{
  "metadata": {
    "title": "A review on fundamentals for designing stable ruthenium-based catalysts for the hydrogen and oxygen evolution reactions",
    "authors": "; ; ",
    "journal": "Chinese Journal of Catalysis",
    "date": "2024-05-31",
    "doi": "10.1016/S1872-2067(24)60013-6",
    "abstract": "",
    "uri": "https://api.elsevier.com/content/article/pii/S1872206724600136",
    "pii": "S1872206724600136"
  },
  "fulltext": {
    "full-text-retrieval-response": {
      "scopus-eid": "2-s2.0-85193567384",
      "originalText": "serial JL 273538 291210 291744 291809 31 Chinese Journal of Catalysis CHINESEJOURNALCATALYSIS 2024-05-22 2024-05-22 2024-05-22 2024-05-22 2024-07-02T15:56:58 1-s2.0-S1872206724600136 S1872-2067(24)60013-6 S1872206724600136 10.1016/S1872-2067(24)60013-6 S300 S300.2 FULL-TEXT 1-s2.0-S1872206724X00066 2024-07-02T15:06:29.817107Z 0 0 20240501 20240531 2024 2024-05-22T16:22:33.517775Z absattachment articleinfo articletitlenorm authfirstinitialnorm authfirstsurnamenorm cid cids contenttype copyright crossmark dateloaded dateloadedtxt datesearch datesort dateupdated dco docsubtype doctype doi eid ewtransactionid hubeid indexeddate issn issnnorm itemstage itemtransactionid itemweight openaccess openarchive pg pgfirst pglast pii piinorm pubdateend pubdatestart pubdatetxt pubyr sortorder srctitle srctitlenorm srctype ssids alllist content subj subheadings suppl tomb volfirst volissue volumelist webpdf webpdfpagecount yearnav figure table body mmlmath affil articletitle auth authfirstini authfull authkeywords authlast grantnumber grantsponsor primabst pubtype ref specialabst vitae 1872-2067 18722067 true 60 60 C Volume 60 4 68 106 68 106 202405 May 2024 2024-05-01 2024-05-31 2024 article rev Copyright © 2024 Dalian Institute of Chemical Physics, Chinese Academy of Sciences. Published by Elsevier B.V. All rights are reserved, including those for text and data mining, AI training, and similar technologies. AREVIEWFUNDAMENTALSFORDESIGNINGSTABLERUTHENIUMBASEDCATALYSTSFORHYDROGENOXYGENEVOLUTIONREACTIONS GOU W 1 Introduction 2 Fundamentals and principles of the stability 2.1 Fundamentals of electrochemical of water-splitting 2.1.1 HER mechanism 2.1.2 OER mechanism 2.1.3 DFT calculations 2.1.4 In-situ characterization methods 2.2 Evaluation methods and criteria of stability 2.2.1 Chronoamperometry/chronopotentiometry 2.2.2 Cyclic voltammetry 2.2.3 Activity-stability factor 2.2.4 Activity-durability factor 2.2.5 Stability number 2.3 Deactivation mechanism 2.3.1 Deactivation mechanism for HER 2.3.2 Deactivation mechanism for OER 3 Recent advances in catalytic stability of Ru-based electrocatalysts for HER 3.1 Incorporation of conductive substrate 3.2 Construction of core-shell structures 3.3 Formation of embedded structures 3.4 Enhancement of the metal-support interaction 3.5 Phase engineering 3.6 Modulations of adsorption and desorption behavior of intermediates 4 Recent advances on catalytic stability of Ru-based electrocatalysts for OER 4.1 Hybridization of Ru-based catalysts with iridium 4.2 Construction of core-shell structures 4.3 Incorporation of stable support 4.4 Chemical doping 4.5 Formation of solid solution 4.6 Alternated reaction pathways 5 Recent advances of Ru-based electrocatalysts for water-splitting 6 Conclusion and perspectives 6.1 Development of the stability testing strategy and evaluation criteria 6.2 Understanding of deactivation mechanism 6.3 Development and application of in-situ technologies 6.4 Utilization of advanced modification strategies 6.5 Highly desired practical application References DRESSELHAUS 2001 332 337 M LI 2023 e202305661 W DUNN 2011 928 935 B CHU 2017 16 22 S CRAPNELL 2023 85 93 R ZHAO 2023 e202314121 P MCCRUM 2020 891 899 I WANG 2023 109 125 Y ZHANG 2023 4629 4645 S MCCRORY 2015 4347 4357 C HUNTER 2016 14120 14136 B SONG 2020 2196 2214 J WANG 2021 2108 2116 C CHEN 2021 566 600 J GENG 2023 334 342 S XIAO 2024 109155 L XIAO 2023 12850 12868 L CHENG 2023 1383 1388 C ZHAO 2023 100159 X ZHOU 2023 2527 2544 Y XIAO 2023 2310195 L HAN 2023 1913 1966 J TANG 2023 215288 T BAI 2022 2057 2090 X ZHAO 2023 1389 1398 S LAN 2023 2210036 C LUO 2023 164 172 H LIN 2022 2200213 S WANG 2023 2301023 A DU 2023 26 33 X ZENG 2023 2300108 H GOU 2022 107960 W WANG 2023 1287 1296 X ZHENG 2016 16174 16181 Y WANG 2020 12575 12581 J YAO 2022 121378 H MAN 2011 1159 1165 I MONTOYA 2016 70 81 J YU 2019 9973 10011 J MATTOSCOSTA 1998 1515 1523 F SU 2018 1801351 J CREUS 2019 2493 2514 J HODNIK 2015 10140 10147 N CHEREVKOA 2016 170 180 S RAMALINGAM 2019 1903841 V YANG 2021 257 264 M YANG 2023 100031 H WU 2023 182 190 L XI 2021 197 204 G WEN 2020 1161 1167 Y ZHANG 2022 2103 2111 J LIU 2021 2000184 H ZHAO 2022 2102665 L LI 2006 A1823 A1828 L ZAGALSKAYA 2020 3650 3657 A KIM 2017 34 J ZHENG 2018 7568 7579 Y ZHAI 2022 e12357 W PARSONS 1958 1053 1063 R NORSKOV 2005 J23 J26 J YANG 2021 160 Y HU 2019 2620 2645 C NORSKOV 2004 17886 17892 J ROSSMEISL 2005 178 184 J ZHANG 2021 4647 4671 N WANG 2022 2107956 X WOHLFAHRTMEHRENS 1987 251 260 M ZHANG 2021 1253 1268 X GRIMAUD 2017 457 465 A MEFFORD 2016 11053 J HUANG 2019 329 338 Z GRIMAUD 2016 121 126 A ZHANG 2020 4066 N ZHAO 2021 e202110186 S HU 2021 1360 1365 S CHEREVKO 2018 118 125 S KIM 2017 1449 Y LI 2019 17775 17781 J GEIGER 2018 508 515 S STERN 2015 2347 2351 L LIU 2020 2001136 X ZHENG 2018 149 154 X DIONIGI 2020 2522 F CHEN 2021 1704 1731 F WANG 2018 2267 2295 S PEREZRODRIGUEZ 2017 156 166 S LI 2023 2212514 G CHEN 2022 120996 S WAN 2019 1160 1169 Q TOBIASREIER 2017 1601275 H DICKENS 2017 18516 18524 C PAOLI 2015 190 196 E LEE 2012 399 404 Y CHU 2023 e202300013 X JIANG 2021 4110 4116 X YOU 2022 121729 M ZHANG 2020 18945 18954 G XU 2020 34728 34735 Y DING 2022 1535 1543 Y YANG 2021 119583 B ZHOU 2023 2206781 G CHI 2018 743 752 J GOU 2019 1970 1976 W FENG 2022 121193 Y CHEN 2022 107445 D ZHANG 2021 32997 33005 S LIU 2020 2001526 X WEI 2022 2675 2684 Y MAHMOOD 2017 441 446 J TU 2020 2005433 K LI 2022 2200029 C YU 2022 137248 J LIU 2022 4817 4824 H KWEON 2020 1278 D CHEN 2021 138 K TIWARI 2019 1900931 J YE 2020 104301 S GAO 2023 49 59 T LI 2023 7597 7605 Y YANG 2020 2003300 J YANG 2022 121796 Y SONG 2019 1802135 H ZHANG 2018 32171 32179 Z YU 2020 119236 J LI 2019 1711 P DAI 2020 1906915 L CHEN 2021 2104764 X LIU 2023 141414 H ZHAO 2019 7028 7036 M ZHANG 2022 87 95 J LI 2022 14885 14894 L KIM 2021 2105248 J ZHU 2020 851 918 J STRMCNIK 2016 29 36 D WANG 2020 23740 23747 K CHEN 2021 106211 L DANG 2021 5433 5443 Y ZHANG 2022 e202209486 J ZHOU 2022 e202212196 S WANG 2023 2300980 K LI 2023 2301369 C WANG 2023 2300148 X TANG 2023 2301925 R LI 2021 12196 Y PANG 2022 102 108 B SONG 2021 7234 7244 H SU 2022 2109731 H SHAN 2019 445 459 J HE 2021 2102883 J WU 2021 1145 D CUI 2020 1908126 X YAN 2023 2300152 H WANG 2020 15746 15751 K HARZANDI 2021 2003448 A YU 2020 104667 H CAO 2019 4849 L XU 2021 3402 3413 J WANG 2022 9437 9445 X YUAN 2023 2462 2471 C DUAN 2022 136962 X HU 2021 2002816 Y YAO 2023 1882 1896 N HOU 2023 2300177 L XUE 2021 2101405 Y LI 2021 2105308 L AN 2022 2200131 L WU 2023 100 108 Z JIN 2023 354 H LIU 2023 558 573 H LI 2023 2213304 L FENG 2019 494 501 Q ZHANG 2021 8537 8548 N YAN 2022 9419 9426 J HAN 2023 2208399 N PING 2022 121884 X LIU 2022 2202513 H GALYAMIN 2023 2010 D RETUERTO 2019 2041 M MIAO 2019 3809 X LIU 2022 2202439 W LIN 2019 162 Y CHEN 2022 2200636 H HAO 2020 5368 S WEN 2021 6482 6490 Y JIN 2022 1119 1130 H WEN 2022 4871 Y SHI 2023 843 Z LIN 2021 1012 1023 C KWON 2021 14352 14362 T ZHAO 2022 20964 20974 Y ZHANG 2021 18821 18829 L GOUX2024X68 GOUX2024X68X106 GOUX2024X68XW GOUX2024X68X106XW 2026-05-22T00:00:00.000Z 2026-05-22T00:00:00.000Z http://creativecommons.org/licenses/by-nc-nd/4.0/ 2024-05-24T00:39:50.178Z http://vtw.elsevier.com/data/voc/AddOnTypes/50.7/aggregated-refined China Postdoctoral Science Foundation 2022M722585 China Postdoctoral Science Foundation http://data.elsevier.com/vocabulary/SciValFunders/501100002858 http://sws.geonames.org/1814991/ Basic and Applied Basic Research Foundation of Guangdong Province 2023A1515012288 Basic and Applied Basic Research Foundation of Guangdong Province http://data.elsevier.com/vocabulary/SciValFunders/501100021171 http://sws.geonames.org/1814991/ Fundamental Research Funds for the Central Universities D5000210601 D5000210829 Fundamental Research Funds for the Central Universities http://data.elsevier.com/vocabulary/SciValFunders/501100012226 http://sws.geonames.org/1814991/ Natural Science Foundation of Shaanxi province 2022JQ-433 Natural Science Foundation of Shaanxi Province http://data.elsevier.com/vocabulary/SciValFunders/501100007128 http://sws.geonames.org/1814991/ This work was supported by the Basic and Applied Basic Research Foundation of Guangdong Province (2023A1515012288), the Natural Science Foundation of Shaanxi province, China (2022JQ-433), the China Postdoctoral Science Foundation (2022M722585) and the Fundamental Research Funds for the Central Universities (D5000210829, D5000210601). item S1872-2067(24)60013-6 S1872206724600136 1-s2.0-S1872206724600136 10.1016/S1872-2067(24)60013-6 273538 2024-07-02T15:06:29.817107Z 2024-05-01 2024-05-31 1-s2.0-S1872206724600136-main.pdf https://s3-eu-west-1.amazonaws.com/prod-ucs-content-store-eu-west/content/pii:S1872206724600136/MAIN/application/pdf/3b45515629416b09ee9e24d47ae619ee/main.pdf main.pdf pdf true 38250886 MAIN 39 1-s2.0-S1872206724600136-main_1.png https://s3-eu-west-1.amazonaws.com/prod-ucs-content-store-eu-west/content/pii:S1872206724600136/PREVIEW/image/png/a0ef1136b499fa2da702740dcd43ec1f/main_1.png main_1.png png 51562 849 656 IMAGE-WEB-PDF 1 1-s2.0-S1872206724600136-fx1.jpg https://s3-eu-west-1.amazonaws.com/prod-ucs-content-store-eu-west/content/pii:S1872206724600136/fx1/DOWNSAMPLED/image/jpeg/175c654dd0c813ca8b05dd01bd8fa579/fx1.jpg fx1 true fx1.jpg jpg 19374 151 301 IMAGE-DOWNSAMPLED 1-s2.0-S1872206724600136-fx2.jpg https://s3-eu-west-1.amazonaws.com/prod-ucs-content-store-eu-west/content/pii:S1872206724600136/fx2/DOWNSAMPLED/image/jpeg/b7baa804f23deceb3590ae301997caca/fx2.jpg fx2 fx2.jpg jpg 10690 194 155 IMAGE-DOWNSAMPLED 1-s2.0-S1872206724600136-fx3.jpg https://s3-eu-west-1.amazonaws.com/prod-ucs-content-store-eu-west/content/pii:S1872206724600136/fx3/DOWNSAMPLED/image/jpeg/de4fce31ded52a3460b6634f2e940124/fx3.jpg fx3 fx3.jpg jpg 12291 194 155 IMAGE-DOWNSAMPLED 1-s2.0-S1872206724600136-gr1.jpg https://s3-eu-west-1.amazonaws.com/prod-ucs-content-store-eu-west/content/pii:S1872206724600136/gr1/DOWNSAMPLED/image/jpeg/9eeaf3b374ab30287d729ac2cdabd4c9/gr1.jpg gr1 gr1.jpg jpg 42497 276 564 IMAGE-DOWNSAMPLED 1-s2.0-S1872206724600136-gr10.jpg https://s3-eu-west-1.amazonaws.com/prod-ucs-content-store-eu-west/content/pii:S1872206724600136/gr10/DOWNSAMPLED/image/jpeg/5f3df89b75295333042785d3dec4c4f8/gr10.jpg gr10 gr10.jpg jpg 112469 553 551 IMAGE-DOWNSAMPLED 1-s2.0-S1872206724600136-gr11.jpg https://s3-eu-west-1.amazonaws.com/prod-ucs-content-store-eu-west/content/pii:S1872206724600136/gr11/DOWNSAMPLED/image/jpeg/51de1672c90d43b1ef8de82d2987ff76/gr11.jpg gr11 gr11.jpg jpg 107979 612 513 IMAGE-DOWNSAMPLED 1-s2.0-S1872206724600136-gr12.jpg https://s3-eu-west-1.amazonaws.com/prod-ucs-content-store-eu-west/content/pii:S1872206724600136/gr12/DOWNSAMPLED/image/jpeg/e96e88edc8ebcfc5919a5b8c3a76aad5/gr12.jpg gr12 gr12.jpg jpg 104171 465 619 IMAGE-DOWNSAMPLED 1-s2.0-S1872206724600136-gr13.jpg https://s3-eu-west-1.amazonaws.com/prod-ucs-content-store-eu-west/content/pii:S1872206724600136/gr13/DOWNSAMPLED/image/jpeg/afac003b554ac6ede9de215f8a98fff2/gr13.jpg gr13 gr13.jpg jpg 107699 474 606 IMAGE-DOWNSAMPLED 1-s2.0-S1872206724600136-gr14.jpg https://s3-eu-west-1.amazonaws.com/prod-ucs-content-store-eu-west/content/pii:S1872206724600136/gr14/DOWNSAMPLED/image/jpeg/242bc68fc0b82c1bacb8ff1ba4479230/gr14.jpg gr14 gr14.jpg jpg 104669 598 442 IMAGE-DOWNSAMPLED 1-s2.0-S1872206724600136-gr15.jpg https://s3-eu-west-1.amazonaws.com/prod-ucs-content-store-eu-west/content/pii:S1872206724600136/gr15/DOWNSAMPLED/image/jpeg/1e948d484807f39583a3390abce9f85b/gr15.jpg gr15 gr15.jpg jpg 20159 132 369 IMAGE-DOWNSAMPLED 1-s2.0-S1872206724600136-gr16.jpg https://s3-eu-west-1.amazonaws.com/prod-ucs-content-store-eu-west/content/pii:S1872206724600136/gr16/DOWNSAMPLED/image/jpeg/6a11c1d25284e93eaf51caddf733e2e5/gr16.jpg gr16 gr16.jpg jpg 131875 538 646 IMAGE-DOWNSAMPLED 1-s2.0-S1872206724600136-gr17.jpg https://s3-eu-west-1.amazonaws.com/prod-ucs-content-store-eu-west/content/pii:S1872206724600136/gr17/DOWNSAMPLED/image/jpeg/e790a43d4e6dba0453e90b781fde1b5f/gr17.jpg gr17 gr17.jpg jpg 135973 539 618 IMAGE-DOWNSAMPLED 1-s2.0-S1872206724600136-gr18.jpg https://s3-eu-west-1.amazonaws.com/prod-ucs-content-store-eu-west/content/pii:S1872206724600136/gr18/DOWNSAMPLED/image/jpeg/71ed2df8b2d40cc5553c1e1e339d3311/gr18.jpg gr18 gr18.jpg jpg 123012 707 571 IMAGE-DOWNSAMPLED 1-s2.0-S1872206724600136-gr19.jpg https://s3-eu-west-1.amazonaws.com/prod-ucs-content-store-eu-west/content/pii:S1872206724600136/gr19/DOWNSAMPLED/image/jpeg/a5b18b0e3ec8713edd750466808f5dc5/gr19.jpg gr19 gr19.jpg jpg 101604 457 658 IMAGE-DOWNSAMPLED 1-s2.0-S1872206724600136-gr2.jpg https://s3-eu-west-1.amazonaws.com/prod-ucs-content-store-eu-west/content/pii:S1872206724600136/gr2/MAIN/image/jpeg/5107701f796144ad6a79a3697436ce74/gr2.jpg gr2 gr2.jpg jpg 94699 364 705 IMAGE-DOWNSAMPLED 1-s2.0-S1872206724600136-gr20.jpg https://s3-eu-west-1.amazonaws.com/prod-ucs-content-store-eu-west/content/pii:S1872206724600136/gr20/DOWNSAMPLED/image/jpeg/1b33155b1a2d2c646afc185b7c5e4432/gr20.jpg gr20 gr20.jpg jpg 93814 453 756 IMAGE-DOWNSAMPLED 1-s2.0-S1872206724600136-gr21.jpg https://s3-eu-west-1.amazonaws.com/prod-ucs-content-store-eu-west/content/pii:S1872206724600136/gr21/DOWNSAMPLED/image/jpeg/b7adbdfabd0281f85fcb8e5b21e8a634/gr21.jpg gr21 gr21.jpg jpg 74196 479 613 IMAGE-DOWNSAMPLED 1-s2.0-S1872206724600136-gr22.jpg https://s3-eu-west-1.amazonaws.com/prod-ucs-content-store-eu-west/content/pii:S1872206724600136/gr22/DOWNSAMPLED/image/jpeg/c340607ea98abf1b32bc3b2faee064bb/gr22.jpg gr22 gr22.jpg jpg 106346 591 618 IMAGE-DOWNSAMPLED 1-s2.0-S1872206724600136-gr23.jpg https://s3-eu-west-1.amazonaws.com/prod-ucs-content-store-eu-west/content/pii:S1872206724600136/gr23/DOWNSAMPLED/image/jpeg/34f040119a46095d551a0e7f5b0aebdb/gr23.jpg gr23 gr23.jpg jpg 104177 470 619 IMAGE-DOWNSAMPLED 1-s2.0-S1872206724600136-gr24.jpg https://s3-eu-west-1.amazonaws.com/prod-ucs-content-store-eu-west/content/pii:S1872206724600136/gr24/DOWNSAMPLED/image/jpeg/929da3cbf118fb43db366c6c9ed04cc3/gr24.jpg gr24 gr24.jpg jpg 109149 436 664 IMAGE-DOWNSAMPLED 1-s2.0-S1872206724600136-gr25.jpg https://s3-eu-west-1.amazonaws.com/prod-ucs-content-store-eu-west/content/pii:S1872206724600136/gr25/DOWNSAMPLED/image/jpeg/6fcf458a7b3a3e291c60f42986b971f6/gr25.jpg gr25 gr25.jpg jpg 81111 464 552 IMAGE-DOWNSAMPLED 1-s2.0-S1872206724600136-gr26.jpg https://s3-eu-west-1.amazonaws.com/prod-ucs-content-store-eu-west/content/pii:S1872206724600136/gr26/DOWNSAMPLED/image/jpeg/3e9a5501a3ce1210cf14ae830cb85a1f/gr26.jpg gr26 gr26.jpg jpg 98212 473 583 IMAGE-DOWNSAMPLED 1-s2.0-S1872206724600136-gr27.jpg https://s3-eu-west-1.amazonaws.com/prod-ucs-content-store-eu-west/content/pii:S1872206724600136/gr27/DOWNSAMPLED/image/jpeg/a39819405f462df560ba7af5df0f3813/gr27.jpg gr27 gr27.jpg jpg 31806 158 487 IMAGE-DOWNSAMPLED 1-s2.0-S1872206724600136-gr28.jpg https://s3-eu-west-1.amazonaws.com/prod-ucs-content-store-eu-west/content/pii:S1872206724600136/gr28/DOWNSAMPLED/image/jpeg/7d1e6c618709d0ccf319ee79777fc7b8/gr28.jpg gr28 gr28.jpg jpg 86504 455 674 IMAGE-DOWNSAMPLED 1-s2.0-S1872206724600136-gr29.jpg https://s3-eu-west-1.amazonaws.com/prod-ucs-content-store-eu-west/content/pii:S1872206724600136/gr29/DOWNSAMPLED/image/jpeg/952acef47d7204c0299977a916c38cd3/gr29.jpg gr29 gr29.jpg jpg 35316 287 319 IMAGE-DOWNSAMPLED 1-s2.0-S1872206724600136-gr3.jpg https://s3-eu-west-1.amazonaws.com/prod-ucs-content-store-eu-west/content/pii:S1872206724600136/gr3/DOWNSAMPLED/image/jpeg/1b8ef5cc7c63d81954e418c4c124748c/gr3.jpg gr3 gr3.jpg jpg 58113 268 610 IMAGE-DOWNSAMPLED 1-s2.0-S1872206724600136-gr30.jpg https://s3-eu-west-1.amazonaws.com/prod-ucs-content-store-eu-west/content/pii:S1872206724600136/gr30/DOWNSAMPLED/image/jpeg/884f414a6fbfe3bbe94c526d3ea4de87/gr30.jpg gr30 gr30.jpg jpg 19134 254 334 IMAGE-DOWNSAMPLED 1-s2.0-S1872206724600136-gr4.jpg https://s3-eu-west-1.amazonaws.com/prod-ucs-content-store-eu-west/content/pii:S1872206724600136/gr4/DOWNSAMPLED/image/jpeg/c32f8ec7bc72a3dde79ec6330f7886e6/gr4.jpg gr4 gr4.jpg jpg 39098 310 369 IMAGE-DOWNSAMPLED 1-s2.0-S1872206724600136-gr5.jpg https://s3-eu-west-1.amazonaws.com/prod-ucs-content-store-eu-west/content/pii:S1872206724600136/gr5/DOWNSAMPLED/image/jpeg/41406f4667f5cae630dc33fa97ff4f0a/gr5.jpg gr5 gr5.jpg jpg 25187 199 361 IMAGE-DOWNSAMPLED 1-s2.0-S1872206724600136-gr6.jpg https://s3-eu-west-1.amazonaws.com/prod-ucs-content-store-eu-west/content/pii:S1872206724600136/gr6/DOWNSAMPLED/image/jpeg/eb03e9b6ba122f029336959be7e727ad/gr6.jpg gr6 gr6.jpg jpg 76680 442 540 IMAGE-DOWNSAMPLED 1-s2.0-S1872206724600136-gr7.jpg https://s3-eu-west-1.amazonaws.com/prod-ucs-content-store-eu-west/content/pii:S1872206724600136/gr7/DOWNSAMPLED/image/jpeg/455ba2b5ded2ccc135d7a8e7a26803ad/gr7.jpg gr7 gr7.jpg jpg 70673 412 605 IMAGE-DOWNSAMPLED 1-s2.0-S1872206724600136-gr8.jpg https://s3-eu-west-1.amazonaws.com/prod-ucs-content-store-eu-west/content/pii:S1872206724600136/gr8/DOWNSAMPLED/image/jpeg/dfe807b634df4f7a7b031ebc9a11dff8/gr8.jpg gr8 gr8.jpg jpg 105401 409 619 IMAGE-DOWNSAMPLED 1-s2.0-S1872206724600136-gr9.jpg https://s3-eu-west-1.amazonaws.com/prod-ucs-content-store-eu-west/content/pii:S1872206724600136/gr9/DOWNSAMPLED/image/jpeg/2ec85475d03f257ebba0e400963f776e/gr9.jpg gr9 gr9.jpg jpg 118388 501 664 IMAGE-DOWNSAMPLED 1-s2.0-S1872206724600136-fx1.sml https://s3-eu-west-1.amazonaws.com/prod-ucs-content-store-eu-west/content/pii:S1872206724600136/fx1/THUMBNAIL/image/gif/76439eb715e43c61542c4e3e9aeb9542/fx1.sml fx1 true fx1.sml sml 11068 110 219 IMAGE-THUMBNAIL 1-s2.0-S1872206724600136-fx2.sml https://s3-eu-west-1.amazonaws.com/prod-ucs-content-store-eu-west/content/pii:S1872206724600136/fx2/THUMBNAIL/image/gif/ffb04e6b1304432ec68940533bff9560/fx2.sml fx2 fx2.sml sml 13405 164 131 IMAGE-THUMBNAIL 1-s2.0-S1872206724600136-fx3.sml https://s3-eu-west-1.amazonaws.com/prod-ucs-content-store-eu-west/content/pii:S1872206724600136/fx3/THUMBNAIL/image/gif/8b5abda3700fc41415eda5c43a1cac63/fx3.sml fx3 fx3.sml sml 14015 164 131 IMAGE-THUMBNAIL 1-s2.0-S1872206724600136-gr1.sml https://s3-eu-west-1.amazonaws.com/prod-ucs-content-store-eu-west/content/pii:S1872206724600136/gr1/THUMBNAIL/image/gif/bd8b3bf359ac21f525737be4fbfb5407/gr1.sml gr1 gr1.sml sml 10664 107 219 IMAGE-THUMBNAIL 1-s2.0-S1872206724600136-gr10.sml https://s3-eu-west-1.amazonaws.com/prod-ucs-content-store-eu-west/content/pii:S1872206724600136/gr10/THUMBNAIL/image/gif/5174fa0c9a239d97b454401e415fe514/gr10.sml gr10 gr10.sml sml 13787 163 163 IMAGE-THUMBNAIL 1-s2.0-S1872206724600136-gr11.sml https://s3-eu-west-1.amazonaws.com/prod-ucs-content-store-eu-west/content/pii:S1872206724600136/gr11/THUMBNAIL/image/gif/27281b7ea454a7c6246275d442171b07/gr11.sml gr11 gr11.sml sml 11197 163 137 IMAGE-THUMBNAIL 1-s2.0-S1872206724600136-gr12.sml https://s3-eu-west-1.amazonaws.com/prod-ucs-content-store-eu-west/content/pii:S1872206724600136/gr12/THUMBNAIL/image/gif/d302c8ad92f9b6acbcf4df2d2f6597db/gr12.sml gr12 gr12.sml sml 17967 164 218 IMAGE-THUMBNAIL 1-s2.0-S1872206724600136-gr13.sml https://s3-eu-west-1.amazonaws.com/prod-ucs-content-store-eu-west/content/pii:S1872206724600136/gr13/THUMBNAIL/image/gif/a1c4019a337bdad2ae185e07ee0da683/gr13.sml gr13 gr13.sml sml 17104 164 210 IMAGE-THUMBNAIL 1-s2.0-S1872206724600136-gr14.sml https://s3-eu-west-1.amazonaws.com/prod-ucs-content-store-eu-west/content/pii:S1872206724600136/gr14/THUMBNAIL/image/gif/e555d602e8e259435a7dfd104b7304b2/gr14.sml gr14 gr14.sml sml 12487 164 121 IMAGE-THUMBNAIL 1-s2.0-S1872206724600136-gr15.sml https://s3-eu-west-1.amazonaws.com/prod-ucs-content-store-eu-west/content/pii:S1872206724600136/gr15/THUMBNAIL/image/gif/d06546a4dec6fc11d5b915094ba6eae7/gr15.sml gr15 gr15.sml sml 5816 78 219 IMAGE-THUMBNAIL 1-s2.0-S1872206724600136-gr16.sml https://s3-eu-west-1.amazonaws.com/prod-ucs-content-store-eu-west/content/pii:S1872206724600136/gr16/THUMBNAIL/image/gif/a6241966fe24ad06b756674d71f4aa49/gr16.sml gr16 gr16.sml sml 16847 164 197 IMAGE-THUMBNAIL 1-s2.0-S1872206724600136-gr17.sml https://s3-eu-west-1.amazonaws.com/prod-ucs-content-store-eu-west/content/pii:S1872206724600136/gr17/THUMBNAIL/image/gif/f3b0b274cf73ead505d5d69d69a2b94e/gr17.sml gr17 gr17.sml sml 15373 164 188 IMAGE-THUMBNAIL 1-s2.0-S1872206724600136-gr18.sml https://s3-eu-west-1.amazonaws.com/prod-ucs-content-store-eu-west/content/pii:S1872206724600136/gr18/THUMBNAIL/image/gif/b7c3e2617fd183e9e7019fe6f7e9c0aa/gr18.sml gr18 gr18.sml sml 10943 164 132 IMAGE-THUMBNAIL 1-s2.0-S1872206724600136-gr19.sml https://s3-eu-west-1.amazonaws.com/prod-ucs-content-store-eu-west/content/pii:S1872206724600136/gr19/THUMBNAIL/image/gif/466f6c39086c29d6a95b9c5ba0b04490/gr19.sml gr19 gr19.sml sml 15995 152 219 IMAGE-THUMBNAIL 1-s2.0-S1872206724600136-gr2.sml https://s3-eu-west-1.amazonaws.com/prod-ucs-content-store-eu-west/content/pii:S1872206724600136/gr2/THUMBNAIL/image/gif/84ed54d67e83ef846c3c6f67281b08cb/gr2.sml gr2 gr2.sml sml 11489 113 219 IMAGE-THUMBNAIL 1-s2.0-S1872206724600136-gr20.sml https://s3-eu-west-1.amazonaws.com/prod-ucs-content-store-eu-west/content/pii:S1872206724600136/gr20/THUMBNAIL/image/gif/62568bff5b31500829945f19759295e2/gr20.sml gr20 gr20.sml sml 12714 131 219 IMAGE-THUMBNAIL 1-s2.0-S1872206724600136-gr21.sml https://s3-eu-west-1.amazonaws.com/prod-ucs-content-store-eu-west/content/pii:S1872206724600136/gr21/THUMBNAIL/image/gif/2c34ef53038dc46686b03b25de68f5e8/gr21.sml gr21 gr21.sml sml 10488 163 209 IMAGE-THUMBNAIL 1-s2.0-S1872206724600136-gr22.sml https://s3-eu-west-1.amazonaws.com/prod-ucs-content-store-eu-west/content/pii:S1872206724600136/gr22/THUMBNAIL/image/gif/d0ae8f17d4effcc9c161d035c24f5f72/gr22.sml gr22 gr22.sml sml 11368 164 171 IMAGE-THUMBNAIL 1-s2.0-S1872206724600136-gr23.sml https://s3-eu-west-1.amazonaws.com/prod-ucs-content-store-eu-west/content/pii:S1872206724600136/gr23/DOWNSAMPLED/image/gif/f7b00dbf7b993ffb139890c536e0bfa4/gr23.sml gr23 gr23.sml sml 14806 164 216 IMAGE-THUMBNAIL 1-s2.0-S1872206724600136-gr24.sml https://s3-eu-west-1.amazonaws.com/prod-ucs-content-store-eu-west/content/pii:S1872206724600136/gr24/THUMBNAIL/image/gif/c6bcc81812145e07dd4a30bae3be3841/gr24.sml gr24 gr24.sml sml 14968 144 219 IMAGE-THUMBNAIL 1-s2.0-S1872206724600136-gr25.sml https://s3-eu-west-1.amazonaws.com/prod-ucs-content-store-eu-west/content/pii:S1872206724600136/gr25/THUMBNAIL/image/gif/351bd4e5f991e3d4873fa04db9fd0d6b/gr25.sml gr25 gr25.sml sml 11639 164 195 IMAGE-THUMBNAIL 1-s2.0-S1872206724600136-gr26.sml https://s3-eu-west-1.amazonaws.com/prod-ucs-content-store-eu-west/content/pii:S1872206724600136/gr26/THUMBNAIL/image/gif/91cd60553f4fe942768abab9d9d0857d/gr26.sml gr26 gr26.sml sml 13906 164 202 IMAGE-THUMBNAIL 1-s2.0-S1872206724600136-gr27.sml https://s3-eu-west-1.amazonaws.com/prod-ucs-content-store-eu-west/content/pii:S1872206724600136/gr27/THUMBNAIL/image/gif/c876cf90fce5e1903a115f5cfea5c6e2/gr27.sml gr27 gr27.sml sml 4547 71 219 IMAGE-THUMBNAIL 1-s2.0-S1872206724600136-gr28.sml https://s3-eu-west-1.amazonaws.com/prod-ucs-content-store-eu-west/content/pii:S1872206724600136/gr28/THUMBNAIL/image/gif/9d229f0393c18a04deeef3f5ea99936a/gr28.sml gr28 gr28.sml sml 12941 148 219 IMAGE-THUMBNAIL 1-s2.0-S1872206724600136-gr29.sml https://s3-eu-west-1.amazonaws.com/prod-ucs-content-store-eu-west/content/pii:S1872206724600136/gr29/THUMBNAIL/image/gif/0595447f5e6cfcfdca65828d8d0cfe2b/gr29.sml gr29 gr29.sml sml 11993 164 182 IMAGE-THUMBNAIL 1-s2.0-S1872206724600136-gr3.sml https://s3-eu-west-1.amazonaws.com/prod-ucs-content-store-eu-west/content/pii:S1872206724600136/gr3/THUMBNAIL/image/gif/f0906fbd0a333a93fefaedf94e59214d/gr3.sml gr3 gr3.sml sml 8117 96 219 IMAGE-THUMBNAIL 1-s2.0-S1872206724600136-gr30.sml https://s3-eu-west-1.amazonaws.com/prod-ucs-content-store-eu-west/content/pii:S1872206724600136/gr30/THUMBNAIL/image/gif/5cf02d6aa665c9f08c888c33256b3847/gr30.sml gr30 gr30.sml sml 8054 164 215 IMAGE-THUMBNAIL 1-s2.0-S1872206724600136-gr4.sml https://s3-eu-west-1.amazonaws.com/prod-ucs-content-store-eu-west/content/pii:S1872206724600136/gr4/THUMBNAIL/image/gif/91225da883aa3d41959084cd918be0f6/gr4.sml gr4 gr4.sml sml 15444 164 195 IMAGE-THUMBNAIL 1-s2.0-S1872206724600136-gr5.sml https://s3-eu-west-1.amazonaws.com/prod-ucs-content-store-eu-west/content/pii:S1872206724600136/gr5/THUMBNAIL/image/gif/0c3fbcb7921807f9123e6e418e511a0a/gr5.sml gr5 gr5.sml sml 12196 121 219 IMAGE-THUMBNAIL 1-s2.0-S1872206724600136-gr6.sml https://s3-eu-west-1.amazonaws.com/prod-ucs-content-store-eu-west/content/pii:S1872206724600136/gr6/THUMBNAIL/image/gif/00c45d19ace06f0770f2a447fcd0f55f/gr6.sml gr6 gr6.sml sml 14823 164 200 IMAGE-THUMBNAIL 1-s2.0-S1872206724600136-gr7.sml https://s3-eu-west-1.amazonaws.com/prod-ucs-content-store-eu-west/content/pii:S1872206724600136/gr7/THUMBNAIL/image/gif/136ede7fa1b3f636fd1a60708f7459b1/gr7.sml gr7 gr7.sml sml 13534 149 219 IMAGE-THUMBNAIL 1-s2.0-S1872206724600136-gr8.sml https://s3-eu-west-1.amazonaws.com/prod-ucs-content-store-eu-west/content/pii:S1872206724600136/gr8/THUMBNAIL/image/gif/59cc3df0252a6412df73edb707e04fe8/gr8.sml gr8 gr8.sml sml 18741 145 219 IMAGE-THUMBNAIL 1-s2.0-S1872206724600136-gr9.sml https://s3-eu-west-1.amazonaws.com/prod-ucs-content-store-eu-west/content/pii:S1872206724600136/gr9/THUMBNAIL/image/gif/99ebe48ee0357a120db12530b5899a83/gr9.sml gr9 gr9.sml sml 17255 164 217 IMAGE-THUMBNAIL 1-s2.0-S1872206724600136-fx1_lrg.jpg https://s3-eu-west-1.amazonaws.com/prod-ucs-content-store-eu-west/content/pii:S1872206724600136/HIGHRES/image/jpeg/3449f16f957059820749fe295fa14458/fx1_lrg.jpg fx1 true fx1_lrg.jpg jpg 74268 400 800 IMAGE-HIGH-RES 1-s2.0-S1872206724600136-fx2_lrg.jpg https://s3-eu-west-1.amazonaws.com/prod-ucs-content-store-eu-west/content/pii:S1872206724600136/HIGHRES/image/jpeg/ff957ad88cea487cf4b5bf4a77e3c88d/fx2_lrg.jpg fx2 fx2_lrg.jpg jpg 48422 517 413 IMAGE-HIGH-RES 1-s2.0-S1872206724600136-fx3_lrg.jpg https://s3-eu-west-1.amazonaws.com/prod-ucs-content-store-eu-west/content/pii:S1872206724600136/HIGHRES/image/jpeg/2778a4b26b4240fe10217c0ae37d937b/fx3_lrg.jpg fx3 fx3_lrg.jpg jpg 58437 516 413 IMAGE-HIGH-RES 1-s2.0-S1872206724600136-gr1_lrg.jpg https://s3-eu-west-1.amazonaws.com/prod-ucs-content-store-eu-west/content/pii:S1872206724600136/HIGHRES/image/jpeg/1b2084da2c569d1b5aafb3b38a98c54b/gr1_lrg.jpg gr1 gr1_lrg.jpg jpg 192724 733 1498 IMAGE-HIGH-RES 1-s2.0-S1872206724600136-gr10_lrg.jpg https://s3-eu-west-1.amazonaws.com/prod-ucs-content-store-eu-west/content/pii:S1872206724600136/HIGHRES/image/jpeg/eaa4e04f0c5c21bbb547b929d8f2f053/gr10_lrg.jpg gr10 gr10_lrg.jpg jpg 469061 1469 1465 IMAGE-HIGH-RES 1-s2.0-S1872206724600136-gr11_lrg.jpg https://s3-eu-west-1.amazonaws.com/prod-ucs-content-store-eu-west/content/pii:S1872206724600136/THUMBNAIL/image/jpeg/e7ce053c0614ba57076d99389dccff22/gr11_lrg.jpg gr11 gr11_lrg.jpg jpg 432430 1624 1362 IMAGE-HIGH-RES 1-s2.0-S1872206724600136-gr12_lrg.jpg https://s3-eu-west-1.amazonaws.com/prod-ucs-content-store-eu-west/content/pii:S1872206724600136/HIGHRES/image/jpeg/e12966d044f3d97cdd85cdb170deff39/gr12_lrg.jpg gr12 gr12_lrg.jpg jpg 416235 1235 1645 IMAGE-HIGH-RES 1-s2.0-S1872206724600136-gr13_lrg.jpg https://s3-eu-west-1.amazonaws.com/prod-ucs-content-store-eu-west/content/pii:S1872206724600136/HIGHRES/image/jpeg/47ae9a3dac2fd7516ff02470ac621b85/gr13_lrg.jpg gr13 gr13_lrg.jpg jpg 415839 1258 1609 IMAGE-HIGH-RES 1-s2.0-S1872206724600136-gr14_lrg.jpg https://s3-eu-west-1.amazonaws.com/prod-ucs-content-store-eu-west/content/pii:S1872206724600136/HIGHRES/image/jpeg/e90088209092a5653c8c8ebdf2869c39/gr14_lrg.jpg gr14 gr14_lrg.jpg jpg 423409 1589 1174 IMAGE-HIGH-RES 1-s2.0-S1872206724600136-gr15_lrg.jpg https://s3-eu-west-1.amazonaws.com/prod-ucs-content-store-eu-west/content/pii:S1872206724600136/HIGHRES/image/jpeg/77f7aeebbe26c1d8d4e38e09ab82526a/gr15_lrg.jpg gr15 gr15_lrg.jpg jpg 106174 351 980 IMAGE-HIGH-RES 1-s2.0-S1872206724600136-gr16_lrg.jpg https://s3-eu-west-1.amazonaws.com/prod-ucs-content-store-eu-west/content/pii:S1872206724600136/HIGHRES/image/jpeg/8cfa7d54d52480ae8bdb56a3addecc01/gr16_lrg.jpg gr16 gr16_lrg.jpg jpg 519731 1430 1716 IMAGE-HIGH-RES 1-s2.0-S1872206724600136-gr17_lrg.jpg https://s3-eu-west-1.amazonaws.com/prod-ucs-content-store-eu-west/content/pii:S1872206724600136/HIGHRES/image/jpeg/ae4188836b6f980b699b02da10fe8da7/gr17_lrg.jpg gr17 gr17_lrg.jpg jpg 544277 1434 1643 IMAGE-HIGH-RES 1-s2.0-S1872206724600136-gr18_lrg.jpg https://s3-eu-west-1.amazonaws.com/prod-ucs-content-store-eu-west/content/pii:S1872206724600136/DOWNSAMPLED/image/jpeg/3624de02ec6b338c544a70852425f28c/gr18_lrg.jpg gr18 gr18_lrg.jpg jpg 503392 1878 1516 IMAGE-HIGH-RES 1-s2.0-S1872206724600136-gr19_lrg.jpg https://s3-eu-west-1.amazonaws.com/prod-ucs-content-store-eu-west/content/pii:S1872206724600136/HIGHRES/image/jpeg/52a1f0035ef049636b117f4440f81449/gr19_lrg.jpg gr19 gr19_lrg.jpg jpg 395331 1214 1747 IMAGE-HIGH-RES 1-s2.0-S1872206724600136-gr2_lrg.jpg https://s3-eu-west-1.amazonaws.com/prod-ucs-content-store-eu-west/content/pii:S1872206724600136/HIGHRES/image/jpeg/9571317bdf4b2c61ea57b58505c5406e/gr2_lrg.jpg gr2 gr2_lrg.jpg jpg 418578 967 1874 IMAGE-HIGH-RES 1-s2.0-S1872206724600136-gr20_lrg.jpg https://s3-eu-west-1.amazonaws.com/prod-ucs-content-store-eu-west/content/pii:S1872206724600136/HIGHRES/image/jpeg/b739300c1e5906ab920769de962894ca/gr20_lrg.jpg gr20 gr20_lrg.jpg jpg 371965 1202 2008 IMAGE-HIGH-RES 1-s2.0-S1872206724600136-gr21_lrg.jpg https://s3-eu-west-1.amazonaws.com/prod-ucs-content-store-eu-west/content/pii:S1872206724600136/HIGHRES/image/jpeg/cc2749f0d69295c4180f57a02ef47caf/gr21_lrg.jpg gr21 gr21_lrg.jpg jpg 300949 1275 1630 IMAGE-HIGH-RES 1-s2.0-S1872206724600136-gr22_lrg.jpg https://s3-eu-west-1.amazonaws.com/prod-ucs-content-store-eu-west/content/pii:S1872206724600136/HIGHRES/image/jpeg/f6945451969b754444e5e15ca05ecf93/gr22_lrg.jpg gr22 gr22_lrg.jpg jpg 426201 1571 1643 IMAGE-HIGH-RES 1-s2.0-S1872206724600136-gr23_lrg.jpg https://s3-eu-west-1.amazonaws.com/prod-ucs-content-store-eu-west/content/pii:S1872206724600136/HIGHRES/image/jpeg/d1bf289b0f5aacdff26da50abb1f0e4d/gr23_lrg.jpg gr23 gr23_lrg.jpg jpg 399401 1250 1646 IMAGE-HIGH-RES 1-s2.0-S1872206724600136-gr24_lrg.jpg https://s3-eu-west-1.amazonaws.com/prod-ucs-content-store-eu-west/content/pii:S1872206724600136/HIGHRES/image/jpeg/47cd2179cf41723a8f276c7be1fe57ba/gr24_lrg.jpg gr24 gr24_lrg.jpg jpg 445416 1159 1764 IMAGE-HIGH-RES 1-s2.0-S1872206724600136-gr25_lrg.jpg https://s3-eu-west-1.amazonaws.com/prod-ucs-content-store-eu-west/content/pii:S1872206724600136/DOWNSAMPLED/image/jpeg/d69c963111938ec16c13e4660a5f1313/gr25_lrg.jpg gr25 gr25_lrg.jpg jpg 307699 1234 1467 IMAGE-HIGH-RES 1-s2.0-S1872206724600136-gr26_lrg.jpg https://s3-eu-west-1.amazonaws.com/prod-ucs-content-store-eu-west/content/pii:S1872206724600136/HIGHRES/image/jpeg/b5d35ab6073454439a42b463e1631ba6/gr26_lrg.jpg gr26 gr26_lrg.jpg jpg 376297 1258 1549 IMAGE-HIGH-RES 1-s2.0-S1872206724600136-gr27_lrg.jpg https://s3-eu-west-1.amazonaws.com/prod-ucs-content-store-eu-west/content/pii:S1872206724600136/HIGHRES/image/jpeg/35ee0b87cc8d4df7b45225b148a69c1b/gr27_lrg.jpg gr27 gr27_lrg.jpg jpg 153734 420 1293 IMAGE-HIGH-RES 1-s2.0-S1872206724600136-gr28_lrg.jpg https://s3-eu-west-1.amazonaws.com/prod-ucs-content-store-eu-west/content/pii:S1872206724600136/HIGHRES/image/jpeg/e002a5f04f6f947c010c59161cb7358d/gr28_lrg.jpg gr28 gr28_lrg.jpg jpg 365326 1208 1791 IMAGE-HIGH-RES 1-s2.0-S1872206724600136-gr29_lrg.jpg https://s3-eu-west-1.amazonaws.com/prod-ucs-content-store-eu-west/content/pii:S1872206724600136/HIGHRES/image/jpeg/e1deb0c5419a7d5c248a09e0f9d26c07/gr29_lrg.jpg gr29 gr29_lrg.jpg jpg 154677 763 847 IMAGE-HIGH-RES 1-s2.0-S1872206724600136-gr3_lrg.jpg https://s3-eu-west-1.amazonaws.com/prod-ucs-content-store-eu-west/content/pii:S1872206724600136/HIGHRES/image/jpeg/3d52b74f61eaa1654d7447416a3a13c1/gr3_lrg.jpg gr3 gr3_lrg.jpg jpg 208294 713 1620 IMAGE-HIGH-RES 1-s2.0-S1872206724600136-gr30_lrg.jpg https://s3-eu-west-1.amazonaws.com/prod-ucs-content-store-eu-west/content/pii:S1872206724600136/HIGHRES/image/jpeg/b02cca1a2465f2dfa598767d7972bfcd/gr30_lrg.jpg gr30 gr30_lrg.jpg jpg 75881 676 888 IMAGE-HIGH-RES 1-s2.0-S1872206724600136-gr4_lrg.jpg https://s3-eu-west-1.amazonaws.com/prod-ucs-content-store-eu-west/content/pii:S1872206724600136/HIGHRES/image/jpeg/550c3042a82d8fb9a747d684cdd2b53f/gr4_lrg.jpg gr4 gr4_lrg.jpg jpg 154009 823 980 IMAGE-HIGH-RES 1-s2.0-S1872206724600136-gr5_lrg.jpg https://s3-eu-west-1.amazonaws.com/prod-ucs-content-store-eu-west/content/pii:S1872206724600136/HIGHRES/image/jpeg/b8ef2a060797da4373f05f4080a903fe/gr5_lrg.jpg gr5 gr5_lrg.jpg jpg 122163 529 961 IMAGE-HIGH-RES 1-s2.0-S1872206724600136-gr6_lrg.jpg https://s3-eu-west-1.amazonaws.com/prod-ucs-content-store-eu-west/content/pii:S1872206724600136/HIGHRES/image/jpeg/ec99905bc510f0cfbae3898b17e28b9d/gr6_lrg.jpg gr6 gr6_lrg.jpg jpg 303679 1175 1435 IMAGE-HIGH-RES 1-s2.0-S1872206724600136-gr7_lrg.jpg https://s3-eu-west-1.amazonaws.com/prod-ucs-content-store-eu-west/content/pii:S1872206724600136/HIGHRES/image/jpeg/08975e62640b90e5d9ce15a7bd687d37/gr7_lrg.jpg gr7 gr7_lrg.jpg jpg 279308 1094 1607 IMAGE-HIGH-RES 1-s2.0-S1872206724600136-gr8_lrg.jpg https://s3-eu-west-1.amazonaws.com/prod-ucs-content-store-eu-west/content/pii:S1872206724600136/HIGHRES/image/jpeg/179730cae46996602c00d25d5bc38bac/gr8_lrg.jpg gr8 gr8_lrg.jpg jpg 425697 1087 1646 IMAGE-HIGH-RES 1-s2.0-S1872206724600136-gr9_lrg.jpg https://s3-eu-west-1.amazonaws.com/prod-ucs-content-store-eu-west/content/pii:S1872206724600136/HIGHRES/image/jpeg/f5394765690580b9383f0a0928d11826/gr9_lrg.jpg gr9 gr9_lrg.jpg jpg 497430 1330 1763 IMAGE-HIGH-RES 1-s2.0-S1872206724600136-si1.gif https://s3-eu-west-1.amazonaws.com/prod-ucs-content-store-eu-west/content/pii:S1872206724600136/STRIPIN/image/gif/bf0d4bd727296346e408970b5d8a7326/si1.gif si1 si1.gif gif 467 41 92 ALTIMG 1-s2.0-S1872206724600136-si2.gif https://s3-eu-west-1.amazonaws.com/prod-ucs-content-store-eu-west/content/pii:S1872206724600136/STRIPIN/image/gif/264c84dd7a2caabea880c503f2ae803b/si2.gif si2 si2.gif gif 407 37 79 ALTIMG 1-s2.0-S1872206724600136-si3.gif https://s3-eu-west-1.amazonaws.com/prod-ucs-content-store-eu-west/content/pii:S1872206724600136/STRIPIN/image/gif/4214796309ac3f311133e05a7239c339/si3.gif si3 si3.gif gif 814 36 170 ALTIMG CHNJC 60013 S1872-2067(24)60013-6 10.1016/S1872-2067(24)60013-6 Dalian Institute of Chemical Physics, Chinese Academy of Sciences. Fig. 1 Schematic representation of substantial energy storage in valuable chemicals and fuels through water electrolysis. Fig. 2 Representative milestone research work of Ru-based catalysts in HER and OER [40,41,43–45,109,167,183,187,188]. Reprinted with permission from Ref. [40]. Copyright 1998, Elsevier. Reprinted with permission from Ref. [41]. Copyright 2018, John Wiley and Sons. Reprinted with permission from Ref. [43]. Copyright 2015, American Chemical Society. Reprinted with permission from Ref. [44]. Copyright 2016, Elsevier. Reprinted with permission from Ref. [45]. Copyright 2019, John Wiley and Sons. Reprinted with permission from Ref. [109]. Copyright 2017, Springer Nature. Reprinted with permission from Ref. [167]. Copyright 2023, Springer Nature. Reprinted with permission from Ref. [183]. Copyright 2020, Springer Nature. Reprinted with permission from Ref. [187]. Copyright 2021, Springer Nature. Reprinted with permission from Ref. [188]. Copyright 2023, Springer Nature. Fig. 3 (a) Chemical processes in HER under acidic and alkaline conditions. (b) Relationship between the exchange current density (j 0) and hydrogen adsorption free energy under the assumption of the Langmuir adsorption model. Reprinted with permission from Ref. [58]. Copyright 2022, John Wiley and Sons. (c) Volcano plot of the relationship between the exchange current density (j 0) and the free energy of hydrogen adsorption (ΔG H*) for the surfaces of Ru and other metals. Reprinted with permission from Ref. [61]. Copyright 2021, Springer Nature. Fig. 4 (a) Schematic illustration of the proposed AEM pathway of OER in alkaline media on an active metal site. (b–d) Schematic illustrations of three alternative pathways of LOM in alkaline media with different catalytic centers. (b) Oxygen-vacancy-site mechanism (OVSM). (c) Single-metal-site mechanism (SMSM). (d) Dual-metal-site mechanism (DMSM). Reprinted with permission from Ref. [65]. Copyright 2021, Royal Society of Chemistry. Fig. 5 Degradation mechanisms of HER catalysts. Fig. 6 (a) Schematic illustration of synthesis of Ru-G/CC. (b) High resolution TEM (HRTEM) images of Ru-G/CC. (c) Comparison of the LSV curves of the initial electrode and the one after chronopotentiometry test for 100 h in 1.0 mol L−1 KOH. (d) Chronopotentiometry test performed at an overpotential of 270 mV for 100 h. (e) Calculated ΔG of H* on the surface of Ru-G/CC, Ru (101) and Pt (111). (f) Electron localized function of the adsorbed H-atom on the active sites. (g) Total DOS plots of amorphous/crystalline Ru structure. Reprinted with permission from Ref. [96]. Copyright 2022, Elsevier. Fig. 7 (a) Schematic illustration of synthesis of Ru x Fe y P-NCs/CNF. (b) Field emission scanning electron microscopy (FESEM) image of RuFeP-NCs/CNF. (c) Chronoamperometry curves of RuFeP-NCs/CNF at an overpotential of 60 mV for 100 h in 0.5 mol L−1 H2SO4. (d) Polarization curves of RuFeP-NCs/CNF before and after 100 h stability tests. (e) Chronoamperometry curves of the RuFeP-NCs/CNF tested at an overpotential of 60 mV vs. RHE for 100 h in 1.0 mol L−1 NaOH solution. Calculated adsorption free energy of H* (ΔG H*) (f) and OH*+H* (ΔG OH*+H*) (g) for various catalysts. (h) Possible and optimized adsorption configurations of OH* and H* on RuFeP-NCs/CNF. Reprinted with permission from Ref. [100]. Copyright 2021, Elsevier. Fig. 8 (a) Schematic illustration of synthesis of RuNP@RuN x -OFC/NC. (b) HRTEM image of RuNP@RuN x -OFC/NC. LSV curves of RuNP@ RuN x -OFC/NC, RuNP-RuN x /NC and Pt/C in 0.5 mol L−1 H2SO4 (c) and 1.0 mol L−1 KOH (d). Long-term chronoamperometric test of RuNP@RuN x -OFC/NC in 0.5 mol L−1 H2SO4 (e) and 1.0 mol L−1 KOH (f) at a current density of 10 mA cm−2 (inset: the LSV curves of RuNP@RuN x -OFC/NC before (red) and after (black) 2000 CV cycles). (g) Optimized structure of RuNP@RuN4-FC and RuNP-RuN4/PC. Color code: Ru gold, N blue and C gray. (h) DOS diagram of RuNP@RuN4-FC and RuNP-RuN4/PC. (i) Relationship of ΔG H* against the d band center (ɛ d) of the Ru atoms in RuNP@RuN4-FC and RuNP-RuN4/PC. Reprinted with permission from Ref. [104]. Copyright 2022, Elsevier. Fig. 9 (a) Schematic illustration of the synthesis and structure of the Ru@C2N electrocatalyst. (b) TEM image of Ru@C2N (insets: corresponding particle size distribution of the Ru nanoparticles (bottom) and atomic-resolution TEM image (top)). (c) LSV curves of Ru@C2N, Co@C2N, Ni@C2N, Pd@C2N, Pt@C2N and Pt/C electrocatalysts in 0.5 mol L−1 H2SO4 solution. (d) Durability test. The LSV curves of Pt/C and Ru@C2N were recorded before and after 10000 potential cycles in 0.5 mol L−1 H2SO4 solution from 0.2 to –0.1 V (versus RHE). Reprinted with permission from Ref. [109]. Copyright 2017, Springer Nature. (e) A schematic fabrication procedure of metal-composite-embedded hexagonal porous carbon nanosheets. (f) Comparison of the LSV curve of the 2DPC-RuMo nanosheets electrocatalysts for the 1st and 2000th cycles (inset: long-term HER stability measurement at a constant overpotential of 20 mV (with IR correction)). (g) Calculated hydrogen-adsorption free energy profile for different models. Reprinted with permission from Ref. [110]. Copyright 2020, John Wiley and Sons. (h) Stability of Ru@TiO2-V, Ru/CNTs, and Ru/TiO2-V for HER in 6 mol L−1 KOH at 80 °C. (i) Schematic display the unchanged metal diameter of Ru NPs confined into the lattice framework of TiO2 and after stability test for enabling outstanding stability of HER and Ru NPs supported on the surface of TiO2 undergo aggregation and dissociation for enabling poor stability of HER under harsh conditions. Reprinted with permission from Ref. [112]. Copyright 2022, Elsevier. Fig. 10 (a) Synthesis procedure for Ru-OC60-300. (b) Chronopotentiometry curve of Ru-OC60-300/KB and Pt/C at a constant current density of 10 mA cm−2. (c) Calculated ΔG H* of Ru13-O3-C60-top, Ru13-O3-C60-inter, Ru13-O3-G-top, and Ru13-O3-G-inter. (d) Charge differential density map of Ru13-O3-C60 and Ru13-O3-G. Cyan and yellow colors represent electron decrease and increase, respectively. (e) Energy diagram of Volmer-Tafel route for Ru13-O3-C60. Reprinted with permission from Ref. [119]. Copyright 2023, American Chemical Society. (f) Schematic synthesis processes and structure of Ru NRs/TiN catalyst. (g) LSV curves with before and after 10000 potential cycles of Ru NRs/TiN, Ru NRs/C and Pt/C in 1.0 mol L−1 KOH solution (inset: 50 h chronopotentiometry test). (h) Charge density difference of Ru/TiN. Cyan and yellow colors represent negative and positive isosurface, respectively. The value of the isosurface is 0.1 e bohr−3. (i) Calculated Gibbs free energy of atomic hydrogen adsorption on Ru/TiN, Ru (100), and Ru (–120) slabs. (j) Hydrogen adsorption configuration and the corresponding ΔG H* of Ru/TiN. Reprinted with permission from Ref. [121]. Copyright 2022, Elsevier. Fig. 11 (a) Crystal models of the temperature-induced phase transformation. LSV curves (b) and Stability (c) of MoO x -Ru fcc, MoO x -Ru hcp, Ru/C and Pt/C in 1 mol L−1 KOH. (d) Distribution map of formation energy for metal Ru fcc phase and hcp phase in the condition of bulk, facets (fcc_111 and hcp_101, respectively), and MoO x modification. (e) Crystal orbital Hamilton population (COHP) curves for Ru-H adsorption bonds on Ru(111) surface in fcc phase and corresponding projected DOS diagram. The Fermi level is set at zero. Projected density of states (PDOS) of 4d z 2 orbitals of Ru atoms on the surface of Ru without and with modification with MoO x , as well as the corresponding partial d-band center (ɛd ) relative to the Fermi levels in fcc phase (f) and hcp phase (g), respectively. Gibbs free energy diagrams for the adsorption of H* (h) and OH* (i) on the surface of Ru without and with the modification of MoO x . Reprinted with permission from Ref. [131]. Copyright 2022, American Chemical Society. Fig. 12 (a) A schematic diagram of phase-transition by atom slippage on the Ruccp(111) plane, in which the “A,” “B,” and “C” planes represented in light green, orange, and green. (b) The lattice distance of Ruccp(111) between the virtual horizontal line and Ruccp(111) (or Ruhcp(002)) orientation. (c) High-temperature XRD (HT-XRD) patterns of ccp/C heated to temperatures in the range of 200–500 °C under an Ar atmosphere. The black and red vertical lines representing the ccp (JCPDS# 88-2333) and hcp (JCPDS# 06-0663) Ru references. (d) Comparison of the LSV curve of the RuΔc→h/C electrocatalysts for the 1st and 5000th cycles (inset: HER stability measurement). (e) Schematic diagram describing different mechanisms of RuCX formation at RuΔc→h/C (top) and RuΔhcp/C (bottom). (f) Average H-binding free energy (ΔG H*) for each surface model. (g) Schematic diagram explaining the atomic-level bifunctional mechanism of the RuC X surface. Reprinted with permission from Ref. [132]. Copyright 2021, John Wiley and Sons. Fig. 13 (a) Schematic illustration of the synthesis of Ru/r-TiO2 and Ru/TiO2 catalysts. (b) LSV curves of Ru/r-TiO2, Ru/TiO2, Pt/C, Ru/C, Ti(III) oxide, TiO2 and GC electrocatalysts in 1.0 mol L−1 KOH solution. (c) Stability of Ru/r-TiO2 by 1000 potential cycles between –50 and 10 mV at 5 mV s−1 (inset: the stability of catalysts at a constant potential of 15 mV for 10 h). (d) Charge density differences for Ru(0001)/TiO2 (up) and Ru(0001)/r-TiO2 (down) interfaces. The yellow region represents charge accumulation, and the light blue region indicates charge depletion at the isosurface value of 0.01 e Bohr−3. (e) Free energy profiles for HER from water to H2 on different surfaces. (f) The enlarged view of OH* adsorption on Ru(0001)/r-TiO2 and Ru(0001)/TiO2 interfaces. Green: Ru; grey: Ti; red: O; white: H. Reprinted with permission from Ref. [136]. Copyright 2021, Elsevier. Fig. 14 (a) Schematic illustration of the synthesis of Ru SAs-SnO2/C. (b) LSV curves (iR compensated) of Ru SAs-SnO2/C, Ru/C, Pt/C, and SnO2/C electrocatalysts in 1.0 mol L−1 KOH at a scan rate of 5 mV s−1. (c) LSV curves of Ru SAs-SnO2/C electrocatalyst before and after 3000 CV cycles (inset: the chronoamperometry curve at –18 mV). (d) OH adsorption configurations on the Ru (001), Ru site on Ru SAs/SnO2 and Sn site on Ru SAs/SnO2, as well as corresponding binding energies. (e) Schematic showing of the mechanism of enhanced HER performance on Ru SAs-SnO2/C. Reprinted with permission from Ref. [138]. Copyright 2022, John Wiley and Sons. Fig. 15 Timeline of investigations on the stability of Ru- based catalysts for HER. Fig. 16 (a) Schematic illustration of the synthetic procedures of catalysts. (b) LSV curves of various electrocatalysts (C-RuO2, C-IrO2, and Ir/C represent the commercial RuO2, IrO2, and Ir/C, respectively). (c) Chronopotentiometry curves of Ru1Ir1O x . (d) S-number for various electrocatalysts at 10 mA cm−2 geo. (e) The DOS curves of IrO x , RuO x , and Ru1Ir1O x . (f) Charge density difference of IrO x and Ru1Ir1O x (Blue and yellow colors represent charge depletion and accumulation, respectively). (g) The Gibbs free energy diagram of IrO x , RuO x , and Ru1Ir1O x . Reprinted with permission from Ref. [149]. Copyright 2021, John Wiley and Sons. Fig. 17 (a) Schematic illustration of the synthetic process of RuNi2©G-250. “T” represents the different oxidation temperatures, and “X” represents the molar ratios of Ru and Ni precursors. (b) LSV curves of RuNi2©G-250 in comparison with other catalysts treated at different oxidation temperatures and commercial RuO2 at the same mass loading of 0.32 mg cm−2. (c) Chronopotentiometric curve of RuNi2©G-250 supported on carbon fibers at a mass loading of 3 mg cm−2. (d) X-ray absorption near-edge structure (XANES) of Ru K-edge for RuNi2©G-250 supported on carbon fibers before and after 24 h stability testing. (e) The catalytical reaction circle and the active sites for interface Ru centers. The red, gray, white, and blue balls represent O, C, H, and Ru atoms, respectively. (f) The calculated overpotential (η) against the free energy of O* (ΔG O*) and HOO* (ΔG HOO*) on different active sites: a pristine RuO2 site, interface Ru centers, a Ru site under graphene or graphene oxide, and a Ru site adjacent to Ni (Ru adjacent to Ni); P1–P4 represent the graphene with different degrees of oxidation, and d1.5–d3.0 represent the different heights between graphene and RuO2. (g) Free energy profiles for the OER over RuO2 and interfacial Ru centers between RuO2 and graphene with an armchair edge at zero potential (U = 0). (h) Differential charge density at the interfacial Ru centers between RuO2 and graphene. Yellow and blue contours represent electron accumulation and depletion, respectively. The isovalue is set to be 0.004 a.u. Reprinted with permission from Ref. [151]. Copyright 2020, John Wiley and Sons. Fig. 18 (a) SEM image of RuIr@CoNC catalysts. (b) CP curves of RuIr@CoNC recorded at a constant current density of 10 mA cm−2 in 0.5 mol L−1 H2SO4, 0.05 mol L−1 H2SO4, and PBS. (c) ICP-OES analysis of the dissolution of Ru, Ir, and Co of RuIr@CoNC during the OER electrolysis after different time intervals in 0.5 mol L−1 H2SO4. (d) Gibbs free-energy diagram on the flat and step surfaces, calculated at 1.23 V. (e) The Bader charge analysis of the flat and step surfaces. The green, blue, and red spheres represent Ru, Ir, and O atoms, respectively. (f) Calculated PDOS of Ru d-band on the flat and step surfaces. The dotted lines denote the d-band center. Reprinted with permission from Ref. [157]. Copyright 2021, American Chemical Society. (g) High-resolution TEM of RuO2/D-TiO2 (inset: a structural schematic for the composite catalyst). (h) Electron paramagnetic resonance (EPR) spectra of RuO2/D-TiO2, RuO2/C, and RuO2/TiO2. (i) CP measurements with different applied current densities. (j) Long-term stability tests at a constant current density of 200 mA cm−2 in a three-electrode electrolyzer. (k) Limiting potential diagram for AEM and LOM on model surfaces. Reprinted with permission from Ref. [158]. Copyright 2022, American Chemical Society. Fig. 19 (a) Synthetic scheme of the Ru-UiO-67-bpydc catalyst (bpydc represents 2,2’-bipyridine-5,5’-dicarboxylic acid). (b) Initial LSV curves of Ru-UiO-67-bpydc and the LSV curves of catalysts after 1000 CV cycles. (c) Chronopotentiometric curves of Ru-UiO-67-bpydc at a current density of 10/50 mA cm−2 and RuO2 at a current density of 10 mA cm−2. (d) Crystal orbital Hamilton population of Ru–N and Ru–OOH bond in Ru-UiO-67-bpydc and –COHP of Ru–O and Ru–OOH in RuO2 catalysts. (e) Gibbs free energy illustration by Ru-UiO-67-bpydc and RuO2 catalysts during the OER process through the AEM or LOM pathways. (f) The transformation of RuO2 to RuO4 2– during the acidic OER process via the LOM pathway. (g) The stability of the Ru intermediate in the MOF-anchored Ru oxide during the acidic OER through the LOM pathway. Reprinted with permission from Ref. [162]. Copyright 2023, Elsevier. Fig. 20 (a) LSV curves of RuMn NSBs with a 85% iR-correction after 1000, 5000, 10000, and 20000 cycles (inset: the overpotential at 10 mA cm−2). (b) Ru and Mn dissolution. (c) The chronopotentiometry curve of RuMn NSBs and commercial RuO2 at 10 mA cm−2. (d) Schematic of surface reconstruction of RuMn NSBs and dissolution of unstable Ru-based alloys in acidic media during CV cycles. (e) Durability-binding energy (Ru) relationships found in this study. Reprinted with permission from Ref. [166]. Copyright 2022, John Wiley and Sons. Fig. 21 (a) Schematic illustration of the synthesis of Ni-RuO2. (b) LSV curves of Ni-RuO2, RuO2 and Com-RuO2. (c) Stability tests of Ni-RuO2, RuO2 and Com-RuO2. (d) Calculated free energy of OER via AEM on surfaces of RuO2 (110) and Ni-RuO2 (110) under an electrode potential of 1.70 V. (e) Calculated energies for the structural degradation of the surfaces of RuO2 (110) and Ni-RuO2 (110). Reprinted with permission from Ref. [167]. Copyright 2023, Springer Nature. Fig. 22 (a) Chronopotentiometry curves of YSRO-15 and RuO2 catalysts at a current density of 10 mA cmgeo −2. (b) Surface and bulk atomic percentages of the YSRO-15 catalyst after the stability test, observed from in-depth XPS spectra. (c) Schematic illustrations of different RuO6 along with the splitting of Ru 4d orbitals. (d) PDOS diagrams of Ru 4d and O 2p orbitals in pristine Y2Ru2O7 (top) and the 12.5 at% Sr-substituted Y1.75Sr0.25Ru2O7 (bottom) model. Calculated free energy diagrams of the OER pathway for the Y2Ru2O7 (e) and Y1.75Sr0.25Ru2O7 (f) models. Reprinted with permission from Ref. [172]. Copyright 2021, American Chemical Society. Fig. 23 (a) Crystalline structure of Y2Ru2O7 with Ir doping. (b) LSV curves (inset: LSV curves of pyrochlores with different Ru/Ir ratios). (c) Chronpotentionary measurement of Y2Ru1.2Ir0.8O7 and commercial RuO2 at 10 mA cm−2 respectively. (d) Adsorption of oxygen intermediates at Ir site. (e) Free energy diagram of Ru in Y2Ru1.2Ir0.8O7 and RuO2. (f) Free energy diagram of Ir in Y2Ru1.2Ir0.8O7 and IrO2. Reprinted with permission from Ref. [176]. Copyright 2022, John Wiley and Sons. Fig. 24 (a) Schematic route for synthesis of W0.2Er0.1Ru0.7O2–δ nanosheets. (b) Extended X-ray absorption fine structure (EXAFS) spectra of Ru K-edge for Ru foil, C-RuO2, W0.2Er0.1Ru0.7O2–δ , and RuO2−δ . (c) LSV curves of W0.2Er0.1Ru0.7O2–δ , Er0.1Ru0.9O2–δ , W0.2Ru0.8O2–δ , and RuO2–δ nanosheets. (d) Stability of W0.2Er0.1Ru0.7O2–δ nanosheets in 0.5 mol L−1 H2SO4. (e) ICP analysis of the spent W0.2Er0.1Ru0.7O2–δ catalysts after 500 h operation in acid. (f) Schematic diagrams of rigid band models for RuO2 and W0.2Er0.1Ru0.7O2–δ–1 in acidic OER. (g) Calculated energy for the formation of VO in different positions of RuO2, W0.2Ru0.8O2–δ–1, Er0.1Ru0.9O2–δ–1, and W0.2Er0.1Ru0.7O2–δ–1. (h) Calculated energy barriers diagram of W0.2Er0.1Ru0.7O2–δ–1. Reprinted with permission from Ref. [183]. Copyright 2020, Springer Nature. Fig. 25 (a) Normalized LSV curves of MRuO x based on geometric areas. (b) Chronopotentiometry curve of SnRuO x operated at 100 mA cm−2 during the 250-h test. (c) DEMS signals of 32O2, 34O2 and 36O2 from the reaction products of MRu16O x in H18O aqueous sulfuric acid electrolyte. The right part presented the variation of 16O: 18O ratio with Ru oxidation states of MRuO x . (d) The variation of apparent overpotential at 10 mA cm−2 with Ru oxidation states. (e) The variation trend of Ru K-edge absorption energy (E 0) of SnRuO x and RuO x under different potentials. (f) Summary of the Ru–O bond length of SnRuO x and RuO x under various potentials. (g) The variation of It 2g–p/Ie g–p with applied potentials for SnRuO x and RuO x . Reprinted with permission from Ref. [187]. Copyright 2023, Springer Nature. Fig. 26 (a) Schematic illustration of the simplified OPM mechanism. (b) Electrocatalytic OER performance of MnO2, Ru/MnO2 and homemade RuO2 in 0.1 mol L−1 HClO4. (c) Chronopotentiometric response of the 12Ru/MnO2 catalyst in an H-type cell (inset photo) using carbon cloth as a current collector (inset: the chronopotentiometric response of 12Ru/MnO2 and RuO2 using gassy carbon as the current collector). Operando synchrotron FTIR spectra recorded in the potential range of 1.2–1.6 V versus RHE for 12Ru/MnO2 (d) and commercial RuO2 (e). (f) DEMS signals of O2 products for 12Ru/MnO2 in the electrolyte using H2 18O as the solvent during three times of LSV in the potential range of 1.17–1.72 V versus RHE, with a 10 mV s−1 scan rate. Reprinted with permission from Ref. [188]. Copyright 2021, Springer Nature. Fig. 27 Timeline for investigations on the stability of Ru-based catalysts for OER. Fig. 28 (a) Polarization curves of a/c-RuO2||c-RuO2 and commercial Pt/C||RuO2 for water splitting in 0.5 mol L−1 H2SO4. (b) Photo image of a/c-RuO2-based two-electrode electrolyzer driven by a battery with 1.5 V. (c) Time-dependent current density curves of a/c-RuO2||a/c-RuO2 and commercial Pt/C||RuO2 for water splitting in 0.5 mol L−1 H2SO4 at 50 mA cm−2. Reprinted with permission from Ref. [191]. Copyright 2021, John Wiley and Sons. (d) Polarization curves of the catalysts in the two-electrode configuration for water splitting. (e) Photo of the RuO2-NiO/NF||RuO2-NiO/NF couple powered by a single AA battery. (f) Chronoamperometric curves of RuO2-NiO/NF||RuO2-NiO/NF. Reprinted with permission from Ref. [97]. Copyright 2020, Royal Society of Chemistry. (g) Schematic diagram of the PEM electrolyzer. Reprinted with permission from Ref. [170]. Copyright 2023, John Wiley and Sons. (h) Steady-state polarization curve of a PEM electrolyzer measured at 80 °C using SrRuIr as anodic catalysts. (i) Chronopotentiometry tests of the SrRuIr oxide catalyst at 1 A cm−2 in the PEM electrolyzer measured at 80 °C. Reprinted with permission from Ref. [184]. Copyright 2021, American Chemical Society. Fig. 29 Illustration of fundamentals and strategies to improve the stability of Ru-based catalysts in HER and OER. Fig. 30 Schematic illustration of potential research issues related to the catalytic stability of Ru-based catalysts. Table 1 Summary of representative Ru-based electrocatalysts toward HER. Catalyst Electrolyte η10 (mV) Tafel slope (mV dec−1) Stability Ref. CA/retention (mA cm−2@h@%) CP/decay (mV@h@mV) CV cycles/retention (cycles @%) Ru NRs/TiN 1.0 mol L−1 KOH 25 27.08 — ~30@50@41 10000 [121] Ru-NiCo2S4–x 1.0 mol L−1 KOH 32 61.3 20@12@100 — 1000 [147] Ru SAs-SnO2/C 1.0 mol L−1 KOH 10 25 10@27@100 — 3000 [138] Ru@MoO(S)3 1.0 mol L−1 KOH/0.5 mol L−1 H2SO4 30/63 29/32 17@24@88 — 3000 [105] Ru/TiO2-V 1.0 mol L−1 KOH 34 35.4 300@200@100 (80 °C and 6 mol L−1 KOH) — — [112] RuFe@NF 1.0 mol L−1 KOH 28 63.39 — ~310@680@0 — [113] Ru-G/CC 1.0 mol L−1 KOH 40 76 8@100@100 — — [96] Ru x Fe y P-NCs/CNF 1.0 mol L−1 NaOH/0.5 mol L−1 H2SO4 16/66 40.31/43.33 ~10@100@98 — — [100] Ru SAs/N-Mo2C NSs 1.0 mol L−1 KOH 43 38.67 ~22@60@93.7 — — [123] RuO2-NiO/NF 1.0 mol L−1 KOH 18 27 20@100 — — [97] NiRu-MOF/NF 1.0 mol L−1 KOH 51 90 ~30@24 ~110@24@~40 5000 [98] Ru-NCs/N-GA-900 1.0 mol L−1 KOH/1.0 mol L−1 HClO4 36/52 36.8 — ~150@40@50 10000 [99] RuNP@RuN x -OFC/NC 1.0 mol L−1 KOH/0.5 mol L−1 H2SO4 19/10 13.75/35.35 10@120@90 — 2000 [104] R-NiRu 1.0 mol L−1 KOH 16 40 ~23@12@80 — 5000 [127] 2DPC-RuMo 1.0 mol L−1 KOH 18 25 10@120@100 — 2000 [110] P,Mo-Ru@PC 1.0 mol L−1 KOH 21 21.7 10@10@100 — 5000 [111] S-RuP@NPSC-900 1.0 mol L−1 KOH 92 90.23 800@10@98 — — [107] Ru-Ru2P@CNFs 1.0 mol L−1 KOH/0.5 mol L−1 H2SO4 14/11 24.5 6@11@83 — 3000 [108] fcc-RuCu HUNSs 1.0 mol L−1 KOH/0.5 mol L−1 H2SO4 26/25 40 — 25@5@25 — [130] MoO x -Ru fcc 1.0 mol L−1 KOH/0.5 mol L−1 H2SO4 34/26 14.5 — 34@100@~16 — [131] RuΔc→h/C 0.5 mol L−1 KOH 97 (50 mA cm−2) 51 — ~45@12@5 5000 [132] Ru x Se-400 1.0 mol L−1 KOH 45 31.4 10@18@80 — 3000 [135] Ru/r-TiO2 1.0 mol L−1 KOH 15 49 10@10@~90 — 1000 [136] RuO2-300Ar 1.0 mol L−1 KOH/0.5 mol L−1 H2SO4 17/16 35 — ~220@300 — [137] Ru1CoP/CDs-1000 1 mol L−1 KOH/0.5 mol L−1 H2SO4 51/49 73.4/51.6 10@20 — 2000 [146] PtRu/mCNTs 1.0 mol L−1 KOH/0.5 mol L−1 H2SO4/1 mol L−1 PBS 15/28/17 33.5 — 25@48 3000 [145] Ru/p-NC 1.0 mol L−1 KOH 10 17 14@24@93 — 3000 [144] CNT-V-Fe-Ru 1.0 mol L−1 KOH/0.5M H2SO4 38/64 41/51 — 64@20@11 — [118] Mo2C-Ru/C 1.0 mol L−1 KOH 22 25 10@100 — — [143] Ru@Ti3C2T x -VC 1.0 mol L−1 KOH 35 32 — 40@40@10 — [142] Ru@MWCNT 1 mol L−1 KOH/0.5 mol L−1 H2SO4 17/13 27/27 20@50 — 10000 [114] Ru-Fe3O4/C 1.0 mol L−1 KOH 11 25 56@32@95.5 — 5000 [141] Cu-Ru/RuSe2 NSs/C 1.0 mol L−1 KOH 23 58.5 — — 5000 [140] Ru@N-CNFs 1.0 mol L−1 KOH/0.5 mol L−1 H2SO4 17/16 28.5/31.8 15@17@80 — 2000 [101] Ru/P-TiO2 1.0 mol L−1 KOH 27 28.3 9@23@78 — 2000 [139] Ru-OC60-300 1.0 mol L−1 KOH 4.6 24.7 — 4.6@50@13.3 3000 [119] Table 2 Summary of representative Ru-based electrocatalysts toward OER. Catalyst Electrolyte η10 (mV) Tafel slope (mV dec−1) Stability Ref. CA/Retention (mA cm−2 @h@%) CP/decay (mV@h@mV) CV cycles/retention (cycles @%) Ru/GDY 0.5 mol L−1 H2SO4 531 100 10@54@100 — 2000 [155] YZRO/AB 0.5 mol L−1 H2SO4 291 36.9 — 290@6@~25 2000 [171] PRPO-350 0.1 mol L−1 HClO4 174 28.8 — 270@150@~63 2000 [175] W0.2Er0.1Ru0.7O2–δ 0.5 mol L−1 H2SO4 168 66.8 — 170@500@83 — [183] 12Ru/MnO2 0.1 mol L−1 HClO4 161 29.4 — 161@200@169 — [187] Ru/NiFe2+Fe-LDH 1 mol L−1 KOH 194 36 — 290 (100 mA cm−2)@100@16 — [160] RuO2/D-TiO2 0.5 mol L−1 H2SO4 180 43 — 270 (200 mA cm−2)@100@16 — [158] YSRO-15 0.5 mol L−1 H2SO4 264 44.8 — 260@28 — [172] Ru@IrO x 0.05 mol L−1 H2SO4 282 69.1 −@24@90 — — [148] Ru SAs/AC-FeCoNi 1 mol L−1 KOH 205 40 10@48@100 — — [161] S-RuFeO x 0.1 mol L−1 HClO4 187 40 — 170 (1 mA cm−2)@50 @35 5000 [164] RuMn 0.5 mol L−1 H2SO4 270 — — 270@720@100 20000 [166] Ru1Ir1O x 0.5 mol L−1 H2SO4 204 71.3 — 270 (100 mA cm−2)@110 1000 [149] RuNi2©G-250 0.5 mol L−1 H2SO4 227 65 — 270@24 — [151] Sr1.7Ru5Ir1O13.7 0.5 mol L−1 H2SO4 190 39 — 180@1500@43 — [184] PtCo-RuO2/C 0.1 mol L−1 HClO4 212.6 48.5 — 270@20@80 — [185] Sr0.95Na0.05RuO3 0.1 mol L−1 HClO4 160 — — — 20 [178] Ru-N-C 0.5 mol L−1 H2SO4 267 52.6 11@30@95 — 1000 [156] Ni-RuO2 0.1 mol L−1 HClO4 214 42.6 — 220@200 — [167] Re0.06Ru0.94O2 0.1 mol L−1 HClO4 190 45.5 — 190@200@50 — [168] Nb0.1Ru0.9O2 0.5 mol L−1 H2SO4 204 47.9 — 770 (200 mA cm−2)@360 — [169] RuIr-NC 0.05 mol L−1 H2SO4 165 — — 165 (1 mA cm−2)@122 — [150] Ru5W1O x 0.5 mol L−1 H2SO4 235 — — 235@550 10000 [186] Y2Ru2–x Ir x O7 0.1 mol L−1 HClO4 220 47.56 — 500@2000 — [176] CaCu3Ru4O12 0.5 mol L−1 H2SO4 171 40 — 171@24@21 — [179] Cr0.6Ru0.4O2 0.5 mol L−1 H2SO4 178 58 — 178@10 10000 [163] RuMn NSBs-300 0.5 mol L−1 H2SO4/1 mol L−1 KOH 226/222 — — 230@122 — [165] RuRh@(RuRh)O2 0.1 mol L−1 HClO4 245 51.2 — 270@2.22 — [153] Ni-Ru@RuO x -HL 0.5 mol L−1 H2SO4 184 54 — 184@30 — [154] Au@Pt@RuO x 0.1 mol L−1 HClO4 215 60.1 — 220@40 — [189] RuOCl@MnO x 0.5 mol L−1 H2SO4 228 43 — 228@280@50 — [190] a/c-RuO2 0.1 mol L−1 HClO4 205 48.6 — 240@60 — [191] HRO 0.1 mol L−1 HClO4 215 36.86 — 270 (1 mA cm−2)@60 1000 [173] CaCu3Ru4O12 1 mol L−1 H2SO4 320 59 — — 100 [180] RuIr@CoNC 0.5 mol L−1 H2SO4 223 45 — 230@40@90 — [157] NC@Vo·-RuO2/CNTs-350 0.5 mol L−1 H2SO4 170 38.9 — 170@900 2000 [152] Y2MnRuO7 0.5 mol L−1 H2SO4 260 48 — 270@45 2000 [177] Table 3 Summary of representative Ru-based electrocatalysts toward water splitting. Catalyst Electrolyte Potential (V@ mA cm−2) Stability (h) Ref. Ru-G/CC 1.0 mol L−1 KOH 1.67@10 — [96] Ru-NiCo2S4 1.0 mol L−1 KOH 1.46@10 24 [147] Ru SAs-SnO2/C 1.0 mol L−1 KOH 1.49@10 27 [138] Ru@MoO(S)3 1.0 mol L−1 KOH/0.5 mol L−1 H2SO4 1.526@10/1.522@10 24/24 [105] RuFe@NF 1.0 mol L−1 KOH 1.54@10 680 [113] Ru x Fe y P-NCs/CNF 1.0 mol L−1 NaOH 1.6@10 10 [100] RuO2-NiO/NF 1.0 mol L−1 KOH 1.43@10 2000 [97] RuNP@RuN x -OFC/NC 1.0 mol L−1 KOH 1.337@10/1.615@100 50 [104] Ru-WO3 1.0 mol L−1 KOH 1.86@1000 100 [128] RuO2-300Ar 1.0 mol L−1 KOH/0.5 mol L−1 H2SO4 1.45@10/1.54@100 300/300 [137] a/c-RuO2 0.5 mol L−1 H2SO4 1.5210@10 20 [191] SrRuIr 0.5 mol L−1 H2SO4 1.5@1000 150 [184] Nb0.1Ru0.9O2 0.5 mol L−1 H2SO4 1.69@1000 100 [169] Nd0.1RuO x /CC 0.5 mol L−1 H2SO4 1.455@10 50 [170] Ni-RuO2 0.1 mol L−1 HClO4 1.78@500 1000 [167] PRPO-350 0.1 mol L−1 HClO4 1.8@1140 — [175] PtCo-RuO2/C 0.1 mol L−1 HClO4 2.0@4400 24 [185] RuO2/D-TiO2 0.5 mol L−1 H2SO4 1.74@1500 6 [158] Y2Ru2–x Ir x O7 0.1 mol L−1 HClO4 1.645@100 150 [176] SnRuO x 0.5 mol L−1 H2SO4 1.565@1000 1300 [186] RuIr-NC 0.05 mol L−1 H2SO4 1.485@10 120 [150] RuMn NSBs-300 1.0 mol L−1 KOH/0.5 mol L−1 H2SO4 1.452@10/1.456@10 125 [165] YZRO/AB 0.5 mol L−1 H2SO4 1.65@340 — [171] NC@Vo·-RuO2/CNTs-350 0.5 mol L−1 H2SO4 1.45@10 1000 [152] Ru0.85Zn0.15O2–δ 1.0 mol L−1 KOH/0.5 mol L−1 H2SO4 1.47@10/1.50@10 50 [163] Y2MnRuO7 0.1 mol L−1 HClO4 1.75@1000 24 [177] Available online 20 May 2024 This work was supported by the Basic and Applied Basic Research Foundation of Guangdong Province (2023A1515012288), the Natural Science Foundation of Shaanxi province, China (2022JQ-433), the China Postdoctoral Science Foundation (2022M722585) and the Fundamental Research Funds for the Central Universities (D5000210829, D5000210601). Review A review on fundamentals for designing stable ruthenium-based catalysts for the hydrogen and oxygen evolution reactions Wangyan Gou a b Yichen Wang a b Mingkai Zhang c Xiaohe Tan b Yuanyuan Ma a b * Yongquan Qu b * a Research & Development Institute of Northwestern Polytechnical University in Shenzhen, Shenzhen 518057, Guangdong, China Research & Development Institute of Northwestern Polytechnical University in Shenzhen Shenzhen Guangdong 518057 China Research & Development Institute of Northwestern Polytechnical University in Shenzhen, Shenzhen 518057, Guangdong, China b School of Chemistry and Chemical Engineering, Northwestern Polytechnical University, Xi'an 710072, Shaanxi, China School of Chemistry and Chemical Engineering Northwestern Polytechnical University Xi'an Shaanxi 710072 China School of Chemistry and Chemical Engineering, Northwestern Polytechnical University, Xi'an 710072, Shaanxi, China c School of Science, Xi'an University of Technology, Xi'an 710048, Shaanxi, China School of Science Xi'an University of Technology Xi'an Shaanxi 710048 China School of Science, Xi'an University of Technology, Xi'an 710048, Shaanxi, China * Corresponding author Clean and renewable energy is generally localized and intermittent. Thus, energy conversion and storage technologies are necessary to compensate for these shortcomings. Electrolytic water splitting presents a reliable and promising energy technology for producing high purity hydrogen (H2). Among the platinum metals, ruthenium (Ru) has gained significant attentions as it generally outperforms commercial catalysts in terms of activity at a more affordable price. Although great progress has been made in improving the catalytic activity of Ru-based catalysts, stability remains a major challenge hindering their practical applications. To this end, this review introduces the fundamentals of the stability over Ru-based catalysts for water splitting, including the reaction mechanisms of hydrogen evolution reaction (HER) and oxygen evolution reaction (OER), measurement methods and evaluation criteria, as well as deactivation mechanisms. Moreover, the up-to-date advances of representative strategies for improving HER and OER stability of Ru-based catalysts are further discussed with respect to specific design principles and underlying mechanisms. Ultimately, insights into the challenges and opportunities for Ru-based electrocatalysts are provided to promote the development of next-generation Ru-based catalysts with exceptional stability. This review aims at guiding the design and synthesis of superior catalysts, generating increased interest among researchers, and stimulating further advanced research. Graphical Abstract The fundamentals on stability of ruthenium-based catalysts, strategies and recent advances to design stable ruthenium-based catalysts for the hydrogen evolution and oxygen evolution reactions are summarized in this review. Keywords Electrocatalysis Water splitting Deactivation mechanism Ruthenium-based catalyst Stability 1 Introduction In recent decades, the excessive reliance on fossil energy has led to serious environmental issues and energy crisis. In this regard, there is a growing interest in exploring affordable and long-lasting renewable energy alternatives [1–3]. However, these clean and renewable energy sources are localized and intermittent, making it challenging to meet the actual demand. Therefore, energy conversion and storage technologies are needed to overcome these limitations [4–6]. High-purity hydrogen (H2), which can be produced by photoelectrochemical and electrochemical water-splitting, presents great potential as an abundant, accessible, economical, and environmentally friendly source of energy with zero carbonaceous species emission among various energy alternatives (Fig. 1 ). Water electrolysis proves to be an attractive, promising and reliable energy technology for future applications due to its efficiency and convenience [7–9]. The process of electrochemical water-splitting involves two crucial reactions, oxygen evolution reaction (OER) on the anode and hydrogen evolution reaction (HER) on the cathode. The overall water-splitting reaction is demonstrated as follows: 2H2O (l) → 2H2 (g) + O2 (g). Water electrolysis can be performed in acidic, neutral and alkaline electrolytes. The standard thermodynamic potential of 1.23 V (vs. reversible hydrogen electrode, RHE) in the alkali and acidic electrolyte media is required to split water into O2 and H2 [5,10]. However, due to multiple electron transfer steps involved in both cathodic and anodic reactions, the kinetics become sluggish, resulting in additional energy requirements known as overpotential (η) to overcome the reaction barriers and accelerate electron transfer. Therefore, electrocatalysts with high activity and robust stability are needed to enhance the kinetics of HER and OER for cost-effective water-splitting [11–13]. Generally, an efficient catalyst should fulfill two essential criteria: (1) the ability to generate high current density at small overpotential; (2) high operating stability. The performance of cost-effective catalysts based on transition metals in electrolytic water splitting, including metal organic framework (MOF), covalent organic frameworks (COF), high-entropy alloys, metal oxides and (oxy)hydroxides, diatomic catalysts, MXenes, etc., has been comprehensively summarized in previous cutting-edge reviews [14–31]. However, in a wide range of pH, especially in acid, noble metal catalysts are still considered as the most superior catalysts for both HER and OER. For instance, Pt/C and IrO2 widely serve as the HER and the OER benchmark, respectively. Thus, noble-metal based electrocatalysts are almost indispensable for these reactions [32,33]. Among various noble metals, Ru has gained significant attention as a cost-effective alternative within platinum-group metals and has shown great potential to substitute Pt in HER [34]. Ru exhibits comparable or even better HER performance to Pt, and possesses a bond strength with hydrogen similar to that of Pt (65 kcal mol−1) [35,36]. Moreover, Ru is more affordable than Ir, making it the most promising alternative to iridium oxide. According to the volcano theory proposed by Nørskov et al., RuO2 is localized near the peak of the volcano among extensively studied oxides, indicating its great potential as an ideal substitute for IrO2 in OER [37,38]. Therefore, ruthenium-based catalyst is the most promising catalyst for water splitting applications. Considerable efforts have been devoted to enhancing the water splitting activity and understanding the reaction mechanism of Ru-based catalysts, which results in the superior performance in comparison with commercial Pt/C and IrO2 catalysts [39–52]. However, the lack of ultra-long stability restricts the development of Ru-agent catalysts in electrolytic water splitting. Insufficient stability of Ru-based catalysts in HER can be attributed to phenomena such as Ostwald ripening, agglomeration, dissolution, and detachment [53,54]. In terms of OER reaction, stability remains one of the major challenges hindering its practical applications, as the transition from Ru4+ into soluble and losable Ru>4+ with higher valence states leads to the weak chemical stability and structural stability [39,55,56]. The stability of ruthenium catalysts for HER and OER is unsatisfactory due to above factors, necessitating further improvement. Although previous reviews have been made in terms of improving the activity of Ru-based catalysts in HER or OER, there is a noticeable lack of comprehensive one focusing on their stability issues in water splitting, necessitating attention and effective solutions to overcome limitations for practical applications [13,39,42]. It is an urgent need for a review encompassing critical aspects and recent advances in designing stable ruthenium-based catalysts for the hydrogen and oxygen evolution reactions. In this review, we focus on the recent progresses in the stability of Ru-involving electrocatalysts for water splitting. First of all, we provide a brief introduction to the mechanisms of OER/HER reactions, evaluation methods and criteria for stability, as well as deactivation types for Ru-based materials. Subsequently, based on the recent advances in this field, we focus on the emphatic discussions of key issues and debate on stability, as well as stability-enhancing strategies via representing typical examples in HER and OER, respectively. In-depth analysis of high performance can provide valuable insights for designing superior catalysts. The development timeline of the stability of Ru-based catalysts, including several crucial stages, is provided in Fig. 2 . Finally, we address the challenges and prospects of utilizing Ru-based materials in water-splitting research field. Thus, this comprehensive review is expected to attract significant interest among researchers worldwide and stimulate further high-level investigations in this filed. Moreover, it is anticipated that this review will have significant implications on other catalytic fields, including photocatalysis, thermal catalysis and enzyme catalysis. 2 Fundamentals and principles of the stability 2.1 Fundamentals of electrochemical of water-splitting The understanding of the reaction mechanism in various electrolytes is crucial as it helps to enhance the reaction activity and stability. Numerous research studies have been carried out to investigate the reactions occurring on both electrodes during water-splitting. The proposed mechanisms are described as follows. 2.1.1 HER mechanism The generation of a single H2 molecule involves the participation of two electrons in the HER process, and its activation requires a theoretical thermodynamic voltage of 0 V when using an ideal catalyst. As a result, HER is typically carried out as a two-step, two-electron process, which can be represented by the following equations [57,58]. Acidic condition: Volmer step: H+ + e− → H* Heyrovsky step: H+ + H* + e− → H2 or Tafel step: H* + H* → H2 Alkaline and neutral conditions: Volmer step: H2O + e− → H* + OH− Heyrovsky step: H2O + H* + e− → H2 + OH− or Tafel step: H* + H* → H2 where * denotes the active sites of the electrocatalyst. HER can proceed via either the Volmer-Heyrovsky or Volmer-Tafel mechanism (Fig. 3(a) ) [58]. The rate-determining step can be identified by analyzing the Tafel slope, with values of 120, 40, and 30 mV dec−1 representing the Tafel slopes of Volmer, Heyrovsky and Tafel steps, respectively. For the formation of hydrogen, hydrogen adsorption and desorption are normally involved in the HER process [59]. Consequently, Gibbs free energy of hydrogen adsorption (ΔG H*) can be a well-known descriptor calculated using density functional theory (DFT), which serves as a valuable tool to support experimental results. For an idea HER catalyst based on the Sabatier's principle, the ΔG H* ideally approaches zero, indicating that the hydrogen binding energy of the catalyst should be neither too weak nor too strong (Fig. 3(b)). If the hydrogen bond on the surface of the catalyst is excessively weak, the hydrogen cannot be sufficiently activated, conversely if the hydrogen bond is too strong, release of hydrogen becomes difficult and the occupation of the catalytic active sites prevents new hydrogen adsorption (Fig. 3(b)) [60,61]. The high electronegativity of Ru (Pauling scale = 2.2) leads to a strong adsorption of active hydrogen species (H*). It has been observed from the volcano plot that Ru exhibits a more negative ΔG H* about –0.2 eV compared to Pt (~0 eV), which results in an unfavorable desorption of hydrogen from Ru surface (Fig. 3(c)). Therefore, modulation of the electronic structure of Ru can be employed to remove the electrons from Ru, thereby enhancing its desorption ability towards hydrogen, and consequently improving the reaction rate of Heyrovsky or Tafel step. In alkaline media, the dissociation of water plays a pivotal role in Volmer step. The HER efficiency of Ru-based catalysts can be improved by accelerating the water dissociation through the promoted nucleophilic attack of water on the active center Ru. Generally, Ru exhibits a strong adsorption of hydroxyl, facilitating water dissociation on Ru, however, excessive adsorption strength leads to OH occupation of Ru sites, resulting in active site poisoning [59–61]. 2.1.2 OER mechanism Oxygen molecule generation in OER process requires the transfer of four electrons. Therefore, compared to HER, OER involves multiple steps with electron transfer, resulting in sluggish kinetics. The theoretical thermodynamic voltage for OER is 1.23 V [5,11,62]. Various OER mechanisms have been proposed due to the difficulty in detecting intermediates. One commonly suggested mechanism is the absorbate evolution mechanism (AEM, Fig. 4(a) ), where the oxygen precursors undergo a stepwise process involving adsorption-deprotonation-coupling- desorption in a typical proposed OER cycling [63–65]. The specific reaction process is shown in the following equations: Acidic condition: H2O → OH* + H+ + e− OH* → O* + H+ + e− O* + H2O → OOH* + H+ + e− OOH* → O2 + H+ + e− Alkaline and neutral conditions: OH− → OH* + e− OH* + OH− → O* + H2O + e− O* + OH− → OOH* + e− OOH* + OH− → O2 + H2O + e It is evident that the assumed AEM exhibits a characteristic of four concerted proton-electron transfer (CPET) reactions between the metal bands and the adsorbed oxygen intermediates, which can be considered as a type of metal redox catalytic reaction. However, AEM shows a strong correlation between binding energies of oxygen intermediates and activity. It exhibits a theoretical overpotential limitation of 370 mV, which cannot fully rationalize some advanced reports that demonstrate lower overpotential. As an alternative, researchers have proposed another advanced mechanism to achieve the oxygen evolution cycles more subtly. This mechanism involves the lattice oxygen redox chemistry and a direct (O–O) bond coupling in oxygen molecule production [65–68]. In this alternative pathway, oxygen ligands are electrochemically activated and released from the lattice matrix, following a lattice oxygen-mediated mechanism (LOM). However, there remain some debates regarding the precise process of LOM, mainly in the subsequent three aspects [65]. The pre-activated lattice oxygen can effectively perform as an active site, known as the oxygen-vacancy-site mechanism (OVSM, Fig. 4(b)), where it directly receives OH− via nucleophilic attack to form OOH* species. The release of the gaseous O2 product leads to the creation of an Ovac site, which is refilled by OH− [69]. Another mechanism (single-metal-site mechanism (SMSM, Fig. 4(c)) involves the utilization of a single metal site as the catalytic center for adsorbing OH−, followed by OH− deprotonation. The direct coupling of the O* intermediate and activated lattice oxygen forms OO* species, which is considered as a newly formed intermediate undergoing the subsequent oxygen release procedure [70,71]. A dual-metal-site mechanism (DMSM) has also been proposed as a supplement of LOM (Fig. 4(d)). As anticipated, adjacent activated lattice oxygen on dual-metal-site forms a M–OO–M motif via intramolecular oxygen coupling, where the resulting *OO* moiety typically functions as peroxo-like species [72,73]. Normally, the difference of binding free energy between OH* and O* (ΔG O*–ΔG OH*) in AEM is substantial, with a value of 3.2 ± 0.2 eV, according to previous study on numerous metal oxides [39]. Optimal OER catalysts should possess a moderate bonding to the O-related reaction intermediates, suggesting that excessively strong or weak binding energies are unfavorable for OER. By employing the first-principal calculation to determine the theoretical overpotential of numerous metal oxides against the binding free energy of ΔG O*–ΔG OH*, Rossmeisl and his co-workers established a scaling relation using the “volcano” model [45,62]. Among these catalysts, RuO2 theoretically possesses the highest activity toward OER, owing to the closest proximity to optimal bonding energy with oxygen species. However, it remains challenging to quantitatively correlate theoretical data with experimental observations. Some scholars believe that ruthenium oxide follows the LOM mechanism to explain the small overpotential, since it possesses active lattice oxygen and low oxygen vacancy formation energy. 2.1.3 DFT calculations Besides the experimental illustrations on the catalytic mechanism, a computational standard hydrogen electrode model based on DFT is constructed to simulate the thermochemistry of electrochemical reactions. DFT calculations can provide deeper insights into the electrochemical process occurring in Ru-based materials by calculating energy barrier. Zagalskaya et al. [55] found that the defective RuO x delivered a higher OER activity through the LOM pathway. AEM is preferred for the perfect RuO x (110) and (211) surfaces, while the formation of metal vacancies due to catalyst dissolution may lead to LOM with lower OER overpotentials. Additionally, dopants, such as Ni and Co, can promote LOM over AEM even on the perfectly structured surfaces. Projected density of states (PDOS) analysis can also explain catalytic activity trends across a variety of catalysts based on electronic-structure descriptors, such as transition metal d- and oxygen p-band centers. Specifically, the O 2p-band center can serve as a descriptor for the OER activities of metal oxides due to its ability to reflect the electronic structure properties of oxides, especially about the electrochemical steps occurring at the oxygen sites in OER. In the case of the OER, oxidation of oxygen becomes thermodynamically favorable when O 2p states at the materials Fermi level are positioned above the redox energy of the O2/H2O couple. The O 2p-band center clearly shifts towards more positive values and closer to the Fermi level when going from the ideal (110) to one- and two-vacancy surface models for RuO2, leading to enhanced OER activity. Additionally, computed DOS reveals that the d x2–y2-band center of Ni-doped RuO2 is shifted to a higher energy and closer to the Fermi level compared to the pure RuO2, making the LOM more preferable [55]. 2.1.4 In-situ characterization methods In-situ X-ray diffraction (XRD), transmission electron microscope (TEM), Raman spectroscopy and other techniques are essential for real-time monitoring of phase structure changes, composite, morphology, vibrational change of M–O bond, defects, and other modifications. These analyses provide insights into the active sites and deepen our understandings of the roles of each component in catalysts. Particularly, operando X-ray absorption spectroscopy (XAFS) offers a suitable investigative approach to capture the dynamic electronic structures, valence states and local coordination environments of catalysts during the reaction. Operando synchrotron Fourier transform infrared spectroscopy (FTIR) has been reported to successfully detect the intermediates OOH* and OO* of AEM and LOM, respectively. Differential electrochemical mass spectrometry (DEMS) combined with isotope labeling has been employed to identify and quantify the products or intermediates during the reaction process, due to the simultaneous observation of electrochemical currents alongside mass spectrometer ion currents. The results obtained from this method solidly support whether the catalyst follows the AEM pathway or the LOM pathway [43,70]. Additionally, by employing an electrochemical flow cell (EFC) with an inductively coupled plasma mass spectrometer (ICP-MS), simultaneous real-time measurement of metal dissolution quantities can be recorded alongside the electrochemical measurement for analyzing catalyst stability. As-synthesized metallic Ru sample exhibited dissolution rate approximately 10 times faster than that of the electrochemically produced RuO2 and about 100 times faster than that of the thermally produced RuO2. All ruthenium samples demonstrated massive dissolution at potentials exceeding the onset of the OER, which is approximately 1.4 V [44]. 2.2 Evaluation methods and criteria of stability Catalyst stability is also a crucial factor for practical applications that can be significantly influenced by various factors such as electrolyte properties. While most catalysts demonstrate good stability in alkaline media, their performance tends to be unsatisfactory in acidic media. This discrepancy is commercially significant. On the other hand, the method used to fabricate a working electrode, the structure, morphology and chemical properties of catalyst also affect the stability of catalyst. Normally, the active materials directly manufactured on working electrode are more stable compared to the pasted one. And the catalysts that possess a more stable structure, morphology and chemical properties tend to exhibit stable electrocatalytic performance. The two commonly employed stability testing methods are cyclic voltammetry (CV) and chronopotentiometry (CP; potential-time curve) or chronoamperometry (CA; current-time curve) [74–76]. Researchers also proposed various metrics such as Activity-Stability Factor (ASF), Activity-Durability Factor (ADF), and Stability number (S-number) to evaluate the stability of the catalyst [77–79]. However, it remains uncertain whether the stability reported in the laboratory settings can guarantee the long-term functionality on the actual device over several years, as there is no definitive way to determine the stability of the catalyst in real-world application. In spite of this, evaluating the stability of the catalyst in the laboratory remains an indispensable aspect for designing commercially viable catalysts. Recently, a set of techniques including ex-situ and in-situ XRD, TEM, X-ray photoelectron spectroscopy (XPS), and scanning electron microscope (SEM) along with potentiometric studies are employed to investigate what is actually happening or the catalytic mechanism when the structure or composition of the catalyst are changed. These techniques also play roles in monitoring both the structural and compositional stability of catalysts [80–83]. 2.2.1 Chronoamperometry/chronopotentiometry The stability of catalysts can be assessed by using the CA or CP method over a long period at a constant potential or current density. In scientific literatures, CA is more commonly utilized than CP. During CA, the current density varies with time, and is carried out at a potential where the current density approaches 10 mA cm−2. The greater stability of the current density over time, the higher stability of the catalyst. The CP method is conducted at a consistent current density, typically 10 mA cm−2, with the measurement of potential variation. If there is a slight increase in overpotential, it indicates that the catalyst is stable. The stability test is recommended to be carried out at higher current densities (50 or 100 mA cm−2) for the catalysts with strong redox peaks. In order to approach industrialization, some researchers have tested the stability of catalysts at higher current density, such as 50, 100, 300 mA cm−2 and 1 A cm−2. In addition, evaluating stability under elevated temperatures (such as 40, 60, and 80 °C) also serves as a means to simulate real-world industrial applications [84]. 2.2.2 Cyclic voltammetry CV accelerates the degradation of electrocatalysts at a wide voltage window and higher scanning rates (such as 50 or 100 mV s−1). In general, the stability of the catalyst is determined by comparing linear sweep voltammetry (LSV) curves before and after several thousand CV cycles (1000–10000 cycles). If the LSV curve after CV cycles test almost coincides with the initial one or the overpotential slightly increases by less than 10% compared with the original values, it indicates favorable stability of the catalyst [85,86]. 2.2.3 Activity-stability factor The ratio between the rate of di-oxygen production (expressed as current density, J) and the rate of metal dissolution during OER (equivalent dissolution current density, S) proposed by Kim et al. [77] can accurately and effectively evaluate the activity and stability for a given material. Herein, the ASF represents this activity-stability metric by the following formula: A S F = J - S S | η where η represents a constant overpotential. The higher the stability of the OER catalysts, the higher the ASF value. In this method, the measurement of S was conducted utilizing an in-situ Stationary Probe Rotating Disk Electrode (SPRDE) coupled to an ICP-MS. 2.2.4 Activity-durability factor Li et al. [78] put forward a method to evaluate the stability performance of the catalysts by calculating the ratio between the H2 production rate (expressed as exchange current density, j ex) and the catalyst leaching rate (equivalent j corr). The catalyst leaching rate was measured by testing corrosion polarization curves of the catalysts. Similarly, a higher ADF value means better stability. A D F = j e x j c o r r 2.2.5 Stability number Geiger et al. [79] put forward a metric to determine the dissolution processes of various iridium-based oxides, which is defined as the ratio between the amounts of evolved oxygen and dissolved iridium based on a slow potential sweep: S - n u m b e r = n O 2 ( O E R ) n I r ( d i s s o l v e d ) where the production of oxygen was determined by calculating the total charge and the amount of dissolved Ir was tested by a combination of scanning flow cell (SFC) and ICP-MS. A larger S-number indicates better stability. The evaluation criteria do not depend on surface area, loading or active sites involved, providing a reasonable comparison of the stability among various materials. This assessment method is considered applicable and commonly employed to address the critical issue of metal dissolution in the Ru-based catalysts. 2.3 Deactivation mechanism 2.3.1 Deactivation mechanism for HER The stability of Ru-based nanomaterials is still questionable. It is essential to address issues such as metal leaching, irregular aggregation or detachment of active catalysts from the current collector during reaction conditions, especially under harsh conditions towards practical applications (i.e., 80 °C, 6 mol L−1 KOH). The stability of catalyst is closely related to its active site. The deactivation or loss of the active site will decrease the reaction rate and affect the lifespan of the catalyst. Therefore, it is crucial to design and prepare long-lasting catalysts based on an understanding of the deactivation mechanism. As shown in Fig. 5 , ruthenium-based catalysts typically become deactivated in HER reactions through various means: support corrosion, dissolution of the metal atoms, Osterwald ripening, agglomeration, particle detachment and active site poisoning [53,54]. Carbon support, which serves as the most common support will face the issue of corrosion under harsh electrochemical conditions, resulting in the agglomeration and dissolution of metal particles [86]. Similarly, acidic electrolytes can lead to the instability and corrosion of certain metal oxide supports. [87]. Moreover, the weak interaction between support and the loaded active species results in agglomeration and detachment of the active species during the reaction [88]. Harsh environmental conditions often trigger rapid deactivation especially at high temperature where the Ostwald ripening of Ru nanoparticles may occur [89,90]. Ostwald ripening involves the dissolution of small particles, solute directional migration, aggregation and deposition of those species onto large particles in an inhomogeneous particle system. This process is driven by the reduction of interface energy under certain temperature conditions. The agglomeration of nanoparticles to form larger particles is due to adsorption, electric charge and van der Waals force. Specifically, the surface of the nanoparticle may adsorb molecules, ions and proteins in the air, resulting in adsorption forces between the nanoparticles and consequent agglomeration. When the surface of the nanoparticles has opposite charges, it will produce a force that attracts each other of small particles and form larger ones. When nanoparticles are in close proximity, van der Waals forces can also cause the nanoparticles unification. In practical scenarios, the deactivation of catalysts typically arises from multiple factors, and these deactivation mechanisms coexist and exhibit mutual interactions with each other simultaneously. 2.3.2 Deactivation mechanism for OER Although Ru-based materials possess high activity, they face a significant challenge in terms of stability, especially in the OER electrocatalytic process. As the representative Ru-based catalyst for OER, RuO2 is unstable due to the dissolution caused by excessive oxidation at high overpotential above 1.4 V during OER process. The specific reaction can be described as follows: RuO2 + 2H2O → RuO4 (aq) + 4H+ + 4e− (U 0 = 1.39 V vs. RHE) [45,55,56]. Some researchers attribute the over-oxidation of Ru-based catalysts to the oxidation of lattice oxygen in the LOM mechanism, resulting in oxygen vacancies (VO) during OER. The formation of oxygen vacancies is accompanied with the exposure of Ru atoms on the surface, which will be over-oxidized to soluble high valence Ru>4+ (e.g. RuO4) materials. This excessive oxidation of Ru inevitably leads to the collapse of crystal structure and the destruction of stability [90–92]. Metallic Ru exhibits slightly better OER activity compared to RuO2, but its dissolution rate is 2–3 orders of magnitude higher than that of the oxide [93]. By employing SEM images, ICP analysis and electrochemical detection of RuO4, Paoli et al. [92] demonstrated that 90% of metal Ru was corroded from the catalyst electrode during continuous electrolysis at 1.5 V vs. RHE for 15 min, while approximately 30% dissolution was observed in the corresponding oxide during a measurement period lasting 15 hours. Moreover, it is notable that corrosion occurs in both alkaline and acidic electrolytes, and alkali exhibits even greater susceptibility compared to acid [94]. In addition, Mayrhofer et al. [44] conducted detailed comparative studies of the activity and stability of commonly used Ru, RuO2, Ir, and IrO2 in both acidic and alkaline media. The OER activities exhibit the following pattern: IrO2 < RuO2 ≈ Ir < Ru, whereas dissolution degree follows the trends of Ru ≫ Ir > RuO2 ≫ IrO2. It is worth noting that solely taking advantage of the high activity of ruthenium catalysts without improving their stability is impractical. 3 Recent advances in catalytic stability of Ru-based electrocatalysts for HER In recent times, there has been significant progress in the development of HER electrocatalysts using various of Ru-based materials including Ru metal, Ru oxides, Ru phosphides, Ru sulfides, Ru selenides, Ru single metal and other Ru-based complexes. This section summarizes some recent advancements and strategies to improve the stability of Ru-related materials with more detailed classifications. In order to make a more comprehensive understanding and comparison among their stability as HER catalysts, the latest breakthroughs in improving the stability of Ru-based catalysts for HER are summarized in Table 1 . 3.1 Incorporation of conductive substrate Most of the reported Ru-based catalysts for HER are in the formation of powders, necessitating the use of adhesives during catalytic electrodes preparation, which seriously impacts their conductivity and stability. In addition, irreversible agglomeration of powdered Ru nanoparticles is more likely to occur, leading to reduced utilization and catalytic performance [86,95]. Therefore, it would be beneficial to grow catalysts directly on a conductive substrate, such as carbon cloth (CC), nickel foam (NF), graphene aerogel and carbon nanofibers (CNF). This approach would strengthen both adhesion force and conductivity between the catalysts and the substrate, thereby improving activity and stability [96–101]. You et al. [96] synthesized Ru nanoparticles on carbon cloth using a facile glycerol-assisted solvothermal strategy (Ru-G/CC), which exhibited an enhanced HER performance with an overpotential of only 40 mV@10 mA cm−2 and maintained stability without significant changes in current density over a period of 100 h (Figs. 6(a)–(d) ). DFT calculations indicate that the free energy of H* (ΔG H*) at the active sites of Ru-G/CC (–0.20 eV) is lower than those of Ru (101) (–0.31 eV) and Pt (111) (–0.25 eV), owing to the amorphous/crystalline Ru structure decorated on CC. The electron transfer from Ru to the adsorbed H*, revealed by electron localized function (ELF) as well as the calculated density of states (DOS), led to the promoted performance for HER (Figs. 6(e) and (f)). By employing a facile and scalable dip coating and heating method, Zhang et al. [97] developed a hybrid catalyst consisting of RuO2 and NiO fabricated onto NF which exhibited excellent performance and required merely 18 mV overpotential to reach 10 mA cm−2. Moreover, the RuO2-NiO/NF catalyst exhibits a long-term electrolysis in cycling test for 20 h at 100 mA cm−2 with no obvious change in the morphology and the chemical states. The dissociation barrier of H2O at the RuO2-NiO interface is reduced to 0.09 eV, indicating the promotional effect of NiO on H2O dissociation and thus accelerating the production of H*. Moreover, the RuO2-NiO hybrid shows a lower ΔG H* compared to NiO and RuO2, suggesting that the formed interface can modulate the adsorption of H* and improve its HER activity. Tiny RuO2 was uniformly dispersed on NiO, enhancing the utilization efficiency of NiO. RuO2-NiO/NF was prepared by using formation of NiO from the support with excellent structural stability. The NiRu-based metal-organic framework (MOF) nanosheet arrays on a Ni foam substrate (NiRu-MOF/NF) were obtained by solvothermal reaction of Ni(NO3)2, RuCl3, 1,4-benzenedicarboxylic acid (BDC), and triethylenediamine (TED) in the presence of a Ni foam substrate [98]. The optimized catalysts demonstrated decent catalytic performance for HER in alkaline conditions, requiring an overpotential of 51 mV at 10 mA cm−2 and exhibiting negligible decay during stability tests with a period of 24 h test at 30 mA cm−2. The excellent stability was ascribed to the enhanced contact between the electrocatalysts with MOF structure and electrode substrate by in-situ growth of NiRu-MOF on the backbone of the conductive NF. Additionally, the remarkable water stability of MOF structure also significantly contributed to its catalytic stability. Nitrogen‐doped graphene aerogel (N‐GA) also exhibits significant advantages as a support material of ultrafine Ru nanocrystals (Ru‐NCs). This nanocomposites catalyst synthesized by annealing 3D reduced graphene oxide, ruthenium chloride and polyallylamine, demonstrates remarkable performance, requiring overpotentials of only 52 and 36 mV to achieve a current density of 10 mA cm−2 in 1 mol L−1 HClO4 and 1 mol L−1 KOH electrolytes for HER process, respectively. The synergy effect between Ru and the highly conductive substrate, as well as the anchoring effect of the N atom contributed to the excellent stability of Ru‐NCs/N‐GA [99]. Amorphous phosphatized ruthenium-iron bimetallic nanoclusters supported on graphitized carbon nanofibers (RuFeP-NCs/CNF) synthesized by wet chemical reduction using sodium borohydride and subsequent phosphorization were reported to exhibit outstanding Pt-like HER performance with low overpotentials of 66 and 16.0 mV to deliver a current density of 10 mA cm−2 in acidic and alkaline environments, respectively [100]. In addition, it displays exceptional stability by effectively catalyzing the HER for a minimum of 100 h with little performance attenuation and no aggregation and structural changes are observed in the clusters after the long-term stability tests (Figs. 7(a)–(e) ). RuFeP-NCs/CNF exhibits a small ΔG H* value of –0.11 eV, which is comparable to that of Pt (111) surface (−0.09 eV), explanationing for its Pt-like HER activity. Moreover, the ΔG OH*+H* value of RuFeP-NCs/CNF is merely –0.02 eV, suggesting a negligible barrier of water dissociation and H2 formation (Figs. 7(f)–(h)). The intimate interaction and facile electron transport between the RuFeP-NCs and CNF can firmly immobilize clusters and endow an enhanced stability during the HER process. N-doped carbon nanofibers were reported as a substrate by Zhou et al. [101] to anchor Ru nanoclusters with Mott-Schottky effect. The seamless attachment of Ru nanoclusters on the substrate can facilitate structural stability by preventing the active sites from unfavorable migration, aggregation, and detachment. Ru@N-CNFs presented low overpotentials of 16 and 17 mV at 10 mA cm−2 and nearly 20 h of stability tests in acidic and alkaline electrolytes, respectively. The Ru@NC heterostructure exhibits a ΔG H* value of –0.11 eV, which is smaller than that of the pristine Ru (–0.39 eV). Therefore, the formation of Ru@NC Schottky heterojunction can reduce the reaction energy barrier, thereby demonstrating its promising HER performance. It is evident that incorporating a conductive substrate significantly improves the stability of catalyst. The advantage lies in its direct utilization as a self-supporting electrode ensuring good mechanical stability and straightforward preparation process. However, the limited availability of suitable conductive substrates for use in acidic media poses significant challenges to design such catalysts. Therefore, further development of novel, stable and self-supporting conductive substrates is imperative. 3.2 Construction of core-shell structures Although Ru nanoparticles possess high activity, drawbacks such as agglomeration, leaching, oxidation and inactivation apparently compromise their stability. Among various strategies to overcome these drawbacks, introducing a protective layer on the surface of Ru nanoparticles to construct a core-shell structure becomes one of the effective solutions [102–105]. Ruthenium phosphides nanoparticles encapsulated within N,P-codoped hollow carbon nanospheres, which were synthesized by the confined phosphorization reaction between the aniline-pyrrole copolymer and guest RuP x exhibited good electrocatalytic HER activity in a wide pH range. Moreover, the shell could protect the active species from corrosion in the electrolyte so that the catalyst maintained a durability of 10 h [102]. Similarly, the amorphous turbostratic-phased carbon nitride (t-CN x ) layer was utilized not only as the modulator of electronic structures to trigger lower d-band position of Ru for the enhanced activity, but also as the protective layer to avoid the Ru aggregation/bleaching on multi-walled carbon nanotubes for improved stability [103]. Feng et al. [104] encapsulated Ru nanoparticle into an oxyfullerene-like carbon cage embellished with single-atomic RuN x species to construct a core-shell architecture by the coordination between Ru3+ ions and fullerenol in the presence of melamine and then thermal pyrolysis under Ar/H2 atmosphere (Figs. 8(a)–(f) ). This unique structure enables the catalyst to exhibit exceptional catalytic activity for HER, demonstrating continuously performance for at least 100 hours under both acidic and basic conditions. The DOS of RuNP@RuN4-FC possessed a lower d-band center of –3.75 eV compared to that of RuNP-RuN4/PC (–2.78 eV), indicating a weaker but more favorable hydrogen bonding strength. Additionally, the optimal hydrogen adsorption was calculated with a ΔG H* of –0.02 eV for RuNP@RuN4-FC (Figs. 8(g)–(i)). The protective coating on the surface is not limited to carbon-based materials, other materials can also be utilized. Ru nanoparticles encapsulated in a sulfur-modulated molybdenum oxide (MoO(S)3) shell were reported to show 63 and 30 mV overpotentials at a current density of 10 mA cm−2 in acidic and alkaline media, respectively, which were synthesized by an oil-in-water strategy in a one-step hydrothermal reaction followed by annealing at 600 °C [105]. The catalyst showed excellent stability not only after undergoing 3000 CV cycles, but also operating in overall water-splitting devices with slightly decreased current density during 24 hours. This remarkable durability can be attributed to the encapsulation and protection of the active center Ru by the MoO(S)3 shell, which prevents erosion and electrochemical oxidation of Ru. The construction of core-shell structure represents a straightforward method, which can effectively address issues like particle agglomeration, dissolution and detachment. However, the preparation process is relatively complicated. The selection of an appropriate shell material plays a crucial rule; it should possess certain flexibility and mechanical strength, yet not impeding access to catalytic sites or hindering electrolyte permeation. 3.3 Formation of embedded structures As previously mentioned, the weak interaction between carbon support and metal, particularly in case of carbon as the most common support material, contributes to the insufficient stability of catalyst. Therefore, embedding Ru-based nanoparticles into the support becomes one of the effective solutions. Ruthenium nanoparticles embedded in N-doped mesoporous carbon nanospheres, S-doped RuP nanoparticles embedded in a N, P, and S-co-doped carbon sheet and heterostructured Ru-Ru2P nanoparticles embedded in the N, P-co-doped carbon nanofibers have been reported to exhibit good activity and stability [106–108]. Ru nanoparticles can be embedded within a nitrogenated holey two-dimensional carbon structure (Ru@C2N), which consists of uniformly distributed 0.83-nm-sized holes with six nitrogen atoms surrounding each hole to anchor Ru sites [109]. The Ru@C2N electrocatalyst exhibits small overpotentials at 10 mA cm−2 (13.5 mV in 0.5 mol L−1 H2SO4 solution; 17.0 mV in 1.0 mol L−1 KOH solution) as well as superior stability (10000 cycles) in both acidic and alkaline media (Figs. 9(a)–(d) ). The high electrocatalytic activity of Ru@C2N originates from the optimal hydrogen binding energy, as revealed by DFT calculations. The RuMo-nanoalloys embedded in hexagonal 2D porous carbon (2DPC-RuMo) exhibit promising performance for HER with a small overpotential of 18 mV. These nanoalloys were synthesized by a combination of hard-templating synthesis and anion-exchange processes, enabling process control over both the geometric hexagonal morphology and alloy constitution [110]. This catalyst also shows robust stability with a negligible activity decay after undergoing 2000 cycles and 120 h (Figs. 9(e)–(g)). The introduction of N into C and Mo atoms into Ru lattices can reduce the energy barrier for the HER by inducing electron accumulation/depletion regions at the hetero-surface. The excellent electrocatalytic stability of the 2DPC-RuMo heterostructure can be attributed to the integration of stable RuMo nanoalloy particles within conductive N-rich hexagonal 2DPC nanosheets without any observable alternations in morphology, composition, or particle agglomeration. Li et al. [111] proposed that P, Mo dual doped Ru ultrasmall nanoparticles embedded in P-doped porous carbon are efficient for HER. The P,Mo-Ru@PC catalyst achieves a low overpotential of 21 mV at 10 mA cm−2 and presents excellent durability with an increase in overpotential of only 2 mV after 5000 cycles. The introduction of Mo and P atoms into Ru lattices triggers the in-situ electron donation from Ru to Mo and P, resulting in the optimized energies for water dissociation and near-optimal adsorption of hydrogen on P,Mo-Ru@PC catalyst and thereby reducing the energy barrier for the HER. It is evident that embedding Ru active species into carbon-based support serves as an effective approach to improve the stability of catalyst. Embedding into supports are not limited to carbon-based materials, but also applicable to other types of supports. Yu et al. [112] have reported that confining ultrafine Ru clusters into TiO2 lattice frameworks can both enhance the stability and intrinsic activity of Ru by a lattice-confined approach. Moreover, this catalyst delivers remarkable HER performance even under harsh conditions (80 °C and 6 mol L−1 KOH) with a small overpotential of 116 mV at 800 mA cm−2, and long-time stability for 200-h continuous HER at 300 mA cm−2 through the effective confinement of Ru (Figs. 9(h) and 9(i)). As disclosed by both experimental and computational results, the interaction between Ru and TiO2 can be enhanced by the lattice-confined strategy, which promotes the electron transfer from Ru to TiO2 and thus strongly stabilize Ru to avoid the dissociation and aggregation of Ru during the stability test. An electrocatalyst of ultra-small Ru nanoparticles embedded on Fe-Ni(OH)2 nanosheets in-situ grown on a Ni foam (RuFe@NF) was prepared by a one-step immersion method. Remarkably, this catalyst only requires an overpotential of 28 mV to achieve a current density of 10 mA cm−2 towards the HER [113]. Moreover, the RuFe@NF based electrolytic cell exhibits ultra-long stability over 680 h at 10 mA cm cm−2 and even at higher current density up to 100 mA cm−2. The excellent catalytic performance of the catalyst can be attributed primarily to the special structure of Ru nanoparticles embedded in Fe-Ni(OH)2 nanosheets. Anchoring the particles with this method can enhance their stability on the support. However, characterizing the structure to confirm that the particles are embedded in the support remains challenging. Moreover, only exposed part of the particle serves as catalytic sites, reducing atomic utilization. There is no obvious rule in the selection of the support that can construct the embedded structure, necessitating the development of a universal method for such constructions. 3.4 Enhancement of the metal-support interaction Supported metal catalysts play an important role in heterogeneous catalytic reactions due to their flexibility and adjustability. While carbon support is a commonly used support, the interaction between carbon and the loaded active species is normally weak, leading to the aggregation or even detachment of the active species during the reaction process and resulting in insufficient stability [114–117]. To address this issue, researchers have developed oxygen-coordinated single-atom iron sites (Fe-O4) decorated carbon nanotubes with abundant vacancies as the support to stabilize Ru clusters. The synthesis of these clusters involved an iron-induced functionalization strategy, followed by subsequent electrochemical reduction. This innovative catalyst demonstrated an overpotential of only 64 mV at a current density of 10 mA cm−2 and a durability of 20 h in 0.5 mol L−1 H2SO4 solution [118]. The synergistic combination of vacancy defects and iron single-atom sites not only promotes the charge redistribution of Ru clusters and optimizes the adsorption energy of H*, but also enhances the metal-support interaction at the interfaces of Ru cluster-support, leading to superior structural and catalytic stability, thereby resulting in remarkable HER performance. Another study by Li et al. [119] utilized C60 fullerenol (C60(OH)24) to stabilize, disperse, and activate Ru nanoparticles through Ru–O–C60 connections, which were synthesized by integrating wet chemistry reactions, freeze-dried techniques, and pyrolysis processes. The anchoring and confinement effects of C60 fullerenols allow for dense and uniform dispersion of Ru nanoparticles on the C60 substrate. The synthesized Ru-OC60-300 showed an ultra-small overpotential of 4.6 mV at 10 mA cm−2 along with excellent performance during 50 h chronopotentiometry test that showed only a slightly increase in overpotential by 13.3 mV (Figs. 10(a)–(e) ). The high electronegativity of the O atom and the electron-withdrawing property of C60 electrons trigger electron transferring from Ru NPs to C60 through O atoms, resulting in the strong interaction between Ru NP and C60. It optimizes the HER kinetics of Ru-OC60 through the strong H2O adsorption, rapid H2O dissociation, and appropriate H* adsorption. In addition, a series of supported metal catalysts with strong metal-support interactions (SMSI) have been developed as alternatives to the carbon support. The ideal support in electrocatalysis should possess good electrical conductivity. It serves not only as a physical support for anchoring the active site, but also has strong interaction with the active species, which can induce the charge redistribution on the metal-support interface and stabilize the supported metal [120]. Irregularly curved Ru nanorods supported on porous and hollow titanium nitride nanosheet assembled tubes (Ru NRs/TiN) exhibited excellent activity with an overpotential of only 25 mV at a current density of 10 mA cm−2 [121]. No degradation in performance is observed after 10000 CV cycles, while Ru NRs/C experienced an irreversible performance loss. The CP measurement further reflected the high stability of Ru NRs/TiN, which showed an attenuation of only 41 mV after a 50-h test compared to reductions of 115 and 135 mV for Ru NRs/C and Pt/C, respectively. Unlike Ru NRs/C catalyst, Ru particles aggregate to a certain extent, while no significant change is observed in the morphology of Ru NRs/TiN catalyst. The SMSI between Ru nanorods and TiN can be confirmed by the density functional theory calculations. The significant charge redistribution at the Ru-TiN interface implies the strong interaction between the supported Ru and TiN slab (Figs. 10(f)–(j)). Molybdenum carbide (Mo2C) has been widely utilized as a support for active metal catalysts in various reactions due to its excellent chemical, mechanical and thermal stability. However, the weak bonding between the active metal catalyst and molybdenum carbide leads to irreversible agglomeration and dissolution loss during the catalytic process, resulting in inadequate stability [122,123]. To address this issue, Yu et al. [124] regulated the bonding between Ru single atoms and Mo2C nanosheets (Ru SAs/N-Mo2C NSs) substrate by introducing nitrogen doping of Mo2C through the anti-Ostwald ripening. The anti-Ostwald ripening method can enhance the interaction between the single atom and the support, rendering a more stable dispersion of Ru at atomic level. The catalyst showed superior catalytic stability for HER in 1.0 mol L−1 KOH, with a decay of only 3.7% over 8 h and a 6.3% decay over 60 h at an overpotential of 100 mV. In addition, the catalyst demonstrated remarkable catalytic performance over 60 h at overpotentials of and 230 mV, achieving high current densities of approximately 80 and 150 mA cm−2, respectively. The morphology remains almost unchanged and Ru loading amount verifies the enhanced electrocatalytic stability, which can be contributed to the strong interactions between the Ru SAs and N-Mo2C NSs substrate. Theoretical calculations reveal that the synergistical acceleration of H2O dissociation, combined with optimized H* adsorption strength in Mo-Ru interface, facilitates enhanced HER activity of Ru SAs/N-Mo2C NSs. The confinement effect and strong interaction between the surface hydroxyl group and single atoms make layered metal hydroxides (LMHs) promising supports with high-loading capacity of single atomic metal [125,126]. Chen et al. [127] synthesized nickel hydroxide ultrathin nanoribbons on nickel foam with atomically dispersed Ru atoms, which exhibited an overpotential of 16 mV at a current density of 10 mA cm−2. The catalytic stability of R-NiRu was confirmed through extensive testing, including 5000 cycles of CV cycling test and continuous working for 12 h. The exceptional stability can be attributed to the bonding and anchoring effect between abundant surface hydroxyl groups in the nanoribbon structure and the Ru atoms. The WO3 matrix can also support single atomic Ru, which exhibits overpotentials of 28.0 mV in acidic media, 17.6 mV in alkaline media, and 83.0 mV in neutral media to achieve a current density of 10 mA cm−2 as well as robust stability for 100 h at ampere-level current density [128]. The strong electronic interaction between Ru and WO3 can be achieved by electron transfer from W sites to nearby Ru site through a bridging O atom. This robust interaction plays a vital role in preventing Ru sites from agglomeration and achieving moderate H* adsorption, hence significantly contributing to its outstanding performance. The synthesis of catalysts with enhanced metal-support interaction is generally expedient. Especially, the combination of a single Ru atom onto supports not only reduce the ruthenium usage, but also improves its atomic utilization, making it one of the most promising approaches for industrialization. Generally, supports functionalized with specific groups can enhance metal-support interaction. Carbon-based support is commonly employed; however, it exhibits stability issues at high applied voltages. Other supports suffer from low conductivity, which restricts their catalytic performance. Therefore, developing highly conductive and stable supports in acidic or basic electrolytes under high external voltages becomes crucial. 3.5 Phase engineering Crystal phase engineering can also significantly enhance electrochemical stability because of the robustness of the crystal structure with various bond lengths and coordination numbers [129]. The synthesis of Ru-based nanomaterials with face-centered-cubic structure (fcc) has posed a significant challenge due to their high systemic energy. Zhang et al. [130] synthesized fcc-structured RuCu hollow urchin-like nanospheres (fcc-RuCu HUNSs) by a wet-chemical strategy. The fcc-RuCu HUNSs only require an overpotential of 26 mV to achieve the current density of 10 mA cm−2 in 1 mol L−1 KOH for HER, which efficiently surpasses that observed in materials with hexagonal close-packed (hcp) phase. Moreover, the stability exhibited by fcc phase outperforms its hcp counterpart. In the study conducted by Li et al. [131], Ru nanodendrimers modified by MoO x with pure fcc phase (MoO x -Ru fcc) were synthesized via a colloidal method. The similar catalysts with hcp phase can be obtained by undergoing a phase transformation through high-temperature annealing in an inert Ar atmosphere. MoO x -Ru fcc exhibited significantly higher activity and greater stability in catalyzing HER compared to the MoO x -Ru hcp catalyst. The current of MoO x -Ru fcc experienced a minimal decrease of only 6.6% after 20000 s, while the activity of MoO x -Ru hcp dropped by 23.5% at 10000 s, indicating significantly higher stability of fcc phase (Figs. 11(a)–(c) ). With the modification effect of MoO x , ɛ d of the (111) facet of Ru with fcc phase was reduced to –2.70 eV, resulting in the lowest adsorption energy of protons and hydroxyl groups. The moderate adsorption energies of H* and OH* on MoO x -Ru fcc (ΔG H* = –0.30 eV; ΔG OH* = –0.07 eV) further confirmed the superior HER capability of the fcc phase Ru (Figs. 11(d)–(i)). Kim et al. [132] observed the formation of a novel phase of ruthenium carbide (RuC X , X < 1) on the surface of the Ru nanocrystal during exothermic phase-transition from cubic-close-packed (ccp) to hcp structure. The ccp{111} and hcp{002} are considered as close-packed planes, which exhibit stacking sequences of ABC and ABAB, respectively, along with their corresponding packing directions. Consequently, the ccp-to-hcp phase-transition can be understood as the formation of the Ruhcp(002) plane due to the slippage of the Ruccp(111) plane. During the phase-transition, the RuC X phase can be formed. According to the HER activity and stability tests in alkaline media, catalysts with RuC X phase on the surface exhibited superior performance compared to those with ccp and hcp phases, delivering an overpotential 97 mV at a current density of 50 mA cm−2 and minimal degradation of operating potential at 10 mA cm−2 over a period of 12 h. DFT calculations predict that the local heterogeneity of the outermost RuC X surface and high coverage of atomic-level interfaces promote the bifunctional HER mechanism by providing catalytic sites for both H* adsorption and facile water dissociation (Figs. 12(a)–(g) ). Phase transformation is an effective approach for selecting the stable phase structure of ruthenium and improving the intrinsic stability. The fcc phase structure is relatively more stable for ruthenium. However, this method typically involves high temperatures to induce phase transition, which may lead to Osterwald ripening and agglomeration, resulting in larger particles that could potentially compromise the activity and stability of catalysts. Therefore, it is imperative to explore alternative methods for achieving phase transition at lower temperatures. 3.6 Modulations of adsorption and desorption behavior of intermediates Ru is considered as a feasible electrocatalyst for hydrogen evolution due to its rapid dissociation of water in alkaline electrolytes. However, the strong affinity of Ru towards adsorbing hydroxyl (OHad) can lead to the poisoning of active sites, thereby impacting the activity and stability of the catalyst [124,133,134]. The selenium-enriched RuSe2 (Ru x Se) nanocrystals were prepared by a simple hydrothermal reaction followed by thermal annealing process, exhibiting remarkable performance as a highly efficient HER electrocatalyst in alkaline media with a low overpotential of 45 mV and a high stability of 18 h [135]. The excessive Se would reduce the energy barrier for water dissociation and weaken the dependence on the Ru sites for OH* adsorption while have a negligible effect on the energy required for hydrogen adsorption. Study by Chen et al. [136] involving depositing Ru nanoparticles on strong reductive Ti(III) oxide (r-TiO2) with oxygen vacancies, resulting in a minimal overpotential of merely 15 mV to deliver a current density of 10 mA cm−2 while experiencing only slight degradation of HER activity over 10 h. DFT calculations indicate that the electron transfer occurs from Ru clusters to the pristine TiO2(110) in the Ru(0001)/TiO2, resulting in the positively charged Ru clusters. By contrast, for the Ru(0001)/r-TiO2, there is an opposite electron transfer from the partially reduced TiO2(110) to the Ru clusters, leading to the negatively charged Ru. Moreover, the reduction of TiO2 can promote water dissociation and weaken the adsorption strength of OH, thereby promoting the continuous water dissociation and hydrogen production (Figs. 13(a)–(f) ). The synergistic effect of Ru and RuO2 interfaces, which was achieved through a precipitation method followed by annealing under an oxygen-poor environment and/or in-situ electrochemical reduction, was reported to enhance water adsorption and dissociation as well as optimize OH binding energy [137]. The formed Ru/RuO2 interfaces presented superior HER performance, achieving 10 mA cm−2 with an overpotential of 17 mV, and maintained stability for up to 300 h of testing at the same current density without any noticeable degradation. Zhang et al. [138] regulated the strong adsorption between Ru and OHad by introducing SnO2 to perform competitive adsorption on OHad. This approach helps to moderate the poisoning of Ru active site. Theoretical calculation revealed that the binding energy of OHad on Ru sites (1.06 eV) exhibits a weaker interaction with OHad than that of Sn sites (0.36 eV) for the Ru SAs/SnO2, which indicated a preference of OH adsorption on SnO2. As a consequence, the presence of Ru SAs-SnO2/C exhibited a low overpotential of 17 mV at 10 mA cm−2 and an excellent stability after 3000 CV cycles and continuous testing for 27 h. Therefore, the competitive adsorption of OHad between Ru and SnO2 facilitated the OHad transfer process, which effectively alleviated the poisoning of Ru sites and accelerated the regeneration of Ru active sites (Figs. 14(a)–(e) ). Regulating the adsorption and desorption of intermediates is an effective way to mitigate catalytic site poisoning. In alkaline media, the strong hydroxyl adsorption on Ru sites can lead to Ru poisoning, thus adjusting the adsorption strength of hydroxyl on active sites can enhance the catalytic performance. Introducing another catalytic site for adsorption of hydroxyl is also beneficial. However, this approach primarily focuses on hydroxyl poisoning, with limited reports on other ions. Considering practical applications or seawater or wastewater electrolysis, where purity of the electrolyte is relatively low, competitive adsorption with other ions on the catalyst surface becomes a concern. Therefore, further investigations are expected to regulate the adsorption and desorption of intermediates to prevent other ions from poisoning catalytic sites. In summary, according to the recent advancements on the stability of Ru-based catalysts for HER, the strategies for improving the stability can be divided into the following six types: incorporation of conductive substrate, construction of core-shell structures, formation of embedded structures, enhancement of the metal-support interaction, phase engineering, and modulations of adsorption and desorption behavior of intermediates (Fig. 15 ). The timeline shows that every design strategy is out of date. The deactivation mechanisms of various catalysts for HER can be attributed to support corrosion, dissolution of the metal atoms, Osterwald ripening, agglomeration, particle detachment and active site poisoning. Generally speaking, the poor stability is not dependent on a single factor but rather multiple ones, which even trigger a cascading effect. The design of catalysts necessitates simultaneous suppression of various causes of inactivation; hence, the aforementioned strategies can be employed in a cross-disciplinary manner. Therefore, the principles underlying the design process for stable Ru-based catalyst in HER lie in selecting Ru particles and supports with stable phase structures, immobilizing Ru on the support, optimizing the adsorption of the intermediate by modulating the electronic structure of the Ru, and culminating an efficient and stable Ru-based catalyst. 4 Recent advances on catalytic stability of Ru-based electrocatalysts for OER Currently, Ru-based materials including Ru metal, Ru oxides, Ru-based perovskites, Ru-based pyrochlores and other Ru-based hybrids have been widely designed and synthesized as OER electrocatalysts. As mentioned, inadequate stability remains the prominent problem of RuO2 in acidic electrolytes, which is mainly ascribed to the oxidation of Ru atoms resulting in soluble high-valence states. Moreover, the oxidation-induced collapse and loss of the active species can lead to the observed decayed stability. In principle, the stability of Ru-based catalysts can be effectively improved by stabilizing or preventing the formation of the high-valence states of Ru and improving the stability of crystal structure. This section summarizes some recent advances and strategies to improve the stability of Ru-related materials with more detailed classifications. In order to provide a more comprehensive understanding and comparison among different samples used as Ru-based OER catalysts, Table 2 summarizes recent advances in their stability. 4.1 Hybridization of Ru-based catalysts with iridium Ir-based catalysts exhibit superior stability compared to Ru-based catalysts. Incorporating Ir and Ru together is one of the effective ways to improve the stability of Ru-based catalysts [148–150]. Shan et al. [148] reported a heterostructured OER electrocatalyst with a highly strained ruthenium core and a partially oxidized iridium shell via a sequential polyol method. The as-prepared Ru@IrO x nanostructure can offer an overpotential of 282 mV to deliver 10 mA cm−2 together with an activity retention of 90% over a 24 h test in acidic environments. The enhanced electrocatalytic activity of the Ru@IrO x core-shell nanocrystals were attributed to the favorable surface valence states due to the charge redistribution at the metal core-oxide shell heterojunction. The excellent catalytic durability was ascribed to both stable chemical states and core-shell nanostructure. Specifically, these factors prevented the formation of the dissolvable high-valent intermediate species during the OER process and core-shell structure provides effective protection over active Ru sites from electrolyte loss. The intermetallic Ru1Ir1O x nanocatalyst was synthesized by He et al. [149], which exhibited a low overpotential of 204 mV (10 mA cm−2) and continuous OER electrolysis of at least 110 h (100 mA cm−2) with negligible changes in acidic electrolyte. Compared to RuO x , Ru1Ir1O x exhibited a significantly higher S-number (1.13 × 106 vs. 1.99 × 103) at 10 mA cm−2 after 20 h OER test. The d-band center of –1.68 eV and charge density difference in Ru1Ir1O x confirmed the tailored electronic structures of Ir sites and Ru sites by charge redistribution. The values of ΔG of various intermediates suggested that the intermetallic Ru1Ir1O x possessed the optimal adsorption energy of the intermediates for acidic OER. The stability was enhanced owing to the synergistic effects between Ru and Ir atoms by charge redistribution and structural enhancement (Figs. 16(a)–(g) ). Another efficient catalyst in acid was reported as well, known as solid-solution Ru-Ir nanosized-coral (RuIr-NC) consisting of 3 nm-thick sheets with only 6 wt% Ir [150]. RuIr-NC required only 165 mV to achieve 10 mA cm−2 and showed a lifetime of 122 h under a constant current density of 1 mA cm−2. The coral-like structure, characterized by exposed {0001} facets with the lowest surface energy of hcp structures and excellent resistance to oxidation, contributes to its high-performance by inhibiting the formation of the dissolvable metal oxides. The original intention behind the combination of ruthenium with iridium is to take advantage of the remarkable activity of ruthenium coupled with the exceptional stability of iridium. The ruthenium oxide and iridium oxide share a similar rutile crystal structure with lattice matching, enabling a stable catalyst formation. However, there remains room for improvement in terms of the stability of iridium. Despite this limitation, in view of its widespread usage in acidic media of iridium, this approach remains significant. By employing specialized structural and morphological designs, the synergistic effects of Ir and Ru can be achieved. 4.2 Construction of core-shell structures Introducing a protective layer on its surface and construct a core-shell structure proves to be an effective way to encapsulate and protect Ru-based cores [151–154]. One of the most common pathways is to wrap carbon. Cui et al. [151] enhanced the activity and stability of Ru nanoparticles by encapsulating them into controllable oxidation of graphene (RuNi2©G-250) by a hard template impregnation method. An overpotential of only 227 mV and a lifetime of 24 h at 10 mA cm−2 was achieved in acidic electrolyte. Inductively coupled plasma optical emission spectroscopy (ICP-OES) indicated the Ru dissolution percentage relative to the initial mass loading was approximately 1.5% and Ru K-edge indicated the electronic structure and valence state of Ru in RuNi2©G-250 sample after stability test almost had no change compared with the fresh catalyst. DFT calculations reveal that the interfacial Ru centers between RuO2 and graphene can disrupt the conventional scaling relationships governing the free energies of HOO* and HO*, leading to a modification in the rate-determining step and a reduction in energy barrier. Consequently, the enhanced intrinsic OER activity of RuO2 was observed. Additionally, charge transfer from the graphene to RuO2 implied that the graphene could serve as an electron reservoir to donate electrons to RuO2 surface, thereby enhancing the resistance against the over-oxidation and corrosion for RuO2 (Figs. 17(a)–(h) ). Ultrathin nitrogen-doped carbon was reported by Yan et al. [152] to protect oxygen-vacancy (Vo·) rich RuO2 nanoparticles on carbon nanotubes (CNTs). NC@Vo·-RuO2/CNTs-350 required an overpotential of 170.0 mV to achieve 10.0 mA cm−2 and showed a stability of 900 h without any distinguishable activity loss. The DFT calculations indicate that the strong electronic coupling between the NC/CNTs and the RuO2 NPs, thereby enhancing the catalytic activity of RuO2. The presence of Vo· can strengthen the electronic coupling and improve both the stabilities of lattice oxygen and surface Ru during the OER processes. Additionally, the ultrathin NC shell serves as a protective layer against the chemical corrosion of RuO2 NPs during the OER. This catalyst demonstrates an impressive S-number value of approximately 4.5 × 106. The stability of Ru oxides surpasses that of metallic Ru, thus enabling the effective utilization of oxide species as a protective shell. Wang et al. [153] reported a novel architecture with a core of ultrathin metallic RuRh nanosheets and a shell of RuO2/RhO2 oxides as electrocatalysts toward the OER. The RuRh@(RuRh)O2 core/shell nanosheets can achieve a 245 mV overpotential at 10 mA cm−2 and maintain a current density of 5 mA cm−2 for 8000 s. DFT calculations unravel the superior OER performance based on the electro-activation by the surface oxidation layer. The core RuRh preserves the high electrical conductivity for electron transfer towards the surface, while the shell RuO2 layer further pumps the electrons towards the adsorbates to efficiently, facilitating the consecutive reactions for OER. The RuO2/RhO2 oxides shell protects the normally labile RuRh NSs core against dissolution. Harzandi et al. [154] achieved similar protection by safeguard the metallic NiRu-core through employing oxidized Ru-shell with Ni single atoms, resulting in an overpotential of 184 mV and a lifetime of 30 h at 10 mA cm−2. The extensive Ni leaching from the catalyst surface through hot acid treatment formed the stabilized metal vacancies, leading to increased interaction with adsorbates via acid-base O–O bond formation and shorter Ru–O bond distances and thereby enhancing the catalytic activity and protecting the Ru material against dissolution. Constructing a core-shell structure to encapsulate and safeguard ruthenium represent effective strategies for inhibiting the over-oxidation and dissolution of ruthenium. Similar to HER, the fabrication process of this structure is relatively intricate. The selection of an appropriate shell is crucial. It is imperative that the chosen shell exhibits both flexibility and mechanical strength, while also allows electrolyte penetration without obstructing access to catalytic sites. In particular, in acidic media, there is a scarcity of suitable materials for constructing shells. Therefore, developing novel shell materials that possess enhanced stable without compromising catalytic activity becomes pivotal. 4.3 Incorporation of stable support A viable approach to improve the dissolution resistance of Ru-based OER catalysts is anchoring the Ru active sites in a conductive matrix, thereby avoiding the dissolution of Ru [155–162]. The graphdiyne (GDY) serving as support material can enhance the activity and stability of Ru atom catalyst [155]. The incorporation of GDY in Ru/GDY has an overpotential of 531 mV to reach 10 mA cm−2 in 0.5 mol L−1 H2SO4 with only minimal degradation observed during 2000 CV cycles and a 54-h chronoamperometric test. The superior stability can be ascribed to the robust nature of GDY skeleton and the strong coupling between the individually anchored Ru atoms and GDY. DFT calculations indicate that the strong p–d coupling between Ru atoms and adjacent C atoms produces an intrinsic electron compensation library to stabilize the high oxidation of anchored Ru. Carbon nitride-derived N-C can also serve as an efficient matrix to support single-atomic Ru [156]. The single-atom Ru-N-C catalyst with atomically anchored Ru1-N4 site delivered an overpotential of 267 mV at a current density of 10 mA cm−2 and a dissolution ratio of 5% after 30-h operation in acidic environment. The combination of in-situ XAFS and FTIR revealed the dynamic pre-adsorption of O to give the O-Ru1-N4 structure with more charge donations of Ru under operando conditions. Theoretical calculations demonstrated that this newly formed O-Ru1-N4 site delivered a low barrier of O–O coupling, facilitating the formation of the OOH* intermediate. A metal organic framework (MOF) derived carbon (CoNC) was reported by Xu et al. [157] to support ruthenium-iridium (RuIr) nanocrystals, which showed an overpotential of 223 mV at 10 mA cm−2 during continuous OER electrolysis lasting up to 40 h with a S-number of 1.01 × 105. DFT calculations revealed that RuIr nanocrystals could lower the potential barrier of the rate determining step. Moreover, the CoNC support with the pyrrolic-N sites endowed homogeneous dispersion and robust immobilization of RuIr catalysts, thereby enhancing their resistance to dissolution during the acidic OER (Figs. 18(a)–(f) ). Conventional carbon supports are most widely deployed in electrocatalysis, but they suffer from severe oxidation under the high OER operation voltage. In addition to carbon-based supports, metal oxides, layered double hydroxides (LDH) and MOF supports are regarded as the promising candidates. It was reported by Wang et al. [158] that the oxygen vacancies were enriched by dispersing RuO2 over defective TiO2 (D-TiO2), which could modulate the electronic structure of Ru and enhance the conductivity of the catalyst. As a result, the as-prepared RuO2/D-TiO2 catalyst exhibited a low overpotential of 180 mV at 10 mA cm−2 and a long lifetime above 100 h at 200 mA cm−2 with a leaching of ~17.30 at% Ru (Figs. 18(g)–(k)). The electronic structure of RuO2 is successfully modulated by the defective TiO2 support enriched with oxygen vacancies, and thereby reduce the energetic barrier. Similarly, oxygen-defective Co3O4 can also anchor atomically dispersed Ru single-atom, which exhibited an overpotential of 280 mV at 10 mA cm−2 and a long-term stability of 150 h in alkaline media [159]. The enhanced Raman characteristic peaks of Ru/Co3O4–x measured at 1.5, 1.6, 1.7, and 1.1 V indicated that the atomically dispersed Ru improved the structural stability of Co3O4–x during OER for the strong electron coupling effects between Ru and Co3O4–x supports. DFT calculations uncovered that oxygen vacancy and atomically dispersed Ru could synergistically tailor electron decentralization and d-band center of Co atoms, further optimizing the adsorption of oxygen-based intermediates and reducing the reaction barriers of OER. The improved stability was ascribed to the strong electron coupling effect between Ru atoms and Co3O4–x substrates. Single atomic Ru anchored on Fe2+ ions doped NiFe LDH has been reported to exhibit a reduced overpotential of 194 mV at 10 mA cm−2, along with negligible performance decay and dissolution even after 100 h stability test at 100 mA cm−2 [160]. Only 0.46 ppb dissolved Ru can be detected by ICP-MS after 24 h electrolysis in the electrolyte for the catalyst, which is considerably lower than the concentration observed for RuO2 (53 ppb). The prominent stability can be attributed to the strong electronic interaction between Ru and Fe2+ and the decreased valence states of both the Fe and Ru sites. A ternary amorphous/crystalline FeCoNi LDH, which serves as an efficient support of single Ru atoms, was also be reported by Hu et al. [161]. The amorphous outer layer decorated by abundant unsaturated coordination sites and defect sites, which utilize as anchoring sites to stabilize single Ru atoms. A highly symmetric rigid structure can be observed in crystalline inner, thereby strengthening the stability of support during OER. The combination of synergistic effects gives this hybrid catalyst with a low overpotential of 205 mV and a 48-h continuous testing without any noticeable decay. Yao et al. [162] developed a metal-organic framework UiO-67-bpydc (bpydc represents 2,2’-bipyridine-5,5’-dicarboxylic acid) with strong coordinating pyridine ligands as support to anchor atomically isolated Ru oxide by hydrothermal growth of UiO-67-bpydc and followed Ru anchoring process. Ru-UiO-67-bpydc not only displayed an overpotential of 200 mV to achieve the current density of 10 mA cm−2, but also showed a long-term stability lasting up to 115 h. Electrochemical experiments, including isotope tests, in-situ Raman, and in-situ 18O-labeled DEMS, validated the participation of lattice oxygen in OER through the LOM pathway. Theory calculations and X-ray absorption spectroscopy (XAS) characterizations revealed that the soluble *Vo-RuO4 2– intermediate and activated lattice oxygen could be stabilized by Ru–N bonds formed between Ru oxide and UiO-67-bpydc, thereby enhancing both OER stability and performance (Figs. 19(a)–(g) ). The introduction of stable support represents an effective approach to reduce the amount of ruthenium and stabilize the ruthenium site, and it is also a promising method that is expected to be industrialized. However, ruthenium remains vulnerable with a tendency to be over-oxidized and dissolved. Therefore, it is necessary to develop highly conductive support that exhibits stability in acidic electrolytes under high-voltage environment. Additionally, achieving coating during the introduction of the support holds great potential for significantly enhancing the catalyst stability, which presents a direction for future development. 4.4 Chemical doping Doping catalysts with certain elements is an efficient approach to modify their electronic structure, thereby adjusting the activity and stability. Previous reports have demonstrated that doping RuO2 with non-precious transition metal cations such as Cr, Fe, Mn, Ni, Co, and Zn leads to improved OER performance [163–167]. The sulfate anion and Fe cation co-doped RuO2 (S-RuFeO x ) with high OER activity and stability in acid was reported by Xue et al. [164]. This catalyst displayed a comparable OER performance with a low overpotential of 187 mV at 10 mA cm−2 in acid conditions, and much enhanced stability with 5000 cycles of CV test and 50 h of CP test at 1mA cm−2. Notably, only a minimal dissolution rate of 4.4% for Ru was observed after subjecting the S-RuFeO x catalyst after 5000 cycles. The doping effect not only promotes the deprotonation of water molecule and weakens the adsorption energy of the OOH* intermediate, but also stabilizes lattice oxygen and improves the stability of the catalyst. Mn-doped ultrathin Ru nanosheet branches (RuMn NSBs) were reported to show an overpotential of 226 mV in 0.5 mol L−1 H2SO4 and 222 mV in 1 mol L−1 KOH at 10 mA cm−2 [165]. Moreover, these RuMn NSBs demonstrate remarkable stability in water splitting, with a lifespan reaching up to125 h in 0.5 mol L−1 H2SO4. DFT calculations have demonstrated that the introduced Mn improves the stability of valence states in Ru sites due to the compensatory electronic structures. An et al. [166] synthesized a series of Ru-based alloys by doping with Co, Cr, Zn, and Mn on carbon fiber papers. CV cycle test was applied as a dealloying treatment and surface transformation strategy. Notably, the RuMn alloy showed remarkable resistance against acid corrosion and overoxidation during 20000 cycles, whereas other Ru-based samples (Ru, RuCo, RuCr, RuZn) deteriorated rapidly within only 10 consecutive CV cycles. In addition, RuMn catalyst remained stable for 720 h during CP test at 10 mA cm−2. A surface reconstruction process that formed a robust amorphous RuO x surface was beneficial for the superior stability, which can be attributed to the high bond strength between Ru atoms within RuMn alloy (Figs. 20(a)–(e) ). According to the previous research by Wu et al. [167], the addition of Ni dopants can also enhance the lattice stability of both surface Ru and subsurface oxygen. Ni-RuO2 catalysts an overpotential of 214 mV at 10 mA cm−2 and a 200 h of continuous operation. The S-number was found to be 7.4 × 105 after 205 h of testing for Ni-RuO2. Operando DEMS analysis confirmed that Ni-RuO2 catalysts underwent an AEM pathway. The limiting potential of OER on the Ni-RuO2 (110) surface was calculated to be 1.70 V, which was approximately 0.2 V lower than that of RuO2, indicating the improved OER activity of Ni-RuO2. The incorporation of Ni into the lattice resulted in an increased energy cost for Ru demetallation from 1.87 to 2.22 eV, suggesting a more stable surface Ru in Ni-RuO2 compared to pure RuO2 alone. Furthermore, the enthalpy changes for subsurface oxygen loss were calculated to be 1.67 and 2.12 eV on the RuO2 and Ni-RuO2 (110) surfaces, respectively, clearly demonstrating that the introduction of Ni dopants to the RuO2 lattice had also stabilized lattice oxygen during OER. Therefore, DFT studies indicated that the incorporation of Ni improved the OER stability of RuO2 by inhibiting both surface Ru demetallation and lattice oxygen loss (Figs. 21(a)–(e) ). Doping with other uncommon metals, such as Re, Nb, Nd, etc., has also been reported to improve the activity and stability of RuO2 [168–170]. Jin et al. [168] reported that the addition of Re dopants enables Ru sites to receive electrons at onsite potentials and donate them back at large overpotentials, as observed through operando XAS. This mechanism effectively prevents the dissolution of Ru. The introduction of Re doping reduces the adsorption energy of oxygen intermediates and strengthens the Ru–O bond in AEM pathway. Remarkably, Re0.06Ru0.94O2 exhibited an overpotential of 190 mV at current density 10 mA cm−2 during continuous 200 h test in 0.1 mol L−1 HClO4 with a S-number of 4.0 × 106. Liu et al. [169], on the other hand, found that the Ru sites in Nb-RuO2 provides electrons from Nb to Ru via bridging oxygen, thereby increasing electron density. In the OER process, the presence of Nb5+ in RuO2 inhibits the dissolution of Ru, strengthens the M–O bond in RuO2, and prevents the formation of soluble high-valent Ru substances. The designed Nb-Ru binary oxide shows a minimal overpotential (204 mV at 10 mA cm−2), a low degradation rate (25 μV h−1) over a 360-h stability test at 200 mA cm−2. Doping Ru-based catalysts with other metals is an efficient approach to modulate their electronic structures, thereby improving the activity and stability of catalysts for OER. Generally, the introduction of a quantitative amount of other metal salts during ruthenium catalyst synthesis can realize chemical doping. However, the dissolution of doped metal ions can be detrimental to the long-term stability of the catalyst. 4.5 Formation of solid solution The solid solution of pyrochlores and perovskites with special crystal structure have been proved active and stable for OER in water electrolysis. Pyrochlore is a complex oxide represented by a general formula of A2B2O7–y , where A site typically consists of Pb, Bi, Tl, Y, or Ln (rare-earth metal); and B site can be Ru [171–174]. Feng et al. [171] reported that the addition of Zn2+ doping into A site enhances the activity and stability of Y2Ru2O7–δ . The catalyst showed an overpotential of 291 mV to achieve 10 mA cm−2 and maintained its performance during a 6-h continuous testing without obvious decay. The intrinsic stability of Y2Ru2O7–δ is not affected by the partial substitutes of Zn for Y at A sites, which can be ascribed to the rigid RuO6 structure. The substitution of partial Y3+ with Sr2+ has also been reported to enhance the performance of Y2Ru2O7–δ [172]. The optimized Y1.7Sr0.3Ru2O7 candidate showed an overpotential of 161 mV at 10 mA cm−2 and demonstrated good stability for up to 28 h without any perceptible activity decline. The amount of dissolved metal detected was as low as 0.12% relative to the total catalyst. This excellent stability can be attributed to a good surface stability without structural reconstruction and/or metal dissolution during the OER process in acidic media. The enlargement of Ru–O–Ru bond angle, the alleviation of RuO6 octahedral distortion and the enhancement of Ru–O covalency are the main reasons for the stability of the crystal structure. The ligand oxygen is chemically activated to facilitate the nucleophilic OH− attack during OOH* formation, thus alleviating the energy barrier to further reduce η OER (Figs. 22(a)–(f) ). Yan et al. [173] introduced Ho3+ ions as substitutes for A-site atoms in Y2Ru2O7, resulting in an increased Ru–O–Ru bond angle and reduced the Ru–O bond length due to higher electronegativity with 4f electron effect. This substitute effectively mitigated the RuO6 octahedral distortion in Ho2Ru2O7. Moreover, Ho3+ improved the formation energy of oxygen vacancies, enhancing the resistance against Ru dissolution. Therefore, Ho2Ru2O7 displayed an overpotential of 215 mV at 10 mA cm−2 and a long-term (> 60 h) stability in acidic media. A study conducted by Guo et al. [174] reported the synthesis of Y2–x Co x Ru2O7–δ pyrochlore, where partial yttrium was substituted with Co. This substitution exhibited an overpotential of 275 mV in 0.5 mol L−1 H2SO4 at the current density of 10 mA cm−2. After 2000 cycles, only a marginal decay of 3.6% in the catalytic activity was observed. The incorporation of Co through substitution strengthens of the bond hybridization between the d orbitals of metal (Y and Ru) and the 2p orbitals of O, thereby enhancing the chemical stability of the crystal. In addition to the doping of A site, the B site can also be partially replaced [175–177]. A series of Pb-substituted lead-ruthenate pyrochlore (Pb2[Ru2–x Pb x ]O7–δ , PRPO) were synthesized [175] by utilizing a low-temperature pyrolysis cation exchange resin method. The optimized catalyst exhibited an overpotential of 174 mV and sustained for 150 h to achieve 10 mA cm−2 at around 1.50 V with a slight voltage increase of 63 mV. According to the DFT results, the Ru–O average binding length of PRPO was 1.969 Å, which is shorter than that of RuO2 (1.992 Å). Therefore, its superior stability can be attributed to the more stable octahedral structure after doping Pb in B-site. It was also reported that doping Ir in B-site of yttrium ruthenate pyrochlore can also work [176]. The optimized Y2Ru2–x Ir x O7 catalyst gave a low overpotential of 220 mV at 10 mA cm−2 and maintained its performance over 2000 h. DFT calculations implied enhanced activity for both Ru and Ir sites in Ir-doped pyrochlore ruthenate. Derived from their calculated energy barriers, the Ir site exhibited a higher OER favorability in comparison with the Ru site. The high stability was attributed to the depressed overoxidation of the active species due to the low valence state and the high structural stability with strengthened interaction between RuO6 and IrO6 (Figs. 23(a)–(f) ). Overall, the balanced binding ability with oxygen intermediates, downshift of O 2p band center, and accelerated potential-determining steps collectively contributed to the enhanced activity and stability of Y2Ru2–x Ir x O7. Another study reported by Galyamin et al. [177] demonstrated that half of the Ru content can also be replaced by Mn to form low-Ru-content pyrochlores (Y2MnRuO7). In this case, an overpotential of 260 mV was required to achieve 10 mA cm−2 and the catalyst remained stable for 45 h during CP measurement. The substitution of Mn for Ru is responsible for maintaining the structural stability of the catalyst. Only a few examples of perovskites with high OER activity were reported in acid media [178–180]. The OER activity and durability of perovskite SrRuO3 in acid can be enhanced by Na+ doping in the Sr2+ position, as reported by Retuerto et al. [178]. Sr0.95Na0.05RuO3 exhibited very high specific OER activity, with an overpotential of ~160 mV at 10 mA cm−2. Na-doped perovskites experienced a modest decline of 15% from their initial activity after 20 cycles, while SrRuO3 encountered a substantial decrease exceeding 85%. The enhanced stability of Na-doped perovskites was attributed to the robust perovskite structure with stabilization of Ru centers in the form of higher oxidation states and less distorted RuO6 octahedra. Miao et al. [179] reported a quadruple perovskite oxide CaCu3Ru4O12 as an efficient catalyst for acidic water oxidation, which exhibited an overpotential of 171 mV and a lifetime of 24 h at 10 mA cm−2. Inductively coupled plasma atomic emission spectroscopy (ICP-AES) measurements revealed the dissolution percentage of Ca, Cu and Ru ions were less than 6.7%, 2.9% and 2.7%, respectively in acid conditions, which can be attributed to the excellent chemical and structural stability of this perovskite material. Liu et al. [180] investigated a series of quadruple perovskite ruthenates (ACu3Ru4O12, A = Ca, Sr, La, Nd, and Ce) to evaluate activities and stabilities during OER. Among all the samples tested, CaCu3Ru4O12 exhibited the highest activity and stability. The improved OER cycle stability can be attributed to the increased Ru-O covalency with decreased Ru–O bond length. The solid solutions of Ru-based catalysts with rutile phase have also been reported as active and stable catalysts for OER. It has been reported that the introduction of Cr into RuO2 to form chromium-ruthenium oxide solid solution enhances the acidic OER performance. Specifically, a low overpotential of 178 mV at 10 mA cm−2 was achieved for Cr0.6Ru0.4O2 and this level of performance was maintained at least for 10 h [181]. The enhanced stability was related to the stabilization of rutile crystalline structure due to lower occupation at the Fermi level. Moreover, various chromium-ruthenium oxide solid solution with different Cr/Ru ratios were also synthesized via sol-gel method. Among them, Ru0.6Cr0.4O2 delivered an overpotential of only 195 mV at 10 mA cm−2. The applied potential was merely increased by 5.3 mV for 20 h during a continuous OER test in acidic media. The incorporation of Cr increased the energy required for oxygen defect formation and reduced the participation of lattice oxygen, thus improving the stability of the catalyst [182]. Many investigators have focused on the construction of solid solutions with unique crystal structures, especially pyrochlore structures with RuO6 active centers. The catalyst possesses a singular crystal structure, facilitating catalytic mechanism modeling and analysis. However, the dissolution of metal within the crystal lattice can readily cause the structural collapse and surface reconstruction, which is not conducive to long-term stability. Therefore, it is significant to design catalysts with robust structures and high capability against metal dissolution under operation conditions. 4.6 Alternated reaction pathways As previously mentioned, the participation of activated lattice oxygen in the LOM is the main factor that leads to inadequate stability of Ru-based catalysts. This is because the generated oxygen vacancy (VO) defects cause the exposure of metal species and subsequent over-oxidation, resulting in the detachment from the catalyst surface. Therefore, one of the core strategies is to improve the stability of catalyst by changing the reaction mechanism of catalyst in order to suppress LOM process [183–188]. Hao et al. [183] modified the electronic structure of RuO2 via co-doping W and Er, resulting in a downward shift of the O 2p-band centers. This modification effectively increases the energy (ΔG) required for the VO formation, thereby preventing the participation of lattice oxygen and minimizing the generation of soluble high valence Ru>4+. The representative W0.2Er0.1Ru0.7O2–δ catalyst showed a low overpotential of 168 mV to achieve 10 mA cm−2 accompanied with a stability at least 500 h in 0.5 mol L−1 H2SO4 electrolyte. The ICP-MS results revealed that the concentration of Ru cations in the solution was below12 ppb after 500 h, indicating that only a slight amount of Ru is dissolved and the stability is improved significantly (Figs. 24(a)–(h) ). Wen et al. [184], on the other hand, developed a ternary oxide electrocatalysts consisting of Sr-Ru-Ir, which achieved an overpotential of 190 mV at 10 mA cm−2 and maintained an overpotential below 225 mV during 1500 h of operation. On the basis of the ICP-OES data, the S-number for SrRuIr (1.97 × 104) is approximately 2 orders of magnitude higher than that for SrRu (4.10 × 102). Based on X-ray absorption spectroscopy and 18O isotope-labeled online mass spectroscopy studies, the interactions in the Ru–O–Ir local structure suppressed the participation of lattice oxygen during OER, attributing to the enhanced stability. To steer the AEM in OER for improved durability of the RuO2 phase in acidic electrolytes, Jin et al. [185] designed a nanorod-shaped PtCo-RuO2/C that showed 212.6 mV overpotential and a lifetime of 20 h at 10 mA cm−2. Pt dopants were found not only to promote *OOH adsorption and deprotonation, facilitating AEM, but also to sacrificially oxidize and dissolve instead of Ru in order to prevent Ru from over-oxidation. Wen et al. [186] presented a strategy to accelerate the deprotonation of OER intermediates by introducing WO x as strong Brönsted acid sites into the RuO2. The Ru-W binary oxide exhibited a low overpotential of 235 mV at 10 mA cm−2 and a 550-hour stability test with a low degradation rate. This approach facilitated the transfer of proton from the oxo-intermediate to the neighboring bridging oxygen sites, thus accelerating bridging-oxygen-assisted deprotonation during OER steps. Shi et al. [187] have used MRuO x (M = Ce4+, Sn4+, Ru4+, Cr4+) solid solution as structure model, finding the relationship between the reaction route and the Ru charge. By varying the chelating elements surrounding the RuO6 motif and controlling the M-O-Ru structure, they were able to selectively involve or exclude the LOM and optimize both activity and stability under AEM pathway. SnRuO x solid solution with Sn-O-Ru local structure that follows the AEM with appropriate Ru–O binding strength. The screened out SnRuO x solid solution exhibited an overpotential of 194 mV at 10 mA cm−2 along with a sustained operation for a 250-h at 100 mA cm−2 (Figs. 25(a)–(g) ). In contrast to LOM, the oxide path mechanism (OPM) is more promising for designing high-performance OER electrocatalysts due to the direct O–O radical coupling avoiding from the production of oxygen vacancy defects and extra reaction intermediates [188]. However, the geometric configuration of metal active sites increases the difficulty of implementing OPM. An in-situ reconstructed Ru atom array on α-MnO2 has been reported by Lin et al. [188], which showed high activity with an overpotential of 161 mV at 10 mA cm−2 and outstanding stability with small degradation after 200 h operation with 1.32 wt% Ru loading. The mass loss ratios of Ru and Mn in the 12Ru/MnO2 catalyst were found out to be remarkably low at only 0.50% and 0.28%, respectively, after undergoing stable test over long periods. To validate the OPM pathway, a combination of operando vibrational and mass spectroscopy measurements along with DFT calculations were performed to probe the reaction intermediates and gaseous products (Figs. 26(a)–(f) ). Alternating the reaction pathway from LOM to AEM or OPM might provide solution to figure out the problem of the exposure and over-oxidation of Ru-based catalysts caused by oxygen vacancy formation in the LOM pathway. However, the discovery of the catalysts design principle capable of alternating the reaction pathway remains elusive, and there is still a relative lack of research focusing on enhancing stability under LOM pathways. In addition, despite numerous reports on Ru-based catalysts following the AEM pathways, their stability remains unsatisfactory, necessitating further stability improvement under this pathway. According to the recent advancements of the stability of Ru-based catalysts for OER, the strategies to improve the stability can be categorized into the following six types: hybridization of Ru-based catalysts with iridium, construction of core-shell structures, incorporation of stable support, chemical doping, formation of solid solution and alternated reaction pathways (Fig. 27 ). The timeline shows that every design idea is out of date. The deactivation mechanism of the Ru-based catalysts in OER is mainly the dissolution of ruthenium. Therefore, the design principle of catalysts is to enhance the stability of crystal structure and increase the dissolution resistance of ruthenium. In addition, to address the dissolution of ruthenium caused by LOM pathway, alternating the reaction pathway can be adopted. Introducing stable ingredients as secondary catalytic sites may provide a comprehensive solution to the stability issue. 5 Recent advances of Ru-based electrocatalysts for water-splitting The combination of HER and OER enables efficient and environmentally friendly electrocatalytic overall water splitting, which holds great promise for sustainable hydrogen production with high purity. The activity and stability of Ru-based catalysts in alkaline and acidic electrolytes for electrocatalytic water splitting are summarized in Table 3 . RuNP@RuN x -OFC/NC catalysts, in combination with anode IrO2, demonstrated a remarkable performance, achieving the current density of 10 mA cm−2 at a record-low cell voltage of 1.337 V in 1.0 mol L−1 KOH, while NC@Vo·-RuO2/CNTs-350 catalysts coupled with the commercial Pt/C as counter electrode catalysts required a higher potential of 1.45 V to drive the same current density (10 mA cm−2) for overall water splitting in the acidic media [104,152]. Several catalysts can be employed as bifunctional catalysts for both hydrogen and oxygen production. The electrocatalytic water splitting in the case of the a/c-RuO2||a/c-RuO2 system occurred at approximately 1.45 V and processed at 1.52 V for a current density of 10 mA cm−2. This system outperformed the Pt/C||RuO2 system [191]. Moreover, the a/c-RuO2||a/c-RuO2 system exhibited a remarkable catalytic stability in acidic media. A current retention of 68.5% was observed for the a/c-RuO2||a/c-RuO2 system during a period of 20 h at a current density of 50 mA cm−2, which was much higher than that of the Pt/C||RuO2 system (34.2%, Figs. 28(a)–(c) ). RuO2-NiO/NF, as a self-supporting electrode, served as both the anode and cathode for the basic overall water splitting (1.0 mol L−1 KOH) in a two-electrode configuration. RuO2-NiO/NF||RuO2-NiO/NF electrolyzer could generate a remarkable current density of 10 mA cm−2 at a low cell voltage of 1.43 V, which was significantly lower than those of Pt/C||RuO2 (1.52 V) and RuO2||RuO2 (1.55 V) [97]. Moreover, RuO2-NiO/NF||RuO2-NiO/NF only required a voltage of about 1.66 V to reach 500 mA cm−2 with a faradaic efficiency of close to 100%. The RuO2-NiO/NF||RuO2-NiO/NF electrolyzer can maintain stable electrolysis performance with a duration up to 2000 h measured at both 100 mA cm−2 and 1000 mA cm−2. ICP-OES analysis suggests the minimal dissolution of Ru and Ni in the electrolyte, suggesting the potential for practical industrial application (Figs. 28(d)–(f)). To further evaluate the performance of these prepared electrocatalyst in the practical applications, cell tests were conducted using proton and anion exchange membrane water electrolyzers (PEMWE and AEMWE). Generally, the cells consist of aluminum end plates, silicon gaskets, current collectors, membrane electrode assembly (MEA), and gas diffusion layers (GDL, Fig. 28(g)). To verify the practical application of Ru-WO3 catalysts in water electrolyzer, a AEMWE electrolyzer was assembled with the commercial IrO2 as anode and Ru-WO3-20% as cathode. The assembled electrolzyer required 1.86 V to achieve a current density of 1 A cm−2 at 80 °C [128]. The electrolyzer delivered a high stability without any obvious degradation at 1 A cm−2 for 100 h, indicating its promising potential for electrocatalytic water splitting. Due to the more irreplaceable performance in acidic electrolytes, many Ru-based catalysts have been employed in PEMWE. The Ni-RuO2/PEM/Pt/C electrolyzer required only 1.78, 1.95 and 2.10 V to reach the catalytic current densities of 500, 1000 and 1500 mA cm−2 at room temperature, respectively [167]. To assess the stability of the Ni-RuO2-based electrolyzer, as well as pristine RuO2 for comparison, a constant current density of 200 mA cm−2 was applied for evaluation purposes. The voltage of the RuO2 electrolyzer noticeably increased after approximately 120 h of continuous electrolysis, suggesting poor OER stability under practical operation conditions. In contrast, the Ni-RuO2 catalyst was operated for 1000 h without any obvious cell voltage increase, indicating the markedly PEMWE durability. A rapid increase of Ru concentration in electrolyte was observed at the initial stage of operation, which could be ascribed to the dissolution of unstable Ru species during the catalyst activation. Afterward, Ru dissolution was gradually stabilized at approximately 3 × 10−8 within the first 500 and remained nearly unchanged for the subsequent stability test. The optimal SnRuO x catalysts were also assessed in a single cell to evaluate their performance in a PEMWE device. The cell voltages of 1.565, 1.655, and 1.735 V were required to reach current densities of 1, 2, and 3 A cm−2 at 50 °C, respectively; these values were significantly higher than those obtained by the commercial RuO2 (1.733 V@1 A cm−2 and 1.883 V@2 A cm−2) [186]. The SnRuO x -based cell delivered a low apparent degradation rate of 53 μV h−1 under 1 A cm−2 for 1300 h, demonstrating the well-maintained PEMWE performance. SrRuIr catalysts displayed exceptional activity in a PEMWE device with the overall cell voltage of 1.50 V at 1 A cm−2 at 80 °C [184]. Upon applying a constant current of 1 A cm−2, no significant increase in cell voltage was observed after 150 h of electrolysis (Figs. 28(h) and (i)). 6 Conclusion and perspectives This review provides a comprehensive summary of the mechanism, evaluation methods, criteria of stability as well as deactivation for HER and OER. Additionally, it highlights the latest advancements and strategies of Ru-based HER and OER electrocatalysts with the improved catalytic stability. The deep understandings on targeted solutions to address the deactivation mechanisms in HER and OER were outlined, providing a clear pathway for improving the stability of Ru-based electrocatalysts in future research. Particularly, the strategies for enhancing HER performance of Ru-based electrocatalysts are elucidated from the following aspects: incorporation of conductive substrate, construction of core-shell structures, formation of embedded structures, enhancement of the metal-support interaction, phase engineering, and modulations of adsorption and desorption behavior of intermediates. Afterwards, emphasis is placed on the progress and strategies for enhancing the stability of Ru-based electrocatalysts for OER. This progress can be categorized into the following aspects hybridizing Ru-based catalysts with iridium, constructing core-shell structures, introducing stable supports, doping with specific element, forming solid solution, and alternating reaction pathways (Fig. 29 ). Despite gratifying progress has been made in the field of HER and OER, there remain considerable obstacles in developing Ru-based catalysts for practical water-splitting applications that exhibit both high activity and stability. We put forward prospects for the future development of Ru-based electrocatalysts for HER and OER (Fig. 30 ). 6.1 Development of the stability testing strategy and evaluation criteria The ultimate practicality of catalysts is determined by their stability which can be evaluated through stability testing methods under practical conditions for HER, such as exposure to high temperatures and strong bases/acids. However, only a limited number of catalysts have demonstrated the ability to withstand such harsh testing environments. Therefore, there is an urgent need for development of catalysts that can maintain stability in more challenging environments. The current laboratory stability testing method has been tried to simulate and predict the performance of the catalyst in real water electrolyzer. However, it raises concerns about whether this approach can really guarantee the long-term functionality of device for years, since there is no clear way to assess the stability of the catalyst in the actual application. In practice, the electrolytic cell experiences operational intermittency with frequent startups and static conditions, whether such operations affect the stability of the catalyst remains unclear. To reflect this phenomenon, a novel stability test method needs to be developed. Furthermore, establishing more reasonable criteria for quantifying and comparing the stability of different OER catalysts are essential for fair evaluation purposes. 6.2 Understanding of deactivation mechanism The understanding of deactivation mechanism influences the explanation and design principles of the stable catalysts. The primary deactivation modes of catalyst in HER involve support corrosion, metal atom dissolution, Osterwald ripening, agglomeration, particle detachment and active site poisoning. However, the underlying factors for these deactivation phenomena remain inadequately comprehended, taking the dissolution mechanism of metal atoms in an alkaline system as an example. In addition to OH* poisoning the active site, other species may also act as potential poisons. The formation of ruthenium with high valence resulting in dissolution is a well-known cause of deactivation in OER. Some researchers believe that the deactivation occurs due to the formation of oxygen vacancies and structural collapse caused by lattice oxygen participating in the generation of oxygen. However, the clarity and acceptance of LOM are considerably lower compared to that of AEM. Therefore, AEM is reported to as the predominant reaction pathway for most catalysts. Under such mechanism, how does high-valent ruthenium dissolve, and whether there is a strategy to fundamentally solve this problem remains to be explored. 6.3 Development and application of in-situ technologies The structure of the active site in electrocatalysts is ambiguous and challenging to capture, due to the complex nature of the three-phase electrocatalytic reaction involving solid, liquid and gas phases, as well as multiple electron transfer and intermediates. It may also be accompanied by complex surface reconstruction and catalyst modifications in the electrocatalytic process. Therefore, it is imperative to employ in-situ characterization technologies for real-time monitoring of the dynamic catalytic process and capturing catalyst change, enabling a comprehensive understanding of the deactivation mechanisms. Advanced in-situ techniques, such as operando XAFS, in-situ XRD, TEM, Raman, etc. are essential for detecting the atomic level changes of valence state, structure, recombination, morphology, defect and other changes in real time. Only through a clearer understanding of the deactivation mechanisms can targeted solutions be proposed to improve the stability of the catalyst. 6.4 Utilization of advanced modification strategies Conventional modification strategies include composition regulation, structural modulation, heterojunction construction, and electron orbital regulation. Other methodologies, such as amorphous supports, Van der Waals heterojunction, spin state regulation, microenvironment regulation, etc., have shown potential in improving the performance of Ru-based catalysts for water splitting. Amorphization can generate abundant metal dangling bonds with the flexibly unsaturated electronic configurations to facilitate frequent couplings of orbitals, rearrange the distribution of the local lone-pair electrons and accelerate charge transfer among active centers. Amorphous supports that confine single atoms or diatoms can not only enhance activity but also improve stability. The paramagnetic product O2 from diamagnetic hydroxide/water requires spin-related electron transfer, which can be facilitated by the hybridization between the transition metal 3d and oxygen intermediate 2p orbitals. The formation of active sites (M) and oxygen intermediate (e.g., OH*, O*, OOH*) bonds (M–O) are a prerequisite of OER. Thus, regulating the spin state of active metal sites or supports can ensure rapid catalytic kinetic. Since the catalytic reaction is sensitive to the properties of the surface/interface, regulating the local interfacial microenvironment of active sites in heterogeneous catalysts induces charge redistribution, creates new active sites and enhances the catalytic performance. 6.5 Highly desired practical application Several other significant breakthroughs are urgently required to facilitate the practical application of these Ru-based electrocatalysts in industrial water electrolysis. Firstly, it is crucial to develop stable electrocatalysts through scalable and straightforward synthesis methods for large-scale production. It is urge to construct a production scale of free-standing and large-area electrode with catalysts in order to remove the unstable adhesive and avoid disintegrating over a long period of operation. Additionally, it is necessary to develop bifunctional electrocatalysts with high stability toward both OER and HER, simplifying the construction of an electrolyzer while reducing the manufacturing costs. Moreover, parameters such as local pH, mass transfer resistance, bubble evolution rate, etc. need to be considered for the electrolyzers operating at high current density. Lastly, in actual production environments, it is essential for the catalyst to be minimally affected by impurities in the electrolyte such as dust and microorganisms. References 1 M.S. Dresselhaus I.L. Thomas Nature 414 2001 332 337 M. S. Dresselhaus, I. L. Thomas, Nature, 2001, 414, 332–337. 2 W.B. Li J. Gan Y.X. Liu Y. Zou S. Zhang Y.Q. Qu Angew. Chem. Int. Ed. 62 2023 e202305661 W. B. Li, J. Gan, Y. X. Liu, Y. Zou, S. Zhang, Y. Q. Qu, Angew. Chem. Int. Ed., 2023, 62, e202305661. 3 B. Dunn H. Kamath J.-M. Tarascon Science 334 2011 928 935 B. Dunn, H. Kamath, J.-M. Tarascon, Science, 2011, 334, 928–935. 4 S. Chu Y. Cui N. Liu Nat. Mater. 16 2017 16 22 S. Chu, Y. Cui, N. Liu, Nat. Mater., 2017, 16, 16–22. 5 R.D. Crapnell C.E. Banks Green Carbon 1 2023 85 93 R. D. Crapnell, C. E. Banks, Green Carbon, 2023, 1, 85–93. 6 P. Zhao H. Jiang H.D. Shen S.W. Yang R.Z. Gao Y. Guo Q.Y. Zhang H.P. Zhang Angew. Chem. Int. Ed. 62 2023 e202314121 P. Zhao, H. Jiang, H. D. Shen, S. W. Yang, R. Z. Gao, Y. Guo, Q. Y. Zhang, H. P. Zhang, Angew. Chem. Int. Ed., 2023, 62, e202314121. 7 I.T. McCrum M.T.M. Koper Nat. Energy 5 2020 891 899 I. T. McCrum, M. T. M. Koper, Nat. Energy, 2020, 5, 891–899. 8 Y.N. Wang L.M. Wang K.X. Zhang J.Y. Xu Q.N. Wu Z.B. Xie W. An X. Liang X.X. Zou Chin. J. Catal. 50 2023 109 125 Y. N. Wang, L. M. Wang, K. X. Zhang, J. Y. Xu, Q. N. Wu, Z. B. Xie, W. An, X. Liang, X. X. Zou, Chin. J. Catal., 2023, 50, 109–125. 9 S. Zhang Z.M. Tian Y.Y. Ma Y.Q. Qu ACS Catal. 13 2023 4629 4645 S. Zhang, Z. M. Tian, Y. Y. Ma, Y. Q. Qu, ACS Catal., 2023, 13, 4629–4645. 10 C.C.L. McCrory S. Jung I.M. Ferrer S.M. Chatman J.C. Peters T.F. Jaramillo J. Am. Chem. Soc. 137 2015 4347 4357 C. C. L. McCrory, S. Jung, I. M. Ferrer, S. M. Chatman, J. C. Peters, T. F. Jaramillo, J. Am. Chem. Soc., 2015, 137, 4347–4357. 11 B.M. Hunter H.B. Gray A.M. Müller Chem. Rev. 116 2016 14120 14136 B. M. Hunter, H. B. Gray, A. M. Müller, Chem. Rev., 2016, 116, 14120–14136. 12 J. Song C. Wei Z.-F. Huang C. Liu L. Zeng X. Wang Z.J. Xu Chem. Soc. Rev. 49 2020 2196 2214 J. Song, C. Wei, Z.-F. Huang, C. Liu, L. Zeng, X. Wang, Z. J. Xu, Chem. Soc. Rev., 2020, 49, 2196–2214. 13 C. Wang L.J. Jin H.Y. Shang H. Xu Y. Shiraishi Y.K. Du Chin. Chem. Lett. 32 2021 2108 2116 C. Wang, L. J. Jin, H. Y. Shang, H. Xu, Y. Shiraishi, Y. K. Du, Chin. Chem. Lett., 2021, 32, 2108–2116. 14 J.W. Chen H.X. Chen T.W. Yu R.C. Li Y. Wang Z.P. Shao S.Q. Song Electrochem. Energy Rev. 4 2021 566 600 J. W. Chen, H. X. Chen, T. W. Yu, R. C. Li, Y. Wang, Z. P. Shao, S. Q. Song, Electrochem. Energy Rev., 2021, 4, 566–600. 15 S.P. Geng L.M. Chen H.X. Chen Y. Wang Z.-B. Ding D.D. Cai S.Q. Song Chin. J. Catal. 50 2023 334 342 S. P. Geng, L. M. Chen, H. X. Chen, Y. Wang, Z.-B. Ding, D. D. Cai, S. Q. Song, Chin. J. Catal., 2023, 50, 334–342. 16 L.Y. Xiao L.L. Qi J.R. Sun A. Husile S.Y. Zhang Z.L. Wang J.Q. Guan Nano Energy 120 2024 109155 L. Y. Xiao, L. L. Qi, J. R. Sun, A. Husile, S. Y. Zhang, Z. L. Wang, J. Q. Guan, Nano Energy, 2024, 120, 109155. 17 L.Y. Xiao Z.L. Wang J.Q. Guan Chem. Sci. 14 2023 12850 12868 L. Y. Xiao, Z. L. Wang, J. Q. Guan, Chem. Sci., 2023, 14, 12850–12868. 18 C.G. Cheng W.D. Ao H.J. Ren Z.S. Fan T.T. Xu L. Dai P.Q. Yin Sci. China Mater. 66 2023 1383 1388 C. G. Cheng, W. D. Ao, H. J. Ren, Z. S. Fan, T. T. Xu, L. Dai, P.Q. Yin, Sci. China Mater., 2023, 66, 1383–1388. 19 X.Y. Zhao J.J. Wang J.Z. Kang X.M. Wang H. Yu C.-F. Du Chin. J. Struct. Chem. 42 2023 100159 X. Y. Zhao, J. J. Wang, J. Z. Kang, X. M. Wang, H. Yu, C.-F. Du, Chin. J. Struct. Chem., 2023, 42, 100159. 20 Y.B. Zhou X.W. Shen M.F. Wang L.F. Zhang T. Qian C.L. Yan J.M. Lu Sci. China Mater. 66 2023 2527 2544 Y. B. Zhou, X. W. Shen, M. F. Wang, L. F. Zhang, T. Qian, C. L. Yan, J. M. Lu, Sci. China Mater., 2023, 66, 2527–2544. 21 L.Y. Xiao Z.L. Wang J.Q. Guan Adv. Funct. Mater. 34 2023 2310195 L. Y. Xiao, Z. L. Wang, J. Q. Guan, Adv. Funct. Mater., 2023, 34, 2310195. 22 J.Y. Han J.Q. Guan Nano Res. 16 2023 1913 1966 J. Y. Han, J. Q. Guan, Nano Res., 2023, 16, 1913–1966. 23 T.M. Tang Z.L. Wang J.Q. Guan Coord. Chem. Rev. 492 2023 215288 T. M. Tang, Z. L. Wang, J. Q. Guan, Coord. Chem. Rev., 2023, 492, 215288. 24 X. Bai J.Q. Guan Chin. J. Catal. 43 2022 2057 2090 X. Bai, J. Q. Guan, Chin. J. Catal., 2022, 43, 2057–2090. 25 S. Zhao F. Hu L.J. Yin L.L. Li S.J. Peng Sci. Bull. 68 2023 1389 1398 S. Zhao, F. Hu, L. J. Yin, L. L. Li, S. J. Peng, Sci. Bull., 2023, 68, 1389–1398. 26 C. Lan Y.Y. Chu S. Wang C.P. Liu J.J. Ge W. Xing Acta Phys.-Chim. Sin. 39 2023 2210036 C. Lan, Y. Y. Chu, S. Wang, C. P. Liu, J. J. Ge, W. Xing, Acta Phys.-Chim. Sin., 2023, 39, 2210036. 27 H. Luo X.D. Zhang H. Zhu K.X. Zhang F. Yang K.W. Xu S. Yu D.G. Guo J. Mater. Sci. Technol. 166 2023 164 172 H. Luo, X. D. Zhang, H. Zhu, K. X. Zhang, F. Yang, K. W. Xu, S. Yu, D. G. Guo, J. Mater. Sci. Technol., 2023, 166, 164–172. 28 S.S. Lin M.A. Habib R. Mandavkar R. Kulkarni S. Burse Y.-U. Chung C.S. Liu Z.L. Wang S.W. Lin J.-H. Jeong J. Lee Adv. Sustainable Syst. 6 2022 2200213 S. S. Lin, M. A. Habib, R. Mandavkar, R. Kulkarni, S. Burse, Y.-U. Chung, C. S. Liu, Z. L. Wang, S. W. Lin, J.-H. Jeong, J. Lee, Adv. Sustainable Syst., 2022, 6, 2200213. 29 A.Q. Wang J. Chen P.F. Zhang S. Tang Z.C. Feng T.T. Yao C. Li Acta Phys.-Chim. Sin. 39 2023 2301023 A. Q. Wang, J. Chen, P. F. Zhang, S. Tang, Z. C. Feng, T. T. Yao, C. Li, Acta Phys.-Chim. Sin., 2023, 39, 2301023. 30 X. Du L.L. Yin W.J. Zhang M.L. Zhang K.M. Su Z.H. Li J. Mater. Sci. Technol. 135 2023 26 33 X. Du, L. L. Yin, W. J. Zhang, M. L. Zhang, K. M. Su, Z. H. Li, J. Mater. Sci. Technol., 2023, 135, 26–33. 31 H. Zeng M. Lv H. Wang X. Li S.M. Jin Z.L. Liu X.H. Chang Adv. Sustainable Syst. 7 2023 2300108 H. Zeng, M. Lv, H. Wang, X. Li, S. M. Jin, Z. L. Liu, X. H. Chang, Adv. Sustainable Syst., 2023, 7, 2300108. 32 W.Y. Gou Z.M. Xia X.H. Tan Q.Y. Xue F. Ye S. Dai M.K. Zhang R. Si Y. Zou Y.Y. Ma J.C. Ho Y.Q. Qu Nano Energy 104 2022 107960 W. Y. Gou, Z. M. Xia, X. H. Tan, Q. Y. Xue, F. Ye, S. Dai, M. K. Zhang, R. Si, Y. Zou, Y. Y. Ma, J. C. Ho, Y. Q. Qu, Nano Energy, 2022, 104, 107960. 33 X.H. Wang H. Tian X. Yu L.S. Chen X.Z. Cui J.L. Shi Chin. J. Catal. 42 2023 1287 1296 X. H. Wang, H. Tian, X. Yu, L. S. Chen, X. Z. Cui, J. L. Shi, Chin. J. Catal., 2023, 42, 1287–1296. 34 Y. Zheng Y. Jiao Y.H. Zhu L.H. Li Y. Han Y. Chen M. Jaroniec S.Z. Qiao J. Am. Chem. Soc. 138 2016 16174 16181 Y. Zheng, Y. Jiao, Y. H. Zhu, L. H. Li, Y. Han, Y. Chen, M. Jaroniec, S. Z. Qiao, J. Am. Chem. Soc., 2016, 138, 16174–16181. 35 J.-Q. Wang C. Xi M. Wang L. Shang J. Mao C.-K. Dong H. Liu S.A. Kulinich X.-W. Du ACS Catal. 10 2020 12575 12581 J.-Q. Wang, C. Xi, M. Wang, L. Shang, J. Mao, C.-K. Dong, H. Liu, S. A. Kulinich, X.-W. Du, ACS Catal., 2020, 10, 12575–12581. 36 H.X. Yao X.K. Wang K. Li C. Li C.H. Zhang J. Zhou Z.W. Cao H.L. Wang M. Gu M.H. Huang H.Q. Jiang Appl. Catal. B 312 2022 121378 H. X. Yao, X. K. Wang, K. Li, C. Li, C. H. Zhang, J. Zhou, Z. W. Cao, H. L. Wang, M. Gu, M. H. Huang, H. Q. Jiang, Appl. Catal. B, 2022, 312, 121378. 37 I.C. Man H.-Y. Su F. Calle-Vallejo H.A. Hansen J.I. Martínez N.G. Inoglu J. Kitchin T.F. Jaramillo J.K. Nørskov J. Rossmeisl ChemCatChem 3 2011 1159 1165 I. C. Man, H.-Y. Su, F. Calle-Vallejo, H. A. Hansen, J. I. Martínez, N. G. Inoglu, J. Kitchin, T. F. Jaramillo, J. K. Nørskov, J. Rossmeisl, ChemCatChem, 2011, 3, 1159−1165. 38 J.H. Montoya L.C. Seitz P. Chakthranont A. Vojvodic T.F. Jaramillo J.K. Norskov Nat. Mater. 16 2016 70 81 J. H. Montoya, L. C. Seitz, P. Chakthranont, A. Vojvodic, T. F. Jaramillo and J. K. Norskov, Nat. Mater., 2016, 16, 70–81. 39 J. Yu Q.J. He G.M. Yang W. Zhou Z.P. Shao M. Ni ACS Catal. 9 2019 9973 10011 J. Yu, Q. J. He, G. M. Yang, W. Zhou, Z. P. Shao, M. Ni, ACS Catal., 2019, 9, 9973–10011. 40 F.I. Mattos-Costa P. de Lima-Neto S.A.S. Machado L.A. Avac Electrochim. Acta 44 1998 1515 1523 F. I. Mattos-Costa, P. de Lima-Neto, S. A. S. Machado, L. A. Avac, Electrochim. Acta, 1998, 44, 1515–1523. 41 J.W. Su R.X. Ge K.M. Jiang Y. Dong F. Hao Z.Q. Tian G.X. Chen L. Chen Adv. Mater. 30 2018 1801351 J. W. Su, R. X. Ge, K. M. Jiang, Y. Dong, F. Hao, Z. Q. Tian, G. X. Chen, L. Chen, Adv. Mater., 2018, 30, 1801351. 42 J. Creus J.D. Tovar N. Romero J. García-Antón K. Philippot R. Bofill X. Sala ChemSusChem 12 2019 2493 2514 J. Creus, J. D. Tovar, N. Romero, J. García-Antón, K. Philippot, R. Bofill, X. Sala, ChemSusChem, 2019, 12, 2493–2514 43 N. Hodnik P. Jovanovic A. Pavlisic B. Jozinovic M. Zorko M. Bele V.S. Selih M. Sala S. Hocevar M. Gaberscek J. Phys. Chem. C 119 2015 10140 10147 N. Hodnik, P. Jovanovic, A. Pavlisic, B. Jozinovic, M. Zorko, M. Bele, V. S. Selih, M. Sala, S. Hocevar, M. Gaberscek, J. Phys. Chem. C, 2015, 119, 10140–10147. 44 S. Cherevkoa S. Geiger O. Kasiana N. Kulyka J.-P. Grotea A. Savanc B.R. Shresthaa S. Merzlikina B. Breitbachb A. Ludwigc K.J.J. Mayrhofer Catal. Today 262 2016 170 180 S. Cherevkoa, S. Geiger, O. Kasiana, N. Kulyka, J.-P. Grotea, A. Savanc, B. R. Shresthaa, S. Merzlikina, B. Breitbachb, A. Ludwigc, K. J. J. Mayrhofer, Catal. Today, 2016, 262, 170–180. 45 V. Ramalingam P. Varadhan H.-C. Fu H. Kim D.L. Zhang S.M. Chen L. Song D. Ma Y. Wang H.N. Alshareef Adv. Mater. 31 2019 1903841 V. Ramalingam, P. Varadhan, H.-C. Fu, H. Kim, D. L. Zhang, S. M. Chen, L. Song, D. Ma, Y. Wang, H. N. Alshareef, Adv. Mater., 2019, 31, 1903841. 46 M.Y. Yang L. Jiao H.L. Dong L.J. Zhou C.Q. Teng D.M. Yan T.-N. Ye X.X. Chen Y. Liu H.-L. Jiang Sci. Bull. 66 2021 257 264 M. Y. Yang, L. Jiao, H. L. Dong, L. J. Zhou, C. Q. Teng, D. M. Yan, T.-N. Ye, X. X. Chen, Y. Liu, H.-L. Jiang, Sci. Bull., 2021, 66, 257–264. 47 H.B. Yang D.W. Ma Y. Li Q.H. Zhao F. Pan S.S. Zheng Z.R. Lou Chin. J. Struct. Chem. 42 2023 100031 H. B. Yang, D. W. Ma, Y. Li, Q. H. Zhao, F. Pan, S. S. Zheng, Z. R. Lou, Chin. J. Struct. Chem., 2023, 42, 100031. 48 L.Q. Wu Q. Liang J.Y. Zhao J. Zhu H.N. Jia W. Zhang P. Cai W. Luo Chin. J. Catal. 55 2023 182 190 L. Q. Wu, Q. Liang, J. Y. Zhao, J. Zhu, H. N. Jia, W. Zhang, P. Cai, W. Luo, Chin. J. Catal., 2023, 55, 182–190. 49 G.G. Xi L. Zuo X. Li Y. Jin R. Li T. Zhang J. Mater. Sci. Technol. 70 2021 197 204 G. G. Xi, L. Zuo, X. Li, Y. Jin, R. Li, T. Zhang, J. Mater. Sci. Technol., 2021, 70, 197–204. 50 Y.Z. Wen T. Yang C.Q. Cheng X.R. Zhao E.Z. Liu J. Yang Chin. J. Catal. 41 2020 1161 1167 Y. Z. Wen, T. Yang, C. Q. Cheng, X. R. Zhao, E. Z. Liu, J. Yang, Chin. J. Catal., 2020, 41, 1161–1167. 51 J.T. Zhang G.M. Ren D.Y. Li Q.Y. Kong Z.W. Hu Y. Xu S.L. Wang L. Wang M.F. Cao X.Q. Huang Sci. Bull. 67 2022 2103 2111 J. T. Zhang, G. M. Ren, D. Y. Li, Q. Y. Kong, Z. W. Hu, Y. Xu, S. L. Wang, L. Wang, M. F. Cao, X. Q. Huang, Sci. Bull., 2022, 67, 2103–2111. 52 H.X. Liu R.Q. Zhang L.L. Chen L.C. Wang Y.H. Guo Y.J. Yang Adv. Sustainable Syst. 5 2021 2000184 H. X. Liu, R. Q. Zhang, L. L. Chen, L. C. Wang, Y. H. Guo, Y. J. Yang, Adv. Sustainable Syst., 2021, 5, 2000184. 53 L. Zhao J.B. Zhu Y. Zheng M.L. Xiao R. Gao Z. Zhang G.B. Wen H.Z. Dou Y.-P. Deng A.P. Yu Z.B. Wang Z.W. Chen Adv. Energy Mater. 12 2022 2102665 L. Zhao, J. B. Zhu, Y. Zheng, M. L. Xiao, R. Gao, Z. Zhang, G. B. Wen, H. Z. Dou, Y.-P. Deng, A. P. Yu, Z. B. Wang, Z. W. Chen, Adv. Energy Mater., 2022, 12, 2102665. 54 L. Li Y. Xing J. Electrochem. Soc. 153 2006 A1823 A1828 L. Li, Y. Xing, J. Electrochem. Soc., 2006, 153, A1823–A1828. 55 A. Zagalskaya V. Alexandrov ACS Catal. 10 2020 3650 3657 A. Zagalskaya, V. Alexandrov, ACS Catal., 2020, 10, 3650–3657 56 J. Kim P.-C. Shih K.-C. Tsao Y.-T. Pan X. Yin C.-J. Sun H. Yang J. Am. Chem. Soc. 139 2017 34 12076–12083. J. Kim, P.-C. Shih, K.-C. Tsao, Y.-T. Pan, X. Yin, C.-J. Sun, H. Yang, J. Am. Chem. Soc., 2017, 139, 34, 12076–12083. 57 Y. Zheng Y. Jiao A. Vasileff S.Z. Qiao Angew. Chem. Int. Ed. 57 2018 7568 7579 Y. Zheng, Y. Jiao, A. Vasileff, S. Z. Qiao, Angew. Chem. Int. Ed., 2018, 57, 7568–7579. 58 W.F. Zhai Y.Y. Ma D. Chen J.C. Ho Z.F. Dai Y.Q. Qu InfoMat 4 2022 e12357 W. F. Zhai, Y. Y. Ma, D. Chen, J. C. Ho, Z. F. Dai, Y. Q. Qu, InfoMat, 2022, 4, e12357. 59 R. Parsons Trans Fraday Soc. 54 1958 1053 1063 R. Parsons, Trans Fraday Soc., 1958, 54, 1053–1063. 60 J.K. Nørskov T. Bligaard A. Logadottir J.R. Kitchin J.G. Chen S. Pandelov U. Stimming J Electrochem Soc. 152 2005 J23 J26 J. K. Nørskov, T. Bligaard, A. Logadottir, J. R. Kitchin, J. G. Chen, S. Pandelov, U. Stimming, J Electrochem Soc., 2005, 152, J23–J26. 61 Y.J. Yang Y.H. Yu J. Li Q.R. Chen Y.L. Du P. Rao R.S. Li C.M. Jia Z.Y. Kang P.L. Deng Y.J. Shen X.L. Tian Nano-Micro Lett. 13 2021 160 Y. J. Yang, Y. H. Yu, J. Li, Q. R. Chen, Y. L. Du, P. Rao., R. S. Li, C. M. Jia, Z. Y. Kang, P. L. Deng, Y. J. Shen, X. L. Tian, Nano-Micro Lett., 2021, 13, 160. 62 C. Hu L. Zhang J. Gong Energy Environ. Sci. 12 2019 2620 2645 C. Hu, L. Zhang, J. Gong, Energy Environ. Sci., 2019, 12, 2620–2645. 63 J.K. Nørskov J. Rossmeisl A. Logadottir L. Lindqvist J.R. Kitchin T. Bligaard H. Jónsson J. Phys. Chem. B 108 2004 17886 17892 J. K. Nørskov, J. Rossmeisl, A. Logadottir, L. Lindqvist, J. R. Kitchin, T. Bligaard, H. Jónsson, J. Phys. Chem. B, 2004, 108, 17886–17892. 64 J. Rossmeisl A. Logadottir J.K. Nørskov Chem. Phys. 319 2005 178 184 J. Rossmeisl, A. Logadottir, J. K. Nørskov, Chem. Phys., 2005, 319, 178–184. 65 N. Zhang Y. Chai Energy Environ. Sci. 14 2021 4647 4671 N. Zhang, Y. Chai, Energy Environ. Sci., 2021, 14, 4647–4671. 66 X.P. Wang H.Y. Zhong S.B. Xi W.S.V. Lee J.M. Xue Adv. Mater. 34 2022 2107956 X. P. Wang, H. Y. Zhong, S. B. Xi, W. S. V. Lee, J. M. Xue, Adv. Mater., 2022, 34, 2107956. 67 M. Wohlfahrt-Mehrens J. Heitbaum J. Electroanal. Chem. Interfacial Electrochem. 237 1987 251 260 M. Wohlfahrt-Mehrens, J. Heitbaum, J. Electroanal. Chem. Interfacial Electrochem., 1987, 237, 251–260. 68 X.-P. Zhang H.-Y. Wang H.Q. Zheng W. Zhang R. Cao Chin. J. Catal. 42 2021 1253 1268 X.-P. Zhang, H.-Y. Wang, H. Q. Zheng, W. Zhang, R. Cao, Chin. J. Catal., 2021, 42, 1253–1268. 69 A. Grimaud O. Diaz-Morales B. Han W.T. Hong Y.-L. Lee L. Giordano K.A. Stoerzinger M.T.M. Koper Y. Shao-Horn Nat. Chem. 9 2017 457 465 A. Grimaud, O. Diaz-Morales, B. Han, W. T. Hong, Y.-L. Lee, L. Giordano, K. A. Stoerzinger, M. T. M. Koper, Y. Shao-Horn, Nat. Chem., 2017, 9, 457–465. 70 J.T. Mefford X. Rong A.M. Abakumov W.G. Hardin S. Dai A.M. Kolpak K.P. Johnston K.J. Stevenson Nat. Commun. 7 2016 11053 J. T. Mefford, X. Rong, A. M. Abakumov, W. G. Hardin, S. Dai, A. M. Kolpak, K. P. Johnston, K. J. Stevenson, Nat. Commun., 2016, 7, 11053. 71 Z.-F. Huang J. Song Y. Du S. Xi S. Dou J.M.V. Nsanzimana C. Wang Z.J. Xu X. Wang Nat. Energy 4 2019 329 338 Z.-F. Huang, J. Song, Y. Du, S. Xi, S. Dou, J. M. V. Nsanzimana, C. Wang, Z. J. Xu, X. Wang, Nat. Energy, 2019, 4, 329–338. 72 A. Grimaud W.T. Hong Y. Shao-Horn J.M. Tarascon Nat. Mater. 15 2016 121 126 A. Grimaud, W. T. Hong, Y. Shao-Horn, J. M. Tarascon, Nat. Mater., 2016, 15, 121–126. 73 N. Zhang X. Feng D. Rao X. Deng L. Cai B. Qiu R. Long Y. Xiong Y. Lu Y. Chai Nat. Commun. 11 2020 4066 N. Zhang, X. Feng, D. Rao, X. Deng, L. Cai, B. Qiu, R. Long, Y. Xiong, Y. Lu, Y. Chai, Nat. Commun., 2020, 11, 4066. 74 S.L. Zhao Y.C. Yang Z.Y. Tang Angew. Chem. Int. Ed. 61 2021 e202110186 S. L. Zhao, Y. C. Yang, Z. Y. Tang, Angew. Chem. Int. Ed., 2021, 61, e202110186. 75 S.L. Hu W.-X. Li Science 374 2021 1360 1365 S. L. Hu, W.-X. Li, Science, 2021, 374, 1360–1365. 76 S. Cherevko Curr. Opin. Electrochem. 8 2018 118 125 S. Cherevko, Curr. Opin. Electrochem., 2018, 8, 118–125. 77 Y.-T. Kim P.P. Lopes S.-A. Park A-Y. Lee J. Lim H. Lee S. Back Y. Jung N. Danilovic V. Stamenkovic J. Erlebacher J. Snyder N.M. Markovic Nat. Commun. 8 2017 1449 Y.-T. Kim, P. P. Lopes, S.-A. Park, A-Y. Lee, J. Lim, H. Lee, S. Back, Y. Jung, N. Danilovic, V. Stamenkovic, J. Erlebacher, J. Snyder, N. M. Markovic, Nat. Commun., 2017, 8, 1449. 78 J.Y. Li Z.M. Xia M.K. Zhang S. Zhang J. Li Y.Y. Ma Y.Q. Qu J. Mater. Chem. A 7 2019 17775 17781 J. Y. Li, Z. M. Xia, M. K. Zhang, S. Zhang, J. Li, Y. Y. Ma, Y. Q. Qu, J. Mater. Chem. A, 2019, 7, 17775–17781. 79 S. Geiger O. Kasian M. Ledendecker E. Pizzutilo A.M. Mingers W.T. Fu O. Diaz-Morales Z.Z. Li T. Oellers L. Fruchter A. Ludwig K.J.J. Mayrhofer M.T.M. Koper S. Cherevko Nat. Catal. 1 2018 508 515 S. Geiger, O. Kasian, M. Ledendecker, E. Pizzutilo, A. M. Mingers, W. T. Fu, O. Diaz-Morales, Z. Z. Li, T. Oellers, L. Fruchter, A. Ludwig, K. J. J. Mayrhofer, M. T. M. Koper, S. Cherevko, Nat. Catal., 2018, 1, 508–515. 80 L.-A. Stern L. Feng F. Song X. Hu Energy Environ. Sci. 8 2015 2347 2351 L.-A. Stern, L. Feng, F. Song, X. Hu, Energy Environ. Sci., 2015, 8, 2347–2351. 81 X. Liu R. Guo K. Ni F. Xia C. Niu B. Wen J. Meng P. Wu J. Wu X. Wu L. Mai Adv. Mater. 32 2020 2001136 X. Liu, R. Guo, K. Ni, F. Xia, C. Niu, B. Wen, J. Meng, P. Wu, J. Wu, X. Wu, L. Mai, Adv. Mater., 2020, 32, 2001136. 82 X.L. Zheng B. Zhang P.D. Luna Y.F. Liang R. Comin O. Voznyy L.L. Han F.P.G. de Arquer M. Liu C.T. Dinh T. Regier J.J. Dynes S.S. He H.L. Xin H.S. Peng D. Prendergast X.W. Du E. Sargent Nat. Chem. 10 2018 149 154 X. L. Zheng, B. Zhang, P. D. Luna, Y. F. Liang, R. Comin, O. Voznyy, L. L. Han, F. P. G. de Arquer, M. Liu, C. T. Dinh, T. Regier, J. J. Dynes, S. S. He, H. L. Xin, H. S. Peng, D. Prendergast, X. W. Du, E. Sargent, Nat. Chem., 2018, 10, 149–154. 83 F. Dionigi Z.H. Zeng I. Sinev T. Merzdorf S. Deshpande M.B. Lopez S. Kunze I. Zegkinoglou H. Sarodnik D.X. Fan A. Bergmann J. Drnec J.F. de Araujo M. Gliech D. Teschner J. Zhu W.-X. Li J. Greeley B.R. Cuenya P. Strasser Nat. Commun. 11 2020 2522 F. Dionigi, Z. H. Zeng, I. Sinev, T. Merzdorf, S. Deshpande, M. B. Lopez, S. Kunze, I. Zegkinoglou, H. Sarodnik, D. X. Fan, A. Bergmann, J. Drnec, J. F. de Araujo, M. Gliech, D. Teschner, J. Zhu, W.-X. Li, J. Greeley, B. R. Cuenya, P. Strasser, Nat. Commun., 2020, 11, 2522. 84 F.-Y. Chen Z.-Y. Wu Z. Adler H.T. Wang Joule 5 2021 1704 1731 F.-Y. Chen, Z.-Y. Wu, Z. Adler, H. T. Wang, Joule, 2021, 5, 1704–1731. 85 S. Wang Z. Teng C. Wang G. Wang ChemSusChem 11 2018 2267 2295 S. Wang, Z. Teng, C. Wang, G. Wang, ChemSusChem, 2018, 11, 2267–2295. 86 S. Pérez-Rodríguez D. Sebastián M.J. Lázaro E. Pastor J. Catal. 355 2017 156 166 S. Pérez-Rodríguez, D. Sebastián, M.J. Lázaro, E. Pastor, J. Catal., 2017, 355 156–166. 87 G.Z. Li T. Sun H.-J. Niu Y. Yan T. Liu S.S. Jiang Q.L. Yang W. Zhou L. Guo Adv. Funct. Mater. 33 2023 2212514 G. Z. Li, T. Sun, H.-J. Niu, Y. Yan, T. Liu, S. S. Jiang, Q. L. Yang, W. Zhou, L. Guo, Adv. Funct. Mater., 2023, 33, 2212514. 88 S.Y. Chen S.Y. Wang P.P. Hao M.H. Li Y. Zhang J. Guo W.P. Ding M. Liu J.L. Wang X.F. Guo Appl. Catal. B 304 2022 120996 S. Y. Chen, S. Y. Wang, P. P. Hao, M. H. Li, Y. Zhang, J. Guo, W. P. Ding, M. Liu, J. L. Wang, X. F. Guo, Appl. Catal. B, 2022, 304, 120996. 89 Q.X. Wan S.L. Hu J.N. Dai C.Q. Chen W.-X. Li J. Phys. Chem. C 123 2019 1160 1169 Q. X. Wan, S. L. Hu, J. N. Dai, C. Q. Chen, W.-X. Li, J. Phys. Chem. C, 2019, 123, 1160–1169. 90 H.N.N. Tobias Reier D. Teschner R. Schlögl P. Strasser Adv. Energy Mater. 7 2017 1601275 H. N. N. Tobias Reier, D. Teschner, R. Schlögl, P. Strasser, Adv. Energy Mater., 2017, 7, 1601275. 91 C.F. Dickens J.K. Nørskov J. Phys. Chem. C 121 2017 18516 18524 C. F. Dickens, J. K. Nørskov, J. Phys. Chem. C, 2017, 121, 18516–18524. 92 E.A. Paoli F. Masini R. Frydendal D. Deiana C. Schlaup M. Malizia T.W. Hansen S. Horch I.E.L. Stephens I. Chorkendorff Chem. Sci. 6 2015 190 196 E. A. Paoli, F. Masini, R. Frydendal, D. Deiana, C. Schlaup, M. Malizia, T. W. Hansen, S. Horch, I. E. L. Stephens, I. Chorkendorff, Chem. Sci., 2015, 6, 190–196. 93 Y. Lee J. Suntivich K.J. May E.E. Perry Y. Shao-Horn J. Phys. Chem. Lett. 3 2012 399 404 Y. Lee, J. Suntivich, K. J. May, E. E. Perry, Y. Shao-Horn, J. Phys. Chem. Lett., 2012, 3, 399–404. 94 X. Chu L. Wang J. Li H. Xu Chem. Rec. 23 2023 e202300013 X. Chu, L. Wang, J. Li, H. Xu, Chem. Rec. 2023, 23, e202300013. 95 X.L. Jiang H. Jang S.G. Liu Z.J. Li M.G. Kim C. Li Q. Qin X.E. Liu J. Cho Angew. Chem. Int. Ed. 60 2021 4110 4116 X. L. Jiang, H. Jang, S. G. Liu, Z. J. Li, M. G. Kim, C. Li, Q. Qin, X. E. Liu, J. Cho, Angew. Chem. Int. Ed., 2021, 60, 4110–4116. 96 M.Z. You X. Du X.H. Hou Z.Y. Wang Y. Zhou H.P. Ji L.Y. Zhang Z.T. Zhang S.S. Yi D.L. Chen Appl. Catal. B 317 2022 121729 M. Z. You, X. Du, X. H. Hou, Z. Y. Wang, Y. Zhou, H. P. Ji, L. Y. Zhang, Z. T. Zhang, S. S. Yi, D. L. Chen, Appl. Catal. B, 2022, 317, 121729. 97 G.W. Zhang B. Wang L. Li S. Yang J.M. Liu S.C. Yang J. Mater. Chem. A 8 2020 18945 18954 G. W. Zhang, B. Wang, L. Li, S. Yang, J. M. Liu, S. C. Yang, J. Mater. Chem. A, 2020, 8, 18945–18954. 98 Y. Xu S.S. Yu T.H. Ren S.L. Liu Z.Q. Wang X.N. Li L. Wang H.J. Wang ACS Appl. Mater. Interfaces 12 2020 34728 34735 Y. Xu, S. S. Yu, T. H. Ren, S. L. Liu, Z. Q. Wang, X. N. Li, L. Wang, H. J. Wang, ACS Appl. Mater. Interfaces, 2020, 12, 34728–34735. 99 Y. Ding K.-W. Cao J.-W. He F.-M. Li H. Huang P. Chen Y. Chen Chin. J. Catal. 43 2022 1535 1543 Y. Ding, K.-W. Cao, J.-W. He, F.-M. Li, H. Huang, P. Chen, Y. Chen, Chin. J. Catal., 2022, 43, 1535–1543. 100 B.B. Yang J.Y. Xu D. Bin J. Wang J.Z. Zhao Y.X. Liu B.X. Li X.N. Fang Y. Liu L. Qiao L.F. Liu B.H. Liu Appl. Catal. B 283 2021 119583 B. B. Yang, J. Y. Xu, D. Bin, J. Wang, J. Z. Zhao, Y. X. Liu, B. X. Li, X. N. Fang, Y. Liu, L. Qiao, L. F. Liu, B. H. Liu, Appl. Catal. B, 2021, 283, 119583. 101 G.Y. Zhou S.K. Zhang Y.F. Zhu J. Li K. Sun H. Pang M.Y. Zhang Y.W. Tang L. Xu Small 19 2023 2206781 G. Y. Zhou, S. K. Zhang, Y. F. Zhu, J. Li, K. Sun, H. Pang, M. Y. Zhang, Y. W. Tang, L. Xu, Small, 2023, 19, 2206781. 102 J.-Q. Chi W.-K. Gao J.-H. Lin B. Dong K.-L. Yan J.-F. Qin B. Liu Y.-M. Chai C.-G. Liu ChemSusChem 11 2018 743 752 J.-Q. Chi, W.-K. Gao, J.-H. Lin, B. Dong, K.-L. Yan, J.-F. Qin, B. Liu, Y.-M. Chai, C.-G. Liu, ChemSusChem, 2018, 11, 743–752. 103 W.Y. Gou J.Y. Li W. Gao Z.M. Xia S. Zhang Y.Y. Ma ChemCatChem 11 2019 1970 1976 W. Y. Gou, J. Y. Li, W. Gao, Z. M. Xia, S. Zhang, Y. Y. Ma, ChemCatChem, 2019, 11, 1970–1976. 104 Y.Q. Feng W.H. Feng J. Wan J.S. Chen H. Wang S.M. Li T.M. Luo Y.Z. Hu C.K. Yuan L.Y. Cao L.L. Feng J. Li R. Wen J.F. Huang Appl. Catal. B 307 2022 121193 Y. Q. Feng, W. H. Feng, J. Wan, J. S. Chen, H. Wang, S. M. Li, T. M. Luo, Y. Z. Hu, C. K. Yuan, L. Y. Cao, L. L. Feng, J. Li, R. Wen, J. F. Huang, Appl. Catal. B, 2022, 307, 121193. 105 D. Chen R.H. Yu D.L. Wu H.Y. Zhao P.Y. Wang J.W. Zhu P.X. Ji Z.H. Pu L. Chen J. Yu S.C. Mu Nano Energy 100 2022 107445 D. Chen, R. H. Yu, D. L. Wu, H. Y. Zhao, P. Y. Wang, J. W. Zhu, P. X. Ji, Z. H. Pu, L. Chen, J. Yu, S. C. Mu, Nano Energy, 2022, 100, 107445. 106 S. Zhang C. Wang X.Y. Zhang H.Y. Xia B.L. Huang S.J. Guo J. Li E.K. Wang ACS Appl. Mater. Interfaces 13 2021 32997 33005 S. Zhang, C. Wang, X. Y. Zhang, H. Y. Xia, B. L. Huang, S. J. Guo, J. Li, E. K. Wang, ACS Appl. Mater. Interfaces, 2021, 13, 32997–33005. 107 X.Y. Liu F. Liu J.Y. Yu G.W. Xiong L.L. Zhao Y.H. Sang S.W. Zuo J. Zhang H. Liu W.J. Zhou Adv. Sci. 7 2020 2001526 X. Y. Liu, F. Liu, J. Y. Yu, G. W. Xiong, L. L. Zhao, Y. H. Sang, S. W. Zuo, J. Zhang, H. Liu, W. J. Zhou, Adv. Sci., 2020, 7, 2001526. 108 Y. Wei G. Xu Y.J. Wei L.L. Ji T. Wang Z. Liu S. Wang Sci. China Mater. 65 2022 2675 2684 Y. Wei, G. Xu, Y. J. Wei, L. L. Ji, T. Wang, Z. Liu, S. Wang, Sci. China Mater., 2022, 65, 2675–2684. 109 J. Mahmood F. Li S.-M. Jung M.S. Okyay I. Ahmad S.-J. Kim N. Park H.Y. Jeong J.-B. Baek Nat. Nanotechnol. 12 2017 441 446 J. Mahmood, F. Li, S.-M. Jung, M. S. Okyay, I. Ahmad, S.-J. Kim, N. Park, H. Y. Jeong, J.-B. Baek, Nat. Nanotechnol., 2017, 12, 441–446. 110 K.J. Tu D. Tranca F. Rodríguez-Hernández K.Y. Jiang S.H. Huang Q. Zheng M.-X. Chen C.B. Lu Y.Z. Su Z.Y. Chen H.Y. Mao C.Q. Yang J.Y. Jiang H.-W. Liang X.D. Zhuang Adv. Mater. 32 2020 2005433 K. J. Tu, D. Tranca, F. Rodríguez-Hernández, K. Y. Jiang, S.H. Huang, Q. Zheng, M.-X. Chen, C. B. Lu, Y. Z. Su, Z. Y. Chen, H. Y. Mao, C. Q. Yang, J. Y. Jiang, H.-W. Liang, X. D. Zhuang, Adv. Mater., 2020, 32, 2005433. 111 C. Li H. Jang S.G. Liu M.G. Kim L.Q. Hou X.E. Liu J. Cho Adv. Energy Mater. 12 2022 2200029 C. Li, H. Jang, S. G. Liu, M. G. Kim, L. Q. Hou, X. E. Liu, J. Cho, Adv. Energy Mater., 2022, 12, 2200029. 112 J.Y. Yu X.D. Wang X.W. Huang J.Y. Cao Q.H. Huo L.R. Mi H.P. Yang Q. Hu C.X. He Chem. Eng. J. 446 2022 137248 J. Y. Yu, X. D. Wang, X. W. Huang, J. Y. Cao, Q. H. Huo, L. R. Mi, H. P. Yang, Q. Hu, C. X. He, Chem. Eng. J., 2022, 446, 137248. 113 H.B. Liu Q.H. Jia S.Q. Huang L. Yang S.T. Wang L.R. Zheng D.P. Cao J. Mater. Chem. A 10 2022 4817 4824 H. B. Liu, Q. H. Jia, S. Q. Huang, L. Yang, S. T. Wang, L. R. Zheng, D. P. Cao, J. Mater. Chem. A, 2022, 10, 4817–4824. 114 D.H. Kweon M.S. Okyay S.-J. Kim J.-P. Jeon H.-J. Noh N. Park J. Mahmood J.-B. Baek Nat. Commun. 11 2020 1278 D. H. Kweon, M. S. Okyay, S.-J. Kim, J.-P. Jeon, H.-J. Noh, N. Park, J. Mahmood, J.-B. Baek, Nat. Commun., 2020, 11, 1278. 115 K. Chen Z.M. Wang L. Wang X.Z. Wu B.J. Hu Z. Liu M.H. Wu Nano-Micro Lett. 13 2021 138 K. Chen, Z. M. Wang, L. Wang, X. Z. Wu, B. J. Hu, Z. Liu, M. H. Wu, Nano-Micro Lett., 2021, 13, 138. 116 J.N. Tiwari A.M. Harzandi M. Ha S. Sultan C.W. Myung H.J. Park D.Y. Kim P. Thangavel A.N. Singh P. Sharma S.S. Chandrasekaran F. Salehnia J.-W. Jang H.S. Shin Z. Lee K.S. Kim Adv. Energy Mater. 9 2019 1900931 J. N. Tiwari, A. M. Harzandi, M. Ha, S. Sultan, C. W. Myung, H. J. Park, D. Y. Kim, P. Thangavel, A. N. Singh, P. Sharma, S. S. Chandrasekaran, F. Salehnia, J.-W. Jang, H. S. Shin, Z. Lee, K. S. Kim, Adv. Energy Mater., 2019, 9, 1900931. 117 S.H. Ye F.Y. Luo T.T. Xu P.Y. Zhang H.D. Shi S.Q. Qin J.P. Wu C.X. He X.P. Ouyang Q.L. Zhang J.H. Liu X.L. Sun Nano Energy 68 2020 104301 S. H. Ye, F. Y. Luo, T. T. Xu, P. Y. Zhang, H. D. Shi, S. Q. Qin, J. P. Wu, C. X. He, X. P. Ouyang, Q. L. Zhang, J. H. Liu, X. L. Sun, Nano Energy, 2020, 68, 104301. 118 T.T. Gao X.M. Tang X.Q. Li S.W. Wu S.M. Yu P.P. Li D. Xiao Z.Y. Jin ACS Catal. 13 2023 49 59 T. T. Gao, X. M. Tang, X. Q. Li, S.W. Wu, S. M. Yu, P. P. Li, D. Xiao, Z. Y. Jin, ACS Catal., 2023, 13, 49–59. 119 Y.Z. Li T.T. Xu Q. Huang L.T. Zhu Y.Y. Yan P. Peng F.-F. Li ACS Catal. 13 2023 7597 7605 Y. Z. Li, T. T. Xu, Q. Huang, L. T. Zhu, Y. Y. Yan, P. Peng, F.-F. Li, ACS Catal., 2023, 13, 7597–7605. 120 J.R. Yang W.H. Li D.S. Wang Y.D. Li Adv. Mater. 32 2020 2003300 J. R. Yang, W. H. Li, D. S. Wang, Y. D. Li, Adv. Mater., 2020, 32, 2003300. 121 Y.J. Yang D.X. Wu R.S. Li P. Rao J. Li P.L. Deng J.M. Luo W. Huang Q. Chen Z.Y. Kang Y.J. Shen X.L. Tian Appl. Catal. B 317 2022 121796 Y. J. Yang, D. X. Wu, R. S. Li, P. Rao, J. Li, P. L. Deng, J. M. Luo, W. Huang, Q. Chen, Z. Y. Kang, Y. J. Shen, X. L. Tian, Appl. Catal. B, 2022, 317, 121796. 122 H.J. Song M.-C. Sung H. Yoon B. Ju D.-W. Kim Adv. Sci. 6 2019 1802135 H. J. Song, M.-C. Sung, H. Yoon, B. Ju, D.-W. Kim, Adv. Sci., 2019, 6, 1802135. 123 Z. Zhang P. Li Q. Feng B. Wei C.L. Deng J.T. Fan H. Li H.J. Wang ACS Appl. Mater. Interfaces 10 2018 32171 32179 Z. Zhang, P. Li, Q. Feng, B. Wei, C. L. Deng, J. T. Fan, H. Li, H. J. Wang, ACS Appl. Mater. Interfaces, 2018, 10, 32171–32179. 124 J.Y. Yu A.Z. Wang W.Q. Yu X.Y. Liu X. Li H. Liu Y.Y. Hu Y.E. Wu W.J. Zhou Appl. Catal. B 277 2020 119236 J. Y. Yu, A. Z. Wang, W. Q. Yu, X. Y. Liu, X. Li, H. Liu, Y. Y. Hu, Y. E. Wu, W. J. Zhou, Appl. Catal. B, 2020, 277, 119236. 125 P.S. Li M.Y. Wang X.X. Duan L.R. Zheng X.P. Cheng Y.F. Zhang Y. Kuang Y.P. Li Q. Ma Z.X. Feng W. Liu X.M. Sun Nat. Commun. 10 2019 1711 P. S. Li, M. Y. Wang, X. X. Duan, L. R. Zheng, X. P. Cheng, Y. F. Zhang, Y. Kuang, Y. P. Li, Q. Ma, Z. X. Feng, W. Liu, X. M. Sun, Nat. Commun., 2019, 10, 1711. 126 L. Dai Z.-N. Chen L.X. Li P.Q. Yin Z.Q. Liu H. Zhang Adv. Mater. 32 2020 1906915 L. Dai, Z.-N. Chen, L. X. Li, P. Q. Yin, Z. Q. Liu, H. Zhang, Adv. Mater., 2020, 32, 1906915. 127 X.Y. Chen J.W. Wan J. Wang Q.H. Zhang L. Gu L.R. Zheng N. Wang R.B. Yu Adv. Mater. 33 2021 2104764 X. Y. Chen, J. W. Wan, J. Wang, Q. H. Zhang, L. Gu, L. R. Zheng, N. Wang, R. B. Yu, Adv. Mater., 2021, 33, 2104764. 128 H. Liu G.Y. Tan M.X. Li Z. Zhang M.G. Sendeku Y.P. Li Y. Kuang X.M. Sun Chem. Eng. J. 458 2023 141414 H. Liu, G. Y. Tan, M. X. Li, Z. Zhang, M. G. Sendeku, Y. P. Li, Y. Kuang, X. M. Sun, Chem. Eng. J., 2023, 458, 141414. 129 M. Zhao Z.T. Chen Z.H. Lyu Z.D. Hood M.H. Xie M. Vara M.F. Chi Y.N. Xia J. Am. Chem. Soc. 141 2019 7028 7036 M. Zhao, Z. T. Chen, Z. H. Lyu, Z. D. Hood, M. H. Xie, M. Vara, M. F. Chi, Y. N. Xia, J. Am. Chem. Soc., 2019, 141, 7028–7036. 130 J.T. Zhang J.B. Le Y.T. Dong L.Z. Bu Y. Zhang J. Cheng L.G. Li X.Q. Huang Sci. China Chem. 65 2022 87 95 J. T. Zhang, J. B. Le, Y. T. Dong, L. Z. Bu, Y. Zhang, J. Cheng, L. G. Li, X. Q. Huang, Sci. China Chem., 2022, 65, 87–95. 131 L.G. Li C. Liu S.H. Liu J. Wang J.J. Han T.-S. Chan Y.Y. Li Z.W. Hu Q. Shao Q.B. Zhang X.Q. Huang ACS Nano 16 2022 14885 14894 L. G. Li, C. Liu, S. H. Liu, J. Wang, J. J. Han, T.-S. Chan, Y. Y. Li, Z. W. Hu, Q. Shao, Q. B. Zhang, X. Q. Huang, ACS Nano, 2022, 16, 14885–14894. 132 J. Kim H.J. Kim B. Ruqia M.J. Kim Y.-J. Jang T.H. Jo H. Baik H.-S. Oh H.-S. Chung K. Baek S. Noh M. Jung K. Kim H.-K. Lim Y.-S. Youn S.-I. Choi Adv. Mater. 33 2021 2105248 J. Kim, H. J. Kim, B. Ruqia, M. J. Kim, Y.-J. Jang, T. H. Jo, H. Baik, H.-S. Oh, H.-S. Chung, K. Baek, S. Noh, M. Jung, K. Kim, H.-K. Lim, Y.-S. Youn, S.-I. Choi, Adv. Mater., 2021, 33, 2105248. 133 J. Zhu L.S. Hu P.X. Zhao L.Y.S. Lee K.-Y. Wong Chem. Rev. 120 2 2020 851 918 J. Zhu, L. S. Hu, P. X. Zhao, L. Y. S. Lee, K.-Y. Wong, Chem. Rev., 2020, 120, 2, 851–918. 134 D. Strmcnik P.P. Lopes B. Genorio V.R. Stamenkovic N.M. Markovic Nano Energy 29 2016 29 36 D. Strmcnik, P. P. Lopes, B. Genorio, V. R. Stamenkovic, N. M. Markovic, Nano Energy, 2016, 29, 29–36. 135 K.F. Wang B. Li W. Wei J.G. Wang Q. Shen P. Qu Nanoscale 12 2020 23740 23747 K. F. Wang, B. Li, W. Wei, J. G. Wang, Q. Shen, P. Qu, Nanoscale, 2020,12, 23740–23747. 136 L.-N. Chen S.-H. Wang P.-Y. Zhang Z.-X. Chen X. Lin H.-J. Yang T. Sheng W.-F. Lin N. Tian S.-G. Sun Z.-Y. Zhou Nano Energy 88 2021 106211 L.-N. Chen, S.-H. Wang, P.-Y. Zhang, Z.-X. Chen, X. Lin, H.-J. Yang, T. Sheng, W.-F. Lin, N. Tian, S.-G. Sun, Z.-Y. Zhou, Nano Energy, 2021, 88, 106211. 137 Y.L. Dang T.L. Wu H.Y. Tan J.L. Wang C. Cui P. Kerns W. Zhao L. Posada L.Y. Wen S.L. Suib Energy Environ. Sci. 14 2021 5433 5443 Y. L. Dang, T. L. Wu, H. Y. Tan, J. L. Wang, C. Cui, P. Kerns, W. Zhao, L. Posada, L. Y. Wen, S. L. Suib, Energy Environ. Sci., 2021, 14, 5433–5443. 138 J.C. Zhang G.B. Chen Q.C. Liu C. Fan D.M. Sun Y.W. Tang H.J. Sun X.L. Feng Angew. Chem. Int. Ed. 61 2022 e202209486 J. C. Zhang, G. B. Chen, Q. C. Liu, C. Fan, D. M. Sun, Y. W. Tang, H. J. Sun, X. L. Feng, Angew. Chem. Int. Ed., 2022, 61, e202209486. 139 S.Z. Zhou H. Jang Q. Qin L.Q. Hou M.G. Kim S.G. Liu X.E. Liu J. Cho Angew. Chem. Int. Ed. 61 2022 e202212196 S. Z. Zhou, H. Jang, Q. Qin, L. Q. Hou, M. G. Kim, S. G. Liu, X. E. Liu, J. Cho, Angew. Chem. Int. Ed., 2022, 61, e202212196 140 K. Wang J.H. Zhou M.Z. Sun F.X. Lin B.L. Huang F. Lv L.Y. Zeng Q.H. Zhang L. Gu M.C. Luo S.J. Guo Adv. Mater. 35 2023 2300980 K. Wang, J. H. Zhou, M. Z. Sun, F. X. Lin, B. L. Huang, F. Lv, L. Y. Zeng, Q. H. Zhang, L. Gu, M. C. Luo, S. J. Guo, Adv. Mater., 2023, 35, 2300980. 141 C.Q. Li S.H. Kim H.Y. Lim Q.K. Sun Y. Jiang H.-J. Noh S.-J. Kim J. Baek S.K. Kwak J.-B. Baek Adv. Mater. 35 2023 2301369 C. Q. Li, S. H. Kim, H. Y. Lim, Q. K. Sun, Y. Jiang, H.-J. Noh, S.-J. Kim, J. Baek, S. K. Kwak, J.-B. Baek, Adv. Mater., 2023, 35, 2301369. 142 X. Wang J. Ding W.Q. Song X.Y. Yang T. Zhang Z.C. Huang H.Z. Wang X.P. Han W.B. Hu Adv. Energy Mater. 13 2023 2300148 X. Wang, J. Ding, W. Q. Song, X. Y. Yang, T. Zhang, Z. C. Huang, H. Z. Wang, X. P. Han, W. B. Hu, Adv. Energy Mater., 2023, 13, 2300148. 143 R.R. Tang Y. Yang Y.T. Zhou X.-Y. Yu Adv. Funct. Mater. 34 2023 2301925 R. R. Tang, Y. Yang, Y. T. Zhou, X.-Y. Yu, Adv. Funct. Mater., 2023, 34, 2301925. 144 Y.J. Li H.J. Liu B. Li Z.Z. Yang Z.G. Guo J.-B. He J.H. Xie T.-C. Lau J. Mater. Chem. A 9 2021 12196 Y. J. Li, H. J. Liu, B. Li, Z. Z. Yang, Z. G. Guo, J.-B. He, J. H. Xie, T.-C. Lau, J. Mater. Chem. A, 2021, 9, 12196. 145 B.B. Pang X.K. Liu T.Y. Liu T. Chen X.Y. Shen W. Zhang S.C. Wang T. Liu D. Liu T. Ding Z.L. Liao Y.F. Li C.H. Liang T. Yao Energy Environ. Sci. 15 2022 102 108 B. B. Pang, X. K. Liu, T. Y. Liu, T. Chen, X. Y. Shen, W. Zhang, S. C. Wang, T. Liu, D. Liu, T. Ding, Z. L. Liao, Y. F. Li, C. H. Liang, T. Yao, Energy Environ. Sci., 2022, 15, 102–108. 146 H.Q. Song M. Wu Z.Y. Tang J.S. Tse B. Yang S.Y. Lu Angew. Chem. Int. Ed. 60 2021 7234 7244 H. Q. Song, M. Wu, Z. Y. Tang, J. S. Tse, B. Yang, S. Y. Lu, Angew. Chem. Int. Ed., 2021, 60, 7234–7244. 147 H. Su S.J. Song Y.Q. Gao N. Li Y. Fu L. Ge W.Y. Song J. Liu T.Y. Ma Adv. Funct. Mater. 32 2022 2109731 H. Su, S. J. Song, Y. Q. Gao, N. Li, Y. Fu, L. Ge, W. Y. Song, J. Liu, T. Y. Ma, Adv. Funct. Mater., 2022, 32, 2109731. 148 J.Q. Shan C.X. Guo Y.H. Zhu S.M. Chen L. Song M. Jaroniec Y. Zheng S.-Z. Qiao Chem 5 2019 445 459 J. Q. Shan, C. X. Guo, Y. H. Zhu, S. M. Chen, L. Song, M. Jaroniec, Y. Zheng, S.-Z. Qiao, Chem, 2019, 5, 445–459. 149 J. He X. Zhou P. Xu J.M. Sun Adv. Energy Mater. 11 2021 2102883 J. He, X. Zhou, P. Xu, J. M. Sun, Adv. Energy Mater., 2021, 11, 2102883. 150 D.S. Wu K. Kusada S. Yoshioka T. Yamamoto T. Toriyama S. Matsumura Y.N. Chen O. Seo J. Kim C. Song S. Hiroi O. Sakata T. Ina S.O. Kawaguchi Y. Kubota H. Kobayashi H. Kitagawa Nat. Commun. 12 2021 1145 D. S. Wu, K. Kusada, S. Yoshioka, T. Yamamoto, T. Toriyama, S. Matsumura, Y. N. Chen, O. Seo, J. Kim, C. Song, S. Hiroi, O. Sakata, T. Ina, S. O. Kawaguchi, Y. Kubota, H. Kobayashi, H. Kitagawa, Nat. Commun., 2021, 12, 1145. 151 X.J. Cui P.J. Ren C. Ma J. Zhao R.X. Chen S.M. Chen N.P. Rajan H. Li L. Yu Z.Q. Tian D.H. Deng Adv. Mater. 32 2020 1908126 X. J. Cui, P. J. Ren, C. Ma, J. Zhao, R. X. Chen, S. M. Chen, N. P. Rajan, H. Li, L. Yu, Z. Q. Tian, D. H. Deng, Adv. Mater., 2020, 32, 1908126. 152 H.H. Yan Z.Q. Jiang B.L. Deng Y.J. Wang Z.-J. Jiang Adv. Energy Mater. 13 2023 2300152 H. H. Yan, Z. Q. Jiang, B. L. Deng, Y. J. Wang, Z.-J. Jiang, Adv. Energy Mater., 2023, 13, 2300152. 153 K. Wang B.L. Huang W.Y. Zhang F. Lv Y. Xing W.S. Zhang J.H. Zhou W.X. Yang F.X. Lin P. Zhou M.Q. Li P. Gao S.J. Guo J. Mater. Chem. A 8 2020 15746 15751 K. Wang, B. L. Huang, W. Y. Zhang, F. Lv, Y. Xing, W. S. Zhang, J. H. Zhou, W. X. Yang, F. X. Lin, P. Zhou, M. Q. Li, P. Gao, S. J. Guo, J. Mater. Chem. A, 2020, 8, 15746–15751. 154 A.M. Harzandi S. Shadman A.S. Nissimagoudar D.Y. Kim H.-D. Lim J.H. Lee M.G. Kim H.Y. Jeong Y. Kim K.S. Kim Adv. Energy Mater. 11 2021 2003448 A. M. Harzandi, S. Shadman, A. S. Nissimagoudar, D. Y. Kim, H.-D. Lim, J. H. Lee, M. G. Kim, H. Y. Jeong, Y. Kim, K. S. Kim, Adv. Energy Mater., 2021, 11, 2003448. 155 H.D. Yu L. Hui Y.R. Xue Y.X. Liu Y. Fang C.Y. Xing C. Zhang D.Y. Zhang X. Chen Y.C. Du Z.Q. Wang Y. Gao B.L. Huang Y.L. Li Nano Energy 72 2020 104667 H. D. Yu, L. Hui, Y. R. Xue, Y. X. Liu, Y. Fang, C. Y. Xing, C. Zhang, D. Y. Zhang, X. Chen, Y. C. Du, Z. Q. Wang, Y. Gao, B. L. Huang, Y. L. Li, Nano Energy, 2020, 72, 104667. 156 L.L. Cao Q.Q. Luo J.J. Chen L. Wang Y. Lin H.J. Wang X.K. Liu X.Y. Shen W. Zhang W. Liu Z.M. Qi Z. Jiang J.L. Yang T. Yao Nat. Commun. 10 2019 4849 L. L. Cao, Q. Q. Luo, J. J. Chen, L. Wang, Y. Lin, H. J. Wang, X. K. Liu, X. Y. Shen, W. Zhang, W. Liu, Z. M. Qi, Z. Jiang, J. L. Yang, T. Yao, Nat. Commun., 2019, 10, 4849. 157 J.Y. Xu J.J. Li Z. Lian A. Araujo Y. Li B. Wei Z.P. Yu O. Bondarchuk I. Amorim V. Tileli B. Li L.F. Liu ACS Catal. 11 2021 3402 3413 J. Y. Xu, J. J. Li, Z. Lian, A. Araujo, Y. Li, B. Wei, Z. P. Yu, O. Bondarchuk, I. Amorim, V. Tileli, B. Li, L. F. Liu, ACS Catal., 2021, 11, 3402–3413. 158 X.J. Wang X.H. Wan X.X. Qin C. Chen X.S. Qian Y.Z. Guo Q.J. Xu W.-B. Cai H. Yang K. Jiang ACS Catal. 12 2022 9437 9445 X. J. Wang, X. H. Wan, X. X. Qin, C. Chen, X. S. Qian, Y. Z. Guo, Q. J. Xu, W.-B. Cai, H. Yang, K. Jiang, ACS Catal., 2022, 12, 9437–9445. 159 C.-Z. Yuan S. Wang K.S. Hui K.X. Wang J.F. Li H.X. Gao C.Y. Zha X.M. Zhang D.A. Dinh X.-L. Wu Z.K. Tang J.W. Wan Z.P. Shao K.N. Hui ACS Catal. 13 2023 2462 2471 C.-Z. Yuan, S. Wang, K. S. Hui, K. X. Wang, J. F. Li, H. X. Gao, C. Y. Zha, X. M. Zhang, D. A. Dinh, X.-L. Wu, Z. K. Tang, J. W. Wan, Z. P. Shao, K. N. Hui, ACS Catal., 2023, 13, 2462–2471. 160 X.X. Duan P.S. Li D.J. Zhou S.Y. Wang H. Liu Z.L. Wang X.H. Zhang G.T. Yang Z. Zhang G.Y. Tan Y.P. Li L.J. Xu W. Liu Z.H. Xing Y. Kuang X.M. Sun Chem. Eng. J. 446 2022 136962 X. X. Duan, P. S. Li, D. J. Zhou, S. Y. Wang, H. Liu, Z. L. Wang, X. H. Zhang, G. T. Yang, Z. Zhang, G. Y. Tan, Y. P. Li, L. J. Xu, W. Liu, Z. H. Xing, Y. Kuang, X. M. Sun, Chem. Eng. J., 2022, 446, 136962. 161 Y.D. Hu G. Luo L.G. Wang X.K. Liu Y.T. Qu Y.S. Zhou F.Y. Zhou Z.J. Li Y.F. Li T. Yao C. Xiong B. Yang Z.Q. Yu Y.E. Wu Adv. Energy Mater. 11 2021 2002816 Y. D. Hu, G. Luo, L. G. Wang, X. K. Liu, Y. T. Qu, Y. S. Zhou, F. Y. Zhou, Z. J. Li, Y. F. Li, T. Yao, C. Xiong, B. Yang, Z. Q. Yu, Y. E. Wu, Adv. Energy Mater., 2021, 11, 2002816. 162 N. Yao H.G. Jia J. Zhu Z.P. Shi H.J. Cong J.J. Ge W. Luo Chem 9 2023 1882 1896 N. Yao, H. G. Jia, J. Zhu, Z. P. Shi, H. J. Cong, J. J. Ge, W. Luo, Chem, 2023, 9, 1882–1896. 163 L.Q. Hou Z.J. Li H. Jang Y. Wang X.M. Cui X.M. Gu M.G. Kim L.G. Feng S.G. Liu X.E. Liu Adv. Energy Mater. 13 2023 2300177 L. Q. Hou, Z. J. Li, H. Jang, Y. Wang, X. M. Cui, X. M. Gu, M. G. Kim, L. G. Feng, S. G. Liu, X. E. Liu, Adv. Energy Mater., 2023, 13, 2300177. 164 Y.R. Xue J.J. Fang X.D. Wang Z.Y. Xu Y.F. Zhang Q.Q. Lv M.Y. Liu Wei Zhu Z.B. Zhuang Adv. Funct. Mater. 31 2021 2101405 Y. R. Xue, J. J. Fang, X. D. Wang, Z. Y. Xu, Y. F. Zhang, Q. Q. Lv, M. Y. Liu, Wei Zhu, Z. B. Zhuang, Adv. Funct. Mater., 2021, 31, 2101405. 165 L.G. Li L.Z. Bu B.L. Huang P.T. Wang C.Q. Shen S.X. Bai T.-S. Chan Q. Shao Z.W. Hu X.Q. Huang Adv. Mater. 33 2021 2105308 L. G. Li, L. Z. Bu, B. L. Huang, P. T. Wang, C. Q. Shen, S. X. Bai, T.-S. Chan, Q. Shao, Z. W. Hu, X. Q. Huang, Adv. Mater., 2021, 33, 2105308. 166 L. An F. Yang C.H. Fu X.Y. Cai S.Y. Shen G.F. Xia J. Li Y.Z. Du L.X. Luo J.L. Zhang Adv. Funct. Mater. 32 2022 2200131 L. An, F. Yang, C. H. Fu, X. Y. Cai, S. Y. Shen, G. F. Xia, J. Li, Y. Z. Du, L. X. Luo, J. L. Zhang, Adv. Funct. Mater., 2022, 32, 2200131. 167 Z.-Y. Wu F.-Y. Chen B. Li S.-W. Yu Y.Z. Finfrock D.M. Meira Q.-Q. Yan P. Zhu M.-X. Chen T.-W. Song Z.g Yin H.-W. Liang S. Zhang G. Wang H. Wang Nat. Mater. 22 2023 100 108 Z.-Y. Wu, F.-Y. Chen, B. Li, S.-W. Yu, Y. Z. Finfrock, D. M. Meira, Q.-Q. Yan, P. Zhu, M.-X. Chen, T.-W. Song, Z.g Yin, H.-W. Liang, S. Zhang, G. Wang, H. Wang, Nat. Mater., 2023, 22, 100–108. 168 H.Y. Jin X.Y. Liu P.F. An C. Tang H.M. Yu Q.H. Zhang H.-J. Peng L. Gu Y. Zheng T. Song K. Davey U. Paik J. Dong S.-Z. Qiao Nat. Commun. 14 2023 354 H. Y. Jin, X. Y. Liu, P. F. An, C. Tang, H. M. Yu, Q. H. Zhang, H.-J. Peng, L. Gu, Y. Zheng, T. Song, K. Davey, U. Paik, J. Dong, S.-Z. Qiao, Nat. Commun., 2023, 14, 354. 169 H. Liu Z. Zhang J.J. Fang M.X. Li M.G. Sendeku X. Wang H.Y. Wu Y.P. Li J.J. Ge Z.B. Zhuang D.J. Zhou Y. Kuang X.M. Sun Joule 7 2023 558 573 H. Liu, Z. Zhang, J. J. Fang, M. X. Li, M. G. Sendeku, X. Wang, H. Y. Wu, Y. P. Li, J. J. Ge, Z. B. Zhuang, D. J. Zhou, Y. Kuang, X. M. Sun, Joule, 2023, 7, 558–573. 170 L. Li G.W. Zhang J.W. Xu H.J. He B. Wang Z.M. Yang S.C. Yang Adv. Funct. Mater. 33 2023 2213304 L. Li, G. W. Zhang, J. W. Xu, H. J. He, B. Wang, Z. M. Yang, S. C. Yang, Adv. Funct. Mater., 2023, 33, 2213304. 171 Q. Feng Q. Wang Z. Zhang Y.Y.H. Xiong H.Y. Li Y. Yao X.-Z. Yuan M.C. Williams M. Gu H. Chen H. Li H.J. Wang Appl. Catal. B 244 2019 494 501 Q. Feng, Q. Wang, Z. Zhang, Y. Y. H. Xiong, H. Y. Li, Y. Yao, X.-Z. Yuan, M. C. Williams, M. Gu, H. Chen, H. Li, H. J. Wang, Appl. Catal. B, 2019, 244, 494–501. 172 N. Zhang C. Wang J.W. Chen C.Y. Hu J. Ma X. Deng B.C. Qiu L.J. Cai Y.J. Xiong Y. Chai ACS Nano 15 2021 8537 8548 N. Zhang, C. Wang, J. W. Chen, C. Y. Hu, J. Ma, X. Deng, B. C. Qiu, L. J. Cai, Y. J. Xiong, Y. Chai, ACS Nano, 2021, 15, 8537–8548. 173 J.B. Yan J. Zhu D.W. Chen S. Liu X. Zhang S.S. Yu Z.H. Zeng L.H. Jiang F.L. Du J. Mater. Chem. A 10 2022 9419 9426 J. B. Yan, J. Zhu, D. W. Chen, S. Liu, X. Zhang, S. S. Yu, Z. H. Zeng, L. H. Jiang, F. L. Du, J. Mater. Chem. A, 2022, 10, 9419–9426. 174 N. Han S.H. Feng Y. Liang J. Wang W. Zhang X.L. Guo Q.R. Ma Q. Liu W. Guo Z.Y. Zhou S.J. Xie K. Wan Y.Z. Jiang A. Vlad Y.Z. Guo E.M. Gaigneaux C. Zhang J. Fransaer X. Zhang Adv. Funct. Mater. 33 2023 2208399 N. Han, S. H. Feng, Y. Liang, J. Wang, W. Zhang, X. L. Guo, Q. R. Ma, Q. Liu, W. Guo, Z. Y. Zhou, S. J. Xie, K. Wan, Y. Z. Jiang, A. Vlad, Y. Z. Guo, E. M. Gaigneaux, C. Zhang, J. Fransaer, X. Zhang, Adv. Funct. Mater., 2023, 33, 2208399. 175 X.Y. Ping Y.D. Liu S.G. Chen N. Ran L.X. Zheng M. Wang L. Guo Z.D. Wei Appl. Catal. B 318 2022 121884 X. Y. Ping, Y. D. Liu, S. G. Chen, N. Ran, L. X. Zheng, M. Wang, L. Guo, Z. D. Wei, Appl. Catal. B, 2022, 318, 121884. 176 H. Liu Z. Zhang M.X. Li Z.L. Wang X.S. Zhang T.S. Li Y.P. Li S.B. Tian Y. Kuang X.M. Sun Small 18 2022 2202513 H. Liu, Z. Zhang, M. X. Li, Z. L. Wang, X. S. Zhang, T. S. Li, Y. P. Li, S. B. Tian, Y. Kuang, X. M. Sun, Small, 2022, 18, 2202513. 177 D. Galyamin J. Torrero I. Rodríguez M.J. Kolb P. Ferrer L. Pascual M.A. Salam D. Gianolio V. Celorrio M. Mokhtar D.G. Sanchez A.S. Gago K.A. Friedrich M.A. Peña J.A. Alonso F. Calle-Vallejo M. Retuerto S. Rojas Nat. Commun. 14 2023 2010 D. Galyamin, J. Torrero, I. Rodríguez, M. J. Kolb, P. Ferrer, L. Pascual, M. A. Salam, D. Gianolio, V. Celorrio, M. Mokhtar, D. G. Sanchez, A. S. Gago, K. A. Friedrich, M. A. Peña, J. A. Alonso, F. Calle-Vallejo, M. Retuerto, S. Rojas, Nat. Commun., 2023, 14, 2010. 178 M. Retuerto L. Pascual F. Calle-Vallejo P. Ferrer D. Gianolio A.G. Pereira Á. García J. Torrero M.T. Fernández-Díaz P. Bencok M.A. Peña J.L.G. Fierro S. Rojas Nat. Commun. 10 2019 2041 M. Retuerto, L. Pascual, F. Calle-Vallejo, P. Ferrer, D. Gianolio, A. G. Pereira, Á. García, J. Torrero, M. T. Fernández-Díaz, P. Bencok, M. A. Peña, J. L. G. Fierro, S. Rojas, Nat. Commun., 2019, 10, 2041. 179 X.B. Miao L.F. Zhang L. Wu Z.P. Hu L. Shi S.M. Zhou Nat. Commun. 10 2019 3809 X. B. Miao, L. F. Zhang, L. Wu, Z. P. Hu, L. Shi, S. M. Zhou, Nat. Commun., 2019, 10, 3809. 180 W. Liu K. Kawano M. Kamiko Y. Kato Y. Okazaki I. Yamada S. Yagi Small 18 2022 2202439 W. Liu, K. Kawano, M. Kamiko, Y. Kato, Y. Okazaki, I. Yamada, S. Yagi, Small, 2022, 18, 2202439. 181 Y.C. Lin Z.Q. Tian L.J. Zhang J.Y. Ma Z. Jiang B.J. Deibert R.X. Ge L. Chen Nat. Commun. 10 2019 162 Y. C. Lin, Z. Q. Tian, L. J. Zhang, J. Y. Ma, Z. Jiang, B. J. Deibert, R. X. Ge, L. Chen, Nat. Commun., 2019, 10, 162. 182 H.X. Chen X.F. Zhang S.P. Geng S.Q. Song Y. Wang Small Methods 6 2022 2200636 H. X. Chen, X. F. Zhang, S. P. Geng, S. Q. Song, Y. Wang, Small Methods, 2022, 6, 2200636. 183 S.Y. Hao M. Liu J.J. Pan X.N. Liu X.L. Tan N. Xu Y. He L.C. Lei X.W. Zhang Nat. Commun. 11 2020 5368 S. Y. Hao, M. Liu, J. J. Pan, X. N. Liu, X. L. Tan, N. Xu, Y. He, L. C. Lei, X. W. Zhang, Nat. Commun., 2020, 11, 5368. 184 Y.Z. Wen P.N. Chen L. Wang S.Y. Li Z.Y. Wang J. Abed X.N. Mao Y.M. Min C.T. Dinh P.D. Luna R. Huang L.S. Zhang L. Wang L.P. Wang R.J. Nielsen H.H. Li T.T. Zhuang C.C. Ke O. Voznyy Y.F. Hu Y.Y. Li W.A. Goddard III B. Zhang H.S. Peng E.H. Sargent J. Am. Chem. Soc. 143 2021 6482 6490 Y. Z. Wen, P. N. Chen, L. Wang, S. Y. Li, Z. Y. Wang, J. Abed, X. N. Mao, Y. M. Min, C. T. Dinh, P. D. Luna, R. Huang, L. S. Zhang, L. Wang, L. P. Wang, R. J. Nielsen, H. H. Li, T. T. Zhuang, C. C. Ke, O. Voznyy, Y. F. Hu, Y. Y. Li, W. A. Goddard III, B. Zhang, H. S. Peng, E. H. Sargent, J. Am. Chem. Soc., 2021, 143, 6482–6490. 185 H. Jin S. Choi G.J. Bang T. Kwon H.S. Kim S.J. Lee Y. Hong D.W. Lee H.S. Park H. Baik Y. Jung S.J. Yoo K. Lee Energy Environ. Sci. 15 2022 1119 1130 H. Jin, S. Choi, G. J. Bang, T. Kwon, H. S. Kim, S. J. Lee, Y. Hong, D. W. Lee, H. S. Park, H. Baik, Y. Jung, S. J. Yoo, K. Lee, Energy Environ. Sci., 2022, 15, 1119–1130. 186 Y.Z. Wen C. Liu R. Huang H. Zhang X.B. Li F.P.G. de Arquer Z. Liu Y.Y. Li B. Zhang Nat. Commun. 13 2022 4871 Y. Z. Wen, C. Liu, R. Huang, H. Zhang, X. B. Li, F. P. G. de Arquer, Z. Liu, Y. Y. Li, B. Zhang, Nat. Commun., 2022, 13, 4871. 187 Z.P. Shi J. Li Y.B. Wang S.W. Liu J.B. Zhu J.H. Yang X. Wang J. Ni Z. Jiang L.J. Zhang Y. Wang C.P. Liu W. Xing J.J. Ge Nat. Commun. 14 2023 843 Z. P. Shi, J. Li, Y. B. Wang, S. W. Liu, J. B. Zhu, J. H. Yang, X. Wang, J. Ni, Z. Jiang, L. J. Zhang, Y. Wang, C. P. Liu, W. Xing, J. J. Ge, Nat. Commun., 2023, 14, 843. 188 C. Lin J.-L. Li X.P. Li S. Yang W. Luo Y.J. Zhang S.-H. Kim D.-H. Kim S.S. Shinde Y.-F. Li Z.-P. Liu Z. Jiang J.-H. Lee Nat. Catal. 4 2021 1012 1023 C. Lin, J.-L. Li, X. P. Li, S. Yang, W. Luo, Y. J. Zhang, S.-H. Kim, D.-H. Kim, S. S. Shinde, Y.-F. Li, Z.-P. Liu, Z. Jiang, J.-H. Lee, Nat. Catal., 2021, 4, 1012–1023. 189 T. Kwon H. Yang M. Jun Ta. Kim J. Joo J. Kim H. Baik J.Y. Kim K. Lee J. Mater. Chem. A 9 2021 14352 14362 T. Kwon, H. Yang, M. Jun, Ta. Kim, J. Joo, J. Kim, H. Baik, J. Y. Kim, K. Lee, J. Mater. Chem. A, 2021, 9, 14352–14362. 190 Y.X. Zhao J. Hu C.-L. Chiang Y. Li W.C. Yang Z.H. Yang W.-H. Hung Y.-G. Lin Z. Chen B. Li P.Q. Gao H. Li J. Mater. Chem. A 10 2022 20964 20974 Y. X. Zhao, J. Hu, C.-L. Chiang, Y. Li, W. C. Yang, Z. H. Yang, W.-H. Hung, Y.-G. Lin, Z. Chen, B. Li, P. Q. Gao, H. Li, J. Mater. Chem. A, 2022, 10, 20964–20974. 191 L.J. Zhang H. Jang H.H. Liu M.G. Kim D.J. Yang S.G. Liu X. Liu J. Cho Angew. Chem. Int. Ed. 60 2021 18821 18829 L. J. Zhang, H. Jang, H. H. Liu, M. G. Kim, D. J. Yang, S. G. Liu, X. Liu, J. Cho, Angew. Chem. Int. Ed., 2021, 60, 18821–18829. Yuanyuan Ma (School of Chemistry and Chemical Engineering, Northwestern Polytechnical University) is a professor at the School of Chemistry and Chemical Engineering, Northwestern Polytechnical University. She received her B.S. in Materials Science and Engineering from Nanjing University in 2001 and Ph.D from the University of California, Davis in 2012. Her current research focuses on the design of highly performed electrocatalysts for water splitting and organic transformations as well as the reaction mechanisms for electrochemical reactions. Yongquan Qu (School of Chemistry and Chemical Engineering, Northwestern Polytechnical University) is a professor at the School of Chemistry and Chemical Engineering, Northwestern Polytechnical University. He received his B.S. in Materials Science and Engineering from Nanjing University in 2001, M.S. in Chemistry from the Dalian Institute of Chemical Physics in 2004, and Ph.D in Chemistry from the University of California, Davis, in 2009. He worked as a postdoctoral research fellow in the University of California, Los Angeles, from 2009 to 2011. His research interests focus on heterogeneous catalysis in the areas of organic synthesis, clean energy production and biomimetic catalysis.",
      "scopus-id": "85193567384",
      "coredata": {
        "eid": "1-s2.0-S1872206724600136",
        "dc:description": "Clean and renewable energy is generally localized and intermittent. Thus, energy conversion and storage technologies are necessary to compensate for these shortcomings. Electrolytic water splitting presents a reliable and promising energy technology for producing high purity hydrogen (H2). Among the platinum metals, ruthenium (Ru) has gained significant attentions as it generally outperforms commercial catalysts in terms of activity at a more affordable price. Although great progress has been made in improving the catalytic activity of Ru-based catalysts, stability remains a major challenge hindering their practical applications. To this end, this review introduces the fundamentals of the stability over Ru-based catalysts for water splitting, including the reaction mechanisms of hydrogen evolution reaction (HER) and oxygen evolution reaction (OER), measurement methods and evaluation criteria, as well as deactivation mechanisms. Moreover, the up-to-date advances of representative strategies for improving HER and OER stability of Ru-based catalysts are further discussed with respect to specific design principles and underlying mechanisms. Ultimately, insights into the challenges and opportunities for Ru-based electrocatalysts are provided to promote the development of next-generation Ru-based catalysts with exceptional stability. This review aims at guiding the design and synthesis of superior catalysts, generating increased interest among researchers, and stimulating further advanced research.",
        "openArchiveArticle": "false",
        "prism:coverDate": "2024-05-31",
        "openaccessUserLicense": null,
        "prism:aggregationType": "Journal",
        "prism:url": "https://api.elsevier.com/content/article/pii/S1872206724600136",
        "dc:creator": [
          {
            "@_fa": "true",
            "$": "Gou, Wangyan"
          },
          {
            "@_fa": "true",
            "$": "Wang, Yichen"
          },
          {
            "@_fa": "true",
            "$": "Zhang, Mingkai"
          },
          {
            "@_fa": "true",
            "$": "Tan, Xiaohe"
          },
          {
            "@_fa": "true",
            "$": "Ma, Yuanyuan"
          },
          {
            "@_fa": "true",
            "$": "Qu, Yongquan"
          }
        ],
        "link": [
          {
            "@_fa": "true",
            "@rel": "self",
            "@href": "https://api.elsevier.com/content/article/pii/S1872206724600136"
          },
          {
            "@_fa": "true",
            "@rel": "scidir",
            "@href": "https://www.sciencedirect.com/science/article/pii/S1872206724600136"
          }
        ],
        "dc:format": "application/json",
        "openaccessType": null,
        "pii": "S1872-2067(24)60013-6",
        "prism:volume": "60",
        "prism:publisher": "Dalian Institute of Chemical Physics, Chinese Academy of Sciences. Published by Elsevier B.V. All rights are reserved, including those for text and data mining, AI training, and similar technologies.",
        "dc:title": "A review on fundamentals for designing stable ruthenium-based catalysts for the hydrogen and oxygen evolution reactions",
        "prism:copyright": "Copyright © 2024 Dalian Institute of Chemical Physics, Chinese Academy of Sciences. Published by Elsevier B.V. All rights are reserved, including those for text and data mining, AI training, and similar technologies.",
        "openaccess": "0",
        "prism:issn": "18722067",
        "dcterms:subject": [
          {
            "@_fa": "true",
            "$": "Electrocatalysis"
          },
          {
            "@_fa": "true",
            "$": "Water splitting"
          },
          {
            "@_fa": "true",
            "$": "Deactivation mechanism"
          },
          {
            "@_fa": "true",
            "$": "Ruthenium-based catalyst"
          },
          {
            "@_fa": "true",
            "$": "Stability"
          }
        ],
        "openaccessArticle": "false",
        "prism:publicationName": "Chinese Journal of Catalysis",
        "openaccessSponsorType": null,
        "prism:pageRange": "68-106",
        "prism:endingPage": "106",
        "pubType": "rev",
        "prism:coverDisplayDate": "May 2024",
        "prism:doi": "10.1016/S1872-2067(24)60013-6",
        "prism:startingPage": "68",
        "dc:identifier": "doi:10.1016/S1872-2067(24)60013-6",
        "openaccessSponsorName": null
      },
      "objects": {
        "object": [
          {
            "@category": "standard",
            "@height": "151",
            "@width": "301",
            "@_fa": "true",
            "$": "https://api.elsevier.com/content/object/eid/1-s2.0-S1872206724600136-fx1.jpg?httpAccept=%2A%2F%2A",
            "@multimediatype": "JPEG image file",
            "@type": "IMAGE-DOWNSAMPLED",
            "@size": "19374",
            "@ref": "fx1",
            "@mimetype": "image/jpeg"
          },
          {
            "@category": "standard",
            "@height": "194",
            "@width": "155",
            "@_fa": "true",
            "$": "https://api.elsevier.com/content/object/eid/1-s2.0-S1872206724600136-fx2.jpg?httpAccept=%2A%2F%2A",
            "@multimediatype": "JPEG image file",
            "@type": "IMAGE-DOWNSAMPLED",
            "@size": "10690",
            "@ref": "fx2",
            "@mimetype": "image/jpeg"
          },
          {
            "@category": "standard",
            "@height": "194",
            "@width": "155",
            "@_fa": "true",
            "$": "https://api.elsevier.com/content/object/eid/1-s2.0-S1872206724600136-fx3.jpg?httpAccept=%2A%2F%2A",
            "@multimediatype": "JPEG image file",
            "@type": "IMAGE-DOWNSAMPLED",
            "@size": "12291",
            "@ref": "fx3",
            "@mimetype": "image/jpeg"
          },
          {
            "@category": "standard",
            "@height": "276",
            "@width": "564",
            "@_fa": "true",
            "$": "https://api.elsevier.com/content/object/eid/1-s2.0-S1872206724600136-gr1.jpg?httpAccept=%2A%2F%2A",
            "@multimediatype": "JPEG image file",
            "@type": "IMAGE-DOWNSAMPLED",
            "@size": "42497",
            "@ref": "gr1",
            "@mimetype": "image/jpeg"
          },
          {
            "@category": "standard",
            "@height": "553",
            "@width": "551",
            "@_fa": "true",
            "$": "https://api.elsevier.com/content/object/eid/1-s2.0-S1872206724600136-gr10.jpg?httpAccept=%2A%2F%2A",
            "@multimediatype": "JPEG image file",
            "@type": "IMAGE-DOWNSAMPLED",
            "@size": "112469",
            "@ref": "gr10",
            "@mimetype": "image/jpeg"
          },
          {
            "@category": "standard",
            "@height": "612",
            "@width": "513",
            "@_fa": "true",
            "$": "https://api.elsevier.com/content/object/eid/1-s2.0-S1872206724600136-gr11.jpg?httpAccept=%2A%2F%2A",
            "@multimediatype": "JPEG image file",
            "@type": "IMAGE-DOWNSAMPLED",
            "@size": "107979",
            "@ref": "gr11",
            "@mimetype": "image/jpeg"
          },
          {
            "@category": "standard",
            "@height": "465",
            "@width": "619",
            "@_fa": "true",
            "$": "https://api.elsevier.com/content/object/eid/1-s2.0-S1872206724600136-gr12.jpg?httpAccept=%2A%2F%2A",
            "@multimediatype": "JPEG image file",
            "@type": "IMAGE-DOWNSAMPLED",
            "@size": "104171",
            "@ref": "gr12",
            "@mimetype": "image/jpeg"
          },
          {
            "@category": "standard",
            "@height": "474",
            "@width": "606",
            "@_fa": "true",
            "$": "https://api.elsevier.com/content/object/eid/1-s2.0-S1872206724600136-gr13.jpg?httpAccept=%2A%2F%2A",
            "@multimediatype": "JPEG image file",
            "@type": "IMAGE-DOWNSAMPLED",
            "@size": "107699",
            "@ref": "gr13",
            "@mimetype": "image/jpeg"
          },
          {
            "@category": "standard",
            "@height": "598",
            "@width": "442",
            "@_fa": "true",
            "$": "https://api.elsevier.com/content/object/eid/1-s2.0-S1872206724600136-gr14.jpg?httpAccept=%2A%2F%2A",
            "@multimediatype": "JPEG image file",
            "@type": "IMAGE-DOWNSAMPLED",
            "@size": "104669",
            "@ref": "gr14",
            "@mimetype": "image/jpeg"
          },
          {
            "@category": "standard",
            "@height": "132",
            "@width": "369",
            "@_fa": "true",
            "$": "https://api.elsevier.com/content/object/eid/1-s2.0-S1872206724600136-gr15.jpg?httpAccept=%2A%2F%2A",
            "@multimediatype": "JPEG image file",
            "@type": "IMAGE-DOWNSAMPLED",
            "@size": "20159",
            "@ref": "gr15",
            "@mimetype": "image/jpeg"
          },
          {
            "@category": "standard",
            "@height": "538",
            "@width": "646",
            "@_fa": "true",
            "$": "https://api.elsevier.com/content/object/eid/1-s2.0-S1872206724600136-gr16.jpg?httpAccept=%2A%2F%2A",
            "@multimediatype": "JPEG image file",
            "@type": "IMAGE-DOWNSAMPLED",
            "@size": "131875",
            "@ref": "gr16",
            "@mimetype": "image/jpeg"
          },
          {
            "@category": "standard",
            "@height": "539",
            "@width": "618",
            "@_fa": "true",
            "$": "https://api.elsevier.com/content/object/eid/1-s2.0-S1872206724600136-gr17.jpg?httpAccept=%2A%2F%2A",
            "@multimediatype": "JPEG image file",
            "@type": "IMAGE-DOWNSAMPLED",
            "@size": "135973",
            "@ref": "gr17",
            "@mimetype": "image/jpeg"
          },
          {
            "@category": "standard",
            "@height": "707",
            "@width": "571",
            "@_fa": "true",
            "$": "https://api.elsevier.com/content/object/eid/1-s2.0-S1872206724600136-gr18.jpg?httpAccept=%2A%2F%2A",
            "@multimediatype": "JPEG image file",
            "@type": "IMAGE-DOWNSAMPLED",
            "@size": "123012",
            "@ref": "gr18",
            "@mimetype": "image/jpeg"
          },
          {
            "@category": "standard",
            "@height": "457",
            "@width": "658",
            "@_fa": "true",
            "$": "https://api.elsevier.com/content/object/eid/1-s2.0-S1872206724600136-gr19.jpg?httpAccept=%2A%2F%2A",
            "@multimediatype": "JPEG image file",
            "@type": "IMAGE-DOWNSAMPLED",
            "@size": "101604",
            "@ref": "gr19",
            "@mimetype": "image/jpeg"
          },
          {
            "@category": "standard",
            "@height": "364",
            "@width": "705",
            "@_fa": "true",
            "$": "https://api.elsevier.com/content/object/eid/1-s2.0-S1872206724600136-gr2.jpg?httpAccept=%2A%2F%2A",
            "@multimediatype": "JPEG image file",
            "@type": "IMAGE-DOWNSAMPLED",
            "@size": "94699",
            "@ref": "gr2",
            "@mimetype": "image/jpeg"
          },
          {
            "@category": "standard",
            "@height": "453",
            "@width": "756",
            "@_fa": "true",
            "$": "https://api.elsevier.com/content/object/eid/1-s2.0-S1872206724600136-gr20.jpg?httpAccept=%2A%2F%2A",
            "@multimediatype": "JPEG image file",
            "@type": "IMAGE-DOWNSAMPLED",
            "@size": "93814",
            "@ref": "gr20",
            "@mimetype": "image/jpeg"
          },
          {
            "@category": "standard",
            "@height": "479",
            "@width": "613",
            "@_fa": "true",
            "$": "https://api.elsevier.com/content/object/eid/1-s2.0-S1872206724600136-gr21.jpg?httpAccept=%2A%2F%2A",
            "@multimediatype": "JPEG image file",
            "@type": "IMAGE-DOWNSAMPLED",
            "@size": "74196",
            "@ref": "gr21",
            "@mimetype": "image/jpeg"
          },
          {
            "@category": "standard",
            "@height": "591",
            "@width": "618",
            "@_fa": "true",
            "$": "https://api.elsevier.com/content/object/eid/1-s2.0-S1872206724600136-gr22.jpg?httpAccept=%2A%2F%2A",
            "@multimediatype": "JPEG image file",
            "@type": "IMAGE-DOWNSAMPLED",
            "@size": "106346",
            "@ref": "gr22",
            "@mimetype": "image/jpeg"
          },
          {
            "@category": "standard",
            "@height": "470",
            "@width": "619",
            "@_fa": "true",
            "$": "https://api.elsevier.com/content/object/eid/1-s2.0-S1872206724600136-gr23.jpg?httpAccept=%2A%2F%2A",
            "@multimediatype": "JPEG image file",
            "@type": "IMAGE-DOWNSAMPLED",
            "@size": "104177",
            "@ref": "gr23",
            "@mimetype": "image/jpeg"
          },
          {
            "@category": "standard",
            "@height": "436",
            "@width": "664",
            "@_fa": "true",
            "$": "https://api.elsevier.com/content/object/eid/1-s2.0-S1872206724600136-gr24.jpg?httpAccept=%2A%2F%2A",
            "@multimediatype": "JPEG image file",
            "@type": "IMAGE-DOWNSAMPLED",
            "@size": "109149",
            "@ref": "gr24",
            "@mimetype": "image/jpeg"
          },
          {
            "@category": "standard",
            "@height": "464",
            "@width": "552",
            "@_fa": "true",
            "$": "https://api.elsevier.com/content/object/eid/1-s2.0-S1872206724600136-gr25.jpg?httpAccept=%2A%2F%2A",
            "@multimediatype": "JPEG image file",
            "@type": "IMAGE-DOWNSAMPLED",
            "@size": "81111",
            "@ref": "gr25",
            "@mimetype": "image/jpeg"
          },
          {
            "@category": "standard",
            "@height": "473",
            "@width": "583",
            "@_fa": "true",
            "$": "https://api.elsevier.com/content/object/eid/1-s2.0-S1872206724600136-gr26.jpg?httpAccept=%2A%2F%2A",
            "@multimediatype": "JPEG image file",
            "@type": "IMAGE-DOWNSAMPLED",
            "@size": "98212",
            "@ref": "gr26",
            "@mimetype": "image/jpeg"
          },
          {
            "@category": "standard",
            "@height": "158",
            "@width": "487",
            "@_fa": "true",
            "$": "https://api.elsevier.com/content/object/eid/1-s2.0-S1872206724600136-gr27.jpg?httpAccept=%2A%2F%2A",
            "@multimediatype": "JPEG image file",
            "@type": "IMAGE-DOWNSAMPLED",
            "@size": "31806",
            "@ref": "gr27",
            "@mimetype": "image/jpeg"
          },
          {
            "@category": "standard",
            "@height": "455",
            "@width": "674",
            "@_fa": "true",
            "$": "https://api.elsevier.com/content/object/eid/1-s2.0-S1872206724600136-gr28.jpg?httpAccept=%2A%2F%2A",
            "@multimediatype": "JPEG image file",
            "@type": "IMAGE-DOWNSAMPLED",
            "@size": "86504",
            "@ref": "gr28",
            "@mimetype": "image/jpeg"
          },
          {
            "@category": "standard",
            "@height": "287",
            "@width": "319",
            "@_fa": "true",
            "$": "https://api.elsevier.com/content/object/eid/1-s2.0-S1872206724600136-gr29.jpg?httpAccept=%2A%2F%2A",
            "@multimediatype": "JPEG image file",
            "@type": "IMAGE-DOWNSAMPLED",
            "@size": "35316",
            "@ref": "gr29",
            "@mimetype": "image/jpeg"
          },
          {
            "@category": "standard",
            "@height": "268",
            "@width": "610",
            "@_fa": "true",
            "$": "https://api.elsevier.com/content/object/eid/1-s2.0-S1872206724600136-gr3.jpg?httpAccept=%2A%2F%2A",
            "@multimediatype": "JPEG image file",
            "@type": "IMAGE-DOWNSAMPLED",
            "@size": "58113",
            "@ref": "gr3",
            "@mimetype": "image/jpeg"
          },
          {
            "@category": "standard",
            "@height": "254",
            "@width": "334",
            "@_fa": "true",
            "$": "https://api.elsevier.com/content/object/eid/1-s2.0-S1872206724600136-gr30.jpg?httpAccept=%2A%2F%2A",
            "@multimediatype": "JPEG image file",
            "@type": "IMAGE-DOWNSAMPLED",
            "@size": "19134",
            "@ref": "gr30",
            "@mimetype": "image/jpeg"
          },
          {
            "@category": "standard",
            "@height": "310",
            "@width": "369",
            "@_fa": "true",
            "$": "https://api.elsevier.com/content/object/eid/1-s2.0-S1872206724600136-gr4.jpg?httpAccept=%2A%2F%2A",
            "@multimediatype": "JPEG image file",
            "@type": "IMAGE-DOWNSAMPLED",
            "@size": "39098",
            "@ref": "gr4",
            "@mimetype": "image/jpeg"
          },
          {
            "@category": "standard",
            "@height": "199",
            "@width": "361",
            "@_fa": "true",
            "$": "https://api.elsevier.com/content/object/eid/1-s2.0-S1872206724600136-gr5.jpg?httpAccept=%2A%2F%2A",
            "@multimediatype": "JPEG image file",
            "@type": "IMAGE-DOWNSAMPLED",
            "@size": "25187",
            "@ref": "gr5",
            "@mimetype": "image/jpeg"
          },
          {
            "@category": "standard",
            "@height": "442",
            "@width": "540",
            "@_fa": "true",
            "$": "https://api.elsevier.com/content/object/eid/1-s2.0-S1872206724600136-gr6.jpg?httpAccept=%2A%2F%2A",
            "@multimediatype": "JPEG image file",
            "@type": "IMAGE-DOWNSAMPLED",
            "@size": "76680",
            "@ref": "gr6",
            "@mimetype": "image/jpeg"
          },
          {
            "@category": "standard",
            "@height": "412",
            "@width": "605",
            "@_fa": "true",
            "$": "https://api.elsevier.com/content/object/eid/1-s2.0-S1872206724600136-gr7.jpg?httpAccept=%2A%2F%2A",
            "@multimediatype": "JPEG image file",
            "@type": "IMAGE-DOWNSAMPLED",
            "@size": "70673",
            "@ref": "gr7",
            "@mimetype": "image/jpeg"
          },
          {
            "@category": "standard",
            "@height": "409",
            "@width": "619",
            "@_fa": "true",
            "$": "https://api.elsevier.com/content/object/eid/1-s2.0-S1872206724600136-gr8.jpg?httpAccept=%2A%2F%2A",
            "@multimediatype": "JPEG image file",
            "@type": "IMAGE-DOWNSAMPLED",
            "@size": "105401",
            "@ref": "gr8",
            "@mimetype": "image/jpeg"
          },
          {
            "@category": "standard",
            "@height": "501",
            "@width": "664",
            "@_fa": "true",
            "$": "https://api.elsevier.com/content/object/eid/1-s2.0-S1872206724600136-gr9.jpg?httpAccept=%2A%2F%2A",
            "@multimediatype": "JPEG image file",
            "@type": "IMAGE-DOWNSAMPLED",
            "@size": "118388",
            "@ref": "gr9",
            "@mimetype": "image/jpeg"
          },
          {
            "@category": "thumbnail",
            "@height": "110",
            "@width": "219",
            "@_fa": "true",
            "$": "https://api.elsevier.com/content/object/eid/1-s2.0-S1872206724600136-fx1.sml?httpAccept=%2A%2F%2A",
            "@multimediatype": "GIF image file",
            "@type": "IMAGE-THUMBNAIL",
            "@size": "11068",
            "@ref": "fx1",
            "@mimetype": "image/gif"
          },
          {
            "@category": "thumbnail",
            "@height": "164",
            "@width": "131",
            "@_fa": "true",
            "$": "https://api.elsevier.com/content/object/eid/1-s2.0-S1872206724600136-fx2.sml?httpAccept=%2A%2F%2A",
            "@multimediatype": "GIF image file",
            "@type": "IMAGE-THUMBNAIL",
            "@size": "13405",
            "@ref": "fx2",
            "@mimetype": "image/gif"
          },
          {
            "@category": "thumbnail",
            "@height": "164",
            "@width": "131",
            "@_fa": "true",
            "$": "https://api.elsevier.com/content/object/eid/1-s2.0-S1872206724600136-fx3.sml?httpAccept=%2A%2F%2A",
            "@multimediatype": "GIF image file",
            "@type": "IMAGE-THUMBNAIL",
            "@size": "14015",
            "@ref": "fx3",
            "@mimetype": "image/gif"
          },
          {
            "@category": "thumbnail",
            "@height": "107",
            "@width": "219",
            "@_fa": "true",
            "$": "https://api.elsevier.com/content/object/eid/1-s2.0-S1872206724600136-gr1.sml?httpAccept=%2A%2F%2A",
            "@multimediatype": "GIF image file",
            "@type": "IMAGE-THUMBNAIL",
            "@size": "10664",
            "@ref": "gr1",
            "@mimetype": "image/gif"
          },
          {
            "@category": "thumbnail",
            "@height": "163",
            "@width": "163",
            "@_fa": "true",
            "$": "https://api.elsevier.com/content/object/eid/1-s2.0-S1872206724600136-gr10.sml?httpAccept=%2A%2F%2A",
            "@multimediatype": "GIF image file",
            "@type": "IMAGE-THUMBNAIL",
            "@size": "13787",
            "@ref": "gr10",
            "@mimetype": "image/gif"
          },
          {
            "@category": "thumbnail",
            "@height": "163",
            "@width": "137",
            "@_fa": "true",
            "$": "https://api.elsevier.com/content/object/eid/1-s2.0-S1872206724600136-gr11.sml?httpAccept=%2A%2F%2A",
            "@multimediatype": "GIF image file",
            "@type": "IMAGE-THUMBNAIL",
            "@size": "11197",
            "@ref": "gr11",
            "@mimetype": "image/gif"
          },
          {
            "@category": "thumbnail",
            "@height": "164",
            "@width": "218",
            "@_fa": "true",
            "$": "https://api.elsevier.com/content/object/eid/1-s2.0-S1872206724600136-gr12.sml?httpAccept=%2A%2F%2A",
            "@multimediatype": "GIF image file",
            "@type": "IMAGE-THUMBNAIL",
            "@size": "17967",
            "@ref": "gr12",
            "@mimetype": "image/gif"
          },
          {
            "@category": "thumbnail",
            "@height": "164",
            "@width": "210",
            "@_fa": "true",
            "$": "https://api.elsevier.com/content/object/eid/1-s2.0-S1872206724600136-gr13.sml?httpAccept=%2A%2F%2A",
            "@multimediatype": "GIF image file",
            "@type": "IMAGE-THUMBNAIL",
            "@size": "17104",
            "@ref": "gr13",
            "@mimetype": "image/gif"
          },
          {
            "@category": "thumbnail",
            "@height": "164",
            "@width": "121",
            "@_fa": "true",
            "$": "https://api.elsevier.com/content/object/eid/1-s2.0-S1872206724600136-gr14.sml?httpAccept=%2A%2F%2A",
            "@multimediatype": "GIF image file",
            "@type": "IMAGE-THUMBNAIL",
            "@size": "12487",
            "@ref": "gr14",
            "@mimetype": "image/gif"
          },
          {
            "@category": "thumbnail",
            "@height": "78",
            "@width": "219",
            "@_fa": "true",
            "$": "https://api.elsevier.com/content/object/eid/1-s2.0-S1872206724600136-gr15.sml?httpAccept=%2A%2F%2A",
            "@multimediatype": "GIF image file",
            "@type": "IMAGE-THUMBNAIL",
            "@size": "5816",
            "@ref": "gr15",
            "@mimetype": "image/gif"
          },
          {
            "@category": "thumbnail",
            "@height": "164",
            "@width": "197",
            "@_fa": "true",
            "$": "https://api.elsevier.com/content/object/eid/1-s2.0-S1872206724600136-gr16.sml?httpAccept=%2A%2F%2A",
            "@multimediatype": "GIF image file",
            "@type": "IMAGE-THUMBNAIL",
            "@size": "16847",
            "@ref": "gr16",
            "@mimetype": "image/gif"
          },
          {
            "@category": "thumbnail",
            "@height": "164",
            "@width": "188",
            "@_fa": "true",
            "$": "https://api.elsevier.com/content/object/eid/1-s2.0-S1872206724600136-gr17.sml?httpAccept=%2A%2F%2A",
            "@multimediatype": "GIF image file",
            "@type": "IMAGE-THUMBNAIL",
            "@size": "15373",
            "@ref": "gr17",
            "@mimetype": "image/gif"
          },
          {
            "@category": "thumbnail",
            "@height": "164",
            "@width": "132",
            "@_fa": "true",
            "$": "https://api.elsevier.com/content/object/eid/1-s2.0-S1872206724600136-gr18.sml?httpAccept=%2A%2F%2A",
            "@multimediatype": "GIF image file",
            "@type": "IMAGE-THUMBNAIL",
            "@size": "10943",
            "@ref": "gr18",
            "@mimetype": "image/gif"
          },
          {
            "@category": "thumbnail",
            "@height": "152",
            "@width": "219",
            "@_fa": "true",
            "$": "https://api.elsevier.com/content/object/eid/1-s2.0-S1872206724600136-gr19.sml?httpAccept=%2A%2F%2A",
            "@multimediatype": "GIF image file",
            "@type": "IMAGE-THUMBNAIL",
            "@size": "15995",
            "@ref": "gr19",
            "@mimetype": "image/gif"
          },
          {
            "@category": "thumbnail",
            "@height": "113",
            "@width": "219",
            "@_fa": "true",
            "$": "https://api.elsevier.com/content/object/eid/1-s2.0-S1872206724600136-gr2.sml?httpAccept=%2A%2F%2A",
            "@multimediatype": "GIF image file",
            "@type": "IMAGE-THUMBNAIL",
            "@size": "11489",
            "@ref": "gr2",
            "@mimetype": "image/gif"
          },
          {
            "@category": "thumbnail",
            "@height": "131",
            "@width": "219",
            "@_fa": "true",
            "$": "https://api.elsevier.com/content/object/eid/1-s2.0-S1872206724600136-gr20.sml?httpAccept=%2A%2F%2A",
            "@multimediatype": "GIF image file",
            "@type": "IMAGE-THUMBNAIL",
            "@size": "12714",
            "@ref": "gr20",
            "@mimetype": "image/gif"
          },
          {
            "@category": "thumbnail",
            "@height": "163",
            "@width": "209",
            "@_fa": "true",
            "$": "https://api.elsevier.com/content/object/eid/1-s2.0-S1872206724600136-gr21.sml?httpAccept=%2A%2F%2A",
            "@multimediatype": "GIF image file",
            "@type": "IMAGE-THUMBNAIL",
            "@size": "10488",
            "@ref": "gr21",
            "@mimetype": "image/gif"
          },
          {
            "@category": "thumbnail",
            "@height": "164",
            "@width": "171",
            "@_fa": "true",
            "$": "https://api.elsevier.com/content/object/eid/1-s2.0-S1872206724600136-gr22.sml?httpAccept=%2A%2F%2A",
            "@multimediatype": "GIF image file",
            "@type": "IMAGE-THUMBNAIL",
            "@size": "11368",
            "@ref": "gr22",
            "@mimetype": "image/gif"
          },
          {
            "@category": "thumbnail",
            "@height": "164",
            "@width": "216",
            "@_fa": "true",
            "$": "https://api.elsevier.com/content/object/eid/1-s2.0-S1872206724600136-gr23.sml?httpAccept=%2A%2F%2A",
            "@multimediatype": "GIF image file",
            "@type": "IMAGE-THUMBNAIL",
            "@size": "14806",
            "@ref": "gr23",
            "@mimetype": "image/gif"
          },
          {
            "@category": "thumbnail",
            "@height": "144",
            "@width": "219",
            "@_fa": "true",
            "$": "https://api.elsevier.com/content/object/eid/1-s2.0-S1872206724600136-gr24.sml?httpAccept=%2A%2F%2A",
            "@multimediatype": "GIF image file",
            "@type": "IMAGE-THUMBNAIL",
            "@size": "14968",
            "@ref": "gr24",
            "@mimetype": "image/gif"
          },
          {
            "@category": "thumbnail",
            "@height": "164",
            "@width": "195",
            "@_fa": "true",
            "$": "https://api.elsevier.com/content/object/eid/1-s2.0-S1872206724600136-gr25.sml?httpAccept=%2A%2F%2A",
            "@multimediatype": "GIF image file",
            "@type": "IMAGE-THUMBNAIL",
            "@size": "11639",
            "@ref": "gr25",
            "@mimetype": "image/gif"
          },
          {
            "@category": "thumbnail",
            "@height": "164",
            "@width": "202",
            "@_fa": "true",
            "$": "https://api.elsevier.com/content/object/eid/1-s2.0-S1872206724600136-gr26.sml?httpAccept=%2A%2F%2A",
            "@multimediatype": "GIF image file",
            "@type": "IMAGE-THUMBNAIL",
            "@size": "13906",
            "@ref": "gr26",
            "@mimetype": "image/gif"
          },
          {
            "@category": "thumbnail",
            "@height": "71",
            "@width": "219",
            "@_fa": "true",
            "$": "https://api.elsevier.com/content/object/eid/1-s2.0-S1872206724600136-gr27.sml?httpAccept=%2A%2F%2A",
            "@multimediatype": "GIF image file",
            "@type": "IMAGE-THUMBNAIL",
            "@size": "4547",
            "@ref": "gr27",
            "@mimetype": "image/gif"
          },
          {
            "@category": "thumbnail",
            "@height": "148",
            "@width": "219",
            "@_fa": "true",
            "$": "https://api.elsevier.com/content/object/eid/1-s2.0-S1872206724600136-gr28.sml?httpAccept=%2A%2F%2A",
            "@multimediatype": "GIF image file",
            "@type": "IMAGE-THUMBNAIL",
            "@size": "12941",
            "@ref": "gr28",
            "@mimetype": "image/gif"
          },
          {
            "@category": "thumbnail",
            "@height": "164",
            "@width": "182",
            "@_fa": "true",
            "$": "https://api.elsevier.com/content/object/eid/1-s2.0-S1872206724600136-gr29.sml?httpAccept=%2A%2F%2A",
            "@multimediatype": "GIF image file",
            "@type": "IMAGE-THUMBNAIL",
            "@size": "11993",
            "@ref": "gr29",
            "@mimetype": "image/gif"
          },
          {
            "@category": "thumbnail",
            "@height": "96",
            "@width": "219",
            "@_fa": "true",
            "$": "https://api.elsevier.com/content/object/eid/1-s2.0-S1872206724600136-gr3.sml?httpAccept=%2A%2F%2A",
            "@multimediatype": "GIF image file",
            "@type": "IMAGE-THUMBNAIL",
            "@size": "8117",
            "@ref": "gr3",
            "@mimetype": "image/gif"
          },
          {
            "@category": "thumbnail",
            "@height": "164",
            "@width": "215",
            "@_fa": "true",
            "$": "https://api.elsevier.com/content/object/eid/1-s2.0-S1872206724600136-gr30.sml?httpAccept=%2A%2F%2A",
            "@multimediatype": "GIF image file",
            "@type": "IMAGE-THUMBNAIL",
            "@size": "8054",
            "@ref": "gr30",
            "@mimetype": "image/gif"
          },
          {
            "@category": "thumbnail",
            "@height": "164",
            "@width": "195",
            "@_fa": "true",
            "$": "https://api.elsevier.com/content/object/eid/1-s2.0-S1872206724600136-gr4.sml?httpAccept=%2A%2F%2A",
            "@multimediatype": "GIF image file",
            "@type": "IMAGE-THUMBNAIL",
            "@size": "15444",
            "@ref": "gr4",
            "@mimetype": "image/gif"
          },
          {
            "@category": "thumbnail",
            "@height": "121",
            "@width": "219",
            "@_fa": "true",
            "$": "https://api.elsevier.com/content/object/eid/1-s2.0-S1872206724600136-gr5.sml?httpAccept=%2A%2F%2A",
            "@multimediatype": "GIF image file",
            "@type": "IMAGE-THUMBNAIL",
            "@size": "12196",
            "@ref": "gr5",
            "@mimetype": "image/gif"
          },
          {
            "@category": "thumbnail",
            "@height": "164",
            "@width": "200",
            "@_fa": "true",
            "$": "https://api.elsevier.com/content/object/eid/1-s2.0-S1872206724600136-gr6.sml?httpAccept=%2A%2F%2A",
            "@multimediatype": "GIF image file",
            "@type": "IMAGE-THUMBNAIL",
            "@size": "14823",
            "@ref": "gr6",
            "@mimetype": "image/gif"
          },
          {
            "@category": "thumbnail",
            "@height": "149",
            "@width": "219",
            "@_fa": "true",
            "$": "https://api.elsevier.com/content/object/eid/1-s2.0-S1872206724600136-gr7.sml?httpAccept=%2A%2F%2A",
            "@multimediatype": "GIF image file",
            "@type": "IMAGE-THUMBNAIL",
            "@size": "13534",
            "@ref": "gr7",
            "@mimetype": "image/gif"
          },
          {
            "@category": "thumbnail",
            "@height": "145",
            "@width": "219",
            "@_fa": "true",
            "$": "https://api.elsevier.com/content/object/eid/1-s2.0-S1872206724600136-gr8.sml?httpAccept=%2A%2F%2A",
            "@multimediatype": "GIF image file",
            "@type": "IMAGE-THUMBNAIL",
            "@size": "18741",
            "@ref": "gr8",
            "@mimetype": "image/gif"
          },
          {
            "@category": "thumbnail",
            "@height": "164",
            "@width": "217",
            "@_fa": "true",
            "$": "https://api.elsevier.com/content/object/eid/1-s2.0-S1872206724600136-gr9.sml?httpAccept=%2A%2F%2A",
            "@multimediatype": "GIF image file",
            "@type": "IMAGE-THUMBNAIL",
            "@size": "17255",
            "@ref": "gr9",
            "@mimetype": "image/gif"
          },
          {
            "@category": "high",
            "@height": "400",
            "@width": "800",
            "@_fa": "true",
            "$": "https://api.elsevier.com/content/object/eid/1-s2.0-S1872206724600136-fx1_lrg.jpg?httpAccept=%2A%2F%2A",
            "@multimediatype": "JPEG image file",
            "@type": "IMAGE-HIGH-RES",
            "@size": "74268",
            "@ref": "fx1",
            "@mimetype": "image/jpeg"
          },
          {
            "@category": "high",
            "@height": "517",
            "@width": "413",
            "@_fa": "true",
            "$": "https://api.elsevier.com/content/object/eid/1-s2.0-S1872206724600136-fx2_lrg.jpg?httpAccept=%2A%2F%2A",
            "@multimediatype": "JPEG image file",
            "@type": "IMAGE-HIGH-RES",
            "@size": "48422",
            "@ref": "fx2",
            "@mimetype": "image/jpeg"
          },
          {
            "@category": "high",
            "@height": "516",
            "@width": "413",
            "@_fa": "true",
            "$": "https://api.elsevier.com/content/object/eid/1-s2.0-S1872206724600136-fx3_lrg.jpg?httpAccept=%2A%2F%2A",
            "@multimediatype": "JPEG image file",
            "@type": "IMAGE-HIGH-RES",
            "@size": "58437",
            "@ref": "fx3",
            "@mimetype": "image/jpeg"
          },
          {
            "@category": "high",
            "@height": "733",
            "@width": "1498",
            "@_fa": "true",
            "$": "https://api.elsevier.com/content/object/eid/1-s2.0-S1872206724600136-gr1_lrg.jpg?httpAccept=%2A%2F%2A",
            "@multimediatype": "JPEG image file",
            "@type": "IMAGE-HIGH-RES",
            "@size": "192724",
            "@ref": "gr1",
            "@mimetype": "image/jpeg"
          },
          {
            "@category": "high",
            "@height": "1469",
            "@width": "1465",
            "@_fa": "true",
            "$": "https://api.elsevier.com/content/object/eid/1-s2.0-S1872206724600136-gr10_lrg.jpg?httpAccept=%2A%2F%2A",
            "@multimediatype": "JPEG image file",
            "@type": "IMAGE-HIGH-RES",
            "@size": "469061",
            "@ref": "gr10",
            "@mimetype": "image/jpeg"
          },
          {
            "@category": "high",
            "@height": "1624",
            "@width": "1362",
            "@_fa": "true",
            "$": "https://api.elsevier.com/content/object/eid/1-s2.0-S1872206724600136-gr11_lrg.jpg?httpAccept=%2A%2F%2A",
            "@multimediatype": "JPEG image file",
            "@type": "IMAGE-HIGH-RES",
            "@size": "432430",
            "@ref": "gr11",
            "@mimetype": "image/jpeg"
          },
          {
            "@category": "high",
            "@height": "1235",
            "@width": "1645",
            "@_fa": "true",
            "$": "https://api.elsevier.com/content/object/eid/1-s2.0-S1872206724600136-gr12_lrg.jpg?httpAccept=%2A%2F%2A",
            "@multimediatype": "JPEG image file",
            "@type": "IMAGE-HIGH-RES",
            "@size": "416235",
            "@ref": "gr12",
            "@mimetype": "image/jpeg"
          },
          {
            "@category": "high",
            "@height": "1258",
            "@width": "1609",
            "@_fa": "true",
            "$": "https://api.elsevier.com/content/object/eid/1-s2.0-S1872206724600136-gr13_lrg.jpg?httpAccept=%2A%2F%2A",
            "@multimediatype": "JPEG image file",
            "@type": "IMAGE-HIGH-RES",
            "@size": "415839",
            "@ref": "gr13",
            "@mimetype": "image/jpeg"
          },
          {
            "@category": "high",
            "@height": "1589",
            "@width": "1174",
            "@_fa": "true",
            "$": "https://api.elsevier.com/content/object/eid/1-s2.0-S1872206724600136-gr14_lrg.jpg?httpAccept=%2A%2F%2A",
            "@multimediatype": "JPEG image file",
            "@type": "IMAGE-HIGH-RES",
            "@size": "423409",
            "@ref": "gr14",
            "@mimetype": "image/jpeg"
          },
          {
            "@category": "high",
            "@height": "351",
            "@width": "980",
            "@_fa": "true",
            "$": "https://api.elsevier.com/content/object/eid/1-s2.0-S1872206724600136-gr15_lrg.jpg?httpAccept=%2A%2F%2A",
            "@multimediatype": "JPEG image file",
            "@type": "IMAGE-HIGH-RES",
            "@size": "106174",
            "@ref": "gr15",
            "@mimetype": "image/jpeg"
          },
          {
            "@category": "high",
            "@height": "1430",
            "@width": "1716",
            "@_fa": "true",
            "$": "https://api.elsevier.com/content/object/eid/1-s2.0-S1872206724600136-gr16_lrg.jpg?httpAccept=%2A%2F%2A",
            "@multimediatype": "JPEG image file",
            "@type": "IMAGE-HIGH-RES",
            "@size": "519731",
            "@ref": "gr16",
            "@mimetype": "image/jpeg"
          },
          {
            "@category": "high",
            "@height": "1434",
            "@width": "1643",
            "@_fa": "true",
            "$": "https://api.elsevier.com/content/object/eid/1-s2.0-S1872206724600136-gr17_lrg.jpg?httpAccept=%2A%2F%2A",
            "@multimediatype": "JPEG image file",
            "@type": "IMAGE-HIGH-RES",
            "@size": "544277",
            "@ref": "gr17",
            "@mimetype": "image/jpeg"
          },
          {
            "@category": "high",
            "@height": "1878",
            "@width": "1516",
            "@_fa": "true",
            "$": "https://api.elsevier.com/content/object/eid/1-s2.0-S1872206724600136-gr18_lrg.jpg?httpAccept=%2A%2F%2A",
            "@multimediatype": "JPEG image file",
            "@type": "IMAGE-HIGH-RES",
            "@size": "503392",
            "@ref": "gr18",
            "@mimetype": "image/jpeg"
          },
          {
            "@category": "high",
            "@height": "1214",
            "@width": "1747",
            "@_fa": "true",
            "$": "https://api.elsevier.com/content/object/eid/1-s2.0-S1872206724600136-gr19_lrg.jpg?httpAccept=%2A%2F%2A",
            "@multimediatype": "JPEG image file",
            "@type": "IMAGE-HIGH-RES",
            "@size": "395331",
            "@ref": "gr19",
            "@mimetype": "image/jpeg"
          },
          {
            "@category": "high",
            "@height": "967",
            "@width": "1874",
            "@_fa": "true",
            "$": "https://api.elsevier.com/content/object/eid/1-s2.0-S1872206724600136-gr2_lrg.jpg?httpAccept=%2A%2F%2A",
            "@multimediatype": "JPEG image file",
            "@type": "IMAGE-HIGH-RES",
            "@size": "418578",
            "@ref": "gr2",
            "@mimetype": "image/jpeg"
          },
          {
            "@category": "high",
            "@height": "1202",
            "@width": "2008",
            "@_fa": "true",
            "$": "https://api.elsevier.com/content/object/eid/1-s2.0-S1872206724600136-gr20_lrg.jpg?httpAccept=%2A%2F%2A",
            "@multimediatype": "JPEG image file",
            "@type": "IMAGE-HIGH-RES",
            "@size": "371965",
            "@ref": "gr20",
            "@mimetype": "image/jpeg"
          },
          {
            "@category": "high",
            "@height": "1275",
            "@width": "1630",
            "@_fa": "true",
            "$": "https://api.elsevier.com/content/object/eid/1-s2.0-S1872206724600136-gr21_lrg.jpg?httpAccept=%2A%2F%2A",
            "@multimediatype": "JPEG image file",
            "@type": "IMAGE-HIGH-RES",
            "@size": "300949",
            "@ref": "gr21",
            "@mimetype": "image/jpeg"
          },
          {
            "@category": "high",
            "@height": "1571",
            "@width": "1643",
            "@_fa": "true",
            "$": "https://api.elsevier.com/content/object/eid/1-s2.0-S1872206724600136-gr22_lrg.jpg?httpAccept=%2A%2F%2A",
            "@multimediatype": "JPEG image file",
            "@type": "IMAGE-HIGH-RES",
            "@size": "426201",
            "@ref": "gr22",
            "@mimetype": "image/jpeg"
          },
          {
            "@category": "high",
            "@height": "1250",
            "@width": "1646",
            "@_fa": "true",
            "$": "https://api.elsevier.com/content/object/eid/1-s2.0-S1872206724600136-gr23_lrg.jpg?httpAccept=%2A%2F%2A",
            "@multimediatype": "JPEG image file",
            "@type": "IMAGE-HIGH-RES",
            "@size": "399401",
            "@ref": "gr23",
            "@mimetype": "image/jpeg"
          },
          {
            "@category": "high",
            "@height": "1159",
            "@width": "1764",
            "@_fa": "true",
            "$": "https://api.elsevier.com/content/object/eid/1-s2.0-S1872206724600136-gr24_lrg.jpg?httpAccept=%2A%2F%2A",
            "@multimediatype": "JPEG image file",
            "@type": "IMAGE-HIGH-RES",
            "@size": "445416",
            "@ref": "gr24",
            "@mimetype": "image/jpeg"
          },
          {
            "@category": "high",
            "@height": "1234",
            "@width": "1467",
            "@_fa": "true",
            "$": "https://api.elsevier.com/content/object/eid/1-s2.0-S1872206724600136-gr25_lrg.jpg?httpAccept=%2A%2F%2A",
            "@multimediatype": "JPEG image file",
            "@type": "IMAGE-HIGH-RES",
            "@size": "307699",
            "@ref": "gr25",
            "@mimetype": "image/jpeg"
          },
          {
            "@category": "high",
            "@height": "1258",
            "@width": "1549",
            "@_fa": "true",
            "$": "https://api.elsevier.com/content/object/eid/1-s2.0-S1872206724600136-gr26_lrg.jpg?httpAccept=%2A%2F%2A",
            "@multimediatype": "JPEG image file",
            "@type": "IMAGE-HIGH-RES",
            "@size": "376297",
            "@ref": "gr26",
            "@mimetype": "image/jpeg"
          },
          {
            "@category": "high",
            "@height": "420",
            "@width": "1293",
            "@_fa": "true",
            "$": "https://api.elsevier.com/content/object/eid/1-s2.0-S1872206724600136-gr27_lrg.jpg?httpAccept=%2A%2F%2A",
            "@multimediatype": "JPEG image file",
            "@type": "IMAGE-HIGH-RES",
            "@size": "153734",
            "@ref": "gr27",
            "@mimetype": "image/jpeg"
          },
          {
            "@category": "high",
            "@height": "1208",
            "@width": "1791",
            "@_fa": "true",
            "$": "https://api.elsevier.com/content/object/eid/1-s2.0-S1872206724600136-gr28_lrg.jpg?httpAccept=%2A%2F%2A",
            "@multimediatype": "JPEG image file",
            "@type": "IMAGE-HIGH-RES",
            "@size": "365326",
            "@ref": "gr28",
            "@mimetype": "image/jpeg"
          },
          {
            "@category": "high",
            "@height": "763",
            "@width": "847",
            "@_fa": "true",
            "$": "https://api.elsevier.com/content/object/eid/1-s2.0-S1872206724600136-gr29_lrg.jpg?httpAccept=%2A%2F%2A",
            "@multimediatype": "JPEG image file",
            "@type": "IMAGE-HIGH-RES",
            "@size": "154677",
            "@ref": "gr29",
            "@mimetype": "image/jpeg"
          },
          {
            "@category": "high",
            "@height": "713",
            "@width": "1620",
            "@_fa": "true",
            "$": "https://api.elsevier.com/content/object/eid/1-s2.0-S1872206724600136-gr3_lrg.jpg?httpAccept=%2A%2F%2A",
            "@multimediatype": "JPEG image file",
            "@type": "IMAGE-HIGH-RES",
            "@size": "208294",
            "@ref": "gr3",
            "@mimetype": "image/jpeg"
          },
          {
            "@category": "high",
            "@height": "676",
            "@width": "888",
            "@_fa": "true",
            "$": "https://api.elsevier.com/content/object/eid/1-s2.0-S1872206724600136-gr30_lrg.jpg?httpAccept=%2A%2F%2A",
            "@multimediatype": "JPEG image file",
            "@type": "IMAGE-HIGH-RES",
            "@size": "75881",
            "@ref": "gr30",
            "@mimetype": "image/jpeg"
          },
          {
            "@category": "high",
            "@height": "823",
            "@width": "980",
            "@_fa": "true",
            "$": "https://api.elsevier.com/content/object/eid/1-s2.0-S1872206724600136-gr4_lrg.jpg?httpAccept=%2A%2F%2A",
            "@multimediatype": "JPEG image file",
            "@type": "IMAGE-HIGH-RES",
            "@size": "154009",
            "@ref": "gr4",
            "@mimetype": "image/jpeg"
          },
          {
            "@category": "high",
            "@height": "529",
            "@width": "961",
            "@_fa": "true",
            "$": "https://api.elsevier.com/content/object/eid/1-s2.0-S1872206724600136-gr5_lrg.jpg?httpAccept=%2A%2F%2A",
            "@multimediatype": "JPEG image file",
            "@type": "IMAGE-HIGH-RES",
            "@size": "122163",
            "@ref": "gr5",
            "@mimetype": "image/jpeg"
          },
          {
            "@category": "high",
            "@height": "1175",
            "@width": "1435",
            "@_fa": "true",
            "$": "https://api.elsevier.com/content/object/eid/1-s2.0-S1872206724600136-gr6_lrg.jpg?httpAccept=%2A%2F%2A",
            "@multimediatype": "JPEG image file",
            "@type": "IMAGE-HIGH-RES",
            "@size": "303679",
            "@ref": "gr6",
            "@mimetype": "image/jpeg"
          },
          {
            "@category": "high",
            "@height": "1094",
            "@width": "1607",
            "@_fa": "true",
            "$": "https://api.elsevier.com/content/object/eid/1-s2.0-S1872206724600136-gr7_lrg.jpg?httpAccept=%2A%2F%2A",
            "@multimediatype": "JPEG image file",
            "@type": "IMAGE-HIGH-RES",
            "@size": "279308",
            "@ref": "gr7",
            "@mimetype": "image/jpeg"
          },
          {
            "@category": "high",
            "@height": "1087",
            "@width": "1646",
            "@_fa": "true",
            "$": "https://api.elsevier.com/content/object/eid/1-s2.0-S1872206724600136-gr8_lrg.jpg?httpAccept=%2A%2F%2A",
            "@multimediatype": "JPEG image file",
            "@type": "IMAGE-HIGH-RES",
            "@size": "425697",
            "@ref": "gr8",
            "@mimetype": "image/jpeg"
          },
          {
            "@category": "high",
            "@height": "1330",
            "@width": "1763",
            "@_fa": "true",
            "$": "https://api.elsevier.com/content/object/eid/1-s2.0-S1872206724600136-gr9_lrg.jpg?httpAccept=%2A%2F%2A",
            "@multimediatype": "JPEG image file",
            "@type": "IMAGE-HIGH-RES",
            "@size": "497430",
            "@ref": "gr9",
            "@mimetype": "image/jpeg"
          },
          {
            "@category": "thumbnail",
            "@height": "41",
            "@width": "92",
            "@_fa": "true",
            "$": "https://api.elsevier.com/content/object/eid/1-s2.0-S1872206724600136-si1.gif?httpAccept=%2A%2F%2A",
            "@multimediatype": "GIF image file",
            "@type": "ALTIMG",
            "@size": "467",
            "@ref": "si1",
            "@mimetype": "image/gif"
          },
          {
            "@category": "thumbnail",
            "@height": "37",
            "@width": "79",
            "@_fa": "true",
            "$": "https://api.elsevier.com/content/object/eid/1-s2.0-S1872206724600136-si2.gif?httpAccept=%2A%2F%2A",
            "@multimediatype": "GIF image file",
            "@type": "ALTIMG",
            "@size": "407",
            "@ref": "si2",
            "@mimetype": "image/gif"
          },
          {
            "@category": "thumbnail",
            "@height": "36",
            "@width": "170",
            "@_fa": "true",
            "$": "https://api.elsevier.com/content/object/eid/1-s2.0-S1872206724600136-si3.gif?httpAccept=%2A%2F%2A",
            "@multimediatype": "GIF image file",
            "@type": "ALTIMG",
            "@size": "814",
            "@ref": "si3",
            "@mimetype": "image/gif"
          }
        ]
      },
      "link": {
        "@rel": "abstract",
        "@href": "https://api.elsevier.com/content/abstract/scopus_id/85193567384"
      }
    }
  }
}