{
  "metadata": {
    "title": "Atomic orbitals modulated dual functional bimetallic phosphides derived from MOF on MOF structure for boosting high efficient overall water splitting",
    "authors": "; ; ",
    "journal": "Chinese Journal of Catalysis",
    "date": "2024-10-31",
    "doi": "10.1016/S1872-2067(24)60124-5",
    "abstract": "",
    "uri": "https://api.elsevier.com/content/article/pii/S1872206724601245",
    "pii": "S1872206724601245"
  },
  "fulltext": {
    "full-text-retrieval-response": {
      "scopus-eid": "2-s2.0-85207078099",
      "originalText": "serial JL 273538 291210 291744 291809 31 Chinese Journal of Catalysis CHINESEJOURNALCATALYSIS 2024-10-24 2024-10-24 2024-10-24 2024-10-24 2024-10-24T15:56:24 1-s2.0-S1872206724601245 S1872-2067(24)60124-5 S1872206724601245 10.1016/S1872-2067(24)60124-5 S300 S300.2 FULL-TEXT 1-s2.0-S1872206724X0011X 2024-10-28T20:32:48.32329Z 0 0 20241001 20241031 2024 2024-10-24T16:10:45.975666Z absattachment articleinfo articletitlenorm authfirstinitialnorm authfirstsurnamenorm cid cids contenttype copyright crossmark dateloaded dateloadedtxt datesearch datesort dateupdated dco docsubtype doctype doi eid ewtransactionid hubeid indexeddate issn issnnorm itemstage itemtransactionid itemweight openaccess openarchive pg pgfirst pglast pii piinorm pubdateend pubdatestart pubdatetxt pubyr sortorder srctitle srctitlenorm srctype ssids alllist content subj subheadings suppl tomb volfirst volissue volumelist webpdf webpdfpagecount yearnav figure e-component body affil appendices articletitle auth authfirstini authfull authkeywords authlast grantnumber grantsponsor primabst pubtype ref specialabst 1872-2067 18722067 true 65 65 C Volume 65 7 113 125 113 125 202410 October 2024 2024-10-01 2024-10-31 2024 article fla Copyright © 2024 Dalian Institute of Chemical Physics, the Chinese Academy of Sciences. Published by Elsevier B.V. All rights are reserved, including those for text and data mining, AI training, and similar technologies. ATOMICORBITALSMODULATEDDUALFUNCTIONALBIMETALLICPHOSPHIDESDERIVEDMOFMOFSTRUCTUREFORBOOSTINGHIGHEFFICIENTOVERALLWATERSPLITTING AN B 1 Introduction 2 Experimental 2.1 Synthesis 2.2 Characterizations 2.3 Electrochemical testing conditions 2.4 Calculation of density functional theory (DFT) 3 Results and discussion 3.1 Characterization of prepared sample 3.2 Electrocatalytic hydrogen evolution performance 3.3 Electrocatalytic oxygen evolution performance 3.4 Overall water splitting performance 3.5 Electrocatalytic mechanism investigation 4 Conclusions Supporting Information Supplementary Material References WANG 2022 1295 1305 A LI 2022 2200733 S LI 2022 679 707 X JIANG 2022 4367 4374 J LI 2022 27961 27972 X ZHANG 2021 1677 1688 L LI 2021 2101315 X LI 2021 1897 1927 S SUEN 2017 337 365 N SU 2023 7 49 H BAGLIO 2008 105 108 V DRESP 2019 933 942 S YU 2019 244 276 P DU 2018 21617 21624 H BROWNE 2016 11397 11407 M KUMAR 2023 54446 54457 L ZHANG 2023 174 183 D AN 2020 21770 21779 B AN 2024 149903 B AN 2024 292 302 B FU 2023 22744 22754 L JIANG 2024 2306910 Y ZHOU 2022 9318 9327 J WANG 2023 101192 H KUANG 2023 2303030 P CONG 2020 242 248 M MOULDER 1995 44 45 J SUN 2024 124302 Y GU 2020 123454 J PI 2016 19779 19786 M ZHANG 2014 14354 14359 Y LI 2023 1171 1180 J YOU 2016 714 721 B NA 2024 135531 S ROH 2021 120434 H XUE 2020 28288 28297 N XIONG 2020 1184 1192 L CHEN 2023 1116 1122 J LI 2023 140292 L ZHOU 2021 31 38 F SUN 2018 1800584 F NATH 2019 2293 2302 K LIU 2024 228 238 W SU 2024 e2319427121 R WANG 2023 2374 2385 J SU 2022 137226 H GAO 2018 39713 39722 Y GAO 2020 17364 17375 Y ANX2024X113 ANX2024X113X125 ANX2024X113XB ANX2024X113X125XB 2026-10-24T00:00:00.000Z 2026-10-24T00:00:00.000Z http://creativecommons.org/licenses/by-nc-nd/4.0/ 2024-10-27T16:04:01.258Z http://vtw.elsevier.com/data/voc/AddOnTypes/50.7/aggregated-refined National Natural Science Foundation of China 52473327 51572295 21003157 21273285 NSFC National Natural Science Foundation of China http://data.elsevier.com/vocabulary/SciValFunders/501100001809 http://sws.geonames.org/1814991/ National Key R&amp;D Program of China 2021YFA1501300 2019YFC1907602 NKRDPC National Key Research and Development Program of China http://data.elsevier.com/vocabulary/SciValFunders/501100012166 http://sws.geonames.org/1814991/ This work was supported by National Natural Science Foundation of China (52473327, 51572295, 21273285, 21003157) and National Key R&amp;D Program of China (2021YFA1501300, 2019YFC1907602). item S1872-2067(24)60124-5 S1872206724601245 1-s2.0-S1872206724601245 10.1016/S1872-2067(24)60124-5 273538 2024-10-24T15:10:45.975666Z 2024-10-01 2024-10-31 1-s2.0-S1872206724601245-main.pdf https://s3-eu-west-1.amazonaws.com/prod-ucs-content-store-eu-west/content/pii:S1872206724601245/MAIN/application/pdf/e678452bf00f55039d7a1897d292104a/main.pdf main.pdf pdf true 6194201 MAIN 13 1-s2.0-S1872206724601245-main_1.png https://s3-eu-west-1.amazonaws.com/prod-ucs-content-store-eu-west/content/pii:S1872206724601245/PREVIEW/image/png/6acce9ff86d47dd2dce637368fd853bf/main_1.png main_1.png png 53409 849 656 IMAGE-WEB-PDF 1 1-s2.0-S1872206724601245-fx1.jpg https://s3-eu-west-1.amazonaws.com/prod-ucs-content-store-eu-west/content/pii:S1872206724601245/fx1/DOWNSAMPLED/image/jpeg/b20ab16c88506d1e99eed0ef96033fee/fx1.jpg fx1 true fx1.jpg jpg 43656 245 245 IMAGE-DOWNSAMPLED 1-s2.0-S1872206724601245-gr1.jpg https://s3-eu-west-1.amazonaws.com/prod-ucs-content-store-eu-west/content/pii:S1872206724601245/gr1/DOWNSAMPLED/image/jpeg/8477af781ef03550886b1280cd711f92/gr1.jpg gr1 gr1.jpg jpg 55363 303 371 IMAGE-DOWNSAMPLED 1-s2.0-S1872206724601245-gr2.jpg https://s3-eu-west-1.amazonaws.com/prod-ucs-content-store-eu-west/content/pii:S1872206724601245/gr2/DOWNSAMPLED/image/jpeg/b2c57a61c6c91b46926953d3b3185d29/gr2.jpg gr2 gr2.jpg jpg 177360 671 738 IMAGE-DOWNSAMPLED 1-s2.0-S1872206724601245-gr3.jpg https://s3-eu-west-1.amazonaws.com/prod-ucs-content-store-eu-west/content/pii:S1872206724601245/gr3/DOWNSAMPLED/image/jpeg/589cd5aa05bfc6a7b0423152376b4ecd/gr3.jpg gr3 gr3.jpg jpg 114848 547 736 IMAGE-DOWNSAMPLED 1-s2.0-S1872206724601245-gr4.jpg https://s3-eu-west-1.amazonaws.com/prod-ucs-content-store-eu-west/content/pii:S1872206724601245/gr4/DOWNSAMPLED/image/jpeg/ce9cd70cdb322ba0ed9e98272f73b1cc/gr4.jpg gr4 gr4.jpg jpg 115762 569 750 IMAGE-DOWNSAMPLED 1-s2.0-S1872206724601245-gr5.jpg https://s3-eu-west-1.amazonaws.com/prod-ucs-content-store-eu-west/content/pii:S1872206724601245/gr5/DOWNSAMPLED/image/jpeg/9b0809a20f888a97d524ac7e40e2c9f0/gr5.jpg gr5 gr5.jpg jpg 62977 392 528 IMAGE-DOWNSAMPLED 1-s2.0-S1872206724601245-gr6.jpg https://s3-eu-west-1.amazonaws.com/prod-ucs-content-store-eu-west/content/pii:S1872206724601245/gr6/DOWNSAMPLED/image/jpeg/3e053963d9a88973a05f4735e3b8aef3/gr6.jpg gr6 gr6.jpg jpg 88269 437 690 IMAGE-DOWNSAMPLED 1-s2.0-S1872206724601245-gr7.jpg https://s3-eu-west-1.amazonaws.com/prod-ucs-content-store-eu-west/content/pii:S1872206724601245/gr7/DOWNSAMPLED/image/jpeg/f6a6ef5c6ce6833752983b515551e7a5/gr7.jpg gr7 gr7.jpg jpg 148376 485 730 IMAGE-DOWNSAMPLED 1-s2.0-S1872206724601245-gr8.jpg https://s3-eu-west-1.amazonaws.com/prod-ucs-content-store-eu-west/content/pii:S1872206724601245/gr8/DOWNSAMPLED/image/jpeg/3821e3dabb13037457660a092fa31749/gr8.jpg gr8 gr8.jpg jpg 90983 512 521 IMAGE-DOWNSAMPLED 1-s2.0-S1872206724601245-fx1.sml https://s3-eu-west-1.amazonaws.com/prod-ucs-content-store-eu-west/content/pii:S1872206724601245/fx1/THUMBNAIL/image/gif/3f805dd39112bd7d655647ee871f817f/fx1.sml fx1 true fx1.sml sml 24813 164 164 IMAGE-THUMBNAIL 1-s2.0-S1872206724601245-gr1.sml https://s3-eu-west-1.amazonaws.com/prod-ucs-content-store-eu-west/content/pii:S1872206724601245/gr1/THUMBNAIL/image/gif/a995a796d418f90a12625232c9dee471/gr1.sml gr1 gr1.sml sml 26883 164 201 IMAGE-THUMBNAIL 1-s2.0-S1872206724601245-gr2.sml https://s3-eu-west-1.amazonaws.com/prod-ucs-content-store-eu-west/content/pii:S1872206724601245/gr2/THUMBNAIL/image/gif/3c5f29bb1894fbc9922afe4b7c081bef/gr2.sml gr2 gr2.sml sml 13865 164 180 IMAGE-THUMBNAIL 1-s2.0-S1872206724601245-gr3.sml https://s3-eu-west-1.amazonaws.com/prod-ucs-content-store-eu-west/content/pii:S1872206724601245/gr3/THUMBNAIL/image/gif/18dc66868fd3ca464625fbef3f7ebeb3/gr3.sml gr3 gr3.sml sml 13097 163 219 IMAGE-THUMBNAIL 1-s2.0-S1872206724601245-gr4.sml https://s3-eu-west-1.amazonaws.com/prod-ucs-content-store-eu-west/content/pii:S1872206724601245/gr4/THUMBNAIL/image/gif/f59415d6713009f1d8c6672b402638c1/gr4.sml gr4 gr4.sml sml 12471 164 216 IMAGE-THUMBNAIL 1-s2.0-S1872206724601245-gr5.sml https://s3-eu-west-1.amazonaws.com/prod-ucs-content-store-eu-west/content/pii:S1872206724601245/gr5/THUMBNAIL/image/gif/0039ae9b785035971e22adb9fb51262d/gr5.sml gr5 gr5.sml sml 11782 162 219 IMAGE-THUMBNAIL 1-s2.0-S1872206724601245-gr6.sml https://s3-eu-west-1.amazonaws.com/prod-ucs-content-store-eu-west/content/pii:S1872206724601245/gr6/THUMBNAIL/image/gif/d4aa9b27dfe9a60dd8bf4013cf241e8e/gr6.sml gr6 gr6.sml sml 10441 139 219 IMAGE-THUMBNAIL 1-s2.0-S1872206724601245-gr7.sml https://s3-eu-west-1.amazonaws.com/prod-ucs-content-store-eu-west/content/pii:S1872206724601245/gr7/THUMBNAIL/image/gif/e1f4a0d1ba1e57f1cea312541363b126/gr7.sml gr7 gr7.sml sml 16766 145 219 IMAGE-THUMBNAIL 1-s2.0-S1872206724601245-gr8.sml https://s3-eu-west-1.amazonaws.com/prod-ucs-content-store-eu-west/content/pii:S1872206724601245/gr8/THUMBNAIL/image/gif/97a3aa49691fe7d87a7eb7eece7c50c4/gr8.sml gr8 gr8.sml sml 11543 164 167 IMAGE-THUMBNAIL 1-s2.0-S1872206724601245-fx1_lrg.jpg https://s3-eu-west-1.amazonaws.com/prod-ucs-content-store-eu-west/content/pii:S1872206724601245/HIGHRES/image/jpeg/a780b5cebe8bc084cf92339833490e93/fx1_lrg.jpg fx1 true fx1_lrg.jpg jpg 222319 651 651 IMAGE-HIGH-RES 1-s2.0-S1872206724601245-gr1_lrg.jpg https://s3-eu-west-1.amazonaws.com/prod-ucs-content-store-eu-west/content/pii:S1872206724601245/HIGHRES/image/jpeg/60081643e9ec3c9216a9ee39907ac370/gr1_lrg.jpg gr1 gr1_lrg.jpg jpg 364130 804 985 IMAGE-HIGH-RES 1-s2.0-S1872206724601245-gr2_lrg.jpg https://s3-eu-west-1.amazonaws.com/prod-ucs-content-store-eu-west/content/pii:S1872206724601245/HIGHRES/image/jpeg/ea5a62c936cb50ea9ca703b6fe8d72a6/gr2_lrg.jpg gr2 gr2_lrg.jpg jpg 688943 1784 1961 IMAGE-HIGH-RES 1-s2.0-S1872206724601245-gr3_lrg.jpg https://s3-eu-west-1.amazonaws.com/prod-ucs-content-store-eu-west/content/pii:S1872206724601245/HIGHRES/image/jpeg/e801ef9ca1a291394b49f21cebc7ef18/gr3_lrg.jpg gr3 gr3_lrg.jpg jpg 467674 1453 1954 IMAGE-HIGH-RES 1-s2.0-S1872206724601245-gr4_lrg.jpg https://s3-eu-west-1.amazonaws.com/prod-ucs-content-store-eu-west/content/pii:S1872206724601245/HIGHRES/image/jpeg/116d206ce157f1116820216e9d7e1620/gr4_lrg.jpg gr4 gr4_lrg.jpg jpg 474709 1513 1993 IMAGE-HIGH-RES 1-s2.0-S1872206724601245-gr5_lrg.jpg https://s3-eu-west-1.amazonaws.com/prod-ucs-content-store-eu-west/content/pii:S1872206724601245/HIGHRES/image/jpeg/749a734654b06d3a6caa81fce1e21bdd/gr5_lrg.jpg gr5 gr5_lrg.jpg jpg 279195 1040 1402 IMAGE-HIGH-RES 1-s2.0-S1872206724601245-gr6_lrg.jpg https://s3-eu-west-1.amazonaws.com/prod-ucs-content-store-eu-west/content/pii:S1872206724601245/HIGHRES/image/jpeg/15897c02baa54830ddad630c6ade2a89/gr6_lrg.jpg gr6 gr6_lrg.jpg jpg 357059 1160 1832 IMAGE-HIGH-RES 1-s2.0-S1872206724601245-gr7_lrg.jpg https://s3-eu-west-1.amazonaws.com/prod-ucs-content-store-eu-west/content/pii:S1872206724601245/HIGHRES/image/jpeg/40a9baebbdf55758c54e12324804eb1b/gr7_lrg.jpg gr7 gr7_lrg.jpg jpg 637156 1288 1939 IMAGE-HIGH-RES 1-s2.0-S1872206724601245-gr8_lrg.jpg https://s3-eu-west-1.amazonaws.com/prod-ucs-content-store-eu-west/content/pii:S1872206724601245/HIGHRES/image/jpeg/6f807c4fbc85a15bc23ee7c32701e4f0/gr8_lrg.jpg gr8 gr8_lrg.jpg jpg 328266 1361 1384 IMAGE-HIGH-RES 1-s2.0-S1872206724601245-mmc1.pdf https://s3-eu-west-1.amazonaws.com/prod-ucs-content-store-eu-west/content/pii:S1872206724601245/mmc1/MAIN/application/pdf/9a9e8eaa9d139abae12a803322bc4069/mmc1.pdf mmc1 mmc1.pdf pdf false 5304527 APPLICATION CHNJC 60124 S1872-2067(24)60124-5 10.1016/S1872-2067(24)60124-5 Dalian Institute of Chemical Physics, the Chinese Academy of Sciences Fig. 1 (a) SEM image of FeP-CoP3. (b) TEM images of FeP-CoP3. (c–e) HRTEM images of FeP-CoP3. (f) SAED image of FeP-CoP3. (g–m) EDS elemental mapping images for Co, Fe, P, O, N, C separately. Fig. 2 (a) Process flowchart for preparing MOF on MOF structure. XRD images of FeP-CoP3 (b), FeP and CoP3 (c), Co3O4 and Fe2O3 (d). (e) Partial enlarged XRD images of FeP-CoP3. (f) SBET image of FeP-CoP3, FeP and CoP3. (g) Raman images of FeP-CoP3, FeP and CoP3. (h) Comparison graph of Fe XPS peaks. (i) Comparison graph of Co XPS peaks. (j) Comparison graph of P XPS peaks. Fig. 3 (a) The LSV curves of FeP-CoP3, FeP, Fe2O3, CoP3, Co3O4 and CG. (b) Tafel slops of FeP-CoP3, FeP, Fe2O3, CoP3, Co3O4 and CG. (c) Relevant overpotentials at η10, η50 and η100 of the samples. (d,e) Impedance of the prepared catalyst. (f) HER stability test of FeP-CoP3. (g) Comparison of HER performance with other catalysts. (h) Comparison of HER LSV before and after stability testing. Fig. 4 (a) LSV curves of FeP-CoP3, FeP, Fe2O3, CoP3, Co3O4 and CG. (b) Tafel slops of FeP-CoP3, FeP, Fe2O3, CoP3, Co3O4 and CG. (c) Relevant overpotentials at η50, η100 and η150 of the samples; (d,e) Impedance of the prepared catalyst. (f) OER stability test of FeP-CoP3. (g) Comparison of OER performance with other catalysts. (h) Comparison of OER LSV before and after stability testing. Fig. 5 (a) Overall water splitting LSV curves of as-prepared catalysts at 1 M KOH. (b) FeP-CoP3 catalytic stability. (c) XRD pattern of FeP-CoP3 recovered for OER reaction. (d) Activity comparison with other electrocatalysts. Fig. 6 (a) Free energy diagram of HER intermediates at different U values, and bottom image is most likely OER mechanism, Gibbs free energy profiles along the reaction pathway of CoP3 (b), FeP (c), and FeP-CoP3 (d). Fig. 7 Density of states projected on the d-states of Fe in Fe-CoP3 (a), Co in FeP-CoP3 (b), Fe in FeP (c), and Co in CoP3 (d). Dashed-dotted lines and the numbers show the position of d-band center. E g density of states projected on the d-states of Fe in Fe-CoP3 (e), Co in FeP-CoP3 (f), Fe in FeP (g), Co in CoP3 (h). (i) The charge density difference between FeP-CoP3. Charge buildup and depletion are represented by the colors blue and yellow, respectively. (j) Schematic diagram of OER process. Fig. 8 Schematics of d-orbital electronic configurations of central metals in single atom Fe (a), single atom Co (b), and FeP-CoP3 (c) [43]. Available online 20 October 2024 This work was supported by National Natural Science Foundation of China (52473327, 51572295, 21273285, 21003157) and National Key R&D Program of China (2021YFA1501300, 2019YFC1907602). Article Atomic orbitals modulated dual functional bimetallic phosphides derived from MOF on MOF structure for boosting high efficient overall water splitting Bohan An a b Weilong Liu a b Jipeng Dong a b Ning Li a b Yangqin Gao a b Lei Ge a b * a State Key Laboratory of Heavy Oil Processing, College of New Energy and Materials, China University of Petroleum Beijing, Beijing 102249, China State Key Laboratory of Heavy Oil Processing College of New Energy and Materials China University of Petroleum Beijing Beijing 102249 China State Key Laboratory of Heavy Oil Processing, College of New Energy and Materials, China University of Petroleum Beijing, Beijing 102249, China b Department of Materials Science and Engineering, College of New Energy and Materials, China University of Petroleum Beijing, Beijing 102249, China Department of Materials Science and Engineering College of New Energy and Materials China University of Petroleum Beijing Beijing 102249 China Department of Materials Science and Engineering, College of New Energy and Materials, China University of Petroleum Beijing, Beijing 102249, China * Corresponding author The electronic modulation characteristics of efficient metal phosphide electrocatalysts can be utilized to tune the performance of oxygen evolution reaction (OER). However, improving the overall water splitting performance remains a challenging task. By building metal organic framework (MOF) on MOF heterostructures, an efficient strategy for controlling the electrical structure of MOFs was presented in this study. ZIF-67 was in-situ synthesized on MIL-88 (Fe) using a two-step self-assembly method, followed by low-temperature phosphorization to ultimately synthesize FeP-CoP3 bimetallic phosphides. By combining atomic orbital theory and theoretical calculations (density functional theory), the results reveal the successful modulation of electronic orbitals in FeP-CoP3 bimetallic phosphides, which are synthesized from MOF on MOF structure. The synergistic impact of the metal center Co species and the phase conjugation of both kinds of MOFs are responsible for this regulatory phenomenon. Therefore, the catalyst demonstrates excellent properties, demonstrating HER 81 mV (η10) in a 1.0 mol L−1 KOH solution and OER 239 mV (η50) low overpotentials. The FeP-CoP3 linked dual electrode alkaline batteries, which are bifunctional electrocatalysts, have a good electrocatalytic ability and may last for 50 h. They require just 1.49 V (η50) for total water breakdown. Through this technique, the electrical structure of electrocatalysts may be altered to increase catalytic activity. Graphical Abstract By building metal organic framework MOF on MOF heterostructures, followed by low-temperature phosphorization technology, FeP-CoP3 bimetallic phosphides are ultimately synthesized. FeP-CoP3 material is a bifunctional electrocatalyst with a good electrocatalytic ability and may last for 50 h. They require just 1.49 V (η50) for total water breakdown. Keywords Transition metal phosphides MOF on MOF Atomic orbital theory Density functional theory calculation 1 Introduction Facing with the current global energy and carbon emissions issues, hydrogen fuel is considered the most effective method to traditional energy due to its high calorific value and zero carbon emissions [1–3]. Among them, the use of green hydrogen produced by electrochemical water decomposition is currently recognized as the most environmentally and friendly method [4–6]. However, electrochemical hydrogen evolution requires two and a half reactions (hydrogen evolution reaction and oxygen evolution reaction) to occur simultaneously, and the slow kinetics of oxygen evolution reaction (OER) significantly hinder energy conversion efficiency, which is the result of the four-step proton coupled electron transfer process [7–10]. Adding noble metal-based materials such as Pt, IrO2, and RuO2 to the electrode has always been the preferred solution to enhance the progress of this semi reaction [11]. However, their extremely precious resource reserves limit prevailing application, and its high market price further suppresses its widespread promotion. Therefore, exploring non-precious metal electrocatalysts with high activity and stability is crucial [12–14]. As a substitute for precious metal catalysts, transition metal-based catalysts not only have large natural reserves and low market prices, but also possess excellent electrochemical performance and stability [3]. So they can be used as workable substitutes for efficient hydrogen generation. In electrocatalytic processes, transition metal oxides (TMO) demonstrate exceptional OER stability and performance [15]. However, due to their poor HER performance in complete hydrolysis, the application range is often limited (often used as a semi reaction catalyst). Moreover, transition metal phosphides (TMPs) present exceptional performance in fully hydrolyzed water, while their use is often limited due to their weak stability [16]. Therefore, by utilizing appropriate skeleton structures and combining the advantages of various architectures, multifunctional electrocatalysts can be developed. Because of their rich porosity, large surface areas, movable structures and plenty of active sites, metal organic frameworks (MOFs) have a lot of potential applications in the field of electrocatalysis [17]. Further, by modifying the metal centers and organic ligands, MOFs’ electronic structure can be precisely controlled. This is important because the electronic structure of MOFs has a significant impact on the OER performance by altering the binding energy between the electrocatalyst and reaction intermediates during the process. Moreover, the construction of multi metal MOFs provides a new approach for electronic structure modulation [18,19]. Notably, the synergistic interaction between Co and Fe ions causes CoFe MOF to exhibit modest electronic structural adjustment, increasing catalytic activity and making it one of the most efficient OER electrocatalysts [20]. For example, Liu et al. [21] firstly synthesized the core using MOF templating method, and then obtained the outer shell, finally prepared CoP nanoparticles containing within the CoFeP shell. This catalyst showed excellent OER performance in alkaline media with an overpotential of 266 mV (η10). It outperformed commercial RuO2 and CoFeP nanocubes in terms of performance. The encapsulation structure of CoP/CoFeP was shown to have a rich Fe doped shell through theoretical calculations and experimental characterization. This phenomenon allows for electronic interactions between CoP and CoFeP, exposing more active sites and ultimately improving OER performance. Jiang et al. [22] adjusted the electronic structure of MOFs by constructing MOF on MOF heterostructures. MOF-(74+274)@NFF was prepared on NiFe substrate by two-step self-assembly technology. This material also presented excellent OER performance with 198 and 223 mV (η10) in 1.0 and 0.1 mol L−1 KOH solutions, nevertheless the HER activity is insufficient. Therefore, creating dual MOF hybrids is a useful tactic for enhancing MOF catalytic activity and adjusting their electronic structure. By converting two different MOF structures into a mixed catalyst to maintain their respective characteristics and advantages that a single MOF cannot provide, can be utilized to develop high performance electrocatalysts. So far, numerous conjugated MOF-based compounds with exceptional OER performance have been investigated as electrocatalysts [18–22]. However, the inherent electron transfer mechanism of MOF on MOF hybrids remains ambiguous, which poses a challenge for designing efficient electrocatalysts [23–26]. In this work, bimetallic phosphides were reasonably designed and synthesized from MOF on MOF structure to achieve precise charge modulation and synergistic effects of electron redistribution. The bimetallic center leads to an improvement in performance. Specifically, through a two-step solvent thermal epitaxial growth process, MIL-88(Fe)@ZIF-67 precursor with MOF on MOF structure was obtained. Finally, bimetallic phosphides were generated through in-situ phosphating process. The phase conjugation of two types of MOFs and the synergistic effect of metal centers have a tuning effect on the electron distribution. Its larger specific surface area exposes more active sites. It is worth noting that the heterojunction interface generated between FeP and CoP3 promotes electron transfer, enriches active sites and regulates electronic structure, thereby achieving excellent electrocatalytic performance, which is far superior to phosphides synthesized by a single MOF precursor. Detailed investigation and theoretical calculation results imply that the synergistic effect between Co and Fe ions can reduce the energy barrier of the rate determination step (RDS), thereby improving ability and reducing the activation energy (E a). 2 Experimental 2.1 Synthesis All compounds are purchased and used directly without additional purification. Firstly, 20 mmol (2.32g) fumaric acid and 10 mmol (4.04g) of Fe(NO3)3·9H2O were added and rapidly stirred in a 1:1 volume ratio ethanol water mixture, and mixture was maintained for 24 h. The reddish brown precipitate was collected by centrifugation, and then dried at 70 °C for 12 h. By changing the content of malic acid while remaining unchanged, the size of MIL-88(Fe) can be regulated. The as-prepared MIL-88(Fe) was added into 50 mL methanol solution, 4 mmol 2-methylimidazole was dropped and stirred for 30 min, and then 1 mmol Co(NO3)2·6H2O was added to form a mixed solution. The merged solution was kept at room temperature for 24 h. After the solution is fully dispersed, the purple substance was collected by centrifugation, and then dried at 70 °C for 12 h. Finally, MIL-88(Fe)@ZIF-67 precursor was obtained. NaH2PO2·H2O (located on the upstream side) and MIL-88(Fe)@ZIF-67 precursor are placed in pipeline equipment with 1:10 ratio. Experimental phosphating conditions: under continuous nitrogen protection, the temperature is maintained at 400 °C, the heating rate is 2 °C min−1, and the insulation time is 2 h. Finally, the product was wash repeatedly with an alcohol solution to remove unreacted substances and impurities. Finally, the samples were dried overnight to get the target catalysts FeP and CoP3, which was labeled as FeP-CoP3 for subsequent expression convenience (Fig. S1). The synthesis process of other catalyzers is described in the supporting information. The scanning electron microscope (SEM) images of comparison samples FeP and CoP3 are shown in Fig. S2. 2.2 Characterizations The crystallographic characterization of all samples was investigated by X-ray diffractometer (XRD) (Cu-Kα radiation, λ = 1.5406 Å) with a 2θ range of 10° to 90° and a scan rate of 5°min−1. Morphological characterization of the electrodes was carried out by using a FEI Quanta 200 F emission SEM with an accelerating voltage of 20 kV. The morphologies of the catalysts were a−1nalyzed by FEI Tecnai G2 F20 transmission electron microscope (TEM) and HRTEM imaging. X-ray photoelectron spectroscopy (XPS) measurements were performed on a spectrometer PHI 5300 ESCA, using a Mg Kα monochromator calibrated with the C 1s peak (284.8 eV) to provide incident photon energy. In addition, the electrodes were also carried out on a Raman spectrometer (λ = 532 nm). 2.3 Electrochemical testing conditions Electrochemical measurements were tested in a standard three-electrode system (CHI660E, China) in KOH (1.0 mol L−1). The carbon rod and saturated calomel served as the counter electrode and reference electrode, respectively, while the working electrode was 1 × 1 cm2 FTO loaded with electrocatalyst. High purity N2 gas was pumped for 30 min prior to eliminating dissolved O2. Linear sweep voltammetry (LSV) measurements were performed in KOH (1.0 mol L−1, pH = 13.8) electrolyte at 5 mV s−1 with iR compensation. The HER and OER potentials were converted to reversible hydrogen electrode (RHE) according to the Eqs. (1) and (2): (1) η(HER) = E(Ag/AgCl) + 0.0591 × PH + 0.2415 (2) η(OER) = E(Hg/AgCl) + 0.0591 × PH + 0.2415–1.23 The Tafel slope (b) is derived from η = a + blog(j), where j represents the current density. The electrochemical impedance spectroscopy (EIS) was conducted at 5 mV (vs. RHE) for HER in the frequency range of 105 to 10−1 Hz. Electrochemical surface area (ECSA) was used to record cyclic voltammogry (CV) at 20, 40, 60, 80, 100, and 120 mV s−1. Catalytic performance towards overall water splitting was tested in a two-electrode system, and LSV maps were recorded at 10 mV s−1 using V-CoFeP as the anode and cathode. E(RHE) = E(Ag/AgCl) + 0.059 × pH + 0.197 V 2.4 Calculation of density functional theory (DFT) The calculation method is a theoretical analysis way depended on DFT, using VASP (Vienna Ab initio Simulation Package) package and Projector Augmented Wave (PAW) method. Perdew Bourke Ernzerhof (PBE) and Generalized Gradient Approximation (GGA) is adopted for the swap-related multi-function. Because of the correlated electron effect in transition metals, GGA approximation cannot exactly explain the electronic structure and mechanization of magnetism, so the GGA+U (Hubbard parameter) method with Hubbard correction is adopted. The synthesis process, characterization methods, electrochemical measurements and DFT calculations of other TMPs are fully illustrated in the supporting information. 3 Results and discussion 3.1 Characterization of prepared sample As shown in TEM images and SEM images (Fig. 1(a) and Fig. S3), it can be noticed that the FeP-CoP3 sample is composed of two types of nanoparticles. These nanoparticles are tightly constructed together through the MOF on MOF method, and a large number of electrochemical active sites are exposed on their surface (Fig. 1(b)). Furthermore, selected area electron diffraction (SAED) patterns relative to lattice points (Fig. 1(f)) can be observed with spacings corresponding to the (011), (020), and (111) planes of shuttle shaped FeP and the (321) and (013) planes of hexagonal CoP3, further confirming the synthesis of the target product (Figs. 1(c)–(e)). It can also be found that there are a large number of heterojunction structures at the junction of the two types of nanoparticles. Moreover, the results of TEM Energy Dispersion Spectroscopy (TEM EDS) confirm that Fe, Co, P, O, N and C elements coexist in the MOF on MOF structured nanomaterials (Figs. 1(g)–(m) and Fig. S5). Therefore, it can be determined that FeP-CoP3 has been successfully synthesized with MOF on MOF structure (Fig. S4). The sample FeP-CoP3 was synthesized through three steps, including precursor synthesis, the preparation of precursor using MOF on MOF, and the final material phosphating. Firstly, MIL-88(Fe) will be synthesized under air conditions using a hot stirring method. Then, the Co source was added into the MIL-88(Fe) material using the MOF on MOF synthesis strategy to form the MIL-88(Fe)@ZIF-67 precursor. Finally, PH3 steam is used as the phosphorus source. Phosphating treatment was performed on the precursor to obtain FeP-CoP3 hetero structure (Fig. 2(a) ). To ensure clarity of the sample, it was repeatedly cleaned with hydrochloric acid to remove impurities and purify the FeP-CoP3 catalyzer. According to XRD results (Figs. 2(b) and 2(e)) [27], the sample adopts a low-temperature synthesis process, and the synthesis of the target product can be determined by comparing it with the standard card. According to the intensity of diffraction peaks, the sample contains a large amount of FeP and CoP3 components. The X-ray diffraction peaks of the target sample product appear at 32.7°, 37.2°, 46.3°, 46.9°, 48.3°, and 59.6°, which can be attached to the (011), (111), (202), (211), and (020) crystal planes of the FeP crystal (PDF#78-1443). The XRD peaks at 22.9°, 36.8° and 43.9° can be indexed to (200), (013), and (331) crystal planes (PDF#73-1239) of the CoP3 phase. Comparison samples were prepared by controlling experiments (Figs. 2(c) and 2(d)), CoP3 material was synthesized by phosphating of ZIF-67, and Co3O4 material was fabricated by direct oxidation (PDF#74-1657). FeP was obtained by phosphating MIL-88(Fe), and Fe2O3 was synthesized by further oxidation process (PDF#87-1164). Each sample was matched with the corresponding PDF card. Weak XRD peaks occur at lower synthesis temperatures (400 °C) as a result of lower synthesis temperatures. XRD patterns suggest the successful synthesis of the target catalyst (FeP-CoP3), and characterizing techniques such as Raman spectroscopy, XPS, and TEM were further conducted to confirm the presence of FeP-CoP3. The nitrogen adsorption desorption isotherm is shown in Fig. 2(f), the FeP-CoP3 sample still has a large specific surface area after the phosphorization of the nanoparticles. Simultaneously, as shown in Fig. 2(g), the sample was further analyzed by Raman spectroscopy. It has two distinct peaks at approximately 1359 and 1581 cm−1, indicating disordered carbon (D band) and graphitized carbon (G band), respectively, while an increase in I D/I G values indicates the presence of more defects on the surface, which is more conducive to the catalytic reaction [28,29]. The composition and chemcial states of FeP-CoP3 were explored using XPS. By comparing with the FeP and CoP3 samples (Figs. S8(f) and S9(f)), the superiority of the MOF on MOF preparation process adopted in this study has been further demonstrated. The XPS survey scanning spectrum revealed the existence of Co, Fe, C, N, O, and P elements in the sample (Fig. S6). The binding energy was calibrated using C 1s as a reference. As shown in Fig. S7(b), the three fitted peaks of FeP-CoP3 samples at 284.8, 285.9, and 287.5 eV can be attributed to the C–C, C–N, and C–O bonds of the C species [30]. The overall fitting peak of FeP-CoP3 is similar to that of CoP3 and FeP (Figs. S8(b) and S9(b)), except that the C-N signal is obvious. It can be summarized that the core-shell skeleton contributes to the C–N transfer and thus improves the carbon skeleton behavior. A small amount of N element from cobalt nitrate will form electrophilic carbon atoms and nucleophilic N atoms with the C source in fumaric acid, forming C–N bonds. In Fig. S7(c), the N 1s peak of FeP-CoP3 can be ascribed to pyridine N (399.3 eV), pyrrole N (401.4 eV), and graphite N (407.7 eV) [31]. In fact, graphite he conductivity of carbon skeleton can be enhanced by graphite N. On the other hand, the improvement in its electrocatalytic performance can be attributed to the high binding energy of pyridine N. On the contrary, the pyridine N signal in CoP3 is much weaker (Figs. S8(c) and Fig. S9(c)). Graphitic nitrogen enhances the conductivity of the carbon skeleton, while pyridine nitrogen exhibits the highest binding energy, which makes it easy to enhance its electrocatalytic properties. In contrast, the fitted peak signals of other samples are weaker. In contrast to single FeP and CoP3, due to the interaction of two metal phosphides in FeP-CoP3, the redistribution of orbital electrons in FeP-CoP3 makes it easier to form hydroxyl oxides on the surface that are conducive to electrocatalysis under alkaline conditions. Based on the comparison of element content in Table S1, the sample has a low O content (low oxide content). The XPS peak at 707.1 eV of FeP-CoP3 in Fig. 2(h) is similar to that in FeP. The high-resolution Fe 2p 3/2 XPS spectrum shows three peaks, namely Fe-P, Fe-PO x , and other satellite peaks (Fig. S7(a)) [16,17]. The high-resolution spectrum of Fe 2p indicates that these three peaks are Fe 2p 3/2 (711.6 and 715.7 eV), Fe 2p 1/2 (724.9 and 728.5 eV), and a wobbly satellite peak (730.9 eV). The Fe XPS spectrum of FeP are also consists of Fe 2p 3/2 (711.3 and 713.9 eV), Fe 2p 1/2 (717.4 and 725.1 eV), and wobbly satellite peaks (730.4 eV) (Fig. S8(a)). For Co 2p 3/2 orbit, the XPS peaks can be approximately categorized into three different XPS peaks, which are separately related to Co-P, Co-PO x , and their vibrational satellite peaks (Fig. 2(i)) [32]. The FeP-CoP3 XPS spectrum of Co (Fig. S7(f)) has three XPS peaks including Co–P bonds (779.3 and 792.7 eV), Co–PO x bonds (782.3 and 798.3 eV), and other satellite signals (782.3 and 804.3 eV). The Co peaks of CoP3 (Fig. S9(a)) are separately related to Co–P bonds (781.8 and 788.1 eV), Co–PO x bonds (783.4 and 798.4 eV), and satellite signals (785.3 and 803.4 eV). Sum up, compared with CoP3, the combining energies of Co 2p 3/2 and 2p 1/2 in FeP-CoP3 samples shift to the left side, indicating that the electron cloud density is high, and the electron cloud is more easily polarized when the electrophilic reagent approaches, which helps to generate transition states that are more conducive to the reaction. At the same time, the intermediate ions generated after being attacked by the electrophilic reagent are more stable, and correspondingly, the energy barrier of the reaction transition state is lower, so electrophilic addition is easier to occur [32]. As shown in Fig. 2(j), the P3− metal phosphorus bond at 130 and 134.5 eV belongs to FeP-CoP3 sample (Fig. S7(e)), which might be active center. The peak at 135.2 eV can be attributed to byproducts produced by oxidation on the surface of FeP-CoP3 [19]. The P-XPS spectra of FeP and CoP3 also have three characteristic peaks. Due to exposure to air, there are also oxidized P (PO4 3−) substances on their surfaces (FeP: 134.9 eV; CoP3: 135.7 eV) (Fig. S8(e) and Fig. S9(e)) [19,33–35]. By comparing the three samples, it can be found that due to the positive shift of the Fe orbitals and the negative transformation of the Co orbitals, the P orbitals also undergo a positive shift, resulting in an increase in the valence state of the element and a bias towards the positive polarity of the chemical bonds, thereby freeing up more low state orbitals for electron transfer. The same results still support the support of charge transfer between MOF on MOF nanostructures, thereby enhancing electrocatalytic activity. 3.2 Electrocatalytic hydrogen evolution performance HER performance was evaluated by a standard three electrode apparatus in alkaline solution. The electrocatalytic performances of FeP-CoP3, FeP, Fe2O3, CoP3, Co3O4 electrodes and pure CG were tested and compared. The FeP-CoP3 electrode exhibited extraordinary catalytic activity as shown by the LSV curve (Fig. 3(a) ). The FeP-CoP3 electrode clearly requires Pt-C/CC or zero initial potential (initial potential). The HER performance of the FeP-CoP3 electrode is determined to be 81 mV (η10), 170 mV (η50) and 237 mV (η100) respectively, the electrodes still have advantages at high current densities (Fig. 3c). At a current density of η10, η50 and η100, it outperforms the performance of FeP (113, 203, and 276 mV) and CoP3 (192, 356, and 456 mV). In addition, it can be verified that the performance of FeP-CoP3 electrode in alkaline media is superior to the previously reported materials (Table S2 and Fig. 3(g)). The Tafel slope of the FeP-CoP3 electrode in the Volmer-Tafel mechanism is 71.5 mV dec−1 (Fig. 3(b)), which is much lower than the slope of the FeP electrode (101.5 mV dec−1) and other electrodes. As a result of EIS, reaction kinetics were detected. Compared with other electrodes, the FeP-CoP3 electrode demonstrates significantly lower transfer resistance (R ct = 2 Ω) (Fig. 3(d)), indicating that the MOF on MOF structure can improve the kinetics of charge transfer. Moreover, FeP-CoP3 also exhibits high standardized ESCA activity and has the highest HER performance. The CV curve shows that the FeP-CoP3 electrode has a higher C dl (15.17 mF cm−2) than other samples, indicating that the MOF on MOF structure generates more active sites (Fig. 3(e)). Therefore, this structure can present strong HER performance. Eventually, the electrode (FeP-CoP3) was evaluated using LSV curves and CV cycles (Fig. S10). After CV cycling, the FeP-CoP3 electrode curve clearly shows a slight decrease. Even after 20 h of operation, the decrease in current density is negligible, as shown in the LSV curve of FeP-CoP3 electrode (Fig. 3(h)). The excellent sustainability of FeP-CoP3 has been demonstrated through stability experiments (Fig. 3(f)). After HER testing, SEM and TEM techniques (Fig. S11) were conducted to examine the structural integrity of FeP-CoP3 and found no significant changes in its composition and structure, indicating that reconstruction of the surface of HER is not induced by electrolysis. Therefore, phosphides synthesized from MOF on MOF structure have excellent stability, which is also the main reason for the improving HER performance. 3.3 Electrocatalytic oxygen evolution performance The OER performance of the samples was also investigated. FeP-CoP3 electrode illustrates OER 239 mV (η50), indicating that it also has excellent OER performance (Fig. 4(a) ). Under alkaline medium conditions, the performance of FeP-CoP3 electrode is also superior to the majority of previously reported materials (Table S2 and Fig. 4(g)). As shown in Fig. 4(c), FeP-CoP3 shows lower values of 239 (η50), 263 (η100) and 275 mV (η150), compared to FeP (261, 285, and 298 mV) and CoP3 (267, 292, and 306 mV). Moreover, the FeP-CoP3 electrode shows the best Tafel slope (57.1 mV dec−1), which greatly improves its OER activity. The result indicates that phosphides based on MOF on MOF structure can effectively reduce the energy barrier of electron transfer and promote OER kinetics (Fig. 4(b)). From the CV curve, the FeP-CoP3 electrode (C dl = 15.62 mF cm−2) has better reversible activity than the FeP electrode (C dl = 13.27 mF cm−2). This phenomenon presents that the two coexisting phosphides have higher compatibility, and more active catalytic sites can be generated on the surface (Fig. 4(e) and S12). Detection of reaction kinetics was accomplished using EIS. Compared with other electrodes, the FeP-CoP3 catalyst illustrates significantly lower transfer resistance (R ct = 2 Ω) (Fig. 4(d)), showing that the MOF on MOF structure improves its charge transfer kinetics. In addition, the FeP-CoP3 electrode also has strong consistency in OER performance (Fig. 4(f)). Based on ESCA, the normalized specific activity of FeP-CoP3 is higher than that of FeP and CoP3 (Fig. 4(e) and S13), in the same condition, the TOF value of FeP-CoP3 is also higher than that of other materials (Fig. S14). These findings present that both OER ability and active sites improve with the increase of phosphides. After CV cycling, the current density of FeP-CoP3 catalyst did not significantly decrease (Fig. 4(h)), indicating its unique OER stability. 3.4 Overall water splitting performance Electrolytic cells with dual electrodes were assembled by selecting two identical FeP-CoP3 electrodes. The FeP-CoP3 electrode only requires 1.49 V (η10) to drive the entire water decomposition (Fig. 5(a) and S15). Compared to most reported materials used in alkaline media, this sample presents superior electrocatalytic performance (Table S2 and Fig. 5(d)). After continuous operation at 1.49 V for 40 h, the FeP-CoP3/GC electrode also demonstrates excellent stability with the current decreasing from 10 mA cm−2 to 9.4 mA cm−2 (Fig. 5(b)). During the testing process, the electrocatalytic activity of the electrode briefly declines, nevertheless when 1 mol L−1 NaCl solution is added, the activity eventually stabilizes in simulating seawater conditions. This discovery indicates that the electrode has a certain degree of anti-toxicity (Fig. S16). After achieving all tests, no obvious varieties are found in the XRD pattern (Fig. 5(c)), which further supports the stability of the material (Figs. S17 and S18). Faced to the stability of 94.2% in FeP-CoP3/GC electrode, the comparison samples CoP3 and FeP only achieve 80.5% and 71.6%, which further proves the excellent stability of the composite samples. By analyzing the XPS before and after the sample reaction (Figs. S19 and S20), it was found that the fundamental reason for its performance failure may be related to the surface oxidation of the material. Finally, compared with the reported bifunctional catalysts, the FeP-CoP3 electrode has excellent electrochemical performance in alkaline media (Table S2). 3.5 Electrocatalytic mechanism investigation To demonstrate the excellent electrocatalytic performance of FeP-CoP3 material, DFT calculations were performed. Prior to the calculation, the target sample and control sample were constructed and optimized (Figs. S21 and S22). Typically, ideal HER catalysts have the lowest |ΔG H| values [34,35]. In Fig. 6(a) , the DFT calculation results demonstrate that compared with the control sample, FeP-CoP3 has the lowest |ΔG H| energy (0.12 eV). By calculating and analyzing the adsorption free energies of OH*, OOH*, and O* in the basic process of the structure, DFT method was used to elucidate the potential Co and Fe active sites of the FeP-CoP3 model at different positions in the MOF on MOF structure (Fig. S23). The possibility of Co being the active site is higher for discrete units. The optimized geometric model of FeP-CoP3 for water oxidation process is shown in Fig. S24. Understanding the activity of the entire process in the OER mechanism can be accomplished objectively by utilizing the adsorption energy of intermediates produced from oxygen. It is worth noting that the adsorption capacity and energy barrier of OER intermediate conditions (ΔG) is in inverse proportion [36,37]. The process energy barriers of different materials under different U conditions are shown in Fig. 6. When compared to other materials, it is clear that FeP-CoP3 can successfully alter the four step G values. (Figs. 6(b) and 6(c)). When the applied potential is 1.49 V, the absorption capacity of O * and OH * increases, resulting in a decrease in the ΔG value of FeP-CoP3. The fourth process of CoP3 is the RDS, the conversion of OOH* to O2 has a more high energy barrier of 1.88 eV due to the poor affinity of OOH* intermediates for adsorption on Co sites. However, the RDS energy barrier of FeP-CoP3 decreases to 1.83 eV, demonstrating that the MOF on MOF structure significantly increases OOH* adsorption and lowers the energy threshold. According to all theoretical assessments, MOF on MOF structure can successfully lower the energy barrier for the production of intermediate states, increase OER activity, and improve mass transfer efficiency. These findings are in good agreement with the experimental results. To gain a deeper comprehension of the alterations in electron distribution at the interface between OER intermediates and Co sites throughout the whole OER process [38–40], it is necessary to explore the direction of OOH * electron transfer. Electrons are more likely to move from Fe and P to Co atoms when these two elements coordinate with Co because their electronegativity is lower than Co. The 3D charge density difference plot in Fig. 7(i) further supports this result, where the positive charge of the P atom indicates that Co and Fe can capture electrons during the OER process. More electrons will rise from the metal reaction sites when a MOF on MOF structure forms, drawing higher valence metal species as active sites and speeding up the O2 generation process. Meanwhile, some electrons transfer from metal atoms to the generated OOH*. The d-band centers of the comparative samples of FeP and CoP3, as well as the Fe and Co in the bimetallic phosphide FeP-CoP3, are shown in Figs. 7(a)–(d). It is worth noting that compared to a single phosphide FeP, a rightward vary of the d-band center of Fe atoms can be viewed when CoP3 is added. In the same situation, an obvious rightward shift of the d-band center of Co atoms can also be observed. This phenomenon also illustrates that the significant reaction rate of FeP-CoP3 is closely related to its upgraded adsorption affinity for intermediates. In the OER process, the external conditions of surface-active sites play a crucial role in promoting electron conversion and are largely influenced by their interaction with oxygen-containing intermediates σ the influence of keys. This bonding strength can be accurately analysis by integrating the projected density of states (PDOS) in FeP-CoP3, FeP, and CoP3 into the Fermi energy [39,41]. As is well known, the ƒ e value obtained by projecting the coordination unsaturated state is one of the key parameters for measuring OER activity. The calculated ƒ e values of Fe and Co in bimetallic phosphides FeP-CoP3 and metal atoms in single metal phosphides FeP and CoP3 are determined to be 2.19, 2.45, 4.03, and 4.65, respectively (Figs. 7(e)–(h)). The ultra-high ƒ e causes strong combining between the FeP-CoP3 and oxygen-containing intermediates, resulting in a decrease in catalytic performance. On the contrary, much lower ƒ e can lead to weaken binding, which is also detrimental to catalytic efficiency [41,42]. As a result, having a suitable ƒ e is a key role for improving the catalytic ability. Compared to single metal phosphides FeP and CoP3, bimetallic phosphides FeP-CoP3 exhibit superior catalytic performance (Figs. 7(e)–(h)). For deeper understanding the electrocatalytic mechanism of FeP-CoP3 and analyzing its excellent catalytic performance, corresponding DFT calculations (Figs. 6 and S24) were performed on the target catalyst and other comparison samples. The corresponding results clearly illustrate that Co2+ has more unfilled semi full orbitals compared to Fe3+, indicating a more active interaction between Co and OER intermediates in FeP-CoP3 species. Obviously, after adopting the MOF on MOF structure, the electrons that occupy the P 3p orbital tend to redistribute and accumulate around the Co atom, while there are fewer electrons around the P atom because Co has higher electronegativity, which leads to electron arrangement. It is possible for metal atoms to acquire high valence states due to this property. XPS results show more prominent orbital peaks for Co 2p 3/2 and 2p 1/2, which improves the overall water splitting efficiency. For gaining a deeper learning of the basic principle about metal phosphide center metal improving electrocatalytic performance and combine atomic orbital theory, the electronic configuration of transition metals was studied theoretically [43]. Due to the influence of electron distribution [43,44], the outer electrons of transition metals (Fe and Co) are composed of s-orbital electrons and d-orbital electrons. By visualizing the configuration (arranging the 3d and 4s orbitals in a planar petal shape), the electron distribution of the d orbitals of Fe and Co in transition metals is illustrated (Figs. 8(a) and (b) ), while the bimetallic phosphide FeP-CoP3 constructed based on MOF on MOF is in an ionic state in the reaction (Fig. 8(c)). It can be noted that according to the Hund rule and Pauli Exclusion Principle, the electrons in the outermost d-orbitals of Fe3+ and Co2+ are unpaired, which is more conducive to electron release. Further confirmation shows that compared to single metal phosphides FeP and CoP3, bimetallic phosphides FeP-CoP3 exhibit superior catalytic performance [45]. Experimental data, atomic orbital theory and DFT calculations jointly confirm that metal organic framework metal (MOF on MOF) derived materials exhibit significant heterojunction behavior with a concentration of more significant electron density [46]. This performance profoundly affects the electronic structure of FeP-CoP3, and is also an important manifestation of improving catalyst performance. Specifically, this modulation leads to the formation of coordination unsaturated Co and Fe atoms in the material matrix, which in turn become key sites for oxygen molecule capture, promoting energetically favorable synthesis of O–O bonds, which is a crucial step in OER. Subsequently, the released O* atoms were captured by Co atoms embedded in the FeP-CoP3 lattice [47,48]. By coordinating with adjacent Co atoms, the captured O* atoms exhibit active Co catalytic centers, especially in higher spin electron states. Bader charge analysis supplemented these findings, indicating that throughout the OER process, the Co catalytic center gradually transfers towards a higher oxidation state. The role played in selectively capturing OOH* intermediates from alkaline solutions is attributed to the presence of low-energy 3d orbitals that accommodate unpaired spin electrons. The complex interaction between electronic structure and catalytic behavior highlights the multifaceted properties of MOF on MOF derived materials, promoting the understanding and operation of electrochemical processes in sustainable energy applications. 4 Conclusions In summary, a strategy was proposed to construct two transition metal phosphides into one system (FeP-CoP3) through the MOF on MOF method and promote the activity of bimetallic phosphides. Experimental data, atomic orbital theory and DFT calculations all show that the heterojunction electron density generated by MOF on MOF method is more concentrated, which regulates the electronic structure of FeP-CoP3 and generates coordination unsaturated Co atoms and Fe atoms, thus creating oxygen atom trapping sites for FeP-CoP3 adsorption. FeP-CoP3 is energetically favorable for the binding of O–O bonds, and the dissociated O* atoms are captured by the Co atoms in FeP-CoP3. The captured O* atom coordinates with the surrounding Co atoms, forming a Co catalytic center in higher spin electron states. Bader charge analysis also reveals that the Co catalytic center is formed in a higher oxidation state throughout the entire OER process. Due to the low energy 3d orbitals with unpaired spin electrons, OOH* is captured from alkaline solution. Based on the oxygen atom capture effect, FeP-CoP3 just needs HER 81 mV (η10) overpotential and OER 239 mV (η50) overpotential. When FeP-CoP3 is used for the overall decomposition of water, it demonstrates excellent performance and stability, only requiring 1.49 V (η10) to achieve 10 mA cm−1 current density, and FeP-CoP3 sample presents higher activity under alkaline conditions and demonstrates superior activity among numerous reported catalysts. It is expected that MOF on MOF method can be well combined with other non-precious metal materials. This work provides a novel strategy for creation of cheaply viable bifunctional materials. Supporting Information Supporting information is available in the online version of this article. Conflicts of interest The authors declare no conflict of interest. Supplementary Material Supplementary appendix References 1 A. Wang L. Zhang X. Li Y. Gao N. Li G. Lu L. Ge Chin. J. Catal. 43 2022 1295 1305 A. Wang, L. Zhang, X. Li, Y. Gao, N. Li, G. Lu, L. Ge, Chin. J. Catal., 2022, 43, 1295–1305. 2 S. Li L. Wang H. Su A.N. Hong Y. Wang H. Yang L. Ge W. Song J. Liu T. Ma Adv. Funct. Mater. 32 2022 2200733 S. Li, L. Wang, H. Su, A. N. Hong, Y. Wang, H. Yang, L. Ge, W. Song, J. Liu, T. Ma, Adv. Funct. Mater., 2022, 32, 2200733. 3 X. Li N. Li Y. Gao L. Ge Chin. J. Catal. 43 2022 679 707 X. Li, N. Li, Y. Gao, L. Ge, Chin. J. Catal., 2022, 43, 679–707. 4 J. Jiang F. Li H. Su Y. Gao N. Li L. Ge Chin. Chem. Lett. 33 2022 4367 4374 J. Jiang, F. Li, H. Su, Y. Gao, N. Li, L. Ge, Chin. Chem. Lett., 2022, 33, 4367–4374. 5 X. Li Y. Gao N. Li L. Ge Int. J. Hydrogen Energy 47 2022 27961 27972 X. Li, Y. Gao, N. Li, L. Ge, Int. J. Hydrogen Energy, 2022, 47, 27961–27972. 6 L. Zhang F. Zhang H. Xue J. Gao L. Ge Chin. J. Catal. 42 2021 1677 1688 L. Zhang, F. Zhang, H. Xue, J. Gao, L. Ge, Chin. J. Catal., 2021, 42, 1677–1688. 7 X. Li S. Song Y. Gao L. Ge W. Song T. Ma J. Liu Small 17 2021 2101315 X. Li, S. Song, Y. Gao, L. Ge, W. Song, T. Ma, J. Liu, Small, 2021, 17, 2101315. 8 S. Li Y. Gao N. Li L. Ge X. Bu P. Feng Energy Environ. Sci. 14 2021 1897 1927 S. Li, Y. Gao, N. Li, L. Ge, X. Bu, P. Feng, Energy Environ. Sci., 2021, 14, 1897–1927. 9 N. Suen S. Hung Q. Quan N. Zhang Y. Xu H. Chen Chem. Soc. Rev. 46 2017 337 365 N. Suen, S. Hung, Q. Quan, N. Zhang, Y. Xu, H. Chen, Chem. Soc. Rev., 2017, 46, 337–365. 10 H. Su J. Jiang S. Song B. An N. Li Y. Gao L. Ge Chin. J. Catal. 44 2023 7 49 H. Su, J. Jiang, S. Song, B. An, N. Li, Y. Gao, L. Ge, Chin. J. Catal., 2023, 44, 7–49. 11 V. Baglio A.D. Blasi T. Denaro V. Antonucci L.G. Arriaga J. New Mater. Electrochem. Syst. 11 2008 105 108 V. Baglio, A. D. Blasi, T. Denaro, V. Antonucci, L. G. Arriaga, J. New Mater. Electrochem. Syst., 2008, 11, 105–108. 12 S. Dresp F. Dionigi M. Klingenhof P. Strasser ACS Energy Lett. 4 2019 933 942 S. Dresp, F. Dionigi, M. Klingenhof, P. Strasser, ACS Energy Lett., 2019, 4, 933–942. 13 P. Yu F. Wang T.A. Shifa X. Zhan X. Lou F. Xia J. He Nano Energy 58 2019 244 276 P. Yu, F. Wang, T. A. Shifa, X. Zhan, X. Lou, F. Xia, J. He, Nano Energy, 2019, 58, 244–276. 14 H. Du R.M. Kong X. Guo F. Qu J. Li Nanoscale 10 2018 21617 21624 H. Du, R. M. Kong, X. Guo, F. Qu, J. Li, Nanoscale, 2018, 10, 21617–21624. 15 M. Browne S. Stafford M. O'Brien H. Nolan N. Berner G. Duesberg P. Colavita M. Lyons J. Mater. Chem. A 4 2016 11397 11407 M. Browne, S. Stafford, M. O'Brien, H. Nolan, N. Berner, G. Duesberg, P. Colavita, M. Lyons, J. Mater. Chem. A, 2016, 4, 11397–11407. 16 L. Kumar B. Antil A. Kumar M. Das O. López-Estrada ACS Appl. Mater. Interfaces 15 2023 54446 54457 L. Kumar, B. Antil, A. Kumar, M. Das, O. López-Estrada, ACS Appl. Mater. Interfaces, 2023, 15, 54446–54457. 17 D. Zhang Y. Shi X. Chen J. Lai B. Huang L. Wang Chin. J. Catal. 45 2023 174 183 D. Zhang, Y. Shi, X. Chen, J. Lai, B. Huang, L. Wang, Chin. J. Catal., 2023, 45, 174–183. 18 B. An J. Li X. Wu W. Li Y. Li L. Sun H. Mi Q. Zhang C. He X. Ren Nanoscale 12 2020 21770 21779 B. An, J. Li, X. Wu, W. Li, Y. Li, L. Sun, H. Mi, Q. Zhang, C. He, X. Ren, Nanoscale, 2020, 12, 21770–21779. 19 B. An R. Bian J. Dong W. Liu H. Su N. Li Y. Gao L. Ge Chem. Eng. J. 485 2024 149903 B. An, R. Bian, J. Dong, W. Liu, H. Su, N. Li, Y. Gao, L. Ge, Chem. Eng. J., 2024, 485, 149903. 20 B. An J. Dong H. Su W. Liu N. Li Y. Gao L. Ge Int. J. Hydrogen Energy 51 2024 292 302 B. An, J. Dong, H. Su, W. Liu, N. Li, Y. Gao, L. Ge, Int. J. Hydrogen Energy, 2024, 51, 292–302. 21 L. Fu J. Zhou Z. Zhou B. Xiao N. Khaorapapong Y. Kang K. Wu Y. Yamauchi ACS Nano 17 2023 22744 22754 L. Fu, J. Zhou, Z. Zhou, B. Xiao, N. Khaorapapong, Y. Kang, K. Wu, Y. Yamauchi, ACS Nano, 2023, 17, 22744–22754. 22 Y. Jiang T.Y. Chen J.L. Chen Y. Liu X. Yuan J. Yan Q. Sun Z. Xu D. Zhang X. Wang C. Meng X. Guo L. Ren L. Liu R.Y. Lin Adv. Mater. 36 2024 2306910 Y. Jiang, T. Y. Chen, J. L. Chen, Y. Liu, X. Yuan, J. Yan, Q. Sun, Z. Xu, D. Zhang, X. Wang, C. Meng, X. Guo, L. Ren, L. Liu, R. Y. Lin, Adv. Mater., 2024, 36, 2306910. 23 J. Zhou C. Huang Q. Zhou Y. Xie L. Yang L. Yu Y. Yu Inorg. Chem. 61 2022 9318 9327 J. Zhou, C. Huang, Q. Zhou, Y. Xie, L. Yang, L. Yu, Y. Yu, Inorg. Chem., 2022, 61, 9318–9327. 24 H. Wang W. Zhan H. Yu S. Jiang B. Wang K. Deng Z. Wang Y. Xu L. Wang Mater. Today Phys. 37 2023 101192 H. Wang, W. Zhan, H. Yu, S. Jiang, B. Wang, K. Deng, Z. Wang, Y. Xu, L. Wang, Mater. Today Phys., 2023, 37, 101192. 25 P. Kuang Z. Ni B. Zhu Y. Lin J. Yu Adv. Mater. 35 2023 2303030 P. Kuang, Z. Ni, B. Zhu, Y. Lin, J. Yu, Adv. Mater., 2023, 35, 2303030. 26 M. Cong D. Sun L. Zhang X. Ding Chin. J. Catal. 41 2020 242 248 M. Cong, D. Sun, L. Zhang, X. Ding, Chin. J. Catal., 2020, 41, 242–248. 27 J. Moulder W. Stickle P. Sobol K.D. Bomben Chem. Phys. Lett. 1 1995 44 45 J. Moulder, W. Stickle, P. Sobol, K. D. Bomben, Chem. Phys. Lett., 1995, 1, 44–45. 28 Y. Sun K. Lai N. Li Y. Gao L. Ge Appl. Catal. B 357 2024 124302 Y. Sun, K. Lai, N. Li, Y. Gao, L. Ge, Appl. Catal. B, 2024, 357, 124302. 29 J. Gu L. Sun Y. Zhang Q. Zhang X. Li H. Si Y. Shi C. Sun Y. Gong Y. Zhang Chem. Eng. J. 385 2020 123454 J. Gu, L. Sun, Y. Zhang, Q. Zhang, X. Li, H. Si, Y. Shi, C. Sun, Y. Gong, Y. Zhang, Chem. Eng. J., 2020, 385, 123454. 30 M. Pi T. Wu D. Zhang S. Chen S. Wang Nanoscale 8 2016 19779 19786 M. Pi, T. Wu, D. Zhang, S. Chen, S. Wang, Nanoscale, 2016, 8, 19779–19786. 31 Y.Z. Zhang Y. Wang Y.L. Xie T. Cheng W.Y. Lai H. Pang W. Huang Nanoscale 6 2014 14354 14359 Y. Z. Zhang, Y. Wang, Y. L. Xie, T. Cheng, W. Y. Lai, H. Pang, W. Huang, Nanoscale, 2014, 6, 14354–14359. 32 J. Li F. Dou J. Gong Y. Gao Y. Hua K. Sielicki D. Zhang E. Mijowska X. Chen ACS Appl. Nano Mater. 6 2023 1171 1180 J. Li, F. Dou, J. Gong, Y. Gao, Y. Hua, K. Sielicki, D. Zhang, E. Mijowska, X. Chen, ACS Appl. Nano Mater., 2023, 6, 1171–1180. 33 B. You N. Jiang M. Sheng M.W. Bhushan Y. Sun ACS Catal. 6 2016 714 721 B. You, N. Jiang, M. Sheng, M. W. Bhushan, Y. Sun, ACS Catal., 2016, 6, 714–721. 34 S. Na X. Han C. Cheng X. He Z. Dou Z. Lin L. Cui J. Xiang Electrochim. Acta 333 2024 135531 S. Na, X. Han, C. Cheng, X. He, Z. Dou, Z. Lin, L. Cui, J. Xiang, Electrochim. Acta, 2024, 333, 135531. 35 H. Roh H. Jung H. Choi J.W. Han K. Yong Appl. Catal. B 297 2021 120434 H. Roh, H. Jung, H. Choi, J. W. Han, K. Yong, Appl. Catal. B, 2021, 297, 120434. 36 N. Xue Z. Lin P. Li P. Diao Q. Zhang ACS Appl. Mater. Interfaces 12 2020 28288 28297 N. Xue, Z. Lin, P. Li, P. Diao, Q. Zhang, ACS Appl. Mater. Interfaces, 2020, 12, 28288–28297. 37 L. Xiong B. Wang H. Cai T. Yang L. Wang S.C. Yang J. Mater. Chem. A 8 2020 1184 1192 L. Xiong, B. Wang, H. Cai, T. Yang, L. Wang, S. C. Yang, J. Mater. Chem. A, 2020, 8, 1184–1192. 38 J. Chen L. Zhang J. Li X. He Y. Zheng S. Sun X. Fang D. Zheng Y. Luo Y. Wang J. Zhang L. Xie Z. Cai Y. Sun A. Alshehri Q. Kong C. Tang X. Sun J. Mater. Chem. A 11 2023 1116 1122 J. Chen, L. Zhang, J. Li, X. He, Y. Zheng, S. Sun, X. Fang, D. Zheng, Y. Luo, Y. Wang, J. Zhang, L. Xie, Z. Cai, Y. Sun, A. Alshehri, Q. Kong, C. Tang, X. Sun, J. Mater. Chem. A, 2023, 11, 1116–1122. 39 L. Li L. Zhang L. Gou S. Wei X. Hou L. Wu Chem. Eng. J. 454 2023 140292 L. Li, L. Zhang, L. Gou, S. Wei, X. Hou, L. Wu, Chem. Eng. J., 2023, 454, 140292. 40 F. Zhou Y. Zhou G.G. Liu C.T. Wang J. Wang Rare Metals 40 2021 31 38 F. Zhou, Y. Zhou, G. G. Liu, C. T. Wang, J. Wang, Rare Metals, 2021, 40, 31–38. 41 F. Sun G. Wang Y. Ding C. Wang B. Yuan Y. Lin Adv. Energy Mater. 8 2018 1800584 F. Sun, G. Wang, Y. Ding, C. Wang, B. Yuan, Y. Lin, Adv. Energy Mater., 2018, 8, 1800584 42 K. Nath K. Bhunia D. Pradhan K. Biradha Nanoscale Adv. 1 2019 2293 2302 K. Nath, K. Bhunia, D. Pradhan, K. Biradha, Nanoscale Adv., 2019, 1, 2293–2302. 43 W. Liu J. Dong B. An H. Su Z. Teng N. Li Y. Gao L. Ge J. Colloid Interface Sci. 673 2024 228 238 W. Liu, J. Dong, B. An, H. Su, Z. Teng, N. Li, Y Gao, L. Ge, J. Colloid Interface Sci., 2024, 673, 228–238. 44 R. Su Y. Gao L. Chen Y. Chen N. Li W. Liu B. Gao Q. Li Proc. Natl. Acad. Sci. U. S. A. 121 2024 e2319427121 R. Su, Y. Gao, L. Chen, Y. Chen, N. Li, W. Liu, B. Gao, Q. Li, Proc. Natl. Acad. Sci. U. S. A., 2024, 121, e2319427121. 45 J. Wang Y.-C. Huang Y. Wang H. Deng Y. Shi D. Wei M. Li C.-L. Dong H. Jin S.S. Mao S. Shen ACS Catal. 13 2023 2374 2385 J. Wang, Y.-C. Huang, Y. Wang, H. Deng, Y. Shi, D. Wei, M. Li, C.-L. Dong, H. Jin, S. S. Mao, S. Shen, ACS Catal., 2023, 13, 2374–2385. 46 H. Su J. Jiang N. Li Y. Gao L. Ge Chem. Eng. J. 446 2022 137226 H. Su, J. Jiang, N. Li, Y. Gao, L. Ge, Chem. Eng. J., 2022, 446, 137226. 47 Y. Gao Y. Li G. Yang S. Li N. Xiao B. Xu S. Liu P. Qiu S. Hao L. Ge ACS Appl. Mater. Interfaces 10 2018 39713 39722 Y. Gao, Y. Li, G. Yang, S. Li, N. Xiao, B. Xu, S. Liu, P. Qiu, S. Hao, L. Ge, ACS Appl. Mater. Interfaces, 2018, 10, 39713–39722. 48 Y. Gao G. Yang Y. Dai X. Li J. Gao N. Li P. Qiu L. Ge ACS Appl. Mater. Interfaces 12 2020 17364 17375 Y. Gao, G. Yang, Y. Dai, X. Li, J. Gao, N. Li, P. Qiu, L. Ge, ACS Appl. Mater. Interfaces, 2020, 12, 17364–17375.",
      "scopus-id": "85207078099",
      "coredata": {
        "eid": "1-s2.0-S1872206724601245",
        "dc:description": "The electronic modulation characteristics of efficient metal phosphide electrocatalysts can be utilized to tune the performance of oxygen evolution reaction (OER). However, improving the overall water splitting performance remains a challenging task. By building metal organic framework (MOF) on MOF heterostructures, an efficient strategy for controlling the electrical structure of MOFs was presented in this study. ZIF-67 was in-situ synthesized on MIL-88 (Fe) using a two-step self-assembly method, followed by low-temperature phosphorization to ultimately synthesize FeP-CoP3 bimetallic phosphides. By combining atomic orbital theory and theoretical calculations (density functional theory), the results reveal the successful modulation of electronic orbitals in FeP-CoP3 bimetallic phosphides, which are synthesized from MOF on MOF structure. The synergistic impact of the metal center Co species and the phase conjugation of both kinds of MOFs are responsible for this regulatory phenomenon. Therefore, the catalyst demonstrates excellent properties, demonstrating HER 81 mV (η10) in a 1.0 mol L−1 KOH solution and OER 239 mV (η50) low overpotentials. The FeP-CoP3 linked dual electrode alkaline batteries, which are bifunctional electrocatalysts, have a good electrocatalytic ability and may last for 50 h. They require just 1.49 V (η50) for total water breakdown. Through this technique, the electrical structure of electrocatalysts may be altered to increase catalytic activity.",
        "openArchiveArticle": "false",
        "prism:coverDate": "2024-10-31",
        "openaccessUserLicense": null,
        "prism:aggregationType": "Journal",
        "prism:url": "https://api.elsevier.com/content/article/pii/S1872206724601245",
        "dc:creator": [
          {
            "@_fa": "true",
            "$": "An, Bohan"
          },
          {
            "@_fa": "true",
            "$": "Liu, Weilong"
          },
          {
            "@_fa": "true",
            "$": "Dong, Jipeng"
          },
          {
            "@_fa": "true",
            "$": "Li, Ning"
          },
          {
            "@_fa": "true",
            "$": "Gao, Yangqin"
          },
          {
            "@_fa": "true",
            "$": "Ge, Lei"
          }
        ],
        "link": [
          {
            "@_fa": "true",
            "@rel": "self",
            "@href": "https://api.elsevier.com/content/article/pii/S1872206724601245"
          },
          {
            "@_fa": "true",
            "@rel": "scidir",
            "@href": "https://www.sciencedirect.com/science/article/pii/S1872206724601245"
          }
        ],
        "dc:format": "application/json",
        "openaccessType": null,
        "pii": "S1872-2067(24)60124-5",
        "prism:volume": "65",
        "prism:publisher": "Dalian Institute of Chemical Physics, the Chinese Academy of Sciences. Published by Elsevier B.V. All rights are reserved, including those for text and data mining, AI training, and similar technologies.",
        "dc:title": "Atomic orbitals modulated dual functional bimetallic phosphides derived from MOF on MOF structure for boosting high efficient overall water splitting",
        "prism:copyright": "Copyright © 2024 Dalian Institute of Chemical Physics, the Chinese Academy of Sciences. Published by Elsevier B.V. All rights are reserved, including those for text and data mining, AI training, and similar technologies.",
        "openaccess": "0",
        "prism:issn": "18722067",
        "dcterms:subject": [
          {
            "@_fa": "true",
            "$": "Transition metal phosphides"
          },
          {
            "@_fa": "true",
            "$": "MOF on MOF"
          },
          {
            "@_fa": "true",
            "$": "Atomic orbital theory"
          },
          {
            "@_fa": "true",
            "$": "Density functional theory calculation"
          }
        ],
        "openaccessArticle": "false",
        "prism:publicationName": "Chinese Journal of Catalysis",
        "openaccessSponsorType": null,
        "prism:pageRange": "113-125",
        "prism:endingPage": "125",
        "pubType": "fla",
        "prism:coverDisplayDate": "October 2024",
        "prism:doi": "10.1016/S1872-2067(24)60124-5",
        "prism:startingPage": "113",
        "dc:identifier": "doi:10.1016/S1872-2067(24)60124-5",
        "openaccessSponsorName": null
      },
      "objects": {
        "object": [
          {
            "@category": "standard",
            "@height": "245",
            "@width": "245",
            "@_fa": "true",
            "$": "https://api.elsevier.com/content/object/eid/1-s2.0-S1872206724601245-fx1.jpg?httpAccept=%2A%2F%2A",
            "@multimediatype": "JPEG image file",
            "@type": "IMAGE-DOWNSAMPLED",
            "@size": "43656",
            "@ref": "fx1",
            "@mimetype": "image/jpeg"
          },
          {
            "@category": "standard",
            "@height": "303",
            "@width": "371",
            "@_fa": "true",
            "$": "https://api.elsevier.com/content/object/eid/1-s2.0-S1872206724601245-gr1.jpg?httpAccept=%2A%2F%2A",
            "@multimediatype": "JPEG image file",
            "@type": "IMAGE-DOWNSAMPLED",
            "@size": "55363",
            "@ref": "gr1",
            "@mimetype": "image/jpeg"
          },
          {
            "@category": "standard",
            "@height": "671",
            "@width": "738",
            "@_fa": "true",
            "$": "https://api.elsevier.com/content/object/eid/1-s2.0-S1872206724601245-gr2.jpg?httpAccept=%2A%2F%2A",
            "@multimediatype": "JPEG image file",
            "@type": "IMAGE-DOWNSAMPLED",
            "@size": "177360",
            "@ref": "gr2",
            "@mimetype": "image/jpeg"
          },
          {
            "@category": "standard",
            "@height": "547",
            "@width": "736",
            "@_fa": "true",
            "$": "https://api.elsevier.com/content/object/eid/1-s2.0-S1872206724601245-gr3.jpg?httpAccept=%2A%2F%2A",
            "@multimediatype": "JPEG image file",
            "@type": "IMAGE-DOWNSAMPLED",
            "@size": "114848",
            "@ref": "gr3",
            "@mimetype": "image/jpeg"
          },
          {
            "@category": "standard",
            "@height": "569",
            "@width": "750",
            "@_fa": "true",
            "$": "https://api.elsevier.com/content/object/eid/1-s2.0-S1872206724601245-gr4.jpg?httpAccept=%2A%2F%2A",
            "@multimediatype": "JPEG image file",
            "@type": "IMAGE-DOWNSAMPLED",
            "@size": "115762",
            "@ref": "gr4",
            "@mimetype": "image/jpeg"
          },
          {
            "@category": "standard",
            "@height": "392",
            "@width": "528",
            "@_fa": "true",
            "$": "https://api.elsevier.com/content/object/eid/1-s2.0-S1872206724601245-gr5.jpg?httpAccept=%2A%2F%2A",
            "@multimediatype": "JPEG image file",
            "@type": "IMAGE-DOWNSAMPLED",
            "@size": "62977",
            "@ref": "gr5",
            "@mimetype": "image/jpeg"
          },
          {
            "@category": "standard",
            "@height": "437",
            "@width": "690",
            "@_fa": "true",
            "$": "https://api.elsevier.com/content/object/eid/1-s2.0-S1872206724601245-gr6.jpg?httpAccept=%2A%2F%2A",
            "@multimediatype": "JPEG image file",
            "@type": "IMAGE-DOWNSAMPLED",
            "@size": "88269",
            "@ref": "gr6",
            "@mimetype": "image/jpeg"
          },
          {
            "@category": "standard",
            "@height": "485",
            "@width": "730",
            "@_fa": "true",
            "$": "https://api.elsevier.com/content/object/eid/1-s2.0-S1872206724601245-gr7.jpg?httpAccept=%2A%2F%2A",
            "@multimediatype": "JPEG image file",
            "@type": "IMAGE-DOWNSAMPLED",
            "@size": "148376",
            "@ref": "gr7",
            "@mimetype": "image/jpeg"
          },
          {
            "@category": "standard",
            "@height": "512",
            "@width": "521",
            "@_fa": "true",
            "$": "https://api.elsevier.com/content/object/eid/1-s2.0-S1872206724601245-gr8.jpg?httpAccept=%2A%2F%2A",
            "@multimediatype": "JPEG image file",
            "@type": "IMAGE-DOWNSAMPLED",
            "@size": "90983",
            "@ref": "gr8",
            "@mimetype": "image/jpeg"
          },
          {
            "@category": "thumbnail",
            "@height": "164",
            "@width": "164",
            "@_fa": "true",
            "$": "https://api.elsevier.com/content/object/eid/1-s2.0-S1872206724601245-fx1.sml?httpAccept=%2A%2F%2A",
            "@multimediatype": "GIF image file",
            "@type": "IMAGE-THUMBNAIL",
            "@size": "24813",
            "@ref": "fx1",
            "@mimetype": "image/gif"
          },
          {
            "@category": "thumbnail",
            "@height": "164",
            "@width": "201",
            "@_fa": "true",
            "$": "https://api.elsevier.com/content/object/eid/1-s2.0-S1872206724601245-gr1.sml?httpAccept=%2A%2F%2A",
            "@multimediatype": "GIF image file",
            "@type": "IMAGE-THUMBNAIL",
            "@size": "26883",
            "@ref": "gr1",
            "@mimetype": "image/gif"
          },
          {
            "@category": "thumbnail",
            "@height": "164",
            "@width": "180",
            "@_fa": "true",
            "$": "https://api.elsevier.com/content/object/eid/1-s2.0-S1872206724601245-gr2.sml?httpAccept=%2A%2F%2A",
            "@multimediatype": "GIF image file",
            "@type": "IMAGE-THUMBNAIL",
            "@size": "13865",
            "@ref": "gr2",
            "@mimetype": "image/gif"
          },
          {
            "@category": "thumbnail",
            "@height": "163",
            "@width": "219",
            "@_fa": "true",
            "$": "https://api.elsevier.com/content/object/eid/1-s2.0-S1872206724601245-gr3.sml?httpAccept=%2A%2F%2A",
            "@multimediatype": "GIF image file",
            "@type": "IMAGE-THUMBNAIL",
            "@size": "13097",
            "@ref": "gr3",
            "@mimetype": "image/gif"
          },
          {
            "@category": "thumbnail",
            "@height": "164",
            "@width": "216",
            "@_fa": "true",
            "$": "https://api.elsevier.com/content/object/eid/1-s2.0-S1872206724601245-gr4.sml?httpAccept=%2A%2F%2A",
            "@multimediatype": "GIF image file",
            "@type": "IMAGE-THUMBNAIL",
            "@size": "12471",
            "@ref": "gr4",
            "@mimetype": "image/gif"
          },
          {
            "@category": "thumbnail",
            "@height": "162",
            "@width": "219",
            "@_fa": "true",
            "$": "https://api.elsevier.com/content/object/eid/1-s2.0-S1872206724601245-gr5.sml?httpAccept=%2A%2F%2A",
            "@multimediatype": "GIF image file",
            "@type": "IMAGE-THUMBNAIL",
            "@size": "11782",
            "@ref": "gr5",
            "@mimetype": "image/gif"
          },
          {
            "@category": "thumbnail",
            "@height": "139",
            "@width": "219",
            "@_fa": "true",
            "$": "https://api.elsevier.com/content/object/eid/1-s2.0-S1872206724601245-gr6.sml?httpAccept=%2A%2F%2A",
            "@multimediatype": "GIF image file",
            "@type": "IMAGE-THUMBNAIL",
            "@size": "10441",
            "@ref": "gr6",
            "@mimetype": "image/gif"
          },
          {
            "@category": "thumbnail",
            "@height": "145",
            "@width": "219",
            "@_fa": "true",
            "$": "https://api.elsevier.com/content/object/eid/1-s2.0-S1872206724601245-gr7.sml?httpAccept=%2A%2F%2A",
            "@multimediatype": "GIF image file",
            "@type": "IMAGE-THUMBNAIL",
            "@size": "16766",
            "@ref": "gr7",
            "@mimetype": "image/gif"
          },
          {
            "@category": "thumbnail",
            "@height": "164",
            "@width": "167",
            "@_fa": "true",
            "$": "https://api.elsevier.com/content/object/eid/1-s2.0-S1872206724601245-gr8.sml?httpAccept=%2A%2F%2A",
            "@multimediatype": "GIF image file",
            "@type": "IMAGE-THUMBNAIL",
            "@size": "11543",
            "@ref": "gr8",
            "@mimetype": "image/gif"
          },
          {
            "@category": "high",
            "@height": "651",
            "@width": "651",
            "@_fa": "true",
            "$": "https://api.elsevier.com/content/object/eid/1-s2.0-S1872206724601245-fx1_lrg.jpg?httpAccept=%2A%2F%2A",
            "@multimediatype": "JPEG image file",
            "@type": "IMAGE-HIGH-RES",
            "@size": "222319",
            "@ref": "fx1",
            "@mimetype": "image/jpeg"
          },
          {
            "@category": "high",
            "@height": "804",
            "@width": "985",
            "@_fa": "true",
            "$": "https://api.elsevier.com/content/object/eid/1-s2.0-S1872206724601245-gr1_lrg.jpg?httpAccept=%2A%2F%2A",
            "@multimediatype": "JPEG image file",
            "@type": "IMAGE-HIGH-RES",
            "@size": "364130",
            "@ref": "gr1",
            "@mimetype": "image/jpeg"
          },
          {
            "@category": "high",
            "@height": "1784",
            "@width": "1961",
            "@_fa": "true",
            "$": "https://api.elsevier.com/content/object/eid/1-s2.0-S1872206724601245-gr2_lrg.jpg?httpAccept=%2A%2F%2A",
            "@multimediatype": "JPEG image file",
            "@type": "IMAGE-HIGH-RES",
            "@size": "688943",
            "@ref": "gr2",
            "@mimetype": "image/jpeg"
          },
          {
            "@category": "high",
            "@height": "1453",
            "@width": "1954",
            "@_fa": "true",
            "$": "https://api.elsevier.com/content/object/eid/1-s2.0-S1872206724601245-gr3_lrg.jpg?httpAccept=%2A%2F%2A",
            "@multimediatype": "JPEG image file",
            "@type": "IMAGE-HIGH-RES",
            "@size": "467674",
            "@ref": "gr3",
            "@mimetype": "image/jpeg"
          },
          {
            "@category": "high",
            "@height": "1513",
            "@width": "1993",
            "@_fa": "true",
            "$": "https://api.elsevier.com/content/object/eid/1-s2.0-S1872206724601245-gr4_lrg.jpg?httpAccept=%2A%2F%2A",
            "@multimediatype": "JPEG image file",
            "@type": "IMAGE-HIGH-RES",
            "@size": "474709",
            "@ref": "gr4",
            "@mimetype": "image/jpeg"
          },
          {
            "@category": "high",
            "@height": "1040",
            "@width": "1402",
            "@_fa": "true",
            "$": "https://api.elsevier.com/content/object/eid/1-s2.0-S1872206724601245-gr5_lrg.jpg?httpAccept=%2A%2F%2A",
            "@multimediatype": "JPEG image file",
            "@type": "IMAGE-HIGH-RES",
            "@size": "279195",
            "@ref": "gr5",
            "@mimetype": "image/jpeg"
          },
          {
            "@category": "high",
            "@height": "1160",
            "@width": "1832",
            "@_fa": "true",
            "$": "https://api.elsevier.com/content/object/eid/1-s2.0-S1872206724601245-gr6_lrg.jpg?httpAccept=%2A%2F%2A",
            "@multimediatype": "JPEG image file",
            "@type": "IMAGE-HIGH-RES",
            "@size": "357059",
            "@ref": "gr6",
            "@mimetype": "image/jpeg"
          },
          {
            "@category": "high",
            "@height": "1288",
            "@width": "1939",
            "@_fa": "true",
            "$": "https://api.elsevier.com/content/object/eid/1-s2.0-S1872206724601245-gr7_lrg.jpg?httpAccept=%2A%2F%2A",
            "@multimediatype": "JPEG image file",
            "@type": "IMAGE-HIGH-RES",
            "@size": "637156",
            "@ref": "gr7",
            "@mimetype": "image/jpeg"
          },
          {
            "@category": "high",
            "@height": "1361",
            "@width": "1384",
            "@_fa": "true",
            "$": "https://api.elsevier.com/content/object/eid/1-s2.0-S1872206724601245-gr8_lrg.jpg?httpAccept=%2A%2F%2A",
            "@multimediatype": "JPEG image file",
            "@type": "IMAGE-HIGH-RES",
            "@size": "328266",
            "@ref": "gr8",
            "@mimetype": "image/jpeg"
          },
          {
            "@category": "standard",
            "@_fa": "true",
            "$": "https://api.elsevier.com/content/object/eid/1-s2.0-S1872206724601245-mmc1.pdf?httpAccept=%2A%2F%2A",
            "@multimediatype": "Acrobat PDF file",
            "@type": "APPLICATION",
            "@size": "5304527",
            "@ref": "mmc1",
            "@mimetype": "application/pdf"
          }
        ]
      },
      "link": {
        "@rel": "abstract",
        "@href": "https://api.elsevier.com/content/abstract/scopus_id/85207078099"
      }
    }
  }
}