{
  "metadata": {
    "title": "Effect of gas diffusion electrode parameters on anion exchange membrane fuel cell performance",
    "authors": "; ; ",
    "journal": "Chinese Journal of Catalysis",
    "date": "2014-07-31",
    "doi": "10.1016/S1872-2067(14)60050-4",
    "abstract": "",
    "uri": "https://api.elsevier.com/content/article/pii/S1872206714600504",
    "pii": "S1872206714600504"
  },
  "fulltext": {
    "full-text-retrieval-response": {
      "scopus-eid": "2-s2.0-84903949033",
      "originalText": "serial JL 273538 291210 291744 291809 31 Chinese Journal of Catalysis CHINESEJOURNALCATALYSIS 2014-07-08 2014-07-08 2014-07-08T01:16:39 1-s2.0-S1872206714600504 S1872-2067(14)60050-4 S1872206714600504 10.1016/S1872-2067(14)60050-4 S300 S300.1 FULL-TEXT 1-s2.0-S1872206714X00070 2015-05-15T07:14:43.50131-04:00 0 0 20140701 20140731 2014 2014-07-08T00:00:00Z absattachment articleinfo articletitlenorm authfirstinitialnorm authfirstsurnamenorm cid cids contenttype copyright crossmark dateloaded dateloadedtxt datesearch datesort dateupdated dco docsubtype doctype doi eid ewtransactionid hubeid indexeddate issfirst issn issnnorm issuelist itemstage itemtransactionid itemweight openaccess openarchive pg pgfirst pglast pii piinorm pubdateend pubdatestart pubdatetxt pubyr sortorder srctitle srctitlenorm srctype subheadings tomb volfirst volissue volumelist webpdf webpdfpagecount yearnav figure table body mmlmath affil articletitle auth authfirstini authfull authkeywords authlast primabst pubtype ref specialabst alllist content subj ssids 1872-2067 18722067 false 35 35 7 7 Volume 35, Issue 7 16 1091 1097 1091 1097 201407 July 2014 2014-07-01 2014-07-31 2014 article fla Copyright © 2014 Dalian Institute of Chemical Physics, the Chinese Academy of Sciences. Published by Elsevier B.V. All rights reserved. EFFECTGASDIFFUSIONELECTRODEPARAMETERSANIONEXCHANGEMEMBRANEFUELCELLPERFORMANCE YANG D 1 Introduction 2 Experimental 2.1 MEA fabrication 2.2 Characterization of CL microstructure 2.3 Single cell tests 3 Results and discussion 3.1 Effect of PTFE content on single cell performance 3.2 Effect of Pt loading on single cell performance 3.3 Electrode reaction kinetics analysis 4 Conclusions References WANG 2013 5768 Y VARCOE 2005 187 J MATSUMOTO 2011 1089 K MERLE 2011 1 G BIDAULT 2009 39 F PAN 2012 473 J TAMAIN 2007 18423 C ARGES 2012 3733 C POYNTON 2012 2067 S DEAVIN 2012 8584 O LIU 2012 1842 L XU 2011 192 T ZHU 2013 575 R KIM 2010 8707 J BUNAZAWA 2008 48 H KIM 2011 3085 H HAYASHI 2004 A354 K HUANG 2003 329 N MARINI 2013 11496 S MILLINGTON 2011 9013 B KIM 2011 4684 Y KUBO 2013 493 D UNLU 2011 4439 M LU 2008 20611 S YAN 2013 1471 Z ZHANG 2012 222 H VARCOE 2006 21041 J MAMLOUK 2011 7191 M KIM 1995 2670 J SQUADRITO 1999 1449 G CARMO 2013 169 M YANGX2014X1091 YANGX2014X1091X1097 YANGX2014X1091XD YANGX2014X1091X1097XD item S1872-2067(14)60050-4 S1872206714600504 1-s2.0-S1872206714600504 10.1016/S1872-2067(14)60050-4 273538 2014-07-08T01:18:44.891644-04:00 2014-07-01 2014-07-31 1-s2.0-S1872206714600504-main.pdf https://s3.amazonaws.com/prod-ucs-content-store-us-east/content/pii:S1872206714600504/MAIN/application/pdf/7e127ef64db8962484c0832c684213a0/main.pdf https://s3-eu-west-1.amazonaws.com/prod-ucs-content-store-eu-west/content/pii:S1872206714600504/MAIN/application/pdf/7e127ef64db8962484c0832c684213a0/main.pdf main.pdf pdf true 1141196 MAIN 6 1-s2.0-S1872206714600504-main_1.png https://s3.amazonaws.com/prod-ucs-content-store-us-east/content/pii:S1872206714600504/PREVIEW/image/png/225979f0cfeb88f6004159404342ae46/main_1.png https://s3-eu-west-1.amazonaws.com/prod-ucs-content-store-eu-west/content/pii:S1872206714600504/PREVIEW/image/png/225979f0cfeb88f6004159404342ae46/main_1.png main_1.png png 52412 849 656 IMAGE-WEB-PDF 1 1-s2.0-S1872206714600504-si2.gif https://s3.amazonaws.com/prod-ucs-content-store-us-east/content/pii:S1872206714600504/STRIPIN/image/gif/899da979b12a764b89a0c868c0bd8f6b/si2.gif https://s3-eu-west-1.amazonaws.com/prod-ucs-content-store-eu-west/content/pii:S1872206714600504/STRIPIN/image/gif/899da979b12a764b89a0c868c0bd8f6b/si2.gif si2 si2.gif gif 271 16 123 ALTIMG 1-s2.0-S1872206714600504-si1.gif https://s3.amazonaws.com/prod-ucs-content-store-us-east/content/pii:S1872206714600504/STRIPIN/image/gif/1b4271baedbb648f9a8c671a94c7611b/si1.gif https://s3-eu-west-1.amazonaws.com/prod-ucs-content-store-eu-west/content/pii:S1872206714600504/STRIPIN/image/gif/1b4271baedbb648f9a8c671a94c7611b/si1.gif si1 si1.gif gif 283 16 142 ALTIMG 1-s2.0-S1872206714600504-gr9.jpg https://s3.amazonaws.com/prod-ucs-content-store-us-east/content/pii:S1872206714600504/gr9/DOWNSAMPLED/image/jpeg/95116db90ce53ad999737d428b910077/gr9.jpg https://s3-eu-west-1.amazonaws.com/prod-ucs-content-store-eu-west/content/pii:S1872206714600504/gr9/DOWNSAMPLED/image/jpeg/95116db90ce53ad999737d428b910077/gr9.jpg gr9 gr9.jpg jpg 16939 212 343 IMAGE-DOWNSAMPLED 1-s2.0-S1872206714600504-gr8.jpg https://s3.amazonaws.com/prod-ucs-content-store-us-east/content/pii:S1872206714600504/gr8/DOWNSAMPLED/image/jpeg/6aa611dde1048bb07f3365366db79ad7/gr8.jpg https://s3-eu-west-1.amazonaws.com/prod-ucs-content-store-eu-west/content/pii:S1872206714600504/gr8/DOWNSAMPLED/image/jpeg/6aa611dde1048bb07f3365366db79ad7/gr8.jpg gr8 gr8.jpg jpg 16736 223 354 IMAGE-DOWNSAMPLED 1-s2.0-S1872206714600504-gr7.jpg https://s3.amazonaws.com/prod-ucs-content-store-us-east/content/pii:S1872206714600504/gr7/DOWNSAMPLED/image/jpeg/7265c41eb67d7475b51d37b9dc46ecfa/gr7.jpg https://s3-eu-west-1.amazonaws.com/prod-ucs-content-store-eu-west/content/pii:S1872206714600504/gr7/DOWNSAMPLED/image/jpeg/7265c41eb67d7475b51d37b9dc46ecfa/gr7.jpg gr7 gr7.jpg jpg 16878 205 344 IMAGE-DOWNSAMPLED 1-s2.0-S1872206714600504-gr6.jpg https://s3.amazonaws.com/prod-ucs-content-store-us-east/content/pii:S1872206714600504/gr6/DOWNSAMPLED/image/jpeg/28aaaa4b041d08d6b0198cb59ed7589f/gr6.jpg https://s3-eu-west-1.amazonaws.com/prod-ucs-content-store-eu-west/content/pii:S1872206714600504/gr6/DOWNSAMPLED/image/jpeg/28aaaa4b041d08d6b0198cb59ed7589f/gr6.jpg gr6 gr6.jpg jpg 43608 241 337 IMAGE-DOWNSAMPLED 1-s2.0-S1872206714600504-gr5.jpg https://s3.amazonaws.com/prod-ucs-content-store-us-east/content/pii:S1872206714600504/gr5/DOWNSAMPLED/image/jpeg/f4b560e7674ab7d114ca7195d0b42763/gr5.jpg https://s3-eu-west-1.amazonaws.com/prod-ucs-content-store-eu-west/content/pii:S1872206714600504/gr5/DOWNSAMPLED/image/jpeg/f4b560e7674ab7d114ca7195d0b42763/gr5.jpg gr5 gr5.jpg jpg 28271 250 313 IMAGE-DOWNSAMPLED 1-s2.0-S1872206714600504-gr4.jpg https://s3.amazonaws.com/prod-ucs-content-store-us-east/content/pii:S1872206714600504/gr4/DOWNSAMPLED/image/jpeg/fa2a64563845c9b57413158a0c6007c8/gr4.jpg https://s3-eu-west-1.amazonaws.com/prod-ucs-content-store-eu-west/content/pii:S1872206714600504/gr4/DOWNSAMPLED/image/jpeg/fa2a64563845c9b57413158a0c6007c8/gr4.jpg gr4 gr4.jpg jpg 15990 218 345 IMAGE-DOWNSAMPLED 1-s2.0-S1872206714600504-gr3.jpg https://s3.amazonaws.com/prod-ucs-content-store-us-east/content/pii:S1872206714600504/gr3/DOWNSAMPLED/image/jpeg/b0aa7871105346738e55ddc81feba0c5/gr3.jpg https://s3-eu-west-1.amazonaws.com/prod-ucs-content-store-eu-west/content/pii:S1872206714600504/gr3/DOWNSAMPLED/image/jpeg/b0aa7871105346738e55ddc81feba0c5/gr3.jpg gr3 gr3.jpg jpg 15412 213 341 IMAGE-DOWNSAMPLED 1-s2.0-S1872206714600504-gr2.jpg https://s3.amazonaws.com/prod-ucs-content-store-us-east/content/pii:S1872206714600504/gr2/DOWNSAMPLED/image/jpeg/6b1e037bcc76419d1ab1bfc8732e494f/gr2.jpg https://s3-eu-west-1.amazonaws.com/prod-ucs-content-store-eu-west/content/pii:S1872206714600504/gr2/DOWNSAMPLED/image/jpeg/6b1e037bcc76419d1ab1bfc8732e494f/gr2.jpg gr2 gr2.jpg jpg 39674 241 337 IMAGE-DOWNSAMPLED 1-s2.0-S1872206714600504-gr10.jpg https://s3.amazonaws.com/prod-ucs-content-store-us-east/content/pii:S1872206714600504/gr10/DOWNSAMPLED/image/jpeg/702cb651f98520b080601f05d47abf7f/gr10.jpg https://s3-eu-west-1.amazonaws.com/prod-ucs-content-store-eu-west/content/pii:S1872206714600504/gr10/DOWNSAMPLED/image/jpeg/702cb651f98520b080601f05d47abf7f/gr10.jpg gr10 gr10.jpg jpg 28695 257 346 IMAGE-DOWNSAMPLED 1-s2.0-S1872206714600504-gr1.jpg https://s3.amazonaws.com/prod-ucs-content-store-us-east/content/pii:S1872206714600504/gr1/DOWNSAMPLED/image/jpeg/d6ae789a1f54bb0501610dae47b6e9da/gr1.jpg https://s3-eu-west-1.amazonaws.com/prod-ucs-content-store-eu-west/content/pii:S1872206714600504/gr1/DOWNSAMPLED/image/jpeg/d6ae789a1f54bb0501610dae47b6e9da/gr1.jpg gr1 gr1.jpg jpg 25610 361 361 IMAGE-DOWNSAMPLED 1-s2.0-S1872206714600504-fx1.jpg https://s3.amazonaws.com/prod-ucs-content-store-us-east/content/pii:S1872206714600504/fx1/DOWNSAMPLED/image/jpeg/6f9adc4d7bd6e3be673adbe29d01dddd/fx1.jpg https://s3-eu-west-1.amazonaws.com/prod-ucs-content-store-eu-west/content/pii:S1872206714600504/fx1/DOWNSAMPLED/image/jpeg/6f9adc4d7bd6e3be673adbe29d01dddd/fx1.jpg fx1 true fx1.jpg jpg 45226 165 500 IMAGE-DOWNSAMPLED 1-s2.0-S1872206714600504-gr9.sml https://s3.amazonaws.com/prod-ucs-content-store-us-east/content/pii:S1872206714600504/gr9/THUMBNAIL/image/gif/6c8a2d7019b38fc4e873efa7a3e6ff0b/gr9.sml https://s3-eu-west-1.amazonaws.com/prod-ucs-content-store-eu-west/content/pii:S1872206714600504/gr9/THUMBNAIL/image/gif/6c8a2d7019b38fc4e873efa7a3e6ff0b/gr9.sml gr9 gr9.sml sml 3549 135 219 IMAGE-THUMBNAIL 1-s2.0-S1872206714600504-gr8.sml https://s3.amazonaws.com/prod-ucs-content-store-us-east/content/pii:S1872206714600504/gr8/THUMBNAIL/image/gif/ea57bd10c6f7cb524cd4deb4f47c23c4/gr8.sml https://s3-eu-west-1.amazonaws.com/prod-ucs-content-store-eu-west/content/pii:S1872206714600504/gr8/THUMBNAIL/image/gif/ea57bd10c6f7cb524cd4deb4f47c23c4/gr8.sml gr8 gr8.sml sml 3381 138 219 IMAGE-THUMBNAIL 1-s2.0-S1872206714600504-gr7.sml https://s3.amazonaws.com/prod-ucs-content-store-us-east/content/pii:S1872206714600504/gr7/THUMBNAIL/image/gif/2d72e4ecb3fff861807d34a525aa42b0/gr7.sml https://s3-eu-west-1.amazonaws.com/prod-ucs-content-store-eu-west/content/pii:S1872206714600504/gr7/THUMBNAIL/image/gif/2d72e4ecb3fff861807d34a525aa42b0/gr7.sml gr7 gr7.sml sml 3601 130 219 IMAGE-THUMBNAIL 1-s2.0-S1872206714600504-gr6.sml https://s3.amazonaws.com/prod-ucs-content-store-us-east/content/pii:S1872206714600504/gr6/THUMBNAIL/image/gif/695e0decab24cf5e080cfc5a07174daf/gr6.sml https://s3-eu-west-1.amazonaws.com/prod-ucs-content-store-eu-west/content/pii:S1872206714600504/gr6/THUMBNAIL/image/gif/695e0decab24cf5e080cfc5a07174daf/gr6.sml gr6 gr6.sml sml 8962 156 219 IMAGE-THUMBNAIL 1-s2.0-S1872206714600504-gr5.sml https://s3.amazonaws.com/prod-ucs-content-store-us-east/content/pii:S1872206714600504/gr5/THUMBNAIL/image/gif/d183c77458ce20b9ab1e8ee9205a18e4/gr5.sml https://s3-eu-west-1.amazonaws.com/prod-ucs-content-store-eu-west/content/pii:S1872206714600504/gr5/THUMBNAIL/image/gif/d183c77458ce20b9ab1e8ee9205a18e4/gr5.sml gr5 gr5.sml sml 5946 164 205 IMAGE-THUMBNAIL 1-s2.0-S1872206714600504-gr4.sml https://s3.amazonaws.com/prod-ucs-content-store-us-east/content/pii:S1872206714600504/gr4/THUMBNAIL/image/gif/6e106ff71ff658bedcc25eae83a09f71/gr4.sml https://s3-eu-west-1.amazonaws.com/prod-ucs-content-store-eu-west/content/pii:S1872206714600504/gr4/THUMBNAIL/image/gif/6e106ff71ff658bedcc25eae83a09f71/gr4.sml gr4 gr4.sml sml 3395 138 219 IMAGE-THUMBNAIL 1-s2.0-S1872206714600504-gr3.sml https://s3.amazonaws.com/prod-ucs-content-store-us-east/content/pii:S1872206714600504/gr3/THUMBNAIL/image/gif/24ec0fa43866c0ecfe7d2972e1961a1a/gr3.sml https://s3-eu-west-1.amazonaws.com/prod-ucs-content-store-eu-west/content/pii:S1872206714600504/gr3/THUMBNAIL/image/gif/24ec0fa43866c0ecfe7d2972e1961a1a/gr3.sml gr3 gr3.sml sml 3305 137 219 IMAGE-THUMBNAIL 1-s2.0-S1872206714600504-gr2.sml https://s3.amazonaws.com/prod-ucs-content-store-us-east/content/pii:S1872206714600504/gr2/THUMBNAIL/image/gif/f020793cd245dc4ed589c77a5095e580/gr2.sml https://s3-eu-west-1.amazonaws.com/prod-ucs-content-store-eu-west/content/pii:S1872206714600504/gr2/THUMBNAIL/image/gif/f020793cd245dc4ed589c77a5095e580/gr2.sml gr2 gr2.sml sml 8731 156 219 IMAGE-THUMBNAIL 1-s2.0-S1872206714600504-gr10.sml https://s3.amazonaws.com/prod-ucs-content-store-us-east/content/pii:S1872206714600504/gr10/THUMBNAIL/image/gif/4a83c573ab350724dc920646773b45f0/gr10.sml https://s3-eu-west-1.amazonaws.com/prod-ucs-content-store-eu-west/content/pii:S1872206714600504/gr10/THUMBNAIL/image/gif/4a83c573ab350724dc920646773b45f0/gr10.sml gr10 gr10.sml sml 5799 163 219 IMAGE-THUMBNAIL 1-s2.0-S1872206714600504-gr1.sml https://s3.amazonaws.com/prod-ucs-content-store-us-east/content/pii:S1872206714600504/gr1/THUMBNAIL/image/gif/f5bfc459206397342a26240c7c089b20/gr1.sml https://s3-eu-west-1.amazonaws.com/prod-ucs-content-store-eu-west/content/pii:S1872206714600504/gr1/THUMBNAIL/image/gif/f5bfc459206397342a26240c7c089b20/gr1.sml gr1 gr1.sml sml 5995 164 164 IMAGE-THUMBNAIL 1-s2.0-S1872206714600504-fx1.sml https://s3.amazonaws.com/prod-ucs-content-store-us-east/content/pii:S1872206714600504/fx1/THUMBNAIL/image/gif/729cee767fc5433cbffd95fa0a437043/fx1.sml https://s3-eu-west-1.amazonaws.com/prod-ucs-content-store-eu-west/content/pii:S1872206714600504/fx1/THUMBNAIL/image/gif/729cee767fc5433cbffd95fa0a437043/fx1.sml fx1 true fx1.sml sml 8136 72 219 IMAGE-THUMBNAIL CHNJC 60050 S1872-2067(14)60050-4 10.1016/S1872-2067(14)60050-4 Dalian Institute of Chemical Physics, the Chinese Academy of Sciences Fig. 1 Contact angle (θ) measurement images of the CLs at each PTFE content. (a) 10%; (b) 20%; (c) 30%; (d) 40%. Fig. 2 i-V and power density curves of the single cells at each PTFE content. Fig. 3 Open circuit voltage of the single cell versus the PTFE content in the CL. Fig. 4 Resistance of the single cell versus the PTFE content in the CL. Fig. 5 In-situ EIS spectra of the single cells at each PTFE content. (a) at 100 mA/cm2; (b) at 200 mA/cm2. Z' is the real component of the impedance cell impedance vector, while Z' is the imaginary component. Fig. 6 i-V and power density curves of the single cells at each Pt loading. Fig. 7 Mass peak power density of the single cells versus Pt loading. Fig. 8 Open circuit voltage of the single cells versus Pt loading. Fig. 9 Resistance of the single cells versus Pt loading. Fig. 10 In-situ EIS spectra of the cells at each Pt loading. (a) at 100 mA/cm2; (b) at 200 mA/cm2. Z' and Z' see Fig. 5. Table 1 Kinetic parameters obtained by fitting the i-V curves against Eq. (1) for the electrodes with different characteristics. Both at anode and cathode b/(mV/dec) i 0/(A/cm2) R/(Ω cm2) PTFE content (% in CL) 10 55.8 7.23 × 10−8 1.37 20 54.2 7.41 × 10−8 1.26 30 58.7 1.55 × 10−7 1.85 40 57.7 8.94 × 10−8 1.63 Pt loading (mg/cm2) 0.2 60.0 8.67 × 10−8 2.44 0.5 54.2 8.72 × 10−8 1.26 1.0 60.0 2.12 × 10−7 1.29 1.5 23.3 8.56 × 10−15 1.83 This work was supported by the National High Technology Research and Development Program of China (863 Program, 2011AA050705), the National Basic Research Program of China (973 Program, 2012CB215500), and the National Natural Science Foundation of China (21176234 and 21203191). Published 20 July 2014 Article Effect of gas diffusion electrode parameters on anion exchange membrane fuel cell performance Donglei Yang a b Hongmei Yu a * Guangfu Li a Wei Song a Yanxi Liu a Zhigang Shao a a Dalian National Laboratory for Clean Energy, Dalian Institute of Chemical Physics, Chinese Academy of Science, Dalian 116023, Liaoning, China Dalian National Laboratory for Clean Energy Dalian Institute of Chemical Physics Chinese Academy of Science Dalian Liaoning 116023 China b University of Chinese Academy of Sciences, Beijing 100049, China University of Chinese Academy of Sciences Beijing 100049 China * Corresponding author. Tel: +86-411-84379051; Fax:+86-411-84379187 Focused on the optimization of the gas diffusion electrode (GDE) in an alkaline anion exchange membrane fuel cell (AAEMFC), PTFE content and catalyst loading in the catalyst layer (CL) were found to have a substantial effect on the cell performance and electrochemical kinetics. The i-V curves, open circuit voltage, cell resistance, in-situ electrochemical impedance spectroscopy and kinetics analysis have been used to evaluate the electrochemical properties of the fabricated GDEs. The results reveal that the optimum PTFE content in the CL of AAEMFC is 20%. Pt loading ranged from 0.2–1.0 mg/cm2 was also investigated as a vital parameter for three-phase boundary, CL conductivity and catalyst utilization. Ultimately, the highest peak power density of 213 mW/cm2 was achieved at 50 °C from the prepared GDE with Pt loading of 1.0 mg/cm2 on Pt/C and 20% PTFE in CL of AAEMFC. Considering the Pt-based catalyst effective utilization and cost, however, the platinum requirement can be diminished to close to 0.5 mg/cm2 in CLwithout significant performance loss. Graphical Abstract The performance of the prepared gas diffusion electrode in an anion exchange membrane fuel cell has been significantly improved using an optimized PTFE content and Pt loading in the Pt-based catalyst layer. Keywords Alkaline anion exchange membrane fuel cell Gas diffusion electrode PTFE content Catalyst loading Three phase boundary 1 Introduction Recently, alkaline fuel cells (AFCs) have attracted a resurgence of interest for application involving H2 [1–4]. In particular, alkaline anion exchange membrane fuel cells (AAEMFCs), which use an alkaline anion-exchanged membrane (AEM) instead of a traditional liquid electrolyte, appear to be a potentially useful technique. Compared with conventional AFCs, AAEMFCs are superior in automotive application, owing to: (1) the elimination of electrolyte weeping, (2) reduced reactant crossover, (3) potentially simplified water management, as water is produced at the anode and consumed at the cathode, (4) a larger repertoire of effective catalytic materials, and (5) potentially reduced corrosion [2,5–7]. To fully realize these advantages, extensive efforts have been made to explore new AEMs/ionomers using novel synthesis methods, a direction which has been most often identified as an important route in advancing the field [1,8–13]. Unfortunately, AEM use requires new electrode design and raises new fabrication challenges, and little work on the electrode fabrication technology can be found in previous publications [14–16]. Research into finely optimized electrodes is therefore necessary to achieve improved cell performance. Gas diffusion electrodes (GDEs) are frequently employed in electrochemical devices, such as fuel cells, cells for brine electrolysis, and air-metal batteries [17,18]. GDEs are prepared by binding PTFE to a metal net before being coated in a catalyst powder, and have the advantages of flexibility, inexpensive equipment, and ease of scale up [19]. In general, GDEs consist of two or three PTFE-bonded porous layers: a gas diffusion layer (GDL), a catalyst layer (CL), and a microporous layer (MPL) sandwiched between the GDL and the CL. The GDL acts as the backbone of the GDE, supports the MPL and CL, and is responsible for primary gas distribution [18]. The MPL usually contains a PTFE-bonded carbon-black layer which is applied onto the GDL surface. Its principle functions are: (1) to prevent flooding in the CL (water management), (2) to act as a good electrical conductor between the GDL and the CL, and (3) to improve reactant gas distribution [20]. The CL is the core of GDE and provides reaction zones for the electrode reaction. Within the CL, the electrode reaction occurs at the three-phase boundaries (TPBs), where the catalyst, electrolyte, and gases meet and react [3,21,22]. A state-of-the-art AAEMFC electrode usually has a CL comprising catalyst nanoparticles on carbon black, which acts as a support, mixed with an ionomer/binder [10,23,24]. In this case, to improve the performance of AAEMFC electrodes through increasing the stability and availability of the TPBs, either the gas transport channels for a given catalyst loading needs to be improved or the catalytic sites in the CL need to be more active. Both can be achieved by the control of the hydrophobic PTFE content and catalyst loading in the CL. However, the PTFE content in the CL is a trade-off between the level of hydrophobic behavior of the PTFE and the conductivity of the carbon support. Conversely, high electrocatalyst loadings increase the CL thickness, and eventually to poor catalyst use. The electrocatalysts are usually noble-metal Pt-based materials, are used at both the anode and cathode, and are the major contributor to the cost of the cell [25,26]. Therefore, optimization of the fabrication techniques of GDEs is required to obtain enhanced AAEMFC performance and reduce electrode cost. Recently, Tokuyama Corp. (Japan) has commercially produced alkaline electrolyte materials such as the A201 AEM and/or the anion-exchange ionomer AS-4. In a previous report, these materials showed high electrochemical stability and performance in AAEMFCs, and a maximum power density of around 450 mW/cm2 in the H2/O2 fuel cell [27]. However, there is, as yet, no apparent consensus on the best method to improve the electrode fabrication. It is worthy to note that direct performance comparison for the published results is not crucial, since a number of the experimental conditions (like temperature, pressure, and electrode size) and electrode materials (including catalyst, current collector) can vary the cell performance, and are thus outside the scope of this report. This paper reports the electrochemical studies of GDEs for AAEMFCs prepared with commercial AEM A201 (Tokuyama Corp.) as a standard quaternary ammonium hydroxide anion exchange membrane. To extend stable and available TPBs, the commercial ionomer AS-4 was employed in CLs to transfer hydroxide ions and bind the catalyst particles. We evaluated the effects of PTFE content and catalyst loading (Pt/C as prototype) on AAEMFC performance, and discussed the kinetic parameters of the electrodes in terms of CL composition and architecture. 2 Experimental 2.1 MEA fabrication To prepare the catalyst layer, a homogeneous suspension was formed from the desired amounts of the commercial Pt/C catalyst (70% Pt, Johnson Matthey Inc., Britain), 5% PTFE emulsion, and a mixture of isopropyl alcohol (IPA) and H2O (volumetric ratio of 1:1) as the solvent/dispersant. After fully suspending the emulsion by sonication, the resulting catalyst ink was quantitatively deposited on a commercial gas diffusion layer (Sunrise Power Corp.) by a hand brushing. After each pass, the solvent/dispersant was evaporated with a drier until the desired Pt loading was obtained. These GDEs were sintered at 240 °C for 30 min and 340 °C for 30 min under the N2 atmosphere to remove the surfactant and to make the PTFE hydrophobic. After that, the desired amount of ionomer AS-4 (0.2 mg/cm2, Tokuyama Corp., China) was sprayed onto the surface of the as-fabricated GDE to allow OH− transport through the AEM (A201, Tokuyama Corp.) from the cathode to the anode. Finally, the GDE was cut into two pieces and the AEM sandwiched between them at 60 °C and 0.1 MPa for 2 min to fabricate the membrane electrode assemblies (MEAs). GDEs were fabricated with different PTFE contents in the CL of 10%, 20%, 30%, and 40%, which are named GDE-P10, GDE-P20, GDE-P30, and GDE-P40, respectively. To identify the impact of the Pt-based catalyst loading on the performance of AAEMFCs, four types of GDEs were prepared with different CL Pt loadings of 0.2, 0.5, 1.0, and 1.5 mg/cm2, and are named GDE-LD2, GDE-LD5, GDE-LD10, and GDE-LD15, respectively. 2.2 Characterization of CL microstructure To evaluate the hydrophobic properties of the prepared GDEs at each PTFE content, the contact angle tests were performed on a KRÜSS DSA100 Drop Shape Analysis System. At room temperature, 3 μl of distilled water was dropped onto the electrode surface. The contact angle images were taken after 10 s. The contact angle was analyzed using the tangent method of Sessile Drop Fitting. 2.3 Single cell tests The MEAs were assembled into fuel cells with an effective area of 5 cm2. The fuel cells were tested at 50 °C by passing H2/O2 (100/200 mL/min) at 0.05 MPa and 100% relative humidity. The i-V performance with cell resistance and in-situ electrochemical impedance spectroscopy (EIS) of each cell were measured and recorded by an electric load system (KMF2030, Kikusui Electronics Corp., Japan). The EIS experiments were carried out at the current density of 100 and 200 mA/cm2 with a small amplitude alternating current of 10 mA/cm2, with a frequency range of 0.1 Hz to 10 kHz. 3 Results and discussion 3.1 Effect of PTFE content on single cell performance The hydrophobicity of the CLs at each PTFE content was characterized in terms of the contact angle of the GDE surface. The contact angles images of the as-prepared GDEs are presented in Fig. 1 . When the PTFE content increased from 10% to 40%, the contact angles in the CL surface increased sharply from 143.0° to 154.5°, and then slowly rose from 157.8° to 158.3°. This means the increasing PTFE content enhances the hydrophobicity of the CLs, indicating more hydrophobic channels for gas and water transport. Figure 2 shows the typical i-V curves and power density curves of the MEAs prepared at each PTFE content. The PTFE content in the CLs strongly influences the cell performance. Among the four GDEs, GDE-P20 exhibits the optimal cell performance in the tested current density window, including the activation, ohmic, and concentration-controlled regions. The GDE-P20 cell has the highest peak power density of 197 mW/cm2 and the largest current density of 998 mA/cm2, which implies the catalyst dispersion/utilization and mass transport have been improved, and the catalyst active sites within the CL have been enhanced. The poor performance of GDE-P40 at a peak power density of only 130 mW/cm2 may relate to the decreased conductivity of the CL caused by the high PTFE content, which is an effective insulator. In addition, the cell open circuit voltage was monitored at each PTFE content under the H2/O2 AAEMFC operation. As shown in Fig. 3 , the open circuit voltage increased by about 40 mV from 10% to 30% PTFE content, and then decreased by about 10 mV at 40%. These results indicate that increasing the PTFE in CL can hamper the reactant crossover at the interface between the CL and the AEM. The diminished open circuit voltage in GDE-P40 is an indication of the decreased conductivity in the CL. The measured cell resistances (Fig. 4 ) increased linearly with the PTFE content to 30%, as a result of the poor electron conductivity of the PTFE. The high cell resistance of 0.167 Ω cm2 for GDE-P40 is in line with the decrease in the open circuit voltage. The EIS spectra can provide in-situ information on the fuel cell under real operating conditions [28]. The EIS measurements were conducted at 100 mA/cm2 and 200 mA/cm2. The EIS results displayed in Fig. 5 show only one semicircle for each tested electrode in the experimental frequency range. The high-frequency features correspond to the ohmic resistance. The medium-frequency arc, corresponding to the charge-?transfer-resistance, decreased in the studied electrodes with increasing current density, which indicates a breakdown in the reaction kinetics. Figure 5 also shows that GDE-P20 has the lowest charge-transfer resistance, which is an important factor in optimum cell performance (Fig. 2). Compared with the charge-transfer resistances of other GDEs, GDE-P40 has high values at both at the current densities and hints that there is a difficult kinetic process in the electrode reaction which will be discussed below in detail. 3.2 Effect of Pt loading on single cell performance To identify the impact of the Pt-based catalyst loading in the CLs, Fig. 6 shows the i-V curves and power density curves of the MEAs assembled at each Pt loading. In the tested electrodes, GDE-LD10 achieved the maximum peak power density of 213 mW/cm2 and the largest current density of 1118 mA/cm2. The results confirm the improved TPBs for mass diffusion and electron transfer, and correspondingly decreased energy barrier for the electrode reaction, which all arose from the optimum catalyst content. Normally, the cell performance can be improved by increasing the Pt loading, as a result of the increased catalytic sites and decreased ohmic resistance. However, GDE-LD15 with the Pt loading of 1.5 mg/cm2 had a lower maximum current density (ca. 848 mA/cm2) and peak power density (174 mW/cm2) than GDE-LD5, suggesting a relatively poor dispersion and low utilization of catalyst within the CL. Figure 7 shows the corresponding mass peak-power-?density plots derived from the above i-V data. The mass peak power density decreases rapidly as the Pt loading increases, especially when the Pt loading exceeds 0.5 mg/cm2. Therefore, given the cost of the catalyst and the Pt utilization in AAEMFC, 0.5 mg/cm2 Pt as appears to be the optimum content in the electrode CL. Furthermore, as shown in Fig. 8 , the catalyst loading influences the open circuit voltage. The open circuit voltages of these cells gradually increased to the peak of 1.040 V at Pt loading of 1.0 mg/cm2, and then dropped by 64 mV at Pt loading of 1.5 mg/cm2. This suggests that the reactant gas crossover was improved gradually owing to the thicker CL of the increasing catalyst loading, but at high loadings hampers the reactant gas crossover at the interface of the CL and AEM. Nevertheless, the low open circuit voltage of GDE-LD15 might be attributed to the high bulk resistance due to the thick CL. The low utilization of Pt catalysts may also decrease the open circuit voltage owing to the starvation of available reactant gases at the TPBs. The measured cell resistances are given in Fig. 9 . The surprisingly high cell resistance of GDE-LD2 might be ascribed to its ultra-low Pt loading and accordingly, a discontinuous conductive surface. The cell resistance is the lowest (0.137 Ω cm2) at Pt loading of 0.5 mg/cm2. Then, as the Pt loading continues to increase, the cell resistance increases to 0.175 Ω cm2, implying the resistance increase is because of thickness. The individual characteristics of electrode reaction process can be described from the in-situ EIS test. Figure 10 shows the results of the as-prepared GDEs at each Pt loading. The EIS tests were carried out at 100 and 200 mA/cm2. The charge-transfer resistance decreases significantly with increased Pt loading, meaning that there is an increase in the catalytic active sites, the TPBs are more available, and the energy barrier of the electrode reactions has decreased. GDE-LD10 has the minimum charge-transfer resistance, which coincides well with the above i-V curves. Besides the large charge-transfer resistance, there is another arc at the low-frequency region of GDE-LD2, revealing a mass transport resistance. Because the thickness of the CL with such a Pt loading is much thinner than that of GDE-LD5 and the other samples, gas transport will be unimpeded. Therefore, the mass transport resistance may be related to water management [29]. 3.3 Electrode reaction kinetics analysis To explore the electrochemical differences in these electrodes, Tafel plots were employed to extract more information about the electrode characteristics. The kinetic parameters of each electrode were obtained by fitting the i-V curves against a theoretical model as follows [30–32]: (1) E = E 0 - b log i - R i , (2) E 0 = E r + b log i 0 , where Er is the reversible potential, taken to be 1.22 V for under the experimental conditions [28], b is the Tafel slope, i 0 is the exchange current density, and R is the overall contribution of i to E, including the ohmic resistance, charge-transfer resistance of the hydrogen oxidation, and mass-transport resistance in the intermediate current density region. The fitted results are listed in Table 1 . It is worth mentioning that the Tafel slope b always reflects the electrode reaction activity, while the exchange current density i 0 represents the electrode reaction rate, which relates to the number of reaction sites. Since all MEAs are made from the same GDL and membrane, any differences in these parameters can be attributed to the different compositions and architectures of the CLs caused by the different PTFE contents and Pt loadings. The electrode materials and cell operating conditions in this work are also fixed, so the exchange current density i 0 is primarily dependent on the TPBs. The results show that increasing the PTFE content generally increases b, i 0 and R. This means that increasing the PTFE content reduces the CL electron conductivity and the electrode reaction activity, but improves the TPBs and increases the effective reaction areas. The small b and R of GDE-P20 indicates this level has good electrode reaction activity and CL conductivity and further explains its excellent cell performance, and thus confirms 20% to be the optimal PTFE content in the CL. Conversely, the increase in Pt loading results in a decrease in b and R but an increase in i 0, because increasing the Pt loading improves the electrode reaction activity, increases the reaction zones, and enhances the CL conductivity, so long as the Pt loading lies between 0.2 and 1.0 mg/cm2. Electrodes with Pt loading 1.0 mg/cm2 have better CL conductivity and improved TPBs, meaning this is the optimal Pt loading. Considering the open circuit voltage of GDE-LD15, its tiny exchange current density may be related to the concentration distribution of the reactants in the thick CL. 4 Conclusions The effects of the PTFE content and Pt loading on AAEMFC performance and electrode kinetics were evaluated and investigated. The results show that the fabricated GDE-P20 has the optimal peak power density of 197 mW/cm2 at 50 °C, meaning the optimum PTFE content in the CL is 20%. In addition, based on the various cell measurements and fitted kinetic parameters, the Pt loading (ranging from 0.2 to 1.0 mg/cm2) was observed as a crucial role in augmenting the TPBs, the electron conductivity, and catalyst utilization in CLs. The best performance of GDE for AAEMFCs had a peak power density of 213 mW/cm2 with Pt loading 1.0 mg/cm2 of 70% Pt/C, and 20% PTFE in the CL. To increase utilization of the Pt-based catalyst and reduce its cost, this work confirmed that the Pt loading could be diminished to near 0.5 mg/cm2 in the CL without obvious performance loss. References 1 Y J Wang J L Qiao R Baker J J Zhang Chem Soc Rev 42 2013 5768 2 J R Varcoe R C T Slade Fuel Cells 5 2005 187 3 K Matsumoto T Fujigaya H Yanagi N Nakashima Adv Funct Mater 21 2011 1089 4 G Merle M Wessling K Nijmeijer J Membr Sci 377 2011 1 5 F Bidault D J L Brett P H Middleton N P Brandon J Power Sources 187 2009 39 6 J Pan C Chen L Zhuang J T Lu Acc Chem Res 45 2012 473 7 C Tamain S D Poynton R C T Slade B Carroll J R Varcoe J Phys Chem C 111 2007 18423 8 C G Arges J Parrondo G Johnson A Nadhan V Ramani J Mater Chem 22 2012 3733 9 S D Poynton R Zeng J Kizewski A L Ong J R Varcoe ECS Transactions 50 2012 2067 10 O I Deavin S Murphy A L Ong S D Poynton R Zeng H Herman J R Varcoe Energy Environ Sci 5 2012 8584 11 L L Liu J Zhang J L Qiao Chem Res Chin Univ 8 2012 1842 12 T W Xu Y H Wu J Y Luo Membr Sci Technol 31 2011 192 13 R J Zhu X R Zhang T Wang D Wang Chin J Power Sources 37 2013 575 14 J-H Kim S Yonezawa M Takashima Int J Hydrogen Energy 35 2010 8707 15 H Bunazawa Y Yamazaki J Power Sources 182 2008 48 16 H Kim J F Zhou M Ünlü I Anestis-Richard K Joseph P A Kohl Electrochim Acta 56 2011 3085 17 K Hayashi N Furuya J Electrochem Soc 151 2004 A354 18 N K Huang S Z Wang L X Li Chin J Power Sources 27 2003 329 19 S Marini P Salvi P Nelli R Pesenti M Villa Y Kiros Int J Hydrogen Energy 38 2013 11496 20 B Millington S F Du B G Pollet J Power Sources 196 2011 9013 21 Y B Kim T P Holme T M Guer F B Prinz Adv Funct Mater 21 2011 4684 22 D Kubo K Tadanaga A Hayashi M Tatsumisago J Power Sources 222 2013 493 23 M Ünlü J F Zhou I Anestis-Richard H Kim P A Kohl Electrochim Acta 56 2011 4439 24 S F Lu J Pan A B Huang L Zhuang J T Lu Proc Natl Acad Sci (USA) 105 2008 20611 25 Z Y Yan B Li D J Yang J X Ma Chin J Catal 34 2013 1471 26 H Y Zhang C H Cao J Zhao R Lin J X Ma Chin J Catal 33 2012 222 27 Fukuta K. Electrolyte Materials for AMFCs and AMFCs Performance. Presented at the 2011 AMFC Workshop, 2011 28 J R Varcoe R C T Slade G L Wright Y L Chen J Phys Chem B 110 2006 21041 29 M Mamlouk K Scott J A Horsfall C Williams Int J Hydrogen Energy 36 2011 7191 30 J Kim S M Lee S Srinivasan C E Chamberlin J Electrochem Soc 142 1995 2670 31 G Squadrito G Maggio E Passalacqua F Lufrano A Patti J Appl Electrochem 29 1999 1449 32 M Carmo G Doubek R C Sekol M Linardi A D Taylor J Power Sources 230 2013 169",
      "scopus-id": "84903949033",
      "coredata": {
        "eid": "1-s2.0-S1872206714600504",
        "dc:description": "Focused on the optimization of the gas diffusion electrode (GDE) in an alkaline anion exchange membrane fuel cell (AAEMFC), PTFE content and catalyst loading in the catalyst layer (CL) were found to have a substantial effect on the cell performance and electrochemical kinetics. The i-V curves, open circuit voltage, cell resistance, in-situ electrochemical impedance spectroscopy and kinetics analysis have been used to evaluate the electrochemical properties of the fabricated GDEs. The results reveal that the optimum PTFE content in the CL of AAEMFC is 20%. Pt loading ranged from 0.2–1.0 mg/cm2 was also investigated as a vital parameter for three-phase boundary, CL conductivity and catalyst utilization. Ultimately, the highest peak power density of 213 mW/cm2 was achieved at 50 °C from the prepared GDE with Pt loading of 1.0 mg/cm2 on Pt/C and 20% PTFE in CL of AAEMFC. Considering the Pt-based catalyst effective utilization and cost, however, the platinum requirement can be diminished to close to 0.5 mg/cm2 in CLwithout significant performance loss.",
        "openArchiveArticle": "false",
        "prism:coverDate": "2014-07-31",
        "openaccessUserLicense": null,
        "prism:aggregationType": "Journal",
        "prism:url": "https://api.elsevier.com/content/article/pii/S1872206714600504",
        "dc:creator": [
          {
            "@_fa": "true",
            "$": "Yang, Donglei"
          },
          {
            "@_fa": "true",
            "$": "Yu, Hongmei"
          },
          {
            "@_fa": "true",
            "$": "Li, Guangfu"
          },
          {
            "@_fa": "true",
            "$": "Song, Wei"
          },
          {
            "@_fa": "true",
            "$": "Liu, Yanxi"
          },
          {
            "@_fa": "true",
            "$": "Shao, Zhigang"
          }
        ],
        "link": [
          {
            "@_fa": "true",
            "@rel": "self",
            "@href": "https://api.elsevier.com/content/article/pii/S1872206714600504"
          },
          {
            "@_fa": "true",
            "@rel": "scidir",
            "@href": "https://www.sciencedirect.com/science/article/pii/S1872206714600504"
          }
        ],
        "dc:format": "application/json",
        "openaccessType": null,
        "pii": "S1872-2067(14)60050-4",
        "prism:volume": "35",
        "prism:publisher": "Dalian Institute of Chemical Physics, the Chinese Academy of Sciences. Published by Elsevier B.V.",
        "dc:title": "Effect of gas diffusion electrode parameters on anion exchange membrane fuel cell performance",
        "prism:copyright": "Copyright © 2014 Dalian Institute of Chemical Physics, the Chinese Academy of Sciences. Published by Elsevier B.V. All rights reserved.",
        "openaccess": "0",
        "prism:issn": "18722067",
        "prism:issueIdentifier": "7",
        "dcterms:subject": [
          {
            "@_fa": "true",
            "$": "Alkaline anion exchange membrane fuel cell"
          },
          {
            "@_fa": "true",
            "$": "Gas diffusion electrode"
          },
          {
            "@_fa": "true",
            "$": "PTFE content"
          },
          {
            "@_fa": "true",
            "$": "Catalyst loading"
          },
          {
            "@_fa": "true",
            "$": "Three phase boundary"
          }
        ],
        "openaccessArticle": "false",
        "prism:publicationName": "Chinese Journal of Catalysis",
        "prism:number": "7",
        "openaccessSponsorType": null,
        "prism:pageRange": "1091-1097",
        "prism:endingPage": "1097",
        "pubType": "fla",
        "prism:coverDisplayDate": "July 2014",
        "prism:doi": "10.1016/S1872-2067(14)60050-4",
        "prism:startingPage": "1091",
        "dc:identifier": "doi:10.1016/S1872-2067(14)60050-4",
        "openaccessSponsorName": null
      },
      "objects": {
        "object": [
          {
            "@category": "thumbnail",
            "@height": "16",
            "@width": "123",
            "@_fa": "true",
            "$": "https://api.elsevier.com/content/object/eid/1-s2.0-S1872206714600504-si2.gif?httpAccept=%2A%2F%2A",
            "@multimediatype": "GIF image file",
            "@type": "ALTIMG",
            "@size": "271",
            "@ref": "si2",
            "@mimetype": "image/gif"
          },
          {
            "@category": "thumbnail",
            "@height": "16",
            "@width": "142",
            "@_fa": "true",
            "$": "https://api.elsevier.com/content/object/eid/1-s2.0-S1872206714600504-si1.gif?httpAccept=%2A%2F%2A",
            "@multimediatype": "GIF image file",
            "@type": "ALTIMG",
            "@size": "283",
            "@ref": "si1",
            "@mimetype": "image/gif"
          },
          {
            "@category": "standard",
            "@height": "212",
            "@width": "343",
            "@_fa": "true",
            "$": "https://api.elsevier.com/content/object/eid/1-s2.0-S1872206714600504-gr9.jpg?httpAccept=%2A%2F%2A",
            "@multimediatype": "JPEG image file",
            "@type": "IMAGE-DOWNSAMPLED",
            "@size": "16939",
            "@ref": "gr9",
            "@mimetype": "image/jpeg"
          },
          {
            "@category": "standard",
            "@height": "223",
            "@width": "354",
            "@_fa": "true",
            "$": "https://api.elsevier.com/content/object/eid/1-s2.0-S1872206714600504-gr8.jpg?httpAccept=%2A%2F%2A",
            "@multimediatype": "JPEG image file",
            "@type": "IMAGE-DOWNSAMPLED",
            "@size": "16736",
            "@ref": "gr8",
            "@mimetype": "image/jpeg"
          },
          {
            "@category": "standard",
            "@height": "205",
            "@width": "344",
            "@_fa": "true",
            "$": "https://api.elsevier.com/content/object/eid/1-s2.0-S1872206714600504-gr7.jpg?httpAccept=%2A%2F%2A",
            "@multimediatype": "JPEG image file",
            "@type": "IMAGE-DOWNSAMPLED",
            "@size": "16878",
            "@ref": "gr7",
            "@mimetype": "image/jpeg"
          },
          {
            "@category": "standard",
            "@height": "241",
            "@width": "337",
            "@_fa": "true",
            "$": "https://api.elsevier.com/content/object/eid/1-s2.0-S1872206714600504-gr6.jpg?httpAccept=%2A%2F%2A",
            "@multimediatype": "JPEG image file",
            "@type": "IMAGE-DOWNSAMPLED",
            "@size": "43608",
            "@ref": "gr6",
            "@mimetype": "image/jpeg"
          },
          {
            "@category": "standard",
            "@height": "250",
            "@width": "313",
            "@_fa": "true",
            "$": "https://api.elsevier.com/content/object/eid/1-s2.0-S1872206714600504-gr5.jpg?httpAccept=%2A%2F%2A",
            "@multimediatype": "JPEG image file",
            "@type": "IMAGE-DOWNSAMPLED",
            "@size": "28271",
            "@ref": "gr5",
            "@mimetype": "image/jpeg"
          },
          {
            "@category": "standard",
            "@height": "218",
            "@width": "345",
            "@_fa": "true",
            "$": "https://api.elsevier.com/content/object/eid/1-s2.0-S1872206714600504-gr4.jpg?httpAccept=%2A%2F%2A",
            "@multimediatype": "JPEG image file",
            "@type": "IMAGE-DOWNSAMPLED",
            "@size": "15990",
            "@ref": "gr4",
            "@mimetype": "image/jpeg"
          },
          {
            "@category": "standard",
            "@height": "213",
            "@width": "341",
            "@_fa": "true",
            "$": "https://api.elsevier.com/content/object/eid/1-s2.0-S1872206714600504-gr3.jpg?httpAccept=%2A%2F%2A",
            "@multimediatype": "JPEG image file",
            "@type": "IMAGE-DOWNSAMPLED",
            "@size": "15412",
            "@ref": "gr3",
            "@mimetype": "image/jpeg"
          },
          {
            "@category": "standard",
            "@height": "241",
            "@width": "337",
            "@_fa": "true",
            "$": "https://api.elsevier.com/content/object/eid/1-s2.0-S1872206714600504-gr2.jpg?httpAccept=%2A%2F%2A",
            "@multimediatype": "JPEG image file",
            "@type": "IMAGE-DOWNSAMPLED",
            "@size": "39674",
            "@ref": "gr2",
            "@mimetype": "image/jpeg"
          },
          {
            "@category": "standard",
            "@height": "257",
            "@width": "346",
            "@_fa": "true",
            "$": "https://api.elsevier.com/content/object/eid/1-s2.0-S1872206714600504-gr10.jpg?httpAccept=%2A%2F%2A",
            "@multimediatype": "JPEG image file",
            "@type": "IMAGE-DOWNSAMPLED",
            "@size": "28695",
            "@ref": "gr10",
            "@mimetype": "image/jpeg"
          },
          {
            "@category": "standard",
            "@height": "361",
            "@width": "361",
            "@_fa": "true",
            "$": "https://api.elsevier.com/content/object/eid/1-s2.0-S1872206714600504-gr1.jpg?httpAccept=%2A%2F%2A",
            "@multimediatype": "JPEG image file",
            "@type": "IMAGE-DOWNSAMPLED",
            "@size": "25610",
            "@ref": "gr1",
            "@mimetype": "image/jpeg"
          },
          {
            "@category": "standard",
            "@height": "165",
            "@width": "500",
            "@_fa": "true",
            "$": "https://api.elsevier.com/content/object/eid/1-s2.0-S1872206714600504-fx1.jpg?httpAccept=%2A%2F%2A",
            "@multimediatype": "JPEG image file",
            "@type": "IMAGE-DOWNSAMPLED",
            "@size": "45226",
            "@ref": "fx1",
            "@mimetype": "image/jpeg"
          },
          {
            "@category": "thumbnail",
            "@height": "135",
            "@width": "219",
            "@_fa": "true",
            "$": "https://api.elsevier.com/content/object/eid/1-s2.0-S1872206714600504-gr9.sml?httpAccept=%2A%2F%2A",
            "@multimediatype": "GIF image file",
            "@type": "IMAGE-THUMBNAIL",
            "@size": "3549",
            "@ref": "gr9",
            "@mimetype": "image/gif"
          },
          {
            "@category": "thumbnail",
            "@height": "138",
            "@width": "219",
            "@_fa": "true",
            "$": "https://api.elsevier.com/content/object/eid/1-s2.0-S1872206714600504-gr8.sml?httpAccept=%2A%2F%2A",
            "@multimediatype": "GIF image file",
            "@type": "IMAGE-THUMBNAIL",
            "@size": "3381",
            "@ref": "gr8",
            "@mimetype": "image/gif"
          },
          {
            "@category": "thumbnail",
            "@height": "130",
            "@width": "219",
            "@_fa": "true",
            "$": "https://api.elsevier.com/content/object/eid/1-s2.0-S1872206714600504-gr7.sml?httpAccept=%2A%2F%2A",
            "@multimediatype": "GIF image file",
            "@type": "IMAGE-THUMBNAIL",
            "@size": "3601",
            "@ref": "gr7",
            "@mimetype": "image/gif"
          },
          {
            "@category": "thumbnail",
            "@height": "156",
            "@width": "219",
            "@_fa": "true",
            "$": "https://api.elsevier.com/content/object/eid/1-s2.0-S1872206714600504-gr6.sml?httpAccept=%2A%2F%2A",
            "@multimediatype": "GIF image file",
            "@type": "IMAGE-THUMBNAIL",
            "@size": "8962",
            "@ref": "gr6",
            "@mimetype": "image/gif"
          },
          {
            "@category": "thumbnail",
            "@height": "164",
            "@width": "205",
            "@_fa": "true",
            "$": "https://api.elsevier.com/content/object/eid/1-s2.0-S1872206714600504-gr5.sml?httpAccept=%2A%2F%2A",
            "@multimediatype": "GIF image file",
            "@type": "IMAGE-THUMBNAIL",
            "@size": "5946",
            "@ref": "gr5",
            "@mimetype": "image/gif"
          },
          {
            "@category": "thumbnail",
            "@height": "138",
            "@width": "219",
            "@_fa": "true",
            "$": "https://api.elsevier.com/content/object/eid/1-s2.0-S1872206714600504-gr4.sml?httpAccept=%2A%2F%2A",
            "@multimediatype": "GIF image file",
            "@type": "IMAGE-THUMBNAIL",
            "@size": "3395",
            "@ref": "gr4",
            "@mimetype": "image/gif"
          },
          {
            "@category": "thumbnail",
            "@height": "137",
            "@width": "219",
            "@_fa": "true",
            "$": "https://api.elsevier.com/content/object/eid/1-s2.0-S1872206714600504-gr3.sml?httpAccept=%2A%2F%2A",
            "@multimediatype": "GIF image file",
            "@type": "IMAGE-THUMBNAIL",
            "@size": "3305",
            "@ref": "gr3",
            "@mimetype": "image/gif"
          },
          {
            "@category": "thumbnail",
            "@height": "156",
            "@width": "219",
            "@_fa": "true",
            "$": "https://api.elsevier.com/content/object/eid/1-s2.0-S1872206714600504-gr2.sml?httpAccept=%2A%2F%2A",
            "@multimediatype": "GIF image file",
            "@type": "IMAGE-THUMBNAIL",
            "@size": "8731",
            "@ref": "gr2",
            "@mimetype": "image/gif"
          },
          {
            "@category": "thumbnail",
            "@height": "163",
            "@width": "219",
            "@_fa": "true",
            "$": "https://api.elsevier.com/content/object/eid/1-s2.0-S1872206714600504-gr10.sml?httpAccept=%2A%2F%2A",
            "@multimediatype": "GIF image file",
            "@type": "IMAGE-THUMBNAIL",
            "@size": "5799",
            "@ref": "gr10",
            "@mimetype": "image/gif"
          },
          {
            "@category": "thumbnail",
            "@height": "164",
            "@width": "164",
            "@_fa": "true",
            "$": "https://api.elsevier.com/content/object/eid/1-s2.0-S1872206714600504-gr1.sml?httpAccept=%2A%2F%2A",
            "@multimediatype": "GIF image file",
            "@type": "IMAGE-THUMBNAIL",
            "@size": "5995",
            "@ref": "gr1",
            "@mimetype": "image/gif"
          },
          {
            "@category": "thumbnail",
            "@height": "72",
            "@width": "219",
            "@_fa": "true",
            "$": "https://api.elsevier.com/content/object/eid/1-s2.0-S1872206714600504-fx1.sml?httpAccept=%2A%2F%2A",
            "@multimediatype": "GIF image file",
            "@type": "IMAGE-THUMBNAIL",
            "@size": "8136",
            "@ref": "fx1",
            "@mimetype": "image/gif"
          }
        ]
      },
      "link": {
        "@rel": "abstract",
        "@href": "https://api.elsevier.com/content/abstract/scopus_id/84903949033"
      }
    }
  }
}