{
  "metadata": {
    "title": "Electrochemical CO<ce:inf loc=post>2</ce:inf>RR to C<ce:inf loc=post>2+</ce:inf> products: A vision of dynamic surfaces of Cu-based catalysts",
    "authors": "; ; ",
    "journal": "Chinese Journal of Catalysis",
    "date": "2025-01-31",
    "doi": "10.1016/S1872-2067(24)60185-3",
    "abstract": "",
    "uri": "https://api.elsevier.com/content/article/pii/S1872206724601853",
    "pii": "S1872206724601853"
  },
  "fulltext": {
    "full-text-retrieval-response": {
      "scopus-eid": "2-s2.0-85214325253",
      "originalText": "serial JL 273538 291210 291744 291809 31 Chinese Journal of Catalysis CHINESEJOURNALCATALYSIS 2025-01-09 2025-01-09 2025-01-09 2025-01-09 2025-01-09T15:56:16 1-s2.0-S1872206724601853 S1872-2067(24)60185-3 S1872206724601853 10.1016/S1872-2067(24)60185-3 S300 S300.1 FULL-TEXT 1-s2.0-S1872206725X00024 2025-01-09T16:30:42.364751Z 0 0 20250101 20250131 2025 2025-01-09T17:21:34.273198Z absattachment articleinfo articletitlenorm authfirstinitialnorm authfirstsurnamenorm cid cids contenttype copyright crossmark dateloaded dateloadedtxt datesearch datesort dateupdated dco docsubtype doctype doi eid ewtransactionid hubeid indexeddate issn issnnorm itemstage itemtransactionid itemweight openaccess openarchive pg pgfirst pglast pii piinorm pubdateend pubdatestart pubdatetxt pubyr sortorder srctitle srctitlenorm srctype ssids alllist content subj subheadings suppl tomb volfirst volissue volumelist webpdf webpdfpagecount yearnav figure body affil articletitle auth authfirstini authfull authkeywords authlast primabst pubtype ref specialabst vitae 1872-2067 18722067 true 68 68 C Volume 68 3 83 102 83 102 202501 January 2025 2025-01-01 2025-01-31 2025 article rev Copyright © 2025 Dalian Institute of Chemical Physics, the Chinese Academy of Sciences. Published by Elsevier B.V. All rights are reserved, including those for text and data mining, AI training, and similar technologies. ELECTROCHEMICALCO2RRC2PRODUCTSAVISIONDYNAMICSURFACESCUBASEDCATALYSTS WANG J 1 Introduction 2 Insights into mechanisms of forming C2+ products 2.1 C2 pathways 2.2 C3 pathways 3 Structural factors facilitating C2+ production 3.1 Crystalline facets 3.2 Low-coordinated Cu sites 3.3 Adjustment of oxidation state 4 Observation of reconstruction process using in-situ/operando techniques 4.1 Morphology evolution 4.2 Evolution in oxidation state 5 A vision of dynamic surfaces: Atomic-level mechanisms and the origin of catalytic activity 5.1 Atomic-level mechanisms of the dynamic reconstruction 5.2 Understanding the electrolyte effect 5.3 Perfecting the electrolysis conditions 6 Summary and perspectives 6.1 Development of multidimensional in situ observation techniques 6.2 Researching CO2RR with robotic AI chemists References LAI 2022 2111193 W NITOPI 2019 7610 7672 S ZHU 2021 2005484 S GROSSE 2018 6192 6197 P WANG 2024 4692 D MU 2022 3694 S HUANG 2018 3117 J AMIRBEIGIARAB 2023 837 846 R GROSSE 2021 6736 P LIU 2024 5080 S ZHANG 2024 807 817 Z LIU 2024 4242 4251 Q GATTRELL 2006 1 19 M SCHOUTEN 2011 1902 1909 K GOODPASTER 2016 1471 1477 J MONTOYA 2015 2032 2037 J SCHOUTEN 2012 9864 9867 K SCHOUTEN 2013 1292 1295 K LI 2014 15694 15701 H LEDEZMAYANEZ 2016 90 94 I HANSELMAN 2018 1062 1067 S ZHAN 2024 C DELUNA 2018 103 110 P HOU 2022 22202 22211 J LI 2019 1124 1131 J BAI 2024 3171 3180 X CAI 2024 891 902 Y TING 2020 4059 4069 L IYENGAR 2021 4456 4463 P CHEN 2022 878 887 C REN 2016 20 24 D PENG 2021 1580 C JEONG 2024 4508 4520 S ZHUANG 2018 946 951 T LONG 2023 eadi6119 C ZHANG 2024 e202405733 R CHEN 2022 5998 6006 L CHANG 2020 2975 2983 X DASILVA 2023 4339 4347 A TANG 2021 26437 26447 M HUANG 2017 1749 1756 Y LUO 2015 219 229 W DEGREGORIO 2020 4854 4862 G YAO 2024 1749 K JIANG 2018 111 119 K CHEN 2024 35143 35154 Z HORI 2003 39 47 Y CHANG 2021 10919 10925 C HAHN 2017 5918 5923 C CHEN 2020 12760 12766 Y TAKAHASHI 2002 135 143 I HORI 2002 15 17 Y KIM 2016 391 399 Y GAO 2020 1902820 Y ZHONG 2021 4879 4885 D WOLDU 2022 214340 A CHOI 2020 804 812 C LI 2018 4614 J JIAO 2024 15917 15925 J LOIUDICE 2016 5789 5792 A RONG 2021 466 472 W HANDOKO 2016 20058 20067 A KIM 2020 3622 T RESKE 2014 6978 6986 R YUAN 2021 15344 15347 X CHOU 2020 2857 2867 T JIA 2024 2402537 Y JIANG 2024 8310 8316 Y LEE 2015 14701 14705 S TAN 2023 8656 8664 X WU 2021 7210 H LIANG 2018 3828 Z GAO 2019 17047 17053 D YANG 2023 262 269 Y VAVRA 2021 1347 1354 J POPOVIC 2020 14736 14746 S WANG 2021 794 X SIMON 2021 2561 2568 G MARIANO 2021 1000 1006 R KIM 2017 10560 10565 D ZHU 2020 100190 X FANG 2024 e202319936 W YANG 2020 6400 6408 P SANG 2022 e202114238 J HE 2023 4494 4498 C ZHANG 2024 16119 16127 Z QIN 2023 7607 X ZHANG 2024 643 647 Q VAVRA 2024 89 97 J LI 2024 10409 10417 Y WU 2024 2403217 H XU 2024 10829 10838 Y YANG 2024 5532 5542 X PAN 2022 1267 1276 B ZHOU 2024 201 222 H HAN 2022 3158 Z IIJIMA 2020 15238 15249 G HE 2023 4554 4561 X XU 2022 e202210375 L WANG 2023 26213 26221 J LI 2024 23901 23908 Z NGUYEN 2022 13254 13265 T KOK 2024 19509 19520 J HERZOG 2024 3986 A LI 2023 20655 20664 Z ARANAIS 2020 317 325 R TAYYEBI 2024 510 521 A ZHONG 2020 178 183 M MOK 2023 7303 D QIN 2024 e202404763 Y ZHU 2022 nwac190 Q ZHU 2024 319 328 Q WANGX2025X83 WANGX2025X83X102 WANGX2025X83XJ WANGX2025X83X102XJ 2027-01-09T00:00:00.000Z 2027-01-09T00:00:00.000Z http://creativecommons.org/licenses/by-nc-nd/4.0/ item S1872-2067(24)60185-3 S1872206724601853 1-s2.0-S1872206724601853 10.1016/S1872-2067(24)60185-3 273538 2025-01-09T16:21:34.273198Z 2025-01-01 2025-01-31 1-s2.0-S1872206724601853-main.pdf https://s3-eu-west-1.amazonaws.com/prod-ucs-content-store-eu-west/content/pii:S1872206724601853/MAIN/application/pdf/b93f3217bc6769e473362b4f3f95b645/main.pdf main.pdf pdf true 2978196 MAIN 20 1-s2.0-S1872206724601853-main_1.png https://s3-eu-west-1.amazonaws.com/prod-ucs-content-store-eu-west/content/pii:S1872206724601853/PREVIEW/image/png/ec96daf4aa0851416c1dac5676c5adcb/main_1.png main_1.png png 61905 849 656 IMAGE-WEB-PDF 1 1-s2.0-S1872206724601853-fx1.jpg https://s3-eu-west-1.amazonaws.com/prod-ucs-content-store-eu-west/content/pii:S1872206724601853/fx1/DOWNSAMPLED/image/jpeg/f7af27b603debf239af292f5d10a027c/fx1.jpg fx1 true fx1.jpg jpg 33185 208 301 IMAGE-DOWNSAMPLED 1-s2.0-S1872206724601853-fx2.jpg https://s3-eu-west-1.amazonaws.com/prod-ucs-content-store-eu-west/content/pii:S1872206724601853/fx2/THUMBNAIL/image/jpeg/651edb28178d49e4293147f21a3d1dd0/fx2.jpg fx2 fx2.jpg jpg 17139 209 178 IMAGE-DOWNSAMPLED 1-s2.0-S1872206724601853-fx3.jpg https://s3-eu-west-1.amazonaws.com/prod-ucs-content-store-eu-west/content/pii:S1872206724601853/fx3/DOWNSAMPLED/image/jpeg/0e600d058f57d2cfe6b8318a09194d04/fx3.jpg fx3 fx3.jpg jpg 12089 209 177 IMAGE-DOWNSAMPLED 1-s2.0-S1872206724601853-gr1.jpg https://s3-eu-west-1.amazonaws.com/prod-ucs-content-store-eu-west/content/pii:S1872206724601853/gr1/DOWNSAMPLED/image/jpeg/ac012bd5db0e5ded9d72847453aa78fa/gr1.jpg gr1 gr1.jpg jpg 138690 587 680 IMAGE-DOWNSAMPLED 1-s2.0-S1872206724601853-gr10.jpg https://s3-eu-west-1.amazonaws.com/prod-ucs-content-store-eu-west/content/pii:S1872206724601853/gr10/DOWNSAMPLED/image/jpeg/1385dbfcc79b60fcd4c6c9bb87e4d7d2/gr10.jpg gr10 gr10.jpg jpg 101463 367 765 IMAGE-DOWNSAMPLED 1-s2.0-S1872206724601853-gr11.jpg https://s3-eu-west-1.amazonaws.com/prod-ucs-content-store-eu-west/content/pii:S1872206724601853/gr11/DOWNSAMPLED/image/jpeg/a302ce0780d91dbdb8a8853c0c533f53/gr11.jpg gr11 gr11.jpg jpg 118067 335 770 IMAGE-DOWNSAMPLED 1-s2.0-S1872206724601853-gr2.jpg https://s3-eu-west-1.amazonaws.com/prod-ucs-content-store-eu-west/content/pii:S1872206724601853/gr2/DOWNSAMPLED/image/jpeg/96c8b944018fd0be69ecf46f9fe9d379/gr2.jpg gr2 gr2.jpg jpg 55818 432 774 IMAGE-DOWNSAMPLED 1-s2.0-S1872206724601853-gr3.jpg https://s3-eu-west-1.amazonaws.com/prod-ucs-content-store-eu-west/content/pii:S1872206724601853/gr3/DOWNSAMPLED/image/jpeg/b5887ba583fbcf58feeb375804350c3b/gr3.jpg gr3 gr3.jpg jpg 114745 423 768 IMAGE-DOWNSAMPLED 1-s2.0-S1872206724601853-gr4.jpg https://s3-eu-west-1.amazonaws.com/prod-ucs-content-store-eu-west/content/pii:S1872206724601853/gr4/DOWNSAMPLED/image/jpeg/36d97de018e3f513d37f761a77e66beb/gr4.jpg gr4 gr4.jpg jpg 139337 521 752 IMAGE-DOWNSAMPLED 1-s2.0-S1872206724601853-gr5.jpg https://s3-eu-west-1.amazonaws.com/prod-ucs-content-store-eu-west/content/pii:S1872206724601853/gr5/DOWNSAMPLED/image/jpeg/a034e4b15abe68e148d2ee862b73b343/gr5.jpg gr5 gr5.jpg jpg 93725 393 770 IMAGE-DOWNSAMPLED 1-s2.0-S1872206724601853-gr6.jpg https://s3-eu-west-1.amazonaws.com/prod-ucs-content-store-eu-west/content/pii:S1872206724601853/gr6/DOWNSAMPLED/image/jpeg/adaee5ecb66cd1836fa353aefb5b484b/gr6.jpg gr6 gr6.jpg jpg 104150 348 765 IMAGE-DOWNSAMPLED 1-s2.0-S1872206724601853-gr7.jpg https://s3-eu-west-1.amazonaws.com/prod-ucs-content-store-eu-west/content/pii:S1872206724601853/gr7/DOWNSAMPLED/image/jpeg/f8f292ac72c37f87095e95b3503a0a2c/gr7.jpg gr7 gr7.jpg jpg 108927 461 746 IMAGE-DOWNSAMPLED 1-s2.0-S1872206724601853-gr8.jpg https://s3-eu-west-1.amazonaws.com/prod-ucs-content-store-eu-west/content/pii:S1872206724601853/gr8/DOWNSAMPLED/image/jpeg/6cf58373fe829d52ff7a254819f74c2a/gr8.jpg gr8 gr8.jpg jpg 113134 353 742 IMAGE-DOWNSAMPLED 1-s2.0-S1872206724601853-gr9.jpg https://s3-eu-west-1.amazonaws.com/prod-ucs-content-store-eu-west/content/pii:S1872206724601853/gr9/DOWNSAMPLED/image/jpeg/097eed6fe528f046d2eed537355e594c/gr9.jpg gr9 gr9.jpg jpg 152585 457 762 IMAGE-DOWNSAMPLED 1-s2.0-S1872206724601853-fx1.sml https://s3-eu-west-1.amazonaws.com/prod-ucs-content-store-eu-west/content/pii:S1872206724601853/fx1/THUMBNAIL/image/gif/9b0d15fd1094d6bcedd76dfb918cf68d/fx1.sml fx1 true fx1.sml sml 16960 151 219 IMAGE-THUMBNAIL 1-s2.0-S1872206724601853-fx2.sml https://s3-eu-west-1.amazonaws.com/prod-ucs-content-store-eu-west/content/pii:S1872206724601853/fx2/THUMBNAIL/image/gif/3e6267dea8295cf66c69663b4b4e0632/fx2.sml fx2 fx2.sml sml 20234 163 139 IMAGE-THUMBNAIL 1-s2.0-S1872206724601853-fx3.sml https://s3-eu-west-1.amazonaws.com/prod-ucs-content-store-eu-west/content/pii:S1872206724601853/fx3/THUMBNAIL/image/gif/097704f906541dfa0ccff35e172785e2/fx3.sml fx3 fx3.sml sml 16215 163 138 IMAGE-THUMBNAIL 1-s2.0-S1872206724601853-gr1.sml https://s3-eu-west-1.amazonaws.com/prod-ucs-content-store-eu-west/content/pii:S1872206724601853/gr1/THUMBNAIL/image/gif/68972cc26536c7211e617c1bd4cf90bd/gr1.sml gr1 gr1.sml sml 15879 164 190 IMAGE-THUMBNAIL 1-s2.0-S1872206724601853-gr10.sml https://s3-eu-west-1.amazonaws.com/prod-ucs-content-store-eu-west/content/pii:S1872206724601853/gr10/THUMBNAIL/image/gif/70689640e8fd13d394109b88fd7939f7/gr10.sml gr10 gr10.sml sml 11838 105 219 IMAGE-THUMBNAIL 1-s2.0-S1872206724601853-gr11.sml https://s3-eu-west-1.amazonaws.com/prod-ucs-content-store-eu-west/content/pii:S1872206724601853/gr11/THUMBNAIL/image/gif/8718a22b8d4483ec9dc933f1f89e3802/gr11.sml gr11 gr11.sml sml 12180 95 219 IMAGE-THUMBNAIL 1-s2.0-S1872206724601853-gr2.sml https://s3-eu-west-1.amazonaws.com/prod-ucs-content-store-eu-west/content/pii:S1872206724601853/gr2/THUMBNAIL/image/gif/1c055fd5852ded6b55268f78596c2ffb/gr2.sml gr2 gr2.sml sml 8004 122 219 IMAGE-THUMBNAIL 1-s2.0-S1872206724601853-gr3.sml https://s3-eu-west-1.amazonaws.com/prod-ucs-content-store-eu-west/content/pii:S1872206724601853/gr3/THUMBNAIL/image/gif/bf30c4d9812741f30e14fa41987f4551/gr3.sml gr3 gr3.sml sml 12553 121 219 IMAGE-THUMBNAIL 1-s2.0-S1872206724601853-gr4.sml https://s3-eu-west-1.amazonaws.com/prod-ucs-content-store-eu-west/content/pii:S1872206724601853/gr4/THUMBNAIL/image/gif/327149f9228ff78da5c4c826450b9db5/gr4.sml gr4 gr4.sml sml 16944 152 219 IMAGE-THUMBNAIL 1-s2.0-S1872206724601853-gr5.sml https://s3-eu-west-1.amazonaws.com/prod-ucs-content-store-eu-west/content/pii:S1872206724601853/gr5/THUMBNAIL/image/gif/d5213e6e67d7164e03875f202b4bd6d3/gr5.sml gr5 gr5.sml sml 10458 112 219 IMAGE-THUMBNAIL 1-s2.0-S1872206724601853-gr6.sml https://s3-eu-west-1.amazonaws.com/prod-ucs-content-store-eu-west/content/pii:S1872206724601853/gr6/THUMBNAIL/image/gif/9e36216dfa507d1a395d91279d28dca4/gr6.sml gr6 gr6.sml sml 13104 100 219 IMAGE-THUMBNAIL 1-s2.0-S1872206724601853-gr7.sml https://s3-eu-west-1.amazonaws.com/prod-ucs-content-store-eu-west/content/pii:S1872206724601853/gr7/THUMBNAIL/image/gif/fa87186d1aca271b7a72992b74064801/gr7.sml gr7 gr7.sml sml 11131 135 219 IMAGE-THUMBNAIL 1-s2.0-S1872206724601853-gr8.sml https://s3-eu-west-1.amazonaws.com/prod-ucs-content-store-eu-west/content/pii:S1872206724601853/gr8/THUMBNAIL/image/gif/33931e9a89d9a7c98e97f46c8ebd28b1/gr8.sml gr8 gr8.sml sml 13969 104 219 IMAGE-THUMBNAIL 1-s2.0-S1872206724601853-gr9.sml https://s3-eu-west-1.amazonaws.com/prod-ucs-content-store-eu-west/content/pii:S1872206724601853/gr9/THUMBNAIL/image/gif/0af6f37b596b7658bbd22ef41250dc78/gr9.sml gr9 gr9.sml sml 17360 131 219 IMAGE-THUMBNAIL 1-s2.0-S1872206724601853-fx1_lrg.jpg https://s3-eu-west-1.amazonaws.com/prod-ucs-content-store-eu-west/content/pii:S1872206724601853/HIGHRES/image/jpeg/fdfb6b800f66fa4ebb9a7e1fe19941f5/fx1_lrg.jpg fx1 true fx1_lrg.jpg jpg 146722 553 800 IMAGE-HIGH-RES 1-s2.0-S1872206724601853-fx2_lrg.jpg https://s3-eu-west-1.amazonaws.com/prod-ucs-content-store-eu-west/content/pii:S1872206724601853/HIGHRES/image/jpeg/91555fa65579689d07880110dc7768e2/fx2_lrg.jpg fx2 fx2_lrg.jpg jpg 68921 556 473 IMAGE-HIGH-RES 1-s2.0-S1872206724601853-fx3_lrg.jpg https://s3-eu-west-1.amazonaws.com/prod-ucs-content-store-eu-west/content/pii:S1872206724601853/HIGHRES/image/jpeg/9b2f6a734bb54795290676533e587868/fx3_lrg.jpg fx3 fx3_lrg.jpg jpg 50025 558 472 IMAGE-HIGH-RES 1-s2.0-S1872206724601853-gr1_lrg.jpg https://s3-eu-west-1.amazonaws.com/prod-ucs-content-store-eu-west/content/pii:S1872206724601853/HIGHRES/image/jpeg/1148f14db9809631a1f80afd4dc53c55/gr1_lrg.jpg gr1 gr1_lrg.jpg jpg 590103 1559 1806 IMAGE-HIGH-RES 1-s2.0-S1872206724601853-gr10_lrg.jpg https://s3-eu-west-1.amazonaws.com/prod-ucs-content-store-eu-west/content/pii:S1872206724601853/HIGHRES/image/jpeg/58f2ba457939b5795af488a08ca77ca1/gr10_lrg.jpg gr10 gr10_lrg.jpg jpg 418349 975 2031 IMAGE-HIGH-RES 1-s2.0-S1872206724601853-gr11_lrg.jpg https://s3-eu-west-1.amazonaws.com/prod-ucs-content-store-eu-west/content/pii:S1872206724601853/HIGHRES/image/jpeg/5daaad5c8d7eb97eff16361292b1c992/gr11_lrg.jpg gr11 gr11_lrg.jpg jpg 490755 890 2046 IMAGE-HIGH-RES 1-s2.0-S1872206724601853-gr2_lrg.jpg https://s3-eu-west-1.amazonaws.com/prod-ucs-content-store-eu-west/content/pii:S1872206724601853/HIGHRES/image/jpeg/107cf07641903f9c5e25928436457c2b/gr2_lrg.jpg gr2 gr2_lrg.jpg jpg 206908 1146 2055 IMAGE-HIGH-RES 1-s2.0-S1872206724601853-gr3_lrg.jpg https://s3-eu-west-1.amazonaws.com/prod-ucs-content-store-eu-west/content/pii:S1872206724601853/HIGHRES/image/jpeg/0619df3d2d11f1ab758b7eb02a9fa4a1/gr3_lrg.jpg gr3 gr3_lrg.jpg jpg 443968 1123 2040 IMAGE-HIGH-RES 1-s2.0-S1872206724601853-gr4_lrg.jpg https://s3-eu-west-1.amazonaws.com/prod-ucs-content-store-eu-west/content/pii:S1872206724601853/HIGHRES/image/jpeg/e6c1f88a729b826c135d017a0f4afff7/gr4_lrg.jpg gr4 gr4_lrg.jpg jpg 571513 1385 1999 IMAGE-HIGH-RES 1-s2.0-S1872206724601853-gr5_lrg.jpg https://s3-eu-west-1.amazonaws.com/prod-ucs-content-store-eu-west/content/pii:S1872206724601853/HIGHRES/image/jpeg/c0b79bf4f9c9ea65a4368ed33c85bf41/gr5_lrg.jpg gr5 gr5_lrg.jpg jpg 379808 1044 2045 IMAGE-HIGH-RES 1-s2.0-S1872206724601853-gr6_lrg.jpg https://s3-eu-west-1.amazonaws.com/prod-ucs-content-store-eu-west/content/pii:S1872206724601853/HIGHRES/image/jpeg/f47ed31096e046d9819240916af0c3ed/gr6_lrg.jpg gr6 gr6_lrg.jpg jpg 435844 925 2032 IMAGE-HIGH-RES 1-s2.0-S1872206724601853-gr7_lrg.jpg https://s3-eu-west-1.amazonaws.com/prod-ucs-content-store-eu-west/content/pii:S1872206724601853/HIGHRES/image/jpeg/cb8399ce26ee7da5ab0f36195b09c8a5/gr7_lrg.jpg gr7 gr7_lrg.jpg jpg 402139 1224 1982 IMAGE-HIGH-RES 1-s2.0-S1872206724601853-gr8_lrg.jpg https://s3-eu-west-1.amazonaws.com/prod-ucs-content-store-eu-west/content/pii:S1872206724601853/HIGHRES/image/jpeg/e2981d1e1615f48753e26f08eeab2c15/gr8_lrg.jpg gr8 gr8_lrg.jpg jpg 481314 938 1972 IMAGE-HIGH-RES 1-s2.0-S1872206724601853-gr9_lrg.jpg https://s3-eu-west-1.amazonaws.com/prod-ucs-content-store-eu-west/content/pii:S1872206724601853/HIGHRES/image/jpeg/e6d2d53e5963d1430ca930d7e1dea16a/gr9_lrg.jpg gr9 gr9_lrg.jpg jpg 664901 1214 2024 IMAGE-HIGH-RES CHNJC 60185 S1872-2067(24)60185-3 10.1016/S1872-2067(24)60185-3 Dalian Institute of Chemical Physics, the Chinese Academy of Sciences Fig. 1 Overview of catalyst surface reconstruction, its regulation strategies for CO2 reduction reactions, and the evolution mechanisms for CO2RR-to-C2+ products discussed in this review. Fig. 2 Schematic representation of the possible routes of CO2RR to various value-added products. CO2 is the initial reactant and CO is the key intermediate, with C2 and C3 products formed through coupling between intermediates. Arrows indicate proton and electron transfer to oxygen or carbon sites. Fig. 3 (a) Catalytic properties of the Cu nanocatalysts with different facets in CO2RR. Reprinted with permission from Ref. [43]. Copyright 2020, American Chemical Society. (b) The activation energy barrier of CO dimerization on different facets. Reprinted with permission from Ref. [42]. Copyright 2016, American Chemical Society. (c) The highest C2+/C1 ratio of polished Cu, 10-cycled Cu and 100-cycled Cu. Reprinted with permission from Ref. [45]. Copyright 2018, Springer Nature. (d) Schematic depiction of the influence of the coverage of *CO. Reprinted with permission from Ref. [41]. Copyright 2017, American Chemical Society. (e) Formation of C2H4 on the (100) facets of c-Cu2O NPs, (111) facets of o-Cu2O NPs, and (100) and (111) facets of t-Cu2O NPs. Reprinted with permission from Ref. [54]. Copyright 2020, John Wiley and Sons. Fig. 4 (a) CNs of adparticles with different sizes on various crystalline facets. Reprinted with permission from Ref. [58]. Copyright 2018, Springer Nature. (b) Better selectivity of n-propanol obtained on the catalyst with adparticles [46]. Copyright 2024, American Chemical Society. (c,d) Size dependence of catalytic performance of Cu nanocubes [60]. Copyright 2016, John Wiley and Sons. (e) Schematic diagram of manipulating CN via pulsed electrolysis. (f) CNs obtained from EXAFS. Reprinted with permission from Ref. [59]. Copyright 2024, American Chemical Society. Fig. 5 (a) The synergistic effect of Cu(0) and Cu(I) sites. Reprinted with permission from Ref. [66]. Copyright 2020, American Chemical Society. (b) Selectivity of catalysts with and without molecular doping. Reprinted with permission from Ref. [71]. Copyright 2021, Springer Nature. (c) Long-time catalytic performance with changing ratio of Cu(I). Reprinted with permission from Ref. [69]. Copyright 2015, John Wiley and Sons. (d) The ability to preserve Cu(I) of Cu-on-Cu3N catalyst characterized via in situ XAS. Reprinted with permission from Ref. [72]. Copyright 2018, Springer Nature. Fig. 6 (a) Schematic diagram of the morphology evolution of terraced field-like Cu electrode. Reprinted with permission from Ref. [78]. Copyright 2020, John Wiley and Sons. (b) Morphology evolution of Cu NCs observed with operando EC-AFM. Reprinted with permission from Ref. [4]. Copyright 2018, John Wiley and Sons. (c) Observation of the grain boundary utilizing SECCM. Reprinted with permission from Ref. [79]. Copyright 2021, Springer Nature. (d) The reconstruction mechanism of Cu NCs with two distinct stages. Reprinted with permission from Ref. [7]. Copyright 2018, Springer Nature. (e) The distortion and aggregation of Cu NPs to nanograins. (f) Size dependence of catalytic performance of Cu NPs. Reprinted with permission from Ref. [74]. Copyright 2023, Springer Nature. Fig. 7 (a) Ratio of Cu oxidation states with respect to time at –1.2 V RHE. Reprinted with permission from Ref. [23]. Copyright 2018, Springer Nature. (b) 6O and 18O contents of the Cu plates after 24 h oxidizing corrosion, measured by TOF-SIMS. (c) Schematic diagram of the reoxidation of Cu(0). Reprinted with permission from Ref. [6]. Copyright 2022, Springer Nature. (d) The Pourbaix diagram of Cu with applied potential and pH as variants. (e) EPR spectra of the corresponding solutions containing 100mmol L–1 DMPO after 24 h resting. (f) Raman spectra of surface Cu2O species at –0.3 V RHE for 10 s in the electrolyte containing KHC16O3 and H2 18O. (g) Raman spectra of carbonate species on the Cu electrode in different electrolyte. Reprinted with permission from Ref. [6]. Copyright 2022, Springer Nature. Fig. 8 (a) Reconstruction of Cu x O to metallic Cu and the ratio of low-coordinated Cu before/after the reconstruction. Reprinted with permission from Ref. [82]. Copyright 2024, John Wiley and Sons. (b) Simulated final structures for the reconstruction of CuO and Cu2O. Reprinted with permission from Ref. [35]. Copyright 2023, The American Association for the Advancement of Science. (c) Schematic diagram of confined carbon intermediates. Reprinted with permission from Ref. [83]. Copyright 2020, American Chemical Society. (d) SEM images of the Cu2P2O7 catalyst before electrolysis. (e) SEM images of the Cu2P2O7 catalyst after electrolysis. Reprinted with permission from Ref. [84]. Copyright 2021, John Wiley and Sons. Fig. 9 (a) TEM images of potential-dependent molecular-scale Cu(100) surface structure and corresponding Raman spectra. Reprinted with permission from Ref. [8]. Copyright 2023, Springer Nature. (b) HRTEM image shows three phases. (c) The behaviour of amorphous Cu in ESLIs. (d,e) Atomic-scale mechanism of surface roughening. Reprinted with permission from Ref. [88]. Copyright 2024, Springer Nature. (f) Schematic diagram of the working principle of the quantitative analysis of Cu(I) transient species. (g) Cu concentration quantified via UV-vis and ICP-MS. Reprinted with permission from Ref. [89]. Copyright 2024, Springer Nature. (h) Quasi-kinetic Monte Carlo simulations of *H and *CO coverages evolution (left) and the vertical displacement map of Cu with *H and *CO coverages as variants (right). (i) Structures with rearranged Cu atoms under different coverage of *H and *CO. (j) Possible mechanism of Cu*CO dimerization. Reprinted with permission from Ref. [86]. Copyright 2024, American Chemical Society. Fig. 10 (a) In situ SEIRAS spectra of adsorbed CO in 0.1 mol L–1 NaHCO3 and 0.1 mol L–1 KHCO3. ΔGs for hydrogenation (b) and dimerization (c) of *CO. Reprinted with permission from Ref. [92]. Copyright 2024, American Chemical Society. In situ ATR-SEIRAS collected in CO2-saturated 0.05 mol L–1 H2SO4 (d) and 0.05 mol L–1 H2SO4 + 1 mol L–1 Na2SO4 (e). Reprinted with permission from Ref. [11]. Copyright 2024, Springer Nature. (f) The dependence of band intensity of adsorbed CO2 on cation concentration. Reprinted with permission from Ref. [11]. Copyright 2024, Springer Nature. (g) Schematic illustration of the influence of different cation on *CO. Reprinted with permission from Ref. [93]. Copyright 2024, American Chemical Society. (h) TEM images showing the alkali cation-induced corrosion. (i) Voltammetric profiles of the Cu NCs recorded after electrolysis in different electrolyte. Reprinted with permission from Ref. [10]. Copyright 2024, Springer Nature. Fig. 11 (a) FE of ethylene during electrolysis using alternating “on” and “off” segments with PTFE/Cu GDE at the current density of 150 mA cm–2. Reprinted with permission from Ref. [102]. Copyright 2024, American Chemical Society. (b) Schematic diagram of reduction and reoxidation of the catalyst in pulsed electrolysis. (c) FE of C2H4 for a continuous operation and the two pulsed electrolysis experiments. Reprinted with permission from Ref. [103]. Copyright 2024, American Chemical Society. (d) A schematic illustration of the coverages of *OH, *CO and *O in different pulsed modes. Reprinted with permission from Ref. [104]. Copyright 2024, Springer Nature. (e) Mappings of the Raman spectra acquired during pulsed CORR. (f) Evolution of Raman spectra within one pulse cycle. Reprinted with permission from Ref. [105]. Copyright 2023, American Chemical Society. (g) AFM images showing the reconstructed morphology after potentiostatic or pulsed electrolysis. Reprinted with permission from Ref. [106]. Copyright 2020, Springer Nature. (h) Intensity fits of COr, COs, OHad and Cu–Oad bands obtained from SERS. Reprinted with permission from Ref. [104]. Copyright 2024, Springer Nature. Available online 10 January 2025 Review Electrochemical CO2RR to C2+ products: A vision of dynamic surfaces of Cu-based catalysts Jinxin Wang Jiaqi Zhang * Chen Chen * Engineering Research Center of Advanced Rare Earth Materials, Department of Chemistry, Tsinghua University, Beijing 100084, China Engineering Research Center of Advanced Rare Earth Materials Department of Chemistry Tsinghua University Beijing 100084 China Engineering Research Center of Advanced Rare Earth Materials, Department of Chemistry, Tsinghua University, Beijing 100084, China * Corresponding author. ABSTRACT Electrochemical reduction of CO2 (CO2RR) to form high-energy-density and high-value-added multicarbon products has attracted much attention. Selective reduction of CO2 to C2+ products face the problems of low reaction rate, complex mechanism and low selectivity. Currently, except for a few examples, copper-based catalysts are the only option capable of achieving efficient generation of C2+ products. However, the continuous dynamic reconstruction of the catalyst causes great difficulty in understanding the structure-performance relationship of CO2RR. In this review, we first discuss the mechanism of C2+ product generation. The structural factors promoting C2+ product generation are outlined, and the dynamic evolution of these structural factors is discussed. Furthermore, the effects of electrolyte and electrolysis conditions are reviewed in a vision of dynamic surface. Finally, further exploration of the reconstruction mechanism of Cu-based catalysts and the application of emerging robotic AI chemists are discussed. Graphical Abstract In CO2RR, Cu-based catalysts undergo dynamic reconstruction, impacting their structure and activity. This review provides a dynamic perspective to re-examine catalytic processes, discussing evolution mechanisms, in situ techniques, and electrolytes’ roles. Keywords Electrocatalysis CO2RR Cu-based catalyst Reconstruction Multicarbon product Structural evolution 1 Introduction The continued massive consumption of fossil fuels in modern societies has led to a range of environmental issues, including excessive CO2 emissions, which have resulted in climate change, environmental deterioration and energy crises. In this regard, electrochemical CO2 reduction can convert intermittent electricity into chemical fuels and other value-added products to partially meet the needs of modern society, which not only opens a new path for clean energy utilization, but also holds the potential to reduce the carbon footprint and close the carbon cycle [1–3]. In CO2RR, catalysts play a central role by activating inert CO2 molecules, determining reaction pathways, and improving the activity and selectivity of CO2 conversion. Among the various catalysts, metals are the most extensively studied heterogeneous CO2RR electrocatalysts, and can be classified into three categories based on the main products. Containing Bi, Sn, In, Pb, and Cd (formate as the main product), Au, Ag, and Zn (CO as the main product), and Cu (the only monometallic metal capable of generating multicarbon products with appreciable efficiency). Among these, the development and application of Cu-based catalysts have garnered significant attention due to the higher energy density and added value of the multicarbon products. However, the reaction network for generating multicarbon products is extremely complex, involving multi-step electron/proton transfer reactions and interactions among various intermediates. Moreover, it has been demonstrated that the structure of Cu-based catalysts undergoes dynamic reconstruction under operating conditions, which significantly affects their catalytic performance [4–7]. The reconstruction process is influenced by many factors (electrolyte, electrolysis mode, catalyst structure and microenvironment, etc.). These factors constrain stability and selectivity, complicating the development of structure-activity relationships. Due to dynamic evolution, the characterization of the initial catalyst based on ex situ techniques may not accurately reflect the actual catalytic sites and structure-activity relationships of CO2RR catalysts. Recent advancements in in-situ/operando characterization techniques now enable real-time monitoring of the dynamic evolution and intermediates [8–12]. Combined with density functional theory (DFT) calculations, in-situ/operando studies can help give a picture of how catalytic sites reconstruct during electrolysis and how they influence catalytic performance as well as reaction pathways. In this review, we begin with the discussion of the mechanism of C2+ product (ethylene, ethanol, acetate and propanol, etc.) generation. The structural factors promoting the generation of C2+ products (crystal surfaces, low coordination sites and oxidation states) are reviewed, and the dynamic evolution of these structural factors is discussed. Subsequently, from a perspective of dynamic surfaces, the effects of acid cation effect and pulsed electrochemical method on the catalytic performance are discussed. Finally, we look ahead to the further exploration of reconstruction mechanisms and the application of robotic AI chemists to study CO2RR (Fig. 1 ) 2 Insights into mechanisms of forming C2+ products To enhance the efficiency of catalysts to meet industrial demands, it is essential to investigate the molecular-level pathways that lead to the generation of C2+ products. The production of C2+ products through carbon dioxide reduction reactions (CO2RR) often encounters significant competition from the formation of C1 products and the hydrogen evolution reaction (HER). More precisely, the preference for producing C2+ over C1 and H2 is critically influenced by factors such as the coverage and binding strength of various intermediates, including *CO, *COOH, *CHO, and *H, on the catalyst surface. Additionally, the coupling energy barriers between these intermediates is crucial in determining the overall reaction pathway. In recent years, numerous experimental data and theoretical studies have contributed to advancing our understanding of these mechanisms. These findings have improved our understanding of this complex reaction. Nevertheless, it is important to acknowledge that despite these advances, a substantial degree of controversy and uncertainty persists in the field. 2.1 C2 pathways One of the most exciting observations in CO2RR is the coupling of two *C1 intermediates to form C–C bonds, ultimately leading to C2 products, of which ethylene, ethanol and acetic acid are the most typical examples. In the entire pathway, CO2 is first activated by a single electron transfer step to form *CO2, and is then reduced to *CO [13]. *CO is the key intermediate for C-C coupling and production of C2+ products [13–16]. In earlier studies, Schouten et al. [17] observed two different ethylene production pathways on single crystal copper surfaces: (1) At high overpotentials, the reaction mainly occurred on Cu(111), involving *CHO, which is a key intermediate in the CH4 pathway. (2) At low overpotential, the reaction mainly occurred on Cu(100) where the CO dimer intermediate was determined to produce C2 products. The two pathways have different pH dependence. Additionally, at more negative potentials, the dimerization of *CO becomes kinetically unfavourable and instead the coupling of *CO to *CHO has a lower activation energy [15]. This dimer intermediate *COCOH on Cu(100) was observed using FTIR at low overpotential, which is consistent with previous research [18,19]. Ethanol is another common C2 product in CO2RR. It is widely acknowledged that ethylene and ethanol share a set of intermediates and undergo the same reaction pathway until the formation of a key selectivity-determining intermediate, which then undergoes two branching processes to either produce ethylene or ethanol. Some studies proposed that *CH2CHO on Cu(100) is the key intermediate [20,21]. On the basis of SERS and DFT, a recent study suggested that Cu sites with distorted coordination environment and deep s-band states stabilize *OCHCH2, opening a route to ethanol [22]. Instead, Cu sites with low coordination numbers enable strong *CO binding and are mainly selective to ethylene via *CO-CO or *CO-COH couplings. Experimental phenomenon indicated acetate is not generated via *CO-CO coupling pathways [23–25]. One of the primary concerns is that CORR often shows higher selectivity for acetate, and that augmenting the partial pressure of CO can further enhance this selectivity. According to the mechanism involving *COCO, increasing the partial pressure of CO should not affect the selectivity of acetate in the C2 products but should instead lead to an overall increase in the yields of all C2 products. Bai et al. [26] proposed a new mechanism for the coupling of *CO with *COOH, which is formed by the oxidation of *CO by surface Cu-OH species, based on a combination of experiments and DFT calculations. Cai et al. [27] performed an extensive investigation into the influence of CO partial pressure on the selectivity of acetic acid. Their DFT calculations revealed that under higher CO partial pressure, the coupling of *CO with *CO2 on Cu(111) becomes more thermodynamically favourable, leading to the formation of the *COCO2 intermediate. This pathway was validated using sophisticated isotope-labelled co-reduction experiments and 1H NMR quantitative studies, in which 13CO2/CO was applied as feedstock. In addition to the aforementioned pathways, several other potential asymmetric C-C coupling pathways have been considered. Several theoretical studies demonstrated that the coupling of *CH x with *CO is thermodynamically and kinetically feasible at specific Cu sites [28,29]. Chen et al. [30] demonstrated the feasibility of coupling *CH3 with *CO on the Cu surface to form C2+ products through co-electrolysis experiments using 13CH3I and 12CO on an electropolished Cu foil. It is important to note that in the same reaction system, different reaction paths may coexist, leading to the formation of diverse products, particularly at high overpotentials. The primary reaction pathways for the C2 products described above are illustrated in Fig. 2 . 2.2 C3 pathways The formation of C3 products is constrained by low selectivity and catalytic activity. Only a limited number of examples of propanol formation have been reported, with all cases exhibiting Faraday efficiencies below 25% [31–36]. It is currently accepted that the formation of C3 products can be reasonably attributed to the formation of C1 intermediates with C2 intermediates relatively stable bound to the catalyst surface. In recent studies, the coupling of two *CO intermediates to *OCCO was hypothesised to be a key step in the formation of propanol on bicontinuous Cu2O/Cu catalysts using in situ ATR-SEIRS which directly detected *OCCO dimers [36,37]. Apart from the self-coupling among *CO intermediates, several studies observed another coupling mechanism between CO and acetaldehyde [38,39]. *CO attacks the *CH3CO derived from acetaldehyde and then a C3 intermediate *CH3COCO is formed. Chang et al. [38] demonstrated that only a minor proportion of the propanol was produced via this pathway when CORR was conducted in an electrolyte containing acetaldehyde, with the majority being generated through self-coupling between *CO intermediates. Nevertheless, the pathway of C3 products is still subject to many controversies and gaps, and some studies have proposed other possible C2 intermediates [33,40]. 3 Structural factors facilitating C2+ production The C1-C1 or C1-C2 coupling is a crucial step in the synthesis of C2+ products. It is therefore essential to systematically optimize the surface of Cu-based catalysts to regulate the adsorption strength and coverage of intermediates and thereby enhancing these coupling processes. This section will present a summary of the surface structural influences that promote the generation of C2+ products. These include crystalline facets, low-coordinated Cu sites, and the oxidation state of Cu. Notably, these structural factors evolve under practical working conditions and significantly affect the catalytic performance. Therefore, the dynamic reconstruction of Cu surfaces must be considered in the design of catalysts. 3.1 Crystalline facets The adsorption energies and coupling energy barriers of intermediates such as *CO, *COOH, *CHO and *H on different crystal surfaces display significant variations, which in turn contribute to the variations in catalytic performance and selectivity (Fig. 3(a) ). It has been demonstrated that the coverage of *CO and the interaction between *CO and *H represent the pivotal factors in the competition between the CH4 and C2H4 pathways (Fig. 3(d)) [41,42]. In general, the adsorption strengths of *CO and *H on the Cu(111) surface are favoured to CH4 production [43]. In contrast, the Cu(100) surface exhibits a higher tendency for the adsorption of *CO. DFT calculations indicate that among all the low-index crystalline surfaces, Cu(100) exhibits the lowest energy barrier for the dimerization of *CO, which is conducive to the formation of C2 products (Fig. 3(b)) [42]. Gregorio et al. [43] compared the catalytic performance of different Cu NCs with a spherical morphology, Cu(100), and Cu(111) facets in 1.0 mol L–1 KOH. A higher selectivity towards ethylene was recorded over Cu(100) catalysts (Fig. 3(a)). Based on this, selective exposure of crystalline facets represents a promising strategy for improving the selectivity of C2 products [44–46]. Jiang et al. [45] increased the exposure of Cu(100) using metal ion battery cycling method, resulting in a sixfold increase in the C2/C1 ratio of the products (Fig. 3(c)) Furthermore, high-index crystalline surfaces can enhance the selectivity of C2+ products even further [47–50]. This argument has been demonstrated by Hori et al. [47,51,52] over a series of Cu catalysts with different single-crystal facets, such as Cu(650), Cu(911), Cu(711). It is noteworthy that the interaction between different crystalline facets of the catalysts may lead to a synergistic effect [53]. Gao et al. [54] prepared three kinds of Cu NPs with different crystal facets. A better selectivity to ethylene was recorded over t-Cu2O NPs, which exposed both (100) and (111) facets (Fig. 3(e)). In situ attenuated total reflection surface-enhanced infrared absorption spectroscopy (ATR-SEIRAS), DFT calculations and in situ Raman spectroscopy were employed by Zhong et al. [55] to elucidate the enhancement of C2+ product selectivity by stepped Cu(110) and Cu(100) sites in Cu(OH)2-D/Cu foils. The (110) facet was observed to promote CO adsorption, while the (100) facet was found to facilitate C-C coupling to C2+ products. 3.2 Low-coordinated Cu sites Low-coordinated Cu sites are another structural factor that facilitates C2+ production. Actually, the coordination number may be the underlying cause of the above-mentioned facet-dependence. Different facets have different coordination numbers and different amounts of low-coordinated Cu sites, such as edges, steps, and kinks, and hence they show different selectivities and activities in CO2RR [56]. Among them, Cu sites in the high-index facets or in the boundaries between different facets have lower coordinated numbers and hence demonstrating enhanced catalytic activity towards C2+ products. Stepped sites are one of the typical morphologies of low-coordination Cu [57]. In situ ATR-SEIRAS, DFT calculations and in situ Raman spectroscopy demonstrated that stepped Cu(110) and Cu(100) sites in Cu(OH)2-D/Cu lower the C-C coupling energy barrier [55]. In addition to the stepped sites, another typical morphology of low-coordination Cu is adparticle (Fig. 4(a) ). Theoretical calculations have demonstrated that Cu adparticles with an abundance of low-coordinated Cu sites exhibit enhanced *CO binding strength, facilitate C-C coupling, and stabilize the *COCO dimer [58]. The utilisation of Cu adparticles has emerged as an effective approach for the design of Cu-based catalysts (Fig. 4(b)) [46]. In recent studies, pulsed electrolysis has been demonstrated to be an effective method for the manipulation of coordination numbers of Cu sites (Fig. 4(e)). Cu catalysts with varying coordination numbers were synthesised via cyclic voltammetry, constant potential electrolysis and pulsed electrolysis for the reduction of CuO precursors, with the coordination numbers examined by extended x-ray absorption fine structure (EXAFS) (Fig. 4(f)) [59]. The results indicated that Cu catalysts after four cycles of pulse electrolysis had excessively low coordination numbers, resulting in the production of CH4 instead of C2+ products. Conversely, Cu catalysts with intermediate coordination numbers demonstrated enhanced catalytic performance for ethylene and ethanol. In addition to modulating the surface structure, the morphology and size of the catalyst also affect the coordination number and abundance of low-coordinated Cu sites [61,62]. Specific morphologies can increase specific surface area and enhance the exposure of unsaturated Cu atoms, leading to the formation of more low-coordinated sites. As an example, copper foil surfaces treated with anodic halogenation in solutions of KCl, KBr, or KI, followed by electroreduction processes formed a high density of unsaturated Cu, which results in the selective conversion of CO2 to C2+ products with a FE of 72% [63]. A series of Cu NCs with different sizes were synthesised by Loiudice et al. [60]. It was observed that the proportion of low-coordinated edge sites increases with the reduction in the size of the nanocube (Fig. 4(d)). The selectivity of the C2+ product exhibited a gradual increase as the size of the NC was reduced to 44 nm. However, further size reduction to 24 nm led to a significant increase in competing hydrogen evolution reaction (HER), which in turn decreased C2 + product selectivity (Fig. 4(c)). Reske et al. [64] proposed that the binding of *CO and *H is too strong when there are a considerable abundance of Cu sites with CN < 8. This significantly reduces the mobility of the intermediates containing carbon, thereby limiting the subsequent hydrogenation of *CO to form hydrocarbons. This finding is consistent with previous studies indicating that Cu sites with medium coordination numbers are more effective. 3.3 Adjustment of oxidation state The CO2RR catalytic performance of Cu catalysts has been shown to depend on their oxidation state, as evidenced by numerous studies [23,65,66]. Chou et al. [66] investigated this phenomenon using a combination of SEIRS, in-situ X-ray absorption spectroscopy (XAS), and DFT calculations. Their findings indicated that CO tends to be in a bridge-adsorbed state on the surface of Cu(0) and in an atop-adsorbed state on the surface of Cu(I). The CV-treated Cu electrodes exhibited the coexistence of Cu(0) and Cu(I), with substantial coverage of both atop-adsorbed and bridge-adsorbed *CO, thereby leading to enhanced C2 selectivity (Fig. 5(a) ). Other studies highlighted the distinctive catalytic performance of the Cu(I)/Cu(0) interface from another perspective [65,67,68]. Here, Cu(0) promotes CO2 activation, while Cu(I) facilitates *CO adsorption and subsequent C-C coupling processes. Performance-time-de- pendent experiments conducted by Lee et al. [69] demonstrated that the Cu(I)/Cu(0) ratio in Cu2O decreased with increasing reaction time, accompanied by a uniform decrease in C2+ product selectivity (Fig. 5(c)). In contrast, Cu(II) is generally regarded as lacking catalytic activity for C2+ products. Tan et al. [70] have achieved the stabilization of Cu(II) by constructing atomic-scale Cu-O-Si interfaces with excellent catalytic performance for CH4. Accordingly, the impact of Cu(II) will not be discussed in this review. In conclusion, these studies have demonstrated that the preservation of Cu(I) species and a high density of Cu(I)/Cu(0) interfaces have a positive influence on the selectively generation of C2 products. The interaction between Cu and other coordination groups enhances the preservation of Cu(I) and increase the ratio of Cu(I)/Cu(0) in CO2RR, thereby optimizing the catalyst stability and the selectivity of C2+ products. In accordance with this strategy, researchers have developed numerous Cu-based precatalysts for obtaining oxidation state-adjustable surface structures through electrochemical reduction reconstruction, thereby achieving the highly selective generation of various CO2 reduction products. As an illustration, Yuan et al. [65] employed CuO/CuSiO3 as a precatalyst and observed that Cu(II) in the CuO crystalline phase was rapidly reduced to Cu(0), whereas the CuSiO3 phase retains a substantial number of Cu(I) species in the CO2RR conditions, the formation of a distinctive Cu(I)/Cu(0) interface occurs, which reaches a Faraday efficiency of 51.8% at –1.1 V RHE for up to 6 h. Furthermore, compounds such as CuI and Cu3N have also demonstrated effective preservation of Cu(I) species (Fig. 5(d)) [72,73]. Molecular doping is another strategy to stabilize Cu(I) species under cathodic potentials. Wu et al. [71] modified the surface of bimetallic silver-copper catalyst with aromatic heterocycles such as thiadiazole and triazole derivatives, which helped maintain the oxidation state of the catalyst and increased the selectivity of C2+ products (Fig. 5(b)). 4 Observation of reconstruction process using in-situ/operando techniques Despite decades of research on Cu-based catalysts in the field of CO2RR, several points of contention remain. For instance, issues such as the relatively poor reproducibility of performance testing in practice, the surface sensitivity of Cu-based materials, the impact of trace impurities in the solution, the significant cation effects of alkali metals, and the substantial role of microenvironmental control are still under debate. In CO2RR, dynamic structural reconstruction is a common phenomenon observed in Cu-based catalysts. Establishing dynamic structure-activity relationships is one of the critical directions for future development in this field. Considering these contentious issues from a dynamic perspective may provide new insights and guidance for advancing this area of research. To study the dynamic surface, in-situ/operando techniques are necessary. Dynamic structural reconstruction causes changes in key structural factors, such as crystalline facets, low-coordinated Cu sites, and oxidation state. Therefore, the actual catalytic sites may differ significantly from the structures characterized using ex-situ techniques (Fig. 6(e) ), When the reaction potential is removed, the material may rapidly revert to a back state [74]. This suggests that ex situ characterisation may give misleading information and cannot precisely reflect the real situation during CO2RR. Dynamic reconstruction affects the intermediate adsorption energy, coverage, charge transfer and microenvironment, and hence alter the catalytic reaction pathway, influencing the catalytic performance. Usually, these dynamic reconstructions are detrimental and can lead to a decrease in the selectivity of the target product and destabilize the catalyst. Even today's state-of-the-art Cu-based catalysts are far from being stable enough to meet industrial requirements, with a maximum lifetime of only a few hundred hours. However, this dynamic reconstruction can also be beneficial. Rational designs of pre-catalysts can induce the subsequent reconstruction processes to achieve the desired tuneable catalytic performance. In addition, the reconstruction process may generate new catalytic sites. Distorted copper sites form during the reconstruction process and can effectively produce ethanol by stabilizing the *OCHCH2 intermediate [22]. Therefore, in order to establish more reliable structure-effect relationships, we need to gain a deeper understanding of the dynamic surfaces of Cu catalysts and to identify the real catalytic sites, which rely on observations using in situ/operando techniques. In this section, on the basis of advanced in situ/operando characterisations, we systematically discuss the dynamic evolution of the key structural factors (morphology, crystalline facets, oxidation state, and coordination environment). It should be clarified that the dynamic changes of the different structural factors occur simultaneously. However, for ease of understanding and discussion, these factors are highlighted separately. 4.1 Morphology evolution Overall, the morphology of Cu electrocatalysts evolves in various forms, and the evolution results including deformation, corrosion, fragmentation, agglomeration, and Ostwald maturation [9,75–77]. The behavior of this morphological evolution is highly complex, especially when considering factors such as CO2 adsorption, electrolyte composition, and applied voltage. Effective techniques for characterizing morphology evolution include electrochemical atomic force microscopy (EC-AFM), electrochemical scanning tunnelling microscopy (EC-STM), and grazing incidence X-ray diffraction (GI-XRD). The entire process of morphology evolution is primarily governed by two mechanisms: the dissolution-deposition mechanism occurring on the surface of individual nanoparticles, and the fragmentation-agglomeration mechanism between nanoparticles. Potential-dependent reconstruction of the surface morphology of the Cu(100) model was tracked using operando electrochemical AFM [78]. In the OCP state, when exposed to 0.1 mol L–1 KHCO3 electrolyte, the originally smooth, terraced field-like structure was quickly covered by spherical particles or sheet-like crystals formed due to oxide deposition (Fig. 6(a)). When the applied potential was varied from 0 to –0.5 V RHE and then to –1 V RHE, the deposited copper oxides were reduced and reconstructed to form mound-like surfaces with primitive square lattices with different periods. This study not only investigated the surface structure that evolved from Cu(100) at varying potentials, but also discovered that the catalyst immersed in the electrolyte undergoes structural evolution even in the absence of a cathodic potential, which was a consequence of dissolved oxygen molecules. The dissolution-deposition process may change the exposed facets, and hence significantly influences the catalytic performance. Kim et al. [62] observed that polycrystalline Cu electrodes underwent a reconstruction process under negative potentials, initially to Cu(111) and then to Cu(100) using operando EC-STM. Additionally, GI-XRD demonstrated the transformation process of polycrystalline Cu into Cu(100) under the catalytic conditions of CO2RR [63]. Theoretical studies indicate that the coverage of *H and *CO jointly influences the reconstruction of specific crystalline surfaces, which elucidates the self-selectivity of the Cu-based catalyst obtained through electrodeposition process [7,64]. The reconstruction of facets led to new catalytic sites, which differed from the structure before electrolysis. Using operando EC-STM and DEMS, a study revealed that the Cu(polycrystalline)-Cu(100) surface undergoes reconstruction to form Cu(S)-[3(100)×(111)] stepped sites during CV tests in 0.1 mol L–1 KOH, which facilitated the formation of ethanol [59]. Catalysts with nanocubic structures (CuNCs) have excellent catalytic performance and selectivity for C2+ products [80]. The sensitivity of their performance to the catalytic environment, such as surface structure, cathodic potential and electrolyte, has received much attention. The dynamic morphological evolutions of Cu NCs loaded on carbon supports under potential control were investigated using electrochemical atomic force microscopy (AFM) (Fig. 6(b)) [4]. The initial Cu NCs were deformed even when exposed to air without applied cathodic bias. Thermodynamically, corners and edges with high curvature and higher surface energy degrade faster than flat surfaces. CO2RR electrolysis at –1.1 V RHE for 1 min results in further surface roughening, smoothing of sharp corners or edges, and reduction of edge length by about 10%. And the Faraday efficiency (especially C2H4 selectivity) of CO2RR gradually decreased with the structural transformation after electrolysis at –1.1 V RHE for 3 h. Huang et al. [7] used in situ transmission electron microscopy (TEM) to observe the structural evolution of Cu NCs on the working electrode. Based on the in-situ observation, a reconstruction mechanism involving two stages was proposed (Fig. 6(d)). In the first stage, H* or CO* intermediates adsorbed on the Cu surface induce nanoclustering, which roughens the Cu NCs while forming small nanofragments. In the second stage, nanoclustering continues and is accompanied by agglomeration. In addition, clearer structure-property relationships were revealed by in situ high-resolution scanning electrochemical cell microscopy (SECM) and electron backscattering diffraction (EBSD), which directly showed that the excellent catalytic performance of CO2 is associated with a large number of undercoordinated sites in nanograins where high geometrically necessary dislocations are present (Fig. 6(c)) [79,81]. Recently, Yang et al. [74] developed a time-resolved four-dimensional electrochemical liquid-cell scanning transmission electron microscopy (4D-STEM) operando technique and demonstrated that pre-catalyst Cu NPs deform and distort under CO2RR conditions and further aggregate to form abundant Cu-metallic nanograins (Fig. 6(e)). Further, in combination with operando XAS, the researchers illustrated the correlation between the abundance of nanograins and abundant low-coordinated Cu sites, which promotes C-C coupling and subsequent generation of C2+ products. Moreover, as the size of the pre-catalyst Cu NPs decreases, more nanograins are formed by reconstruction. The results show that the C2+ product selectivity exhibited by the 7 nm Cu NPs ensemble is 6 times higher than that of 18 nm Cu NPs (Fig. 6(f)). It is noteworthy that under ex situ conditions, the Cu catalysts after electrolysis is rapidly transformed into Cu nanocubes in the presence of moist air, with a structure very different from that under practical working conditions. This phenomenon again emphasizes the need of using in-situ or operando techniques to probe the dynamic reconstruction of the catalyst. 4.2 Evolution in oxidation state The oxidation state of Cu-based catalysts continuously evolved under practical working conditions. Pourbaix diagram for Cu provide a thermodynamic basis for predicting the most stable form of Cu in aqueous solution at a given pH and potential. As illustrated in the Pourbaix diagram (Fig. 7(d) ), the stable equilibrium phase under CO2RR conditions is Cu(0). However, this suggestion is contradicted by numerous experimental evidence. For instance, oxide-derived Cu catalysts were observed to preserve significant quantities of Cu(I) species under CO2RR conditions. This indicates that, in addition to thermodynamic factors, numerous kinetic and environmental factors in real conditions exert a considerable influence on the oxidation state of Cu. The earliest observation of the preservation of Cu(I) species in Cu2O at the reduction potential was made by Lee et al. [69]. According to the chemical properties of Cu, Cu is easily oxidized when exposed to air in the electrolyte under OCP. On the other hand, under the operating conditions with applied cathodic potential, the oxide species will be reduced to a lower valence state to some extent depending on the potential range. It should be emphasized that even during the short OCP residence time between cathodic electrolysis intervals, the low valence state is rapidly oxidized to the high valence state by the dissolved oxygen in the electrolyte. Therefore, a dynamic reduction-reoxidation process occurs over the Cu-based catalyst during CO2RR. The repeated delocalization-embedding process of lattice oxygen atoms during this cycling process, which leads to a change in the coordination environment, another important factor of the oxidation state, and thus further modulates the catalytic selectivity, as the phenomenon we observed in the structural characterization of OD-Cu. In situ XAS is widely utilized to trace the evolution of oxidation state. In recent years, numerous reports have focused on the relationship between the catalytic performance of CO2RR and the dynamic evolution of the oxidation state. Sargent et al. [23] studied the evolution of the oxidation state of CuO during CO2RR using in situ XAS and found that Cu(II) was rapidly reduced to Cu(I) in less than 5 min, whereas the reduction of Cu(I) to Cu(0) was much slower. Even when maintained at –1.2 V RHE for 1 h, the catalyst still preserved a significant proportion of the Cu(I) species (Fig. 7(a)). At room temperature, oxidizing OH radicals are readily generated in aqueous HCO3 – solutions, and the rapid oxygen exchange between HCO3 – and H2O provides a dynamic oxygen source for the formation of OH radicals (Fig. 7(c)). Using electron paramagnetic resonance (EPR), Mu et al. [6] identified highly oxidized hydroxyl (OH) radicals formed in KHCO3 solution at room temperature. By combining in situ Raman spectroscopy, secondary ion mass spectrometry, and isotopic labelling, they confirmed the dynamic reduction/reoxidation behaviour of the OD-Cu surface and showed that the rapid oxygen exchange between HCO3 – and H2O provides an oxygen source for the formation of OH radicals (Figs. 7(b), (e)–(g)). In addition, the continuous generation of OH radicals induced spontaneous oxidation of the Cu electrode, producing surface CuO x species. It is noteworthy that this work demonstrates the existence of a dynamic equilibrium between cathodic reduction and OH-induced reoxidation, which ultimately determines the oxidation state and abundance of Cu(I) during CO2RR. The evolution of the oxidation state implies the reorganization of the metal coordination environment and oxygen removal, which may cause changes in the morphology. In fact, some catalysts with rough surfaces enriched in low-coordinated Cu sites are prepared via electrochemical reconstruction during potentiostatic reduction or pulsed electrolysis [5,84,85]. In a recent study, Long et al. [35] recently investigated the reconstruction process of CuO and Cu2O at the reduction potential using molecular dynamics simulations. Due to the more vigorous oxygen removal process, CuO produces more low-coordinated Cu sites and higher surface roughness than Cu2O, which was characterized by in situ XAS as well as electrochemical tests (Fig. 8(b) ). Fang et al. [82] synthesized a series of Cu2O nanocrystals with different polyhedral shapes and found that with the increase of the number of faces of the polyhedral, the more edge sites the Cu2O nanocrystals have, the lower the coordination number of the Cu catalyst obtained after CO2RR, with better ethylene selectivity (Fig. 8(a)). This study suggests that the reconstructed Cu catalyst maintains some of the coordination properties of the pre-catalyst Cu2O, and its coordination number can be adjusted by controlling the morphology of the pre-catalyst. Wang et al. [5] found that homogeneous CuAg oxides underwent a reduction reaction under COR conditions, and the structure evolved into Ag nanoparticles encapsulated in amorphous Cu thin layers. Sang et al. [84] synthesized Cu2P2O7 catalysts, which were electrochemically reduced to the metallic state Cu, the morphology undergoes a remarkable reconstruction from agglomerated grains to highly porous structure with large electrochemically active surface area and abundant defects (Figs. 8(d) and (e)). Additionally, the morphology reconstruction also affects the oxidation state evolution. Yang et al. [83] found that the in situ formation of nanocavities in the Cu catalysts confined the carbon-containing intermediates and increased the local concentration of these intermediates, which resulted in a better ability of the cavities to preserve the Cu(I) (Fig. 8(c)). In conclusion, the oxidation state evolution process of Cu-based catalysts can be divided into two categories: first, the dynamic equilibrium between the oxidation of the catalyst surface in the presence of dissolved oxygen or OH radicals and the reduction by the cathodic current; and second, the drastic reconstruction of Cu oxides as precatalysts, which occurs in the early stage of electrolysis, and the removal of a large number of oxygen atoms that may cause the change of morphology. This process is affected by factors such as the structure of the precatalyst, the electrolyte, and the applied potential, and more seriously, there is an interference between the evolution of the oxidation state and the reconstruction of the morphology, which makes the mechanism extremely complex. 5 A vision of dynamic surfaces: Atomic-level mechanisms and the origin of catalytic activity Recently, with advancements in characterization techniques, the study of electrochemical catalytic processes has reached an atomic-level observation. By employing environmental aberration-corrected atomic-resolution electron microscopy combined with EELS spectroscopy, ultra-high-resolution mass spectrometry, and surface-enhanced Raman spectroscopy, we can piece together a more comprehensive understanding of the evolving mechanisms of copper catalysts in the CO2RR through multidimensional information. Consequently, copper-based catalysts can be examined from a new perspective: that of dynamic surfaces. This perspective is founded on our in-depth understanding of the laws governing the dynamic reconstruction processes. There are several key points: (1) What is the mechanism of the reconstruction process? How to understand the reconstruction process at the atomic level? (2) What's the result of the reconstruction? (3) What is the law of changing the catalyst surface structure during the reconstruction process? Which factors (potential, pH, electrolyte and pre-catalyst structure, etc.) can affect this process? Although there are still many gaps and controversies in this area, the efforts of researchers have achieved many exciting results. This section begins with a description of the atomic-level mechanisms of dynamic reconstruction. Then, focusing on electrolytes and electrolytic condition as two illustrative examples, we'll discuss how these factors can be understood with a vision of dynamic surfaces. 5.1 Atomic-level mechanisms of the dynamic reconstruction In order to elucidate the impact of various factors on the dynamic evolution of the surface and their underlying mechanisms, and subsequently to regulate and induce dynamic reconstruction to enhance the stability and the selectivity of C2+ products, it is essential to gain a fundamental understanding of the mechanism of dynamic reconstruction at the atomic level. In this regard, several key points have been identified: (1) the activation of Cu atoms on the surface; (2) the existence state and characteristics of activated Cu detached from the surface; and (3) the deposition process of detached Cu. Recent experimental and theoretical studies suggest that *H and *CO adsorbed on the Cu surface are the key intermediates for dynamic reconstruction, participating in the redox cycle of Cu(I)/Cu(0) [8,86,87]. Amirbeigiarab et al. [8] conducted an investigation into the reconstruction process of Cu(100) electrodes with flat terrace morphology in a CO2-saturated KHCO3 solution using in situ STM, in situ SXRD, and SERS. Cu clusters formed on the surface within the potential range where CO was simultaneously generated. During the reversible formation and dissolution process of Cu cluster, the electrode surface underwent irreversible roughening due to the formation of attached Cu atoms with vacancies (Fig. 9(a) ). In this study, it was postulated that Cu atoms were seized by adsorbed *CO. Recently, Zhang et al. [86] combined a quasi-kinetic Monte Carlo simulation and a potential-dependent grand canonical ensemble representation to track the reconstruction of Cu(100) surface during a simulated cathodic scanning period (Figs. 9(h)–(j)). Their findings suggest a potential mechanism whereby the synergistic role of *H and *CO promotes reconstruction. A chemical bonding analysis indicates that the combined effect of the weakening of the surface Cu–Cu bond by H and the coordination of the strong ligand CO at the top is responsible for the elevation of Cu*CO. In the absence of CO, Cu raised slowly with the increase of *H coverage. Instead, when CO is coordinated to Cu, Cu*CO species raised sharply with the increase of *H (Fig. 9(i)). Molecular dynamics simulations and free energy calculations revealed that the two Cu*COs may dimerize at a slightly higher potential barrier, which could be a potential mechanism for further cluster aggregation and island formation (Fig. 9(j)). The aforementioned studies have indicated that the adsorbed species *H and *CO play a role in activating the surface Cu atoms and driving further reconstruction. In order to determine the oxidation state of the activated Cu species involved in reconstruction, Vavra et al. [89] employed a combination of online MS and UV-vis absorption spectroscopy using 1,10-phenanthroline (dmphen) as ligands to investigate the dissolution-redeposition process in the reconstruction of Cu surfaces (Fig. 9(f)). Dmphen ligands were applied to capture and stabilize transient Cu(I) intermediates, facilitating the formation of photoreactive Cu(dmphen)2 +, which can be detected by UV-vis absorption spectroscopy. The experimental data indicated that the soluble, transient intermediates contained Cu(I) species (Fig. 9(g)). The researchers then hypothesize that [CuCO]+ and [Cu2C2O4]– may serve as possible intermediates, whose reductive redeposition results in the reconstruction and the roughening of Cu surface. Direct observation of the atomic dynamics of electrified solid-liquid interfaces (ESLIs) at negative potentials is very challenging because the interfaces are buried in a liquid electrolyte and techniques for in situ imaging through liquids have limited spatial resolution. In a recent study, Zhang et al. [88] developed an advanced polymer electrochemical liquid cell for TEM to monitor the atomic dynamics of the dynamic reconstruction process of ESLIs during the Cu-catalysed CO2 electroreduction reaction (Figs. 9(b)–(d)). With the change of applied potential, fluctuating liquid-like amorphous structures were observed on the surface of Cu nanowires using TEM, flowing along the Cu surface or interconverting with the crystalline phase Cu and causing surface roughening. EDS and EELS analyses of the frozen amorphous surface phases showed the presence of both Cu(0) and Cu(I) and the identification of the elements C, O, and H, which is consistent with the [CuCO]+ intermediates postulated in previous studies. At the atomic level, the researchers observed that attached atoms, atomic steps, vacancies, and ridges formed at the interface between amorphous Cu and crystalline phase Cu, and these defect sites changed dynamically with the motion of amorphous Cu (Fig. 9(d)). It is noteworthy that Cu atoms can also be removed from the atomic platforms at the interface between crystalline Cu and the electrolyte, but the resulting vacancies are rapidly refilled to obtain smooth atomic platform again. This suggests that the dynamic reconstruction of the Cu surface occurs mainly at the interface between amorphous Cu and crystalline Cu, rather than at the interface between electrolyte and crystalline Cu (Fig. 9(b)). In this study, the formation of a liquid-like amorphous structure and its atomic dynamics involved in the reconstruction of the Cu surface were observed using in situ TEM. It is intriguing to guess whether this *CO-rich amorphous Cu will act as a catalytic phase and participate in the reaction of CO2 electroreduction to form multicarbon products or not. Li et al. [90] developed an electrified operando-freezing methodology to freeze the dynamic surfaces and interfaces under CO2RR conditions for cryogenic electron microscopy (cryo-EM) imaging and EELS detection. Cu clusters and nanoparticles from fragmentation were observed after 10 mins. EELS demonstrated that these freshly formed nanoparticles were also covered by an amorphous Cu(I) layer, of which the thickness was less than 1 nm. This is consistent with the above study. Additionally, it indicated that the amorphous Cu(I) layer not only causes the roughening of Cu surfaces, but is also involved in the fragmentation and agglomeration. Further investigation is required to ascertain the role of this amorphous interface in other reconstruction modes, such as segregation, Ostwald ripening, coalescence, and so forth [91]. 5.2 Understanding the electrolyte effect In addition to the structures of catalysts, CO2RR is also influenced by environmental factors, including electrolyte, pH, and ligand modification. In previous studies on these factors, due to the limitations of theoretical computational resources, Cu catalysts have often been presented as static models. However, as previously stated, dynamic reconstruction of Cu during CO2RR universally occurs and significantly affects catalytic performance and selectivity. These environmental factors affect the water network at the catalyst interface, the local electric field and concentration of each species. It seems reasonable to posit that these alterations will affect the dynamic reconstruction, which in turn will alter the catalytic performance. An examination of the influence of these environmental factors on the dynamic surface may prove an important addition to our understanding of the effects of these factors on catalytic performance. However, only few reports researched the influence of these environmental factors on Cu surface reconstruction and their mechanisms. The cations in the electrolyte have a significant effect on the product selectivity in CO2RR. For the selectivity of C2+ products, the overall trend follows Cs+ > K+ > Na+ > Li+. Several hypotheses have been proposed to understand the underlying mechanisms [11,87,92–94]. It is usually assumed that cations in the electrical double layer alter the surface water network, which in turn affects the adsorption and activation of CO2 and its subsequent hydrogenation process. Using in situ SEIRS, it was found that the CO coverage under reaction conditions was rather lower in KHCO3 than in NaHCO3, suggesting that CO coverage is not a key factor in cation effect (Fig. 10(a) ) [92]. Further DFT calculations showed that CO2 δ– on the surface pulls K+ and Cs+, which are weakly hydrated, closer to the surface, lowering the energy barrier for *CO dimerisation and subsequent hydrogenation (Figs. 10(b) and (c)). Yang et al. [93] suggested that Li+ is more distant from the Cu surface and unlikely to coordinate with *CO + *CO. Consequently, the C-C coupling is stabilised mainly by hydrogen bonding provided by surrounding water molecules, which significantly promotes the hydrogenation of *CO and reduces the selectivity of C2 products. In contrast, the larger cation K+ can coordinate with *CO + *CO, which contributes little to the coupling barrier but creates a hydrophobic microenvironment that inhibits conversion to the C1 pathway and improves the selectivity of C2 products (Fig. 10(g)). Zhang et al. [11] investigated the cation effect of Cu-catalysed CO2RR in acidic electrolytes in combination with ATR-SEIRAS and AIMD. It was found that adsorbed CO2 and other intermediates won't be detected without the addition of alkali-metal cations, and only HER occurred (Fig. 10(d)). Contrary to common perspective, time-resolved IR spectroscopy showed that Li+ enhanced CO2 adsorption more efficiently than the other larger cations (e.g., Na+, K+, and Cs+) but slowed down the kinetics of the hydrogenation of CO2 (Figs. 10(d)–(f)). The researchers suggest that the more flexible water network surrounding the larger cations promotes water reorientation and enhances the contact between hydrogen and CO2, speeding up the hydrogenation kinetics. In a recent study, Liu et al. [10] revealed an alkali cation-induced reconstruction mechanism of Cu catalysts using in situ TEM, XAFS and CV (Fig. 10(h)). It was found that in the absence of alkali cations, the surface evolution of Cu NCs was limited to the reduction of the surface oxide layer. In contrast, in the presence of alkali metal cations, Cu NCs underwent significant morphological changes, and the depth of corrosion increased from Li+ to Cs+ (Fig. 10(i)). Based on the aforementioned principles of cation effects and reliable experimental studies on cation-induced reconstruction, along with a comparison of the key intermediate Cu*CO, we reasonably speculate that the Cu-CO-M+ structure is a primary factor contributing to the phenomenon of cation-induced reconstruction. Simple H+ ions are not sufficient to easily induce surface reconstruction of copper. The presence of cations in the solution can interact with the oxygen end of CO, pulling Cu atoms from the surface due to the solvation effect of water molecules. For Li+, its thicker hydration layer makes it difficult to coordinate with CO. Larger cations, like Cs+, due to their stronger interactions with CO, are more likely to induce surface reconstruction of the catalyst, thereby affecting the reaction pathway. As mentioned above, the surface of Cu catalysts continuously reconstructs, which is induced by *H and *CO intermediates, resulting in a dynamic formation-quenching process of the catalytic sites on the surface (low-coordinated Cu, stepped Cu sites, and Cu0/Cu1 interfaces, etc.). With this perspective of dynamic surfaces, environmental factors such as electrolytes, ligand modifications, pH, etc. can significantly affect the adsorption of *H and *CO, and thus the dynamic surfaces of Cu. Consequently, these factors are likely to change the abundance and dynamic distribution of catalytic sites, leading to different catalytic performance and selectivity. In addition, some molecular additives can also stabilize or induce the reconstruction of Cu-based catalysts, thereby altering the dynamic surfaces [95]. For example, EDTMPA can selectively absorb onto Cu(110), lowering the surface energy of Cu(110), and hence induce the transformation of other facets to (110) [96]. Methanethiol monolayers on Cu surface induced the reconstruction via reductive desorption during CO2RR, thereby increasing surface roughness [97]. A similar phenomenon of reductive desorption was observed for Cu catalysts coated with Zr-based metal-organic layers [98]. In conclusion, molecular additives can influence the reconstruction of Cu-based catalysts through adsorption, reductive desorption, or charge transfer, thereby impacting catalytic performances. 5.3 Perfecting the electrolysis conditions The surface of the Cu catalyst is subject to continuous reconstruction throughout the CO2RR process, resulting in a dynamic structure that is inherently non-equilibrium. Prolonged application of the reduction potential may result in the catalyst deviating increasingly from its initial structure. This not only leads to a loss of the expected catalytic performance or even complete loss of CO2RR catalytic activity, but also presents a challenge in identifying the real catalytic sites during the reaction. In recent years, researchers have made significant advancements in enhancing catalyst stability by designing special electrolysis conditions, including regeneration and pulse electrolysis. These methods facilitate the regeneration of active sites or induce cyclical structural changes within a narrow range, thereby improving its stability and resilience [99–102]. Regeneration represents a typical strategy for renewing catalytic activity. This is achieved by regenerating the catalytic active sites and the reaction microenvironment, thereby extending the lifetime of CO2 electrolysis. The most used regeneration method is to refresh the electrolyte in a long-term test. Furthermore, a distinctive electrolysis mode comprising alternating “on” and “off” operating segments was employed to regenerate the reactivity sites and enhance the CO2RR stability (Fig. 11(a) ) [102]. During the 15 min “off” period, the cathodic potential was removed, the Cu catalyst surface was oxidized by dissolved O2 molecules, and the restoration of the Cu oxide phase was observed using Raman spectroscopy, which led to the regeneration of the catalytic activity of ethylene. The application of the aforementioned “on-off” strategy, comprising two alternating “on” (15 min) and “off” (15 min) operating segments, extended the lifetime of CO2 electroreduction ethylene production to 200 h, with negligible or no degradation in selectivity. The output voltage of pulsed electrolysis varies between a higher and a lower potential, which is promising for the Cu catalyst to be “reset” at higher potentials to counteract the reconstruction in CO2RR. This allows for periodic alteration of the catalyst structure within a narrow range, which notably enhances stability while facilitating the identification of catalytic sites. The application of AFM revealed that the morphological change of Cu NCs after pulse electrolysis was much smaller than that of constant potential electrolysis and the structural change can be influenced by the width of the applied potential window (Fig. 11(g)) [106]. Furthermore, it was demonstrated by operando XAS that pulsed electrolysis has a good reservation ability for Cu(I) species, which can still be observed even when the reaction stops at the reduction potential pulse. Using time-resolved in situ Raman spectroscopy with a time resolution of 0.25 s, the periodic changes of *CO intermediates and the oxidation-reduction cyclic transitions of Cu x O-Cu phases were observed in real time within a single pulse cycle, using polycrystalline copper foils as a model system (Figs. 11(e) and (f)) [105]. Utilizing time-resolved in situ Raman, it was demonstrated that tuning the pulse length could optimize the surface adsorption of species on the Cu-based catalysts, particularly the co-adsorption of *OH and *CO, which significantly affects the adsorption kinetics of CO and enhances the selectivity of ethanol (Figs. 11(d) and (h)) [104]. Kok et al. [103] found that increasing the oxygen flux during pulsed electrolysis further prolonged the catalyst lifetime and reduced the time of the “off” operating segments, which improved the electrolysis efficiency (Figs. 11(b), (c)). This finding is also consistent with previous studies that have indicated that Cu(I) species may promote C2 product selectivity. The optimization of electrolysis conditions has great potential in improving catalyst stability and modulating product selectivity. In the future, it is necessary to further investigate the mechanism of the effect of electrolysis conditions on catalytic performance and to develop new electrolysis conditions, such as applying linearly varying potentials or sinusoidal potentials. 6 Summary and perspectives In summary, we have provided an overview of the dynamic surfaces of copper-based catalysts in the CO2RR. We began with the mechanisms for the formation of C2+ products and the key structural factors of Cu-based catalysts. Next, we highlighted the recent advancements in in situ characterization techniques that enhance our understanding of the reaction mechanisms and dynamic processes involved in CO2RR, summarizing the latest research on morphological changes and the evolution of oxidation states, as well as the corresponding changes in surface species and reaction mechanisms. Subsequently, from the perspective of dynamic surfaces and utilizing cutting-edge technologies, we reinterpreted the atomic-level mechanisms of reconstruction and examined the influence of electrolyte effect and electrolysis conditions from this dynamic vision. With the advancement of various in-situ and operando techniques, researchers have achieved many exciting advances. In our perspective, the future opportunities and challenges for CO2RR are as follows. 6.1 Development of multidimensional in situ observation techniques Despite the plethora of promising findings in recent years, the field of dynamic reconstructions of Cu still exhibits significant gaps in knowledge. In general, in addition to surface roughening, catalysts may undergo several reconstruction processes, including fragmentation, aggregation, Ostwald ripening, remodelling, and oxidation-reduction. These processes encompass not only the dissolution-deposition mechanism on the surface of individual nanoparticles, the atomic-level mechanism of which has recently been elucidated, but also the aggregation mechanism between nanoparticles. In order to gain a deeper understanding of these processes and to be able to control them, it is essential to gain further insight into their dynamics, in particular at the atomic level. This may require simultaneous observations at both the micro and nano scales, while utilizing advanced spectroscopic techniques to identify intermediate information, aimed at recognizing the active complexes or phases that dominate these reconstruction processes and investigating the conditions and environments under which these active complexes or phases form. Moreover, due to the surface sensitivity of copper-based materials, it is crucial to ensure that in situ observation techniques do not interfere with the normal progression of the reactions. For example, when using high-resolution liquid-phase TEM, high-energy electron beams can lead to thermal damage and radiation decomposition of the materials, particularly at atomic-level resolutions, which may cause the detected materials to deviate from real operational conditions. Therefore, developing low-beam-current, high-sensitivity sensors, employing algorithms for image enhancement, and utilizing cryo-electron microscopy to study reaction processes through time slicing can provide more information while reducing electron beam damage. Spectroelectrochemistry is also a powerful tool in studying the dynamics of CO2RR; however, it is important to note that as spectral sensitivity improves, an increasing number of “false” intermediates may interfere with the testing process. Some adsorbed species, despite their presence, may be inert and not genuinely participate in the reaction, serving merely as bystanders. Additionally, spectroscopy tends to detect strongly adsorbed species, whereas some key species may be weakly adsorbed or have short lifetimes. This necessitates that researchers advance qualitative analysis to a quantitative level while obtaining deeper insights through methods such as gas feed switching. In the future, studies using in situ high-resolution mass spectrometry may also prove to be significant. 6.2 Researching CO2RR with robotic AI chemists Robotic AI chemists consist of a superbrain built on neural networks, large language models, and high-quality DFT simulation data, along with mechanical and mobile structures designed for hands-on experimentation. In simulating calculations for reconstruction or dynamic surfaces, the effects of solvation and various ions are often overlooked due to computational resource limitations. Large-scale surface structures require substantial computational resources, which can further distance models from actual conditions. As emphasized in Section 5, electrolytes significantly impact the dynamic reconstruction of copper-based catalysts, potentially altering catalytic sites. This makes models that ignore solvation and ionic effects deviate from reality. Monte Carlo simulations serve as a powerful algorithmic tool, capable of coarse-graining atoms within the system and achieving dynamical simulations over extended timescales. Zhang et al. [86] utilized quasi-dynamic Monte Carlo simulations to reveal the evolutionary pathways of the system in coverage space during the CO2RR process on copper surfaces, exploring the recombination of surface chemical spaces with mixed adsorbates Cu*CO and Cu*H and their non-equilibrium evolution. Machine learning has a unique advantage in exploring the collective impacts of multiple variables, enabling a more accurate reflection of the relationships between various influences and catalytic performance. Several studies have demonstrated the advantages of machine learning in probing the dynamic behaviour of Cu catalysts. To realise industrial applications of CO2RR, high selectivity and long-term stability are key parameters. And these parameters are influenced various factors (electrolyte, device, electrolysis method, etc.), not only the catalyst. The use of polymer membrane electrode assemblies is expected to increase the current density and meet industrial demands, with CO2 and H2O producing multicarbon products such as ethylene, ethanol, acetic acid and n-propanol at the cathode. The goal is to improve reaction rates, single product selectivity, stability and energy efficiency performance. However, the reaction occurs at the gas-liquid-solid three-phase interface and involves many factors such as catalyst structure, microenvironment, electrolyte and various intermediates. More seriously, all these factors are under dynamic change, which poses a challenge to understand and construct more exact structure-effect relationships. For example, the Cu-based catalyst structure undergoes dynamic changes in features such as morphology and oxidation state under actual working conditions, and the microenvironment as well as the electrolyte composition also change during the CO2RR process. Moreover, these factors do not occur independently but interact with each other, which greatly increases the complexity of the reaction system. This not only makes it often difficult for theoretical models to exactly reflect the real situation, but also impairs the repeatability of experiments. In the current research context, decoupling these complex factors is quite challenging. To accelerate material development through large-scale data mining and material screening, abstracting all factors into a black box and then progressively dissecting the influencing factors using machine learning is an effective approach [107–110]. However, the effectiveness of machine learning heavily depends on the quality of the database, which is determined by the simplification and standardization of various experimental testing steps. AI chemists, who standardize and systematically complete standard tests, using comparison samples with similar structures, will generate high-quality datasets [111,112]. This process will become a powerful tool for accelerated material screening and optimization in the field of CO2RR. In summary, there is great room for progress in the study of the dynamic behaviors and evolutionary processes of copper-based materials in the understanding CO2RR. This advancement requires the development of multidimensional advanced characterization techniques, quantitative spectroscopic analyses, and the retrospective development of high-quality material datasets. We need to gain a deeper understanding of electrochemical reaction processes from a dynamic vision to guide the rational design of stable, controllable, and efficient CO2RR catalysts for the production of C2+ products in the future. References 1 W. Lai Z. Ma J. Zhang Y. Yuan Y. Qiao H. Huang Adv. Funct. Mater. 32 2022 2111193 W. Lai, Z. Ma, J. Zhang, Y. Yuan, Y. Qiao, H. Huang, Adv. Funct. Mater., 2022, 32, 2111193. 2 S. Nitopi E. Bertheussen S.B. Scott X. Liu A.K. Engstfeld S. Horch B. Seger I.E.L. Stephens K. Chan C. Hahn J.K. Norskov T.F. Jaramillo I. Chorkendorff Chem. Rev. 119 2019 7610 7672 S. Nitopi, E. Bertheussen, S. B. Scott, X. Liu, A. K. Engstfeld, S. Horch, B. Seger, I. E. L. Stephens, K. Chan, C. Hahn, J. K. Norskov, T. F. Jaramillo, I. Chorkendorff, Chem. Rev., 2019, 119, 7610–7672. 3 S. Zhu E.P. Delmo T. Li X. Qin J. Tian L. Zhang M. Shao Adv. Mater. 33 2021 2005484 S. Zhu, E. P. Delmo, T. Li, X. Qin, J. Tian, L. Zhang, M. Shao, Adv. Mater., 2021, 33, 2005484. 4 P. Grosse D. Gao F. Scholten I. Sinev H. Mistry B. Roldan Cuenya Angew. Chem. Int. Ed. 57 2018 6192 6197 P. Grosse, D. Gao, F. Scholten, I. Sinev, H. Mistry, B. Roldan Cuenya, Angew. Chem. Int. Ed., 2018, 57, 6192–6197. 5 D. Wang H.D. Jung S. Liu J. Chen H. Yang Q. He S. Xi S. Back L. Wang Nat. Commun. 15 2024 4692 D. Wang, H. D. Jung, S. Liu, J. Chen, H. Yang, Q. He, S. Xi, S. Back, L. Wang, Nat. Commun., 2024, 15, 4692. 6 S. Mu H. Lu Q. Wu L. Li R. Zhao C. Long C. Cui Nat. Commun. 13 2022 3694 S. Mu, H. Lu, Q. Wu, L. Li, R. Zhao, C. Long, C. Cui, Nat. Commun., 2022, 13, 3694. 7 J. Huang N. Hormann E. Oveisi A. Loiudice G.L. De Gregorio O. Andreussi N. Marzari R. Buonsanti Nat. Commun. 9 2018 3117 J. Huang, N. Hormann, E. Oveisi, A. Loiudice, G. L. De Gregorio, O. Andreussi, N. Marzari, R. Buonsanti, Nat. Commun., 2018, 9, 3117. 8 R. Amirbeigiarab J. Tian A. Herzog C.R. Qiu A. Bergmann B.R. Cuenya O.M. Magnussen Nat. Catal. 6 2023 837 846 R. Amirbeigiarab, J. Tian, A. Herzog, C. R. Qiu, A. Bergmann, B. R. Cuenya, O. M. Magnussen, Nat. Catal., 2023, 6, 837–846. 9 P. Grosse A. Yoon C. Rettenmaier A. Herzog S.W. Chee B. Roldan Cuenya Nat. Commun. 12 2021 6736 P. Grosse, A. Yoon, C. Rettenmaier, A. Herzog, S. W. Chee, B. Roldan Cuenya, Nat. Commun., 2021, 12, 6736. 10 S. Liu Y. Li D. Wang S. Xi H. Xu Y. Wang X. Li W. Zang W. Liu M. Su K. Yan A.C. Nielander A.B. Wong J. Lu T.F. Jaramillo L. Wang P. Canepa Q. He Nat. Commun. 15 2024 5080 S. Liu, Y. Li, D. Wang, S. Xi, H. Xu, Y. Wang, X. Li, W. Zang, W. Liu, M. Su, K. Yan, A. C. Nielander, A. B. Wong, J. Lu, T. F. Jaramillo, L. Wang, P. Canepa, Q. He, Nat. Commun., 2024, 15, 5080. 11 Z.M. Zhang T. Wang Y.C. Cai X.Y. Li J.Y. Ye Y. Zhou N. Tian Z.Y. Zhou S.G. Sun Nat. Catal. 7 2024 807 817 Z. M. Zhang, T. Wang, Y. C. Cai, X. Y. Li, J. Y. Ye, Y. Zhou, N. Tian, Z. Y. Zhou, S. G. Sun, Nat. Catal., 2024, 7, 807–817. 12 Q. Liu Q. Jiang L. Li W. Yang J. Am. Chem. Soc. 146 2024 4242 4251 Q. Liu, Q. Jiang, L. Li, W. Yang, J. Am. Chem. Soc., 2024, 146, 4242–4251. 13 M. Gattrell N. Gupta A. Co J. Electroanal. Chem. 594 2006 1 19 M. Gattrell, N. Gupta, A. Co, J. Electroanal. Chem., 2006, 594, 1–19. 14 K.J.P. Schouten Y. Kwon C.J.M. van der Ham Z. Qin M.T.M. Koper Chem. Sci. 2 2011 1902 1909 K. J. P. Schouten, Y. Kwon, C. J. M. van der Ham, Z. Qin, M. T. M. Koper, Chem. Sci., 2011, 2, 1902–1909. 15 J.D. Goodpaster A.T. Bell M. Head-Gordon J. Phys. Chem. Lett. 7 2016 1471 1477 J. D. Goodpaster, A. T. Bell, M. Head-Gordon, J. Phys. Chem. Lett., 2016, 7, 1471–1477. 16 J.H. Montoya C. Shi K. Chan J.K. Norskov J. Phys. Chem. Lett. 6 2015 2032 2037 J. H. Montoya, C. Shi, K. Chan, J. K. Norskov, J. Phys. Chem. Lett., 2015, 6, 2032–2037. 17 K.J. Schouten Z. Qin E. Perez Gallent M.T. Koper J. Am. Chem. Soc. 134 2012 9864 9867 K. J. Schouten, Z. Qin, E. Perez Gallent, M. T. Koper, J. Am. Chem. Soc., 2012, 134, 9864–9867. 18 K.J.P. Schouten E.P. Gallent M.T.M. Koper ACS Catal. 3 2013 1292 1295 K. J. P. Schouten, E. P. Gallent, M. T. M. Koper, ACS Catal., 2013, 3, 1292–1295. 19 H. Li Y. Li M.T. Koper F. Calle-Vallejo J. Am. Chem. Soc. 136 2014 15694 15701 H. Li, Y. Li, M. T. Koper, F. Calle-Vallejo, J. Am. Chem. Soc., 2014, 136, 15694–15701. 20 I. Ledezma-Yanez E.P. Gallent M.T.M. Koper F. Calle-Vallejo Catal. Today 262 2016 90 94 I. Ledezma-Yanez, E. P. Gallent, M. T. M. Koper and F. Calle-Vallejo, Catal. Today, 2016, 262, 90–94. 21 S. Hanselman M.T.M. Koper F. Calle-Vallejo ACS Energy Lett. 3 2018 1062 1067 S. Hanselman, M. T. M. Koper, F. Calle-Vallejo, ACS Energy Lett., 2018, 3, 1062–1067. 22 C. Zhan F. Dattila C. Rettenmaier A. Herzog M. Herran T. Wagner F. Scholten A. Bergmann N. López B.R. Cuenya Nat. Energy 2024 DOI: https://doi.org/10.1038/s41560-024-01633-4 C. Zhan, F. Dattila, C. Rettenmaier, A. Herzog, M. Herran, T. Wagner, F. Scholten, A. Bergmann, N. López, B. R. Cuenya, Nat. Energy, 2024, DOI: https://doi.org/10.1038/s41560-024-01633-4. 23 P. De Luna R. Quintero-Bermudez C.-T. Dinh M.B. Ross O.S. Bushuyev P. Todorović T. Regier S.O. Kelley P. Yang E.H. Sargent Nat. Catal. 1 2018 103 110 P. De Luna, R. Quintero-Bermudez, C.-T. Dinh, M. B. Ross, O. S. Bushuyev, P. Todorović, T. Regier, S. O. Kelley, P. Yang, E. H. Sargent, Nat. Catal., 2018, 1, 103–110. 24 J. Hou X. Chang J. Li B. Xu Q. Lu J. Am. Chem. Soc. 144 2022 22202 22211 J. Hou, X. Chang, J. Li, B. Xu, Q. Lu, J. Am. Chem. Soc., 2022, 144, 22202–22211. 25 J. Li Z.Y. Wang C. McCallum Y. Xu F.W. Li Y.H. Wang C.M. Gabardo C.T. Dinh T.T. Zhuang L. Wang J.Y. Howe Y. Ren E.H. Sargent D. Sinton Nat. Catal. 2 2019 1124 1131 J. Li, Z. Y. Wang, C. McCallum, Y. Xu, F. W. Li, Y. H. Wang, C. M. Gabardo, C. T. Dinh, T. T. Zhuang, L. Wang, J. Y. Howe, Y. Ren, E. H. Sargent, D. Sinton, Nat. Catal., 2019, 2, 1124–1131. 26 X.W. Bai M. He Y.F. Xu B.J. Xu Q. Lu J.L. Wang C.Y. Ling ACS Catal. 14 2024 3171 3180 X. W. Bai, M. He, Y. F. Xu, B. J. Xu, Q. Lu, J. L. Wang, C. Y. Ling, ACS Catal., 2024, 14, 3171–3180. 27 Y. Cai R. Yang J. Fu Z. Li L. Xie K. Li Y.-C. Chang S. Ding Z. Lyu J.-R. Zhang J.-J. Zhu Y. Lin W. Zhu Nat. Synth. 3 2024 891 902 Y. Cai, R. Yang, J. Fu, Z. Li, L. Xie, K. Li, Y.-C. Chang, S. Ding, Z. Lyu, J.-R. Zhang, J.-J. Zhu, Y. Lin, W. Zhu, Nat. Synth., 2024, 3, 891–902. 28 L.R.L. Ting O. Piqué S.Y. Lim M. Tanhaei F. Calle-Vallejo B.S. Yeo ACS Catal. 10 2020 4059 4069 L. R. L. Ting, O. Piqué, S. Y. Lim, M. Tanhaei, F. Calle-Vallejo, B. S. Yeo, ACS Catal., 2020, 10, 4059–4069. 29 P. Iyengar M.J. Kolb J.R. Pankhurst F. Calle-Vallejo R. Buonsanti ACS Catal. 11 2021 4456 4463 P. Iyengar, M. J. Kolb, J. R. Pankhurst, F. Calle-Vallejo, R. Buonsanti, ACS Catal., 2021, 11, 4456–4463. 30 C.B. Chen S. Yu Y. Yang S. Louisia I. Roh J.B. Jin S.P. Chen P.C. Chen Y. Shan P.D. Yang Nat. Catal. 5 2022 878 887 C. B. Chen, S. Yu, Y. Yang, S. Louisia, I. Roh, J. B. Jin, S. P. Chen, P. C. Chen, Y. Shan, P. D. Yang, Nat. Catal., 2022, 5, 878–887. 31 D. Ren N.T. Wong A.D. Handoko Y. Huang B.S. Yeo J. Phys. Chem. Lett. 7 2016 20 24 D. Ren, N. T. Wong, A. D. Handoko, Y. Huang, B. S. Yeo, J. Phys. Chem. Lett., 2016, 7, 20–24. 32 C. Peng G. Luo J. Zhang M. Chen Z. Wang T.K. Sham L. Zhang Y. Li G. Zheng Nat. Commun. 12 2021 1580 C. Peng, G. Luo, J. Zhang, M. Chen, Z. Wang, T. K. Sham, L. Zhang, Y. Li, G. Zheng, Nat. Commun., 2021, 12, 1580. 33 S. Jeong C. Huang Z. Levell R.X. Skalla W. Hong N.J. Escorcia Y. Losovyj B. Zhu A.N. Butrum-Griffith Y. Liu C.W. Li D. Reifsnyder Hickey Y. Liu X. Ye J. Am. Chem. Soc. 146 2024 4508 4520 S. Jeong, C. Huang, Z. Levell, R. X. Skalla, W. Hong, N. J. Escorcia, Y. Losovyj, B. Zhu, A. N. Butrum-Griffith, Y. Liu, C. W. Li, D. Reifsnyder Hickey, Y. Liu, X. Ye, J. Am. Chem. Soc., 2024, 146, 4508–4520. 34 T.T. Zhuang Y.J. Pang Z.Q. Liang Z.Y. Wang Y. Li C.S. Tan J. Li C.T. Dinh P. De Luna P.L. Hsieh T. Burdyny H.H. Li M.X. Liu Y.H. Wang F.W. Li A. Proppe A. Johnston D.H. Nam Z.Y. Wu Y.R. Zheng A.H. Ip H.R. Tan L.J. Chen S.H. Yu S.O. Kelley D. Sinton E.H. Sargent Nat. Catal. 1 2018 946 951 T. T. Zhuang, Y. J. Pang, Z. Q. Liang, Z. Y. Wang, Y. Li, C. S. Tan, J. Li, C. T. Dinh, P. De Luna, P. L. Hsieh, T. Burdyny, H. H. Li, M. X. Liu, Y. H. Wang, F. W. Li, A. Proppe, A. Johnston, D. H. Nam, Z. Y. Wu, Y. R. Zheng, A. H. Ip, H. R. Tan, L. J. Chen, S. H. Yu, S. O. Kelley, D. Sinton, E. H. Sargent, Nat. Catal., 2018, 1, 946–951. 35 C. Long X. Liu K. Wan Y. Jiang P. An C. Yang G. Wu W. Wang J. Guo L. Li K. Pang Q. Li C. Cui S. Liu T. Tan Z. Tang Sci. Adv. 9 2023 eadi6119 C. Long, X. Liu, K. Wan, Y. Jiang, P. An, C. Yang, G. Wu, W. Wang, J. Guo, L. Li, K. Pang, Q. Li, C. Cui, S. Liu, T. Tan, Z. Tang, Sci. Adv., 2023, 9, eadi6119. 36 R. Zhang J. Zhang S. Wang Z. Tan Y. Yang Y. Song M. Li Y. Zhao H. Wang B. Han R. Duan Angew. Chem. Int. Ed. 63 2024 e202405733 R. Zhang, J. Zhang, S. Wang, Z. Tan, Y. Yang, Y. Song, M. Li, Y. Zhao, H. Wang, B. Han, R. Duan, Angew. Chem. Int. Ed., 2024, 63, e202405733. 37 L. Chen C. Tang Y. Zheng E. Skúlason Y. Jiao J. Mater. Chem. A 10 2022 5998 6006 L. Chen, C. Tang, Y. Zheng, E. Skúlason, Y. Jiao, J. Mater. Chem. A, 2022, 10, 5998–6006. 38 X.X. Chang A. Malkani X. Yang B.J. Xu J. Am. Chem. Soc. 142 2020 2975 2983 X. X. Chang, A. Malkani, X. Yang, B. J. Xu, J. Am. Chem. Soc., 2020, 142, 2975–2983. 39 A.H.M. da Silva Q. Lenne R.E. Vos M.T.M. Koper ACS Catal. 13 2023 4339 4347 A. H. M. da Silva, Q. Lenne, R. E. Vos, M. T. M. Koper, ACS Catal., 2023, 13, 4339–4347. 40 M.T. Tang H.J. Peng J.H. Stenlid F. Abild-Pedersen J. Phys. Chem. C 125 2021 26437 26447 M. T. Tang, H. J. Peng, J. H. Stenlid, F. Abild-Pedersen, J. Phys. Chem. C, 2021, 125, 26437–26447. 41 Y. Huang A.D. Handoko P. Hirunsit B.S. Yeo ACS Catal. 7 2017 1749 1756 Y. Huang, A. D. Handoko, P. Hirunsit, B. S. Yeo, ACS Catal., 2017, 7, 1749–1756. 42 W. Luo X. Nie M.J. Janik A. Asthagiri ACS Catal. 6 2015 219 229 W. Luo, X. Nie, M. J. Janik, A. Asthagiri, ACS Catal., 2015, 6, 219–229. 43 G.L. De Gregorio T. Burdyny A. Loiudice P. Iyengar W.A. Smith R. Buonsanti ACS Catal 10 2020 4854 4862 G. L. De Gregorio, T. Burdyny, A. Loiudice, P. Iyengar, W. A. Smith, R. Buonsanti, ACS Catal, 2020, 10, 4854–4862. 44 K. Yao J. Li A. Ozden H. Wang N. Sun P. Liu W. Zhong W. Zhou J. Zhou X. Wang H. Liu Y. Liu S. Chen Y. Hu Z. Wang D. Sinton H. Liang Nat. Commun. 15 2024 1749 K. Yao, J. Li, A. Ozden, H. Wang, N. Sun, P. Liu, W. Zhong, W. Zhou, J. Zhou, X. Wang, H. Liu, Y. Liu, S. Chen, Y. Hu, Z. Wang, D. Sinton, H. Liang, Nat. Commun., 2024, 15, 1749. 45 K. Jiang R.B. Sandberg A.J. Akey X.Y. Liu D.C. Bell J.K. Norskov K.R. Chan H.T. Wang Nat. Catal. 1 2018 111 119 K. Jiang, R. B. Sandberg, A. J. Akey, X. Y. Liu, D. C. Bell, J. K. Norskov, K. R. Chan, H. T. Wang, Nat. Catal., 2018, 1, 111–119. 46 Z. Chen Z. Ma G. Fan F. Li ACS Appl. Mater. Interfaces 16 2024 35143 35154 Z. Chen, Z. Ma, G. Fan, F. Li, ACS Appl. Mater. Interfaces, 2024, 16, 35143–35154. 47 Y. Hori I. Takahashi O. Koga N. Hoshi J. Mol. Catal. A 199 2003 39 47 Y. Hori, I. Takahashi, O. Koga, N. Hoshi, J. Mol. Catal. A, 2003, 199, 39–47. 48 C.C. Chang M.S. Ku J. Phys. Chem. C 125 2021 10919 10925 C. C. Chang, M. S. Ku, J. Phys. Chem. C, 2021, 125, 10919–10925. 49 C. Hahn T. Hatsukade Y.G. Kim A. Vailionis J.H. Baricuatro D.C. Higgins S.A. Nitopi M.P. Soriaga T.F. Jaramillo Proc. Natl. Acad. Sci. U. S. A. 114 2017 5918 5923 C. Hahn, T. Hatsukade, Y. G. Kim, A. Vailionis, J. H. Baricuatro, D. C. Higgins, S. A. Nitopi, M. P. Soriaga, T. F. Jaramillo, Proc. Natl. Acad. Sci. U. S. A., 2017, 114, 5918–5923. 50 Y. Chen Z.X. Fan J. Wang C.Y. Ling W.X. Niu Z.Q. Huang G.G. Liu B. Chen Z.C. Lai X.Z. Liu B. Li Y. Zong L. Gu J.L. Wang X. Wang H. Zhang J. Am. Chem. Soc. 142 2020 12760 12766 Y. Chen, Z. X. Fan, J. Wang, C. Y. Ling, W. X. Niu, Z. Q. Huang, G. G. Liu, B. Chen, Z. C. Lai, X. Z. Liu, B. Li, Y. Zong, L. Gu, J. L. Wang, X. Wang, H. Zhang, J. Am. Chem. Soc., 2020, 142, 12760–12766. 51 I. Takahashi O. Koga N. Hoshi Y. Hori J. Electroanal. Chem. 533 2002 135 143 I. Takahashi, O. Koga, N. Hoshi, Y. Hori, J. Electroanal. Chem., 2002, 533, 135–143. 52 Y. Hori I. Takahashi O. Koga N. Hoshi J. Phys. Chem. B 106 2002 15 17 Y. Hori, I. Takahashi, O. Koga, N. Hoshi, J. Phys. Chem. B, 2002, 106, 15–17. 53 Y.G. Kim A. Javier J.H. Baricuatro M.P. Soriaga Electrocatalysis 7 2016 391 399 Y. G. Kim, A. Javier, J. H. Baricuatro, M. P. Soriaga, Electrocatalysis, 2016, 7, 391–399. 54 Y. Gao Q. Wu X. Liang Z. Wang Z. Zheng P. Wang Y. Liu Y. Dai M.H. Whangbo B. Huang Adv. Sci. 7 2020 1902820 Y. Gao, Q. Wu, X. Liang, Z. Wang, Z. Zheng, P. Wang, Y. Liu, Y. Dai, M. H. Whangbo, B. Huang, Adv. Sci., 2020, 7, 1902820. 55 D. Zhong Z.J. Zhao Q. Zhao D. Cheng B. Liu G. Zhang W. Deng H. Dong L. Zhang J. Li J. Li J. Gong Angew. Chem. Int. Ed. 60 2021 4879 4885 D. Zhong, Z. J. Zhao, Q. Zhao, D. Cheng, B. Liu, G. Zhang, W. Deng, H. Dong, L. Zhang, J. Li, J. Li, J. Gong, Angew. Chem. Int. Ed., 2021, 60, 4879–4885. 56 A.R. Woldu Z.L. Huang P.X. Zhao L.S. Hu D. Astruc Coord. Chem. Rev. 454 2022 214340 A. R. Woldu, Z. L. Huang, P. X. Zhao, L. S. Hu, D. Astruc, Coord. Chem. Rev., 2022, 454, 214340. 57 C. Choi S. Kwon T. Cheng M.J. Xu P. Tieu C. Lee J. Cai H.M. Lee X.Q. Pan X.F. Duan W.A. Goddard Y. Huang Nat. Catal. 3 2020 804 812 C. Choi, S. Kwon, T. Cheng, M. J. Xu, P. Tieu, C. Lee, J. Cai, H. M. Lee, X. Q. Pan, X. F. Duan, W. A. Goddard, Y. Huang, Nat. Catal., 2020, 3, 804–812. 58 J. Li F.L. Che Y.J. Pang C.Q. Zou J.Y. Howe T. Burdyny J.P. Edwards Y.H. Wang F.W. Li Z.Y. Wang P. De Luna C.T. Dinh T.T. Zhuang M.I. Saidaminov S. Cheng T. Wu Y.Z. Finfrock L. Ma S.H. Hsieh Y.S. Liu G.A. Botton W.F. Pong X. Du J.H. Guo T.K. Sham E.H. Sargent D. Sinton Nat. Commun. 9 2018 4614 J. Li, F. L. Che, Y. J. Pang, C. Q. Zou, J. Y. Howe, T. Burdyny, J. P. Edwards, Y. H. Wang, F. W. Li, Z. Y. Wang, P. De Luna, C. T. Dinh, T. T. Zhuang, M. I. Saidaminov, S. Cheng, T. Wu, Y. Z. Finfrock, L. Ma, S. H. Hsieh, Y. S. Liu, G. A. Botton, W. F. Pong, X. Du, J. H. Guo, T. K. Sham, E. H. Sargent, D. Sinton, Nat. Commun., 2018, 9, 4614. 59 J. Jiao X. Kang J. Yang S. Jia Y. Peng S. Liu C. Chen X. Xing M. He H. Wu B. Han J. Am. Chem. Soc. 146 2024 15917 15925 J. Jiao, X. Kang, J. Yang, S. Jia, Y. Peng, S. Liu, C. Chen, X. Xing, M. He, H. Wu, B. Han, J. Am. Chem. Soc., 2024, 146, 15917–15925. 60 A. Loiudice P. Lobaccaro E.A. Kamali T. Thao B.H. Huang J.W. Ager R. Buonsanti Angew. Chem. Int. Ed. 55 2016 5789 5792 A. Loiudice, P. Lobaccaro, E. A. Kamali, T. Thao, B. H. Huang, J. W. Ager, R. Buonsanti, Angew. Chem. Int. Ed., 2016, 55, 5789–5792. 61 W. Rong H. Zou W. Zang S. Xi S. Wei B. Long J. Hu Y. Ji L. Duan Angew. Chem. Int. Ed. 60 2021 466 472 W. Rong, H. Zou, W. Zang, S. Xi, S. Wei, B. Long, J. Hu, Y. Ji, L. Duan, Angew. Chem. Int. Ed., 2021, 60, 466–472. 62 A.D. Handoko C.W. Ong Y. Huang Z.G. Lee L.Y. Lin G.B. Panetti B.S. Yeo J. Phys. Chem. C 120 2016 20058 20067 A. D. Handoko, C. W. Ong, Y. Huang, Z. G. Lee, L. Y. Lin, G. B. Panetti, B. S. Yeo, J. Phys. Chem. C, 2016, 120, 20058–20067. 63 T. Kim G.T.R. Palmore Nat. Commun. 11 2020 3622 T. Kim, G. T. R. Palmore, Nat. Commun., 2020, 11, 3622. 64 R. Reske H. Mistry F. Behafarid B. Roldan Cuenya P. Strasser J. Am. Chem. Soc. 136 2014 6978 6986 R. Reske, H. Mistry, F. Behafarid, B. Roldan Cuenya, P. Strasser, J. Am. Chem. Soc., 2014, 136, 6978–6986. 65 X. Yuan S. Chen D. Cheng L. Li W. Zhu D. Zhong Z.J. Zhao J. Li T. Wang J. Gong Angew. Chem. Int. Ed. 60 2021 15344 15347 X. Yuan, S. Chen, D. Cheng, L. Li, W. Zhu, D. Zhong, Z. J. Zhao, J. Li, T. Wang, J. Gong, Angew. Chem. Int. Ed., 2021, 60, 15344–15347. 66 T.C. Chou C.C. Chang H.L. Yu W.Y. Yu C.L. Dong J.J. Velasco-Vélez C.H. Chuang L.C. Chen J.F. Lee J.M. Chen H.L. Wu J. Am. Chem. Soc. 142 2020 2857 2867 T. C. Chou, C. C. Chang, H. L. Yu, W. Y. Yu, C. L. Dong, J. J. Velasco-Vélez, C. H. Chuang, L. C. Chen, J. F. Lee, J. M. Chen, H. L. Wu, J. Am. Chem. Soc., 2020, 142, 2857–2867. 67 Y. Jia D. Li C. Liu T. Song L. Duan F. Li F. Li Y. Ji L. Sun K. Fan Small 20 2024 2402537 Y. Jia, D. Li, C. Liu, T. Song, L. Duan, F. Li, F. Li, Y. Ji, L. Sun, K. Fan, Small, 2024, 20, 2402537. 68 Y.L. Jiang H.B. Li C.J. Chen Y. Zheng S.Z. Qiao ACS Catal. 14 2024 8310 8316 Y. L. Jiang, H. B. Li, C. J. Chen, Y. Zheng, S. Z. Qiao, ACS Catal., 2024, 14, 8310–8316. 69 S. Lee D. Kim J. Lee Angew. Chem. Int. Ed. 54 2015 14701 14705 S. Lee, D. Kim, J. Lee, Angew. Chem. Int. Ed., 2015, 54, 14701–14705. 70 X. Tan K. Sun Z. Zhuang B. Hu Y. Zhang Q. Liu C. He Z. Xu C. Chen H. Xiao C. Chen J. Am. Chem. Soc. 145 2023 8656 8664 X. Tan, K. Sun, Z. Zhuang, B. Hu, Y. Zhang, Q. Liu, C. He, Z. Xu, C. Chen, H. Xiao, C. Chen, J. Am. Chem. Soc., 2023, 145, 8656–8664. 71 H. Wu J. Li K. Qi Y. Zhang E. Petit W. Wang V. Flaud N. Onofrio B. Rebiere L. Huang C. Salameh L. Lajaunie P. Miele D. Voiry Nat. Commun. 12 2021 7210 H. Wu, J. Li, K. Qi, Y. Zhang, E. Petit, W. Wang, V. Flaud, N. Onofrio, B. Rebiere, L. Huang, C. Salameh, L. Lajaunie, P. Miele, D. Voiry, Nat. Commun., 2021, 12, 7210. 72 Z.Q. Liang T.T. Zhuang A. Seifitokaldani J. Li C.W. Huang C.S. Tan Y. Li P. De Luna C.T. Dinh Y. Hu Q. Xiao P.L. Hsieh Y. Wang F. Li R. Quintero-Bermudez Y. Zhou P. Chen Y. Pang S.C. Lo L.J. Chen H. Tan Z. Xu S. Zhao D. Sinton E.H. Sargent Nat. Commun. 9 2018 3828 Z. Q. Liang, T. T. Zhuang, A. Seifitokaldani, J. Li, C. W. Huang, C. S. Tan, Y. Li, P. De Luna, C. T. Dinh, Y. Hu, Q. Xiao, P. L. Hsieh, Y. Wang, F. Li, R. Quintero-Bermudez, Y. Zhou, P. Chen, Y. Pang, S. C. Lo, L. J. Chen, H. Tan, Z. Xu, S. Zhao, D. Sinton, E. H. Sargent, Nat. Commun., 2018, 9, 3828. 73 D. Gao I. Sinev F. Scholten R.M. Aran-Ais N.J. Divins K. Kvashnina J. Timoshenko B. Roldan Cuenya Angew. Chem. Int. Ed. 58 2019 17047 17053 D. Gao, I. Sinev, F. Scholten, R. M. Aran-Ais, N. J. Divins, K. Kvashnina, J. Timoshenko, B. Roldan Cuenya, Angew. Chem. Int. Ed., 2019, 58, 17047–17053. 74 Y. Yang S. Louisia S. Yu J.B. Jin I. Roh C.B. Chen M.V.F. Guzman J. Feijóo P.C. Chen H.S. Wang C.J. Pollock X. Huang Y.T. Shao C. Wang D.A. Muller H.D. Abruña P.D. Yang Nature 614 2023 262 269 Y. Yang, S. Louisia, S. Yu, J. B. Jin, I. Roh, C. B. Chen, M. V. F. Guzman, J. Feijóo, P. C. Chen, H. S. Wang, C. J. Pollock, X. Huang, Y. T. Shao, C. Wang, D. A. Muller, H. D. Abruña, P. D. Yang, Nature, 2023, 614, 262–269. 75 J. Vavra T.H. Shen D. Stoian V. Tileli R. Buonsanti Angew. Chem. Int. Ed. 60 2021 1347 1354 J. Vavra, T. H. Shen, D. Stoian, V. Tileli, R. Buonsanti, Angew. Chem. Int. Ed., 2021, 60, 1347–1354. 76 S. Popovic M. Smiljanic P. Jovanovic J. Vavra R. Buonsanti N. Hodnik Angew. Chem. Int. Ed. 59 2020 14736 14746 S. Popovic, M. Smiljanic, P. Jovanovic, J. Vavra, R. Buonsanti, N. Hodnik, Angew. Chem. Int. Ed., 2020, 59, 14736–14746. 77 X. Wang K. Klingan M. Klingenhof T. Moller J. Ferreira de Araujo I. Martens A. Bagger S. Jiang J. Rossmeisl H. Dau P. Strasser Nat. Commun. 12 2021 794 X. Wang, K. Klingan, M. Klingenhof, T. Moller, J. Ferreira de Araujo, I. Martens, A. Bagger, S. Jiang, J. Rossmeisl, H. Dau, P. Strasser, Nat. Commun., 2021, 12, 794. 78 G.H. Simon C.S. Kley B. Roldan Cuenya Angew. Chem. Int. Ed. 60 2021 2561 2568 G. H. Simon, C. S. Kley, B. Roldan Cuenya, Angew. Chem. Int. Ed., 2021, 60, 2561–2568. 79 R.G. Mariano M. Kang O.J. Wahab I.J. McPherson J.A. Rabinowitz P.R. Unwin M.W. Kanan Nat. Mater. 20 2021 1000 1006 R. G. Mariano, M. Kang, O. J. Wahab, I. J. McPherson, J. A. Rabinowitz, P. R. Unwin, M. W. Kanan, Nat. Mater., 2021, 20, 1000–1006. 80 D. Kim C.S. Kley Y. Li P. Yang Proc. Natl. Acad. Sci. U. S. A. 114 2017 10560 10565 D. Kim, C. S. Kley, Y. Li, P. Yang, Proc. Natl. Acad. Sci. U. S. A., 2017, 114, 10560–10565. 81 X.H. Zhu C.Y. Wang L. Fu Cell Rep. Phys. Sci. 1 2020 100190 X. H. Zhu, C. Y. Wang, L. Fu, Cell Rep. Phys. Sci., 2020, 1, 100190. 82 W. Fang R. Lu F.M. Li C. He D. Wu K. Yue Y. Mao W. Guo B. You F. Song T. Yao Z. Wang B.Y. Xia Angew. Chem. Int. Ed. 63 2024 e202319936 W. Fang, R. Lu, F. M. Li, C. He, D. Wu, K. Yue, Y. Mao, W. Guo, B. You, F. Song, T. Yao, Z. Wang, B. Y. Xia, Angew. Chem. Int. Ed., 2024, 63, e202319936. 83 P.P. Yang X.L. Zhang F.Y. Gao Y.R. Zheng Z.Z. Niu X. Yu R. Liu Z.Z. Wu S. Qin L.P. Chi Y. Duan T. Ma X.S. Zheng J.F. Zhu H.J. Wang M.R. Gao S.H. Yu J. Am. Chem. Soc. 142 2020 6400 6408 P. P. Yang, X. L. Zhang, F. Y. Gao, Y. R. Zheng, Z. Z. Niu, X. Yu, R. Liu, Z. Z. Wu, S. Qin, L. P. Chi, Y. Duan, T. Ma, X. S. Zheng, J. F. Zhu, H. J. Wang, M. R. Gao, S. H. Yu, J. Am. Chem. Soc., 2020, 142, 6400–6408. 84 J. Sang P. Wei T. Liu H. Lv X. Ni D. Gao J. Zhang H. Li Y. Zang F. Yang Z. Liu G. Wang X. Bao Angew. Chem. Int. Ed. 61 2022 e202114238 J. Sang, P. Wei, T. Liu, H. Lv, X. Ni, D. Gao, J. Zhang, H. Li, Y. Zang, F. Yang, Z. Liu, G. Wang, X. Bao, Angew. Chem. Int. Ed., 2022, 61, e202114238. 85 C.H. He D.L. Duan J.X. Low Y. Bai Y.W. Jiang X.Y. Wang S.M. Chen R. Long L. Song Y.J. Xiong Nano Res. 16 2023 4494 4498 C. H. He, D. L. Duan, J. X. Low, Y. Bai, Y. W. Jiang, X. Y. Wang, S. M. Chen, R. Long, L. Song, Y. J. Xiong, Nano Res., 2023, 16, 4494–4498. 86 Z. Zhang W. Gee P. Sautet A.N. Alexandrova J. Am. Chem. Soc. 146 2024 16119 16127 Z. Zhang, W. Gee, P. Sautet, A. N. Alexandrova, J. Am. Chem. Soc., 2024, 146, 16119–16127. 87 X. Qin H.A. Hansen K. Honkala M.M. Melander Nat. Commun. 14 2023 7607 X. Qin, H. A. Hansen, K. Honkala, M. M. Melander, Nat. Commun., 2023, 14, 7607. 88 Q. Zhang Z. Song X. Sun Y. Liu J. Wan S.B. Betzler Q. Zheng J. Shangguan K.C. Bustillo P. Ercius P. Narang Y. Huang H. Zheng Nature 630 2024 643 647 Q. Zhang, Z. Song, X. Sun, Y. Liu, J. Wan, S. B. Betzler, Q. Zheng, J. Shangguan, K. C. Bustillo, P. Ercius, P. Narang, Y. Huang, H. Zheng, Nature, 2024, 630, 643–647. 89 J. Vavra G.P.L. Ramona F. Dattila A. Kormányos T. Priamushko P.P. Albertini A. Loiudice S. Cherevko N. Lopéz R. Buonsanti Nat. Catal. 7 2024 89 97 J. Vavra, G. P. L. Ramona, F. Dattila, A. Kormányos, T. Priamushko, P. P. Albertini, A. Loiudice, S. Cherevko, N. Lopéz, R. Buonsanti, Nat. Catal., 2024, 7, 89–97. 90 Y. Li Y. Liu Z. Zhang W. Zhou J. Xu Y. Ye Y. Peng X. Xiao W. Chiu R. Sinclair Y. Li Y. Cui Nano Lett. 24 2024 10409 10417 Y. Li, Y. Liu, Z. Zhang, W. Zhou, J. Xu, Y. Ye, Y. Peng, X. Xiao, W. Chiu, R. Sinclair, Y. Li, Y. Cui, Nano Lett., 2024, 24, 10409–10417. 91 H. Wu H. Yu Y.L. Chow P.A. Webley J. Zhang Adv. Mater. 36 2024 2403217 H. Wu, H. Yu, Y. L. Chow, P. A. Webley, J. Zhang, Adv. Mater., 2024, 36, 2403217. 92 Y.F. Xu W.Q. Gao Z.X. Chen Z.B. Yin Z.Y. Chen X.X. Chang M.J. Cheng B.J. Xu ACS Catal. 14 2024 10829 10838 Y. F. Xu, W. Q. Gao, Z. X. Chen, Z. B. Yin, Z. Y. Chen, X. X. Chang, M. J. Cheng, B. J. Xu, ACS Catal., 2024, 14, 10829–10838. 93 X.Z. Yang H.W. Ding S.N. Li S.S. Zheng J.F. Li F. Pan J. Am. Chem. Soc. 146 2024 5532 5542 X. Z. Yang, H. W. Ding, S. N. Li, S. S. Zheng, J. F. Li, F. Pan, J. Am. Chem. Soc., 2024, 146, 5532–5542. 94 B.B. Pan Y.H. Wang Y.G. Li Chem. Catal. 2 2022 1267 1276 B. B. Pan, Y. H. Wang, Y. G. Li, Chem. Catal., 2022, 2, 1267–1276. 95 H.X. Zhou W.L. Xi P. Yang H.T. Huang J. Tian M. Ratova D. Wu J. Energy Chem. 99 2024 201 222 H. X. Zhou, W. L. Xi, P. Yang, H. T. Huang, J. Tian, M. Ratova, D. Wu, J. Energy Chem., 2024, 99, 201–222. 96 Z. Han D. Han Z. Chen J. Gao G. Jiang X. Wang S. Lyu Y. Guo C. Geng L. Yin Z. Weng Q.H. Yang Nat. Commun. 13 2022 3158 Z. Han, D. Han, Z. Chen, J. Gao, G. Jiang, X. Wang, S. Lyu, Y. Guo, C. Geng, L. Yin, Z. Weng, Q. H. Yang, Nat. Commun., 2022, 13, 3158. 97 G. Iijima H. Yamaguchi T. Inomata H. Yoto M. Ito H. Masuda ACS Catal. 10 2020 15238 15249 G. Iijima, H. Yamaguchi, T. Inomata, H. Yoto, M. Ito, H. Masuda, ACS Catal., 2020, 10, 15238–15249. 98 X.R. He J.W. Chen Y.F. Xu Y. Shen Y.F. Zeng J.Y. Zhu B.J. Xu C. Wang Nano Res. 16 2023 4554 4561 X. R. He, J. W. Chen, Y. F. Xu, Y. Shen, Y. F. Zeng, J. Y. Zhu, B. J. Xu, C. Wang, Nano Res., 2023, 16, 4554–4561. 99 L. Xu X. Ma L. Wu X. Tan X. Song Q. Zhu C. Chen Q. Qian Z. Liu X. Sun S. Liu B. Han Angew. Chem. Int. Ed. 61 2022 e202210375 L. Xu, X. Ma, L. Wu, X. Tan, X. Song, Q. Zhu, C. Chen, Q. Qian, Z. Liu, X. Sun, S. Liu, B. Han, Angew. Chem. Int. Ed., 2022, 61, e202210375. 100 J.H. Wang Y.Y. Qin S.T. Jin Y. Yang J. Zhu X.T. Li X.Z. Lv J. Fu Z.J. Hong Y.Q. Su H.B. Wu J. Am. Chem. Soc. 145 2023 26213 26221 J. H. Wang, Y. Y. Qin, S. T. Jin, Y. Yang, J. Zhu, X. T. Li, X. Z. Lv, J. Fu, Z. J. Hong, Y. Q. Su, H. B. Wu, J. Am. Chem. Soc., 2023, 145, 26213–26221. 101 Z. Li L. Wang L. Sun W. Yang J. Am. Chem. Soc. 146 2024 23901 23908 Z. Li, L. Wang, L. Sun, W. Yang, J. Am. Chem. Soc., 2024, 146, 23901–23908. 102 T.N. Nguyen Z. Chen A.S. Zeraati H.S. Shiran S.M. Sadaf M.G. Kibria E.H. Sargent C.T. Dinh J. Am. Chem. Soc. 144 2022 13254 13265 T. N. Nguyen, Z. Chen, A. S. Zeraati, H. S. Shiran, S. M. Sadaf, M. G. Kibria, E. H. Sargent, C. T. Dinh, J. Am. Chem. Soc., 2022, 144, 13254–13265. 103 J. Kok J. de Ruiter W. van der Stam T. Burdyny J. Am. Chem. Soc. 146 2024 19509 19520 J. Kok, J. de Ruiter, W. van der Stam, T. Burdyny, J. Am. Chem. Soc., 2024, 146, 19509–19520. 104 A. Herzog M. Lopez Luna H.S. Jeon C. Rettenmaier P. Grosse A. Bergmann B. Roldan Cuenya Nat. Commun. 15 2024 3986 A. Herzog, M. Lopez Luna, H. S. Jeon, C. Rettenmaier, P. Grosse, A. Bergmann, B. Roldan Cuenya, Nat. Commun., 2024, 15, 3986. 105 Z. Li L. Wang T. Wang L. Sun W. Yang J. Am. Chem. Soc. 145 2023 20655 20664 Z. Li, L. Wang, T. Wang, L. Sun, W. Yang, J. Am. Chem. Soc., 2023, 145, 20655–20664. 106 R.M. Arán-Ais F. Scholten S. Kunze R. Rizo B. Roldan Cuenya Nat. Energy 5 2020 317 325 R. M. Arán-Ais, F. Scholten, S. Kunze, R. Rizo, B. Roldan Cuenya, Nat. Energy, 2020, 5, 317–325. 107 A. Tayyebi R. Mehrotra M.A. Mubarok J. Kim M. Zafari M. Tayebi D. Oh S.-h. Lee J.E. Matthews S.-M. Lee T.J. Shin G. Lee T.F. Jaramillo S.-Y. Jang J.-W. Jang Nat. Catal. 7 2024 510 521 A. Tayyebi,R. Mehrotra, M. A. Mubarok,J. Kim, M. Zafari, M. Tayebi, D. Oh, S.-h. Lee,J. E. Matthews, S.-M. Lee, T. J. Shin, G. Lee, T. F. Jaramillo, S.-Y. Jang, J.-W. Jang, Nat. Catal., 2024, 7, 510–521. 108 M. Zhong K. Tran Y. Min C. Wang Z. Wang C.T. Dinh P. De Luna Z. Yu A.S. Rasouli P. Brodersen S. Sun O. Voznyy C.S. Tan M. Askerka F. Che M. Liu A. Seifitokaldani Y. Pang S.C. Lo A. Ip Z. Ulissi E.H. Sargent Nature 581 2020 178 183 M. Zhong, K. Tran, Y. Min, C. Wang, Z. Wang, C. T. Dinh, P. De Luna, Z. Yu, A. S. Rasouli, P. Brodersen, S. Sun, O. Voznyy, C. S. Tan, M. Askerka, F. Che, M. Liu, A. Seifitokaldani, Y. Pang, S. C. Lo, A. Ip, Z. Ulissi, E. H. Sargent, Nature, 2020, 581, 178–183. 109 D.H. Mok H. Li G. Zhang C. Lee K. Jiang S. Back Nat. Commun. 14 2023 7303 D. H. Mok, H. Li, G. Zhang, C. Lee, K. Jiang, S. Back, Nat. Commun., 2023, 14, 7303. 110 Y. Qin W. Zhao C. Xia L.J. Yu F. Song J. Zhang T. Wu R. Cao S. Ding B.Y. Xia Y. Su Angew. Chem. Int. Ed. 63 2024 e202404763 Y. Qin, W. Zhao, C. Xia, L. J. Yu, F. Song, J. Zhang, T. Wu, R. Cao, S. Ding, B. Y. Xia, Y. Su, Angew. Chem. Int. Ed., 2024, 63, e202404763. 111 Q. Zhu F. Zhang Y. Huang H. Xiao L. Zhao X. Zhang T. Song X. Tang X. Li G. He B. Chong J. Zhou Y. Zhang B. Zhang J. Cao M. Luo S. Wang G. Ye W. Zhang X. Chen S. Cong D. Zhou H. Li J. Li G. Zou W. Shang J. Jiang Y. Luo Natl. Sci. Rev. 9 2022 nwac190 Q. Zhu, F. Zhang, Y. Huang, H. Xiao, L. Zhao, X. Zhang, T. Song, X. Tang, X. Li, G. He, B. Chong, J. Zhou, Y. Zhang, B. Zhang, J. Cao, M. Luo, S. Wang, G. Ye, W. Zhang, X. Chen, S. Cong, D. Zhou, H. Li, J. Li, G. Zou, W. Shang, J. Jiang, Y. Luo, Natl. Sci. Rev., 2022, 9, nwac190. 112 Q. Zhu Y. Huang D.L. Zhou L.Y. Zhao L.L. Guo R.Y. Yang Z.X. Sun M. Luo F. Zhang H.Y. Xiao X.S. Tang X.C. Zhang T. Song X. Li B.C. Chong J.Y. Zhou Y.H. Zhang B.C. Zhang J.Q. Cao G.Z. Zhang S. Wang G.L. Ye W.J. Zhang H.T. Zhao S. Cong H.R. Li L.L. Ling Z. Zhang W.W. Shang J. Jiang Y. Luo Nat. Synth. 3 2024 319 328 Q. Zhu, Y. Huang, D. L. Zhou, L. Y. Zhao, L. L. Guo, R. Y. Yang, Z. X. Sun, M. Luo, F. Zhang, H. Y. Xiao, X. S. Tang, X. C. Zhang, T. Song, X. Li, B. C. Chong, J. Y. Zhou, Y. H. Zhang, B. C. Zhang, J. Q. Cao, G. Z. Zhang, S. Wang, G. L. Ye, W. J. Zhang, H. T. Zhao, S. Cong, H. R. Li, L. L. Ling, Z. Zhang, W. W. Shang, J. Jiang, Y. Luo, Nat. Synth., 2024, 3, 319–328. Jiaqi Zhang (Department of Chemistry, Tsinghua University) received his B.S. degree from China University of Petroleum (East China) in 2020 and is currently pursuing his Ph.D. at Tsinghua University. His research focuses on nanomaterials for electrocatalysis and electrochemical synthesis. Chen Chen (Department of Chemistry, Tsinghua University) received his B.S. degree from the Department of Chemistry, Beijing Institute of Technology in 2006, and his Ph.D. degree from the Department of Chemistry, Tsinghua University in 2011. After postdoctoral work at Lawrence Berkeley National Laboratory, he joined the Department of Chemistry at Tsinghua University as an Associate Professor in 2015, and was promoted to Professor with tenure in 2021. His name is in the lists of Highly Cited Researchers 2021–2023 from Clarivate. His research interests are focused on nanomaterials for catalysis and sustainable energy.",
      "scopus-id": "85214325253",
      "coredata": {
        "eid": "1-s2.0-S1872206724601853",
        "dc:description": "ABSTRACT Electrochemical reduction of CO2 (CO2RR) to form high-energy-density and high-value-added multicarbon products has attracted much attention. Selective reduction of CO2 to C2+ products face the problems of low reaction rate, complex mechanism and low selectivity. Currently, except for a few examples, copper-based catalysts are the only option capable of achieving efficient generation of C2+ products. However, the continuous dynamic reconstruction of the catalyst causes great difficulty in understanding the structure-performance relationship of CO2RR. In this review, we first discuss the mechanism of C2+ product generation. The structural factors promoting C2+ product generation are outlined, and the dynamic evolution of these structural factors is discussed. Furthermore, the effects of electrolyte and electrolysis conditions are reviewed in a vision of dynamic surface. Finally, further exploration of the reconstruction mechanism of Cu-based catalysts and the application of emerging robotic AI chemists are discussed.",
        "openArchiveArticle": "false",
        "prism:coverDate": "2025-01-31",
        "openaccessUserLicense": null,
        "prism:aggregationType": "Journal",
        "prism:url": "https://api.elsevier.com/content/article/pii/S1872206724601853",
        "dc:creator": [
          {
            "@_fa": "true",
            "$": "Wang, Jinxin"
          },
          {
            "@_fa": "true",
            "$": "Zhang, Jiaqi"
          },
          {
            "@_fa": "true",
            "$": "Chen, Chen"
          }
        ],
        "link": [
          {
            "@_fa": "true",
            "@rel": "self",
            "@href": "https://api.elsevier.com/content/article/pii/S1872206724601853"
          },
          {
            "@_fa": "true",
            "@rel": "scidir",
            "@href": "https://www.sciencedirect.com/science/article/pii/S1872206724601853"
          }
        ],
        "dc:format": "application/json",
        "openaccessType": null,
        "pii": "S1872-2067(24)60185-3",
        "prism:volume": "68",
        "prism:publisher": "Dalian Institute of Chemical Physics, the Chinese Academy of Sciences. Published by Elsevier B.V. All rights are reserved, including those for text and data mining, AI training, and similar technologies.",
        "dc:title": "Electrochemical CO2RR to C2+ products: A vision of dynamic surfaces of Cu-based catalysts",
        "prism:copyright": "Copyright © 2025 Dalian Institute of Chemical Physics, the Chinese Academy of Sciences. Published by Elsevier B.V. All rights are reserved, including those for text and data mining, AI training, and similar technologies.",
        "openaccess": "0",
        "prism:issn": "18722067",
        "dcterms:subject": [
          {
            "@_fa": "true",
            "$": "Electrocatalysis"
          },
          {
            "@_fa": "true",
            "$": "CO2RR"
          },
          {
            "@_fa": "true",
            "$": "Cu-based catalyst"
          },
          {
            "@_fa": "true",
            "$": "Reconstruction"
          },
          {
            "@_fa": "true",
            "$": "Multicarbon product"
          },
          {
            "@_fa": "true",
            "$": "Structural evolution"
          }
        ],
        "openaccessArticle": "false",
        "prism:publicationName": "Chinese Journal of Catalysis",
        "openaccessSponsorType": null,
        "prism:pageRange": "83-102",
        "prism:endingPage": "102",
        "pubType": "rev",
        "prism:coverDisplayDate": "January 2025",
        "prism:doi": "10.1016/S1872-2067(24)60185-3",
        "prism:startingPage": "83",
        "dc:identifier": "doi:10.1016/S1872-2067(24)60185-3",
        "openaccessSponsorName": null
      },
      "objects": {
        "object": [
          {
            "@category": "standard",
            "@height": "208",
            "@width": "301",
            "@_fa": "true",
            "$": "https://api.elsevier.com/content/object/eid/1-s2.0-S1872206724601853-fx1.jpg?httpAccept=%2A%2F%2A",
            "@multimediatype": "JPEG image file",
            "@type": "IMAGE-DOWNSAMPLED",
            "@size": "33185",
            "@ref": "fx1",
            "@mimetype": "image/jpeg"
          },
          {
            "@category": "standard",
            "@height": "209",
            "@width": "178",
            "@_fa": "true",
            "$": "https://api.elsevier.com/content/object/eid/1-s2.0-S1872206724601853-fx2.jpg?httpAccept=%2A%2F%2A",
            "@multimediatype": "JPEG image file",
            "@type": "IMAGE-DOWNSAMPLED",
            "@size": "17139",
            "@ref": "fx2",
            "@mimetype": "image/jpeg"
          },
          {
            "@category": "standard",
            "@height": "209",
            "@width": "177",
            "@_fa": "true",
            "$": "https://api.elsevier.com/content/object/eid/1-s2.0-S1872206724601853-fx3.jpg?httpAccept=%2A%2F%2A",
            "@multimediatype": "JPEG image file",
            "@type": "IMAGE-DOWNSAMPLED",
            "@size": "12089",
            "@ref": "fx3",
            "@mimetype": "image/jpeg"
          },
          {
            "@category": "standard",
            "@height": "587",
            "@width": "680",
            "@_fa": "true",
            "$": "https://api.elsevier.com/content/object/eid/1-s2.0-S1872206724601853-gr1.jpg?httpAccept=%2A%2F%2A",
            "@multimediatype": "JPEG image file",
            "@type": "IMAGE-DOWNSAMPLED",
            "@size": "138690",
            "@ref": "gr1",
            "@mimetype": "image/jpeg"
          },
          {
            "@category": "standard",
            "@height": "367",
            "@width": "765",
            "@_fa": "true",
            "$": "https://api.elsevier.com/content/object/eid/1-s2.0-S1872206724601853-gr10.jpg?httpAccept=%2A%2F%2A",
            "@multimediatype": "JPEG image file",
            "@type": "IMAGE-DOWNSAMPLED",
            "@size": "101463",
            "@ref": "gr10",
            "@mimetype": "image/jpeg"
          },
          {
            "@category": "standard",
            "@height": "335",
            "@width": "770",
            "@_fa": "true",
            "$": "https://api.elsevier.com/content/object/eid/1-s2.0-S1872206724601853-gr11.jpg?httpAccept=%2A%2F%2A",
            "@multimediatype": "JPEG image file",
            "@type": "IMAGE-DOWNSAMPLED",
            "@size": "118067",
            "@ref": "gr11",
            "@mimetype": "image/jpeg"
          },
          {
            "@category": "standard",
            "@height": "432",
            "@width": "774",
            "@_fa": "true",
            "$": "https://api.elsevier.com/content/object/eid/1-s2.0-S1872206724601853-gr2.jpg?httpAccept=%2A%2F%2A",
            "@multimediatype": "JPEG image file",
            "@type": "IMAGE-DOWNSAMPLED",
            "@size": "55818",
            "@ref": "gr2",
            "@mimetype": "image/jpeg"
          },
          {
            "@category": "standard",
            "@height": "423",
            "@width": "768",
            "@_fa": "true",
            "$": "https://api.elsevier.com/content/object/eid/1-s2.0-S1872206724601853-gr3.jpg?httpAccept=%2A%2F%2A",
            "@multimediatype": "JPEG image file",
            "@type": "IMAGE-DOWNSAMPLED",
            "@size": "114745",
            "@ref": "gr3",
            "@mimetype": "image/jpeg"
          },
          {
            "@category": "standard",
            "@height": "521",
            "@width": "752",
            "@_fa": "true",
            "$": "https://api.elsevier.com/content/object/eid/1-s2.0-S1872206724601853-gr4.jpg?httpAccept=%2A%2F%2A",
            "@multimediatype": "JPEG image file",
            "@type": "IMAGE-DOWNSAMPLED",
            "@size": "139337",
            "@ref": "gr4",
            "@mimetype": "image/jpeg"
          },
          {
            "@category": "standard",
            "@height": "393",
            "@width": "770",
            "@_fa": "true",
            "$": "https://api.elsevier.com/content/object/eid/1-s2.0-S1872206724601853-gr5.jpg?httpAccept=%2A%2F%2A",
            "@multimediatype": "JPEG image file",
            "@type": "IMAGE-DOWNSAMPLED",
            "@size": "93725",
            "@ref": "gr5",
            "@mimetype": "image/jpeg"
          },
          {
            "@category": "standard",
            "@height": "348",
            "@width": "765",
            "@_fa": "true",
            "$": "https://api.elsevier.com/content/object/eid/1-s2.0-S1872206724601853-gr6.jpg?httpAccept=%2A%2F%2A",
            "@multimediatype": "JPEG image file",
            "@type": "IMAGE-DOWNSAMPLED",
            "@size": "104150",
            "@ref": "gr6",
            "@mimetype": "image/jpeg"
          },
          {
            "@category": "standard",
            "@height": "461",
            "@width": "746",
            "@_fa": "true",
            "$": "https://api.elsevier.com/content/object/eid/1-s2.0-S1872206724601853-gr7.jpg?httpAccept=%2A%2F%2A",
            "@multimediatype": "JPEG image file",
            "@type": "IMAGE-DOWNSAMPLED",
            "@size": "108927",
            "@ref": "gr7",
            "@mimetype": "image/jpeg"
          },
          {
            "@category": "standard",
            "@height": "353",
            "@width": "742",
            "@_fa": "true",
            "$": "https://api.elsevier.com/content/object/eid/1-s2.0-S1872206724601853-gr8.jpg?httpAccept=%2A%2F%2A",
            "@multimediatype": "JPEG image file",
            "@type": "IMAGE-DOWNSAMPLED",
            "@size": "113134",
            "@ref": "gr8",
            "@mimetype": "image/jpeg"
          },
          {
            "@category": "standard",
            "@height": "457",
            "@width": "762",
            "@_fa": "true",
            "$": "https://api.elsevier.com/content/object/eid/1-s2.0-S1872206724601853-gr9.jpg?httpAccept=%2A%2F%2A",
            "@multimediatype": "JPEG image file",
            "@type": "IMAGE-DOWNSAMPLED",
            "@size": "152585",
            "@ref": "gr9",
            "@mimetype": "image/jpeg"
          },
          {
            "@category": "thumbnail",
            "@height": "151",
            "@width": "219",
            "@_fa": "true",
            "$": "https://api.elsevier.com/content/object/eid/1-s2.0-S1872206724601853-fx1.sml?httpAccept=%2A%2F%2A",
            "@multimediatype": "GIF image file",
            "@type": "IMAGE-THUMBNAIL",
            "@size": "16960",
            "@ref": "fx1",
            "@mimetype": "image/gif"
          },
          {
            "@category": "thumbnail",
            "@height": "163",
            "@width": "139",
            "@_fa": "true",
            "$": "https://api.elsevier.com/content/object/eid/1-s2.0-S1872206724601853-fx2.sml?httpAccept=%2A%2F%2A",
            "@multimediatype": "GIF image file",
            "@type": "IMAGE-THUMBNAIL",
            "@size": "20234",
            "@ref": "fx2",
            "@mimetype": "image/gif"
          },
          {
            "@category": "thumbnail",
            "@height": "163",
            "@width": "138",
            "@_fa": "true",
            "$": "https://api.elsevier.com/content/object/eid/1-s2.0-S1872206724601853-fx3.sml?httpAccept=%2A%2F%2A",
            "@multimediatype": "GIF image file",
            "@type": "IMAGE-THUMBNAIL",
            "@size": "16215",
            "@ref": "fx3",
            "@mimetype": "image/gif"
          },
          {
            "@category": "thumbnail",
            "@height": "164",
            "@width": "190",
            "@_fa": "true",
            "$": "https://api.elsevier.com/content/object/eid/1-s2.0-S1872206724601853-gr1.sml?httpAccept=%2A%2F%2A",
            "@multimediatype": "GIF image file",
            "@type": "IMAGE-THUMBNAIL",
            "@size": "15879",
            "@ref": "gr1",
            "@mimetype": "image/gif"
          },
          {
            "@category": "thumbnail",
            "@height": "105",
            "@width": "219",
            "@_fa": "true",
            "$": "https://api.elsevier.com/content/object/eid/1-s2.0-S1872206724601853-gr10.sml?httpAccept=%2A%2F%2A",
            "@multimediatype": "GIF image file",
            "@type": "IMAGE-THUMBNAIL",
            "@size": "11838",
            "@ref": "gr10",
            "@mimetype": "image/gif"
          },
          {
            "@category": "thumbnail",
            "@height": "95",
            "@width": "219",
            "@_fa": "true",
            "$": "https://api.elsevier.com/content/object/eid/1-s2.0-S1872206724601853-gr11.sml?httpAccept=%2A%2F%2A",
            "@multimediatype": "GIF image file",
            "@type": "IMAGE-THUMBNAIL",
            "@size": "12180",
            "@ref": "gr11",
            "@mimetype": "image/gif"
          },
          {
            "@category": "thumbnail",
            "@height": "122",
            "@width": "219",
            "@_fa": "true",
            "$": "https://api.elsevier.com/content/object/eid/1-s2.0-S1872206724601853-gr2.sml?httpAccept=%2A%2F%2A",
            "@multimediatype": "GIF image file",
            "@type": "IMAGE-THUMBNAIL",
            "@size": "8004",
            "@ref": "gr2",
            "@mimetype": "image/gif"
          },
          {
            "@category": "thumbnail",
            "@height": "121",
            "@width": "219",
            "@_fa": "true",
            "$": "https://api.elsevier.com/content/object/eid/1-s2.0-S1872206724601853-gr3.sml?httpAccept=%2A%2F%2A",
            "@multimediatype": "GIF image file",
            "@type": "IMAGE-THUMBNAIL",
            "@size": "12553",
            "@ref": "gr3",
            "@mimetype": "image/gif"
          },
          {
            "@category": "thumbnail",
            "@height": "152",
            "@width": "219",
            "@_fa": "true",
            "$": "https://api.elsevier.com/content/object/eid/1-s2.0-S1872206724601853-gr4.sml?httpAccept=%2A%2F%2A",
            "@multimediatype": "GIF image file",
            "@type": "IMAGE-THUMBNAIL",
            "@size": "16944",
            "@ref": "gr4",
            "@mimetype": "image/gif"
          },
          {
            "@category": "thumbnail",
            "@height": "112",
            "@width": "219",
            "@_fa": "true",
            "$": "https://api.elsevier.com/content/object/eid/1-s2.0-S1872206724601853-gr5.sml?httpAccept=%2A%2F%2A",
            "@multimediatype": "GIF image file",
            "@type": "IMAGE-THUMBNAIL",
            "@size": "10458",
            "@ref": "gr5",
            "@mimetype": "image/gif"
          },
          {
            "@category": "thumbnail",
            "@height": "100",
            "@width": "219",
            "@_fa": "true",
            "$": "https://api.elsevier.com/content/object/eid/1-s2.0-S1872206724601853-gr6.sml?httpAccept=%2A%2F%2A",
            "@multimediatype": "GIF image file",
            "@type": "IMAGE-THUMBNAIL",
            "@size": "13104",
            "@ref": "gr6",
            "@mimetype": "image/gif"
          },
          {
            "@category": "thumbnail",
            "@height": "135",
            "@width": "219",
            "@_fa": "true",
            "$": "https://api.elsevier.com/content/object/eid/1-s2.0-S1872206724601853-gr7.sml?httpAccept=%2A%2F%2A",
            "@multimediatype": "GIF image file",
            "@type": "IMAGE-THUMBNAIL",
            "@size": "11131",
            "@ref": "gr7",
            "@mimetype": "image/gif"
          },
          {
            "@category": "thumbnail",
            "@height": "104",
            "@width": "219",
            "@_fa": "true",
            "$": "https://api.elsevier.com/content/object/eid/1-s2.0-S1872206724601853-gr8.sml?httpAccept=%2A%2F%2A",
            "@multimediatype": "GIF image file",
            "@type": "IMAGE-THUMBNAIL",
            "@size": "13969",
            "@ref": "gr8",
            "@mimetype": "image/gif"
          },
          {
            "@category": "thumbnail",
            "@height": "131",
            "@width": "219",
            "@_fa": "true",
            "$": "https://api.elsevier.com/content/object/eid/1-s2.0-S1872206724601853-gr9.sml?httpAccept=%2A%2F%2A",
            "@multimediatype": "GIF image file",
            "@type": "IMAGE-THUMBNAIL",
            "@size": "17360",
            "@ref": "gr9",
            "@mimetype": "image/gif"
          },
          {
            "@category": "high",
            "@height": "553",
            "@width": "800",
            "@_fa": "true",
            "$": "https://api.elsevier.com/content/object/eid/1-s2.0-S1872206724601853-fx1_lrg.jpg?httpAccept=%2A%2F%2A",
            "@multimediatype": "JPEG image file",
            "@type": "IMAGE-HIGH-RES",
            "@size": "146722",
            "@ref": "fx1",
            "@mimetype": "image/jpeg"
          },
          {
            "@category": "high",
            "@height": "556",
            "@width": "473",
            "@_fa": "true",
            "$": "https://api.elsevier.com/content/object/eid/1-s2.0-S1872206724601853-fx2_lrg.jpg?httpAccept=%2A%2F%2A",
            "@multimediatype": "JPEG image file",
            "@type": "IMAGE-HIGH-RES",
            "@size": "68921",
            "@ref": "fx2",
            "@mimetype": "image/jpeg"
          },
          {
            "@category": "high",
            "@height": "558",
            "@width": "472",
            "@_fa": "true",
            "$": "https://api.elsevier.com/content/object/eid/1-s2.0-S1872206724601853-fx3_lrg.jpg?httpAccept=%2A%2F%2A",
            "@multimediatype": "JPEG image file",
            "@type": "IMAGE-HIGH-RES",
            "@size": "50025",
            "@ref": "fx3",
            "@mimetype": "image/jpeg"
          },
          {
            "@category": "high",
            "@height": "1559",
            "@width": "1806",
            "@_fa": "true",
            "$": "https://api.elsevier.com/content/object/eid/1-s2.0-S1872206724601853-gr1_lrg.jpg?httpAccept=%2A%2F%2A",
            "@multimediatype": "JPEG image file",
            "@type": "IMAGE-HIGH-RES",
            "@size": "590103",
            "@ref": "gr1",
            "@mimetype": "image/jpeg"
          },
          {
            "@category": "high",
            "@height": "975",
            "@width": "2031",
            "@_fa": "true",
            "$": "https://api.elsevier.com/content/object/eid/1-s2.0-S1872206724601853-gr10_lrg.jpg?httpAccept=%2A%2F%2A",
            "@multimediatype": "JPEG image file",
            "@type": "IMAGE-HIGH-RES",
            "@size": "418349",
            "@ref": "gr10",
            "@mimetype": "image/jpeg"
          },
          {
            "@category": "high",
            "@height": "890",
            "@width": "2046",
            "@_fa": "true",
            "$": "https://api.elsevier.com/content/object/eid/1-s2.0-S1872206724601853-gr11_lrg.jpg?httpAccept=%2A%2F%2A",
            "@multimediatype": "JPEG image file",
            "@type": "IMAGE-HIGH-RES",
            "@size": "490755",
            "@ref": "gr11",
            "@mimetype": "image/jpeg"
          },
          {
            "@category": "high",
            "@height": "1146",
            "@width": "2055",
            "@_fa": "true",
            "$": "https://api.elsevier.com/content/object/eid/1-s2.0-S1872206724601853-gr2_lrg.jpg?httpAccept=%2A%2F%2A",
            "@multimediatype": "JPEG image file",
            "@type": "IMAGE-HIGH-RES",
            "@size": "206908",
            "@ref": "gr2",
            "@mimetype": "image/jpeg"
          },
          {
            "@category": "high",
            "@height": "1123",
            "@width": "2040",
            "@_fa": "true",
            "$": "https://api.elsevier.com/content/object/eid/1-s2.0-S1872206724601853-gr3_lrg.jpg?httpAccept=%2A%2F%2A",
            "@multimediatype": "JPEG image file",
            "@type": "IMAGE-HIGH-RES",
            "@size": "443968",
            "@ref": "gr3",
            "@mimetype": "image/jpeg"
          },
          {
            "@category": "high",
            "@height": "1385",
            "@width": "1999",
            "@_fa": "true",
            "$": "https://api.elsevier.com/content/object/eid/1-s2.0-S1872206724601853-gr4_lrg.jpg?httpAccept=%2A%2F%2A",
            "@multimediatype": "JPEG image file",
            "@type": "IMAGE-HIGH-RES",
            "@size": "571513",
            "@ref": "gr4",
            "@mimetype": "image/jpeg"
          },
          {
            "@category": "high",
            "@height": "1044",
            "@width": "2045",
            "@_fa": "true",
            "$": "https://api.elsevier.com/content/object/eid/1-s2.0-S1872206724601853-gr5_lrg.jpg?httpAccept=%2A%2F%2A",
            "@multimediatype": "JPEG image file",
            "@type": "IMAGE-HIGH-RES",
            "@size": "379808",
            "@ref": "gr5",
            "@mimetype": "image/jpeg"
          },
          {
            "@category": "high",
            "@height": "925",
            "@width": "2032",
            "@_fa": "true",
            "$": "https://api.elsevier.com/content/object/eid/1-s2.0-S1872206724601853-gr6_lrg.jpg?httpAccept=%2A%2F%2A",
            "@multimediatype": "JPEG image file",
            "@type": "IMAGE-HIGH-RES",
            "@size": "435844",
            "@ref": "gr6",
            "@mimetype": "image/jpeg"
          },
          {
            "@category": "high",
            "@height": "1224",
            "@width": "1982",
            "@_fa": "true",
            "$": "https://api.elsevier.com/content/object/eid/1-s2.0-S1872206724601853-gr7_lrg.jpg?httpAccept=%2A%2F%2A",
            "@multimediatype": "JPEG image file",
            "@type": "IMAGE-HIGH-RES",
            "@size": "402139",
            "@ref": "gr7",
            "@mimetype": "image/jpeg"
          },
          {
            "@category": "high",
            "@height": "938",
            "@width": "1972",
            "@_fa": "true",
            "$": "https://api.elsevier.com/content/object/eid/1-s2.0-S1872206724601853-gr8_lrg.jpg?httpAccept=%2A%2F%2A",
            "@multimediatype": "JPEG image file",
            "@type": "IMAGE-HIGH-RES",
            "@size": "481314",
            "@ref": "gr8",
            "@mimetype": "image/jpeg"
          },
          {
            "@category": "high",
            "@height": "1214",
            "@width": "2024",
            "@_fa": "true",
            "$": "https://api.elsevier.com/content/object/eid/1-s2.0-S1872206724601853-gr9_lrg.jpg?httpAccept=%2A%2F%2A",
            "@multimediatype": "JPEG image file",
            "@type": "IMAGE-HIGH-RES",
            "@size": "664901",
            "@ref": "gr9",
            "@mimetype": "image/jpeg"
          }
        ]
      },
      "link": {
        "@rel": "abstract",
        "@href": "https://api.elsevier.com/content/abstract/scopus_id/85214325253"
      }
    }
  }
}