{
  "metadata": {
    "title": "Recent progress in electronic modulation of electrocatalysts for high-efficient polysulfide conversion of Li-S batteries",
    "authors": "; ; ",
    "journal": "Chinese Journal of Catalysis",
    "date": "2022-12-31",
    "doi": "10.1016/S1872-2067(21)63984-0",
    "abstract": "",
    "uri": "https://api.elsevier.com/content/article/pii/S1872206721639840",
    "pii": "S1872206721639840"
  },
  "fulltext": {
    "full-text-retrieval-response": {
      "scopus-eid": "2-s2.0-85141529936",
      "originalText": "serial JL 273538 291210 291744 291809 31 Chinese Journal of Catalysis CHINESEJOURNALCATALYSIS 2022-11-09 2022-11-09 2022-11-09 2022-11-09 2023-01-18T15:58:50 1-s2.0-S1872206721639840 S1872-2067(21)63984-0 S1872206721639840 10.1016/S1872-2067(21)63984-0 S300 S300.2 FULL-TEXT 1-s2.0-S1872206722X00120 2024-05-28T11:27:55.740965Z 0 0 20221201 20221231 2022 2022-11-09T09:21:12.533395Z absattachment articleinfo articletitlenorm authfirstinitialnorm authfirstsurnamenorm cid cids contenttype copyright crossmark dateloaded dateloadedtxt datesearch datesort dateupdated dco docsubtype doctype doi eid ewtransactionid hubeid indexeddate issfirst issn issnnorm issuelist itemstage itemtransactionid itemweight openaccess openarchive pg pgfirst pglast pii piinorm pubdateend pubdatestart pubdatetxt pubyr sortorder srctitle srctitlenorm srctype ssids alllist content subj subheadings tomb volfirst volissue volumelist webpdf webpdfpagecount yearnav figure body affil articletitle auth authfirstini authfull authkeywords authlast grantnumber grantsponsor primabst pubtype ref specialabst 1872-2067 18722067 true 43 43 12 12 Volume 43, Issue 12 3 2946 2965 2946 2965 202212 December 2022 2022-12-01 2022-12-31 2022 article rev Copyright © 2022 Dalian Institute of Chemical Physics, the Chinese Academy of Sciences. Published by Elsevier B.V. All rights reserved. RECENTPROGRESSINELECTRONICMODULATIONELECTROCATALYSTSFORHIGHEFFICIENTPOLYSULFIDECONVERSIONLISBATTERIES ZENG P 1 Introduction 2 Principles of sulfur redox reactions and roles of catalytic materials 3 Electronic structure engineering of electrocatalysts 3.1 Vacancy engineering 3.1.1 Anion vacancies 3.1.2 Cation vacancies 3.2 Heteroatom doping 3.2.1 Anion-doped carbon 3.2.2 Anion-doped metal compounds 3.2.3 Cation (metal ion) doped compounds 3.2.4 Single atom doping 3.3 Band engineering 3.4 Alloying engineering 3.5 Heterostructures 4 Conclusions and future outlook References ZENG 2022 425 432 P ZENG 2021 18526 18536 P CAMERON 2021 5863 5883 J DING 2019 1 28 Y YANG 2018 239 293 X LI 2018 1801323 X YANG 2020 2140 2195 X YUAN 2021 105928 C LI 2021 1142 1188 Y LI 2018 3 7 G HWANG 2014 53 62 S LEE 2019 9607 9619 J XUE 2016 4915 4923 H HWANG 2015 8351 8355 S HU 2020 2002180 A QI 2021 2100387 F LIAN 2021 11063 11071 J SU 2022 132167 H XIAO 2021 16692 16698 T HUA 2021 2101006 W ZHAO 2020 12636 12652 M CHEN 2018 1702348 W SHIN 2020 2001456 H GUO 2021 2010499 J CHENG 2017 258 270 X ZHANG 2018 764 777 R YU 2021 1358 1369 B CHENG 2017 10403 10473 X ZHOU 2021 141 156 S LIN 2013 2829 2833 Z SONG 2013 2186 2204 M YANG 2013 3018 3032 Y NG 2021 2008654 S GUO 2021 3031 W WAN 2021 862 868 H LIU 2021 2100065 K ALZAHRANI 2021 413 418 A TANTIS 2021 2101326 I ZHANG 2019 491 497 Y FENG 2014 518 521 Z ZHANG 2021 2100432 C ZHANG 2021 2100793 B XIANG 2021 14313 14318 J LI 2021 3102 R YAN 2021 130316 W SAROHA 2021 11651 11664 R WANG 2021 2010693 L QIAN 2021 2100810 J MA 2021 23936 23944 Z ZHANG 2021 106094 X BALACH 2016 317 324 J ZHOU 2015 641 647 G UMMETHALA 2018 206 215 R FANG 2016 3374 3382 R CHUNG 2016 10462 10470 S SUN 2015 10539 10544 Q ZHANG 2010 1531 1537 B XIN 2012 18510 18513 S LI 2014 1301473 Z ZHENG 2014 4842 S DU 2016 2690 2694 W CHUNG 2018 710 724 S HE 2018 36 43 J XIANG 2017 18020 18028 M BAO 2012 3246 3252 L ELAZARI 2011 5641 5644 R LI 2017 655 662 X WEISEH 2013 1331 Z HE 2017 1702707 J YAO 2017 1602923 X ESHETU 2017 15368 15372 G ZHANG 2019 1900763 H SHIN 2019 1900938 M WANG 2020 2000791 W CHEN 2020 2000049 H ZHAI 2020 23344 23353 P LIN 2021 9665 9674 Y ZHANG 2021 5233 5239 Z ZHANG 2017 13779 13785 X SU 2017 1602014 D PEI 2017 482 F YAN 2018 1801066 M OGOKE 2019 13389 13399 O LI 2019 647 655 Q YU 2020 6406 6411 Z SONG 2018 16610 16616 J LIAO 2018 23062 23070 K LI 2018 1707483 B LIU 2019 1803900 T CAI 2019 900 909 J GE 2018 14885 14893 Y XIANG 2020 161 165 J JIANG 2021 18666 18672 M WANG 2011 7030 7034 J QIE 2013 2497 2504 L GU 2015 16670 16678 X SHI 2019 743 751 H CHEN 2020 1605 1620 H PAN 2017 1703936 H DORFLER 2018 116 128 S RAO 2019 10895 10901 D KIM 2020 8537 8548 D ALSALEM 2015 11542 11545 H HE 2019 55 70 J WANG 2019 230 240 S SUN 2020 1904010 Z TSAO 2019 872 884 Y YANG 2020 3692 3700 Y ZHOU 2017 840 845 G LI 2018 1705590 G SUN 2021 2101285 T LIU 2020 5215 F SUN 2018 1800595 Q WANG 2019 13235 13243 M ZHANG 2020 1907153 L PARK 2017 1602567 J HUANG 2019 1901872 X LIN 2019 7073 7082 H XU 2018 73 82 J LIN 2017 1476 1486 H SUN 2019 12137 12147 W LIAO 2018 37955 37962 Y QI 2018 14359 14366 B SHEN 2019 8986 8996 J YUAN 2017 1711 1719 H CHEN 2019 4731 4741 Y BAO 2016 8746 8756 W ZHOU 2018 1035 1043 F SUN 2020 11818 11823 M BARCHASZ 2012 3973 3980 C CUISINIER 2013 3227 3232 M YANG 2019 1901220 X JIN 2021 7318 7327 Z YE 2020 2234 2245 H LI 2020 279 296 S GUPTA 2021 13242 13251 A WANG 2021 e2008422 H DU 2019 4484 4502 X LI 2015 6393 6399 H ZHU 2016 9576 9579 L ZHANG 2020 920 934 Z LUO 2020 4849 4860 D LI 2020 1907444 Z WANG 2019 1900953 Y LI 2019 11921 11934 Q LIU 2019 1901667 H XU 2019 11491 11496 L LIN 2018 1801868 H ZHANG 2018 1707578 Y SHEN 2020 6673 6682 Z TIAN 2020 e1904876 Y ZHAO 2019 3779 3783 M LUO 2019 1900228 D ZHANG 2020 2001165 Y HUANG 2018 1705045 J ZHAO 2013 2390 Y KOU 2018 1703538 T GE 2020 6276 6282 W ZHANG 2017 1602876 J BAO 2018 1702485 W LI 2016 1998 2004 Y GONG 2020 3644 3649 B LIU 2020 2002462 Y ZHANG 2021 531 545 L HOU 2016 3283 3291 T ZENG 2018 327 337 P ZHOU 2015 7760 G WU 2017 20458 20472 H XU 2020 1906357 H PENG 2020 762 770 L WANG 2020 3041 3050 M LIU 2021 15226 15236 J TAO 2016 9978 9985 H SONG 2020 104555 Y CALLEVALLEJO 2011 15639 15643 F YIN 2016 7965 7972 Y HE 2017 5132 5135 D ZHENG 2017 306 312 C LIU 2021 7491 7499 W GAO 2019 1806724 X WANG 2020 105293 J YANG 2018 13593 13598 Y WANG 2021 11619 11633 W YANG 2019 1803137 W LIN 2019 1902096 H QIAO 2011 634 641 B YUAN 2020 2404 2412 K LU 2020 1906548 C GU 2020 891 898 J LIU 2018 19311 19317 Z DU 2019 3977 3985 Z LIANG 2020 2003507 Z ZHANG 2020 2002471 D LI 2020 250 259 Y LIU 2021 12 18 Y ZHOU 2020 1252 1261 G YANG 2020 161 166 W ZHANG 2020 13423 13429 S OSMIERI 2017 17796 17817 L GONG 2020 2705 2709 Y QIU 2020 16105 16113 Y MA 2021 2100171 C WANG 2019 246 252 J ZENG 2018 e1707290 Y LI 2017 576 587 Z NORSKOV 2009 37 46 J SHEN 2019 1906661 Z ZHOU 2018 2681 2693 J GAO 2015 5982 M SHEN 2021 2100673 J ZENG 2020 11558 11569 P SHI 2020 2006798 Z WANG 2021 20222 20232 Z LIU 2015 3056 3078 H LIU 2019 1902431 Y QIAO 2019 62 71 Z LI 2020 339 347 H SONG 2021 248 254 X DE 2016 3314 3347 S HE 2021 8583 8591 J WANG 2021 11160 11167 J SHI 2021 2102314 H HUANG 2021 2003689 S ZHOU 2017 291 296 T CI 2020 11929 11938 H GU 2019 20579 20588 S WANG 2021 2003314 S SHEN 2021 1138 1144 Z ZHOU 2017 1694 1703 T FANG 2018 56 61 R SONG 2018 2620 2630 Y JIAO 2019 1900219 L HAO 2019 305 311 B WEI 2020 16073 16084 C CAI 2020 2005967 J HU 2018 1800709 L YANG 2021 11491 11500 J WANG 2020 2000315 R YE 2018 16703 16707 C QIAO 2021 2100970 Z ZHAO 2020 9011 9017 M ZENGX2022X2946 ZENGX2022X2946X2965 ZENGX2022X2946XP ZENGX2022X2946X2965XP 2024-11-09T00:00:00.000Z 2024-11-09T00:00:00.000Z http://creativecommons.org/licenses/by-nc-nd/4.0/ 2022-11-13T00:07:57.803Z http://vtw.elsevier.com/data/voc/AddOnTypes/50.7/aggregated-refined Natural Science Foundation of the Jiangsu Higher Education Institutions of China 19KJA550004 Natural Science Research of Jiangsu Higher Education Institutions of China http://data.elsevier.com/vocabulary/SciValFunders/501100010023 http://sws.geonames.org/1814991/ Priority Academic Program Development of Jiangsu Higher Education Institutions PAPD Priority Academic Program Development of Jiangsu Higher Education Institutions http://data.elsevier.com/vocabulary/SciValFunders/501100012246 http://sws.geonames.org/1814991/ National Natural Science Foundation of China 11905154 NSFC National Natural Science Foundation of China http://data.elsevier.com/vocabulary/SciValFunders/501100001809 http://sws.geonames.org/1814991/ Collaborative Innovation Center of Suzhou Nano Science and Technology NANO-CIC Collaborative Innovation Center of Suzhou Nano Science and Technology http://data.elsevier.com/vocabulary/SciValFunders/501100012462 http://sws.geonames.org/1814991/ 111 Project Higher Education Discipline Innovation Project http://data.elsevier.com/vocabulary/SciValFunders/501100013314 http://sws.geonames.org/1814991/ Natural Science Foundation of Jiangsu Province BK20190814 Natural Science Foundation of Jiangsu Province http://data.elsevier.com/vocabulary/SciValFunders/501100004608 http://sws.geonames.org/1814991/ This work was supported by the Natural Science Foundation of Jiangsu Province ( BK20190814 ), the National Natural Science Foundation of China ( 11905154 ), the Natural Science Foundation of the Jiangsu Higher Education Institutions of China ( 19KJA550004 ), Collaborative Innovation Center of Suzhou Nano Science and Technology, the Priority Academic Program Development of Jiangsu Higher Education Institutions (PAPD), the 111 Project. 0 item S1872-2067(21)63984-0 S1872206721639840 1-s2.0-S1872206721639840 10.1016/S1872-2067(21)63984-0 273538 2023-01-18T16:14:12.536931Z 2022-12-01 2022-12-31 1-s2.0-S1872206721639840-main.pdf https://s3-eu-west-1.amazonaws.com/prod-ucs-content-store-eu-west/content/pii:S1872206721639840/MAIN/application/pdf/f97456ace8db9712ab61acebe2983ef8/main.pdf main.pdf pdf true 13622228 MAIN 20 1-s2.0-S1872206721639840-main_1.png https://s3-eu-west-1.amazonaws.com/prod-ucs-content-store-eu-west/content/pii:S1872206721639840/PREVIEW/image/png/020af60b696ba363944764518be4dc5d/main_1.png main_1.png png 53692 849 656 IMAGE-WEB-PDF 1 1-s2.0-S1872206721639840-fx1.jpg https://s3-eu-west-1.amazonaws.com/prod-ucs-content-store-eu-west/content/pii:S1872206721639840/fx1/DOWNSAMPLED/image/jpeg/2d7e95ec93820d72777bb64c682868fe/fx1.jpg fx1 true fx1.jpg jpg 27926 245 243 IMAGE-DOWNSAMPLED 1-s2.0-S1872206721639840-gr1.jpg https://s3-eu-west-1.amazonaws.com/prod-ucs-content-store-eu-west/content/pii:S1872206721639840/gr1/DOWNSAMPLED/image/jpeg/0cad8b0970a79f4835f825e74c8c9b82/gr1.jpg gr1 gr1.jpg jpg 48003 318 319 IMAGE-DOWNSAMPLED 1-s2.0-S1872206721639840-gr10.jpg https://s3-eu-west-1.amazonaws.com/prod-ucs-content-store-eu-west/content/pii:S1872206721639840/gr10/DOWNSAMPLED/image/jpeg/8e90172f0bee20924313d96c2ba1921a/gr10.jpg gr10 gr10.jpg jpg 142832 500 613 IMAGE-DOWNSAMPLED 1-s2.0-S1872206721639840-gr2.jpg https://s3-eu-west-1.amazonaws.com/prod-ucs-content-store-eu-west/content/pii:S1872206721639840/gr2/DOWNSAMPLED/image/jpeg/0a8464f8fff8cf0e055dac5c41cc65fe/gr2.jpg gr2 gr2.jpg jpg 26429 145 369 IMAGE-DOWNSAMPLED 1-s2.0-S1872206721639840-gr3.jpg https://s3-eu-west-1.amazonaws.com/prod-ucs-content-store-eu-west/content/pii:S1872206721639840/gr3/THUMBNAIL/image/jpeg/50725d067a564f5ac6d52ac7ebcc24db/gr3.jpg gr3 gr3.jpg jpg 86224 343 605 IMAGE-DOWNSAMPLED 1-s2.0-S1872206721639840-gr4.jpg https://s3-eu-west-1.amazonaws.com/prod-ucs-content-store-eu-west/content/pii:S1872206721639840/gr4/DOWNSAMPLED/image/jpeg/eb287b89d2c6bdfa7a399a29508c1c47/gr4.jpg gr4 gr4.jpg jpg 33495 140 614 IMAGE-DOWNSAMPLED 1-s2.0-S1872206721639840-gr5.jpg https://s3-eu-west-1.amazonaws.com/prod-ucs-content-store-eu-west/content/pii:S1872206721639840/gr5/DOWNSAMPLED/image/jpeg/724c6b8e87910aff941a1ed0f44c0c79/gr5.jpg gr5 gr5.jpg jpg 123277 540 502 IMAGE-DOWNSAMPLED 1-s2.0-S1872206721639840-gr6.jpg https://s3-eu-west-1.amazonaws.com/prod-ucs-content-store-eu-west/content/pii:S1872206721639840/gr6/DOWNSAMPLED/image/jpeg/a947f8055ba7e6ad269d7284bd335816/gr6.jpg gr6 gr6.jpg jpg 142211 575 648 IMAGE-DOWNSAMPLED 1-s2.0-S1872206721639840-gr7.jpg https://s3-eu-west-1.amazonaws.com/prod-ucs-content-store-eu-west/content/pii:S1872206721639840/gr7/DOWNSAMPLED/image/jpeg/356315a1c707ae9aa9e0fbe8a864b65b/gr7.jpg gr7 gr7.jpg jpg 132480 575 601 IMAGE-DOWNSAMPLED 1-s2.0-S1872206721639840-gr8.jpg https://s3-eu-west-1.amazonaws.com/prod-ucs-content-store-eu-west/content/pii:S1872206721639840/gr8/DOWNSAMPLED/image/jpeg/5548bc47ba536dea132abfbdb6be9899/gr8.jpg gr8 gr8.jpg jpg 137619 595 618 IMAGE-DOWNSAMPLED 1-s2.0-S1872206721639840-gr9.jpg https://s3-eu-west-1.amazonaws.com/prod-ucs-content-store-eu-west/content/pii:S1872206721639840/gr9/DOWNSAMPLED/image/jpeg/adbe55cdaf18e4d65ddc763b7abd5af4/gr9.jpg gr9 gr9.jpg jpg 77158 330 511 IMAGE-DOWNSAMPLED 1-s2.0-S1872206721639840-fx1.sml https://s3-eu-west-1.amazonaws.com/prod-ucs-content-store-eu-west/content/pii:S1872206721639840/fx1/THUMBNAIL/image/gif/7c9f0c96121b10947c0179f7471af2ec/fx1.sml fx1 true fx1.sml sml 11098 164 163 IMAGE-THUMBNAIL 1-s2.0-S1872206721639840-gr1.sml https://s3-eu-west-1.amazonaws.com/prod-ucs-content-store-eu-west/content/pii:S1872206721639840/gr1/THUMBNAIL/image/gif/35b2ac5e83e7343ef49eed58fd92e790/gr1.sml gr1 gr1.sml sml 13530 164 164 IMAGE-THUMBNAIL 1-s2.0-S1872206721639840-gr10.sml https://s3-eu-west-1.amazonaws.com/prod-ucs-content-store-eu-west/content/pii:S1872206721639840/gr10/THUMBNAIL/image/gif/3c08eea7a12815ac422eb869501b093f/gr10.sml gr10 gr10.sml sml 20562 164 201 IMAGE-THUMBNAIL 1-s2.0-S1872206721639840-gr2.sml https://s3-eu-west-1.amazonaws.com/prod-ucs-content-store-eu-west/content/pii:S1872206721639840/gr2/THUMBNAIL/image/gif/c6008edd0621977538de6a727238eea9/gr2.sml gr2 gr2.sml sml 11875 86 219 IMAGE-THUMBNAIL 1-s2.0-S1872206721639840-gr3.sml https://s3-eu-west-1.amazonaws.com/prod-ucs-content-store-eu-west/content/pii:S1872206721639840/gr3/MAIN/image/gif/fc1cccd6b9571bb25e4e5fd08e72079d/gr3.sml gr3 gr3.sml sml 13158 124 219 IMAGE-THUMBNAIL 1-s2.0-S1872206721639840-gr4.sml https://s3-eu-west-1.amazonaws.com/prod-ucs-content-store-eu-west/content/pii:S1872206721639840/gr4/THUMBNAIL/image/gif/5bd2871032b8bf099042d60417dfa6d2/gr4.sml gr4 gr4.sml sml 5358 50 219 IMAGE-THUMBNAIL 1-s2.0-S1872206721639840-gr5.sml https://s3-eu-west-1.amazonaws.com/prod-ucs-content-store-eu-west/content/pii:S1872206721639840/gr5/THUMBNAIL/image/gif/635a401aaca650478df3e5d0e7d702b7/gr5.sml gr5 gr5.sml sml 14125 163 152 IMAGE-THUMBNAIL 1-s2.0-S1872206721639840-gr6.sml https://s3-eu-west-1.amazonaws.com/prod-ucs-content-store-eu-west/content/pii:S1872206721639840/gr6/THUMBNAIL/image/gif/26b82fb4f7e2a2830baa21a9423fe70f/gr6.sml gr6 gr6.sml sml 14647 164 185 IMAGE-THUMBNAIL 1-s2.0-S1872206721639840-gr7.sml https://s3-eu-west-1.amazonaws.com/prod-ucs-content-store-eu-west/content/pii:S1872206721639840/gr7/THUMBNAIL/image/gif/8497726c3f84addb3da0c7c487b296db/gr7.sml gr7 gr7.sml sml 14510 164 171 IMAGE-THUMBNAIL 1-s2.0-S1872206721639840-gr8.sml https://s3-eu-west-1.amazonaws.com/prod-ucs-content-store-eu-west/content/pii:S1872206721639840/gr8/THUMBNAIL/image/gif/25a2ef1562f1eceacf18d55b57cab3ed/gr8.sml gr8 gr8.sml sml 15210 164 170 IMAGE-THUMBNAIL 1-s2.0-S1872206721639840-gr9.sml https://s3-eu-west-1.amazonaws.com/prod-ucs-content-store-eu-west/content/pii:S1872206721639840/gr9/THUMBNAIL/image/gif/b34a2f8460e00afef44a9570773b20cb/gr9.sml gr9 gr9.sml sml 16058 141 219 IMAGE-THUMBNAIL 1-s2.0-S1872206721639840-fx1_lrg.jpg https://s3-eu-west-1.amazonaws.com/prod-ucs-content-store-eu-west/content/pii:S1872206721639840/HIGHRES/image/jpeg/e2aa482c02a77a1ab94c6683b17a0fcc/fx1_lrg.jpg fx1 true fx1_lrg.jpg jpg 302045 1085 1078 IMAGE-HIGH-RES 1-s2.0-S1872206721639840-gr1_lrg.jpg https://s3-eu-west-1.amazonaws.com/prod-ucs-content-store-eu-west/content/pii:S1872206721639840/HIGHRES/image/jpeg/030bbae90d5dcaa9eca58fc924f6faf3/gr1_lrg.jpg gr1 gr1_lrg.jpg jpg 211739 846 848 IMAGE-HIGH-RES 1-s2.0-S1872206721639840-gr10_lrg.jpg https://s3-eu-west-1.amazonaws.com/prod-ucs-content-store-eu-west/content/pii:S1872206721639840/HIGHRES/image/jpeg/b1fcb9ee3d0bda92862b7e13cb72de74/gr10_lrg.jpg gr10 gr10_lrg.jpg jpg 707124 1327 1628 IMAGE-HIGH-RES 1-s2.0-S1872206721639840-gr2_lrg.jpg https://s3-eu-west-1.amazonaws.com/prod-ucs-content-store-eu-west/content/pii:S1872206721639840/HIGHRES/image/jpeg/f811638276f19083fc94faf0064e12e0/gr2_lrg.jpg gr2 gr2_lrg.jpg jpg 122557 386 982 IMAGE-HIGH-RES 1-s2.0-S1872206721639840-gr3_lrg.jpg https://s3-eu-west-1.amazonaws.com/prod-ucs-content-store-eu-west/content/pii:S1872206721639840/HIGHRES/image/jpeg/4b119b8a92995f71574910b909066435/gr3_lrg.jpg gr3 gr3_lrg.jpg jpg 380703 912 1607 IMAGE-HIGH-RES 1-s2.0-S1872206721639840-gr4_lrg.jpg https://s3-eu-west-1.amazonaws.com/prod-ucs-content-store-eu-west/content/pii:S1872206721639840/HIGHRES/image/jpeg/594937e0d2294f4a9443234544daad4e/gr4_lrg.jpg gr4 gr4_lrg.jpg jpg 158040 373 1631 IMAGE-HIGH-RES 1-s2.0-S1872206721639840-gr5_lrg.jpg https://s3-eu-west-1.amazonaws.com/prod-ucs-content-store-eu-west/content/pii:S1872206721639840/HIGHRES/image/jpeg/1884ad5abe6b7a92e8ac154b1fe066f5/gr5_lrg.jpg gr5 gr5_lrg.jpg jpg 574701 1435 1335 IMAGE-HIGH-RES 1-s2.0-S1872206721639840-gr6_lrg.jpg https://s3-eu-west-1.amazonaws.com/prod-ucs-content-store-eu-west/content/pii:S1872206721639840/HIGHRES/image/jpeg/cf59be7b1eb791f7791aa8ed3bbe69f2/gr6_lrg.jpg gr6 gr6_lrg.jpg jpg 605795 1527 1721 IMAGE-HIGH-RES 1-s2.0-S1872206721639840-gr7_lrg.jpg https://s3-eu-west-1.amazonaws.com/prod-ucs-content-store-eu-west/content/pii:S1872206721639840/HIGHRES/image/jpeg/a9cb7f0892b38669797feae6a0c88c57/gr7_lrg.jpg gr7 gr7_lrg.jpg jpg 551526 1527 1596 IMAGE-HIGH-RES 1-s2.0-S1872206721639840-gr8_lrg.jpg https://s3-eu-west-1.amazonaws.com/prod-ucs-content-store-eu-west/content/pii:S1872206721639840/HIGHRES/image/jpeg/2cc53b9c04a3f1c8d37d70b26a1d6541/gr8_lrg.jpg gr8 gr8_lrg.jpg jpg 540035 1582 1643 IMAGE-HIGH-RES 1-s2.0-S1872206721639840-gr9_lrg.jpg https://s3-eu-west-1.amazonaws.com/prod-ucs-content-store-eu-west/content/pii:S1872206721639840/HIGHRES/image/jpeg/4b760bc8b16d3a15d9273a202de8bf32/gr9_lrg.jpg gr9 gr9_lrg.jpg jpg 341736 876 1358 IMAGE-HIGH-RES CHNJC 63984 S1872-2067(21)63984-0 10.1016/S1872-2067(21)63984-0 Dalian Institute of Chemical Physics, the Chinese Academy of Sciences Fig. 2 (a) Schematic configuration of Li-S batteries. (b) Discharge/charge voltage profiles and corresponding reaction mechanism [15]. Reprinted with permission from Ref. [15]. Copyright 2020, Wiley-VCH. Fig. 3 (a) Ta L3 -edge XANES spectra of Ta2O5 related samples; (b) Band diagram of a-Ta2O5‒x /MCN; Ta L3 -edge XANES spectra (c) and FT-EXAFS (d) of Ta L-edge in a-Ta2O5–x /MCN/S at different discharge/charge states. (a–d) Reprinted with permission from Ref. [141]. Copyright 2020, Elsevier. (e) Crystal structure of Ni3N0.85. (f) Schematic illustration of rational catalyst design by correlating activation barrier with orbital interactions. (g) Partial density of states for Ni 3d orbitals. (h) COOP diagram of the S1-S2 and S3-S4 bonds of Li2S4. (e–h) Reprinted with permission from Ref. [150]. Copyright 2020, American Chemical Society. (i) DOS patterns of Fe3C and Fe3–x C. Reprinted with permission from Ref. [154]. Copyright 2020, Wiley-VCH. (j) Atomic structure model and illustration of polysulfides etching process. (i,j) Reprinted with permission from Ref. [152]. Copyright 2019, Wiley-VCH. Fig. 4 (a) The reaction pathways from S8 to Li2S for different pyridinic N configurations and pure graphene; Illustrations of the working mechanism of graphene (b), N-doped graphene (c), and N-rich graphene (d). Reprinted with permission from Ref. [169]. Copyright 2020, Wiley-VCH. Fig. 5 Optimized interaction configurations between polysulfides and the (311) (a) and (440) (b) surfaces of Co9S8 and N-Co9S8 nanoparticles, respectively. (a,b) Reprinted with permission from Ref. [163]. Copyright 2020, Wiley-VCH. DOS (c) and PDOS (d) of CoSe2 and N-CoSe2. (e) PDOS of Co 3d. The vertical view models and charge number of Co for DFT calculation of CoSe2 (f) and N-CoSe2 (g). (h) The bond lengths of CoSe2 and N-CoSe2. (i) The Li–S bond lengths of Li2S on the surfaces of CoSe2 and N-CoSe2 and possible conversion mechanism of sulfur species on the surface of N-CoSe2. (c–g) Reprinted with permission from Ref. [171]. Copyright 2020, American Chemical Society. Fig. 6 (a) Formation energies of 1T and 2H MoS2 with different Co doping contents. (b) Formation energies of sulfur vacancies in MoS2 and Co-MoS2 with the Co/Mo atomic ratio of 1:5. (c) Schematic illustration of the structure and phase transition of MoS2 after Co doping. (a–c) Reprinted with permission from Ref. [179]. Copyright 2021, American Chemical Society. (d) Mo K-edge FT-EXAFS of Co-MoSe2/MXene, MoSe2/MXene, and Mo foil; TDOS plots (e) and PDOS plots (f,g) of the main orbital contribution for MoSe2 and Co-MoSe2. (d–g) Reprinted with permission from Ref. [183]. Copyright 2021, American Chemical Society. (h) Intercalation process of Sn atoms into MoO3 nanoribbons; (i,j) DOS of MoO3 and Sn-MoO3 slab, respectively; (k,l) DOS of Li2S4 adsorbed on MoO3 and Sn-MoO3 slab, respectively. (d–l) Reprinted with permission from Ref. [184]. Copyright 2019, Wiley-VCH. Fig. 7 (a) DOS of CN and Fe-N2/CN. (b) PDOS of the Fe atom anchored on Fe-N2/CN. (c) Decomposition energy barriers of Li2S on Fe-N2/CN and CN. (a–c) Reprinted with permission from Ref. [201]. Copyright 2020, American Chemical Society. Simulated deformation charge density of SA-Fe (d) and Fe2N (e). Geometric configurations of Li2S6 on SA-Fe (f) and Fe2N (g). (h) Binding energy of sulfur species adsorbed on NG, SA-Fe, and Fe2N. (i) Energy profiles for the reduction of polysulfides and decomposition of the Li2S on NG, SA-Fe, and Fe2N; Decomposition energy barriers of Li2S on NG (j), SA-Fe (k), and Fe2N (l). (d–l) Reprinted with permission from Ref. [202]. Copyright 2021, Wiley-VCH. Fig. 8 (a) COOP of Ni2P and Ni2Co4P3. (b) DOS showing the d-bands shift upon Co doping. (c) Activation energy change of Li2S nucleation when using Ni2P and Ni2Co4P3. (a–c) Reprinted with permission from Ref. [207]. Copyright 2019, Wiley-VCH. (d) DOS analysis of the p bands of anions and the d bands of Co in Co-based compounds. (e) Scaling relation between the d band center and Li-S redox potentials for Co-based compounds. (f) Diffusion energy barriers of Li2S on Co-based compounds. (g) Adsorption configurations and energies of Li2S6 and Li2S on rGO and Co-based compounds. (d–g) Reprinted with permission from Ref. [208]. Copyright 2018, Elsevier. (h) DOS of the p- and the d-bands of Fe3C, Fe3O4, and Fe3N; (i) the relationship of ∆ band center (d-p) and reaction voltage of Li2S4. (j) Radial distribution functions of S-S molecules. (h–j) Reprinted with permission from Ref. [210]. Copyright 2021, Wiley-VCH. Fig. 9 (a) Pt 4f XPS spectra of Pt, Pt-Ni (2 h), and Pt-Ni (4 h). (b) Diagram of the HOMO and LUMO energy levels showing a reactive energy barrier between short-chain polysulfides and catalysis for Pt, Pt-Ni alloy, and Ni. (c) Adsorption energy of various polysulfides on different catalyst surfaces. (a–c) Reprinted with permission from Ref. [215]. Copyright 2019, Wiley-VCH. AIMD simulations of the adsorption of S8 on CoTe2 (d) and Co (e). (d,e) Reprinted with permission from Ref. [218]. Copyright 2021, Elsevier. (f) Catalytic conversion mechanism of Fe-Ni alloys. (f) Reprinted with permission from Ref. [220]. Copyright 2021, American Chemical Society. Fig. 10 (a) Working schematic illustration of MoS2-MoN heterostructure. Reprinted with permission from Ref. [227]. Copyright 2021, Wiley-VCH. (b) Schematic illustration of the conversion from polysulfides to Li2S on SnO2-Mo2N surface. (c) High-resolution TEM image of SnO2-Mo2N. (a–c) Reprinted with permission from Ref. [237]. Copyright 2021, American Chemical Society. (d) High-resolution TEM image of MoN-VN. (e) Mo L-edge NEXAFS spectra of MoN-VN and MoN. (f) Mo 3d XPS spectra of MoN, MoN-VN, and MoN-VN-polysulfides. (g) DOS of Mo on surface of V-MoN and MoN. (d–g) Reprinted with permission from Ref. [239]. Copyright 2018, Wiley-VCH. Available online 10 November 2022 This work was supported by the Natural Science Foundation of Jiangsu Province (BK20190814), the National Natural Science Foundation of China (11905154), the Natural Science Foundation of the Jiangsu Higher Education Institutions of China (19KJA550004), Collaborative Innovation Center of Suzhou Nano Science and Technology, the Priority Academic Program Development of Jiangsu Higher Education Institutions (PAPD), the 111 Project. Review Recent progress in electronic modulation of electrocatalysts for high-efficient polysulfide conversion of Li-S batteries Pan Zeng Cheng Yuan Genlin Liu Jiechang Gao Yanguang Li # Liang Zhang * Institute of Functional Nano & Soft Materials (FUNSOM), Jiangsu Key Laboratory for Carbon-Based Functional Materials & Devices, Soochow University, Suzhou 215123, Jiangsu, China Institute of Functional Nano & Soft Materials (FUNSOM) Jiangsu Key Laboratory for Carbon-Based Functional Materials & Devices Soochow University Suzhou Jiangsu 215123 China Institute of Functional Nano & Soft Materials (FUNSOM), Jiangsu Key Laboratory for Carbon-Based Functional Materials & Devices, Soochow University, Suzhou 215123, Jiangsu, China * Corresponding author. Tel/Fax: +86-512-65885890 Tel/Fax: +86-512-65885890 # Corresponding author Abstract With the merits of high energy density, environmental friendliness, and cost effectiveness, lithium-sulfur (Li-S) batteries are considered as one of the most promising next-generation electrochemical storage systems. However, the notorious polysulfide shuttle effect, which results in low active material utilization and serious capacity fading, severely impedes the practical application of Li-S batteries. Utilizing various electrocatalysts to improve the polysulfide redox kinetics has recently emerged as a promising strategy to address the shuttle effect. Specially, the electronic structure of the electrocatalysts plays a decisive role in determining the catalytic activity to facilitate the polysulfide conversion. Therefore, reasonably modulating the electronic structure of electrocatalysts is of paramount significance for improving the electrochemical performance of Li-S batteries. Herein, a comprehensive overview of the fascinating strategies to tailor the electronic structure of electrocatalysts for Li-S batteries is presented, including but not limited to vacancy engineering, heteroatom doping, single atom doping, band regulation, alloying, and heterostructure engineering. The future perspectives and challenges are also proposed for designing high-efficient electrocatalysts to construct high-energy-density and long-lifetime Li-S batteries. Graphical Abstract We have summarized the fascinating strategies for regulating the electronic structure of electrocatalysts to accelerate sulfur redox conversion, which could significantly improve the electrochemical performance of Li-S batteries. Keywords Lithium-sulfur batteries Catalytic effect Electronic modification Shuttle effect Redox kinetics 1 Introduction With the increasing demand for portable electronics and electric vehicles, the energy densities powered by conventional lithium-ion batteries (LIBs) are approaching their theoretical limits [1–4]. Lithium-sulfur (Li-S) batteries, among the state-of-the-art next-generation energy storage systems, has been regarded as one of the most promising successors to LIBs [5–10]. The theoretical gravimetric energy density of Li-S batteries is 2600 Wh kg−1, which is three to five times higher than that of LIBs [11–14]. Besides, elemental sulfur as the active material possesses the fascinating advantages of low cost, environmentally friendliness, and nature abundance [15–20]. Although Li-S batteries are promising, the practical application is severely hampered by multiple challenges coming from the sulfur cathode, lithium anode [21–24], and electrolyte [25–29]. Here, we mainly focus on the critical concerns regarding the sulfur cathode. The first one is the insulation characteristic of elemental sulfur (5 × 10−30 S cm−1, room temperature) and discharge product lithium sulfide (Li2S, 3.6 × 10−7 S cm1, room temperature) [30–32], which inhibits the active materials from being used directly as cathode. The second one is the large volumetric changes up to 80% between S and Li2S during cycling [33–40]. The third one is the notorious shuttle effect of polysulfides. During the charge/discharge process, the generated long-chain polysulfides (Li2S x , 4 < x ≤8) will dissolve into the electrolyte and diffuse between the cathode and the anode, leading to the participation in the reduction reactions with Li anode and oxidation reactions at the cathode side [41–45]. This inevitable shuttle effect causes low utilization of active materials and rapid capacity fading [46–50]. On the other hand, to meet the demand for high energy density of practical applications for Li-S batteries, high sulfur loading of more than 5 mg cm−2, high sulfur content of more than 70%, and low electrolyte/sulfur (E/S) ratio of less than 6 µL mg−1 are indispensable [16–19]. However, with increasing the sulfur loading and reducing the E/S ratio, more polysulfides will accumulate on the substrate surface during the cycling process, also resulting in sluggish polysulfide redox conversion and rapid inactivation of the substrate surface by forming Li2S2/Li2S passivation layer. The typical strategies to address the first two challenges mentioned above include constructing high electronic conductive networks [51–56], reducing the size of sulfur particles [57–61], rationally designing flexible electrode structures [62–67], or reserving extra space for the active materials [68,69], and great progress has been achieved. However, it is still a formidable challenge to inhibit the shuttle effect because polysulfides are inevitably formed during cycling. In fact, all-solid-state Li-S batteries can avoid the generation of polysulfides and completely eradicate the shuttle effect by replacing traditional organic liquid electrolytes with solid electrolytes [70–74]. However, all-solid-state Li-S batteries have shortcomings of inferior reaction kinetics, electrolyte sensitivity to moisture, and severely low sulfur content in the cathode, which are challenging for commercialization [37,75–79]. Therefore, strenuous efforts have been exerted over the past few decades to suppress the polysulfide shuttle of Li-S batteries with organic electrolytes by utilizing reasonable host materials. Fig. 1 Schematic illustration of the strategies for regulating the electronic structure of electrocatalysts to address the key challenges of Li-S batteries. Reprinted with permission from Ref. [150]. Copyright 2020, American Chemical Society. Reprinted with permission from Ref. [152]. Copyright 2019, Wiley-VCH. Reprinted with permission from Ref. [179]. Copyright 2021, American Chemical Society. Reprinted with permission from Ref. [171]. Copyright 2020, American Chemical Society. Reprinted with permission from Ref. [207]. Copyright 2019, Wiley-VCH. Reprinted with permission from Ref. [208]. Copyright 2018, Elsevier. Reprinted with permission from Ref. [215]. Copyright 2019, Wiley-VCH. Reprinted with permission from Ref. [211]. Copyright 2020, American Chemical Society. Reprinted with permission from Ref. [218]. Copyright 2021, Elsevier. Reprinted with permission from Ref. [227]. Copyright 2021, Wiley-VCH. So far, various conductive carbon materials, such as micro/mesoporous carbon [80–84], hollow carbon spheres [85–90], carbon nanotubes (CNTs) [91–93], and graphene [94–98], have been widely used as sulfur hosts to confine polysulfides through physical adsorption. However, the weak binding energy between nonpolar carbon substrates and polar polysulfides is inadequate to efficiently suppress the polysulfide shuttle. Therefore, polar functionalized carbons with heteroatom doping (N, S, O, P) and defect engineering [99–102] have been developed as sulfur hosts, which are able to capture the polysulfides via chemical adsorption through the formation of chemical bonds between polysulfides and polar hosts. These strategies are based on the perspective of inhibiting the diffusion of polysulfides by using physical confinement or chemical adsorption to passively restrict polysulfide diffusion. However, the shuttle effect is not only derived from the diffusion of dissolved polysulfides but also caused by the slow conversion kinetics between polysulfides and Li2S2/Li2S [103–106]. In light of this, the introduction of electrocatalysts that can accelerate the redox kinetics of polysulfides is considered to be a more effective strategy to suppress shuttle effect, particularly under practical applications [103,106]. This is because for the substrates with only adsorption function, the sluggish redox kinetics of adsorbed polysulfides results in a saturation of polysulfides on substrate surfaces. Therefore, further polysulfide adsorption is restricted and inactive sulfur species accumulate in each cycle, thereby leading to the structure degradation and capacity fading [63–67]. In contrast, the catalytic materials can not only entrap polysulfides but also accelerate the redox conversions of polysulfides by facile electrons/ions transfer, resulting in an unsaturated state of polysulfides. Therefore, further entrapment of polysulfides is feasible and smooth adsorption-conversion of polysulfides is realized [107–110]. Up to now, various catalytic substrates, such as metal oxides [111–115], metal sulfides [116–120], metal nitrides [121–123], metal phosphides [124–126], and metal carbides [127–129], have been developed and utilized as sulfur host materials. The classification of these catalytic materials has been comprehensively reviewed in term of their intrinsically physical and chemical properties in previous reports [5–7]. In fact, the catalytic activity of electrocatalysts is essentially determined by their electronic structure. Therefore, rational regulation of the electronic structure plays a pivotal role in realizing high-efficient electrocatalysts. The spin ordering, density of state (DOS) and energy band structure intrinsically characterize the electronic behaviors. In this review, we mainly summarize the strategies for optimizing the electronic structure (e.g., spin state, DOS, and band structure) of electrocatalysts for Li-S batteries and establish the relationship between electronic structure and catalytic activity. The employed strategies are classified as follows: (1) vacancy engineering; (2) heteroatom doping; (3) single atom doping; (4) band regulation; (5) alloying; and (6) heterostructure engineering. The remaining challenges and prospects are also proposed for further rational guidelines of designing electrocatalysts to regulate Li-S chemistry. 2 Principles of sulfur redox reactions and roles of catalytic materials Since the accumulation of polysulfides on the surface of electrocatalysts is the key reason for the sluggish transformation and shuttle of polysulfides, rational design of electrocatalysts for accelerating polysulfide reaction kinetics is considered as an effective strategy to suppress shuttle effect [6–8]. During the discharge process, S8 is gradually reduced to soluble polysulfides and finally to insoluble Li2S through the following steps (Figs. 2(a) and 2(b) ) [15,130,131]. The first step of solid-liquid reaction process corresponds to the solid sulfur ring-opening reduction to the long-chain Li2S8 at the potential of ~2.4 V (vs. Li/Li+). The second step of liquid-liquid reaction process is the further reduction of the long-chain Li2S8 to short chains Li2S x (4 ≤ x ≤ 8) at ~2.3 V, while the third step of liquid-solid reaction process corresponds to the two-phase reaction from short-chain Li2S x (4 ≤ x ≤ 8) to solid Li2S2 at ~2.1 V. The last step is the reduction from solid Li2S2 to solid Li2S. Notably, steps 1 and 2 are relatively easy due to the low reaction energy barrier. However, steps 3 and 4 are tough because of high energy barrier and thus sluggish reaction kinetics, which are considered as the rate-determining steps of sulfur redox kinetics [132,133]. Moreover, the discharge product Li2S is preferred to be deposited on the surface of active sites, leading to the gradual deactivation of their catalytic activity. Since 75% of sulfur discharge capacity derives from steps 3 and 4 (1254 mAh g−1), enhancing the reaction kinetics of Li2S precipitation is extremely important for suppressing shuttle effect. During the subsequent charge process, due to the insulating properties of Li2S2/Li2S, an additional driving force is required to facilitate their decomposition [134–136]. Therefore, appropriate electrocatalysts are high required to facilitate the redox kinetics of Li2S2/Li2S precipitation and decomposition to improve the electrochemical performance of Li-S batteries. 3 Electronic structure engineering of electrocatalysts Since the conductivity and adsorption strength of the electrocatalysts as the intuitive behavior of the electronic structure directly determine the reaction kinetics, the electronic structure has been identified as an important descriptor to explain the corresponding catalytic behavior [137,138]. The spin ordering, energy band structure, and DOS intrinsically characterize the electronic behaviors. Combining the advanced operando characterizations and powerful simulation methods, the clear images of electronic structure are available via detecting and simulating these characteristics [137,139–142]. Herein, we mainly summarize the modulation of electronic structure of electrocatalyst materials used for Li-S batteries via different strategies, such as vacancy engineering, heteroatom doping, single atom doping, band engineering, alloying, and heterostructure engineering, which are reviewed in details in this section with some representative examples. 3.1 Vacancy engineering Vacancy engineering is considered as one of the most effective strategies for surface modification of electrocatalysts, which aims at creating more active sites and tuning the surface charge-transfer property. Meanwhile, vacancies can significantly promote the electrocatalytic activity by optimizing the surface-adsorption ability for reaction intermediates, which derives from the abundance of localized electrons around vacancies. Additionally, the vacancies can simultaneously tailor the surface hydrophilic property for a better electrolyte contact. Therefore, vacancies can function as adsorption and conversion sites for the polysulfide intermediates, leading to the improved electrochemical performance of Li-S batteries [139]. 3.1.1 Anion vacancies Oxygen vacancies are the most widely used anion vacancies in Li-S batteries due to the following reasons. Firstly, oxygen vacancies with abundant localized electrons can act as active sites for the adsorption and activation of adsorbed products [139]. Secondly, the surface oxygen vacancies possess strong hole and/or electron trapping ability, which effectively suppress the recombination of charge carriers and dramatically reduce the energy barrier for interfacial charge transfer [140]. Therefore, oxygen vacancies can significantly promote the electrochemical properties of Li-S batteries by improving charge transfer capability and enhancing polysulfide affinity. For example, Zhang et al. explored amorphous tantalum oxide with oxygen vacancies (a-Ta2O5–x ) embedded into the microporous carbon (MCN) as a new electrocatalyst toward polysulfide entrapment and conversion [141]. The Ta L3 -edge X-ray absorption near-edge structure (XANES) spectra reveals that the oxygen vacancies in the Ta2O5–x increase the density of Ta 5d unoccupied states near the Fermi level (Fig. 3(a) )). Meanwhile, oxygen vacancies reduce conduction band minimum (CBM), which can be observed from the Ta L 3 absorption edge energy (E 0) of a-Ta2O5–x . The increased density of Ta 5d unoccupied states near the Fermi level and the reduced CBM significantly reduce the band gap of a-Ta2O5–x /MCN (Fig. 3(b))). Thus, the electrons become more easily striding over the gap and can significantly ameliorate the intrinsic conductivity, and the oxygen-deficient Ta2O5–x catalyst presents higher activity than that of Ta2O5. On the other hand, the Fourier-transformed extended X-ray absorption fine structure spectra (FT-EXAFS, Figs. 3(c) and 3(d)) reveal the stability of oxygen-deficient structure. Therefore, the as-fabricated a-Ta2O5–x @MCN/S cathode presents excellent rate capacity up to 5 C, long-term cyclability over 1000 cycles with an ultralow capacity fading rate of 0.029% per cycle, and high areal capacity of 5 mAh cm−2 under high sulfur loading and low electrolyte/sulfur (E/S) conditions. Oxygen vacancies in other metal oxides, such as Nb2O5–x @MCN [142], TiO2 [143,144], Mn/Ni co-doped CoO/C [145], Fe2O3@Mn3O4 nanosheet [146] and HNb3O8 [147], WO3– x[148], can also generate rich electrons, leading to the enhanced conductivity and fast polysulfide conversion. In addition to oxygen vacancies, sulfur, selenium, and nitrogen vacancies have also been introduced into metal compounds to tailor their electronic structure. For example, Zhang et al. [149] fabricated MXene/1T-2H MoS2-C nanomaterials with sulfur vacancies for boosting the electrochemical performance of Li-S batteries. Large numbers of positively S-vacancy defects generated in MXene/1T-2H MoS2-C surface serve as strong adsorption and activation sites of polysulfides, which accelerate their redox reactions, thereby suppressing polysulfide shuttle. Thus, the MXene/1T-2H MoS2-C-S electrode exhibits an excellent cycle stability, which preserves a high capacity of 799.3 mAh g−1 at 0.5 C after 300 cycles. In addition, Shen et al. [150] developed a Ni3N0.85 electrocatalyst by engineering nitrogen vacancies in a hexagonal Ni3N (Fig. 3(e))), which could enhance the catalytic activity of inert Ni3N and expedite the sulfur redox conversion. To further explore the underlying reason for the accelerated sulfur redox conversion, the relationship between the activation energy barrier of polysulfide conversion and the 3d orbital interactions of the defected Ni3N0.85 is investigated (Fig. 3(f))). Combining with density functional theory (DFT) calculations, it can be seen from the center of the 3d-bands of Ni3N0.85 shifts to the Fermi level (Fig. 3(g))) due to the presence of nitrogen vacancies. Meanwhile, the crystal orbital overlap population (COOP, Fig. 3(h))) analysis shows that Ni3N0.85 has more antibonding states of S–S bonding below the Fermi level than that of Ni3N, indicating that vacancy-rich Ni3N0.85 weakens the S–S bonding and thereby expediting polysulfide conversion. Thus, the vacancy-rich Ni3N0.85@S cathode delivers a high initial capacity of 1200 mAh g−1 for up to 100 cycles at a high loading of 5.2 mg cm−2. Apart from the successful introduction of sulfur and nitrogen vacancies, Tian and co-workers [151] developed catalytically active Sb2Se3–x with rich selenium vacancies for boosting the performance of Li-S system. The defects in the as-fabricated Sb2Se3–x induce a redistribution of the excess electrons among the nearest neighboring atoms to form shallow donor states. In this case, electrons below the Fermi level can leap into the defect level, which creates a hole carrier and lowers the barrier of electron transition to the conduction bands, thus contributing to the enhanced conductivity. Meanwhile, the introduced selenium defects strengthen the chemical affinity to polysulfides. Therefore, rapid sulfur electrochemical conversion is realized. It can be concluded from above studies that the anion vacancies within the electrocatalysts are typically beneficial to accelerating the redox kinetics of polysulfides in Li-S batteries. 3.1.2 Cation vacancies Apart from anion vacancies, cation vacancies also have important prospects in promoting catalytic activity because of their unique active sites and electronic properties [152–154]. For instance, Zhang et al. [154] developed the Fe3–x C@hollow microspheres with enriched Fe-vacancies as advanced sulfur host materials. DOS results shown in Fig. 3(i)) reveal that the Fe defects in the Fe3–x C increase Fe d-band center (–1.3573 eV) compared to the pure Fe3C (–2.0939 eV), thereby enhancing the polysulfide affinity. Meanwhile, the energy barrier of Li2S decomposition on the Fe-defect rich Fe3–x C (0.51 eV) is lower than that on the pure Fe3C (1.72 eV), demonstrating the accelerated Li2S conversion kinetics by the introduction of Fe defects. Correspondingly, the Fe3–x C/S electrode exhibits a high rate capacity up to 5 C and stable cycling over 1000 cycles with a low capacity fading rate of 0.04% per cycle at 1 C. To further clarify the influence of cation vacancies on sulfur redox chemistry, Zhao et al. [152] adopted an in situ extrinsic-metal etching strategy to create the cation vacancies. During the charge/discharge process, the Fe atoms at the angular position of the cubic structure of Ni3FeN could be leached out by polysulfide etching, leading to the formation of a metastable Ni3Fe1–δ N (Fig. 3(j))). The authors infer that the creation of Fe vacancies activates the electrochemically inert Ni3N, exposing abundant active sites for boosting the redox conversion of polysulfides. This study not only reveals the true active sites under aprotic conditions but also deepens the understanding of the chemical conversion of sulfur caused by vacancies. Despite significant progresses have been achieved, there is still a big room to explore vacancy engineering for harnessing robust catalytic capability to boost sulfur reaction kinetics. For example, traditional exfoliation and pyrolysis strategies are usually unable to accurately control the generation of specific types of defects. In this sense, it is imperative to develop effective strategies to achieve the optimized defective catalysts. It is worth noting that chemical vapor deposition, atomic layer deposition, and plasma assisted technologies are considered as promising solutions for the preparation of defective catalysts, yet still lack in-depth exploration in constructing defect sites with a precise and controllable manner. 3.2 Heteroatom doping Similar to the strategy of introducing cation/anion vacancies, heteroatom doping is another encouraging method for enhancing catalytic activity [155]. The employment of heteroatoms or free radicals can disrupt the periodicity of the crystal lattice, resulting in a locally changed electronic structure [156,157]. This change can effectively modify the electric conductivity and surface property of substrate materials and thus enhance their electrocatalytic activity. Therefore, heteroatom doping shows a broad prospect for the rational design of polysulfide conversion mediators for Li-S batteries [158–161]. Herein, typical types of heteroatom doping used for electrocatalyst design, i.e., anion-doped carbon, anion-doped compounds, and cation-doped compounds, are summarized, with particular attention to the sulfur redox conversion regulated by heteroatom doped mediators. 3.2.1 Anion-doped carbon In the field of Li-S batteries, heteroatom-doped carbon materials can not only regulate the uniform distribution of electron of nonpolar carbon surface to localize electron accumulation in heteroatom but also generate special surface functional groups, which afford more active sites for polysulfide adsorption [162–164]. By combining with density functional theory calculations, Hou et al. [165] systematically investigated the interactions between various heteroatoms (B, N, O, F, P, S, and Cl) doped carbon and polysulfides. It is demonstrated that the chemical modification of carbon using N or O heteroatom remarkably enhances the interactions between polysulfides and the carbon substrates through dipole-dipole electrostatic interactions and thus significantly suppress the shuttle effect, allowing high capacity and Coulombic efficiency. In contrast, the interactions between polysulfides and B, S, P, F, and Cl doped carbon substrates are unsatisfactory [165]. Compared with mono-atomic doping, dual-atomic doping can further improve the adsorption capability of polysulfides by synergistic effect [102,166]. For instance, Zhou et al. [167] prepared N, S co-doped graphene sponge and applied it as sulfur host. Based on first-principles calculations, it is revealed that the N, S co-doped graphene sponge shows stronger binding energy towards polysulfides compared to single N or S doped graphene sponge. In addition, N and P co-doped Gr/CNTs@porous carbon hybrid substrate was successfully fabricated by Wu et al. [168], which could generate more defects and active sites in the carbon substrate, thereby improving the polysulfide adsorption and electrochemical performance. The heteroatom doping mentioned above mainly focuses on the inhibition of polysulfide shuttle by enhancing the polysulfide adsorption capability of carbon substrate. To further explore the sulfur redox reactions enabled by the heteroatom doping carbon from a viewpoint of catalytic conversion, Xu et al. [169] calculated the reaction energy barrier of polysulfide conversion during electrochemical reaction process with the assistance of DFT calculations. The calculated adsorption energy between different types of N-doped graphene (graphitic N, pyrrolic N, and pyridinic N) and polysulfides indicates that pyridinic N possesses the highest adsorption energy for polysulfides. This means that pyridinic N atoms are preferential adsorption sites for polysulfide intermediates during the redox reaction process. More importantly, the graphene-four pyridinic N (Gr-4N) shows different reaction rate determining step (Fig. 4(a) )) and smallest limiting energy barrier of 0.12 eV compared to the pure graphene, graphene-two pyridinic N (Gr-2N), and graphene-three pyridinic N (G-3N). Thus, the activity trend in these four cases is Gr-4N > Gr-3N > Gr-2N > Gr, demonstrating that catalytic activity and reaction pathways are strongly dependent on the concentration of N-dopants in graphene. Based on these analysis, the following three criteria are required to obtain a catalyst with high catalytic activity: (1) High conductivity for fast charge transfer; (2) strong binding capability to enhance the adsorption and immobilization for polysulfides; and (3) strong electrocatalytic activity to promote redox kinetics of polysulfide conversion (Figs. 4(b)–(d)). To better understand the fundamental origins of the improved catalytic activity for the co-doped carbon materials, Peng and co-workers [170] developed N,S co-doped holey graphene framework (N,S-HGF) and investigated sulfur reduction reaction process. The activation energy (E a) for each reduction step of polysulfide conversion was investigated by probing the charge transfer resistance at the corresponding voltages under various temperatures. The obtained E a presents the highest value of 0.33 eV for the N, S-HGF at 1.8 V than that at 2.7 V (0.12 eV) and 2.1 V (0.24 eV). This result clearly demonstrates that the conversion of S8 ring molecules to soluble polysulfides is relatively easy, whereas the conversion of polysulfides into insoluble Li2S2/Li2S is difficult. Meanwhile, compared to mono-atomic N-HGF or S-HGF doping, the N,S-HGF substrate delivers the smallest E a, indicating the facile reaction kinetics with the introduction of N and S dual-atoms. Meanwhile, the N, S co-doped HGF substrate presents a good compromise of LiS binding (–2.14 eV) and consequently a low overpotential. The DOS pattern result further reveals an intermediate p-band center energy caused by the dual-doping, thus leading to a moderate bonding energy with the LiS radical and eventually resulting in an enhanced electrocatalytic activity for sulfur reduction reaction process. 3.2.2 Anion-doped metal compounds Metal compounds generally have high polysulfide adsorption capacity compared to carbon substrates, therefore doping non-metal atoms (N,P) into metal compounds (e.g., transition metal oxides and sulfides) can further improve their catalytic activity [163,171,172]. For example, Liu et al. [163] fabricated a novel N-doped Co9S8 as an advanced sulfur host. Interestingly, the adsorption structures obtained from the first-principles calculations clearly indicate that the Li atoms tend to bond with the N atoms after the surface doping with N atoms (Figs. 5(a) and 5(b) ). In contrast, the Li and S atoms of polysulfides chemically bond with the S and Co atoms of pristine Co9S8. Meanwhile, the N-doped Co9S8 exhibits higher adsorption capability toward polysulfides. This study reveals that the doped N can simultaneously improve the immobilization capability and catalytic activity of Co9S8, and thereby accelerate polysulfide conversion. In addition, the P-doped CoS2 as a sulfur host was also reported by Liu et al. [172], which can not only significantly improve the polysulfide adsorption but also enhance the catalytic effects. To truly improve the sulfur redox conversion for realizing high-performance Li-S batteries, it is essential to develop a bidirectional electrocatalyst that can simultaneously accelerate both the reduction of polysulfides and the oxidation of Li2S. Wang et al. [171] constructed a new type of bi-functional catalyst by anion N doping in CoSe2 (N-CoSe2). The DOS patterns of N-CoSe2 and CoSe2 (Fig. 5(c))) indicate that new defect levels could be produced by the introduction of N heteroatoms, thus increasing the conductivity of CoSe2. Meanwhile, the d-band center of Co 3d in N-CoSe2 apparently shifts closer to the Fermi level compared to CoSe2, indicating the higher charge carrier density and favorable charge transfer during sulfur redox conversion [173]. The projected density of states (PDOS) of Co 3d further demonstrates that the Co atoms in N-CoSe2 affords more empty orbitals to adsorb polysulfide intermediates (Figs. 5(d) and 5(e)), which is conducive to the polysulfide adsorption. Atomic level analysis shown in Figs. 5(f)–5(i) discloses that N-CoSe2 can form shorter Co–S bonds with sulfur species and simultaneously weaken the S–S bridged bond of Li2S4 and Li–S bond of Li2S, which expedite the polysulfide reduction and Li2S oxidation. Because of these advantages, the fabricated N-CoSe2 bifunctional catalyst delivers a high areal capacity of 9.26 mAh g−1 under a low E/S ratio of 4.4 μL mg−1. Besides, a bidirectional electrocatalyst of porous N-doped Ti3C2 MXene (P-NTC) has also recently been reported by Song et al. [174]. Benefiting from the ample N doping, P-NTC can not only serve as an effective immobilizer for polysulfides but also act as a bifunctional electrocatalyst to promote both the precipitation and decomposition of Li2S. 3.2.3 Cation (metal ion) doped compounds Except anion-doped metal compounds, the doped cation ions (metal atoms) in the metal compounds can also induce lattice deformation and redistribution of internal electrons. These changes can activate the doping atoms and surrounding atoms as active sites to participate in the redox conversion of polysulfides [161,175]. Meanwhile, the charge transfer from the catalytic interface to the adsorbed reactants is facilitated by the electron redistribution [176,177]. The single metal atoms doped in the carbon matrix are widely defined as single-atom materials, which will be discussed separately in this review. In this section, we mainly focus on the metal atoms doped in non-carbon matrices. Metal sulfides, such as MoS2, are widely used in Li-S batteries to restrain the shuttle of polysulfides due to their decent chemical adsorption capacity and catalytic activity [109,178]. Nonetheless, their relatively low conductivity and activity limit the polysulfide conversion kinetics. Liu et al. [179] proposed the use of Co-doped MoS2 to expedite the redox conversion of polysulfides. The calculated formation energies (Figs. 6(a) and 6(b) ) show that Mo atoms (–1.45 eV) are easily replaced by Co atoms. The formation of 1T MoS2 is preferred compared to 2H MoS2 when the Co doping content in MoS2 is higher than 0.2, owing to the low formation energy of 1T phase MoS2 (Fig. 6(a)) and 6(b)). Besides, the formation energy of sulfur vacancies in MoS2 also decreases from 3.38 eV (2H MoS2) to 1.92 eV (1T Co-doped MoS2) with Co doping. Clearly, the doped Co atoms promote the transition from semiconducting 2H phase to metallic 1T phase accompanied with the introduction of sulfur vacancies, which thereby enhances the electron transfer and catalytic activity (Fig. 6(c))). In addition, Co-doped SnS2 [180], Co-doped TiO2–x [181], and Ni-doped zeolitic imidazolate framework-8 [182] have also been reported to accelerate the polysulfide conversion in Li-S batteries. Catalysts with bidirectional catalytic function can also be generated by the cationic doping. For example, Wang et al. [183] designed a bifunctional electrocatalyst by doping Co cations into MoSe2 (Co-MoSe2) that was in situ hybridized with MXene nanosheets. Mo K-edge EXAFS spectra shown in Fig. 6(d)) implies the decrease of Mo-Mo coordination, which derives from the substitution of Mo atoms by Co atoms in MoSe2. The partial substitution of Mo atoms by Co atoms also leads to coordination unsaturation of Se atoms near Co atoms, thereby activating the inert two-dimensional basal plane of MoSe2. The total density of states (TDOS) (Fig. 6(e))) shows that both the valence bands and conduction bands shift toward the Fermi level after doping Co cations into MoSe2, thus resulting in a narrower band gap. Meanwhile, the DOS of Co-MoSe2 is also obviously closer to the Fermi level compared to MoSe2, which derives from Mo d, Se p, and Co d orbitals (Fig. 6(f))). The PDOS plots (Fig. 6(g))) further confirm that the conduction and valence bands of Se-p, Co-d and Mo-d shift towards the Fermi level after doping Co atoms into MoSe2 lattice planes. Accordingly, the doping Co atoms into the MoSe2 can significantly enhance the electronic conductivity of MoSe2 and provide strong interactions between polysulfides and Co-MoSe2, leading to the enhanced catalytic activity for fast redox kinetics. In addition to replacing the original atoms in the substrates, heteroatoms can also be embedded into the structural gaps of the substrates. For example, Yang and co-workers [184] fabricated ultrathin-layered cation-doped Sn-MoO3 nanoribbons, in which the Sn atoms intercalated into the MoO3 van der Waals gap (Fig. 6(h))). The DOS patterns of pure and Sn-MoO3 slab show that the valence electrons of Sn have partially transferred to MoO3 slab. Meanwhile, the infused electrons from intercalated Sn atoms have replaced the original bandgap with the spreading states around Fermi level, resulting in the metallic properties of Sn-MoO3 (Figs. 6(i) and 6(j)). Besides, these spreading states around Fermi level are mainly contributed from Mo and O atoms, which are easily to be affected by adsorbates and will further lead to the enhanced binding strength. As expected, the DOS pattern of the adsorbed Li2S4 reveals that electrons were transferred from lower states into upper levels after Sn intercalation (Figs. 6(k) and 6(l)). The increased electrons in the upper states near Fermi level is easier to participate into the sulfur redox reactions, thus leading to better electrochemical performance. Apart from cation/anion doping, heteroatom doping using simultaneous cation (Co) and anion (P) modifications of MoS2 could also improve the sulfur conversion reaction [185]. The doping of Co turns MoS2 from 2H phase to 1T phase, thereby increasing the electrical conductivity of MoS2. Meanwhile, the formation of Co-P coordination sites on the surface of the catalyst are effective for the polysulfide redox reaction. This work provides the first direct evidence that heteroatom co-doping is beneficial to polysulfide conversion. Note that although the doping strategy in the form of either substitution or attachment to conductive hosts is widely used to modulate the chemisorption capability and electrical conductivity, multiple factors, such as doping sites, dopant distribution, and doping content, could greatly influence the catalytic properties of designed materials and their impact on the electrochemical performance of Li-S batteries need further investigation. 3.2.4 Single atom doping Single atom catalysts (SACs) are rapidly becoming a fascinating research frontier in the field of catalysis [186,187]. Benefiting from the maximized atom-utilization efficiency and well-defined catalytic active sites, SACs showcase a great potential in promoting various electrochemical reactions with improved selectivity. The uniformity and simplicity of the SACs structure make it possible to accurately characterize and identify the active sites, thereby deepening the understanding the relationship between the structure and the catalytic effect at the atomic level. Recently, SACs with unique atomic structures have been introduced into Li-S batteries, exhibiting excellent catalytic activity in accelerating polysulfide conversion [188,189]. Yang and co-workers [190] first reported the application of Fe single atom loaded on N-doped carbon as a sulfur host for Li-S batteries. However, the lack of sufficient evidences to clearly define the coordination structure of Fe single atom makes its single atom catalyst somewhat controversial. Until 2019, Du et al. [191] prepared SACs of Co-embedded N-doped graphene (Co-N/G) and used it as a sulfur host. They clearly revealed the coordination environment of Co single atom with a Co-N4 square-planar structure (i.e., Co atom coordinates with four N atoms). The Co-N coordination center can serve as a bifunctional electrocatalyst to promote both the formation and decomposition of Li2S. Therefore, the as-fabricated Co-N/G electrode allows a high utilization of sulfur active materials even with a high sulfur mass ratio of 90 wt%. After that, atomically dispersed Fe/C2N [192], single atom Zn-MXene [193], single atom Co-N-doped carbon nanosheet [194], and O, N-coordinated single atom Mn [195] have also been employed into Li-S system. Especially, Zhou et al. fabricated a variety of single atom materials, including single atom Fe, Mn, Ru, Zn, Co, Cu, V, and Ag, on N-doped graphene (NG). Among these single atom materials, V single atom on NG shows the smallest decomposition barrier (1.10 eV), lowest lithium ion diffusion barriers (0.23 eV), and highest polysulfide chemisorption capability (3.38 eV), thereby presenting high catalytic activity to expedite sulfur redox reactions [196]. Precisely regulating the coordination structure of the metal center and further enhancing the catalytic activity of the metal-nitrogen-carbon (M-NC) electrocatalyst is extremely important to realize high-performance Li-S batteries [197,198]. It is well known that the nonpolar M-N4 coordination is unfavorable for the adsorption of intermediate products owing to the high electronegativity of the plane-symmetric N atoms around the metal atom [199]. In contrast, the M-N2 coordination can present excellent electrochemical activity because of their highly unsaturated coordination [200]. Based on the above consideration, uniform and stable Fe-N2 coordination structure was successfully constructed by Qiu et al. [201] and used as a sulfur host. The DOS in Fig. 7(a) ) reveals that Fe-N2/carbon nitride (Fe-N2/CN) possesses more states near the Fermi energy level than that of carbon nitride (CN), indicating that the Fe atom doping can improve the conductivity of CN, which is beneficial for the electron transfer in the sulfur redox conversion. The PDOS of Fe-N2/CN (Fig. 7(b))) shows sharp peaks that are attributed to the Fe 3d electrons, which play a positive role in modulating the polysulfide adsorption and interfacial electron transfer. Meanwhile, the calculated binding energy of Li2S adsorbed on the Fe-N2 (–3.12 eV) is much higher than that on the CN (–1.51 eV). Besides, the Fe-N2 sites also reduce the decomposition energy barrier of Li2S (Fig. 7(c))). Thus, the unsaturated Fe-N2 can serve as a bifunctional site for entrapping and activating polysulfides to accelerate the reversible conversion from S8 to Li2S. Eventually, the as-fabricated Fe-N2/CN@S cathode delivers a high rate capacity and stable cycling performance. To further optimize the polysulfide adsorption and catalytic process in Li-S system, Ma et al. [202] constructed an integrated catalyst containing Fe single atom and Fe2N nanocrystals co-decorated on N-doped graphene (SA-Fe/Fe2N@NG). The symmetrical charge distribution of the planar SA-Fe structure allows only top-site adsorption of polysulfides (Figs. 7(d) and 7(f)). By contrast, an asymmetric electron distribution of Fe2N exhibits tends to combine sulfur atoms through the bridge sites of two adjacent iron sites, which is attributed to the triangular pyramid coordination of Fe-3N (Figs. 7(e) and 7(g)). Besides, the abundant and interconnected Fe-N coordination sites in Fe2N help to alleviate the saturation adsorption effect caused by the limited Fe active sites of single atom Fe. Thus, SA-Fe/Fe2N@NG exhibits a high adsorption capability toward polysulfides (Fig. 7(h))). The low Gibbs free energy (0.556 eV) on SA-Fe (Fig. 7(i))) indicates that the reduction from Li2S2 to Li2S is thermodynamically favorable on SA-Fe sites. Notably, the lower free energy profile of Li2S decomposition on Fe2N (0.138 eV) compared with that on NG (3.117 eV) and SA-Fe (1.395 eV) reveals the facile delithiation kinetics with the introduction of Fe2N (Figs. 7(j)–7(l)). These results reveal that the synergistic Fe2N and SA-Fe composite sites improve the chemisorption and catalytic conversion of polysulfides. Up to now, the preparation of SACs has always confronted issues such as the high surface free energy of isolated metal atoms, thereby resulting in the easy aggregation of metal atoms and subsequent sacrifice the catalytic activity. To this end, most available SACs tend to reduce the metal loading (usually below 1.0 wt%) to maintain the isolated state of metal atoms without aggregation, which severely limits the practical application of SACs [191,203]. To realize high performance Li-S batteries, host materials containing a high content of single metal atoms is required to provide abundant active sites to achieve enhanced polysulfide immobilization and their fast transformation. Co single-atom catalyst embedded in N-doped carbon with a high Co content of 15.3 wt% (CoSA-N-C) was fabricated by Li et al. [194]. The high-content Co-N species in CoSA-N-C not only chemically entrap the dissolved polysulfides but also significantly promote the transformation from polysulfides to Li2S. In addition, the CoSA-N-C also efficiently catalyzes the oxidation of Li2S into polysulfides. Therefore, CoSA-N-C@S electrode with high Co content delivers an outstanding electrochemical performance with high sulfur utilization (1574 mAh g−1 at 0.05 C), superior rate capability (624 mAh g−1 at 5 C), and excellent cycle stability (capacity fade rate of 0.035% per cycle for 1000 cycles at 1 C). To realize the high energy density of Li-S batteries, it is necessary to further increase the loading of SACs. Moreover, selecting a suitable support material for the single atom metals not only helps the uniform distribution of single atoms without agglomeration but also facilitates the charge transfer kinetics of the electrochemical reaction. Currently, the existing carrier materials are mainly nano-carbon materials. Researchers should pay more attention to other two-dimensional nanomaterials with novel structures. On the other hand, different single atom metals with distinctive structures and properties may display different catalytic effects for polysulfide conversion, and therefore, designing multiple single atom metals for specific catalytic conversion effects of Li-S batteries is also of great significance. 3.3 Band engineering Generally, interfacial interactions involving surface adsorption and interfacial charge transfer play a crucial role in the electrochemical performance of sulfur cathodes [204,205]. According to the Sabatier principle, too weak adsorption between host materials and polysulfides cannot be beneficial to the interfacial electron/ion transfer and will result in severe shuttle effect, while too strong chemisorption with stable configuration may also impede the ion diffusion and subsequent redox conversion [206]. Therefore, modifying the interfacial interactions by regulating the electronic states of sulfur hosts is important for polysulfide redox reaction. For transition metal-based compounds composed of metallic cations and nonmetallic anions, the partially filled d orbitals of the metallic cations are generally considered as the active sites for the charge transfer and polysulfide redox reactions [150,207]. Therefore, adjusting the adsorption energy can be achieved by regulating the position of the d bands. For instance, Shen et al. [150] proposed a strategy of tuning the d bands of electrocatalysts to enhance polysulfide redox kinetics. After engineering N vacancies in the Ni3N, the Ni–Ni bond length of Ni3N0.85 increases and the position of d bands is elevated, thereby enhancing adsorption capability of polysulfides and expediting their conversion. The d band modulation strategy is also reported by alloying Co to the metal sites of Ni2P (Ni2Co4P3) to accelerate the reaction kinetics of polysulfides. DOS analysis (Figs. 8(a) and 8(b) ) reveals that the Co 3d bands in Ni2Co4P3 is higher than the Ni 3d bands in Ni2P and Ni2Co4P3. Since the Co 3d bands have a lower filling fraction and higher center than Ni 3d bands, stronger adsorption capability toward polysulfide molecules is achieved [207]. Meanwhile, Ni2Co4P3 weakens the S–S bonds and reduces the activation energy of polysulfide conversion (Fig. 8(c))). As a consequence, the polysulfide shuttle is effectively reduced, leading to the excellent cycling stability. In addition to adopting d band modulation of metal elements to expedite polysulfide conversion, p band regulation of nonmetallic elements has also attracted much attention. For example, Zhou et al. [208] disclosed the adjustment mechanism of Li-S chemistry by the p band engineering of nonmetallic anions at the atomic level. They fabricated a variety of Co-based compounds (CoS2, Co4N, Co3O4 and CoP) with fixed metal cation and varied non-metal anions, and systematically studied the kinetic behaviors of Li-S chemistry. The DOS shown in Fig. 8(d)) reveals that the p band center of CoP possesses a remarkable upshift with respect to Fermi level, thereby enabling a reduced energy gap between the anion 2p and cobalt 3d band centers (Fig. 8(e))). Especially, the P anion atoms are softer with less electron pulling force than the O and S atoms in various Co-based compounds, which leads to an increase in the energy of the bonding state and a decrease in the energy gap between the antibonding and bonding orbitals. This further leads to higher electronic energy because the anion has more hybridization and contribution to the valence band electrons, thereby promoting electron transfer and interfacial redox kinetics. Importantly, the CoP exhibits low d-p band centers, small redox potential of S6 2– and S4 2– (Fig. 8(f))), low Li2S diffusion energy (Fig. 8(f))) as well as mild adsorption capability for Li2S6 (Fig. 8(g)), 4.13 eV) compared to other Co-based compounds. As a consequence, the CoP presents higher catalytic activity than t other Co-based compounds. This work reveals that the position of the p bands from the non-metallic anions of electrocatalysts plays an important role in Li-S chemistry by adjusting the interface electron transfer kinetics. It is known from the quantum chemistry that the valence electrons play a crucial role in the formation and breaking of bonds among various elements [209]. For metal-based compounds containing metal cations and non-metal anions, the energy level of the electrons in the p orbitals and d orbitals will directly affect the formation/breaking of the bonds. Based on above theory, the d-p band model was successfully applied into the Fe-based materials (Fe3O4@C, FeS@C, Fe3N@C) in Li-S system [210]. The p-band centers of non-metal anions (O, C, S, and N elements) and d-band centers of metal cation (Fe) based on the DOS is shown in Fig. 8(h)). Among these Fe-based compounds, Fe3C shows the smallest average difference between the center of the d-bands and the p-bands (∆p-d), following the order of ∆p-d (Fe3C) < ∆p-d (Fe3O4) < ∆p-d (FeS) < ∆p-d (Fe3N). Meanwhile, the relationship between ∆p-d center and the reaction voltage of Li2S4 (Fig. 8(i))) clearly reveals that a smaller energy band difference (∆p-d) corresponds to a smaller reaction voltage. More importantly, the reduction of the ∆p-d center reduces the energy barrier of S-S bond breaking, thus enhancing the reaction kinetics of polysulfide conversion. The radial distribution function of g(r)s–s in Fig. 8(j)) further confirms the reduced energy barrier of S–S bond breaking. As shown in Fig. 8(j)), the radius of the first peak, which corresponds to the distance between adjacent S atoms, is 2.05 Å for graphene and Fe3O4, and this value is 2.15 Å for Fe3C. Obviously, the distance between S molecules on Fe3C is more stretched than that on graphene and Fe3O4, which means that Li2S6 molecules on Fe3C have the most significant degree of intermolecular bond breakage. This result demonstrates that the reduction of the ∆p-d center reduces the energy barrier of S–S bond breaking and a better catalyst ability of Fe3C for the polysulfides. 3.4 Alloying engineering Alloy engineering is another commonly adopted method for manufacturing high-performance electrode materials for Li-S batteries [211–215]. By alloying with other metals, the electronic structures of electrocatalysts can be tailored by regulating their compositions, which can boost the electrocatalytic performance [214,215]. For example, Liu et al. [215] designed a Pt-Ni core shell bimetallic catalyst and used it as sulfur host. The Pt 4f X-ray photoelectron spectroscopy (XPS) of Pt-Ni alloy catalyst (Fig. 9(a) )) obviously shifts to low binding energy compared to pure Ni, revealing the electron transfer from Ni to Pt. Therefore, Pt-Ni bimetal shows the highest occupied molecular orbital-lowest unoccupied molecular orbital (HOMO-LUMO) gap, indicating the low energy barrier of polysulfide conversion reaction. Meanwhile, the Pt-Ni bimetal presents high adsorption capacity toward polysulfides (Figs. 9(b) and 9(c)). Therefore, the electrocatalytic activity of bimetal Pt-Ni is remarkably improved. Eventually, the as-fabricated Pt-Ni bimetal demonstrates a decent cycle stability, which preserves high capacity of approximate 600 mAh g−1 at 1 C after 300 cycles. Inspired by this research, other alloy catalysts, such as Co x Sn y [216], Co-Fe [211,217], and Co-Te [218], have also been developed to accelerate the polysulfide conversion. Among these alloy catalyst materials, Song et al. [218] found an interesting phenomenon that the sulfur-poisoned transition metals can be avoided by alloying strategy (Co-Te alloy). Alloying Co with metal Te changes the sulfur adsorption sites and the corresponding binding energies, which enables intact adsorption of S8. The ab initio molecular dynamics (AIMD) simulations reveal that the structure of S8 remains almost intact when approaching the surface of CoTe2 (Figs. 9(d) and 9(e)) and the adsorption configuration of S8 on CoTe2 remains ring-like S8 molecule by forming two Co–S bonds, indicating that the sulfur poisoning can be inhibited on the surface of CoTe2. In contrast, inevitable disassociation of S8 is observed on the Co surface, and the adsorption geometry of S8 on Co is that eight S atoms bind with the surface. Meanwhile, the Gibbs free energy of polysulfide reduction on the surface of CoTe2 is lower than on the poisoned Co, suggesting that the sulfur reduction process is thermodynamically more favorable on the surface of CoTe2. These merits render Co-Te alloy an excellent catalyst which significantly boosts the sulfur redox reactions and restrains polysulfide shuttle. Thus, sulfur cathode using Co-Te alloy catalyst exhibits a high rate capability of 898 mAh g−1 at 2 C together with a low capacity decay of 0.03% after 1000 cycles. However, the above mentioned Co-based or Pt-based alloy catalysts possess disadvantages of high cost and scarce resources as well as toxic characteristic, which are not suitable for the commercial application of Li-S batteries. Therefore, it is urgent to develop cheap and non-toxic alloy catalytic materials. The low-cost and eco-friendly Ni is known for its high alloying efficiency with many transition metals in different mass ratios [219], which makes it easier to develop a wide range of composition-dependent bimetallic Ni alloys for potentially large-scale application in Li-S batteries. Thus, alloying metal Ni with a low-cost and non-toxic metal is more suitable for improving catalyst activity. For example, nickel-boron (Ni-B) alloy nanoparticles embedded into the carbon nanotube microspheres (CNTMs) have been used as sulfur hosts in Li-S batteries [213]. Ni-B alloy can not only entrap polysulfides through the formation of Ni–S and B–S bonds but also exhibit high catalytic capability toward the conversion of polysulfides. In addition, a cost-effective Ni-Fe alloy is also confirmed to be an efficient catalyst to accelerate the conversion reaction of polysulfide intermediates (Fig. 9(f))) [220]. Note that the alloy catalysts currently employed in Li-S batteries are all dense particles, which not only significantly reduces the active sites but also increases unnecessary mass. Therefore, it is important to rationally design alloy catalysts with three-dimensional porous structure to help further improving the corresponding catalytic activity. 3.5 Heterostructures Design of heterostructures is another promising strategy to construct active interfaces for electrocatalysis, which can create new catalytic sites by modulating the interfacial electronic structure and lattice strain [221–223]. Unlike alloying with one or more other metals, heterostructure engineering generally involves the hybridization of different kinds of compounds with intimate interfaces, such as carbon-metal compound interfaces [224,225], metal compound-metal compound interfaces [222,223], and metal compound-polymer interfaces [226]. To better understand the effect of electronic structure modulation on the catalytic activity of heterostructures, herein we focus on the metal compound-metal compound heterostructures. For the metal-compound based heterostructures, the rapid conversion of polysulfides is achieved by adsorbing-diffusion-transforming mechanism, which can sufficiently exert the advantages of each component [223]. One of the pioneering works is the fabrication of novel MoS2-MoN heterostructure [227]. By combining with the respective advantages of high conductivity of MoN and fast Li ion diffusion accelerated by MoS2, the hetero-interface ensures fast redox conversion from dissolved polysulfides into insoluble Li2S (Fig. 10(a) )). The assembled battery delivers decent capacity and excellent capacity retention at high sulfur loading condition. After that, a variety of heterostructured catalytic materials, such as CoSe2/MoS2 [228], TiO2-TiN [229], MoC-MoO x [230], VO2-VN [231], TiO2-MXene [232], TiN-sulfur-doped oxide layer [233], MO x -MXene (M: Ti, V, and Nb) [234], and V8C7-VO2 [235] and NiO-NiCo2O4 [236], have been designed and reported. Different from above catalytic conversion by heterostructures, Yang et al. [237] found that the deposition morphology of Li2S can also be regulated through a rationally designed MoN@SnO2 nanodot heterostructure. The formed high-accessible interfaces serve as the facile nucleation sites to guide the three-dimensional growth of Li2S, which avoids the surface passivation and facilitates the polysulfide conversion (Figs. 10(b) and 10(c)). Meanwhile, the metallic Mo2N microbelts with high electrical conductivity and good catalytic activity can effectively enhance the reaction kinetics of polysulfides and provide a large surface area for Li2S deposition, while the SnO2 nanodots can effectively entrap polysulfides. Thus, the assembled MoN@SnO2/S cathode delivers a high capacity of 738.3 mAh g−1 after 550 cycles (0.5 C) with a low capacity decay of 0.025% per cycle. Even with under a high sulfur loading of 9.0 mg cm−2 and a low E/S ratio of 5 μL mg−1, excellent cycle stability is also obtained at 0.5 C. Obviously, most of the reported electrocatalysts only work for one direction sulfur reduction reaction, while the oxidation of Li2S by electrocatalysts is largely ignored. If the designed electrocatalyst cannot promote the decomposition of reactive Li2S, it will gradually evolve into a dense passivation layer during repeated cycling owing to the high decomposition barrier of Li2S. Wang et al. [238] proposed a typical bidirectional catalyst of TiO2-Ni3S2 heterostructure to accelerate both the reduction of dissolved polysulfides and the oxidation of Li2S to suppress the catalyst surface passivation. More specifically, during the discharge process, TiO2 presents a strong adsorption capability toward polysulfides and the high catalytic activity of Ni3S2 effectively accelerates the polysulfide reduction. During the subsequent oxidation process, both Ni3S2 and TiO2 exhibit high catalytic oxidation activity toward Li2S, refreshing the catalyst surface. Therefore, the assembled TiO2-Ni3S2@S cathode shows a low capacity decay of 0.038% per cycle for 900 cycles at 0.5 C and excellent cyclic stability with a capacity retention of 65% over 500 cycles at 0.3 C under a sulfur loading of 3.9 mg cm−2. In order to more deeply understand the heterogeneous strategy, Ye et al. [239] developed a two-dimensional MoN-VN heterostructure as a sulfur host (Fig. 10(d))) to gain an atomic-level understanding of polysulfide adsorption. Mo L-edge near-edge X-ray absorption fine structure (NEXAFS) results (Fig. 10(e))) show that the peak positions of LIII-edge and LII-edge for MoN-VN (2524.0 and 2624.3 eV) shift toward high photon energy compared to that of MoN (2523.7 and 2624.0 eV), indicating a higher oxidation state of Mo in MoN-VN. This probably results from the decreased electron density of Mo in MoN-VN heterostructure owing to the strong coupling between MoN and VN. Meanwhile, a slightly positive shift of Mo XPS spectra (Fig. 10(f))) for the MoN-VN heterostructure further confirms the coupling between MoN and VN. More importantly, MoN-VN heterostructure presents a higher Ep position of the Mo density of state (DOS, Fig. 10(g))) compared with that of MoN. As is known from the orbital hybridization theory, the higher Ep position results in a lower occupancy of anti-bonding states, leading to a stronger adsorption of polysulfides. Based on the tightly coupled interface and enhanced adsorption capability, the MoN-VN@S cathode delivers a high rate capacity of 708 mAh g−1 at 2 C and a low capacity decay of 0.068% per cycle over 500 cycles. Although great progress has been made for the heterostructures used for Li-S batteries, there are still many controversies regarding the special adsorption-diffusion-transfor- mation mechanism. More direct evidences are highly needed to reveal the migration of polysulfides among each component in the heterostructures. Meanwhile, it is also necessary to further explore the origins of the different catalytic activities of heterostructures with different component ratios in combination with theoretical calculations. 4 Conclusions and future outlook Practical application of Li-S batteries is severely impeded by their inferior cycle stability and poor rate performance, which mainly derives from the polysulfide shuttle. Various electrocatalysts have been employed in Li-S batteries, which can expedite the conversion of polysulfides into the insoluble products and are considered as one of the most effective strategies to suppress the shuttle effect. Regulating the electronic structure of electrocatalysts is the key to accurately and controllably regulate the catalytic performance of electrocatalysts in the polysulfide redox process. In this review, we mainly summarize the fascinating strategies to tailor the electronic structures of electrocatalysts, including vacancy engineering, heteroatom doping, single atom doping, band regulation, alloying, and heterostructure engineering. The relationship between the electronic structure of catalytic materials and their catalytic activity is described in details, aiming to provide a rational guidance for the precise design of electrocatalysts with specific activities. Despite significant progress has been made in the past few years, the employment of electrocatalyst materials into Li-S batteries is still in the early stages, with many remaining challenges in developing ideal electrocatalysts for Li-S batteries: (1) Considering that the electronic structure of electrocatalysts greatly affects the physicochemical characteristics and subsequent electrochemical performance of the Li-S batteries, more effective strategies, e.g., precise regulation of doping atom/vacancy concentration, doping/vacancy type, and coordination environment of single atom metals, should be developed to finely modulate the electronic structures (2) The precise identification of structural characteristics (such as the arrangement of atoms in alloys, heterostructure interface and position of the doped atoms or vacancies) is the key to investigate the relationship between the electronic structure and physicochemical properties of electrocatalysts, which is still challenging. Thus, advanced characterization technologies such as XAS, cryo electron microscopy, and Cs-corrected TEM, should be employed to offer in-depth insight into the structure activity relationships. (3) Precise identification of the real catalytic active sites of the electrocatalysts in Li-S batteries is of great significance yet challenging. For example, previous literatures revealed that Fe3O4 [240] and cobalt-containing compounds [241] could react with polysulfides to form sulfides during the electrochemical reaction process, thus the pristine materials cannot be simply defined as the real active sites. Therefore, it is important to track the whole catalytic reaction through in situ characterization techniques (e.g., XAS, Raman, XPS, and XRD) and combine with theoretical models to unambiguously reveal the real active sites. (4) The elaboration of electrocatalysts for Li-S batteries towards practical application should take multiple factors into consideration. The electrocatalysts should possess appropriate chemical adsorption accompanied with high electronic conductivity to ensure the fast electron transfer as required for catalysis. In addition, hierarchical architectures with large numbers of exposed active sites to expedite the redox reaction are also necessary. Moreover, the commonly used electrocatalyst materials are mainly transition metal compounds with high bulk density and a certain degree of toxicity, which can significantly reduce the battery energy density. To improve the overall energy density of Li-S batteries and reduce environmental pollution and battery costs, it is also necessary to develop electrocatalysts derived from light elements rather than heavy or precious metal compounds/metals. (5) To realize high energy density of Li-S batteries, more attention should also be paid to the exploration of high-efficient electrocatalysts under practical applications, such as high-loading cathodes, limited anode excess and lean electrolytes. Notably, when soluble polysulfides are converted into solid Li2S, the active sites will be buried and thus causing loss of activity. The situation gets even worse under practical conditions, such as high sulfur loading, low-temperature, and low E/S ratio. In order to avoid catalyst failure, one of the most promising strategies is to increase the active sites of catalysts through reasonable nanostructure design instead of increasing the catalyst loading. For example, by designing a bidirectional catalyst with a three-dimensional porous structure, more catalytic active sites can be exposed during the discharge process, thereby preventing the catalyst from being completely covered. While for the following oxidation process, bidirectional catalyst also promotes the decomposition of Li2S to refresh electrocatalyst surface. Therefore, the high catalytic activity of electrocatalyst is well retained during the entire electrochemical process. In addition, reducing the size of the catalyst (such as single atom catalyst) can also increase the number of active sites of catalyst, thereby effectively reducing the catalyst loading. In summary, designing sulfur host materials with high catalytic activity has provided a new direction towards high-performance Li-S batteries. We believe that the high-efficiency electrocatalysts with high activity and special functions can be obtained through the coordination of various electronic structure regulation strategies, which can further improve the electrochemical performance of Li-S batteries and also enlighten other energy-related processes based on multi-electron reactions. References 1 P. Zeng C. Yuan J. An X. Yang C. Cheng T. Yan G. Liu T. Chan J. Kang L. Zhang X. Sun Energy Storage Mater. 44 2022 425 432 P. Zeng, C. Yuan, J. An, X. Yang, C. Cheng, T. Yan, G. Liu, T. Chan, J. Kang, L. Zhang, X. Sun, Energy Storage Mater., 2022, 44, 425–432. 2 P. Zeng C. Liu C. Cheng C. Yuan K. Dai J. Mao L. Zheng J. Zhang L.Y. Chang S.C. Haw T.S. Chan H.P. Lin L. Zhang J. Mater. Chem. A 9 2021 18526 18536 P. Zeng, C. Liu, C. Cheng, C. Yuan, K. Dai, J. Mao, L. Zheng, J. Zhang, L. Y. Chang, S. C. Haw, T. S. Chan, H. P. Lin, L. Zhang, J. Mater. Chem. A, 2021, 9, 18526–18536. 3 J.M. Cameron C. Holc A.J. Kibler C.L. Peake D.A. Walsh G.N. Newton L.R. Johnson Chem. Soc. Rev. 50 2021 5863 5883 J. M. Cameron, C. Holc, A. J. Kibler, C. L. Peake, D. A. Walsh, G. N. Newton, L. R. Johnson, Chem. Soc. Rev., 2021, 50, 5863–5883. 4 Y. Ding Z.P. Cano A. Yu J. Lu Z. Chen Electrochem. Energy Rev. 2 2019 1 28 Y. Ding, Z. P. Cano, A. Yu, J. Lu, Z. Chen, Electrochem. Energy Rev., 2019, 2, 1–28. 5 X. Yang X. Li K. Adair H. Zhang X. Sun Electrochem. Energy Rev. 1 2018 239 293 X. Yang, X. Li, K. Adair, H. Zhang, X. Sun, Electrochem. Energy Rev., 2018, 1, 239–293. 6 X. Li X. Sun Adv. Funct. Mater. 28 2018 1801323 X. Li, X. Sun, Adv. Funct. Mater., 2018, 28, 1801323. 7 X. Yang J. Luo X. Sun Chem. Soc. Rev. 49 2020 2140 2195 X. Yang, J. Luo, X. Sun, Chem. Soc. Rev., 2020, 49, 2140–2195. 8 C. Yuan X. Yang P. Zeng J. Mao K. Dai L. Zhang X. Sun Nano Energy 84 2021 105928 C. Yuan, X. Yang, P. Zeng, J. Mao, K. Dai, L. Zhang, X. Sun, Nano Energy, 2021, 84, 105928. 9 Y. Li S. Guo Matter 4 2021 1142 1188 Y. Li, S. Guo, Matter, 2021, 4, 1142–1188. 10 G. Li Z. Chen J. Lu Chem 4 2018 3 7 G. Li, Z. Chen, J. Lu, Chem, 2018, 4, 3–7. 11 S.M. Hwang Y.G. Lim J.-G. Kima Y.-U. Heo J.H. Lim Y. Yamauchie M.-S. Park Y.-J. Kim S.X. Dou J.H. Kim Nano Energy 10 2014 53 62 S. M. Hwang, Y. G. Lim, J.-G. Kima, Y.-U. Heo, J. H. Lim, Y. Yamauchie, M.-S. Park, Y.-J. Kim, S. X. Dou, J. H. Kim, Nano Energy, 2014, 10, 53–62. 12 J. Lee J. Moon S.A. Han J. Kim V. Malgras Y.-U. Heo H. Kim S.-M. Lee H.K. Liu S.X. Dou Y. Yamauchi M.-S. Park J.H. Kim ACS Nano 13 2019 9607 9619 J. Lee, J. Moon, S. A. Han, J. Kim, V. Malgras, Y.-U. Heo, H. Kim, S.-M. Lee, H. K. Liu, S. X. Dou, Y. Yamauchi, M.-S. Park, J. H. Kim, ACS Nano, 2019, 13, 9607–9619. 13 H.R. Xue J.Q. Zhao J. Tang H. Gong P. He H.S. Zhou Y. Yamauchi J.P. He Chem. Eur. J 22 2016 4915 4923 H. R. Xue, J. Q. Zhao, J. Tang, H. Gong, P. He, H. S. Zhou, Y. Yamauchi, J. P. He, Chem. Eur. J, 2016, 22, 4915–4923. 14 S.M. Hwang S.Y. Kim J.-G. Kim K.J. Kim J.-W. Lee M.-S. Park Y.-J. Kim M. Shahabuddin Y. Yamauchif J.H. Kim Nanoscale 7 2015 8351 8355 S. M. Hwang, S. Y. Kim, J.-G. Kim, K. J. Kim, J.-W. Lee, M.-S. Park, Y.-J. Kim, M. Shahabuddin, Y. Yamauchif, J. H. Kim, Nanoscale, 2015, 7, 8351–8355. 15 A. Hu M. Zhou T. Lei Y. Hu X. Du C. Gong C. Shu J. Long J. Zhu W. Chen X. Wang J. Xiong Adv. Energy Mater. 10 2020 2002180 A. Hu, M. Zhou, T. Lei, Y. Hu, X. Du, C. Gong, C. Shu, J. Long, J. Zhu, W. Chen, X. Wang, J. Xiong, Adv. Energy Mater., 2020, 10, 2002180. 16 F. Qi Z. Sun X. Fan Z. Wang Y. Shi G. Hu F. Li Adv. Energy Mater. 11 2021 2100387 F. Qi, Z. Sun, X. Fan, Z. Wang, Y. Shi, G. Hu, F. Li, Adv. Energy Mater., 2021, 11, 2100387. 17 J. Lian W. Guo Y. Fu J. Am. Chem. Soc. 143 2021 11063 11071 J. Lian, W. Guo, Y. Fu, J. Am. Chem. Soc., 2021, 143, 11063–11071. 18 H. Su L. Lu M. Yang F. Cai W. Liu M. Li X. Hu M. Ren X. Zhang Z. Zhou Chem. Eng. J. 429 2022 132167 H. Su, L. Lu, M. Yang, F. Cai, W. Liu, M. Li, X. Hu, M. Ren, X. Zhang, Z. Zhou, Chem. Eng. J., 2022, 429, 132167. 19 T.J. Xiao F.J. Yi M.Z. Yang W.L. Liu M. Li M. Ren X. Zhang Z. Zhou J. Mater. Chem. A 9 2021 16692 16698 T. J. Xiao, F. J. Yi, M. Z. Yang, W. L. Liu, M. Li, M. Ren, X. Zhang, Z. Zhou, J. Mater. Chem. A, 2021, 9, 16692–16698. 20 W.X. Hua H. Li C. Pei J.Y. Xia Y.F. Sun C. Zhang W. Lv Y. Tao Y. Jiao B.S. Zhang S.Z. Qiao Y. Wan Q.H. Yang Adv. Mater. 33 2021 2101006 W. X. Hua, H. Li, C. Pei, J. Y. Xia, Y. F. Sun, C. Zhang, W. Lv, Y. Tao, Y. Jiao, B. S. Zhang, S. Z. Qiao, Y. Wan, Q. H. Yang, Adv. Mater., 2021, 33, 2101006. 21 M. Zhao B.Q. Li H.J. Peng H. Yuan J.Y. Wei J.Q. Huang Angew. Chem. Int. Ed. 59 2020 12636 12652 M. Zhao, B. Q. Li, H. J. Peng, H. Yuan, J. Y. Wei, J. Q. Huang, Angew. Chem. Int. Ed., 2020, 59, 12636–12652. 22 W. Chen T. Lei C. Wu M. Deng C. Gong K. Hu Y. Ma L. Dai W. Lv W. He X. Liu J. Xiong C.L. Yan Adv. Energy Mater. 8 2018 1702348 W. Chen, T. Lei, C. Wu, M. Deng, C. Gong, K. Hu, Y. Ma, L. Dai, W. Lv, W. He, X. Liu, J. Xiong, C. L. Yan, Adv. Energy Mater., 2018, 8, 1702348. 23 H. Shin M. Baek A. Gupta K. Char A. Manthiram J.W. Choi Adv. Energy Mater. 10 2020 2001456 H. Shin, M. Baek, A. Gupta, K. Char, A. Manthiram, J. W. Choi, Adv. Energy Mater., 2020, 10, 2001456. 24 J. Guo H. Pei Y. Dou S. Zhao G. Shao J. Liu Adv. Funct. Mater. 31 2021 2010499 J. Guo, H. Pei, Y. Dou, S. Zhao, G. Shao, J. Liu, Adv. Funct. Mater., 2021, 31, 2010499. 25 X.-B. Cheng C. Yan X. Chen C. Guan J.-Q. Huang H.-J. Peng R. Zhang S.-T. Yang Q. Zhang Chem 2 2017 258 270 X.-B. Cheng, C. Yan, X. Chen, C. Guan, J.-Q. Huang, H.-J. Peng, R. Zhang, S.-T. Yang, Q. Zhang, Chem, 2017, 2, 258–270. 26 R. Zhang X. Chen X. Shen X.-Q. Zhang X.-R. Chen X.-B. Cheng C. Yan C.-Z. Zhao Q. Zhang Joule 2 2018 764 777 R. Zhang, X. Chen, X. Shen, X.-Q. Zhang, X.-R. Chen, X.-B. Cheng, C. Yan, C.-Z. Zhao, Q. Zhang, Joule, 2018, 2, 764–777. 27 B. Yu Y. Fan S. Mateti D. Kim C. Zhao S. Lu X. Liu Q. Rong T. Tao K.K. Tanwar X. Tan S.C. Smith Y.I. Chen ACS Nano 15 2021 1358 1369 B. Yu, Y. Fan, S. Mateti, D. Kim, C. Zhao, S. Lu, X. Liu, Q. Rong, T. Tao, K. K. Tanwar, X. Tan, S. C. Smith, Y. I. Chen, ACS Nano, 2021, 15, 1358–1369. 28 X.B. Cheng R. Zhang C.Z. Zhao Q. Zhang Chem. Rev. 117 2017 10403 10473 X. B. Cheng, R. Zhang, C. Z. Zhao, Q. Zhang, Chem. Rev., 2017, 117, 10403–10473. 29 S. Zhou I. Usman Y. Wang A. Pan Energy Storage Mater. 38 2021 141 156 S. Zhou, I. Usman, Y. Wang, A. Pan, Energy Storage Mater., 2021, 38, 141–156. 30 Z. Lin Z. Liu N.J. Dudney C. Liang ACS Nano 7 2013 2829 2833 Z. Lin, Z. Liu, N. J. Dudney, C. Liang, ACS Nano, 2013, 7, 2829–2833. 31 M.K. Song E.J. Cairns Y. Zhang Nanoscale 5 2013 2186 2204 M. K. Song, E. J. Cairns, Y. Zhang, Nanoscale, 2013, 5, 2186–2204. 32 Y. Yang G. Zheng Y. Cui Chem. Soc. Rev. 42 2013 3018 3032 Y. Yang, G. Zheng, Y. Cui, Chem. Soc. Rev., 2013, 42, 3018–3032. 33 S.F. Ng M.Y.L. Lau W.J. Ong Adv. Mater. 33 2021 2008654 S. F. Ng, M. Y. L. Lau, W. J. Ong, Adv. Mater., 2021, 33, 2008654. 34 W. Guo W. Zhang Y. Si D. Wang Y. Fu A. Manthiram Nat. Commun. 12 2021 3031 W. Guo, W. Zhang, Y. Si, D. Wang, Y. Fu, A. Manthiram, Nat. Commun., 2021, 12, 3031. 35 H. Wan S. Liu T. Deng J. Xu J. Zhang X. He X. Ji X. Yao C. Wang ACS Energy Lett. 6 2021 862 868 H. Wan, S. Liu, T. Deng, J. Xu, J. Zhang, X. He, X. Ji, X. Yao, C. Wang, ACS Energy Lett., 2021, 6, 862–868. 36 K. Liu X. Zhang F. Miao Z. Wang S. Zhang Y. Zhang P. Zhang G. Shao Small 17 2021 2100065 K. Liu, X. Zhang, F. Miao, Z. Wang, S. Zhang, Y. Zhang, P. Zhang, G. Shao, Small, 2021, 17, 2100065. 37 A.S. Alzahrani M. Otaki D. Wang Y. Gao T.S. Arthur S. Liu D. Wang ACS Energy Lett. 6 2021 413 418 A. S. Alzahrani, M. Otaki, D. Wang, Y. Gao, T. S. Arthur, S. Liu, D. Wang, ACS Energy Lett., 2021, 6, 413–418. 38 I. Tantis A. Bakandritsos D. Zaoralova M. Medved P. Jakubec J. Havlakova R. Zboril M. Otyepka Adv. Funct. Mater. 31 2021 2101326 I. Tantis, A. Bakandritsos, D. Zaoralova, M. Medved, P. Jakubec, J. Havlakova, R. Zboril, M. Otyepka, Adv. Funct. Mater., 2021, 31, 2101326. 39 Y. Zhang Y. Luo C. Fincher S. McProuty G. Swenson S. Banerjee M. Pharr Energy Storage Mater. 16 2019 491 497 Y. Zhang, Y. Luo, C. Fincher, S. McProuty, G. Swenson, S. Banerjee, M. Pharr, Energy Storage Mater., 2019, 16, 491–497. 40 Z. Feng C. Kim A. Vijh M. Armand K.H. Bevan K. Zaghib J. Power Sources 272 2014 518 521 Z. Feng, C. Kim, A. Vijh, M. Armand, K. H. Bevan, K. Zaghib, J. Power Sources, 2014, 272, 518–521. 41 C. Zhang R. Du J.J. Biendicho M. Yi K. Xiao D. Yang T. Zhang X. Wang J. Arbiol J. Llorca Y. Zhou J.R. Morante A. Cabot Adv. Energy Mater. 11 2021 2100432 C. Zhang, R. Du, J. J. Biendicho, M. Yi, K. Xiao, D. Yang, T. Zhang, X. Wang, J. Arbiol, J. Llorca, Y. Zhou, J. R. Morante, A. Cabot, Adv. Energy Mater., 2021, 11, 2100432. 42 B. Zhang C. Luo G. Zhou Z.Z. Pan J. Ma H. Nishihara Y.B. He F. Kang W. Lv Q.H. Yang Adv. Funct. Mater. 31 2021 2100793 B. Zhang, C. Luo, G. Zhou, Z. Z. Pan, J. Ma, H. Nishihara, Y. B. He, F. Kang, W. Lv, Q. H. Yang, Adv. Funct. Mater., 2021, 31, 2100793. 43 J. Xiang W. Shen Z. Guo J. Meng L. Yuan Y. Zhang Z. Cheng Y. Shen X. Lu Y. Huang Angew. Chem. Int. Ed. 60 2021 14313 14318 J. Xiang, W. Shen, Z. Guo, J. Meng, L. Yuan, Y. Zhang, Z. Cheng, Y. Shen, X. Lu, Y. Huang, Angew. Chem. Int. Ed., 2021, 60, 14313–14318. 44 R. Li D. Rao J. Zhou G. Wu G. Wang Z. Zhu X. Han R. Sun H. Li C. Wang W. Yan X. Zheng P. Cui Y. Wu G. Wang X. Hong Nat. Commun. 12 2021 3102 R. Li, D. Rao, J. Zhou, G. Wu, G. Wang, Z. Zhu, X. Han, R. Sun, H. Li, C. Wang, W. Yan, X. Zheng, P. Cui, Y. Wu, G. Wang, X. Hong, Nat. Commun., 2021, 12, 3102. 45 W. Yan K.-Y. Yan G.-C. Kuang Z. Jin Chem. Eng. J. 424 2021 130316 W. Yan, K.-Y. Yan, G.-C. Kuang, Z. Jin, Chem. Eng. J., 2021, 424, 130316. 46 R. Saroha J.H. Oh Y.H. Seon Y.C. Kang J.S. Lee D.W. Jeong J.S. Cho J. Mater. Chem. A 9 2021 11651 11664 R. Saroha, J. H. Oh, Y. H. Seon, Y. C. Kang, J. S. Lee, D. W. Jeong, J. S. Cho, J. Mater. Chem. A, 2021, 9, 11651–11664. 47 L. Wang G.R. Li S. Liu X.P. Gao Adv. Funct. Mater. 31 2021 2010693 L. Wang, G. R. Li, S. Liu, X. P. Gao, Adv. Funct. Mater., 2021, 31, 2010693. 48 J. Qian Y. Xing Y. Yang Y. Li K. Yu W. Li T. Zhao Y. Ye L. Li F. Wu R. Chen Adv. Mater. 33 2021 2100810 J. Qian, Y. Xing, Y. Yang, Y. Li, K. Yu, W. Li, T. Zhao, Y. Ye, L. Li, F. Wu, R. Chen, Adv. Mater., 2021, 33, 2100810. 49 Z. Ma Z. Zuo Y. Li ACS Appl. Mater. Interfaces 13 2021 23936 23944 Z. Ma, Z. Zuo, Y. Li, ACS Appl. Mater. Interfaces, 2021, 13, 23936–23944. 50 X. Zhang G. Li Y. Zhang D. Luo A. Yu X. Wang Z. Chen Nano Energy 86 2021 106094 X. Zhang, G. Li, Y. Zhang, D. Luo, A. Yu, X. Wang, Z. Chen, Nano Energy, 2021, 86, 106094. 51 J. Balach T. Jaumann M. Klose S. Oswald J. Eckert L. Giebeler J. Power Sources 303 2016 317 324 J. Balach, T. Jaumann, M. Klose, S. Oswald, J. Eckert, L. Giebeler, J. Power Sources, 2016, 303, 317–324. 52 G. Zhou L. Li D.W. Wang X.Y. Shan S. Pei F. Li H.M. Cheng Adv. Mater. 27 2015 641 647 G. Zhou, L. Li, D. W. Wang, X. Y. Shan, S. Pei, F. Li, H. M. Cheng, Adv. Mater., 2015, 27, 641–647. 53 R. Ummethala M. Fritzsche T. Jaumann J. Balach S. Oswald R. Nowak N. Sobczak I. Kaban M.H. Rümmeli L. Giebeler Energy Storage Mater. 10 2018 206 215 R. Ummethala, M. Fritzsche, T. Jaumann, J. Balach, S. Oswald, R. Nowak, N. Sobczak, I. Kaban, M. H. Rümmeli, L. Giebeler, Energy Storage Mater., 2018, 10, 206–215. 54 R. Fang S. Zhao P. Hou M. Cheng S. Wang H.M. Cheng C. Liu F. Li Adv. Mater. 28 2016 3374 3382 R. Fang, S. Zhao, P. Hou, M. Cheng, S. Wang, H. M. Cheng, C. Liu, F. Li, Adv. Mater., 2016, 28, 3374–3382. 55 S.H. Chung C.H. Chang A. Manthiram ACS Nano 10 2016 10462 10470 S. H. Chung, C. H. Chang, A. Manthiram, ACS Nano, 2016, 10, 10462–10470. 56 Q. Sun X. Fang W. Weng J. Deng P. Chen J. Ren G. Guan M. Wang H. Peng Angew. Chem. Int. Ed. 54 2015 10539 10544 Q. Sun, X. Fang, W. Weng, J. Deng, P. Chen, J. Ren, G. Guan, M. Wang, H. Peng, Angew. Chem. Int. Ed., 2015, 54, 10539–10544. 57 B. Zhang X. Qin G.R. Li X.P. Gao Energy Environ. Sci. 3 2010 1531 1537 B. Zhang, X. Qin, G. R. Li, X. P. Gao, Energy Environ. Sci., 2010, 3, 1531–1537. 58 S. Xin L. Gu N.H. Zhao Y.X. Yin L.J. Zhou Y.G. Guo L.J. Wan J. Am. Chem. Soc. 134 2012 18510 18513 S. Xin, L. Gu, N. H. Zhao, Y. X. Yin, L. J. Zhou, Y. G. Guo, L. J. Wan, J. Am. Chem. Soc., 2012, 134, 18510–18513. 59 Z. Li L. Yuan Z. Yi Y. Sun Y. Liu Y. Jiang Y. Shen Y. Xin Z. Zhang Y. Huang Adv. Energy Mater. 4 2014 1301473 Z. Li, L. Yuan, Z. Yi, Y. Sun, Y. Liu, Y. Jiang, Y. Shen, Y. Xin, Z. Zhang, Y. Huang, Adv. Energy Mater., 2014, 4, 1301473. 60 S. Zheng P. Han Z. Han H. Zhang Z. Tang J. Yang Sci. Rep. 4 2014 4842 S. Zheng, P. Han, Z. Han, H. Zhang, Z. Tang, J. Yang, Sci. Rep., 2014, 4, 4842. 61 W.C. Du J. Zhang Y.X. Yin Y.G. Guo L.J. Wan Chem. Asian J. 11 2016 2690 2694 W. C. Du, J. Zhang, Y. X. Yin, Y. G. Guo, L. J. Wan, Chem. Asian J., 2016, 11, 2690–2694. 62 S.-H. Chung A. Manthiram Joule 2 2018 710 724 S.-H. Chung, A. Manthiram, Joule, 2018, 2, 710–724. 63 J. He Y. Chen A. Manthiram iScience 4 2018 36 43 J. He, Y. Chen, A. Manthiram, iScience, 2018, 4, 36–43. 64 M. Xiang L. Yang Y. Zheng J. Huang P. Jing H. Wu Y. Zhang H. Liu J. Mater. Chem. A 5 2017 18020 18028 M. Xiang, L. Yang, Y. Zheng, J. Huang, P. Jing, H. Wu, Y. Zhang, H. Liu, J. Mater. Chem. A, 2017, 5, 18020–18028. 65 L. Bao X. Li Adv. Mater. 24 2012 3246 3252 L. Bao, X. Li, Adv. Mater., 2012, 24, 3246–3252. 66 R. Elazari G. Salitra A. Garsuch A. Panchenko D. Aurbach Adv. Mater. 23 2011 5641 5644 R. Elazari, G. Salitra, A. Garsuch, A. Panchenko, D. Aurbach, Adv. Mater., 2011, 23, 5641–5644. 67 X. Li K. Ding B. Gao Q. Li Y. Li J. Fu X. Zhang P.K. Chu K. Huo Nano Energy 40 2017 655 662 X. Li, K. Ding, B. Gao, Q. Li, Y. Li, J. Fu, X. Zhang, P. K. Chu, K. Huo, Nano Energy, 2017, 40, 655–662. 68 Z. Wei Seh W. Li J.J. Cha G. Zheng Y. Yang M.T. McDowell P.C. Hsu Y. Cui Nat. Commun. 4 2013 1331 Z. Wei Seh, W. Li, J. J. Cha, G. Zheng, Y. Yang, M. T. McDowell, P. C. Hsu, Y. Cui, Nat. Commun., 2013, 4, 1331. 69 J. He L. Luo Y. Chen A. Manthiram Adv. Mater. 29 2017 1702707 J. He, L. Luo, Y. Chen, A. Manthiram, Adv. Mater., 2017, 29, 1702707. 70 X. Yao N. Huang F. Han Q. Zhang H. Wan J.P. Mwizerwa C. Wang X. Xu Adv. Energy Mater. 7 2017 1602923 X. Yao, N. Huang, F. Han, Q. Zhang, H. Wan, J. P. Mwizerwa, C. Wang, X. Xu, Adv. Energy Mater., 2017, 7, 1602923. 71 G.G. Eshetu X. Judez C. Li O. Bondarchuk L.M. Rodriguez-Martinez H. Zhang M. Armand Angew. Chem. Int. Ed. 56 2017 15368 15372 G. G. Eshetu, X. Judez, C. Li, O. Bondarchuk, L. M. Rodriguez-Martinez, H. Zhang, M. Armand, Angew. Chem. Int. Ed., 2017, 56, 15368–15372. 72 H. Zhang X. Judez A. Santiago M. Martinez-Ibanez M.A. Munoz-Marquez J. Carrasco C. Li G.G. Eshetu M. Armand Adv. Energy Mater. 9 2019 1900763 H. Zhang, X. Judez, A. Santiago, M. Martinez-Ibanez, M. A. Munoz-Marquez, J. Carrasco, C. Li, G. G. Eshetu, M. Armand, Adv. Energy Mater., 2019, 9, 1900763. 73 M. Shin A.A. Gewirth Adv. Energy Mater. 9 2019 1900938 M. Shin, A. A. Gewirth, Adv. Energy Mater., 2019, 9, 1900938. 74 W.P. Wang J. Zhang J. Chou Y.X. Yin Y. You S. Xin Y.G. Guo Adv. Energy Mater. 11 2020 2000791 W. P. Wang, J. Zhang, J. Chou, Y. X. Yin, Y. You, S. Xin, Y. G. Guo, Adv. Energy Mater., 2020, 11, 2000791. 75 H. Chen D. Adekoya L. Hencz J. Ma S. Chen C. Yan H. Zhao G. Cui S. Zhang Adv. Energy Mater. 10 2020 2000049 H. Chen, D. Adekoya, L. Hencz, J. Ma, S. Chen, C. Yan, H. Zhao, G. Cui, S. Zhang, Adv. Energy Mater., 2020, 10, 2000049. 76 P. Zhai N. Peng Z. Sun W. Wu W. Kou G. Cui K. Zhao J. Wang J. Mater. Chem. A 8 2020 23344 23353 P. Zhai, N. Peng, Z. Sun, W. Wu, W. Kou, G. Cui, K. Zhao, J. Wang, J. Mater. Chem. A, 2020, 8, 23344–23353. 77 Y. Lin K. Liu C. Xiong M. Wu T. Zhao J. Mater. Chem. A 9 2021 9665 9674 Y. Lin, K. Liu, C. Xiong, M. Wu, T. Zhao, J. Mater. Chem. A, 2021, 9, 9665–9674. 78 Z. Zhang L. Wu D. Zhou W. Weng X. Yao Nano Lett. 21 2021 5233 5239 Z. Zhang, L. Wu, D. Zhou, W. Weng, X. Yao, Nano Lett., 2021, 21, 5233–5239. 79 X. Zhang T. Liu S. Zhang X. Huang B. Xu Y. Lin B. Xu L. Li C.W. Nan Y. Shen J. Am. Chem. Soc. 139 2017 13779 13785 X. Zhang, T. Liu, S. Zhang, X. Huang, B. Xu, Y. Lin, B. Xu, L. Li, C. W. Nan, Y. Shen, J. Am. Chem. Soc., 2017, 139, 13779–13785. 80 D. Su M. Cortie G. Wang Adv. Energy Mater. 7 2017 1602014 D. Su, M. Cortie, G. Wang, Adv. Energy Mater., 2017, 7, 1602014. 81 F. Pei L. Lin D. Ou Z. Zheng S. Mo X. Fang N. Zheng Nat. Commun. 8 2017 482 F. Pei, L. Lin, D. Ou, Z. Zheng, S. Mo, X. Fang, N. Zheng, Nat. Commun., 2017, 8, 482. 82 M. Yan H. Chen Y. Yu H. Zhao C.-F. Li Z.-Y. Hu P. Wu L. Chen H. Wang D. Peng H. Gao T. Hasan Y. Li B.-L. Su Adv. Energy Mater. 8 2018 1801066 M. Yan, H. Chen, Y. Yu, H. Zhao, C.-F. Li, Z.-Y. Hu, P. Wu, L. Chen, H. Wang, D. Peng, H. Gao, T. Hasan, Y. Li, B.-L. Su, Adv. Energy Mater., 2018, 8, 1801066. 83 O. Ogoke S. Hwang B. Hultman M. Chen S. Karakalos Y. He A. Ramsey D. Su P. Alexandridis G. Wu J. Mater. Chem. A 7 2019 13389 13399 O. Ogoke, S. Hwang, B. Hultman, M. Chen, S. Karakalos, Y. He, A. Ramsey, D. Su, P. Alexandridis, G. Wu, J. Mater. Chem. A, 2019, 7, 13389–13399. 84 Q. Li J. Guo J. Zhao C. Wang F. Yan Nanoscale 11 2019 647 655 Q. Li, J. Guo, J. Zhao, C. Wang, F. Yan, Nanoscale, 2019, 11, 647–655. 85 Z. Yu M. Liu D. Guo J. Wang X. Chen J. Li H. Jin Z. Yang X. Chen S. Wang Angew. Chem. Int. Ed. 59 2020 6406 6411 Z. Yu, M. Liu, D. Guo, J. Wang, X. Chen, J. Li, H. Jin, Z. Yang, X. Chen, S. Wang, Angew. Chem. Int. Ed., 2020, 59, 6406–6411. 86 J. Song C. Zhang X. Guo J. Zhang L. Luo H. Liu F. Wang G. Wang J. Mater. Chem. A 6 2018 16610 16616 J. Song, C. Zhang, X. Guo, J. Zhang, L. Luo, H. Liu, F. Wang, G. Wang, J. Mater. Chem. A, 2018, 6, 16610–16616. 87 K. Liao S. Chen H. Wei J. Fan Q. Xu Y. Min J. Mater. Chem. A 6 2018 23062 23070 K. Liao, S. Chen, H. Wei, J. Fan, Q. Xu, Y. Min, J. Mater. Chem. A, 2018, 6, 23062–23070. 88 B.Q. Li S.Y. Zhang L. Kong H.J. Peng Q. Zhang Adv. Mater. 30 2018 1707483 B. Q. Li, S. Y. Zhang, L. Kong, H. J. Peng, Q. Zhang, Adv. Mater., 2018, 30, 1707483. 89 T. Liu L. Zhang B. Cheng J. Yu Adv. Energy Mater. 9 2019 1803900 T. Liu, L. Zhang, B. Cheng, J. Yu, Adv. Energy Mater., 2019, 9, 1803900. 90 J. Cai Z. Zhang S. Yang Y. Min G. Yang K. Zhang Electrochim. Acta 295 2019 900 909 J. Cai, Z. Zhang, S. Yang, Y. Min, G. Yang, K. Zhang, Electrochim. Acta, 2019, 295, 900–909. 91 Y. Ge Z. Chen S. Ye Z. Zhu Y. Tu X. Yang J. Mater. Chem. A 6 2018 14885 14893 Y. Ge, Z. Chen, S. Ye, Z. Zhu, Y. Tu, X. Yang, J. Mater. Chem. A, 2018, 6, 14885–14893. 92 J. Xiang Z. Guo Z. Yi Y. Zhang L. Yuan Z. Cheng Y. Shen Y. Huang J. Energy Chem. 49 2020 161 165 J. Xiang, Z. Guo, Z. Yi, Y. Zhang, L. Yuan, Z. Cheng, Y. Shen, Y. Huang, J. Energy Chem., 2020, 49, 161–165. 93 M. Jiang G. Liu Q. Zhang D. Zhou X. Yao ACS Appl. Mater. Interfaces 13 2021 18666 18672 M. Jiang, G. Liu, Q. Zhang, D. Zhou, X. Yao, ACS Appl. Mater. Interfaces, 2021, 13, 18666–18672. 94 J.-Z. Wang L. Lu M. Choucair J.A. Stride X. Xu H.-K. Liu J. Power Sources 196 2011 7030 7034 J.-Z. Wang, L. Lu, M. Choucair, J. A. Stride, X. Xu, H.-K. Liu, J. Power Sources, 2011, 196, 7030–7034. 95 L. Qie W. Chen H. Xu X. Xiong Y. Jiang F. Zou X. Hu Y. Xin Z. Zhang Y. Huang Energy Environ. Sci. 6 2013 2497 2504 L. Qie, W. Chen, H. Xu, X. Xiong, Y. Jiang, F. Zou, X. Hu, Y. Xin, Z. Zhang, Y. Huang, Energy Environ. Sci., 2013, 6, 2497–2504. 96 X. Gu C.-J. Tong C. Lai J. Qiu X. Huang W. Yang B. Wen L.-M. Liu Y. Hou S. Zhang J. Mater. Chem. A 3 2015 16670 16678 X. Gu, C.-J. Tong, C. Lai, J. Qiu, X. Huang, W. Yang, B. Wen, L.-M. Liu, Y. Hou, S. Zhang, J. Mater. Chem. A, 2015, 3, 16670–16678. 97 H. Shi X. Zhao Z.-S. Wu Y. Dong P. Lu J. Chen W. Ren H.-M. Cheng X. Bao Nano Energy 60 2019 743 751 H. Shi, X. Zhao, Z.-S. Wu, Y. Dong, P. Lu, J. Chen, W. Ren, H.-M. Cheng, X. Bao, Nano Energy, 2019, 60, 743–751. 98 H. Chen G. Zhou D. Boyle J. Wan H. Wang D. Lin D. Mackanic Z. Zhang S.C. Kim H.R. Lee H. Wang W. Huang Y. Ye Y. Cui Matter 2 2020 1605 1620 H. Chen, G. Zhou, D. Boyle, J. Wan, H. Wang, D. Lin, D. Mackanic, Z. Zhang, S. C. Kim, H. R. Lee, H. Wang, W. Huang, Y. Ye, Y. Cui, Matter, 2020, 2, 1605–1620. 99 H. Pan Z. Cheng Z. Xiao X. Li R. Wang Adv. Funct. Mater. 27 2017 1703936 H. Pan, Z. Cheng, Z. Xiao, X. Li, R. Wang, Adv. Funct. Mater., 2017, 27, 1703936. 100 S. Dörfler P. Strubel T. Jaumann E. Troschke F. Hippauf C. Kensy A. Schökel H. Althues L. Giebeler S. Oswald S. Kaskel Nano Energy 54 2018 116 128 S. Dörfler, P. Strubel, T. Jaumann, E. Troschke, F. Hippauf, C. Kensy, A. Schökel, H. Althues, L. Giebeler, S. Oswald, S. Kaskel, Nano Energy, 2018, 54, 116–128. 101 D. Rao H. Yang X. Shen X. Yan G. Qiao Phys. Chem. Chem. Phys. 21 2019 10895 10901 D. Rao, H. Yang, X. Shen, X. Yan, G. Qiao, Phys. Chem. Chem. Phys., 2019, 21, 10895–10901. 102 D. Kim G. Kim S. Oh J. Park S. Lee S. Yoon J. Lee W. Lee T.-Y. Jeon E. Cho K. Sohn D.-K. Yang J. Kim ACS Sustain. Chem. Eng. 8 2020 8537 8548 D. Kim, G. Kim, S. Oh, J. Park, S. Lee, S. Yoon, J. Lee, W. Lee, T.-Y. Jeon, E. Cho, K. Sohn, D.-K. Yang, J. Kim, ACS Sustain. Chem. Eng., 2020, 8, 8537–8548. 103 H. Al Salem G. Babu C.V. Rao L.M. Arava J. Am. Chem. Soc. 137 2015 11542 11545 H. Al Salem, G. Babu, C. V. Rao, L. M. Arava, J. Am. Chem. Soc., 2015, 137, 11542–11545. 104 J. He A. Manthiram Energy Storage Mater. 20 2019 55 70 J. He, A. Manthiram, Energy Storage Mater., 2019, 20, 55–70. 105 S. Wang J. Liao X. Yang J. Liang Q. Sun J. Liang F. Zhao A. Koo F. Kong Y. Yao X. Gao M. Wu S.-Z. Yang R. Li X. Sun Nano Energy. 57 2019 230 240 S. Wang, J. Liao, X. Yang, J. Liang, Q. Sun, J. Liang, F. Zhao, A. Koo, F. Kong, Y. Yao, X. Gao, M. Wu, S.-Z. Yang, R. Li, X. Sun, Nano Energy., 2019, 57, 230–240. 106 Z. Sun S. Vijay H.H. Heenen A.Y.S. Eng W. Tu Y. Zhao S.W. Koh P. Gao Z.W. Seh K. Chan H. Li Adv. Energy Mater. 10 2020 1904010 Z. Sun, S. Vijay, H. H. Heenen, A. Y. S. Eng, W. Tu, Y. Zhao, S. W. Koh, P. Gao, Z. W. Seh, K. Chan, H. Li, Adv. Energy Mater., 2020, 10, 1904010. 107 Y. Tsao M. Lee E.C. Miller G. Gao J. Park S. Chen T. Katsumata H. Tran L.-W. Wang M.F. Toney Y. Cui Z. Bao Joule 3 2019 872 884 Y. Tsao, M. Lee, E. C. Miller, G. Gao, J. Park, S. Chen, T. Katsumata, H. Tran, L.-W. Wang, M. F. Toney, Y. Cui, Z. Bao, Joule, 2019, 3, 872–884. 108 Y. Yang W. Wang L. Li B. Li J. Zhang J. Mater. Chem. A 8 2020 3692 3700 Y. Yang, W. Wang, L. Li, B. Li, J. Zhang, J. Mater. Chem. A, 2020, 8, 3692–3700. 109 G. Zhou H. Tian Y. Jin X. Tao B. Liu R. Zhang Z.W. Seh D. Zhuo Y. Liu J. Sun J. Zhao C. Zu D.S. Wu Q. Zhang Y. Cui Proc. Natl. Acad. Sci. USA 114 2017 840 845 G. Zhou, H. Tian, Y. Jin, X. Tao, B. Liu, R. Zhang, Z. W. Seh, D. Zhuo, Y. Liu, J. Sun, J. Zhao, C. Zu, D. S. Wu, Q. Zhang, Y. Cui, Proc. Natl. Acad. Sci. USA, 2017, 114, 840–845. 110 G. Li S. Wang Y. Zhang M. Li Z. Chen J. Lu Adv. Mater. 30 2018 1705590 G. Li, S. Wang, Y. Zhang, M. Li, Z. Chen, J. Lu, Adv. Mater., 2018, 30, 1705590. 111 T. Sun X. Zhao B. Li H. Shu L. Luo W. Xia M. Chen P. Zeng X. Yang P. Gao Y. Pei X. Wang Adv. Funct. Mater. 31 2021 2101285 T. Sun, X. Zhao, B. Li, H. Shu, L. Luo, W. Xia, M. Chen, P. Zeng, X. Yang, P. Gao, Y. Pei, X. Wang, Adv. Funct. Mater., 2021, 31, 2101285. 112 F. Liu G. Sun H.B. Wu G. Chen D. Xu R. Mo L. Shen X. Li S. Ma R. Tao X. Li X. Tan B. Xu G. Wang B.S. Dunn P. Sautet Y. Lu Nat. Commun. 11 2020 5215 F. Liu, G. Sun, H. B. Wu, G. Chen, D. Xu, R. Mo, L. Shen, X. Li, S. Ma, R. Tao, X. Li, X. Tan, B. Xu, G. Wang, B. S. Dunn, P. Sautet, Y. Lu, Nat. Commun., 2020, 11, 5215. 113 Q. Sun B. Xi J.-Y. Li H. Mao X. Ma J. Liang J. Feng S. Xiong Adv. Energy Mater. 8 2018 1800595 Q. Sun, B. Xi, J.-Y. Li, H. Mao, X. Ma, J. Liang, J. Feng, S. Xiong, Adv. Energy Mater., 2018, 8, 1800595. 114 M. Wang Y. Song Z. Sun Y. Shao C. Wei Z. Xia Z. Tian Z. Liu J. Sun ACS Nano 13 2019 13235 13243 M. Wang, Y. Song, Z. Sun, Y. Shao, C. Wei, Z. Xia, Z. Tian, Z. Liu, J. Sun, ACS Nano, 2019, 13, 13235–13243. 115 L. Zhang F. Wan H. Cao L. Liu Y. Wang Z. Niu Small 16 2020 1907153 L. Zhang, F. Wan, H. Cao, L. Liu, Y. Wang, Z. Niu, Small, 2020, 16, 1907153. 116 J. Park B.-C. Yu J.S. Park J.W. Choi C. Kim Y.-E. Sung J.B. Goodenough Adv. Energy Mater. 7 2017 1602567 J. Park, B.-C. Yu, J. S. Park, J. W. Choi, C. Kim, Y.-E. Sung, J. B. Goodenough, Adv. Energy Mater., 2017, 7, 1602567. 117 X. Huang J. Tang B. Luo R. Knibbe T. Lin H. Hu M. Rana Y. Hu X. Zhu Q. Gu D. Wang L. Wang Adv. Energy Mater. 9 2019 1901872 X. Huang, J. Tang, B. Luo, R. Knibbe, T. Lin, H. Hu, M. Rana, Y. Hu, X. Zhu, Q. Gu, D. Wang, L. Wang, Adv. Energy Mater., 2019, 9, 1901872. 118 H. Lin S. Zhang T. Zhang S. Cao H. Ye Q. Yao G.W. Zheng J.Y. Lee ACS Nano 13 2019 7073 7082 H. Lin, S. Zhang, T. Zhang, S. Cao, H. Ye, Q. Yao, G. W. Zheng, J. Y. Lee, ACS Nano, 2019, 13, 7073–7082. 119 J. Xu W. Zhang H. Fan F. Cheng D. Su G. Wang Nano Energy 51 2018 73 82 J. Xu, W. Zhang, H. Fan, F. Cheng, D. Su, G. Wang, Nano Energy, 2018, 51, 73–82. 120 H. Lin L. Yang X. Jiang G. Li T. Zhang Q. Yao G.W. Zheng J.Y. Lee Energy Environ. Sci. 10 2017 1476 1486 H. Lin, L. Yang, X. Jiang, G. Li, T. Zhang, Q. Yao, G. W. Zheng, J. Y. Lee, Energy Environ. Sci., 2017, 10, 1476–1486. 121 W. Sun C. Liu Y. Li S. Luo S. Liu X. Hong K. Xie Y. Liu X. Tan C. Zheng ACS Nano 13 2019 12137 12147 W. Sun, C. Liu, Y. Li, S. Luo, S. Liu, X. Hong, K. Xie, Y. Liu, X. Tan, C. Zheng, ACS Nano, 2019, 13, 12137–12147. 122 Y. Liao J. Xiang L. Yuan Z. Hao J. Gu X. Chen K. Yuan P.K. Kalambate Y. Huang ACS Appl. Mater. Interfaces 10 2018 37955 37962 Y. Liao, J. Xiang, L. Yuan, Z. Hao, J. Gu, X. Chen, K. Yuan, P. K. Kalambate, Y. Huang, ACS Appl. Mater. Interfaces, 2018, 10, 37955–37962. 123 B. Qi X. Zhao S. Wang K. Chen Y. Wei G. Chen Y. Gao D. Zhang Z. Sun F. Li J. Mater. Chem. A 6 2018 14359 14366 B. Qi, X. Zhao, S. Wang, K. Chen, Y. Wei, G. Chen, Y. Gao, D. Zhang, Z. Sun, F. Li, J. Mater. Chem. A, 2018, 6, 14359–14366. 124 J. Shen X. Xu J. Liu Z. Liu F. Li R. Hu J. Liu X. Hou Y. Feng Y. Yu M. Zhu ACS Nano 13 2019 8986 8996 J. Shen, X. Xu, J. Liu, Z. Liu, F. Li, R. Hu, J. Liu, X. Hou, Y. Feng, Y. Yu, M. Zhu, ACS Nano, 2019, 13, 8986–8996. 125 H. Yuan X. Chen G. Zhou W. Zhang J. Luo H. Huang Y. Gan C. Liang Y. Xia J. Zhang J. Wang X. Tao ACS Energy Lett. 2 2017 1711 1719 H. Yuan, X. Chen, G. Zhou, W. Zhang, J. Luo, H. Huang, Y. Gan, C. Liang, Y. Xia, J. Zhang, J. Wang, X. Tao, ACS Energy Lett., 2017, 2, 1711–1719. 126 Y. Chen W. Zhang D. Zhou H. Tian D. Su C. Wang D. Stockdale F. Kang B. Li G. Wang ACS Nano 13 2019 4731 4741 Y. Chen, W. Zhang, D. Zhou, H. Tian, D. Su, C. Wang, D. Stockdale, F. Kang, B. Li, G. Wang, ACS Nano, 2019, 13, 4731–4741. 127 W. Bao D. Su W. Zhang X. Guo G. Wang Adv. Funct. Mater. 26 2016 8746 8756 W. Bao, D. Su, W. Zhang, X. Guo, G. Wang, Adv. Funct. Mater., 2016, 26, 8746–8756. 128 F. Zhou Z. Li X. Luo T. Wu B. Jiang L.L. Lu H.B. Yao M. Antonietti S.H. Yu Nano Lett. 18 2018 1035 1043 F. Zhou, Z. Li, X. Luo, T. Wu, B. Jiang, L. L. Lu, H. B. Yao, M. Antonietti, S. H. Yu, Nano Lett., 2018, 18, 1035–1043 129 M. Sun Z. Wang X. Li H. Li H. Jia X. Xue M. Jin J. Li Y. Xie M. Feng J. Mater. Chem. A 8 2020 11818 11823 M. Sun, Z. Wang, X. Li, H. Li, H. Jia, X. Xue, M. Jin, J. Li, Y. Xie, M. Feng, J. Mater. Chem. A, 2020, 8, 11818–11823. 130 C. Barchasz F. Molton C. Duboc J.C. Lepretre S. Patoux F. Alloin Anal. Chem. 84 2012 3973 3980 C. Barchasz, F. Molton, C. Duboc, J. C. Lepretre, S. Patoux, F. Alloin, Anal. Chem., 2012, 84, 3973–3980. 131 M. Cuisinier P.-E. Cabelguen S. Evers G. He M. Kolbeck A. Garsuch T. Bolin M. Balasubramanian L.F. Nazar J. Phys. Chem. Lett. 4 2013 3227 3232 M. Cuisinier, P.-E. Cabelguen, S. Evers, G. He, M. Kolbeck, A. Garsuch, T. Bolin, M. Balasubramanian, L. F. Nazar, J. Phys. Chem. Lett., 2013, 4, 3227–3232. 132 X. Yang X. Gao Q. Sun S.P. Jand Y. Yu Y. Zhao X. Li K. Adair L.Y. Kuo J. Rohrer J. Liang X. Lin M.N. Banis Y. Hu H. Zhang X. Li R. Li H. Zhang P. Kaghazchi T.K. Sham X. Sun Adv. Mater. 31 2019 1901220 X. Yang, X. Gao, Q. Sun, S. P. Jand, Y. Yu, Y. Zhao, X. Li, K. Adair, L. Y. Kuo, J. Rohrer, J. Liang, X. Lin, M. N. Banis, Y. Hu, H. Zhang, X. Li, R. Li, H. Zhang, P. Kaghazchi, T. K. Sham, X. Sun, Adv. Mater., 2019, 31, 1901220. 133 Z. Jin T. Lin H. Jia B. Liu Q. Zhang L. Li L. Zhang Z.M. Su C. Wang ACS Nano 15 2021 7318 7327 Z. Jin, T. Lin, H. Jia, B. Liu, Q. Zhang, L. Li, L. Zhang, Z. M. Su, C. Wang, ACS Nano, 2021, 15, 7318–7327. 134 H. Ye M. Li T. Liu Y. Li J. Lu ACS Energy Lett. 5 2020 2234 2245 H. Ye, M. Li, T. Liu, Y. Li, J. Lu, ACS Energy Lett., 2020, 5, 2234–2245. 135 S. Li D. Leng W. Li L. Qie Z. Dong Z. Cheng Z. Fan Energy Storage Mater. 27 2020 279 296 S. Li, D. Leng, W. Li, L. Qie, Z. Dong, Z. Cheng, Z. Fan, Energy Storage Mater., 2020, 27, 279–296. 136 A. Gupta A. Manthiram J. Mater. Chem. A 9 2021 13242 13251 A. Gupta, A. Manthiram, J. Mater. Chem. A, 2021, 9, 13242–13251. 137 H. Wang J. Chen Y. Lin X. Wang J. Li Y. Li L. Gao L. Zhang D. Chao X. Xiao J.M. Lee Adv. Mater. 33 2021 e2008422 H. Wang, J. Chen, Y. Lin, X. Wang, J. Li, Y. Li, L. Gao, L. Zhang, D. Chao, X. Xiao, J. M. Lee, Adv. Mater., 2021, 33, e2008422. 138 X. Du J. Huang J. Zhang Y. Yan C. Wu Y. Hu C. Yan T. Lei W. Chen C. Fan J. Xiong Angew. Chem. Int. Ed. 58 2019 4484 4502 X. Du, J. Huang, J. Zhang, Y. Yan, C. Wu, Y. Hu, C. Yan, T. Lei, W. Chen, C. Fan, J. Xiong, Angew. Chem. Int. Ed., 2019, 58, 4484–4502. 139 H. Li J. Shang Z. Ai L. Zhang J. Am. Chem. Soc. 137 2015 6393 6399 H. Li, J. Shang, Z. Ai, L. Zhang, J. Am. Chem. Soc., 2015, 137, 6393–6399. 140 L. Zhu Y. Liu C. Su W. Zhou M. Liu Z. Shao Angew. Chem. Int. Ed. 55 2016 9576 9579 L. Zhu, Y. Liu, C. Su, W. Zhou, M. Liu, Z. Shao, Angew. Chem. Int. Ed., 2016, 55, 9576–9579. 141 Z. Zhang D. Luo G. Li R. Gao M. Li S. Li L. Zhao H. Dou G. Wen S. Sy Y. Hu A. Yu Z. Chen Matter 3 2020 920 934 Z. Zhang, D. Luo, G. Li, R. Gao, M. Li, S. Li, L. Zhao, H, Dou, G. Wen, S. Sy, Y. Hu, A. Yu, Z. Chen, Matter, 2020, 3, 920–934. 142 D. Luo Z. Zhang G. Li S. Cheng S. Li J. Li R. Gao M. Li S. Sy Y.P. Deng Y. Jiang Y. Zhu H. Dou Y. Hu A. Yu Z. Cheng ACS Nano 14 2020 4849 4860 D. Luo, Z. Zhang, G. Li, S. Cheng, S. Li, J. Li, R. Gao, M. Li, S. Sy, Y. P. Deng, Y. Jiang, Y. Zhu, H. Dou, Y. Hu, A. Yu, Z. Cheng, ACS Nano, 2020, 14, 4849–4860. 143 Z. Li C. Zhou J. Hua X. Hong C. Sun H.W. Li X. Xu L. Mai Adv. Mater. 32 2020 1907444 Z. Li, C. Zhou, J. Hua, X. Hong, C. Sun, H. W. Li, X. Xu, L. Mai, Adv. Mater., 2020, 32, 1907444. 144 Y. Wang R. Zhang J. Chen H. Wu S. Lu K. Wang H. Li C.J. Harris K. Xi R.V. Kumar S. Ding Adv. Energy Mater. 9 2019 1900953 Y. Wang, R. Zhang, J. Chen, H. Wu, S. Lu, K. Wang, H. Li, C. J. Harris, K. Xi, R. V. Kumar, S. Ding, Adv. Energy Mater., 2019, 9, 1900953. 145 Q. Li Y. Zhao H. Liu P. Xu L. Yang K. Pei Q. Zeng Y. Feng P. Wang R. Che ACS Nano 13 2019 11921 11934 Q. Li, Y. Zhao, H. Liu, P. Xu, L. Yang, K. Pei, Q. Zeng, Y. Feng, P. Wang, R. Che, ACS Nano, 2019, 13, 11921–11934. 146 H. Liu Z. Chen L. Zhou K. Pei P. Xu L. Xin Q. Zeng J. Zhang R. Wu F. Fang R. Che D. Sun Adv. Energy Mater. 9 2019 1901667 H. Liu, Z. Chen, L. Zhou, K. Pei, P. Xu, L. Xin, Q. Zeng, J. Zhang, R. Wu, F. Fang, R. Che, D. Sun, Adv. Energy Mater., 2019, 9, 1901667. 147 L. Xu H. Zhao M. Sun B. Huang J. Wang J. Xia N. Li D. Yin M. Luo F. Luo Y. Du C. Yan Angew. Chem. Int. Ed. 58 2019 11491 11496 L. Xu, H. Zhao, M. Sun, B. Huang, J. Wang, J. Xia, N. Li, D. Yin, M. Luo, F. Luo, Y. Du, C. Yan, Angew. Chem. Int. Ed., 2019, 58, 11491–11496. 148 H. Lin S. Zhang T. Zhang H. Ye Q. Yao G.W. Zheng J.Y. Lee Adv. Energy Mater. 8 2018 1801868 H. Lin, S. Zhang, T. Zhang, H. Ye, Q. Yao, G. W. Zheng, J. Y. Lee, Adv. Energy Mater., 2018, 8, 1801868. 149 Y. Zhang Z. Mu C. Yang Z. Xu S. Zhang X. Zhang Y. Li J. Lai Z. Sun Y. Yang Y. Chao C. Li X. Ge W. Yang S. Guo Adv. Funct. Mater. 28 2018 1707578 Y. Zhang, Z. Mu, C. Yang, Z. Xu, S. Zhang, X. Zhang, Y. Li, J. Lai, Z. Sun, Y. Yang, Y. Chao, C. Li, X. Ge, W. Yang, S. Guo, Adv. Funct. Mater., 2018, 28, 1707578. 150 Z. Shen Z. Zhang M. Li Y. Yuan Y. Zhao S. Zhang C. Zhong J. Zhu J. Lu H. Zhang ACS Nano 14 2020 6673 6682 Z. Shen, Z. Zhang, M. Li, Y. Yuan, Y. Zhao, S. Zhang, C. Zhong, J. Zhu, J. Lu, H. Zhang, ACS Nano, 2020, 14, 6673–6682. 151 Y. Tian G. Li Y. Zhang D. Luo X. Wang Y. Zhao H. Liu P. Ji X. Du J. Li Z. Chen Adv. Mater. 32 2020 e1904876 Y. Tian, G. Li, Y. Zhang, D. Luo, X. Wang, Y. Zhao, H. Liu, P. Ji, X. Du, J. Li, Z. Chen, Adv. Mater., 2020, 32, e1904876. 152 M. Zhao H.J. Peng Z.W. Zhang B.Q. Li X. Chen J. Xie X. Chen J.Y. Wei Q. Zhang J.Q. Huang Angew. Chem. Int. Ed. 58 2019 3779 3783 M. Zhao, H. J. Peng, Z. W. Zhang, B. Q. Li, X. Chen, J. Xie, X. Chen, J. Y. Wei, Q. Zhang, J. Q. Huang, Angew. Chem. Int. Ed., 2019, 58, 3779–3783. 153 D. Luo G. Li Y.P. Deng Z. Zhang J. Li R. Liang M. Li Y. Jiang W. Zhang Y. Liu W. Lei A. Yu Z. Chen Adv. Energy Mater. 9 2019 1900228 D. Luo, G. Li, Y. P. Deng, Z. Zhang, J. Li, R. Liang, M. Li, Y. Jiang, W. Zhang, Y. Liu, W. Lei, A. Yu, Z. Chen, Adv. Energy Mater., 2019, 9, 1900228. 154 Y. Zhang G. Li J. Wang G. Cui X. Wei L. Shui K. Kempa G. Zhou X. Wang Z. Chen Adv. Funct. Mater. 30 2020 2001165 Y. Zhang, G. Li, J. Wang, G. Cui, X. Wei, L. Shui, K. Kempa, G. Zhou, X. Wang, Z. Chen, Adv. Funct. Mater., 2020, 30, 2001165. 155 J. Huang Y. Sun Y. Zhang G. Zou C. Yan S. Cong T. Lei X. Dai J. Guo R. Lu Y. Li J. Xiong Adv. Mater. 30 2018 1705045 J. Huang, Y. Sun, Y. Zhang, G. Zou, C. Yan, S. Cong, T. Lei, X. Dai, J. Guo, R. Lu, Y. Li, J. Xiong, Adv. Mater., 2018, 30, 1705045. 156 Y. Zhao R. Nakamura K. Kamiya S. Nakanishi K. Hashimoto Nat. Commun. 4 2013 2390 Y. Zhao, R. Nakamura, K. Kamiya, S. Nakanishi, K. Hashimoto, Nat. Commun., 2013, 4, 2390. 157 T. Kou T. Smart B. Yao I. Chen D. Thota Y. Ping Y. Li Adv. Energy Mater. 8 2018 1703538 T. Kou, T. Smart, B. Yao, I. Chen, D. Thota, Y. Ping, Y. Li, Adv. Energy Mater., 2018, 8, 1703538. 158 W. Ge L. Wang C. Li C. Wang D. Wang Y. Qian L. Xu J. Mater. Chem. A 8 2020 6276 6282 W. Ge, L. Wang, C. Li, C. Wang, D. Wang, Y. Qian, L. Xu, J. Mater. Chem. A, 2020, 8, 6276–6282. 159 J. Zhang Y. Shi Y. Ding L. Peng W. Zhang G. Yu Adv. Energy Mater. 7 2017 1602876 J. Zhang, Y. Shi, Y. Ding, L. Peng, W. Zhang, G. Yu, Adv. Energy Mater., 2017, 7, 1602876. 160 W. Bao L. Liu C. Wang S. Choi D. Wang G. Wang Adv. Energy Mater. 8 2018 1702485 W. Bao, L. Liu, C. Wang, S. Choi, D. Wang, G. Wang, Adv. Energy Mater., 2018, 8, 1702485. 161 Y.-J. Li J.-M. Fan M.-S. Zheng Q.-F. Dong Energy Environ. Sci. 9 2016 1998 2004 Y.-J. Li, J.-M. Fan, M.-S. Zheng, Q.-F. Dong, Energy Environ. Sci., 2016, 9, 1998–2004. 162 B. Gong X. Song Y. Shi J. Liu C. Hao J. Phys. Chem. C 124 2020 3644 3649 B. Gong, X. Song, Y. Shi, J. Liu, C. Hao, J. Phys. Chem. C, 2020, 124, 3644–3649. 163 Y. Liu S. Ma L. Liu J. Koch M. Rosebrock T. Li F. Bettels T. He H. Pfnür N.C. Bigall A. Feldhoff F. Ding L. Zhang Adv. Funct. Mater. 30 2020 2002462 Y. Liu, S. Ma, L. Liu, J. Koch, M. Rosebrock, T. Li, F. Bettels, T. He, H. Pfnür, N. C. Bigall, A. Feldhoff, F. Ding, L. Zhang, Adv. Funct. Mater., 2020, 30, 2002462. 164 L. Zhang W. Zhao S. Yuan F. Jiang X. Chen Y. Yang P. Ge W. Sun X. Ji J. Energy Chem. 60 2021 531 545 L. Zhang, W. Zhao, S. Yuan, F. Jiang, X. Chen, Y. Yang, P. Ge, W. Sun, X. Ji, J. Energy Chem., 2021, 60, 531–545. 165 T.Z. Hou X. Chen H.J. Peng J.Q. Huang B.Q. Li Q. Zhang B. Li Small 12 2016 3283 3291 T. Z. Hou, X. Chen, H. J. Peng, J. Q. Huang, B. Q. Li, Q. Zhang, B. Li, Small, 2016, 12, 3283–3291. 166 P. Zeng L. Huang X. Zhang R. Zhang L. Wu Y. Chen Chem. Eng. J. 349 2018 327 337 P. Zeng, L. Huang, X. Zhang, R. Zhang, L. Wu, Y. Chen, Chem. Eng. J., 2018, 349, 327–337. 167 G. Zhou E. Paek G.S. Hwang A. Manthiram Nat. Commun. 6 2015 7760 G. Zhou, E. Paek, G. S. Hwang, A. Manthiram, Nat. Commun., 2015, 6, 7760. 168 H. Wu L. Xia J. Ren Q. Zheng C. Xu D. Lin J. Mater. Chem. A 5 2017 20458 20472 H. Wu, L. Xia, J. Ren, Q. Zheng, C. Xu, D. Lin, J. Mater. Chem. A, 2017, 5, 20458–20472. 169 H. Xu Q. Jiang B. Zhang C. Chen Z. Lin Adv. Mater. 32 2020 1906357 H. Xu, Q. Jiang, B. Zhang, C. Chen, Z. Lin, Adv. Mater., 2020, 32, 1906357. 170 L. Peng Z. Wei C. Wan J. Li Z. Chen D. Zhu D. Baumann H. Liu C.S. Allen X. Xu A.I. Kirkland I. Shakir Z. Almutairi S. Tolbert B. Dunn Y. Huang P. Sautet X. Duan Nat. Catal. 3 2020 762 770 L. Peng, Z. Wei, C. Wan, J. Li, Z. Chen, D. Zhu, D. Baumann, H. Liu, C. S. Allen, X. Xu, A. I. Kirkland, I. Shakir, Z. Almutairi, S. Tolbert, B. Dunn, Y. Huang, P. Sautet, X. Duan, Nat. Catal., 2020, 3, 762–770. 171 M. Wang L. Fan X. Sun B. Guan B. Jiang X. Wu D. Tian K. Sun Y. Qiu X. Yin Y. Zhang N. Zhang ACS Energy Lett. 5 2020 3041 3050 M. Wang, L. Fan, X. Sun, B. Guan, B. Jiang, X. Wu, D. Tian, K. Sun, Y. Qiu, X. Yin, Y. Zhang, N. Zhang, ACS Energy Lett., 2020, 5, 3041–3050. 172 J. Liu Z. Qiao Q. Xie D.L. Peng R.J. Xie ACS Appl. Mater. Interfaces 13 2021 15226 15236 J. Liu, Z. Qiao, Q. Xie, D. L. Peng, R. J. Xie, ACS Appl. Mater. Interfaces, 2021, 13, 15226–15236. 173 H.B. Tao L. Fang J. Chen H.B. Yang J. Gao J. Miao S. Chen B. Liu J. Am. Chem. Soc. 138 2016 9978 9985 H. B. Tao, L. Fang, J. Chen, H. B. Yang, J. Gao, J. Miao, S. Chen, B. Liu, J. Am. Chem. Soc., 2016, 138, 9978–9985. 174 Y. Song Z. Sun Z. Fan W. Cai Y. Shao G. Sheng M. Wang L. Song Z. Liu Q. Zhang J. Sun Nano Energy 70 2020 104555 Y. Song, Z. Sun, Z. Fan, W. Cai, Y. Shao, G. Sheng, M. Wang, L. Song, Z. Liu, Q. Zhang, J. Sun, Nano Energy, 2020, 70, 104555. 175 F. Calle-Vallejo J.I. Martinez J. Rossmeisl Phys. Chem. Chem. Phys. 13 2011 15639 15643 F. Calle-Vallejo, J. I. Martinez, J. Rossmeisl, Phys. Chem. Chem. Phys., 2011, 13, 15639–15643. 176 Y. Yin J. Han Y. Zhang X. Zhang P. Xu Q. Yuan L. Samad X. Wang Y. Wang Z. Zhang P. Zhang X. Cao B. Song S. Jin J. Am. Chem. Soc. 138 2016 7965 7972 Y. Yin, J. Han, Y. Zhang, X. Zhang, P. Xu, Q. Yuan, L. Samad, X. Wang, Y. Wang, Z. Zhang, P. Zhang, X. Cao, B. Song, S. Jin, J. Am. Chem. Soc., 2016, 138, 7965–7972. 177 D. He G. He H. Jiang Z. Chen M. Huang Chem. Commun. 53 2017 5132 5135 D. He, G. He, H. Jiang, Z. Chen, M. Huang, Chem. Commun., 2017, 53, 5132–5135. 178 C. Zheng S. Niu W. Lv G. Zhou J. Li S. Fan Y. Deng Z. Pan B. Li F. Kang Q.–H. Yang Nano Energy 33 2017 306 312 C. Zheng, S. Niu, W. Lv, G. Zhou, J. Li, S. Fan, Y. Deng, Z. Pan, B. Li, F. Kang, Q.–H. Yang, Nano Energy, 2017, 33, 306–312. 179 W. Liu C. Luo S. Zhang B. Zhang J. Ma X. Wang W. Liu Z. Li Q.H. Yang W. Lv ACS Nano 15 2021 7491 7499 W. Liu, C. Luo, S. Zhang, B. Zhang, J. Ma, X. Wang, W. Liu, Z. Li, Q. H. Yang, W. Lv, ACS Nano, 2021, 15, 7491–7499. 180 X. Gao X. Yang M. Li Q. Sun J. Liang J. Luo J. Wang W. Li J. Liang Y. Liu S. Wang Y. Hu Q. Xiao R. Li T.-K. Sham X. Sun Adv. Funct. Mater. 29 2019 1806724 X. Gao, X. Yang, M. Li, Q. Sun, J. Liang, J. Luo, J. Wang, W. Li, J. Liang, Y. Liu, S. Wang, Y. Hu, Q. Xiao, R. Li, T.-K. Sham, X. Sun, Adv. Funct. Mater., 2019, 29, 1806724. 181 J. Wang D. Luo J. Li Y. Zhang Y. Zhao G. Zhou L. Shui Z. Chen X. Wang Nano Energy 78 2020 105293 J. Wang, D. Luo, J. Li, Y. Zhang, Y. Zhao, G. Zhou, L. Shui, Z. Chen, X. Wang, Nano Energy, 2020, 78, 105293. 182 Y. Yang Z. Wang T. Jiang C. Dong Z. Mao C. Lu W. Sun K. Sun J. Mater. Chem. A 6 2018 13593 13598 Y. Yang, Z. Wang, T. Jiang, C. Dong, Z. Mao, C. Lu, W. Sun, K. Sun, J. Mater. Chem. A, 2018, 6, 13593–13598. 183 W. Wang L. Huai S. Wu J. Shan J. Zhu Z. Liu L. Yue Y. Li ACS Nano 15 2021 11619 11633 W. Wang, L. Huai, S. Wu, J. Shan, J. Zhu, Z. Liu, L. Yue, Y. Li, ACS Nano, 2021, 15, 11619–11633. 184 W. Yang J. Xiao Y. Ma S. Cui P. Zhang P. Zhai L. Meng X. Wang Y. Wei Z. Du B. Li Z. Sun S. Yang Q. Zhang Y. Gong Adv. Energy Mater. 9 2019 1803137 W. Yang, J. Xiao, Y. Ma, S. Cui, P. Zhang, P. Zhai, L. Meng, X. Wang, Y. Wei, Z. Du, B. Li, Z. Sun, S. Yang, Q. Zhang, Y. Gong, Adv. Energy Mater., 2019, 9, 1803137. 185 H. Lin S. Zhang T. Zhang H. Ye Q. Yao G.W. Zheng J.Y. Lee Adv. Energy Mater. 9 2019 1902096 H. Lin, S. Zhang, T. Zhang, H. Ye, Q. Yao, G. W. Zheng, J. Y. Lee, Adv. Energy Mater., 2019, 9, 1902096. 186 B. Qiao A. Wang X. Yang L.F. Allard Z. Jiang Y. Cui J. Liu J. Li T. Zhang Nat. Chem. 3 2011 634 641 B. Qiao, A. Wang, X. Yang, L. F. Allard, Z. Jiang, Y. Cui, J. Liu, J. Li, T. Zhang, Nat. Chem., 2011, 3, 634–641. 187 K. Yuan D. Lutzenkirchen-Hecht L. Li L. Shuai Y. Li R. Cao M. Qiu X. Zhuang M.K.H. Leung Y. Chen U. Scherf J. Am. Chem. Soc. 142 2020 2404 2412 K. Yuan, D. Lutzenkirchen-Hecht, L. Li, L. Shuai, Y. Li, R. Cao, M. Qiu, X. Zhuang, M. K. H. Leung, Y. Chen, U. Scherf, J. Am. Chem. Soc., 2020, 142, 2404–2412. 188 C. Lu R. Fang X. Chen Adv. Mater. 32 2020 1906548 C. Lu, R. Fang, X. Chen, Adv. Mater., 2020, 32, 1906548. 189 J. Gu Q. Zhu Y. Shi H. Chen D. Zhang Z. Du S. Yang ACS Nano 14 2020 891 898 J. Gu, Q. Zhu, Y. Shi, H. Chen, D. Zhang, Z. Du, S. Yang, ACS Nano, 2020, 14, 891–898. 190 Z. Liu L. Zhou Q. Ge R. Chen M. Ni W. Utetiwabo X. Zhang W. Yang ACS Appl. Mater. Interfaces 10 2018 19311 19317 Z. Liu, L. Zhou, Q. Ge, R. Chen, M. Ni, W. Utetiwabo, X. Zhang, W. Yang, ACS Appl. Mater. Interfaces, 2018, 10, 19311–19317. 191 Z. Du X. Chen W. Hu C. Chuang S. Xie A. Hu W. Yan X. Kong X. Wu H. Ji L.J. Wan J. Am. Chem. Soc. 141 2019 3977 3985 Z. Du, X. Chen, W. Hu, C. Chuang, S. Xie, A. Hu, W. Yan, X. Kong, X. Wu, H. Ji, L. J. Wan, J. Am. Chem. Soc., 2019, 141, 3977–3985. 192 Z. Liang D. Yang P. Tang C. Zhang J. Jacas Biendicho Y. Zhang J. Llorca X. Wang J. Li M. Heggen J. David R.E. Dunin-Borkowski Y. Zhou J.R. Morante A. Cabot J. Arbiol Adv. Energy Mater. 11 2020 2003507 Z. Liang, D. Yang, P. Tang, C. Zhang, J. Jacas Biendicho, Y. Zhang, J. Llorca, X. Wang, J. Li, M. Heggen, J. David, R. E. Dunin-Borkowski, Y. Zhou, J. R. Morante, A. Cabot, J. Arbiol, Adv. Energy Mater., 2020, 11, 2003507. 193 D. Zhang S. Wang R. Hu J. Gu Y. Cui B. Li W. Chen C. Liu J. Shang S. Yang Adv. Funct. Mater. 30 2020 2002471 D. Zhang, S. Wang, R. Hu, J. Gu, Y. Cui, B. Li, W. Chen, C. Liu, J. Shang, S. Yang, Adv. Funct. Mater., 2020, 30, 2002471. 194 Y. Li J. Wu B. Zhang W. Wang G. Zhang Z.W. Seh N. Zhang J. Sun L. Huang J. Jiang J. Zhou Y. Sun Energy Storage Mater. 30 2020 250 259 Y. Li, J. Wu, B. Zhang, W. Wang, G. Zhang, Z. W. Seh, N. Zhang, J. Sun, L. Huang, J. Jiang, J. Zhou, Y. Sun, Energy Storage Mater., 2020, 30, 250–259. 195 Y. Liu Z. Wei B. Zhong H. Wang L. Xia T. Zhang X. Duan D. Jia Y. Zhou X. Huang Energy Storage Mater. 35 2021 12 18 Y. Liu, Z. Wei, B. Zhong, H. Wang, L. Xia, T. Zhang, X. Duan, D. Jia, Y. Zhou, X. Huang, Energy Storage Mater., 2021, 35, 12–18. 196 G. Zhou S. Zhao T. Wang S.Z. Yang B. Johannessen H. Chen C. Liu Y. Ye Y. Wu Y. Peng C. Liu S.P. Jiang Q. Zhang Y. Cui Nano Lett. 20 2020 1252 1261 G. Zhou, S. Zhao, T. Wang, S. Z. Yang, B. Johannessen, H. Chen, C. Liu, Y. Ye, Y. Wu, Y. Peng, C. Liu, S. P. Jiang, Q. Zhang, Y. Cui, Nano Lett., 2020, 20, 1252–1261 197 W. Yang B. Ling B. Hu H. Yin J. Mao P.J. Walsh Angew. Chem. Int. Ed. 59 2020 161 166 W. Yang, B. Ling, B. Hu, H. Yin, J. Mao, P. J. Walsh, Angew. Chem. Int. Ed., 2020, 59, 161–166. 198 S. Zhang M. Jin T. Shi M. Han Q. Sun Y. Lin Z. Ding L.R. Zheng G. Wang Y. Zhang H. Zhang H. Zhao Angew. Chem. Int. Ed. 59 2020 13423 13429 S. Zhang, M. Jin, T. Shi, M. Han, Q. Sun, Y. Lin, Z. Ding, L. R. Zheng, G. Wang, Y. Zhang, H. Zhang, H. Zhao, Angew. Chem. Int. Ed., 2020, 59, 13423–13429. 199 L. Osmieri A.H.A. Monteverde Videla P. Ocon S. Specchia J. Phys. Chem. C 121 2017 17796 17817 L. Osmieri, A. H. A. Monteverde Videla, P. Ocon, S. Specchia, J. Phys. Chem. C, 2017, 121, 17796–17817. 200 Y.N. Gong L. Jiao Y.Y. Qian C.Y. Pan L.R. Zheng X.H. Cai B. Liu S.H. Yu H.L. Jiang Angew. Chem. Int. Ed. 59 2020 2705 2709 Y. N. Gong, L. Jiao, Y. Y. Qian, C. Y. Pan, L. R. Zheng, X. H. Cai, B. Liu, S. H. Yu, H. L. Jiang, Angew. Chem. Int. Ed., 2020, 59, 2705–2709. 201 Y. Qiu L. Fan M. Wang X. Yin X. Wu X. Sun D. Tian B. Guan D. Tang N. Zhang ACS Nano 14 2020 16105 16113 Y. Qiu, L. Fan, M. Wang, X. Yin, X. Wu, X. Sun, D. Tian, B. Guan, D. Tang, N. Zhang, ACS Nano, 2020, 14, 16105–16113. 202 C. Ma Y. Zhang Y. Feng N. Wang L. Zhou C. Liang L. Chen Y. Lai X. Ji C. Yan W. Wei Adv. Mater. 33 2021 2100171 C. Ma, Y. Zhang, Y. Feng, N. Wang, L. Zhou, C. Liang, L. Chen, Y. Lai, X. Ji, C. Yan, W. Wei, Adv. Mater., 2021, 33, 2100171. 203 J. Wang L. Jia J. Zhong Q. Xiao C. Wang K. Zang H. Liu H. Zheng J. Luo J. Yang H. Fan W. Duan Y. Wu H. Lin Y. Zhang Energy Storage Mater. 18 2019 246 252 J. Wang, L. Jia, J. Zhong, Q. Xiao, C. Wang, K. Zang, H. Liu, H. Zheng, J. Luo, J. Yang, H. Fan, W. Duan, Y. Wu, H. Lin, Y. Zhang, Energy Storage Mater., 2019, 18, 246–252. 204 Y. Zeng Z. Lin Z. Wang M. Wu Y. Tong X. Lu Adv. Mater. 30 2018 e1707290 Y. Zeng, Z. Lin, Z. Wang, M. Wu, Y. Tong, X. Lu, Adv. Mater., 2018, 30, e1707290. 205 Z. Li B.Y. Guan J. Zhang X.W. Lou Joule 1 2017 576 587 Z. Li, B. Y. Guan, J. Zhang, X. W. Lou, Joule, 2017, 1, 576–587. 206 J.K. Norskov T. Bligaard J. Rossmeisl C.H. Christensen Nat. Chem. 1 2009 37 46 J. K. Norskov, T. Bligaard, J. Rossmeisl, C. H. Christensen, Nat. Chem., 2009, 1, 37–46. 207 Z. Shen M. Cao Z. Zhang J. Pu C. Zhong J. Li H. Ma F. Li J. Zhu F. Pan H. Zhang Adv. Funct. Mater. 30 2019 1906661 Z. Shen, M. Cao, Z. Zhang, J. Pu, C. Zhong, J. Li, H. Ma, F. Li, J. Zhu, F. Pan, H. Zhang, Adv. Funct. Mater., 2019, 30, 1906661. 208 J. Zhou X. Liu L. Zhu J. Zhou Y. Guan L. Chen S. Niu J. Cai D. Sun Y. Zhu J. Du G. Wang Y. Qian Joule 2 2018 2681 2693 J. Zhou, X. Liu, L. Zhu, J. Zhou, Y. Guan, L. Chen, S. Niu, J. Cai, D. Sun, Y. Zhu, J. Du, G. Wang, Y. Qian, Joule, 2018, 2, 2681–2693. 209 M.-R. Gao J.-X. Liang Y.-R. Zheng Y.-F. Xu J. Jiang Q. Gao J. Li S.-H. Yu Nat. Commun. 6 2015 5982 M.-R. Gao, J.-X. Liang, Y.-R. Zheng, Y.-F. Xu, J. Jiang, Q. Gao, J. Li, S.-H. Yu, Nat. Commun., 2015, 6, 5982. 210 J. Shen X. Xu J. Liu Z. Wang S. Zuo Z. Liu D. Zhang J. Liu M. Zhu Adv. Energy Mater. 11 2021 2100673 J. Shen, X. Xu, J. Liu, Z. Wang, S. Zuo, Z. Liu, D. Zhang, J. Liu, M. Zhu, Adv. Energy Mater., 2021, 11, 2100673. 211 P. Zeng C. Liu X. Zhao C. Yuan Y. Chen H. Lin L. Zhang ACS Nano 14 2020 11558 11569 P. Zeng, C. Liu, X. Zhao, C. Yuan, Y. Chen, H. Lin, L. Zhang, ACS Nano, 2020, 14, 11558–11569. 212 Z. Shi Z. Sun J. Cai Z. Fan J. Jin M. Wang J. Sun Adv. Funct. Mater. 31 2020 2006798 Z. Shi, Z. Sun, J. Cai, Z. Fan, J. Jin, M. Wang, J. Sun, Adv. Funct. Mater., 2020, 31, 2006798. 213 Z.Y. Wang H.M. Wang S. Liu G.R. Li X.P. Gao ACS Appl. Mater. Interfaces 13 2021 20222 20232 Z. Y. Wang, H. M. Wang, S. Liu, G. R. Li, X. P. Gao, ACS Appl. Mater. Interfaces, 2021, 13, 20222–20232. 214 H.L. Liu F. Nosheen X. Wang Chem. Soc. Rev. 44 2015 3056 3078 H. L. Liu, F. Nosheen, X. Wang, Chem. Soc. Rev., 2015, 44, 3056–3078. 215 Y. Liu W. Kou X. Li C. Huang R. Shui G. He Small 15 2019 1902431 Y. Liu, W. Kou, X. Li, C. Huang, R. Shui, G. He, Small, 2019, 15, 1902431. 216 Z. Qiao F. Zhou Q. Zhang F. Pei H. Zheng W. Xu P. Liu Y. Ma Q. Xie L. Wang X. Fang D.-L. Peng Energy Storage Mater. 23 2019 62 71 Z. Qiao, F. Zhou, Q. Zhang, F. Pei, H. Zheng, W. Xu, P. Liu, Y. Ma, Q. Xie, L. Wang, X. Fang, D.-L. Peng, Energy Storage Mater., 2019, 23, 62–71. 217 H. Li L. Fei R. Zhang S. Yu Y. Zhang L. Shu Y. Li Y. Wang J. Energy Chem. 49 2020 339 347 H. Li, L. Fei, R. Zhang, S. Yu, Y. Zhang, L. Shu, Y. Li, Y. Wang, J. Energy Chem., 2020, 49, 339–347. 218 X. Song D. Tian Y. Qiu X. Sun B. Jiang C. Zhao Y. Zhang L. Fan N. Zhang Energy Storage Mater. 41 2021 248 254 X. Song, D. Tian, Y. Qiu, X. Sun, B. Jiang, C. Zhao, Y. Zhang, L. Fan, N. Zhang, Energy Storage Mater., 2021, 41, 248–254. 219 S. De J. Zhang R. Luque N. Yan Energy Environ. Sci. 9 2016 3314 3347 S. De, J. Zhang, R. Luque, N. Yan, Energy Environ. Sci., 2016, 9, 3314–3347. 220 J. He A. Bhargav A. Manthiram ACS Nano 15 2021 8583 8591 J. He, A. Bhargav, A. Manthiram, ACS Nano, 2021, 15, 8583–8591. 221 J. Wang G. Li D. Luo Y. Zhao Y. Zhang G. Zhou L. Shui X. Wang J. Mater. Chem. A 9 2021 11160 11167 J. Wang, G. Li, D. Luo, Y. Zhao, Y. Zhang, G. Zhou, L. Shui, X. Wang, J. Mater. Chem. A, 2021, 9, 11160–11167. 222 H. Shi J. Qin P. Lu C. Dong J. He X. Chou P. Das J. Wang L. Zhang Z.S. Wu Adv. Funct. Mater. 31 2021 2102314 H. Shi, J. Qin, P. Lu, C. Dong, J. He, X. Chou, P. Das, J. Wang, L. Zhang, Z. S. Wu, Adv. Funct. Mater., 2021, 31, 2102314. 223 S. Huang Z. Wang Y. Von Lim Y. Wang Y. Li D. Zhang H.Y. Yang Adv. Energy Mater. 11 2021 2003689 S. Huang, Z. Wang, Y. Von Lim, Y. Wang, Y. Li, D. Zhang, H. Y. Yang, Adv. Energy Mater., 2021, 11, 2003689. 224 T. Zhou Y. Zhao G. Zhou W. Lv P. Sun F. Kang B. Li Q.H. Yang Nano Energy 39 2017 291 296 T. Zhou, Y. Zhao, G. Zhou, W. Lv, P. Sun, F. Kang, B. Li, Q. H. Yang, Nano Energy, 2017, 39, 291–296. 225 H. Ci J. Cai H. Ma Z. Shi G. Cui M. Wang J. Jin N. Wei C. Lu W. Zhao J. Sun Z. Liu ACS Nano 14 2020 11929 11938 H. Ci, J. Cai, H. Ma, Z. Shi, G. Cui, M. Wang, J. Jin, N. Wei, C. Lu, W. Zhao, J. Sun, Z. Liu, ACS Nano, 2020, 14, 11929–11938. 226 S. Gu Z. Bai S. Majumder B. Huang G. Chen Nanoscale 11 2019 20579 20588 S. Gu, Z. Bai, S. Majumder, B. Huang, G. Chen, Nanoscale, 2019, 11, 20579–20588. 227 S. Wang S. Feng J. Liang Q. Su F. Zhao H. Song M. Zheng Q. Sun Z. Song X. Jia J. Yang Y. Li J. Liao R. Li X. Sun Adv. Energy Mater. 11 2021 2003314 S. Wang, S. Feng, J. Liang, Q. Su, F. Zhao, H. Song, M. Zheng, Q. Sun, Z. Song, X. Jia, J. Yang, Y. Li, J. Liao, R. Li, X. Sun, Adv. Energy Mater., 2021, 11, 2003314. 228 Z. Shen Q. Zhou H. Yu J. Tian M. Shi C. Hu H. Zhang Chin. J. Chem. 39 2021 1138 1144 Z. Shen, Q. Zhou, H. Yu, J. Tian, M. Shi, C. Hu, H. Zhang, Chin. J. Chem., 2021, 39, 1138–1144. 229 T. Zhou W. Lv J. Li G. Zhou Y. Zhao S. Fan B. Liu B. Li F. Kang Q.-H. Yang Energy Environ. Sci. 10 2017 1694 1703 T. Zhou, W. Lv, J. Li, G. Zhou, Y. Zhao, S. Fan, B. Liu, B. Li, F. Kang, Q.-H. Yang, Energy Environ. Sci., 2017, 10, 1694–1703. 230 R. Fang S. Zhao Z. Sun D.-W. Wang R. Amal S. Wang H.-M. Cheng F. Li Energy Storage Mater. 10 2018 56 61 R. Fang, S. Zhao, Z. Sun, D.-W. Wang, R. Amal, S. Wang, H.-M. Cheng, F. Li, Energy Storage Mater., 2018, 10, 56–61. 231 Y. Song W. Zhao L. Kong L. Zhang X. Zhu Y. Shao F. Ding Q. Zhang J. Sun Z. Liu Energy Environ. Sci. 11 2018 2620 2630 Y. Song, W. Zhao, L. Kong, L. Zhang, X. Zhu, Y. Shao, F. Ding, Q. Zhang, J. Sun, Z. Liu, Energy Environ. Sci., 2018, 11, 2620–2630. 232 L. Jiao C. Zhang C. Geng S. Wu H. Li W. Lv Y. Tao Z. Chen G. Zhou J. Li G. Ling Y. Wan Q.H. Yang Adv. Energy Mater. 9 2019 1900219 L. Jiao, C. Zhang, C. Geng, S. Wu, H. Li, W. Lv, Y. Tao, Z. Chen, G. Zhou, J. Li, G. Ling, Y. Wan, Q. H. Yang, Adv. Energy Mater., 2019, 9, 1900219. 233 B. Hao H. Li W. Lv Y. Zhang S. Niu Q. Qi S. Xiao J. Li F. Kang Q.-H. Yang Nano Energy 60 2019 305 311 B. Hao, H. Li, W. Lv, Y. Zhang, S. Niu, Q. Qi, S. Xiao, J. Li, F. Kang, Q.-H. Yang, Nano Energy, 2019, 60, 305–311. 234 C. Wei M. Tian M. Wang Z. Shi L. Yu S. Li Z. Fan R. Yang J. Sun ACS Nano 14 2020 16073 16084 C. Wei, M. Tian, M. Wang, Z. Shi, L. Yu, S. Li, Z. Fan, R. Yang, J. Sun, ACS Nano, 2020, 14, 16073–16084. 235 J. Cai J. Jin Z. Fan C. Li Z. Shi J. Sun Z. Liu Adv. Mater. 32 2020 2005967 J. Cai, J. Jin, Z. Fan, C. Li, Z. Shi, J. Sun, Z. Liu, Adv. Mater., 2020, 32, 2005967. 236 L. Hu C. Dai H. Liu Y. Li B. Shen Y. Chen S.-J. Bao M. Xu Adv. Energy Mater. 8 2018 1800709 L. Hu, C. Dai, H. Liu, Y. Li, B. Shen, Y. Chen, S.-J. Bao, M. Xu, Adv. Energy Mater., 2018, 8, 1800709. 237 J.L. Yang D.Q. Cai X.G. Hao L. Huang Q. Lin X.T. Zeng S.X. Zhao W. Lv ACS Nano 15 2021 11491 11500 J. L. Yang, D. Q. Cai, X. G. Hao, L. Huang, Q. Lin, X. T. Zeng, S. X. Zhao, W. Lv, ACS Nano, 2021, 15, 11491–11500. 238 R. Wang C. Luo T. Wang G. Zhou Y. Deng Y. He Q. Zhang F. Kang W. Lv Q.H. Yang Adv. Mater. 32 2020 2000315 R. Wang, C. Luo, T. Wang, G. Zhou, Y. Deng, Y. He, Q. Zhang, F. Kang, W. Lv, Q. H. Yang, Adv. Mater., 2020, 32, 2000315. 239 C. Ye Y. Jiao H. Jin A.D. Slattery K. Davey H. Wang S.Z. Qiao Angew. Chem. Int. Ed. 57 2018 16703 16707 C. Ye, Y. Jiao, H. Jin, A. D. Slattery, K. Davey, H. Wang, and S. Z. Qiao, Angew. Chem. Int. Ed., 2018, 57, 16703–16707. 240 Z.S. Qiao Y.G. Zhang Z.H. Meng Q.S. Xie L. Lin H.F. Zheng B.S. Sa J. Lin L.S. Wang D.L. Peng Adv. Funct. Mater. 31 2021 2100970 Z. S. Qiao, Y. G. Zhang, Z. H. Meng, Q. S. Xie, L. Lin, H. F. Zheng, B. S. Sa, J. Lin, L. S. Wang, D. L. Peng, Adv. Funct. Mater., 2021, 31, 2100970. 241 M. Zhao H.J. Peng B.Q. Li X. Chen J. Xie X.Y. Liu Q. Zhang J.Q. Huang Angew. Chem. Int. Ed. 59 2020 9011 9017 M. Zhao, H. J. Peng, B. Q. Li, X. Chen, J. Xie, X. Y. Liu, Q. Zhang, J. Q. Huang, Angew. Chem. Int. Ed., 2020, 59, 9011–9017.",
      "scopus-id": "85141529936",
      "coredata": {
        "eid": "1-s2.0-S1872206721639840",
        "dc:description": "Abstract With the merits of high energy density, environmental friendliness, and cost effectiveness, lithium-sulfur (Li-S) batteries are considered as one of the most promising next-generation electrochemical storage systems. However, the notorious polysulfide shuttle effect, which results in low active material utilization and serious capacity fading, severely impedes the practical application of Li-S batteries. Utilizing various electrocatalysts to improve the polysulfide redox kinetics has recently emerged as a promising strategy to address the shuttle effect. Specially, the electronic structure of the electrocatalysts plays a decisive role in determining the catalytic activity to facilitate the polysulfide conversion. Therefore, reasonably modulating the electronic structure of electrocatalysts is of paramount significance for improving the electrochemical performance of Li-S batteries. Herein, a comprehensive overview of the fascinating strategies to tailor the electronic structure of electrocatalysts for Li-S batteries is presented, including but not limited to vacancy engineering, heteroatom doping, single atom doping, band regulation, alloying, and heterostructure engineering. The future perspectives and challenges are also proposed for designing high-efficient electrocatalysts to construct high-energy-density and long-lifetime Li-S batteries.",
        "openArchiveArticle": "false",
        "prism:coverDate": "2022-12-31",
        "openaccessUserLicense": null,
        "prism:aggregationType": "Journal",
        "prism:url": "https://api.elsevier.com/content/article/pii/S1872206721639840",
        "dc:creator": [
          {
            "@_fa": "true",
            "$": "Zeng, Pan"
          },
          {
            "@_fa": "true",
            "$": "Yuan, Cheng"
          },
          {
            "@_fa": "true",
            "$": "Liu, Genlin"
          },
          {
            "@_fa": "true",
            "$": "Gao, Jiechang"
          },
          {
            "@_fa": "true",
            "$": "Li, Yanguang"
          },
          {
            "@_fa": "true",
            "$": "Zhang, Liang"
          }
        ],
        "link": [
          {
            "@_fa": "true",
            "@rel": "self",
            "@href": "https://api.elsevier.com/content/article/pii/S1872206721639840"
          },
          {
            "@_fa": "true",
            "@rel": "scidir",
            "@href": "https://www.sciencedirect.com/science/article/pii/S1872206721639840"
          }
        ],
        "dc:format": "application/json",
        "openaccessType": null,
        "pii": "S1872-2067(21)63984-0",
        "prism:volume": "43",
        "prism:publisher": "Dalian Institute of Chemical Physics, the Chinese Academy of Sciences. Published by Elsevier B.V.",
        "dc:title": "Recent progress in electronic modulation of electrocatalysts for high-efficient polysulfide conversion of Li-S batteries",
        "prism:copyright": "Copyright © 2022 Dalian Institute of Chemical Physics, the Chinese Academy of Sciences. Published by Elsevier B.V. All rights reserved.",
        "openaccess": "0",
        "prism:issn": "18722067",
        "prism:issueIdentifier": "12",
        "dcterms:subject": [
          {
            "@_fa": "true",
            "$": "Lithium-sulfur batteries"
          },
          {
            "@_fa": "true",
            "$": "Catalytic effect"
          },
          {
            "@_fa": "true",
            "$": "Electronic modification"
          },
          {
            "@_fa": "true",
            "$": "Shuttle effect"
          },
          {
            "@_fa": "true",
            "$": "Redox kinetics"
          }
        ],
        "openaccessArticle": "false",
        "prism:publicationName": "Chinese Journal of Catalysis",
        "prism:number": "12",
        "openaccessSponsorType": null,
        "prism:pageRange": "2946-2965",
        "prism:endingPage": "2965",
        "pubType": "rev",
        "prism:coverDisplayDate": "December 2022",
        "prism:doi": "10.1016/S1872-2067(21)63984-0",
        "prism:startingPage": "2946",
        "dc:identifier": "doi:10.1016/S1872-2067(21)63984-0",
        "openaccessSponsorName": null
      },
      "objects": {
        "object": [
          {
            "@category": "standard",
            "@height": "245",
            "@width": "243",
            "@_fa": "true",
            "$": "https://api.elsevier.com/content/object/eid/1-s2.0-S1872206721639840-fx1.jpg?httpAccept=%2A%2F%2A",
            "@multimediatype": "JPEG image file",
            "@type": "IMAGE-DOWNSAMPLED",
            "@size": "27926",
            "@ref": "fx1",
            "@mimetype": "image/jpeg"
          },
          {
            "@category": "standard",
            "@height": "318",
            "@width": "319",
            "@_fa": "true",
            "$": "https://api.elsevier.com/content/object/eid/1-s2.0-S1872206721639840-gr1.jpg?httpAccept=%2A%2F%2A",
            "@multimediatype": "JPEG image file",
            "@type": "IMAGE-DOWNSAMPLED",
            "@size": "48003",
            "@ref": "gr1",
            "@mimetype": "image/jpeg"
          },
          {
            "@category": "standard",
            "@height": "500",
            "@width": "613",
            "@_fa": "true",
            "$": "https://api.elsevier.com/content/object/eid/1-s2.0-S1872206721639840-gr10.jpg?httpAccept=%2A%2F%2A",
            "@multimediatype": "JPEG image file",
            "@type": "IMAGE-DOWNSAMPLED",
            "@size": "142832",
            "@ref": "gr10",
            "@mimetype": "image/jpeg"
          },
          {
            "@category": "standard",
            "@height": "145",
            "@width": "369",
            "@_fa": "true",
            "$": "https://api.elsevier.com/content/object/eid/1-s2.0-S1872206721639840-gr2.jpg?httpAccept=%2A%2F%2A",
            "@multimediatype": "JPEG image file",
            "@type": "IMAGE-DOWNSAMPLED",
            "@size": "26429",
            "@ref": "gr2",
            "@mimetype": "image/jpeg"
          },
          {
            "@category": "standard",
            "@height": "343",
            "@width": "605",
            "@_fa": "true",
            "$": "https://api.elsevier.com/content/object/eid/1-s2.0-S1872206721639840-gr3.jpg?httpAccept=%2A%2F%2A",
            "@multimediatype": "JPEG image file",
            "@type": "IMAGE-DOWNSAMPLED",
            "@size": "86224",
            "@ref": "gr3",
            "@mimetype": "image/jpeg"
          },
          {
            "@category": "standard",
            "@height": "140",
            "@width": "614",
            "@_fa": "true",
            "$": "https://api.elsevier.com/content/object/eid/1-s2.0-S1872206721639840-gr4.jpg?httpAccept=%2A%2F%2A",
            "@multimediatype": "JPEG image file",
            "@type": "IMAGE-DOWNSAMPLED",
            "@size": "33495",
            "@ref": "gr4",
            "@mimetype": "image/jpeg"
          },
          {
            "@category": "standard",
            "@height": "540",
            "@width": "502",
            "@_fa": "true",
            "$": "https://api.elsevier.com/content/object/eid/1-s2.0-S1872206721639840-gr5.jpg?httpAccept=%2A%2F%2A",
            "@multimediatype": "JPEG image file",
            "@type": "IMAGE-DOWNSAMPLED",
            "@size": "123277",
            "@ref": "gr5",
            "@mimetype": "image/jpeg"
          },
          {
            "@category": "standard",
            "@height": "575",
            "@width": "648",
            "@_fa": "true",
            "$": "https://api.elsevier.com/content/object/eid/1-s2.0-S1872206721639840-gr6.jpg?httpAccept=%2A%2F%2A",
            "@multimediatype": "JPEG image file",
            "@type": "IMAGE-DOWNSAMPLED",
            "@size": "142211",
            "@ref": "gr6",
            "@mimetype": "image/jpeg"
          },
          {
            "@category": "standard",
            "@height": "575",
            "@width": "601",
            "@_fa": "true",
            "$": "https://api.elsevier.com/content/object/eid/1-s2.0-S1872206721639840-gr7.jpg?httpAccept=%2A%2F%2A",
            "@multimediatype": "JPEG image file",
            "@type": "IMAGE-DOWNSAMPLED",
            "@size": "132480",
            "@ref": "gr7",
            "@mimetype": "image/jpeg"
          },
          {
            "@category": "standard",
            "@height": "595",
            "@width": "618",
            "@_fa": "true",
            "$": "https://api.elsevier.com/content/object/eid/1-s2.0-S1872206721639840-gr8.jpg?httpAccept=%2A%2F%2A",
            "@multimediatype": "JPEG image file",
            "@type": "IMAGE-DOWNSAMPLED",
            "@size": "137619",
            "@ref": "gr8",
            "@mimetype": "image/jpeg"
          },
          {
            "@category": "standard",
            "@height": "330",
            "@width": "511",
            "@_fa": "true",
            "$": "https://api.elsevier.com/content/object/eid/1-s2.0-S1872206721639840-gr9.jpg?httpAccept=%2A%2F%2A",
            "@multimediatype": "JPEG image file",
            "@type": "IMAGE-DOWNSAMPLED",
            "@size": "77158",
            "@ref": "gr9",
            "@mimetype": "image/jpeg"
          },
          {
            "@category": "thumbnail",
            "@height": "164",
            "@width": "163",
            "@_fa": "true",
            "$": "https://api.elsevier.com/content/object/eid/1-s2.0-S1872206721639840-fx1.sml?httpAccept=%2A%2F%2A",
            "@multimediatype": "GIF image file",
            "@type": "IMAGE-THUMBNAIL",
            "@size": "11098",
            "@ref": "fx1",
            "@mimetype": "image/gif"
          },
          {
            "@category": "thumbnail",
            "@height": "164",
            "@width": "164",
            "@_fa": "true",
            "$": "https://api.elsevier.com/content/object/eid/1-s2.0-S1872206721639840-gr1.sml?httpAccept=%2A%2F%2A",
            "@multimediatype": "GIF image file",
            "@type": "IMAGE-THUMBNAIL",
            "@size": "13530",
            "@ref": "gr1",
            "@mimetype": "image/gif"
          },
          {
            "@category": "thumbnail",
            "@height": "164",
            "@width": "201",
            "@_fa": "true",
            "$": "https://api.elsevier.com/content/object/eid/1-s2.0-S1872206721639840-gr10.sml?httpAccept=%2A%2F%2A",
            "@multimediatype": "GIF image file",
            "@type": "IMAGE-THUMBNAIL",
            "@size": "20562",
            "@ref": "gr10",
            "@mimetype": "image/gif"
          },
          {
            "@category": "thumbnail",
            "@height": "86",
            "@width": "219",
            "@_fa": "true",
            "$": "https://api.elsevier.com/content/object/eid/1-s2.0-S1872206721639840-gr2.sml?httpAccept=%2A%2F%2A",
            "@multimediatype": "GIF image file",
            "@type": "IMAGE-THUMBNAIL",
            "@size": "11875",
            "@ref": "gr2",
            "@mimetype": "image/gif"
          },
          {
            "@category": "thumbnail",
            "@height": "124",
            "@width": "219",
            "@_fa": "true",
            "$": "https://api.elsevier.com/content/object/eid/1-s2.0-S1872206721639840-gr3.sml?httpAccept=%2A%2F%2A",
            "@multimediatype": "GIF image file",
            "@type": "IMAGE-THUMBNAIL",
            "@size": "13158",
            "@ref": "gr3",
            "@mimetype": "image/gif"
          },
          {
            "@category": "thumbnail",
            "@height": "50",
            "@width": "219",
            "@_fa": "true",
            "$": "https://api.elsevier.com/content/object/eid/1-s2.0-S1872206721639840-gr4.sml?httpAccept=%2A%2F%2A",
            "@multimediatype": "GIF image file",
            "@type": "IMAGE-THUMBNAIL",
            "@size": "5358",
            "@ref": "gr4",
            "@mimetype": "image/gif"
          },
          {
            "@category": "thumbnail",
            "@height": "163",
            "@width": "152",
            "@_fa": "true",
            "$": "https://api.elsevier.com/content/object/eid/1-s2.0-S1872206721639840-gr5.sml?httpAccept=%2A%2F%2A",
            "@multimediatype": "GIF image file",
            "@type": "IMAGE-THUMBNAIL",
            "@size": "14125",
            "@ref": "gr5",
            "@mimetype": "image/gif"
          },
          {
            "@category": "thumbnail",
            "@height": "164",
            "@width": "185",
            "@_fa": "true",
            "$": "https://api.elsevier.com/content/object/eid/1-s2.0-S1872206721639840-gr6.sml?httpAccept=%2A%2F%2A",
            "@multimediatype": "GIF image file",
            "@type": "IMAGE-THUMBNAIL",
            "@size": "14647",
            "@ref": "gr6",
            "@mimetype": "image/gif"
          },
          {
            "@category": "thumbnail",
            "@height": "164",
            "@width": "171",
            "@_fa": "true",
            "$": "https://api.elsevier.com/content/object/eid/1-s2.0-S1872206721639840-gr7.sml?httpAccept=%2A%2F%2A",
            "@multimediatype": "GIF image file",
            "@type": "IMAGE-THUMBNAIL",
            "@size": "14510",
            "@ref": "gr7",
            "@mimetype": "image/gif"
          },
          {
            "@category": "thumbnail",
            "@height": "164",
            "@width": "170",
            "@_fa": "true",
            "$": "https://api.elsevier.com/content/object/eid/1-s2.0-S1872206721639840-gr8.sml?httpAccept=%2A%2F%2A",
            "@multimediatype": "GIF image file",
            "@type": "IMAGE-THUMBNAIL",
            "@size": "15210",
            "@ref": "gr8",
            "@mimetype": "image/gif"
          },
          {
            "@category": "thumbnail",
            "@height": "141",
            "@width": "219",
            "@_fa": "true",
            "$": "https://api.elsevier.com/content/object/eid/1-s2.0-S1872206721639840-gr9.sml?httpAccept=%2A%2F%2A",
            "@multimediatype": "GIF image file",
            "@type": "IMAGE-THUMBNAIL",
            "@size": "16058",
            "@ref": "gr9",
            "@mimetype": "image/gif"
          },
          {
            "@category": "high",
            "@height": "1085",
            "@width": "1078",
            "@_fa": "true",
            "$": "https://api.elsevier.com/content/object/eid/1-s2.0-S1872206721639840-fx1_lrg.jpg?httpAccept=%2A%2F%2A",
            "@multimediatype": "JPEG image file",
            "@type": "IMAGE-HIGH-RES",
            "@size": "302045",
            "@ref": "fx1",
            "@mimetype": "image/jpeg"
          },
          {
            "@category": "high",
            "@height": "846",
            "@width": "848",
            "@_fa": "true",
            "$": "https://api.elsevier.com/content/object/eid/1-s2.0-S1872206721639840-gr1_lrg.jpg?httpAccept=%2A%2F%2A",
            "@multimediatype": "JPEG image file",
            "@type": "IMAGE-HIGH-RES",
            "@size": "211739",
            "@ref": "gr1",
            "@mimetype": "image/jpeg"
          },
          {
            "@category": "high",
            "@height": "1327",
            "@width": "1628",
            "@_fa": "true",
            "$": "https://api.elsevier.com/content/object/eid/1-s2.0-S1872206721639840-gr10_lrg.jpg?httpAccept=%2A%2F%2A",
            "@multimediatype": "JPEG image file",
            "@type": "IMAGE-HIGH-RES",
            "@size": "707124",
            "@ref": "gr10",
            "@mimetype": "image/jpeg"
          },
          {
            "@category": "high",
            "@height": "386",
            "@width": "982",
            "@_fa": "true",
            "$": "https://api.elsevier.com/content/object/eid/1-s2.0-S1872206721639840-gr2_lrg.jpg?httpAccept=%2A%2F%2A",
            "@multimediatype": "JPEG image file",
            "@type": "IMAGE-HIGH-RES",
            "@size": "122557",
            "@ref": "gr2",
            "@mimetype": "image/jpeg"
          },
          {
            "@category": "high",
            "@height": "912",
            "@width": "1607",
            "@_fa": "true",
            "$": "https://api.elsevier.com/content/object/eid/1-s2.0-S1872206721639840-gr3_lrg.jpg?httpAccept=%2A%2F%2A",
            "@multimediatype": "JPEG image file",
            "@type": "IMAGE-HIGH-RES",
            "@size": "380703",
            "@ref": "gr3",
            "@mimetype": "image/jpeg"
          },
          {
            "@category": "high",
            "@height": "373",
            "@width": "1631",
            "@_fa": "true",
            "$": "https://api.elsevier.com/content/object/eid/1-s2.0-S1872206721639840-gr4_lrg.jpg?httpAccept=%2A%2F%2A",
            "@multimediatype": "JPEG image file",
            "@type": "IMAGE-HIGH-RES",
            "@size": "158040",
            "@ref": "gr4",
            "@mimetype": "image/jpeg"
          },
          {
            "@category": "high",
            "@height": "1435",
            "@width": "1335",
            "@_fa": "true",
            "$": "https://api.elsevier.com/content/object/eid/1-s2.0-S1872206721639840-gr5_lrg.jpg?httpAccept=%2A%2F%2A",
            "@multimediatype": "JPEG image file",
            "@type": "IMAGE-HIGH-RES",
            "@size": "574701",
            "@ref": "gr5",
            "@mimetype": "image/jpeg"
          },
          {
            "@category": "high",
            "@height": "1527",
            "@width": "1721",
            "@_fa": "true",
            "$": "https://api.elsevier.com/content/object/eid/1-s2.0-S1872206721639840-gr6_lrg.jpg?httpAccept=%2A%2F%2A",
            "@multimediatype": "JPEG image file",
            "@type": "IMAGE-HIGH-RES",
            "@size": "605795",
            "@ref": "gr6",
            "@mimetype": "image/jpeg"
          },
          {
            "@category": "high",
            "@height": "1527",
            "@width": "1596",
            "@_fa": "true",
            "$": "https://api.elsevier.com/content/object/eid/1-s2.0-S1872206721639840-gr7_lrg.jpg?httpAccept=%2A%2F%2A",
            "@multimediatype": "JPEG image file",
            "@type": "IMAGE-HIGH-RES",
            "@size": "551526",
            "@ref": "gr7",
            "@mimetype": "image/jpeg"
          },
          {
            "@category": "high",
            "@height": "1582",
            "@width": "1643",
            "@_fa": "true",
            "$": "https://api.elsevier.com/content/object/eid/1-s2.0-S1872206721639840-gr8_lrg.jpg?httpAccept=%2A%2F%2A",
            "@multimediatype": "JPEG image file",
            "@type": "IMAGE-HIGH-RES",
            "@size": "540035",
            "@ref": "gr8",
            "@mimetype": "image/jpeg"
          },
          {
            "@category": "high",
            "@height": "876",
            "@width": "1358",
            "@_fa": "true",
            "$": "https://api.elsevier.com/content/object/eid/1-s2.0-S1872206721639840-gr9_lrg.jpg?httpAccept=%2A%2F%2A",
            "@multimediatype": "JPEG image file",
            "@type": "IMAGE-HIGH-RES",
            "@size": "341736",
            "@ref": "gr9",
            "@mimetype": "image/jpeg"
          }
        ]
      },
      "link": {
        "@rel": "abstract",
        "@href": "https://api.elsevier.com/content/abstract/scopus_id/85141529936"
      }
    }
  }
}