{
  "metadata": {
    "title": "Advanced yolk-shell nanoparticles as nanoreactors for energy conversion",
    "authors": "; ; ",
    "journal": "Chinese Journal of Catalysis",
    "date": "2017-06-30",
    "doi": "10.1016/S1872-2067(17)62818-3",
    "abstract": "",
    "uri": "https://api.elsevier.com/content/article/pii/S1872206717628183",
    "pii": "S1872206717628183"
  },
  "fulltext": {
    "full-text-retrieval-response": {
      "scopus-eid": "2-s2.0-85020841044",
      "originalText": "serial JL 273538 291210 291744 291809 31 Chinese Journal of Catalysis CHINESEJOURNALCATALYSIS 2017-06-16 2017-06-16 2017-06-16 2017-06-16 2018-10-06T00:01:34 1-s2.0-S1872206717628183 S1872-2067(17)62818-3 S1872206717628183 10.1016/S1872-2067(17)62818-3 S300 S300.2 FULL-TEXT 1-s2.0-S1872206717X00089 2018-10-06T00:08:53.069524Z 0 0 20170601 20170630 2017 2017-06-16T14:45:11.948784Z absattachment articleinfo articletitlenorm authfirstinitialnorm authfirstsurnamenorm cid cids contenttype copyright crossmark dateloaded dateloadedtxt datesearch datesort dateupdated dco docsubtype doctype doi eid ewtransactionid hubeid indexeddate issfirst issn issnnorm issuelist itemstage itemtransactionid itemweight openaccess openarchive pg pgfirst pglast pii piinorm pubdateend pubdatestart pubdatetxt pubyr sortorder srctitle srctitlenorm srctype ssids alllist content subj subheadings tomb volfirst volissue volumelist webpdf webpdfpagecount yearnav figure table body mmlmath affil articletitle auth authfirstini authfull authkeywords authlast primabst pubtype ref specialabst 1872-2067 18722067 true 38 38 6 6 Volume 38, Issue 6 3 970 990 970 990 201706 June 2017 2017-06-01 2017-06-30 2017 article rev Copyright © 2017 Dalian Institute of Chemical Physics, the Chinese Academy of Sciences. Published by Elsevier B.V. All rights reserved. ADVANCEDYOLKSHELLNANOPARTICLESNANOREACTORSFORENERGYCONVERSION WANG M 1 Introduction 2 Synthetic methods 2.1 General synthetic methods 2.2 Comparison and analysis of general synthetic methods 3 Advanced YSNs for energy-conversion applications 3.1 Use of carbon sources — methane reforming 3.2 Photocatalysis 3.3 Electrocatalysis 4 Summary and outlook References TOUMEY 2009 783 784 C OSTAFIN 2000 A KIRKOTHMERENCYCLOPEDIACHEMICALTECHNOLOGY LIU 2011 12578 12591 J YANG 2012 9164 9168 Y ZHANG 2012 20182 20185 H PEREZLORENZO 2013 12196 12211 M TIAN 2015 4959 4977 H GUIET 2015 6228 6240 A PRIEBE 2015 3854 3874 M LIU 2011 425 443 J JIN 2014 2344 2351 R JANKIEWICZ 2012 28 47 B YAO 2013 230 236 T LIN 2011 2984 2988 C LI 2014 3995 4011 G LI 2016 324 341 Z FANG 2011 1902 1909 Q CHEN 2010 6524 6526 Z FANG 2013 2205 2218 X LIU 2012 591 599 J GUTTEL 2012 100 104 R SHMAKOV 2014 1126 1132 S WU 2012 2229 2233 S LIU 2013 9747 9757 B LIANG 2012 8034 8036 X PARK 2011 33 49 J PURBIA 2015 19789 19873 R SONG 2015 491 499 H PRIETO 2016 14056 14119 G LIU 2010 4981 4985 J LI 2015 160 168 Z PAK 2014 107 112 J LIU 2014 11887 11897 B FANG 2013 6908 6916 X ZHANG 2008 2867 2871 Q LI 2015 126 131 J ZENG 2011 7511 7526 H YEC 2014 4843 4851 C LOU 2006 1679 1684 X WANG 2012 1903 1911 Z CAO 2013 10986 10991 L QIN 2013 897 902 Z POLAVARAPU 2013 4355 4361 L ANDERSON 2014 12195 12216 B PEARSON 2010 731 733 A XIA 2013 6313 6333 X LEE 2014 631 667 J XU 2014 4221 4226 P JIN 2011 58 61 J MAHMOUD 2013 1795 1805 M CHEN 2010 529 539 Y WANG 2015 238 245 C ZHAO 2013 22008 22013 Z KONG 2010 421 426 L ZENG 2011 11 17 H PAN 2003 542 546 L DAI 2014 4846 4848 C WANG 2014 98 103 S ZHANG 2012 2227 2238 N LIU 2005 566 571 B XIE 2012 14974 14980 S NIU 2013 3172 3181 W YEO 2010 64 66 K JEONG 2015 499 502 K ROSARIOAMORIN 2009 12636 12643 D MAJEWSKI 2013 14531 14541 A MIRZAEI 2014 973 978 F LIGTHART 2011 206 220 D ZHAO 2016 2447 2456 X LIM 2015 61925 61932 Z BIAN 2016 1 8 Z PARK 2010 1239 1246 J LI 2012 54 64 L KIM 2011 775 783 H DING 2015 6835 6843 C HAJJAJI 2012 392 399 N GOULD 2014 2714 2717 T ZHENG 2014 11360 11367 X KANG 2011 1236 1243 K LI 2014 1526 1536 Z YANG 2016 438 445 W BHARADWAJ 1995 109 127 S KIM 2009 3351 3359 H LI 2013 3781 3787 L MATSUOKA 2007 51 61 M PARAMASIVAM 2012 7 11 I CUI 2013 9065 9073 X YANG 2014 696 699 T KIM 2014 272 279 H ISMAIL 2014 85 101 A LI 2013 041101 X WANG 2013 11252 11256 D HERNANDEZ 2014 S530 S537 S LEE 2011 2449 2456 I WANG 2014 4144 4150 Q MAEDA 2006 7806 7809 K PIHOSH 2014 315402 Y WANG 2015 6220 6228 M LI 2013 1461 1466 G ZHANG 2016 3038 3047 Q LIANG 2017 1000 1005 B YU 2014 11492 11501 J DAS 2014 765 805 S ADACHI 1994 187 190 K DERICHTER 2013 82 106 R BAEISSA 2014 12431 12438 E TU 2015 14232 14236 W ZHAI 2013 5776 5779 Q TSAI 2011 10180 10186 C GUI 2015 272 278 M LIU 2015 8166 8175 S WANG 2017 5020 5029 W WANG 2012 3421 3425 X JIANG 2015 784 797 Z LI 2015 109 115 J ZHOU 2015 119 126 J CHEN 2014 6603 6608 L JOO 2016 261 269 J ZHAO 2016 5313 5326 Y TANG 2014 305 323 J ZHANG 2015 863 868 H GU 2015 572 578 L SELVAKUMAR 2014 21024 21036 K XIAO 2015 7056 7064 J SU 2007 63 128 F CHEMISTRYPHYSICSCARBON KUAI 2011 6093 6095 L YE 2014 12337 12340 S LONG 2013 636 676 N HUANG 2014 868 875 Y LI 2010 6373 6378 X SHI 2015 4350 4357 Q YE 2012 19132 19138 Y LU 2016 560 568 Y HU 2015 5590 5595 H HU 2016 107 111 H CHAO 2015 128 135 S BIE 2015 22448 22453 S ZHENG 2016 907 916 X YIN 2016 19129 19138 Z TIAN 2017 H HAO 2017 Y WANG 2017 207 216 Z MORTAZAVIDERAZKOLA 2017 17 23 S WANGX2017X970 WANGX2017X970X990 WANGX2017X970XM WANGX2017X970X990XM 2019-06-16T00:00:00.000Z UnderEmbargo http://creativecommons.org/licenses/by-nc-nd/4.0/ item S1872-2067(17)62818-3 S1872206717628183 1-s2.0-S1872206717628183 10.1016/S1872-2067(17)62818-3 273538 2018-10-06T00:08:53.069524Z 2017-06-01 2017-06-30 1-s2.0-S1872206717628183-main.pdf https://s3-eu-west-1.amazonaws.com/prod-ucs-content-store-eu-west/content/pii:S1872206717628183/MAIN/application/pdf/60d884f4517707338dd4b56ed95157d2/main.pdf https://s3.amazonaws.com/prod-ucs-content-store-us-east/content/pii:S1872206717628183/MAIN/application/pdf/60d884f4517707338dd4b56ed95157d2/main.pdf main.pdf pdf true 3597902 MAIN 21 1-s2.0-S1872206717628183-main_1.png https://s3-eu-west-1.amazonaws.com/prod-ucs-content-store-eu-west/content/pii:S1872206717628183/PREVIEW/image/png/a1c317b0e5866703ef417be13b9efa14/main_1.png https://s3.amazonaws.com/prod-ucs-content-store-us-east/content/pii:S1872206717628183/PREVIEW/image/png/a1c317b0e5866703ef417be13b9efa14/main_1.png main_1.png png 47052 849 656 IMAGE-WEB-PDF 1 1-s2.0-S1872206717628183-fx1.sml https://s3-eu-west-1.amazonaws.com/prod-ucs-content-store-eu-west/content/pii:S1872206717628183/fx1/THUMBNAIL/image/gif/403e5082aa91b911736ecb6692aed526/fx1.sml https://s3.amazonaws.com/prod-ucs-content-store-us-east/content/pii:S1872206717628183/fx1/THUMBNAIL/image/gif/403e5082aa91b911736ecb6692aed526/fx1.sml fx1 true fx1.sml sml 14750 72 219 IMAGE-THUMBNAIL 1-s2.0-S1872206717628183-gr1.sml https://s3-eu-west-1.amazonaws.com/prod-ucs-content-store-eu-west/content/pii:S1872206717628183/gr1/THUMBNAIL/image/gif/7a82974ef6b61ee9168f61c6b7ae6ba5/gr1.sml https://s3.amazonaws.com/prod-ucs-content-store-us-east/content/pii:S1872206717628183/gr1/THUMBNAIL/image/gif/7a82974ef6b61ee9168f61c6b7ae6ba5/gr1.sml gr1 gr1.sml sml 10826 116 219 IMAGE-THUMBNAIL 1-s2.0-S1872206717628183-gr10.sml https://s3-eu-west-1.amazonaws.com/prod-ucs-content-store-eu-west/content/pii:S1872206717628183/gr10/THUMBNAIL/image/gif/441b57150f5c5cb303968f1fa213f8ac/gr10.sml https://s3.amazonaws.com/prod-ucs-content-store-us-east/content/pii:S1872206717628183/gr10/THUMBNAIL/image/gif/441b57150f5c5cb303968f1fa213f8ac/gr10.sml gr10 gr10.sml sml 18050 163 118 IMAGE-THUMBNAIL 1-s2.0-S1872206717628183-gr2.sml https://s3-eu-west-1.amazonaws.com/prod-ucs-content-store-eu-west/content/pii:S1872206717628183/gr2/THUMBNAIL/image/gif/edb1aabe11783c5ac03a86a2bee5a961/gr2.sml https://s3.amazonaws.com/prod-ucs-content-store-us-east/content/pii:S1872206717628183/gr2/THUMBNAIL/image/gif/edb1aabe11783c5ac03a86a2bee5a961/gr2.sml gr2 gr2.sml sml 15505 163 165 IMAGE-THUMBNAIL 1-s2.0-S1872206717628183-gr3.sml https://s3-eu-west-1.amazonaws.com/prod-ucs-content-store-eu-west/content/pii:S1872206717628183/gr3/THUMBNAIL/image/gif/3236c288d63efd3abd2cf49ce9f16fd4/gr3.sml https://s3.amazonaws.com/prod-ucs-content-store-us-east/content/pii:S1872206717628183/gr3/THUMBNAIL/image/gif/3236c288d63efd3abd2cf49ce9f16fd4/gr3.sml gr3 gr3.sml sml 7565 55 219 IMAGE-THUMBNAIL 1-s2.0-S1872206717628183-gr4.sml https://s3-eu-west-1.amazonaws.com/prod-ucs-content-store-eu-west/content/pii:S1872206717628183/gr4/THUMBNAIL/image/gif/fcb416c32782cc87409d5811936addd1/gr4.sml https://s3.amazonaws.com/prod-ucs-content-store-us-east/content/pii:S1872206717628183/gr4/THUMBNAIL/image/gif/fcb416c32782cc87409d5811936addd1/gr4.sml gr4 gr4.sml sml 19502 108 219 IMAGE-THUMBNAIL 1-s2.0-S1872206717628183-gr5.sml https://s3-eu-west-1.amazonaws.com/prod-ucs-content-store-eu-west/content/pii:S1872206717628183/gr5/THUMBNAIL/image/gif/40e6a105447c40998745b23d4b9081e4/gr5.sml https://s3.amazonaws.com/prod-ucs-content-store-us-east/content/pii:S1872206717628183/gr5/THUMBNAIL/image/gif/40e6a105447c40998745b23d4b9081e4/gr5.sml gr5 gr5.sml sml 30585 164 197 IMAGE-THUMBNAIL 1-s2.0-S1872206717628183-gr6.sml https://s3-eu-west-1.amazonaws.com/prod-ucs-content-store-eu-west/content/pii:S1872206717628183/gr6/THUMBNAIL/image/gif/8499b8dba2f6b506a06c09e76e55b0c1/gr6.sml https://s3.amazonaws.com/prod-ucs-content-store-us-east/content/pii:S1872206717628183/gr6/THUMBNAIL/image/gif/8499b8dba2f6b506a06c09e76e55b0c1/gr6.sml gr6 gr6.sml sml 21917 163 172 IMAGE-THUMBNAIL 1-s2.0-S1872206717628183-gr7.sml https://s3-eu-west-1.amazonaws.com/prod-ucs-content-store-eu-west/content/pii:S1872206717628183/gr7/THUMBNAIL/image/gif/0c10c556d5bfaf2849e1851342d876ba/gr7.sml https://s3.amazonaws.com/prod-ucs-content-store-us-east/content/pii:S1872206717628183/gr7/THUMBNAIL/image/gif/0c10c556d5bfaf2849e1851342d876ba/gr7.sml gr7 gr7.sml sml 22734 164 182 IMAGE-THUMBNAIL 1-s2.0-S1872206717628183-gr8.sml https://s3-eu-west-1.amazonaws.com/prod-ucs-content-store-eu-west/content/pii:S1872206717628183/gr8/THUMBNAIL/image/gif/bc7289e14d742286f4c0b79279114230/gr8.sml https://s3.amazonaws.com/prod-ucs-content-store-us-east/content/pii:S1872206717628183/gr8/THUMBNAIL/image/gif/bc7289e14d742286f4c0b79279114230/gr8.sml gr8 gr8.sml sml 21586 163 171 IMAGE-THUMBNAIL 1-s2.0-S1872206717628183-gr9.sml https://s3-eu-west-1.amazonaws.com/prod-ucs-content-store-eu-west/content/pii:S1872206717628183/gr9/THUMBNAIL/image/gif/36b0bfec815e035ce591ff18ae31258d/gr9.sml https://s3.amazonaws.com/prod-ucs-content-store-us-east/content/pii:S1872206717628183/gr9/THUMBNAIL/image/gif/36b0bfec815e035ce591ff18ae31258d/gr9.sml gr9 gr9.sml sml 17366 116 219 IMAGE-THUMBNAIL 1-s2.0-S1872206717628183-fx1.jpg https://s3-eu-west-1.amazonaws.com/prod-ucs-content-store-eu-west/content/pii:S1872206717628183/fx1/DOWNSAMPLED/image/jpeg/0919af467d7268117f31532406c74128/fx1.jpg https://s3.amazonaws.com/prod-ucs-content-store-us-east/content/pii:S1872206717628183/fx1/DOWNSAMPLED/image/jpeg/0919af467d7268117f31532406c74128/fx1.jpg fx1 true fx1.jpg jpg 44868 165 500 IMAGE-DOWNSAMPLED 1-s2.0-S1872206717628183-gr1.jpg https://s3-eu-west-1.amazonaws.com/prod-ucs-content-store-eu-west/content/pii:S1872206717628183/gr1/DOWNSAMPLED/image/jpeg/c5d51b5bbfa16e2e1b78863b2771dc92/gr1.jpg https://s3.amazonaws.com/prod-ucs-content-store-us-east/content/pii:S1872206717628183/gr1/DOWNSAMPLED/image/jpeg/c5d51b5bbfa16e2e1b78863b2771dc92/gr1.jpg gr1 gr1.jpg jpg 37743 198 373 IMAGE-DOWNSAMPLED 1-s2.0-S1872206717628183-gr10.jpg https://s3-eu-west-1.amazonaws.com/prod-ucs-content-store-eu-west/content/pii:S1872206717628183/gr10/DOWNSAMPLED/image/jpeg/38f2545eedcfd878604fe505cec07bc2/gr10.jpg https://s3.amazonaws.com/prod-ucs-content-store-us-east/content/pii:S1872206717628183/gr10/DOWNSAMPLED/image/jpeg/38f2545eedcfd878604fe505cec07bc2/gr10.jpg gr10 gr10.jpg jpg 145503 774 560 IMAGE-DOWNSAMPLED 1-s2.0-S1872206717628183-gr2.jpg https://s3-eu-west-1.amazonaws.com/prod-ucs-content-store-eu-west/content/pii:S1872206717628183/gr2/DOWNSAMPLED/image/jpeg/aeb9baeca01deb9d10d2cc2e28ad1952/gr2.jpg https://s3.amazonaws.com/prod-ucs-content-store-us-east/content/pii:S1872206717628183/gr2/DOWNSAMPLED/image/jpeg/aeb9baeca01deb9d10d2cc2e28ad1952/gr2.jpg gr2 gr2.jpg jpg 118264 674 680 IMAGE-DOWNSAMPLED 1-s2.0-S1872206717628183-gr3.jpg https://s3-eu-west-1.amazonaws.com/prod-ucs-content-store-eu-west/content/pii:S1872206717628183/gr3/DOWNSAMPLED/image/jpeg/cb2ed648b870d588670b3bfaf26d94a4/gr3.jpg https://s3.amazonaws.com/prod-ucs-content-store-us-east/content/pii:S1872206717628183/gr3/DOWNSAMPLED/image/jpeg/cb2ed648b870d588670b3bfaf26d94a4/gr3.jpg gr3 gr3.jpg jpg 25567 92 366 IMAGE-DOWNSAMPLED 1-s2.0-S1872206717628183-gr4.jpg https://s3-eu-west-1.amazonaws.com/prod-ucs-content-store-eu-west/content/pii:S1872206717628183/gr4/DOWNSAMPLED/image/jpeg/fbcedfcb6df752f392af6be1079b7155/gr4.jpg https://s3.amazonaws.com/prod-ucs-content-store-us-east/content/pii:S1872206717628183/gr4/DOWNSAMPLED/image/jpeg/fbcedfcb6df752f392af6be1079b7155/gr4.jpg gr4 gr4.jpg jpg 105690 327 666 IMAGE-DOWNSAMPLED 1-s2.0-S1872206717628183-gr5.jpg https://s3-eu-west-1.amazonaws.com/prod-ucs-content-store-eu-west/content/pii:S1872206717628183/gr5/DOWNSAMPLED/image/jpeg/4f649babed0b3a509d0a3f5357f01181/gr5.jpg https://s3.amazonaws.com/prod-ucs-content-store-us-east/content/pii:S1872206717628183/gr5/DOWNSAMPLED/image/jpeg/4f649babed0b3a509d0a3f5357f01181/gr5.jpg gr5 gr5.jpg jpg 126934 444 533 IMAGE-DOWNSAMPLED 1-s2.0-S1872206717628183-gr6.jpg https://s3-eu-west-1.amazonaws.com/prod-ucs-content-store-eu-west/content/pii:S1872206717628183/gr6/DOWNSAMPLED/image/jpeg/d894d472244aba4bf7f10b556c1968c3/gr6.jpg https://s3.amazonaws.com/prod-ucs-content-store-us-east/content/pii:S1872206717628183/gr6/DOWNSAMPLED/image/jpeg/d894d472244aba4bf7f10b556c1968c3/gr6.jpg gr6 gr6.jpg jpg 146235 634 667 IMAGE-DOWNSAMPLED 1-s2.0-S1872206717628183-gr7.jpg https://s3-eu-west-1.amazonaws.com/prod-ucs-content-store-eu-west/content/pii:S1872206717628183/gr7/DOWNSAMPLED/image/jpeg/2f5a49f7e3fe9ca080bed7bd87ec558d/gr7.jpg https://s3.amazonaws.com/prod-ucs-content-store-us-east/content/pii:S1872206717628183/gr7/DOWNSAMPLED/image/jpeg/2f5a49f7e3fe9ca080bed7bd87ec558d/gr7.jpg gr7 gr7.jpg jpg 122054 568 630 IMAGE-DOWNSAMPLED 1-s2.0-S1872206717628183-gr8.jpg https://s3-eu-west-1.amazonaws.com/prod-ucs-content-store-eu-west/content/pii:S1872206717628183/gr8/DOWNSAMPLED/image/jpeg/1c08a8d115819f31c3bdc097900397ef/gr8.jpg https://s3.amazonaws.com/prod-ucs-content-store-us-east/content/pii:S1872206717628183/gr8/DOWNSAMPLED/image/jpeg/1c08a8d115819f31c3bdc097900397ef/gr8.jpg gr8 gr8.jpg jpg 122618 552 578 IMAGE-DOWNSAMPLED 1-s2.0-S1872206717628183-gr9.jpg https://s3-eu-west-1.amazonaws.com/prod-ucs-content-store-eu-west/content/pii:S1872206717628183/gr9/DOWNSAMPLED/image/jpeg/954b6b0c740606c41c51404543441105/gr9.jpg https://s3.amazonaws.com/prod-ucs-content-store-us-east/content/pii:S1872206717628183/gr9/DOWNSAMPLED/image/jpeg/954b6b0c740606c41c51404543441105/gr9.jpg gr9 gr9.jpg jpg 80969 338 638 IMAGE-DOWNSAMPLED 1-s2.0-S1872206717628183-fx1_lrg.jpg https://s3-eu-west-1.amazonaws.com/prod-ucs-content-store-eu-west/content/pii:S1872206717628183/fx1/HIGHRES/image/jpeg/f6047cdb5ba880040a9a40a12a00122e/fx1_lrg.jpg https://s3.amazonaws.com/prod-ucs-content-store-us-east/content/pii:S1872206717628183/fx1/HIGHRES/image/jpeg/f6047cdb5ba880040a9a40a12a00122e/fx1_lrg.jpg fx1 true fx1_lrg.jpg jpg 142668 437 1328 IMAGE-HIGH-RES 1-s2.0-S1872206717628183-gr1_lrg.jpg https://s3-eu-west-1.amazonaws.com/prod-ucs-content-store-eu-west/content/pii:S1872206717628183/gr1/HIGHRES/image/jpeg/907f40c9cc92592e243041179fab921c/gr1_lrg.jpg https://s3.amazonaws.com/prod-ucs-content-store-us-east/content/pii:S1872206717628183/gr1/HIGHRES/image/jpeg/907f40c9cc92592e243041179fab921c/gr1_lrg.jpg gr1 gr1_lrg.jpg jpg 114113 526 992 IMAGE-HIGH-RES 1-s2.0-S1872206717628183-gr10_lrg.jpg https://s3-eu-west-1.amazonaws.com/prod-ucs-content-store-eu-west/content/pii:S1872206717628183/gr10/HIGHRES/image/jpeg/4d1feb47128220a0b5c26b1ae1bfc41d/gr10_lrg.jpg https://s3.amazonaws.com/prod-ucs-content-store-us-east/content/pii:S1872206717628183/gr10/HIGHRES/image/jpeg/4d1feb47128220a0b5c26b1ae1bfc41d/gr10_lrg.jpg gr10 gr10_lrg.jpg jpg 556839 2054 1487 IMAGE-HIGH-RES 1-s2.0-S1872206717628183-gr2_lrg.jpg https://s3-eu-west-1.amazonaws.com/prod-ucs-content-store-eu-west/content/pii:S1872206717628183/gr2/HIGHRES/image/jpeg/fda3ed1c8d1a1b1e03098e56a4854971/gr2_lrg.jpg https://s3.amazonaws.com/prod-ucs-content-store-us-east/content/pii:S1872206717628183/gr2/HIGHRES/image/jpeg/fda3ed1c8d1a1b1e03098e56a4854971/gr2_lrg.jpg gr2 gr2_lrg.jpg jpg 429042 1790 1807 IMAGE-HIGH-RES 1-s2.0-S1872206717628183-gr3_lrg.jpg https://s3-eu-west-1.amazonaws.com/prod-ucs-content-store-eu-west/content/pii:S1872206717628183/gr3/HIGHRES/image/jpeg/6abaecc1fdd934e11f21cf5cdf45f9cc/gr3_lrg.jpg https://s3.amazonaws.com/prod-ucs-content-store-us-east/content/pii:S1872206717628183/gr3/HIGHRES/image/jpeg/6abaecc1fdd934e11f21cf5cdf45f9cc/gr3_lrg.jpg gr3 gr3_lrg.jpg jpg 68675 243 972 IMAGE-HIGH-RES 1-s2.0-S1872206717628183-gr4_lrg.jpg https://s3-eu-west-1.amazonaws.com/prod-ucs-content-store-eu-west/content/pii:S1872206717628183/gr4/HIGHRES/image/jpeg/3b6d7ec69f8c6270dbee2a768240444e/gr4_lrg.jpg https://s3.amazonaws.com/prod-ucs-content-store-us-east/content/pii:S1872206717628183/gr4/HIGHRES/image/jpeg/3b6d7ec69f8c6270dbee2a768240444e/gr4_lrg.jpg gr4 gr4_lrg.jpg jpg 462342 869 1769 IMAGE-HIGH-RES 1-s2.0-S1872206717628183-gr5_lrg.jpg https://s3-eu-west-1.amazonaws.com/prod-ucs-content-store-eu-west/content/pii:S1872206717628183/gr5/HIGHRES/image/jpeg/53d404630fb7fe25425fb1683e01408e/gr5_lrg.jpg https://s3.amazonaws.com/prod-ucs-content-store-us-east/content/pii:S1872206717628183/gr5/HIGHRES/image/jpeg/53d404630fb7fe25425fb1683e01408e/gr5_lrg.jpg gr5 gr5_lrg.jpg jpg 429608 1179 1416 IMAGE-HIGH-RES 1-s2.0-S1872206717628183-gr6_lrg.jpg https://s3-eu-west-1.amazonaws.com/prod-ucs-content-store-eu-west/content/pii:S1872206717628183/gr6/HIGHRES/image/jpeg/c18023a37808d302926cc4e9de2fb4f6/gr6_lrg.jpg https://s3.amazonaws.com/prod-ucs-content-store-us-east/content/pii:S1872206717628183/gr6/HIGHRES/image/jpeg/c18023a37808d302926cc4e9de2fb4f6/gr6_lrg.jpg gr6 gr6_lrg.jpg jpg 555063 1685 1773 IMAGE-HIGH-RES 1-s2.0-S1872206717628183-gr7_lrg.jpg https://s3-eu-west-1.amazonaws.com/prod-ucs-content-store-eu-west/content/pii:S1872206717628183/gr7/HIGHRES/image/jpeg/05aa21a81dd79d67f41735cad4a84643/gr7_lrg.jpg https://s3.amazonaws.com/prod-ucs-content-store-us-east/content/pii:S1872206717628183/gr7/HIGHRES/image/jpeg/05aa21a81dd79d67f41735cad4a84643/gr7_lrg.jpg gr7 gr7_lrg.jpg jpg 478736 1508 1673 IMAGE-HIGH-RES 1-s2.0-S1872206717628183-gr8_lrg.jpg https://s3-eu-west-1.amazonaws.com/prod-ucs-content-store-eu-west/content/pii:S1872206717628183/gr8/HIGHRES/image/jpeg/9ea04b202140229fb56a173b866c2d27/gr8_lrg.jpg https://s3.amazonaws.com/prod-ucs-content-store-us-east/content/pii:S1872206717628183/gr8/HIGHRES/image/jpeg/9ea04b202140229fb56a173b866c2d27/gr8_lrg.jpg gr8 gr8_lrg.jpg jpg 474152 1469 1537 IMAGE-HIGH-RES 1-s2.0-S1872206717628183-gr9_lrg.jpg https://s3-eu-west-1.amazonaws.com/prod-ucs-content-store-eu-west/content/pii:S1872206717628183/gr9/HIGHRES/image/jpeg/75bbed615585dc8314e00d44d90c41d3/gr9_lrg.jpg https://s3.amazonaws.com/prod-ucs-content-store-us-east/content/pii:S1872206717628183/gr9/HIGHRES/image/jpeg/75bbed615585dc8314e00d44d90c41d3/gr9_lrg.jpg gr9 gr9_lrg.jpg jpg 265847 898 1695 IMAGE-HIGH-RES 1-s2.0-S1872206717628183-si1.gif https://s3-eu-west-1.amazonaws.com/prod-ucs-content-store-eu-west/content/pii:S1872206717628183/STRIPIN/image/gif/8ad6c5ab6f2334ddfb776dac530a29b1/si1.gif https://s3.amazonaws.com/prod-ucs-content-store-us-east/content/pii:S1872206717628183/STRIPIN/image/gif/8ad6c5ab6f2334ddfb776dac530a29b1/si1.gif si1 si1.gif gif 1905 40 349 ALTIMG 1-s2.0-S1872206717628183-si2.gif https://s3-eu-west-1.amazonaws.com/prod-ucs-content-store-eu-west/content/pii:S1872206717628183/STRIPIN/image/gif/87e8e560d8ea2cbf2c8af208bf82ea1c/si2.gif https://s3.amazonaws.com/prod-ucs-content-store-us-east/content/pii:S1872206717628183/STRIPIN/image/gif/87e8e560d8ea2cbf2c8af208bf82ea1c/si2.gif si2 si2.gif gif 1074 16 353 ALTIMG CHNJC 62818 S1872-2067(17)62818-3 10.1016/S1872-2067(17)62818-3 Dalian Institute of Chemical Physics, the Chinese Academy of Sciences Fig. 1 Diagram of different spherical architectures of YSNs. (A) core encapsulated in shell; (B) multiple cores within solid shell; (C) core-satellite-shell structure; (D) single yolk encapsulated in shell with multiple cores loaded on shell surface; (E) single core within multiple shells. Fig. 2 Simple diagrams of general synthetic methods. (A) selective etching method; (B) soft- and hard-templating methods; (C) ship-in-a-bottle method; (D) Ostwald ripening method; (E) galvanic replacement method; (F) Kirkendall diffusion method. Fig. 3 Synthesis of Ni@SiO2 by seed-mediated growth. Fig. 4 (A) Schematic diagram of synthesis of Ni@ZrO2 YSNs, and transition electron microscopy images and core-size distributions at each synthetic step; (B) recyclability (a) and durability tests (b) for Ni@ZrO2 YSNs in SRM. (Panels A and B reproduced with permission from Ref. [70]. Copyright) © The Royal Society of Chemistry 2015. Fig. 5 (A) Transition electron microscopy (TEM) image of NiCe@m-SiO2 YSNs and (inset) size distribution of Ni nanoparticles (a); and high-resolution TEM image of NiCe@m-SiO2 YSNs (b); (B) CH4 and CO2 conversions over different catalysts at various temperatures (a) and catalytic stabilities of different catalysts (b). (Panels A and B reproduced with permission from Ref. [69].) Copyright © 2015, Hydrogen Energy Publications. Fig. 6 (A) Schematic diagram of water splitting mechanism using noble metal@semiconductor YSNs; (B) schematic diagram of Au@r-GO/TiO2 synthetic steps (a), TEM image (b), and high-resolution TEM image (d) of Au@r-GO/TiO2, high-angle angular dark-field-scanning TEM images of Au@r-GO/TiO2 (c, e), energy-dispersive X-ray spectroscopy mapping images of single Au@r-GO/TiO2 nanoparticles (f–h); (C) comparison of H2 production from methanol aqueous solution using different catalysts: visible-light irradiation (a) and simulated-daylight irradiation (b), recyclability of Au@r-GO/TiO2 nanoparticles in H2 production under visible-light irradiation (c). (Panels B and C reproduced with permission from Ref. [98]) Copyright © 2016 American Chemical Society. Fig. 7 (A) Schematic diagram of CO2 reduction mechanism using noble metal@semiconductor YSNs; (B) SEM (a, b) and TEM (c, d) images of Au@TiO2 YSNs (inset in d is high-resolution TEM image); (C) CH4 (a) and C2H6 (b) production catalysed by Au@TiO2 YSNs and bare hollow TiO2 spheres, comparison of photocatalytic activities of P25, TiO2 hollow spheres, and Au@TiO2 YSNs (c). (Panels B and C reproduced with permission from Ref. [107]) Copyright © The Royal Society of Chemistry 2015. Fig. 8 (A) Schematic diagram of synthesis of Fe3O4@TiO2@Ag YSNs (a), and TEM images at synthetic steps (b–e); (B) results for AMP photodegradation under UV irradiation (a) and visible-light irradiation (b). (Panels A and B reproduced with permission from Ref. [119].) Copyright © The Royal Society of Chemistry 2016. Fig. 9 (A) TEM images of Au@pPt YSNs (a, b); (B) cyclic voltammograms (a) and chronoamperometric curves (b) recorded at 0.6 V for MOR catalysed by Au@pPt, hollow Pt, and Pt black catalysts under acidic conditions, cyclic voltammograms (c) and chronoamperometric curves (d) recorded at −0.2 V for MOR catalysed by Au@pPt, hollow Pt, and Pt black catalysts under alkaline conditions. (Panels A and B reproduced with permission from Ref. [121].) Copyright © 2015 Wiley-VCH Verlag GmbH & Co. KGaA, Weinheim. Fig. 10 (A) Schematic diagram of synthesis of Co-C@Co9S8 double-shelled nanocages; (B) SEM image of Co-C@Co9S8 (a), TEM images of Co-C@Co9S8 (b, c); (C) cyclic voltammetry curves of Co-C@Co9S8 in an Ar- or O2-saturated 0.1 mol/L KOH solution at scanning rate of 10 mV/s (a), linear sweep voltammograms of Co-C@Co9S8 at different rotating speeds (b), Koutecky-Levich plots of Co-C@Co9S8 at various potentials (c), and stabilities of Co-C@Co9S8, Co-C, Co9S8, and Pt black at 1600 r/min in O2-saturated 0.1 mol/L KOH solution (d). (Panels A and B reproduced with permission from Ref. [135].) Copyright © The Royal Society of Chemistry 2016. Table 1 Comparison of common methods for YSNs synthesis. Synthesis method Suitable composites Nanoparticle structure Complexity Disadvantages Ref. Selective etching Most types of materials Spherical and non-spherical Moderate Amount of etchant used [3,35] Soft templating Inorganic materials Spherical Simple Uniformity; appropriate surfactants [3,15,29] Hard templating Metals and metal oxides Spherical Simple Rigid shape particles only; costly [15,29,48,49] Ship-in-bottle Most types of materials Spherical Moderate Shell needs to be prepared first. [3,22] Ostwald ripening Inorganic oxides or sulphide semiconducting materials Complex Moderate Controlling of void space [3,42] Galvanic replacement Noble metals and metal oxides Various shapes and structures Moderate Time consuming; breakup of nanostructure [3,44,46,50] Kirkendall effect Metals and alloys Complex Moderate Untuneable [3,37,44] Table 2 Summary of catalytic performances of nanoreactors used in SRM, DRM, and POM. Application Catalyst Performance Particle name Structure * Ni (wt%) Operating temperature (K) CH4 conversion (%) Tested durability (h) Ref. SRM Nicore@SiO2 CS 11 1023 85 4 [66] Nicore@Al2O3 CS 10 1023 97 5 [74] Ni@SiO2 YS 89 973 90 4 [72] Ni@ZrO2 YS 5.08 1023 93 150 [70] DRM Nicore@Al2O3 CS 11 1073 92 150 [79] LaNiO3core@SiO2 CS 10 NA 88.3 30 [78] Ni-Mg PSNTS@SiO2 CS 11.6 1023 85 72 [71] Ni-yolk@Ni@SiO2 YS 18.6 1073 90 90 [80] Ni@SiO2 YS 42.4 973 43.9 590 [81] NiCe@m-SiO2 YS 10.6 1023 95.2 40 [69] POM Nicore@Al2O3 CS 10 1073 96 50 [83] Ni-350@meso-SiO2 CS 43 (calculated) 1023 93 8.3 [73] 0.1La-Ni@SiO2 CS 43 (calculated) 973 1023 85.2 96.1 64 [84] Ni/ZrO2@SiO2 CS 24.8 1023 99 160 [75] * CS: Core-shell; YS: Yolk-shell. Table 3 Summary of catalytic performances of nanoreactors used in photocatalytic water splitting, CO2 reduction, and pollutant degradation. Application Catalyst Performance Particle name Structure * Illumination H2 production (μmol h−1g−1) Quantum efficiency Tested time (h) Ref. Water splitting 2H2O ↔ 2H2 + O2 NiFe2O4@TiO2 CS UV-vis light (λ = 365nm) 215.8 (calculated) NA 8 [89] Pt-SiO2@IrO2-Ti3N5 CS UV-vis light (λ >420nm) 46 (calculated) NA NA [92] SrTiO3core:La/Rh CS UV-vis light (λ >420nm) 280 (calculated) NA 16 [95] h-(pt-TiO2)/CdS YS Visible light (λ >420 nm) 29600 14.5% 70 [87] (Ni-ZnO)@C YS UV-vis light 5.01 NA NA [88] Au@r-GO/TiO2 YS Visible light (λ <400 nm) 462 2.5% 24 [98] Carbon dioxide reduction Particle name Structure * Illumination Carbon fuel production (μmol h−1g−1) Chemical reaction Au@TiO2 YS UV-vis light CH4 = 6.34 C2H4= 0.68 CO2 + 2H2O → 22 +CH4 [107] C@TiO2 YS Solar light CH4 = 4.22 2CO2 + 22O → 3O2 +C2H4 [112] Ni@NiO/InTaO4-N CS Visible light (λ = 390–770 nm) CH4 ≈ 160 (calculated) [59,109] Cu/Pt/TiO2 CS UV-vis light (λ = 320–780 nm) CH4 = 3 2CO2 + 3H2O → 3.5O2 +C2H6 [108] Ag-MWCNT@TiO2 CS Visible light CH4 = 6.34 C2H4= 0.68 [110] Degradation of pollutants R + OH−→ R− + H2O Particle name Structure * Illumination Pollutant degradation efficiency (%) Quantum efficiency Tested time Au@r-GO/TiO2 YS Visible light (λ = 400 nm) RhB = 99 3.4% 100 min [98] Fe3O4@C@TiO2 YS UV light RhB ≈ 99 NA 90 min [117] C@TiO2 YS UV light (λ = 365 nm) RhB ≈ 99 NA 30 min [118] Fe3O4@TiO2@Ag YS UV and visible lights AMP = 98.7 (UV) NA 360 min [119] AMP = 91.5 (Visible) * CS: Core-shell; YS: Yolk-shell. Table 4 Summary of catalytic performances of nanoreactors used in MOR and ORR. Application Catalyst Performance Particle name Structure * Synthesis method Testing condition Catalytic activity Stability Ref. Methanol oxidation reaction CH3OH + H2O → CO2 + 6H+ + 6e− Au@Pt YS Galvanic displacement Alkaline solution mass current density = 86.1 mA/mgPt Stable [126] Fe3O4@PDA/RGO/Pt YS Hydrothermal method Acidic solution mass current density = 385.3 mA/mgPt 2.6 times higher than that of the Pt black Not very stable [129] Au@pPt YS Template approach and selective etching Acidic solution Alkaline solution Acidic: mass current density = 107.5 mA/mg catalyst 1.9 times higher than that of the Pt black Alkaline: mass current density = 936.0 mA/mg catalyst Stable [121] Oxygen reduction reaction 1/2O2 + 2H+ +2e− → H2O Co@Co3O4/BNCNTs CS Thermal treatment and oxidation process Alkaline solution Not as good as Pt black Stable [124] PdAg@Pd CS Oleylamine-reduction and electrochemical treatment Acidic solution Positive shift of onset potential, similar current density as Pt black Stable [133] Au@pPt YS Template approach and selective etching Alkaline solution Better onset potential and current density than Pt black NA [121] Fe3O4@Fe2.5C/N-doped C YS Template approach and calcination Alkaline solution Good activity Stable [122] Co-C@ Co9S8 YS thermal annealing Alkaline solution Close to 20 wt% Pt black Stable [135] * CS: Core-shell; YS: Yolk-shell. Published 5 June 2017 Review (Special Issue on Nanoscience and Catalysis) Advanced yolk-shell nanoparticles as nanoreactors for energy conversion Meiwen Wang Yash Boyjoo Jian Pan Shaobin Wang # Jian Liu * Department of Chemical Engineering, Curtin University, Perth, WA 6845, Australia Department of Chemical Engineering Curtin University Perth WA 6845 Australia * Corresponding author Corresponding author # Corresponding author Corresponding author Yolk-shell structured nanoparticles are of immense scientific and technological interests because of their unique architecture and myriad of applications. This review summarizes recent progresses in the use of yolk-shell structured nanoparticles as nanoreactors for various chemical reactions. A very brief overview of synthetic strategies is provided with emphasis on recent research progress in the last five years. Catalytic applications of these yolk-shell structured nanoreactors are then discussed by covering photocatalysis, methane reforming and electrochemical conversion. The state of the art research and perspective in future development are also highlighted. Graphical Abstract This review summarizes the general synthetic methods of yolk-shell nanoreactors and their recent catalytic performances in photocatalysis, carbon sources utilization and electrochemical energy conversion applications with an outlook of significant advantages using in more applications. Keywords Yolk-shell nanoreactors Energy conversion applications Photocatalysis Fuel cell Utilization of carbon sources 1 Introduction Long before the term “nanotechnology” appeared in the scientific world, the concept of micro- or nano-scale work was mentioned by Richard Feynman, on 29 December 1959 in his visionary lecture entitled “There's plenty of room at the bottom”. It took more than 20 years for scientists to realize the power behind this concept [1]. Our understanding of materials at the electronic and atomic scales relies heavily on the use of electron microscopes. The development of electron microscopy techniques in recent decades has finally enabled scientists to explore the mysteries of the nanoscale world. This has resulted in the “nanotechnology fever” that we are experiencing today. Nanotechnology has enabled many state-of-the-art inventions; one of them is the nanoreactor, an important and innovative creation for mimicking processes that occur in nature. The characteristics of natural processes, such as spontaneity and using the lowest-energy path, enable nature to operate in the smartest way; this has provided inspiration for many artificial materials and processes. Nanoreactors first appeared in the 1990s and became good potential candidates for catalytic applications [2]. Nanoreactors replicate the mechanisms of natural catalysts such as enzymes, bacteria, and cellular organelles in boosting reaction rates and production yields. Nanoreactors have several advantages over conventional ones, such as the ability to perform parallel chemical reactions, the elimination of undesirable products, and enhancement of the catalytic performance as a result of large surface:volume ratios. Researchers have therefore devoted much effort to understanding and investigating nanoreactors, especially the relationship between nanoarchitecture and catalytic performance. High energy demands, limited natural fossil fuel reserves, and the environmental consequences of energy generation are causing great concern globally; therefore much current scientific research is focused on sustainable energy generation. Average energy consumption is increasing because of the increasing global population and development of new technologies. Although the idea of using renewable energy to replace conventionally produced energy arose decades ago, low efficiency, high capital costs, and environmental consequences are challenges that have yet to be tackled. In recent years, catalytic energy conversion, which involves transformation of energy from one form to another or of wastes to valuable products, has become an attractive method for solving these problems. Energy-conversion techniques such as the use of carbon resources, solar energy conversion, and electrochemical fuel cells have the potential to resolve current difficulties. In terms of catalysis, nanoscale catalysts show enhanced catalytic activities and stabilities, which are essential characteristics for chemical reactions. Among the latest nanocatalysts for energy conversion, catalysts with advanced structures outperform traditional ones, and yolk-shell-structured catalysts give the best performances. Yolk-shell nanoparticles (YSNs) or “nanorattles” have attracted much attention because of their unique structures and enhanced performances in a wide range of applications, including catalysis, energy storage and conversion, environmental remediation, and nanomedicine [3–8]. In principle, a yolk-shell structure is an advanced development of a core-shell structure with a core@void@shell configuration (Fig. 1 (A)); such structures have high surface-area-to-volume ratios [3–8]. Recently, an extensive range of materials have been used to develop yolk-shell-structured nanoparticles to fulfil different needs in various applications. Generally, YSNs have a metal or metal oxide core that is encapsulated in inorganic or polymer shells of various shapes. Silica and carbon are the commonest shell materials because of their simple functionality, high biocompatibility, stability, and abundance [9–12]. Conducting polymers are also good shell materials because of their inertness and high conductivity and, most importantly, the possibility of tailoring their functional groups [13]. There are many significant variations that can be used to improve the performances and mechanical strengths of YSNs, such as changing the dimension, shell thickness, size uniformity, and nanoparticle shape. Various methods have been developed for synthesizing YSNs with tuneable parameters. These methods include selective etching, soft templating (or bottom-up methods), hard templating, ship-in-a-bottle, Ostwald ripening, galvanic replacement, and use of the Kirkendall effect. Catalysts should have certain characteristics, including long life, reusability, and high catalytic activity, selectivity, and stability, even in harsh environments [3,5,14–16]. All these requirements can be satisfied by yolk-shell structures because the YSN core, which is usually the active site for the catalytic reaction, is protected by a shell, and this prevents decay during catalytic reactions [4,6,17]. Moreover, in many cases, the shells of YSNs are porous and permeable, allowing sufficient diffusion of reactants in and out of the YSNs through the nanoporous channels, while protecting the metal core from aggregation and sintering [10,18,19]. The advantages of YSNs as nanoreactors can be summarized as: (1). the manipulable physical and chemical properties of the core and shell; (2). a movable core within the shell for cooperative catalysis; (3). a homogeneous reaction environment for heterogeneous catalysis because the voids act as a reservoir; (4). protection of the catalytic core nanoparticles and suppression of agglomeration; and (5). controllable diffusion rates [3–7,20–29]. Recently, the structures of YSNs have been intensively investigated and have been shown to greatly affect the catalytic performances. Furthermore, the successes achieved using YSNs have led to the rapid development of YSNs with increasingly complex architectures. These YSN architectures can be briefly categorized as: (1). a single core encapsulated in a shell (Fig. 1(A)); (2). multiple cores within a shell (Fig. 1(B) and (C)); (3). a single yolk encapsulated in a shell with multiple cores loaded on the shell surface (Fig. 1(D)); and (4). a single core within multiple shells (Fig. 1(E)) [3,5,24,30,31]. Among these, a single core within a single shell is the most basic YSN structure and can be achieved using numerous methods. The other YSN structures are generally derived from this basic structural concept. YSNs with multiple cores within a porous shell are favoured because the contact surface area provided by multicores is larger than that provided by a single core, reactant transfer into and out of the core is easier, the catalytic activities are higher, and multiple cores can be either of uniform (Fig. 1(B)) or different sizes (Fig. 1(C)) [32]. A single yolk within a capsule with multiple metal nanoparticles loaded on the shell surface is another category (Fig. 1(D)). The multiple metal nanoparticles serve as active sites that are different from those in the central yolk. This architecture enables more than one catalytic reaction to be performed and enhances the catalytic performance. A more advanced YSN structure consists of multiple shells with a single core (Fig. 1(E)). Multiple-shell nanoparticles have higher loading capacities and larger surface areas than single-shell nanoparticles [24]. This structure is generally used for multistep catalytic reactions, and all the materials involved in such nanoparticles must be highly selective to avoid unwanted by-products [24,33]. The best YSN structure cannot be defined because every chemical reaction has its own needs, and the optimum composition, shape, and structure can only be determined based on the YSN performance. Some examples of the use of YSNs as nanoreactors are as follows. Au@ZrO2 performed well in CO oxidation; Pd@SiO2 gave a very high production yield (99.5%) in Suzuki coupling reactions; Ni@SiO2 showed high catalytic activity in steam methane reforming; Au nanoparticles in a permeable carbon shell (Au@HCS) provided an efficient catalyst for the reduction of 4-nitrophenol by NaBH4 to 4-aminophenol [18,20,21,34]. Many of the published reviews focus on brief synopses of an extensive range of applications of YSNs, mostly silica-based YSNs. In contrast, in this review, we give a detailed summary of basic methods for YSN synthesis as well as recent advances in applications of YSNs as nanoreactors for energy conversion, with extensive coverage of yolk-shell compositions. Energy-conversion applications include methane reforming, photosynthesis, and electrocatalysis, which are popular and important energy-conversion techniques. Yolk-shell nanotechnology is a relatively new field; therefore many applications are not yet well developed. However, based on the rapid growth of interest in YSN applications, this review brings together the latest achievements in yolk-shell nanoreactors for catalysis, which will contribute greatly to our fundamental understanding and enable further developments. 2 Synthetic methods 2.1 General synthetic methods Yolk-shell nanoreactors have great potential for use in an extensive range of applications; therefore many synthetic methods for the preparation of various YSNs have been developed. Different methods are used to obtain specific compositions, architectures, and dimensions. All these approaches have common characteristics: e.g. they are easy to perform, effective, economically viable, and environmentally friendly. Selective etching, soft templating (bottom-up methods), hard templating, ship-in-a-bottle, Ostwald ripening, galvanic replacement, and the Kirkendall diffusion method (Fig. 2 ) are general methods for YSN synthesis [3,20]. In this section, we will briefly introduce each method and compare them. Selective etching uses chemicals or calcination to selectively remove either part of the shell or part of the core to create a void between the core and the shell, as shown in Fig. 2(A). There are three types of selective etching method: partial etching, surface-protected etching, and shell formation via chemical reactions [3]. The first method, partial etching, is one of the commonest fabrication routes because of its simplicity. Generally, a void is created by introducing a certain amount of an acidic or basic etchant (such as HF or NaOH) to partially etch out core or shell material. The core size and shell thickness can be tuned by adjusting the amount of etchant used. The second method, surface-protected etching, was first developed in 2007 [3]. Many researchers have stated that this strategy was a significant breakthrough in synthesizing porous silica nanoparticles. For sol-gel-derived silica nanoparticles, the dense silica layer makes it difficult for outside molecules to reach the inner active core; surface-protected etching overcomes this drawback [35]. In this method, the surfaces of metal oxide (such as silica) particles are coated with a protecting layer such as poly(vinylpyrrolidone) [35] and 3-thiocyanatopropyltriethoxysilane [36] and then an appropriate etchant is introduced to etch away part of the metal oxide from the interior and create a porous shell structure at the same time. This protecting layer enables the metal oxide nanoparticles to retain their original size, while creating voids [35]. In the third selective etching method, formation of the shell material through chemical reactions between core and shell materials is a spontaneous self-formation method. First, a core (pure metal or metal oxide) coated with a shell (pure metal or metal oxide) in a core-shell structure is prepared. Selective etching occurs when the shell reacts with the core to create a void between the core and shell. This synthetic method is not popular because it is only suitable for a limited number of nanoparticle compositions. Soft templating is a flexible, simple, and effective method, especially for the fabrication of functional YSNs with porous shells [20]. Soft templates are surfactants and polymers which have a hydrophilic head and hydrophobic chain [15]. When noble metal cores are evenly dispersed in a soft template mixture, the soft templates spontaneously attach to the cores to give well-defined assemblies under certain conditions to form core-shell nanoparticles. Hydrolysis and condensation of the core-shell nanoparticles remove the hydrophobic chains and form a space between the core and the shell. YSNs are obtained by calcination to produce a porous shell, as shown in Fig. 2(B) [15]. Hard templating is performed similarly to soft templating, but hard templates instead of soft templates spontaneously attach to the core material. The hard-templating method performs well in the synthesis of rigid YSNs with a movable core encapsulated in a hollow metal oxide shell [15]. A presynthesized metal core is coated with a hard template and then the desired shell material attaches to the hard template layer to form sandwich-structured core-shell nanoparticles. Finally, an etchant is introduced to remove the hard template and create a void between the shell and the core. Ship-in-a-bottle methods involve entrapment of molecules in nanocapsules; the method is the reverse of the usual YSN methods such as selective etching or soft templating [22]. In this synthesis route, a porous hollow nanoshell or nanocage is prepared first. Core precursors/molecules then enter the shell through channels in the porous shell. The core precursors/molecules then assemble to form single or multiple cores inside the hollow chamber, as shown in Fig. 2(C). Ostwald ripening is a physical recrystallization process and does not involve any chemical reaction. According to the International Union of Pure and Applied Chemistry, Ostwald ripening is “the growth of larger crystals from those of smaller sized ones which have a higher solubility” [3,37,38]. Recently, a new Ostwald ripening mechanism was developed. It can be described as an oriented attachment process in which small crystals attach to each other in the correct orientation to form bigger crystals [39]. This new method has been used in many research studies. The Ostwald ripening method is a thermodynamically favourable and spontaneous template-free strategy for creating yolk-shell or hollow nanoparticles [40]. Unstable and less dense smaller nanocrystals with higher solubilities have a strong tendency to dissolve and redeposit on the surface through a recrystallization process, which leaves a hollow interior space, as shown in Fig. 2(D) [40,41]. The formation of YSNs is driven by the differences among the chemical potentials of the crystallites [3,42]. Galvanic replacement, which is a sacrificial template strategy, is an efficient and easy route for synthesizing YSNs with controllable morphologies, particularly controlled compositions and porosities [3,43,44]. Many researchers consider galvanic replacement to be the most versatile synthetic method. The mechanism of galvanic replacement is based on a redox chemical reaction in which the metal from a metal salt is exchanged with metal ions from solution because of their different electrochemical potentials, as shown in Fig. 2(E). The less noble metal from the metal salt nanoparticle is the sacrificial template and acts as a reducing agent; it is concurrently replaced by a more noble metal ion from the solution to achieve electrochemical potential equilibrium [45,46]. Galvanic replacement involves deposition of a more noble metal, alloying, and dissolution of a less noble metal. Dissolution of the less noble metal forms pinholes, which result in voids, and these expand towards the centre [44]. Kirkendall diffusion is another ion-exchange method for nanoparticle synthesis after galvanic replacement and also a crystal growth synthetic method besides Ostwald ripening [37,42]. Kirkendall mass transfer occurs at the boundary of two different metals when an imbalance in their diffusion rates occurs, leaving vacancies at the material side with the faster diffusion rate [47]. In YSN synthesis based on Kirkendall diffusion, a core-shell nanoparticle consisting of two different core and shell materials (metal or alloy) is first prepared. Usually, the core material is the sacrificial template and has a faster diffusion rate than the shell material. Voids are formed at the core/shell interface via thermal activation (Fig. 2(F)) [44]. Further diffusion leads to formation of a hollow nanoparticle structure. 2.2 Comparison and analysis of general synthetic methods As discussed in Table 1 , selective etching is one of the most popular methods for YSN fabrication and is suitable for synthesizing an extensive range of materials, especially silica- and carbon-based nanoparticles. Among selective etching approaches, surface-protected strategies are commonly used for fabricating hollow and non-spherical structures. Fine tuning the amount of etchants and surfactants enables control of the nanoparticle size and shell thickness. However, this is one of the main drawbacks of this method because the appropriate amounts of etchants and surfactants need to be determined by trial and error. The low uniformity of the nanoparticle size is another weakness. Selective etching is therefore not recommended for producing high-quality YSNs with a narrow size distribution. These problems can be solved by using a combination of selective etching and other synthetic methods. Here, we briefly introduce some examples to elaborate the selective etching steps. One-component YSNs, namely silica@mesoporous silica (SiO2@m-SiO2), with dense silica nanospherical cores were first prepared using the Stöber method. A sol-gel method with pore-forming agents was used to coat the silica nanospheres with a mesoporous silica layer to form a core-shell structure [51]. The absence and presence of surfactants in the silica core and mesoporous silica shell resulted in structural differences; therefore etchants such as Na2CO3 or ammonia solution selectively etched part of the core material to form voids between the cores and shells. Surfactants were removed by high-temperature treatment [51]. Two-component YSNs, Au@m-SiO2, were prepared as follows. Au nanoparticles were prepared by traditional sodium citrate reduction and then the metal spheres were coated with a layer of dense silica via a sol-gel method. A mesoporous silica shell was deposited outside the dense silica layer to form a Au@SiO2@m-SiO2 core-shell structure [51]. A Au@m-SiO2 yolk-shell structure was created by introducing an etchant to etch away the dense silica layer. Three-component YSNs, Fe3O4@SiO2@TiO2, were synthesized using a surface-protected selective etching method. Each Fe3O4 sphere was coated with a layer of silica, followed by a layer of resorcinol-formaldehyde (RF) resin, and an outer layer of amorphous TiO2, using sol-gel processes, to form a FeO4@SiO2@RF@TiO2 core-shell structure [52]. The core-shell nanoparticles then underwent two-step annealing treatment. During the first calcination under nitrogen, a carbon layer was formed, which protected the precrystallized TiO2 shell from morphological changes. A yolk-shell structure was created by removing the carbon layer through calcination in air [52]. Soft-templating methods overcome many of the difficulties associated with selective etching, such as multiple steps and the need for accurate amount of etchants. Soft templates such as surfactants, polymers, and viruses can be easily removed via simple processes such as washing and calcination, without using chemicals, in contrast to hard templates. Soft templating is therefore the perfect option for one-pot synthetic strategies [15,29]. For example, the surfactant FC4 can be used as a soft template to encapsulate lipase in mesoporous silica YSNs or attach resins to cores to produce mesoporous carbon shells [49,53]. The difficulties associated with the soft-templating method are problems in controlling the product uniformity and choosing appropriate surfactants [3,15]. Hard-templating methods perform well in the fabrication of rigid YSNs. Silica is a common hard template and is widely used to create noble metal@metal oxide YSNs. Hard templating is easily controlled, and the results are easy to predict and highly reproducible [48]. However, this synthetic method is not as popular as the soft-templating method used in industry because the range of particle shapes that can be obtained is limited and it is expensive, which makes it unsuitable for large-scale production. For example, mesoporous carbon nanoparticle synthesis using mesoporous silica as a hard template is not a feasible option, and soft templating is used instead [49]. However, hard-templating methods can be used for small-scale preparation of nanoparticles such as metal cores encapsulated in TiO2 shells [54,55] and multishell Au/CeO2 hollow spheres [48]. Soft- and hard-templating methods have so far only been used for producing spherical nanoparticles. Ship-in-a-bottle methods can be used to create YSNs with a single core, multiple cores, or multiple shells and can be used for most types of material. As previously mentioned, the ship-in-a-bottle method is the reverse of other general synthetic approaches. It is therefore useful for producing highly inert materials which are difficult to dissolve and remove, such as zeolites [56]. The ship-in-a-bottle route is therefore an efficient, economical, and controllable method for synthesizing yolk-shell-nanostructured nanoparticles [22]; for example, the fabrication of yolk-shell HPW@hollow silicalite-1 has been reported [57]. Ostwald ripening is a template-free synthetic strategy and is a well-known method for generating nanoparticles with complex structures. This method is widely used to fabricate YSNs in inorganic oxide or sulfide semiconducting materials, e.g. TiO2-YSNs [58], Pt@CeO2 core-shell nanoparticles or YSNs [59], Au@SiO2 [39], and ZnS core-shell nanoparticles [60]. As mentioned above, Ostwald ripening is a spontaneous process, and although the void size can be controlled by varying the hydrothermal reaction time, precise tuning of the void size is still a major challenge in this fabrication process. Galvanic replacement is used for metal and metal oxide YSN fabrication. Au, Pt, and Pd salts are the most common noble metal compounds, and Ag, Ni, Al, and Cu are used as sacrificial templates in galvanic replacement processes [44,61]. The greatest advantage of this fabrication method is the ability to control the nanoparticle size and shape, and it is one of the most versatile synthetic methods for creating metal nanoparticles with complex structures. Morphological control greatly depends on the shapes and sizes of the template nanoparticles and the reaction conditions. In addition, chemicals such as HCl can be added to the solution to regulate the reaction kinetics to increase the morphological control [44]. However, this strategy also has drawbacks such as long reaction times and breakage of the nanostructure by dealloying, which tends to occur in the final stage of fabrication when the less noble metal redissolves from the shell material [44]. Kirkendall diffusion has attracted significant attention because of its frequent occurrence and the possibility of obtaining nanoparticles with unique compositions and complex structures [44]. Similarly to the galvanic replacement method, this synthetic method is suitable for metal and alloy materials, and the formation process is thermodynamically favourable [37]. The use of this method for fabricating YSNs is not yet well understood. It is believed that the yolk/core is initially connected to the shell by many filaments, as shown in Fig. 2(F), and the filaments break before the yolk/core completely disappears through diffusion. Because of the uncertainty and uncontrollability of the Kirkendall diffusion process, tuning the YSN morphology is a challenge. The use of YSNs is growing rapidly, and there is increasing demand for yolk-shell nanoreactors with more complex structures which can be precisely tuned. Much research is therefore being devoted to investigating new and more advanced methods for YSN synthesis. Here, we briefly introduce one newly developed synthetic route that has good potential for synthesizing multicomponent core-shell or yolk-shell colloidal hybrid nanoparticles. The seed-mediated growth method was first used to synthesize noble metal nanocrystals; it is based on the galvanic replacement and selective etching methods. The seed, i.e. the less noble metal salt, serves as a sacrificial template, which is replaced by ions of a more noble metal in the introduced solution. Seed-mediated growth, which is similar to galvanic replacement, takes advantage of the fact that the activation energy of the metal reduction reaction between a less noble metal and more noble metal is lower than that of nucleation of the seeds themselves [62]. In addition, because the spontaneous nucleation of seeds is less favourable, natural and uneven crystal growth can be successfully suppressed; this is also the reason for the controllability of the nanoparticle shape and size [62]. Recently, this synthetic route has been successfully used to fabricate noble metal YSNs such as Ag@h-SiO2 YSNs [63], and the research focus has moved to synthesizing non-noble metal cores encapsulated in porous silica shells, e.g. Ni@SiO2 YSNs [64]. Ni, which is one of the most effective catalysts, gives good catalytic performances in many significant reactions. The growth of non-noble metals is much more difficult to restrict than is seed growth of noble metals. This problem can be overcome by using a more powerful seed to restrict Ni growth within the porous shell. As shown in Fig. 3 , Pd was used as an effective catalyst for decomposition of Ni2+-hydrazine complex [64]. Pd2+ ions were introduced onto Fe3O4 together with Au to form a stronger seed. After creation of the Au and Pd seed, Ni2+-(N2H4) n was added as a reducing agent and Au and Pd were replaced by Ni to form Ni@SiO2 YSNs. 3 Advanced YSNs for energy-conversion applications Rapid advances in nanotechnology have led the chemical industry to a new peak. There have been enormous changes and improvements in the quality and quantity of chemical production compared with two decades ago. People therefore ask “What is the next move?” Of course, the next move will always be process optimization. Chemical processes involving renewable energy or low energy consumption, which have the potential to solve resource or environmental problems, always catch the world's attention. Catalysis of chemical reactions has become a key element in research. The use of YSNs as nanoreactors for catalytic reactions has attracted much interest and become one of the hottest research topics. YSNs definitely have greater potential for use in long-lasting and low-cost catalytic processes than metal nanoparticles and core-shell nanoparticles, which also overcome many of the severe drawbacks of traditional catalysts. First, functionalization of both the core and the shell of YSNs can be achieved by attaching functional groups to the core and shell or by fabricating the core and shell from appropriate materials. Because of the differences between the physical and chemical properties of the yolk and shell, multiple catalytic reactions can be performed simultaneously. Second, the encapsulated core or cores with active sites can move freely inside the shell, which allows reactants to reach the active sites more easily, and this improves the catalytic activity. Next, the voids between the yolk and shell provide a homogeneous reaction environment for reactants, which minimizes environmental effects in catalytic reactions. It is well known that homogeneous catalysis gives better results than heterogeneous catalysis [65]. YSNs with various shapes, sizes, and structures can be easily produced using the numerous excellent synthetic methods described in the synthesis section. The shapes, sizes, and structures are important factors in the catalytic performance; this is why a large amount of research has been devoted to the development of synthetic methods. There is no “one size fits all” case in catalysis; therefore the fabrication of catalysts with the most appropriate features for achieving the best performances is crucial. Finally, the most important function of yolk-shell nanostructures is to avoid aggregation and deactivation of the active cores. Dispersed nano active cores, especially pure metal cores, tend to aggregate and lose their catalytic activity during exposure to chemicals, products, or by-products under experimental conditions. The YSN shell therefore acts as a protecting layer that efficiently prevents damage and allows transport of reactants and products from active sites. Because of the many advantages of YSNs as catalysts for chemical reactions, any research conducted on this topic could lead to a scientific breakthrough. In the following subsections, we summarize a few important and advanced yolk-shell catalyst applications such as methane reforming, photocatalysis, and electrocatalysis. These reactions play significant roles in the current chemical industry and contribute greatly to green energy and chemical production. 3.1 Use of carbon sources — methane reforming Clean and efficient energy generation is much needed because of our current environmental situation. Conversion of one of the major greenhouse gases, namely methane, to clean syngas/H2 gas is a significant development in sustainable energy generation. H2 gas combustion is another important method for producing energy, and H2 is also an important chemical in petroleum refining. A number of H2 production processes are available, such as steam reforming of methane (SRM), CO2 (dry) reforming of methane (DRM), partial oxidation of methane (POM), bi-reforming of methane, autothermal reforming of methane, and tri-reforming of methane [66]. Among these, SRM, DRM, and POM are more commonly used. H2 production from natural sources is a good starting point for decreasing or even eliminating the use of traditional fuels such as diesel and coke. Ni has always been the most popular metal catalyst for methane reforming reactions. Rh, Ru, and Pt are also effective catalysts, but they are rare and expensive [67–69]. Because of their availability, ease of preparation, and low cost, Ni and Co are the favoured catalysts in the methane reforming industry [67,69–71]. Ni nanoparticles are air sensitive and are deactivated during methane reforming because of carbon deposition on the catalyst surface over a period of time [66,69,70,72–74]. Core-shell and yolk-shell-nanostructured catalysts have therefore been used in methane reforming reactions to prevent carbon deposition on metal nanoparticles and agglomeration. It is believed that the protecting shell efficiently blocks carbon deposition on the edges and corners of active metal nanoparticles [75]. Here, we briefly introduce some core-shell-structured catalysts, concentrating on YSNs, which have been used in SRM, DRM, and POM H2 production processes. SRM is the most important and well-developed H2 production method, and it currently accounts for the largest proportion of total H2 gas production [66,76]. Syngas (a mixture of CO and H2 gas) is the product of SRM [Eq. 1(1)], and the water-gas shift reaction [Eq. 1(2)] increases the yield of H2 gas in the final product. SRM is a highly endothermic chemical process, which requires a large energy input for operation between 675 and 1000 °C and high-pressure conditions. This environment makes many materials unsuitable as supports for active metal catalysts [66,70,76]. Moreover, to prevent carbon deposition, which deactivates metal catalysts, the water/methane ratio of the input reactants should be high (over 1:1); this is also required for the water-gas shift reaction [66,70,74]. Eq. 1: (1) SRM reaction equation; (2) water-gas shift reaction equation CH 4 + H 2 O → CO + 3 H 2 △ H 298 ° = + 206 kJ / mol CO + H 2 O → CO 2 + H 2 △ H 298 ° = - 41 kJ / mol Core-shell nanoparticles were first used in the SRM before YSNs were used. Nicore@SiO2 (11 wt% Ni), which was synthesized using a deposition-precipitation method, achieved an approximate methane conversion of 85% at 750 °C, with an inlet water/methane ratio of 3:1, in the first 4 h [66]. Core-shell nanoparticles consisting of a Ni core and Al2O3 shell, i.e. Nicore@Al2O3 (10 wt% Ni), were prepared under multibubble sonoluminescence conditions, and gave 97% methane conversion at 750 °C at a water/methane ratio of 2 for reaction times up to 5 h [74]. In further modifications of the catalysts, yolk-shell-structured Ni@SiO2 catalysts were prepared by directly coating a Ni core with a silica shell, followed by selective etching of the core, and porous shell formation by calcination [72]. SRM was performed using Ni@SiO2 (89 wt% Ni) as a catalyst in a fixed-bed continuous-flow reactor at atmospheric pressure and 700 °C. A high water/methane ratio was used in the inlet to minimize the possibility of carbon deposition. The methane conversion and H2 concentration were high, above 90% and 70%, respectively, for a reaction period up to 4 h. The experimental results were close to the theoretical values, and the catalytic activity of the recycled catalyst was almost the same as that of the fresh catalyst [72]. Steam reforming experiments were also performed using yolk-shell catalysts with various metal weight percentages under the same experimental conditions. The metal weight percentage in the catalyst did not greatly affect the methane conversion or H2 concentration. For example, with 20 wt% Ni in the catalyst, the methane conversion and H2 concentration were 85% and 70%, respectively [72]. A Ni@ZrO2 yolk-shell catalyst was synthesized using a double-template emulsion method by coating silica and ZrO2 shells sequentially on Ni nanoparticles, followed by silica etching to form a yolk-shell structure [70]. Very small Ni cores were synthesized using a reverse micelle approach, which is believed to facilitate particle dispersion, increase the number of active catalytic sites, and prevent coke formation [70]. The catalytic ability of Ni@ZrO2 (5.08% Ni) yolk-shell particles was tested using a fixed-bed quartz reactor at 750 °C, atmospheric pressure, and a steam/methane input ratio of 2.5. The results showed high catalytic activity, giving 93% methane conversion, and the activity was retained for 150 h, as shown in Fig. 4 . The catalytic performances of the core-shell and yolk-shell nanoreactors mentioned above in SRM were compared. The results (Table 2 ) show that Ni@ZrO2 is the best catalyst because it gives good methane conversion, has a low metal weight percentage, good stability and recyclability, and is easily synthesized. DRM is an important process because it converts two major greenhouse gases (methane and CO2) to a useful product, i.e. syngas, as shown in Eq. 2. Similar to SRM, DRM is also a highly endothermic reaction, which requires a high operating temperature. Initially, DRM was not investigated as intensively as SRM because of its low H2/CO ratio (1/1); a low H2 gas ratio in the final product is undesirable and coke formation becomes problematic in the absence of steam [77]. However, this product ratio is appropriate for producing synthetic fuel via Fischer–Tropsch synthesis; therefore DRM has recently become a popular research topic [69,77,78]. Eq. 2: DRM reaction equation CH 4 + CO 2 → 2 CO + 2 H 2 △ H 298 ° = + 247 kJ / mol Nicore@Al2O3 core-shell nanoparticles also gave excellent performances in DRM, giving 92% methane conversion and 95% CO2 conversion at 800 °C for up to 150 h, with a CH4/CO2 input ratio of 1. Nicore@MgO-Al2O3 core-shell nanoparticles gave similar catalytic result under the same test conditions [79]. LaNiO3core@SiO2 (10 wt%) core-shell nanoparticles were also tested in DRM in a coaxial dielectric barrier discharge plasma reactor under ambient conditions. The catalytic performance was better than that of traditional Nicore@SiO2, with CH4 and CO2 conversions of 88% and 78%, respectively [78]. As well as conventional spherical nanoparticles, Ni-Mg phyllosilicate nanotubes@silica (Ni-Mg PSNTS@SiO2) core-shell nanoreactors were recently synthesized, and gave 85% CH4 conversion and 89% CO2 conversion at 750 °C; the nanoparticles were stable for 72 h [71]. Yolk-shell catalysts with a yolk-satellite-shell structure (Fig. 1(C)), i.e. Ni-yolk@Ni@SiO2 nanoparticles, have been synthesized by selective etching via calcination and reduction [80]. These nanoparticles consisting of a Ni yolk and satellite encapsulated within a silica shell had high stabilities and catalytic activities in CO2 (dry) reforming of methane; the performances of Ni-yolk@Ni@SiO2 were highly dependent on the silica shell thickness [80]. When the silica shell thickness was 11.2 nm or more, the core-shell Ni@SiO2 structure was converted to a yolk-satellite-shell nanocomposite, i.e. Ni-yolk@Ni@SiO2, by calcination at 800 °C for 2 h [80]. A series of experiments were performed using Ni-yolk@Ni@SiO2 nanoreactors with various shell thicknesses as catalysts in DRM. The results show that the nanoreactor catalytic activity, stability, and carbon resistance increased with increasing shell thickness, and that small Ni satellites around the Ni core improved the catalytic activity. At the optimum shell thickness, i.e. 11.2 nm, Ni-yolk@Ni@SiO2 gave 90% CH4 conversion and 95% CO2 conversion for up to 90 h without any carbon deposition. Ni@SiO2 yolk-shell nanoreactors, which were fabricated using the synthetic method reported by Song and his colleagues [72] (summarized in the discussion of SRM), were also tested in DRM. The DRM catalytic activity of Ni@SiO2 YSNs of core size approximately 46.4 nm was low compared with their high activity in SRM. Because of the reverse waster-gas shift reaction, the CH4 conversion (43.9%) was lower than the CO2 conversion (57.3%) at 700 °C; it is suggested that water supplied by the reaction helps to stabilize the catalyst and prevent carbon deposition [81]. However, despite the catalytic activity, Ni@SiO2 showed excellent durability up to 590 h at both 700 and 800 °C and the conversions of CH4 and CO2 increased with increasing operating temperature because the DRM is endothermic, but the gas hourly space velocity of the reactants was unchanged [81]. Bimetallic mesoporous shell NiCe@m-SiO2 yolk-shell catalysts synthesized by encapsulating CeO2-modified Ni nanoparticles (less than 10 wt% Ce), formed in situ, in mesoporous silica shells significantly improved the dispersion of Ni nanoparticles, catalytic performance, and suppression of coke formation [69]. DRM was performed in a fixed-bed reactor with a quartz tube and a reactant input ratio of 1:1. The CH4 conversion reached 97.6% at 800 °C and 95.2% at 750 °C, and the conversion was unchanged after 40 h, as shown in Fig. 5 [69]. In DRM, CH4 conversion is lower than CO2 conversion because of the reverse water-gas shift reaction, and the catalytic performance increases with increasing reaction temperature. Table 2 summarizes the performances of the core-shell and yolk-shell catalysts used in DRM. Current research on DRM is progressing rapidly, and it is believed that more efficient and well-designed nanoreactors will be available in the near future. POM, also called oxy-methane reforming, mainly produces syngas (H2 + CO). POM has some advantages over traditional SRM and DRM. POM produces syngas, which is desirable in green energy production, with a H2/CO ratio of 2, and the reaction (CH4 + 1/2CO2 → CO + 2H2: ΔH 298 o = −37 kJ/mol) is slightly exothermic and therefore needs less energy. The operating costs for POM are therefore lower than those for SRM and DRM [73,82]. The first catalysts developed for POM, consisting of Ni metal on an Al2O3 support, gave very high methane conversions and syngas selectivities, but severe sintering and aggregation of the catalysts occurred during the reaction [73]. Nanoparticles consisting of a Ni core encapsulated in an Al2O3 shell were synthesized. Nicore@Al2O3 (10 wt%) core-shell nanoparticles gave an excellent catalytic performance in POM, with a methane conversion of 96% [83]. Nanoparticles consisting of a Ni core encapsulated in a porous silica shell were also tested in POM. This nanocomposite has a high activity and long lifetime, especially at high temperatures. A Ni-350@meso-SiO2 core-shell catalyst prepared using a modified Stöber method gave a maximum methane conversion of approximately 93% with 92% CO selectivity and 87% H2 selectivity [73]. The catalytic performance was tested in a continuous-flow fixed-bed reactor at atmospheric pressure and 750 °C for 500 min. The results show that the selectivity for H2 was only slightly lower than that for CO. The catalytic activity was highly dependent on the size of the Ni core and an increase in the core size resulted in a significant decrease in methane conversion and selectivities for CO and H2 [73]. The same research team doped Ni@SiO2 core-shell nanoreactors with various metals. The results show that La-doped Ni@SiO2 particles (0.1La-Ni@SiO2) gave the best performance in terms of catalytic ability and durability by decreasing carbon deposition [84]. Recently, Ni/ZrO2@SiO2 (24.8 wt% Ni, Ni/Zr = 1) core-shell nanoparticles synthesized using a modified Stöber method were tested in POM. A methane conversion of 99% was achieved at 750 °C [75]. To the best of our knowledge, no yolk-shell-structured catalysts have been used in in POM. The catalytic performances of all the core-shell catalysts discussed are listed in Table 2. 3.2 Photocatalysis Photocatalysis can be defined as the acceleration of chemical reactions by light energy. It has been widely researched for decades because it is a green process. Photocatalytic reactions can be classified as up-hill or down-hill; up-hill reactions convert light to chemical energy, e.g. photosynthesis in plants, whereas down-hill reactions convert reactants to products via light absorption [85]. Artificial up-hill reactions are currently of great interest. Photocatalysis is attractive and important in many applications such as organic pollutant degradation, selective organic transformations, killing cancer cells, water splitting, reduction of CO2, and biomass conversion [59,86]. Among these applications, research is currently focused on water splitting, reduction of CO2, and organic pollutant degradation. As mentioned in the section on methane reforming, there is a great demand for sustainable energy production. Photocatalysis can make an important contribution to green energy generation; it has the advantages of eliminating harsh reaction conditions and increasing reaction rates via visible-light absorption [59,87]. Abundant data are available because photocatalysis has been extensively researched for many decades. Here, we summarize current progress in research on core-shell materials and YSNs as catalysts for water splitting, reduction of CO2, and organic pollutant degradation; the catalytic performances of all the nanoreactors discussed are listed in Table 3 . Water splitting, which converts water to clean fuels, i.e. H2 and O2, using solar energy, is the most attractive photocatalytic reaction. Traditionally, H2 has been obtained from seawater by chemical electrolysis. This method is not widely used for large-scale production of H2 because of the very high operating costs [88]. The use of photocatalysis could overcome this problem and enable the development of low-cost and efficient methods for H2 gas generation. In photocatalytic water splitting, electrons in conduction bands and holes in valence bands split water molecules into oxygen and hydrogen; the electrons and holes are created by ionization of photocatalysts through exposure to light (Fig. 6 (A)) [89]. Since the 1970s, when Fujishima and Honda first reported the use of TiO2 as a catalyst for water splitting, much research has been conducted on developing appropriate photocatalytic systems for producing chemical energy through water splitting [85,90,91]. Many materials such as noble metals, metal oxide semiconductors, nitrides, oxynitrides, and oxysulfides have been investigated as potential catalysts [92,93]. Among all the tested photocatalysts, semiconductors are the most suitable because they have appropriate bandgaps, low electrical resistance, are cheap, and can be produced on a large scale [93]. A semiconductor of small particle size was first used for water splitting, but the particles recombined via the charges created by light absorption, causing a decrease in the surface area and efficiency [94]. Photocatalytic water splitting consists of two half reactions: water oxidation to O2 and water reduction to H2 [92,95]; specific catalysts are needed for each half reaction. Advanced-structured and composite nanoreactors have been designed, synthesized, and tested for water splitting. Noble metal and transition metal oxides are often used as cocatalysts in nanoreactors with advanced structures [92,96]. These advanced nanoreactors increase the conversion rate and prevent recombination of the products (H2 and O2) to water molecules. The performances of TiO2 and ZnO are better than those of other semiconductors [88,90,93]. TiO2 can only be excited by UV light because of high recombination of photogenerated electron-hole pairs and a wide band gap; this results in inefficient use of visible light. However, this drawback can be overcome by either encapsulating a noble metal core within a TiO2 shell or heavy doping with carbon and nitrogen [58,59,89,93,97]. The production of H2 gas by water splitting using a semiconductor as a heterogeneous photocatalyst is a more attractive technique for H2 gas generation than methods such as partial oxidation, gasification, and steam reforming [87,88]. Core-shell-nanostructured photocatalysts, e.g. NiFe2O4@TiO2 [89], SiO2core@Ta3N5 with Pt nanoparticles loaded on the inner shell and IrO2 or CoO x loaded on the outer shell [92], and SrTiO3core:La/Rh core-shell particles [95], have high photocatalytic activities in water splitting. Yolk-shell-nanostructured photocatalysts have rarely been reported because this is a relatively new concept. To the best of our knowledge, only a few YSNs have been synthesized and tested in photocatalytic water splitting. Nanoparticles consisting of a noble metal core/yolk in a semiconductor shell have distinct advantages. (1). A noble metal core/yolk encapsulated in a semiconductor shell transfers the charges created during light absorption, which helps to prevent aggregation. (2). A noble metal has a very low Fermi energy level, which can extend the catalyst life and improve the performance. (3). Reduction and oxidation of water occur on the core/yolk and shell, respectively, and this minimizes the possibility of recombination, as shown in Fig. 6(A) [59,94]. Multishelled hollow nanoreactors, h-(Pt-TiO2)/CdS, consisting of hollow TiO2 and CdS porous double shells with fine Pt nanoparticles deposited on the inner surface of the TiO2 shell, were synthesized using an in situ growth and deposition method. Carboxyl-modified poly(methyl methacrylate) nanospheres were used as templates, and after deposition of Pt, TiO2, and CdS, the templates were removed by calcination in air in order to create a hollow structure [87]. h-(Pt-TiO2)/CdS nanospheres of size approximately 318 nm with shells of thickness 25 nm and Pt nanoparticles of diameter 5 nm were tested in water splitting. They showed an excellent catalytic activity of 296 μmol/h/10 mg and apparent quantum efficiency (QE) of 14.5% at a wavelength of 420 nm [87]. Analysis suggests that the specific morphology and the composites contributed to the outstanding catalytic activity. The use of CdS as the outer shell enhanced the reception of visible light and accurately directed photogenerated carriers to the inner TiO2 shell (active sites); the Pt nanoparticles in the inner layer increased the reaction rate and the porous and hollow structures enabled sufficient transfer of molecules [87]. A composite consisting of Ni metal and ZnO (7–23 nm) enclosed in porous carbon shells, (Ni-ZnO)@C, is an efficient photocatalyst for generating H2 gas. Ni and ZnO are the main active sites. This yolk-shell structure was formed by partial etching of Ni and ZnO from (Ni-ZnO)@C core-shell nanoparticles [88]. The porous carbon shell allows reactants to diffuse freely through the shell. (Ni-ZnO)@C with a Ni/Zn molar ratio of 1 gave the best results, and H2 gas production from seawater splitting using (Ni-ZnO)@C was approximately 20.8 times higher than that using bare TiO2 nanoparticles [88]. Wang et al. [98] recently used graphene in a yolk-shell nanoreactor composite for photocatalytic applications. They reported that graphene hybridized with TiO2 suppressed recombination of electron-hole pairs and enhanced light absorption. A nanoreactor consisting of Au nanoparticles encapsulated in a hybrid shell consisting of reduced graphene oxide and TiO2 (Au@r-GO/TiO2) was prepared using a sol-gel coating process, calcination, and selective template etching; the nanoreactor showed high water splitting photocatalytic activity, with a H2 production rate of 462 μmol h−1g−1 and an apparent QE of 2.5%. Tests showed that the catalyst had high stability, with no obvious loss of activity after six cycles. Some yolk-shell microreactors also gave excellent catalytic performances in water splitting for H2 production, such as yolk-shell TiN microparticles [99], yolk-shell MoS2 microparticles [100], and KNb3O8 yolk-shell microspheres [101]. Reduction of CO2 through light absorption, which mimics natural photosynthesis, converts CO2 and H2O to hydrocarbon fuels such as methane, methanol, formaldehyde, ethanol, and formic acid, and O2 [102–107]. The reduction of CO2, which is abundant, is an attractive sustainable energy production method and also helps to reduce this greenhouse gas in the environment. CO2 is an extremely stable molecule and is difficult to activate for chemical reactions. In traditional methods, high temperatures and electrical voltages are needed to break CO2 molecules, and this is unsustainable and costly [103]. In 1979, selective reduction of CO2 was first achieved using a photocatalytic method to produce hydrocarbon fuel [102]. So far, a number of semiconductors have been identified as effective photocatalysts for CO2 reduction in the liquid or gas phase, e.g. TiO2, CdS, ZnGa2O4, and ZnGe2O4, [102,104,101–109]. TiO2 is a good semiconductor photocatalyst, but it has low photocatalytic activity under UV irradiation for selective reduction of CO2. Cocatalysts are therefore needed to obtain better catalytic performances. Noble or coinage metals such as Au, Ag, Pt, Pd, Rh, and Cu are suitable cocatalyst materials [108,110]. The mechanism of photocatalytic reduction involves the formation of H atoms, C–O bond breaking, and C–H and O–H bond formation under UV irradiation with a catalyst, in the presence of H2O and CO2 (as shown in Fig. 7 (A)) [102,104]. A combination of mesoporous Au@TiO2 YSNs and an induced electric field provides an effective catalytic system for reduction of CO2. Such plasmonic metal/semiconductor hybrid nanoparticles have recently been shown to be good potential candidates for use in many photocatalytic applications. Au@TiO2 nanoparticles of size 200–250 nm with an average shell thickness of around 50 nm and a Au core of diameter 45 nm were synthesized using a hydrolysis-deposition method. First, carbon was coated on the Au nanoparticle surface before deposition of a TiO2 layer; the carbon layer acted as a sacrificial template and was removed to create voids between the core and the shell [107]. Catalytic tests indicated that Au@TiO2 YSNs gave a very high photoreduction yield of CO2, with a CH4 production rate of 2.52 μmol h−1g−1, which is about 3.6 times higher than that achieved using the commercial catalyst P25, and generation of the more valuable high-grade carbon compound C2H6 at a rate of 1.67 μmol h−1g−1 under UV-vis-light irradiation [107]. Analysis suggests that plasmonic metal/semiconductor hybrid nanoreactors combined with an applied electric field can promote the generation and subsequent separation of electron-hole pairs at catalytic active sites, leading to an improved catalytic performance and production of high-grade carbon species. Titanate nanosheet-assembled yolk-shell microspheres have also been synthesized and tested for photocatalytic CO2 reduction; they showed excellent catalytic activity [111]. Recently, a yolk-shell catalyst consisting of carbon nanospheres encapsulated in hollow TiO2 shells (C@TiO2) was synthesized by coating carbon with a uniform layer of TiO2 by hydrolysis and condensation, followed by calcination at 450 °C; the catalyst nanoparticle diameter was approximately 420 nm and the size of the encapsulated yolk was 350 nm [112]. Photocatalytic tests were performed in a custom-made Pyrex glass reactor at room temperature and atmospheric pressure under simulated solar light (λ > 200). A C@TiO2 sample calcined for 120 min had the best catalytic activity in production of both methane and methanol. The methane production rate achieved with C@TiO2 (4.22 μmol h−1g−1) was about twice that obtained using the commercial catalyst P25 [112]. This shows that carbon played a crucial role in boosting the photocatalytic performance in CO2 reduction. Not many yolk-shell-nanostructured photocatalysts have been tested in the photocatalytic reduction of CO2. Here, we introduce a few core-shell nanoreactors. Ni@NiO/InTaO4-N core-shell nanoparticles were synthesized and showed enhanced photocatalytic activity. The production yield achieved from CO2 reduction was higher than those obtained using InTaO4-N and as-prepared InTaO4 [59,109]. The Ni metal core was encapsulated in two shell layers, consisting of NiO and InTaO4-N. In this photocatalyst, Ni@NiO acts as a cocatalyst, which improves the photocatalytic performance of InTaO4. Cu/Pt/TiO2 core-shell nanoparticles were also synthesized and tested. This nanoparticle composite gave good selectivity for CO2 reduction, i.e. 85%, compared with those of Pt@TiO2 and Cu@TiO2, which gave selectivities of 41% and 80%, respectively [108]. Ag-doped multiwalled carbon nanotubes@TiO2 (MWCNT@TiO2) core-shell nanoparticles were fabricated for reduction of CO2 to methane and ethylene. This nanoreactor gave the best catalytic performance at a Ag weight percentage of 2% [110]. It is believed that more yolk-shell-nanostructured photocatalysts for reduction of CO2 will be developed. The advantages of yolk-shell structures will lead to better catalytic performances. Pollutant degradation, another application of photocatalysis, uses visible light and appropriate photocatalysts to effectively remove organic contaminants from wastewater. Semiconductors are again efficient photocatalysts, and combinations of the most popular semiconductor, TiO2, and cocatalysts have been widely used. Recently, a number of yolk-shell photocatalysts for photocatalytic degradation of pollutants have been reported, some of which are micro-sized nanoparticles, and are briefly introduced here. ZnO hollow spheres with a double-yolk structure, formed by bubble-assisted Ostwald ripening, gave more than 90% degradation of rhodamine B (RhB) [113]. Ti3+ self-doped titanium oxide YSNs aggregated into micro-sized spheres to form TiO2 powders, which gave RhB degradation percentages of 80.3%, 98.2%, and 99.3% in 5, 20, and 30 min, respectively [58]. Ag-loaded nitrogen-doped yolk-shell mesoporous TiO2 hollow microspheres were also investigated and gave good catalytic performances in the photodegradation of both RhB and the antibiotic ciprofloxacin [114]. Yolk-shell-structured Bi4–2x Mo x O6 (x ≤ 1) microspheres were synthesized; Bi2.38Mo0.81O6 synthesized via a solvothermal method had the best catalytic activity, giving 99% degradation of RhB and 72% degradation of methyl orange after 120 min [115]. Yolk-shell Au@CeO2 microspheres showed good catalytic activity and gave 95% decolouration of methylene blue at room temperature in 40 min [116]. A yolk-shell-structured nano-sized catalyst, namely the Au@r-GO/TiO2 yolk-shell nanoreactor which was also used for water splitting, was investigated for photocatalytic decomposition of RhB. The nanoreactor gave 99.6% RhB degradation in 50 min, with a QE of 3.4%, under simulated daylight; this is much higher than the degradation achieved using the commercial catalyst P25 under the same conditions [98]. This nanoreactor had good catalytic stability, although the catalytic activity declined slightly after six runs. The good catalytic performance is attributed to the graphene-hybridized TiO2 shell, as previously discussed. Fe3O4@C@TiO2 YSNs, which consist of a Fe3O4 core coated with a carbon layer and a Fe3O4@C yolk encapsulated in a mesoporous TiO2 shell, were also tested in pollutant degradation. These YSNs were synthesized by self-assembly of poly(acrylic acid) (PAA), which was used as a template, on suspended Fe2O3 nanoparticles to form Fe2O3@PAA core-shell nanoparticles. The addition of tetrabutyl titanate resulted in aggregation of small amorphous TiO2 nanoparticles on the PAA layer. A porous TiO2 shell was formed through formation of anatase nanocrystals from amorphous particles by annealing. Finally, heat treatment of the Fe2O3@PAA@TiO2 core-shell nanoparticles reduced the PAA to carbon and Fe2O3 to Fe3O4, with simultaneous void formation between carbon and TiO2 [117]. This novel method gave an excellent multifunctional photocatalyst with a large surface area and magnetic properties. Experimental results for RhB photodegradation showed that Fe3O4@C@TiO2 YSNs had excellent catalytic activity during five cycles [117]. The magnetic cores enabled easy recovery of the catalyst using an external magnetic field. Joo et al. [118] reported fabrication of C@TiO2 yolk-shell-nanostructured particles with a tuneable size, crystallinity, and phase for pollutant degradation. C@TiO2 was prepared using a templating method with silica-protected calcination and selective etching, in which the silica layer acted as a protecting layer and helped to maintain the structural integrity of the TiO2 shells during high-temperature calcination. Post-treatments, namely acid treatment and recalcination, were performed to improve the crystallinity of the TiO2 shells, which was a significant factor in the photocatalytic performance. The catalytic activity in RhB degradation of a sample post-treated and calcined at 750 °C was better than those of samples without post-treatments, with post-treatments but calcined at different temperatures, and commercial P25 TiO2 [118]. It is believed that not only the crystallinity degree of TiO2 but also the carbon material used in the nanoreactor had positive effects on photocatalysis. Recently, a nanoreactor consisting of a magnetic material, a noble metal, and a semiconductor was synthesized and used in photocatalytic degradation of pollutants. This nanoreactor has several distinct advantages in terms of its composition; the combination of a noble metal/plasmonic metal with a semiconductor results in local surface plasmon resonance adsorption, which enhances the catalytic activity, and the magnetic material improves the recyclability by enabling separation of the nanoreactor using an external magnetic field. A sea-urchin-like Fe3O4@TiO2@Ag yolk-shell nanoreactor with Ag (4 nm) nanoparticles loaded on both the TiO2 surface and inside the cavities, with Fe3O4 as the core and nanofiber TiO2/Fe3O4/Ag nano-heterojunctions as the shell, was prepared using a modified hydrothermal method and photochemical reduction (Fig. 8 ). The nanoreactor showed excellent photocatalytic activity in ampicillin (AMP) degradation under both UV and visible-light irradiation [119]. The degradation rates reached 98.7% under UV irradiation and 91.5% under visible-light irradiation; these results show that the catalytic activity of this nanoreactor is better than those of Fe3O4@TiO2 and Fe3O4 particles [119]. In terms of recyclability, such yolk-shell nanoreactors can be easily separated by magnetic force and no change in the photocatalytic activity was observed after five cycles. Moreover, this facile synthetic method enables precise and easy control of the cavity size, shell thickness, and particle size. 3.3 Electrocatalysis Fuel cells are energy-conversion devices with low emissions of environmentally hazardous compounds. Fuel cells convert chemical energy to electrical energy via a series of reduction and oxidation reactions at the anode, i.e. the hydrogen evolution/oxidation reaction or methanol oxidation reaction (MOR), and cathode, i.e. oxygen reduction reaction (ORR) or oxygen evolution reaction (OER) [120,121]. Proton exchange membrane fuel cells (PEMFCs) (Eq. 3) and direct methanol fuel cells (DMFCs) (Eq. 4) are the two main types of fuel cell. Fuel cells are important for green energy generation and can be used as portable power sources, e.g. in portable electronic devices or batteries. Fuel cell applications have been extensively researched; however, the sluggish kinetics of the ORR at the cathode is still a challenge [122–124]. In recent decades, researchers have investigated electrode materials which enhance the performances of fuel cells. The electrocatalyst is the critical factor in the fuel cell performance [125]. Pt is the most commonly used electrocatalyst for fuel cells, but a pure Pt electrocatalyst suffers from CO poisoning because of its low CO tolerance, which leads to insufficient catalytic activity, high costs, and low durability. Many alternative metals, metal-free materials, and catalysts with various structures, such as non-precious metals, nitrogen-doped carbons, Pt-based alloys, and core–shell or yolk-shell catalysts, have been therefore been intensively investigated [120–124,126–131]. In terms of current commercial electrocatalysts, Pt loaded on a carbon support (Pt/C) gives excellent catalytic performances [127]. A good catalyst can improve the fuel cell performance in many ways, e.g. in terms of durability, stability, and catalytic activity. The ideal electrocatalyst should therefore have the following properties: (1). a high surface area; (2). high conductivity; (3). high porosity and pore accessibility; and (4). good electrochemical stability, even under harsh reaction conditions. Eq. 3: PEMFC reactions Cathode 1/2O2 + 2H+ + 2e− → H2O Anode H2 → 2H+ + 2e− Overall 1/2O2 + H2 → H2O Eq. 4: DMFCs reactions Cathode 3/2O2 + 6H+ +6e− → 3H2O Anode CH3OH + H2O → CO2 + 6H+ + 6e− Overall CH3OH + 3/2O2 → CO2 + 2H2O The MOR is the key reaction at the anode in DMFCs, which are promising power sources for portable electronic devices and electric vehicles. Here, we discuss a few yolk-shell-nanostructured electrocatalysts for the MOR. The MOR activity of a Au@Pt yolk-shell electrocatalyst of diameter approximately 100 nm, which was synthesized using a galvanic displacement method, was investigated [126]. The experimental results showed that this electrocatalyst had high CO tolerance, which prolonged the Pt durability, good catalytic activity, and a significantly decreased MOR overpotential. The MOR activity of a Fe3O4-polydopamine-graphene-Pt yolk-shell nanocomposite (Fe3O4@PDA/RGO/Pt) was also investigated. First, a Fe3O4 yolk was coated with PDA to prepare core-shell nanoparticles, and then with RGO, which acted as a shell or support, was formed using a hydrothermal process to immobilize Fe3O4@PDA and prevent particle agglomeration. Pt nanoparticles were then distributed on the PDA shell and RGO, and voids were formed between the yolk and shell by partial dissolution of the yolk [129]. The catalytic activity of this yolk-shell electrocatalyst was about 2.6 times that of a commercial catalyst because of its smaller size, better distribution of Pt nanoparticles, good catalyst support, and larger number of functional groups. Highly dispersed and porous Au@pPt YSNs (140 nm) with Pt shells of thickness approximately 20 nm, Au yolks of size 15 nm, and pores of size 6 nm were created by Pt deposition and selective etching; a silica layer, which was used as a template, was coated on the Au core surface before the outer Pt shell was removed to form a yolk-shell structure [121]. This nanoreactor gave a current density about 1.9 times higher than that obtained using commercial Pt black under acidic conditions, and better catalytic activity and stability under alkaline conditions, as shown in Fig. 9 . Finally, the physical and chemical properties of a micro-sized catalyst, consisting of PtCu alloy yolk-shell cubes prepared via disproportionation and displacement reactions in Cu2O yolk-shell cubes, differed from those of ordinary spherical nanoparticles because its crystal planes were different. The PtCu alloy yolk-shell nanocubes had good MOR activity in acidic solution, about 2.5 times better than that of a commercial Pt/C electrocatalyst [127]. The ORR occurs at the cathode in both PEMFCs and DMFCs. As already mentioned, the sluggish kinetics of this reaction is a major challenge in fuel cell development. Appropriate electrocatalysts are therefore needed to improve the ORR kinetics. It has been suggested that the ORR kinetics involves two pathways: one is direct four-electron pathway and the other is an indirect (peroxide) pathway [130,132]. Many efficient catalysts have been suggested, but not many of them have nanoscale yolk-shell structures. Here, we present two recent examples of core-shell nanoparticles and yolk-shell-structured nano-electrocatalysts, and some yolk-shell microreactors. Core-shell-structured nanoparticles, namely Co@Co3O4 core-shell nanoparticles embedded in bamboo-like nitrogen-doped carbon nanotubes (Co@Co3O4/BNCNTs), were prepared via thermal treatment and oxidation [124]. Tests showed that the Co/BNCNTs did not show effective catalytic activity before oxidation to form Co@Co3O4/BNCNTs. This suggests that a Co3O4 composite provides the active sites for the ORR reaction and the catalytic activity is related to the level of oxidation. These YSNs had moderate catalytic activity, excellent tolerance for methanol molecules, and better catalytic stability than commercial Pt black [124]. Recently, highly active and durable PdAg@Pd core-shell nanoparticles were prepared and were shown to be a good potential ORR catalyst. PdAg bimetallic alloy nanoparticles of size approximately 6 nm were prepared via oleylamine reduction of Pd and Ag precursors, and ultrathin Pd shells were formed by electrochemical treatment (100 cycles of electrocatalysis) of the PdAg alloy in an acidic medium [133]. The electrocatalytic activity was evaluated by attaching the nanoparticles to active carbon; the nanoparticles showed good catalytic activity and durability in the ORR. The Au@pPt porous yolk-shell nanoreactor, which, as mentioned above, was used in the MOR, was also tested in the ORR using O2-saturated 0.1 mol/L KOH. The catalytic activity of this nanoreactor was better than that of hollow Pt and Pt black, and it gave an onset potential of 0.12 V, which is a 30 mV positive shift from the onset potential of hollow Pt and a positive shift double that from the onset potential of Pt black [121]. This proves that the Au@pPt catalyst has good catalytic activities in both the MOR and ORR. Iron carbide was also found to play a significant role in improving electrocatalytic performances in the ORR. Fe2.5C buried in a nitrogen-doped carbon shell togetherwith an Fe3O4 core (Fe3O4@Fe2.5C/N-doped C) was fabricated using a templating approach and calcination under a nitrogen flow [122]. This yolk-shell nanoreactor with particles of size 400–500 nm, a shell thickness of 40 nm, and a yolk size of 140 nm was tested in the ORR in alkaline solution. The experimental results show that the catalyst had high stability, with only slight decay in the activity after 1000 cycles [122]. Lou and his colleagues [134] synthesized Co3O4/NiCO2O4 box-in-box rattle-type double-shelled nanocages using zeolitic imidazolate framework-67/Ni-Co layered double hydroxide YSNs by thermal annealing in air. This novel synthetic method is versatile and can be used to produce double-shelled nanocages with various compositions. The catalytic performance of Co3O4/NiCO2O4 nanocages in which both shells were of thickness around 20 nm were investigated in the OER. The results show that the catalytic activity was better than those of Co3O4 and Co3O4/Co3O4 nanocages and that the catalyst had good stability. Recently, this group of researchers reported the use of a metal-organic framework to form Co-nanoparticle-embedded carbon@Co9S8 (Co-C@Co9S8) rattle-type double-shelled nanocages via thermal annealing of ZIF-67@a-CoS YSNs, as shown in Fig. 10 (A) [135]. The electrocatalytic activity and stability in the ORR were tested. The results showed that the current density at a rotating speed of 1600 r/min reached 4.5 mA/cm2 at 0.5 V, which is much greater than the values for many other nanoparticles based on Co, Co3O4, or carbon, and the current retention was 96% after 5 h, as shown in Fig. 10(C) [135]. Analysis suggests that for a rattle-type hollow double-shelled structure, the high exposure and accessibility of the active sites contribute to the outstanding catalytic performance. Finally, many yolk-shell-structured microparticles have been used in the ORR and shown excellent electrocatalytic activities, e.g. Fe3O4@Co3O4 yolk-shell microspheres [132], yolk-shell Co- and N-codoped porous carbon microspheres [136], yolk-shell-structured La0.9Sr0.1CoO3 perovskite microspheres [137], yolk-shell-structured N/P/B-ternary-doped biocarbon microparticles [138], and Ni0.69Co0.31-P yolk-shell microspheres [139]. The catalytic performances of the discussed core-shell and yolk-shell nanoreactors used in the MOR and the ORR are summarized in Table 4 . 4 Summary and outlook In this review, we have summarized the general synthetic methods for yolk-shell particles, and their recent use as nanoreactors in energy-conversion applications. Precise tuning of their structures, particle sizes, and functionalities will provide next-generation YSNs with nanoarchitectures that make them attractive catalysts for many important chemical reactions. Although many different synthetic methods have been developed in the past decade, the development of more universal, effective, environmentally friendly, and low-cost synthetic methods is still a primary research aim. Several methods for YSN synthesis were described and compared; however, a general method for synthesizing more complex YSNs is still needed. Recently, there has been rapid growth in advanced approaches for YSN synthesis [140–143], but much research is still needed to optimize the synthetic parameters. Moreover, the complexity of the synthetic processes and lack of precise control in fabricating YSNs need to be tackled; these are the main issues preventing large-scale YSN production and their commercial use. YSNs are designed to have significant advantages over conventionally structured catalysts; however, the use of nanoreactors is still new and limited. The components of yolk-shell structures could be selectively functionalized to enable multiple reactions to be performed simultaneously. Multifunctional catalysts are highly desirable for complex chemical reactions such as tandem reactions. Moreover, the porosity of the protective shell could be further tailored to regulate the diffusion rates of reactants to enable better control of the reaction rate, and gain direct control of the catalytic performance. Furthermore, the recyclability of YSNs with protective shells around their active core will benefit their use as nanoreactors. Precisely locating the active sites in YSNs will improve our understanding of the relationship between structure and performance, and enable cooperative catalysis to be achieved. In addition, the use of YSN nanoreactors in many major chemical reactions has not yet been tested, and further research in this area is expected. We believe that yolk-shell nanoreactors have great potential for improving chemical reactions. Multidisciplinary studies and collaboration are needed to fully realize the potential of yolk-shell nanoreactors. Significant progress has been made in the synthesis and applications of yolk-shell nanoreactors, and research in this area will continue to be popular in the future. The synthesis and use of optimized yolk-shell nanoreactors for high-value chemical production is the goal. References 1 C. Toumey Nat. Nanotechnol. 4 2009 783 784 2 A. Ostafin Y.C. Chen Kirk-Othmer Encyclopedia of Chemical Technology 2000 John Wiley & Sons, Inc. 3 J. Liu S.Z. Qiao J.S. Chen X.W. Lou X.R. Xing G.Q. Lu Chem. Commun. 47 2011 12578 12591 4 Y. Yang X. Liu X.B. Li J. Zhao S.Y. Bai J. Liu Q.H. Yang Angew. Chem. Int. Ed. 51 2012 9164 9168 5 H.C. Zhang H. Huang Y. Liu X. Han Z. Ma L.L. Zhang H.T. Li Z.H. Kang J. Mater. Chem. 22 2012 20182 20185 6 M. Pérez-Lorenzo B. Vaz V. Salgueiriño M.A. Correa-Duarte Chem. Eur. J. 19 2013 12196 12211 7 H. Tian X.Y. Li L. Zeng J.L. Gong ACS Catal. 5 2015 4959 4977 8 A. Guiet C. Göbel K. Klingan M. Lublow T. Reier U. Vainio R. Kraehnert H. Schlaad P. Strasser I. Zaharieva H. Dau M. Driess J. Polte A. Fischer Adv. Funct. Mater. 25 2015 6228 6240 9 M. Priebe K.M. Fromm Chem. Eur. J. 21 2015 3854 3874 10 J. Liu S.Z. Qiao Q.H. Hu G.Q. Lu Small 7 2011 425 443 11 R.X. Jin Y. Yang Y.C. Zou X.C. Liu Y. Xing Chem. Eur. J. 20 2014 2344 2351 12 B.J. Jankiewicz D. Jamiola J. Choma M. Jaroniec Adv. Colloid Interface Sci. 170 2012 28 47 13 T.J. Yao T.Y. Cui X. Fang J. Yu F. Cui J. Wu Chem. Eng. J. 225 2013 230 236 14 C.H. Lin X.Y. Liu S.H. Wu K.H. Liu C.Y. Mou J. Phys. Chem. Lett. 2 2011 2984 2988 15 G.D. Li Z.Y. Tang Nanoscale 6 2014 3995 4011 16 Z.W. Li M. Li Z.F. Bian Y. Kathiraser S. Kawi Appl. Catal. B 188 2016 324 341 17 Q.L. Fang S.H. Xuan W.Q. Jiang X.L. Gong Adv. Funct. Mater. 21 2011 1902 1909 18 Z. Chen Z.M. Cui F. Niu L. Jiang W.G. Song Chem. Commun. 46 2010 6524 6526 19 X.L. Fang X.J. Zhao W.J. Fang C. Chen N.F. Zheng Nanoscale 5 2013 2205 2218 20 J. Liu H.Q. Yang F. Kleitz Z.G. Chen T.Y. Yang E. Strounina G.Q. Lu S.Z. Qiao Adv. Funct. Mater. 22 2012 591 599 21 R. Güttel M. Paul C. Galeano F. Schüth J. Catal. 289 2012 100 104 22 S.N. Shmakov Y. Jia E. Pinkhassik Chem. Mater. 26 2014 1126 1132 23 S. Wu J. Dzubiella J. Kaiser M. Drechsler X.H. Guo M. Ballauff Y. Lu Angew. Chem. Int. Ed. 51 2012 2229 2233 24 B.C. Liu Q. Wang S.L. Yu T. Zhao J.X. Han P. Jing W.T. Hu L.X. Liu J. Zhang L.D. Sun C.H. Yan Nanoscale 5 2013 9747 9757 25 X.L. Liang J. Li J.B. Joo A. Gutiérrez A. Tillekaratne I. Lee Y.D. Yin F. Zaera Angew. Chem. Int. Ed. 51 2012 8034 8036 26 J.C. Park H. Song Nano Res. 4 2011 33 49 27 R. Purbia S. Paria Nanoscale 7 2015 19789 19873 28 H. Song Acc. Chem. Res. 48 2015 491 499 29 G. Prieto H. Tüysüz N. Duyckaerts J. Knossalla G.H. Wang F. Schüth Chem. Rev. 116 2016 14056 14119 30 J. Liu S.Z. Qiao S. Budi Hartono G.Q. Lu Angew. Chem. Int. Ed. 49 2010 4981 4985 31 Z.W. Li Y. Kathiraser S. Kawi ChemCatChem 7 2015 160 168 32 J. Pak H. Yoo Microporous Mesoporous Mater. 185 2014 107 112 33 B.C. Liu Q. Wang S.L. Yu P. Jing L.X. Liu G.R. Xu J. Zhang Nanoscale 6 2014 11887 11897 34 X.L. Fang S.J. Liu J. Zang C.F. Xu M.S. Zheng Q.F. Dong D.H. Sun N.F. Zheng Nanoscale 5 2013 6908 6916 35 Q. Zhang T.R. Zhang J.P. Ge Y.D. Yin Nano Lett. 8 2008 2867 2871 36 J. Li L.X. Chen X. Li C.C. Zhang F.L. Zeng Appl. Surf. Sci. 340 2015 126 131 37 H.C. Zeng J. Mater. Chem. 21 2011 7511 7526 38 C.C. Yec H.C. Zeng J. Mater. Chem. A 2 2014 4843 4851 39 X.W. Lou C.L. Yuan E. Rhoades Q. Zhang L.A. Archer Adv. Funct. Mater. 16 2006 1679 1684 40 Z.Y. Wang L. Zhou X.W. Lou Adv. Mater. 24 2012 1903 1911 41 L. Cao D.H. Chen R.A. Caruso Angew. Chem. Int. Ed. 52 2013 10986 10991 42 Z.H. Qin H.Y. Sun Z. Jiang X.L. Jiao D.R. Chen CrystEngComm 15 2013 897 902 43 L. Polavarapu L.M. Liz-Marzan Nanoscale 5 2013 4355 4361 44 B.D. Anderson J.B. Tracy Nanoscale 6 2014 12195 12216 45 A. Pearson A.P. O’Mullane V. Bansal S.K. Bhargava Chem. Commun. 46 2010 731 733 46 X.H. Xia Y. Wang A. Ruditskiy Y.N. Xia Adv. Mater. 25 2013 6313 6333 47 J. Lee S.M. Kim I.S. Lee Nano Today 9 2014 631 667 48 P.F. Xu R.B. Yu H. Ren L.B. Zong J. Chen X.N. Xing Chem. Sci. 5 2014 4221 4226 49 J. Jin T. Mitome Y. Egashira N. Nishiyama Colloids Surf. A 384 2011 58 61 50 M.A. Mahmoud R. Narayanan M.A. El-Sayed Acc. Chem. Res. 46 2013 1795 1805 51 Y. Chen H.R. Chen L.M. Guo Q.J. He F. Chen J. Zhou J.W. Feng J.L. Shi ACS Nano 4 2010 529 539 52 C. Wang J.C. Chen X.R. Zhou W. Li Y. Liu Q. Yue Z.T. Xue Y.H. Li A.A. Elzatahry Y.H. Deng D.Y. Zhao Nano Res. 8 2015 238 245 53 Z.Y. Zhao J. Liu M. Hahn S.Z. Qiao A.P.J. Middelberg L.Z. He RSC Adv. 3 2013 22008 22013 54 L.C. Kong G.T. Duan G.M. Zuo W.P. Cai Z.X. Cheng Mater. Chem. Phys. 123 2010 421 426 55 H.C. Zeng Curr. Opin. Chem. Eng. 1 2011 11 17 56 L. Pan H.M. Liu X.G. Lei X.Y. Huang D.H. Olson N.J. Turro J. Li Angew. Chem. Int. Ed. 42 2003 542 546 57 C.Y. Dai A.F. Zhang J.J. Li K.K. Hou M. Liu C.S. Song X.W. Guo Chem. Commun. 50 2014 4846 4848 58 S.X. Wang X.J. Yang Y.P. Wang L.X. Liu Y.Y. Guo H. Guo J. Solid State Chem. 213 2014 98 103 59 N. Zhang S.Q. Liu Y.J. Xu Nanoscale 4 2012 2227 2238 60 B. Liu H.C. Zeng Small 1 2005 566 571 61 S.F. Xie M.S. Jin J. Tao Y.C. Wang Z.X. Xie Y.M. Zhu Y.N. Xia Chem. Eur. J. 18 2012 14974 14980 62 W.X. Niu L. Zhang G.B. Xu Nanoscale 5 2013 3172 3181 63 K.M. Yeo J. Shin I.S. Lee Chem. Commun. 46 2010 64 66 64 K. Jeong S.M. Kim I.S. Lee Chem. Commun. 51 2015 499 502 65 D. Rosario-Amorin X. Wang M. Gaboyard R. Clérac S. Nlate K. Heuzé Chem. Eur. J. 15 2009 12636 12643 66 A.J. Majewski J. Wood W. Bujalski Int. J. Hydrogen Energy 38 2013 14531 14541 67 F. Mirzaei M. Rezaei F. Meshkani Chem. Eng. Technol. 37 2014 973 978 68 D.A.J.M. Ligthart R.A. van Santen E.J.M. Hensen J. Catal. 280 2011 206 220 69 X.Y. Zhao H.R. Li J.P. Zhang L.Y. Shi D.S. Zhang Int. J. Hydrogen Energy 41 2016 2447 2456 70 Z.Y. Lim C.Z. Wu W.G. Wang K.L. Choy H.F. Yin RSC Adv. 5 2015 61925 61932 71 Z.F. Bian I.Y. Suryawinata S. Kawi Appl. Catal. B 195 2016 1 8 72 J.C. Park J.U. Bang J. Lee C.H. Ko H. Song J. Mater. Chem. 20 2010 1239 1246 73 L. Li S.C. He Y.Y. Song J. Zhao W.J. Ji C.T. Au J. Catal. 288 2012 54 64 74 H.W. Kim K.M. Kang H.Y. Kwak J.H. Kim Chem. Eng. J. 168 2011 775 783 75 C.M. Ding G.G. Ai K. Zhang Q.B. Yuan Y.L. Han X.S. Ma J.W. Wang S.B. Liu Int. J. Hydrogen Energy 40 2015 6835 6843 76 N. Hajjaji M.N. Pons A. Houas V. Renaudin Energy Policy 42 2012 392 399 77 T.D. Gould A. Izar A.W. Weimer J.L. Falconer J.W. Medlin ACS Catal. 4 2014 2714 2717 78 X.G. Zheng S.Y. Tan L.C. Dong S.B. Li H.M. Chen Int. J. Hydrogen Energy 39 2014 11360 11367 79 K.M. Kang H.W. Kim I.W. Shim H.Y. Kwak Fuel Process. Technol. 92 2011 1236 1243 80 Z.W. Li L.Y. Mo Y. Kathiraser S. Kawi ACS Catal. 4 2014 1526 1536 81 W.W. Yang H.M. Liu Y.M. Li J. Zhang H. Wu D.H. He Catal. Today 259 Part 2 2016 438 445 82 S.S. Bharadwaj L.D. Schmidt Fuel Process. Technol. 42 1995 109 127 83 H.W. Kim K.M. Kang H.Y. Kwak Int. J. Hydrogen Energy 34 2009 3351 3359 84 L. Li Y. Yao B. Sun Z.Y. Fei H. Xia J. Zhao W.J. Ji C.T. Au ChemCatChem 5 2013 3781 3787 85 M. Matsuoka M. Kitano M. Takeuchi K. Tsujimaru M. Anpo J.M. Thomas Catal. Today 122 2007 51 61 86 I. Paramasivam S. Singh M. Moll C. Hauser K. Meyer P. Schmuki Electrochim. Acta 66 2012 7 11 87 X.F. Cui G.Y. Jiang M. Zhu Z. Zhao L.C. Du Y.X. Weng C.M. Xu D.K. Zhang Q.L. Zhang Y.C. Wei A.J. Duan J. Liu J.S. Gao Int. J. Hydrogen Energy 38 2013 9065 9073 88 T.C. Yang F.C. Chang H.P. Wang Y.L. Wei C.J. Jou Mar. Pollut. Bull. 85 2014 696 699 89 H.S. Kim D.J. Kim B.S. Kwak G.B. Han M.H. Um M. Kang Chem. Eng. J. 243 2014 272 279 90 A.A. Ismail D.W. Bahnemann Sol. Energy Mater. Sol. Cells 128 2014 85 101 91 X.B. Li J. Liu A.F. Masters V.K. Pareek T. Maschmeyer APL Mater. 1 2013 041101 92 D.A. Wang T. Hisatomi T. Takata C.S. Pan M. Katayama J. Kubota K. Domen Angew. Chem. Int. Ed. 52 2013 11252 11256 93 S. Hernández V. Cauda D. Hidalgo V. Farías Rivera D. Manfredi A. Chiodoni F.C. Pirri J. Alloys Compd. 615 2014 S530 S537 94 I. Lee M.A. Albiter Q. Zhang J.P. Ge Y.D. Yin F. Zaera Phys. Chem. Chem. Phys. 13 2011 2449 2456 95 Q. Wang T. Hisatomi S.S.K. Ma Y.B. Li K. Domen Chem. Mater. 26 2014 4144 4150 96 K. Maeda K. Teramura D.L. Lu N. Saito Y. Inoue K. Domen Angew. Chem. Int. Ed. 45 2006 7806 7809 97 Y. Pihosh I. Turkevych K. Mawatari N. Fukuda R. Ohta M. Tosa K. Shimamura E.G. Villora T. Kitamori Nanotechnology 25 2014 315402 98 M.G. Wang J. Han H.X. Xiong R. Guo Langmuir 31 2015 6220 6228 99 G.S. Li P. Zhang Z.F. Bian J. Zhu L. Wu H.X. Li ChemSusChem 6 2013 1461 1466 100 Q.Q. Zhang H. Bai Q. Zhang Q. Ma Y.H. Li C.Q. Wan G.C. Xi Nano Res. 9 2016 3038 3047 101 B. Liang N. Zhang C. Chen X.H. Liu R.Z. Ma S.F. Tong Z.W. Mei V.A.L. Roy H.Y. Wang Y.G. Tang Catal. Sci. Technol. 7 2017 1000 1005 102 J.G. Yu K. Wang W. Xiao B. Cheng Phys. Chem. Chem. Phys. 16 2014 11492 11501 103 S. Das W.M.A. Wan Daud Renewable Sustainable Energy Rev. 39 2014 765 805 104 K. Adachi K. Ohta T. Mizuno Solar Energy 53 1994 187 190 105 R.K. de Richter T.Z. Ming S. Caillol Renewable Sustainable Energy Rev. 19 2013 82 106 106 E.S. Baeissa Ceram. Int. 40 2014 12431 12438 107 W.G. Tu Y. Zhou H.J. Li P. Li Z.G. Zou Nanoscale 7 2015 14232 14236 108 Q.G. Zhai S.J. Xie W.Q. Fan Q.H. Zhang Y. Wang W.P. Deng Y. Wang Angew. Chem. Int. Ed. 52 2013 5776 5779 109 C.W. Tsai H.M. Chen R.S. Liu K. Asakura T.S. Chan J. Phys. Chem. C 115 2011 10180 10186 110 M.M. Gui W.M.P. Wong S.P. Chai A.R. Mohamed Chem. Eng. J. 278 2015 272 278 111 S.W. Liu J.Q. Xia J.G. Yu ACS Appl. Mater. Interfaces 7 2015 8166 8175 112 W.K. Wang D.F. Xu B. Cheng J.G. Yu C.J. Jiang J. Mater. Chem. A 5 2017 5020 5029 113 X. Wang M.Y. Liao Y.T. Zhong J.Y. Zheng W. Tian T.Y. Zhai C.Y. Zhi Y. Ma J.N. Yao Y. Bando D. Golberg Adv. Mater. 24 2012 3421 3425 114 Z.F. Jiang W. Wei D.J. Mao C. Chen Y.F. Shi X.M. Lv J.M. Xie Nanoscale 7 2015 784 797 115 J.L. Li X.J. Liu Z. Sun Y. Sun L.K. Pan J. Colloid Interface Sci. 452 2015 109 115 116 J. Zhou L. Xu J.L. Sun D.P. He H. Jiao Surf. Coat. Technol. 271 2015 119 126 117 L.L. Chen L. Li T.T. Wang L.Y. Zhang S.X. Xing C.G. Wang Z.M. Su Nanoscale 6 2014 6603 6608 118 J.B. Joo H.Y. Liu Y.J. Lee M. Dahl H.X. Yu F. Zaera Y.D. Yin Catal. Today 264 2016 261 269 119 Y.L. Zhao C.R. Tao G. Xiao G.P. Wei L.H. Li C.X. Liu H.J. Su Nanoscale 8 2016 5313 5326 120 J. Tang J. Liu N.L. Torad T. Kimura Y. Yamauchi Nano Today 9 2014 305 323 121 H.Y. Zhang H.J. Wang K. Eid L. Wang Part. Part. Syst. Charact. 32 2015 863 868 122 L.Z. Gu L.H. Jiang J.T. Jin J. Liu G.Q. Sun Carbon 82 2015 572 578 123 K. Selvakumar S. M. Senthil Kumar R. Thangamuthu G. Kruthika P. Murugan Int. J. Hydrogen Energy 39 2014 21024 21036 124 J.W. Xiao C. Chen J.B. Xi Y.Y. Xu F. Xiao S. Wang S.H. Yang Nanoscale 7 2015 7056 7064 125 F.B. Su Z.C. Zhou W.P. Guo J.J. Liu X.N. Tian X.S. Zhao Chemistry & Physics of Carbon L.R. Radovic 2007 CRC Press 63 128 126 L. Kuai S.Z. Wang B.Y. Geng Chem. Commun. 47 2011 6093 6095 127 S.H. Ye X.J. He L.X. Ding Z.W. Pan Y.X. Tong M.M. Wu G.R. Li Chem. Commun. 50 2014 12337 12340 128 N.V. Long Y. Yang C. Minh Thi N.V. Minh Y.Q. Cao M. Nogami Nano Energy 2 2013 636 676 129 Y.Q. Huang Y.J. Liu Z.H. Yang J.L. Jia X. Li Y. Luo Y.P. Fang J. Power Sources 246 2014 868 875 130 X.G. Li G. Liu B.N. Popov J. Power Sources 195 2010 6373 6378 131 Q.R. Shi P.N. Zhang Y.J. Li H.B. Xia D.Y. Wang X.T. Tao Chem. Sci. 6 2015 4350 4357 132 Y.X. Ye L. Kuai B.Y. Geng J. Mater. Chem. 22 2012 19132 19138 133 Y.Z. Lu Y.Y. Jiang X.H. Gao X.D. Wang W. Chen Part. Part. Syst. Charact. 33 2016 560 568 134 H. Hu B.Y. Guan B.Y. Xia X.W. Lou J. Am. Chem. Soc. 137 2015 5590 5595 135 H. Hu L. Han M.Z. Yu Z.Y. Wang X.W. Lou Energy Environ. Sci. 9 2016 107 111 136 S.J. Chao Q. Cui K. Wang Z.Y. Bai L. Yang J.L. Qiao J. Power Sources 288 2015 128 135 137 S.Y. Bie Y.Q. Zhu J.M. Su C. Jin S.H. Liu R.Z. Yang J. Wu J. Mater. Chem. A 3 2015 22448 22453 138 X.J. Zheng X.C. Cao J. Wu J.H. Tian C. Jin R.Z. Yang Carbon 107 2016 907 916 139 Z.X. Yin C.L. Zhu C.Y. Li S. Zhang X.T. Zhang Y.J. Chen Nanoscale 8 2016 19129 19138 140 H. Tian S.C. Wang C. Zhang J.P. Veder J. Pan M. Jaroniec L.Z. Wang J. Liu J. Mater. Chem. A 2017 In Press 141 Y.J. Hao X. Jiao H.B. Zou H.Q. Yang J. Liu J. Mater. Chem. A 2017 In Press 142 Z.W. Wang Y.X. Liu T. Yang J.G. Deng S.H. Xie H.X. Dai Chin. J. Catal. 38 2017 207 216 143 S. Mortazavi-Derazkola M. Salavati-Niasari O. Amiri A. Abbasi J. Energy Chem. 26 2017 17 23",
      "scopus-id": "85020841044",
      "coredata": {
        "eid": "1-s2.0-S1872206717628183",
        "dc:description": "Yolk-shell structured nanoparticles are of immense scientific and technological interests because of their unique architecture and myriad of applications. This review summarizes recent progresses in the use of yolk-shell structured nanoparticles as nanoreactors for various chemical reactions. A very brief overview of synthetic strategies is provided with emphasis on recent research progress in the last five years. Catalytic applications of these yolk-shell structured nanoreactors are then discussed by covering photocatalysis, methane reforming and electrochemical conversion. The state of the art research and perspective in future development are also highlighted.",
        "openArchiveArticle": "false",
        "prism:coverDate": "2017-06-30",
        "openaccessUserLicense": null,
        "prism:aggregationType": "Journal",
        "prism:url": "https://api.elsevier.com/content/article/pii/S1872206717628183",
        "dc:creator": [
          {
            "@_fa": "true",
            "$": "Wang, Meiwen"
          },
          {
            "@_fa": "true",
            "$": "Boyjoo, Yash"
          },
          {
            "@_fa": "true",
            "$": "Pan, Jian"
          },
          {
            "@_fa": "true",
            "$": "Wang, Shaobin"
          },
          {
            "@_fa": "true",
            "$": "Liu, Jian"
          }
        ],
        "link": [
          {
            "@_fa": "true",
            "@rel": "self",
            "@href": "https://api.elsevier.com/content/article/pii/S1872206717628183"
          },
          {
            "@_fa": "true",
            "@rel": "scidir",
            "@href": "https://www.sciencedirect.com/science/article/pii/S1872206717628183"
          }
        ],
        "dc:format": "application/json",
        "openaccessType": null,
        "pii": "S1872-2067(17)62818-3",
        "prism:volume": "38",
        "prism:publisher": "Dalian Institute of Chemical Physics, the Chinese Academy of Sciences. Published by Elsevier B.V.",
        "dc:title": "Advanced yolk-shell nanoparticles as nanoreactors for energy conversion",
        "prism:copyright": "Copyright © 2017 Dalian Institute of Chemical Physics, the Chinese Academy of Sciences. Published by Elsevier B.V. All rights reserved.",
        "openaccess": "0",
        "prism:issn": "18722067",
        "prism:issueIdentifier": "6",
        "dcterms:subject": [
          {
            "@_fa": "true",
            "$": "Yolk-shell nanoreactors"
          },
          {
            "@_fa": "true",
            "$": "Energy conversion applications"
          },
          {
            "@_fa": "true",
            "$": "Photocatalysis"
          },
          {
            "@_fa": "true",
            "$": "Fuel cell"
          },
          {
            "@_fa": "true",
            "$": "Utilization of carbon sources"
          }
        ],
        "openaccessArticle": "false",
        "prism:publicationName": "Chinese Journal of Catalysis",
        "prism:number": "6",
        "openaccessSponsorType": null,
        "prism:pageRange": "970-990",
        "prism:endingPage": "990",
        "pubType": "rev",
        "prism:coverDisplayDate": "June 2017",
        "prism:doi": "10.1016/S1872-2067(17)62818-3",
        "prism:startingPage": "970",
        "dc:identifier": "doi:10.1016/S1872-2067(17)62818-3",
        "openaccessSponsorName": null
      },
      "objects": {
        "object": [
          {
            "@category": "thumbnail",
            "@height": "72",
            "@width": "219",
            "@_fa": "true",
            "$": "https://api.elsevier.com/content/object/eid/1-s2.0-S1872206717628183-fx1.sml?httpAccept=%2A%2F%2A",
            "@multimediatype": "GIF image file",
            "@type": "IMAGE-THUMBNAIL",
            "@size": "14750",
            "@ref": "fx1",
            "@mimetype": "image/gif"
          },
          {
            "@category": "thumbnail",
            "@height": "116",
            "@width": "219",
            "@_fa": "true",
            "$": "https://api.elsevier.com/content/object/eid/1-s2.0-S1872206717628183-gr1.sml?httpAccept=%2A%2F%2A",
            "@multimediatype": "GIF image file",
            "@type": "IMAGE-THUMBNAIL",
            "@size": "10826",
            "@ref": "gr1",
            "@mimetype": "image/gif"
          },
          {
            "@category": "thumbnail",
            "@height": "163",
            "@width": "118",
            "@_fa": "true",
            "$": "https://api.elsevier.com/content/object/eid/1-s2.0-S1872206717628183-gr10.sml?httpAccept=%2A%2F%2A",
            "@multimediatype": "GIF image file",
            "@type": "IMAGE-THUMBNAIL",
            "@size": "18050",
            "@ref": "gr10",
            "@mimetype": "image/gif"
          },
          {
            "@category": "thumbnail",
            "@height": "163",
            "@width": "165",
            "@_fa": "true",
            "$": "https://api.elsevier.com/content/object/eid/1-s2.0-S1872206717628183-gr2.sml?httpAccept=%2A%2F%2A",
            "@multimediatype": "GIF image file",
            "@type": "IMAGE-THUMBNAIL",
            "@size": "15505",
            "@ref": "gr2",
            "@mimetype": "image/gif"
          },
          {
            "@category": "thumbnail",
            "@height": "55",
            "@width": "219",
            "@_fa": "true",
            "$": "https://api.elsevier.com/content/object/eid/1-s2.0-S1872206717628183-gr3.sml?httpAccept=%2A%2F%2A",
            "@multimediatype": "GIF image file",
            "@type": "IMAGE-THUMBNAIL",
            "@size": "7565",
            "@ref": "gr3",
            "@mimetype": "image/gif"
          },
          {
            "@category": "thumbnail",
            "@height": "108",
            "@width": "219",
            "@_fa": "true",
            "$": "https://api.elsevier.com/content/object/eid/1-s2.0-S1872206717628183-gr4.sml?httpAccept=%2A%2F%2A",
            "@multimediatype": "GIF image file",
            "@type": "IMAGE-THUMBNAIL",
            "@size": "19502",
            "@ref": "gr4",
            "@mimetype": "image/gif"
          },
          {
            "@category": "thumbnail",
            "@height": "164",
            "@width": "197",
            "@_fa": "true",
            "$": "https://api.elsevier.com/content/object/eid/1-s2.0-S1872206717628183-gr5.sml?httpAccept=%2A%2F%2A",
            "@multimediatype": "GIF image file",
            "@type": "IMAGE-THUMBNAIL",
            "@size": "30585",
            "@ref": "gr5",
            "@mimetype": "image/gif"
          },
          {
            "@category": "thumbnail",
            "@height": "163",
            "@width": "172",
            "@_fa": "true",
            "$": "https://api.elsevier.com/content/object/eid/1-s2.0-S1872206717628183-gr6.sml?httpAccept=%2A%2F%2A",
            "@multimediatype": "GIF image file",
            "@type": "IMAGE-THUMBNAIL",
            "@size": "21917",
            "@ref": "gr6",
            "@mimetype": "image/gif"
          },
          {
            "@category": "thumbnail",
            "@height": "164",
            "@width": "182",
            "@_fa": "true",
            "$": "https://api.elsevier.com/content/object/eid/1-s2.0-S1872206717628183-gr7.sml?httpAccept=%2A%2F%2A",
            "@multimediatype": "GIF image file",
            "@type": "IMAGE-THUMBNAIL",
            "@size": "22734",
            "@ref": "gr7",
            "@mimetype": "image/gif"
          },
          {
            "@category": "thumbnail",
            "@height": "163",
            "@width": "171",
            "@_fa": "true",
            "$": "https://api.elsevier.com/content/object/eid/1-s2.0-S1872206717628183-gr8.sml?httpAccept=%2A%2F%2A",
            "@multimediatype": "GIF image file",
            "@type": "IMAGE-THUMBNAIL",
            "@size": "21586",
            "@ref": "gr8",
            "@mimetype": "image/gif"
          },
          {
            "@category": "thumbnail",
            "@height": "116",
            "@width": "219",
            "@_fa": "true",
            "$": "https://api.elsevier.com/content/object/eid/1-s2.0-S1872206717628183-gr9.sml?httpAccept=%2A%2F%2A",
            "@multimediatype": "GIF image file",
            "@type": "IMAGE-THUMBNAIL",
            "@size": "17366",
            "@ref": "gr9",
            "@mimetype": "image/gif"
          },
          {
            "@category": "standard",
            "@height": "165",
            "@width": "500",
            "@_fa": "true",
            "$": "https://api.elsevier.com/content/object/eid/1-s2.0-S1872206717628183-fx1.jpg?httpAccept=%2A%2F%2A",
            "@multimediatype": "JPEG image file",
            "@type": "IMAGE-DOWNSAMPLED",
            "@size": "44868",
            "@ref": "fx1",
            "@mimetype": "image/jpeg"
          },
          {
            "@category": "standard",
            "@height": "198",
            "@width": "373",
            "@_fa": "true",
            "$": "https://api.elsevier.com/content/object/eid/1-s2.0-S1872206717628183-gr1.jpg?httpAccept=%2A%2F%2A",
            "@multimediatype": "JPEG image file",
            "@type": "IMAGE-DOWNSAMPLED",
            "@size": "37743",
            "@ref": "gr1",
            "@mimetype": "image/jpeg"
          },
          {
            "@category": "standard",
            "@height": "774",
            "@width": "560",
            "@_fa": "true",
            "$": "https://api.elsevier.com/content/object/eid/1-s2.0-S1872206717628183-gr10.jpg?httpAccept=%2A%2F%2A",
            "@multimediatype": "JPEG image file",
            "@type": "IMAGE-DOWNSAMPLED",
            "@size": "145503",
            "@ref": "gr10",
            "@mimetype": "image/jpeg"
          },
          {
            "@category": "standard",
            "@height": "674",
            "@width": "680",
            "@_fa": "true",
            "$": "https://api.elsevier.com/content/object/eid/1-s2.0-S1872206717628183-gr2.jpg?httpAccept=%2A%2F%2A",
            "@multimediatype": "JPEG image file",
            "@type": "IMAGE-DOWNSAMPLED",
            "@size": "118264",
            "@ref": "gr2",
            "@mimetype": "image/jpeg"
          },
          {
            "@category": "standard",
            "@height": "92",
            "@width": "366",
            "@_fa": "true",
            "$": "https://api.elsevier.com/content/object/eid/1-s2.0-S1872206717628183-gr3.jpg?httpAccept=%2A%2F%2A",
            "@multimediatype": "JPEG image file",
            "@type": "IMAGE-DOWNSAMPLED",
            "@size": "25567",
            "@ref": "gr3",
            "@mimetype": "image/jpeg"
          },
          {
            "@category": "standard",
            "@height": "327",
            "@width": "666",
            "@_fa": "true",
            "$": "https://api.elsevier.com/content/object/eid/1-s2.0-S1872206717628183-gr4.jpg?httpAccept=%2A%2F%2A",
            "@multimediatype": "JPEG image file",
            "@type": "IMAGE-DOWNSAMPLED",
            "@size": "105690",
            "@ref": "gr4",
            "@mimetype": "image/jpeg"
          },
          {
            "@category": "standard",
            "@height": "444",
            "@width": "533",
            "@_fa": "true",
            "$": "https://api.elsevier.com/content/object/eid/1-s2.0-S1872206717628183-gr5.jpg?httpAccept=%2A%2F%2A",
            "@multimediatype": "JPEG image file",
            "@type": "IMAGE-DOWNSAMPLED",
            "@size": "126934",
            "@ref": "gr5",
            "@mimetype": "image/jpeg"
          },
          {
            "@category": "standard",
            "@height": "634",
            "@width": "667",
            "@_fa": "true",
            "$": "https://api.elsevier.com/content/object/eid/1-s2.0-S1872206717628183-gr6.jpg?httpAccept=%2A%2F%2A",
            "@multimediatype": "JPEG image file",
            "@type": "IMAGE-DOWNSAMPLED",
            "@size": "146235",
            "@ref": "gr6",
            "@mimetype": "image/jpeg"
          },
          {
            "@category": "standard",
            "@height": "568",
            "@width": "630",
            "@_fa": "true",
            "$": "https://api.elsevier.com/content/object/eid/1-s2.0-S1872206717628183-gr7.jpg?httpAccept=%2A%2F%2A",
            "@multimediatype": "JPEG image file",
            "@type": "IMAGE-DOWNSAMPLED",
            "@size": "122054",
            "@ref": "gr7",
            "@mimetype": "image/jpeg"
          },
          {
            "@category": "standard",
            "@height": "552",
            "@width": "578",
            "@_fa": "true",
            "$": "https://api.elsevier.com/content/object/eid/1-s2.0-S1872206717628183-gr8.jpg?httpAccept=%2A%2F%2A",
            "@multimediatype": "JPEG image file",
            "@type": "IMAGE-DOWNSAMPLED",
            "@size": "122618",
            "@ref": "gr8",
            "@mimetype": "image/jpeg"
          },
          {
            "@category": "standard",
            "@height": "338",
            "@width": "638",
            "@_fa": "true",
            "$": "https://api.elsevier.com/content/object/eid/1-s2.0-S1872206717628183-gr9.jpg?httpAccept=%2A%2F%2A",
            "@multimediatype": "JPEG image file",
            "@type": "IMAGE-DOWNSAMPLED",
            "@size": "80969",
            "@ref": "gr9",
            "@mimetype": "image/jpeg"
          },
          {
            "@category": "high",
            "@height": "437",
            "@width": "1328",
            "@_fa": "true",
            "$": "https://api.elsevier.com/content/object/eid/1-s2.0-S1872206717628183-fx1_lrg.jpg?httpAccept=%2A%2F%2A",
            "@multimediatype": "JPEG image file",
            "@type": "IMAGE-HIGH-RES",
            "@size": "142668",
            "@ref": "fx1",
            "@mimetype": "image/jpeg"
          },
          {
            "@category": "high",
            "@height": "526",
            "@width": "992",
            "@_fa": "true",
            "$": "https://api.elsevier.com/content/object/eid/1-s2.0-S1872206717628183-gr1_lrg.jpg?httpAccept=%2A%2F%2A",
            "@multimediatype": "JPEG image file",
            "@type": "IMAGE-HIGH-RES",
            "@size": "114113",
            "@ref": "gr1",
            "@mimetype": "image/jpeg"
          },
          {
            "@category": "high",
            "@height": "2054",
            "@width": "1487",
            "@_fa": "true",
            "$": "https://api.elsevier.com/content/object/eid/1-s2.0-S1872206717628183-gr10_lrg.jpg?httpAccept=%2A%2F%2A",
            "@multimediatype": "JPEG image file",
            "@type": "IMAGE-HIGH-RES",
            "@size": "556839",
            "@ref": "gr10",
            "@mimetype": "image/jpeg"
          },
          {
            "@category": "high",
            "@height": "1790",
            "@width": "1807",
            "@_fa": "true",
            "$": "https://api.elsevier.com/content/object/eid/1-s2.0-S1872206717628183-gr2_lrg.jpg?httpAccept=%2A%2F%2A",
            "@multimediatype": "JPEG image file",
            "@type": "IMAGE-HIGH-RES",
            "@size": "429042",
            "@ref": "gr2",
            "@mimetype": "image/jpeg"
          },
          {
            "@category": "high",
            "@height": "243",
            "@width": "972",
            "@_fa": "true",
            "$": "https://api.elsevier.com/content/object/eid/1-s2.0-S1872206717628183-gr3_lrg.jpg?httpAccept=%2A%2F%2A",
            "@multimediatype": "JPEG image file",
            "@type": "IMAGE-HIGH-RES",
            "@size": "68675",
            "@ref": "gr3",
            "@mimetype": "image/jpeg"
          },
          {
            "@category": "high",
            "@height": "869",
            "@width": "1769",
            "@_fa": "true",
            "$": "https://api.elsevier.com/content/object/eid/1-s2.0-S1872206717628183-gr4_lrg.jpg?httpAccept=%2A%2F%2A",
            "@multimediatype": "JPEG image file",
            "@type": "IMAGE-HIGH-RES",
            "@size": "462342",
            "@ref": "gr4",
            "@mimetype": "image/jpeg"
          },
          {
            "@category": "high",
            "@height": "1179",
            "@width": "1416",
            "@_fa": "true",
            "$": "https://api.elsevier.com/content/object/eid/1-s2.0-S1872206717628183-gr5_lrg.jpg?httpAccept=%2A%2F%2A",
            "@multimediatype": "JPEG image file",
            "@type": "IMAGE-HIGH-RES",
            "@size": "429608",
            "@ref": "gr5",
            "@mimetype": "image/jpeg"
          },
          {
            "@category": "high",
            "@height": "1685",
            "@width": "1773",
            "@_fa": "true",
            "$": "https://api.elsevier.com/content/object/eid/1-s2.0-S1872206717628183-gr6_lrg.jpg?httpAccept=%2A%2F%2A",
            "@multimediatype": "JPEG image file",
            "@type": "IMAGE-HIGH-RES",
            "@size": "555063",
            "@ref": "gr6",
            "@mimetype": "image/jpeg"
          },
          {
            "@category": "high",
            "@height": "1508",
            "@width": "1673",
            "@_fa": "true",
            "$": "https://api.elsevier.com/content/object/eid/1-s2.0-S1872206717628183-gr7_lrg.jpg?httpAccept=%2A%2F%2A",
            "@multimediatype": "JPEG image file",
            "@type": "IMAGE-HIGH-RES",
            "@size": "478736",
            "@ref": "gr7",
            "@mimetype": "image/jpeg"
          },
          {
            "@category": "high",
            "@height": "1469",
            "@width": "1537",
            "@_fa": "true",
            "$": "https://api.elsevier.com/content/object/eid/1-s2.0-S1872206717628183-gr8_lrg.jpg?httpAccept=%2A%2F%2A",
            "@multimediatype": "JPEG image file",
            "@type": "IMAGE-HIGH-RES",
            "@size": "474152",
            "@ref": "gr8",
            "@mimetype": "image/jpeg"
          },
          {
            "@category": "high",
            "@height": "898",
            "@width": "1695",
            "@_fa": "true",
            "$": "https://api.elsevier.com/content/object/eid/1-s2.0-S1872206717628183-gr9_lrg.jpg?httpAccept=%2A%2F%2A",
            "@multimediatype": "JPEG image file",
            "@type": "IMAGE-HIGH-RES",
            "@size": "265847",
            "@ref": "gr9",
            "@mimetype": "image/jpeg"
          },
          {
            "@category": "thumbnail",
            "@height": "40",
            "@width": "349",
            "@_fa": "true",
            "$": "https://api.elsevier.com/content/object/eid/1-s2.0-S1872206717628183-si1.gif?httpAccept=%2A%2F%2A",
            "@multimediatype": "GIF image file",
            "@type": "ALTIMG",
            "@size": "1905",
            "@ref": "si1",
            "@mimetype": "image/gif"
          },
          {
            "@category": "thumbnail",
            "@height": "16",
            "@width": "353",
            "@_fa": "true",
            "$": "https://api.elsevier.com/content/object/eid/1-s2.0-S1872206717628183-si2.gif?httpAccept=%2A%2F%2A",
            "@multimediatype": "GIF image file",
            "@type": "ALTIMG",
            "@size": "1074",
            "@ref": "si2",
            "@mimetype": "image/gif"
          }
        ]
      },
      "link": {
        "@rel": "abstract",
        "@href": "https://api.elsevier.com/content/abstract/scopus_id/85020841044"
      }
    }
  }
}