{
  "metadata": {
    "title": "Revealing the effect of electrolyte coordination structures on the intercalation chemistry of batteries",
    "authors": "; ; ",
    "journal": "Journal of Energy Chemistry",
    "date": "2023-06-30",
    "doi": "10.1016/j.jechem.2023.02.038",
    "abstract": "",
    "uri": "https://api.elsevier.com/content/article/pii/S2095495623001389",
    "pii": "S2095495623001389"
  },
  "fulltext": {
    "full-text-retrieval-response": {
      "scopus-eid": "2-s2.0-85150424232",
      "originalText": "serial JL 286353 291210 291711 291744 291809 31 Journal of Energy Chemistry JOURNALENERGYCHEMISTRY 2023-03-08 2023-03-08 2023-03-21 2023-03-21 2023-06-01T23:56:48 1-s2.0-S2095495623001389 S2095-4956(23)00138-9 S2095495623001389 10.1016/j.jechem.2023.02.038 S300 S300.1 FULL-TEXT 1-s2.0-S2095495623X00047 2024-06-03T13:21:35.128194Z 0 0 20230601 20230630 2023 2023-03-08T01:36:03.954453Z absattachment articleinfo articletitlenorm authfirstinitialnorm authfirstsurnamenorm cid cids contenttype copyright crossmark dateloaded dateloadedtxt datesearch datesort dateupdated dco docsubtype doctype doi eid ewtransactionid hubeid indexeddate issn issnnorm itemstage itemtransactionid itemweight openaccess openarchive pg pgfirst pglast pii piinorm pubdateend pubdatestart pubdatetxt pubyr sortorder srctitle srctitlenorm srctype ssids alllist content subj subheadings suppl tomb volfirst volissue volumelist webpdf webpdfpagecount yearnav figure e-component body mmlmath acknowledge affil appendices articletitle auth authfirstini authfull authkeywords authlast grantnumber grantsponsor grantsponsorid primabst ref specialabst 2095-4956 20954956 false 81 81 C Volume 81 15 149 156 149 156 202306 June 2023 2023-06-01 2023-06-30 2023 article fla © 2023 Science Press and Dalian Institute of Chemical Physics, Chinese Academy of Sciences. Published by ELSEVIER B.V. and Science Press. All rights reserved. REVEALINGEFFECTELECTROLYTECOORDINATIONSTRUCTURESINTERCALATIONCHEMISTRYBATTERIES WANG C 1 Introduction 2 Results and discussion 3 Conclusions Experimental section Acknowledgments Appendix A Supplementary material References LI 2020 6783 6819 M XU 2014 11503 11618 K BANERJEE 2020 6878 6933 A ZHAO 2021 2552 2564 J HOU 2021 172 178 S YAMADA 2015 A2406 Y SUO 2015 938 943 L YAMADA 2014 5039 5046 Y LU 2017 1602 1609 D LI 2022 718 726 S YU 2013 5865 5868 L ZHANG 2013 1806 1810 Z MING 2019 1584 1593 J ZHANG 2006 1423 1428 S TAN 2022 1 11 S HAREGEWOIN 2016 1955 1988 A AURBACH 1997 2195 2206 D AURBACH 2002 1423 1439 D MING 2019 2613 2622 J MING 2018 335 340 J CHENG 2022 490 513 H YAO 2021 4090 4097 Y LIU 2021 2003905 X DIVYA 2021 4228 4244 M TIAN 2022 2201207 Z SEIDL 2017 1631 1642 L LI 2020 12917 12924 L LEPHAM 2022 291 300 P XU 2017 1700146 J ZHANG 2020 47647 47654 L OU 2021 2102498 X WANG 2017 18681 18687 X GE 1988 1172 1175 P JACHE 2014 10333 10337 B KIM 2015 2963 2969 H COHN 2016 543 548 A YOON 2017 1601519 G WANG 2021 nwaa289 C LIN 2015 324 328 M CHEN 2017 eaao7233 H MEN 2011 15244 15255 S CREMER 2010 9018 9033 T LOVELOCK 2009 2854 2864 K FERNANDES 2011 4033 4041 A BINI 2007 598 604 R SLOUTSKIN 2005 7796 7804 E WANG 2021 17843 17850 C PAN 2018 5670 5675 C SCHMUELLING 2013 563 571 G WANG 2019 528 534 D SCHNYDER 2001 221 232 B FOELSKESCHMITZ 2010 1453 1456 A BAO 2014 4224 W ZHI 2017 e1701010 J HAYAMIZU 2004 19527 19532 K FEDOROV 2014 2978 3036 M ZHENG 2016 9585 9598 Y XU 2010 11538 11543 K ABE 2004 A1120 T KONDO 2022 22706 22718 Y MENG 2022 eabq3750 Y WANGX2023X149 WANGX2023X149X156 WANGX2023X149XC WANGX2023X149X156XC 2025-03-21T00:00:00.000Z 2025-03-21T00:00:00.000Z http://creativecommons.org/licenses/by-nc-nd/4.0/ © 2023 Science Press and Dalian Institute of Chemical Physics, Chinese Academy of Sciences. Published by ELSEVIER B.V. and Science Press. All rights reserved. 2023-03-25T08:13:52.485Z http://vtw.elsevier.com/data/voc/AddOnTypes/50.7/aggregated-refined LiaoNing Revitalization Talents Program XLYC1902117 Liaoning Revitalization Talents Program http://data.elsevier.com/vocabulary/SciValFunders/501100018617 http://sws.geonames.org/1814991/ Photon Science Center for Carbon Neutrality Youth Innovation Fund of Dalian institute of Chemical Physics DICP I202125 National Natural Science Foundation of China 21825203 22288201 91945302 NSFC National Natural Science Foundation of China http://data.elsevier.com/vocabulary/SciValFunders/501100001809 http://sws.geonames.org/1814991/ National Key R&D Program of China 2021YFA1502800 NKRDPC National Key Research and Development Program of China http://data.elsevier.com/vocabulary/SciValFunders/501100012166 http://sws.geonames.org/1814991/ This work was financially supported by the National Key R&D Program of China ( 2021YFA1502800 ), the National Natural Science Foundation of China ( 21825203 , 22288201 , and 91945302 ), the Photon Science Center for Carbon Neutrality, LiaoNing Revitalization Talents Program ( XLYC1902117 ), and the Youth Innovation Fund of Dalian institute of Chemical Physics ( DICP I202125 ). The authors gratefully acknowledge Profs. X.H. Bao and Z.Q. Peng for fruitful discussions. item S2095-4956(23)00138-9 S2095495623001389 1-s2.0-S2095495623001389 10.1016/j.jechem.2023.02.038 286353 2023-06-01T23:09:58.046876Z 2023-06-01 2023-06-30 1-s2.0-S2095495623001389-main.pdf https://s3-eu-west-1.amazonaws.com/prod-ucs-content-store-eu-west/content/pii:S2095495623001389/MAIN/application/pdf/c19fffc5a2766226239204536b1438d5/main.pdf main.pdf pdf true 2595932 MAIN 8 1-s2.0-S2095495623001389-main_1.png https://s3-eu-west-1.amazonaws.com/prod-ucs-content-store-eu-west/content/pii:S2095495623001389/PREVIEW/image/png/5ee7ebb77bef5df69f9ae45f5530eaff/main_1.png main_1.png png 61961 849 656 IMAGE-WEB-PDF 1 1-s2.0-S2095495623001389-gr2.jpg https://s3-eu-west-1.amazonaws.com/prod-ucs-content-store-eu-west/content/pii:S2095495623001389/gr2/DOWNSAMPLED/image/jpeg/0fbe27d3b28e7964cc5ac6583dc6275e/gr2.jpg gr2 gr2.jpg jpg 60444 321 667 IMAGE-DOWNSAMPLED 1-s2.0-S2095495623001389-gr3.jpg https://s3-eu-west-1.amazonaws.com/prod-ucs-content-store-eu-west/content/pii:S2095495623001389/gr3/DOWNSAMPLED/image/jpeg/0ddfeeb75e348fd1f17d1408f1638748/gr3.jpg gr3 gr3.jpg jpg 102716 488 622 IMAGE-DOWNSAMPLED 1-s2.0-S2095495623001389-gr4.jpg https://s3-eu-west-1.amazonaws.com/prod-ucs-content-store-eu-west/content/pii:S2095495623001389/gr4/DOWNSAMPLED/image/jpeg/2294d0e82ae52edaa5dd929dee1d4a99/gr4.jpg gr4 gr4.jpg jpg 136131 866 667 IMAGE-DOWNSAMPLED 1-s2.0-S2095495623001389-gr5.jpg https://s3-eu-west-1.amazonaws.com/prod-ucs-content-store-eu-west/content/pii:S2095495623001389/gr5/THUMBNAIL/image/jpeg/6c6804645e893f5291d34767560f888d/gr5.jpg gr5 gr5.jpg jpg 81280 511 578 IMAGE-DOWNSAMPLED 1-s2.0-S2095495623001389-ga1.jpg https://s3-eu-west-1.amazonaws.com/prod-ucs-content-store-eu-west/content/pii:S2095495623001389/ga1/DOWNSAMPLED/image/jpeg/61ba5f22eb0382a1e1a499175f96f261/ga1.jpg ga1 true ga1.jpg jpg 25646 200 425 IMAGE-DOWNSAMPLED 1-s2.0-S2095495623001389-alt1.jpg https://s3-eu-west-1.amazonaws.com/prod-ucs-content-store-eu-west/content/pii:S2095495623001389/alt1/THUMBNAIL/image/jpeg/ed2f5d3e7813c84bf4e1da47f173c8cf/alt1.jpg alt1 alt1.jpg jpg 43840 271 482 IMAGE-DOWNSAMPLED 1-s2.0-S2095495623001389-alt2.jpg https://s3-eu-west-1.amazonaws.com/prod-ucs-content-store-eu-west/content/pii:S2095495623001389/alt2/DOWNSAMPLED/image/jpeg/e46ba364eb83f3e5de8cf4e4981aebe4/alt2.jpg alt2 alt2.jpg jpg 36540 271 482 IMAGE-DOWNSAMPLED 1-s2.0-S2095495623001389-gr1.jpg https://s3-eu-west-1.amazonaws.com/prod-ucs-content-store-eu-west/content/pii:S2095495623001389/gr1/DOWNSAMPLED/image/jpeg/e11124669ef0cf6d81bb63308469b89a/gr1.jpg gr1 gr1.jpg jpg 124025 777 667 IMAGE-DOWNSAMPLED 1-s2.0-S2095495623001389-gr2.sml https://s3-eu-west-1.amazonaws.com/prod-ucs-content-store-eu-west/content/pii:S2095495623001389/gr2/THUMBNAIL/image/gif/6a40835e15796fb4a35e5cb0b52a48df/gr2.sml gr2 gr2.sml sml 9878 105 219 IMAGE-THUMBNAIL 1-s2.0-S2095495623001389-gr3.sml https://s3-eu-west-1.amazonaws.com/prod-ucs-content-store-eu-west/content/pii:S2095495623001389/gr3/THUMBNAIL/image/gif/360d5cb874d304dcb019b8a5fc8b04b6/gr3.sml gr3 gr3.sml sml 14390 164 209 IMAGE-THUMBNAIL 1-s2.0-S2095495623001389-gr4.sml https://s3-eu-west-1.amazonaws.com/prod-ucs-content-store-eu-west/content/pii:S2095495623001389/gr4/THUMBNAIL/image/gif/e42d98055ca58c06d242252fd1ecc436/gr4.sml gr4 gr4.sml sml 9791 164 126 IMAGE-THUMBNAIL 1-s2.0-S2095495623001389-gr5.sml https://s3-eu-west-1.amazonaws.com/prod-ucs-content-store-eu-west/content/pii:S2095495623001389/gr5/THUMBNAIL/image/gif/72452d9f5347c008d248ff268ba3a6cb/gr5.sml gr5 gr5.sml sml 10128 164 185 IMAGE-THUMBNAIL 1-s2.0-S2095495623001389-ga1.sml https://s3-eu-west-1.amazonaws.com/prod-ucs-content-store-eu-west/content/pii:S2095495623001389/ga1/THUMBNAIL/image/gif/793a0bdfa3ca0926a71dad8fff0f5550/ga1.sml ga1 true ga1.sml sml 9440 103 219 IMAGE-THUMBNAIL 1-s2.0-S2095495623001389-alt1.sml https://s3-eu-west-1.amazonaws.com/prod-ucs-content-store-eu-west/content/pii:S2095495623001389/alt1/THUMBNAIL/image/gif/fba735c968eedb9aa7b3b270e759581b/alt1.sml alt1 alt1.sml sml 23119 123 219 IMAGE-THUMBNAIL 1-s2.0-S2095495623001389-alt2.sml https://s3-eu-west-1.amazonaws.com/prod-ucs-content-store-eu-west/content/pii:S2095495623001389/alt2/THUMBNAIL/image/gif/2f27fbb6e3da584c1b5642b82aedf7fa/alt2.sml alt2 alt2.sml sml 24242 123 219 IMAGE-THUMBNAIL 1-s2.0-S2095495623001389-gr1.sml https://s3-eu-west-1.amazonaws.com/prod-ucs-content-store-eu-west/content/pii:S2095495623001389/gr1/HIGHRES/image/gif/8659cd5350699eb5440f6d650274cf46/gr1.sml gr1 gr1.sml sml 9094 163 140 IMAGE-THUMBNAIL 1-s2.0-S2095495623001389-gr2_lrg.jpg https://s3-eu-west-1.amazonaws.com/prod-ucs-content-store-eu-west/content/pii:S2095495623001389/HIGHRES/image/jpeg/a08ca5e13ddadb36eaf7daa2b0dcc004/gr2_lrg.jpg gr2 gr2_lrg.jpg jpg 378078 1422 2953 IMAGE-HIGH-RES 1-s2.0-S2095495623001389-gr3_lrg.jpg https://s3-eu-west-1.amazonaws.com/prod-ucs-content-store-eu-west/content/pii:S2095495623001389/HIGHRES/image/jpeg/c8ddf3b0114c4c6ac736113d7ed9a2e5/gr3_lrg.jpg gr3 gr3_lrg.jpg jpg 588370 2162 2756 IMAGE-HIGH-RES 1-s2.0-S2095495623001389-gr4_lrg.jpg https://s3-eu-west-1.amazonaws.com/prod-ucs-content-store-eu-west/content/pii:S2095495623001389/DOWNSAMPLED/image/jpeg/aa27d4d624654280d83cc0a605ca5745/gr4_lrg.jpg gr4 gr4_lrg.jpg jpg 769110 3832 2953 IMAGE-HIGH-RES 1-s2.0-S2095495623001389-gr5_lrg.jpg https://s3-eu-west-1.amazonaws.com/prod-ucs-content-store-eu-west/content/pii:S2095495623001389/HIGHRES/image/jpeg/dac6357a48430962ebe9f67415603c65/gr5_lrg.jpg gr5 gr5_lrg.jpg jpg 414869 2262 2559 IMAGE-HIGH-RES 1-s2.0-S2095495623001389-ga1_lrg.jpg https://s3-eu-west-1.amazonaws.com/prod-ucs-content-store-eu-west/content/pii:S2095495623001389/MAIN/image/jpeg/ba76269dfd6d890cf624d4245c83cc20/ga1_lrg.jpg ga1 true ga1_lrg.jpg jpg 139783 886 1883 IMAGE-HIGH-RES 1-s2.0-S2095495623001389-alt1_lrg.jpg https://s3-eu-west-1.amazonaws.com/prod-ucs-content-store-eu-west/content/pii:S2095495623001389/HIGHRES/image/jpeg/a913576208be0cfed7ef18ad7f1d1e4e/alt1_lrg.jpg alt1 alt1_lrg.jpg jpg 135279 720 1280 IMAGE-HIGH-RES 1-s2.0-S2095495623001389-alt2_lrg.jpg https://s3-eu-west-1.amazonaws.com/prod-ucs-content-store-eu-west/content/pii:S2095495623001389/THUMBNAIL/image/jpeg/a0fc449a4f02c9009a89c764c2acc5e3/alt2_lrg.jpg alt2 alt2_lrg.jpg jpg 111590 720 1280 IMAGE-HIGH-RES 1-s2.0-S2095495623001389-gr1_lrg.jpg https://s3-eu-west-1.amazonaws.com/prod-ucs-content-store-eu-west/content/pii:S2095495623001389/HIGHRES/image/jpeg/833e3f0ab75033606e50fde5445b0f77/gr1_lrg.jpg gr1 gr1_lrg.jpg jpg 769312 3442 2953 IMAGE-HIGH-RES 1-s2.0-S2095495623001389-mmc3.docx https://s3-eu-west-1.amazonaws.com/prod-ucs-content-store-eu-west/content/pii:S2095495623001389/mmc3/MAIN/application/vnd.openxmlformats-officedocument.wordprocessingml.document/9dce07179de0af3d0423da834bde699f/mmc3.docx mmc3 mmc3.docx docx 2715912 APPLICATION 1-s2.0-S2095495623001389-mmc1.mp4 https://s3-eu-west-1.amazonaws.com/prod-ucs-content-store-eu-west/content/pii:S2095495623001389/mmc1/MAIN/video/mp4/ec09d19fc24b7fd57c8521af486949dc/mmc1.mp4 mmc1 mmc1.mp4 mp4 4116434 VIDEO 1-s2.0-S2095495623001389-mmc2.mp4 https://s3-eu-west-1.amazonaws.com/prod-ucs-content-store-eu-west/content/pii:S2095495623001389/mmc2/MAIN/video/mp4/e1128cfd2abd794c5922678985f6249e/mmc2.mp4 mmc2 mmc2.mp4 mp4 471773 VIDEO 1-s2.0-S2095495623001389-mmc1.jpg https://s3-eu-west-1.amazonaws.com/prod-ucs-content-store-eu-west/content/pii:S2095495623001389/mmc1/DOWNSAMPLED/image/jpeg/ed2f5d3e7813c84bf4e1da47f173c8cf/mmc1.jpg mmc1 mmc1.jpg jpg 43840 271 482 IMAGE-MMC-DOWNSAMPLED 1-s2.0-S2095495623001389-mmc2.jpg https://s3-eu-west-1.amazonaws.com/prod-ucs-content-store-eu-west/content/pii:S2095495623001389/mmc2/DOWNSAMPLED/image/jpeg/e46ba364eb83f3e5de8cf4e4981aebe4/mmc2.jpg mmc2 mmc2.jpg jpg 36540 271 482 IMAGE-MMC-DOWNSAMPLED 1-s2.0-S2095495623001389-mmc1.sml https://s3-eu-west-1.amazonaws.com/prod-ucs-content-store-eu-west/content/pii:S2095495623001389/mmc1/THUMBNAIL/image/gif/fba735c968eedb9aa7b3b270e759581b/mmc1.sml mmc1 mmc1.sml sml 23119 123 219 IMAGE-MMC-THUMBNAIL 1-s2.0-S2095495623001389-mmc2.sml https://s3-eu-west-1.amazonaws.com/prod-ucs-content-store-eu-west/content/pii:S2095495623001389/mmc2/THUMBNAIL/image/gif/2f27fbb6e3da584c1b5642b82aedf7fa/mmc2.sml mmc2 mmc2.sml sml 24242 123 219 IMAGE-MMC-THUMBNAIL 1-s2.0-S2095495623001389-si1.svg https://s3-eu-west-1.amazonaws.com/prod-ucs-content-store-eu-west/content/pii:S2095495623001389/STRIPIN/image/svg+xml/028122822c010dc0c000dca48954881c/si1.svg si1 si1.svg svg 4016 ALTIMG 1-s2.0-S2095495623001389-si2.svg https://s3-eu-west-1.amazonaws.com/prod-ucs-content-store-eu-west/content/pii:S2095495623001389/STRIPIN/image/svg+xml/912c7a3646f92f8bffdc0ca9fb347181/si2.svg si2 si2.svg svg 6506 ALTIMG 1-s2.0-S2095495623001389-si3.svg https://s3-eu-west-1.amazonaws.com/prod-ucs-content-store-eu-west/content/pii:S2095495623001389/STRIPIN/image/svg+xml/69cb1c972bf99ffa345b232153a92813/si3.svg si3 si3.svg svg 15562 ALTIMG 1-s2.0-S2095495623001389-si4.svg https://s3-eu-west-1.amazonaws.com/prod-ucs-content-store-eu-west/content/pii:S2095495623001389/STRIPIN/image/svg+xml/5171136d17792d0f727eff69b2a790ea/si4.svg si4 si4.svg svg 9575 ALTIMG 1-s2.0-S2095495623001389-si5.svg https://s3-eu-west-1.amazonaws.com/prod-ucs-content-store-eu-west/content/pii:S2095495623001389/STRIPIN/image/svg+xml/12a060090c7edf946c317492f0cd88e1/si5.svg si5 si5.svg svg 1607 ALTIMG 1-s2.0-S2095495623001389-am.pdf https://s3-eu-west-1.amazonaws.com/prod-ucs-content-store-eu-west/content/egi:103D0WP66WT/MAIN/application/pdf/f2a77e92a4e398ede9b35c5e441b0ebd/am.pdf am am.pdf pdf false 1128128 AAM-PDF JECHEM 3059 S2095-4956(23)00138-9 10.1016/j.jechem.2023.02.038 Science Press and Dalian Institute of Chemical Physics, Chinese Academy of Sciences Fig. 1 (a) Schematic for the Al/graphite battery with an IL electrolyte and its ion intercalation process upon charging. (b) CV curves (scan rate: 0.5 mV s−1; cutoff voltage: 2.45 V) of the Al/HOPG batteries with EMICl-AlCl3 (black) and HMICl-AlCl3 (red) electrolytes. The curves from 1.80 to 1.95 V are enlarged in the inset. (c) XPS N 1s signals for the EMICl-AlCl3 and HMICl-AlCl3 IL electrolytes. The EMI+ and HMI+ structures are included. (d) Relative MS intensity ratio between the ion pair ([EMI-Cl-EMI]+ or [HMI-Cl-HMI]+) and the respective isolated cation (EMI+ or HMI+) of the EMICl and HMICl salts from ESI-MS analysis. (e) Atomic ratio between Al (in anion), N (in cation) and O (from H2O) according to ARXPS results. (f) Schematic for the anion, cation and H2O distribution from the ARXPS measurements. Fig. 2 (a) 2D contour plots of the stage-n GIC (002), (00n + 1) and (00n + 2) reflection planes under charging conditions in operando XRD measurements with HMI-based electrolyte. (b) Representative operando XRD patterns with EMICl-AlCl3 (E) and HMICl-AlCl3 (H) electrolytes at different charging states. Fig. 3 Operando XPS analysis of the Al| HMICl-AlCl3| HOPG model battery. (a–c) A set of operando XPS Al 2p (a), N 1s (b) and C 1s (c) spectra of the model batteries when charging from OCV to 2.6 V. (d) Dependence of intercalated Cl (Clint, black circles and the black dashed line is the fitting result) and N (Nint) contents (red stars and the red dashed line is the fitting result) with intercalated Al (Alint) contents of the HMI-based electrolyte systems in the charging process. The corresponding results in EMI-based systems (black and red solid lines) are included [39]. (e) Atomic ratios between intercalated Al (Alint) and host-C (Chost) in HMI-based electrolyte systems at different potentials. The theory limit (black dashed line) for the Alint/Chost in EMICl-based systems at 2.45 V is also displayed [39]. Fig. 4 (a) Operando OM images captured over an exfoliated HOPG flake in HMICl-AlCl3 electrolyte at 2 V for the indicated charging times. Diffusion frontiers are highlighted by red dashed lines. (b) The intercalated area vs. time extracted from the operando OM images. The results in EMICl-AlCl3 electrolyte are included. (c) Correlation between the peak current (I p) and scan rate (v). (d) Nyquist plots of the model HOPG electrodes in EMICl-AlCl3 and HMICl-AlCl3 electrolytes acquired at 1.95 V upon the initial charging process. (e) GCD curves for the coin-type Al/graphite batteries after 20th cycles at 0.5 A g−1 (cutoff voltage: 2.42 V) using the two electrolytes. Scheme 1 Schematic illustration of the ion intercalation process without (a) and with (b) de-solvation. The schematic for the coordination structure of the solvated ion are deduced from the ARXPS measurements.The red balls, blue pentagons and the grean lines represent for the guest anions, imidazolium rings and the aliphatic side chains respectively. Revealing the effect of electrolyte coordination structures on the intercalation chemistry of batteries Chao Wang a b Xianjin Li a c Guiming Zhong d f Caixia Meng a Shiwen Li a b Guohui Zhang a Yanxiao Ning a Xianfeng Li e f Qiang Fu a f ⁎ a State Key Laboratory of Catalysis, iChEM, Dalian Institute of Chemical Physics, Chinese Academy of Sciences, Dalian 116023, Liaoning, China State Key Laboratory of Catalysis iChEM Dalian Institute of Chemical Physics Chinese Academy of Sciences Dalian 116023 Liaoning China State Key Laboratory of Catalysis, iChEM, Dalian Institute of Chemical Physics, Chinese Academy of Sciences, Dalian 116023, Liaoning, China b University of Chinese Academy of Sciences, Beijing 100049, China University of Chinese Academy of Sciences Beijing 100049 China University of Chinese Academy of Sciences, Beijing 100049, China c Department of Chemical Physics, University of Science and Technology of China, Hefei 230026, Anhui, China Department of Chemical Physics University of Science and Technology of China Hefei 230026 Anhui China Department of Chemical Physics, University of Science and Technology of China, Hefei 230026, Anhui, China d Laboratory of Advanced Spectro-electrochemistry and Li-ion Batteries, Dalian Institute of Chemical Physics Chinese Academy of Sciences, Dalian116023, Liaoning, China Laboratory of Advanced Spectro-electrochemistry and Li-ion Batteries Dalian Institute of Chemical Physics Chinese Academy of Sciences Dalian116023 Liaoning China Laboratory of Advanced Spectro-electrochemistry and Li-ion Batteries, Dalian Institute of Chemical Physics Chinese Academy of Sciences, Dalian116023, Liaoning, China e Division of Energy Storage, Dalian National Laboratory for Clean Energy Dalian Institute of Chemical Physics, Chinese Academy of Sciences, Dalian 116023, Liaoning, China Division of Energy Storage Dalian National Laboratory for Clean Energy Dalian Institute of Chemical Physics Chinese Academy of Sciences Dalian 116023 Liaoning China Division of Energy Storage, Dalian National Laboratory for Clean Energy Dalian Institute of Chemical Physics, Chinese Academy of Sciences, Dalian 116023, Liaoning, China f Dalian National Laboratory for Clean Energy Dalian Institute of Chemical Physics, Chinese Academy of Sciences, Dalian 116023, Liaoning, China Dalian National Laboratory for Clean Energy Dalian Institute of Chemical Physics Chinese Academy of Sciences Dalian 116023 Liaoning China Dalian National Laboratory for Clean Energy Dalian Institute of Chemical Physics, Chinese Academy of Sciences, Dalian 116023, Liaoning, China ⁎ Corresponding author. Graphical abstract The electrolyte coordination structure-dependent intercalation chemistry has been directly observed over an Al/graphite model battery using operando X-ray photoelectron spectroscopy measurements which suggest a new method to investigate the electrolyte-dependent intercalation and interface chemistry. In-depth understanding of the electrolyte-dependent intercalation chemistry in batteries through direct operando/in situ characterizations is crucial for the development of the high-performance batteries. Herein, taking the Al/graphite battery as a model system, the effect of electrolyte coordination structure on the intercalation processes has been investigated over the batteries with either 1-hexyl-3-methylimidazolium chloride (HMICl)-AlCl3 or 1-ethyl-3-methylimidazolium chloride (EMICl)-AlCl3 ionic liquid electrolyte using operando X-ray photoelectron spectroscopy (XPS) and X-ray diffraction. With a weaker anion-cation interaction in HMI-based electrolyte, the XPS-derived atomic ratio between co-intercalated N and intercalated Al is 0.9, which is lower than 1.6 for EMI-based electrolyte. Attributed to the additional de-solvation process, the batteries with the HMI-based electrolyte show a lower ionic diffusion rate, capacity, and cycling performance, which agree with the operando characterization results. Our findings highlight the critical role of the electrolyte coordination structure on the (co–)intercalation chemistry. Keywords Operando surface characterization Electrolyte coordination structure De-solvation Intercalation chemistry 1 Introduction It is well known that the electrolyte lies at the heart of the battery and plays a critical role in the overall performance [1–6]. For instance, in the state-of-the-art lithium-ion batteries (LIBs), both the formation of solid electrolyte interphase (SEI) and intercalation chemistry are directly governed by electrolyte concentration [7–11], as well as its components including solvents [9,12–14], salts [9,15] and additives [16,17]. Typically, in the previously used propylene carbonate (PC)-based electrolytes, an unstable SEI composed of organic Li salts forms on the graphite anode. Such a poor SEI leads to Li+-solvent co-intercalation and exfoliation of the graphite anode [18]. In contrast, an effective SEI which forms in ethylene carbonate (EC)-based electrolyte with vinylene carbonate (VC) as the additive can inhibit the Li+-solvent co-intercalation and leads to reversible Li+ intercalation–deintercalation [19]. In addition to SEI, it is reported that the intercalation chemistry is also affected by the solvation or coordination structure of the intercalating ions [20–24]. For instance, Ming et al. discovered that the Li+-solvent co-intercalation into the graphite anode can still happen in dioxolane (DOL)/dimethoxymethane (DME) electrolyte after precoating the anode by the SEI formed in the commercial EC-based electrolyte which can inhibit the co-intercalation of the EC solvent. Furthermore, the Li+-solvent co-intercalation can be well inhibited by weakening the Li+-solvent interaction through introducing LiNO3 [20,21]. The critical role of the electrolyte coordination structure on the ionic intercalation processes can also be observed in sodium-ion batteries (SIBs) [25–27], potassium-ion batteries [28–30], dual-ion batteries [31,32] and supercapacitors [33]. With respect to the poor Na+ storage performance of graphite electrode (< 35 mA h g−1) [34], many researches demonstrate that the limit can be bypassed via the solvent-assisted Na+ intercalation strategy using diglyme-based electrolytes [35,36]. For example, Pint’s group successfully designed an ultrafast Na/few-layer graphene cell with the diglyme-based electrolyte which can yield a capacity of > 150 mA h g−1 at 1 A g−1 and ∼ 100 mA h g−1 at 30 A g−1 over 8000 cycles [37]. Yoon et al. systematically studied Na+-solvent co-intercalation chemistry in various solvents by combining theoretical calculations with electrochemical performance tests. They found that both the Na+-solvent interaction and the lowest unoccupied molecular orbital level of the [Na-solvent]+ complex control the reversible Na+ (de)intercalation [38]. In order to deeply understand the role of the electrolyte coordination structures in battery performance, it requires direct and operando characterization methodology. In this work, taking Al/graphite battery as a model system, we have studied the electrolyte coordination structure-dependent electrochemical intercalation behaviors by using operando X-ray diffraction (XRD) and X-ray photoelectron spectroscopy (XPS). For the battery, either 1-ethyl-3-methylimidazolium chloride (EMICl)-AlCl3 or 1-hexyl-3-methylimidazolium chloride (HMICl)-AlCl3 ionic liquid (IL) is used as the electrolyte. In the IL electrolytes, the EMI+ or HMI+ cations act as the solvent of the guest chloroaluminate ( A l C l 4 - ) anions. As evaluated by XPS and mass spectrometry (MS), the coordination strength of HMI+ is lower than that of EMI+ and the corresponding anion-cation interaction is weaker in HMI-based electrolyte than that in EMI-based electrolyte. The intercalated N:Al atomic ratio is reduced from 1.6 in the EMI-based systems [39] to 0.9 in the HMI-based systems based on operando XPS measurements. Affected by the de-solvation processes, the batteries with HMI-based electrolyte demonstrate a much lower ionic diffusion rate, lower capacity, and poorer cycling performance, which are consistent with the higher stage graphite intercalation compound (GIC) with a lower intercalation concentration by operando XRD and XPS. Our results suggest that the de-solvation processes are mainly governed by the electrolyte coordination structure. Moreover, the methods demonstrated in this work can be applied to other systems, such as LIBs or SIBs, to study the electrolyte-dependent interface and intercalation chemistry. 2 Results and discussion Two kinds of IL electrolytes used in the Al/graphite batteries (Fig. 1 a) have been prepared by mixing EMICl ([C2C1Im]+Cl−) or HMICl ([C6C1Im]+Cl−) salt with anhydrous AlCl3 (AlCl3:EMICl or HMICl = 1.3:1, by mole). Cyclic voltammetry (CV) curves of Al/highly orientated pyrolyzed graphite (HOPG) batteries with the two electrolytes are respectively shown in Fig. 1(b) between 1.50–2.45 V (vs. Al quasi-reference electrode) under 0.5 mV s−1. Typically, the sharp oxidative peaks around 1.85, 2.10 and 2.40 V can be clearly seen in the EMI-based system upon charging (positive polarization), which correspond to the anion intercalation processes [39–41]. In contrast, the CV curve with tiny broad peaks and a lower current density is acquired in the HMI-based systems. Furthermore, the intercalation potential in HMI-based electrolyte can be determined as 1.90 V which is larger than 1.82 V in EMI-based electrolyte (inset of Fig. 1b). The above results demonstrate that the cation structure of IL electrolyte strongly affects the electrochemical behaviors. To figure out the underlying mechanism of the distinct electrochemical behaviors, a comparison of the anion-cation interaction in the two ILs has been performed by XPS. As shown in Fig. 1(c), the binding energy of the imidazole N atom Ncation 1s in EMI-based electrolyte is located at 402.7 eV (other elements are shown in Fig. S1). In comparison, the Ncation 1s signal from the HMI-based electrolyte displays a broadened feature and has a shoulder band at 403.6 eV, showing that the charge of Ncation as well as the imidazolium ring in HMI-based electrolyte is more positive than that in EMI-based electrolyte. Such results suggest that the less electron is transferred from the anion to cation which causes the less charge delocalization of the imidazolium ring in HMI-based electrolyte. Thus, it can be concluded that the anion-cation interaction is weaker in HMI-based electrolyte (Fig. 1f) [42–44]. Such conclusions can be further supported by the 1H nuclear magnetic resonance (NMR) and infrared (IR) spectra of the electrolytes shown in Figs. S2 and S3, respectively. The higher chemical shifts of H atoms and lower wavenumbers of the corresponding CH x modes in HMI-based electrolyte demonstrate that the positive charge density of the imidazolium ring is higher as well as the anion-cation interaction is weaker. The coordination strength of these two cations has been also evaluated by electrospray ionization mass spectrometry (ESI-MS) [45,46]. As shown in Fig. 1(d) and Fig. S4, the MS intensity ratio between the ion pair ([EMI-Cl-EMI]+) and the isolated cation (EMI+) in EMI-based IL electrolyte can reach 46%, which is much higher than 2% ([HMI-Cl-HMI]+/HMI+) in HMI-based IL electrolyte. The ESI-MS results further support the XPS results, indicating that the anion-cation interaction is weaker in HMI-based electrolyte. Angle-resolved XPS (ARXPS) measurements were carried out over the IL surface in ultra-high vacuum (UHV) to investigate the depth-dependent chemical information and coordination structure (Fig. S1). As shown in Fig. 1(e), the surface enrichment of the cation [44,47] can be observed in HMI-based electrolyte compared with EMI-based one according to the higher N/Al ratio. Moreover, the distribution of contaminated H2O molecules (from O 1s [48]), which is mainly produced by the reactions between acid IL electrolyte and aluminum oxide films on Al anode (determined by Karl Fischer titrator shown in Fig. S5), has been measured by ARXPS (O/Al in Fig. 1e). H2O is mainly distributed in the topmost surface region of EMI-based electrolyte but in the bulk region of HMI-based electrolyte. We suggest that the weak anion-cation interaction in HMI-based electrolyte allows H2O molecules to enter the bulk anion-cation networks (Fig. 1f), which may further influence the corresponding electrochemical behaviors [48]. Electrochemical intercalation processes upon charging under LSV condition (1.8–2.65 V, 0.1 mV s−1) and the following constant voltage charging at 2.65 V in HMICl-AlCl3 electrolyte have been investigated by operando XRD over the model Al/HOPG battery. Fig. 2 (a) shows two-dimensional (2D) contour patterns of reflections from the (002) plane (middle panel) of the pristine uncharged graphite, as well as the (00n + 1) (left panel) and (00n + 2) (right panel) planes of the generated stage-n GIC electrodes in HMI-based system. Under a linear sweep voltammetry (LSV) condition from 1.80 to 2.65 V with 0.1 mV s−1 and the subsquent constant-voltage charge at 2.65 V for 2400 s (right panel in Fig. 2a), intensity of the pristine uncharged (002) pattern gradually decreases along with the increasing (00n + 1) and (00n + 2) signals. At 2.15 V, the (00n + 1) and (00n + 2) diffraction patterns appear at 23.9° and 27.9° which are corresponding to the (006) and (007) planes of a stage-5 GIC structure, respectively. When the potential reaches to 2.25 V, a stage-4 GIC can be observed, for which (005) and (006) diffraction peaks are located at 23.5° and 28.2° and become profound during the subsequent charging process to 2.65 V. After charging at 2.65 V for 1800 s (Fig. 2a), two dominant (005) and (006) diffraction patterns are observed which demonstrates the formation of a pure stage-4 GIC [49,50]. Operando XRD characterization results over the HOPG model electrode in EMI-based electrolyte under the same charging condition (LSV: 1.80–2.45 V, 0.1 mV s−1) are shown in Fig. S6. Similiarly, the intensity of the pristine (002) peak gradually decreases and the (00n + 1) and (00n + 2) peaks appear upon charging and shift to 22.5° and 28.2° after charging to 2.45 V, respectively [39,48]. Some typical operando XRD patterns recorded over HOPG electrodes in HMI- (labelled as H) and EMI- (labelled as E) based systems are comparativley displayed in Fig. 2(b). At open circuit voltage (OCV) state, the (002) XRD pattterns are located at 26.5° indicating the same pristine structure with an interlayer spacing of 3.35 Å. Under the same charging condition (LSV: 1.80–2.45 V, 0.1 mV s−1), a pure stage-3 GIC structure whose gallery height is 9.1 Å can be observed at 2.45 V in EMI-based system as seen from the well-defined (004) and (005) diffraction peaks located at 22.5° and 28.2°, respectively. In comparision, a pure stage-4 GIC structure with the calculated gallery height of 8.9 Å [50,51] can be formed at 2.65 V (albeit with a longer charging period of 2400 s shown in Fig. 2(b) in HMICl-AlCl3 electrolyte. The operando XRD results confirm the coordination structure-dependent intercalation processes in the two electrolytes, and show that the GIC structure with a higher stage can be acquired at higher charging potential in HMI-based electrolyte than that in EMI-based electrolyte. The coordination structure effect on intercalation chemistry in the two electrolytes can be further investigated by operando XPS. By constructing well-defined planar Al/HOPG model batteries (Fig. S7) and using UHV-compatible IL electrolytes, operando XPS measurements have been successfully carried out over the EMI-based system [39,48]. The intercalation of A l C l 4 - together with EMI+ has been directly observed. Electrochemical intercalation mechanism in the HMI-based system has been further studied by operando XPS measurements over the planar Al|HMICl-AlCl3|HOPG model batteries in this work (detail in experimental section). A set of operando XPS Al 2p, N 1s and C 1s signals acquired at different charging potentials are shown in Fig. 3 (a–c) and Fig. S8, respectively. At the OCV state, Al 2p spectrum is peaked at 75.9 eV (Fig. 3a) which can be assigned to A l x C l y - in the IL electrolyte (Alads) adsorbing on the HOPG electrode surface and is similar to the pure IL droplet (Fig. S9a). When the charging potential reaches to 1.95 V, a new Al 2p signal (red part in Fig. 3a) at 74.2 eV can be observed, whose BE is 1.7 eV lower than that at the OCV state. We assign the signals to the intercalated Al (Alint), and the negative BE shift (−1.7 eV) with respect to Alads is corresponding to the Fermi level shift, i.e., increment of the surface work function by 1.7 eV (Fig. S10) [39,52,53]. The peaks at higher BEs (blue part) are attributed to the hydrous species due to the entry of H2O into the bulk anion-cation networks as discussed in Fig. 1(f) [48]. During charging to 2.6 V, the Alint 2p signal intensity continues to increase. The evolution of N 1s signal (Fig. 3b) is similar to Al 2p. Upon charging, N 1s signal located at 400.3 eV appears and increases gradually from OCV to 2.6 V, whose BE is 1.7 eV lower than that in OCV state. The depth-profile XPS measurement assisted with Ar+ sputtering has been performed and shown in Fig. S11. Upon Ar+ etching, the Al 2p and N 1s BEs from the bulk region are consistent with those from the surface region acquired by the operando XPS measurements. Such results demonstrate that this newly appeared N 1s signal is assigned to the co-intercalated HMI+ cations within the HOPG electrode instead of surface adsorption on the electrode. Thus, the anion-cation co-intercalation is also involved in the Al|HMICl-AlCl3|HOPG battery. Furthermore, the depth-profile XPS and the chemical analysis results (Fig. S12) confirm that the concentrations of intercalated anions and cations are lower in the bulk region compared with the surface region. The selected operando XPS C 1s signals at OCV and 2.6 V are shown in Fig. 3(c). C 1s intensity decreases strongly after charging due to attenuation of the intercalated ions. In addition to some complex functional groups (dash line in Fig. 3c), the C 1s band at OCV mainly consists of the adsorbed IL species, including adsorbed C-N ((C–N)ads, green part) at 286.8 eV and adsorbed C–C ((C–C)ads, patterned green part) at 285.3 eV (the same as the IL droplet, Fig. S9b), and the uncharged carbon atoms (Cuc) at 284.5 eV. The co-intercalation of HMI+ can be further proved by the fact that the intercalated C–N ((C–N)int) and C–C ((C–C)int) signals can be found at 285.1 and 283.6 eV at 2.6 V, respectively, whose BEs are also 1.7 eV lower than the (C–N)ads and (C–C)ads. In addition, the charged carbon atoms (Cc, pink part in Fig. 3c) shift negatively to 283.1 eV, which is 1.4 eV lower than Cuc (Fig. S10). The quantitative information of the intercalated species and GICs can be further derived from the operando XPS analysis. As shown in Fig. 3(d), the atomic ratio of the intercalated Nint/Alint is calculated as 0.9 in HMI-based systems, which is lower than 1.6 in the EMI-based systems (red solid line) [39]. Thus, the operando XPS analysis directly demonstrates the stronger de-solvation processes in HMI-based systems, which is due to the weaker anion-cation interaction. In addition, Clint/Alint in HMI-based electrolyte is 3.2 and lower than that in EMI-based one (Clint/Alint = 4.1:1 (black solid line in Fig. 3d) [39], which may be due to the hydrolysis from replacement of Cl by OH [48]. Fig. 3(e) displays the atomic ratios between intercalated Al (Alint) and host-C (Chost) in HMI-based systems at different potentials. At 2.6 V, the ratio of Alint/Chost can reach 1:5, which is much lower than 1:1.7 in EMICl-based systems at 2.45 V (red star in Fig. 3e), but still ∼5-fold higher than the theoretical limit, i.e., Alint/Chost = 1: 24 (dashed line in Fig. 3e) [49]. Combined with the operando XRD measurements (Fig. 2), it can be concluded that the GIC formed in HMI-based systems has a higher stage structure, that is, with a lower (co–)intercalation concentration, compared with EMI-based systems. The different electrochemical behaviors observed in the above characterizations may strongly affect the performance. The ion transport processes within the graphite electrode have been recorded by operando optical microscope (OM) measurements. A set of OM images of a single exfoliated HOPG flake are captured upon charging at 2 V as shown in Fig. 4 (a) and Video S1, in which the intercalated regions can be distinguished by the dark contrast. As shown in Fig. 4(b), the intercalated area increases approximately linearly with time [54] since that the OM images were captured under the current-steady conditions. Derived from the slope of the linear fit of the intercalated area vs. time curves, the transport rate of the intercalated ions can be estimated as 5.4 × 10−6 cm2 s−1 (black line in Fig. 4b) in HMICl-AlCl3 electrolyte, which is one order lower than 3.9 × 10−5 cm2 s−1 in EMICl-AlCl3 electrolyte (red line in Fig. 4b, Fig. S13 and Video S2). Furthermore, the appearance diffusion coefficients (D) in the two electrolytes are measured by CV tests over the Al/HOPG model batteries (Fig. S14) under various scan rates (v). According to the Randles-Sevcik equation, peak current (I p) and scan rate (v) follow the formula: I p = 269000 n 3 / 2 A C D 1 / 2 v 1 / 2 (A: the working electrode area; C: concentration; D: diffusion coefficient) [41,55]. Thus, D in the two electrolytes can be obtained based on the dependence of I p on v 1/2. As shown in Fig. 4(c), D in HMI-based system is only 1/16 of that in EMI-based system. To clarify the main factor of the different ion transport kinetics in the above two electrolytes, the electrochemical impedance spectroscopy (EIS) analysis has been further conducted. To begin with, the ionic conductivity of these two electrolytes were measured by EIS measurements using Ta as the blocking electrode which are shown in Fig. S15. The ionic conductivity of HMI-based electrolyte is 7.4 mS cm−1, which is only slightly lower than 16.7 mS cm−1 in EMI-based electrolyte. According to the Nernst-Einstein equation: σ = n e 2 kT D e , the diffusion coefficients of the ion in the electrolyte (D e) is in direct proportional to the ionic conductivity ( σ ) of the electrolyte [56]. Thus, the liquid-phase ionic diffusion coefficient in the EMI-based electrolyte is only about 2-fold higher than that in the HMI-based electrolyte. The EIS measurements have been further performed over the Al/HOPG model batteries. Fig. 4(d) shows the Nyquist plots in the above two electrolytes acquired at 1.95 V. Both Nyquist plots showed a single semicircle at the high-frequency range and a straight line rising at the low-frequency region, which are attributed to the charge-transfer resistance and the diffusion resistance, respectively. Based on the equivalent circuit shown in Fig. S16, the charge-transfer resistance in HMI-based electrolyte can be estimated as 56 Ω, which is approximately 5-fold higher than 12 Ω in the EMI-based electrolyte. Otherwise, the diffusion coefficient in the bulk region can be yielded as 9.59 × 10−13 cm2 s−1 in the EMI-based electrolyte, which is slightly higher than 7.2 × 10−13 cm2 s−1 in the HMI-based electrolyte (the detailed derivation processes are described in SI). Overall, the observed large difference in ionic intercalation kinetics between HMI- and EMI-based systems should not be from the small difference in the liquid- and solid- phase ionic diffusion coefficients but from the interfacial charge transfer resistance, i.e., the occurrence of the de-solvation processes. The operando XPS measurements show that there exists the considerable discrepancy on the concentration of the intercalated anions and cations of these two electrolytes which may strongly affect the total charge density (TCD) of the electrode (TCD= −Alint/Chost + 1/2·Nint/Chost) as well as the battery capacity. Cycling performance tests of the coin-type Al/graphite batteries have been further carried out over the nano-thick graphite electrode. The galvanostatic charge–discharge (GCD) curves after the 20th cycle at 0.5 A g−1 with a cutoff voltage of 2.42 V using the two electrolytes are shown in Fig. 4(e). The capacity in HMI-based system is ∼51 mA h g−1, in contrast with ∼109 mA h g−1 in EMI-based system, which is highly consistent with the XPS-derived TCD values (−0.11 and −0.06 per C atom for EMI- and HMI-based electrolyte respectively) at 2.4 V. This suggests that while the EMI-based electrolyte has more co-intercalation, the corresponding capacity is even higher due to the much higher concentration of the intercalated guest anions. This may be interpreted as a decrease in Coulomb repulsion between the intercalated anions assisted by the co-intercalation cations. The discharge plateau with HMICl-AlCl3 electrolyte is 1.82 V which is much lower than 2.25 V with EMICl-AlCl3 electrolyte. The contribution of the electric double layer capacitance (EDLC) has been further measured [57,58]. The EDLC of the EMI- and HMI-based electrolytes can be calculated as 22 and 13 μF cm−2 respectively based on the CV tests (Fig. S17), which can contribute capacity of 0.29 and 0.11 mA h g−1 (Fig. S18). The negligible contribution of the EDLC indicates that the differenrce of the cycling performance is owing to the distinct intercalation chemistry observed by our above operando characterization methods showing a higher intercalation stage-structure and a lower intercalation concentration in HMI-based system. The long-term cyclic performance at 0.5 A g−1 is shown in Fig. S19. Compared with the stable capacity at 110 mA h g−1 and with 95% efficiency using EMICl-AlCl3 electrolyte, the capacity of the HMI-based system increases slightly upon cycling along with the decreasing efficiency, which may be due to the side reactions caused by the internal H2O. More obvious irreversible intercalation–deintercalation can be found when the cutoff voltage is set above 2.6 V but no remarkable electrolyte decomposition occurs (Figs. S20 and S21). The online gas analysis (Fig. S22) shows that O2 appears continually upon charging in HMI-based system while almost no gaseous products can be detected in EMI-based system. Such results indicate that the residual water in the electrolytes plays a negative role since it can trigger the side reactions and lower the Coulombic efficiency [40,48]. Overall, the batteries with HMI-based electrolyte perform larger inercalation overpotential, lower ionic diffusion rate, smaller capacity, and poorer cycling performance. Based on the above results, the coordination structure effect on the intercalation chemistry can be illustrated by Scheme 1 . With a weaker anion-cation interaction, the de-solvent processes are more likely to happen in HMI-based electrolyte than EMI-based electrolyte. Such conclusions can be directly validated by using operando XPS measurements showing that the atomic ratio of the intercalated Nint/Alint is 0.9 in HMI-based electrolyte, which is lower than 1.6 in EMI-based electrolyte [39]. The additional de-solvation processes in HMI-based systems should pose an extra de-solvation energy [59–61] (Scheme 1b) during the ion transfer across the electrolyte-graphite interface and lead to a large intercalation overpotential and the sluggish diffusion process whose ionic diffusion rate is one order less than that of EMI-based systems (Scheme 1a) as revealed by operando OM measurements and CV tests. Combined with the operando XPS and EIS measuremnts, it can be unambiguously proved that the de-solvation processes is a rate-determining step of the battery and the use of the electrolyte with low coordination strength can significantly reduce the de-solvation energy [62]. In addition to the diffusion kinetics, the de-solvation in HMI-based systems also leads to the strong coulomb repulsion between the intercalated anions within graphite and thus the low capacity (∼50 mA h g−1, half of that in EMI-based electrolyte ∼ 110 mA h g−1). Furthermore, the internal H2O impurities in HMI-based electrolyte also cause the lower efficiency and poorer cycling performance. 3 Conclusions In summary, the effect of the electrolyte coordination structure on the intercalation chemistry has been extensively investigated based on the operando characterizations over model Al/HOPG batteries with EMI- or HMI-based IL electrolytes in this work. Due to the weak anion-cation interaction, the de-solvation processes in the HMI-based systems have been observed by the operando XPS measurements. Such de-solvation process further causes the sluggish intercalation kinetics and a lower capacity of the batteries. This work provides direct evidence that de-solvation is a rate-determining step in the batteries. Such methods can be extended to other energy storage systems exploring the solvation effect on the intercalation and interface chemistry in batteries. Experimental section Experimental details can be found in the Supporting Information. Declaration of competing interest The authors declare that they have no known competing financial interests or personal relationships that could have appeared to influence the work reported in this paper. Acknowledgments This work was financially supported by the National Key R&D Program of China (2021YFA1502800), the National Natural Science Foundation of China (21825203, 22288201, and 91945302), the Photon Science Center for Carbon Neutrality, LiaoNing Revitalization Talents Program (XLYC1902117), and the Youth Innovation Fund of Dalian institute of Chemical Physics (DICP I202125). The authors gratefully acknowledge Profs. X.H. Bao and Z.Q. Peng for fruitful discussions. Appendix A Supplementary material Supplementary data to this article can be found online at https://doi.org/10.1016/j.jechem.2023.02.038. Appendix A Supplementary material The following are the Supplementary data to this article: Supplementary video 1 Supplementary video 2 Supplementary data 3 References [1] M. Li C. Wang Z. Chen K. Xu J. Lu Chem. Rev. 120 2020 6783 6819 M. Li, C. Wang, Z. Chen, K. Xu, J. Lu, Chem. Rev. 120 (2020) 6783-6819. [2] K. Xu Chem. Rev. 114 2014 11503 11618 K. Xu, Chem. Rev. 114 (2014) 11503-11618. [3] K. Xu, Nat. Energy 6 (2021) 763-763. [4] A. Banerjee X. Wang C. Fang E.A. Wu Y.S. Meng Chem. Rev. 120 2020 6878 6933 A. Banerjee, X. Wang, C. Fang, E. A. Wu, Y. S. Meng, Chem. Rev. 120 (2020) 6878-6933. [5] J. Zhao X. Zhang Y. Liang Z. Han S. Liu W. Chu H. Yu ACS Energy Lett. 6 2021 2552 2564 J. Zhao, X. Zhang, Y. Liang, Z. Han, S. Liu, W. Chu, H. Yu, ACS Energy Lett. 6 (2021) 2552-2564. [6] S. Hou X. Ji K. Gaskell P.-F. Wang L. Wang J. Xu R. Sun O. Borodin C. Wang Science 374 2021 172 178 S. Hou, X. Ji, K. Gaskell, P.-f. Wang, L. Wang, J. Xu, R. Sun, O. Borodin, C. Wang, Science 374 (2021) 172-178. [7] Y. Yamada A. Yamada J. Electrochem. Soc. 162 2015 A2406 Y. Yamada, A. Yamada, J. Electrochem. Soc. 162 (2015) A2406. [8] L. Suo O. Borodin T. Gao M. Olguin J. Ho X. Fan C. Luo C. Wang K. Xu Science 350 2015 938 943 L. Suo, O. Borodin, T. Gao, M. Olguin, J. Ho, X. Fan, C. Luo, C. Wang, K. Xu, Science 350 (2015) 938-943. [9] Y. Yamada K. Furukawa K. Sodeyama K. Kikuchi M. Yaegashi Y. Tateyama A. Yamada J. Am. Chem. Soc. 136 2014 5039 5046 Y. Yamada, K. Furukawa, K. Sodeyama, K. Kikuchi, M. Yaegashi, Y. Tateyama, A. Yamada, J. Am. Chem. Soc. 136 (2014) 5039-5046. [10] D. Lu J. Tao P. Yan W.A. Henderson Q. Li Y. Shao M.L. Helm O. Borodin G.L. Graff B. Polzin Nano Lett. 17 2017 1602 1609 D. Lu, J. Tao, P. Yan, W. A. Henderson, Q. Li, Y. Shao, M. L. Helm, O. Borodin, G. L. Graff, B. Polzin, Nano Lett. 17 (2017) 1602-1609. [11] S. Li C. Wang C. Meng Y. Ning G. Zhang Q. Fu J. Energy Chem. 67 2022 718 726 S. Li, C. Wang, C. Meng, Y. Ning, G. Zhang, Q. Fu, J. Energy Chem. 67 (2022) 718-726. [12] L. Yu H. Liu Y. Wang N. Kuwata M. Osawa J. Kawamura S. Ye Angew. Chem. Int. Ed. 125 2013 5865 5868 L. Yu, H. Liu, Y. Wang, N. Kuwata, M. Osawa, J. Kawamura, S. Ye, Angew. Chem. Int. Ed. 125 (2013) 5865-5868. [13] Z. Zhang L. Hu H. Wu W. Weng M. Koh P.C. Redfern L.A. Curtiss K. Amine Energy Environ. Sci. 6 2013 1806 1810 Z. Zhang, L. Hu, H. Wu, W. Weng, M. Koh, P. C. Redfern, L. A. Curtiss, K. Amine, Energy Environ. Sci. 6 (2013) 1806-1810. [14] J. Ming Z. Cao Q. Li W. Wahyudi W. Wang L. Cavallo K.-J. Park Y.-K. Sun H.N. Alshareef ACS Energy Lett. 4 2019 1584 1593 J. Ming, Z. Cao, Q. Li, W. Wahyudi, W. Wang, L. Cavallo, K.-J. Park, Y.-K. Sun, H. N. Alshareef, ACS Energy Lett. 4 (2019) 1584-1593. [15] S.S. Zhang Electrochem. Commun. 8 2006 1423 1428 S. S. Zhang, Electrochem. Commun. 8 (2006) 1423-1428. [16] S. Tan Z. Shadike J. Li X. Wang Y. Yang R. Lin A. Cresce J. Hu A. Hunt I. Waluyo Nat. Energy 2022 1 11 S. Tan, Z. Shadike, J. Li, X. Wang, Y. Yang, R. Lin, A. Cresce, J. Hu, A. Hunt, I. Waluyo, Nat. Energy (2022) 1-11. [17] A.M. Haregewoin A.S. Wotango B.-J. Hwang Energy Environ. Sci. 9 2016 1955 1988 A. M. Haregewoin, A. S. Wotango, B.-J. Hwang, Energy Environ. Sci. 9 (2016) 1955-1988. [18] D. Aurbach M.D. Levi E. Levi A. Schechter J. Phys. Chem. B 101 1997 2195 2206 D. Aurbach, M. D. Levi, E. Levi, A. Schechter, J. Phys. Chem. B 101 (1997) 2195-2206. [19] D. Aurbach K. Gamolsky B. Markovsky Y. Gofer M. Schmidt U. Heider Electrochim. Acta 47 2002 1423 1439 D. Aurbach, K. Gamolsky, B. Markovsky, Y. Gofer, M. Schmidt, U. Heider, Electrochim. Acta 47 (2002) 1423-1439. [20] J. Ming Z. Cao Y. Wu W. Wahyudi W. Wang X. Guo L. Cavallo J.-Y. Hwang A. Shamim L.-J. Li ACS Energy Lett. 4 2019 2613 2622 J. Ming, Z. Cao, Y. Wu, W. Wahyudi, W. Wang, X. Guo, L. Cavallo, J.-Y. Hwang, A. Shamim, L.-J. Li, ACS Energy Lett. 4 (2019) 2613-2622. [21] J. Ming Z. Cao W. Wahyudi M. Li P. Kumar Y. Wu J.-Y. Hwang M.N. Hedhili L. Cavallo Y.-K. Sun ACS Energy Lett. 3 2018 335 340 J. Ming, Z. Cao, W. Wahyudi, M. Li, P. Kumar, Y. Wu, J.-Y. Hwang, M. N. Hedhili, L. Cavallo, Y.-K. Sun, ACS Energy Lett. 3 (2018) 335-340. [22] H. Cheng Q. Sun L. Li Y. Zou Y. Wang T. Cai F. Zhao G. Liu Z. Ma W. Wahyudi ACS Energy Lett. 7 2022 490 513 H. Cheng, Q. Sun, L. Li, Y. Zou, Y. Wang, T. Cai, F. Zhao, G. Liu, Z. Ma, W. Wahyudi, ACS Energy Lett. 7 (2022) 490-513. [23] Y.X. Yao X. Chen C. Yan X.Q. Zhang W.L. Cai J.Q. Huang Q. Zhang Angew. Chem. Int. Ed. 60 2021 4090 4097 Y. X. Yao, X. Chen, C. Yan, X. Q. Zhang, W. L. Cai, J. Q. Huang, Q. Zhang, Angew. Chem. Int. Ed. 60 (2021) 4090-4097. [24] X. Liu X. Shen H. Li P. Li L. Luo H. Fan X. Feng W. Chen X. Ai H. Yang Adv. Energy Mater. 11 2021 2003905 X. Liu, X. Shen, H. Li, P. Li, L. Luo, H. Fan, X. Feng, W. Chen, X. Ai, H. Yang, Adv. Energy Mater. 11 (2021) 2003905. [25] M.L. Divya Y.-S. Lee V. Aravindan ACS Energy Lett. 6 2021 4228 4244 M. L. Divya, Y.-S. Lee, V. Aravindan, ACS Energy Lett. 6 (2021) 4228-4244. [26] Z. Tian Y. Zou G. Liu Y. Wang J. Yin J. Ming H.N. Alshareef Adv. Sci. 2022 2201207 Z. Tian, Y. Zou, G. Liu, Y. Wang, J. Yin, J. Ming, H. N. Alshareef, Adv. Sci. (2022) 2201207. [27] L. Seidl N. Bucher E. Chu S. Hartung S. Martens O. Schneider U. Stimming Energy Environ. Sci. 10 2017 1631 1642 L. Seidl, N. Bucher, E. Chu, S. Hartung, S. Martens, O. Schneider, U. Stimming, Energy Environ. Sci. 10 (2017) 1631-1642. [28] L. Li L. Liu Z. Hu Y. Lu Q. Liu S. Jin Q. Zhang S. Zhao S.L. Chou Angew. Chem. Int. Ed. 59 2020 12917 12924 L. Li, L. Liu, Z. Hu, Y. Lu, Q. Liu, S. Jin, Q. Zhang, S. Zhao, S. L. Chou, Angew. Chem. Int. Ed. 59 (2020) 12917-12924. [29] P.N. Le Pham V. Gabaudan A. Boulaoued G. Åvall F. Salles P. Johansson L. Monconduit L. Stievano Energy Stor. Mater. 45 2022 291 300 P. N. Le Pham, V. Gabaudan, A. Boulaoued, G. Åvall, F. Salles, P. Johansson, L. Monconduit, L. Stievano, Energy Stor. Mater. 45 (2022) 291-300. [30] J. Xu Y. Dou Z. Wei J. Ma Y. Deng Y. Li H. Liu S. Dou Adv. Sci. 4 2017 1700146 J. Xu, Y. Dou, Z. Wei, J. Ma, Y. Deng, Y. Li, H. Liu, S. Dou, Adv. Sci. 4 (2017) 1700146. [31] L. Zhang H. Wang ACS Appl. Mater. Interfaces 12 2020 47647 47654 L. Zhang, H. Wang, ACS Appl. Mater. Interfaces 12 (2020) 47647-47654. [32] X. Ou D. Gong C. Han Z. Liu Y. Tang Adv. Energy Mater. 11 2021 2102498 X. Ou, D. Gong, C. Han, Z. Liu, Y. Tang, Adv. Energy Mater. 11 (2021) 2102498. [33] X. Wang A.Y. Mehandzhiyski B. Arstad K.L. Van Aken T.S. Mathis A. Gallegos Z. Tian D. Ren E. Sheridan B.A. Grimes J. Am. Chem. Soc. 139 2017 18681 18687 X. Wang, A. Y. Mehandzhiyski, B. Arstad, K. L. Van Aken, T. S. Mathis, A. Gallegos, Z. Tian, D. Ren, E. Sheridan, B. A. Grimes, J. Am. Chem. Soc. 139 (2017) 18681-18687. [34] P. Ge M. Fouletier Solid State Ion. 28 1988 1172 1175 P. Ge, M. Fouletier, Solid State Ion. 28 (1988) 1172-1175. [35] B. Jache P. Adelhelm Angew. Chem. Int. Ed. 126 2014 10333 10337 B. Jache, P. Adelhelm, Angew. Chem. Int. Ed. 126 (2014) 10333-10337. [36] H. Kim J. Hong G. Yoon H. Kim K.-Y. Park M.-S. Park W.-S. Yoon K. Kang Energy Environ. Sci. 8 2015 2963 2969 H. Kim, J. Hong, G. Yoon, H. Kim, K.-Y. Park, M.-S. Park, W.-S. Yoon, K. Kang, Energy Environ. Sci. 8 (2015) 2963-2969. [37] A.P. Cohn K. Share R. Carter L. Oakes C.L. Pint Nano Lett. 16 2016 543 548 A. P. Cohn, K. Share, R. Carter, L. Oakes, C. L. Pint, Nano Lett. 16 (2016) 543-548. [38] G. Yoon H. Kim I. Park K. Kang Adv. Energy Mater. 7 2017 1601519 G. Yoon, H. Kim, I. Park, K. Kang, Adv. Energy Mater. 7 (2017) 1601519. [39] C. Wang Y. Ning H. Huang S. Li C. Xiao Q. Chen L. Peng S. Guo Y. Li C. Liu Natl Sci. Rev. 8 2021 nwaa289 Wang C., Ning Y., Huang H., Li S., Xiao C., Chen Q., Peng L., Guo S., Li Y., Liu C., Natl Sci. Rev. 8 (2021) nwaa289. [40] M.-C. Lin M. Gong B. Lu Y. Wu D.-Y. Wang M. Guan M. Angell C. Chen J. Yang B.-J. Hwang Nature 520 2015 324 328 M.-C. Lin, M. Gong, B. Lu, Y. Wu, D.-Y. Wang, M. Guan, M. Angell, C. Chen, J. Yang, B.-J. Hwang, Nature 520 (2015) 324-328. [41] H. Chen H. Xu S. Wang T. Huang J. Xi S. Cai F. Guo Z. Xu W. Gao C. Gao Sci. Adv. 3 2017 eaao7233 Chen H., Xu H., Wang S., Huang T., Xi J., Cai S., Guo F., Xu Z., Gao W., Gao C., Sci. Adv. 3 (2017) eaao7233. [42] S. Men K.R. Lovelock P. Licence Phys. Chem. Chem. Phys. 13 2011 15244 15255 S. Men, K. R. Lovelock, P. Licence, Phys. Chem. Chem. Phys 13 (2011) 15244-15255. [43] T. Cremer C. Kolbeck K.R. Lovelock N. Paape R. Wölfel P.S. Schulz P. Wasserscheid H. Weber J. Thar B. Kirchner Chem. Eur. J. 16 2010 9018 9033 T. Cremer, C. Kolbeck, K. R. Lovelock, N. Paape, R. Wölfel, P. S. Schulz, P. Wasserscheid, H. Weber, J. Thar, B. Kirchner, Chem. Eur. J. 16 (2010) 9018-9033. [44] K. Lovelock C. Kolbeck T. Cremer N. Paape P. Schulz P. Wasserscheid F. Maier H.-P. Steinruck J. Phys. Chem. B 113 2009 2854 2864 K. Lovelock, C. Kolbeck, T. Cremer, N. Paape, P. Schulz, P. Wasserscheid, F. Maier, H.-P. Steinruck, J. Phys. Chem. B 113 (2009) 2854-2864. [45] A.M. Fernandes M.A. Rocha M.G. Freire I.M. Marrucho J.A. Coutinho L.M. Santos J. Phys. Chem. B 115 2011 4033 4041 A. M. Fernandes, M. A. Rocha, M. G. Freire, I. M. Marrucho, J. A. Coutinho, L. M. Santos, J. Phys. Chem. B 115 (2011) 4033-4041. [46] R. Bini O. Bortolini C. Chiappe D. Pieraccini T. Siciliano J. Phys. Chem. B 111 2007 598 604 R. Bini, O. Bortolini, C. Chiappe, D. Pieraccini, T. Siciliano, J. Phys. Chem. B 111 (2007) 598-604. [47] E. Sloutskin B.M. Ocko L. Tamam I. Kuzmenko T. Gog M. Deutsch J. Am. Chem. Soc. 127 2005 7796 7804 E. Sloutskin, B. M. Ocko, L. Tamam, I. Kuzmenko, T. Gog, M. Deutsch, J. Am. Chem. Soc 127 (2005) 7796-7804. [48] C. Wang C. Meng S. Li G. Zhang Y. Ning Q. Fu J. Am. Chem. Soc. 143 2021 17843 17850 C. Wang, C. Meng, S. Li, G. Zhang, Y. Ning, Q. Fu, J. Am. Chem. Soc. 143 (2021) 17843-17850. [49] C.-J. Pan C. Yuan G. Zhu Q. Zhang C.-J. Huang M.-C. Lin M. Angell B.-J. Hwang P. Kaghazchi H. Dai Proc. Natl. Acad. Sci. U.S.A. 115 2018 5670 5675 C.-J. Pan, C. Yuan, G. Zhu, Q. Zhang, C.-J. Huang, M.-C. Lin, M. Angell, B.-J. Hwang, P. Kaghazchi, H. Dai, Proc. Natl. Acad. Sci. U.S.A. 115 (2018) 5670-5675. [50] G. Schmuelling T. Placke R. Kloepsch O. Fromm H.-W. Meyer S. Passerini M. Winter J. Power Sources 239 2013 563 571 G. Schmuelling, T. Placke, R. Kloepsch, O. Fromm, H.-W. Meyer, S. Passerini, M. Winter, J. Power Sources 239 (2013) 563-571. [51] D.-Y. Wang S.-K. Huang H.-J. Liao Y.-M. Chen S.-W. Wang Y.-T. Kao J.-Y. An Y.-C. Lee C.-H. Chuang Y.-C. Huang Carbon 146 2019 528 534 D.-Y. Wang, S.-K. Huang, H.-J. Liao, Y.-M. Chen, S.-W. Wang, Y.-T. Kao, J.-Y. An, Y.-C. Lee, C.-H. Chuang, Y.-C. Huang, Carbon 146 (2019) 528-534. [52] B. Schnyder D. Alliata R. Kötz H. Siegenthaler Appl. Surf. Sci. 173 2001 221 232 B. Schnyder, D. Alliata, R. Kötz, H. Siegenthaler, Appl. Surf. Sci 173 (2001) 221-232. [53] A. Foelske-Schmitz D. Weingarth H. Kaiser R. Kötz Electrochem. Commun. 12 2010 1453 1456 A. Foelske-Schmitz, D. Weingarth, H. Kaiser, R. Kötz, Electrochem. Commun. 12 (2010) 1453-1456. [54] W. Bao J. Wan X. Han X. Cai H. Zhu D. Kim D. Ma Y. Xu J.N. Munday H.D. Drew Nat. Commun. 5 2014 4224 W. Bao, J. Wan, X. Han, X. Cai, H. Zhu, D. Kim, D. Ma, Y. Xu, J. N. Munday, H. D. Drew, Nat. Commun. 5 (2014) 4224. [55] J. Zhi A.Z. Yazdi G. Valappil J. Haime P. Chen Sci. Adv. 3 2017 e1701010 J. Zhi, A. Z. Yazdi, G. Valappil, J. Haime, P. Chen, Sci. Adv. 3 (2017) e1701010. [56] K. Hayamizu Y. Aihara H. Nakagawa T. Nukuda W.S. Price J. Phys. Chem. B 108 2004 19527 19532 K. Hayamizu, Y. Aihara, H. Nakagawa, T. Nukuda, W. S. Price, J. Phys. Chem. B 108 (2004) 19527-19532. [57] M.V. Fedorov A.A. Kornyshev Chem. Rev. 114 2014 2978 3036 M. V. Fedorov, A. A. Kornyshev, Chem. Rev. 114 (2014) 2978-3036. [58] Y. Zheng Y. Zheng C. Peng Z. Zhao D. Tian Int. J. Electrochem. Sci. 11 2016 9585 9598 Y. Zheng, Y. Zheng, C. Peng, Z. Zhao, D. Tian, Int. J. Electrochem. Sci 11 (2016) 9585-9598. [59] K. Xu A. von Cresce U. Lee Langmuir 26 2010 11538 11543 K. Xu, A. von Cresce, U. Lee, Langmuir 26 (2010) 11538-11543. [60] T. Abe H. Fukuda Y. Iriyama Z. Ogumi J. Electrochem. Soc. 151 2004 A1120 T. Abe, H. Fukuda, Y. Iriyama, Z. Ogumi, J. Electrochem. Soc. 151 (2004) A1120. [61] Y. Kondo T. Abe Y. Yamada ACS Appl. Mater. Interfaces 14 2022 22706 22718 Y. Kondo, T. Abe, Y. Yamada, ACS Appl. Mater. Interfaces 14 (2022) 22706–22718. [62] Y.S. Meng V. Srinivasan K. Xu Science 378 2022 eabq3750 Y. S. Meng, V. Srinivasan, K. Xu, Science 378 (2022) eabq3750",
      "scopus-id": "85150424232",
      "coredata": {
        "eid": "1-s2.0-S2095495623001389",
        "dc:description": "In-depth understanding of the electrolyte-dependent intercalation chemistry in batteries through direct operando/in situ characterizations is crucial for the development of the high-performance batteries. Herein, taking the Al/graphite battery as a model system, the effect of electrolyte coordination structure on the intercalation processes has been investigated over the batteries with either 1-hexyl-3-methylimidazolium chloride (HMICl)-AlCl3 or 1-ethyl-3-methylimidazolium chloride (EMICl)-AlCl3 ionic liquid electrolyte using operando X-ray photoelectron spectroscopy (XPS) and X-ray diffraction. With a weaker anion-cation interaction in HMI-based electrolyte, the XPS-derived atomic ratio between co-intercalated N and intercalated Al is 0.9, which is lower than 1.6 for EMI-based electrolyte. Attributed to the additional de-solvation process, the batteries with the HMI-based electrolyte show a lower ionic diffusion rate, capacity, and cycling performance, which agree with the operando characterization results. Our findings highlight the critical role of the electrolyte coordination structure on the (co–)intercalation chemistry.",
        "openArchiveArticle": "false",
        "prism:coverDate": "2023-06-30",
        "openaccessUserLicense": null,
        "prism:aggregationType": "Journal",
        "prism:url": "https://api.elsevier.com/content/article/pii/S2095495623001389",
        "dc:creator": [
          {
            "@_fa": "true",
            "$": "Wang, Chao"
          },
          {
            "@_fa": "true",
            "$": "Li, Xianjin"
          },
          {
            "@_fa": "true",
            "$": "Zhong, Guiming"
          },
          {
            "@_fa": "true",
            "$": "Meng, Caixia"
          },
          {
            "@_fa": "true",
            "$": "Li, Shiwen"
          },
          {
            "@_fa": "true",
            "$": "Zhang, Guohui"
          },
          {
            "@_fa": "true",
            "$": "Ning, Yanxiao"
          },
          {
            "@_fa": "true",
            "$": "Li, Xianfeng"
          },
          {
            "@_fa": "true",
            "$": "Fu, Qiang"
          }
        ],
        "link": [
          {
            "@_fa": "true",
            "@rel": "self",
            "@href": "https://api.elsevier.com/content/article/pii/S2095495623001389"
          },
          {
            "@_fa": "true",
            "@rel": "scidir",
            "@href": "https://www.sciencedirect.com/science/article/pii/S2095495623001389"
          }
        ],
        "dc:format": "application/json",
        "openaccessType": null,
        "pii": "S2095-4956(23)00138-9",
        "prism:volume": "81",
        "prism:publisher": "Science Press and Dalian Institute of Chemical Physics, Chinese Academy of Sciences. Published by ELSEVIER B.V. and Science Press.",
        "dc:title": "Revealing the effect of electrolyte coordination structures on the intercalation chemistry of batteries",
        "prism:copyright": "© 2023 Science Press and Dalian Institute of Chemical Physics, Chinese Academy of Sciences. Published by ELSEVIER B.V. and Science Press. All rights reserved.",
        "openaccess": "0",
        "prism:issn": "20954956",
        "dcterms:subject": [
          {
            "@_fa": "true",
            "$": "Operando surface characterization"
          },
          {
            "@_fa": "true",
            "$": "Electrolyte coordination structure"
          },
          {
            "@_fa": "true",
            "$": "De-solvation"
          },
          {
            "@_fa": "true",
            "$": "Intercalation chemistry"
          }
        ],
        "openaccessArticle": "false",
        "prism:publicationName": "Journal of Energy Chemistry",
        "openaccessSponsorType": null,
        "prism:pageRange": "149-156",
        "prism:endingPage": "156",
        "pubType": "fla",
        "prism:coverDisplayDate": "June 2023",
        "prism:doi": "10.1016/j.jechem.2023.02.038",
        "prism:startingPage": "149",
        "dc:identifier": "doi:10.1016/j.jechem.2023.02.038",
        "openaccessSponsorName": null
      },
      "objects": {
        "object": [
          {
            "@category": "standard",
            "@height": "321",
            "@width": "667",
            "@_fa": "true",
            "$": "https://api.elsevier.com/content/object/eid/1-s2.0-S2095495623001389-gr2.jpg?httpAccept=%2A%2F%2A",
            "@multimediatype": "JPEG image file",
            "@type": "IMAGE-DOWNSAMPLED",
            "@size": "60444",
            "@ref": "gr2",
            "@mimetype": "image/jpeg"
          },
          {
            "@category": "standard",
            "@height": "488",
            "@width": "622",
            "@_fa": "true",
            "$": "https://api.elsevier.com/content/object/eid/1-s2.0-S2095495623001389-gr3.jpg?httpAccept=%2A%2F%2A",
            "@multimediatype": "JPEG image file",
            "@type": "IMAGE-DOWNSAMPLED",
            "@size": "102716",
            "@ref": "gr3",
            "@mimetype": "image/jpeg"
          },
          {
            "@category": "standard",
            "@height": "866",
            "@width": "667",
            "@_fa": "true",
            "$": "https://api.elsevier.com/content/object/eid/1-s2.0-S2095495623001389-gr4.jpg?httpAccept=%2A%2F%2A",
            "@multimediatype": "JPEG image file",
            "@type": "IMAGE-DOWNSAMPLED",
            "@size": "136131",
            "@ref": "gr4",
            "@mimetype": "image/jpeg"
          },
          {
            "@category": "standard",
            "@height": "511",
            "@width": "578",
            "@_fa": "true",
            "$": "https://api.elsevier.com/content/object/eid/1-s2.0-S2095495623001389-gr5.jpg?httpAccept=%2A%2F%2A",
            "@multimediatype": "JPEG image file",
            "@type": "IMAGE-DOWNSAMPLED",
            "@size": "81280",
            "@ref": "gr5",
            "@mimetype": "image/jpeg"
          },
          {
            "@category": "standard",
            "@height": "200",
            "@width": "425",
            "@_fa": "true",
            "$": "https://api.elsevier.com/content/object/eid/1-s2.0-S2095495623001389-ga1.jpg?httpAccept=%2A%2F%2A",
            "@multimediatype": "JPEG image file",
            "@type": "IMAGE-DOWNSAMPLED",
            "@size": "25646",
            "@ref": "ga1",
            "@mimetype": "image/jpeg"
          },
          {
            "@category": "standard",
            "@height": "271",
            "@width": "482",
            "@_fa": "true",
            "$": "https://api.elsevier.com/content/object/eid/1-s2.0-S2095495623001389-alt1.jpg?httpAccept=%2A%2F%2A",
            "@multimediatype": "JPEG image file",
            "@type": "IMAGE-DOWNSAMPLED",
            "@size": "43840",
            "@ref": "alt1",
            "@mimetype": "image/jpeg"
          },
          {
            "@category": "standard",
            "@height": "271",
            "@width": "482",
            "@_fa": "true",
            "$": "https://api.elsevier.com/content/object/eid/1-s2.0-S2095495623001389-alt2.jpg?httpAccept=%2A%2F%2A",
            "@multimediatype": "JPEG image file",
            "@type": "IMAGE-DOWNSAMPLED",
            "@size": "36540",
            "@ref": "alt2",
            "@mimetype": "image/jpeg"
          },
          {
            "@category": "standard",
            "@height": "777",
            "@width": "667",
            "@_fa": "true",
            "$": "https://api.elsevier.com/content/object/eid/1-s2.0-S2095495623001389-gr1.jpg?httpAccept=%2A%2F%2A",
            "@multimediatype": "JPEG image file",
            "@type": "IMAGE-DOWNSAMPLED",
            "@size": "124025",
            "@ref": "gr1",
            "@mimetype": "image/jpeg"
          },
          {
            "@category": "thumbnail",
            "@height": "105",
            "@width": "219",
            "@_fa": "true",
            "$": "https://api.elsevier.com/content/object/eid/1-s2.0-S2095495623001389-gr2.sml?httpAccept=%2A%2F%2A",
            "@multimediatype": "GIF image file",
            "@type": "IMAGE-THUMBNAIL",
            "@size": "9878",
            "@ref": "gr2",
            "@mimetype": "image/gif"
          },
          {
            "@category": "thumbnail",
            "@height": "164",
            "@width": "209",
            "@_fa": "true",
            "$": "https://api.elsevier.com/content/object/eid/1-s2.0-S2095495623001389-gr3.sml?httpAccept=%2A%2F%2A",
            "@multimediatype": "GIF image file",
            "@type": "IMAGE-THUMBNAIL",
            "@size": "14390",
            "@ref": "gr3",
            "@mimetype": "image/gif"
          },
          {
            "@category": "thumbnail",
            "@height": "164",
            "@width": "126",
            "@_fa": "true",
            "$": "https://api.elsevier.com/content/object/eid/1-s2.0-S2095495623001389-gr4.sml?httpAccept=%2A%2F%2A",
            "@multimediatype": "GIF image file",
            "@type": "IMAGE-THUMBNAIL",
            "@size": "9791",
            "@ref": "gr4",
            "@mimetype": "image/gif"
          },
          {
            "@category": "thumbnail",
            "@height": "164",
            "@width": "185",
            "@_fa": "true",
            "$": "https://api.elsevier.com/content/object/eid/1-s2.0-S2095495623001389-gr5.sml?httpAccept=%2A%2F%2A",
            "@multimediatype": "GIF image file",
            "@type": "IMAGE-THUMBNAIL",
            "@size": "10128",
            "@ref": "gr5",
            "@mimetype": "image/gif"
          },
          {
            "@category": "thumbnail",
            "@height": "103",
            "@width": "219",
            "@_fa": "true",
            "$": "https://api.elsevier.com/content/object/eid/1-s2.0-S2095495623001389-ga1.sml?httpAccept=%2A%2F%2A",
            "@multimediatype": "GIF image file",
            "@type": "IMAGE-THUMBNAIL",
            "@size": "9440",
            "@ref": "ga1",
            "@mimetype": "image/gif"
          },
          {
            "@category": "thumbnail",
            "@height": "123",
            "@width": "219",
            "@_fa": "true",
            "$": "https://api.elsevier.com/content/object/eid/1-s2.0-S2095495623001389-alt1.sml?httpAccept=%2A%2F%2A",
            "@multimediatype": "GIF image file",
            "@type": "IMAGE-THUMBNAIL",
            "@size": "23119",
            "@ref": "alt1",
            "@mimetype": "image/gif"
          },
          {
            "@category": "thumbnail",
            "@height": "123",
            "@width": "219",
            "@_fa": "true",
            "$": "https://api.elsevier.com/content/object/eid/1-s2.0-S2095495623001389-alt2.sml?httpAccept=%2A%2F%2A",
            "@multimediatype": "GIF image file",
            "@type": "IMAGE-THUMBNAIL",
            "@size": "24242",
            "@ref": "alt2",
            "@mimetype": "image/gif"
          },
          {
            "@category": "thumbnail",
            "@height": "163",
            "@width": "140",
            "@_fa": "true",
            "$": "https://api.elsevier.com/content/object/eid/1-s2.0-S2095495623001389-gr1.sml?httpAccept=%2A%2F%2A",
            "@multimediatype": "GIF image file",
            "@type": "IMAGE-THUMBNAIL",
            "@size": "9094",
            "@ref": "gr1",
            "@mimetype": "image/gif"
          },
          {
            "@category": "high",
            "@height": "1422",
            "@width": "2953",
            "@_fa": "true",
            "$": "https://api.elsevier.com/content/object/eid/1-s2.0-S2095495623001389-gr2_lrg.jpg?httpAccept=%2A%2F%2A",
            "@multimediatype": "JPEG image file",
            "@type": "IMAGE-HIGH-RES",
            "@size": "378078",
            "@ref": "gr2",
            "@mimetype": "image/jpeg"
          },
          {
            "@category": "high",
            "@height": "2162",
            "@width": "2756",
            "@_fa": "true",
            "$": "https://api.elsevier.com/content/object/eid/1-s2.0-S2095495623001389-gr3_lrg.jpg?httpAccept=%2A%2F%2A",
            "@multimediatype": "JPEG image file",
            "@type": "IMAGE-HIGH-RES",
            "@size": "588370",
            "@ref": "gr3",
            "@mimetype": "image/jpeg"
          },
          {
            "@category": "high",
            "@height": "3832",
            "@width": "2953",
            "@_fa": "true",
            "$": "https://api.elsevier.com/content/object/eid/1-s2.0-S2095495623001389-gr4_lrg.jpg?httpAccept=%2A%2F%2A",
            "@multimediatype": "JPEG image file",
            "@type": "IMAGE-HIGH-RES",
            "@size": "769110",
            "@ref": "gr4",
            "@mimetype": "image/jpeg"
          },
          {
            "@category": "high",
            "@height": "2262",
            "@width": "2559",
            "@_fa": "true",
            "$": "https://api.elsevier.com/content/object/eid/1-s2.0-S2095495623001389-gr5_lrg.jpg?httpAccept=%2A%2F%2A",
            "@multimediatype": "JPEG image file",
            "@type": "IMAGE-HIGH-RES",
            "@size": "414869",
            "@ref": "gr5",
            "@mimetype": "image/jpeg"
          },
          {
            "@category": "high",
            "@height": "886",
            "@width": "1883",
            "@_fa": "true",
            "$": "https://api.elsevier.com/content/object/eid/1-s2.0-S2095495623001389-ga1_lrg.jpg?httpAccept=%2A%2F%2A",
            "@multimediatype": "JPEG image file",
            "@type": "IMAGE-HIGH-RES",
            "@size": "139783",
            "@ref": "ga1",
            "@mimetype": "image/jpeg"
          },
          {
            "@category": "high",
            "@height": "720",
            "@width": "1280",
            "@_fa": "true",
            "$": "https://api.elsevier.com/content/object/eid/1-s2.0-S2095495623001389-alt1_lrg.jpg?httpAccept=%2A%2F%2A",
            "@multimediatype": "JPEG image file",
            "@type": "IMAGE-HIGH-RES",
            "@size": "135279",
            "@ref": "alt1",
            "@mimetype": "image/jpeg"
          },
          {
            "@category": "high",
            "@height": "720",
            "@width": "1280",
            "@_fa": "true",
            "$": "https://api.elsevier.com/content/object/eid/1-s2.0-S2095495623001389-alt2_lrg.jpg?httpAccept=%2A%2F%2A",
            "@multimediatype": "JPEG image file",
            "@type": "IMAGE-HIGH-RES",
            "@size": "111590",
            "@ref": "alt2",
            "@mimetype": "image/jpeg"
          },
          {
            "@category": "high",
            "@height": "3442",
            "@width": "2953",
            "@_fa": "true",
            "$": "https://api.elsevier.com/content/object/eid/1-s2.0-S2095495623001389-gr1_lrg.jpg?httpAccept=%2A%2F%2A",
            "@multimediatype": "JPEG image file",
            "@type": "IMAGE-HIGH-RES",
            "@size": "769312",
            "@ref": "gr1",
            "@mimetype": "image/jpeg"
          },
          {
            "@category": "standard",
            "@_fa": "true",
            "$": "https://api.elsevier.com/content/object/eid/1-s2.0-S2095495623001389-mmc3.docx?httpAccept=%2A%2F%2A",
            "@multimediatype": "Microsoft Word file",
            "@type": "APPLICATION",
            "@size": "2715912",
            "@ref": "mmc3",
            "@mimetype": "application/word"
          },
          {
            "@category": "standard",
            "@_fa": "true",
            "$": "https://api.elsevier.com/content/object/eid/1-s2.0-S2095495623001389-mmc1.mp4?httpAccept=%2A%2F%2A",
            "@multimediatype": "MPEG-4 movie",
            "@type": "VIDEO",
            "@size": "4116434",
            "@ref": "mmc1",
            "@mimetype": "video/mp4"
          },
          {
            "@category": "standard",
            "@_fa": "true",
            "$": "https://api.elsevier.com/content/object/eid/1-s2.0-S2095495623001389-mmc2.mp4?httpAccept=%2A%2F%2A",
            "@multimediatype": "MPEG-4 movie",
            "@type": "VIDEO",
            "@size": "471773",
            "@ref": "mmc2",
            "@mimetype": "video/mp4"
          },
          {
            "@category": "standard",
            "@height": "271",
            "@width": "482",
            "@_fa": "true",
            "$": "https://api.elsevier.com/content/object/eid/1-s2.0-S2095495623001389-mmc1.jpg?httpAccept=%2A%2F%2A",
            "@multimediatype": "JPEG image file",
            "@type": "IMAGE-MMC-DOWNSAMPLED",
            "@size": "43840",
            "@ref": "mmc1",
            "@mimetype": "image/jpeg"
          },
          {
            "@category": "standard",
            "@height": "271",
            "@width": "482",
            "@_fa": "true",
            "$": "https://api.elsevier.com/content/object/eid/1-s2.0-S2095495623001389-mmc2.jpg?httpAccept=%2A%2F%2A",
            "@multimediatype": "JPEG image file",
            "@type": "IMAGE-MMC-DOWNSAMPLED",
            "@size": "36540",
            "@ref": "mmc2",
            "@mimetype": "image/jpeg"
          },
          {
            "@category": "thumbnail",
            "@height": "123",
            "@width": "219",
            "@_fa": "true",
            "$": "https://api.elsevier.com/content/object/eid/1-s2.0-S2095495623001389-mmc1.sml?httpAccept=%2A%2F%2A",
            "@multimediatype": "GIF image file",
            "@type": "IMAGE-MMC-THUMBNAIL",
            "@size": "23119",
            "@ref": "mmc1",
            "@mimetype": "image/gif"
          },
          {
            "@category": "thumbnail",
            "@height": "123",
            "@width": "219",
            "@_fa": "true",
            "$": "https://api.elsevier.com/content/object/eid/1-s2.0-S2095495623001389-mmc2.sml?httpAccept=%2A%2F%2A",
            "@multimediatype": "GIF image file",
            "@type": "IMAGE-MMC-THUMBNAIL",
            "@size": "24242",
            "@ref": "mmc2",
            "@mimetype": "image/gif"
          },
          {
            "@category": "thumbnail",
            "@_fa": "true",
            "$": "https://api.elsevier.com/content/object/eid/1-s2.0-S2095495623001389-si1.svg?httpAccept=%2A%2F%2A",
            "@multimediatype": "Scalable Vector Graphics file",
            "@type": "ALTIMG",
            "@size": "4016",
            "@ref": "si1",
            "@mimetype": "image/svg+xml"
          },
          {
            "@category": "thumbnail",
            "@_fa": "true",
            "$": "https://api.elsevier.com/content/object/eid/1-s2.0-S2095495623001389-si2.svg?httpAccept=%2A%2F%2A",
            "@multimediatype": "Scalable Vector Graphics file",
            "@type": "ALTIMG",
            "@size": "6506",
            "@ref": "si2",
            "@mimetype": "image/svg+xml"
          },
          {
            "@category": "thumbnail",
            "@_fa": "true",
            "$": "https://api.elsevier.com/content/object/eid/1-s2.0-S2095495623001389-si3.svg?httpAccept=%2A%2F%2A",
            "@multimediatype": "Scalable Vector Graphics file",
            "@type": "ALTIMG",
            "@size": "15562",
            "@ref": "si3",
            "@mimetype": "image/svg+xml"
          },
          {
            "@category": "thumbnail",
            "@_fa": "true",
            "$": "https://api.elsevier.com/content/object/eid/1-s2.0-S2095495623001389-si4.svg?httpAccept=%2A%2F%2A",
            "@multimediatype": "Scalable Vector Graphics file",
            "@type": "ALTIMG",
            "@size": "9575",
            "@ref": "si4",
            "@mimetype": "image/svg+xml"
          },
          {
            "@category": "thumbnail",
            "@_fa": "true",
            "$": "https://api.elsevier.com/content/object/eid/1-s2.0-S2095495623001389-si5.svg?httpAccept=%2A%2F%2A",
            "@multimediatype": "Scalable Vector Graphics file",
            "@type": "ALTIMG",
            "@size": "1607",
            "@ref": "si5",
            "@mimetype": "image/svg+xml"
          },
          {
            "@category": "standard",
            "@_fa": "true",
            "$": "https://api.elsevier.com/content/object/eid/1-s2.0-S2095495623001389-am.pdf?httpAccept=%2A%2F%2A",
            "@multimediatype": "Acrobat PDF file",
            "@type": "AAM-PDF",
            "@size": "1128128",
            "@ref": "am",
            "@mimetype": "application/pdf"
          }
        ]
      },
      "link": {
        "@rel": "abstract",
        "@href": "https://api.elsevier.com/content/abstract/scopus_id/85150424232"
      }
    }
  }
}