{
  "metadata": {
    "title": "Pt-based intermetallic compound catalysts for the oxygen reduction reaction: From problems to recent developments",
    "authors": "; ; ",
    "journal": "Journal of Energy Chemistry",
    "date": "2024-12-31",
    "doi": "10.1016/j.jechem.2024.06.061",
    "abstract": "",
    "uri": "https://api.elsevier.com/content/article/pii/S2095495624004820",
    "pii": "S2095495624004820"
  },
  "fulltext": {
    "full-text-retrieval-response": {
      "scopus-eid": "2-s2.0-85201445667",
      "originalText": "serial JL 286353 291210 291711 291744 291809 31 Journal of Energy Chemistry JOURNALENERGYCHEMISTRY 2024-07-14 2024-07-14 2024-08-19 2024-08-19 2024-11-20T09:09:50 1-s2.0-S2095495624004820 S2095-4956(24)00482-0 S2095495624004820 10.1016/j.jechem.2024.06.061 S300 S300.1 FULL-TEXT 1-s2.0-S2095495624X00091 2024-11-20T09:18:53.21354Z 0 0 20241201 20241231 2024 2024-07-14T09:59:30.613221Z absattachment articleinfo articletitlenorm authfirstinitialnorm authfirstsurnamenorm cid cids contenttype copyright crossmark dateloaded dateloadedtxt datesearch datesort dateupdated dco docsubtype doctype doi eid ewtransactionid hubeid indexeddate issn issnnorm itemstage itemtransactionid itemweight openaccess openarchive pg pgfirst pglast pii piinorm pubdateend pubdatestart pubdatetxt pubyr sortorder srctitle srctitlenorm srctype ssids alllist content subj subheadings suppl tomb volfirst volissue volumelist webpdf webpdfpagecount yearnav figure table body acknowledge affil articletitle auth authfirstini authfull authkeywords authlast grantnumber grantsponsor grantsponsorid primabst pubtype ref specialabst vitae 2095-4956 20954956 false 99 99 C Volume 99 27 302 324 302 324 202412 December 2024 2024-12-01 2024-12-31 2024 article rev © 2024 Science Press and Dalian Institute of Chemical Physics, Chinese Academy of Sciences. Published by ELSEVIER B.V. and Science Press. All rights are reserved, including those for text and data mining, AI training, and similar technologies. PTBASEDINTERMETALLICCOMPOUNDCATALYSTSFOROXYGENREDUCTIONREACTIONPROBLEMSRECENTDEVELOPMENTS TIAN H 1 Introduction 2 Synthesis strategies and optimizations of Pt-based intermetallic compounds 2.1 Sub-nanometer intermetallic synthetic strategy 2.1.1 The loading methods of the precursor on the carbon substrates 2.1.2 Exploration of ultra-small IMCs nanoparticles 2.2 Mechanism of the intermetallic ordering process 2.2.1 Attenuation of the energetic barrier before alloying 2.2.2 Phase diagrams and the intermetallic ordering process 2.2.3 Ordering degree-dependent performance 2.3 Interaction between carbon supports and nanoparticles 2.3.1 Exploration and optimization of the carbon supports 2.3.2 Optimization of carbon substrates in practical application 2.3.3 The performance of PEMFCs in the device 3 Metal composition of Pt intergeneric compounds 3.1 Pt-based bimetallic electrocatalyst 3.1.1 Pt-based intermetallic compounds of the main group and transition metal elements 3.1.2 Pt-based intermetallic compounds of rare earth metal 3.2 Pt-based trimetallic electrocatalysts 3.2.1 PtMN (M, N = Fe, Co, and Ni) intermetallic compounds 3.2.2 Pt-transition metals and main group metals intermetallic compounds 3.2.3 Pt-based intermetallic compounds with rare earth metal 3.3 Pt-based intermetallic compounds with three or more metals 4 ORR mechanism on the intermetallic compound 4.1 Oxygen adsorption and reaction on the catalyst surface 4.1.1 Relationship between adsorption and oxygen reduction reactivity 4.1.2 Upgrade strategy of oxygen adsorption 4.1.3 Identification of ORR catalytic active sites 4.2 Lattice parameters and catalyst properties 4.2.1 Lattice compressive strain tailored 4.2.2 Effect of third element metal incorporation on lattice parameters 4.3 In-situ characterizations and theoretical calculations 4.3.1 In-situ characterizations 4.3.2 Theoretical calculations 5 Conclusion and perspectives CRediT authorship contribution statement Acknowledgments References KODAMA 2021 140 147 K CUI 2024 70 77 H CHEN 2022 304 312 T BATES 2023 6233 6256 J CUI 2023 e202218269 P TAKIMOTO 2023 19 D WANG 2022 78 M KIM 2021 eabe9083 J CHEN 2022 e202117834 H LU 2017 999 1006 S ZHANG 2023 158 166 Q BRANDIELE 2024 508 520 R QIN 2024 143675 Z MATUS 2023 372 389 M LI 2022 4173 H LV 2023 e202304420 H CHEN 2022 e202117834 H YARLAGADDA 2018 618 621 V XIONG 2020 13069 13080 Y XIE 2022 1192 1200 X XIE 2021 8509 8518 M GAO 2022 2202071 J REVERDIAU 2021 39195 39207 G DUKIC 2024 4303 4317 T LI 2024 706 712 S KIM 2020 8195 8217 H TAKESHITA 2020 114250 T HOU 2020 100023 J LI 2021 2109244 W CHE 2023 172401 Y GONG 2021 119617 M LIN 2022 121767 L WU 2023 130341 H ZHAO 2023 107824 T HU 2021 109082 B ZHANG 2023 1597 1608 C LI 2022 24807 24816 W CHEN 2024 1487 1496 W WANG 2020 739 755 X WU 2023 2307297 Y LIU 2020 6287 6296 Z FIDIANI 2020 11874 11883 E LAGRICHI 2022 11997 12012 O WAN 2023 115124 K HAILE 2020 27346 27356 A TETTEH 2022 25246 25256 E WANG 2021 121615 H YANG 2024 124793 Y SHIN 2023 156449 D WU 2020 4427 4434 D LITKOHI 2020 23543 23556 H HUANG 2022 6679 6690 M YAN 2023 2310487 W ZHAO 2020 10637 10645 X BAK 2020 12300 12309 J XU 2022 311 321 R KIM 2016 449 457 J HU 2023 11532 11566 X XIA 2024 115296 Y HAILE 2021 3552 3559 A GAO 2020 16039 16048 P PRITHI 2022 36232 36247 J WANG 2022 27116 27123 M LI 2021 2106371 X GUAN 2022 2207995 J PEDERSEN 2023 10458 10471 A HUANG 2017 1494 1507 X QIAO 2021 4948 4960 Z SAHIN 2023 16829 16840 O DUCLOS 2020 1919 1933 L ZHANG 2020 7857 7863 B SHU 2024 90 99 Q YAN 2023 19522 19531 Y KOVTUNENKO 2024 1518 1526 V ABKAR 2022 19252 19262 Z SARKAR 2021 1184 1197 S MARINOIU 2020 3585 3600 A XUE 2023 e202300094 Y WANG 2019 1901279 Q KIM 2020 2002049 J WANG 2023 142748 M XIAO 2021 160221 Z SONG 2022 6521 T WANG 2024 157 165 E LIU 2022 315 322 X ZHANG 2022 e202101458 S SUN 2024 109154 L LE 2022 1833 1844 T MU 2023 3232 3251 Y ALFAROLOPEZ 2020 170 H GUI 2023 2307661 R SONG 2023 147287 M SUN 2023 232758 L BANHAM 2021 229515 D CUI 2021 6898 6925 J LIANG 2020 2000179 J FENG 2022 628 636 X ZENG 2023 17643 17655 Y GUO 2023 148 156 W GAO 2023 52473 52484 Y LOICHETTORRES 2023 124503 P ZHU 2023 2206062 W ZHAO 2022 968 975 Z DUAN 2022 2103144 X CHEN 2023 160 170 Z ZHAO 2023 2300550 W WANG 2023 2301310 Z LIAO 2021 14728 14736 Y LI 2023 e202300099 L LIU 2020 2000689 Q FENG 2022 2946 2959 X GUO 2022 53819 53827 P CAO 2021 138266 J CUI 2021 255 262 M ZENG 2022 7654 W ZHOU 2022 1256 1266 S LIU 2023 241 250 X WANG 2023 2302067 Y OKAMOTO 2004 395 H OKAMOTO 2010 322 H OKAMOTO 2019 743 756 H DESARIO 2014 2750 2757 D YE 2022 15239 15246 X JU 2023 16108 16116 B SONG 2022 2202916 T YANG 2023 e202315119 L FENG 2020 246 252 S CHEN 2023 388 404 Z CHENGLONGYANG 2021 459 464 L ZHU 2020 3021 3028 S ZHANG 2015 444 452 J LUO 2023 2300624 Y LIU 2022 19106 19114 J AO 2020 3032 3040 X GUAN 2021 21899 21904 J GONG 2023 963 982 Q LV 2023 H ZHU 2023 nwad162 S CAMPOSROLDAN 2023 7417 7427 C LI 2019 124 135 J CHENG 2021 e2104026118 H ZHAO 2020 1774 1790 Z LIU 2022 2200147 M XIAO 2022 503 512 F LIU 2023 e202302134 X LIANG 2019 15471 15477 J MUKHERJEE 2022 14922 14933 P WANG 2020 905 911 X EILER 2022 101023 K ZENG 2022 116728 W HU 2023 144828 S FENG 2023 11140 11150 G WANG 2023 2310683 K WANG 2021 S QIN 2022 14024 14033 J YANG 2023 18 26 B LAI 2022 16639 16645 D LIU 2021 21051 21056 X XU 2023 4078 4087 W LIU 2023 1455 1460 Y GUO 2021 13625 13630 Y WANG 2023 148097 H ZHAO 2023 17516 17524 Q LIM 2022 7399 7408 J WANG 2023 6 J CHENG 2022 278 286 Q POLANI 2022 29690 29702 S LY 2020 228516 A ZHAO 2021 1671 1678 T HU 2022 5380 5387 Y IMPAGNATIELLO 2020 2360 2371 A LIU 2022 3126 3133 G ERICKSON 2011 197 200 E QIAN 2023 140 146 F ZHANG 2014 7734 7739 S ANTOLINI 2017 201 213 E TIANX2024X302 TIANX2024X302X324 TIANX2024X302XH TIANX2024X302X324XH 2026-08-19T00:00:00.000Z 2026-08-19T00:00:00.000Z http://creativecommons.org/licenses/by-nc-nd/4.0/ © 2024 Science Press and Dalian Institute of Chemical Physics, Chinese Academy of Sciences. Published by ELSEVIER B.V. and Science Press. All rights are reserved, including those for text and data mining, AI training, and similar technologies. 2024-09-05T12:32:57.970Z http://vtw.elsevier.com/data/voc/AddOnTypes/50.7/aggregated-refined Natural Science Foundation of Anhui Province 2208085UD04 Natural Science Foundation of Anhui Province http://data.elsevier.com/vocabulary/SciValFunders/501100003995 http://sws.geonames.org/1814991/ National Key Research and Development Program of China 2022YFB4004100 NKRDPC National Key Research and Development Program of China http://data.elsevier.com/vocabulary/SciValFunders/501100012166 http://sws.geonames.org/1814991/ National Natural Science Foundation of China U22A20396 22209168 NSFC National Natural Science Foundation of China http://data.elsevier.com/vocabulary/SciValFunders/501100001809 http://sws.geonames.org/1814991/ The work was supported by the National Key Research and Development Program of China (2022YFB4004100), National Natural Science Foundation of China (U22A20396, 22209168), and Natural Science Foundation of Anhui Province (2208085UD04). item S2095-4956(24)00482-0 S2095495624004820 1-s2.0-S2095495624004820 10.1016/j.jechem.2024.06.061 286353 2024-11-20T09:18:53.21354Z 2024-12-01 2024-12-31 1-s2.0-S2095495624004820-main.pdf https://s3-eu-west-1.amazonaws.com/prod-ucs-content-store-eu-west/content/pii:S2095495624004820/MAIN/application/pdf/e6e744da6f71a2f1ab86408356ba5801/main.pdf main.pdf pdf true 6576362 MAIN 23 1-s2.0-S2095495624004820-main_1.png https://s3-eu-west-1.amazonaws.com/prod-ucs-content-store-eu-west/content/pii:S2095495624004820/PREVIEW/image/png/dd53dd97ef64d71bd29a57ee80409f02/main_1.png main_1.png png 59441 849 656 IMAGE-WEB-PDF 1 1-s2.0-S2095495624004820-fx1.jpg https://s3-eu-west-1.amazonaws.com/prod-ucs-content-store-eu-west/content/pii:S2095495624004820/fx1/DOWNSAMPLED/image/jpeg/6ac7df234e585a686fabae0dfcd8c5a6/fx1.jpg fx1 fx1.jpg jpg 4987 155 111 IMAGE-DOWNSAMPLED 1-s2.0-S2095495624004820-fx2.jpg https://s3-eu-west-1.amazonaws.com/prod-ucs-content-store-eu-west/content/pii:S2095495624004820/fx2/DOWNSAMPLED/image/jpeg/d69c25a1a9bd7c2a8168f9fb1cefc1bb/fx2.jpg fx2 fx2.jpg jpg 10289 155 111 IMAGE-DOWNSAMPLED 1-s2.0-S2095495624004820-fx3.jpg https://s3-eu-west-1.amazonaws.com/prod-ucs-content-store-eu-west/content/pii:S2095495624004820/fx3/HIGHRES/image/jpeg/8bc058cb88a3d32009492514e6e88d00/fx3.jpg fx3 fx3.jpg jpg 6115 155 111 IMAGE-DOWNSAMPLED 1-s2.0-S2095495624004820-ga1.jpg https://s3-eu-west-1.amazonaws.com/prod-ucs-content-store-eu-west/content/pii:S2095495624004820/ga1/DOWNSAMPLED/image/jpeg/4d9efa57d1313baa9402c529a02cf7b1/ga1.jpg ga1 true ga1.jpg jpg 21705 245 273 IMAGE-DOWNSAMPLED 1-s2.0-S2095495624004820-gr1.jpg https://s3-eu-west-1.amazonaws.com/prod-ucs-content-store-eu-west/content/pii:S2095495624004820/gr1/DOWNSAMPLED/image/jpeg/3688af65fee041930ea4e41f3c6d9138/gr1.jpg gr1 gr1.jpg jpg 82265 585 383 IMAGE-DOWNSAMPLED 1-s2.0-S2095495624004820-gr10.jpg https://s3-eu-west-1.amazonaws.com/prod-ucs-content-store-eu-west/content/pii:S2095495624004820/gr10/DOWNSAMPLED/image/jpeg/6c0217e362ae17aeb63b58ff3baeb1ff/gr10.jpg gr10 gr10.jpg jpg 108626 624 624 IMAGE-DOWNSAMPLED 1-s2.0-S2095495624004820-gr11.jpg https://s3-eu-west-1.amazonaws.com/prod-ucs-content-store-eu-west/content/pii:S2095495624004820/gr11/DOWNSAMPLED/image/jpeg/b72a8f071eb66cb2af9824637cf78400/gr11.jpg gr11 gr11.jpg jpg 145269 574 624 IMAGE-DOWNSAMPLED 1-s2.0-S2095495624004820-gr12.jpg https://s3-eu-west-1.amazonaws.com/prod-ucs-content-store-eu-west/content/pii:S2095495624004820/gr12/DOWNSAMPLED/image/jpeg/9ea8ce3cffba747a9fea3077ad1e7d56/gr12.jpg gr12 gr12.jpg jpg 103568 748 624 IMAGE-DOWNSAMPLED 1-s2.0-S2095495624004820-gr2.jpg https://s3-eu-west-1.amazonaws.com/prod-ucs-content-store-eu-west/content/pii:S2095495624004820/gr2/THUMBNAIL/image/jpeg/9a658884e745b7398e368fcc4d48ce5c/gr2.jpg gr2 gr2.jpg jpg 95388 328 779 IMAGE-DOWNSAMPLED 1-s2.0-S2095495624004820-gr3.jpg https://s3-eu-west-1.amazonaws.com/prod-ucs-content-store-eu-west/content/pii:S2095495624004820/gr3/DOWNSAMPLED/image/jpeg/795353ded5f3e3d3295ea1f4f8e6f4eb/gr3.jpg gr3 gr3.jpg jpg 193286 837 624 IMAGE-DOWNSAMPLED 1-s2.0-S2095495624004820-gr4.jpg https://s3-eu-west-1.amazonaws.com/prod-ucs-content-store-eu-west/content/pii:S2095495624004820/gr4/THUMBNAIL/image/jpeg/d95b30e4d508a32f044fe6d799800791/gr4.jpg gr4 gr4.jpg jpg 160623 759 624 IMAGE-DOWNSAMPLED 1-s2.0-S2095495624004820-gr5.jpg https://s3-eu-west-1.amazonaws.com/prod-ucs-content-store-eu-west/content/pii:S2095495624004820/gr5/DOWNSAMPLED/image/jpeg/8393a4c452970a1970b4a9a123316ac1/gr5.jpg gr5 gr5.jpg jpg 100045 407 622 IMAGE-DOWNSAMPLED 1-s2.0-S2095495624004820-gr6.jpg https://s3-eu-west-1.amazonaws.com/prod-ucs-content-store-eu-west/content/pii:S2095495624004820/gr6/DOWNSAMPLED/image/jpeg/a785823ba2340b8000ca14bec464a50c/gr6.jpg gr6 gr6.jpg jpg 91148 435 628 IMAGE-DOWNSAMPLED 1-s2.0-S2095495624004820-gr7.jpg https://s3-eu-west-1.amazonaws.com/prod-ucs-content-store-eu-west/content/pii:S2095495624004820/gr7/DOWNSAMPLED/image/jpeg/483de9ec19549fbfd78887e4fd4844c5/gr7.jpg gr7 gr7.jpg jpg 70746 360 624 IMAGE-DOWNSAMPLED 1-s2.0-S2095495624004820-gr8.jpg https://s3-eu-west-1.amazonaws.com/prod-ucs-content-store-eu-west/content/pii:S2095495624004820/gr8/DOWNSAMPLED/image/jpeg/404bcad100079b62d66c9aa7746ccc4d/gr8.jpg gr8 gr8.jpg jpg 119135 596 624 IMAGE-DOWNSAMPLED 1-s2.0-S2095495624004820-gr9.jpg https://s3-eu-west-1.amazonaws.com/prod-ucs-content-store-eu-west/content/pii:S2095495624004820/gr9/DOWNSAMPLED/image/jpeg/f1abcc610ace06baaaea287f870d2a58/gr9.jpg gr9 gr9.jpg jpg 150955 820 623 IMAGE-DOWNSAMPLED 1-s2.0-S2095495624004820-fx1.sml https://s3-eu-west-1.amazonaws.com/prod-ucs-content-store-eu-west/content/pii:S2095495624004820/fx1/DOWNSAMPLED/image/gif/fab0d4484e6b06d1703a7cd23a7f9b72/fx1.sml fx1 fx1.sml sml 10657 164 117 IMAGE-THUMBNAIL 1-s2.0-S2095495624004820-fx2.sml https://s3-eu-west-1.amazonaws.com/prod-ucs-content-store-eu-west/content/pii:S2095495624004820/fx2/THUMBNAIL/image/gif/57fb9a4cc334cbd5bb532e3196d1ec7e/fx2.sml fx2 fx2.sml sml 18867 164 117 IMAGE-THUMBNAIL 1-s2.0-S2095495624004820-fx3.sml https://s3-eu-west-1.amazonaws.com/prod-ucs-content-store-eu-west/content/pii:S2095495624004820/fx3/THUMBNAIL/image/gif/ebca805b88e604fdab764888aa040f0a/fx3.sml fx3 fx3.sml sml 13449 164 117 IMAGE-THUMBNAIL 1-s2.0-S2095495624004820-ga1.sml https://s3-eu-west-1.amazonaws.com/prod-ucs-content-store-eu-west/content/pii:S2095495624004820/ga1/THUMBNAIL/image/gif/c2ff0ac64ccced02a9e76ab6082a9691/ga1.sml ga1 true ga1.sml sml 17486 164 183 IMAGE-THUMBNAIL 1-s2.0-S2095495624004820-gr1.sml https://s3-eu-west-1.amazonaws.com/prod-ucs-content-store-eu-west/content/pii:S2095495624004820/gr1/THUMBNAIL/image/gif/838e7971fd756c50095430cbaf7556ae/gr1.sml gr1 gr1.sml sml 9720 164 107 IMAGE-THUMBNAIL 1-s2.0-S2095495624004820-gr10.sml https://s3-eu-west-1.amazonaws.com/prod-ucs-content-store-eu-west/content/pii:S2095495624004820/gr10/THUMBNAIL/image/gif/8854fe14722672897cb07ed6ab58c460/gr10.sml gr10 gr10.sml sml 13636 164 164 IMAGE-THUMBNAIL 1-s2.0-S2095495624004820-gr11.sml https://s3-eu-west-1.amazonaws.com/prod-ucs-content-store-eu-west/content/pii:S2095495624004820/gr11/THUMBNAIL/image/gif/3b49be36a0dbb518446d1d6bdb8b2374/gr11.sml gr11 gr11.sml sml 22436 164 178 IMAGE-THUMBNAIL 1-s2.0-S2095495624004820-gr12.sml https://s3-eu-west-1.amazonaws.com/prod-ucs-content-store-eu-west/content/pii:S2095495624004820/gr12/THUMBNAIL/image/gif/989edb898190c77b1880c16bcced5c89/gr12.sml gr12 gr12.sml sml 8091 164 137 IMAGE-THUMBNAIL 1-s2.0-S2095495624004820-gr2.sml https://s3-eu-west-1.amazonaws.com/prod-ucs-content-store-eu-west/content/pii:S2095495624004820/gr2/THUMBNAIL/image/gif/a4e61502e19d527b22cd484fd09d0556/gr2.sml gr2 gr2.sml sml 13095 92 219 IMAGE-THUMBNAIL 1-s2.0-S2095495624004820-gr3.sml https://s3-eu-west-1.amazonaws.com/prod-ucs-content-store-eu-west/content/pii:S2095495624004820/gr3/THUMBNAIL/image/gif/9966418f3f9f92e449e31f5e3ae7c0de/gr3.sml gr3 gr3.sml sml 11571 164 122 IMAGE-THUMBNAIL 1-s2.0-S2095495624004820-gr4.sml https://s3-eu-west-1.amazonaws.com/prod-ucs-content-store-eu-west/content/pii:S2095495624004820/gr4/THUMBNAIL/image/gif/6a37cb984b5a3a8381c33e33b9d5bb4b/gr4.sml gr4 gr4.sml sml 11821 164 135 IMAGE-THUMBNAIL 1-s2.0-S2095495624004820-gr5.sml https://s3-eu-west-1.amazonaws.com/prod-ucs-content-store-eu-west/content/pii:S2095495624004820/gr5/THUMBNAIL/image/gif/6309e7afb24f8c7b9382055c1d5814d0/gr5.sml gr5 gr5.sml sml 17851 143 219 IMAGE-THUMBNAIL 1-s2.0-S2095495624004820-gr6.sml https://s3-eu-west-1.amazonaws.com/prod-ucs-content-store-eu-west/content/pii:S2095495624004820/gr6/THUMBNAIL/image/gif/7e662ad1f67b8f11d54ce7686f5bc3f2/gr6.sml gr6 gr6.sml sml 14610 152 219 IMAGE-THUMBNAIL 1-s2.0-S2095495624004820-gr7.sml https://s3-eu-west-1.amazonaws.com/prod-ucs-content-store-eu-west/content/pii:S2095495624004820/gr7/THUMBNAIL/image/gif/c2a5a36264ef2a323ff7f5eba3b48330/gr7.sml gr7 gr7.sml sml 12509 126 219 IMAGE-THUMBNAIL 1-s2.0-S2095495624004820-gr8.sml https://s3-eu-west-1.amazonaws.com/prod-ucs-content-store-eu-west/content/pii:S2095495624004820/gr8/THUMBNAIL/image/gif/4302836b78db8ba81962c95c2da2952a/gr8.sml gr8 gr8.sml sml 16236 163 171 IMAGE-THUMBNAIL 1-s2.0-S2095495624004820-gr9.sml https://s3-eu-west-1.amazonaws.com/prod-ucs-content-store-eu-west/content/pii:S2095495624004820/gr9/THUMBNAIL/image/gif/2b0fa47f0937c3eb39d5194697b6d1f4/gr9.sml gr9 gr9.sml sml 10645 163 124 IMAGE-THUMBNAIL 1-s2.0-S2095495624004820-fx1_lrg.jpg https://s3-eu-west-1.amazonaws.com/prod-ucs-content-store-eu-west/content/pii:S2095495624004820/HIGHRES/image/jpeg/01a990ce579d7a637814ed538e3c493b/fx1_lrg.jpg fx1 fx1_lrg.jpg jpg 30892 688 492 IMAGE-HIGH-RES 1-s2.0-S2095495624004820-fx2_lrg.jpg https://s3-eu-west-1.amazonaws.com/prod-ucs-content-store-eu-west/content/pii:S2095495624004820/HIGHRES/image/jpeg/bbd656ddae9fd58240cd7a3f99145352/fx2_lrg.jpg fx2 fx2_lrg.jpg jpg 78969 688 492 IMAGE-HIGH-RES 1-s2.0-S2095495624004820-fx3_lrg.jpg https://s3-eu-west-1.amazonaws.com/prod-ucs-content-store-eu-west/content/pii:S2095495624004820/HIGHRES/image/jpeg/5d59e55c146eec70b525240445d8f426/fx3_lrg.jpg fx3 fx3_lrg.jpg jpg 33669 688 492 IMAGE-HIGH-RES 1-s2.0-S2095495624004820-ga1_lrg.jpg https://s3-eu-west-1.amazonaws.com/prod-ucs-content-store-eu-west/content/pii:S2095495624004820/HIGHRES/image/jpeg/d8a5739295ea7f631a760f314b2cf2f1/ga1_lrg.jpg ga1 true ga1_lrg.jpg jpg 126782 1085 1209 IMAGE-HIGH-RES 1-s2.0-S2095495624004820-gr1_lrg.jpg https://s3-eu-west-1.amazonaws.com/prod-ucs-content-store-eu-west/content/pii:S2095495624004820/HIGHRES/image/jpeg/7eb45860b26686407011cba0e48550d4/gr1_lrg.jpg gr1 gr1_lrg.jpg jpg 467473 2597 1699 IMAGE-HIGH-RES 1-s2.0-S2095495624004820-gr10_lrg.jpg https://s3-eu-west-1.amazonaws.com/prod-ucs-content-store-eu-west/content/pii:S2095495624004820/HIGHRES/image/jpeg/ec3b98a43ddb74637a927f24096e8d99/gr10_lrg.jpg gr10 gr10_lrg.jpg jpg 497591 2367 2366 IMAGE-HIGH-RES 1-s2.0-S2095495624004820-gr11_lrg.jpg https://s3-eu-west-1.amazonaws.com/prod-ucs-content-store-eu-west/content/pii:S2095495624004820/THUMBNAIL/image/jpeg/4143480d4246c6eeddc222d5e916170b/gr11_lrg.jpg gr11 gr11_lrg.jpg jpg 428142 1524 1657 IMAGE-HIGH-RES 1-s2.0-S2095495624004820-gr12_lrg.jpg https://s3-eu-west-1.amazonaws.com/prod-ucs-content-store-eu-west/content/pii:S2095495624004820/HIGHRES/image/jpeg/5828c1bbeb3335a28058372507f1e267/gr12_lrg.jpg gr12 gr12_lrg.jpg jpg 289654 1986 1657 IMAGE-HIGH-RES 1-s2.0-S2095495624004820-gr2_lrg.jpg https://s3-eu-west-1.amazonaws.com/prod-ucs-content-store-eu-west/content/pii:S2095495624004820/HIGHRES/image/jpeg/1671cc52ef12cb81b49d16f95e6707e1/gr2_lrg.jpg gr2 gr2_lrg.jpg jpg 523364 1452 3450 IMAGE-HIGH-RES 1-s2.0-S2095495624004820-gr3_lrg.jpg https://s3-eu-west-1.amazonaws.com/prod-ucs-content-store-eu-west/content/pii:S2095495624004820/HIGHRES/image/jpeg/0f1e41ddabeb224487679a27103b07a6/gr3_lrg.jpg gr3 gr3_lrg.jpg jpg 876438 3174 2367 IMAGE-HIGH-RES 1-s2.0-S2095495624004820-gr4_lrg.jpg https://s3-eu-west-1.amazonaws.com/prod-ucs-content-store-eu-west/content/pii:S2095495624004820/HIGHRES/image/jpeg/ac3fdf396f95125a2e59bd5854626dc6/gr4_lrg.jpg gr4 gr4_lrg.jpg jpg 899490 3359 2762 IMAGE-HIGH-RES 1-s2.0-S2095495624004820-gr5_lrg.jpg https://s3-eu-west-1.amazonaws.com/prod-ucs-content-store-eu-west/content/pii:S2095495624004820/HIGHRES/image/jpeg/7b0738bfdeaa0a9e06e8ce712fff854d/gr5_lrg.jpg gr5 gr5_lrg.jpg jpg 662717 1804 2756 IMAGE-HIGH-RES 1-s2.0-S2095495624004820-gr6_lrg.jpg https://s3-eu-west-1.amazonaws.com/prod-ucs-content-store-eu-west/content/pii:S2095495624004820/HIGHRES/image/jpeg/a1cbd4722903a4cdef8bfba8401ff000/gr6_lrg.jpg gr6 gr6_lrg.jpg jpg 446422 1927 2782 IMAGE-HIGH-RES 1-s2.0-S2095495624004820-gr7_lrg.jpg https://s3-eu-west-1.amazonaws.com/prod-ucs-content-store-eu-west/content/pii:S2095495624004820/HIGHRES/image/jpeg/0b22fb91af3ade7726f76c53c770380c/gr7_lrg.jpg gr7 gr7_lrg.jpg jpg 375546 1593 2762 IMAGE-HIGH-RES 1-s2.0-S2095495624004820-gr8_lrg.jpg https://s3-eu-west-1.amazonaws.com/prod-ucs-content-store-eu-west/content/pii:S2095495624004820/HIGHRES/image/jpeg/be7d05745c6e198485904b4f735f9cc6/gr8_lrg.jpg gr8 gr8_lrg.jpg jpg 674558 2639 2762 IMAGE-HIGH-RES 1-s2.0-S2095495624004820-gr9_lrg.jpg https://s3-eu-west-1.amazonaws.com/prod-ucs-content-store-eu-west/content/pii:S2095495624004820/HIGHRES/image/jpeg/3a8610e44cbbad40a92677237e5e249b/gr9_lrg.jpg gr9 gr9_lrg.jpg jpg 698405 3116 2368 IMAGE-HIGH-RES 1-s2.0-S2095495624004820-am.pdf https://s3-eu-west-1.amazonaws.com/prod-ucs-content-store-eu-west/content/egi:1038HVBP2W5/MAIN/application/pdf/c6402415337e60d8aac52171b0b60173/am.pdf am am.pdf pdf false 3243396 AAM-PDF JECHEM 3984 S2095-4956(24)00482-0 10.1016/j.jechem.2024.06.061 Science Press Fig. 1 (a) Diagrams of bond weakening strategy in the synthesis of the IMCs Reproduced with permission from Ref. [112]. Copyright 2022, Elsevier. (b) The formation process of IMCs in ZIF-NC Reproduced with permission from Ref. [113] Copyright 2022, American Chemical Society, and (c) formation of L10-PtCoAu catalyst Reproduced with permission from Ref. [114]. Copyright 2021, Elsevier. Fig. 2 (a) Schematic diagram of the process of synthesis of nanoparticles of IMCs by the Joule heating method. (b) Diagram of the structure and working principle of the Joule heating apparatus. (c) The photo of the carbon black precursor on carbon paper (left) and the precursor heated in the Joule heating furnace (right). (d) The process diagram of the temperature variation over time recorded in the Joule heating apparatus, i.e. the heating program. (e) Temperature variation diagram of a thermal shock cycle. (f–i) XRD patterns at different temperatures and different heating cycles. Reproduced with permission from Ref. [53]. Copyright 2023, Wiley‐VCH GmbH. Fig. 3 (a) The ordering process of ordered IMC compounds and characterization of the degree of order a. Schematic diagram of the ordering process of intermetallic compounds from precursors through the ordering process to ordered nanoparticles Phase diagrams of binary alloys (b–d). Pt-Fe, Pt-Co, and PtNi, regions forming the type of L10 alloys are indicated by color. The phase diagrams have been re-examined and bounded by Okamoto through high temperature powder X-ray diffraction (e–g). High temperature in situ XRD patterns including the metal crystal phase change from low temperature to high temperature and then cooling. (h–j) The calculated degree of order variation diagram of IMC at different temperatures. Reproduced with permission from Ref. [116]. Copyright 2022, Springer Nature. Fig. 4 (a) XPS diagram of sulfur-carbon substrate and supported Pt3Co nanoparticles. (b) X-ray absorption near edge structure (XANES) spectrum of the S-L edge to characterize the S–C interaction. (c) The Fourier transformed EXAFS diagram of the edge of Pt-L3 shows the Pt–S bonding. (d) Schematic diagram of the formation of IMCs by Pt3Co on S-doped carbon supports. Reproduced with permission from Ref. [130]. Copyright 2021, The American Association for the Advancement of Science. (e) Schematic diagram of the anchoring of PtZn nanoparticles with Zif-NC. Reproduced with permission from Ref. [59]. Copyright 2024, Elsevier Inc. Fig. 5 The simulation results of the theoretical calculation are as follows. (a) Comparison of the interaction strength of nanoparticles with different structures anchored on Fe-NC substrate and Pt/C with the substrate. (b) 3D stereogram of nanoclusters and carbon carriers. (c) In the calculation results, the comparison diagram of the aggregation of two nanoparticles with different structures at 300 K. Reproduced with permission from Ref. [133]. Copyright 2023, Wiley‐VCH GmbH. Fig. 6 Relationship between O2 adsorptivity and ORR activity in acidic solution. (a) Superficial molecular layers of water create barriers for O2 to contact the Pt surface. (b) Simulated O2 adsorption and experimental ORR activity. The electrolyte competition provides additional assistance. Reproduced with permission from Ref. [155]. Copyright 2021, The American Association for the Advancement of Science. (c) Projected density of states of Gd-O-Pt3Ni. (d) Effect of Gd on Pt3Ni charge. (e) Projected density of states effect of Gd on Pt3Ni charge. (f) Effect of Gd on adsorption energies of OH* and vacancy formation energies (E v) of Pt sites. Reproduced with permission from Ref. [127]. Copyright 2023, Wiley‐VCH GmbH. Fig. 7 An insight into the effect of spin shielding. 3D contour plot of Fermi level electronic distribution of (a). Pt2Gd. Dark blue spheres = Pt and orange spheres = Gd. The blue isosurface = bonding orbitals and the green isosurface = anti-bonding orbitals. The site-dependent PDOS of (b). Pt2Gd. Location-dependent PDOS of (c) Pt-5d, (d) Gd-5d, and (e) Gd-4f in Pt2Gd. (f) The reaction energies of the ORR at U = 0 V for Pt2Gd and Pt. (g) The evolution of the reaction energies of the ORR at the onset potential and the equilibrium potential (U = 1.23 V). Reproduced with permission from Ref. [139]. Copyright 2023, Oxford University Press on behalf of China Science Publishing & Media Ltd. Fig. 8 (a) The ORR free energy diagram. (b) the schematics (blue, red, purple, and grey spheres represent Pt, Ni, N, and C atoms, respectively), (c) the total density of states and the corresponding d band centers. A black dotted line indicates the Fermi level. A purple line indicates the d-band center. Reproduced with permission from Ref. [100]. Copyright 2022, Royal Society of Chemistry. Fig. 9 (a–d) In-situ Raman spectras in the application of different voltage states (e) In situ infrared spectras at different voltages. (f) Mechanism diagrams of ORR and spillover effect. (g) Schematic of PtCu@TiO2−x N catalyst preparation and working mechanism. Reproduced with permission from Ref. [163]. Copyright 2023 Elsevier B.V. Fig. 10 (a) Pt L3 XANES spectra of different structures. (b) Pt L3 k 3-weighted FT-EXAFS spectra of the sample. (c) Volcanic curves of Pt-Cu-Ga samples with different structures. (d) Alloying and strain effects of the alloys. (e) Surface of nanoparticles. (f) Electronic localization function (ELF) on the slice surface of catalyst nanoparticles. Reproduced with permission from Ref. [146]. Copyright 2023, Wiley‐VCH GmbH. Fig. 11 Degradation mechanism of Pt/C of region (a). EFTEM image of (b) nanoparticles detached, (c) particles aggregated, and (d) electrolyte precipitation. (e) In situ transmission electron microscopy. Partial dissolution of (f) particles, migration in (g) electrolyte, and precipitation of (h) Pt. Reproduced with permission from Ref. [172]. Copyright 2020, American Chemical Society. (i) Fabrication of the PDMS pouch used for the XAS cell, and assembly of the cell with compression plates. (j) XANES difference (Δμ) plot of electrodes at different potentials at O2 and N2. (k) The relationship between the spectral integral area and potential is directly related to the oxidation state. (l) Oxygen/nitrogen oxidation state ratio R diagram of relation to electric potential Reproduced with permission from Ref. [174]. Copyright 2012, American Chemical Society. Fig. 12 (a) Diagram of carbon-borne Pt from a single atom to particle. (b) The mechanism of ORR on Pt (c) Gibbs free energy diagram for ORR on single-atom Pt and Pt cluster, (d) The liner relationship between Gibbs free energy of the intermediates. (e) The volcano curves between ΔE O* and overpotential. Reproduced with permission from Ref. [175]. Copyright 2023, The Chemical Industry and Engineering Society of China, and Chemical Industry Press Co., Ltd. Table 1 Nanoparticle synthesis method and size, advantages, and disadvantages. Material Characteristics Particle diameter (nm) ECSA (m2 g−1 Pt) Synthesis method Advantages Disadvantages Ref. L10-PtCo sulfur-containing molecule-assisted ball-milling 5.29 45.6 Wet ball milling, freeze-drying High dispersion, small particle size, resistance to sintering, large-scale preparation The additive contained S [25] L12-Pt3Mn the emerging periodic carbothermal shock method 3 39.5 Joule heating controlling particle size but also saving time and energy Difficult to enlarge [53] L12-Pt3Co seed-densification strategy 1 134 Single-atom seeds the denser Coseeds lead to smaller alloy nanocrystals [98] L12-Pt3Co Tailored lattice compressive strain of Pt-skins 4 65.9 Adjust the pore size of N-doped porous carbon Adjust the Pt skin thickness [108] L10-PtCo short-ordered mesoporous carbon 3–5 66.8 Multiple carbonization prevent sintering The pore structure may affect mass transfer [109] L12-Pt3Mn three-dimensionally (3D) porous structure and immobilize the metal precursors with definedatomic ratio 3 68 hydrogel-freeze drying strategy Economical, universal, and can be prepared on a large scale The preparation time required is longer [72] L10-PtCo Small molecule-assisted synthesis 5 86.7 molecular additives containing heteroatoms (O, N, or S) coordinated with platinum suppress alloy sintering and insure the formation of small-sized heteroatoms are added [84] L10-PtZn 3D Pt@ZnO matrix as a precursor 4 62.7 self-protection method Prevent aggregation, and promote the phase transition by creating abundant O vacancies [97] L12-Pt3Co Single-metal site-rich carbon 3.3 125.8 Strong chemical binding between Pt clusters and the Mn-NC support the MnN4 site could induce a strong coupling effect between Pt clusters and the carbon support [99] Co-Pt Co-doped Pt nanoclusters 2 116.2 microwave-assisted reduction of polyols Ultra-small nanoclusters and stability Microwave-assisted amplification is difficult [105] Table 2 Pt-based IMCs electrocatalyst. Material Synthesis method ECSA (m2 g−1 pt) Current density (A cm−2) Power density (mW cm−2) Durability Ref. PtCo@Gnp 700 °C for 6 h H2/Ar mixture 32.4 1.7 (air, Cathode, 150 kPaabs) 1010 (air, Cathode, 150 kPaabs) 30,000 cycles 0.6–0.95 V [104] L12-Pt3Co@ML-Pt/NPC10 750 °C in an N2 atmosphere for 10 h 48.5 1.4 (air, cathode, 1 bar) 1020 (air, cathode, 1 bar) 30,000 cycles at 0.6–0.95 V [108] L10-PtCo/Pt annealed under 95% Ar + 5% H2 at 650 °C 1 h 27.3 1.12 (air, cathode, 150kPaabs) / 30,000 cycles at 0.6–0.95 V [141] Sub-Pt3Co-MC annealed in H2/Ar (5 %) atmosphere at 800 °C for 2 h 49.7 2.95 (O2, Cathode, 150 kPa) 1750 (O2, Cathode, 150 kPa) 30,000 cycles at 0.9 V [142] PtFe-H/Pt 1000 °C 1 h and 750 °C 1 h 70.2 0.5 (air, Cathode, 150 kPaabs) 0.6 (air, Cathode, 150 kPaabs) 30,000 cycles 0.6–0.95 V [126] PtFe 900 °C for 6 h under 5 vol% H2/Ar 85.4 2.12 (air, Cathode, 250 kPaabs) 1400 (air, Cathode, 250 kPaabs) 30,000 cycles 0.6–0.95 V [116] Pt1Fe1 @Fe0.5- NC-900 900 °C for 3 h in a 5 % H2/Ar / 1.75 (O2, Cathode, 1 bar) 1050 (O2, Cathode, 1 bar) 30,000 cycles 0.6–0.95 V [40] PtCo/C3 Oil bath at 160 °C for 48 h 36.0 1.9 (air, Cathode, 150 kPaabs) 1160 (air, Cathode, 150 kPaabs) 30,000 cycles 0.6–0.95 V [143] Pt1.5Ni1- x /Ni-N-C 300 °C for 4 h with NH3 gas / 2.4 (O2, Cathode, 2 barabs) 1720 (O2, Cathode, 2 barabs) 30,000 cycles 0.6–1.0 V [100] Pt78Zn22/KB NCs 180 °C for 8 h / 1.95 (O2, Cathode, 150 kPaabs) 1449 (O2, Cathode, 150 kPaabs) 30,000 cycles 0.6–0.95 V [144] Pt-Ni UHT 600 °C 19 h and held for 0.5 h in air, in Ar/H2 atmosphere (3.5%H2) at 150 °C for 1 h 54.1 1.9 (O2, Cathode, 250 kPaabs) 1434 (O2, Cathode, 250 kPaabs) 30,000 cycles 0.6–1.0 V and 5000 cycles 1.0–1.5 V [134] DMSA-PtCo/Pt 1000 °C 1 h and 500 °C 2 h 45.6 2.2 (air, Cathode, 250 kPaabs) 1160 (air, Cathode, 250 kPaabs) 30,000 cycles 0.6–0.95 V [25] PtA@FeSA-N-C 90 min at 160 °C, oil bath and 900 °C 30 min Ar 65.02 1.9 (O2, Cathode, 1.0 bar) 1310 (O2, Cathode, 1.0 bar) 10,000 cycles 0.6–0.95 V [135] Pt-Fe-N-C NH3 gas at 900 °C for 15 min and Ar atmosphere at 1,000 °C for 1 h / 1.3 (O2, Cathode, 2.5 bar) 1080 (O2, Cathode, 2.5 bar) 100,000 cycles 0.6–0.95 V [145] Pt3Fe/NC-600 500 °C in 12 vol%H2/N2 / 1.2 (O2, Cathode, 50 kPa) 1350 (O2, Cathode, 50 kPa) 100 h at 0.6 V [112] PtFe/Fe-N-C 120 °C 4 h and 400 °C 3 h under NH3 60–66 3.88 (O2, Cathode, 1.5 bar) 2490 (O2, Cathode, 1.5 bar) 30,000 cycles 0.6–1.0 V [133] L10-Pt2CuGa 280 °C 60 min 73.7 3.5 (O2, Cathode, 150 kPa) 2600 (O2, Cathode, 150 kPa) trapezoidal wave sweeps from 0.6 V to 0.95 V 0.6–0.95 V [146] L10-W-PtCo/C 280 °C under Ar for 60 min and 700 °C under Ar + 5% H2 6 h / 1.4 (O2, Cathode, 150 kPa) 1.57 J/cm2 (O2, Cathode, 150 kPa) 50,000 cycles 0.6–1.0 V [147] Review Pt-based intermetallic compound catalysts for the oxygen reduction reaction: From problems to recent developments Heyuan Tian Writing – review & editing Writing – original draft Visualization Methodology Data curation a b Xian Wang Writing – review & editing Writing – original draft Project administration b Jiawei Ge Writing – review & editing Writing – original draft Software a b Hao Wan Writing – review & editing Visualization Resources b Wei Ma Visualization Conceptualization c Guanqun Xie Writing – review & editing Writing – original draft Resources a ⁎ Junjie Ge Writing – review & editing Writing – original draft Resources b ⁎ a School of Environment and Civil Engineering, Dongguan University of Technology, Dongguan 523808, Guangdong, China School of Environment and Civil Engineering Dongguan University of Technology Dongguan Guangdong 523808 China School of Environment and Civil Engineering, Dongguan University of Technology, Dongguan 523808, Guangdong, PR China b School of Chemistry and Materials Science, Key Laboratory of Precision and Intelligent Chemistry, University of Science and Technology of China, Hefei 230026, Anhui, China School of Chemistry and Materials Science Key Laboratory of Precision and Intelligent Chemistry University of Science and Technology of China Hefei Anhui 230026 China School of Chemistry and Materials Science, Key Laboratory of Precision and Intelligent Chemistry, University of Science and Technology of China, Hefei 230026, Anhui, PR China c State Grid Anhui Electric Power Research Institute, Hefei 230601, Anhui, PR China State Grid Anhui Electric Power Research Institute Hefei Anhui 230601 China State Grid Anhui Electric Power Research Institute, Hefei 230601, Anhui, China ⁎ Corresponding authors. Graphical abstract Although Pt-based intermetallic compounds oxygen reduction catalysts have been developed rapidly and achieved many advances, the progress is sorted out and in-depth analysis in view of the existing problems. Proton exchange membrane fuel cells (PEMFCs) are promising next-generation energy conversion devices with advantages including high energy conversion efficiency, low noise, and environmental friendliness. On the PEMFC cathode, the oxygen reduction reaction (ORR) relies heavily on Pt-based catalysts, where PtM x (M stands for transition metal) intermetallic compounds (IMCs) are considered the best choice to enhance the catalytic activity. However, problems such as inadequate catalytic activity, high cost, and insufficient durability, etc. still hamper its commercialization. The optimizations of the catalyst structure, the improvements in the preparation process, and the understanding of the reaction mechanism are of great value. The developments of cathodic oxygen reduction catalysts for PEMFCs will also focus on improving the catalytic activity of intermetallic compound nanoparticles, the utilization rate, and the durability of Pt. Controlling the particle size and particle/carrier interaction remain key issues for future research. The catalyst reaction mechanism, the surface changes of the nanoparticles of Pt (111) face before and after the catalytic reaction, and the targeted regulation of the adsorption strength between the IMCs and oxygen-containing intermediates adjusted by transition metals need to be investigated more specifically and directly. At the application level, the expression of catalyst properties in the catalyst membrane electrode and reactor are the keys to the performance of PEMFCs. Therefore, researches on PEMFCs are still systematic works. This paper summarized the recent process toward the optimization of catalyst preparation, the exploration of new catalysts, and the new understanding of the mechanism. Given the reference to the development of PEMFCs, future research can start from the existing problems, solve the shortcomings of the catalyst, and promote the practical application of PEMFCs. Keywords Oxygen reduction reaction Platinum PEMFCs Intermetallic compound 1 Introduction The ballooning energy demand and deterioration of the environment necessitate the energy industry to decrease the use of fossil fuels and upgrade environmentally friendly and renewable energies [1–3]. Hydrogen has been used in fuel cells and green chemical synthesis as the energy carrier and reactive material [4–6]. PEMFCs, as an efficient energy conversion unit, exhibited promising potential for hydrogen electric conversion in vehicles, large-scale electronic equipment, and stationary power supplies [7–12]. Therefore, the lifetime and catalytic activation of commercial PEMFCs depend on the catalysts of the electrodes, especially the ORR that takes place at the cathode [13–17]. For this reason, platinum group metals (PGMs) with high catalytic activity and stability in acidic environments have been used as commercial catalysts, but the inherently hindered reaction kinetics, scarcity of raw materials, and high cost limited the promotion [18–22]. If PEMFCs, especially hydrogen fuel cell vehicles, are promoted on a large scale, the demand for Pt will increase significantly, which may lead to a shortage of Pt supply. According to literature reports, the availability of platinum should be guaranteed in the medium term, i.e. 2035, if the use of platinum in all vehicles is planned, and if research and development progress and recovery rates are met, hydrogen fuel cell vehicles sales will reach the target of 20% by 2050. The recovery rate of Pt resources must also reach 90% to ensure sustainable development [23]. Although precious metals account for a relatively high proportion of fuel cell costs, the reduction of fuel cell manufacturing costs is still a systematic project. The Pt-based ORR catalyst has been optimized for the long term, there is still room for improvement in the catalytic kinetics. ORR on Pt surfaces typically follows a four-electron transfer mechanism in which oxygen molecules are sequentially reduced to water via intermediate species such as superoxide (O2 −), peroxide (O2 2−), and hydroxyl radicals (OH−). Each step in the mechanism involves the adsorption, diffusion, and reaction of oxygen species on the Pt surface. Common rate-determining steps in the ORR on Pt include the breaking of the O–O bond in oxygen molecules, the formation of OH− intermediates, and the reduction of O2 − to water [24]. The presence of active sites, such as Pt atoms with different coordination environments, plays a crucial role in enhancing the kinetics of the ORR. Moreover, the surface structure and morphology of Pt-based catalysts, including the crystallographic orientation, particle size, and surface defects, can significantly impact the ORR kinetics. In other words, Pt-based IMCs did not reach the top of the volcano curve and the optimum balance between catalyst activity and binding strength of oxygenated intermediates was not reached [25]. ORR consists of several steps and the rate-determining steps may not be the same for all Pt-based alloys. Alloying with other transition metals to tune the binding strength of oxygen-containing intermediates and controlling the nanostructure and morphology of Pt-based catalysts to optimize the exposure of active sites [26]. This brings the catalyst closer to the top of the volcanic curve. The development of high activity, longevity ORR catalyst cathode, and reducing the amount of Pt in the catalytic layer is key to promoting the practical application of the PEMFCs [27–29]. Many efforts have been made to optimize the Pt-based ORR catalysts, including but not limited to the design of the catalyst support, the synthesis of different IMCs, the adjustments of the cluster sizes, and even the regulation of the interaction between the carbon substrate and the metal clusters [30–35]. Pt-based catalyst was also optimized through synthesizing Pt metals with different morphologies, i.e., nanowires, nanotubes, exposing the lattice plane selectively, etc., to make the most of the Pt atoms and stabilize the catalytic active centers [36–43]. Different crystal surfaces exhibit varying electrochemical properties. Pt-based nanoparticles (NPs) can be synthesized in distinct morphologies, including octahedrons or cubes [44–46]. This allows for selective exposure of the surface with high activity. Moreover, Fe, Co, Ni, Mn, etc. were also introduced to improve the ORR activity and reduce cost, but these transition metals are not stable in acidic conditions [47–54]. The leaching of transition metals can lead to several detrimental effects that can affect the performance and durability of the fuel cell system. Once the transition metal has been dissolved, the crystal lattice of the IMCs is altered, resulting in a loss of catalytic activity. The dissolved transition metals can migrate to the fuel cell membrane and cause degradation of the proton-conducting polymer membrane. This can lead to membrane swelling, reduced proton conductivity, and ultimately membrane failure, affecting the overall performance of the fuel cell. For example, some transition metals can accumulate at the anode through the PEM, resulting in reduced catalytic activity. Pt clusters are prone to sintering, dissolution, and Ostwald ripening, at the same time, corrosion of the carbon supports leads to the detachment of Pt nano-particles, resulting in a sharpened decline in the ORR performance [55–61]. The U.S. Department of Energy (DOE) provided references for the research on PEMFCs [62]. For the PEMFCs equipped on heavy-duty transport, the target for 2030 of the cost is $80/kW and the ultimate target is $60/kW, and the cost reduction is a systemic subject. The PGM loading before 2030, the target is ≤ 0.3 mg/cm2 peak efficiency 68% and ≤ 0.25 mg/cm2 peak efficiency 72% for the ultimate target. The lifetime of 25000 h before 2030 and eventually 30000 h. This means that under these loading conditions, after aging treatment, it is still necessary to reach 750 mW/cm2 1.5 bar air. This poses a challenge to the mass activity of the catalyst. The activity and stability of the catalyst are important during use in vehicles, long-term use, and especially the degradation during start-up and shut down, which causes corrosion of the carbon support and Oswald ripening, shedding, and agglomeration of the Pt particles. For this reason, the Accelerated Durability Test (ADT) is carried out for a minimum of 30,000 potential cycles at a voltage of 0.60–0.95 V. Therefore, the development of ORR catalysts with high efficiency and long service life is the primary task to break through the bottleneck of fuel cell commercialization [18,29,38,57]. Intermetallic compounds are characterized by well-defined stoichiometry, atomic arrangement, and controlled crystal structure. The formation of intermetallic compounds releases a lot of heat because their chemical bonds are different from the metallic bonds of alloys, and more stable [51,53,61]. Alloys primarily exhibit metallic bonding with some solid solution bonds, while intermetallic compounds can have a combination of covalent, ionic, and metallic bonds due to their ordered and specific stoichiometric structures. The ordered arrangement influences the type of chemical bonds present, such as covalent, ionic, and metallic bonds in IMCs, but the lack of strict order in the arrangement of atoms in alloys results in a more random distribution of bonding interactions, primarily metallic bonding. Alloys are characterized by metallic bonding, where electrons are delocalized throughout the material. In IMCs, the specific stoichiometry and ordered structure of the IMCs result in directional bonding interactions, such as covalent and ionic bonding, in addition to metallic bonding. The differences in chemical bonding between IMCs and alloys result from factors such as stoichiometry, crystal structure, bonding interactions, and electronic structure, which together influence the ORR property. The electronic structure, adsorption energy, extrusion, and expansion of the lattice can be controlled by adjusting the crystal structure and composition, thereby regulating catalytic activity and stability. Pt-based IMCs have shown great promise in providing long-term cyclic mass activity for the oxygen reduction reaction. Contributing to their improved performance and durability in fuel cell applications is the unique structure of these compounds with ultrathin Pt skin and sub-size scales, which are widely regarded as the future of ORR catalysts due to their exceptional activity and stability [63–65]. IMCs boast a defined alloy composition (stoichiometric ratio) and an atomically ordered crystal structure, in which atoms of varying elements have assigned locations within the cell, as opposite to random arrangement [11,66]. Therefore, the number of Pt atoms bonded to base metals is maximized, resulting in a more significant ligand effect [67,68]. In addition, the cell parameters of IMC structures are generally smaller than those of disordered alloys, resulting in more significant shrinkage stress effects [69,70]. A shift in the d-band center and a change in the electronic structure of the surface Pt can be caused by the greater lattice strain of Pt on intermetallic surfaces [71]. This change in electronic structure confers better activity and structural/chemical stability to Pt-M intermetal catalysts [72]. As the superior catalytic activity of IMC catalysts has shown, there is still room for optimization in electronic structure, synergistic effects, high surface area, structural stability, tunable composition, catalytic mechanisms, resistance to poisoning, promotion of reaction kinetics and the structure of carbon substrate. Here, we focused on recent research advanced in ORR catalysts for Pt-based IMCs in recent years. We summed up the breakthrough in reaction mechanisms and the material synthesis, followed by elucidation in structure-activity relationships, and improved strategies for catalytic performance and durability in real PEMFC applications. At last, we finally concluded with the current problems to be solved and prospects for future development. 2 Synthesis strategies and optimizations of Pt-based intermetallic compounds The aim of optimizing Pt-based IMCs is to enhance their catalytic activity and durability for ORR, reduce Pt consumption, and lower fuel cell operating and manufacturing costs. 2.1 Sub-nanometer intermetallic synthetic strategy Nanoparticles composed of intermetallic platinum alloys exhibit enhanced electronic properties and thus superior catalytic performance [11,66]. Production of tinier nanoparticles increases the ratio of surface area to volume, thereby exposing more surface atoms and adjusting the geometry of the surface structure and electrochemical surface area (ECSA). Nevertheless, the high temperatures obligatory for atomic diffusion commonly led to the expansion of these nanoparticles [73,74]. The result of this sintering process is usually a reduction in the electrochemically active area of the nanoparticles, leading to a decrease in their catalytic activity [75,76]. To better compare the size of nanoparticles obtained by different preparation methods and the advantages and disadvantages of the preparation methods, a summary has been made in Table 1 . 2.1.1 The loading methods of the precursor on the carbon substrates The process of loading the Pt and metal precursor on the carbon substrate greatly on the nanoparticle radius of the intermetallic [77–80]. Plenty of techniques had been selected, i. e. initial impregnation method, atomic layer deposition technology, chemical vapor deposition technology, freeze drying, etc [81–83]. The experiment and optimization of carbon substrates, carbon blacks, carbon nanofibers, carbon nanotubes, mesoporous carbon, carbon gels, graphene nanosheets, carbon nanospheres, and carbon dots, etc., have been adopted. When the catalyst is prepared on a large scale and used in the device, the ease of obtaining the carbon substrates and the manufacturing cost need to be considered. In PEMFCs, the stability, electrical conductivity, corrosion resistance, bonding strength with IMC nanoparticles, and the influence of pore channels on the particles should be considered. Different carbon substrates have different pore structures and different groups, which will have a great influence on the loading of Pt and also have many influences on the regulation of the loading process of Pt. The selection and optimization of carbon substrates will be discussed in detail in the following chapters. Molecular additives that contain coordination heteroatoms such as oxygen, nitrogen, sulfur, phosphorus, etc. were added during the impregnation process. Song et al. developed a small molecule-assisted synthesis of carbon-supported platinum IMCs method [84]. During the annealing, the addition of sodium thioglycolate inhibited the sintering of the nanoparticles by forming coordination bonds with platinum during the impregnation process [85,86]. The organic species then thermally converted into a heteroatom-doped carbon coating around the nanoparticles at high temperatures, thereby producing Pt-based IMCs with small size and high order [70,74]. Because the precursors cannot be precipitated at the same time when evaporatively drying, better courses needed to be attempted [87,88]. Zhang et al. developed a cost-effective method to prepare ultra-small Pt intergeneric compounds of less than 3 nm based on rGO and then synthesized rGO-supported PtMn using this method, and has a certain universal application [72]. Freeze drying, as a method of direct solvent transfer from the solid phase to the gas phase, maintains the dispersed state of the precursor in the hydrogel and preserves the three-position polypoid structure of the precursor in the hydrogel. As the solvent sublimated, unaffected by the solubility of the precursor and maintained the atomic ratio of the metal on the substrate. Lyophilization and thermal evaporation of solvents are compared by Zhang et al [72]. Well-distributed and ultra-small precursor particles are the two main issues. The particle size affects the utilization rate of Pt and the catalyst activity, which in turn affects the cost of Pt in the catalyst, and the loading methods are the basics for achieving ultra-small IMC nanoparticles. 2.1.2 Exploration of ultra-small IMCs nanoparticles To achieve the goal, lots of methods have been taken, such as the microwave-assisted method, seed-mediated co-reduction, the water/oil microemulsion method, a sacrificial template strategy, magnetron co-sputtering, microfluidic reactor synthesis, and linker molecule stabilization, etc [89–95]. Some representative methods were enumerated and discussed, hereinafter. The durability has also been improved by the formation of the carbon shell coated on top of the nanoparticles [96]. The one-pot seed-mediated approach was adopted by Liang et al [97]. First, Pt nanoparticles were prepared and the core-shell catalyst Pt@ZnO was prepared using zinc oxide as the coating material. The ZnO matrix was then coated onto the Pt NPs by thermal decomposition of Zinc acetylacetonate in the presence of tri-n-octylphosphate (TOPO) and oleoamine (OAm), followed by reduction of the Pt NPs in the presence of OAm and borane tert-butylamine (BTB). Finally, the Pt@ZnO precursor was ordered at 600 °C. TOPO played an important role that contact with Zn2+, and the disassembly of Zn precursor was released, forcing ZnO to cover the Pt NPs. For the pre-synthesis of the coating process, Pt@ZnO and assistant of TPTO, the L10-PtZn intermetallic nanoparticles less than 4 nm were achieved. It remains a challenge to achieve small-size Pt NPs even 1 nm, the high surface energy and weak interfacial interactions are still hindering. Feng et al. adopted a strategy of pre-loading high-density monatomic seeds onto a carbon substrate and then loading high-density cobalt monatomic seeds onto the nitrogen-doped carbon substrate. The nanoparticles were fixed with a single atom as a nail, which weakened the aggregation effect and controlled the size of the nanoparticles [98]. By adjusting the density of cobalt atoms on the nitrogen-doped carbon precursor, the size of the nanoparticles was influenced. For the same amount of the Pt precursors, the size of the NPs formed on the precursors with more Co single atoms was smaller, correlated with higher utilization of Pt atoms, and better ORR catalytic activity. The MnN4 structure, formed by loading single Mn atoms onto the carbon substrates, was homoplastically prepared by Zeng et al. [99] Because of the strong linkage between Mn in the MnN4 structure on the substrate, highly dispersed Pt nanoparticles of about 2.1 nm were obtained after the annealing process. The gas-promoted dealloying process had been adopted and Pt-based NPs and high density single atomic nickel sites ORR catalyst was synthesized by Guo et al [100]. After the Pt1.5Ni octahedral nanoparticles were synthesized by hydrothermal method on the N-doped C, Pt, and Ni atoms were dealloyed and Ni atoms were detached and captured by the nearby defect sites on the carbon substrate for ammonia and heat generation. Abundant Ni single sites had been located closely near the Pt1.5Ni1− x nanoparticles. The single atom of Ni and nanoparticle produced a synergistic reaction, O2 adsorbed on the Ni atom after the reaction was transferred to the adjacent nanoparticle to complete the further reaction [100–102]. The core-shell structure had been introduced to constrain the over growth of the catalysts [46]. Zhu et al. coated SiO2 shell on the ZIF-67, dissolved the shell and achieved PtCo NPs of 2.61 nm, making the most utilization of Pt [103]. Zhao et al. coated graphene on the PtCo nanocatalysts as PtCo@Gnp [104]. A scalable method through the microwave-assisted reduction by polyols has been taken up and sub-2 nm nanoparticles have been achieved by Duan et al [105]. The annealing time was even reduced to 5 min at one point, which ensured the formation of nanoclusters and prevented the growth of nanocluster size. Although the scalable microwave-assisted polyol reduction annealing route has not yet been used to synthesize the IMCs, but prospective in the future [87,106,107]. Many efforts have been taken to achieve ultra-small IMC nanoparticles, including the usage of the anchoring effect, inert layer coating, control of the ordering temperature, etc. Efforts still need to be taken to bring forth preparation methods that not only have promotion for the obtaining of small-size nanoparticles but also promote catalyst stability and stability. 2.2 Mechanism of the intermetallic ordering process 2.2.1 Attenuation of the energetic barrier before alloying The energetic barrier has been an obstacle to obtaining IMCs with both high degree of order and small structure. The process from a disordered phase to an ordered phase is thermodynamically driven and is determined by the temperature that forces the atoms to migrate [110,111]. However, high temperatures can also cause the NPs to migrate and aggregate, forming larger particles. To bate the bond strength and kinetic barrier, Feng et al. noticed the effect of H adsorbed on the binding energy, regulating and controlling the H2 contents and temperatures in the annealing process [112]. Pt3 nanoclusters deposit on the Fe-N5-C, and the interaction force of Pt–H is stronger than that of N–H, so that H is adsorbed on Pt, which weakens the Pt–Pt and Fe–N bonding, and reduces the kinetic barrier of alloying, as shown in Fig. 1 (a) [112]. This leads to the bonding of H on Pt, which weakens the interaction between Pt–Pt and Fe–N bonds and reduces the barrier to alloy formation. The alloying process can be shifted to lower temperatures, achieved Pt NPs with an order of less than 2 nm. As shown in Fig. 1(b), the process of forming PtCo IMCs nanoparticles by single atom Co migrated and aggregated into formed Pt NPs, Co-ZIF-8 was first synthesized with single Co atoms as nodes, then carbonized and loaded with Pt nanoparticles. During the alloying stage, the Co atoms were reduced and migrated into the Pt nanoparticles, ordering and forming IMCs. Another method is to synthetic Pt-Au alloy nanoparticles in polyol, coated CoO on the nanoparticles forming a core-shell structure, the whole particles anneal and forming IMCs, seeing in Fig. 1(c). The Joule heating can achieve short-term heating and cooling, and is considered to be a highly efficient annealing method for synthesizing IMCs in a short period. This rapid thermal processing to higher temperatures allows the atoms to move more freely and rearrange into a more ordered state, lowering the energy barrier for the ordering transition. Encouraged nucleation and growth processes within the material, resulting in the formation of ordered intermetallic structures. Increased atomic mobility at elevated temperatures facilitates nucleation and subsequent growth of ordered domains, helping to lower the ordering energy barrier. The emerging periodic carbothermal shock (PCTS) through the Joule heater synthesized L10/L12 type Pt-Mn IMCs showed the small size and order by Yan et al, the process shown in Fig. 2 (a) [53]. With the Joule heating, the NPs of the IMCs are not only well defined and the particle size controllable, but they are also economical in terms of time and energy. Joule heating involves the application of an electric current to the material, which generates heat through the Joule effect. This rapid heating leads to an increase in temperature within the material, which promotes the atomic rearrangement necessary for the transition from a disordered to an ordered intermetallic structure. The new arrangement of the precursor weight is ordered to form the required structure, as the Joule heating creates numerous vacancies when heated rapidly. Cui et al. found through DFT that the lower electron cloud density caused by vacancy and the lower activation energy (0.67 eV) of the Pd-vacancy mediated diffusion pathway compared to non-vacancy diffusion (i.e. ring diffusion, 3.96 eV) significantly promote the ordered process of L12-Pd3Pb nanocrystals. In contrast, the average intermetallic particle size was smaller in conventional furnace annealing at 1273 K, where heating was slow and the annealing time was longer [115]. The Joule heating equipment is shown in Fig. 2(b, c). The temperature change process was recorded in Fig. 2(d, e). From Fig. 2(f–i), the order level is related to the number and temperature of carbothermic shocks, as the number increases, the characteristic peaks of the superlattice become visible and stronger. However, because the formation energy of L12-Pt3Mn is −0.354 eV atom−1, which is lower than the −0.346 eV atom−1 of L10-PtMn, L10-PtMn can gradually transform into the more stable L12-Pt3Mn phase as the temperature increases. The crystalline phase was made more stable by the higher temperature or more cycles of carbothermal shocks. The emerging periodic carbothermal shock obtained 4.48 nm of L12-Pt3Mn compared to the conventional furnace annealing of the average particle size of ∼12 nm. During the intermetallic ordering, the energy barrier of the precursor forming alloy is reduced, the chemical bond between the precursor is weakened, and the time and temperature of the order are reduced to obtain ultra-small intermetallic compound nanoparticles. The migration and aggregation of particles will occur at the same time. Reducing the energy barrier to reduce the ordering temperature can reduce the agglomeration of particles and thermal shock, and shortening the high-temperature time indicates that time and temperature determine the agglomeration of particles. 2.2.2 Phase diagrams and the intermetallic ordering process Phase diagrams are important bases that describe the process and state during the liquefaction and solidification, the ordering process shown in Fig. 3 (a), in addition, the content and the element-metal ratio of the alloy can be inquired at a certain temperature. Zeng et al. used the metal phase diagrams and in situ high-temperature X-ray diffraction (HT-XRD) to study the conversion process of a carbon-supported Pt IMC catalyst under high-temperature annealing conditions in Fig. 3 [116]. The phase-transition-temperature and alloying/ordering stages were identified with the help of the phase diagrams in Fig. 3(b–d). In the upper part of the phase diagrams, the metal is in a high-temperature melting state. As the temperature decreases, the melt begins to precipitate solid Pt and Fe, Co, and Ni to form a binary mixture [120–122]. As it cooled further, reaching the edge of the charge, an ordered L10 intermetallic phase began to form. The primary requirement for the formation of IMCs is that after the precursor is reduced, a high temperature is reached to break the ordered energy barrier so that the precursor atoms can begin to move. Through the phase diagrams, separated the annealing protocol designing a program was adopted that ordering energy barrier was quickly broken through at a higher temperature and the ordering process of atomic migration was completed at a lower temperature. The HT-XRD results shown in Fig. 3(e–g) can be observed that a broad diffraction peak around 41° arose when the PtFe alloy experienced temperature at 300 °C, corresponding to the (111) face of the PtFe. The weak diffraction peak at around 33° attributed to the superlattice peak of (110), which means the formation of PtFe IMCs and the ordering process occurs. However, the superlattice peaks of PtCo IMCs appeared at 800 °C during the cooling program (Fig. 3h–j), and unobserved PtNi in the whole temperature-changing process. For the fact that the annealing temperature of PtNi was below the phase-transition-temperature, and was not enough to break the kinetic energy barriers of atom ordering so the process of the disorder-to-order transition was hard to be occurred. A method of separation, in breaking through the energy barrier and ordering occurs in different stages respectively, had been come up, and ORR catalysts of high order and small size IMCs were prepared [117–119]. For more complex Pt-Sn bulk phase diagrams, different proportions of Pt and Sn precursors have been used to study the ordering process. Different proportions of precursors form different intermetallic compounds and have different melting points. DeSario et al. investigated the effect of temperature and composition on the ordering temperature of intermetallic compounds [123]. Due to the addition of strong reducing agents, like LiBHEt3 or KBHEt3, PtSn forms ordered IMC nanoparticles at room temperature, which reduces the randomness of mixing of the two metals in solution. The Pt3Sn NPs were annealed at 200 °C and entered the cubic structure. As an important basis for studying the formation of alloys, the phase diagram plays an indispensable role in studying the melting state and ordering process of IMCs. Previous reports have optimized the ordering process based on the phase diagram and explored the energy barrier-breaking temperature and the ordering temperature. However, there is still much to be explored in the future regarding the temperature of the ordering process. 2.2.3 Ordering degree-dependent performance The ordering degree of the Pt IMCs determined the performance, not only the activity but also the durability [124,125]. Song et al. prepared a range of 3–4 nm PtFe IMC catalysts with the ordering degree in a wide range of 10%–70% [126]. As a quantitative evaluation to calculate the degree of order, the ratio S(110)/S(111) + S(200) + S(002), which is the sum of the integrated area of the (110) sub-peak and the areas of the (111), (200), and (002) sub-peaks, was used in the XRD patterns. Particles with the ordering degree of 74.3%, 34.7%, and 12.4% were evaluated. The interfacial area of PtFe with the ordering degree of 74.3% is 2.211 A, which is close to the 2.192 A of standard PtFe. The interfacial area of the PtFe with 34.7% and 12.4% ordering degree is 2.227 and 2.236 A respectively, indicating greater lattice shrinkage in the PtFe with 74.3%. Durability and catalytic activity show the same result, which can be attributed to the compressive strain effect and the more stable thermodynamic IMC structure compared to disordered alloys, depending on the degree of order and lattice compression regulation [103,127–129]. The mechanism of Pt-based ORR catalyst is still promising for the future. The changes of Pt in the catalyst during the reaction remain to be analyzed, and the changes of Pt and the coordination environment during the adsorption reaction of oxygen-containing intermediate species remain to be analyzed, which requires more in-depth analysis and in situ spectroscopic and spectral evidence. The process of crystal lattice changed during the reaction and the reasons for the change remain to be elucidated. The change of the crystal surface of Pt (111) during and after the reaction remains to be revealed. In the process of studying the catalyst reaction mechanism, machine learning, statistics, simulation, and other means will also be more useful for the development of PEMFC. Based on the above analysis, it is important to design catalysts with higher activity and better stability to promote the development of Pt-based ORR catalysts. 2.3 Interaction between carbon supports and nanoparticles The realization of the transition from disorder to IMC has to overcome the barrier of the kinetic energy of the atomic order and high temperatures are needed. The interaction between the carbon supports and the nanoparticles is determined to allow the nanoparticles to migrate and aggregate so that the optimizations of the carbon supports can be anticipated. 2.3.1 Exploration and optimization of the carbon supports The nanoparticles of IMCs are bonded to the carbon substrate by heteroatoms such as O and N. The coordination strength of these atoms and the metal atoms largely determines the electron distribution of the IMCs and the closeness of the bond between the nanoparticles and the carbon substrate, thus affecting the stability and ORR activity. Platinum IMCs were synthesized with an average particle size of less than 5 nm on porous carbon supports doped with sulfur by Yang et al. [130] Notably, the interaction between sulfur and platinum on the supports effectively prevented the sintering of the metals up to 1000 °C. In Fig. 4 (a) of the XPS spectra, a new peak appeared around 162 eV, and the sulfur 2p peak shifted toward higher binding energy, indicating the electron cloud density of Pt decreased and the electron cloud density of S increased, resulting in a higher ionic bond composition in the valence bond. The S L-edge NEXAFS (Fig. 4b), 174.3 and 182.9 eV of Pt3Co/S-C were assigned to the metal–S bond compared with P + tS2. Pt L3-edge EXAFS results in Fig. 4(c) showed the coexistence of Pt–S and Pt–Pt (Co) bonds in both Pt3Co/S-C samples. In Fig. 4(d), it can be seen that the process by which metal precursors distributed on a carbon substrate transition from dispersed single atoms or clusters to IMCs nanoclusters at 600 to 1000 °C. As the temperature increases, the aggregation of dispersed single atoms and clusters becomes more intense, and the higher the temperature, the larger the size of the IMC nanoparticles. In the process of agglomeration of nanoparticles, particles without S-rivets tend to agglomerate, while particles with S-rivets migrate and aggregate more lightly, and samples with S-rivets are difficult to aggregate further when occurs to a certain extent. Zhu et al. found that P and N codoped carbon nanosheets had a strong anchoring effect, resulting in nanoparticles with an average size of 1.3 ± 0.4 nm, the clusters formed by this size are sufficiently stable, and a Pt atomic utilization rate of up to 32.81% [131]. Fig. 4 showed the comparison of different metal atoms as anchor points attached to carbon substrates and IMCs nanoparticles was made. The dense ZnN x sites in the carbon support can not only provide a source of Zn for alloying PtZn NPs but also act as a “spatial barrier” to prevent the formation of inert PtN x sites and increase the amount of active Pt in the catalyst. In the absence of ZnN4 protection, Zn-NC-PtZn has a strong thermodynamic tendency to form PtN4. After that, during the impregnation process, the Pt source is uniformly dispersed due to the Lewis base interaction between Zn2+ and PtCl6 2− [59]. Aerogel has high porosity and low density, i.e. it is which is conducive to mass transfer, especially O2 diffusion in ORR, and is resistant to the mass transfer limit [132]. Luo et al. prepared Pt-metal/metal-N-C using aerogels loaded with carbon as the carrier. Because aerogels are interconnected through holes, the catalyst has ultra-small oxygen transmission resistance, which promotes the performance of the catalyst in fuel cells [133]. Because the aerogel contains N atoms and has a strong interaction with Pt, the NPs can be chemically anchored, reducing the aggregation of nanoparticles and leading to high-temperature stability during high-temperature annealing and durability. For the same Pt particles, replacing Fe-N-C with a pure carbon substrate significantly reduces their binding energy (the higher the negative binding energy, see in Fig. 5 (a), the stronger the nanoparticle-substrate interaction), indicating that the metal-particle-substrate interaction is stronger after doping the carbon layer with metal and nitrogen. According to the corresponding optimized structure of binding energy in Fig. 5(b), the structure of different samples, the way of binding nanoparticles with carbon substrates, and the structure of NPs are more clearly shown. From the simulation diagram in Fig. 5(c) the theoretical calculation, it can be seen that the aggregation is less likely to occur when the iron single atom is connected to the carbon substrate. Zeng et al. prepared an Mn single atom loaded at the N4 sites and then loaded Pt nanoparticles on the single atom. Mn strongly interacts with both the N4 site and Pt nanoparticles on the substrate, playing a linking role and fixing the nanoparticles [99]. After annealing at 800 °C, well-dispersed Pt NPs about 2.1 nm and ordered L12-Pt3Co nanoparticles (3.3 nm) were retained on the MnSA-NC support. Self-supported ORR catalysts are attracting increasing interest due to their higher activity, better stability, lower metal content, and higher electron transfer efficiency than supported catalysts. Liu et al. prepared alloys of Pt and various transition metals catalyst with an ultrathin holey nanotube (UHT) structure via the Kirkendall effect., with ultra-thin tube walls, and constructed a self-supporting network catalyst layer with a thickness of less than 1 µm [134]. It’s the first catalyst that reached the mass activity target and dual durability targets for load and start−stop cycles of the U.S. DOE. The 100% surface exposure and efficient mass transfer made the catalyst produce high intrinsic activity [55,135,136]. The Ostwald ripening and the aggregation problem of nanoparticles has been avoided, also the low curvature of the pipe wall gave a lower surface energy for the nanotube structure. IMCs formed by loading single non-noble metal atoms onto carbon substrates and then loading Pt play a good anchoring role, which not only prevents the movement and aggregation of particles but also reduces the fall-off and aggregation of particles during the long-term durability process, which is not only conducive to catalytic activity but also conducive to improving the durability of the catalyst. 2.3.2 Optimization of carbon substrates in practical application In PEMFCs, problems such as mass transfer, flooding, and Pt depletion limit the power density of the fuel cell, while dissolution of the carbon substrates, dissolution of base metals and Pt, shedding of IMC nanoparticles, and the increase in particle size due to Oswald ripening mostly affect the performance and lifetime of the fuel cell stack. Gong et al. modified the outer surface of the carbon support with amino group (NH2), improved the utilization rate and mass transfer of Pt in the membrane electrode, and made the ORR have excellent activity [137]. A diazonium reaction method was used to prepare the amino (–NH2)-modified carbon supports. The accessibility of PtCo nanoparticles with N as the bridge to the KB had been enhanced, resulting in high Pt utilization and low mass transport resistance. Because PtCo nanoparticles are mainly deposited on the outer surface of the carbon carrier, the utilization rate of Pt is as high as 95%, improving the accessibility of Pt, and performing well in single-cell tests of fuel cells. 2.3.3 The performance of PEMFCs in the device The activity expression of the ORR catalyst under three-electrode test conditions is very different from that under single battery and stack test conditions. The main reasons for this result are as follows. The first is the transfer of oxygen in mass transfer, which is related to the design of the flow channel, the selection of the gas diffusion layer, the diffusion in the catalytic layer, the transfer in the pores of multistage porous carbon materials, and the transfer between interfaces, all of which affect the expression of catalyst activity, the contact between the active site and oxygen, and water flooding. For the catalyst, the pore structure of the carbon supports and the amount of Pt also affect the expression of catalyst activity. In porous carbon, though the particles in the pores are conducive to improving the durability because it is not easy to suffer the toxicity of sulfonic acid and the migration and aggregation of particles in the pore, the transport of oxygen and the mass transfer resistance of protons in the pore is greater, which affects the expression of the catalyst in the high current region. The loading affects the thickness of the catalyst layer. The catalyst layer with a low load and thicker load has greater resistance to the transfer of oxygen, protons, and electrons, while the load with a high load and high density is more likely to cause particle aggregation and reduce the utilization rate of Pt during preparation and long-term operation. The design of the catalyst must also be balanced in this respect. From the membrane electrode to the stack, the optimization and exploration of the flow path design, assembly process, and so on is also a systematic project for the expression of catalyst activity, and there is still much to be explored. For the selection and optimization of catalyst carbon substrate, taking into account the interaction force between IMC nanoparticles and carbon carriers, heteroatoms N, O, S, and P are introduced and form strong coordination with nanoparticles, which reduces the fall off, movement, and aggregation of nanoparticles during the high-temperature ordering process and durability test, and maintains the small size of IMC particles. However, the introduction of heteroatoms should also take into account the problem of content, too much introduction will lead to the reduction of the conductivity of the support, increase the resistance, and reduce the performance of the membrane electrode device test. In addition to heteroatom doping, the morphology of the carbon substrate must also be considered. Although porous carbon can play a limiting role in the movement and aggregation of nanoparticles, the IMCs involved in the reaction will face a relatively large mass transfer group and the accessibility of protons transferred by naphthalene to the reaction site of the catalyst will be reduced, which will reduce the activity of the catalyst and the utilization of the reaction site. The future research and optimization of carbon supports must still be optimized and explored along the lines of high loading density, low in-plane resistivity, strong interaction with IMCs, and hydrophobicity. High loading density can reduce the thickness of the catalytic layer, the resistance of the catalyst surface to the proton exchange membrane, and the distance of the protons from the membrane to the reaction site. Importantly, the mass transport of the carbon substrate has a major impact on the expression of the catalyst in batteries and stacks, particularly at low voltage and high current levels. When doping with heteroatoms, it is necessary to consider the resistance and bonding strength with IMCs. Improving the Pt utilization rate and reducing the amount of Pt in the catalyst is always the direction of ORR catalyst research. To achieve this goal, many methods have been tried to prepare small-size IMC nanoparticles, but it is often difficult to achieve both small size and high order in the preparation process. The anchoring effect, the dispersion of precursors, and the efficient order-passing process have been tried and some progress has been made. It has been possible to prepare uniform and even about 1 nm nanoparticles and effectively improve ECSA, but for the application of catalysts, the high degree of order is also positively correlated with the activity and stability of the catalyst, while reducing the ordering temperature and ordering time to facilitate the movement and aggregation of particles, it is also necessary to consider the ordering process of the catalyst. In addition, it is still promising to learn from the research results of the catalyst ordering mechanism, optimize the ordering process, and creatively use new methods to improve the ordering efficiency. The large-scale application of PEMFCs in the future will inevitably bring some problems related to industrial production, and the efficient preparation of large-scale batches will be the direction of exploration in the practical application of future catalysts. The carbon support also has a certain resistance, and the diffusion of oxygen, proton, and water in the catalytic layer will also affect the expression of the catalyst in the device. Reducing the thickness of the catalytic layer is conducive to reducing the diffusion resistance and resistance, increasing the load of precious metals on the carbon support, and promoting the effective utilization of precious metals in the membrane electrode and reactor is also of great value for PEMFCs. 3 Metal composition of Pt intergeneric compounds IMCs with different non-Pt metal can have a significant effect on the catalytic performance of the catalyst for the ORR, leading to improved catalytic activity for ORR. Synergistic effects between Pt and the other metal can enhance the ORR kinetics and improve the overall efficiency of the catalyst. The stability of the catalyst during ORR reactions is improved, and reduce the degradation of Pt catalysts, resulting in prolonged catalytic durability. On the other hand, changing the metal component in Pt-based IMCs can modify the electronic structure of the catalyst, influencing the adsorption and activation of oxygen species, leading to optimized ORR performance and selectivity. By modifying the redox behavior, the ability of the catalyst to facilitate ORR and intermediate species can be tailored for improved ORR efficiency. The components of the IMCs are discussed and examined in the following and are presented and compared in Table 2 . 3.1 Pt-based bimetallic electrocatalyst 3.1.1 Pt-based intermetallic compounds of the main group and transition metal elements Except for the common transition metal, the elements' main group element can also form IMC with Pt. Pt-Ga IMCs nanoparticles had been exploited by Lv et al. [138]. The effects of Ga salts with different anions on the formation of PtGa intermetallic compounds were investigated. The stability of ordered mesoporous i-GaPt catalysts with the chiral atomic arrangement is 5.9 times and 3.2 times that of mesoporous i-Ga3Pt5 and commercial Pt/C catalysts, respectively. The introduction of Ga is an important addition to the Pt IMCs. Fenton reaction, H2O2 catalyzed by Co Ni, etc. producing –OH, causing the PEM/catalyst layer to degrade. Due to its relatively negative redox potential, zinc is rarely alloyed with Pt, although it is considered an antioxidant in Fenton reactions. Liang et al. prepared L10-PtZn below 4 nm, the Zn atoms adjusted the distance of Pt-Pt and the ORR catalysis activity and durability had been improved [97]. 3.1.2 Pt-based intermetallic compounds of rare earth metal As a class of metals, the rare earths metal (REM) form IMCs with Pt, which have different properties to the transition metals. However, the synthesis of Pt-REM IMCs is challenging, as the standard highly negative redox potential of rare earth metals means that the oxygen-containing species would always be present. Recent advances in rare earth IMCs with Pt are summarized below. The spin configurations of Pt had been changed for the interactions between the Gd-4f and Pt-5d orbitals of Pt2Gd [139]. The spin symmetry and electronic structures changed and then compared the adsorbed and desorbed oxygen species., promoted the ORR activity, exhibited a half-wave potential of 0.95 V, and a superior mass activity of 1.5 A mgPt − 1. For the reason that the negative formation energy of Pt-REM alloys forced the nanoparticles extremely stabilized by the stabilizer for the diffusion of REM. In the Pt-REM, there is an exponential relationship between the degree of compressive strain and the surface-specific ORR activity. Offline measurements of compressive strain applied in the Pt lattice show the highest specific ORR activity relative to the Pt block at −3% shrinkage. Campos-Roldán et al. prepared Pt6.1Nd/C and Pt7.8Nd/C catalysts, that Pt6.1Nd/C presents only the hexagonal phase of Pt5Nd, while Pt7.8Nd/C is a mixture of cubic Pt, cubic Pt2Nd and hexagonal Pt5Nd phases [140]. For Pt5Nd, the Pt atom-shell on the Nd is electron-enriched and Nd suffered electron loss, so a strongly polarized bond between Pt δ − and Nd δ + happened. 3.2 Pt-based trimetallic electrocatalysts 3.2.1 PtMN (M, N = Fe, Co, and Ni) intermetallic compounds With the vigorous development of the two-component Pt-M catalyst, the three-component type Pt-MN catalyst, in which the transition metal M and another transition metal N are partially introduced, has gradually been reported to show better performance [148]. The ORR performance was improved for the reason of the surface strain of the Pt-base alloy was optimized, the structure was stabilized, and the Pt-Pt distance was adjusted. However, the focus of catalyst regulation is to reduce the dissolution of the metal, as the addition of the second transition metal is more likely to dissolve the metal in the acid. Sun et al. prepared the Pt-Co-Ni alloy was fixed on the N/O-doped graphene catalyst [88]. The introduction of Ni into PtCo alloy resulted in a strong interaction between NPs and carbon support, which improved the ORR catalytic activity and durability of the catalysts. Ternary metal ORR catalysts were also prepared by combining Ni and Cu. The ORR activity of PtCu x Ni1− x /C showed a volcanic curve with increasing Ni content. When the atomic ratio of Cu to Ni reaches 1:1, the PtCu0⋅5Ni0.5/C shows the highest activity [149]. Since Ni and Cu jointly regulate the electron cloud density of Pt, the center of the Pt-d band moves downward relative to the Fermi level, regulating the adsorption strength of Pt to oxygen-containing intermediate species [150–152]. 3.2.2 Pt-transition metals and main group metals intermetallic compounds The main group element metals are mixed with transition metals and Pt in a certain proportion to form IMCs, which regulate the p and d orbital hybridization of Pt atoms and the interaction between Pt and other metal atoms. As a result, the adsorption strength of oxygen-containing intermediates during ORR reaction is optimized, with a reduced dissolution rate of Pt, higher catalytic activity, and stability obtained. Typically, through local charge neutralization, ion displacement, etc., the formation of directional covalent bonds in metal alloys helps to confine free electrons. Due to the decrease of Fermi edge state density, more localized valence electrons and pseudogaps are formed, which provides a higher barrier for component segregation and promotes stability. Trapping free electrons within an alloy can decrease corrosion activity and metal atom dissolution. Liu et al. noted the covalent atomic interaction and prepared the L10-Pt2CuGa ORR catalyst [133]. The formation of directed atomic covalent interactions between Pt and Ga leads to a phase transition from L11 to L10 in PtCu, reducing the strain overhang in L11-PtCu. Pt-Ga interaction has a covalent bond component, which helps to increase the vacancy formation energy of surface Pt, thereby inhibiting its long-term dissolution (Pt-Ga interaction strength is 1.6 times that of Pt-Pt). Biaxial strain induced by directional bond optimizes oxygen binding energy and enhances ORR activity. 3.2.3 Pt-based intermetallic compounds with rare earth metal The Pt (111) lattice plane can be optimized by transition metals, and outstanding ORR activity and durability have been achieved. Practical applications and numerous studies confirm the performance of Pt-M catalysts. Rare earth metals, especially the lanthanide series, have been combined with Pt to form IMCs, with surprising results. New paradigms have already been carried out and attested to the progressive performance of both transition metals and rare earth metals with Pt. Due to the fact that rare earth metals are oxygenic in solution, Gd-O dipoles have been introduced into the Pt3Ni intermetallic via a high-temperature entropy-driven process by Yang et al [127]. The problem of the exchange of sites between the surface Pt atoms and adsorbed oxygen species as the thermodynamic driving force under the conditions of the potential above 0.7 V. The atoms' dissolution and crystallization happen in Oswald ripening progress, but Severe dissolution of the outermost Pt always happens through the Pt-Pt metallic bonds crushed, accelerated by potential dynamic cycling. The growth of oxides and irreversible surface recombination, such as position exchange and insertion/extraction of O atoms into the lattice, lead to the formation of rough surfaces. For the import of Gd, the sublayer formed a Gd-O dipole in the nanoparticles, and the formation energy of Gd-O-Pt3Ni is −2.88 eV lower than Gd-Pt3Ni by 5.50 eV, proving its thermodynamically favorable. The electron density of the Gd–O binding Pt site decreased, confirming the occupation of electrons in low-energy binding orbitals is more stable and the interaction between surface Pt and O is weakened. The introduction of rare earth-oxygen-stabilized Pt3Ni catalysts for site-exchange processes is delayed due to the repulsion between subsurface and surface oxygen. 3.3 Pt-based intermetallic compounds with three or more metals High entropy solid solution alloys, structurally ordered high entropy intermetallic (HEI) particles, were developed for use in fuel cell cathode oxygen reduction catalysts. Feng et al. prepared ordered-PtIrFeCoCu HEI NPs that showed oxygen reduction catalytic activity [153]. This process produces an ultra-high active surface area by combining the properties of a high entropy alloy and an intermetallic compound. The (001) facet provides the lowest activation barrier and the best d-band center. This method expands the application of high entropy alloys by breaking the disorder characteristic of high entropy alloys and making them ordered. Wang et al. designed carbon-supported PtFeCoNiMn (with an atomic ratio of 21:20:20:20:19) HEI nanoparticles and prepared them through shock-heating and shock-cooling strategies [154]. The achieved Pt on PtFeCoNiMn exhibits a wider range of d-band center distribution range than Pt nanoparticles and the adsorption properties of O2 and intermediates were changed. The d-band center value of the transition metal atom on the surface is smaller than that of the corresponding single metal nanoparticle, which makes its electronic structure similar to Pt and makes the transition metal atom also have ORR catalytic activity. The composition of the IMCs has been determined, composed of Co, Ni, Fe, and other elements have also been extensively studied, and the lattice compression stress of Pt has also been thoroughly analyzed. The addition of the third element not only affects the crystal lattice of the metal compound, but also changes the adsorption of oxygen on the surface of the particles, and even plays a role in promoting the ordering state. Other components of the high-entropy alloy also play a role in promoting the ORR reaction. In the future, high-entropy alloys will be one of the important branches of IMCs because of their special properties. For the selection of the third element of the ternary alloy, in addition to regulating the lattice structure to adjust the activity and durability of the catalyst, you can also pay attention to the special properties of the metal, the overflow effect of oxygen, the adsorption of oxygen to change the surface oxygen coverage, etc., and then change the characteristics of the catalyst. The selection of a wide variety of metals will also be an important direction for the future optimization and exploration of catalysts. 4 ORR mechanism on the intermetallic compound 4.1 Oxygen adsorption and reaction on the catalyst surface 4.1.1 Relationship between adsorption and oxygen reduction reactivity Four-electron reduction with several intermediates is the main reaction in the ORR process, O2 (aq) + 4 H3O+ (aq) + 4e− → 6 H2O. The following basic reaction steps were simulated and quantized by the electrochemical measurement technology. Much effort has been paid to identify the possible intermediates through in situ/operator techniques. As an important addition, Wang et al., with the aid of highly accurate molecular dynamics (MD) simulation with the Interface force field (IFF). The function of the solute layer and solvent layer, the free energy of O2 binding, and the adsorption statistics of O2 on the metal surfaces were revealed [155]. Water networks on the Pt surface determined the O2 contact with the surface Fig. 6 (a), that feature corrugated water adlayers, e.g. corrugated, slightly curved, or locally concave surfaces, had weaker hydrogen bonding. The time of initial oxygen adsorption and contact with the Pt surface is related to the ORR rate, while the initial chemisorption (or elsewhere along the reaction coordinates) is the rate-determining step. Due to the high concentration of hydrated hydrogen ions at 0.1 M and the instability of transient bound oxygen, the adsorption of O2 regulates the reachability of the Pt surface and prevents the remaining water reaction sequence from being possibly faster after the slow electron transfer begins, thus preventing high surface coverage. The electrolyte competition provides additional assistance shows in Fig. 6(b). Yang et al. added rare earth metal, rare earth oxygen ion pair was produced (Fig. 6c–f), which changes the O2 adsorption on the catalyst that promotes the activity of the catalyst [127]. 4.1.2 Upgrade strategy of oxygen adsorption The Pt ECSA is the dominant factor in determining the power performance, the ECSA positively correlated with the O2 capture efficiency [109,156,157]. Under the same cathode Pt load, the larger the Pt particle size, the lower the ECSA, and the lower the utilization rate of Pt. Increasing O2 capture efficiency by downsizing Pt particles is an effective approach to improve the power performance. Pt3Co NPs of different sizes have been prepared by Feng et al., through the method of seeds of Co atoms at different concentrations on a carbon substrate, the smaller the nanoparticles are, the more efficiency O2 is captured [98]. The intrinsic spin shielding effect was used to optimize the adsorption and desorption of the oxygen species [158,159]. After the O2 is adsorbed, the d-orbitals interact with O2. The 5d-2p orbital hybridization resulted in a deep-filled bonding state and partially filled anti-bonding states. The alloying of Pt with transition metal (M) can reduce the energy level of the anti-bonding orbital and increase the intrinsic activity of Pt. The central and intermediate binding strength of the d band of Pt is reduced by ligand or strain effect. When O2 is adsorbed on the surface of the catalysts, there is an energy shift of at least 0.4 eV and the phase changes from ferromagnetic to non-ferromagnetic. During the ORR reaction, the molecule changes from a triplet to a singlet. During the spin flipping, the itinerant d-electrons and the spin-related interaction of localized do affect the ORR activity, so optimizing the spin regulation and then adjusting the electron and absorption strength for O2 and the intermediates. For the 4f orbitals are half-filled made Gd an intrinsically high spin density and a natural magnetic moment, that had been made into intermetallic and exhibited outstanding ORR activity by Zhu et al. [139] The abundant single electrons in the Gd open shell change the spin states and electron delocalization of Pt ions of Pt2Gd through orbital coupling. DFT calculations have investigated the effect of spin reconfiguration on the electronic structures that improve the intrinsic oxygen reduction performance of Pt2Gd. Fig. 7 (a) shows the electronic distributions near the Fermi level (EF) that the electronic distributions of Pt2Gd have been changed compared with Pt. The projected partial densities of states (PDOSs) of both the spin-up and spin-down states were studied seen in Fig. 7(b), slight PDOS movement in Gd-5d and Gd-4f orbitals was observed for the presence of highly symmetric states. The reduction of spin polarisation in Pt2Gd optimizes the adsorption of polarised intermediates, resulting in increased coverage of the Pt surface. For the Pt site in Pt2Gd, the symmetry of the Pt-5d orbital spin state is significantly improved. Compared to the original Pt, the total Pt-5d orbital in Pt2Gd is reduced, increasing the ability of Pt to reduce ORR, as seen in Fig. 7(c). Strong spin-polarization effects in both the 5d and 4f orbitals and reverse spin pair appeared of Gd shown in Fig. 7(d, e). For the intrinsic spin shielding effect, the process of electrocatalysis has been optimized. 4.1.3 Identification of ORR catalytic active sites Separating the adsorption, reaction, and desorption processes of O2 at different reaction sites has been an innovative goal and method to improve the reactivity of catalysts and reduce the amount of Pt in catalysts [160–162]. Catalyst design becomes more relevant when one or more of the elements of the oxygen reduction process react on non-precious metal sites. Guo et al. synthesized Pt1.5Ni1− x /Ni-N-C catalyst that contained single atom Ni and PtNi alloy [100]. As seen in Fig. 8 , the DFT calculations and schematic illustrations of Pt1.5Ni1− x /Ni-N-C and reference materials, the ORR free energy diagram of Ni-N-C, Pt1.5Ni/N-C, Pt1.5Ni1− x /Ni-N-C with distant Ni sites, close Ni sites and Pt sites. The rate determining steps (RDS) of Pt1.5Ni1− x /Ni-N-C, Pt1.5Ni/N-C, and Ni–N–C are *OH + H+ + e− → * + H2O, *O + H+ + e− → *OH, and * + O2 + H+ + e− → *OOH, respectively. The *OOH intermediate, instead of being stable at the near-Ni site, migrates to the adjacent Pt-Ni sites and decomposes to O* and *OH. The multi-site synergetic effect between the Ni-NC site and the PtNi cluster site is effective in activating oxygen molecules, thereby facilitating further reduction processes. Therefore, the catalytic efficiency of the multi-site synergistic relay reaction pathway of Pt1.5Ni1− x / Ni-N-C is higher than that of Pt1.5Ni/ N-C and Ni-N-C. Inversely, Xiao et al. combined single-atom Pt and PtFe nanoparticles [145]. The mass activity of Pt in fuel cells is 3.7 times higher than that of commercially available Pt/C. Pt-N1C3, Fe-N1C3, and PtFe@Pt, all contribute to the high performance of the ORR. During the operation of the fuel cell, PtFe@Pt forms the permanent PtFe shell on the surface, and the single atomic active site is PtFe@Pt. The further reduction of the H2O2 produced above is the primary cause of the outstanding durability of the fuel cell. Charge transfer and spillover effect are the connecting bridges for the movement of the ORR intermediates and electrons. Wang et al. implemented the above functions through ordered porous TiO2− x N supported PtCu, in which the ordered porous TiO2− x N provided oxygen-deficient and PtCu with electron-deficient [163]. The reason for the electron-deficient PtCu surface was that electrons were transformed by the electron-deficient PtCu surface. The weak adsorption of ORR intermediates on PtCu, promoted the spillover from PtCu to TiO2− x N. PtCu@TiO2− x N achieved high activity for the highly efficient renewal of the active sites in PtCu by the ORR intermediate overflowing from the PtCu surface to the adjacent TiO2− x N interface. From the in-situ Raman and in-situ IR in Fig. 9 (a–d), a voltage of 1.1 V was applied, the perchlorate ion stretched and the symmetric stretching vibration of O–Ti–O can be observed. A blue shift was observed for the O–Ti–O peak in PtCu@TiO2− x N after applying a potential of 0.85 V but disappeared when the voltage was shifted to 1.1 V. The sample without N showed almost no change. The voltage at 7.7 V, the consumption of absorbed O2, stronger OH– and H–O–H peaks, but weaker OH-peak compared to PtCu@TiO2− x N, indicates that the active site renewal process in PtCu@TiO2− x N is responsible for the spillover action. As shown in Fig. 9(e), the in-situ Raman spectra indicated that the interaction of oxygenaterd intermediates with Ti will increase Ti–O bonding energy, leading to the bue shift of the O–Ti–O peaks, resulted from the interaction of oxygenated intermediates with Ti sites in TiO2− x N. OOHads decompose into OHads at PtCu@TiO2− x N, contributing to the formation of H2O. In Fig. 9(f and g), tune the reaction path when the spillover happened. In the study of ORR mechanism, the fuzzy process, the intermediate product and the change of catalyst in the reaction process, as well as the change of energy are gradually clear. The achieved progresses have been direction the design of the catalyst. In the coming phase, the mechanism study will present a more detailed ORR reaction process by combining the latest characterisation methods, new understanding and DFT. 4.2 Lattice parameters and catalyst properties 4.2.1 Lattice compressive strain tailored Regulating the lattice compression stress of Pt IMCs is an important method for altering the catalytic activity of Pt-based ORR catalysts and their effect on O-containing intermediate species [164,165]. By adjusting the lattice compression stress of Pt IMCs, the catalytic activity can be optimized to achieve the highest oxygen adsorption energy, placing it closer to the top of the volcanic curve [166,167]. Wang et al. used the binding effect of nitrogen-doped polyvoid carbon on IMCs nanoparticles to customize the size of the nanoparticles and to determine the lattice compression strain of Pt skin by intermetallic verification [108]. By regulating the lattice compressive stress of Pt intermetallic compounds, the d-band center of Pt is regulated, which affects the adsorption performance of the catalyst on the reactive substance (O2) and changes the performance of the catalyst. When the Pt-skin is composed of a single layer of Pt atoms, L12-Pt3Co applies an appropriate compressive stress to the Pt-skin, giving the catalyst a remarkable performance. To improve the contraction strain of the Pt3M intermetallic compounds, a series of ultra-small intergeneric compound nanoparticles of Pt were synthesized by Cheng et al [142]. Pt-based intermetallic (Pt3Co, PtCo, and Pt3Ti)–Pt skin core-shell catalysts with average particle size down to about 2.3 nm and ultrathin Pt skin with 4% contraction strain, exhibited excellent mass activity and cycle stability. Higher lattice pressure is positively correlated with high-quality activity and cycle stability. 4.2.2 Effect of third element metal incorporation on lattice parameters Optimizing the adsorption and desorption of oxygenated intermediates through lattice stress control is a practical and effective method [168,169]. By doping atoms of other radii in the lattice to form ordered intermetallic compounds, the cell parameters of the lattice can be effectively regulated, the compressive stress of the cell can be optimized and the length of the Pt–Pt bond can be adjusted to alter the catalytic activity. In response to the adjustment of the compressive stress in the lattice, Liu et al. prepared intermetallic compounds of Pt2CuGa [146]. The activity of L10-Pt2CuGa/C is the best regulated. In the XANES spectra in Fig. 10 (a), the valence state of Pt was consistent with the less oxidized state shown in L10-Pt2CuGa/C, indicating the existence of electron transfer between Ga and Pt. The Extended X-ray Absorption fine structure (EXAFS) spectra in Fig. 10(b) show the Pt-Pt bond length. The relationship between mass activity and dPt–Pt in Cu and Ga systems containing different proportions of Pt intergroup compounds has been calculated by DFT, showing a volcanic curve in Fig. 10(c).The Pt–Pt bond length in L10-Pt2CuGa/C (2.729 Å) is shorter than that of Pt foil (2.762 Å) and longer than that of L11-PtCu/C (2.702 Å), resulting in the release of overstrain in L10-Pt2CuGa than in L11-PtCu, see in Fig. 10(d). The vacancy formation energy of the surface Pt atoms was compared in Fig. 10(e), increased from 0.98 eV on Pt (111) to 1.28 eV on L10-Pt2CuGa NPs, and the structural stability and solubility resistance were improved. The electron localization function analysis and the differential charge density iso-surfaces have been carried out to compare the weathering introduction of Ga exhibits in Fig. 10(f). Charge accumulation was observed between the Pt and Ga atoms on the surface, i.e. formation of the Pt-Ga covalent bonds, but not of the Pt–Cu and Cu–Ga bonds. Compared with Pt–Pt, the interaction of Pt–Ga is 1.6 times stronger in L10-Pt2CuGa, and Pt–Cu is also stronger than that in L11-PtCu. The compressive strain caused by the addition of Ga optimized the interaction, adjusting the adsorption energy, increasing the activity, and reducing the dissolution of the metal due to the strong covalency [170,171]. 4.3 In-situ characterizations and theoretical calculations In-situ characterization and theoretical calculations can provide valuable insights into the design and optimization of Pt-based ORR catalysts. The reaction mechanism and the reaction process of the catalyst were strongly verified. 4.3.1 In-situ characterizations In situ characterizations play an increasingly important role in the field of catalysis and are widely used to study the chemical state and morphological changes of Pt-based catalysts in ORR. These techniques can provide valuable insights into catalytic processes and help to understand the structure-activity relationship of Pt-based ORR catalysts. A large number of in situ characterization techniques, such as in situ X-ray absorption spectroscopy (XAS), in situ X-ray diffraction (XRD), in situ Fourier transform infrared spectroscopy (FTIR), in situ Raman spectroscopy, in situ transmission electron microscopy (TEM), etc., have been developed and applied to study the electrocatalytic mechanism, which can provide rich information [172,173]. These include, but are not limited to, local coordination, real-time vibrational information during the reaction, degradation mechanism, reaction intermediates, and morphological evolution. The degradation mechanism of supported Pt nanocatalysts in proton exchange membrane fuel cells has been studied using liquid cell transmission electron microscopy in Fig. 11 by Impagnatiello et al [172]. The mechanism of surface area loss of supported Pt NPs was monitored in real-time under cyclic voltammetry by energy filtering transmission electron microscopy (EFTEM) coupling. Fig. 11(a–d) shows 0, 150, and 200 CVs from left to right in the same color. At 150 CVs, the interface separating Pt/C and electrolyte was essentially unchanged. At 200 CVs, holes appear at the carbon substrates boundary in Fig. 11(b) and corrosion occurs, which is related to the shedding of Pt particles. Fig. 11(c) shows the aggregation of particles. In Fig. 11(d), it is observed that particles aggregate to form larger particles. The degradation mechanism of the region in Fig. 11(e) is shown in Fig. 11(f–g). The dissolution and movement of particles into the electrolyte are observed in Fig. 11(f and g). The precipitation of Pt particles was observed in Fig. 11(h). The above provides a more in-depth understanding of the degradation mechanism of Pt NPs under operating conditions. The diagram of the test cell in situ XAS is shown in Fig. 11(i–l). In situ, XAS reveals the progressive evolution of the electronic structure of metal clusters, which is both potential-dependent and strongly current-dependent. The diagram of the test cell in situ XAS is shown in Fig. 11(i). Fig. 11(j) shows the Pt L3-edge XANES normalized absorbance spectrum μ(E) showing potential and O2 effects on the white line. Δμ(E) = μ V(E) −μ V0(E), when under different atmospheres and potential 400–1200 mV. The area of Pt L3 is proportional to the density of the unoccupied Pt d states and can therefore be used to estimate the charge on Pt. Fig. 11(k) shows the relative change of the oxidation state. Fig. 11(l) shows that the oxidation degree of Pt decreases with the increase of potential [174]. Smooth transitions with the increase of potential between platinum surfaces with different oxygen activities can be seen. In situ XAS directly observed the Pt–O bond changes under different potentials and atmospheres. In situ Raman spectroscopy was used to evaluate the effect of different order degrees on ORR. The key role of order degree of bimetallic IMCs is revealed by in-situ Raman spectroscopy by Chen et al. [9] Therefor, IMCs with different degrees of order were synthesized. Two different types of *OH were observed on ordered and disordered structures, and ordered sites had a lower affinity for *OH and were more favorable for ORR. HT-XRD in Fig. 3(e–g) was used to determine the change in order degree of intermetallic compounds during the heating process by Zeng et al. [116] A new scheme for the alloying process of the load IMCs has been designed. The in-situ technique is of great importance for the analysis of catalyst and intermediate species at different locations. The state of poisoning and adsorption during the catalytic reaction has also been analyzed. The crystal structure and electronic structure of IMCs during synthesis have been studied. As well as changes in the structure and composition of carbon substrates and NPs during the aging process of long-term use, they lay the foundation for revealing each link in the process and providing direct evidence. 4.3.2 Theoretical calculations To gain a fundamental understanding of the ORR on Pt-based catalysts and to guide the design of more active and durable materials for fuel cell applications, theoretical calculations, in particular DFT, have been extensively used. DFT has been used to study the ORR mechanism on low-index Pt (hkl) surfaces, which helps to understand the fundamental processes involved. To guide the design of more active catalysts, the relationships between ORR performance and the structural and electronic properties of Pt-based electrocatalysts are defined. The theory will help to elucidate links between ORR performance and structural features of Pt ORR nanocatalysts, including particle size, composition, and morphologies. Theoretical insights can reveal the relationships between the ORR performance and the structural features of Pt ORR catalysts, such as particle size, composition, and morphology, and elucidate the role of factors such as strain and ligand effects. Using density functional theory calculations, Quan et al. studied carbon-loaded Pt from single atoms to nanoparticles to bulk seen in Fig. 12 (a) [175]. The ORR overpotential of the Pt-based catalyst increases as the size of the catalyst increases to the nanoparticle scale or decreases to the single atom scale, and the lowest ORR overpotential of the Pt38 cluster that catans 38 atoms about 1 nm in one NP is 0.46 V. The mechanism of ORR on Pt described in Fig. 12(b). The Gibbs free energy diagram for ORR was caculated on PtC4 single atom, Pt38 cluster and Pt111 seeing in Fig. 12(c). The free energy of forming *OOH species catalysted on Pt38 is much lower than that, the rate determined step, on Pt111 and PtC4. Differently, the the rate determined step of Pt38 is the final step, the hydrogenation process of *OH. So that, different surface structures of Pt have different ORR activities, and the possessed the highest ORR activity. The calculation results of the relationship between ΔG *O, ΔG *OH, and ΔG *OOH was shown in Fig. 12(d), ΔG *OH and ΔG *O indicated a linear scaling relation, analogously with the relation between ΔG *OOH and ΔG *OH. Result in the ORR active is expressed by O*. It was confirmed that the intermediate material anchored to the Pt38 cluster has the appropriate binding energy and is at the top of the volcano curve by establishing a volcano curve, in Fig. 12(e), relationship between the ORR overpotential and the binding energy of O* (ΔE O*). The optimal size of Pt nanoparticles obtained by theoretical calculation is about 1 nm nanoparticles containing 38 Pt atoms. In the structure of L10 IMCs, the Pt and M atomic layers are arranged alternately along the C axis and parallel to the A and B axes, which facilitates the weakening of excessive compression. Taking L10-PtFe as an example, the calculation shows that the binding energy of Pt–O is 0.23 eV and that of the disordered alloy is 0.26 eV. The Pt–O binding energy of the former is closer to the theoretical optimum value of 0.2 eV, indicating that the d-band center of the former is slightly increased and the adsorption of Pt by the intermediates is relatively enhanced [176]. The Pt–O binding energies of ordered Pt3Co and disordered Pt3Co were 0.259 and 0.278 eV, respectively, indicating that L12-Pt3Co could effectively inhibit over-compression of d-band caused by alloying [177]. The data provided by the DFT provides valuable guidance for the selection of the most suitable IMC arrangement type and transition metal in ORR reactions. It also proves the fundamental reason why the ORR activity of IMCs is better than that of disordered alloys. Overall, the search results show that DFT has been extensively used for atomic-level understanding, design guidance, and performance evaluation of Pt-based ORR catalysts as well as other non-Pt-based ORR catalysts to improve their efficiency and practical applications in fuel cells. 5 Conclusion and perspectives Significant progress has been made in recent years in optimizing and developing PEMFC cathodic ORR catalysts. The load on the electrodes has been reduced from the milligram of Pt per square centimeter to tens or even a few micrograms per square centimeter. Cycle life also ranges from thousands of cycles to the 30,000 cycles required by ADT, and some catalysts can achieve cycle life above 100,000 cycles. In this paper, the recent research progress on Pt and transition metal dissolution of Pt and transition metal nanoparticles, aggregation of nanoparticles, size control of intermetallic compounds, and carrier-nanoparticle interaction were summarized. The optimization path and possible methods of catalyst preparation are summarized, and the design principle and optimization ideas of the catalyst are refined. The method of solvent evaporation during loading, the ordering process and mechanism, and the method of barrier reduction optimize the preparation process. The carbon carrier is optimized, the seed is pre-loaded on the carrier, the pore structure of the carrier is optimized and other non-metallic atoms are doped, and the interaction between the carrier and the nanoparticles is improved to obtain ultra-small size nanoparticles. Instead of the transition metals, one or more main group elements, secondary group elements, and transition metals have also been used to form intermetallic compounds with Pt and have shown surprising activity and stability, opening up new possibilities for Pt-based catalysts. The change in content altered the dissolution, mass activity, electronic structure, and lattice compressive stress, as well as the adsorption properties of oxygen-containing intermediate species and the stability of the catalyst, and improved the activity and life of the catalyst. The catalytic process and reaction mechanism of ORR were also supplemented. This brings the intermetallic ORR catalyst a step closer to commercial application with further improvements in operating cost and lifetime. Given the problems still existing in the current stage of Pt intergeneric compound ORR catalyst, further investigation and optimizations can be carried out in the future from the following aspects. (1) Though the particle size can be prepared down to 1 nm, the improvement in the utilization of Pt is still worthwhile. The cost of the precious metal is still a large proportion. To optimize and innovate the preparation process, high-order degree and small-size intermetallic compound nanoparticles were obtained by changing the loading and ordering process to obtain the best ORR catalyst. (2) While much effort has been made to maximize mass activity, durability is one of the critical factors for commercial application. Inhibition of Pt and transition metal dissolution, Ostwald ripening of nanoparticles, migration, and aggregation of particles are still problems limiting the durability of the catalyst. In addition, the dissolution of the carbon base and the interaction between the nanoparticles and the carbon that the nanoparticles would also affect durability. It is still an important direction to design the proper catalyst structure so that the durability of the catalyst can be greatly improved. (3) For the ordering process, the breaking of the barrier, the weakening of the binding energy to allow atoms to move and the optimization of the ordering program have attracted attention. The understanding of the ordering mechanism is still insufficient, and the influence and optimization of the cooling process on the ordering process remain to be explored. Efforts are still needed to deepen the understanding of the ordering process, innovate the ordering process, and achieve a high-efficiency and low-cost production process. (4) Clear analysis and in situ characterization are still needed to confirm the relationship and interaction between catalyst components. Direct characterization evidence is still needed for the process of catalyst changes and changes before and after the ORR reaction. It has more profound significance for the direction of catalyst optimization and design. The changes in lattice compressive stress and adsorption state caused by the change in the electronic structure after the formation of intermetallic compounds between Pt atoms and other metals also need to be more clearly and regularly understood. Changes in the adsorbability of oxygen and oxygen-containing intermediates caused by changes in the structure and electronic layer of the catalyst also require more regular understanding to guide the design of future catalysts. (5) The activity parameters reported in this paper are still tested in a three-electrode system in the form of a half-cell. However, compared to RDE, there are more complex factors influencing PEMFCs. In addition to the intrinsic activity of the catalyst, it is also related to the mass transfer, hydrophilicity, and MEA preparation process of the catalyst. The performance of metal dissolution and redeposition in the durability test is also very different in PEMFCs. Therefore, the research of PEMFCs is not limited to the improvement of catalyst performance but also relates to the study of the entire fuel cell system, and each component is properly coordinated with each other to achieve optimal performance. CRediT authorship contribution statement Heyuan Tian: Writing – review & editing, Writing – original draft, Visualization, Methodology, Data curation. Xian Wang: Writing – review & editing, Writing – original draft, Project administration. Jiawei Ge: Writing – review & editing, Writing – original draft, Software. Hao Wan: Writing – review & editing, Visualization, Resources. Wei Ma: Visualization, Conceptualization. Guanqun Xie: Writing – review & editing, Writing – original draft, Resources. Junjie Ge: Writing – review & editing, Writing – original draft, Resources. Declaration of competing interest The authors declare that they have no known competing financial interests or personal relationships that could have appeared to influence the work reported in this paper. Acknowledgments The work was supported by the National Key Research and Development Program of China (2022YFB4004100), National Natural Science Foundation of China (U22A20396, 22209168), and Natural Science Foundation of Anhui Province (2208085UD04). References [1] K. Kodama T. Nagai A. Kuwaki R. Jinnouchi Y. Morimoto Nat. Nanotechnol. 16 2021 140 147 K. Kodama, T. Nagai, A. Kuwaki, R. Jinnouchi, Y. Morimoto, Nat. Nanotechnol. 16 (2021) 140–147. [2] H. Cui Y.-X. Chen J. Energy Chem. 94 2024 70 77 H. Cui, Y.-X. Chen, J. Energy Chem. 94 (2024) 70–77. [3] T. Chen Y. Xu D. Meng X. Guo Y. Zhu L. Peng J. Hu W. Ding J. Energy Chem. 71 2022 304 312 T. Chen, Y. Xu, D. Meng, X. Guo, Y. Zhu, L. Peng, J. Hu, W. Ding J. Energy Chem. 71 (2022) 304–312. [4] J.S. Bates M.R. Johnson F. Khamespanah T.W. Root S.S. Stahl Chem. Rev. 123 2023 6233 6256 J.S. Bates, M.R. Johnson, F. Khamespanah, T.W. Root, S.S. Stahl, Chem. Rev. 123 (2023) 6233–6256. [5] P. Cui L. Zhao Y. Long L. Dai C. Hu Angew. Chem. Int. Ed. Engl. 62 2023 e202218269 P. Cui, L. Zhao, Y. Long, L. Dai, C. Hu, Angew. Chem. Int. Ed. Engl. 62 (2023) e202218269. [6] D. Takimoto S. Toma Y. Suda T. Shirokura Y. Tokura K. Fukuda M. Matsumoto H. Imai W. Sugimoto Nat. Commun. 14 2023 19 D. Takimoto, S. Toma, Y. Suda, T. Shirokura, Y. Tokura, K. Fukuda, M. Matsumoto, H. Imai, W. Sugimoto, Nat. Commun. 14 (2023) 19. [7] M. Wang L. Li M. Wang X. Huang NPG Asia Mater. 14 2022 78 M. Wang, L. Li, M. Wang, X. Huang, NPG Asia Mater. 14 (2022) 78. [8] J.M. Kim A. Jo K.A. Lee H.J. Han Y.J. Kim H.Y. Kim G.R. Lee M. Kim Y. Park Y.S. Kang J. Jung K.H. Chae E. Lee H.C. Ham H. Ju Y.S. Jung J.Y. Kim Sci. Adv. 7 2021 eabe9083 J.M. Kim, A. Jo, K.A. Lee, H.J. Han, Y.J. Kim, H.Y. Kim, G.R. Lee, M. Kim, Y. Park, Y.S. Kang, J. Jung, K.H. Chae, E. Lee, H.C. Ham, H. Ju, Y.S. Jung, J.Y. Kim, Sci. Adv. 7 (2021) eabe9083. [9] H.Q. Chen H. Ze M.F. Yue D.Y. Wei Y.F. Wu J.C. Dong Y.J. Zhang H. Zhang Z.Q. Tian J.F. Li Angew. Chem., Int. Ed. 61 2022 e202117834 H.Q. Chen, H. Ze, M.F. Yue, D.Y. Wei, Y.L. A, Y.F. Wu, J.C. Dong, Y.J. Zhang, H. Zhang, Z.Q. Tian, J.F. Li, Angew. Chem., Int. Ed. 61 (2022) e202117834. [10] S. Lu Y. Jin H. Gu W. Zhang Sci. China. Chem. 60 2017 999 1006 S. Lu, Y. Jin, H. Gu, W. Zhang, Sci. China. Chem. 60 (2017) 999–1006. [11] Q. Zhang T. Shen M. Song S. Wang J. Zhang X. Huang S. Lu D. Wang J. Energy Chem. 86 2023 158 166 Q. Zhang, T. Shen, M. Song, S. Wang, J. Zhang, X. Huang, S. Lu, D. Wang, J. Energy Chem. 86 (2023) 158–166. [12] R. Brandiele A. Guadagnini M. Parnigotto F. Pini V. Coviello D. Badocco P. Pastore G.A. Rizzi A. Vittadini D. Forrer V. Amendola C. Durante J. Energy Chem. 92 2024 508 520 R. Brandiele, A. Guadagnini, M. Parnigotto, F. Pini, V. Coviello, D. Badocco, P. Pastore, G.A. Rizzi, A. Vittadini, D. Forrer, V. Amendola, C. Durante, J. Energy Chem. 92 (2024) 508–520. [13] Z. Qin L. Wu R. He Z. Meng J. Pan J. Zeng Electrochim. Acta 475 2024 143675 Z. Qin, L. Wu, R. He, Z. Meng, J. Pan, J. Zeng, Electrochim. Acta 475 (2024) 143675. [14] M.F. Matus H. Häkkinen Nat. Rev. Mater. 8 2023 372 389 M.F. Matus, H. Häkkinen, Nat. Rev. Mater. 8 (2023) 372–389. [15] H. Li H. Zhao B. Tao G. Xu S. Gu G. Wang H. Chang Nanomaterials (basel) 12 2022 4173 H. Li, H. Zhao, B. Tao, G. Xu, S. Gu, G. Wang, H. Chang, Nanomaterials (Basel) 12 (2022) 4173. [16] H. Lv Y. Zheng Y. Wang J. Wang B. Liu Z.A. Qiao Angew. Chem., Int. Ed. 62 2023 e202304420 H. Lv, Y. Zheng, Y. Wang, J. Wang, B. Liu, Z.A. Qiao, Angew. Chem., Int. Ed. 62 (2023) e202304420. [17] H.Q. Chen H. Ze M.F. Yue D.Y. Wei Y.F. Wu J.C. Dong Y.J. Zhang H. Zhang Z.Q. Tian J.F. Li Angew. Chem. 134 2022 e202117834 H.Q. Chen, H. Ze, M.F. Yue, D.Y. Wei, Y.L. A, Y.F. Wu, J.C. Dong, Y.J. Zhang, H. Zhang, Z.Q. Tian, J.F. Li, Angew. Chem. 134 (2022) e202117834. [18] V. Yarlagadda M.K. Carpenter T.E. Moylan R.S. Kukreja R. Koestner W. Gu L. Thompson A. Kongkanand Acs Energy Lett. 3 2018 618 621 V. Yarlagadda, M.K. Carpenter, T.E. Moylan, R.S. Kukreja, R. Koestner, W. Gu, L. Thompson, A. Kongkanand, Acs Energy Lett. 3 (2018) 618–621. [19] Y. Xiong Y. Yang F.J. DiSalvo H.D. Abruña ACS Nano 14 2020 13069 13080 Y. Xiong, Y. Yang, F.J. DiSalvo, H.D. Abruña, ACS Nano 14 (2020) 13069-13080. [20] X. Xie V. Briega-Martos R. Farris M. Dopita M. Vorokhta T. Skála I. Matolínová K.M. Neyman S. Cherevko I. Khalakhan ACS Appl. Mater. Interfaces 15 2022 1192 1200 X. Xie, V. Briega-Martos, R. Farris, M. Dopita, M. Vorokhta, T. Skála, I. Matolínová, K.M. Neyman, S. Cherevko, I. Khalakhan, ACS Appl. Mater. Interfaces 15 (2022) 1192–1200. [21] M. Xie Z. Lyu R. Chen M. Shen Z. Cao Y. Xia J. Am. Chem. Soc. 143 2021 8509 8518 M. Xie, Z. Lyu, R. Chen, M. Shen, Z. Cao, Y. Xia, J. Am. Chem. Soc. 143 (2021) 8509–8518. [22] J. Gao X. Zhou Y. Wang Y. Chen Z. Xu Y. Qiu Q. Yuan X. Lin H.J. Qiu Small 18 2022 2202071 J. Gao, X. Zhou, Y. Wang, Y. Chen, Z. Xu, Y. Qiu, Q. Yuan, X. Lin, H.J. Qiu, Small 18 (2022) 2202071. [23] G. Reverdiau A. Le Duigou T. Alleau T. Aribart C. Dugast T. Priem Int. J. Hydrogen Energy 46 2021 39195 39207 G. Reverdiau, A. Le Duigou, T. Alleau, T. Aribart, C. Dugast, T. Priem, Int. J. Hydrogen Energy 46 (2021) 39195–39207. [24] T. Đukić L.J. Moriau I. Klofutar M. Šala L. Pavko F.J. González López F. Ruiz-Zepeda A. Pavlišič M. Hotko M. Gatalo N. Hodnik ACS Catal. 14 2024 4303 4317 T. Đukić, L.J. Moriau, I. Klofutar, M. Šala, L. Pavko, F.J. González López, F. Ruiz-Zepeda, A. Pavlišič, M. Hotko, M. Gatalo, N. Hodnik, ACS Catal. 14 (2024) 4303–4317. [25] S. Li J.-J. Li C. Xu L. Zhang A. Li T.-W. Song W. Zhang L. Tong H.-W. Liang ACS Mater. Lett. 2024 706 712 S. Li, J.-J. Li, C. Xu, L. Zhang, A. Li, T.-W. Song, W. Zhang, L. Tong, H.-W. Liang, ACS Materials Lett. (2024) 706–712. [26] H.Y. Kim S.H. Joo J. Mater. Chem. A 8 2020 8195 8217 H.Y. Kim, S.H. Joo, J. Mater. Chem. A 8 (2020) 8195–8217. [27] T. Takeshita Y. Kamitaka K. Shinozaki K. Kodama Y. Morimoto J. Electroanal. Chem. 871 2020 114250 T. Takeshita, Y. Kamitaka, K. Shinozaki, K. Kodama, Y. Morimoto, J. Electroanal. Chem. 871 (2020) 114250. [28] J. Hou M. Yang C. Ke G. Wei C. Priest Z. Qiao G. Wu J. Zhang Energy Chem. 2 2020 100023 J. Hou, M. Yang, C. Ke, G. Wei, C. Priest, Z. Qiao, G. Wu, J. Zhang, Energy Chem. 2 (2020) 100023. [29] W. Li D. Wang T. Liu L. Tao Y. Zhang Y.C. Huang S. Du C.L. Dong Z. Kong Y.F. Li S. Lu S. Wang Adv. Funct. Mater. 32 2021 2109244 W. Li, D. Wang, T. Liu, L. Tao, Y. Zhang, Y.C. Huang, S. Du, C.L. Dong, Z. Kong, Y.f. Li, S. Lu, S. Wang, Adv. Funct. Mater. 32 (2021) 2109244. [30] Y. Che H. Wang H. Fu D. Ma L. Wang R. Anton S. Yan T. Bian J. Alloys Compd. 969 2023 172401 Y. Che, H. Wang, H. Fu, D. Ma, L. Wang, R. Anton, S. Yan, T. Bian, J. Alloys Compd. 969 (2023) 172401. [31] M. Gong D. Xiao Z. Deng R. Zhang W. Xia T. Zhao X. Liu T. Shen Y. Hu Y. Lu X. Zhao H. Xin D. Wang Appl. Catal., B 282 2021 119617 M. Gong, D. Xiao, Z. Deng, R. Zhang, W. Xia, T. Zhao, X. Liu, T. Shen, Y. Hu, Y. Lu, X. Zhao, H. Xin, D. Wang, Appl. Catal., B 282 (2021) 119617. [32] L.-C. Lin C.-H. Kuo Y.-H. Hsu L.-C. Hsu H.-Y. Chen J.-L. Chen Y.-T. Pan Appl. Catal., B 317 2022 121767 L.-C. Lin, C.-H. Kuo, Y.-H. Hsu, L.-C. Hsu, H.-Y. Chen, J.-L. Chen, Y.-T. Pan, Appl. Catal., B 317 (2022) 121767. [33] H. Wu H. Zhong Y. Pan H. Li Y. Peng L. Yang S. Luo D. Banham J. Zeng Colloids Surf., A 656 2023 130341 H. Wu, H. Zhong, Y. Pan, H. Li, Y. Peng, L. Yang, S. Luo, D. Banham, J. Zeng, Colloids Surf., A 656 (2023) 130341. [34] T. Zhao Y. Li J. Liu X. Wang J. Zhang C. Liu W. Xing J. Ge Chin. Chem. Lett. 34 2023 107824 T. Zhao, Y. Li, J. Liu, X. Wang, J. Zhang, C. Liu, W. Xing, J. Ge, Chin. Chem. Lett. 34 (2023) 107824. [35] B. Hu J. Yuan J. Zhang Q. Shu D. Guan G. Yang W. Zhou Z. Shao Compos. Part B-Eng. 222 2021 109082 B. Hu, J. Yuan, J. Zhang, Q. Shu, D. Guan, G. Yang, W. Zhou, Z. Shao, Compos. Part B-Eng. 222 (2021) 109082. [36] C. Zhang Z. Chen H. Yang Y. Luo Z. Qun Tian P. Kang Shen J. Colloid Interface Sci. 652 2023 1597 1608 C. Zhang, Z. Chen, H. Yang, Y. Luo, Z. Qun Tian, P. Kang Shen, J. Colloid Interface Sci. 652 (2023) 1597–1608. [37] W. Li N. Bhuvanendran W. Zhang Q. Xu K. Hooshyari H. Su Int. J. Hydrogen Energy 47 2022 24807 24816 W. Li, N. Bhuvanendran, W. Zhang, Q. Xu, K. Hooshyari, H. Su, Int. J. Hydrogen Energy 47 (2022) 24807–24816. [38] W.-H. Chen M.-H. Chang T.-W. Wang M.-S. Wang Int. J. Hydrogen Energy 51 2024 1487 1496 W.-H. Chen, M.-H. Chang, T.-W. Wang, M.-S. Wang, Int. J. Hydrogen Energy 51 (2024) 1487–1496. [39] X.X. Wang J. Sokolowski H. Liu G. Wu Chin. J. Catal. 41 2020 739 755 X.X. Wang, J. Sokolowski, H. Liu, G. Wu, Chin. J. Catal. 41 (2020) 739–755. [40] Y. Wu L. Chen S. Geng Y. Tian R. Chen K. Wang Y. Wang S. Song Adv. Funct. Mater. 2023 2307297 Y. Wu, L. Chen, S. Geng, Y. Tian, R. Chen, K. Wang, Y. Wang, S. Song, Adv. Funct. Mater. (2023) 2307297. [41] Z. Liu Y. Yin D. Yang C. Zhang P. Ming B. Li S. Yang RSC Adv. 10 2020 6287 6296 Z. Liu, Y. Yin, D. Yang, C. Zhang, P. Ming, B. Li, S. Yang, RSC Adv. 10 (2020) 6287–6296. [42] E. Fidiani G. Thirunavukkarasu Y. Li Y.-L. Chiu S. Du J. Mater. Chem. A 8 2020 11874 11883 E. Fidiani, G. Thirunavukkarasu, Y. Li, Y.-L. Chiu, S. Du, J. Mater. Chem. A 8 (2020) 11874–11883. [43] O. Lagrichi L. Guétaz O. Sicardy D. Buttard A. Morin ACS Appl. Energy Mater. 5 2022 11997 12012 O. Lagrichi, L. Guétaz, O. Sicardy, D. Buttard, A. Morin, ACS Appl. Energy Mater. 5 (2022) 11997–12012. [44] K. Wan H. Chen J. Wang B. Li M. Chai P. Ming C. Zhang J. Catal. 427 2023 115124 K. Wan, H. Chen, J. Wang, B. Li, M. Chai, P. Ming, C. Zhang, J. Catal. 427 (2023) 115124. [45] A.S. Haile W. Yohannes Y.S. Mekonnen RSC Adv. 10 2020 27346 27356 A.S. Haile, W. Yohannes, Y.S. Mekonnen, RSC Adv. 10 (2020) 27346–27356. [46] E.B. Tetteh C. Gyan-Barimah H.-Y. Lee T.-H. Kang S. Kang S. Ringe J.-S. Yu ACS Appl. Mater. Interfaces 14 2022 25246 25256 E.B. Tetteh, C. Gyan-Barimah, H.-Y. Lee, T.-H. Kang, S. Kang, S. Ringe, J.-S. Yu, ACS Appl. Mater. Interfaces 14 (2022) 25246–25256. [47] H. Wang R. Lin X. Cai S. Liu D. Zhong Z. Hao Int. J. Heat Mass Tran. 178 2021 121615 H. Wang, R. Lin, X. Cai, S. Liu, D. Zhong, Z. Hao, Int. J. Heat Mass Tran. 178 (2021) 121615. [48] Y. Yang M. Bai Z. Zhou W.-T. Wu C. Hu L. Gao Y. Li Y. Li Y. Song Int. J. Heat Mass Tran. 218 2024 124793 Y. Yang, M. Bai, Z. Zhou, W.-T. Wu, C. Hu, L. Gao, Y. Li, Y. Li, Y. Song, Int. J. Heat Mass Tran. 218 (2024) 124793. [49] D.Y. Shin D.-H. Lim Appl. Surf. Sci. 616 2023 156449 D.Y. Shin, D.-H. Lim, Appl. Surf. Sci. 616 (2023) 156449. [50] D. Wu Y. Yang C. Dai D. Cheng Int. J. Hydrogen Energy 45 2020 4427 4434 D. Wu, Y. Yang, C. Dai, D. Cheng, Int. J. Hydrogen Energy 45 (2020) 4427–4434. [51] H.R. Litkohi A. Bahari M.P. Gatabi Int. J. Hydrogen Energy 45 2020 23543 23556 H.R. Litkohi, A. Bahari, M.P. Gatabi, Int. J. Hydrogen Energy 45 (2020) 23543–23556. [52] M. Huang T. Liu K. Hou F. Sun C. Wu L. Guan Int. J. Hydrogen Energy 47 2022 6679 6690 M. Huang, T. Liu, K. Hou, F. Sun, C. Wu, L. Guan, Int. J. Hydrogen Energy 47 (2022) 6679–6690. [53] W. Yan X. Wang M. Liu K. Ma L. Wang Q. Liu C. Wang X. Jiang H. Li Y. Tang G. Fu Adv. Funct. Mater. 2023 2310487 W. Yan, X. Wang, M. Liu, K. Ma, L. Wang, Q. Liu, C. Wang, X. Jiang, H. Li, Y. Tang, G. Fu, Adv. Funct. Mater. (2023) 2310487. [54] X. Zhao C. Xi R. Zhang L. Song C. Wang J.S. Spendelow A.I. Frenkel J. Yang H.L. Xin K. Sasaki ACS Catal. 10 2020 10637 10645 X. Zhao, C. Xi, R. Zhang, L. Song, C. Wang, J.S. Spendelow, A.I. Frenkel, J. Yang, H.L. Xin, K. Sasaki, ACS Catal. 10 (2020) 10637–10645. [55] J. Bak H. Kim S. Lee M. Kim E.-J. Kim J. Roh J. Shin C.H. Choi E. Cho ACS Catal. 10 2020 12300 12309 J. Bak, H. Kim, S. Lee, M. Kim, E.-J. Kim, J. Roh, J. Shin, C.H. Choi, E. Cho, ACS Catal. 10 (2020) 12300–12309. [56] R. Xu L. Kang K.G. Papanikolaou B. Wang S. Marlow Q. He P. Zhang J. Wang D.J.L. Brett M. Stamatakis F.R. Wang J. Catal. 416 2022 311 321 R. Xu, L. Kang, K.G. Papanikolaou, B. Wang, S. Marlow, Q. He, P. Zhang, J. Wang, D.J.L. Brett, M. Stamatakis, F.R. Wang, J. Catal. 416 (2022) 311–321. [57] J.H. Kim J.Y. Cheon T.J. Shin J.Y. Park S.H. Joo Carbon 101 2016 449 457 J.H. Kim, J.Y. Cheon, T.J. Shin, J.Y. Park, S.H. Joo, Carbon, 101 (2016) 449–457. [58] X. Hu B. Yang S. Ke Y. Liu M. Fang Z. Huang X. Min Energy Fuels 37 2023 11532 11566 X. Hu, B. Yang, S. Ke, Y. Liu, M. Fang, Z. Huang, X. Min, Energy Fuels 37 (2023) 11532–11566. [59] Y.-F. Xia B. Liu P. Guo F.-D. Tu L.-X. Shen M. Ma Y.-K. Dai J. Liu B. Xu Y.-L. Zhang L. Zhao Y. Wang Z.-B. Wang J. Catal. 429 2024 115296 Y.-F. Xia, B. Liu, P. Guo, F.-D. Tu, L.-X. Shen, M. Ma, Y.-K. Dai, J. Liu, B. Xu, Y.-L. Zhang, L. Zhao, Y. Wang, Z.-B. Wang, J. Catal. 429 (2024) 115296. [60] A.S. Haile H.A. Hansen W. Yohannes Y.S. Mekonnen J. Phys. Chem. Lett. 12 2021 3552 3559 A.S. Haile, H.A. Hansen, W. Yohannes, Y.S. Mekonnen, J. Phys. Chem. Lett. 12 (2021) 3552–3559. [61] P. Gao Y. Cai F. Wang H. Zhu M. Pu Int. J. Hydrogen Energy 45 2020 16039 16048 P. Gao, Y. Cai, F. Wang, H. Zhu, M. Pu, Int. J. Hydrogen Energy 45 (2020) 16039–16048. [62] U.S. Department of Energy, Hydrogen and Fuel Cell Technologies Office Multi-Year Program Plan, 2024. [63] J.A. Prithi R. Shanmugam M.K. Sahoo N. Rajalakshmi G.R. Rao Int. J. Hydrogen Energy 47 2022 36232 36247 J.A. Prithi, R. Shanmugam, M.K. Sahoo, N. Rajalakshmi, G.R. Rao, Int. J. Hydrogen Energy 47 (2022) 36232–36247. [64] M. Wang M. Wang L. Guo Y. Li S. Chen Z. Wei Int. J. Hydrogen Energy 47 2022 27116 27123 M. Wang, M. Wang, L. Guo, Y. Li, S. Chen, Z. Wei, Int. J. Hydrogen Energy 47 (2022) 27116–27123. [65] X. Li Y. He S. Cheng B. Li Y. Zeng Z. Xie Q. Meng L. Ma K. Kisslinger X. Tong S. Hwang S. Yao C. Li Z. Qiao C. Shan Y. Zhu J. Xie G. Wang G. Wu D. Su Adv. Mater. 33 2021 2106371 X. Li, Y. He, S. Cheng, B. Li, Y. Zeng, Z. Xie, Q. Meng, L. Ma, K. Kisslinger, X. Tong, S. Hwang, S. Yao, C. Li, Z. Qiao, C. Shan, Y. Zhu, J. Xie, G. Wang, G. Wu, D. Su, Adv. Mater. 33 (2021) 2106371. [66] J. Guan J. Zhang X. Wang Z. Zhang F. Wang Adv. Mater. 35 2022 2207995 J. Guan, J. Zhang, X. Wang, Z. Zhang, F. Wang, Adv. Mater. 35 (2022) 2207995. [67] A. Pedersen J. Pandya G. Leonzio A. Serov A. Bernardi I.E.L. Stephens M.-M. Titirici C. Petit B. Chachuat Green Chem. 25 2023 10458 10471 A. Pedersen, J. Pandya, G. Leonzio, A. Serov, A. Bernardi, I.E.L. Stephens, M.-M. Titirici, C. Petit, B. Chachuat, Green Chem. 25 (2023) 10458–10471. [68] X. Huang Y. Wang W. Li Y. Hou Sci. China. Chem. 60 2017 1494 1507 X. Huang, Y. Wang, W. Li, Y. Hou, Sci. China. Chem. 60 (2017) 1494–1507. [69] Z. Qiao C. Wang C. Li Y. Zeng S. Hwang B. Li S. Karakalos J. Park A.J. Kropf E.C. Wegener Q. Gong H. Xu G. Wang D.J. Myers J. Xie J.S. Spendelow G. Wu Energy Environ. Sci. 14 2021 4948 4960 Z. Qiao, C. Wang, C. Li, Y. Zeng, S. Hwang, B. Li, S. Karakalos, J. Park, A.J. Kropf, E.C. Wegener, Q. Gong, H. Xu, G. Wang, D.J. Myers, J. Xie, J.S. Spendelow, G. Wu, Energy Environ. Sci. 14 (2021) 4948–4960. [70] Ö. Şahin A. Akdag S. Horoz A. Ekinci Int. J. Hydrogen Energy 48 2023 16829 16840 Ö. Şahin, A. Akdag, S. Horoz, A. Ekinci, Int. J. Hydrogen Energy 48 (2023) 16829–16840. [71] L. Duclos R. Chattot L. Dubau P.-X. Thivel G. Mandil V. Laforest M. Bolloli R. Vincent L. Svecova Green Chem. 22 2020 1919 1933 L. Duclos, R. Chattot, L. Dubau, P.-X. Thivel, G. Mandil, V. Laforest, M. Bolloli, R. Vincent, L. Svecova, Green Chem. 22 (2020) 1919–1933. [72] B. Zhang G. Fu Y. Li L. Liang N.S. Grundish Y. Tang J.B. Goodenough Z. Cui Angew. Chem., Int. Ed. 59 2020 7857 7863 B. Zhang, G. Fu, Y. Li, L. Liang, N.S. Grundish, Y. Tang, J.B. Goodenough, Z. Cui, Angew. Chem., Int. Ed. 59 (2020) 7857–7863. [73] Q. Shu S. Yang X. Zhang Z. Li Y. Zhang Y. Tang H. Gao C. Xia M. Zhao X. Li H. Zhao Int. J. Hydrogen Energy 57 2024 90 99 Q. Shu, S. Yang, X. Zhang, Z. Li, Y. Zhang, Y. Tang, H. Gao, C. Xia, M. Zhao, X. Li, H. Zhao, Int. J. Hydrogen Energy 57 (2024) 90–99. [74] Y. Yan G. Li X. Cheng S. Yin H. Zeng R. Huang C. Wang Y. Jiang S. Sun Int. J. Hydrogen Energy 48 2023 19522 19531 Y. Yan, G. Li, X. Cheng, S. Yin, H. Zeng, R. Huang, C. Wang, Y. Jiang, S. Sun, Int. J. Hydrogen Energy 48 (2023) 19522–19531. [75] V.A. Kovtunenko Int. J. Hydrogen Energy 51 2024 1518 1526 V.A. Kovtunenko, Int. J. Hydrogen Energy 51 (2024) 1518–1526. [76] Z. Abkar R. Ojani J.B. Raoof M. Najafi Roudbari Int. J. Hydrogen Energy 47 2022 19252 19262 Z. Abkar, R. Ojani, J.b. Raoof, M. Najafi Roudbari, Int. J. Hydrogen Energy 47 (2022) 19252–19262. [77] S. Sarkar S.C. Peter Chem.-Asian J. 16 2021 1184 1197 S. Sarkar, S.C. Peter, Chem.-Asian J. 16 (2021) 1184–1197. [78] A. Marinoiu M. Raceanu M. Andrulevicius A. Tamuleviciene T. Tamulevicius S. Nica D. Bala M. Varlam Arab. J. Chem. 13 2020 3585 3600 A. Marinoiu, M. Raceanu, M. Andrulevicius, A. Tamuleviciene, T. Tamulevicius, S. Nica, D. Bala, M. Varlam, Arab. J. Chem. 13 (2020) 3585–3600. [79] Y. Xue X. Deng Y. Yan J. Zhang G. Wang R. Wang J. Chen Chem. Electro. Chem. 10 2023 e202300094 Y. Xue, X. Deng, Y. Yan, J. Zhang, G. Wang, R. Wang, J. Chen, Chem. Electro. Chem. 10 (2023) e202300094. [80] Q. Wang Z.L. Zhao Z. Zhang T. Feng R. Zhong H. Xu S.T. Pantelides M. Gu Adv. Sci. 7 2019 1901279 Q. Wang, Z.L. Zhao, Z. Zhang, T. Feng, R. Zhong, H. Xu, S.T. Pantelides, M. Gu, Adv. Sci. 7 (2019) 1901279. [81] J. Kim Y. Hong K. Lee J.Y. Kim Adv. Energy Mater. 10 2020 2002049 J. Kim, Y. Hong, K. Lee, J.Y. Kim, Adv. Energy Mater. 10 (2020) 2002049. [82] M. Wang Y. Liu Y. Li S. Chen Z. Wei Chem. Eng. J. 465 2023 142748 M. Wang, Y. Liu, Y. Li, S. Chen, Z. Wei, Chem. Eng. J. 465 (2023) 142748. [83] Z. Xiao Y. Jiang H. Wu H. Zhong H. Song A. Abdelhafiz J. Zeng J. Alloys Compd. 877 2021 160221 Z. Xiao, Y. Jiang, H. Wu, H. Zhong, H. Song, A. Abdelhafiz, J. Zeng, J. Alloys Compd. 877 (2021) 160221. [84] T.-W. Song C. Xu Z.-T. Sheng H.-K. Yan L. Tong J. Liu W.-J. Zeng L.-J. Zuo P. Yin M. Zuo S.-Q. Chu P. Chen H.-W. Liang Nat. Commun. 13 2022 6521 T.-W. Song, C. Xu, Z.-T. Sheng, H.-K. Yan, L. Tong, J. Liu, W.-J. Zeng, L.-J. Zuo, P. Yin, M. Zuo, S.-Q. Chu, P. Chen, H.-W. Liang, Nat. Commun. 13 (2022) 6521. [85] E. Wang L. Luo Y. Feng A. Wu H. Li X. Luo Y. Guo Z. Tan F. Zhu X. Yan Q. Kang Z. Zhuang D. Yang S. Shen J. Zhang J. Energy Chem. 93 2024 157 165 E. Wang, L. Luo, Y. Feng, A. Wu, H. Li, X. Luo, Y. Guo, Z. Tan, F. Zhu, X. Yan, Q. Kang, Z. Zhuang, D. Yang, S. Shen, J. Zhang, J. Energy Chem. 93 (2024) 157–165. [86] X. Liu S. Hao G. Zheng Z. Su Y. Wang Q. Wang L. Lei Y. He X. Zhang J. Energy Chem. 64 2022 315 322 X. Liu, S. Hao, G. Zheng, Z. Su, Y. Wang, Q. Wang, L. Lei, Y. He, X. Zhang, J. Energy Chem. 64 (2022) 315–322. [87] S. Zhang K. Jiang H. Jiang J. Zhu H. Ji C. Lu L. Zhang J. Li Z. Chen C. Ke X. Zhuang Chem. Electro. Chem. 9 2022 e202101458 S. Zhang, K. Jiang, H. Jiang, J. Zhu, H. Ji, C. Lu, L. Zhang, J. Li, Z. Chen, C. Ke, X. Zhuang, Chem. Electro. Chem. 9 (2022) e202101458 [88] L. Sun Y. Yin B. Ren Y. Qin G. Wen Z. Chen Nano Energy 120 2024 109154 L. Sun, Y. Yin, B. Ren, Y. Qin, G. Wen, Z. Chen, Nano Energy 120 (2024) 109154. [89] T.D. Le D. Van Dao G. Adilbish Y.-T. Yu Int. J. Hydrogen Energy 47 2022 1833 1844 T.D. Le, D. Van Dao, G. Adilbish, Y.-T. Yu, Int. J. Hydrogen Energy 47 (2022) 1833–1844. [90] Y.-T. Mu P. He F. Bai L. Chen Z.-G. Qu W.-Q. Tao Int. J. Hydrogen Energy 48 2023 3232 3251 Y.-T. Mu, P. He, F. Bai, L. Chen, Z.-G. Qu, W.-Q. Tao, Int. J. Hydrogen Energy 48 (2023) 3232–3251. [91] H.M. Alfaro-López M.A. Valdés-Madrigal H. Rojas-Chávez H. Cruz-Martínez M.A. Padilla-Islas M.M. Tellez-Cruz O. Solorza-Feria Catal. 10 2020 170 H.M. Alfaro-López, M.A. Valdés-Madrigal, H. Rojas-Chávez, H. Cruz-Martínez, M.A. Padilla-Islas, M.M. Tellez-Cruz, O. Solorza-Feria, Catal., 10 (2020) 170. [92] R. Gui H. Cheng M. Wang X. Tai H. Zhang C. Liu X. Cao C. Chen M. Ge H. Wang X. Zheng W. Chu Y. Lin Y. Xie C. Wu Adv. Mater. 2023 2307661 R. Gui, H. Cheng, M. Wang, X. Tai, H. Zhang, C. Liu, X. Cao, C. Chen, M. Ge, H. Wang, X. Zheng, W. Chu, Y. Lin, Y. Xie, C. Wu, Adv. Mater. (2023) 2307661. [93] M. Song F. Li Q. Zhang T. Shen G. Luo D. Li D. Wang Chem. Eng. J. 478 2023 147287 M. Song, F. Li, Q. Zhang, T. Shen, G. Luo, D. Li, D. Wang, Chem. Eng. J. 478 (2023) 147287. [94] L. Sun Y. Qin Y. Yin J. Power Sources 562 2023 232758 L. Sun, Y. Qin, Y. Yin, J. Power Sources 562 (2023) 232758. [95] D. Banham J. Zou S. Mukerjee Z. Liu D. Yang Y. Zhang Y. Peng A. Dong J. Power Sources 490 2021 229515 D. Banham, J. Zou, S. Mukerjee, Z. Liu, D. Yang, Y. Zhang, Y. Peng, A. Dong, J. Power Sources 490 (2021) 229515. [96] J. Cui Q. Chen X. Li S. Zhang Green Chem. 23 2021 6898 6925 J. Cui, Q. Chen, X. Li, S. Zhang, Green Chem. 23 (2021) 6898–6925. [97] J. Liang Z. Zhao N. Li X. Wang S. Li X. Liu T. Wang G. Lu D. Wang B.J. Hwang Y. Huang D. Su Q. Li Adv. Energy Mater. 10 2020 2000179 J. Liang, Z. Zhao, N. Li, X. Wang, S. Li, X. Liu, T. Wang, G. Lu, D. Wang, B.J. Hwang, Y. Huang, D. Su, Q. Li, Adv. Energy Mater. 10 (2020) 2000179. [98] X. Feng Y. Bai W. Zhang F. Wang D. Sun J. Li Z. Wei Acs Energy Lett. 8 2022 628 636 X. Feng, Y. Bai, W. Zhang, F. Wang, D. Sun, J. Li, Z. Wei, Acs Energy Lett. 8 (2022) 628–636. [99] Y. Zeng J. Liang C. Li Z. Qiao B. Li S. Hwang N.N. Kariuki C.-W. Chang M. Wang M. Lyons S. Lee Z. Feng G. Wang J. Xie D.A. Cullen D.J. Myers G. Wu J. Am. Chem. Soc. 145 2023 17643 17655 Y. Zeng, J. Liang, C. Li, Z. Qiao, B. Li, S. Hwang, N.N. Kariuki, C.-W. Chang, M. Wang, M. Lyons, S. Lee, Z. Feng, G. Wang, J. Xie, D.A. Cullen, D.J. Myers, G. Wu, J. Am. Chem. Soc. 145 (2023) 17643–17655. [100] W. Guo X. Gao M. Zhu C. Xu X. Zhu X. Zhao R. Sun Z. Xue J. Song L. Tian J. Xu W. Chen Y. Lin Y. Li H. Zhou Y. Wu Energy Environ. Sci. 16 2023 148 156 W. Guo, X. Gao, M. Zhu, C. Xu, X. Zhu, X. Zhao, R. Sun, Z. Xue, J. Song, L. Tian, J. Xu, W. Chen, Y. Lin, Y. Li, H. Zhou, Y. Wu, Energy Environ. Sci. 16 (2023) 148–156. [101] Y. Gao N. Thakur T. Uchiyama W. Cao K. Yamamoto T. Watanabe M. Kumar R. Sato T. Teranishi H. Imai Y. Sakurai Y. Uchimoto ACS Appl. Mater. Interfaces 15 2023 52473 52484 Y. Gao, N. Thakur, T. Uchiyama, W. Cao, K. Yamamoto, T. Watanabe, M. Kumar, R. Sato, T. Teranishi, H. Imai, Y. Sakurai, Y. Uchimoto, ACS Appl. Mater. Interfaces 15 (2023) 52473−52484. [102] P.A. Loichet Torres Y.-S. Li C. Grön T. Lazaridis P. Watermeyer N. Cheng C.H. Liebscher H.A. Gasteiger J. Electrochem. Soc 170 2023 124503 P.A. Loichet Torres, Y.-S. Li, C. Grön, T. Lazaridis, P. Watermeyer, N. Cheng, C.H. Liebscher, H.A. Gasteiger, J. Electrochem. Soc 170 (2023) 124503. [103] W. Zhu Y. Pei H. Liu R. Yue S. Ling J. Zhang X. Liu Y. Yin M.D. Guiver Sadv. Sci. 10 2023 2206062 W. Zhu, Y. Pei, H. Liu, R. Yue, S. Ling, J. Zhang, X. Liu, Y. Yin, M.D. Guiver, SAdv. Sci. 10 (2023) 2206062. [104] Z. Zhao Z. Liu A. Zhang X. Yan W. Xue B. Peng H.L. Xin X. Pan X. Duan Y. Huang Nat. Nanotechnol. 17 2022 968 975 Z. Zhao, Z. Liu, A. Zhang, X. Yan, W. Xue, B. Peng, H.L. Xin, X. Pan, X. Duan, Y. Huang, Nat. Nanotechnol. 17 (2022) 968–975. [105] X. Duan F. Cao R. Ding X. Li Q. Li R. Aisha S. Zhang K. Hua Z. Rui Y. Wu J. Li A. Li J. Liu Adv. Energy Mater. 12 2022 2103144 X. Duan, F. Cao, R. Ding, X. Li, Q. Li, R. Aisha, S. Zhang, K. Hua, Z. Rui, Y. Wu, J. Li, A. Li, J. Liu, Adv. Energy Mater. 12 (2022) 2103144. [106] Z. Chen C. Jin X. Ji J. Liu Int. J. Hydrogen Energy 48 2023 160 170 Z. Chen, C. Jin, X. Ji, J. Liu, Int. J. Hydrogen Energy 48 (2023) 160–170. [107] W. Zhao G. Xu W. Dong Y. Zhang Z. Zhao L. Qiu J. Dong Adv. Sci. 10 2023 2300550 W. Zhao, G. Xu, W. Dong, Y. Zhang, Z. Zhao, L. Qiu, J. Dong, Adv. Sci. 10 (2023) 2300550. [108] Z. Wang S. Chen W. Wu R. Chen Y. Zhu H. Jiang L. Yu N. Cheng Adv. Mater. 35 2023 2301310 Z. Wang, S. Chen, W. Wu, R. Chen, Y. Zhu, H. Jiang, L. Yu, N. Cheng, Adv. Mater. 35 (2023) 2301310. [109] Y. Liao Y. Wang J. Liu Y. Tang C. Wu Y. Chen Ind. Eng. Chem. Res. 60 2021 14728 14736 Y. Liao, Y. Wang, J. Liu, Y. Tang, C. Wu, Y. Chen, Ind. Eng. Chem. Res. 60 (2021) 14728–14736. [110] L. Li L. Zhang T. Zhai S. Yang W. Wang D. Zhou J. Su L. Guo Chem. Eur. J. 29 2023 e202300099 L. Li, L. Zhang, T. Zhai, S. Yang, W. Wang, D. Zhou, J. Su, L. Guo, Chem. Eur. J. 29 (2023) e202300099 [111] Q. Liu Y. Li L. Zheng J. Shang X. Liu R. Yu J. Shui Adv. Energy Mater. 10 2020 2000689 Q. Liu, Y. Li, L. Zheng, J. Shang, X. Liu, R. Yu, J. Shui, Adv. Energy Mater. 10 (2020) 2000689. [112] X. Feng N. Yang W. Zhang W. Hong L. Tan F. Wang D. Sun W. Ding J. Li L. Li Z. Wei Matter 5 2022 2946 2959 X. Feng, N. Yang, W. Zhang, W. Hong, L. Tan, F. Wang, D. Sun, W. Ding, J. Li, L. Li, Z. Wei, Matter, 5 (2022) 2946–2959. [113] P. Guo Y. Xia B. Liu M. Ma L. Shen Y. Dai Z. Zhang Z. Zhao Y. Zhang L. Zhao Z. Wang ACS Appl. Mater. Interfaces 14 2022 53819 53827 P. Guo, Y. Xia, B. Liu, M. Ma, L. Shen, Y. Dai, Z. Zhang, Z. Zhao, Y. Zhang, L. Zhao, Z. Wang, ACS Appl. Mater. Interfaces 14 (2022) 53819–53827. [114] J. Cao H. Cao F. Wang H. Zhu Electrochim. Acta 384 2021 138266 J. Cao, H. Cao, F. Wang, H. Zhu, Electrochim. Acta 384 (2021) 138266. [115] M. Cui C. Yang S. Hwang B. Li Q. Dong M. Wu H. Xie X. Wang G. Wang L. Hu Nano Lett. 22 2021 255 262 M. Cui, C. Yang, S. Hwang, B. Li, Q. Dong, M. Wu, H. Xie, X. Wang, G. Wang, L. Hu, Nano Lett. 22 (2021) 255–262. [116] W.J. Zeng C. Wang Q.Q. Yan P. Yin L. Tong H.W. Liang Nat. Commun. 13 2022 7654 W.J. Zeng, C. Wang, Q.Q. Yan, P. Yin, L. Tong, H.W. Liang, Nat. Commun. 13 (2022) 7654. [117] S. Zhou W. Liao Z. Wang H. Pan F. Liu Q. Lin Q. Wang Int. J. Hydrogen Energy 47 2022 1256 1266 S. Zhou, W. Liao, Z. Wang, H. Pan, F. Liu, Q. Lin, Q. Wang, Int. J. Hydrogen Energy 47 (2022) 1256–1266. [118] X. Liu Q. Xing J. Song Z. Xiao F. Wang T. Yang J. Yu W. Chen X. Li Y. Chen J. Colloid Interface Sci. 645 2023 241 250 X. Liu, Q. Xing, J. Song, Z. Xiao, F. Wang, T. Yang, J. Yu, W. Chen, X. Li, Y. Chen, J. Colloid Interface Sci. 645 (2023) 241–250. [119] Y. Wang N. Gong H. Liu W. Ma K. Hippalgaonkar Z. Liu Y. Huang Adv. Mater. 35 2023 2302067 Y. Wang, N. Gong, H. Liu, W. Ma, K. Hippalgaonkar, Z. Liu, Y. Huang, Adv. Mater. 35 (2023) 2302067. [120] H. Okamoto J. Phase Equilib. Diffus. 25 2004 395 H. Okamoto, J. Phase Equilib. Diffus. 25 (2004) 395–395. [121] H. Okamoto J. Phase Equilib. Diffus. 31 2010 322 H. Okamoto, J. Phase Equilib. Diffus. 31 (2010) 322–322. [122] H. Okamoto J. Phase Equilib. Diffus. 40 2019 743 756 H. Okamoto, J. Phase Equilib. Diffus. 40 (2019) 743–756. [123] D.Y. DeSario F.J. DiSalvo Chem. Mater. 26 2014 2750 2757 D.Y. DeSario, F.J. DiSalvo, Chem. Mater. 26 (2014) 2750–2757. [124] X. Ye R.-Y. Shao P. Yin H.-W. Liang Y.-X. Chen Inorg. Chem. 61 2022 15239 15246 X. Ye, R.-Y. Shao, P. Yin, H.-W. Liang, Y.-X. Chen, Inorg. Chem. 61 (2022) 15239–15246. [125] B. Ju H.J. Song H. Yoon D.K. Kim H.W. Jin T. Lim D.-W. Kim ACS Sustainable Chem. Eng. 11 2023 16108 16116 B. Ju, H.J. Song, H. Yoon, D.K. Kim, H.W. Jin, T. Lim, D.-W. Kim, ACS Sustainable Chem. Eng. 11 (2023) 16108–16116. [126] T.W. Song M.X. Chen P. Yin L. Tong M. Zuo S.Q. Chu P. Chen H.W. Liang Small 18 2022 2202916 T.W. Song, M.X. Chen, P. Yin, L. Tong, M. Zuo, S.Q. Chu, P. Chen, H.W. Liang, Small 18 (2022) 2202916. [127] L. Yang J. Bai N. Zhang Z. Jiang Y. Wang M. Xiao C. Liu S. Zhu Z.J. Xu J. Ge W. Xing Angew. Chem., Int. Ed. 2023 e202315119 L. Yang, J. Bai, N. Zhang, Z. Jiang, Y. Wang, M. Xiao, C. Liu, S. Zhu, Z.J. Xu, J. Ge, W. Xing, Angew. Chem., Int. Ed. (2023) e202315119. [128] S. Feng J. Lu L. Luo G. Qian J. Chen H.S. Abbo S.J.J. Titinchi S. Yin J. Energy Chem. 51 2020 246 252 S. Feng, J. Lu, L. Luo, G. Qian, J. Chen, H.S. Abbo, S.J.J. Titinchi, S. Yin, J. Energy Chem. 51 (2020) 246–252. [129] Z. Chen J. Liu B. Yang M. Lin C. Molochas P. Tsiakaras P. Shen J. Colloid Interface Sci. 652 2023 388 404 Z. Chen, J. Liu, B. Yang, M. Lin, C. Molochas, P. Tsiakaras, P. Shen, J. Colloid Interface Sci. 652 (2023) 388–404. [130] L.-N.-W. Cheng-Long Yang P. Yin J. Liu M.-X. Chen Q.-Q. Yan Z.-S. Wang Xu. Shi-Long S.-Q. Chu C. Cui Ju. Huanxin J. Zhu Y. Lin J. Shui H.-W. Liang Science 374 2021 459 464 L.-N.W. Cheng-Long Yang, Peng Yin, Jieyuan Liu, Ming-Xi Chen, Qiang-Qiang Yan, Zheng-Shu Wang, Shi-Long Xu, Sheng-Qi Chu, Chunhua Cui, Huanxin Ju, Junfa Zhu, Yue Lin, Jianglan Shui, Hai-Wei Liang, Science 374 (2021) 459–464. [131] S. Zhu X. Wang E. Luo L. Yang Y. Chu L. Gao Z. Jin C. Liu J. Ge W. Xing ACS Energy Lett. 5 2020 3021 3028 S. Zhu, X. Wang, E. Luo, L. Yang, Y. Chu, L. Gao, Z. Jin, C. Liu, J. Ge, W. Xing, Acs Energy Lett. 5 (2020) 3021–3028. [132] J. Zhang Z. Zhao Z. Xia L. Dai Nat. Nanotechnol. 10 2015 444 452 J. Zhang, Z. Zhao, Z. Xia, L. Dai, Nat. Nanotechnol., 10 (2015) 444–452. [133] Y. Luo K. Li Y. Chen J. Feng L. Wang Y. Jiang L. Li G. Yu J. Feng Adv. Mater. 35 2023 2300624 Y. Luo, K. Li, Y. Chen, J. Feng, L. Wang, Y. Jiang, L. Li, G. Yu, J. Feng, Adv. Mater. 35 (2023) 2300624. [134] J. Liu S. Liu F. Yan Z. Wen W. Chen X. Liu Q. Liu J. Shang R. Yu D. Su J. Shui J. Am. Chem. Soc. 144 2022 19106 19114 J. Liu, S. Liu, F. Yan, Z. Wen, W. Chen, X. Liu, Q. Liu, J. Shang, R. Yu, D. Su, J. Shui, J. Am. Chem. Soc. 144 (2022) 19106–19114. [135] X. Ao W. Zhang B. Zhao Y. Ding G. Nam L. Soule A. Abdelhafiz C. Wang M. Liu Energy Environ. Sci. 13 2020 3032 3040 X. Ao, W. Zhang, B. Zhao, Y. Ding, G. Nam, L. Soule, A. Abdelhafiz, C. Wang, M. Liu, Energy Environ. Sci. 13 (2020) 3032–3040. [136] J. Guan S. Yang T. Liu Y. Yu J. Niu Z. Zhang F. Wang Angew. Chem., Int. Ed. 60 2021 21899 21904 J. Guan, S. Yang, T. Liu, Y. Yu, J. Niu, Z. Zhang, F. Wang, Angew. Chem., Int. Ed. 60 (2021) 21899–21904. [137] Q. Gong H. Zhang H. Yu S. Jeon Y. Ren Z. Yang C.-J. Sun E.A. Stach A.C. Foucher Y. Yu M. Smart G.M. Filippelli D.A. Cullen P. Liu J. Xie Matter 6 2023 963 982 Q. Gong, H. Zhang, H. Yu, S. Jeon, Y. Ren, Z. Yang, C.-J. Sun, E.A. Stach, A.C. Foucher, Y. Yu, M. Smart, G.M. Filippelli, D.A. Cullen, P. Liu, J. Xie, Matter 6 (2023) 963-982. [138] H. Lv Y. Zheng Y. Wang J. Wang B. Liu Z.A. Qiao Angew. Chem., Int. Ed. 62 2023 H. Lv, Y. Zheng, Y. Wang, J. Wang, B. Liu, Z.A. Qiao, Angew. Chem., Int. Ed. 62 (2023). [139] S. Zhu M. Sun B. Mei L. Yang Y. Chu Z. Shi J. Bai X. Wang Z. Jiang C. Liu B. Huang J. Ge W. Xing Natl. Sci. Rev. 10 2023 nwad162 S. Zhu, M. Sun, B. Mei, L. Yang, Y. Chu, Z. Shi, J. Bai, X. Wang, Z. Jiang, C. Liu, B. Huang, J. Ge, W. Xing, Natl. Sci. Rev. 10 (2023) nwad162. [140] C.A. Campos-Roldán R. Chattot J.-S. Filhol H. Guesmi F. Pailloux R. Bacabe P.-Y. Blanchard A. Zitolo J. Drnec D.J. Jones S. ACS Catal. 13 2023 7417 7427 C.A. Campos-Roldán, R. Chattot, J.-S. Filhol, H. Guesmi, F. Pailloux, R. Bacabe, P.-Y. Blanchard, A. Zitolo, J. Drnec, D.J. Jones, S. ACS Catal. 13 (2023) 7417–7427. [141] J. Li S. Sharma X. Liu Y.-T. Pan J.S. Spendelow M. Chi Y. Jia P. Zhang D.A. Cullen Z. Xi H. Lin Z. Yin B. Shen M. Muzzio C. Yu Y.S. Kim A.A. Peterson K.L. More H. Zhu S. Sun Joule 3 2019 124 135 J. Li, S. Sharma, X. Liu, Y.-T. Pan, J.S. Spendelow, M. Chi, Y. Jia, P. Zhang, D.A. Cullen, Z. Xi, H. Lin, Z. Yin, B. Shen, M. Muzzio, C. Yu, Y.S. Kim, A.A. Peterson, K.L. More, H. Zhu, S. Sun, Joule 3 (2019) 124–135. [142] H. Cheng R. Gui H. Yu C. Wang S. Liu H. Liu T. Zhou N. Zhang X. Zheng W. Chu Y. Lin H. Wu C. Wu Y. Xie Proc. Natl. Acad. Sci. 118 2021 e2104026118 H. Cheng, R. Gui, H. Yu, C. Wang, S. Liu, H. Liu, T. Zhou, N. Zhang, X. Zheng, W. Chu, Y. Lin, H. Wu, C. Wu, Y. Xie, Proc. Natl. Acad. Sci. 118 (2021) e2104026118. [143] Z. Zhao M.D. Hossain C. Xu Z. Lu Y.-S. Liu S.-H. Hsieh I. Lee W. Gao J. Yang B.V. Merinov W. Xue Z. Liu J. Zhou Z. Luo X. Pan F. Zaera J. Guo X. Duan W.A. Goddard Y. Huang Matter 3 2020 1774 1790 Z. Zhao, M.D. Hossain, C. Xu, Z. Lu, Y.-S. Liu, S.-H. Hsieh, I. Lee, W. Gao, J. Yang, B.V. Merinov, W. Xue, Z. Liu, J. Zhou, Z. Luo, X. Pan, F. Zaera, J. Guo, X. Duan, W.A. Goddard, Y. Huang, Matter 3 (2020) 1774–1790. [144] M. Liu B.A. Lu G. Yang P. Yuan H. Xia Y. Wang K. Guo S. Zhao J. Liu Y. Yu W. Yan C.L. Dong J.N. Zhang S. Mu Adv. Sci. 9 2022 2200147 M. Liu, B.A. Lu, G. Yang, P. Yuan, H. Xia, Y. Wang, K. Guo, S. Zhao, J. Liu, Y. Yu, W. Yan, C.L. Dong, J.N. Zhang, S. Mu, Adv. Sci. 9 (2022) 2200147. [145] F. Xiao Q. Wang G.-L. Xu X. Qin I. Hwang C.-J. Sun M. Liu W. Hua H.-W. Wu S. Zhu J.-C. Li J.-G. Wang Y. Zhu D. Wu Z. Wei M. Gu K. Amine M. Shao Nat. Catal. 5 2022 503 512 F. Xiao, Q. Wang, G.-L. Xu, X. Qin, I. Hwang, C.-J. Sun, M. Liu, W. Hua, H.-w. Wu, S. Zhu, J.-C. Li, J.-G. Wang, Y. Zhu, D. Wu, Z. Wei, M. Gu, K. Amine, M. Shao, Nat. Catal. 5 (2022) 503–512. [146] X. Liu Z. Zhao J. Liang S. Li G. Lu C. Priest T. Wang J. Han G. Wu X. Wang Y. Huang Q. Li Angew. Chem., Int. Ed. 62 2023 e202302134 X. Liu, Z. Zhao, J. Liang, S. Li, G. Lu, C. Priest, T. Wang, J. Han, G. Wu, X. Wang, Y. Huang, Q. Li, Angew. Chem., Int. Ed. 62 (2023) e202302134. [147] J. Liang N. Li Z. Zhao L. Ma X. Wang S. Li X. Liu T. Wang Y. Du G. Lu J. Han Y. Huang D. Su Q. Li Angew. Chem., Int. Ed. 58 2019 15471 15477 J. Liang, N. Li, Z. Zhao, L. Ma, X. Wang, S. Li, X. Liu, T. Wang, Y. Du, G. Lu, J. Han, Y. Huang, D. Su, Q. Li, Angew. Chem., Int. Ed. 58 (2019) 15471–15477. [148] P. Mukherjee I. Patil B. Kakade S.K. Das A.K. Sahu A. Swami ACS Appl. Energy Mater. 5 2022 14922 14933 P. Mukherjee, I. Patil, B. Kakade, S.K. Das, A.K. Sahu, A. Swami, ACS Appl. Energy Mater. 5 (2022) 14922–14933. [149] X. Wang L. Zhang F. Wang J. Yu H. Zhu Prog. Nat. Sci.-Mater. 30 2020 905 911 X. Wang, L. Zhang, F. Wang, J. Yu, H. Zhu, Prog. Nat. Sci.–Mater. 30 (2020) 905–911. [150] K. Eiler L. Mølmen L. Fast P. Leisner J. Sort E. Pellicer Mater. Today Energy 27 2022 101023 K. Eiler, L. Mølmen, L. Fast, P. Leisner, J. Sort, E. Pellicer, Mater. Today Energy 27 (2022) 101023. [151] W.-J. Zeng L. Tong J. Liu H.-W. Liang J. Electroanal. Chem. 922 2022 116728 W.-J. Zeng, L. Tong, J. Liu, H.-W. Liang, J. Electroanal. Chem. 922 (2022) 116728. [152] S. Hu Z.-A. Li Chem. Eng. J. 471 2023 144828 S. Hu, Z.-A. Li, Chem. Eng. J. 471 (2023) 144828. [153] G. Feng F. Ning Y. Pan T. Chen J. Song Y. Wang R. Zou D. Su D. Xia J. Am. Chem. Soc. 145 2023 11140 11150 G. Feng, F. Ning, Y. Pan, T. Chen, J. song, Y. Wang, R. Zou, D. Su, D. Xia, J. Am. Chem. Soc. 145 (2023) 11140-11150. [154] K. Wang R. Chen H. Yang Y. Chen H. Jia Y. He S. Song Y. Wang Adv. Funct. Mater. 2023 2310683 K. Wang, R. Chen, H. Yang, Y. Chen, H. Jia, Y. He, S. Song, Y. Wang, Adv. Funct. Mater. (2023) 2310683. [155] S. Wang E. Zhu Y. Huang H. Heinz Sci. Adv. 7 2021 S. Wang, E.Z. , Y.H. , H.H. , Sci. Adv. 7 (2021) eabb1435. [156] J. Qin P. Zou R. Zhang C. Wang L. Yao H.L. Xin ACS Sustainable Chem. Eng. 10 2022 14024 14033 J. Qin, P. Zou, R. Zhang, C. Wang, L. Yao, H.L. Xin, ACS Sustainable Chem. Eng. 10 (2022) 14024–14033. [157] B. Yang X. Yu J. Hou Z. Xiang Particuology 79 2023 18 26 B. Yang, X. Yu, J. Hou, Z. Xiang, Particuology 79 (2023) 18–26. [158] D. Lai Q. Cheng Y. Zheng H. Zhao Y. Chen W. Hu Z. Zou K. Wen L. Zou H. Yang J. Mater. Chem. A 10 2022 16639 16645 D. Lai, Q. Cheng, Y. Zheng, H. Zhao, Y. Chen, W. Hu, Z. Zou, K. Wen, L. Zou, H. Yang, J. Mater. Chem. A 10 (2022) 16639–16645. [159] X. Liu X. Wan X. Tan H. Yang Y. Yang J. Shui X. Wang J. Mater. Chem. A 9 2021 21051 21056 X. Liu, X. Wan, X. Tan, H. Yang, Y. Yang, J. Shui, X. Wang, J. Mater. Chem. A 9 (2021) 21051–21056. [160] W. Xu Z. Zhu Y. Wang P. Cui L. Tong K. Zhao J. Yuan Z.-Y. Zhou H.-W. Liang N. Tian S.-G. Sun J. Mater. Chem. A 11 2023 4078 4087 W. Xu, Z. Zhu, Y. Wang, P. Cui, L. Tong, K. Zhao, J. Yuan, Z.-Y. Zhou, H.-W. Liang, N. Tian, S.-G. Sun, J. Mater. Chem. A 11 (2023) 4078–4087. [161] Y. Liu C. Zhan J. Zhang X. Huang L. Bu J. Mater. Chem. A 11 2023 1455 1460 Y. Liu, C. Zhan, J. Zhang, X. Huang, L. Bu, J. Mater. Chem. A 11 (2023) 1455–1460. [162] Y. Guo S. Yang Q. Xu P. Wu Z. Jiang G. Zeng J. Mater. Chem. A 9 2021 13625 13630 Y. Guo, S. Yang, Q. Xu, P. Wu, Z. Jiang, G. Zeng, J. Mater. Chem. A 9 (2021) 13625–13630. [163] H.Z. Wang L. Kai Y. Wu X. Wang J.L. Du Chem. Eng. J. 2023 148097 H.Z. Wang, Kai , L. Wu, Y. Wang, X. Du, J. Li, Chem. Eng. J. (2023) 148097. [164] Q. Zhao Y. Zhang C. Ke X. Yang W. Xiao Nanoscale 15 2023 17516 17524 Q. Zhao, Y. Zhang, C. Ke, X. Yang, W. Xiao, Nanoscale 15 (2023) 17516–17524. [165] J. Lim C. Jung D. Hong J. Bak J. Shin M. Kim D. Song C. Lee J. Lim H. Lee H.M. Lee E. Cho J. Mater. Chem. A 10 2022 7399 7408 J. Lim, C. Jung, D. Hong, J. Bak, J. Shin, M. Kim, D. Song, C. Lee, J. Lim, H. Lee, H.M. Lee, E. Cho, J. Mater. Chem. A 10 (2022) 7399–7408. [166] J. Wang F. Pan W. Chen B. Li D. Yang P. Ming X. Wei C. Zhang Electrochem. Energy Rev. 6 2023 6 J. Wang, F. Pan, W. Chen, B. Li, D. Yang, P. Ming, X. Wei, C. Zhang, Electrochem. Energy Rev. 6 (2023) 6. [167] Q. Cheng S. Yang C. Fu L. Zou Z. Zou Z. Jiang J. Zhang H. Yang Energy Environ. Sci. 15 2022 278 286 Q. Cheng, S. Yang, C. Fu, L. Zou, Z. Zou, Z. Jiang, J. Zhang, H. Yang, Energy Environ. Sci. 15 (2022) 278–286. [168] S. Polani K.E. MacArthur J. Kang M. Klingenhof X. Wang T. Möller R. Amitrano R. Chattot M. Heggen R.E. Dunin-Borkowski P. Strasser ACS Appl. Mater. Interfaces 14 2022 29690 29702 S. Polani, K.E. MacArthur, J. Kang, M. Klingenhof, X. Wang, T. Möller, R. Amitrano, R. Chattot, M. Heggen, R.E. Dunin-Borkowski, P. Strasser, ACS Appl. Mater. Interfaces 14 (2022) 29690–29702. [169] A. Ly T. Asset P. Atanassov J. Power Sources 478 2020 228516 A. Ly, T. Asset, P. Atanassov, J. Power Sources 478 (2020) 228516. [170] T. Zhao E. Luo Y. Li X. Wang C. Liu W. Xing J. Ge Sci. China Mater. 64 2021 1671 1678 T. Zhao, E. Luo, Y. Li, X. Wang, C. Liu, W. Xing, J. Ge, Sci. China Mater. 64 (2021) 1671–1678. [171] Y. Hu X. Guo T. Shen Y. Zhu D. Wang ACS Catal. 12 2022 5380 5387 Y. Hu, X. Guo, T. Shen, Y. Zhu, D. Wang, ACS Catal. 12 (2022) 5380–5387. [172] A. Impagnatiello C.F. Cerqueira P.-E. Coulon A. Morin S. Escribano L. Guetaz M.-C. Clochard G. Rizza ACS Appl. Energy Mater. 3 2020 2360 2371 A. Impagnatiello, C.F. Cerqueira, P.-E. Coulon, A. Morin, S. Escribano, L. Guetaz, M.-C. Clochard, G. Rizza, ACS Appl. Energy Mater. 3 (2020) 2360–2371. [173] G. Liu H. Deng J. Greeley Z. Zeng Chin. J. Catal. 43 2022 3126 3133 G. Liu, H. Deng, J. Greeley, Z. Zeng, Chin. J. Catal. 43 (2022) 3126–3133. [174] E.M. Erickson M.S. Thorum R. Vasić N.S. Marinković A.I. Frenkel A.A. Gewirth R.G. Nuzzo J. Am. Chem. Soc. 134 2011 197 200 E.M. Erickson, M.S. Thorum, R. Vasić, N.S. Marinković, A.I. Frenkel, A.A. Gewirth, R.G. Nuzzo, J. Am. Chem. Soc. 134 (2011) 197–200. [175] F. Qian L. Peng Y. Zhuang L. Liu Q. Chen Chin. J. Chem. Eng. 61 2023 140 146 F. Qian, L. Peng, Y. Zhuang, L. Liu, Q. Chen, Chin. J. Chem. Eng. 61 (2023) 140–146. [176] S. Zhang X. Zhang G. Jiang H. Zhu S. Guo D. Su G. Lu S. Sun J. Am. Chem. Soc. 136 2014 7734 7739 S. Zhang, X. Zhang, G. Jiang, H. Zhu, S. Guo, D. Su, G. Lu, S. Sun, J. Am. Chem. Soc. 136 (2014) 7734–7739. [177] E. Antolini Appl. Catal., B 217 2017 201 213 E. Antolini, Appl. Catal., B 217 (2017) 201–213. HeyuanTian is a joint postdoctoral fellow at the University of Science and Technology of China and Dongguan University of Technology. He received his PhD from the University of Science and Technology of China in 2022. His research interests focus on platinum-based catalysts for proton exchange membrane fuel cells. Guanqun Xie received his Ph.D. from Zhejiang University of Technology in 2009. He has taught at Henan Normal University and Zhejiang Normal University. He is now a senior engineer at Dongguan University of Technology, School of Ecological Environment and Architectural Engineering. The research direction focuses on CO2 fixation and conversion, VOCs pollution control and process development. JunjieGe received her Ph.D. in physical chemistry from Chinese Academy of Sciences in 2010. She worked at University of South Carolina and University of Hawaii as a postdoc fellow for almost 5 years. She joined Changchun Institute of Applied Chemistry in 2015 as a professor, where she was recruited in the Hundred Talents Program in CAS (2015). She joined University of Science and Technology of China in 2022 as a professor. Her research interests comprehend fuel cells, nanoscience, catalysis, and electrochemistry.",
      "scopus-id": "85201445667",
      "coredata": {
        "eid": "1-s2.0-S2095495624004820",
        "dc:description": "Proton exchange membrane fuel cells (PEMFCs) are promising next-generation energy conversion devices with advantages including high energy conversion efficiency, low noise, and environmental friendliness. On the PEMFC cathode, the oxygen reduction reaction (ORR) relies heavily on Pt-based catalysts, where PtM x (M stands for transition metal) intermetallic compounds (IMCs) are considered the best choice to enhance the catalytic activity. However, problems such as inadequate catalytic activity, high cost, and insufficient durability, etc. still hamper its commercialization. The optimizations of the catalyst structure, the improvements in the preparation process, and the understanding of the reaction mechanism are of great value. The developments of cathodic oxygen reduction catalysts for PEMFCs will also focus on improving the catalytic activity of intermetallic compound nanoparticles, the utilization rate, and the durability of Pt. Controlling the particle size and particle/carrier interaction remain key issues for future research. The catalyst reaction mechanism, the surface changes of the nanoparticles of Pt (111) face before and after the catalytic reaction, and the targeted regulation of the adsorption strength between the IMCs and oxygen-containing intermediates adjusted by transition metals need to be investigated more specifically and directly. At the application level, the expression of catalyst properties in the catalyst membrane electrode and reactor are the keys to the performance of PEMFCs. Therefore, researches on PEMFCs are still systematic works. This paper summarized the recent process toward the optimization of catalyst preparation, the exploration of new catalysts, and the new understanding of the mechanism. Given the reference to the development of PEMFCs, future research can start from the existing problems, solve the shortcomings of the catalyst, and promote the practical application of PEMFCs.",
        "openArchiveArticle": "false",
        "prism:coverDate": "2024-12-31",
        "openaccessUserLicense": null,
        "prism:aggregationType": "Journal",
        "prism:url": "https://api.elsevier.com/content/article/pii/S2095495624004820",
        "dc:creator": [
          {
            "@_fa": "true",
            "$": "Tian, Heyuan"
          },
          {
            "@_fa": "true",
            "$": "Wang, Xian"
          },
          {
            "@_fa": "true",
            "$": "Ge, Jiawei"
          },
          {
            "@_fa": "true",
            "$": "Wan, Hao"
          },
          {
            "@_fa": "true",
            "$": "Ma, Wei"
          },
          {
            "@_fa": "true",
            "$": "Xie, Guanqun"
          },
          {
            "@_fa": "true",
            "$": "Ge, Junjie"
          }
        ],
        "link": [
          {
            "@_fa": "true",
            "@rel": "self",
            "@href": "https://api.elsevier.com/content/article/pii/S2095495624004820"
          },
          {
            "@_fa": "true",
            "@rel": "scidir",
            "@href": "https://www.sciencedirect.com/science/article/pii/S2095495624004820"
          }
        ],
        "dc:format": "application/json",
        "openaccessType": null,
        "pii": "S2095-4956(24)00482-0",
        "prism:volume": "99",
        "prism:publisher": "Science Press and Dalian Institute of Chemical Physics, Chinese Academy of Sciences. Published by ELSEVIER B.V. and Science Press. All rights are reserved, including those for text and data mining, AI training, and similar technologies.",
        "dc:title": "Pt-based intermetallic compound catalysts for the oxygen reduction reaction: From problems to recent developments",
        "prism:copyright": "© 2024 Science Press and Dalian Institute of Chemical Physics, Chinese Academy of Sciences. Published by ELSEVIER B.V. and Science Press. All rights are reserved, including those for text and data mining, AI training, and similar technologies.",
        "openaccess": "0",
        "prism:issn": "20954956",
        "dcterms:subject": [
          {
            "@_fa": "true",
            "$": "Oxygen reduction reaction"
          },
          {
            "@_fa": "true",
            "$": "Platinum"
          },
          {
            "@_fa": "true",
            "$": "PEMFCs"
          },
          {
            "@_fa": "true",
            "$": "Intermetallic compound"
          }
        ],
        "openaccessArticle": "false",
        "prism:publicationName": "Journal of Energy Chemistry",
        "openaccessSponsorType": null,
        "prism:pageRange": "302-324",
        "prism:endingPage": "324",
        "pubType": "rev",
        "prism:coverDisplayDate": "December 2024",
        "prism:doi": "10.1016/j.jechem.2024.06.061",
        "prism:startingPage": "302",
        "dc:identifier": "doi:10.1016/j.jechem.2024.06.061",
        "openaccessSponsorName": null
      },
      "objects": {
        "object": [
          {
            "@category": "standard",
            "@height": "155",
            "@width": "111",
            "@_fa": "true",
            "$": "https://api.elsevier.com/content/object/eid/1-s2.0-S2095495624004820-fx1.jpg?httpAccept=%2A%2F%2A",
            "@multimediatype": "JPEG image file",
            "@type": "IMAGE-DOWNSAMPLED",
            "@size": "4987",
            "@ref": "fx1",
            "@mimetype": "image/jpeg"
          },
          {
            "@category": "standard",
            "@height": "155",
            "@width": "111",
            "@_fa": "true",
            "$": "https://api.elsevier.com/content/object/eid/1-s2.0-S2095495624004820-fx2.jpg?httpAccept=%2A%2F%2A",
            "@multimediatype": "JPEG image file",
            "@type": "IMAGE-DOWNSAMPLED",
            "@size": "10289",
            "@ref": "fx2",
            "@mimetype": "image/jpeg"
          },
          {
            "@category": "standard",
            "@height": "155",
            "@width": "111",
            "@_fa": "true",
            "$": "https://api.elsevier.com/content/object/eid/1-s2.0-S2095495624004820-fx3.jpg?httpAccept=%2A%2F%2A",
            "@multimediatype": "JPEG image file",
            "@type": "IMAGE-DOWNSAMPLED",
            "@size": "6115",
            "@ref": "fx3",
            "@mimetype": "image/jpeg"
          },
          {
            "@category": "standard",
            "@height": "245",
            "@width": "273",
            "@_fa": "true",
            "$": "https://api.elsevier.com/content/object/eid/1-s2.0-S2095495624004820-ga1.jpg?httpAccept=%2A%2F%2A",
            "@multimediatype": "JPEG image file",
            "@type": "IMAGE-DOWNSAMPLED",
            "@size": "21705",
            "@ref": "ga1",
            "@mimetype": "image/jpeg"
          },
          {
            "@category": "standard",
            "@height": "585",
            "@width": "383",
            "@_fa": "true",
            "$": "https://api.elsevier.com/content/object/eid/1-s2.0-S2095495624004820-gr1.jpg?httpAccept=%2A%2F%2A",
            "@multimediatype": "JPEG image file",
            "@type": "IMAGE-DOWNSAMPLED",
            "@size": "82265",
            "@ref": "gr1",
            "@mimetype": "image/jpeg"
          },
          {
            "@category": "standard",
            "@height": "624",
            "@width": "624",
            "@_fa": "true",
            "$": "https://api.elsevier.com/content/object/eid/1-s2.0-S2095495624004820-gr10.jpg?httpAccept=%2A%2F%2A",
            "@multimediatype": "JPEG image file",
            "@type": "IMAGE-DOWNSAMPLED",
            "@size": "108626",
            "@ref": "gr10",
            "@mimetype": "image/jpeg"
          },
          {
            "@category": "standard",
            "@height": "574",
            "@width": "624",
            "@_fa": "true",
            "$": "https://api.elsevier.com/content/object/eid/1-s2.0-S2095495624004820-gr11.jpg?httpAccept=%2A%2F%2A",
            "@multimediatype": "JPEG image file",
            "@type": "IMAGE-DOWNSAMPLED",
            "@size": "145269",
            "@ref": "gr11",
            "@mimetype": "image/jpeg"
          },
          {
            "@category": "standard",
            "@height": "748",
            "@width": "624",
            "@_fa": "true",
            "$": "https://api.elsevier.com/content/object/eid/1-s2.0-S2095495624004820-gr12.jpg?httpAccept=%2A%2F%2A",
            "@multimediatype": "JPEG image file",
            "@type": "IMAGE-DOWNSAMPLED",
            "@size": "103568",
            "@ref": "gr12",
            "@mimetype": "image/jpeg"
          },
          {
            "@category": "standard",
            "@height": "328",
            "@width": "779",
            "@_fa": "true",
            "$": "https://api.elsevier.com/content/object/eid/1-s2.0-S2095495624004820-gr2.jpg?httpAccept=%2A%2F%2A",
            "@multimediatype": "JPEG image file",
            "@type": "IMAGE-DOWNSAMPLED",
            "@size": "95388",
            "@ref": "gr2",
            "@mimetype": "image/jpeg"
          },
          {
            "@category": "standard",
            "@height": "837",
            "@width": "624",
            "@_fa": "true",
            "$": "https://api.elsevier.com/content/object/eid/1-s2.0-S2095495624004820-gr3.jpg?httpAccept=%2A%2F%2A",
            "@multimediatype": "JPEG image file",
            "@type": "IMAGE-DOWNSAMPLED",
            "@size": "193286",
            "@ref": "gr3",
            "@mimetype": "image/jpeg"
          },
          {
            "@category": "standard",
            "@height": "759",
            "@width": "624",
            "@_fa": "true",
            "$": "https://api.elsevier.com/content/object/eid/1-s2.0-S2095495624004820-gr4.jpg?httpAccept=%2A%2F%2A",
            "@multimediatype": "JPEG image file",
            "@type": "IMAGE-DOWNSAMPLED",
            "@size": "160623",
            "@ref": "gr4",
            "@mimetype": "image/jpeg"
          },
          {
            "@category": "standard",
            "@height": "407",
            "@width": "622",
            "@_fa": "true",
            "$": "https://api.elsevier.com/content/object/eid/1-s2.0-S2095495624004820-gr5.jpg?httpAccept=%2A%2F%2A",
            "@multimediatype": "JPEG image file",
            "@type": "IMAGE-DOWNSAMPLED",
            "@size": "100045",
            "@ref": "gr5",
            "@mimetype": "image/jpeg"
          },
          {
            "@category": "standard",
            "@height": "435",
            "@width": "628",
            "@_fa": "true",
            "$": "https://api.elsevier.com/content/object/eid/1-s2.0-S2095495624004820-gr6.jpg?httpAccept=%2A%2F%2A",
            "@multimediatype": "JPEG image file",
            "@type": "IMAGE-DOWNSAMPLED",
            "@size": "91148",
            "@ref": "gr6",
            "@mimetype": "image/jpeg"
          },
          {
            "@category": "standard",
            "@height": "360",
            "@width": "624",
            "@_fa": "true",
            "$": "https://api.elsevier.com/content/object/eid/1-s2.0-S2095495624004820-gr7.jpg?httpAccept=%2A%2F%2A",
            "@multimediatype": "JPEG image file",
            "@type": "IMAGE-DOWNSAMPLED",
            "@size": "70746",
            "@ref": "gr7",
            "@mimetype": "image/jpeg"
          },
          {
            "@category": "standard",
            "@height": "596",
            "@width": "624",
            "@_fa": "true",
            "$": "https://api.elsevier.com/content/object/eid/1-s2.0-S2095495624004820-gr8.jpg?httpAccept=%2A%2F%2A",
            "@multimediatype": "JPEG image file",
            "@type": "IMAGE-DOWNSAMPLED",
            "@size": "119135",
            "@ref": "gr8",
            "@mimetype": "image/jpeg"
          },
          {
            "@category": "standard",
            "@height": "820",
            "@width": "623",
            "@_fa": "true",
            "$": "https://api.elsevier.com/content/object/eid/1-s2.0-S2095495624004820-gr9.jpg?httpAccept=%2A%2F%2A",
            "@multimediatype": "JPEG image file",
            "@type": "IMAGE-DOWNSAMPLED",
            "@size": "150955",
            "@ref": "gr9",
            "@mimetype": "image/jpeg"
          },
          {
            "@category": "thumbnail",
            "@height": "164",
            "@width": "117",
            "@_fa": "true",
            "$": "https://api.elsevier.com/content/object/eid/1-s2.0-S2095495624004820-fx1.sml?httpAccept=%2A%2F%2A",
            "@multimediatype": "GIF image file",
            "@type": "IMAGE-THUMBNAIL",
            "@size": "10657",
            "@ref": "fx1",
            "@mimetype": "image/gif"
          },
          {
            "@category": "thumbnail",
            "@height": "164",
            "@width": "117",
            "@_fa": "true",
            "$": "https://api.elsevier.com/content/object/eid/1-s2.0-S2095495624004820-fx2.sml?httpAccept=%2A%2F%2A",
            "@multimediatype": "GIF image file",
            "@type": "IMAGE-THUMBNAIL",
            "@size": "18867",
            "@ref": "fx2",
            "@mimetype": "image/gif"
          },
          {
            "@category": "thumbnail",
            "@height": "164",
            "@width": "117",
            "@_fa": "true",
            "$": "https://api.elsevier.com/content/object/eid/1-s2.0-S2095495624004820-fx3.sml?httpAccept=%2A%2F%2A",
            "@multimediatype": "GIF image file",
            "@type": "IMAGE-THUMBNAIL",
            "@size": "13449",
            "@ref": "fx3",
            "@mimetype": "image/gif"
          },
          {
            "@category": "thumbnail",
            "@height": "164",
            "@width": "183",
            "@_fa": "true",
            "$": "https://api.elsevier.com/content/object/eid/1-s2.0-S2095495624004820-ga1.sml?httpAccept=%2A%2F%2A",
            "@multimediatype": "GIF image file",
            "@type": "IMAGE-THUMBNAIL",
            "@size": "17486",
            "@ref": "ga1",
            "@mimetype": "image/gif"
          },
          {
            "@category": "thumbnail",
            "@height": "164",
            "@width": "107",
            "@_fa": "true",
            "$": "https://api.elsevier.com/content/object/eid/1-s2.0-S2095495624004820-gr1.sml?httpAccept=%2A%2F%2A",
            "@multimediatype": "GIF image file",
            "@type": "IMAGE-THUMBNAIL",
            "@size": "9720",
            "@ref": "gr1",
            "@mimetype": "image/gif"
          },
          {
            "@category": "thumbnail",
            "@height": "164",
            "@width": "164",
            "@_fa": "true",
            "$": "https://api.elsevier.com/content/object/eid/1-s2.0-S2095495624004820-gr10.sml?httpAccept=%2A%2F%2A",
            "@multimediatype": "GIF image file",
            "@type": "IMAGE-THUMBNAIL",
            "@size": "13636",
            "@ref": "gr10",
            "@mimetype": "image/gif"
          },
          {
            "@category": "thumbnail",
            "@height": "164",
            "@width": "178",
            "@_fa": "true",
            "$": "https://api.elsevier.com/content/object/eid/1-s2.0-S2095495624004820-gr11.sml?httpAccept=%2A%2F%2A",
            "@multimediatype": "GIF image file",
            "@type": "IMAGE-THUMBNAIL",
            "@size": "22436",
            "@ref": "gr11",
            "@mimetype": "image/gif"
          },
          {
            "@category": "thumbnail",
            "@height": "164",
            "@width": "137",
            "@_fa": "true",
            "$": "https://api.elsevier.com/content/object/eid/1-s2.0-S2095495624004820-gr12.sml?httpAccept=%2A%2F%2A",
            "@multimediatype": "GIF image file",
            "@type": "IMAGE-THUMBNAIL",
            "@size": "8091",
            "@ref": "gr12",
            "@mimetype": "image/gif"
          },
          {
            "@category": "thumbnail",
            "@height": "92",
            "@width": "219",
            "@_fa": "true",
            "$": "https://api.elsevier.com/content/object/eid/1-s2.0-S2095495624004820-gr2.sml?httpAccept=%2A%2F%2A",
            "@multimediatype": "GIF image file",
            "@type": "IMAGE-THUMBNAIL",
            "@size": "13095",
            "@ref": "gr2",
            "@mimetype": "image/gif"
          },
          {
            "@category": "thumbnail",
            "@height": "164",
            "@width": "122",
            "@_fa": "true",
            "$": "https://api.elsevier.com/content/object/eid/1-s2.0-S2095495624004820-gr3.sml?httpAccept=%2A%2F%2A",
            "@multimediatype": "GIF image file",
            "@type": "IMAGE-THUMBNAIL",
            "@size": "11571",
            "@ref": "gr3",
            "@mimetype": "image/gif"
          },
          {
            "@category": "thumbnail",
            "@height": "164",
            "@width": "135",
            "@_fa": "true",
            "$": "https://api.elsevier.com/content/object/eid/1-s2.0-S2095495624004820-gr4.sml?httpAccept=%2A%2F%2A",
            "@multimediatype": "GIF image file",
            "@type": "IMAGE-THUMBNAIL",
            "@size": "11821",
            "@ref": "gr4",
            "@mimetype": "image/gif"
          },
          {
            "@category": "thumbnail",
            "@height": "143",
            "@width": "219",
            "@_fa": "true",
            "$": "https://api.elsevier.com/content/object/eid/1-s2.0-S2095495624004820-gr5.sml?httpAccept=%2A%2F%2A",
            "@multimediatype": "GIF image file",
            "@type": "IMAGE-THUMBNAIL",
            "@size": "17851",
            "@ref": "gr5",
            "@mimetype": "image/gif"
          },
          {
            "@category": "thumbnail",
            "@height": "152",
            "@width": "219",
            "@_fa": "true",
            "$": "https://api.elsevier.com/content/object/eid/1-s2.0-S2095495624004820-gr6.sml?httpAccept=%2A%2F%2A",
            "@multimediatype": "GIF image file",
            "@type": "IMAGE-THUMBNAIL",
            "@size": "14610",
            "@ref": "gr6",
            "@mimetype": "image/gif"
          },
          {
            "@category": "thumbnail",
            "@height": "126",
            "@width": "219",
            "@_fa": "true",
            "$": "https://api.elsevier.com/content/object/eid/1-s2.0-S2095495624004820-gr7.sml?httpAccept=%2A%2F%2A",
            "@multimediatype": "GIF image file",
            "@type": "IMAGE-THUMBNAIL",
            "@size": "12509",
            "@ref": "gr7",
            "@mimetype": "image/gif"
          },
          {
            "@category": "thumbnail",
            "@height": "163",
            "@width": "171",
            "@_fa": "true",
            "$": "https://api.elsevier.com/content/object/eid/1-s2.0-S2095495624004820-gr8.sml?httpAccept=%2A%2F%2A",
            "@multimediatype": "GIF image file",
            "@type": "IMAGE-THUMBNAIL",
            "@size": "16236",
            "@ref": "gr8",
            "@mimetype": "image/gif"
          },
          {
            "@category": "thumbnail",
            "@height": "163",
            "@width": "124",
            "@_fa": "true",
            "$": "https://api.elsevier.com/content/object/eid/1-s2.0-S2095495624004820-gr9.sml?httpAccept=%2A%2F%2A",
            "@multimediatype": "GIF image file",
            "@type": "IMAGE-THUMBNAIL",
            "@size": "10645",
            "@ref": "gr9",
            "@mimetype": "image/gif"
          },
          {
            "@category": "high",
            "@height": "688",
            "@width": "492",
            "@_fa": "true",
            "$": "https://api.elsevier.com/content/object/eid/1-s2.0-S2095495624004820-fx1_lrg.jpg?httpAccept=%2A%2F%2A",
            "@multimediatype": "JPEG image file",
            "@type": "IMAGE-HIGH-RES",
            "@size": "30892",
            "@ref": "fx1",
            "@mimetype": "image/jpeg"
          },
          {
            "@category": "high",
            "@height": "688",
            "@width": "492",
            "@_fa": "true",
            "$": "https://api.elsevier.com/content/object/eid/1-s2.0-S2095495624004820-fx2_lrg.jpg?httpAccept=%2A%2F%2A",
            "@multimediatype": "JPEG image file",
            "@type": "IMAGE-HIGH-RES",
            "@size": "78969",
            "@ref": "fx2",
            "@mimetype": "image/jpeg"
          },
          {
            "@category": "high",
            "@height": "688",
            "@width": "492",
            "@_fa": "true",
            "$": "https://api.elsevier.com/content/object/eid/1-s2.0-S2095495624004820-fx3_lrg.jpg?httpAccept=%2A%2F%2A",
            "@multimediatype": "JPEG image file",
            "@type": "IMAGE-HIGH-RES",
            "@size": "33669",
            "@ref": "fx3",
            "@mimetype": "image/jpeg"
          },
          {
            "@category": "high",
            "@height": "1085",
            "@width": "1209",
            "@_fa": "true",
            "$": "https://api.elsevier.com/content/object/eid/1-s2.0-S2095495624004820-ga1_lrg.jpg?httpAccept=%2A%2F%2A",
            "@multimediatype": "JPEG image file",
            "@type": "IMAGE-HIGH-RES",
            "@size": "126782",
            "@ref": "ga1",
            "@mimetype": "image/jpeg"
          },
          {
            "@category": "high",
            "@height": "2597",
            "@width": "1699",
            "@_fa": "true",
            "$": "https://api.elsevier.com/content/object/eid/1-s2.0-S2095495624004820-gr1_lrg.jpg?httpAccept=%2A%2F%2A",
            "@multimediatype": "JPEG image file",
            "@type": "IMAGE-HIGH-RES",
            "@size": "467473",
            "@ref": "gr1",
            "@mimetype": "image/jpeg"
          },
          {
            "@category": "high",
            "@height": "2367",
            "@width": "2366",
            "@_fa": "true",
            "$": "https://api.elsevier.com/content/object/eid/1-s2.0-S2095495624004820-gr10_lrg.jpg?httpAccept=%2A%2F%2A",
            "@multimediatype": "JPEG image file",
            "@type": "IMAGE-HIGH-RES",
            "@size": "497591",
            "@ref": "gr10",
            "@mimetype": "image/jpeg"
          },
          {
            "@category": "high",
            "@height": "1524",
            "@width": "1657",
            "@_fa": "true",
            "$": "https://api.elsevier.com/content/object/eid/1-s2.0-S2095495624004820-gr11_lrg.jpg?httpAccept=%2A%2F%2A",
            "@multimediatype": "JPEG image file",
            "@type": "IMAGE-HIGH-RES",
            "@size": "428142",
            "@ref": "gr11",
            "@mimetype": "image/jpeg"
          },
          {
            "@category": "high",
            "@height": "1986",
            "@width": "1657",
            "@_fa": "true",
            "$": "https://api.elsevier.com/content/object/eid/1-s2.0-S2095495624004820-gr12_lrg.jpg?httpAccept=%2A%2F%2A",
            "@multimediatype": "JPEG image file",
            "@type": "IMAGE-HIGH-RES",
            "@size": "289654",
            "@ref": "gr12",
            "@mimetype": "image/jpeg"
          },
          {
            "@category": "high",
            "@height": "1452",
            "@width": "3450",
            "@_fa": "true",
            "$": "https://api.elsevier.com/content/object/eid/1-s2.0-S2095495624004820-gr2_lrg.jpg?httpAccept=%2A%2F%2A",
            "@multimediatype": "JPEG image file",
            "@type": "IMAGE-HIGH-RES",
            "@size": "523364",
            "@ref": "gr2",
            "@mimetype": "image/jpeg"
          },
          {
            "@category": "high",
            "@height": "3174",
            "@width": "2367",
            "@_fa": "true",
            "$": "https://api.elsevier.com/content/object/eid/1-s2.0-S2095495624004820-gr3_lrg.jpg?httpAccept=%2A%2F%2A",
            "@multimediatype": "JPEG image file",
            "@type": "IMAGE-HIGH-RES",
            "@size": "876438",
            "@ref": "gr3",
            "@mimetype": "image/jpeg"
          },
          {
            "@category": "high",
            "@height": "3359",
            "@width": "2762",
            "@_fa": "true",
            "$": "https://api.elsevier.com/content/object/eid/1-s2.0-S2095495624004820-gr4_lrg.jpg?httpAccept=%2A%2F%2A",
            "@multimediatype": "JPEG image file",
            "@type": "IMAGE-HIGH-RES",
            "@size": "899490",
            "@ref": "gr4",
            "@mimetype": "image/jpeg"
          },
          {
            "@category": "high",
            "@height": "1804",
            "@width": "2756",
            "@_fa": "true",
            "$": "https://api.elsevier.com/content/object/eid/1-s2.0-S2095495624004820-gr5_lrg.jpg?httpAccept=%2A%2F%2A",
            "@multimediatype": "JPEG image file",
            "@type": "IMAGE-HIGH-RES",
            "@size": "662717",
            "@ref": "gr5",
            "@mimetype": "image/jpeg"
          },
          {
            "@category": "high",
            "@height": "1927",
            "@width": "2782",
            "@_fa": "true",
            "$": "https://api.elsevier.com/content/object/eid/1-s2.0-S2095495624004820-gr6_lrg.jpg?httpAccept=%2A%2F%2A",
            "@multimediatype": "JPEG image file",
            "@type": "IMAGE-HIGH-RES",
            "@size": "446422",
            "@ref": "gr6",
            "@mimetype": "image/jpeg"
          },
          {
            "@category": "high",
            "@height": "1593",
            "@width": "2762",
            "@_fa": "true",
            "$": "https://api.elsevier.com/content/object/eid/1-s2.0-S2095495624004820-gr7_lrg.jpg?httpAccept=%2A%2F%2A",
            "@multimediatype": "JPEG image file",
            "@type": "IMAGE-HIGH-RES",
            "@size": "375546",
            "@ref": "gr7",
            "@mimetype": "image/jpeg"
          },
          {
            "@category": "high",
            "@height": "2639",
            "@width": "2762",
            "@_fa": "true",
            "$": "https://api.elsevier.com/content/object/eid/1-s2.0-S2095495624004820-gr8_lrg.jpg?httpAccept=%2A%2F%2A",
            "@multimediatype": "JPEG image file",
            "@type": "IMAGE-HIGH-RES",
            "@size": "674558",
            "@ref": "gr8",
            "@mimetype": "image/jpeg"
          },
          {
            "@category": "high",
            "@height": "3116",
            "@width": "2368",
            "@_fa": "true",
            "$": "https://api.elsevier.com/content/object/eid/1-s2.0-S2095495624004820-gr9_lrg.jpg?httpAccept=%2A%2F%2A",
            "@multimediatype": "JPEG image file",
            "@type": "IMAGE-HIGH-RES",
            "@size": "698405",
            "@ref": "gr9",
            "@mimetype": "image/jpeg"
          },
          {
            "@category": "standard",
            "@_fa": "true",
            "$": "https://api.elsevier.com/content/object/eid/1-s2.0-S2095495624004820-am.pdf?httpAccept=%2A%2F%2A",
            "@multimediatype": "Acrobat PDF file",
            "@type": "AAM-PDF",
            "@size": "3243396",
            "@ref": "am",
            "@mimetype": "application/pdf"
          }
        ]
      },
      "link": {
        "@rel": "abstract",
        "@href": "https://api.elsevier.com/content/abstract/scopus_id/85201445667"
      }
    }
  }
}