{
  "metadata": {
    "title": "Sulfur-encapsulated in heteroatom-doped hierarchical porous carbon derived from goat hair for high performance lithium–sulfur batteries",
    "authors": "; ; ",
    "journal": "Journal of Energy Chemistry",
    "date": "2019-03-31",
    "doi": "10.1016/j.jechem.2018.01.015",
    "abstract": "",
    "uri": "https://api.elsevier.com/content/article/pii/S2095495617310963",
    "pii": "S2095495617310963"
  },
  "fulltext": {
    "full-text-retrieval-response": {
      "scopus-eid": "2-s2.0-85046788004",
      "originalText": "serial JL 286353 291210 291711 291744 291809 31 Journal of Energy Chemistry JOURNALENERGYCHEMISTRY 2018-02-19 2018-02-19 2019-01-31 2019-01-31 2019-01-31T15:57:04 1-s2.0-S2095495617310963 S2095-4956(17)31096-3 S2095495617310963 10.1016/j.jechem.2018.01.015 S300 S300.1 FULL-TEXT 1-s2.0-S2095495619X00030 2020-04-21T04:57:45.549545Z 0 0 20190301 20190331 2019 2018-02-19T07:59:17.568639Z absattachment articleinfo articletitlenorm authfirstinitialnorm authfirstsurnamenorm cid cids contenttype copyright crossmark dateloaded dateloadedtxt datesearch datesort dateupdated dco docsubtype doctype doi eid ewtransactionid hubeid indexeddate issn issnnorm itemstage itemtransactionid itemweight openaccess openarchive pg pgfirst pglast pii piinorm pubdateend pubdatestart pubdatetxt pubyr sortorder srctitle srctitlenorm srctype ssids alllist content subj subheadings suppl tomb volfirst volissue volumelist webpdf webpdfpagecount yearnav figure table body mmlmath acknowledge affil articletitle auth authfirstini authfull authkeywords authlast grantnumber grantsponsor primabst ref specialabst 2095-4956 20954956 false 30 30 C Volume 30 17 121 131 121 131 201903 March 2019 2019-03-01 2019-03-31 2019 article fla © 2018 Science Press and Dalian Institute of Chemical Physics, Chinese Academy of Sciences. Published by Elsevier B.V. and Science Press. All rights reserved. SULFURENCAPSULATEDINHETEROATOMDOPEDHIERARCHICALPOROUSCARBONDERIVEDGOATHAIRFORHIGHPERFORMANCELITHIUMSULFURBATTERIES REN J 1 Introduction 2 Experimental 2.1 Preparation of NOPC 2.2 Fabrication of S/NOPC composites 2.3 Material characterizations 2.4 Electrochemical measurement 3 Results and discussion 4 Conclusions Conflict of interest Acknowledgments References YANG 2011 3577 3613 Z JACOBSON 2009 148 173 M ERICKSON 2014 3313 3324 E MENG 2012 3589 3615 X SONG 2013 2186 2204 M LI 2015 41 63 Z JAYAPRAKASH 2011 6026 6030 N XIN 2017 115 121 P YANG 2018 813 819 W PANG 2014 4759 Q PANG 2016 130 136 Q YUAN 2016 8912 8919 S ZHANG 2017 1282 1290 H HAKARI 2014 147 150 T CARBONE 2017 209 215 L ZHENG 2013 8464 8470 J SU 2012 1166 Y ZHOU 2014 625 631 G JIN 2012 163 167 Z ZHANG 2014 55 61 Z LIN 2013 1064 1069 Z HUANG 2014 3015 C JING 2015 12213 12219 H QU 2016 17 23 J WU 2017 146 158 H ZHANG 2012 9730 9733 C LIU 2013 341 346 X WANG 2011 2644 2647 H YAN 2017 522 529 L JI 2011 18522 18525 L KIM 2013 336 340 J PANG 2015 A2567 A2576 Q ZHANG 2014 13174 13182 B XIE 2016 15612 15620 Y CHEN 2016 99 109 F ZHAO 2016 6124 6130 J ZHOU 2015 7760 G YANG 2016 14324 14333 J PENG 2014 1400227 H TANG 2014 6100 6105 C YUAN 2016 151733 S RYBARCZYK 2016 5169 5179 M WU 2016 1021 1030 H WU 2017 20458 20472 H KANG 2017 2599 2607 X ZHOU 2017 3181 3187 Y LIN 2009 4668 4677 J REINA 2009 1 8 A SHI 2018 167 175 J RADHAKRISHNAN 2011 1225 1231 L PUZIY 2008 2113 2123 A PUZII 2011 277 291 A REN 2016 16507 16515 G ZHANG 2015 17791 17797 J KHOMENKO 2006 183 190 V WANG 2014 34004 B ZHANG 2013 153 162 S LI 2016 10601 G POLROLNICZAK 2016 59 63 P SEO 2017 2836 2841 S SCHIPPER 2015 3077 3083 F VU 2017 4144 4151 D GUO 2015 853 860 J GU 2014 129 139 X TAO 2016 1 9 X DENG 2013 A553 A558 Z GENG 2016 131 139 Z RENX2019X121 RENX2019X121X131 RENX2019X121XJ RENX2019X121X131XJ 2021-01-31T00:00:00.000Z 2021-01-31T00:00:00.000Z © 2018 Science Press and Dalian Institute of Chemical Physics, Chinese Academy of Sciences. Published by Elsevier B.V. and Science Press. All rights reserved. item S2095-4956(17)31096-3 S2095495617310963 1-s2.0-S2095495617310963 10.1016/j.jechem.2018.01.015 286353 2020-04-21T04:57:45.549545Z 2019-03-01 2019-03-31 1-s2.0-S2095495617310963-main.pdf https://s3.amazonaws.com/prod-ucs-content-store-us-east/content/pii:S2095495617310963/MAIN/application/pdf/d0fc5076940e2e4a667c969396cdf349/main.pdf main.pdf pdf true 4733288 MAIN 11 1-s2.0-S2095495617310963-main_1.png https://s3.amazonaws.com/prod-ucs-content-store-us-east/content/pii:S2095495617310963/PREVIEW/image/png/1f2e0a917ea1ff18f4247626f51f6f04/main_1.png main_1.png png 59207 849 656 IMAGE-WEB-PDF 1 1-s2.0-S2095495617310963-gr1.sml https://s3.amazonaws.com/prod-ucs-content-store-us-east/content/pii:S2095495617310963/gr1/THUMBNAIL/image/gif/439caf5a3443d368faa17a5257679ddd/gr1.sml gr1 gr1.sml sml 16025 142 219 IMAGE-THUMBNAIL 1-s2.0-S2095495617310963-gr2.sml https://s3.amazonaws.com/prod-ucs-content-store-us-east/content/pii:S2095495617310963/gr2/THUMBNAIL/image/gif/50a81d9a51dd00d2ff576f4d6131a4e5/gr2.sml gr2 gr2.sml sml 23680 164 162 IMAGE-THUMBNAIL 1-s2.0-S2095495617310963-gr3.sml https://s3.amazonaws.com/prod-ucs-content-store-us-east/content/pii:S2095495617310963/gr3/THUMBNAIL/image/gif/bd672711bf4efcdec3047e708560cc12/gr3.sml gr3 gr3.sml sml 23237 131 219 IMAGE-THUMBNAIL 1-s2.0-S2095495617310963-gr4.sml https://s3.amazonaws.com/prod-ucs-content-store-us-east/content/pii:S2095495617310963/gr4/THUMBNAIL/image/gif/c91b5520c1cbc232f5e2323317af8f63/gr4.sml gr4 gr4.sml sml 11968 144 219 IMAGE-THUMBNAIL 1-s2.0-S2095495617310963-gr5.sml https://s3.amazonaws.com/prod-ucs-content-store-us-east/content/pii:S2095495617310963/gr5/THUMBNAIL/image/gif/da7ddc93e30c8d4fd25b24ae419a8c7f/gr5.sml gr5 gr5.sml sml 11497 164 165 IMAGE-THUMBNAIL 1-s2.0-S2095495617310963-gr6.sml https://s3.amazonaws.com/prod-ucs-content-store-us-east/content/pii:S2095495617310963/gr6/THUMBNAIL/image/gif/93d39ae5c611ad9d8e90d63a7ff8f597/gr6.sml gr6 gr6.sml sml 14272 158 219 IMAGE-THUMBNAIL 1-s2.0-S2095495617310963-gr7.sml https://s3.amazonaws.com/prod-ucs-content-store-us-east/content/pii:S2095495617310963/gr7/THUMBNAIL/image/gif/b14faca817c96ce5c23014cda4d97a6d/gr7.sml gr7 gr7.sml sml 14682 164 213 IMAGE-THUMBNAIL 1-s2.0-S2095495617310963-gr8.sml https://s3.amazonaws.com/prod-ucs-content-store-us-east/content/pii:S2095495617310963/gr8/THUMBNAIL/image/gif/74a7d3e96d891880827aec2b9a256f2f/gr8.sml gr8 gr8.sml sml 7615 80 219 IMAGE-THUMBNAIL 1-s2.0-S2095495617310963-fx1.sml https://s3.amazonaws.com/prod-ucs-content-store-us-east/content/pii:S2095495617310963/fx1/THUMBNAIL/image/gif/50086ffb8e232d2f07484bbb7905ae5b/fx1.sml fx1 true fx1.sml sml 12323 100 219 IMAGE-THUMBNAIL 1-s2.0-S2095495617310963-gr1.jpg https://s3.amazonaws.com/prod-ucs-content-store-us-east/content/pii:S2095495617310963/gr1/DOWNSAMPLED/image/jpeg/2f99c922400f256a657712cb02b38c3b/gr1.jpg gr1 gr1.jpg jpg 47161 346 532 IMAGE-DOWNSAMPLED 1-s2.0-S2095495617310963-gr2.jpg https://s3.amazonaws.com/prod-ucs-content-store-us-east/content/pii:S2095495617310963/gr2/DOWNSAMPLED/image/jpeg/40a6275d6c5d6488e34dc9aaf2fd04f5/gr2.jpg gr2 gr2.jpg jpg 109713 479 473 IMAGE-DOWNSAMPLED 1-s2.0-S2095495617310963-gr3.jpg https://s3.amazonaws.com/prod-ucs-content-store-us-east/content/pii:S2095495617310963/gr3/DOWNSAMPLED/image/jpeg/f1e7cb9d18e64e98724c4ddcf40ff4fe/gr3.jpg gr3 gr3.jpg jpg 115409 429 717 IMAGE-DOWNSAMPLED 1-s2.0-S2095495617310963-gr4.jpg https://s3.amazonaws.com/prod-ucs-content-store-us-east/content/pii:S2095495617310963/gr4/DOWNSAMPLED/image/jpeg/56cde26d6d0a75ecfe25b0d2450db8d0/gr4.jpg gr4 gr4.jpg jpg 112361 496 756 IMAGE-DOWNSAMPLED 1-s2.0-S2095495617310963-gr5.jpg https://s3.amazonaws.com/prod-ucs-content-store-us-east/content/pii:S2095495617310963/gr5/DOWNSAMPLED/image/jpeg/786e1dcfc83ae9f1879f23f53aa863ed/gr5.jpg gr5 gr5.jpg jpg 140141 804 809 IMAGE-DOWNSAMPLED 1-s2.0-S2095495617310963-gr6.jpg https://s3.amazonaws.com/prod-ucs-content-store-us-east/content/pii:S2095495617310963/gr6/DOWNSAMPLED/image/jpeg/e3c7d6dc8d7e4a60da50c0f9011a5241/gr6.jpg gr6 gr6.jpg jpg 129934 582 808 IMAGE-DOWNSAMPLED 1-s2.0-S2095495617310963-gr7.jpg https://s3.amazonaws.com/prod-ucs-content-store-us-east/content/pii:S2095495617310963/gr7/DOWNSAMPLED/image/jpeg/6e64361fc0654bf7f218237a4cd829a3/gr7.jpg gr7 gr7.jpg jpg 129514 588 764 IMAGE-DOWNSAMPLED 1-s2.0-S2095495617310963-gr8.jpg https://s3.amazonaws.com/prod-ucs-content-store-us-east/content/pii:S2095495617310963/gr8/DOWNSAMPLED/image/jpeg/036a1208785ffcf4d4d4d0a97c5d262b/gr8.jpg gr8 gr8.jpg jpg 55446 296 809 IMAGE-DOWNSAMPLED 1-s2.0-S2095495617310963-fx1.jpg https://s3.amazonaws.com/prod-ucs-content-store-us-east/content/pii:S2095495617310963/fx1/DOWNSAMPLED/image/jpeg/fd11beae0c7d3ad59d8c3df72ed7e56f/fx1.jpg fx1 true fx1.jpg jpg 19259 138 301 IMAGE-DOWNSAMPLED 1-s2.0-S2095495617310963-gr1_lrg.jpg https://s3.amazonaws.com/prod-ucs-content-store-us-east/content/pii:S2095495617310963/gr1/HIGHRES/image/jpeg/8dd85cbaf57edaa1885617c4a06d831f/gr1_lrg.jpg gr1 gr1_lrg.jpg jpg 442324 1531 2356 IMAGE-HIGH-RES 1-s2.0-S2095495617310963-gr2_lrg.jpg https://s3.amazonaws.com/prod-ucs-content-store-us-east/content/pii:S2095495617310963/gr2/HIGHRES/image/jpeg/08265743ddaa70e832c4e3d10e9b51de/gr2_lrg.jpg gr2 gr2_lrg.jpg jpg 1181051 2123 2097 IMAGE-HIGH-RES 1-s2.0-S2095495617310963-gr3_lrg.jpg https://s3.amazonaws.com/prod-ucs-content-store-us-east/content/pii:S2095495617310963/gr3/HIGHRES/image/jpeg/5d5a36b64887cdcd82200c2d2b292b82/gr3_lrg.jpg gr3 gr3_lrg.jpg jpg 1292004 1899 3176 IMAGE-HIGH-RES 1-s2.0-S2095495617310963-gr4_lrg.jpg https://s3.amazonaws.com/prod-ucs-content-store-us-east/content/pii:S2095495617310963/gr4/HIGHRES/image/jpeg/18c56a460e8869464b6a2e31d2074d16/gr4_lrg.jpg gr4 gr4_lrg.jpg jpg 867485 2199 3349 IMAGE-HIGH-RES 1-s2.0-S2095495617310963-gr5_lrg.jpg https://s3.amazonaws.com/prod-ucs-content-store-us-east/content/pii:S2095495617310963/gr5/HIGHRES/image/jpeg/00efcaba4f0c5f50dec401c62624f78b/gr5_lrg.jpg gr5 gr5_lrg.jpg jpg 1070497 3559 3583 IMAGE-HIGH-RES 1-s2.0-S2095495617310963-gr6_lrg.jpg https://s3.amazonaws.com/prod-ucs-content-store-us-east/content/pii:S2095495617310963/gr6/HIGHRES/image/jpeg/c2d1d065995fad6d61071c1ea9c51bfa/gr6_lrg.jpg gr6 gr6_lrg.jpg jpg 972137 2580 3579 IMAGE-HIGH-RES 1-s2.0-S2095495617310963-gr7_lrg.jpg https://s3.amazonaws.com/prod-ucs-content-store-us-east/content/pii:S2095495617310963/gr7/HIGHRES/image/jpeg/da9fb58523ad58d6b6b5df6eb0d9b533/gr7_lrg.jpg gr7 gr7_lrg.jpg jpg 995745 2603 3384 IMAGE-HIGH-RES 1-s2.0-S2095495617310963-gr8_lrg.jpg https://s3.amazonaws.com/prod-ucs-content-store-us-east/content/pii:S2095495617310963/gr8/HIGHRES/image/jpeg/5f20c36686e453fb1fe80361a20e6015/gr8_lrg.jpg gr8 gr8_lrg.jpg jpg 385668 1311 3584 IMAGE-HIGH-RES 1-s2.0-S2095495617310963-fx1_lrg.jpg https://s3.amazonaws.com/prod-ucs-content-store-us-east/content/pii:S2095495617310963/fx1/HIGHRES/image/jpeg/b7cb988222ea11195aa39b0337dbc837/fx1_lrg.jpg fx1 true fx1_lrg.jpg jpg 127813 611 1333 IMAGE-HIGH-RES 1-s2.0-S2095495617310963-si1.gif https://s3.amazonaws.com/prod-ucs-content-store-us-east/content/pii:S2095495617310963/STRIPIN/image/gif/2398986429600d802e27329bc486018a/si1.gif si1 si1.gif gif 1203 23 277 ALTIMG 1-s2.0-S2095495617310963-am.pdf am am.pdf pdf 4763674 AAM-PDF https://s3-eu-west-1.amazonaws.com/prod-ucs-content-store-eu-west/content/egi:107GPG5DMGC/MAIN/application/pdf/c83dd306aeb32d45053c427d3fecccec/am.pdf JECHEM 522 S2095-4956(17)31096-3 10.1016/j.jechem.2018.01.015 Science Press and Dalian Institute of Chemical Physics, Chinese Academy of Sciences Fig. 1 Schematic of the formation of S/NOPC composite materials. Fig 1 Fig. 2 SEM images of NOPC samples: (a1) NOPC-550; (a2) S/NOPC-550; (b1) NOPC-600; (b2) S/NOPC-600; (c1) NOPC-650; (c2) S/NOPC-650. Fig 2 Fig. 3 Low and high magnification TEM images of NOPC-600 (a1, a2); S/NOPC-600 (b1, b2); EDS mapping images of S/NOPC-600 (c) and the corresponding elemental mappings of C, N, O, P and S (c1–c5). Fig 3 Fig. 4 (a) XRD patterns of NOPC-550, S/NOPC-550, NOPC-600, S/NOPC-600, NOPC-650 and S/NOPC-650; (b) TGA curves of sulfur, S/NOPC-550, S/NOPC-600, S/NOPC-650; (c) N2 adsorption-desorption isotherms of NOPC samples; and (d) pore size distribution curves of NOPC-550, NOPC-600, NOPC-650. Fig 4 Fig. 5 XPS spectra of (a) S/NOPC-600; resolution spectra of (b) C 1s, (c) N 1s, (d) O 1s, (e) P 2p and (f) S 2p. Fig 5 Fig. 6 (a) The initial charge/discharge profiles of S/NOPC-500, S/NOPC-600 and S/NOPC-650 at 0.2 C; (b) Cyclic voltammetry of the initial three cycles at a scan rate of 0.1 mV s−1; (c) The 1st, 2nd, 10th, 20th, 50th, 100th, 200th and 300th discharge/charge curves of the S/NOPC-600 composite; (d) Discharge/charge curves of the S/NOPC-600 composite at different rates from 0.05 C to 2 C; (e) Rate performance of S/PPNC-600 composite at various current densities from 0.05 C to 2 C; (f) Energy efficiency and coulombic efficiency for the tenth charge/discharge cycle at different rates; (g) Cycling performances of the S/NOPC-550, S/NOPC-600 and S/PPNC-650 composites at 0.2 C. Fig 6 Fig. 7 Cyclic voltammetry curves at different scan rates of Li–S cells: (a) S/NOPC-550, (b) S/NOPC-600, (c) S/NOPC-650 and the corresponding linear relationship between the square root of the scan rate v0.5 and peak current I p for the cells. Fig 7 Fig. 8 Electrochemical impedance spectroscopy spectra of three samples (a) before cycle and (b) after 30 cycles. Fig 8 Table 1 Textural properties obtained from the N2 adsorption/desorption isotherm of NOPC-550, NOPC-600 and NOPC-650. Table 1 Sample BET surface area (m2 g−1) Pore volume (cm3 g−1) Average pore diameter (nm) NOPC-550 60.454 0.093 4.15 NOPC-600 535.352 0.388 2.63 NOPC-650 52.933 0.041 7.05 Table 2 The contents of C, N, O, P and S in S/OPNC-600 and component analysis. Table 2 Element C N O P S Content (at%) 73.74 3.70 5.69 3.37 13.50 CC/CC Pyridinic N CO (Carboyl) Phosphate S 2p 3/2 (SS) Components CO/CN Pyrrolic N CO (Ester, amides) Pyrophosphosphate S 2p 1/2 (SS) CO Graphitic N COC Metaphosphate Sulfate species OCO Quaternary N COH/NOC – – Table 3 Comparison electrochemical performance of some other reported biomass-derived carbon/sulfur composites for Li–S batteries. Table 3 Biomass source Initial capacity (mA h g−1) Final capacity (mA h g−1) Cycle number Rate (C) Sulfur content (wt%) Ref. Mandarin peels 860 790 40 0.05 50 [60] Tea bag 712 500 50 0.1 68 [61] glucosamine 1194 505 100 0.1 50 [62] Rice husk 934 355 100 0.2 42 [63] Shrimp shell 549 450 100 0.3 63 [25] Corncob 1600 554 50 0.1 44 [64] Bamboo ∼750 ∼500 50 0.1 60 [65] Goat hair 921 489 300 0.2 54 This work Sulfur-encapsulated in heteroatom-doped hierarchical porous carbon derived from goat hair for high performance lithium–sulfur batteries Juan Ren Yibei Zhou Huali Wu Fengyu Xie Chenggang Xu ⁎ Dunmin Lin ⁎ College of Chemistry and Materials Science, Sichuan Normal University, Chengdu 610066, Sichuan, China College of Chemistry and Materials Science Sichuan Normal University Chengdu 610066 China ⁎ Corresponding authors. Biomass-derived carbon materials have aroused widespread concern as host material of sulfur to enhance electrochemical performances for lithium–sulfur batteries. Herein, goat hair, as a low-cost and eco-friendly precursor, is employed to fabricate cauliflower-like in-situ nitrogen, oxygen and phosphorus tri-doped porous biomass carbon (NOPC) by a facile activation with H3PO4 and carbonization process. The morphology and microstructure of NOPC can be readily tuned by altering pyrolysis temperature. The as-prepared NOPC matrix material carbonized at 600 °C possesses 3D hierarchical porous structure, high specific surface area (535.352 m2 g−1), and appropriate pore size and pore size distribution. Encapsulating sulfur into the NOPC depends on a stem-melting technology as cathode materials of Li–S batteries. Due to the synergistic effect of special physical structure and inherent tri-doping of N, O and P, electrons and ions transfer and utilization of active sulfur in the materials are improved, and the shuttle behaviors of soluble lithium polysulfides are also mitigated. Consequently, the S/NOPC-600 composite exhibits excellent electrochemical performance, giving a high initial discharge capacity of 1185 mA h g−1 at 0.05 C and maintaining a relatively considerable capacity of 489 mA h g−1 at 0.2 C after 300 cycles. Our work shows that a promising candidate for cathode material of Li–S batteries can be synthesized using low-cost and renewable biomass materials by a facile process. Graphical abstract Goat hair, as a low-cost, eco-friendly and renewable precursor, is employed to fabricate cauliflower-like in-situ nitrogen, oxygen and phosphorus tri-doped porous biomass carbon (NOPC-600) by a facile activation with H3PO4 and carbonization process. The related S/NOPC-600 composite was fabricated by a stem-melting technology as cathode materials of lithium–sulfur batteries and exhibits excellent electrochemical performance. Image, graphical abstract Keywords Biomass-derived carbon materials Goat hair Nitrogen Oxygen and phosphorus tri-doping Lithium sulfur batteries 1 Introduction With ever-increasing energy storage requirements of portable electric devices and electric vehicles, exploiting sustainable energy storage system with high energy density and long service life has become an unavoidable hot topic [1,2]. Conventional commercial rechargeable lithium-ion batteries, as the most widely applied battery devices in various fields (e.g., smart phones, laptops, electric tools), no longer meet insatiable demands for energy storages owing to their limited theoretical energy density [3,4]. Lithium–sulfur batteries (Li–S) with ultrahigh theoretical energy density (2600 W h kg−1) and specific capacity (1675 mA h g−1) have obtained extensive attention to serve as one of the most attractive candidates for next generation high energy density battery systems. Furthermore, sulfur has lots of distinct advantages, including low cost, non-poison and environmental friendliness, which make it an excellent cathode material [5–7]. However, to date, the commercialization application of Li–S batteries is still hampered by several severe obstacles, such as low sulfur utilization, fast capacity decay with cycling and poor coulombic efficiency. These issues mainly originate from (1) the electronic insulating property of both sulfur (5 × 10−30 S cm−1 at 25 °C) and insoluble end reduction products of Li2S/Li2S2, (2) the high solubility of long-chain lithium polysulfides (Li2S x , 4 ≤ x ≤ 8) intermediates in organic electrolyte, and (3) significant volumetric expansion of ∼80% upon complete lithiation during charging/discharging process. Therefore, extensive researches have been made to improve electrochemical performance by confining sulfur into a conductive materials (porous carbon [8], conductive polymer [9,10], metal oxides/sulfides [11,12] and MOFs [13,14]), developing a novel electrolyte (solid-state [15], polymer [16] and ionic liquid electrolytes [17]), modifying the separator (carbon species [18,19], polymeric [20] and inorganic [21]) and protecting lithium anode (P2S5 [22], graphite film [23] and Al2O3 [24]). Among these strategies, incorporating active sulfur into carbon frameworks with good electrical conductivity and diverse nanostructures, such as micro/meso‑porous carbon [25,26], carbon nanotubes/spheres [8,27,28], graphene [29,30] and graphene oxides [31,32], have been regarded as one of the most effective strategies to enhance the electrochemical performance of lithium sulfur batteries. Nevertheless, the capacity fading cannot be avoided over a long cycle process, which is ascribed to the weak physical adsorbing between nonpolar porous carbon and highly polar polysulfides [33]. Recently, it has been frequently reported that heteroatom-doped carbonaceous material with porous structures is a most promising candidate for cathode material of lithium sulfur batteries due to its high surface area, tuned pore size and superior chemical stability [25,34]. Importantly, strong chemical bonds can be formed between lithium polysulfides and heteroatoms in carbon hosts [29,33]. Various heteroatom (e.g., N [25,33,35], O [36], P [37] and S [38,39]) groups have been introduced into carbon-based materials and exhibit strong chemical adsorption to polysulfides; as a result, cycling stability and discharge capacity of the batteries are significantly enhanced because of the retarding dissolution of polysulfides. Up to now, a variety of heteroatom-doped porous carbon materials, such as N-doped hierarchical porous carbon [29,30], O-doped carbon nanotubes [40], and S-doped graphene [39], have been developed and used to prepare C/S composites for addressing the above mentioned issues. In these composites, sulfur is encapsulated into nanopores of carbonaceous materials, which immensely increases the connection between insulated active sulfur and conductivity substrate, and thus enhances the utilization of active material. In addition, the dissolution of lithium polysulfides intermediates may be effectively inhibited by the synergistic entrapping effect of heteroatom and porous microstructure. For example, Zhang et al. have fabricated a 3D porous N, O co-doped structure based on 1D self-weaving CNTs and 2D modified graphene by a one-pot pyrolysis process. This unique structure of open, porous and heteroatoms doped 3D network not only enables rapid Li+/e− transfer in conductive network, but also prevents the re-stacking of graphene and the dissolution of lithium polysulfides intermediates during charging/discharging process; as a consequence, a superior discharge capacity of 1373.8 mA h g−1 at 0.1 C is exhibited in this cathode [41]. In general, the afore-mentioned heteroatom-doped carbons are synthesized by a relatively sophisticated process or using poisonous and/or high-cost chemical reagents, which restrict their scale-up production and practical application [42]. Recently, the inherent heteroatom-doped porous biomass-derived carbon materials, such as shrimp shell [25], rice husk [43], mushroom [44], egg white [45], banana peel [46] and pig nails [47], have appealed interest owing to their easy availability and low cost. Among biomass materials, goat hair, as a kind of eco-friendly, low-cost, easy available and sustainable biomass material, is widely distributed around the world; and it consists of abundant crude protein (keratin) and amino acid. These suggest that goat hair should be a promising carbon source to produce intrinsic heteroatom-doped porous carbon material and may be widely applied in energy storage, catalysis, adsorption etc. Herein, the in-situ nitrogen, oxygen and phosphorus trip-doped hierarchical porous carbon (NOPC) derived from goat hair was fabricated by a simple H3PO4 activation and high temperature carbonization method, and employed to construct the S/NOPC composite by stem-melting technology. Compared with the representative synthesis routes (e.g., pyrolysis of polymeric [48], CVD [49,50], template method [51]) to prepare the porous carbon, this method is relative facile, safe, inexpensive and eco-friendly. More importantly, the activated precursor was thermal treatment at 600 °C (NOPC-600) with a high product yield (31.2%) that is conductive to large-scale production carbon material. When the S/NOPC-600 was employed as the cathode in Li–S batteries, a good specific capacity and cycling stability were obtained. The enhancement of the electrochemical performance is mainly imputed to the synergetic effect of the inherent N, O and P heteroatoms homogeneous doping and special physical structure of the host material (NOPC-600); and the matched morphology, microstructure and electrochemical properties of materials were investigated in detail. 2 Experimental 2.1 Preparation of NOPC All chemical reagents used in this work were purchased from Sinopharm Chemical Reagent Co. Ltd, and the goat hair was available from local farm (Chengdu, China). Typically, 10 g raw material of goat hair was cleaned with distilled water several times, dried at 80 °C for 24 h and cut into small segments with the length of 0.5 cm. After that, the material was impregnated with H3PO4 solution (the volume ratio of H3PO4 to H2O = 4:6) and dissolved by heating at 150 °C in an oil bath. Meanwhile, the superfluous water was evaporated in this process. The dissolved mixture was calcinated for 2 h at 550, 600 and 650 °C, respectively, in a N2 flowing in a tube furnace. The carbonized materials were thoroughly washed with ethanol and copious distilled water until the pH value is ∼7. Finally, the samples were dried at 150 °C for 24 h in a vacuum oven. The obtained goat hair-derived carbons at the different calcinated temperatures of 550, 600 and 650 °C were labeled as NOPC-550, NOPC-600 and NOPC-650, respectively. 2.2 Fabrication of S/NOPC composites The S/NOPC composites were fabricated by a classical stem-melting technology. Sulfur was encapsulated into the porous carbon matrixes via a two-step method: (1) four alundum crucibles with different sizes were inter-lapped each other, NOPC was placed in the smallest crucible, adequate sulfur was put between the crucibles, and the apparatus was heated at 115 °C for 24 h in a vacuum oven, which is intended to create a sulfur atmosphere for the NOPC; and (2) the NOPC was mixed well with the sublimed sulfur at a weight ratio of 1:1 by grinding for 0.5 h in an agate mortar; and the mixture was heated at 155 °C for 24 h in an electric heat oven. The obtained carbon/sulfur composites were labeled as S/NOPC-550, S/NOPC-600 and S/NOPC-6500, respectively. 2.3 Material characterizations The crystalline structure of the obtained materials were detected via X-ray diffraction analysis with Cu Kα (λ = 1.540598 Å) radiation (XRD, Smart Lab, Rigaku, Japan) at a scan rate of 4°/min−1 from 10° to 80° at room temperature. The morphologies and microstructures of the samples were observed using the field-emission scanning electron microscope (FE-SEM, JSM-7500, JEOL, Japan) and transmission electron microscope (FE-TEM, GZF20, JEOL, Japan). The specific surface areas and pore size distribution of the as-synthesized samples were measured via physical adsorption at 77 K (BET, ASAP2020, Micromeritics, USA) in accordance with the nitrogen adsorption-desorption isotherms. The content of sulfur in the composites were investigated using a thermoanalyzer (DSC-TGA, Q500, TA, USA) under a N2 atmosphere at the temperature range of room temperature to 600 °C with a heating rate of 5 °C min−1. The X-ray photoelectron spectroscopy spectra of the composites were conducted using a PHI 5000VersaProbe XPS instrument (XPS, ESCALAB 250XI, Thermo Fisher, USA) with monochromatic Al-Kα radiation at room temperature. 2.4 Electrochemical measurement To evaluate electrochemical characterization of the S/NOPC materials, all electrodes were fabricated by blending S/NOPC composite materials (80 wt%), acetylene black (Super P, 10 wt%) and polyvinylidene fluoride (PVDF, 10 wt%) binder in N-methyl pyrrolidone (NMP) solvent. The mixed slurry was stirred for 3 h in a magnetic apparatus, then casted onto current collector (aluminum foil) and dried at 60 °C for 24 h in a vacuum oven. After that, the film was punched into the wafers with a diameter of 14 mm. The active material loading of sulfur cathode is ∼1.3 mg cm−2. CR2032-type coin cells were assembled by employing S/NOPC composite as cathode, Li as anode, Celgard 2400 as membrane, and sealed in an argon-filled glove box (MB-Labstar, Germany). The electrolyte was a mixture solution of 1.0 M lithium bis(trifluoromethanesulfonyl)imide (LiTFSI) dissolved in 1,3-dioxolane (DOL) and 1,2-dimethoxyethane (DME) (v/v, 1:1) containing 1 wt% LiNO3 as the additive. Galvanostatic charge/discharge tests were carried out between 1.7 and 3.0 V to examine the discharge capacity and cycle life of batteries at various rates (1 C = 1675 mA g−1) at room temperature with test instruments (LAND, CT2001A, China). Cyclic voltammetry (CV, 0.1 mV s−1, 1.5–3.0 V) and electrochemical impedance spectroscopy (EIS, 100 kHz–10 mHz) were conducted using an electrochemical workstation (CHI660E, China). 3 Results and discussion Goat hair, as a sustainable biomass material containing abundant protein and amino acid, can be easily available in the world, which is beneficial to constructing heteroatom-doped porous carbon matrix in a large-scale production. The entire synthesis process of S/NOPC composites is illustrated in Fig. 1 . The goat hair was firstly cleaned, dried and sheared into segments, and then activated by a H3PO4 solution. After that, the activated mixture was carbonized at various temperatures (550, 600 and 650 °C) under a N2 atmosphere, and cauliflower-like porous biomass carbon was obtained. Finally, sulfur was incorporated into porous carbon by a conventional melt-diffusion method. The microstructures and morphologies of the as-obtained NOPC and the related S/NOPC composites are displayed in Fig. 2 . At low carbonized temperature of 550 °C, the NOPC-550 shows a slightly tight block-like structure with different size gap among blocks (Fig. 2a1). When sulfur is mixed with the NOPC-550, sulfur cannot be completely embedded into the carbon material and a part of sulfur aggregates and exposes on the surface of NOPC-550. Therefore, as seen in Fig. 2(a2), a relatively dense morphology is observed for the prepared S/NOPC-550 composite. Unlike the NOPC-550, the NOPC-600 carbonized at 600 °C exhibits a 3D cauliflower-like loose structure and the homogeneous nanoparticles are distributed in the materials (Fig. 2b1), which is beneficial to encapsulating sulfur and anchoring polysulfides during charging/discharging. After sulfur is loaded into the NOPC-600 (Fig. 2b2), the original cauliflower-like structure is well maintained and evident sulfur particles cannot be found on the surface of the carbon/sulfur composite, which suggests that sulfur has been effectively encapsulated into the fluffy carbon structure by capillary force. However, excessive temperature is not conducive to the creation of loose and porous structure. At high temperature of 650 °C, the material exhibits a compact and hardened structure with smooth surface and few nanopores (Fig. 2c1). Since there are not enough pores in the NOPC-650, active sulfur cannot be trapped well so that many agglomerated sulfur particles appear on the surface of S/NOPC-650 (Fig. 2c2). Obviously, carbonized temperature has a significant influence on the microstructures and morphologies of the materials. The optimum carbonized temperature is 600 °C, where the goat hair-derived hierarchical porous carbon material can be obtained. Therefore, the NOPC-600 is expected as an excellent carbon matrix to incorporate sulfur and enhance the electrochemical performance of Li–S batteries. The TEM images of NOPC-600 and S/NOPC-600 are shown in Fig. 3 . The disordered hierarchical porous and loose structure can be observed in the NOPC-600 from the low magnification TEM (Fig. 3a1). From the high magnification TEM (Fig. 3a2), great quantities of white spots are exhibited on the disordered carbon, implying that plentiful micropores/mesopores exist in the NOPC-600, which should be ascribed to chemical etching induced by H3PO4 on goat hair. The unique porous structure of NOPC-600 not only can increase rapid transfer channels for electrons/ions, but also supply enough space to accommodate sulfur and anchor soluble polysulfides, which is important to induce the outstanding electrochemical performance in Li–S batteries. As seen from Fig. 3(b1, b2), the fabricated S/NOPC-600 composite displays a parallel morphology to the original porous carbon material. Compared with the NOPC-600, only a small number of white spots can be observed in the S/NOPC-600, manifesting that sublimed sulfur has been successfully filled into the NOPC-600 porous carbon matrix via the capillary force. Fig. 3(c) presents the EDS mapping images of the S/NOPC-600. It can be seen that carbon and sulfur are homogeneously dispersed in the S/NOPC-600 (Fig. 3c1 and c5), implying that sulfur is well-confined within the NOPC-600 porous host. Furthermore, the elementals of N, O and P can be also detected in the sulfur/carbon composite (Fig. 3c2–c4), which is consistent with the XPS analysis in Fig. 5(a). The XRD patterns of the obtained NOPC and S/NOPC are shown in Fig. 4 (a). For the three pure porous carbon materials (NOPC-550, NOPC-600 and NOPC-650), a broad characteristic diffraction peak can be found at 20°−30°, which is ascribed to an amorphous structure of carbon framework. Meanwhile, other weak peaks are also observed in these carbon materials, which may be related to the formation of phosphates in high temperature carbonization process [52,53]. After loading sulfur into the carbon matrix, strong and sharp characteristic peaks appear in the S/NOPC composites, which corresponds to the typical XRD patterns of crystalline sublimated sulfur with orthorhombic structure (S8, JCPDS#08-0247) [27,36]. These results indicate that sulfur is well combined with carbon substrate and exists in a crystal state in the S/NOPC composites. Thermogravimetric analysis (TGA) was conducted under a nitrogen atmosphere to probe the sulfur content in the S/NOPC-550, S/NOPC-600 and S/NOPC-650 composites. As displayed in Fig. 4(b), the noticeable mass losses of the three composites take place between ∼175 °C and 400 °C, which are referred to the evaporation of sulfur at high temperature. The sulfur contents of S/NOPC-550, S/NOPC-600 and S/NOPC-650 are 51.98 wt%, 54.33 wt% and 50.92 wt%, respectively. The TGA curve of S/NOPC-550 shows a steep slope, suggesting a rapid weight loss of sulfur. As presented in SEM results, the NOPC-550 possesses a slightly tight structure and little porosity so that the sulfur cannot be completely embedded into its porosities and/or nanopores. Compared with S/NOPC-550, S/NOPC-600 has a higher weight loss (54.33 wt%) at high temperature, which may be attributed to its loose and abundant porous structure that can effectively pack sulfur by physical adsorption and accommodate enough sulfur. Among these composites, the smallest sulfur content is detected in the S/NOPC-650, which is related to its dense and hardened structure with few pores or porosities. The BET measurement is an effective technology for researching the porous structure of carbon materials. Nitrogen adsorption-desorption isotherms and pore size distribution curves of the prepared NOPC materials are illustrated in Fig. 4(c, d), respectively. From Fig. 4(c), the NOPC-600 shows a type IV isotherm profile at a relative low pressure region of P/P 0  < 1 on the basis of IUPAC classification, indicating a strong nitrogen adsorption and the presence of hierarchical pores in the carbon structure [34–36]. The calculated Brunauer–Emmett–Teller (BET) surface area for the NOPC-600 is 535.352 cm2 g−1. It can be found that the surface areas of the NOPC-550 and NOPC-650 are much smaller than that of the NOPC-600, giving the values of 60.454 and 52.933 cm2 g−1, respectively, which should be ascribed to their dense microstructure with low porosity. Based on density functional theory (DFT) analysis, the pore size distributions and pore volumes of the NOPC materials can be calculated and the results are shown in Fig. 4(d). It can be noted that many micropores and mesopores exist in the NOPC materials and the range for main pore size distribution is from 0.6 nm to 7.0 nm. The NOPC-600 has the largest pore volume of 0.388 cm3 g−1, and the average pore size is around 2.63 nm. However, the NOPC-550 and NOPC-650 exhibit much smaller pore volumes than the NOPC-650, giving the values of 0.093 and 0.041 cm3 g−1, respectively, suggesting the weak interaction of the NOPC-550 and NOPC-650 materials with N2. In addition, NOPC-550 and NOPC-650 possess a slightly larger pore size distribution than NOPC-600, which is not conducive to packaging sulfur and anchoring polysulfides. The corresponding textural properties of the materials are summarized in Table 1 . The NOPC-600 exhibits much larger specific surface area and pore volume, and smaller average pore diameter than the NOPC-550 and NOPC-650. The developed small-sized mesopores structure and large pore volume have greater ability in restraining the long-chain polysulfides dissolution and cushioning volume expansion during the charge/discharge process of Li–S batteries via the strong capillary force. These imply that the NOPC-600 may be an excellent host material to optimize the electrochemical performance [25,44,45]. The X-ray photoelectron spectroscopy (XPS) spectra of the S/NOPC-600 are shown in Fig. 5. From Fig. 5(a), five peaks can be clearly observed at 291.1, 406.7, 537.9, 140.9 and 171.6 eV in the wide-survey XPS spectrum, corresponding to C 1s, N 1s, O 1s, P 2p and S 2p, respectively. Clearly, the material consists of C, N, O, P and S elements. And the contents of these elements (C, N, O, P and S) on the S/NOPC-600 surface are 73.74 at%, 3.70 at%, 5.69 at%, 3.37 at% and 13.50 at%, respectively. This proves that N, O and P tri-doped carbon has been successfully synthesized in this work. The high-resolution C 1s, N 1s, O 1s, P 2p and S 2p spectra for the S/NOPC-600 are depicted in Fig. 5(b-f), respectively. The C 1s spectrum in Fig. 5(b) is decomposed into four peaks which represent CC/CC at 283.2 eV, CO/CN at 283.8 eV, CO at 285.9 eV and OCO at 289.5 eV [54], respectively. Obviously, the S/NOPC-600 contains many heteroatom functional groups on carbon the surface, which is conducive to enhancing the ability of immobilizing long-chain lithium polysulfides depended on the chemical adsorption [35,36,39]. From the N 1s spectrum in Fig. 5(c), four different chemical environments of nitrogen are exhibited, which are attributed to pyridinic N at 397.1 eV, pyrrolic N at 398.9 eV, graphitic N at 400.3 eV and quaternary N at 401.3 eV, respectively. These N species can offer stable active sites and facilitate the formation of chemical bonds between sulfur atoms and oxygen functional groups [34–36]. Furthermore, the pyridinic N and pyrrolic N based on the lone-pair electrons can generate the strong chemical interaction with polysulfides species on the porous carbon surface [54,55]. These are beneficial to improve the utilization of sulfur and the anchoring ability to long chain polysulfides. The O 1s spectrum in Fig. 5(d) shows four peaks, corresponding to CO (carboyl) groups at 530.2 eV, CO (ester, amides) groups at 531.5 eV, COC groups at 533.6 eV and COH/NOC at 535.1 eV [36,54,55], respectively, which confirm the existence of oxygen-containing groups in the prepared goat hair-derived carbon framework. Oxygen functional groups can react with polysulfides to form stable Li–O bonds because of the strong electronegative nature of O and thus weaken the dissolution of polysulfides [54]. From Fig. 5(e), the main peak of P 2p is divided into three distinct peaks, which may be assigned to phosphate at 132.1 eV, pyrophosphate at 132.8 eV and metaphosphate at 134.1 eV [52,53,56], respectively. Different types of P–S bonds can be formed between these phosphorus-oxygen functional groups and polysulfides, which reduce the dissolving of intermediates into electrolyte during charge/discharge process [37]. The S 2p spectrum in Fig. 5(f) can be divided into four peaks, representing the S 2p 3/2 and S 2p 1/2 components at 162.4 and 163.6 eV, and sulfate species at 167.1 and 168.4 eV, respectively. The S 2p 3/2 and S 2p 1/2 may be related to the S–S bonds, while sulfate species should result from the strong reaction of sulfur and oxygen [57]. The contents of all elements in the S/NOPC-600 and the corresponding component analysis are listed Table 2 . All these characteristics show that N, O and P heteroatoms have been successfully introduced into the carbon materials and are favor of enhancing the affinity between polar polysulfides and nonpolar carbon frameworks. Therefore, it can be reasonably expected that N, O and P tri-doped porous carbon host material can effectively suppress the shuttle effect and improve the electrical stability of the Li–S batteries during cycling. The initial charge/discharge profiles of the S/NOPC-500, S/NOPC-600 and S/NOPC-650 at 0.2 C are presented in Fig. 6 (a). All three cathodes possess two typical discharge platforms at ∼2.30 and 2.05 V and one long charge platforms at 2.21–2.48 V, which are in coincidence with the solid–liquid–solid reaction mechanism of Li–S batteries [58]. Compared with the S/NOPC-550 and S/NOPC-650 electrodes, S/NOPC-600 electrode shows the highest discharge capacity of 921 mA h g−1, which manifests the optimum utilization of sulfur in the S/NOPC-600 electrode. This is closely related to the microstructures of the materials. Fig. 6(b) displays the cyclic voltammetry (CV) curves of the S/NOPC-600 electrode for the first three cycles at a scan rate of 0.1 mV s−1 between 1.5 and 3.0 V. Two reduction peaks of the cathode can be observed at ∼2.30 V and 2.05 V, which correspond to two processes of the reduction of sulfur to long-chain dissolved polysulfides and further conversion of soluble polysulfides to insoluble Li2S2 and Li2S. One oxidation peak was also found at ∼ 2.46 V, which allocate to the oxidation processes of Li2S2/Li2S to long-chain lithium polysulfides/sulfur [5–7]. All peaks of these CV curves are well matched with each other, demonstrating the high-degree reversibility and superior electrochemical stability of the S/NOPC-600 cathode. The selected charge/discharge profiles (1st, 2nd, 10th, 20th, 50th, 100th, 200th and 300th) of the S/NOPC-600 cathode at 0.2 C (1 C1675 mA g−1) from 1.7 V to 3.0 V are presented in Fig. 6(c). All discharge profiles have two obvious voltage platforms at ∼2.30 and ∼2.05 V, corresponding to the two processes of the reductions: sulfur to high-order polysulfides (Li2S x , 4 ≤ x ≤ 8) at the high platform and Li2S x (4 ≤ x ≤ 8) to final low-order polysulfides (Li2S/Li2S2) at the low platform [39,44]. All charge profiles have one long platform at 2.21–2.50 V, which can be assigned to the reverse reaction of Li2S2/Li2S to lithium polysulfides and sulfur. The results agree well with the CV exam of the S/NOPC-600 cathode. Fig. 6(d) displays the galvanostatic charge/discharge profiles of the S/NOPC-600 cathode at various current densities (from 0.05 C to 2 C). The discharge capacities of 1185 mA h g−1, 1064 mA h g−1, 921 mA h g−1, 810 mA h g−1, 537 mA h g−1 and 355 mA h g−1 are obtained at 0.05 C, 0.1 C, 0.2 C, 0.5 C, 1 C and 2 C, respectively. Furthermore, the typical charge/discharge platforms in these curves can be clearly observed even at high current densities, which indicate the high utilization of sulfur and good stability of the S/NOPC-600 cathode. Fig. 6(e) displays the rate performance of the S/NOPC-600 cathode. Apparently, a reversible capacity of 600 mA h g−1 can be recovered when the current density returns to 0.2 C, indicating that the electrode has the excellent rate capability and redox reversibility [59]. Energy efficiency and coulombic efficiency of the S/NOPC-600 from the tenth charge/discharge curves at different densities are depicted in Fig. 6(f). The S/NOPC-600 cathode shows high coulombic efficiencies of ∼99% from 0.05 C to 0.5 C and ∼96% from 1 C to 2 C, which indicate an infirm shuttle effect and a high utilization of active sulfur. Meanwhile, the S/NOPC-600 cathode displays high energy efficiencies of 93.90%, 93.01%, 90.92%, 89.38%, 87.25% and 72.00% at rates of 0.05, 0.1, 0.2, 0.5, 1 and 2 C, respectively, which reveal an excellent utilization of energy in the cell. The improved electrochemical performance of the S/NOPC-600 cathode should be attributed to the synergistic effect of the special physical structure and inherent tri-doping of N, O and P of NOPC-600. To further prove the potential advantages of the material as cathode host material of Li–S batteries, the long-term cycling characteristics of the S/NOPC-550, S/NOPC-600 and S/NOPC-650 electrodes are evaluated at 0.2 C between 1.7 and 3.0 V. As illustrated in Fig. 6(g), the S/NOPC-600 composite delivers a high initial discharge capacity of 921 mA h g−1 and retains a capacity of 489 mA h g−1 (capacity retention: 53.09%) with an average coulombic efficiency of 98% after 300 cycles. However, the S/NOPC-550 and S/NOPC-650 electrodes display much lower initial discharge capacity of 833 mA h g−1 and 517.8 mA h g−1 at 0.2 C than the S/NOPC-600; in addition, compared with the S/NOPC-600, the two electrodes exhibit much smaller discharge specific capacities of 363.2 mA h g−1 and 359.8 mA h g−1 with lower coulombic efficiency of 96% after 300 cycles. Obviously, the S/NOPC-600 has a better cycle stability than other samples in the long-term cycling measurement, which is closely related to the microcosmic characteristics of NOPC-600. Evidently, the high specific surface area, cauliflower-like hierarchical porous structure and appropriate pore size of the NOPC-600 can not only promote encapsulation of sulfur, but also restrict the dissolution of polysulfides in liquid electrolyte and alleviate volume change of the materials during reaction process, which is beneficial to restraining the “shuttle effect” of Li–S batteries [44]. As a result, a good cycle stability is obtained in the S/NOPC-600 composite. Table 3 shows electrochemical performance of some reported biomass-derived carbon/sulfur composites for Li–S batteries. Compared with these reports, the S/NOPC-600 shows relatively excellent discharge capacity and cycle stability. To prove the ions and electrons transfer performance of the materials, the cyclic voltammetry (CV) measurements have been carried out at different scanning rates varying from 0.1 to 0.5 mV s−1 and the results are illustrated in Fig. 7 . All cathodic and anodic peak currents show a linear relationship to the square root of scan rates (Fig. 7(a–c)). The A peak represents the oxidation reaction of Li2S2/Li2S to long-chain lithium polysulfides/sulfur [6]. The B and C peaks stand for two reduction reaction of sulfur to long-chain dissolved polysulfides and soluble polysulfides to insoluble Li2S2 and Li2S [6]. The Li+ diffusion coefficients of the three S/NOPC cathodes can be calculated from the classical Randles–Sevcik equation as follows [66]: (1) I p = 2.687 × 10 5 n 1.5 A D Li + 0.5 v 0.5 C Li where I p represents the peak current, n is the number of electrons in the reaction (n = 2), A stands for the effective electrode area (1.53 cm2), D Li+ is the Li+ diffusion coefficient, v is the scanning rate (0.1, 0.2, 0.3, 0.4 and 0.5 mV s−1) and C Li refers to the Li+ concentration in the electrolyte. The slopes of curves in Fig. 7(d) are positively correlated to the corresponding Li+ diffusion. Evidently, the A2, B2 and C2 curves exhibit the largest slope among A1, A2 and A3, B1, B2 and B3, and C1, C2 and C3, suggesting that the S/NOPC-600 cathode possesses the fastest Li+ diffusion velocity, compared with the S/NOPC-550 and S/NOPC-650. During the charging/discharging process, ions and electrons will interact, resulting in the redox reaction [5], which implies that the S/NOPC-600 also has excellent electron transfer performance. The hierarchical porous structure of the S/NOPC-600 can provide abundant electrons and ions transmission channels and thus leads to good ions and electrons transfer performance. The enhancement in the electrochemical performance for the S/NOPC-600 electrode is mainly attributed to the synergetic effect of the doping of inherent heteroatoms and unique physical structure of the host material (NOPC-600). On the one hand, as illustrated in Fig. 5 and Table 2, the NOPC-600 contains abundant intrinsic heteroatoms and various functional groups. These in-situ N, O and P heteroatoms can significantly suppress the shuttle effect of Li–S batteries, because the strong chemical interaction induced by heteroatoms restrains the dissolution of long-chain intermediates into organic electrolyte during the cycling. On the other hand, the cauliflower-like hierarchical porous structure with high specific surface area and abundant micropores and small-sized mesopores not only serves as large reservoir to load enough sulfur and effectively anchors the polysulfides, but also offers rapid transmission channels for electrons and ions and alleviates volume change during charging/discharging. These are in favor of enhancing electrochemical performance of the S/NOPC-600 electrode. Fig. 8 (a, b) exhibits the electrochemical impedance spectroscopy (EIS) spectra of the three S/NOPC cathodes before discharge and after 30 cycles, respectively. From Fig. 8(a), the Nyquist plots for the three S/NOPC cathodes before discharge are composed of a semicircle in the high to medium frequency region and an oblique straight line at low frequency. The semicircle assigns to the interface charge-transfer resistance (R ct) at the interface between the electrolyte and sulfur electrode. The inclined line corresponds to the lithium ions diffusion resistance (Warburg impedance) of the electrode [67]. Apparently, the S/NOPC-600 exhibits a smallest resistance among all S/NOPC cathodes. This reason is that the S/NOPC-600 has higher surface area and more hierarchical pores than the S/NOPC-550 and S/NOPC-650, which is in favor of accelerating the surface charge transfer and lithium ions diffusion in the electrode by providing enough pathways and increasing contact between the insulating sulfur and conductive carbon [44,45]. As presented in Fig. 8(b), after 30 cycles, it can be found that the impedance spectra of the three cathodes still consist of a semicircle in high to middle frequency region and an oblique line in the low frequency region, demonstrating that the impedance behaviors are similar to those before discharge. However, it is expressly observed that the overall impedance increases after 30 cycles. Typically, this phenomenon is related to the deposition of insulating Li2S/Li2S2 on the surface of the electrode and the higher viscosity of electrolyte and lower Li+ ion mobility owing to the dissolution of some long-chain polysulfides into the electrolyte after cycling [68]. Obviously, the S/NOPC-600 cathode still exhibits the smallest electrochemical resistance among the three electrodes after 30 charge/discharge cycles, which suggests that the S/NOPC-600 possesses an excellent electrochemical reaction kinetics process, leading to the best electrochemical performance among the three samples. The excellent electrochemical properties of the S/NOPC-600 composite can be ascribed to the synergetic effect of the doping of inherent heteroatoms and unique cauliflower-like hierarchical porous physical structure of the host material (NOPC-600). 4 Conclusions An in-situ N, O and P tri-doped cauliflower-like hierarchical porous carbon has been successfully synthesized via a facile method of H3PO4 activation and high-temperature carbonization using low-cost, naturally abundant and easily available goat hair as carbon source. The obtained NOPC-600 material exhibits hierarchical porous structure and can be employed as excellent conductive matrix for Li–S batteries. Owing to the synergistic effect of the unique physical structure and inherent N, O and P tri-doping, the OPNC-600 carbon material can provide rich rapid transportation pathways for electrons and ions, enhance the utilization of active sulfur and effectively restrain the shuttle behaviors of long-chain polysulfides. As a result, the S/NOPC-600 cathode delivers a high initial discharge capacity of 1185 mA h g−1 at 0.05 C and maintains a reversible capacity of 489 mA h g−1 at 0.2 C after 300 cycles. Our study presents an eco-friendly and low-cost strategy to synthesize hierarchical porous carbons for high performance of Li–S batteries using natural biomass as precursor. Conflict of interest The authors declare no competing financial interest. Acknowledgments This work was supported by the projects of Sichuan Normal University (DJ GX2017017 and DJ GX2017018). References [1] Yang Z. Zhang J. M.C.W. Kintner-Meyer Lu X. Choi D. J.P. Lemmon Liu J. Chem. Rev. 111 2011 3577 3613 [2] M.Z. Jacobson Energy Environ. Sci. 2 2009 148 173 [3] E.M. Erickson C. Ghanty D. Aurbach J. Phys. Chem. Lett. 5 2014 3313 3324 [4] Meng X. Yang X. Sun X. Adv. Mater. 24 2012 3589 3615 [5] A. Manthiram, Y. Fu, S.-H. Chung, C. Zu, Y.-S. Su, Chem. Rev. 114 (2014) 11751–11787. [6] Song M.-K. E.J. Cairns Zhang Y. Nanoscale 5 2013 2186 2204 [7] Li Z. Huang Y. Yuan L. Hao Z. Huang Y. Carbon N. Y. 92 2015 41 63 [8] N. Jayaprakash Shen J. S.S. Moganty A. Corona L.A. Archer Angew. Chem. 123 2011 6026 6030 [9] Xin P. Jin B. Li H. Lang X. Yang C. Gao W. Zhu Y. Zhang W. Dou S. Jiang Q. ChemElectroChem 4 2017 115 121 [10] Yang W. Yang W. Feng J. Qin X. J. Energy Chem. 27 2018 813 819 [11] Pang Q. D. Kundu M. Cuisinier L.F. Nazar Nat. Commun. 5 2014 4759 [12] Pang Q. D. Kundu L.F. Nazar Mater. Horiz. 3 2016 130 136 [13] Yuan S. Chen Y.-P. Qin J.-S. Lu W. Zou L. Zhang Q. Wang X. Sun X. Zhou H.-C. J. Am. Chem. Soc. 138 2016 8912 8919 [14] Zhang H. Zhao Z. Liu Y. Liang J. Hou Y. Zhang Z. Wang X. Qiu J. J. Energy Chem. 26 2017 1282 1290 [15] T. Hakari M. Nagao A. Hayashi M. Tatsumisago Solid State Ionics 262 2014 147 150 [16] L. Carbone Peng J. M. Agostini M. Gobet M. Devany B. Scrosati S. Greenbaum J. Hassoun ChemElectroChem 4 2017 209 215 [17] Zheng J. Gu M. Chen H. P. Meduri M.H. Engelhard Zhang J.-G. Liu J. Xiao J. J. Mater. Chem. A 1 2013 8464 8470 [18] Su Y.-S. A. Manthiram Nat. Commun. 3 2012 1166 [19] Zhou G. Pei S. Li L. Wang D. Wang S. Huang K. Yin L. Li F. Cheng H. Adv. Mater. 26 2014 625 631 [20] Jin Z. Xie K. Hong X. Hu Z. Liu X. J. Power Sources 218 2012 163 167 [21] Zhang Z. Lai Y. Zhang Z. Zhang K. Li J. Electrochim. Acta 129 2014 55 61 [22] Lin Z. Liu Z. Fu W. N.J. Dudney Liang C. Adv. Funct. Mater. 23 2013 1064 1069 [23] Huang C. Xiao J. Shao Y. Zheng J. W.D. Bennett Lu D. S.V Laxmikant M. Engelhard Ji L. Zhang J. Nat. Commun. 5 2014 3015 [24] Jing H.-K. Kong L.-L. Liu S. Li G.-R. Gao X.-P. J. Mater. Chem. A 3 2015 12213 12219 [25] Qu J. Lv S. Peng X. Tian S. Wang J. Gao F. J. Alloys Compd. 671 2016 17 23 [26] Wu H. Deng Y. Mou J. Zheng Q. Xie F. Long E. Xu C. Lin D. Electrochim. Acta 242 2017 146 158 [27] Zhang C. Bin Wu H. Yuan C. Guo Z. Lou X.W.D. Angew. Chem. 124 2012 9730 9733 [28] Liu X. Zhang Q. Huang J. Zhang S. Peng H. Wei F. J. Energy Chem. 22 2013 341 346 [29] Wang H. Yang Y. Liang Y. J.T. Robinson Li Y. A. Jackson Cui Y. Dai H. Nano Lett. 11 2011 2644 2647 [30] Yan L. Xiao M. Wang S. Han D. Meng Y. J. Energy Chem. 26 2017 522 529 [31] Ji L. Rao M. Zheng H. Zhang L. Li Y. Duan W. Guo J. Cairns E.J. Zhang Y. J. Am. Chem. Soc. 133 2011 18522 18525 [32] Kim J.W. J.D. Ocon Park D.W. Lee J. J. Energy Chem. 22 2013 336 340 [33] Pang Q. Liang X. C.Y. Kwok L.F. Nazar J. Electrochem. Soc. 162 2015 A2567 A2576 [34] Zhang B. Xiao M. Wang S. Han D. Song S. Chen G. Meng Y. ACS Appl. Mater. Interfaces 6 2014 13174 13182 [35] Xie Y. Fang L. Cheng H. Hu C. Zhao H. Xu J. Fang J. Lu X. Zhang J. J. Mater. Chem. A 4 2016 15612 15620 [36] Chen F. Yang J. Bai T. Long B. Zhou X. Electrochim. Acta 192 2016 99 109 [37] Zhao J. Yang Y. R.S. Katiyar Chen Z. J. Mater. Chem. A 4 2016 6124 6130 [38] Zhou G. Paek E. Hwang G.S. A. Manthiram Nat. Commun. 6 2015 7760 [39] Yang J. Chen F. Li C. Bai T. Long B. Zhou X. J. Mater. Chem. A 4 2016 14324 14333 [40] Peng H. Hou T. Zhang Q. Huang J. Cheng X. Guo M. Yuan Z. He L. Wei F. Adv. Mater. Interfaces 1 2014 1400227 [41] Tang C. Zhang Q. Zhao M. Huang J. Cheng X. Tian G. Peng H. Wei F. Adv. Mater. 26 2014 6100 6105 [42] Yuan S. Bao J.L. Wang L. Xia Y. D.G. Truhlar Wang Y. Adv. Energy Mater. 6 2016 151733 [43] M.K. Rybarczyk Peng H.-J. Tang C. M. Lieder Zhang Q. M.-M. Titirici Green Chem. 18 2016 5169 5179 [44] Wu H. Mou J. Zhou L. Zheng Q. Jiang N. Lin D. Electrochim. Acta 212 2016 1021 1030 [45] Wu H. Xia L. Ren J. Zheng Q. Xu C. Lin D. J. Mater. Chem. A 38 2017 20458 20472 [46] Kang X. Wang C. Yin J. ChemElectroChem 4 2017 2599 2607 [47] Zhou Y. Ren J. Xia L. Wu H. Xie F. Zheng Q. Xu C. Lin D. ChemElectroChem 12 2017 3181 3187 [48] Lin J.H. Ko T.H. Lin Y.H. Pan C.K. Energy Fuels 23 2009 4668 4677 [49] A. Reina Jia X. Ho J. D. Nezich Son H. V. Bulovic M.S. Dresselhaus Kong J. Nano Lett. 9 2009 1 8 [50] Shi J.L. Tang C. Huang J.Q. Zhu W. Zhang Q. J. Energy Chem. 27 2018 167 175 [51] L. Radhakrishnan J. Reboul S. Furukawa P. Srinivasu S. Kitagawa Y. Yamauchi Chem. Mater. 23 2011 1225 1231 [52] A.M. Puziy O.I. Poddubnaya R.P. Socha J. Gurgul M. Wisniewski Carbon N. Y. 46 2008 2113 2123 [53] A.M. Puzii Theor. Exp. Chem. 47 2011 277 291 [54] Ren G. Li S. Fan Z.-X. J. Warzywoda Fan Z. J. Mater. Chem. A 4 2016 16507 16515 [55] Zhang J. Cai Y. Zhong Q. Lai D. Yao J. Nanoscale 7 2015 17791 17797 [56] V. Khomenko E. Raymundo-Pinero F. Béguin J. Power Sources 153 2006 183 190 [57] Wang B. S.M. Alhassan S.T. Pantelides Phys. Rev. Appl. 2 2014 34004 [58] Zhang S.S. J. Power Sources 231 2013 153 162 [59] Li G. Sun J. Hou W. Jiang S. Huang Y. Geng J. Nat. Commun. 7 2016 10601 [60] P. Polrolniczak P. Nowicki K. Wasinski R. Pietrzak M. Walkowiak Solid State Ionics 297 2016 59 63 [61] Seo S.D. Choi C. Kim B.K. Kim D.W. Ceram. Int. 43 2017 2836 2841 [62] F. Schipper A. Vizintin J. Ren R. Dominko T.P. Fellinger ChemSusChem 8 2015 3077 3083 [63] Vu D.-L. Seo J.-S. Lee H.-Y. Lee J.-W. RSC Adv. 7 2017 4144 4151 [64] Guo J. Zhang J. Jiang F. Zhao S. Su Q. Du G. Electrochim. Acta 176 2015 853 860 [65] Gu X. Wang Y. Lai C. Qiu J. Li S. Hou Y. W. Martens N. Mahmood Zhang S. Nano Res. 8 2014 129 139 [66] Tao X. Wan J. Liu C. Wang H. Yao H. Zheng G. Seh Z.W. Cai Q. Li W. Zhou G. Zu C. Cui Y. Nat. Commun. 7 2016 1 9 [67] Deng Z. Zhang Z. Lai Y. Liu J. Li J. Liu Y. J. Electrochem. Soc. 160 2013 A553 A558 [68] Geng Z. Xiao Q. Wang D. Yi G. Xu Z. Li B. Zhang C. Electrochim. Acta 202 2016 131 139",
      "scopus-id": "85046788004",
      "coredata": {
        "eid": "1-s2.0-S2095495617310963",
        "dc:description": "Biomass-derived carbon materials have aroused widespread concern as host material of sulfur to enhance electrochemical performances for lithium–sulfur batteries. Herein, goat hair, as a low-cost and eco-friendly precursor, is employed to fabricate cauliflower-like in-situ nitrogen, oxygen and phosphorus tri-doped porous biomass carbon (NOPC) by a facile activation with H3PO4 and carbonization process. The morphology and microstructure of NOPC can be readily tuned by altering pyrolysis temperature. The as-prepared NOPC matrix material carbonized at 600 °C possesses 3D hierarchical porous structure, high specific surface area (535.352 m2 g−1), and appropriate pore size and pore size distribution. Encapsulating sulfur into the NOPC depends on a stem-melting technology as cathode materials of Li–S batteries. Due to the synergistic effect of special physical structure and inherent tri-doping of N, O and P, electrons and ions transfer and utilization of active sulfur in the materials are improved, and the shuttle behaviors of soluble lithium polysulfides are also mitigated. Consequently, the S/NOPC-600 composite exhibits excellent electrochemical performance, giving a high initial discharge capacity of 1185 mA h g−1 at 0.05 C and maintaining a relatively considerable capacity of 489 mA h g−1 at 0.2 C after 300 cycles. Our work shows that a promising candidate for cathode material of Li–S batteries can be synthesized using low-cost and renewable biomass materials by a facile process.",
        "openArchiveArticle": "false",
        "prism:coverDate": "2019-03-31",
        "openaccessUserLicense": null,
        "prism:aggregationType": "Journal",
        "prism:url": "https://api.elsevier.com/content/article/pii/S2095495617310963",
        "dc:creator": [
          {
            "@_fa": "true",
            "$": "Ren, Juan"
          },
          {
            "@_fa": "true",
            "$": "Zhou, Yibei"
          },
          {
            "@_fa": "true",
            "$": "Wu, Huali"
          },
          {
            "@_fa": "true",
            "$": "Xie, Fengyu"
          },
          {
            "@_fa": "true",
            "$": "Xu, Chenggang"
          },
          {
            "@_fa": "true",
            "$": "Lin, Dunmin"
          }
        ],
        "link": [
          {
            "@_fa": "true",
            "@rel": "self",
            "@href": "https://api.elsevier.com/content/article/pii/S2095495617310963"
          },
          {
            "@_fa": "true",
            "@rel": "scidir",
            "@href": "https://www.sciencedirect.com/science/article/pii/S2095495617310963"
          }
        ],
        "dc:format": "application/json",
        "openaccessType": null,
        "pii": "S2095-4956(17)31096-3",
        "prism:volume": "30",
        "prism:publisher": "Science Press and Dalian Institute of Chemical Physics, Chinese Academy of Sciences. Published by Elsevier B.V. and Science Press.",
        "dc:title": "Sulfur-encapsulated in heteroatom-doped hierarchical porous carbon derived from goat hair for high performance lithium–sulfur batteries",
        "prism:copyright": "© 2018 Science Press and Dalian Institute of Chemical Physics, Chinese Academy of Sciences. Published by Elsevier B.V. and Science Press. All rights reserved.",
        "openaccess": "0",
        "prism:issn": "20954956",
        "dcterms:subject": [
          {
            "@_fa": "true",
            "$": "Biomass-derived carbon materials"
          },
          {
            "@_fa": "true",
            "$": "Goat hair"
          },
          {
            "@_fa": "true",
            "$": "Nitrogen"
          },
          {
            "@_fa": "true",
            "$": "Oxygen and phosphorus tri-doping"
          },
          {
            "@_fa": "true",
            "$": "Lithium sulfur batteries"
          }
        ],
        "openaccessArticle": "false",
        "prism:publicationName": "Journal of Energy Chemistry",
        "openaccessSponsorType": null,
        "prism:pageRange": "121-131",
        "prism:endingPage": "131",
        "pubType": "fla",
        "prism:coverDisplayDate": "March 2019",
        "prism:doi": "10.1016/j.jechem.2018.01.015",
        "prism:startingPage": "121",
        "dc:identifier": "doi:10.1016/j.jechem.2018.01.015",
        "openaccessSponsorName": null
      },
      "objects": {
        "object": [
          {
            "@category": "thumbnail",
            "@height": "142",
            "@width": "219",
            "@_fa": "true",
            "$": "https://api.elsevier.com/content/object/eid/1-s2.0-S2095495617310963-gr1.sml?httpAccept=%2A%2F%2A",
            "@multimediatype": "GIF image file",
            "@type": "IMAGE-THUMBNAIL",
            "@size": "16025",
            "@ref": "gr1",
            "@mimetype": "image/gif"
          },
          {
            "@category": "thumbnail",
            "@height": "164",
            "@width": "162",
            "@_fa": "true",
            "$": "https://api.elsevier.com/content/object/eid/1-s2.0-S2095495617310963-gr2.sml?httpAccept=%2A%2F%2A",
            "@multimediatype": "GIF image file",
            "@type": "IMAGE-THUMBNAIL",
            "@size": "23680",
            "@ref": "gr2",
            "@mimetype": "image/gif"
          },
          {
            "@category": "thumbnail",
            "@height": "131",
            "@width": "219",
            "@_fa": "true",
            "$": "https://api.elsevier.com/content/object/eid/1-s2.0-S2095495617310963-gr3.sml?httpAccept=%2A%2F%2A",
            "@multimediatype": "GIF image file",
            "@type": "IMAGE-THUMBNAIL",
            "@size": "23237",
            "@ref": "gr3",
            "@mimetype": "image/gif"
          },
          {
            "@category": "thumbnail",
            "@height": "144",
            "@width": "219",
            "@_fa": "true",
            "$": "https://api.elsevier.com/content/object/eid/1-s2.0-S2095495617310963-gr4.sml?httpAccept=%2A%2F%2A",
            "@multimediatype": "GIF image file",
            "@type": "IMAGE-THUMBNAIL",
            "@size": "11968",
            "@ref": "gr4",
            "@mimetype": "image/gif"
          },
          {
            "@category": "thumbnail",
            "@height": "164",
            "@width": "165",
            "@_fa": "true",
            "$": "https://api.elsevier.com/content/object/eid/1-s2.0-S2095495617310963-gr5.sml?httpAccept=%2A%2F%2A",
            "@multimediatype": "GIF image file",
            "@type": "IMAGE-THUMBNAIL",
            "@size": "11497",
            "@ref": "gr5",
            "@mimetype": "image/gif"
          },
          {
            "@category": "thumbnail",
            "@height": "158",
            "@width": "219",
            "@_fa": "true",
            "$": "https://api.elsevier.com/content/object/eid/1-s2.0-S2095495617310963-gr6.sml?httpAccept=%2A%2F%2A",
            "@multimediatype": "GIF image file",
            "@type": "IMAGE-THUMBNAIL",
            "@size": "14272",
            "@ref": "gr6",
            "@mimetype": "image/gif"
          },
          {
            "@category": "thumbnail",
            "@height": "164",
            "@width": "213",
            "@_fa": "true",
            "$": "https://api.elsevier.com/content/object/eid/1-s2.0-S2095495617310963-gr7.sml?httpAccept=%2A%2F%2A",
            "@multimediatype": "GIF image file",
            "@type": "IMAGE-THUMBNAIL",
            "@size": "14682",
            "@ref": "gr7",
            "@mimetype": "image/gif"
          },
          {
            "@category": "thumbnail",
            "@height": "80",
            "@width": "219",
            "@_fa": "true",
            "$": "https://api.elsevier.com/content/object/eid/1-s2.0-S2095495617310963-gr8.sml?httpAccept=%2A%2F%2A",
            "@multimediatype": "GIF image file",
            "@type": "IMAGE-THUMBNAIL",
            "@size": "7615",
            "@ref": "gr8",
            "@mimetype": "image/gif"
          },
          {
            "@category": "thumbnail",
            "@height": "100",
            "@width": "219",
            "@_fa": "true",
            "$": "https://api.elsevier.com/content/object/eid/1-s2.0-S2095495617310963-fx1.sml?httpAccept=%2A%2F%2A",
            "@multimediatype": "GIF image file",
            "@type": "IMAGE-THUMBNAIL",
            "@size": "12323",
            "@ref": "fx1",
            "@mimetype": "image/gif"
          },
          {
            "@category": "standard",
            "@height": "346",
            "@width": "532",
            "@_fa": "true",
            "$": "https://api.elsevier.com/content/object/eid/1-s2.0-S2095495617310963-gr1.jpg?httpAccept=%2A%2F%2A",
            "@multimediatype": "JPEG image file",
            "@type": "IMAGE-DOWNSAMPLED",
            "@size": "47161",
            "@ref": "gr1",
            "@mimetype": "image/jpeg"
          },
          {
            "@category": "standard",
            "@height": "479",
            "@width": "473",
            "@_fa": "true",
            "$": "https://api.elsevier.com/content/object/eid/1-s2.0-S2095495617310963-gr2.jpg?httpAccept=%2A%2F%2A",
            "@multimediatype": "JPEG image file",
            "@type": "IMAGE-DOWNSAMPLED",
            "@size": "109713",
            "@ref": "gr2",
            "@mimetype": "image/jpeg"
          },
          {
            "@category": "standard",
            "@height": "429",
            "@width": "717",
            "@_fa": "true",
            "$": "https://api.elsevier.com/content/object/eid/1-s2.0-S2095495617310963-gr3.jpg?httpAccept=%2A%2F%2A",
            "@multimediatype": "JPEG image file",
            "@type": "IMAGE-DOWNSAMPLED",
            "@size": "115409",
            "@ref": "gr3",
            "@mimetype": "image/jpeg"
          },
          {
            "@category": "standard",
            "@height": "496",
            "@width": "756",
            "@_fa": "true",
            "$": "https://api.elsevier.com/content/object/eid/1-s2.0-S2095495617310963-gr4.jpg?httpAccept=%2A%2F%2A",
            "@multimediatype": "JPEG image file",
            "@type": "IMAGE-DOWNSAMPLED",
            "@size": "112361",
            "@ref": "gr4",
            "@mimetype": "image/jpeg"
          },
          {
            "@category": "standard",
            "@height": "804",
            "@width": "809",
            "@_fa": "true",
            "$": "https://api.elsevier.com/content/object/eid/1-s2.0-S2095495617310963-gr5.jpg?httpAccept=%2A%2F%2A",
            "@multimediatype": "JPEG image file",
            "@type": "IMAGE-DOWNSAMPLED",
            "@size": "140141",
            "@ref": "gr5",
            "@mimetype": "image/jpeg"
          },
          {
            "@category": "standard",
            "@height": "582",
            "@width": "808",
            "@_fa": "true",
            "$": "https://api.elsevier.com/content/object/eid/1-s2.0-S2095495617310963-gr6.jpg?httpAccept=%2A%2F%2A",
            "@multimediatype": "JPEG image file",
            "@type": "IMAGE-DOWNSAMPLED",
            "@size": "129934",
            "@ref": "gr6",
            "@mimetype": "image/jpeg"
          },
          {
            "@category": "standard",
            "@height": "588",
            "@width": "764",
            "@_fa": "true",
            "$": "https://api.elsevier.com/content/object/eid/1-s2.0-S2095495617310963-gr7.jpg?httpAccept=%2A%2F%2A",
            "@multimediatype": "JPEG image file",
            "@type": "IMAGE-DOWNSAMPLED",
            "@size": "129514",
            "@ref": "gr7",
            "@mimetype": "image/jpeg"
          },
          {
            "@category": "standard",
            "@height": "296",
            "@width": "809",
            "@_fa": "true",
            "$": "https://api.elsevier.com/content/object/eid/1-s2.0-S2095495617310963-gr8.jpg?httpAccept=%2A%2F%2A",
            "@multimediatype": "JPEG image file",
            "@type": "IMAGE-DOWNSAMPLED",
            "@size": "55446",
            "@ref": "gr8",
            "@mimetype": "image/jpeg"
          },
          {
            "@category": "standard",
            "@height": "138",
            "@width": "301",
            "@_fa": "true",
            "$": "https://api.elsevier.com/content/object/eid/1-s2.0-S2095495617310963-fx1.jpg?httpAccept=%2A%2F%2A",
            "@multimediatype": "JPEG image file",
            "@type": "IMAGE-DOWNSAMPLED",
            "@size": "19259",
            "@ref": "fx1",
            "@mimetype": "image/jpeg"
          },
          {
            "@category": "high",
            "@height": "1531",
            "@width": "2356",
            "@_fa": "true",
            "$": "https://api.elsevier.com/content/object/eid/1-s2.0-S2095495617310963-gr1_lrg.jpg?httpAccept=%2A%2F%2A",
            "@multimediatype": "JPEG image file",
            "@type": "IMAGE-HIGH-RES",
            "@size": "442324",
            "@ref": "gr1",
            "@mimetype": "image/jpeg"
          },
          {
            "@category": "high",
            "@height": "2123",
            "@width": "2097",
            "@_fa": "true",
            "$": "https://api.elsevier.com/content/object/eid/1-s2.0-S2095495617310963-gr2_lrg.jpg?httpAccept=%2A%2F%2A",
            "@multimediatype": "JPEG image file",
            "@type": "IMAGE-HIGH-RES",
            "@size": "1181051",
            "@ref": "gr2",
            "@mimetype": "image/jpeg"
          },
          {
            "@category": "high",
            "@height": "1899",
            "@width": "3176",
            "@_fa": "true",
            "$": "https://api.elsevier.com/content/object/eid/1-s2.0-S2095495617310963-gr3_lrg.jpg?httpAccept=%2A%2F%2A",
            "@multimediatype": "JPEG image file",
            "@type": "IMAGE-HIGH-RES",
            "@size": "1292004",
            "@ref": "gr3",
            "@mimetype": "image/jpeg"
          },
          {
            "@category": "high",
            "@height": "2199",
            "@width": "3349",
            "@_fa": "true",
            "$": "https://api.elsevier.com/content/object/eid/1-s2.0-S2095495617310963-gr4_lrg.jpg?httpAccept=%2A%2F%2A",
            "@multimediatype": "JPEG image file",
            "@type": "IMAGE-HIGH-RES",
            "@size": "867485",
            "@ref": "gr4",
            "@mimetype": "image/jpeg"
          },
          {
            "@category": "high",
            "@height": "3559",
            "@width": "3583",
            "@_fa": "true",
            "$": "https://api.elsevier.com/content/object/eid/1-s2.0-S2095495617310963-gr5_lrg.jpg?httpAccept=%2A%2F%2A",
            "@multimediatype": "JPEG image file",
            "@type": "IMAGE-HIGH-RES",
            "@size": "1070497",
            "@ref": "gr5",
            "@mimetype": "image/jpeg"
          },
          {
            "@category": "high",
            "@height": "2580",
            "@width": "3579",
            "@_fa": "true",
            "$": "https://api.elsevier.com/content/object/eid/1-s2.0-S2095495617310963-gr6_lrg.jpg?httpAccept=%2A%2F%2A",
            "@multimediatype": "JPEG image file",
            "@type": "IMAGE-HIGH-RES",
            "@size": "972137",
            "@ref": "gr6",
            "@mimetype": "image/jpeg"
          },
          {
            "@category": "high",
            "@height": "2603",
            "@width": "3384",
            "@_fa": "true",
            "$": "https://api.elsevier.com/content/object/eid/1-s2.0-S2095495617310963-gr7_lrg.jpg?httpAccept=%2A%2F%2A",
            "@multimediatype": "JPEG image file",
            "@type": "IMAGE-HIGH-RES",
            "@size": "995745",
            "@ref": "gr7",
            "@mimetype": "image/jpeg"
          },
          {
            "@category": "high",
            "@height": "1311",
            "@width": "3584",
            "@_fa": "true",
            "$": "https://api.elsevier.com/content/object/eid/1-s2.0-S2095495617310963-gr8_lrg.jpg?httpAccept=%2A%2F%2A",
            "@multimediatype": "JPEG image file",
            "@type": "IMAGE-HIGH-RES",
            "@size": "385668",
            "@ref": "gr8",
            "@mimetype": "image/jpeg"
          },
          {
            "@category": "high",
            "@height": "611",
            "@width": "1333",
            "@_fa": "true",
            "$": "https://api.elsevier.com/content/object/eid/1-s2.0-S2095495617310963-fx1_lrg.jpg?httpAccept=%2A%2F%2A",
            "@multimediatype": "JPEG image file",
            "@type": "IMAGE-HIGH-RES",
            "@size": "127813",
            "@ref": "fx1",
            "@mimetype": "image/jpeg"
          },
          {
            "@category": "thumbnail",
            "@height": "23",
            "@width": "277",
            "@_fa": "true",
            "$": "https://api.elsevier.com/content/object/eid/1-s2.0-S2095495617310963-si1.gif?httpAccept=%2A%2F%2A",
            "@multimediatype": "GIF image file",
            "@type": "ALTIMG",
            "@size": "1203",
            "@ref": "si1",
            "@mimetype": "image/gif"
          },
          {
            "@category": "standard",
            "@_fa": "true",
            "$": "https://api.elsevier.com/content/object/eid/1-s2.0-S2095495617310963-am.pdf?httpAccept=%2A%2F%2A",
            "@multimediatype": "Acrobat PDF file",
            "@type": "AAM-PDF",
            "@size": "4763674",
            "@ref": "am",
            "@mimetype": "application/pdf"
          }
        ]
      },
      "link": {
        "@rel": "abstract",
        "@href": "https://api.elsevier.com/content/abstract/scopus_id/85046788004"
      }
    }
  }
}