{
  "metadata": {
    "title": "Types, properties, and applications of non-precious oxygen reduction reaction electrocatalyst: A review",
    "authors": "; ; ",
    "journal": "Journal of Energy Chemistry",
    "date": "2025-08-31",
    "doi": "10.1016/j.jechem.2025.03.045",
    "abstract": "",
    "uri": "https://api.elsevier.com/content/article/pii/S2095495625002608",
    "pii": "S2095495625002608"
  },
  "fulltext": {
    "full-text-retrieval-response": {
      "scopus-eid": "2-s2.0-105002841188",
      "originalText": "serial JL 286353 291210 291711 291744 291809 31 Journal of Energy Chemistry JOURNALENERGYCHEMISTRY 2025-04-02 2025-04-02 2025-04-18 2025-04-18 2025-07-24T19:56:18 1-s2.0-S2095495625002608 S2095-4956(25)00260-8 S2095495625002608 10.1016/j.jechem.2025.03.045 S300 S300.1 FULL-TEXT 1-s2.0-S2095495625X0005X 2025-07-24T19:07:12.096323Z 0 0 20250801 20250831 2025 2025-04-02T23:45:58.103942Z absattachment articleinfo articletitlenorm authfirstinitialnorm authfirstsurnamenorm cid cids contenttype copyright crossmark dateloaded dateloadedtxt datesearch datesort dateupdated dco docsubtype doctype doi eid ewtransactionid hubeid indexeddate issn issnnorm itemstage itemtransactionid itemweight openaccess openarchive pg pgfirst pglast pii piinorm pubdateend pubdatestart pubdatetxt pubyr sortorder srctitle srctitlenorm srctype ssids alllist content subj subheadings suppl tomb volfirst volissue volumelist webpdf webpdfpagecount yearnav figure table body mmlmath affil articletitle auth authfirstini authfull authkeywords authlast primabst pubtype ref specialabst vitae 2095-4956 20954956 false 107 107 C Volume 107 29 305 344 305 344 202508 August 2025 2025-08-01 2025-08-31 2025 article rev © 2025 Science Press and Dalian Institute of Chemical Physics, Chinese Academy of Sciences. Published by Elsevier B.V. and Science Press. All rights are reserved, including those for text and data mining, AI training, and similar technologies. TYPESPROPERTIESAPPLICATIONSNONPRECIOUSOXYGENREDUCTIONREACTIONELECTROCATALYSTAREVIEW MOGHADDAM M 1 Introduction 2 Literature review 2.1 PEMFC description 2.2 Effect of CL on MEA efficiency 2.3 Effect of PEM on MEA efficiency 2.4 Effect of GDL on MEA efficiency 2.5 Working principle of PEMFC 2.6 Working mechanism of the ORR 2.7 Characteristics of ORR EC in half-cell testing systems 2.8 The electrode kinetics of ORR 2.9 Effect of basic environment in ORR 2.10 Effect of acidic environment in ORR 2.11 The design principles of multiphase interfaces during ORR 2.12 Theoretical methodologies for investigating the potential of new ORR EC 2.13 Theoretical prediction of the ORR's electrocatalytic performance 2.14 Electrocatalytic activity experimental factors for the ORR 3 The impact of different parameters on catalytic performance 3.1 Morphology, size, and facet sensitivity of catalyst NPs 3.2 Extended surface area of EC (ESAC) 3.3 Metal-ion center 3.4 Nano-dimension of EC 3.5 Current strategies for designing hierarchical porous structures 3.6 Construction of the hierarchically structured porous materials 4 ECs for ORR 4.1 Non-precious metal (NPMEC) or non-noble metal (NNMEC) 4.1.1 Metal-oxide (MO) catalyst 4.1.1.1 Manganese oxides 4.1.1.2 Perovskites oxides 4.1.1.3 Spinel AB2O4 4.1.2 Metal carbides (MCs) 4.1.3 Transition metal nitrides (TMNs) 4.1.4 Metal oxynitrides 4.1.5 Metal sulfides 4.1.6 M-N-C EC 4.1.7 Single-atom EC 4.1.7.1 Improvement strategies for activity of SACs 4.1.7.2 Structure and active site density engineering 4.1.7.3 Modulating the coordination environment 4.1.7.4 Synergistic impacts of single atoms and clusters/particles 4.1.7.5 Regulating the spin state of metal atoms 4.1.7.6 Improvement strategies for stability of SACs 4.1.7.7 Strengthening metal–N bonds 4.1.7.8 Alternative Fe-free catalysts 4.1.7.9 Eliminating H2O2/ROS 4.1.7.10 The anchoring mechanisms of SACs on the support substrate 4.1.8 Dual-atom catalysts (DACs) 4.1.9 Advantages of DACs 4.1.10 EC derived from metal-organic frameworks (MOFs) 4.2 Metal-free (MFEC) or non-metallic (NMEC) 4.2.1 Carbon material catalyst for ORR 4.2.1.1 EC based on functionalized and heteroatom doped graphene polymer 4.2.1.2 Conductive polymer 4.2.1.3 The enhancement of ORR performance by the integration of TM macrocycles in CPs 5 Conclusions and perspectives CRediT authorship contribution statement References ASIF 2007 1388 1413 M LIN 2023 138536 Y CALDERA 2023 119261 U ACHAKULWISUT 2023 5425 P YUSAF 2024 1026 1045 T HASSAN 2023 108404 Q DINCER 2023 116950 I SAZALI 2020 18753 18771 N LINGE 2023 11058 11070 J MUULI 2023 117 130 K HE 2017 1601741 D LIM 2022 140509 I LEE 2022 1174 1182 D ZAMAN 2021 17976 17996 S IIDA 2019 105 113 S DESA 2022 6335 M RADUWAN 2022 18468 18495 N ZHAO 2022 2102665 L DESANTES 2022 119137 J CHU 2022 122356 T WANG 2017 460 479 J JOUIN 2016 78 95 M SILVA 2012 7299 7308 R DUBAU 2014 540 560 L JUNG 2014 354 359 G ZATON 2017 409 438 M VINCENT 2017 10752 10761 I CHEN 2020 100075 M HOU 2020 100023 J WANG 2023 70 79 J TAN 2023 144624 A LI 2023 113182 Z MENG 2022 115973 K OKONKWO 2021 3780 3800 P CINDRELLA 2009 146 160 L ATHANASAKI 2023 2294 2313 G KE 2023 112261 Y WEI 2021 100061 X OSHCHEPKOV 2020 7043 7068 A LIU 2022 13 H SCHNEIDER 2023 24506 P LIU 2024 118562 F SAKTHIVEL 2023 K HORNBERGER 2022 18420 18430 E JAYABAL 2020 9420 9446 S BORUP 2020 192 200 R FOFANA 2014 398 403 D LI 2021 2000381 Y ASIF 2023 145381 M SHI 2023 108000 Z SOYEZ 2000 37870 37875 D QIAO 2010 544 553 Y CUI 2020 104525 X ZHAO 2023 19 J SHAO 2023 4026 4037 C ZOU 2023 X LASTOVINA 2023 1161 1168 T BU 2023 118365 M CHEN 2011 3167 3192 Z KIANI 2018 1124 1139 M TANG 2023 100062 W NIKZAIMAN 2022 471 504 N KULKARNI 2022 121213 D VANDERLINDEN 2023 233168 F BAZAID 2023 132187 M ZHANG 2023 113369 C SASIKUMAR 2004 11 17 G CHEN 2019 F24 D KONGKANAND 2016 1127 1137 A ORFANIDI 2017 F418 A ZENYUK 2016 F691 I SASSIN 2019 16944 16955 M SHIMPALEE 2018 F1019 S BAYRAKCEKEN 2008 165 170 A AYERS 2019 9 15 K FERRARA 2018 197 207 A ALAWAJJI 2018 208 215 R LI 2020 17628 17636 T LIU 2022 230723 Q OMRANI 2017 28515 28536 R ATYABI 2019 738 748 S JAYAKUMAR 2015 1 18 A SHAO 2019 717 724 H THAMPAN 2000 3242 T WEBER 2005 A677 A GOSTICK 2009 576 579 J TARDY 2019 118720 E LATORRATA 2014 5350 5357 S OZTURK 2017 21226 21249 A KITAHARA 2014 1256 1263 T MA 2014 307 315 J ALINK 2013 358 368 R DESSALLE 2023 237 260 A BASYOONI 2023 2966 M YAOLIN 2023 101381 A DHANABALAN 2023 4950 K XUE 2023 e202218567 S KISAND 2022 14050 14061 K LI 2023 147608 M PENG 2023 17826 17837 H XIE 2023 e202301833 Y KOPER 2013 2710 2723 M ZAGAL 2021 100683 J MATUTE 2021 138905 R LUO 2022 615 623 M SILVA 2018 502 510 N FICCA 2023 2162 2175 V BHUVANENDRAN 2022 7113 7138 N JIN 2023 155580 L WANG 2023 429 442 L LIU 2023 1652 1661 M WANG 2023 100758 L TOSONI 2023 232492 S UPADHYAY 2023 17700 17712 S RAJHI 2024 129784 A XU 2023 17508 17514 F ZHU 2023 2464 2474 Y HELSEL 2023 2202132 N LIN 2023 24721 24732 L YAN 2023 123078 L LIN 2024 2303740 X SHI 2024 123326 Y FENG 2022 2108531 Y WANG 2023 2929 2935 Y BORFECCHIA 2014 34 45 E JIANG 2024 2310163 J SARAPUU 2023 e202300849 A SCHRODER 2023 2962 2969 J PUTNAM 2024 10036 10045 S USTARROZ 2018 6775 6790 J BERNAL 2024 144302 M SU 2018 13361 13365 H EDMONDSON 2020 697 706 J WANG 2023 2304277 J FU 2023 677 686 L WANG 2022 120838 N SHIM 2011 305 309 J LEE 2012 204 211 C LU 2012 3594 3623 Y JIN 2015 1173 1179 S AGARWAL 2023 2223 2233 H ZHANG 2018 1567 1574 J WANG 2014 5184 L KIANI 2017 261 272 M LI 2016 1 17 W BINWU 2017 eaap9252 H WU 2018 8839 8845 Z KUMAR 2023 107623 Y LILLOJA 2022 121113 J AYASHA 2023 e202300885 N SINHA 2023 e202300349 S AKULA 2023 141468 S KUMAR 2023 526 541 R BALAJI 2023 122895 R KIRAN 2023 127272 G LIN 2023 103100 L SARI 2024 2310181 F SONG 2024 2301477 W WANG 2023 2201714 S LANG 2020 1900984 P BHALOTHIA 2023 16177 16188 D FENG 2022 27 46 Y AKBARIAN 2023 8889 8907 P WU 2023 e202300862 H NASIM 2023 190 200 F ZHOU 2023 156906 G TIAN 2023 2210714 H LI 2024 13006 13018 Z FAROOQ 2023 1577 1632 U LI 2018 10021 10029 J CHENG 2013 F LI 2017 12133 12136 T LIANG 2011 780 786 Y LIANG 2012 15849 15857 Y ZHANG 2024 6123 6133 Y MAHATO 2024 103924 D NAGARANI 2024 10910 10924 S SINGH 2023 3425 R SUNTIVICH 2011 546 550 J ELLINGSSON 2023 e202300947 V HU 2014 3675 3679 Y HE 2022 13240 13250 C INGAVALE 2024 9998 10010 S YANG 2023 Z FU 2023 117212 Y VERMA 2023 215177 C HE 2021 2301 2307 X XIA 2008 296 302 D SHAH 2019 R YU 2022 137542 H SANCHEZ 1959 11945 111941 J HUANG 2023 143855 C CAO 2016 776 783 X LI 2022 779 809 Z WANG 2016 11342 11350 J ZHAO 2023 800 809 S XU 2024 2593 2603 W ZHANG 2020 2000768 Q SATHYASEELAN 2024 A WANG 2020 12217 12314 Y KIANI 2021 213954 M YAN 2023 2300200 W XIAO 2022 e202206544 C CAI 2020 15012 15022 Z CHEN 2020 2003134 J SONG 2023 2212087 M LIU 2023 10724 10741 K YUASA 2011 1235 1241 M BHUNIA 2023 145028 K LIU 2022 X YANG 2023 6191 6197 H SHAO 2024 14742 14753 X SONG 2017 1700802 P LUO 2021 723 730 F QI 2024 306 314 Y WANG 2023 2206071 F ZHANG 2022 2202476 M TSAI 2023 141868 J CHI 2024 2311817 K CHEN 2024 105 113 R RAO 2023 e12371 P ZHANG 2022 653 662 J CHANG 2023 2301656 J YANG 2024 13086 13092 Y CHEN 2024 103 113 Z LUO 2024 2400357 H SWAIN 2022 214710 S FANG 2024 123346 C XU 2023 103050 K WANG 2023 169728 H MAHAJAN 2022 108930 S REN 2023 12333 12341 J ALABI 2023 1091105 A NIU 2021 8207 8213 L WEI 2023 154929 Y SAHOO 2022 246 254 L LV 2019 12052 12061 H DENG 2019 20649 20657 C WANG 2021 158249 Z JIANG 2021 13716 13723 A WANG 2019 17894 17902 S HORNBERGER 2022 9295 9304 E SONG 2022 2202916 T CHEN 2020 118729 D ZHU 2023 2035 2040 S NANDAN 2022 16108 16116 R GAO 2022 141160 P LI 2020 164 171 S NAGARANI 2024 135705 S WANG 2024 226 236 S SUN 2023 117489 Y FAN 2023 107275 M CHEN 2024 150532 R QU 2024 2400695 J LI 2023 1127 1134 H XU 2022 116826 C LIU 2021 2006766 X ZHANG 2021 137712 X LAI 2021 61129 61138 Q MACCHI 2021 1 27 S DUAN 2015 5207 5234 J ZHANG 2017 33921 33928 J LIANG 2024 159025 J XIA 2023 112880 C LI 2024 1577 1587 Z DU 2023 579 588 Q MANSOURE 2020 1171 1180 T KHOMENKO 2005 1675 1683 V MILLAN 2009 694 702 W BAO 2023 e202216751 R CHEN 2024 2401880 Z NAYAK 2022 2100277 P TAXI 2023 134938 D COUTANCEAU 1995 2739 2748 C MA 2024 e202405594 R SINGH 2023 20290 20301 S MOGHADDAMX2025X305 MOGHADDAMX2025X305X344 MOGHADDAMX2025X305XM MOGHADDAMX2025X305X344XM 2027-04-18T00:00:00.000Z 2027-04-18T00:00:00.000Z http://creativecommons.org/licenses/by-nc-nd/4.0/ © 2025 Science Press and Dalian Institute of Chemical Physics, Chinese Academy of Sciences. Published by Elsevier B.V. and Science Press. All rights are reserved, including those for text and data mining, AI training, and similar technologies. item S2095-4956(25)00260-8 S2095495625002608 1-s2.0-S2095495625002608 10.1016/j.jechem.2025.03.045 286353 2025-07-24T19:07:12.096323Z 2025-08-01 2025-08-31 1-s2.0-S2095495625002608-main.pdf https://s3-eu-west-1.amazonaws.com/prod-ucs-content-store-eu-west/content/pii:S2095495625002608/MAIN/application/pdf/a633b1e52ca7f4e02fd742e4f1920835/main.pdf main.pdf pdf true 4620823 MAIN 40 1-s2.0-S2095495625002608-main_1.png https://s3-eu-west-1.amazonaws.com/prod-ucs-content-store-eu-west/content/pii:S2095495625002608/PREVIEW/image/png/17a9e4014ea079daefc079e5c965b2ab/main_1.png main_1.png png 50996 928 656 IMAGE-WEB-PDF 1 1-s2.0-S2095495625002608-fx1.jpg https://s3-eu-west-1.amazonaws.com/prod-ucs-content-store-eu-west/content/pii:S2095495625002608/fx1/DOWNSAMPLED/image/jpeg/7ce9740032fa3d198cafd58cbbba784f/fx1.jpg fx1 fx1.jpg jpg 6436 155 111 IMAGE-DOWNSAMPLED 1-s2.0-S2095495625002608-fx2.jpg https://s3-eu-west-1.amazonaws.com/prod-ucs-content-store-eu-west/content/pii:S2095495625002608/fx2/DOWNSAMPLED/image/jpeg/c5c55df1ab89bc19e20b7d643cde8587/fx2.jpg fx2 fx2.jpg jpg 6680 155 111 IMAGE-DOWNSAMPLED 1-s2.0-S2095495625002608-fx3.jpg https://s3-eu-west-1.amazonaws.com/prod-ucs-content-store-eu-west/content/pii:S2095495625002608/fx3/DOWNSAMPLED/image/jpeg/d5ee406353b32417e50b24a94cb156f3/fx3.jpg fx3 fx3.jpg jpg 6488 155 111 IMAGE-DOWNSAMPLED 1-s2.0-S2095495625002608-fx4.jpg https://s3-eu-west-1.amazonaws.com/prod-ucs-content-store-eu-west/content/pii:S2095495625002608/fx4/DOWNSAMPLED/image/jpeg/8ec5460b5f6fdae2a5f5e3f7950a38d8/fx4.jpg fx4 fx4.jpg jpg 5655 155 111 IMAGE-DOWNSAMPLED 1-s2.0-S2095495625002608-ga1.jpg https://s3-eu-west-1.amazonaws.com/prod-ucs-content-store-eu-west/content/pii:S2095495625002608/ga1/DOWNSAMPLED/image/jpeg/d7d164c774433461f419bc917425777b/ga1.jpg ga1 true ga1.jpg jpg 19355 200 278 IMAGE-DOWNSAMPLED 1-s2.0-S2095495625002608-gr1.jpg https://s3-eu-west-1.amazonaws.com/prod-ucs-content-store-eu-west/content/pii:S2095495625002608/gr1/DOWNSAMPLED/image/jpeg/bbac528e4add27a93c90fab7edc9a791/gr1.jpg gr1 gr1.jpg jpg 125870 853 706 IMAGE-DOWNSAMPLED 1-s2.0-S2095495625002608-gr2.jpg https://s3-eu-west-1.amazonaws.com/prod-ucs-content-store-eu-west/content/pii:S2095495625002608/gr2/DOWNSAMPLED/image/jpeg/c2e9366786a939759fc58cea434f4645/gr2.jpg gr2 gr2.jpg jpg 47536 281 535 IMAGE-DOWNSAMPLED 1-s2.0-S2095495625002608-gr3.jpg https://s3-eu-west-1.amazonaws.com/prod-ucs-content-store-eu-west/content/pii:S2095495625002608/gr3/THUMBNAIL/image/jpeg/bbe9f601be6913e5dee08c4c3b13ce1c/gr3.jpg gr3 gr3.jpg jpg 60462 343 628 IMAGE-DOWNSAMPLED 1-s2.0-S2095495625002608-gr4.jpg https://s3-eu-west-1.amazonaws.com/prod-ucs-content-store-eu-west/content/pii:S2095495625002608/gr4/DOWNSAMPLED/image/jpeg/b22f9709604b28c899c787c975ff1c5c/gr4.jpg gr4 gr4.jpg jpg 44968 408 665 IMAGE-DOWNSAMPLED 1-s2.0-S2095495625002608-gr5.jpg https://s3-eu-west-1.amazonaws.com/prod-ucs-content-store-eu-west/content/pii:S2095495625002608/gr5/DOWNSAMPLED/image/jpeg/d3fe78ae0e2981419a49bb8019458297/gr5.jpg gr5 gr5.jpg jpg 166798 604 768 IMAGE-DOWNSAMPLED 1-s2.0-S2095495625002608-gr6.jpg https://s3-eu-west-1.amazonaws.com/prod-ucs-content-store-eu-west/content/pii:S2095495625002608/gr6/DOWNSAMPLED/image/jpeg/e182110dd06d3998166709f32c6f22d4/gr6.jpg gr6 gr6.jpg jpg 127436 605 732 IMAGE-DOWNSAMPLED 1-s2.0-S2095495625002608-gr7.jpg https://s3-eu-west-1.amazonaws.com/prod-ucs-content-store-eu-west/content/pii:S2095495625002608/gr7/DOWNSAMPLED/image/jpeg/6846f8b39868b96cbb51c19feab16313/gr7.jpg gr7 gr7.jpg jpg 84901 405 727 IMAGE-DOWNSAMPLED 1-s2.0-S2095495625002608-gr8.jpg https://s3-eu-west-1.amazonaws.com/prod-ucs-content-store-eu-west/content/pii:S2095495625002608/gr8/DOWNSAMPLED/image/jpeg/4618c67a58ec259f9ee73d99cd01893f/gr8.jpg gr8 gr8.jpg jpg 90792 476 665 IMAGE-DOWNSAMPLED 1-s2.0-S2095495625002608-gr9.jpg https://s3-eu-west-1.amazonaws.com/prod-ucs-content-store-eu-west/content/pii:S2095495625002608/gr9/THUMBNAIL/image/jpeg/6d003ffc24d3c1af35693b216c97cfb6/gr9.jpg gr9 gr9.jpg jpg 170549 980 661 IMAGE-DOWNSAMPLED 1-s2.0-S2095495625002608-fx1.sml https://s3-eu-west-1.amazonaws.com/prod-ucs-content-store-eu-west/content/pii:S2095495625002608/fx1/THUMBNAIL/image/gif/216dcd036b0512c3bf38610156d6e133/fx1.sml fx1 fx1.sml sml 16706 164 117 IMAGE-THUMBNAIL 1-s2.0-S2095495625002608-fx2.sml https://s3-eu-west-1.amazonaws.com/prod-ucs-content-store-eu-west/content/pii:S2095495625002608/fx2/THUMBNAIL/image/gif/ac8ca076312ff17cf8e38a806435cf68/fx2.sml fx2 fx2.sml sml 16607 164 117 IMAGE-THUMBNAIL 1-s2.0-S2095495625002608-fx3.sml https://s3-eu-west-1.amazonaws.com/prod-ucs-content-store-eu-west/content/pii:S2095495625002608/fx3/THUMBNAIL/image/gif/6fb5a827dce68164fc6b0c2e926b8ce9/fx3.sml fx3 fx3.sml sml 16868 164 117 IMAGE-THUMBNAIL 1-s2.0-S2095495625002608-fx4.sml https://s3-eu-west-1.amazonaws.com/prod-ucs-content-store-eu-west/content/pii:S2095495625002608/fx4/THUMBNAIL/image/gif/b6cef29d6ce5b1a64537b780b3b68c3d/fx4.sml fx4 fx4.sml sml 13724 164 117 IMAGE-THUMBNAIL 1-s2.0-S2095495625002608-ga1.sml https://s3-eu-west-1.amazonaws.com/prod-ucs-content-store-eu-west/content/pii:S2095495625002608/ga1/THUMBNAIL/image/gif/80b73352a26b636e8467663e284b9dc8/ga1.sml ga1 true ga1.sml sml 10976 157 219 IMAGE-THUMBNAIL 1-s2.0-S2095495625002608-gr1.sml https://s3-eu-west-1.amazonaws.com/prod-ucs-content-store-eu-west/content/pii:S2095495625002608/gr1/HIGHRES/image/gif/44f5509a3817287e3622238413d345d6/gr1.sml gr1 gr1.sml sml 8198 163 135 IMAGE-THUMBNAIL 1-s2.0-S2095495625002608-gr2.sml https://s3-eu-west-1.amazonaws.com/prod-ucs-content-store-eu-west/content/pii:S2095495625002608/gr2/THUMBNAIL/image/gif/3dee37249d40438b512766fc06779a64/gr2.sml gr2 gr2.sml sml 16763 115 219 IMAGE-THUMBNAIL 1-s2.0-S2095495625002608-gr3.sml https://s3-eu-west-1.amazonaws.com/prod-ucs-content-store-eu-west/content/pii:S2095495625002608/gr3/THUMBNAIL/image/gif/79fe6659521d1d34e0dff0fd3d26b01a/gr3.sml gr3 gr3.sml sml 8488 120 219 IMAGE-THUMBNAIL 1-s2.0-S2095495625002608-gr4.sml https://s3-eu-west-1.amazonaws.com/prod-ucs-content-store-eu-west/content/pii:S2095495625002608/gr4/THUMBNAIL/image/gif/2027b0c6799b0ba539585f469fea7519/gr4.sml gr4 gr4.sml sml 8508 134 219 IMAGE-THUMBNAIL 1-s2.0-S2095495625002608-gr5.sml https://s3-eu-west-1.amazonaws.com/prod-ucs-content-store-eu-west/content/pii:S2095495625002608/gr5/DOWNSAMPLED/image/gif/d7b89a6afe1c5f3f077851c60eee895e/gr5.sml gr5 gr5.sml sml 19351 164 208 IMAGE-THUMBNAIL 1-s2.0-S2095495625002608-gr6.sml https://s3-eu-west-1.amazonaws.com/prod-ucs-content-store-eu-west/content/pii:S2095495625002608/gr6/THUMBNAIL/image/gif/8e87654af42ab3af750584e12c63d001/gr6.sml gr6 gr6.sml sml 16243 164 198 IMAGE-THUMBNAIL 1-s2.0-S2095495625002608-gr7.sml https://s3-eu-west-1.amazonaws.com/prod-ucs-content-store-eu-west/content/pii:S2095495625002608/gr7/HIGHRES/image/gif/df6ead7a5f7e862d749fcf54929b8378/gr7.sml gr7 gr7.sml sml 11524 122 219 IMAGE-THUMBNAIL 1-s2.0-S2095495625002608-gr8.sml https://s3-eu-west-1.amazonaws.com/prod-ucs-content-store-eu-west/content/pii:S2095495625002608/gr8/THUMBNAIL/image/gif/5c226ae84cba16f4eb16e8ca10ca5695/gr8.sml gr8 gr8.sml sml 17061 157 219 IMAGE-THUMBNAIL 1-s2.0-S2095495625002608-gr9.sml https://s3-eu-west-1.amazonaws.com/prod-ucs-content-store-eu-west/content/pii:S2095495625002608/gr9/DOWNSAMPLED/image/gif/1ae979fdcaa4012a32a6109e848b0c4c/gr9.sml gr9 gr9.sml sml 8587 163 110 IMAGE-THUMBNAIL 1-s2.0-S2095495625002608-fx1_lrg.jpg https://s3-eu-west-1.amazonaws.com/prod-ucs-content-store-eu-west/content/pii:S2095495625002608/HIGHRES/image/jpeg/6d29f3f5946e37e696511ea8b0f851f8/fx1_lrg.jpg fx1 fx1_lrg.jpg jpg 38840 688 492 IMAGE-HIGH-RES 1-s2.0-S2095495625002608-fx2_lrg.jpg https://s3-eu-west-1.amazonaws.com/prod-ucs-content-store-eu-west/content/pii:S2095495625002608/THUMBNAIL/image/jpeg/ffec599eedf338e9aea512e396c58889/fx2_lrg.jpg fx2 fx2_lrg.jpg jpg 42365 688 492 IMAGE-HIGH-RES 1-s2.0-S2095495625002608-fx3_lrg.jpg https://s3-eu-west-1.amazonaws.com/prod-ucs-content-store-eu-west/content/pii:S2095495625002608/HIGHRES/image/jpeg/40d00da405a8fe0fe8ad4a7e1952579f/fx3_lrg.jpg fx3 fx3_lrg.jpg jpg 42394 688 492 IMAGE-HIGH-RES 1-s2.0-S2095495625002608-fx4_lrg.jpg https://s3-eu-west-1.amazonaws.com/prod-ucs-content-store-eu-west/content/pii:S2095495625002608/HIGHRES/image/jpeg/04c0e1321e6a76ce121b2b301e26fcf0/fx4_lrg.jpg fx4 fx4_lrg.jpg jpg 35823 688 492 IMAGE-HIGH-RES 1-s2.0-S2095495625002608-ga1_lrg.jpg https://s3-eu-west-1.amazonaws.com/prod-ucs-content-store-eu-west/content/pii:S2095495625002608/HIGHRES/image/jpeg/164a2d0b62282b043da51a9576bd8914/ga1_lrg.jpg ga1 true ga1_lrg.jpg jpg 149910 886 1234 IMAGE-HIGH-RES 1-s2.0-S2095495625002608-gr1_lrg.jpg https://s3-eu-west-1.amazonaws.com/prod-ucs-content-store-eu-west/content/pii:S2095495625002608/HIGHRES/image/jpeg/fb2fdd78ffd5aaffc59ce66d0951e5c8/gr1_lrg.jpg gr1 gr1_lrg.jpg jpg 666552 3778 3126 IMAGE-HIGH-RES 1-s2.0-S2095495625002608-gr2_lrg.jpg https://s3-eu-west-1.amazonaws.com/prod-ucs-content-store-eu-west/content/pii:S2095495625002608/HIGHRES/image/jpeg/9771da8d1dc4aa094fe8a532760d6c3c/gr2_lrg.jpg gr2 gr2_lrg.jpg jpg 260159 1244 2368 IMAGE-HIGH-RES 1-s2.0-S2095495625002608-gr3_lrg.jpg https://s3-eu-west-1.amazonaws.com/prod-ucs-content-store-eu-west/content/pii:S2095495625002608/HIGHRES/image/jpeg/653041ac2d63fac94552fe6dc1cd2cfe/gr3_lrg.jpg gr3 gr3_lrg.jpg jpg 342412 1519 2782 IMAGE-HIGH-RES 1-s2.0-S2095495625002608-gr4_lrg.jpg https://s3-eu-west-1.amazonaws.com/prod-ucs-content-store-eu-west/content/pii:S2095495625002608/HIGHRES/image/jpeg/d84eab998ec61b2d3d3852e5b4cb1082/gr4_lrg.jpg gr4 gr4_lrg.jpg jpg 127627 1085 1767 IMAGE-HIGH-RES 1-s2.0-S2095495625002608-gr5_lrg.jpg https://s3-eu-west-1.amazonaws.com/prod-ucs-content-store-eu-west/content/pii:S2095495625002608/HIGHRES/image/jpeg/6fb683838f6740dea0f3c56e75bbf89f/gr5_lrg.jpg gr5 gr5_lrg.jpg jpg 922274 2673 3399 IMAGE-HIGH-RES 1-s2.0-S2095495625002608-gr6_lrg.jpg https://s3-eu-west-1.amazonaws.com/prod-ucs-content-store-eu-west/content/pii:S2095495625002608/HIGHRES/image/jpeg/f920da0795145d0db6c8a5c7b1108c36/gr6_lrg.jpg gr6 gr6_lrg.jpg jpg 683314 2676 3239 IMAGE-HIGH-RES 1-s2.0-S2095495625002608-gr7_lrg.jpg https://s3-eu-west-1.amazonaws.com/prod-ucs-content-store-eu-west/content/pii:S2095495625002608/HIGHRES/image/jpeg/d926051eac19ac2b6084512673f7869e/gr7_lrg.jpg gr7 gr7_lrg.jpg jpg 420750 1793 3220 IMAGE-HIGH-RES 1-s2.0-S2095495625002608-gr8_lrg.jpg https://s3-eu-west-1.amazonaws.com/prod-ucs-content-store-eu-west/content/pii:S2095495625002608/THUMBNAIL/image/jpeg/7391401cdb89bfe72254dc161d59b5be/gr8_lrg.jpg gr8 gr8_lrg.jpg jpg 506212 2107 2946 IMAGE-HIGH-RES 1-s2.0-S2095495625002608-gr9_lrg.jpg https://s3-eu-west-1.amazonaws.com/prod-ucs-content-store-eu-west/content/pii:S2095495625002608/HIGHRES/image/jpeg/e5e0d283345e8a9fd974a5034202610f/gr9_lrg.jpg gr9 gr9_lrg.jpg jpg 952353 4337 2926 IMAGE-HIGH-RES 1-s2.0-S2095495625002608-si1.svg https://s3-eu-west-1.amazonaws.com/prod-ucs-content-store-eu-west/content/pii:S2095495625002608/STRIPIN/image/svg+xml/0ef0ac7ed637e91cae5e8fdfbe326746/si1.svg si1 si1.svg svg 9569 ALTIMG 1-s2.0-S2095495625002608-si2.svg https://s3-eu-west-1.amazonaws.com/prod-ucs-content-store-eu-west/content/pii:S2095495625002608/STRIPIN/image/svg+xml/b385b330de916314df1d4c8ea256b7b4/si2.svg si2 si2.svg svg 5750 ALTIMG 1-s2.0-S2095495625002608-si3.svg https://s3-eu-west-1.amazonaws.com/prod-ucs-content-store-eu-west/content/pii:S2095495625002608/STRIPIN/image/svg+xml/485c06b1de825e430498996b42a8f8a7/si3.svg si3 si3.svg svg 15426 ALTIMG 1-s2.0-S2095495625002608-si4.svg https://s3-eu-west-1.amazonaws.com/prod-ucs-content-store-eu-west/content/pii:S2095495625002608/STRIPIN/image/svg+xml/f25f5a539de754c0db1b09c36b5c6dca/si4.svg si4 si4.svg svg 10326 ALTIMG 1-s2.0-S2095495625002608-si5.svg https://s3-eu-west-1.amazonaws.com/prod-ucs-content-store-eu-west/content/pii:S2095495625002608/STRIPIN/image/svg+xml/f249354e6acf1ff9a907bfd8f132d303/si5.svg si5 si5.svg svg 17176 ALTIMG JECHEM 4583 S2095-4956(25)00260-8 10.1016/j.jechem.2025.03.045 Science Press Fig. 1 (a) Evolution of ORR catalysts and commercialization of FC. Reproduced with permission from ref. [14]. Copyright 2021 John Wiley & Sons; (b) FC technologies in Japan. Reproduced with permission from ref. [15]. Copyright 2019 National Institute of Clean-and-Low-Carbon Energy. Fig. 2 Acidic and basic FCs. Reproduced with permission from ref. [67]. Copyright 2018 University of Connecticut. Fig. 3 (a) Catalytic activities (Log j) OPG/FeN4 vs. DFT TGA binding energies (E bTGA, eV) for Fe-phthalocyanines and porphyrins catalysts; Log j (E = −0.3 V) vs. the formal potential E°Fe(III)/(II) of the catalyst for the TGA electrooxidation using OPG electrodes modified: (b) with FePcs and FePs complexes and (c) with MWCNT/FePcs and MWCNT/FePs; (d) energy gaps plot (donor–acceptor intermolecular hardness 2Δη DA) of the frontier orbitals of TGA (HOMO) and the various FeN4 complexes (SOMO); (e) correlation of (log j) E vs. Δη DA; (f) correlation between (log TOF) E vs. Δη DA of TGA oxidation activated using FeN4 complexes. Reproduced with permission from ref. [106]. Copyright 2021 Elsevier. Fig. 4 (a) Associative and dissociative mechanism of ORR; (b) ORR in acidic and basic media. Reproduced with permission from ref. [110]. Copyright 2024 Elsevier. Fig. 5 (a, b) Gibbs free energy change of ORR pathways on different Sn sites; (c) O2 absorption energies on the optimized model structures; (d) PDOS of the SnN2O, O2, and O2@Sn SAC; (e) charge density difference pattern and relative charge states of Sn; (f) ELF analysis for SnN4 (left) and SnN2O (right); (g) PDOS of SnN4 and SnN2O. Reproduced with permission from ref. [123]. Copyright 2024 John Wiley & Sons. Fig. 6 (a, b) Fe Mossbauer spectroscopy and (c) mass-based Fe site density values of SA-FeIII/SNPC and Fe/NPC-HT2; (d) Fe K-edge XANES spectra; (e) Fourier-transformed magnitude of Fe K-edge EXAFS signal; (f) wavelet transforms (WT) for EXAFS signals; (g) Fe K-edge EXAFS analysis in k space and (h) R space in SA-FeIII/SNPC. Reproduced with permission from ref. [136]. Copyright 2021 John Wiley & Sons. Fig. 7 The creation of an NNM catalyst as an ORR catalyst in PEMFCs. Reproduced with permission from ref. [14]. Copyright 2021 John Wiley & Sons. Fig. 8 (a) Schematic structure of 3DOM Co@WNO and ZAB for ORR pathway; (b) power density and polarization plots; (c) rate performance at various current densities; (d) specific capacities of 3DOM Co@WNO and Pt/C-based primary ZABs; (e) scheme of the flexible ZABs; (f) time-dependent open circuit voltage curve; (g) OCV of flexible ZABs at various bending angles; (h) power density and polarization plots; (i) wearable LEDs lit by three flexible ZABs assembled by 3DOM Co@WNO. Reproduced with permission from ref. [193]. Copyright 2022 Elsevier. Fig. 9 ORR performance of IL-M-SAC catalysts. (a) CV test comparison in O2-saturated electrolyte; (b) LSV test at 1600 r min−1; (c) halfwave potential and limited current density comparison; (d) Tafel plot test; (e) LSV test at various rates; (f) corresponding RRDE measurement; (g) H2O2 and n of electron transferred; (h) stability test; (i) comparative analysis of methanol tolerance of IL-Fe-SAC-8 with Pt/C. Reproduced with permission from ref. [202]. Copyright 2024 Elsevier. (j) Different properties of SAC in ORR/OER/HER/NRR procedures. Reproduced with permission from ref. [203]. Copyright 2024 ACS Publications. Table 1 Comparison of ORR performance of corresponding SACs. Catalyst Half-wave potential (E 1/2) (V vs. RHE) Diffusion-limited current density (mA cm−2) Electrolyte Ref. Zn N x /BP 0.836 5.72 0.1 M KOH [216] Ni-SAs@NC 0.850 5.45 0.1 M KOH [217] Fe-SAs@NC 0.890 5.46 0.1 M KOH [217] Co-N/P-C 0.890 5.15 0.1 M KOH [218] Ni-SiNC 0.870 5.20 0.1 M KOH [219] Ni-NC 0.770 5.16 0.1 M KOH [219] Co SAs@PNCN 0.850 5.92 0.1 M KOH [220] Ni SAs@PNCN 0.750 4.45 0.1 M KOH [220] Fe SAs@PNCN 0.820 4.48 0.1 M KOH [220] A-SAC (Fe, Ni, Zn)/NC 0.880 6.15 0.1 M KOH [221] SAC (Fe, Ni, Zn)/NC 0.840 6.07 0.1 M KOH [221] Fe-SAC/NSG-900 0.930 5.50 0.1 M KOH [222] Zn NC-800 0.720 3.50 0.1 M KOH [223] Co-SAC/NC 0.884 5.90 0.1 M KOH [224] Zn/Co-N-C 0.780 5.38 0.1 M KOH [225] Fe-N-C/Fe3-OP 0.911 5.88 0.1 M KOH [226] Ca/NPS-HC 0.890 5.60 0.1 M KOH [227] CoSA@NC 0.825 5.32 0.1 M KOH [228] CeO2@Fe-NC 0.890 6.20 0.1 M KOH [229] Table 2 A cost comparison of the prominent catalysts. Cathode catalysts (1 g) Fabrication cost/USD($) Pt/C 20% 301.30 SACs 8.83 Metal carbides 3.94 Metal nitrides 5.61 Metal oxides 1.08 MOFs 3.93 Conductive polymers 3.67 Carbon-based materials (MWCNT, …) 4.53 Table 3 Recent works on ORR EC. Electrocatalyst Synthesis method Research aim Activity Stability (number of cycles/losses [%]) Ref. CoNi@N-GCNT Freeze drying Production of TM-based CoNi alloy support on N-GCNTs Onset potential of 0.9 V and E 1/2 = 0.84 V 10000/no loss [238] Ti4O7/Mxene Hydrothermal and carbothermal Development of NMP-based nanocomposite Onset potential of 0.91 V and E 1/2 = 0.72 V 80000/35% [239] PdNi nanowire Hydrothermal Fabrication of ultrathin nanowire for ORR EC Exhibited E 1/2 = 0.95 V 200000/29% [240] PdBP Soft templating preparation Fabrication of ternary alloy nanosphere for ORR EC The recorded mass activity of 1.45 A mg−1 Pd 5000/32.1% [241] MnO/CoMn@N-doped graphite composite Annealing of Prussian blue analogue Synthesis of CoMn alloy coated with N-C and MnO composite for OER and ORR EC Onset potential of 0.91 V and E 1/2 = 0.76 V 40000/16% [242] Fe2Co2Ni2/N-CNT Solvothermal Development of ternary TM alloy embedded N-CNTs for ORR EC Onset potential of 0.81 V and E 1/2 = 0.75 V 25000/4.5% [243] Rh2.6Fe3Co2.6@NG Sequential annealing and substitution process Production of bifunctional rhodium, Fe, and Co alloy NPs EC anchored on N-Gr for HER and ORR Onset potential of 0.98 V and E 1/2 = 0.82 V 5000/positive shift in half-wave potential by 9 mV [244] Pt(Fe,Co,Ni)3/C Spray dehydration and annealing Synthesis of low Pt structurally ordered quaternary alloy EC for ORR Exhibited mass activity of 3.189 mA µgPt −1 10000/17% [245] PtNiRhMo nanoalloy Solvothermal Synthesis of octahedral-shaped PtNi doped with molybdenum and rhodium as for ORR EC The recorded mass activity of 1.53 A mgPt −1 NA [246] PtFe/Pt intermetallic compound Wet impregnation reaction Synthesis of atomically ordered Pt-based intermetallic compound for ORR EC Exhibited mass activity of 0.92 A mgPt −1 10000/24% [247] FeNi3@NC intermetallic compound Freeze drying and annealing Development of intermetallic compound embedded in N-C as bifunctional EC for OER and ORR Recorded E 1/2 = 0.86 V 3000/positive shift in half-wave potential by 6 mV [248] Pt5La intermetallic compound Solvothermal Alloying Pt with early TM to produce intermetallic compound for durable ORR EC Exhibited mass activity of 0.49 A mgPt −1 30000/6.1% [249] FeCoNiMnCr@N-CNT Solvothermal Development of FeCoNiMnCr HEA NPs grafted on N-CNTs for ORR EC Onset potential of 0.95 V and E 1/2 = 0.8 V 10% loss [250] FeCoNiCuMn/NCNS Confinement growth process Utilization of the synergistic effect of HEA NPs formed on N-carbon nanosheet as bifunctional EC of nitrite sensing and ORR E 1/2 = 0.87 V 3000/negligible loss [251] AlCuNiPtMn NPs De-alloying reaction Synthesis of self-supported AlCuNiPtMn NPs HEA for durable ORR EC Exhibited mass activity of 3.5 A mg−1 30000/no loss [252] Table 4 ORR results of Co3O4/poly(EDOT-F). Reproduced with permission from ref. [271]. Copyright 2021 ACS Publications. Polymer Peak potential (V) I L (mA cm−1) E 1/2 (V) Onset potential (V) CAWater (°) PEDOT 0.641 −2.329 0.625 0.810 55.6 Poly(EDOT-OH) 0.536 −1.996 0.525 0.750 23.5 Poly(EDOT-F) 0.524 −3.707 0.603 0.982 154 Co3O4 −1.434 0.522 0.720 Co3O4/PEDOT −2.592 0.664 0.830 Co3O4/Poly(EDOT-OH) −2.135 0.525 0.770 Co3O4/Poly(EDOT-F) −4.761 0.628 0.990 20% Pt/C −3.615 0.727 0.938 Review Types, properties, and applications of non-precious oxygen reduction reaction electrocatalyst: A review Mahdi Soleimani Moghaddam Writing – review & editing Writing – original draft Visualization Validation Supervision Conceptualization a ⁎ Meysam Seyfi Kafshgari Writing – review & editing Writing – original draft Visualization Validation Conceptualization b Ali Bahari Conceptualization Validation Visualization Writing – original draft Writing – review & editing a Leila Asadi Kafshgari Conceptualization Validation Visualization Writing – original draft Writing – review & editing b ⁎ Adeleh Jafari Conceptualization Validation Visualization Writing – original draft Writing – review & editing a a Department of Solid-State Physics, Faculty of Science, University of Mazandaran, P. O. BOX: 47416-95447, Babolsar, Iran Department of Solid-State Physics Faculty of Science University of Mazandaran P. O. BOX: 47416-95447 Babolsar Iran Department of Solid-State Physics, Faculty of Science, University of Mazandaran, P. O. BOX: 47416-95447, Babolsar, Iran b Department of Chemical Engineering, Babol Noshirvani University of Technology, P.O.BOX: 484, Babol, Iran Department of Chemical Engineering Babol Noshirvani University of Technology P.O.BOX: 484 Babol Iran Department of Chemical Engineering, Babol Noshirvani University of Technology, P.O.BOX: 484, Babol, Iran ⁎ Corresponding authors. Graphical abstract This review offers a comprehensive overview of non-precious group metal (non-PGM) electrocatalysts, with a particular focus on oxygen reduction reactions (ORR). The main challenge preventing the broad commercial use of polymer electrolyte membrane fuel cells (PEMFCs) is the dependence on noble metals, specifically electrocatalyst (EC) based on platinum (Pt) at the cathode, which is indispensable for assisting the oxygen reduction reaction (ORR) in fuel cells (FCs). Research on EC-containing non-noble metal (NNM) has been considerable over the past few decades to minimize costs and reduce the excessive loading of EC based on Pt. This review is aimed at improving the reliability and stability of non-precious metal EC. To achieve a feasible ORR, Pt-based EC is crucial for the widespread commercial applications of PEMFCs. The review emphasizes improving ORR performance, stability, and cost-effectiveness in catalysts that are not precious metals. The article examines the advancements in non-precious nanomaterial-based EC, highlighting different types that have improved ORR efficiency. The review suggests future possibilities and directions for further improvement in designing and constructing EC with high efficiency and low costs for PEMFCs. Keywords Fuel cells Oxygen reduction reaction Electrocatalyst Non-noble metal Nanomaterial 1 Introduction The global energy demand has experienced a significant surge, primarily driven by the current rate of population growth [1,2]. An alarming issue is the substantial reliance on fossil fuels to meet this energy demand [3–5]. Fossil fuels, nonrenewable resources, pose considerable drawbacks and are implicated in environmental issues, notably global warming. As a result, it is imperative to explore reliable and ecologically sustainable alternatives for energy generation. Fuel cell (FC) technologies have emerged as a viable alternative to fossil fuels for producing clean energy in response to this imperative over the past few decades [6–10]. Polymer electrolyte membrane fuel cells (PEMFCs) are highly regarded for efficiently converting chemical energies to electricity through electrochemical processes. Compared to other fuel cell technologies, they are thought to be the best for both stationary and mobile uses because they have a high energy density, a short start-up time, high efficiency, no toxic emissions, silent operation, low operating temperature, the ability to work in stop-and-go driving conditions, and are easy to handle safely [11–13]. Fig. 1 indicates the evolution of oxygen reduction reaction (ORR) catalysts and the commercialization of FC [14,15]. Despite these advantages, challenges impeding their commercialization include issues related to durability and cost [16,17]. The successful commercialization of PEMFCs necessitates careful consideration of durability and cost. In this regard, the minimum lifetime requirements established by the American Department of Energy (DOE) for stationary applications stand at 40,000 h, while they approximate 5000 h for automotive applications [18,19]. While recent efforts have aimed at reducing costs and enhancing durability, foundational innovations in PEMFC technology are imperative to facilitate sustainable commercialization. In general, the lifetime of PEMFCs can be compromised by factors such as water management systems, thermal and power cycling, and degradation of the membrane electrode assembly (MEA) [20–23]. Carbon corrosion, Pt accumulation, or MEA degradation may result from these issues [24–31]. Degradation can happen in extreme situations, including high oxygen (O2) levels passing through the membranes or poor control of operational factors such as a lack of reactants and fuel [32–34]. This leads to a process in which the active layer does not contain sufficient gas [35,36]. Consequently, extensive efforts are being made globally to comprehend the degradation mechanisms and achieve the lifetime previously mentioned objectives. Recently, there has been a focus on the mechanisms for the degradation of electrocatalysts (EC) that are supported by Pt and carbon, and emphasized problems related to fuel and oxidant shortages, considering the extensive literature on impurities and water management in this field [37–40]. Furthermore, the quantity of Pt required in FCs has been significantly reduced owing to economic considerations, with concentrations as low as 0.4 mg cm−2 or even lower at the cathode and 0.05 mg cm−2 at the anode [41]. This reduction has been achieved progressively by replacing Pt with carbon-based structures. However, the catalysis of carbon support oxidation by Pt and the subsequent release of sustained catalyst nanoparticles (NPs) cause a diminish in active surface area, significantly impacting the ORR performance [42–45]. According to an anticipated cost for large-scale FC production, research conducted by the DOE has established that the Pt EC layers are responsible for 56% of the expenses in a PEMFC stack [46]. This expenditure is a result of the considerable quantity of catalysts based on Pt that is required in both the cathode catalyst layer, which is responsible for catalyzing the ORR, and the anode catalyst layer, which is responsible for catalyzing the hydrogen (H2) oxidation reaction (HOR). Anodic HOR leads to relatively slow ORR kinetics for the cathode. This is due to the need to overcome the strong energy bonds between oxygen molecules, particularly in low-pH environments. To facilitate this process, a large amount of platinum (Pt) catalyst, approximately eight times more than the anode catalyst, is required. However, this leads to high overpotential and limits the performance of PEMFCs [47,48]. Pt-based EC are recognized as effective materials due to their superior catalytic properties. However, prohibitive expenses, resource limitations, vulnerability to toxicity, and insufficient stability impede their practical usage. Therefore, effective, robust, and cost-effective ORR EC are crucial for attaining [49,50]. In recent decades, several design approaches and engineering methodologies were created to improve ORR performance by making refined adjustments to the nanostructures, doping arrangement, and porosity of nanostructures. Collaborative efforts from experimental and theoretical scientists have yielded insightful perspectives into the ORR process on carbon materials without metal. Considerable research has been done to improve the efficiency of ORR EC by creating new nanostructures with increased surface areas and active sites to enhance ORR efficiency. The complicated mechanism and sluggish kinetics of ORR remain insufficiently understood, primarily owing to challenges in precisely identifying active sites and the intricate proton/electron transfer pathways to O2 molecules, despite much research and notable progress over the years [51–55]. Herein, we offer a summary of recent developments in NNMEC for ORR, along with prospects for designing nanomaterials as very effective EC for ORR in PEMFCs. To enhance PEMFC technology with NNMEC, research endeavors have broadened to include a variety of prospective materials, a few of which have undergone evaluation in recent times [56–59]. The term “catalyst performance” is used to simplify the situation by referring to the ORR electro-kinetics that take place on these nanomaterials, which are normally evaluated at large electrode potentials [60–63]. The electrochemical efficiency is assessed on a volumetric basis, considering that NNMEC is relatively more economical than Pt-metal EC. Consequently, increased loading becomes less critical when the catalyst layer thickness approaches 100 mm; however, at this point, mass transport issues may emerge [64,65]. Electrochemical performance is a comprehensive measure of ORR electro-kinetics over a broad potential range, considering electron transport, mass transfer, and the structural and chemical characteristics of various catalyst architectures. Non-noble electrocatalytic materials are tested for stability and durability by examining how well they maintain activity and performance following accelerated degradation tests. 2 Literature review 2.1 PEMFC description A basic PEMFC has seven primary layers: the cathode catalyst layer, the proton exchange membrane, the hydrogen diffusion layer, the hydrogen flow plate, the anode catalyst layer, the air diffusion layer, and the airflow plate. In PEMFCs, the anode and cathode are separated via a solid ionomer membrane that facilitates proton transport between the two electrodes. The electrodes can conduct electricity, while the membrane serves as an ionic conductor, allowing for physical separation between them. Traditional fuels like compressed gaseous hydrogen are accepted by the anode, while an oxidant like atmospheric oxygen is accepted by the cathode. Electrons and protons are created via the oxidation of hydrogen by the anode. Protons are transported through the membrane over the cathode by the electrochemical potential gradient. The cathode receives electrons from the outside circuit. At the cathode, electrons and protons recombine, where they engage in the ORR with water. PEMFCs are characterized by their high-power density, which is attributed to the electrolyte membrane, which is typically a thin layer with a thickness of roughly 20 µm and a lightweight composition. Due to the electrolyte substance utilized in the FC, the operating temperature of PEMFCs is established. Typically, membrane materials are derived from perfluorinated H2O3S polymers, such as Nafion or Aquivion. PEMFCs with perfluorinated H2O3S polymers operate effectively at temperatures below 100 °C, depending on liquid water for proton conductivity in cold environments [66]. It is vital to use noble-metal catalysts at these temperatures to facilitate reactions at the electrodes. This is because they are less vulnerable to being poisoned by impurities, and they are also better able to handle water management at these temperatures. Fig. 2 indicates a scheme of acidic and basic FCs [67]. The current research is concentrated on advancing ORR catalysts in the cathode of PEMFCs. Additionally, PEMFCs offer several advantages, including (I) production of electrical energy, avoiding the “thermal bottleneck” associated with the second law of thermodynamics [68], making them more efficient than combustion engines that first converted chemical energy into heat and then converted mechanical energy, (II) FC vehicles emit only water and minimal heat, representing a significant improvement over internal combustion engines, (III) PEMFCs, do not have any components that move, which increases their dependability in comparison to conventional engines, (IV) Hydrogen, the preferred fuel for PEMFCs, is often readily generated, whereas the procedures involved in oil extraction and refining have detrimental effects on the environment. The MEA constitutes the core of PEMFC. Elevating the operating voltage under practically relevant load situations is a crucial element in advancing PEMFC technology. Four main parts constitute the MEA: the proton exchange membrane (PEM), the gas diffusion layers (GDLs) for the anode and cathode, the catalyst layers (CL), and the microporous layer (MPL), which is usually part of the GDL. 2.2 Effect of CL on MEA efficiency Pt NPs catalyst, usually, is used to construct the CL in both the anode and cathode, and they are supported by carbon black materials with a large surface area and an ionomer. Electrochemical reactions occur at the interface of the three phases: catalyst, ionomer, and reactant. The kinetics of the ORR at the cathode is more sluggish than that of the HOR at the anode. Boosting catalysts' natural catalytic activities can help speed up slow ORR kinetics, which in turn makes MEA work better. Furthermore, mass transport capabilities inside the catalyst layers are increasingly critical for the efficiency attributes of the MEA. The meticulous design of catalyst layers, incorporating optimum pore structure, thickness, and ionomer content, emerged as a crucial determinant in enhancing MEA performance. However, the impacts resulting from alterations in CL preparation are interrelated. The quantity of ionomer required for proton transport and the formation of the triple phase area in both catalyst layers influences catalytic activity, water management, reactant permeability, and ionic resistance concurrently [69]. The permeability of oxygen increases as the thickness of the ionomer film in the catalyst layer decreases [70]. An excessively thick ionomer film in the CL enhances proton conductivity but concurrently elevates reactant diffusion resistance, therefore diminishing MEA performance. Furthermore, it can negatively affect the cell's water management by obstructing certain pores in the CL. Conversely, insufficient ionomer content can diminish ionic conductivity and lower the active triple-phase region [71,72]. To get the best performance from the MEA, it is important to utilize the right amount of ionomer in the catalyst layer. Another approach to enhancing MEA performance may involve minimizing the electrical resistance of each catalyst layer. This is attained by decreasing the thickness of the catalyst layer through the utilization of catalysts with high platinum content, leading to an enhancement of the linear segments of the I-V characteristics of the MEA. The thickness of the CL influences water management and the response to changes in operational circumstances [73,74]. The ink compositions and selecting an appropriate MEA preparation can enhance efficiency. 2.3 Effect of PEM on MEA efficiency The type of membrane can significantly alter the efficiency parameters of the MEA [75]. Generally, thinner membranes result in reduced ohmic resistance, therefore enhancing MEA efficiency [76]. However, thinner membranes result in heightened hydrogen crossing and alterations in the back diffusion of product water. Both effects are impacting the durability and performance of MEA. The PEM in MEA facilitates isolated electron transfer, segregates gas reactants, and facilitates proton migration and transmission. The fundamental criteria for PEMs encompass elevated ionic conductivity, appropriate water absorption capacity, superior mechanical qualities in dry and hydrated conditions, robust thermal stability, minimal air permeability, electrochemical stability, and a controlled swelling rate. The Nafion series of perfluorosulfonic acid (PFSA) membranes has been primarily employed in low-temperature photovoltaic FCs because of its superb mechanical and thermal stability and remarkable proton conductivity [77]. The PFSA molecule contains a sulfonic acid functional group, a perfluoroethylene side chain, and a polytetrafluoroethylene (PTFE) backbone [78]. The Mechanical and chemical stability of PEM is specified with the hydrophobic main chain of PTFE [79]. Proton conductivity is primarily dependent on the sulfonic acid groups as the primary active elements. PFSA membranes can be classified into long-side chain (LSC) and short-side chain (SSC) membranes based on the length of their side chains. The SSC membranes can hold more water, have better ionic conductivity and comparable mechanical properties, and have a greater glass transition temperature [80], therefore demonstrating enhanced performance in MEA, especially under low humidity conditions. Because they have a higher ion exchange capacity (IEC), SSC membranes have a lot more water in them. This means that the network of hydrophobic channels is not as well established as it is in LSC membranes. The proton conductivity of the PFSA membrane is typically enhanced by reduced temperature and elevated humidity. An elevated operating temperature will result in membrane deterioration and failure due to desiccation. On the other hand, in cold environments, the polymer chain sequesters a portion of the water, causing it to rapidly freeze on the membrane surface. Pinholes readily develop on the membrane surface, adversely impacting the performance of the MEA. As a result, the PFSA membrane needs to be at the right temperature for it to conduct and absorb water. 2.4 Effect of GDL on MEA efficiency GDL typically comprises a substrate layer and an MPL. It is applied to the hydrophobically modified substrate layer [81]. In MEAs, the MPL is in direct contact with the CL, while the substrate layer interfaces with the external bipolar plate (BPP) [82]. The GDL's role in the MEA is to offer robust mechanical support and corrosion resistance to safeguard the CL and ensure excellent interfacial contact with the CL and BPP, and smooth flow transmission channels (like heat, electricity, and water) [83]. The GDL is used to effectively transmit electrons between the BPP and CL during the operation of an FC, while the CL's heat is passed onto the BPP through the GDL. Consequently, the GDL primarily fulfills the essential roles of transmitting electricity and heat, as well as conveying reaction gasses. Proper hydrophilicity is necessary for the GDL at the anode to provide enough water for the membrane and ionomer to facilitate proton conduction. Nonetheless, the cathode reaction generates a substantial quantity of water (particularly in intensive operational situations), a portion of which migrates by the PEM to the anode, whereas the remainder must be effectively expelled by the GDL to the flow regions [84]. Flooding at the cathode can cause many issues due to inadequate exhaust. Water management differs between the cathode and anode sides. Thus, the hydrophobicity of the GDL located on the cathode must be higher than that located near the anode [85]. GDLs on both sides must show an appropriate porosity, pore distribution, and pore architecture to facilitate the ingress of liquid water from CL into GDL [86]. Optimizing MPLs is widely recognized as an effective method for enhancing water management [87]. MPL lowers the contact resistance between the CL and GDL, limits catalyst ink from getting into the GDL, and prevents the loss of active material. The optimization and enhancement of MPLs now focus on (i) the thickness of MPLs [88]; (ii) the pore distribution and porosity [89]; (iii) modifications of MPLs that are either hydrophobic or hydrophilic [90,91]; (iv) MPLs that contain multiple layers of hydrophilic and hydrophobic material [92]; and (v) structures modifications (such as cracks and perforations that serve as the pathway for liquid water to reach the substrate layer, etc.) [93]. If you want to optimize the GDL's water management performance, perforating it can also be a useful optimization strategy. This process breaks down the hydrophobic layer, allowing some hydrophilic pores to enter the diffusion channels surrounding the water channels. This method improves the GDL's wettability and removes liquid water at the same time, resulting in improved water management and MEA performance [94]. 2.5 Working principle of PEMFC H2 is directed through the catalyst into the FC at the anode under pressure. Upon encountering the Pt on the catalyst, the H2 molecule undergoes a split into two entities: protons or H+ ions and electrons (e−). The transmission of electrons is from the anode, passes by using the exterior circuit, and then returns to the cathode. Concurrently, O2 is compelled through the catalyst at the cathode, leading to the formation of two O2 atoms. Atoms of O2 possess a potent negative charge, which draws H+ ions towards them across the membrane. This interaction results in the formation of a water molecule (H2O). These reactions occur within a cell stack, which is integrated into a unit that includes water, air management, fuel, and coolant control software and hardware. This unit is then incorporated into a complete system suitable for various technological applications. Due to the FCs' high efficiency (55%), this remarkable technology finds utility in diverse applications like transportation (buses, cars, forklifts, vehicles, etc.) and backup power generation during electricity network failures. 2.6 Working mechanism of the ORR The operational mechanism of the ORR is contingent upon various factors, including intermediates involved in the reaction pathway. A comprehensive examination has been conducted regarding ORR catalysts, encompassing nanostructures, catalytic activity, and stability. Presently, ORR stands as one of the most pivotal challenges in electrocatalysis, serving as an indispensable cathodic process in FCs [95–97]. Additionally, the production of four O–H bonds and the breaking of double bonds are both components of the complex four-electron reaction pathway, which includes essential steps and transitional species [98,99]. Several researches have investigated the rate of the ORR in an acidic environment utilizing nanostructures made of Pt supported on carbon. Some research endeavors have primarily concentrated on optimizing the O2 cathode structure and electrochemical efficiency. Theoretical assessments and computations enhance experimental results and assist the acquisition of kinetic parameters. Research is scarce on the ORR mechanism, specifically on nanostructures made of Pt. Therefore, the mechanism is deduced but not definitively explained. Despite extensive and rigorous experimental and theoretical investigation spanning several decades, the specific mechanism of the ORR remains unknown. This lack of clarity is attributed to several factors. Firstly, current experimental systems lack proficiency in detecting all potential reaction intermediates within a complex process. Furthermore, the reaction takes place in an area with a large over-potential, and the activation zone is limited to the beginning of the wave alone. This leads to the swift emergence of the transport-controlled region, limiting the potential range for a true analysis of the electron transfer mechanism. Therefore, it is crucial to employ innovative experimental approaches and theoretical computations to elucidate the features and processes associated with ORR electrocatalysis. 2.7 Characteristics of ORR EC in half-cell testing systems The evaluation of the industrial and practical potential of ORR EC is considered sophisticated when using the MEA to determine power density. However, doing thorough evaluations of ORR catalysts using the MEA approach requires significant work in creating exceptional membrane electrodes, resulting in a time-consuming and not particularly efficient process for future research. A fundamental half-cell electrochemical assessment method was developed and implemented to investigate electrochemical performance. This method utilizes a rotating ring disk electrode (RRDE) and rotating disk electrode (RDE) to achieve high-speed rotation of the disk electrode, reaching around 1600 revolutions per minute (r min−1). This rotation efficiently facilitates mass transfer through a stable limiting current. The glassy carbon electrode (GCE) is coated with a thin and even film of catalytic material, which facilitates laminar flow when rotated and decreases resistance to the transfer of mass through the Nafion layer. To precisely evaluate the kinetics of ORR by polarization plots, it is necessary to create ultrathin and uniform catalytic coatings on the glassy carbon rotating disk electrode (GC RDE). RDEs and RRDEs serve as effective techniques for exploring the kinetics of intricate charge transfer processes, encompassing both chemical-charge exchange and multistep charge exchange. To understand the proposed mechanism and kinetics involved in the ORR, it is essential to generate intermediate species. The outcome is contingent upon the quantity of electrons engaged and the electrolyte pH. The number of intermediates has a direct impact on the overall efficiency of the electrode, subsequently influencing the performance of the fuel cell. An RRDE, recognized for its sensitivity and direct measurement capabilities, was employed to assess the levels of H2O2 in an acidic environment and HO2 − in a basic electrolyte. The symbols of J R and J D are referred to as the ring and the disc current, respectively, and then shown as a function of the disc potential. The RRDE-LSV evaluation is performed by maintaining the ring potential at 1.2 V vs. a reversible hydrogen electrode (RHE). The significant potential ensures that any intermediates (H2O2) are thoroughly oxidized, but diffusion could limit the peroxide oxidation. The centrifugal flow generated by the electrode rotation facilitates the movement of intermediates towards the ring surface. The generation of H2O2 or HO2 − and the number of electrons transferred in the ORR path, influenced via diffusion control, can be approximated via the formulas provided that follow. The formulae are derived from the values of ring and disc currents [100]. (1) n = 4 × J D J D + J R N (2) N = - J R J D (3) H 2 O 2 % = 100 × 2 × J R N J D + J R N In this context, the abbreviation J D is used to represent the disc current density, J R is used to represent the ring current density, and N is used to represent the RRDE collecting efficiency. Eq. (1) introduced a connection between the J D and J R which can be used to ascertain the number of electrons transferred in ORR. This value is indicated by the letter n. In addition, the electron transfer number can be specified using the Koutechy-Levich (K-L) methodologies by following this procedure. (4) 1 J = 1 J K + 1 B ω 1 2 (5) B = 0.2 n F ( D 0 ) 2 3 v - 1 6 C The parameters used in these formulas include the following: ω denotes angular rotation, J indicates determined current density, J K refers to kinetic current density, and F describes the Faraday constant (F = 96,485 C mol−1). The diffusion coefficient (D 0) of oxygen molecules in the alkaline electrolyte is 1.9 × 10−5 cm2 s−1, with C 0 = 1.2 × 10−6 mol cm−3 as a bulk concentration. Kinematic viscosity is denoted by υ and has a value of 0.01 cm2 s−1. The rotary velocity is quantified in revolutions per minute (r min−1) utilizing a constant value of 0.2. 2.8 The electrode kinetics of ORR For the ORR, there is a multi-step process that involves a transfer of four electrons, during which bonds are broken and then reformed. The sequence of events in the process is unclear, as it is questionable if the initial step involves the O2 atom separation or if the steps of reduction occur before the breaking of the O–O bond. Some well-known scientists, including Griffith, Pauling, and Bridge, have postulated three distinct forms of O2 sorption to supply an answer to this topic. In the field of inorganic chemistry, these three bonding models are generally acknowledged, and it is thought that they occur for compounds based on platinum. According to the Griffith model, the O2 molecule interacts with a single substrate atom through a robust connection, particularly between the π and vacant dz 2 orbitals of the atoms on the metal surface [101]. The Pauling model delineates the process of “end-on adsorption by a single-type bond”, in which the electron density of the acceptor dz 2 orbitals is supplied by the π orbital of the O2 molecule [102]. On the other hand, the Bridge model clarifies the reaction that occurs between two robust connections with two distinct active sites for nanomaterials based on Pt, as suggested by the Yeager principle [103]. Electrical potential, precise temperature, and concentration all have an impact on the catalytic characteristics of clustered materials. Structural modifications to the electrolyte additives and electrode surface accelerate the electrode reaction. Since the start of the 20th century, the Sabatier principle has served as a conceptual foundation for our understanding of the most effective catalyst. The concept is that the most effective catalysts should form bonds with atoms and molecules of intermediate strength. This means that the bonds should not be too weak, since the catalyst has to activate the reactants. However, if the bonds are too strong, they could hinder the release of products and potentially contaminate the catalyst with strongly attached intermediates. This results in a correlation between activity and binding strength that resembles a volcano. A quantitative expression of the Sabatier principle may be established by considering the thermodynamics of individual reaction steps. In this formulation, the free energy of reaction steps that include intermediates bound to the catalyst will be influenced by the characteristics of the catalyst. In the quantitative version of the Sabatier principle, the optimal catalyst is the material in which every reaction step in the sequence is thermodynamically neutral or energetically favorable. In the context of electrochemical equilibrium, this means that every individual step in a reaction mechanism must have the same equilibrium potential as the overall equilibrium potential. Additionally, if the mechanism includes non-electrochemical stages, those steps must have no free reaction energy. The thermodynamic Sabatier approach identifies the “difficult” step in the process as the one that is thermodynamically least favorable if a condition cannot be satisfied. This phase is frequently, but not invariably, identical to the rate-determining step. This theory has proven highly effective in offering a broad qualitative comprehension of the reasons behind the existence of an optimal catalyst. As a heterogeneous catalysis theory, its lack of quantitative nature significantly limits its application. This suggests a lack of precision in forecasting, which prevents experimental testing. The appropriate measure to quantify the “bond strength” between the relevant intermediate and the catalyst, as well as the optimal value of this “bond strength” for the catalyst, remains uncertain. Due to these factors, the Sabatier principle is not applicable as a foundation for catalyst design guidelines. It is now much easier to find organized data on adsorption energies and activation energies in chemical processes that happen on metal surfaces thanks to the development of fast and accurate computational methods for electronic structure. Koper's group [104], has revived the Sabatier technique by integrating it with quantum-chemical calculations, specifically using density functional theory (DFT), for assessing the thermodynamics of the reaction stages in a catalytic mechanism. This methodology enables the “computational screening” of a vast array of catalysts and has demonstrated significant use in the logical advancement of novel catalysts. The method has gained significant popularity in the field of electrocatalysis and has been successfully used in all of the aforementioned electrode reactions. Nevertheless, the thermodynamic method has uncovered significant constraints on multi-step catalytic reactions that involve several intermediates. Specifically, these intermediates in a catalytic process exhibit energy interdependencies known as scaling relationships. The genesis of these scaling relationships may be traced back to the quantum-chemical theory of chemical bonding. The scaling relationships result in the inability to achieve the ideal catalyst, as specified before, due to the unfavorable universal scaling relation between the energies of two or more intermediates, which prevents all reaction steps from being thermodynamically neutral. Unfavorable scaling between the OOH and OH intermediates was discovered to occur for the ORR and oxygen evolution reaction (OER). Moreover, several investigations have been conducted on diverse charge transfer intermediate models on distinct surface types, along with the corresponding reactivity descriptors indicated below. The attention has been focused on two reactivity descriptors, the active metal site density (SD [molSite cm−2]) or (SDmass [Site gcat −1]) or (SDVol [Site cm−3]), and the catalytic turn-over frequency (TOF [s−1]) or [electron site−1 s−1], that is the electrons transferred per active site per second [105]. Enhancing one or both of these characteristics indicates high EC activity. The amalgamation of TOF and SD can be regarded as a meticulous evaluation of catalysts. There are several methods to estimate TOF, and it is crucial to understand how these estimations are made. A common method for measuring both SD, or better the gravimetric site density (SDmass [Site gcat −1]), and TOF denoted by the ex-situ low temperature (or cryo) CO chemisorption/desorption. SD can be determined using an electrochemical approach that relies on the adsorption of nitrite and the electrostripping of NO in situ. The two previously described in situ and ex-situ approaches allow for a precise calculation of the reactivity characteristics of PGM-free catalysts, yielding equivalent findings. Typically, TOF values obtained by CO chemisorption tend to be somewhat lower than those derived using nitrite stripping. This discrepancy may be caused by an overestimation of the associated standard deviation or the use of different approaches to compute the kinetic current in the two routes. Additionally, the disparity between the ability to access gas-phase (CO chemisorption) and electrochemical (nitrite reactivity) properties also contributes to the variation in results obtained when evaluating the standard deviation using in situ or ex-situ techniques. Matute et al. [106] investigated the process of electro-oxidation of thioglycolic acid using iron phthalocyanines and iron porphyrins (FeN4 complexes) that were applied onto regular pyrolytic graphite and MWCNTs. This study aims to determine the theoretical and experimental reactivity characteristics of MN4 macrocyclic complexes for thioglycolic acid electro-oxidation. Reactivity descriptors are primarily concerned with the metal center's capacity in the MN4 moiety to coordinate an additional ligand associated with the reacting molecule. The capability to coordinate, as shown via M-thioglycolic acid (M-TGA) binding energy, may be adjusted by manipulating the electron-donating capacity of the ligand (Fig. 3 a). This capability is directly connected to the Fe(III)/(II) redox potential of the complex linearly. The MN4 catalysts display volcano correlations (Fig. 3b and c) in the experimental graphs measuring their activity as (log j)E at a constant potential. The −0.3 V potential was selected to prevent the currents detected for the more active catalysts from being extrapolated excessively. FePs have Fe(III)/II) redox potentials that were lower than −0.3 V, and the number of Fe(II) active sites on the surface was very low at that point. It is evident from the red line that the electrode has the potential to highlight that the complexes situated to the left of the red lines are mostly Fe(III)OH. In Fig. 3(b), the slope of the Fe porphyrins groups was +0.134 V dec−1 (left-hand side of the volcano), while the slope of the Fe phthalocyanines groups was −0.223 V dec−1. The slopes associated with MWCNTs/ FeN4 (Fig. 3c) were +0.103 and −0.069 V dec−1. A semi-theoretical graph of catalytic activity (log j) E versus DFT-calculated Fe-thioglycolic acid binding energies (E bTGA) aligns with the experimental volcano-type correlations that characterize both weak and strong binding linear relationships of those volcanoes. Conversely, the Hirshfeld population test reveals a positive charge on the Fe center of the FeN4 complexes, suggesting that electron transfer takes place from thioglycolic acid to the Fe center in the FeN4 complexes, which function as electron acceptors. The intermolecular hardness Δη DA, which represents the donor (thioglycolic acid)-acceptor (Fe) interaction, was employed as a reactivity descriptor (Fig. 3d and e). It was shown that the reactivity of the Fe centers, as indicated by the rise in (log j)E, shows a linear correlation with the increase in Δη DA. When considering activity per active site, the pattern is completely different. Specifically, a graph of (log TOF) E grows linearly when Δη DA decreases, as anticipated by the Maximum Hardness Principle (Fig. 3f). There is a direct link between the standard redox potential (E°’Fe(III)/(II)) and the logarithm of turnover frequency (log TOF). This means that as the redox potential goes down, so does the activity per active site [106]. Luo et al. [107] reported an unexpected impact of non-specifically attached anions on the kinetics of the ORR on a Pt (111) electrode. These patterns did not align with the typical ORR indicator, which is the binding energy of *OH. They suggested a description that can be measured using voltammetry, namely the reversibility of the *O ↔ *OH transition. This description examined the correlation between ORR rates and the properties of the electrolyte, such as the concentration and type of anions in an acidic medium, the type of cations in an alkali medium, and the impact of ionomers. The researchers put up a model that establishes a connection between the pace of the ORR on Pt (111) and the rate at which the transition from oxygen (*O) to hydroxyl (*OH) occurs, together with the thermodynamic descriptor of the binding energy of *OH. Their model also explained why the ORR rate on Pt surfaces changed in different ways when the environment was acidic or alkaline. The redox potential of MN4 macrocyclic molecular catalysts with M n +/M( n −1)+ is a highly effective indicator of reactivity in various electrochemical reactions. An essential characteristic of this reactivity descriptor is that it can be empirically obtained using the same circumstances as the kinetic data, unlike other descriptors such as intermediate binding energies, which are calculated by the DFT technique. It appears that the two descriptors have a linear correlation. Graphs depicting activity as (log j) E at a constant E concerning the M n +/M( n −1)+ redox potential exhibit volcano correlations. The tuning of the M n +/M( n −1)+ redox potential of the MN4 catalyst is significant, and it can be achieved by modifying the macrocyclic complex structure and adjusting the electron-withdrawing capacity of the ligand to optimize activity. The redox potential was studied by Selva et al. [108] to measure the reactivity of cysteamine oxidation. They examined a range of substituted Fe phthalocyanines and Fe porphyrins that were adsorbed on GC and pyrolytic graphite under basic conditions. As anticipated, the Fe(II)/(I) redox potential of the various Fe phthalocyanines strongly influences the catalytic activity of these FeN4 species. The activity (log j)E curve vs. E° Fe(II/I) reveals a volcano-shaped correlation, indicating a formal potential magnitude that yields the highest activity. This suggests that the formal potential of the complexes serves as a universal reactivity descriptor for electrochemical reactions. Ficca et al. [109] examined the exchange current density as a useful indicator of the detrimental effects on active sites in EC without Pt group metals for ORR. The researchers suggested a technique for assessing the direct contact between probing molecules and the main and secondary sites that are devoid of precious group metals (PGM). Differentiating between these sites is crucial for a reliable evaluation of the technique known as SD. The findings revealed that the exchange current density is a valuable indicator for distinguishing the poisoning of particular active sites, whether they contain metal or are metal-free. Furthermore, it is crucial to comprehend the interaction phenomena that take place between sites and probing molecules. This understanding is essential for identifying contaminants that may selectively interact with the desired active sites. It will ultimately lead to a more precise evaluation of the system's structural dynamics. 2.9 Effect of basic environment in ORR Since the ORR is a facile and direct method, it provides opportunities to investigate alternative EC that are not dependent on platinum. This includes researching the use of MOs and substances based on carbon in basic environments. Despite this, the ORR capability of these ECs is not even close to being on par with what can be accomplished with platinum. Our objective is to develop new material designs and get a thorough comprehension of the surface structure attributes that impact the sorption energies of intermediates and the efficacy of ORR in PEMFCs. (I) Alkaline mediums possess distinct advantages relative to their acidic counterparts. The electrocatalytic process, characterized by the ORR at the cathode and methanol oxidation at the anode, demonstrates greater efficiency in alkaline solutions than in acidic conditions. (II) Alkaline conditions present an opportunity to utilize economical EC composed of (i) supported groups of precious or non-precious metals and (ii) organometallic and inorganic complexes. (III) The flow of liquid fuel, like methanol, is opposed by the transport of OH− ions and the consequent electro-osmotic drag of H2O, which diminishes the likelihood of crossover problems and the reduction of cathodic overpotential. (IV) Improved water management and a decrease in flooding at the cathode can be achieved by balancing water consumption and production at the cathode. (V) Higher pH values safeguard the ionomer membrane from peroxide radicals, facilitating the use of hydrocarbon-based membranes and eliminating the necessity for costly fluorinated polymers. (VI) Liquid electrolytes are prevented from forming carbonate precipitation by using metal-cation-free hydroxyl ion exchange membranes. (VII) Alkaline fuel cells (AFCs) offer a wider variety of fuel choices, like ammonia, ethanol, formic acid, oxalic acid, petrol, and xylitol, alongside the more commonly used hydrogen and methanol in acidic media. The alkaline medium facilitates enhanced cleavage of C–C bonds. The AFCs exhibit distinctive characteristics as a result of the alkaline environment present within the cell. It is important to note the impact on reaction rates at the cathode and anode. In an AFC, the cathode demonstrates superior OER and ORR rates compared to an acidic cell. The high alkali conditions present in the AFC account for this phenomenon. To achieve acceptable cell voltages, Pt catalysts often are needed to address slow rates of OER and ORR in PEMFC. However, this raises the total expense associated with the cell. The elevated rates of OER and ORR in an AFC diminish the necessity for Pt catalysts. This enables the utilization of non-PGMs at the cathode, in conjunction with a diverse array of cost-effective polymers and carbon supports that demonstrate outstanding stability. In contrast, the rate of the HOR and hydrogen evolution reactions (HER) at the anode is significantly reduced in alkaline media when compared to acidic environments. The challenge of HOR stems from the necessity to maintain a metal surface predominantly devoid of oxides at an anode potential of 0.1 V relative to the reversible RHE, and ideally at even greater levels. This is crucial for connecting with hydrogen sorption intermediates in the relevant potential range. The development of appropriate catalysts for hydrogen reactions in PEMFCs presents a significant challenge, especially concerning non-PGM catalysts. It is widely recognized that ORR takes place readily in an alkali media. The alteration in thermodynamics takes place as the pH of the solution increases, leading to a related shift in the potential difference. The potential difference is measured at 1.2 V in an acidic solution and 0.4 V in an alkali solution. A rise in surface-free energy is caused by the decrease in potential variation, which ultimately leads to decreased free energy and increased sorption of oxygen and its intermediates. Nonetheless, a restricted selection of catalysts, like Pt in acidic conditions, exhibit a considerable level of O2 adsorption-free energy, allowing for efficient surface binding and promoting the occurrence of ORR. On the other hand, alkali solution promotes surface reactions, allowing for the utilization of catalysts beyond Pt in the oxygen reduction reaction. Additional catalysts employed in the ORR encompass Pt-metal-based catalysts (PGM), including Pt alloys, alongside PGM-free EC made up of noble metals not derived from PGMs, transition metal oxides (TMOs), and carbon-based catalysts. The ORR generally occurs in alkali conditions and adheres to one of two primary mechanisms: (i) 4-electron pathways, in which each O2 molecule is completely reduced to hydroxide (Eq. (6)), or (ii) a mechanism that reduces each O2 molecule to a hydrogen peroxide anion (HO2 −) through 2-electron pathways (Eq. (7)), which is then further reduced to hydroxide via an additional 2-electron pathway (Eq. (8)). (6) Direct: O2 + 2H2O + 4e− → 4OH− E 0 = 0.401 V vs. SHE (7) Series: O2 + H2O + 2e− → HO2 − + OH− E0 = −0.65 V vs. SHE (8) HO2 − + H2O + 2e− → 3OH− E 0 = 0.867 V vs. SHE The ORR's performance can be assessed by evaluating the electron transfer number (n). A significant quantity of n leads to the exclusive generation of H2O as the only byproduct (as shown in Eq. (6)), with no formation of H2O2, thus protecting the PEMFC from degradation. 2.10 Effect of acidic environment in ORR EC composed of noble metals has shown remarkable effectiveness and long-lasting performance for use in commercial applications. Current studies have focused heavily on methods to improve the effectiveness of ORR in nanocatalysts by significantly decreasing the amount of Pt used in electrocatalytic materials. Different techniques are used to produce hybrid materials to maximize surface area and enhance interactions with intermediate species involved in the ORR. However, the ORR activity of carbon EC and MOs is lower than that of Pt-based materials. Scientists are devoting significant effort to comprehensively understanding the surfaces of nanostructures, as this has a substantial impact on intermediate sorption energies and determines the overall effectiveness of the ORR. Protons and electrons transfer simultaneously during the complex ORR process. This process may proceed via two distinct reaction pathways: the 2-electron pathways and the 4-electron pathways, which compete with one another. The chemical processes under acidic conditions are delineated by Eqs. (9)–(11) and are shown in Fig. 4 [110]. (9) Direct: O2 + 4H+ + 4e− → 2 H2O E 0 = 1.230 V vs. SHE (10) Series: O2 + 2H+ + 2e− → H2O2 E 0 = 0.695 V vs. SHE (11) H2O2 + 2H+ + 2e− → 2 H2O E 0 = 1.763 V vs. SHE The electrochemical technique provides a renewable, accurate, and safe way to produce H2O2. Typically, the electrosynthesis of H2O2 encompasses two potential reaction pathways. Two different paths exist: the 2-electron ORR (2e−-ORR) and the 2-electron water oxidation reaction (2e−-WOR). Nonetheless, the application of 2e−-WOR faces challenges for large-scale deployment because of the tendency of H2O2 to undergo rapid oxidation. The 2e−-ORR method consistently produces H2O2 with remarkable purity and concentration, yielding only water as a by-product. Although the ORR can produce H2O2 across acidic, alkaline, and neutral environments, the generation of H2O2 in acidic conditions presents certain advantages over alkaline or neutral scenarios. It is important to highlight that H2O2 demonstrates enhanced chemical durability in acidic conditions against alkaline and neutral conditions. This trait significantly obstructs its natural breakdown. Moreover, the advanced PEM device demonstrates the capability to efficiently utilize H2O2 electrosynthesis in acidic conditions, highlighting outstanding ionic conductivity and impressive durability. Additionally, the presence of H2O2 in acidic conditions broadens its potential applications across various industrial processes. Nonetheless, the thermodynamics of H2O2 in the ORR presents challenges. Consequently, it is essential to design and fabricate EC that exhibit great selectivity, low overpotential, and stable efficiency to promote the generation of H2O2 in acidic environments via a 2e−-ORR pathway. 2.11 The design principles of multiphase interfaces during ORR Electrochemical reactions happen at the triple phase boundary (TPB), which is the line where the proton-conducting electrolyte (liquid phase), gas (gas phase), and catalytic active sites (solid phase) meet. Enhancing the ORR catalyst and optimizing hydrogen fuel cell operations can facilitate the formation of additional TPB. The ORR necessitates a semi-hydrophobic environment that optimizes the catalyst's access to oxygen and the aqueous electrolyte. A commercial carbon-based GDL containing a backing layer that is completely hydrophobic and overlaid with a microporous layer that has fine porosity for catalyst loading. The multiphase interface is established by passivating the surface of porous carbon in the GDL microporous layer with oxygen carboxyl and carbonyl functional groups. These functional groups create ORR active sites on the carbon surface and augment the hydrophilicity of the layer. The functionalized area of the GDL creates a semi-hydrophobic catalyst layer (SCL) on the electrolyte-facing side, where the number of active centers and hydrophobicity can be adjusted. In CL design, meticulous regulation of ionomer concentration and distribution is essential to improve proton conductivity and the accessibility of active sites. In addition to CL design, the TPB is affected by PEMFC operation, with factors like flooding, degradation, load cycling, and dehydration potentially altering the TPB area. Analyzing and elucidating the properties of TPB is essential for enhancing the FC performance. Due to the utilization of a solid electrolyte in PEMFCs, the sulfonic groups are anchored to the resin of the PEM, inhibiting penetration into the electrode. Consequently, the TPB is confined to the reaction layer in contact with the PEM. Only the CL and PEM can efficiently conduct protons, requiring the formation of ion channels inside the CL. Furthermore, gaseous reactants must access the catalyst surface, and the produced water must evacuate rapidly, necessitating hydrophobic pathways inside the catalyst layer. The inclusion of ionomers in the CL might fill certain pores; thus, optimizing the ionomer content and distribution is essential for proton conduction and oxygen transport. An optimal catalyst layer must possess a superior electrochemical triple-phase boundary reaction area to facilitate the effective transfer of protons, electrons, water, and oxygen. The efficiency of FCs can be enhanced by increasing TPB, which can also speed up reaction rates and improve electron and ion transport efficiency. Comprehending and enhancing sorption and kinetic reaction at the triple phase boundary is crucial for developing more effective catalysts. Accelerated adsorption and reaction rates facilitate swifter fuel cell activation. The TPB, where the catalyst, pores, and ionomer converge, is crucial for the reaction, particularly with the optimization of the catalyst layer structure, including pore size and tortuosity. The pore architecture of the CL may restrict oxygen diffusion. The TPB demonstrates a significant rise in porosity in a low-porosity environment. Achieving the appropriate TPB density at intermediate porosity depends on balancing the surface area across the three phases, rather than solely focusing on the volume fraction. The TPBs begin to decline upon achieving the ideal TPB density within the high porosity regime. The membrane and active areas inside the CL are crucial to TPB. The PFSA ionomer utilized in membranes, with thickness contingent upon substrate material, ionomer concentration, and solvents, serves as the foundation for the CL ionomer. The weight and side chain length affect the elevated proton conductivity and the adequate gas permeability for oxygen transport to the catalyst sites. Reduced weight and abbreviated side chains result in increased water absorption owing to enhanced hydrophilic channels and elevated micropore volume. The precise regulation of the TPB is crucial for fuel cell performance because (i) adequate water content at the cathode is necessary for effective membrane wetting and proton diffusion; (ii) humidified H2 and O2 gases must readily reach the catalytic site to prevent MEA desiccation, which impedes proton migration in the TPB and diminishes catalytic activity; (iii) the hot-pressing process during MEA fabrication is essential for optimal assembly, ensuring physical contact among the GDL, CL, and PEM, which facilitate both electron and proton conductivities. TPB is essential in ORR. Indeed, ORR transpires within TPB. Enhancing TPB can improve the interaction among the catalyst, electrolyte, and gas phases, therefore augmenting catalytic activity and activation rate. 2.12 Theoretical methodologies for investigating the potential of new ORR EC DFT is the most often applied technique in quantum mechanics for studying new EC at the molecular level. It has opened up new possibilities for systematically designing EC for the ORR [111,112]. DFT's popularity stems from the commendable balance it achieves between calculation accuracy and computational resources utilized in simulations. Computational design has the advantage of concentrating on qualities and interactions when working with ideal structures, although it is still impossible to achieve a thorough description of all of the atoms that are contained within a solid or particle. As a consequence of this, it is vital to apply a technique that restricts the amount of explicitly handled atoms in computations to fully exploit the potential of computational design. At the moment, two ways have been proven to be effective in modeling EC and the ORR. These are the slab method and the cluster method [113–116]. Cluster approach: NPs are represented in the cluster model using a specific number of atoms, and the computational cost is determined by the number of atoms in the cluster. This methodology provides the most optimal criterion for investigating tiny NPs or QDs with sizes ranging from 1 to 2 nm since it allows for the analysis of the edge effects shown by these nanostructures. Choosing the cluster structure for the ORR assessment can be done using two relevant methods. In the initial scenario, the ORR is assessed based on the cluster's most stable configuration. The alternative scenario suggests a configuration characterized by distinct geometric forms, including octahedrons, icosahedrons, and cubes. Slab approach: In the slab model, a solid surface is depicted by periodic boundary constraints and a finite number of atoms. The dimensions of the surface unit cell determine the computational cost of the simulation. This widely used approach explains extended surfaces or nanoparticle surfaces of different nanometer sizes (greater than 2 nm). 2.13 Theoretical prediction of the ORR's electrocatalytic performance The DFT technique creates a crucial understanding of the surface mechanisms involved in EC for the ORR. Bridging the gap between theoretical studies and experimental results poses a primary challenge. Several theoretical indicators have been suggested to establish the connection between electrocatalytic activity for ORR. Essentially, theoretical predictors provide pertinent details about electrocatalytic characteristics or important factors for the ORR. Therefore, this section primarily focuses on the theoretical descriptors that are frequently applied to characterize the electrocatalytic activity of the ORR. Therefore, the researchers undertook a more comprehensive investigation into these descriptors from a more in-depth perspective [117–119]. The Pt/C EC, extensively utilized and studied for the ORR, serves as a benchmark against which the electrocatalytic properties of newly developed EC, whether derived experimentally or through theoretical investigations, are evaluated [120–122]. One of the first methods that may be used in the theoretical investigation of electrocatalysts is the adsorption energy of the ORR intermediates. A volcano-like pattern may be seen in the relationship between the electrocatalytic activity of platinum and other transition metals and the oxygen adsorption energy (OAE) of these elements. Within the category of pure metals, the volcano diagram demonstrates that Pt is the most effective EC. On the other hand, it was discovered that pure Pt acts as an electrocatalyst that is not ideal. The fact that the adsorption energy is affected by the electrical characteristics of the EC is a well-known fact. Consequently, the “d-band theory” was introduced to establish a relationship between electronic characteristics and electrocatalytic activities. The primary framework of this theory is that the adsorption energy of the species on the electrocatalyst surface is contingent upon the electronic structure of the surface. The adsorption energy of reaction intermediates and d-band theory create significant insights into the efficacy of an ORR EC. Nonetheless, the free energy diagram (FED) serves as a tertiary technique that offers more comprehensive insights into the possibility of spontaneous reactions and the rate-determining step (RDS). The adsorption energy of ORR intermediates may be calculated to generate the FED. For a better understanding of the theoretical prediction of the ORR's electrocatalytic performance, Fig. 5 was provided [123]. 2.14 Electrocatalytic activity experimental factors for the ORR The theoretical assessment of EC has led to the proposal of many different markers of electrocatalytic activity. Concurrently, in experimental assessments, the electrocatalytic performances of new EC are directly measured against established benchmarks, such as mercantile Pt/C EC. Typically, two approaches are used to evaluate the electrocatalytic efficiency of the ORR: (I) utilizing a thin-film RDE; (II) evaluating the performance of an MEA in a single cell. Both methods are appropriate for assessing the electrocatalytic activities of ORR. However, RDE is preferred due to its quicker determination of electrocatalytic activity with minimal equipment requirements. The analysis and quantification of ORR EC performances typically involve parameters such as (I) mass activity; (II) specific activity; (III) electrochemical surface area (ECSA). The ECSA is an empirical factor that is essential for determining specific activity. It allows for the comparison of the active area per unit mass of noble metals in the EC. The charge density resulting from the adsorption/desorption of probe species (such as CO, Cu, and H) measured using cyclic voltammetry is frequently used to determine the ECSAs of different EC based on Pt. Specific activity refers to the measurement of the size of PEMFCs needed to produce a specified value of electric current. This is determined by normalizing the kinetic currents via the ECSA. Mass activity is a measure of the efficiency of an EC, specifically in the context of examining new EC for the ORR. It is computed by dividing the kinetic currents by the amount of EC loaded onto the electrode. The calculation of ECSA, mass, and specific activity follows established protocols available in the literature [124]. In-situ characterization is assuming an increasingly significant role in the domain of electrocatalysis. The real-time measurement of catalysts, reactants, and reaction intermediates elucidates the dynamic process of ORR, hence facilitating a precise comprehension of the catalytic mechanism [125]. The ORR process is complex and involves many electrons. By integrating two or more in situ technologies, a more thorough understanding of the response process may be obtained. For example, using in situ infrared spectroscopy, Raman spectroscopy, and X-ray absorption spectroscopy, it is possible to get chemical information that is specific to the surface. This includes information on the local coordination environment, as well as the structure and oxidation state of the electrocatalyst while the catalysis process is taking place. In situ scanning tunneling microscopy (STM) can offer insights into the changes that occur in adsorbed species during the ORR. Wang et al. [126] used the STM technique to look at how O2 attaches to and decreases the amount of cobalt porphyrin (CoOEP) and phthalocyanine (CoPc). Electrochemical tests demonstrated that CoOEP exhibited greater oxygen reduction reaction (ORR) activity compared to CoPc. Monolayers of self-assembled CoOEP and CoPc were created on Au (111) substrates and then examined at the molecular level using STM. The molecular imaging directly demonstrated that O2 adsorbed on CoII sites and only to a small extent on CoIII sites. The CoOEP-O2 and CoPc-O2 complexes displayed significant disparity in STM images as a result of O2 binding. The surface coverage of CoOEP-O2 was approximately 1.4 times greater than that of CoPc-O2. The quantitative measurement of O2 adsorption dynamics was achieved by fitting data from potential step experiments. This allowed for the determination of rate constants for O2 adsorption (k ad) and dissociation (k di) on Co centers. The CoOEP compound exhibited larger levels of k ad and k di compared to CoPc, suggesting increased O2 binding kinetics and reduced barriers to Co–O dissociation on CoOEP. By integrating theoretical calculations, one may achieve a more thorough comprehension of the fundamental process and a more profound insight into the response mechanism. An increasingly crucial element in in situ characterization is the advancement of technology that allows for both time-resolved and spatially-resolved measurements. Employing advanced techniques that offer both high temporal and spatial resolution enables the examination of catalytic reaction processes. This allows for the identification of transient intermediates, the determination of rate-limiting steps, the establishment of the catalyst's mechanism, and the elucidation of the reaction pathway. For instance, it is possible to use video-STM with atomic spatial resolution and millisecond temporal resolution in an aqueous solution to uncover the diffusion behavior of the adsorbent on the electrode surface during electrocatalysis at the atomic level. XAS can monitor rapid advancements in catalytic reactions. There are documented instances when synchrotron-based XAS has effectively tracked the catalyst process kinetics over a time period of hundreds of picoseconds [127]. Jiang et al. [128] investigated the occurrence of molecular oxygen activation during intermetallic spacing-optimized iron network-like sites to improve the ORR. In-situ soft XAS and in-situ synchrotron infrared characterizations showed that the optimized intermetallic distances in Fe-HDNSs could activate molecular oxygen in situ by quickly compensating for electrons through the hybridized Fe 3d–O 2p. This process effectively facilitated the breaking of the OO bond to form *O species and greatly reduced side reactions, resulting in faster kinetics for the 4e− ORR. Consequently, the Fe-HDNS catalyst, which was constructed correctly, demonstrated exceptional performance. It achieved a half-wave potential (E 1/2) of 0.89 V against. RHE and a kinetic current density of 72 mA cm−2@0.80 V vs. RHE. These results surpassed the majority of ORR catalysts that do not contain noble metals. XAS is a robust technique that forms the foundation for two distinct approaches, namely X-ray absorption near edge structure (XANES) and extended X-ray absorption fine structure (EXAFS). XANES spectroscopy offers insights into the electrical configuration of both single and dual metal atoms, whereas EXAFS spectroscopy is employed to uncover details about their coordination environment, consisting of the identity of coordinated atoms, the quantity of coordination, and the length of the bonds. Furthermore, XANES has the capability to offer more intricate insights into the electronic configurations of coordinated atoms, their levels of oxidation, and their spatial configurations [129]. Schröder et al. [130] employed XANES to follow the valence shifts of Mn in an appealing, super-thin, porous MnO x layer on an Ag-thin film. Studies of the Mn-K edge were conducted to examine the effect of the electrochemical environment and ORR conditions. Surprisingly, it was observed that when the ORR was driven at 0.8 VRHE, the Mn underwent a more significant reduction, and the MnO x redox was found to be nonreversible, which differed from studies in an electrolyte saturated with N2. Further, the catalyst surface's reactivity map may be acquired by the usage of SECM. The size of the tip determines the spatial resolution of SECM, which has seen substantial enhancements in recent times. Putnam et al. [131] employed operand SECM to investigate the generation of radicals by a commercially available pyrolyzed Fe-N-C catalyst in real-time, utilizing a redox-active spin trap technique. The SECM experiment demonstrated the consistent generation of OH·, which correlated with the ORR performance. Their findings were extensively supported by electron spin resonance confirmation, which demonstrated that the hydroxyl radical is the primary radical species generated. In addition, the creation of OH· and H2O2 exhibited different patterns. The formation of reactive oxygen species (ROS) decreased as the catalyst degraded, indicating a correlation between ROS production and the catalytic activity of the sample. The investigation of the structural sources of ROS production was conducted using model systems, namely iron phthalocyanine (FePc) and Fe3O4 NPs. Both of these systems exhibited substantial creation of hydroxyl radicals (OH∙) during the ORR. The results offered a thorough understanding of the important, yet insufficiently researched, factors related to the creation and impact of ROS on electrocatalytic systems. This has paved the way for a more in-depth analysis of the mechanisms and kinetics employed by SECM. The recently developed scanning electrochemical cell microscopy (SECCM) approach allows for the precise investigation of the catalytic process of ORR in platinum clusters and NPs. This method provides very detailed spatial information and may effectively expose the catalytic activity [132]. The dissolution of Au NPs placed on glassy carbon was investigated by Bernal et al. [133] using a combination of SECCM and EC-TEM. The work was conducted under both potentiostatic and potentiodynamic conditions, by electrolytes consisting of acidified NaCl and H2SO4. By this integrated methodology, they gained valuable insights into the impact of chloride ion presence or absence on electro-dissolution processes. Chronoamperometric experiments using SECCM in the electrolyte containing Cl− ions showed clear and separate current peak events occurring in the dissolution process. These occurrences were ascribed to the delayed dissolution of individual NPs after the quick collapse of the protective layer that forms in the early stages of anodic polarization. This breakdown exposes the metallic gold core to Cl− ions. The statistical examination of these peak occurrences revealed correlations between the applied potential and the temporal distribution of the peak descriptors. The charge expended in each occurrence was examined, revealing that NPs experience partial disintegration followed by rapid re-passivation. The rise in potential led to an increase in the current at its peak and a reduction in the length of these peak occurrences. This may be attributed to the enhanced process of dissolution and faster re-passivation. The initiation time of the highest occurrences had a significantly random characteristic. In-situ EC-TEM test confirmed the findings, showing that the Au NPs dissolve individually at various time intervals and stages, revealing a core–shell structure in the dissolution process. Due to its higher resistance, the shell undergoes prolonged disintegration, occurring particle by particle, once it breaks down. Another significant emerging trend in in-situ characterization is the integration of several in-situ approaches to analyze the electrocatalytic process from many perspectives. For example, the integration of STM and spectroscopic methods offers a thorough analysis for determining the chemical and structural properties of the electrocatalytic system. Tip-enhanced Raman spectroscopy (TERS) merges the superior spatial resolution of STM with the chemical discriminating capabilities of RS. Electrochemical ETRS (EC-TERS) may be used in a water-based solution to directly investigate the correlation between the structure and EC activity. Su et al. [134] employed EC-TERS to examine the atomic site-specific electronic characteristics of Pt adatoms with varying coordination numbers. This analysis yielded valuable information on the connection between the electrocatalytic activity of Pt catalysts and the localized surface nanostructure. Moreover, the integration of STM and SECM allows for the acquisition of precise and localized data on the electrochemical behavior of the catalyst surface. Edmondson et al. [135] have successfully implemented conductance and electron tunneling SECM on the surface of gold nanocrystal electrodes. It is possible to simultaneously map both the surface features of the substrate and its electrochemical activity. Fe Mossbauer spectroscopy is a very accurate method to assess the coordination state, electron spin states, and electronic surroundings of iron species in EC. It can identify variations in the energy levels of Fe nuclei and differentiate between Fe species that have comparable coordination settings. Identifying the active centers and electrocatalytic intermediates is very advantageous. Wang et al. [136] employed Fe Mossbauer spectroscopy to differentiate between various Fe types. The SA-FeIII/SNPC profile (Fig. 6 a) was successfully modeled using two doublets, corresponding to FeN x groups with Fe (III) in high-spin (D1) and low-spin (D2) sites, respectively. The lack of singlet and sextet peaks, which correspond to α-Fe and γ-Fe, respectively, indicates the absence of any crystalline phase of iron metal in SA-FeIII/SNPC. The spectrum of Fe/NPCHT2 exhibited three distinct kinds of FeN x sites, namely D3, D2, and D1 (Fig. 6b). The presence of D3 suggests that iron occurs in both the +2 and +3 oxidation states in the Fe/NPC-HT2 catalyst. Consequently, the presence of the embedded S atom adjusts the distribution of electric charge in the Fe center due to the difference in electronegativity between S and C. The quantitative study revealed that SA-FeIII/SNPC has a proportion of 38.74% D1 species and 61.25% D2 species, which is substantially higher than the proportions of 23.20% and 39.95% found in Fe/NPC-HT2. Through the implementation of the S regulation, they have successfully observed the change in the valence state of Fe from +2 to +3. Additionally, they have demonstrated that the ORR efficiency of SA-FeIII/SNPC has substantially improved compared to that of Fe/NPC-HT2. Further, the mass-based site density (MSDD1) was determined based on the Mossbauer data (Fig. 6c). The Mossbauer spectrum provided the highest site density value for MSDD1. The SAFeIII/SNPC had an MSDD1 value that was almost twice as high (4.16 × 1021 sites g−1) as Fe/NPC-HT2 (2.49 × 1021 sites g−1), demonstrating that the inclusion of S effectively maintained the active site numbers. XAS studies were conducted to see and analyze the electronic and local structure of the central atom, iron. Fig. 6(d) displays the Fe K-edge XANES spectrum of SA-FeIII/SNPC, along with references such as Fe/NPC-HT2, Fe foil, FePc, FeS, and Fe2O3. The pre-edge seen at about 7114 eV is attributed to the symmetrical FeN4 square planarity, as shown in Fig. 6(d) inset. In SA-FeIII/SNPC, this pre-edge moved to higher energy due to the creation of an N–S bond in the second shell surrounding the Fe atom. More precisely, the absorption edge of SAFeIII/SNPC was found to be located between the absorption edges of Fe foil and Fe2O3. This displayed that the typical oxidation state of SAFeIII/SNPC falls between 0 and +3, which is consistent with the findings of Mossbauer spectroscopy [136]. In addition, it is clear that the oxidation state of Fe/NPC-HT2 was less positive compared to SA-FeIII/SNPC. This indicates that the presence of the S element enhances the electron transfer process between the carbon support and the Fe atom. The EXAFS spectrum (Fig. 6e indicates that there is no Fe–Fe scattering channel at 2.21 Å in SA-FeIII/SNPC, unlike in Fe foil. This suggests that the Fe atoms in SA-FeIII/SNPC are distributed at the atomic level. The SA-FeIII/SNPC compound had a dominant peak at 1.53 Å, which was somewhat greater than the Fe–N peaks (1.48 Å) in FePc but shorter than the Fe–S peaks (1.8 Å) in FeS. Consequently, it was hypothesized that the Fe atom in SA-FeIII/SNPC formed bonds with N/O rather than S, which aligned with the findings from the XPS S 2p analysis. In addition, they determined the coordination environment around Fe by analyzing EXAFS spectra, as seen in Fig. 6(g and h). In addition, a wavelet transform (WT) was conducted to differentiate the backscattering route. Fig. 6(f) demonstrates that SA-FeIII/SNPC exhibited a peak with a k value of 5.3 for the Fe-N pathway, which was distinguishable from the Fe–O (Fe2O3, 8 Å−1) and Fe–Fe (Fe foil 8.3 Å−1) pathways. The XANES and Mossbauer spectra test both indicated an increase in the valence of Fe atoms due to the modulation of S. The aberration-corrected scanning transmission electron microscopy (AC-STEM) technique offers high resolution in the Angstrom range, making it a direct means to observe individual metal atoms on the carbon substrate, provided that there is a significant contrast in atomic numbers. The high-angle annular dark field-STEM (HAADF-STEM) study, which combines AC-STEM and HAADF, allows for the direct visualization of individual metal centers and even dual metal sites. HAADF-STEM can be used with electron energy loss spectroscopy (EELS) to provide further insights into the specific chemical composition and bonding characteristics of metal centers. This combination can aid in the understanding of the catalytic process. Overall, the in-situ characterization of ORR has shown significant advancements in recent years. As in situ technology advances, the research on electrocatalytic processes will provide more thrilling outcomes. 3 The impact of different parameters on catalytic performance 3.1 Morphology, size, and facet sensitivity of catalyst NPs The performance and stability of a catalyst in the ORR are influenced by its size, morphology, and facet sensitivity. Tuning the particle size, morphology, and active facet exposure can enhance the catalytic performance and stability. Studies suggest that reducing particle size improves electrocatalytic efficiency by elevating d-states to the Fermi level and narrowing the d-band [137,138]. The electrochemical ORR efficiency of EC tends to diminish as the size of NPs increases. The significant alteration in volume and clumping of NPs might lengthen the path of ion diffusion and impede the flow of electrons, resulting in a reduction in the ORR. Typically, the effectiveness of catalysts is heavily influenced by the size of the metal particles. Decreasing the diameters of particles can enhance the catalytic performance for many reasons. The process of dividing large quantities of materials into NPs exposes a significant number of previously internal atoms to the surfaces, where the catalytic reaction takes place. As the size of the NPs diminishes, the surface ratio increases. On the other hand, tiny particles are more prone to having dense, low-coordinated species like edges, steps, and kinks. These features are highly effective in attaining superior catalytic performance owing to their high surface-free energy. In addition, reducing the size improves the interactions between the metal and the support, perhaps causing a rearrangement of the electronic structure of the metal species and further enhancing the catalytic process. Hence, it is commonly acknowledged that decreasing the size is a highly effective method for improving atomic usage and catalytic activity. The nanoparticle catalyst's strong binding to the support and its large surface-to-volume ratio, due to its nano dimension, will increase the catalytic activity of the electrochemical reaction. Additionally, this binding will prevent the catalyst from detaching throughout the ORR tests and lengthy periods of fuel cell operations. Nanostructure design has a crucial role in determining the specific surface area and porosity of catalysts, which in turn significantly affects the activity of the ORR. Lee et al. observed that polycrystalline Au particles with a mean diameter of 8 nm displayed the best activity, attributed to structural defects, indicating that small size alone is insufficient for optimal activity [139]. In a separate investigation, Lee et al. discovered that Pd nanocubes measuring 48 nm had superior performance in a solution of methanol when compared with nanocubes of different dimensions, specifically those measuring 27 and 63 nm [140]. The activities of Pd, based on size, were arranged in the following order: 48 nm > 27 nm > 63 nm. Numerous research studies examine the impact of morphological characteristics on monometallic electrocatalysis, specifically comparing different shapes such as nanorods (NRs), nanowires (NWs), nanoparticles (NPs), nanocubes, nanobelts, nanospheres, nanoclusters (NCs), and flower-like structures. The morphology of an EC has a direct impact on the efficiency of mass/charge transfer and the overall number of catalytic active sites. Consequently, this morphology also influences the efficiency of the EC in terms of ORR. In catalyst applications, tiny NPs are often preferred because of their elevated specific surface area (SSA). Additionally, a larger ECSA and mass activity are anticipated at the same ratio. FC reactions are influenced by the structure of the crystal. Specifically, crystal facets such as (111) have a higher specific area activity compared to (100) or amorphous surfaces when it comes to the ORR. However, the reactions are less active at the edge and corner sites due to the exceptionally strong binding energy between oxygen and the surface. Particles of larger size exhibit a greater abundance of crystal facets compared to edge and corner sites, resulting in increased specific area activity. Nevertheless, the reduced ECSA leads to diminished mass activity achievable with smaller particles. The increased surface area of various ECs allows for a greater number of active sites to be exposed, therefore improving the movement of mass and electrons. This enhancement is advantageous for the performance of the ORR. Lu et al. produced Ag nanoclusters and NPs with succimer (DMSA) as a protective ligand, revealing higher specific activities for nanoclusters than NPs [141]. Erikson et al. demonstrated that Pd nanocubes outperformed bulk Pd material and nanospheres in onset, specific activity, and E 1/2. This was owing to the fact that the cubic forms possessed a greater number of active facets than the nanospheres [142]. Jin et al. utilized an electrochemical reduction technique to create Ag nanoclusters by employing single-stranded oligonucleotide sequences (ssDNA) as a template. The Ag NCs/NG composite displayed similar electrocatalytic efficiency and improved stability compared to the existing Pt/C EC. This can be attributable to the interactions among the Ag NCs, NG, and ssDNA [143]. Another crucial parameter is facet preference in ORR catalysis, with various monometallic EC showing varied facet sensitivities. This encourages adjustments to the EC synthesis to achieve more active facets. It is explained that facets, along with other sites such as edges and vertices, contribute to the overall coordination numbers, and facets with lower atomic coordination numbers allow long-term O2 binding. 3.2 Extended surface area of EC (ESAC) Extended surface area catalysts (ESACs) are characterized by large surface areas extended in two dimensions, resembling thin films. ESACs have significantly higher efficiency in the ORR than carbon-supported NP EC, particularly in acidic environments. This heightened performance is attributed to the distinctive electronic and structural features of thin films in comparison to other structures. Examples of ESACs can be included in several forms, such as single-crystalline bulk materials and polycrystalline catalyst surfaces. The significance of structural parameters such as shape, size, category, single-crystal surface alignment, and composition in affecting efficiency is highlighted by these catalysts, which serve as significant and useful model systems. Some advanced extended surface area alloy catalysts (ESAACs) reveal a textured surface featuring Pt atoms that encompass the typical bulk composition, alongside a highly coordinated “Pt-peel” that overlays a meticulously structured surface where the essential alignment of three layers varies with the bulk. The Pt-peel surface structure of Pt3Ni1 {111} and Pt3Co demonstrated a remarkable performance of 18 mA cm−2, about 3–4 times more than normal commercial Pt/C, as shown by rotating disk electrode (RDE) experiments. The order of ORR activities at 60 °C was “Pt-peel”> Pt3Co > Pt3Ni > Pt. The enhancement of electrocatalytic activity was more pronounced in HCl (0.1 M) compared to H2SO4 (0.5 M), with the peak enhancement seen for the “Pt-peel surface” on Pt3Co in HCl, which is 3–4 times superior compared to balk Pt. The configuration of Ni and Pt atoms in the top three layers of this system is influenced by variations in the d-band concerning the Fermi level of the outermost layer of Pt atoms. This configuration is anticipated to affect the sorption exposure of the hydroxyl group, thus affecting the activity of the ORR. However, there is a must to investigate how to get a viable electrocatalyst. Literature surveys indicate that nanostructured thin-film catalysts (NSTFCs) are viable electrocatalytic materials. 3.3 Metal-ion center The presence of a metal ion center has a substantial impact on the redox and electrical characteristics of TM material [144]. Among these, Fe and Co ions exhibit outstanding electrocatalytic characteristics because of their distinctive redox attributes. These active sites were recently recognized as highly effective for the ORR in PEMFCs, especially in basic environments. As a result, Co and Fe have been the main subjects of substantial research in the field of NNMEC techniques for ORR. The interaction between metals is crucial in regulating the efficiency of these materials in the ORR. Specifically, the high ionization potential of these metals is recognized as a crucial feature exerting a substantial influence on ORR performance. Notably, DFT models have revealed that Co porphyrin exhibits a significantly larger ionization potential compared to its Fe counterparts. Although the ionization potential of Fe is significantly larger than that of Co, it is important to evaluate the impact of ligands on characteristics and ORR efficiency. Typically, greater efficiency in ORR is linked to metal-ion centers that have larger ionization potentials and improved ability to bind with O2. 3.4 Nano-dimension of EC Nanocatalysts play a crucial role in advancing new energy resources, and the design of catalysts with specific unique structures is highly sought. Recent research has extensively explored various fabrication techniques for catalyst production. Efforts have also been directed towards enhancing the catalytic active site for the ORR, resulting in significant progress. However, achieving the required porosity is essential to provide a greater number of active sites and improve the ORR performance of the catalyst. Nanostructured materials hold significant importance in electrocatalysis, and current research in nanoscience and nanotechnology is particularly focused on EC fabrication. Research on doped carbon structures and porosity has become a vital part of catalyst design in the present day, to improve catalyst efficiency. Zhang et al. [145] fabricated controlled 2D WN nanosheets that are highly effective nano-EC for the ORR. In alkaline electrolytes, the EC activity of WN in ORR is influenced by the presence of potassium ions (K+). These ions played a crucial role in controlling the shape and size of nanostructures formed under the nitridation preparation and hydrothermal methods. Specifically, K+ promotes the formation of plate-like nanostructures of WO3 and two-dimensional sheets of WN. Furthermore, the WN sheets, which have been optimized to have a maximum number of exposed edge sites, provide a large number of electrocatalytic active sites that enable rapid charge conversion. Furthermore, these catalysts based on WN exhibit exceptional durability and resistance to methanol in ORR. Wang et al. [146] produced N and B co-doped carbon-based nanomaterial, which acts as a low-cost nano-electrocatalyst for ORR. Developing advanced and efficient synthesis methods for carbon nanostructures doped with both boron and nitrogen without the creation of direct covalent boron nitride is a captivating endeavor. The preparation of B and N-doped graphitic nanosheets was achieved using a straightforward process involving the utilization of iron forms. This technique allowed for the preservation of nitrogen content while simultaneously doping the B element. The resultant B and N-doped graphitic nanosheets exhibit a much higher onset potential compared to both B and N-doped graphitic carbon nanosheets individually. In addition, nanomaterials illustrate superior methanol tolerance and remarkable stability compared to commercial Pt-C EC. Kiani et al. [147] synthesized NiFe2O4 NPs with N-doped graphene to create a more efficient nano-EC for the ORR. The electrocatalytic performance of NiFe2O4 with an N-doped graphene nanohybrid is superior to that of pure NiFe2O4 and N-doped graphene. This nanohybrid promotes the desired direct 4e-reaction route during the ORR mechanism. The remarkable EC activity of the nanohybrid is attributed to the strong connection between the NiFe2O4 NPs and the N-doped graphene, as well as the network topology. 3.5 Current strategies for designing hierarchical porous structures The catalytic efficacy is contingent upon the properties of the active site and its accessibility to the reactant, which is predominantly affected by the substrate's microstructure. Hierarchical porous medium or porous material utilized as catalyst supports possess distinct attributes, such as elevated surface area, reduced density, and increased active site density. As opposed to solid substances, hierarchical porous architectures significantly enhance the specific surface area of catalysts, hence exposing active sites and promoting mass diffusion. The alteration of hierarchical porous structure can substantially influence or even change catalytic performance. Hierarchical pore structures are a category of functional nanomaterials characterized by cavities or voids of varying pore diameters contained within a specified shell. The hierarchical pore structure enhances the selectivity of catalytic processes by meticulously regulating pore size and the disparity between molecular sieve and nanopore diffusivity. Furthermore, a cascade reaction can be initiated by manipulating the spatial arrangement of the catalytic active site. Moreover, hierarchical porous architectures are often advantageous for enhancing mass transfer. They also enhance charge transfer, facilitating rapid reversible de-intercalation of ions and improving rate performance [148]. Furthermore, they can improve the structural integrity of the electrode material, thereby extending the cycle life of energy storage devices, as the extensive porous architecture and the interconnectivity of pores across various length scales can accommodate volume fluctuations as well as facilitate heat absorption and dissipation during operation [149,150]. Hierarchically structured porous substances featuring vascularized branch systems have a rich and diversified architecture resulting from the interplay of many organizational, structural, and geometric properties of pores across multiple length scales. The main thing to look at is the number of scale levels in hierarchically organized porous materials. If they are bimodal mesoporous, they can have two or three stages of pore sizes at a single scale level. If they are micro–macro, micro-meso, meso-macro, or even micro-meso-macro, they can have multiple levels of pore sizes that cover two or three-length scales. Secondly, it is acknowledged that hierarchically organized porous materials contain both bigger and smaller pores; hence, the dimensions and proportions of these pores constitute a critical design element. Moreover, pore morphology is a critical determinant, which might manifest as columnar with uniform lower and upper diameters, or as funnel-shaped with varying lower and upper diameters. Furthermore, these pores may exhibit either order or disorder. Their channels can exhibit either a centrally diverging direction or a vertical and parallel alignment. Consequently, the scientific and precise design methodologies for hierarchically organized porous materials are of paramount importance. 3.6 Construction of the hierarchically structured porous materials The templating techniques are the predominant ways for synthesizing materials with a porous hierarchy. The hierarchically organized porous medium created via templating techniques (consisting of hard and soft templating routes) possesses adjustable pore sizes and customizable pore geometries. Nevertheless, these solutions necessitate a post-template elimination step, which entails intricate procedures and demands additional resources and work. Template-free approaches, mostly associated with spontaneous formation phenomena and self-assembly processes, are considerably easier; yet, they provide challenges in control and make it arduous to forecast the shape and size of the pores owing to their inherent spontaneous nature. (1) Soft templating Soft templates often denote molecular systems characterized by variable organizational structures and restricted domain capabilities within a specific spatial range. (2) Surfactant templating A technique called surfactant templating makes a porous medium via multi-molecular aggregates (like vesicles, micelle, and liquid crystal) to guide the structure. These aggregates are made using surfactant molecules. This technique facilitates the synthesis of mesoporous materials featuring well-ordered channels and consistent pore dimensions. (3) Emulsion templating Emulsion templating relies on the characteristics of emulsions, utilizing the solidification or polymerization of the emulsion in the continuous phase to create materials with optimal porosity. This approach is straightforward and moderately gentle, suitable for producing hierarchically structured porous medium with meso- or macro-pore, as the size and distribution of emulsion particles may be regulated between 10 and 1000 nm. (4) Breath figure templating The breath figure (BF) route derives its name from a phenomenon in which water vapor condenses on cold surfaces, resulting in the formation of orderly, hexagonally distributed water droplets. This approach uses water droplets as templates. This is among the most efficient techniques for the large-scale production of two-dimensional organized porous structures. This method enables the utilization of star, block, and graft copolymers, alongside conjugated polymers and inorganic materials with rigid segments, to fabricate honeycomb-like ordered porous membranes with pore dimensions spanning from several hundred nm to several hundred μm. (5) Hard templating Hard templates are typically materials with somewhat inflexible structures that direct material growth by constraining spatial dimensions. In contrast to soft templating methods, hard templating techniques are more efficient in accurately regulating pore sizes owing to their robust spatial confinement effect; nonetheless, the removal of hard templates poses greater challenges. (6) Colloidal crystal templating Colloidal crystals become created through the self-assembled preparation of monodisperse microspheres with a 3D-opal structure. The colloidal crystal templating technique produces a three-dimensional ordered macroporous (3DOM) structure resembling an opal. By modifying the size of the microspheres in the templates, the dimensions of the pores can be easily changed as they are systematically organized. (7) Bio-templating The bio-templating technique employs natural biomass as a template, undergoing specialized treatment to preserve the structural integrity of biological heritage, resulting in porous materials with exacting structures. The intrinsic hierarchically porous architecture of biological materials confers numerous attributes, including a substantial specific surface area, reduced weight, and elevated permeability. A stable and regulated environment for material creation can be provided by the organism's chemical composition and unique microstructure simultaneously. In order to produce high-efficiency materials for practical commercial applications, it is necessary to use appropriate natural biological structures as templates. (8) Polymer templating Polymer foams, gels, and fibers, which are porous polymeric materials with mesoporous or macroporous structures, can be used as templates for manufacturing hierarchically structured porous materials. The distinctive benefits of porous polymers, including diverse preparation techniques, customizable pore dimensions, and modifiable surface properties, enable their use as templates that facilitate chemical reactions and serve as scaffolds for nanoparticle infiltration. (9) Template-free methods The disadvantages associated with elevated costs and laborious preparatory processes of soft and hard templating have impeded mass production for large-scale applications. Preferably, template-free techniques for the production of hierarchically organized porous medium with a broad range of pore diameters and diverse forms would be advantageous. (10) Self-formation Hierarchically organized porous materials can be synthesized successfully using the self-formation method, which is based on a spontaneous occurrence related to the chemistry of organic metal alkoxides and alkali metals. The rapid hydrolysis and condensation of metal alkoxides result in the swift release of water and alcohol molecules, which are crucial for the parallel macroporous channels creation inside the materials. (11) Sol-gel controlling The sol-gel technique is a crucial tool for regulating the chemical and physical features of materials due to its ability to organize inorganic species at the molecular level. During preparation, the capillary shrinkage force resulting from gelation will produce pore contraction and a reduction in porosity. Consequently, in practical applications, the sol-gel technology frequently necessitates integration with templating techniques. (12) Selective leaching Immiscible two-phase composites, including desirable and sacrificial phases, can serve as precursors for selective leaching, facilitating the creation of various hierarchically organized porous materials, such as metal oxides and metals. Initially, a thoroughly mixed composite is produced using various physical or chemical methods, including sintering, evaporation, and the disintegration of mixed precipitates; subsequently, the sacrificial phase is eliminated via chemical processes, resulting in a porous framework of the intended phase. 4 ECs for ORR 4.1 Non-precious metal (NPMEC) or non-noble metal (NNMEC) The high cost and limited availability of FC technology are commonly cited as major barriers to its development. As a result, researchers and scientists have extensively examined the performance of the ORR, investigating a wide range of platinum-free ECs. Several Pt-free ECs including MOs, MCs, TMNs, MONs, MSs, SACs, M-N-C, and MOFs [151–162] have been developed using NPMs because of their low cost, availability, and abundance in nature. NPMECs have undergone extensive research because of their exceptional catalytic efficiency, long-lasting nature, and cost-effectiveness. It has been shown that NPMECs exhibit greater stability in less harsh alkaline conditions. However, the attendance of an acidic electrolyte might accelerate the corrosion of NPMECs because of the abundance of H+ ions, which limits their use in such conditions. However, NPMECs have minimal disruption from methanol because of their great selectivity, which contributes to their overall performance. Lang et al. delved into metal-based catalysts for ORR, emphasizing NNMEC, such as transition metal nitrides (TMNs), transition metal carbides (TMCs), transition metal oxides (TMOs), and layered double hydroxides (LDHs) [163]. These electrocatalytic materials prevent the requirement for precious metals while exhibiting exceptional electrochemical efficiency and durability in ORR. While employing these EC in acidic electrolyte environments presents difficulties, their performance in basic electrolytes has been exceptionally noteworthy. The kinetics of the ORR are greatly improved in basic solutions compared to acidic conditions. The TMO EC is capable of reaching performance levels that are comparable to those of EC based on Pt if they are constructed with an adequate structural design. TMOs have attracted attention owing to their cost-effectiveness and controllability. Scientists have also studied the use of 2D TM hydroxides for ORR in basic environments. They have examined how these hydroxides are made and how their structure grows, with a specific focus on breaking them down into nanosheets [164,165]. In addition, metal-oxynitride materials have demonstrated very accurate ORR efficiency [166]. Cost-effective NNM catalysts have demonstrated notable improvements in the efficiency of ORR. The formation of the NNM catalyst as an ORR catalyst in PEMFCs is shown in Fig. 7 [14]. The creation of NNM catalysts has been investigated via several analyses, including Fe-based hetero-atom polymer components and cobalt pyrolysis, amongst others. The pyrolysis and impregnation preparation method, involving the networking of Fe and N, has resulted in maximal activity [167]. The nature of active sites in NNMEC still requires discussion, specifically regarding the coordination of iron with the active site and the methods used to create these active sites. It has been shown that catalyst endurance decreases with increasing potentials, and for automotive uses, catalytic efficiencies <0.6 V tend to be impracticable. Nasim et al. [168] introduced an NPMEC for ORR in the alkaline environment. The synthesized EC exhibited superb activity to 20 wt% Pt/C in KOH (0.1 M) with the E onset = 1.03 VRHE, E 1/2 = 0.89 VRHE, and J = 6.32 mA cm−2. The increased activity is ascribed to the combined impact of CoOx, FeOx, and the presence of four distinct N atoms. The ORR capability of the as-prepared catalyst was also examined in the presence of a 0.5 M concentration of methanol. The catalyst demonstrated greater resistance to methanol addition. After 10,000 cycles in a 0.1 M KOH solution, the accelerated durability test (ADT) shows that there is only 17 mV of degradation. Zhou et al. [169] developed a pH-universal ORR catalyst for use in both Zn-air batteries. Achieving a logical, hierarchical porous structure with controlled size and a specific ratio of micropores to mesopores has been accomplished. This structure is advantageous for facilitating mass transfer in the ORR. The NNMEC illustrated superb ORR performance throughout a wide pH range, with an E 1/2 = 0.91 V in alkaline electrolyte and E 1/2 = 0.76 V in acid electrolyte. The zinc-air battery had an impressive peak power density of 203 mW cm−2 and demonstrated 130 h of long-term stability, indicating excellent battery performance. Tian et al. [170] developed high-durability NNMEC toward the ORR in alkaline media. The NNMEC exhibited an E 1/2 of 0.91 V and adequate stability of 100,000 voltage cycles with 29 mV E 1/2 loss. DFT simulations have verified that the presence of vacancies near active sites can decrease the adsorption-free energy of OH* and impede the dissolution of the metal center. This leads to a substantial improvement in the kinetics and stability of the ORR. NNMEC demonstrated exceptional power density and maintained long-term stability for over 1200 h in rechargeable zinc-air batteries (ZABs). Li et al. [171] fabricated Pt-free EC (NNMEC) as a bifunctional EC toward ORR and OER activity for rechargeable zinc-air batteries (RZABs). The potential gap for this NNMEC was 0.616 V, while the E 1/2 for ORR was 0.884 V and the overvoltage for OER was 270 mV at 10 mA cm−2. The peak power density of RZAB was 203.36 mW cm−2 with a lifetime of over 550 h, even beyond the commercial Pt/C + IrO2 catalyst, which is due to the good activity of this NPMEC. Moreover, flexible RZAB with such EC shows the promising future of NPMEC in wearable energy storage devices. 4.1.1 Metal-oxide (MO) catalyst Simultaneously, complexes of MOs and carbon have demonstrated significant advancements in both durability and activity [172]. Consequently, the enhancement of electronic structure has the potential to elevate catalytic activity. MOs have recently been employed as catalyst supports for the ORR in an acidic environment. This is done by moving the D-band center to the best spot. In a study by Huang et al., a porous MnCo2O4 bifunctional EC was developed using a solvothermal preparation method, following the calcination route for ORR and OER [173]. The exceptional efficiency can be associated with the large surface area, high porosity, and tiny size of NPs, which are accurately regulated through the solvothermal method. MOs have demonstrated notable catalytic activity and durability as independent EC for the ORR in both aqueous acidic and alkaline environments. They offer several advantages, such as abundant availability, cost-effectiveness, and eco-friendliness. In contrast to carbon materials, metal oxides exhibit significantly greater corrosion resistance in electrochemical environments, attributed to their elevated oxidation states that impede electron loss. Group IV-XII TMs possess various oxidation states due to their electronic configurations. This characteristic enables them to efficiently absorb and dissociate O2 molecules on their surface, hence increasing the process of ORR. TMOs, in contrast, exhibit limited electrical conductivity and lack surface sites for oxygen adsorption. Consequently, their ORR activity in bulk form is significantly sluggish. Conductive carbon hosts can enhance the TMOs' conductivity and the electron transfer activity at the cathode contact. While carbon structure's supporting features have been presented by multiple TMOs, the main focus is on the catalytic activity of TMOs. Various research approaches have been pursued to enhance the catalytic efficiency of TMOs, such as modifying the surface, introducing dopants, forming alloys, and dispersing high amounts of N/P-hetero-atoms. Perovskite materials can be discovered in addition to their role as active ORR catalysts [174–177]. Zhang et al. [178] introduced typical post-transition metal oxides, including CoO, NiO, CuO, ZnO, and as primary constituents or supports in the domain of electrocatalysis. The catalysts demonstrated differing selectivity for the 2e− ORR, with approximate values of 36.8%, 79.4%, 82.8%, and 90.0%, respectively. The ΔG*OOH value of ZnO is closest to its ideal potential at the limiting potential, as revealed by DFT. Furthermore, with a rise in atomic number, the catalyst's efficiency in producing H2O2 by 2e− ORR showed a substantial improvement. This study offered novel perspectives on the structure and functioning of TMO materials for the formation of H2O2. Mahato et al. [179] characterized a heterostructure consisting of Cu/CuO x -Co3O4/NC-700 and found it to be a highly efficient, long-lasting, and cost-effective catalyst for the ORR. The catalyst indicated favorable ORR performance, achieving an E 1/2 of 0.81 V vs. reversible RHE and a limiting current density of 6.5 mA cm−2. The observed ORR performances were similar to those of benchmark Pt/C catalysts. The Zn-air battery, which employed an as-prepared Cu/CuO x -Co3O4/NC-700 catalyst, achieved a significant open circuit voltage (OCV = 1.41 V). The catalyst also demonstrated an exceptional specific capacity of 820 mAh gZn −1 and a great peak power density (103 mW cm−2). Nagarani et al. [180] conducted an evaluation of a hybrid EC consisting of ZnO-NiO/rGO to enhance applications related to the ORR. The hybrid catalyst was shown to possess exceptional thermal stability and a much larger specific area (395.8 m2 g−1) when compared to the bare catalysts, as determined by TGA and BET tests. By conducting a TEM investigation, researchers noticed a uniform distribution of ZnO nanorods and NiO NPs on the surface of rGO. The electrochemical investigation demonstrated that the ZnO-NiO/rGO hybrid catalyst exhibited exceptional catalytic efficiency for the ORR. It had a high limiting current density (7.1 mA cm−2), a positive onset potential (0.95 V), a low rate of H2O2 formation (less than 15%), and long-term stability. The ZnO-NiO/rGO hybrid catalyst was found to facilitate the ORR process by a highly efficient 4e− pathway, as confirmed by RDE and RRDE experiments. The ZnO-NiO/rGO hybrid catalyst showed great potential as a cost-effective catalyst for cathodes in alkaline fuel cells, without the need for costly metals. Singh et al. [181] developed a CoO x -Fe3O4/N-rGO ORR catalyst for anion-exchange membrane fuel cells (AEMFCs). This catalyst demonstrated a significant enhancement in ORR activity (130 mV@−1.5 mA cm−2) relative to pure graphene oxide (GO), with the ORR limiting current exceeding that of commercial Pt/C by 12% at 0.5 V. The better ORR performance of CoO x -Fe3O4/N-rGO was because Co, Fe, and N were spread out evenly on sheets of rGO. Also, ORR rapid stress tests showed that this material was very sturdy, which means it could be a good catalyst that lasts a long time. The CoO x -Fe3O4/N-rGO catalyst on the cathode helped us get a peak power density of 676 mW cm−2 in an operand H2-O2 AEMFC. There was the most power output per mass of cathode catalyst in a cathode catalyst that did not contain PGM. 4.1.1.1 Manganese oxides Manganese oxides, which include MnO2, Mn2O3, Mn3O4, and MnO x , have been thought of as possible alternative ORR catalysts because they are cheap, have good catalytic activity, and are structurally stable. Manganese oxides do not carry electricity well on their own, so they usually need to be mixed with carbons that do. Doping is a popular way to deal with this problem. The arrangement and interconnection of fundamental octahedral [MnO6] units result in many polymorphs of MnO2, including α-MnO2, β-MnO2, and δ-MnO2. There are many different types of structures because of two main factors that affect the change from Mn(III) to Mn(IV). One of these factors is that making crystals less perfect is a key part of getting a high catalytic activity for the ORR. As a general rule, manganese oxides have several different crystal shapes. Manganese in oxides can also have valence states of + 2, +3, and + 4, which can be used alone or together. In the ORR, all of these different valence states play a big role. Mixed valence states can make it easier for surfaces to store charges and improve their electrical and ionic properties. This, in turn, makes ORR catalysis possible. 4.1.1.2 Perovskites oxides ABO3 Perovskites have been recognized as potential replacements for conventional PGM-based catalysts in fuel cells due to their strong resistance to corrosion, efficient proton transport properties, and exceptional ionic conductivities. Among these perovskites, LaNiO3, a simple perovskite with a rhombohedral structure, has demonstrated one of the highest levels of ORR activity among similar materials. Perovskite oxides generally display significant ORR activity and moderate stability in alkali electrolytes. The characteristics of these oxides can vary extensively, associated with the composition of the A- and B-sites. Commonly the transition metal elements of the B-site can be considered as the active sites for ORR. Shao-Horn et al. [182] study results show that the extent of s*-orbital occupation and the level of covalent bonding between the oxygen and B-site metal is a vital parameter of the ORR activity of perovskites. 4.1.1.3 Spinel AB2O4 Spinel oxides with the AB2O4 formula, where A and B represent transition metals, and O represent oxygen, have shown great potential as EC for ORR in recent years. These oxides offer several advantages, including low cost, high stability, significant activity, and environmental friendliness. Furthermore, they display outstanding electrical conductivity because of the fast electron hopping between different metal valence states in O-sites. This property allows them to serve as crucial surface redox-active centers for the adsorption and activation of O2. For the enhancement of electrocatalytic efficiency, researchers have focused on finding appropriate methods to create nanostructured materials such as spheres, wires, and sheets. These materials are designed to facilitate the efficient movement of electrons and ions, thereby improving their transport paths. Compared to Pt/C, the AB2O4 oxides still indicate poor performance in ORR, which means there is a need for more enhancements. In this study, the researchers have discovered that introducing oxygen vacancies is a highly successful approach for strengthening catalytic performance. This is achieved by increasing the quantity of active sites that are exposed, adjusting the electrical characteristics of the catalysts, and improving their ability to adsorb reactants. Oxides such as cobalt oxide, cerium oxide, zirconium oxide, molybdenum oxide, and other specific oxides have generated significant attention for their potential use in catalyzing the ORR. In this context, the primary objective is to improve the performance of the ORR by enhancing conductivity and gaining a better understanding of the active sites. The main approaches to achieving high performance involve the construction of multiple TMOs, the addition of dopants, conductive carbon usage, the introduction of oxygen vacancies, and the production of crystal structures with desirable features. 4.1.2 Metal carbides (MCs) Nowadays, MCs, particularly tungsten carbides (WCs), have gained widespread use as catalyst supports for the ORR [183]. Nevertheless, the utilization of WC and other carbide alloys as effective ORR catalysts encounters obstacles due to their restricted durability under acidic electrolytes and extremely oxidizing surroundings. This impracticality can be addressed through structural modifications and alterations. To tackle these issues, investigations have focused on the impact of incorporating Tantalum (Ta) into WCs. The addition of Ta has been discovered to improve the electrocatalytic efficiency and durability in the ORR, which is linked to the formation of a Ta-W alloy. Furthermore, Ni-doped Ta-C composites, produced through sputtering methods, have been identified as effective ORR EC. These fabricated nanostructures exhibit heightened stability, attributed to the protective thin-film formation of TaO on the EC's surface. TMCs exhibit the necessary ORR activity and ascertain catalytic properties akin to Pt in various methods. TMCs, under acidic conditions, are surrounded by carbon and/or graphitic material layers, unlike TMNs [184]. WC NPs, with a mean diameter of 1.9 ± 0.9 nm, are surrounded by graphite layers and are referred to as WC@C. This configuration led to a substantial increase in activity for the 4-electron path, as it enhanced the overall catalytic conductivity and minimized the sintering of WC NPs on the ORR. The exceptional performance and stability of the system have been attributed to both the limited chemical compositions and designs. Nevertheless, the efficiency of TMC-carbon complex catalysts is influenced by many factors, including the quantity of nitrogen and the kind of graphitic shells. It is worth noting that nitrogen-doped carbon can also demonstrate substantial ORR activity. Furthermore, the composition of TMCs can be intricate. For example, WCs may consist of a mixture of WC and W2C, while iron carbide may contain both Fe and Fe3C. Hence, further comprehensive and extensive investigation is necessary to fully comprehend the functionalities of the constituent elements and the underlying cause of the heightened ORR activity of TMC-based EC. He et al. [185] prepared TMC co-doped NC as an effective bifunctional EC for HER and ORR pathways. All of the metal carbides synthesized in this study (WC/NC, V8C7/NC, and Mo2C/NC) exhibited a high level of activity in ORR. The efficacy of WC/NC at a current density of 3.0 mA cm−2 for ORR is 0.814 V (against RHE), closely approaching that of Pt/C (0.827 V), so establishing it as one of the premier transition metal carbide-based ORR catalysts in acidic electrolyte. Among them, WC/NC illustrated exceptional efficiencies, maintaining durability for 10,000 cycles without any decline in ORR activity compared with the Pt/C catalyst in an acidic electrolyte. Ingavale et al. [186] indicated a significant electrochemical efficiency of the optimized Mo2C/Fe3C-NC3 catalyst for ORR with an impressive onset potential of 1 V versus RHE, an E 1/2 of 0.89 V, and an excellent current density of about 6.2 mA cm−2. The optimized catalysts achieve a maximum power density of 142 mW cm−2 at a current density of 200 mA cm−2 in ZAB. The combination of this synergy, together with the even dispersion of Mo2C and Fe3C NPs, significantly increased the number of active catalytic sites and facilitated the diffusion of electrolytes. This significant advancement has opened up possibilities for the development of sustainable energy technologies and provides a foundation for future research on enhancing the scalability and ORR catalysts' performance. TMCs, including Fe3C, Co3C, WC, and Mo2C, encapsulated in graphitic or N-doped graphitic carbon structure, have attracted significant interest owing to their electronic structures resembling those of Pt and their pronounced ability to electrically adsorb hydrogen. Encased Fe3C NPs are believed to have a synergistic impact that boosts the activation of the outer N-doped graphitic shell. This, in turn, facilitates O2 adsorption and reduces the number of active surface carbon layers. In addition to facilitating electron transport at active sites, graphitic carbon layers can protect enclosed metal NPs from corrosion in electrolytes. This protection is crucial for ensuring the long-term stability of catalysts, especially in acidic environments. 4.1.3 Transition metal nitrides (TMNs) TMNs are gaining attention owing to their notable stability in acidic environments, positioning them as potential candidates for ORR electrocatalysis [187]. TMNs, or transition metal nitrides, are often more stable than TMs, or TMOs, because of the elevated energy levels associated with metal-nitrogen triple bonds. Moreover, their excellent corrosion resistance and remarkable conductivity make them highly appealing for ORR-EC. Nevertheless, even when considering the RDE level, the ORR efficiency of TMNs remains very poor while functioning in acidic electrolyte conditions. The addition of nickel to titanium nitride nanocrystals resulted in the formation of a binary Ti-Ni nitride, which exhibited greater ORR activity in an acidic medium compared with the original nanocrystals. Additionally, it performed similarly to commercially available Pt/C catalysts in alkaline electrolytes. The suggestion was made to use Ni doping as a means to improve the capability of Ti atoms to transfer electrons to adsorbed O2 and somewhat weaken the Ti–O bonds. Both of these factors contribute to the activity of the ORR. Catalysts based on VN and NbN, produced using the same doping approach, exhibited high potential for catalyzing the ORR in alkaline environments. Fu et al. [188] investigated hierarchical porous VN/NC/C nanocomposite for ORR. The VN/NC/C nanocomposite exhibited superior catalytic activity with an E onset of 0.87 V, a limiting current density of 4.05 mA cm−2, and excellent durability. The experimental data and DFT estimation demonstrated that the combination of NC and VN resulted in a synergistic effect, which led to the optimization of the free energies of the reaction intermediates. This optimization considerably enhanced the adsorption of O2 and reduced the potential of the rate-determining phase. The ZABs constructed with VN/NC/C nanocomposite illustrate an open circuit potential of 1.30 V, an energy density of 856.27 Wh kgZn − 1, and a large power density of 141.82 mW cm − 2. It has been established in a great number of investigations that the integrated N atoms have the potential to influence the electron distribution of the parent metal [189]. After the creation of M–N bonds, the lattice expands and the distance between metal atoms increases. This causes the metal d-band to broaden and results in a rise in the density of states (DOS) around the Fermi level. TMNs have catalytic characteristics similar to those of Pt-based metals, making them suitable as cathode catalysts in Zn-air batteries. Furthermore, TMNs possess not only the superior electrical conductivity of the original metal but also display the properties often associated with ionic crystals and covalent compounds. The presence of covalent connections gives it the characteristics of covalent compounds, such as high hardness. The exceptional ionic conductivity and superb electronic properties of TMN stem from its ionic and metallic bonding. It has recently been shown that the structure of a nitride-core and oxide-shell morphology can serve as a high-conductive catalyst for the ORR in an alkaline environment. The shape of TMNs significantly influences the ORR activity of these catalysts. For metal nitrides to maintain long-term stability, it is essential to apply an additional passivation layer. A comprehensive comprehension of the links between structure and activity is employed to fabricate TMNs with nanotube morphology. These TMNs, in contrast to TMNs with nanosheet morphology, demonstrate considerably enhanced ORR activity at the level of the whole cell. The exceptional ORR performance is ascribed to the alteration of the electronic states of the material. The fusion of TMNs with carbonaceous materials, similar to the fusion of TMOs with carbon-based materials, enhances the performance of ORR. The intense interaction between the two components in the hybrid catalyst leads to a synergistic effect. Researchers have also studied the ability of TMN NPs to perform the ORR under acidic conditions. He et al. [190] reported the creation of a dual-functional electrocatalyst for the ORR and OER, including Zn-doped Ni3FeN/N-doped graphene (Zn-Ni3FeN/NG). The incorporation of Zn as a dopant induced lattice distortion, modifying the electronic density of Ni3FeN in the peripheral areas, resulting in the creation of catalytic sites. The DFT calculations indicated that the introduction of Zn2+ ions might alter the electronic density of Ni3-FeN, resulting in a modification of the adsorption/desorption path. This modification can reduce the thermodynamic barrier for electrocatalysis. In addition to its bifunctional electrocatalytic characteristics, the Zn-Ni3FeN/NG material demonstrated acceptable electrochemical activity and durability, as well as a comparatively high overpotential of 740 mV. However, it exhibited a greater power density in comparison to the commercially available Pt/C and RuO2, which were 158 and 120 mW cm−2, respectively. Xia et al. [191] conducted a study to provide a more comprehensive understanding of the electrocatalytic efficiency of MoN/C, which was constructed by ammonia heat treatment. A current density of 0.15 mA cm−2 was at 0.40 V against NHE in a 0.5 M sulfuric acid solution. Following over 10 h of testing at this potential, no notable current degradation was noticed. The hexagonal nanostructure of MoN was found to be responsible for the O2 reduction efficiency by a 4-electron pathway, leading to the creation of water. 4.1.4 Metal oxynitrides Metallic oxynitride compounds indicate unique ORR activity, which is commonly attained through the introduction of N-doping into MOs. This procedure effectively mitigates the elevated band gap characteristic of MOs, resulting in enhanced electron-conducting characteristics for electrocatalytic applications. The incorporation of carbon in this class of material has been shown to further enhance their ORR performance. In recent studies, researchers have documented the preparation of carbon-supported zirconium oxynitride [ZrO x N y /C] EC using the pyrolysis process of ZrO2/C in the presence of NH3 [192]. It demonstrated a great ORR activity at a potential of 0.7 V vs. RHE. Furthermore, the thin films of ZrO x N y , which were prepared via a reactive sputtering path, demonstrated an onset potential of 0.8 V vs. RHE for ORR. The nanostructure of EC with the highest potential for ORR performance was found to be the crystalline Zr2ON2 phase, among the others. According to reports, adding N atoms to the oxide lattice would increase its conductivity. In the face-centered cubic structure of tungsten oxynitride (WNO), some of the oxygen atoms with a radius of 3.44 are substituted with nitrogen atoms with a radius of 3.04 in the octahedral locations. N-doping decreases the d-band gap of MOs by reducing the energy difference between electrons in the oxide. WNO materials exhibit robust electrical conductivity, exceptional corrosion resistance, high porosity, and enhanced surface wettability. Specifically, its high stability and resistance to corrosion in alkaline solutions make it a strong contender for supporting EC. Additionally, the incorporation of oxygen vacancies not only enhances the electrical conductivity but also provides additional binding sites for the metal catalysts, hence enhancing the catalytic activity. Yu et al. [193] created catalysts supported by metal oxynitride with a porous structure to improve the efficiency of the ORR. These catalysts have good conductivity and are resistant to electrochemical degradation. The catalyst, including supported nanoclusters, can increase the exposure of active surface area and enhance the density of active sites in comparison to metal NPs. The study suggests using a W0.62(N0.62O0.38) framework with a 3D organized macroporous structure to support Co nanoclusters (3DOM Co@WNO) as an ORR EC that works very well and lasts a long time (illustrated in Fig. 8 ). The presence of oxygen vacancies in WNO enhances the catalyst's electrical conductivity and electrochemical stability. Furthermore, it provides many fixed locations for the widely scattered Co nanoclusters, resulting in their enhanced stability. Moreover, the 3DOM structure design could be obtained by a controllable mass transfer pathway at the three-phase interface where the ORR reaction arises. The ORR half-wave potential of 0.85 V (vs. RHE) was obtained for the 3DOM Co@WNO catalyst in an alkaline media, and excellent stability exceeded that of the Pt/C catalyst. Theoretical simulations indicate that the robust electron-transfer interaction between Co clusters and the WNO support is crucial in enhancing the kinetics of the ORR. ZAB indicated a 185-mW cm−2 power density with a specific capacity of 740.0 mAh g−1 at 20 mA cm−2 when employed as an air cathode. The integration of conductive and durable oxynitrides, together with the construction of highly distributed nanoclusters, promotes the progress of effective and long-lasting EC for ORR [193]. 4.1.5 Metal sulfides TMSs have been extensively used as EC for ORR owing to their comprehensive electronic structure and inherent physical characteristics. TMSs utilize metal-sulfur interactions to enhance the O2 adsorption and the transfer of electrons. Metal sulfidation alters the chemical properties of TMSs and protects the metal centers from oxidation during electrocatalysis. As a result, TMSs exhibit greater stability in acidic electrolytes compared to TMOs. Typically, TMSs are produced on carbon-based structures to enhance the active surface area, the mass transfer process, electron transfer activity, structural porosity, density of active sites, and the ORR performance [194]. Mixed metal sulfide (MMS) has significantly enhanced electrochemical performance compared to monometallic sulfide, owing to their higher redox activity and superior electronic conductivity. Furthermore, MMSs exhibit enhanced electrochemical efficiency compared to MMOs, thanks to their plentiful redox chemistry and improved electronic conductivity. This is the case because MMSs exhibit more stability. Owing to their abundant redox chemistry, improved electrical conductivity, and the synergistic effects of combining two metals, mixed MMSs have emerged as desirable materials for use as electrodes in metal-air batteries (MABs), EC water splitting, and supercapacitors. Specifically, some mixed MMSs can serve as bifunctional catalysts for MABs and EC water splitting. The effectiveness of these catalysts is primarily influenced by the composition, structure, morphology, crystalline phase, and particle size of the MMS materials. Consequently, significant attention has been devoted to the development and production of materials based on MMSs, as well as the appropriate arrangement of the electrodes connected to them. Hollow nanostructures made of nickel–cobalt sulfide are a kind of nanoarchitecture that has gained significant attention due to their advantageous structural characteristics. The exceptional ionic permeability and conductivity of Ni-Co sulfide make them well-suited as core materials for supporting other electroactive materials that have low electrical conductivity. The temple-engaged approach is highly effective in fabricating Ni-Co sulfide with controlled shell thicknesses, morphologies, compositions, particle and internal void sizes, and interior complexity. The capacitance of hierarchical core-shell nanoarrays composed of Ni-Co sulfide and other capacitive materials has been enhanced. Heterostructure nanoarrays provide many electroactive sites for redox reactions, an enlarged interface between the electrode and electrolyte, a reduced distance for electrolyte diffusion, and a beneficial interaction between the core and shell components. Huang et al. [195] designed SPAN-FCNM as a multifunctional EC for overall water electrolysis and ZAB. This catalyst achieved low overpotentials (η) for the OER (η 10 = 210 mV) and HER (η 10 = 55 mV) with a minor efficiency decay of 7.5% under 100-h continuous operation in KOH at 500 mA cm−2. Furthermore, a zinc-air battery equipped with the SPAN-FCNM-coated air electrode demonstrated remarkable energy efficiency (1st cycle = 60.9%; 90th cycle = 58.9%) when subjected to a discharge/charge current density of 50 mA cm−2, which is important to industrial applications, for a duration exceeding 60 h. In the research of Cao et al. [196] NPMEC has been implemented for both ORR and OER with rapid kinetics, which is an essential component in increasing the effectiveness of the electrochemical process, especially for FC devices. The performance of a nanohybrid of cobalt sulfide and porous N-doped carbon (Co9S8/N-C) was superior to that of commercial Pt/C, which was a combination of cobalt sulfide and porous N-doped carbon. The starting point of the ORR on Co9S8/N-C is 0.05 V (vs. Ag/AgCl), which is higher than the starting points for Co9S8 + AB (−0.11 V), N-C (−0.18 V), and Co9S8 + N-C (−0.13 V). This suggests the hybrid material's superior ORR activity. The significantly reduced Tafel slopes (154 mV dec−1) of the Co9S8/N-C hybrid for both the ORR and OER indicate enhanced electrocatalytic activity of Co9S8/N-C. Li et al. [197] effectively constructed a new nanocomposite, specifically a WC/FeS/FePt/NC nanohybrid for the ORR EC. The resultant Pt-based EC exhibited a remarkable mass activity of 317 mA mg−1 Pt at 0.9 V vs. RHE, greatly exceeding the activity of Pt/C EC, which was 125 mA mg−1 Pt, by a factor of 2.5. Furthermore, improved stability in acidic electrolytes was noted for the WC/FeS/FePt/NC. This study introduces a novel way of creating high-efficiency ORR EC by the incorporation of diverse beneficial components, such as sulfides and carbides. Wang et al. [198] successfully produced distinctive hollow nanohybrid structures consisting of EC NPs that were evenly distributed and maintained within a carbon matrix. Synthesized Co9S8/NHCS composites exhibited superior ORR performance when synthesized at 900 °C, showcasing the highest ORR performance compared to other ECs. To evaluate the stability of the Co9S8/NHCS-900 catalysts, a constant voltage of 0.8 V was applied for a duration of 10,000 s in solutions of KOH (0.1 M) and HClO4 (0.1 M), whereas the catalysts were rotated at a rate of 1600 r min−1. According to research, the Co9S8/NHCS-900 catalyst's current densities toward ORR can be saved by KOH (0.1 M) and HClO4 (0.1 M) electrolytes, with a sustainability rate of 87.1% and 60%.9%, surpassing the performance of Pt/C (74.6% and 9.8%), respectively. 4.1.6 M-N-C EC Single-atom catalysts (SAC) composed of metal-nitrogen-carbon (M-N-C) materials exhibit exceptional efficacy due to their ability to expose all metal atoms to catalytic pathways. Typically, M-N-C catalysts with Fe, Co, and Ni have remarkable electrocatalytic activity and seem to be viable materials for addressing future energy issues. In addition, instead of MNPs and TM complexes, M-N-C materials possess distinct characteristics such as uniform distribution of metal atoms with low-coordination numbers, maximum utilization of atoms, and structural resemblance to naturally occurring MN4-molecules. The identification of these distinct qualities can be advantageous in identifying the activity descriptors and theoretical modeling for both homogeneous and heterogeneous electrocatalysis. These properties have led to the development of ways to design M-N-C materials that exhibit enhanced catalytic performance. Furthermore, mass transportation, density of active sites, and intrinsic features are the main factors determining ORR performance. However, the precise identification of genuine catalytic sites and their impact on the reaction, as well as the mechanism of action, remains inadequately comprehended. Researchers are employing in situ/- operand characterization approaches to get insights into these difficulties and further the improvement of energy catalysts. In catalysts with atomically scattered M-N-C structures, individual metal sites interact with donor atoms such as N, S, and O like MN4 molecular catalysts, exhibiting comparable electronic and structural features. The coordination environment and electrolyte stability of M-N-C catalysts are influenced by the valence state of the central metal. Therefore, adjusting the coordination number of the central metal atom can enhance the efficiency of M-N-C material. Zhao et al. [199] prepared FeMn(mIm)-N-C catalyst for ORR in the alkaline and acidic media. The findings demonstrated that FeMn(mIm)-N-C had exceptional ORR efficiency, with E 1/2 of 0.861 and 0.778 V in alkaline and acid environments, respectively. Additionally, the material showed remarkable long-term stability. In addition, the ZAB and PEMFCs that were put together exhibited remarkable power densities and showed potential for long-term stability when compared to 20% Pt/C. Xu et al. [200] presented atomically dispersed Zn/Co-N-C as ORR EC for alkaline FCs. This catalyst indicated excellent ORR activity with an E 1/2 of 0.938 V vs. RHE and superb stability after 50,000 cycles. Furthermore, this exceptional achievement was confirmed in practical operating circumstances of an FC, attaining an unprecedented peak power density of around 1 W cm−2, which is the highest recorded value for M-N-Cs used in AFCs. X-ray absorption spectroscopy was performed to locate the active sites and uncover mechanistic insights into catalysis. The findings revealed that the Co atom in the Co-N4 structure served as the primary catalytically active site. Specifically, one oxygenated species bonds to this site, forming an Oads-Co-N4 moiety in the ORR. Furthermore, the experimental results were effectively corroborated by theoretical investigations employing a potential-dependent microkinetic model and core-level shift calculations. These studies not only demonstrated a high degree of agreement with the experimental findings but also offered valuable insights into the O-species bonding to Co-N4 centers in ORR. 4.1.7 Single-atom EC The single-atom catalyst (SAC) has become a prominent area of research. SACs are presently regarded as highly prospective contenders for progress in energy technologies, specifically in electrocatalysis, with the capacity to diminish dependence on Pt. Replacing traditional noble metal catalysts with SACs is a pressing matter, yet it poses significant difficulties. Nevertheless, individual metal atoms tend to aggregate due to their high surface free energy. The electrocatalytic process can result in the aggregation of individual atoms, leading to the formation of a mixed phase consisting of metal NPs, single atoms, and nanoclusters. This aggregation has a significant impact on the catalytic activity and reactions. To prevent the accumulation of individual atoms, contemporary investigations have predominantly focused on SACs with low metal loadings. However, this limitation severely hinders the practical use of SACs since it reduces the number of available active sites. Therefore, it is imperative to produce SACs with high atomic loadings to boost catalytic activity and enable their practical use on a broad scale. When synthesizing SACs, it is important to maintain appropriate spacing between atoms and provide strong contact between the atomic metal centers and the supports. A complex with several coordination sites can be considered as the appropriate precursor for achieving the incorporation of a large number of single-atom active sites onto the support. Porous materials possessing significant surface areas or voids are optimal substrates capable of accommodating abundant active sites, hence achieving high metal loadings of individual atoms. Defect engineering of graphene, which may create more locations for metal atoms and heteroatoms, could be an optimal selection. Furthermore, further synthesis methodologies should be investigated to produce SACs on a wide scale. Currently, it has been proven that the hydrothermal approach and restricted pyrolysis strategy are effective in creating atomically distributed catalysts with high metal loadings. To prevent the clustering of SACs with large metal loadings, one may consider utilizing the low-temperature pyrolysis technique. Furthermore, it is possible to enhance the current synthesis methods to minimize the exposure of precursors to high-energy environments. This, in turn, can partially reduce aggregation as the metal loading increases. In addition to the clustering of individual atoms, the performance and long-term stability of SACs in real-world settings remain difficult, but are essential for widespread use in commercial applications. Many of the electrocatalysts used in the ORR in acidic environments are not sufficiently active and stable. This substantially restricts the use of SACs in PEMFCs. To address these issues, it is crucial to carefully choose appropriate metal precursors and supports that can provide robust interactions between the metal centers and supports. It is crucial to precisely control the coordination environments of metal centers in SACs. This may be accomplished by selecting appropriate single-site materials and supports, as well as employing suitable synthesis techniques (such as manipulating vacancies and structural defects) [201]. So far, it has been established that several M-N coordination structures are very advantageous for electrocatalytic processes. The M-N4 and M-N2 configurations of SACs are the most prevalent in electrocatalysis. Therefore, the addition of heteroatoms like N, O, S, P, B, and others to carbon materials can be considered an effective approach to enhance both the catalytic performance and durability. Furthermore, the addition of additional metal atoms to SACs to create atomically distributed dual sites might potentially improve the catalytic performance of SACs. This is because of the beneficial interactions between the two metal atoms, known as synergistic effects. Furthermore, the development of more effective and resilient EC can be achieved by a synergistic approach including experimental investigations and theoretical simulations. This approach can provide insights into the underlying reaction processes and the intricate connections between the catalyst's structure and its properties. For instance, analyzing the spatial arrangement and dispersion of metals in volcano plots, together with examining the alterations in Gibbs free energy during individual stages of electrochemical processes, might offer valuable insights for enhancing the efficiency and stability of SACs. Furthermore, there is currently a lack of thorough information on the catalytic processes of SACs. Advanced characterization methods including high-angle annular dark-field scanning transmission electron microscopy (HAADF-STEM) and XAS are highly helpful in identifying the actual active sites. Nevertheless, they are unable to see the dynamic alterations, including changes in structure and components, of active sites during electrocatalysis. This limitation somewhat hinders the ability to get a more profound understanding of intricate catalytic processes on SACs. Therefore, it is necessary to create additional in situ/operand characterization methods, since the existing ones are still insufficient to fulfill actual needs. Characterization techniques like in-situ XRS, TEM, and XAS provide valuable and dependable means to directly examine the structural features of active sites and the dynamic processes involved in electrocatalytic reactions. These techniques aid in comprehending the relationships between process, structure, and property. In terms of the current in situ/operand study, a combination of multiple XRS characterization techniques is vital because using 3D metal K-edge XANES is advantageous for obtaining valuable data about the bulk and surface of SACs. Furthermore, in-situ XAS is an invaluable characterization technique for identifying the dynamic active sites and reaction processes in electrocatalytic reactions. It provides surface-sensitive information and is advantageous for designing efficient and resilient SAC at the atomic level. Recent research reports suggest that SACs can exhibit superior performance for ORR efficiency and durability. The IL-M-SAC catalyst's electrochemical performances versus ORR are shown in Fig. 9 (a–i) [202]. Zhu and his colleagues [203] carried out a thorough evaluation of metal catalysts that scatter at the atomic level, composed of clusters and single atoms for ORR (Fig. 9j). The high stability of SACs is attributed to the robust association between single atoms and the host link's active sites. The SACs have exhibited notable catalytic efficacy, particularly in the context of Co-based SACs. Extensive research has been performed to elucidate the effective production of Co-SACs with substantial metal content employing a pyrolysis technique. An additional research endeavor resulted in the discovery of a process that defies common sense, namely the transformation of NPs of noble metal into single atoms that are thermally stable at temperatures higher than 900 °C. Various approaches were employed to investigate the atomic distribution of Pd, which unveiled the presence of a transition phase that occurs between the sintering and atomization processes of NPs within SACs. According to theoretical calculations, it has been proposed that the transformation process at elevated temperatures may be intensified, resulting in the creation of stable Pd-N4. This enhancement is associated with the capture of individual Pd atoms by defects in N-doped nanocarbons. W-N-based electrocatalytic performance [204] was improved by modifying fabrication factors such as temperature feasibility, pyrolysis atmosphere, and duration. Furthermore, it has been shown by DFT calculations and experiments that the increased catalytic efficiency of W-based SACs can be ascribed to the presence of adequate contacts between individual W atoms and OH groups, potentially resulting from the appropriate hybridization of dz 2-pz orbitals. The activity of Ni-based SACs has been assessed, where Ni-N4 sites are integrated into a three-dimensional and hierarchical carbon-based nanostructure. This nanostructure displays excellent electrocatalytic performance for ORR in a basic medium [205–207]. The catalytic activity of this NiN4-C-based nanomaterial is comparable to Pt-C catalysts. The NiN4-C catalyst consists of numerous single Ni-atom active sites, each coordinated with four N atoms, as determined by ICP-OES. It has been demonstrated through both practical and theoretical evaluations that the ORR catalyst that was produced possesses a high 4e− selectivity. Moreover, the NiN4-C EC demonstrates a high-power density (95 mW cm−2), comparable to Pt-C power density. These findings support the exploration of catalytically active sites in carbon support Ni-based EC. Simultaneously, another study reports the transformation of Ni NPs into stable. The facilitation of this transformation is associated with the existence of many flaws inside the N-doped carbon structure. A highly active catalyst composed of Ni-N4-GHSs-Fe-N4 has been produced by researchers using a self-assembly approach [208]. The present catalytic material demonstrates notable catalytic effectiveness by the dispersion of Fe and Ni ions, strategically located on both the inside and outside surfaces of hollow graphene (Gr). Recent research evaluations suggest that Ni-based SAC coordination significantly enhances ORR activity. A variety of metal-based SACs have been explored, including Ni-N2O2 nanomaterials as SACs [209,210]. The active sites in Ni-N2O2-C have garnered attention for their remarkable efficiency. In a basic electrolyte, analyses indicate that Ni-N2O2 active sites exhibit notable selectivity in the reduction of O2 to H2O2. The Ni-N2O2-C EC was prepared via a ligand-mediated pyrolysis procedure, which offers a promising approach for producing ORR catalysts on a wide scale for FCs. Researchers conducted a study that revealed the effectiveness of using a SiO2-templated strategy to generate Co-active sites that were distributed across hollow spheres based on Gr (GHS) as an ORR EC. Furthermore, enhanced ORR activity is demonstrated by cobalt phthalocyanine (CoPc). Yuasa et al. [211] incorporated Co ions into polypyrrole in methanol at 120 °C to create an ORR EC based on nanocarbon that is co-doped with N and Co. This catalyst represents the coordination of Co and N4 in a pyrrole-type structure. The resulting catalyst exhibits high ORR performance in a basic environment, with further improvement observed after pyrolysis at 700 °C. The retention of closed-packed Co-N4 is ascribed to exceptional outcomes, whereas the depletion of Co-N groups at an elevated temperature (1000 °C) results in the proliferation of metallic Co, resulting in a deterioration in electrochemical efficiency. This suggests that Co-N4 moieties play a crucial role in electrocatalytic efficiency. However, EXAFS assessments offered only moderate structural evidence, leaving uncertainty about the preservation of all Co-N4 moieties during pyrolysis at elevated temperatures. Therefore, detailed analyses were conducted to reveal the Co-N x configurations using theoretical exploration and empirical findings. Recent research has produced different forms of Co-N x molecules, suggesting that the nanostructures of Co-N-C molecules stay unaltered when subjected to an applied potential [212]. The authors have put forth a straightforward method for the production of Fe-based catalysts that are atomically distributed throughout N and Fe-doped nanocarbons, resulting in the formation of five Fe-N5 active sites [213]. Furthermore, the catalyst ORR activity is modified by introducing Fe atoms through doping, providing an effective approach to creating EC that is connected to structure and activity. This strategy allows for the creation of EC with a significant number of active sites in M-N x , thereby enhancing catalytic efficiency. Various methods have been explored for fabricating noble and NNM-based SACs, relying on different metal properties. An exhaustive protocol is required for potential preparation to acquire a diverse range of SACs. Researchers have also uncovered EC that possess both dual and bimetal active sites. Yang et al. [214] produced a dual-metal SAC consisting of Fe and Cu on commercially available carbon black to enhance the efficiency of the ORR. Fe and Cu atoms were uniformly distributed on commercially available carbon black material, forming FeN4 and CuN4 sites at the atomic level. Due to the proximity of Fe and Cu atoms in a small region, the Fe, Cu dual metal SAC demonstrated exceptional performance in the ORR. It exhibited a high E 1/2 of 0.926 V and displayed good stability in 0.1 M KOH. These values are significantly superior to those observed in the Fe-SAC or Cu-SAC control samples. DFT simulations demonstrated that the presence of a single Cu atom enhances the electron density of Fe sites, effectively donating electrons. This results in optimized adsorption/desorption energy for ORR intermediates, hence promoting the ORR activity of FeCu-SAC. Furthermore, a study conducted on three common commercial carbon substrates demonstrated that carbon support with elevated surface areas and a hierarchical pore structure had a positive impact on the ORR. The FeCu-SAC catalyst exhibited outstanding ORR performance and long-lasting durability, resulting in a Zn-air battery with a remarkable power density of 201.4 mW cm−2 and a high specific energy of 827.68 Wh kg−1. Shao et al. [215] discovered single sites of SnN4O in the main group that have been optimized to enhance the ORR by improving the distribution of charges. The Sn SAC that was constructed had exceptional ORR performance, with a very high E 1/2 of 0.912 V (vs. RHE) and excellent mass activity of 13.1 A mgSn −1 at 0.850 V (vs. RHE). These values beat those of commercially available Pt/C and most TM-based SACs that have been reported. Furthermore, the Sn SAC that was described exhibited remarkable stability in the ORR as a result of the robust contact between the Sn sites and the carbon support, facilitated by the presence of oxygen atoms acting as bridges. The high ORR efficiency of Sn SAC was also shown by ZAB tests conducted in both liquid and solid states, which indicates that it has a significant amount of promise for use in real-world applications. The ORR efficiency of TM-based SACs is presented and compared in Table 1 [216–229]. The process of designing SACs at the molecular level has been briefly explained, providing a clear understanding of the coordination structure of metal centers. Recent research in the field of SAC-based catalysis has focused on improving catalytic efficiency by manipulating the amount of metal used. The primary objective of modifying the structure and morphology of SAC-based EC is to enhance their efficacy in mass transfer. Optimizing the porosity and density of active sites in SACs can enhance their catalytic efficiency. Despite the relatively lower activity of SACs compared to precious metal EC, it is imperative to do additional research and develop strategic design and fabrication approaches for SACs with minimal metal loading to prevent the buildup of NPs [230]. SACs present a cost-effective alternative with equal catalytic efficacy for the ORR. The first issue for SACs is their operating durability in PEMFC settings. This work examines contemporary ways of enhancing the catalytic activity of SACs, consisting of augmenting active site density, metal center coordination optimization, and designing porous substrates. Although SACs have demonstrated remarkable performance in controlled laboratory environments and during MEAs, their durability in the rigorous circumstances of functioning PEMFCs creates a significant worry. Several difficulties, such as metal dissolution, active site poisoning, and corrosion, pose considerable obstacles to the lifetime and reliability of these ECs. 4.1.7.1 Improvement strategies for activity of SACs To improve the catalytic characteristics of SACs, researchers have utilized various methodologies aimed at altering the electronic structure, geometry, and morphology of the catalysts. 4.1.7.2 Structure and active site density engineering Growth of the M-N4 active site numbers and developing a support with a highly porous structure are essential design elements to optimize catalytic activity. The alteration of pore architecture and the meticulous design of active sites are essential for enhancing catalytic efficacy. The pore structure optimization enhances the active site approachability and improves reactant molecule diffusion efficiency; hence, it expedites catalytic processes. Not only does changing the pore structure mean changing the pore size, but it also means making the pore shape and network work best for the reaction in question. The accurate formation of active sites necessitates the regulation of atomic-scale architecture on the surface of the EC. Using meticulous design and preparation, particular types of active sites, like metal clusters, single-atom sites, or uniquely structured metal oxides, can be included on the surface of the EC. You can change these active sites' electrical properties, geometric shapes, and chemical environments to fit the needs of the catalytic process. This lets you precisely control reaction paths and product selectivity. 4.1.7.3 Modulating the coordination environment By changing the number and types of ligand atoms, which is called “local coordination manipulation”, the electronic structure of the metal center is affected. This includes the electron density and d-orbital occupancy. This control can change how well the metal center can bind reactants and the activation energy. It can also create active sites with certain geometric shapes that may be better for the transition states of some reactions. This lowers the reaction energy barrier and improves the speed and activity of the reaction. The new way to boost ORR activity is different from the old way of adding heteroatoms to the carbon matrix plane. It focuses on improving the coordination sphere of intrinsic M-N x active sites by adding axial ligands like chlorine, sulfur, and oxygen. 4.1.7.4 Synergistic impacts of single atoms and clusters/particles The usage of NPs, clusters, and single atoms on carbon supports to function synergistically demonstrates significant potential for enhancing ORR activity. The clusters facilitate electron transport at the M-N4 site, enhance O2 activation, optimize *OOH adsorption at the metal's active site, and accelerate the ORR. 4.1.7.5 Regulating the spin state of metal atoms The spin state of metal atoms can affect the electron occupancy of their d-orbitals, thereby altering the electronic density at the metal core. An elevated spin state often indicates an increased quantity of unpaired electrons, which might enhance the interaction between the reactants and the metal core and hence augment catalytic activity. Changes in spin states can adjust the adsorption capacity of the metal center for crucial intermediates in the ORR. A higher spin state generally enhances the adsorption of oxygen molecules, thereby promoting the oxygen reduction process. Furthermore, varying spin states can enhance reaction routes and augment catalytic selectivity. 4.1.7.6 Improvement strategies for stability of SACs The stability of SACs for the ORR is a pivotal concern in PEMFCs, and these catalysts typically rely on M-N-C architectures. However, they lose their effectiveness quickly and aren't stable enough for real-world use. This is mostly because of carbon oxidation, metal dissolution, Fenton reactions, and active site poisoning, all of which often work together to make FC catalysts less effective in real-world settings. Demetallization is a critical aspect influencing the durability of SACs within the operation of PEMFCs. Potential variations may cause the detachment and dissolution of metal active sites in elevated potential conditions, thereby diminishing catalyst effectiveness. This dissolution process is generally linked to anodic corrosion within electrochemical processes, which is more probable during start-up and shut-down operations. Specifically, for the highly active Fe-N x centers, iron ions may leach from the metallic iron phase. While this leaching may not instantaneously lead to a decline in catalytic activity, the substantial release of these ions can initiate the Fenton reaction, generating harmful reactive oxygen species that intensify the oxidation of the carbon support and hasten the deterioration of the fuel cell. Enhancing the durability of FCs necessitates the identification of more stable carbon support materials, EC structure optimization, and the regulation of the EC manufacturing process. 4.1.7.7 Strengthening metal–N bonds The intensity of the contact between support and metal atoms is widely recognized as a crucial element in the demetallization mechanism, and enhancing the link between nitrogen and metal can increase the resistance to metal leaching. 4.1.7.8 Alternative Fe-free catalysts The addition of iron ions can modify the decomposition pathway of H2O2, resulting in an increased production of reactive oxygen species (ROS) rather than direct degradation into water and oxygen. The ROS, due to their potent oxidative capability, can target and impair the active sites or carbon matrix of the catalyst, resulting in diminished catalyst efficacy or deactivation. Conversely, other TMs including zinc, copper, cobalt, and manganese do not demonstrate the same pronounced catalytic activity in the Fenton reaction as iron. Thus, it is expected that M-N-C ECs utilizing these Fe-free metal sites will diminish the frequency of the Fenton reaction, thus improving the catalyst's durability. The use of Fe-free metals in catalyst construction is expected to reduce degradation from the Fenton reaction. Nonetheless, the inherent ORR activities of these ECs are generally inferior to that of Fe SACs, thereby constraining their applicability. Increasing the number of M-N x sites is a suitable manner to make them more catalytic because intrinsic activity is calculated by multiplying specific activity by turnover frequency. 4.1.7.9 Eliminating H2O2/ROS H2O2 and ROS can induce significant corrosion of carbon substrates and degrade the active sites of catalysts, leading to a reduction in catalytic efficacy·H2O2 is a principal generator of ROS; thus, reducing its generation or eliminating existing H2O2 is essential for limiting ROS damage. Using compounds based on platinum and cerium is a quick and effective way to get rid of harmful substances. It helps break down H2O2 and ROS into less harmful or harmless substances like H2O and O2. This technique prevents the erosion of the carbon material and catalyst active centers, preserves its catalytic activity, and prolongs its service life, thereby significantly boosting its stability and efficiency. 4.1.7.10 The anchoring mechanisms of SACs on the support substrate The instability of individual atoms leads to their tendency to aggregate into clusters or NPs, thereby minimizing their surface free energy, which can undermine the benefits of their great catalytic activity in SAC configurations. Consequently, the formulation of the stabilizing method is crucial to preserve the metal atoms' dispersion, thereby sustaining their elevated activity for catalytic reactions. At the atomic level, it is very hard to stabilize precursors like mononuclear metal complexes on carrier surfaces. Stabilizing ligands being removed from highly scattered mononuclear metal complexes leads to atom aggregation through the post-treatment method. Lowering the load of single metal atoms and choosing carriers with larger specific surface areas is one of the effective and best ways to avoid this problem. Using phosphorus, nitrogen, and sulfur atoms is another way to do it. They create the right coordination environment for monometallic complexes to attach and stick to the carrier surface. This method emphasizes preserving the robust connection between metal and coordination sites on the carriers throughout the formation method. The use of metal nanoparticle precursors is an alternative approach; nevertheless, strong metal–metal bonding limits these endeavors. To disrupt the metal–metal bonds and achieve atomically dispersed metal groups affixed to carriers without aggregation, an appropriate energy source is required. To address this issue, it is essential to establish coordination sites that can efficiently capture the dispersed metal species by forming robust links between the metal atoms and the carriers. The techniques encompass impregnation, co-precipitation, one-pot pyrolysis, step reduction, organometallic complexation, atomic layer deposition (ALD), and mass-separated soft landing. In the fabrication of SAC, many organic materials, especially polymers, have been employed as synthetic templates, protective agents, encapsulating agents, and catalyst carriers across multiple fabrication techniques. Numerous polymers are appropriate for the incorporation of supplementary active sites owing to their precisely specified porosity, adaptable tunability, elevated surface area, and diverse functional groups. Moreover, polymers may function as surfactants to modulate the crystallization of the desired catalyst. Polymers containing N-atoms are advantageous for dispersing active single atoms without aggregation and modifying charge distribution to enhance catalytic activity. Heteroatoms possessing lone electron pairs, like nitrogen, are typically prevalent in polymers or their derivatives. These heteroatoms can stabilize individual metal atoms through robust coordination interactions. The coordination environment of the solitary electron pair can increase the average adsorption distance between individual metal precursors and the polymer matrix, effectively inhibiting agglomeration in the pyrolysis process and promoting the formation of SACs. In this context, polymers containing nitrogen groups are extensively utilized to fabricate SACs. Due to the robust interaction between carriers and metal atoms, they exhibit superior intrinsic catalytic selectivity and activity compared to traditional catalysts for the ORR, OER, and other processes. Despite the significant promise of SACs in practical applications such as the hydrogen evaluation reaction (HER), OER, ORR, and CO2RR, their advancement is hindered by low single-atom loading, inadequate chemical and thermal stability, and the constraints of catalytic processes. Typically, (1) the metal–metal interaction surpasses the metal-carrier interaction in single-metal catalysts, allowing individual atoms to readily migrate and amalgamate to create metal clusters and NPs under practical reaction conditions; (2) single atoms can also induce self-agglomeration and cluster formation due to the elevated surface free energy in fabrication environments and during catalytic cycling, both of which may result in catalyst deactivation. The fundamental factor in stabilizing SAC active species is to create robust connections between the individual atoms and their supports. This robust connection is crucial in preventing solitary metal atoms from clustering, hence facilitating the formation of stable and well-dispersed SACs. The interaction happens because electrons are moved around between the single atom and the carrier. This has a big effect on the atom's electronic structure and its ability to catalyze reactions. Polymers are important in many synthetic methods because they act as carrier precursors, microstructure templates, inhibitors to limit the size of metallic particles, and protective agents for SACs. Polymers are the best choice for carriers because their shapes and structures can be changed chemically or physically to make them more porous, increase their surface area, and keep them chemically stable. Polymer carriers play an important role in keeping atoms in place on their surface by connecting with metal atoms through their many functional groups. Metal atoms can become immobile, smaller, or more limited during the synthesis process if the carrier precursors have flaws or empty spaces. To stop single metal atoms from sticking together when there are more of them, two theoretical requirements have been found: increasing the carrier surface area and making it easier for the metal atoms to stick to the carrier surfaces. (1) Mass-separated soft-landing method The mass-separated soft-landing method uses a high-frequency laser evaporation source to turn metal atoms into vapor. Then, a mass spectrometer is employed to control the deposition of the vapor, creating metal particles on the carrier surface that are of different sizes and weights. (2) Atomic layer deposition method (ALD) ALD transpires when individual metal atoms are deposited onto a carrier's surface with atomic-level accuracy. A precisely defined catalyst can be systematically fabricated at the atomic level by ALD, owing to its distinctive self-limiting surface property, which facilitates the conformal deposition of catalytic materials on the high surface area of substrates. (3) One-pot pyrolysis method The one-pot pyrolysis technique has been devised to synthesize SACs with elevated loading capacity. Stable SAC can be produced by separating isolated metal species during high-temperature processing due to fractured metal–metal or metal-O-metal connections that improve interactions between the metal and support. (4) Co-precipitation method The technique of co-precipitation facilitates the fabrication of supported metal catalysts with homogenous dispersions of multiple active components concurrently. The properties of catalysts produced via co-precipitation are influenced by several aspects, such as temperature, the base solution pH, aging duration, efficient mixing, the sequence and rate of component solution addition, and the quantity and distribution of defects on the substrate. (5) Impregnation method In a standard synthesis technique, the carrier is infused with a solution with an active component (metal salt). The active component is progressively adsorbed onto the carrier surface or confined within the pore structure following the carrier's interaction with the solution. The solution is subsequently filtered or dried to eliminate the surplus solution. The resultant solid is dried, calcined, and activated to yield the desired catalyst. The dispersion of metal is contingent upon the properties of the anchoring sites, which arise from interactions between the precursor and the carrier. (6) Organometallic complex approach A metal in a molecular complex with a certain structure can coordinate with a functional group on the carrier surface. This method can precisely place and quantify metal atoms. The manufacturing cost is a crucial determinant for the practical utilization of non-PGM catalysts. A cost comparison of the leading catalysts documented in this domain, as illustrated in Table 2 , will offer a more lucid understanding of their economic viability. 4.1.8 Dual-atom catalysts (DACs) To surpass the constraints of single-atom catalysts, dual-atom catalysts (DACs), characterized by isolated pairs of metal atoms scattered on a carbon framework as active sites, have lately been proposed and garnered significant interest in a brief period. DACs possess atomically scattered active sites and demonstrate comparable benefits to SACs in terms of the optimal performance of the metal sites. Furthermore, DACs feature two proximate metal atoms as the active center, which may lead to novel catalytic mechanisms and significantly enhanced structural adaptability in comparison to SACs. The chemical interaction between two neighboring metal atoms generates a unique electronic structure for each atom, diverging from their single-atom forms, potentially augmenting intrinsic electrocatalytic activity and optimizing ORR/OER performance. These advantages render DACs intriguing candidates for high-efficiency oxygen electrocatalysis, surpassing SACs. The isolated metal atom pairs in DACs are typically considered the active sites for oxygen electrocatalysis. In contrast to SACs, the distinctive architecture of DACs presents novel prospects for oxygen electrocatalysis. Initially, each pair of metal atoms in DACs offers two potential locations for the adsorption of oxygen intermediates, potentially introducing new reaction mechanisms to achieve reduced reaction energy barriers. DACs also have short-range contacts (1–5 Å) between metal atoms that create a unique electronic structure of the active sites. These contacts can be direct metal–metal bonds or indirect inductive M1–N/C–M2 interactions. The active sites in DACs have properties that make them better at electrocatalysis than their SAC counterparts. The inherent advantages of DACs are acknowledged from three distinct perspectives: the modulation mechanism, the bifunction mechanism, and the collaboration mechanism. 4.1.9 Advantages of DACs (1) The modulation mechanism The modulation process pertains to electronic modulation between one metal atom and an adjacent metal atom, enhancing the inherent activity of the former, which acts as the true active center. In this scenario, just one atom in the pair acts as the active center that directly interacts with the intermediates of the ORR/OER, while the other atom behaves as an ambient atom that modulates its electronic structure without directly adsorbing the intermediates. The adsorption characteristics of the oxygen intermediates at the active site can be adjusted in comparison to its SAC equivalent, hence potentially enhancing intrinsic activity. (2) The cooperation mechanism The cooperative process, namely the cooperative adsorption of oxygen intermediates on the two neighboring metal atoms of DACs, is believed to potentially disrupt scaling relations and surpass the theoretical upper limit of electrocatalytic activity. The scaling relations delineate the association between the adsorption energy of various oxygen species on designated electrocatalytic sites. The adsorption energies of various oxygen intermediates are consistently linearly correlated, provided the adsorbed atoms are the same. An increase in the adsorption energy of one intermediary at a particular catalytic site correlates with an increase in the adsorption energy of other intermediates. Consequently, in oxygen electrocatalysis involving several steps, the scaling relations link the free energy change (ΔG) of each step in ORR with OER, thereby inhibiting independent regulation by the design of active sites. Consequently, the total overpotential must guarantee ΔG < 0 for all phases, reflecting the maximum threshold of electrocatalytic activity for standard single-atom sites. Fortunately, the dual-atom locations in DACs can disrupt this link through a cooperative method. Diverse oxygen intermediates may be adsorbed onto various metal atoms or establish distinct adsorption patterns. Consequently, following the collaboration mechanism, the electrocatalytic activity of DACs is not limited by the aforementioned scaling laws. (3) The bifunctional mechanism The two neighboring metal atoms in DACs can independently electrocatalyze the ORR and OER, resulting in bifunctional electrocatalytic activity, encapsulated in the bifunction mechanism. Bifunctional electrocatalytic activity denotes an EC capable of facilitating both the ORR and OER, a characteristic essential for ensuring high energy efficiency in rechargeable metal-air batteries. Due to the differing reaction processes and rate-determining steps of the two reactions in most instances, EC featuring multiple active sites is typically regarded as providing optimal adsorption characteristics for the oxygen intermediates in OER and ORR, respectively. In the DACs, ORR and OER can be facilitated by two proximate metal atoms, with the electronic interactions between the metal pair potentially enhancing the OER/ORR activity relative to SAC arrangements. (4) Applications of DACs The significant influence of DACs transcends their direct applications, including HER, OER, and ORR, affecting the fundamental aspects of catalytic science and materials engineering. The capacity to optimize electrical and geometric characteristics via bimetallic combinations not only indicates an enhancement in catalyst efficacy but also denotes a transition towards more customizable and versatile catalytic systems. (5) DACs for HER The application of DACs in HER markedly increases catalytic research, providing improved efficiency. By utilizing the synergistic interactions between two metal atoms in a singular catalytic system, these DACs offer an innovative method for enhancing the electrocatalytic process, including atomic-level localized electric fields. This technique enhances the kinetics of hydrogen production and paves the way for the development of energy-efficient and sustainable hydrogen generation systems. The importance of atomic-scale local electric fields and the reorientation of water molecules within DACs is vital in the context of bimetallic catalysts for HER. The fundamental mechanism involves the purposeful alteration of the water structure at the electrode–electrolyte interface to enhance HER efficiency. (6) DACs for OER The utilization of DACs in OER represents a significant advancement in EC, especially in water electrolysis and renewable energy harvesting. Adding more bimetallic elements makes electrochemical dynamics better by changing the electronic structure and helping water molecules adsorb and react in the best way possible. These DACs employ a sophisticated method to modify the reaction environment by lowering energy barriers and fine-tuning the adsorption energies of intermediates, thus enhancing and expediting the oxygen evolution process. (7) DACs for ORR DACs are pivotal in enhancing the kinetics and performance of the ORR, which is vital for electrochemical energy devices such as FCs. Conventional ORR catalysts frequently have sluggish kinetics because of rigid scaling relationships. Nonetheless, DACs, recognized for their superior atomic efficiency, selectivity, and durability, provide unique solutions by overcoming these limitations, hence improving ORR efficiency. The distinctive synergistic impact in these bimetallic systems enhances adsorption-desorption dynamics, greatly improving the electrocatalytic process. DACs facilitate a more effective 4-electron reduction path, essential for enhancing the ORR rate and selectivity while providing superior durability compared to traditional monoatomic catalysts. The advancement of highly selective four-electron reaction pathways demonstrates the superior catalytic capability of DACs in efficiently facilitating ORR reactions, hence improving both kinetics and selectivity. It's important to control the complex electronic structures and interactions between sites in these catalysts to create the best electronic environment at catalytic sites. This has a big impact on ORR performance by changing the way reactions work and increasing catalytic activity. (8) DACs for CO2RR There are two main ways they work: the “Bridge” adsorption mode improves the adsorption and transfer of intermediates, and the “Intermediate Auxiliary Mechanism” keeps the stable conversion intermediates for CO2. These mechanisms jointly enhance the catalytic process, rendering DACs indispensable for sustainable CO2 conversion technologies. 4.1.10 EC derived from metal-organic frameworks (MOFs) MOFs, or Metal-Organic Frameworks, have the potential to create more intricate catalysts through the use of different metal ions or clusters, organic connections, and a fast production method. MOFs show great promise as catalysts for ORR applications. The carbonization technique is straightforward and results in a metal that has a significant surface area and is doped with heteroatoms, which enhances its functionality. The MOF bimetal exhibits a minimal over-potential. The wide-ranging metal valence coordinated aromatic hydrocarbon sites, and atomic defects of this material make it highly favorable for ORR applications since they provide static sites. Recent studies have demonstrated that MOFs composed of metal ions and polyfunctional organic ligands act as ideal sacrificial templates for the controlled thermal degradation of various NPCs, including metal/metal oxide-decorated porosity, porous carbons, and heteroatom-doped porous carbons. When developing MOFs, it is important to fulfill the following conditions: (1) absence of any structure-directing agent; (2) expectation of specific structure formation based on metal–ligand chemistry, with the ability to explain variations in synthesis by creating different morphologies; (3) initiation of the reaction through reversible framework formation; (4) maintaining a consistent composition of the organic linker during the transesterification reaction. The MOF template generated carbon-based materials with notable characteristics such as a high-specific surface area, readily functionalized heteroatoms, and adjustable porosity, beyond the capabilities of traditional hard- or soft-template procedures. Many studies have been conducted to create diverse MOF-templated NPCs using multiple MOF templates and temperatures, as well as additional precursors, pyrolysis, and post-synthetic functionalization. These efforts have been driven by the numerous benefits associated with these approaches. Porous composite materials are generated by the combination of organic ligands and metal ions in MOFs, which possess expansive surface areas and customizable porosities. These materials are well-suited for energy and environmental applications, particularly in the context of batteries. MOFs are particularly suitable for usage as anode materials in lithium-ion batteries due to their ability to provide porosity (channels), organic ligands, redox metal ions, and electrolyte ion transport. Furthermore, porous, crystalline formations contain metal ions and a network of metal clusters, which can be two- or three-dimensional. Fang et al. [231] added Fe/dicyandiamide to Co-MOF to greatly improve its ORR/OER bifunctional electrocatalytic activity. FeCo@CNTs-60 catalyst had an onset potential of 1.04 V for ORR in an alkaline medium, which is close to the commercial Pt/C (40 wt% Pt) of 1.05 V. The initiation potential in a quasi-neutral solution was higher at 1.02 V compared to the Pt/C electrode at 0.99 V. Furthermore, FeCo@CNTs-60 demonstrated a minimal potential difference of 0.81 V between the potentials for OER and ORR. The ZABs, which were made using the sample as the electrocatalyst for the air electrode, showed greater peak power density and stability compared to Pt/C. Additionally, the rechargeable batteries demonstrated excellent stability when cycling discharge/charge at 5 and 10 mA cm−2. Specifically, the battery containing FeCo@CNTs-60 was subjected to a continuous cycle of charging and discharging for over 1300 h. This very long-term test was done at a current density of 5 mA cm−2. Recently published studies indicate that MOFs are present as in-situ molded precursors of porous carbon [232,233]. Studies on the impact of different porous carbon host materials on the electrocatalytic activity have revealed that an EC sustained by a Zn(II)-based MOF (ZIF-8) has 2.6 times greater ORR performance compared to EC sustained by black pearls. The improved catalytic efficiency of the EC developed from ZIF-8 can be related to its porous framework, which has a greater surface area. The active sites in the micropores play a role in this improved performance. Nowadays, researchers have successfully created EC by utilizing MOFs with core-shell nanostructures. One example is the Fe/Fe3C@C catalyst, which has demonstrated exceptional efficiency in the ORR [234]. During this procedure, scientists successfully manipulated the size and distribution of implanted NPs to increase their effectiveness. The combination of the electric conductivity and porous nanostructure enables efficient electron and mass transport to occur simultaneously. Carboxylic ligands and macrocycle ligands containing N atoms are two important ligands for the classification of MOFs [235]. Previous research has demonstrated the successful utilization of MOFs in catalyzing the ORR in PEMFCs, highlighting their obvious benefits. The zeolitic imidazolate framework (ZIF) is the most commonly used material in the ORR process [236]. The ZIF series materials, which possess tetrahedral nanostructures, have been found to exhibit remarkable thermal and chemical stability, as well as enduring porosity. Wang et al. conducted a study where they reported the use of a carbon catalyst doped with N and S. This catalyst was generated from a MOF employing a ZIF-8 precursor. The results demonstrate that the nanocarbon material, doped with both N and S, exhibits excellent catalytic efficiency and long-term stability for the ORR in basic conditions, surpassing that of Pt/C. The N and S co-doped carbon exhibits a large specific surface area and appropriate porosity, which is beneficial for efficient mass movement and facilitates the ORR. The presence of coupled dopants enhances the reactivity of carbon active sites, leading to superior performance compared to carbon that is only doped with S or N individually. A summary of the ORR performance for the alloy-based electrocatalysts and their composites has been made in Table 3 [237–252]. 4.2 Metal-free (MFEC) or non-metallic (NMEC) 4.2.1 Carbon material catalyst for ORR By employing a wide range of metal-supported forms as catalytic agents, it is possible to manufacture huge amounts of carbon nanostructures. The EC is evenly dispersed at the bottom of a ceramic vessel, located in the middle of a tube, and exposed to precise gas and temperature conditions. A mixture of helium and H2 gas is introduced into the system to reduce the sample. MCs have recently seen widespread use as EC supports for the ORR in PEMFCs. RGO is gaining attention as a promising candidate for catalytic support due to its excellent electrical conductivity and good durability. Nagarani et al. [253] examined the electrochemical properties of chemically reduced graphene oxides (C-rGO) in ORR. The catalytic activity of the C-rGO was greatly improved compared to the beginning GO when it came to the ORR in alkaline solutions. The thermal characteristics of C-rGO exhibited excellent thermal stability, whereas the presence of structural flaws in C-rGO was verified using Raman analysis. The investigation of electrochemical impedance spectroscopy (EIS) indicated that C-rGO has a higher electron transport capacity compared to GO. The C-rGO catalysts exhibited an enhanced onset potential of 0.82 V, a reduced Tafel slope, and a current density of −5.6 × 10−4 mA cm−2 compared to GO. This may be attributed to the removal of the majority of functional groups by chemical reductions. The evidence indicated that the catalyst operates via a four-electron ORR pathway, as demonstrated by the increased electron transfer numbers (3.8 at a potential of −0.63 V) seen in the C-rGO. Wang et al. [254] devised a technique to simultaneously control the surface micro-morphology and construct the N-doped graphene-based nanosheets via subjecting chitin and GO to annealing. The researchers discovered that the annealing temperature played a crucial role in determining the micro-morphology and nitrogen-doping characteristics of the graphene matrix. By optimizing the annealing temperature, they were able to successfully produce 2D multi-wrinkled graphene (CS-rGO-600) with abundant active nitrogen species and moderate defects. When employed as an environmentally friendly electrocatalyst for ORR, CS-rGO-600 demonstrated exceptional performance, characterized by enhanced electrode activity and durability, as well as a greater output power density in fuel cell systems, in comparison to Pt/C. These factors might be related to the fact that the suitable annealing treatment not only promoted the enrichment of exogenous nitrogen and oriented conversion but also facilitated the building of the microstructure. The enhanced ORR performance in the fuel cell corresponds to the synergistic effects resulting from the combination of a multi-wrinkled 2D structure and active sites in the CS-rGO-600 material. Sun et al. [255] described a straightforward hydrothermal technique for preparing S, N dual-element doped reduced graphene oxide (S, N-rGO) for ORR. The process involved employing graphene oxide as the carbon source and thiourea as both the sulfur-nitrogen source and reducing agent. Heteroatom doping substantially boosted the performance of the ORR by increasing the number of active sites on the edges of defects, introducing additional sulfur and nitrogen active sites, and adjusting the electronic structure of rGO. The catalyst with a loading of 0.05-S and N-rGO had the highest activity for the ORR in alkaline circumstances, with an onset potential of 0.793 V versus RHE. It also exhibited excellent stability and resistance to methanol tolerance. The computed electron transfer number, around 3.1 ± 0.1, indicates that both two-electron and four-electron events took place on the catalyst. Several other carbon nanomaterials, including gauze, nanowires, and supported metal NPs, are equally efficient for catalysis, offering a straightforward approach for energy applications. It is important to take into account how the interaction between metal and support elements affects the formation of solid carbon compounds. The primary difficulty in developing an EC with support is achieving a homogeneous and evenly distributed arrangement of metal NPs on the material used for support. Various synthesis approaches can be employed to present NPs on the supportive surface. An appropriate supporting medium can give positive outcomes in enhancing the growth of nano-fiber characteristics. Scientists are currently studying EC produced from biomass for ORR. These ECs are economical and show improved electrochemical efficiency in neutral, acidic, and basic environments, which can be attributed to hetero-catalysis [256]. The VN QDs, which are plentiful and range in size from 3 to 6 nm, have unique structural features. These features include a large surface area and multiple levels of pores, which contain noticeable flaws that operate as active sites. This enables the complete use of accessible active areas and the availability of abundant routes for electron migration during the ORR. Recently, various carbon nanostructures, including fullerenes, carbon nanotubes (CNTs), graphene (Gr) sheets, and graphite nanoplatelets, which possess distinct molecular compositions and optoelectronic characteristics, are now recognized as promising options for the advancement of carbon-based catalysts with improved ORR performance within PEMFCs. In addition to their use in catalysis, CNTs have attracted significant attention for a range of applications, including field emission, H2 storage, heterogeneous catalysis, and superconductivity. However, recent research has specifically focused on the synthesis of bamboo-like CNT/Fe3C structure hybrids as a superior catalyst for the ORR. Moreover, CNTs have been suggested as a substitute for carbon black in supporting FC EC because of their remarkable characteristics, like resistance to corrosion, excellent electrical conductivity, and significant surface area. Chen et al. [257] developed a two-compartment bio-electro-Fenton system, known as a microbial fuel cell (MFC)-Fenton, with a biological anode and a Fenton cathode. The cathode was made of carbon nanotubes supported on carbon brushes (OCNT-80/CB) that had abundant oxygen-containing functional groups, serving as a metal-free catalyst. The findings indicated that the presence of CO in the cathode effectively trapped oxygen from the atmosphere. This trapped oxygen was then used in situ by the electrons generated at the anode to synthesize H2O2 through a 2-electron (2e− ORR) path. Furthermore, ·OH was generated during the activation of H2O2, leading to the effective degradation of tetracycline (TC) in the cathode chamber. This work overcomes the constraints of limited pH adaptation and the subsequent environmental damage resulting from metal breakdown. The OCNT-80/CB demonstrated a significant improvement in maximum power density by 79.4% compared to the CB control, owing to the high conductivity, lifetime stability, and beneficial characteristics of the oxygen-containing functional group active centers. This study shows that meticulous structural design of the cathode can enhance the performance of the electrode. The use of MFC-Fenton can serve as a competitive method to simultaneously improve the treatment of wastewater and recover energy. Qu et al. [258] reported a hybrid catalyst consisting of metal-free graphitic carbon nitride and carbon nanotubes (g-C3N4/CNT) that can enhance the production of H2O2 through π–π interaction. This catalyst achieved nearly perfect (97%) H2O2 production at 0.57 V, with a high selectivity of over 92% across a wide potential range from 0.6 to 0 V. Carbon compounds like acetylene black and super P, which have poor contact with g-C3N4, exhibited a significant decrease in H2O2 generation. This suggests that the π-π interaction plays a crucial role. Electron transfer kinetics studies, together with density functional theory calculations, demonstrated that the combination of g-C3N4 and CNT resulted in a synergistic effect that promoted electron transfer and O2 activation between the two materials. This, in turn, led to an improved performance in the formation of H2O2. This study presented an additional method for producing H2O2 from ORR, which does not need the introduction of oxygenated groups or heteroatom doping into carbon materials. Li et al. [259] synthesized a catalyst for ORR by pyrolyzing urea with sulfur and nitrogen co-doping on carbon nanotubes (S/N/CNT). The findings demonstrated that the S/N co-doping technique effectively altered the charge distribution of carbon nanotubes, resulting in the generation of more active sites and enhancing the catalytic activity of the ORR. In a 0.1 M KOH solution, S/N/CNT's onset potential and E 1/2 of S/N/CNT in a 0.1 M KOH solution were 1.04 V and 822 mV, respectively. These values were comparable to those of Pt/C, which had an onset potential of 1.04 V and an E 1/2 of 815 mV. The S/N/CNT system followed a conventional 4-electron reaction mechanism, with an electron transfer number ranging from 3.88 to 3.91 between 0.2 V and 0.8 V. Additionally, it exhibited excellent tolerance to methanol. The S/N/CNT-based ZABs exhibited a greater galvanostatic discharge capacity than Pt/C-based ZABs and indicated good stability in 6 M KOH and 0.2 M Zn(OAc)2 alkaline electrolytes. The ZABs constructed employing air electrodes including S/N/CNT exhibited excellent performance, characterized by a high open-circuit potential of 1.39 V and a substantial peak power density of 123 mW cm−2. 4.2.1.1 EC based on functionalized and heteroatom doped graphene polymer Graphene has recently garnered attention for its unique applications in electrolyzers, metal-air batteries, and PEMFCs. Gr has been employed as an alternative support for Pt. Functionalized Gr is considered a promising nanofiller for the next generation due to its comparable chemical and physical attributes and cost-effective fabrication compared to carbon nanotubes. Graphene is commonly used as a replacement for carbon black due to its mechanical strength, superior conductivity, and surface area. Xu et al. [260] presented a pioneering study where they introduced edge-rich and dopant-free graphene as a very effective catalyst for the ORR. The electrochemical experiments demonstrated the exceptional ORR efficiency of graphene with a high concentration of edges, following a 4e- pathway. Additionally, edge-rich CNT and Gr exhibited improved ORR performance, emphasizing the crucial role of edge carbon in enhancing the performance of ORR EC. Liu et al. [261] developed metal-free catalysts for both the OER and ORR in FCs. The study successfully produced oxygen-functionalized Gr with abundant edges by exfoliating it in situ on carbon fibers using Ar plasma treatment. Compared to pure carbon cloth (CC), the plasma-etched carbon cloth (P-CC) demonstrated a greater specific surface area, resulting in the creation of more active sites for OER and ORR. In addition, P-CC exhibited strong inherent electron conductivity. Statistical investigations have demonstrated that P-CC has a relatively small overpotential, similar to EC based on Pt. This can be due to the presence of defects and O2 doping. The research of Zhang et al. [262] introduces a direct and efficient technique for producing highly efficient EC on carbon support. The modified ORR activity of N-doped carbon (NC) catalysts can be related to the greater electronegativity of nitrogen in comparison to carbon atoms. Experimental evidence has shown that the presence of a higher density of positive charges on the carbon atoms that are connected has a beneficial effect on the ability of O2 molecules to be adsorbed, hence improving the performance of the ORR. Lai et al. [263] introduced two distinct methods for producing N-doped Gr and elucidated its application as a metal-free catalyst to investigate the catalytic active center for the ORR. N-doped Gr was fabricated via annealing GO in ammonia (NH3) or N-containing polymer/rGO nanocomposite. The study delved into the influence of nitrogen precursors and temperature on the EC's efficiency. The bonding state of the nitrogen atom significantly impacted the ORR activity. The process of annealing GO with NH3 resulted in the formation of pyridinic nitrogen and graphitic nitrogen centers. On the other hand, annealing PANI/rGO and PPy/rGO led to the production of pyrrolic and pyridinic nitrogen moieties. The pyridinic nitrogen had a significant favorable effect on the starting potential. At the same time, the EC's catalytic efficacy was determined by the graphitic nitrogen, which was responsible for evaluating the maximum current. Chemically modifying carbon with other elements is an extremely efficient method in electrocatalytic usage. This method modifies the electron-donor characteristics of carbon and, as a result, enhances catalytic efficiency. In recent times, many advanced synthetic methods have been used to reveal micropores, which play a vital role in providing space for active sites involved in the ORR in PEMFCs. The synthesis approach is crucial in the development of carbon compounds with a high nitrogen content. When utilizing a nitrogen-containing precursor such as melamine or polyacrylonitrile, carbon material with inert nitrogen compounds can be obtained, altering the electronic structure. Alternatively, the introduction of nitrogen into nanocarbon material can be achieved by chemically modifying it with N-containing reactive elements like HNO3 or NH3CH4N2O. This process leads to the formation of nitrogen complexes, specifically at the edges and boundaries of Gr structures. The impact of doping on the electrochemical efficiency is often linked to three characteristics of the dopant: (I) the electron counts in the outside layer, (II) the atomic dimensions, and (III) the electronegativity. Nitrogen, which is the element that is employed as a dopant the most frequently, has a size that is comparable to that of carbon and possesses one additional electron in its outer shell in comparison to the carbon component. Nitrogen can exist in four different bonding forms: (I) pyridinic N (N1); (II) pyrrolic N (N2); (III) graphitic N (N3-N4); (IV) oxidized pyridinic N (N5). The N1 and N2 atoms are found near the periphery or in areas of imperfections, whereas the N3-N4 atoms substitute carbon atoms within the structure's interior. Pyridinic nitrogen can also occur in its oxidized state, denoted as N5. The introduction of nitrogen has been observed to enhance the electron-donor characteristics of carbon, thereby improving ORR activity. The increased activity can be attributed to two factors: (I) the presence of a single electron pair on pyridinic N and (II) the existence of extra electrons in the p-orbitals of the carbon scaffold. The precise characteristics of active sites in N-doped carbon substances continue to be a topic of investigation. Several scholars claim that pyridinic nitrogen (N) contributes to the activity of ORR, whereas others indicate the involvement of graphitic nitrogen. Recent research suggests that both sites may be equally important for ORR efficiency [264,265]. The resulting EC exhibits high performance in both acidic and basic media, along with great stability and remarkable tolerance to methanol. Furthermore, a core graphitic shell structure's existence influences the efficiency of mass transport in the ORR process from the electrolyte to the catalytic sites. This research demonstrates the effective combination of nanostructures, resulting in a highly promising EC for ORR in PEMFCs. Zhang et al. [266] fabricated a structure resembling a flower using WN and N-C to improve the efficiency of the ORR. The increased electrocatalytic performance is attributed to the existence of dual active sites comprising of N-C and distinctive flower-like WN nanostructures, which facilitate an almost complete 4-electron route. Therefore, this economically efficient EC made from NMPs has the potential to replace Pt/C. It has been demonstrated that the introduction of heteroatoms into Gr or carbon has a major impact on the catalytic efficacy of these materials, and the ORR performance of doped Gr or carbon is highly supported by theoretical investigations. Scientists have identified heteroatom-doped Gr as a potential source for ORR in PEMFCs. They propose that the heteroatom source itself can serve as a very effective EC. Liang et al. [267] explored the co-doping effect of graphitic N and pyridinic N on the structural stability of NDG through theoretical calculations. Through the examination of the co-doping of graphitic N and pyridinic N within various porous structures, it was observed that co-doping enhanced the stability of the material. The combination of graphitic N and pyridinic N in triangular pores exhibited the highest stability compared to all other co-doped structures. Additionally, they examined the ORR activities of pyridinic N, graphitic N, and co-doped structures, respectively. The co-doped structure exhibited superior ORR activity compared to both the graphitic N and pyridinic N-doped structures. Xia et al. [268] employed DFT to explore the variations in ORR catalytic activities between pyridinic N and pyrrolic N doped graphene quantum dots (GQDs), as well as the impact of four ions/groups: OH, OH−, H3O+, and H3O on their electronic properties. Calculations of free energy change indicated that pyridinic N-doped GQDs (pN-GQDs) exhibited superior catalytic activities compared to pyrrolic N-doped GQDs (prN-GQDs). Furthermore, the catalytic performance of both pN-GQDs and prN-GQDs can be improved through the functionalization with OH and H3O groups. This modification significantly changes the electronic structures of the GQDs, allowing for effective control over the adsorption strength of reactants. The results may illuminate the impact of various N-doping configurations and adsorbed species on electrocatalytic activities, offering theoretical guidance for the design and advancement of carbon-based ORR electrochemical cells for FCs and metal-air batteries. Li et al. [269] have recently shown that changes in the carbon nanoscale work function are the cause of the enhanced performance in ORR. In addition, the inclusion of other heteroatoms such as phosphorus (P), boron (B), and sulfur (S) in carbon materials has garnered interest due to their ability to effectively enhance the activity of ORR by introducing extra-active sites. Carbon nanohybrids containing dopants such as S, P, and B, or co-doped with N, have been successfully synthesized. These nanohybrids exhibit enhanced electrocatalytic activity for the ORR as a result of the synergistic effects caused by the presence of the doped elements. A readily available and economical method has been utilized to produce BCN-Gr on a large scale, with the ability to control the quantities of N and B doping. This is achieved by subjecting GO to thermal annealing in the presence of boric acid and ammonia gas. When heteroatoms are added to Gr or CNTs, the electrical structure changes, creating active spots where O2 can be adsorbed. In N-C materials such as Gr or carbon, active sites are present at carbon atoms that are next to the doped N atoms. This is because the N atoms have a high electronegativity, causing the nearby carbon atoms to become polarized. Additionally, due to the poor electronegativities of B or P atoms, dopants serve as active sites for carbon materials that have been doped with any or both of these elements. In the case of carbon materials that have been doped with sulfur, active sites are created at the zigzag edge point, which is either close to carbon or where doped sulfur atoms are present. Du et al. [270] discovered that by pyrolyzing zero-dimensional C-quantum dots, they were able to construct a metal-free, effective ORR EC. This EC was made of P and N co-doped three-dimensional porous carbon. The NPCN-900, as it was originally produced, demonstrates exceptional electrocatalytic activity for the ORR and displays high resistance to methanol in a wide range of pH levels in water-based solutions. The remarkable ORR performance of NPCN-900 can be primarily ascribed to its unique three-dimensional porous architectures, abundant edge defects, high specific surface area, and the effective incorporation of P and N. This study not only acknowledges the shift from zero-dimensional colloidal quantum dots (CQDs) to three-dimensional heteroatoms functionalized porous carbon nanomaterial but also showcases a straightforward and template-free fabrication approach to attain exceptional catalytic efficiency and improved durability in metal-free ORR EC for FCs. 4.2.1.2 Conductive polymer (CP) materials Polythiophene (PTh), poly (3-methyl thiophene) (PMeT), polyaniline (PANI), polypyrrole (PPy), and poly (3,4-ethylenedioxythiophene) (PEDOT) are conductive polymers (CPs) that possess a combination of metallic and polymeric characteristics. This makes them well-suited for a wide range of purposes because they are cost-effective, highly electronic conductive, and have unique redox properties. In recent times, there has been a growing interest in investigating the potential of CPs for non-precious ORR electrocatalysis, employing three distinct methodologies: (I) serving as standalone ORR EC; (II) integrating NMP complexes into the CP matrix; (III) functioning as a N-C precursor material for pyrolyzed M-N x /C EC, where M = Fe, Ni, Co, Mn, etc. The ORR results of Co3O4/poly(EDOT-F) are discussed in Table 4 [271]. Conductive polymers possess distinct intrinsic characteristics, including electrochemical, electrical/electronic, and optical properties, which are associated with their p-conjugated bonds, including both single and double bonds. CPs possess several benefits, such as low density, flexibility, chemical variety, corrosion resistance, morphology, and adjustable conductivity. Hence, CPs have a wide range of applications, including organic light-emitting diodes, thin film transistors, supercapacitors, organic solar cells, sensors, FCs, and electrochromic displays. There exist innovative techniques to enhance the characteristics of CPs. The CP nanocomposites can consist of carbon nanofibers, graphene, and CNT. Percolation theory provides a rationale for the conductive properties of CPs. This paper elucidates the transition from having insulating properties to acquiring conductive properties in the context of CPs, which is facilitated by the existence of conductive fillers. However, even with the addition of more fillers, the percolation threshold remains unchanged, presenting a continuous obstacle to the electrical conductivity of CPs. Research has been conducted over several decades to investigate the electrical conductivity and characteristics of organic polymers. Particular attention has been paid by researchers to the electrical conductivity of CPs. Nanofillers, such as CNTs, fullerene, CB, graphene, and CNFs are crucial for CPs because of their enhanced functionality in comparison to conventional polymers. These qualities include electrical and thermal conductivity, electromagnetic shielding, easy formability, lightweight, cost-effectiveness, etc. Two crucial factors impact the conductive network in CPs: dispersion and distribution. Another crucial issue in composite materials is the interface between the polymer chain and nanofillers, which has a significant impact on the mechanical and electrical characteristics. Surface modifications, whether covalent or non-covalent, are a method used to improve interfacial interactions. Covalent methods can create robust C–C bonds between the molecular chains of a polymer matrix and nanofillers, resulting in improved mechanical characteristics of the polymer. Conversely, the electrical characteristics of carbon nanofillers may be impaired as a result of the rigorous surface treatment. The non-covalent approach allows for the preservation of the integrity of electrical characteristics. When creating nanocomposite polymers, several elements need to be considered, such as the selection of nanofillers, the polymer matrix and production process, and the interfacial behavior. Furthermore, a comprehensive understanding of the electrical characteristics of CPs is essential for their optimal use. Khomenko et al. [272] investigated the ORR performance of carbon-based CPs with nitrogen or sulfur in their fundamental composition, including PMeT, PANI, PPy, PEDOT, and PTh. Martinez-Millan et al. [273] examined carbon-supported PANI, PPy, and PMeT, revealing ORR occurrences at high overpotentials with open circuit potentials of 0.48, 0.62, and 0.63 V vs. NHE, respectively. Chronoamperometry tests on PPy/C indicated a gradual decrease in activity over 48 h, indicating a gradual deterioration of the catalyst's structure. Bao et al. [274] designed and successfully constructed a thiophene-enriched fully conjugated 3D COF (BUCT-COF-11) by an all-thiophene-linked saddle-shaped building block (COThTh-CHO). The BUCT-COF-11 illustrated superior semiconducting properties with intrinsic metal-free ORR activity. The AEMFCs achieved a significant peak power density of up to 493 mW cm−2 using the COF as the cathode catalyst. DFT simulations demonstrated that the addition of thiophene to the COF not only enhanced its conductivity but also optimized its electronic structure, resulting in an increased performance in the ORR. This paper represents the initial use of COFs as catalysts in FCs, highlighting the significant potential of completely conjugated 3D COFs as semiconductors in the field of energy. Chen et al. [275] constructed PTh-COF/CNT as ORR EC with narrowed energy band gaps. Similarly, the performance of PTh-COF/CNT was evaluated as a cathode catalyst in metal-free AEMFCs, resulting in a peak power density of 176 mW cm−2 at a current density of 533 mA cm−2. The DFT simulation demonstrated that the electron cloud distribution of interlayer conjugated polythiophene was optimized, resulting in an enhancement of the ORR performance. This study not only offered a fresh understanding of the fabrication of a completely interconnected covalent organic framework but also advanced the progress of novel metal-free oxygen reduction reaction catalysts. Nayak et al. [276] examined the ORR characteristics of a range of electropolymerized PEDOT films. To comprehend the factors that affect the features of ORR, the researchers conducted experiments where they manipulated the counterion (using monomeric or polymeric forms), included a hydroxyl-terminated EDOT monomer into the polymer structure, or introduced a conductivity enhancer into the reaction mixture. The counterion type and the presence of the conductivity enhancer regulated the immaculate doping level of the polymer in PEDOT films, thereby influencing the ORR route. Significant levels of inherent doping resulted in films in which H2O2 was the primary ORR product. This study proposes methodologies for developing conducting polymers that exhibit enhanced performance for electrocatalytic applications. Taxi et al. [277] developed a method to create cost-effective and highly efficient EC for ORR, to advance the use of fuel cells in commercial applications. The researchers presented findings on a newly developed porous carbon structure that exhibits exceptional catalytic performance. N and P co-doped carbon structures were fabricated using the impregnation process, with sustainable cotton fibers (CF) serving as the template. The specific surface area of PANI-SF@CF materials increased to 857.9 m2 g−1 after undergoing pyrolysis. In an alkaline medium, the metal-free EC showed exceptional ORR activity (E onset = 1.1 V, J L = 6.83 mA cm−2) and long-term stability. Quantum-chemical calculations were employed to gain deeper insights into the ORR catalyzed by these polymers. All conducting polymers, except PEDOT, exhibited ORR efficiency at elevated overpotentials. It has been proposed that for these polymers to engage with O2, they must exist in their reduced forms, which are commonly attained at electrochemically low potentials. PEDOT, however, remained unreduced in the required potential range for ORR, rendering it inert to the reaction. Research indicated that electron donor heteroatoms, particularly nitrogen in PPy and PANI, contributed more significantly to activity enhancement compared to sulfur atoms in PTh and PMeT. The results are consistent with previous observations made on M-N x /C catalysts, providing a foundation for future research endeavors focused on improving the ORR efficiency of CPs and their composites. 4.2.1.3 The enhancement of ORR performance by the integration of TM macrocycles in CPs Extensive research has been conducted on the inclusion of catalytically active NMP macrocycle components inside a CP chain. Coutanceau et al. investigated the process of immobilizing Fe and Co tetra-sulfonated phthalocyanines (FeTsPc or CoTsPc) within PPy and PANI materials [278]. Their findings indicated an enhanced ORR performance for PPy-encapsulated Pc macrocycles, while minimal differences were observed in the case of PANI. Over a decade later, several studies delved into the encapsulation of CoTPP macrocycles or CoTPPS in PPy on various supports, revealing some ORR activities. Despite demonstrating catalytic activity for ORR at elevated overpotentials, these materials exhibited relatively low activities, consistent with the typical behavior of non-precious macrocycle catalysts in the absence of heat treatment. Ma et al. [279] developed CNTs@CoPc-CPs as a pyrolysis-free electrocatalyst for the ORR. They proposed an efficient linker engineering technique to modify the electronic states of metallophthalocyanine conjugated polymers and elucidate the crucial function of organic linkers in promoting the ORR. By altering the electrical properties of organic linkers from terephthalaldehyde (TA) to 2,5-thiophene carboxaldehyde (TDA) and subsequently, to thieno/thiophene-2,5-dicarboxaldehyde (bTDA), the associated CNTs@CoPc-CPs demonstrated progressively enhanced electrocatalytic performance for the ORR. Furthermore, theoretical calculations indicated that the transfer of charge from CoPc units to electron-withdrawing linkers (such as TDA and bTDA) facilitated the delocalization of Co d-orbital electrons, consequently leading to a downshift in the Co d-band energy level. Hence, the Co centers that were more positively charged had improved binding energy towards intermediates relevant to the ORR. As a result, they exhibited a well-balanced adsorption/desorption pathway, leading to a considerable boost in electrocatalytic ORR. Singh et al. [280] developed a cobalt-based phenanthroline and triphenylamine-linked mesoporous polymer using a donor-acceptor strategy for trifunctional electrocatalysis (Co@TBPA-phen). Co@TBPA-phen showed considerable electrochemical activity for the ORR with a low onset potential of 0.80 V against RHE and for the HER with an overpotential of −486 mV at 10 mA cm−2. However, just 6.3 wt% Co stabilized Co@TBPA-phen facilitates the OER at an overpotential of 480 mV at 10 mA cm−2, alongside the ORR (E onset = 0.82 V vs. RHE) and HER (−335 mV at 10 mA cm−2) at diminished overpotentials. DFT simulations revealed the descriptor for each reaction and confirmed that easily produced polymers were exceptional donor–acceptor pairings. The natural bond orbital analysis elucidated orbital interactions and charge transfer in the ORR and OER, confirming cobalt stabilization in Co@TBPA-phen in Co(0) and Co(II) oxidation states. RZABs exhibited a specific capacity of 723 mAh g−1 with a notable discharge potential of 1.2 V, and an open circuit voltage of 1.51 V, maintaining a consistent voltage window of 0.75 V for as many as 108 cycles. 5 Conclusions and perspectives Many decades have passed since the beginning of the search for alternatives to Pt EC for the reduction of O2 in FCs. To improve the ORR activity, several novel techniques and models have been devised, involving strategies such as tuning absorbency, doping configurations, and nanostructure preparation. Carbon nanomaterials have been identified as highly efficient catalysts for ORR in FCs. These materials (Gr and CNT that are doped with two different elements) can serve as highly efficient substrates for catalysts with nanostructured features. This support role serves to inhibit the movement and buildup of nanostructures, while simultaneously improving the catalytic efficiency by leveraging the combined action of the supports and structures. Additionally, porous MOFs and doped carbon nanostructures have shown great potential as catalysts. NNM-based SACs are intriguing due to their potential for more active sites, yet there is a need for a more precise fabrication approach to achieve optimal catalysts. Currently, there is an increasing desire to acquire ORR catalysts that exhibit superior efficiency in acidic environments as opposed to basic environments. Hence, forthcoming investigations should prioritize the extensive surface area of nanomaterials and the presence of additional active sites, to achieve improved electrochemical efficiency. Although there are several difficulties in this area, the growing interest in electrochemical reduction using NNM catalysts suggests a hopeful outlook for future advancements. Additional endeavors should be focused on the systematic development of exceptionally effective electrodes and the exploration of reduction processes. The use of NNM catalysts in PEMFCs has the potential to have a wide range of applications for ORR. The primary objective continues to be the advancement of EC for PEMFCs. For the industrial fabrication of catalysts, maintaining quality control for stable FC activity is crucial. The durability of Pt catalysts directly impacts the longevity and economic efficiency of PEMFCs. Maintaining high activity throughout the electrochemical operation is referred to as enhancing their stability to some extent. Given the limited durability of Pt/C, improving the stability can be achieved by optimizing the size and crystal structure of Pt. Smaller particles have a higher surface energy, which causes them to be more prone to aggregation and thermodynamic instability. Likewise, the breakdown of the Pt/C system occurs due to carbon corrosion at high potential. The oxygenated species have a higher affinity for binding to the Pt particles, causing them to separate from the support. This detachment occurs by either particle movement or spillage on the surface, resulting in the subsequent redeposition and aggregation of the particles. Additionally, the presence of radicals, sulphonic groups, and other substances on the surface of Pt can cause significant deterioration. Therefore, increasing the size and optimizing the crystal structure of the catalyst might help reduce the merging and solidification of Pt. Nevertheless, the increased size may result in a drop in the effective ECSA and activity, as a consequence of the lower ratio of surface area to volume. However, it is possible to accept a slight loss in activity in exchange for the enhanced long-term stability of the catalyst. The next concept involves the creation of intricate multidimensional Pt nanostructures that exhibit resistance to migration, dissolution, and aggregation, in contrast to the isotropic nanoparticle. Using a metal with a greater oxidation potential to stabilize Pt, which is resistant to corrosion and sintering, is a promising strategy. Another potential technique is to provide a protective coating that prevents direct contact between a less resistant non-noble metal and a corrosive environment. However, achieving an optimized uniform coating, particularly carbon coating at high temperatures, remains difficult because of its potential to impede the effective interaction of reactants with the active sites. Although Pt has undergone size and structural improvements, it still faces significant challenges in terms of poor stability and increased cost. Hence, alloying is a more favorable option for enhancing durability against particle dissolving and reducing costs. While alloying procedures may be effective in meeting durability criteria, Pt alloys still have issues such as metal corrosion, leaching, and overflow of surface particles. These problems can result in redeposition and aggregation, resulting in a significant decline in activity. Similarly, alloying provides the opportunity to precisely adjust the composition, strain, or ligand effect at the surface, and enhance it with additional anti-corrosion components to safeguard against particle spillover under long-term circumstances. To make PGM-free materials economically viable, it is crucial to make considerable improvements in the performance of the Pt/C electrocatalyst, addressing issues such as Pt ripening, carbon corrosion, and agglomeration. Although there have been significant increases in ORR activity, the lack of molecular-level understanding or control of the iron active sites is now impeding future progress. The intricate and labor-intensive manufacturing techniques are expected to hinder the progress of MOF-based SACs with outstanding efficiency. Hence, to satisfy the need for electrochemical analysis results and, eventually, operational uses in energy technologies, it is necessary to search for convenient and inexpensive synthesis processes for the manufacturing of large-scale catalysts. However, there are still technological obstacles that must be overcome to create nanostructures that may be used in practical uses. The precise details of the reaction process and the specific active sites involved in the ORR are still not fully understood, especially when considering detailed simulations and theoretical calculations. The development of effective ORR EC continues to depend largely on experimental measurements and data. Hence, it is crucial to promote comprehensive and methodical theoretical investigation into the nanomaterial design and fabrication strategies of ORR EC for PEMFCs. The following conclusions and future perspectives were drawn from this review (I) Two different methodologies were utilized to study EC for the ORR in acidic conditions, including both theoretical and experimental approaches. The initial methodology involved employing computational design as a means of forecasting and examining a significant quantity of NPs. Afterward, the most favorable candidates for the ORR were created. The second method involved conducting experimental studies on NPs, followed by the use of computational chemistry to examine the molecular-level components that contribute to the enhancement of ORR electrocatalytic performance. (II) The slab and cluster techniques were applied at the theoretical level to simulate EC in the course of both theoretical and experimental research of metal EC based on platinum. Particularly noteworthy is the fact that the slab approach was utilized over the cluster approach more frequently. (III) Theoretical and empirical examinations of Pt EC have shown that the electrocatalytic performance and intermediates generated during the ORR process are greatly affected by various surface configurations of Pt. The study yielded significant findings that enhanced our comprehension of the function of support materials in the activity and durability of Pt EC for the ORR in acidic environments. (IV) A multitude of integrated theoretical and practical investigations have been carried out on EC composed of platinum and another metal for the ORR. An analysis was conducted on the impact of the second metal (strain, ligand, and ensemble effects) on the Pt surface employing a range of experimental methods and DFT simulations. Nevertheless, there is a dearth of theoretical and practical research investigating the performance and durability of Pt-based bimetallic catalysts when supported by innovative materials including CNTs, Gr, and hybrid supports. Hence, it is imperative for future studies to prioritize the investigation of this aspect, given the well-documented significance of support materials in influencing the performance and durability of EC. (V) Currently, there is a limited amount of research that examines the impact of size on catalytic activity and stability. This is mostly due to the difficulty in modeling NPs or clusters that are larger than 2 nm. (VI) Generally, DFT computations that make use of generalized gradient approximation functionals are utilized extensively in both experimental and theoretical research. Incorporating more complex approximations, such as hybrid functionals, is necessary to provide a description that is more accurate of the interaction that occurs between ORR species and metallic surfaces. Therefore, future research endeavors should prioritize the following aspects I. Additional progress in electrocatalytic efficiency is urgently required, specifically in acidic solutions. This imperative is essential to delve deeper into the fundamental catalytic mechanisms. II. NMP catalysts with electrochemically active surface area (ESA) nanostructures should be explored as a means to augment the ORR performance, to increase the number of active sites. III. The catalytic capabilities of metal-free EC rely on the introduction of heteroatoms into carbonaceous materials, which act as defects to improve catalytic efficiency. The development of a metal-free EC with a hierarchical porous structure can offer several advantages by offering various active sites. However, there is a requirement for easy fabrication approaches for this structure due to the lack of control over the existing pyrolysis process employed in its synthesis. Additional investigation is necessary to comprehend the characteristics of the active sites in the developing electrocatalyst to support its eventual widespread commercialization and use in catalyzing reactions in PEMFC. IV. The area of CPs has the potential for future growth in several aspects, including the creation of novel molecules, the exploration of new commercial applications, and the progress of basic research that enhances our understanding of materials. Electron-conducting polymers can be intentionally created to have the ability to expand, as indicated by the first statement. Furthermore, it is crucial to comprehend that most CPs function as hole transporters, indicating that the electron mobility in organic solids is equivalent to that of holes. Despite notable advancements, N-doped CPs have not yet attained the stability and conductivity levels of the P-doped polymers. It is crucial to develop synthetic methods for both new and old CPs. V. Theoretical calculations, coupled with experimental approaches, should be employed to uncover fundamental ORR mechanisms and identify active sites. This integrated approach facilitates the design of novel catalyst nanostructures. VI. MOF-based catalysts have been seldom taken into account for chemical synthesis, including CO2 reduction. MOF-based catalysts offer a straightforward means of achieving enhanced catalytic stability. There is a need to modify the catalytic activity and stability of MOF-based nanomaterials, especially in acidic electrolytes. There is a strong need for efficient and reliable nano-EC based on MOFs that possess certain properties for use in energy conversion applications. The primary driving force in the foreseeable future is the exploration of novel nanomaterials. The new nanomaterials must surpass the existing obstacles and must fulfill the following requirements. (a) The synthetic raw material and synthesis process is inexpensive. (b) The catalyst exhibits exceptional catalytic activity for the ORR and may be used in commercial applications. (c) The catalyst demonstrates stability that effectively maintains the performance of the commercial device over several years. (d) The catalyst has the potential to be scaled up for mass commercialization. Hence, future study needs further endeavors. VII. EC composed of single atoms requires extensive research and investigation. There is a strong need for detailed investigations and a methodical evaluation of the mechanisms involved in the ORR in basic and acidic electrolytic conditions. The preparation methods for various types of SACs are time-consuming. Thus, there is a significant need for universally applicable protocols that can be refined and enhanced to easily synthesize a wide range of SACs. This is a challenging task when it comes to producing SACs on a large scale for industrial purposes. The advancement of SACs utilizing non-precious metals is a highly intriguing and significant breakthrough due to its unique characteristics and affordability. Consequently, a more extensive experimental investigation is necessary to explore the potential of non-precious SACs as a promising avenue for future electrocatalysis advancements. It is required to use modern methodologies and theoretical calculations to comprehend the non-precious SAC and the electrocatalytic process of a single active site. Calculating the structure's SAC is crucial through theoretical measurements using a novel manufacturing process and an innovative catalytic system. Efforts are necessary to investigate the active SACs that exhibit commendable activity, prolonged durability, and affordable cost. Investigating SAC with improved characteristics is crucial for EC and its relevance to energy technology. VIII. Advancing the development of in-situ/high-resolution characterization methods, like XANES, EXAFS, HAADFSTEM, and XPS, to accurately determine electronic structure, surface species, atomic-level distribution, coordination information, and other relevant factors. Various methodologies can yield more precise elucidations of active site creation, facilitating a comprehensive comprehension of enhanced performance concerning activity, stability, and resistance. CRediT authorship contribution statement Mahdi Soleimani Moghaddam: Writing – review & editing, Writing – original draft, Visualization, Validation, Supervision, Conceptualization. Meysam Seyfi Kafshgari: Writing – review & editing, Writing – original draft, Visualization, Validation, Conceptualization. Ali Bahari: Conceptualization, Validation, Visualization, Writing – original draft, Writing – review & editing. Leila Asadi Kafshgari: Conceptualization, Validation, Visualization, Writing – original draft, Writing – review & editing. Adeleh Jafari: Conceptualization, Validation, Visualization, Writing – original draft, Writing – review & editing. Declaration of competing interest The authors declare that they have no known competing financial interests or personal relationships that could have appeared to influence the work reported in this paper. References [1] M. Asif T. Muneer Renew. Sustain. Energy Rev. 11 2007 1388 1413 M. Asif, T. Muneer, Renew. Sustain. Energy Rev. 11 (2007) 1388–1413. [2] Y. Lin L. Ma Z. Li W. Ni J. Clean. Prod. 421 2023 138536 Y. Lin, L. Ma, Z. Li, W. Ni, J. Clean. Prod. 421 (2023) 138536. [3] U. Caldera A. Gulagi N. Jayasinghe C. Breyer Renew. Energy 218 2023 119261 U. Caldera, A. Gulagi, N. Jayasinghe, C. Breyer, Renew. Energy 218 (2023) 119261. [4] P. Achakulwisut P. Erickson C. Guivarch R. Schaeffer E. Brutschin S. Pye Nat. Commun. 14 2023 5425 P. Achakulwisut, P. Erickson, C. Guivarch, R. Schaeffer, E. Brutschin, S. Pye, Nat. Commun. 14 (2023) 5425. [5] T. Yusaf A.S.F. Mahamude K. Kadirgama D. Ramasamy K. Farhana H.A. Dhahad A.B.D.R.A. Talib Int. J. Hydrogen Energy 52 2024 1026 1045 T. Yusaf, A.S.F. Mahamude, K. Kadirgama, D. Ramasamy, K. Farhana, H.A. Dhahad, A.B.D.R.A. Talib, Int. J. Hydrogen Energy 52 (2024) 1026–1045. [6] Q. Hassan A.Z. Sameen H.M. Salman M. Jaszczur A.K. Al-Jiboory J. Energy Storage 72 2023 108404 Q. Hassan, A.Z. Sameen, H.M. Salman, M. Jaszczur, A.K. Al-Jiboory, J. Energy Storage 72 (2023) 108404. [7] I. Dincer M.I. Aydin Energy Convers. Manag. 283 2023 116950 I. Dincer, M.I. Aydin, Energy Convers. Manag. 283 (2023) 116950. [8] N. Sazali Int. J. Hydrogen Energy 45 2020 18753 18771 N. Sazali, Int. J. Hydrogen Energy 45 (2020) 18753–18771. [9] J.M. Linge H. Erikson M. Mooste H.-M. Piirsoo T. Kaljuvee A. Kikas J. Aruväli V. Kisand A. Tamm A.M. Kannan Int. J. Hydrogen Energy 48 2023 11058 11070 J.M. Linge, H. Erikson, M. Mooste, H.-M. Piirsoo, T. Kaljuvee, A. Kikas, J. Aruväli, V. Kisand, A. Tamm, A.M. Kannan, Int. J. Hydrogen Energy 48 (2023) 11058–11070. [10] K. Muuli A. Sokka M. Mooste J. Lilloja V. Gudkova M. Käärik M. Otsus A. Kikas V. Kisand A. Tamm J. Catal. 422 2023 117 130 K. Muuli, A. Sokka, M. Mooste, J. Lilloja, V. Gudkova, M. Käärik, M. Otsus, A. Kikas, V. Kisand, A. Tamm, J. Catal. 422 (2023) 117–130. [11] D. He H. Tang Z. Kou M. Pan X. Sun J. Zhang S. Mu Adv. Mater. 29 2017 1601741 D. He, H. Tang, Z. Kou, M. Pan, X. Sun, J. Zhang, S. Mu, Adv. Mater. 29 (2017) 1601741. [12] I.S. Lim Y. Il Lee B. Kang J.Y. Park M.S. Kim Electrochim. Acta 421 2022 140509 I.S. Lim, Y. Il Lee, B. Kang, J.Y. Park, M.S. Kim, Electrochim. Acta 421 (2022) 140509. [13] D.-H. Lee G.-T. Yun G. Doo S. Yuk H. Guim Y. Kim W.-B. Jung H.-T. Jung H.-T. Kim Nano Lett. 22 2022 1174 1182 D.-H. Lee, G.-T. Yun, G. Doo, S. Yuk, H. Guim, Y. Kim, W.-B. Jung, H.-T. Jung, H.-T. Kim, Nano Lett. 22 (2022) 1174–1182. [14] S. Zaman L. Huang A.I. Douka H. Yang B. You B.Y. Xia Angew. Chemie 133 2021 17976 17996 S. Zaman, L. Huang, A.I. Douka, H. Yang, B. You, B.Y. Xia, Angew. Chemie 133 (2021) 17976–17996. [15] S. Iida K. Sakata Clean Energy 3 2019 105 113 S. Iida, K. Sakata, Clean Energy 3 (2019) 105–113. [16] M.H. de Sá C.S. Moreira A.M.F.R. Pinto V.B. Oliveira Energies 15 2022 6335 M.H. de Sá, C.S. Moreira, A.M.F.R. Pinto, V.B. Oliveira, Energies 15 (2022) 6335. [17] N.F. Raduwan N. Shaari S.K. Kamarudin M.S. Masdar R.M. Yunus Int. J. Hydrogen Energy 47 2022 18468 18495 N.F. Raduwan, N. Shaari, S.K. Kamarudin, M.S. Masdar, R.M. Yunus, Int. J. Hydrogen Energy 47 (2022) 18468–18495. [18] L. Zhao J. Zhu Y. Zheng M. Xiao R. Gao Z. Zhang G. Wen H. Dou Y. Deng A. Yu Adv. Energy Mater. 12 2022 2102665 L. Zhao, J. Zhu, Y. Zheng, M. Xiao, R. Gao, Z. Zhang, G. Wen, H. Dou, Y. Deng, A. Yu, Adv. Energy Mater. 12 (2022) 2102665. [19] J.M. Desantes R. Novella B. Pla M. Lopez-Juarez Appl. Energy 317 2022 119137 J.M. Desantes, R. Novella, B. Pla, M. Lopez-Juarez, Appl. Energy 317 (2022) 119137. [20] T. Chu M. Xie Y. Yu B. Wang D. Yang B. Li P. Ming C. Zhang Energy 239 2022 122356 T. Chu, M. Xie, Y. Yu, B. Wang, D. Yang, B. Li, P. Ming, C. Zhang, Energy 239 (2022) 122356. [21] J. Wang Appl. Energy 189 2017 460 479 J. Wang, Appl. Energy 189 (2017) 460–479. [22] M. Jouin R. Gouriveau D. Hissel M.-C. Péra N. Zerhouni Reliab. Eng. Syst. Saf. 148 2016 78 95 M. Jouin, R. Gouriveau, D. Hissel, M.-C. Péra, N. Zerhouni, Reliab. Eng. Syst. Saf. 148 (2016) 78–95. [23] R.A. Silva T. Hashimoto G.E. Thompson C.M. Rangel Int. J. Hydrogen Energy 37 2012 7299 7308 R.A. Silva, T. Hashimoto, G.E. Thompson, C.M. Rangel, Int. J. Hydrogen Energy 37 (2012) 7299–7308. [24] L. Dubau L. Castanheira F. Maillard M. Chatenet O. Lottin G. Maranzana J. Dillet A. Lamibrac J. Perrin E. Moukheiber Wiley Interdiscip. Rev. Energy Environ. 3 2014 540 560 L. Dubau, L. Castanheira, F. Maillard, M. Chatenet, O. Lottin, G. Maranzana, J. Dillet, A. Lamibrac, J. Perrin, E. Moukheiber, Wiley Interdiscip. Rev. Energy Environ. 3 (2014) 540–560. [25] G.-B. Jung H.-H. Chen W.-M. Yan J. Power Sources 247 2014 354 359 G.-B. Jung, H.-H. Chen, W.-M. Yan, J. Power Sources 247 (2014) 354–359. [26] M. Zatoń J. Rozière D.J. Jones Sustain. Energy Fuels 1 2017 409 438 M. Zatoń, J. Rozière, D.J. Jones, Sustain. Energy Fuels 1 (2017) 409–438. [27] I. Vincent A. Kruger D. Bessarabov Int. J. Hydrogen Energy 42 2017 10752 10761 I. Vincent, A. Kruger, D. Bessarabov, Int. J. Hydrogen Energy 42 (2017) 10752–10761. [28] M. Chen C. Zhao F. Sun J. Fan H. Li H. Wang ETransportation 5 2020 100075 M. Chen, C. Zhao, F. Sun, J. Fan, H. Li, H. Wang, ETransportation 5 (2020) 100075. [29] J. Hou M. Yang C. Ke G. Wei C. Priest Z. Qiao G. Wu J. Zhang EnergyChem 2 2020 100023 J. Hou, M. Yang, C. Ke, G. Wei, C. Priest, Z. Qiao, G. Wu, J. Zhang, EnergyChem 2 (2020) 100023. [30] J. Wang W. Yang J. Geng Z. Shao W. Song Chinese J. Chem. Eng. 56 2023 70 79 J. Wang, W. Yang, J. Geng, Z. Shao, W. Song, Chinese J. Chem. Eng. 56 (2023) 70–79. [31] A. Tan Y. Zhang X. Shi C. Ju P. Liu T. Yang J. Liu Chem. Eng. J. 471 2023 144624 A. Tan, Y. Zhang, X. Shi, C. Ju, P. Liu, T. Yang, J. Liu, Chem. Eng. J. 471 (2023) 144624. [32] Z. Li Y. Wang Y. Mu B. Wu Y. Jiang L. Zeng T. Zhao Renew. Sustain. Energy Rev. 176 2023 113182 Z. Li, Y. Wang, Y. Mu, B. Wu, Y. Jiang, L. Zeng, T. Zhao, Renew. Sustain. Energy Rev. 176 (2023) 113182. [33] K. Meng B. Chen H. Zhou J. Shen Z. Tu Energy Convers. Manag. 268 2022 115973 K. Meng, B. Chen, H. Zhou, J. Shen, Z. Tu, Energy Convers. Manag. 268 (2022) 115973. [34] P.C. Okonkwo C. Otor Int. J. Energy Res. 45 2021 3780 3800 P.C. Okonkwo, C. Otor, Int. J. Energy Res. 45 (2021) 3780–3800. [35] L. Cindrella A.M. Kannan J.F. Lin K. Saminathan Y. Ho C.W. Lin J. Wertz J. Power Sources 194 2009 146 160 L. Cindrella, A.M. Kannan, J.F. Lin, K. Saminathan, Y. Ho, C.W. Lin, J. Wertz, J. Power Sources 194 (2009) 146–160. [36] G. Athanasaki A. Jayakumar A.M. Kannan Int. J. Hydrogen Energy 48 2023 2294 2313 G. Athanasaki, A. Jayakumar, A.M. Kannan, Int. J. Hydrogen Energy 48 (2023) 2294–2313. [37] Y. Ke W. Yuan Q. Liu F. Zhou W. Guo Z. Lin X. Li J. Li S. Zhang Y. Tang Mater. Des. 233 2023 112261 Y. Ke, W. Yuan, Q. Liu, F. Zhou, W. Guo, Z. Lin, X. Li, J. Li, S. Zhang, Y. Tang, Mater. Des. 233 (2023) 112261. [38] X. Wei R.-Z. Wang W. Zhao G. Chen M.-R. Chai L. Zhang J. Zhang Energy Chem. 3 2021 100061 X. Wei, R.-Z. Wang, W. Zhao, G. Chen, M.-R. Chai, L. Zhang, J. Zhang, Energy Chem 3 (2021) 100061. [39] A.G. Oshchepkov G. Braesch A. Bonnefont E.R. Savinova M. Chatenet ACS Catal. 10 2020 7043 7068 A.G. Oshchepkov, G. Braesch, A. Bonnefont, E.R. Savinova, M. Chatenet, ACS Catal. 10 (2020) 7043–7068. [40] H. Liu J. Zhao X. Li Electrochem. Energy Rev. 5 2022 13 H. Liu, J. Zhao, X. Li, Electrochem. Energy Rev. 5 (2022) 13. [41] P. Schneider M. Batool A.O. Godoy R. Singh D. Gerteisen J. Jankovic N. Zamel J. Electrochem. Soc. 170 2023 24506 P. Schneider, M. Batool, A.O. Godoy, R. Singh, D. Gerteisen, J. Jankovic, N. Zamel, J. Electrochem. Soc. 170 (2023) 24506. [42] F. Liu P. Wei J. Zhang M. Shi J. Hou H. Chen Y. Li S. Li Carbon 216 2024 118562 F. Liu, P. Wei, J. Zhang, M. Shi, J. Hou, H. Chen, Y. Li, S. Li, Carbon 216 (2024) 118562. [43] K. Sakthivel Y.-Y. Lee B. Sriram S.-F. Wang M. George G.-P. Chang-Chien J.-K. Sheu Angew. Chemie 2023 10.1002/ange.202311806 K. Sakthivel, Y.-Y. Lee, B. Sriram, S.-F. Wang, M. George, G.-P. Chang-Chien, J.-K. Sheu, Angew. Chemie (2023). DOI: 10.1002/ange.202311806. [44] E. Hornberger T. Merzdorf H. Schmies J. Hübner M. Klingenhof U. Gernert M. Kroschel B. Anke M. Lerch J. Schmidt ACS Appl. Mater. Interfaces 14 2022 18420 18430 E. Hornberger, T. Merzdorf, H. Schmies, J. Hübner, M. Klingenhof, U. Gernert, M. Kroschel, B. Anke, M. Lerch, J. Schmidt, ACS Appl. Mater. Interfaces 14 (2022) 18420–18430. [45] S. Jayabal G. Saranya D. Geng L.-Y. Lin X. Meng J. Mater. Chem. A 8 2020 9420 9446 S. Jayabal, G. Saranya, D. Geng, L.-Y. Lin, X. Meng, J. Mater. Chem. A 8 (2020) 9420–9446. [46] R.L. Borup A. Kusoglu K.C. Neyerlin R. Mukundan R.K. Ahluwalia D.A. Cullen K.L. More A.Z. Weber D.J. Myers Curr. Opin. Electrochem. 21 2020 192 200 R.L. Borup, A. Kusoglu, K.C. Neyerlin, R. Mukundan, R.K. Ahluwalia, D.A. Cullen, K.L. More, A.Z. Weber, D.J. Myers, Curr. Opin. Electrochem. 21 (2020) 192–200. [47] D. Fofana S.K. Natarajan J. Hamelin P. Benard Energy 64 2014 398 403 D. Fofana, S.K. Natarajan, J. Hamelin, P. Benard, Energy 64 (2014) 398–403. [48] Y. Li H. Wang C. Priest S. Li P. Xu G. Wu Adv. Mater. 33 2021 2000381 Y. Li, H. Wang, C. Priest, S. Li, P. Xu, G. Wu, Adv. Mater. 33 (2021) 2000381. [49] M. Asif S.S. Bibi S. Ahmed M. Irshad M.S. Hussain H. Zeb M.K. Khan J. Kim Chem. Eng. J. 473 2023 145381 M. Asif, S.S. Bibi, S. Ahmed, M. Irshad, M.S. Hussain, H. Zeb, M.K. Khan, J. Kim, Chem. Eng. J. 473 (2023) 145381. [50] Z. Shi Q. Peng H. Wang Z. Huang H. Liu X. Tian F. Yan R. Yin Fuel Process. Technol. 252 2023 108000 Z. Shi, Q. Peng, H. Wang, Z. Huang, H. Liu, X. Tian, F. Yan, R. Yin, Fuel Process. Technol. 252 (2023) 108000. [51] W.L. Orr, J.S. Sinninghe Damsté, in: ACS Publications, 1990. https://doi.org/10.1021/bk-1990-0429.ch001. [52] D. Soyez J.-Y. Toullec C. Ollivaux G. Géraud J. Biol. Chem. 275 2000 37870 37875 D. Soyez, J.-Y. Toullec, C. Ollivaux, G. Géraud, J. Biol. Chem. 275 (2000) 37870–37875. [53] Y. Qiao S.-J. Bao C.M. Li Energ. Environ. Sci. 3 2010 544 553 Y. Qiao, S.-J. Bao, C.M. Li, Energy Environ. Sci. 3 (2010) 544–553. [54] X. Cui S. Lei A.C. Wang L. Gao Q. Zhang Y. Yang Z. Lin Nano Energy 70 2020 104525 X. Cui, S. Lei, A.C. Wang, L. Gao, Q. Zhang, Y. Yang, Z. Lin, Nano Energy 70 (2020) 104525. [55] J. Zhao J. Lian Z. Zhao X. Wang J. Zhang Nano-Micro Lett. 15 2023 19 J. Zhao, J. Lian, Z. Zhao, X. Wang, J. Zhang, Nano-Micro Lett. 15 (2023) 19. [56] C. Shao M. Luo H. Song S. Zhang F. Wang X. Liu Z. Huang Energy Fuel 37 2023 4026 4037 C. Shao, M. Luo, H. Song, S. Zhang, F. Wang, X. Liu, Z. Huang, Energy & Fuels 37 (2023) 4026–4037. [57] X. Zou M. Tang Q. Lu Y. Wang Z. Shao L. An Energ. Environ. Sci. 2023 10.1039/D3EE03059H X. Zou, M. Tang, Q. Lu, Y. Wang, Z. Shao, L. An, Energy Environ. Sci. (2023). DOI: 10.1039/D3EE03059H [58] T. Lastovina A. Bugaev A. Fedorenko A. Nikolskiy A. Kozakov A. Anokhin W. Yohannes A. Budnyk Int. J. Hydrogen Energy 51 2023 1161 1168 T. Lastovina, A. Bugaev, A. Fedorenko, A. Nikolskiy, A. Kozakov, A. Anokhin, W. Yohannes, A. Budnyk, Int. J. Hydrogen Energy 51 (2023) 1161–1168. [59] M. Bu Y. Liu S. Liao W. Liu Z. Yang J. Jiang X. Gao Y. Yang H. Liu Carbon 214 2023 118365 M. Bu, Y. Liu, S. Liao, W. Liu, Z. Yang, J. Jiang, X. Gao, Y. Yang, H. Liu, Carbon 214 (2023) 118365. [60] Z. Chen D. Higgins A. Yu L. Zhang J. Zhang Energy Environ. Sci. 4 2011 3167 3192 Z. Chen, D. Higgins, A. Yu, L. Zhang, J. Zhang, Energy Environ. Sci. 4 (2011) 3167–3192. [61] M. Kiani J. Zhang Y. Luo C. Jiang J. Fan G. Wang J. Chen R. Wang J. Energy Chem. 27 2018 1124 1139 M. Kiani, J. Zhang, Y. Luo, C. Jiang, J. Fan, G. Wang, J. Chen, R. Wang, J. Energy Chem. 27 (2018) 1124–1139. [62] W. Tang S. Wang S. Li S. Yu X. Yuan C. Yang W. Li Next Mater. 4 2023 100062 W. Tang, S. Wang, S. Li, S. Yu, X. Yuan, C. Yang, W. Li, Next Mater. 4 (2023) 100062. [63] N.F.H. Nik Zaiman N. Shaari N.A.M. Harun Int. J. Energy Res. 46 2022 471 504 N.F.H. Nik Zaiman, N. Shaari, N.A.M. Harun, Int. J. Energy Res. 46 (2022) 471–504. [64] D. Kulkarni A. Huynh P. Satjaritanun M. O’Brien S. Shimpalee D. Parkinson P. Shevchenko F. DeCarlo N. Danilovic K.E. Ayers Appl. Catal. B Environ. 308 2022 121213 D. Kulkarni, A. Huynh, P. Satjaritanun, M. O’Brien, S. Shimpalee, D. Parkinson, P. Shevchenko, F. DeCarlo, N. Danilovic, K.E. Ayers, Appl. Catal. B Environ. 308 (2022) 121213. [65] F. Van Der Linden E. Pahon S. Morando D. Bouquain J. Power Sources 575 2023 233168 F. Van Der Linden, E. Pahon, S. Morando, D. Bouquain, J. Power Sources 575 (2023) 233168. [66] M. Bazaid Y. Huang W.A. Goddard III S.S. Jang Colloids Surfaces A Physicochem. Eng. Asp. 676 2023 132187 M. Bazaid, Y. Huang, W.A. Goddard III, S.S. Jang, Colloids Surfaces A Physicochem. Eng. Asp. 676 (2023) 132187. [67] T. Omasta, University of Connecticut, Doctoral Dissertations, 2018. https://digitalcommons.lib.uconn.edu/dissertations/1808. [68] C. Zhang Y. Zhang L. Wang X. Deng Y. Liu J. Zhang Renew. Sustain. Energy Rev. 182 2023 113369 C. Zhang, Y. Zhang, L. Wang, X. Deng, Y. Liu, J. Zhang, Renew. Sustain. Energy Rev. 182 (2023) 113369. [69] G. Sasikumar J.W. Ihm H. Ryu J. Power Sources 132 2004 11 17 G. Sasikumar, J.W. Ihm, H. Ryu, J. Power Sources 132 (2004) 11–17. [70] D. Chen A. Kongkanand J. Jorne J. Electrochem. Soc. 166 2019 F24 D. Chen, A. Kongkanand, J. Jorne, J. Electrochem. Soc. 166 (2019) F24. [71] A. Kongkanand M.F. Mathias J. Phys. Chem. Lett. 7 2016 1127 1137 A. Kongkanand, M.F. Mathias, J. Phys. Chem. Lett. 7 (2016) 1127–1137. [72] A. Orfanidi P. Madkikar H.A. El-Sayed G.S. Harzer T. Kratky H.A. Gasteiger J. Electrochem. Soc. 164 2017 F418 A. Orfanidi, P. Madkikar, H.A. El-Sayed, G.S. Harzer, T. Kratky, H.A. Gasteiger, J. Electrochem. Soc. 164 (2017) F418. [73] I.V. Zenyuk P.K. Das A.Z. Weber J. Electrochem. Soc. 163 2016 F691 I. V Zenyuk, P.K. Das, A.Z. Weber, J. Electrochem. Soc. 163 (2016) F691. [74] M.B. Sassin Y. Garsany R.W. Atkinson Iii R.M.E. Hjelm K.E. Swider-Lyons Int. J. Hydrogen Energy 44 2019 16944 16955 M.B. Sassin, Y. Garsany, R.W. Atkinson Iii, R.M.E. Hjelm, K.E. Swider-Lyons, Int. J. Hydrogen Energy 44 (2019) 16944–16955. [75] S. Shimpalee V. Lilavivat H. Xu J.R. Rowlett C. Mittelsteadt J.W. Van Zee J. Electrochem. Soc. 165 2018 F1019 S. Shimpalee, V. Lilavivat, H. Xu, J.R. Rowlett, C. Mittelsteadt, J.W. Van Zee, J. Electrochem. Soc. 165 (2018) F1019. [76] A. Bayrakçeken S. Erkan L. Türker İ. Eroğlu Int. J. Hydrogen Energy 33 2008 165 170 A. Bayrakçeken, S. Erkan, L. Türker, İ. Eroğlu, Int. J. Hydrogen Energy 33 (2008) 165–170. [77] K. Ayers Curr. Opin. Electrochem. 18 2019 9 15 K. Ayers, Curr. Opin. Electrochem. 18 (2019) 9–15. [78] A. Ferrara P. Polverino C. Pianese J. Power Sources 390 2018 197 207 A. Ferrara, P. Polverino, C. Pianese, J. Power Sources 390 (2018) 197–207. [79] R.A. Alawajji G.K. Kannarpady A.S. Biris Appl. Surf. Sci. 444 2018 208 215 R.A. Alawajji, G.K. Kannarpady, A.S. Biris, Appl. Surf. Sci. 444 (2018) 208–215. [80] T. Li J. Shen G. Chen S. Guo G. Xie ACS Omega 5 2020 17628 17636 T. Li, J. Shen, G. Chen, S. Guo, G. Xie, ACS Omega 5 (2020) 17628–17636. [81] Q. Liu F. Lan J. Chen C. Zeng J. Wang J. Power Sources 517 2022 230723 Q. Liu, F. Lan, J. Chen, C. Zeng, J. Wang, J. Power Sources 517 (2022) 230723. [82] R. Omrani B. Shabani Int. J. Hydrogen Energy 42 2017 28515 28536 R. Omrani, B. Shabani, Int. J. Hydrogen Energy 42 (2017) 28515–28536. [83] S.A. Atyabi E. Afshari J. Clean. Prod. 214 2019 738 748 S.A. Atyabi, E. Afshari, J. Clean. Prod. 214 (2019) 738–748. [84] A. Jayakumar S.P. Sethu M. Ramos J. Robertson A. Al-Jumaily Ionics (Kiel). 21 2015 1 18 A. Jayakumar, S.P. Sethu, M. Ramos, J. Robertson, A. Al-Jumaily, Ionics (Kiel). 21 (2015) 1–18. [85] H. Shao D. Qiu L. Peng P. Yi X. Lai J. Power Sources 412 2019 717 724 H. Shao, D. Qiu, L. Peng, P. Yi, X. Lai, J. Power Sources 412 (2019) 717–724. [86] T. Thampan S. Malhotra H. Tang R. Datta J. Electrochem. Soc. 147 2000 3242 T. Thampan, S. Malhotra, H. Tang, R. Datta, J. Electrochem. Soc. 147 (2000) 3242. [87] A.Z. Weber J. Newman J. Electrochem. Soc. 152 2005 A677 A.Z. Weber, J. Newman, J. Electrochem. Soc. 152 (2005) A677. [88] J.T. Gostick M.A. Ioannidis M.W. Fowler M.D. Pritzker Electrochem. Commun. 11 2009 576 579 J.T. Gostick, M.A. Ioannidis, M.W. Fowler, M.D. Pritzker, Electrochem. Commun. 11 (2009) 576–579. [89] E. Tardy F. Courtois M. Chandesris J.-P. Poirot-Crouvezier A. Morin Y. Bultel Int. J. Heat Mass Transf. 145 2019 118720 E. Tardy, F. Courtois, M. Chandesris, J.-P. Poirot-Crouvezier, A. Morin, Y. Bultel, Int. J. Heat Mass Transf. 145 (2019) 118720. [90] S. Latorrata P.G. Stampino C. Cristiani G. Dotelli Int. J. Hydrogen Energy 39 2014 5350 5357 S. Latorrata, P.G. Stampino, C. Cristiani, G. Dotelli, Int. J. Hydrogen Energy 39 (2014) 5350–5357. [91] A. Öztürk B. Fıçıcılar İ. Eroğlu A.B. Yurtcan Int. J. Hydrogen Energy 42 2017 21226 21249 A. Öztürk, B. Fıçıcılar, İ. Eroğlu, A.B. Yurtcan, Int. J. Hydrogen Energy 42 (2017) 21226–21249. [92] T. Kitahara H. Nakajima M. Inamoto K. Shinto J. Power Sources 248 2014 1256 1263 T. Kitahara, H. Nakajima, M. Inamoto, K. Shinto, J. Power Sources 248 (2014) 1256–1263. [93] J. Ma X. Zhang Z. Jiang H. Ostadi K. Jiang R. Chen Fuel 136 2014 307 315 J. Ma, X. Zhang, Z. Jiang, H. Ostadi, K. Jiang, R. Chen, Fuel 136 (2014) 307–315. [94] R. Alink J. Haußmann H. Markötter M. Schwager I. Manke D. Gerteisen J. Power Sources 233 2013 358 368 R. Alink, J. Haußmann, H. Markötter, M. Schwager, I. Manke, D. Gerteisen, J. Power Sources 233 (2013) 358–368. [95] A. Dessalle J. Quílez-Bermejo V. Fierro F. Xu A. Celzard Carbon 203 2023 237 260 A. Dessalle, J. Quílez-Bermejo, V. Fierro, F. Xu, A. Celzard, Carbon 203 (2023) 237–260. [96] M.A. Basyooni M. Kabatas Nanomaterials 13 2023 2966 M.A. Basyooni-M. Kabatas, Nanomaterials 13 (2023) 2966. [97] A. Yao-Lin Z.-Y. Du H.-J. Ze X.-T. Wang Y. Zhang H. Zhang Q.-N. Zheng J.-C. Dong J.-H. Tian J.-F. Li Curr. Opin. Electrochem. 42 2023 101381 A. Yao-Lin, Z.-Y. Du, H.-J. Ze, X.-T. Wang, Y. Zhang, H. Zhang, Q.-N. Zheng, J.-C. Dong, J.-H. Tian, J.-F. Li, Curr. Opin. Electrochem. 42(2023) 101381. [98] K. Dhanabalan M. Perumalsamy G. Sriram N. Murugan T. Sadhasivam T.H. Oh Energies 16 2023 4950 K. Dhanabalan, M. Perumalsamy, G. Sriram, N. Murugan, T. Sadhasivam, T.H. Oh, Energies 16 (2023) 4950. [99] S. Xue W. Ryan Osterloh X. Lv N. Liu Y. Gao H. Lei Y. Fang Z. Sun P. Mei D. Kuzuhara Angew. Chemie Int. Ed. 62 2023 e202218567 S. Xue, W. Ryan Osterloh, X. Lv, N. Liu, Y. Gao, H. Lei, Y. Fang, Z. Sun, P. Mei, D. Kuzuhara, Angew. Chemie Int. Ed. 62 (2023) e202218567. [100] K. Kisand A. Sarapuu J.C. Douglin A. Kikas A. Treshchalov M. Käärik H.-M. Piirsoo P. Paiste J. Aruväli J. Leis ACS Catal. 12 2022 14050 14061 K. Kisand, A. Sarapuu, J.C. Douglin, A. Kikas, A. Treshchalov, M. Käärik, H.-M. Piirsoo, P. Paiste, J. Aruväli, J. Leis, Acs Catal. 12 (2022) 14050–14061. [101] M. Li P. Song M. Hou W. Feng D. Zhao J. Zhang Chem. Eng. J. 479 2023 147608 M. Li, P. Song, M. Hou, W. Feng, D. Zhao, J. Zhang, Chem. Eng. J. 479 (2023) 147608. [102] H. Peng J. Liu H. Yang L. Sun K.S. Novoselov H. Wu Y. Yang Y. Zou H. Zhang F. Xu ACS Appl. Nano Mater. 6 2023 17826 17837 H. Peng, J. Liu, H. Yang, L. Sun, K.S. Novoselov, H. Wu, Y. Yang, Y. Zou, H. Zhang, F. Xu, ACS Appl. Nano Mater. 6 (2023) 17826–17837. [103] Y. Xie X. Chen K. Sun J. Zhang W. Lai H. Liu G. Wang Angew. Chemie Int. Ed. 62 2023 e202301833 Y. Xie, X. Chen, K. Sun, J. Zhang, W. Lai, H. Liu, G. Wang, Angew. Chemie Int. Ed. 62 (2023) e202301833. [104] M.T.M. Koper Chem. Sci. 4 2013 2710 2723 M.T.M. Koper, Chem. Sci. 4 (2013) 2710–2723. [105] J.H. Zagal S. Specchia P. Atanassov Curr. Opin. Electrochem. 27 2021 100683 J.H. Zagal, S. Specchia, P. Atanassov, Curr. Opin. Electrochem. 27 (2021) 100683. [106] R.A. Matute A. Toro-Labbé M.P. Oyarzún S. Ramirez D.E. Ortega K. Oyarce N. Silva J.H. Zagal Electrochim. Acta 391 2021 138905 R.A. Matute, A. Toro-Labbé, M.P. Oyarzún, S. Ramirez, D.E. Ortega, K. Oyarce, N. Silva, J.H. Zagal, Electrochim. Acta 391 (2021) 138905. [107] M. Luo M.T.M. Koper Nat. Catal. 5 2022 615 623 M. Luo, M.T.M. Koper, Nat. Catal. 5 (2022) 615–623. [108] N. Silva S. Calderón M.A. Páez M.P. Oyarzún M.T.M. Koper J.H. Zagal J. Electroanal. Chem. 819 2018 502 510 N. Silva, S. Calderón, M.A. Páez, M.P. Oyarzún, M.T.M. Koper, J.H. Zagal, J. Electroanal. Chem. 819 (2018) 502–510. [109] V.C.A. Ficca C. Santoro E. Placidi F. Arciprete A. Serov P. Atanassov B. Mecheri ACS Catal. 13 2023 2162 2175 V.C.A. Ficca, C. Santoro, E. Placidi, F. Arciprete, A. Serov, P. Atanassov, B. Mecheri, ACS Catal. 13 (2023) 2162–2175. [110] N. Bhuvanendran S. Ravichandran Q. Xu T. Maiyalagan H. Su Int. J. Hydrogen Energy 47 2022 7113 7138 N. Bhuvanendran, S. Ravichandran, Q. Xu, T. Maiyalagan, H. Su, Int. J. Hydrogen Energy 47 (2022) 7113–7138. [111] L. Jin C. Liu D. Wang M. Liu T.G. Lee S.G. Peera X. Qi Appl. Surf. Sci. 610 2023 155580 L. Jin, C. Liu, D. Wang, M. Liu, T.G. Lee, S.G. Peera, X. Qi, Appl. Surf. Sci. 610 (2023) 155580. [112] L. Wang R.M. Ore P.K. Jayamaha Z.-P. Wu C.-J. Zhong Faraday Discuss. 242 2023 429 442 L. Wang, R.M. Ore, P.K. Jayamaha, Z.-P. Wu, C.-J. Zhong, Faraday Discuss. 242 (2023) 429–442. [113] M. Liu T.-C. Yang Z. Pan J. Lee L. An B. Qiu H. Yin C.-M. Yang L.Y.S. Lee ACS Energy Lett. 8 2023 1652 1661 M. Liu, T.-C. Yang, Z. Pan, J. Lee, L. An, B. Qiu, H. Yin, C.-M. Yang, L.Y.S. Lee, ACS Energy Lett. 8 (2023) 1652–1661. [114] L. Wang Z. Mei Q. An X. Sheng Q. Jing W. Huang X. Wang X. Zou H. Guo Chem Catal. 3 2023 100758 L. Wang, Z. Mei, Q. An, X. Sheng, Q. Jing, W. Huang, X. Wang, X. Zou, H. Guo, Chem Catal. 3 (2023) 100758. [115] S. Tosoni G. Di Liberto I. Matanovic G. Pacchioni J. Power Sources 556 2023 232492 S. Tosoni, G. Di Liberto, I. Matanovic, G. Pacchioni, J. Power Sources 556 (2023) 232492. [116] S.N. Upadhyay D. Halba L. Yadav S. Pakhira Langmuir 39 2023 17700 17712 S.N. Upadhyay, D. Halba, L. Yadav, S. Pakhira, Langmuir 39 (2023) 17700–17712. [117] A.A. Rajhi H.S. Majdi C.-Y. Hsu A. Kumar A.G. Taki A.A. Duhduh S. Alamri I.A.K. Jassem M.M. Kadhim Fuel 357 2024 129784 A.A. Rajhi, H.S. Majdi, C.-Y. Hsu, A. Kumar, A.G. Taki, A.A. Duhduh, S. Alamri, I.A.K. Jassem, M.M. Kadhim, Fuel 357 (2024) 129784. [118] F. Xu Z. Gao Z. Ge H. Ma H. Ren H. Zhu Y. Chi W. Guo W. Zhao Phys. Chem. Chem. Phys. 25 2023 17508 17514 F. Xu, Z. Gao, Z. Ge, H. Ma, H. Ren, H. Zhu, Y. Chi, W. Guo, W. Zhao, Phys. Chem. Chem. Phys. 25 (2023) 17508-17514. [119] Y. Zhu Z. Wang Catal. Lett. 154 2023 2464 2474 Y. Zhu, Z. Wang, Catal. Letters 154 (2023) 2464–2474. [120] N. Helsel P. Choudhury Adv. Mater. Interfaces 10 2023 2202132 N. Helsel, P. Choudhury, Adv. Mater. Interfaces 10 (2023) 2202132. [121] L. Lin X. Long X. Yang P. Shi L. Su Phys. Chem. Chem. Phys. 25 2023 24721 24732 L. Lin, X. Long, X. Yang, P. Shi, L. Su, Phys. Chem. Chem. Phys. 25 (2023) 24721–24732. [122] L. Yan C. Wang Y. Wang Y. Wang Z. Wang L. Zheng Y. Lu R. Wang G. Chen Appl. Catal. B Environ. 338 2023 123078 L. Yan, C. Wang, Y. Wang, Y. Wang, Z. Wang, L. Zheng, Y. Lu, R. Wang, G. Chen, Appl. Catal. B Environ. 338 (2023) 123078. [123] X. Lin X. Zhang D. Liu L. Shi L. Zhao Y. Long L. Dai Adv. Energy Mater. 14 2024 2303740 X. Lin, X. Zhang, D. Liu, L. Shi, L. Zhao, Y. Long, L. Dai, Adv. Energy Mater. 14 (2024) 2303740. [124] Y. Shi S. Zhou J. Liu X. Zhang J. Yin T. Zhan Y. Yang G. Li J. Lai L. Wang Appl. Catal. B Environ. 341 2024 123326 Y. Shi, S. Zhou, J. Liu, X. Zhang, J. Yin, T. Zhan, Y. Yang, G. Li, J. Lai, L. Wang, Appl. Catal. B Environ. 341 (2024) 123326. [125] Y.-C. Feng X. Wang Y.-Q. Wang H.-J. Yan D. Wang J. Electrochem. 28 2022 2108531 Y.-C. Feng, X. Wang, Y.-Q. Wang, H.-J. Yan, D. Wang, J. Electrochem. 28 (2022) 2108531. [126] Y.-Q. Wang X.-H. Dan Z.-Y. Yi X. Wang Y.-C. Feng Y. Feng D. Wang L.-J. Wan J. Phys. Chem. C 127 2023 2929 2935 Y.-Q. Wang, X.-H. Dan, Z.-Y. Yi, X. Wang, Y.-C. Feng, Y. Feng, D. Wang, L.-J. Wan, J. Phys. Chem. C 127 (2023) 2929–2935. [127] E. Borfecchia C. Garino D. Gianolio L. Salassa R. Gobetto C. Lamberti Catal. Today 229 2014 34 45 E. Borfecchia, C. Garino, D. Gianolio, L. Salassa, R. Gobetto, C. Lamberti, Catal. Today 229 (2014) 34–45. [128] J. Jiang W. Zhou Y. Jiang X. Zhang Q. An F. Hu H. Wang K. Zheng M.A. Soldatov S. Wei Small 20 2024 2310163 J. Jiang, W. Zhou, Y. Jiang, X. Zhang, Q. An, F. Hu, H. Wang, K. Zheng, M.A. Soldatov, S. Wei, Small 20 (2024) 2310163. [129] A. Sarapuu J. Lilloja S. Akula J.H. Zagal S. Specchia K. Tammeveski ChemCatChem 15 2023 e202300849 A. Sarapuu, J. Lilloja, S. Akula, J.H. Zagal, S. Specchia, K. Tammeveski, ChemCatChem 15 (2023) e202300849. [130] J. Schröder J.A. Zamora Zeledón G.A. Kamat M.E. Kreider L. Wei A.S. Mule A. Torres K. Yap D. Sokaras A. Gallo ACS Energy Lett. 8 2023 2962 2969 J. Schröder, J.A. Zamora Zeledón, G.A. Kamat, M.E. Kreider, L. Wei, A.S. Mule, A. Torres, K. Yap, D. Sokaras, A. Gallo, ACS Energy Lett. 8 (2023) 2962–2969. [131] S.T. Putnam J. Rodríguez-López Chem. Sci. 15 2024 10036 10045 S.T. Putnam, J. Rodríguez-López, Chem. Sci. 15 (2024) 10036–10045. [132] J. Ustarroz I.M. Ornelas G. Zhang D. Perry M. Kang C.L. Bentley M. Walker P.R. Unwin ACS Catal. 8 2018 6775 6790 J. Ustarroz, I.M. Ornelas, G. Zhang, D. Perry, M. Kang, C.L. Bentley, M. Walker, P.R. Unwin, ACS Catal. 8 (2018) 6775–6790. [133] M. Bernal D. Torres S.S. Parapari L.B. Coelho S. Delfosse M. Čeh K. Žužek S. Šturm J. Ustarroz Electrochim. Acta 492 2024 144302 M. Bernal, D. Torres, S.S. Parapari, L.B. Coelho, S. Delfosse, M. Čeh, K. Žužek, S. Šturm, J. Ustarroz, Electrochim. Acta 492 (2024) 144302. [134] H. Su X. Zhang J. Sun X. Jin D. Wu X. Lian J. Zhong B. Ren Angew. Chemie 130 2018 13361 13365 H. Su, X. Zhang, J. Sun, X. Jin, D. Wu, X. Lian, J. Zhong, B. Ren, Angew. Chemie 130 (2018) 13361–13365. [135] J.F. Edmondson G.N. Meloni G. Costantini P.R. Unwin ChemElectroChem 7 2020 697 706 J.F. Edmondson, G.N. Meloni, G. Costantini, P.R. Unwin, ChemElectroChem 7 (2020) 697–706. [136] J. Wang C. Hu L. Wang Y. Yuan K. Zhu Q. Zhang L. Yang J. Lu Z. Bai Adv. Funct. Mater. 33 2023 2304277 J. Wang, C. Hu, L. Wang, Y. Yuan, K. Zhu, Q. Zhang, L. Yang, J. Lu, Z. Bai, Adv. Funct. Mater. 33 (2023) 2304277. [137] L. Fu J. Zhou Q. Deng J. Yang Q. Li Z. Zhu K. Wu Nanoscale 15 2023 677 686 L. Fu, J. Zhou, Q. Deng, J. Yang, Q. Li, Z. Zhu, K. Wu, Nanoscale 15 (2023) 677–686. [138] N. Wang S. Ning X. Yu D. Chen Z. Li J. Xu H. Meng D. Zhao L. Li Q. Liu Appl. Catal. B Environ. 302 2022 120838 N. Wang, S. Ning, X. Yu, D. Chen, Z. Li, J. Xu, H. Meng, D. Zhao, L. Li, Q. Liu, Appl. Catal. B Environ. 302 (2022) 120838. [139] J.H. Shim J. Kim C. Lee Y. Lee J. Phys. Chem. C 115 2011 305 309 J.H. Shim, J. Kim, C. Lee, Y. Lee, J. Phys. Chem. C 115 (2011) 305–309. [140] C.-L. Lee H.-P. Chiou Appl. Catal. B Environ. 117 2012 204 211 C.-L. Lee, H.-P. Chiou, Appl. Catal. B Environ. 117 (2012) 204–211. [141] Y. Lu W. Chen Chem. Soc. Rev. 41 2012 3594 3623 Y. Lu, W. Chen, Chem. Soc. Rev. 41 (2012) 3594–3623. [142] H. Erikson, A. Sarapuu, K. Tammeveski, J. Solla-Gullón, J. Feliu, in: Electrochem. Soc. Meet. Abstr. 228, The Electrochemical Society, Inc., 2015, p. 1628. [143] S. Jin M. Chen H. Dong B. He H. Lu L. Su W. Dai Q. Zhang X. Zhang J. Power Sources 274 2015 1173 1179 S. Jin, M. Chen, H. Dong, B. He, H. Lu, L. Su, W. Dai, Q. Zhang, X. Zhang, J. Power Sources 274 (2015) 1173–1179. [144] H. Agarwal J. Florian D. Pert B.R. Goldsmith N. Singh ACS Catal. 13 2023 2223 2233 H. Agarwal, J. Florian, D. Pert, B.R. Goldsmith, N. Singh, ACS Catal. 13 (2023) 2223–2233. [145] J. Zhang J. Chen Y. Luo Y. Chen M. Kiani X. Wei R. Luo G. Wang R. Wang Sci. China Mater. 61 2018 1567 1574 J. Zhang, J. Chen, Y. Luo, Y. Chen, M. Kiani, X. Wei, R. Luo, G. Wang, R. Wang, Sci. China Mater. 61 (2018) 1567–1574. [146] L. Wang P. Yu L. Zhao C. Tian D. Zhao W. Zhou J. Yin R. Wang H. Fu Sci. Rep. 4 2014 5184 L. Wang, P. Yu, L. Zhao, C. Tian, D. Zhao, W. Zhou, J. Yin, R. Wang, H. Fu, Sci. Rep. 4 (2014) 5184. [147] M. Kiani J. Zhang J. Fan H. Yang G. Wang J. Chen R. Wang Mater. Express 7 2017 261 272 M. Kiani, J. Zhang, J. Fan, H. Yang, G. Wang, J. Chen, R. Wang, Mater. Express 7 (2017) 261–272. [148] W. Li J. Liu D. Zhao Nat. Rev. Mater. 1 2016 1 17 W. Li, J. Liu, D. Zhao, Nat. Rev. Mater. 1 (2016) 1–17. [149] H. Bin Wu X.W. Lou Sci. Adv. 3 2017 eaap9252 H. Bin Wu, X.W. Lou, Sci. Adv. 3 (2017) eaap9252. [150] Z. Wu W. Hu T. Huang P. Lan K. Tian F. Xie L. Li J. Mater. Chem. C 6 2018 8839 8845 Z. Wu, W. Hu, T. Huang, P. Lan, K. Tian, F. Xie, L. Li, J. Mater. Chem. C 6 (2018) 8839–8845. [151] Y. Kumar E. Kibena-Põldsepp S. Akula J. Kozlova A. Kikas J. Aruväli V. Kisand K. Kukli K. Tammeveski Electrochem. Commun. 157 2023 107623 Y. Kumar, E. Kibena-Põldsepp, S. Akula, J. Kozlova, A. Kikas, J. Aruväli, V. Kisand, K. Kukli, K. Tammeveski, Electrochem. Commun. 157 (2023) 107623. [152] J. Lilloja E. Kibena-Põldsepp A. Sarapuu M. Käärik J. Kozlova P. Paiste A. Kikas A. Treshchalov J. Leis A. Tamm V. Kisand S. Holdcroft K. Tammeveski Appl. Catal. B Environ. 306 2022 121113 J. Lilloja, E. Kibena-Põldsepp, A. Sarapuu, M. Käärik, J. Kozlova, P. Paiste, A. Kikas, A. Treshchalov, J. Leis, A. Tamm, V. Kisand, S. Holdcroft, K. Tammeveski, Appl. Catal. B Environ. 306 (2022) 121113. [153] N. Ayasha A. Ahuja S. Mitra Chem. Select 8 2023 e202300885 N. Ayasha, A. Ahuja, S. Mitra, Chemistry Select 8 (2023) e202300885. [154] S. Sinha T. Vegge H.A. Hansen ChemCatChem 15 2023 e202300349 S. Sinha, T. Vegge, H.A. Hansen, ChemCatChem 15 (2023) e202300349. [155] S. Akula M. Mooste J. Kozlova M. Käärik A. Treshchalov A. Kikas V. Kisand J. Aruväli P. Paiste A. Tamm J. Leis K. Tammeveski Chem. Eng. J. 458 2023 141468 S. Akula, M. Mooste, J. Kozlova, M. Käärik, A. Treshchalov, A. Kikas, V. Kisand, J. Aruväli, P. Paiste, A. Tamm, J. Leis, K. Tammeveski, Chem. Eng. J. 458 (2023) 141468. [156] R. Kumar M. Mooste Z. Ahmed S. Akula I. Zekker M. Marandi M. Käärik J. Leis A. Kikas A. Treshchalov Ind. Chem. Mater. 1 2023 526 541 R. Kumar, M. Mooste, Z. Ahmed, S. Akula, I. Zekker, M. Marandi, M. Käärik, J. Leis, A. Kikas, A. Treshchalov, Ind. Chem. Mater. 1 (2023) 526–541. [157] R. Balaji T.T. Nguyen M. Austeria D.H. Kim J.H. Lee N.H. Kim Appl. Catal. B Environ. 335 2023 122895 R. Balaji, T.T. Nguyen, M. Austeria, D.H. Kim, J.H. Lee, N.H. Kim, Appl. Catal. B Environ. 335 (2023) 122895. [158] G.K. Kiran T.V.M. Sreekanth K. Yoo J. Kim Mater. Chem. Phys. 296 2023 127272 G.K. Kiran, T.V.M. Sreekanth, K. Yoo, J. Kim, Mater. Chem. Phys. 296 (2023) 127272. [159] L. Lin X. Yang P. Shi L. Yan K. Xie C. Deng Z. Chen Surf. Interfaces 40 2023 103100 L. Lin, X. Yang, P. Shi, L. Yan, K. Xie, C. Deng, Z. Chen, Surfaces and Interfaces 40 (2023) 103100. [160] F.N.I. Sari Y. Lai Y. Huang X. Wei H. Pourzolfaghar Y. Chang M. Ghufron Y. Li Y. Su O. Clemens Adv. Funct. Mater. 34 2024 2310181 F.N.I. Sari, Y. Lai, Y. Huang, X. Wei, H. Pourzolfaghar, Y. Chang, M. Ghufron, Y. Li, Y. Su, O. Clemens, Adv. Funct. Mater. 34 (2024) 2310181. [161] W. Song C. Xiao J. Ding Z. Huang X. Yang T. Zhang D. Mitlin W. Hu Adv. Mater. 36 2024 2301477 W. Song, C. Xiao, J. Ding, Z. Huang, X. Yang, T. Zhang, D. Mitlin, W. Hu, Adv. Mater. 36 (2024) 2301477. [162] S. Wang M. Wang Y. Zhang H. Wang H. Fei R. Liu H. Kong R. Gao S. Zhao T. Liu Small Methods 7 2023 2201714 S. Wang, M. Wang, Y. Zhang, H. Wang, H. Fei, R. Liu, H. Kong, R. Gao, S. Zhao, T. Liu, Small Methods 7 (2023) 2201714. [163] P. Lang N. Yuan Q. Jiang Y. Zhang J. Tang Energy Technol. 8 2020 1900984 P. Lang, N. Yuan, Q. Jiang, Y. Zhang, J. Tang, Energy Technol. 8 (2020) 1900984. [164] D. Bhalothia C. Yan N. Hiraoka H. Ishii Y.-F. Liao P.-C. Chen K.-W. Wang J.-P. Chou S. Dai T.-Y. Chen ACS Appl. Mater. Interfaces 15 2023 16177 16188 D. Bhalothia, C. Yan, N. Hiraoka, H. Ishii, Y.-F. Liao, P.-C. Chen, K.-W. Wang, J.-P. Chou, S. Dai, T.-Y. Chen, ACS Appl. Mater. Interfaces 15 (2023) 16177–16188. [165] Y. Feng L. Chen Z.-Y. Yuan J. Ind. Eng. Chem. 120 2022 27 46 Y. Feng, L. Chen, Z.-Y. Yuan, J. Ind. Eng. Chem. 120 (2022) 27-46. [166] P. Akbarian M. Kheirmand A. Asadi J. Mater. Sci. 58 2023 8889 8907 P. Akbarian, M. Kheirmand, A. Asadi, J. Mater. Sci. 58 (2023) 8889–8907. [167] H.-R. Wu M.-Y. Chen W.-D. Li B.-A. Lu Chem. Asian J. 19 2023 e202300862 H.-R. Wu, M.-Y. Chen, W.-D. Li, B.-A. Lu, Chem. Asian J. 19 (2023) e202300862. [168] F. Nasim H. Ali M.A. Nadeem M.A. Nadeem Sustain. Energy Fuels 7 2023 190 200 F. Nasim, H. Ali, M.A. Nadeem, M.A. Nadeem, Sustain. Energy Fuels 7 (2023) 190–200. [169] G. Zhou X. Yan T. Zhang K. Wang J. Zhang J. Guo Appl. Surf. Sci. 621 2023 156906 G. Zhou, X. Yan, T. Zhang, K. Wang, J. Zhang, J. Guo, Appl. Surf. Sci. 621 (2023) 156906. [170] H. Tian A. Song P. Zhang K. Sun J. Wang B. Sun Q. Fan G. Shao C. Chen H. Liu Adv. Mater. 35 2023 2210714 H. Tian, A. Song, P. Zhang, K. Sun, J. Wang, B. Sun, Q. Fan, G. Shao, C. Chen, H. Liu, Adv. Mater. 35 (2023) 2210714. [171] Z. Li X. Zhong L. Gao J. Hu W. Peng X. Wang G. Zhou B. Xu ACS Nano 18 2024 13006 13018 Z. Li, X. Zhong, L. Gao, J. Hu, W. Peng, X. Wang, G. Zhou, B. Xu, ACS Nano 18 (2024) 13006–13018. [172] U. Farooq T. Ahmad F. Naaz S. ul Islam Energy Fuels 37 2023 1577 1632 U. Farooq, T. Ahmad, F. Naaz, S. ul Islam, Energy & Fuels 37 (2023) 1577–1632. [173] J. Li S. Lu H. Huang D. Liu Z. Zhuang C. Zhong ACS Sustain. Chem. Eng. 6 2018 10021 10029 J. Li, S. Lu, H. Huang, D. Liu, Z. Zhuang, C. Zhong, ACS Sustain. Chem. Eng. 6 (2018) 10021–10029. [174] F. Cheng T. Zhang Y. Zhang J. Du X. Han J. Chen Angew. Chemie 2013 10.1002/ange.201208582 F. Cheng, T. Zhang, Y. Zhang, J. Du, X. Han, J. Chen, Angew. Chemie (2013). doi: 10.1002/ange.201208582 [175] T. Li B. Xue B. Wang G. Guo D. Han Y. Yan A. Dong JACS 139 2017 12133 12136 T. Li, B. Xue, B. Wang, G. Guo, D. Han, Y. Yan, A. Dong, J. Am. Chem. Soc. 139 (2017) 12133–12136. [176] Y. Liang Y. Li H. Wang J. Zhou J. Wang T. Regier H. Dai Nat. Mater. 10 2011 780 786 Y. Liang, Y. Li, H. Wang, J. Zhou, J. Wang, T. Regier, H. Dai, Nat. Mater. 10 (2011) 780–786. [177] Y. Liang H. Wang P. Diao W. Chang G. Hong Y. Li M. Gong L. Xie J. Zhou J. Wang JACS 134 2012 15849 15857 Y. Liang, H. Wang, P. Diao, W. Chang, G. Hong, Y. Li, M. Gong, L. Xie, J. Zhou, J. Wang, J. Am. Chem. Soc. 134 (2012) 15849–15857. [178] Y. Zhang H. Jiang C. Zhang Y. Feng H. Feng S. Zhu J. Hu J. Mater. Chem. A 12 2024 6123 6133 Y. Zhang, H. Jiang, C. Zhang, Y. Feng, H. Feng, S. Zhu, J. Hu, J. Mater. Chem. A 12 (2024) 6123–6133. [179] D. Mahato A. Praveen L.K. Nivedha T. Gurusamy K. Ramanujam P. Haridoss T. Thomas Surf. Interfaces 46 2024 103924 D. Mahato, A. Praveen, L.K. Nivedha, T. Gurusamy, K. Ramanujam, P. Haridoss, T. Thomas, Surfaces and Interfaces 46 (2024) 103924. [180] S. Nagarani J.-H. Chang M. Yuvaraj M. Kumar D. Ganguly S. Balachandran New J. Chem. 48 2024 10910 10924 S. Nagarani, J.-H. Chang, M. Yuvaraj, M. Kumar, D. Ganguly, S. Balachandran, New J. Chem. 48 (2024) 10910–10924. [181] R.K. Singh J.C. Douglin L. Jiang K. Yassin S. Brandon D.R. Dekel Energies 16 2023 3425 R.K. Singh, J.C. Douglin, L. Jiang, K. Yassin, S. Brandon, D.R. Dekel, Energies 16 (2023) 3425. [182] J. Suntivich H.A. Gasteiger N. Yabuuchi H. Nakanishi J.B. Goodenough Y. Shao-Horn Nat. Chem. 3 2011 546 550 J. Suntivich, H.A. Gasteiger, N. Yabuuchi, H. Nakanishi, J.B. Goodenough, Y. Shao-Horn, Nat. Chem. 3 (2011) 546–550. [183] V. Ellingsson A. Iqbal E. Skúlason Y. Abghoui ChemSusChem 16 2023 e202300947 V. Ellingsson, A. Iqbal, E. Skúlason, Y. Abghoui, ChemSusChem 16 (2023) e202300947. [184] Y. Hu J.O. Jensen W. Zhang L.N. Cleemann W. Xing N.J. Bjerrum Q. Li Angew. Chemie Int. Ed. 53 2014 3675 3679 Y. Hu, J.O. Jensen, W. Zhang, L.N. Cleemann, W. Xing, N.J. Bjerrum, Q. Li, Angew. Chemie Int. Ed. 53 (2014) 3675–3679. [185] C. He J. Tao Int. J. Hydrogen Energy 47 2022 13240 13250 C. He, J. Tao, Int. J. Hydrogen Energy 47 (2022) 13240–13250. [186] S. Ingavale M. Gopalakrishnan P. Marbaniang W. Lao-Atiman A.A. Mohamad M.T. Nguyen T. Yonezawa A. Swami S. Kheawhom Nanoscale 16 2024 9998 10010 S. Ingavale, M. Gopalakrishnan, P. Marbaniang, W. Lao-Atiman, A.A. Mohamad, M.T. Nguyen, T. Yonezawa, A. Swami, S. Kheawhom, Nanoscale 16 (2024) 9998–10010. [187] Z.-G. Yang H. Xu T.-Y. Shuai Z. Qi-Ni Z. Zhi-Jie K. Huang C. Dai G.-R. Li Nanoscale 2023 10.1039/D3NR01607B Z.-G. Yang, H. Xu, T.-Y. Shuai, Z. Qi-Ni, Z. Zhi-Jie, K. Huang, C. Dai, G.-R. Li, Nanoscale (2023). https://doi.org/10.1039/D3NR01607B [188] Y. Fu L. Han P. Zheng X. Xian X. Zeng P. Dong J. Feng Y. Zhang J. Electroanal. Chem. 932 2023 117212 Y. Fu, L. Han, P. Zheng, X. Xian, X. Zeng, P. Dong, J. Feng, Y. Zhang, J. Electroanal. Chem. 932 (2023) 117212. [189] C. Verma A. Thakur R. Ganjoo S. Sharma H. Assad A. Kumar M.A. Quraishi A. Alfantazi Coord. Chem. Rev. 488 2023 215177 C. Verma, A. Thakur, R. Ganjoo, S. Sharma, H. Assad, A. Kumar, M.A. Quraishi, A. Alfantazi, Coord. Chem. Rev. 488 (2023) 215177. [190] X. He Y. Tian Z. Huang L. Xu J. Wu J. Qian J. Zhang H. Li J. Mater. Chem. A 9 2021 2301 2307 X. He, Y. Tian, Z. Huang, L. Xu, J. Wu, J. Qian, J. Zhang, H. Li, J. Mater. Chem. A 9 (2021) 2301–2307. [191] D. Xia S. Liu Z. Wang G. Chen L. Zhang L. Zhang S.R. Hui J. Zhang J. Power Sources 177 2008 296 302 D. Xia, S. Liu, Z. Wang, G. Chen, L. Zhang, L. Zhang, S.R. Hui, J. Zhang, J. Power Sources 177 (2008) 296–302. [192] R.S. Shah D.N. Patel V.J. Amreliya N.P. Patel Int. Res. J. Eng. Technol. (IRJET) 6 2019 https://www.irjet.net/archives/V6/i4/IRJET-V6I4959.pdf R.S. Shah, D.N. Patel, V.J. Amreliya, N.P. Patel, International Research Journal of Engineering and Technology (IRJET). 6 (2019). https://www.irjet.net/archives/V6/i4/IRJET-V6I4959.pdf [193] H. Yu Y. Luo C. Wu A. Jia Y. Wang L. Wu J. Li Chem. Eng. J. 449 2022 137542 H. Yu, Y. Luo, C. Wu, A. Jia, Y. Wang, L. Wu, J. Li, Chem. Eng. J. 449 (2022) 137542. [194] J.S. Sanchez Z. Xia K. Mirehbar S. Sasidharan S.A. Aravindh A. Liscio J. Sun M. Christian J. Palma V. Palermo J. Mater. Chem. A 12 2024 1959 11945 111941 J.S. Sanchez, Z. Xia, K. Mirehbar, S. Sasidharan, S.A. Aravindh, A. Liscio, J. Sun, M. Christian, J. Palma, V. Palermo, J. Mater. Chem. A 12 (2024) 11945–11959. [195] C.-L. Huang Z.-F. He J.-Y. Pai Y.-H. Yang W.-Y. Jao C.-Y. Lai Y.-T. Lu H.-Y. Ku C.-C. Hu Chem. Eng. J. 469 2023 143855 C.-L. Huang, Z.-F. He, J.-Y. Pai, Y.-H. Yang, W.-Y. Jao, C.-Y. Lai, Y.-T. Lu, H.-Y. Ku, C.-C. Hu, Chem. Eng. J. 469 (2023) 143855. [196] X. Cao X. Zheng J. Tian C. Jin K. Ke R. Yang Electrochim. Acta 191 2016 776 783 X. Cao, X. Zheng, J. Tian, C. Jin, K. Ke, R. Yang, Electrochim. Acta 191 (2016) 776–783. [197] Z. Li B. Li Y. Hu S. Wang C. Yu Mater. Adv. 3 2022 779 809 Z. Li, B. Li, Y. Hu, S. Wang, C. Yu, Mater. Adv. 3 (2022) 779–809. [198] J. Wang L. Li X. Chen Y. Lu W. Yang J. Mater. Chem. A 4 2016 11342 11350 J. Wang, L. Li, X. Chen, Y. Lu, W. Yang, J. Mater. Chem. A 4 (2016) 11342–11350. [199] S. Zhao Z. Ma Z. Wan J. Li X. Wang J. Colloid Interface Sci. 642 2023 800 809 S. Zhao, Z. Ma, Z. Wan, J. Li, X. Wang, J. Colloid Interface Sci. 642 (2023) 800–809. [200] W. Xu R. Zeng M. Rebarchik A. Posada-Borbón H. Li C.J. Pollock M. Mavrikakis H.D. Abruña JACS 146 2024 2593 2603 W. Xu, R. Zeng, M. Rebarchik, A. Posada-Borbón, H. Li, C.J. Pollock, M. Mavrikakis, H.D. Abruña, J. Am. Chem. Soc. 146 (2024) 2593–2603. [201] Q. Zhang J. Guan Adv. Funct. Mater. 30 2020 2000768 Q. Zhang, J. Guan, Adv. Funct. Mater. 30 (2020) 2000768. [202] A. Sathyaseelan V. Elumalai M. Perumalsamy N. Ul Haq Liyakath Ali A. Sajeev S.-J. Kim Chem. Eng. J. 489 2024 A. Sathyaseelan, V. Elumalai, M. Perumalsamy, N. Ul Haq Liyakath Ali, A. Sajeev, S.-J. Kim, Chem. Eng. J. 489 (2024) 151235. [203] Y. Wang H. Su Y. He L. Li S. Zhu H. Shen P. Xie X. Fu G. Zhou C. Feng Chem. Rev. 120 2020 12217 12314 Y. Wang, H. Su, Y. He, L. Li, S. Zhu, H. Shen, P. Xie, X. Fu, G. Zhou, C. Feng, Chem. Rev. 120 (2020) 12217–12314. [204] M. Kiani X.Q. Tian W. Zhang Coord. Chem. Rev. 441 2021 213954 M. Kiani, X.Q. Tian, W. Zhang, Coord. Chem. Rev. 441 (2021) 213954. [205] W. Yan O. Guo Q. Xing M. Liao Z. Shi H. Feng Y. Zhang X. Li Y. Chen Small 19 2023 2300200 W. Yan, O. Guo, Q. Xing, M. Liao, Z. Shi, H. Feng, Y. Zhang, X. Li, Y. Chen, Small 19 (2023) 2300200. [206] C. Xiao L. Cheng Y. Zhu G. Wang L. Chen Y. Wang R. Chen Y. Li C. Li Angew. Chemie Int. Ed. 61 2022 e202206544 C. Xiao, L. Cheng, Y. Zhu, G. Wang, L. Chen, Y. Wang, R. Chen, Y. Li, C. Li, Angew. Chemie Int. Ed. 61 (2022) e202206544. [207] Z. Cai P. Du W. Liang H. Zhang P. Wu C. Cai Z. Yan J. Mater. Chem. A 8 2020 15012 15022 Z. Cai, P. Du, W. Liang, H. Zhang, P. Wu, C. Cai, Z. Yan, J. Mater. Chem. A 8 (2020) 15012–15022. [208] J. Chen H. Li C. Fan Q. Meng Y. Tang X. Qiu G. Fu T. Ma Adv. Mater. 32 2020 2003134 J. Chen, H. Li, C. Fan, Q. Meng, Y. Tang, X. Qiu, G. Fu, T. Ma, Adv. Mater. 32 (2020) 2003134. [209] M. Song W. Liu J. Zhang C. Zhang X. Huang D. Wang Adv. Funct. Mater. 33 2023 2212087 M. Song, W. Liu, J. Zhang, C. Zhang, X. Huang, D. Wang, Adv. Funct. Mater. 33 (2023) 2212087. [210] K. Liu P. Chen Z. Sun W. Chen Q. Zhou X. Gao Nano Res. 16 2023 10724 10741 K. Liu, P. Chen, Z. Sun, W. Chen, Q. Zhou, X. Gao, Nano Res. 16 (2023) 10724–10741. [211] M. Yuasa T. Kondo D. Mori S. Arikawa Polym. Adv. Technol. 22 2011 1235 1241 M. Yuasa, T. Kondo, D. Mori, S. Arikawa, Polym. Adv. Technol. 22 (2011) 1235–1241. [212] K. Bhunia E. Vijayakumar N.P.M.J. Raj K.S. Bejigo D. Kesavan S.-J. Kim Chem. Eng. J. 473 2023 145028 K. Bhunia, E. Vijayakumar, N.P.M.J. Raj, K.S. Bejigo, D. Kesavan, S.-J. Kim, Chem. Eng. J. 473 (2023) 145028. [213] X. Liu Y. Liu W. Yang X. Feng B. Wang Chem. Eur. J. 28 2022 X. Liu, Y. Liu, W. Yang, X. Feng, B. Wang, Chem. Eur. J. 28 (2022) e202201471. [214] H. Yang H. Huang Q. Wang L. Shang T. Zhang S. Wang J. Mater. Chem. A 11 2023 6191 6197 H. Yang, H. Huang, Q. Wang, L. Shang, T. Zhang, S. Wang, J. Mater. Chem. A 11 (2023) 6191–6197. [215] X. Shao R. Gan Y. Rao T.T.T. Nga M. Liang C.-L. Dong C. Ma J.Y. Lee H. Li H. Lee ACS Nano 18 2024 14742 14753 X. Shao, R. Gan, Y. Rao, T.T.T. Nga, M. Liang, C.-L. Dong, C. Ma, J.Y. Lee, H. Li, H. Lee, ACS Nano 18 (2024) 14742–14753. [216] P. Song M. Luo X. Liu W. Xing W. Xu Z. Jiang L. Gu Adv. Funct. Mater. 27 2017 1700802 P. Song, M. Luo, X. Liu, W. Xing, W. Xu, Z. Jiang, L. Gu, Adv. Funct. Mater. 27 (2017) 1700802. [217] F. Luo J. Zhu S. Ma M. Li R. Xu Q. Zhang Z. Yang K. Qu W. Cai Z. Chen Energy Storage Mater. 35 2021 723 730 F. Luo, J. Zhu, S. Ma, M. Li, R. Xu, Q. Zhang, Z. Yang, K. Qu, W. Cai, Z. Chen, Energy Storage Mater. 35 (2021) 723–730. [218] Y. Qi Q. Liang K. Song X. Zhou M. Liu W. Li F. Liu Z. Jiang X. Zou Z. Chen J. Energy Chem. 95 2024 306 314 Y. Qi, Q. Liang, K. Song, X. Zhou, M. Liu, W. Li, F. Liu, Z. Jiang, X. Zou, Z. Chen, J. Energy Chem. 95 (2024) 306–314. [219] F. Wang Y. Li R. Zhang H. Liu Y. Zhang X. Zheng J. Zhang C. Chen S. Zheng H.L. Xin Small 19 2023 2206071 F. Wang, Y. Li, R. Zhang, H. Liu, Y. Zhang, X. Zheng, J. Zhang, C. Chen, S. Zheng, H.L. Xin, Small 19 (2023) 2206071. [220] M. Zhang H. Li J. Chen F. Ma L. Zhen Z. Wen C. Xu Small 18 2022 2202476 M. Zhang, H. Li, J. Chen, F. Ma, L. Zhen, Z. Wen, C. Xu, Small 18 (2022) 2202476. [221] J.-E. Tsai W.-X. Hong H. Pourzolfaghar W.-H. Wang Y.-Y. Li Chem. Eng. J. 460 2023 141868 J.-E. Tsai, W.-X. Hong, H. Pourzolfaghar, W.-H. Wang, Y.-Y. Li, Chem. Eng. J. 460 (2023) 141868. [222] K. Chi Z. Wang T. Sun P. He F. Xiao J. Lu S. Wang Small 20 2024 2311817 K. Chi, Z. Wang, T. Sun, P. He, F. Xiao, J. Lu, S. Wang, Small 20 (2024) 2311817. [223] R. Chen W. Liu Z. Sang J. Jia Z. Li J. Nie Q. Jiang Z. Mao B. Guo Q. Wang J. Energy Chem. 98 2024 105 113 R. Chen, W. Liu, Z. Sang, J. Jia, Z. Li, J. Nie, Q. Jiang, Z. Mao, B. Guo, Q. Wang, J. Energy Chem. 98 (2024) 105–113. [224] P. Rao J. Luo D. Wu J. Li Q. Chen P. Deng Y. Shen X. Tian Energy Environ. Mater. 6 2023 e12371 P. Rao, J. Luo, D. Wu, J. Li, Q. Chen, P. Deng, Y. Shen, X. Tian, Energy Environ. Mater. 6 (2023) e12371. [225] J. Zhang Y. Chen Y. Liu X. Liu S. Gao Sci. China Mater. 65 2022 653 662 J. Zhang, Y. Chen, Y. Liu, X. Liu, S. Gao, Sci. China Mater. 65 (2022) 653–662. [226] J. Chang Q. Zhang J. Yu W. Jing S. Wang G. Yin G.I.N. Waterhouse S. Lu Adv. Sci. 10 2023 2301656 J. Chang, Q. Zhang, J. Yu, W. Jing, S. Wang, G. Yin, G.I.N. Waterhouse, S. Lu, Adv. Sci. 10 (2023) 2301656. [227] Y. Yang G. Wang C. Liu Y. Lin C. Jiao Q. Chen Z. Zhuo J. Mao Y. Liu Inorg. Chem. 63 2024 13086 13092 Y. Yang, G. Wang, C. Liu, Y. Lin, C. Jiao, Q. Chen, Z. Zhuo, J. Mao, Y. Liu, Inorg. Chem. 63 (2024) 13086–13092. [228] Z. Chen H. Zheng J. Zhang Z. Jiang C. Bao C.-H. Yeh N.-C. Lai J. Colloid Interface Sci. 670 2024 103 113 Z. Chen, H. Zheng, J. Zhang, Z. Jiang, C. Bao, C.-H. Yeh, N.-C. Lai, J. Colloid Interface Sci. 670 (2024) 103–113. [229] H. Luo J. Wang S. Zhang B. Sun Z. Chen X. Ren Z. Luo X. Han W. Hu Small 20 2024 2400357 H. Luo, J. Wang, S. Zhang, B. Sun, Z. Chen, X. Ren, Z. Luo, X. Han, W. Hu, Small 20 (2024) 2400357. [230] S. Swain A. Altaee M. Saxena A.K. Samal Coord. Chem. Rev. 470 2022 214710 S. Swain, A. Altaee, M. Saxena, A.K. Samal, Coord. Chem. Rev. 470 (2022) 214710. [231] C. Fang X. Tang Q. Yi Appl. Catal. B Environ. 341 2024 123346 C. Fang, X. Tang, Q. Yi, Appl. Catal. B Environ. 341 (2024) 123346. [232] K. Xu S. Zhang X. Zhuang G. Zhang Y. Tang H. Pang Adv. Colloid Interface Sci. 323 2023 103050 K. Xu, S. Zhang, X. Zhuang, G. Zhang, Y. Tang, H. Pang, Adv. Colloid Interface Sci. 323 (2023) 103050. [233] H. Wang C. Sun E. Zhu C. Shi J. Yu M. Xu J. Alloy. Compd. 948 2023 169728 H. Wang, C. Sun, E. Zhu, C. Shi, J. Yu, M. Xu, J. Alloys Compd. 948 (2023) 169728. [234] X.-H. Yan, H. Xu, in: Noble-Metal-Free Electrocatal. Hydrog. Energy, World Scientific, 2022, pp. 459–528. [235] S. Mahajan M. Lahtinen J. Environ. Chem. Eng. 10 2022 108930 S. Mahajan, M. Lahtinen, J. Environ. Chem. Eng. 10 (2022) 108930. [236] J. Ren Z. Shi Y. Huang Int. J. Hydrogen Energy 48 2023 12333 12341 J. Ren, Z. Shi, Y. Huang, Int. J. Hydrogen Energy 48 (2023) 12333–12341. [237] A.S. Alabi A.P.I. Popoola O.M. Popoola N.R. Mathe M. Abdulwahab Front. Energy Res. 11 2023 1091105 A.S. Alabi, A.P.I. Popoola, O.M. Popoola, N.R. Mathe, M. Abdulwahab, Front. Energy Res. 11 (2023) 1091105. [238] L. Niu G. Liu Y. Li J. An B. Zhao J. Yang D. Qu X. Wang L. An Z. Sun ACS Sustain. Chem. Eng. 9 2021 8207 8213 L. Niu, G. Liu, Y. Li, J. An, B. Zhao, J. Yang, D. Qu, X. Wang, L. An, Z. Sun, ACS Sustain. Chem. Eng. 9 (2021) 8207–8213. [239] Y. Wei D. Wu C. Yong Z. Wang P. Zhong J. Qiu J. Fan J. Sun Y. Lei X. Wu Appl. Surf. Sci. 607 2023 154929 Y. Wei, D. Wu, C. Yong, Z. Wang, P. Zhong, J. Qiu, J. Fan, J. Sun, Y. Lei, X. Wu, Appl. Surf. Sci. 607 (2023) 154929. [240] L. Sahoo R. Garg K. Kaur C.P. Vinod U.K. Gautam Nano Lett. 22 2022 246 254 L. Sahoo, R. Garg, K. Kaur, C.P. Vinod, U.K. Gautam, Nano Lett. 22 (2022) 246–254. [241] H. Lv D. Xu L. Sun J. Henzie S.L. Suib Y. Yamauchi B. Liu ACS Nano 13 2019 12052 12061 H. Lv, D. Xu, L. Sun, J. Henzie, S.L. Suib, Y. Yamauchi, B. Liu, ACS Nano 13 (2019) 12052–12061. [242] C. Deng K.-H. Wu J. Scott S. Zhu R. Amal D.-W. Wang J. Mater. Chem. A 7 2019 20649 20657 C. Deng, K.-H. Wu, J. Scott, S. Zhu, R. Amal, D.-W. Wang, J. Mater. Chem. A 7 (2019) 20649–20657. [243] Z. Wang L. Cheng R. Zhang W. Lv W. Wang J. Alloy. Compd. 857 2021 158249 Z. Wang, L. Cheng, R. Zhang, W. Lv, W. Wang, J. Alloys Compd. 857 (2021) 158249. [244] A. Jiang J. Chen S. Liu Z. Wang Q. Li D. Xia M. Dong ACS Appl. Nano Mater. 4 2021 13716 13723 A. Jiang, J. Chen, S. Liu, Z. Wang, Q. Li, D. Xia, M. Dong, ACS Appl. Nano Mater. 4 (2021) 13716–13723. [245] S. Wang Q. Luo Y. Zhu S. Tang Y. Du ACS Omega 4 2019 17894 17902 S. Wang, Q. Luo, Y. Zhu, S. Tang, Y. Du, ACS Omega 4 (2019) 17894–17902. [246] E. Hornberger M. Klingenhof S. Polani P. Paciok A. Kormányos R. Chattot K.E. MacArthur X. Wang L. Pan J. Drnec Chem. Sci. 13 2022 9295 9304 E. Hornberger, M. Klingenhof, S. Polani, P. Paciok, A. Kormányos, R. Chattot, K.E. MacArthur, X. Wang, L. Pan, J. Drnec, Chem. Sci. 13 (2022) 9295–9304. [247] T. Song M. Chen P. Yin L. Tong M. Zuo S. Chu P. Chen H. Liang Small 18 2022 2202916 T. Song, M. Chen, P. Yin, L. Tong, M. Zuo, S. Chu, P. Chen, H. Liang, Small 18 (2022) 2202916. [248] D. Chen J. Zhu X. Mu R. Cheng W. Li S. Liu Z. Pu C. Lin S. Mu Appl. Catal. B Environ. 268 2020 118729 D. Chen, J. Zhu, X. Mu, R. Cheng, W. Li, S. Liu, Z. Pu, C. Lin, S. Mu, Appl. Catal. B Environ. 268 (2020) 118729. [249] S. Zhu L. Yang J. Bai Y. Chu J. Liu Z. Jin C. Liu J. Ge W. Xing Nano Res. 16 2023 2035 2040 S. Zhu, L. Yang, J. Bai, Y. Chu, J. Liu, Z. Jin, C. Liu, J. Ge, W. Xing, Nano Res. 16 (2023) 2035–2040. [250] R. Nandan G. Raj K.K. Nanda ACS Appl. Mater. Interfaces 14 2022 16108 16116 R. Nandan, G. Raj, K.K. Nanda, ACS Appl. Mater. Interfaces 14 (2022) 16108–16116. [251] P. Gao S. Zhao X. Qu X. Qian F. Duan S. Lu H. Zhu M. Du Electrochim. Acta 432 2022 141160 P. Gao, S. Zhao, X. Qu, X. Qian, F. Duan, S. Lu, H. Zhu, M. Du, Electrochim. Acta 432 (2022) 141160. [252] S. Li X. Tang H. Jia H. Li G. Xie X. Liu X. Lin H.-J. Qiu J. Catal. 383 2020 164 171 S. Li, X. Tang, H. Jia, H. Li, G. Xie, X. Liu, X. Lin, H.-J. Qiu, J. Catal. 383 (2020) 164–171. [253] S. Nagarani J.-H. Chang M. Yuvaraj S. Balachandran M. Kumar S. Kanimozhi Mater. Lett. 357 2024 135705 S. Nagarani, J.-H. Chang, M. Yuvaraj, S. Balachandran, M. Kumar, S. Kanimozhi, Mater. Lett. 357 (2024) 135705. [254] S. Wang W. Song M. Hu F. Li Y. Song R. Ju K. Xu H. Zhou Int. J. Hydrogen Energy 72 2024 226 236 S. Wang, W. Song, M. Hu, F. Li, Y. Song, R. Ju, K. Xu, H. Zhou, Int. J. Hydrogen Energy 72 (2024) 226–236. [255] Y.-B. Sun R.-X. Deng C. Chi X.-L. Chen Y.-A. Pan J. Li X.-H. Xia J. Electroanal. Chem. 940 2023 117489 Y.-B. Sun, R.-X. Deng, C. Chi, X.-L. Chen, Y.-A. Pan, J. Li, X.-H. Xia, J. Electroanal. Chem. 940 (2023) 117489. [256] M. Fan X. Liang Q. Li L. Cui X. He X. Zou Chinese Chem. Lett. 34 2023 107275 M. Fan, X. Liang, Q. Li, L. Cui, X. He, X. Zou, Chinese Chem. Lett. 34 (2023) 107275. [257] R. Chen M. Han Y. Shi W. Guo Y. Wu T. Zhang X. Han C. Du C. Yu J. Feng S. Dong J. Sun M. Fan Y. Zhu Chem. Eng. J. 487 2024 150532 R. Chen, M. Han, Y. Shi, W. Guo, Y. Wu, T. Zhang, X. Han, C. Du, C. Yu, J. Feng, S. Dong, J. Sun, M. Fan, Y. Zhu, Chem. Eng. J. 487 (2024) 150532. [258] J. Qu G. Long L. Luo Y. Yang W. Fan F. Zhang Small 20 2024 2400695 J. Qu, G. Long, L. Luo, Y. Yang, W. Fan, F. Zhang, Small 20 (2024) 2400695. [259] H.-C. Li P.-C. Ji Y. Teng H.-L. Jia M.-Y. Guan Sustain Energy Fuels 7 2023 1127 1134 H.-C. Li, P.-C. Ji, Y. Teng, H.-L. Jia, M.-Y. Guan, Sustain. Energy Fuels 7 (2023) 1127–1134. [260] C. Xu Z. Li L. Yang L. Hu W. Wang J. Huang H. Zhou L. Chen Z. Hou J. Electroanal. Chem. 923 2022 116826 C. Xu, Z. Li, L. Yang, L. Hu, W. Wang, J. Huang, H. Zhou, L. Chen, Z. Hou, J. Electroanal. Chem. 923 (2022) 116826. [261] X. Liu G. Zhang L. Wang H. Fu Small 17 2021 2006766 X. Liu, G. Zhang, L. Wang, H. Fu, Small 17 (2021) 2006766. [262] X. Zhang X. Zhang S. Zhao Y.Q. Wang X. Lin Z.Q. Tiang P.K. Shen Electrochim. Acta 370 2021 137712 X. Zhang, X. Zhang, S. Zhao, Y.Q. wang, X. Lin, Z.Q. Tiang, P.K. Shen. Electrochim. Acta 370 (2021) 137712. [263] Q. Lai H. Zheng Z. Tang D. Bi N. Chen X. Liu J. Zheng Y. Liang ACS Appl. Mater. Interfaces 13 2021 61129 61138 Q. Lai, H. Zheng, Z. Tang, D. Bi, N. Chen, X. Liu, J. Zheng, Y. Liang, ACS Appl. Mater. Interfaces 13 (2021) 61129–61138. [264] S. Macchi I. Denmark T. Le M. Forson M. Bashiru A. Jalihal N. Siraj Electrochem 3 2021 1 27 S. Macchi, I. Denmark, T. Le, M. Forson, M. Bashiru, A. Jalihal, N. Siraj, Electrochem 3 (2021) 1–27. [265] J. Duan S. Chen M. Jaroniec S.Z. Qiao ACS Catal. 5 2015 5207 5234 J. Duan, S. Chen, M. Jaroniec, S.Z. Qiao, Acs Catal. 5 (2015) 5207–5234. [266] J. Zhang J. Chen H. Yang J. Fan F. Zhou Y. Wang G. Wang R. Wang RSC Adv. 7 2017 33921 33928 J. Zhang, J. Chen, H. Yang, J. Fan, F. Zhou, Y. Wang, G. Wang, R. Wang, RSC Adv. 7 (2017) 33921–33928. [267] J. Liang Q. Yuan Appl. Surf. Sci. 648 2024 159025 J. Liang, Q. Yuan, Appl. Surf. Sci. 648 (2024) 159025. [268] C. Xia J. Feng C. Ma H. Xi N. Song H. Dong L. Yu L. Dong Mol. Catal. 535 2023 112880 C. Xia, J. Feng, C. Ma, H. Xi, N. Song, H. Dong, L. Yu, L. Dong, Mol. Catal. 535 (2023) 112880. [269] Z. Li L. Zhang Q. Zhu Z. Ke G. Hu J. Colloid Interface Sci. 653 2024 1577 1587 Z. Li, L. Zhang, Q. Zhu, Z. Ke, G. Hu, J. Colloid Interface Sci. 653 (2024) 1577–1587. [270] Q. Du Y. Zhao Y. Chen J. Liu H. Li G. Bai K. Zhuo J. Wang Green Energy Environ. 8 2023 579 588 Q. Du, Y. Zhao, Y. Chen, J. Liu, H. Li, G. Bai, K. Zhuo, J. Wang, Green Energy Environ. 8 (2023) 579–588. [271] T.H. Mansoure H. Ayalew W.-L. Kao J.-J. Shyue S.-C. Luo Y.-C. Cheng H. Yu ACS Appl. Energy Mater. 3 2020 1171 1180 T.H. Mansoure, H. Ayalew, W.-L. Kao, J.-J. Shyue, S.-C. Luo, Y.-C. Cheng, H. Yu, ACS Appl. Energy Mater. 3 (2020) 1171–1180. [272] V.G. Khomenko V.Z. Barsukov A.S. Katashinskii Electrochim. Acta 50 2005 1675 1683 V.G. Khomenko, V.Z. Barsukov, A.S. Katashinskii, Electrochim. Acta 50 (2005) 1675–1683. [273] W.M. Millán T.T. Thompson L.G. Arriaga M.A. Smit Int. J. Hydrogen Energy 34 2009 694 702 W.M. Millán, T.T. Thompson, L.G. Arriaga, M.A. Smit, Int. J. Hydrogen Energy 34 (2009) 694–702. [274] R. Bao Z. Xiang Z. Qiao Y. Yang Y. Zhang D. Cao S. Wang Angew. Chemie Int. Ed. 62 2023 e202216751 R. Bao, Z. Xiang, Z. Qiao, Y. Yang, Y. Zhang, D. Cao, S. Wang, Angew. Chemie Int. Ed. 62 (2023) e202216751. [275] Z. Chen P. Fang X. Zou Z. Shi J. Zhang Z. Sun S. Guo F. Yan Small 20 2024 2401880 Z. Chen, P. Fang, X. Zou, Z. Shi, J. Zhang, Z. Sun, S. Guo, F. Yan, Small 20 (2024) 2401880. [276] P.D. Nayak D. Ohayon S. Wustoni S. Inal Adv. Mater. Technol. 7 2022 2100277 P.D. Nayak, D. Ohayon, S. Wustoni, S. Inal, Adv. Mater. Technol. 7 (2022) 2100277. [277] D. Taxi X. Maimaitiyiming Mater. Lett. 350 2023 134938 D. Taxi, X. Maimaitiyiming, Mater. Lett. 350 (2023) 134938. [278] C. Coutanceau A. El Hourch P. Crouigneau J.M. Leger C. Lamy Electrochim. Acta 40 1995 2739 2748 C. Coutanceau, A. El Hourch, P. Crouigneau, J.M. Leger, C. Lamy, Electrochim. Acta 40 (1995) 2739–2748. [279] R. Ma C. Tang Y. Wang X. Xu M. Wu X. Cui Y. Yang Angew. Chemie Int. Ed. 63 2024 e202405594 R. Ma, C. Tang, Y. Wang, X. Xu, M. Wu, X. Cui, Y. Yang, Angew. Chemie Int. Ed. 63 (2024) e202405594. [280] S. Singh M.K. Ghorai K.K. Kar J. Mater. Chem. A 11 2023 20290 20301 S. Singh, M.K. Ghorai, K.K. Kar, J. Mater. Chem. A 11 (2023) 20290–20301. Mahdi Soleimani Moghaddam got his PhD from the University of Mazandaran, Babolsar, Iran. His research interests include clean energy, electrochemical sciences, quantum technology, and especially PEM fuel cells. Meysam Seyfi Kafshgari got his PhD from Babol Noshirvani University of Technology. His research interests include wastewater treatment, gas sensors, electrochemical sciences, nano-biomaterials, and MOF technology. Ali Bahari is a Professor in the Faculty of Science at the University of Mazandaran, Babolsar, Iran. He is an expert in electrochemistry and clean energy. He is the author or coauthor of more than 50 papers in these fields. Leila Asadi Kafshgari got her PhD from Babol Noshirvani University of Technology. She received her master’s degree in Chemical Engineering-Polymer Engineering for her work on the fabrication and application of magnetic nano-adsorbent at Shomal University in 2016. Her current research interest covers polymer engineering, DFT modeling, and electrochemical sciences. Adeleh Jafari is a researcher in the Department of Solid-State Physics of the University of Mazandaran, Babolsar, Iran. Her research interests include electrochemistry, clean energy, and PEM fuel cells",
      "scopus-id": "105002841188",
      "coredata": {
        "eid": "1-s2.0-S2095495625002608",
        "dc:description": "The main challenge preventing the broad commercial use of polymer electrolyte membrane fuel cells (PEMFCs) is the dependence on noble metals, specifically electrocatalyst (EC) based on platinum (Pt) at the cathode, which is indispensable for assisting the oxygen reduction reaction (ORR) in fuel cells (FCs). Research on EC-containing non-noble metal (NNM) has been considerable over the past few decades to minimize costs and reduce the excessive loading of EC based on Pt. This review is aimed at improving the reliability and stability of non-precious metal EC. To achieve a feasible ORR, Pt-based EC is crucial for the widespread commercial applications of PEMFCs. The review emphasizes improving ORR performance, stability, and cost-effectiveness in catalysts that are not precious metals. The article examines the advancements in non-precious nanomaterial-based EC, highlighting different types that have improved ORR efficiency. The review suggests future possibilities and directions for further improvement in designing and constructing EC with high efficiency and low costs for PEMFCs.",
        "openArchiveArticle": "false",
        "prism:coverDate": "2025-08-31",
        "openaccessUserLicense": null,
        "prism:aggregationType": "Journal",
        "prism:url": "https://api.elsevier.com/content/article/pii/S2095495625002608",
        "dc:creator": [
          {
            "@_fa": "true",
            "$": "Moghaddam, Mahdi Soleimani"
          },
          {
            "@_fa": "true",
            "$": "Kafshgari, Meysam Seyfi"
          },
          {
            "@_fa": "true",
            "$": "Bahari, Ali"
          },
          {
            "@_fa": "true",
            "$": "Kafshgari, Leila Asadi"
          },
          {
            "@_fa": "true",
            "$": "Jafari, Adeleh"
          }
        ],
        "link": [
          {
            "@_fa": "true",
            "@rel": "self",
            "@href": "https://api.elsevier.com/content/article/pii/S2095495625002608"
          },
          {
            "@_fa": "true",
            "@rel": "scidir",
            "@href": "https://www.sciencedirect.com/science/article/pii/S2095495625002608"
          }
        ],
        "dc:format": "application/json",
        "openaccessType": null,
        "pii": "S2095-4956(25)00260-8",
        "prism:volume": "107",
        "prism:publisher": "Science Press and Dalian Institute of Chemical Physics, Chinese Academy of Sciences. Published by Elsevier B.V. and Science Press. All rights are reserved, including those for text and data mining, AI training, and similar technologies.",
        "dc:title": "Types, properties, and applications of non-precious oxygen reduction reaction electrocatalyst: A review",
        "prism:copyright": "© 2025 Science Press and Dalian Institute of Chemical Physics, Chinese Academy of Sciences. Published by Elsevier B.V. and Science Press. All rights are reserved, including those for text and data mining, AI training, and similar technologies.",
        "openaccess": "0",
        "prism:issn": "20954956",
        "dcterms:subject": [
          {
            "@_fa": "true",
            "$": "Fuel cells"
          },
          {
            "@_fa": "true",
            "$": "Oxygen reduction reaction"
          },
          {
            "@_fa": "true",
            "$": "Electrocatalyst"
          },
          {
            "@_fa": "true",
            "$": "Non-noble metal"
          },
          {
            "@_fa": "true",
            "$": "Nanomaterial"
          }
        ],
        "openaccessArticle": "false",
        "prism:publicationName": "Journal of Energy Chemistry",
        "openaccessSponsorType": null,
        "prism:pageRange": "305-344",
        "prism:endingPage": "344",
        "pubType": "rev",
        "prism:coverDisplayDate": "August 2025",
        "prism:doi": "10.1016/j.jechem.2025.03.045",
        "prism:startingPage": "305",
        "dc:identifier": "doi:10.1016/j.jechem.2025.03.045",
        "openaccessSponsorName": null
      },
      "objects": {
        "object": [
          {
            "@category": "standard",
            "@height": "155",
            "@width": "111",
            "@_fa": "true",
            "$": "https://api.elsevier.com/content/object/eid/1-s2.0-S2095495625002608-fx1.jpg?httpAccept=%2A%2F%2A",
            "@multimediatype": "JPEG image file",
            "@type": "IMAGE-DOWNSAMPLED",
            "@size": "6436",
            "@ref": "fx1",
            "@mimetype": "image/jpeg"
          },
          {
            "@category": "standard",
            "@height": "155",
            "@width": "111",
            "@_fa": "true",
            "$": "https://api.elsevier.com/content/object/eid/1-s2.0-S2095495625002608-fx2.jpg?httpAccept=%2A%2F%2A",
            "@multimediatype": "JPEG image file",
            "@type": "IMAGE-DOWNSAMPLED",
            "@size": "6680",
            "@ref": "fx2",
            "@mimetype": "image/jpeg"
          },
          {
            "@category": "standard",
            "@height": "155",
            "@width": "111",
            "@_fa": "true",
            "$": "https://api.elsevier.com/content/object/eid/1-s2.0-S2095495625002608-fx3.jpg?httpAccept=%2A%2F%2A",
            "@multimediatype": "JPEG image file",
            "@type": "IMAGE-DOWNSAMPLED",
            "@size": "6488",
            "@ref": "fx3",
            "@mimetype": "image/jpeg"
          },
          {
            "@category": "standard",
            "@height": "155",
            "@width": "111",
            "@_fa": "true",
            "$": "https://api.elsevier.com/content/object/eid/1-s2.0-S2095495625002608-fx4.jpg?httpAccept=%2A%2F%2A",
            "@multimediatype": "JPEG image file",
            "@type": "IMAGE-DOWNSAMPLED",
            "@size": "5655",
            "@ref": "fx4",
            "@mimetype": "image/jpeg"
          },
          {
            "@category": "standard",
            "@height": "200",
            "@width": "278",
            "@_fa": "true",
            "$": "https://api.elsevier.com/content/object/eid/1-s2.0-S2095495625002608-ga1.jpg?httpAccept=%2A%2F%2A",
            "@multimediatype": "JPEG image file",
            "@type": "IMAGE-DOWNSAMPLED",
            "@size": "19355",
            "@ref": "ga1",
            "@mimetype": "image/jpeg"
          },
          {
            "@category": "standard",
            "@height": "853",
            "@width": "706",
            "@_fa": "true",
            "$": "https://api.elsevier.com/content/object/eid/1-s2.0-S2095495625002608-gr1.jpg?httpAccept=%2A%2F%2A",
            "@multimediatype": "JPEG image file",
            "@type": "IMAGE-DOWNSAMPLED",
            "@size": "125870",
            "@ref": "gr1",
            "@mimetype": "image/jpeg"
          },
          {
            "@category": "standard",
            "@height": "281",
            "@width": "535",
            "@_fa": "true",
            "$": "https://api.elsevier.com/content/object/eid/1-s2.0-S2095495625002608-gr2.jpg?httpAccept=%2A%2F%2A",
            "@multimediatype": "JPEG image file",
            "@type": "IMAGE-DOWNSAMPLED",
            "@size": "47536",
            "@ref": "gr2",
            "@mimetype": "image/jpeg"
          },
          {
            "@category": "standard",
            "@height": "343",
            "@width": "628",
            "@_fa": "true",
            "$": "https://api.elsevier.com/content/object/eid/1-s2.0-S2095495625002608-gr3.jpg?httpAccept=%2A%2F%2A",
            "@multimediatype": "JPEG image file",
            "@type": "IMAGE-DOWNSAMPLED",
            "@size": "60462",
            "@ref": "gr3",
            "@mimetype": "image/jpeg"
          },
          {
            "@category": "standard",
            "@height": "408",
            "@width": "665",
            "@_fa": "true",
            "$": "https://api.elsevier.com/content/object/eid/1-s2.0-S2095495625002608-gr4.jpg?httpAccept=%2A%2F%2A",
            "@multimediatype": "JPEG image file",
            "@type": "IMAGE-DOWNSAMPLED",
            "@size": "44968",
            "@ref": "gr4",
            "@mimetype": "image/jpeg"
          },
          {
            "@category": "standard",
            "@height": "604",
            "@width": "768",
            "@_fa": "true",
            "$": "https://api.elsevier.com/content/object/eid/1-s2.0-S2095495625002608-gr5.jpg?httpAccept=%2A%2F%2A",
            "@multimediatype": "JPEG image file",
            "@type": "IMAGE-DOWNSAMPLED",
            "@size": "166798",
            "@ref": "gr5",
            "@mimetype": "image/jpeg"
          },
          {
            "@category": "standard",
            "@height": "605",
            "@width": "732",
            "@_fa": "true",
            "$": "https://api.elsevier.com/content/object/eid/1-s2.0-S2095495625002608-gr6.jpg?httpAccept=%2A%2F%2A",
            "@multimediatype": "JPEG image file",
            "@type": "IMAGE-DOWNSAMPLED",
            "@size": "127436",
            "@ref": "gr6",
            "@mimetype": "image/jpeg"
          },
          {
            "@category": "standard",
            "@height": "405",
            "@width": "727",
            "@_fa": "true",
            "$": "https://api.elsevier.com/content/object/eid/1-s2.0-S2095495625002608-gr7.jpg?httpAccept=%2A%2F%2A",
            "@multimediatype": "JPEG image file",
            "@type": "IMAGE-DOWNSAMPLED",
            "@size": "84901",
            "@ref": "gr7",
            "@mimetype": "image/jpeg"
          },
          {
            "@category": "standard",
            "@height": "476",
            "@width": "665",
            "@_fa": "true",
            "$": "https://api.elsevier.com/content/object/eid/1-s2.0-S2095495625002608-gr8.jpg?httpAccept=%2A%2F%2A",
            "@multimediatype": "JPEG image file",
            "@type": "IMAGE-DOWNSAMPLED",
            "@size": "90792",
            "@ref": "gr8",
            "@mimetype": "image/jpeg"
          },
          {
            "@category": "standard",
            "@height": "980",
            "@width": "661",
            "@_fa": "true",
            "$": "https://api.elsevier.com/content/object/eid/1-s2.0-S2095495625002608-gr9.jpg?httpAccept=%2A%2F%2A",
            "@multimediatype": "JPEG image file",
            "@type": "IMAGE-DOWNSAMPLED",
            "@size": "170549",
            "@ref": "gr9",
            "@mimetype": "image/jpeg"
          },
          {
            "@category": "thumbnail",
            "@height": "164",
            "@width": "117",
            "@_fa": "true",
            "$": "https://api.elsevier.com/content/object/eid/1-s2.0-S2095495625002608-fx1.sml?httpAccept=%2A%2F%2A",
            "@multimediatype": "GIF image file",
            "@type": "IMAGE-THUMBNAIL",
            "@size": "16706",
            "@ref": "fx1",
            "@mimetype": "image/gif"
          },
          {
            "@category": "thumbnail",
            "@height": "164",
            "@width": "117",
            "@_fa": "true",
            "$": "https://api.elsevier.com/content/object/eid/1-s2.0-S2095495625002608-fx2.sml?httpAccept=%2A%2F%2A",
            "@multimediatype": "GIF image file",
            "@type": "IMAGE-THUMBNAIL",
            "@size": "16607",
            "@ref": "fx2",
            "@mimetype": "image/gif"
          },
          {
            "@category": "thumbnail",
            "@height": "164",
            "@width": "117",
            "@_fa": "true",
            "$": "https://api.elsevier.com/content/object/eid/1-s2.0-S2095495625002608-fx3.sml?httpAccept=%2A%2F%2A",
            "@multimediatype": "GIF image file",
            "@type": "IMAGE-THUMBNAIL",
            "@size": "16868",
            "@ref": "fx3",
            "@mimetype": "image/gif"
          },
          {
            "@category": "thumbnail",
            "@height": "164",
            "@width": "117",
            "@_fa": "true",
            "$": "https://api.elsevier.com/content/object/eid/1-s2.0-S2095495625002608-fx4.sml?httpAccept=%2A%2F%2A",
            "@multimediatype": "GIF image file",
            "@type": "IMAGE-THUMBNAIL",
            "@size": "13724",
            "@ref": "fx4",
            "@mimetype": "image/gif"
          },
          {
            "@category": "thumbnail",
            "@height": "157",
            "@width": "219",
            "@_fa": "true",
            "$": "https://api.elsevier.com/content/object/eid/1-s2.0-S2095495625002608-ga1.sml?httpAccept=%2A%2F%2A",
            "@multimediatype": "GIF image file",
            "@type": "IMAGE-THUMBNAIL",
            "@size": "10976",
            "@ref": "ga1",
            "@mimetype": "image/gif"
          },
          {
            "@category": "thumbnail",
            "@height": "163",
            "@width": "135",
            "@_fa": "true",
            "$": "https://api.elsevier.com/content/object/eid/1-s2.0-S2095495625002608-gr1.sml?httpAccept=%2A%2F%2A",
            "@multimediatype": "GIF image file",
            "@type": "IMAGE-THUMBNAIL",
            "@size": "8198",
            "@ref": "gr1",
            "@mimetype": "image/gif"
          },
          {
            "@category": "thumbnail",
            "@height": "115",
            "@width": "219",
            "@_fa": "true",
            "$": "https://api.elsevier.com/content/object/eid/1-s2.0-S2095495625002608-gr2.sml?httpAccept=%2A%2F%2A",
            "@multimediatype": "GIF image file",
            "@type": "IMAGE-THUMBNAIL",
            "@size": "16763",
            "@ref": "gr2",
            "@mimetype": "image/gif"
          },
          {
            "@category": "thumbnail",
            "@height": "120",
            "@width": "219",
            "@_fa": "true",
            "$": "https://api.elsevier.com/content/object/eid/1-s2.0-S2095495625002608-gr3.sml?httpAccept=%2A%2F%2A",
            "@multimediatype": "GIF image file",
            "@type": "IMAGE-THUMBNAIL",
            "@size": "8488",
            "@ref": "gr3",
            "@mimetype": "image/gif"
          },
          {
            "@category": "thumbnail",
            "@height": "134",
            "@width": "219",
            "@_fa": "true",
            "$": "https://api.elsevier.com/content/object/eid/1-s2.0-S2095495625002608-gr4.sml?httpAccept=%2A%2F%2A",
            "@multimediatype": "GIF image file",
            "@type": "IMAGE-THUMBNAIL",
            "@size": "8508",
            "@ref": "gr4",
            "@mimetype": "image/gif"
          },
          {
            "@category": "thumbnail",
            "@height": "164",
            "@width": "208",
            "@_fa": "true",
            "$": "https://api.elsevier.com/content/object/eid/1-s2.0-S2095495625002608-gr5.sml?httpAccept=%2A%2F%2A",
            "@multimediatype": "GIF image file",
            "@type": "IMAGE-THUMBNAIL",
            "@size": "19351",
            "@ref": "gr5",
            "@mimetype": "image/gif"
          },
          {
            "@category": "thumbnail",
            "@height": "164",
            "@width": "198",
            "@_fa": "true",
            "$": "https://api.elsevier.com/content/object/eid/1-s2.0-S2095495625002608-gr6.sml?httpAccept=%2A%2F%2A",
            "@multimediatype": "GIF image file",
            "@type": "IMAGE-THUMBNAIL",
            "@size": "16243",
            "@ref": "gr6",
            "@mimetype": "image/gif"
          },
          {
            "@category": "thumbnail",
            "@height": "122",
            "@width": "219",
            "@_fa": "true",
            "$": "https://api.elsevier.com/content/object/eid/1-s2.0-S2095495625002608-gr7.sml?httpAccept=%2A%2F%2A",
            "@multimediatype": "GIF image file",
            "@type": "IMAGE-THUMBNAIL",
            "@size": "11524",
            "@ref": "gr7",
            "@mimetype": "image/gif"
          },
          {
            "@category": "thumbnail",
            "@height": "157",
            "@width": "219",
            "@_fa": "true",
            "$": "https://api.elsevier.com/content/object/eid/1-s2.0-S2095495625002608-gr8.sml?httpAccept=%2A%2F%2A",
            "@multimediatype": "GIF image file",
            "@type": "IMAGE-THUMBNAIL",
            "@size": "17061",
            "@ref": "gr8",
            "@mimetype": "image/gif"
          },
          {
            "@category": "thumbnail",
            "@height": "163",
            "@width": "110",
            "@_fa": "true",
            "$": "https://api.elsevier.com/content/object/eid/1-s2.0-S2095495625002608-gr9.sml?httpAccept=%2A%2F%2A",
            "@multimediatype": "GIF image file",
            "@type": "IMAGE-THUMBNAIL",
            "@size": "8587",
            "@ref": "gr9",
            "@mimetype": "image/gif"
          },
          {
            "@category": "high",
            "@height": "688",
            "@width": "492",
            "@_fa": "true",
            "$": "https://api.elsevier.com/content/object/eid/1-s2.0-S2095495625002608-fx1_lrg.jpg?httpAccept=%2A%2F%2A",
            "@multimediatype": "JPEG image file",
            "@type": "IMAGE-HIGH-RES",
            "@size": "38840",
            "@ref": "fx1",
            "@mimetype": "image/jpeg"
          },
          {
            "@category": "high",
            "@height": "688",
            "@width": "492",
            "@_fa": "true",
            "$": "https://api.elsevier.com/content/object/eid/1-s2.0-S2095495625002608-fx2_lrg.jpg?httpAccept=%2A%2F%2A",
            "@multimediatype": "JPEG image file",
            "@type": "IMAGE-HIGH-RES",
            "@size": "42365",
            "@ref": "fx2",
            "@mimetype": "image/jpeg"
          },
          {
            "@category": "high",
            "@height": "688",
            "@width": "492",
            "@_fa": "true",
            "$": "https://api.elsevier.com/content/object/eid/1-s2.0-S2095495625002608-fx3_lrg.jpg?httpAccept=%2A%2F%2A",
            "@multimediatype": "JPEG image file",
            "@type": "IMAGE-HIGH-RES",
            "@size": "42394",
            "@ref": "fx3",
            "@mimetype": "image/jpeg"
          },
          {
            "@category": "high",
            "@height": "688",
            "@width": "492",
            "@_fa": "true",
            "$": "https://api.elsevier.com/content/object/eid/1-s2.0-S2095495625002608-fx4_lrg.jpg?httpAccept=%2A%2F%2A",
            "@multimediatype": "JPEG image file",
            "@type": "IMAGE-HIGH-RES",
            "@size": "35823",
            "@ref": "fx4",
            "@mimetype": "image/jpeg"
          },
          {
            "@category": "high",
            "@height": "886",
            "@width": "1234",
            "@_fa": "true",
            "$": "https://api.elsevier.com/content/object/eid/1-s2.0-S2095495625002608-ga1_lrg.jpg?httpAccept=%2A%2F%2A",
            "@multimediatype": "JPEG image file",
            "@type": "IMAGE-HIGH-RES",
            "@size": "149910",
            "@ref": "ga1",
            "@mimetype": "image/jpeg"
          },
          {
            "@category": "high",
            "@height": "3778",
            "@width": "3126",
            "@_fa": "true",
            "$": "https://api.elsevier.com/content/object/eid/1-s2.0-S2095495625002608-gr1_lrg.jpg?httpAccept=%2A%2F%2A",
            "@multimediatype": "JPEG image file",
            "@type": "IMAGE-HIGH-RES",
            "@size": "666552",
            "@ref": "gr1",
            "@mimetype": "image/jpeg"
          },
          {
            "@category": "high",
            "@height": "1244",
            "@width": "2368",
            "@_fa": "true",
            "$": "https://api.elsevier.com/content/object/eid/1-s2.0-S2095495625002608-gr2_lrg.jpg?httpAccept=%2A%2F%2A",
            "@multimediatype": "JPEG image file",
            "@type": "IMAGE-HIGH-RES",
            "@size": "260159",
            "@ref": "gr2",
            "@mimetype": "image/jpeg"
          },
          {
            "@category": "high",
            "@height": "1519",
            "@width": "2782",
            "@_fa": "true",
            "$": "https://api.elsevier.com/content/object/eid/1-s2.0-S2095495625002608-gr3_lrg.jpg?httpAccept=%2A%2F%2A",
            "@multimediatype": "JPEG image file",
            "@type": "IMAGE-HIGH-RES",
            "@size": "342412",
            "@ref": "gr3",
            "@mimetype": "image/jpeg"
          },
          {
            "@category": "high",
            "@height": "1085",
            "@width": "1767",
            "@_fa": "true",
            "$": "https://api.elsevier.com/content/object/eid/1-s2.0-S2095495625002608-gr4_lrg.jpg?httpAccept=%2A%2F%2A",
            "@multimediatype": "JPEG image file",
            "@type": "IMAGE-HIGH-RES",
            "@size": "127627",
            "@ref": "gr4",
            "@mimetype": "image/jpeg"
          },
          {
            "@category": "high",
            "@height": "2673",
            "@width": "3399",
            "@_fa": "true",
            "$": "https://api.elsevier.com/content/object/eid/1-s2.0-S2095495625002608-gr5_lrg.jpg?httpAccept=%2A%2F%2A",
            "@multimediatype": "JPEG image file",
            "@type": "IMAGE-HIGH-RES",
            "@size": "922274",
            "@ref": "gr5",
            "@mimetype": "image/jpeg"
          },
          {
            "@category": "high",
            "@height": "2676",
            "@width": "3239",
            "@_fa": "true",
            "$": "https://api.elsevier.com/content/object/eid/1-s2.0-S2095495625002608-gr6_lrg.jpg?httpAccept=%2A%2F%2A",
            "@multimediatype": "JPEG image file",
            "@type": "IMAGE-HIGH-RES",
            "@size": "683314",
            "@ref": "gr6",
            "@mimetype": "image/jpeg"
          },
          {
            "@category": "high",
            "@height": "1793",
            "@width": "3220",
            "@_fa": "true",
            "$": "https://api.elsevier.com/content/object/eid/1-s2.0-S2095495625002608-gr7_lrg.jpg?httpAccept=%2A%2F%2A",
            "@multimediatype": "JPEG image file",
            "@type": "IMAGE-HIGH-RES",
            "@size": "420750",
            "@ref": "gr7",
            "@mimetype": "image/jpeg"
          },
          {
            "@category": "high",
            "@height": "2107",
            "@width": "2946",
            "@_fa": "true",
            "$": "https://api.elsevier.com/content/object/eid/1-s2.0-S2095495625002608-gr8_lrg.jpg?httpAccept=%2A%2F%2A",
            "@multimediatype": "JPEG image file",
            "@type": "IMAGE-HIGH-RES",
            "@size": "506212",
            "@ref": "gr8",
            "@mimetype": "image/jpeg"
          },
          {
            "@category": "high",
            "@height": "4337",
            "@width": "2926",
            "@_fa": "true",
            "$": "https://api.elsevier.com/content/object/eid/1-s2.0-S2095495625002608-gr9_lrg.jpg?httpAccept=%2A%2F%2A",
            "@multimediatype": "JPEG image file",
            "@type": "IMAGE-HIGH-RES",
            "@size": "952353",
            "@ref": "gr9",
            "@mimetype": "image/jpeg"
          },
          {
            "@category": "thumbnail",
            "@_fa": "true",
            "$": "https://api.elsevier.com/content/object/eid/1-s2.0-S2095495625002608-si1.svg?httpAccept=%2A%2F%2A",
            "@multimediatype": "Scalable Vector Graphics file",
            "@type": "ALTIMG",
            "@size": "9569",
            "@ref": "si1",
            "@mimetype": "image/svg+xml"
          },
          {
            "@category": "thumbnail",
            "@_fa": "true",
            "$": "https://api.elsevier.com/content/object/eid/1-s2.0-S2095495625002608-si2.svg?httpAccept=%2A%2F%2A",
            "@multimediatype": "Scalable Vector Graphics file",
            "@type": "ALTIMG",
            "@size": "5750",
            "@ref": "si2",
            "@mimetype": "image/svg+xml"
          },
          {
            "@category": "thumbnail",
            "@_fa": "true",
            "$": "https://api.elsevier.com/content/object/eid/1-s2.0-S2095495625002608-si3.svg?httpAccept=%2A%2F%2A",
            "@multimediatype": "Scalable Vector Graphics file",
            "@type": "ALTIMG",
            "@size": "15426",
            "@ref": "si3",
            "@mimetype": "image/svg+xml"
          },
          {
            "@category": "thumbnail",
            "@_fa": "true",
            "$": "https://api.elsevier.com/content/object/eid/1-s2.0-S2095495625002608-si4.svg?httpAccept=%2A%2F%2A",
            "@multimediatype": "Scalable Vector Graphics file",
            "@type": "ALTIMG",
            "@size": "10326",
            "@ref": "si4",
            "@mimetype": "image/svg+xml"
          },
          {
            "@category": "thumbnail",
            "@_fa": "true",
            "$": "https://api.elsevier.com/content/object/eid/1-s2.0-S2095495625002608-si5.svg?httpAccept=%2A%2F%2A",
            "@multimediatype": "Scalable Vector Graphics file",
            "@type": "ALTIMG",
            "@size": "17176",
            "@ref": "si5",
            "@mimetype": "image/svg+xml"
          }
        ]
      },
      "link": {
        "@rel": "abstract",
        "@href": "https://api.elsevier.com/content/abstract/scopus_id/105002841188"
      }
    }
  }
}