{
  "metadata": {
    "title": "Emerging role of graphitic carbon nitride in advanced supercapacitors: A comprehensive review",
    "authors": "; ; ",
    "journal": "Journal of Energy Chemistry",
    "date": "2025-04-30",
    "doi": "10.1016/j.jechem.2024.11.075",
    "abstract": "",
    "uri": "https://api.elsevier.com/content/article/pii/S2095495624008532",
    "pii": "S2095495624008532"
  },
  "fulltext": {
    "full-text-retrieval-response": {
      "scopus-eid": "2-s2.0-85213558839",
      "originalText": "serial JL 286353 291210 291711 291744 291809 31 90 Journal of Energy Chemistry JOURNALENERGYCHEMISTRY 2024-12-18 2024-12-18 2024-12-29 2024-12-29 2025-03-21T19:58:27 1-s2.0-S2095495624008532 S2095-4956(24)00853-2 S2095495624008532 10.1016/j.jechem.2024.11.075 S300 S300.1 FULL-TEXT 1-s2.0-S2095495624X00133 2025-03-23T02:31:14.400374Z 0 0 20250401 20250430 2025 2024-12-19T00:38:23.306434Z absattachment articleinfo articletitlenorm authfirstinitialnorm authfirstsurnamenorm cid cids contenttype copyright crossmark dateloaded dateloadedtxt datesearch datesort dateupdated dco docsubtype doctype doi eid ewtransactionid fundingbodyid hubeid indexeddate issn issnnorm itemstage itemtransactionid itemweight oauserlicense openaccess openarchive pg pgfirst pglast pii piinorm pubdateend pubdatestart pubdatetxt pubyr sortorder sponsoredaccesstype srctitle srctitlenorm srctype ssids alllist content oa subj subheadings suppl tomb volfirst volissue volumelist webpdf webpdfpagecount yearnav figure table body acknowledge affil articletitle auth authfirstini authfull authkeywords authlast primabst pubtype ref specialabst vitae 2095-4956 20954956 UNLIMITED MAHEHYB23 false 103 103 C Volume 103 39 498 524 498 524 202504 April 2025 2025-04-01 2025-04-30 2025 article rev © 2024 Science Press and Dalian Institute of Chemical Physics, Chinese Academy of Sciences. Published by Elsevier B.V. and Science Press. EMERGINGROLEGRAPHITICCARBONNITRIDEINADVANCEDSUPERCAPACITORSACOMPREHENSIVEREVIEW CHALUVACHAR P 1 Introduction 2 Graphitic carbon nitride (g-C3N4) 2.1 Structure, properties, and synthesis of pristine g-C3N4 2.2 Functionalization of g-C3N4 2.3 Theoretical studies of g-C3N4 3 Heterostructures of g-C3N4 3.1 Heteroatom doping 3.2 g-C3N4-metal composites 3.2.1 g-C3N4 and metal oxides 3.2.2 g-C3N4, metal hydroxides and LDH 3.2.3 g-C3N4, metal sulfides and TMDs 3.2.4 g-C3N4 and others 3.3 g-C3N4-carbon composites 3.3.1 g-C3N4 and graphene 3.3.2 g-C3N4 and CNTs 3.4 g-C3N4-conducting polymer composites 3.5 Ternary and multiphase composites 4 Energy storage applications 4.1 Battery-type hybrid capacitors 4.2 All solid-state and flexible supercapacitors 4.3 Photo-supercapacitors 5 Conclusion and future perspective Declaration of generative AI and AI-assisted technologies in the writing process CRediT authorship contribution statement Acknowledgments References PAL 2019 3807 3835 B DHANDAPANI 2022 104937 E RIAZ 2021 1 33 A REZK 2021 6110 6126 H NEWBY 2023 12613 12629 S NARDEKAR 2023 1 9 S ZHANG 2023 106602 Q ZHANG 2023 100229 J SUTAR 2023 109035 S SU 2018 327 336 X CHOUDHARY 2017 1605336 N SHAIKH 2022 161998 N ATES 2022 27 52 M IBRAHIM 2022 12828 12836 M HOQUE 2022 105988 A MOHDABDAH 2020 108199 M KHALADKAR 2024 11408 11420 S MELISSEN 2021 2853 2859 S WANG 2012 1596 1606 X ZHU 2014 16449 16465 J ZHANG 2020 3599 3607 X DAS 2024 234374 H LUO 2019 901 924 Y CHAN 2019 14993 15003 M CAO 2015 2150 2176 S CHENA 2023 100003 Y LI 2019 5399 5408 W ASHRITHA 2020 101840 M ARORA 2023 112552 R XU 2013 3766 3798 M MAHESHWARAN 2022 105900 G KUMAR 2018 482 495 K ANSARI 2017 1 11 S ZHOU 2021 27 42 D WANG 2017 624 630 X SILVA 2016 41 49 A AHMAD 2024 15100 15109 T WANG 2023 106935 H VATTIKUTI 2023 9412 9423 S ZHANG 2020 2133 2144 X ZHANG 2019 65 77 S HAO 2020 18 37 Q GOVINDARAJU 2021 128693 V MAGESA 2019 e00064 F INAGAKI 2019 580 607 M VINOTH 2021 116274 S MANGISETTI 2019 264 277 S HUANG 2019 19020 19029 H SHRUTI 2024 128826 M SHI 2015 335 346 Q WEI 2018 472 477 B MUNUSAMY 2021 116669 S LIN 2020 6341 6351 Z ALGARASILLER 2014 7450 7455 G ZHAO 2015 298 318 Y GHAEMMAGHAMI 2019 2176 2204 M ZHANG 2021 116709 W PILATHOTTATHIL 2022 115573 S ASAITHAMBIA 2021 158807 S SELVARAJ 2024 1210 1223 K GHANEM 2022 104850 L IQBAL 2023 101080 O IDRIS 2019 101032 M WANG 2016 3305 3328 L WANG 2023 432 Q LIU 2016 303 310 L KUMAR 2023 107496 A LI 2020 765 786 Y GONG 2017 1 9 Y LI 2019 283 290 F MALIK 2021 110235 R ZHANG 2021 106184 W YANG 2020 101909 Z TAHIR 2013 13949 13955 M IDRIS 2019 219 230 M GONCALVES 2018 35327 35336 R TAHIR 2014 1258 1265 M LIN 2017 25545 25554 R SHWETHA 2023 219 226 K QU 2019 A3564 A3569 Y ZHOU 2018 14065 14068 Y RUSHO 2024 1 5 M SUTER 2018 25183 25194 T DHANDA 2024 117344 M QASIM 2024 325 335 K XU 2024 154449 C WANG 2018 510 515 M TALUKDAR 2022 308 331 M KONG 2018 261 271 L PARK 2022 137116 S SHAN 2017 103 106 Q YESMIN 2021 103308 S TRIPATHI 2023 107974 V DING 2016 14307 14315 Y PAKZAD 2023 16294 16319 P ZHANG 2021 108165 Y CHEN 2020 3 10 X LI 2017 617 625 Z BANDYOPADHYAY 2018 824 838 P VEERESH 2022 104715 S LIN 2021 1897 1918 Y HUSSAIN 2020 1 23 S YESMIN 2023 109383 S SANTOS 2024 410 418 R KAVIL 2018 2244 2251 J LU 2023 123973 Q PARVEEN 2023 26822 26838 S FAWAZ 2023 118345 M HAO 2016 515 526 C OJHA 2018 83 88 D REDDY 2021 103302 N XU 2019 5109 5119 X SIWAL 2020 2 S WU 2020 116601 S SHI 2015 150 153 L DONG 2017 17890 17896 B LIU 2020 108263 H AGHAZADEH 2020 101743 M VIVEKA 2022 164541 E VIVEK 2021 15205 15212 E XU 2022 104541 Z ZHANG 2015 292 301 L LI 2022 165805 Z ADHIKARI 2018 4455 4466 S PATIL 2019 33643 33652 B SANATI 2019 743 757 S ZHAO 2022 27369 27378 Y ZHAO 2017 1206 1212 F SAFAEI 2018 22346 22380 J WANG 2022 163784 X RAGUPATHI 2019 88 91 V JIANG 2017 41 47 D VINOTH 2021 204 215 S GAO 2022 132745 Y NABI 2020 27601 27607 G MAJUMDAR 2021 114825 D DING 2022 22121 M KHALADKAR 2023 304 313 S MEFTAHI 2022 141052 A MEFTAHI 2022 125683 A PALLAVOLU 2023 108725 M SUGANYA 2023 117341 M SHI 2021 126284 Y ANTIL 2022 104731 B BAI 2018 982 992 L PANICKER 2023 142376 N GUAN 2022 1190 1199 Y RANGARAJ 2023 1 10 V ZHANG 2022 10 22 S WANG 2020 234 240 X BASHIR 2021 115626 S SAMTHAM 2022 104418 M HIMADRIREDDY 2023 117447 P KUMAR 2021 3987 4001 S DONG 2019 369 377 G VERMA 2020 109363 C NAVANEETHANDURAISAMYA 2020 298 307 K HARPUTLU 2022 25687 25703 E CHAMEH 2022 22295 22306 B ZHANG 2017 4982 4991 J SUN 2019 558 561 S GANESANA 2016 46 51 J FAROOQ 2023 7127 7136 N KUMAR 2023 101385 S WENHUAZUO 2017 1600539 R SIRIMANNE 2023 2465 D SHEN 2021 638 645 Q YUAN 2021 34238 34247 X LIN 2022 84 93 R ZHONG 2023 102887 L PALIWAL 2020 136871 M PRADEEPA 2024 105084 S SONIA 2023 9111 9129 Y WANG 2021 103053 Y LU 2019 4103 4111 C ASL 2022 104223 M ZHU 2021 1 5 H TANG 2019 98 Z DING 2021 923 929 M ZHANG 2022 154015 S NG 2015 169 185 C SUN 2017 1700002 Y ONG 2016 7159 7329 W BORUAH 2020 5967 5974 B ALTAF 2023 142415 C PALANIVELA 2019 143807 B MANIKANDAN 2024 1 12 V VARATHARAJAN 2023 13704 13715 P PECENEK 2023 107075 H RANI 2021 108671 B CHEN 2022 165769 L HOU 2020 135996 L ALROWAILY 2024 1 13 A IRSHAD 2023 167705 A MANGIRI 2023 7479 7489 R RABIA 2022 2234 M YESMIN 2022 136540 S POLAT 2022 24609 24618 S RANJITHKUMAR 2023 172 183 R BENGOUIDERTRABELSI 2022 4 11 A LE 2023 1 11 G SHI 2020 1901975 M LIU 2023 1 15 W POURSHAHMIR 2023 8127 8143 M LIANG 2022 122845 R TRABELSI 2022 1 9 A ELSAYED 2023 3118 3127 A VADIVEL 2024 172670 M MA 2019 346 353 J XIE 2023 8670 8678 H RAZA 2024 117534 M XAVIER 2023 18147 18168 J XAVIER 2024 J SELVARAJ 2024 7957 7969 K NEHA 2024 5286 5297 A CHALUVACHARX2025X498 CHALUVACHARX2025X498X524 CHALUVACHARX2025X498XP CHALUVACHARX2025X498X524XP Full 2024-12-17T17:29:47Z ElsevierWaived Manipal Academy of Higher Education 2023 http://creativecommons.org/licenses/by/4.0/ 2026-12-29T00:00:00.000Z 2026-12-29T00:00:00.000Z http://creativecommons.org/licenses/by-nc-nd/4.0/ This is an open access article under the CC BY license. © 2024 Science Press and Dalian Institute of Chemical Physics, Chinese Academy of Sciences. Published by Elsevier B.V. and Science Press. 2025-01-03T04:29:44.265Z http://vtw.elsevier.com/data/voc/AddOnTypes/50.7/aggregated-refined Manipal Institute of Technology Manipal Academy of Higher Education MAHE Manipal Academy of Higher Education http://data.elsevier.com/vocabulary/SciValFunders/100019305 http://sws.geonames.org/1269750/ The authors wish to acknowledge the financial support of the TMA pai scholarship from the Manipal Institute of Technology, Manipal Academy of Higher Education, Manipal, in achieving this milestone. item S2095-4956(24)00853-2 S2095495624008532 1-s2.0-S2095495624008532 10.1016/j.jechem.2024.11.075 286353 2025-03-23T02:31:14.400374Z 2025-04-01 2025-04-30 UNLIMITED MAHEHYB23 1-s2.0-S2095495624008532-main.pdf https://s3-eu-west-1.amazonaws.com/prod-ucs-content-store-eu-west/content/pii:S2095495624008532/MAIN/application/pdf/a470f01f5f5a4eca3fa590cef7f0950e/main.pdf main.pdf pdf true 10617520 MAIN 27 1-s2.0-S2095495624008532-main_1.png https://s3-eu-west-1.amazonaws.com/prod-ucs-content-store-eu-west/content/pii:S2095495624008532/PREVIEW/image/png/6d1ae545650a5c97e158c6ba84742eef/main_1.png main_1.png png 58501 849 656 IMAGE-WEB-PDF 1 1-s2.0-S2095495624008532-fx1.jpg https://s3-eu-west-1.amazonaws.com/prod-ucs-content-store-eu-west/content/pii:S2095495624008532/fx1/DOWNSAMPLED/image/jpeg/8488e7bea13c0d925c8533f8ede3ea5c/fx1.jpg fx1 fx1.jpg jpg 6810 145 111 IMAGE-DOWNSAMPLED 1-s2.0-S2095495624008532-fx2.jpg https://s3-eu-west-1.amazonaws.com/prod-ucs-content-store-eu-west/content/pii:S2095495624008532/fx2/DOWNSAMPLED/image/jpeg/b6d789106b80cc468787ba39e0144005/fx2.jpg fx2 fx2.jpg jpg 5661 127 111 IMAGE-DOWNSAMPLED 1-s2.0-S2095495624008532-fx3.jpg https://s3-eu-west-1.amazonaws.com/prod-ucs-content-store-eu-west/content/pii:S2095495624008532/fx3/MAIN/image/jpeg/913f3fdcf4710e88a948812314793d24/fx3.jpg fx3 fx3.jpg jpg 5945 133 111 IMAGE-DOWNSAMPLED 1-s2.0-S2095495624008532-fx4.jpg https://s3-eu-west-1.amazonaws.com/prod-ucs-content-store-eu-west/content/pii:S2095495624008532/fx4/DOWNSAMPLED/image/jpeg/7ff985e88fd1c23b57e0976ea51a6726/fx4.jpg fx4 fx4.jpg jpg 6260 139 111 IMAGE-DOWNSAMPLED 1-s2.0-S2095495624008532-fx5.jpg https://s3-eu-west-1.amazonaws.com/prod-ucs-content-store-eu-west/content/pii:S2095495624008532/fx5/DOWNSAMPLED/image/jpeg/8adfa25fe269b26978f2258536aebeb8/fx5.jpg fx5 fx5.jpg jpg 5509 146 111 IMAGE-DOWNSAMPLED 1-s2.0-S2095495624008532-fx6.jpg https://s3-eu-west-1.amazonaws.com/prod-ucs-content-store-eu-west/content/pii:S2095495624008532/fx6/DOWNSAMPLED/image/jpeg/51c1c8a700bd21b2bc82dbf1411c01c2/fx6.jpg fx6 fx6.jpg jpg 5514 140 111 IMAGE-DOWNSAMPLED 1-s2.0-S2095495624008532-ga1.jpg https://s3-eu-west-1.amazonaws.com/prod-ucs-content-store-eu-west/content/pii:S2095495624008532/ga1/DOWNSAMPLED/image/jpeg/c9b3f1012ae08066175674c00d116ecc/ga1.jpg ga1 true ga1.jpg jpg 32641 244 244 IMAGE-DOWNSAMPLED 1-s2.0-S2095495624008532-gr1.jpg https://s3-eu-west-1.amazonaws.com/prod-ucs-content-store-eu-west/content/pii:S2095495624008532/gr1/DOWNSAMPLED/image/jpeg/85b725fdaa0c5268049200af71557537/gr1.jpg gr1 gr1.jpg jpg 144960 591 709 IMAGE-DOWNSAMPLED 1-s2.0-S2095495624008532-gr10.jpg https://s3-eu-west-1.amazonaws.com/prod-ucs-content-store-eu-west/content/pii:S2095495624008532/gr10/DOWNSAMPLED/image/jpeg/1ff178e61321b8296a87663f731ad6ab/gr10.jpg gr10 gr10.jpg jpg 198902 835 696 IMAGE-DOWNSAMPLED 1-s2.0-S2095495624008532-gr11.jpg https://s3-eu-west-1.amazonaws.com/prod-ucs-content-store-eu-west/content/pii:S2095495624008532/gr11/DOWNSAMPLED/image/jpeg/20501d5f38b8596f407c1d8149da109d/gr11.jpg gr11 gr11.jpg jpg 130679 630 709 IMAGE-DOWNSAMPLED 1-s2.0-S2095495624008532-gr12.jpg https://s3-eu-west-1.amazonaws.com/prod-ucs-content-store-eu-west/content/pii:S2095495624008532/gr12/DOWNSAMPLED/image/jpeg/d133eb9b2caa9f766010af6450640d5e/gr12.jpg gr12 gr12.jpg jpg 135402 979 713 IMAGE-DOWNSAMPLED 1-s2.0-S2095495624008532-gr13.jpg https://s3-eu-west-1.amazonaws.com/prod-ucs-content-store-eu-west/content/pii:S2095495624008532/gr13/DOWNSAMPLED/image/jpeg/a8c1c0061353d41cca2533bd0900751c/gr13.jpg gr13 gr13.jpg jpg 180032 862 712 IMAGE-DOWNSAMPLED 1-s2.0-S2095495624008532-gr14.jpg https://s3-eu-west-1.amazonaws.com/prod-ucs-content-store-eu-west/content/pii:S2095495624008532/gr14/DOWNSAMPLED/image/jpeg/a4388e8685803950735c86cab07e87d1/gr14.jpg gr14 gr14.jpg jpg 121918 616 749 IMAGE-DOWNSAMPLED 1-s2.0-S2095495624008532-gr15.jpg https://s3-eu-west-1.amazonaws.com/prod-ucs-content-store-eu-west/content/pii:S2095495624008532/gr15/DOWNSAMPLED/image/jpeg/65d0bdd4b440a523e0cf8004e3a55ec7/gr15.jpg gr15 gr15.jpg jpg 127009 798 647 IMAGE-DOWNSAMPLED 1-s2.0-S2095495624008532-gr16.jpg https://s3-eu-west-1.amazonaws.com/prod-ucs-content-store-eu-west/content/pii:S2095495624008532/gr16/DOWNSAMPLED/image/jpeg/875be7aa2a9187520cfc8af437b663ae/gr16.jpg gr16 gr16.jpg jpg 175390 710 670 IMAGE-DOWNSAMPLED 1-s2.0-S2095495624008532-gr2.jpg https://s3-eu-west-1.amazonaws.com/prod-ucs-content-store-eu-west/content/pii:S2095495624008532/gr2/DOWNSAMPLED/image/jpeg/ed352af7d3061a059b964f63bc1c143c/gr2.jpg gr2 gr2.jpg jpg 163218 708 708 IMAGE-DOWNSAMPLED 1-s2.0-S2095495624008532-gr3.jpg https://s3-eu-west-1.amazonaws.com/prod-ucs-content-store-eu-west/content/pii:S2095495624008532/gr3/DOWNSAMPLED/image/jpeg/7d318ad818f26b073cc5dd22f5b75402/gr3.jpg gr3 gr3.jpg jpg 86606 489 628 IMAGE-DOWNSAMPLED 1-s2.0-S2095495624008532-gr4.jpg https://s3-eu-west-1.amazonaws.com/prod-ucs-content-store-eu-west/content/pii:S2095495624008532/gr4/DOWNSAMPLED/image/jpeg/1ed72f573a51fb3e0edf2e94e1601121/gr4.jpg gr4 gr4.jpg jpg 32068 206 637 IMAGE-DOWNSAMPLED 1-s2.0-S2095495624008532-gr5.jpg https://s3-eu-west-1.amazonaws.com/prod-ucs-content-store-eu-west/content/pii:S2095495624008532/gr5/DOWNSAMPLED/image/jpeg/9ff9a0ec7235d6d35091cda9c44eefb1/gr5.jpg gr5 gr5.jpg jpg 129161 832 669 IMAGE-DOWNSAMPLED 1-s2.0-S2095495624008532-gr6.jpg https://s3-eu-west-1.amazonaws.com/prod-ucs-content-store-eu-west/content/pii:S2095495624008532/gr6/DOWNSAMPLED/image/jpeg/1ed65f1198e321c653f8be81454086f5/gr6.jpg gr6 gr6.jpg jpg 162852 761 689 IMAGE-DOWNSAMPLED 1-s2.0-S2095495624008532-gr7.jpg https://s3-eu-west-1.amazonaws.com/prod-ucs-content-store-eu-west/content/pii:S2095495624008532/gr7/DOWNSAMPLED/image/jpeg/0a599bf887156ca29d5fb8433adf79ab/gr7.jpg gr7 gr7.jpg jpg 140567 546 672 IMAGE-DOWNSAMPLED 1-s2.0-S2095495624008532-gr8.jpg https://s3-eu-west-1.amazonaws.com/prod-ucs-content-store-eu-west/content/pii:S2095495624008532/gr8/HEAD-TAIL/image/jpeg/da8a9b7e48041619d7e63f74e5659bfe/gr8.jpg gr8 gr8.jpg jpg 161286 831 714 IMAGE-DOWNSAMPLED 1-s2.0-S2095495624008532-gr9.jpg https://s3-eu-west-1.amazonaws.com/prod-ucs-content-store-eu-west/content/pii:S2095495624008532/gr9/MAIN/image/jpeg/2e3ceb5b466232680db4c3aedad4fffe/gr9.jpg gr9 gr9.jpg jpg 145208 622 628 IMAGE-DOWNSAMPLED 1-s2.0-S2095495624008532-fx1.sml https://s3-eu-west-1.amazonaws.com/prod-ucs-content-store-eu-west/content/pii:S2095495624008532/fx1/THUMBNAIL/image/gif/07b9e00c3a286ff8b35375f2a13a8108/fx1.sml fx1 fx1.sml sml 18302 164 126 IMAGE-THUMBNAIL 1-s2.0-S2095495624008532-fx2.sml https://s3-eu-west-1.amazonaws.com/prod-ucs-content-store-eu-west/content/pii:S2095495624008532/fx2/THUMBNAIL/image/gif/52291a0115194490c325c1f67dee0df2/fx2.sml fx2 fx2.sml sml 18075 164 143 IMAGE-THUMBNAIL 1-s2.0-S2095495624008532-fx3.sml https://s3-eu-west-1.amazonaws.com/prod-ucs-content-store-eu-west/content/pii:S2095495624008532/fx3/DOWNSAMPLED/image/gif/fcdf49b0118427c7e0b9cd36ea5501be/fx3.sml fx3 fx3.sml sml 16141 163 136 IMAGE-THUMBNAIL 1-s2.0-S2095495624008532-fx4.sml https://s3-eu-west-1.amazonaws.com/prod-ucs-content-store-eu-west/content/pii:S2095495624008532/fx4/THUMBNAIL/image/gif/c036f1497fe6cda737cf11e0fbd4a387/fx4.sml fx4 fx4.sml sml 17657 163 130 IMAGE-THUMBNAIL 1-s2.0-S2095495624008532-fx5.sml https://s3-eu-west-1.amazonaws.com/prod-ucs-content-store-eu-west/content/pii:S2095495624008532/fx5/THUMBNAIL/image/gif/4b188f1cb5846a6d4ca32571d087a394/fx5.sml fx5 fx5.sml sml 15716 164 125 IMAGE-THUMBNAIL 1-s2.0-S2095495624008532-fx6.sml https://s3-eu-west-1.amazonaws.com/prod-ucs-content-store-eu-west/content/pii:S2095495624008532/fx6/THUMBNAIL/image/gif/1e5b45f6d0d4331551840dd34754caee/fx6.sml fx6 fx6.sml sml 13066 164 130 IMAGE-THUMBNAIL 1-s2.0-S2095495624008532-ga1.sml https://s3-eu-west-1.amazonaws.com/prod-ucs-content-store-eu-west/content/pii:S2095495624008532/ga1/THUMBNAIL/image/gif/a1a0902e1e04bc4aac9ce18ffa4a2c94/ga1.sml ga1 true ga1.sml sml 16775 163 163 IMAGE-THUMBNAIL 1-s2.0-S2095495624008532-gr1.sml https://s3-eu-west-1.amazonaws.com/prod-ucs-content-store-eu-west/content/pii:S2095495624008532/gr1/THUMBNAIL/image/gif/9516a7583fb4179c0e7f3ff201b9e2a3/gr1.sml gr1 gr1.sml sml 17187 164 197 IMAGE-THUMBNAIL 1-s2.0-S2095495624008532-gr10.sml https://s3-eu-west-1.amazonaws.com/prod-ucs-content-store-eu-west/content/pii:S2095495624008532/gr10/THUMBNAIL/image/gif/1e3fe26a76a0b4f3d17fa896f98cf59e/gr10.sml gr10 gr10.sml sml 13398 163 136 IMAGE-THUMBNAIL 1-s2.0-S2095495624008532-gr11.sml https://s3-eu-west-1.amazonaws.com/prod-ucs-content-store-eu-west/content/pii:S2095495624008532/gr11/THUMBNAIL/image/gif/e2845faa9f1ec386ceb0d30558bdc98b/gr11.sml gr11 gr11.sml sml 15073 163 184 IMAGE-THUMBNAIL 1-s2.0-S2095495624008532-gr12.sml https://s3-eu-west-1.amazonaws.com/prod-ucs-content-store-eu-west/content/pii:S2095495624008532/gr12/DOWNSAMPLED/image/gif/47982373a792c4bfc9955a86f4aa27ed/gr12.sml gr12 gr12.sml sml 8245 163 119 IMAGE-THUMBNAIL 1-s2.0-S2095495624008532-gr13.sml https://s3-eu-west-1.amazonaws.com/prod-ucs-content-store-eu-west/content/pii:S2095495624008532/gr13/THUMBNAIL/image/gif/e376b10f2d48b668834ad13d7358727c/gr13.sml gr13 gr13.sml sml 11583 163 135 IMAGE-THUMBNAIL 1-s2.0-S2095495624008532-gr14.sml https://s3-eu-west-1.amazonaws.com/prod-ucs-content-store-eu-west/content/pii:S2095495624008532/gr14/THUMBNAIL/image/gif/c84ff1a301fac977d0a40c41a334ee71/gr14.sml gr14 gr14.sml sml 14222 164 199 IMAGE-THUMBNAIL 1-s2.0-S2095495624008532-gr15.sml https://s3-eu-west-1.amazonaws.com/prod-ucs-content-store-eu-west/content/pii:S2095495624008532/gr15/THUMBNAIL/image/gif/8c56ac927f7d4a6d223e436a36eca42a/gr15.sml gr15 gr15.sml sml 12810 164 133 IMAGE-THUMBNAIL 1-s2.0-S2095495624008532-gr16.sml https://s3-eu-west-1.amazonaws.com/prod-ucs-content-store-eu-west/content/pii:S2095495624008532/gr16/THUMBNAIL/image/gif/dcde1dc243bacb0853805f181fb71ac0/gr16.sml gr16 gr16.sml sml 13939 164 155 IMAGE-THUMBNAIL 1-s2.0-S2095495624008532-gr2.sml https://s3-eu-west-1.amazonaws.com/prod-ucs-content-store-eu-west/content/pii:S2095495624008532/gr2/THUMBNAIL/image/gif/6baf817658a0bfccfda78d7bff1a196f/gr2.sml gr2 gr2.sml sml 17091 164 164 IMAGE-THUMBNAIL 1-s2.0-S2095495624008532-gr3.sml https://s3-eu-west-1.amazonaws.com/prod-ucs-content-store-eu-west/content/pii:S2095495624008532/gr3/THUMBNAIL/image/gif/41ab5f0764d1224da225e824a90817d5/gr3.sml gr3 gr3.sml sml 13609 164 211 IMAGE-THUMBNAIL 1-s2.0-S2095495624008532-gr4.sml https://s3-eu-west-1.amazonaws.com/prod-ucs-content-store-eu-west/content/pii:S2095495624008532/gr4/DOWNSAMPLED/image/gif/28f352190464483e6a517d79e3bf3c07/gr4.sml gr4 gr4.sml sml 4994 71 219 IMAGE-THUMBNAIL 1-s2.0-S2095495624008532-gr5.sml https://s3-eu-west-1.amazonaws.com/prod-ucs-content-store-eu-west/content/pii:S2095495624008532/gr5/HEAD-TAIL/image/gif/a39eb868d5bb7a8987558c9fa85b8450/gr5.sml gr5 gr5.sml sml 9426 164 132 IMAGE-THUMBNAIL 1-s2.0-S2095495624008532-gr6.sml https://s3-eu-west-1.amazonaws.com/prod-ucs-content-store-eu-west/content/pii:S2095495624008532/gr6/THUMBNAIL/image/gif/d6f1c333e7e2e24a805a24e5d766c892/gr6.sml gr6 gr6.sml sml 13198 164 148 IMAGE-THUMBNAIL 1-s2.0-S2095495624008532-gr7.sml https://s3-eu-west-1.amazonaws.com/prod-ucs-content-store-eu-west/content/pii:S2095495624008532/gr7/THUMBNAIL/image/gif/de59d28da8223266c4aeba20d90186e0/gr7.sml gr7 gr7.sml sml 19911 163 201 IMAGE-THUMBNAIL 1-s2.0-S2095495624008532-gr8.sml https://s3-eu-west-1.amazonaws.com/prod-ucs-content-store-eu-west/content/pii:S2095495624008532/gr8/THUMBNAIL/image/gif/3e9c0365f89b019a1d7f18842700b52f/gr8.sml gr8 gr8.sml sml 13273 164 141 IMAGE-THUMBNAIL 1-s2.0-S2095495624008532-gr9.sml https://s3-eu-west-1.amazonaws.com/prod-ucs-content-store-eu-west/content/pii:S2095495624008532/gr9/THUMBNAIL/image/gif/07cfd7c7dbb557770bbf7db254c41a9d/gr9.sml gr9 gr9.sml sml 15665 163 165 IMAGE-THUMBNAIL 1-s2.0-S2095495624008532-fx1_lrg.jpg https://s3-eu-west-1.amazonaws.com/prod-ucs-content-store-eu-west/content/pii:S2095495624008532/HIGHRES/image/jpeg/7d6ad93dcd42c0ebdc66ddaf1a9f906f/fx1_lrg.jpg fx1 fx1_lrg.jpg jpg 44189 641 492 IMAGE-HIGH-RES 1-s2.0-S2095495624008532-fx2_lrg.jpg https://s3-eu-west-1.amazonaws.com/prod-ucs-content-store-eu-west/content/pii:S2095495624008532/HIGHRES/image/jpeg/85e30904dee298f4d41af98e08719fe3/fx2_lrg.jpg fx2 fx2_lrg.jpg jpg 37374 564 492 IMAGE-HIGH-RES 1-s2.0-S2095495624008532-fx3_lrg.jpg https://s3-eu-west-1.amazonaws.com/prod-ucs-content-store-eu-west/content/pii:S2095495624008532/HIGHRES/image/jpeg/c1ce6b019a7e235c51a045927a1d6fe4/fx3_lrg.jpg fx3 fx3_lrg.jpg jpg 52514 591 492 IMAGE-HIGH-RES 1-s2.0-S2095495624008532-fx4_lrg.jpg https://s3-eu-west-1.amazonaws.com/prod-ucs-content-store-eu-west/content/pii:S2095495624008532/HIGHRES/image/jpeg/154f927232f598195ec9dafdc6fdd6b5/fx4_lrg.jpg fx4 fx4_lrg.jpg jpg 49913 617 492 IMAGE-HIGH-RES 1-s2.0-S2095495624008532-fx5_lrg.jpg https://s3-eu-west-1.amazonaws.com/prod-ucs-content-store-eu-west/content/pii:S2095495624008532/DOWNSAMPLED/image/jpeg/0d94b69e6075ba841b4c6c1383ae04e4/fx5_lrg.jpg fx5 fx5_lrg.jpg jpg 35752 645 492 IMAGE-HIGH-RES 1-s2.0-S2095495624008532-fx6_lrg.jpg https://s3-eu-west-1.amazonaws.com/prod-ucs-content-store-eu-west/content/pii:S2095495624008532/HIGHRES/image/jpeg/9522d3ee713397e8844dc3e3f32977a1/fx6_lrg.jpg fx6 fx6_lrg.jpg jpg 43954 619 492 IMAGE-HIGH-RES 1-s2.0-S2095495624008532-ga1_lrg.jpg https://s3-eu-west-1.amazonaws.com/prod-ucs-content-store-eu-west/content/pii:S2095495624008532/THUMBNAIL/image/jpeg/6b66d62cd717dc9124409fac87b59331/ga1_lrg.jpg ga1 true ga1_lrg.jpg jpg 233394 1085 1083 IMAGE-HIGH-RES 1-s2.0-S2095495624008532-gr1_lrg.jpg https://s3-eu-west-1.amazonaws.com/prod-ucs-content-store-eu-west/content/pii:S2095495624008532/HIGHRES/image/jpeg/898b12048bba4e2a49edc1ff767a28b0/gr1_lrg.jpg gr1 gr1_lrg.jpg jpg 891536 2617 3139 IMAGE-HIGH-RES 1-s2.0-S2095495624008532-gr10_lrg.jpg https://s3-eu-west-1.amazonaws.com/prod-ucs-content-store-eu-west/content/pii:S2095495624008532/HIGHRES/image/jpeg/d26a4edd5387f0cce8641f845364e680/gr10_lrg.jpg gr10 gr10_lrg.jpg jpg 1081905 3693 3080 IMAGE-HIGH-RES 1-s2.0-S2095495624008532-gr11_lrg.jpg https://s3-eu-west-1.amazonaws.com/prod-ucs-content-store-eu-west/content/pii:S2095495624008532/HIGHRES/image/jpeg/c3cf8c5571f39883c0351737f1a2d1e6/gr11_lrg.jpg gr11 gr11_lrg.jpg jpg 747130 2791 3141 IMAGE-HIGH-RES 1-s2.0-S2095495624008532-gr12_lrg.jpg https://s3-eu-west-1.amazonaws.com/prod-ucs-content-store-eu-west/content/pii:S2095495624008532/HIGHRES/image/jpeg/3dc10d346c55b6d9123ccd6710f01a3f/gr12_lrg.jpg gr12 gr12_lrg.jpg jpg 725718 4335 3157 IMAGE-HIGH-RES 1-s2.0-S2095495624008532-gr13_lrg.jpg https://s3-eu-west-1.amazonaws.com/prod-ucs-content-store-eu-west/content/pii:S2095495624008532/HIGHRES/image/jpeg/a7e8200410e209aa19de025ffdb94896/gr13_lrg.jpg gr13 gr13_lrg.jpg jpg 1028339 3818 3154 IMAGE-HIGH-RES 1-s2.0-S2095495624008532-gr14_lrg.jpg https://s3-eu-west-1.amazonaws.com/prod-ucs-content-store-eu-west/content/pii:S2095495624008532/HIGHRES/image/jpeg/1a8073ed7a2aec4f811f3f20ed2478fe/gr14_lrg.jpg gr14 gr14_lrg.jpg jpg 656971 2728 3318 IMAGE-HIGH-RES 1-s2.0-S2095495624008532-gr15_lrg.jpg https://s3-eu-west-1.amazonaws.com/prod-ucs-content-store-eu-west/content/pii:S2095495624008532/THUMBNAIL/image/jpeg/7314ade86f6d8482874c6f1b7f7b402e/gr15_lrg.jpg gr15 gr15_lrg.jpg jpg 643276 3531 2863 IMAGE-HIGH-RES 1-s2.0-S2095495624008532-gr16_lrg.jpg https://s3-eu-west-1.amazonaws.com/prod-ucs-content-store-eu-west/content/pii:S2095495624008532/HIGHRES/image/jpeg/c0d77c084292fe86dc9b2157a633d492/gr16_lrg.jpg gr16 gr16_lrg.jpg jpg 1164667 3145 2968 IMAGE-HIGH-RES 1-s2.0-S2095495624008532-gr2_lrg.jpg https://s3-eu-west-1.amazonaws.com/prod-ucs-content-store-eu-west/content/pii:S2095495624008532/HIGHRES/image/jpeg/5f69f8d8e6729c16cbfc5e8163d1c540/gr2_lrg.jpg gr2 gr2_lrg.jpg jpg 868477 3139 3137 IMAGE-HIGH-RES 1-s2.0-S2095495624008532-gr3_lrg.jpg https://s3-eu-west-1.amazonaws.com/prod-ucs-content-store-eu-west/content/pii:S2095495624008532/HIGHRES/image/jpeg/da8c6bcb0c4062f5fdf4c45b499e1e94/gr3_lrg.jpg gr3 gr3_lrg.jpg jpg 453532 2165 2782 IMAGE-HIGH-RES 1-s2.0-S2095495624008532-gr4_lrg.jpg https://s3-eu-west-1.amazonaws.com/prod-ucs-content-store-eu-west/content/pii:S2095495624008532/HIGHRES/image/jpeg/cb42d7a252d448ee5ebdce8e23143d1f/gr4_lrg.jpg gr4 gr4_lrg.jpg jpg 161499 911 2823 IMAGE-HIGH-RES 1-s2.0-S2095495624008532-gr5_lrg.jpg https://s3-eu-west-1.amazonaws.com/prod-ucs-content-store-eu-west/content/pii:S2095495624008532/HIGHRES/image/jpeg/b52a9e6d209bafdefbca99dcd11e1d0a/gr5_lrg.jpg gr5 gr5_lrg.jpg jpg 718321 3688 2964 IMAGE-HIGH-RES 1-s2.0-S2095495624008532-gr6_lrg.jpg https://s3-eu-west-1.amazonaws.com/prod-ucs-content-store-eu-west/content/pii:S2095495624008532/HIGHRES/image/jpeg/53f339c14dd47b7a9b5b06cba48c8e25/gr6_lrg.jpg gr6 gr6_lrg.jpg jpg 929361 3371 3051 IMAGE-HIGH-RES 1-s2.0-S2095495624008532-gr7_lrg.jpg https://s3-eu-west-1.amazonaws.com/prod-ucs-content-store-eu-west/content/pii:S2095495624008532/HIGHRES/image/jpeg/c4455df68584e4f75139df5d046f37fb/gr7_lrg.jpg gr7 gr7_lrg.jpg jpg 798056 2420 2976 IMAGE-HIGH-RES 1-s2.0-S2095495624008532-gr8_lrg.jpg https://s3-eu-west-1.amazonaws.com/prod-ucs-content-store-eu-west/content/pii:S2095495624008532/DOWNSAMPLED/image/jpeg/88db679d3e44b5483b406d4e663414ab/gr8_lrg.jpg gr8 gr8_lrg.jpg jpg 870003 3678 3162 IMAGE-HIGH-RES 1-s2.0-S2095495624008532-gr9_lrg.jpg https://s3-eu-west-1.amazonaws.com/prod-ucs-content-store-eu-west/content/pii:S2095495624008532/HIGHRES/image/jpeg/b524181552cca5e0ad363aad4cf769da/gr9_lrg.jpg gr9 gr9_lrg.jpg jpg 753728 2755 2782 IMAGE-HIGH-RES JECHEM 4322 S2095-4956(24)00853-2 10.1016/j.jechem.2024.11.075 Science Press Fig. 1 (a) Schematic representation of the structure of a supercapacitor. Reproduced with permission from Ref. [10]. Copyright 2023, Elsevier. Types of supercapacitors: (b) EDLC (c) pseudocapacitor, and (d) hybrid supercapacitor. Reproduced with permission from Ref. [1]. Copyright 2019, Royal Society of Chemistry. Fig. 2 Various composites of g-C3N4 for supercapacitor applications. Fig. 3 (a) Triazine and (b) heptazine structures of g-C3N4. (c) Functional groups of g-C3N4. Reproduced with permission from Ref. [43]. Copyright 2019, Elsevier. (d) Preparation of g-C3N4 from melamine. (e) FT-IR spectrum. (f) XRD spectrum. (g) SEM image of g-C3N4. Reproduced with permission from Ref. [62]. Copyright 2024, Royal Society of Chemistry. Fig. 4 Schematic representation of chemical etching used to convert bulk g-C3N4 into edge-functionalized g-C3N4. Reproduced with permission from Ref. [75]. Copyright 2020, Elsevier. Fig. 5 (a) Scheme of the synthesis of Au-Cu/g-C3N4. Reproduced with permission from Ref. [94]. Copyright 2021, Elsevier. (b) XRD spectrum of Co-Ni/g-C3N4. (c) TEM micrograph of Co-Ni/g-C3N4. (d) Pore size distribution analysis of Co-Ni/g-C3N4. (e) CV curve of Co-Ni/g-C3N4 and carbon at 30 mV s−1. (f) Plot of i c vs. v and i p vs. v 1/2 of Co-Ni/g-C3N4. Reproduced with permission from Ref. [95]. Copyright 2023, Elsevier. Fig. 6 (a) Scheme of the synthesis of the Cu2O nanoflakes, CdFe2O4 nanoparticles, sheet-like g-C3N4, and Cu2O-CdFe2O4@g-C3N4 heterojunctions. (b) Specific capacitance from CV for g-C3N4, Cu2O, CdFe2O4, Cu2O/g-C3N4, CdFe2O4/g-C3N4, Cu2O-CdFe2O4, and Cu2O-CdFe2O4@g-C3N4 electrodes. (c) Ragone plots at varying current densities for g-C3N4, Cu2O, CdFe2O4, Cu2O/g-C3N4, CdFe2O4/g-C3N4, Cu2O-CdFe2O4, and Cu2O-CdFe2O4@g-C3N4 electrodes. (d) Cycling stability of the Cu2O-CdFe2O4@g-C3N4 electrode. Reproduced with permission from Ref. [113]. Copyright 2019, Elsevier. Fig. 7 (a) Scheme of the synthesis of NiFe-LDH@SCN. Zeta potential values of (b) NiFe-LDH and (c) SCN. Reproduced with permission from Ref. [126]. Copyright 2022, Elsevier. SEM images of (d) f-NiCo-LDH/g-CN2, (e) NiFe-LDH@SCN-32, and (f) f-NiCo-LDH/g-C3N4. Reproduced with permission from Ref. [124]. Copyright 2022, Elsevier. Fig. 8 (a) Fabrication route for NiCo2Fe x -LDH@g-C3N4. SEM images of (b) NC@CN, (c) NF1.0C@CN, and (d) NF1.5C@CN. (e) CV curves of NF1.0C@CN and NFC. (f) GCD graphs of NF1.0C@CN and NFC. (g) Ragone plot for various electrodes. (h) Cycling stability graph for the NF1.0C@CN//AC cell. Reproduced with permission from Ref. [130]. Copyright 2022, Elsevier. Fig. 9 (a) Scheme of the synthesis of NiSe/g-C3N4. (b) FE-SEM image of the NiSe/g-C3N4. (c) HR-TEM image of the NiSe/g-C3N4. (d) CV cycles at a scan rate of 10 mV s−1. (e) GCD cycles at 1 A g−1. (f) Nyquist plots of the g-C3N4, NiSe, and NiSe/g-C3N4 electrodes. (g) Plots of the specific capacity of g-C3N4, NiSe, and NiSe/g-C3N4 versus the current density. (h) Specific capacity and coulombic efficiency variation with cycle number for the NiSe/g-C3N4 device. (i) Ragone plot for the sample electrodes. Reproduced with permission from Ref. [141]. Copyright 2023, Elsevier. Fig. 10 (a) Schematic illustration of the synthesis of fg-C3N4-rGO/LDH. (b) FE-SEM images of fg-C3N4-rGO/LDH. (c) Specific capacitance vs. current density plot. (d) Cyclic stability test at 7.5 A g−1 (inset shows the GCD curves of the first 5 and last 5 cycles). (e) Ragone plot (energy density vs. power density) at a 1.6 V working potential (inset: glowing LED light). Reproduced with permission from Ref. [101]. Copyright 2018, Elsevier. Fig. 11 (a) Graphical abstract of the assembly of the MnMoO4@g-C3N4/CNT composite. SEM images of (b) g-C3N4, (c) g-C3N4/CNT, and (d) MnMoO4@g-C3N4/CNT. (e) CV profiles at a scan rate of 2 mV s−1. (f) EIS measurements at frequencies ranging from 0.01 Hz to 200 kHz. (g) Variation in the specific capacity of g-C3N4/CNT and MnMoO4@g-C3N4/CNT at different current densities. Reproduced with permission from Ref. [152]. Copyright 2023, Elsevier. Fig. 12 (a) Schematic illustration of binder-free thin film deposition on semiflexible nickel foam. The inset shows a photographic image of the pyrrole solution and g-C3N4/pyrrole composite. (b) CV curves at a 5 mV s−1 of scan rate. (c) Areal capacity versus current density. (d) Cycling stability of the g-C3N4/PPy composite for up to 10,000 cycles. (e) Nyquist plots of PPy and g-C3N4/PPy. Reproduced with permission from Ref. [161]. Copyright 2020, Elsevier. Fig. 13 (a) Scheme of the synthesis of MnO2/g-C3N4@PPy. Reproduced with permission from Ref. [165]. Copyright 2019 Elsevier. (b) TEM image of the PTh/g-C3N4/V2O5 nanocomposite. (c) Nitrogen adsorption-desorption curves. (d) Graphs of the pore size distribution. (e) CV profiles of PTh, PTh/V2O5, PTh/GCN, and PTh/GCN/V2O5. (f) Specific capacitances and (g) retention rates of specific capacitance for PTh, PTh/V2O5, PTh/GCN, and PTh/GCN/V2O5. Reproduced with permission from Ref. [166]. Copyright 2016, Elsevier. Fig. 14 (a) Schematic illustration of the synthesis of MoS2-SnS@g-C3N4/graphene. Electrochemical measurement of the SIB half-cell. (b) Cyclic voltammograms and (c) GCD cycles of the MoS2-SnS@g-C3N4/graphene electrode. (d) Cycling performance of MoS2-SnS@g-C3N4/graphene at 2 A g−1. (e) Schematic illustration of the discharge process for MoS2-SnS@g-C3N4/graphene||AC SIHCs. Reproduced with permission from Ref. [172]. Copyright 2021, American Chemical Society. Fig. 15 (a) Method of preparing Ti3C2T x /g-C3N4 heterostructure films. (b) Digital photos of devices under flat and bending conditions. (c) CV curves of Ti3C2T x /g-C3N4 flexible electrodes under different bending conditions at 20 mV s−1. (d) Capacity of Ti3C2T x /g-C3N4 films with different content ratios of g-C3N4 at varying current densities. (e) Nyquist graphs of various film electrodes; the inset shows the artificial circuit. Reproduced with permission from Ref. [184]. Copyright 2022, Elsevier. Fig. 16 (a) HR-TEM image of g-C3N4/ZnFe2O4. (b) UV-DRS absorption spectra of ZnFe2O4, g-C3N4, and g-C3N4/ZnFe2O4. (c) Probable reaction mechanism. Electrochemical analysis (d) CV profiles of the ZnFe2O4/g-C3N4 electrode. (e) Efficiency vs. photocatalytic MB degradation cycles of the ZnFe2O4/g-C3N4 composite catalyst. (f) Cycling stability of the ZnFe2O4/g-C3N4 electrode for 500 cycles. Reproduced with permission from Ref. [190]. Copyright 2019, Elsevier. Table 1 Supercapacitive performance of binary and ternary composites of g-C3N4. Electrode Device Electrolyte Fabrication method Specific capacitance Current density Energy density Power density Retention rate Ref. Binary composites g-C3N4/Bi2WO6 SC (Anode) 1 M KOH/5 M KOH Hydrothermal 158 mF g−1 1 mA cm−2 [191] g-C3N4/BiCoO3 Asymmetric SC 2 M KOH Hydrothermal 341 F g−1 1 A g−1 35 Wh kg−1 2800 W kg−1 98.82% (1000) [192] g-C3N4/BiFeO3 Hybrid SC 2 M KOH Hydrothermal & ball milling 330 F g−1 1 A g−1 244.8 Wh kg−1 1.155 kW kg−1 [193] g-C3N4/BiFeO3 SC 2 M KOH Hydrothermal 1164 F g−1 [194] g-C3N4/CoFe2O4 SC 2 M KOH Solvothermal & polyol synthesis 524 F g−1 98% (5000) [195] g-C3N4/ZIF-67-derived Co2NiO4 Asymmetric SC 3 M KOH Solvothermal 1701 F g−1 1 A g−1 49.37 Wh kg−1 − 91.5% (5000) [196] ND-g-C3N4/Ov-NiCo2O4 Asymmetric SC 6 M KOH Electrostatic interaction & annealing 1998 F g−1 2 A g−1 70.22 Wh kg−1 0.80 kW kg−1 95.22% (5000) [197] g-C3N4/NiFe2O4 SC 2 M KOH Hydrothermal 740 F g−1 1 A g−1 38 Wh kg−1 305 W kg−1 (5000) [198] Ternary composites g-C3N4/Ag/NiAl2O4 SC 6 M KOH Sol-gel & ultrasonication 768 F g−1 27 Wh kg−1 187.28 W kg−1 94.01% (6000) [199] g-C3N4/CaMoO4/ZIF-67 Asymmetric solid-state SC PVA-KOH gel Hydrothermal 586 C g−1 1 A g−1 − − 94% (5000) [200] g-C3N4/CoS/Co2O3 Symmetric SC 0.5 M HCL/6 M NaOH Hydrothermal 361 and 92 F g−1 28.7 and 30.2 Wh kg−1 98.5% (1000) [201] g-C3N4/Cu/CoFe2O4 Asymmetric solid-state SC PVA/KOH gel Chemical coprecipitation method 1380 F g−1 1 A g−1 144.4 Wh kg−1 7.992 kW kg−1 86.4% (10,000) [202] g-C3N4/Graphene/CuFe2O4 SC (Anode) 6 M KOH Hydrothermal 989 mF cm−2 2 mA cm−2 27.8 mWh cm−2 300 mW cm−2 70% (1500) [203] g-C3N4/Ag/TiO2 SC 3 M KOH Incipient wetness impregnation& thermal spreading [204] g-C3N4/CuS/CuO Symmetric SC 0.5 M HCl Hydrothermal 370 F g−1 0.3 A g−1 37 Wh kg−1 − − [205] g-C3N4/Fe2O3/CNT Symmetric SC Na2SO4 Hydrothermal 610 F g−1 0.2 A g−1 − − − [206] g-C3N4/FQD/MXene Solid-state SC EMIMBF4 IL ionogel Ultrasonication 77.12 mWh cm−3 6000 mW cm−3 [207] g-C3N4/MnCo2O4/Co(OH)2 Symmetric SC 6 M KOH Hydrothermal, calcination, & chemical bath method 1932 F g−1 0.5 A g−1 23.2 Wh kg−1 600 W kg−1 83.3% (10000) [208] g-C3N4/NiCo-LDH/NiCo2S4 Asymmetric SC 6 M KOH − 246.0 F g−1 1 A g−1 65.2 Wh kg−1 750 W kg−1 93.3% (10000) [209] g-C3N4/NiMoO4/CoMoO4 Asymmetric SC (Anode) 2 M KOH Hydrothermal 641.5 F g−1 84.21% (8000) [210] g-C3N4/NiS/NiO Symmetric SC 0.6 M HCl Hydrothermal 766 F g−1 0.3 A g−1 23.55 Wh kg−1 − − [211] g-C3N4/ZnS/ZnO Symmetric SC 1 M Na2SO4 Hydrothermal 152.2 F g−1 − 11.87 Wh kg−1 − 90.2% (500) [212] PAA/g-C3N4/CoFe2O4 SC & solar light irradiated photocatalysis 3 M KOH Ultrasonication 1470 F g−1 1 A g−1 − − [213] PANI/Ag/g-C3N4 Symmetric SC 1 M H2SO4 In situ oxidative polymerization 797.8 F g−1 1 A g−1 − − 95.57% (1000) [214] PANI/g-C3N4/MXene Symmetric solid-state SC PVA-H2SO4 gel In situ polymerization 570 F g−1 − 18.8 Wh kg−1 1563 W kg−1 [215] PANI/NiCo2S4/g-C3N4 SC 6 M KOH Hydrothermal, thermal condensation, & chemical oxidative polymerization 1799.07 F g−1 2 mA cm−2 − − 90% (2700) [216] PIn/g-C3N4/MnO2 SC 3 M KOH In situ oxidation polymerization 1377 F g−1 5 A g−1 990 Wh kg−1 3305 W kg−1 98% (10000) [217] Ppy/g-C3N4/Ta2O5 SC 3 M KOH In situ oxidation polymerization & surface adsorption 1190 F g−1 1 A g−1 82.0 Wh kg−1 12,000 W kg−1 90.8% (5000) [218] Nitrogen-rich porous carbon (NRPC)/g-C3N4/Fe3O4 SC 1 M KOH Sintering & hydrothermal 385 F g−1 1 A g−1 − − 94.3% (2000) [219] gC3N4/MoS2/rGO SC & photocatalysis 3 M KOH Hydrothermal & ultrasonication 74 F g−1 35 mA cm−2 5.3 Wh kg−1 337 W kg−1 − [220] Review Emerging role of graphitic carbon nitride in advanced supercapacitors: A comprehensive review Priyanka Chaluvachar Writing – review & editing Writing – original draft Methodology Formal analysis Data curation Conceptualization a Y.N. Sudhakar Writing – review & editing Writing – original draft Visualization Resources Conceptualization b G.T. Mahesha Writing – review & editing Supervision Project administration Conceptualization a Vishnu G. Nair Writing – review & editing Supervision Formal analysis a Nakul Desai Formal analysis Data curation b Dayananda K. Pai Writing – review & editing Visualization Supervision Conceptualization a ⁎ a Department of Aeronautical and Automobile Engineering, Manipal Institute of Technology, Manipal Academy of Higher Education, Manipal 576104, Karnataka, India Department of Aeronautical and Automobile Engineering Manipal Institute of Technology Manipal Academy of Higher Education Manipal Karnataka 576104 India Department of Aeronautical and Automobile Engineering, Manipal Institute of Technology, Manipal Academy of Higher Education, Manipal 576104, Karnataka, India b Department of Chemistry, Manipal Institute of Technology, Manipal Academy of Higher Education, Manipal 576104, Karnataka, India Department of Chemistry Manipal Institute of Technology Manipal Academy of Higher Education Manipal Karnataka 576104 India Department of Chemistry, Manipal Institute of Technology, Manipal Academy of Higher Education, Manipal 576104, Karnataka, India ⁎ Corresponding author. Graphical abstract Graphitic carbon nitride (g-C3N4) is a nitrogen-rich semiconducting material that combines various metal oxides, transition metal dichalcogenides (TMDs), graphene, PEDOT, etc., leveraging the strengths of each component while mitigating the limitations of g-C3N4. These g-C3N4-based battery-type, flexible, and photo-supercapacitors enable their advanced energy applications. Graphitic carbon nitride (g-C3N4), known for its green and abundant nature and composed of carbon and nitrogen in a two-dimensional structure, has emerged as a significant area of interest across various disciplines, particularly in energy conversion and storage. Its recent demonstrations of high potential in supercapacitor applications mark it as a promising alternative to graphene within the realm of materials science. Numerous favorable features, such as chemical and thermal stability, abundant nitrogen content, eco-friendly attributes, and gentle conditions for synthesis, are shown. This review summarizes recent advancements in the use of g-C3N4 and its composites as electrodes for supercapacitors, highlighting the advantages and issues associated with g-C3N4 in these applications. This emphasizes situations where the composition of g-C3N4 with other materials, such as metal oxides, metal chalcogenides, carbon materials, and conducting polymers, overcomes its limitations, leading to composite materials with improved functionalities. This review discusses the challenges that still need to be addressed and the possible future roles of g-C3N4 in the research of advanced supercapacitor technology, such as battery-hybrid supercapacitors, flexible supercapacitors, and photo-supercapacitors. Keywords Graphitic carbon nitride Metal oxides Graphene Conducting polymers Battery-type hybrid supercapacitors Flexible supercapacitors Photo-supercapacitors 1 Introduction Energy conversion and storage are among today's most vital necessities because of the rapid expansion of the global economy, urbanization, and improvements in living standards. Significant global challenges, such as the depletion of fossil fuel reserves and environmental pollution, have led to zero-emission and renewable energy technologies becoming a priority [1–3]. Electrochemical energy storage systems, including batteries and supercapacitors (SCs), have significantly impacted the energy application domain in recent years. Compared with batteries, supercapacitors are particularly attractive because of their long-term durability, operational safety, and eco-friendliness [4,5]. SCs have potential applications in various fields, including industrial electronics [6], robots [7], automobiles [8], and renewable energy storage [9]. Electrochemical capacitors, or SCs, are energy storage systems that operate with a structure similar to a battery. They contain two electrodes, charged positively and negatively, with a separator between them and an electrolyte filling the space, as shown in Fig. 1 (a) [10]. Unlike traditional batteries, the working principle of SCs involves storing and releasing energy through electrostatic charge separation rather than chemical reactions. SCs accumulate energy in the form of an electrostatic field between the electrode surfaces and the ions in the electrolyte, making them more stable over multiple charging cycles and allowing them to charge and discharge more quickly than batteries do [11,12]. SCs are categorized into electrochemical double-layer capacitors (EDLCs) (Fig. 1b), pseudocapacitors (Fig. 1c), and hybrid capacitors (Fig. 1d) according to their energy storage process. In EDLCs, the charge is stored electrostatically at the interface between the electrode and electrolyte. Conversely, in pseudocapacitors, the charge is stored owing to changes in oxidation states caused by faradaic redox reactions. However, hybrid capacitors exhibit both EDLC and pseudocapacitive behaviors [13]. The performance of supercapacitors is influenced by several key factors, particularly their energy density, which remains significantly lower than that of lithium-ion batteries due to the inherent limitations of their energy storage mechanism. Unlike batteries that rely on faradaic redox reactions, supercapacitors store energy through electrostatic charge accumulation at the electrode-electrolyte interface, limiting energy density to 1–20 Wh kg−1 compared to 100–265 Wh kg−1 in lithium-ion batteries. The energy density is determined by the capacitance (C) and potential window (V), with efforts focused on improving both through advanced electrode materials and optimized electrolytes [14,15]. Carbon-based electrodes like activated carbon, graphene, and carbon nanotubes provide high surface area and conductivity but are limited by their non-faradaic charge storage, which reduces specific capacitance [16]. To address this, researchers are exploring hierarchical and nanostructured electrodes and incorporating materials like transition metal oxides (e.g., RuO2, Fe2O3, and MnO2) and conducting polymers (e.g., polythiophene and polyaniline) in pseudocapacitors for enhanced energy storage via faradaic reactions [17]. Electrolyte selection also plays a crucial role, with aqueous electrolytes offering high power but narrow voltage windows, organic electrolytes providing wider voltage ranges but at higher cost and resistance, and ionic liquids enabling higher voltages but with lower ionic conductivity. Additionally, separators and current collectors, though essential for functionality, contribute to weight and resistance, further constraining energy density [1]. Despite these challenges, supercapacitors excel in power density (up to 10 kW kg−1), rapid charge-discharge rates, and durability, driving ongoing research to balance energy and power capabilities for diverse applications [18]. A linear polymer derivative named “melon”, synthesized by Berzelius and Liebig in 1834, led to the discovery of carbon nitride [19]. Among the seven carbon nitride phases, graphitic carbon nitride (g-C3N4) stands unique for its lowest band gap energy (∼2.6 eV). Its structural framework is composed of triazine (C3N3) (s-triazine) or heptazine (C6N7) (tri-s-triazine) rings incorporating carbon (C), nitrogen (N), and hydrogen (H) impurities. The heptazine component offers more active sites than the triazine unit, as it possesses many nitrogen atoms [20]. It also exhibits high thermal stability and retains its structure up to 600 °C. g-C3N4 remains chemically stable and is insoluble in most common solvents like alcohol, water, or dimethylformamide (DMF) [21]. Synthesis of g-C3N4 through pyrolysis is relatively easier compared to other commercial materials as their precursors are carbon and nitrogen, which are abundantly present on the earth [22]. A lone pair of electrons in nitrogen atoms in g-C3N4 strengthens the polarity of the molecule, improving charge carrier transport efficiency, and its unique lamellar structure is conducive to the horizontal transfer of charges [23]. Due to its distinctive physiochemical characteristics, g-C3N4 found its application in various fields, including electrochemical energy storage [24], biological sensors [25], photocatalysis [26], electrocatalysis [27], and superconductors [28]. However, its low specific surface area and electronic conductivity limit its direct application in supercapacitors [29,30]. Research trends in two-dimensional (2D) materials (∼10 nm thickness) have rapidly increased since the discovery of graphene as a carbon allotrope in 2004 [31]. The significance of using 2D materials such as molybdenum disulfide (MoS2), graphene, layered double hydroxides (LDHs), transition metal dichalcogenides (TMDs), and MXenes in supercapacitors lies in their ability to increase the interior/exterior areas of the material to facilitate ion migration via loose van der Waals attraction and impart flexibility and mechanical strength to the electrode [32,33]. Graphene stands out for its exceptional electrical conductivity, mechanical strength, and thermal conductivity, making it highly desirable for various applications, from electronics to energy storage [34]. However, other 2D materials offer specialized functionalities, such as semiconducting behaviour, enhanced mechanical properties, or chemical stability, for specific applications. For example, MoS2 has a direct bandgap, making it more suitable for semiconductor applications [35]. Hexagonal boron nitride (h-BN) provides excellent insulating properties and thermal stability, making it an ideal substrate or dielectric layer in electronic devices [36]. Graphite carbon nitride (g-C3N4) is a 2D material known for its substantial nitrogen content (theoretically about 57% nitrogen) and strong chemical and thermal resistance [21]. Its stable polymer structure, made of tri-s-triazine units, allows it to withstand tough conditions. With a bandgap of around 2.7 eV, it acts as a semiconductor, offering more flexibility than other 2D materials like graphene and MoS2 [20]. It has a porous nature and various functional groups, which improve interactions with electrolytes without needing significant modifications. Its production is eco-friendly and cost-effective, and its slightly curved shape enhances its ion movement compared to flat materials like graphene [24,37]. A study provides a detailed density functional theory (DFT) analysis of 2D g-C3N4 material, highlighting their nanoporous structure and semiconducting properties. The 2D triazine (n-type) and tri-s-triazine (p-type) sheets exhibit higher bandgaps (1.25 and 1.40 eV, respectively) than graphene. g-C3N4 demonstrates shorter interplanar distances (3.07–3.23 Å) than graphite, allowing ion and gas storage, with tri-s-triazine being the most porous. Adhesion energies (0.28–0.67 J m−2) suggest slower aging compared to graphite (0.31 J m−2). These findings position g-C3N4 as a promising material for advanced photochemical and electrochemical applications due to its superior structural and electronic properties [38]. This review highlights the latest advancements in the application of g-C3N4 and its composites in supercapacitors. This study covers g-C3N4 applications in various supercapacitors, such as battery-type hybrid capacitors, all-solid-state SCs, flexible SCs, and photo supercapacitors Fig. 2 . This approach emphasizes optimizing g-C3N4 nanostructures by functionalizing them with diverse materials, including transition metal oxides, LDHs, metal sulfides, TMDs, carbon allotropes, and conducting polymers. The unique features of g-C3N4, such as its semi-conductivity, visible light absorptivity, chemical stability and tunable electronic properties, make it potentially useful for photocatalysis, energy storage, and environmental remediation. However, fully exploiting its capabilities requires a comprehensive understanding of its structure, surface chemistry, and interactions with other materials. This review on g-C3N4 also involves exploring ways to overcome its inherent limitations, such as relatively low surface area and poor charge separation efficiency, through strategies such as doping, compositing, or structural modification. Understanding its environmental impact, scalability, and cost-effectiveness is critical for its adoption in large-scale applications. This comprehensive review of graphitic carbon nitride in next-generation supercapacitors helps identify its strengths and areas for improvement, guiding further research and development toward more efficient and practical implementations. 2 Graphitic carbon nitride (g-C3N4) Graphitic carbon nitride (g-C3N4) is a promising material for supercapacitor applications because of its high chemical stability, nitrogen-rich structure, and tunable electronic properties. To increase its performance, strategies such as increasing the surface area and porosity through templating and exfoliation, doping with heteroatoms, and forming composites with conductive materials such as graphene, transition metal oxides, or sulfides to form heterostructures are employed. Structurally, its tri-s-triazine framework is rich in nitrogen, which provides abundant active sites for ion adsorption and redox reactions, contributing to both the EDLC and pseudocapacitance. The advantages of g-C3N4 include its low cost, abundant raw materials (e.g., urea, melamine), high nitrogen content for active sites, and excellent thermal and chemical stability, making it suitable for various electrolyte systems [39,40]. However, it also has notable limitations, including low intrinsic conductivity, limited surface area compared with traditional porous carbons, and mechanical brittleness in bulk forms. Additionally, optimizing its structure often requires complex synthesis methods such as templating or doping, which may increase production costs. Despite these challenges, the versatility and ability of g-C3N4 to form effective heterostructures make it a valuable candidate for advanced energy storage applications, offering a balance between performance, durability, and cost-effectiveness [41,42]. 2.1 Structure, properties, and synthesis of pristine g-C3N4 g-C3N4 is a semiconducting polymer composed primarily of carbon and nitrogen atoms arranged in a two-dimensional structure. The structural units consist of either triazine (C3N3) or heptazine (C6N7) molecules (Fig. 3 a and b) [43], in which N atoms are bonded to C atoms in a hexagonal pattern. These units are linked together by tertiary nitrogen atoms, forming a conjugated system with a layered, graphite-like structure. The presence of nitrogen introduces structural diversity and alters electronic properties, giving g-C3N4 a moderate bandgap, making it a semiconductor [44]. g-C3N4 is the most stable phase of carbon nitride (i.e., alpha, beta, cubic, pseudo-cubic, g-h-heptazine, g-h-triazine, and g-o-triazine) under ambient conditions [19]. It involves π-conjugation and sp 2 hybridization between nitrogen and carbon atoms within each plane [45]. Compared with that of graphene (0.335 nm), the interplanar distance in g-C3N4 is reduced to 0.315 nm because of the substitution of nitrogen atoms [46]. The denser packing enhances vertical charge transfer, which is beneficial for supercapacitor applications [47,48]. The structure of g-C3N4 includes four nitrogen-rich functional groups: pyrrolic-N, pyridinic-N, oxidized pyridine-N, and quaternary-N (Fig. 3c). The pyrrolic-N and pyridinic-N groups on the periphery of the g-C3N4 plane act as electron donors, whereas the quaternary-N groups within the plane increase the electron transfer capacity and electrical conductivity [49]. This unique structure endows g-C3N4 with stable thermal and chemical properties and photocatalytic activity, making it useful for applications such as catalysis, environmental remediation, and energy conversion and storage. One of the most common and straightforward approaches for synthesizing g-C3N4 is thermal polymerization (pyrolysis) using nitrogen-rich precursors, as illustrated in Fig. 3(d) [50], such as urea [51], cyanamide [52], thiourea [53], melamine [54], and dicyandiamide [55]. The typical procedure for producing g-C3N4 involves calcining carbon- and nitrogen-rich precursors at 550 °C for a specific period in a muffle furnace. The resulting material is a pale-yellow powder with a 3:4 ratio of C to N atoms [56]. However, this yields g-C3N4 with stacked layers, leading to low electronic conductivity, a reduced surface area, and rapid electron-hole recombination rates [57]. g-C3N4 is chemically stable and insoluble in various acidic, alkaline and organic solvents, making it ideal for electrochemical applications [58]. Nitrogen substitution enhances wettability by adding heterogeneous atoms [59]. When nitrogen is added to carbon materials, it brings extra electrons to the delocalized electron cloud, which increases the conductivity [60]. Additionally, the material has enhanced the ability to promote reverse redox faradaic reactions (pseudocapacitance) due to the incorporation of additional heteroatoms, resulting in a notable increase in specific capacitance compared with that of EDLCs while maintaining its cycle life [61]. FT-IR analysis of g-C3N4 (Fig. 3e) revealed bands associated with aromatic C–H stretching vibrations at 3030 cm−1, C–N stretching vibrations between 1220 and 1630 cm−1, and a band at 810 cm−1, confirming the presence of a triazine ring. The XRD pattern of g-C3N4 (Fig. 3f) presents peaks at 13.1° (100) and 28.3° (002), which are consistent with those of g-C3N4 [62]. The FESEM (Fig. 3g) image shows the layered structure of g-C3N4 with a nanosheet morphology [63]. Various functionalization techniques have been used to produce g-C3N4 with an enlarged surface area, minimized diffusion paths, and abundant reaction sites. This led to the enhanced conductivity of g-C3N4, making it highly suitable for supercapacitor applications [64]. 2.2 Functionalization of g-C3N4 To apply g-C3N4 effectively in supercapacitor applications, it is necessary to increase its surface area and improve its uniform pore size distribution [65] since the surface area and electronic conductivity of bulk g-C3N4 are limited. One of the strategies to overcome these limitations is functionalization [66]. Functionalization can be achieved via either covalent or noncovalent methods. Covalent functionalization results in bonds between the functional groups of g-C3N4, which can introduce defects into the g-C3N4 lattice while significantly enhancing its chemical reactivity. Noncovalent functionalization involves interactions such as π–π stacking, van der Waals forces, or electrostatic interactions, attaching various molecules while preserving the g-C3N4 structure [67]. There are three types of functionalization routes: liquid exfoliation, chemical oxidation, and protonation [68]. The exfoliation of g-C3N4 using strong acids such as H2SO4 and HNO3 increases the number of active sites, surface area, and interlayer spacing to increase the electron transmission efficiency and minimize the charge transfer resistance [69]. Chemical exfoliation creates functional groups and pores on g-C3N4, creating more diffusion paths for electrolyte ions through chemical treatment and hence improving its capacitive ability [70]. Protonation introduces protons (H+ ions) into g-C3N4 to change its surface charge. It facilitates ionic transport by enhancing interactions with other ions/molecules, which can improve the conductivity and charge storage capability. Many functionalized g-C3N4 structures have been reported, including exfoliated g-C3N4 [71], tubular g-C3N4 [72], g-C3N4 nanosheets [73], and g-C3N4 nanofibers [74], all of which have increased surface areas. A diagram illustrating the process of chemical etching performed on bulk g-C3N4 to produce edge-functionalized porous g-C3N4 is depicted in Fig. 4 Compared with the original g-C3N4, which had an SSA of 10.12 m2 g−1, the tubular g-C3N4 prepared via chemical synthesis presented a significantly larger specific surface area (SSA) of 182.6 m2 g−1 [75]. In a KOH solution, tubular g-C3N4 achieved a specific capacitance of 233 F g−1 at a current density of A g−1, outperforming other nitrogen-doped carbon materials, such as N-doped ultrathin graphitic carbon nanocages and nitrogen-enriched carbon nanotubes [76]. Mesoporous g-C3N4 was synthesized, and its capacitance properties were evaluated. The enhanced specific capacitance of 279 F g−1 at a current density of 0.5 A g−1 resulted from the increased SSA, abundant mesopores, greater pore volume, higher concentration of graphitic carbon regions, and surface functional groups [77]. Roger Gonçalves and colleagues synthesized exfoliated g-C3N4 via pyrolysis of melamine, which resulted in a specific capacitance of 113.7 F g−1 at 0.2 A g−1 along with 89% capacitance retention over 5000 cycles [78]. Tahir and colleagues used melamine to obtain tubular g-C3N4 with a specific capacitance of 263 F g−1 at 0.2 A g−1, with ∼91% retention for 1000 cycles [79]. Lin and coauthors produced 3D oxidized g-C3N4 combined with functionalized graphene, which exhibited a specific capacitance of 265.5 F g−1 in an acidic electrolyte and 243.8 F g−1 in an alkaline electrolyte at 0.2 A g−1, with 65% and 45% retention rates, respectively [80]. Two porous g-C3N4 samples were synthesized using melamine and ammonium carbonate, one of which had a lamellar structure that improved charge transfer by providing more active sites. The second sample was mesoporous g-C3N4 with enhanced porosity. Mesoporous g-C3N4 has a specific capacitance of 150 F g−1 at 0.5 A g−1, significantly surpassing that of bulk g-C3N4 and porous g-C3N4 because of its improved SSA and porous structure [81]. Using g-C3N4 as a scaffold nitrogen source and glucose as a carbon source, 3D N-doped porous carbon was produced via a hydrothermal method followed by a calcination method. This flexible SC achieved 90 F g−1 of specific capacitance due to 954 m2 g−1 SSA and 11% N content, contributing to its excellent carrier storage ability [82]. The symmetric supercapacitor device with g-C3N4 electrodes delivered a high energy density of 19.33 Wh kg−1 with exceptional stability over 21,000 cycles within a broad window of 2 V, attributed to high nitrogen doping (>12%) [63]. Hierarchically porous g-C3N4, featuring 3D nanoribbons interconnected with layers, results in an increased surface area (681.8 m2 g−1) and abundant migration channels and reservoirs for electrolyte ions. The electrode delivered 520 F g−1 capacitance at 0.1 A g−1 and 219.4 F g−1 at 20 A g−1, with an excellent cycling stability of 104% after 10,000 cycles [40]. The N-doped mesoporous graphitic nanofiber containing 16.5% nitrogen worked well for SCs because of its highly conductive open-structured graphite nanofiber matrix, large surface area, low internal resistance, and electrochemically active sites. When tested with KOH, H2SO4, and KCl electrolytes, the specific capacitances were 460, 420, and 345 F g−1, respectively. A retention of 92% capacitance over 50,000 cycles was observed for KOH-based SCs [83]. Although functionalization is a suitable approach for modifying the structural and surface characteristics of g-C3N4, challenges such as a reduced interlayer distance and scale of g-C3N4 sheets during the exfoliation process need to be addressed [64]. 2.3 Theoretical studies of g-C3N4 Theoretical studies or simulations of g-C3N4 provide insights into its potential as an electrode material for supercapacitors. DFT is a crucial tool in these studies, enabling precise analysis of electronic structures, reaction energy barriers, and environmental factors (e.g., pH, temperature). It helps identify doping sites, configurations, and electronic properties critical for enhancing electrochemical activity and storage capabilities [38]. Studies have demonstrated that g-C3N4 nanosheets, with tunable properties like layer number and size, offer unique benefits in energy storage. For example, defect-engineered C3N monolayers showed enhanced quantum capacitance (QC), especially double-vacancy monolayers (DC3NML), which surpassed 767.8 μF g−1 as a positive electrode. Vacancy defects improve charge storage by altering the electronic structure and leveraging molecular orbitals around vacancies [84]. Innovative synthesis methods further expand the functionality of g-C3N4. For example, carbon-rich g-C x Nγ materials, produced via molten salt reactions, exhibit mixed sp 2-hybridized domains with enhanced electronic and magnetic properties. This tunability makes them suitable for diverse applications, including energy conversion and storage [85]. Additionally, Pd-doped g-C3N4 nanocomposites achieved remarkable supercapacitor performance, offering 401.1 F g−1 specific capacitance with excellent cyclic stability [86]. Composites like PANI@g-C3N4 also showed promise, with synergistic interactions enhancing conductivity and energy storage. A specific capacitance of 584 F g−1 and retention of 96.7% after 1000 cycles highlight their potential for high-frequency applications [87]. Moreover, g-C3N4/TiVCT x composites for lithium-ion batteries and SCs demonstrated outstanding performance due to reduced nanosheet re-stacking and enhanced charge transfer. g-C3N4/TiVCT x -30//LiFePO4 full cell maintained stable capacity (505.5 mA h g−1 after 100 cycles) and demonstrated excellent low-temperature tolerance, achieving 97.9% Coulombic efficiency after 50 cycles at −20 °C. DFT calculations revealed their high lithium-ion adsorption and reduced diffusion barriers, making them ideal for advanced energy storage [88]. Despite these advances, challenges remain in precisely synthesizing and characterizing g-C3N4 materials to fully leverage their potential. Computational studies, while insightful, struggle to fully capture the complexity of electrochemical systems. 3 Heterostructures of g-C3N4 3.1 Heteroatom doping Heteroatom doping of g-C3N4 is recognized as a highly effective method for enhancing its electrochemistry [89]. The introduction of heteroatoms into g-C3N4 can alter its local electronic structure by increasing the surface charge density and interactions with ions in the electrolyte, potentially enhancing its capacitive characteristics [90]. Additionally, the redox behavior of heteroatoms can activate faradic reactions, resulting in a significant increase in interfacial capacitance [91]. On the other hand, pyridinic nitrogen atoms present in the g-C3N4 structure serve as active sites for incorporating guest or dopant atoms [92]. Boron doping significantly increased the specific capacitance of g-C3N4 to 660 F g−1 at 0.1 A g−1 [91]. Compared with undoped g-C3N4/MnO2 electrodes, the incorporation of potassium atoms into g-C3N4/MnO2 electrodes resulted in a twofold increase in specific capacitance, reaching 375 F g−1 [93]. In addition, doping g-C3N4 with bimetallic alloys further improved the electrochemical performance. For example, an Au-Cu nanoalloy grafted onto g-C3N4 nanosheets, as illustrated in Fig. 5 (a), exhibited a specific capacitance of 506 F g−1 at 1.25 A g−1, with 76% capacity retention over 5000 cycles [94]. Tripathi and team synthesized Co-Ni nanoalloys grafted onto 2D graphitic nitride sheets (Co-Ni/g-C3N4) through hydrogenation for SC applications. The XRD pattern (Fig. 5b) confirmed the existence of both the Co-Ni alloy and g-C3N4, with corresponding Bragg peaks at 44.4° (111), 51.7° (200), 76.1° (220), and 26° (002). The TEM image showing the particle size of Co-Ni/g-C3N4 (Fig. 5c) illustrates the formation of nanoparticles on the carbon support. The pore size distribution curve showed a peak at approximately 4 nm (Fig. 5d), indicating the mesoporous structure of Co-Ni/g-C3N4. The cyclic voltammetry (CV) curves depicted in Fig. 5(e) show the EDLC characteristics of carbon and the redox characteristics of Co-Ni/g-C3N4. The proportional relationship between i c vs. ν and i p vs. ν 1/2 demonstrated the pseudocapacitive mechanism of Co-Ni/g-C3N4, as shown in Fig. 5(f) [95]. Compared with bare g-C3N4, self-repairing g-C3N4 had greater electronic conductivity because delocalized π-electrons were extended through substitutional or interstitial carbon atoms within its structure. The larger planes of self-repairing g-C3N4 are broken down into smaller segments due to acid treatment. This increases the number of nitrogen and oxygen functional groups at the edges [96]. The results revealed that the heteroatom-doped 2D g-C3N4 electrode materials, when doped with heteroatoms, displayed enhanced capacitive characteristics compared with their undoped carbon counterparts. However, controlling their configuration, the content of heteroatoms, and their porous structure is challenging, leading to limitations in improving their energy storage performance. 3.2 g-C3N4-metal composites Transition metal compounds are widely recognized as effective materials for supercapacitor electrodes due to their abundance, affordability, and pseudocapacitive properties. Materials such as transition metal oxides, hydroxides, LDHs, sulfides, and chalcogenides have been extensively studied for g-C3N4-based supercapacitors because of their high theoretical specific capacitances. g-C3N4 is an excellent support layer for creating M−N x sites (where M represents a metal atom, and N denotes a nitrogen atom) and stabilizing metal nanoparticles. This capability stems from its high concentration of pyridine-like nitrogen within heptazine heteroring, which readily bind metal ions by providing abundant electron pairs [97]. However, challenges such as agglomeration and restacking, driven by interplanar π-π interactions and van der Waals forces, hinder electrolyte ion diffusion between g-C3N4 layers and reduce its effective surface area [98]. Adding spacers is particularly effective in increasing the surface area and promoting ion mobility between g-C3N4 layers. Integrating transition metal oxides as spacers into g-C3N4 matrices often results in hierarchical architectures with increased surface area and porosity. Additionally, this combination leverages the redox activity of the composites to improve pseudocapacitive charge storage [99]. g-C3N4 typically suffers from low electrical conductivity, and incorporating metal sulfides and TMDs (e.g., MoS2, NiCo2S4) helps address this limitation by introducing conductive pathways, thereby facilitating rapid charge transport [100]. LDHs and other layered materials offer unique two-dimensional structures with interlayer spaces that facilitate ion intercalation and diffusion, complementing the ion adsorption capability of g-C3N4 [101]. 3.2.1 g-C3N4 and metal oxides Transition metal oxides (TMOs), such as CuO, Fe2O3, MnO2, MoO2, TiO2, V2O5, and WO3, are popular Faradaic materials for pseudocapacitive SCs owing to their natural abundance, redox behaviour, and ability to undergo multiple oxidation states [102–104]. Nonetheless, TMOs have issues such as low conductivity, low rate capability, and poor cycling stability [17]. Considering this, Faradaic TMOs hybridized with non-Faradaic g-C3N4 to enhance the overall electrochemical performance. For example, 2D tungsten oxide nanoflakes grafted over g-C3N4 (WO3/g-C3N4) exhibited a remarkable capacitance of 1051.4 F g−1 along with 85% retention over 10,000 cycles because of the porosity, surface area, ion diffusion, and chemical stability imparted by g-C3N4 [105]. Similarly, NiO/g-C3N4 and Fe2O3/g-C3N4 composites achieved high capacitances of 816 and 703 F g−1 at 0.5 A g−1, respectively, maintaining approximately 96% of their capacitance over 5000 cycles [106]. In another study, MnO2 and SnO2 metal oxides were used as spacers to address the agglomeration of layered g-C3N4, while the capacitance of g-C3N4/MnO2 was 174 F g−1 and that of g-C3N4/SnO2 was 64 F g−1 with approximately 96% retention after 5000 cycles [99]. Similarly, V2O5 nanoparticles were used as spacers on 3D porous g-C3N4 surfaces to prevent compaction of g-C3N4 layers and facilitate efficient ion transport [107]. In addition to monometallic oxides, bimetallic oxides with spinel structures with two types of positive ions show better performance in supercapacitors [108]. It is well known that g-C3N4 acts as a skeleton or template in the formation of heterostructures with metal and bimetal oxides, taking advantage of the abundance of active species and thereby increasing the electrical conductivity [82]. The presence of nitrogen increases the surface polarity of g-C3N4 because of the lone pair of electrons. This increased polarity can generate numerous sites for binding and facilitate electrode and electrolyte-ion interactions. When electrolyte ions interact with g-C3N4, they quickly integrate with metal oxide nanostructures, thereby strengthening the interaction between the electrolyte and the working electrode [109]. Various types of bimetallic oxides, such as conversion-type (NiFe2O4, ZnFe2O4, MnNi2O4, etc.) [110] and intercalation-type (LiCoO2, LiMn2O4, etc.) [111] or different combinations of transition metal oxides (titanates, phosphates, vanadates, molybdates, tungstates, etc.) [112], are engineered with g-C3N4 for supercapacitors. Cu2O nanoflakes and CdFe2O4 nanoparticles were deposited onto g-C3N4 nanosheets through simple hydrothermal and wet impregnation techniques, as illustrated in Fig. 6 (a). The electrochemical characteristics of pure Cu2O, g-C3N4, and composites such as Cu2O@CdFe2O4, Cu2O@g-C3N4, and CdFe2O4@g-C3N4 were investigated via a standard three-electrode configuration. At 0.25 A g−1, the ternary nanocomposite exhibited a specific capacitance of 1067 F g−1 (approximately 4, 2, and 5 times greater than those of Cu2O, CdFe2O4, and g-C3N4, respectively) (Fig. 6b). Moreover, the asymmetric device, comprising Cu2O-CdFe2O4@g-C3N4 and AC, demonstrated an energy density of 31.25 Wh kg−1 at a power density of 478 W kg−1 (Fig. 6c), along with durable cycling stability for up to 4000 cycles (approximately 87% capacity retention) (Fig. 6d). These findings indicate that the composite structures can undergo synergistic impacts among the components of the composite, thereby increasing their overall efficiency [113]. A capacitance as high as 1275 F g−1 at a charge of 0.25 A g−1 was achieved by the g-C3N4/NiMoO4 nanocomposite owing to the interconnected layered architecture and the nitrogen content with the inclusion of g-C3N4 [114]. A study combined g-C3N4 nanosheets with FeWO4 nanorods to inhibit the agglomeration of both materials, resulting in increased surface area and ion diffusion. The composite exhibited a capacitance of 357 F g−1 with 80% retention after 1000 cycles [112]. Furthermore, zinc antimonate (ZnSb2O6] nanorods merged with porous g-C3N4 nanosheets showed an impressive capacitance of 557 F g−1 at 2.5 A g−1. These outcomes are attributed to the increased number of electrochemically active sites provided by both the porous g-C3N4 and the bimetal oxide nanorods [115]. The CuMnO2/g-C3N4 modified electrode had a better electrochemical response than the Cu2O/g-C3N4 electrode. The CuMnO2/g-C3N4 electrode maintained 91% of its initial capacitance (i.e., 817.85 F g−1) over 1000 cycles [116]. In g-C3N4 and metal oxide composites, g-C3N4 nanosheets serve as substrates for the attachment of metal nanoparticles, whereas metal oxides complement g-C3N4 in mitigating its agglomeration issue by acting as spacers between the g-C3N4 layers. g-C3N4, with its substantial nitrogen content and porous morphology, can provide reactive regions and lattice defects, serve as a growth template for crystal nucleation, and can be well matched with metal oxides. However, the electrochemical performance is far from expected because g-C3N4 acts only as a dispersant in these composites, which are semiconductors with poor conductivity. 3.2.2 g-C3N4, metal hydroxides and LDH Nickel hydroxide (Ni(OH)2) is commonly used in combination with g-C3N4 for supercapacitor applications because of its affordability, non-toxic nature, and high theoretical capacitance (2365 F g−1) [117]. For example, a hydrothermally synthesized Ni(OH)2/g-C3N4 composite with a flower-like morphology exhibited a capacitance of 505.6 F g−1 at 0.5 A g−1 in a 6 M KOH solution. g-C3N4 was used as a growth substrate for Ni(OH)2, accommodating volume changes in Ni(OH)2 and allowing for expansion [118]. Dong et al. created a honeycomb-structured g-C3N4/Ni(OH)2 composite, achieving a remarkable capacitance of 1768.7 F g−1 at 7 A g−1, which surpassed the values obtained for pure g-C3N4 (416.4 F g−1) and Ni(OH)2 (968.9 F g−1), retaining 84% of the capacity over 4000 cycles [119]. Similarly, Li and coauthors prepared g-C3N4/rGO/Ni(OH)2 nanocomposites via a precipitation method, which exhibited excellent supercapacitive performance of 1785 F g−1 at 2 A g−1 with 71% capacitance retention for 5000 cycles [120]. g-C3N4/Co(OH)2 was synthesized through cathodic electrodeposition, achieving an exceptional specific capacitance of 1663 F g−1 at 1 A g−1 [121]. Furthermore, supercapacitor electrodes were developed by combining g-C3N4 with hydroxides of the lanthanides samarium and neodymium. Sm(OH)3/g-C3N4 achieved a capacitance of 586 F g−1, outperforming g-C3N4 (135.4 F g−1) and Sm(OH)3 (227.7 F g−1) [122], whereas Nd(OH)3/g-C3N4 achieved a capacitance of 426.4 F g−1, which surpassed those of g-C3N4 (111.5 F g−1) and Nd(OH)3 (247.5 F g−1) at 1 A g−1 in 3 M Li-OH electrolyte. Both lanthanide-based composites showed excellent cyclic stability and maintained over 90% coulombic efficiency after 3000 cycles [123]. Layered double hydroxides (LDHs) are 2D materials, as depicted in SEM images (Fig. 7 d–f), consisting of positively charged host layers and loosely bound balancing anions [101,124]. However, poor conductivity, low specific capacitance, poor cycling stability, and a tendency to stack together in the solid state limit the application of pure LDH in SCs [125]. The uniform deposition of LDH on a conductive nanostructured g-C3N4 matrix can improve the electronic conductivity and mass diffusion of LDHs, resulting in enhanced electrochemical performance [101]. A 2D NiFe-LDH@soluble-g-C3N4 electrode was created using electrostatic self-assembly (Fig. 7a) and exhibited a specific capacitance of 1060.4 F g−1 at 1 A g−1 and 770 F g−1 at 10 A g−1. The presence of abundant active sites in NiFe-LDH was confirmed by its zeta potential: −19.5 mV for g-C3N4 and + 15.6 mV for NiFe-LDH, as illustrated in Fig. 7(b and c), respectively [126]. In one study, Ni foam was used as a conductive base for the hydrothermal deposition of Cu-Al LDH nanosheets on g-C3N4 sheets. This 3D framework allows for excellent electron transfer by facilitating electrolyte permeation and demonstrates an impressive capacitance of 838 F g−1 at a discharge rate of 0.4 A g−1 [127]. A composite of g-C3N4 with a Ni-Co LDH achieved a specific capacity of 183.4 mA h g−1 at 1 A g−1 in 6 M KOH, surpassing g-C3N4 (20.8 mA h g−1) and Ni-Co LDH (96 mA h g−1) electrodes [128]. Moreover, CoAl-LDH nanocomposites enhanced with graphitic C3N4 nanosheets delivered a capacitance of 343.3 F g−1 at a current density of 5 A g−1 [129]. A nanocomposite combining g-C3N4 with NiAl-LDH reached a capacitance of 714 F g−1 at 0.5 A g−1 [125]. The hydrothermally synthesized NiCo2Fe x -LDH/g-C3N4 composite revealed the formation of strong N–Ni bonds (Fig. 8 a). SEM images of different samples of NC@CN, NF1.0C@CN, and NF1.5C@CN, as illustrated in Fig. 8(b–d), respectively, demonstrated a shift from a rock-like to a flower-like structure as the Fe stoichiometry was altered in the ternary NiCo2Fe x -LDH. This indicates that the presence of iron (Fe) enhances the growth of nanosheets, offering more sites for electrochemical reactions. Electrochemical studies revealed that the NiCo2Fe1.0-LDH@g-C3N4 electrode exhibited an outstanding specific capacitance of 1550 F g−1 at 1 A g−1, which was inferred from the CV (Fig. 8e) and GCD (Fig. 8f) results. When paired with AC, the device delivered a capacitance of 129.6 F g−1, a specific energy of 35 Wh kg−1 at a specific power of 701 W kg−1, as depicted in Fig. 8(g). The device has a capacitance retention of ∼93% through 5000 cycles, as indicated in Fig. 8(h) [130]. In composites of metal hydroxides and g-C3N4, metal hydroxides attach to g-C3N4 nanosheets, enhancing electrolyte ion diffusion at the boundary between the electrode and electrolyte because of the abundant active sites created by an efficient redox reaction. LDHs provide abundant layers and sites that are electrochemically active, enabling simultaneous generation of EDLCs and pseudocapacitance. This makes them appeal to the next generation of hybrid supercapacitors. 3.2.3 g-C3N4, metal sulfides and TMDs Transition metal sulfides (TMSs) are known for greater electrical conductivity and mechanical stability compared to their oxide counterparts in applications such as batteries and supercapacitors [131]. Owing to their unique electronic and crystal structures, rationally designed g-C3N4/TMS heterojunctions are promising for improving the performance of supercapacitors. Heterojunctions are interfaces formed between two different semiconductor materials with distinct bandgaps, electronic structures, or properties [132]. g-C3N4 is an n-type semiconductor, whereas metal sulfides often exhibit p-type semiconductor features. Thus, constructing composites of n-type g-C3N4 and p-type TMSs is a promising approach for achieving high-efficiency supercapacitors. The p-n heterojunction generates an internal electric field that enhances the charge mobility across the electrode-electrolyte interface owing to the alignment of energy levels. This presents a new approach to improve electrochemical energy storage [133]. The g-C3N4-doped MnS has achieved a higher theoretical specific capacitance of 463.32 F g−1 and demonstrates excellent durability [134]. Ansari et al. prepared molybdenum disulfide and g-C3N4 heterojunctions (MoS2/g-C3N4) using the ball milling technique for both photocatalytic and supercapacitor purposes. The hybrid MoS2/g-C3N4 significantly outperformed pure MoS2 (48.7 F g−1), with a specific capacitance of 240 F g−1 [35]. The g-C3N4/CoS nanocomposite reached a capacitance of 668 F g−1 at 2 A g−1, surpassing that of pure CoS and g-C3N4 supercapacitors [135]. Vinoth et al. synthesized sulfur-doped g-C3N4 and cobalt disulfide (S-g-C3N4/CoS2) composite electrodes via an in-situ pyrolysis method. This composite exhibited a remarkable cycling stability of 89% through 100,000 cycles, a specific capacity of 180 C g−1 at 1 A g−1, a specific energy of 26.7 Wh kg−1, and a specific power of 19.8 kW kg−1 [136]. Sulfide compounds provide higher specific capacities because they have two or more valence states [53]. The utilization of various forms of carbon has been common in enhancing the conductivity of TMSs for potential application in supercapacitors [137]. In a hydrothermally synthesized TiS2/g-C3N4 composite, the aggregation of TiS2 was avoided by adding g-C3N4, resulting in almost uniform spherical particles and improving its electrochemical performance [138]. Among transition metal dichalcogenides (TMDs), ternary transition metal sulfides, also called thiospinels (e.g., NiCo2S4, FeCo2S4, ZnCo2S4, CoMoS4, etc.), tend to exhibit better electrochemical performance than their binary counterparts (e.g., Co3S4, CoS x , NiS, etc.) because of their high conductivity, rich redox reactions originating from their complex chemical compositions, and synergetic effects [139]. Moreover, thiospinels have better electron density because of the less electronegative sulfur in their structure, which maintains better conductivity. According to previous results, NiIn2S4 has a narrow band gap, adequate electron density, and appropriate conductivity, which make it a feasible material for electrodes in SCs [39]. Heterojunctions of g-C3N4 with TMDs or TMOs increase the number of active sites for charge transfer. The pyridine N and tertiary N in the tri-s-triazine structure of g-C3N4 possess high electron density, and quaternary N can increase the conductivity of materials, which not only promotes electron transfer but also enables the chemisorption of active ions [113]. The unique architecture of nanosheets on nickel cobalt sulfide nanosheets grown over porous g-C3N4 nanosheets (NiCo2S4/g-C3N4) resulted in enhanced ion permeability and exhibited a remarkable specific capacity of 506 C g−1 at 1 A g−1 [100]. NiCo2S4/g-C3N4 nanocomposites developed by the hydrothermal method significantly enhanced the cycle life of supercapacitors by improving ion movement and providing more active sites for electrochemical processes. The material exhibited a specific capacitance of 1229.9 F g−1 at 5 A g−1, maintaining 66.24% of its energy storage capacity after 2000 cycles [140]. Additionally, NiSe was grown on 2D g-C3N4 nanosheets via the hydrothermal method, creating a 3D structure, as illustrated in Fig. 9 (a). The 2D configuration and high nitrogen concentration of g-C3N4 contributed to the increased specific capacity of the NiSe/g-C3N4 composite. The FE-SEM image (Fig. 9b) shows that the nanocomposite with NiSe nanoparticles was uniformly distributed on the g-C3N4 nanosheets, resulting in increased interparticle distances and reduced agglomeration. Fig. 9(c) shows the HR-TEM image of NiSe/g-C3N4, which reveals that the direct growth enhances electron and ion transport and increases the mechanical and chemical stability, and the visible lattice fringes with 0.23 nm interplanar spacing match the [100] plane of the hexagonal crystal structure. The NiSe/g-C3N4 composite outperformed both g-C3N4 and NiSe alone, as shown by the CV, GCD, and Nyquist plots in Fig. 9(d–f), respectively. The specific capacity of the NiSe/g-C3N4 electrode was 320 mA h g−1 at 1 A g−1 (Fig. 9g), which was maintained at 84.9% through 8000 cycles (Fig. 9h). The hybrid SC cell with AC achieved an energy density of 52.5 Wh kg−1 and a power density of 1488 W kg−1 (Fig. 9i) [141]. The advantages of TMSs over their oxide counterparts are good electronic conductivity and enhanced mechanical stability. Combining n-type g-C3N4 with p-type TMSs has the potential for high-performance supercapacitors with improved specific capacitances and cycling stability. Additionally, incorporating carbon with TMSs/TMDs enhances conductivity, thereby improving electrochemical efficiency. Ternary transition metal sulfides (thiospinels) outperform binary sulfides in electrochemical applications because of their high conductivity and complex chemical compositions. 3.2.4 g-C3N4 and others Other non-conventional materials integrated with g-C3N4 have significantly enhanced supercapacitor performance. The layered structure and network of g-C3N4 facilitate rapid ion diffusion and electron transport. Metal iodide and g-C3N4 hybrids led to reversible redox reactions and quick electron transfer. The AgI/g-C3N4 electrode exhibited a specific capacity of approximately 95 C g−1 in different electrolytes at 1.5 A g−1 [142]. CuI/g-C3N4 nanocomposites fabricated using sonochemistry and coprecipitation methods achieved a significantly high energy density (34 Wh kg−1) and power density (440 W kg−1) [143]. The electrode, consisting of a bismuth ferrite wafer-like structure supported by 2D g-C3N4 and N-doped graphene quantum dots, exhibited an impressive capacitance of 1472 F g−1 at 1 A g−1, with 87% retention after 3000 cycles. In an asymmetric configuration, the device reached an energy density and power density of 53.1 Wh kg−1 and 705.4 W kg−1, respectively [144]. The electrode made by combining Ni-Co phosphate nanoflakes with g-C3N4 nanosheets showed a remarkably high capacitance of 2000 F g−1 (242 mA h g−1) at 1 A g−1. This was attributed to the redox-rich g-C3N4 matrix, which enhanced the capacitive behavior without affecting the charge storage kinetics [145]. A novel hexaferrite-based composite (BaCoFe11O19/g-C3N4) demonstrated significantly enhanced electrochemical capacitance (314.6 F g−1 at 0.5 A g−1) and rate capability (94.3% over 10,000 cycles) than BaCoFe11O19 alone due to its larger surface area and hierarchical structure [146]. Furthermore, a mesoporous hollow Prussian blue/g-C3N4 composite benefitted from its hollow mesoporous nano box structure, and the inclusion of g-C3N4 resulted in a specific capacity of 201.6 mA h g−1 at 1 A g−1, with 90% retention through 5000 cycles at 10 A g−1 [147]. The composites of g-C3N4 with other nontraditional materials, such as phosphates, boron nitride, or organic-inorganic hybrids, offer unique advantages, such as improved thermal stability, electrochemical efficiency, and tunable electronic properties. These innovations expand the versatility of g-C3N4 in the field of sustainable energy storage applications. 3.3 g-C3N4-carbon composites When g-C3N4 is combined with various carbon-based materials, such as graphene, carbon nanotubes, or activated carbon, the resulting composites exhibit increased electrical conductivity, surface area, and chemical stability. These hybrid materials offer improved charge storage capability, flexibility, and stability, making them highly attractive for next-generation energy technologies such as flexible SCs. 3.3.1 g-C3N4 and graphene Carbon allotropes such as graphene, CNTs, and AC are compatible with g-C3N4, and the graphene combination in a nanocomposite has shown promise for supercapacitor applications. The synergistic effects arising from the unique properties of both materials can significantly improve the overall efficiency of the supercapacitor electrode [30]. Various studies on g-C3N4-graphene supercapacitors have shown improved electrochemical properties. A supercapacitor composed of graphene/g-C3N4 with a gel electrolyte involves the interaction of carbon and nitrogen in g-C3N4 with the oxygen in graphene oxide. The thickness of the GO/g-C3N4/PVA-KOH (GNP) film dramatically increases after thermal reduction at 350 °C, which is beneficial for increasing the capacitance because of the increased SSA and infiltration of electrolytes in the electrode materials. The device achieved an areal capacitance of 1500 mF cm−1, maintaining 95% of its capacitance through 5000 cycles. Similarly, a flexible SC composed of N-rich carbon nitride and N-doped graphene underwent bending tests and exhibited stable capacitance through 20,000 cycles [148]. The combination of graphene and g-C3N4 can enhance ion diffusion and electron transport, leading to improved performance and stability. For example, 3D N-doped carbon/graphene/g-C3N4 hybrids fabricated by dissolution and carbonization for Li-S batteries have shown remarkable improvements in both energy density and lifespan, maintaining a high capacity of 1130 mA h g−1 over 500 consecutive charge/discharge cycles [149]. Different research groups have explored the use of g-C3N4/rGO nanocomposites for improving electrochemical performance. Panicker and coauthors studied NiCo2S4/g-C3N4/rGO supercapacitor electrodes that delivered an impressive specific capacitance of 1938 F g−1 at 2 A g−1 [150]. A study showed that graphene complements g-C3N4 with conductivity, whereas g-C3N4 prevents graphene layers from stacking by acting as a spacer. This combination, when added to MoO2 (MoO2/rGO/g-C3N4) via the precursor reduction method, demonstrated a considerably high capacitance of 1700 F g−1 at 1 A g−1, preserving 74.7% of its capacitance over 3000 cycles [149]. The functionalized g-C3N4 was assembled with layered rGO and LDH (fg-C3N4-rGO/LDH), as shown in Fig. 10 (a). In the given FE-SEM image, exfoliated LDH and fg-C3N4-rGO nanosheets have similar morphologies, making them hard to distinguish. In the fg-C3N4-rGO/LDH composites, LDH sheets are anchored to the fg-C3N4-rGO matrix through electrostatic interactions, forming loose lamellar structures without the distinct shapes of the LDH sheets (Fig. 10b). The fg-C3N4-rGO/LDH composites exhibited superior specific capacitance values (1190 F g−1 for fg-C3N4-rGO/LDH-1 and 931 F g−1 for fg-C3N4-rGO/LDH-2 at 1 A g−1) compared with those of rGO/LDH (859 F g−1) and LDH (684 F g−1). This performance was due to the conductive fg-C3N4-rGO matrix, which increased the surface area, enhanced the conductivity, and promoted the formation of smaller LDH sheets. The resulting open and porous morphology reduces the number of ion-transport paths and enhances the electrocatalytic properties. The specific capacitance values of the different electrodes as a function of current density are shown in Fig. 10(c). The device exhibited cyclic stability up to 7000 GCD cycles at 7.5 A g−1 (Fig. 10d), with energy (54.7 Wh kg−1) and power (797.9 W kg−1) densities, as presented in a Ragone plot Fig. 10(e) [101]. The composition of g-C3N4 and graphene improved the supercapacitive parameters of the composites. Different architectures, such as graphene nanosheets decorated with g-C3N4, graphene nanosheets wrapped with g-C3N4, and hierarchical structures, have been investigated to optimize the electrochemical properties of supercapacitors, but challenges such as scalable synthesis, long-term stability, and the cost of graphene need to be addressed. 3.3.2 g-C3N4 and CNTs Carbon nanotubes (CNTs) are cylindrical nanostructures made of carbon atoms connected by sp 2 bonds. They are known for their outstanding electrical conductivity, mechanical strength, and high surface area, which are advantageous for improving energy storage efficiency [29,151]. A 3D hierarchical MnMoO4@g-C3N4/CNT hybrid composite was synthesized using a hydrothermal approach (Fig. 11 a). SEM images of g-C3N4 (Fig. 11b), g-C3N4/CNT (Fig. 11c), and MnMoO4@g-C3N4/CNT, which are intertwined with MnMoO4 rods within the 3D g-C3N4/CNT network structure, are shown in Fig. 11(d). An increase in the scan rate causes peak shifts in the CV curve, indicating efficient ionic mobility and electron transfer at the electrode-electrolyte interface, as depicted in Fig. 11(e). The Nyquist impedance plots for the g-C3N4/CNT and MnMoO4@g-C3N4/CNT electrodes demonstrate distinctive characteristics, confirming the synergistic effect of the pseudocapacitive mechanism within the 3D hybrid material (Fig. 11f). The specific capacitances for the g-C3N4/CNT and MnMoO4@g-C3N4/CNT electrodes were 252.4 and 89.2 F g−1, respectively, at 1 A g−1 in a 1 M NaCl solution (Fig. 11g) [152]. g-C3N4 contributes to the capacitance due to its intrinsic pseudocapacitive behavior, whereas CNTs contribute to the electronic conductivity and mechanical strength of a composite. For example, NeCo3S4/g-C3N4/CNT showed an exceptional specific capacitance of 1158 F g−1 at 1 A g−1 and maintained 97.2% cycling stability after 4000 cycles. Thick CNTs provide excellent conductive support and spacers, increasing the electron conductivity and creating active sites for redox reactions. Additionally, nitrogen doping improved electrolyte wettability, facilitating rapid electron transfer [153]. The 2D structure of g-C3N4 provides a substantial surface area for better charge storage. In contrast, the 1D structure of CNTs enables fast electron transport and ionic diffusion within the electrode [154]. 3.4 g-C3N4-conducting polymer composites Conducting polymers are composed of many organic molecules that exhibit electrical conductivity due to the presence of π-conjugated systems within their molecular structure [3]. In contrast to conventional insulating polymers, conducting polymers have the ability to transport charge carriers, such as electrons and ions, resulting in electrical conductivity [155]. A distinctive feature of conducting polymers is their remarkable redox behavior, which enables reversible redox reactions by absorbing and releasing charge carriers. This attribute indicates their potential for use in batteries and supercapacitors [156]. They offer significant power density, quick charging features, and remarkable cyclic stability when used as electrodes in supercapacitors. However, their performance in terms of power output and cycle life is limited when they are used exclusively in supercapacitor electrodes [17]. To address these challenges and enhance electrode efficiency, researchers have explored the potential of merging conductive polymers with g-C3N4 [157]. Notably, conductive materials such as poly(3,4-ethylenedioxythiophene) polystyrene sulfonate (PEDOT:PSS), polyindole (PIn), polyaniline (PANI), and polypyrrole (PPy) have potential applications in supercapacitor technology. A composite of PEDOT and g-C3N4 demonstrated a specific capacitance of 277 F g−1 at 1 A g−1 in 1 M H2SO4, with an energy density of 10.2 Wh kg−1 and a power density of 4245 W kg−1, maintaining 94.2% capacitance through 5000 cycles. Zhou synthesized a flower-shaped PANI/g-C3N4 composite electrode via a polymerization technique, achieving a capacitance of 584.3 F g−1 at 1 A g−1 in a 1 M H2SO4 solution [158]. The integration of conducting polymers contributes to enhancing capacitance through redox reactions. The layered g-C3N4/PPy nanocomposite demonstrated a specific capacitance of 471 F g−1 at 1 A g−1, with 70% retention over 5000 cycles, surpassing those of PPy and g-C3N4 [159]. In another study, electrodes made of polyindole and g-C3N4 (PIn/g-C3N4) via the reflux method achieved a specific capacity of 440.8 C g−1 at 6 A g−1 in 1 M H2SO4. An asymmetric device with rGO achieved a specific capacitance of 73.84 C g−1, an energy density of 23.2 Wh kg−1, and a power density of 2307 W kg−1 at 3 A g−1, maintaining 72% cyclic stability after 5000 cycles [160]. A semiflexible, binder-free thin film nanocomposite intercalated with g-C3N4 and PPy was prepared via a hybrid electrospray method, as illustrated in Fig. 12 (a). CV analysis of pristine PPy and the composite at a scan rate of 5 mV s−1 is shown in Fig. 12(b). Electrochemical tests indicated that the modified composite achieved an areal capacity of 289.6 mF cm−2 at 0.4 mA cm−2, surpassing the 194.8 mF cm−2 of unmodified PPy (Fig. 12c). The PPy/g-C3N4 heterostructure electrode demonstrated remarkable cycle stability, maintaining 99% capacity for up to 10,000 cycles (Fig. 12d), which was attributed to the low resistance resulting from the interaction between the PPy matrix and g-C3N4, ensuring strong adherence of the materials on the surface (Fig. 12e) [161]. Conducting polymers (for example, PTh, PANI, and PPy) are essential for smart and flexible supercapacitors, enabling them to be bendable and stretchable while maintaining electrical conductivity even under mechanical deformation. This allows them to be used in wearable or flexible electronics without compromising performance. Exploring the potential of g-C3N4 and conducting polymer composites for electrode materials has revealed promising directions in terms of stability, although improvements in specific capacitance are needed. Moreover, the availability of highly conductive polymers remains a significant challenge. 3.5 Ternary and multiphase composites Ternary and multiphase composites are utilized to create 3D heterostructures. The 3D structure is employed to minimize the path for ion and electron diffusion, thus avoiding the self-aggregation of materials [162]. The integration of g-C3N4 or its oxidized form with various metal oxides has led to a notable increase in the mesoporous surface area, including increases in both the micro- and mesopore sizes. The utilization of g-C3N4, in either its pure or oxidized state, has been effective in preventing the aggregation of metal oxides by providing a supportive sheet-like structure to these nanomaterials [163]. A 3D composite of RuO2/g-C3N4/rGO aerogel was developed through electrostatic self-assembly for smart supercapacitors. This composite utilized g-C3N4 to prevent aggregation of RuO2 nanoparticles and stacking of graphene layers, thereby increasing the surface area and EDLC. RuO2/g-C3N4/rGO//AC has a capacitance of 22.4 F g−1 at 10 A g−1, a specific energy and a specific power of 2.50 Wh kg−1 and 4500 W kg−1, respectively [164]. A study developed a nickel selenide (NiSe)/rGO/g-C3N4 anode for HSCs. The device resulted in a specific capacity of 412.6 mA h g−1, an energy density of 65.2 Wh kg−1, and 93.3% efficiency after 10,000 cycles [18]. A composite material of MnO2 nanorods and conductive PPy was deposited on 2D g-C3N4 nanosheets, as illustrated in Fig. 13 (a). The specific capacitance of the MnO2/g-C3N4/PPy electrode was 274 F g−1 at 2 A g−1, nearly twice that of the MnO2/PPy electrode, with a cycling stability of 95% (1000 cycles) [165]. Another nanocomposite electrode (PTh/g-C3N4/V2O5) was produced via the hydrothermal method, which resulted in a uniform distribution of V2O5 and PTh nanoparticles on g-C3N4 nanosheets, as shown in the TEM image (Fig. 13b). The inclusion of V2O5 and PTh nanoparticles as spacers increased the BET surface area and charge transport, resulting in improved performance. The PTh/g-C3N4/V2O5 composite had a greater surface area (390 cm2 g−1) (Fig. 13c) and pore volume (0.28 cm3 g−1) than the other nanocomposites, such as pure PTh, PTh/V2O5, and PTh/g-C3N4 (Fig. 13d). CV profiles (Fig. 13e), specific capacitances (Fig. 13f), and retention rates of specific capacitance for PTh, PTh/V2O5, PTh/GCN, and PTh/GCN/V2O5 (Fig. 13g) showed that PTh/g-C3N4/V2O5 SC exhibited excellent delivery of specific capacitance (720 F g−1), specific energy (32 Wh kg−1), specific power (3291 W kg−1), and cyclic stability (96%, 5000 cycles) [166]. In addition, constructing a quaternary/multiphase nanocomposite structure can improve the electronic conductivity, offer more electrochemically active sites, and increase redox reactions. For example, a multicomponent NiO/g-C3N4/CNT/TiO2 electrode showed an enhanced specific capacitance (388.76 F g−1) compared with that of a NiO/g-C3N4/CNT electrode (362.12 F g−1) because of the improved charge transfer capability of TiO2/CNT bridges in the interlayered and porous g-C3N4 structure, ensuring ion diffusion pathways for better and improved conductivity [167]. A battery-type NiO/g-C3N4/PANI/Ni-MOF quaternary composite exhibited an excellent capacitance of 2420 F g−1 (584 mA h g−1) at 5 A g−1. By tuning Ni-MOF with NiO, g-C3N4, and PANI nanostructures, a symmetric device resulted in a specific energy of 31.3 Wh kg−1 and a specific power of 1491 W kg−1, which was 1.5 times greater than that of their ternary composites with 99.5% stability after 3000 cycles [168]. In ternary and multiphase composites, the overall performance is influenced by the contribution of each component. The heterojunctions formed between g-C3N4 and other materials offer versatility suitable for hybrid energy applications. However, maintaining a controlled morphology, phase distribution, optimal component ratios, and interactions between multiple phases is challenging. 4 Energy storage applications Smart energy storage devices, such as photosensitive, thermosensitive, electrosensitive, and flexible supercapacitors (SCs), integrate responsiveness to environmental stimuli. Photosensitive SCs capture solar energy, which is ideal for solar-powered wearables. Thermosensitive SCs adjust to temperature variations, which is valuable in extreme environments. Electrosensitive SCs respond to changes in electric fields, offering real-time power management. Flexible SCs seamlessly integrate into wearable electronics and portable devices, enhancing energy efficiency while maintaining durability. These advancements pave the way for adaptive energy storage in modern technologies. The versatile polymeric g-C3N4 has applications in photocatalysis, electrocatalysis, sensing, and energy storage devices because of its high nitrogen content, excellent chemical and thermal strength, easy preparation, low toxicity, and cost-effectiveness. Owing to its excellent electrochemical properties, this material has great potential for use in batteries and supercapacitors. This section discusses the use of g-C3N4 and its composites in supercapacitor applications. 4.1 Battery-type hybrid capacitors Battery-type hybrid capacitors or ultracapacitors are novel types of EES that bridge the performance gap between SCs and batteries. These hybrid capacitors are typically fabricated with a capacitor-type cathode for high power density and a battery-type anode for high energy density [169]. Ultracapacitors, such as lithium-ion hybrid supercapacitors, sodium-ion hybrid supercapacitors, and potassium-ion hybrid capacitors, have attracted significant interest in the large-scale energy field [170]. g-C3N4 has been used as a part of the anode for various battery-type hybrid capacitors. As a reference, a g-C3N4/N-rich carbon fiber composite anode with a high nitrogen content (19.78 at%), high discharge capacity (391 mA h g−1), long-term stability (201 mA h g−1 for 3000 cycles), and excellent rate capability (141 mA h g−1) has been used for potassium-ion hybrid capacitors [171]. A multiphase MoS2-SnS@g-C3N4/graphene structure was assembled via a covalent bonding technique for sodium-ion hybrid capacitors, as shown in Fig. 14 (a). This innovative structure enhances electrical conductivity, supports swift electron transfer across interfaces and mitigates the volumetric expansion of MoS2-SnS during the sodium-ion extraction/insertion cycle. Consequently, the electrode exhibited a high reversible capacity of 834 mA h g−1 at 0.1 A g−1, a rate capability of 452 mA h g−1 at 5 A g−1, and a cyclic stability of 54.7% (500 cycles) in sodium half-cells (Fig. 14b–d). The MoS2-SnS@g-C3N4/graphene||AC achieved a specific energy of 193 W h kg−1 and a specific power of 90 W kg−1. Fig. 14(e) shows a schematic of the sodium ion hybrid capacitor, where ClO4 − anions are adsorbed onto the surface of the AC cathode, while Na+ cations are intercalated into or adsorbed onto the MoS2-SnS@g-C3N4/G anode during charging. During discharging, the process occurs in reverse [172]. The use of g-C3N4 as a sacrificial template not only inhibits the accumulation of the material but also provides the composite with 2D morphology. Owing to this architecture, the heterostructure has an accelerated ion diffusion rate, enhanced electronic conductivity, and well-controlled volume expansion. An N-doped graphene nanolayer (N-g-C3N4) anode was synthesized using g-C3N4 as a binder as well as a template for lithium-ion capacitors. g-C3N4, with its self-decomposing and nitrogen-rich properties, helps lithium-ion capacitors deliver excellent rate capability and excellent cycling stability (84.4%, 5000 cycles) [173]. All-carbon potassium-ion hybrid capacitors with C3N4/carbon as both the anode and cathode exhibited high energy and power densities due to their high thermostability and the ability to covalently bond supermolecule-derived C3N4 intermediates with lignin-derived carbon skeletons at high temperatures. This C3N4/carbon intermediate structure enables high nitrogen doping in the obtained carbons. The ultrahigh nitrogen doping level (17%) endows enhanced pseudocapacitance, resulting in highly stabilized potassium-ion storage [174]. In another study, a nanocomposite anode consisting of NiSe integrated with g-C3N4 and rGO (NiSe/g-C3N4/rGO) was developed via a simple hydrothermal process to form a hybrid SC. This integration leads to improvements in electron transfer processes and ionic transportation in the nanocomposite. Notably, the NiSe nanoparticles show uniform growth on the g-C3N4/rGO nanosheets, creating a hierarchical architecture. The extended π-conjugated layered structure of g-C3N4 promotes strong interactions with rGO, which further enhances the surface area, surface free energy, and efficient electron/ionic path. Additionally, it establishes clear ion diffusion pathways, serving as ion reservoirs during charging and discharging and facilitating efficient redox reactions. As an outcome, the nanocomposite electrode (NiSe/g-C3N4/rGO) displayed a high capacity of 412.6 mA h g−1 at 1 A g−1 [18]. 4.2 All solid-state and flexible supercapacitors All solid-state supercapacitors (ASC) use solid-state electrolytes made from various materials, such as polymers, ceramics, or hybrid composites. The components are integrated into a solid matrix, providing a robust and stable configuration. Owing to their rigid and fixed structure, they offer high energy density and power density. Compared with liquid or gel electrolytes, solid-state electrolytes often provide better thermal stability and safety because of the absence of liquid electrolytes, which reduces the risk of leakage or flammability [175]. These are used in applications requiring safety and stability, such as electric vehicles, industrial machinery, and stationary energy storage systems. The fg-C3N4-rGO/LDH//3D-fg-C3N4/rGO ASC device demonstrated a specific capacitance of 154 F g−1 at 1 A g−1, an energy density of 54.76 Wh kg−1, and a power density of 797.9 W kg−1 [101]. A solid-state asymmetric SC was made of a MoO3/g-C3N4 cathode, an AC anode, and a 1-ethyl-3-methylimidazolium tetrafluoroborate (EMIMBF4) ionogel electrolyte. The composite material had a specific capacity of 520.97 C g−1 at 10 mV s−1, exhibiting a lower solution resistance (R s = 0.05 Ω) and a charge transfer resistance (R ct = 3.14 Ω). The MoO3-g-C3N4//AC system demonstrated energy and power densities of 59.75 Wh kg−1 and 1125 W kg−1, respectively [176]. Research has shown that combining g-C3N4 with CoS-NiCo2S4 significantly improved the efficiency of solid-state hybrid SCs. This combination, known as CoS-NiCo2S4/g-C3N4, offers better hydrophilicity, uniform phase formation, and nanocrystal size. It also has lowered internal and ion diffusion resistances and a better ability to store charge on the surface, leading to higher efficiency, especially at higher charge and discharge rates. Compared with the original CoS-NiCo2S4, CoS-NiCo2S4/g-C3N4 exhibited substantially greater capacitance and energy storage, along with a capacitance lasting over 10,000 discharge cycles. This improvement is attributed to g-C3N4 helping to create a more integrated and conductive structure, adjusting the ratio of nickel to cobalt for better performance, and introducing an effective ion-buffering system within the material [177]. Flexible and wearable supercapacitors have attracted significant attention in research for their promising role as integrated power sources in applications such as roll-up displays, field-effect transistors, and car windows [178]. g-C3N4, with its 2D structure, is a suitable material for flexible electrodes owing to its exceptional structural stability, appealing electronic properties, and environmentally friendly features [179]. Flexible supercapacitors can utilize solid-state, gel, or liquid electrolytes and electrodes of flexible materials such as CNTs, graphene, conductive polymers, or fabric-based materials [180]. Using an ionic liquid (IL) as an electrolyte increases the operating voltage and energy density of flexible supercapacitors. Flexible N-doped carbon nanosheets derived from g-C3N4 served as a sacrificial template for the growth of MnO2 nanoneedles that had a 188.2 F g−1 capacitance in the IL [181]. Furthermore, a 3D flexible electrode made of g-C3N4 nanowires was used as a supportive scaffold for PEDOT:PSS. The composite electrode outperformed pure PEDOT:PSS, exhibiting a 202 F g−1 capacitance and 83.5% cyclic stability after 5000 cycles [182]. A wire-shaped flexible supercapacitor was assembled using carbon fibers (CFs) coated with rGO and g-C3N4 (CF/rGO/g-C3N4) electrodes and a PVA/KOH gel electrolyte. The areal capacitance and cycling stability of the device were 61 mF cm−1 and 90% (5000 cycles), respectively. The addition of g-C3N4 prevents graphene from stacking, enhancing electrochemical storage [183]. The Ti3C2T x /g-C3N4 heterostructure was fabricated via self-assembly to increase the layer spacing, improve the charge transfer efficiency, and prevent restacking (Fig. 15 a). The Ti3C2T x /g-C3N4 flexible films showed stable performance under flat and different bending conditions, as seen in the digital photos (Fig. 15b) and the CV curves of the Ti3C2T x /g-C3N4 flexible electrodes under different bending conditions at 20 mV s−1 (Fig. 15c). The capacities achieved by various composites at different current densities under both flat and bending conditions are illustrated in Fig. 15(d). The Nyquist curves of the Ti3C2T x /g-C3N4 film (Fig. 15e) revealed a steep impedance slope, indicating ideal double-layer capacitance, whereas small semicircles in the high-frequency region reflected low internal resistance. Compared with the other electrodes, the Ti3C2T x /g-C3N4 composite has the lowest charge transfer impedance, ensuring efficient electron and ion movement and superior capacitance performance. The capacitance, energy density, and power density of the Ti3C2T x /g-C3N4 flexible symmetric SC were 414 F g−1 at 1 A g−1, 23.9 Wh kg−1, and 139.6 W kg−1, respectively [184]. 4.3 Photo-supercapacitors Photo-supercapacitors are innovative devices that can convert solar energy into electrical energy and store it simultaneously. They were first developed by Miyasaka and Murakami in 2004 by combining a dye-sensitive solar cell and a capacitor [185]. Most of the work reported has focused on integrating separately designed solar cells with SCs. However, performing energy conversion and storage on the same system with an efficient and compact design is challenging [186]. Non-metallic g-C3N4 has turned out to be a unique material due to its narrow band gap (∼2.7 eV), great chemical stability, greater surface area, greater number of energetic sites and smaller distance between photoexcited charge carriers, which can be useful for increasing photocatalytic performance [187]. Recently, the author synthesized a photo rechargeable zinc-ion capacitor (ZIC) using g-C3N4 to harvest solar energy and charge storage simultaneously. 2D g-C3N4 is used as a photoactive cathode material because of its unique combination of a band gap in the visible light spectrum (∼2.7 eV) and high surface area desirable for ion adsorption [188]. Furthermore, g-C3N4/ZnO-nanowire composites have been synthesized as photoactive electrode materials. The g-C3N4/ZnO nanowire-based photo-supercapacitors with Li+ Nafion membranes as the solid electrolyte exhibited outstanding stability over 25,000 charge-discharge cycles, along with 90.2% capacitance retention and 99.9% coulombic efficiency [189]. The photoactive ZnFe2O4/g-C3N4 nanocomposite was made via the sol-gel method, and its HR-TEM image confirmed the heterostructure between g-C3N4 and ZnFe2O4, as shown in Fig. 16 (a). This composite catalyst exhibited enhanced photocatalytic activity in the UV-DRS absorption spectra of g-C3N4/ZnFe2O4, surpassing those of pure ZnFe2O4 and g-C3N4 (Fig. 16b). An elemental trapping experiment demonstrated the presence of photo-catalytically active radicals along with the mechanism of the possible photocatalytic reaction, revealing that OH* radicals played a major role, whereas O2 contributed only slightly to the degradation process (Fig. 16c). The capacitance of 103 F g−1 at 10 A g−1 resulted from the enhanced rate of ion diffusion and redox-active sites, contributing to pseudocapacitive behavior, as shown in Fig. 16(d). The stability of the composite catalyst was demonstrated by maintaining 95% of the degradation efficiency of photocatalysis after 5 cycles under direct sunlight (Fig. 16e), retaining 94% of its capacitance over 500 cycles at 10 A g−1 (Fig. 16f) [190]. 5 Conclusion and future perspective Graphitic carbon nitride (g-C3N4) has gained interest as a promising material for future energy storage technologies. Its substantial nitrogen content, chemical stability, thermal stability, and cost-efficient production methods make it an attractive option for supercapacitor applications. However, challenges remain in controlling thickness, surface properties and improving its low conductivity. Structural modifications, such as creating nanorods, spheres, or 2D layers, enhance its electronic properties, paving the way for broader implementation in advanced energy technologies. Hence, research efforts have focused on developing g-C3N4 composites by integrating them with metal compounds, carbon materials, and conductive polymers to enhance their properties. In heterostructures involving transition metal compounds (such as TMOs, LDHs, and TMDs), g-C3N4 is an effective template or support material. The incorporation of highly conductive materials such as carbon (for example, CNTs and graphene) or conductive polymers (such as PEDOT, PPy, and PANI) enhances the electronic conductivity of g-C3N4 electrodes. This review examined the current state of g-C3N4-based supercapacitors, focusing on their design, performance, and applications. This highlighted the advances in electrode materials and the importance of optimizing device architecture, emphasizing the role of g-C3N4 and other components in these developments. The supercapacitive performance of various binary and ternary composites of g-C3N4 is tabulated in Table 1 with necessary attributes such as electrode composition, electrolyte, fabrication method, device type, and electrochemical results such as specific capacitance, energy density, power density, retention rate [191–220]. Compared with binary composites, ternary composites have exhibited superior performance, highlighting the benefits of incorporating three materials. However, optimal combinations of materials for enhanced performance have yet to be fully explored. The integration of g-C3N4 nanomaterials notably improved the energy density, power density, and cycling stability of the composites. Despite these advancements, challenges such as conductivity, aggregation, long-term stability of materials, developing cost-effective manufacturing methods and ensuring seamless integration into existing infrastructure remain crucial for advancing g-C3N4 technologies. Recent studies have demonstrated significant progress in integrating carbon nitride-based materials into supercapacitor devices. For example, hybrid materials that combine g-C3N4 with transition metal sulfides or oxides have shown remarkable improvements in capacitance and cycling stability. In one study, a g-C3N4-Co3S4 composite was synthesized and tested in supercapacitor devices, achieving a high specific capacitance of 830 F g−1 and excellent cycling stability over 10,000 cycles. This performance was attributed to the synergistic effect between the g-C3N4 conductivity and the redox activity of Co3S4, which contributed to enhanced charge storage and faster electron transfer [153]. Similarly, the incorporation of g-C3N4 with graphene or reduced graphene oxide has significantly improved the power and energy density of supercapacitors. For example, a composite of graphene and g-C3N4 synthesized via a one-step pyrolysis process showed a specific capacitance of 320 F g−1 and superior rate capability, maintaining 90% of its capacitance at high charge/discharge rates. This material exhibited a high energy density of 21.5 Wh kg−1 and a power density of 2.7 kW kg−1, making it a promising candidate for high-performance supercapacitors in energy storage applications [183]. These examples highlight the potential of g-C3N4 and its composites in enhancing supercapacitor performance, particularly in terms of energy density, power density, and cycling stability. Future research directions should aim at overcoming the limitations and exploring several promising avenues. The emerging field of 2D materials offers exciting opportunities for developing advanced electrode materials. Phosphorene and silicone can be effectively engineered with graphene-like carbon nitride to enhance their electrochemical properties. While liquid and gel polymer electrodes have been extensively studied, solid electrolytes composed of ceramics and other composites remain relatively unexplored. Additionally, research on composites of g-C3N4 and metal phosphates is limited, presenting an untapped opportunity for investigation. Furthermore, there is significant potential for groundbreaking research in the development of g-C3N4-based photo-supercapacitors. The future scope of g-C3N4 and its composites lies in enhancing its functional properties through controlled doping, morphological engineering, and hybridization with advanced materials. By fine-tuning the synthesis approach, researchers aim to improve its conductivity, surface area, and catalytic activity. These composites hold potential in next-generation applications such as supercapacitors, photocatalysis, and hydrogen production, offering a sustainable pathway for green energy technologies. Additionally, the development of scalable, low-cost, and eco-friendly synthesis routes will be a key to broadening the commercial viability of g-C3N4 electrodes. Smart energy storage applications involve devices that store energy and respond to environmental or external stimuli, such as light, temperature, pressure, or electric fields. These systems are important for wearable electronics, IoT devices, and smart grids. Examples include photosensitive supercapacitors for solar energy harvesting, thermosensitive supercapacitors that adjust performance based on temperature changes, and electrosensitive supercapacitors for real-time energy storage optimization. Flexible supercapacitors are crucial for wearable and foldable devices because of their energy efficiency and mechanical durability under physical stress. These devices offer advantages such as rapid charging, long cycling life, and adaptability, paving the way for more efficient energy management in modern electronics, autonomous systems, and renewable energy solutions. The integration of smart materials such as conducting polymers and carbon nanostructures further enhances the functionality of these devices, making them essential for future energy storage technologies. Integrating advanced technologies such as artificial intelligence and machine learning could optimize design and forecast performance, potentially overcoming current limitations and promoting future energy storage devices. The advancements in flexible supercapacitors and battery-type supercapacitors hold great promise for electric vehicles, portable electronics, and grid storage. By addressing the identified research gaps and leveraging emerging trends, the field can continue to progress toward more efficient, sustainable, and high-performance energy storage solutions. Declaration of generative AI and AI-assisted technologies in the writing process During the preparation of this work, the author(s) used [AJE, Grammarly and Chatgpt 3.5] for English and grammar editing. After using this tool/service, the author(s) reviewed and edited the content as needed and take(s) full responsibility for the content of the publication. CRediT authorship contribution statement Priyanka Chaluvachar: Writing – review & editing, Writing – original draft, Methodology, Formal analysis, Data curation, Conceptualization. Y.N. Sudhakar: Writing – review & editing, Writing – original draft, Visualization, Resources, Conceptualization. G.T. Mahesha: Writing – review & editing, Supervision, Project administration, Conceptualization. Vishnu G. Nair: Writing – review & editing, Supervision, Formal analysis. Nakul Desai: Formal analysis, Data curation. Dayananda K. Pai: Writing – review & editing, Visualization, Supervision, Conceptualization. Declaration of competing interest The authors declare that they have no known competing financial interests or personal relationships that could have appeared to influence the work reported in this paper. Acknowledgments The authors wish to acknowledge the financial support of the TMA pai scholarship from the Manipal Institute of Technology, Manipal Academy of Higher Education, Manipal, in achieving this milestone. References [1] B. Pal S. Yang S. Ramesh V. Thangadurai R. Jose Nanoscale Adv. 1 2019 3807 3835 B. Pal, S. Yang, S. Ramesh, V. Thangadurai, R. Jose, Nanoscale Adv. 1 (2019) 3807–3835. [2] V. Molahalli, C. K, M.K. Singh, M. Agrawal, S.G. Krishnan, G. Hegde, J. Energy Storage 70 (2023) 108062. [3] E. Dhandapani S. Thangarasu S. Ramesh K. Ramesh R. Vasudevan N. Duraisamy J. Energy Storage 52 2022 104937 E. Dhandapani, S. Thangarasu, S. Ramesh, K. Ramesh, R. Vasudevan, N. Duraisamy, J. Energy Storage 52 (2022) 104937. [4] A. Riaz M.R. Sarker M.H.M. Saad R. Mohamed Sensors 21 2021 1 33 A. Riaz, M.R. Sarker, M.H.M. Saad, and R. Mohamed, Sensors 21 (2021) 1–33. [5] H. Rezk A.M. Nassef M.A. Abdelkareem A.H. Alami A. Fathy Int. J. Hydrogen Energy 46 2021 6110 6126 H. Rezk, A.M. Nassef, M.A. Abdelkareem, A.H. Alami, A. Fathy, Int. J. Hydrogen Energy 46 (2021) 6110–6126. [6] S. Newby W. Mirihanage A. Fernando ACS Omega 8 2023 12613 12629 S. Newby, W. Mirihanage, A. Fernando, ACS Omega 8 (2023) 12613–12629. [7] S.S. Nardekar S.J. Kim Adv. Sci. 10 2023 1 9 S.S. Nardekar, S.J. Kim, Adv. Sci. 10 (2023) 1–9. [8] Q. Zhang L. Liu J. Zhang G. Zhang Y. Chen H. Huang J. Energy Storage 60 2023 106602 Q. Zhang, L. Liu, J. Zhang, G. Zhang, Y. Chen, H. Huang, J. Energy Storage 60 (2023) 106602. [9] J. Zhang M. Gu X. Chen Micro Nano Eng. 21 2023 100229 J. Zhang, M. Gu, X. Chen, Micro Nano Eng. 21 (2023) 100229. [10] S.H. Sutar B.M. Babar K.B. Pisal A.I. Inamdar S.H. Mujawar J. Energy Storage 73 2023 109035 S.H. Sutar, B.M. Babar, K.B. Pisal, A.I. Inamdar, S.H. Mujawar, J. Energy Storage 73 (2023) 109035. [11] X.L. Su J.R. Chen G.P. Zheng J.H. Yang X.X. Guan X.C. Zheng Appl. Surf. Sci. 436 2018 327 336 X.L. Su, J.R. Chen, G.P. Zheng, J.H. Yang, X.X. Guan, X.C. Zheng, Appl. Surf. Sci. 436 (2018) 327–336. [12] N. Choudhary C. Li J. Moore N. Nagaiah L. Zhai J. Thomas Adv. Mater. 29 2017 1605336 N. Choudhary, C. Li, J. Moore, N. Nagaiah, L. Zhai, J. Thomas, Adv. Mater. 29 (2017) 1605336. [13] N.S. Shaikh S.B. Ubale V.J. Mane J.S. Shaikh V.C. Lokhande S. Praserthdam C.D. Lokhandeb P. Kanjanaboos J. Alloys Compd. 893 2022 161998 N.S. Shaikh, S.B. Ubale, V.J. Mane, J.S. Shaikh, V.C. Lokhande, S. Praserthdam, C.D. Lokhandeb, P. Kanjanaboos, J. Alloys Compd. 893 (2022) 161998. [14] M. Ates A. Chebil O. Yoruk C. Dridi M. Turkyilmaz Ionics (Kiel). 28 2022 27 52 M. Ates, A. Chebil, O. Yoruk, C. Dridi, M. Turkyilmaz, Ionics (Kiel). 28 (2022) 27–52. [15] M. Ibrahim M.G. Fayed S.G. Mohamed Z. Wen X. Sun H.N. Abdelhamid ACS Appl. Energy Mater. 5 2022 12828 12836 M. Ibrahim, M.G. Fayed, S.G. Mohamed, Z. Wen, X. Sun, H.N. Abdelhamid, ACS Appl. Energy Mater. 5 (2022) 12828–12836. [16] A. Hoque T. Ul A.N.M.M. Rahman J. Energy Storage 56 2022 105988 A. Hoque, T. Ul, A.N.M.M. Rahman, J. Energy Storage 56 (2022) 105988. [17] M.A.A. Mohd Abdah N.H.N. Azman S. Kulandaivalu Y. Sulaiman Mater. Des. 186 2020 108199 M.A.A. Mohd Abdah, N.H.N. Azman, S. Kulandaivalu, Y. Sulaiman, Mater. Des. 186 (2020) 108199. [18] S.R. Khaladkar G.G. Oshnik Maurya D. Dubal R. Deshmukh A. Kalekar ACS Appl. Mater. Interfaces 16 2024 11408 11420 S.R. Khaladkar, G.G. Oshnik Maurya, D. Dubal, R. Deshmukh, A. Kalekar, ACS Appl. Mater. Interfaces 16 (2024) 11408−11420. [19] S.T.A.G. Melissen T. Le Bahers P. Sautet S.N. Steinmann Phys. Chem. Chem. Phys. 23 2021 2853 2859 S.T.A.G. Melissen, T. Le Bahers, P. Sautet, S.N. Steinmann, Phys. Chem. Chem. Phys. 23 (2021) 2853–2859. [20] X. Wang S. Blechert M. Antonietti ACS Catal. 2 2012 1596 1606 X. Wang, S. Blechert, M. Antonietti, ACS Catal. 2 (2012) 1596–1606. [21] J. Zhu P. Xiao H. Li S.A.C. Carabineiro ACS Appl. Mater. Interfaces 6 2014 16449 16465 J. Zhu, P. Xiao, H. Li, S.A.C. Carabineiro, ACS Appl. Mater. Interfaces 6 (2014) 16449–16465. [22] X. Zhang H. Liao X. Liu R. Shang Y. Zhou Y. Zhou Ionics (Kiel). 26 2020 3599 3607 X. Zhang, H. Liao, X. Liu, R. Shang, Y. Zhou, Y. Zhou, Ionics (Kiel). 26 (2020) 3599–3607. [23] H.T. Das S.P. Babu A. Mondal N. Naresh T. Elango Balaji N. Das J. Power Sources 603 2024 234374 H.T. Das, S.P. Babu, A. Mondal, N. Naresh, T. Elango Balaji, N. Das, J. Power Sources 603 (2024) 234374. [24] Y. Luo Y. Yan S. Zheng H. Xue H. Pang J. Mater. Chem. A 7 2019 901 924 Y. Luo, Y. Yan, S. Zheng, H. Xue, H. Pang, J. Mater. Chem. A 7 (2019) 901–924. [25] M.H. Chan R.S. Liu M. Hsiao Nanoscale 11 2019 14993 15003 M.H. Chan, R.S. Liu, M. Hsiao, Nanoscale 11 (2019) 14993–15003. [26] S. Cao J. Low J. Yu M. Jaroniec Adv. Mater. 27 2015 2150 2176 S. Cao, J. Low, J. Yu, M. Jaroniec, Adv. Mater. 27 (2015) 2150–2176. [27] Y. Chena B. Zhanga Y. Liua J. Chenc H. Pana W. Sun Mater. Today Catal. 1 2023 100003 Y. Chena, B. Zhanga, Y. Liua, J. Chenc, H. Pana, W. Sun, Mater. Today Catal. 1 (2023) 100003. [28] W. Li J. Li Y. Liu J. Qu B. Liu R. Zheng ACS Appl. Nano Mater. 2 2019 5399 5408 W. Li, J. Li, Y. Liu, J. Qu, B. Liu, R. Zheng, ACS Appl. Nano Mater. 2 (2019) 5399–5408. [29] M.G. Ashritha K. Hareesh J. Energy Storage 32 2020 101840 M.G. Ashritha, K. Hareesh, J. Energy Storage 32 (2020) 101840. [30] R. Arora M. Dhanda R. Malik S. Ahlawat M. Yadav S.P. Nehra S. Lata Eur. Polym. J. 201 2023 112552 R. Arora, M. Dhanda, R. Malik, S. Ahlawat, M. Yadav, S.P. Nehra, S. Lata, Eur. Polym. J. 201 (2023) 112552. [31] M. Xu T. Liang M. Shi H. Chen ACS Chem. Rev. 113 2013 3766 3798 M. Xu, T. Liang, M. Shi, H. Chen, ACS Chem. Rev. 113 (2013) 3766−3798. [32] R.R. Atram, S.B. Kondawar, D.J. Late, Structure and Properties of 2D Materials in General and Their Importance to Energy Storage 2021, Fundamentals and Supercapacitor Applications of 2D Materials, pp. 11–75. [33] G. Maheshwaran P. Pandi S. Suganya B.A. Kumar G. Ramalingam M.R. Prabhu S. Sudhahar J. Energy Storage 56 2022 105900 G. Maheshwaran, P. Pandi, S. Suganya, B.A. Kumar, G. Ramalingam, M.R. Prabhu, S. Sudhahar, J. Energy Storage 56 (2022) 105900. [34] K.S. Kumar N. Choudhary Y. Jung J. Thomas ACS Energy Lett. 3 2018 482 495 K.S. Kumar, N. Choudhary, Y. Jung, J. Thomas, ACS Energy Lett. 3 (2018) 482–495. [35] S.A. Ansari M.H. Cho Sci. Rep. 7 2017 1 11 S.A. Ansari, M.H. Cho, Sci. Rep. 7 (2017) 1–11. [36] D. Zhou L. Zhao B. Li J. Energy Chem. 62 2021 27 42 D. Zhou, L. Zhao, B. Li, J. Energy Chem. 62 (2021) 27–42. [37] X.L. Wang H.G. Yang Appl. Catal. B Environ. 205 2017 624 630 X.L. Wang, H.G. Yang, Appl. Catal. B Environ. 205 (2017) 624–630. [38] A.M. Silva M.I. Rojas Comput. Theor. Chem. 1098 2016 41 49 A.M. Silva, M.I. Rojas, Comput. Theor. Chem. 1098 (2016) 41–49. [39] T. Ahmad B.M. Alotaibi A.W. Alrowaily H.A. Alyousef M.F. Alotiby S. Aman Ceram. Int. 50 2024 15100 15109 T. Ahmad, B.M. Alotaibi, A.W. Alrowaily, H.A. Alyousef, M.F. Alotiby, S. Aman, Ceram. Int. 50 (2024) 15100–15109. [40] H. Wang Y. Liu L. Kong Z. Xu X. Shen S. Premlatha J. Energy Storage 63 2023 106935 H. Wang, Y. Liu, L. Kong, Z. Xu, X. Shen, S. Premlatha, J. Energy Storage 63 (2023) 106935. [41] S.V.P. Vattikuti C.T. Hoang Ngoc H. Nguyen N.H. Nguyen Thi J. Shim N.N. Dang J. Phys. Chem. Lett. 14 2023 9412 9423 S.V.P. Vattikuti, C.T. Hoang Ngoc, H. Nguyen, N.H. Nguyen Thi, J. Shim, N.N. Dang, J. Phys. Chem. Lett. 14 (2023) 9412–9423. [42] X. Zhang H. Liao X. Liu R. Shang Y. Zhou Y. Zhou Int. J. Electrochem. Sci. 15 2020 2133 2144 X. Zhang, H. Liao, X. Liu, R. Shang, Y. Zhou, Y. Zhou, Int. J. Electrochem. Sci. 15 (2020) 2133–2144. [43] S. Zhang P. Gu R. Ma C. Luo T. Wen X. Wang Catal. Today 335 2019 65 77 S. Zhang, P. Gu, R. Ma, C. Luo, T. Wen, X. Wang, Catal. Today 335 (2019) 65–77. [44] Q. Hao G. Jia W. Wei A. Vinu B.J. Wang Nano Res. 13 2020 18 37 Q. Hao, G. Jia, W. Wei, A. Vinu, B.J. Wang, Nano Res. 13 (2020) 18–37. [45] V.R. Govindaraju K. Sureshkumar T. Ramakrishnappa K.H. Kim J. Clean. Prod. 320 2021 128693 V.R. Govindaraju, K. Sureshkumar, T. Ramakrishnappa, K.H. Kim, J. Clean. Prod. 320 (2021) 128693. [46] F. Magesa Y. Wu Y. Tian J.M. Vianney J. Buza Y. Tan Trends Environ Anal. Chem. 23 2019 e00064 F. Magesa, Y. Wu, Y. Tian, J.M. Vianney, J. Buza, Y. Tan, Trends Environ. Anal. Chem. 23 (2019) e00064. [47] M. Inagaki T. Tsumura T. Kinumoto M. Toyoda Carbon N. Y. 141 2019 580 607 M. Inagaki, T. Tsumura, T. Kinumoto, M. Toyoda, Carbon N. Y. 141 (2019) 580–607. [48] S. Vinoth K.S. Shalini Devi A. Pandikumar TrAC - T Trends Anal. Chem. 140 2021 116274 S. Vinoth, K.S. Shalini Devi, A. Pandikumar, TrAC - Trends Anal. Chem. 140 (2021) 116274. [49] S.R. Mangisetti M. Kamaraj S. Ramaprabhu Electrochim. Acta 305 2019 264 277 S.R. Mangisetti, M. Kamaraj, S. Ramaprabhu, Electrochim. Acta 305 (2019) 264–277. [50] H. Huang S. Guo K. Cheng Z. Zhang J. Xu N. Zhang J. Mater. Sci. Mater. Electron. 30 2019 19020 19029 H. Huang, S. Guo, K. Cheng, Z. Zhang, J. Xu, N. Zhang, J. Mater. Sci. Mater. Electron. 30 (2019) 19020–19029. [51] M.S. Shruti A. Sasmal H. HyukSu A.K. Nayak Mater. Chem. Phys. 314 2024 128826 M.S. Shruti, A. Sasmal, H. HyukSu, A.K. Nayak, Mater. Chem. Phys. 314 (2024) 128826. [52] Q. Shi R. Zhang Y. Lv Y. Deng A.A. Elzatahrya D. Zhao Carbon 84 2015 335 346 Q. Shi, R. Zhang, Y. Lv, Y. Deng, A.A. Elzatahrya, D. Zhao, Carbon 84 (2015) 335–346. [53] B. Wei H. Liang R. Wang D. Zhang Z. Qi Z. Wang J. Energy Chem. 27 2018 472 477 B. Wei, H. Liang, R. Wang, D. Zhang, Z. Qi, Z. Wang, J. Energy Chem. 27 (2018) 472–477. [54] S. Munusamy K. Sivaranjan P. Sabhapathy V. Narayanan F. Mohammad Synth. Met. 272 2021 116669 S. Munusamy, K. Sivaranjan, P. Sabhapathy, V. Narayanan, F. Mohammad, Synth. Met. 272 (2021) 116669. [55] Z. Lin S. Wang Y. Miao J. Yuan Y. Liu S. Cao Int. J. Hydrogen Energy 45 2020 6341 6351 Z. Lin, S. Wang, Y. Miao, J. Yuan, Y. Liu, S. Cao, Int. J. Hydrogen Energy 45 (2020) 6341–6351. [56] G. Algara-Siller N. Severin S.Y. Chong T. Björkman R.G. Palgrave M.J. Bojdys Angew. Chemie - Int. Ed. 53 2014 7450 7455 G. Algara-Siller, N. Severin, S.Y. Chong, T. Björkman, R.G. Palgrave, M.J. Bojdys, Angew. Chemie - Int. Ed. 53 (2014) 7450–7455. [57] Y. Zhao J. Zhang L. Qu ChemNanoMat 1 2015 298 318 Y. Zhao, J. Zhang, L. Qu, ChemNanoMat 1 (2015) 298–318. [58] M. Ghaemmaghami R. Mohammadi Sustain. Energy Fuels 3 2019 2176 2204 M. Ghaemmaghami, R. Mohammadi, Sustain. Energy Fuels 3 (2019) 2176–2204. [59] W. Zhang J. Yin C. Chen X. Qiu Chem. Eng. Sci. 241 2021 116709 W. Zhang, J. Yin, C. Chen, X. Qiu, Chem. Eng. Sci. 241 (2021) 116709. [60] S. Pilathottathil J. Kavil M. Shahin Thayyil Mater. Sci. Eng. B Solid-State Mater. Adv. Technol. 276 2022 115573 S. Pilathottathil, J. Kavil, M. Shahin Thayyil, Mater. Sci. Eng. B Solid-State Mater. Adv. Technol. 276 (2022) 115573. [61] S. Asaithambia P. Sakthivela M. Karuppaiaha R. Yuvakkumara Dhayalan Velauthapillaib Tansir Vijayaprabhuf J. Alloys Compd. 866 2021 158807 S. Asaithambia, P. Sakthivela, M. Karuppaiaha, R. Yuvakkumara, Dhayalan Velauthapillaib, Tansir Vijayaprabhuf, J. Alloys Compd. 866 (2021) 158807. [62] K. Selvaraj M.E. Spontón D.A. Estenoz D. Kannaiyan Soft Matter 20 2024 1210 1223 K. Selvaraj, M.E. Spontón, D.A. Estenoz, D. Kannaiyan, Soft Matter 20 (2024) 1210–1223. [63] L.G. Ghanem M.A. Hamza M.M. Taha N.K. Allam J. Energy Storage 52 2022 104850 L.G. Ghanem, M.A. Hamza, M.M. Taha, N.K. Allam, J. Energy Storage 52 (2022) 104850. [64] O. Iqbal H. Ali N. Li A.I. Al-Sulami K.F. Alshammari M. Zahid Ansari Mater. Today Phys. 34 2023 101080 O. Iqbal, H. Ali, N. Li, A.I. Al-Sulami, K. F Alshammari, M. Zahid Ansari, Mater. Today Phys. 34 (2023) 101080. [65] M.B. Idris S. Devaraj J. Energy Storage 26 2019 101032 M.B. Idris, S. Devaraj, J. Energy Storage 26 (2019) 101032. [66] L. Wang C. Wang X. Hu H. Xue H. Pang Chem. an Asian J. 11 2016 3305 3328 L. Wang, C. Wang, X. Hu, H. Xue, H. Pang, Chem. An Asian J. 11 (2016) 3305–3328. [67] Q. Wang Y. Li F. Huang S. Song G. Ai Z. Zhang Molecules 28 2023 432 Q. Wang, Y. Li, F. Huang, S. Song, G. Ai, Z. Zhang, Molecules 28 (2023) 432. [68] L. Liu J. Wang C. Wang G. Wang Appl. Surf. Sci. 390 2016 303 310 L. Liu, J. Wang, C. Wang, G. Wang, Appl. Surf. Sci. 390 (2016) 303–310. [69] A. Kumar H. Mittal M. Khanuja J. Energy Storage 67 2023 107496 A. Kumar, H. Mittal, M. Khanuja, J. Energy Storage 67 (2023) 107496. [70] Y. Li X. Li H. Zhang Q. Xiang Nanoscale Horiz. 5 2020 765 786 Y. Li, X. Li, H. Zhang, Q. Xiang, Nanoscale Horizons 5 (2020) 765–786. [71] Y. Gong C. Fu G. Zhang H. Zhou Y. Kuang Electrochim. Acta 256 2017 1 9 Y. Gong, C. Fu, G. Zhang, H. Zhou, Y. Kuang, Electrochim. Acta 256 (2017) 1–9. [72] F. Li Y. Dong Q. Dai T.T. Nguyen M. Guo Vacuum 161 2019 283 290 F. Li, Y. Dong, Q. Dai, T.T. Nguyen, M. Guo, Vacuum 161 (2019) 283–290. [73] R. Malik V.K. Tomer Renew. Sustain. Energy Rev. 135 2021 110235 R. Malik, V.K. Tomer, Renew. Sustain. Energy Rev. 135 (2021) 110235. [74] W. Zhang M. Sun J. Yin W. Wang G. Huang X. Qiu U. Schwingenschlögl H.N. Alshareef Nano Energy 87 2021 106184 W. Zhang, M. Sun, J. Yin, W. Wang, G. Huang, X. Qiu, U. Schwingenschlögl, H.N. Alshareef, Nano Energy 87 (2021) 106184. [75] Z. Yang Q. Liu L. Zhang J. Dai Z. Shen J. Energy Storage 32 2020 101909 Z. Yang, Q. Liu, L. Zhang, J. Dai, Z. Shen, J. Energy Storage 32 (2020) 101909. [76] M. Tahir C. Cao F.K. Butt F. Idrees N. Mahmood T. Mahmood J. Mater. Chem. A 1 2013 13949 13955 M. Tahir, C. Cao, F.K. Butt, F. Idrees, N. Mahmood, T. Mahmood, J. Mater. Chem. A 1 (2013) 13949–13955. [77] M.B. Idris S. Devaraj Electrochim. Acta 303 2019 219 230 M.B. Idris, S. Devaraj, Electrochim. Acta 303 (2019) 219–230. [78] R. Gonçalves T.M. Lima M.W. Paixão E.C. Pereira RSC Adv. 8 2018 35327 35336 R. Gonçalves, T.M. Lima, M.W. Paixão, E.C. Pereira, RSC Adv. 8 (2018) 35327–35336. [79] M. Tahir C. Cao N. Mahmood F.K. Butt A. Mahmood I. Aslam ACS Appl. Mater. Interfaces 6 2014 1258 1265 M. Tahir, C. Cao, N. Mahmood, F.K. Butt, A. Mahmood, I. Aslam, ACS Appl. Mater. Interfaces 6 (2014) 1258–1265. [80] R. Lin Z. Li D.I. Abou El Amaiem B. Zhang I.P. Brett J. Mater. Chem. A 5 2017 25545 25554 R. Lin, Z. Li, D.I. Abou El Amaiem, B. Zhang, I.P. Brett, J. Mater. Chem. A 5 (2017) 25545–25554. [81] K.P. Shwetha S.G. Divakara M.K. Sudha Kamath T. Gupta Mater. Today Proc. 76 2023 219 226 K.P. Shwetha, S.G. Divakara, M.K. Sudha Kamath, T. Gupta, Mater. Today Proc. 76 (2023) 219–226. [82] Y. Qu Z. Tang L. Duan X. Li X. Zhang W. Lü J. Electrochem. Soc. 166 2019 A3564 A3569 Y. Qu, Z. Tang, L. Duan, X. Li, X. Zhang, W. Lü, J. Electrochem. Soc. 166 (2019) A3564–A3569. [83] Y. Zhou Y. Zhu D. Xue B. Xu J. Mater. Chem. A 6 2018 14065 14068 Y. Zhou, Y. Zhu, D. Xue, B. Xu, J. Mater. Chem. A 6 (2018) 14065–14068. [84] M.A. Rusho I.A. Alduhan A.I. Mohammed H.H.A. Al-Anbari A.S. Mansoor A. Yadav High Energy Density Phys. 53 2024 1 5 M.A. Rusho, I.A. Alduhan, A.I. Mohammed, H.H.A. Al-Anbari, A.S. Mansoor, A. Yadav, High Energy Density Phys. 53 (2024) 1–5. [85] T. Suter V. Brázdová K. McColl T.S. Miller H. Nagashima P.F. McMillan J. Phys. Chem. C 122 2018 25183 25194 T. Suter, V. Brázdová, K. McColl, T.S. Miller, H. Nagashima, P.F. McMillan, J. Phys. Chem. C 122 (2018) 25183–25194. [86] M. Dhanda R. Arora M. Yadav S. Ahlawat S. Dahiya S. Lata Mater. Sci. Eng. B 304 2024 117344 M. Dhanda, R. Arora, M. Yadav, S. Ahlawat, S. Dahiya, S. Lata, Mater. Sci. Eng. B 304 (2024) 117344. [87] K.F. Qasim S. Abdelhamed A. Elaraby M.A. Mousa J. Ind. Eng. Chem. 139 2024 325 335 K.F. Qasim, S. Abdelhamed, A. Elaraby, M.A. Mousa, J. Ind. Eng. Chem. 139 (2024) 325–335. [88] C. Xu L. Tong W. Zhang X. Zhao L. Yang S. Yin Chem. Eng. J. 497 2024 154449 C. Xu, L. Tong, W. Zhang, X. Zhao, L. Yang, S. Yin, Chem. Eng. J. 497 (2024) 154449. [89] M.Y. Wang J. Li Xinxing Tan Cailiao/New Carbon Mater. 33 2018 510 515 M.Y. Wang, J. Li, Xinxing Tan Cailiao/New Carbon Mater. 33 (2018) 510–515. [90] M. Talukdar P. Deb Carbon N. Y. 192 2022 308 331 M. Talukdar, P. Deb, Carbon N. Y. 192 (2022) 308–331. [91] L. Kong Q. Chen X. Shen G. Zhu J. Zhu J. Colloid Interface Sci. 532 2018 261 271 L. Kong, Q. Chen, X. Shen, G. Zhu, J. Zhu, J. Colloid Interface Sci. 532 (2018) 261–271. [92] S. Park J. Kim K. Kwon Chem. Eng. J. 446 2022 137116 S. Park, J. Kim, K. Kwon, Chem. Eng. J. 446 (2022) 137116. [93] Q.Y. Shan X.L. Guo F. Dong Y.X. Zhang Mater. Lett. 202 2017 103 106 Q.Y. Shan, X.L. Guo, F. Dong, Y.X. Zhang, Mater. Lett. 202 (2017) 103–106. [94] S. Yesmin M. Devi I. Hussain R. Dasgupta S.S. Dhar J. Energy Storage 44 2021 103308 S. Yesmin, M. Devi, I. Hussain, R. Dasgupta, S.S. Dhar, J. Energy Storage 44 (2021) 103308. [95] V. Tripathi S.P. Gupta K. Kumar L.S. Panchakarla J. Energy Storage 70 2023 107974 V. Tripathi, S.P. Gupta, K. Kumar, L.S. Panchakarla, J. Energy Storage 70 (2023) 107974. [96] Y. Ding Y. Tang L. Yang Y. Zeng J. Yuan S. Luo J. Mater. Chem. A 4 2016 14307 14315 Y. Ding, Y. Tang, L. Yang, Y. Zeng, J. Yuan, S. Luo, J. Mater. Chem. A 4 (2016) 14307–14315. [97] P. Pakzad M. Mehrpooya F. Pourfayaz M.R. Ganjali Int. J. Hydrogen Energy 48 2023 16294 16319 P. Pakzad, M. Mehrpooya, F. Pourfayaz, M.R. Ganjali, Int. J. Hydrogen Energy 48 (2023) 16294–16319. [98] Y. Zhang L. Chang X. Chang H. Chen Y. Li C. Xue Diam. Relat. Mater. 111 2021 108165 Y. Zhang, L. Chang, X. Chang, H. Chen, Y. Li, C. Xue, Diam. Relat. Mater. 111 (2021) 108165. [99] X. Chen X. Wang F. Liu X. Song H. Cui Vacuum 178 2020 3 10 X. Chen, X. Wang, F. Liu, X. Song, H. Cui, Vacuum 178 (2020) 3–10. [100] Z. Li L. Wu L. Wang A. Gu Q. Zhou Electrochim. Acta 231 2017 617 625 Z. Li, L. Wu, L. Wang, A. Gu, Q. Zhou, Electrochim. Acta 231 (2017) 617–625. [101] P. Bandyopadhyay X. Li N.H. Kim J.H. Lee Chem. Eng. J. 353 2018 824 838 P. Bandyopadhyay, X. Li, N.H. Kim, J.H. Lee, Chem. Eng. J. 353 (2018) 824–838. [102] S. Veeresh H. Ganesha Y.S. Nagaraju H. Vijeth M. Vandana M. Basappa J. Energy Storage 52 2022 104715 S. Veeresh, H. Ganesha, Y.S. Nagaraju, H. Vijeth, M. Vandana, M. Basappa, J. Energy Storage 52 (2022) 104715. [103] Y. Lin S. Zhang L. Guan J. Tao J. Mater. Sci. 56 2021 1897 1918 Y. Lin, S. Zhang, L. Guan, J. Tao, J. Mater. Sci. 56 (2021) 1897–1918. [104] S.B.Z. Hussain M. Ihrar S.B.Z. Hussain W.C. Oh K. Ullah S.N. Appl Sci. 2 2020 1 23 S.B.Z. Hussain, M. Ihrar, S.B.Z. Hussain, W.C. Oh, K. Ullah, SN Appl. Sci. 2 (2020) 1–23. [105] S. Yesmin I. Hussain R. Dasgupta S.S. Dhar J. Energy Storage 74 2023 109383 S. Yesmin, I. Hussain, R. Dasgupta, S.S. Dhar, J. Energy Storage 74 (2023) 109383. [106] R.S. Santos R. Suresh Babu T.S. Lessa L.M. Samyn R. Vinodh A.L.F. de Barros J. Ind. Eng. Chem. 133 2024 410 418 R.S. Santos, R. Suresh Babu, T.S. Lessa, L.M. Samyn, R. Vinodh, A.L.F. de Barros, J. Ind. Eng. Chem. 133 (2024) 410–418. [107] J. Kavil P.M. Anjana P. Periyat R.B. Rakhi Sustain. Energy Fuels 2 2018 2244 2251 J. Kavil, P.M. Anjana, P. Periyat, R.B. Rakhi, Sustain. Energy Fuels 2 (2018) 2244–2251. [108] Q. Lu Z. Wei M. Ding C. Li J. Ma J. Solid State Chem. 322 2023 123973 Q. Lu, Z. Wei, M. Ding, C. Li, J. Ma, J. Solid State Chem. 322 (2023) 123973. [109] S. Parveen E.W. Cochran S. Zulfiqar M.A. Amin Farooq Warsi K. Chaudhary RSC Adv. 13 2023 26822 26838 S. Parveen, E.W. Cochran, S. Zulfiqar, M.A. Amin, Farooq Warsi, K. Chaudhary, RSC Adv. 13 (2023) 26822–26838. [110] M. Fawaz R. Bahadur N. Panangattu Dharmarajan J.H. Yang A. Vinu Carbon 214 2023 118345 M. Fawaz, R. Bahadur, N. Panangattu Dharmarajan, J.H. Yang, A. Vinu, Carbon 214 (2023) 118345. [111] C. Hao X. Wang Y. Yin Z. You J. Electron. Mater. 45 2016 515 526 C. Hao, X. Wang, Y. Yin, Z. You, J. Electron. Mater. 45 (2016) 515–526. [112] D.P. Ojha H.P. Karki J. hee Song H.J. Kim Chem. Phys. Lett. 712 2018 83 88 D.P. Ojha, H.P. Karki, J. hee Song, H.J. Kim, Chem. Phys. Lett. 712 (2018) 83–88. [113] N.R. Reddy P.M. Reddy T.K. Mandal A.K. Yedluri S.W. Joo J. Energy Storage 43 2021 103302 N.R. Reddy, P.M. Reddy, T.K. Mandal, A.K. Yedluri, S.W. Joo, J. Energy Storage 43 (2021) 103302. [114] X. Xu Q. Liu T. Wei Y. Zhao X. Zhang J. Mater. Sci. Mater. Electron. 30 2019 5109 5119 X. Xu, Q. Liu, T. Wei, Y. Zhao, X. Zhang, J. Mater. Sci. Mater. Electron. 30 (2019) 5109–5119. [115] B.S. Balasubramaniam M, Diam. Relat. Mater. 97 (2019) 107460. [116] S.S. Siwal Q. Zhang C. Sun V.K. Thakur Nanomaterials 10 2020 2 S.S. Siwal, Q. Zhang, C. Sun, V.K. Thakur, Nanomaterials 10 (2020) 2. [117] S. Wu B. Xu Y. Long X. Luo L. Zhang Synth. Met. 270 2020 116601 S. Wu, B. Xu, Y. Long, X. Luo, L. Zhang, Synth. Met. 270 (2020) 116601. [118] L. Shi J. Zhang H. Liu M. Que X. Cai S. Tan L. Huang Mater. Lett. 145 2015 150 153 L. Shi, J. Zhang, H. Liu, M. Que, X. Cai, S. Tan, L. Huang, Mater. Lett. 145 (2015) 150–153. [119] B. Dong M. Li S. Chen D. Ding S. Wei ACS Appl. Mater. Interfaces 9 2017 17890 17896 B. Dong, M. Li, S. Chen, D. Ding, S. Wei, ACS Appl. Mater. Interfaces 9 (2017) 17890–17896. [120] H. Liu B. Liu X. Sun X. Han J. Cui W. He Inorg. Chem. Commun. 122 2020 108263 H. Liu, B. Liu, X. Sun, X. Han, J. Cui, W. He, Inorg. Chem. Commun. 122 (2020) 108263. [121] M. Aghazadeh K. Yavari H.F. Rad K. Mohammadzadeh J. Energy Storage 32 2020 101743 M. Aghazadeh, K. Yavari, H.F. Rad, K. Mohammadzadeh, J. Energy Storage 32 (2020) 101743. [122] E. Viveka A. Arulrajb Mohammad Khalidb I.V. Potheher J. Alloys Compd. 908 2022 164541 E. Viveka, A. Arulrajb, Mohammad Khalidb, I.V. Potheher, J. Alloys Compd. 908 (2022) 164541. [123] E. Vivek A. Arulraj S.G. Krishnan M. Khalid I. Vetha Potheher Energy Fuels 35 2021 15205 15212 E. Vivek, A. Arulraj, S.G. Krishnan, M. Khalid, I. Vetha Potheher, Energy and Fuels 35 (2021) 15205–15212. [124] Z. Xu L. Kong H. Wang X. Shen S. Premlatha J. Energy Storage 51 2022 104541 Z. Xu, L. Kong, H. Wang, X. Shen, S. Premlatha, J. Energy Storage 51 (2022) 104541. [125] L. Zhang M. Ou H. Yao Z. Li D. Qu Z. Li Electrochim. Acta 186 2015 292 301 L. Zhang, M. Ou, H. Yao, Z. Li, D. Qu, Z. Li, Electrochim. Acta 186 (2015) 292–301. [126] Z. Li M. Yao Z. Hu L. Zhang S. Gou X. Lu J. Alloys Compd. 919 2022 165805 Z. Li, M. Yao, Z. Hu, L. Zhang, S. Gou, X. Lu, J. Alloys Compd. 919 (2022) 165805. [127] S.P. Adhikari G.P. Awasthi K.S. Kim C.H. Park C.S. Kim Dalt. Trans. 47 2018 4455 4466 S.P. Adhikari, G.P. Awasthi, K.S. Kim, C.H. Park, C.S. Kim, Dalt. Trans. 47 (2018) 4455–4466. [128] B. Patil C. Park H. Ahn RSC Adv. 9 2019 33643 33652 B. Patil, C. Park, H. Ahn, RSC Adv. 9 (2019) 33643–33652. [129] S. Sanati Z. Rezvani Chem. Eng. J. 362 2019 743 757 S. Sanati, Z. Rezvani, Chem. Eng. J. 362 (2019) 743–757. [130] Y. Zhao Z. Feng Z. Guo J. Mu H. Che J. Mu Ceram. Int. 48 2022 27369 27378 Y. Zhao, Z. Feng, Z. Guo, J. Mu, H. Che, J. Mu, Ceram. Int. 48 (2022) 27369–27378. [131] F. Zhao W. Huang H. Zhang D. Zhou Appl. Surf. Sci. 426 2017 1206 1212 F. Zhao, W. Huang, H. Zhang, D. Zhou, Appl. Surf. Sci. 426 (2017) 1206–1212. [132] J. Safaei N.A. Mohamed M.F. Mohamad Noh M.F. Soh M.A. Ludin J. Mater. Chem. A 6 2018 22346 22380 J. Safaei, N.A. Mohamed, M.F. Mohamad Noh, M.F. Soh, M.A. Ludin, J. Mater. Chem. A 6 (2018) 22346–22380. [133] X. Wang S. Wang D. Su S. Xu S. Cao Y. Xiao J. Alloys Compd. 902 2022 163784 X. Wang, S. Wang, D. Su, S. Xu, S. Cao, Y. Xiao, J. Alloys Compd. 902 (2022) 163784. [134] V. Ragupathi P. Panigrahi N. Ganapathi Subramaniam Mater. Lett. 246 2019 88 91 V. Ragupathi, P. Panigrahi, N. Ganapathi Subramaniam, Mater. Lett. 246 (2019) 88–91. [135] D. Jiang Q. Xu S. Meng C. Xia M. Chen J. Alloys Compd. 706 2017 41 47 D. Jiang, Q. Xu, S. Meng, C. Xia, M. Chen, J. Alloys Compd. 706 (2017) 41–47. [136] S. Vinoth K. Subramani W.J. Ong M. Sathish A. Pandikumar J. Colloid Interface Sci. 584 2021 204 215 S. Vinoth, K. Subramani, W.J. Ong, M. Sathish, A. Pandikumar, J. Colloid Interface Sci. 584 (2021) 204–215. [137] Y. Gao L. Zhao Chem. Eng. J. 430 2022 132745 Y. Gao, L. Zhao, Chem. Eng. J. 430 (2022) 132745. [138] G. Nabi K.N. Riaz M. Nazir W. Raza M.B. Tahir M. Tanveer Ceram. Int. 46 2020 27601 27607 G. Nabi, K.N. Riaz, M. Nazir, W. Raza, M.B. Tahir, M. Tanveer, Ceram. Int. 46 (2020) 27601–27607. [139] D. Majumdar J. Electroanal. Chem. 880 2021 114825 D. Majumdar, J. Electroanal. Chem. 880 (2021) 114825. [140] M. Ding Z. Wei X. Zhu D. Liu Int. J. Electrochem. Sci. 17 2022 22121 M. Ding, Z. Wei, X. Zhu, D. Liu, Int. J. Electrochem. Sci. 17 (2022) 22121. [141] S.R. Khaladkar O. Maurya G. Gund B. Sinha D. Dubal A. Kalekar J. Energy Chem. 87 2023 304 313 S.R. Khaladkar, O. Maurya, G. Gund, B. Sinha, D. Dubal, A. Kalekar, J. Energy Chem. 87 (2023) 304–313. [142] A. Meftahi M. Shabani-Nooshabadi A. Reisi-Vanani Electrochim. Acta 430 2022 141052 A. Meftahi, M. Shabani-Nooshabadi, A. Reisi-Vanani, Electrochim. Acta 430 (2022) 141052. [143] A. Meftahi A. Reisi-Vanani M. Shabani-Nooshabadi Fuel 331 2022 125683 A. Meftahi, A. Reisi-Vanani, M. Shabani-Nooshabadi, Fuel 331 (2022) 125683. [144] B. Shalini Reghunath, S. Rajasekaran, S. Devi K R, B. Saravanakumar, J.J. William, S. Kheawhom, J. Phys. Chem. Solids 171 (2022) 110985. [145] M.R. Pallavolu A.N. Banerjee S.W. Joo J.H. Jung J. Energy Storage 72 2023 108725 M.R. Pallavolu, A.N. Banerjee, S.W. Joo, J.H. Jung, J. Energy Storage 72 (2023) 108725. [146] M. Suganya S. Anand D. Mani M. Canh Vu S. Muniyappan J.K. Kumar Synth. Met. 295 2023 117341 M. Suganya, S. Anand, D. Mani, M. Canh Vu, S. Muniyappan, J.K. Kumar, Synth. Met. 295 (2023) 117341. [147] Y. Shi P. Chen J. Chen D. Chen H. Shu X. Luo Chem. Eng. J. 404 2021 126284 Y. Shi, P. Chen, J. Chen, D. Chen, H. Shu, X. Luo, Chem. Eng. J. 404 (2021) 126284. [148] B. Antil L. Kumar M.R. Das S. Deka J. Energy Storage 52 2022 104731 B. Antil, L. Kumar, M.R. Das, S. Deka, J. Energy Storage 52 (2022) 104731. [149] L. Bai Y.Y. Zhang L. Zhang Y.Y. Zhang H. Sun Nano Energy 53 2018 982 992 L. Bai, Y.Y. Zhang, L. Zhang, Y.Y. Zhang, H. Sun, Nano Energy 53 (2018) 982–992. [150] N.J. Panicker J.C. Dutta P.P. Sahu Chem. Eng. J. 463 2023 142376 N.J. Panicker, J.C. Dutta, P.P. Sahu, Chem. Eng. J. 463 (2023) 142376. [151] Y. Guan J. Wu L. Wang C.H. Shi K. Lv Y. Lv Energy Rep. 8 2022 1190 1199 Y. Guan, J. Wu, L. Wang, C.H. Shi, K. Lv, Y. Lv, Energy Reports 8 (2022) 1190–1199. [152] V.M. Rangaraj J.I. Yoo J.K. Song V. Mittal Sep. Purif. Technol. 317 2023 1 10 V.M. Rangaraj, J.I. Yoo, J.K. Song, V. Mittal, Sep. Purif. Technol. 317 (2023) 1–10. [153] S. Zhang K. Wang H. Chen H. Liu H. Yang H. Li Carbon n. y. 194 2022 10 22 S. Zhang, K. Wang, H. Chen, H. Liu, H. Yang, H. Li, Carbon N. Y. 194 (2022) 10–22. [154] X. Wang G. Li M. Li R. Liu Z. Li J. Energy Chem. 53 2020 234 240 X. Wang, G. Li, M. Li, R. Liu, Z. Li, J. Energy Chem. 53 (2020) 234–240. [155] S. Bashir K. Hasan M. Hina R. Ali Soomro R. Mujtaba J. Electroanal. Chem. 898 2021 115626 S. Bashir, K. Hasan, M. Hina, R. Ali Soomro, R. Mujtaba, J. Electroanal. Chem. 898 (2021) 115626. [156] M. Samtham D. Singh K. Hareesh R.S. Devan J. Energy Storage 51 2022 104418 M. Samtham, D. Singh, K. Hareesh, R.S. Devan, J. Energy Storage 51 (2022) 104418. [157] P.C. Himadri Reddy J. Amalraj S. Ranganatha S.S. Patil S. Chandrasekaran Synth. Met. 298 2023 117447 P.C. Himadri Reddy, J. Amalraj, S. Ranganatha, S.S. Patil, S. Chandrasekaran, Synth. Met. 298 (2023) 117447. [158] S. Kumar Y.P. Fu Sustain. Energy Fuels 5 2021 3987 4001 S. Kumar, Y.P. Fu, Sustain. Energy Fuels 5 (2021) 3987–4001. [159] G. Dong H. Fan K. Fu L. Ma S. Zhang W. Wang Compos. Part B Eng. 162 2019 369 377 G. Dong, H. Fan, K. Fu, L. Ma, S. Zhang, W. Wang, Compos. Part B Eng. 162 (2019) 369–377. [160] C.J. Verma A.S. Keshari P. Dubey R. Prakash Vacuum 177 2020 109363 C.J. Verma, A.S. Keshari, P. Dubey, R. Prakash, Vacuum 177 (2020) 109363. [161] K.K. Navaneethan Duraisamya S. Prabhu R. Ramesh Prog. Nat. Sci. Mater. Int. 30 2020 298 307 K.K. Navaneethan Duraisamya, Prabhu S, Ramesh R, Prog. Nat. Sci. Mater. Int. 30 (2020) 298–307. [162] E. Harputlu C. Gecgel J. Mater. Sci. Mater. Electron. 33 2022 25687 25703 E. Harputlu, C. Gecgel, J. Mater. Sci. Mater. Electron. 33 (2022) 25687–25703. [163] B. Chameh N. Khosroshahi M. Bakhtian M. Moradi V. Safarifard Ceram. Int. 48 2022 22295 22306 B. Chameh, N. Khosroshahi, M. Bakhtian, M. Moradi, V. Safarifard, Ceram. Int. 48 (2022) 22295–22306. [164] J. Zhang J. Ding C. Li B. Li Y. Li ACS Sustain. Chem. Eng. 5 2017 4982 4991 J. Zhang, J. Ding, C. Li, B. Li, Y. Li, ACS Sustain. Chem. Eng. 5 (2017) 4982–4991. [165] S. Sun X. Lin Guo Y. Chang X.Z. Yu Mater. Lett. 236 2019 558 561 S. Sun, Lin Guo, X. Chang, Y. Yu, X. Zhai, Mater. Lett. 236 (2019) 558–561. [166] J.R.X.R. Ganesan a Mater. Sci. Eng. B 90 2016 46 51 J.R.X. R. Ganesan a, Mater. Sci. Eng. B 90 (2016) 46–51. [167] N. Farooq P. Kallem M.I. Khan A.M. Qureshi A.U. Rehman J. Mater. Res. Technol. 26 2023 7127 7136 N. Farooq, P. Kallem, M.I. Khan, A.M. Qureshi, A.U. Rehman, J. Mater. Res. Technol. 26 (2023) 7127–7136. [168] S. Kumar P.H. Weng Y.P. Fu Mater. Today Chem. 28 2023 101385 S. Kumar, P.H. Weng, Y.P. Fu, Mater. Today Chem. 28 (2023) 101385. [169] R. Wenhua Zuo C. Li Y. Zhou A.J. Li J.L. Xia Adv. Sci. 4 2017 1600539 Wenhua Zuo, R. Li, C. Zhou, Y. Li, A. Jianlong Xia, J. Liu, Adv. Sci. 4 (2017) 1600539. [170] D.C.U. Sirimanne N. Kularatna N. Arawwawala Electron. 12 2023 2465 D.C.U. Sirimanne, N. Kularatna, N. Arawwawala, Electron. 12 (2023) 2465. [171] Q. Shen P. Jiang H. He Y. Cai D. Lei M. Zhang Energy Environ. Mater. 4 2021 638 645 Q. Shen, P. Jiang, H. He, Y. Cai, D. Lei, M. Zhang, Energy Environ. Mater. 4 (2021) 638–645. [172] X. Yuan S. Qiu X. Zhao ACS Appl. Mater. Interfaces 13 2021 34238 34247 X. Yuan, S. Qiu, X. Zhao, ACS Appl. Mater. Interfaces 13 (2021) 34238–34247. [173] R. Lin F. Gao X. Zhang C. Xu H. Song X. Ma Carbon 200 2022 84 93 R. Lin, F. Gao, X. Zhang, C. Xu, H. Song, X. Ma, Carbon 200 (2022) 84–93. [174] L. Zhong X. Qiu S. Yang S. Sun L. Chen W. Zhang Energy Storage Mater. 61 2023 102887 L. Zhong, X. Qiu, S. Yang, S. Sun, L. Chen, W. Zhang, Energy Storage Mater. 61 (2023) 102887. [175] M.K. Paliwal S.K. Meher Electrochim. Acta 358 2020 136871 M.K. Paliwal, S.K. Meher, Electrochim. Acta 358 (2020) 136871. [176] S.S. Pradeepa K. Sutharthani R. Suba Devi W.R. Liu M. Sivakumar J. Taiwan Inst. Chem. Eng. 154 2024 105084 S.S. Pradeepa, K. Sutharthani, R. Suba Devi, W.R. Liu, M. Sivakumar, J. Taiwan Inst. Chem. Eng. 154 (2024) 105084. [177] Y.K. Sonia S. Srivastav S.K. Meher ACS Langmuir 39 2023 9111 9129 Y.K. Sonia, S. Srivastav, S.K. Meher, ACS Langmuir 39 (2023) 9111–9129. [178] Y. Wang X. Wu Y. Han T. Li J. Energy Storage 42 2021 103053 Y. Wang, X. Wu, Y. Han, T. Li, J. Energy Storage 42 (2021) 103053. [179] C. Lu Y. Yang X. Chen Nano Lett. 19 2019 4103 4111 C. Lu, Y. Yang, X. Chen, Nano Lett. 19 (2019) 4103–4111. [180] M.S. Asl R. Hadi L. Salehghadimi A.G. Tabrizi S. Farhoudian M. Pahlevani J. Energy Storage 50 2022 104223 M.S. Asl, R. Hadi, L. Salehghadimi, A.G. Tabrizi, S. Farhoudian, M. Pahlevani, J. Energy Storage 50 (2022) 104223. [181] H. Zhu Y. An M. Shi Z. Li N. Chen P. Xiao Mater. Lett. 296 2021 1 5 H. Zhu, Y. An, M. Shi, Z. Li, N. Chen, P. Xiao, Mater. Lett. 296 (2021) 1–5. [182] Z. Tang X. Zhang L. Duan A. Wu W. Lü Nanoscale Res. Lett. 14 2019 98 Z. Tang, X. Zhang, L. Duan, A. Wu, W. Lü, Nanoscale Res. Lett. 14 (2019) 98. [183] M. Ding Y. Qu X. Zhang L. Duan X. Li W. Lü New J. Chem. 45 2021 923 929 M. Ding, Y. Qu, X. Zhang, L. Duan, X. Li, W. Lü, New J. Chem. 45 (2021) 923–929. [184] S. Zhang Y. Huang J. Wang X. Han C. Chen X. Sun Appl. Surf. Sci. 599 2022 154015 S. Zhang, Y. Huang, J. Wang, X. Han, C. Chen, X. Sun, Appl. Surf. Sci. 599 (2022) 154015. [185] C.H. Ng H.N. Lim S. Hayase I. Harrison A. Pandikumar N.M. Huang J. Power Sources 296 2015 169 185 C.H. Ng, H.N. Lim, S. Hayase, I. Harrison, A. Pandikumar, N.M. Huang, J. Power Sources 296 (2015) 169–185. [186] Y. Sun X. Yan Sol. RRL 1 2017 1700002 Y. Sun, X. Yan, Sol. RRL 1 (2017) 1700002. [187] W.J. Ong L.L. Tan Y.H. Ng S.T. Yong S.P. Chai Chem. Rev. 116 2016 7159 7329 W.J. Ong, L.L. Tan, Y.H. Ng, S.T. Yong, S.P. Chai, Chem. Rev. 116 (2016) 7159–7329. [188] B.D. Boruah A. Mathieson B. Wen C. Jo F. Deschler M. De Volder Nano Lett. 20 2020 5967 5974 B.D. Boruah, A. Mathieson, B. Wen, C. Jo, F. Deschler, M. De Volder, Nano Lett. 20 (2020) 5967–5974. [189] C.T. Altaf T.O. Colak E. Erdem U. Unal F.B. Misirlioglu M. Sankir Electrochim. Acta 456 2023 142415 C.T. Altaf, T.O. Colak, E. Erdem, U. Unal, F.B. Misirlioglu, M. Sankir, Electrochim. Acta 456 (2023) 142415. [190] B. Palanivela V.J. Saranya devi Mudisoodum perumal Thandavarayan Maiyalagan C. Ayyappan M. Alagiri Appl. Surf. Sci. 498 2019 143807 B. Palanivela, V.J. Saranya devi Mudisoodum perumal, Thandavarayan Maiyalagan, C. Ayyappan, M. Alagiri, Appl. Surf. Sci. 498 (2019) 143807. [191] V.S. Manikandan K. George M. Shimna A. Thirumurugan S. Harish M. Navaneethan J. Mater. Sci. Mater. Electron. 35 2024 1 12 V.S. Manikandan, K. George, M. Shimna, A. Thirumurugan, S. Harish, M. Navaneethan, J. Mater. Sci. Mater. Electron. 35 (2024) 1–12. [192] P. Varatharajan I.B. Shameem Banu M.H. Mamat N. Vasimalai Dalt. Trans. 52 2023 13704 13715 P. Varatharajan, I.B. Shameem Banu, M.H. Mamat, N. Vasimalai, Dalt. Trans. 52 (2023) 13704–13715. [193] T. Zahra, A. Gassoumi, S. Gouadria, M. Abdullah, F.F. Alharbi, Tahir, Diam. Relat. Mater. 144 (2024) 110927. [194] H. Pecenek F.K. Dokan M.S. Onses E. Yılmaz E. Sahmetlioglu J. Energy Storage 64 2023 107075 H. Pecenek, F.K. Dokan, M.S. Onses, E. Yılmaz, E. Sahmetlioglu, J. Energy Storage 64 (2023) 107075. [195] B. Rani A.K. Nayak N.K. Sahu Diam. Relat. Mater. 120 2021 108671 B. Rani, A.K. Nayak, N.K. Sahu, Diam. Relat. Mater. 120 (2021) 108671. [196] L. Chen J. Wan X. Feng H. Shi P. Liu J. Alloys Compd. 918 2022 165769 L. Chen, J. Wan, X. Feng, H. Shi, P. Liu, J. Alloys Compd. 918 (2022) 165769. [197] L. Hou W. Yang X. Xu B. Deng J. Tian Y. Li Electrochim. Acta 340 2020 135996 L. Hou, W. Yang, X. Xu, B. Deng, J. Tian, Y. Li, Electrochim. Acta 340 (2020) 135996. [198] A.W. Alrowaily B.M. Alotaibi M. Ali H.A. Alyousef M.F. Alotiby S. Aman J. Mater. Sci. Mater. Electron. 35 2024 1 13 A.W. Alrowaily, B.M. Alotaibi, M. Ali, H.A. Alyousef, M.F. Alotiby, S. Aman, J. Mater. Sci. Mater. Electron. 35 (2024) 1–13. [199] A. Irshad H.H. Somaily S. Zulfiqar M.I.D. Muhammad Farooq Warsi M. Shahid J. Alloys Compd. 934 2023 167705 A. Irshad, H.H. Somaily, S. Zulfiqar, M.I.D. Muhammad Farooq Warsi, M. Shahid, J. Alloys Compd. 934 (2023) 167705. [200] R. Mangiri C. Lee K. Kim J. Lee E. Chung Energy Fuels 37 2023 7479 7489 R. Mangiri, C. Lee, K. Kim, J. Lee, E. Chung, Energy and Fuels 37 (2023) 7479–7489. [201] M. Rabia D. Essam F.H. Alkallas M. Shaban S. Elaissi Amira Micromachines 13 2022 2234 M. Rabia, D. Essam, F.H. Alkallas, M. Shaban, S. Elaissi, Amira, Micromachines 13 (2022) 2234. [202] S. Yesmin M. Devi R. Dasgupta S.S. Dhar Chem. Eng. J. 446 2022 136540 S. Yesmin, M. Devi, R. Dasgupta, S.S. Dhar, Chem. Eng. J. 446 (2022) 136540. [203] S. Polat D. Faris Ceram. Int. 48 2022 24609 24618 S. Polat, D. Faris, Ceram. Int. 48 (2022) 24609–24618. [204] R. Ranjithkumar P. Lakshmanan N. Palanisami P. Devendran N. Nallamuthu M.K. Kumar Electron. Mater. Lett. 19 2023 172 183 R. Ranjithkumar, P. Lakshmanan, N. Palanisami, P. Devendran, N. Nallamuthu, M.K. Kumar, Electron. Mater. Lett. 19 (2023) 172–183. [205] A. Ben Gouider Trabelsi A.M. Elsayed F.H. Alkallas M. Al-Noaimi M. Rabia Coatings 12 2022 4 11 A. Ben Gouider Trabelsi, A. M. Elsayed, F. H. Alkallas, M. Al-Noaimi, M. Rabia, Coatings 12 (2022) 4–11. [206] G. Le Z. Chen S. Jiangfeng L. Jiachen J. Mater. Sci. Mater. Electron. 34 2023 1 11 G. Le, Z. Chen, S. Jiangfeng, L. Jiachen, J. Mater. Sci. Mater. Electron. 34 (2023) 1–11. [207] M. Shi P. Xiao J. Lang C. Yan X. Yan Adv. Sci. 7 2020 1901975 M. Shi, P. Xiao, J. Lang, C. Yan, X. Yan, Adv. Sci. 7 (2020) 1901975. [208] W. Liu X. Li J. Sun S. Zuo C. Yao X. Li J. Mater. Sci. Mater. Electron. 34 2023 1 15 W. Liu, X. Li, J. Sun, S. Zuo, C. Yao, X. Li, J. Mater. Sci. Mater. Electron. 34 (2023) 1–15. [209] M. Pourshahmir S. Ghasemi S.R. Hosseini Int. J. Hydrogen Energy 48 2023 8127 8143 M. Pourshahmir, S. Ghasemi, S.R. Hosseini, Int. J. Hydrogen Energy 48 (2023) 8127–8143. [210] R. Liang Y. Du J. Wu X. Li J. Chen J. Solid State Chem. 307 2022 122845 R. Liang, Y. Du, J. Wu, X. Li, J. Chen, J. Solid State Chem. 307 (2022) 122845. [211] A.B.G. Trabelsi D. Essam F.H. Alkallas A.M. Ahmed M. Rabia Micromachines 13 2022 1 9 A.B.G. Trabelsi, D. Essam, F. H. Alkallas, A. M. Ahmed, M. Rabia, Micromachines 13 (2022) 1–9. [212] A.M. Elsayed M.A. Alnuwaiser M. Rabia J. Inorg. Organomet. Polym. Mater. 33 2023 3118 3127 A.M. Elsayed, M.A. Alnuwaiser, M. Rabia, J. Inorg. Organomet. Polym. Mater. 33 (2023) 3118–3127. [213] M. Vadivel M.S. Pandian P. Ramasamy Q. Jing B. Liu J. Alloys Compd. 971 2024 172670 M. Vadivel, M.S. Pandian, P. Ramasamy, Q. Jing, B. Liu, J. Alloys Compd. 971 (2024) 172670. [214] J. Ma X.Y. Tao S.X. Zhou X.Z. Song X.Y.W. Lin-Guo J. Electroanal. Chem. 835 2019 346 353 J. Ma, X.Y. Tao, S.X. Zhou, X.Z. Song, Lin-Guo, X.Y. Wei, J. Electroanal. Chem. 835 (2019) 346–353. [215] H. Xie Z. Guo M. Wang S. Ma Z. Kong Z. He New J. Chem. 47 2023 8670 8678 H. Xie, Z. Guo, M. Wang, S. Ma, Z. Kong, Z. He, New J. Chem. 47 (2023) 8670–8678. [216] M.A. Raza M.I. Yousaf S. Akram A. Siddique M. Ashraf D.J. Fu Synth. Met. 301 2024 117534 M.A. Raza, M.I. Yousaf, S. Akram, A. Siddique, M. Ashraf, D.J. Fu, Synth. Met. 301 (2024) 117534. [217] J.R. Xavier S.P. Vinodhini J. Mater. Sci. 58 2023 18147 18168 J.R. Xavier, S.P. Vinodhini, J. Mater. Sci. 58 (2023) 18147–18168. [218] J.R. Xavier S.P. Vinodhini J. Mater. Eng. Perform. 2024 10.1007/s11665-024-09391-w J.R. Xavier, S.P. Vinodhini, J. Mater. Eng. Perform. (2024). Doi: 10.1007/s11665-024-09391-w [219] K. Selvaraj B. Yu M.E. Spontón P. Kumar U.S. Veerasamy D. Kannaiyan Soft Matter 20 2024 7957 7969 K. Selvaraj, B. Yu, M.E. Spontón, P. Kumar, U.S. Veerasamy, D. Kannaiyan, Soft Matter 20 (2024) 7957–7969. [220] A. Neha R.R. Andola R.K. Pandey P. Pandey G.R.T. Rambabu J. Electron. Mater. 53 2024 5286 5297 Neha, A. Andola, R.R. Pandey, R.K. Pandey, P. Rambabu, G.R. Turpu, J. Electron. Mater. 53 (2024) 5286–5297. Priyanka Chaluvachar is a researcher and doctoral student at the Department of Aeronautical and Automobile Engineering, Manipal Institute of Technology (MIT), part of the Manipal Academy of Higher Education (MAHE), Manipal, India. Her research focuses on advanced nanomaterials and the computational analysis of molecular dynamics for energy storage applications. She has contributed to the field through publications in academic journals. She has also presented at international conferences showcasing her innovative work on energy storage materials. Y.N. Sudhakar is an Assistant Professor (Senior Scale) at the Department of Chemistry, Manipal Institute of Technology, Manipal Academy of Higher Education (Deemed to be University), Manipal. He completed a doctoral degree at the Manipal Institute of Technology and a postgraduate degree at Mangalore University, Konaje. He currently supervises five research scholars and has supervised more than 45 postgraduate students. More than 70 original and review articles were published, with 50 plus presentations at International and National Conferences and two books and four book chapters in reputed publishers. His current research interest is in Electrochemical energy storage and sensors. G.T. Mahesha is a professor in the Department of Aeronautical and Automobile Engineering at Manipal Institute of Technology, Manipal, India. He has more than 25 years of teaching experience and more than 5 years of research experience. His areas of research interest are green materials, bio-based and eco-friendly materials, alternative fuels, and electric and hybrid vehicles. He has published more than 25 articles in international journals of repute and presented about 20 technical papers at international conferences. Vishnu G Nair received the B.Tech. Degree from Kerala University, India, in 2010, the M.Tech. He earned his Degree from the Manipal Institute of Technology, Manipal, India, in 2012 and his Ph.D. from the National Institute of Technology Karnataka, India, in 2019. He is currently with the Department of Aeronautical Engineering, Manipal Institute of Technology, Manipal Academy of Higher Education. His research interests include control, motion planning, and multi-robotic systems. Nakul Desai is a researcher and a doctoral student at the Department of Chemistry, Manipal Institute of Technology (MIT), Manipal Academy of Higher Education (MAHE), Manipal, India. He holds a master’s in Analytical Chemistry from Christ (Deemed to be University), Bengaluru, India. His area of research focuses on exploring novel electrode materials to improve the sensitivity, selectivity, and stability of sensors and energy storage devices. He has published research articles on sensors and energy storage materials in academic journals and presented his work at international conferences. Dayananda K. Pai is the Head of the Department of Aeronautical & Automobile Engineering at Manipal Institute of Technology (MIT), Manipal Academy of Higher Education (MAHE), Manipal, India, and the Chief Coordinator for NBA, AICTE, IET, and NAAC activities. Holding a B.E. in Mechanical Engineering, an M.Tech. in Production Management, and a Ph.D. in Mechanical Engineering, his areas of interest include composites, manufacturing, design, and optimization. With 30 years of teaching experience and 20 years of research contributions, he has participated in numerous international conferences and served as a peer reviewer for review articles.",
      "scopus-id": "85213558839",
      "coredata": {
        "eid": "1-s2.0-S2095495624008532",
        "dc:description": "Graphitic carbon nitride (g-C3N4), known for its green and abundant nature and composed of carbon and nitrogen in a two-dimensional structure, has emerged as a significant area of interest across various disciplines, particularly in energy conversion and storage. Its recent demonstrations of high potential in supercapacitor applications mark it as a promising alternative to graphene within the realm of materials science. Numerous favorable features, such as chemical and thermal stability, abundant nitrogen content, eco-friendly attributes, and gentle conditions for synthesis, are shown. This review summarizes recent advancements in the use of g-C3N4 and its composites as electrodes for supercapacitors, highlighting the advantages and issues associated with g-C3N4 in these applications. This emphasizes situations where the composition of g-C3N4 with other materials, such as metal oxides, metal chalcogenides, carbon materials, and conducting polymers, overcomes its limitations, leading to composite materials with improved functionalities. This review discusses the challenges that still need to be addressed and the possible future roles of g-C3N4 in the research of advanced supercapacitor technology, such as battery-hybrid supercapacitors, flexible supercapacitors, and photo-supercapacitors.",
        "openArchiveArticle": "false",
        "prism:coverDate": "2025-04-30",
        "openaccessUserLicense": "http://creativecommons.org/licenses/by/4.0/",
        "prism:aggregationType": "Journal",
        "prism:url": "https://api.elsevier.com/content/article/pii/S2095495624008532",
        "dc:creator": [
          {
            "@_fa": "true",
            "$": "Chaluvachar, Priyanka"
          },
          {
            "@_fa": "true",
            "$": "Sudhakar, Y.N."
          },
          {
            "@_fa": "true",
            "$": "Mahesha, G.T."
          },
          {
            "@_fa": "true",
            "$": "Nair, Vishnu G."
          },
          {
            "@_fa": "true",
            "$": "Desai, Nakul"
          },
          {
            "@_fa": "true",
            "$": "Pai, Dayananda K."
          }
        ],
        "link": [
          {
            "@_fa": "true",
            "@rel": "self",
            "@href": "https://api.elsevier.com/content/article/pii/S2095495624008532"
          },
          {
            "@_fa": "true",
            "@rel": "scidir",
            "@href": "https://www.sciencedirect.com/science/article/pii/S2095495624008532"
          }
        ],
        "dc:format": "application/json",
        "openaccessType": "Full",
        "pii": "S2095-4956(24)00853-2",
        "prism:volume": "103",
        "prism:publisher": "Science Press and Dalian Institute of Chemical Physics, Chinese Academy of Sciences. Published by Elsevier B.V. and Science Press.",
        "dc:title": "Emerging role of graphitic carbon nitride in advanced supercapacitors: A comprehensive review",
        "prism:copyright": "© 2024 Science Press and Dalian Institute of Chemical Physics, Chinese Academy of Sciences. Published by Elsevier B.V. and Science Press.",
        "openaccess": "1",
        "prism:issn": "20954956",
        "dcterms:subject": [
          {
            "@_fa": "true",
            "$": "Graphitic carbon nitride"
          },
          {
            "@_fa": "true",
            "$": "Metal oxides"
          },
          {
            "@_fa": "true",
            "$": "Graphene"
          },
          {
            "@_fa": "true",
            "$": "Conducting polymers"
          },
          {
            "@_fa": "true",
            "$": "Battery-type hybrid supercapacitors"
          },
          {
            "@_fa": "true",
            "$": "Flexible supercapacitors"
          },
          {
            "@_fa": "true",
            "$": "Photo-supercapacitors"
          }
        ],
        "openaccessArticle": "true",
        "prism:publicationName": "Journal of Energy Chemistry",
        "openaccessSponsorType": "ElsevierWaived",
        "prism:pageRange": "498-524",
        "prism:endingPage": "524",
        "pubType": "rev",
        "prism:coverDisplayDate": "April 2025",
        "prism:doi": "10.1016/j.jechem.2024.11.075",
        "prism:startingPage": "498",
        "dc:identifier": "doi:10.1016/j.jechem.2024.11.075",
        "openaccessSponsorName": "Manipal Academy of Higher Education 2023"
      },
      "objects": {
        "object": [
          {
            "@category": "standard",
            "@height": "145",
            "@width": "111",
            "@_fa": "true",
            "$": "https://api.elsevier.com/content/object/eid/1-s2.0-S2095495624008532-fx1.jpg?httpAccept=%2A%2F%2A",
            "@multimediatype": "JPEG image file",
            "@type": "IMAGE-DOWNSAMPLED",
            "@size": "6810",
            "@ref": "fx1",
            "@mimetype": "image/jpeg"
          },
          {
            "@category": "standard",
            "@height": "127",
            "@width": "111",
            "@_fa": "true",
            "$": "https://api.elsevier.com/content/object/eid/1-s2.0-S2095495624008532-fx2.jpg?httpAccept=%2A%2F%2A",
            "@multimediatype": "JPEG image file",
            "@type": "IMAGE-DOWNSAMPLED",
            "@size": "5661",
            "@ref": "fx2",
            "@mimetype": "image/jpeg"
          },
          {
            "@category": "standard",
            "@height": "133",
            "@width": "111",
            "@_fa": "true",
            "$": "https://api.elsevier.com/content/object/eid/1-s2.0-S2095495624008532-fx3.jpg?httpAccept=%2A%2F%2A",
            "@multimediatype": "JPEG image file",
            "@type": "IMAGE-DOWNSAMPLED",
            "@size": "5945",
            "@ref": "fx3",
            "@mimetype": "image/jpeg"
          },
          {
            "@category": "standard",
            "@height": "139",
            "@width": "111",
            "@_fa": "true",
            "$": "https://api.elsevier.com/content/object/eid/1-s2.0-S2095495624008532-fx4.jpg?httpAccept=%2A%2F%2A",
            "@multimediatype": "JPEG image file",
            "@type": "IMAGE-DOWNSAMPLED",
            "@size": "6260",
            "@ref": "fx4",
            "@mimetype": "image/jpeg"
          },
          {
            "@category": "standard",
            "@height": "146",
            "@width": "111",
            "@_fa": "true",
            "$": "https://api.elsevier.com/content/object/eid/1-s2.0-S2095495624008532-fx5.jpg?httpAccept=%2A%2F%2A",
            "@multimediatype": "JPEG image file",
            "@type": "IMAGE-DOWNSAMPLED",
            "@size": "5509",
            "@ref": "fx5",
            "@mimetype": "image/jpeg"
          },
          {
            "@category": "standard",
            "@height": "140",
            "@width": "111",
            "@_fa": "true",
            "$": "https://api.elsevier.com/content/object/eid/1-s2.0-S2095495624008532-fx6.jpg?httpAccept=%2A%2F%2A",
            "@multimediatype": "JPEG image file",
            "@type": "IMAGE-DOWNSAMPLED",
            "@size": "5514",
            "@ref": "fx6",
            "@mimetype": "image/jpeg"
          },
          {
            "@category": "standard",
            "@height": "244",
            "@width": "244",
            "@_fa": "true",
            "$": "https://api.elsevier.com/content/object/eid/1-s2.0-S2095495624008532-ga1.jpg?httpAccept=%2A%2F%2A",
            "@multimediatype": "JPEG image file",
            "@type": "IMAGE-DOWNSAMPLED",
            "@size": "32641",
            "@ref": "ga1",
            "@mimetype": "image/jpeg"
          },
          {
            "@category": "standard",
            "@height": "591",
            "@width": "709",
            "@_fa": "true",
            "$": "https://api.elsevier.com/content/object/eid/1-s2.0-S2095495624008532-gr1.jpg?httpAccept=%2A%2F%2A",
            "@multimediatype": "JPEG image file",
            "@type": "IMAGE-DOWNSAMPLED",
            "@size": "144960",
            "@ref": "gr1",
            "@mimetype": "image/jpeg"
          },
          {
            "@category": "standard",
            "@height": "835",
            "@width": "696",
            "@_fa": "true",
            "$": "https://api.elsevier.com/content/object/eid/1-s2.0-S2095495624008532-gr10.jpg?httpAccept=%2A%2F%2A",
            "@multimediatype": "JPEG image file",
            "@type": "IMAGE-DOWNSAMPLED",
            "@size": "198902",
            "@ref": "gr10",
            "@mimetype": "image/jpeg"
          },
          {
            "@category": "standard",
            "@height": "630",
            "@width": "709",
            "@_fa": "true",
            "$": "https://api.elsevier.com/content/object/eid/1-s2.0-S2095495624008532-gr11.jpg?httpAccept=%2A%2F%2A",
            "@multimediatype": "JPEG image file",
            "@type": "IMAGE-DOWNSAMPLED",
            "@size": "130679",
            "@ref": "gr11",
            "@mimetype": "image/jpeg"
          },
          {
            "@category": "standard",
            "@height": "979",
            "@width": "713",
            "@_fa": "true",
            "$": "https://api.elsevier.com/content/object/eid/1-s2.0-S2095495624008532-gr12.jpg?httpAccept=%2A%2F%2A",
            "@multimediatype": "JPEG image file",
            "@type": "IMAGE-DOWNSAMPLED",
            "@size": "135402",
            "@ref": "gr12",
            "@mimetype": "image/jpeg"
          },
          {
            "@category": "standard",
            "@height": "862",
            "@width": "712",
            "@_fa": "true",
            "$": "https://api.elsevier.com/content/object/eid/1-s2.0-S2095495624008532-gr13.jpg?httpAccept=%2A%2F%2A",
            "@multimediatype": "JPEG image file",
            "@type": "IMAGE-DOWNSAMPLED",
            "@size": "180032",
            "@ref": "gr13",
            "@mimetype": "image/jpeg"
          },
          {
            "@category": "standard",
            "@height": "616",
            "@width": "749",
            "@_fa": "true",
            "$": "https://api.elsevier.com/content/object/eid/1-s2.0-S2095495624008532-gr14.jpg?httpAccept=%2A%2F%2A",
            "@multimediatype": "JPEG image file",
            "@type": "IMAGE-DOWNSAMPLED",
            "@size": "121918",
            "@ref": "gr14",
            "@mimetype": "image/jpeg"
          },
          {
            "@category": "standard",
            "@height": "798",
            "@width": "647",
            "@_fa": "true",
            "$": "https://api.elsevier.com/content/object/eid/1-s2.0-S2095495624008532-gr15.jpg?httpAccept=%2A%2F%2A",
            "@multimediatype": "JPEG image file",
            "@type": "IMAGE-DOWNSAMPLED",
            "@size": "127009",
            "@ref": "gr15",
            "@mimetype": "image/jpeg"
          },
          {
            "@category": "standard",
            "@height": "710",
            "@width": "670",
            "@_fa": "true",
            "$": "https://api.elsevier.com/content/object/eid/1-s2.0-S2095495624008532-gr16.jpg?httpAccept=%2A%2F%2A",
            "@multimediatype": "JPEG image file",
            "@type": "IMAGE-DOWNSAMPLED",
            "@size": "175390",
            "@ref": "gr16",
            "@mimetype": "image/jpeg"
          },
          {
            "@category": "standard",
            "@height": "708",
            "@width": "708",
            "@_fa": "true",
            "$": "https://api.elsevier.com/content/object/eid/1-s2.0-S2095495624008532-gr2.jpg?httpAccept=%2A%2F%2A",
            "@multimediatype": "JPEG image file",
            "@type": "IMAGE-DOWNSAMPLED",
            "@size": "163218",
            "@ref": "gr2",
            "@mimetype": "image/jpeg"
          },
          {
            "@category": "standard",
            "@height": "489",
            "@width": "628",
            "@_fa": "true",
            "$": "https://api.elsevier.com/content/object/eid/1-s2.0-S2095495624008532-gr3.jpg?httpAccept=%2A%2F%2A",
            "@multimediatype": "JPEG image file",
            "@type": "IMAGE-DOWNSAMPLED",
            "@size": "86606",
            "@ref": "gr3",
            "@mimetype": "image/jpeg"
          },
          {
            "@category": "standard",
            "@height": "206",
            "@width": "637",
            "@_fa": "true",
            "$": "https://api.elsevier.com/content/object/eid/1-s2.0-S2095495624008532-gr4.jpg?httpAccept=%2A%2F%2A",
            "@multimediatype": "JPEG image file",
            "@type": "IMAGE-DOWNSAMPLED",
            "@size": "32068",
            "@ref": "gr4",
            "@mimetype": "image/jpeg"
          },
          {
            "@category": "standard",
            "@height": "832",
            "@width": "669",
            "@_fa": "true",
            "$": "https://api.elsevier.com/content/object/eid/1-s2.0-S2095495624008532-gr5.jpg?httpAccept=%2A%2F%2A",
            "@multimediatype": "JPEG image file",
            "@type": "IMAGE-DOWNSAMPLED",
            "@size": "129161",
            "@ref": "gr5",
            "@mimetype": "image/jpeg"
          },
          {
            "@category": "standard",
            "@height": "761",
            "@width": "689",
            "@_fa": "true",
            "$": "https://api.elsevier.com/content/object/eid/1-s2.0-S2095495624008532-gr6.jpg?httpAccept=%2A%2F%2A",
            "@multimediatype": "JPEG image file",
            "@type": "IMAGE-DOWNSAMPLED",
            "@size": "162852",
            "@ref": "gr6",
            "@mimetype": "image/jpeg"
          },
          {
            "@category": "standard",
            "@height": "546",
            "@width": "672",
            "@_fa": "true",
            "$": "https://api.elsevier.com/content/object/eid/1-s2.0-S2095495624008532-gr7.jpg?httpAccept=%2A%2F%2A",
            "@multimediatype": "JPEG image file",
            "@type": "IMAGE-DOWNSAMPLED",
            "@size": "140567",
            "@ref": "gr7",
            "@mimetype": "image/jpeg"
          },
          {
            "@category": "standard",
            "@height": "831",
            "@width": "714",
            "@_fa": "true",
            "$": "https://api.elsevier.com/content/object/eid/1-s2.0-S2095495624008532-gr8.jpg?httpAccept=%2A%2F%2A",
            "@multimediatype": "JPEG image file",
            "@type": "IMAGE-DOWNSAMPLED",
            "@size": "161286",
            "@ref": "gr8",
            "@mimetype": "image/jpeg"
          },
          {
            "@category": "standard",
            "@height": "622",
            "@width": "628",
            "@_fa": "true",
            "$": "https://api.elsevier.com/content/object/eid/1-s2.0-S2095495624008532-gr9.jpg?httpAccept=%2A%2F%2A",
            "@multimediatype": "JPEG image file",
            "@type": "IMAGE-DOWNSAMPLED",
            "@size": "145208",
            "@ref": "gr9",
            "@mimetype": "image/jpeg"
          },
          {
            "@category": "thumbnail",
            "@height": "164",
            "@width": "126",
            "@_fa": "true",
            "$": "https://api.elsevier.com/content/object/eid/1-s2.0-S2095495624008532-fx1.sml?httpAccept=%2A%2F%2A",
            "@multimediatype": "GIF image file",
            "@type": "IMAGE-THUMBNAIL",
            "@size": "18302",
            "@ref": "fx1",
            "@mimetype": "image/gif"
          },
          {
            "@category": "thumbnail",
            "@height": "164",
            "@width": "143",
            "@_fa": "true",
            "$": "https://api.elsevier.com/content/object/eid/1-s2.0-S2095495624008532-fx2.sml?httpAccept=%2A%2F%2A",
            "@multimediatype": "GIF image file",
            "@type": "IMAGE-THUMBNAIL",
            "@size": "18075",
            "@ref": "fx2",
            "@mimetype": "image/gif"
          },
          {
            "@category": "thumbnail",
            "@height": "163",
            "@width": "136",
            "@_fa": "true",
            "$": "https://api.elsevier.com/content/object/eid/1-s2.0-S2095495624008532-fx3.sml?httpAccept=%2A%2F%2A",
            "@multimediatype": "GIF image file",
            "@type": "IMAGE-THUMBNAIL",
            "@size": "16141",
            "@ref": "fx3",
            "@mimetype": "image/gif"
          },
          {
            "@category": "thumbnail",
            "@height": "163",
            "@width": "130",
            "@_fa": "true",
            "$": "https://api.elsevier.com/content/object/eid/1-s2.0-S2095495624008532-fx4.sml?httpAccept=%2A%2F%2A",
            "@multimediatype": "GIF image file",
            "@type": "IMAGE-THUMBNAIL",
            "@size": "17657",
            "@ref": "fx4",
            "@mimetype": "image/gif"
          },
          {
            "@category": "thumbnail",
            "@height": "164",
            "@width": "125",
            "@_fa": "true",
            "$": "https://api.elsevier.com/content/object/eid/1-s2.0-S2095495624008532-fx5.sml?httpAccept=%2A%2F%2A",
            "@multimediatype": "GIF image file",
            "@type": "IMAGE-THUMBNAIL",
            "@size": "15716",
            "@ref": "fx5",
            "@mimetype": "image/gif"
          },
          {
            "@category": "thumbnail",
            "@height": "164",
            "@width": "130",
            "@_fa": "true",
            "$": "https://api.elsevier.com/content/object/eid/1-s2.0-S2095495624008532-fx6.sml?httpAccept=%2A%2F%2A",
            "@multimediatype": "GIF image file",
            "@type": "IMAGE-THUMBNAIL",
            "@size": "13066",
            "@ref": "fx6",
            "@mimetype": "image/gif"
          },
          {
            "@category": "thumbnail",
            "@height": "163",
            "@width": "163",
            "@_fa": "true",
            "$": "https://api.elsevier.com/content/object/eid/1-s2.0-S2095495624008532-ga1.sml?httpAccept=%2A%2F%2A",
            "@multimediatype": "GIF image file",
            "@type": "IMAGE-THUMBNAIL",
            "@size": "16775",
            "@ref": "ga1",
            "@mimetype": "image/gif"
          },
          {
            "@category": "thumbnail",
            "@height": "164",
            "@width": "197",
            "@_fa": "true",
            "$": "https://api.elsevier.com/content/object/eid/1-s2.0-S2095495624008532-gr1.sml?httpAccept=%2A%2F%2A",
            "@multimediatype": "GIF image file",
            "@type": "IMAGE-THUMBNAIL",
            "@size": "17187",
            "@ref": "gr1",
            "@mimetype": "image/gif"
          },
          {
            "@category": "thumbnail",
            "@height": "163",
            "@width": "136",
            "@_fa": "true",
            "$": "https://api.elsevier.com/content/object/eid/1-s2.0-S2095495624008532-gr10.sml?httpAccept=%2A%2F%2A",
            "@multimediatype": "GIF image file",
            "@type": "IMAGE-THUMBNAIL",
            "@size": "13398",
            "@ref": "gr10",
            "@mimetype": "image/gif"
          },
          {
            "@category": "thumbnail",
            "@height": "163",
            "@width": "184",
            "@_fa": "true",
            "$": "https://api.elsevier.com/content/object/eid/1-s2.0-S2095495624008532-gr11.sml?httpAccept=%2A%2F%2A",
            "@multimediatype": "GIF image file",
            "@type": "IMAGE-THUMBNAIL",
            "@size": "15073",
            "@ref": "gr11",
            "@mimetype": "image/gif"
          },
          {
            "@category": "thumbnail",
            "@height": "163",
            "@width": "119",
            "@_fa": "true",
            "$": "https://api.elsevier.com/content/object/eid/1-s2.0-S2095495624008532-gr12.sml?httpAccept=%2A%2F%2A",
            "@multimediatype": "GIF image file",
            "@type": "IMAGE-THUMBNAIL",
            "@size": "8245",
            "@ref": "gr12",
            "@mimetype": "image/gif"
          },
          {
            "@category": "thumbnail",
            "@height": "163",
            "@width": "135",
            "@_fa": "true",
            "$": "https://api.elsevier.com/content/object/eid/1-s2.0-S2095495624008532-gr13.sml?httpAccept=%2A%2F%2A",
            "@multimediatype": "GIF image file",
            "@type": "IMAGE-THUMBNAIL",
            "@size": "11583",
            "@ref": "gr13",
            "@mimetype": "image/gif"
          },
          {
            "@category": "thumbnail",
            "@height": "164",
            "@width": "199",
            "@_fa": "true",
            "$": "https://api.elsevier.com/content/object/eid/1-s2.0-S2095495624008532-gr14.sml?httpAccept=%2A%2F%2A",
            "@multimediatype": "GIF image file",
            "@type": "IMAGE-THUMBNAIL",
            "@size": "14222",
            "@ref": "gr14",
            "@mimetype": "image/gif"
          },
          {
            "@category": "thumbnail",
            "@height": "164",
            "@width": "133",
            "@_fa": "true",
            "$": "https://api.elsevier.com/content/object/eid/1-s2.0-S2095495624008532-gr15.sml?httpAccept=%2A%2F%2A",
            "@multimediatype": "GIF image file",
            "@type": "IMAGE-THUMBNAIL",
            "@size": "12810",
            "@ref": "gr15",
            "@mimetype": "image/gif"
          },
          {
            "@category": "thumbnail",
            "@height": "164",
            "@width": "155",
            "@_fa": "true",
            "$": "https://api.elsevier.com/content/object/eid/1-s2.0-S2095495624008532-gr16.sml?httpAccept=%2A%2F%2A",
            "@multimediatype": "GIF image file",
            "@type": "IMAGE-THUMBNAIL",
            "@size": "13939",
            "@ref": "gr16",
            "@mimetype": "image/gif"
          },
          {
            "@category": "thumbnail",
            "@height": "164",
            "@width": "164",
            "@_fa": "true",
            "$": "https://api.elsevier.com/content/object/eid/1-s2.0-S2095495624008532-gr2.sml?httpAccept=%2A%2F%2A",
            "@multimediatype": "GIF image file",
            "@type": "IMAGE-THUMBNAIL",
            "@size": "17091",
            "@ref": "gr2",
            "@mimetype": "image/gif"
          },
          {
            "@category": "thumbnail",
            "@height": "164",
            "@width": "211",
            "@_fa": "true",
            "$": "https://api.elsevier.com/content/object/eid/1-s2.0-S2095495624008532-gr3.sml?httpAccept=%2A%2F%2A",
            "@multimediatype": "GIF image file",
            "@type": "IMAGE-THUMBNAIL",
            "@size": "13609",
            "@ref": "gr3",
            "@mimetype": "image/gif"
          },
          {
            "@category": "thumbnail",
            "@height": "71",
            "@width": "219",
            "@_fa": "true",
            "$": "https://api.elsevier.com/content/object/eid/1-s2.0-S2095495624008532-gr4.sml?httpAccept=%2A%2F%2A",
            "@multimediatype": "GIF image file",
            "@type": "IMAGE-THUMBNAIL",
            "@size": "4994",
            "@ref": "gr4",
            "@mimetype": "image/gif"
          },
          {
            "@category": "thumbnail",
            "@height": "164",
            "@width": "132",
            "@_fa": "true",
            "$": "https://api.elsevier.com/content/object/eid/1-s2.0-S2095495624008532-gr5.sml?httpAccept=%2A%2F%2A",
            "@multimediatype": "GIF image file",
            "@type": "IMAGE-THUMBNAIL",
            "@size": "9426",
            "@ref": "gr5",
            "@mimetype": "image/gif"
          },
          {
            "@category": "thumbnail",
            "@height": "164",
            "@width": "148",
            "@_fa": "true",
            "$": "https://api.elsevier.com/content/object/eid/1-s2.0-S2095495624008532-gr6.sml?httpAccept=%2A%2F%2A",
            "@multimediatype": "GIF image file",
            "@type": "IMAGE-THUMBNAIL",
            "@size": "13198",
            "@ref": "gr6",
            "@mimetype": "image/gif"
          },
          {
            "@category": "thumbnail",
            "@height": "163",
            "@width": "201",
            "@_fa": "true",
            "$": "https://api.elsevier.com/content/object/eid/1-s2.0-S2095495624008532-gr7.sml?httpAccept=%2A%2F%2A",
            "@multimediatype": "GIF image file",
            "@type": "IMAGE-THUMBNAIL",
            "@size": "19911",
            "@ref": "gr7",
            "@mimetype": "image/gif"
          },
          {
            "@category": "thumbnail",
            "@height": "164",
            "@width": "141",
            "@_fa": "true",
            "$": "https://api.elsevier.com/content/object/eid/1-s2.0-S2095495624008532-gr8.sml?httpAccept=%2A%2F%2A",
            "@multimediatype": "GIF image file",
            "@type": "IMAGE-THUMBNAIL",
            "@size": "13273",
            "@ref": "gr8",
            "@mimetype": "image/gif"
          },
          {
            "@category": "thumbnail",
            "@height": "163",
            "@width": "165",
            "@_fa": "true",
            "$": "https://api.elsevier.com/content/object/eid/1-s2.0-S2095495624008532-gr9.sml?httpAccept=%2A%2F%2A",
            "@multimediatype": "GIF image file",
            "@type": "IMAGE-THUMBNAIL",
            "@size": "15665",
            "@ref": "gr9",
            "@mimetype": "image/gif"
          },
          {
            "@category": "high",
            "@height": "641",
            "@width": "492",
            "@_fa": "true",
            "$": "https://api.elsevier.com/content/object/eid/1-s2.0-S2095495624008532-fx1_lrg.jpg?httpAccept=%2A%2F%2A",
            "@multimediatype": "JPEG image file",
            "@type": "IMAGE-HIGH-RES",
            "@size": "44189",
            "@ref": "fx1",
            "@mimetype": "image/jpeg"
          },
          {
            "@category": "high",
            "@height": "564",
            "@width": "492",
            "@_fa": "true",
            "$": "https://api.elsevier.com/content/object/eid/1-s2.0-S2095495624008532-fx2_lrg.jpg?httpAccept=%2A%2F%2A",
            "@multimediatype": "JPEG image file",
            "@type": "IMAGE-HIGH-RES",
            "@size": "37374",
            "@ref": "fx2",
            "@mimetype": "image/jpeg"
          },
          {
            "@category": "high",
            "@height": "591",
            "@width": "492",
            "@_fa": "true",
            "$": "https://api.elsevier.com/content/object/eid/1-s2.0-S2095495624008532-fx3_lrg.jpg?httpAccept=%2A%2F%2A",
            "@multimediatype": "JPEG image file",
            "@type": "IMAGE-HIGH-RES",
            "@size": "52514",
            "@ref": "fx3",
            "@mimetype": "image/jpeg"
          },
          {
            "@category": "high",
            "@height": "617",
            "@width": "492",
            "@_fa": "true",
            "$": "https://api.elsevier.com/content/object/eid/1-s2.0-S2095495624008532-fx4_lrg.jpg?httpAccept=%2A%2F%2A",
            "@multimediatype": "JPEG image file",
            "@type": "IMAGE-HIGH-RES",
            "@size": "49913",
            "@ref": "fx4",
            "@mimetype": "image/jpeg"
          },
          {
            "@category": "high",
            "@height": "645",
            "@width": "492",
            "@_fa": "true",
            "$": "https://api.elsevier.com/content/object/eid/1-s2.0-S2095495624008532-fx5_lrg.jpg?httpAccept=%2A%2F%2A",
            "@multimediatype": "JPEG image file",
            "@type": "IMAGE-HIGH-RES",
            "@size": "35752",
            "@ref": "fx5",
            "@mimetype": "image/jpeg"
          },
          {
            "@category": "high",
            "@height": "619",
            "@width": "492",
            "@_fa": "true",
            "$": "https://api.elsevier.com/content/object/eid/1-s2.0-S2095495624008532-fx6_lrg.jpg?httpAccept=%2A%2F%2A",
            "@multimediatype": "JPEG image file",
            "@type": "IMAGE-HIGH-RES",
            "@size": "43954",
            "@ref": "fx6",
            "@mimetype": "image/jpeg"
          },
          {
            "@category": "high",
            "@height": "1085",
            "@width": "1083",
            "@_fa": "true",
            "$": "https://api.elsevier.com/content/object/eid/1-s2.0-S2095495624008532-ga1_lrg.jpg?httpAccept=%2A%2F%2A",
            "@multimediatype": "JPEG image file",
            "@type": "IMAGE-HIGH-RES",
            "@size": "233394",
            "@ref": "ga1",
            "@mimetype": "image/jpeg"
          },
          {
            "@category": "high",
            "@height": "2617",
            "@width": "3139",
            "@_fa": "true",
            "$": "https://api.elsevier.com/content/object/eid/1-s2.0-S2095495624008532-gr1_lrg.jpg?httpAccept=%2A%2F%2A",
            "@multimediatype": "JPEG image file",
            "@type": "IMAGE-HIGH-RES",
            "@size": "891536",
            "@ref": "gr1",
            "@mimetype": "image/jpeg"
          },
          {
            "@category": "high",
            "@height": "3693",
            "@width": "3080",
            "@_fa": "true",
            "$": "https://api.elsevier.com/content/object/eid/1-s2.0-S2095495624008532-gr10_lrg.jpg?httpAccept=%2A%2F%2A",
            "@multimediatype": "JPEG image file",
            "@type": "IMAGE-HIGH-RES",
            "@size": "1081905",
            "@ref": "gr10",
            "@mimetype": "image/jpeg"
          },
          {
            "@category": "high",
            "@height": "2791",
            "@width": "3141",
            "@_fa": "true",
            "$": "https://api.elsevier.com/content/object/eid/1-s2.0-S2095495624008532-gr11_lrg.jpg?httpAccept=%2A%2F%2A",
            "@multimediatype": "JPEG image file",
            "@type": "IMAGE-HIGH-RES",
            "@size": "747130",
            "@ref": "gr11",
            "@mimetype": "image/jpeg"
          },
          {
            "@category": "high",
            "@height": "4335",
            "@width": "3157",
            "@_fa": "true",
            "$": "https://api.elsevier.com/content/object/eid/1-s2.0-S2095495624008532-gr12_lrg.jpg?httpAccept=%2A%2F%2A",
            "@multimediatype": "JPEG image file",
            "@type": "IMAGE-HIGH-RES",
            "@size": "725718",
            "@ref": "gr12",
            "@mimetype": "image/jpeg"
          },
          {
            "@category": "high",
            "@height": "3818",
            "@width": "3154",
            "@_fa": "true",
            "$": "https://api.elsevier.com/content/object/eid/1-s2.0-S2095495624008532-gr13_lrg.jpg?httpAccept=%2A%2F%2A",
            "@multimediatype": "JPEG image file",
            "@type": "IMAGE-HIGH-RES",
            "@size": "1028339",
            "@ref": "gr13",
            "@mimetype": "image/jpeg"
          },
          {
            "@category": "high",
            "@height": "2728",
            "@width": "3318",
            "@_fa": "true",
            "$": "https://api.elsevier.com/content/object/eid/1-s2.0-S2095495624008532-gr14_lrg.jpg?httpAccept=%2A%2F%2A",
            "@multimediatype": "JPEG image file",
            "@type": "IMAGE-HIGH-RES",
            "@size": "656971",
            "@ref": "gr14",
            "@mimetype": "image/jpeg"
          },
          {
            "@category": "high",
            "@height": "3531",
            "@width": "2863",
            "@_fa": "true",
            "$": "https://api.elsevier.com/content/object/eid/1-s2.0-S2095495624008532-gr15_lrg.jpg?httpAccept=%2A%2F%2A",
            "@multimediatype": "JPEG image file",
            "@type": "IMAGE-HIGH-RES",
            "@size": "643276",
            "@ref": "gr15",
            "@mimetype": "image/jpeg"
          },
          {
            "@category": "high",
            "@height": "3145",
            "@width": "2968",
            "@_fa": "true",
            "$": "https://api.elsevier.com/content/object/eid/1-s2.0-S2095495624008532-gr16_lrg.jpg?httpAccept=%2A%2F%2A",
            "@multimediatype": "JPEG image file",
            "@type": "IMAGE-HIGH-RES",
            "@size": "1164667",
            "@ref": "gr16",
            "@mimetype": "image/jpeg"
          },
          {
            "@category": "high",
            "@height": "3139",
            "@width": "3137",
            "@_fa": "true",
            "$": "https://api.elsevier.com/content/object/eid/1-s2.0-S2095495624008532-gr2_lrg.jpg?httpAccept=%2A%2F%2A",
            "@multimediatype": "JPEG image file",
            "@type": "IMAGE-HIGH-RES",
            "@size": "868477",
            "@ref": "gr2",
            "@mimetype": "image/jpeg"
          },
          {
            "@category": "high",
            "@height": "2165",
            "@width": "2782",
            "@_fa": "true",
            "$": "https://api.elsevier.com/content/object/eid/1-s2.0-S2095495624008532-gr3_lrg.jpg?httpAccept=%2A%2F%2A",
            "@multimediatype": "JPEG image file",
            "@type": "IMAGE-HIGH-RES",
            "@size": "453532",
            "@ref": "gr3",
            "@mimetype": "image/jpeg"
          },
          {
            "@category": "high",
            "@height": "911",
            "@width": "2823",
            "@_fa": "true",
            "$": "https://api.elsevier.com/content/object/eid/1-s2.0-S2095495624008532-gr4_lrg.jpg?httpAccept=%2A%2F%2A",
            "@multimediatype": "JPEG image file",
            "@type": "IMAGE-HIGH-RES",
            "@size": "161499",
            "@ref": "gr4",
            "@mimetype": "image/jpeg"
          },
          {
            "@category": "high",
            "@height": "3688",
            "@width": "2964",
            "@_fa": "true",
            "$": "https://api.elsevier.com/content/object/eid/1-s2.0-S2095495624008532-gr5_lrg.jpg?httpAccept=%2A%2F%2A",
            "@multimediatype": "JPEG image file",
            "@type": "IMAGE-HIGH-RES",
            "@size": "718321",
            "@ref": "gr5",
            "@mimetype": "image/jpeg"
          },
          {
            "@category": "high",
            "@height": "3371",
            "@width": "3051",
            "@_fa": "true",
            "$": "https://api.elsevier.com/content/object/eid/1-s2.0-S2095495624008532-gr6_lrg.jpg?httpAccept=%2A%2F%2A",
            "@multimediatype": "JPEG image file",
            "@type": "IMAGE-HIGH-RES",
            "@size": "929361",
            "@ref": "gr6",
            "@mimetype": "image/jpeg"
          },
          {
            "@category": "high",
            "@height": "2420",
            "@width": "2976",
            "@_fa": "true",
            "$": "https://api.elsevier.com/content/object/eid/1-s2.0-S2095495624008532-gr7_lrg.jpg?httpAccept=%2A%2F%2A",
            "@multimediatype": "JPEG image file",
            "@type": "IMAGE-HIGH-RES",
            "@size": "798056",
            "@ref": "gr7",
            "@mimetype": "image/jpeg"
          },
          {
            "@category": "high",
            "@height": "3678",
            "@width": "3162",
            "@_fa": "true",
            "$": "https://api.elsevier.com/content/object/eid/1-s2.0-S2095495624008532-gr8_lrg.jpg?httpAccept=%2A%2F%2A",
            "@multimediatype": "JPEG image file",
            "@type": "IMAGE-HIGH-RES",
            "@size": "870003",
            "@ref": "gr8",
            "@mimetype": "image/jpeg"
          },
          {
            "@category": "high",
            "@height": "2755",
            "@width": "2782",
            "@_fa": "true",
            "$": "https://api.elsevier.com/content/object/eid/1-s2.0-S2095495624008532-gr9_lrg.jpg?httpAccept=%2A%2F%2A",
            "@multimediatype": "JPEG image file",
            "@type": "IMAGE-HIGH-RES",
            "@size": "753728",
            "@ref": "gr9",
            "@mimetype": "image/jpeg"
          }
        ]
      },
      "link": {
        "@rel": "abstract",
        "@href": "https://api.elsevier.com/content/abstract/scopus_id/85213558839"
      }
    }
  }
}