{
  "metadata": {
    "title": "Advanced heterostructure of Pd nanosheets@Pt nanoparticles boosts methanol electrooxidation",
    "authors": "; ; ",
    "journal": "Journal of Energy Chemistry",
    "date": "2023-10-31",
    "doi": "10.1016/j.jechem.2023.06.031",
    "abstract": "",
    "uri": "https://api.elsevier.com/content/article/pii/S2095495623003789",
    "pii": "S2095495623003789"
  },
  "fulltext": {
    "full-text-retrieval-response": {
      "scopus-eid": "2-s2.0-85167407651",
      "originalText": "serial JL 286353 291210 291711 291744 291809 31 Journal of Energy Chemistry JOURNALENERGYCHEMISTRY 2023-07-07 2023-07-07 2023-08-10 2023-08-10 2023-10-03T23:57:43 1-s2.0-S2095495623003789 S2095-4956(23)00378-9 S2095495623003789 10.1016/j.jechem.2023.06.031 S300 S300.1 FULL-TEXT 1-s2.0-S2095495623X00084 2024-06-03T13:21:35.095704Z 0 0 20231001 20231031 2023 2023-07-07T14:56:27.864384Z absattachment articleinfo articletitlenorm authfirstinitialnorm authfirstsurnamenorm cid cids contenttype copyright crossmark dateloaded dateloadedtxt datesearch datesort dateupdated dco docsubtype doctype doi eid ewtransactionid hubeid indexeddate issn issnnorm itemstage itemtransactionid itemweight openaccess openarchive pg pgfirst pglast pii piinorm pubdateend pubdatestart pubdatetxt pubyr sortorder srctitle srctitlenorm srctype ssids alllist content subj subheadings suppl tomb volfirst volissue volumelist webpdf webpdfpagecount yearnav figure e-component body mmlmath acknowledge affil appendices articletitle auth authfirstini authfull authkeywords authlast orcid primabst ref specialabst 2095-4956 20954956 false 85 85 C Volume 85 39 430 438 430 438 202310 October 2023 2023-10-01 2023-10-31 2023 article fla © 2023 Science Press and Dalian Institute of Chemical Physics, Chinese Academy of Sciences. Published by ELSEVIER B.V. and Science Press. All rights reserved. ADVANCEDHETEROSTRUCTUREPDNANOSHEETSPTNANOPARTICLESBOOSTSMETHANOLELECTROOXIDATION LI J 1 Introduction 2 Experimental 2.1 Synthesis of PdPt alloy nanosheets, U-Pd@Pt HS, and E-Pd@Pt HS 2.2 Characterizations 2.3 Electrochemical tests 3 Results and discussion 3.1 Physical characterization of the Pd@Pt heterostructure 3.2 Growth mechanism of the Pd@Pt heterostructure 3.3 Electrochemical performance of the Pd@Pt heterostructure 3.4 Performance enhancement mechanism of the Pd@Pt heterostructure 3.5 Density functional theory (DFT) calculation for interfacial structural analysis 4 Conclusions Acknowledgments Appendix A Supplementary data References ZHU 2022 15529 15538 J ZHU 2017 915 923 Y YU 2021 2101242 D LEI 2022 7260 7280 G SUN 2022 193 205 Y MONTESGARCIA 2021 1269 1304 V ZHU 2020 851 918 J GAYEN 2022 2191 2200 P LV 2021 2100187 F YUN 2019 14329 14336 Q LIU 2022 2200147 M LAHA 2019 1803795 S CHEN 2022 e202209693 S WANG 2022 407 413 T WANG 2021 11190 11195 M LI 2021 130319 J WANG 2019 565 595 H CHEN 2021 247 255 F WANG 2022 2106773 Y FENG 2022 1656 1664 X LYU 2021 16093 16100 Z SUN 2021 1369 Y TIAN 2022 230 235 H WANG 2020 1806843 H CUI 2018 385 397 X LANG 2020 11986 12043 R XU 2020 2006317 H YAN 2022 583 606 W SUN 2020 234 240 H ISHIKAWA 2021 750 757 H WANG 2021 2108 2116 C HUANG 2022 721 751 X ZHAO 2022 41352 41357 Y WANG 2020 5458 5464 W LIU 2020 2123 2170 J PENG 2020 30336 30342 X WANG 2015 3307 3313 Z JIN 2012 2566 2573 M KIM 2010 10197 10201 Y LI 2022 523 532 J CAI 2020 20386 20392 M HUANG 2021 601 609 H XIA 2017 60 95 Y BAO 2020 119106 Y XUE 2022 94 102 Q YANG 2023 e202302220 J WANG 2020 2000534 T LI 2022 745 779 S MENG 2022 137932 W CHEN 2022 2106773 J LIU 2020 125507 H WANG 2020 7751 7759 X YANG 2021 15432 15440 C WANG 2022 483 492 S BAI 2016 506 511 S LIU 2023 130036 Z ZHAI 2022 202116057 L YAMASHITA 2016 240 244 D LIX2023X430 LIX2023X430X438 LIX2023X430XJ LIX2023X430X438XJ 2025-08-10T00:00:00.000Z 2025-08-10T00:00:00.000Z http://creativecommons.org/licenses/by-nc-nd/4.0/ © 2023 Science Press and Dalian Institute of Chemical Physics, Chinese Academy of Sciences. Published by ELSEVIER B.V. and Science Press. All rights reserved. 2023-08-15T08:49:03.826Z http://vtw.elsevier.com/data/voc/AddOnTypes/50.7/aggregated-refined National Natural Science Foundation of China 52073199 NSFC National Natural Science Foundation of China http://data.elsevier.com/vocabulary/SciValFunders/501100001809 http://sws.geonames.org/1814991/ 52274304 ICD National Academy of Natural Disaster Prevention http://data.elsevier.com/vocabulary/SciValFunders/501100016333 http://sws.geonames.org/1814991 This work was supported by the National Natural Science Foundation of China (Grant numbers 52274304, 52073199). item S2095-4956(23)00378-9 S2095495623003789 1-s2.0-S2095495623003789 10.1016/j.jechem.2023.06.031 286353 2023-10-03T23:24:04.943271Z 2023-10-01 2023-10-31 1-s2.0-S2095495623003789-main.pdf https://s3-eu-west-1.amazonaws.com/prod-ucs-content-store-eu-west/content/pii:S2095495623003789/MAIN/application/pdf/e69b2a1a81e15348bd86aa9520dd986d/main.pdf main.pdf pdf true 4370752 MAIN 9 1-s2.0-S2095495623003789-main_1.png https://s3-eu-west-1.amazonaws.com/prod-ucs-content-store-eu-west/content/pii:S2095495623003789/PREVIEW/image/png/498e35b7d7cda6c521aef3ece4748240/main_1.png main_1.png png 59674 849 656 IMAGE-WEB-PDF 1 1-s2.0-S2095495623003789-gr2.jpg https://s3-eu-west-1.amazonaws.com/prod-ucs-content-store-eu-west/content/pii:S2095495623003789/gr2/DOWNSAMPLED/image/jpeg/e1a1a304f0cf8ce252af03c30711b7ad/gr2.jpg gr2 gr2.jpg jpg 153105 642 711 IMAGE-DOWNSAMPLED 1-s2.0-S2095495623003789-gr3.jpg https://s3-eu-west-1.amazonaws.com/prod-ucs-content-store-eu-west/content/pii:S2095495623003789/gr3/DOWNSAMPLED/image/jpeg/c8228fa23047b57823db069d813c3ebb/gr3.jpg gr3 gr3.jpg jpg 139761 469 711 IMAGE-DOWNSAMPLED 1-s2.0-S2095495623003789-gr4.jpg https://s3-eu-west-1.amazonaws.com/prod-ucs-content-store-eu-west/content/pii:S2095495623003789/gr4/DOWNSAMPLED/image/jpeg/62f4a0f263f6cbbef9a36f6ab887008a/gr4.jpg gr4 gr4.jpg jpg 89947 524 578 IMAGE-DOWNSAMPLED 1-s2.0-S2095495623003789-gr5.jpg https://s3-eu-west-1.amazonaws.com/prod-ucs-content-store-eu-west/content/pii:S2095495623003789/gr5/DOWNSAMPLED/image/jpeg/d96c745ab4553fec64cff8d0d234279e/gr5.jpg gr5 gr5.jpg jpg 95573 424 774 IMAGE-DOWNSAMPLED 1-s2.0-S2095495623003789-gr6.jpg https://s3-eu-west-1.amazonaws.com/prod-ucs-content-store-eu-west/content/pii:S2095495623003789/gr6/DOWNSAMPLED/image/jpeg/582e3e6a83d66755c3bfd32f7f3b8658/gr6.jpg gr6 gr6.jpg jpg 79184 417 774 IMAGE-DOWNSAMPLED 1-s2.0-S2095495623003789-gr7.jpg https://s3-eu-west-1.amazonaws.com/prod-ucs-content-store-eu-west/content/pii:S2095495623003789/gr7/DOWNSAMPLED/image/jpeg/76dad0c14155a452dc10890a7d9e3784/gr7.jpg gr7 gr7.jpg jpg 89274 486 667 IMAGE-DOWNSAMPLED 1-s2.0-S2095495623003789-gr8.jpg https://s3-eu-west-1.amazonaws.com/prod-ucs-content-store-eu-west/content/pii:S2095495623003789/gr8/DOWNSAMPLED/image/jpeg/97a140505738bbb726a78b9ee915b875/gr8.jpg gr8 gr8.jpg jpg 50716 357 774 IMAGE-DOWNSAMPLED 1-s2.0-S2095495623003789-ga1.jpg https://s3-eu-west-1.amazonaws.com/prod-ucs-content-store-eu-west/content/pii:S2095495623003789/ga1/DOWNSAMPLED/image/jpeg/ab58caf4e11c9de9cdf43b93c9705f40/ga1.jpg ga1 true ga1.jpg jpg 22429 199 288 IMAGE-DOWNSAMPLED 1-s2.0-S2095495623003789-gr1.jpg https://s3-eu-west-1.amazonaws.com/prod-ucs-content-store-eu-west/content/pii:S2095495623003789/gr1/HEAD-TAIL/image/jpeg/8cc58b71ea92b0a7dbf440b1580fb73a/gr1.jpg gr1 gr1.jpg jpg 155596 588 711 IMAGE-DOWNSAMPLED 1-s2.0-S2095495623003789-gr2.sml https://s3-eu-west-1.amazonaws.com/prod-ucs-content-store-eu-west/content/pii:S2095495623003789/gr2/THUMBNAIL/image/gif/c89872884c5ddbd9d950b9f8b1b37333/gr2.sml gr2 gr2.sml sml 19786 164 181 IMAGE-THUMBNAIL 1-s2.0-S2095495623003789-gr3.sml https://s3-eu-west-1.amazonaws.com/prod-ucs-content-store-eu-west/content/pii:S2095495623003789/gr3/THUMBNAIL/image/gif/c02c24000257eab879572bec282d5296/gr3.sml gr3 gr3.sml sml 22435 144 219 IMAGE-THUMBNAIL 1-s2.0-S2095495623003789-gr4.sml https://s3-eu-west-1.amazonaws.com/prod-ucs-content-store-eu-west/content/pii:S2095495623003789/gr4/THUMBNAIL/image/gif/3a75704f1c8b8439369c5695c6e25bae/gr4.sml gr4 gr4.sml sml 12865 164 181 IMAGE-THUMBNAIL 1-s2.0-S2095495623003789-gr5.sml https://s3-eu-west-1.amazonaws.com/prod-ucs-content-store-eu-west/content/pii:S2095495623003789/gr5/THUMBNAIL/image/gif/a7fb959d4cd1a39ef43feb69c888a216/gr5.sml gr5 gr5.sml sml 9752 120 219 IMAGE-THUMBNAIL 1-s2.0-S2095495623003789-gr6.sml https://s3-eu-west-1.amazonaws.com/prod-ucs-content-store-eu-west/content/pii:S2095495623003789/gr6/DOWNSAMPLED/image/gif/755c53b38e32a184409d29e9cec7367e/gr6.sml gr6 gr6.sml sml 9038 118 219 IMAGE-THUMBNAIL 1-s2.0-S2095495623003789-gr7.sml https://s3-eu-west-1.amazonaws.com/prod-ucs-content-store-eu-west/content/pii:S2095495623003789/gr7/THUMBNAIL/image/gif/2a2456136fd968a8705db8054b0d93b2/gr7.sml gr7 gr7.sml sml 10676 160 219 IMAGE-THUMBNAIL 1-s2.0-S2095495623003789-gr8.sml https://s3-eu-west-1.amazonaws.com/prod-ucs-content-store-eu-west/content/pii:S2095495623003789/gr8/MAIN/image/gif/40367628f84669c55a01f7f63519aecd/gr8.sml gr8 gr8.sml sml 9404 101 219 IMAGE-THUMBNAIL 1-s2.0-S2095495623003789-ga1.sml https://s3-eu-west-1.amazonaws.com/prod-ucs-content-store-eu-west/content/pii:S2095495623003789/ga1/THUMBNAIL/image/gif/c4df07a297415ee861d34ccb988d5ff9/ga1.sml ga1 true ga1.sml sml 17277 152 219 IMAGE-THUMBNAIL 1-s2.0-S2095495623003789-gr1.sml https://s3-eu-west-1.amazonaws.com/prod-ucs-content-store-eu-west/content/pii:S2095495623003789/gr1/PUBMED/image/gif/2239932a63b07e910b18089d08e0f005/gr1.sml gr1 gr1.sml sml 21697 164 198 IMAGE-THUMBNAIL 1-s2.0-S2095495623003789-gr2_lrg.jpg https://s3-eu-west-1.amazonaws.com/prod-ucs-content-store-eu-west/content/pii:S2095495623003789/HIGHRES/image/jpeg/bf1eb131dcdcc262724847f3c7656bf5/gr2_lrg.jpg gr2 gr2_lrg.jpg jpg 1083513 2845 3149 IMAGE-HIGH-RES 1-s2.0-S2095495623003789-gr3_lrg.jpg https://s3-eu-west-1.amazonaws.com/prod-ucs-content-store-eu-west/content/pii:S2095495623003789/THUMBNAIL/image/jpeg/16638ceccddb196385f5399188b40f9a/gr3_lrg.jpg gr3 gr3_lrg.jpg jpg 1182675 2076 3150 IMAGE-HIGH-RES 1-s2.0-S2095495623003789-gr4_lrg.jpg https://s3-eu-west-1.amazonaws.com/prod-ucs-content-store-eu-west/content/pii:S2095495623003789/HIGHRES/image/jpeg/c46f197f9e01fad553c57ebe3615871c/gr4_lrg.jpg gr4 gr4_lrg.jpg jpg 579174 2320 2559 IMAGE-HIGH-RES 1-s2.0-S2095495623003789-gr5_lrg.jpg https://s3-eu-west-1.amazonaws.com/prod-ucs-content-store-eu-west/content/pii:S2095495623003789/HIGHRES/image/jpeg/e7ac3fe944b88f8f966503fe919246cc/gr5_lrg.jpg gr5 gr5_lrg.jpg jpg 572302 1876 3425 IMAGE-HIGH-RES 1-s2.0-S2095495623003789-gr6_lrg.jpg https://s3-eu-west-1.amazonaws.com/prod-ucs-content-store-eu-west/content/pii:S2095495623003789/HIGHRES/image/jpeg/5c0283f4bf8fc32fc46128705360e6e1/gr6_lrg.jpg gr6 gr6_lrg.jpg jpg 439595 1845 3425 IMAGE-HIGH-RES 1-s2.0-S2095495623003789-gr7_lrg.jpg https://s3-eu-west-1.amazonaws.com/prod-ucs-content-store-eu-west/content/pii:S2095495623003789/HIGHRES/image/jpeg/89f5f4504ae8b2197503985be98944f6/gr7_lrg.jpg gr7 gr7_lrg.jpg jpg 486874 2152 2953 IMAGE-HIGH-RES 1-s2.0-S2095495623003789-gr8_lrg.jpg https://s3-eu-west-1.amazonaws.com/prod-ucs-content-store-eu-west/content/pii:S2095495623003789/HEAD-ONLY/image/jpeg/13b47bc6cd1b1f9b849ee44b5e68052b/gr8_lrg.jpg gr8 gr8_lrg.jpg jpg 289551 1580 3425 IMAGE-HIGH-RES 1-s2.0-S2095495623003789-ga1_lrg.jpg https://s3-eu-west-1.amazonaws.com/prod-ucs-content-store-eu-west/content/pii:S2095495623003789/HIGHRES/image/jpeg/3a61b63da6c79d74373926be31f622cb/ga1_lrg.jpg ga1 true ga1_lrg.jpg jpg 76483 531 767 IMAGE-HIGH-RES 1-s2.0-S2095495623003789-gr1_lrg.jpg https://s3-eu-west-1.amazonaws.com/prod-ucs-content-store-eu-west/content/pii:S2095495623003789/HIGHRES/image/jpeg/f3e60d2af48840b6435a43548a431afd/gr1_lrg.jpg gr1 gr1_lrg.jpg jpg 1018494 2607 3150 IMAGE-HIGH-RES 1-s2.0-S2095495623003789-mmc1.docx https://s3-eu-west-1.amazonaws.com/prod-ucs-content-store-eu-west/content/pii:S2095495623003789/mmc1/MAIN/application/vnd.openxmlformats-officedocument.wordprocessingml.document/88277e5111f3af3e172bbf515eb51aa0/mmc1.docx mmc1 mmc1.docx docx 7354678 APPLICATION 1-s2.0-S2095495623003789-si1.svg https://s3-eu-west-1.amazonaws.com/prod-ucs-content-store-eu-west/content/pii:S2095495623003789/STRIPIN/image/svg+xml/ca6cd5002ced3208d2b003e75b4e8e17/si1.svg si1 si1.svg svg 26124 ALTIMG 1-s2.0-S2095495623003789-si2.svg https://s3-eu-west-1.amazonaws.com/prod-ucs-content-store-eu-west/content/pii:S2095495623003789/STRIPIN/image/svg+xml/96046ce28c2fb9e81df834da8d1101ac/si2.svg si2 si2.svg svg 15643 ALTIMG 1-s2.0-S2095495623003789-am.pdf https://s3-eu-west-1.amazonaws.com/prod-ucs-content-store-eu-west/content/egi:10J7FXFV97L/MAIN/application/pdf/f4fd46be713920447386e35be59263b5/am.pdf am am.pdf pdf false 3840569 AAM-PDF JECHEM 3266 S2095-4956(23)00378-9 10.1016/j.jechem.2023.06.031 Science Press and Dalian Institute of Chemical Physics, Chinese Academy of Sciences Fig. 1 (a) HAADF-STEM image, (b) TEM image, (c) histogram of diameter distribution of Pt NPs, (d, e) HRTEM images, (f) line-scan analysis, and (g) HAADF-STEM-energy dispersive spectroscopy (EDS) element mappings of U-Pd@Pt HS. Fig. 2 (a) HAADF-STEM image, (b) TEM image, (c) histogram of diameter distribution of Pt NPs, (d, e) HRTEM images, (f) line-scan analysis, and (g) HAADF-STEM-EDS element mappings of E-Pd@Pt HS. Fig. 3 Representative TEM images of the products obtained in different solvents. (a) 5 mL ODE. (b) 4 mL ODE + 1 mL OAM. (c) 3 mL ODE + 2 mL OAM. (d) 2 mL ODE + 3 mL OAM. (e) 1 mL ODE + 4 mL OAM. (f) 5 mL OAM. Fig. 4 (a) The corresponding percentage of Pd and Pt. (b) The corresponding PXRD patterns during the process of changing solvent. (c) Scheme of the growth mechanism of Pt NPs on Pd NSs. Fig. 5 (a) CO stripping curves, (b) CV curve in 1 M KOH containing 1 M methanol solution, (c) mass activity, (d) specific activity, (e) mass activity variation during the consecutive 1000 CV tests, and (f) CA tests of U-Pd@Pt HS/C, E-Pd@Pt HS/C, PdPt AS/C, and Pd/C. Fig. 6 (a) Nyquist plots in 1 M KOH containing 1 M methanol of U-Pd@Pt HS/C, E-Pd@Pt HS/C, and PdPt AS/C. (b) CV curves of U-Pd@Pt HS/C toward MOR at different scan rates. (c, d) Plot of j versus v 1/2 and activation energies of the U-Pd@Pt HS/C, E-Pd@Pt HS/C, PdPt AS/C, and Pd/C electrodes. (e) Surface valence band photoemission spectra of U-Pd@Pt HS/C, E-Pd@Pt HS/C, and PdPt AS/C. Fig. 7 (a) Pd 3d XPS spectra, (b) Pt 4f XPS spectra, and (c–e) CA tests at bubbling CO in 1 M KOH + 1 M methanol solution of U-Pd@Pt HS, E-Pd@Pt HS and PdPt AS, respectively. Fig. 8 (a) The PDOS of Pd surround at the Pd (100)-Pt and Pd (111)-Pt interface, and on the Pd (111) and Pd (100) surface, respectively. (b, c) Charge density difference of Pt overlayer on Pd (111) and Pd (100). Orange and green correspond to electron depletion and accumulation, respectively. Advanced heterostructure of Pd nanosheets@Pt nanoparticles boosts methanol electrooxidation Jie Li a Cheng Wang a Yuefan Zhang a Shinichi Hata c Kewang Zhang a Changqing Ye b ⁎ Yukihide Shiraishi c Yukou Du a d ⁎ a College of Chemistry, Chemical Engineering and Materials Science, Soochow University, Suzhou 215123, Jiangsu, China College of Chemistry Chemical Engineering and Materials Science Soochow University Suzhou Jiangsu 215123 China College of Chemistry, Chemical Engineering and Materials Science, Soochow University, Suzhou 215123, Jiangsu, China b Jiangsu Key Laboratory for Environment Functional Materials, School of Materials Science and Engineering, Suzhou University of Science and Technology, Suzhou 215009, Jiangsu, China Jiangsu Key Laboratory for Environment Functional Materials School of Materials Science and Engineering Suzhou University of Science and Technology Suzhou Jiangsu 215009 China Jiangsu Key Laboratory for Environment Functional Materials, School of Materials Science and Engineering, Suzhou University of Science and Technology, Suzhou 215009, Jiangsu, China c Department of Applied Chemistry, Faculty of Engineering, Sanyo-Onoda City University, Sanyo-Onoda, Yamaguchi 756-0884, Japan Department of Applied Chemistry Faculty of Engineering Sanyo-Onoda City University Sanyo-Onoda Yamaguchi 756-0884 Japan Department of Applied Chemistry, Faculty of Engineering, Sanyo-Onoda City University, Sanyo-Onoda, Yamaguchi 756-0884, Japan d School of Optical and Electronic Information, Suzhou City University, Suzhou 215104, Jiangsu, China School of Optical and Electronic Information Suzhou City University Suzhou Jiangsu 215104 China School of Optical and Electronic Information, Suzhou City University, Suzhou 215104, Jiangsu, China ⁎ Corresponding authors. Graphical abstract Innovative heterostructures consist of Pd nanosheets and Pt nanoparticles, which exhibit efficient methanol electrooxidation performance owing to unique Pd@Pt heterointerface. Heterostructures have emerged as elaborate structures to improve catalytic activity owing to their combined surface and distinct inverse interface. However, fabricating advanced nanocatalysts with facet-dependent interface remains an unexploited and promising area. Herein, we render the controlled growth of Pt nanoparticles (NPs) on Pd nanosheets (NSs) by regulating the reduction kinetics of Pt2+ with solvents. Specifically, the fast reduction kinetic makes the Pt NPs uniformly deposited on the Pd NSs (U-Pd@Pt HS), while the slow reduction kinetic leads to the preferential growth of Pt NPs on the edge of the Pd NSs (E-Pd@Pt HS). Density functional theory calculations demonstrate that Pd (111)-Pt interface in U-Pd@Pt HS induces the electron-deficient status of Pd substrates, triggering the d-band center downshift and amplifying the Pd-Pt intermetallic interaction. The synergy between the electronic effect and interfacial effect facilitates the removal of poisonous intermediates on U-Pd@Pt HS. By virtue of the Pd NSs@Pt NPs interface, the heterostructure achieves exceptional methanol oxidation reaction activity as well as improved durability. This study innovatively proposes heterostructure engineering with facet-dependent interfacial modulation, offering instructive guidelines for the rational design of versatile heterocatalysts. Keywords Heterostructure engineering Facet-dependent interfacial modulation Methanol oxidation reaction 1 Introduction Noble metal nanocatalysts play a vital role in fuel cells, sensors, metal-air batteries, and electrocatalytic hydrogen generation owing to their abundant structural merits [1–5]. The rational design and development of high-performance noble metal nanocatalysts hold great prospects in these applications [6–8]. For property enhancement, structural regulation of noble metal nanocatalysts has been widely reported, as exemplified by the incorporation of transition metals, morphology engineering, phase control, and exposure of high-indexed facets [9–13]. Notably, the construction of heterostructures with inverse interfaces has aroused great interest due to their unique structural advantages and remarkable electrocatalytic properties [14–16]. As an emerging advanced strategy, heterostructure engineering has made considerable progress in diverse fields, such as catalysis, energy conversion and storage, and photoelectric devices [17–19]. For example, Chen and coworkers reported that Bi2O3/BiO2 heterojunction contributes to the enhanced adsorption of CO2 and intermediates, leading to high selectivity toward formate in the electrocatalytic CO2 reduction reaction [20]. Xie and coworkers demonstrated that the RuO x -on-Pd heterostructure manifests remarkable electrocatalytic performance toward the oxygen reduction reaction since the inverse interface obtains charge from the Pd host and facilitates O–O bond cleavage [21]. As a robust nanostructure, heterostructures integrate the superiorities of charge redistribution, enhanced component interactions, and well-tailored electronic structure [22–25]. Although heterogeneous structures exhibit many advantages, the rational design and construction of heterostructured electrocatalysts remain persistent dilemmas. It is worth pointing out that the regulation over heterostructures is mostly focused on interface components, such as metal-oxide/hydroxide [26,27], metal-sulfide/phosphide [28–31], and metal-alloy [32,33]. However, the facet-dependent interface modulation has been seldom studied, although it offers a suitable structural model to investigate the synergy between metal and metal with different facets. Apart from constructing heterostructures, the rational design of nanocatalysts with applicable dimensions and components is of important significance to explore the correlation between the inverse interface and the catalytic properties. Two-dimensional (2D) nanomaterials as substrates display highly open surfaces and a large number of edge sites with high surface energy, which are conducive to the introduction of foreign species and the construction of inverse interfaces [34]. In addition, the selection of components is a crucial issue because the differences in the lattice parameters of components will determine the mechanisms of crystal growth from thermodynamics [35]. On the premise of selecting components with small lattice mismatch (f), the epitaxial seed growth method makes the construction of heterostructures possible, such as Pt-Pd (f = 0.8%) [36], Cu-Au (f = 11.4%) [37], Pd-Cu (f = 7.1%) [38], and Au-Ag (f = 0.2%) [39]. The interactions between building blocks in heterostructures have been the focus of electrocatalyst research. In particular, Pd-Pt heterostructures system attracts extensive attention for their integrated superiorities in electron redistribution, active sites increasement, and stabilization toward electrochemical reactions. For example, Ren and co-workers reported that the isolated growth of Pt overlayer on the Pd nanocube surface leads to the enhanced hydrogen evolution activity, owing to the abundant reactive Pd/Pt heterointerfaces. However, the effect of Pd/Pt interface with specific crystal facets on catalytic performance is still largely unexplored to date. A key challenge is to precisely synthesize PdPt nanocatalysts with controllable interfacial facets. Motivated by the considerations above, Pd@Pt heterostructures with thermodynamic advantages were prepared by adjusting the reduction kinetics of Pt2+ with different solvents. Heterostructure engineering provides effective interfacial control of Pd@Pt nanocrystals, where enriched Pt nanoparticles (NPs) are deposited at different positions on 2D Pd nanosheets (NSs). The Pt NPs are distributed on the top/bottom surface and edge sites of the Pd NSs, corresponding to U-Pd@Pt HS and E-Pd@Pt HS. Noticeably, the synergistic effect beneath the interfacial structure significantly enhances the methanol oxidation reaction (MOR) performance. Pd@Pt heterostructures exhibit interfacial facets-dependent electrocatalytic performance. Specifically, the optimized U-Pd@Pt HS with Pd (111)-Pt interface shows a mass activity of 4.65 A mgPd+Pt −1, which is 2.7-fold, 2.4-fold, 2.0-fold, and 1.2-fold larger than that of Pd NS, Pd NSs + Pt NPs mixture, PdPt alloy, and E-Pd@Pt HS catalysts, respectively. The construction of the Pd@Pt heterostructure provides a robust reference for material design toward potential applications. 2 Experimental 2.1 Synthesis of PdPt alloy nanosheets, U-Pd@Pt HS, and E-Pd@Pt HS Pd NSs and PdPt alloy nanosheets were synthesized by a modified protocol reported by our group (see Supporting Information). The Pd NSs were collected through centrifugation and washed with an ethanol/acetone (V(acetone)/V(ethanol) = 9/1) mixture. Then, the Pd NSs dispersed in 10 mL benzyl alcohol were added into a flask and preheated at 100 °C for 10 min. In the synthesis of U-Pd@Pt HS, the Pt precursor solution dissolving 4.00 mg of Pt(acac)2 in 5.00 mL of oleylamine (OAM) was injected into the reaction flask, and the heating temperature was raised to 160 °C for 1 h. The synthesis of E-Pd@Pt HS was similar to that of U-Pd@Pt HS, except that Pt(acac)2 was dissolved in 2.00 mL of OAM and 3.00 mL of octadecene (ODE). The products were collected by centrifugation and then washed with an ethanol/cyclohexane (V(ethanol)/V(cyclohexane) = 5/1) mixture. 2.2 Characterizations Transmission electron microscopy (TEM) was conducted on a HITACHI HT7700 transmission electron microscope at an accelerating voltage of 120 kV. High-resolution TEM (HRTEM) and high-angle annular dark-field scanning TEM (HAADF-STEM) images were implemented by an FEI Tecnai F20 transmission electron microscope operated at 200 kV. An X’Pert-Pro MPD diffractometer (PANalytical, Netherlands) was used to collect the powder X-ray diffraction (PXRD) patterns. X-ray photoelectron spectroscopy (XPS) was used to investigate the surface composition and elemental valence of the products. 2.3 Electrochemical tests A three-electrode system was used to implement the electrochemical measurements, consisting of a Pt wire (counter electrode), a glassy carbon electrode (GCE) (working electrode), and a saturated Hg/Hg2Cl2 (SCE) (reference electrode). All catalysts were mixed with isopropanol and Nafion (V/V = 1/0.005). 5 μL of catalyst ink (0.2 mg mL−1) was deposited on a GCE and dried naturally. The electrochemical active surface areas (ECSAs) were determined by CO stripping curves at 20 mV s−1 in 0.1 M HClO4. MOR performance tests were performed in 1 M KOH containing 1 M methanol at 50 mV s−1. The ECSA of the electrocatalyst was determined according to the following equation. ECSA = Q CO - adsorption / 420 × M metal M metal represents the metal loading, Q CO-adsorption is the charge for CO adsorption, and 420 (μC cm−2) represents the charge required to oxidize a monolayer adsorbed CO on metal surface. The activation energy of electrocatalysts within 273.15–303.15 K was determined by the Arrhenius equation. log j = log A - E a / ( 2.3 R T ) j represents the current density, R represents the gas constant, T represents the temperature, and E a represents the apparent activation energy. By linearly fitting log j and T −1, the slope represents E a. 3 Results and discussion 3.1 Physical characterization of the Pd@Pt heterostructure The Pd@Pt heterostructure was typically synthesized by the epitaxial seed growth method. First, Pd NS seeds were prepared according to a modified protocol reported by our group [40]. Pd NSs feature a 2D morphology and face-centered cubic (fcc) structure (Fig. S1 a and b), and atomic force microscopy (AFM) analysis reveals that the thickness of a single-layer nanosheet is approximately 5 nm (Fig. S2). In the second step, Pt2+ was reduced and deposited at different positions on the Pd NSs by regulating the reduction kinetics with solvents. The HAADF-STEM and TEM images show that U-Pd@Pt HS is composed of well-dispersed Pt NPs and Pd NSs (Fig. 1a and b). The average diameter of the Pt NPs is determined to be 8.1 nm (Fig. 1c), and the thickness of the nanosheets is similar to that of the Pd NSs (Fig. S3). The PXRD pattern (Fig. S4) of U-Pd@Pt HS exhibits obvious peaks corresponding to fcc Pd (JCPDS No. 87-0643) and Pt (JCPDS No. 87-0636). The HRTEM images of U-Pd@Pt HS show a lattice spacing of 0.232 nm, corresponding to the 1/3(422) reflections originating from the stacking faults of fcc palladium (Fig. 1d). Selected area electron diffraction also confirms the existence of 1/3(422) reflections (Fig. S5). Pt NPs exhibit an interplanar spacing of 0.227 nm, corresponding to the (111) facet of fcc platinum (Fig. 1e). The line-scan analysis (Fig. 1f) and elemental mapping images (Fig. 1g) of U-Pd@Pt HS demonstrate that Pt NPs are distributed on the Pd NSs, which exhibit random, uniform, and dense characteristics. Interestingly, by simply replacing the solvent OAM with the mixed solvent of OAM and ODE, we obtained a new type of Pd@Pt heterostructure (E-Pd@Pt HS). The morphology of the E-Pd@Pt HS is determined by HAADF-STEM and TEM images (Fig. 2 a and b), and the Pt NPs are deposited at the edge of the Pd NSs. The average diameter of Pt NPs in E-Pd@Pt HS is measured to be 6.6 nm (Fig. 2c). The Pd NSs and Pt NPs display lattice spacing of approximately 0.232 and 0.227 nm, respectively (Fig. 2d and e). The PXRD of E-Pd@Pt HS can be indexed to the fcc structure (Fig. S6), similar to that of U-Pd@Pt HS. The line-scan analysis (Fig. 2f) and elemental mapping images (Fig. 2g) of E-Pd@Pt HS intuitively show that the distribution of Pt NPs is not uniform and concentrated at the edge of the Pd NS. 3.2 Growth mechanism of the Pd@Pt heterostructure To reveal the formation mechanism of the Pd@Pt heterostructure, we first collected the intermediates at different reaction times and investigated the composition variation with reaction time. When the Pt precursor was dissolved in 5 mL OAM, the content of Pt rapidly increased to 9.2% within 5 min and eventually reached approximately 24% (Fig. S7). In contrast, when the Pt precursor was dissolved in 2 mL OAM + 3 mL ODE, the content of Pt slowly increased to 10.5% within 15 min and eventually reached approximately 16%. Based on the experimental results, we concluded that the reduction kinetics of the solvent might play an important role in the distribution of Pt NPs. To confirm this hypothesis, the reaction products at different OAM/ODE ratios were collected and systematically characterized. When ODE is dominant (ODE/OAM ≫ 1), the products are 2D nanosheets (Fig. 3 a and b). However, when ODE/OAM ≈ 1 or OAM is dominant (ODE/OAM ≪ 1), the products change from nanosheets to E-Pd@Pt HS (Fig. 3c and d) or U-Pd@Pt HS (Fig. 3e and f), respectively. Fig. 4 (a) shows the compositional evolution from nanosheets to two distinct Pd@Pt heterostructures, in which the content of Pt gradually increases. OAM and ODE are strong reducing agents and surface capping agents, respectively, corresponding to strong and weak reducing power [41]. The reduction kinetics varies with the amount of solvent. Under weak reaction kinetics, the deposition of Pt atoms was much slower than the surface diffusion of Pt (v deposition ≪ v diffusion), and the Pt atoms could be evenly spread across the surface, generating a homogeneous Pd-Pt alloy with a small amount of Pt (3.0% and 11.4%) [42,43]. With increasing reduction power, the deposition rate of Pt atoms was higher than the surface diffusion of Pt (v deposition > v diffusion), resulting in the local nucleation and growth of Pt along the active region of the (100) plane. In contrast, when the deposition of Pt atoms was much faster than the surface diffusion of Pt (v deposition ≫ v diffusion), most of the Pt2+ was reduced and evenly distributed around the Pd NSs. The structure and compositional evolution from the Pd-Pt alloy nanosheets to the Pd@Pt heterostructures reveal that a rapid reduction of Pt2+ leads to the random distribution of Pt NPs on the surface of the Pd NSs (Fig. 4b), and a slow reduction of Pt2+ results in the oriented growth of Pt NPs on the edge of the Pd NSs. The variant deposition position of Pt NPs determines the difference of interfacial structure. As shown in Fig. 4(c), U-Pd@Pt HS and E-Pd@Pt HS display the Pd (111)-Pt and Pd (100)-Pt interfaces, providing a platform to elucidate the promotion effect of facet-dependent interfacial structure on catalytic activity. 3.3 Electrochemical performance of the Pd@Pt heterostructure Considering the novel 2D Pd@Pt heterostructure, the electrochemical properties of MOR were investigated. In addition, PdPt alloy nanosheets (AS) were prepared as a reference for elucidating the interfacial effect on electrocatalytic performance. There are many similarities between U-Pd@Pt HS and PdPt AS, such as morphology, composition, and exposed crystal facets, except for the abundant interfaces in U-Pd@Pt HS (Fig. S8). Before the electrochemical tests, the electrocatalysts U-Pd@Pt HS/C, E-Pd@Pt HS/C, PdPt AS/C, Pd NSs/C, and Pd NSs + Pt NPs mixture/C were prepared by loading the products on carbon powder. The ECSAs for U-Pd@Pt HS/C, E-Pd@Pt HS/C, PdPt AS/C, Pd NS/C, PtRu/C, and Pd/C were calculated to be 89.6, 87.9, 58.8, 38.4, 47.3, and 49.8 m2 g−1, respectively, through the CO stripping curves in Fig. 5 (a) and Fig. S9(a). The heterostructure exhibited the highest ECSA value, implying that the introduction of inverse interfaces provides sufficient active sites for electrocatalytic reactions. The electrocatalytic properties for MOR were investigated by cyclic voltammetry (CV) in a 1 M KOH solution containing 1 M methanol. As shown in Fig. 5(b) and Fig. S9(b), U-Pd@Pt HS/C exhibits the optimal electrocatalytic performance among these catalysts. The electrocatalytic activities are closely correlated with the structure of nanocatalysts in the order of U-Pd@Pt HS/C > E-Pd@Pt HS/C > PdPt AS/C > Pd NS/C. In particular, U-Pd@Pt HS/C delivers the highest mass activity of 4.65 A mgPd+Pt −1 (Fig. 5c), which shows significant enhancement in comparison to E-Pd@Pt HS/C (3.81 A mgPd+Pt −1), PdPt AS/C (2.38 A mgPd+Pt −1), Pd NS/C (1.75 A mgPd −1), PtRu/C (0.41 A mgPt −1), and Pd/C (0.30 A mgPd −1) (Fig. S9c). Additionally, U-Pd@Pt HS/C also exhibits outstanding specific activity, reaching 5.19 mA cm−2 (Fig. 5d), which is 1.2-fold, 1.3-fold, 1.1-fold, 5.9-fold, and 8.6-fold larger than that of E-Pd@Pt HS/C, PdPt AS/C, Pd NS/C, PtRu/C, and Pd/C, respectively. To our knowledge, the obtained U-Pd@Pt HS/C shows remarkable activity for MOR among the reported Pd-based electrocatalysts (Fig. S10 and Table S1). Furthermore, the Pd NSs + Pt NPs mixture also was prepared and investigated for its electrocatalytic property toward MOR. As shown in Fig. S11, Pt NPs in mixture display average diameter of 7.0 nm, similar to that of U-Pd@Pt HS and E-Pd@Pt HS. Specifically, the mixture exhibits a mass activity of 1.96 A mgPd+Pt −1 and specific activity of 2.23 mA cm−2 (Fig. S12). Mixture shows the lower activity than U-Pd@Pt HS, which demonstrates the importance of Pd NSs@Pt NPs interface in MOR. The durability of the catalysts toward MOR was investigated by multiple CV and chronoamperometric (CA) tests. The prepared U-Pd@Pt HS/C and E-Pd@Pt HS/C possess superior stability after 1000 consecutive CV tests (Fig. 5e and Fig. S13). The mass activities could still reach 1.51 and 0.84 A mgPd+Pt −1 for U-Pd@Pt HS/C and E-Pd@Pt HS/C, far beyond that of PdPt AS/C, Pd NS/C, mixture, PtRu/C, and Pd/C (Fig. S14). After the CA tests, U-Pd@Pt HS/C retained excellent activity and structural integrity, while severe activity decay and aggregation occurred on Pd/C (Fig. 5f and Fig. S15). 3.4 Performance enhancement mechanism of the Pd@Pt heterostructure Electrochemical impedance spectroscopy (EIS) was employed to explore the electron transfer resistance during MOR. In general, the larger the diameter of the semicircle is, the greater the electron transfer resistance (R CT) is. The semicircular diameter for U-Pd@Pt HS/C and E-Pd@Pt HS/C in 1 M KOH solution containing 1 M methanol is much less than that of PdPt AS/C, Pd NS/C, mixture, PtRu/C, and Pd/C (Fig. S16), which suggests that the Pd NSs@Pt NPs interface functionally promotes the electron transport for MOR [44,45]. Information on the electrode-catalyst-electrolyte interface was further investigated through an equivalent circuit (inset of Fig. 6 a). The solution resistance (R S) was approximately 6.4 Ω, and U-Pd@Pt HS/C exhibits the smallest R CT, which is consistent with it having the highest electrooxidation activity toward MOR (Table S2). Additionally, CV measurements of all catalysts were performed with different scanning rates from 10 to 100 mV s−1 to investigate the reaction kinetics during MOR (Fig. 6b and Fig. S17). Fig. 6(b) displays the effect of the scan rate on the CV curves, where the current density (j) and peak potential increased with increasing scan rate. j is linear relation with the square root of the scanning rate (v 1/2), suggesting that the diffusion of reactants and intermediates is the rate-determining step [46,47]. As depicted in the plot of j versus v 1/2, U-Pd@Pt HS/C demonstrats a larger slope (0.32) than E-Pd@Pt HS/C (0.27), PdPt AS/C (0.17), and Pd/C (0.03), indicating that the boosted interfacial effect can effectively improve the reaction kinetics for MOR (Fig. 6c). In addition, the apparent activation energies (E a) of different catalysts were also investigated by Arrhenius plots [48,49]. As shown in Fig. 6(d) and Fig. S18, U-Pd@Pt HS/C delivers the lowest E a value among the tested catalysts, namely, the fastest reaction rate. Fig. 6(e) presents the surface valence band photoemission spectra of the aforementioned catalysts. The d-band center is an effective descriptor to predict the CO tolerance of electrocatalysts. Obviously, U-Pd@Pt HS/C and E-Pd@Pt HS/C show lower d-band centers than PdPt AS/C and Pd NS/C (Fig. S19). The downshift of the d-band center in the Pd@Pt heterostructures leads to the weakened binding strength of poisonous intermediates and thus improved catalytic performance [50,51]. It is a general belief that the electrocatalytic behavior of nanocatalysts is dependent on their electronic structures. Hence, XPS was used to investigate the structural evolution of the Pd-Pt system after the introduction of inverse interface. For U-Pd@Pt HS, two peaks with binding energies of 336.1 and 341.4 eV are assigned to the 3d 5/2 and 3d 3/2 orbitals of metallic Pd, respectively. The Pd 3d orbitals of U-Pd@Pt HS shift to a higher binding energy by 0.1 and 0.2 eV compared with that of E-Pd@Pt HS and PdPt AS, respectively (Fig. 7 a). Fig. 7(b) shows two peaks of Pt 4f orbitals, where the peaks at 71.16 and 74.56 eV are assigned to the 4f 7/2 and 4f 5/2 orbitals of metallic Pt. The Pt 4f peaks of U-Pd@Pt HS negatively shift by 0.14 and 0.29 eV compared to that of E-Pd@Pt HS and PdPt AS, respectively. The variations in binding energy demonstrate that the introduction of the Pd NSs@Pt NPs interface induces intense electron transfer from Pd to Pt, leading to an electron-deficient state of Pd [52–54]. As shown in Fig. 7(c–e) and Fig. S20, pure CO was purged into the electrolyte to further investigate the anti-poisoning ability of the electrocatalysts during the CA tests. The current density of PdPt AS/C and Pd/C dramatically decreased after the injection of CO, while the current density of the heterostructure sharply increased and then slowly decreased, indicating enhanced CO tolerance. As a result, we have demonstrated that the electron deficiency of Pd enables heterostructured electrocatalysts an outstanding anti-poisoning ability. 3.5 Density functional theory (DFT) calculation for interfacial structural analysis DFT calculations were performed to investigate the electronic interactions at the Pd NSs@Pt NPs interface and understand the performance promotion of Pd NSs@Pt NPs interface on MOR. Pt monolayer is coated on Pd (111) and Pd (100) substrates to simply simulate the interface structure (Fig. S21). Projected density of states (PDOS) of different surface is calculated to estimate the d-band center. As shown in Fig. 8 (a), the d-band center of Pd atoms around Pd(111)-Pt and Pd(100)-Pt interface shifts downward compared to Pd(111) and Pd(100) surface. It is well known that the work function (Φ) determines the direction of charge transfer in heterostructures [55–58]. During the formation of heterostructures, electrons are transferred from the component with low work function to the component with high work function, causing their Fermi levels to tend to the same value. To our knowledge, the work functions of Pt and Pd are 5.65 and 5.0 eV, respectively. The work function difference between Pd and Pt can drive electron transfer from Pd to Pt, resulting in electron depletion on the Pd substrate. Fig. 8(b and c) demonstrates the charge density difference in two types of interface structures, in which orange and green correspond to electron depletion and accumulation, respectively. It can be found that the electrons tend to transfer from Pd (100) or Pd (111) surface to the Pt monolayer. Charge analysis indicates that electron depletion in the Pd (111) is 0.38 e, while electron depletion in the Pd (100) is 0.21 e with the different interface. DFT calculations illustrate not only the effect of facet-dependent interfacial regulation on electronic structure, but also the electron deficiency state of Pd NSs neighboring Pt. Consequently, the synergistic effect in Pd@Pt heterostructures between the electronic effect and interfacial effect strengthens the resistance to poisonous CO species. On the one hand, XPS and DFT calculations have illustrated that the introduction of inverse interface regulates the electronic structure of the catalyst. The interactions between the Pd NSs and the Pt NPs endow Pd NSs with electron-deficient status, which benefits the oxidation of adsorbed methanol. On the other hand, the Pd NSs@Pt NPs interface plays a crucial role in improving the catalytic performance since it provides not only the channel for charge redistribution, but also the vicinity for intermediate spillover. To be specific, Pd NSs@Pt NPs interface provides more avenues to facilitate poisonous intermediates and electron transfer during the MOR, and thus achieves rapid removal of COads to accelerate the release of active site and subsequent adsorption of reactant. 4 Conclusions In conclusion, we designed and implemented two types of Pd@Pt heterostructures by altering the reduction kinetics. DFT calculations demonstrate that Pd (111)-Pt interface in U-Pd@Pt HS induces more obvious electron-deficient status of Pd substrates, compared with Pd (100)-Pt interface in E-Pd@Pt HS, leading to the lower d-band center and excellent CO tolerance. Consequently, the optimized U-Pd@Pt HS realizes a top-ranked MOR activity and outstanding long-term stability, superior to the counterpart E-Pd@Pt HS and the PdPt AS without interfacial structure. This work shows a new direction of heterostructure engineering, lightening the design of efficient nanocatalysts for electrocatalysis and beyond. Declaration of competing interest The authors declare that they have no known competing financial interests or personal relationships that could have appeared to influence the work reported in this paper. Acknowledgments This work was supported by the National Natural Science Foundation of China (Grant numbers 52274304, 52073199). Appendix A Supplementary data Supplementary data to this article can be found online at https://doi.org/10.1016/j.jechem.2023.06.031. Appendix A Supplementary data The following are the Supplementary data to this article: Supplementary data 1 References [1] J. Zhu L. Xia R. Yu R. Lu J. Li R. He Y. Wu W. Zhang X. Hong W. Chen Y. Zhao L. Zhou L. Mai Z. Wang J. Am. Chem. Soc. 144 2022 15529 15538 J. Zhu, L. Xia, R. Yu, R. Lu, J. Li, R. He, Y. Wu, W. Zhang, X. Hong, W. Chen, Y. Zhao, L. Zhou, L. Mai, Z. Wang, J. Am. Chem. Soc. 144 (2022) 15529–15538. [2] Y.P. Zhu C. Guo Y. Zheng S.-Z. Qiao Accounts Chem. Res. 50 2017 915 923 Y.P. Zhu, C. Guo, Y. Zheng, S.-Z. Qiao, Accounts Chem. Res. 50 (2017) 915–923. [3] D. Yu Y. Ma F. Hu C.-C. Lin L. Li H.-Y. Chen X. Han S. Peng Adv. Energy Mater. 11 2021 2101242 D. Yu, Y. Ma, F. Hu, C.-C. Lin, L. Li, H.-Y. Chen, X. Han, S. Peng, Adv. Energy Mater. 11 (2021) 2101242. [4] G. Lei H. Pan H. Mei X. Liu G. Lu C. Lou Z. Li J. Zhang Chem. Soc. Rev. 51 2022 7260 7280 G. Lei, H. Pan, H. Mei, X. Liu, G. Lu, C. Lou, Z. Li, J. Zhang, Chem. Soc. Rev. 51 (2022) 7260–7280. [5] Y. Sun W. Zhang Q. Zhang Y. Li L. Gu S. Guo Matter 6 2022 193 205 Y. Sun, W. Zhang, Q. Zhang, Y. Li, L. Gu, S. Guo, Matter 6 (2022) 193–205. [6] V. Montes-García M.A. Squillaci M. Diez-Castellnou Q.K. Ong F. Stellacci P. Samorì Chem. Soc. Rev. 50 2021 1269 1304 V. Montes-García, M.A. Squillaci, M. Diez-Castellnou, Q.K. Ong, F. Stellacci, P. Samorì, Chem. Soc. Rev. 50 (2021) 1269–1304. [7] J. Zhu L. Hu P. Zhao L.Y.S. Lee K.-Y. Wong Chem. Rev. 120 2020 851 918 J. Zhu, L. Hu, P. Zhao, L.Y.S. Lee, K.-Y. Wong, Chem. Rev. 120 (2020) 851–918. [8] P. Gayen S. Saha V. Ramani Accounts Chem. Res. 55 2022 2191 2200 P. Gayen, S. Saha, V. Ramani, Accounts Chem. Res. 55 (2022) 2191–2200. [9] F. Lv W. Zhang M. Sun F. Lin T. Wu P. Zhou W. Yang P. Gao B. Huang S. Guo Adv. Energy Mater. 11 2021 2100187 F. Lv, W. Zhang, M. Sun, F. Lin, T. Wu, P. Zhou, W. Yang, P. Gao, B. Huang, S. Guo, Adv. Energy Mater. 11 (2021) 2100187. [10] Q. Yun Q. Lu C. Li B. Chen Q. Zhang Q. He Z. Hu Z. Zhang Y. Ge N. Yang J. Ge Y.B. He L. Gu H. Zhang ACS Nano 13 2019 14329 14336 Q. Yun, Q. Lu, C. Li, B. Chen, Q. Zhang, Q. He, Z. Hu, Z. Zhang, Y. Ge, N. Yang, J. Ge, Y.B. He, L. Gu, H. Zhang, ACS Nano 13 (2019) 14329–14336. [11] M. Liu B.-A. Lu G. Yang P. Yuan H. Xia Y. Wang K. Guo S. Zhao J. Liu Y. Yu W. Yan C.-L. Dong J.-N. Zhang S. Mu Adv. Sci. 9 2022 2200147 M. Liu, B.-A. Lu, G. Yang, P. Yuan, H. Xia, Y. Wang, K. Guo, S. Zhao, J. Liu, Y. Yu, W. Yan, C.-L. Dong, J.-N. Zhang, S. Mu, Adv. Sci. 9 (2022) 2200147. [12] S. Laha Y. Lee F. Podjaski D. Weber V. Duppel L.M. Schoop F. Pielnhofer C. Scheurer K. Müller U. Starke K. Reuter B.V. Lotsch Adv. Energy Mater. 9 2019 1803795 S. Laha, Y. Lee, F. Podjaski, D. Weber, V. Duppel, L.M. Schoop, F. Pielnhofer, C. Scheurer, K. Müller, U. Starke, K. Reuter, B.V. Lotsch, Adv. Energy Mater. 9 (2019) 1803795. [13] S. Chen N. Liu J. Zhong R. Yang B. Yan L. Gan P. Yu X. Gui H. Yang D. Yu Z. Zeng G. Yang Angew. Chem. Int. Ed. 61 2022 e202209693 S. Chen, N. Liu, J. Zhong, R. Yang, B. Yan, L. Gan, P. Yu, X. Gui, H. Yang, D. Yu, Z. Zeng, G. Yang, Angew. Chem. Int. Ed. 61 (2022) e202209693. [14] T.-J. Wang W.-S. Fang Y.-M. Liu F.-M. Li P. Chen Y. Chen J. Energy Chem. 70 2022 407 413 T.-J. Wang, W.-S. Fang, Y.-M. Liu, F.-M. Li, P. Chen, Y. Chen, J. Energy Chem. 70 (2022) 407–413. [15] M. Wang X. Dong Z. Meng Z. Hu Y.G. Lin C.K. Peng H. Wang C.W. Pao S. Ding Y. Li Q. Shao X. Huang Angew. Chem. Int. Ed. 60 2021 11190 11195 M. Wang, X. Dong, Z. Meng, Z. Hu, Y.G. Lin, C.K. Peng, H. Wang, C.W. Pao, S. Ding, Y. Li, Q. Shao, X. Huang, Angew. Chem. Int. Ed. 60 (2021) 11190–11195. [16] J. Li C. Wang H. Shang Y. Wang H. You H. Xu Y. Du Chem. Eng. J. 424 2021 130319 J. Li, C. Wang, H. Shang, Y. Wang, H. You, H. Xu, Y. Du, Chem. Eng. J. 424 (2021) 130319. [17] H.-F. Wang Q. Xu Matter 1 2019 565 595 H.-F. Wang, Q. Xu, Matter 1 (2019) 565–595. [18] F. Chen N. Wu M. Zhai X. Zhang R. Guo T. Hu M. Ma J. Energy Chem. 58 2021 247 255 F. Chen, N. Wu, M. Zhai, X. Zhang, R. Guo, T. Hu, M. Ma, J. Energy Chem. 58 (2021) 247–255. [19] Y. Wang X. Dai C. Dong W. Guo Z. Xu Y. Chen H. Xiang R. Zhang Adv. Mater. 34 2022 2106773 Y. Wang, X. Dai, C. Dong, W. Guo, Z. Xu, Y. Chen, H. Xiang, R. Zhang, Adv. Mater. 34 (2022) 2106773. [20] X. Feng H. Zou R. Zheng W. Wei R. Wang W. Zou G. Lim J. Hong L. Duan H. Chen Nano Lett. 22 2022 1656 1664 X. Feng, H. Zou, R. Zheng, W. Wei, R. Wang, W. Zou, G. Lim, J. Hong, L. Duan, H. Chen, Nano Lett. 22 (2022) 1656–1664. [21] Z. Lyu X.G. Zhang Y. Wang K. Liu C. Qiu X. Liao W. Yang Z. Xie S. Xie Angew. Chem. Int. Ed. 60 2021 16093 16100 Z. Lyu, X.G. Zhang, Y. Wang, K. Liu, C. Qiu, X. Liao, W. Yang, Z. Xie, S. Xie, Angew. Chem. Int. Ed. 60 (2021) 16093–16100. [22] Y. Sun Z. Xue Q. Liu Y. Jia Y. Li K. Liu Y. Lin M. Liu G. Li C.-Y. Su Nat. Commun. 12 2021 1369 Y. Sun, Z. Xue, Q. Liu, Y. Jia, Y. Li, K. Liu, Y. Lin, M. Liu, G. Li, C.-Y. Su, Nat. Commun. 12 (2021) 1369. [23] H. Tian D. Wu J. Li J. Luo C. Jia Z. Liu W. Huang Q. Chen C.M. Shim P. Deng Y. Shen X. Tian J. Energy Chem. 70 2022 230 235 H. Tian, D. Wu, J. Li, J. Luo, C. Jia, Z. Liu, W. Huang, Q. Chen, C.M. Shim, P. Deng, Y. Shen, X. Tian, J. Energy Chem.70 (2022) 230–235. [24] H. Wang X. Mi Y. Li S. Zhan Adv. Mater. 32 2020 1806843 H. Wang, X. Mi, Y. Li, S. Zhan, Adv. Mater. 32 (2020) 1806843. [25] X. Cui W. Li P. Ryabchuk K. Junge M. Beller Nat. Catal. 1 2018 385 397 X. Cui, W. Li, P. Ryabchuk, K. Junge, M. Beller, Nat. Catal. 1 (2018) 385–397. [26] R. Lang X. Du Y. Huang X. Jiang Q. Zhang Y. Guo K. Liu B. Qiao A. Wang T. Zhang Chem. Rev. 120 2020 11986 12043 R. Lang, X. Du, Y. Huang, X. Jiang, Q. Zhang, Y. Guo, K. Liu, B. Qiao, A. Wang, T. Zhang, Chem. Rev. 120 (2020) 11986–12043. [27] H. Xu H. Shang C. Wang Y. Du Adv. Funct. Mater. 30 2020 2006317 H. Xu, H. Shang, C. Wang, Y. Du, Adv. Funct. Mater. 30 (2020) 2006317. [28] W. Yan D. Zhang Q. Zhang Y. Sun S. Zhang F. Du X. Jin J. Energy Chem. 64 2022 583 606 W. Yan, D. Zhang, Q. Zhang, Y. Sun, S. Zhang, F. Du, X. Jin, J. Energy Chem. 64 (2022) 583–606. [29] H.-Y. Sun G.-R. Xu F.-M. Li Q.-L. Hong P.-J. Jin P. Chen Y. Chen J. Energy Chem. 47 2020 234 240 H.-Y. Sun, G.-R. Xu, F.-M. Li, Q.-L. Hong, P.-J. Jin, P. Chen, Y. Chen, J. Energy Chem. 47 (2020) 234–240. [30] H. Ishikawa M. Sheng A. Nakata K. Nakajima S. Yamazoe J. Yamasaki S. Yamaguchi T. Mizugaki T. Mitsudome ACS Catal. 11 2021 750 757 H. Ishikawa, M. Sheng, A. Nakata, K. Nakajima, S. Yamazoe, J. Yamasaki, S. Yamaguchi, T. Mizugaki, T. Mitsudome, ACS Catal. 11 (2021) 750–757. [31] C. Wang L. Jin H. Shang H. Xu Y. Shiraishi Y. Du Chinese Chem. Lett. 32 2021 2108 2116 C. Wang, L. Jin, H. Shang, H. Xu, Y. Shiraishi, Y. Du, Chinese Chem. Lett. 32 (2021) 2108–2116. [32] X. Huang G. Yang S. Li H. Wang Y. Cao F. Peng H. Yu J. Energy Chem. 68 2022 721 751 X. Huang, G. Yang, S. Li, H. Wang, Y. Cao, F. Peng, H. Yu, J. Energy Chem. 68 (2022) 721–751. [33] Y. Zhao Y. Liu B. Miao Y. Ding P. Jin Y. Chen Chin. J. Struct. Chem. 41 2022 41352 41357 Y. Zhao, Y. Liu, B. Miao, Y. Ding, P. Jin, Y. Chen, Chin. J. Struct. Chem. 41 (2022) 41352–41357. [34] W. Wang X. Zhang Y. Zhang X. Chen J. Ye J. Chen Z. Lyu X. Chen Q. Kuang S. Xie Z. Xie Nano Lett. 20 2020 5458 5464 W. Wang, X. Zhang, Y. Zhang, X. Chen, J. Ye, J. Chen, Z. Lyu, X. Chen, Q. Kuang, S. Xie, Z. Xie, Nano Lett. 20 (2020) 5458–5464. [35] J. Liu J. Zhang Chem. Rev. 120 2020 2123 2170 J. Liu, J. Zhang, Chem. Rev. 120 (2020) 2123–2170. [36] X. Peng D. Lu Y. Qin M. Li Y. Guo S. Guo ACS Appl. Mater. Interfaces 12 2020 30336 30342 X. Peng, D. Lu, Y. Qin, M. Li, Y. Guo, S. Guo, ACS Appl. Mater. Interfaces 12 (2020) 30336–30342. [37] Z. Wang Z. Chen H. Zhang Z. Zhang H. Wu M. Jin C. Wu D. Yang Y. Yin ACS Nano 9 2015 3307 3313 Z. Wang, Z. Chen, H. Zhang, Z. Zhang, H. Wu, M. Jin, C. Wu, D. Yang, Y. Yin, ACS Nano 9 (2015) 3307–3313. [38] M. Jin H. Zhang J. Wang X. Zhong N. Lu Z. Li Z. Xie M.J. Kim Y. Xia ACS Nano 6 2012 2566 2573 M. Jin, H. Zhang, J. Wang, X. Zhong, N. Lu, Z. Li, Z. Xie, M.J. Kim, Y. Xia, ACS Nano 6 (2012) 2566–2573. [39] Y. Kim J.W. Hong Y.W. Lee M. Kim D. Kim W.S. Yun S.W. Han Angew. Chem. Int. Ed. 49 2010 10197 10201 Y. Kim, J.W. Hong, Y.W. Lee, M. Kim, D. Kim, W.S. Yun, S.W. Han, Angew. Chem. Int. Ed. 49 (2010) 10197–10201. [40] J. Li Z. Zhou H. Xu C. Wang S. Hata Z. Dai Y. Shiraishi Y. Du J. Colloid Interf. Sci. 611 2022 523 532 J. Li, Z. Zhou, H. Xu, C. Wang, S. Hata, Z. Dai, Y. Shiraishi, Y. Du, J. Colloid Interf. Sci. 611 (2022) 523–532. [41] M. Cai Y. Zhang Y. Zhao Q. Liu Y. Li G. Li J. Mater. Chem. A 8 2020 20386 20392 M. Cai, Y. Zhang, Y. Zhao, Q. Liu, Y. Li, G. Li, J. Mater. Chem. A 8 (2020) 20386–20392. [42] H. Huang Y. Wei Y. Yang M. Yan H. He Q. Jiang X. Yang J. Zhu J. Energy Chem. 57 2021 601 609 H. Huang, Y. Wei, Y. Yang, M. Yan, H. He, Q. Jiang, X. Yang, J. Zhu, J. Energy Chem. 57 (2021) 601–609. [43] Y. Xia K.D. Gilroy H.C. Peng X. Xia Angew. Chem. Int. Ed. 56 2017 60 95 Y. Xia, K.D. Gilroy, H.C. Peng, X. Xia, Angew. Chem. Int. Ed. 56 (2017) 60–95. [44] Y. Bao H. Liu Z. Liu F. Wang L. Feng Appl. Catal. B: Environ. 274 2020 119106 Y. Bao, H. Liu, Z. Liu, F. Wang, L. Feng, Appl. Catal. B: Environ. 274 (2020) 119106. [45] Q. Xue X.-Y. Bai Y. Zhao Y.-N. Li T.-J. Wang H.-Y. Sun F.-M. Li P. Chen P. Jin S.-B. Yin Y. Chen J. Energy Chem. 65 2022 94 102 Q. Xue, X.-Y. Bai, Y. Zhao, Y.-N. Li, T.-J. Wang, H.-Y. Sun, F.-M. Li, P. Chen, P. Jin, S.-B. Yin, Y. Chen, J. Energy Chem. 65 (2022) 94–102. [46] J. Yang Y. Shen Y. Sun J. Xian Y. Long G. Li Angew. Chem. Int. Ed. 135 2023 e202302220 J. Yang, Y. Shen, Y. Sun, J. Xian, Y. Long, G. Li, Angew. Chem. Int. Ed. 135 (2023) e202302220. [47] T.-J. Wang F.-M. Li H. Huang S.-W. Yin P. Chen P.-J. Jin Y. Chen Adv. Funct. Mater. 30 2020 2000534 T.-J. Wang, F.-M. Li, H. Huang, S.-W. Yin, P. Chen, P.-J. Jin, Y. Chen, Adv. Funct. Mater. 30 (2020) 2000534. [48] S. Li Y. Zhang H. Huang J. Energy Chem. 67 2022 745 779 S. Li, Y. Zhang, H. Huang, J. Energy Chem. 67 (2022) 745–779. [49] W. Meng H. He L. Yang Q. Jiang B. Yuliarto Y. Yamauchi X. Xu H. Huang Chem. Eng. J. 450 2022 137932 W. Meng, H. He, L. Yang, Q. Jiang, B. Yuliarto, Y. Yamauchi, X. Xu, H. Huang, Chem. Eng. J. 450 (2022) 137932. [50] J. Chen G. Qian B. Chu Z. Jiang K. Tan L. Luo B. Li S. Yin Small 18 2022 2106773 J. Chen, G. Qian, B. Chu, Z. Jiang, K. Tan, L. Luo, B. Li, S. Yin, Small 18 (2022) 2106773. [51] H. Liu Z. Liu F. Wang L. Feng Chem. Eng. J. 397 2020 125507 H. Liu, Z. Liu, F. Wang, L. Feng, Chem. Eng. J. 397 (2020) 125507. [52] X. Wang M. Xie F. Lyu Y.M. Yiu Z. Wang J. Chen L.Y. Chang Y. Xia Q. Zhong M. Chu H. Yang T. Cheng T.K. Sham Q. Zhang Nano Lett. 20 2020 7751 7759 X. Wang, M. Xie, F. Lyu, Y.M. Yiu, Z. Wang, J. Chen, L.Y. Chang, Y. Xia, Q. Zhong, M. Chu, H. Yang, T. Cheng, T.K. Sham, Q. Zhang, Nano Lett. 20 (2020) 7751–7759. [53] C. Yang Q. Jiang H. Liu L. Yang H. He H. Huang W. Li J. Mater. Chem. A 9 2021 15432 15440 C. Yang, Q. Jiang, H. Liu, L. Yang, H. He, H. Huang, W. Li, J. Mater. Chem. A 9 (2021) 15432–15440. [54] S. Wang L. Zhao J. Li X. Tian X. Wu L. Feng J. Energy Chem. 66 2022 483 492 S. Wang, L. Zhao, J. Li, X. Tian, X. Wu, L. Feng, J. Energy Chem. 66 (2022) 483–492. [55] S. Bai M. Xie Q. Kong W. Jiang R. Qiao Z. Li J. Jiang Y. Xiong Part. Part. Syst. Charact. 33 2016 506 511 S. Bai, M. Xie, Q. Kong, W. Jiang, R. Qiao, Z. Li, J. Jiang, Y. Xiong, Part. Part. Syst. Charact. 33 (2016) 506–511. [56] Z. Liu W. Gao L. Liu S. Luo C. Zhang T. Yue J. Sun M. Zhu J. Wang J. Hazard Mater. 442 2023 130036 Z. Liu, W. Gao, L. Liu, S. Luo, C. Zhang, T. Yue, J. Sun, M. Zhu, J. Wang, J. Hazard Mater. 442 (2023) 130036. [57] L. Zhai X. She L. Zhuang Y. Li R. Ding X. Guo Y. Zhang Y. Zhu K. Xu H.J. Fan S.P. Lau Angew. Chem. Int. Ed. 61 2022 202116057 L. Zhai, X. She, L. Zhuang, Y. Li, R. Ding, X. Guo, Y. Zhang, Y. Zhu, K. Xu, H.J. Fan, S.P. Lau, Angew. Chem. Int. Ed. 61 (2022) 202116057. [58] D. Yamashita A. Ishizaki Appl. Surf. Sci. 363 2016 240 244 D. Yamashita, A. Ishizaki, Appl. Surf. Sci. 363 (2016) 240–244.",
      "scopus-id": "85167407651",
      "coredata": {
        "eid": "1-s2.0-S2095495623003789",
        "dc:description": "Heterostructures have emerged as elaborate structures to improve catalytic activity owing to their combined surface and distinct inverse interface. However, fabricating advanced nanocatalysts with facet-dependent interface remains an unexploited and promising area. Herein, we render the controlled growth of Pt nanoparticles (NPs) on Pd nanosheets (NSs) by regulating the reduction kinetics of Pt2+ with solvents. Specifically, the fast reduction kinetic makes the Pt NPs uniformly deposited on the Pd NSs (U-Pd@Pt HS), while the slow reduction kinetic leads to the preferential growth of Pt NPs on the edge of the Pd NSs (E-Pd@Pt HS). Density functional theory calculations demonstrate that Pd (111)-Pt interface in U-Pd@Pt HS induces the electron-deficient status of Pd substrates, triggering the d-band center downshift and amplifying the Pd-Pt intermetallic interaction. The synergy between the electronic effect and interfacial effect facilitates the removal of poisonous intermediates on U-Pd@Pt HS. By virtue of the Pd NSs@Pt NPs interface, the heterostructure achieves exceptional methanol oxidation reaction activity as well as improved durability. This study innovatively proposes heterostructure engineering with facet-dependent interfacial modulation, offering instructive guidelines for the rational design of versatile heterocatalysts.",
        "openArchiveArticle": "false",
        "prism:coverDate": "2023-10-31",
        "openaccessUserLicense": null,
        "prism:aggregationType": "Journal",
        "prism:url": "https://api.elsevier.com/content/article/pii/S2095495623003789",
        "dc:creator": [
          {
            "@_fa": "true",
            "$": "Li, Jie"
          },
          {
            "@_fa": "true",
            "$": "Wang, Cheng"
          },
          {
            "@_fa": "true",
            "$": "Zhang, Yuefan"
          },
          {
            "@_fa": "true",
            "$": "Hata, Shinichi"
          },
          {
            "@_fa": "true",
            "$": "Zhang, Kewang"
          },
          {
            "@_fa": "true",
            "$": "Ye, Changqing"
          },
          {
            "@_fa": "true",
            "$": "Shiraishi, Yukihide"
          },
          {
            "@_fa": "true",
            "$": "Du, Yukou"
          }
        ],
        "link": [
          {
            "@_fa": "true",
            "@rel": "self",
            "@href": "https://api.elsevier.com/content/article/pii/S2095495623003789"
          },
          {
            "@_fa": "true",
            "@rel": "scidir",
            "@href": "https://www.sciencedirect.com/science/article/pii/S2095495623003789"
          }
        ],
        "dc:format": "application/json",
        "openaccessType": null,
        "pii": "S2095-4956(23)00378-9",
        "prism:volume": "85",
        "prism:publisher": "Science Press and Dalian Institute of Chemical Physics, Chinese Academy of Sciences. Published by ELSEVIER B.V. and Science Press.",
        "dc:title": "Advanced heterostructure of Pd nanosheets@Pt nanoparticles boosts methanol electrooxidation",
        "prism:copyright": "© 2023 Science Press and Dalian Institute of Chemical Physics, Chinese Academy of Sciences. Published by ELSEVIER B.V. and Science Press. All rights reserved.",
        "openaccess": "0",
        "prism:issn": "20954956",
        "dcterms:subject": [
          {
            "@_fa": "true",
            "$": "Heterostructure engineering"
          },
          {
            "@_fa": "true",
            "$": "Facet-dependent interfacial modulation"
          },
          {
            "@_fa": "true",
            "$": "Methanol oxidation reaction"
          }
        ],
        "openaccessArticle": "false",
        "prism:publicationName": "Journal of Energy Chemistry",
        "openaccessSponsorType": null,
        "prism:pageRange": "430-438",
        "prism:endingPage": "438",
        "pubType": "fla",
        "prism:coverDisplayDate": "October 2023",
        "prism:doi": "10.1016/j.jechem.2023.06.031",
        "prism:startingPage": "430",
        "dc:identifier": "doi:10.1016/j.jechem.2023.06.031",
        "openaccessSponsorName": null
      },
      "objects": {
        "object": [
          {
            "@category": "standard",
            "@height": "642",
            "@width": "711",
            "@_fa": "true",
            "$": "https://api.elsevier.com/content/object/eid/1-s2.0-S2095495623003789-gr2.jpg?httpAccept=%2A%2F%2A",
            "@multimediatype": "JPEG image file",
            "@type": "IMAGE-DOWNSAMPLED",
            "@size": "153105",
            "@ref": "gr2",
            "@mimetype": "image/jpeg"
          },
          {
            "@category": "standard",
            "@height": "469",
            "@width": "711",
            "@_fa": "true",
            "$": "https://api.elsevier.com/content/object/eid/1-s2.0-S2095495623003789-gr3.jpg?httpAccept=%2A%2F%2A",
            "@multimediatype": "JPEG image file",
            "@type": "IMAGE-DOWNSAMPLED",
            "@size": "139761",
            "@ref": "gr3",
            "@mimetype": "image/jpeg"
          },
          {
            "@category": "standard",
            "@height": "524",
            "@width": "578",
            "@_fa": "true",
            "$": "https://api.elsevier.com/content/object/eid/1-s2.0-S2095495623003789-gr4.jpg?httpAccept=%2A%2F%2A",
            "@multimediatype": "JPEG image file",
            "@type": "IMAGE-DOWNSAMPLED",
            "@size": "89947",
            "@ref": "gr4",
            "@mimetype": "image/jpeg"
          },
          {
            "@category": "standard",
            "@height": "424",
            "@width": "774",
            "@_fa": "true",
            "$": "https://api.elsevier.com/content/object/eid/1-s2.0-S2095495623003789-gr5.jpg?httpAccept=%2A%2F%2A",
            "@multimediatype": "JPEG image file",
            "@type": "IMAGE-DOWNSAMPLED",
            "@size": "95573",
            "@ref": "gr5",
            "@mimetype": "image/jpeg"
          },
          {
            "@category": "standard",
            "@height": "417",
            "@width": "774",
            "@_fa": "true",
            "$": "https://api.elsevier.com/content/object/eid/1-s2.0-S2095495623003789-gr6.jpg?httpAccept=%2A%2F%2A",
            "@multimediatype": "JPEG image file",
            "@type": "IMAGE-DOWNSAMPLED",
            "@size": "79184",
            "@ref": "gr6",
            "@mimetype": "image/jpeg"
          },
          {
            "@category": "standard",
            "@height": "486",
            "@width": "667",
            "@_fa": "true",
            "$": "https://api.elsevier.com/content/object/eid/1-s2.0-S2095495623003789-gr7.jpg?httpAccept=%2A%2F%2A",
            "@multimediatype": "JPEG image file",
            "@type": "IMAGE-DOWNSAMPLED",
            "@size": "89274",
            "@ref": "gr7",
            "@mimetype": "image/jpeg"
          },
          {
            "@category": "standard",
            "@height": "357",
            "@width": "774",
            "@_fa": "true",
            "$": "https://api.elsevier.com/content/object/eid/1-s2.0-S2095495623003789-gr8.jpg?httpAccept=%2A%2F%2A",
            "@multimediatype": "JPEG image file",
            "@type": "IMAGE-DOWNSAMPLED",
            "@size": "50716",
            "@ref": "gr8",
            "@mimetype": "image/jpeg"
          },
          {
            "@category": "standard",
            "@height": "199",
            "@width": "288",
            "@_fa": "true",
            "$": "https://api.elsevier.com/content/object/eid/1-s2.0-S2095495623003789-ga1.jpg?httpAccept=%2A%2F%2A",
            "@multimediatype": "JPEG image file",
            "@type": "IMAGE-DOWNSAMPLED",
            "@size": "22429",
            "@ref": "ga1",
            "@mimetype": "image/jpeg"
          },
          {
            "@category": "standard",
            "@height": "588",
            "@width": "711",
            "@_fa": "true",
            "$": "https://api.elsevier.com/content/object/eid/1-s2.0-S2095495623003789-gr1.jpg?httpAccept=%2A%2F%2A",
            "@multimediatype": "JPEG image file",
            "@type": "IMAGE-DOWNSAMPLED",
            "@size": "155596",
            "@ref": "gr1",
            "@mimetype": "image/jpeg"
          },
          {
            "@category": "thumbnail",
            "@height": "164",
            "@width": "181",
            "@_fa": "true",
            "$": "https://api.elsevier.com/content/object/eid/1-s2.0-S2095495623003789-gr2.sml?httpAccept=%2A%2F%2A",
            "@multimediatype": "GIF image file",
            "@type": "IMAGE-THUMBNAIL",
            "@size": "19786",
            "@ref": "gr2",
            "@mimetype": "image/gif"
          },
          {
            "@category": "thumbnail",
            "@height": "144",
            "@width": "219",
            "@_fa": "true",
            "$": "https://api.elsevier.com/content/object/eid/1-s2.0-S2095495623003789-gr3.sml?httpAccept=%2A%2F%2A",
            "@multimediatype": "GIF image file",
            "@type": "IMAGE-THUMBNAIL",
            "@size": "22435",
            "@ref": "gr3",
            "@mimetype": "image/gif"
          },
          {
            "@category": "thumbnail",
            "@height": "164",
            "@width": "181",
            "@_fa": "true",
            "$": "https://api.elsevier.com/content/object/eid/1-s2.0-S2095495623003789-gr4.sml?httpAccept=%2A%2F%2A",
            "@multimediatype": "GIF image file",
            "@type": "IMAGE-THUMBNAIL",
            "@size": "12865",
            "@ref": "gr4",
            "@mimetype": "image/gif"
          },
          {
            "@category": "thumbnail",
            "@height": "120",
            "@width": "219",
            "@_fa": "true",
            "$": "https://api.elsevier.com/content/object/eid/1-s2.0-S2095495623003789-gr5.sml?httpAccept=%2A%2F%2A",
            "@multimediatype": "GIF image file",
            "@type": "IMAGE-THUMBNAIL",
            "@size": "9752",
            "@ref": "gr5",
            "@mimetype": "image/gif"
          },
          {
            "@category": "thumbnail",
            "@height": "118",
            "@width": "219",
            "@_fa": "true",
            "$": "https://api.elsevier.com/content/object/eid/1-s2.0-S2095495623003789-gr6.sml?httpAccept=%2A%2F%2A",
            "@multimediatype": "GIF image file",
            "@type": "IMAGE-THUMBNAIL",
            "@size": "9038",
            "@ref": "gr6",
            "@mimetype": "image/gif"
          },
          {
            "@category": "thumbnail",
            "@height": "160",
            "@width": "219",
            "@_fa": "true",
            "$": "https://api.elsevier.com/content/object/eid/1-s2.0-S2095495623003789-gr7.sml?httpAccept=%2A%2F%2A",
            "@multimediatype": "GIF image file",
            "@type": "IMAGE-THUMBNAIL",
            "@size": "10676",
            "@ref": "gr7",
            "@mimetype": "image/gif"
          },
          {
            "@category": "thumbnail",
            "@height": "101",
            "@width": "219",
            "@_fa": "true",
            "$": "https://api.elsevier.com/content/object/eid/1-s2.0-S2095495623003789-gr8.sml?httpAccept=%2A%2F%2A",
            "@multimediatype": "GIF image file",
            "@type": "IMAGE-THUMBNAIL",
            "@size": "9404",
            "@ref": "gr8",
            "@mimetype": "image/gif"
          },
          {
            "@category": "thumbnail",
            "@height": "152",
            "@width": "219",
            "@_fa": "true",
            "$": "https://api.elsevier.com/content/object/eid/1-s2.0-S2095495623003789-ga1.sml?httpAccept=%2A%2F%2A",
            "@multimediatype": "GIF image file",
            "@type": "IMAGE-THUMBNAIL",
            "@size": "17277",
            "@ref": "ga1",
            "@mimetype": "image/gif"
          },
          {
            "@category": "thumbnail",
            "@height": "164",
            "@width": "198",
            "@_fa": "true",
            "$": "https://api.elsevier.com/content/object/eid/1-s2.0-S2095495623003789-gr1.sml?httpAccept=%2A%2F%2A",
            "@multimediatype": "GIF image file",
            "@type": "IMAGE-THUMBNAIL",
            "@size": "21697",
            "@ref": "gr1",
            "@mimetype": "image/gif"
          },
          {
            "@category": "high",
            "@height": "2845",
            "@width": "3149",
            "@_fa": "true",
            "$": "https://api.elsevier.com/content/object/eid/1-s2.0-S2095495623003789-gr2_lrg.jpg?httpAccept=%2A%2F%2A",
            "@multimediatype": "JPEG image file",
            "@type": "IMAGE-HIGH-RES",
            "@size": "1083513",
            "@ref": "gr2",
            "@mimetype": "image/jpeg"
          },
          {
            "@category": "high",
            "@height": "2076",
            "@width": "3150",
            "@_fa": "true",
            "$": "https://api.elsevier.com/content/object/eid/1-s2.0-S2095495623003789-gr3_lrg.jpg?httpAccept=%2A%2F%2A",
            "@multimediatype": "JPEG image file",
            "@type": "IMAGE-HIGH-RES",
            "@size": "1182675",
            "@ref": "gr3",
            "@mimetype": "image/jpeg"
          },
          {
            "@category": "high",
            "@height": "2320",
            "@width": "2559",
            "@_fa": "true",
            "$": "https://api.elsevier.com/content/object/eid/1-s2.0-S2095495623003789-gr4_lrg.jpg?httpAccept=%2A%2F%2A",
            "@multimediatype": "JPEG image file",
            "@type": "IMAGE-HIGH-RES",
            "@size": "579174",
            "@ref": "gr4",
            "@mimetype": "image/jpeg"
          },
          {
            "@category": "high",
            "@height": "1876",
            "@width": "3425",
            "@_fa": "true",
            "$": "https://api.elsevier.com/content/object/eid/1-s2.0-S2095495623003789-gr5_lrg.jpg?httpAccept=%2A%2F%2A",
            "@multimediatype": "JPEG image file",
            "@type": "IMAGE-HIGH-RES",
            "@size": "572302",
            "@ref": "gr5",
            "@mimetype": "image/jpeg"
          },
          {
            "@category": "high",
            "@height": "1845",
            "@width": "3425",
            "@_fa": "true",
            "$": "https://api.elsevier.com/content/object/eid/1-s2.0-S2095495623003789-gr6_lrg.jpg?httpAccept=%2A%2F%2A",
            "@multimediatype": "JPEG image file",
            "@type": "IMAGE-HIGH-RES",
            "@size": "439595",
            "@ref": "gr6",
            "@mimetype": "image/jpeg"
          },
          {
            "@category": "high",
            "@height": "2152",
            "@width": "2953",
            "@_fa": "true",
            "$": "https://api.elsevier.com/content/object/eid/1-s2.0-S2095495623003789-gr7_lrg.jpg?httpAccept=%2A%2F%2A",
            "@multimediatype": "JPEG image file",
            "@type": "IMAGE-HIGH-RES",
            "@size": "486874",
            "@ref": "gr7",
            "@mimetype": "image/jpeg"
          },
          {
            "@category": "high",
            "@height": "1580",
            "@width": "3425",
            "@_fa": "true",
            "$": "https://api.elsevier.com/content/object/eid/1-s2.0-S2095495623003789-gr8_lrg.jpg?httpAccept=%2A%2F%2A",
            "@multimediatype": "JPEG image file",
            "@type": "IMAGE-HIGH-RES",
            "@size": "289551",
            "@ref": "gr8",
            "@mimetype": "image/jpeg"
          },
          {
            "@category": "high",
            "@height": "531",
            "@width": "767",
            "@_fa": "true",
            "$": "https://api.elsevier.com/content/object/eid/1-s2.0-S2095495623003789-ga1_lrg.jpg?httpAccept=%2A%2F%2A",
            "@multimediatype": "JPEG image file",
            "@type": "IMAGE-HIGH-RES",
            "@size": "76483",
            "@ref": "ga1",
            "@mimetype": "image/jpeg"
          },
          {
            "@category": "high",
            "@height": "2607",
            "@width": "3150",
            "@_fa": "true",
            "$": "https://api.elsevier.com/content/object/eid/1-s2.0-S2095495623003789-gr1_lrg.jpg?httpAccept=%2A%2F%2A",
            "@multimediatype": "JPEG image file",
            "@type": "IMAGE-HIGH-RES",
            "@size": "1018494",
            "@ref": "gr1",
            "@mimetype": "image/jpeg"
          },
          {
            "@category": "standard",
            "@_fa": "true",
            "$": "https://api.elsevier.com/content/object/eid/1-s2.0-S2095495623003789-mmc1.docx?httpAccept=%2A%2F%2A",
            "@multimediatype": "Microsoft Word file",
            "@type": "APPLICATION",
            "@size": "7354678",
            "@ref": "mmc1",
            "@mimetype": "application/word"
          },
          {
            "@category": "thumbnail",
            "@_fa": "true",
            "$": "https://api.elsevier.com/content/object/eid/1-s2.0-S2095495623003789-si1.svg?httpAccept=%2A%2F%2A",
            "@multimediatype": "Scalable Vector Graphics file",
            "@type": "ALTIMG",
            "@size": "26124",
            "@ref": "si1",
            "@mimetype": "image/svg+xml"
          },
          {
            "@category": "thumbnail",
            "@_fa": "true",
            "$": "https://api.elsevier.com/content/object/eid/1-s2.0-S2095495623003789-si2.svg?httpAccept=%2A%2F%2A",
            "@multimediatype": "Scalable Vector Graphics file",
            "@type": "ALTIMG",
            "@size": "15643",
            "@ref": "si2",
            "@mimetype": "image/svg+xml"
          },
          {
            "@category": "standard",
            "@_fa": "true",
            "$": "https://api.elsevier.com/content/object/eid/1-s2.0-S2095495623003789-am.pdf?httpAccept=%2A%2F%2A",
            "@multimediatype": "Acrobat PDF file",
            "@type": "AAM-PDF",
            "@size": "3840569",
            "@ref": "am",
            "@mimetype": "application/pdf"
          }
        ]
      },
      "link": {
        "@rel": "abstract",
        "@href": "https://api.elsevier.com/content/abstract/scopus_id/85167407651"
      }
    }
  }
}