{
  "metadata": {
    "title": "Trimetallic synergistic optimization of 0D NiCoFe-P QDs anchoring on 2D porous carbon for efficient electrocatalysis and high-energy supercapacitor",
    "authors": "; ; ",
    "journal": "Journal of Energy Chemistry",
    "date": "2022-11-30",
    "doi": "10.1016/j.jechem.2022.07.015",
    "abstract": "",
    "uri": "https://api.elsevier.com/content/article/pii/S2095495622003758",
    "pii": "S2095495622003758"
  },
  "fulltext": {
    "full-text-retrieval-response": {
      "scopus-eid": "2-s2.0-85135405813",
      "originalText": "serial JL 286353 291210 291711 291744 291809 31 Journal of Energy Chemistry JOURNALENERGYCHEMISTRY 2022-07-20 2022-07-20 2022-08-04 2022-08-04 2022-10-19T19:56:36 1-s2.0-S2095495622003758 S2095-4956(22)00375-8 S2095495622003758 10.1016/j.jechem.2022.07.015 S300 S300.1 FULL-TEXT 1-s2.0-S2095495622X00065 2024-06-03T13:21:19.250072Z 0 0 20221101 20221130 2022 2022-07-20T01:30:21.38642Z absattachment articleinfo articletitlenorm authfirstinitialnorm authfirstsurnamenorm cid cids contenttype copyright crossmark dateloaded dateloadedtxt datesearch datesort dateupdated dco docsubtype doctype doi eid ewtransactionid hubeid indexeddate issn issnnorm itemstage itemtransactionid itemweight openaccess openarchive pg pgfirst pglast pii piinorm pubdateend pubdatestart pubdatetxt pubyr sortorder srctitle srctitlenorm srctype ssids alllist content subj subheadings suppl tomb volfirst volissue volumelist webpdf webpdfpagecount yearnav figure e-component body mmlmath acknowledge affil appendices articletitle auth authfirstini authfull authkeywords authlast grantnumber grantsponsor grantsponsorid primabst ref specialabst 2095-4956 20954956 false 74 74 C Volume 74 15 149 158 149 158 202211 November 2022 2022-11-01 2022-11-30 2022 article fla © 2022 Science Press and Dalian Institute of Chemical Physics, Chinese Academy of Sciences. Published by ELSEVIER B.V. and Science Press. All rights reserved. TRIMETALLICSYNERGISTICOPTIMIZATION0DNICOFEPQDSANCHORING2DPOROUSCARBONFOREFFICIENTELECTROCATALYSISHIGHENERGYSUPERCAPACITOR LIU R 1 Introduction 2 Experimental 2.1 Preparation of NiCoFe-ZIF precursor 2.2 Preparation of NiCoFe-P/C 2.3 Materials characterization 2.4 Electrochemical measurements 2.5 Theoretical details 3 Results and discussion 4 Conclusions Acknowledgments Appendix A Supplementary data References PANG 2019 9610 9616 S YAO 2018 1706054 L HUANG 2022 151344 S VERMA 2021 130567 S SINGH 2022 103547 B CHEN 2022 370 379 C TIAN 2021 12088 12101 L VERMA 2020 120527 S VERMA 2021 1045 1052 S WANG 2019 138 148 M VERMA 2020 245401 S LI 2021 310 317 Z ZHANG 2021 2895 2904 L WU 2019 86 95 M ZHANG 2020 71 76 M YANG 2021 356 363 F LI 2019 1902104 Y PAN 2015 13087 13094 Y GONG 2014 23 39 M LIANG 2017 23222 23229 X SURYAWANSHI 2020 234 245 U SHI 2018 510 517 S LIU 2021 47717 47727 R WANG 2021 8832 8843 Y HONG 2018 1800214 W ZHANG 2021 3016 3025 G GUO 2018 1802442 Y YAN 2019 519 527 G KIM 2021 10909 10920 D ZHU 2018 1700603 Y XIAO 2018 4689 4696 X SUN 2018 12101 12104 T WANG 2020 100490 Q TRAN 2021 105861 D ZHANG 2020 23851 23858 R QIU 2018 2360 2369 B XIE 2022 503 510 X LIANG 2020 124976 T XU 2021 26391 26401 S LI 2019 17084 17092 W TANG 2017 1602441 C HAO 2017 5710 5713 S AUGUSTYN 2014 1597 V LIU 2021 157111 Y JIA 2018 254 260 H LI 2017 1605784 B ZHOU 2019 134582 Q LAN 2018 11775 11781 Y ZHAO 2019 1132 1143 Y KOU 2020 590 T ROH 2021 120434 H YOU 1800 11796 111791 B SUN 2022 152197 C LIUX2022X149 LIUX2022X149X158 LIUX2022X149XR LIUX2022X149X158XR 2024-08-04T00:00:00.000Z 2024-08-04T00:00:00.000Z http://creativecommons.org/licenses/by-nc-nd/4.0/ © 2022 Science Press and Dalian Institute of Chemical Physics, Chinese Academy of Sciences. Published by ELSEVIER B.V. and Science Press. All rights reserved. 2022-08-10T00:50:13.219Z http://vtw.elsevier.com/data/voc/AddOnTypes/50.7/aggregated-refined 20YF1416100 STCSM Science and Technology Commission of Shanghai Municipality http://data.elsevier.com/vocabulary/SciValFunders/501100003399 http://sws.geonames.org/1814991 Xidian University XJS211403 Xidian University http://data.elsevier.com/vocabulary/SciValFunders/501100005320 http://sws.geonames.org/1814991/ Shanghai Sailing Program National Natural Science Foundation of China 21703137 NSFC National Natural Science Foundation of China http://data.elsevier.com/vocabulary/SciValFunders/501100001809 http://sws.geonames.org/1814991/ This research was financially supported by the National Natural Science Foundation of China (Grant No. 21703137 ), the Starting Research Funds of Xidian University (Grant No. XJS211403 ), and the Shanghai Sailing Program (Grant No. 20YF1416100). 0 item S2095-4956(22)00375-8 S2095495622003758 1-s2.0-S2095495622003758 10.1016/j.jechem.2022.07.015 286353 2022-10-19T22:26:09.219961Z 2022-11-01 2022-11-30 1-s2.0-S2095495622003758-main.pdf https://s3-eu-west-1.amazonaws.com/prod-ucs-content-store-eu-west/content/pii:S2095495622003758/MAIN/application/pdf/a4d630ba8e112bd26df9e67d5e687e26/main.pdf main.pdf pdf true 3406747 MAIN 10 1-s2.0-S2095495622003758-main_1.png https://s3-eu-west-1.amazonaws.com/prod-ucs-content-store-eu-west/content/pii:S2095495622003758/PREVIEW/image/png/11b513717f93a42f3bdaff855f4aed51/main_1.png main_1.png png 60655 849 656 IMAGE-WEB-PDF 1 1-s2.0-S2095495622003758-ga1.jpg https://s3-eu-west-1.amazonaws.com/prod-ucs-content-store-eu-west/content/pii:S2095495622003758/ga1/DOWNSAMPLED/image/jpeg/9389410102198d51b6fbcaa2c12ce581/ga1.jpg ga1 true ga1.jpg jpg 43366 200 400 IMAGE-DOWNSAMPLED 1-s2.0-S2095495622003758-gr1.jpg https://s3-eu-west-1.amazonaws.com/prod-ucs-content-store-eu-west/content/pii:S2095495622003758/gr1/DOWNSAMPLED/image/jpeg/1f2683557c30dd1ddca939f0b713ca16/gr1.jpg gr1 gr1.jpg jpg 107652 357 533 IMAGE-DOWNSAMPLED 1-s2.0-S2095495622003758-gr2.jpg https://s3-eu-west-1.amazonaws.com/prod-ucs-content-store-eu-west/content/pii:S2095495622003758/gr2/DOWNSAMPLED/image/jpeg/58b672abaf8d368bbb681e4f51ce1d84/gr2.jpg gr2 gr2.jpg jpg 68686 484 383 IMAGE-DOWNSAMPLED 1-s2.0-S2095495622003758-gr3.jpg https://s3-eu-west-1.amazonaws.com/prod-ucs-content-store-eu-west/content/pii:S2095495622003758/gr3/DOWNSAMPLED/image/jpeg/b9a5b04e6fc2799ec0be427a7553337d/gr3.jpg gr3 gr3.jpg jpg 93887 467 534 IMAGE-DOWNSAMPLED 1-s2.0-S2095495622003758-gr4.jpg https://s3-eu-west-1.amazonaws.com/prod-ucs-content-store-eu-west/content/pii:S2095495622003758/gr4/THUMBNAIL/image/jpeg/dc27dc35963902c80dc208c0b28c7544/gr4.jpg gr4 gr4.jpg jpg 72883 403 534 IMAGE-DOWNSAMPLED 1-s2.0-S2095495622003758-gr5.jpg https://s3-eu-west-1.amazonaws.com/prod-ucs-content-store-eu-west/content/pii:S2095495622003758/gr5/DOWNSAMPLED/image/jpeg/6e26f91462672c06bad99b7f1d02eaf8/gr5.jpg gr5 gr5.jpg jpg 74832 334 644 IMAGE-DOWNSAMPLED 1-s2.0-S2095495622003758-gr6.jpg https://s3-eu-west-1.amazonaws.com/prod-ucs-content-store-eu-west/content/pii:S2095495622003758/gr6/DOWNSAMPLED/image/jpeg/9c6643435cf3c0053ab96e082327ed6a/gr6.jpg gr6 gr6.jpg jpg 75271 318 644 IMAGE-DOWNSAMPLED 1-s2.0-S2095495622003758-gr7.jpg https://s3-eu-west-1.amazonaws.com/prod-ucs-content-store-eu-west/content/pii:S2095495622003758/gr7/DOWNSAMPLED/image/jpeg/dc786c5b1f1a02a68001ef5b9701f9b9/gr7.jpg gr7 gr7.jpg jpg 123520 535 534 IMAGE-DOWNSAMPLED 1-s2.0-S2095495622003758-gr8.jpg https://s3-eu-west-1.amazonaws.com/prod-ucs-content-store-eu-west/content/pii:S2095495622003758/gr8/DOWNSAMPLED/image/jpeg/6b52be57bd4ab781daba5fde2c265015/gr8.jpg gr8 gr8.jpg jpg 27812 180 534 IMAGE-DOWNSAMPLED 1-s2.0-S2095495622003758-ga1.sml https://s3-eu-west-1.amazonaws.com/prod-ucs-content-store-eu-west/content/pii:S2095495622003758/ga1/THUMBNAIL/image/gif/5e7c1c4bcceae63bc1151c6f1d5fb62f/ga1.sml ga1 true ga1.sml sml 22650 110 219 IMAGE-THUMBNAIL 1-s2.0-S2095495622003758-gr1.sml https://s3-eu-west-1.amazonaws.com/prod-ucs-content-store-eu-west/content/pii:S2095495622003758/gr1/THUMBNAIL/image/gif/db7963c064b6591fc058c70ebca54572/gr1.sml gr1 gr1.sml sml 27902 147 219 IMAGE-THUMBNAIL 1-s2.0-S2095495622003758-gr2.sml https://s3-eu-west-1.amazonaws.com/prod-ucs-content-store-eu-west/content/pii:S2095495622003758/gr2/THUMBNAIL/image/gif/161ff928121412c3506e48cab225ec32/gr2.sml gr2 gr2.sml sml 10326 163 129 IMAGE-THUMBNAIL 1-s2.0-S2095495622003758-gr3.sml https://s3-eu-west-1.amazonaws.com/prod-ucs-content-store-eu-west/content/pii:S2095495622003758/gr3/THUMBNAIL/image/gif/3864a1eca5eb275e8d0f9739f1ec1471/gr3.sml gr3 gr3.sml sml 14787 164 187 IMAGE-THUMBNAIL 1-s2.0-S2095495622003758-gr4.sml https://s3-eu-west-1.amazonaws.com/prod-ucs-content-store-eu-west/content/pii:S2095495622003758/gr4/THUMBNAIL/image/gif/4c6ad7dc766ca0a1455d0d9d6a091e14/gr4.sml gr4 gr4.sml sml 15680 164 217 IMAGE-THUMBNAIL 1-s2.0-S2095495622003758-gr5.sml https://s3-eu-west-1.amazonaws.com/prod-ucs-content-store-eu-west/content/pii:S2095495622003758/gr5/THUMBNAIL/image/gif/690906889d0266391331c9fbe794d431/gr5.sml gr5 gr5.sml sml 11118 114 219 IMAGE-THUMBNAIL 1-s2.0-S2095495622003758-gr6.sml https://s3-eu-west-1.amazonaws.com/prod-ucs-content-store-eu-west/content/pii:S2095495622003758/gr6/THUMBNAIL/image/gif/d55d527f344c99c7a62fd906d2107f59/gr6.sml gr6 gr6.sml sml 11426 108 219 IMAGE-THUMBNAIL 1-s2.0-S2095495622003758-gr7.sml https://s3-eu-west-1.amazonaws.com/prod-ucs-content-store-eu-west/content/pii:S2095495622003758/gr7/DOWNSAMPLED/image/gif/dc36bd32c14738805bcafcf35078fc47/gr7.sml gr7 gr7.sml sml 14198 164 164 IMAGE-THUMBNAIL 1-s2.0-S2095495622003758-gr8.sml https://s3-eu-west-1.amazonaws.com/prod-ucs-content-store-eu-west/content/pii:S2095495622003758/gr8/DOWNSAMPLED/image/gif/bb0001b5fc4b79198730340033bea00d/gr8.sml gr8 gr8.sml sml 6415 74 219 IMAGE-THUMBNAIL 1-s2.0-S2095495622003758-ga1_lrg.jpg https://s3-eu-west-1.amazonaws.com/prod-ucs-content-store-eu-west/content/pii:S2095495622003758/HIGHRES/image/jpeg/c96d0e403b587f73431d44d69ff994f8/ga1_lrg.jpg ga1 true ga1_lrg.jpg jpg 142991 531 1062 IMAGE-HIGH-RES 1-s2.0-S2095495622003758-gr1_lrg.jpg https://s3-eu-west-1.amazonaws.com/prod-ucs-content-store-eu-west/content/pii:S2095495622003758/HIGHRES/image/jpeg/03c5d393aee5ed04477df80e8821343e/gr1_lrg.jpg gr1 gr1_lrg.jpg jpg 498648 986 1473 IMAGE-HIGH-RES 1-s2.0-S2095495622003758-gr2_lrg.jpg https://s3-eu-west-1.amazonaws.com/prod-ucs-content-store-eu-west/content/pii:S2095495622003758/THUMBNAIL/image/jpeg/0410e076fe767ac72ffd5b9c44159990/gr2_lrg.jpg gr2 gr2_lrg.jpg jpg 390343 2142 1695 IMAGE-HIGH-RES 1-s2.0-S2095495622003758-gr3_lrg.jpg https://s3-eu-west-1.amazonaws.com/prod-ucs-content-store-eu-west/content/pii:S2095495622003758/HIGHRES/image/jpeg/43f895076991e822cfb1ef4cb8908f2a/gr3_lrg.jpg gr3 gr3_lrg.jpg jpg 507568 2069 2364 IMAGE-HIGH-RES 1-s2.0-S2095495622003758-gr4_lrg.jpg https://s3-eu-west-1.amazonaws.com/prod-ucs-content-store-eu-west/content/pii:S2095495622003758/HIGHRES/image/jpeg/68303bd23ad7f23b7cbe4430bca0ee98/gr4_lrg.jpg gr4 gr4_lrg.jpg jpg 419763 1782 2364 IMAGE-HIGH-RES 1-s2.0-S2095495622003758-gr5_lrg.jpg https://s3-eu-west-1.amazonaws.com/prod-ucs-content-store-eu-west/content/pii:S2095495622003758/HIGHRES/image/jpeg/c9d0e554d9cf2a7093addf55e923f7c9/gr5_lrg.jpg gr5 gr5_lrg.jpg jpg 410917 1480 2852 IMAGE-HIGH-RES 1-s2.0-S2095495622003758-gr6_lrg.jpg https://s3-eu-west-1.amazonaws.com/prod-ucs-content-store-eu-west/content/pii:S2095495622003758/HIGHRES/image/jpeg/6803df4f70d4fb619f760bc3b2ae25c4/gr6_lrg.jpg gr6 gr6_lrg.jpg jpg 431199 1407 2850 IMAGE-HIGH-RES 1-s2.0-S2095495622003758-gr7_lrg.jpg https://s3-eu-west-1.amazonaws.com/prod-ucs-content-store-eu-west/content/pii:S2095495622003758/HIGHRES/image/jpeg/f466f2fb467678939c950c1921e76f32/gr7_lrg.jpg gr7 gr7_lrg.jpg jpg 704587 2367 2364 IMAGE-HIGH-RES 1-s2.0-S2095495622003758-gr8_lrg.jpg https://s3-eu-west-1.amazonaws.com/prod-ucs-content-store-eu-west/content/pii:S2095495622003758/THUMBNAIL/image/jpeg/2f3a6332c50c234dd92dc92d07072b27/gr8_lrg.jpg gr8 gr8_lrg.jpg jpg 182560 795 2364 IMAGE-HIGH-RES 1-s2.0-S2095495622003758-mmc1.pdf https://s3-eu-west-1.amazonaws.com/prod-ucs-content-store-eu-west/content/pii:S2095495622003758/mmc1/MAIN/application/pdf/c20ea12d931b1e976128f8bb673bf64b/mmc1.pdf mmc1 mmc1.pdf pdf false 4710455 APPLICATION 1-s2.0-S2095495622003758-si1.svg https://s3-eu-west-1.amazonaws.com/prod-ucs-content-store-eu-west/content/pii:S2095495622003758/STRIPIN/image/svg+xml/43417a641031a531d2c7bdc1b735d184/si1.svg si1 si1.svg svg 4202 ALTIMG 1-s2.0-S2095495622003758-am.pdf https://s3-eu-west-1.amazonaws.com/prod-ucs-content-store-eu-west/content/egi:100S3BT0VNF/MAIN/application/pdf/0b6cf3628fc4c6683fed30ee1419c36c/am.pdf am am.pdf pdf false 1785207 AAM-PDF JECHEM 2656 S2095-4956(22)00375-8 10.1016/j.jechem.2022.07.015 Science Press and Dalian Institute of Chemical Physics, Chinese Academy of Sciences Fig. 1 (a) SEM, (b) TEM, inset is the particle size distribution, and (c) HRTEM images of NiCoFe-C. (d) SEM, (e) TEM, inset is the particle size distribution, and (f) HRTEM images of NiCoFe-P/C. (g) Elemental mapping images of NiCoFe-P/C. Fig. 2 (a) XRD and (b) Raman patterns of NiCoFe-P/C. XPS spectra of NiCoFe-P/C: (c) Ni 2p, (d) Co 2p, (e) Fe 2p, and (f) P 2p. Fig. 3 (a) LSV and (b) Tafel plots of NiCoFe-P/C. (c) The capacitive currents at −0.95 V (vs. RHE) against the scan rate. (d) LSV and (e) Tafel plots of NiCoFe-P/C. (f) TOF of NiCoFe-P/C. (g) Chronoamperometry curves of NiCoFe-P/C at −1.12 and 0.60 V. Inset is the LSV curves of the NiCoFe-P/C before and after chronoamperometric stability tests. (h) Overpotentials of NiCoFe-P/C. Fig. 4 (a) Polarization curves of overall water splitting for different samples at a scan rate of 5 mV s−1. (b) Long-term stability test of NiCoFe-P/C//NiCoFe-P/C at 1.55 V. (c) A comparison of cell potential between this work and reported electrolyzers. Fig. 5 (a) CV curves and (b) GCD curves of NiCoFe-ZIF (2:1), NiCoFe-C (2:1), and NiCoFe-P/C (2:1). (c) Cycle stability at 40 mA cm−2 of NiCoFe-P/C (2:1). Inset is the last 10 cycles. Kinetics of storage behavior of NiCoFe-P/C (2:1). (d) Capacitive contribution (orange lines) at a scan rate of 6 mV s−1. (e) log i vs. log v plots of cathodic and anodic peak. (f) Contribution ratio of capacitive (orange) and diffusion-controlled (black) process. Fig. 6 (a) CV curves of NiCoFe-P/C (2:1) and AC. (b) CV curves, (c) GCD curves, and (d) EIS curves of the HSC device. (e) Cycle stability at 15 A g−1. Inset is the last 10 cycles. (f) Ragone plots. Inset is the photograph of LED powered by NiCoFe-P/C (2:1)||AC. Fig. 7 (a) The total DOS of bulk Ni-ZIF, NiO, and Ni2P. (b) The projected DOS of Ni d orbitals in Ni-ZIF, the p orbitals of surface O atoms in NiO(200) and surface P atoms in Ni2P(111), and the d orbitals of surface Ni atoms in NiO(200) and Ni2P(111). (c) ELF of NiO(200) and Ni2P(111). The most stable OH adsorption configuration and corresponding adsorption energy on (d) Ni-ZIF, (e) NiO(200), and (f) Ni2P(111). (g) The energy profiles of HER and corresponding the most stable H adsorption configurations on Ni-ZIF, NiO(200), and Ni2P(111). (h) The initial step of HER in alkaline solution. Scheme 1 Illustration for the synthesis process of NiCoFe-ZIF, NiCoFe-C, and NiCoFe-P/C. Trimetallic synergistic optimization of 0D NiCoFe-P QDs anchoring on 2D porous carbon for efficient electrocatalysis and high-energy supercapacitor Ruiqi Liu a Xue-Rong Shi a ⁎ Yi Wen a Xiaoxuan Shao a Chen Su b Jing Hu c Shusheng Xu a ⁎ a School of Materials Engineering, Shanghai University of Engineering Science, Shanghai 201620, China School of Materials Engineering Shanghai University of Engineering Science Shanghai 201620 China School of Materials Engineering, Shanghai University of Engineering Science, Shanghai 201620, China b School of Advanced Materials and Nanotechnology, Xidian University, Xi’an 710071, Shaanxi, China School of Advanced Materials and Nanotechnology Xidian University Xi’an 710071 Shanxi China School of Advanced Materials and Nanotechnology, Xidian University, Xi’an 710071, Shanxi, China c School of Materials Science and Engineering, Suzhou University of Science and Technology, Suzhou 215009, Jiangsu, China School of Materials Science and Engineering Suzhou University of Science and Technology Suzhou 215009 Jiangsu China School of Materials Science and Engineering, Suzhou University of Science and Technology, Suzhou 215009, Jiangsu, China ⁎ Corresponding authors. Graphical abstract A gradient temperature construction of 0D/2D heterostructure with NiCoFe-P quantum dots anchoring on porous carbon for highly efficient overall water splitting and supercapacitor. Developing multi-functional and low-cost noble-metal-free catalysts such as transition metal phosphides (TMPs) to replace noble-metal is of practical significance for energy conversion and storage. However, the low-durability and the agglomeration phenomenon during the electrochemical process limit their practical applications. Herein, using metal–organic frameworks (MOFs) as the precursor and a combined strategy of gradient temperature calcination and thermal phosphorization, a 0D/2D heterostructure of NiCoFe-P quantum dots (QDs) anchored on porous carbon was successfully developed as highly efficient electrode materials for overall water splitting and supercapacitors. Owing to this distinctive 0D/2D heterostructure and the synergistic effect of multi-metallic TMPs, the NiCoFe-P/C exhibits excellent electrocatalytic activity and durability of HER (87 mV at 10 mA cm−2) and OER (257 mV at 100 mA cm−2) in the KOH electrolyte. When NiCoFe-P/C is used as the two electrodes of electrolyzed water, only 1.55 V can drive the current density to 10 mA cm−2. At the same time, our NiCoFe-P/C possessed extraordinary property for charge storage. In particular, an ultra-high energy density of 100.8 Wh kg−1 was achieved at a power density of 900.0 W kg−1 for our assembled hybrid supercapacitor device NiCoFe-P/C (2:1)//activated carbon (AC). This work may open a potential way for the design of 0D/2D hybrid multi-functional nanomaterials based on TMPs QDs. Keywords Metal-organic frameworks Transition metal phosphide quantum dots 0D/2D heterostructure Overall water splitting Supercapacitor First-principle calculations 1 Introduction Due to the high calorific value of hydrogen and excellent energy storage performance, electrochemical overall water splitting and supercapacitor play a crucial role in the coming energy revolution, promoting the transition to a sustainable and carbon neutral society [1–6]. Finding clean, cheap, and sustainable electrode materials is a critical strategy to achieve highly efficient energy conversion and storage. Pt and RuO2/IrO2 are ideal materials for electrocatalytic hydrogen evolution reactions (HER) and oxygen evolution reactions (OER), which can effectively reduce the overpotential of the electrochemical reaction process [7]. Nevertheless, the scarcity and the high-cost limit their extensive application. Similar problems also appear for energy storage electrode materials [8,9]. In this regard, more and more researchers have made efforts to explore a series of non-noble transition metal-based compounds including metal oxides [10], hydroxides [11], sulfides [12], selenides [13], nitrides [14], and phosphides [15] for highly efficient overall water splitting and supercapacitor. Among potential candidates mentioned above, transition metal phosphides (TMPs) such as Ni2P, CoP, and FeP have got increasing interests due to their high conductivity, abundant earth reserves, and adjustable electronic structures [16]. However, the poor exposure ratio of active sites and unsatisfactory stability limits the application of TMPs as electrode for electrocatalytic water splitting and supercapacitors. To overcome these problems, many improvement methods have been proposed including interfacial engineering, elemental doping, structural engineering, phase modification, and nanocarbon incorporation [17]. Liu et al. have successfully synthesized Ni2P/CNT nanohybrid with excellent electrocatalytic activity due to the unexpected synergistic effect between Ni2P nanocrystals and nitrogen-doped rGO [18]. They found that the high conductivity of Ni and P is necessary to enhance the catalytic activity of HER. Metal-organic frameworks (MOFs) are excellent precursors for preparing metal phosphides due to their high porosity and structural tunability, and the multi-metal phosphides obtained by this method can inherit the rich porous structure with abundant active sites for electrochemical reactions [19]. Recently, Chen et al. found that the existence of Ni2P/CoP interfaces in their synthesized Ni2P-CoP bimetallic phosphides by using MOFs as precursors is necessary for delivering the synergistic effect and enhancing electrocatalytic activity [20]. These discoveries are of great significance to the rational design and development of multi-component electrocatalysts for energy conversion and energy storage devices with high performances. However, the precise regulation of such heterogeneous interfaces is still challenging. Heterostructures based on 0D and 2D are particularly interesting in interface engineering. In the 0D/2D heterostructure, a very intimate interface is constructed through direct physical contact between the two phases. The physicochemical properties at the interface are quite different from the bulk phase. The strong interface interaction triggers the redistribution of electrons at the heterogeneous interface and consequently affects the reaction kinetics, conductivity, and adsorption energy of the intermediates. For instance, Kim et al. used a robust solution-phase and facile ex-situ sonication to form a 0D@2D Ni2P@NSG heterostructure [21]. Consequently, Ni2P@NSG electrocatalysts present high catalytic activity toward HER and OER in an alkaline electrolyte. Zhao et al. reported a Ni2P@NPC heterostructure with a strong coupling effect. The mutual stabilization of monodispersed TMPs nanocrystals and carbon nanosheets (NSs) makes the electrode material exhibit excellent electrochemical energy storage characteristics [22]. Nevertheless, there are few studies about 0D quantum dots (QDs), especially polymetallic phosphide QDs, interacting with 2D NSs to enhance electrocatalysis and energy storage properties have been reported. Based on the above analysis and our previous work [23], we herein propose a simple and unique design scheme to uniformly anchor TMPs QDs (<10 nm) on porous carbon NSs forming a special 0D/2D heterostructure. Using MOFs as precursors, low-dimensional and uniformly distributed QDs supported on 2D NSs were obtained through a gradient temperature calcination process. Subsequently, the obtained NiCoFe-P/C after thermal phosphating with a 0D/2D heterostructure shows super electrochemical performances in the electrocatalytic water splitting (including HER and OER) and supercapacitor. The obtained NiCoFe-P/C electrode presents impressive catalytic performances with an overpotential of 87 mV at 10 mA cm−2 for HER, 257 mV at 100 mA cm−2 for OER, and 34 h of stable running. The NiCoFe-P/C//NiCoFe-P/C electrolyzer only requires 1.55 V to reach the current density of 10 mA cm−2. In addition, the NiCoFe-P/C (2:1) can deliver an areal capacitance as high as 6.3 F cm−2 at 2 mA cm−2. Our work provides an inspiring synthesis strategy for the future application of multi-metallic phosphides with 0D/2D heterostructures in HER, OER, and supercapacitors. 2 Experimental 2.1 Preparation of NiCoFe-ZIF precursor The NiCoFe-ZIF precursor is in-situ grown on Ni foam (NF) first. All chemicals with analytical-grade were directly used without further processing. NF (1 × 1 cm2) was pretreated in 1 M HCl for 30 min, and then washed with deionized water (DI) and ethanol for 15 min, respectively. In a typical solvothermal process, Ni(NO3)2·6H2O (0.75 mmol), Co(NO3)2·6H2O (0.75 mmol), and Fe(NO3)3·9H2O (0.1 mmol) were dispersed in 17.5 mL methanol, and magnetically stirred to form a homogeneous solution. Similarly, C4H6N2 (4 mmol) was dissolved in 17.5 mL methanol, and after stirring, the obtained ligand solution was added to the methanol solution containing the mixed metal salts. After magnetic stirring for 20 min, the mixed solution and a piece of NF were placed in an autoclave and heated at 180 °C for 6 h. After cooling to room temperature, it was washed with DI and ethanol. Then, dried over night at 60 °C. The ratios of nickel salt and cobalt salt of 8:1, 2:1, 1:2, and 1:8 were considered to verify the effect of different ion ratios on the properties of composite materials. 2.2 Preparation of NiCoFe-P/C The NiCoFe-P/C 0D/2D heterostructure was fabricated by carbonization and phosphorization process of NiCoFe-ZIF precursors. A piece of NF supported NiCoFe-ZIF was annealed in N2 at 450 °C for 2 h with a heating rate of 1.5 °C min−1, and after cooling down to room temperature, the NiCoFe-C was obtained. Then the sample was once again annealed and phosphated at 350 °C for 2 h under N2 atmosphere with a heating rate of 4 °C min−1, using NaH2PO2 as the phosphorus source. To ensure that the precursor is completely phosphatized, the NaH2PO2 is in excess (5.7 mmol). The mass loading of NiCoFe-P/C was about 4.3–4.8 mg cm−2. In order to explore the impact of the carbonization process on the material structure, NiCoFe-P/C-d was prepared for comparison, which was obtained by directly phosphating NiCoFe-ZIF without the carbonization process. 2.3 Materials characterization Ultra-55 Scanning Electron Microscope (SEM) from Zeiss Company and Tecnai G2 F20 Transmission Electron Microscope (TEM) from FEI Company were used to observe the morphological characteristics of the materials. Crystal structure and phase composition of the product are identified by X-ray diffraction (XRD, X'Pert Pro) measurements. The element content and chemical bond formed on the surface of the product are revealed by X-ray photoelectron spectroscopy (XPS, Thermo K-Alpha+). In this research, Raman spectroscopy with 532 nm excitation laser was employed to confirm the composition of the products. 2.4 Electrochemical measurements All electrochemical tests were performed in 1 M KOH electrolyte (pH=14) using the electrochemical workstation (Chenhua CHI660E, Shanghai, China). First, HER and OER performances were tested using a three-electrode system. The synthesized material supported on NF was directly used as the working electrode. Ag/AgCl and carbon rod were used as a reference electrode and a counter electrode, respectively. Catalytic performance tests include linear sweep voltammetry (LSV) at a scan rate of 5 mV s−1 and electrochemical impedance spectroscopy (EIS) at frequencies of 0.1–100 kHz in a fixed potential window. Cyclic voltammetry (CV) curves were plotted at different scan rates (20, 40, 60, 80, and 100 mV s−1) to estimate the double-layer capacitance (C dl). Chronopotentiometry was conducted to test the stability of the samples under a fixed potential window. Moreover, CV curves, galvanostatic charge/discharge (GCD) curves, and EIS were used to verify the energy storage characteristics of as-fabricated nanomaterials. We used the traditional three-electrode system. Hg/HgO and platinum sheets were used as reference and counter electrodes, respectively. The NiCoFe-P/C (2:1) was used as anode and activated carbon (AC) was used as cathode to assemble the hybrid supercapacitor (HSC). Each EIS spectrum was fitted using the suggested equivalent circuit by the Zview program. The electrochemical calculation details were listed in the supporting information (SI). 2.5 Theoretical details The Vienna ab-initio simulation package (VASP) was used to perform the density functional theory (DFT) calculations. The parameters used are provided in SI. The ( 3 × 2 ) of the NiO(200) surface and (1 × 1) of Ni2P(111) with the close surface area are employed to perform the calculations. These two surfaces are clearly revealed in the XRD patterns with strong peak intensity and high resolution TEM (HRTEM) images. The following XPS analysis also shows that the content of Ni in the composites is higher than that of Fe or Co. Therefore, the Ni-series, namely, Ni-ZIF, NiO, and Ni2P, are chosen to perform the calculations. 3 Results and discussion Creating unique heterostructure structures based on interface engineering technology plays a key role in material modification. Herein, NiCoFe-P/C with a special 0D/2D (QDs/NSs) heterostructure was obtained by the combined strategy of solvothermal reaction and low-temperature calcination (Scheme 1 ). Initially, NiCoFe-ZIF NSs were obtained by the self-assembly between Ni2+, Co2+, Fe3+, and C4H6N2 to form coordination bonds. Then carbonization was carried out at 450 °C under N2 atmosphere, in which the carbon source comes from the ligand. After carbonization, the metal/metal oxide nanoparticles were uniformly supported on the carbon NSs. The carbon layer contains a small amount of N element, and the nitrogen source comes from the organic ligand as well. Different from the commonly used temperature in other reported works (≥700 °C) [24], a relatively low temperature, 450 °C, the most suitable temperature for our system, was taken to fulfill the carbonization. This low temperature treatment avoided the diffusion and agglomeration of nanoparticles caused by high temperature and effectively retained the porous structure of the precursor. At last, using NaH2PO4 as the phosphorus source, uniformly dispersed TMPs QDs were obtained on the surface of the porous carbon NSs under a slow heating rate, and some carbons were partially graphitized induced by the surrounding metal phosphide [25]. SEM and TEM were first performed to demonstrate the uniqueness of the sample in structure and morphology. Ultra-thin NiCoFe-ZIF (Fig. S1a and b) NSs were in-situ grown on the surface of NF uniformly, forming a crossed network and curled morphology, which is consistent with our previous research [23]. As illustrated in Fig. 1 (a–c), after the low temperature carbonization treatment, the 2D NSs morphology was still retained in NiCoFe-C (Fig. 1a). The main part of this sample was carbon that derived from the organic ligand. Furthermore, a more detailed description of the morphology and the interface structure of NiCoFe-C was presented in TEM (Fig. 1b). The dark nanoparticles anchored on the surface of porous carbon were metal/metal oxide QDs evolved from metal ions, which can be proved by the following XRD and HRTEM. The size of these QDs was mainly distributed around 8 nm. A lattice spacing of 0.203 nm is identified in the HRTEM, which matches well with the (111) plane of Ni, Co, and Fe crystals (Fig. 1c). To obtain the direct evidence for the existence of metal/metal oxide QDs, XRD of NiCoFe-C powder (without NF) was tested (Fig. S2). The subsequent XPS results (Fig. S7) reveal the existence of O elements in the prepared NiCoFe-ZIF precursor, which could be transformed to metal oxide during the carbonization process. After phosphating process, the 0D/2D heterostructure was fully reserved, in which metal atoms and metal oxides were converted into metal phosphide QDs and the carbon layer still acted as a protective layer and a substrate to maintain the dispersed state of the QDs (Fig. 1d and e). The size of the metal phosphides QDs is about 6–8 nm, which is a little smaller than that of metal/metal oxide QDs. The interplanar spacing of 0.221, 0.283, and 0.346 nm can be assigned to the (111), (011), and (001) planes of Ni2P, CoP, and Fe2P, respectively (Fig. 1f). The energy dispersive element mapping in Fig. 1(g) demonstrates the existence and uniform distribution of C, P, Co, Fe, and Ni. The porous properties of NiCoFe-P/C were further identified by the N2 adsorption/desorption isotherm. As shown in Fig. S1(c and d), the specific surface area of NiCoFe-P/C is 85.03 m2 g−1. In addition, the microporous and mesoporous nanostructure of polymetallic phosphides with an average pore size distribution of 36.26 nm was further demonstrated by the Barrett-Joyner-Halenda (BJH) model. Given above, it is believed that NiCoFe-P QDs anchored on the porous carbon with multiple interfaces derived from MOFs have been successfully synthesized. In order to prove the importance of low-temperature carbonization process, NiCoFe-P/C-d, the product of direct phosphating the NiCoFe-ZIF precursor without the carbonization step, was also obtained for comparison. As revealed in Fig. S3(a–d), although the NiCoFe-P/C-d presents the similar 0D/2D heterostructure to the NiCoFe-P/C, a significant overlap between the carbon NSs and an obviously agglomeration between the TMPs QDs were observed. This further validates the advancement and ingenuity of the gradient temperature calcination strategy. The unique morphology will inevitably bring the surprising electrochemical performance to the composite material. To reveal the synergistic effect between different metal phosphides and obtain chemical state of the sample, XRD, Raman, and XPS were further performed. As depicted in Fig. 2 (a), the broad carbon diffraction peaks can be clearly observed in the XRD patterns of NiCoFe-C and NiCoFe-P/C. The fine diffraction peaks at 40.7°, 47.3°, 54.2°, 54.9°, and 74.6° were in perfect agreement with the (111), (210), (300), (211), and (400) surfaces of Ni2P [26]. Regardless of the strong diffraction peak of NF, the highest intensity diffraction peak, corresponding to the (111) crystal plane of Ni2P, is detected, which indicates that the optimal orientation is formed along the (111) direction in the NiCoFe-P/C heterostructure. To eliminate the influence of NF on the peak intensity, the XRD pattern of the final product at 10°–40° was tested (Fig. S4). The peak positions matched with the XRD patterns of CoP and Fe2P, which is consistent with the observation of TEM [25]. The XRD peaks of NiCoFe-P/C-d are similar to that of NiCoFe-P/C, but the peak intensity is weaker, in which the peak at 74.6° almost disappears (Fig. S5a). This may be due to the rapid phosphating process reducing the crystallinity of NiCoFe-P. Moreover, the evolution of carbon during the low-temperature carbonization is proved by the Raman spectroscopy (Fig. 2b). The characteristic peaks of NiCoFe-C were detected at about 1363 and 1583 cm−1, which result from the carbonization of dimethylimidazole. For NiCoFe-P/C, two characteristic peaks at about 1358 and 1585 cm−1 correspond to the D-band and G-band of graphene, which comes from the vibration of the defects and sp 2 hybridized carbon atoms, respectively. It is noting that the ratio of I G/I D in NiCoFe-P/C is higher than that in NiCoFe-C, indicating that more graphite carbons exist in NiCoFe-P/C than in NiCoFe-C. Namely, the presence of metal phosphides induced the formation of nearby graphite carbons during the phosphating process. The abundant graphite carbons are conductive to improve the conductivity of as-fabricated nanomaterials. It should be noted that the direct phosphorization of NiCoFe-ZIF to obtain NiCoFe-P/C-d may be associated with the carbonization processes simultaneously at 350 °C. However, the detected G peak of NiCoFe-P/C-d (Fig. S5b) is quite weak, indicating that the carbonization process is incomplete. Meanwhile, the I D/I G ratio of NiCoFe-P/C is higher than that of NiCoFe-P/C-d, suggesting NiCoFe-P/C may have abundant defects and expose more active sites for electrochemical reactions. XPS was further employed to analyze the electronic structure of the samples. The XPS survey spectrum of NiCoFe-P/C reveals the presence of the expected Ni, Co, Fe, C, N, and P (Fig. S6 and Table S1). As shown in Fig. 2(c), the Ni 2p 3/2 and Ni 2p 1/2 spectrum of NiCoFe-P/C can be deconvoluted to Ni3+ (859.9 and 877.1 eV) and Ni2+ (856.8 and 874.3 eV) in Ni-O, respectively [26]. The peaks at 853.5 and 870.8 eV come from the Ni-P along with the satellite peaks at 863.4 and 880.5 eV. The binding energy (BE) of Ni in Ni2P is slightly lower than that of Ni2+, indicating that the valence of Ni x + in Ni2P is 0 < x < 2. The Co 2p spectrum can be deconvoluted into two spin–orbit doublets (Fig. 2d) [27]. The first double peaks located at 777.4 and 792.0 eV were assigned to the stretching vibrations of the Co–P bond. The second double peaks at 782.0 (Co 2p 3/2) and 798.2 eV (Co 2p 1/2) were caused by the partial oxidation of the sample in air. Satellite peaks were detected at 786.3 and 803.3 eV. For Fe 2p spectrum (Fig. 2e), the peaks at 707.2 and 719.7 eV were characterized by Fe–P bonds [28]. The peaks at 710.8 and 723.4 eV can be attributed to surface Fe–O bonds. The other two peaks were attributed to satellite peaks. The high-resolution P 2p spectrum in Fig. 2(f) shows three peaks at 134.5, 133.7, and 129.8 eV, corresponding to P–O and M–P [29]. The results fully demonstrate the transformation of metals/metal oxides into metal phosphides. In addition, the XPS spectra of NiCoFe-ZIF and NiCoFe-C were shown in Figs. S7 and S8, which further provides evidence for the evolution of materials. Electrochemical tests were performed to evaluate the catalytic performance of NiCoFe-P/C, NiCoFe-ZIF, NiCoFe-C, NF, and reference electrode. As shown in Fig. 3 (a), the overpotential of NiCoFe-P/C is only 87 mV at the current density of 10 mA cm−2, which is much lower than those of NF (η 10 = 257 mV), NiCoFe-ZIF (η 10 = 234 mV), and NiCoFe-C (η 10 = 197 mV). NiCoFe-P/C exhibits the lowest overpotential, which is comparable to that of Pt/C. The superior HER performance of NiCoFe-P/C may be attributed to the co-contribution of the interfacial effect of the unique heterostructure and the synergistic effect of different metal phosphides. For NiCoFe-P/C, Ni species is considered to be the main active center. CoP and Fe2P QDs can adjust the electronic activity of the electrocatalysts [27]. The uniformly distributed ultra-thin carbon NSs favor the transmission of electrons, making NiCoFe-P/C exhibit high-conductivity (Fig. S9). As shown in Fig. 3(b and c), the calculated values of the Tafel slope and electrochemical active surface area (ECSA) further reveal the HER kinetic mechanism of the material. The Tafel slope of NiCoFe-P/C (80 mV dec–1) is smaller than those of NiCoFe-ZIF (167 mV dec–1) and NiCoFe-C (151 mV dec–1). Generally, HER is triggered by the Volmer (120 mV dec–1) step, and following this, it may proceed via a Heyrovsky (40 mV dec–1) step or a Tafel (30 mV dec–1) reaction. According to the obtained Tafel slope, the HER process on the NiCoFe-P/C electrode occurs through the Volmer-Heyrovsky mechanism, where the rate-determining step is the electrochemical desorption [30]. HER in the alkaline environment requires an additional water splitting reaction to provide H+ for the subsequent HER, which places higher requirements to the catalyst. The cleavage of the O–H bond in water molecules is promoted by the metal phosphides (Ni2P, CoP, and Fe2P) compared with the meta oxides precursor, which greatly improves the HER efficiency of NiCoFe-P/C under alkaline conditions, and this is confirmed by the following DFT calculations. The double layer capacitance (C dl) (Fig. 3c) was also calculated by using the CV curves under the narrow potential window (Fig. S10) and accordingly the ECSA was estimated to provide the ECSA-normalized LSV curves in Fig. S11. The C dl value of NiCoFe-P/C is about 21.3 m F cm−2, which is much higher than those of NiCoFe-ZIF (3.8 m F cm−2) and NiCoFe-C (7.4 m F cm−2). These results prove that NiCoFe-P/C possesses more active sites for the catalytic reaction than other fabricated samples. The disorder nature of interfaces between the poly-metal phosphides in the heterostructure leads to the increased reactivity and boots the generation and desorption of H2 at high current densities. Furthermore, NiCoFe-P/C also exhibited higher OER activity than NiCoFe-ZIF and NiCoFe-C, as shown in Fig. 3(d). At current densities of 50 and 100 mA cm−2, the overpotential of the NiCoFe-P/C is 254 and 257 mV, respectively. The overpotential is only increased by 3 mV, which means NiCoFe-P/C has ultra-fast reaction kinetics and high charge transfer efficiency. The Tafel slope of NiCoFe-P/C is only 20 mV dec–1, which is significantly lower than other catalysts including commercial electrode RuO2 (Fig. 3e). The OER reaction is considered to be a four-electron transfer process. The mechanism is very complicated, and its slow reaction kinetics process is an important factor hindering the efficiency of water electrolysis. Due to the unique 0D/2D heterostructure of NiCoFe-P/C, more reactive sites at the edge are exposed than other materials, which promotes the kinetics of the catalytic reaction. To explore the intrinsic activity, the turnover frequency (TOF) of the material was calculated to further illustrate the dynamic advantages of the material. The TOF of NiCoFe-P/C is as high as 1.36 s−1, which is much higher than other samples. These experimental results essentially show that the 0D/2D heterostructure with multiple components is very beneficial for exposing abundant active sites and thus improving the electrocatalytic activity. More importantly, the excellent durability of catalyst is also required for its practical application. The stability of the material was detected by the chronoamperometry measurement. Notably, the current density of the material basically unchanged during the 34 h test under a high voltage. No matter it is at a positive or negative voltage, the catalytic stability of NiCoFe-P/C is higher than those of NiCoFe-ZIF and NiCoFe-C (Fig. 3g and Fig. S12). In specific, we compared the LSV curves before and after the measurement, the overpotential value barely changes after the durability test and the structure also keeps well, as confirmed by XRD (Fig. S13). Fig. 3(h) presented a 3D histogram based on the LSV curves of NiCoFe-ZIF, NiCoFe-C, and NiCoFe-P/C to illustrate the overpotential of the samples under different current densities. Moreover, comparing the electrocatalytic properties of different phosphide materials in Tables S2 and S3, our NiCoFe-P/C also exhibits the competitive electrocatalytic performance. The catalytic performance of NiCoFe-P/C-d was also tested to illustrate the advantages of the gradient temperature carbonization strategy. For both HER and OER performances, NiCoFe-P/C-d exhibits inferior catalytic activities to NiCoFe-P/C with the higher overpotential and larger Tafel slope (Fig. S14). The difference of catalytic performances between NiCoFe-P/C-d and NiCoFe-P/C mainly comes from the changes in morphology and structure. The direct phosphorization process leads to the overlap of NSs and the agglomeration of nanoparticles, which greatly reduces the dispersibility of the nanoparticles, and the deterioration of performance is inevitable. The proportion of metal ions was also an important indicator for regulating electrochemical performance. Keeping the iron salt content unchanged, the content of nickel and cobalt salts in the precursor was adjusted. Similarly, a two-step calcination method was used to prepare metal phosphides with different nickel and cobalt ratios. The products were labeled as NiCoFe-P/C (8:1), NiCoFe-P/C (2:1), NiCoFe-P/C (1:2), and NiCoFe-P/C (1:8). According to the LSV, Tafel, EIS, and C dl results, when the ratio of Ni/Co is 8:1, 2:1, 1:2, and 1:8, the electrocatalytic performance of the hybrid materials is inferior to that of NiCoFe-P/C with Ni/Co ratio of 1:1 (Figs. S15 and S16). Thus, the suitable metal ratio is important for tuning the electronic structure of the nanocomposites and thus improving the electrocatalytic performance. Meanwhile, the change of morphology also affects its performance to a certain extent. All samples still maintain the original NSs structure, however, the NSs tend to agglomerate slightly, so some large nanoparticles are formed (Fig. S17). Fig. S18 shows the XRD patterns of the four samples. Compared with NiCoFe-P/C, no significant change in peak position was detected. Furthermore, a two-electrode electrolyzer was assembled by using the NiCoFe-P/C as a bifunctional electrocatalyst for overall water splitting. Only 1.55 V is required to obtain a current density of 10 mA cm−2, which is smaller than those of NiCoFe-C and NiCoFe-ZIF, suggesting NiCoFe-P/C has great application potential (Fig. 4 a). Additionally, under a fixed voltage, the chronoamperometry was performed to evaluate the stability of NiCoFe-P/C. The NiCoFe-P/C||NiCoFe-P/C electrolyzer can support the overall water splitting over 24 h with a slightly reduced activity, indicating the excellent durability of the 0D/2D NiCoFe-P/C heterostructure material (Fig. 4b). The recent achievements of TMPs used in water splitting are provided in Fig. 4(c) for comparison [31–42]. Obviously, our as-fabricated 0D/2D NiCoFe-P/C delivers super catalytic performances, outperforming most of reported relevant materials. Different from the scenario of the OER or HER catalytic performance, the NiCoFe-P/C (2:1) electrode exhibits the best energy storage characteristics among all the prepared composites. This may be due to that when the ratio of nickel and cobalt is 2:1, the two metal ions achieve the best electronic coordination effect and exhibit the best electrochemical performance. The similar phenomenon was also observed in our previous work for NiCo-based sulfides, where bimetallic sulfides exhibit the highest energy storage performance at the ratio of nickel to cobalt of 2:1 [23]. NiCoFe-ZIF (2:1), NiCoFe-C (2:1), and NiCoFe-P/C (2:1) electrode materials present similar CV curves with obvious redox peaks at a scan rate of 6 mV s−1 (Fig. 5 a). NiCoFe-P/C presented a higher redox peak than pure NF, which indicates that the electrochemical activity is mainly provided by the polymetallic phosphides rather than NF. For NiCoFe-P/C (2:1), as the scan rate increased, the redox peak positions shifted to the two ends respectively, while the curve shape maintained well, indicating that the material has good charge and discharge reversibility (Fig. S19a). When the scan rate is increased to 8 mV s−1, the redox peak becomes inconspicuous. This is because electrons cannot fully enter the interior of the material under the high current density. Fig. 5(b) and Fig. S19(b) list the GCD curves of NiCoFe-P/C (2:1). Clearly, the curves exhibit a relatively symmetric shape and an obvious discharge platform. At the current densities of 2 and 20 mA cm−2, the areal capacitances of the NiCoFe-P/C (2:1) electrode are 6.3 and 3.2 F cm−2, respectively, yielding a rate performance of 50.8% (Fig. S19c). The NiCoFe-P/C (2:1) electrode presented higher charge storage capacity than other TMPs (Table S4). During the charging and discharging process, the solution resistance (R s) and the charge transfer resistance (R ct) will hinder the diffusion and transfer of electrons. NiCoFe-P/C (2:1) owns a low R s (1.408 Ω) and R ct (0.106 Ω), which is also one of the reasons for its ultra-high areal capacitance (Fig. S19d). Benefiting from the unique 0D/2D heterostructure, NiCoFe-P/C possesses the largest charge storage capacity and the fastest electron diffusion and transfer channels among the considered materials. At a high current density of 40 mA cm−2, the cycle performance shows that after 5000 charge–discharge cycles, the capacitance loss is 16.5% (Fig. 5c). For comparison, Fig. S20 provides the CV and GCD curves of NiCoFe-P/C (8:1), NiCoFe-P/C (1:1), NiCoFe-P/C (1:2), and NiCoFe-P/C (1:8) to prove that the proper ratio of Ni and Co is essential for tuning the electrochemical performance. The energy storage mechanism of NiCoFe-P/C (2:1) was analyzed in Fig. 5(d–f). According to previous reports [43], the charge storage process includes the capacitance control (k 1 v, orange part) and diffusion control process (k 2 v 1/2, black part). The capacitance contribution rate and peak current are positively and exponentially correlated with the scan rate, respectively. The calculated b value of the cathodic and anodic peaks of NiCoFe-P/C is 0.5702 and 0.6195, respectively, indicating that the energy storage of NiCoFe-P/C presents both the battery and pseudocapacitance type characteristics. A further analysis (Fig. 5f) reveals that the energy storage is dominated by the diffusion process. The excellent performance of NiCoFe-P/C may come from the following aspects. (1) NiCoFe-P/C (2:1) is tightly combined with NF substrate, which helps electron transport in the electrochemical process. (2) Mixed metal phosphides have diverse ion valences, providing many possibilities for redox reactions. (3) The strong electronic coupling in the 0D/2D heterostructure brings the small resistance and enhanced stability to the material. Furthermore, the electrochemical performances of the HSC assembled by NiCoFe-P/C (2:1) and AC were shown in Fig. 6 (a–f). The mass loading of the anode (4.6 mg) and cathode (16.2 mg) of the HSC device is reasonably matched according to Eq. (8) in SI. Fig. 6(a) shows the CV curves of the anode and cathode at the scan rate of 2 mV s−1, and the voltage windows are 0–0.6 V and −1.0–0 V, respectively. To explore the optimal voltage window of the HSC device, the CV curve of the device under different voltage conditions was checked. When the voltage reaches 1.8 V, the CV curve is still not significantly deformed (Fig. S21a). Under this voltage, the actual energy storage of the device was further evaluated. The CV curves of the device at different scan rates are shown in Fig. 6(b). The faint redox peaks in the curve can be observed, indicating that the device has the characteristics of both electric double-layer capacitance and pseudocapacitance. The GCD curves and capacitance retention rate were also detected in Fig. 6(c) and Fig. S21(b). The GCD curves of the HSC device under different current densities of 1 to10 A g−1 also show a non-standard triangular shape, which is consistent with the CV curves. Electrochemical impedance is an important parameter for supercapacitors. According to the analysis of the impedance data on the equivalent circuit, the values of R s and R ct were 0.679 and 4.504 Ω, respectively (Fig. 6d). The small semicircle diameter in the high-frequency region and the large slope in the low-frequency region verified the good conductivity of the material and fast charge transfer at the interface, resulting the excellent electrochemical performances of HSC devices. The low resistance may originate from the special porous 0D/2D structure, which provides abundant active sites and reaction interfaces. Not surprisingly, the HSC device shows excellent stability (Fig. 6e). After 10,000 cycles of the GCD test, the specific capacitance of the material maintains 98.2% of the initial value. The Ragone diagram of the HSC device is shown in Fig. 6(f). The HSC device reaches an energy density of 100.8 Wh kg−1 at 900 W kg−1. When the maximum power density is 9000 W kg−1, the energy density still remained at 50.5 Wh kg−1. The performances of our assembled HSC surpass the recently reported studies [44–49]. Besides, the ultra-high energy density can support the light emitting diode (LED) to light up for about 1 min at 1.8 V. To comprehend the origin behind the electrochemical performances of various as-fabricated materials, the electronic properties and corresponding reaction mechanisms were explored by the DFT calculations. According to the above XRD, XPS, and HRTEM results, the Ni-series, namely, Ni-ZIF, NiO, and Ni2P are chosen to shed a light on the catalytic nature of these composites. As revealed in Fig. 7 (a), the band gap of the bulk materials is ordered of Ni-ZIF > NiO > Ni2P. The bulk Ni-ZIF and NiO show semiconductor properties with the band gaps of about 2.1 and 1.8 eV, respectively, while the Ni2P shows metallic characteristics with some states across the Fermi level. Consequently, Ni2P is expected to exhibit the best electronic conductivity, which is followed by NiO. This is consistent with the above EIS results and previous experimental and theoretical observations [50–52]. The projected density of states (PDOS) calculations reveals that more states appear near the Fermi level for Ni2P(111) compared to the other systems. According to our previous calculation [53], the closer d or p band center to the Fermi level means the stronger bonding strength to the adsorbates, which is confirmed by the cases of OH and H adsorption. As shown in Fig. 7(d–g), the H and OH adsorption strength decreases in the sequence of adsorbates-Ni2P(111) > adsorbates-NiO(200) > adsorbates-Ni-ZIF (The more negative the adsorption energy E ads value, the stronger adsorption it is). The strongest H adsorption on the hollow site formed by three surface Ni atoms on Ni2P(111) yields the closest |ΔG| value to 0 (Fig. 7g), suggesting its best HER performance, in line well with the experimental observation. Similarly, the OH adsorption, which is strongly related to the capacitive behavior of the as-fabricated materials by involving in the faradaic process, is thermodynamically preferred on Ni2P(111) over on the NiO(200) and Ni-ZIF. Notably, besides the d orbitals of surface Ni, the p orbitals of surface O in NiO(200) and surface P atoms in Ni2P(111) show up near/at the Fermi level as well, indicating that their contributions to the electronic conductivity and adsorbing the reaction species can be ignored. For instance, the most favorable H adsorption site on NiO is the top site of surface O. And OH prefers to locate at the top site of surface P on Ni2P(111). Moreover, the calculated electron localization function (ELF) shows that the surface electrons of NiO(200) are delocalized compared to those of Ni2P(111), where the electron cloud (in green) does not appear until the isosurface value equals 0.67 (Isosurface value = 1.0 means that the electron is totally localized). At this value, the electrons localized near the O atoms of NiO(200) and P atoms of Ni2P(111) arise, suggesting that these atoms show the trend to form covalent band with the adsorbates. As mentioned in the above discussion of the experimental results, HER in the alkaline environment requires an additional water splitting reaction to provide H+ for the subsequent HER. The calculation starts with H2O adsorption and its following dissociation to produce co-adsorbed H and OH. It is found that H2O adsorption on Ni2P(111) is slightly less stable than that on NiO(200) with the E ads of −0.27 vs. −0.46 eV for the most stable H2O adsorption configuration on the top site of surface Ni [50–52]. This is different from the scenarios of H and OH adsorption, which can be attributed to the extra formed H bond between the H2O molecule and surface O of NiO(200). Although H2O shows the slightly favorable adsorption on NiO(200), its following dissociation requires to cross a much higher reaction barrier than that on Ni2P(111) (1.97 vs. 1.35 eV, Fig. 7h and Fig. S23). Note that when the dissociation of H2O begins from its adsorption on the second most stable site on Ni2P(111), a top site of another surface Ni with E ads of −0.20 eV (Fig. 7h, only 0.07 eV higher than the most stable one). The dissociation barrier is reduced to be 0.78 eV. Apparently, the cleavage of the O–H bond in water molecules is promoted by Ni2P compared to the NiO, which greatly improves the HER efficiency of NiCoFe-P/C under alkaline conditions. 4 Conclusions In summary, we have proposed a simple and controllable gradient temperature calcination method to anchor 0D TMPs QDs on 2D porous carbon NSs. The formed NiCoFe-P/C exhibits excellent electrocatalytic activities and durability of HER and OER in the KOH electrolyte with η 10 of 87 mV for HER and η 100 of 257 mV for OER, respectively. Both of them can work steadily for 34 h at the high voltage. The assembled NiCoFe-P/C//NiCoFe-P/C electrolyzer exhibited superior overall water splitting characteristics (1.55 V at 10 mA cm−2). More importantly, an HSC device assembled with commercial AC and NiCoFe-P/C (2:1) reached an ultra-high energy density of 100.8 Wh kg−1 at the powder density of 900.0 W kg−1. This dual-function feature mainly comes from the designed unique 0D/2D heterostructure and the synergistic effect between the components in poly-metal phosphides. First, the rich porous structure inheriting from the MOFs precursor and the 0D shape of phosphides guarantee a large specific surface area to expose massive reactive sites. Secondly, a variety of metal phosphides derived from multi-metal MOFs, including Ni2P, CoP, and Fe2P, provide various types of active sites for the electrochemical reaction and the synergistic effect between the components promotes the kinetic process of catalysis and energy storage. In addition, the monodispersed nature of NiCoFe-P QDs avoids the overlapping and contact between the particles, thereby reducing the agglomeration in the process of chemical reactions and results in the excellent stability. We expect that the comprehensive utilization of the synergistic effects between the components and the unique 0D/2D heterostructure emphasized in this work may inaugurate a new way to explore cost-effective and multi-functional electrode materials. Declaration of competing interest The authors declare that they have no known competing financial interests or personal relationships that could have appeared to influence the work reported in this paper. Acknowledgments This research was financially supported by the National Natural Science Foundation of China (Grant No. 21703137), the Starting Research Funds of Xidian University (Grant No. XJS211403), and the Shanghai Sailing Program (Grant No. 20YF1416100). Appendix A Supplementary data Supplementary data to this article can be found online at https://doi.org/10.1016/j.jechem.2022.07.015. Appendix A Supplementary data The following are the Supplementary data to this article: Supplementary data 1 References [1] S.Y. Pang Y.T. Wong S. Yuan Y. Liu M.K. Tsang Z. Yang H. Huang W.T. Wong J. Hao J. Am. Chem. Soc. 141 2019 9610 9616 S.Y. Pang, Y.T. Wong, S. Yuan, Y. Liu, M.K. Tsang, Z. Yang, H. Huang, W.T. Wong, J. Hao, J. Am. Chem. Soc. 141 (2019) 9610–9616. [2] L. Yao Q. Wu P.X. Zhang J.M. Zhang D.R. Wang Y.L. Li X.Z. Ren H.W. Mi L.B. Deng Z.J. Zheng Adv. Mater. 30 2018 1706054 L. Yao, Q. Wu, P.X. Zhang, J.M. Zhang, D.R. Wang, Y.L. Li, X.Z. Ren, H.W. Mi, L.B. Deng, Z.J. Zheng, Adv. Mater. 30 (2018) 1706054. [3] S.M. Huang X.-R. Shi C.Y. Sun X.R. Zhang M.R. Huang R.Q. Liu H. Wang S.S. Xu Appl. Surf. Sci. 572 2022 151344 C.R. Zhu, A.L. Wang, W. Xiao, D.L. Chao, X. Zhang, N.H. Tiep, S. Chen, J.N. Kang, X. Wang, J. Ding, J. Wang, H. Zhang, H.J. Fan, Adv. Mater. 30 (2018) 1705516. [4] S. Verma S. Arya V. Gupta A. Khosla Chem. Eng. J. 424 2021 130567 S. Verma, S. Arya, V. Gupta, A. Khosla, Chem. Eng. J. 424 (2021) 130567. [5] B. Singh B. Padha S. Verma S. Satapathi V. Gupta S. Arya J. Energy Storage 47 2022 103547 B. Singh, B. Padha, S. Verma, S. Satapathi, V. Gupta, S. Arya, J. Energy Storage 47 (2022) 103547. [6] C. Chen H.T. Zhu M.J. Shi L.T. Hu Z.Q. Xue H. Ye L.P. Zhao C. Yan Energy Stor. Mater. 49 2022 370 379 C. Chen, H.T. Zhu, M.J. Shi, L.T. Hu, Z.Q. Xue, H. Ye, L.P. Zhao, C. Yan, Energy Stor. Mater. 49 (2022) 370–379. [7] L. Tian Z. Li M. Song J. Li Nanoscale 13 2021 12088 12101 L. Tian, Z. Li, M. Song, J. Li, Nanoscale 13 (2021) 12088–12101. [8] S. Verma A. Khosla S. Arya J. Electrochem. Soc. 167 2020 120527 S. Verma, A. Khosla, S. Arya, J. Electrochem. Soc. 167 (2020) 120527. [9] S. Verma B. Padha A. Singh S. Khajuria A. Sharma P. Mahajan B. Singh S. Arya Fuller. Nanotub. Car. N. 29 2021 1045 1052 S. Verma, B. Padha, A. Singh, S. Khajuria, A. Sharma, P. Mahajan, B. Singh, S. Arya, Fuller. Nanotub. Car. N. 29 (2021) 1045–1052. [10] M.M. Wang S.M. Li Y. Lv X. Zhou J. Energy Chem. 33 2019 138 148 M.M. Wang, S.M. Li, Y. Lv, X. Zhou, J. Energy Chem. 33 (2019) 138–148. [11] S. Verma V. Gupta A. Khosla S. Kumar S. Arya Nanotechnology 31 2020 245401 S. Verma, V. Gupta, A. Khosla, S. Kumar, S. Arya, Nanotechnology 31 (2020) 245401. [12] Z. Li W. Wang M.J. Zhou B.H. He W.Q. Ren L. Chen W.Y. Xu Z.H. Hou Y.Y. Chen J. Energy Chem. 54 2021 310 317 Z. Li, W. Wang, M.J. Zhou, B.H. He, W.Q. Ren, L. Chen, W.Y. Xu, Z.H. Hou, Y.Y. Chen, J. Energy Chem. 54 (2021) 310–317. [13] L.L. Zhang Y.T. Lei D.N. Zhou C.L. Xiong Z.L. Jiang X.Y. Li H.S. Shang Y.F. Zhao W.X. Chen B. Zhang Nano Res. 15 2021 2895 2904 L.L. Zhang, Y.T. Lei, D.N. Zhou, C.L. Xiong, Z.L. Jiang, X.Y. Li, H.S. Shang, Y.F. Zhao, W.X. Chen, B. Zhang, Nano Res. 15 (2021) 2895–2904. [14] M.J. Wu G.X. Zhang J.L. Qiao N. Chen W.F. Chen S.H. Sun Nano Energy 61 2019 86 95 M.J. Wu, G.X. Zhang, J.L. Qiao, N. Chen, W.F. Chen, S.H. Sun, Nano Energy 61 (2019) 86–95. [15] M.R. Zhang T.T. Wang H.Y. Cao S.S. Cui P.W. Du J. Energy Chem. 42 2020 71 76 M.R. Zhang, T.T. Wang, H.Y. Cao, S.S. Cui, P.W. Du, J. Energy Chem. 42 (2020) 71–76. [16] F. Yang Y.N. Shen Z. Cen J. Wan S.J. Li G.J. He J.Q. Hu K.B. Xu Sci. China Mater. 65 2021 356 363 F. Yang, Y.N. Shen, Z. Cen, J. Wan, S.J. Li, G.J. He, J.Q. Hu, K.B. Xu, Sci. China Mater. 65 (2021) 356–363. [17] Y. Li Z. Dong L.F. Jiao Adv. Energy Mater. 10 2019 1902104 Y. Li, Z. Dong, L.F. Jiao, Adv. Energy Mater. 10 (2019) 1902104. [18] Y. Pan W.H. Hu D.P. Liu Y.Q. Liu C.G. Liu J. Mater. Chem. A 3 2015 13087 13094 Y. Pan, W.H. Hu, D.P. Liu, Y.Q. Liu, C.G. Liu, J. Mater. Chem. A 3 (2015) 13087–13094. [19] M. Gong H.J. Dai Nano Res. 8 2014 23 39 M. Gong, H.J. Dai, Nano Res. 8 (2014) 23–39. [20] X. Liang B.X. Zheng L.G. Chen J.T. Zhang Z.B. Zhuang B.H. Chen ACS Appl. Mater. Interfaces 9 2017 23222 23229 X. Liang, B.X. Zheng, L.G. Chen, J.T. Zhang, Z.B. Zhuang, B.H. Chen, ACS Appl. Mater. Interfaces 9 (2017) 23222–23229. [21] U.P. Suryawanshi U.V. Ghorpade D.M. Lee M. He S.W. Shin P.V. Kumar J.S. Jang H.R. Jung M.P. Suryawanshi J.H. Kim Chem. Mater. 33 2020 234 245 U.P. Suryawanshi, U.V. Ghorpade, D.M. Lee, M. He, S.W. Shin, P.V. Kumar, J.S. Jang, H.R. Jung, M.P. Suryawanshi, J.H. Kim, Chem. Mater. 33 (2020) 234–245. [22] S.S. Shi Z.P. Li Y. Sun B. Wang Q.N. Liu Y.L. Hou S.F. Huang J.Y. Huang Y.F. Zhao Nano Energy 48 2018 510 517 S.S. Shi, Z.P. Li, Y. Sun, B. Wang, Q.N. Liu, Y.L. Hou, S.F. Huang, J.Y. Huang, Y.F. Zhao, Nano Energy 48 (2018) 510–517. [23] R.Q. Liu S.S. Xu X.X. Shao Y. Wen X.R. Shi L.P. Huang M. Hong J. Hu Z. Yang ACS Appl. Mater. Interfaces 13 2021 47717 47727 R.Q. Liu, S.S. Xu, X.X. Shao, Y. Wen, X.R. Shi, L.P. Huang, M. Hong, J. Hu, Z. Yang, ACS Appl. Mater. Interfaces 13 (2021) 47717–47727. [24] Y.N. Wang Z.J. Yang D.H. Yang L. Zhao X.R. Shi G.C. Yang B.H. Han ACS Appl. Mater. Interfaces 13 2021 8832 8843 Y.N. Wang, Z.J. Yang, D.H. Yang, L. Zhao, X.R. Shi, G.C. Yang, B.H. Han, ACS Appl. Mater. Interfaces 13 (2021) 8832–8843. [25] W. Hong M. Kitta Q. Xu Small Methods 2 2018 1800214 W. Hong, M. Kitta, Q. Xu, Small Methods 2 (2018) 1800214. [26] G.X. Zhang Y.L. Li X. Xiao Y. Shan Y. Bai H.G. Xue H. Pang Z.Q. Tian Q. Xu Nano Lett. 21 2021 3016 3025 G.X. Zhang, Y.L. Li, X. Xiao, Y. Shan, Y. Bai, H.G. Xue, H. Pang, Z.Q. Tian, Q. Xu, Nano Lett. 21 (2021) 3016–3025. [27] Y. Guo J. Tang Z. Wang Y. Sugahara Y. Yamauchi Small 14 2018 1802442 Y. Guo, J. Tang, Z. Wang, Y. Sugahara, Y. Yamauchi, Small 14 (2018) 1802442. [28] G. Yan H.Q. Tan Y.H. Wang Y.G. Li Appl. Surf. Sci. 489 2019 519 527 G. Yan, H.Q. Tan, Y.H. Wang, Y.G. Li, Appl. Surf. Sci. 489 (2019) 519–527. [29] D. Kim Y. Jeong H. Roh C. Lim K. Yong J. Mater. Chem. A 9 2021 10909 10920 D. Kim, Y. Jeong, H. Roh, C. Lim, K. Yong, J. Mater. Chem. A 9 (2021) 10909–10920. [30] Y.P. Zhu G. Chen Y.J. Zhong W. Zhou Z.P. Shao Adv. Sci. 5 2018 1700603 Y.P. Zhu, G. Chen, Y.J. Zhong, W. Zhou, Z.P. Shao, Adv. Sci. 5 (2018) 1700603. [31] X. Xiao D. Huang Y.Q. Fu M. Wen X.X. Jiang X.W. Lv M. Li L. Gao S.S. Liu M.K. Wang C. Zhao Y. Shen ACS Appl. Mater. Interfaces 10 2018 4689 4696 X. Xiao, D. Huang, Y.Q. Fu, M. Wen, X.X. Jiang, X.W. Lv, M. Li, L. Gao, S.S. Liu, M.K. Wang, C. Zhao, Y. Shen, ACS Appl. Mater. Interfaces 10 (2018) 4689–4696. [32] T.T. Sun S.L. Zhang L.B. Xu D.S. Wang Y.D. Li Chem. Commun. 54 2018 12101 12104 T.T. Sun, S.L. Zhang, L.B. Xu, D.S. Wang, Y.D. Li, Chem. Commun. 54 (2018) 12101–12104. [33] Q. Wang H. Wang X. Cheng M. Fritz D. Wang H. Li A. Bund G. Chen P. Schaaf Mater. Today Energy 17 2020 100490 Q. Wang, H. Wang, X. Cheng, M. Fritz, D. Wang, H. Li, A. Bund, G. Chen, P. Schaaf, Mater. Today Energy 17 (2020) 100490. [34] D.T. Tran H.T. Le V.H. Hoa N.H. Kim J.H. Lee Nano Energy 84 2021 105861 D.T. Tran, H.T. Le, V.H. Hoa, N.H. Kim, J.H. Lee, Nano Energy 84 (2021) 105861. [35] R. Zhang R.L. Zhu Y. Li Z. Hui Y.Y. Song Y.L. Cheng J.J. Lu Nanoscale 12 2020 23851 23858 R. Zhang, R.L. Zhu, Y. Li, Z. Hui, Y.Y. Song, Y.L. Cheng, J.J. Lu, Nanoscale 12 (2020) 23851–23858. [36] B.L. Qiu A.L. Han D.C. Jiang T.T. Wang P.W. Du ACS Sustain. Chem. Eng. 7 2018 2360 2369 B.L. Qiu, A.L. Han, D.C. Jiang, T.T. Wang, P.W. Du, ACS Sustain. Chem. Eng. 7 (2018) 2360-2369. [37] X.-Q. Xie J.P. Liu C.N. Gu J.J. Li Y. Zhao C.-S. Liu J. Energy Chem. 64 2022 503 510 X.-Q. Xie, J.P. Liu, C.N. Gu, J.J. Li, Y. Zhao, C.-S. Liu, J. Energy Chem. 64 (2022) 503–510. [38] T.T. Liang Y.D. Liu P.F. Zhang C.T. Liu F. Ma Q.Y. Yan Z.F. Dai Chem. Eng. J. 395 2020 124976 T.T. Liang, Y.D. Liu, P.F. Zhang, C.T. Liu, F. Ma, Q.Y. Yan, Z.F. Dai, Chem. Eng. J. 395 (2020) 124976. [39] S.J. Xu Y. Qi Y.K. Lu S.C. Sun Y. Liu D.L. Jiang Int. J. Hydrog. Energy 46 2021 26391 26401 S.J. Xu, Y. Qi, Y.K. Lu, S.C. Sun, Y. Liu, D.L. Jiang, Int. J. Hydrog. Energy 46 (2021) 26391–26401. [40] W.P. Li G. Cheng M. Sun Z.X. Wu G.L. Liu D.S. Su B. Lan S.X. Mai L.Y. Chen L. Yu Nanoscale 11 2019 17084 17092 W.P. Li, G. Cheng, M. Sun, Z.X. Wu, G.L. Liu, D.S. Su, B. Lan, S.X. Mai, L.Y. Chen, L. Yu, Nanoscale 11 (2019) 17084–17092. [41] C. Tang R. Zhang W.B. Lu L.B. He X. Jiang A.M. Asiri X.P. Sun Adv. Mater. 29 2017 1602441 C. Tang, R. Zhang, W.B. Lu, L.B. He, X. Jiang, A.M. Asiri, X.P. Sun, Adv. Mater. 29 (2017) 1602441. [42] S. Hao L.B. Yang D.N. Liu R.M. Kong G. Du A.M. Asiri Y.C. Yang X.P. Sun Chem. Commun. 53 2017 5710 5713 S. Hao, L.B. Yang, D.N. Liu, R.M. Kong, G. Du, A.M. Asiri, Y.C. Yang, X.P. Sun, Chem. Commun. 53 (2017) 5710–5713. [43] V. Augustyn P. Simon B. Dunn Energy Environ. Sci. 7 2014 1597 V. Augustyn, P. Simon, B. Dunn, Energy Environ. Sci. 7 (2014) 1597. [44] Y. Liu X. Zhang K. Matras-Postolek P. Yang J. Alloy. Compd. 854 2021 157111 Y. Liu, X. Zhang, K. Matras-Postolek, P. Yang, J. Alloy. Compd. 854 (2021) 157111. [45] H. Jia Q. Li C. Li Y.Y. Song H.R. Zheng J.G. Zhao W.Y. Zhang X.M. Liu Z.L. Liu Y. Liu Chem. Eng. J. 354 2018 254 260 H. Jia, Q. Li, C. Li, Y.Y. Song, H.R. Zheng, J.G. Zhao, W.Y. Zhang, X.M. Liu, Z.L. Liu, Y. Liu, Chem. Eng. J. 354 (2018) 254–260. [46] B. Li P. Gu Y.C. Feng G.X. Zhang K.S. Huang H.G. Xue H. Pang Adv. Funct. Mater. 27 2017 1605784 B. Li, P. Gu, Y.C. Feng, G.X. Zhang, K.S. Huang, H.G. Xue, H. Pang, Adv. Funct. Mater. 27 (2017) 1605784. [47] Q.F. Zhou Y. Gong K.Y. Tao Electrochim. Acta 320 2019 134582 Q.F. Zhou, Y. Gong, K.Y. Tao, Electrochim. Acta 320 (2019) 134582. [48] Y.Y. Lan H.Y. Zhao Y. Zong X.H. Li Y. Sun J. Feng Y. Wang X.L. Zheng Y.P. Du Nanoscale 10 2018 11775 11781 Y.Y. Lan, H.Y. Zhao, Y. Zong, X.H. Li, Y. Sun, J. Feng, Y. Wang, X.L. Zheng, Y.P. Du, Nanoscale 10 (2018) 11775–11781. [49] Y. Zhao M. Zhao X. Ding Z.R. Liu H. Tian H.H. Shen X.T. Zu S. Li L. Qiao Chem. Eng. J. 373 2019 1132 1143 Y. Zhao, M. Zhao, X. Ding, Z.R. Liu, H. Tian, H.H. Shen, X.T. Zu, S. Li, L. Qiao, Chem. Eng. J. 373 (2019) 1132–1143. [50] T. Kou M. Chen F. Wu T.J. Smart S. Wang Y. Wu Y. Zhang S. Li S. Lall Z. Zhang Y.S. Liu J. Guo G. Wang Y. Ping Y. Li Nat. Commun. 11 2020 590 T. Kou, M. Chen, F. Wu, T.J. Smart, S. Wang, Y. Wu, Y. Zhang, S. Li, S. Lall, Z. Zhang, Y.S. Liu, J. Guo, G. Wang, Y. Ping, Y. Li, Nat. Commun. 11 (2020) 590. [51] H. Roh H. Jung H. Choi J.W. Han T. Park S. Kim K. Yong Appl. Catal. B 297 2021 120434 H. Roh, H. Jung, H. Choi, J.W. Han, T. Park, S. Kim, K. Yong, Appl. Catal. B 297 (2021) 120434. [52] B. You Y. Zhang Y. Jiao K. Davey S.Z. Qiao Angew. Chem. Int. Ed. 58 2019 1800 11796 111791 B. You, Y. Zhang, Y. Jiao, K. Davey, S.Z. Qiao, Angew. Chem. Int. Ed. 58 (2019) 11796–11800. [53] C.Y. Sun Z.C. Duan P.J. Wang X.R. Zhang M.R. Huang F. Cao W.S. Lin H. Wang Y.Y. Chen X.-R. Shi Appl. Surf. Sci. 580 2022 152197 C.Y. Sun, Z.C. Duan, P.J. Wang, X.R. Zhang, M.R. Huang, F. Cao, W.S. Lin, H. Wang, Y.Y. Chen, X.-R. Shi, Appl. Surf. Sci. 580 (2022) 152197.",
      "scopus-id": "85135405813",
      "coredata": {
        "eid": "1-s2.0-S2095495622003758",
        "dc:description": "Developing multi-functional and low-cost noble-metal-free catalysts such as transition metal phosphides (TMPs) to replace noble-metal is of practical significance for energy conversion and storage. However, the low-durability and the agglomeration phenomenon during the electrochemical process limit their practical applications. Herein, using metal–organic frameworks (MOFs) as the precursor and a combined strategy of gradient temperature calcination and thermal phosphorization, a 0D/2D heterostructure of NiCoFe-P quantum dots (QDs) anchored on porous carbon was successfully developed as highly efficient electrode materials for overall water splitting and supercapacitors. Owing to this distinctive 0D/2D heterostructure and the synergistic effect of multi-metallic TMPs, the NiCoFe-P/C exhibits excellent electrocatalytic activity and durability of HER (87 mV at 10 mA cm−2) and OER (257 mV at 100 mA cm−2) in the KOH electrolyte. When NiCoFe-P/C is used as the two electrodes of electrolyzed water, only 1.55 V can drive the current density to 10 mA cm−2. At the same time, our NiCoFe-P/C possessed extraordinary property for charge storage. In particular, an ultra-high energy density of 100.8 Wh kg−1 was achieved at a power density of 900.0 W kg−1 for our assembled hybrid supercapacitor device NiCoFe-P/C (2:1)//activated carbon (AC). This work may open a potential way for the design of 0D/2D hybrid multi-functional nanomaterials based on TMPs QDs.",
        "openArchiveArticle": "false",
        "prism:coverDate": "2022-11-30",
        "openaccessUserLicense": null,
        "prism:aggregationType": "Journal",
        "prism:url": "https://api.elsevier.com/content/article/pii/S2095495622003758",
        "dc:creator": [
          {
            "@_fa": "true",
            "$": "Liu, Ruiqi"
          },
          {
            "@_fa": "true",
            "$": "Shi, Xue-Rong"
          },
          {
            "@_fa": "true",
            "$": "Wen, Yi"
          },
          {
            "@_fa": "true",
            "$": "Shao, Xiaoxuan"
          },
          {
            "@_fa": "true",
            "$": "Su, Chen"
          },
          {
            "@_fa": "true",
            "$": "Hu, Jing"
          },
          {
            "@_fa": "true",
            "$": "Xu, Shusheng"
          }
        ],
        "link": [
          {
            "@_fa": "true",
            "@rel": "self",
            "@href": "https://api.elsevier.com/content/article/pii/S2095495622003758"
          },
          {
            "@_fa": "true",
            "@rel": "scidir",
            "@href": "https://www.sciencedirect.com/science/article/pii/S2095495622003758"
          }
        ],
        "dc:format": "application/json",
        "openaccessType": null,
        "pii": "S2095-4956(22)00375-8",
        "prism:volume": "74",
        "prism:publisher": "Science Press and Dalian Institute of Chemical Physics, Chinese Academy of Sciences. Published by ELSEVIER B.V. and Science Press.",
        "dc:title": "Trimetallic synergistic optimization of 0D NiCoFe-P QDs anchoring on 2D porous carbon for efficient electrocatalysis and high-energy supercapacitor",
        "prism:copyright": "© 2022 Science Press and Dalian Institute of Chemical Physics, Chinese Academy of Sciences. Published by ELSEVIER B.V. and Science Press. All rights reserved.",
        "openaccess": "0",
        "prism:issn": "20954956",
        "dcterms:subject": [
          {
            "@_fa": "true",
            "$": "Metal-organic frameworks"
          },
          {
            "@_fa": "true",
            "$": "Transition metal phosphide quantum dots"
          },
          {
            "@_fa": "true",
            "$": "0D/2D heterostructure"
          },
          {
            "@_fa": "true",
            "$": "Overall water splitting"
          },
          {
            "@_fa": "true",
            "$": "Supercapacitor"
          },
          {
            "@_fa": "true",
            "$": "First-principle calculations"
          }
        ],
        "openaccessArticle": "false",
        "prism:publicationName": "Journal of Energy Chemistry",
        "openaccessSponsorType": null,
        "prism:pageRange": "149-158",
        "prism:endingPage": "158",
        "pubType": "fla",
        "prism:coverDisplayDate": "November 2022",
        "prism:doi": "10.1016/j.jechem.2022.07.015",
        "prism:startingPage": "149",
        "dc:identifier": "doi:10.1016/j.jechem.2022.07.015",
        "openaccessSponsorName": null
      },
      "objects": {
        "object": [
          {
            "@category": "standard",
            "@height": "200",
            "@width": "400",
            "@_fa": "true",
            "$": "https://api.elsevier.com/content/object/eid/1-s2.0-S2095495622003758-ga1.jpg?httpAccept=%2A%2F%2A",
            "@multimediatype": "JPEG image file",
            "@type": "IMAGE-DOWNSAMPLED",
            "@size": "43366",
            "@ref": "ga1",
            "@mimetype": "image/jpeg"
          },
          {
            "@category": "standard",
            "@height": "357",
            "@width": "533",
            "@_fa": "true",
            "$": "https://api.elsevier.com/content/object/eid/1-s2.0-S2095495622003758-gr1.jpg?httpAccept=%2A%2F%2A",
            "@multimediatype": "JPEG image file",
            "@type": "IMAGE-DOWNSAMPLED",
            "@size": "107652",
            "@ref": "gr1",
            "@mimetype": "image/jpeg"
          },
          {
            "@category": "standard",
            "@height": "484",
            "@width": "383",
            "@_fa": "true",
            "$": "https://api.elsevier.com/content/object/eid/1-s2.0-S2095495622003758-gr2.jpg?httpAccept=%2A%2F%2A",
            "@multimediatype": "JPEG image file",
            "@type": "IMAGE-DOWNSAMPLED",
            "@size": "68686",
            "@ref": "gr2",
            "@mimetype": "image/jpeg"
          },
          {
            "@category": "standard",
            "@height": "467",
            "@width": "534",
            "@_fa": "true",
            "$": "https://api.elsevier.com/content/object/eid/1-s2.0-S2095495622003758-gr3.jpg?httpAccept=%2A%2F%2A",
            "@multimediatype": "JPEG image file",
            "@type": "IMAGE-DOWNSAMPLED",
            "@size": "93887",
            "@ref": "gr3",
            "@mimetype": "image/jpeg"
          },
          {
            "@category": "standard",
            "@height": "403",
            "@width": "534",
            "@_fa": "true",
            "$": "https://api.elsevier.com/content/object/eid/1-s2.0-S2095495622003758-gr4.jpg?httpAccept=%2A%2F%2A",
            "@multimediatype": "JPEG image file",
            "@type": "IMAGE-DOWNSAMPLED",
            "@size": "72883",
            "@ref": "gr4",
            "@mimetype": "image/jpeg"
          },
          {
            "@category": "standard",
            "@height": "334",
            "@width": "644",
            "@_fa": "true",
            "$": "https://api.elsevier.com/content/object/eid/1-s2.0-S2095495622003758-gr5.jpg?httpAccept=%2A%2F%2A",
            "@multimediatype": "JPEG image file",
            "@type": "IMAGE-DOWNSAMPLED",
            "@size": "74832",
            "@ref": "gr5",
            "@mimetype": "image/jpeg"
          },
          {
            "@category": "standard",
            "@height": "318",
            "@width": "644",
            "@_fa": "true",
            "$": "https://api.elsevier.com/content/object/eid/1-s2.0-S2095495622003758-gr6.jpg?httpAccept=%2A%2F%2A",
            "@multimediatype": "JPEG image file",
            "@type": "IMAGE-DOWNSAMPLED",
            "@size": "75271",
            "@ref": "gr6",
            "@mimetype": "image/jpeg"
          },
          {
            "@category": "standard",
            "@height": "535",
            "@width": "534",
            "@_fa": "true",
            "$": "https://api.elsevier.com/content/object/eid/1-s2.0-S2095495622003758-gr7.jpg?httpAccept=%2A%2F%2A",
            "@multimediatype": "JPEG image file",
            "@type": "IMAGE-DOWNSAMPLED",
            "@size": "123520",
            "@ref": "gr7",
            "@mimetype": "image/jpeg"
          },
          {
            "@category": "standard",
            "@height": "180",
            "@width": "534",
            "@_fa": "true",
            "$": "https://api.elsevier.com/content/object/eid/1-s2.0-S2095495622003758-gr8.jpg?httpAccept=%2A%2F%2A",
            "@multimediatype": "JPEG image file",
            "@type": "IMAGE-DOWNSAMPLED",
            "@size": "27812",
            "@ref": "gr8",
            "@mimetype": "image/jpeg"
          },
          {
            "@category": "thumbnail",
            "@height": "110",
            "@width": "219",
            "@_fa": "true",
            "$": "https://api.elsevier.com/content/object/eid/1-s2.0-S2095495622003758-ga1.sml?httpAccept=%2A%2F%2A",
            "@multimediatype": "GIF image file",
            "@type": "IMAGE-THUMBNAIL",
            "@size": "22650",
            "@ref": "ga1",
            "@mimetype": "image/gif"
          },
          {
            "@category": "thumbnail",
            "@height": "147",
            "@width": "219",
            "@_fa": "true",
            "$": "https://api.elsevier.com/content/object/eid/1-s2.0-S2095495622003758-gr1.sml?httpAccept=%2A%2F%2A",
            "@multimediatype": "GIF image file",
            "@type": "IMAGE-THUMBNAIL",
            "@size": "27902",
            "@ref": "gr1",
            "@mimetype": "image/gif"
          },
          {
            "@category": "thumbnail",
            "@height": "163",
            "@width": "129",
            "@_fa": "true",
            "$": "https://api.elsevier.com/content/object/eid/1-s2.0-S2095495622003758-gr2.sml?httpAccept=%2A%2F%2A",
            "@multimediatype": "GIF image file",
            "@type": "IMAGE-THUMBNAIL",
            "@size": "10326",
            "@ref": "gr2",
            "@mimetype": "image/gif"
          },
          {
            "@category": "thumbnail",
            "@height": "164",
            "@width": "187",
            "@_fa": "true",
            "$": "https://api.elsevier.com/content/object/eid/1-s2.0-S2095495622003758-gr3.sml?httpAccept=%2A%2F%2A",
            "@multimediatype": "GIF image file",
            "@type": "IMAGE-THUMBNAIL",
            "@size": "14787",
            "@ref": "gr3",
            "@mimetype": "image/gif"
          },
          {
            "@category": "thumbnail",
            "@height": "164",
            "@width": "217",
            "@_fa": "true",
            "$": "https://api.elsevier.com/content/object/eid/1-s2.0-S2095495622003758-gr4.sml?httpAccept=%2A%2F%2A",
            "@multimediatype": "GIF image file",
            "@type": "IMAGE-THUMBNAIL",
            "@size": "15680",
            "@ref": "gr4",
            "@mimetype": "image/gif"
          },
          {
            "@category": "thumbnail",
            "@height": "114",
            "@width": "219",
            "@_fa": "true",
            "$": "https://api.elsevier.com/content/object/eid/1-s2.0-S2095495622003758-gr5.sml?httpAccept=%2A%2F%2A",
            "@multimediatype": "GIF image file",
            "@type": "IMAGE-THUMBNAIL",
            "@size": "11118",
            "@ref": "gr5",
            "@mimetype": "image/gif"
          },
          {
            "@category": "thumbnail",
            "@height": "108",
            "@width": "219",
            "@_fa": "true",
            "$": "https://api.elsevier.com/content/object/eid/1-s2.0-S2095495622003758-gr6.sml?httpAccept=%2A%2F%2A",
            "@multimediatype": "GIF image file",
            "@type": "IMAGE-THUMBNAIL",
            "@size": "11426",
            "@ref": "gr6",
            "@mimetype": "image/gif"
          },
          {
            "@category": "thumbnail",
            "@height": "164",
            "@width": "164",
            "@_fa": "true",
            "$": "https://api.elsevier.com/content/object/eid/1-s2.0-S2095495622003758-gr7.sml?httpAccept=%2A%2F%2A",
            "@multimediatype": "GIF image file",
            "@type": "IMAGE-THUMBNAIL",
            "@size": "14198",
            "@ref": "gr7",
            "@mimetype": "image/gif"
          },
          {
            "@category": "thumbnail",
            "@height": "74",
            "@width": "219",
            "@_fa": "true",
            "$": "https://api.elsevier.com/content/object/eid/1-s2.0-S2095495622003758-gr8.sml?httpAccept=%2A%2F%2A",
            "@multimediatype": "GIF image file",
            "@type": "IMAGE-THUMBNAIL",
            "@size": "6415",
            "@ref": "gr8",
            "@mimetype": "image/gif"
          },
          {
            "@category": "high",
            "@height": "531",
            "@width": "1062",
            "@_fa": "true",
            "$": "https://api.elsevier.com/content/object/eid/1-s2.0-S2095495622003758-ga1_lrg.jpg?httpAccept=%2A%2F%2A",
            "@multimediatype": "JPEG image file",
            "@type": "IMAGE-HIGH-RES",
            "@size": "142991",
            "@ref": "ga1",
            "@mimetype": "image/jpeg"
          },
          {
            "@category": "high",
            "@height": "986",
            "@width": "1473",
            "@_fa": "true",
            "$": "https://api.elsevier.com/content/object/eid/1-s2.0-S2095495622003758-gr1_lrg.jpg?httpAccept=%2A%2F%2A",
            "@multimediatype": "JPEG image file",
            "@type": "IMAGE-HIGH-RES",
            "@size": "498648",
            "@ref": "gr1",
            "@mimetype": "image/jpeg"
          },
          {
            "@category": "high",
            "@height": "2142",
            "@width": "1695",
            "@_fa": "true",
            "$": "https://api.elsevier.com/content/object/eid/1-s2.0-S2095495622003758-gr2_lrg.jpg?httpAccept=%2A%2F%2A",
            "@multimediatype": "JPEG image file",
            "@type": "IMAGE-HIGH-RES",
            "@size": "390343",
            "@ref": "gr2",
            "@mimetype": "image/jpeg"
          },
          {
            "@category": "high",
            "@height": "2069",
            "@width": "2364",
            "@_fa": "true",
            "$": "https://api.elsevier.com/content/object/eid/1-s2.0-S2095495622003758-gr3_lrg.jpg?httpAccept=%2A%2F%2A",
            "@multimediatype": "JPEG image file",
            "@type": "IMAGE-HIGH-RES",
            "@size": "507568",
            "@ref": "gr3",
            "@mimetype": "image/jpeg"
          },
          {
            "@category": "high",
            "@height": "1782",
            "@width": "2364",
            "@_fa": "true",
            "$": "https://api.elsevier.com/content/object/eid/1-s2.0-S2095495622003758-gr4_lrg.jpg?httpAccept=%2A%2F%2A",
            "@multimediatype": "JPEG image file",
            "@type": "IMAGE-HIGH-RES",
            "@size": "419763",
            "@ref": "gr4",
            "@mimetype": "image/jpeg"
          },
          {
            "@category": "high",
            "@height": "1480",
            "@width": "2852",
            "@_fa": "true",
            "$": "https://api.elsevier.com/content/object/eid/1-s2.0-S2095495622003758-gr5_lrg.jpg?httpAccept=%2A%2F%2A",
            "@multimediatype": "JPEG image file",
            "@type": "IMAGE-HIGH-RES",
            "@size": "410917",
            "@ref": "gr5",
            "@mimetype": "image/jpeg"
          },
          {
            "@category": "high",
            "@height": "1407",
            "@width": "2850",
            "@_fa": "true",
            "$": "https://api.elsevier.com/content/object/eid/1-s2.0-S2095495622003758-gr6_lrg.jpg?httpAccept=%2A%2F%2A",
            "@multimediatype": "JPEG image file",
            "@type": "IMAGE-HIGH-RES",
            "@size": "431199",
            "@ref": "gr6",
            "@mimetype": "image/jpeg"
          },
          {
            "@category": "high",
            "@height": "2367",
            "@width": "2364",
            "@_fa": "true",
            "$": "https://api.elsevier.com/content/object/eid/1-s2.0-S2095495622003758-gr7_lrg.jpg?httpAccept=%2A%2F%2A",
            "@multimediatype": "JPEG image file",
            "@type": "IMAGE-HIGH-RES",
            "@size": "704587",
            "@ref": "gr7",
            "@mimetype": "image/jpeg"
          },
          {
            "@category": "high",
            "@height": "795",
            "@width": "2364",
            "@_fa": "true",
            "$": "https://api.elsevier.com/content/object/eid/1-s2.0-S2095495622003758-gr8_lrg.jpg?httpAccept=%2A%2F%2A",
            "@multimediatype": "JPEG image file",
            "@type": "IMAGE-HIGH-RES",
            "@size": "182560",
            "@ref": "gr8",
            "@mimetype": "image/jpeg"
          },
          {
            "@category": "standard",
            "@_fa": "true",
            "$": "https://api.elsevier.com/content/object/eid/1-s2.0-S2095495622003758-mmc1.pdf?httpAccept=%2A%2F%2A",
            "@multimediatype": "Acrobat PDF file",
            "@type": "APPLICATION",
            "@size": "4710455",
            "@ref": "mmc1",
            "@mimetype": "application/pdf"
          },
          {
            "@category": "thumbnail",
            "@_fa": "true",
            "$": "https://api.elsevier.com/content/object/eid/1-s2.0-S2095495622003758-si1.svg?httpAccept=%2A%2F%2A",
            "@multimediatype": "Scalable Vector Graphics file",
            "@type": "ALTIMG",
            "@size": "4202",
            "@ref": "si1",
            "@mimetype": "image/svg+xml"
          },
          {
            "@category": "standard",
            "@_fa": "true",
            "$": "https://api.elsevier.com/content/object/eid/1-s2.0-S2095495622003758-am.pdf?httpAccept=%2A%2F%2A",
            "@multimediatype": "Acrobat PDF file",
            "@type": "AAM-PDF",
            "@size": "1785207",
            "@ref": "am",
            "@mimetype": "application/pdf"
          }
        ]
      },
      "link": {
        "@rel": "abstract",
        "@href": "https://api.elsevier.com/content/abstract/scopus_id/85135405813"
      }
    }
  }
}