{
  "metadata": {
    "title": "Interface-driven <ce:italic>d</ce:italic>-band modulation for dual-function anchoring and catalytic conversion of polysulfides in lithium-sulfur batteries",
    "authors": "; ; ",
    "journal": "Journal of Energy Chemistry",
    "date": "2025-08-31",
    "doi": "10.1016/j.jechem.2025.05.018",
    "abstract": "",
    "uri": "https://api.elsevier.com/content/article/pii/S2095495625004115",
    "pii": "S2095495625004115"
  },
  "fulltext": {
    "full-text-retrieval-response": {
      "scopus-eid": "2-s2.0-105006750163",
      "originalText": "serial JL 286353 291210 291711 291744 291809 31 Journal of Energy Chemistry JOURNALENERGYCHEMISTRY 2025-05-20 2025-05-20 2025-05-29 2025-05-29 2025-07-24T19:56:18 1-s2.0-S2095495625004115 S2095-4956(25)00411-5 S2095495625004115 10.1016/j.jechem.2025.05.018 S300 S300.1 FULL-TEXT 1-s2.0-S2095495625X0005X 2025-07-24T19:07:12.116702Z 0 0 20250801 20250831 2025 2025-05-20T14:56:36.920061Z absattachment articleinfo articletitlenorm authfirstinitialnorm authfirstsurnamenorm cid cids contenttype copyright crossmark dateloaded dateloadedtxt datesearch datesort dateupdated dco docsubtype doctype doi eid ewtransactionid hubeid indexeddate issn issnnorm itemstage itemtransactionid itemweight openaccess openarchive pg pgfirst pglast pii piinorm pubdateend pubdatestart pubdatetxt pubyr sortorder srctitle srctitlenorm srctype ssids alllist content subj subheadings suppl tomb volfirst volissue volumelist webpdf webpdfpagecount yearnav figure e-component body mmlmath acknowledge affil appendices articletitle auth authfirstini authfull authkeywords authlast footnotes grantnumber grantsponsor grantsponsorid primabst ref specialabst 2095-4956 20954956 false 107 107 C Volume 107 78 919 928 919 928 202508 August 2025 2025-08-01 2025-08-31 2025 article fla © 2025 Science Press and Dalian Institute of Chemical Physics, Chinese Academy of Sciences. Published by Elsevier B.V. and Science Press. All rights are reserved, including those for text and data mining, AI training, and similar technologies. INTERFACEDRIVENDBANDMODULATIONFORDUALFUNCTIONANCHORINGCATALYTICCONVERSIONPOLYSULFIDESINLITHIUMSULFURBATTERIES XIA W 1 Introduction 2 Results and discussion 3 Conclusions Experimental section CRediT authorship contribution statement Acknowledgments Appendix A Supplementary material References FAN 2025 2425240 X PARK 2025 169 J LI 2025 44 62 R BO 2024 663 668 R MIAO 2024 2402609 K DENG 2024 2406135 D BI 2024 2402609 C ZHANG 2024 7047 7057 H LIU 2024 1073 1082 B FENG 2024 2414047 J KIM 2025 1649 S CAI 2025 2501600 G ZHANG 2024 238 245 J CHEN 2023 2203720 L CAI 2025 319 346 L ZHAO 2024 545 557 M ZHANG 2024 103786 J NAZIR 2025 e12844 A DONG 2022 6414 6425 Y XIAO 2024 32732 32745 W ZHOU 2024 150719 J DU 2025 2413826 M DU 2021 4933 4944 M SONG 2025 2420588 N ZHANG 2025 3553 3567 X XU 2024 2307995 H QIN 2023 2300611 J YANG 2022 11102 11114 D LI 2024 2309324 B ZHANG 2025 2409674 K GUO 2024 1330 1367 Y WU 2024 2315012 X ZHUANG 2025 11058 11074 Y ZHU 2025 2425945 J YE 2024 2417776 X MA 2024 2403101 Z HUANG 2024 12795 12807 A KUNG 2024 235365 C WANG 2024 2093 2104 P ZHANG 2025 2403464 H LU 2025 e202502846 C QIN 2024 2402644 T LIU 2025 J LI 2022 2916 S XIA 2024 2400262 W WEI 2022 120861 X XIONG 2024 156320 Y LI 2023 138548 Y GUO 2023 6452 6464 M CHEN 2022 e202208642 D MAO 2023 156298 Y ZHANG 2012 344 348 S ZHANG 2023 2302620 Q WANG 2024 34858 34869 Y LI 2019 1802207 Z WANG 2023 2300590 B ZOU 2016 1518 1525 Q LIU 2021 2109462 Y XIA 2024 2408304 W LUO 2023 e202215802 Y XIAX2025X919 XIAX2025X919X928 XIAX2025X919XW XIAX2025X919X928XW 2027-05-29T00:00:00.000Z 2027-05-29T00:00:00.000Z http://creativecommons.org/licenses/by-nc-nd/4.0/ © 2025 Science Press and Dalian Institute of Chemical Physics, Chinese Academy of Sciences. Published by Elsevier B.V. and Science Press. All rights are reserved, including those for text and data mining, AI training, and similar technologies. 2025-06-01T02:53:33.787Z http://vtw.elsevier.com/data/voc/AddOnTypes/50.7/aggregated-refined item S2095-4956(25)00411-5 S2095495625004115 1-s2.0-S2095495625004115 10.1016/j.jechem.2025.05.018 286353 2025-07-24T19:07:12.116702Z 2025-08-01 2025-08-31 1-s2.0-S2095495625004115-main.pdf https://s3-eu-west-1.amazonaws.com/prod-ucs-content-store-eu-west/content/pii:S2095495625004115/MAIN/application/pdf/55dd2064b6678ae833b397afb158e08f/main.pdf main.pdf pdf true 5806937 MAIN 10 1-s2.0-S2095495625004115-main_1.png https://s3-eu-west-1.amazonaws.com/prod-ucs-content-store-eu-west/content/pii:S2095495625004115/PREVIEW/image/png/66e7be65eb31be60f1eb52077cd86c9a/main_1.png main_1.png png 62286 928 656 IMAGE-WEB-PDF 1 1-s2.0-S2095495625004115-ga1.jpg https://s3-eu-west-1.amazonaws.com/prod-ucs-content-store-eu-west/content/pii:S2095495625004115/ga1/DOWNSAMPLED/image/jpeg/c5eee33db3d3d5839c7db399920ca78b/ga1.jpg ga1 true ga1.jpg jpg 30812 245 245 IMAGE-DOWNSAMPLED 1-s2.0-S2095495625004115-gr1.jpg https://s3-eu-west-1.amazonaws.com/prod-ucs-content-store-eu-west/content/pii:S2095495625004115/gr1/DOWNSAMPLED/image/jpeg/44e9da89e9c1c6eef7b7987ebf0a9e86/gr1.jpg gr1 gr1.jpg jpg 132220 598 577 IMAGE-DOWNSAMPLED 1-s2.0-S2095495625004115-gr2.jpg https://s3-eu-west-1.amazonaws.com/prod-ucs-content-store-eu-west/content/pii:S2095495625004115/gr2/DOWNSAMPLED/image/jpeg/95dca3ecdea91d95d603610c7d86ef8f/gr2.jpg gr2 gr2.jpg jpg 129389 573 778 IMAGE-DOWNSAMPLED 1-s2.0-S2095495625004115-gr3.jpg https://s3-eu-west-1.amazonaws.com/prod-ucs-content-store-eu-west/content/pii:S2095495625004115/gr3/DOWNSAMPLED/image/jpeg/e4f1470e8ba9285a86c88d0d15043370/gr3.jpg gr3 gr3.jpg jpg 113380 576 776 IMAGE-DOWNSAMPLED 1-s2.0-S2095495625004115-gr4.jpg https://s3-eu-west-1.amazonaws.com/prod-ucs-content-store-eu-west/content/pii:S2095495625004115/gr4/DOWNSAMPLED/image/jpeg/c56580b5669edd72cd64c967ca4a2ca3/gr4.jpg gr4 gr4.jpg jpg 127991 591 756 IMAGE-DOWNSAMPLED 1-s2.0-S2095495625004115-gr5.jpg https://s3-eu-west-1.amazonaws.com/prod-ucs-content-store-eu-west/content/pii:S2095495625004115/gr5/DOWNSAMPLED/image/jpeg/8e2597d36aa3c258147c82269cb7dbad/gr5.jpg gr5 gr5.jpg jpg 78813 407 793 IMAGE-DOWNSAMPLED 1-s2.0-S2095495625004115-gr6.jpg https://s3-eu-west-1.amazonaws.com/prod-ucs-content-store-eu-west/content/pii:S2095495625004115/gr6/DOWNSAMPLED/image/jpeg/dd1277e8aeab11472daac8415e3fb838/gr6.jpg gr6 gr6.jpg jpg 71788 421 612 IMAGE-DOWNSAMPLED 1-s2.0-S2095495625004115-gr7.jpg https://s3-eu-west-1.amazonaws.com/prod-ucs-content-store-eu-west/content/pii:S2095495625004115/gr7/DOWNSAMPLED/image/jpeg/bb22c8887bdfdb99660a29a290b18a3f/gr7.jpg gr7 gr7.jpg jpg 171590 778 756 IMAGE-DOWNSAMPLED 1-s2.0-S2095495625004115-ga1.sml https://s3-eu-west-1.amazonaws.com/prod-ucs-content-store-eu-west/content/pii:S2095495625004115/ga1/THUMBNAIL/image/gif/0c67be53de1ea3f4c66c79e70ff45fc0/ga1.sml ga1 true ga1.sml sml 24218 164 164 IMAGE-THUMBNAIL 1-s2.0-S2095495625004115-gr1.sml https://s3-eu-west-1.amazonaws.com/prod-ucs-content-store-eu-west/content/pii:S2095495625004115/gr1/THUMBNAIL/image/gif/0ec0cec3e61daccc24b8e24c476bac7b/gr1.sml gr1 gr1.sml sml 19970 164 158 IMAGE-THUMBNAIL 1-s2.0-S2095495625004115-gr2.sml https://s3-eu-west-1.amazonaws.com/prod-ucs-content-store-eu-west/content/pii:S2095495625004115/gr2/THUMBNAIL/image/gif/7b1b136b106680f542ecc9e286040a98/gr2.sml gr2 gr2.sml sml 16462 161 219 IMAGE-THUMBNAIL 1-s2.0-S2095495625004115-gr3.sml https://s3-eu-west-1.amazonaws.com/prod-ucs-content-store-eu-west/content/pii:S2095495625004115/gr3/THUMBNAIL/image/gif/ba6ebf0f1613e90e26e1f7661331147c/gr3.sml gr3 gr3.sml sml 14610 163 219 IMAGE-THUMBNAIL 1-s2.0-S2095495625004115-gr4.sml https://s3-eu-west-1.amazonaws.com/prod-ucs-content-store-eu-west/content/pii:S2095495625004115/gr4/THUMBNAIL/image/gif/19f4cf68458a18ae6ac5fe5265b03400/gr4.sml gr4 gr4.sml sml 13504 164 210 IMAGE-THUMBNAIL 1-s2.0-S2095495625004115-gr5.sml https://s3-eu-west-1.amazonaws.com/prod-ucs-content-store-eu-west/content/pii:S2095495625004115/gr5/THUMBNAIL/image/gif/55dbf8efece50724c861aa499e1cb599/gr5.sml gr5 gr5.sml sml 9356 112 219 IMAGE-THUMBNAIL 1-s2.0-S2095495625004115-gr6.sml https://s3-eu-west-1.amazonaws.com/prod-ucs-content-store-eu-west/content/pii:S2095495625004115/gr6/THUMBNAIL/image/gif/dcf01a5ac92c4dcc437be29e9e6d6a15/gr6.sml gr6 gr6.sml sml 13162 151 219 IMAGE-THUMBNAIL 1-s2.0-S2095495625004115-gr7.sml https://s3-eu-west-1.amazonaws.com/prod-ucs-content-store-eu-west/content/pii:S2095495625004115/gr7/THUMBNAIL/image/gif/d2518de63059437cbf85fcd94ba10bf4/gr7.sml gr7 gr7.sml sml 16138 164 159 IMAGE-THUMBNAIL 1-s2.0-S2095495625004115-ga1_lrg.jpg https://s3-eu-west-1.amazonaws.com/prod-ucs-content-store-eu-west/content/pii:S2095495625004115/HIGHRES/image/jpeg/c88274c9f6283e7dad17609e68133317/ga1_lrg.jpg ga1 true ga1_lrg.jpg jpg 212184 1085 1085 IMAGE-HIGH-RES 1-s2.0-S2095495625004115-gr1_lrg.jpg https://s3-eu-west-1.amazonaws.com/prod-ucs-content-store-eu-west/content/pii:S2095495625004115/HIGHRES/image/jpeg/b4b4cd8bebb4f667a64a491637f08fba/gr1_lrg.jpg gr1 gr1_lrg.jpg jpg 1098644 2648 2556 IMAGE-HIGH-RES 1-s2.0-S2095495625004115-gr2_lrg.jpg https://s3-eu-west-1.amazonaws.com/prod-ucs-content-store-eu-west/content/pii:S2095495625004115/HIGHRES/image/jpeg/2d1b96d26b0df2df6a3a3e68d17ca065/gr2_lrg.jpg gr2 gr2_lrg.jpg jpg 841723 2540 3446 IMAGE-HIGH-RES 1-s2.0-S2095495625004115-gr3_lrg.jpg https://s3-eu-west-1.amazonaws.com/prod-ucs-content-store-eu-west/content/pii:S2095495625004115/HIGHRES/image/jpeg/b7ac42c89f0183dbe0d5e063e011799c/gr3_lrg.jpg gr3 gr3_lrg.jpg jpg 910554 2550 3435 IMAGE-HIGH-RES 1-s2.0-S2095495625004115-gr4_lrg.jpg https://s3-eu-west-1.amazonaws.com/prod-ucs-content-store-eu-west/content/pii:S2095495625004115/HIGHRES/image/jpeg/baf40aeef5e7d9e370be5994e9fca9c6/gr4_lrg.jpg gr4 gr4_lrg.jpg jpg 980983 2617 3346 IMAGE-HIGH-RES 1-s2.0-S2095495625004115-gr5_lrg.jpg https://s3-eu-west-1.amazonaws.com/prod-ucs-content-store-eu-west/content/pii:S2095495625004115/HIGHRES/image/jpeg/f88645ce584fad60e5c3a6c72aac9f57/gr5_lrg.jpg gr5 gr5_lrg.jpg jpg 591874 1801 3513 IMAGE-HIGH-RES 1-s2.0-S2095495625004115-gr6_lrg.jpg https://s3-eu-west-1.amazonaws.com/prod-ucs-content-store-eu-west/content/pii:S2095495625004115/HIGHRES/image/jpeg/16535c1cde41868d65594338703297d4/gr6_lrg.jpg gr6 gr6_lrg.jpg jpg 521437 1867 2711 IMAGE-HIGH-RES 1-s2.0-S2095495625004115-gr7_lrg.jpg https://s3-eu-west-1.amazonaws.com/prod-ucs-content-store-eu-west/content/pii:S2095495625004115/HIGHRES/image/jpeg/58b0e175a977ef34112920552932c429/gr7_lrg.jpg gr7 gr7_lrg.jpg jpg 1268481 3443 3346 IMAGE-HIGH-RES 1-s2.0-S2095495625004115-mmc1.docx https://s3-eu-west-1.amazonaws.com/prod-ucs-content-store-eu-west/content/pii:S2095495625004115/mmc1/MAIN/application/vnd.openxmlformats-officedocument.wordprocessingml.document/f99c1aab55b680fcb093465e9ae5dbb3/mmc1.docx mmc1 mmc1.docx docx 8832976 APPLICATION 1-s2.0-S2095495625004115-si1.svg https://s3-eu-west-1.amazonaws.com/prod-ucs-content-store-eu-west/content/pii:S2095495625004115/STRIPIN/image/svg+xml/0d5e0967e0723e495449770c2a27d3f1/si1.svg si1 si1.svg svg 20543 ALTIMG 1-s2.0-S2095495625004115-si2.svg https://s3-eu-west-1.amazonaws.com/prod-ucs-content-store-eu-west/content/pii:S2095495625004115/STRIPIN/image/svg+xml/85b015f84f67e9ef8f8242f707f9ab84/si2.svg si2 si2.svg svg 945 ALTIMG 1-s2.0-S2095495625004115-si3.svg https://s3-eu-west-1.amazonaws.com/prod-ucs-content-store-eu-west/content/pii:S2095495625004115/STRIPIN/image/svg+xml/b617a4f84cad076775b08a5c475fac00/si3.svg si3 si3.svg svg 11790 ALTIMG JECHEM 4726 S2095-4956(25)00411-5 10.1016/j.jechem.2025.05.018 Science Press Fig. 1 (a) Schematic of the fabrication process of Ni3Fe/Ni3ZnC0.7. (b) XRD spectra of different samples. (c) SEM images of M-Ni3Fe/Ni3ZnC0.7. (d) TEM image of M-Ni3Fe/Ni3ZnC0.7. (e) HRTEM image of M-Ni3Fe/Ni3ZnC0.7. (f, g) Corresponding interplanar spacing profiles and pictures from the rapid Fourier transform. (h–l) Elemental mapping images of M-Ni3Fe/Ni3ZnC0.7. Fig. 2 The XPS profiles with (a) Ni 2p of M-Ni3Fe/Ni3ZnC0.7 and Ni3Fe. The comparison of (b) Fe 2p spectrum of M-Ni3Fe/Ni3ZnC0.7 and Ni3Fe. The comparison of work function with (c) Ni3Fe, (d) Ni3ZnC0.7, and (e) Ni3Fe/Ni3ZnC0.7. (f) Energy band change diagram before and after contact with Ni3Fe and Ni3ZnC0.7. (g) The charge density difference of Ni3Fe/Ni3ZnC0.7. Fig. 3 (a) Cycle performances of the batteries with different cathodes at 0.2 C. (b) Rate capabilities of LiS cells based on different cathodes. (c) Voltage discharge–charge profiles of M-Ni3Fe/Ni3ZnC0.7/S-based cell at various current rates. (d) Capacity retention rates of cathodes at high potential platforms at different rates. (e) Cycle performance of M-Ni3Fe/Ni3ZnC0.7/S-based cell under a high sulfur loading of 4.7 mg cm−2. (f) Digital photograph of an electric LED lamp lit by LiS batteries in series. (g) Long cycle performance of various sample-based cells. (h) The comparison with part previous works. Fig. 4 (a) UV–vis absorption spectra after adsorbing Li2S6 solution contained as-synthesized heterostructure samples. (b) The comparison with Ni 2p spectra of M-Ni3Fe/Ni3ZnC0.7 before and after Li2S6 adsorption. (c) CV test of symmetric batteries. (d) CV curves of the batteries with various heterostructure materials. (e) Corresponding Tafel plots from the process of Li2Sn to Li2S. (f) Corresponding Tafel plots from Li2S to Li2Sn. (g) CV curves of M-Ni3Fe/Ni3ZnC0.7/S at different scan rates. (h) Comparison of Li+ diffusion coefficients. (i) EIS plots of LiS batteries with different cathodes. Fig. 5 Potentiostatic discharge profile of Li2S nucleation with (a) Ni3Fe and (b) M-Ni3Fe/Ni3ZnC0.7 at 2.05 V. Dimensionless transients of (c) M-Ni3Fe/Ni3ZnC0.7 and (d) Ni3Fe. (e) Comparison of Li2S deposition in SEM images. (f) The potentiostatic charge curve on M-Ni3Fe/Ni3ZnC0.7 at 2.4 V. Fig. 6 The comparison of operando UV–vis spectra during cycling with (a) M-Ni3Fe/Ni3ZnC0.7 and (d) Ni3Fe; The time–voltage curves of (b) M-Ni3Fe/Ni3ZnC0.7 and (e) Ni3Fe; Data on the absorbance of the dissolved LiPS using the (c) M-Ni3Fe/Ni3ZnC0.7/S and (f) Ni3Fe/S cathode. Fig. 7 The comparison of partial density of states (PDOS) for (a) Ni3Fe, (b) Ni3ZnC0.7, and (c) Ni3Fe/Ni3ZnC0.7. (d) The Gibbs free energy profiles on the surface of different samples with optimized adsorption models of sulfur species. (e) The comparison of energy barriers on Li2S decomposition. (f, g) The LiS bridged bond lengths of Li2S8 and Li2S4 on the surface of Ni3Fe, Ni3ZnC0.7 and Ni3Fe/Ni3ZnC0.7. (h) Schematic diagram for the promoted polysulfide transformation by Ni3Fe/Ni3ZnC0.7. Interface-driven d-band modulation for dual-function anchoring and catalytic conversion of polysulfides in lithium-sulfur batteries Wenlong Xia Writing – original draft Investigation Formal analysis Conceptualization a 1 Hengzhi Liu Project administration Methodology Investigation b 1 Hong Liu Supervision Resources Methodology a ⁎ Qianqian Liang Methodology Data curation a Lanhua Yi Investigation Conceptualization a Manfang Chen Investigation Formal analysis Conceptualization a Xianyou Wang Investigation Formal analysis Data curation a Xingqiao Wu Writing – review & editing Supervision Methodology Investigation Conceptualization c ⁎ Hongbo Shu Writing – review & editing Validation Funding acquisition a ⁎ a National Local Joint Engineering Laboratory for Key Materials of New Energy Storage Battery, Hunan Province Key Laboratory for Electrochemical Energy Storage and Conversion, School of Chemistry, Xiangtan University, Xiangtan 411105, Hunan, China National Local Joint Engineering Laboratory for Key Materials of New Energy Storage Battery Hunan Province Key Laboratory for Electrochemical Energy Storage and Conversion School of Chemistry Xiangtan University Xiangtan Hunan 411105 China National Local Joint Engineering Laboratory for Key Materials of New Energy Storage Battery, Hunan Province Key Laboratory for Electrochemical Energy Storage and Conversion, School of Chemistry, Xiangtan University, Xiangtan 411105, Hunan, China b Department of Chemistry, Southern University of Science and Technology, Shenzhen 518055, Guangdong, China Department of Chemistry Southern University of Science and Technology Shenzhen Guangdong 518055 China Department of Chemistry, Southern University of Science and Technology, Shenzhen 518055, Guangdong, China c College of Chemistry and Materials Engineering, Wenzhou University, Wenzhou 325035, Zhejiang, China College of Chemistry and Materials Engineering Wenzhou University Wenzhou Zhejiang 325035 China College of Chemistry and Materials Engineering, Wenzhou University, Wenzhou 325035, Zhejiang, China ⁎ Corresponding authors. 1 These authors contributed equally to this work. Graphical abstract To investigate the comprehensive understanding of the thermodynamic growth mechanisms for heterostructure and the relationship between interface design and the D-band center as well as catalytic performance was established. The polysulfide shuttle effect critically hinders lithium-sulfur (LiS) battery development, therefore, the design of heterogeneous interface engineering with “adsorption-catalysis” functions for polysulfide conversion has garnered considerable attention. However, the exploration of the intricate relationship between key electronic properties and catalytic activity at such interfaces remains a challenge. Additionally, a comprehensive understanding of the thermodynamic growth mechanisms for heterostructure materials is lacking. Herein, a Ni-based homologous structure was precisely constructed via thermodynamic control, with a specific focus on optimizing the interface design. The theoretical results show that the heterostructures with adjustable composition realize the appropriate upward shift to the D-band, improving the affinity towards polysulfide, and further reducing the reaction energy barrier. On this basis, the relationship between interface design and the D-band center, as well as catalytic performance, was established. Specifically, M-Ni3Fe/Ni3ZnC0.7 accomplishes the electron enrichment at the interface, supporting the further diffusion of polysulfides, and lowering the LiS bond energy, performing the bidirectional catalytic transformation of polysulfides. As a result, the LiS batteries with the cathode of M-Ni3Fe/Ni3ZnC0.7/S deliver rate performances of discharge capacity of 514 mA h g−1 at 5.0 C. This understanding of the D-band and interfacial design provides a framework for LiS catalyst optimization. Keywords Lithium-sulfur battery Heterostructure D-band Interfacial design 1 Introduction The development of electric vehicles and portable electronics has increased the demand for energy storage systems [1,2]. However, the energy density of the most advanced lithium-ion (Li-ion) batteries has been getting close to the limit [3,4]. With a high specific capacity of 1675 mA h g−1 and theoretical energy density of 2600 W h kg−1, lithium-sulfur (LiS) batteries are regarded as one of the most promising battery technologies [5–7]. However, the shuttle behavior of dissolved polysulfides (LiPSs) during the reaction causes the loss of active substances and the rapid decay of capacity, which seriously hinders their further application [8–10]. Numerous catalysts have been successfully employed as sulfur host materials to speed up the conversion of polysulfides [11–13]. Some theories, including D-band theory [14], electric-field theory [15], and crystal-field theory [16], were applied to optimize the catalyst design, enhancing the reaction kinetics towards the LiS system [17–19]. In particular, D-band theory enhances the understanding of the catalytic mechanism. It connects polysulfide activity with the fundamental electronic properties of the catalyst [20]. Actually, the D-band theory defines the structure-reaction connection of the catalyst by connecting the surface chemical characteristics to the surface electronic structure of the metal-containing surface [21,22], while the intrinsic structure of the catalyst is further determined by the reaction thermodynamics [23,24]. It is necessary to rationalize the activity trend of the electrocatalyst with thermodynamic strategy as the center, establishing a connection with the D-band. Recently, multiple engineering [25,26] has been used to achieve the sensible control of the D-band towards the catalyst and to further develop an electrocatalyst with high catalytic activity, including doping engineering [27,28], phase engineering [29,30], and heterostructure engineering [31–33]. Among them, the heterostructures have achieved brilliant performance in LiS cells through multi-component coupling design as multi-functional catalysts, such as COF/MXene [34], Cu3P/Cu2O [35], and NiS2-CoS2 [36]. Most heterogeneous structures, as multifunctional catalysts, couple the synergies of different components, accelerating the transformation of polysulfides to a certain extent [37,38]. Considering the metal-based catalysts [39,40], especially Ni, the electronic structure of which delivers similar properties to precious metals, as well as possesses the unfilled D-orbital electrons. This feature enables high tunability and strong adsorption and activation of the reactant molecules on the surface of the nickel-based catalyst. Furthermore, the Fe atom delivers a distinct structure with Ni, which could potentially modify the electronic state of Ni even more, demonstrating the potential to construct multifunctional catalysts with heterostructures [41,42]. However, despite these advances, the mechanism behind interfacial catalysis remains unidentified, while the heterogeneous interface has long been thought to as the active site of charge transfer and heterophase reaction [43,44]. Using a heterostructure built by various thermodynamic factors [45,46] to integrate band structure with heterogeneous engineering and interfacial electronic characteristics with catalytic activity is crucial for designing effective electrocatalysts. Herein, a link between heterostructure interface design and D-band center was established as well as catalytic performance. The change in Fe concentration directly affects the thermodynamic growth stability of different phases in the Ni3Fe/Ni3ZnC0.7 system. In addition, the designed interface facilitates electron enrichment and transfer between Ni and Fe, generating an internal electric field that accelerates the catalytic conversion of polysulfides. Crucially, the formation of the interface modulates the D-band of the catalyst, which avoids the passivation on catalyst caused by excessive adsorption, further reducing the reaction energy barrier. The longer LiS bond on the Ni3Fe/Ni3ZnC0.7 aided in the desorption and dissolution of Li2S. As a result, M-Ni3Fe/Ni3ZnC0.7/S as the host material exhibits minimal Li2S2 disproportionation, which directionally promotes the deposition and oxidation process of Li2S. Based on this, M-Ni3Fe/Ni3ZnC0.7 provides effective long-term cycling stability with a capacity attenuation rate of 0.062% per cycle after 500 cycles at 1.0 C in LiS systems. And M-Ni3Fe/Ni3ZnC0.7 continues to exhibit outstanding electrochemical performance even when exposed to rate capability and high sulfur loading. 2 Results and discussion The synthesis process of Ni3Fe/Ni3ZnC0.7 on porous carbon nanofibers is shown in Fig. 1 a. In short, the Ni3Fe/Ni3ZnC0.7 was prepared via the peocess of electrospinning and then calcining. The heterogeneous structure of different components can be obtained by controlling the amount of the precursor Fe metal salt. To create the various samples, the mass ratio of Ni/Fe was varied from 2/1, 4/1, 6.5/1 and 9/1, resulting products were designated as Ni3Fe, L-Ni3Fe/Ni3ZnC0.7, M-Ni3Fe/Ni3ZnC0.7 and H-Ni3Fe/Ni3ZnC0.7, respectively. Firstly, we explored the thermodynamic growth process of the heterostructure with varying Fe content. The crystal structures of several samples were first examined using X-ray diffraction (XRD). Fig. 1b shows the existence of Ni3Fe and Ni3ZnC0.7 from diffraction peaks. The diffraction peaks at 44.2°, 51.5° and 75.8° correspond to the (111), (200) and (220) crystal planes of the Ni3Fe phase. And the peaks at 42.7°and 49.7° assigned to the (111) and (200) crystal planes of Ni3ZnC0.7. It is worth noting that when the Fe content grows, the distinctive peaks that correspond to Ni3ZnC0.7 progressively vanish, showing that Ni preferentially coordinates with Fe to produce Ni3Fe alloy, subsequently generated to Ni3ZnC0.7. In brief, Fe preferentially coordinates with Ni to form the Ni3Fe alloy, followed by Zn reacting to form Ni3ZnC0.7. The formation of Ni3ZnC0.7 is strongly correlated with the Ni concentration in the precursor, as insufficient Ni concentration prevents its participation in the reaction. The microstructure of materials was examined using transmission electron microscopy (TEM) and scanning electron microscopy (SEM). As shown in Fig. 1c and Fig. S1 (Supporting information), the nanoparticles grow on the long-range tubular shape carbon nanofibers. Simultaneously, the morphology and structural integrity are maintained even at higher Fe contents. TEM with different magnifications in Fig. 1d and Fig. S2 shows that the fibers are around 100 nm in width, and the interior is filled with abundant nanoparticles. The heterogeneous interface between various materials is visible in the HRTEM image (Fig. 1e), with a lattice spacing of 0.206 and 0.183 nm (Fig. 1f, g), which correspond to the Ni3Fe (111) and Ni3ZnC0.7 (200) planes, respectively. Moreover, Fig. S3 supplemented the corresponding SAED patterns of M-Ni3Fe/Ni3ZnC0.7. The diffraction rings point to the (111) and (111) crystal planes of Ni3Fe and Ni3ZnC0.7, indicating the successful synthesis of the Ni3Fe/Ni3ZnC0.7. After that, the EDS technique demonstrates the uniform distribution of these elements within M-Ni3Fe/Ni3ZnC0.7 (Fig. 1h–l). X-ray photoelectron spectroscopy (XPS) was used to further examine the elemental composition and surface chemical state of these as-obtained samples. The distinctive peaks of several elements were seen in the overall XPS survey spectra of M-Ni3Fe/Ni3ZnC0.7 in Fig. S4. Two distinct peaks at 1022 and 1045 eV should be attributed to Zn 2p 3/2 and Zn 2p 1/2 (Fig. S5). Furthermore, the valence variations towards the key elements of M-Ni3Fe/Ni3ZnC0.7 and the Ni3Fe were contrasted in Fig. 2 a, b. For the Ni 2p spectra in M-Ni3Fe/Ni3ZnC0.7, two peaks at 853.1 and 872.6 eV were attributed to Ni 2p 3/2 and Ni 2p 1/2 in the Ni0 valence state [47,48]. Two distinct peaks at 855.3 and 872.6 eV should be attributed to Ni 2p 3/2 and Ni 2p 1/2 in the Ni2+ valence state. The comparison of the Ni 2p spectrum of M-Ni3Fe/Ni3ZnC0.7 and Ni3Fe further shows that the formation of heterogeneous structures makes M-Ni3Fe/Ni3ZnC0.7 shift towards the lower binding energy, suggesting that the Ni is in the electron-abundance state. Two peaks at 707.8 and 720.9 eV are identified as Fe0 2p 3/2 and Fe0 2p 1/2, respectively, in the Fe 2p spectrum [49,50]. And the other two peaks at 711.5 and 724.6 eV, together with two satellite peaks, are identified as Fe3+ 2p 3/2 and Fe3+ 2p 1/2, respectively. In contrast, after forming a heterogeneous structure, the Fe 2p orbital shifts toward a higher binding energy, indicating its electron-deficient state. In this instance, the Fe and Ni peak shifts in M-Ni3Fe/Ni3ZnC0.7 show that Ni3Fe can donate electrons in M-Ni3Fe/Ni3ZnC0.7, allowing electrons to transfer from Ni3Fe to Ni3ZnC0.7. Then the work functions of different samples are compared in Fig. 2c–e. Obviously, the work function of Ni3Fe (5.02 eV) is clearly less than that of Ni3ZnC0.7 (5.24 eV). In addition, the lowest work function (4.51 eV) is shown after the formation of Ni3Fe/Ni3ZnC0.7, which might be attributed to the alignment of Fermi levels upon contact and the formation of a dipole layer brought by the charge transfer of heterostructures. Further, the energy band change diagram of Ni3Fe and Ni3ZnC0.7 before and after contact is shown in Fig. 2f. Due to the disparity in the work function, electrons will move from the Ni3Fe to Ni3ZnC0.7 until the thermodynamic equilibrium state is attained and the Fermi level is equal [51,52]. The differential charge density in Fig. 2g is used to further investigate the electron state at the heterogeneous interface, while cyan indicates the loss of electrons and yellow represents the gain of electrons. Numerous electrons are enriched at the heterogeneous interface, which further modifies the electronic structure at the active site and quickens the kinetics of charge transfer. In addition, the charge density difference of Ni3Fe/Ni3ZnC0.7 indicates that Fe loses 0.417 e− while Ni receives electrons in Ni3Fe. After the formation of the heterostructure, both Fe and Ni lose electrons in the Ni3Fe/Ni3ZnC0.7, while carbon receives 0.859 e− (Table S1). The transfer of electrons leads to the redistribution of charges at the interface. This redistribution generates electron-rich regions in Ni3ZnC0.7 and hole-rich regions in Ni3Fe, resulting in a shift in the Fermi level. Overall, adding Fe results in the formation of various heterogeneous structures, and the creation of heterogeneous interfaces facilitates electron transmission and optimizes the electronic structure. The electrochemical performance was further investigated by assembling L-Ni3Fe/Ni3ZnC0.7/S, M-Ni3Fe/Ni3ZnC0.7/S, H-Ni3Fe/Ni3ZnC0.7/S and Ni3Fe/S batteries. The electrochemical characteristics at 0.2 C were first compared in more detail (Fig. 3 a). M-Ni3Fe/Ni3ZnC0.7/S cell delivers an initial discharge capacity of 1128 mA h g−1 and still has a discharge capacity of 942 mA h g−1 after 100 cycles. In comparison, Ni3Fe/S has a low initial capacity of 1070 mA h g−1, and the capacity after cycling only reaches 821 mA h g−1. The galvanostatic discharge–charge profiles of M-Ni3Fe/Ni3ZnC0.7/S-based cells at 1.0 C (Fig. S6) exhibited the highest discharge capacity as well as the minimum overpotential at about 2.0 V in the reduction process, compared to L-Ni3Fe/Ni3ZnC0.7/S (800 mA h g−1) and H-Ni3Fe/Ni3ZnC0.7/S (911 mA h g−1). Furthermore, M-Ni3Fe/Ni3ZnC0.7/S delivered the lowest polarization potential (0.26 V) in Fig. S7, while others showed significant potential polarizations and capacity deteriorations. The rate performance is then contrasted under various current densities. The M-Ni3Fe/Ni3ZnC0.7/S-based cell had rate performances of 1095, 962, 780, 657 and 514 mA h g−1 at 0.5, 1.0, 2.0, 3.0 and 5.0 C, respectively. Fig. 3b shows that at a current density of 5 C, Ni3Fe/M-Ni3ZnC0.7 still exhibits relatively high Coulombic efficiency, indicating the improved utilization rate of active substances. The electrochemical characteristics of Ni3Fe are further altered by the creation of a heterogeneous interface, whereas H-Ni3Fe/Ni3ZnC0.7/S performs worse than M-Ni3Fe/Ni3ZnC0.7/S because of the excessively powerful adsorption ability towards polysulfides. Fig. 3c shows the charge–discharge curve at different current densities of M-Ni3Fe/Ni3ZnC0.7/S-based cells, and two obvious reduction platforms could still be identified at 3.0 C, indicating its effectiveness in promoting polysulfide conversion at high current densities, which should be attributed to the enhancement of heterogeneous interfaces. Additionally, the trailing phenomenon at 0.5 C was attributed to the irreversible reduction of LiNO3 [53,54]. When LiNO3 is used as an additive or a co-salt of the electrolyte, excessively low discharge cut-off voltage will lead to an irreversible reduction of part of LiNO3 to generate the SEI on the surface of the Li anode. The charge–discharge curves in Fig. S8 after cycling also indicate that the formation of SEI only occurs in the initial cyclic process and gradually disappears as the cycle proceeds. Further comparison of the capacity retention rate of the high voltage platform (Fig. 3d) shows that M-Ni3Fe/Ni3ZnC0.7/S-based cells have a higher retention rate under different current densities. Additional testing was done in Fig. 3g on the long-term stability of cells with various electrode configurations. M-Ni3Fe/Ni3ZnC0.7/S-based cells deliver a decent reversibility of 606 mA h g−1 over 500 cycles with a capacity attenuation of 0.062% per cycle. In contrast, Ni3Fe/S-based cells only show a capacity of 500 cycles decayed to 501 mA h g−1, revealing poor cycle stability. In addition, during the initial cycle, the excessive adsorption behavior on Ni3Fe of polysulfides passivated the catalyst surface, which increased polarization, resulting in a slowdown in kinetics and a rapid decrease in capacity. The electrochemical properties of M-Ni3Fe/Ni3ZnC0.7/S-based cells with high sulfur loading were examined at a current density of 0.2 C. Fig. 3e demonstrates that M-Ni3Fe/Ni3ZnC0.7/S cell still hold an areal capacity of ∼3.5 mA h cm−2 under the sulfur loading of ∼4.6 mg cm−2 after 50 cycles (E/S ratio of 10 µl/mg). The M-Ni3Fe/Ni3ZnC0.7/S electrode was able to keep the LED lights in Fig. 3f lighted for several minutes, demonstrating the robustness and usefulness. Simultaneously, the advantages of the designed M-Ni3Fe/Ni3ZnC0.7 are highlighted by the comparison with other cathode materials (Fig. 3h and Table S2), proving that the performance of the structure is further improved by the construction of the heterogeneous interface. Then the assembled cells were disassembled after cycling to determine the failure mechanism of the heterogeneous structure. Through SEM comparison of the cycled lithium metal anode (Fig. S9), the surfaces of all samples have severe corrosion with different degrees, while the surface of the Li anode from M-Ni3Fe/Ni3ZnC0.7/S-based cells has a much smoother surface, indicating that M-Ni3Fe/Ni3ZnC0.7 improved the polysulfide reaction kinetics. In addition, the condition of separators after cycling is shown in Fig. S10. The separator from the M-Ni3Fe/Ni3ZnC0.7/S-based cell is relatively colorless, while other samples show a yellowish surface. In addition, the capacity contribution of pure M-Ni3Fe/Ni3ZnC0.7 during the redox process was further compared. Fig. S11 indicates that the capacity contribution of M-Ni3Fe/Ni3ZnC0.7 can be disregarded. In summary, the electrochemical performance is further enhanced by the creation of heterogeneous interfaces. To better investigate the principle behind the catalytic behavior of different heterogeneous materials, the kinetic behavior throughout the chemical reaction process is further studied. Firstly, the adsorption behavior of polysulfide by different materials was investigated. A diluted polysulfide solution was used to further observe the improved adsorption behavior of M-Ni3Fe/Ni3ZnC0.7 in Fig. S12. It is demonstrated that the adsorption ability of various polysulfides is further improved when the Ni3Fe content rises. Adding different content of Fe effectively modifies the adsorption capability towards polysulfides. Ni3Fe in particular demonstrated an excessive adsorption action, which further passivated the surface of the catalyst. M-Ni3Fe/Ni3ZnC0.7 showed moderate adsorption capacity, which further reduced the polysulfide shuttle. Additionally, the UV–vis spectrum in Fig. 4 a demonstrates that the distinctive absorbance of S6 2− constantly declines as the addition of Fe content increases, supporting the aforementioned result. The interaction between M-Ni3Fe/Ni3ZnC0.7 and Li2S6 was verified by the comparison of XPS before and after adsorption in Fig. 4b [55]. Following the addition of Li2S6, the binding energy of M-Ni3Fe/Ni3ZnC0.7 shows a more noticeable change along the lower direction, supporting the higher electron density at the center Ni and further resulting in the formation of strong chemical interactions between Li2S6 and Ni sites. Assemble Li2S6 symmetric cells to explore the catalytic capabilities of these samples. As shown in Fig. 4c, three pairs of redox peaks were observed in different samples, demonstrating superiority in transforming various polysulfides (Table S3). Compared with the other samples, M-Ni3Fe/Ni3ZnC0.7 showed the highest peak response current, peak potential, as well as the smallest peak separations. This outcome indicates that M-Ni3Fe/Ni3ZnC0.7 can successfully carry out the effective transformation of LiPSs, which promotes the conversion rate and reversibility toward sulfur. Coin-type LiS batteries with different cathodes are shown in cyclic voltammetry (CV) plots in Fig. 4d with a sweep rate of 0.1 mV s−1 spanning the 1.7–2.8 V potential window. Peak C (2.3 V) and Peak B (2.0 V) of the M-Ni3Fe/Ni3ZnC0.7/S electrode correspond to the process of S8 to Li2Sn and further reduction to insoluble Li2S/Li2S2, respectively. The oxidation peaks correspond to the process of Li2S/Li2S2 to Li2Sn and the subsequent conversion to S8. M-Ni3Fe/Ni3ZnC0.7/S exhibits the largest current response and the smallest polarization potential difference as well. Tafel curves representing different stages were used to assess the capacity of various samples to promote LiPSs conversion. As seen in Fig. 4e and Fig. S13, M-Ni3Fe/Ni3ZnC0.7/S delivers the lower Tafel slope value (106 mV dec−1) compared with Ni3Fe (172 mV dec−1), L-Ni3Fe/Ni3ZnC0.7/S (144 mV dec−1) and H-Ni3Fe/Ni3ZnC0.7/S (120 mV dec−1), demonstrating the advantages of the reduction process. In addition, Fig. 4f exhibits M-Ni3Fe/Ni3ZnC0.7/S a faster reaction rate (64.2 mV dec−1) in the oxidation process. The findings demonstrate that M-Ni3Fe/Ni3ZnC0.7 promotes the reduction of Li2Sn in addition to having an advantage in the oxidation process. CV of various sweep speeds was used to compare the Li+ diffusion of several samples. Fig. 4g displays the CV curves with the M-Ni3Fe/Ni3ZnC0.7/S cathode at different scanning speeds. The matching peak current rises as the scanning rate does. The diffusion coefficients of each electrode were then further determined using the conventional Randles-Sevcik equation following the CV curves of other samples in Fig. S14 (1) I p = 2.69 × 10 5 n 3 / 2 A D L i + 1 / 2 C L i + v 1 / 2 The peak current is denoted by I p, the number of electrons in the reaction is expressed as n, A stands for the electrode area (0.785 cm2), and the Li+ diffusion coefficient is represented as D Li+, the Li+ concentration in the electrolyte is regarded as C Li+, and the scan rate is denoted by v. Fig. S15 manifests the corresponding relationship between the square root of scan rate v 1/2 and peak current I p of different cathodes. Both the oxidation and reduction peaks showed the greatest fitting slopes in M-Ni3Fe/Ni3ZnC0.7/S. Fig. 4h shows the corresponding Li+ diffusion coefficient, in which M-Ni3Fe/Ni3ZnC0.7/S exhibits a greater coefficient with 4 × 10−11 cm2 S−1 and 1.32 × 10−10 cm2 S−1, showing that M-Ni3Fe/Ni3ZnC0.7 is more conducive to lithium-ion diffusion and promotes reaction kinetics. To investigate the mechanism underlying the elevated redox kinetics, electrochemical impedance spectra were obtained. Due to the excellent electrical conductivity of the modified heterostructure, the M-Ni3Fe/Ni3ZnC0.7/S cell had the lowest charge-transfer resistance, as shown in Fig. 4i. And the corresponding equivalent circuit of EIS is shown in Fig. S16. Consequently, charge transfer was encouraged and the transformation dynamics were enhanced. The resistance of the solid Li2S2/Li2S passivation layer formed during cycling was linked to the emergence of an extra semicircle in the high-frequency region following the cycles. To illustrate the catalytic properties of M-Ni3Fe/Ni3ZnC0.7 as a multifunctional catalyst in different reaction steps, the effects of M-Ni3Fe/Ni3ZnC0.7 on Li2S were further evaluated. Fig. 5 a, b and Fig. S17 compare the constant current discharge curve at 2.05 V, which can be fitted into three parts: reduction of Li2S8, reduction of Li2S6, and deposition of Li2S. Nucleation capacity is related to the area under the fitted curve. M-Ni3Fe/Ni3ZnC0.7 showed the earliest time response (5.9 min) and showed a capacity of 89.7 mA h g−1. Compared with Ni3Fe/Ni3ZnC0.7, Ni3Fe represents a slower response time (10.3 min) and a lower capacity (32.7 mA h g−1). Different contents of Ni3Fe/Ni3ZnC0.7 have different effects on the nucleation of Li2S. H-Ni3Fe/Ni3ZnC0.7 showed a relatively large current response time (9.7 min) and larger capacity (77.3 mA h g−1), while L-Ni3Fe/Ni3ZnC0.7 showed the latest response time (15.4 min) due to poor LiPSs adsorption. Furthermore, the current–time response (Fig. S18) was fitted using four classical electrochemical deposition models: 2DP (2D progressive nucleation), 2DI (2D instantaneous nucleation), 3DP (3D progressive nucleation), and 3DI (3D instantaneous nucleation) [56,57]. The t m corresponding to the peak current on the potentiostatic curve can be acquired by the following (2) t m = 2 π A k 2 1 / 3 A represents the nucleation rate constant, while k denotes the growth rate in the above Equation. It can be shown that Ni3Fe exhibits a mixed mode of 2DI-3DP by comparing the current curves of various samples. Upon generating a heterogeneous structure, it exhibits a propensity to convert to 3DP-3DI even though no nucleation mode adjustment is accomplished (Fig. 5c). The findings demonstrated that the formation of heterogeneous structures impacted the deposition pattern of Li2S and further encouraged its nucleation. To directly observe the deposition form and morphology of Li2S products, the battery was disassembled after a deposition test on carbon paper and the SEM test was conducted in Fig. 5e. The surface of the Ni3Fe/M-Ni3ZnC0.7 electrode is almost completely covered by transverse and solid materials, and there is a certain gap structure between the materials. However, sparsely deposited Li2S solid can be observed on the Ni3Fe electrode, indicating that M-Ni3Fe/Ni3ZnC0.7 delivers highly efficient Li2S deposition behavior. In addition, the decomposition process of Li2S is also compared in Fig. 5f and Fig. S19. Among them, M-Ni3Fe/Ni3ZnC0.7 shows the largest peak current response and the largest integral area under the curve, which indicates the effectiveness of M-Ni3Fe/Ni3ZnC0.7 as a bidirectional catalyst and reduces the reaction energy barrier in the oxidation process. Ni3Fe exhibited nearly no correlation peak of Li2S decomposition, which suggests that it has limited catalytic activity for Li2S dissociation. In summary, heterostructure formation aided in promoting the efficient nucleation and development of Li2S while facilitating the decomposition process. To capture real-time information on the dynamic process of polysulfide evolution, the dynamic evolution of dissolved LiPSs was measured by in situ UV–vis measurement [58,59]. Fig. 6 b, e shows that the discharge time of M-Ni3Fe/Ni3ZnC0.7/S is longer, and the positive electrode of M-Ni3Fe/Ni3ZnC0.7/S has a higher specific discharge capacity during the reduction process. Fig. 6c, f further contrasts the differences on M-Ni3Fe/Ni3ZnC0.7/S and Ni3Fe/S in the reduction process by examining the absorbance change. Absorbance at 420, 480 and 560 nm corresponds to the characteristic wavelengths of Li2S4, Li2S6 and Li2S8, respectively. In contrast to Ni3Fe/S, M-Ni3Fe/Ni3ZnC0.7/S showed an increase in absorbance at 5% DOD of various wavelength compounds, showing the rapid dissolution of LiPSs. Additionally, the absorbance exhibits a further decrease at 40% DOD, which results from the continued interaction of dissolved LiPSs with the conductive network [60,61]. Notably, the Li2S2-related LiPSs disproportionation process is responsible for the rise in low-order polysulfide concentrations at about 60% DOD. The absorbance alterations of M-Ni3Fe/Ni3ZnC0.7/S at the conclusion of the reduction procedure also show the presence of the disproportionation reaction. On the other hand, Ni3Fe/S exhibited delayed kinetic behavior and extreme hysteresis throughout the reaction. In conclusion, the disproportionation reaction occurs throughout the whole reaction process. The reaction electron channel is created by the regulation of electrons at the heterogeneous interface, which influences the affinity for polysulfide and enhances the reaction kinetics. Theoretical calculations investigated the impact of the development of heterostructure on the D-band center in more detail. Fig. 7 a–c compares the differences in the projected density of states (PDOS) of different samples, and Ni3Fe/Ni3ZnC0.7 demonstrates wider peaks compared with Ni3Fe and Ni3ZnC0.7, indicating a higher level of orbital hybridization. Also, Fig. S20 examines the D-band levels of several samples in further detail. The findings indicate the construction of Ni3Fe/Ni3ZnC0.7 improves the D-band center (−2.38 eV) in contrast to Ni3ZnC0.7 (−3.12 eV), boosting the interaction with LiPSs. The greatest interaction with LiPSs was indicated by the most upwardly shifted D-band of Ni3Fe (−1.43 eV). The improvement of the D-band center in heterojunctions is mainly achieved by adjusting the electronic structure. Strong interfacial coupling in the heterostructure can increase the interfacial electron transfer and cause the D-band center to shift by forming an embedded electric field, promoting electron rearrangement in the hybrid catalyst. Additionally, a comparison was made regarding the binding energies of various polysulfides on various samples, the corresponding adsorption models were exhibited in Figs. S21–S23. Fig. S24 shows that the binding energy of various polysulfides on Ni3ZnC0.7 is the lowest, indicating the poor adsorption capacity towards LiPSs. The creation of Ni3Fe/Ni3ZnC0.7 raises the binding energy even more, considerably boosting the adsorption capacity of various polysulfides. With the increase of Fe content in the synthesis process, Ni3Fe showed the highest binding energy among the three samples. Moreover, Fig. 7d confirms the reaction kinetic benefits with Ni3Fe/Ni3ZnC0.7 in a variety of redox processes by calculating the free energy while taking into consideration an assortment of intermediate states (S8, Li2S8, Li2S6, Li2S4, Li2S2, and Li2S). Ni3Fe demonstrated a lower reaction energy (0.54 eV) barrier than Ni3ZnC0.7 (0.67 eV) at the high-order polysulfide transformation stage due to the strong adsorption towards polysulfides. After forming a heterogeneous interface, Ni3Fe/Ni3ZnC0.7 achieved faster reaction kinetics and a lower reaction barrier (0.49 eV) by establishing an adsorption-diffusion-conversion channel path. The conversion process from Li2S2 to Li2S is often considered to be the rate-limiting step in the reduction process, and Ni3Fe/Ni3ZnC0.7 still shows a reduced reaction barrier (0.37 eV) compared to Ni3Fe (0.44 eV) and Ni3ZnC0.7 (0.59 eV). Then, the decomposition energy barrier of Li2S in different samples during oxidation was investigated. As seen in Fig. 7e, Ni3ZnC0.7 (−0.25 eV) has a lower oxidation energy barrier than Ni3Fe (−0.21 eV), which encourages the breakdown of Li2S during the oxidation process, enhancing the reaction kinetics. In particular, the formation of heterogeneous interfaces makes Ni3Fe/Ni3ZnC0.7 (0.11 eV) highlight the smallest reaction barrier, and advantage the dynamics significantly. Subsequently, Fig. 7f, g and Table S4 examine the breaking energy of the LiS bond in various samples. It is evident that Ni3Fe/Ni3ZnC0.7 further lowers the LiS bond energy with the length of the LiS bond of Li2S8 (2.7 Å) and Li2S4 (2.94 Å), facilitating the transition of polysulfide in comparison to Ni3Fe and Ni3ZnC0.7. The aforementioned findings demonstrate that the formation of heterogeneous interfaces enhances the D-band center, increases the adsorption towards polysulfides, and lowers the reaction barrier. These findings demonstrate the effective bidirectional catalytic behavior of Ni3Fe/Ni3ZnC0.7 in LiS batteries. According to the experimental and calculation results, Fig. 7h shows the reaction mechanism in the redox process of LiS batteries. The formation of the heterogeneous interface effectively regulates the electronic structure, optimizes the D-band center, and enables fast, balanced redox reactions of LiPSs. Specifically, the participating electrons could shift from the d orbital to the LUMO energy level of sulfur as a result of the d orbital of Ni3Fe hybridizing with the 2p orbital of sulfur species. The excessively high binding strength in the high d band causes slow desorption and catalytic activity in the sulfur reduction reaction. Ni3Fe/Ni3ZnC0.7 strategically placing the D-band center at the middle of HOMO and LUMO between each sulfur species, allowing for a balanced quick oxidation and reduction process. 3 Conclusions In summary, the optimized Ni3Fe/Ni3ZnC0.7 was built to clarify the thermodynamic development process and examine the connection between the heterogeneous interface and the D-band center. Combining the experimental with the theoretical calculation results, the heterogeneous interface serves as the active site to further promote the electron transfer and improve the catalytic activity, thus reducing the reaction energy barrier. Simultaneously, the shifted D-band center further increases the affinity of Ni3Fe/Ni3ZnC0.7 towards polysulfide and weakens the bonding energy of the LiS bond, which proves the effectiveness of the modulated adsorption as well as bidirectional catalytic behavior of Ni3Fe/Ni3ZnC0.7 in LiS batteries. As a result, the LiS batteries with the cathode of M-Ni3Fe/Ni3ZnC0.7/S deliver impressive long-term cycling stability with a capacity retention of 0.062% per cycle after 500 cycles at 1.0 C. This work verifies the feasibility of the strategy of influencing energy band structure through interface engineering and provides guidance for designing heterogeneous catalysts with high catalytic activity. Experimental section Experimental details can be found in the Supporting Information. CRediT authorship contribution statement Wenlong Xia: Writing – original draft, Investigation, Formal analysis, Conceptualization. Hengzhi Liu: Project administration, Methodology, Investigation. Hong Liu: Supervision, Resources, Methodology. Qianqian Liang: Methodology, Data curation. Lanhua Yi: Investigation, Conceptualization. Manfang Chen: Investigation, Formal analysis, Conceptualization. Xianyou Wang: Investigation, Formal analysis, Data curation. Xingqiao Wu: Writing – review & editing, Supervision, Methodology, Investigation, Conceptualization. Hongbo Shu: Writing – review & editing, Validation, Funding acquisition. Declaration of competing interest The authors declare that they have no known competing financial interests or personal relationships that could have appeared to influence the work reported in this paper. Acknowledgments This work is supported financially by the National Natural Science Foundation of China (52172242, 22109135, 52371237), the Science & Technology Talents Lifting Project of Hunan Province (2023TJ-Z32), the Hunan Provincial Education Office Foundation of China (20B570, 23B0126), the Natural Science Foundation of Hunan Province (2021JJ30659, 2022JJ40423), and the Postgraduate Scientific Research Innovation Project of Hunan Province (QL20230146). Appendix A Supplementary material Supplementary data to this article can be found online at https://doi.org/10.1016/j.jechem.2025.05.018. Appendix A Supplementary material The following are the Supplementary data to this article: Supplementary Data 1 References [1] X.Z. Fan M. Liu J.H. Zhang N. Yao X.H. Zhou S.S. Fedotov Y.Z. Song X. Chen Y.Z. Zhang L. Kong Adv. Funct. Mater. 2025 2425240 10.1002/adfm.202425240 X.Z. Fan, M. Liu, J.H. Zhang, N. Yao, X.H. Zhou, S.S. Fedotov, Y.Z. Song, X. Chen, Y.Z. Zhang, L. Kong, Adv. Funct. Mater. (2025) 2425240, https://doi.org/10.1002/adfm.202425240. [2] J. Park Y.S. Jung Nat. Mater. 24 2025 169 J. Park and Y.S. Jung, Nat. Mater. 24 (2025) 169. [3] R. Li W. Zhao R. Li C. Gan L. Chen Z. Wang X. Yang J. Energy Chem. 106 2025 44 62 R. Li, W. Zhao, R. Li, C. Gan, L. Chen, Z. Wang, X. Yang, J. Energy Chem. 106 (2025) 44–62. [4] R. Bo J. Chen J. Zhang B. Li Q. Fu G. Kalimuldina G. Sun Y. Han L. Kong J. Energy Chem. 93 2024 663 668 R. Bo, J. Chen, J. Zhang, B. Li, Q. Fu, G. Kalimuldina, G. Sun, Y. Han, L. Kong, J. Energy Chem. 93 (2024) 663–668. [5] K. Miao C. Ma J. Zhou Adv. Energy Mater. 14 2024 2402609 K. Miao, C. Ma, J. Zhou, Adv. Energy Mater. 14 (2024) 2402609. [6] D.R. Deng H.J. Xiong Y.L. Luo K.M. Yu J.C. Weng G.F. Li J. Lei Y. Li M.S. Zheng Q.H. Wu Adv. Mater. 36 2024 2406135 D.R. Deng, H.J. Xiong, Y.L. Luo, K.M. Yu, J.C. Weng, G.F. Li, J. Lei, Y. Li, M.S. Zheng, Q.H. Wu, Adv. Mater. 36 (2024) 2406135. [7] C.X. Bi Y.J. Zhu Z. Li M. Zhao X.Q. Zhang B.Q. Li J.Q. Huang Adv. Energy Mater. 14 2024 2402609 C.X. Bi, Y.J. Zhu, Z. Li, M. Zhao, X.Q. Zhang, B.Q. Li, J.Q. Huang, Adv. Energy Mater. 14 (2024) 2402609. [8] H. Zhang Y. Zhang C. Cao W. Zhao K. Huang Y. Zhang Y. Shen Z. Li Y. Huang Energ. Environ. Sci. 17 2024 7047 7057 H. Zhang, Y. Zhang, C. Cao, W. Zhao, K. Huang, Y. Zhang, Y. Shen, Z. Li, Y. Huang, Energy Environ. Sci. 17 (2024) 7047–7057. [9] B. Liu H. Gu J.F. Torres Z. Yin A. Tricoli Energ. Environ. Sci. 17 2024 1073 1082 B. Liu, H. Gu, J.F. Torres, Z. Yin, A. Tricoli, Energy Environ. Sci. 17 (2024) 1073–1082. [10] J. Feng C. Shi X. Zhao Y. Zhang S. Chen X. Cheng J. Song Adv. Mater. 36 2024 2414047 J. Feng, C. Shi, X. Zhao, Y. Zhang, S. Chen, X. Cheng, J. Song, Adv. Mater. 36 (2024) 2414047. [11] S. Kim W.G. Lim H. Jung Y.C. Jeong C.Y. Park S.B. Yang C.H. Lee D. Wang K. Sohn J.W. Han J. Lee Nat. Commun. 16 2025 1649 S. Kim, W.G. Lim, H. Jung, Y.C. Jeong, C.Y. Park, S.B. Yang, C.H. Lee, D. Wang, K. Sohn, J.W. Han, J. Lee, Nat. Commun. 16 (2025) 1649. [12] G. Cai G. Zhang Y. Li L. Wang S. Xie J. Zhang Y.R. Lu T.S. Chan X. Kong X. Wu S. Jin J. Lu H. Ji Adv. Funct. Mater. 2025 2501600 10.1002/adfm.202501600 G. Cai, G. Zhang, Y. Li, L. Wang, S. Xie, J. Zhang, Y.R. Lu, T.S. Chan, X. Kong, X. Wu, S. Jin, J. Lu, H. Ji, Adv. Funct. Mater. (2025) 2501600. https://doi.org/10.1002/adfm.202501600. [13] J. Zhang Q. Fu P. Li R. Linghu X. Fan H. Lin J. Bian S. Han G. Sun L. Kong Particuology 89 2024 238 245 J. Zhang, Q. Fu, P. Li, R. Linghu, X. Fan, H. Lin, J. Bian, S. Han, G. Sun, L. Kong, Particuology 89 (2024) 238–245. [14] B. Hammer, J.K. Nørskov, Advances in Catalysis, Elsevier, Amsterdam, 2000, pp. 71. [15] L. Chen J.T. Ren Z.Y. Yuan Adv. Energy Mater. 13 2023 2203720 L. Chen, J.T. Ren, Z.Y. Yuan, Adv. Energy Mater. 13 (2023) 2203720. [16] L. Cai H. Ying W.Q. Han Mater. Today 85 2025 319 346 L. Cai, H. Ying, W.Q. Han, Materials Today 85 (2025) 319–346. [17] M. Zhao H.J. Peng B.Q. Li J.Q. Huang Acc. Chem. Res. 57 2024 545 557 M. Zhao, H.J. Peng, B.Q. Li, J.Q. Huang, Acc. Chem. Res 57 (2024) 545–557. [18] J.H. Zhang X.Z. Fan X.H. Zhou R.J. Hu N. Du C. Guan S.B. Han B.Q. Li L. Kong Energy Storage Mater. 73 2024 103786 J.H. Zhang, X.Z. Fan, X.H. Zhou, R.J. Hu, N. Du, C. Guan, S.B. Han, B.Q. Li, L. Kong, Energy Storage Mater. 73 (2024) 103786. [19] A. Nazir A. Pathak D. Hamal O. Awadallah S. Motevalian A. Claus V. Drozd B. El-Zahab Energy Environ. Mater. 8 2025 e12844 A. Nazir, A. Pathak, D. Hamal, O. Awadallah, S. Motevalian, A. Claus, V. Drozd, B. El‐Zahab, Energy & Environmental Materials 8 (2025) e12844. [20] Y. Dong D. Cai T. Li S. Yang X. Zhou Y. Ge H. Tang H. Nie Z. Yang ACS Nano 16 2022 6414 6425 Y. Dong, D. Cai, T. Li, S. Yang, X. Zhou, Y. Ge, H. Tang, H. Nie, Z. Yang, ACS Nano 16 (2022) 6414–6425. [21] W. Xiao K. Yoo J. Kim H. Xu ACS Nano 18 2024 32732 32745 W. Xiao, K. Yoo, J. Kim, H. Xu, ACS Nano 18 (2024) 32732–32745. [22] J. Zhou A. Sun Chem. Eng. J. 488 2024 150719 J. Zhou, A. Sun, Chem. Eng. J. 488 (2024) 150719. [23] M. Du F. Yu S. Gong F. Liu Adv. Funct. Mater. 35 2025 2413826 M. Du, F. Yu, S. Gong, F. Liu, Adv. Funct. Mater. 35 (2025) 2413826. [24] M. Du X. Zhao G. Zhu H.Y. Hsu F. Liu J. Mater. Chem. A 9 2021 4933 4944 M. Du, X. Zhao, G. Zhu, H.Y. Hsu, F. Liu, J. Mater. Chem. A 9 (2021) 4933–4944. [25] N. Song J. Ma Y. Liang P. Wang J. Yuan S. Xiong X. Li J. Feng B. Xi Adv. Mater. 2025 2420588 N. Song, J. Ma, Y. Liang, P. Wang, J. Yuan, S. Xiong, X. Li, J. Feng, B. Xi, Adv. Mater. (2025) 2420588. [26] X. Zhang X. Zhang X. Wang G. Cui H. Pan W. Sun Energ. Environ. Sci. 18 2025 3553 3567 X. Zhang, X. Zhang, X. Wang, G. Cui, H. Pan, W. Sun, Energy Environ. Sci.18 (2025) 3553–3567. [27] H. Xu Q. Jiang Z. Shu K.S. Hui S. Wang Y. Zheng X. Liu H. Xie W.F. Ip C. Zha Y. Cai K.N. Hui Adv. Sci. 11 2024 2307995 H. Xu, Q. Jiang, Z. Shu, K.S. Hui, S. Wang, Y. Zheng, X. Liu, H. Xie, W.F. Ip, C. Zha, Y. Cai, K.N. Hui, Adv. Sci. 11 (2024) 2307995. [28] J. Qin R. Wang P. Xiao D. Wang Engineering cooperative catalysis in Li-S batteries Adv. Energy Mater. 13 2023 2300611 J. Qin, R. Wang, P. Xiao, D. Wang, Engineering Cooperative Catalysis in Li-S Batteries, Adv. Energy Mater. 13 (2023) 2300611. [29] D. Yang M. Li X. Zheng X. Han C. Zhang J. Jacas Biendicho J. Llorca J. Wang H. Hao J. Li G. Henkelman J. Arbiol J.R. Morante D. Mitlin S. Chou A. Cabot ACS Nano 16 2022 11102 11114 D. Yang, M. Li, X. Zheng, X. Han, C. Zhang, J. Jacas Biendicho, J. Llorca, J. Wang, H. Hao, J. Li, G. Henkelman, J. Arbiol, J.R. Morante, D. Mitlin, S. Chou, A. Cabot, ACS Nano 16 (2022) 11102–11114. [30] B. Li P. Wang J. Yuan N. Song J. Feng S. Xiong B. Xi Adv. Mater. 36 2024 2309324 B. Li, P. Wang, J. Yuan, N. Song, J. Feng, S. Xiong and B. Xi, Adv. Mater. 36 (2024) 2309324. [31] K. Zhang Z. Zhao H. Chen Y. Pan B. Niu D. Long Y. Zhang Small 21 2025 2409674 K. Zhang, Z. Zhao, H. Chen, Y. Pan, B. Niu, D. Long, Y. Zhang, Small 21 (2025) 2409674. [32] Y. Guo Q. Niu F. Pei Q. Wang Y. Zhang L. Du Y. Zhang Y. Zhang Y. Zhang L. Fan Q. Zhang L. Yuan Y. Huang Energ. Environ. Sci. 17 2024 1330 1367 Y. Guo, Q. Niu, F. Pei, Q. Wang, Y. Zhang, L. Du, Y. Zhang, Y. Zhang, Y. Zhang, L. Fan, Q. Zhang, L. Yuan, Y. Huang, Energy Environ. Sci. 17 (2024) 1330–1367. [33] X. Wu R. Xie D. Cai B. Fei C. Zhang Q. Chen B. Sa H. Zhan Adv. Funct. Mater. 34 2024 2315012 X. Wu, R. Xie, D. Cai, B. Fei, C. Zhang, Q. Chen, B. Sa, H. Zhan, Adv. Funct. Mater. 34 (2024) 2315012. [34] Y. Zhuang H. Yang Y. Li Y. Zhao H. Min S. Cui X. Shen H.Y. Chen Y. Wang J. Wang ACS Nano 19 2025 11058 11074 Y. Zhuang, H. Yang, Y. Li, Y. Zhao, H. Min, S. Cui, X. Shen, H.Y. Chen, Y. Wang, J. Wang, ACS Nano 19 (2025) 11058–11074. [35] J. Zhu Y. Xian F. Liang C. Lin H. He N. Wang D. Huang Y. Zhu Adv. Funct. Mater. 2025 2425945 J. Zhu, Y. Xian, F. Liang, C. Lin, H. He, N. Wang, D. Huang, Y. Zhu, Adv. Funct. Mater. (2025) 2425945. [36] X. Ye F. Wu Z. Xue H. Yuan S. Mei J. Wang R. Yang X. Wu X. Zhao H. Pan Q. Zhang Y. Xiang M. Huang F. Li Adv. Funct. Mater. 2024 2417776 X. Ye, F. Wu, Z. Xue, H. Yuan, S. Mei, J. Wang, R. Yang, X. Wu, X. Zhao, H. Pan, Q. Zhang, Y. Xiang, M. Huang, F. Li, Adv. Funct. Mater. (2024) 2417776. [37] Z. Ma Z. Qi G. Song S. Huang Z. Du J. Dong C. Guan P. Luo P. Gan B. Yu B. Guo J. Chen M. Wang J. Zhang X. Li J. Zhang F. Li Adv. Funct. Mater. 34 2024 2403101 Z. Ma, Z. Qi, G. Song, S. Huang, Z. Du, J. Dong, C. Guan, P. Luo, P. Gan, B. Yu, B. Guo, J. Chen, M. Wang, J. Zhang, X. Li, J. Zhang, F. Li, Adv. Funct. Mater.34 (2024) 2403101. [38] A. Huang L. Kong B. Zhang X. Liu L. Wang L. Li J. Xu ACS Nano 18 2024 12795 12807 A. Huang, L. Kong, B. Zhang, X. Liu, L. Wang, L. Li, J. Xu, ACS Nano 18 (2024) 12795–12807. [39] C.Y. Kung Y.P. Chiang T.C. Chan S.H. Chung J. Power Sources 622 2024 235365 C.Y. Kung, Y.P. Chiang, T.C. Chan, S.H. Chung, J. Power Sources 622 (2024) 235365. [40] P. Wang B. Xi S. Xiong Acc. Chem. Res. 57 2024 2093 2104 P. Wang, B. Xi, S. Xiong, Acc. Chem. Res 57 (2024) 2093–2104. [41] H. Zhang H. Zhou H. Wang Y. Wang X. Yang D. Wu P. Yuan M. He W. Wei T. Yang Adv. Energy Mater. 15 2025 2403464 H. Zhang, H. Zhou, H. Wang, Y. Wang, X. Yang, D. Wu, P. Yuan, M. He, W. Wei, T. Yang, Advanced Energy Mater. 15 (2025) 2403464. [42] C. Lu S. Yang P. Shi S. Huang C. Cai J. Zhu X. Zhuang T. Wang Angew. Chem. Int. Ed. 64 2025 e202502846 C. Lu, S. Yang, P. Shi, S. Huang, C. Cai, J. Zhu, X. Zhuang, T. Wang, Angew. Chem. Int. Ed. 64 (2025) e202502846. [43] T. Qin X. Zhao Y. Sui D. Wang W. Chen Y. Zhang S. Luo W. Pan Z. Guo D.Y.C. Leung Adv. Mater. 36 2024 2402644 T. Qin, X. Zhao, Y. Sui, D. Wang, W. Chen, Y. Zhang, S. Luo, W. Pan, Z. Guo, D.Y. C. Leung, Adv. Mater. 36 (2024) 2402644. [44] J. Liu P. Li S. Jia Y. Wang L. Jing Z. Liu J. Zhang Q. Qian X. Kang X. Sun Q. Zhu B. Han Nat. Synth. 2025 10.1038/s44160-025-00752-4 J. Liu, P. Li, S. Jia, Y. Wang, L. Jing, Z. Liu, J. Zhang, Q. Qian, X. Kang, X. Sun, Q. Zhu, B. Han, Nat. Synth. (2025). https://doi.org/10.1038/s44160-025-00752-4. [45] S. Li R. Ma J. Hu Z. Li L. Liu X. Wang Y. Lu G.E. Sterbinsky S. Liu L. Zheng J. Liu D. Liu J. Wang Nat. Commun. 13 2022 2916 S. Li, R. Ma, J. Hu, Z. Li, L. Liu, X. Wang, Y. Lu, G.E. Sterbinsky, S. Liu, L. Zheng, J. Liu, D. Liu, J. Wang, Nat. Commun.13 (2022) 2916. [46] W. Xia Y. Chen M. Han X. Wu H. Yang K. Fu M. Chen X. Wang H. Shu Adv. Funct. Mater. 34 2024 2400262 W. Xia, Y. Chen, M. Han, X. Wu, H. Yang, K. Fu, M. Chen, X. Wang and H. Shu, Adv. Funct. Mater. 34 (2024) 2400262. [47] X. Wei S. Xiao R. Wu Z. Zhu L. Zhao Z. Li J. Wang J.S. Chen Z. Wei App. Catal. B: Environ. 302 2022 120861 X. Wei, S. Xiao, R. Wu, Z. Zhu, L. Zhao, Z. Li, J. Wang, J.S. Chen, Z. Wei, App. Catal. B: Environ. 302 (2022) 120861. [48] Y. Xiong S. Hu J. Jiang Y. Liu W. Zhao X. Ji C. Chen M. Fan K. Wang Chem. Eng. J. 499 2024 156320 Y. Xiong, S. Hu, J. Jiang, Y. Liu, W. Zhao, X. Ji, C. Chen, M. Fan, K. Wang, Chem. Eng. J. 499 (2024) 156320. [49] Y. Li Y.C. Miao C. Yang Y.X. Chang Y. Su H. Yan S. Xu Chem. Eng. J. 451 2023 138548 Y. Li, Y.C. Miao, C. Yang, Y.X. Chang, Y. Su, H. Yan, S. Xu, Chem. Eng. J. 451 (2023) 138548. [50] M. Guo H. Meng J. Jin J. Mi J. Mater. Chem. A. 11 2023 6452 6464 M. Guo, H. Meng, J. Jin and J. Mi, J. Mater. Chem. A. 11 (2023) 6452–6464. [51] D. Chen R. Lu R. Yu Y. Dai H. Zhao D. Wu P. Wang J. Zhu Z. Pu L. Chen J. Yu S. Mu Angew. Chem. Int. Ed. 61 2022 e202208642 D. Chen, R. Lu, R. Yu, Y. Dai, H. Zhao, D. Wu, P. Wang, J. Zhu, Z. Pu, L. Chen, J. Yu, S. Mu, Angew. Chem. Int. Ed. 61 (2022) e202208642. [52] Y. Mao C. Qin X. Zhou Z. Zhang J. Yuan Appl. Surf. Sci. 617 2023 156298 Y. Mao, C. Qin, X. Zhou, Z. Zhang, J. Yuan, Appl. Surf. Sci. 617 (2023) 156298. [53] S.S. Zhang Electrochim. Acta 70 2012 344 348 S.S. Zhang, Electrochim. Acta 70 (2012) 344–348. [54] Q. Zhang L. Xu X. Yue J. Liu X. Wang X. He Z. Shi S. Niu W. Gao C. Cheng Z. Liang Adv. Energy Mater. 13 2023 2302620 Q. Zhang, L. Xu, X. Yue, J. Liu, X. Wang, X. He, Z. Shi, S. Niu, W. Gao, C. Cheng, Z. Liang, Adv. Energy Mater. 13 (2023) 2302620. [55] Y. Wang C. Xu B. Li M. Tian M. Liu D. Zhu S. Dou Q. Zhang J. Sun ACS Nano 18 2024 34858 34869 Y. Wang, C. Xu, B. Li, M. Tian, M. Liu, D. Zhu, S. Dou, Q. Zhang, J. Sun, ACS Nano 18 (2024) 34858–34869. [56] Z. Li Y. Zhou Y. Wang Y.C. Lu Adv. Energy Mater. 9 2019 1802207 Z. Li, Y. Zhou, Y. Wang, Y.C. Lu, Adv. Energy Mater. 9 (2019) 1802207. [57] B. Wang L. Wang Y. Kong F. Wang Z. Jing X. Yang Y. Qian M. Chen L. Xu Adv. Energy Mater. 13 2023 2300590 B. Wang, L. Wang, Y. Kong, F. Wang, Z. Jing, X. Yang, Y. Qian, M. Chen, L. Xu, Adv. Energy Mater. 13 (2023) 2300590. [58] Q. Zou Y.C. Lu J. Phys. Chem. Lett. 7 2016 1518 1525 Q. Zou, Y.C. Lu, J.Phys.Chem. Lett.7 (2016) 1518–1525. [59] Y. Liu Z. Ma G. Yang Z. Wu Y. Li J. Gu J. Gautam X. Gong A.N. Chishti S. Duan C. Chen M. Chen L. Ni G. Diao Adv. Funct. Mater. 32 2021 2109462 Y. Liu, Z. Ma, G. Yang, Z. Wu, Y. Li, J. Gu, J. Gautam, X. Gong, A.N. Chishti, S. Duan, C. Chen, M. Chen, L. Ni, G. Diao, Adv. Funct. Mater. 32 (2021) 2109462. [60] W. Xia H. Liu Y. Chen X. Wu Y. Du K. Fu M. Chen X. Yang X. Wang H. Shu Small 21 2024 2408304 W. Xia, H. Liu, Y. Chen, X. Wu, Y. Du, K. Fu, M. Chen, X. Yang, X. Wang, H. Shu, Small 21 (2024) 2408304. [61] Y. Luo Z. Fang S. Duan H. Wu H. Liu Y. Zhao K. Wang Q. Li S. Fan Z. Zheng W. Duan Y. Zhang J. Wang Angew. Chem. Int. Ed. 62 2023 e202215802 Y. Luo, Z. Fang, S. Duan, H. Wu, H. Liu, Y. Zhao, K. Wang, Q. Li, S. Fan, Z. Zheng, W. Duan, Y. Zhang ,J. Wang, Angew.Chem. Int. Ed. 62 (2023) e202215802.",
      "scopus-id": "105006750163",
      "coredata": {
        "eid": "1-s2.0-S2095495625004115",
        "dc:description": "The polysulfide shuttle effect critically hinders lithium-sulfur (LiS) battery development, therefore, the design of heterogeneous interface engineering with “adsorption-catalysis” functions for polysulfide conversion has garnered considerable attention. However, the exploration of the intricate relationship between key electronic properties and catalytic activity at such interfaces remains a challenge. Additionally, a comprehensive understanding of the thermodynamic growth mechanisms for heterostructure materials is lacking. Herein, a Ni-based homologous structure was precisely constructed via thermodynamic control, with a specific focus on optimizing the interface design. The theoretical results show that the heterostructures with adjustable composition realize the appropriate upward shift to the D-band, improving the affinity towards polysulfide, and further reducing the reaction energy barrier. On this basis, the relationship between interface design and the D-band center, as well as catalytic performance, was established. Specifically, M-Ni3Fe/Ni3ZnC0.7 accomplishes the electron enrichment at the interface, supporting the further diffusion of polysulfides, and lowering the LiS bond energy, performing the bidirectional catalytic transformation of polysulfides. As a result, the LiS batteries with the cathode of M-Ni3Fe/Ni3ZnC0.7/S deliver rate performances of discharge capacity of 514 mA h g−1 at 5.0 C. This understanding of the D-band and interfacial design provides a framework for LiS catalyst optimization.",
        "openArchiveArticle": "false",
        "prism:coverDate": "2025-08-31",
        "openaccessUserLicense": null,
        "prism:aggregationType": "Journal",
        "prism:url": "https://api.elsevier.com/content/article/pii/S2095495625004115",
        "dc:creator": [
          {
            "@_fa": "true",
            "$": "Xia, Wenlong"
          },
          {
            "@_fa": "true",
            "$": "Liu, Hengzhi"
          },
          {
            "@_fa": "true",
            "$": "Liu, Hong"
          },
          {
            "@_fa": "true",
            "$": "Liang, Qianqian"
          },
          {
            "@_fa": "true",
            "$": "Yi, Lanhua"
          },
          {
            "@_fa": "true",
            "$": "Chen, Manfang"
          },
          {
            "@_fa": "true",
            "$": "Wang, Xianyou"
          },
          {
            "@_fa": "true",
            "$": "Wu, Xingqiao"
          },
          {
            "@_fa": "true",
            "$": "Shu, Hongbo"
          }
        ],
        "link": [
          {
            "@_fa": "true",
            "@rel": "self",
            "@href": "https://api.elsevier.com/content/article/pii/S2095495625004115"
          },
          {
            "@_fa": "true",
            "@rel": "scidir",
            "@href": "https://www.sciencedirect.com/science/article/pii/S2095495625004115"
          }
        ],
        "dc:format": "application/json",
        "openaccessType": null,
        "pii": "S2095-4956(25)00411-5",
        "prism:volume": "107",
        "prism:publisher": "Science Press and Dalian Institute of Chemical Physics, Chinese Academy of Sciences. Published by Elsevier B.V. and Science Press. All rights are reserved, including those for text and data mining, AI training, and similar technologies.",
        "dc:title": "Interface-driven d-band modulation for dual-function anchoring and catalytic conversion of polysulfides in lithium-sulfur batteries",
        "prism:copyright": "© 2025 Science Press and Dalian Institute of Chemical Physics, Chinese Academy of Sciences. Published by Elsevier B.V. and Science Press. All rights are reserved, including those for text and data mining, AI training, and similar technologies.",
        "openaccess": "0",
        "prism:issn": "20954956",
        "dcterms:subject": [
          {
            "@_fa": "true",
            "$": "Lithium-sulfur battery"
          },
          {
            "@_fa": "true",
            "$": "Heterostructure"
          },
          {
            "@_fa": "true",
            "$": "D-band"
          },
          {
            "@_fa": "true",
            "$": "Interfacial design"
          }
        ],
        "openaccessArticle": "false",
        "prism:publicationName": "Journal of Energy Chemistry",
        "openaccessSponsorType": null,
        "prism:pageRange": "919-928",
        "prism:endingPage": "928",
        "pubType": "fla",
        "prism:coverDisplayDate": "August 2025",
        "prism:doi": "10.1016/j.jechem.2025.05.018",
        "prism:startingPage": "919",
        "dc:identifier": "doi:10.1016/j.jechem.2025.05.018",
        "openaccessSponsorName": null
      },
      "objects": {
        "object": [
          {
            "@category": "standard",
            "@height": "245",
            "@width": "245",
            "@_fa": "true",
            "$": "https://api.elsevier.com/content/object/eid/1-s2.0-S2095495625004115-ga1.jpg?httpAccept=%2A%2F%2A",
            "@multimediatype": "JPEG image file",
            "@type": "IMAGE-DOWNSAMPLED",
            "@size": "30812",
            "@ref": "ga1",
            "@mimetype": "image/jpeg"
          },
          {
            "@category": "standard",
            "@height": "598",
            "@width": "577",
            "@_fa": "true",
            "$": "https://api.elsevier.com/content/object/eid/1-s2.0-S2095495625004115-gr1.jpg?httpAccept=%2A%2F%2A",
            "@multimediatype": "JPEG image file",
            "@type": "IMAGE-DOWNSAMPLED",
            "@size": "132220",
            "@ref": "gr1",
            "@mimetype": "image/jpeg"
          },
          {
            "@category": "standard",
            "@height": "573",
            "@width": "778",
            "@_fa": "true",
            "$": "https://api.elsevier.com/content/object/eid/1-s2.0-S2095495625004115-gr2.jpg?httpAccept=%2A%2F%2A",
            "@multimediatype": "JPEG image file",
            "@type": "IMAGE-DOWNSAMPLED",
            "@size": "129389",
            "@ref": "gr2",
            "@mimetype": "image/jpeg"
          },
          {
            "@category": "standard",
            "@height": "576",
            "@width": "776",
            "@_fa": "true",
            "$": "https://api.elsevier.com/content/object/eid/1-s2.0-S2095495625004115-gr3.jpg?httpAccept=%2A%2F%2A",
            "@multimediatype": "JPEG image file",
            "@type": "IMAGE-DOWNSAMPLED",
            "@size": "113380",
            "@ref": "gr3",
            "@mimetype": "image/jpeg"
          },
          {
            "@category": "standard",
            "@height": "591",
            "@width": "756",
            "@_fa": "true",
            "$": "https://api.elsevier.com/content/object/eid/1-s2.0-S2095495625004115-gr4.jpg?httpAccept=%2A%2F%2A",
            "@multimediatype": "JPEG image file",
            "@type": "IMAGE-DOWNSAMPLED",
            "@size": "127991",
            "@ref": "gr4",
            "@mimetype": "image/jpeg"
          },
          {
            "@category": "standard",
            "@height": "407",
            "@width": "793",
            "@_fa": "true",
            "$": "https://api.elsevier.com/content/object/eid/1-s2.0-S2095495625004115-gr5.jpg?httpAccept=%2A%2F%2A",
            "@multimediatype": "JPEG image file",
            "@type": "IMAGE-DOWNSAMPLED",
            "@size": "78813",
            "@ref": "gr5",
            "@mimetype": "image/jpeg"
          },
          {
            "@category": "standard",
            "@height": "421",
            "@width": "612",
            "@_fa": "true",
            "$": "https://api.elsevier.com/content/object/eid/1-s2.0-S2095495625004115-gr6.jpg?httpAccept=%2A%2F%2A",
            "@multimediatype": "JPEG image file",
            "@type": "IMAGE-DOWNSAMPLED",
            "@size": "71788",
            "@ref": "gr6",
            "@mimetype": "image/jpeg"
          },
          {
            "@category": "standard",
            "@height": "778",
            "@width": "756",
            "@_fa": "true",
            "$": "https://api.elsevier.com/content/object/eid/1-s2.0-S2095495625004115-gr7.jpg?httpAccept=%2A%2F%2A",
            "@multimediatype": "JPEG image file",
            "@type": "IMAGE-DOWNSAMPLED",
            "@size": "171590",
            "@ref": "gr7",
            "@mimetype": "image/jpeg"
          },
          {
            "@category": "thumbnail",
            "@height": "164",
            "@width": "164",
            "@_fa": "true",
            "$": "https://api.elsevier.com/content/object/eid/1-s2.0-S2095495625004115-ga1.sml?httpAccept=%2A%2F%2A",
            "@multimediatype": "GIF image file",
            "@type": "IMAGE-THUMBNAIL",
            "@size": "24218",
            "@ref": "ga1",
            "@mimetype": "image/gif"
          },
          {
            "@category": "thumbnail",
            "@height": "164",
            "@width": "158",
            "@_fa": "true",
            "$": "https://api.elsevier.com/content/object/eid/1-s2.0-S2095495625004115-gr1.sml?httpAccept=%2A%2F%2A",
            "@multimediatype": "GIF image file",
            "@type": "IMAGE-THUMBNAIL",
            "@size": "19970",
            "@ref": "gr1",
            "@mimetype": "image/gif"
          },
          {
            "@category": "thumbnail",
            "@height": "161",
            "@width": "219",
            "@_fa": "true",
            "$": "https://api.elsevier.com/content/object/eid/1-s2.0-S2095495625004115-gr2.sml?httpAccept=%2A%2F%2A",
            "@multimediatype": "GIF image file",
            "@type": "IMAGE-THUMBNAIL",
            "@size": "16462",
            "@ref": "gr2",
            "@mimetype": "image/gif"
          },
          {
            "@category": "thumbnail",
            "@height": "163",
            "@width": "219",
            "@_fa": "true",
            "$": "https://api.elsevier.com/content/object/eid/1-s2.0-S2095495625004115-gr3.sml?httpAccept=%2A%2F%2A",
            "@multimediatype": "GIF image file",
            "@type": "IMAGE-THUMBNAIL",
            "@size": "14610",
            "@ref": "gr3",
            "@mimetype": "image/gif"
          },
          {
            "@category": "thumbnail",
            "@height": "164",
            "@width": "210",
            "@_fa": "true",
            "$": "https://api.elsevier.com/content/object/eid/1-s2.0-S2095495625004115-gr4.sml?httpAccept=%2A%2F%2A",
            "@multimediatype": "GIF image file",
            "@type": "IMAGE-THUMBNAIL",
            "@size": "13504",
            "@ref": "gr4",
            "@mimetype": "image/gif"
          },
          {
            "@category": "thumbnail",
            "@height": "112",
            "@width": "219",
            "@_fa": "true",
            "$": "https://api.elsevier.com/content/object/eid/1-s2.0-S2095495625004115-gr5.sml?httpAccept=%2A%2F%2A",
            "@multimediatype": "GIF image file",
            "@type": "IMAGE-THUMBNAIL",
            "@size": "9356",
            "@ref": "gr5",
            "@mimetype": "image/gif"
          },
          {
            "@category": "thumbnail",
            "@height": "151",
            "@width": "219",
            "@_fa": "true",
            "$": "https://api.elsevier.com/content/object/eid/1-s2.0-S2095495625004115-gr6.sml?httpAccept=%2A%2F%2A",
            "@multimediatype": "GIF image file",
            "@type": "IMAGE-THUMBNAIL",
            "@size": "13162",
            "@ref": "gr6",
            "@mimetype": "image/gif"
          },
          {
            "@category": "thumbnail",
            "@height": "164",
            "@width": "159",
            "@_fa": "true",
            "$": "https://api.elsevier.com/content/object/eid/1-s2.0-S2095495625004115-gr7.sml?httpAccept=%2A%2F%2A",
            "@multimediatype": "GIF image file",
            "@type": "IMAGE-THUMBNAIL",
            "@size": "16138",
            "@ref": "gr7",
            "@mimetype": "image/gif"
          },
          {
            "@category": "high",
            "@height": "1085",
            "@width": "1085",
            "@_fa": "true",
            "$": "https://api.elsevier.com/content/object/eid/1-s2.0-S2095495625004115-ga1_lrg.jpg?httpAccept=%2A%2F%2A",
            "@multimediatype": "JPEG image file",
            "@type": "IMAGE-HIGH-RES",
            "@size": "212184",
            "@ref": "ga1",
            "@mimetype": "image/jpeg"
          },
          {
            "@category": "high",
            "@height": "2648",
            "@width": "2556",
            "@_fa": "true",
            "$": "https://api.elsevier.com/content/object/eid/1-s2.0-S2095495625004115-gr1_lrg.jpg?httpAccept=%2A%2F%2A",
            "@multimediatype": "JPEG image file",
            "@type": "IMAGE-HIGH-RES",
            "@size": "1098644",
            "@ref": "gr1",
            "@mimetype": "image/jpeg"
          },
          {
            "@category": "high",
            "@height": "2540",
            "@width": "3446",
            "@_fa": "true",
            "$": "https://api.elsevier.com/content/object/eid/1-s2.0-S2095495625004115-gr2_lrg.jpg?httpAccept=%2A%2F%2A",
            "@multimediatype": "JPEG image file",
            "@type": "IMAGE-HIGH-RES",
            "@size": "841723",
            "@ref": "gr2",
            "@mimetype": "image/jpeg"
          },
          {
            "@category": "high",
            "@height": "2550",
            "@width": "3435",
            "@_fa": "true",
            "$": "https://api.elsevier.com/content/object/eid/1-s2.0-S2095495625004115-gr3_lrg.jpg?httpAccept=%2A%2F%2A",
            "@multimediatype": "JPEG image file",
            "@type": "IMAGE-HIGH-RES",
            "@size": "910554",
            "@ref": "gr3",
            "@mimetype": "image/jpeg"
          },
          {
            "@category": "high",
            "@height": "2617",
            "@width": "3346",
            "@_fa": "true",
            "$": "https://api.elsevier.com/content/object/eid/1-s2.0-S2095495625004115-gr4_lrg.jpg?httpAccept=%2A%2F%2A",
            "@multimediatype": "JPEG image file",
            "@type": "IMAGE-HIGH-RES",
            "@size": "980983",
            "@ref": "gr4",
            "@mimetype": "image/jpeg"
          },
          {
            "@category": "high",
            "@height": "1801",
            "@width": "3513",
            "@_fa": "true",
            "$": "https://api.elsevier.com/content/object/eid/1-s2.0-S2095495625004115-gr5_lrg.jpg?httpAccept=%2A%2F%2A",
            "@multimediatype": "JPEG image file",
            "@type": "IMAGE-HIGH-RES",
            "@size": "591874",
            "@ref": "gr5",
            "@mimetype": "image/jpeg"
          },
          {
            "@category": "high",
            "@height": "1867",
            "@width": "2711",
            "@_fa": "true",
            "$": "https://api.elsevier.com/content/object/eid/1-s2.0-S2095495625004115-gr6_lrg.jpg?httpAccept=%2A%2F%2A",
            "@multimediatype": "JPEG image file",
            "@type": "IMAGE-HIGH-RES",
            "@size": "521437",
            "@ref": "gr6",
            "@mimetype": "image/jpeg"
          },
          {
            "@category": "high",
            "@height": "3443",
            "@width": "3346",
            "@_fa": "true",
            "$": "https://api.elsevier.com/content/object/eid/1-s2.0-S2095495625004115-gr7_lrg.jpg?httpAccept=%2A%2F%2A",
            "@multimediatype": "JPEG image file",
            "@type": "IMAGE-HIGH-RES",
            "@size": "1268481",
            "@ref": "gr7",
            "@mimetype": "image/jpeg"
          },
          {
            "@category": "standard",
            "@_fa": "true",
            "$": "https://api.elsevier.com/content/object/eid/1-s2.0-S2095495625004115-mmc1.docx?httpAccept=%2A%2F%2A",
            "@multimediatype": "Microsoft Word file",
            "@type": "APPLICATION",
            "@size": "8832976",
            "@ref": "mmc1",
            "@mimetype": "application/word"
          },
          {
            "@category": "thumbnail",
            "@_fa": "true",
            "$": "https://api.elsevier.com/content/object/eid/1-s2.0-S2095495625004115-si1.svg?httpAccept=%2A%2F%2A",
            "@multimediatype": "Scalable Vector Graphics file",
            "@type": "ALTIMG",
            "@size": "20543",
            "@ref": "si1",
            "@mimetype": "image/svg+xml"
          },
          {
            "@category": "thumbnail",
            "@_fa": "true",
            "$": "https://api.elsevier.com/content/object/eid/1-s2.0-S2095495625004115-si2.svg?httpAccept=%2A%2F%2A",
            "@multimediatype": "Scalable Vector Graphics file",
            "@type": "ALTIMG",
            "@size": "945",
            "@ref": "si2",
            "@mimetype": "image/svg+xml"
          },
          {
            "@category": "thumbnail",
            "@_fa": "true",
            "$": "https://api.elsevier.com/content/object/eid/1-s2.0-S2095495625004115-si3.svg?httpAccept=%2A%2F%2A",
            "@multimediatype": "Scalable Vector Graphics file",
            "@type": "ALTIMG",
            "@size": "11790",
            "@ref": "si3",
            "@mimetype": "image/svg+xml"
          }
        ]
      },
      "link": {
        "@rel": "abstract",
        "@href": "https://api.elsevier.com/content/abstract/scopus_id/105006750163"
      }
    }
  }
}