{
  "metadata": {
    "title": "Reviewing metal supported solid oxide fuel cells for efficient electricity generation with biofuels for mobility",
    "authors": "; ; ",
    "journal": "Journal of Energy Chemistry",
    "date": "2025-04-30",
    "doi": "10.1016/j.jechem.2024.10.056",
    "abstract": "",
    "uri": "https://api.elsevier.com/content/article/pii/S2095495624007848",
    "pii": "S2095495624007848"
  },
  "fulltext": {
    "full-text-retrieval-response": {
      "scopus-eid": "2-s2.0-85212920757",
      "originalText": "serial JL 286353 291210 291711 291744 291809 31 Journal of Energy Chemistry JOURNALENERGYCHEMISTRY 2024-11-22 2024-11-22 2024-12-24 2024-12-24 2025-03-21T19:58:27 1-s2.0-S2095495624007848 S2095-4956(24)00784-8 S2095495624007848 10.1016/j.jechem.2024.10.056 S300 S300.1 FULL-TEXT 1-s2.0-S2095495624X00133 2025-03-23T02:31:14.401338Z 0 0 20250401 20250430 2025 2024-11-22T09:26:44.50976Z absattachment articleinfo articletitlenorm authfirstinitialnorm authfirstsurnamenorm cid cids contenttype copyright crossmark dateloaded dateloadedtxt datesearch datesort dateupdated dco docsubtype doctype doi eid ewtransactionid hubeid indexeddate issn issnnorm itemstage itemtransactionid itemweight openaccess openarchive pg pgfirst pglast pii piinorm pubdateend pubdatestart pubdatetxt pubyr sortorder srctitle srctitlenorm srctype ssids alllist content subj subheadings suppl tomb volfirst volissue volumelist webpdf webpdfpagecount yearnav figure table e-component body mmlmath acknowledge affil appendices articletitle auth authfirstini authfull authkeywords authlast grantnumber grantsponsor grantsponsorid primabst pubtype ref specialabst vitae 2095-4956 20954956 false 103 103 C Volume 103 12 106 153 106 153 202504 April 2025 2025-04-01 2025-04-30 2025 article rev © 2024 Science Press and Dalian Institute of Chemical Physics, Chinese Academy of Sciences. Published by Elsevier B.V. and Science Press. All rights are reserved, including those for text and data mining, AI training, and similar technologies. REVIEWINGMETALSUPPORTEDSOLIDOXIDEFUELCELLSFOREFFICIENTELECTRICITYGENERATIONBIOFUELSFORMOBILITY ANTUNES F 1 Introduction 1.1 Motivation 1.2 Fuel cells 1.3 Biofuels as H2 carrier 1.4 Why do MS-SOFCs make sense? 1.5 Case study 1.6 MS-SOFCs limitations 1.7 What is the point of this review? 2 Methodology 3 SOFCs powered by H2, hydrocarbon, and biofuels: Features, benefits, and drawbacks 3.1 Chemical composition, crystal structure, punctual defects, and electrical conductivity 3.2 SOFCs directly powered by biofuels 3.3 Coking 3.4 Recent break-throughs in SOFC construction 3.5 Advanced approaches for manufacturing high-performance SOFCs 4 MS-SOFCs powered by H2 and biofuels: Features, benefits, and drawbacks 4.1 Innovative design, high efficiency performance, and scalability at low cost 4.2 Anodes for MS-SOFCs 4.3 Electrolytes for MS-SOFC 4.4 Cathodes for MS-SOFC 4.5 PMSs for MS-SOFCs 4.6 DBLs for MS-SOFCs 4.7 ICs and sealants for MS-SOFCs 4.8 Key thoughts on MS-SOFCs powered by hydrocarbons and biofuels 5 External ESR and SMR: A brief overview 6 Re-engineering PMSs for direct and efficient reforming of biofuels 7 MS-SOFC advanced materials and manufacturing techniques 8 MS-SOFCs recycling 9 MS-SOFCs LCA: From the cradle-to-the-grave 10 Advances and perspectives in R&D 11 Conclusions and future perspectives CRediT authorship contribution statement Acknowledgments Appendix A Supplementary material References LUDERER 2019 5229 G ZHENG 2020 166 Y SHAFAEIDOUK 2020 7527 7534 A SONG 2020 14480 14490 W WANG 2020 136823 H GALINDODELAROSA 2020 10900 10910 J UDOMSILP 2020 100072 D TUCKER 2010 4570 4582 M UDOMSILP 2021 2001062 D DEWA 2021 33523 33540 M MA 2021 110119 S VELANDIAVARGAS 2021 149265 J DEOLIVEIRAGONCALVES 2021 36381 36397 F DOGDIBEGOVIC 2020 227598 E SHI 2020 6 N MALAVASI 2010 4370 4387 L STEELE 2001 345 352 B ZHOU 2019 3309 M DAS 2017 268 291 H DIMITROVA 2017 124 142 Z ORMEROD 2003 17 28 R BRETT 2008 1568 1578 D CIGOLOTTI 2021 4963 V VANBIERT 2018 382 396 L MAHATO 2015 141 337 N CHEN 2024 79 109 R BOLDRIN 2019 571 577 P LEAH 2017 2005 2014 R XU 2024 100051 H PIROU 2022 1263 S POLLET 2019 90 95 B WACHSMAN 2012 5498 5509 E NING 2017 5982 5991 F ISANAKA 2016 165 171 S LI 2023 17373 17391 H LEAH 2017 87 95 R KOBAYASHI 2019 109 133 H GLENSOR 2019 6332 K HANDLER 2016 3253 3261 R WACLAWOVSKY 2010 263 276 A YANG 2019 5 19 B HOANG 2021 314 T JAGANMOHAN 2024 1 M LANZINI 2017 150 188 A XU 2020 99 C DENG 2020 511 515 J PONROUCH 2019 20180297 A ANTONIORUFINOJUNIOR 2022 112078 C ZHOU 2021 3139 Z VALENTE 2019 20965 20977 A GARBAYO 2014 3617 3629 I ZHU 2024 316 321 Z GAO 2016 1602 1644 Z DOGDIBEGOVIC 2021 4 6 E WHISTON 2019 2060 2065 M LIU 2021 112564 Z PENISA 2020 5276 X PANTHI 2017 10698 10707 D VILLASBOAS 2014 522 525 L FAGG 2003 1023 1029 D LEWIS 2001 1155 1157 G WANG 2018 109 118 X LEE 2020 2943 2949 Y PAINTER 2017 391 398 A SUBBARAO 1981 1 24 E CHEN 2019 695 701 X CODDET 2014 212 221 P ZHU 2021 279 290 Z ADMASUBESHIWORK 2024 306 316 B SKINNER 2003 30 37 S ASADIKIYA 2016 17438 17445 M BRODNIKOVSKA 2019 79 85 I SELVARAJ 2019 309 320 T BARSOUM 2003 M FUNDAMENTALSCERAMICS GOTSCH 2016 025119 T SHIMIZU 2016 1 8 T HUANG 2009 K SOLIDOXIDEFUELCELLTECHNOLOGYPRINCIPLESPERFORMANCEOPERATIONS LI 2021 1374 1398 X MAMIVAND 2013 304 311 M MAMIVAND 2013 5223 5235 M BASU 2004 338 347 B DEVILLE 2004 5697 5707 S DEVILLE 2004 5709 5721 S KELLY 2002 463 557 P SHIBATA 2001 90 98 N CORMACK 1986 177 186 A KROGER 1958 208 223 F MOULSON 2003 A ELECTROCERAMICSMATERIALSPROPERTIESAPPLICATIONS MOGENSEN 2004 279 286 M PANTHI 2018 325 335 D FIGUEIREDO 2013 52 72 F WINCEWICZ 2005 280 296 K RALPH 2001 1161 1172 J IRSHAD 2016 75 M JACOBSON 2010 660 674 A IVERSTIFFEE 2001 1805 1811 E MONTROSS 2002 85 93 C TIETZ 1999 129 139 F HILPERT 1996 3642 3647 K WU 2010 293 305 J SACHITANAND 2013 15328 15334 R AZNAM 2019 148 155 I WACHSMAN 2011 935 939 E TU 2004 284 293 H DESOUZA 1997 57 61 S AGUIAR 2004 120 136 P CHEN 2006 351 357 Y CHEN 2006 436 438 K MOON 2008 1758 1768 H DING 2008 1246 1249 J BAILLY 2012 1 7 N SHI 2017 182 186 N GUO 2009 96 101 X GUO 1996 575 578 X GUO 1995 235 242 X GUO 2004 1 7 X MOGENSEN 2000 63 94 M KHARTON 2001 1105 1117 V KHARTON 2004 135 149 V LIU 1999 115 121 J WANG 2000 3606 S XIONG 2002 E450 Y TULLER 1977 859 867 H GAUTAM 2020 239 M HAYASHI 2000 227 233 H MUCCILLO 2008 B232 R FAN 2022 112646 L FAN 2022 231573 L GUR 2016 1 64 T HU 2023 33537 33547 B LYU 2020 7184 7207 Y SINGHAL 2003 S HIGHTEMPERATURESOLIDOXIDEFUELCELLSFUNDAMENTALSDESIGNAPPLICATIONS MINH 1995 N SCIENCETECHNOLOGYCERAMICFUELCELLS HUIJSMANS 2001 317 323 J HASSMANN 2001 78 84 K GARDNER 2000 122 129 F PROFFEN 1993 599 604 T MORI 2006 749 757 T DEVANATHAN 2006 1251 1258 R GALWEY 1995 501 512 A QIU 2021 25208 25224 P MORI 1998 1374 1381 M NI 2007 3238 3247 M SENGODAN 2018 761 780 S ATKINSON 2004 17 27 A PIETA 2021 2001822 I YE 2021 736 745 L LIU 2013 428 440 M AFROZ 2023 10918 10928 L ASLANNEJAD 2016 179 186 H DEMIDOV 2011 5941 5950 D BALDINELLI 2016 492 503 A HANNA 2014 74 111 J QIN 2011 1273 1276 H MA 2021 209 222 M CUI 2023 359 367 D WANG 2022 231854 R SARRUF 2020 5297 5308 B GARCIABARRIOCANAL 2008 676 680 J GARCIABARRIOCANAL 2009 465 J WEI 2021 229199 T CHEN 2018 1042 1050 Y LYU 2023 32 41 Z DEVELOSBAGARINAO 2021 3979 K LI 2020 1879 1887 T ZHOU 2014 2279 2285 Y ZHOU 2014 148 154 Y YE 2012 505 510 X DOGDIBEGOVIC 2019 877 885 E DOGDIBEGOVIC 2019 226935 E DOGDIBEGOVIC 2019 91 98 E MAO 2023 113597 J ROJEKWOCKNER 2016 65 74 V NENNING 2020 5 9 A BISCHOF 2019 31475 31487 C DEWA 2022 231625 M YANG 2019 49 66 L TUCKER 2017 2175 2181 M BLENNOW 2009 701 710 P TAN 2018 18133 18142 J BLENNOW 2011 7117 7125 P MIURA 2023 25487 25498 Y BABAEI 2009 B1022 A ALVAREZMORENO 2021 1 10 A SHI 2020 764 774 H HAN 2012 157 162 F OPAKHAI 2023 4700 S CHASTA 2022 14627 14658 G GOMES 2009 1041 1052 E HAYDN 2014 52 60 M HUI 2007 308 323 R DU 2024 1133 1141 K HERMAWAN 2017 10450 10459 E MARCANO 2017 170 177 D ZHANG 2024 44391 44400 M HAYDN 2013 382 387 M ROEHRENS 2016 762 D SONDERBY 2014 1 6 S SONDERBY 2014 452 458 S HAGEN 2020 29201 29211 A GAO 2020 1708 1717 J TANHAEI 2017 3035 3042 M ZHANG 2024 964 975 M SOLOVYEV 2016 3921 3928 A PARK 2020 11626 11631 B YANG 2022 121627 Y LIANG 2022 36926 36952 F TANG 2024 618 632 M GAO 2023 147352 J DU 2024 235298 K WANG 2020 223 231 Y ISHIHARA 2008 031205 T LIU 2021 100003 Y YANG 2019 5 19 B GAO 2024 600 609 J BRUGNONI 1995 177 182 C MITTERDORFER 1998 185 218 A WANG 2008 90 95 Z CESARIO 2017 M FRONTIERSINCERAMICSCIENCE VIBHU 2015 32 37 V ZHEN 2007 61 66 Y KOMATSU 2008 132 137 T FAN 2016 72 84 E KIM 2011 3138 3146 Y CASCOS 2016 1 12 V AGUADERO 2010 789 798 A EVANS 2015 1 9 A HUSSAIN 2020 113 126 S SINGH 2021 27643 27674 M WEHRLE 2022 42 64 L MOLIN 2008 31 37 S ANTEPARA 2005 103 107 I DENG 2006 1225 1229 X JEONG 2020 126794 H ROSE 2009 638 645 L SARASKETAZABALA 2012 16 22 E REISERT 2020 30882 30897 M LI 2016 35981 K FRANCO 2007 771 780 T LARRING 2013 71 93 Y SOLIDOXIDEFUELSCELLSFACTSFIGURESGREENENERGYTECHNOLOGY DEMIRANDA 2022 365 374 A YAN 2015 415 427 Y KRISHNAN 2017 e246 V SHAIGAN 2010 1529 1542 N SUDIREDDY 2017 508 516 B FROITZHEIM 2012 217 227 J BANERJEE 2017 M HEATTREATMENTCOMMERCIALSTEELSFORENGINEERINGAPPLICATIONS NEDELEC 2011 3999 4004 R HWANG 2011 1932 1939 C KLEMENSO 2011 9459 9466 T BRANDNER 2008 1501 1504 M SOLOVYEV 2015 14077 14084 A KIM 2010 6420 6427 Y LIU 2022 53840 53849 F ANTOLINI 2023 711 735 E CHUN 2000 3680 C CHUN 2002 B348 C CHUN 2007 C465 C WELANDER 2022 1533 1539 M WELANDER 2022 11261 11269 M LI 2022 231533 Q HU 2023 233544 B DEWA 2024 1408 1416 M HUANG 2007 39 46 B HUANG 2007 288 294 B DIETHELM 2011 7355 7362 S LOFARO 2018 98 110 M YE 2008 512 517 X WANG 2015 22 31 W ZANCHET 2015 3841 3863 D SINGHAL 2002 405 410 S VAIDYA 2006 39 49 P VAIDYA 2006 6614 6618 P ERDOHELYI 2006 367 376 A AUPRETRE 2002 263 267 F AKANDE 2006 1707 1715 A AKPAN 2007 3112 3126 E CIAMBELLI 2010 190 197 P MAS 2008 319 323 V MATHURE 2007 8471 8479 P MORGENSTERN 2005 1708 1716 D SIMSON 2009 58 64 A COMAS 2004 61 68 J FATSIKOSTAS 2004 439 452 A ROSTRUPNIELSEN 1984 1 117 J HOLLADAY 2009 244 260 J PEELA 2011 12881 12894 N SAHOO 2007 139 147 D DAS 2007 92 100 N WU 2014 116 130 Y PUNASE 2019 1027 1042 K LI 2015 446 451 K MURRAY 1999 649 651 E SUN 2005 437 445 J AKANDE 2005 159 175 A DANCINIPONTES 2015 66 74 I DAN 2015 260 268 M BISWAS 2007 36 49 P AUGUSTO 2014 11196 11209 B ROSSETTI 2014 42 53 I KIM 2012 279 292 D CHEN 2014 509 519 L MORAES 2015 35 49 T CHIOU 2014 5653 5662 J FANG 2015 485 496 W KWAK 2015 165 175 B GRELUK 2015 50 59 M MORALES 2015 305 311 M CHEN 2011 5849 5856 S ZHAO 2016 430 437 L LIU 2015 16837 16846 F WANG 2014 5644 5652 Z LEE 2014 139 150 G OSORIOVARGAS 2015 169 181 P HOU 2015 137 140 T ZOU 2015 741 750 J CHIOU 2012 13667 13673 J WANG 2011 13566 13574 F FERENCZ 2014 1205 1218 Z FRUSTERI 2004 611 615 F HE 2012 2 8 Z DELIMA 2009 95 113 S MA 2015 3366 3376 Y XUE 2015 5617 5623 X KIM 2015 4512 4518 T ZHANG 2015 130 136 Y MAJEWSKI 2013 14531 14541 A LI 2010 485 489 Z ANDRADE 2014 343 348 M HARSHINI 2014 415 423 D LERTWITTAYANON 2010 12277 12285 K ZHOU 2014 7291 7305 L OZKARAAYDNOLU 2011 2950 2959 S FOLETTO 2006 531 534 E KHZOUZ 2013 1664 1675 M LUNA 1999 247 252 E DAN 2012 173 193 M MALUF 2009 1547 1553 S PARIZOTTO 2007 12 22 N PERENIGUEZ 2010 346 353 R MIYATA 2006 97 104 T KUSAKABE 2004 319 326 K NAWFAL 2015 1269 1277 M HOMSI 2014 10101 10107 D AMJAD 2015 122 130 U VITA 2015 551 563 A SHINDE 2013 13961 13973 V SIMAKOV 2015 540 549 D KUMAR 2021 16561 16576 A GUO 2021 33533 33541 W POPOV 2023 77 I LLORCA 2013 135 169 J RENEWABLEHYDROGENTECHNOLOGIES MA 2021 29201 29214 S NIELSEN 2018 F90 F96 J LEAH 2015 95 107 R LEAH 2011 351 367 R YANG 2019 394 404 L DOWNING 2021 109096 D YADROITSEV 2009 5523 5527 I TUCKER 2007 477 482 M DEANGELIS 2018 72 79 S OVTAR 2019 4394 4406 S TUCKER 2008 447 451 M LI 2020 100473 Q TAO 2014 F337 F343 Y ZHA 2007 B201 S GOHAR 2024 103241 O DU 2023 3978 P SHIM 2019 629 646 J NDOLOMINGO 2020 6195 6241 M DUPONT 2010 1780 1804 J FERRANDO 2008 845 910 R RICHARDSON 1990 293 309 J KROLL 1996 387 398 V KLEMENSO 2010 7295 7301 T GAO 2020 100065 X COMAN 2013 229 238 V ALMANSI 2002 85 90 N FURIMSKY 1996 223 286 E WRIGHT 2007 113 E KAMIYA 2007 27 33 M GAUTO 2023 101261 M HARAM 2021 4517 4536 M CUSENZA 2019 339 354 M KOROMA 2022 154859 M QIAO 2019 45 53 Q BLANKEMEYER 2021 559 564 S WITTSTOCK 2016 343 364 R BESSEKON 2019 1905 1918 Y NORDELOF 2014 1866 1890 A EVANGELISTI 2017 4339 4355 S BEKEL 2019 2220 2237 K KOUNTOURIS 2024 5517 I GONCALVES 2021 106052 F SILVA 2018 956 963 R CHANDEL 2019 994 1014 A VANRENSSEN 2011 389 390 S VANRENSSEN 2020 799 801 S MOREIRA 2016 55 63 J MAROCCO 2022 8709 8721 P MYRDAL 2016 J PREDICTINGPRICESOLIDOXIDEELECTROLYSERSSOECS LEAH 2005 336 352 R LEAH 2013 461 470 R BANCE 2004 86 90 P MCKENNA 2013 592 597 B RUTTINGER 2011 259 268 M CHRISTIANSEN 2013 43 52 N MOUGIN 2013 481 490 J PIKALOVA 2022 8783 E OLIVEIRA 2023 1 19 L WU 2023 143854 Y MAHBUB 2021 229846 R SATO 2023 233059 K NETZELMANN 2022 1 10 U ZHAO 2020 53 85 C GARCIA 2024 103213 N ANTUNESX2025X106 ANTUNESX2025X106X153 ANTUNESX2025X106XF ANTUNESX2025X106X153XF 2026-12-24T00:00:00.000Z 2026-12-24T00:00:00.000Z http://creativecommons.org/licenses/by-nc-nd/4.0/ © 2024 Science Press and Dalian Institute of Chemical Physics, Chinese Academy of Sciences. Published by Elsevier B.V. and Science Press. All rights are reserved, including those for text and data mining, AI training, and similar technologies. 2024-11-21T15:38:27.459Z http://vtw.elsevier.com/data/voc/AddOnTypes/50.7/aggregated-refined Fundação de Amparo à Pesquisa do Estado de São Paulo 2022/02235-4 2017/11986-5 2014/02163-7 2017/11958-1 FAPESP Fundação de Amparo à Pesquisa do Estado de São Paulo http://data.elsevier.com/vocabulary/SciValFunders/501100001807 http://sws.geonames.org/3469034/ Fundação de Apoio da UFMG 27192-36 01-P-38465/2023 ANEEL ANEEL Agência Nacional de Energia Elétrica http://data.elsevier.com/vocabulary/SciValFunders/501100007133 http://sws.geonames.org/3469034/ CNPq 302180/2022-2 405643/2022-5 306870/2021-5 CNPq Conselho Nacional de Desenvolvimento Científico e Tecnológico http://data.elsevier.com/vocabulary/SciValFunders/501100003593 http://sws.geonames.org/3469034/ The authors express their sincere appreciation for the generous financial support provided by various Brazilian funding agencies, including the Funda\\u00E7\\u00E3o de Amparo \\u00E0 Pesquisa do Estado de S\\u00E3o Paulo (FAPESP, 2022/02235-4, 2017/11958-1, 2017/11986-5, 2014/02163-7), Funda\\u00E7\\u00E3o de Apoio da UFMG (FUNDEP, 27192-36, 01-P-38465/2023) and Conselho Nacional de Desenvolvimento Cient\\u00EDfico e Tecnol\\u00F3gico (CNPq, 405643/2022-5, 302180/2022-2, 306870/2021-5). Additionally, the authors extend their gratitude to Shell (British multinational oil and gas company) for their valuable support and recognize the strategic significance of the assistance received from ANP (Brazil\\u2019s National Oil, Natural Gas, and Biofuels Agency) through the R&D levy regulation. Furthermore, the authors would like to acknowledge the support from AMBAR ENERGIA (Brazilian electric power generation company) and recognize the strategic importance of the assistance provided by ANEEL (Brazil\\u2019s national electricity regulator) through the R&D levy regulation. item S2095-4956(24)00784-8 S2095495624007848 1-s2.0-S2095495624007848 10.1016/j.jechem.2024.10.056 286353 2025-03-23T02:31:14.401338Z 2025-04-01 2025-04-30 1-s2.0-S2095495624007848-main.pdf https://s3-eu-west-1.amazonaws.com/prod-ucs-content-store-eu-west/content/pii:S2095495624007848/MAIN/application/pdf/3f02ad8b8a879cc395b885b7800eecce/main.pdf main.pdf pdf true 8707406 MAIN 48 1-s2.0-S2095495624007848-main_1.png https://s3-eu-west-1.amazonaws.com/prod-ucs-content-store-eu-west/content/pii:S2095495624007848/PREVIEW/image/png/6435834dfebb7f539ac31497a3fd18a3/main_1.png main_1.png png 65202 849 656 IMAGE-WEB-PDF 1 1-s2.0-S2095495624007848-fx1.jpg https://s3-eu-west-1.amazonaws.com/prod-ucs-content-store-eu-west/content/pii:S2095495624007848/fx1/DOWNSAMPLED/image/jpeg/b1b9d3b1752e4a18ca66211b0821ba8a/fx1.jpg fx1 fx1.jpg jpg 6762 154 111 IMAGE-DOWNSAMPLED 1-s2.0-S2095495624007848-fx10.jpg https://s3-eu-west-1.amazonaws.com/prod-ucs-content-store-eu-west/content/pii:S2095495624007848/fx10/DOWNSAMPLED/image/jpeg/0beb7ba550645ed0dab40f3732d0af2a/fx10.jpg fx10 fx10.jpg jpg 8221 155 111 IMAGE-DOWNSAMPLED 1-s2.0-S2095495624007848-fx2.jpg https://s3-eu-west-1.amazonaws.com/prod-ucs-content-store-eu-west/content/pii:S2095495624007848/fx2/DOWNSAMPLED/image/jpeg/d84bfcbcb43fd87e1f480c491a01f575/fx2.jpg fx2 fx2.jpg jpg 9140 155 111 IMAGE-DOWNSAMPLED 1-s2.0-S2095495624007848-fx3.jpg https://s3-eu-west-1.amazonaws.com/prod-ucs-content-store-eu-west/content/pii:S2095495624007848/fx3/DOWNSAMPLED/image/jpeg/651390943382527d9c83f966253aa3b8/fx3.jpg fx3 fx3.jpg jpg 6654 153 111 IMAGE-DOWNSAMPLED 1-s2.0-S2095495624007848-fx4.jpg https://s3-eu-west-1.amazonaws.com/prod-ucs-content-store-eu-west/content/pii:S2095495624007848/fx4/HIGHRES/image/jpeg/6d64d86e715e64f48798a34f8b9c4c39/fx4.jpg fx4 fx4.jpg jpg 4910 155 111 IMAGE-DOWNSAMPLED 1-s2.0-S2095495624007848-fx5.jpg https://s3-eu-west-1.amazonaws.com/prod-ucs-content-store-eu-west/content/pii:S2095495624007848/fx5/MAIN/image/jpeg/5d2aa24d1998d4e411841b7a52035cbf/fx5.jpg fx5 fx5.jpg jpg 7097 155 111 IMAGE-DOWNSAMPLED 1-s2.0-S2095495624007848-fx6.jpg https://s3-eu-west-1.amazonaws.com/prod-ucs-content-store-eu-west/content/pii:S2095495624007848/fx6/DOWNSAMPLED/image/jpeg/fa6113f08aef23f98538f25576da1032/fx6.jpg fx6 fx6.jpg jpg 7310 155 111 IMAGE-DOWNSAMPLED 1-s2.0-S2095495624007848-fx7.jpg https://s3-eu-west-1.amazonaws.com/prod-ucs-content-store-eu-west/content/pii:S2095495624007848/fx7/HIGHRES/image/jpeg/daac84a7a3f0db9b2cf74f7beacb7564/fx7.jpg fx7 fx7.jpg jpg 6784 155 111 IMAGE-DOWNSAMPLED 1-s2.0-S2095495624007848-fx8.jpg https://s3-eu-west-1.amazonaws.com/prod-ucs-content-store-eu-west/content/pii:S2095495624007848/fx8/DOWNSAMPLED/image/jpeg/cd8bbef2a22b42bd03a8b4a0352edb4e/fx8.jpg fx8 fx8.jpg jpg 6881 155 111 IMAGE-DOWNSAMPLED 1-s2.0-S2095495624007848-fx9.jpg https://s3-eu-west-1.amazonaws.com/prod-ucs-content-store-eu-west/content/pii:S2095495624007848/fx9/DOWNSAMPLED/image/jpeg/15e1879ec09bbce13d3a15c95e93e569/fx9.jpg fx9 fx9.jpg jpg 8060 155 111 IMAGE-DOWNSAMPLED 1-s2.0-S2095495624007848-ga1.jpg https://s3-eu-west-1.amazonaws.com/prod-ucs-content-store-eu-west/content/pii:S2095495624007848/ga1/DOWNSAMPLED/image/jpeg/6f81c31266f353b7789eed3f26c78704/ga1.jpg ga1 true ga1.jpg jpg 16298 200 301 IMAGE-DOWNSAMPLED 1-s2.0-S2095495624007848-gr1.jpg https://s3-eu-west-1.amazonaws.com/prod-ucs-content-store-eu-west/content/pii:S2095495624007848/gr1/DOWNSAMPLED/image/jpeg/c8d557d711f1cc84aa91efea61d8b7d4/gr1.jpg gr1 gr1.jpg jpg 60151 667 378 IMAGE-DOWNSAMPLED 1-s2.0-S2095495624007848-gr10.jpg https://s3-eu-west-1.amazonaws.com/prod-ucs-content-store-eu-west/content/pii:S2095495624007848/gr10/HIGHRES/image/jpeg/96b444fb6356029bb03f2fa1fbd6f82e/gr10.jpg gr10 gr10.jpg jpg 39703 372 535 IMAGE-DOWNSAMPLED 1-s2.0-S2095495624007848-gr11.jpg https://s3-eu-west-1.amazonaws.com/prod-ucs-content-store-eu-west/content/pii:S2095495624007848/gr11/DOWNSAMPLED/image/jpeg/ee999dd0f11e48757464df1b6910a77f/gr11.jpg gr11 gr11.jpg jpg 83166 263 711 IMAGE-DOWNSAMPLED 1-s2.0-S2095495624007848-gr12.jpg https://s3-eu-west-1.amazonaws.com/prod-ucs-content-store-eu-west/content/pii:S2095495624007848/gr12/DOWNSAMPLED/image/jpeg/bd3634d27ae73d7d86f3295e631bb4d1/gr12.jpg gr12 gr12.jpg jpg 155116 726 788 IMAGE-DOWNSAMPLED 1-s2.0-S2095495624007848-gr13.jpg https://s3-eu-west-1.amazonaws.com/prod-ucs-content-store-eu-west/content/pii:S2095495624007848/gr13/DOWNSAMPLED/image/jpeg/18ff0d690c15b5ad2af0ac9da5cfc61d/gr13.jpg gr13 gr13.jpg jpg 29130 314 383 IMAGE-DOWNSAMPLED 1-s2.0-S2095495624007848-gr14.jpg https://s3-eu-west-1.amazonaws.com/prod-ucs-content-store-eu-west/content/pii:S2095495624007848/gr14/DOWNSAMPLED/image/jpeg/be2de77a6e32c5b916968b0bca7fce5b/gr14.jpg gr14 gr14.jpg jpg 50605 358 534 IMAGE-DOWNSAMPLED 1-s2.0-S2095495624007848-gr15.jpg https://s3-eu-west-1.amazonaws.com/prod-ucs-content-store-eu-west/content/pii:S2095495624007848/gr15/DOWNSAMPLED/image/jpeg/121d015d0519bbdf0fe1a32ad2d22a57/gr15.jpg gr15 gr15.jpg jpg 53889 176 666 IMAGE-DOWNSAMPLED 1-s2.0-S2095495624007848-gr16.jpg https://s3-eu-west-1.amazonaws.com/prod-ucs-content-store-eu-west/content/pii:S2095495624007848/gr16/DOWNSAMPLED/image/jpeg/2d58f8a06db2e856d8dca22e9fcab6ef/gr16.jpg gr16 gr16.jpg jpg 60512 398 534 IMAGE-DOWNSAMPLED 1-s2.0-S2095495624007848-gr17.jpg https://s3-eu-west-1.amazonaws.com/prod-ucs-content-store-eu-west/content/pii:S2095495624007848/gr17/DOWNSAMPLED/image/jpeg/3ca06b7e590beae935eb14f3335edbf3/gr17.jpg gr17 gr17.jpg jpg 69998 409 534 IMAGE-DOWNSAMPLED 1-s2.0-S2095495624007848-gr18.jpg https://s3-eu-west-1.amazonaws.com/prod-ucs-content-store-eu-west/content/pii:S2095495624007848/gr18/DOWNSAMPLED/image/jpeg/ec12b51b0ad60ed1142269f91a091765/gr18.jpg gr18 gr18.jpg jpg 87657 454 753 IMAGE-DOWNSAMPLED 1-s2.0-S2095495624007848-gr19.jpg https://s3-eu-west-1.amazonaws.com/prod-ucs-content-store-eu-west/content/pii:S2095495624007848/gr19/DOWNSAMPLED/image/jpeg/7a02d66becfbde25523efee792326015/gr19.jpg gr19 gr19.jpg jpg 105572 850 752 IMAGE-DOWNSAMPLED 1-s2.0-S2095495624007848-gr2.jpg https://s3-eu-west-1.amazonaws.com/prod-ucs-content-store-eu-west/content/pii:S2095495624007848/gr2/DOWNSAMPLED/image/jpeg/592565152fdd7b79b0234abd5894ade3/gr2.jpg gr2 gr2.jpg jpg 166901 846 749 IMAGE-DOWNSAMPLED 1-s2.0-S2095495624007848-gr20.jpg https://s3-eu-west-1.amazonaws.com/prod-ucs-content-store-eu-west/content/pii:S2095495624007848/gr20/DOWNSAMPLED/image/jpeg/69362acfed4704c132d5e9dce1ff4216/gr20.jpg gr20 gr20.jpg jpg 30452 305 378 IMAGE-DOWNSAMPLED 1-s2.0-S2095495624007848-gr21.jpg https://s3-eu-west-1.amazonaws.com/prod-ucs-content-store-eu-west/content/pii:S2095495624007848/gr21/DOWNSAMPLED/image/jpeg/8a335f3b3acfd06c9824ea1f5832a79a/gr21.jpg gr21 gr21.jpg jpg 66860 565 578 IMAGE-DOWNSAMPLED 1-s2.0-S2095495624007848-gr3.jpg https://s3-eu-west-1.amazonaws.com/prod-ucs-content-store-eu-west/content/pii:S2095495624007848/gr3/DOWNSAMPLED/image/jpeg/6c4503f95ebc3283b4a29434f2a82ce9/gr3.jpg gr3 gr3.jpg jpg 24986 242 535 IMAGE-DOWNSAMPLED 1-s2.0-S2095495624007848-gr4.jpg https://s3-eu-west-1.amazonaws.com/prod-ucs-content-store-eu-west/content/pii:S2095495624007848/gr4/DOWNSAMPLED/image/jpeg/4c83c1abef2ca980b554165663249183/gr4.jpg gr4 gr4.jpg jpg 75423 293 667 IMAGE-DOWNSAMPLED 1-s2.0-S2095495624007848-gr5.jpg https://s3-eu-west-1.amazonaws.com/prod-ucs-content-store-eu-west/content/pii:S2095495624007848/gr5/DOWNSAMPLED/image/jpeg/7d30ac805fb135dc6a4406e0b89e6376/gr5.jpg gr5 gr5.jpg jpg 32126 342 383 IMAGE-DOWNSAMPLED 1-s2.0-S2095495624007848-gr6.jpg https://s3-eu-west-1.amazonaws.com/prod-ucs-content-store-eu-west/content/pii:S2095495624007848/gr6/DOWNSAMPLED/image/jpeg/420d391f6fe17ba05af557f40c0c89cb/gr6.jpg gr6 gr6.jpg jpg 59551 323 659 IMAGE-DOWNSAMPLED 1-s2.0-S2095495624007848-gr7.jpg https://s3-eu-west-1.amazonaws.com/prod-ucs-content-store-eu-west/content/pii:S2095495624007848/gr7/DOWNSAMPLED/image/jpeg/5576ed14c73df2a5ce803e1c17dc4dcf/gr7.jpg gr7 gr7.jpg jpg 171710 695 750 IMAGE-DOWNSAMPLED 1-s2.0-S2095495624007848-gr8.jpg https://s3-eu-west-1.amazonaws.com/prod-ucs-content-store-eu-west/content/pii:S2095495624007848/gr8/DOWNSAMPLED/image/jpeg/a34df97022d0cb18a1f0927f5e7429cc/gr8.jpg gr8 gr8.jpg jpg 117410 484 778 IMAGE-DOWNSAMPLED 1-s2.0-S2095495624007848-gr9.jpg https://s3-eu-west-1.amazonaws.com/prod-ucs-content-store-eu-west/content/pii:S2095495624007848/gr9/DOWNSAMPLED/image/jpeg/50ea49ae6e6136603f4e113163f2619a/gr9.jpg gr9 gr9.jpg jpg 114895 504 778 IMAGE-DOWNSAMPLED 1-s2.0-S2095495624007848-fx1.sml https://s3-eu-west-1.amazonaws.com/prod-ucs-content-store-eu-west/content/pii:S2095495624007848/fx1/HIGHRES/image/gif/552e8d6d97667f23e1e461c4ea4f6c55/fx1.sml fx1 fx1.sml sml 16731 164 118 IMAGE-THUMBNAIL 1-s2.0-S2095495624007848-fx10.sml https://s3-eu-west-1.amazonaws.com/prod-ucs-content-store-eu-west/content/pii:S2095495624007848/fx10/THUMBNAIL/image/gif/c6aab1c493db5d44e93cb6abab736f5a/fx10.sml fx10 fx10.sml sml 17251 163 117 IMAGE-THUMBNAIL 1-s2.0-S2095495624007848-fx2.sml https://s3-eu-west-1.amazonaws.com/prod-ucs-content-store-eu-west/content/pii:S2095495624007848/fx2/THUMBNAIL/image/gif/5783b1167a05ca19acdff6e9d3fd3a2e/fx2.sml fx2 fx2.sml sml 17721 164 117 IMAGE-THUMBNAIL 1-s2.0-S2095495624007848-fx3.sml https://s3-eu-west-1.amazonaws.com/prod-ucs-content-store-eu-west/content/pii:S2095495624007848/fx3/THUMBNAIL/image/gif/3218516eb45d04e92b475c39622466dc/fx3.sml fx3 fx3.sml sml 16032 164 119 IMAGE-THUMBNAIL 1-s2.0-S2095495624007848-fx4.sml https://s3-eu-west-1.amazonaws.com/prod-ucs-content-store-eu-west/content/pii:S2095495624007848/fx4/HIGHRES/image/gif/52f8724d8e48621426d8aed7dc812473/fx4.sml fx4 fx4.sml sml 14008 164 117 IMAGE-THUMBNAIL 1-s2.0-S2095495624007848-fx5.sml https://s3-eu-west-1.amazonaws.com/prod-ucs-content-store-eu-west/content/pii:S2095495624007848/fx5/THUMBNAIL/image/gif/970ce11d899c206617483ffb3266998f/fx5.sml fx5 fx5.sml sml 17733 164 117 IMAGE-THUMBNAIL 1-s2.0-S2095495624007848-fx6.sml https://s3-eu-west-1.amazonaws.com/prod-ucs-content-store-eu-west/content/pii:S2095495624007848/fx6/THUMBNAIL/image/gif/1fabc47b3252a2fc3212f9b31fd0736a/fx6.sml fx6 fx6.sml sml 15674 164 117 IMAGE-THUMBNAIL 1-s2.0-S2095495624007848-fx7.sml https://s3-eu-west-1.amazonaws.com/prod-ucs-content-store-eu-west/content/pii:S2095495624007848/fx7/THUMBNAIL/image/gif/844d66088d8a935b953052d71effd8c2/fx7.sml fx7 fx7.sml sml 15474 164 117 IMAGE-THUMBNAIL 1-s2.0-S2095495624007848-fx8.sml https://s3-eu-west-1.amazonaws.com/prod-ucs-content-store-eu-west/content/pii:S2095495624007848/fx8/THUMBNAIL/image/gif/7ca3edf2e717cc7d84a83d2ca1b9fd80/fx8.sml fx8 fx8.sml sml 14987 164 117 IMAGE-THUMBNAIL 1-s2.0-S2095495624007848-fx9.sml https://s3-eu-west-1.amazonaws.com/prod-ucs-content-store-eu-west/content/pii:S2095495624007848/fx9/THUMBNAIL/image/gif/7e4dafd31fedc7ce7a2189bf9b5083cc/fx9.sml fx9 fx9.sml sml 18186 164 117 IMAGE-THUMBNAIL 1-s2.0-S2095495624007848-ga1.sml https://s3-eu-west-1.amazonaws.com/prod-ucs-content-store-eu-west/content/pii:S2095495624007848/ga1/THUMBNAIL/image/gif/f46c64c66b89c432e82a911c3c7e6cbb/ga1.sml ga1 true ga1.sml sml 12219 145 219 IMAGE-THUMBNAIL 1-s2.0-S2095495624007848-gr1.sml https://s3-eu-west-1.amazonaws.com/prod-ucs-content-store-eu-west/content/pii:S2095495624007848/gr1/THUMBNAIL/image/gif/d918156df474d72250aa05ad590d9397/gr1.sml gr1 gr1.sml sml 5805 164 93 IMAGE-THUMBNAIL 1-s2.0-S2095495624007848-gr10.sml https://s3-eu-west-1.amazonaws.com/prod-ucs-content-store-eu-west/content/pii:S2095495624007848/gr10/THUMBNAIL/image/gif/ecc5e7b4a4ec75383e4d080247a986eb/gr10.sml gr10 gr10.sml sml 10437 152 219 IMAGE-THUMBNAIL 1-s2.0-S2095495624007848-gr11.sml https://s3-eu-west-1.amazonaws.com/prod-ucs-content-store-eu-west/content/pii:S2095495624007848/gr11/THUMBNAIL/image/gif/b6b465a78f5f738164115e82aad48960/gr11.sml gr11 gr11.sml sml 15939 81 219 IMAGE-THUMBNAIL 1-s2.0-S2095495624007848-gr12.sml https://s3-eu-west-1.amazonaws.com/prod-ucs-content-store-eu-west/content/pii:S2095495624007848/gr12/THUMBNAIL/image/gif/a082e1b617c7c0c43ff6e69abaeb6bb8/gr12.sml gr12 gr12.sml sml 13633 164 178 IMAGE-THUMBNAIL 1-s2.0-S2095495624007848-gr13.sml https://s3-eu-west-1.amazonaws.com/prod-ucs-content-store-eu-west/content/pii:S2095495624007848/gr13/THUMBNAIL/image/gif/b0bd733b38665f96169c4db9131a69e4/gr13.sml gr13 gr13.sml sml 6712 164 200 IMAGE-THUMBNAIL 1-s2.0-S2095495624007848-gr14.sml https://s3-eu-west-1.amazonaws.com/prod-ucs-content-store-eu-west/content/pii:S2095495624007848/gr14/THUMBNAIL/image/gif/496ced40920997e4255f00743f911429/gr14.sml gr14 gr14.sml sml 12850 147 219 IMAGE-THUMBNAIL 1-s2.0-S2095495624007848-gr15.sml https://s3-eu-west-1.amazonaws.com/prod-ucs-content-store-eu-west/content/pii:S2095495624007848/gr15/HIGHRES/image/gif/15131581554faacb2bdbcdb54e87b57f/gr15.sml gr15 gr15.sml sml 8214 58 219 IMAGE-THUMBNAIL 1-s2.0-S2095495624007848-gr16.sml https://s3-eu-west-1.amazonaws.com/prod-ucs-content-store-eu-west/content/pii:S2095495624007848/gr16/THUMBNAIL/image/gif/dcc457c8b8b7001ee64552c7e77aed44/gr16.sml gr16 gr16.sml sml 11813 163 219 IMAGE-THUMBNAIL 1-s2.0-S2095495624007848-gr17.sml https://s3-eu-west-1.amazonaws.com/prod-ucs-content-store-eu-west/content/pii:S2095495624007848/gr17/THUMBNAIL/image/gif/79b36802b58418b5e96626e4c265c4c0/gr17.sml gr17 gr17.sml sml 18485 164 214 IMAGE-THUMBNAIL 1-s2.0-S2095495624007848-gr18.sml https://s3-eu-west-1.amazonaws.com/prod-ucs-content-store-eu-west/content/pii:S2095495624007848/gr18/THUMBNAIL/image/gif/85ca25758369fe961061b1e6379e08e3/gr18.sml gr18 gr18.sml sml 13119 132 219 IMAGE-THUMBNAIL 1-s2.0-S2095495624007848-gr19.sml https://s3-eu-west-1.amazonaws.com/prod-ucs-content-store-eu-west/content/pii:S2095495624007848/gr19/THUMBNAIL/image/gif/5636049b464380c7bf76681dd8687241/gr19.sml gr19 gr19.sml sml 7615 164 145 IMAGE-THUMBNAIL 1-s2.0-S2095495624007848-gr2.sml https://s3-eu-west-1.amazonaws.com/prod-ucs-content-store-eu-west/content/pii:S2095495624007848/gr2/THUMBNAIL/image/gif/3e9a19359fb82a70627a8b80471c6945/gr2.sml gr2 gr2.sml sml 9624 164 145 IMAGE-THUMBNAIL 1-s2.0-S2095495624007848-gr20.sml https://s3-eu-west-1.amazonaws.com/prod-ucs-content-store-eu-west/content/pii:S2095495624007848/gr20/THUMBNAIL/image/gif/c57763d5eb23bbcbfd801f4bde9bf024/gr20.sml gr20 gr20.sml sml 8731 164 203 IMAGE-THUMBNAIL 1-s2.0-S2095495624007848-gr21.sml https://s3-eu-west-1.amazonaws.com/prod-ucs-content-store-eu-west/content/pii:S2095495624007848/gr21/THUMBNAIL/image/gif/5461bd0b909c5a60eaa8e153ce81d9c2/gr21.sml gr21 gr21.sml sml 10344 164 168 IMAGE-THUMBNAIL 1-s2.0-S2095495624007848-gr3.sml https://s3-eu-west-1.amazonaws.com/prod-ucs-content-store-eu-west/content/pii:S2095495624007848/gr3/THUMBNAIL/image/gif/89de2ec813fb0d3df5091c102e8d3d75/gr3.sml gr3 gr3.sml sml 4739 99 219 IMAGE-THUMBNAIL 1-s2.0-S2095495624007848-gr4.sml https://s3-eu-west-1.amazonaws.com/prod-ucs-content-store-eu-west/content/pii:S2095495624007848/gr4/THUMBNAIL/image/gif/41486c95e61be76cfed7225da6df5537/gr4.sml gr4 gr4.sml sml 10582 96 219 IMAGE-THUMBNAIL 1-s2.0-S2095495624007848-gr5.sml https://s3-eu-west-1.amazonaws.com/prod-ucs-content-store-eu-west/content/pii:S2095495624007848/gr5/THUMBNAIL/image/gif/36e50f3fe8701bd18d077801097cd79d/gr5.sml gr5 gr5.sml sml 6931 164 184 IMAGE-THUMBNAIL 1-s2.0-S2095495624007848-gr6.sml https://s3-eu-west-1.amazonaws.com/prod-ucs-content-store-eu-west/content/pii:S2095495624007848/gr6/THUMBNAIL/image/gif/0e9a70e999a2fedcbcf7acdb824ef77a/gr6.sml gr6 gr6.sml sml 9977 107 219 IMAGE-THUMBNAIL 1-s2.0-S2095495624007848-gr7.sml https://s3-eu-west-1.amazonaws.com/prod-ucs-content-store-eu-west/content/pii:S2095495624007848/gr7/THUMBNAIL/image/gif/04b2363416408ad3dfa6cbe82f710abd/gr7.sml gr7 gr7.sml sml 17713 164 177 IMAGE-THUMBNAIL 1-s2.0-S2095495624007848-gr8.sml https://s3-eu-west-1.amazonaws.com/prod-ucs-content-store-eu-west/content/pii:S2095495624007848/gr8/THUMBNAIL/image/gif/679de35a1dbe79bbf0c33b5d995c8b80/gr8.sml gr8 gr8.sml sml 18242 136 219 IMAGE-THUMBNAIL 1-s2.0-S2095495624007848-gr9.sml https://s3-eu-west-1.amazonaws.com/prod-ucs-content-store-eu-west/content/pii:S2095495624007848/gr9/THUMBNAIL/image/gif/306efa37ec30472848c8a085ddd25c96/gr9.sml gr9 gr9.sml sml 17782 142 219 IMAGE-THUMBNAIL 1-s2.0-S2095495624007848-fx1_lrg.jpg https://s3-eu-west-1.amazonaws.com/prod-ucs-content-store-eu-west/content/pii:S2095495624007848/HIGHRES/image/jpeg/31650557fb363d3a40b9c50fba5f9db1/fx1_lrg.jpg fx1 fx1_lrg.jpg jpg 49798 683 492 IMAGE-HIGH-RES 1-s2.0-S2095495624007848-fx10_lrg.jpg https://s3-eu-west-1.amazonaws.com/prod-ucs-content-store-eu-west/content/pii:S2095495624007848/HIGHRES/image/jpeg/c61c1469ca036aabdc578ae267cdfe86/fx10_lrg.jpg fx10 fx10_lrg.jpg jpg 58358 686 492 IMAGE-HIGH-RES 1-s2.0-S2095495624007848-fx2_lrg.jpg https://s3-eu-west-1.amazonaws.com/prod-ucs-content-store-eu-west/content/pii:S2095495624007848/THUMBNAIL/image/jpeg/6b43df23036e126acf3b76a73d47270a/fx2_lrg.jpg fx2 fx2_lrg.jpg jpg 30502 413 295 IMAGE-HIGH-RES 1-s2.0-S2095495624007848-fx3_lrg.jpg https://s3-eu-west-1.amazonaws.com/prod-ucs-content-store-eu-west/content/pii:S2095495624007848/HIGHRES/image/jpeg/a61b61df5a5ed38d36bcfba27f60b7be/fx3_lrg.jpg fx3 fx3_lrg.jpg jpg 46799 676 492 IMAGE-HIGH-RES 1-s2.0-S2095495624007848-fx4_lrg.jpg https://s3-eu-west-1.amazonaws.com/prod-ucs-content-store-eu-west/content/pii:S2095495624007848/THUMBNAIL/image/jpeg/cbfbd4944a100380270bb6b544e02a9e/fx4_lrg.jpg fx4 fx4_lrg.jpg jpg 14543 413 295 IMAGE-HIGH-RES 1-s2.0-S2095495624007848-fx5_lrg.jpg https://s3-eu-west-1.amazonaws.com/prod-ucs-content-store-eu-west/content/pii:S2095495624007848/HIGHRES/image/jpeg/0678d260a9cb76a36be5fd7d822cac86/fx5_lrg.jpg fx5 fx5_lrg.jpg jpg 21281 413 295 IMAGE-HIGH-RES 1-s2.0-S2095495624007848-fx6_lrg.jpg https://s3-eu-west-1.amazonaws.com/prod-ucs-content-store-eu-west/content/pii:S2095495624007848/DOWNSAMPLED/image/jpeg/51d891aba7f5389b03cf5b002a86e4aa/fx6_lrg.jpg fx6 fx6_lrg.jpg jpg 22032 413 295 IMAGE-HIGH-RES 1-s2.0-S2095495624007848-fx7_lrg.jpg https://s3-eu-west-1.amazonaws.com/prod-ucs-content-store-eu-west/content/pii:S2095495624007848/HIGHRES/image/jpeg/53aa97e1ae08d19f17d6f0beaf0914a6/fx7_lrg.jpg fx7 fx7_lrg.jpg jpg 20930 413 295 IMAGE-HIGH-RES 1-s2.0-S2095495624007848-fx8_lrg.jpg https://s3-eu-west-1.amazonaws.com/prod-ucs-content-store-eu-west/content/pii:S2095495624007848/HIGHRES/image/jpeg/ee142fd574c7d1ae6447990f13c6f69b/fx8_lrg.jpg fx8 fx8_lrg.jpg jpg 21314 413 295 IMAGE-HIGH-RES 1-s2.0-S2095495624007848-fx9_lrg.jpg https://s3-eu-west-1.amazonaws.com/prod-ucs-content-store-eu-west/content/pii:S2095495624007848/HIGHRES/image/jpeg/24c864b30cc36b4777a7a80b90f1cfac/fx9_lrg.jpg fx9 fx9_lrg.jpg jpg 26999 413 295 IMAGE-HIGH-RES 1-s2.0-S2095495624007848-ga1_lrg.jpg https://s3-eu-west-1.amazonaws.com/prod-ucs-content-store-eu-west/content/pii:S2095495624007848/DOWNSAMPLED/image/jpeg/ce5ba9cad8bed7be50f33d27f1a92944/ga1_lrg.jpg ga1 true ga1_lrg.jpg jpg 112513 886 1336 IMAGE-HIGH-RES 1-s2.0-S2095495624007848-gr1_lrg.jpg https://s3-eu-west-1.amazonaws.com/prod-ucs-content-store-eu-west/content/pii:S2095495624007848/HIGHRES/image/jpeg/c1ceecc4c15acc51a6425300956ef9c1/gr1_lrg.jpg gr1 gr1_lrg.jpg jpg 315517 2950 1673 IMAGE-HIGH-RES 1-s2.0-S2095495624007848-gr10_lrg.jpg https://s3-eu-west-1.amazonaws.com/prod-ucs-content-store-eu-west/content/pii:S2095495624007848/HIGHRES/image/jpeg/3d770ef4e12c626b48969860a6afa866/gr10_lrg.jpg gr10 gr10_lrg.jpg jpg 245132 1646 2368 IMAGE-HIGH-RES 1-s2.0-S2095495624007848-gr11_lrg.jpg https://s3-eu-west-1.amazonaws.com/prod-ucs-content-store-eu-west/content/pii:S2095495624007848/DOWNSAMPLED/image/jpeg/1008178a911d59f60aa346ac8161d8d0/gr11_lrg.jpg gr11 gr11_lrg.jpg jpg 492805 1165 3150 IMAGE-HIGH-RES 1-s2.0-S2095495624007848-gr12_lrg.jpg https://s3-eu-west-1.amazonaws.com/prod-ucs-content-store-eu-west/content/pii:S2095495624007848/HIGHRES/image/jpeg/626789c96d3b5537fc148049dc39d53a/gr12_lrg.jpg gr12 gr12_lrg.jpg jpg 842320 3214 3487 IMAGE-HIGH-RES 1-s2.0-S2095495624007848-gr13_lrg.jpg https://s3-eu-west-1.amazonaws.com/prod-ucs-content-store-eu-west/content/pii:S2095495624007848/HEAD-ONLY-JATS/image/jpeg/bcae82007309f1373f37f95579db6376/gr13_lrg.jpg gr13 gr13_lrg.jpg jpg 165358 1395 1699 IMAGE-HIGH-RES 1-s2.0-S2095495624007848-gr14_lrg.jpg https://s3-eu-west-1.amazonaws.com/prod-ucs-content-store-eu-west/content/pii:S2095495624007848/HIGHRES/image/jpeg/144141b03a5c1f6c8ab17c8b42e2fb84/gr14_lrg.jpg gr14 gr14_lrg.jpg jpg 324617 1586 2367 IMAGE-HIGH-RES 1-s2.0-S2095495624007848-gr15_lrg.jpg https://s3-eu-west-1.amazonaws.com/prod-ucs-content-store-eu-west/content/pii:S2095495624007848/HIGHRES/image/jpeg/22704600ad510b4346eb16b5a8ac93a2/gr15_lrg.jpg gr15 gr15_lrg.jpg jpg 378437 777 2947 IMAGE-HIGH-RES 1-s2.0-S2095495624007848-gr16_lrg.jpg https://s3-eu-west-1.amazonaws.com/prod-ucs-content-store-eu-west/content/pii:S2095495624007848/HIGHRES/image/jpeg/f85afaae5aaee68a2d7ea30f219472d5/gr16_lrg.jpg gr16 gr16_lrg.jpg jpg 341813 1766 2367 IMAGE-HIGH-RES 1-s2.0-S2095495624007848-gr17_lrg.jpg https://s3-eu-west-1.amazonaws.com/prod-ucs-content-store-eu-west/content/pii:S2095495624007848/HIGHRES/image/jpeg/a5bff8e73d31ea558510066edb6bb045/gr17_lrg.jpg gr17 gr17_lrg.jpg jpg 503801 1812 2367 IMAGE-HIGH-RES 1-s2.0-S2095495624007848-gr18_lrg.jpg https://s3-eu-west-1.amazonaws.com/prod-ucs-content-store-eu-west/content/pii:S2095495624007848/HIGHRES/image/jpeg/ffdc08066b6edc2a8f8a85281c23713b/gr18_lrg.jpg gr18 gr18_lrg.jpg jpg 547111 2009 3335 IMAGE-HIGH-RES 1-s2.0-S2095495624007848-gr19_lrg.jpg https://s3-eu-west-1.amazonaws.com/prod-ucs-content-store-eu-west/content/pii:S2095495624007848/HIGHRES/image/jpeg/b494ce59333a3415e0b14ae7ff5b1478/gr19_lrg.jpg gr19 gr19_lrg.jpg jpg 620181 3764 3329 IMAGE-HIGH-RES 1-s2.0-S2095495624007848-gr2_lrg.jpg https://s3-eu-west-1.amazonaws.com/prod-ucs-content-store-eu-west/content/pii:S2095495624007848/HEAD-ONLY-JATS/image/jpeg/b7978d5d1857b9cacadb7cff4dd87f70/gr2_lrg.jpg gr2 gr2_lrg.jpg jpg 993753 3746 3317 IMAGE-HIGH-RES 1-s2.0-S2095495624007848-gr20_lrg.jpg https://s3-eu-west-1.amazonaws.com/prod-ucs-content-store-eu-west/content/pii:S2095495624007848/HIGHRES/image/jpeg/81b935def3761d3fcda1c8e53ab846f9/gr20_lrg.jpg gr20 gr20_lrg.jpg jpg 163313 1350 1673 IMAGE-HIGH-RES 1-s2.0-S2095495624007848-gr21_lrg.jpg https://s3-eu-west-1.amazonaws.com/prod-ucs-content-store-eu-west/content/pii:S2095495624007848/HIGHRES/image/jpeg/d22c09521c3a3a527c58bf2825fabf68/gr21_lrg.jpg gr21 gr21_lrg.jpg jpg 216680 1656 1694 IMAGE-HIGH-RES 1-s2.0-S2095495624007848-gr3_lrg.jpg https://s3-eu-west-1.amazonaws.com/prod-ucs-content-store-eu-west/content/pii:S2095495624007848/MAIN/image/jpeg/0b333e66a813ff965ed0359f8fb6d3d3/gr3_lrg.jpg gr3 gr3_lrg.jpg jpg 137182 1071 2368 IMAGE-HIGH-RES 1-s2.0-S2095495624007848-gr4_lrg.jpg https://s3-eu-west-1.amazonaws.com/prod-ucs-content-store-eu-west/content/pii:S2095495624007848/HIGHRES/image/jpeg/e0b44fe32734575164ec5a5c7bcf25de/gr4_lrg.jpg gr4 gr4_lrg.jpg jpg 420362 1297 2953 IMAGE-HIGH-RES 1-s2.0-S2095495624007848-gr5_lrg.jpg https://s3-eu-west-1.amazonaws.com/prod-ucs-content-store-eu-west/content/pii:S2095495624007848/HIGHRES/image/jpeg/13f33e762195fc09cee9ac0fde810cf8/gr5_lrg.jpg gr5 gr5_lrg.jpg jpg 175000 1515 1699 IMAGE-HIGH-RES 1-s2.0-S2095495624007848-gr6_lrg.jpg https://s3-eu-west-1.amazonaws.com/prod-ucs-content-store-eu-west/content/pii:S2095495624007848/HIGHRES/image/jpeg/461e7c846f0598d8f86287017a336583/gr6_lrg.jpg gr6 gr6_lrg.jpg jpg 395073 1433 2920 IMAGE-HIGH-RES 1-s2.0-S2095495624007848-gr7_lrg.jpg https://s3-eu-west-1.amazonaws.com/prod-ucs-content-store-eu-west/content/pii:S2095495624007848/HIGHRES/image/jpeg/9ea898fa075b317e338c983b1852913e/gr7_lrg.jpg gr7 gr7_lrg.jpg jpg 1116170 3081 3323 IMAGE-HIGH-RES 1-s2.0-S2095495624007848-gr8_lrg.jpg https://s3-eu-west-1.amazonaws.com/prod-ucs-content-store-eu-west/content/pii:S2095495624007848/HIGHRES/image/jpeg/8331f170d405bf255707d74e77cc1d13/gr8_lrg.jpg gr8 gr8_lrg.jpg jpg 755279 2143 3445 IMAGE-HIGH-RES 1-s2.0-S2095495624007848-gr9_lrg.jpg https://s3-eu-west-1.amazonaws.com/prod-ucs-content-store-eu-west/content/pii:S2095495624007848/HIGHRES/image/jpeg/629de87bf0da278836a89f7e39084008/gr9_lrg.jpg gr9 gr9_lrg.jpg jpg 759283 2231 3445 IMAGE-HIGH-RES 1-s2.0-S2095495624007848-mmc1.docx https://s3-eu-west-1.amazonaws.com/prod-ucs-content-store-eu-west/content/pii:S2095495624007848/mmc1/MAIN/application/vnd.openxmlformats-officedocument.wordprocessingml.document/52422c9a15399ec7bcffe5be23cd897c/mmc1.docx mmc1 mmc1.docx docx 5763133 APPLICATION 1-s2.0-S2095495624007848-si1.svg https://s3-eu-west-1.amazonaws.com/prod-ucs-content-store-eu-west/content/pii:S2095495624007848/STRIPIN/image/svg+xml/d116fae976043bc96e36c1e267f3e2a2/si1.svg si1 si1.svg svg 11426 ALTIMG 1-s2.0-S2095495624007848-si10.svg https://s3-eu-west-1.amazonaws.com/prod-ucs-content-store-eu-west/content/pii:S2095495624007848/STRIPIN/image/svg+xml/abb89c2e6994322c47bad2ff52f61c73/si10.svg si10 si10.svg svg 18218 ALTIMG 1-s2.0-S2095495624007848-si11.svg https://s3-eu-west-1.amazonaws.com/prod-ucs-content-store-eu-west/content/pii:S2095495624007848/STRIPIN/image/svg+xml/7c873aae0c57e24f8f7d01de226b6a83/si11.svg si11 si11.svg svg 5815 ALTIMG 1-s2.0-S2095495624007848-si12.svg https://s3-eu-west-1.amazonaws.com/prod-ucs-content-store-eu-west/content/pii:S2095495624007848/STRIPIN/image/svg+xml/d140f28ee7f5828bcd31e50596102fa2/si12.svg si12 si12.svg svg 5624 ALTIMG 1-s2.0-S2095495624007848-si13.svg https://s3-eu-west-1.amazonaws.com/prod-ucs-content-store-eu-west/content/pii:S2095495624007848/STRIPIN/image/svg+xml/a1b84e6aff3d16874e9294d6af53f4ba/si13.svg si13 si13.svg svg 28041 ALTIMG 1-s2.0-S2095495624007848-si14.svg https://s3-eu-west-1.amazonaws.com/prod-ucs-content-store-eu-west/content/pii:S2095495624007848/STRIPIN/image/svg+xml/ed64a4185978cb640aa930641f746c4e/si14.svg si14 si14.svg svg 2661 ALTIMG 1-s2.0-S2095495624007848-si15.svg https://s3-eu-west-1.amazonaws.com/prod-ucs-content-store-eu-west/content/pii:S2095495624007848/STRIPIN/image/svg+xml/ed66608972e95a47fdf85e3251ac592b/si15.svg si15 si15.svg svg 5753 ALTIMG 1-s2.0-S2095495624007848-si16.svg https://s3-eu-west-1.amazonaws.com/prod-ucs-content-store-eu-west/content/pii:S2095495624007848/STRIPIN/image/svg+xml/a681fe798e99d51afc79e57c85f3a909/si16.svg si16 si16.svg svg 1124 ALTIMG 1-s2.0-S2095495624007848-si17.svg https://s3-eu-west-1.amazonaws.com/prod-ucs-content-store-eu-west/content/pii:S2095495624007848/STRIPIN/image/svg+xml/31bcfb7dce936030078de293afe803b7/si17.svg si17 si17.svg svg 1626 ALTIMG 1-s2.0-S2095495624007848-si18.svg https://s3-eu-west-1.amazonaws.com/prod-ucs-content-store-eu-west/content/pii:S2095495624007848/STRIPIN/image/svg+xml/b4cf1a27463654e45dba5392c7e731f5/si18.svg si18 si18.svg svg 1758 ALTIMG 1-s2.0-S2095495624007848-si19.svg https://s3-eu-west-1.amazonaws.com/prod-ucs-content-store-eu-west/content/pii:S2095495624007848/STRIPIN/image/svg+xml/2b0fe4033bdbbe7b8f1e68b21991a997/si19.svg si19 si19.svg svg 1811 ALTIMG 1-s2.0-S2095495624007848-si2.svg https://s3-eu-west-1.amazonaws.com/prod-ucs-content-store-eu-west/content/pii:S2095495624007848/STRIPIN/image/svg+xml/a5df596b012aadf96db76535c7bd1746/si2.svg si2 si2.svg svg 5369 ALTIMG 1-s2.0-S2095495624007848-si20.svg https://s3-eu-west-1.amazonaws.com/prod-ucs-content-store-eu-west/content/pii:S2095495624007848/STRIPIN/image/svg+xml/af46a88ea50de3a7925849424cfd38d9/si20.svg si20 si20.svg svg 4884 ALTIMG 1-s2.0-S2095495624007848-si21.svg https://s3-eu-west-1.amazonaws.com/prod-ucs-content-store-eu-west/content/pii:S2095495624007848/STRIPIN/image/svg+xml/54ec38f5767a138c5e1087d209f6bc8b/si21.svg si21 si21.svg svg 27314 ALTIMG 1-s2.0-S2095495624007848-si22.svg https://s3-eu-west-1.amazonaws.com/prod-ucs-content-store-eu-west/content/pii:S2095495624007848/STRIPIN/image/svg+xml/35a725619b9c2364a86c6e51523c8441/si22.svg si22 si22.svg svg 30114 ALTIMG 1-s2.0-S2095495624007848-si23.svg https://s3-eu-west-1.amazonaws.com/prod-ucs-content-store-eu-west/content/pii:S2095495624007848/STRIPIN/image/svg+xml/5f88621b24e2a65b79f20d5e83d47661/si23.svg si23 si23.svg svg 27412 ALTIMG 1-s2.0-S2095495624007848-si24.svg https://s3-eu-west-1.amazonaws.com/prod-ucs-content-store-eu-west/content/pii:S2095495624007848/STRIPIN/image/svg+xml/4384859c483a41c0057cdfccadf39224/si24.svg si24 si24.svg svg 28984 ALTIMG 1-s2.0-S2095495624007848-si25.svg https://s3-eu-west-1.amazonaws.com/prod-ucs-content-store-eu-west/content/pii:S2095495624007848/STRIPIN/image/svg+xml/face7bb540daf06ad5e151e626a7d26a/si25.svg si25 si25.svg svg 27743 ALTIMG 1-s2.0-S2095495624007848-si26.svg https://s3-eu-west-1.amazonaws.com/prod-ucs-content-store-eu-west/content/pii:S2095495624007848/STRIPIN/image/svg+xml/c30d5cda315c60138f6d260aca8dfb59/si26.svg si26 si26.svg svg 28848 ALTIMG 1-s2.0-S2095495624007848-si27.svg https://s3-eu-west-1.amazonaws.com/prod-ucs-content-store-eu-west/content/pii:S2095495624007848/STRIPIN/image/svg+xml/fc7500b4ce7013ecd85734d8cf7bb8fe/si27.svg si27 si27.svg svg 27774 ALTIMG 1-s2.0-S2095495624007848-si28.svg https://s3-eu-west-1.amazonaws.com/prod-ucs-content-store-eu-west/content/pii:S2095495624007848/STRIPIN/image/svg+xml/3e3ef4df8f2b1e21c5b269ae00d671aa/si28.svg si28 si28.svg svg 30450 ALTIMG 1-s2.0-S2095495624007848-si29.svg https://s3-eu-west-1.amazonaws.com/prod-ucs-content-store-eu-west/content/pii:S2095495624007848/STRIPIN/image/svg+xml/4a0b9064e4644a15a73979aa3a02da31/si29.svg si29 si29.svg svg 28298 ALTIMG 1-s2.0-S2095495624007848-si3.svg https://s3-eu-west-1.amazonaws.com/prod-ucs-content-store-eu-west/content/pii:S2095495624007848/STRIPIN/image/svg+xml/bea2770018415d0bc5c14104df8dedf3/si3.svg si3 si3.svg svg 2680 ALTIMG 1-s2.0-S2095495624007848-si30.svg https://s3-eu-west-1.amazonaws.com/prod-ucs-content-store-eu-west/content/pii:S2095495624007848/STRIPIN/image/svg+xml/30426659f2f7d68c31c424b4230ba8b8/si30.svg si30 si30.svg svg 25271 ALTIMG 1-s2.0-S2095495624007848-si31.svg https://s3-eu-west-1.amazonaws.com/prod-ucs-content-store-eu-west/content/pii:S2095495624007848/STRIPIN/image/svg+xml/ac22d7e9d668815b05fea8e2dd79cd5b/si31.svg si31 si31.svg svg 25624 ALTIMG 1-s2.0-S2095495624007848-si32.svg https://s3-eu-west-1.amazonaws.com/prod-ucs-content-store-eu-west/content/pii:S2095495624007848/STRIPIN/image/svg+xml/7301be031599f8c9c5778b75cd39527d/si32.svg si32 si32.svg svg 24732 ALTIMG 1-s2.0-S2095495624007848-si33.svg https://s3-eu-west-1.amazonaws.com/prod-ucs-content-store-eu-west/content/pii:S2095495624007848/STRIPIN/image/svg+xml/2722e44209b3abea03837ffd6cc3f42c/si33.svg si33 si33.svg svg 24085 ALTIMG 1-s2.0-S2095495624007848-si4.svg https://s3-eu-west-1.amazonaws.com/prod-ucs-content-store-eu-west/content/pii:S2095495624007848/STRIPIN/image/svg+xml/73ae714c85985f253357c617cfae5636/si4.svg si4 si4.svg svg 17293 ALTIMG 1-s2.0-S2095495624007848-si5.svg https://s3-eu-west-1.amazonaws.com/prod-ucs-content-store-eu-west/content/pii:S2095495624007848/STRIPIN/image/svg+xml/b62bedb468464519cfd0c9c186d65db6/si5.svg si5 si5.svg svg 9008 ALTIMG 1-s2.0-S2095495624007848-si6.svg https://s3-eu-west-1.amazonaws.com/prod-ucs-content-store-eu-west/content/pii:S2095495624007848/STRIPIN/image/svg+xml/fdeca8778fa43d8a16a7ddeeb756cd01/si6.svg si6 si6.svg svg 7160 ALTIMG 1-s2.0-S2095495624007848-si7.svg https://s3-eu-west-1.amazonaws.com/prod-ucs-content-store-eu-west/content/pii:S2095495624007848/STRIPIN/image/svg+xml/97cef87ab6054f0c4c52d49ebb789d69/si7.svg si7 si7.svg svg 9013 ALTIMG 1-s2.0-S2095495624007848-si8.svg https://s3-eu-west-1.amazonaws.com/prod-ucs-content-store-eu-west/content/pii:S2095495624007848/STRIPIN/image/svg+xml/ce937221ec815a92209032b210f57a3d/si8.svg si8 si8.svg svg 5621 ALTIMG 1-s2.0-S2095495624007848-si9.svg https://s3-eu-west-1.amazonaws.com/prod-ucs-content-store-eu-west/content/pii:S2095495624007848/STRIPIN/image/svg+xml/1560265b43e384b59dbabf600c96fa10/si9.svg si9 si9.svg svg 3447 ALTIMG JECHEM 4254 S2095-4956(24)00784-8 10.1016/j.jechem.2024.10.056 Science Press Fig. 1 Comparative volumetric power density diagram in the range of the (a) energy devices and (b) fuels. Reproduced with permission from Kobayashi et al. [41]. Copyright© 2019 The Authors. Published by Elsevier Inc. on behalf of The Combustion Institute. Fig. 2 (a–j) Number of publications over the years for each search string used in this systematic research. Fig. 3 Chart depicting the distribution of references cited in this review based on the range of (a) Impact Factor and (b) CiteScore. The category “Non indexed” refers to situations where metrics are unavailable, such as websites, books, and conference proceedings. Fig. 4 Schematic representation for (a) ZrO2 and (b) 8YSZ FCC crystal structures. In these diagrams, blue spheres represent Zr4+ cations, green spheres are the O2− anions, and yellow spheres denote replacement Y3+ cations. Fig. 5 Total electrical conductivity as a function of the absolute inverse temperature for several. YSZ: Y0.16Zr0.84O1.92; BCY: BaCe0.92Y0.08O3-δ; GDC: Gd0.20Ce0.80O1.90; LSGM: La0.80Sr0.20Ga0.80Mg0.20O3-δ; SNDC: Sm0.075Nd0.075Ce0.85O2-δ; LSGMC: La0.80Sr0.20Ga0.80Mg0.115Co0.085O3-δ; ESB: Er0.40Bi1.60O3-δ. Adapted with permission from Antunes et al. [4]. Copyright © 2022, The Author(s), under exclusive license to Springer Nature Switzerland AG. Fig. 6 (Right) IT-SOFC schematic representation depicting the porous anode (green), and cathode (gray) separated by the 8YSZ electrolyte (white) and (left) cathode and anode zooming evidencing the electrochemical reactions at the TPBs. Draft components are unscaled for better visualization. Fig. 7 (a) SEM image of cross-sectional microstructure of LSCrN-GDC/NiO-GDC interface, (b) EDS mapping analyses and durability long-term test for SOFC with (red line) and lacking it (black line) the catalyst, (c) time-dependent cell voltage at 400 mA·cm−2, (d) CH4 conversion rate, (e) power density curves before and after durability test showing performance degradation, (f) Raman spectra collected from Ni–GDC anodes, (g) scanning electron microscopy (SEM) image of NiO-GDC anode, (h) punctual EDS analysis. Reproduced with permission from Wei et al [169]. Copyright © 2021 Elsevier B.V. All rights reserved. Fig. 8 (a) Schematic illustration of the SOFC architecture, (b–d) SEM image of cross-section illustrating the details of the LSCF-GDC nanocomposite and the GDC on the anode-supported cell, (e, f) STEM-HAADF images and STEM-EDS elemental mapping showing the existence of self-assembled nano striped patterns with long-range ordering across the thickness of the LSCF-GDC nanocomposite film, (g) power density curves of the SOFC with nanocomposite showing a high performance in different temperatures. Reproduced with permission from Develos-Bagarinao et al. [172]. Copyright © 2021, The Author(s), under exclusive license to Springer Nature Switzerland AG. Fig. 9 (Left) SEM photomicrographs of six-channel micro-monolithic anode supports after sintered at 1400 °C. (a) Central-axis view, cross-sectional images of (b) the electrochemical active region in the range of the shell and the outer surface, (c) porous region in the range of the two channels and outer surface, (d) central porous region which reddish shaded area denotes the mechanical support/current collector, (e) schematic diagram of a complete single cell and the composition for each component, (right) (f) the 3D reconstruction of micro-monolithic anode support by X-ray computed tomography displaying the (g) 3D visualization of the micro-channel distribution depicting the red micro-channels, the semitransparent light blue solid layer, and (h) the microstructure of the electrochemical active region cross-section [173]. This journal is © The Royal Society of Chemistry 2020. This article is licensed under a Creative Commons Attribution 3.0 Unparted License. Fig. 10 MS-SOFC schematic depicting both anode and cathode ICs as bipolar plates with ceramics layers of electrodes, electrolyte, and DBLs all over the PMS highlighting the H2 and air inlets as well as the H2O and air outlets. Fig. 11 Polished cross-sectional SEM images of PMSs depicting the evolution of an oxide layer in reddish hues over various exposure times at 800 °C in a 50 vol% H2 in H2O atmosphere. Reproduced with permission from Sarasketa-Zabala et al. [244]. Copyright © 2012 Elsevier B.V. All rights reserved. Fig. 12 (a) Schematic illustration of the MS-SOFC powertrain integrated into a CH4-powered vehicle. (b) SEM image of cross-section of single MS-SOFC with catalyst, (c) power density curve with (blue line) and lacking (black line) the catalyst at 600 °C, (d) HAADF of reduced SDC-Ni Wet-Chemistry and EDS mapping of reduced SDC-Ni Wet-Chemistry, (e) comparison of power density curves of by MS-SOFCs powered by CH4, (f) comparison of stability-testing time of MS-SOFCs powered by CH4, (g) CH4 conversion of MS-SOFC at 600 °C in different current density conditions, (h) CO2/CO ratio in anode outlet gas stream of the MS-SOFC powered by CH4 at 600 °C in different current density conditions, (i) long-term test stability of a MS-SOFC at 600 °C powered by CH4. Reproduced with permission from Ref [262]. Copyright © 2022 American Chemical Society. Fig. 13 Comparison of SOFCs (Circles) and MS-SOFCs (Red and Purple Stars) performance under ethanol and methane internal reforming conditions. Pink: [272], Orange: [273], Yellow: [274], Green: [275], Cyan: [276], Blue: [277], Purple: [270], Red: [190]. Adapted with permission from Ref. [17]. Copyright © 2019 Elsevier B.V. All rights reserved. Fig. 14 A schematic representation of the MR and MS-SOFC integrated depicting the MR with the organized micro-channels inside of the IC cavity [369]. Fig. 15 (Left) cross-sectional view of the entire cell integrated with MRs and (right) zooming of the PMS, DBLs, base and active anode, electrolyte, and cathode. Fig. 16 (a) PMS re-engineering obtained by Nielsen et al. [363] and (b) the outcomes which can lead higher global efficiency of MS-SOFCs integrated with MRs [369]. Adapted with permission from Nielsen et al. [363]. Copyright © The Author(s) 2018. Published by ECS. Zhou [55]. Copyright © 2021 by the authors. Licensee MDPI, Basel, Switzerland. Fig. 17 (a) Schematic representation of the Ni metal dusting corrosion, (b) the interface in the range of the Ni particle and the YSZ electrolyte close to the gas inlet of the cell and (c) showing the carbon nanofibers and nanoparticles at the Ni-YSZ/YSZ interface, adapted with permission from Zhou et al. [55] and Tao et al. and Chun et al. reproduced with permission from [375] [266]. Fig. 18 Schematic depicting from left to right a MS-SOFC with ceramic films deposited on the PMS and zooming of the electrode scaffolds and the PMS impregnated by catalysts for the pre-reforming of hydrocarbons and biofuels into H2 and CO. Fig. 19 Different sub-systems contribution that comprising FCHEVs equipped with MS-SOFCs, and FCEVs equipped with PEMFCs LCAs for the current (CS) and 2030 scenarios. It should be noted that this LCA analysis was conducted considering only one single MS-SOFC-equipped FCHEV, the e-Bio Fuel Cell, launched by Nissan in 2016. Adapted with permission from J. E. V. Vargas & J. E. A. Seabra [15]. © 2021 Elsevier B.V. All rights reserved. Fig. 20 Reduction in GGEs for different powertrain/energy source combinations over the years. Fig. 21 Schematic illustration comprising the perspectives and research directions for future endeavors. Table 1 PPeak of Ni/GDC and Ru/GDC infiltrated MS-SOFC at 0.70 V. Adapted with permission from Miura et al. [190]. Copyright © 2023 Hydrogen Energy Publications LLC. Published by Elsevier Ltd. All rights reserved. Catalyst Fuel PPeak at 0.70 V (mW · cm−2) 650 °C 600 °C 550 °C Ni/GDC infiltration H2 (3 vol% H2O) 1580 1140 600 CH4 (S/C: 1) 1040 580 300 Ru/GDC infiltration H2 (3 vol% H2O) 1710 1370 750 CH4 (S/C: 1) 1160 630 320 Table 2 Performances and main conclusions overview of MS-SOFCs as a function of the electrolyte deposition by PVD and PS techniques. Deposition technique Electrolyte Anode Cathode Top . (°C) Fuel Power density (mW · cm−2) OCV (V) Deposition parameters Durability (h) Main conclusion Defects in electrolyte REF APS GDC NiO/GDC LSCF 700 H2 386 0.75 Spray Distance of 80 mm – GDC provides high conductivity. Some porosity, microcracks observed. [211] APS/LPPS ScSZ NiO/GDC LSCF 650 H2 342 1.0 – Operating 80 h with 18% of degradation Combined techniques improved gas-tightness. Porosity in the layer was observed and microcracks. [218] VLPPS ScSZ NiO/ScSZ LSCF 750 H2 1112 1.07 Deposition distance of 250 mm – ScSZ layers with improved gas-tightness. Microcracks present but reduced compared to APS. [219] PLD LSGM/SDC NiO/Fe2O3 SSC 600 H2 950 1.0 – – Dense, crack-free films with high power density. No significant defects, very dense layer. [220] GFS YSZ NiO-YSZ/NiO-GDC LSCF/LSC 800 H2 3130 1.1 – Stable for 900 h Dense, crack-free films with high power density. No significant defects, highly dense. [10] Table 3 Long-term operation of MS-SOFCs powered by C2H5OH and CH4. Anode Electrolyte Fuel Peak powerdensity(mW·cm−2) Long-term operation REF 2 × Ni-SDCN40 ScSZ C2H5OH:H2O 1:3.75 (mol) 264 (700 °C) 100 h at 0.7 V. Current dropped from ∼0.85 to 0.7 A·cm−2 [17] CoMnCuFeNi HEANi-SDC scaffold ScSZ C2H5OH:H2O60:40(vol) 570 (700 °C) 100 h at 0.7 V. Current dropped from 0.60 to 0.49 A·cm−2 [270] Sc-YSZ scaffold Ni-GDC infiltrated Sc-YSZ C2H5OH:H2O45:55(vol) 150 (600 °C) 140 h at 0.7 V. Slow voltage deactivation rate of 1.5 mV·h−1 [184] Sm0.25Ce0.75O2−δsupported Ni catalysts Sc-YSZ 10 sccm CH4 purified 350 (600 °C) 1000 h at 0.8 V. Slow voltage deactivation rate of 0.15 mV·h−1 [262] Ni@CNO-infiltrated NiFe PMs GDC CH4:H2O97:3(vol) 343 (600 °C) 280 h at 0.6 A·cm−2. Slow voltage deactivation rate of 0.09 mV·h−1. [269] Table 4 Different ESR systems comprising catalysts on supports by different preparation methods. Adapted with permission from Sengodan et al. [152]. Copyright © 2017 The Author(s). Published by Elsevier Ltd. Adapted with permission from M. Ni, D. Y.C. Leung, M. K.H. Leung [151]. Copyright © 2007 International Association for Hydrogen Energy. Published by Elsevier Ltd. All rights reserved. Reformer system Method T cat. (°C) Conversion rate ( L · h - 1 · g cat . - 1 ) Steam/Carbon molar ratio(S/C) Conversion (%) H2 selectivity (%) REF ESR 1 wt% Ru/CeO2 Impregnation 450 – 3:1 >90 57 [282] 15.3 wt% Ni/La2O3 Impregnation 250 – 3:1 81 49 [303] 3.8 wt% Ni/Al2O3 Precipitation/impregnation 650 – 3:1 100 89 [304] CuNi/CeO2 Impregnation 450 57 10:1 60 70 [305] Ni/La2O3-ZrO2 Impregnation 350 9.2 30:1 100 55 [306] Ni/CeO2-ZrO2 Impregnation 650 5.5 8:1 100 >75 [307] Ni/GDC Hydrothermal combustion 850 80 3:1 100 65 [308] Ni/TiO2 Precipitation/impregnation 500 29.2 3:1 99 – [309] Ni0,95Mo0,05/SiO2 Hydrothermal combustion 700 8.6 3:1 80 80 [310] CuNi/SiO2 Impregnation 350 17.2 6:1 100 – [311] Pt-Ni/CeO2 Hydrothermal combustion/impregnation 500 36 3:1 69 – [312] Pt1,5Co98,5/ZrO2 Sol-gel/impregnation 300 22 13:1 100 – [313] Ni3Mg2AlOy Precipitation 300 168 3:1 100 60 [314] Co2MnO4 Combustion 700 8.8 0.33:1 100 71 [315] 2KCo/ZrO2 Impregnation 420 60 9:1 100 74 [316] La0,6Sr0,4CoO3 Sol-gel amorphous citrate 700 40 3:1 100 70 [317] La1−xCaxFe0,7Ni0,3O3 Pechini 650 400 3:1 100 65 [318] La1−xKxFe0,7Ni0,3O3 Pechini 450 60 3:1 100 70 [319] LaCoxNi1−xO3 Pechini 550 60 3:1 100 60 [320] Ni/LaFe0,7Co0,3O3 Pechini 550 80 3:1 100 67 [321] Mn/Co0,1Si0,9-aluminosilicate Hydrothermal combustion/impregnation 600 8.6 0.33:1 100 97 [322] Rh/5%La2O3-CeO2-Al2O3 Impregnation 500 82.2 3:1 70 70 [323] Rh/CeO2 Deposition/impregnation 650 382 3:1 100 72 [324] Ir/CeO2 Deposition/impregnation 650 6 1.8:1 100 55 [325] Ir/CeO2 Deposition/impregnation 450 22 4:1 100 – [326] Ir/Ce0,9Pr0,1O2 Impregnation 450 18 3:1 95 60 [327] Rh-Co/CeO2 Impregnation 450 72 3:1 90 60 [328] Rh/MgO Impregnation 650 24 8.4:1 100 92 [329] Pt/CeO2 Impregnation 350 25.4 3:1 82 – [330] Pt/CeZrO2 Precipitation/impregnation 500 80 0 100 >50 [331] Table 5 Different SMR systems comprising catalysts on supports by different preparation methods. Adapted with permission from Sengodan et al. [152]. Copyright © 2017 The Author(s). Published by Elsevier Ltd. Reformer system Method T cat. (°C) Conversion rate ( L · h - 1 · g cat . - 1 ) Steam to carbon molar ratioH2O/C (S/C) Conversion (%) H2 selectivity (%) REF SMR Ni/La2Zr2O7 Impregnation 800 18 2:1 100 >75 [332] Ni/CaO-Al2O3 Impregnation 600 2.7 4:1 86 92 [333] Ni/Al2O3 Impregnation 655 – 3:1 88 75 [334] Ni/SiO2 Impregnation 800 24 0.5:1 40 68.3 [335] Ni/SiO2 Stöber process 750 6.6 3:1 85 – [336] Ni/MgSiO3 Impregnation 650 42 2.5:1 82 – [337] Ni/Ce1−xGdxO2 Hydrolysis 700 560 3:1 75 – [338] Ni/CeO2-HfO2 EDTA:CA 700 25.5 2:1 85 35 [339] Ni/CaO-ZrO2-Al2O3 – 600 60 1:1 45 – [340] Ni-Pt/Al2O3 Impregnation 700 47.1 3:1 100 – [341] Ni-Pt/Al2O3 Impregnation 650 96 1:1 77.2 – [342] Ni-Pt/MgAl2O4 Impregnation 600 9.6 4:1 80 >97 [343] Ni-Cu/Al2O3 Impregnation 500 2 3:1 >85 – [344] Ni-Rh/Al2O3 Impregnation 800 6 3:1 32.2 – [345] Ni-Au/Al2O3 Impregnation 550 3 4:1 84 55 [346] Ni-Mo/Al2O3 Impregnation 700 24 4:1 85 – [347] Ni-Ag/Al2O3 Impregnation 600 105 0.5:1 >30 45 [348] LaNiO3 Spray pyrolysis 777 300 1:1 75 – [349] (Pt, Rh, Pd)-Ni/Mg2.5AlO Co-precipitation 700 210 2:1 >85 – [350] (Pt, Rh, Ru)/Ce0.15Zr0.85O2 Urea hydrolysis 800 54,000 2:1 98.6 – [351] Ru/NixMg6−xAl2 Impregnation 800 30 1:1 85 – [352] Ru/Co6−xMgxAl2 Impregnation 600 15 3:1 80 >72 [353] Ru/MgO-Nb2O5 Impregnation 700 20 4:1 >95 – [354] Rh/CeO2 Impregnation 800 40 1.2:1 99.4 – [355] Rh/Sm2O3-CeO2-Al2O3 Sol-gel impregnation 760 6480 3:1 70 – [356] Zr0.95Ru0.05O2−δ Sono chemical 650 61.8 1:1 74 81 [356] Ru/Al2O3 Impregnation 600 0.75 1:1 75 68 [357] Review Reviewing metal supported solid oxide fuel cells for efficient electricity generation with biofuels for mobility Fábio C. Antunes Writing – review & editing Writing – original draft Project administration Methodology Investigation Funding acquisition Formal analysis Conceptualization a ⁎ João P.J. de Oliveira Writing – review & editing Writing – original draft Formal analysis a Ricardo S. de Abreu Writing – review & editing Formal analysis b Thiago Dias Writing – review & editing Formal analysis c Bruno B.N.S. Brandão Writing – review & editing Formal analysis a Josué M. Gonçalves Writing – review & editing Formal analysis a d Josimar Ribeiro Writing – review & editing Formal analysis e Julian Hunt Writing – review & editing Formal analysis f Hudson Zanin Writing – review & editing Supervision Project administration Funding acquisition Formal analysis a ⁎ Gustavo Doubek Writing – review & editing Supervision Project administration Funding acquisition Formal analysis c ⁎ a School of Electrical and Computer Engineering, University of Campinas, Campinas 13083-852, Brazil School of Electrical and Computer Engineering University of Campinas Campinas 13083-852 Brazil School of Electrical and Computer Engineering, University of Campinas, Campinas 13083-852, Brazil b School of Food Engineering, University of Campinas, Campinas 13083-852, Brazil School of Food Engineering University of Campinas Campinas 13083-852 Brazil School of Food Engineering, University of Campinas, Campinas 13083-852, Brazil c School of Chemical Engineering, University of Campinas, Campinas 13083-852, Brazil School of Chemical Engineering University of Campinas Campinas 13083-852 Brazil School of Chemical Engineering, University of Campinas, Campinas 13083-852, Brazil d Mackenzie Institute for Research in Graphene and Nanotechnologies (MackGraphe), Mackenzie Presbyterian Institute, São Paulo 01302-907, Brazil Mackenzie Institute for Research in Graphene and Nanotechnologies (MackGraphe) Mackenzie Presbyterian Institute São Paulo 01302-907 Brazil Mackenzie Institute for Research in Graphene and Nanotechnologies (MackGraphe), Mackenzie Presbyterian Institute, São Paulo 01302-907, Brazil e Electrochemistry Research and Development Laboratory (LPDE), Department of Chemistry, Center of Exact Sciences, Federal University of Espírito Santo, Campus Goiabeiras, Vitória 29075-910, Brazil Electrochemistry Research and Development Laboratory (LPDE) Department of Chemistry Center of Exact Sciences Federal University of Espírito Santo Campus Goiabeiras Vitória 29075-910 Brazil Electrochemistry Research and Development Laboratory (LPDE), Department of Chemistry, Center of Exact Sciences, Federal University of Espírito Santo, Campus Goiabeiras, Vitória 29075-910, Brazil f Biological and Environmental Science and Engineering Division, King Abdullah University of Science and Technology, Thuwal 23955-6900, Saudi Arabia Biological and Environmental Science and Engineering Division King Abdullah University of Science and Technology Thuwal 23955-6900 Saudi Arabia Biological and Environmental Science and Engineering Division, King Abdullah University of Science and Technology, Thuwal 23955-6900, Saudi Arabia ⁎ Corresponding authors. Graphical abstract The graphical abstract illustrates the integration of MS-SOFCs into a hybrid electric vehicle, where bioethanol is reformed into hydrogen and carbon monoxide for onboard electricity generation by MS-SOFCs. Metal-Supported Solid Oxide Fuel Cells (MS-SOFCs) hold significant potential for driving the energy transition. These electrochemical devices represent the most advanced generation of Solid Oxide Fuel Cell (SOFCs) and can pave the way for mass production and wider adoption than Proton Exchange Membrane Fuel Cells (PEMFCs) due to their fuel flexibility, higher power density and the absence of noble metals in the fabrication processes. This review examines the state-of-the-art of SOFCs and MS-SOFCs, presenting perspectives and research directions for these key technological devices, highlighting novel materials, techniques, architectures, devices, and degradation mechanisms to address current challenges and future opportunities. Techniques such as infiltration/impregnation, ex-solution catalyst synthesis, and the use of a pre-catalytic reformer layer are discussed as their impact on efficiency and prolonged activity. These concepts are also described and connected with well-dispersed nanoparticles, hindrance of coarsening, and an increased number of Triple Phase Boundaries (TPBs). This review also describes the synergistic use of reformers with MS-SOFCs to compose solutions in energy generation from readily available fuels. Lastly, the End-of-Life (EoL), recycling, and life-cycle assessments (LCAs) of the Fuel Cell Hybrid Electric Vehicles (FCHEVs) were discussed. LCAs comparing Fuel Cell Electric Vehicles (FCEVs) equipped with (PEMFCs) and FCHEVs equipped with MS-SOFCs, both powered with hydrogen (H2) generated by different routes were compared. This review aims to provide valuable insights into these key technological devices, emphasizing the importance of robust research and development to enhance performance and lifespan while reducing costs and environmental impact. Keywords Reform Metal-supported solid oxide fuel cell Powertrain systems Fuel cell Hybrid electric vehicle Biofuel 1 Introduction 1.1 Motivation The global push towards decarbonizing transportation is well underway, mainly motivated by the urgent imperatives outlined in the Paris Agreement, a pivotal and legally binding international treaty on climate change. Conceived at the UN Climate Change Conference (COP21) in Paris, France, on December 12, 2015, the agreement garnered support from 196 parties. Taken effect on November 4, 2016, it sets targets for reducing greenhouse gas emissions (GGEs) by 45% by 2030 and achieving net-zero emissions close to 2050. The overall mission of the Paris Agreement is to suppress the escalation of the global average temperature below 1.5 °C above pre-industrial levels [1,2]. The electrification of the economy is one of the most powerful tools available to reduce GGEs, as it aims to combine renewable energy generation with the high efficiency and scalability of electric engines (EEs). However, it is imperative to recognize that the power source for these EEs should not be confined solely to conventional batteries. Furthermore, the worldwide electric grids responsible for recharging these batteries remain far from renewable energy sources. In many developing or even fully industrialized countries, the exclusive incorporation of battery-electric vehicles (BEVs) could overcharge the existing power grids, requiring substantial infrastructure loans reaching hundreds of billions of dollars to accommodate the increased load [3]. In this sense, technologies that utilize H2 have shown great potential for decarbonization. One such technology is the SOFC, a high-temperature fuel cells (FCs) operating in the range of 600–1000 °C, which can be integrated with other high-temperature technologies, such as reforming systems. The operating principle of SOFCs is similar to that of H2-fueled PEMFCs. The fuel arriving at the anode undergoes oxidation, releasing electrons, which then combine with oxygen ions (O2−) that have been reduced at the cathode and conducted through the electrolyte via oxygen vacancies [4]. In this process, oxygen anions (O2−) combine with hydrogen cations (H+), forming water (H2O), releasing electrons, and generating heat. SOFCs offer fuel flexibility, capable of operating with various biofuels such as biomethane (CH4), bioethanol (C2H5OH), or any hydrocarbon, converting the chemical energy stored in covalent bonds directly into electrical energy. The use of renewable fuels for energy production in SOFCs has made a wide range of possibilities conceivable in recent years [5–9]. However, conventional SOFCs face challenges related to material stability and mechanical robustness, especially during thermal cycling, due to the use of brittle ceramic components. To address these issues, MS-SOFCs have emerged as a more durable alternative [10]. MS-SOFCs replace the ceramic support structure with metal support, enhancing mechanical strength, thermal shock resistance, and reducing manufacturing costs. The metal support also facilitates faster start-up times and better scalability, making MS-SOFCs more suitable for a wide range of applications, including portable and large-scale power systems [11,12]. Exploring an innovative electrification concept through hydrocarbon and biofuels onboard reforming into syngas composed of H2 and carbon monoxide (CO) in the majority to be used in MS-SOFCs to generate electricity in a novel hybrid powertrain system for vehicle propulsion could be the path to a faster energy transition. This also can be achieved through internal reforming processes of these fuels directly in the MS-SOFCs anodes [13]. These FCs exhibit high performance, rapid start-up, and light-off characteristics, facilitated by the ceramic thin films deposition on cost-effective stainless steel porous supports, utilizing scalable techniques with lower capital expenditure (CAPEX) [14,15]. Over the last decade, these lines of sight have saved substantial interest and investments from governments along automakers of internal combustion engine vehicles (ICEVs), BEVs, and pure FCEVs as well as power generation companies in Brazil and worldwide, promoting research and development [16,17]. However, the hydrocarbon and biofuel utilization, including C2H5OH and CH4, poses a challenge in the long-term stability of the external reformer or the MS-SOFCs anodes due to coking on the catalysts surface [18]. This challenge still requires efforts from the literature and companies to devise innovative solutions that preserve MS-SOFCs high performance and lifespan over 100,000 h. Therefore, this review provides strong and critical points offering a valuable overview of the technologies involved in electrical energy onboard generation by MS-SOFCs powered by hydrocarbon and biofuels. We provide a comprehensive overview of the current state-of-the-art materials used in MS-SOFC stacks and reformers, considering key aspects such as performance, lifespan, and LCA from the cradle to the grave. This innovative eyesight demonstrates Brazil’s commitment to sustainable and efficient transportation solutions, aligning with global efforts to reduce emissions and transition towards cleaner energy sources. But the main challenge is still the FCs. 1.2 Fuel cells Among all alternative combustion technologies, FCs can use H2, CO, hydrocarbon or biofuels for power generation in the range of 100–1000 °C with high efficiency with zero or lower carbon and other pollutant emissions [19]. Several FCs are at different technology readiness levels (TRLs), including commercial products from Ballard, Bosch, Ceres Power, Nissan, Panasonic, SOFCMAN, Plug Power, Toshiba, Fuel Cell Materials, and Elcogen, among others. The FCs are classified in agreement with the electrolyte used and the operating temperature (Top .). The main FCs are: (i) Proton Exchange Membrane FC (PEMFC); (ii) Alkaline FC (AFC); (iii) Phosphoric Acid FC (PAFC); (iv) Molten Carbonate FC (MCFC), and (v) Solid Oxide FC (SOFC) [20]. Table S1 of Supplementary Information (SI) depicts a brief FC features overview. PEMFC stacks are widely used in FCEVs powered by H2, but they cannot tolerate contaminants such as CO traces and hydrogen sulfide gas (H2S), making the H2 high-purity cryo-liquefaction process very expensive. The skyrocketing costs of H2 cryo-liquefaction and high-pressure storage tanks, besides the safe transport and logistic distribution, turn the FCEVs into a business model with high CAPEX and OPEX. This barrier has held the PEMFC vehicle widespread for more than 20 years now, as the first manufactured PEMFC vehicle, the Honda FCX, dates from 2002. Furthermore, FCEVs equipped with H2-powered PEMFC stacks show low dynamic response due to H2O flooding at the interface in the range of the electrodes and gas diffusion layers. Hence, they are unable to manage power peaks under start-up, and acceleration cannot extract regenerative energy from the EE during deceleration or braking [21]. This issue can be solved by combining a small lithium-ion or sodium-ion battery (LIB or SIB) pack with a PEMFC stack. These fuel cell hybrid electric vehicles (FCHEVs) powertrain systems show strong synergy due to the electrical power integrated supply. This achievement is due to the following aspects: (i) the battery packs which power aid under start-up and acceleration; (ii) the EE deceleration and braking energy re-absorption that also reduces the PEMFC stack power fluctuation [22]. The PEMFC stack is connected in series with the battery pack to indirectly supply electrical power to the EE. However, this system has higher synergy when the PEMFC stack is connected directly to the EE and in parallel with the battery pack. In this configuration, the PEMFC stack is the main source of electrical power to the EE and the battery pack becomes an auxiliary one. Because of this, the battery pack volume can be reduced down to one-fifth in FCHEVs, which means less cost and reduced carbon footprint through battery LCA. SOFC stacks are technologically and strategically more important than PEMFC stacks due to these three main advantages: (i) economic, because the use of nickel (Ni) based catalysts for hydrocarbon or biofuels internal reforming at the anode instead of platinum (Pt) used in the PEMFCs electrodes. Ni can also be used in an external reformer to convert these fuels into syngas before these molecules reach the SOFC anode [23]; (ii) MS-SOFC stacks can operate with fuels carrying H2S low levels as low as 50 parts per billion (ppb); (iii) CO is also a fuel, as well as H2, reacting with O2− at the anode to produce carbon dioxide (CO2) and H2O as by-products without any issue with CO poisoning [24,25]. Another SOFCs advantage is the chemical energy conversion directly into electrical up to η = 0.60 of efficiency, while PEMFCs and ICEVs (limited by the Carnot cycle) shows η = 0.50 and η = 0.35 of efficiency [26,27]. The SOFCs thermodynamic principle is similar to any other FCs because the faradaic electrochemical reactions occur at the electrode/electrolyte interfaces called TPBs. In the anode TPBs occurs the electrochemical reactions in the range of the fuel, such as H2, and O2− anions from molecular O2 present in the air, previously reduced at the composite cathode TPBs, producing besides H2O vapor, electricity, and heat [28]. The MS-SOFCs enable the use of C2H5OH and CH4 in FCHEVs displaying overall electrical efficiency between 0.45 < η < 0.60. In stationary applications using CH4, the electrical efficiency has been reported as high as η = 0.60, and if a micro-turbine is attached to harness the regenerative heat energy from the heat H2O vapor, the overall thermal efficiency could reach an impressive 100% [29]. In terms of Research and Development (R&D), SOFCs have demonstrated volumetric power densities ranging from 0.1 to 1.0 kW·L−1 [30,31], whereas MS-SOFCs have shown superior values in the range of 1.0–5.6 kW·L−1 [32,33]. The PEMFCs have shown values in the range of 1.65–3.12 kW·L−1 [34], losing to MS-SOFCs. Commercially, there are consolidated products in this area, for instance, the company Ceres Power (England) produces MS-SOFC stacks with 10 kg and 1.2 kW when powered by CH4 for stationary power generation, which roughly gives a specific power of 0.12 kW·kg−1 [35]. Nevertheless, for a light-duty vehicle, less than half of this power is needed, i.e., stacks with 200 < Weight (kg) < 400 provide 24 < P (kW) < 48, assuming that the same design and architecture of MS-SOFCs for stationary applications could be used directly without any appropriate changes. Similar products employing high-temperature solid oxide fuel cells (HT-SOFCs, 1st generation) and intermediate-temperature solid oxide fuel cells (IT-SOFCs, 2nd generation) depict a specific power range of 1 < kW·kg−1 < 3 [36]. For instance, the literature has been reporting a specific power range of 1.8 < kW·kg−1 < 2.2 for PEMFC used in light-duty vehicles [37,38]. We could argue that even the most advanced SOFC, in this case the MS-SOFC, is still far from being able to enter into mobility applications. Despite that, the commonly reported power density ranges of SOFC and MS-SOFC are 0.5 < W·cm−2 < 5 and 0.5 < W·cm−2 < 3, respectively, which shows that MS-SOFC has approximately the triple of the 0.5 < W·cm−2 < 1 power density range of the PEMFC, considering cells with similar thickness [39]. Therefore, we can realize the importance of cell architecture and stack design for the final specific power density and the constraints imposed by the different applications. Stacks that have been designed for small stationary applications will not meet the demands for mobility even if the internal cells could. These MS-SOFC stacks must be improved in size and weight to be useful in vehicle powertrain systems and adapted to be powered by hydrocarbons and biofuels. In Fig. 1 a, on a volumetric power density scale, energy technologies such as batteries, PEMFC, SOFC, and MS-SOFC easily outperform fuel cells [30,32–36,40]. However, on a gravimetric power density scale, we observe that fuel cells have superiority in terms of energy density compared to batteries, and MS-SOFCs can surpass all other technologies. 1.3 Biofuels as H2 carrier Biofuels can be considered “H2 in liquid phase” because these molecules store the element hydrogen (H). For example, Fig. 1b depicts that H2 and C2H5OH have ∼0.01 MJ·L−1 and ∼18.4 MJ·L−1 of stored energy into their chemical bonds under standard temperature and pressure conditions (STP), proving the higher C2H5OH energy density. In an external reformer, C2H5OH can be converted into H2 and CO to power MS-SOFCs, boosting the stack energy efficiency and lifespan. The bioethanol produced from sugarcane is a renewable and clean fuel source since the CO2 from the atmosphere is captured through photosynthesis by this plant life cycle, leading CO2 emission net near to zero, being practically null if its biomass is used in the FCHEVs supply chain as a circular economy [42,43]. Using standardized LCA methods, the bioethanol produced in the USA by a new fermentation process from corn stover, forest residue, or switchgrass gasification results in GGEs that are at least 60% lower than that of conventional fossil fuels such as gasoline, with biomass-based bioethanol achieving close to 90% of emission reductions [44]. One ton of corn produces in the range of 390 and 410 L of bioethanol, while a ton of sugarcane produces in the range of 70 and 90 L. Nonetheless, corn yields 6 tons per hectare, and sugarcane averages 80 tons per hectare, but can reach 381 tons per hectare with genetically designed species [45]. Brazil utilizes only 0.5% of its landfill for bioethanol production, which does not compete with food production or contribute to deforestation. This bioethanol production is currently able to fulfill more than all flex fuel cars in Brazil (∼30% of the national fleet). Moreover, the bioethanol generation and logistic distribution infrastructures are much cheaper and safer compared to H2 hubs for FCEVs and battery recharging grids for BEVs. These infrastructures are already consolidated in Brazil and other countries such as the USA, Thailand, India, and some African countries [46,47]. Besides bioethanol, biogas is another prominent biofuel which is gaining attention to energy transition. In 2020, the biogas worldwide production amounted to 1.46 EJ in terms of energy content, representing a substantial increase from the 0.29 EJ produced in the year 2000 [48]. Biogas is derived from anaerobic digestion of decomposing organic matter in biodigesters. This matter can originate from various sources, including urban and industrial sludge like sewage treatment plants, food waste, or landfills, as well as agricultural residues such as vinasse. This gas is composed of CH4 and CO2 with several trace components, including H2O vapor, nitrogen (N2), O2, CO, H2S, ammonia (NH3), siloxanes, and lightweight hydrocarbons. The biogas refining into biomethane involves purification to eliminate the trace components and an upgrade to align the calorific value. Therefore, biomethane is a clean source for H2 production as bioethanol. Biogas plants and SOFC stacks integrated, in conjunction with agricultural and biomass waste treatment plants, offer a substantial prospect in the stationary and decentralized power generation market, operating in the range of 10–103 kW. These integrated systems are highly efficient. Theexothermic power generation can supply heat and steam energy to reforming or other industrial through the exhaust gas stream from the SOFC stacks. The primary challenge for this system is ensuring the purity of the fuel gases used to feed the SOFC stacks. However, there are already technologies with high TRLs for refining and reforming biogas into syngas with ppb of sulfur, siloxanes, and halogens [49]. Bioethanol and biomethane as H2 carriers can be the solution for mobility electrification using MS-SOFCs in countries that produce these biofuels and already have the production and distribution logistic infrastructure. This outcome allows the mobility sector to gradually decarbonize without huge investments in infrastructure to recharge the BEVs or refueling H2 hubs for FCEVs. 1.4 Why do MS-SOFCs make sense? The MS-SOFC stacks can be powered by H2 and CO reformed onboarding from biofuels and extend the timeframe for clean electricity generation and smart grid distribution to charge the battery pack of the BEVs, estimated only in Brazil in 210 < USD billion < 300 [50]. This hybrid powertrain system could be comprised of: (i) one tank for liquid bioethanol or gas biomethane refueling of ∼30 L or ∼10 m3, respectively, smaller than the ∼50 L of gasoline or ∼20 m3 of compressed natural gas (CNG) of current ICEVs; (ii) an onboard external reformer to convert these biofuels in H2 and CO to be used in an MS-SOFC stack; (iii) a smaller battery pack for electrical energy storage produced by the MS-SOFC stack; (iv) a supercapacitors (SCs) bank in cases of higher energy demand as overdrives providing quickly electrical power to the EE and fast regenerative energy re-absorption from the EE when it is in deceleration or braking mode; (v) a power and energy controller management unity in the range of the MS-SOFC stack, battery pack, SCs bank, and the EE to get the best working condition [15]. The main advantages of FCHEVs comprising hybrid powertrain system with MS-SOFCs stack are the: (i) refueling tank could be fueled by these biofuels between 3 < t (min) < 5 as the same way the flex power ICEVs are refueled in Brazil; (ii) autonomy depends on the external reformer and MS-SOFC stack overall efficiencies; (iii) smaller batteries pack volume considerably reduces the system weight and cost; (iv) toxic and flammable substances present in the battery cells will be much lower; (v) reduction of critical metals such Ni, lithium (Li), cobalt (Co), aluminum (Al), copper (Cu), silicon (Si), zinc (Zn), manganese (Mn), and carbon materials present in the battery cells and (vi) the MS-SOFC high electrical overall efficiency compared to the HT-SOFC, IT-SOFC and PEMFC, with much more room to scale-up at lower costs [51–54]. However, since FCHEVs equipped with MS-SOFC stacks are still under development, the main drawbacks are the: (i) MS-SOFC performance and lifespan depends on the porous metal supports (PMSs) and dense metal interconnectors (ICs) oxidation resistance which usually are made in ferritic stainless steel (FSS: Fe26Cr) and austenitic stainless steel (ASS: Fe18Cr12Ni) stainless steels; (ii) cathode degradation when steam reacts with the Cr (Cr) from the cathode IC alloy, precipitating CrO(OH)x; (iii) cathode/electrolyte degradation during the sinterization in the range of 900–1300 °C or at operation in the range of 650–750 °C; (iv) iron (Fe) and Cr evaporation and deposition on the anode Ni catalyst surface, promoting FeNiOx and CrNiOx electronic charge carrier blocking phases; (v) Ni diffusion into the FSS PMS emerge higher oxidation resistance austenitic phases but with a higher coefficient of thermal expansion (CTE) which causes cracks nucleation and anode delamination from the PMS; (vi) pyrolytic coking in graphitic, fibers or nanotubes phases on the anode Ni catalyst surface deactivating and dusting it if hydrocarbon or biofuels is internally reformed; (vii) stack is still too heavyweight and large as HT-SOFCs and IT-SOFCs which are commonly used for stationary power generation, so downsizing is mandatory; and (viii) the testing standards, LCAs, recycling legislations and public policies are lacking for MS-SOFC stacks powered by biofuels, which reduces its bankability [55–57]. In contrast to HT-SOFCs and IT-SOFCs, the MS-SOFCs present fast start-up and light-off of 10 min [40], because of the following features: (i) the Top. of 700 °C is lower and (ii) they present excellent thermal shock resistance due to the thin ceramic films deposition on the PMS that promotes the components thermal integration ensuring high redox cyclabilities without device cracks and mechanical failures [58,59]. Although several papers present the state-of-the-art improvements in IT-SOFCs powered by C2H5OH and CH4 for low-temperature applications as low-temperature solid oxide fuel cells (LT-SOFCs) [46,60], there are few papers on MS-SOFCs powered by hydrocarbons, biofuels or syngas [17,61]. However, in 2016, Nissan introduced a new technology demonstrating that these FCHEVs with MS-SOFCs can be developed and improved. 1.5 Case study In 2016, Nissan in collaboration with AVL GmbH List (Germany), Plansee SE (Austria), and Ceres Power (spin-off from Imperial College London), presented on Brazilian highways the first FCHEV called Nissan e-bio (1,716 kg). This vehicle was adapted and equipped with an MS-SOFC stack that shows η = 0.55 of efficiency and 600 km of drive range. The fuel was a 1:1 vol% mix of water and ethanol (15 L each) reaching 40 km·L−1 of ethanol consumption. For comparison, a commercial BEV reaches 400–600 km with a single recharge between 1 < t (h) < 8, and an ICEV flex-fuel typically reaches 10 km·L−1 with 90 vol% of ethanol [62]. This 425 kg hybrid powertrain system includes: (i) a 30 L refueling tank of liquid hydrated bioethanol, which is converted by an (ii) onboard external reformer into syngas to power an (iii) 5 kW MS-SOFC planar stack (150 Wh·kg−1 and 50 kg) and charge an (iv) 24 kWh LIB pack; (v) a heat-exchanger; (vi) a start-burner; (vii) an air-blower; (viii) a gas-processer unit; (ix) an after-burner that uses the exhaust heat generated by the MS-SOFC stack to warm up the unreacted syngas and recirculated it to improve the overall system efficiency. This vehicle achieved high performance due to the synergy between the LIB pack of Nissan’s range extender (REX2) and the MS-SOFC stack by Ceres Power and AVL company [15,62]. The LIB pack is important to suppress the power fluctuation from the MS-SOFCs stack ensuring fast start-ups. The Nissan’s e-bio FCHEV is equipped with a LIB pack with 192 Li-ion cells that show 32.5 A·h and 3.75 V per cell. Each Li-ion cell comprises a LiMn2O4-LiNiO2 composite active cathode and Cgraphite active anode. The Nissan e-bio EE is an AC synchronous that shows 80 kW and 280 N·m of torque [14]. 1.6 MS-SOFCs limitations Despite the previously mentioned advantages, this novel hybrid powertrain system with MS-SOFC stack does not yet present an adequate lifespan compared to ICEV systems. The MS-SOFC stack lifespan is compromised by the PMS and ICs oxidation, electrodes, and electrolyte degradation, and mainly anode coking when MS-SOFC are directly powered by hydrocarbon or biofuels. The MS-SOFCs stack cost of 200 < USD·kW−1 < 400 is still a limiting factor when compared to the 140 < USD·kW−1 < 250 of the LIBs and the 35 < USD·kW−1 < 55 of the ICEVs powertrain system cost. However, MS-SOFCs stacks large-scale up production is the trigger to reduce this cost, improving market competitiveness [63–65]. More details about this analysis are made in a dedicated section in the present review. The 8 mol% Y2O3 stabilized ZrO2 (8YSZ) electrolyte, and 10 mol% Gd2O3 doped CeO2 (10GDC) diffusion barrier layer (DBL) deposition by physical vapor deposition (PVD), and the high sintering temperature (Tsint. ) to obtaining these phases in electrodes manufactured by tape casting, spray pyrolysis, airbrushing or screen-printing scalable techniques are factors that challenge the MS-SOFCs cost reduction. CoO, Fe2O3, and ZnO used as sintering additives can decrease the Tsint . of the electrodes. However, these additives reduce the 8YSZ and 10GDC ionic conductivities ( σ ion . ) decreasing the cell performance [66–69]. The main issue is the Ni/8YSZ and Ni/10GDC-based anode deactivations due to the coking when carbon-based fuels are used, reducing the MS-SOFC stack performance and lifespan. Hydrocarbon or biofuel hydration reduces the anode coking and improves the σ ion . of these devices [70]. High Top. can reduce the polarization losses and increase the kinetic rate of the electrochemical reactions in the electrodes TPBs, but thermal stresses, components delamination, and electrode coarsening arise. Thinner ceramic films onto PMSs besides the DBLs in the cell components interfaces, which avoid blocking phase precipitation, can reduce the Top ., extending the MS-SOFCs lifespan [71,72]. 1.7 What is the point of this review? The main point of this review is to organize the main scientific works on SOFCs and MS-SOFCs powered by syngas externally reformed from hydrocarbons and biofuels. Additionally, it investigates the internal reforming of these fuels directly at the anode of SOFCs and MS-SOFCs. It is worth noting that public policies and technical standards for testing, manufacturing, and recycling the MS-SOFCs are still in the developmental phase and will not be discussed here. Only a brief introduction and comparison of the LCA will be covered and correlated with this new type of FCHEV. This review is structured into the following sections: (i) section II outlines the adopted methodology for the systematic review; (ii) section III is an overview of the key features of SOFCs and MS-SOFCs, along with an analysis of their advantages and disadvantages when powered by H2, hydrocarbon and biofuels; (iii) section IV focuses on the challenges associated with MS-SOFCs and explores strategies for optimizing this device when it is powered by hydrocarbon and biofuels; (iv) section V offers an overview in LCA from the cradle-to-the-grave; and finally the (vi) section VI presents the main conclusions. 2 Methodology This review is conducted in agreement with a protocol comprising three steps. The steps undertaken consist of: (i) studies identification and contextualization regarding global warming mitigation in the mobility sector; (ii) the identification of the most pertinent studies to comply with carbon neutrality through MS-SOFCs, and (iii) the extraction data and referencing. Databases include Elsevier–Science Direct, Nature, Springer Link, Oxford Press Journal, Royal Society of Chemistry, and the Web of Science platform. The sourced references’ reliability is upheld through rigorous peer review processes involving experts in the fields of materials science and engineering, electrochemistry, renewable energy generation and storage, and sustainability. Executing queries within the database search space was accomplished by combining and linking specific AND and OR operators to execute the following queries: (a) SOFCs and MS-SOFCs powered by H2, hydrocarbons, and biofuels; (b) state-of-the-art of biofuel reformer, SOFCs and MS-SOFCs technologies; (c) LCAs for SOFCs and MS-SOFCs. An overview of the research field can be obtained by examining the number of annual publications from the last 25 years for each of the keywords used as search criteria in this systematic review. Fig. 2 depicts the number of publications per year for each search sequence utilized in the mentioned databases. Fig. 2(a, b) show the number of publications related to the keywords SOFCs and MS-SOFCs, respectively. A significant increase in SOFC publications has been observed over the past 15 years, while for MS-SOFCs, the number remained constant. This can be attributed to the challenges in obtaining MS-SOFCs. During the same period, Fig. 2 (c–f) illustrate an increase in publications focused on SOFCs powered by C2H5OH and CH4. In contrast, there were few publications on MS-SOFCs fueled by biofuels, indicating that there is still much to explore in this area. When biofuels are linked to reforming processes, a substantial rise in the number of publications can be seen in Fig. 2(g) and (i). This suggests that research is advancing towards the development of better catalysts for biofuel reforming and, consequently, for internal reforming in SOFCs and MS-SOFCs. The technological advancements in external reforming devices could facilitate their integration with MS-SOFCs in the powertrain systems of hybrid electric vehicles (HEVs), and this field remains underexplored, as shown in Fig. 2(h) and (j), where the number of publications is still relatively low, indicating significant potential for further research. Based on the observed data, it is possible to conclude that research on SOFCs and MS-SOFCs has grown significantly in recent years. The quality of the published work should be intrinsically linked to this amount, highlighting how promising this research field is. Fig. 3 presents a graphical representation illustrating the distribution of references analyzed in this review, based on impact factors (IF) and citescore (CS). The publications cited in this review include nearly 8% of journal articles with an impact factor higher than 15. Additionally, almost 10% of SOFC and MS-SOFC publications have an IF above 25, demonstrating the high impact of this research area. The largest portion of the publications fall within the 5 to 15 IF range, accounting for approximately 48.5%. Therefore, we can conclude that publications in the SOFC and MS-SOFC fields are promising and have the potential for high relevance and impact in literature. The publications cited in this review include 17.38% and 42.09% of papers from journals with impact factor and citescore higher than 15. 3 SOFCs powered by H2, hydrocarbon, and biofuels: Features, benefits, and drawbacks 3.1 Chemical composition, crystal structure, punctual defects, and electrical conductivity To recognize the MS-SOFC features, it is essential to understand the evolution from SOFCs to MS-SOFCs. The success of these devices results from: (i) the deposition of composite cermet anodes, ceramic electrolytes and cathodes, and DBLs films on PMSs; and (ii) the use of metallic ICs and (iii) the sealing between ICs and PMS by micro-welding laser. These characteristics provide cost reduction and performance improvement for applications in a lower Top . ranging from 550 to 750 °C. The SOFC electrolyte is a dense and semipermeable membrane of O2− anions. These anions are transported by the ceramic crystalline structure by oxygen vacancies ( V O ∙ ∙ ) defects. The mechanism for O2− and vacancy migration is thermally activated; therefore the electrolyte material determines the Top .. The state-of-the-art widely adopted is the Zr0.84Y0.16O1.92 ceramic, commonly referred as 8YSZ (8 mol% yttria-stabilized zirconia). This electrolyte is inexpensive and only has σ ion . over all the Top . range. Moreover, 8YSZ exhibits CTE that matches with the materials used as electrodes and can be manufactured by scalable techniques, including tape casting, screen printing, spin coating, thermal spray (TS), PVD, and additive manufacturing (AM), among others [28,73–77]. Fig. 4 (a) depicts the crystal structure of zirconia (ZrO2). Zr4+ cations occupy the regular lattice positions of the face-centered cubic (FCC) unit cell, and all eight interstitial tetrahedral positions are filled by O2− according to the ZrO2 stoichiometric ratio. This chemistry coordination is required to ensure the electroneutrality of the crystalline lattice [78–86]. However, this structure remains stable only ranging from 2370 to 2680 °C. While cooling from 2370 to 1170 °C, the ceramic cubic structure of ZrO2 undergoes a transformation into its tetragonal allotrope. At temperatures below 1170 °C, the tetragonal phase changes into a monoclinic structure. During the tetragonal to monoclinic martensitic transition, the unit cell experiences a volumetric expansion of 3%–4%. This transition triggers multiple crack propagations throughout the crystal lattice, resulting in mechanical failure of the ZrO2 ceramic after sintering. To address this issue, ZrO2 is doped with other compounds like magnesia (MgO), calcia (CaO), or aliovalent oxides such as gadolinia (Gd2O3), samaria (Sm2O3), or hafnia (Hf2O3). These dopants stabilize the cubic phase field of ZrO2 at room temperature (Troom ) [87–93]. Fig. 4(b) provides a 2D schematic explanation of the doping mechanism. If four Zr4+ are replaced by four Y3+, the lattice acquires a net negative charge equals minus four. Consequently, two O2− anions located on the crystal surface are expelled as molecular O2 in the surrounding atmosphere, resulting in the formation of two V O ∙ ∙ each one with two positive charges. This mechanism ensures the overall electroneutrality of the crystal lattice. Depending on the dopant and its concentration, typically ranging from 6 to 12 mol% for Y2O3 to obtain YSZ, the crystal cubic structure can remain stable from Troom up to ∼2500 °C. This ordered and relatively open crystal structure, as observed in 8YSZ, has the ionic jump lowest activation energy (E at.) of V O ∙ ∙ migration, resulting in an σ ion . of ∼0.05 S·cm−1 and an Eat. of ∼1 eV at 800 °C. These attributes contribute to achieving desirable efficiency and power output in SOFCs operating at this Top . [73,78,94]. The equations 1 and 2 describe the solid-state chemical reaction of the V O ∙ ∙ formation in ZrO2 as well as the chemical equilibrium, both expressed using the Kröger-Vink notation [95,96]. (1) Y 2 O 3 + 2 Zr Zr → Z r O 2 2 Y Zr ′ + 3 O O + V O ∙ ∙ (2) Y Zr ′ = 2 V O ∙ ∙ ZrO2 exhibits intrinsic formation of V O ∙ ∙ ranging from 800 to 1000 °C. However, the concentration of these charge carriers is too low, leading to insufficient transport of O2− anions, resulting in reduced values of σ ion . . The Equation 2 demonstrates that the concentration of extrinsic V O ∙ ∙ is half of Y3+ concentration. If all V O ∙ ∙ are available and can migrate freely through the crystal lattice, the mobile vacancies concentration is equal to the fraction of stoichiometric vacancies. However, if the dopant concentration becomes excessively high, coulombic interactions can give rise to electrostatic clusters such as ( Y Zr ′ V O ∙ ∙ ) ∙ and ( Y Zr ′ V O ∙ ∙ Y Zr ′ ) x decreasing the σ ion . , particularly at temperatures lower than 800 °C [97]. The 8YSZ electrolyte must also have the following attributes: (i) density higher than 98% of the theoretical density (∼5.8 g·cm−3) to prevent mixture between the fuel and oxidant gases; (ii) good mechanical properties [98]; (iii) wide electrolytic domain exhibiting transfer numbers greater than 0.99 [99,100]; (iv) physicochemical stability under thermal and redox cycling [20]. The high Top . ranging from 800 to 1000 °C of 8YSZ electrolyte limits the choice of materials for other SOFCs components. In this temperature range, the selection of advanced materials is necessary for the ICs, current collectors, and sealants, resulting in an overall increase in the final SOFC stack cost [28]. This high Top . also leads to several adverse effects, including: (i) electrodes coarsening; (ii) interdiffusion of chemical elements between electrodes and electrolyte interfaces; (iii) degradation, such as the precipitation of pyrochlores charge carrier blocking phases at the cathode and electrolyte interfaces; (iv) mechanical fatigue owing to the CTEs mismatch between electrodes and electrolytes [24,28,101–106]; (v) Cr volatilization from the lanthanum chromite (LaCrO3) ceramic ICs of SOFCs; (vi) Cr interdiffusion from stainless steel ICs to electrodes in MS-SOFCs [107–110]. These factors play a crucial role in the lifespan of these devices. Due to these factors, the SOFC still requires the use of expensive advanced ceramic materials, hindering the competitiveness of this technology in the power generation market [28,111,112]. The primary challenge lies in decreasing the Top . of SOFCs, which can be achieved by: (i) minimizing the thickness of 8YSZ electrolyte to mitigate energy losses from ohmic polarization or (ii) using electrolytes with ionic conductivity higher than 8YSZ [113–120]. Other O2− conductors’ electrolytes can be employed in SOFCs. Fig. 5 illustrates Arrhenius curves depicting the total electrical conductivity ( σ total ) as a function of the absolute inverse temperature for several O2− conductor electrolytes more conductive than 8YSZ. The electrical conductivity at 650 °C for YSZ, LSGMC, and ESB-based electrolytes are 6.9 × 10−3 S·cm−1, 2.6 × 10−1 S·cm−1 and 3.8 × 10−1 S·cm−1. LSGMC and ESB-based electrolytes are recent and require further improvement due to their physicochemical instability and strong degradation at this Top .. For instance, BCY degrades in the presence of CO2 and moisture, reverting to its precursor oxides even upon prolonged exposure at Troom . Except for YSZ and GDC electrolytes, LSGMC, LSGM, and SNDC degrades quickly ranging from 600 to 700 °C, which is caused by the precipitation of blocking phases at electrodes/electrolyte interfaces. Additionally, the high-cost of these raw materials leads to another restriction on the application. In this context, 8YSZ and 10GDC ceramic film electrolytes are commonly used in SOFC stacks for stationary power generation. These electrolytes can be deposited over the anodes of IT-SOFCs, LT-SOFCs, or MS-SOFCs. Using these electrolytes, the IT-SOFCs can achieve power densities as high as 1–2 W·cm−2 at 800 °C, and MS-SOFCs can maintain this power range at Top . = 650 °C, thanks to reductions in ohmic polarizations using electrolyte films in the range of 1–3 μm of thickness. The power losses result from: (i) ohmic polarization in the electrolyte due to the space charge layers at grain boundaries; (ii) activation polarization at the electrodes due to the sluggish kinetic of the electrochemical reactions and (iii) mass transport polarization at the electrodes due to the difficulty of the gaseous species in accessing and leaving the active regions [121–124]. 10GDC has found successful applications as DBLs covering both the PMS and 8YSZ electrolyte in MS-SOFCs [28,125–127]. However, when 10GDC is applied as an electrolyte in the range of 700–900 °C and oxygen partial pressure ( PP O 2 ) ranging from 10−25 to 10−12 atm, Ce4+ are reduced to Ce3+ [128,129]. This reduction promotes the transport of electronic charge carriers across the 10GDC electrolyte crystal lattice by small polarons, causing SOFC short-circuiting [130,131]. Furthermore, Ce3+ has a larger ionic radius, leading to chemical expansion and CTE mismatch, triggering crack propagation and mechanical fatigue failures under cycling [28,125,132,133]. The Equation 3 illustrates the solid-state chemical reaction of CeO2 reduction to produce O2, Ce3+, and V O ∙ ∙ in the crystal lattice [95]. (3) O O + 2 Ce Ce ↔ 1 2 O 2 ( g a s ) + 2 Ce Ce ′ + V O ∙ ∙ The current SOFC state-of-the-art comprising: (i) NiO/8YSZ or NiO/10GDC porous anodes; (ii) 8YSZ electrolyte; and (iii) a La1-xSrxMnO3 (LSM) mixed ionic and electronic conductor (MIEC) cathode [28]. These components are used to manufacture HT-SOFCs and IT-SOFCs that can operate ranging from 800 to 1000 °C. These SOFCs can achieve power densities ranging from 0.2 to 1.2 W·cm−2 and efficiencies ranging from 0.45 to 0.60 when powered by H2, hydrocarbon, or biofuels [28,49,134–138]. The lower power peak of 0.2 W·cm−2 is attributed to the ohmic and activation polarizations [139–142]. Fig. 6 depicts a volume element of an IT-SOFC planar cell, which consists of ceramic ICs based on LaCrO3, 8YSZ electrolyte, and composite electrodes based on Ni/8YSZ and LSM-8YSZ. The 8YSZ dense electrolyte separates the electrode chambers. The air is injected and directed through the IC channels to reach the porous cathode surface. In this surface, O2 from the air is reduced into O2− anions at the cathode active sites. The O2− anions migrate by the V O ∙ ∙ of the 8YSZ crystal lattice to reach the anode TPBs. H2, hydrocarbon, or biofuels are injected and directed via the IC channels to the porous anode surface. These fuels are oxidated at the anode TPBs, producing either H2O or H2O and CO2, heat, and free electrons. These electrons are used in an external circuit before being collected by the cathode. IT-SOFCs have demonstrated superior performance and longer lifespans in comparison to HT-SOFCs. Over the past two decades, significant advancements have been made in the development of IT-SOFCs that can be powered by hydrocarbon and biofuels, including C2H5OH and CH4 as shown in Fig. 2(c) and (e). Notably, Siemens Westinghouse (Germany) [143], Mitsubishi (Japan), Rolls Royce (England) [144], and Bloom Energy (USA) have successfully commercialized HT-SOFCs and IT-SOFCs integrated with gas-turbine hybrid systems. These systems are designed for the regenerative reuse of steam to generate stationary electric power, achieving impressive efficiencies between 0.60 < η < 0.90. Nonetheless, a significant IT-SOFC drawback arises when they are powered by hydrocarbon or biofuels. This is mainly attributed to the coking on the anode Ni surface, which leads to the deactivation of the electrocatalytic active sites [46]. The thickness of IT-SOFCs electrolytes (∼10–20 μm) can also be an issue. Down 800 °C, the IT-SOFCs exhibit high energy losses due to the following factors: (i) intrinsic ohmic polarization by the nature of the V O ∙ ∙ electrostatic migration process; (ii) extrinsic ohmic polarization due to the space charge layers created by the segregation of dopants and (iii) hindered migration of the V O ∙ ∙ due to the heterogeneity and imperfections of the crystal lattice caused by segregation of dopant and formation of microdomains inside the bulk which block the migration of the V O ∙ ∙ [145–147]. Thicker electrolytes result in a larger average free path for ionic charge carriers, leading to higher impedance. This feature induces more shock and scattering of O2− and V O ∙ ∙ inside the crystal. The ionic migration of O2− and V O ∙ ∙ across the 8YSZ crystal is thermally activated and exhibits an exponential dependence on temperature (Arrhenius Law). This activation is especially important when hydrocarbons or biofuels are directly reformed due to their highly endothermic nature, creating colder zones inside the anode with lower ionic conductivity. To mitigate this phenomenon, thinner electrolytes are employed at higher Top . to reduce the ohmic losses owing to elastic and inelastic shocks of the O2− and V O ∙ ∙ and the sub-lattice cations [148]. IT-SOFCs anode materials have been optimized for the use of low-cost logistics biofuels such as bioethanol and biomethane, which are more versatile than H2 [46,149]. The NiO/8YSZ composite anode is widely preferred in IT-SOFCs due to the following advantages: (i) exceptional particle size and size distribution of NiO and 8YSZ besides interconnected pores; (ii) efficient reactant/product diffusion; (iii) high density of TPBs; (iv) good electrocatalytic activity for H2, C2H5OH, or CH4 bonds cleavage; (v) good electronic and ionic conductivities; (vi) structural stability; (vii) low-cost of Ni compared to noble metals like Pt, rhodium (Rh), and palladium (Pd); and (viii) electrolyte CTE matching. The CTE of NiO/8YSZ composite anode and 8YSZ electrolyte is 12 × 10−6 °C−1 and 14 × 10−6 °C−1 ranging from 300 to 900 °C [150]. However, the main disadvantages of NiO/8YSZ anodes in IT-SOFCs are: (i) low redox cycling; (ii) degradation ranging from 800 to 1000 °C, and (iii) surface deactivation of Ni by coking. Many researchers have explored alternative materials with the goal of improving performance, reducing degradation caused by coking, and extending the IT-SOFCs lifespan [18,46,151,152]. Table S2 of SI presents several performance, efficiency, and durability data of IT-SOFC and HT-SOFC for several cell configurations powered by H2, C2H5OH, or CH4. These studies focus on enhancing the performance of IT-SOFCs and HT-SOFCs by: (i) reducing the coking; (ii) improving the kinetics of H2, C2H5OH, or CH4 oxidation; (iii) hydration of the fuels to mitigate coking; (iv) enhancement of the mechanical properties and physicochemical stability of the SOFC electrolyte and electrodes. As depicted in Table S2 of SI, Ni is the most used catalyst in anode for SOFCs. This is attributed to the following aspects: (i) excellent electronic conductivity and (ii) high concentration of basic sites in the metallic surface, which promote the cleavage of H2, hydrocarbons, and biofuels covalent bonds. Furthermore, Ni has proven to be an effective catalyst for the thermal decomposition (cracking) of hydrocarbons in the synthesis of nanotubes and graphene. An alternative approach involves the use of Ni-Cu alloys in SOFC anodes. Cu has a lower catalytic activity compared to Ni presenting lower coking over its surface and a slight reduction of IT-SOFC power density [46,153–155]. Noble metals such as Pt, Rh, Pd, and silver (Ag) can be used for C2H5OH reforming at IT-SOFCs anodes. Pt is an effective catalyst for methanol (CH3OH) and C2H5OH deprotonation. It also facilitates the cleavage of H2 covalent bonds. However, the use of Pt in C2H5OH reforming results in the generation of high concentrations of CO. To address this issue, Pt-Ru alloys are employed. These alloys mitigate coking because ruthenium (Ru) undergoes rapid oxidation, producing O2− anions. These anions react with the adsorbed CO, transforming it into CO2 and preventing coking on the active surface [46,153]. However, these noble metals are skyrocketing expensive. 3.2 SOFCs directly powered by biofuels SOFCs can directly reform natural gas (NG), biogas, biomethane, bioethanol and biomass-derived syngas into electricity with efficiencies higher than gas engines and turbines. SOFCs exhibit reduced emissions of CO2, sulfur oxides (SOx), CO, volatile organic compounds (VOCs), and nitrogen oxides (NOx) [49]. NOx is a great concern for ICEVs, even if biofuels are employed. Other contaminants, such as siloxanes, H2S, and sulfur-containing organic compounds present in biofuels, react with Ni of the reformers and SOFC anodes. High concentrations of these contaminants are frequently found in sewage biogas, as well as in manure and food waste. Halogenated compounds and siloxanes are predominantly present in landfill biogas [49]. Ni-free anodes have been used to enhance the performance and lifespan of SOFCs powered by fuels containing impurities. Mahato et al. reviewed Ni-free anodes, including Cu and Ce-based perovskites with improved resilience against sulfur attack and coking. Anodes with higher resistance to sulfur attack might result in increased SOx emissions due to H2S oxidation. Siloxanes, even in ppb trace amounts, are a severe threat to reformers and anode SOFCs, leading to irreversible degradation by SiO2 growth over the Ni catalyst surface. Instead, the impact of H2S is lower than siloxanes, causing temporary performance setbacks without irreversible damage [28]. Logistic fuels like bioethanol and NG hold potential advantages over H2, given the undeveloped H2 hubs and pipelines distribution in the entire world. Ethanol Steam Reform (ESR), Steam Methane Reform (SMR), and the water–gas shift reaction (WGS) may occur when these fuels are used in SOFCs, impacting the partial pressures of H2 and CO, the temperatures, and the disparities in Nernst potentials at different points inside the cell [156]. For instance, Afroz et al. reported Ni-Cu/GDC nanocatalysts applied as anodes of SOFCs powered by biogas. (NiO(1-x)CuOx)/yGDC nanocatalysts with stoichiometry between 0.2 < x < 0.8 and y = 1 or 1.3 were synthesized by solid-state reaction. SOFCs were manufactured by pressing LiNiCuZnO as cathode and GDC as electrolyte. 0.2NiO-0.8CuO/1.3GDC powered by biogas showed 72 mW·cm−2 and OCV of 0.84 V at 650 °C. The biogas composition was 55% CH4, 25% CO2, 9% H2, 5% CO, and 5% N2 with 1% H2S + ash + O2 by volume. In long-term tests up to 72 h at 650 °C, the cells demonstrated voltage and power degradation of 0.14 mV·h−1 and 0.75 mW·cm−2 after two hours without coking [157]. 3.3 Coking Low-carbon fuels, such as NG or biogas with high CH4 concentration, hold promise for SOFC technological applications. The high Top . of SOFCs allows the internal cracking of lightweight hydrocarbons, eliminating the demand for external reforming. However, direct exposure can lead to SOFC anode degradation. One approach to mitigate this issue is regulating the oxygen-to-carbon (O/C) ratio in the fuel. This can be achieved by adding air to NG and partially separating CO2 from biogas (refining/upgrading). Such measures prevent degradation by coking. Researchers have reported the use of IT-SOFCs powered by air-diluted NG and upgraded biogas with 0.2 < O/C < 1.2 ratio. NG and biogas undergo air dilution and CO2 separation, respectively, before being used as fuels in SOFCs in order to avoid coking. The synthetic biogas composition used was 56 vol%CH4:36 vol%CO2:8vol%N2, with an O/C ratio of 0.8 [158]. According to Gibbs free energy equilibrium predictions, an O/C ratio of 1.2 is the minimum acceptable value to prevent coking at 800 °C [159]. However, SOFCs can operate at lower O/C ratios without experiencing coking [158]. Button NiO/YSZ anode-supported cells with 8YSZ electrolyte, GDC (gadolinia-doped ceria) DBL, and LSCF (La1-xSrxCoyFe1-yO3-δ) cathode were manufactured and tested using air-diluted NG and upgraded biogas. SOFCs operated at O/C < 1.2 did not exhibit coking. At 800 °C and a constant discharge of 500 mA·cm−2, cell performances were measured over 100 h of testing. Post-mortem analysis was performed on the samples to investigate morphological changes after exposure to high-methane fuels. For an O/C ratio of 0.8 (+63 vol% air), cells powered by air-diluted NG achieve 867 mV at 500 mA·cm−2. For upgraded biogas, partial CO2 separation to achieve an O/C of 0.4 (−60 vol% CO2) enabled better and stable performance, reaching 880 mV at 500 mA·cm−2. However, the cells running on pure synthetic biogas at O/C ratio of 0.8 at 800 °C failed due to NiO/YSZ deactivation caused by coking [160]. These carbon deposits reduce the SOFC performance by obstructing reagent access to the anode TPBs. The interfaces between Ni, NiO, YSZ phases, and the coke exhibit CTEs mismatch. During the start-up and light-off switching, and redox cycles, micro-defects emerge, propagating cracks that spread by the anode microstructure. These cracks lead to anode delamination, mechanical failure, and performance drop due to the loss of contact between the percolated electronic and ionic conductor phases. Thus, it is crucial to understand the behavior of the anode materials and fuels at the operating conditions in order to set up modifications that can mitigate coking [4,49,135–137,161–164]. Ni/YSZ anodes synthesized by sol–gel and hydrothermal combustion with distinct compositions and co-dopants have been evaluated in SOFCs powered by CH4 among 650–850 °C. The analysis of the exhaust gases has been performed using mass spectrometry and gas chromatography. The coke concentration is typically determined through temperature programmed oxidation (TPO). The coking rate on the anode TPBs can be influenced by the synthesis route, chemical composition, and the anode microstructure. The coking rate on NiO/YSZ anodes strongly depends on the O/C ratio at the TPBs. This rate can be boosted by enhancing: (i) the mass transfer of reactants across the anode to TPBs via control of diameter, volume, and orientation of the pore; (ii) the inlet concentration of CH4 gas; and (iii) the SOFCs current density. The power density of the cell increases with more efficient mass transfer of CH4 to the TPBs. However, a low O/C ratio at the TPBs results in coking. Otherwise, elevating the current density and reducing the CH4 concentration raises the O/C ratio at the TPBs, reducing the coking rate [165]. The O/C ratio affects the coking rate in SOFCs powered by CH4. Controlling the operating parameters and the anode microstructure can potentially reduce or prevent coking. Wang et al. optimized the O/C ratio changing the SOFC anodes pore structure, inlet CH4 concentration, and cell current density. Higher CH4 levels in the fuel inlet led to efficient mass transfer and elevated CH4 levels at the TPBs, ensuring a high-power density. However, coking rates have increased, reducing the SOFC lifespan. The coking rate can be also reduced by increasing the cell operating current density. Therefore, adjusting the operating parameters and anode microstructure can eliminate coking on NiO-based anodes, ensuring stable power generation by CH4 [165]. 3.4 Recent break-throughs in SOFC construction Using advanced materials for direct CH4 electrochemical oxidation represents a viable strategy for enhancing performance and lifespan while reducing coking on the SOFC anode. Researchers have explored the substitution of Ni in SOFC anodes with other metals, including Co, Cu, or bimetallic Co-Cu alloys. Sarruf et al. reported CeO2 composite anodes incorporating Co, Cu, and Co-Cu catalysts by amorphous citrate route. CeO2-10Sc1CeSZ (Ce0.01Zr0.99)0.80Sc0.20O2-δ: 10 mol% Sc2O3 and 1 mol% CeO2 stabilized ZrO2 buffer layer was screen printed on the 10Sc1CeSZ (150 μm of thickness) electrolyte and sintered at 1300 °C for 2 h in ambient atmosphere. LSM cathode slurries were screen printed on the other side of the electrolyte and sintered at 1100 °C for 2 h in an ambient atmosphere. (Co, Cu, Co-Cu)x/(CeO2)y slurry-based anodes were screen printed on the buffer layer and calcined at 800 °C for 2 h in an ambient atmosphere. Ag wires glued with Ag ink over the electrodes were employed as current collectors. The buffer layer was applied to prevent delamination during cycling due to a CTE mismatch between the electrolyte and the anode. The CTE of 10Sc1CeSZ electrolyte and CuO and CoO are 13–14 × 10−6 °C−1 and 5–7 × 10−6 °C−1, respectively. However, after the thermal reduction of CuO and CoO into Cu and Co, the CTE for both metals is ∼17 × 10−6 °C−1 [166]. Co2Cu-CeO2 anode-based SOFCs exhibited power densities of 540, 450, and 400 mW · cm−2 at 800 °C when assessed with anhydrous H2, C2H5OH, and CH4 outperforming the Co-CeO2 and Cu-CeO2 anode-based SOFCs, which demonstrated 120–150 mW·cm−2 at 800 °C. Moreover, Co2Cu-CeO2 anode-based SOFCs showed stability over 24 h of continuous operation. These cells are appropriate for electro-oxidation of hydrocarbons and biofuels exhibiting no evidence of coking. The Co2Cu-CeO2 electrocatalyst from Troom up to ∼500 °C has a biphasic microstructure comprising two solid solutions based on Co rich in Cu (HCP: hexagonal close packed) and Cu rich in Co (FCC). In the range of 700–850 °C, the same microstructure persists, with a slight chemical redistribution in each solid solution, while both phases are FCC. This architecture promotes homogeneous microstructure even with an interface of the same phase. Heterointerfaces with the same or different phases are known to yield synergistic effects, thereby enhancing electrochemical and electrocatalytic properties [121,166–168]. To prevent coking on NiO-based anode, a thin pre-catalytic layer also can be applied. This layer facilitates the conversion of hydrocarbon and biofuels into H2 and CO. Wei et al. reported SOFC anodes coated with a pre-catalytic layer of La0.60Sr0.20Cr0.85Ni0.15O3-δ (LSCrNi) with exsolved Ni nanoparticles. SOFCs were manufactured using NiO/5GDC anodes, both containing the LSCrNi pre-catalytic layer and lacking it. Fig. 7 (a and b) depict the microstructure of the anode and the catalyst layer interface cross-sectional besides the semi-quantitative Energy Dispersive Spectroscopy (EDS) [169]. LSCF and 5GDC were used as cathode and electrolyte, respectively. 5GDC electrolyte was screen printed on the 60 wt%NiO:40 wt%GDC green anode previously shaped by tape casting and both were co-sintered. 70 wt%LSCF:30 wt%5GDC cathode was deposited on the electrolyte by screen printing, and the entire cell was sintered. Then, a slurry containing 80 wt% of 20 wt%GDC-LSCrNi was screen printed on the NiO/5GDC anode. SOFCs containing the 20 wt%GDC-LSCrNi pre-catalyst layer and those lacking it showed 856 and 822 mW·cm−2 when powered by H2 at 750 °C. Similarly, the SOFCs containing the 20 wt%GDC-LSCrNi pre-catalyst layer and those lacking it, powered by 50 vol%CH4:50vol.%CO2, exhibited maximum power densities of 496 and 758 mW·cm−2 at 750 °C. The SOFCs with the 20 wt%GDC-LSCrNi pre-catalyst layer show good performance and stability, achieving 0.65 V and 84% of CH4 conversion without coking despite the lower power density as shown in Fig. 7(c and d). However, the SOFCs lacking the pre-catalyst layer despite, presenting the higher power density showed a voltage drop of 76.9% over 36 h of testing under 400 mA·cm−2 at 750 °C due to the coking as depicted in Fig. 7(c and e). To confirm coking, the electrodes were characterized by Raman spectroscopy and EDS, which showed a high coking on the electrode without the catalyst and no coking on the electrode with the catalyst as shown in Fig. 7(f and h) [169]. Chen et al. reported SOFCs with power density as high as 370 mW·cm−2 at 500 °C when powered by 96.5 vol%CH4:3.5 vol%H2O. This cell has operated for 550 h without coking. The manufacturing process included: (i) synthesis of NiO/BZCYYb (BaZr0.10Ce0.70Y0.10Yb0.10O3–δ) anode by conventional oxide mixing, followed by tape casting and sintering at 1000 °C for 2 h; (ii) deposition of a functional layer of NiO/BZCYYb and SDC on the anode by suspension dripping, drying and sintering at 1400 °C for 5 h; (iii) synthesis of PrBa0.50Sr0.50Co1.50Fe0.50O5+δ (PBSCF) cathode nanofibers by electrospinning, followed by painting a ink containing the nanofibers on the other electrolyte surface, and thermal-treated at 950 °C for 2 h; (iv) infiltration of 20 μL of 0.1 Molar of SDC solution on the anode surface and drying; (v) a Ce0.90Ni0.05Ru0.05O2-δ slurry of the pre-catalytic layer was painted on the anode; (vi) infiltration of 5 μL of 0.1 Molar of Pr(NO3)3 solution on the cathode surface and (vii) sintering the entire cell at 800 °C for 2 h in an ambient atmosphere. The higher catalytic activity and coking resistance of the pre-catalytic layer can be attributed to the synergistic effect in the Ni and Ru ex-solution on the surface. This hypothesis was validated through computer simulation and in situ experiments [170]. The methodologies of ex-solution, infiltration, impregnation, and solid-state reactions of catalyst nanoparticles on the electrode pores play a crucial role in achieving electrodes with enhanced dispersion, distribution, and strong interaction in the support and catalyst particles. The degree of dispersion, distribution, and interaction significantly impacts the electrochemical properties and physicochemical stability of the electrodes. These attributes reduce the coarsening and coking on the electrodes during SOFC operation. The coarsening reduction leads to a substantial increase in the SOFCs performance and lifespan [171]. 3.5 Advanced approaches for manufacturing high-performance SOFCs Innovative techniques such as microengineering have been used for SOFCs manufacturing to enhance performance, mitigate coking, and extend lifespan. Pulsed-laser deposition (PLD) was used to construct nanocomposite layers to improve the performance of anode-supported SOFC as shown in Fig. 8 (a). Develos-Bagarinao et al. reported high-performance SOFCs with 4.7 W·cm−2 at 700 °C. This was possible by nanoengineering techniques used to construct the nanoporous active cathode LSC and the nanocomposite cathode LSCF-GDC both fabricated by PLD. Fig. 8(b–d) show high-magnification cross-sectional SEM images of the SOFC, where the nanostructures of the layers can be observed. To confirm the nanostructure patterns, high-resolution scanning transmission electron microscopy with high-angle annular dark-field (STEM-HAADF) images and EDS elemental mapping were obtained as depicted in Fig. 8(e, f). The nanostructures SOFCs demonstrated high electrochemical performance at low temperatures, the highest performance reported in the literature, showing values in the range of 2.2–4.7 W·cm−2 at 650 and 700 °C when powered by 97.0 vol%H2:3.0 vol%H2O as depicted in Fig. 8(g). The SOFCs exhibited stable electrochemical performance at ∼0.8 V for 250 h without any voltage drop [172]. Researchers have reported remarkable findings on tubular SOFCs exhibiting high performance and coking resistance. Micro-monolithic SOFCs were manufactured with an asymmetric geometry, enabling the separation of the mechanical support and anode from the electrochemically active sites. These SOFCs exhibited a notable enhancement in mass transport, achieving power densities in the range of 1,770–2,220 mW·cm−2 when powered by fuels with low calorific value gases (LCVGs). The majority of the world’s biomethane and NG sources consist of LCVGs, typically containing less than 20 vol% of CH4 levels. Exploiting these sources poses challenges due to skyrocketing costs associated with gas refining and upgrading technologies. Therefore, there is potential for developing more cost-effective alternatives for LCVG direct utilization [173]. Li et al. reported micro-monolithic SOFCs exceeding 2000 mW·cm−2 when supplied with 10–20 vol% CH4 in the fuel stream at 700 °C. This outcome results in emerge from the reduction of mass transport polarization and the effective prevention of coking for over 4,000 h, facilitated by the micro-monolithic anode support design. This design comprises six sub-channels with radial droplet morphology manufactured using the phase inversion technique of a polymeric binder precipitation by solvent-coagulant exchange under controlled isostatic pressure. This support, with an external diameter of 2.2 ± 0.1 mm and a thickness of 50 μm, played a crucial role in providing a high surface area per volume, ensuring a high volumetric power density. The YSZ electrolyte (4.5 μm of thickness) and GDC buffer (4.5 μm of thickness) layers were deposited via dip-coating on the anode support and co-sintered at 1400 °C. The LCSF-GDC cathode (25–30 μm of thickness) was deposited using dip-coating and sintered at 1000 °C for 2 h. Ag wires were utilized as current collectors in both electrodes [173]. Fig. 9 depicts this disruptive micro-tubular SOFC. The techniques, methodologies, and insights discussed above play a crucial role in enhancing the feasibility of SOFC technology for efficient electricity generation from hydrocarbon and biofuels like bioethanol and biogas. The durability of these systems is significantly impacted by the presence of impurities in hydrocarbons, particularly in biofuels. Biogas can be refined to produce biomethane, converted into syngas, and utilized as fuel in SOFCs, enabling the efficient generation of stationary and decentralized power. Moreover, bioethanol and biomethane can be onboard reformed into syngas and employed for power generation in electrified vehicles equipped with stacks of MS-SOFCs. 4 MS-SOFCs powered by H2 and biofuels: Features, benefits, and drawbacks 4.1 Innovative design, high efficiency performance, and scalability at low cost New fabrication techniques have been developed for SOFC operation in temperatures lower than 800 °C. These include the deposition of SOFC ceramic films on PMSs to obtain the MS-SOFCs which can operate in the range of 550–750 °C. In this range, cost-effective FSS and ASS-based PMSs and ICs can be used. The inclusion of metallic materials enables MS-SOFC manufacturing with lower CAPEX investments and scalable techniques, thereby enhancing the competitiveness of this technology in the mobility market. This progress is also attributed to the: (i) MS-SOFCs are sealed and integrated into stacks by laser micro-welding, ensuring robustness and gas tightness; (ii) resistance to mechanical vibrations; (iii) good redox cycling; and (iv) rapid start-up and light-off switching facilitated by the high thermal conductivity of metallic PMSs and ICs. These devices also can be powered by reformed syngas derived from hydrocarbon or biofuels, exhibiting performance higher than SOFCs. These features of MS-SOFCs can enable them to scale up in stacks at a lower cost for application in the mobility sector. This new powertrain system comprising a stack of MS-SOFCs powered by hydrocarbons or biofuels represents a wide global market, spanning cars, trucks, agricultural machinery, trains, airplanes, and cargo ships, with the key component being the MS-SOFC. Fig. 10 depicts an MS-SOFC architecture designed solely for proof-of-concept. MS-SOFCs can be manufactured using: (i) dense ICs made of FSS, ASS, Inconel 600 (NiCrFe alloy) or Hastelloy (NiMoFeCr alloy) of high oxidation resistance shaped by mechanical stamping, machining, or laser cut; (ii) PMS made from the same materials of the ICs (300–500 μm of thickness) manufactured by tape casting, 3D printing, or sheets micro-drilled by laser; (iii) 10GDC DBL layer (500–800 nm of thickness) deposited by PVD or sol–gel on the PMS; (iv) porous Ni/8YSZ base anode layer (20–60 μm of thickness) deposited by screen printing on the 10GDC DBL layer; (v) porous Ni/10GDC active anode layer (10–20 μm of thickness) also deposited by screen printing on the base anode layer; (vi) dense 8YSZ electrolyte layer (1–5 μm of thickness) deposited on the active anode layer by PVD or sol–gel; (vii) 10GDC DBL (500–800 nm of thickness) deposited by PVD or sol–gel on the 8YSZ electrolyte layer; (viii) high electrocatalytic activity cathode layers, such as LSC (La1-xSrxCoO3-δ) or LSCF with (10–30 μm of thickness) deposited on the last DBL layer by screen printing; (ix) spinels DBLs based on CoxOy, CuMn2O4, and MnCo2O4 (500–800 nm of thickness) deposited by PVD or sol–gel on the cathode layer or cathode IC. Some studies have reported the use of different materials, architectures, microstructure engineering, and techniques to manufacture MS-SOFCs, leading to remarkable performance improvements. Typically, a 10GDC DBL of 500 nm is deposited on FSS or ASS PMSs by PVD. This DBL prevents the inter-diffusion of Fe, Cr, and Ni into the anode layer, minimizing the formation of insulating blocking phases for charge carriers. Subsequently, Ni/8YSZ and Ni/10GDC suspension in an ink vehicle based on α-terpineol and ethyl-cellulose, containing pore formers (such as corn starch, carbon black, or PMMA) with suitable particle and distribution sizes are deposited on the 10GDC DBL over the PMS by screen printing using a small aperture polyester mesh. Following this, a dense 8YSZ electrolyte layer is deposited by PVD to seal the active anode surface and prevent the mixing of fuel and air. Then, a 10GDC DBL is deposited on the 8YSZ electrolyte before the deposition of the LSCF or LSC cathode layer by screen printing [10,17,55,174–183]. The hierarchical stacking of the anode layers is organized to minimize the roughness of the active anode surface to prevent issues such as 8YSZ electrolyte flaws, pinholes, delamination, and cracks. Each anode layer is designed with an appropriate particle size and distribution. MS-SOFCs play a pivotal role in the onboard power generation of FCHEVs, demonstrating high synergy when powered by logistical biofuels. This aligns with existing value chains for biofuel production and distribution established in many countries. MS-SOFCs also boast significant attributes such as a compact design, mechanical robustness, efficient power generation, and materials cost advantage compared to SOFCs [13,184]. To enhance the efficiency of MS-SOFCs powered by biofuels, improvements in performance and long-term stability are imperative. These enhancements aim to extend the lifespan by mitigating PMS oxidation and coking. Among these strategies, coating the PMS with DBLs or a pre-catalytic layer for direct internal reforming and the impregnation of catalyst nanoparticles into the PMS and anode scaffolds are the most effective method to improve electrochemical devices [13,184]. The next sections aim to discuss the challenges and advances in key components for the construction of MS-SOFCs, such as anodes, electrolytes, cathodes, DBLs, and PMS. 4.2 Anodes for MS-SOFCs Researchers have focused on enhancing the properties of SOFC anode materials to enable the use of cost-effective logistic fuels such as bioethanol and biomethane [46,135–137,161]. The NiO/8YSZ composite is the most employed anode material due to its: (i) good control over the size, distribution, and pores interconnection to promote the suitable transport of reactants and products; (ii) high surface area of TPBs; (iii) high electrocatalytic activity; (iv) high electrical conductivity, structural stability, and CTEs matching [135–137,150,161,185]. The main drawbacks of NiO/8YSZ composite anodes in MS-SOFCs powered by hydrocarbon and biofuels include the low kinetic performance of electrochemical reactions, coarsening, and coking during the long-term. To mitigate coking and achieve good stability and performance, researchers have explored the incorporation of more active materials as anodes [18,135–138,151,152]. Ni, 8YSZ, and 10GDC thin particles coarsening in the anode is the most damaging mechanism of degradation. This phenomenon arises from the auto-diffusion of nano or sub-micrometric particles at highly porous regions, leading to the growth of larger particles while smaller ones decrease. Consequently, the volume of pores increases, reducing the TPBs area and MS-SOFC performance. Researchers have addressed this issue by creating composite anodes by infiltration of Ni, YSZ, and GDC catalyst precursor salts into YSZ or GDC scaffolds, followed by calcination to impregnate these catalyst nanoparticles. Despite these efforts, the nanoparticles still undergo coarsening in long-term due to the high surface area of the catalyst material, reducing the available TPBs for redox reactions [17,177,186–189]. Dewa et al. developed MS-SOFCs with the following configuration: a Sc2O3 co-doped YSZ (Sc-YSZ) anode scaffold co-laminated with FSS 430 PMS (300 μm of thickness) by tape casting and both infiltrated with Ni/GDC followed by the deposition of a Sc-YSZ dense electrolyte on the anode and sintered at 1350 °C in a reducing atmosphere. Then, a 5 wt% Rh/CeO2-ZrO2 catalyst was infiltrated in both PMS and anode scaffold and calcinated at 600 °C. Afterward, the La0.80Sr0.20CoO3-δ cathode layer was deposited on the Sc-YSZ electrolyte surface by screen printing and activated in-situ [184]. MS-SOFCs featuring an active area of 0.60 cm2 were tested using 45 vol% C2H5OH in H2O at 600 °C. The cells lacking the 5 wt% Rh/CeO2-ZrO2 catalyst delivered 120 mW·cm−2 under 280 mA·cm−2 at 0.45 V, whereas those incorporating the catalyst achieved 150 mW·cm−2 under 360 mA·cm−2 at 0.60 V. For long-term, this MS-SOFC lacks the 5 wt% Rh/CeO2-ZrO2 catalyst delivered 100 mA·cm−2 at 0.70 V but was deactivated by coking after 1.2 h. Meanwhile, the same configuration cell with 5 wt% Rh/CeO2-ZrO2 catalyst delivered 140 mA·cm−2 at 0.70 V with a 31% of degradation in voltage over 130 h of endurance tests with lower coking [184]. Table S3 of SI presents several performance, efficiency, and durability data of MS-SOFCs powered by H2, C2H5OH, or CH4, including several cell configurations and types of anodes. Dogdibegovic et al. have developed MS-SOFCs comprising 10SDC scaffold infiltrated with a 40 vol% Ni catalyst as the anode on PMSs based on P434L alloy followed by 10Sc1CeSZ electrolyte and Pr6O11 cathode deposition. This MS-SOFC (5 cm2 of active area) is powered directly by 45 vol% C2H5OH in H2O at 700 °C delivered 250 mW·cm−2 under 0.44 A·cm−2 at 0.7 V without coking over 100 h of operation, owing to the excellent anode Ni thin nanoparticles high surface area, as shown in Table S3 of SI [17,61]. Miura et al. reported the impregnation of Ni/GDC-based catalyst nanoparticles in MS-SOFC anodes. Ni-YSZ and Ni-GDC scaffold anodes were deposited on PMSs provided by Plansee®. GDC DBLs and YSZ electrolyte were deposited on the PMS and anode by PVD. LSC cathode (50 μm of thickness) with 0.64 cm2 of the active area was screen printed over the electrolyte and dried at 80 °C [190]. Catalysts were impregnated into the anode scaffolds and PMSs by wet infiltration of Ni:Gd:Ce and Ru:Gd:Ce with a molar ratio of 5:1:4 using Triton-X as a surfactant. The PMSs and anode scaffolds were calcinated at 350 °C for 30 min in an ambient atmosphere. The process of infiltration and calcination was repeated fourfold. The weights of Ni/GDC and Ru/GDC were 74.0 and 77.7 mg. Au mesh and Pt wires were used as current collectors in the electrodes. After assembling the cell in the experimental set-up, the system was heated up to 850 °C for 2 h to activate the LSC cathode, stabilize and adhere the catalyst nanoparticles to the anode, and cure the glassy sealant used to seal the cell. During this thermal-treatment, 10 vol% H2 and air were supplied to the anode and cathode [190]. Electrochemical tests were performed using several fuels, including H2, CH4, NG, propane, and iso-octane (C8H18). The composition used for NG comprised 27.2% CH4, 1.5% ethane (C2H6), 1.2% propane (C3H8), 0.3% butane (C4H10), 34.9% H2O, and 34.9% N2 by volume. For propane, the composition included 14% C3H8, 43% H2O, and 43% N2 by volume. Iso-octane was 4.5% C8H18, 35.9% N2, and 59.6% H2O by volume. In all cases, a steam/carbon (S/C) molar ratio equal 1 was employed to prevent coking on the PMS and anode [190]. MS-SOFCs comprising GDC anodes lacking catalysts, as well as those with Ni/GDC and Ru/GDC shows 630, 1140, and 1370 mW·cm−2 at 0.70 V when supplied with 97 vol%H2:3vol%H2O at 600 °C up to 5 h of testing. At open circuit voltage (OCV), the polarization curve slope decreases proportionally to the concentration of these impregnated catalysts. This outcome implies a reduction in the resistance of the H2 oxidation reaction (HOR) at the anode with the incorporation of nanostructured catalysts [190]. When powered by CH4, the MS-SOFCs lacking catalysts, as well as those with Ni/GDC and Ru/GDC showed 300 mW·cm−2 at 0.30 V, 970 and 1160 mW·cm−2 at 0.60 V. MS-SOFCs impregnated with Ni/GDC and Ru/GDC nanocatalysts showed 1.0 V of OCV according to the equilibrium gas composition calculated by the Nernst equation. However, the OCV of MS-SOFC without catalyst was 0.95 V, suggesting a low catalytic activity for CH4 reforming. In addition, the MS-SOFC anode lacking catalyst featured a potential sharp drop in the range of 400 and 500 mA·cm−2, indicating insufficient production of H2 and CO by the CH4 reforming. These high performances are due to the small particle size (∼100 nm) of Ni, Ce, and Gd present in the Ni/GDC scaffolds. Ni and Ru nanoparticles of ∼10–30 nm and 20 nm were obtained on the GDC scaffolds. The other reason was the formation of bimetallic Ni-Ru alloy nanoparticles on the surface of Ru/GDC anode scaffold. This microstructure was responsible for the increase of H2 adsorption and surface diffusivity, improving the electrochemical performance of the cells. The presence of Ru with a high concentration of active basic sites increases the rate of electron donation, facilitating the cleavage of C–H chemical bonds and the catalytic activity increases considerably [190–192]. These results suggest that the infiltration of nanocatalysts can boost the internal reforming of CH4 at low temperatures (Top . = 600 °C) in MS-SOFCs. Udomsilp et al. reviewed the performance of SOFCs and MS-SOFCs in terms of power density [10,12]. Compared to these benchmarks, the performance of H2-powered MS-SOFCs reported by Miura et al. is the highest ever achieved in the literature in operating temperatures as low as 600 °C. This performance is similar to SOFCs operating in the range of 800–1000 °C. Table 1 shows the power density values at 0.70 V for MS-SOFCs manufactured and tested by Miura et al. [190]. For NG, propane, and iso-octane directly reformed at 600 °C in MS-SOFCs with infiltrated Ni/GDC, the OCVs were higher than 0.97 V, suggesting good catalytic activity. At 900 mA·cm−2, the cell voltage powered by propane dropped significantly. However, the use of NG and iso-octane enables a current density up to 1200 mA·cm−2. For iso-octane, the current density at 0.7 V and 600 °C was 640 mA·cm−2. These MS-SOFCs with infiltrated catalysts exhibited suitable catalytic activity for hydrocarbons reforming up to 5 h of testing. However, the application of MS-SOFCs for onboard power generation from hydrocarbons and logistical biofuels still requires long-term testing at least 80,000 h for competitiveness in the mobility sector [190]. 4.3 Electrolytes for MS-SOFC The main objective of the MS-SOFCs is to reduce the thickness of the deposited ceramic layers, aiming for “thinner” films to minimize both Top . and cell ohmic losses [55]. As previously discussed, the electrolyte functions as a selective semipermeable membrane for O2− anions by V O ∙ ∙ promoting ionic conductivity across the cell. Simultaneously, it acts as a cell gas sealer and electronic insulator, preventing contact in the range of the anode and cathode gas chambers to prevent short-circuiting by lower impedance pathways. To comply with those requirements, a dense defect-free electrolyte is crucial. Consequently, achieving thin electrolyte layers poses challenges, often requiring the use of expensive and advanced techniques of deposition. Several fluorite and perovskite structures are used as electrolytes in MS-SOFCs. Stabilized zirconia, doped ceria, bismuth oxides, and LSGM have been used as solid electrolytes [193]. 8YSZ films have been obtained by gas flow sputtering deposition and characterized to ensure a dense and defect-free electrolyte layer. MS-SOFCs comprising 8YSZ (2 µm of thickness) deposited on Ni/GDC active anode by gas flow sputtering showed 2500 mW·cm−2 at 0.7 V using H2/H2O at 700 °C [10]. Bischof et al. investigated the impact of reducing the electrolyte layer thickness by the same technique to minimize the ohmic resistance of the cell. 8YSZ electrolyte with 2 µm of thickness exhibited higher current density compared to cell comprising 8YSZ electrolytes with 4 µm of thickness [183]. Researchers are engaged in the reduction of electrolyte layers in SOFCs, focusing on employing scale-up film deposition techniques to produce dense and defect-free electrolytes. These techniques include tape casting [178], spin coating [194], and various PVD methods such as PLD [193], atomic layer deposition (ALD) [193], magnetron sputtering (Msputt.) [10], and electron-beam physical vapor deposition (EB-PVD) [12]. The main goal is to enhance the SOFC performance and decrease the Top . by either the reduction of electrolyte thickness or the adoption of more conductive materials. These advanced fabrication techniques enable the creation of thin and dense electrolytes with superior properties, providing precise control over film thickness, microstructure, and composition, which is critical for optimizing ionic conductivity and minimizing the ohmic losses of the cell [195]. For instance, ALD allows for the deposition of ultra-thin electrolyte layers with atomic-scale precision, reducing diffusion pathways for ions and improving overall efficiency. PLD and Msputt. can create highly dense and defect-free electrolyte films, which enhances mechanical stability and prevent gas leakage, critical for long-term operation. Furthermore, these techniques enable the integration of novel electrolyte materials, such as composite and multi-layered structures, which can combine the benefits of high ionic conductivity with improved chemical and thermal stability [196]. By producing electrolytes with optimized thickness and density, these advanced fabrication methods directly contribute to the enhancement of MS-SOFC performance, durability, and operational efficiency [196]. Some of these highly conductive materials include doped ceria [125,126], lanthanum gallates [197], cubic scandium-stabilized zirconia [178,179] and doped barium-based cerates [28]. However, none of these electrolytes has matched the thermodynamic stability of YSZ electrolytes or achieved competitive commercial pricing [10,12,198]. Notably, companies like Ceres Power and research institutions such as Jülich GmbH have opted to enhance their cells using GDC and 8YSZ electrolytes, respectively, with thickness in the range of 20–5 µm [198]. Opakhai et al. reported recent developments associated with MS-SOFCs. The focus is on several materials used as electrolytes and how they influence the performance and durability of MS-SOFCs. A dense and gas-tight electrolyte is crucial to prevent the mixing of fuel and oxidant gases, which leads to lower OCVs and reduced performance. The challenge is ensuring that thin electrolyte layers maintain gas-tightness while remaining structurally during high-temperature operation. Among all electrolytes, YSZ is commonly used, but its limited ionic conductivity at lower temperatures and shrinkage during sintering processes are challenging issues. One of the issues in MS-SOFCs is the CTEs mismatch in the range of the PMS and ceramic electrolytes. For instance, YSZ has a CTE of ∼10 × 10−6 °C−1, whereas some FSS and all ASS tend to have higher CTEs (∼12–17 × 10−6 °C−1). This mismatch can lead to delamination or cracking during thermal cycling. Techniques like plasma spraying (PS) or co-sintering have been used to improve the electrolyte density, but even with these, achieving complete densification without compromising the structural integrity of the PMS remains a challenge. Wet/colloidal deposition and thin YSZ layers post-sintering can boost the electrolyte density, but these approaches introduce complexity in maintaining lower porosity and structural compatibility. As MS-SOFCs aim to operate in the range of 500–750 °C, the performance of traditional YSZ electrolytes diminishes, requiring the exploration of alternative materials such as GDC or scandia-stabilized zirconia (ScSZ). However, these alternatives come with its own challenges, such as electronic leakage or high cost. MS-SOFCs with YSZ electrolytes have shown power densities of ∼940 mW·cm−2 at 800 °C and ∼550 mW·cm−2 at 700 °C. These values are promising for mid-range temperatures, but performance decreases significantly as the operating temperature drops. OCV as high as 1.0 V is essential for efficient operation. Dense YSZ electrolytes have shown OCVs slightly above 1.0 V when H2 is used as fuel, indicating good gas-tightness under optimal conditions. However, maintaining these OCV levels consistently across varied temperatures remains a challenge [195]. Hui et al. reported the manufacturing of SOFC components by PS focusing on electrolytes. This method offers numerous advantages for MS-SOFCs, but it also presents several key challenges. While PS allows high-temperature processing, it is difficult to fabricate sufficiently dense electrolytes using single-step deposition methods. Atmospheric plasma spraying (APS) often results in porous microstructures with 5%–15% porosity, leading to lower OCVs and reduced cell efficiency due to microcracking propagation. Microcracks are a common issue during the PS process, resulting from inadequate particle melting, substrate temperature fluctuations, and other deposition parameters. These microcracks reduce the electrolytes effectiveness, as they create pathways for gas crossover, compromising the SOFCs performance. To address this, post-deposition treatments, such as spark plasma sintering or vacuum sintering, are sometimes necessary to densify the electrolytes, adding complexity to the process. Despite the challenges with porosity and microcracking, some cells achieved OCVs close to 1.0 V, particularly when optimizing post-deposition treatments to reduce defects. Although PS offers high deposition rates, achieving the desired electrolyte microstructure and thickness lower than 10 µm across large areas is challenging. This complexity increases when scaling up for industrial production. On the other hand, vacuum plasma spraying (VPS), while producing denser electrolytes, is significantly more expensive than APS. SOFCs manufactured by APS reached 770 mW·cm−2 at 900 °C and 430 mW·cm−2 at 800 °C when using H2 as the fuel and oxygen as the oxidant [199]. Coddet et al. reported on TS and PVD techniques for manufacturing SOFC electrolyte layers. These techniques are crucial for creating thin, dense, and gas-tight electrolyte layers of MS-SOFCs with high efficiency. The challenge is to produce dense and gas-tight electrolyte layers while maintaining a minimal thickness to reduce ohmic resistance. However, achieving full density in electrolyte layers using conventional TS techniques remains difficult. Porosity in plasma-sprayed electrolytes is a common issue, leading to gas leakage and lower performance. For instance, APS deposits often require post-treatments, such as microwave sintering, to reduce porosity. Another challenge is the formation of cracks and voids during the deposition process. These defects arise due to the high thermal stress involved in TS processes. As the electrolyte layer cools, cracks can form, leading to gas permeability. Coddet et al. emphasize that VPS can help reduce cracks by operating in a controlled environment but at higher costs. Another issue is the CTEs mismatch in the range of the PMs and ceramic electrolytes like YSZ. This mismatch can cause delamination and cracking during thermal cycling. Coddet et al. suggest the use of composite electrolyte layers or interlayers to mitigate this problem by introducing a graded transition in the range of the PMS and the ceramic electrolyte. Both TS and PVD technologies have limitations. While TS allows high deposition rates, the porosity and crack formation remain challenges. On the other hand, PVD offers better control over the deposition of thin, dense films but at significantly slower deposition rates, making it less feasible for large-scale production. Cells fabricated using TS and optimized deposition parameters have shown improved performance. For instance, YSZ electrolyte layers produced using low-pressure plasma spraying (LPPS) achieved power densities up to 500 mW·cm−2 at 800 °C and 0.7 V, which is a significant improvement compared to traditional APS methods. The OCV of cells with YSZ electrolytes typically reached values close to 0.95 V, which indicates good gas-tightness but still falls short of the ideal 1.0 V. Further densification and crack reduction are needed to consistently achieve higher OCVs [75]. Du et al. reported the use of APS as a cost-effective alternative compared to LPPS techniques. However, while APS shows promise, achieving consistent microstructural quality remains difficult, particularly in controlling porosity and crack formation. Key performance metrics for MS-SOFCs highlight the importance of fine-tuning deposition parameters. For instance, the optimal YSZ coating deposited at an 80 mm spraying distance shows a porosity of 3.56%, yielding a maximum power density of 902 mW·cm−2 at 900 °C. This value outperforms other configurations, but further work is needed to improve the OCV, which is still below the desired 1.0 V mark at 0.964 V for the best sample. The ohmic resistance of the optimized cell was measured at 0.10 Ω·cm2 at 900 °C, which is significantly lower than cells with greater porosity or more microcracks, indicating that the dense YSZ layer effectively reduced resistance [200]. Hermawan et al. reported on the densification of YSZ electrolytes deposited by APS and refined through chemical/electrochemical vapor deposition (CVD/EVD) techniques. The goal was to create a dense, gas-tight electrolyte suitable for MS-SOFCs, addressing key challenges in achieving an optimal electrolyte structure. The APS technique is known for its fast deposition rate, but it leaves behind residual pores and pinholes, which compromise gas-tightness. The initial N2 permeation flux through the APS-prepared YSZ layer was 1.8–2.7 × 10−7 mol·s−1·cm2 at 25 °C, indicating the presence of defects. These imperfections hinder the cell efficiency by allowing gas crossover in the range of the fuel and oxidant. The CVD/EVD process is used to refine the density and plug residual pores in the YSZ electrolyte. This method gradually fills the pores by depositing additional YSZ material, increasing the layer thickness by 4–7 µm, and ensuring gas-tight conditions after 5 h of deposition. Despite the slow deposition rate of 1.14 µm·h−1, CVD/EVD effectively addresses the shortcomings of the APS process. Achieving a homogenous, dense layer is crucial for MS-SOFC performance. The study found that the CVD/EVD process yielded a dominant cubic phase in the YSZ layer, but a small amount of a secondary phase (monoclinic) was also observed. This secondary phase may affect the long-term performance and stability of the electrolyte. It was confirmed that a combination of APS followed by CVD/EVD produced a gas-tight electrolyte. The YSZ thickness after refinement was around 24–27 µm, ensuring minimal gas permeation and higher operational efficiency. However, the process remains time-consuming due to the slow growth rates of CVD/EVD [201]. Marcano et al. reported the use of APS and plasma spray-physical vapor deposition PS-PVD for fabricating high-performance SOFCs, focusing on the development of a dense and gas-tight YSZ electrolyte. The authors used PS-PVD to deposit a 26 μm thick YSZ layer, optimizing the plasma spraying parameters to ensure gas-tightness. However, ensuring consistent gas-tightness across large areas remains a challenge, particularly when controlling variables such as plasma gas composition, spray distance, and powder feed rate. The deposition of the YSZ electrolyte using TS methods can cause bending due to thermal stresses, which affects the integrity of the electrolyte layer. Bending during deposition is difficult to avoid, but the authors showed that optimizing the spray distance and robot speed could minimize this effect, leading to better contact in the range of the PMS and the electrolyte layer. The study highlights the importance of optimizing deposition parameters. For instance, a spray distance of 800 mm and a plasma gas ratio of Ar/He = 5.5 was found to be optimal for producing a dense, gas-tight YSZ electrolyte. However, the use of different powder feed rates and carrier gas flow rates affected the porosity and thickness of the deposited layers, requiring fine-tuning for consistent results. Even with optimized conditions, the YSZ electrolyte exhibited 2% porosity and some unmolten particles. These small defects, although not significant enough to cause leakage, could potentially impact long-term performance. The MS-SOFCs with the optimized YSZ electrolyte achieved a power density of 1.125 W·cm−2 at 0.75 V and 870 °C, demonstrating excellent performance. The study shows that the power density increased with temperature, reaching over 1 A·cm−2 at 800 °C, a significant benchmark for high-performance cells. The OCV values were measured in the range of 1.021 V and 1.082 V for temperatures ranging from 611 °C to 870 °C, which is close to the theoretical value of 1.1 V, indicating good gas-tightness of the YSZ electrolyte [202]. Zhang et al. reported the fabrication of GDC electrolytes for MS-SOFCs using APS and VPS to evaluate the performance of the GDC electrolytes and compare the effectiveness of the two fabrication methods. The authors show that VPS produces denser GDC electrolytes than APS, with the VPS-deposited GDC showing fewer defects and better gas-tightness. The porosity of the APS-GDC electrolyte was approximately 8.5%, while the VPS-GDC had 5.4% porosity, which directly affects the electrochemical performance of the cells. The temperature and velocity of GDC particles during deposition play a crucial role in the film’s microstructure. In the APS process, particles were deposited in a liquid–solid state, leading to larger splat sizes and some cracks. In contrast, the VPS process, which involved gas–liquid deposition, resulted in smaller splat sizes and a denser structure. However, the high temperature in the VPS process accelerated the evaporation of CeO2, leading to a compositional shift in the GDC films, which must be considered in future applications. While VPS produced a more uniform and denser microstructure, vertical cracks were observed in both APS and VPS coatings. These cracks, while present, did not penetrate the entire electrolyte layer and did not result in direct gas crossover. The rapid cooling during deposition in both methods contributed to the crack formation, which remains a challenge for long-term performance. The authors found that during both APS and VPS processes, there was preferential evaporation of CeO2, which changed the Ce/Gd ratio in the deposited films. The atomic ratio of Ce to Gd in the VPS-GDC electrolyte shifted to 3.5 from the original 4.5, which could impact the ionic conductivity of the electrolyte. The VPS-cell achieved 175.7 mW·cm2 at 600 °C, while the APS-cell showed a lower MPD of 124.8 mW·cm2 at the same temperature. This difference highlights the superior performance of the VPS process in fabricating dense and efficient GDC electrolytes. The OCV of the VPS-cell was 0.90 V at 600 °C, higher than the APS-cells OCV of 0.86 V, indicating better gas-tightness and overall performance in the VPS-deposited electrolyte [203]. Haydn et al. have been reporting the development of multi-layer thin-film electrolytes for MS-SOFCs using PVD and gas-flow sputtering (GFS). The key focus is on improving electrolyte gas-tightness and performance by employing innovative multi-layer configurations. Single-layer electrolytes often suffer from columnar grain structures that can result in microscopic pathways for gas crossover. Haydn et al. addressed this by employing multi-layer structures (alternating oxide and metallic layers) to interrupt the columnar grain growth, significantly improving gas-tightness. These electrolytes, with two or eight layers, reduced leakage rates to less than 3 × 10−4 Pa·dm3·s−1·cm−2, meeting the required standards for high-performance SOFCs [198]. In another work, Haydn et al. reported for a single-layer electrolyte, the gas leakage rate of 1.57 × 10−2 Pa·dm3·s−1·cm−2, measured at room temperature. However, with the compound electrolyte (alternating Zr/Y and YSZ layers), the leakage rate improved to 2.9 × 10−2 Pa·dm3·s−1·cm−2, demonstrating the benefits of the layered structure in enhancing sealing. Electrochemical testing of the metal-supported cells with compound electrolytes showed impressive results, achieving OCV of 1.096 V, current densities above 2 A·cm−2 at 0.7 V and a power density of over 1400 mW·cm−2 at 850 °C. These high-power densities indicate the potential of the compound electrolyte structure for mobile SOFC applications [204]. Roehrens et al. reported a detailed study on MS-SOFCs thin-film electrolyte designed for lightweight and stationary stacks. The focus is on the performance of MS-SOFCs with thin YSZ electrolytes and the challenges encountered in their operation, particularly under mobile and stationary conditions. The YSZ layer, which is just 4 µm thick, must be dense enough to prevent gas-crossover while maintaining low resistance. The GFS method was used to deposit the YSZ electrolyte, but ensuring defect-free deposition over large areas remains a challenge. Another significant challenge is the CTEs mismatch in the range of the PMS and the ceramic electrolyte. The study uses GDC as a buffer layer to mitigate this issue, but the long-term stability of the buffer layer under varying thermal and chemical conditions poses a challenge, particularly due to cation interdiffusion in the range of the PMS and the ceramic layers. When scaling up from single-cell tests to stack configurations, there is a significant drop in performance. The authors reported a performance loss of 30% to 50% when comparing single-cell operation with stack performance, mainly due to gas transport limitations and contact resistances that arise in the stack configuration. This performance degradation is attributed to the larger cell sizes and differences in gas distribution compared to laboratory-scale single-cell experiments. Degradation of the cells during operation is another critical issue. After 43 h of operation, the study reports a degradation rate in the range of 4.15% and 8.31%, mainly due to interdiffusion in the range of the GDC and the PMS, leading to the formation of Cr/Fe oxide phases. This degradation reduces electrical performance and is a challenge for long-term durability. In single-cell tests, MS-SOFCs with thin YSZ electrolytes achieved power densities of approximately 1.0 W·cm−2 at 800 °C and 1.5 A·cm−2 at 0.8 V, which is comparable to SOFCs. However, in a lightweight two-layer stack, the power density dropped significantly, with a maximum of 300 mA·cm−2 at 0.8 V and 800 °C in the stack configuration. The OCV values were relatively high, with measurements of 1.011 V and 1.015 V for two cells in the stack at 750 °C, indicating good initial gas-tightness. However, internal leakages and degradation over time reduced the overall performance of the cells [205]. Xu et al. reported a review of recent advancements and challenges in the commercialization and industrial production of MS-SOFCs, specifically focusing on the electrolyte layers impact on overall cell performance and durability. Achieving a thin, dense electrolyte is a critical challenge for MS-SOFCs. The authors emphasize the importance of controlling electrolyte thickness, as this impacts ionic conductivity and gas leakage. Electrolyte layers, particularly YSZ and GDC, must be carefully fabricated to ensure gas-tightness, especially in reducing operational costs and improving overall performance. Achieving this balance is difficult, especially for scale-up production. One of the challenges in manufacturing MS-SOFCs is controlling the sintering temperature due to the PMS. The PMS tends to oxidize at high temperatures, and this affects the overall mechanical properties and electrochemical stability of the cell. Researchers have developed strategies to lower the sintering temperature, such as the introduction of additives like Fe2O3, which helps reduce the sintering temperature while ensuring adequate densification of the YSZ electrolyte. The CTE mismatch in the range of the ceramic electrolyte YSZ and the FSS or ASS PMSs poses a significant challenge. This mismatch can cause cracking or delamination during thermal cycling. While FSS alloys are widely used due to their relatively compatible CTE with YSZ, Cr poisoning and interfacial reactions in the range of the electrolyte and PMS remain issues that require attention. Xu et al. highlight the challenge of long-term stability for MS-SOFCs. Issues like Cr diffusion from the PMS into the electrolyte and electrode layers can cause degradation over time, reducing the cell performance. Mitigating this degradation is essential to ensure the longevity of MS-SOFCs under continuous operation. Optimized MS-SOFCs with thin-film YSZ or GDC electrolytes have demonstrated impressive power densities, such as 1.4 W·cm−2 at 850 °C. The use of GFS for electrolyte deposition further improves gas-tightness and power output. The study indicates that cells utilizing YSZ electrolytes have achieved OCV values around 1.01 V, reflecting good gas-tightness and minimal gas crossover. The introduction of additives to improve electrolyte performance is noted, but these also impact long-term stability, requiring careful balancing in the range of initial performance and degradation [32]. Sønderby et al. have reported the deposition of YSZ thin films using high power impulse magnetron sputtering (HiPIMS) and pulsed direct current magnetron sputtering (DCMS) for SOFC applications. The focus is on achieving dense, defect-free YSZ thin films suitable for MS-SOFCs while comparing the effectiveness of HiPIMS and pulsed DCMS techniques. A major challenge in the fabrication of YSZ electrolytes using Msputt. is the formation of columnar structures, which contain voids that lead to internal gas leakage. Films with such defects do not provide sufficient gas-tightness, reducing cell performance. This issue was observed when YSZ films were deposited using both pulsed DCMS and HiPIMS at a floating potential, resulting in a columnar structure regardless of the method used. The application of substrate bias voltage during deposition is crucial for improving film density. HiPIMS, in particular, showed promising results when a bias voltage of −25 V to −50 V was applied, as it disrupted columnar growth and produced dense films with a non-columnar microstructure. However, increasing the bias voltage beyond − 75 V introduced a new issue of film delamination and microcracking, highlighting the need to carefully optimize bias voltage to avoid excessive ion bombardment. While pulsed DCMS generally resulted in columnar films with voids at all bias levels, HiPIMS was able to produce dense, featureless films when the bias was set ranging from −25 V to −50 V. This improvement in film morphology is critical for MS-SOFC applications, as dense films without voids prevent gas crossover and enhance the durability of the electrolyte layer. Although dense, non-columnar films were achieved at specific bias voltages using HiPIMS, higher bias levels (e.g., −75 V) resulted in film delamination. This issue was attributed to the high stress induced by ion bombardment, leading to poor adhesion to the substrate. The stress levels must be controlled to balance density and adhesion, particularly for large-scale production [206,207]. Hagen et al. have been reporting on the robustness of metal-supported cells (MSCs) and anode-supported cells (ASCs) stacks under thermal cycling for mobile applications. The study explores the stacks’ ability to endure rapid temperature changes and thermal gradients, focusing on real-world operational conditions. One of the most critical challenges for MS-SOFCs is their robustness under thermal cycling, particularly in mobile applications where fast start-up and power modulation are needed. The authors subjected MSC and ASC stacks to thermal gradients of up to 30 °C·cm−1. The MSC stacks, with high thermal conductivity and mechanical robustness, performed better under these conditions compared to ASC stacks, which began to show degradation after several cycles. Maintaining gas-tightness during thermal cycling is another challenge. The study reports that the MSC stack maintained an OCV close to theoretical values even after multiple thermal cycles, indicating good gas-tightness. However, small leaks were observed in the ASC stack after several cycles, likely due to degradation in the sealing interfaces. While the MSC stack showed high robustness, there was still a 15% increase in area-specific resistance (ASR) after several thermal cycles, particularly after the first cycle. This increase in ASR was linked to contact issues in the range of the interconnects and the cells, as well as degradation in the electrode materials. The MSC stacks endured temperature differences of up to 300 °C in the range of different parts of the stack, corresponding to gradients of 30 °C·cm−1. These extreme conditions highlight the importance of high thermal conductivity in MSCs, which helps mitigate mechanical stress and prolongs the stacks lifespan. The MSC stack showed an OCV of 3.26 V at 690 °C, slightly lower than the theoretical value of 3.32 V. The slight decrease was attributed to the first thermal cycle, but the gas-tightness remained intact throughout the testing. The power density of the MSC stack remained stable after multiple thermal cycles. The stack was capable of maintaining its power output at 1.0 W·cm−2 under operational conditions, indicating high performance even under severe thermal stress [208]. In summary, YSZ is one of the most widely used electrolytes in MS-SOFCs due to its high ionic conductivity at elevated temperatures above 800 °C and its stability in both oxidizing and reducing environments. However, the ionic conductivity of YSZ significantly decreases at temperatures below 800 °C, which limits its efficiency in intermediate temperature applications requiring the use of very thin films to mitigate performance loss. However, depositions of thinner YSZ films can be challenging, requesting careful control over the deposition process [209,210]. Despite this drawback, YSZ remains the preferred electrolyte for high-temperature SOFCs due to its robust stability [210]. When YSZ is used as a thin film, it can significantly reduce ohmic losses, making it a good candidate for lower operating temperatures around 600 °C [209,211]. YSZ-based SOFCs typically produce power densities in the range of 200–650 mW·cm−2, depending on the operating temperature and deposition technique used. For example, YSZ films deposited by EB-PVD technique can achieve a power density of up to 650 mW·cm−2 at 700 °C [210]. GDC exhibits much higher ionic conductivity than YSZ at intermediate temperatures (500–700 °C). However, GDC is susceptible to reduction under reducing atmospheres, which increases its electronic conductivity and leads to lower OCV and long-term stability [209,211]. This chemical reduction from Ce+4 to Ce+3 introduces challenges in achieving high efficiency and requires DBLs to mitigate these effects. Therefore, it is often coupled with a protective layer of YSZ to prevent excessive electronic conductivity [212]. Moreover, the performance of GDC electrolytes also depends heavily on the deposition technique, with plasma-sprayed GDC sometimes showing porosity [211]. GDC-based MS-SOFCs typically demonstrate power densities ranging from 200 to 500 mW·cm−2. For instance, plasma-sprayed GDC achieved 386 mW·cm−2 at 700 °C, with an OCV of 0.75 V [211]. The reduction of electrolyte layer thickness represents one of the most critical breakthroughs in the development of micro-tubular solid oxide fuel cells (MS-SOFCs) [32]. For optimal performance, the electrolyte must maintain a thickness in the range of 3–5 μm to ensure the gas-tightness of the cell, effectively separating the anode and cathode and preventing cross-leakage of fuel and oxidants. Achieving such thin layers is crucial, as it significantly reduces the ionic resistance across the electrolyte, leading to enhanced power output and overall cell efficiency [213]. This performance enhancement has been extensively demonstrated in the literature, where thinner electrolytes contribute to lower ohmic losses and improved electrochemical performance, particularly at lower operating temperatures, which is a key goal for next-generation SOFCs [214–217]. To achieve these ultra-thin, defect-free electrolyte layers, advanced fabrication techniques have been developed, focusing primarily on vapor deposition methods. Both PVD and CVD have emerged as highly effective approaches [215,217]. PVD techniques, such as sputtering and thermal evaporation, allow for precise control over layer thickness and uniformity, while CVD processes, including ALD and PS offer the advantage of conformal coatings even on complex geometries [215,217]. These methods not only enable the fabrication of thin, dense electrolytes but also contribute to the scalability and reproducibility of MS-SOFC manufacturing [10]. APS is widely used for depositing YSZ layers due to its scalability and flexibility. However, the deposited layers often show some microcracks and porosity, which requires post-treatment or impregnation to ensure gas-tightness [209,211]. Power densities for APS-deposited YSZ typically range in the range of 200–386 mW·cm−2 [209]. When APS is used for GDC, it avoids the need for high-temperature sintering, which helps maintain better interface integrity with metal supports. However, achieving fully dense coatings remains challenging [211]. GDC’s high ionic conductivity makes it a promising material for MS-SOFCs, despite that achieving gas-tight coatings often requires optimized deposition parameters [211]. The microstructure of YSZ and GDC layers deposited by APS are prone to have voids and microcracks. However, these defects can be reduced by optimizing spraying parameters. For instance, GDC layers sprayed at 80 mm show improved density and fewer cracks compared to other configurations [211]. Very Low-Pressure Plasma Spraying (VLPPS) is a newer plasma spraying method that allows the deposition of very thin YSZ layers (<5 μm). This method helps reduce porosity compared to conventional APS, leading to improved gas-tightness [209]. VLPPS can produce thin layers while maintaining high deposition efficiency. VLPPS-deposited YSZ layers have fewer microcracks and voids compared to APS, making it a more promising technique for creating highly dense, thin electrolyte layers [209]. PLD is a PVD technique that allows precise control over the thickness and composition of the electrolyte layers, making it ideal for producing dense, crack-free YSZ films [216]. PLD-deposited YSZ layers are typically much thinner than those produced by APS, which helps reduce ohmic losses and improve overall performance [216]. PLD is also highly effective in manufacturing thin and highly conductive GDC electrolyte layers. This technique is often used to create uniform and dense bilayers, such as ScSZ/SDC to mitigate chemical reduction-related issues in GDC [216]. These bilayers improve both conductivity and stability in MS-SOFCs. Bi-layered electrolytes formed by PLD show excellent gas-tightness, and their uniform microstructure helps improve performance at lower temperatures [216]. EB-PVD is known for producing thin, dense YSZ films that exhibit good adhesion and minimal cracks [210]. This method achieves high power densities due to the dense and uniform nature of the films. EB-PVD has demonstrated power densities of up to 650 mW·cm−2 at 700 °C [210]. EB-PVD YSZ layers are typically free of significant defects, which ensures excellent gas-tightness and long-term stability [210]. Table 2 depicts the architecture of different MS-SOFCs alongside performance data on the presence or absence of defects in the electrolyte and the main conclusions based on different electrolyte depositions by PVD and PS techniques. 4.4 Cathodes for MS-SOFC LSM-based cathodes exhibit lower stability in temperatures in the range of 550–750 °C. The presence of lanthanum (La) in LSM leads to La diffusion toward the YSZ electrolyte interface, resulting in the precipitation of La2Zr2O7 pyrochlore phases that obstruct the transport of ionic charge carriers. In contrast, LSC, LSCF, SSC, and BSCF cathodes demonstrate higher thermodynamic stability, exhibit robustness in reducing atmospheres, good oxygen electroactivity, are MIECs, and present suitable particle size and distribution. These cathodes are typically applied on 8YSZ electrolytes by methods like screen printing or airbrushing, followed by ex situ or in situ drying and sintering [17,153,221–223]. These cathodes allow MS-SOFCs to be sintered at Tsint . = 950 °C in argon or reducing atmospheres, preventing cathode degradation and PMS oxidation. The primary disadvantages include: (i) YSZ CTEs mismatch, leading to crack nucleation and propagation, causing component delamination under cycling; (ii) the high Top . also induces cathode coarsening, and similar anode strategies are employed to mitigate this issue; and (iii) Cr volatilization from ICs, which reacts with O2 moisture stream, resulting in the precipitation of CrO(OH)x in the cathode-IC interface. These precipitates undergo dehydration at the Top ., generating Cr2O3 scales that block the charge carriers [224–226]. To promote efficient oxygen reduction reaction (ORR) and prevent O2− deficiency towards the TPBs for fuel electro-oxidation, composite and MIECs cathodes must possess a high TPBs density and active surface area, respectively. The cathode materials must exhibit the following characteristics: (i) high TPBs density and active surface area with a high concentration of acid sites in the range of 550–750 °C and high PP O 2 operation range, i.e., electrolytic domain; (ii) CTEs matching with DBL and IC materials; (iii) resistance to thermal shock and thermal cycling; (iv) chemical-structural stability to prevent degradation and undesired oxide segregation [227]. The cathode is sintered to achieve the desired phases and morphology, either using in situ techniques during MS-SOFC sealing or ex situ techniques. The main challenge lies in depositing the cathode followed by stabilizing the crystalline structure. Typically, the PMS, anode, and electrolyte are sintered in a reducing atmosphere to prevent oxidation of the PMS stainless steel. Subsequently, the cathode is ex situ sintered at temperatures in the range of 900–1100 °C and 1–3 h in the ambient atmosphere, while the other MS-SOFC components are maintained in a reducing atmosphere. Therefore, in situ sintering at the Top . is the ideal technique to activate the cathodes crystalline structure and its adhesion to the DBL/electrolyte interface. In situ sintering reduces process costs while the anode and PMS remain in a reducing atmosphere, preventing oxidation. Recently, novel cathode materials for MS-SOFCs, including La2NiO4+δ (LNO), Pr2NiO4+δ (PNO), and La2-xPrxNiO4+δ (LPNO) have been synthesized and characterized to ensure stability in reducing atmospheres and high electrocatalytic activity. LPNO cathodes with stoichiometry x < 0.5 exhibited good structural stability, while those with 0.5 < x < 1.0 demonstrated higher power density but lower structural stability. These Ni-based cathodes are oxygen-saturated above 1000 °C and possess the following characteristics: (i) good electrical conductivity; (ii) CTE matching in the range of the electrolyte, DBL, and ICs; (iii) excellent charge exchange coefficients and O2− diffusibility. However, no long-term performance tests have been conducted [228]. LaNi0.60Fe0.40O3-δ (LNF) cathodes have been used due the lower reactivity with Cr from IC compared to LSM and LSCF cathodes [229,230]. As discussed earlier, one strategy to mitigate Cr poisoning involves the deposition of Co, CoOx, Co2Mn0.5Al0.5O4 or CuMn2O4 DBLs on the cathode using ALD preventing undesired chemical reactions at the cathode-IC interface [178]. Composite cathodes, consisting of LSCF and Cgraphite, were applied through plasma spray (PS) over 10 mol% Sm2O3-doped CeO2 (10SDC) DBL. This DBL effectively prevents the occurrence of charge carrier-blocking phases at the electrolyte/cathode interface resulting in area-specific resistance (ASR) values as low as 62 mΩ·cm2 [231]. BSCF-based cathodes, when sintered below 700 °C on 10GDC DBLs in MS-SOFCs supported by 430L FSS, have demonstrated the capability to supply a Ppeak = 740 mW·cm−2 [232]. Shi et al. have reported BSCF as an efficient cathode material when combined with GDC for intermediate-temperature SOFCs [193]. BSCF shows good catalytic activity for the ORR and performs well with GDC due to similar CTEs. Cathodes based on Nb5+ and Ta5+-doped SrCoO3 exhibit low activation polarization, while partially crystalline LSC-based cathodes can provide 200 < Ppeak (mW·cm−2) < 260 at 400 < Top . (°C) < 450 range [233–235]. LNBL researchers have been manufacturing cathodes through catalyst infiltration/impregnation into YSZ scaffold structures [11]. Other researchers have similarly produced symmetric electrodes of SrFe0.75Mo0.25O3-δ (SFMO) through catalyst infiltration/impregnation into YSZ scaffold structures previously deposited on YSZ electrolyte (20 µm of thickness) over FSS 430L support. After the infiltration process, all layers were sintered in an H2 reducing atmosphere. These MS-SOFCs reached 400 mW·cm−2 at 700 °C using H2/H2O [175]. The success of MS-SOFCs also stems from the utilization of high-performance thin cathodes made of LSC and LSCF. These cathodes are deposited on the electrolyte DBL by screen printing, drying, and sintering. This method yields power and current densities in the range of 1000–2000 mW·cm−2 and 1400–2800 mA·cm−2 at 0.7 V and 650 °C using H2 as fuel. The notable performance of these MS-SOFCs can be attributed to the low TPBs cathode polarizability and the minimal tortuosity of Ni/10GDC nanoparticles of the active anode. This anode microstructure contributes to low electrochemical impedance, with the Ni phase promoting electron long-range transport, and both Ni and 10GDC particles aiding the H2 electro-oxidation [10,183,198]. The early discussion depicts various cathode materials used in MS-SOFCs comprising YSZ electrolytes. It is important to address cathode materials that are compatible with GDC as these materials have been used as DBLs highlighting the importance of its properties, such as CTEs match and mechanical and chemical stability. LSCF is an MIEC perovskite cathode material for MS-SOFCs. It is commonly used in conjunction with GDC as a DBL to avoid undesirable reactions with the YSZ electrolyte and improve stability and performance. The combination of LSCF with GDC allows better integration, as GDC acts as a buffer to prevent detrimental interactions with the electrolyte at high temperatures. LSCF is recognized for its lower polarization resistance and high oxygen exchange rates, making it suitable for use in MS-SOFCs [195]. La0.8Sr0.2Co0.4Mn0.6O3-δ (LSCM) is a perovskite-type material which offers a balancing of the properties necessary for interaction with GDC DBLS or electrolytes. Higher Co content can increase the risk of reactions with the GDC or YSZ electrolyte, leading to a mismatch in the CTEs. LSM is not ideal for direct use with GDC due to high sintering temperatures, LSM is often combined with GDC as a composite material to improve the number of reaction sites and enhance oxygen diffusion [195]. Opakhai et al. reported a polarization resistivity of 1.8 Ω·cm2 for LSM-YSZ composite cathodes, whereas LSCF cathodes showed significantly lower resistivity of 0.4 Ω·cm2 at 850 °C in MS-SOFCs containing GDC as DBL. A thin magnetron-sputtered GDC DBL was used to block reactions in the range of the cathode materials and the electrolyte. This DBL enhances the long-term stability of the cell and prevents degradation of the cathode. The use of LSCF with a GDC DBL achieved 650 mW·cm−2 at 800 °C when powered with H2 [195]. Sm0.5Sr0.5CoO3 (SSC) cathode, when combined with GDC, exhibits low polarization resistance and enhanced catalytic activity, especially at lower temperatures. SSC-based cells have achieved excellent electrochemical performance when paired with GDC electrolytes in bilayer configurations. SrFe0.9Nb0.1O3-δ (SFN) material is a promising cathode compatible with GDC. SrFe0.75Mo0.25O3-δ (SFMO) has shown good compatibility with GDC electrolytes in MS-SOFC configurations. SFMO-GDC composites offer favorable electrochemical performance in MS-SOFCs [32,236]. Xu et al. reported the use of LSCF with a GDC electrolyte layer, which achieves 1.25 W·cm−2 at 800 °C when powered by H2. While SSC-GDC systems have demonstrated 3.03 W·cm−2 at 700 °C, illustrating strong performance in high-temperature ranges. The LSCF and SSC cathodes maintained OCV values above 0.9 V, which is crucial for ensuring the efficiency of the MS-SOFC systems. The current density was as high as 2.8 A·cm−2 at 650 °C and 0.7 V [32]. Singh et al. have reported MS-SOFCs using LSCF-GDC systems. These cells achieved power densities as high as 1.2 W·cm−2 at 700 °C and BSCF-GDC systems have shown 0.65 W·cm−2 at 600 °C when powered by H2. These performance figures indicate the effectiveness of GDC as a DBL for these cathode materials in MS-SOFCs. GDC-based cathodes in MS-SOFCs typically achieve OCV values above 0.9 V, ensuring high efficiency and reduced leakage. The LSCF-GDC combinations perform especially well, maintaining a stable OCV throughout the extended operation. MS-SOFCs using LSM-GDC cathodes have demonstrated current densities as high as 0.75 A·cm−2 at 650 °C [237]. Wehrle et al. reported the potential of MS-SOFCs in the mobility sector. It focuses on optimizing cell materials and designs to enhance performance metrics like power density and efficiency. The authors highlight LSCF as a promising cathode material for use with GDC in MS-SOFCs. LSCFs compatibility with GDC stems from its MIEC, which boosts ORR efficiency. When paired with GDC, it forms a composite material with low polarization resistance, leading to enhanced cell performance. LSCF is frequently combined with GDC in MS-SOFC designs to optimize ionic conductivity while maintaining good mechanical and chemical compatibility with other components in the cell. This combination is advantageous for lowering the operating temperature while maintaining high electrochemical activity, especially in mobile applications [238]. Wehrle et al. reported a Ni-fiber GDC anode coupled with an LSCF-GDC cathode, which achieved 3.13 W·cm−2 at 850 °C and 0.7 V, a significant improvement over commercial standard. Additionally, the same authors report stack power densities as high as 1.85 kW·L−1 at operating temperatures below 700 °C. The OCV for the optimized LSCF-CGO cathode system reaches 0.92 V, which is the expected range for a high-efficiency SOFC system [238]. 4.5 PMSs for MS-SOFCs The architecture of the MS-SOFCs comprises multiple layers, as detailed earlier. Each layer plays a crucial role, and it is essential to comprehend individual functions. As the acronym implies, the PMS is the support of the ceramic films. PMSs should exhibit the following characteristics: (i) porosity to facilitate the diffusion of gaseous reactants and products; (ii) mechanical resilience to be used as support; (iii) CTEs match with the other components; (iv) oxidation and degradation resistances under low PP O 2 , as well as in the presence of H2, H2O and O2 atmospheres; and (v) cost-effectiveness [11]. The commonly employed PMS is porous stainless steel typically prepared through powder metallurgy by tape casting. However, this technique lacks control over the metallic suspension rheological properties and process parameters, resulting in the production of irregularly shaped pores with small sintered necks in the range of the PMS particles. These sintered particles are susceptible to oxidation due to the high surface energy. To address this issue, a thin layer of an electronic conductor such as LaCrO3 can be deposited on the surface of the pores by dip coating (DCoat), enhancing the oxidation resistance. Nevertheless, similar to spinel-based DBLs, the deposition process is not uniform requiring optimization [239–242]. 430, 441, and Crofer 22APU FSS alloys with different Cr amounts, exhibit CTEs in the range of 10 × 10−6–12 × 10−6 °C−1, close to the CTEs of 8YSZ and 10GDC ceramics. In addition to these characteristics, PMSs also should have a foam/mesh morphology or can be thin sheets micro-drilled by laser. Several manufacturing techniques are available for PMS conformation, including powder metallurgy by uniaxial pressing with a binder (pelletizing), spray pyrolysis, electrospray, tape casting of metallic suspensions, and even 3D printing [243]. The characterization of the PMSs includes: (i) mass gain (mg·cm−2) and (ii) ASR measurement by the 4-point probe in direct current (mΩ·cm2), both by exposure to high oxidation temperatures; (iii) mechanical strength evaluation under creep; (iv) CTEs assessment; (iv) thermodynamic stability in long-term at the Top . and (v) data survey of Cr diffusion and evaporation. For ASR analysis, samples undergo oxidation in air at the Top . to promote Cr2O3 scale growth. FSS Crofer 22APU (ThyssenKrupp) and ITM (Plansee SE) PMSs alloys exhibit ASRs of 5 and 2.5 mΩ·cm2. Following, the LSM DBL deposition on FSS ITM alloy can reduce the ASR down to 1.0 mΩ·cm2 [240]. PMSs with 40% of porosity have been oxidized in an atmosphere containing 50 vol% H2 in H2O at 800 °C. The growth of oxide thickness was examined using scanning electron microscope (SEM) image processing and software analysis. Fig. 11 illustrates the evolution of polished PMS cross-sections over time. SEM image analysis revealed a substantial increase in the oxide layer after 2,500 h [244]. Reisert et al. provided insights into the oxidation behavior of P434L FSS alloys employed as PMSs in MS-SOFCs under anodic and cathodic atmospheres in the range of 600–800 °C. Notably, significant oxidation initiates at 600 °C in both moisture air and H2, characterized by a high oxidation rate and pore filling by reaction products. The study includes oxidation data recorded for samples post-sintering and those subjected to pre-oxidation. Pre-oxidation is a method for establishing a passivating Cr2O3 film, which proved effective in mitigating the oxidation rate over long-term [245]. In the case of pre-oxidized samples, the oxidation rate in air surpassed that in atmospheres with moisture H2 above 700 °C. To address oxidation challenges, coatings of Pr7O11, LSCF-SDC, and Ni-SDC oxides were applied to the P434L alloy. The oxidation behavior in the absence and presence of carbon under anodic atmospheres remained comparable for the pristine P434L alloy, regardless of the type of coating. Additionally, the introduction of CH4, CO2, and CO to humidified H2, simulating biogas and reformed bioethanol, did not exert a severe impact on oxidation behavior. Furthermore, the evaporation of Cr in air, especially in the presence of H2O vapor, undergoes a significant reduction with Pr7O11 coating, attributed to the precipitation of a passivating layer of PrCrO3 [245]. Reisert et al. also observed the formation of a dense and protective chromia (Cr2O3) scale on the P434L alloy under all investigated oxidation conditions. Another oxide layer rich in silica (SiO2) was also identified at the interface in the range of the alloy and the chromia scale. For the pre-oxidized alloy, the oxidation rate in humidified H2 at 700 °C was comparable to the oxidation rate for the non-pre-oxidized alloy at 600 °C. However, at higher temperatures the oxidation rate significantly increased in air. In contrast, the alloy with a Ni-SDC coating exhibited a moderate reduction in the oxidation rate in humidified H2. Coatings of LSCF-SDC and Pr7O11 did not significantly impact the oxide scale generated in air, but a substantial mass increase was observed and correlated with the chemical reaction in the range of CrO(OH)x and the coating film [245]. Few research has focused on the integration of PMSs with catalysts for direct hydrocarbon and biofuel reforming. Zhou et al. reported the co-lamination of 430L FSS (300 μm of thickness) and YSZ electrolyte (30 μm of thickness) scaffolds by tape casting. 10 vol%Ni catalyst was infiltrated in the PMS scaffolds, while 30 vol%LSFC cathode (45 μm of thickness) was infiltrated in the YSZ scaffold previously deposited on the YSZ electrolyte. MS-SOFCs with an active area of 0.35 cm2 powered by 3 vol% H2O in H2 provided 420–910 mW·cm−2 in the range of 700–900 °C [174]. Li et al. reported MS-SOFCs with Ni0.9Fe0.1 PMS impregnated with 0–4 wt% NiTiO3, aiming to assess electrochemical performance and CH4 steam reforming. NiTiO3 underwent a reduction in H2 at 650 °C ex-solving Ni nanoparticles on the TiO2 surface. Compositions with 3 wt% NiTiO3 showed higher electrocatalytic activity for CH4 steam reforming, resistance to coking, and good electrochemical performance. Under a flow of 97 vol% CH4 and 3 vol% H2O at a rate of 100 mL·min−1, the cell with 3 wt% NiTiO3 exhibited 1200 mW·cm−2 in a limiting current density of 2830 mA·cm−2 at 650 °C. These cells maintained an almost constant operating potential of 0.70 V at 400 mA·cm−2 during 96 h of long-term testing without coking. The presence of Ni nanoparticles on the TiO2 surface in the PMS reduced the polarization resistance due to catalytic steam pre-reforming of CH4 besides enhancing the gas diffusion in both PMS and the functional anode [246]. The Ni0.9Fe0.1 PMSs (1 mm of thickness) were fabricated by tape casting. A ceramic suspension was prepared by ball milling NiO and Fe2O3 powders in a molar ratio of 9:1 with fish oil as deflocculant, corn starch as pore former, PVB as a binder, and butyl benzyl phthalate and polyalkylene glycol as plasticizers in a xylene/ethanol mixture for 24 h. This suspension was tape casted and used to manufacture PMS samples with 25 mm of diameter. The functional NiO/10GDC anode (10 and the GDC electrolyte (each one with 10 μm of thickness)) were deposited on these samples by screen printing, followed by co-sintering at 1450 °C for 5 h in ambient atmosphere. After that, La0.80Sr0.20MnO3-δ-Ba0.50Sr0.50Co0.80Fe0.20O3-δ cathode (LSM-BSCF, 10 μm of thickness) was screen printed on the electrolyte and sintered at 1050 °C for 2 h in ambient atmosphere [246]. An aqueous solution containing Ti and Ni in the stoichiometric concentration of NiTiO3 phase was prepared using tetrabutyl titanate (C16H36O4Ti), HNO3, and Ni(NO3)2-6H2O. CA and EDTA chelating agents were added with a molar ratio of cations:CA:EDTA of 1:1:1.5. Ammonia solution was used to maintain the pH of the precursor solution neutral. This solution was infiltrated into the pores of the PMS NiO/Fe2O3 scaffold and calcined at 1000 °C for 2 h in ambient atmosphere to precipitate the NiTiO3 nanoparticles [246]. The OCV for all MS-SOFCs was 0.78 V, attributed to the current leakage of electronic carriers across the GDC electrolyte bulk. During long-term tests up to 96 h, the degradation rate of MS-SOFCs at 400 mA·cm−2 and 0.70 V was remarkably low, measuring only 0.50 mV·h−1. According to Li et al., the incorporation of TiO2 enhances the catalytic activity of CH4 reforming by increasing the H2O absorption for carbon oxidation by reducing coking. This effect is attributed to the presence of V O ∙ ∙ and interstitial Ti defects on the surface of the TiO2 nanoparticles in a reducing atmosphere [246]. 4.6 DBLs for MS-SOFCs Despite the remarkable architecture, effective materials processing, advanced deposition techniques, in situ sintering to mitigate PMS oxidation and prevent cathode degradation, signs of PMS and Ni anode oxidation persist beyond cathode degradation near the DBL interfaces despite of the high MS-SOFCs performance. The diffusion, evaporation, and precipitation of Fe and Cr from the PMS on the Ni particles in the anode lead to the formation of insulating oxides such as NiCr2O4 and Fe2O3. Cr2O3 scale formation is commonly observed on FSS and ASS particles. This phenomenon is intensified near the PMS sinter necks in the range of tiny particles. Ni from the anode also diffuses, evaporates, and precipitates on the surface of FSS PMS particles, triggering an FSS → ASS phase transition [247]. Despite the better oxidation resistance of ASS, the CTEASS = 17.3 × 10−6 °C−1 is higher than CTEFSS = 11.2 × 10−6 °C−1. This phase transition results in interface delamination and mechanical failure since the CTENi/8YSZ = 12 × 10−6 °C−1 and CTE8YSZ = 14 × 10−6 °C−1 in the range of 300–900 °C are different from the ASS PMS CTE [150]. These issues contribute to the long-term drop in MS-SOFCs performance, due to failures in the deposition of the DBL on PMS. One strategy to address this issue involves the deposition of Co-Mn or Cu-Mn on the PMS by PVD to form Co2Mn0.50Al0.50O4 and CuMn2O4 spinel DBLs which are electronic conductors. Subsequently, LSM or LSC contact layer is applied to prevent the inter-diffusion of Co and Mn to the Ni anode. However, this DBL technology is relatively recent and requires further optimization [248,249]. DBLs deposited from precursor salts of ethylene glycol, HNO3, La3+, Y3+, and Ce4+ by DCoat of sol–gel on FSS are typically prepared by drying and calcination at 400 °C and 650 °C to form Ce1-x(LayY1-y)xO2-δ oxides. These DBLs exhibit favorable electronic conductivity and excellent diffusion barrier properties [250]. Sønderby et al. reported the use of magnetron-sputtered GDC as a DBL in MS-SOFCs. The GDC is designed to prevent the diffusion of strontium (Sr) from the cathode into the electrolyte, which degrades cell performance by forming insulating SrZrO3 phases. A significant challenge is the migration of Sr from the cathode to the electrolyte, particularly during operation at intermediate temperatures. GDC layers deposited by Msputt. can effectively block Sr diffusion, but this depends on deposition parameters like temperature, substrate bias, and film thickness. Poorly controlled deposition leads to under dense column boundaries, which act as diffusion pathways for Sr. The density of the GDC DBL is critical for preventing Sr diffusion. The study shows that by tuning substrate bias voltage and deposition temperature, denser GDC films can be produced. Films deposited at lower bias voltages (e.g., floating potential) had an open, columnar structure that allowed Sr diffusion, whereas films grown under −50 V or −110 V bias were significantly denser and more effective as DBLs. Thermal expansion mismatch in the range of the GDC and the PMS is another concern. The GDC layers are deposited below 400 °C to prevent oxidation of the PMS. However, heat treatments (like cathode sintering) can release compressive stress in the GDC layers, leading to grain coarsening and potential performance degradation. The study highlights that cell with denser GDC DBLs achieved lower ASR values, indicating better overall performance. For example, a GDC film deposited at −50 V bias voltage yielded an ASR of 0.34 Ω·cm2 at 650 °C, while a less dense film deposited at floating potential had a higher ASR of 0.43 Ω·cm2. The cells tested showed excellent gas-tightness, with OCV values of 1.12 V at 650 °C, which is close to the theoretical OCV of 1.11 V. This indicates that the GDC barriers effectively prevented gas leakage in the tested cells [207]. 4.7 ICs and sealants for MS-SOFCs FSS and ASS alloys are used in MS-SOFCs as dense ICs enhancing the welding of the PMS plus the SOFC ceramic films to the IC [251]. ICs play a crucial role in MS-SOFCs as they facilitate electrical current collection, channeling the gases across the electrodes, and enable the assemble of MS-SOFCs in stacks through micro-welding by laser to ensure tightness while increasing power and electrical voltages. The most used IC material is based on Fe16Cr FSS. However, a drawback of this alloy is the evaporation of Cr and its deposition on the electrodes, leading to the formation of insulating oxide phases, which hinder electron transport. To mitigate this effect, Mn-Co spinels and LSM perovskite oxides are deposited over the ICs by PVD or APS to inhibit Cr volatilization. These spinels exhibit σ total of 60 S·cm−1 at 800 °C and CTEs of ∼9.7 × 10−6 °C−1, closely matching the CTEs of FSS alloys, 8YSZ, and 10GDC [240,252]. Companies like Sandvik Materials Technology manufacture large-scale stainless-steel alloys coated with Co-Ce alloy with 800 nm of thickness to be used as ICs in MS-SOFCs. Recently, some researchers have replicated this large-scale process by depositing a dense layer of Co with 600 nm of thickness on the surface of the cathode FSS ICs. During MS-SOFC stack operation, the Co undergoes oxidation to form Co3O4 on the surface of the cathode FSS ICs [253]. This oxide reacts with the Mn from cathode FSS ICs, creating a (CoxMny)3O4 thin spinel layer, which prevents Cr evaporation and diffusion up to 3000 h of long-term testing at 850 °C [254]. Despite the CTE mismatch with ceramic films, NiCrAlY and Hastelloy ICs exhibit high oxidation resistance [11]. However, these alloys are skyrocket expensive. For example, the powder costs for FSS 410 (USD 113.00/kg) and ASS 316 (USD 268.00/kg) are more economical than Hastelloy (USD 774.69/kg), NiCrAlY (USD 6,750.00/kg) alloys, and Ni 99.5% (USD 6,734.28/kg) powders. In comparison, the ceramic powders 8YSZ and 10GDC have costs of USD 147.10/kg and USD 1,810.00/kg, respectively. It is noteworthy that ongoing factors such as the pandemic, the conflict in Ukraine, and new contracts with BEV companies like TESLA contribute to constant instabilities in these product values. In conjunction with the laser micro-welding of ICs and MS-SOFCs stack assembly, mica-type phyllosilicates (SiO2-Al2O3-K2O-Na2O-Fe2O3) and Al2O3-SiO2 felts or glass sealants are employed. These sealants, originally utilized in HT-SOFCs and IT-SOFCs, undergo a significant reduction in application due to the scaled-up ICs laser sealing process of MS-SOFCs manufacturing. They are strategically placed in proximity to the gas inlet and outlet areas to ensure tightness [253]. 4.8 Key thoughts on MS-SOFCs powered by hydrocarbons and biofuels The stability and efficient performance of MS-SOFCs in long-term operation can be attributed to the DBLs, which mitigate the degradation of the cell under Top . < 750 °C compared to HT-SOFCs and IT-SOFCs. These DBLs contribute to maintaining the MS-SOFCs performance at lower operating temperatures while still enabling direct biofuels reforming. Lower operating temperatures also enable the application of lower-cost materials such as PMSs, ICs, and current collectors based on FSS alloys besides the cost-effective sealing of these materials by micro-welding laser. However, despite the cost-effectiveness and favorable properties of the FSS alloys, even below the austenitic transition (Ttrans . ≅ 1200 °C) and melting (Tmelt. ≅ 1450 °C) temperatures, diffusion of Fe and Cr into the anode still occurs poisoning it [255]. DBLs can be deposited using various PVD techniques such as ALD, APS, PLD, MSputt., radio-frequency sputtering (RFSputt.), or EB-PVD [55]. These layers must be dense and uniform in thickness without cracks, pores, pinholes and should exhibit excellent CTE match with the cell components [251,256]. 10GDC (CTE10GDC ≅ 12 × 10−6 °C−1) and 10SDC DBLs can be deposited over the PMS and the electrolyte [231,256–259]. Cr2O3 and Cr2MnO4 have been used as DBLs over PMSs based on Ni-Al alloys [259,260]. Co, CoOx, or CuMn2O4 DBLs are deposited over the dense ICs of the cathodes [231,261]. The degradation mechanisms of MS-SOFCs powered by H2 and CH4 have been recently investigated. However, there is a notable gap in studies regarding MS-SOFCs powered by C2H5OH. Additionally, potential new degradation mechanisms, including coking, remain unexplored [17]. Liu et al. developed catalyst nanocomposites to be used as a pre-catalytic layer for CH4 in MS-SOFCs. The main objective of the study was to demonstrate the feasibility of using MS-SOFCs operating with CH4 to generate power within a vehicle as depicted in Fig. 12 (a). Fig. 12(b) depicts the developed MS-SOFC with the pre-catalytic layer. The MS-SOFC achieved 350 mW·cm−2 at 600 °C when operating with CH4 as shown in Fig. 12(c). The catalysts were characterized by HAADF and EDS, which showed uniformity of the chemical elements as depicted in Fig. 12(d). Fig. 12(e) compares the power density of the MS-SOFCs powered by CH4 against the pristine versions. The results indicate a significant improvement in power density for the optimized cells, highlighting the effectiveness of the pre-catalyst layer in enhancing the internal SMR activity. Fig. 12(f) illustrates the long-term durability results showing stability and performance up to 1000 h of operation. In contrast, the pristine cells exhibit rapid performance decline, underscoring the importance of the catalyst layer in enhancing durability and coking resistance. Fig. 12(g) illustrates the CH4 conversion rates as a function of applied current density with other MS-SOFC. The MS-SOFCs powered by CH4 demonstrate significantly higher conversion rates compared to the pristine cells, indicating that the catalyst layer effectively promotes CH4 reforming. Fig. 12(h) shows the CO2/CO ratio in the anode outlet gas stream, which is an important indicator of the reforming process. A higher CO2/CO ratio suggests the reforming reaction is proceeding efficiently, producing more CO2 relative to CO, which is desirable for reducing coking and enhancing overall efficiency. Long-term test stability results, confirming the MS-SOFCs powered by CH4 maintain performance over extended operation up to 1000 h as depicted in Fig. 12(i). The degradation rate is minimal, indicating the pre-catalyst layer not only enhances performance but also contributes to the lifespan by preventing coking and other degradation mechanisms [262]. The main challenge associated with the use of C2H5OH and CH4 in MS-SOFCs is optimizing the interaction in the range of PMS and the anode in the presence of these low-molar-mass biofuels [263]. These biofuels induce coking on the Ni surface, reducing the MS-SOFCs performance and lifespan. The deposition of an amorphous carbon on the Ni surface stimulates the Ni oxidation into Ni2+. These cations promote the nucleation of graphite. Over time, these nuclei grow into lamellar channels and the Ni2+ diffuses through these channels, interacting with other Ni2+ to form Ni nanoparticles. These nanoparticles catalyze the growth of carbon nanotubes, decreasing the surface area of active sites available for biofuel thermal cracking into H2 and CO. The consequences include Ni sputtering, anode degradation, and a subsequent sink in MS-SOFC performance over time [264–266]. To understand the coking mechanism in SOFCs powered by biofuels, it is imperative to comprehend the elementary steps of biofuels reforming, such as ESR and SMR, into H2 and CO at the catalyst surface. Welander et al. reported the internal reforming of NG, propane, ammonia, and dimethyl ether at 700 °C by MS-SOFCs with symmetric architecture using an innovative high-entropy alloy (HEA) catalyst. The architecture of the cells includes thin ceramic electrolytes, scaffold layers, and cost-effective FSS PMSs on both sides. Praseodymium oxide and Ni/SDC catalysts were infiltrated into the cathode and anode, respectively. The initial performance and durability achieve performance and degradation rates comparable to H2 (500 mW·cm−2 and ∼12% per 100 h). Sulfur testing revealed reversible degradation at concentrations typical of NG and irreversible degradation at higher sulfur levels, as found in commercial propane. Overall, the MS-SOFCs demonstrated effective fuel flexibility [267]. The evaluation of the performance, long-term durability, and thermal cycling tolerance of MS-SOFCs running on NG reformate fuels was reported. Symmetric MS-SOFCs, comprising composite SDC-Ni anode catalysts and PrOx cathode catalysts were tested using simulated NG steam-reformate and partial-oxidation-reformate fuels containing 1 ppm and 5 ppm of sulfur. The cells were operated for 1000 h, displaying initial degradation rates comparable to those observed with humidified H2, with performance differences largely due to the lower H2 content in the reformate fuels. Furthermore, the cells exhibited resilience to multiple aggressive thermal cycles, even in the presence of sulfur, with minimal performance loss. Post-mortem analysis revealed that Ni particle coarsening and Cr deposition were primary factors in degradation, while no evidence of coking or sulfur deposition was detected. Overall, MS-SOFCs demonstrated successful operation with reformed NG [268]. Li et al. have reported Ce0.9Ni0.1O2-δ (CNO) comprising Ni nanoparticles and Ni-doped CeO2, referred to as Ni@CNO, with Ni particles uniformly dispersed on the CNO substrate. This material depicts a high V O ∙ ∙ concentration and excellent H2O absorption properties, leading to moderate catalytic activity and strong resistance to coking during SMR. When Ni@CNO is infiltrated into a Ni0.9Fe0.1 (NF) PMS, it enhances the MS-SOFC performance by increasing the H2/CH4 ratio (3.38 at 600 °C) in the reforming gas, improving coking resistance, and extending the operational durability. Using the Ni@CNO-infiltrated NF PMS (NFNC) with Ni/Ce0.9Gd0.1O2-δ (Ni-GDC) functional anode, GDC electrolyte, and La0.6Sr0.4Co0.2Fe0.8O3-δ/Ce0.9Gd0.1O2-δ (LSCF-GDC) cathode, the MS-SOFC powered by wet CH4 (3 vol% H2O) achieved a peak power density of 343 mW·cm−2. The cell voltage remained above 0.6 V at 400 mW·cm−2 over 280 h of testing at 600 °C, with no significant coking observed in the PMS or the functional anode [269]. Hu et al. have reported high-performance MS-SOFCs with internal reforming catalysts based on HEA materials. The MS-SOFCs were demonstrated for transportation applications using ethanol and methanol as fuels. The addition of the HEA catalysts significantly enhanced both cell performance and stability when powered by an ethanol–water fuel blend. The absence of coking, predicted by thermodynamic models, was verified through Raman spectroscopy of post-mortem anodes. Optimal conditions for catalyst processing, such as deposition methods, loading, and sintering temperature, as well as operating parameters including flow rates, temperature, and fuel compositions, were investigated. The infiltrated HEA catalyst formed a highly porous structure with a low loading of 6 mg·cm−2, contributing to minimal mass transport resistance in both the fuel electrode (26.2 s·m−1) and oxygen electrode (41.6 s·m−1). The best results were achieved with a 60:40 ethanol-to-water fuel mixture, delivering a power density of 830 mW·cm−2 at 700 °C, without any coking. The ethanol-fueled MS-SOFC demonstrated stable operation for 500 h, including five thermal cycles. The cell degradation followed trends similar to those observed with H2 fuel, with Ni coarsening and chromia deposition as the main degradation mechanisms, while coking was effectively avoided even after extended operation [270]. Dewa et al. reported MS-SOFCs incorporating infiltrated NiMo/CeO2-ZrO2 internal reforming catalysts. The cells were operated under direct ethanol at 700 °C, with a steam-to-carbon (S/C) ratio of 2. The addition of a catalyst functional layer was essential to reform ethanol into syngas internally while preventing rapid deactivation of the MS-SOFC due to coking. Experimental results demonstrated that the cell with the NiMo/CeO2-ZrO2 catalyst achieved a higher maximum current density of 355 mW·cm−2 compared to 52 mA·cm−2 for the cell lacking the catalyst at 0.4 V. Additionally, the stability of cells at constant current was markedly improved. The NiMo/CeO2-ZrO2 infiltrated cell operated for 90 h, exhibiting lower levels of coking compared to the cell without the catalyst. The incorporation of the NiMo/CeO2-ZrO2 reforming catalyst into the MS-SOFC system presents a promising approach to extending operational lifetime and enhancing coke resistance during ESR in MS-SOFC applications [271]. In other study, Dewa reported the use of Rh/CeO2-ZrO2 (Rh/CZ) as an internal reforming catalyst layer in a high-performance MS-SOFC. The catalyst is applied by infiltrating Rh, CeO2, and ZrO2 precursors into the FSS 430 PMS. The cell was powered using 45 vol% C2H5OH in H2O at 600 °C. Button cell with the infiltrated 5 wt% Rh/CZ catalyst significantly outperforms the cell lacking the catalyst, enhancing ethanol’s internal reforming activity for syngas production. The maximum current density increased from 300 to 400 mA·cm−2, and long-term stability was also greatly enhanced. Post-mortem analysis reveals that the catalyst layer effectively prevents severe coking on the anode functional layer. The integration of the reforming catalyst layer with the MS-SOFC shows great promise for advancing bioethanol-powered MS-SOFC technology for future electric vehicle applications [184]. The electrochemical oxidative coupling of CH4 using the Sr2Fe1.5Mo0.5O6-δ (SFM) catalyst was demonstrated with MSCs. SFM anode and Pr6O11 cathode catalysts are incorporated into a porous symmetric-architecture cell through infiltration and sintering. Citric acid/ethylene glycol was identified as the most effective chelating agent, and optimal sintering and reduction temperatures (850 °C/750 °C) were determined for the SFM catalyst precursor solution based on cell testing. The CH4 conversion rate and product selectivity were significantly influenced by operating temperature, cell voltage, and oxygen concentration at the cathode, as these factors regulate oxygen ion flow. At 800 °C, a CH4 conversion rate of 85.8% was achieved, with resulting concentrations of C2H4, C2H6, and H2 at 10.5%, 12.3%, and 25.6%, respectively, in the exhaust gas. The system demonstrated stable current density and methane conversion over 200 h of operation enabling the synthesis of valuable chemicals using MS-SOCs [138]. The enhanced MS-SOFC is compared with literature reports that demonstrate high maximum power density for various anode catalysts, as shown in Fig. 13 . The MS-SOFC performance is nearly double that of the best conventional SOFCs. This improved performance reflects advancements in cathode, electrolyte, anode, and overall cell architecture. Table 3 depicts the potential of MS-SOFCs powered by C2H5OH and CH4 in long-term tests ranging from 100 to 1000 h. The published articles focus solely on the scientific demonstration of individually optimized cells, with no studies found showcasing the performance of stacks under high-power conditions with commercial relevance. 5 External ESR and SMR: A brief overview Hydrocarbons or biofuels can be converted into syngas by steam reforming. This syngas is used as fuel in MS-SOFCs. Otherwise, hydrocarbons and biofuels such as bioethanol and biomethane can be reformed directly at the anode of MS-SOFCs since the anode materials are similar to those used in external ESR and SMR. However, there is a challenge: the anode catalyst materials in MS-SOFCs for H2 cleavage need further improvement to efficiently convert higher molar mass biofuels and hydrocarbon fuels like propane, butane, and iso-octane in syngas. These fuels are converted into syngas inside a reformer reactor containing Ni, Ru, or Rh supported on Al2O3, La2O3, CeO2, ZnO, MgO, or aluminosilicates. The catalytic conversion occurs in the range of 250–950 °C relying on the catalyst/support system interaction. Salts and nitrates of metal precursors are infiltrated and impregnated inside sponges or monolithic ceramics with organized micro-channels by wet chemistry or sol–gel DCoat followed by calcination to consolidate the catalytic active metal phase. Metals such as Co, Cu, tin (Sn), Pt, Pd, Mn, niobium (Nb), or gold (Au) can be alloyed with Ni, Ru, or Rh to efficiently convert these fuels with high H2 selectivity and low coking [152,278]. Tables 4 and 5 illustrate the main external ESR and SMR systems. Systems incorporating Ni, Mn-Co-Si, Pt, Ru, and Rh on Al2O3, MgO, La2O3, CeO2, and aluminosilicates exhibit the highest conversion and H2 selectivity. However, the key drawbacks of onboard external reformers in FCHEVs powertrain systems include heat management, size, weight, cost, reuse difficulty, and recyclability challenges. Therefore, scaling up internal ESR and SMR directly at the MS-SOFCs anode emerges as a viable alternative. However, it still faces challenges due to the lack of optimized materials for hydrocarbon and biofuel reforming [17,61,279]. The optimal materials used in reformers are improper for use as MS-SOFCs anode catalysts due to the following reasons: (i) Rh, Pt, and Pd are excellent catalysts for CC and HH cleavage but are skyrocket expensive; (ii) Si and SiO2 are contaminants of 8YSZ and 10GDC polycrystalline ionic conductors creating during the thermal-treatment an amorphous SiO2 thin film in the grain boundaries which blocks the charge carriers increasing polarization losses; (iii) the concentration of V O ∙ ∙ in pure Al2O3, MgO, and CeO2 ceramic supports is insufficient for O2− transport by the crystalline lattice. Therefore, these oxides need to be doped with aliovalent metal to be used as MS-SOFCs anodes. Furthermore, the kinetic modeling of reformers should incorporate intrinsic thermodynamic information about the chemical elementary reactions as a function of the reformer properties to derive the ESR and SMR conversion rates r ̇ ESR and r ̇ MSR . This information is crucial for a more comprehensive understanding of the ESR and SMR. The kinetic behavior of ESR has been investigated in several reformers, such as the Ni/Al2O3-based state-of-the-art in the range of 200–900 °C. The description of r ̇ ESR involves equations based on experimental data fitting, using either power law rate (PLR) [250,279–288], or Eley-Rideal (ER) mechanistic assumptions [284,289–297]. Similar to ESR, the kinetic behavior of SMR has also been studied for various reformers in the same ESR temperature range, also employing equations from experimental data fitting [135–137,161]. Kinetics data can be modeled using the PLR without considering the elementary reaction mechanisms of the ESR. These data are fitted using the Eq. (4) below. (4) - r ̇ ESR = k 0 . ( e E act . RT ) . P C 2 H 5 O H α . P H 2 O β where k 0 represents the collision frequency in (kgcat·s)−1, E act . denotates the activation energy in kJ·kmol−1, R is the universal gas constant in kJ·kmol−1·K−1, T represents the absolute temperature in Kelvin (K), P is the partial pressure of the gas, and α and β are the chemical reaction orders. The parameters k 0 , E at . , α and β vary based on factors such as particle size and size distribution, crystal structure, morphology, catalysts and support microstructures, gas diffusion channels architecture and operating conditions including catalyst temperature (Tcat. ), reactants mass fluxes, PP O 2 , and the catalytic activity of catalysts [151,280,283–285,298–300]. However, certain details extracted from the chemical elementary reactions are overlooked when using PLR. In contrast, the ER kinetic model incorporates mechanistic assumptions involving elementary reactions that occur in ERS. Broadly, during ESR, besides the C2H5OH decomposition to produce CH4, CO, and H2 the following elementary reactions also take place: (i) dehydrogenation of C2H5OH to produce H2, resulting in the generation of acetaldehyde (CH3CHO); (ii) decomposition of CH3CHO to produce more CH4 and CO; (iii) dehydration of C2H5OH, giving rise to H2O and ethylene (C2H4), which may polymerize and degrade into carbon on the catalyst active surface also generating H2 [151,280,283–285,298–300]. The ESR kinetic modeling by the ER mechanism involves the following elementary reactions: (i) adsorption of C2H5OH on the active site of the active catalyst; (ii) dissociation on the adjacent active site, leading to the formation of oxygenated and hydrogenated hydrocarbons; and (iii) these hydrocarbons react with non-adsorbed H2O molecules to produce H2 and CO2 [151,280,283–285,298–300]. The dissociation of C2H5OH is the slowest elementary reaction. Consequently, it is the rate-determining step (RDS) in the overall process. However, this elementary reaction effectiveness depends on the active catalyst surface site concentration for C2H5OH adsorption [284,300]. Only the global reactions of ESR and SMR for catalyst supported on O2− anion conductors’ electrolytes will be considered, which aligns with the anode reality of MS-SOFCs [46,269,301,302]. The ESR occurs according to Eqs. (5) and (6), and the SMR according to Eqs. (7) and (8), both to produce H2. (5) C 2 H 5 O H ( g ) + H 2 O ( g ) → 2 C O ( g ) + 4 H 2 ( g ) Δ H 298 K 0 = 256 k J · mol - 1 (6) C 2 H 5 O H ( g ) + 3 H 2 O ( g ) → 2 CO 2 ( g ) + 6 H 2 ( g ) Δ H 298 K 0 = 174 k J · mol - 1 (7) CH 4 ( g ) + H 2 O ( g ) → CO ( g ) + 6 H 2 ( g ) Δ H 298 K 0 = 206 k J · mol - 1 (8) CH 4 ( g ) + 2 H 2 O ( g ) → CO 2 ( g ) + 4 H 2 ( g ) Δ H 298 K 0 = 165 k J · mol - 1 The C2H5OH and CH4 can also react with O2 by partial oxidation of ethanol (POE) and partial oxidation of methane (POM) in the auto-thermal reforming (ATR) to produce CO, H2O, H2 and heat according to Eqs. (9) and (10) for POM and POE. (9) C 2 H 5 O H ( g ) + 1 2 O 2 ( g ) → 2 C O ( g ) + 3 H 2 ( g ) Δ H 298 K 0 = - 14 k J · mol - 1 (10) CH 4 ( g ) + 1 2 O 2 ( g ) → CO ( g ) + 2 H 2 ( g ) Δ H 298 K 0 = - 36 k J · mol - 1 At low molar ratios of Oxygen/Ethanol (O/E) or Oxygen/Methane (O/M), CO production can occur in MS-SOFCs at low current densities. However, this reaction is not thermodynamically preferred at Tcat. ≅ 600 °C. Finally, H2 and CO are converted by the O2− anions at the MS-SOFCs anode according to Eqs. (11) and (12) below. (11) H 2 ( g ) + O ( T P B ) 2 - → H 2 O ( g ) + 2 e - Δ H 298 K 0 = - 241 k J · mol - 1 (12) CO ( g ) + O ( T P B ) 2 - → CO 2 ( g ) + 2 e - Δ H 298 K 0 = - 283 k J · mol - 1 Coking can occur by the decomposition of C2H5OH or CH4, or by CO disproportionation reaction (Boudouard reaction) also generating CO2, leading to the formation of carbon on the catalyst surface of the MS-SOFC anode according to the Eq. (15). This process also produces H2, as described by Eqs. (13) and (14) for C2H5OH and CH4. (13) C 2 H 5 O H ( g ) → CH 4 ( g ) + CO ( g ) + H 2 ( g ) Δ H 298 K 0 = 49 k J · mol - 1 (14) CH 4 ( g ) → C + 2 H 2 ( g ) Δ H 298 K 0 = 75 k J · mol - 1 (15) 2 CO ( g ) → C ( s ) + CO 2 ( g ) Δ H 298 K 0 = - 171 k J · mol - 1 However, reactions in the range of CO and H2O can enhance the production of H2 and CO2 by the WGS reaction reducing coking on the reformer catalyst and the MS-SOFC anode, as indicated by Eq. (16) below. (16) CO ( g ) + H 2 O ( g ) → CO 2 ( g ) + H 2 ( g ) Δ H 298 K 0 = - 41 k J · mol - 1 The C2H5OH and CH4 hydration is crucial to ensure free-coking on the active catalysts of reformers and MS-SOFC anodes. Additionally, it contributes to cost reduction since hydrated ethanol has a lower energy input compared to 100 vol% ethanol due to a basic distillation process in biorefineries. This not only makes the fuel less intensive in industrial processing but also contributes to a further reduction in GGE. Moreover, hydration enhances the surface ionic conductivity due to the Grotthuss mechanism [358–360]. Endothermic reactions are favored by increasing temperature, while exothermic reactions are favored by decreasing temperature. Therefore, the C2H5OH reformers have two stages: (i) an ESR by Ni/Al2O3 or Ni/CeO2 state-of-art catalysts at 600 °C; (ii) POE and WGS by FexOy catalysts producing more H2 at 300 °C [361]. For 0<(S/E) < 10 and 0 < O/E < 3 M ratios, no coking occurs in the range of 200–1000 °C due to the Gibbs free energy minimization in the range of the ESR, POE, and ATR. For the ESR, POE, and ATR the main features are: (i) in ESR and POE, the C2H5OH decomposes in the range of 200–1000 °C; (ii) for Tcat. < 400 °C, CH4 and CO2 generating occurs; (iii) for Tcat . > 400 °C the CH4 concentration decreases and H2 and CO increase; (iv) in ESR for S/E > 4 in the range of 550–650 °C the H2 productivity can be as high as 4 mols of H2 per mol of C2H5OH with CO < 0.1 mol without coking; (v) in POE, high H2 and CO formation can occur in the range of 0.8 < O/E < 1.5 and Tcat . > 600 °C without coking; (vi) the ATR is used at any S/E to reduce the ESR energy demand and (vii) for O/E up to 0.75 and Tcat. < 600 °C no H2 and CO productivity reduction and coking occurs [361]. Due to these characteristics, ESR and SMR emerge as viable solutions for the internal reforming of C2H5OH and CH4 directly at MS-SOFC anodes. It is noteworthy that the bioethanol available in Brazilian gas stations may contain up to 7 vol% of H2O. This concentration corresponds to an S/E of 0.24. This powertrain system proves economically attractive as it allows C2H5OH dilution down to 24.6 vol%, i.e., 75.4 vol% of H2O (S/E: 10) without experiencing coking, thanks to the WGS reaction. Moreover, the S/E can be increased by recirculating the steam-rich exhaust gas from the SOFC, which carries the additional benefit of energy integration in the range of the exothermic SOFC and the endothermic reformer. However, MS-SOFC performance diminishes when the H2O concentration exceeds 55 vol% H2O due to the fuels reduced electrocatalytic activity [17,61]. Ma et al. conducted thermodynamic simulation studies on a powertrain system incorporating ESR and a stack of MS-SOFCs powered by H2 reformed from C2H5OH at 600 °C, providing a current density of 300 mA·cm−2. In this investigation, the MS-SOFC stack achieved a maximum efficiency of η = 0.50. This low efficient value is attributed to the presence of ohmic, activation, and mass transport overpotentials, leading to energy losses. These characteristics stem from the inherent material parameters of MS-SOFCs employed in this simulation [362]. To understand these mechanisms of energy loss, it is imperative to quantify each of them. Electrochemical models can be explored to validate experimental observations of the energy conversion phenomenology. However, this matter will not be discussed in this review. 6 Re-engineering PMSs for direct and efficient reforming of biofuels As early discussed, new degradation mechanisms may emerge when MS-SOFCs are directly powered by hydrocarbon fuels and biofuels. To address this issue, the PMS and anode redesign becomes essential. Over the last two decades, the PMS architecture and manufacturing techniques have only been well-established for MS-SOFCs powered by H2. Typical manufacturing techniques for PMSs by powder metallurgy involve processes such as powder pressing, tape casting, and spraying of metallic suspensions. These techniques produce PMSs with randomly dispersed pores and high tortuosity channels. The drawback of using powder metallurgy is the difficulty to control: (i) the particle and pores size and size distribution; (ii) the lateral gas diffusion; (iii) the sinter neck sizes of the PMS particles, which are highly susceptible to oxidation. The main challenge of powder metallurgy is developing PMSs with open and interconnected porosity. The morphology, connectivity, and size of the pores depend on the incorporation of suitable pore formers and sacrificial templates. This procedure, combined with a well-designed sintering program, contributes to achieving a suitable microstructure with highly efficient gas channels. Nielsen et al. reported a ∼40% increase in the Ppeak of MS-SOFCs powered by H2 using PMSs with straightforward, open, and interconnected pore channels. The enhancement was ascribed to the efficient gas diffusion across highly dense pores with low tortuosity [363]. Ceres Power uses a laser to drill straight channels (25 μm of diameter) in PMSs of 500 μm of thickness. However, the laser drilling process is expensive and complex impairing the scale-up manufacturing. The process involves the use of fast laser pulses to melt and drill small perpendicular channels in thin FSS alloy sheets [364,365]. The control of the sinter neck morphology and size of the metal particles can effectively mitigate PMS degradation due to oxidation and coking. These vulnerable regions exhibit high surface energy, leading to elevated chemical reactivity. Additive manufacturing has emerged as a promising technique for manufacturing porous structures. This technique employs 3D printing by laser sintering to create micro-organized porous structures with interconnected channels in the range of 100–400 μm of thickness using a laser or electron beam [185,366–369]. Bineli et al. explored the reforming of bioethanol to produce syngas using micro-reformers (MRs) with micro-organized channels obtained by AM [369]. MRs could integrate into the ICs of MS-SOFCs for catalytic pre-reforming of hydrocarbon fuels and biofuels into syngas before reaching the TPBs of the active anode. Fig. 14 illustrates the proof-of-concept of this novel device integrating MRs and MS-SOFCs. MRs with organized micro-channels in the range of 100 < Thickness (μm) < 400 exhibits a reduced pressure drop and shorter gas residence time. This is assigned to the higher surface area provided by nanocatalysts impregnated on the surface of the organized micro-channels [369]. These attributes the following advantages: (i) enhanced conversion of hydrocarbons and biofuels with H2 selectivity; (ii) rapid start-up and light-off promoted by thermal integration in the range of the PMSs and ICs; (iii) good thermal shock resistance; (iv) improved control over the gas mass transport; (v) increased oxidation resistance of the PMS due to the preferential thermal cracking of the hydrocarbons and biofuels on the nanocatalysts of the MR which does not show small sinter necks; (vi) enhanced robustness and safety; (vii) long lifespan; (viii) and (ix) the prevention of coking on the MS-SOFCs anode [369]. This concept is currently in the experimental phase, limited to 3D metal printing, and further engineering studies are required before making any assertions about the economic viability of this integration. Fig. 15 provides a schematic of the MS-SOFC cross-sectional view depicting the MR, PMS, DBLs, electrolyte, and electrodes. Fig. 16 depicts the integration of PMSs and MRs in terms of oxidation resistance and lifespan. The figure compares the organized, robust, and sinter neck-free micro-channels obtained through AM with those produced by other powder metallurgy methods with less dimensional control. This approach aims to prevent the long-term performance decline of the MS-SOFC stack due to the PMS oxidation and coking at the MS-SOFC anode. The use of external reformers for hydrocarbon and biofuels in syngas to power SOFC stacks has been extensively documented. The advent and evolution of MS-SOFCs have stimulated technological interest. Therefore, MS-SOFCs can be used in FCHEVs enabling the use of hydrocarbon and biofuels [14,17,61,184,362]. Ni is the most used catalyst in MS-SOFC anodes, typically in Ni/YSZ or Ni/GDC composite anodes, which suffer from coarsening. This degradation occurs through Ni-Ni interdiffusion, a thermally activated mass transfer process. Over time, this results in the formation of larger, isolated Ni particles, reducing catalytic efficiency. This process reduces the TPB length, crucial for electrochemical reactions and long-distance transport of charge carriers. Methods to manufacture nanostructured anodes such as infiltrated Ni nanoparticles have shown promise in mitigating coarsening, though these approaches still face challenges from nanoparticle aggregation at high temperatures [55]. In a conventional process described by Tucker et al., NiO was co-sintered with YSZ and the PMS support under a reducing atmosphere (4% H2/96% Ar) at 1300 °C for 4 h. This process resulted in an increase in particle size from 3 µm to 10 µm as NiO was reduced to Ni. The coarsening, driven by Ni-Ni interdiffusion, is characterized by mass transfer from regions of high chemical potential to low chemical potential [370]. This directional diffusion causes the formation of isolated Ni particles and a reduction in TPB length, as demonstrated by Angelis et al. using ex situ ptychographic nanotomography. Rapid diffusion during annealing at 850 °C led to isolated Ni particles within 3 h [371]. One strategy to address the Ni coarsening is the use of Ni nanostructuring. Infiltrated anodes, where Ni nanoparticles are embedded into the porous backbone of YSZ or GDC, prevent coarsening at high temperatures. Ovtar et al. infiltrated 10GDC nanoparticles into Ni/YSZ electrodes and tested the cell at 800 °C in SOEC mode. Even after 1000 h of operation, no isolated Ni particles were observed. The strong adhesion of 10GDC nanoparticles on the Ni surface, along with heterogeneous mass diffusion in nanocomposites, helps to prevent surface diffusion [372]. Despite the advantages of infiltrated electrodes, nanoparticle coarsening, and aggregation still occur, driven by the high diffusive activity of the nanoparticles at elevated temperatures. Tucker et al. observed that infiltrated nano-Ni particles coarsened during operation at 700 °C, leading to rapid degradation of MSCs. To address this, thermochemical treatments were applied to stabilize the microstructure by pre-coarsening the nanoparticles at a higher annealing temperature (800 °C). While this approach provided stability, it came at the cost of performance loss [373]. Blennow et al. found that combining nano-sized GDC with 10 wt% of nano-Ni to form a conductive cermet anode helped stabilize Ni particles. This configuration provided sufficient catalytic activity while reducing the risk of Ni agglomeration. Subsequent research confirmed that MS-SOFCs with this anode achieved 500 mW·cm−2 at 650 °C with a degradation rate of 4.5% over 1000 h [187]. More recent studies by Dogdibegovic et al. demonstrated that the infiltrated 40 wt% Ni samaria-doped ceria anode showed almost no coarsening after 100 h of annealing at 700 °C in 3 vol% humidified H2 [178]. In addition to infiltrated electrodes, the in situ ex-solution method has gained attention for producing nanostructured electrodes. For example, Tan et al. used thermally driven in situ ex-solution to uniformly distribute Ni nanocatalysts on GDC surfaces. This method increased TPB density while avoiding nanoparticle agglomeration, achieving 1 W·cm−2 at 650 °C in humidified H2. However, the isolated Ni particles led to increased ohmic resistance, and an annealing process at 1250 °C was necessary to recover the GDC phase, limiting its application in MSCs [188]. H2 is considered an ideal fuel for SOFCs since it produces only water vapor, with no harmful by-products that would negatively impact cell performance or lifespan. While H2 is advantageous, biofuels like bioethanol and biomethane are more compatible with existing infrastructure, offering cost-effective solutions. However, these fuels lead to coking, as already discussed which reduces performance and shortens the cell’s lifespan [55]. The accumulation of graphite and other carbon-based materials on the Ni surface results from a catalytic graphitization process. Ni cations migrate to the outer surface of the graphite, forming small Ni particles. These particles then catalyze the formation of filamentous carbon, such as carbon fibers and nanotubes. This carbon buildup clogs pores and reduces the availability of catalytic sites, leading to further degradation of the cell [55]. Fig. 17 depicts this degradation phenomenology. One approach to address this issue is to incorporate Cu into the Ni-containing cermet anode or even replace Ni with Cu altogether, as Cu lacks the catalytic activity needed to break C–H and C–C bonds. However, while this reduces coking, it also lowers the power density of the cell, achieving only around 370 mW·cm−2 at 700 °C. In 2020, Li et al. designed an MSC featuring a Ni-Mn spinel anode (Ni-MnO-Mn/Fe-doped GDC) that operated stably at 650 °C in humidified H2 for 100 h without coking delivering 869 mW·cm−2. The high resistance to coking was attributed to fine MnO particles adsorbed on the Ni surface, while the increased catalytic activity of the GDC contributed to the cell’s improved performance [374]. In addition to coking, sulfur poisoning also occurs in the anode when carbon-based fuels such as biogas or biomethane-derivated from biogas are used. Sulfur, often present in methane from NG or CO sources, adsorbs onto the Ni surface, leading to decreased catalytic efficiency and TPBs blocking [55]. The reaction for sulfur poisoning is (17) H 2 S ( g a s ) + Ni ( s o l i d ) → Ni - S ( s u r f a c e ) + H 2 ( g a s ) This adsorption separates the Ni from the fuel gas and reduces the active sites available for electrochemical reactions. Regeneration or desulfurization processes can reverse some of the damage caused by sulfur poisoning. For instance, Zha et al. found that when 50 ppm of H2S was introduced into the fuel, there was a 20.6% decrease in current density. However, after removing the H2S from the fuel, performance gradually recovered due to sulfur desorption from the Ni surface, facilitated by reactions with H2 from the fuel and O2− from the electrolyte [376]. Proton ceramics have shown high resistance to both coking and sulfur poisoning due to their ability to conduct protons and oxide ions efficiently. For example, Duan et al. found that using an yttrium-doped barium zirconate anode (Ni-BZY) improved carbon cleaning by facilitating water adsorption and decomposition. This process removes carbon from the Ni surface by converting it to CO2 or hydrocarbons. Proton ceramics have also demonstrated better conductivity at lower temperatures compared to O2− conductors. Cells using a Ni-BZCYYb anode, BZCYYb electrolyte, and BZCY-LSCF cathode achieved excellent power densities as high as 1.1 W·cm−2, even in fuel containing 20 ppm of H2S at 750 °C. For more in-depth information on the degradation mechanisms of SOFCs and MS-SOFCs, you may kindly refer to the following references [32,49,377,378]. The MS-SOFCs performance and lifespan must be improved to enable the cells operation in the range of 500–600 °C. This improvement is crucial for external or internal reforming of hydrocarbon fuels and biofuels with 80,000 h of lifespan. It is imperative to adopt scalable manufacturing techniques to reduce FCHEV costs and market competitiveness. The next chapter will explore new materials and manufacturing techniques to mitigate the degradation mechanisms of MS-SOFCs directly powered by hydrocarbons and biofuels. 7 MS-SOFC advanced materials and manufacturing techniques In recent years, several researchers have reported new materials and manufacturing techniques for MS-SOFCs based on the: (i) deposition of a thin catalyst film on the MS-SOFC anode by spin and spray coating or ALD and PLD to create a pre-reforming catalytic layer, (ii) infiltration of catalyst in the electrodes and PMS scaffolds, (iii) pre-homogenization of electrode and catalyst materials, followed by impregnation in the electrodes and PMS scaffolds [172]. Table S4 of the SI provides guidance for developing MS-SOFCs directly powered by hydrocarbons and biofuels. The previous reform of hydrocarbons and biofuels into syngas by a pre-reforming catalytic layer before reaching the anode TPBs boosts the overall efficiency, ensuring higher cell performance without coking. However, the recent techniques present the following drawbacks: (i) lower adhesion of the catalyst thin film deposited on the anode by spin or spray coating causing delamination; (ii) increase in the total volume and impedance of the SOFC stack [13]. These emerging techniques target the enhancement of the anode performance. However, the ORR exhibits a sluggish rate compared to the HOR due to the difficulty of the 4e− pathway to fully oxidize the O2 molecule in a single step. Consequently, the ORR stands as the main limiting factor in SOFC performance powered by H2. The low TPBs density or active sites in LSM-based cathodes constrain the ORR. Advanced techniques like ALD enable the deposition of nanostructured cathodes with high surface area and TPBs density (or active sites). ALD is less common for anode fabrication due to the high charge transfer kinetics of the HOR. Several research groups have successfully employed ALD to deposit a pre-reforming catalytic layer on the SOFCs anode [379]. Given the skyrocketing costs associated with scaling up ALD for film manufacturing, some researchers have opted for more economical techniques. These techniques involve the infiltration of catalyst precursors by wet chemical or sol–gel routes followed by impregnation of desired crystalline phases into electrodes and PMS scaffold. This process is accomplished by successive calcinations, avoiding the deposition of a pre-reforming catalytic layer on the MS-SOFC anode. The impregnation techniques offer: (i) higher electrocatalytic activity and power density; (ii) good physicochemical stability; (iii) reduction and suppression of coking without increasing the final volume of the MS-SOFC stack. Moreover, the catalyst precursors infiltration and impregnation of active catalysts in the PMS and electrode scaffolds should possess the following characteristics: (i) the catalyst precursor solution or sol–gel must exhibit favorable rheological properties, including viscosity, rheopexy, and wettability, enabling penetration into the pores of the PMS or electrodes; (ii) the catalysts impregnated after heat treatment should feature a high surface area with nanoparticles in the range of 1–10 nm of average particle size (A-PSize). This A-PSize is achievable with good dispersion [380–382]. However, at elevated temperatures, the nanoparticles of impregnated catalysts undergo coarsening, leading to a reduction in active surface area and TPBs density (or active sites), catalytic activity, and resistance to coking [383,384]. To enhance resistance against catalyst coarsening, co-doping the electrolyte of Ni/YSZ-based anodes with Al2O3, TiO2, and CeO2 proves effective, as these oxides function as sintering/coarsening inhibitors. However, it is noteworthy that Al2O3 and TiO2 oxides contribute to a decrease in the electrical conductivity of the electrode [385]. The pre-homogenization of these materials can be conducted before the infiltration step into the PMS and electrode scaffolds to improve the infiltration. This process aims to enhance the infiltration, dispersion, and impregnation of active catalyst nanoparticles while reducing the coarsening of both nanoparticles and the electrode scaffolds [13]. High and medium entropy alloys show a stabilization effect against coarsening compared to supported nanoparticle Ni. Fig. 18 depicts a schematic of the impregnation of catalysts in the MS-SOFC electrode scaffolds. An approach for optimizing MS-SOFCs anodes for direct ESR and SMR involves the use of catalyst-support reformer systems used in the reforming of high molar mass hydrocarbons. For example, biomass gasification yields medium and low molar mass products, including syngas and by-products such as tar. These systems exhibit notable resistance to coarsening, sulfur poisoning, and coking. Table S5 of the SI outlines some of these systems and highlights key conclusions that can guide future testing as MS-SOFCs anodes. To enable the internal reforming of biofuels directly inside MS-SOFCs anodes, it is imperative to optimize the materials or the anode architecture to improve the power density, coarsening, and coking resistance besides the stability of the pre-reforming catalytic layer [386]. To present good electrocatalytic activity, the SOFC or MS-SOFC anode architecture should embody the following key features: (i) high concentration and mobility of V O ∙ ∙ without undesirable crystal structures; (ii) high density of TPBs; (iii) high surface adsorption of hydrocarbon and biofuels molecules on basic active sites to promote the production of hydrogenated and oxygenated hydrocarbons; (iv) good exchange kinetics for O2− release, and storage redox processes; and (v) strong interaction in the range of the catalysts active metal and the O2− ceramic conductor phase to prevent coarsening and coking [386]. Perovskite-structured MIECs exhibit elevated concentrations and surface mobility of the V O ∙ ∙ . Co-doping these perovskites with alkali metals reduces the chemical bonding energy in the range of these metals and oxygen ions enhancing the V O ∙ ∙ surface concentration and bulk mobility. However, alkali metals like potassium (K), sodium (Na), Li, and magnesium (Mg) possess low Tmelt . and high vapor pressures. These elements may evaporate and diffuse at the MS-SOFC during the thermal treatment and operation promoting the formation of insulating glassy phases that hinder electronic and ionic charge carriers transport [386]. Metals such as potassium (K), ruthenium (Ru), tungsten (W), tin (Sn), and boron (B) serve to mitigate Ni poisoning by sulfur (S) from H2S when SOFCs and MS-SOFCs anodes are powered with sour fuel such as biomethane, NG or diesel. This protective mechanism changes the electronic configuration of Ni in the conduction band, thereby safeguarding it against the formation of undesirable alloys with low active site density. The presence of V O ∙ ∙ not only facilitates the gasification of coke from the anode surface but also accelerates the removal of S and H2S through gasification by SO2 and H2O, respectively. Additionally, ions like Mn and cerium (Ce) exhibit low oxygen binding energy, demonstrating good redox capabilities and proficiency in oxygen release/storage cycling [386]. Enhancing the SOFCs and MS-SOFCs anodes coarsening resistance involves the following mechanisms: (i) confining the nanocatalysts on the ceramic phase; (ii) robust interaction in the range of nanocatalysts and ceramic phase; (iii) employing bi-metallic alloys with synergistic properties [386]. In recent developments, SOFCs and MS-SOFCs anodes featuring micro and mesoporous core–shell structures with ordered architecture and high surface areas demonstrate significant reductions in the nanocatalysts coarsening. These structures prove effective due to steric hindrance, which impedes the coarsening of nanocatalysts either when embedded on the surface of the core–shell (on the shell) or inside (in the core). In this context, new materials can drive the optimization and adaptation of SOFC and MS-SOFC anodes for power generation using hydrocarbon and biofuels. However, the introduction of new materials gives rise to additional degradation mechanisms. In the next section, we will explore the iceberg tip of the recycling and LCA and public policies concerned about this introduction of the MS-SOFC in a novel hybrid powertrain system designed for onboard electricity generation in FCHEVs powered by hydrocarbons and biofuels. 8 MS-SOFCs recycling Nowadays, there is a lack of research on the recycling and reuse of materials in MS-SOFC cells and stacks. However, there are few studies on HT-SOFCs and IT-SOFCs EoL when those devices are powered by H2, CH4 and other hydrocarbon fuels for decentralized stationary power generation. Unfortunately, there is an absence of studies addressing the EoL considerations specific to MS-SOFCs powered by biofuels such as C2H5OH and CH4 for the mobility sector, as this is still an emerging area. Nonetheless, since C2H5OH and CH4 can be considered biofuel and hydrocarbon, it is possible to draw comparisons with existing EoL literature on SOFCs powered by these fuels. The main material employed in MS-SOFCs anodes is Ni and/or NiO. Both Ni and NiO fall under carcinogenic classifications, specifically category 3 and 1. Consequently, there is a pressing need to either gradually substitute these materials or restrict their usage to minimal quantities. Recycling technologies for Ni and NiO are already established in the electrochemical sector, and several metallurgical companies have successfully incorporated recycled Ni and NiO alongside pure counterparts. Ni can undergo recycling from MS-SOFCs stacks EoL using conventional methods based on physical separation, involving processes such as size reduction and magnetic separation. However, when Ni is in combination with other materials inside the MS-SOFCs anode, more intricate separation procedures, such as hydrometallurgical processes used in battery recycling, become necessary. In the hydrometallurgical recycling process, Ni dissolves from the MS-SOFCs anode by chemical etching with acids or bases. Subsequent separation occurs by precipitation, solvent extraction, distillation, ion exchange, and filtration. This hydrometallurgical approach exhibits high recycling metal selectivity and reutilization of reactants. Nevertheless, the process requires a prior mechanical milling step to increase the material surface area exposing them to reactants. This process involves high electricity consumption and the generation of corrosive and toxic wastewater [387]. NiO holds the potential for recycling and subsequent utilization in the automotive and petrochemical industries [388,389]. The recycling process for NiO entails reactions with sulfuric acid (H2SO4), resulting in the formation of Ni sulfate (NiSO4) with an efficiency of 99%. This NiSO4 can be reused in galvanoplasty processes. Several methods employed by recycling industries for Ni and NiO recycling include chemical leaching or microbiological processes followed by solvent extraction, ion exchange columns or pyrolysis, and electrochemical refining [390]. On the other hand, the YSZ ceramic used as an electrolyte and often together with electrode composite materials is not a health hazard. This material can be recycled by hydrometallurgical or hydrothermal processes. The hydrothermal process has widely been used for recycling ceramics in dental prosthesis such as tetragonal zirconia 3Y-TZP (Z0.94Y0.06O1.97). This process involves the use of water at 250 °C to disintegrate the 3Y-TZP. The powder is filtered and dried at 50 °C, milled, granulated, and graded below 100 μm to be reused [391]. However, due to the high-purity requirements of YSZ raw materials for SOFCs and MS-SOFCs high electrochemical performance, its reuse for the same application becomes impractical. This recycled material may find utility in the electrochemical industries as a low-purity and lower-grade alternative rather than being reintroduced into SOFCs. Another viable option involves recycling this ceramic by milling and mechanical separation for repurposing in the construction sector, such as a filler in the manufacturing of highly mechanical resistant bricks or incorporation into cement compositions [56,390]. Concerning the cathode materials, LSM is commonly used in SOFCs, while LSCF and LSC are used in MS-SOFCs. These materials, such as YSZ ceramic, are amenable to recycling and reuse. MS-SOFCs stacks contain stainless steel ICs and Al2O3-based glass sealants. These materials can be recycled by mechanical milling processes and magnetic separation. They can be reused in the metallurgical or construction industry. The recycling and reuse process complexity escalates when additional materials are incorporated into the manufacturing of SOFCs and MS-SOFCs cells and stacks. MS-SOFCs are currently being commercialized by several companies across Europe, North America, and Asia. The urgency to produce solutions for the EoL of MS-SOFCs stacks is evident due to the: (i) recent imposition of responsibility on the mobility sector for recovery and recycling; (ii) potential conflict with EoL legislations in several countries if low-cost recycling technologies are unavailable; (iii) despite the high efficiency and reduced GGEs during MS-SOFC operation, environmental impacts of the cradle-to-the-grave cycle life must be considered to accurately assess the technology overall benefits [56,390]. One extreme approach to recycling the most resilient components involves grinding and segregating materials based on size and density, followed by managing the dense fractions abundant in Fe, Ni, and Cr towards the raw material feedstock for the steel industry. Conversely, the less dense fractions rich in ceramic materials such as Zr, Y, and Ce can find purpose in the cement industry. By reimagining recycling processes, not only the waste management challenges could be addressed, but also unlock avenues for resource optimization and circular economy practices, marking a significant stride towards a greener and more sustainable future. In addition to the recycling of FC stacks, another significant challenge lies in the disposal of FCHEVs battery packs. The second life and recycling of batteries are critical considerations for transport electrification. Inherent to the chemistry of these devices during operation or even in non-operation, batteries undergo continuous wear. After numerous charging and discharging cycles, the batteries experience a reduction in nominal capacity, rendering them impractical for use in BEVs. The typical lifespan of a battery pack is in the range of 5–8 years, and beyond this period, recharging no longer achieves 80% of the nominal capacity [381]. However, these battery packs can still find utility in “second life” applications, extending the lifespan to 7–10 years. This second life primarily involves energy storage from the grid, transforming them into large unity power storage (UPS) systems that release energy to the grid during peak times or in intermittent power generation periods. Through this utilization, the battery lifespan can be extended up to 15 years. Subsequently, recycling or disposal of these batteries becomes necessary [392,393]. A notable drawback of batteries lies in the substantial quantity of metals, including Li, Cu, Co, Ni, Mn, P, Fe, and Al, necessary for production. The extraction of these metals through mining contributes significantly to environmental impacts (EIs), such as GGEs released into the atmosphere. Recycling presents a viable solution to mitigate these impacts by minimizing the need for additional ore mining. Battery recycling has the potential to reduce GGEs by up to 30% [394–396]. However, the recycling process is complex due to the batteries being encased in robust containers that are challenging to open and separate [397]. Several other issues persist regarding the current scale of second-life batteries and MS-SOFCs recycling. Nonetheless, it is acknowledged that this aspect is highly imperative for BEVs and FCHEVs to constitute a sustainable solution amid the ongoing global energy transition. 9 MS-SOFCs LCA: From the cradle-to-the-grave The current literature exhibits a gap on the life-cycle inventory (LCI) and EoL aspects of MS-SOFC technology, imposing barriers to in-depth LCAs. The LCA methodology enables the quantification of EIs by assessing harmful emissions or other chemicals throughout the entire life-cycle of a product, service, or technology. Several reviews on LCA for SOFCs are available, but the focus is mostly on examining the environmental impacts of FCEVs compared to BEVs and ICEVs. However, a reliable LCA specific to FCHEVs equipped with MS-SOFCs remains missing, as this technology is still under development [15,56]. Furthermore, there is a lack of comprehensive studies specific to the Brazilian scenario, mainly due to unique characteristics such as: (i) the availability of biogenic feedstocks for H2 production by steam reform; (ii) limited data on renewable energy share in the energy matrix, (iii) the introduction of a new powertrain system based on MS-SOFCs powered by syngas reformed from bioethanol and biomethane from sugar cane and biogas. Currently, only one available study quantifies the EIs of FCEVs considering H2 production under existing Brazilian conditions and estimates for a future scenario. It compares these impacts to FCHEVs equipped with MS-SOFC stacks [15]. The majority of LCA studies comparing ICEVs, plug-in hybrid electrical vehicles (PHEVs), non-plug-in HEVs, and FCEVs concludes that the FCEVs are non-competitive across all assessed impact categories (ImC). In terms of global super-warming potential (GSWP), FCEVs exhibit performance as poorly as conventional fossil-fueled ICEVs. Nowadays, all FCEVs are equipped with PEMFCs stacks and a compact battery pack. This choice is driven by the ability to achieve rapid start-up at a lower 60–85 °C range and fast dynamic response to power fluctuations provided by the battery pack [398]. However, the drawback is the requirement of pure H2, mostly from electrolysis, and the need for high-pressure tanks, which considerably lowers the round-trip efficiency from the main power source. Currently, SOFC stacks find applications in commercial settings as auxiliary power units (APUs) or range extenders providing electrical efficiency and fuel flexibility, facilitating integration with existing infrastructure in numerous hydrocarbon and biofuel-producing countries [15,399]. LCA outcomes for several light-duty transport vehicles exhibit significant variability. These variations stem from factors such as study geolocation, temporal considerations, diversity in the supply chain, power matrix, ore extraction routes, ore scarcity, transportation, and rejects toxicity and carcinogenicity [15,400]. Although FCHEVs equipped with MS-SOFCs are still in development, an estimated assessment with FCEVs can be conducted. For this purpose, the LCA methodology can utilize software such as ReCiPe® and SimaPro® to evaluate and compare the studied technologies. The results typically consider five ImCs: (i) GSWP; (ii) Human-Terrestrial Ecotoxicity (HTE); (iii) Human-Toxicity Carcinogenic (HTC); (iv) Mineral Resource Scarcity (MRS); and (v) Water Consumption (WC). Boundary conditions can be established, including the manufacturing of FCHEVs and FCEVs based on: (i) raw biogenic H2 resource and H2 production from water electrolysis (WElisys) for FCEVs; (ii) bioethanol and biomethane production for H2 and CO onboard reforming; and (iii) the use of these gases as fuels in FCHEVs powertrain system, considering the entire life-cycle of these vehicles [15]. Usually, the mineral extraction and production of steel, Al, and Cu to be used in vehicle manufacturing, as well as the production and logistics infrastructures for H2, bioethanol, and biomethane, should be considered in the LCI of these technologies. PEMFCs used in FCEVs consist of several membranes based on perfluorosulfonic acid and tetrafluoroethylene (Nafion®) copolymerization. Besides the acid being a risk for HTE and MRS, porous carbon electrodes decorated with Pt catalysts are highly sensitive to deactivation by CO, requiring an additional reactor to remove traces of this gas (<10 ppm) from H2 reformed from hydrocarbons or biofuels. Moreover, the carbon fiber of the high-pressure H2 gas storage vessels in FCEVs is not only skyrocket expensive but also designed to store only 5.6 kg of gas H2 at 700–900 bar [15,401]. Unlike PEMFCs, MS-SOFCs operate at higher temperatures in the range of 550–750 °C, with one of the main advantages being the utilization of Ni and CeO2-based catalysts instead of noble metals. The world’s first and only FCHEV prototype equipped with MS-SOFCs is Nissan’s e-Bio Fuel Cell. However, due to the scarcity of data surveys on SOFCs for vehicle applications, many LCAs utilize data extracted from SOFCs operating in decentralized stationary power generation. Other crucial data for these vehicle LCAs include the: (i) curb weight (kg); (ii) battery chemistry; (iii) power (kW) and the battery pack capacity (kWh); (iv) fuel consumption (km·L−1); (v) vehicle lifespan (km); (vi) catalysts used in the FCHEVs external reformer and inside of the FC electrodes of the FCHEVs and FCEVs; and (vii) the origin of materials and components used in these vehicles. Other important data are the weight of the: (i) FC stack; (ii) balance of plant (BoP); (iii) powertrain system; (iv) battery; (v) glider; (vi) FCEV H2 gas storage vessels and FCHEV fuel tank [15]. Unfortunately, comprehensive EoL information remains unavailable for most materials used in FC stacks. While hydrometallurgical routes exist for the treatment of Ni and YSZ, there is a lack of information concerning the treatment of LSM, LSC, and LSCF-based materials used in the MS-SOFCs cathodes [15]. Nowadays, global H2 demand stands at ∼70 Mton·year−1. The main sources for H2 production include NG reforming (76%) and coal gasification (23%), resulting in a substantial emission of 830 Mton CO2·year−1 [15,402]. In the Brazilian context, low GGEs routes for H2 production are imperative to establish it as a viable energy vector. Nowadays, Brazil’s landscape comprises five routes: (i) two ESR routes utilizing sugarcane and corn feedstocks; (ii) two SMR routes involving biomethane capture from landfills (BioMe) and SMR from NG; and (iii) an additional route through WElisys. By 2030, the production of syngas from biomass could be harnessed for combustion and electricity generation. This electricity could assist the conversion of lignocellulosic materials into second-generation ethanol (2G Ethanol) by enzymatic hydrolysis and fermentation of the resultant syngas [15]. The WElisys for H2 production consumes a substantial amount of energy, and its EI is highly contingent on the electricity supply type. Notably, in 2020, Brazil’s share of renewable energies was approximately 48%, contrasting with the global figure of around 14%. This peculiarity is important for a country’s energy sustainability and its transition toward a lower carbon economy, especially when considering WElisys with low EIs [50]. However, aside from generation, establishing a dedicated infrastructure for H2 storage and logistics for FCEVs is essential. Safety standards also play a critical role, with the SAE J2601 protocol stipulating that H2 gas storage vessel temperatures should not exceed 85 °C, even during rapid refueling. In the LCA of these vehicles, it is crucial to consider if the H2 production occurs in a central hub, such as a refinery for biomethane or NG reforming, a distillery for bioethanol reforming, or a WElisys plant. It is well-established that H2 production based on small reforming stations requires less CAPEX and entails higher sales rates and lower costs than centralized productions. However, the emergence of large-scale H2 production geographical centers to ensure a scale economy is a possibility in the near future [15,403]. Additionally, it should be assumed that the vehicles can be at least partially manufactured in Brazil, enabling the adaptation of LCIs for the glider components and the powertrain system, consisting of either PEMFCs or SOFCs cells stacks to Brazilian manufacturing conditions. Fig. 19 depicts the data corresponding to each ImC for FCEVs and FCHEVs. Due to the mass, both the glider and powertrain FCEVs and FCHEVs significantly contribute to each ImC, given the substantial use of materials such as steel, Al, and other alloys. The battery weight of 24 kWh of the Nissan’s e-Bio Fuel Cell has a notable impact on each ImC. The adjustment of design parameters, particularly the shift from power to energy density in FCHEVs equipped with MS-SOFCs stacks, results in a subsequent reduction in the weight of the battery pack and also leads to a decrease in the ImCs of these vehicles [15]. While FC stacks have a relatively low impact on EIs, it is essential to carefully analyze the data due to the scarcity and outdated nature of manufacturing processes and material specifications. FCs stacks and BoPs components exhibit a minimal contribution compared to other ImCs [15]. Concerning the fuel type in LCA of these vehicles, H2 production from biomass with carbon capture and storage can potentially yield negative carbon emissions, particularly when predominantly using ESR from sugarcane, corn feedstocks, or SMR from biomethane refined from biogas lagoon or landfills. However, the impact on HTE is significant due to the agricultural stage of these feedstocks [15]. Regarding WC, the WElisys exhibits a significant impact due to its extensive hydroelectricity consumption. In the current Brazilian scenario, the common practice for biomethane upgrade involves biogas purification using pressure swing adsorption to extract moisture, CO2, and H2S. The biomethane can be compressed, like CNG, for use as fuel in ICEVs or as fuel in FCHEVs equipped with MS-SOFCs. However, this purification technology still allows for an 8 vol% methane leakage, contributing to the GSWP. Despite its maturity with TRLs in the range of 8–9, there are alternative options available which can eliminate such leakage. While biogas burning occurs in landfills in certain regions of Brazil, it is not a nationwide practice. Therefore, biomethane upgraded from biogas and captured in landfills can be used for syngas reforming, resulting in carbon credits [15]. If bioethanol undergoes reforming by steam reforming with carbon capture and storage to address biogenic CO2 emissions, the resulting syngas can indeed contain green H2, leading to potentially negative carbon footprints. HTC and MRS are the main ImCs dominated by vehicle production. Reduction in vehicle weight, the use of alternative materials, and improvements in production efficiency can contribute to reducing these impacts. WC has a significant impact on FCEVs powered by H2 generated by WElisys in the current Brazilian scenario context due to substantial hydroelectricity consumption. However, in the near future, all H2 generated by WElisys will use a peak power supply from wind and solar renewable power in the northeast of Brazil. On the other hand, HTE is primarily influenced by all bioethanol reforming routes, with the agricultural stage of feedstock production by pesticide use, and subsequent emissions to air, water, and soil being the key factors contributing to this ImC [15]. In the context of FCEVs and FCHEVs, the dominant impacts on ImCs do not originate from the FC stacks. The glider, BoP, and battery weight remain crucial factors for mitigating the ImCs of these vehicles. For instance, the majority (70%–95%) of the total cost of ownership (TCO) for a FCEV with PEMFCs stack is attributed to the purchase cost. Hence, reducing the cost of the FCEVs and FCHEVs, particularly the FC stack and the carbon fiber H2 gas storage vessel, is essential for enhancing competitiveness against BEVs and ICEVs. Achieving cost reductions can be facilitated by economies of scale [15]. H2 production from WElisys, and from biomass, bioethanol, and biomethane reforming should be prioritized due to the ability to add value to the product by diversifying H2 sources. WElisys, especially in countries like Brazil, which has a significant share of renewable energies, and large hydroelectricity power generation can significantly contribute to reducing GGEs. This is particularly relevant in Brazil, where the biofuel tracking management policy called RenovaBio is in place, issuing carbon credits to producers who efficiently produce these fuels [404]. Nevertheless, those practices can also be implemented in other countries with biofuel production ability, such as Thailand, India and even USA and Canada to increase their portfolio of solutions for the energy transition, especially for the heavy-duty transportation where BEVs cannot meet the intercontinental demands of large countries. RenovaBio program in Brazil exemplifies a public policy initiative designed to mitigate GGEs. This program incorporates the following key elements: (i) impelling biofuel production; (ii) performing control and responsibility measures for GGEs by biofuel production tracking; (iii) emphasizing environmental sustainability, and (iv) promoting economic sustainability. In 2016, Brazil operated more than 350 sugarcane mills, employing 794,000 individuals in rural areas, surpassing the 700,000 employees engaged in the urban-based Brazilian oil industry [16,405–407]. This program introduces a payback known as decarbonization credits (CBio) for biofuel producers. Biofuel producers, upon accrediting sugarcane mills, landfills, and biogas lagoons, gather CBio entitlements proportionate to the volume of biofuel generated. Notably, this system allows producers to purchase CBios to offset GGE emissions. A higher CBio score is assigned to more efficient production practices, thereby inspiring the reduction of GGEs [404]. Governments and private entities are actively researching and developing a myriad of advanced power generation technologies for the mobility sector to achieve carbon neutrality. During these early stages, substantial government subsidies are essential. Examples include the exploration of solar and wind renewable power generation for charging BEVs and the investigation of emerging technologies which use renewable fuels. This includes FCEVs and HBVs with FCs powered by green H2 [408,409]. The energy transition of the mobility sector is crucial. In 2020, the fossil fuel consumption sector contributed ∼23% to global CO2 emissions. During the same period, the R&D public budget allocated to energy technologies by International Energy Agency (IEA) member countries amounted ∼USD 23 billion. In this budget, renewable energies accounted for 14.5%, while H2 and FCs constituted 4.3%. Consequently, R&D centers focusing on H2 and FCs in IEA member countries received ∼USD 1 billion of financial incentives. Brazil became an IEA member in 2017. In 2020, Brazil allocated ∼USD 1.7 billion to its public R&D budget in energy technology, acquiring the 5th position among member countries with heavy investments in this sector. From 2013 to 2017, Brazil did not witness significant investments in the field of H2 and FCs. However, in 2018, the Brazilian government initiated the ROTA2030 program under Federal Law No 13.755/2018. This program aims to lead investment to reinforce the mobility sector by stimulating the development and implementation of new technologies, which also improve fuel efficiency. Over the past three years, ROTA2030, administered by the Brazilian Research Development Foundation (FUNDEP), has approved and shell out ∼USD 35 million. These funds were allocated across 59 biofuels and alternative combustion propulsion research projects, supporting collaborations in the range of ISTs and industrial companies. Fig. 20 depicts the relationship of energy consumption and GGEs, specifically well-to-wheel, for several vehicle types across different scenarios outlined by ROTA2030. Each data point on the respective top-down curve denotes the product of energy consumption (MJ·km−1) and carbon intensity (gCO2eq.·MJ−1). The data spans from 2017, the baseline year for the diagram, to the projected dates of the new phases introduced by ROTA2030, namely 2022 (phase 1), 2027 (phase 2), and 2032 (phase 3). It is noteworthy that each line in the graph illustrates the progression of several propulsion and energy combinations over time, utilizing the most reliable data available from the Ecoinvent and BEN (Balanço Energético Nacional) database for energy inputs. Additionally, the authors estimations, derived from multiple sources, inform the evolution of efficiency for each powertrain technology. In this context, FCHEVs equipped with MS-SOFCs stacks emerge as potentially optimal choices in the current Brazilian scenario and are projected to maintain this status in 2032. This designation is attributed to the potential for substantial carbon emission reduction and low energy consumption throughout the well-to-wheel life cycle. This analysis holds importance not only for compliance with emerging legislations and policies in the mobility sector but also for alleviating concerns related to the potential impacts of the widespread adoption of BEVs and FCEVs. Such adoption has the potential to disrupt existing biofuel value chains in producing countries, leading to unemployment and economic imbalances which could have an impact on the global economy. The revolution in the mobility sector must align with the peculiar characteristics of each country, ensuring the preservation of established value networks developed over decades/centuries. This approach not only safeguards against market competitiveness but also promotes a more sustainable and modern transition to address challenges stemming from a growing population, ecosystem imbalances, and escalating energy demands over the years [15]. Any emerging technology with the capacity to mitigate EIs of the mobility sector requires initiative-taking encouragement from stakeholders to ensure economic viability. The implementation of such innovations triggers deep modifications in both supply chains and business models. In tandem, incentives and market adjustments must be coordinated to collectively contribute to the mitigation of global warming, enhancement of air quality, and improvement in energy efficiency, all of which significantly impact the biosphere quality and human health. The robustness of LCA studies heavily relies on the availability and quality of data, along with the boundary conditions and assumptions made by the referenced authors. Additionally, the adaptability of studies to diverse regional scenarios is a crucial factor. It is important to highlight those other kinds of emissions related to biofuel generation and reforming are inadequately addressed in existing literature for LCAs. Specifically, FCHEVs equipped with MS-SOFCs, it is pertinent to acknowledge that these analyses are grounded in information from two decades ago, lacking consideration for emissions during the life-cycle manufacturing process. Moreover, there is a notable scarcity of information on the LCIs of materials used in FCs, along with EoL details for each component or device. These gaps contribute to an incomplete understanding of the EI associated with FCHEVs equipped with MS-SOFCs. Onboard biofuel reforming into syngas for MS-SOFCs stacks of FCHEVs, could represent a viable alternative for GGEs reduction by 2030. This comparison is made in the scientific international literature against BEVs and FCEVs. The advantage lies in the fact that FCs contribute minimally to ImCs, apart from the MRS category. Reduction in FCs impact on MRS is associated with weight reduction or the manufacturing scale-up. The impact of FCHEVs on the HTE is associated with the agricultural stage and the overall biofuel supply chain. However, in comparison in the range of FCEVs and FCHEVs equipped with MS-SOFCs, the latter demonstrates numerous advantages, particularly in scenarios where biofuel is produced. In contrast, FCEVs do not exhibit competitiveness across the discussed categories. For GSWP, these vehicles perform as unfavorably as ICEVs powered by fossil fuels. Even flexible-fuel ICEVs manufactured in Brazil and fueled with 100 vol% of bioethanol exhibit a lower EI than both BEVs and PHEVs in both European and Brazilian contexts [15]. H2 from biofuels holds significant potential as a net carbon sink. The effectiveness of this strategy depends on the appropriate handling of feedstocks and the successful launch of carbon capture systems. FCHEVs equipped with MS-SOFC stacks avoid the substantial investments required for H2 hubs and logistics. Vargas et al. reported the LCA of light-duty FCEVs and FCHEVs equipped with PEMFC and MS-SOFC. The analysis considered the impacts associated with different H2 production methods, including viable reforming routes of bioethanol, biomethane, and WElisys. The study evaluated scenarios where H2 is produced onboard in the case of FCHEVs with MS-SOFC stack and an external reformer or reformed externally [15]. Results indicated the potential for GGEs reduction in FCHEVs equipped with MS-SOFC stacks. However, future studies should enhance reliability by utilizing more robust LCIs and EoL data. A more comprehensive examination of the integration of this new powertrain system into the Brazilian market and other biofuel producer markets is recommended. This solution brings a robust synergy in the range of electrification and biofuels in the mobility sector [15]. Gauto et al. reported LCAs from the cradle-to-the-grave of ICEVs, plug-in and non-plug-in HEVs, and BEVs. These vehicles were fueled with bioethanol and biomethane or charged with electricity from either the Brazilian or European energy matrix. The study revealed that GGEs for HEVs fueled with these biofuels are lower than those observed for BEVs in the Brazilian scenario. This is attributed to the lower carbon intensity emission of the electricity matrix in Brazil compared to many other countries. In 2022, Brazil produced 677 GWh of electricity, with 88% from renewable sources including hydropower (63%), wind (12%), and biofuels (8.1%). ICEVs using biomethane exhibit lower GGEs than a BEV charged in the Brazilian energy matrix, known for its environmental cleanliness. The authors reported that an HEV powered with 100% of biomethane and 100% of bioethanol can travel 16.8 and 12.9 km/kgCO2eq., respectively. In comparison, a BEV charged in the Brazilian and European energy matrix can only cover 9.5 and 6.9 km/kgCO2eq. The study suggests that even considering potential GGEs reductions during BEV battery manufacturing in future scenarios, biofuels remain a more favorable option [392]. Emissions linked to biofuel production are set to decrease in the coming decade as Brazilian biofuel producers actively pursue decarbonization to acquire carbon credits from RenovaBio program (CBios). This is achieved through various measures, including: (i) the biodigestion of the filter cake, vinasse, and straw to generate biomethane replacing diesel in sugarcane farming, harvesting, and transportation; (ii) the substitution of chemical fertilizers and pesticides with natural ones derived from the biodigestion process or other biological alternatives like nutrient-fixing microorganisms, algae, and biological pesticides; (iii) the cultivation and utilization of more productive biomass sources, exemplified by genetically modified Energy Cane, able to produce 280% more bioethanol per hectare; and (iv) strategic investments in technology and precision agriculture to enhance overall production efficiency [392]. It is important to highlight the production of 2G Ethanol from sugarcane by current technology which results in GGEs of 13.6 gCO2eq./MJ. Besides this significant value, the decarbonization of biofuel production coupled with carbon capture holds the potential for achieving negative emissions. Moreira et al. reported data about capturing CO2 emitted during the bioethanol fermentation and injecting it into deep aquifers which would result in a fuel cost increase of only USD 0.0334·L−1, corresponding to a price increment of 3.5% or a cost of USD 30/tCO2. Such minimal costs are feasible because the effluent gas from fermentation may contain up to 99% CO2, excluding water and bioethanol vapors, thereby reducing the need for expensive purification processes. If all the fermented CO2 generated from bioethanol production in Brazil could be sequestered, annual extraction of 27.7 MtCO2 from the atmosphere would be achieved, representing approximately 4% of the 650 MtCO2/year estimated by the Intergovernmental Panel on Climate Change as requiring removal from the atmosphere Moreover, if these findings were extrapolated to global bioethanol production, this process could contribute substantially, accounting for 10% towards the world’s CO2 removal target. Similarly, the upgrade from biogas to biomethane inherently involves the removal of excess CO2, which could potentially be stored, thereby leading to negative emissions. Consequently, these findings reinforce the pivotal role of fermented biofuels in the endeavor to decarbonize the economy [410]. In lack of EoL and LCA data for MS-SOFCs, despite their lower EI, potential hazards during manufacturing stages could emit pollutants. This poses a risk of detriment to the entire manufacturing chain of FCHEVs and may lead to the imposition of trade barriers. Consideration should be given not only to the EoL and LCA of MS-SOFC stacks but also to the powertrain system. This system comprises fuel and air supply pipes, a fuel tank, early-burners, after-burners, air-blowers, electro-electronic systems for heating and operational control, as well as a thermal insulation system. Despite the superior efficiency and lower GGEs of MS-SOFC stacks, the lack of scientific studies on EoL and LCA requires further research. More studies are required to assess GGEs release of the manufacturing of these devices to evaluate the economic feasibility of recycling. Despite being a recent technology with limited information on EoL and LCA, the recycling of MS-SOFCs devices holds the potential to establish a promising new market in Brazil and other countries. 10 Advances and perspectives in R&D The development of MS-SOFCs has advanced significantly over the past decade, driven by the need for high-performance, cost-effective, and durable energy solutions. Companies like Ceres Power and consortia, including DLR, Plansee, and Topsoe have pioneered advancements in stack architecture, employing novel materials like ferritic steel substrates and innovative fabrication techniques such as plasma spraying and screen printing. These innovations have led to improved power densities, reduced degradation rates, and enhanced operational stability, but challenges remain. Issues such as electrolyte gas leakage, complex multi-layered cell structures, and the need for reliable sealing techniques persist. Patents filed in this space reflect the progress made in addressing these difficulties, with key developments in cathode materials, protective coatings, and electrolyte deposition methods. Despite the advancements, the scaling of MS-SOFCs for commercial use still faces technical and economic hurdles, particularly in achieving long-term durability and cost reduction. The economic viability of SOFCs must be assessed in comparison to competing technologies available in the market, such as natural gas turbines, solar photovoltaics, onshore wind, PEM fuel cells, and battery storage. In 2022, the estimated production cost for SOFC stacks was around 13,260 USD/kW, with a levelized cost of electricity (LCOE) of approximately 190 USD/MWh [411]. For context, the installation costs and LCOE of commercial energy sources in 2024 are as follows: natural gas turbines range in the range of 800–1,200 USD/kW and 40–110 USD/MWh; solar photovoltaics range from 800 to 1,300 USD/kW and 20–45 USD/MWh; onshore wind is in the range of 1,100–1,600 USD/kW and 30–50 USD/MWh; PEMFC are estimated at 1,000–1,500 USD/kW and 150–200 USD/MWh; and LFP battery storage at 53 USD/kW and 100–150 USD/MWh. These costs clearly indicate the current economic disadvantage of SOFC compared to these more mature energy sources. However, it is essential to recognize that SOFC technology has not yet benefited from cost reductions associated with large scale production. The Commercial-scale SOFC systems (COMSOS) project targets a cost of 3,700 USD/kW for 10–60 kW modules, while Nielsen et al. predict that SOFC stack costs could drop to 300 USD/kW in an industrial plant with a production capacity of 50 MW/year, and as low as 200 USD/kW for plants producing over 1000 MW/year [412]. Furthermore, SOFC provides distributed and dispatchable power, can co-produce hot water, and operate on renewable fuels like biomethane and ethanol. These competitive advantages can be leveraged to stabilize the electrical grid, serve as backup power systems, and support transport applications, demonstrating the transformative potential of this technology for the energy transition. To understand the advancements toward mass production, patent grants and their trends can be evaluated as indicators of technological maturity, and in this analysis, Google Scholar was employed for the research. Since 2004, a total of 32,271 patents have featured the term “SOFC” in their title, abstract, or claims, categorized under the Cooperative Patent Classification as 83% in Energy Generation through Renewable Energy Sources (Y02E), 66% in Processes for the Direct Conversion of Chemical Energy into Electrical Energy (H01M), and 23% in Climate Change Mitigation Technologies in Manufacturing (Y02P). These results indicate the potential of SOFCs as a promising solution for energy transition and the reduction of greenhouse gas emissions. When narrowing the search by fuels, “natural gas” produced 14,538 results, “ethanol” 1266, “methane” 661, “ammonia” 626, and “biogas” just 106. These results reveal a strong interest in logistical fuels like natural gas, ethanol, and ammonia, whereas methane and biogas are less frequently referenced—likely because they are largely equivalent to natural gas in their characteristics and applications. Further refinement by production methods highlights “screen printing” with 5045 results, “spray” with 991, “tape casting” with 334, “spin coating” with 188, and “physical deposition” with only 94 results. This trend clearly points toward a preference for scalable and cost-effective techniques, with screen printing and spray processes leading the development. Although physical deposition can produce superior devices, its high costs limit its exploration. Regarding critical components for enhanced durability, “interconnect” appears 1631 times, while “diffusion barrier” is mentioned in just 73 instances, underscoring the priority of optimizing the durability within the fuel cell. For mobility applications, “start-up” shows up 1325 times and “metal supported” 177 times, emphasizing the ongoing challenge of managing the on–off cycling necessary for transport modes, where reliability under dynamic conditions is key. In this sense, some companies have started to develop SOFC and MS-SOFC on a large-scale. Ceres Power has developed a robust MS-SOFC stack design using a ferritic stainless steel foil substrate with a perforated central region for gas permeability. The cell structure includes a thick-film cermet anode, a tri-layer electrolyte (GDC, YSZ, and a GDC buffer layer), and a bilayer cathode for efficient current collection. Early stack performance (from 2004) demonstrated power densities of 300 mW·cm−2 at 600 °C. As of 2015, Ceres reported stacks generating 10–15 kW with a power-to-weight ratio of 0.12 kW·kg−1 and a degradation rate of 0.3%–0.45% per 1000 h over 6400 h of operation. Ceres MSCs operate at around 600 °C, making them suitable for APUs in vehicles [40,364,365,413–415]. German Consortium (DLR, Plansee, Elring Klinger, BMW) developed a high-performing MSC stack based on TS processes (plasma spraying) for the catalytic and electrolyte layers [416,417]. The stacks featured diffusion barrier layers to prevent the migration of metallic species, improving durability. The stacks demonstrated power densities of 600 mW·cm−2 at 800 °C, with advancements like GDC barrier layers reducing cathode ASR to 0.26 Ω·cm2. The stacks produced 160–200 W in a 10-cell configuration. Achieving gas tightness in the plasma-sprayed electrolytes was identified as a key challenge. NextGen MSC development is a German initiative led by AVL List GmbH aimed at developing a 3 kW SOFC APU system using NextGen MSCs [417]. The Gen A and Gen B MSC configurations incorporated advancements in anode and electrolyte structure, reducing the thickness of the electrolyte and improving performance. The Gen B cell exhibited power densities of 1064 mW·cm−2 at 820 °C, but OCV measurements indicated persistent gas leakage issues. Topsoe Fuel Cells (TFC), DTU, and Riso worked on developing MSC stacks as part of the EU METSOFC project, focusing on improving performance at lower operating temperatures (600–700 °C) [418]. These efforts included infiltrated nanostructured electrodes and ScSZ electrolytes. A 25-cell stack operating at 700 °C delivered 450 W with a degradation rate of 160 mΩ·cm2 per 1000 h. RAMSES EU Project developed both tubular and planar MSCs using a ferritic steel substrate with protective coatings to enhance corrosion resistance [419]. The stacks achieved power densities of over 500 mW·cm−2 at 800 °C, demonstrating robust performance over thermal cycles. In summary, MS-SOFC stacks have seen significant developments, with advancements in materials, fabrication processes, and operational durability. Various groups have contributed patented technologies to improve the overall performance and manufacturability of MSCs. These developments hold promise for both stationary and mobile applications of fuel cells, particularly in distributed power generation and APUs. 11 Conclusions and future perspectives Global efforts to decarbonize mobility are progressing strongly, driven by the Paris Agreements directives to cut GGEs by 45% by 2030 and achieve net-zero emissions by 2050, limiting the increase in the global average temperature below 2 °C over pre-industrial levels [1,2]. This review explored the concept of electrification by reforming hydrocarbons and biofuels to power MS-SOFCs stack with syngas for onboard electricity generation and EE propulsion. This approach presents a promising alternative, aiming to diminish reliance on batteries and mitigate the EIs associated with production, including resource-intensive mining and manufacturing processes. The higher energy density of some biofuels allows the integration in the range of onboard external reformers and MS-SOFCs stack in a new powertrain system enabling drive-range transportation in biofuels producing countries also reducing the scarce mineral mining and GGEs. This concept reduces the necessity for extensive infrastructure modifications to fit widespread vehicle recharging since bioethanol and biomethane can be easily integrated into gas stations as the Brazilian 30 years’ experience already proves to be commercially viable. This solution may be vital in our collective efforts to combat climate change and reduce CO2 emissions. The energy transition should primarily center on reducing GGEs emissions and adoption of the most efficient scale-up technologies currently available. The potential exists to mitigate GGEs while promoting prosperity and wealth for communities worldwide. MS-SOFCs promotes the utilization of hydrocarbons and biofuels, such as bioethanol and biomethane, in FCHEVs. This can be achieved by external reforming or directly internal reforming. The high performance, rapid start-up, and light-off stem from the ceramic film deposition on cost-effective stainless steel porous supports, accomplished by scale-up techniques with lower CAPEX. Over the past eight years, this technological advancement has garnered interest and investment from governments, several ICEVs, BEVs, and FCEVs automotive manufacturers, and power generation companies in Brazil to support R&D. This review discussed several insights aimed at addressing challenges in the utilization of hydrocarbons and biofuels, particularly bioethanol and biomethane, in MS-SOFCs. Key considerations include: (i) 3D print PMSs as MRs integrated with MS-SOFCs; (ii) pre-catalytic thin layer deposition on the MS-SOFCs anode through spin, spray coating or PVD to create a pre-reformer layer; (iii) infiltration and impregnation of catalysts into electrodes and PMS scaffolds; (iv) pre-homogenization of catalysts and electrode materials, followed by infiltration and impregnation into the same electrode and PMS scaffolds; (v) optimization of MS-SOFCs electrode materials to address the issues caused by coking on the anode and coarsening of the electrodes, exploring those resistant to carbon and sulfur deposition, potentially employing materials used in high mass molar biomass and tar reformers. However, the use of new materials and manufacturing techniques, while enhancing the MS-SOFCs performance and lifespan requires careful application. This caution stems from the challenges associated with the reuse and recycling of these new materials at the EoL. LCAs of several technologies reveal HEVs, plug-in PHEVs, and non-plug-in HEVs powered by biofuels exhibit lower GGEs than BEVs in both Brazil and Europe. The implementation of the MS-SOFC stack in a hybrid powertrain system powered by biofuel may can help decarbonize the mobility sector in a more sustainable way. It has the potential to increase energy efficiency up to fivefold compared to Brazilian commercial FlexPower ICEV powered by bioethanol, as demonstrated by the Nissan prototype powered by heavily hydrated bioethanol, achieving an efficiency of 40 km·L−1. The synergy in the range of biofuels and electrification by FCHEVs equipped with MS-SOFC stacks may be a pathway for the decarbonization of the entire automotive fleet in terms of sustainability and global economic impact. This synergy extends beyond Brazilian biofuels, offering a viable alternative for over 3 billion people worldwide which rely on the entire biofuel production chain. The 2G bioethanol production release 13.6 gCO2eq./MJ and the decarbonization of the chain production and new bioenergy carbon capture and storage process could bring this number to negative values. Advances in biotechnology for farming, harvesting, transportation, and the decarbonization of production, coupled with policies involving carbon capture, are expected to reduce the GGEs associated with biofuels to levels that may be lower or even negative. The journey toward the widespread commercialization of MS-SOFCs faces challenges that need to be addressed to unlock the full potential of the next generation of electrochemical energy devices. Despite ongoing research, substantial issues persist requiring continued focus and solutions. To address these issues, the following perspectives and research directions for future endeavors are emphasized below. (1) The exploration of high-entropy materials as a promising strategy. HEAs have garnered attention as prospective materials for MS-SOFCs due their excellent physico-chemical stability, good catalytic activity, and electrical conductivity [420]. HEAs exhibit the potential to be used as DBLs on ICs of SOFCs and MS-SOFCs [420]. High-Entropy Oxides (HEOs) with proton conductivity are promising electrolytes for SOFC applications. HEOs with perovskite structure enhance the catalytic activity and diminish polarization resistance in SOFC cathode materials by the mitigation of Sr-segregation [420,421]. Ex-solved catalysts have been shown efficiency and long-term stability due to small and well-dispersed nanoparticles, which reduce the coking and coarsening, ensuring higher TPBs density. (2) There is a lack of mechanistic studies regarding the use of fuels with higher molecular mass. The elementary steps of the catalytic reactions at different electrode materials need to be more investigated. At the TPBs of the anode, it is necessary to understand the oxidative steps of the fuel on the catalyst, the cleavage of C–H and C–C bonds, and how O2− reacts with H2 and carbon at the TPBs generating electrons, H2O and CO2. It is necessary to understand the mechanism of the ORR over different cathode materials since the overall process involves four electrons. Modeling the electrochemical data of SOFCs to extract kinetic parameters leads to improvements in overall efficiency, especially in reducing coking and coarsening [422]. (3) The microstructural architecture of the SOFCs plays multiple roles during its operation, such as allowing the reactant gas diffusion in and products out; enabling ionic charge transfer and electronic conductivity at the electrodes and gas impermeability and electronic insulation at the electrolyte layer. To achieve all these features not only must the material properties attend to the demand, but also the thickness, porosity, active surface area, and interconnectivity must match the specific needs of each layer. The evolution of the microstructure during the operation is a crucial degradation mechanism and encourages the development of innovative assembling strategies to mitigate nanocatalyst coarsening, de-wetting from scaffold, and components delamination. Tomography studies using synchrotron X-ray allow high resolution and fast acquisition of data to improve the reliability of SOFCs [423], and inexpensive non-destructive testing must be developed [424,425]. (4) The use of heterointerfaces in the range of electrodes and electrolytes stands as a pivotal approach to significantly enhance not only ionic and electronic conductivity but also the electrocatalytic activity and stability of Solid Oxide Cells (SOCs) components [426]. Precise control over the composition and microstructure of heterointerfaces becomes imperative for the design of novel electrode and electrolyte materials by interface engineering [426]. Thin film deposition techniques such as PLD, ALD, and Molecular Beam Epitaxy (MBE) offer distinct advantages in precisely controlling the atomic structure of heterointerfaces, making invaluable tools for the synthesis of novel heterostructure SOC components [426]. The integration of microelectronics manufacturing techniques could improve the TRL and attract experienced stakeholders to boost the commercial implementation of SOFCs, closing the gap in the range of academia and industry. (5) The higher SOFC operating temperature is known to induce substantial structural and morphological changes in electrode and electrolyte materials, reducing the performance. Some electrode material compositions have demonstrated the potential to enhance performance during operation due to the in-situ formation of new catalytic sites. Given these challenges and the pressing need for a deeper understanding and the formulation of more precise mechanisms, the development and application of in situ and operando techniques become indispensable for accurate interpretation and progress in the field. Indeed, this matter requires the utilization of numerous in situ and operando spectroscopic and structural characterization techniques. Advanced spectroscopic methods, including synchrotron light-based techniques such as Extended X-ray Absorption Fine Structure (EXAFS), X-ray Absorption Near-Edge Structure (XANES), Near Edge X-ray Absorption Fine Structure (NEXAFS), and X-ray photoelectron spectroscopy (XPS) are essential tools. In addition, a thorough exploration of in situ and operando electron microscopy is imperative for advancing research on SOFC electrode materials. For example, a detailed in situ TEM examination of the morphological evolution during the in situ synthesis of alloys through emerging ex-solution materials during cell operation can yield valuable insights [427]. (6) Fuel cells are suited for carbon capture storage given the exhaustion gases from anode contains only H2O vapour, CO2, and residual fuel. This mix could be directly used in carbon capture storage processes like geological storage or purified to high purity CO2 with less energy spent than traditional thermoelectric facilities, where CO2 is diluted on burned air–fuel mixture. This can lead to a sharp GGEs reduction towards the Paris Agreements goals even when using fossil fuels; moreover, in bioenergy carbon capture storage context, this could lead to precious net atmosphere CO2 removal when biofuels are used. (7) Despite high electricity efficiency, the commercially available Elcogen SOFCs stacks already reaching 75% in 2024, the SOFCs fuel utilization is still underwhelming, with only 70% utilization, and then only 52.5% net fuel efficiency. The unreacted fuel usually is partially recycled back into the SOFC stack or catalytically oxidized on an afterburner. If any carbon-based fuel is utilized, CO must be completely reacted to meet hazardous and environmental criteria. Therefore, research to increase fuel utilization and lower CO emissions at the anode level could simplify the stacks and improve commercialization. Considering the latest findings and the expected future directions, we aspire that this review serves as a valuable contribution to establishing and acknowledging MS-SOFCs and hydrocarbon and biofuel reformers as pivotal technologies for global decarbonization. Furthermore, research in these domains should continue to advance, with the goal of developing systems that pave the way for future breakthroughs in addressing the energy demands of our society. Fig. 21 depicts a schematic illustration comprising the perspectives and research directions for future endeavors. CRediT authorship contribution statement Fábio C. Antunes: Writing – review & editing, Writing – original draft, Project administration, Methodology, Investigation, Funding acquisition, Formal analysis, Conceptualization. João P.J. de Oliveira: Writing – review & editing, Writing – original draft, Formal analysis. Ricardo S. de Abreu: Writing – review & editing, Formal analysis. Thiago Dias: Writing – review & editing, Formal analysis. Bruno B.N.S. Brandão: Writing – review & editing, Formal analysis. Josué M. Gonçalves: Writing – review & editing, Formal analysis. Josimar Ribeiro: Writing – review & editing, Formal analysis. Julian Hunt: Writing – review & editing, Formal analysis. Hudson Zanin: Writing – review & editing, Supervision, Project administration, Funding acquisition, Formal analysis. Gustavo Doubek: Writing – review & editing, Supervision, Project administration, Funding acquisition, Formal analysis. Declaration of competing interest The authors declare that they have no known competing financial interests or personal relationships that could have appeared to influence the work reported in this paper. Acknowledgments The authors express their sincere appreciation for the generous financial support provided by various Brazilian funding agencies, including the Fundação de Amparo à Pesquisa do Estado de São Paulo (FAPESP, 2022/02235-4, 2017/11958-1, 2017/11986-5, 2014/02163-7), Fundação de Apoio da UFMG (FUNDEP, 27192-36, 01-P-38465/2023) and Conselho Nacional de Desenvolvimento Científico e Tecnológico (CNPq, 405675/2022-4, 56405643/2022-5, 302180/2022-2, 306870/2021-5). Additionally, the authors extend their gratitude to Shell (British multinational oil and gas company) for their valuable support and recognize the strategic significance of the assistance received from ANP (Brazil’s National Oil, Natural Gas, and Biofuels Agency) through the R&D levy regulation. Furthermore, the authors would like to acknowledge the support from AMBAR ENERGIA (Brazilian electric power generation company) and recognize the strategic importance of the assistance provided by ANEEL (Brazil’s national electricity regulator) through the R&D levy regulation. Appendix A Supplementary material Supplementary data to this article can be found online at https://doi.org/10.1016/j.jechem.2024.10.056. Appendix A Supplementary material The following are the Supplementary data to this article: Supplementary Data 1 References [1] United Nations, Net Zero Coalit. (2023) 1–11. [2] U.N.C. Change, United Nations Clim. Chang. (2017) 1. [3] G. Luderer M. Pehl A. Arvesen T. Gibon B.L. Bodirsky H.S. de Boer O. Fricko M. Hejazi F. Humpenöder G. Iyer S. Mima I. Mouratiadou R.C. Pietzcker A. Popp M. van den Berg D. van Vuuren E.G. Hertwich Nat. Commun. 10 2019 5229 G. Luderer, M. Pehl, A. Arvesen, T. Gibon, B.L. Bodirsky, H.S. de Boer, O. Fricko, M. Hejazi, F. Humpenöder, G. Iyer, S. Mima, I. Mouratiadou, R.C. Pietzcker, A. Popp, M. van den Berg, D. van Vuuren, E.G. Hertwich, Nat. Commun. 10 (2019) 5229. [4] F. Coutinho Antunes, R. Venâncio, G. Doubek, H. Zanin, in: Liquid Biofuels: Bioethanol, Springer, 2022, pp. 385–429. [5] Y. Zheng X. Wan X. Cheng K. Cheng Z. Dai Z. Liu Catalysts 10 2020 166 Y. Zheng, X. Wan, X. Cheng, K. Cheng, Z. Dai, Z. Liu, Catalysts 10 (2020) 166. [6] A. Shafaei Douk H. Saravani M.Z. Yazdan Abad M. Noroozifar ACS Appl. Energy Mater. 3 2020 7527 7534 A. Shafaei Douk, H. Saravani, M.Z. Yazdan Abad, M. Noroozifar, ACS Appl. Energy Mater. 3 (2020) 7527–7534. [7] W. Song Z. Ma Y. Yang S. Zhang X. Ou Y. Ling Int. J. Hydrogen Energy 45 2020 14480 14490 W. Song, Z. Ma, Y. Yang, S. Zhang, X. Ou, Y. Ling, Int. J. Hydrogen Energy 45 (2020) 14480–14490. [8] H. Wang X. Tong S. Sun M. Mohamedi Electrochim. Acta 355 2020 136823 H. Wang, X. Tong, S. Sun, M. Mohamedi, Electrochim. Acta 355 (2020) 136823. [9] J. Galindo-de-la-Rosa A. Álvarez M.P. Gurrola J.A. Rodríguez-Morales G. Oza L.G. Arriaga J. Ledesma-García ACS Sustain. Chem. Eng. 8 2020 10900 10910 J. Galindo-de-la-Rosa, A. Álvarez, M.P. Gurrola, J.A. Rodríguez-Morales, G. Oza, L.G. Arriaga, J. Ledesma-García, ACS Sustain. Chem. Eng. 8 (2020) 10900–10910. [10] D. Udomsilp J. Rechberger R. Neubauer C. Bischof F. Thaler W. Schafbauer N.H. Menzler L.G.J. de Haart A. Nenning A.K. Opitz O. Guillon M. Bram Cell Rep. Phys. Sci. 1 2020 100072 D. Udomsilp, J. Rechberger, R. Neubauer, C. Bischof, F. Thaler, W. Schafbauer, N.H. Menzler, L.G.J. de Haart, A. Nenning, A.K. Opitz, O. Guillon, M. Bram, Cell Rep. Phys. Sci. 1 (2020) 100072. [11] M.C. Tucker J. Power Sources 195 2010 4570 4582 M.C. Tucker, J. Power Sources 195 (2010) 4570–4582. [12] D. Udomsilp C. Lenser O. Guillon N.H. Menzler Energy Technol. 9 2021 2001062 D. Udomsilp, C. Lenser, O. Guillon, N.H. Menzler, Energy Technol. 9 (2021) 2001062. [13] M. Dewa W. Yu N. Dale A.M. Hussain M.G. Norton S. Ha Int. J. Hydrogen Energy 46 2021 33523 33540 M. Dewa, W. Yu, N. Dale, A.M. Hussain, M.G. Norton, S. Ha, Int. J. Hydrogen Energy 46 (2021) 33523–33540. [14] S. Ma M. Lin T.-E. Lin T. Lan X. Liao F. Maréchal J. Van Herle Y. Yang C. Dong L. Wang Renew. Sustain. Energy Rev. 135 2021 110119 S. Ma, M. Lin, T.-E. Lin, T. Lan, X. Liao, F. Maréchal, J. Van herle, Y. Yang, C. Dong, L. Wang, Renew. Sustain. Energy Rev. 135 (2021) 110119. [15] J.E. Velandia Vargas J.E.A. Seabra Sci. Total Environ. 798 2021 149265 J.E. Velandia Vargas, J.E.A. Seabra, Sci. Total Environ. 798 (2021) 149265. [16] F. de Oliveira Gonçalves E. Savioli Lopes M. Savioli Lopes R. Maciel Filho Int. J. Hydrogen Energy 46 2021 36381 36397 F. de Oliveira Gonçalves, E. Savioli Lopes, M. Savioli Lopes, R. Maciel Filho, Int. J. Hydrogen Energy 46 (2021) 36381–36397. [17] E. Dogdibegovic Y. Fukuyama M.C. Tucker J. Power Sources 449 2020 227598 E. Dogdibegovic, Y. Fukuyama, M.C. Tucker, J. Power Sources 449 (2020) 227598. [18] N. Shi Y. Xie Y. Yang S. Xue X. Li K. Zhu D. Huan R. Peng C. Xia Y. Lu Mater. Renew. Sustain. Energy 9 2020 6 N. Shi, Y. Xie, Y. Yang, S. Xue, X. Li, K. Zhu, D. Huan, R. Peng, C. Xia, Y. Lu, Mater. Renew. Sustain. Energy 9 (2020) 6. [19] L. Malavasi C.A.J. Fisher M.S. Islam Chem. Soc. Rev. 39 2010 4370 4387 L. Malavasi, C.A.J. Fisher, M.S. Islam, Chem. Soc. Rev. 39 (2010) 4370–4387. [20] B.C.H. Steele A. Heinzel Nature 414 2001 345 352 B.C.H. Steele, A. Heinzel, Nature 414 (2001) 345–352. [21] M. Zhou M. Yang X. Wu J. Fu Appl. Sci. 9 2019 3309 M. Zhou, M. Yang, X. Wu, J. Fu, Appl. Sci. 9 (2019) 3309. [22] H.S. Das C.W. Tan A.H.M. Yatim Renew. Sustain. Energy Rev. 76 2017 268 291 H.S. Das, C.W. Tan, A.H.M. Yatim, Renew. Sustain. Energy Rev. 76 (2017) 268–291. [23] Z. Dimitrova F. Maréchal Renew. Energy 112 2017 124 142 Z. Dimitrova, F. Maréchal, Renew. Energy 112 (2017) 124–142. [24] R.M. Ormerod Chem. Soc. Rev. 32 2003 17 28 R.M. Ormerod, Chem. Soc. Rev. 32 (2003) 17–28. [25] D.J.L. Brett A. Atkinson N.P. Brandon S.J. Skinner Chem. Soc. Rev. 37 2008 1568 1578 D.J.L. Brett, A. Atkinson, N.P. Brandon, S.J. Skinner, Chem. Soc. Rev. 37 (2008) 1568–1578. [26] V. Cigolotti M. Genovese P. Fragiacomo Energies 14 2021 4963 V. Cigolotti, M. Genovese, P. Fragiacomo, Energies 14 (2021) 4963. [27] L. van Biert T. Woudstra M. Godjevac K. Visser P.V. Aravind J. Power Sources 397 2018 382 396 L. van Biert, T. Woudstra, M. Godjevac, K. Visser, P. V. Aravind, J. Power Sources 397 (2018) 382–396. [28] N. Mahato A. Banerjee A. Gupta S. Omar K. Balani Prog. Mater. Sci. 72 2015 141 337 N. Mahato, A. Banerjee, A. Gupta, S. Omar, K. Balani, Prog. Mater. Sci. 72 (2015) 141–337. [29] R. Chen Y. Gao J. Gao H. Zhang M. Motola M.B. Hanif C.-X. Li J. Energy Chem. 97 2024 79 109 R. Chen, Y. Gao, J. Gao, H. Zhang, M. Motola, M.B. Hanif, C.-X. Li, J. Energy Chem. 97 (2024) 79–109. [30] P. Boldrin N.P. Brandon Nat. Catal. 2 2019 571 577 P. Boldrin, N.P. Brandon, Nat. Catal. 2 (2019) 571–577. [31] R.T. Leah A. Bone E. Hammer A. Selcuk M. Rahman A. Clare L. Rees N. Lawrence A. Ballard T. Domanski S. Mukerjee M. Selby ECS Trans. 78 2017 2005 2014 R.T. Leah, A. Bone, E. Hammer, A. Selcuk, M. Rahman, A. Clare, L. Rees, N. Lawrence, A. Ballard, T. Domanski, S. Mukerjee, M. Selby, ECS Trans. 78 (2017) 2005–2014. [32] H. Xu Y. Han J. Zhu M. Ni Z. Yao Energy Rev. 3 2024 100051 H. Xu, Y. Han, J. Zhu, M. Ni, Z. Yao, Energy Rev. 3 (2024) 100051. [33] S. Pirou B. Talic K. Brodersen A. Hauch H.L. Frandsen T.L. Skafte Å.H. Persson J.V.T. Høgh H. Henriksen M. Navasa X.-Y. Miao X. Georgolamprou S.P.V. Foghmoes P.V. Hendriksen E.R. Nielsen J. Nielsen A.C. Wulff S.H. Jensen P. Zielke A. Hagen Nat. Commun. 13 2022 1263 S. Pirou, B. Talic, K. Brodersen, A. Hauch, H.L. Frandsen, T.L. Skafte, Å.H. Persson, J.V.T. Høgh, H. Henriksen, M. Navasa, X.-Y. Miao, X. Georgolamprou, S.P. V. Foghmoes, P.V. Hendriksen, E.R. Nielsen, J. Nielsen, A.C. Wulff, S.H. Jensen, P. Zielke, A. Hagen, Nat. Commun. 13 (2022) 1263. [34] B.G. Pollet S.S. Kocha I. Staffell Curr. Opin. Electrochem. 16 2019 90 95 B.G. Pollet, S.S. Kocha, I. Staffell, Curr. Opin. Electrochem. 16 (2019) 90–95. [35] C. Vesely, P. Barnard, B. Dosanjh, Metal-Supported Ceria Electrolyte-Based SOFC Stack for Scalable, Low-Cost, High-Efficiency and Robust Stationary Power Systems (Final Report), Pittsburgh, PA, and Morgantown, WV (United States), 2021. [36] E.D. Wachsman C.A. Marlowe K.T. Lee Energy Environ. Sci. 5 2012 5498 5509 E.D. Wachsman, C.A. Marlowe, K.T. Lee, Energy Environ. Sci. 5 (2012) 5498–5509. [37] F. Ning X. He Y. Shen H. Jin Q. Li D. Li S. Li Y. Zhan Y. Du J. Jiang H. Yang X. Zhou ACS Nano 11 2017 5982 5991 F. Ning, X. He, Y. Shen, H. Jin, Q. Li, D. Li, S. Li, Y. Zhan, Y. Du, J. Jiang, H. Yang, X. Zhou, ACS Nano 11 (2017) 5982–5991. [38] S.P. Isanaka T.E. Sparks F.F. Liou J.W. Newkirk J. Manuf. Syst. 38 2016 165 171 S.P. Isanaka, T.E. Sparks, F.F. Liou, J.W. Newkirk, J. Manuf. Syst. 38 (2016) 165–171. [39] H. Li H. Zhao S. Jian B. Tao S. Gu G. Xu G. Wang H. Chang J. Mater. Chem. A 11 2023 17373 17391 H. Li, H. Zhao, S. Jian, B. Tao, S. Gu, G. Xu, G. Wang, H. Chang, J. Mater. Chem. A 11 (2023) 17373–17391. [40] R.T. Leah A. Bone E. Hammer A. Selcuk M. Rahman A. Clare S. Mukerjee M. Selby ECS Trans. 78 2017 87 95 R.T. Leah, A. Bone, E. Hammer, A. Selcuk, M. Rahman, A. Clare, S. Mukerjee, M. Selby, ECS Trans. 78 (2017) 87–95. [41] H. Kobayashi A. Hayakawa K.D.K.A. Somarathne E.C. Okafor Proc. Combust. Inst. 37 2019 109 133 H. Kobayashi, A. Hayakawa, K.D.K.A. Somarathne, E.C. Okafor, Proc. Combust. Inst. 37 (2019) 109–133. [42] V.A. Blagojević, D.G. Minić, J.G. Novaković, D.M. Minić, in: IntechOpen, IntechOpen, 2012, p. 27. [43] K. Glensor M.R. Muñoz Sustainability 11 2019 6332 K. Glensor, M.R. Muñoz, Sustainability 11 (2019) 6332. [44] R.M. Handler D.R. Shonnard E.M. Griffing A. Lai I. Palou-Rivera Ind. Eng. Chem. Res. 55 2016 3253 3261 R.M. Handler, D.R. Shonnard, E.M. Griffing, A. Lai, I. Palou-Rivera, Ind. Eng. Chem. Res. 55 (2016) 3253–3261. [45] A.J. Waclawovsky P.M. Sato C.G. Lembke P.H. Moore G.M. Souza Plant Biotechnol. J. 8 2010 263 276 A.J. Waclawovsky, P.M. Sato, C.G. Lembke, P.H. Moore, G.M. Souza, Plant Biotechnol. J. 8 (2010) 263–276. [46] B.C. Yang J. Koo J.W. Shin D. Go J.H. Shim J. Ah Energy Technol. 7 2019 5 19 B.C. Yang, J. Koo, J.W. Shin, D. Go, J.H. Shim, J. Ah, Energy Technol. 7 (2019) 5–19. [47] T.-D. Hoang N. Nghiem Fermentation 7 2021 314 T.-D. Hoang, N. Nghiem, Fermentation 7 (2021) 314. [48] M. Jaganmohan Statista 2024 1 M. Jaganmohan, Statista (2024) 1. [49] A. Lanzini H. Madi V. Chiodo D. Papurello S. Maisano M. Santarelli J. Van Herle Prog. Energy Combust. Sci. 61 2017 150 188 A. Lanzini, H. Madi, V. Chiodo, D. Papurello, S. Maisano, M. Santarelli, J. Van herle, Prog. Energy Combust. Sci. 61 (2017) 150–188. [50] Empresa de Pesquisa Energética, Documento de Apoio Ao PNE 2050 - Eletromobilidade e Biocombustíveis, 2020. [51] C. Xu Q. Dai L. Gaines M. Hu A. Tukker B. Steubing Commun. Mater. 1 2020 99 C. Xu, Q. Dai, L. Gaines, M. Hu, A. Tukker, B. Steubing, Commun. Mater. 1 (2020) 99. [52] J. Deng C. Bae A. Denlinger T. Miller Joule 4 2020 511 515 J. Deng, C. Bae, A. Denlinger, T. Miller, Joule 4 (2020) 511–515. [53] A. Ponrouch M.R. Palacín Philos. Trans. R. Soc. A Math Phys. Eng. Sci. 377 2019 20180297 A. Ponrouch, M.R. Palacín, Philos. Trans. R. Soc. A Math. Phys. Eng. Sci. 377 (2019) 20180297. [54] C. Antônio Rufino Júnior E.R. Sanseverino P. Gallo D. Koch H.-G. Schweiger H. Zanin Renew. Sustain. Energy Rev. 157 2022 112078 C. Antônio Rufino Júnior, E.R. Sanseverino, P. Gallo, D. Koch, H.-G. Schweiger, H. Zanin, Renew. Sustain. Energy Rev. 157 (2022) 112078. [55] Z. Zhou V.K. Nadimpalli D.B. Pedersen V. Esposito Materials (Basel) 14 2021 3139 Z. Zhou, V.K. Nadimpalli, D.B. Pedersen, V. Esposito, Materials (Basel). 14 (2021) 3139. [56] A. Valente D. Iribarren J. Dufour Int. J. Hydrogen Energy 44 2019 20965 20977 A. Valente, D. Iribarren, J. Dufour, Int. J. Hydrogen Energy 44 (2019) 20965–20977. [57] S. Longo, M. Cellura, F. Guarino, M. Ferraro, V. Antonucci, G. Squadrito, in: Hydrogen Economy, Elsevier, 2017, pp. 139–169. [58] I. Garbayo D. Pla A. Morata L. Fonseca N. Sabaté A. Tarancón Energy Environ. Sci. 7 2014 3617 3629 I. Garbayo, D. Pla, A. Morata, L. Fonseca, N. Sabaté, A. Tarancón, Energy Environ. Sci. 7 (2014) 3617–3629. [59] Z. Zhu B. Hu M.C. Tucker Int. J. Hydrogen Energy 59 2024 316 321 Z. Zhu, B. Hu, M.C. Tucker, Int. J. Hydrogen Energy 59 (2024) 316–321. [60] Z. Gao L.V. Mogni E.C. Miller J.G. Railsback S.A. Barnett Energy Environ. Sci. 9 2016 1602 1644 Z. Gao, L. V. Mogni, E.C. Miller, J.G. Railsback, S.A. Barnett, Energy Environ. Sci. 9 (2016) 1602–1644. [61] E. Dogdibegovic Y. Fukuyama M.C. Tucker J. Power Sources 492 2021 4 6 E. Dogdibegovic, Y. Fukuyama, M.C. Tucker, J. Power Sources 492 (2021) 4–6. [62] Fuel Cells Bull. 2016 (2016) 3. [63] M.M. Whiston I.M.L. Azevedo S. Litster C. Samaras K.S. Whitefoot J.F. Whitacre Joule 3 2019 2060 2065 M.M. Whiston, I.M.L. Azevedo, S. Litster, C. Samaras, K.S. Whitefoot, J.F. Whitacre, Joule 3 (2019) 2060–2065. [64] Z. Liu J. Song J. Kubal N. Susarla K.W. Knehr E. Islam P. Nelson S. Ahmed Energy Policy 158 2021 112564 Z. Liu, J. Song, J. Kubal, N. Susarla, K.W. Knehr, E. Islam, P. Nelson, S. Ahmed, Energy Policy 158 (2021) 112564. [65] X.N. Penisa M.T. Castro J.D.A. Pascasio E.A. Esparcia O. Schmidt J.D. Ocon Energies 13 2020 5276 X.N. Penisa, M.T. Castro, J.D.A. Pascasio, E.A. Esparcia, O. Schmidt, J.D. Ocon, Energies 13 (2020) 5276. [66] D. Panthi B. Choi Y. Du A. Tsutsumi Ceram. Int. 43 2017 10698 10707 D. Panthi, B. Choi, Y. Du, A. Tsutsumi, Ceram. Int. 43 (2017) 10698–10707. [67] L.A. Villas-boas F.M.L. Figueiredo D.P.F. De Souza F.M.B. Marques Solid State Ionics 262 2014 522 525 L.A. Villas-boas, F.M.L. Figueiredo, D.P.F. De Souza, F.M.B. Marques, Solid State Ionics 262 (2014) 522–525. [68] D.P. Fagg J.C.C. Abrantes D. Pérez-Coll P. Núñez V.V. Kharton J.R. Frade Electrochim. Acta 48 2003 1023 1029 D.P. Fagg, J.C.C. Abrantes, D. Pérez-Coll, P. Núñez, V. V. Kharton, J.R. Frade, Electrochim. Acta 48 (2003) 1023–1029. [69] G.S. Lewis A. Atkinson B.C.H. Steele J. Mater. Sci. Lett. 20 2001 1155 1157 G.S. Lewis, A. Atkinson, B.C.H. Steele, J. Mater. Sci. Lett. 20 (2001) 1155–1157. [70] X. Wang K. Wei J. Kang S. Shen R.A. Budiman X. Ou F. Zhou Y. Ling Electrochim. Acta 264 2018 109 118 X. Wang, K. Wei, J. Kang, S. Shen, R.A. Budiman, X. Ou, F. Zhou, Y. Ling, Electrochim. Acta 264 (2018) 109–118. [71] Y.H. Lee H. Ren E.A. Wu E.E. Fullerton Y.S. Meng N.Q. Minh Nano Lett. 20 2020 2943 2949 Y.H. Lee, H. Ren, E.A. Wu, E.E. Fullerton, Y.S. Meng, N.Q. Minh, Nano Lett. 20 (2020) 2943–2949. [72] A.S. Painter Y.L. Huang E.D. Wachsman J. Power Sources 360 2017 391 398 A.S. Painter, Y.L. Huang, E.D. Wachsman, J. Power Sources 360 (2017) 391–398. [73] E.C. Subbarao Adv. Ceram. 1 1981 1 24 E. C. Subbarao, Adv. Ceram. 1 (1981) 1–24. [74] X. Chen W. Ni X. Du Z. Sun T. Zhu Q. Zhong M. Han J. Mater. Sci. Technol. 35 2019 695 701 X. Chen, W. Ni, X. Du, Z. Sun, T. Zhu, Q. Zhong, M. Han, J. Mater. Sci. Technol. 35 (2019) 695–701. [75] P. Coddet H. Lin Liao C. Coddet Adv. Manuf. 2 2014 212 221 P. Coddet, H. lin Liao, C. Coddet, Adv. Manuf. 2 (2014) 212–221. [76] Z. Zhu Z. Gong P. Qu Z. Li S.A. Rasaki Z. Liu P. Wang C. Liu C. Lao Z. Chen J. Adv. Ceram. 10 2021 279 290 Z. Zhu, Z. Gong, P. Qu, Z. Li, S.A. Rasaki, Z. Liu, P. Wang, C. Liu, C. Lao, Z. Chen, J. Adv. Ceram. 10 (2021) 279–290. [77] B. Admasu Beshiwork X. Wan M. Xu H. Guo B. Sirak Teketel Y. Chen J. Song Chen T. Li E. Traversa J. Energy Chem. 88 2024 306 316 B. Admasu Beshiwork, X. Wan, M. Xu, H. Guo, B. Sirak Teketel, Y. Chen, J. Song Chen, T. Li, E. Traversa, J. Energy Chem. 88 (2024) 306–316. [78] S.J. Skinner J.A. Kilner Mater. Today 6 2003 30 37 S.J. Skinner, J.A. Kilner, Mater. Today 6 (2003) 30–37. [79] M. Asadikiya H. Sabarou M. Chen Y. Zhong RSC Adv. 6 2016 17438 17445 M. Asadikiya, H. Sabarou, M. Chen, Y. Zhong, RSC Adv. 6 (2016) 17438–17445. [80] I. Brodnikovska N. Korsunska L. Khomenkova Y. Polishchuk S. Lavoryk M. Brychevskyi Y. Brodnikovskyi O. Vasylyev Mater. Today Proc. 6 2019 79 85 I. Brodnikovska, N. Korsunska, L. Khomenkova, Y. Polishchuk, S. Lavoryk, M. Brychevskyi, Y. Brodnikovskyi, O. Vasylyev, Mater. Today Proc. 6 (2019) 79–85. [81] T. Selvaraj B. Johar S.F. Khor Mater. Chem. Phys. 222 2019 309 320 T. Selvaraj, B. Johar, S.F. Khor, Mater. Chem. Phys. 222 (2019) 309–320. [82] M.W. Barsoum Fundamentals of Ceramics 1st ed., 2003 IOP Publishing Ltd M.W. Barsoum, Fundamentals of Ceramics, 1st ed., IOP Publishing Ltd, 2003. [83] T. Götsch W. Wallisch M. Stöger-Pollach B. Klötzer S. Penner AIP Adv. 6 2016 025119 T. Götsch, W. Wallisch, M. Stöger-Pollach, B. Klötzer, S. Penner, AIP Adv. 6 (2016) 025119. [84] T. Shimizu K. Katayama T. Kiguchi A. Akama T.J. Konno O. Sakata H. Funakubo Sci. Rep. 6 2016 1 8 T. Shimizu, K. Katayama, T. Kiguchi, A. Akama, T.J. Konno, O. Sakata, H. Funakubo, Sci. Rep. 6 (2016) 1–8. [85] K. Huang J.B. Goodenough Solid Oxide Fuel Cell Technology: Principles, Performance and Operations 2009 CRC Press, Woodhead Publishing Limited Boston NY K. Huang, J.B. Goodenough, Solid Oxide Fuel Cell Technology: Principles, Performance and Operations, CRC Press, Woodhead Publishing Limited, Boston NY, 2009. [86] X. Li X. Kuang J. Sun Inorg. Chem. Front. 8 2021 1374 1398 X. Li, X. Kuang, J. Sun, Inorg. Chem. Front. 8 (2021) 1374–1398. [87] M. Mamivand M.A. Zaeem H. El Kadiri Comput. Mater. Sci. 77 2013 304 311 M. Mamivand, M.A. Zaeem, H. El Kadiri, Comput. Mater. Sci. 77 (2013) 304–311. [88] M. Mamivand M.A. Zaeem H. El Kadiri L.Q. Chen Acta Mater. 61 2013 5223 5235 M. Mamivand, M.A. Zaeem, H. El Kadiri, L.Q. Chen, Acta Mater. 61 (2013) 5223–5235. [89] B. Basu J. Vleugels O. Van Der Biest Mater. Sci. Eng. A 366 2004 338 347 B. Basu, J. Vleugels, O. Van Der Biest, Mater. Sci. Eng. A 366 (2004) 338–347. [90] S. Deville G. Guénin J. Chevalier Acta Mater. 52 2004 5697 5707 S. Deville, G. Guénin, J. Chevalier, Acta Mater. 52 (2004) 5697–5707. [91] S. Deville G. Guénin J. Chevalier Acta Mater. 52 2004 5709 5721 S. Deville, G. Guénin, J. Chevalier, Acta Mater. 52 (2004) 5709–5721. [92] P.M. Kelly L.R.F. Rose Prog. Mater. Sci. 47 2002 463 557 P.M. Kelly, L.R.F. Rose, Prog. Mater. Sci. 47 (2002) 463–557. [93] N. Shibata J. Katamura A. Kuwabara Y. Ikuhara T. Sakuma Mater. Sci. Eng. A 312 2001 90 98 N. Shibata, J. Katamura, A. Kuwabara, Y. Ikuhara, T. Sakuma, Mater. Sci. Eng. A 312 (2001) 90–98. [94] A.N. Cormack Kinet. Mass Transp. Silic. Oxide Syst. 7 1986 177 186 A.N. Cormack, Kinet. Mass Transp. Silic. Oxide Syst. 7 (1986) 177–186. [95] F.A. Kroger H.J. Vink J. Phys. Chem. Solids 5 1958 208 223 F.A. Kroger, H.J. Vink, J. Phys. Chem. Solids 5 (1958) 208–223. [96] A.J. Moulson J.M. Herbert Electroceramics: Materials, Properties, Applications second ed. 2003 Wiley Sussex A.J. Moulson, J.M. Herbert, Electroceramics: Materials, Properties, Applications., Second, Wiley, Sussex, 2003. [97] M. Mogensen D. Lybye N. Bonanos P.V. Hendriksen F.W. Poulsen Solid State Ionics 174 2004 279 286 M. Mogensen, D. Lybye, N. Bonanos, P. V. Hendriksen, F.W. Poulsen, Solid State Ionics 174 (2004) 279–286. [98] D. Panthi N. Hedayat Y. Du J. Adv. Ceram. 7 2018 325 335 D. Panthi, N. Hedayat, Y. Du, J. Adv. Ceram. 7 (2018) 325–335. [99] F.M.L. Figueiredo F.M.B. Marques Wires Energy Environ. 2 2013 52 72 F.M.L. Figueiredo, F.M.B. Marques, Wires Energy Environ. 2 (2013) 52–72. [100] K.C. Wincewicz J.S. Cooper J. Power Sources 140 2005 280 296 K.C. Wincewicz, J.S. Cooper, J. Power Sources 140 (2005) 280–296. [101] J.M. Ralph A.C. Schoeler M. Krumpelt J. Mater. Sci. 36 2001 1161 1172 J.M. Ralph, A.C. Schoeler, M. Krumpelt, J. Mater. Sci. 36 (2001) 1161–1172. [102] M. Irshad K. Siraj R. Raza A. Ali P. Tiwari B. Zhu A. Rafique A. Ali M. Kaleem Ullah A. Usman Appl. Sci. 6 2016 75 M. Irshad, K. Siraj, R. Raza, A. Ali, P. Tiwari, B. Zhu, A. Rafique, A. Ali, M. Kaleem Ullah, A. Usman, Appl. Sci. 6 (2016) 75. [103] A.J. Jacobson Chem. Mater. 22 2010 660 674 A.J. Jacobson, Chem. Mater. 22 (2010) 660–674. [104] E. Ivers-Tiffée A. Weber D. Herbstritt J. Eur. Ceram. Soc. 21 2001 1805 1811 E. Ivers-Tiffée, A. Weber, D. Herbstritt, J. Eur. Ceram. Soc. 21 (2001) 1805–1811. [105] C.S. Montross H. Yokokawa M. Dokiya Br. Ceram. Trans. 101 2002 85 93 C.S. Montross, H. Yokokawa, M. Dokiya, Br. Ceram. Trans. 101 (2002) 85–93. [106] F. Tietz Ionics (Kiel). 5 1999 129 139 F. Tietz, Ionics (Kiel). 5 (1999) 129–139. [107] K. Hilpert D. Das M. Miller D.H. Peck R. Weiß J. Electrochem. Soc. 143 1996 3642 3647 K. Hilpert, D. Das, M. Miller, D.H. Peck, R. Weiß, J. Electrochem. Soc. 143 (1996) 3642–3647. [108] J. Wu X. Liu J. Mater. Sci. Technol. 26 2010 293 305 J. Wu, X. Liu, J. Mater. Sci. Technol. 26 (2010) 293–305. [109] R. Sachitanand M. Sattari J.E. Svensson J. Froitzheim Int. J. Hydrogen Energy 38 2013 15328 15334 R. Sachitanand, M. Sattari, J.E. Svensson, J. Froitzheim, Int. J. Hydrogen Energy 38 (2013) 15328–15334. [110] I. Aznam J.C.W. Mah A. Muchtar M.R. Somalu M.J. Ghazali J. Adv. Res. Fluid Mech. Therm. Sci. 59 2019 148 155 I. Aznam, J.C.W. Mah, A. Muchtar, M.R. Somalu, M.J. Ghazali, J. Adv. Res. Fluid Mech. Therm. Sci. 59 (2019) 148–155. [111] E.D. Wachsman K.T. Lee Science. 334 2011 935 939 E.D. Wachsman, K.T. Lee, Science. 334 (2011) 935–939. [112] H. Tu U. Stimming J. Power Sources 127 2004 284 293 H. Tu, U. Stimming, J. Power Sources 127 (2004) 284–293. [113] S. De Souza S.J. Visco L.C. De Jonghe Solid State Ionics 98 1997 57 61 S. De Souza, S.J. Visco, L.C. De Jonghe, Solid State Ionics 98 (1997) 57–61. [114] P. Aguiar C.S. Adjiman N.P. Brandon J. Power Sources 138 2004 120 136 P. Aguiar, C.S. Adjiman, N.P. Brandon, J. Power Sources 138 (2004) 120–136. [115] Y.Y. Chen W.C.J. Wei Solid State Ionics 177 2006 351 357 Y.Y. Chen, W.C.J. Wei, Solid State Ionics 177 (2006) 351–357. [116] K. Chen Z. Lü N. Ai X. Huang Y. Zhang X. Xin R. Zhu W. Su J. Power Sources 160 2006 436 438 K. Chen, Z. Lü, N. Ai, X. Huang, Y. Zhang, X. Xin, R. Zhu, W. Su, J. Power Sources 160 (2006) 436–438. [117] H. Moon S.D. Kim S.H. Hyun H.S. Kim Int. J. Hydrogen Energy 33 2008 1758 1768 H. Moon, S.D. Kim, S.H. Hyun, H.S. Kim, Int. J. Hydrogen Energy 33 (2008) 1758–1768. [118] J. Ding J. Liu Solid State Ionics 179 2008 1246 1249 J. Ding, J. Liu, Solid State Ionics 179 (2008) 1246–1249. [119] N. Bailly S. Georges E. Djurado Solid State Ionics 222–223 2012 1 7 N. Bailly, S. Georges, E. Djurado, Solid State Ionics 222–223 (2012) 1–7. [120] N. Shi S. Yu S. Chen L. Ge H. Chen L. Guo Ceram. Int. 43 2017 182 186 N. Shi, S. Yu, S. Chen, L. Ge, H. Chen, L. Guo, Ceram. Int. 43 (2017) 182–186. [121] X. Guo J. Maier Adv. Funct. Mater. 19 2009 96 101 X. Guo, J. Maier, Adv. Funct. Mater. 19 (2009) 96–101. [122] X. Guo J. Eur. Ceram. Soc. 16 1996 575 578 X. Guo, J. Eur. Ceram. Soc. 16 (1996) 575–578. [123] X. Guo Solid State Ionics 81 1995 235 242 X. Guo, Solid State Ionics 81 (1995) 235–242. [124] X. Guo Y. Ding J. Electrochem. Soc. 151 2004 1 7 X. Guo, Y. Ding, J. Electrochem. Soc. 151 (2004) 1–7. [125] M. Mogensen Solid State Ionics 129 2000 63 94 M. Mogensen, Solid State Ionics 129 (2000) 63–94. [126] V.V. Kharton F.M. Figueiredo L. Navarro E.N. Naumovich A.A. Kovalevsky A.V. Yaremchenko A.P. Viskup A. Carneiro F.M.B. Marques J.R. Frade J. Mater. Sci. 36 2001 1105 1117 V. V. Kharton, F.M. Figueiredo, L. Navarro, E.N. Naumovich, A.A. Kovalevsky, A. V. Yaremchenko, A.P. Viskup, A. Carneiro, F.M.B. Marques, J.R. Frade, J. Mater. Sci. 36 (2001) 1105–1117. [127] V. Kharton F. Marques A. Atkinson Solid State Ionics 174 2004 135 149 V. Kharton, F. Marques, A. Atkinson, Solid State Ionics 174 (2004) 135–149. [128] J. Liu W. Weppner Ionics (Kiel). 5 1999 115 121 J. Liu, W. Weppner, Ionics (Kiel). 5 (1999) 115–121. [129] S. Wang T. Kobayashi M. Dokiya T. Hashimoto J. Electrochem. Soc. 147 2000 3606 S. Wang, T. Kobayashi, M. Dokiya, T. Hashimoto, J. Electrochem. Soc. 147 (2000) 3606. [130] Y. Xiong K. Yamaji T. Horita N. Sakai H. Yokokawa J. Electrochem. Soc. 149 2002 E450 Y. Xiong, K. Yamaji, T. Horita, N. Sakai, H. Yokokawa, J. Electrochem. Soc. 149 (2002) E450. [131] H.L. Tuller A.S. Nowick J. Phys. Chem. Solids 38 1977 859 867 H.L. Tuller, A.S. Nowick, J. Phys. Chem. Solids 38 (1977) 859–867. [132] M. Gautam A. Ahuja A. Sinha J. Sharma P.K. Patro A. Venkatasubramanian Bull. Mater. Sci. 43 2020 239 M. Gautam, A. Ahuja, A. Sinha, J. Sharma, P.K. Patro, A. Venkatasubramanian, Bull. Mater. Sci. 43 (2020) 239. [133] H. Hayashi M. Kanoh C.J. Quan H. Inaba S. Wang M. Dokiya H. Tagawa Solid State Ionics 132 2000 227 233 H. Hayashi, M. Kanoh, C.J. Quan, H. Inaba, S. Wang, M. Dokiya, H. Tagawa, Solid State Ionics 132 (2000) 227–233. [134] R. Muccillo E.N.S. Muccillo F.C. Fonseca D.Z. de Florio J. Electrochem. Soc. 155 2008 B232 R. Muccillo, E.N.S. Muccillo, F.C. Fonseca, D.Z. de Florio, J. Electrochem. Soc. 155 (2008) B232. [135] L. Fan C. Li L. van Biert S.H. Zhou A.N. Tabish A. Mokhov P.V. Aravind W. Cai Renew. Sustain. Energy Rev. 166 2022 112646 L. Fan, C. Li, L. van Biert, S.H. Zhou, A.N. Tabish, A. Mokhov, P.V. Aravind, W. Cai, Renew. Sustain. Energy Rev. 166 (2022) 112646. [136] L. Fan C. Li P.V. Aravind W. Cai M. Han N. Brandon J. Power Sources 538 2022 231573 L. Fan, C. Li, P.V. Aravind, W. Cai, M. Han, N. Brandon, J. Power Sources 538 (2022) 231573. [137] T.M. Gür Prog. Energy Combust. Sci. 54 2016 1 64 T.M. Gür, Prog. Energy Combust. Sci. 54 (2016) 1–64. [138] B. Hu F. Rosner H. Breunig A. Sarycheva R. Kostecki M.C. Tucker Int. J. Hydrogen Energy 48 2023 33537 33547 B. Hu, F. Rosner, H. Breunig, A. Sarycheva, R. Kostecki, M.C. Tucker, Int. J. Hydrogen Energy 48 (2023) 33537–33547. [139] Y. Lyu J. Xie D. Wang J. Wang J. Mater. Sci. 55 2020 7184 7207 Y. Lyu, J. Xie, D. Wang, J. Wang, J. Mater. Sci. 55 (2020) 7184–7207. [140] S.C. Singhal K. Kendall High-Temperature Solid Oxide Fuel Cells: Fundamentals, Design and Applications first ed. 2003 Elsevier Science S.C. Singhal, K. Kendall, High-Temperature Solid Oxide Fuel Cells: Fundamentals, Design and Applications, 1st ed., Elsevier Science, 2003. [141] N.Q. Minh T. Takahashi Science and Technology of Ceramic Fuel Cells first ed. 1995 Elsevier N.Q. Minh, T. Takahashi, Science and Technology of Ceramic Fuel Cells, 1st ed., Elsevier, 1995. [142] J.P.P. Huijsmans Curr. Opin. Solid State Mater. Sci. 5 2001 317 323 J.P.P. Huijsmans, Curr. Opin. Solid State Mater. Sci. 5 (2001) 317–323. [143] K. Hassmann Fuel Cells 1 2001 78 84 K. Hassmann, Fuel Cells 1 (2001) 78–84. [144] F.J. Gardner M.J. Day N.P. Brandon M.N. Pashley M. Cassidy J. Power Sources 86 2000 122 129 F.J. Gardner, M.J. Day, N.P. Brandon, M.N. Pashley, M. Cassidy, J. Power Sources 86 (2000) 122–129. [145] T. Proffen R.B. Neder F. Frey W. Assmus Acta Crystallogr. Sect. B 49 1993 599 604 T. Proffen, R.B. Neder, F. Frey, W. Assmus, Acta Crystallogr. Sect. B 49 (1993) 599–604. [146] T. Mori J. Drennan J. Electroceramics 17 2006 749 757 T. Mori, J. Drennan, J. Electroceramics 17 (2006) 749–757. [147] R. Devanathan W.J. Weber S.C. Singhal J.D. Gale Solid State Ionics 177 2006 1251 1258 R. Devanathan, W.J. Weber, S.C. Singhal, J.D. Gale, Solid State Ionics 177 (2006) 1251–1258. [148] A.K. Galwey M.E. Brown Proc. R Soc. London Ser. A Math. Phys. Sci. 450 1995 501 512 A.K. Galwey, M.E. Brown, Proc. R. Soc. London. Ser. A Math. Phys. Sci. 450 (1995) 501–512. [149] P. Qiu S. Sun X. Yang F. Chen C. Xiong L. Jia J. Li Int. J. Hydrogen Energy 46 2021 25208 25224 P. Qiu, S. Sun, X. Yang, F. Chen, C. Xiong, L. Jia, J. Li, Int. J. Hydrogen Energy 46 (2021) 25208–25224. [150] M. Mori T. Yamamoto H. Itoh H. Inaba H. Tagawa J. Electrochem. Soc. 145 1998 1374 1381 M. Mori, T. Yamamoto, H. Itoh, H. Inaba, H. Tagawa, J. Electrochem. Soc. 145 (1998) 1374–1381. [151] M. Ni D.Y.C. Leung M.K.H. Leung Int. J. Hydrogen Energy 32 2007 3238 3247 M. Ni, D.Y.C. Leung, M.K.H. Leung, Int. J. Hydrogen Energy 32 (2007) 3238–3247. [152] S. Sengodan R. Lana J. Humphreys D. Du W. Xu H. Wang S. Tao Renew. Sustain. Energy Rev. 82 2018 761 780 S. Sengodan, R. Lana, J. Humphreys, D. Du, W. Xu, H. Wang, S. Tao, Renew. Sustain. Energy Rev. 82 (2018) 761–780. [153] A. Atkinson S. Barnett R.J. Gorte J.T.S. Irvine A.J. McEvoy M. Mogensen S.C. Singhal J. Vohs Nat. Mater. 3 2004 17 27 A. Atkinson, S. Barnett, R.J. Gorte, J.T.S. Irvine, A.J. McEvoy, M. Mogensen, S.C. Singhal, J. Vohs, Nat. Mater. 3 (2004) 17–27. [154] I.S. Pieta R.G. Kadam P. Pieta D. Mrdenovic R. Nowakowski A. Bakandritsos O. Tomanec M. Petr M. Otyepka R. Kostecki M.A.M. Khan R. Zboril M.B. Gawande Adv. Mater. Interfaces 8 2021 2001822 I.S. Pieta, R.G. Kadam, P. Pieta, D. Mrdenovic, R. Nowakowski, A. Bakandritsos, O. Tomanec, M. Petr, M. Otyepka, R. Kostecki, M.A.M. Khan, R. Zboril, M.B. Gawande, Adv. Mater. Interfaces 8 (2021) 2001822. [155] L. Ye K. Xie J. Energy Chem. 54 2021 736 745 L. Ye, K. Xie, J. Energy Chem. 54 (2021) 736–745. [156] M. Liu M.J.B.M. Pourquie L. Fan W. Halliop V.R.M. Cobas A.H.M. Verkooijen P.V. Aravind Fuel Cells 13 2013 428 440 M. Liu, M.J.B.M. Pourquie, L. Fan, W. Halliop, V.R.M. Cobas, A.H.M. Verkooijen, P. V. Aravind, Fuel Cells 13 (2013) 428–440. [157] L. Afroz M. Rafaqat M.A. Ahmad T. Bashir M. Naqvi G. Abbas G.M. Mustafa R. Raza ACS Appl. Energy Mater. 6 2023 10918 10928 L. Afroz, M. Rafaqat, M.A. Ahmad, T. Bashir, M. Naqvi, G. Abbas, G.M. Mustafa, R. Raza, ACS Appl. Energy Mater. 6 (2023) 10918–10928. [158] H. Aslannejad L. Barelli A. Babaie S. Bozorgmehri Appl. Energy 177 2016 179 186 H. Aslannejad, L. Barelli, A. Babaie, S. Bozorgmehri, Appl. Energy 177 (2016) 179–186. [159] D.V. Demidov I.V. Mishin M.N. Mikhailov Int. J. Hydrogen Energy 36 2011 5941 5950 D. V. Demidov, I. V. Mishin, M.N. Mikhailov, Int. J. Hydrogen Energy 36 (2011) 5941–5950. [160] A. Baldinelli L. Barelli G. Bidini A. Di Michele R. Vivani Energy Convers. Manag. 124 2016 492 503 A. Baldinelli, L. Barelli, G. Bidini, A. Di Michele, R. Vivani, Energy Convers. Manag. 124 (2016) 492–503. [161] J. Hanna W.Y. Lee Y. Shi A.F. Ghoniem Prog. Energy Combust. Sci. 40 2014 74 111 J. Hanna, W.Y. Lee, Y. Shi, A.F. Ghoniem, Prog. Energy Combust. Sci. 40 (2014) 74–111. [162] H. Qin Z. Zhu Q. Liu Y. Jing R. Raza S. Imran M. Singh G. Abbas B. Zhu Energy Environ. Sci. 4 2011 1273 1276 H. Qin, Z. Zhu, Q. Liu, Y. Jing, R. Raza, S. Imran, M. Singh, G. Abbas, B. Zhu, Energy Environ. Sci. 4 (2011) 1273–1276. [163] M. Ma X. Yang J. Qiao W. Sun Z. Wang K. Sun J. Energy Chem. 56 2021 209 222 M. Ma, X. Yang, J. Qiao, W. Sun, Z. Wang, K. Sun, J. Energy Chem. 56 (2021) 209–222. [164] D. Cui A. Sciazko Y. Komatsu A. Nakamura T. Hara S. Wu R. Xiao N. Shikazono J. Energy Chem. 87 2023 359 367 D. Cui, A. Sciazko, Y. Komatsu, A. Nakamura, T. Hara, S. Wu, R. Xiao, N. Shikazono, J. Energy Chem. 87 (2023) 359–367. [165] R. Wang T. Wang Y. Ma T. Wei Z. Ye B. Chen D. Dong J. Power Sources 544 2022 231854 R. Wang, T. Wang, Y. Ma, T. Wei, Z. Ye, B. Chen, D. Dong, J. Power Sources 544 (2022) 231854. [166] B.J.M. Sarruf J.E. Hong R. Steinberger-Wilckens P.E.V. de Miranda Int. J. Hydrogen Energy 45 2020 5297 5308 B.J.M. Sarruf, J.E. Hong, R. Steinberger-Wilckens, P.E.V. de Miranda, Int. J. Hydrogen Energy 45 (2020) 5297–5308. [167] J. Garcia-Barriocanal A. Rivera-Calzada M. Varela Z. Sefrioui E. Iborra C. Leon S.J. Pennycook J. Santamaria Science 321 2008 676 680 J. Garcia-Barriocanal, A. Rivera-Calzada, M. Varela, Z. Sefrioui, E. Iborra, C. Leon, S.J. Pennycook, J. Santamaria, Science. 321 (2008) 676–680. [168] J. García-Barriocanal A. Rivera-Calzada M. Varela Z. Sefrioui E. Iborra C. Leon S.J. Pennycook J. Santamaría Science 324 2009 465 J. García-Barriocanal, A. Rivera-Calzada, M. Varela, Z. Sefrioui, E. Iborra, C. Leon, S.J. Pennycook, J. Santamaría, Science. 324 (2009) 465. [169] T. Wei P. Qiu J. Yang L. Jia B. Chi J. Pu J. Li J. Power Sources 484 2021 229199 T. Wei, P. Qiu, J. Yang, L. Jia, B. Chi, J. Pu, J. Li, J. Power Sources 484 (2021) 229199. [170] Y. Chen B. deGlee Y. Tang Z. Wang B. Zhao Y. Wei L. Zhang S. Yoo K. Pei J.H. Kim Y. Ding P. Hu F.F. Tao M. Liu Nat. Energy 3 2018 1042 1050 Y. Chen, B. deGlee, Y. Tang, Z. Wang, B. Zhao, Y. Wei, L. Zhang, S. Yoo, K. Pei, J.H. Kim, Y. Ding, P. Hu, F.F. Tao, M. Liu, Nat. Energy 3 (2018) 1042–1050. [171] Z. Lyu Y. Wang A. Sciazko H. Li Y. Komatsu Z. Sun K. Sun N. Shikazono M. Han J. Energy Chem. 87 2023 32 41 Z. Lyu, Y. Wang, A. Sciazko, H. Li, Y. Komatsu, Z. Sun, K. Sun, N. Shikazono, M. Han, J. Energy Chem. 87 (2023) 32–41. [172] K. Develos-Bagarinao T. Ishiyama H. Kishimoto H. Shimada K. Yamaji Nat. Commun. 12 2021 3979 K. Develos-Bagarinao, T. Ishiyama, H. Kishimoto, H. Shimada, K. Yamaji, Nat. Commun. 12 (2021) 3979. [173] T. Li X. Lu M.F. Rabuni M.F. Rabuni B. Wang N.M. Farandos G.H. Kelsall D.J.L. Brett P.R. Shearing M. Ouyang N.P. Brandon K. Li Energy Environ. Sci. 13 2020 1879 1887 T. Li, X. Lu, M.F. Rabuni, M.F. Rabuni, B. Wang, N.M. Farandos, G.H. Kelsall, D.J.L. Brett, P.R. Shearing, M. Ouyang, N.P. Brandon, K. Li, Energy Environ. Sci. 13 (2020) 1879–1887. [174] Y. Zhou X. Xin J. Li X. Ye C. Xia S. Wang Z. Zhan Int. J. Hydrogen Energy 39 2014 2279 2285 Y. Zhou, X. Xin, J. Li, X. Ye, C. Xia, S. Wang, Z. Zhan, Int. J. Hydrogen Energy 39 (2014) 2279–2285. [175] Y. Zhou X. Meng X. Liu X. Pan J. Li X. Ye H. Nie C. Xia S. Wang Z. Zhan J. Power Sources 267 2014 148 154 Y. Zhou, X. Meng, X. Liu, X. Pan, J. Li, X. Ye, H. Nie, C. Xia, S. Wang, Z. Zhan, J. Power Sources 267 (2014) 148–154. [176] X.F. Ye J. Zhou S.R. Wang F.R. Zeng T.L. Wen Z.L. Zhan Int. J. Hydrogen Energy 37 2012 505 510 X.F. Ye, J. Zhou, S.R. Wang, F.R. Zeng, T.L. Wen, Z.L. Zhan, Int. J. Hydrogen Energy 37 (2012) 505–510. [177] E. Dogdibegovic F. Shen R. Wang I. Robinson G.Y. Lau M.C. Tucker ECS Trans. 91 2019 877 885 E. Dogdibegovic, F. Shen, R. Wang, I. Robinson, G.Y. Lau, M.C. Tucker, ECS Trans. 91 (2019) 877–885. [178] E. Dogdibegovic R. Wang G.Y. Lau A. Karimaghaloo M.H. Lee M.C. Tucker J. Power Sources 437 2019 226935 E. Dogdibegovic, R. Wang, G.Y. Lau, A. Karimaghaloo, M.H. Lee, M.C. Tucker, J. Power Sources 437 (2019) 226935. [179] E. Dogdibegovic R. Wang G.Y. Lau M.C. Tucker J. Power Sources 410–411 2019 91 98 E. Dogdibegovic, R. Wang, G.Y. Lau, M.C. Tucker, J. Power Sources 410–411 (2019) 91–98. [180] J. Mao E. Wang H. Wang M. Ouyang Y. Chen H. Hu L. Lu D. Ren Y. Liu Renew. Sustain. Energy Rev. 185 2023 113597 J. Mao, E. Wang, H. Wang, M. Ouyang, Y. Chen, H. Hu, L. Lu, D. Ren, Y. Liu, Renew. Sustain. Energy Rev. 185 (2023) 113597. [181] V.A. Rojek-Wöckner A.K. Opitz M. Brandner J. Mathé M. Bram J. Power Sources 328 2016 65 74 V.A. Rojek-Wöckner, A.K. Opitz, M. Brandner, J. Mathé, M. Bram, J. Power Sources 328 (2016) 65–74. [182] A. Nenning C. Bischof J. Fleig M. Bram A.K. Opitz Energies 13 2020 5 9 A. Nenning, C. Bischof, J. Fleig, M. Bram, A.K. Opitz, Energies 13 (2020) 5–9. [183] C. Bischof A. Nenning A. Malleier L. Martetschläger A. Gladbach W. Schafbauer A.K. Opitz M. Bram Int. J. Hydrogen Energy 44 2019 31475 31487 C. Bischof, A. Nenning, A. Malleier, L. Martetschläger, A. Gladbach, W. Schafbauer, A.K. Opitz, M. Bram, Int. J. Hydrogen Energy 44 (2019) 31475–31487. [184] M. Dewa M.A. Elharati A.M. Hussain Y. Miura D. Song Y. Fukuyama Y. Furuya N. Dale X. Zhang O.G. Marin-Flores D. Wu M.G. Norton S. Ha J. Power Sources 541 2022 231625 M. Dewa, M.A. Elharati, A.M. Hussain, Y. Miura, D. Song, Y. Fukuyama, Y. Furuya, N. Dale, X. Zhang, O.G. Marin-Flores, D. Wu, M.G. Norton, S. Ha, J. Power Sources 541 (2022) 231625. [185] L. Yang C. Yan W. Cao Z. Liu B. Song S. Wen C. Zhang Y. Shi S. Yang Acta Mater. 181 2019 49 66 L. Yang, C. Yan, W. Cao, Z. Liu, B. Song, S. Wen, C. Zhang, Y. Shi, S. Yang, Acta Mater. 181 (2019) 49–66. [186] M.C. Tucker Energy Technol. 5 2017 2175 2181 M.C. Tucker, Energy Technol. 5 (2017) 2175–2181. [187] P. Blennow J. Hjelm T. Klemensø A. Persson K. Brodersen A. Srivastava H. Frandsen M. Lundberg S. Ramousse M. Mogensen ECS Trans. 25 2009 701 710 P. Blennow, J. Hjelm, T. Klemensø, A. Persson, K. Brodersen, A. Srivastava, H. Frandsen, M. Lundberg, S. Ramousse, M. Mogensen, ECS Trans. 25 (2009) 701–710. [188] J. Tan D. Lee J. Ahn B. Kim J. Kim J. Moon J. Mater. Chem. A 6 2018 18133 18142 J. Tan, D. Lee, J. Ahn, B. Kim, J. Kim, J. Moon, J. Mater. Chem. A 6 (2018) 18133–18142. [189] P. Blennow J. Hjelm T. Klemensø S. Ramousse A. Kromp A. Leonide A. Weber J. Power Sources 196 2011 7117 7125 P. Blennow, J. Hjelm, T. Klemensø, S. Ramousse, A. Kromp, A. Leonide, A. Weber, J. Power Sources 196 (2011) 7117–7125. [190] Y. Miura S. Takemiya Y. Fukuyama T. Kato S. Taniguchi K. Sasaki Int. J. Hydrogen Energy 48 2023 25487 25498 Y. Miura, S. Takemiya, Y. Fukuyama, T. Kato, S. Taniguchi, K. Sasaki, Int. J. Hydrogen Energy 48 (2023) 25487–25498. [191] A. Babaei S.P. Jiang J. Li J. Electrochem. Soc. 156 2009 B1022 A. Babaei, S.P. Jiang, J. Li, J. Electrochem. Soc. 156 (2009) B1022. [192] A. Álvarez Moreno T. Ramirez-Reina S. Ivanova A.C. Roger M.Á. Centeno J.A. Odriozola Front. Chem. 9 2021 1 10 A. Álvarez Moreno, T. Ramirez-Reina, S. Ivanova, A.C. Roger, M.Á. Centeno, J.A. Odriozola, Front. Chem. 9 (2021) 1–10. [193] H. Shi C. Su R. Ran J. Cao Z. Shao Prog. Nat. Sci. Mater. Int. 30 2020 764 774 H. Shi, C. Su, R. Ran, J. Cao, Z. Shao, Prog. Nat. Sci. Mater. Int. 30 (2020) 764–774. [194] F. Han R. Mücke T. Van Gestel A. Leonide N.H. Menzler H.P. Buchkremer D. Stöver J. Power Sources 218 2012 157 162 F. Han, R. Mücke, T. Van Gestel, A. Leonide, N.H. Menzler, H.P. Buchkremer, D. Stöver, J. Power Sources 218 (2012) 157–162. [195] S. Opakhai K. Kuterbekov Energies 16 2023 4700 S. Opakhai, K. Kuterbekov, Energies 16 (2023) 4700. [196] G. Chasta Himanshu M.S. Dhaka Int. J. Energy Res. 46 2022 14627 14658 G. Chasta, Himanshu, M.S. Dhaka, Int. J. Energy Res. 46 (2022) 14627–14658. [197] E. Gomes G.C. Mather F.M. Figueiredo F.M.B. Marques Monatshefte Für Chemie - Chem. Mon. 140 2009 1041 1052 E. Gomes, G.C. Mather, F.M. Figueiredo, F.M.B. Marques, Monatshefte Für Chemie - Chem. Mon. 140 (2009) 1041–1052. [198] M. Haydn K. Ortner T. Franco S. Uhlenbruck N.H. Menzler D. Stöver G. Bräuer A. Venskutonis L.S. Sigl H.P. Buchkremer R. Vaßen J. Power Sources 256 2014 52 60 M. Haydn, K. Ortner, T. Franco, S. Uhlenbruck, N.H. Menzler, D. Stöver, G. Bräuer, A. Venskutonis, L.S. Sigl, H.P. Buchkremer, R. Vaßen, J. Power Sources 256 (2014) 52–60. [199] R. Hui Z. Wang O. Kesler L. Rose J. Jankovic S. Yick R. Maric D. Ghosh J. Power Sources 170 2007 308 323 R. Hui, Z. Wang, O. Kesler, L. Rose, J. Jankovic, S. Yick, R. Maric, D. Ghosh, J. Power Sources 170 (2007) 308–323. [200] K. Du C. Song M. Liu T. Liu K. Wen H. Liao C. Yang Int. J. Hydrogen Energy 50 2024 1133 1141 K. Du, C. Song, M. Liu, T. Liu, K. Wen, H. Liao, C. Yang, Int. J. Hydrogen Energy 50 (2024) 1133–1141. [201] E. Hermawan G. Sang Lee G. Sik Kim H. Chul Ham J. Han S. Pil Yoon Ceram. Int. 43 2017 10450 10459 E. Hermawan, G. Sang Lee, G. Sik Kim, H. Chul Ham, J. Han, S. Pil Yoon, Ceram. Int. 43 (2017) 10450–10459. [202] D. Marcano G. Mauer R. Vaßen A. Weber Surf. Coatings Technol. 318 2017 170 177 D. Marcano, G. Mauer, R. Vaßen, A. Weber, Surf. Coatings Technol. 318 (2017) 170–177. [203] M. Zhang C. Song M. Liu Y. Yang K. Du T. Liu A. Zhao K. Wen C. Deng H. Liao K. Zhou Ceram. Int. 50 2024 44391 44400 M. Zhang, C. Song, M. Liu, Y. Yang, K. Du, T. Liu, A. Zhao, K. Wen, C. Deng, H. Liao, K. Zhou, Ceram. Int. 50 (2024) 44391–44400. [204] M. Haydn K. Ortner T. Franco N.H. Menzler A. Venskutonis L.S. Sigl Powder Metall. 56 2013 382 387 M. Haydn, K. Ortner, T. Franco, N.H. Menzler, A. Venskutonis, L.S. Sigl, Powder Metall. 56 (2013) 382–387. [205] D. Roehrens U. Packbier Q. Fang L. Blum D. Sebold M. Bram N. Menzler Materials (Basel) 9 2016 762 D. Roehrens, U. Packbier, Q. Fang, L. Blum, D. Sebold, M. Bram, N. Menzler, Materials (Basel). 9 (2016) 762. [206] S. Sønderby A. Aijaz U. Helmersson K. Sarakinos P. Eklund Surf. Coatings Technol. 240 2014 1 6 S. Sønderby, A. Aijaz, U. Helmersson, K. Sarakinos, P. Eklund, Surf. Coatings Technol. 240 (2014) 1–6. [207] S. Sønderby T. Klemensø B.H. Christensen K.P. Almtoft J. Lu L.P. Nielsen P. Eklund J. Power Sources 267 2014 452 458 S. Sønderby, T. Klemensø, B.H. Christensen, K.P. Almtoft, J. Lu, L.P. Nielsen, P. Eklund, J. Power Sources 267 (2014) 452–458. [208] A. Hagen A.C. Wulff P. Zielke X. Sun B. Talic I. Ritucci H.L. Frandsen S.H. Jensen W.R. Kiebach P.V. Hendriksen Int. J. Hydrogen Energy 45 2020 29201 29211 A. Hagen, A.C. Wulff, P. Zielke, X. Sun, B. Talic, I. Ritucci, H.L. Frandsen, S.H. Jensen, W.R. Kiebach, P.V. Hendriksen, Int. J. Hydrogen Energy 45 (2020) 29201–29211. [209] J.-T. Gao L.-X. Cheng Y.-P. Wang C.-J. Li C.-X. Li J. Therm. Spray Technol. 29 2020 1708 1717 J.-T. Gao, L.-X. Cheng, Y.-P. Wang, C.-J. Li, C.-X. Li, J. Therm. Spray Technol. 29 (2020) 1708–1717. [210] M. Tanhaei M. Mozammel Ceram. Int. 43 2017 3035 3042 M. Tanhaei, M. Mozammel, Ceram. Int. 43 (2017) 3035–3042. [211] M. Zhang C. Song K. Lin M. Liu K. Du K. Wen T. Liu J. Mao X. Zhang H. Liao K. Zhou J. Therm. Spray Technol. 33 2024 964 975 M. Zhang, C. Song, K. Lin, M. Liu, K. Du, K. Wen, T. Liu, J. Mao, X. Zhang, H. Liao, K. Zhou, J. Therm. Spray Technol. 33 (2024) 964–975. [212] A.A. Solovyev A.V. Shipilova I.V. Ionov A.N. Kovalchuk S.V. Rabotkin V.O. Oskirko J. Electron. Mater. 45 2016 3921 3928 A.A. Solovyev, A. V. Shipilova, I. V. Ionov, A.N. Kovalchuk, S. V. Rabotkin, V.O. Oskirko, J. Electron. Mater. 45 (2016) 3921–3928. [213] B.-K. Park S.A. Barnett J. Mater. Chem. A 8 2020 11626 11631 B.-K. Park, S.A. Barnett, J. Mater. Chem. A 8 (2020) 11626–11631. [214] Y. Yang Y. Zhang M. Yan Sep. Purif. Technol. 298 2022 121627 Y. Yang, Y. Zhang, M. Yan, Sep. Purif. Technol. 298 (2022) 121627. [215] F. Liang J. Yang Y. Zhao Y. Zhou Z. Yan J. He Q. Yuan J. Wu P. Liu Z. Zhong M. Han Int. J. Hydrogen Energy 47 2022 36926 36952 F. Liang, J. Yang, Y. Zhao, Y. Zhou, Z. Yan, J. He, Q. Yuan, J. Wu, P. Liu, Z. Zhong, M. Han, Int. J. Hydrogen Energy 47 (2022) 36926–36952. [216] M. Tang Y. Niu W. Muhammad S. Muhammad Z. Zhong S. Muhammad Y. Pang Z. Wan N. Chen L. Qiao W. Lv Int. J. Hydrogen Energy 50 2024 618 632 M. Tang, Y. Niu, W. Muhammad, S. Muhammad, Z. Zhong, S. Muhammad, Y. Pang, Z. Wan, N. Chen, L. Qiao, W. Lv, Int. J. Hydrogen Energy 50 (2024) 618–632. [217] J.-T. Gao M.B. Hanif H.-Y. Zhang M. Motola C.-X. Li Chem. Eng. J. 478 2023 147352 J.-T. Gao, M.B. Hanif, H.-Y. Zhang, M. Motola, C.-X. Li, Chem. Eng. J. 478 (2023) 147352. [218] K. Du C. Song B. Yuan T. Liu K. Wen M. Liu J. Mao X. Zhang H. Liao J. Power Sources 621 2024 235298 K. Du, C. Song, B. Yuan, T. Liu, K. Wen, M. Liu, J. Mao, X. Zhang, H. Liao, J. Power Sources 621 (2024) 235298. [219] Y. Wang J. Gao W. Chen C. Li S. Zhang G. Yang C. Li J. Therm. Spray Technol. 29 2020 223 231 Y. Wang, J. Gao, W. Chen, C. Li, S. Zhang, G. Yang, C. Li, J. Therm. Spray Technol. 29 (2020) 223–231. [220] T. Ishihara J. Yan M. Enoki S. Okada H. Matsumoto J. Fuel Cell Sci. Technol. 5 2008 031205 T. Ishihara, J. Yan, M. Enoki, S. Okada, H. Matsumoto, J. Fuel Cell Sci. Technol. 5 (2008) 031205. [221] Y. Liu Z. Shao T. Mori S.P. Jiang Mater. Rep. Energy 1 2021 100003 Y. Liu, Z. Shao, T. Mori, S.P. Jiang, Mater. Rep. Energy 1 (2021) 100003. [222] B.C. Yang J. Koo J.W. Shin D. Go J.H. Shim J. An Energy Technol. 7 2019 5 19 B.C. Yang, J. Koo, J.W. Shin, D. Go, J.H. Shim, J. An, Energy Technol. 7 (2019) 5–19. [223] J. Gao Z. Wei M. Yuan Z. Wang Z. Lü Q. Li L. Xu B. Wei J. Energy Chem. 90 2024 600 609 J. Gao, Z. Wei, M. Yuan, Z. Wang, Z. Lü, Q. Li, L. Xu, B. Wei, J. Energy Chem. 90 (2024) 600–609. [224] C. Brugnoni U. Ducati M. Scagliotti Solid State Ionics 76 1995 177 182 C. Brugnoni, U. Ducati, M. Scagliotti, Solid State Ionics 76 (1995) 177–182. [225] A. Mitterdorfer L.J. Gauckler Solid State Ionics 111 1998 185 218 A. Mitterdorfer, L.J. Gauckler, Solid State Ionics 111 (1998) 185–218. [226] Z. Wang J.O. Berghaus S. Yick C. Decès-Petit W. Qu R. Hui R. Maric D. Ghosh J. Power Sources 176 2008 90 95 Z. Wang, J.O. Berghaus, S. Yick, C. Decès-Petit, W. Qu, R. Hui, R. Maric, D. Ghosh, J. Power Sources 176 (2008) 90–95. [227] M.R. Cesário A. de Macedo Frontiers in Ceramic Science 2017 Bentham Science Publishers Ltd. Sharjah M.R. Cesário, A. de Macedo, Frontiers in Ceramic Science, Bentham Science Publishers Ltd., Sharjah, 2017. [228] V. Vibhu A. Rougier C. Nicollet A. Flura J.C. Grenier J.M. Bassat Solid State Ionics 278 2015 32 37 V. Vibhu, A. Rougier, C. Nicollet, A. Flura, J.C. Grenier, J.M. Bassat, Solid State Ionics 278 (2015) 32–37. [229] Y.D. Zhen A.I.Y. Tok S.P. Jiang F.Y.C. Boey J. Power Sources 170 2007 61 66 Y.D. Zhen, A.I.Y. Tok, S.P. Jiang, F.Y.C. Boey, J. Power Sources 170 (2007) 61–66. [230] T. Komatsu R. Chiba H. Arai K. Sato J. Power Sources 176 2008 132 137 T. Komatsu, R. Chiba, H. Arai, K. Sato, J. Power Sources 176 (2008) 132–137. [231] E.S.C. Fan J. Kuhn O. Kesler J. Power Sources 316 2016 72 84 E.S.C. Fan, J. Kuhn, O. Kesler, J. Power Sources 316 (2016) 72–84. [232] Y.M. Kim P. Kim-Lohsoontorn S.W. Baek J. Bae Int. J. Hydrogen Energy 36 2011 3138 3146 Y.M. Kim, P. Kim-Lohsoontorn, S.W. Baek, J. Bae, Int. J. Hydrogen Energy 36 (2011) 3138–3146. [233] V. Cascos J.A. Alonso M.T. Fernández-Díaz Materials (Basel) 9 2016 1 12 V. Cascos, J.A. Alonso, M.T. Fernández-Díaz, Materials (Basel). 9 (2016) 1–12. [234] A. Aguadero J.A. Alonso D. Pérez-Coll C. De La Calle M.T. Fernández-Díaz J.B. Goodenough Chem. Mater. 22 2010 789 798 A. Aguadero, J.A. Alonso, D. Pérez-Coll, C. De La Calle, M.T. Fernández-Díaz, J.B. Goodenough, Chem. Mater. 22 (2010) 789–798. [235] A. Evans J. Martynczuk D. Stender C.W. Schneider T. Lippert M. Prestat Adv. Energy Mater. 5 2015 1 9 A. Evans, J. Martynczuk, D. Stender, C.W. Schneider, T. Lippert, M. Prestat, Adv. Energy Mater. 5 (2015) 1–9. [236] S. Hussain L. Yangping Energy Trans. 4 2020 113 126 S. Hussain, L. Yangping, Energy Transitions 4 (2020) 113–126. [237] M. Singh D. Zappa E. Comini Int. J. Hydrogen Energy 46 2021 27643 27674 M. Singh, D. Zappa, E. Comini, Int. J. Hydrogen Energy 46 (2021) 27643–27674. [238] L. Wehrle Y. Wang P. Boldrin N.P. Brandon O. Deutschmann A. Banerjee ACS Environ. Au 2 2022 42 64 L. Wehrle, Y. Wang, P. Boldrin, N.P. Brandon, O. Deutschmann, A. Banerjee, ACS Environ. Au 2 (2022) 42–64. [239] S. Molin B. Kusz M. Gazda P. Jasinski J. Power Sources 181 2008 31 37 S. Molin, B. Kusz, M. Gazda, P. Jasinski, J. Power Sources 181 (2008) 31–37. [240] I. Antepara I. Villarreal L.M. Rodríguez-Martínez N. Lecanda U. Castro A. Laresgoiti J. Power Sources 151 2005 103 107 I. Antepara, I. Villarreal, L.M. Rodríguez-Martínez, N. Lecanda, U. Castro, A. Laresgoiti, J. Power Sources 151 (2005) 103–107. [241] X. Deng P. Wei M.R. Bateni A. Petric J. Power Sources 160 2006 1225 1229 X. Deng, P. Wei, M.R. Bateni, A. Petric, J. Power Sources 160 (2006) 1225–1229. [242] H. Jeong D. Roehrens M. Bram Mater. Lett. 258 2020 126794 H. Jeong, D. Roehrens, M. Bram, Mater. Lett. 258 (2020) 126794. [243] L. Rose O. Kesler C. Decès-Petit T. Troczynski R. Maric Int. J. Green Energy 6 2009 638 645 L. Rose, O. Kesler, C. Decès-Petit, T. Troczynski, R. Maric, Int. J. Green Energy 6 (2009) 638–645. [244] E. Sarasketa-Zabala L. Otaegi L.M. Rodriguez-Martinez M.A. Alvarez N. Burgos F. Castro I. Villarreal Solid State Ionics 222–223 2012 16 22 E. Sarasketa-Zabala, L. Otaegi, L.M. Rodriguez-Martinez, M.A. Alvarez, N. Burgos, F. Castro, I. Villarreal, Solid State Ionics 222–223 (2012) 16–22. [245] M. Reisert V. Berova A. Aphale P. Singh M.C. Tucker Int. J. Hydrogen Energy 45 2020 30882 30897 M. Reisert, V. Berova, A. Aphale, P. Singh, M.C. Tucker, Int. J. Hydrogen Energy 45 (2020) 30882–30897. [246] K. Li L. Jia X. Wang J. Pu B. Chi J. Li Sci. Rep. 6 2016 35981 K. Li, L. Jia, X. Wang, J. Pu, B. Chi, J. Li, Sci. Rep. 6 (2016) 35981. [247] T. Franco K. Schibinger Z. Ilhan G. Schiller A. Venskutonis ECS Trans. 7 2007 771 780 T. Franco, K. Schibinger, Z. Ilhan, G. Schiller, A. Venskutonis, ECS Trans. 7 (2007) 771–780. [248] Y. Larring M.-L. Fontaine Solid Oxide Fuels Cells: Facts and Figures—Green Energy and Technology 2013 Springer London 71 93 Y. Larring, M.-L. Fontaine, in: J. Irvine, P. Connor (Eds.), Solid Oxide Fuels Cells: Facts and Figures—Green Energy and Technology, Springer, London, 2013, pp. 71–93. [249] A.N. de Miranda W.G. Nunes L.J. Maschio L.G.F. Pereira S. Okamoto R. Vieira G. Doubek Catal. Today 397–399 2022 365 374 A.N. de Miranda, W.G. Nunes, L.J. Maschio, L.G.F. Pereira, S. Okamoto, R. Vieira, G. Doubek, Catal. Today 397–399 (2022) 365–374. [250] Y. Yan R. Bateni J. Harris O. Kesler Surf. Coatings Technol. 272 2015 415 427 Y. Yan, R. Bateni, J. Harris, O. Kesler, Surf. Coatings Technol. 272 (2015) 415–427. [251] V.V. Krishnan Wires Energy Environ. 6 2017 e246 V.V. Krishnan, Wires Energy Environ. 6 (2017) e246. [252] N. Shaigan W. Qu D.G. Ivey W. Chen J. Power Sources 195 2010 1529 1542 N. Shaigan, W. Qu, D.G. Ivey, W. Chen, J. Power Sources 195 (2010) 1529–1542. [253] B.R. Sudireddy J. Nielsen H. Persson K. Thydén K. Brodersen S. Ramousse D. Neagu E. Stefan J.T.S. Irvine H. Geisler A. Weber G. Reiss R. Schauperl J. Rechberger J. Froitzheim R. Sachitanand H. Falk-Windisch J.E. Svensson M.W. Lundberg R. Berger J. Westlinder S. Hornauer T. Kiefer Fuel Cells 17 2017 508 516 B.R. Sudireddy, J. Nielsen, H. Persson, K. Thydén, K. Brodersen, S. Ramousse, D. Neagu, E. Stefan, J.T.S. Irvine, H. Geisler, A. Weber, G. Reiss, R. Schauperl, J. Rechberger, J. Froitzheim, R. Sachitanand, H. Falk-Windisch, J.E. Svensson, M.W. Lundberg, R. Berger, J. Westlinder, S. Hornauer, T. Kiefer, Fuel Cells 17 (2017) 508–516. [254] J. Froitzheim S. Canovic M. Nikumaa R. Sachitanand L.G. Johansson J.E. Svensson J. Power Sources 220 2012 217 227 J. Froitzheim, S. Canovic, M. Nikumaa, R. Sachitanand, L.G. Johansson, J.E. Svensson, J. Power Sources 220 (2012) 217–227. [255] M.K. Banerjee Heat Treatment of Commercial Steels for Engineering Applications 2017 Elsevier Ltd. M.K. Banerjee, Heat Treatment of Commercial Steels for Engineering Applications, Elsevier Ltd., 2017. [256] R. Nédélec R. Neagu S. Uhlenbruck R. Maric D. Sebold H.P. Buchkremer D. Stöver Surf. Coatings Technol. 205 2011 3999 4004 R. Nédélec, R. Neagu, S. Uhlenbruck, R. Maric, D. Sebold, H.P. Buchkremer, D. Stöver, Surf. Coatings Technol. 205 (2011) 3999–4004. [257] C.S. Hwang C.H. Tsai J.F. Yu C.L. Chang J.M. Lin Y.H. Shiu S.W. Cheng J. Power Sources 196 2011 1932 1939 C.S. Hwang, C.H. Tsai, J.F. Yu, C.L. Chang, J.M. Lin, Y.H. Shiu, S.W. Cheng, J. Power Sources 196 (2011) 1932–1939. [258] T. Klemensø J. Nielsen P. Blennow Å.H. Persson T. Stegk B.H. Christensen S. Sønderby J. Power Sources 196 2011 9459 9466 T. Klemensø, J. Nielsen, P. Blennow, Å.H. Persson, T. Stegk, B.H. Christensen, S. Sønderby, J. Power Sources 196 (2011) 9459–9466. [259] M. Brandner M. Bram J. Froitzheim H.P. Buchkremer D. Stöver Solid State Ionics 179 2008 1501 1504 M. Brandner, M. Bram, J. Froitzheim, H.P. Buchkremer, D. Stöver, Solid State Ionics 179 (2008) 1501–1504. [260] A.A. Solovyev S.V. Rabotkin A.V. Shipilova A.I. Kirdyashkin I.V. Ionov A.N. Kovalchuk A.S. Maznoy V.D. Kitler A.O. Borduleva Int. J. Hydrogen Energy 40 2015 14077 14084 A.A. Solovyev, S. V. Rabotkin, A. V. Shipilova, A.I. Kirdyashkin, I. V. Ionov, A.N. Kovalchuk, A.S. Maznoy, V.D. Kitler, A.O. Borduleva, Int. J. Hydrogen Energy 40 (2015) 14077–14084. [261] Y.M. Kim P. Kim-Lohsoontorn J. Bae J. Power Sources 195 2010 6420 6427 Y.M. Kim, P. Kim-Lohsoontorn, J. Bae, J. Power Sources 195 (2010) 6420–6427. [262] F. Liu D. Diercks A.M. Hussain N. Dale Y. Furuya Y. Miura Y. Fukuyama C. Duan ACS Appl. Mater. Interfaces 14 2022 53840 53849 F. Liu, D. Diercks, A.M. Hussain, N. Dale, Y. Furuya, Y. Miura, Y. Fukuyama, C. Duan, ACS Appl. Mater. Interfaces 14 (2022) 53840–53849. [263] E. Antolini J. Energy Chem. 80 2023 711 735 E. Antolini, J. Energy Chem. 80 (2023) 711–735. [264] C.M. Chun J.D. Mumford T.A. Ramanarayanan J. Electrochem. Soc. 147 2000 3680 C.M. Chun, J.D. Mumford, T.A. Ramanarayanan, J. Electrochem. Soc. 147 (2000) 3680. [265] C.M. Chun J.D. Mumford T.A. Ramanarayanan J. Electrochem. Soc. 149 2002 B348 C.M. Chun, J.D. Mumford, T.A. Ramanarayanan, J. Electrochem. Soc. 149 (2002) B348. [266] C.M. Chun T.A. Ramanarayanan J. Electrochem. Soc. 154 2007 C465 C.M. Chun, T.A. Ramanarayanan, J. Electrochem. Soc. 154 (2007) C465. [267] M.M. Welander B. Hu S. Belko K.X. Lee P.K. Dubey I. Robinson P. Singh M.C. Tucker Int. J. Hydrogen Energy 48 2022 1533 1539 M.M. Welander, B. Hu, S. Belko, K.X. Lee, P.K. Dubey, I. Robinson, P. Singh, M.C. Tucker, Int. J. Hydrogen Energy 48 (2022) 1533–1539. [268] M.M. Welander B. Hu M.C. Tucker Int. J. Hydrogen Energy 47 2022 11261 11269 M.M. Welander, B. Hu, M.C. Tucker, Int. J. Hydrogen Energy 47 (2022) 11261–11269. [269] Q. Li X. Wang C. Liu X. Yang C. Li L. Jia J. Li J. Power Sources 537 2022 231533 Q. Li, X. Wang, C. Liu, X. Yang, C. Li, L. Jia, J. Li, J. Power Sources 537 (2022) 231533. [270] B. Hu G. Lau K.X. Lee S. Belko P. Singh M.C. Tucker J. Power Sources 582 2023 233544 B. Hu, G. Lau, K.X. Lee, S. Belko, P. Singh, M.C. Tucker, J. Power Sources 582 (2023) 233544. [271] M. Dewa J. Han L. Fang F. Liu C. Duan A.M. Hussain Y. Miura S. Dong Y. Fukuyama Y. Furuya N. Dale O.G. Marin-Flores S. Saunders M.G. Norton S. Ha Int. J. Hydrogen Energy 50 2024 1408 1416 M. Dewa, J. Han, L. Fang, F. Liu, C. Duan, A.M. Hussain, Y. Miura, S. Dong, Y. Fukuyama, Y. Furuya, N. Dale, O.G. Marin-Flores, S. Saunders, M.G. Norton, S. Ha, Int. J. Hydrogen Energy 50 (2024) 1408–1416. [272] B. Huang S.R. Wang R.Z. Liu X.F. Ye H.W. Nie X.F. Sun T.L. Wen J. Power Sources 167 2007 39 46 B. Huang, S.R. Wang, R.Z. Liu, X.F. Ye, H.W. Nie, X.F. Sun, T.L. Wen, J. Power Sources 167 (2007) 39–46. [273] B. Huang S.R. Wang R.Z. Liu T.L. Wen J. Power Sources 167 2007 288 294 B. Huang, S.R. Wang, R.Z. Liu, T.L. Wen, J. Power Sources 167 (2007) 288–294. [274] S. Diethelm J. Van Herle J. Power Sources 196 2011 7355 7362 S. Diethelm, J. Van Herle, J. Power Sources 196 (2011) 7355–7362. [275] M. Lo Faro R.M. Reis G.G.A. Saglietti V.L. Oliveira S.C. Zignani S. Trocino S. Maisano E.A. Ticianelli N. Hodnik F. Ruiz-Zepeda A.S. Aricò Appl. Catal. B Environ. 220 2018 98 110 M. Lo Faro, R.M. Reis, G.G.A. Saglietti, V.L. Oliveira, S.C. Zignani, S. Trocino, S. Maisano, E.A. Ticianelli, N. Hodnik, F. Ruiz-Zepeda, A.S. Aricò, Appl. Catal. B Environ. 220 (2018) 98–110. [276] X.F. Ye S.R. Wang Z.R. Wang Q. Hu X.F. Sun T.L. Wen Z.Y. Wen J. Power Sources 183 2008 512 517 X.F. Ye, S.R. Wang, Z.R. Wang, Q. Hu, X.F. Sun, T.L. Wen, Z.Y. Wen, J. Power Sources 183 (2008) 512–517. [277] W. Wang Y. Chen F. Wang M.O. Tade Z. Shao Chem. Eng. Sci. 126 2015 22 31 W. Wang, Y. Chen, F. Wang, M.O. Tade, Z. Shao, Chem. Eng. Sci. 126 (2015) 22–31. [278] D. Zanchet J.B.O. Santos S. Damyanova J.M.R. Gallo J.M.C. Bueno ACS Catal. 5 2015 3841 3863 D. Zanchet, J.B.O. Santos, S. Damyanova, J.M.R. Gallo, J.M.C. Bueno, ACS Catal. 5 (2015) 3841–3863. [279] S.C. Singhal Solid State Ionics 152–153 2002 405 410 S.C. Singhal, Solid State Ionics 152–153 (2002) 405–410. [280] P.D. Vaidya A.E. Rodrigues Chem. Eng. J. 117 2006 39 49 P.D. Vaidya, A.E. Rodrigues, Chem. Eng. J. 117 (2006) 39–49. [281] P.D. Vaidya A.E. Rodrigues Ind. Eng. Chem. Res. 45 2006 6614 6618 P.D. Vaidya, A.E. Rodrigues, Ind. Eng. Chem. Res. 45 (2006) 6614–6618. [282] A. Erdohelyi J. Raskó T. Kecskés M. Tóth M. Dömök K. Baán Catal. Today 116 2006 367 376 A. Erdohelyi, J. Raskó, T. Kecskés, M. Tóth, M. Dömök, K. Baán, Catal. Today 116 (2006) 367–376. [283] F. Auprêtre C. Descorme D. Duprez Catal. Commun. 3 2002 263 267 F. Auprêtre, C. Descorme, D. Duprez, Catal. Commun. 3 (2002) 263–267. [284] A. Akande A. Aboudheir R. Idem A. Dalai Int. J. Hydrogen Energy 31 2006 1707 1715 A. Akande, A. Aboudheir, R. Idem, A. Dalai, Int. J. Hydrogen Energy 31 (2006) 1707–1715. [285] E. Akpan A. Akande A. Aboudheir H. Ibrahim R. Idem Chem. Eng. Sci. 62 2007 3112 3126 E. Akpan, A. Akande, A. Aboudheir, H. Ibrahim, R. Idem, Chem. Eng. Sci. 62 (2007) 3112–3126. [286] P. Ciambelli V. Palma A. Ruggiero Appl. Catal. B Environ. 96 2010 190 197 P. Ciambelli, V. Palma, A. Ruggiero, Appl. Catal. B Environ. 96 (2010) 190–197. [287] V. Mas M.L. Dieuzeide M. Jobbágy G. Baronetti N. Amadeo M. Laborde Catal. Today 133–135 2008 319 323 V. Mas, M.L. Dieuzeide, M. Jobbágy, G. Baronetti, N. Amadeo, M. Laborde, Catal. Today 133–135 (2008) 319–323. [288] P.V. Mathure S. Ganguly A.V. Patwardhan R.K. Saha Ind. Eng. Chem. Res. 46 2007 8471 8479 P. V. Mathure, S. Ganguly, A. V. Patwardhan, R.K. Saha, Ind. Eng. Chem. Res. 46 (2007) 8471–8479. [289] D.A. Morgenstern J.P. Fornango Energy Fuels 19 2005 1708 1716 D.A. Morgenstern, J.P. Fornango, Energy Fuels 19 (2005) 1708–1716. [290] A. Simson E. Waterman R. Farrauto M. Castaldi Appl. Catal. B Environ. 89 2009 58 64 A. Simson, E. Waterman, R. Farrauto, M. Castaldi, Appl. Catal. B Environ. 89 (2009) 58–64. [291] J. Comas F. Marino M. Laborde N. Amadeo Chem. Eng. J. 98 2004 61 68 J. Comas, F. Marino, M. Laborde, N. Amadeo, Chem. Eng. J. 98 (2004) 61–68. [292] A.N. Fatsikostas X.E. Verykios J. Catal. 225 2004 439 452 A.N. Fatsikostas, X.E. Verykios, J. Catal. 225 (2004) 439–452. [293] J.R. Rostrup-Nielsen Catal. Sci. Technol. 5 1984 1 117 J.R. Rostrup-Nielsen, Catal. Sci. Technol. 5 (1984) 1–117. [294] P. Häussinger, R. Lohmüller, A.M. Watson, in: Ullmann’s Encyclopedia of Industrial Chemistry, Wiley, 2011, p. 60. [295] J.D. Holladay J. Hu D.L. King Y. Wang Catal. Today 139 2009 244 260 J.D. Holladay, J. Hu, D.L. King, Y. Wang, Catal. Today 139 (2009) 244–260. [296] N.R. Peela D. Kunzru Ind. Eng. Chem. Res. 50 2011 12881 12894 N.R. Peela, D. Kunzru, Ind. Eng. Chem. Res. 50 (2011) 12881–12894. [297] D.R. Sahoo S. Vajpai S. Patel K.K. Pant Chem. Eng. J. 125 2007 139 147 D.R. Sahoo, S. Vajpai, S. Patel, K.K. Pant, Chem. Eng. J. 125 (2007) 139–147. [298] N.K. Das A.K. Dalai R. Ranganathan Can. J. Chem. Eng. 85 2007 92 100 N.K. Das, A.K. Dalai, R. Ranganathan, Can. J. Chem. Eng. 85 (2007) 92–100. [299] Y.J. Wu J.C. Santos P. Li J.G. Yu A.F. Cunha A.E. Rodrigues Can. J. Chem. Eng. 92 2014 116 130 Y.J. Wu, J.C. Santos, P. Li, J.G. Yu, A.F. Cunha, A.E. Rodrigues, Can. J. Chem. Eng. 92 (2014) 116–130. [300] K.D. Punase N. Rao P. Vijay Chem. Pap. 73 2019 1027 1042 K.D. Punase, N. Rao, P. Vijay, Chem. Pap. 73 (2019) 1027–1042. [301] K. Li L. Jia X. Wang J. Pu B. Chi L. Jian J. Power Sources 284 2015 446 451 K. Li, L. Jia, X. Wang, J. Pu, B. Chi, L. Jian, J. Power Sources 284 (2015) 446–451. [302] E.P. Murray T. Tsai S.A. Barnett Nature 400 1999 649 651 E.P. Murray, T. Tsai, S.A. Barnett, Nature 400 (1999) 649–651. [303] J. Sun X.P. Qiu F. Wu W.T. Zhu Int. J. Hydrogen Energy 30 2005 437 445 J. Sun, X.P. Qiu, F. Wu, W.T. Zhu, Int. J. Hydrogen Energy 30 (2005) 437–445. [304] A.J. Akande R.O. Idem A.K. Dalai Appl. Catal. A Gen. 287 2005 159 175 A.J. Akande, R.O. Idem, A.K. Dalai, Appl. Catal. A Gen. 287 (2005) 159–175. [305] I. Dancini-Pontes M. DeSouza F.A. Silva M.H.N.O. Scaliante C.G. Alonso G.S. Bianchi A. Medina Neto G.M. Pereira N.R.C. Fernandes-Machado Chem. Eng. J. 273 2015 66 74 I. Dancini-Pontes, M. DeSouza, F.A. Silva, M.H.N.O. Scaliante, C.G. Alonso, G.S. Bianchi, A. Medina Neto, G.M. Pereira, N.R.C. Fernandes-Machado, Chem. Eng. J. 273 (2015) 66–74. [306] M. Dan M. Mihet Z. Tasnadi-Asztalos A. Imre-Lucaci G. Katona M.D. Lazar Fuel 147 2015 260 268 M. Dan, M. Mihet, Z. Tasnadi-Asztalos, A. Imre-Lucaci, G. Katona, M.D. Lazar, Fuel 147 (2015) 260–268. [307] P. Biswas D. Kunzru Catal. Lett. 118 2007 36 49 P. Biswas, D. Kunzru, Catal. Lett. 118 (2007) 36–49. [308] B.L. Augusto F.B. Noronha F.C. Fonseca F.N. Tabuti R.C. Colman L.V. Mattos Int. J. Hydrogen Energy 39 2014 11196 11209 B.L. Augusto, F.B. Noronha, F.C. Fonseca, F.N. Tabuti, R.C. Colman, L. V. Mattos, Int. J. Hydrogen Energy 39 (2014) 11196–11209. [309] I. Rossetti J. Lasso E. Finocchio G. Ramis V. Nichele M. Signoretto A. Di Michele Appl. Catal. A Gen. 477 2014 42 53 I. Rossetti, J. Lasso, E. Finocchio, G. Ramis, V. Nichele, M. Signoretto, A. Di Michele, Appl. Catal. A Gen. 477 (2014) 42–53. [310] D. Kim B.S. Kwak N.-K. Park G.B. Han M. Kang Int. J. Energy Res. 39 2012 279 292 D. Kim, B.S. Kwak, N.-K. Park, G.B. Han, M. Kang, Int. J. Energy Res. 39 (2012) 279–292. [311] L.C. Chen S.D. Lin Appl. Catal. B Environ. 148–149 2014 509 519 L.C. Chen, S.D. Lin, Appl. Catal. B Environ. 148–149 (2014) 509–519. [312] T.S. Moraes R.C.R. Neto M.C. Ribeiro L.V. Mattos M. Kourtelesis S. Ladas X. Verykios F. Bellot Noronha Catal. Today 242 2015 35 49 T.S. Moraes, R.C.R. Neto, M.C. Ribeiro, L.V. Mattos, M. Kourtelesis, S. Ladas, X. Verykios, F. Bellot Noronha, Catal. Today 242 (2015) 35–49. [313] J.Y.Z. Chiou C.L. Lee K.F. Ho H.H. Huang S.W. Yu C. Bin Wang Int. J. Hydrogen Energy 39 2014 5653 5662 J.Y.Z. Chiou, C.L. Lee, K.F. Ho, H.H. Huang, S.W. Yu, C. Bin Wang, Int. J. Hydrogen Energy 39 (2014) 5653–5662. [314] W. Fang S. Paul M. Capron A.V. Biradar S.B. Umbarkar M.K. Dongare F. Dumeignil L. Jalowiecki-Duhamel Appl. Catal. B Environ. 166–167 2015 485 496 W. Fang, S. Paul, M. Capron, A. V. Biradar, S.B. Umbarkar, M.K. Dongare, F. Dumeignil, L. Jalowiecki-Duhamel, Appl. Catal. B Environ. 166–167 (2015) 485–496. [315] B.S. Kwak G. Lee S.M. Park M. Kang Appl. Catal. A Gen. 503 2015 165 175 B.S. Kwak, G. Lee, S.M. Park, M. Kang, Appl. Catal. A Gen. 503 (2015) 165–175. [316] M. Greluk P. Rybak G. Słowik M. Rotko A. Machocki Catal. Today 242 2015 50 59 M. Greluk, P. Rybak, G. Słowik, M. Rotko, A. Machocki, Catal. Today 242 (2015) 50–59. [317] M. Morales M. Segarra Appl. Catal. A Gen. 502 2015 305 311 M. Morales, M. Segarra, Appl. Catal. A Gen. 502 (2015) 305–311. [318] S.Q. Chen Y.D. Li Y. Liu X. Bai Int. J. Hydrogen Energy 36 2011 5849 5856 S.Q. Chen, Y.D. Li, Y. Liu, X. Bai, Int. J. Hydrogen Energy 36 (2011) 5849–5856. [319] L. Zhao Y. Wei Y. Huang Y. Liu Catal. Today 2 2016 430 437 L. Zhao, Y. Wei, Y. Huang, Y. Liu, Catal. Today 2 (2016) 430–437. [320] F. Liu Y. Qu Y. Yue G. Liu Y. Liu RSC Adv. 5 2015 16837 16846 F. Liu, Y. Qu, Y. Yue, G. Liu, Y. Liu, RSC Adv. 5 (2015) 16837–16846. [321] Z. Wang C. Wang S. Chen Y. Liu Int. J. Hydrogen Energy 39 2014 5644 5652 Z. Wang, C. Wang, S. Chen, Y. Liu, Int. J. Hydrogen Energy 39 (2014) 5644–5652. [322] G. Lee D. Kim B.S. Kwak M. Kang Catal. Today 232 2014 139 150 G. Lee, D. Kim, B.S. Kwak, M. Kang, Catal. Today 232 (2014) 139–150. [323] P. Osorio-Vargas C.H. Campos R.M. Navarro J.L.G. Fierro P. Reyes J. Mol. Catal. A Chem. 407 2015 169 181 P. Osorio-Vargas, C.H. Campos, R.M. Navarro, J.L.G. Fierro, P. Reyes, J. Mol. Catal. A Chem. 407 (2015) 169–181. [324] T. Hou B. Yu S. Zhang T. Xu D. Wang W. Cai Catal. Commun. 58 2015 137 140 T. Hou, B. Yu, S. Zhang, T. Xu, D. Wang, W. Cai, Catal. Commun. 58 (2015) 137–140. [325] J. Zou B. Yu S. Zhang J. Zhang Y. Chen L. Cui T. Xu W. Cai Fuel 159 2015 741 750 J. Zou, B. Yu, S. Zhang, J. Zhang, Y. Chen, L. Cui, T. Xu, W. Cai, Fuel 159 (2015) 741–750. [326] J.Y.Z. Chiou J.Y. Siang S.Y. Yang K.F. Ho C.L. Lee C.T. Yeh C. Bin Wang Int. J. Hydrogen Energy 37 2012 13667 13673 J.Y.Z. Chiou, J.Y. Siang, S.Y. Yang, K.F. Ho, C.L. Lee, C.T. Yeh, C. Bin Wang, Int. J. Hydrogen Energy 37 (2012) 13667–13673. [327] F. Wang W. Cai H. Provendier Y. Schuurman C. Descorme C. Mirodatos W. Shen Int. J. Hydrogen Energy 36 2011 13566 13574 F. Wang, W. Cai, H. Provendier, Y. Schuurman, C. Descorme, C. Mirodatos, W. Shen, Int. J. Hydrogen Energy 36 (2011) 13566–13574. [328] Z. Ferencz A. Erdohelyi K. Baán A. Oszkó L. Óvári Z. Kónya C. Papp H.P. Steinrück J. Kiss ACS Catal. 4 2014 1205 1218 Z. Ferencz, A. Erdohelyi, K. Baán, A. Oszkó, L. Óvári, Z. Kónya, C. Papp, H.P. Steinrück, J. Kiss, ACS Catal. 4 (2014) 1205–1218. [329] F. Frusteri S. Freni L. Spadaro V. Chiodo G. Bonura S. Donato S. Cavallaro Catal. Commun. 5 2004 611 615 F. Frusteri, S. Freni, L. Spadaro, V. Chiodo, G. Bonura, S. Donato, S. Cavallaro, Catal. Commun. 5 (2004) 611–615. [330] Z. He M. Yang X. Wang Z. Zhao A. Duan Catal. Today 194 2012 2 8 Z. He, M. Yang, X. Wang, Z. Zhao, A. Duan, Catal. Today 194 (2012) 2–8. [331] S.M. de Lima A.M. Silva U.M. Graham G. Jacobs B.H. Davis L.V. Mattos F.B. Noronha Appl. Catal. A Gen. 352 2009 95 113 S.M. de Lima, A.M. Silva, U.M. Graham, G. Jacobs, B.H. Davis, L. V. Mattos, F.B. Noronha, Appl. Catal. A Gen. 352 (2009) 95–113. [332] Y. Ma X. Wang X. You J. Liu J. Tian X. Xu H. Peng W. Liu C. Li W. Zhou P. Yuan X. Chen ChemCatChem 6 2015 3366 3376 Y. Ma, X. Wang, X. You, J. Liu, J. Tian, X. Xu, H. Peng, W. Liu, C. Li, W. Zhou, P. Yuan, X. Chen, ChemCatChem 6 (2015) 3366–3376. [333] X. Xue S. Wu Int. J. Hydrogen Energy 40 2015 5617 5623 X. Xue, S. Wu, Int. J. Hydrogen Energy 40 (2015) 5617–5623. [334] T.W. Kim J.C. Park T.H. Lim H. Jung D.H. Chun H.T. Lee S. Hong J. Il Yang Int. J. Hydrogen Energy 40 2015 4512 4518 T.W. Kim, J.C. Park, T.H. Lim, H. Jung, D.H. Chun, H.T. Lee, S. Hong, J. Il Yang, Int. J. Hydrogen Energy 40 (2015) 4512–4518. [335] Y. Zhang W. Wang Z. Wang X. Zhou Z. Wang C.J. Liu Catal. Today 256 2015 130 136 Y. Zhang, W. Wang, Z. Wang, X. Zhou, Z. Wang, C.J. Liu, Catal. Today 256 (2015) 130–136. [336] A.J. Majewski J. Wood W. Bujalski Int. J. Hydrogen Energy 38 2013 14531 14541 A.J. Majewski, J. Wood, W. Bujalski, Int. J. Hydrogen Energy 38 (2013) 14531–14541. [337] Z. Li H. Devianto H.-H. Kwon S.P. Yoon T.-H. Lim H.-I. Lee J. Ind. Eng. Chem. 16 2010 485 489 Z. Li, H. Devianto, H.-H. Kwon, S.P. Yoon, T.-H. Lim, H.-I. Lee, J. Ind. Eng. Chem. 16 (2010) 485–489. [338] M.L. Andrade L. Almeida M. do Carmo Rangel F. Pompeo N. Nichio Chem. Eng. Technol. 37 2014 343 348 M.L. Andrade, L. Almeida, M. do Carmo Rangel, F. Pompeo, N. Nichio, Chem. Eng. Technol. 37 (2014) 343–348. [339] D. Harshini D.H. Lee J. Jeong Y. Kim S.W. Nam H.C. Ham J.H. Han T.H. Lim C.W. Yoon Appl. Catal. B Environ. 148–149 2014 415 423 D. Harshini, D.H. Lee, J. Jeong, Y. Kim, S.W. Nam, H.C. Ham, J.H. Han, T.H. Lim, C.W. Yoon, Appl. Catal. B Environ. 148–149 (2014) 415–423. [340] K. Lertwittayanon D. Atong P. Aungkavattana T. Wasanapiarnpong S. Wada V. Sricharoenchaikul Int. J. Hydrogen Energy 35 2010 12277 12285 K. Lertwittayanon, D. Atong, P. Aungkavattana, T. Wasanapiarnpong, S. Wada, V. Sricharoenchaikul, Int. J. Hydrogen Energy 35 (2010) 12277–12285. [341] L. Zhou Y. Guo H. Kameyama J.M. Basset Int. J. Hydrogen Energy 39 2014 7291 7305 L. Zhou, Y. Guo, H. Kameyama, J.M. Basset, Int. J. Hydrogen Energy 39 (2014) 7291–7305. [342] Ş. Özkara-Aydnolu A.E. Aksoylu Int. J. Hydrogen Energy 36 2011 2950 2959 Ş. Özkara-Aydnolu, A.E. Aksoylu, Int. J. Hydrogen Energy 36 (2011) 2950–2959. [343] E.L. Foletto R.W. Alves S.L. Jahn J. Power Sources 161 2006 531 534 E.L. Foletto, R.W. Alves, S.L. Jahn, J. Power Sources 161 (2006) 531–534. [344] M. Khzouz J. Wood B. Pollet W. Bujalski Int. J. Hydrogen Energy 38 2013 1664 1675 M. Khzouz, J. Wood, B. Pollet, W. Bujalski, Int. J. Hydrogen Energy 38 (2013) 1664–1675. [345] E.C. Luna A.M. Becerra M.I. Dimitrijewits React. Kinet. Catal. Lett. 67 1999 247 252 E.C. Luna, A.M. Becerra, M.I. Dimitrijewits, React. Kinet. Catal. Lett. 67 (1999) 247–252. [346] M. Dan M. Mihet A.R. Biris P. Marginean V. Almasan G. Borodi F. Watanabe A.S. Biris M.D. Lazar React. Kinet. Mech. Catal. 105 2012 173 193 M. Dan, M. Mihet, A.R. Biris, P. Marginean, V. Almasan, G. Borodi, F. Watanabe, A.S. Biris, M.D. Lazar, React. Kinet. Mech. Catal. 105 (2012) 173–193. [347] S.S. Maluf E.M. Assaf Fuel 88 2009 1547 1553 S.S. Maluf, E.M. Assaf, Fuel 88 (2009) 1547–1553. [348] N.V. Parizotto K.O. Rocha S. Damyanova F.B. Passos D. Zanchet C.M.P. Marques J.M.C. Bueno Appl. Catal. A Gen. 330 2007 12 22 N. V. Parizotto, K.O. Rocha, S. Damyanova, F.B. Passos, D. Zanchet, C.M.P. Marques, J.M.C. Bueno, Appl. Catal. A Gen. 330 (2007) 12–22. [349] R. Pereñíguez V.M. González-DelaCruz J.P. Holgado A. Caballero Appl. Catal. B Environ. 93 2010 346 353 R. Pereñíguez, V.M. González-DelaCruz, J.P. Holgado, A. Caballero, Appl. Catal. B Environ. 93 (2010) 346–353. [350] T. Miyata D. Li M. Shiraga T. Shishido Y. Oumi T. Sano K. Takehira Appl. Catal. A Gen. 310 2006 97 104 T. Miyata, D. Li, M. Shiraga, T. Shishido, Y. Oumi, T. Sano, K. Takehira, Appl. Catal. A Gen. 310 (2006) 97–104. [351] K. Kusakabe K.I. Sotowa T. Eda Y. Iwamoto Fuel Process. Technol. 86 2004 319 326 K. Kusakabe, K.I. Sotowa, T. Eda, Y. Iwamoto, Fuel Process. Technol. 86 (2004) 319–326. [352] M. Nawfal C. Gennequin M. Labaki B. Nsouli A. Aboukaïs E. Abi-Aad Int. J. Hydrogen Energy 40 2015 1269 1277 M. Nawfal, C. Gennequin, M. Labaki, B. Nsouli, A. Aboukaïs, E. Abi-Aad, Int. J. Hydrogen Energy 40 (2015) 1269–1277. [353] D. Homsi S. Aouad C. Gennequin A. Aboukaïs E. Abi-Aad Int. J. Hydrogen Energy 39 2014 10101 10107 D. Homsi, S. Aouad, C. Gennequin, A. Aboukaïs, E. Abi-Aad, Int. J. Hydrogen Energy 39 (2014) 10101–10107. [354] U.E.S. Amjad G. Gonçalves Lenzi N.R. Camargo Fernandes-Machado S. Specchia Catal. Today 257 2015 122 130 U.E.S. Amjad, G. Gonçalves Lenzi, N.R. Camargo Fernandes-Machado, S. Specchia, Catal. Today 257 (2015) 122–130. [355] A. Vita G. Cristiano C. Italiano L. Pino S. Specchia Appl. Catal. B Environ. 162 2015 551 563 A. Vita, G. Cristiano, C. Italiano, L. Pino, S. Specchia, Appl. Catal. B Environ. 162 (2015) 551–563. [356] V.M. Shinde G. Madras Int. J. Hydrogen Energy 38 2013 13961 13973 V.M. Shinde, G. Madras, Int. J. Hydrogen Energy 38 (2013) 13961–13973. [357] D.S.A. Simakov H.Y. Luo Y. Román-Leshkov Appl. Catal. B Environ. 168–169 2015 540 549 D.S.A. Simakov, H.Y. Luo, Y. Román-Leshkov, Appl. Catal. B Environ. 168–169 (2015) 540–549. [358] A. Kumar Ind. Eng. Chem. Res. 60 2021 16561 16576 A. Kumar, Ind. Eng. Chem. Res. 60 (2021) 16561–16576. [359] W. Guo X.F. Zheng Z.B. Qin Q.J. Guo L. Liu ACS Omega 6 2021 33533 33541 W. Guo, X.F. Zheng, Z.B. Qin, Q.J. Guo, L. Liu, ACS Omega 6 (2021) 33533–33541. [360] I. Popov Z. Zhu A.R. Young-Gonzales R.L. Sacci E. Mamontov C. Gainaru S.J. Paddison A.P. Sokolov Commun. Chem. 6 2023 77 I. Popov, Z. Zhu, A.R. Young-Gonzales, R.L. Sacci, E. Mamontov, C. Gainaru, S.J. Paddison, A.P. Sokolov, Commun. Chem. 6 (2023) 77. [361] J. Llorca V.C. Corberán N.J. Divins R.O. Fraile E. Taboada Renewable Hydrogen Technologies first ed. 2013 Elsevier 135 169 J. Llorca, V.C. Corberán, N.J. Divins, R.O. Fraile, E. Taboada, in: Renewable Hydrogen Technologies, 1st ed., Elsevier, 2013, pp. 135–169. [362] S. Ma X. Hu Y. Zhao X. Wang C. Dong ACS Omega 6 2021 29201 29214 S. Ma, X. Hu, Y. Zhao, X. Wang, C. Dong, ACS Omega 6 (2021) 29201–29214. [363] J. Nielsen Å.H. Persson T.T. Muhl K. Brodersen J. Electrochem. Soc. 165 2018 F90 F96 J. Nielsen, Å.H. Persson, T.T. Muhl, K. Brodersen, J. Electrochem. Soc. 165 (2018) F90–F96. [364] R. Leah A. Bone M. Lankin A. Selcuk M. Rahman A. Clare L. Rees S. Phillip S. Mukerjee M. Selby ECS Trans. 68 2015 95 107 R. Leah, A. Bone, M. Lankin, A. Selcuk, M. Rahman, A. Clare, L. Rees, S. Phillip, S. Mukerjee, M. Selby, ECS Trans. 68 (2015) 95–107. [365] R. Leah A. Bone A. Selcuk D. Corcoran M. Lankin Z. Dehaney-Steven M. Selby P. Whalen ECS Trans. 35 2011 351 367 R. Leah, A. Bone, A. Selcuk, D. Corcoran, M. Lankin, Z. Dehaney-Steven, M. Selby, P. Whalen, ECS Trans. 35 (2011) 351–367. [366] L. Yang R. Mertens M. Ferrucci C. Yan Y. Shi S. Yang Mater. Des. 162 2019 394 404 L. Yang, R. Mertens, M. Ferrucci, C. Yan, Y. Shi, S. Yang, Mater. Des. 162 (2019) 394–404. [367] D. Downing A. Jones M. Brandt M. Leary Mater. Des. 197 2021 109096 D. Downing, A. Jones, M. Brandt, M. Leary, Mater. Des. 197 (2021) 109096. [368] I. Yadroitsev I. Shishkovsky P. Bertrand I. Smurov Appl. Surf. Sci. 255 2009 5523 5527 I. Yadroitsev, I. Shishkovsky, P. Bertrand, I. Smurov, Appl. Surf. Sci. 255 (2009) 5523–5527. [369] A.L.J. Munhoz, A.R.R. Bineli, R.M. Filho, Processo Para Obtenção de Placas de Microcanais Para Mircroreatores Químicos e Placas Assim Obtidas, BR102012032322A2, 2014. [370] M.C. Tucker G.Y. Lau C.P. Jacobson L.C. DeJonghe S.J. Visco J. Power Sources 171 2007 477 482 M.C. Tucker, G.Y. Lau, C.P. Jacobson, L.C. DeJonghe, S.J. Visco, J. Power Sources 171 (2007) 477–482. [371] S. De Angelis P.S. Jørgensen E.H.R. Tsai M. Holler K. Kreka J.R. Bowen J. Power Sources 383 2018 72 79 S. De Angelis, P.S. Jørgensen, E.H.R. Tsai, M. Holler, K. Kreka, J.R. Bowen, J. Power Sources 383 (2018) 72–79. [372] S. Ovtar X. Tong J.J. Bentzen K.T.S. Thydén S.B. Simonsen M. Chen Nanoscale 11 2019 4394 4406 S. Ovtar, X. Tong, J.J. Bentzen, K.T.S. Thydén, S.B. Simonsen, M. Chen, Nanoscale 11 (2019) 4394–4406. [373] M.C. Tucker G.Y. Lau C.P. Jacobson L.C. DeJonghe S.J. Visco J. Power Sources 175 2008 447 451 M.C. Tucker, G.Y. Lau, C.P. Jacobson, L.C. DeJonghe, S.J. Visco, J. Power Sources 175 (2008) 447–451. [374] Q. Li X. Wang L. Jia B. Chi J. Pu J. Li Mater. Today Energy 17 2020 100473 Q. Li, X. Wang, L. Jia, B. Chi, J. Pu, J. Li, Mater. Today Energy 17 (2020) 100473. [375] Y. Tao S.D. Ebbesen M.B. Mogensen J. Electrochem. Soc. 161 2014 F337 F343 Y. Tao, S.D. Ebbesen, M.B. Mogensen, J. Electrochem. Soc. 161 (2014) F337–F343. [376] S. Zha Z. Cheng M. Liu J. Electrochem. Soc. 154 2007 B201 S. Zha, Z. Cheng, M. Liu, J. Electrochem. Soc. 154 (2007) B201. [377] O. Gohar M.Z. Khan M. Saleem O. Chun Z.U.D. Babar M.M.U. Rehman A. Hussain K. Zheng J.H. Koh A. Ghaffar I. Hussain E. Filonova D. Medvedev M. Motola M.B. Hanif Adv. Colloid Interface Sci. 331 2024 103241 O. Gohar, M.Z. Khan, M. Saleem, O. Chun, Z.U.D. Babar, M.M.U. Rehman, A. Hussain, K. Zheng, J.H. Koh, A. Ghaffar, I. Hussain, E. Filonova, D. Medvedev, M. Motola, M.B. Hanif, Adv. Colloid Interface Sci. 331 (2024) 103241. [378] P. Du J. Wu Z. Li X. Wang L. Jia Materials (Basel) 16 2023 3978 P. Du, J. Wu, Z. Li, X. Wang, L. Jia, Materials (Basel). 16 (2023) 3978. [379] J.H. Shim G.D. Han H.J. Choi Y. Kim S. Xu J. An Y.B. Kim T. Graf T.D. Schladt T.M. Gür F.B. Prinz Int. J. Precis. Eng. Manuf. - Green Technol. 6 2019 629 646 J.H. Shim, G.D. Han, H.J. Choi, Y. Kim, S. Xu, J. An, Y.B. Kim, T. Graf, T.D. Schladt, T.M. Gür, F.B. Prinz, Int. J. Precis. Eng. Manuf. - Green Technol. 6 (2019) 629–646. [380] M.J. Ndolomingo N. Bingwa R. Meijboom J. Mater. Sci. 55 2020 6195 6241 M.J. Ndolomingo, N. Bingwa, R. Meijboom, J. Mater. Sci. 55 (2020) 6195–6241. [381] J. Dupont J.D. Scholten Chem. Soc. Rev. 39 2010 1780 1804 J. Dupont, J.D. Scholten, Chem. Soc. Rev. 39 (2010) 1780–1804. [382] R. Ferrando J. Jellinek R.L. Johnston Chem. Rev. 108 2008 845 910 R. Ferrando, J. Jellinek, R.L. Johnston, Chem. Rev. 108 (2008) 845–910. [383] J.T. Richardson S.A. Paripatyadar Appl. Catal. 61 1990 293 309 J.T. Richardson, S.A. Paripatyadar, Appl. Catal. 61 (1990) 293–309. [384] V.C.H. Kroll H.M. Swaan S. Lacombe C. Mirodatos J. Catal. 164 1996 387 398 V.C.H. Kroll, H.M. Swaan, S. Lacombe, C. Mirodatos, J. Catal. 164 (1996) 387–398. [385] T. Klemensø K. Thydén M. Chen H.J. Wang J. Power Sources 195 2010 7295 7301 T. Klemensø, K. Thydén, M. Chen, H.J. Wang, J. Power Sources 195 (2010) 7295–7301. [386] X. Gao Z. Wang J. Ashok S. Kawi Chem. Eng. Sci. X 7 2020 100065 X. Gao, Z. Wang, J. Ashok, S. Kawi, Chem. Eng. Sci. X 7 (2020) 100065. [387] V. Coman B. Robotin P. Ilea Resour. Conserv. Recycl. 73 2013 229 238 V. Coman, B. Robotin, P. Ilea, Resour. Conserv. Recycl. 73 (2013) 229–238. [388] N.M. Al-Mansi N.M. Abdel Monem Waste Manag. 22 2002 85 90 N.M. Al-Mansi, N.M. Abdel Monem, Waste Manag. 22 (2002) 85–90. [389] E. Furimsky Catal. Today 30 1996 223 286 E. Furimsky, Catal. Today 30 (1996) 223–286. [390] E.I. Wright A.J. Clegg S. Rahimifard L. Jones Proc. 3rd Int. Conf. Life Cycle Manag. 1 2007 113 E.I. Wright, A.J. Clegg, S. Rahimifard, L. Jones, Proc. 3rd Int. Conf. Life Cycle Manag. 1 (2007) 113. [391] M. Kamiya Y. Mori T. Kojima R. Sasai H. Itoh J. Mater. Cycles Waste Manag. 9 2007 27 33 M. Kamiya, Y. Mori, T. Kojima, R. Sasai, H. Itoh, J. Mater. Cycles Waste Manag. 9 (2007) 27–33. [392] M.A. Gauto M.F. Carazzolle M.E.P. Rodrigues R.S. de Abreu T.C. Pereira G.A.G. Pereira Energy Sustain. Dev. 76 2023 101261 M.A. Gauto, M.F. Carazzolle, M.E.P. Rodrigues, R.S. de Abreu, T.C. Pereira, G.A.G. Pereira, Energy Sustain. Dev. 76 (2023) 101261. [393] M.H.S.M. Haram J.W. Lee G. Ramasamy E.E. Ngu S.P. Thiagarajah Y.H. Lee Alexandria Eng. J. 60 2021 4517 4536 M.H.S.M. Haram, J.W. Lee, G. Ramasamy, E.E. Ngu, S.P. Thiagarajah, Y.H. Lee, Alexandria Eng. J. 60 (2021) 4517–4536. [394] M.A. Cusenza F. Guarino S. Longo M. Mistretta M. Cellura Energy Build. 186 2019 339 354 M.A. Cusenza, F. Guarino, S. Longo, M. Mistretta, M. Cellura, Energy Build. 186 (2019) 339–354. [395] M.S. Koroma D. Costa M. Philippot G. Cardellini M.S. Hosen T. Coosemans M. Messagie Sci. Total Environ. 831 2022 154859 M.S. Koroma, D. Costa, M. Philippot, G. Cardellini, M.S. Hosen, T. Coosemans, M. Messagie, Sci. Total Environ. 831 (2022) 154859. [396] Q. Qiao F. Zhao Z. Liu H. Hao Resour. Conserv. Recycl. 140 2019 45 53 Q. Qiao, F. Zhao, Z. Liu, H. Hao, Resour. Conserv. Recycl. 140 (2019) 45–53. [397] S. Blankemeyer D. Wiens T. Wiese A. Raatz S. Kara Procedia CIRP 98 2021 559 564 S. Blankemeyer, D. Wiens, T. Wiese, A. Raatz, S. Kara, Procedia CIRP 98 (2021) 559–564. [398] R. Wittstock A. Pehlken M. Wark Recycling 1 2016 343 364 R. Wittstock, A. Pehlken, M. Wark, Recycling 1 (2016) 343–364. [399] Y. Bessekon P. Zielke A.C. Wulff A. Hagen Int. J. Hydrogen Energy 44 2019 1905 1918 Y. Bessekon, P. Zielke, A.C. Wulff, A. Hagen, Int. J. Hydrogen Energy 44 (2019) 1905–1918. [400] A. Nordelöf M. Messagie A.M. Tillman M. Ljunggren Söderman J. Van Mierlo Int. J. Life Cycle Assess. 19 2014 1866 1890 A. Nordelöf, M. Messagie, A.M. Tillman, M. Ljunggren Söderman, J. Van Mierlo, Int. J. Life Cycle Assess. 19 (2014) 1866–1890. [401] S. Evangelisti C. Tagliaferri D.J.L. Brett P. Lettieri J. Clean. Prod. 142 2017 4339 4355 S. Evangelisti, C. Tagliaferri, D.J.L. Brett, P. Lettieri, J. Clean. Prod. 142 (2017) 4339–4355. [402] K. Bekel S. Pauliuk Int. J. Life Cycle Assess. 24 2019 2220 2237 K. Bekel, S. Pauliuk, Int. J. Life Cycle Assess. 24 (2019) 2220–2237. [403] I. Kountouris R. Bramstoft T. Madsen J. Gea-Bermúdez M. Munster D. Keles Nat. Commun. 15 2024 5517 I. Kountouris, R. Bramstoft, T. Madsen, J. Gea-Bermúdez, M. Munster, D. Keles, Nat. Commun. 15 (2024) 5517. [404] F. Gonçalves R. Perna E. Lopes R. Maciel L. Tovar M. Lopes Biomass Bioenergy 148 2021 106052 F. Gonçalves, R. Perna, E. Lopes, R. Maciel, L. Tovar, M. Lopes, Biomass Bioenergy 148 (2021) 106052. [405] R.O. Silva C.M. Torres L. Bonfim-Rocha O.C.M. Lima A. Coutu L. Jiménez L.M.M. Jorge J. Clean. Prod. 183 2018 956 963 R.O. Silva, C.M. Torres, L. Bonfim-Rocha, O.C.M. Lima, A. Coutu, L. Jiménez, L.M.M. Jorge, J. Clean. Prod. 183 (2018) 956–963. [406] F.C. De Oliveira, S.T. Coelho, in: Biofuels—Challenges and Opportunities, IntechOpen, 2018, p. 19. [407] A.K. Chandel J.Q. Albarelli D.T. Santos S.P. Chundawat M. Puri M.A.A. Meireles Biofuels Bioprod. Biorefining 13 2019 994 1014 A.K. Chandel, J.Q. Albarelli, D.T. Santos, S.P. Chundawat, M. Puri, M.A.A. Meireles, Biofuels, Bioprod. Biorefining 13 (2019) 994–1014. [408] S. Van Renssen Nat. Clim. Change 1 2011 389 390 S. Van Renssen, Nat. Clim. Change 1 (2011) 389–390. [409] S. van Renssen Nat. Clim. Change 10 2020 799 801 S. van Renssen, Nat. Clim. Change 10 (2020) 799–801. [410] J.R. Moreira V. Romeiro S. Fuss F. Kraxner S.A. Pacca Appl. Energy 179 2016 55 63 J.R. Moreira, V. Romeiro, S. Fuss, F. Kraxner, S.A. Pacca, Appl. Energy 179 (2016) 55–63. [411] P. Marocco M. Gandiglio M. Santarelli Energy Rep. 8 2022 8709 8721 P. Marocco, M. Gandiglio, M. Santarelli, Energy Rep. 8 (2022) 8709–8721. [412] J.S.G. Mýrdal P.V. Hendriksen C.R. Graves S.H. Jensen E. Ravn Nielsen Predicting the Price of Solid Oxide Electrolysers (SOECs) 2016 Technical University of Denmark J.S.G. Mýrdal, P.V. Hendriksen, C.R. Graves, S.H. Jensen, E. Ravn Nielsen, Predicting the Price of Solid Oxide Electrolysers (SOECs). Technical University of Denmark (2016) [413] R.T. Leah N.P. Brandon P. Aguiar J. Power Sources 145 2005 336 352 R.T. Leah, N.P. Brandon, P. Aguiar, J. Power Sources 145 (2005) 336–352. [414] R. Leah A. Bone M. Lankin A. Selcuk R. Pierce L. Rees D. Corcoran P. Muhl Z. Dehaney-Steven C. Brackenbury M. Selby S. Mukerjee ECS Trans. 57 2013 461 470 R. Leah, A. Bone, M. Lankin, A. Selcuk, R. Pierce, L. Rees, D. Corcoran, P. Muhl, Z. Dehaney-Steven, C. Brackenbury, M. Selby, S. Mukerjee, ECS Trans. 57 (2013) 461–470. [415] P. Bance N.P. Brandon B. Girvan P. Holbeche S. O’Dea B.C.H. Steele J. Power Sources 131 2004 86 90 P. Bance, N.P. Brandon, B. Girvan, P. Holbeche, S. O’Dea, B.C.H. Steele, J. Power Sources 131 (2004) 86–90. [416] B.J. McKenna N. Christiansen R. Schauperl P. Prenninger J. Nielsen P. Blennow T. Klemensø S. Ramousse A. Kromp A. Weber Fuel Cells 13 2013 592 597 B.J. McKenna, N. Christiansen, R. Schauperl, P. Prenninger, J. Nielsen, P. Blennow, T. Klemensø, S. Ramousse, A. Kromp, A. Weber, Fuel Cells 13 (2013) 592–597. [417] M. Rüttinger R. Mücke T. Franco O. Büchler N.H. Menzler A. Venskutonis ECS Trans. 35 2011 259 268 M. Rüttinger, R. Mücke, T. Franco, O. Büchler, N.H. Menzler, A. Venskutonis, ECS Trans. 35 (2011) 259–268. [418] N. Christiansen S. Primdahl M. Wandel S. Ramousse A. Hagen ECS Trans. 57 2013 43 52 N. Christiansen, S. Primdahl, M. Wandel, S. Ramousse, A. Hagen, ECS Trans. 57 (2013) 43–52. [419] J. Mougin A. Brevet J.-C. Grenier R. Laucournet P.-O. Larsson D. Montinaro L.M. Rodriguez-Martinez M.A. Alvarez M. Stange S. Trombert ECS Trans. 57 2013 481 490 J. Mougin, A. Brevet, J.-C. Grenier, R. Laucournet, P.-O. Larsson, D. Montinaro, L.M. Rodriguez-Martinez, M.A. Alvarez, M. Stange, S. Trombert, ECS Trans. 57 (2013) 481–490. [420] E.Y. Pikalova E.G. Kalinina N.S. Pikalova E.A. Filonova Materials (Basel) 15 2022 8783 E.Y. Pikalova, E.G. Kalinina, N.S. Pikalova, E.A. Filonova, Materials (Basel). 15 (2022) 8783. [421] L.C.C.B. Oliveira R. Venâncio P.V.F. de Azevedo C.G. Anchieta T.C.M. Nepel C.B. Rodella H. Zanin G. Doubek J. Energy Chem. 81 2023 1 19 L.C.C.B. Oliveira, R. Venâncio, P.V.F. de Azevedo, C.G. Anchieta, T.C.M. Nepel, C.B. Rodella, H. Zanin, G. Doubek, J. Energy Chem. 81 (2023) 1–19. [422] Y. Wu Z. Yan J. Xu Z. Zhong X. Xu Chem. Eng. J. 469 2023 143854 Y. Wu, Z. Yan, J. Xu, Z. Zhong, X. Xu, Chem. Eng. J. 469 (2023) 143854. [423] R. Mahbub T. Hsu W.K. Epting G. Nolan Y. Lei N.T. Nuhfer R.B. Doane H.W. Abernathy G.A. Hackett S. Litster A.D. Rollett P.A. Salvador J. Power Sources 498 2021 229846 R. Mahbub, T. Hsu, W.K. Epting, G. Nolan, Y. Lei, N.T. Nuhfer, R.B. Doane, H.W. Abernathy, G.A. Hackett, S. Litster, A.D. Rollett, P.A. Salvador, J. Power Sources 498 (2021) 229846. [424] K. Sato Y. Yabuta K. Kumada K. Fukui M. Numao T. Kawada J. Power Sources 570 2023 233059 K. Sato, Y. Yabuta, K. Kumada, K. Fukui, M. Numao, T. Kawada, J. Power Sources 570 (2023) 233059. [425] U. Netzelmann A. Mross T. Waschkies D. Weber E. Toma H. Neurohr Energies 15 2022 1 10 U. Netzelmann, A. Mross, T. Waschkies, D. Weber, E. Toma, H. Neurohr, Energies 15 (2022) 1–10. [426] C. Zhao Y. Li W. Zhang Y. Zheng X. Lou B. Yu J. Chen Y. Chen M. Liu J. Wang Energy Environ. Sci. 13 2020 53 85 C. Zhao, Y. Li, W. Zhang, Y. Zheng, X. Lou, B. Yu, J. Chen, Y. Chen, M. Liu, J. Wang, Energy Environ. Sci. 13 (2020) 53–85. [427] N.G. Garcia J.M. Gonçalves C. Real B. Freitas J.G. Ruiz-Montoya H. Zanin Energy Storage Mater. 67 2024 103213 N.G. Garcia, J.M. Gonçalves, C. Real, B. Freitas, J.G. Ruiz-Montoya, H. Zanin, Energy Storage Mater. 67 (2024) 103213. Fábio C. Antunes is a PhDstudent in materials science and engineering atUFSCar. He has experience in the manufacturing of solid oxide cells (SOCs), and electrochemical, structure and microstructure characterization of SOCs. He is a currently post-doctoral student in the Center for Innovation on New Energies (CINE) at CEPETRO/UNICAMP developing SOFCs for biofuels on-board electrical and stationary power generation besides H2 generation using SOECs to produce green ammonia. João P. J. de Oliveira is a Ph.D.student at the University of Campinas (UNICAMP), and a researcher in the Center for Innovation on New Energies (CINE). He has experience in the manufacturing of solid oxide cells (SOCs), electrochemical and microstructure characterization of SOCFs. He graduated in Energy Engineering in 2021, with international experience at the Autonomous University of Barcelona. He holds a master’s degree in Electrical Engineering from UNICAMP. Ricardo S. de Abreu is a consultant in sustainable mobility, mechanical engineer with expertise in internal combustion engines, and former university professor in engines and energetics. Currently he is a Ph.D. candidate in Bioenergy at UNICAMP/USP/UNESP.Consultant for ÚNICA, research engineer for the Methanol Project at IMT, and former executive at Mercedes-Benz andMahle. Co-founder and advisor at AEA, and member of SAE. Thiago Dias is a postdoctoral researcher in the Advanced Energy Storage Division at the Center for Innovation on New Energies, Campinas. He holds a bachelor’s degree in Physics (2002), a Master’s degree (2005), and a Ph.D.’s degree (2009) in Materials Engineering from the Federal University of São Carlos, with a specialization in solid oxide fuel cells (SOFCs). His research interests span construction and testing SOFCs, varistors and supercapacitors. Bruno B. N. S. Brandão is a post-doctoral researcher at the Advanced Energy Storage Division, Center for Innovation on New Energies. He holds a bachelor’s degree in Chemistry from the Federal University of Minas Gerais and a Ph.D.’s degree from USP (2021). Previously he led an open-innovation project with USP and Metal Chek, synthesizing magneto-fluorescent materials. Currently he develops high-entropy andnano-microstructured materials for catalytic reforming, battery cathodes, and SOFC anodes, focusing on scalable processes. Josué M. Gonçalves is a researcher at the Mackenzie Institute for Research in Graphene and Nanotechnologies (MackGraphe), Brazil. He graduated in Chemistry in 2014 and received his PhD degree from the USP in 2019. He developed cutting-edge research during his postdoctoral internships at USP (2019–2021), the University of Illinois-Chicago (2021–2022), and the University of Campinas (2023–2024). His current research interests include applications of high-entropy materials for energy conversion and storage. Josimar Ribeiro is a full professor at the Federal University of Espírito Santo. He holds a BS degree (1999), a MS degree (2002), and a PhD degree (2006) from USP/FFCLRP. He is the recipient of the Lavoisier Prize (1999) and IAAM Scientist Medal (2017). He completed postdoctoral research on fuel cell catalysis at Université de Poitiers, France, and specializes in Physical Chemistry and Electrochemistry, with over 100 research publications, 52 papers, 10 books, 4 book chapters, and 2 patents. Julian Hunt is a research scientist at KAUST working on water, food, and energy inventions for Saudi Arabia. He holds a chemical engineering degree from the University of Nottigham, a D.Phil degree from the University of Oxford and worked for 7 years at the International Institute for Applied Systems Analysis prior to joining KAUST. Hudson Zanin is a professor at the School of Electrical and Computer Engineering, University of Campinas, and a researcher at the Center for Innovation on New Energies. His research develops functional nanomaterials for energy storage and conversion, focusing on supercapacitors, batteries, and fuel cells. He is the founder of the first South America Lab-scale batteries and supercapacitors manufacturing. Dr. Zanin holds a Ph.D. degree in Electrical Engineering from the University of Campinas (2012). Gustavo Doubek is an associate Professor at UNICAMP and a researcher at the Center for Innovation on New Energies (CINE). He holds a degree in Chemical Engineering from UNICAMP and Ph.D. degree in Nuclear Technology from IPEN/USP, with research experience at Yale University and 3M. He specializes in nanomaterials for energy storage and conversion, focusing on Li-ion, Na-ion, Li-O2, and Li-S batteries, fuel cells, biofuel reformers, and catalyst synthesis for public and private projects.",
      "scopus-id": "85212920757",
      "coredata": {
        "eid": "1-s2.0-S2095495624007848",
        "dc:description": "Metal-Supported Solid Oxide Fuel Cells (MS-SOFCs) hold significant potential for driving the energy transition. These electrochemical devices represent the most advanced generation of Solid Oxide Fuel Cell (SOFCs) and can pave the way for mass production and wider adoption than Proton Exchange Membrane Fuel Cells (PEMFCs) due to their fuel flexibility, higher power density and the absence of noble metals in the fabrication processes. This review examines the state-of-the-art of SOFCs and MS-SOFCs, presenting perspectives and research directions for these key technological devices, highlighting novel materials, techniques, architectures, devices, and degradation mechanisms to address current challenges and future opportunities. Techniques such as infiltration/impregnation, ex-solution catalyst synthesis, and the use of a pre-catalytic reformer layer are discussed as their impact on efficiency and prolonged activity. These concepts are also described and connected with well-dispersed nanoparticles, hindrance of coarsening, and an increased number of Triple Phase Boundaries (TPBs). This review also describes the synergistic use of reformers with MS-SOFCs to compose solutions in energy generation from readily available fuels. Lastly, the End-of-Life (EoL), recycling, and life-cycle assessments (LCAs) of the Fuel Cell Hybrid Electric Vehicles (FCHEVs) were discussed. LCAs comparing Fuel Cell Electric Vehicles (FCEVs) equipped with (PEMFCs) and FCHEVs equipped with MS-SOFCs, both powered with hydrogen (H2) generated by different routes were compared. This review aims to provide valuable insights into these key technological devices, emphasizing the importance of robust research and development to enhance performance and lifespan while reducing costs and environmental impact.",
        "openArchiveArticle": "false",
        "prism:coverDate": "2025-04-30",
        "openaccessUserLicense": null,
        "prism:aggregationType": "Journal",
        "prism:url": "https://api.elsevier.com/content/article/pii/S2095495624007848",
        "dc:creator": [
          {
            "@_fa": "true",
            "$": "Antunes, Fábio C."
          },
          {
            "@_fa": "true",
            "$": "de Oliveira, João P.J."
          },
          {
            "@_fa": "true",
            "$": "de Abreu, Ricardo S."
          },
          {
            "@_fa": "true",
            "$": "Dias, Thiago"
          },
          {
            "@_fa": "true",
            "$": "Brandão, Bruno B.N.S."
          },
          {
            "@_fa": "true",
            "$": "Gonçalves, Josué M."
          },
          {
            "@_fa": "true",
            "$": "Ribeiro, Josimar"
          },
          {
            "@_fa": "true",
            "$": "Hunt, Julian"
          },
          {
            "@_fa": "true",
            "$": "Zanin, Hudson"
          },
          {
            "@_fa": "true",
            "$": "Doubek, Gustavo"
          }
        ],
        "link": [
          {
            "@_fa": "true",
            "@rel": "self",
            "@href": "https://api.elsevier.com/content/article/pii/S2095495624007848"
          },
          {
            "@_fa": "true",
            "@rel": "scidir",
            "@href": "https://www.sciencedirect.com/science/article/pii/S2095495624007848"
          }
        ],
        "dc:format": "application/json",
        "openaccessType": null,
        "pii": "S2095-4956(24)00784-8",
        "prism:volume": "103",
        "prism:publisher": "Science Press and Dalian Institute of Chemical Physics, Chinese Academy of Sciences. Published by Elsevier B.V. and Science Press. All rights are reserved, including those for text and data mining, AI training, and similar technologies.",
        "dc:title": "Reviewing metal supported solid oxide fuel cells for efficient electricity generation with biofuels for mobility",
        "prism:copyright": "© 2024 Science Press and Dalian Institute of Chemical Physics, Chinese Academy of Sciences. Published by Elsevier B.V. and Science Press. All rights are reserved, including those for text and data mining, AI training, and similar technologies.",
        "openaccess": "0",
        "prism:issn": "20954956",
        "dcterms:subject": [
          {
            "@_fa": "true",
            "$": "Reform"
          },
          {
            "@_fa": "true",
            "$": "Metal-supported solid oxide fuel cell"
          },
          {
            "@_fa": "true",
            "$": "Powertrain systems"
          },
          {
            "@_fa": "true",
            "$": "Fuel cell"
          },
          {
            "@_fa": "true",
            "$": "Hybrid electric vehicle"
          },
          {
            "@_fa": "true",
            "$": "Biofuel"
          }
        ],
        "openaccessArticle": "false",
        "prism:publicationName": "Journal of Energy Chemistry",
        "openaccessSponsorType": null,
        "prism:pageRange": "106-153",
        "prism:endingPage": "153",
        "pubType": "rev",
        "prism:coverDisplayDate": "April 2025",
        "prism:doi": "10.1016/j.jechem.2024.10.056",
        "prism:startingPage": "106",
        "dc:identifier": "doi:10.1016/j.jechem.2024.10.056",
        "openaccessSponsorName": null
      },
      "objects": {
        "object": [
          {
            "@category": "standard",
            "@height": "154",
            "@width": "111",
            "@_fa": "true",
            "$": "https://api.elsevier.com/content/object/eid/1-s2.0-S2095495624007848-fx1.jpg?httpAccept=%2A%2F%2A",
            "@multimediatype": "JPEG image file",
            "@type": "IMAGE-DOWNSAMPLED",
            "@size": "6762",
            "@ref": "fx1",
            "@mimetype": "image/jpeg"
          },
          {
            "@category": "standard",
            "@height": "155",
            "@width": "111",
            "@_fa": "true",
            "$": "https://api.elsevier.com/content/object/eid/1-s2.0-S2095495624007848-fx10.jpg?httpAccept=%2A%2F%2A",
            "@multimediatype": "JPEG image file",
            "@type": "IMAGE-DOWNSAMPLED",
            "@size": "8221",
            "@ref": "fx10",
            "@mimetype": "image/jpeg"
          },
          {
            "@category": "standard",
            "@height": "155",
            "@width": "111",
            "@_fa": "true",
            "$": "https://api.elsevier.com/content/object/eid/1-s2.0-S2095495624007848-fx2.jpg?httpAccept=%2A%2F%2A",
            "@multimediatype": "JPEG image file",
            "@type": "IMAGE-DOWNSAMPLED",
            "@size": "9140",
            "@ref": "fx2",
            "@mimetype": "image/jpeg"
          },
          {
            "@category": "standard",
            "@height": "153",
            "@width": "111",
            "@_fa": "true",
            "$": "https://api.elsevier.com/content/object/eid/1-s2.0-S2095495624007848-fx3.jpg?httpAccept=%2A%2F%2A",
            "@multimediatype": "JPEG image file",
            "@type": "IMAGE-DOWNSAMPLED",
            "@size": "6654",
            "@ref": "fx3",
            "@mimetype": "image/jpeg"
          },
          {
            "@category": "standard",
            "@height": "155",
            "@width": "111",
            "@_fa": "true",
            "$": "https://api.elsevier.com/content/object/eid/1-s2.0-S2095495624007848-fx4.jpg?httpAccept=%2A%2F%2A",
            "@multimediatype": "JPEG image file",
            "@type": "IMAGE-DOWNSAMPLED",
            "@size": "4910",
            "@ref": "fx4",
            "@mimetype": "image/jpeg"
          },
          {
            "@category": "standard",
            "@height": "155",
            "@width": "111",
            "@_fa": "true",
            "$": "https://api.elsevier.com/content/object/eid/1-s2.0-S2095495624007848-fx5.jpg?httpAccept=%2A%2F%2A",
            "@multimediatype": "JPEG image file",
            "@type": "IMAGE-DOWNSAMPLED",
            "@size": "7097",
            "@ref": "fx5",
            "@mimetype": "image/jpeg"
          },
          {
            "@category": "standard",
            "@height": "155",
            "@width": "111",
            "@_fa": "true",
            "$": "https://api.elsevier.com/content/object/eid/1-s2.0-S2095495624007848-fx6.jpg?httpAccept=%2A%2F%2A",
            "@multimediatype": "JPEG image file",
            "@type": "IMAGE-DOWNSAMPLED",
            "@size": "7310",
            "@ref": "fx6",
            "@mimetype": "image/jpeg"
          },
          {
            "@category": "standard",
            "@height": "155",
            "@width": "111",
            "@_fa": "true",
            "$": "https://api.elsevier.com/content/object/eid/1-s2.0-S2095495624007848-fx7.jpg?httpAccept=%2A%2F%2A",
            "@multimediatype": "JPEG image file",
            "@type": "IMAGE-DOWNSAMPLED",
            "@size": "6784",
            "@ref": "fx7",
            "@mimetype": "image/jpeg"
          },
          {
            "@category": "standard",
            "@height": "155",
            "@width": "111",
            "@_fa": "true",
            "$": "https://api.elsevier.com/content/object/eid/1-s2.0-S2095495624007848-fx8.jpg?httpAccept=%2A%2F%2A",
            "@multimediatype": "JPEG image file",
            "@type": "IMAGE-DOWNSAMPLED",
            "@size": "6881",
            "@ref": "fx8",
            "@mimetype": "image/jpeg"
          },
          {
            "@category": "standard",
            "@height": "155",
            "@width": "111",
            "@_fa": "true",
            "$": "https://api.elsevier.com/content/object/eid/1-s2.0-S2095495624007848-fx9.jpg?httpAccept=%2A%2F%2A",
            "@multimediatype": "JPEG image file",
            "@type": "IMAGE-DOWNSAMPLED",
            "@size": "8060",
            "@ref": "fx9",
            "@mimetype": "image/jpeg"
          },
          {
            "@category": "standard",
            "@height": "200",
            "@width": "301",
            "@_fa": "true",
            "$": "https://api.elsevier.com/content/object/eid/1-s2.0-S2095495624007848-ga1.jpg?httpAccept=%2A%2F%2A",
            "@multimediatype": "JPEG image file",
            "@type": "IMAGE-DOWNSAMPLED",
            "@size": "16298",
            "@ref": "ga1",
            "@mimetype": "image/jpeg"
          },
          {
            "@category": "standard",
            "@height": "667",
            "@width": "378",
            "@_fa": "true",
            "$": "https://api.elsevier.com/content/object/eid/1-s2.0-S2095495624007848-gr1.jpg?httpAccept=%2A%2F%2A",
            "@multimediatype": "JPEG image file",
            "@type": "IMAGE-DOWNSAMPLED",
            "@size": "60151",
            "@ref": "gr1",
            "@mimetype": "image/jpeg"
          },
          {
            "@category": "standard",
            "@height": "372",
            "@width": "535",
            "@_fa": "true",
            "$": "https://api.elsevier.com/content/object/eid/1-s2.0-S2095495624007848-gr10.jpg?httpAccept=%2A%2F%2A",
            "@multimediatype": "JPEG image file",
            "@type": "IMAGE-DOWNSAMPLED",
            "@size": "39703",
            "@ref": "gr10",
            "@mimetype": "image/jpeg"
          },
          {
            "@category": "standard",
            "@height": "263",
            "@width": "711",
            "@_fa": "true",
            "$": "https://api.elsevier.com/content/object/eid/1-s2.0-S2095495624007848-gr11.jpg?httpAccept=%2A%2F%2A",
            "@multimediatype": "JPEG image file",
            "@type": "IMAGE-DOWNSAMPLED",
            "@size": "83166",
            "@ref": "gr11",
            "@mimetype": "image/jpeg"
          },
          {
            "@category": "standard",
            "@height": "726",
            "@width": "788",
            "@_fa": "true",
            "$": "https://api.elsevier.com/content/object/eid/1-s2.0-S2095495624007848-gr12.jpg?httpAccept=%2A%2F%2A",
            "@multimediatype": "JPEG image file",
            "@type": "IMAGE-DOWNSAMPLED",
            "@size": "155116",
            "@ref": "gr12",
            "@mimetype": "image/jpeg"
          },
          {
            "@category": "standard",
            "@height": "314",
            "@width": "383",
            "@_fa": "true",
            "$": "https://api.elsevier.com/content/object/eid/1-s2.0-S2095495624007848-gr13.jpg?httpAccept=%2A%2F%2A",
            "@multimediatype": "JPEG image file",
            "@type": "IMAGE-DOWNSAMPLED",
            "@size": "29130",
            "@ref": "gr13",
            "@mimetype": "image/jpeg"
          },
          {
            "@category": "standard",
            "@height": "358",
            "@width": "534",
            "@_fa": "true",
            "$": "https://api.elsevier.com/content/object/eid/1-s2.0-S2095495624007848-gr14.jpg?httpAccept=%2A%2F%2A",
            "@multimediatype": "JPEG image file",
            "@type": "IMAGE-DOWNSAMPLED",
            "@size": "50605",
            "@ref": "gr14",
            "@mimetype": "image/jpeg"
          },
          {
            "@category": "standard",
            "@height": "176",
            "@width": "666",
            "@_fa": "true",
            "$": "https://api.elsevier.com/content/object/eid/1-s2.0-S2095495624007848-gr15.jpg?httpAccept=%2A%2F%2A",
            "@multimediatype": "JPEG image file",
            "@type": "IMAGE-DOWNSAMPLED",
            "@size": "53889",
            "@ref": "gr15",
            "@mimetype": "image/jpeg"
          },
          {
            "@category": "standard",
            "@height": "398",
            "@width": "534",
            "@_fa": "true",
            "$": "https://api.elsevier.com/content/object/eid/1-s2.0-S2095495624007848-gr16.jpg?httpAccept=%2A%2F%2A",
            "@multimediatype": "JPEG image file",
            "@type": "IMAGE-DOWNSAMPLED",
            "@size": "60512",
            "@ref": "gr16",
            "@mimetype": "image/jpeg"
          },
          {
            "@category": "standard",
            "@height": "409",
            "@width": "534",
            "@_fa": "true",
            "$": "https://api.elsevier.com/content/object/eid/1-s2.0-S2095495624007848-gr17.jpg?httpAccept=%2A%2F%2A",
            "@multimediatype": "JPEG image file",
            "@type": "IMAGE-DOWNSAMPLED",
            "@size": "69998",
            "@ref": "gr17",
            "@mimetype": "image/jpeg"
          },
          {
            "@category": "standard",
            "@height": "454",
            "@width": "753",
            "@_fa": "true",
            "$": "https://api.elsevier.com/content/object/eid/1-s2.0-S2095495624007848-gr18.jpg?httpAccept=%2A%2F%2A",
            "@multimediatype": "JPEG image file",
            "@type": "IMAGE-DOWNSAMPLED",
            "@size": "87657",
            "@ref": "gr18",
            "@mimetype": "image/jpeg"
          },
          {
            "@category": "standard",
            "@height": "850",
            "@width": "752",
            "@_fa": "true",
            "$": "https://api.elsevier.com/content/object/eid/1-s2.0-S2095495624007848-gr19.jpg?httpAccept=%2A%2F%2A",
            "@multimediatype": "JPEG image file",
            "@type": "IMAGE-DOWNSAMPLED",
            "@size": "105572",
            "@ref": "gr19",
            "@mimetype": "image/jpeg"
          },
          {
            "@category": "standard",
            "@height": "846",
            "@width": "749",
            "@_fa": "true",
            "$": "https://api.elsevier.com/content/object/eid/1-s2.0-S2095495624007848-gr2.jpg?httpAccept=%2A%2F%2A",
            "@multimediatype": "JPEG image file",
            "@type": "IMAGE-DOWNSAMPLED",
            "@size": "166901",
            "@ref": "gr2",
            "@mimetype": "image/jpeg"
          },
          {
            "@category": "standard",
            "@height": "305",
            "@width": "378",
            "@_fa": "true",
            "$": "https://api.elsevier.com/content/object/eid/1-s2.0-S2095495624007848-gr20.jpg?httpAccept=%2A%2F%2A",
            "@multimediatype": "JPEG image file",
            "@type": "IMAGE-DOWNSAMPLED",
            "@size": "30452",
            "@ref": "gr20",
            "@mimetype": "image/jpeg"
          },
          {
            "@category": "standard",
            "@height": "565",
            "@width": "578",
            "@_fa": "true",
            "$": "https://api.elsevier.com/content/object/eid/1-s2.0-S2095495624007848-gr21.jpg?httpAccept=%2A%2F%2A",
            "@multimediatype": "JPEG image file",
            "@type": "IMAGE-DOWNSAMPLED",
            "@size": "66860",
            "@ref": "gr21",
            "@mimetype": "image/jpeg"
          },
          {
            "@category": "standard",
            "@height": "242",
            "@width": "535",
            "@_fa": "true",
            "$": "https://api.elsevier.com/content/object/eid/1-s2.0-S2095495624007848-gr3.jpg?httpAccept=%2A%2F%2A",
            "@multimediatype": "JPEG image file",
            "@type": "IMAGE-DOWNSAMPLED",
            "@size": "24986",
            "@ref": "gr3",
            "@mimetype": "image/jpeg"
          },
          {
            "@category": "standard",
            "@height": "293",
            "@width": "667",
            "@_fa": "true",
            "$": "https://api.elsevier.com/content/object/eid/1-s2.0-S2095495624007848-gr4.jpg?httpAccept=%2A%2F%2A",
            "@multimediatype": "JPEG image file",
            "@type": "IMAGE-DOWNSAMPLED",
            "@size": "75423",
            "@ref": "gr4",
            "@mimetype": "image/jpeg"
          },
          {
            "@category": "standard",
            "@height": "342",
            "@width": "383",
            "@_fa": "true",
            "$": "https://api.elsevier.com/content/object/eid/1-s2.0-S2095495624007848-gr5.jpg?httpAccept=%2A%2F%2A",
            "@multimediatype": "JPEG image file",
            "@type": "IMAGE-DOWNSAMPLED",
            "@size": "32126",
            "@ref": "gr5",
            "@mimetype": "image/jpeg"
          },
          {
            "@category": "standard",
            "@height": "323",
            "@width": "659",
            "@_fa": "true",
            "$": "https://api.elsevier.com/content/object/eid/1-s2.0-S2095495624007848-gr6.jpg?httpAccept=%2A%2F%2A",
            "@multimediatype": "JPEG image file",
            "@type": "IMAGE-DOWNSAMPLED",
            "@size": "59551",
            "@ref": "gr6",
            "@mimetype": "image/jpeg"
          },
          {
            "@category": "standard",
            "@height": "695",
            "@width": "750",
            "@_fa": "true",
            "$": "https://api.elsevier.com/content/object/eid/1-s2.0-S2095495624007848-gr7.jpg?httpAccept=%2A%2F%2A",
            "@multimediatype": "JPEG image file",
            "@type": "IMAGE-DOWNSAMPLED",
            "@size": "171710",
            "@ref": "gr7",
            "@mimetype": "image/jpeg"
          },
          {
            "@category": "standard",
            "@height": "484",
            "@width": "778",
            "@_fa": "true",
            "$": "https://api.elsevier.com/content/object/eid/1-s2.0-S2095495624007848-gr8.jpg?httpAccept=%2A%2F%2A",
            "@multimediatype": "JPEG image file",
            "@type": "IMAGE-DOWNSAMPLED",
            "@size": "117410",
            "@ref": "gr8",
            "@mimetype": "image/jpeg"
          },
          {
            "@category": "standard",
            "@height": "504",
            "@width": "778",
            "@_fa": "true",
            "$": "https://api.elsevier.com/content/object/eid/1-s2.0-S2095495624007848-gr9.jpg?httpAccept=%2A%2F%2A",
            "@multimediatype": "JPEG image file",
            "@type": "IMAGE-DOWNSAMPLED",
            "@size": "114895",
            "@ref": "gr9",
            "@mimetype": "image/jpeg"
          },
          {
            "@category": "thumbnail",
            "@height": "164",
            "@width": "118",
            "@_fa": "true",
            "$": "https://api.elsevier.com/content/object/eid/1-s2.0-S2095495624007848-fx1.sml?httpAccept=%2A%2F%2A",
            "@multimediatype": "GIF image file",
            "@type": "IMAGE-THUMBNAIL",
            "@size": "16731",
            "@ref": "fx1",
            "@mimetype": "image/gif"
          },
          {
            "@category": "thumbnail",
            "@height": "163",
            "@width": "117",
            "@_fa": "true",
            "$": "https://api.elsevier.com/content/object/eid/1-s2.0-S2095495624007848-fx10.sml?httpAccept=%2A%2F%2A",
            "@multimediatype": "GIF image file",
            "@type": "IMAGE-THUMBNAIL",
            "@size": "17251",
            "@ref": "fx10",
            "@mimetype": "image/gif"
          },
          {
            "@category": "thumbnail",
            "@height": "164",
            "@width": "117",
            "@_fa": "true",
            "$": "https://api.elsevier.com/content/object/eid/1-s2.0-S2095495624007848-fx2.sml?httpAccept=%2A%2F%2A",
            "@multimediatype": "GIF image file",
            "@type": "IMAGE-THUMBNAIL",
            "@size": "17721",
            "@ref": "fx2",
            "@mimetype": "image/gif"
          },
          {
            "@category": "thumbnail",
            "@height": "164",
            "@width": "119",
            "@_fa": "true",
            "$": "https://api.elsevier.com/content/object/eid/1-s2.0-S2095495624007848-fx3.sml?httpAccept=%2A%2F%2A",
            "@multimediatype": "GIF image file",
            "@type": "IMAGE-THUMBNAIL",
            "@size": "16032",
            "@ref": "fx3",
            "@mimetype": "image/gif"
          },
          {
            "@category": "thumbnail",
            "@height": "164",
            "@width": "117",
            "@_fa": "true",
            "$": "https://api.elsevier.com/content/object/eid/1-s2.0-S2095495624007848-fx4.sml?httpAccept=%2A%2F%2A",
            "@multimediatype": "GIF image file",
            "@type": "IMAGE-THUMBNAIL",
            "@size": "14008",
            "@ref": "fx4",
            "@mimetype": "image/gif"
          },
          {
            "@category": "thumbnail",
            "@height": "164",
            "@width": "117",
            "@_fa": "true",
            "$": "https://api.elsevier.com/content/object/eid/1-s2.0-S2095495624007848-fx5.sml?httpAccept=%2A%2F%2A",
            "@multimediatype": "GIF image file",
            "@type": "IMAGE-THUMBNAIL",
            "@size": "17733",
            "@ref": "fx5",
            "@mimetype": "image/gif"
          },
          {
            "@category": "thumbnail",
            "@height": "164",
            "@width": "117",
            "@_fa": "true",
            "$": "https://api.elsevier.com/content/object/eid/1-s2.0-S2095495624007848-fx6.sml?httpAccept=%2A%2F%2A",
            "@multimediatype": "GIF image file",
            "@type": "IMAGE-THUMBNAIL",
            "@size": "15674",
            "@ref": "fx6",
            "@mimetype": "image/gif"
          },
          {
            "@category": "thumbnail",
            "@height": "164",
            "@width": "117",
            "@_fa": "true",
            "$": "https://api.elsevier.com/content/object/eid/1-s2.0-S2095495624007848-fx7.sml?httpAccept=%2A%2F%2A",
            "@multimediatype": "GIF image file",
            "@type": "IMAGE-THUMBNAIL",
            "@size": "15474",
            "@ref": "fx7",
            "@mimetype": "image/gif"
          },
          {
            "@category": "thumbnail",
            "@height": "164",
            "@width": "117",
            "@_fa": "true",
            "$": "https://api.elsevier.com/content/object/eid/1-s2.0-S2095495624007848-fx8.sml?httpAccept=%2A%2F%2A",
            "@multimediatype": "GIF image file",
            "@type": "IMAGE-THUMBNAIL",
            "@size": "14987",
            "@ref": "fx8",
            "@mimetype": "image/gif"
          },
          {
            "@category": "thumbnail",
            "@height": "164",
            "@width": "117",
            "@_fa": "true",
            "$": "https://api.elsevier.com/content/object/eid/1-s2.0-S2095495624007848-fx9.sml?httpAccept=%2A%2F%2A",
            "@multimediatype": "GIF image file",
            "@type": "IMAGE-THUMBNAIL",
            "@size": "18186",
            "@ref": "fx9",
            "@mimetype": "image/gif"
          },
          {
            "@category": "thumbnail",
            "@height": "145",
            "@width": "219",
            "@_fa": "true",
            "$": "https://api.elsevier.com/content/object/eid/1-s2.0-S2095495624007848-ga1.sml?httpAccept=%2A%2F%2A",
            "@multimediatype": "GIF image file",
            "@type": "IMAGE-THUMBNAIL",
            "@size": "12219",
            "@ref": "ga1",
            "@mimetype": "image/gif"
          },
          {
            "@category": "thumbnail",
            "@height": "164",
            "@width": "93",
            "@_fa": "true",
            "$": "https://api.elsevier.com/content/object/eid/1-s2.0-S2095495624007848-gr1.sml?httpAccept=%2A%2F%2A",
            "@multimediatype": "GIF image file",
            "@type": "IMAGE-THUMBNAIL",
            "@size": "5805",
            "@ref": "gr1",
            "@mimetype": "image/gif"
          },
          {
            "@category": "thumbnail",
            "@height": "152",
            "@width": "219",
            "@_fa": "true",
            "$": "https://api.elsevier.com/content/object/eid/1-s2.0-S2095495624007848-gr10.sml?httpAccept=%2A%2F%2A",
            "@multimediatype": "GIF image file",
            "@type": "IMAGE-THUMBNAIL",
            "@size": "10437",
            "@ref": "gr10",
            "@mimetype": "image/gif"
          },
          {
            "@category": "thumbnail",
            "@height": "81",
            "@width": "219",
            "@_fa": "true",
            "$": "https://api.elsevier.com/content/object/eid/1-s2.0-S2095495624007848-gr11.sml?httpAccept=%2A%2F%2A",
            "@multimediatype": "GIF image file",
            "@type": "IMAGE-THUMBNAIL",
            "@size": "15939",
            "@ref": "gr11",
            "@mimetype": "image/gif"
          },
          {
            "@category": "thumbnail",
            "@height": "164",
            "@width": "178",
            "@_fa": "true",
            "$": "https://api.elsevier.com/content/object/eid/1-s2.0-S2095495624007848-gr12.sml?httpAccept=%2A%2F%2A",
            "@multimediatype": "GIF image file",
            "@type": "IMAGE-THUMBNAIL",
            "@size": "13633",
            "@ref": "gr12",
            "@mimetype": "image/gif"
          },
          {
            "@category": "thumbnail",
            "@height": "164",
            "@width": "200",
            "@_fa": "true",
            "$": "https://api.elsevier.com/content/object/eid/1-s2.0-S2095495624007848-gr13.sml?httpAccept=%2A%2F%2A",
            "@multimediatype": "GIF image file",
            "@type": "IMAGE-THUMBNAIL",
            "@size": "6712",
            "@ref": "gr13",
            "@mimetype": "image/gif"
          },
          {
            "@category": "thumbnail",
            "@height": "147",
            "@width": "219",
            "@_fa": "true",
            "$": "https://api.elsevier.com/content/object/eid/1-s2.0-S2095495624007848-gr14.sml?httpAccept=%2A%2F%2A",
            "@multimediatype": "GIF image file",
            "@type": "IMAGE-THUMBNAIL",
            "@size": "12850",
            "@ref": "gr14",
            "@mimetype": "image/gif"
          },
          {
            "@category": "thumbnail",
            "@height": "58",
            "@width": "219",
            "@_fa": "true",
            "$": "https://api.elsevier.com/content/object/eid/1-s2.0-S2095495624007848-gr15.sml?httpAccept=%2A%2F%2A",
            "@multimediatype": "GIF image file",
            "@type": "IMAGE-THUMBNAIL",
            "@size": "8214",
            "@ref": "gr15",
            "@mimetype": "image/gif"
          },
          {
            "@category": "thumbnail",
            "@height": "163",
            "@width": "219",
            "@_fa": "true",
            "$": "https://api.elsevier.com/content/object/eid/1-s2.0-S2095495624007848-gr16.sml?httpAccept=%2A%2F%2A",
            "@multimediatype": "GIF image file",
            "@type": "IMAGE-THUMBNAIL",
            "@size": "11813",
            "@ref": "gr16",
            "@mimetype": "image/gif"
          },
          {
            "@category": "thumbnail",
            "@height": "164",
            "@width": "214",
            "@_fa": "true",
            "$": "https://api.elsevier.com/content/object/eid/1-s2.0-S2095495624007848-gr17.sml?httpAccept=%2A%2F%2A",
            "@multimediatype": "GIF image file",
            "@type": "IMAGE-THUMBNAIL",
            "@size": "18485",
            "@ref": "gr17",
            "@mimetype": "image/gif"
          },
          {
            "@category": "thumbnail",
            "@height": "132",
            "@width": "219",
            "@_fa": "true",
            "$": "https://api.elsevier.com/content/object/eid/1-s2.0-S2095495624007848-gr18.sml?httpAccept=%2A%2F%2A",
            "@multimediatype": "GIF image file",
            "@type": "IMAGE-THUMBNAIL",
            "@size": "13119",
            "@ref": "gr18",
            "@mimetype": "image/gif"
          },
          {
            "@category": "thumbnail",
            "@height": "164",
            "@width": "145",
            "@_fa": "true",
            "$": "https://api.elsevier.com/content/object/eid/1-s2.0-S2095495624007848-gr19.sml?httpAccept=%2A%2F%2A",
            "@multimediatype": "GIF image file",
            "@type": "IMAGE-THUMBNAIL",
            "@size": "7615",
            "@ref": "gr19",
            "@mimetype": "image/gif"
          },
          {
            "@category": "thumbnail",
            "@height": "164",
            "@width": "145",
            "@_fa": "true",
            "$": "https://api.elsevier.com/content/object/eid/1-s2.0-S2095495624007848-gr2.sml?httpAccept=%2A%2F%2A",
            "@multimediatype": "GIF image file",
            "@type": "IMAGE-THUMBNAIL",
            "@size": "9624",
            "@ref": "gr2",
            "@mimetype": "image/gif"
          },
          {
            "@category": "thumbnail",
            "@height": "164",
            "@width": "203",
            "@_fa": "true",
            "$": "https://api.elsevier.com/content/object/eid/1-s2.0-S2095495624007848-gr20.sml?httpAccept=%2A%2F%2A",
            "@multimediatype": "GIF image file",
            "@type": "IMAGE-THUMBNAIL",
            "@size": "8731",
            "@ref": "gr20",
            "@mimetype": "image/gif"
          },
          {
            "@category": "thumbnail",
            "@height": "164",
            "@width": "168",
            "@_fa": "true",
            "$": "https://api.elsevier.com/content/object/eid/1-s2.0-S2095495624007848-gr21.sml?httpAccept=%2A%2F%2A",
            "@multimediatype": "GIF image file",
            "@type": "IMAGE-THUMBNAIL",
            "@size": "10344",
            "@ref": "gr21",
            "@mimetype": "image/gif"
          },
          {
            "@category": "thumbnail",
            "@height": "99",
            "@width": "219",
            "@_fa": "true",
            "$": "https://api.elsevier.com/content/object/eid/1-s2.0-S2095495624007848-gr3.sml?httpAccept=%2A%2F%2A",
            "@multimediatype": "GIF image file",
            "@type": "IMAGE-THUMBNAIL",
            "@size": "4739",
            "@ref": "gr3",
            "@mimetype": "image/gif"
          },
          {
            "@category": "thumbnail",
            "@height": "96",
            "@width": "219",
            "@_fa": "true",
            "$": "https://api.elsevier.com/content/object/eid/1-s2.0-S2095495624007848-gr4.sml?httpAccept=%2A%2F%2A",
            "@multimediatype": "GIF image file",
            "@type": "IMAGE-THUMBNAIL",
            "@size": "10582",
            "@ref": "gr4",
            "@mimetype": "image/gif"
          },
          {
            "@category": "thumbnail",
            "@height": "164",
            "@width": "184",
            "@_fa": "true",
            "$": "https://api.elsevier.com/content/object/eid/1-s2.0-S2095495624007848-gr5.sml?httpAccept=%2A%2F%2A",
            "@multimediatype": "GIF image file",
            "@type": "IMAGE-THUMBNAIL",
            "@size": "6931",
            "@ref": "gr5",
            "@mimetype": "image/gif"
          },
          {
            "@category": "thumbnail",
            "@height": "107",
            "@width": "219",
            "@_fa": "true",
            "$": "https://api.elsevier.com/content/object/eid/1-s2.0-S2095495624007848-gr6.sml?httpAccept=%2A%2F%2A",
            "@multimediatype": "GIF image file",
            "@type": "IMAGE-THUMBNAIL",
            "@size": "9977",
            "@ref": "gr6",
            "@mimetype": "image/gif"
          },
          {
            "@category": "thumbnail",
            "@height": "164",
            "@width": "177",
            "@_fa": "true",
            "$": "https://api.elsevier.com/content/object/eid/1-s2.0-S2095495624007848-gr7.sml?httpAccept=%2A%2F%2A",
            "@multimediatype": "GIF image file",
            "@type": "IMAGE-THUMBNAIL",
            "@size": "17713",
            "@ref": "gr7",
            "@mimetype": "image/gif"
          },
          {
            "@category": "thumbnail",
            "@height": "136",
            "@width": "219",
            "@_fa": "true",
            "$": "https://api.elsevier.com/content/object/eid/1-s2.0-S2095495624007848-gr8.sml?httpAccept=%2A%2F%2A",
            "@multimediatype": "GIF image file",
            "@type": "IMAGE-THUMBNAIL",
            "@size": "18242",
            "@ref": "gr8",
            "@mimetype": "image/gif"
          },
          {
            "@category": "thumbnail",
            "@height": "142",
            "@width": "219",
            "@_fa": "true",
            "$": "https://api.elsevier.com/content/object/eid/1-s2.0-S2095495624007848-gr9.sml?httpAccept=%2A%2F%2A",
            "@multimediatype": "GIF image file",
            "@type": "IMAGE-THUMBNAIL",
            "@size": "17782",
            "@ref": "gr9",
            "@mimetype": "image/gif"
          },
          {
            "@category": "high",
            "@height": "683",
            "@width": "492",
            "@_fa": "true",
            "$": "https://api.elsevier.com/content/object/eid/1-s2.0-S2095495624007848-fx1_lrg.jpg?httpAccept=%2A%2F%2A",
            "@multimediatype": "JPEG image file",
            "@type": "IMAGE-HIGH-RES",
            "@size": "49798",
            "@ref": "fx1",
            "@mimetype": "image/jpeg"
          },
          {
            "@category": "high",
            "@height": "686",
            "@width": "492",
            "@_fa": "true",
            "$": "https://api.elsevier.com/content/object/eid/1-s2.0-S2095495624007848-fx10_lrg.jpg?httpAccept=%2A%2F%2A",
            "@multimediatype": "JPEG image file",
            "@type": "IMAGE-HIGH-RES",
            "@size": "58358",
            "@ref": "fx10",
            "@mimetype": "image/jpeg"
          },
          {
            "@category": "high",
            "@height": "413",
            "@width": "295",
            "@_fa": "true",
            "$": "https://api.elsevier.com/content/object/eid/1-s2.0-S2095495624007848-fx2_lrg.jpg?httpAccept=%2A%2F%2A",
            "@multimediatype": "JPEG image file",
            "@type": "IMAGE-HIGH-RES",
            "@size": "30502",
            "@ref": "fx2",
            "@mimetype": "image/jpeg"
          },
          {
            "@category": "high",
            "@height": "676",
            "@width": "492",
            "@_fa": "true",
            "$": "https://api.elsevier.com/content/object/eid/1-s2.0-S2095495624007848-fx3_lrg.jpg?httpAccept=%2A%2F%2A",
            "@multimediatype": "JPEG image file",
            "@type": "IMAGE-HIGH-RES",
            "@size": "46799",
            "@ref": "fx3",
            "@mimetype": "image/jpeg"
          },
          {
            "@category": "high",
            "@height": "413",
            "@width": "295",
            "@_fa": "true",
            "$": "https://api.elsevier.com/content/object/eid/1-s2.0-S2095495624007848-fx4_lrg.jpg?httpAccept=%2A%2F%2A",
            "@multimediatype": "JPEG image file",
            "@type": "IMAGE-HIGH-RES",
            "@size": "14543",
            "@ref": "fx4",
            "@mimetype": "image/jpeg"
          },
          {
            "@category": "high",
            "@height": "413",
            "@width": "295",
            "@_fa": "true",
            "$": "https://api.elsevier.com/content/object/eid/1-s2.0-S2095495624007848-fx5_lrg.jpg?httpAccept=%2A%2F%2A",
            "@multimediatype": "JPEG image file",
            "@type": "IMAGE-HIGH-RES",
            "@size": "21281",
            "@ref": "fx5",
            "@mimetype": "image/jpeg"
          },
          {
            "@category": "high",
            "@height": "413",
            "@width": "295",
            "@_fa": "true",
            "$": "https://api.elsevier.com/content/object/eid/1-s2.0-S2095495624007848-fx6_lrg.jpg?httpAccept=%2A%2F%2A",
            "@multimediatype": "JPEG image file",
            "@type": "IMAGE-HIGH-RES",
            "@size": "22032",
            "@ref": "fx6",
            "@mimetype": "image/jpeg"
          },
          {
            "@category": "high",
            "@height": "413",
            "@width": "295",
            "@_fa": "true",
            "$": "https://api.elsevier.com/content/object/eid/1-s2.0-S2095495624007848-fx7_lrg.jpg?httpAccept=%2A%2F%2A",
            "@multimediatype": "JPEG image file",
            "@type": "IMAGE-HIGH-RES",
            "@size": "20930",
            "@ref": "fx7",
            "@mimetype": "image/jpeg"
          },
          {
            "@category": "high",
            "@height": "413",
            "@width": "295",
            "@_fa": "true",
            "$": "https://api.elsevier.com/content/object/eid/1-s2.0-S2095495624007848-fx8_lrg.jpg?httpAccept=%2A%2F%2A",
            "@multimediatype": "JPEG image file",
            "@type": "IMAGE-HIGH-RES",
            "@size": "21314",
            "@ref": "fx8",
            "@mimetype": "image/jpeg"
          },
          {
            "@category": "high",
            "@height": "413",
            "@width": "295",
            "@_fa": "true",
            "$": "https://api.elsevier.com/content/object/eid/1-s2.0-S2095495624007848-fx9_lrg.jpg?httpAccept=%2A%2F%2A",
            "@multimediatype": "JPEG image file",
            "@type": "IMAGE-HIGH-RES",
            "@size": "26999",
            "@ref": "fx9",
            "@mimetype": "image/jpeg"
          },
          {
            "@category": "high",
            "@height": "886",
            "@width": "1336",
            "@_fa": "true",
            "$": "https://api.elsevier.com/content/object/eid/1-s2.0-S2095495624007848-ga1_lrg.jpg?httpAccept=%2A%2F%2A",
            "@multimediatype": "JPEG image file",
            "@type": "IMAGE-HIGH-RES",
            "@size": "112513",
            "@ref": "ga1",
            "@mimetype": "image/jpeg"
          },
          {
            "@category": "high",
            "@height": "2950",
            "@width": "1673",
            "@_fa": "true",
            "$": "https://api.elsevier.com/content/object/eid/1-s2.0-S2095495624007848-gr1_lrg.jpg?httpAccept=%2A%2F%2A",
            "@multimediatype": "JPEG image file",
            "@type": "IMAGE-HIGH-RES",
            "@size": "315517",
            "@ref": "gr1",
            "@mimetype": "image/jpeg"
          },
          {
            "@category": "high",
            "@height": "1646",
            "@width": "2368",
            "@_fa": "true",
            "$": "https://api.elsevier.com/content/object/eid/1-s2.0-S2095495624007848-gr10_lrg.jpg?httpAccept=%2A%2F%2A",
            "@multimediatype": "JPEG image file",
            "@type": "IMAGE-HIGH-RES",
            "@size": "245132",
            "@ref": "gr10",
            "@mimetype": "image/jpeg"
          },
          {
            "@category": "high",
            "@height": "1165",
            "@width": "3150",
            "@_fa": "true",
            "$": "https://api.elsevier.com/content/object/eid/1-s2.0-S2095495624007848-gr11_lrg.jpg?httpAccept=%2A%2F%2A",
            "@multimediatype": "JPEG image file",
            "@type": "IMAGE-HIGH-RES",
            "@size": "492805",
            "@ref": "gr11",
            "@mimetype": "image/jpeg"
          },
          {
            "@category": "high",
            "@height": "3214",
            "@width": "3487",
            "@_fa": "true",
            "$": "https://api.elsevier.com/content/object/eid/1-s2.0-S2095495624007848-gr12_lrg.jpg?httpAccept=%2A%2F%2A",
            "@multimediatype": "JPEG image file",
            "@type": "IMAGE-HIGH-RES",
            "@size": "842320",
            "@ref": "gr12",
            "@mimetype": "image/jpeg"
          },
          {
            "@category": "high",
            "@height": "1395",
            "@width": "1699",
            "@_fa": "true",
            "$": "https://api.elsevier.com/content/object/eid/1-s2.0-S2095495624007848-gr13_lrg.jpg?httpAccept=%2A%2F%2A",
            "@multimediatype": "JPEG image file",
            "@type": "IMAGE-HIGH-RES",
            "@size": "165358",
            "@ref": "gr13",
            "@mimetype": "image/jpeg"
          },
          {
            "@category": "high",
            "@height": "1586",
            "@width": "2367",
            "@_fa": "true",
            "$": "https://api.elsevier.com/content/object/eid/1-s2.0-S2095495624007848-gr14_lrg.jpg?httpAccept=%2A%2F%2A",
            "@multimediatype": "JPEG image file",
            "@type": "IMAGE-HIGH-RES",
            "@size": "324617",
            "@ref": "gr14",
            "@mimetype": "image/jpeg"
          },
          {
            "@category": "high",
            "@height": "777",
            "@width": "2947",
            "@_fa": "true",
            "$": "https://api.elsevier.com/content/object/eid/1-s2.0-S2095495624007848-gr15_lrg.jpg?httpAccept=%2A%2F%2A",
            "@multimediatype": "JPEG image file",
            "@type": "IMAGE-HIGH-RES",
            "@size": "378437",
            "@ref": "gr15",
            "@mimetype": "image/jpeg"
          },
          {
            "@category": "high",
            "@height": "1766",
            "@width": "2367",
            "@_fa": "true",
            "$": "https://api.elsevier.com/content/object/eid/1-s2.0-S2095495624007848-gr16_lrg.jpg?httpAccept=%2A%2F%2A",
            "@multimediatype": "JPEG image file",
            "@type": "IMAGE-HIGH-RES",
            "@size": "341813",
            "@ref": "gr16",
            "@mimetype": "image/jpeg"
          },
          {
            "@category": "high",
            "@height": "1812",
            "@width": "2367",
            "@_fa": "true",
            "$": "https://api.elsevier.com/content/object/eid/1-s2.0-S2095495624007848-gr17_lrg.jpg?httpAccept=%2A%2F%2A",
            "@multimediatype": "JPEG image file",
            "@type": "IMAGE-HIGH-RES",
            "@size": "503801",
            "@ref": "gr17",
            "@mimetype": "image/jpeg"
          },
          {
            "@category": "high",
            "@height": "2009",
            "@width": "3335",
            "@_fa": "true",
            "$": "https://api.elsevier.com/content/object/eid/1-s2.0-S2095495624007848-gr18_lrg.jpg?httpAccept=%2A%2F%2A",
            "@multimediatype": "JPEG image file",
            "@type": "IMAGE-HIGH-RES",
            "@size": "547111",
            "@ref": "gr18",
            "@mimetype": "image/jpeg"
          },
          {
            "@category": "high",
            "@height": "3764",
            "@width": "3329",
            "@_fa": "true",
            "$": "https://api.elsevier.com/content/object/eid/1-s2.0-S2095495624007848-gr19_lrg.jpg?httpAccept=%2A%2F%2A",
            "@multimediatype": "JPEG image file",
            "@type": "IMAGE-HIGH-RES",
            "@size": "620181",
            "@ref": "gr19",
            "@mimetype": "image/jpeg"
          },
          {
            "@category": "high",
            "@height": "3746",
            "@width": "3317",
            "@_fa": "true",
            "$": "https://api.elsevier.com/content/object/eid/1-s2.0-S2095495624007848-gr2_lrg.jpg?httpAccept=%2A%2F%2A",
            "@multimediatype": "JPEG image file",
            "@type": "IMAGE-HIGH-RES",
            "@size": "993753",
            "@ref": "gr2",
            "@mimetype": "image/jpeg"
          },
          {
            "@category": "high",
            "@height": "1350",
            "@width": "1673",
            "@_fa": "true",
            "$": "https://api.elsevier.com/content/object/eid/1-s2.0-S2095495624007848-gr20_lrg.jpg?httpAccept=%2A%2F%2A",
            "@multimediatype": "JPEG image file",
            "@type": "IMAGE-HIGH-RES",
            "@size": "163313",
            "@ref": "gr20",
            "@mimetype": "image/jpeg"
          },
          {
            "@category": "high",
            "@height": "1656",
            "@width": "1694",
            "@_fa": "true",
            "$": "https://api.elsevier.com/content/object/eid/1-s2.0-S2095495624007848-gr21_lrg.jpg?httpAccept=%2A%2F%2A",
            "@multimediatype": "JPEG image file",
            "@type": "IMAGE-HIGH-RES",
            "@size": "216680",
            "@ref": "gr21",
            "@mimetype": "image/jpeg"
          },
          {
            "@category": "high",
            "@height": "1071",
            "@width": "2368",
            "@_fa": "true",
            "$": "https://api.elsevier.com/content/object/eid/1-s2.0-S2095495624007848-gr3_lrg.jpg?httpAccept=%2A%2F%2A",
            "@multimediatype": "JPEG image file",
            "@type": "IMAGE-HIGH-RES",
            "@size": "137182",
            "@ref": "gr3",
            "@mimetype": "image/jpeg"
          },
          {
            "@category": "high",
            "@height": "1297",
            "@width": "2953",
            "@_fa": "true",
            "$": "https://api.elsevier.com/content/object/eid/1-s2.0-S2095495624007848-gr4_lrg.jpg?httpAccept=%2A%2F%2A",
            "@multimediatype": "JPEG image file",
            "@type": "IMAGE-HIGH-RES",
            "@size": "420362",
            "@ref": "gr4",
            "@mimetype": "image/jpeg"
          },
          {
            "@category": "high",
            "@height": "1515",
            "@width": "1699",
            "@_fa": "true",
            "$": "https://api.elsevier.com/content/object/eid/1-s2.0-S2095495624007848-gr5_lrg.jpg?httpAccept=%2A%2F%2A",
            "@multimediatype": "JPEG image file",
            "@type": "IMAGE-HIGH-RES",
            "@size": "175000",
            "@ref": "gr5",
            "@mimetype": "image/jpeg"
          },
          {
            "@category": "high",
            "@height": "1433",
            "@width": "2920",
            "@_fa": "true",
            "$": "https://api.elsevier.com/content/object/eid/1-s2.0-S2095495624007848-gr6_lrg.jpg?httpAccept=%2A%2F%2A",
            "@multimediatype": "JPEG image file",
            "@type": "IMAGE-HIGH-RES",
            "@size": "395073",
            "@ref": "gr6",
            "@mimetype": "image/jpeg"
          },
          {
            "@category": "high",
            "@height": "3081",
            "@width": "3323",
            "@_fa": "true",
            "$": "https://api.elsevier.com/content/object/eid/1-s2.0-S2095495624007848-gr7_lrg.jpg?httpAccept=%2A%2F%2A",
            "@multimediatype": "JPEG image file",
            "@type": "IMAGE-HIGH-RES",
            "@size": "1116170",
            "@ref": "gr7",
            "@mimetype": "image/jpeg"
          },
          {
            "@category": "high",
            "@height": "2143",
            "@width": "3445",
            "@_fa": "true",
            "$": "https://api.elsevier.com/content/object/eid/1-s2.0-S2095495624007848-gr8_lrg.jpg?httpAccept=%2A%2F%2A",
            "@multimediatype": "JPEG image file",
            "@type": "IMAGE-HIGH-RES",
            "@size": "755279",
            "@ref": "gr8",
            "@mimetype": "image/jpeg"
          },
          {
            "@category": "high",
            "@height": "2231",
            "@width": "3445",
            "@_fa": "true",
            "$": "https://api.elsevier.com/content/object/eid/1-s2.0-S2095495624007848-gr9_lrg.jpg?httpAccept=%2A%2F%2A",
            "@multimediatype": "JPEG image file",
            "@type": "IMAGE-HIGH-RES",
            "@size": "759283",
            "@ref": "gr9",
            "@mimetype": "image/jpeg"
          },
          {
            "@category": "standard",
            "@_fa": "true",
            "$": "https://api.elsevier.com/content/object/eid/1-s2.0-S2095495624007848-mmc1.docx?httpAccept=%2A%2F%2A",
            "@multimediatype": "Microsoft Word file",
            "@type": "APPLICATION",
            "@size": "5763133",
            "@ref": "mmc1",
            "@mimetype": "application/word"
          },
          {
            "@category": "thumbnail",
            "@_fa": "true",
            "$": "https://api.elsevier.com/content/object/eid/1-s2.0-S2095495624007848-si1.svg?httpAccept=%2A%2F%2A",
            "@multimediatype": "Scalable Vector Graphics file",
            "@type": "ALTIMG",
            "@size": "11426",
            "@ref": "si1",
            "@mimetype": "image/svg+xml"
          },
          {
            "@category": "thumbnail",
            "@_fa": "true",
            "$": "https://api.elsevier.com/content/object/eid/1-s2.0-S2095495624007848-si10.svg?httpAccept=%2A%2F%2A",
            "@multimediatype": "Scalable Vector Graphics file",
            "@type": "ALTIMG",
            "@size": "18218",
            "@ref": "si10",
            "@mimetype": "image/svg+xml"
          },
          {
            "@category": "thumbnail",
            "@_fa": "true",
            "$": "https://api.elsevier.com/content/object/eid/1-s2.0-S2095495624007848-si11.svg?httpAccept=%2A%2F%2A",
            "@multimediatype": "Scalable Vector Graphics file",
            "@type": "ALTIMG",
            "@size": "5815",
            "@ref": "si11",
            "@mimetype": "image/svg+xml"
          },
          {
            "@category": "thumbnail",
            "@_fa": "true",
            "$": "https://api.elsevier.com/content/object/eid/1-s2.0-S2095495624007848-si12.svg?httpAccept=%2A%2F%2A",
            "@multimediatype": "Scalable Vector Graphics file",
            "@type": "ALTIMG",
            "@size": "5624",
            "@ref": "si12",
            "@mimetype": "image/svg+xml"
          },
          {
            "@category": "thumbnail",
            "@_fa": "true",
            "$": "https://api.elsevier.com/content/object/eid/1-s2.0-S2095495624007848-si13.svg?httpAccept=%2A%2F%2A",
            "@multimediatype": "Scalable Vector Graphics file",
            "@type": "ALTIMG",
            "@size": "28041",
            "@ref": "si13",
            "@mimetype": "image/svg+xml"
          },
          {
            "@category": "thumbnail",
            "@_fa": "true",
            "$": "https://api.elsevier.com/content/object/eid/1-s2.0-S2095495624007848-si14.svg?httpAccept=%2A%2F%2A",
            "@multimediatype": "Scalable Vector Graphics file",
            "@type": "ALTIMG",
            "@size": "2661",
            "@ref": "si14",
            "@mimetype": "image/svg+xml"
          },
          {
            "@category": "thumbnail",
            "@_fa": "true",
            "$": "https://api.elsevier.com/content/object/eid/1-s2.0-S2095495624007848-si15.svg?httpAccept=%2A%2F%2A",
            "@multimediatype": "Scalable Vector Graphics file",
            "@type": "ALTIMG",
            "@size": "5753",
            "@ref": "si15",
            "@mimetype": "image/svg+xml"
          },
          {
            "@category": "thumbnail",
            "@_fa": "true",
            "$": "https://api.elsevier.com/content/object/eid/1-s2.0-S2095495624007848-si16.svg?httpAccept=%2A%2F%2A",
            "@multimediatype": "Scalable Vector Graphics file",
            "@type": "ALTIMG",
            "@size": "1124",
            "@ref": "si16",
            "@mimetype": "image/svg+xml"
          },
          {
            "@category": "thumbnail",
            "@_fa": "true",
            "$": "https://api.elsevier.com/content/object/eid/1-s2.0-S2095495624007848-si17.svg?httpAccept=%2A%2F%2A",
            "@multimediatype": "Scalable Vector Graphics file",
            "@type": "ALTIMG",
            "@size": "1626",
            "@ref": "si17",
            "@mimetype": "image/svg+xml"
          },
          {
            "@category": "thumbnail",
            "@_fa": "true",
            "$": "https://api.elsevier.com/content/object/eid/1-s2.0-S2095495624007848-si18.svg?httpAccept=%2A%2F%2A",
            "@multimediatype": "Scalable Vector Graphics file",
            "@type": "ALTIMG",
            "@size": "1758",
            "@ref": "si18",
            "@mimetype": "image/svg+xml"
          },
          {
            "@category": "thumbnail",
            "@_fa": "true",
            "$": "https://api.elsevier.com/content/object/eid/1-s2.0-S2095495624007848-si19.svg?httpAccept=%2A%2F%2A",
            "@multimediatype": "Scalable Vector Graphics file",
            "@type": "ALTIMG",
            "@size": "1811",
            "@ref": "si19",
            "@mimetype": "image/svg+xml"
          },
          {
            "@category": "thumbnail",
            "@_fa": "true",
            "$": "https://api.elsevier.com/content/object/eid/1-s2.0-S2095495624007848-si2.svg?httpAccept=%2A%2F%2A",
            "@multimediatype": "Scalable Vector Graphics file",
            "@type": "ALTIMG",
            "@size": "5369",
            "@ref": "si2",
            "@mimetype": "image/svg+xml"
          },
          {
            "@category": "thumbnail",
            "@_fa": "true",
            "$": "https://api.elsevier.com/content/object/eid/1-s2.0-S2095495624007848-si20.svg?httpAccept=%2A%2F%2A",
            "@multimediatype": "Scalable Vector Graphics file",
            "@type": "ALTIMG",
            "@size": "4884",
            "@ref": "si20",
            "@mimetype": "image/svg+xml"
          },
          {
            "@category": "thumbnail",
            "@_fa": "true",
            "$": "https://api.elsevier.com/content/object/eid/1-s2.0-S2095495624007848-si21.svg?httpAccept=%2A%2F%2A",
            "@multimediatype": "Scalable Vector Graphics file",
            "@type": "ALTIMG",
            "@size": "27314",
            "@ref": "si21",
            "@mimetype": "image/svg+xml"
          },
          {
            "@category": "thumbnail",
            "@_fa": "true",
            "$": "https://api.elsevier.com/content/object/eid/1-s2.0-S2095495624007848-si22.svg?httpAccept=%2A%2F%2A",
            "@multimediatype": "Scalable Vector Graphics file",
            "@type": "ALTIMG",
            "@size": "30114",
            "@ref": "si22",
            "@mimetype": "image/svg+xml"
          },
          {
            "@category": "thumbnail",
            "@_fa": "true",
            "$": "https://api.elsevier.com/content/object/eid/1-s2.0-S2095495624007848-si23.svg?httpAccept=%2A%2F%2A",
            "@multimediatype": "Scalable Vector Graphics file",
            "@type": "ALTIMG",
            "@size": "27412",
            "@ref": "si23",
            "@mimetype": "image/svg+xml"
          },
          {
            "@category": "thumbnail",
            "@_fa": "true",
            "$": "https://api.elsevier.com/content/object/eid/1-s2.0-S2095495624007848-si24.svg?httpAccept=%2A%2F%2A",
            "@multimediatype": "Scalable Vector Graphics file",
            "@type": "ALTIMG",
            "@size": "28984",
            "@ref": "si24",
            "@mimetype": "image/svg+xml"
          },
          {
            "@category": "thumbnail",
            "@_fa": "true",
            "$": "https://api.elsevier.com/content/object/eid/1-s2.0-S2095495624007848-si25.svg?httpAccept=%2A%2F%2A",
            "@multimediatype": "Scalable Vector Graphics file",
            "@type": "ALTIMG",
            "@size": "27743",
            "@ref": "si25",
            "@mimetype": "image/svg+xml"
          },
          {
            "@category": "thumbnail",
            "@_fa": "true",
            "$": "https://api.elsevier.com/content/object/eid/1-s2.0-S2095495624007848-si26.svg?httpAccept=%2A%2F%2A",
            "@multimediatype": "Scalable Vector Graphics file",
            "@type": "ALTIMG",
            "@size": "28848",
            "@ref": "si26",
            "@mimetype": "image/svg+xml"
          },
          {
            "@category": "thumbnail",
            "@_fa": "true",
            "$": "https://api.elsevier.com/content/object/eid/1-s2.0-S2095495624007848-si27.svg?httpAccept=%2A%2F%2A",
            "@multimediatype": "Scalable Vector Graphics file",
            "@type": "ALTIMG",
            "@size": "27774",
            "@ref": "si27",
            "@mimetype": "image/svg+xml"
          },
          {
            "@category": "thumbnail",
            "@_fa": "true",
            "$": "https://api.elsevier.com/content/object/eid/1-s2.0-S2095495624007848-si28.svg?httpAccept=%2A%2F%2A",
            "@multimediatype": "Scalable Vector Graphics file",
            "@type": "ALTIMG",
            "@size": "30450",
            "@ref": "si28",
            "@mimetype": "image/svg+xml"
          },
          {
            "@category": "thumbnail",
            "@_fa": "true",
            "$": "https://api.elsevier.com/content/object/eid/1-s2.0-S2095495624007848-si29.svg?httpAccept=%2A%2F%2A",
            "@multimediatype": "Scalable Vector Graphics file",
            "@type": "ALTIMG",
            "@size": "28298",
            "@ref": "si29",
            "@mimetype": "image/svg+xml"
          },
          {
            "@category": "thumbnail",
            "@_fa": "true",
            "$": "https://api.elsevier.com/content/object/eid/1-s2.0-S2095495624007848-si3.svg?httpAccept=%2A%2F%2A",
            "@multimediatype": "Scalable Vector Graphics file",
            "@type": "ALTIMG",
            "@size": "2680",
            "@ref": "si3",
            "@mimetype": "image/svg+xml"
          },
          {
            "@category": "thumbnail",
            "@_fa": "true",
            "$": "https://api.elsevier.com/content/object/eid/1-s2.0-S2095495624007848-si30.svg?httpAccept=%2A%2F%2A",
            "@multimediatype": "Scalable Vector Graphics file",
            "@type": "ALTIMG",
            "@size": "25271",
            "@ref": "si30",
            "@mimetype": "image/svg+xml"
          },
          {
            "@category": "thumbnail",
            "@_fa": "true",
            "$": "https://api.elsevier.com/content/object/eid/1-s2.0-S2095495624007848-si31.svg?httpAccept=%2A%2F%2A",
            "@multimediatype": "Scalable Vector Graphics file",
            "@type": "ALTIMG",
            "@size": "25624",
            "@ref": "si31",
            "@mimetype": "image/svg+xml"
          },
          {
            "@category": "thumbnail",
            "@_fa": "true",
            "$": "https://api.elsevier.com/content/object/eid/1-s2.0-S2095495624007848-si32.svg?httpAccept=%2A%2F%2A",
            "@multimediatype": "Scalable Vector Graphics file",
            "@type": "ALTIMG",
            "@size": "24732",
            "@ref": "si32",
            "@mimetype": "image/svg+xml"
          },
          {
            "@category": "thumbnail",
            "@_fa": "true",
            "$": "https://api.elsevier.com/content/object/eid/1-s2.0-S2095495624007848-si33.svg?httpAccept=%2A%2F%2A",
            "@multimediatype": "Scalable Vector Graphics file",
            "@type": "ALTIMG",
            "@size": "24085",
            "@ref": "si33",
            "@mimetype": "image/svg+xml"
          },
          {
            "@category": "thumbnail",
            "@_fa": "true",
            "$": "https://api.elsevier.com/content/object/eid/1-s2.0-S2095495624007848-si4.svg?httpAccept=%2A%2F%2A",
            "@multimediatype": "Scalable Vector Graphics file",
            "@type": "ALTIMG",
            "@size": "17293",
            "@ref": "si4",
            "@mimetype": "image/svg+xml"
          },
          {
            "@category": "thumbnail",
            "@_fa": "true",
            "$": "https://api.elsevier.com/content/object/eid/1-s2.0-S2095495624007848-si5.svg?httpAccept=%2A%2F%2A",
            "@multimediatype": "Scalable Vector Graphics file",
            "@type": "ALTIMG",
            "@size": "9008",
            "@ref": "si5",
            "@mimetype": "image/svg+xml"
          },
          {
            "@category": "thumbnail",
            "@_fa": "true",
            "$": "https://api.elsevier.com/content/object/eid/1-s2.0-S2095495624007848-si6.svg?httpAccept=%2A%2F%2A",
            "@multimediatype": "Scalable Vector Graphics file",
            "@type": "ALTIMG",
            "@size": "7160",
            "@ref": "si6",
            "@mimetype": "image/svg+xml"
          },
          {
            "@category": "thumbnail",
            "@_fa": "true",
            "$": "https://api.elsevier.com/content/object/eid/1-s2.0-S2095495624007848-si7.svg?httpAccept=%2A%2F%2A",
            "@multimediatype": "Scalable Vector Graphics file",
            "@type": "ALTIMG",
            "@size": "9013",
            "@ref": "si7",
            "@mimetype": "image/svg+xml"
          },
          {
            "@category": "thumbnail",
            "@_fa": "true",
            "$": "https://api.elsevier.com/content/object/eid/1-s2.0-S2095495624007848-si8.svg?httpAccept=%2A%2F%2A",
            "@multimediatype": "Scalable Vector Graphics file",
            "@type": "ALTIMG",
            "@size": "5621",
            "@ref": "si8",
            "@mimetype": "image/svg+xml"
          },
          {
            "@category": "thumbnail",
            "@_fa": "true",
            "$": "https://api.elsevier.com/content/object/eid/1-s2.0-S2095495624007848-si9.svg?httpAccept=%2A%2F%2A",
            "@multimediatype": "Scalable Vector Graphics file",
            "@type": "ALTIMG",
            "@size": "3447",
            "@ref": "si9",
            "@mimetype": "image/svg+xml"
          }
        ]
      },
      "link": {
        "@rel": "abstract",
        "@href": "https://api.elsevier.com/content/abstract/scopus_id/85212920757"
      }
    }
  }
}