{
  "metadata": {
    "title": "Recent progress on discovery and properties prediction of energy materials: Simple machine learning meets complex quantum chemistry",
    "authors": "; ; ",
    "journal": "Journal of Energy Chemistry",
    "date": "2021-03-31",
    "doi": "10.1016/j.jechem.2020.05.044",
    "abstract": "",
    "uri": "https://api.elsevier.com/content/article/pii/S2095495620303806",
    "pii": "S2095495620303806"
  },
  "fulltext": {
    "full-text-retrieval-response": {
      "scopus-eid": "2-s2.0-85086749207",
      "originalText": "serial JL 286353 291210 291711 291744 291809 31 Journal of Energy Chemistry JOURNALENERGYCHEMISTRY 2020-05-28 2020-05-28 2020-06-12 2020-06-12 2020-12-31T16:32:17 1-s2.0-S2095495620303806 S2095-4956(20)30380-6 S2095495620303806 10.1016/j.jechem.2020.05.044 S300 S300.1 FULL-TEXT 1-s2.0-S2095495620X00088 2021-01-27T16:45:07.291606Z 0 0 20210301 20210331 2021 2020-05-28T01:27:46.582016Z absattachment articleinfo articletitlenorm authfirstinitialnorm authfirstsurnamenorm cid cids contenttype copyright crossmark dateloaded dateloadedtxt datesearch datesort dateupdated dco docsubtype doctype doi eid ewtransactionid hubeid indexeddate issn issnnorm itemstage itemtransactionid itemweight openaccess openarchive pg pgfirst pglast pii piinorm pubdateend pubdatestart pubdatetxt pubyr sortorder srctitle srctitlenorm srctype ssids alllist content subj subheadings suppl tomb volfirst volissue volumelist webpdf webpdfpagecount yearnav figure body acknowledge affil articletitle auth authfirstini authfull authkeywords authlast grantnumber grantsponsor grantsponsorid orcid primabst pubtype ref specialabst vitae 2095-4956 20954956 false 54 54 C Volume 54 10 72 88 72 88 202103 March 2021 2021-03-01 2021-03-31 2021 article rev © 2020 Science Press and Dalian Institute of Chemical Physics, Chinese Academy of Sciences. Published by ELSEVIER B.V. and Science Press. All rights reserved. RECENTPROGRESSDISCOVERYPROPERTIESPREDICTIONENERGYMATERIALSSIMPLEMACHINELEARNINGMEETSCOMPLEXQUANTUMCHEMISTRY KANG Y 1 Introduction 2 Quantum chemistry reveals the electronic structure 3 Machine learning algorithm accelerates material design 4 Tetrahedral structure-property relationship 5 Applications of machine learning for the development of energy materials 5.1 Modeling electronic structure-(potential energy, band energy, band gap and density functionals) 5.2 Classifying crystal structure-(recognition of crystal, deformation and segregation) 5.3 Predicting performance-(catalytic property of CO2 fixation and methanol electro-oxidation, lifetime of lithium-ion batteries) 5.4 Optimizing experimental method-(two-dimensional (2D) and carbon-based materials) 6 Current challenges 7 Conclusions and perspectives Acknowledgments References SCHMIDT 2019 83 J AGRAWAL 2016 053208 A JIE 2019 612 616 J ZHANG 2020 153 160 G MOGHADAM 2019 219 234 P LIU 2014 1619 1640 H HONKALA 2005 555 558 K ERISMAN 2008 636 639 J MARICHY 2012 1017 1032 C MA 2017 1605361 Q JENSEN 2019 K RACCUGLIA 2016 73 P DERINGER 2019 e1902765 V FRAUX 2019 G NORSKOV 2004 17886 17892 J GREELEY 2009 552 556 J GRASER 2018 3601 3612 J PODRYABINKIN 2019 E HALDER 2019 084418 A XIONG 2020 109203 Z CAO 2018 7434 7444 B ULISSI 2017 6600 6608 Z TRAN 2018 696 703 K BONK 2019 4108 4118 B BUTLER 2018 547 555 K LI 2017 306 H GU 2019 17096 17117 G OGANOV 2019 331 348 A SCHLEDER 2019 032001 G MOLINER 2019 2971 2980 M WAN 2019 3387 3395 X RADOVIC 2018 41 48 A LIU 2017 159 177 Y LIU 2017 315 321 Y LIU 2019 1195 1203 Y SHI 2016 018212 S CHEN 2019 3564 3572 C HU 2018 1800488 W GOLDSMITH 2018 2311 2323 B HAMMER 1995 238 240 B HAMMER 1996 2141 2144 B NORSKOV 2011 937 943 J BHATTACHARJEE 2016 35916 S GORZKOWSKI 2015 18389 18395 M BALANDIN 1958 96 129 A ADVCATAL NATUREACTIVECENTERSKINETICSCATALYTICDEHYDROGENATION ROOTSAERT 1960 16 W BARTEAU 1991 175 183 M NORSKOV 2009 37 46 J FERNANDEZ 2008 4683 4686 E ABILDPEDERSEN 2007 016105 F LI 2016 1600463 Y HUANG 2019 1494 1518 Z AARONSON 2009 707 708 S SCHUCH 2009 732 735 N RASSOLOV 2008 262 264 V HELMA 2004 1402 1411 C HAUTIER 2010 3762 3767 G COLEY 2019 C HUANG 2018 2983 2988 Y HIMANEN 2019 L FISCHER 2006 641 646 C BOCK 2019 110 F BELTHANGADY 2019 1215 1225 C TSHITOYAN 2019 95 98 V SANCHEZLENGELING 2018 360 365 B GOH 2017 1291 1307 G DELUNA 2017 23 25 P WU 2018 107001 W HEGDE 2017 42669 G AHNEMAN 2018 186 190 D HUMMELSHOJ 2012 272 274 J KRISHNAMURTHY 2018 187 191 D DONAHUE 2019 2682 2688 C TOKURA 2017 1056 1068 Y SUN 2000 1989 1992 S ANTONIAK 2006 117201 C CHUNG 2015 15478 15485 D ZHANG 2014 7734 7739 S ZHOU 2019 500 503 J YANG 2017 75 79 Y KIM 2019 124 138 G SHIN 2019 321 330 D IM 2019 37 J MAO 2019 1900247 Y SHANDIZ 2016 270 278 M MEYER 2018 7069 7077 B ZHUO 2018 4377 Y ZHU 2018 294 297 S TAWFIK 2019 1800128 S SHI 2017 43179 J TADA 2014 10347 10358 T ZHAN 2019 24885 24905 C FREY 2019 3031 3041 N WANG 2020 136 152 W TIAN 2020 108 115 Y BUCIUMAN 2001 149 156 F LI 2018 673 689 L HU 2019 87 94 S HWANG 2017 751 756 J ARTRITH 2012 045439 N PILANIA 2016 19375 G LIANG 2019 5640 5646 J SMITH 2017 3192 3203 J KOLB 2017 666 672 B SNYDER 2012 253002 J ZILETTI 2018 2775 A ZHUO 2019 5244 5250 Y BARAI 2019 437 442 V LI 2020 104413 L BALL 2016 16149 J LIU 2019 1906069 D SALMENJOKI 2018 5307 H HUBER 2018 64 L DAROSA 2020 226 234 G SCHERRER 2019 1031 1040 B LI 2019 151 H LI 2018 496 502 H MA 2015 3528 3533 X LI 2017 24131 24138 Z KATTEL 2017 1296 1299 S NIU 2018 1701642 W FENG 2017 e1700580 Y WANG 2017 178 183 X SEVERSON 2019 383 391 K KANG 2017 10156 10162 Y LUO 2019 81 85 M DUAN 2014 1 8 H CHOUDHARY 2017 5179 K LI 2019 413 421 Y GUO 2020 334 336 X KIM 2017 53 E JIA 2018 1905 1916 N ZHANG 2019 50 55 J FERNANDEZ 2015 2500 2506 M FERNANDEZ 2016 661 664 M GATES 2005 2416 2434 T LI 2016 819 833 L LIU 2019 19961 19969 B STEIMLE 2020 418 424 B REDDINGTON 1998 1735 1737 E CHEN 2016 1565 1569 P WALKER 2014 e1001823 S ZHANG 2017 7782 7788 K ZENG 2019 5042 5047 S KOTENKO 2019 380 385 I CAO 2019 2877 N YE 2019 1902069 S WANG 2020 72 78 W YUAN 2020 58 70 M LI 2019 613 619 H KANGX2021X72 KANGX2021X72X88 KANGX2021X72XY KANGX2021X72X88XY 2022-06-12T00:00:00.000Z 2022-06-12T00:00:00.000Z http://creativecommons.org/licenses/by-nc-nd/4.0/ © 2020 Science Press and Dalian Institute of Chemical Physics, Chinese Academy of Sciences. Published by ELSEVIER B.V. and Science Press. All rights reserved. 2020-05-23T07:11:28.534Z http://vtw.elsevier.com/data/voc/AddOnTypes/50.7/eoas Shenzhen Technical Project http://data.elsevier.com/vocabulary/SciValFunders/501100012156 http://sws.geonames.org/1814991 NSFC National Natural Science Foundation of China http://data.elsevier.com/vocabulary/SciValFunders/501100001809 http://sws.geonames.org/1814991 RGC, UGC Research Grants Council, University Grants Committee http://data.elsevier.com/vocabulary/SciValFunders/501100002920 http://sws.geonames.org/1819730 item S2095-4956(20)30380-6 S2095495620303806 1-s2.0-S2095495620303806 10.1016/j.jechem.2020.05.044 286353 2021-01-27T16:45:07.291606Z 2021-03-01 2021-03-31 1-s2.0-S2095495620303806-main.pdf https://s3-eu-west-1.amazonaws.com/prod-ucs-content-store-eu-west/content/pii:S2095495620303806/MAIN/application/pdf/ddede7bd76cbfe2ecfcd8c8664976006/main.pdf main.pdf pdf true 7410607 MAIN 17 1-s2.0-S2095495620303806-main_1.png https://s3-eu-west-1.amazonaws.com/prod-ucs-content-store-eu-west/content/pii:S2095495620303806/PREVIEW/image/png/faf3d91fd1e05d18247982e50ab130f6/main_1.png main_1.png png 57277 849 656 IMAGE-WEB-PDF 1 1-s2.0-S2095495620303806-gr10.jpg https://s3-eu-west-1.amazonaws.com/prod-ucs-content-store-eu-west/content/pii:S2095495620303806/gr10/DOWNSAMPLED/image/jpeg/0b01ca4da6148105dc0756a51961e200/gr10.jpg gr10 gr10.jpg jpg 84537 429 774 IMAGE-DOWNSAMPLED 1-s2.0-S2095495620303806-gr11.jpg https://s3-eu-west-1.amazonaws.com/prod-ucs-content-store-eu-west/content/pii:S2095495620303806/gr11/DOWNSAMPLED/image/jpeg/e443b90542aa37991d6836d437c7006a/gr11.jpg gr11 gr11.jpg jpg 90058 584 669 IMAGE-DOWNSAMPLED 1-s2.0-S2095495620303806-gr12.jpg https://s3-eu-west-1.amazonaws.com/prod-ucs-content-store-eu-west/content/pii:S2095495620303806/gr12/DOWNSAMPLED/image/jpeg/dd25d0bae562a7284d77316e6832a58a/gr12.jpg gr12 gr12.jpg jpg 151912 561 778 IMAGE-DOWNSAMPLED 1-s2.0-S2095495620303806-gr2.jpg https://s3-eu-west-1.amazonaws.com/prod-ucs-content-store-eu-west/content/pii:S2095495620303806/gr2/DOWNSAMPLED/image/jpeg/06d51a239357f7d2c4676d429bc64ebe/gr2.jpg gr2 gr2.jpg jpg 54854 516 538 IMAGE-DOWNSAMPLED 1-s2.0-S2095495620303806-gr3.jpg https://s3-eu-west-1.amazonaws.com/prod-ucs-content-store-eu-west/content/pii:S2095495620303806/gr3/DOWNSAMPLED/image/jpeg/34cc09ad251c6fa8131bda295b211e3b/gr3.jpg gr3 gr3.jpg jpg 84980 663 495 IMAGE-DOWNSAMPLED 1-s2.0-S2095495620303806-gr4.jpg https://s3-eu-west-1.amazonaws.com/prod-ucs-content-store-eu-west/content/pii:S2095495620303806/gr4/DOWNSAMPLED/image/jpeg/0ac699acd0eb1533cb85acbdba15a009/gr4.jpg gr4 gr4.jpg jpg 247105 999 774 IMAGE-DOWNSAMPLED 1-s2.0-S2095495620303806-gr5.jpg https://s3-eu-west-1.amazonaws.com/prod-ucs-content-store-eu-west/content/pii:S2095495620303806/gr5/DOWNSAMPLED/image/jpeg/347e6430eea5f0d6a3e8026e0aa640ba/gr5.jpg gr5 gr5.jpg jpg 229780 1004 774 IMAGE-DOWNSAMPLED 1-s2.0-S2095495620303806-gr6.jpg https://s3-eu-west-1.amazonaws.com/prod-ucs-content-store-eu-west/content/pii:S2095495620303806/gr6/DOWNSAMPLED/image/jpeg/b4868b40f9f78ffab107624ffc09a48b/gr6.jpg gr6 gr6.jpg jpg 106841 410 714 IMAGE-DOWNSAMPLED 1-s2.0-S2095495620303806-gr7.jpg https://s3-eu-west-1.amazonaws.com/prod-ucs-content-store-eu-west/content/pii:S2095495620303806/gr7/DOWNSAMPLED/image/jpeg/21bdf0d2f2d874792735ee831801c434/gr7.jpg gr7 gr7.jpg jpg 169235 719 778 IMAGE-DOWNSAMPLED 1-s2.0-S2095495620303806-gr8.jpg https://s3-eu-west-1.amazonaws.com/prod-ucs-content-store-eu-west/content/pii:S2095495620303806/gr8/DOWNSAMPLED/image/jpeg/8a0f588381e50981a13f12ed0dfa8711/gr8.jpg gr8 gr8.jpg jpg 146359 380 778 IMAGE-DOWNSAMPLED 1-s2.0-S2095495620303806-gr9.jpg https://s3-eu-west-1.amazonaws.com/prod-ucs-content-store-eu-west/content/pii:S2095495620303806/gr9/DOWNSAMPLED/image/jpeg/80bdaf7fd9cd35de62c96f147a4f08c4/gr9.jpg gr9 gr9.jpg jpg 74647 545 580 IMAGE-DOWNSAMPLED 1-s2.0-S2095495620303806-ga1.jpg https://s3-eu-west-1.amazonaws.com/prod-ucs-content-store-eu-west/content/pii:S2095495620303806/ga1/DOWNSAMPLED/image/jpeg/bb64aed1c65b60184a7be483b8472b5d/ga1.jpg ga1 true ga1.jpg jpg 32503 200 398 IMAGE-DOWNSAMPLED 1-s2.0-S2095495620303806-fx1.jpg https://s3-eu-west-1.amazonaws.com/prod-ucs-content-store-eu-west/content/pii:S2095495620303806/fx1/DOWNSAMPLED/image/jpeg/2b959fed933c8c7bdb185b6f0a8af505/fx1.jpg fx1 fx1.jpg jpg 7068 155 111 IMAGE-DOWNSAMPLED 1-s2.0-S2095495620303806-fx2.jpg https://s3-eu-west-1.amazonaws.com/prod-ucs-content-store-eu-west/content/pii:S2095495620303806/fx2/DOWNSAMPLED/image/jpeg/91b7530516af8240cd77ea04d5184072/fx2.jpg fx2 fx2.jpg jpg 5536 155 111 IMAGE-DOWNSAMPLED 1-s2.0-S2095495620303806-fx3.jpg https://s3-eu-west-1.amazonaws.com/prod-ucs-content-store-eu-west/content/pii:S2095495620303806/fx3/DOWNSAMPLED/image/jpeg/df87bb13c2209db6b56121bdbab3256d/fx3.jpg fx3 fx3.jpg jpg 5360 155 111 IMAGE-DOWNSAMPLED 1-s2.0-S2095495620303806-gr1.jpg https://s3-eu-west-1.amazonaws.com/prod-ucs-content-store-eu-west/content/pii:S2095495620303806/gr1/DOWNSAMPLED/image/jpeg/4cff935e0207e1010ed884924776607c/gr1.jpg gr1 gr1.jpg jpg 101749 606 776 IMAGE-DOWNSAMPLED 1-s2.0-S2095495620303806-gr10.sml https://s3-eu-west-1.amazonaws.com/prod-ucs-content-store-eu-west/content/pii:S2095495620303806/gr10/THUMBNAIL/image/gif/b3b636d3a68cacf041ddbdc636e59ee6/gr10.sml gr10 gr10.sml sml 13496 121 219 IMAGE-THUMBNAIL 1-s2.0-S2095495620303806-gr11.sml https://s3-eu-west-1.amazonaws.com/prod-ucs-content-store-eu-west/content/pii:S2095495620303806/gr11/THUMBNAIL/image/gif/03e2c9cd973a96cacaaa5a80c8a1510b/gr11.sml gr11 gr11.sml sml 11724 164 188 IMAGE-THUMBNAIL 1-s2.0-S2095495620303806-gr12.sml https://s3-eu-west-1.amazonaws.com/prod-ucs-content-store-eu-west/content/pii:S2095495620303806/gr12/THUMBNAIL/image/gif/ea31552e104cf17ef4428d447bee16c8/gr12.sml gr12 gr12.sml sml 16944 158 219 IMAGE-THUMBNAIL 1-s2.0-S2095495620303806-gr2.sml https://s3-eu-west-1.amazonaws.com/prod-ucs-content-store-eu-west/content/pii:S2095495620303806/gr2/THUMBNAIL/image/gif/b0b4e0b3ef8be6406a3a9a67c0a9eaf5/gr2.sml gr2 gr2.sml sml 11151 164 171 IMAGE-THUMBNAIL 1-s2.0-S2095495620303806-gr3.sml https://s3-eu-west-1.amazonaws.com/prod-ucs-content-store-eu-west/content/pii:S2095495620303806/gr3/THUMBNAIL/image/gif/47149827f5a4f75814408bc455b4dbc2/gr3.sml gr3 gr3.sml sml 9175 163 122 IMAGE-THUMBNAIL 1-s2.0-S2095495620303806-gr4.sml https://s3-eu-west-1.amazonaws.com/prod-ucs-content-store-eu-west/content/pii:S2095495620303806/gr4/THUMBNAIL/image/gif/97429e23752572bdc67caa173290846a/gr4.sml gr4 gr4.sml sml 12828 164 127 IMAGE-THUMBNAIL 1-s2.0-S2095495620303806-gr5.sml https://s3-eu-west-1.amazonaws.com/prod-ucs-content-store-eu-west/content/pii:S2095495620303806/gr5/THUMBNAIL/image/gif/742d51c2737e8161946cf8fc5ffd2197/gr5.sml gr5 gr5.sml sml 12229 164 126 IMAGE-THUMBNAIL 1-s2.0-S2095495620303806-gr6.sml https://s3-eu-west-1.amazonaws.com/prod-ucs-content-store-eu-west/content/pii:S2095495620303806/gr6/THUMBNAIL/image/gif/b59fdf577d638e3bec66b7e0f0ade21f/gr6.sml gr6 gr6.sml sml 15579 126 219 IMAGE-THUMBNAIL 1-s2.0-S2095495620303806-gr7.sml https://s3-eu-west-1.amazonaws.com/prod-ucs-content-store-eu-west/content/pii:S2095495620303806/gr7/THUMBNAIL/image/gif/08fecd5141ca720abd29ad9b69801f16/gr7.sml gr7 gr7.sml sml 13559 164 177 IMAGE-THUMBNAIL 1-s2.0-S2095495620303806-gr8.sml https://s3-eu-west-1.amazonaws.com/prod-ucs-content-store-eu-west/content/pii:S2095495620303806/gr8/THUMBNAIL/image/gif/b296ead29828241f2576eebe4da9ccb3/gr8.sml gr8 gr8.sml sml 18803 107 219 IMAGE-THUMBNAIL 1-s2.0-S2095495620303806-gr9.sml https://s3-eu-west-1.amazonaws.com/prod-ucs-content-store-eu-west/content/pii:S2095495620303806/gr9/THUMBNAIL/image/gif/93c7ba192afbf87d456feb388ab45051/gr9.sml gr9 gr9.sml sml 8597 163 174 IMAGE-THUMBNAIL 1-s2.0-S2095495620303806-ga1.sml https://s3-eu-west-1.amazonaws.com/prod-ucs-content-store-eu-west/content/pii:S2095495620303806/ga1/THUMBNAIL/image/gif/0b9a65e8f2a49f1137bc04932fb2ff0b/ga1.sml ga1 true ga1.sml sml 11934 110 219 IMAGE-THUMBNAIL 1-s2.0-S2095495620303806-fx1.sml https://s3-eu-west-1.amazonaws.com/prod-ucs-content-store-eu-west/content/pii:S2095495620303806/fx1/THUMBNAIL/image/gif/2ca13a9ab10beb3cb08b90a6177dcdd8/fx1.sml fx1 fx1.sml sml 14593 164 117 IMAGE-THUMBNAIL 1-s2.0-S2095495620303806-fx2.sml https://s3-eu-west-1.amazonaws.com/prod-ucs-content-store-eu-west/content/pii:S2095495620303806/fx2/THUMBNAIL/image/gif/56c46449e459ebb289c4599974633386/fx2.sml fx2 fx2.sml sml 12095 164 117 IMAGE-THUMBNAIL 1-s2.0-S2095495620303806-fx3.sml https://s3-eu-west-1.amazonaws.com/prod-ucs-content-store-eu-west/content/pii:S2095495620303806/fx3/THUMBNAIL/image/gif/07aea7808294ab4965be453e84841897/fx3.sml fx3 fx3.sml sml 13490 164 117 IMAGE-THUMBNAIL 1-s2.0-S2095495620303806-gr1.sml https://s3-eu-west-1.amazonaws.com/prod-ucs-content-store-eu-west/content/pii:S2095495620303806/gr1/THUMBNAIL/image/gif/c7e965ae9763344f719a79475fbe8cb0/gr1.sml gr1 gr1.sml sml 11480 164 210 IMAGE-THUMBNAIL 1-s2.0-S2095495620303806-gr10_lrg.jpg https://s3-eu-west-1.amazonaws.com/prod-ucs-content-store-eu-west/content/pii:S2095495620303806/gr10/HIGHRES/image/jpeg/5a236c6b4483d94c969ca97c8dbce720/gr10_lrg.jpg gr10 gr10_lrg.jpg jpg 259963 1138 2055 IMAGE-HIGH-RES 1-s2.0-S2095495620303806-gr11_lrg.jpg https://s3-eu-west-1.amazonaws.com/prod-ucs-content-store-eu-west/content/pii:S2095495620303806/gr11/HIGHRES/image/jpeg/4eb700efb7079d5e8f49027e59e53054/gr11_lrg.jpg gr11 gr11_lrg.jpg jpg 269549 1550 1777 IMAGE-HIGH-RES 1-s2.0-S2095495620303806-gr12_lrg.jpg https://s3-eu-west-1.amazonaws.com/prod-ucs-content-store-eu-west/content/pii:S2095495620303806/gr12/HIGHRES/image/jpeg/0d6ba336a5118a86089c0d8475fc7c34/gr12_lrg.jpg gr12 gr12_lrg.jpg jpg 905712 2486 3445 IMAGE-HIGH-RES 1-s2.0-S2095495620303806-gr2_lrg.jpg https://s3-eu-west-1.amazonaws.com/prod-ucs-content-store-eu-west/content/pii:S2095495620303806/gr2/HIGHRES/image/jpeg/2d0d441a1ed7b0bea0a42e8f3a0b3ad0/gr2_lrg.jpg gr2 gr2_lrg.jpg jpg 256770 1921 2002 IMAGE-HIGH-RES 1-s2.0-S2095495620303806-gr3_lrg.jpg https://s3-eu-west-1.amazonaws.com/prod-ucs-content-store-eu-west/content/pii:S2095495620303806/gr3/HIGHRES/image/jpeg/b77efedff28b2ebbd2b9deb92f0d80df/gr3_lrg.jpg gr3 gr3_lrg.jpg jpg 525457 2937 2193 IMAGE-HIGH-RES 1-s2.0-S2095495620303806-gr4_lrg.jpg https://s3-eu-west-1.amazonaws.com/prod-ucs-content-store-eu-west/content/pii:S2095495620303806/gr4/HIGHRES/image/jpeg/df9592b08aeeff36f14caa8a9717c129/gr4_lrg.jpg gr4 gr4_lrg.jpg jpg 763635 2652 2055 IMAGE-HIGH-RES 1-s2.0-S2095495620303806-gr5_lrg.jpg https://s3-eu-west-1.amazonaws.com/prod-ucs-content-store-eu-west/content/pii:S2095495620303806/gr5/HIGHRES/image/jpeg/c1cfd29f551c4869b3acccb1f7774266/gr5_lrg.jpg gr5 gr5_lrg.jpg jpg 1212113 4224 3255 IMAGE-HIGH-RES 1-s2.0-S2095495620303806-gr6_lrg.jpg https://s3-eu-west-1.amazonaws.com/prod-ucs-content-store-eu-west/content/pii:S2095495620303806/gr6/HIGHRES/image/jpeg/4774558559b984ebd4aea3bcef3f9cbd/gr6_lrg.jpg gr6 gr6_lrg.jpg jpg 328279 1089 1896 IMAGE-HIGH-RES 1-s2.0-S2095495620303806-gr7_lrg.jpg https://s3-eu-west-1.amazonaws.com/prod-ucs-content-store-eu-west/content/pii:S2095495620303806/gr7/HIGHRES/image/jpeg/2be89d8b8db33e35148c80c24a63a05f/gr7_lrg.jpg gr7 gr7_lrg.jpg jpg 487134 1910 2067 IMAGE-HIGH-RES 1-s2.0-S2095495620303806-gr8_lrg.jpg https://s3-eu-west-1.amazonaws.com/prod-ucs-content-store-eu-west/content/pii:S2095495620303806/gr8/HIGHRES/image/jpeg/fb6f60b38be50141f688bfd2aea4e7a9/gr8_lrg.jpg gr8 gr8_lrg.jpg jpg 911583 1681 3445 IMAGE-HIGH-RES 1-s2.0-S2095495620303806-gr9_lrg.jpg https://s3-eu-west-1.amazonaws.com/prod-ucs-content-store-eu-west/content/pii:S2095495620303806/gr9/HIGHRES/image/jpeg/0347ec9f96d99650c6b3cf90c08d1d56/gr9_lrg.jpg gr9 gr9_lrg.jpg jpg 390083 2411 2567 IMAGE-HIGH-RES 1-s2.0-S2095495620303806-ga1_lrg.jpg https://s3-eu-west-1.amazonaws.com/prod-ucs-content-store-eu-west/content/pii:S2095495620303806/ga1/HIGHRES/image/jpeg/0b9eec158b5b2d7e9eb0620cd052b7a3/ga1_lrg.jpg ga1 true ga1_lrg.jpg jpg 98047 531 1059 IMAGE-HIGH-RES 1-s2.0-S2095495620303806-fx1_lrg.jpg https://s3-eu-west-1.amazonaws.com/prod-ucs-content-store-eu-west/content/pii:S2095495620303806/fx1/HIGHRES/image/jpeg/cfa2c281a67fae50e0dc734071562df8/fx1_lrg.jpg fx1 fx1_lrg.jpg jpg 24590 413 295 IMAGE-HIGH-RES 1-s2.0-S2095495620303806-fx2_lrg.jpg https://s3-eu-west-1.amazonaws.com/prod-ucs-content-store-eu-west/content/pii:S2095495620303806/fx2/HIGHRES/image/jpeg/a5f6c3468265f55a617c3c13ef6c2121/fx2_lrg.jpg fx2 fx2_lrg.jpg jpg 16466 413 295 IMAGE-HIGH-RES 1-s2.0-S2095495620303806-fx3_lrg.jpg https://s3-eu-west-1.amazonaws.com/prod-ucs-content-store-eu-west/content/pii:S2095495620303806/fx3/HIGHRES/image/jpeg/33b234ed9e952fc49c36968ff19fc24c/fx3_lrg.jpg fx3 fx3_lrg.jpg jpg 15713 413 295 IMAGE-HIGH-RES 1-s2.0-S2095495620303806-gr1_lrg.jpg https://s3-eu-west-1.amazonaws.com/prod-ucs-content-store-eu-west/content/pii:S2095495620303806/gr1/HIGHRES/image/jpeg/bce8631eff32ecbfb1298d6c7445d144/gr1_lrg.jpg gr1 gr1_lrg.jpg jpg 400408 1880 2406 IMAGE-HIGH-RES 1-s2.0-S2095495620303806-am.pdf am am.pdf pdf 5824976 AAM-PDF https://s3-eu-west-1.amazonaws.com/prod-ucs-content-store-eu-west/content/egi:10VPJNZ43DS/MAIN/application/pdf/8b1793adaed297c6daaa1f2d901425ca/am.pdf JECHEM 1352 S2095-4956(20)30380-6 10.1016/j.jechem.2020.05.044 Science Press Fig. 1 The bar chart displayed for topics on (a) “energy materials” and (b) “machine learning”+“energy materials” in Web of Science [11]. Copyright 2020, Clarivate Analytics. (c) Scheme for energy materials predictions in four directions using the machine learning tools. Fig. 2 Database-Computation-Materials discovery procedure with the help of data-driven prediction by quantum chemistry methods. Fig. 3 Division of main machine learning algorithms. Fig. 4 Tetrahedral structure relationship of advanced energy materials. (a) Materials perspective (orange) and chemistry perspective (blue). (b) Atomic model of chemically fcc-PtFe and fct-PtFe. (c) Element specific Fe L3 edge magnetization curves of fcc-PtFe and fct-PtFe NPs measured at 15 K [80]. Copyright 2006, American Physical Society. (d) ORR activity of fcc-PtFe/C, fct-PtFe/C, and Pt/C [81]. Copyright 2015, American Chemical Society. (e) 8 nm cuboctahedral fcc-PtFe/Pt, fct-PtFe/Pt models and cuboctahedron model along the [111] [82]. Copyright 2014, American Chemical Society. (f) The periodic supercells of fcc-PtFe and fct-PtFe used to calculate the crystalline lattice constants [82]. Copyright 2014, American Chemical Society. (g) 3D atomic models of an PtFe nanoparticle after annealing at 520 °C for 9, 16 and 26 min, respectively [83]. Copyright 2019, Springer-Nature. (h) The corresponding atomic layer of PtFe nanoparticle along the [010] direction under the different annealing time and an ellipse-like area of the surface and subsurface atoms occurs L10 phase [83]. Copyright 2019, Springer-Nature. (i) Calculated ADF-STEM images of the experimental 3D atomic model along the [100], [010] and [001] directions [84]. Copyright 2017, Springer-Nature. Fig. 5 (a) Computational and experimental tools for perovskite oxides. Reproduced with permission from Reference [105], Copyright 2017, American Association for the Advancement of Science. (b) The DFT and neural network energies of a benchmark system [106], Copyright 2012, American Physical Society. (c) Matrix plot of the double perovskites bandgaps used in the present study. (c) Bandgaps predicting of the parent single perovskites using the KRR model [107]. Copyright 2016, Springer-Nature. (d) predicted DFT band gap (E g DFT,ML) versus the calculated band gap (E g DFT) for each type of 2D structure and NREL AB-type structures. (e) Predicted GW band gap (E g GW,ML) versus the calculated band gap (E g GW) for 2D and WZ 3D structures [108]. Copyright 2019, American Chemical Society. (f) Comparison of a projected functional derivative of MLA with the exact curve [111]. Copyright 2012, American Physical Society. (g) The correlation between MLA error and predictive variance for N = 1, M = 100. Each point represents a density in the test set (blue) or new data set (red). The vertical line denotes the transition between interpolation and extrapolation [111]. Copyright 2012, American Physical Society. (For interpretation of the references to colour in this figure legend, the reader is referred to the web version of this article.) Fig. 6 (a) Structural transition from body-centered-cubic (bcc) to simple cubic (sc). (b) Classification probability as a function of the percentage of atoms being removed, purple represents the bcc structures and red represents sc structures [112]. Copyright 2018, Springer-Nature. ML predicted Debye temperature against the calculated bandgap, including (c) borate and sulfide, (d) nitride and (oxygen) halides, (e) silicate and fluoride, (f) aluminate and phosphates [93]. Copyright 2018, Springer-Nature. Fig. 7 (a) Examples of the true (solid lines) and predicted (dashed lines) curves for a few basic samples, along with the average (thick black line) and standard deviation (shaded region) of the true stress–strain curves. (b) r 2 of linear fits between chosen feature parameters and the stress σ ext (ε = 0.1) as a function of the system size (inset shows an example of such a fit) [118]. Copyright 2018, Springer-Nature. (c) Grain boundaries, energies, and segregation energy distributions of magnesium [119]. Copyright 2018, Springer-Nature. Fig. 8 (a) CO2 reduction activity map for bimetallic systems [25]. Copyright 2018, Springer-Nature. (b) Predicted activity from microkinetic model of transition metal and nickel gallium facets [24]. Copyright 2017, American Chemical Society. (c) methanol electro-oxidation volcanic activity map by limiting potential (V vs. RHE) as a function of *CO and *OH free formation energies relative to Pt(111) [125]. Copyright 2017, Royal Society of Chemistry. (d) Model-predicted theoretical limiting potentials of catalyst surfaces. The structure of bimetallic catalysts is shown on the top with varying ratio of A and B [125]. Copyright 2017, Royal Society of Chemistry. Fig. 9 (a) PLS vs. DFT predicted cathode volume changes of the LiX2O4 spinel (blue circles) and LiXO2 layer structure (red diamonds) [129]. Copyright 2017, Chinese Ceramic Society. (b–d) Observed and predicted cycle lives for the feature-based model of commercial lithium iron phosphate (LFP)/graphite cell [130]. Copyright 2019, Springer Nature. Fig. 10 The schematic illustration of the ML machine learning assisted identification of 2D materials. In the training process, from (a) optical image of 2D material, the RGB values and coordinates of every pixel are obtained; (b) analyzing RGB values by k-means clustering, 4 clusters are deduced; (c) combining corresponding AFM results of the sample with the reconstructed optical image based on the clustered data, (d) the training processes of 2D material is completed [135]. Copyright 2019 Elsevier B.V. For a testing case, based on the above obtanied data bank, the optical image (e) of a 2D material is converted to the layer identified image (f). Fig. 11 VAE prediction results for (a) the syntheses of TiO2 involving methanol, ethanol, and citric acid for brookite phase. (b) Synthesis space for MnO2 with phase boundaries of polymorph regions with dominant ions [137]. Copyright 2017, Springer Nature. (c) The linear relationship of predicted capacitance and the real data from literatures. (d) Prediction accuracy between real capacitances and three ML models results [94]. Copyright 2018 Elsevier B.V. Fig. 12 (a) Comparison of mean absolute error (MAE) of interpolation (CV) and exploration (FCV) for formation energy by five models [22]. Copyright 2020, Elsevier. (b) Contour plots of the MAE as a function of the hyperparameters for the Gaussian kernels [143]. Copyright 2016, John Wiley & Sons. (c) DFT calculated reaction energies (ΔG) compared with the predicted reaction energies using a kernel ridge regression model [144]. Copyright 2019, Royal Society of Chemistry. (d) Reaction diagram of high-throughput synthesis of ~65,000 heterostructure nanorods [145]. Copyright 2020, American Association for the Advancement of Science. Review Recent progress on discovery and properties prediction of energy materials: Simple machine learning meets complex quantum chemistry Yongqiang Kang a b ⁎ Lejing Li c Baohua Li a ⁎ a Tsinghua Shenzhen International Graduate School, Tsinghua University, Shenzhen 518055, Guangdong, China Tsinghua Shenzhen International Graduate School Tsinghua University Shenzhen 518055 Guangdong China Tsinghua Shenzhen International Graduate School, Tsinghua University, Shenzhen 518055, Guangdong, China b School of Materials Science and Engineering, Tsinghua University, Beijing 100081, China School of Materials Science and Engineering Tsinghua University Beijing 100081 China School of Materials Science and Engineering, Tsinghua University, Beijing 100081, China c Department of Chemistry, The Chinese University of Hong Kong, Hong Kong 999077, China Department of Chemistry The Chinese University of Hong Kong Hong Kong 999077 China Department of Chemistry, The Chinese University of Hong Kong, Hong Kong 999077, China ⁎ Corresponding authors at: Tsinghua Shenzhen International Graduate School, Tsinghua University, Shenzhen 518055, Guangdong, China (Y. Kang) Tsinghua Shenzhen International Graduate School Tsinghua University Shenzhen 518055 Guangdong China Graphical abstract The emergence of artificial intelligence, especially machine learning algorithms, has accelerated the development of computational materials science based on quantum chemistry, which is conducive to the exploration and understanding of new energy materials. In nature, the properties of matter are ultimately governed by the electronic structures. Quantum chemistry (QC) at electronic level matches well with a few simple physical assumptions in solving simple problems. To date, machine learning (ML) algorithm has been migrated to this field to simplify calculations and improve fidelity. This review introduces the basic information on universal electron structures of emerging energy materials and ML algorithms involved in the prediction of material properties. Then, the structure-property relationships based on ML algorithm and QC theory are reviewed. Especially, the summary of recently reported applications on classifying crystal structure, modeling electronic structure, optimizing experimental method, and predicting performance is provided. Last, an outlook on ML assisted QC calculation towards identifying emerging energy materials is also presented. Keywords Energy materials Quantum chemistry Machine learning Structure-property relationship 1 Introduction Throughout human history, the abundance of energy material associated with all kinds of human production activities. To date, excessive energy consumptions were not adapted to the current needs for a sustainable development. Energy materials are materials used in energy harvesting, storage and conversion filed such as photovoltaics, batteries, fuel cells and photo(electro)catalysis, etc. Energy materials including intermetallic alloys, metal/covalent–organic frameworks, carbon materials, perovskite and spinel materials play an important role in global economic development [1–5]. For instance, as an efficient ammonia synthesis materials, iron(Fe)-based catalysts invented in the early 20th century have promoted food production, which feeds billions of people [6–8]. Recent electroreduction of N2 by catalysts is promising to produce ammonia in a more cost-effective way. Therefore, finding green energy materials is highly desired but remains a challenge to cut carbon emissions, control environmental pollution, and reduce waste [9,10]. In the last two decades, the number of academic papers focused on the research and innovation of “energy materials” witness an exponential growth (Fig. 1 a) [11]. Under such a rapid growth rate of discovering new materials, people can hardly point out useful information directly and identify promising materials without optimized performance. Chemists sought for desired materials or material preparation methods usually rely on trial and error method, which based on numerous failed experiments and by-products [12,13]. Recently, combinatorial quantum chemistry (QC) and high-throughput screening are expected to bridge the gap [14,15]. Theory calculations can not only confirm the reliability of data but predict untried methods. For example, the density functional theory (DFT) calculations of noble metals predicted the volcano plot for oxygen reduction reaction, which accelerates the investigation into fuel cell related cathode materials [16,17]. On the other hand, improvements in artificial algorithmic provide a new window to find insights or make fast predictions of target properties by mining from big data. As for computational materials science, the machine learning (ML) techniques help to reduce the amount of calculation, and speed up the exploration of energy materials (Fig. 1b). Recently, ML assisted high-throughput screening for crystal structure prediction [18–20], electronic characteristics [21,22], experimental procedures [23] and materials performance searches [24] are found to be reasonable and applicable (Fig. 1c). At present, the developed ML techniques accelerate the identification of energy materials. These contributions include the discovery and the optimization of energy materials [24], determination of the structure–property relationship [25], and modeling of reactive coordinates [26], etc. For instance, Butler et al. [27] summarized the applications of ML algorithms including dataset, model and data-mining tools for molecules and materials. They believe the front direction lies in smaller dataset, simpler descriptor, higher fidelity and more scientific laws. Graser et al. highlights ML tools for crystal structure predictions [18], and Li et al. summarized cases of artificial neural network (ANN) methods for catalyst materials [28]. Although some of the contributions have been summarized before [18,27–34], latest works especially for new applications are not included. These reviews always focus on ML algorithms for specific filed or applications, whereas the structure-property relationship of these materials is not clearly indicated and discussed. Currently, it is necessary to figure out the key points for energy materials development. The key points are: (1) The effect of electronic properties on materials properties. Especially for computer scientists, they inevitably need to understand the basic electronic structures and QC. (2) The critical issues of material science. For computational materials science, the experiential details are not always fully considered but often filtered to simplify the model. (3) The calculation principle, advantages and disadvantages of ML models. For material scientists, they must be absolutely aware of the accuracy of the calculation results. Considering the rapid development of ML, it is necessary to build an integrated system of ML programs. However, interdisciplinary integration is a hash task. For energy materials screening, the comprehensive description of ML is firstly needed when designing for special purpose of ML. Therefore, an updated review is beneficial to outline the cutting-edge of ML assisted energy materials discovery. Since the complexity of quantum chemistry (QC) in materials science, especially in the energy materials filed, machine learning (ML) method is necessary to be introduced to save time and improve accuracy. Shi et al. [35] summarizes the applications of machine learning technology in the field of material development: (1) Macro and micro-performance predictions, such as glass transition temperature [36,37], metal corrosion behavior, lattice constant and lithium-ion diffusion mechanism. (2) Property of predicted materials, such as material structure and performance. (3) Other aspects of the application, such as battery performance monitoring [38]. (4) Common problems of ML algorithms. Herein we not only declare the necessity of ML, but also summarize the effective applications in QC-related areas. Our review focuses on the energy materials towards energy harvesting, storage and conversion. We mainly highlight the properties of strong electron correlation based on quantum chemistry, such as electronic structure and electronic transport. We also highlight the basic methods of ML and discuss various examples where ML technique is employed for state-of-the-art materials research. We will review the intrinsic electronic structures of energy materials, and the screw out the fundamental degrees of freedom (orbital, spin, lattice and charge) is the future direction, which is in prospect of cutting-edge techniques. More importantly, establishing the connection between quantum chemistry theory and machine learning algorithm, is the core of this review. We finally conclude the challenges and prospects to carry forward in this field. 2 Quantum chemistry reveals the electronic structure It is widely known that the discovery of the Schrödinger equation and its application into the hydrogen atom mark the birth of quantum chemistry (QC). By using QC, physicists have achieved great success in describing simple microphysics. Considering the complex chemical reactions, QC appears deficient in determining the chemical behavior of an atom [15]. Even though, calculations can provide detailed thermodynamics and kinetics information, such as Gibbs free energy, binding energy [39], or energy band [40]. For heterogeneous catalysis, QC helps to screen ideal catalyst, reveal surface active sites and understand structure-property relations [41]. The electronic structure of materials is the cornerstone of QC theory [14]. Briefly, understanding the position of free electrons in the space, describing the motion trajectory of electron, ruling electron order of filling orbitals, and discovering the role of electrons in chemical bonds are the key tasks for electronic structure theory. “Quantized” electrons move around the nucleus of an atom in different orbitals, which depends on the nuclear charge and interaction of electron-nucleus. As for chemically bonded atoms, the electronic orbitals are splitting into molecular orbitals (MO) with separated energy levels. In solid-state physics, it is not the isolated atom but crystalline materials formed by a large number of atoms. The individual energy levels of neighboring atoms overlap with continuous bands. In order to describe the bonding interactions between the center transition metals and surrounding ligands, crystal field theory (CFT) is found. The d orbit of the central atom is originally five-fold degenerate, but orbital energy levels split when ligands approaches. The interaction is considered to be static electricity; therefore, the distribution of energy levels can be calculated by surrounding ligands. The CFT cannot explain the covalent bonding between center transition metals and surrounding ligands. The MO theory can be extended to the covalent bonding of center atom and ligand, where the covalent bonding is different from static electric, and this modified CFT also called ligand field theory. The d-band center, as an important theory for bonding and reactivity of transition metals is adopted and applied widely in theoretical calculation [42]. B. Hammer & J. K. Norskov stressed the d-band shape, in other words, the position of d-band center determined by the width of d-band which significantly relies on the coordination number of metal site [43,44]. Even though, several results proved that d-band center is inadequate for demonstrating the catalytic activity of magnetically polarized transition metals [45], and also the activity of Pt-core–Pd-shell nanoparticles [46]. These observations reveal the real chemical systems are more complicated than the simple QC calculations. Linear free energy relationships (LFERs) and volcano plots also play important role in catalyst filed, especially in electrochemical reactions. Balandin first discussed the volcano plots in 1970s [47,48]. Up to date, researchers have studied various volcano plots of surface catalytic reactions based on transition metals. For example, by investigating the interaction of HCOOH vapors with W, Rootsaert and Sachtler firstly reported catalytic dehydrogenation of HCOOH vapor on W [49]. This discovery has a general relationship and has been extended to other metal catalysts. Mark A. Barteau found an exception to the LFERs of transition metal surfaces, i.e. Group VIII and IB metals show a different relationship between the decomposition of formate and methoxide intermediates [50]. Towards the progress of theoretical calculation, Norskov et al. has developed linear scaling relationships and volcano plot for hydrogen-containing molecules on transition metal oxide, sulfide, and nitride surfaces [51–53]. To date, researchers are focusing on new reactions and systems to breaking scaling relations [54,55]. Generally, QC methods are based on the Hartree-Fock method (Fig. 2 ). Post-Hartree-Fock methods including MP2, MP4, CCSD(T), promoted the progress of QC methods. Developed methods including ab initio methods, semi-empirical methods, and density functional theory (DFT) based on quantum mechanics are commonly recognized methods. Since post-HF methods are usually used to calculate electric properties of small sets of molecular and clusters. DFT instead of molecular-orbital method is normally used in solid-state physics especially for cases involving many symmetrical structures. Yet QC has brought us basic information on solid-state material, these results still rely on the ideal model based on simple hypothesis. In real conditions, the reaction process is quite complicated. The computational complexity of quantum chemistry limits the simulation of real systems [56–58]. The innovations in computer science and the improvements to artificial intelligent algorithm brings opportunity to QC simulation. 3 Machine learning algorithm accelerates material design The earliest application of machine learning (ML) in material development can be traced back to the last century [41,59]. The limitation of data and hardware prohibited the ML techniques at that time [60]. Nowadays artificial intelligence algorithms become more convenient and enable high-throughput screening. As an important branch of artificial intelligence, ML focuses on how computer programs improve their performance automatically based on data mining. In other words, using known data, the computer can automatically predict or discover unknowns under the guidance of optimized algorithms (Fig. 2), such as experimental parameters, information, and statistical results. A key task so far has been to improve models to simulate more complex situations, such as electrochemical reactions, molecule adsorption sites, harsh service conditions [12,61,62]. Machine learning is similar to human learning [63], except that human intelligence relies on the brain, while machine learning relies on computer algorithms [64]. In general, human learning ability can be trained by the accumulation of social experience. As for ML, computers can be regarded as scientific instrument that output desired results based on information entered. The progress of ML lies in timely judgment and decision- making based on designed rules, science laws, and accumulated experience. Similarly, ML can be separated into three parts: input, learning, and output. In the input part, computers recognize and store huge amounts of training data for specific cases. Intrinsic relationships and laws are summarized in the learning part. The output part is expected to predict and estimates new problems of the laws learned. To some extent, ML is similar process to human learning, i.e. computer mimicking the behavior of the human brain. The solution is finding out a kind of algorithms or a series of algorithms which can output more credible results in the shortest time. Currently, there are many kinds of ML algorithms (summarized in Fig. 3), including the supervised learning, unsupervised learning, and reinforcement model [1,27,63,65–67]. Supervised learning is characterized by features and labels. Even if the data is unlabeled, the relationship between learning features and labels can be used to determine the label. Unsupervised learning means the algorithms are not enable to label data, which can be divided into several categories—clustering by the internal relationship and similarity [68]. And reinforcement learning solves the current problems through continuous reward and punishment, and optimized strategy can be obtained after constantly strengthen operations [14,69–73]. As the specific ML methods have introduced and summarized elsewhere, we will not repeat the details of each method. Commonly used algorithms include naive bayes, nearest neighbor estimators, decision tree and random forest [74], support vector machine, lifting algorithm, EM algorithm, neural network, K-means clustering, Apriori algorithm and so on. Among them, the artificial neural network (ANN) has been widely applied to the research of energy materials, especially in catalysts screening [28]. Also, some useful databases accelerate the high-value results output [75]. Nevertheless, cost problems still obstacle the determination of large scale datasets [76]. 4 Tetrahedral structure-property relationship In the field of traditional material science, the structure-preparation-property-performance tetrahedral relationship is a tried and true principle [77]. Similarly, chemists usually concern more about the reaction mechanism beyond materials preparation, as well as the reaction progresses under operando conditions (Fig. 4 a). To characterize the physicochemical properties of reactants is a requisite. Therefore, from the chemistry perspective, there should be a preparation-characterization-property-mechanism tetrahedral relationship. Understanding four fundamental degrees of freedom (orbital, spin, lattice and charge) plays a critical role in the electronic property [78]. Here we take the order-disorder transformation of PtFe nanoparticle (NPs) as an example to illustrate the relationship. PtFe NPs as magnetic recording materials and catalysts have attracted much attentions [79]. There is a disorder-order phase transformation during the preparation of PtFe NPs. Typically, a phase transformation from fcc A1-PtFe to fct L10-PtFe occurs for PtFe NPs with diameter of ~4 nm during under ~550 °C annealing (Fig. 4b). Annealed L10-PtFe NPs show larger coercivity compared to plasma treated A1-PtFe NPs (Fig. 4c) [80]. This phase transformation can be deciphered by magnetic properties of nanoparticles such as orbital magnetic moment and spin magnetic moment. L10-PtFe NPs with shorter Pt-Pt distance hereby show enhancement oxygen reduction reaction performance (Fig. 4d) [81]. The quantum mechanics/molecular mechanics (QM − MM) simulations were performed to uncover the difference of Pt-O binding energies (Fig. 4e, f) [82]. The calculation result indicates that the oxygen adsorption energy of L10-PtFe NPs is closer to the optimal value (0.20 eV) of the volcano plot, which follows the Sabatier principle. Therefore, strategies to obtain ordered L10 phase catalysts needs further exploration. Observing the phase transformation in the atomic level is an intriguing process. The ordered phase (L10 and L12) was first formed at the surface of particles during annealing (Fig. 4g) [83]. The precise 3D reconstruction of more than 20,000 single atoms of a PtFe NPs by atomic electron tomography extends the understanding of materials into more fundamental degrees of freedom (e.g. atomic magnetic moments or magnetocrystalline anisotropy energy) (Fig. 4h) [84]. “There's plenty of room at the bottom.” Obviously, it takes so much effort to understand a phenomenon at the atomic scale, let alone a more general section (more particles or more than one degree of freedom). To establish the strongly correlated connection between spin and orbit in solids, further to understand the structure-activity relationship of energy materials, it is absolutely necessary to use machine learning algorithms in quantum chemistry techniques. Besides decoding the fundamental relationships behinds structure and properties, the breakthrough of technologies, including synchrotron radiation [85], neutron diffraction [86], spherical aberration corrected scanning transmission electron microscope [87], and so on, also promote the research and development of energy materials. 5 Applications of machine learning for the development of energy materials At present, ML has been applied to the design and optimization of energy materials, including high-temperature alloys [88], perovskites for solar cells [89], lithium-ion battery materials [90,91], catalytic materials [92], phosphors [93], carbon-based supercapacitors [94], and van der Waals (vdW) heterostructures [95] etc. In addition to accelerating the development of energy materials, ML can also optimize the QC calculation methods. Even tremendous progress has been realized, there is no universal method for different systems (such as electride [96,97], MXenes [98,99]) till now. Here, some selected examples are discussed analyze the role of ML in the field of energy materials. For convenience, this part is divided into four main aspects: Modeling electronic structure, classifying crystal structure, optimizing experimental methods, and predicting performance. 5.1 Modeling electronic structure-(potential energy, band energy, band gap and density functionals) Determining the electronic structure of materials is the premise of understanding their performance. Perovskite oxide family is regard as promising catalysts for several energy conversions including water splitting [100,101], nitrogen oxides reduction [102], solar cells [103] and carbon dioxide captures [104]. Yang et al. [105] highlight that ML will provide upcoming opportunities to high-throughput DFT calculations, and the prediction of activity and physical performance (Fig. 5 a). ML-assisted molecular dynamics and high-throughput screening experiments are combined to explore perovskite materials efficiently. In addition, by comparing the neural network predictions with recalculated DFT energies of bulk silicon, Behler and Parrinello [53] found each metate of the potential matches well. Then, they improved neural network potentials methods compared with DFT potential energy for calculation of bcc copper at 500 K, which reaction paths not influence on the fidelity and saving to calculate cost (Fig. 5b) [106]. Besides the potential energy, the precise band gap of metal surface is crucial criteria for photo(electro)catalyst and other semiconductors. High-fidelity bandgap by QC calculation is a time-consuming task, which is not practical in high throughput research. Yet the statistical learning method based on informatics may be a promising choice. Pilania and collaborators [107] present a systematic engineering method and a powerful learning framework for bandgap prediction of the double perovskites. After evaluating more than 1.2 million features, they concluded that the lowest occupied Kohn-Sham level and the elemental electronegativity of the perovskite atoms are the most important and accurate predictors (Fig. 5c). Inspired by Phillips’s ionicity theory of solid-state physics, Liang et al. [108] demonstrated a least absolute shrinkage and selection operator to predict the band energy and band gap. This method shows high accuracy and can be further extended to other databases (Fig. 5d, e). This work definitely resolves the few-shot problem, while the previous methods only applied to the database used for training. Therefore, Smith et al. [109] introduced a modified Behler-Parrinello (BP) method, so called accurate neural network engine for molecular energies. They use atomic environment vectors to represent molecules in complex chemical environments, which including organic molecules, e.g. a benzene ring, alkenes, functional groups, etc. Besides, Brian Kolb and collaborators [110] extended BP method to the reaction system, including the scattering of molecules and/or dissociation from metal surfaces. Burke, one of the developers of PBE stands, reported a ML-produced functional [111]. That so-called ML approximation (MLA) achieves the more accurate of kinetic energy than that of any other approximation (Fig. 5f). Since it is data-driven by training sets, the MLA requires without much prior knowledge of physics. However, based on collection plot of test set and the new data set, the chemical accuracy of MLA stands at left of the interpolation (Fig. 5g). Even the accuracy could be improved by human correction, it is difficult to find out the source of error because of the self-training process. 5.2 Classifying crystal structure-(recognition of crystal, deformation and segregation) Besides perovskites and phosphors, ML tools can identify the lattice symmetry of unknown materials. Ziletti et al. [112] used advanced ML to simulate the symmetry of defective structures. They simulate the crystal more than 100,000 crystal structures by calculating the diffraction image through a deep learning neural network model. More importantly, this classical algorithm is also applicable to crystal structure with rich defects (even the defect concentration is up to 40%). Thus it is considered a reliable tool for crystal symmetry recognition and crystal classification. For instance, with the help of simulate approaches, the phase transition from body-centered-cubic to simple cubic (bcc-to-sc) structure was predicted. When the moving number of center atom of bcc increased to 75% percentage, the defective structure probably changes into sc structure (Fig. 6 a, b). Rare-earth doped inorganic phosphors are the key to solid-state lighting [113–115]. Traditionally, new phosphor was prepared by solid state reaction [115]. Zhuo and coworkers [93] demonstrated that the Debye temperature of crystal structure of phosphors can be predicted by combining the support vector machine regression model with the high-throughput DFT calculation, where the Debye temperature is the represent the quantum yield of photoluminescence. NaBaB9O15:Eu2+ is selected by screening compounds with highest Debye temperature and largest band gap (Fig. 6c–f). Then NaBaB9O15:Eu2+ phosphor was synthesized by solid state sintering, showing a high (95%) quantum yield and satisfied thermal stability. Instead of trial and error method, ML supported vector machine regression model is beneficial to the discovery of suitable energy materials. The formation, movement and disappearance of crystal defect have an important impact on the activity and stability of energy materials [116,117]. For microcrystals, different samples may present different stress-strain curves, which possess a challenge to the study of plastic deformation of crystals. Salmenjoki et al. [118] discussed this purely random phenomenon and proposed that the predictability of deformation is possible. They used regression neural networks and support vector machines to learn the changes in strain and crystal size during plastic deformation. By carrying out dynamics simulation on discrete dislocation data, ML model can predict the mapping of existing dislocation motions and yield strain (Fig. 7 a). This predictive model suggested larger systems are easier to be predicted (Fig. 7b). This might because that the probability of dislocation motions in larger systems is greater to enable predictability of deformation. Defects not only affect structural transition, but also affect dislocation motions. Furthermore, defects in solute grain boundary (GB) can lead to atomic segregation [120,121]. Even solute atoms in millions of host atoms can cause qualitative change of mechanical properties. In other words, the segregation concept is atomic magnitude order of the solute. However, many defect configurations need strictly approximate models. Huber et al. [119] demonstrated that ML descriptors can accurately predict the segregation energy distribution and isotherm segregation (Fig. 7c) with the aid of high-throughput study and 1 million segregation energy dataset. The diagram shows the energy distribution of magnesium atoms at different GB positions in place of the selected boundary on the polar plot. This ML tool accurately determines the relationship between GB segregation and GB energy, thus providing a new set of identifying advanced material. 5.3 Predicting performance-(catalytic property of CO2 fixation and methanol electro-oxidation, lifetime of lithium-ion batteries) Carbon dioxide (CO2) fixation not only mitigates the greenhouse effect but also converts CO2 into value-added chemicals. In order to systematically study the solubility of CO2 in sodium phosphate solution, Li et al. explored the intrinsic trend of CO2 solubility by data-mining [122,123]. Using generalized regression neural network (GRNN) algorithm, one can quantify the type and concentration of mixed solutions. Besides, by means of GRNN algorithm, the relationship between CO2 solubility and others experimental conditions can be discovered, and the general trend of CO2 solubility in mixed solutions can also be predicted. In a wide range of energy materials, Xin et al. [124] proposed a ML augmented chemisorption model that can quickly predict the surface reactivity of alloys. Firstly, as a biologically inspired learning algorithms, after trained through a set of ab initio adsorption energy from an ideal bimetallic surface, ANN can predict *CO adsorbates on a multimetallic surface with an error of ~0.1 eV. Then screening of high-throughput catalysts greatly relies on the scaling relationships between adsorption energy of adsorbates. For example, by using scaling relations and ANN learning algorithms, the electrochemical reduction of carbon dioxide (CO2RR) to the C2 products was realized by {100}-terminated multimetallic alloys. Besides, the hydrogen evolution reaction (HER) must be taken into consideration when considering CO2RR, because of the lower overpotential of HER than that of CO2RR. Therefore, Tran & Ulissi [25] reported a systemic and automatic screening method to guide DFT calculation, thereby predicting the CO2RR electrocatalytic activity. They demonstrated the screening results of various alloys formed by 31 different elements, and the filter range included 50% d-block elements and 33% p-block elements (Fig. 8 a). So far, this method has identified 131 surfaces for CO2RR in 54 alloys after calculating 42,785 adsorption energy and 258 surfaces for hydrogen generation in 102 alloys. Even though there still are prediction errors (ca. 0.1 eV) when using feedforward ANN model to practical catalyst identification [124], the calculation results did not match polycrystalline experiments well even high-throughput DFT workflow optimized ANN model [25]. This mainly because the active adsorption sites in these models lie in precise crystal surface. Considering that the reactivity of these active sites is related to its electronic properties, the created surface structure of the model is different from the surface of cluster catalysts in experimental cases. The weak binding site of the cluster with low coordination number may also be an active site for reactions. These neglected points as drawbacks of the CO2RR volcano model still remain. Also, these models did not address other important issues of catalysis, such as stability or economy. Bimetallic catalyst is one of the most promising CO2RR catalysts according to modern QC calculation. Tracing active sites on polycrystalline samples is a profound work and requires many works on experimental and theoretical calculations [126,127]. Basically, hundreds of active sites on stable low-index facets of bimetallic crystals represent the possible active sites. Norskov and collaborators [24] used a neural network based model to reduce the amount of DFT calculations and calculated the CO2RR on nickel-gallium bimetallic surface. The results showed that the activity for most surfaces is the same as that of the nickel surfaces, but there are a few exposed nickel sites with good on-top CO configuration (Fig. 8b). This predictive ML model followed the rules of facet reactivity and surface active sites paves a new way to find out promising catalysts. As above mentioned, a new fingerprint descriptor based on the chemical adsorption theory has been adopted in optimizing parameters of ANN. As popular energy materials, bimetallic catalysts have found important applications for methanol fuel cells [128]. Xin et al. [125] used electrochemical methanol oxidation as the model reaction to draw a volcanic activity map (see Fig. 8c). Combined with the free energy correction table, they provided a linear scaling relationship between *CO with carbon-bonding species and *OH with oxygen-bonding species. After that, they established an ML model trained by existing ~1000 ideal alloy surface database. This database can capture the complex and nonlinear adsorption/metal interaction with ~0.2 eV RMSE errors (Fig. 8d). Lithiated and delithiated process in cathode materials induce volume changes, further affecting the lifetime of lithium-ion batteries. In order to reveal the relationship between structural characteristics and volume changes in the electrochemical process, by using partial least squares (PLS) regression, Chen et al. predicted structural distortion of Li-O and X-O polyhedral (Fig. 9 a) [129]. X represents 14 metal elements (Ti, V, Cr, Mn, Fe, Co, Ni, Nb, Mo, Ru, Rh, Pd, Ta, Ir) that involved in oxide cathodes. Compared to DFT calculations, the regression results can well predict the major parameters of volume change. However, predicting variables in the more complicated system is ongoing. It is challenging but vital to predict the lifetime of lithium-ion batteries due to the complex mechanisms of capacity degradation. Braatz et al. [130] developed a new model with the help of ML tools to predict the lifetime of batteries through the early-cycle data (Fig. 9b–d). Namely, the predicting based on first 100 cycles only achieves errors of 9.1%, even though the entire lifetime of a battery normally shows a nonlinear degradation. Compared to traditional power and capacity loss forecasting models, the data-driven model uses high-rate discharge voltage curves without considering the relevant physicochemical knowledge of battery degradation. Since this model was carried out in the commercial lithium iron phosphate (LFP)-graphite battery, the broad applications and model robustness in the relevant system to be further tested. 5.4 Optimizing experimental method-(two-dimensional (2D) and carbon-based materials) Since the discovery of graphene earned the Nobel Prize in 2010, Graphdiyne (GDY) and other two-dimensional materials have started an upsurge in energy materials science [131,132]. A simple two-dimensional (2D) material identification criterion is needed when comparing the experimental lattice constants with DFT computed lattice constants [133]. Naturally, there are always two lattice constant differences greater than or equal to 5% in 2D materials. New materials that meet both the lattice difference and the stripping energy criterion will be considered as 2D materials. Choudhary and coworkers [134] discovered that there are at least 1356 2D materials, and these predicted materials not only meet the lattice difference but also match the exfoliation energy criterion. Further experimental evidences are needed for all systems predicted by the simple criterions. Thickness is also an important factor when identifying 2D materials. Recently, a method combined Fresnel law with ML was proposed to identify the layer thickness of 2D materials [135]. By using K-mean clustering and K-nearest neighbor ML algorithm, the optical images of 2D materials are predictively analyzed. This algorithm can provide a fast and accurate descriptor for properties of 2D materials (Fig. 10 ). The van der Waals (vdW) heterostructures as a promising 2D materials [136] include transition metal sulfides (MoS2, WS2, NbS2 and ReS2, etc), transition metal selenides (MoSe2, NbSe2, WSe2 and NbSe2, etc), transition metal antimonides (NiSb2, TiSb2 and FeSb2, etc) and transition metal tellurides (WTe2, HfTe2 and NbTe2, etc). To explore the structural and electronic properties of all possible hybrid 2D materials, Ford and coworkers [95] predicted the interlayer distance and band gap of these bilayers by ML method. Their results are more effective than DFT calculations, also are beneficial to avoid synthesizing useless heterostructures. TiO2 and MnO2 are widely used in energy conversion and storage fields, such as photocatalysis. Olivetti et al. devoted to screening the synthesis of these materials from published literature [137]. A variational autoencoder (VAE) neural network was developed to generate a parameter set of SrTiO3 synthesis. The VAE framework visually revealed the potential driving factors of TiO2 synthesis, and found the intercalation effects of selected ions during the synthesis of different MnO2 phases. This VAE approach can screen optimized synthetic parameters, identify the formation and influence factor of different phases, as well as the relationship between material crystal phase and intercalated ions. Nevertheless, direct factors of synthesis methods for inorganic materials are still awaiting. Besides metal oxide catalysts, carbon materials have been at the forefront of energy materials researches [138]. Carbon materials are widely used as electrode materials in energy storage devices such as supercapacitors and lithium-ion batteries [139]. For example, Zhu et al. [94] used ANN method to predict the capacitance of carbon materials in the supercapacitor field. In order to train the model, they extracted the data from over 1000 pieces of literatures related to supercapacitors. Finally, five parameters, including specific surface area, calculated pore size, I D/I G ratio, N doping level and voltage window, were selected to train the ML model, followed by the performances of multiple selected carbon-based materials were predicted. ANN shows greater potential than linear regression and Lasso in discovering advanced carbon material for supercapacitors (Fig. 11 a and b). Graphene also has been attracted much attention, Fernandez et al. [140,141] calculated the band gap (E G) energy, the ionization potential (E I) energy, the Fermi level (E F) energy, and the electron affinity (E A) energy of graphene nanoflakes by ML modeling. For example, the model accelerated the reasonable design of functional graphene through predicting the energy gap of graphene nanoflakes (Fig. 11c). The ML model accurately calculated ca. 80% electronic properties of graphene in the training set, efficiently described structures–electronic relationships of graphene solely. Even the result showed a high confidence level, the calculation deviation was still inevitable. If the data point is farther away from the mean, the deviation in the dataset becomes greater. However, these deviations may result from intrinsic defects or experimental errors of materials, or cause by the limitation of one specific model that is not suitable for multiscale materials [142]. Therefore, under different classifications, it is more important to find out the right tolerance parameters to meet the minimum deviations from the specific structures. 6 Current challenges Challenging the holy grail of-how to build a good ML model from limited data is crucial. Data diversity of scales is one of the most important aspects. With the increasing proliferation of large-scale data, the training program must take the diversity scales of data into consideration. Besides, large-scale data sets of material properties are necessary and urgent to be optimized. The material genome initiative is being developed and applied to numerous domains, such as energy and environment, medicine and health, military and aerospace field. These data are gradually extended to ML models, which has contributed a lot to the recent developments of energy materials. Meanwhile, to match the models well, one needs both the proficient skills on ML algorithm and the deep understanding of the applied field. For calculators, developing effective rules to search hyperparameter for algorithms optimization, or learning more complexity knowledge for searching hyperparameters might be time consuming and inefficient. Meanwhile, choosing appropriate hyperparameters is a harsh work to do so. A compromise way might be model complexity. Undeniably, however, such costly process cannot maximize throughput and minimize errors. It is still challenging but promising to predict computation with the rise of deep learning. In order to obtain results of high confidence, it is necessary to verify and validate the ML models. Data scientists for materials science have successfully simulated and predicted many new materials for a specific area. However, due to the limitations of experimental conditions and synthesis methods, the development of many ideal materials lags behind the calculation results. To solve this problem, an improved cross-validation method (i.e. k-fold cross validation) is proposed, which provides a useful estimation of the predictive performance of models. For instance, Xiong et al. [22] developed a k-fold cross validation model to predict material properties through ML. They have addressed the limitation of the traditional k-fold cross-validation method of new evaluation methods. By changing the property value of step/gap between the validation set and training set, this new method has successfully evaluated the prediction performances including the formation energy algorithm (Fig. 12 a), band gap, and superconducting critical temperature of different materials. The functional-driven MAE (see Section 5.2) showed good chemical accuracy. Hyperparameters from cross-validation tests of MLA includes noise level λ and kernel parameter σ (Fig. 12b) [143]. It is hereby proved that errors of the method below 1 kcal/mol. Considering other degrees of freedom, the MLA tools still need to be applied in more complicated system. High-throughput screening has been widely used in the development of new materials [146,147], especially in the implementation of Material Genome Initiative (MGI). To date, several methods such as ML and data mining have been widely used in high throughput screening of materials [13]. With the help of MGI, ML can be used to mine the data of new reaction processes, new properties, or new structures. For example, high-throughput automated reaction screening and ML approaches have been introduced to mimic the interface reactions of solid electrolyte of lithium [144]. It has been well known that the solid electrolyte interface formed on Li metal surface will protect cells from Li-dendrites. The ML algorithms imply that the metal oxides control the interface reactions, where M-O bond enhance the stability of cation-doped solid electrolyte. The excellent correlation confirms the relationship of KRR predictions versus DFT values (Fig. 12c). This systematic study relies on the high-throughput screening of formation energy and interface reaction energy. Scalable and reproducible methods are welcome, since the difficulty of building heterogeneous junctions in experiments, especially maintaining specific components, morphology, and size distribution, limits the application in the field of catalysis and photovoltaics is limited. Schaak et al. [145] developed a cation-exchange reaction by using copper sulfide (Cu1.8S) as a template, which can synthesize more than 65,000 heterostructure nanorods in different lattice structures and interfaces (Fig. 12d). Due to the structural instability of the interface caused by the lattice mismatch, there may be unrealizable components in this heterostructure library. This high-throughput screening experiment cannot be verified by chemical synthesis in the laboratory. Fortunately, ML algorithms can do this kind of work. Currently, owing to the lack of mass failure data and experimental details, the ML method for high-throughput screening is far from meeting the requirements. Besides, the cost of high-throughput screening is still too expensive and it is time-consuming as well. More importantly, the knowledge of material properties is not comprehensive, particularly for new materials. Therefore, the deep integration of ML, high-throughput screening of advanced energy materials will promote its industry applications. 7 Conclusions and perspectives Based on knowledge of QC, ML algorithms seem to be a time-saving method to identify energy materials. Much attention on this field indicates a growing demand for multidisciplinary. From crystal identification of catalysts prediction, the complex chemical reaction descriptor can easily be summarized and trained in simple ML algorithms. This review highlights related studies using ML as a fast and accurate tool in energy material development. More chemists and computational scientists have focused on the development in this field: the knowledge gaps, future directions in machine learning research and applications in energy materials discovery and optimization [76]. Future researches should concentrate on the following interesting directions. Firstly, Researchers with a multidisciplinary background should focus on fundamental applications, especially the application of energy materials in the industrial field. Secondly, Open access database for high-throughput screening is urgently needed. Those inaccurate prediction results should not ascribe to algorithms but the lack of training data. Notably,Pan et al. [3] developed a material structure database and studied the bandgap of material structure by ML method. Thirdly, developing the technical databases for characterizing energy materials is important. Especially the relationship between different experimental results (database) needed to be established by using new techniques, such as X-ray absorption spectroscopy [85], neutron diffraction [86], transmission electron microscope [87], time-resolved computed tomography [148], spectroscopic X-ray nanoimaging [149] . Finally, more powerful algorithm needs to be used in new fields, for example, the reconstruction of imaging [67], identification of material structures [90], connection of structure-activity relationships [150,151] . There are still many important energy materials-related issues to explore assisted by ML, such as: (i) The efficient catalysts for nitrogen fixation reaction [152], (ii) catalytic efficiency of artificial photosynthesis [153], (iii) the degradation mechanism and life prediction of lithium-ion battery [154], (iv) prediction of key parameters for battery nail penetration test [155], and (v) agreed test criteria for flexible electronics and wearable devices [156]. All in all, high efficient/stable green energy materials need to be realized with the support of emerging artificial intelligence technologies. Declaration of Competing Interest The authors declare that they have no known competing financial interests or personal relationships that could have appeared to influence the work reported in this paper. Acknowledgments This work was supported by the National Natural Science Foundation of China (grant number 51872157); Shenzhen Technical Plan Project (grant number KQJSCX20160226191136 and JCYJ20170412170911187); and Research Grants Council of the Hong Kong Special Administrative Region, China [grant number PF17-10186]. References [1] J. Schmidt M.R.G. Marques S. Botti M.A.L. Marques NPJ. Comput. Mater. 5 2019 83 J. Schmidt, M.R.G. Marques, S. Botti, M.A.L. Marques, NPJ Comput. Mater. 5 (2019) 83. [2] A. Agrawal A. Choudhary APL Mater. 4 2016 053208 A. Agrawal, A. Choudhary, APL Materials 4 (2016) 053208. [3] J. Jie Z. Hu G. Qian M. Weng S. Li S. Li M. Hu D. Chen W. Xiao J. Zheng L.-W. Wang F. Pan Sci. Bull. 64 2019 612 616 J. Jie, Z. Hu, G. Qian, M. Weng, S. Li, S. Li, M. Hu, D. Chen, W. Xiao, J. Zheng, L.-W. Wang, F. Pan, Sci. Bull. 64 (2019) 612-616. [4] G.-R. Zhang L.-L. Shen P. Schmatz K. Krois B.J.M. Etzold J. Energy Chem. 49 2020 153 160 G.-R. Zhang, L.-L. Shen, P. Schmatz, K. Krois, B.J.M. Etzold, J. Energy Chem. 49 (2020) 153-160. [5] P.Z. Moghadam S.M.J. Rogge A. Li C.-M. Chow J. Wieme N. Moharrami M. Aragones-Anglada G. Conduit D.A. Gomez-Gualdron V. Van Speybroeck D. Fairen-Jimenez Matter 1 2019 219 234 P.Z. Moghadam, S.M.J. Rogge, A. Li, C.-M. Chow, J. Wieme, N. Moharrami, M. Aragones-Anglada, G. Conduit, D.A. Gomez-Gualdron, V. Van Speybroeck, D. Fairen-Jimenez, Matter 1 (2019) 219-234. [6] H. Liu Chin. J. Catal. 35 2014 1619 1640 H. Liu, Chinese Journal of Catalysis 35 (2014) 1619-1640. [7] K. Honkala A. Hellman I.N. Remediakis A. Logadottir A. Carlsson S. Dahl C.H. Christensen J.K. Nørskov Science 307 2005 555 558 K. Honkala, A. Hellman, I.N. Remediakis, A. Logadottir, A. Carlsson, S. Dahl, C.H. Christensen, J.K. Nørskov, Science 307 (2005) 555-558. [8] J.W. Erisman M.A. Sutton J. Galloway Z. Klimont W. Winiwarter Nat. Geosci. 1 2008 636 639 J.W. Erisman, M.A. Sutton, J. Galloway, Z. Klimont, W. Winiwarter, Nat. Geosci. 1 (2008) 636-639. [9] C. Marichy M. Bechelany N. Pinna Adv. Mater. 24 2012 1017 1032 C. Marichy, M. Bechelany, N. Pinna, Adv. Mater. 24 (2012) 1017-1032. [10] Q. Ma Y. Yu M. Sindoro A.G. Fane R. Wang H. Zhang Adv. Mater. 29 2017 1605361 Q. Ma, Y. Yu, M. Sindoro, A.G. Fane, R. Wang, H. Zhang, Adv. Mater. 29 (2017) 1605361. [11] See record data from web of science search results, key word: “energy materials” and “mechine learning”+“energy materials”, (2020) http://apps.webofknowledge.com. [12] K.F. Jensen C.W. Coley N.S. Eyke Angew. Chem. Int. Ed. 2019 10.1002/anie.201909989 K.F. Jensen, C.W. Coley, N.S. Eyke, Angew. Chem. Int. Ed. (2019) 10.1002/anie.201909989. [13] P. Raccuglia K.C. Elbert P.D.F. Adler C. Falk M.B. Wenny A. Mollo M. Zeller S.A. Friedler J. Schrier A.J. Norquist Nature 533 2016 73 P. Raccuglia, K.C. Elbert, P.D.F. Adler, C. Falk, M.B. Wenny, A. Mollo, M. Zeller, S.A. Friedler, J. Schrier, A.J. Norquist, Nature 533 (2016) 73. [14] V.L. Deringer M.A. Caro G. Csanyi Adv. Mater. 31 2019 e1902765 V.L. Deringer, M.A. Caro, G. Csanyi, Adv. Mater. 31 (2019) e1902765. [15] G. Fraux S. Chibani F.-X. Coudert Philos. T. R. Soc. A 377 2019 G. Fraux, S. Chibani, F.-X. Coudert, Philos. T. R. Soc. A 377 (2019). [16] J.K. Nørskov J. Rossmeisl A. Logadottir L. Lindqvist J.R. Kitchin T. Bligaard H. Jónsson J. Phys. Chem. B 108 2004 17886 17892 J.K. Nørskov, J. Rossmeisl, A. Logadottir, L. Lindqvist, J.R. Kitchin, T. Bligaard, H. Jónsson, J. Phys. Chem. B 108 (2004) 17886-17892. [17] J. Greeley I.E.L. Stephens A.S. Bondarenko T.P. Johansson H.A. Hansen T.F. Jaramillo J. Rossmeisl I. Chorkendorff J.K. Nørskov Nat. Chem. 1 2009 552 556 J. Greeley, I.E.L. Stephens, A.S. Bondarenko, T.P. Johansson, H.A. Hansen, T.F. Jaramillo, J. Rossmeisl, I. Chorkendorff, J.K. Nørskov, Nat. Chem. 1 (2009) 552-556. [18] J. Graser S.K. Kauwe T.D. Sparks Chem. Mater. 30 2018 3601 3612 J. Graser, S.K. Kauwe, T.D. Sparks, Chem. Mater. 30 (2018) 3601-3612. [19] G. Hautier, Data Mining Approaches to High-Throughput Crystal Structure and Compound Prediction, in: S. AtahanEvrenk, A. AspuruGuzik (Eds.) Prediction and Calculation of Crystal Structures: Methods and Applications, 2014, pp. 139–179. [20] E.V. Podryabinkin E.V. Tikhonov A.V. Shapeev A.R. Oganov Phys. Rev. B 99 2019 E.V. Podryabinkin, E.V. Tikhonov, A.V. Shapeev, A.R. Oganov, Phys. Rev. B 99 (2019). [21] A. Halder A. Ghosh T.S. Dasgupta Phys. Rev. Mater. 3 2019 084418 A. Halder, A. Ghosh, T.S. Dasgupta, Phys. Rev. Mater. 3 (2019) 084418. [22] Z. Xiong Y. Cui Z. Liu Y. Zhao M. Hu J. Hu Comput. Mater. Sci. 171 2020 109203 Z. Xiong, Y. Cui, Z. Liu, Y. Zhao, M. Hu, J. Hu, Comput. Mater. Sci. 171 (2020) 109203. [23] B. Cao L.A. Adutwum A.O. Oliynyk E.J. Luber B.C. Olsen A. Mar J.M. Buriak ACS Nano 12 2018 7434 7444 B. Cao, L.A. Adutwum, A.O. Oliynyk, E.J. Luber, B.C. Olsen, A. Mar, J.M. Buriak, ACS Nano 12 (2018) 7434-7444. [24] Z.W. Ulissi M.T. Tang J. Xiao X. Liu D.A. Torelli M. Karamad K. Cummins C. Hahn N.S. Lewis T.F. Jaramillo K. Chan J.K. Nørskov ACS Catal. 7 2017 6600 6608 Z.W. Ulissi, M.T. Tang, J. Xiao, X. Liu, D.A. Torelli, M. Karamad, K. Cummins, C. Hahn, N.S. Lewis, T.F. Jaramillo, K. Chan, J.K. Nørskov, ACS Catal. 7 (2017) 6600-6608. [25] K. Tran Z.W. Ulissi Nat. Catal. 1 2018 696 703 K. Tran, Z.W. Ulissi, Nat. Catal. 1 (2018) 696-703. [26] B.M. Bonk J.W. Weis B. Tidor J. Am. Chem. Soc. 141 2019 4108 4118 B.M. Bonk, J.W. Weis, B. Tidor, J. Am. Chem. Soc. 141 (2019) 4108-4118. [27] K.T. Butler D.W. Davies H. Cartwright O. Isayev A. Walsh Nature 559 2018 547 555 K.T. Butler, D.W. Davies, H. Cartwright, O. Isayev, A. Walsh, Nature 559 (2018) 547-555. [28] H. Li Z. Zhang Z. Liu Catalysts 7 2017 306 H. Li, Z. Zhang, Z. Liu, Catalysts 7 (2017) 306. [29] G.H. Gu J. Noh I. Kim Y. Jung J. Mater. Chem. A 7 2019 17096 17117 G.H. Gu, J. Noh, I. Kim, Y. Jung, J. Mater. Chem. A 7 (2019) 17096-17117. [30] A.R. Oganov C.J. Pickard Q. Zhu R.J. Needs Nat. Rev. Mater. 4 2019 331 348 A.R. Oganov, C.J. Pickard, Q. Zhu, R.J. Needs, Nat. Rev. Mater. 4 (2019) 331-348. [31] G.R. Schleder A.C.M. Padilha C.M. Acosta M. Costa A. Fazzio J. Phys. Mater. 2 2019 032001 G.R. Schleder, A.C.M. Padilha, C.M. Acosta, M. Costa, A. Fazzio, J. Phys. Mater. 2 (2019) 032001. [32] M. Moliner Y. Roman-Leshkov A. Corma Acc. Chem. Res. 52 2019 2971 2980 M. Moliner, Y. Roman-Leshkov, A. Corma, Acc. Chem. Res. 52 (2019) 2971-2980. [33] X. Wan W. Feng Y. Wang H. Wang X. Zhang C. Deng N. Yang Nano Lett. 19 2019 3387 3395 X. Wan, W. Feng, Y. Wang, H. Wang, X. Zhang, C. Deng, N. Yang, Nano Lett. 19 (2019) 3387-3395. [34] A. Radovic M. Williams D. Rousseau M. Kagan D. Bonacorsi A. Himmel A. Aurisano K. Terao T. Wongjirad Nature 560 2018 41 48 A. Radovic, M. Williams, D. Rousseau, M. Kagan, D. Bonacorsi, A. Himmel, A. Aurisano, K. Terao, T. Wongjirad, Nature 560 (2018) 41-48. [35] Y. Liu T. Zhao W. Ju S. Shi J. Materiomics 3 2017 159 177 Y. Liu, T. Zhao, W. Ju, S. Shi, J. Materiomics 3 (2017) 159-177. [36] Y. Liu T. Zhao G. Yang W. Ju S. Shi Comput. Mater. Sci. 140 2017 315 321 Y. Liu, T. Zhao, G. Yang, W. Ju, S. Shi, Comput. Mater. Sci. 140 (2017) 315-321. [37] Y. Liu J. Wu G. Yang T. Zhao S. Shi Sci. Bull. 64 2019 1195 1203 Y. Liu, J. Wu, G. Yang, T. Zhao, S. Shi, Sci. Bull. 64 (2019) 1195-1203. [38] S. Shi J. Gao Y. Liu Y. Zhao Q. Wu W. Ju C. Ouyang R. Xiao Chin. Phys. B 25 2016 018212 S. Shi, J. Gao, Y. Liu, Y. Zhao, Q. Wu, W. Ju, C. Ouyang, R. Xiao, Chin. Phys. B 25 (2016) 018212. [39] C. Chen W. Ye Y. Zuo C. Zheng S.P. Ong C. Chen W. Ye Y. Zuo C. Zheng S.P. Ong Chem. Mater. 31 2019 3564 3572 C. Chen, W. Ye, Y. Zuo, C. Zheng, S.P. Ong, C. Chen, W. Ye, Y. Zuo, C. Zheng, S.P. Ong, Chem. Mater. 31 (2019) 3564-3572. [40] W. Hu L. Wan Y. Jian C. Ren K. Jin X. Su X. Bai H. Haick M. Yao W. Wu Adv. Mater. Technol. 2018 1800488 W. Hu, L. Wan, Y. Jian, C. Ren, K. Jin, X. Su, X. Bai, H. Haick, M. Yao, W. Wu, Adv. Mater. Technol. (2018) 1800488. [41] B.R. Goldsmith J. Esterhuizen J.-X. Liu C.J. Bartel C. Sutton AIChE J. 64 2018 2311 2323 B.R. Goldsmith, J. Esterhuizen, J.-X. Liu, C.J. Bartel, C. Sutton, AIChE J. 64 (2018) 2311-2323. [42] B. Hammer J.K. Norskov Nature 376 1995 238 240 B. Hammer, J.K. Norskov, Nature 376 (1995) 238-240. [43] B. Hammer Y. Morikawa J.K. Nørskov Phys. Rev. Lett. 76 1996 2141 2144 B. Hammer, Y. Morikawa, J.K. Nørskov, Phys. Rev. Lett. 76 (1996) 2141-2144. [44] J.K. Nørskov F. Abild-Pedersen F. Studt T. Bligaard Proc. Natl. Acad. Sci. 108 2011 937 943 J.K. Nørskov, F. Abild-Pedersen, F. Studt, T. Bligaard, Proc. Natl. Acad. Sci. 108 (2011) 937-943. [45] S. Bhattacharjee U.V. Waghmare S.-C. Lee Sci. Rep. 6 2016 35916 S. Bhattacharjee, U.V. Waghmare, S.-C. Lee, Sci. Rep. 6 (2016) 35916. [46] M.T. Gorzkowski A. Lewera J. Phys. Chem. C 119 2015 18389 18395 M.T. Gorzkowski, A. Lewera, J. Phys. Chem. C 119 (2015) 18389-18395. [47] A.A. Balandin The Nature of Active Centers and the Kinetics of Catalytic Dehydrogenation D.D. Eley W.G. Frankenburg V.I. Komarewsky P.B. Weisz Adv. Catal. 1958 Academic Press 96 129 A.A. Balandin, The Nature of Active Centers and the Kinetics of Catalytic Dehydrogenation, in: D.D. Eley, W.G. Frankenburg, V.I. Komarewsky, P.B. Weisz (Eds.) Adv. Catal., Academic Press, 1958, pp. 96-129. [48] A.A. Balandin, Modern State of the Multiplet Theor of Heterogeneous Catalysis1*The paper was prepared for publication by E.I. Klabunovskii, in: D.D. Eley, H. Pines, P.B. Weisz (Eds.) Advances in Catalysis, Academic Press, 1969, pp. 1-210. [49] W.J.M. Rootsaert W.M.H. Sachtler Z. Phys Chem. 26 1960 16 W.J.M. Rootsaert, W.M.H. Sachtler, Z. Phys. Chem. 26 (1960) 16. [50] M.A. Barteau Catal. Lett. 8 1991 175 183 M.A. Barteau, Catal. Lett. 8 (1991) 175-183. [51] J.K. Norskov T. Bligaard J. Rossmeisl C.H. Christensen Nat. Chem. 1 2009 37 46 J.K. Norskov, T. Bligaard, J. Rossmeisl, C.H. Christensen, Nat. Chem. 1 (2009) 37-46. [52] E.M. Fernández P.G. Moses A. Toftelund H.A. Hansen J.I. Martínez F. Abild-Pedersen J. Kleis B. Hinnemann J. Rossmeisl T. Bligaard J.K. Nørskov Angew. Chem. Int. Ed. 47 2008 4683 4686 E.M. Fernández, P.G. Moses, A. Toftelund, H.A. Hansen, J.I. Martínez, F. Abild-Pedersen, J. Kleis, B. Hinnemann, J. Rossmeisl, T. Bligaard, J.K. Nørskov, Angew. Chem. Int. Ed. 47 (2008) 4683-4686. [53] F. Abild-Pedersen J. Greeley F. Studt J. Rossmeisl T.R. Munter P.G. Moses E. Skulason T. Bligaard J.K. Norskov Phys. Rev. Lett. 99 2007 016105 F. Abild-Pedersen, J. Greeley, F. Studt, J. Rossmeisl, T.R. Munter, P.G. Moses, E. Skulason, T. Bligaard, J.K. Norskov, Phys. Rev. Lett. 99 (2007) 016105. [54] Y. Li Q. Sun Adv. Energy Mater. 6 2016 1600463 Y. Li, Q. Sun, Adv. Energy Mater. 6 (2016) 1600463. [55] Z.-F. Huang J. Song S. Dou X. Li J. Wang X. Wang Matter 1 2019 1494 1518 Z.-F. Huang, J. Song, S. Dou, X. Li, J. Wang, X. Wang, Matter 1 (2019) 1494-1518. [56] S. Aaronson Nat. Phys. 5 2009 707 708 S. Aaronson, Nat. Phys. 5 (2009) 707-708. [57] N. Schuch F. Verstraete Nat. Phys. 5 2009 732 735 N. Schuch, F. Verstraete, Nat. Phys. 5 (2009) 732-735. [58] V.A. Rassolov S. Garashchuk Chem. Phys. Lett. 464 2008 262 264 V.A. Rassolov, S. Garashchuk, Chem. Phys. Lett. 464 (2008) 262-264. [59] C. Helma T. Cramer S. Kramer L. De Raedt J. Chem. Inf. Comput. Sci. 44 2004 1402 1411 C. Helma, T. Cramer, S. Kramer, L. De Raedt, J. Chem. Inf. Comput. Sci. 44 (2004) 1402-1411. [60] G. Hautier C.C. Fischer A. Jain T. Mueller G. Ceder Chem. Mater. 22 2010 3762 3767 G. Hautier, C.C. Fischer, A. Jain, T. Mueller, G. Ceder, Chem. Mater. 22 (2010) 3762-3767. [61] C.W. Coley N.S. Eyke K.F. Jensen Angew. Chem. Int. Ed. 2019 10.1002/anie.201909989 C.W. Coley, N.S. Eyke, K.F. Jensen, Angew. Chem. Int. Ed. (2019) 10.1002/anie.201909989. [62] Y. Huang Y. Chen T. Cheng L.-W. Wang W.A. Goddard ACS Energy Lett. 3 2018 2983 2988 Y. Huang, Y. Chen, T. Cheng, L.-W. Wang, W.A. Goddard, ACS Energy Lett. 3 (2018) 2983-2988. [63] L. Himanen A. Geurts A.S. Foster P. Rinke Adv. Sci. 6 2019 L. Himanen, A. Geurts, A.S. Foster, P. Rinke, Adv. Sci. 6 (2019). [64] C.C. Fischer K.J. Tibbetts D. Morgan G. Ceder Nat. Mater. 5 2006 641 646 C.C. Fischer, K.J. Tibbetts, D. Morgan, G. Ceder, Nat. Mater. 5 (2006) 641-646. [65] D.M. Dimiduk, E.A. Holm, S.R.J.I.M. Niezgoda, M. Innovation, Integr. Mater. Manuf. Innov. 7 (2018) 157-172. [66] F.E. Bock R.C. Aydin C.J. Cyron N. Huber S.R. Kalidindi B. Klusemann Front. Mater. 6 2019 110 F.E. Bock, R.C. Aydin, C.J. Cyron, N. Huber, S.R. Kalidindi, B. Klusemann, Front. Mater. 6 (2019) 110. [67] C. Belthangady L.A. Royer Nat. Methods 16 2019 1215 1225 C. Belthangady, L.A. Royer, Nat. Methods 16 (2019) 1215-1225. [68] V. Tshitoyan J. Dagdelen L. Weston A. Dunn Z. Rong O. Kononova K.A. Persson G. Ceder A. Jain Nature 571 2019 95 98 V. Tshitoyan, J. Dagdelen, L. Weston, A. Dunn, Z. Rong, O. Kononova, K.A. Persson, G. Ceder, A. Jain, Nature 571 (2019) 95-98. [69] B. Sanchez-Lengeling A. Aspuru-Guzik Science 361 2018 360 365 B. Sanchez-Lengeling, A. Aspuru-Guzik, Science 361 (2018) 360-365. [70] G.B. Goh N.O. Hodas A. Vishnu J. Comput. Chem. 38 2017 1291 1307 G.B. Goh, N.O. Hodas, A. Vishnu, J. Comput. Chem. 38 (2017) 1291-1307. [71] P. De Luna J. Wei Y. Bengio A. Aspuru-Guzik E. Sargent Nature 552 2017 23 25 P. De Luna, J. Wei, Y. Bengio, A. Aspuru-Guzik, E. Sargent, Nature 552 (2017) 23-25. [72] W. Wu Q. Sun Sci. China Phys. Mech. Astron. 48 2018 107001 W. Wu, Q. Sun, Sci. China Phys. Mech. Astron. 48 (2018) 107001. [73] G. Hegde R.C. Bowen Sci. Rep. 7 2017 42669 G. Hegde, R.C. Bowen, Sci. Rep. 7 (2017) 42669. [74] D.T. Ahneman J.G. Estrada S. Lin S.D. Dreher A.G. Doyle Science 360 2018 186 190 D.T. Ahneman, J.G. Estrada, S. Lin, S.D. Dreher, A.G. Doyle, Science 360 (2018) 186-190. [75] J.S. Hummelshøj F. Abild-Pedersen F. Studt T. Bligaard J.K. Nørskov Angew. Chem. Int. Ed. 51 2012 272 274 J.S. Hummelshøj, F. Abild-Pedersen, F. Studt, T. Bligaard, J.K. Nørskov, Angew. Chem. Int. Ed. 51 (2012) 272-274. [76] D. Krishnamurthy H. Weiland A. Barati Farimani E. Antono J. Green V. Viswanathan ACS Energy Lett. 4 2018 187 191 D. Krishnamurthy, H. Weiland, A. Barati Farimani, E. Antono, J. Green, V. Viswanathan, ACS Energy Lett. 4 (2018) 187-191. [77] C.J. Donahue J. Chem. Educ. 96 2019 2682 2688 C.J. Donahue, J. Chem. Educ. 96 (2019) 2682-2688. [78] Y. Tokura M. Kawasaki N. Nagaosa Nat. Phys. 13 2017 1056 1068 Y. Tokura, M. Kawasaki, N. Nagaosa, Nat. Phys. 13 (2017) 1056-1068. [79] S. Sun C.B. Murray D. Weller L. Folks A. Moser Science 287 2000 1989 1992 S. Sun, C.B. Murray, D. Weller, L. Folks, A. Moser, Science 287 (2000) 1989-1992. [80] C. Antoniak J. Lindner M. Spasova D. Sudfeld M. Acet M. Farle K. Fauth U. Wiedwald H.G. Boyen P. Ziemann F. Wilhelm A. Rogalev S. Sun Phys. Rev. Lett. 97 2006 117201 C. Antoniak, J. Lindner, M. Spasova, D. Sudfeld, M. Acet, M. Farle, K. Fauth, U. Wiedwald, H.G. Boyen, P. Ziemann, F. Wilhelm, A. Rogalev, S. Sun, Phys. Rev. Lett. 97 (2006) 117201. [81] D.Y. Chung S.W. Jun G. Yoon S.G. Kwon D.Y. Shin P. Seo J.M. Yoo H. Shin Y.H. Chung H. Kim B.S. Mun K.S. Lee N.S. Lee S.J. Yoo D.H. Lim K. Kang Y.E. Sung T. Hyeon J. Am. Chem. Soc. 137 2015 15478 15485 D.Y. Chung, S.W. Jun, G. Yoon, S.G. Kwon, D.Y. Shin, P. Seo, J.M. Yoo, H. Shin, Y.H. Chung, H. Kim, B.S. Mun, K.S. Lee, N.S. Lee, S.J. Yoo, D.H. Lim, K. Kang, Y.E. Sung, T. Hyeon, J. Am. Chem. Soc. 137 (2015) 15478-15485. [82] S. Zhang X. Zhang G. Jiang H. Zhu S. Guo D. Su G. Lu S. Sun J. Am. Chem. Soc. 136 2014 7734 7739 S. Zhang, X. Zhang, G. Jiang, H. Zhu, S. Guo, D. Su, G. Lu, S. Sun, J. Am. Chem. Soc. 136 (2014) 7734-7739. [83] J. Zhou Y. Yang Y. Yang D.S. Kim A. Yuan X. Tian C. Ophus F. Sun A.K. Schmid M. Nathanson H. Heinz Q. An H. Zeng P. Ercius J. Miao Nature 570 2019 500 503 J. Zhou, Y. Yang, Y. Yang, D.S. Kim, A. Yuan, X. Tian, C. Ophus, F. Sun, A.K. Schmid, M. Nathanson, H. Heinz, Q. An, H. Zeng, P. Ercius, J. Miao, Nature 570 (2019) 500-503. [84] Y. Yang C.C. Chen M.C. Scott C. Ophus R. Xu A. Pryor L. Wu F. Sun W. Theis J. Zhou M. Eisenbach P.R. Kent R.F. Sabirianov H. Zeng P. Ercius J. Miao Nature 542 2017 75 79 Y. Yang, C.C. Chen, M.C. Scott, C. Ophus, R. Xu, A. Pryor, L. Wu, F. Sun, W. Theis, J. Zhou, M. Eisenbach, P.R. Kent, R.F. Sabirianov, H. Zeng, P. Ercius, J. Miao, Nature 542 (2017) 75-79. [85] Y.Q.-X.D.B.G.Y.Z.K.L. Yi-Jin., Physics 48 (2019) 205-218. [86] G. Kim H. Diao C. Lee A.T. Samaei T. Phan M. de Jong K. An D. Ma P.K. Liaw W. Chen Acta Mater. 181 2019 124 138 G. Kim, H. Diao, C. Lee, A.T. Samaei, T. Phan, M. de Jong, K. An, D. Ma, P.K. Liaw, W. Chen, Acta Mater. 181 (2019) 124-138. [87] J.A. Aguiar, M.L. Gong, R.R. Unocic, T. Tasdizen, B.D. Miller, Sci. Adv. 5 (2019) eaaw1949. [88] D. Shin Y. Yamamoto M.P. Brady S. Lee J.A. Haynes Acta Mater. 168 2019 321 330 D. Shin, Y. Yamamoto, M.P. Brady, S. Lee, J.A. Haynes, Acta Mater. 168 (2019) 321-330. [89] J. Im S. Lee T.-W. Ko H.W. Kim Y. Hyon H. Chang NPJ Comput. Mater. 5 2019 37 J. Im, S. Lee, T.-W. Ko, H.W. Kim, Y. Hyon, H. Chang, NPJ Comput. Mater. 5 (2019) 37. [90] Y. Mao X. Wang S. Xia K. Zhang C. Wei S. Bak Z. Shadike X. Liu Y. Yang R. Xu P. Pianetta S. Ermon E. Stavitski K. Zhao Z. Xu F. Lin X.Q. Yang E. Hu Y. Liu Adv. Funct. Mater. 29 2019 1900247 Y. Mao, X. Wang, S. Xia, K. Zhang, C. Wei, S. Bak, Z. Shadike, X. Liu, Y. Yang, R. Xu, P. Pianetta, S. Ermon, E. Stavitski, K. Zhao, Z. Xu, F. Lin, X.Q. Yang, E. Hu, Y. Liu, Adv. Funct. Mater. 29 (2019) 1900247. [91] M.A. Shandiz R. Gauvin Comput. Mater. Sci. 117 2016 270 278 M.A. Shandiz, R. Gauvin, Comput. Mater. Sci. 117 (2016) 270-278. [92] B. Meyer B. Sawatlon S. Heinen O.A. von Lilienfeld C. Corminboeuf Chem. Sci. 9 2018 7069 7077 B. Meyer, B. Sawatlon, S. Heinen, O.A. von Lilienfeld, C. Corminboeuf, Chem. Sci. 9 (2018) 7069-7077. [93] Y. Zhuo A. Mansouri Tehrani A.O. Oliynyk A.C. Duke J. Brgoch. Nat. Commun. 9 2018 4377 Y. Zhuo, A. Mansouri Tehrani, A.O. Oliynyk, A.C. Duke, J. Brgoch, Nat. Commun. 9 (2018) 4377. [94] S. Zhu J. Li L. Ma C. He E. Liu F. He C. Shi N. Zhao Mater. Lett. 233 2018 294 297 S. Zhu, J. Li, L. Ma, C. He, E. Liu, F. He, C. Shi, N. Zhao, Mater. Lett. 233 (2018) 294-297. [95] S.A. Tawfik O. Isayev C. Stampfl J. Shapter D.A. Winkler M.J. Ford Adv. Theory Simul. 2 2019 1800128 S.A. Tawfik, O. Isayev, C. Stampfl, J. Shapter, D.A. Winkler, M.J. Ford, Adv. Theory Simul. 2 (2019) 1800128. [96] J. Shi T.F.T. Cerqueira W. Cui F. Nogueira S. Botti M.A.L. Marques Sci. Rep. 7 2017 43179 J. Shi, T.F.T. Cerqueira, W. Cui, F. Nogueira, S. Botti, M.A.L. Marques, Sci. Rep. 7 (2017) 43179. [97] T. Tada S. Takemoto S. Matsuishi H. Hosono Inorg. Chem. 53 2014 10347 10358 T. Tada, S. Takemoto, S. Matsuishi, H. Hosono, Inorg. Chem. 53 (2014) 10347-10358. [98] C. Zhan W. Sun Y. Xie D.-E. Jiang P.R.C. Kent A.C.S. Appl Mater. Interfaces 11 2019 24885 24905 C. Zhan, W. Sun, Y. Xie, D.-e. Jiang, P.R.C. Kent, ACS Appl. Mater. Interfaces 11 (2019) 24885-24905. [99] N.C. Frey J. Wang G.I. Vega Bellido B. Anasori Y. Gogotsi V.B. Shenoy ACS Nano 13 2019 3031 3041 N.C. Frey, J. Wang, G.I. Vega Bellido, B. Anasori, Y. Gogotsi, V.B. Shenoy, ACS Nano 13 (2019) 3031-3041. [100] W. Wang M. Xu X. Xu W. Zhou Z. Shao Angew. Chem. Int. Ed. 59 2020 136 152 W. Wang, M. Xu, X. Xu, W. Zhou, Z. Shao, Angew. Chem. Int. Ed. 59 (2020) 136-152. [101] Y.F. Tian Y. Liu W.J. Wang L.C. Jia J. Pu B. Chi J. Li J. Energy Chem. 43 2020 108 115 Y.F. Tian, Y. Liu, W.J. Wang, L.C. Jia, J. Pu, B. Chi, J. Li, J. Energy Chem. 43 (2020) 108-115. [102] F.C. Buciuman E. Joubert J.C. Menezo J. Barbier Appl. Catal. B 35 2001 149 156 F.C. Buciuman, E. Joubert, J.C. Menezo, J. Barbier, Appl. Catal. B 35 (2001) 149-156. [103] L.B. Li S.S. Zhang Z.C. Yang E.E.S. Berthold W. Chen J. Energy Chem. 27 2018 673 689 L.B. Li, S.S. Zhang, Z.C. Yang, E.E.S. Berthold, W. Chen, J. Energy Chem. 27 (2018) 673-689. [104] S.Q. Hu L.X. Zhang H.Y. Liu W.P. Li Z.W. Cao L.L. Cai Y. Zhu X.F. Zhu W.S. Yang J. Energy Chem. 36 2019 87 94 S.Q. Hu, L.X. Zhang, H.Y. Liu, W.P. Li, Z.W. Cao, L.L. Cai, Y. Zhu, X.F. Zhu, W.S. Yang, J. Energy Chem. 36 (2019) 87-94. [105] J. Hwang R.R. Rao L. Giordano Y. Katayama Y. Yu Y. Shao-Horn Science 358 2017 751 756 J. Hwang, R.R. Rao, L. Giordano, Y. Katayama, Y. Yu, Y. Shao-Horn, Science 358 (2017) 751-756. [106] N. Artrith J. Behler Phys. Rev. B 85 2012 045439 N. Artrith, J. Behler, Phys. Rev. B 85 (2012) 045439. [107] G. Pilania A. Mannodi-Kanakkithodi B.P. Uberuaga R. Ramprasad J.E. Gubernatis T. Lookman Sci. Rep. 6 2016 19375 G. Pilania, A. Mannodi-Kanakkithodi, B.P. Uberuaga, R. Ramprasad, J.E. Gubernatis, T. Lookman, Sci. Rep. 6 (2016) 19375. [108] J. Liang X. Zhu J. Phys. Chem. Lett. 10 2019 5640 5646 J. Liang, X. Zhu, J. Phys. Chem. Lett. 10 (2019) 5640-5646. [109] J.S. Smith O. Isayev A.E. Roitberg Chem. Sci. 8 2017 3192 3203 J.S. Smith, O. Isayev, A.E. Roitberg, Chem. Sci. 8 (2017) 3192-3203. [110] B. Kolb X. Luo X. Zhou B. Jiang H. Guo J. Phys. Chem. Lett. 8 2017 666 672 B. Kolb, X. Luo, X. Zhou, B. Jiang, H. Guo, J. Phys. Chem. Lett. 8 (2017) 666-672. [111] J.C. Snyder M. Rupp K. Hansen K.-R. Müller K. Burke Phys. Rev. Lett. 108 2012 253002 J.C. Snyder, M. Rupp, K. Hansen, K.-R. Müller, K. Burke, Phys. Rev. Lett. 108 (2012) 253002. [112] A. Ziletti D. Kumar M. Scheffler L.M. Ghiringhelli Nat. Commun. 9 2018 2775 A. Ziletti, D. Kumar, M. Scheffler, L.M. Ghiringhelli, Nat. Commun. 9 (2018) 2775. [113] Y. Zhuo S. Hariyani E. Armijo Z. Abolade Lawson J. Brgoch ACS Appl. Mater. Interfaces 12 2019 5244 5250 Y. Zhuo, S. Hariyani, E. Armijo, Z. Abolade Lawson, J. Brgoch, ACS Appl. Mater. Interfaces 12 (2019) 5244-5250. [114] V.L. Barai S.J. Dhoble J. Lumin. 208 2019 437 442 V.L. Barai, S.J. Dhoble, J. Lumin. 208 (2019) 437-442. [115] L. Li L. Wondraczek M. Peng Z. Ma B. Zou Nano Energy 69 2020 104413 L. Li, L. Wondraczek, M. Peng, Z. Ma, B. Zou, Nano Energy 69 (2020) 104413. [116] J.M. Ball A. Petrozza Nat. Energy 1 2016 16149 J.M. Ball, A. Petrozza, Nat. Energy 1 (2016) 16149. [117] D. LiU D. Chen H. Liu J. Yang Acta Phys.-Chim. Sin. 2019 1906069 D. LiU, D. Chen, H. Liu, J. Yang, Acta Phys.-Chim. Sin. (2019) 1906069. [118] H. Salmenjoki M.J. Alava L. Laurson Nat. Commun. 9 2018 5307 H. Salmenjoki, M.J. Alava, L. Laurson, Nat. Commun. 9 (2018) 5307. [119] L. Huber R. Hadian B. Grabowski J. Neugebauer NPJ Comput. Mater. 4 2018 64 L. Huber, R. Hadian, B. Grabowski, J. Neugebauer, NPJ Comput. Mater. 4 (2018) 64. [120] G. Da Rosa P. Maugis A. Portavoce J. Drillet N. Valle E. Lentzen K. Hoummada Acta Mater. 182 2020 226 234 G. Da Rosa, P. Maugis, A. Portavoce, J. Drillet, N. Valle, E. Lentzen, K. Hoummada, Acta Mater. 182 (2020) 226-234. [121] B. Scherrer T. Li A. Tsyganok M. Döbeli B. Gupta K.D. Malviya O. Kasian N. Maman B. Gault D.A. Grave A. Mehlman I. Visoly-Fisher D. Raabe A. Rothschild Chem. Mater. 32 2019 1031 1040 B. Scherrer, T. Li, A. Tsyganok, M. Döbeli, B. Gupta, K.D. Malviya, O. Kasian, N. Maman, B. Gault, D.A. Grave, A. Mehlman, I. Visoly-Fisher, D. Raabe, A. Rothschild, Chem. Mater. 32 (2019) 1031-1040. [122] H. Li Z. Zhang Z.-Z. Zhao Processes 7 2019 151 H. Li, Z. Zhang, Z.-Z. Zhao, Processes 7 (2019) 151. [123] H. Li Z. Zhang J. CO2 Util. 26 2018 496 502 H. Li, Z. Zhang, J. CO2 Util. 26 (2018) 496-502. [124] X. Ma Z. Li L.E. Achenie H. Xin J. Phys. Chem. Lett. 6 2015 3528 3533 X. Ma, Z. Li, L.E. Achenie, H. Xin, J Phys Chem. Lett. 6 (2015) 3528-3533. [125] Z. Li S. Wang W.S. Chin L.E. Achenie H. Xin J. Mater. Chem. A 5 2017 24131 24138 Z. Li, S. Wang, W.S. Chin, L.E. Achenie, H. Xin, J. Mater. Chem. A 5 (2017) 24131-24138. [126] S. Kattel P.J. Ramírez J.G. Chen J.A. Rodriguez P. Liu Science 355 2017 1296 1299 S. Kattel, P.J. Ramírez, J.G. Chen, J.A. Rodriguez, P. Liu, Science 355 (2017) 1296-1299. [127] W. Niu Z. Li K. Marcus L. Zhou Y. Li R. Ye K. Liang Y. Yang Adv. Energy Mater. 8 2018 1701642 W. Niu, Z. Li, K. Marcus, L. Zhou, Y. Li, R. Ye, K. Liang, Y. Yang, Adv. Energy Mater. 8 (2018) 1701642. [128] Y. Feng H. Liu J. Yang Sci. Adv. 3 2017 e1700580 Y. Feng, H. Liu, J. Yang, Sci. Adv. 3 (2017) e1700580. [129] X. Wang R. Xiao H. Li L. Chen J. Materiomics 3 2017 178 183 X. Wang, R. Xiao, H. Li, L. Chen, J. Materiomics 3 (2017) 178-183. [130] K.A. Severson P.M. Attia N. Jin N. Perkins B. Jiang Z. Yang M.H. Chen M. Aykol P.K. Herring D. Fraggedakis M.Z. Bazant S.J. Harris W.C. Chueh R.D. Braatz Nat. Energy 4 2019 383 391 K.A. Severson, P.M. Attia, N. Jin, N. Perkins, B. Jiang, Z. Yang, M.H. Chen, M. Aykol, P.K. Herring, D. Fraggedakis, M.Z. Bazant, S.J. Harris, W.C. Chueh, R.D. Braatz, Nat. Energy 4 (2019) 383-391. [131] Y. Kang Q. Xue P. Jin J. Jiang J. Zeng Y. Chen ACS Sustainable Chem. Eng. 5 2017 10156 10162 Y. Kang, Q. Xue, P. Jin, J. Jiang, J. Zeng, Y. Chen, ACS Sustainable Chem. Eng. 5 (2017) 10156-10162. [132] M. Luo Z. Zhao Y. Zhang Y. Sun Y. Xing F. Lv Y. Yang X. Zhang S. Hwang Y. Qin J.-Y. Ma F. Lin D. Su G. Lu S. Guo Nature 574 2019 81 85 M. Luo, Z. Zhao, Y. Zhang, Y. Sun, Y. Xing, F. Lv, Y. Yang, X. Zhang, S. Hwang, Y. Qin, J.-Y. Ma, F. Lin, D. Su, G. Lu, S. Guo, Nature 574 (2019) 81-85. [133] H. Duan N. Yan R. Yu C.-R. Chang G. Zhou H.-S. Hu H. Rong Z. Niu J. Mao H. Asakura Nat. Commun. 5 2014 1 8 H. Duan, N. Yan, R. Yu, C.-R. Chang, G. Zhou, H.-S. Hu, H. Rong, Z. Niu, J. Mao, H. Asakura, Nat. Commun. 5 (2014) 1-8. [134] K. Choudhary I. Kalish R. Beams F. Tavazza Sci. Rep. 7 2017 5179 K. Choudhary, I. Kalish, R. Beams, F. Tavazza, Sci. Rep. 7 (2017) 5179. [135] Y. Li Y. Kong J. Peng C. Yu Z. Li P. Li Y. Liu C.-F. Gao R. Wu J. Materiomics 5 2019 413 421 Y. Li, Y. Kong, J. Peng, C. Yu, Z. Li, P. Li, Y. Liu, C.-F. Gao, R. Wu, J. Materiomics 5 (2019) 413-421. [136] X. Guo H. Gao G. Wang Chem 6 2020 334 336 X. Guo, H. Gao, G. Wang, Chem 6 (2020) 334-336. [137] E. Kim K. Huang S. Jegelka E. Olivetti N.P.J. Comput Mater. 3 2017 53 E. Kim, K. Huang, S. Jegelka, E. Olivetti, NPJ Comput. Mater. 3 (2017) 53. [138] N. Jia Q. Weng Y. Shi X. Shi X. Chen P. Chen Z. An Y. Chen Nano Res. 11 2018 1905 1916 N. Jia, Q. Weng, Y. Shi, X. Shi, X. Chen, P. Chen, Z. An, Y. Chen, Nano Res. 11 (2018) 1905-1916. [139] J. Zhang W. Wang R. Shi W. Wang S. Wang F. Kang B. Li Carbon 155 2019 50 55 J. Zhang, W. Wang, R. Shi, W. Wang, S. Wang, F. Kang, B. Li, Carbon 155 (2019) 50-55. [140] M. Fernandez H. Shi A.S. Barnard J. Chem. Inf. Model. 55 2015 2500 2506 M. Fernandez, H. Shi, A.S. Barnard, J. Chem. Inf. Model. 55 (2015) 2500-2506. [141] M. Fernandez J.I. Abreu H. Shi A.S. Barnard A.C.S. Comb Sci. 18 2016 661 664 M. Fernandez, J.I. Abreu, H. Shi, A.S. Barnard, ACS Comb. Sci. 18 (2016) 661-664. [142] T. Gates G. Odegard S. Frankland T. Clancy Compos. Sci. Technol. 65 2005 2416 2434 T. Gates, G. Odegard, S. Frankland, T. Clancy, Compos. Sci. Technol. 65 (2005) 2416-2434. [143] L. Li J.C. Snyder I.M. Pelaschier J. Huang U.-N. Niranjan P. Duncan M. Rupp K.-R. Müller K. Burke Int. J. Quantum Chem. 116 2016 819 833 L. Li, J.C. Snyder, I.M. Pelaschier, J. Huang, U.-N. Niranjan, P. Duncan, M. Rupp, K.-R. Müller, K. Burke, Int. J. Quantum Chem. 116 (2016) 819-833. [144] B. Liu J. Yang H. Yang C. Ye Y. Mao J. Wang S. Shi J. Yang W. Zhang J. Mater. Chem. A 7 2019 19961 19969 B. Liu, J. Yang, H. Yang, C. Ye, Y. Mao, J. Wang, S. Shi, J. Yang, W. Zhang, J. Mater. Chem. A 7 (2019) 19961-19969. [145] B.C. Steimle J.L. Fenton R.E. Schaak Science 367 2020 418 424 B.C. Steimle, J.L. Fenton, R.E. Schaak, Science 367 (2020) 418-424. [146] E. Reddington A. Sapienza B. Gurau R. Viswanathan S. Sarangapani E.S. Smotkin T.E. Mallouk Science 280 1998 1735 1737 E. Reddington, A. Sapienza, B. Gurau, R. Viswanathan, S. Sarangapani, E.S. Smotkin, T.E. Mallouk, Science 280 (1998) 1735-1737. [147] P.-C. Chen X. Liu J.L. Hedrick Z. Xie S. Wang Q.-Y. Lin M.C. Hersam V.P. Dravid C.A. Mirkin Science 352 2016 1565 1569 P.-C. Chen, X. Liu, J.L. Hedrick, Z. Xie, S. Wang, Q.-Y. Lin, M.C. Hersam, V.P. Dravid, C.A. Mirkin, Science 352 (2016) 1565-1569. [148] S.M. Walker D.A. Schwyn R. Mokso M. Wicklein T. Müller M. Doube M. Stampanoni H.G. Krapp G.K. Taylor PLoS Biol. 12 2014 e1001823 S.M. Walker, D.A. Schwyn, R. Mokso, M. Wicklein, T. Müller, M. Doube, M. Stampanoni, H.G. Krapp, G.K. Taylor, PLoS Biol. 12 (2014) e1001823. [149] K. Zhang F. Ren X. Wang E. Hu Y. Xu X.-Q. Yang H. Li L. Chen P. Pianetta A. Mehta Nano Lett. 17 2017 7782 7788 K. Zhang, F. Ren, X. Wang, E. Hu, Y. Xu, X.-Q. Yang, H. Li, L. Chen, P. Pianetta, A. Mehta, Nano Lett. 17 (2017) 7782-7788. [150] S. Zeng G. Li Y. Zhao R. Wang J. Ni J. Phys. Chem. C 123 2019 5042 5047 S. Zeng, G. Li, Y. Zhao, R. Wang, J. Ni, J. Phys. Chem. C 123 (2019) 5042-5047. [151] I. Kotenko I. Saenko A. Branitskiy Mater. Today:. Proc. 11 2019 380 385 I. Kotenko, I. Saenko, A. Branitskiy, Materials Today: Proceedings 11 (2019) 380-385. [152] N. Cao Z. Chen K. Zang J. Xu J. Zhong J. Luo X. Xu G. Zheng Nat. Commun. 10 2019 2877 N. Cao, Z. Chen, K. Zang, J. Xu, J. Zhong, J. Luo, X. Xu, G. Zheng, Nat. Commun. 10 (2019) 2877. [153] S. Ye C. Ding M. Liu A. Wang Q. Huang C. Li Adv. Mater. 31 2019 1902069 S. Ye, C. Ding, M. Liu, A. Wang, Q. Huang, C. Li, Adv. Mater. 31 (2019) 1902069. [154] W. Wang Q. Yang K. Qian B. Li J. Energy Chem. 47 2020 72 78 W. Wang, Q. Yang, K. Qian, B. Li, J. Energy Chem. 47 (2020) 72-78. [155] M. Yuan K. Liu J. Energy Chem. 43 2020 58 70 M. Yuan, K. Liu, J. Energy Chem. 43 (2020) 58-70. [156] H. Li Z. Tang Z. Liu C. Zhi Joule 3 2019 613 619 H. Li, Z. Tang, Z. Liu, C. Zhi, Joule 3 (2019) 613-619. Yongqiang Kang received his M. S. degree from Shaanxi Normal University in 2018, where he worked on the synthesis of nanomaterials. He is pursuing his Ph.D. degree in materials science and engineering at Tsinghua University. His current research interests include the design and synthesis of nanostructured materials for electrocatalysis and energy applications. Lejing Li received her M. S. degree from South China University of Technology in 2018. She is working towards a Ph.D. degree in chemistry at The Chinese University of Hong Kong. Her research focuses on the development of new methods for nanomaterials and their utilization for energy-related applications. Baohua Li received his Ph.D. degree from the Institute of Coal Chemistry (ICC), Chinese Academy of Science (CAS) in 2002. He is currently a full professor and director of the Division of Energy and Environment of the Tsinghua Shenzhen International Graduate School, Tsinghua University. His research interest includes energy materials in the fields of new carbon materials, lithium-ion batteries, lithium-sulfur batteries, lithium-air batteries, supercapacitors, and fuel cells.",
      "scopus-id": "85086749207",
      "coredata": {
        "eid": "1-s2.0-S2095495620303806",
        "dc:description": "In nature, the properties of matter are ultimately governed by the electronic structures. Quantum chemistry (QC) at electronic level matches well with a few simple physical assumptions in solving simple problems. To date, machine learning (ML) algorithm has been migrated to this field to simplify calculations and improve fidelity. This review introduces the basic information on universal electron structures of emerging energy materials and ML algorithms involved in the prediction of material properties. Then, the structure-property relationships based on ML algorithm and QC theory are reviewed. Especially, the summary of recently reported applications on classifying crystal structure, modeling electronic structure, optimizing experimental method, and predicting performance is provided. Last, an outlook on ML assisted QC calculation towards identifying emerging energy materials is also presented.",
        "openArchiveArticle": "false",
        "prism:coverDate": "2021-03-31",
        "openaccessUserLicense": null,
        "prism:aggregationType": "Journal",
        "prism:url": "https://api.elsevier.com/content/article/pii/S2095495620303806",
        "dc:creator": [
          {
            "@_fa": "true",
            "$": "Kang, Yongqiang"
          },
          {
            "@_fa": "true",
            "$": "Li, Lejing"
          },
          {
            "@_fa": "true",
            "$": "Li, Baohua"
          }
        ],
        "link": [
          {
            "@_fa": "true",
            "@rel": "self",
            "@href": "https://api.elsevier.com/content/article/pii/S2095495620303806"
          },
          {
            "@_fa": "true",
            "@rel": "scidir",
            "@href": "https://www.sciencedirect.com/science/article/pii/S2095495620303806"
          }
        ],
        "dc:format": "application/json",
        "openaccessType": null,
        "pii": "S2095-4956(20)30380-6",
        "prism:volume": "54",
        "prism:publisher": "Science Press and Dalian Institute of Chemical Physics, Chinese Academy of Sciences. Published by ELSEVIER B.V. and Science Press.",
        "dc:title": "Recent progress on discovery and properties prediction of energy materials: Simple machine learning meets complex quantum chemistry",
        "prism:copyright": "© 2020 Science Press and Dalian Institute of Chemical Physics, Chinese Academy of Sciences. Published by ELSEVIER B.V. and Science Press. All rights reserved.",
        "openaccess": "0",
        "prism:issn": "20954956",
        "dcterms:subject": [
          {
            "@_fa": "true",
            "$": "Energy materials"
          },
          {
            "@_fa": "true",
            "$": "Quantum chemistry"
          },
          {
            "@_fa": "true",
            "$": "Machine learning"
          },
          {
            "@_fa": "true",
            "$": "Structure-property relationship"
          }
        ],
        "openaccessArticle": "false",
        "prism:publicationName": "Journal of Energy Chemistry",
        "openaccessSponsorType": null,
        "prism:pageRange": "72-88",
        "prism:endingPage": "88",
        "pubType": "rev",
        "prism:coverDisplayDate": "March 2021",
        "prism:doi": "10.1016/j.jechem.2020.05.044",
        "prism:startingPage": "72",
        "dc:identifier": "doi:10.1016/j.jechem.2020.05.044",
        "openaccessSponsorName": null
      },
      "objects": {
        "object": [
          {
            "@category": "standard",
            "@height": "429",
            "@width": "774",
            "@_fa": "true",
            "$": "https://api.elsevier.com/content/object/eid/1-s2.0-S2095495620303806-gr10.jpg?httpAccept=%2A%2F%2A",
            "@multimediatype": "JPEG image file",
            "@type": "IMAGE-DOWNSAMPLED",
            "@size": "84537",
            "@ref": "gr10",
            "@mimetype": "image/jpeg"
          },
          {
            "@category": "standard",
            "@height": "584",
            "@width": "669",
            "@_fa": "true",
            "$": "https://api.elsevier.com/content/object/eid/1-s2.0-S2095495620303806-gr11.jpg?httpAccept=%2A%2F%2A",
            "@multimediatype": "JPEG image file",
            "@type": "IMAGE-DOWNSAMPLED",
            "@size": "90058",
            "@ref": "gr11",
            "@mimetype": "image/jpeg"
          },
          {
            "@category": "standard",
            "@height": "561",
            "@width": "778",
            "@_fa": "true",
            "$": "https://api.elsevier.com/content/object/eid/1-s2.0-S2095495620303806-gr12.jpg?httpAccept=%2A%2F%2A",
            "@multimediatype": "JPEG image file",
            "@type": "IMAGE-DOWNSAMPLED",
            "@size": "151912",
            "@ref": "gr12",
            "@mimetype": "image/jpeg"
          },
          {
            "@category": "standard",
            "@height": "516",
            "@width": "538",
            "@_fa": "true",
            "$": "https://api.elsevier.com/content/object/eid/1-s2.0-S2095495620303806-gr2.jpg?httpAccept=%2A%2F%2A",
            "@multimediatype": "JPEG image file",
            "@type": "IMAGE-DOWNSAMPLED",
            "@size": "54854",
            "@ref": "gr2",
            "@mimetype": "image/jpeg"
          },
          {
            "@category": "standard",
            "@height": "663",
            "@width": "495",
            "@_fa": "true",
            "$": "https://api.elsevier.com/content/object/eid/1-s2.0-S2095495620303806-gr3.jpg?httpAccept=%2A%2F%2A",
            "@multimediatype": "JPEG image file",
            "@type": "IMAGE-DOWNSAMPLED",
            "@size": "84980",
            "@ref": "gr3",
            "@mimetype": "image/jpeg"
          },
          {
            "@category": "standard",
            "@height": "999",
            "@width": "774",
            "@_fa": "true",
            "$": "https://api.elsevier.com/content/object/eid/1-s2.0-S2095495620303806-gr4.jpg?httpAccept=%2A%2F%2A",
            "@multimediatype": "JPEG image file",
            "@type": "IMAGE-DOWNSAMPLED",
            "@size": "247105",
            "@ref": "gr4",
            "@mimetype": "image/jpeg"
          },
          {
            "@category": "standard",
            "@height": "1004",
            "@width": "774",
            "@_fa": "true",
            "$": "https://api.elsevier.com/content/object/eid/1-s2.0-S2095495620303806-gr5.jpg?httpAccept=%2A%2F%2A",
            "@multimediatype": "JPEG image file",
            "@type": "IMAGE-DOWNSAMPLED",
            "@size": "229780",
            "@ref": "gr5",
            "@mimetype": "image/jpeg"
          },
          {
            "@category": "standard",
            "@height": "410",
            "@width": "714",
            "@_fa": "true",
            "$": "https://api.elsevier.com/content/object/eid/1-s2.0-S2095495620303806-gr6.jpg?httpAccept=%2A%2F%2A",
            "@multimediatype": "JPEG image file",
            "@type": "IMAGE-DOWNSAMPLED",
            "@size": "106841",
            "@ref": "gr6",
            "@mimetype": "image/jpeg"
          },
          {
            "@category": "standard",
            "@height": "719",
            "@width": "778",
            "@_fa": "true",
            "$": "https://api.elsevier.com/content/object/eid/1-s2.0-S2095495620303806-gr7.jpg?httpAccept=%2A%2F%2A",
            "@multimediatype": "JPEG image file",
            "@type": "IMAGE-DOWNSAMPLED",
            "@size": "169235",
            "@ref": "gr7",
            "@mimetype": "image/jpeg"
          },
          {
            "@category": "standard",
            "@height": "380",
            "@width": "778",
            "@_fa": "true",
            "$": "https://api.elsevier.com/content/object/eid/1-s2.0-S2095495620303806-gr8.jpg?httpAccept=%2A%2F%2A",
            "@multimediatype": "JPEG image file",
            "@type": "IMAGE-DOWNSAMPLED",
            "@size": "146359",
            "@ref": "gr8",
            "@mimetype": "image/jpeg"
          },
          {
            "@category": "standard",
            "@height": "545",
            "@width": "580",
            "@_fa": "true",
            "$": "https://api.elsevier.com/content/object/eid/1-s2.0-S2095495620303806-gr9.jpg?httpAccept=%2A%2F%2A",
            "@multimediatype": "JPEG image file",
            "@type": "IMAGE-DOWNSAMPLED",
            "@size": "74647",
            "@ref": "gr9",
            "@mimetype": "image/jpeg"
          },
          {
            "@category": "standard",
            "@height": "200",
            "@width": "398",
            "@_fa": "true",
            "$": "https://api.elsevier.com/content/object/eid/1-s2.0-S2095495620303806-ga1.jpg?httpAccept=%2A%2F%2A",
            "@multimediatype": "JPEG image file",
            "@type": "IMAGE-DOWNSAMPLED",
            "@size": "32503",
            "@ref": "ga1",
            "@mimetype": "image/jpeg"
          },
          {
            "@category": "standard",
            "@height": "155",
            "@width": "111",
            "@_fa": "true",
            "$": "https://api.elsevier.com/content/object/eid/1-s2.0-S2095495620303806-fx1.jpg?httpAccept=%2A%2F%2A",
            "@multimediatype": "JPEG image file",
            "@type": "IMAGE-DOWNSAMPLED",
            "@size": "7068",
            "@ref": "fx1",
            "@mimetype": "image/jpeg"
          },
          {
            "@category": "standard",
            "@height": "155",
            "@width": "111",
            "@_fa": "true",
            "$": "https://api.elsevier.com/content/object/eid/1-s2.0-S2095495620303806-fx2.jpg?httpAccept=%2A%2F%2A",
            "@multimediatype": "JPEG image file",
            "@type": "IMAGE-DOWNSAMPLED",
            "@size": "5536",
            "@ref": "fx2",
            "@mimetype": "image/jpeg"
          },
          {
            "@category": "standard",
            "@height": "155",
            "@width": "111",
            "@_fa": "true",
            "$": "https://api.elsevier.com/content/object/eid/1-s2.0-S2095495620303806-fx3.jpg?httpAccept=%2A%2F%2A",
            "@multimediatype": "JPEG image file",
            "@type": "IMAGE-DOWNSAMPLED",
            "@size": "5360",
            "@ref": "fx3",
            "@mimetype": "image/jpeg"
          },
          {
            "@category": "standard",
            "@height": "606",
            "@width": "776",
            "@_fa": "true",
            "$": "https://api.elsevier.com/content/object/eid/1-s2.0-S2095495620303806-gr1.jpg?httpAccept=%2A%2F%2A",
            "@multimediatype": "JPEG image file",
            "@type": "IMAGE-DOWNSAMPLED",
            "@size": "101749",
            "@ref": "gr1",
            "@mimetype": "image/jpeg"
          },
          {
            "@category": "thumbnail",
            "@height": "121",
            "@width": "219",
            "@_fa": "true",
            "$": "https://api.elsevier.com/content/object/eid/1-s2.0-S2095495620303806-gr10.sml?httpAccept=%2A%2F%2A",
            "@multimediatype": "GIF image file",
            "@type": "IMAGE-THUMBNAIL",
            "@size": "13496",
            "@ref": "gr10",
            "@mimetype": "image/gif"
          },
          {
            "@category": "thumbnail",
            "@height": "164",
            "@width": "188",
            "@_fa": "true",
            "$": "https://api.elsevier.com/content/object/eid/1-s2.0-S2095495620303806-gr11.sml?httpAccept=%2A%2F%2A",
            "@multimediatype": "GIF image file",
            "@type": "IMAGE-THUMBNAIL",
            "@size": "11724",
            "@ref": "gr11",
            "@mimetype": "image/gif"
          },
          {
            "@category": "thumbnail",
            "@height": "158",
            "@width": "219",
            "@_fa": "true",
            "$": "https://api.elsevier.com/content/object/eid/1-s2.0-S2095495620303806-gr12.sml?httpAccept=%2A%2F%2A",
            "@multimediatype": "GIF image file",
            "@type": "IMAGE-THUMBNAIL",
            "@size": "16944",
            "@ref": "gr12",
            "@mimetype": "image/gif"
          },
          {
            "@category": "thumbnail",
            "@height": "164",
            "@width": "171",
            "@_fa": "true",
            "$": "https://api.elsevier.com/content/object/eid/1-s2.0-S2095495620303806-gr2.sml?httpAccept=%2A%2F%2A",
            "@multimediatype": "GIF image file",
            "@type": "IMAGE-THUMBNAIL",
            "@size": "11151",
            "@ref": "gr2",
            "@mimetype": "image/gif"
          },
          {
            "@category": "thumbnail",
            "@height": "163",
            "@width": "122",
            "@_fa": "true",
            "$": "https://api.elsevier.com/content/object/eid/1-s2.0-S2095495620303806-gr3.sml?httpAccept=%2A%2F%2A",
            "@multimediatype": "GIF image file",
            "@type": "IMAGE-THUMBNAIL",
            "@size": "9175",
            "@ref": "gr3",
            "@mimetype": "image/gif"
          },
          {
            "@category": "thumbnail",
            "@height": "164",
            "@width": "127",
            "@_fa": "true",
            "$": "https://api.elsevier.com/content/object/eid/1-s2.0-S2095495620303806-gr4.sml?httpAccept=%2A%2F%2A",
            "@multimediatype": "GIF image file",
            "@type": "IMAGE-THUMBNAIL",
            "@size": "12828",
            "@ref": "gr4",
            "@mimetype": "image/gif"
          },
          {
            "@category": "thumbnail",
            "@height": "164",
            "@width": "126",
            "@_fa": "true",
            "$": "https://api.elsevier.com/content/object/eid/1-s2.0-S2095495620303806-gr5.sml?httpAccept=%2A%2F%2A",
            "@multimediatype": "GIF image file",
            "@type": "IMAGE-THUMBNAIL",
            "@size": "12229",
            "@ref": "gr5",
            "@mimetype": "image/gif"
          },
          {
            "@category": "thumbnail",
            "@height": "126",
            "@width": "219",
            "@_fa": "true",
            "$": "https://api.elsevier.com/content/object/eid/1-s2.0-S2095495620303806-gr6.sml?httpAccept=%2A%2F%2A",
            "@multimediatype": "GIF image file",
            "@type": "IMAGE-THUMBNAIL",
            "@size": "15579",
            "@ref": "gr6",
            "@mimetype": "image/gif"
          },
          {
            "@category": "thumbnail",
            "@height": "164",
            "@width": "177",
            "@_fa": "true",
            "$": "https://api.elsevier.com/content/object/eid/1-s2.0-S2095495620303806-gr7.sml?httpAccept=%2A%2F%2A",
            "@multimediatype": "GIF image file",
            "@type": "IMAGE-THUMBNAIL",
            "@size": "13559",
            "@ref": "gr7",
            "@mimetype": "image/gif"
          },
          {
            "@category": "thumbnail",
            "@height": "107",
            "@width": "219",
            "@_fa": "true",
            "$": "https://api.elsevier.com/content/object/eid/1-s2.0-S2095495620303806-gr8.sml?httpAccept=%2A%2F%2A",
            "@multimediatype": "GIF image file",
            "@type": "IMAGE-THUMBNAIL",
            "@size": "18803",
            "@ref": "gr8",
            "@mimetype": "image/gif"
          },
          {
            "@category": "thumbnail",
            "@height": "163",
            "@width": "174",
            "@_fa": "true",
            "$": "https://api.elsevier.com/content/object/eid/1-s2.0-S2095495620303806-gr9.sml?httpAccept=%2A%2F%2A",
            "@multimediatype": "GIF image file",
            "@type": "IMAGE-THUMBNAIL",
            "@size": "8597",
            "@ref": "gr9",
            "@mimetype": "image/gif"
          },
          {
            "@category": "thumbnail",
            "@height": "110",
            "@width": "219",
            "@_fa": "true",
            "$": "https://api.elsevier.com/content/object/eid/1-s2.0-S2095495620303806-ga1.sml?httpAccept=%2A%2F%2A",
            "@multimediatype": "GIF image file",
            "@type": "IMAGE-THUMBNAIL",
            "@size": "11934",
            "@ref": "ga1",
            "@mimetype": "image/gif"
          },
          {
            "@category": "thumbnail",
            "@height": "164",
            "@width": "117",
            "@_fa": "true",
            "$": "https://api.elsevier.com/content/object/eid/1-s2.0-S2095495620303806-fx1.sml?httpAccept=%2A%2F%2A",
            "@multimediatype": "GIF image file",
            "@type": "IMAGE-THUMBNAIL",
            "@size": "14593",
            "@ref": "fx1",
            "@mimetype": "image/gif"
          },
          {
            "@category": "thumbnail",
            "@height": "164",
            "@width": "117",
            "@_fa": "true",
            "$": "https://api.elsevier.com/content/object/eid/1-s2.0-S2095495620303806-fx2.sml?httpAccept=%2A%2F%2A",
            "@multimediatype": "GIF image file",
            "@type": "IMAGE-THUMBNAIL",
            "@size": "12095",
            "@ref": "fx2",
            "@mimetype": "image/gif"
          },
          {
            "@category": "thumbnail",
            "@height": "164",
            "@width": "117",
            "@_fa": "true",
            "$": "https://api.elsevier.com/content/object/eid/1-s2.0-S2095495620303806-fx3.sml?httpAccept=%2A%2F%2A",
            "@multimediatype": "GIF image file",
            "@type": "IMAGE-THUMBNAIL",
            "@size": "13490",
            "@ref": "fx3",
            "@mimetype": "image/gif"
          },
          {
            "@category": "thumbnail",
            "@height": "164",
            "@width": "210",
            "@_fa": "true",
            "$": "https://api.elsevier.com/content/object/eid/1-s2.0-S2095495620303806-gr1.sml?httpAccept=%2A%2F%2A",
            "@multimediatype": "GIF image file",
            "@type": "IMAGE-THUMBNAIL",
            "@size": "11480",
            "@ref": "gr1",
            "@mimetype": "image/gif"
          },
          {
            "@category": "high",
            "@height": "1138",
            "@width": "2055",
            "@_fa": "true",
            "$": "https://api.elsevier.com/content/object/eid/1-s2.0-S2095495620303806-gr10_lrg.jpg?httpAccept=%2A%2F%2A",
            "@multimediatype": "JPEG image file",
            "@type": "IMAGE-HIGH-RES",
            "@size": "259963",
            "@ref": "gr10",
            "@mimetype": "image/jpeg"
          },
          {
            "@category": "high",
            "@height": "1550",
            "@width": "1777",
            "@_fa": "true",
            "$": "https://api.elsevier.com/content/object/eid/1-s2.0-S2095495620303806-gr11_lrg.jpg?httpAccept=%2A%2F%2A",
            "@multimediatype": "JPEG image file",
            "@type": "IMAGE-HIGH-RES",
            "@size": "269549",
            "@ref": "gr11",
            "@mimetype": "image/jpeg"
          },
          {
            "@category": "high",
            "@height": "2486",
            "@width": "3445",
            "@_fa": "true",
            "$": "https://api.elsevier.com/content/object/eid/1-s2.0-S2095495620303806-gr12_lrg.jpg?httpAccept=%2A%2F%2A",
            "@multimediatype": "JPEG image file",
            "@type": "IMAGE-HIGH-RES",
            "@size": "905712",
            "@ref": "gr12",
            "@mimetype": "image/jpeg"
          },
          {
            "@category": "high",
            "@height": "1921",
            "@width": "2002",
            "@_fa": "true",
            "$": "https://api.elsevier.com/content/object/eid/1-s2.0-S2095495620303806-gr2_lrg.jpg?httpAccept=%2A%2F%2A",
            "@multimediatype": "JPEG image file",
            "@type": "IMAGE-HIGH-RES",
            "@size": "256770",
            "@ref": "gr2",
            "@mimetype": "image/jpeg"
          },
          {
            "@category": "high",
            "@height": "2937",
            "@width": "2193",
            "@_fa": "true",
            "$": "https://api.elsevier.com/content/object/eid/1-s2.0-S2095495620303806-gr3_lrg.jpg?httpAccept=%2A%2F%2A",
            "@multimediatype": "JPEG image file",
            "@type": "IMAGE-HIGH-RES",
            "@size": "525457",
            "@ref": "gr3",
            "@mimetype": "image/jpeg"
          },
          {
            "@category": "high",
            "@height": "2652",
            "@width": "2055",
            "@_fa": "true",
            "$": "https://api.elsevier.com/content/object/eid/1-s2.0-S2095495620303806-gr4_lrg.jpg?httpAccept=%2A%2F%2A",
            "@multimediatype": "JPEG image file",
            "@type": "IMAGE-HIGH-RES",
            "@size": "763635",
            "@ref": "gr4",
            "@mimetype": "image/jpeg"
          },
          {
            "@category": "high",
            "@height": "4224",
            "@width": "3255",
            "@_fa": "true",
            "$": "https://api.elsevier.com/content/object/eid/1-s2.0-S2095495620303806-gr5_lrg.jpg?httpAccept=%2A%2F%2A",
            "@multimediatype": "JPEG image file",
            "@type": "IMAGE-HIGH-RES",
            "@size": "1212113",
            "@ref": "gr5",
            "@mimetype": "image/jpeg"
          },
          {
            "@category": "high",
            "@height": "1089",
            "@width": "1896",
            "@_fa": "true",
            "$": "https://api.elsevier.com/content/object/eid/1-s2.0-S2095495620303806-gr6_lrg.jpg?httpAccept=%2A%2F%2A",
            "@multimediatype": "JPEG image file",
            "@type": "IMAGE-HIGH-RES",
            "@size": "328279",
            "@ref": "gr6",
            "@mimetype": "image/jpeg"
          },
          {
            "@category": "high",
            "@height": "1910",
            "@width": "2067",
            "@_fa": "true",
            "$": "https://api.elsevier.com/content/object/eid/1-s2.0-S2095495620303806-gr7_lrg.jpg?httpAccept=%2A%2F%2A",
            "@multimediatype": "JPEG image file",
            "@type": "IMAGE-HIGH-RES",
            "@size": "487134",
            "@ref": "gr7",
            "@mimetype": "image/jpeg"
          },
          {
            "@category": "high",
            "@height": "1681",
            "@width": "3445",
            "@_fa": "true",
            "$": "https://api.elsevier.com/content/object/eid/1-s2.0-S2095495620303806-gr8_lrg.jpg?httpAccept=%2A%2F%2A",
            "@multimediatype": "JPEG image file",
            "@type": "IMAGE-HIGH-RES",
            "@size": "911583",
            "@ref": "gr8",
            "@mimetype": "image/jpeg"
          },
          {
            "@category": "high",
            "@height": "2411",
            "@width": "2567",
            "@_fa": "true",
            "$": "https://api.elsevier.com/content/object/eid/1-s2.0-S2095495620303806-gr9_lrg.jpg?httpAccept=%2A%2F%2A",
            "@multimediatype": "JPEG image file",
            "@type": "IMAGE-HIGH-RES",
            "@size": "390083",
            "@ref": "gr9",
            "@mimetype": "image/jpeg"
          },
          {
            "@category": "high",
            "@height": "531",
            "@width": "1059",
            "@_fa": "true",
            "$": "https://api.elsevier.com/content/object/eid/1-s2.0-S2095495620303806-ga1_lrg.jpg?httpAccept=%2A%2F%2A",
            "@multimediatype": "JPEG image file",
            "@type": "IMAGE-HIGH-RES",
            "@size": "98047",
            "@ref": "ga1",
            "@mimetype": "image/jpeg"
          },
          {
            "@category": "high",
            "@height": "413",
            "@width": "295",
            "@_fa": "true",
            "$": "https://api.elsevier.com/content/object/eid/1-s2.0-S2095495620303806-fx1_lrg.jpg?httpAccept=%2A%2F%2A",
            "@multimediatype": "JPEG image file",
            "@type": "IMAGE-HIGH-RES",
            "@size": "24590",
            "@ref": "fx1",
            "@mimetype": "image/jpeg"
          },
          {
            "@category": "high",
            "@height": "413",
            "@width": "295",
            "@_fa": "true",
            "$": "https://api.elsevier.com/content/object/eid/1-s2.0-S2095495620303806-fx2_lrg.jpg?httpAccept=%2A%2F%2A",
            "@multimediatype": "JPEG image file",
            "@type": "IMAGE-HIGH-RES",
            "@size": "16466",
            "@ref": "fx2",
            "@mimetype": "image/jpeg"
          },
          {
            "@category": "high",
            "@height": "413",
            "@width": "295",
            "@_fa": "true",
            "$": "https://api.elsevier.com/content/object/eid/1-s2.0-S2095495620303806-fx3_lrg.jpg?httpAccept=%2A%2F%2A",
            "@multimediatype": "JPEG image file",
            "@type": "IMAGE-HIGH-RES",
            "@size": "15713",
            "@ref": "fx3",
            "@mimetype": "image/jpeg"
          },
          {
            "@category": "high",
            "@height": "1880",
            "@width": "2406",
            "@_fa": "true",
            "$": "https://api.elsevier.com/content/object/eid/1-s2.0-S2095495620303806-gr1_lrg.jpg?httpAccept=%2A%2F%2A",
            "@multimediatype": "JPEG image file",
            "@type": "IMAGE-HIGH-RES",
            "@size": "400408",
            "@ref": "gr1",
            "@mimetype": "image/jpeg"
          },
          {
            "@category": "standard",
            "@_fa": "true",
            "$": "https://api.elsevier.com/content/object/eid/1-s2.0-S2095495620303806-am.pdf?httpAccept=%2A%2F%2A",
            "@multimediatype": "Acrobat PDF file",
            "@type": "AAM-PDF",
            "@size": "5824976",
            "@ref": "am",
            "@mimetype": "application/pdf"
          }
        ]
      },
      "link": {
        "@rel": "abstract",
        "@href": "https://api.elsevier.com/content/abstract/scopus_id/85086749207"
      }
    }
  }
}