{
  "metadata": {
    "title": "Dual metal atom catalysts: Advantages in electrocatalytic reactions",
    "authors": "; ; ",
    "journal": "Journal of Energy Chemistry",
    "date": "2023-04-30",
    "doi": "10.1016/j.jechem.2023.01.021",
    "abstract": "",
    "uri": "https://api.elsevier.com/content/article/pii/S2095495623000335",
    "pii": "S2095495623000335"
  },
  "fulltext": {
    "full-text-retrieval-response": {
      "scopus-eid": "2-s2.0-85148016545",
      "originalText": "serial JL 286353 291210 291711 291744 291809 31 Journal of Energy Chemistry JOURNALENERGYCHEMISTRY 2023-01-24 2023-01-24 2023-02-15 2023-02-15 2023-04-20T23:59:49 1-s2.0-S2095495623000335 S2095-4956(23)00033-5 S2095495623000335 10.1016/j.jechem.2023.01.021 S300 S300.1 FULL-TEXT 1-s2.0-S2095495623X00023 2024-06-03T13:21:35.187216Z 0 0 20230401 20230430 2023 2023-01-24T17:24:01.952411Z absattachment articleinfo articletitlenorm authfirstinitialnorm authfirstsurnamenorm cid cids contenttype copyright crossmark dateloaded dateloadedtxt datesearch datesort dateupdated dco docsubtype doctype doi eid ewtransactionid hubeid indexeddate issn issnnorm itemstage itemtransactionid itemweight openaccess openarchive pg pgfirst pglast pii piinorm pubdateend pubdatestart pubdatetxt pubyr sortorder srctitle srctitlenorm srctype ssids alllist content subj subheadings suppl tomb volfirst volissue volumelist webpdf webpdfpagecount yearnav figure e-component body acknowledge affil appendices articletitle auth authfirstini authfull authkeywords authlast grantnumber grantsponsor grantsponsorid orcid primabst pubtype ref specialabst vitae 2095-4956 20954956 false 79 79 C Volume 79 52 515 534 515 534 202304 April 2023 2023-04-01 2023-04-30 2023 article rev © 2023 Science Press and Dalian Institute of Chemical Physics, Chinese Academy of Sciences. All rights reserved. DUALMETALATOMCATALYSTSADVANTAGESINELECTROCATALYTICREACTIONS LIU K 1 Introduction 2 Characterization methods 2.1 Electron microscopy 2.2 X-ray absorption spectroscopy 2.3 X-ray photoelectron spectroscopy 2.4 Mössbauer spectroscopy 2.5 Other characterization techniques 3 Synthetic strategies 3.1 High temperature pyrolysis 3.2 Wet chemistry 3.3 Electrochemical method 3.4 Atomic layer deposition 3.5 Chemical vapor deposition 4 Advantages in different reactions 4.1 HER 4.1.1 Alloying effect 4.1.2 Regulating electronic structure 4.2 OER 4.2.1 Synergy effect 4.2.2 Fundamental study platform 4.3 ORR 4.3.1 Boosting oxygen dissociation 4.3.2 Regulating electronic structure 4.3.3 Synergy effect 4.4 CO2RR 4.4.1 Facilitating CO2 adsorption/activation 4.4.2 Regulating electronic structure 4.4.3 Synergy effect 4.4.4 Breaking scaling relations 4.4.5 Promoting the CC coupling 4.4.6 Ideal machine learning platform 4.5 NRR 4.5.1 Boosting N2 activation 4.5.2 Reducing the rate-determining step barrier 5 Conclusions and perspectives Acknowledgments Appendix A Supplementary material References GUO 2019 5658 5716 W YUAN 2022 254 279 W LIU 2018 64 111 K LUNA 2019 6438 P ZHONG 2022 1759 1780 H WANG 2020 12217 12314 Y XUE 2019 14976 14980 Z WAN 2022 44 53 R HAO 2021 1371 1377 S LIU 2016 382 386 M ZHU 2020 851 918 J QIAO 2011 634 641 B ZHANG 2018 985 992 J LIN 2021 1012 1023 C XIAO 2019 9640 9645 M WANG 2018 1246 1253 X WANG 2018 1944 1948 X PAN 2018 4218 4221 Y YANG 2018 140 147 H ZHOU 2022 823 838 P QIN 1899 11810 11811 R MA 2021 170 194 W LI 2022 584 596 L ZHANG 2021 e2102576 W LI 2022 2103564 R LIU 2022 e202200498 H ZHANG 2021 1908 1922 S QIAO 2022 11702 11711 S SHEN 2022 L SONG 2022 391 422 K WANG 2022 56 72 M YU 2019 7537 7543 X HAO 2022 719 728 Q PEDERSEN 2021 2102715 A HOU 2020 1658 1693 C LI 2021 e2102212 Y YANG 2021 14530 14539 J YANG 2022 12062 12071 J GU 2019 1091 1094 J WANG 2017 17281 17284 J LI 2019 2521 2531 X LIU 2022 Y MA 2021 1966 1972 L BARRIO 2022 6023 6030 J WANG 2018 3375 3379 J LU 2019 2622 2626 Z ZHOU 2020 1404 1410 Y CHAO 2017 16047 16051 T JIAO 2019 222 228 J BAI 2019 14190 14199 L SUN 2013 1775 S ZHANG 2019 4936 L LIU 2020 21698 21705 S YANG 2020 eaba6586 Y CHEN 2022 16 25 W ZENG 2022 3822 L ZHAN 2022 203 209 G MORALESGUIO 2014 6555 6569 C NORSKOV 2005 J23 J26 J LIU 2019 3648 3654 X WEI 2021 14669 14676 T WANG 2021 e2003327 C GAO 2021 e2003786 J DU 2022 260 266 S HUNTER 2016 14120 14136 B PAN 2021 734 745 F YANG 2021 187 195 C ZHAI 2020 5462 P LIU 2018 6840 6846 D WU 2019 14001 14010 C WAN 2021 5589 W ZHANG 2018 11446 11452 X BAI 2021 1054 1066 L LIU 2019 2890 2923 M ZHAO 2022 478 484 C DAI 2015 4823 4892 L NIE 2015 2168 2201 Y CHEN 2021 120021 Z XU 2020 1374 1381 J LI 2021 4645 4651 L SUN 2020 2006533 H XIAO 2019 17763 17770 M JIAO 2021 959 964 L YE 2019 2865 2878 W ZHANG 2020 509 521 N GAO 2021 614 623 R MEDFORD 2015 36 42 A XIAO 2018 396 403 M ZHANG 2018 10757 10763 L KONG 2022 120782 F YAN 2021 19489 19507 Y YANG 2021 1734 G LI 2022 1601 1610 H JIANG 2022 106793 M WANG 2021 e2104718 Z WANG 2021 13044 13055 K HE 2022 1216 1227 Y XIAO 2021 8837 8846 M HAN 2019 e1905622 X LIU 2022 e2107421 M LI 2019 112 121 Z MA 2020 119091 M WU 2020 119159 Y MA 2021 526 535 Y ZHU 2020 104597 X HU 2021 3482 3488 B WANG 2022 2201278 S MOHANTY 2022 444 471 B ZHENG 2019 265 278 T ZHANG 2022 383 390 X CHEN 2022 198 202 Z LI 2020 118747 Y WANG 2022 e202113044 J DING 2021 11317 11324 T CHENG 2021 12673 12681 H XIE 2021 7382 7388 W ZHANG 2021 13388 13393 N ZHU 2020 12664 12668 W GONG 2021 4499 4506 Q ZENG 2021 4088 Z LIANG 2021 eabl4915 Z WANG 2022 640 649 Y WEI 2021 150423 X CHEN 2021 25 Z CHENG 2021 e2105135 L ZHANG 2022 9073 9083 Y LIN 2019 e1903470 L REN 2019 6972 6976 W FENG 2021 23817 23827 M LIU 2021 507 516 H OUYANG 2020 1807 1813 Y LUO 2020 15809 15815 G HE 2018 28629 28636 H LUO 2022 219 223 T GUAN 2020 1044 1053 A SHAO 2021 16687 16692 P CHENG 2016 7769 7777 M ZHU 2019 7760 7766 X LI 2015 6658 6664 Y ZHANG 2018 18599 18604 X TANG 2019 3166 3180 C MA 2022 182 187 L SUN 2021 e2003075 T HAN 2021 345 350 L ZHANG 2020 11957 11960 L LI 2019 22242 22247 Y CHEN 2018 1800291 Z LI 2020 4533 4543 H LV 2021 1871 1878 X LIUX2023X515 LIUX2023X515X534 LIUX2023X515XK LIUX2023X515X534XK 2025-02-15T00:00:00.000Z 2025-02-15T00:00:00.000Z http://creativecommons.org/licenses/by-nc-nd/4.0/ © 2023 Science Press and Dalian Institute of Chemical Physics, Chinese Academy of Sciences. All rights reserved. 2023-02-19T04:17:31.053Z http://vtw.elsevier.com/data/voc/AddOnTypes/50.7/aggregated-refined Natural Science Foundation of Shandong Province ZR2021MB101 ZR2021ME113 ZR2021ME177 ZR2021QE096 Natural Science Foundation of Shandong Province http://data.elsevier.com/vocabulary/SciValFunders/501100007129 http://sws.geonames.org/1814991/ The authors acknowledge the financial support from the Natural Science Foundation of Shandong Province (Nos. ZR2021QE096 , ZR2021MB101 , ZR2021ME113 and ZR2021ME177 ). item S2095-4956(23)00033-5 S2095495623000335 1-s2.0-S2095495623000335 10.1016/j.jechem.2023.01.021 286353 2023-04-21T10:25:34.020827Z 2023-04-01 2023-04-30 1-s2.0-S2095495623000335-main.pdf https://s3-eu-west-1.amazonaws.com/prod-ucs-content-store-eu-west/content/pii:S2095495623000335/MAIN/application/pdf/a83688870f209b187acb52ebef92592e/main.pdf main.pdf pdf true 8571446 MAIN 20 1-s2.0-S2095495623000335-main_1.png https://s3-eu-west-1.amazonaws.com/prod-ucs-content-store-eu-west/content/pii:S2095495623000335/PREVIEW/image/png/f35ab82b53e02b2438b8b4d33ae670c8/main_1.png main_1.png png 56266 849 656 IMAGE-WEB-PDF 1 1-s2.0-S2095495623000335-gr10.jpg https://s3-eu-west-1.amazonaws.com/prod-ucs-content-store-eu-west/content/pii:S2095495623000335/gr10/THUMBNAIL/image/jpeg/9d6f988227b143784adaa202bb4e104d/gr10.jpg gr10 gr10.jpg jpg 69978 362 535 IMAGE-DOWNSAMPLED 1-s2.0-S2095495623000335-gr11.jpg https://s3-eu-west-1.amazonaws.com/prod-ucs-content-store-eu-west/content/pii:S2095495623000335/gr11/DOWNSAMPLED/image/jpeg/9820cf52175c8c4ca724d03ba0fbc9ab/gr11.jpg gr11 gr11.jpg jpg 61701 452 383 IMAGE-DOWNSAMPLED 1-s2.0-S2095495623000335-gr12.jpg https://s3-eu-west-1.amazonaws.com/prod-ucs-content-store-eu-west/content/pii:S2095495623000335/gr12/HIGHRES/image/jpeg/086dba0a296cba9713de4f76e5ea4b3d/gr12.jpg gr12 gr12.jpg jpg 142411 624 681 IMAGE-DOWNSAMPLED 1-s2.0-S2095495623000335-gr13.jpg https://s3-eu-west-1.amazonaws.com/prod-ucs-content-store-eu-west/content/pii:S2095495623000335/gr13/DOWNSAMPLED/image/jpeg/eb4f4b79a998b639da602591c275f9bd/gr13.jpg gr13 gr13.jpg jpg 89517 524 535 IMAGE-DOWNSAMPLED 1-s2.0-S2095495623000335-gr14.jpg https://s3-eu-west-1.amazonaws.com/prod-ucs-content-store-eu-west/content/pii:S2095495623000335/gr14/DOWNSAMPLED/image/jpeg/d25eea27cc2cd926ec3f279568d838ff/gr14.jpg gr14 gr14.jpg jpg 106816 413 628 IMAGE-DOWNSAMPLED 1-s2.0-S2095495623000335-gr15.jpg https://s3-eu-west-1.amazonaws.com/prod-ucs-content-store-eu-west/content/pii:S2095495623000335/gr15/DOWNSAMPLED/image/jpeg/cbb78c3558524845203aaf97534c1af6/gr15.jpg gr15 gr15.jpg jpg 52273 222 535 IMAGE-DOWNSAMPLED 1-s2.0-S2095495623000335-gr16.jpg https://s3-eu-west-1.amazonaws.com/prod-ucs-content-store-eu-west/content/pii:S2095495623000335/gr16/THUMBNAIL/image/jpeg/6c505d024e8ac4d899778379434df9e7/gr16.jpg gr16 gr16.jpg jpg 106316 385 712 IMAGE-DOWNSAMPLED 1-s2.0-S2095495623000335-gr17.jpg https://s3-eu-west-1.amazonaws.com/prod-ucs-content-store-eu-west/content/pii:S2095495623000335/gr17/DOWNSAMPLED/image/jpeg/b33610beaf955e43c75c5e08762d9db8/gr17.jpg gr17 gr17.jpg jpg 40140 320 382 IMAGE-DOWNSAMPLED 1-s2.0-S2095495623000335-gr2.jpg https://s3-eu-west-1.amazonaws.com/prod-ucs-content-store-eu-west/content/pii:S2095495623000335/gr2/DOWNSAMPLED/image/jpeg/d5dac667209a2f05feb33815d764d7dd/gr2.jpg gr2 gr2.jpg jpg 124293 559 534 IMAGE-DOWNSAMPLED 1-s2.0-S2095495623000335-gr3.jpg https://s3-eu-west-1.amazonaws.com/prod-ucs-content-store-eu-west/content/pii:S2095495623000335/gr3/DOWNSAMPLED/image/jpeg/f6e2f4c6359747175e57d3d5b4f5814c/gr3.jpg gr3 gr3.jpg jpg 145822 556 647 IMAGE-DOWNSAMPLED 1-s2.0-S2095495623000335-gr4.jpg https://s3-eu-west-1.amazonaws.com/prod-ucs-content-store-eu-west/content/pii:S2095495623000335/gr4/DOWNSAMPLED/image/jpeg/f1d9dcf887d448b4f6a4e72e3e834c6d/gr4.jpg gr4 gr4.jpg jpg 161878 619 535 IMAGE-DOWNSAMPLED 1-s2.0-S2095495623000335-gr5.jpg https://s3-eu-west-1.amazonaws.com/prod-ucs-content-store-eu-west/content/pii:S2095495623000335/gr5/DOWNSAMPLED/image/jpeg/ff58692e3feaa0019df22cc9552096f7/gr5.jpg gr5 gr5.jpg jpg 172175 488 793 IMAGE-DOWNSAMPLED 1-s2.0-S2095495623000335-gr6.jpg https://s3-eu-west-1.amazonaws.com/prod-ucs-content-store-eu-west/content/pii:S2095495623000335/gr6/DOWNSAMPLED/image/jpeg/4bf11acc8e052650783f3546d1628302/gr6.jpg gr6 gr6.jpg jpg 158493 573 796 IMAGE-DOWNSAMPLED 1-s2.0-S2095495623000335-gr7.jpg https://s3-eu-west-1.amazonaws.com/prod-ucs-content-store-eu-west/content/pii:S2095495623000335/gr7/DOWNSAMPLED/image/jpeg/9610d57a0484abec081055c2a5183115/gr7.jpg gr7 gr7.jpg jpg 84512 458 628 IMAGE-DOWNSAMPLED 1-s2.0-S2095495623000335-gr8.jpg https://s3-eu-west-1.amazonaws.com/prod-ucs-content-store-eu-west/content/pii:S2095495623000335/gr8/DOWNSAMPLED/image/jpeg/d9f367fbc8aa2c813659b998cc82c66c/gr8.jpg gr8 gr8.jpg jpg 60008 274 535 IMAGE-DOWNSAMPLED 1-s2.0-S2095495623000335-gr9.jpg https://s3-eu-west-1.amazonaws.com/prod-ucs-content-store-eu-west/content/pii:S2095495623000335/gr9/DOWNSAMPLED/image/jpeg/7463c01206d86e35311438da978a1d16/gr9.jpg gr9 gr9.jpg jpg 117066 546 645 IMAGE-DOWNSAMPLED 1-s2.0-S2095495623000335-ga1.jpg https://s3-eu-west-1.amazonaws.com/prod-ucs-content-store-eu-west/content/pii:S2095495623000335/ga1/DOWNSAMPLED/image/jpeg/c8dbb874bfbe155d946d1b8badda7c1d/ga1.jpg ga1 true ga1.jpg jpg 26828 245 291 IMAGE-DOWNSAMPLED 1-s2.0-S2095495623000335-fx1.jpg https://s3-eu-west-1.amazonaws.com/prod-ucs-content-store-eu-west/content/pii:S2095495623000335/fx1/THUMBNAIL/image/jpeg/231ba29391f045ddd41dc87cf169d6e3/fx1.jpg fx1 fx1.jpg jpg 5705 155 111 IMAGE-DOWNSAMPLED 1-s2.0-S2095495623000335-fx2.jpg https://s3-eu-west-1.amazonaws.com/prod-ucs-content-store-eu-west/content/pii:S2095495623000335/fx2/DOWNSAMPLED/image/jpeg/166380377645a0676517aa5715830161/fx2.jpg fx2 fx2.jpg jpg 6975 155 111 IMAGE-DOWNSAMPLED 1-s2.0-S2095495623000335-fx3.jpg https://s3-eu-west-1.amazonaws.com/prod-ucs-content-store-eu-west/content/pii:S2095495623000335/fx3/DOWNSAMPLED/image/jpeg/2521867922961f3465abda3be0f73a1e/fx3.jpg fx3 fx3.jpg jpg 5861 155 111 IMAGE-DOWNSAMPLED 1-s2.0-S2095495623000335-fx4.jpg https://s3-eu-west-1.amazonaws.com/prod-ucs-content-store-eu-west/content/pii:S2095495623000335/fx4/DOWNSAMPLED/image/jpeg/5c49bcbef8d2bb8f4f936aad93c00840/fx4.jpg fx4 fx4.jpg jpg 5502 155 111 IMAGE-DOWNSAMPLED 1-s2.0-S2095495623000335-fx5.jpg https://s3-eu-west-1.amazonaws.com/prod-ucs-content-store-eu-west/content/pii:S2095495623000335/fx5/DOWNSAMPLED/image/jpeg/c3b97f32b9489aee6c684ab3e3252c4a/fx5.jpg fx5 fx5.jpg jpg 4922 155 111 IMAGE-DOWNSAMPLED 1-s2.0-S2095495623000335-gr1.jpg https://s3-eu-west-1.amazonaws.com/prod-ucs-content-store-eu-west/content/pii:S2095495623000335/gr1/DOWNSAMPLED/image/jpeg/fb67a6a50be762db9deb1f5ace5c2bb4/gr1.jpg gr1 gr1.jpg jpg 64686 441 535 IMAGE-DOWNSAMPLED 1-s2.0-S2095495623000335-gr10.sml https://s3-eu-west-1.amazonaws.com/prod-ucs-content-store-eu-west/content/pii:S2095495623000335/gr10/THUMBNAIL/image/gif/9befc9e5bf79c3125b6f45b84eed1cf4/gr10.sml gr10 gr10.sml sml 12544 148 219 IMAGE-THUMBNAIL 1-s2.0-S2095495623000335-gr11.sml https://s3-eu-west-1.amazonaws.com/prod-ucs-content-store-eu-west/content/pii:S2095495623000335/gr11/THUMBNAIL/image/gif/867256694040793b3aa23b67d087bb9f/gr11.sml gr11 gr11.sml sml 10820 164 139 IMAGE-THUMBNAIL 1-s2.0-S2095495623000335-gr12.sml https://s3-eu-west-1.amazonaws.com/prod-ucs-content-store-eu-west/content/pii:S2095495623000335/gr12/THUMBNAIL/image/gif/31681a966909289c8ba0be3c7775f7e0/gr12.sml gr12 gr12.sml sml 15686 164 179 IMAGE-THUMBNAIL 1-s2.0-S2095495623000335-gr13.sml https://s3-eu-west-1.amazonaws.com/prod-ucs-content-store-eu-west/content/pii:S2095495623000335/gr13/THUMBNAIL/image/gif/9c9041641b6ebdf0f0fec0299e9050c4/gr13.sml gr13 gr13.sml sml 11221 164 167 IMAGE-THUMBNAIL 1-s2.0-S2095495623000335-gr14.sml https://s3-eu-west-1.amazonaws.com/prod-ucs-content-store-eu-west/content/pii:S2095495623000335/gr14/THUMBNAIL/image/gif/2f02a656c4ef413d9231d49f6ecbbcf1/gr14.sml gr14 gr14.sml sml 18587 144 219 IMAGE-THUMBNAIL 1-s2.0-S2095495623000335-gr15.sml https://s3-eu-west-1.amazonaws.com/prod-ucs-content-store-eu-west/content/pii:S2095495623000335/gr15/THUMBNAIL/image/gif/19c6d1f0f5d36c0f2448a9868bfaa3c9/gr15.sml gr15 gr15.sml sml 11419 91 219 IMAGE-THUMBNAIL 1-s2.0-S2095495623000335-gr16.sml https://s3-eu-west-1.amazonaws.com/prod-ucs-content-store-eu-west/content/pii:S2095495623000335/gr16/THUMBNAIL/image/gif/13de5ba1c57b86ab55c7370f538016d1/gr16.sml gr16 gr16.sml sml 14273 119 219 IMAGE-THUMBNAIL 1-s2.0-S2095495623000335-gr17.sml https://s3-eu-west-1.amazonaws.com/prod-ucs-content-store-eu-west/content/pii:S2095495623000335/gr17/THUMBNAIL/image/gif/32aba388a48715baa1e0a646e3788018/gr17.sml gr17 gr17.sml sml 13015 163 195 IMAGE-THUMBNAIL 1-s2.0-S2095495623000335-gr2.sml https://s3-eu-west-1.amazonaws.com/prod-ucs-content-store-eu-west/content/pii:S2095495623000335/gr2/HIGHRES/image/gif/c15229ecaf1a438b4d21c02e28ed9de9/gr2.sml gr2 gr2.sml sml 18273 163 156 IMAGE-THUMBNAIL 1-s2.0-S2095495623000335-gr3.sml https://s3-eu-west-1.amazonaws.com/prod-ucs-content-store-eu-west/content/pii:S2095495623000335/gr3/THUMBNAIL/image/gif/40224174a4e3ff472afe15f7738424a8/gr3.sml gr3 gr3.sml sml 19574 164 191 IMAGE-THUMBNAIL 1-s2.0-S2095495623000335-gr4.sml https://s3-eu-west-1.amazonaws.com/prod-ucs-content-store-eu-west/content/pii:S2095495623000335/gr4/THUMBNAIL/image/gif/d051dbcdada879690448b3d9757928a9/gr4.sml gr4 gr4.sml sml 13658 164 142 IMAGE-THUMBNAIL 1-s2.0-S2095495623000335-gr5.sml https://s3-eu-west-1.amazonaws.com/prod-ucs-content-store-eu-west/content/pii:S2095495623000335/gr5/THUMBNAIL/image/gif/d7eff3ffec37ad0f1034c22e971591a7/gr5.sml gr5 gr5.sml sml 17456 135 219 IMAGE-THUMBNAIL 1-s2.0-S2095495623000335-gr6.sml https://s3-eu-west-1.amazonaws.com/prod-ucs-content-store-eu-west/content/pii:S2095495623000335/gr6/THUMBNAIL/image/gif/052ed629bf80902550abc4677a8250bb/gr6.sml gr6 gr6.sml sml 17094 158 219 IMAGE-THUMBNAIL 1-s2.0-S2095495623000335-gr7.sml https://s3-eu-west-1.amazonaws.com/prod-ucs-content-store-eu-west/content/pii:S2095495623000335/gr7/THUMBNAIL/image/gif/d2f6fcc001e4861b6130a364ba693f72/gr7.sml gr7 gr7.sml sml 11282 160 219 IMAGE-THUMBNAIL 1-s2.0-S2095495623000335-gr8.sml https://s3-eu-west-1.amazonaws.com/prod-ucs-content-store-eu-west/content/pii:S2095495623000335/gr8/DOWNSAMPLED/image/gif/af23a41e11ffd80ba9f276b6e5fd5f91/gr8.sml gr8 gr8.sml sml 10854 112 219 IMAGE-THUMBNAIL 1-s2.0-S2095495623000335-gr9.sml https://s3-eu-west-1.amazonaws.com/prod-ucs-content-store-eu-west/content/pii:S2095495623000335/gr9/THUMBNAIL/image/gif/da34d40c97bed12acd4a1f08b85a500b/gr9.sml gr9 gr9.sml sml 15008 163 193 IMAGE-THUMBNAIL 1-s2.0-S2095495623000335-ga1.sml https://s3-eu-west-1.amazonaws.com/prod-ucs-content-store-eu-west/content/pii:S2095495623000335/ga1/THUMBNAIL/image/gif/e132c7290967e2b32e16c7ee3856c2c0/ga1.sml ga1 true ga1.sml sml 13558 163 194 IMAGE-THUMBNAIL 1-s2.0-S2095495623000335-fx1.sml https://s3-eu-west-1.amazonaws.com/prod-ucs-content-store-eu-west/content/pii:S2095495623000335/fx1/THUMBNAIL/image/gif/27a90b62c3b946e6e184e228fe7f5f13/fx1.sml fx1 fx1.sml sml 14287 164 117 IMAGE-THUMBNAIL 1-s2.0-S2095495623000335-fx2.sml https://s3-eu-west-1.amazonaws.com/prod-ucs-content-store-eu-west/content/pii:S2095495623000335/fx2/THUMBNAIL/image/gif/b17d4dc6e9c668d9bcf96f635787d21e/fx2.sml fx2 fx2.sml sml 15260 164 117 IMAGE-THUMBNAIL 1-s2.0-S2095495623000335-fx3.sml https://s3-eu-west-1.amazonaws.com/prod-ucs-content-store-eu-west/content/pii:S2095495623000335/fx3/THUMBNAIL/image/gif/df100a820f2f5f60c4943a4ce75cc01f/fx3.sml fx3 fx3.sml sml 14378 164 117 IMAGE-THUMBNAIL 1-s2.0-S2095495623000335-fx4.sml https://s3-eu-west-1.amazonaws.com/prod-ucs-content-store-eu-west/content/pii:S2095495623000335/fx4/THUMBNAIL/image/gif/89d3cdb0f1f0aa649e8b0df78cd2932a/fx4.sml fx4 fx4.sml sml 12173 164 117 IMAGE-THUMBNAIL 1-s2.0-S2095495623000335-fx5.sml https://s3-eu-west-1.amazonaws.com/prod-ucs-content-store-eu-west/content/pii:S2095495623000335/fx5/THUMBNAIL/image/gif/e031cb63bb93654c12c0287187ebe7b2/fx5.sml fx5 fx5.sml sml 11838 164 117 IMAGE-THUMBNAIL 1-s2.0-S2095495623000335-gr1.sml https://s3-eu-west-1.amazonaws.com/prod-ucs-content-store-eu-west/content/pii:S2095495623000335/gr1/HIGHRES/image/gif/14b8dc4c14905e0f467985af9b8298ea/gr1.sml gr1 gr1.sml sml 11384 164 199 IMAGE-THUMBNAIL 1-s2.0-S2095495623000335-gr10_lrg.jpg https://s3-eu-west-1.amazonaws.com/prod-ucs-content-store-eu-west/content/pii:S2095495623000335/HIGHRES/image/jpeg/757c0f63ad49c602460a5fdd61a86707/gr10_lrg.jpg gr10 gr10_lrg.jpg jpg 374449 1604 2368 IMAGE-HIGH-RES 1-s2.0-S2095495623000335-gr11_lrg.jpg https://s3-eu-west-1.amazonaws.com/prod-ucs-content-store-eu-west/content/pii:S2095495623000335/HIGHRES/image/jpeg/09604339a4be177f02f2bbf8e10e8303/gr11_lrg.jpg gr11 gr11_lrg.jpg jpg 359416 2005 1699 IMAGE-HIGH-RES 1-s2.0-S2095495623000335-gr12_lrg.jpg https://s3-eu-west-1.amazonaws.com/prod-ucs-content-store-eu-west/content/pii:S2095495623000335/HIGHRES/image/jpeg/06c381828d2036754c2bd783b8ed6936/gr12_lrg.jpg gr12 gr12_lrg.jpg jpg 767395 2763 3015 IMAGE-HIGH-RES 1-s2.0-S2095495623000335-gr13_lrg.jpg https://s3-eu-west-1.amazonaws.com/prod-ucs-content-store-eu-west/content/pii:S2095495623000335/HIGHRES/image/jpeg/22e1bdcd361e4c3ac0da72ff87f842c5/gr13_lrg.jpg gr13 gr13_lrg.jpg jpg 484706 2321 2368 IMAGE-HIGH-RES 1-s2.0-S2095495623000335-gr14_lrg.jpg https://s3-eu-west-1.amazonaws.com/prod-ucs-content-store-eu-west/content/pii:S2095495623000335/HIGHRES/image/jpeg/757cd0ed9419bd328edf4c7276f19b43/gr14_lrg.jpg gr14 gr14_lrg.jpg jpg 612825 1828 2782 IMAGE-HIGH-RES 1-s2.0-S2095495623000335-gr15_lrg.jpg https://s3-eu-west-1.amazonaws.com/prod-ucs-content-store-eu-west/content/pii:S2095495623000335/DOWNSAMPLED/image/jpeg/5dc84abc6946ceed1dcec36fb9951612/gr15_lrg.jpg gr15 gr15_lrg.jpg jpg 295978 984 2368 IMAGE-HIGH-RES 1-s2.0-S2095495623000335-gr16_lrg.jpg https://s3-eu-west-1.amazonaws.com/prod-ucs-content-store-eu-west/content/pii:S2095495623000335/HIGHRES/image/jpeg/0199ccbe5ef6f88e8319edf2bc597aa3/gr16_lrg.jpg gr16 gr16_lrg.jpg jpg 570288 1707 3154 IMAGE-HIGH-RES 1-s2.0-S2095495623000335-gr17_lrg.jpg https://s3-eu-west-1.amazonaws.com/prod-ucs-content-store-eu-west/content/pii:S2095495623000335/HIGHRES/image/jpeg/779d2f486c18ac75a27e036a17a109f8/gr17_lrg.jpg gr17 gr17_lrg.jpg jpg 248504 1419 1693 IMAGE-HIGH-RES 1-s2.0-S2095495623000335-gr2_lrg.jpg https://s3-eu-west-1.amazonaws.com/prod-ucs-content-store-eu-west/content/pii:S2095495623000335/HIGHRES/image/jpeg/7aa4de5e6c67d3e78fcbd80aebbab407/gr2_lrg.jpg gr2 gr2_lrg.jpg jpg 606799 1782 1702 IMAGE-HIGH-RES 1-s2.0-S2095495623000335-gr3_lrg.jpg https://s3-eu-west-1.amazonaws.com/prod-ucs-content-store-eu-west/content/pii:S2095495623000335/HIGHRES/image/jpeg/fd11c3d4d00d244c8bce8ce1157b642d/gr3_lrg.jpg gr3 gr3_lrg.jpg jpg 871261 2463 2866 IMAGE-HIGH-RES 1-s2.0-S2095495623000335-gr4_lrg.jpg https://s3-eu-west-1.amazonaws.com/prod-ucs-content-store-eu-west/content/pii:S2095495623000335/HIGHRES/image/jpeg/cb73bffe8d5b33b3812bc6bb64bd053a/gr4_lrg.jpg gr4 gr4_lrg.jpg jpg 915887 2738 2368 IMAGE-HIGH-RES 1-s2.0-S2095495623000335-gr5_lrg.jpg https://s3-eu-west-1.amazonaws.com/prod-ucs-content-store-eu-west/content/pii:S2095495623000335/MAIN/image/jpeg/6b7c59c6dcc14c24afba858d07b30a5b/gr5_lrg.jpg gr5 gr5_lrg.jpg jpg 1096741 2161 3509 IMAGE-HIGH-RES 1-s2.0-S2095495623000335-gr6_lrg.jpg https://s3-eu-west-1.amazonaws.com/prod-ucs-content-store-eu-west/content/pii:S2095495623000335/HIGHRES/image/jpeg/736b6d16f758639629d66738d82c14e7/gr6_lrg.jpg gr6 gr6_lrg.jpg jpg 794646 2540 3526 IMAGE-HIGH-RES 1-s2.0-S2095495623000335-gr7_lrg.jpg https://s3-eu-west-1.amazonaws.com/prod-ucs-content-store-eu-west/content/pii:S2095495623000335/MAIN/image/jpeg/53344be0fa1167bb6f90ed7ff9403d8b/gr7_lrg.jpg gr7 gr7_lrg.jpg jpg 439997 2028 2782 IMAGE-HIGH-RES 1-s2.0-S2095495623000335-gr8_lrg.jpg https://s3-eu-west-1.amazonaws.com/prod-ucs-content-store-eu-west/content/pii:S2095495623000335/HIGHRES/image/jpeg/8797daa49945eaa6f18590fa7e448f43/gr8_lrg.jpg gr8 gr8_lrg.jpg jpg 331215 1213 2368 IMAGE-HIGH-RES 1-s2.0-S2095495623000335-gr9_lrg.jpg https://s3-eu-west-1.amazonaws.com/prod-ucs-content-store-eu-west/content/pii:S2095495623000335/HIGHRES/image/jpeg/afeb0ece7dd339de1a71a3b52e9360ee/gr9_lrg.jpg gr9 gr9_lrg.jpg jpg 644346 2417 2854 IMAGE-HIGH-RES 1-s2.0-S2095495623000335-ga1_lrg.jpg https://s3-eu-west-1.amazonaws.com/prod-ucs-content-store-eu-west/content/pii:S2095495623000335/MAIN/image/jpeg/909a93670da280d59b1b93974322ec56/ga1_lrg.jpg ga1 true ga1_lrg.jpg jpg 151851 1085 1288 IMAGE-HIGH-RES 1-s2.0-S2095495623000335-fx1_lrg.jpg https://s3-eu-west-1.amazonaws.com/prod-ucs-content-store-eu-west/content/pii:S2095495623000335/HIGHRES/image/jpeg/20c9a0ac9672ed149b5a6ab0505d460e/fx1_lrg.jpg fx1 fx1_lrg.jpg jpg 15236 413 295 IMAGE-HIGH-RES 1-s2.0-S2095495623000335-fx2_lrg.jpg https://s3-eu-west-1.amazonaws.com/prod-ucs-content-store-eu-west/content/pii:S2095495623000335/HIGHRES/image/jpeg/051fec003b5671c7d1e5e3209b53e9d8/fx2_lrg.jpg fx2 fx2_lrg.jpg jpg 23683 413 295 IMAGE-HIGH-RES 1-s2.0-S2095495623000335-fx3_lrg.jpg https://s3-eu-west-1.amazonaws.com/prod-ucs-content-store-eu-west/content/pii:S2095495623000335/HIGHRES/image/jpeg/dc7e51e3572b8d2bc539b5ab0877784a/fx3_lrg.jpg fx3 fx3_lrg.jpg jpg 16817 413 295 IMAGE-HIGH-RES 1-s2.0-S2095495623000335-fx4_lrg.jpg https://s3-eu-west-1.amazonaws.com/prod-ucs-content-store-eu-west/content/pii:S2095495623000335/HIGHRES/image/jpeg/7c5476ec89872562191352f5ba87cdb6/fx4_lrg.jpg fx4 fx4_lrg.jpg jpg 17147 413 295 IMAGE-HIGH-RES 1-s2.0-S2095495623000335-fx5_lrg.jpg https://s3-eu-west-1.amazonaws.com/prod-ucs-content-store-eu-west/content/pii:S2095495623000335/HIGHRES/image/jpeg/40e6926f51c610a9e9dfcf7fdc76f22a/fx5_lrg.jpg fx5 fx5_lrg.jpg jpg 13253 413 295 IMAGE-HIGH-RES 1-s2.0-S2095495623000335-gr1_lrg.jpg https://s3-eu-west-1.amazonaws.com/prod-ucs-content-store-eu-west/content/pii:S2095495623000335/DOWNSAMPLED/image/jpeg/3f2497222024fb9ccd6bc6db25087d83/gr1_lrg.jpg gr1 gr1_lrg.jpg jpg 373102 1950 2368 IMAGE-HIGH-RES 1-s2.0-S2095495623000335-mmc1.docx https://s3-eu-west-1.amazonaws.com/prod-ucs-content-store-eu-west/content/pii:S2095495623000335/mmc1/MAIN/application/vnd.openxmlformats-officedocument.wordprocessingml.document/4cca69e8a9e944eda28acf42533acb8e/mmc1.docx mmc1 mmc1.docx docx 34903 APPLICATION 1-s2.0-S2095495623000335-am.pdf https://s3-eu-west-1.amazonaws.com/prod-ucs-content-store-eu-west/content/egi:10C03D04RW9/MAIN/application/pdf/edd70523284b3f65f643e2c6f0230d74/am.pdf am am.pdf pdf false 3764306 AAM-PDF JECHEM 2975 S2095-4956(23)00033-5 10.1016/j.jechem.2023.01.021 Science Press and Dalian Institute of Chemical Physics, Chinese Academy of Sciences Fig. 1 Selected techniques for the characterization of DACs. Fig. 2 (a) HAADF-STEM image of Ni2NC. (b) Atomic distance of dual atoms. (c) EELS spectrum based on area 2 in (a). (d) Elemental mapping images of Ni2NC. Scale bar, 200 nm. (e) In-situ ESTEM measurements. Reproduced with permission from Ref. [33]. Copyright 2022, Springer Nature. Fig. 3 (a) Ni K-edge and (b) Zn K-edge XANES spectra. (c) Ni and (d) Zn k3-weighted FT of EXAFS spectra. (e) Ni K-edge and (f) Zn K-edge WT-EXAFS spectra. Fitting curves of the FT-EXAFS spectra for (g) Ni–N, Ni–Zn and (h) Zn–N, Ni–Zn of Ni–ZnNC, (i) NiNC and (j) ZnNC. Reproduced with permission from Ref. [36]. Copyright 2021, Wiley-VCH. Fig. 4 Schematic illustration of the synthetic procedure of (a) (Fe,Co)/NC. Reproduced with permission from Ref. [40]. Copyright 2017, American Chemical Society. (b) Zn/CoN-C. Reproduced with permission from Ref. [46]. Copyright 2019, Wiley-VCH. (c) Cu atom-pair on Pd10Te3 nanowires. Reproduced with permission from Ref. [49]. Copyright 2019, Springer Nature. (d) dual-atom Fe-CoNC. Reproduced with permission from Ref. [50]. Copyright 2019, American Chemical Society. (e) Pt-Ru dimers on NCNTs. Reproduced with permission from Ref. [52]. Copyright 2019, Springer Nature. (f) W1Mo1-NG DAC. (g) Proposed chemical mechanism of W1Mo1-NG DAC. Reproduced with permission from Ref. [54]. Copyright 2020, American Association for the Advancement of Science. Fig. 5 (a) AC HAADF-STEM images. (b) Statistical W-Mo diatomic distance. WT-EXAFS of W1Mo1-NG at (c) Mo K-edge and (d) W L3-edge. (e) Mo K-edge and (f) W L3-edge EXAFS fitting curves. The differential charge density maps of heteronuclear W1Mo1-NG system from (g) (100) and (h) (010) sections. (i) PDOS of metal and O atoms in W1Mo1-NG, Mo2-NG, and W2-NG. Reproduced with permission from Ref. [54]. Copyright 2020, American Association for the Advancement of Science. Fig. 6 (a, c) In situ FT-EXAFS spectra of NiFe-CNG. (b, d) k3-weighted WT-EXAFS signals of NiFe-CNG. (e) Illustration of the OER pathway. Reproduced with permission from Ref. [71]. Copyright 2021, Springer Nature. Fig. 7 (a) Edge-jump energies of Fe K-edge XANES spectra for Ni–FeNC. (b) Operando Ni K-edge HERFD-XAS. (c) Ni K-edge HERFD-XAS for Ni–FeNC under different conditions. (d) Fe/Ni ratio determined by HERFD-XAS. (e) TOFs of different catalysts. (f) Proposed the possible reaction mechanism. Reproduced with permission from Ref. [73]. Copyright 2021, Springer Nature. Fig. 8 (a) Operando XANES spectra and (b) corresponding FTs of Fe K-edge EXAFS for Fe2N6 structure. (c) Fe–Fe shell length calculated from operando EXAFS spectra. (d) Fitted average oxidation state of Fe in Fe2N6 structure. (e) Possible ORR reaction pathways on Fe2N6 structure. Reproduced with permission from Ref. [85]. Copyright 2020, Elsevier. Fig. 9 (a) Room-temperature 57Fe Mossbauer spectrum of Fe,Mn/NC. Magnetic susceptibility of (b) Fe,Mn/NC and (c) Fe/NC. Reproduced with permission from Ref. [92]. Copyright 2021, Springer Nature. Calculated free energies for two-step protonation: (d) ΔG 1*H and (e) ΔG 2*H. (f) EXAFS fitting curves of Fe K-edge. (g) Charge density difference for Fe/ZnNC. Schematic electronic structures of (h) FeNC and (i) Fe/ZnNC. Reproduced with permission from Ref. [93]. Copyright 2022, Royal Society of Chemistry. Fig. 10 (a) Charge density difference for IrCoN5. (b) PDOS for 3d orbitals of Co in IrCoN5. (c) Crystal orbital Hamilton population (COHP) analysis of the Co–O bond on IrCoN5. PDOS for Co (3d orbitals) and O (2p orbital) in (d) CoN4–O and (e) IrCoN5–O. (f) schematic bond formation of the Co–O bond on both CoN4 (left) and IrCoN5 (right) sites. Reproduced with permission from Ref. [98]. Copyright 2021, American Chemical Society. Fig. 11 (a) Free energy profiles for CO2 activation. (b) Configurations of physisorbed CO2 and chemisorbed CO2 on Cu-APC. Reproduced with permission from Ref. [49]. Copyright 2019, Springer Nature. Fig. 12 Density of states of Fe 3d for (a) Fe-SAC and (b) NiFe-DAC, of Ni 3d for (c) Ni-SAC and (d) NiFe-DAC. The differential charge density maps of (e) Ni-SAC, (f) Fe-SAC, and (g) NiFe-DAC. (h) Schematic illustration of orbital interactions. (i) Differential charge density on NiFeDAC–CO. (j) Calculated free energy diagrams for CO2RR and OER processes. Reproduced with permission from Ref. [120]. Copyright 2021, Springer Nature. Fig. 13 (a) The mechanism on diatomic metal-nitrogen site. Reproduced with permission from Ref. [128]. Copyright 2019, Wiley-VCH. (b) Free energy diagrams for CO2 electroreduction to CO. (c) Calculated partial DOS for N4Fe-CuN3 and Fe-N4 with *CO adsorption. Reproduced with permission from Ref. [129]. Copyright 2021, Royal Society of Chemistry. (d) Thermodynamic limiting potentials toward C1 and C2 products (CH4 and C2H4) on M2@C2N. (e) Volcano curve of limiting potential (U L) for CO2RR toward C2H2 production as a function of binding energy (BE) of co-adsorbed *CO + *CO. Reproduced with permission from Ref. [130]. Copyright 2021, Elsevier. Fig. 14 (a) Illustration of the high free energy change caused by the scaling relations. (b) Heteronuclear transition-metal dimers on monolayer C2N. (c) Schematic of decoupling the scaling relations between adsorption energies of *CHO and *CO. Relationship between binding energies (d) Eb(CHO) and Eb(CO), (e) Eb(COOH) and Eb(CO), and (f) Eb(CHO) and Eb(CO) for different metal dimers on C2N support. Reproduced with permission from Ref. [131]. Copyright 2020, Royal Society of Chemistry. Fig. 15 Screening of CO2 electroreduction intermediate adsorption with respect to (a) CO and (b) O species on different MN@2SV. Reproduced with permission from Ref. [139]. Copyright 2015, American Chemical Society. Fig. 16 (a) Proposed “Five-Step” strategy for screening NRR candidate catalysts. (b) Computed ΔE b and E f of metal atoms on g-CN. (c) Limiting potentials for NRR (U L(NRR)) and HER (U L(HER)) illustrating the NRR selectivity of TM2/g-CN. (d) Illustration of the correlation between ICOHP and the excess electrons on *N2. (e) Free energy diagrams and (f) adsorption structures during the NRR on Fe2/g-CN. Reproduced with permission from Ref. [149]. Copyright 2021, American Chemical Society. Scheme 1 Scheme illustration of the advantages of DACs for various catalytic reactions. Review Dual metal atom catalysts: Advantages in electrocatalytic reactions Kaihua Liu ⁎ Jing Li Yuanyuan Liu Meiri Wang Hongtao Cui College of Chemistry & Chemical Engineering, Yantai University, Yantai 264005, Shandong, China College of Chemistry & Chemical Engineering Yantai University Yantai 264005 Shandong China College of Chemistry & Chemical Engineering, Yantai University, Yantai 264005, Shandong, China ⁎ Corresponding author. Graphical abstract The advantages of DACs in various electrocatalytic reactions are summarized, also including the characterization methods, synthesis strategies, and prospects of DACs. The dual-metal-atom catalysts (DACs) have aroused much attention as they possess the advantages of single-atom and metal alloy catalysts. And the DACs have exhibited enhanced performance in various electrocatalytic reactions, such as hydrogen/oxygen evolution and oxygen/carbon dioxide/nitrogen reduction. In this review, we mainly overview the latest understanding of the advantages of DACs for these reactions. This review will start with the familiar characterization methods for DACs, then the primary synthesis strategies for DACs will be discussed. Emphasis is given to the advantages of DACs in catalytic reactions, including the adsorption and activation, electronic structure regulation, breaking scaling relations, reducing energy barriers, cascading and coupling, synergy effect, and providing mechanism research platforms. Finally, personal perspectives and challenges for the further development of DACs are briefly discussed. Keywords Dual atom catalysts Synergy effect Scaling relation Mechanism study platform 1 Introduction The increasing energy and environmental demands stimulate the rapid development of high-efficiency energy storage and conversion techniques [1–4]. Thereinto, most of them mainly rely on several crucial electrochemical reactions, such as hydrogen/oxygen evolution reaction (HER/OER), oxygen/carbon dioxide/ nitrogen reduction reaction (ORR/CO2RR/NRR), etc. [5,6]. Thus, the implementation of these techniques extensively relies on fabricating efficient electrocatalysts to improve energy conversion efficiency. And the advanced catalysts for these reactions until now are still noble-metal catalysts (Pt, Ru, Au, etc.) [7–10]. However, their large-scale application is greatly restricted by their scarcity and stability [11]. Therefore, reducing noble-metal loading or constructing non-noble-metal alternatives is still the focus of current research. Single-atom catalysts (SACs), once reported by Zhang et al. in 2011 [12], have attracted considerable research interests in these thriving fields. The single atom of noble-metal catalysts, which could minimize the precious metal loading while maintaining the maximum atomic utilization, has exhibited enhanced performance towards many reactions, such as Mo2TiC2T x -PtSA for HER [13], Ru/MnO2 for acidic OER [14], Ir-SAC for ORR [15], and Au1/C3N4 for NRR [16], etc. Besides, the unique electronic and locally coordinated structures of SACs contribute to adjusting the adsorption/desorption of reaction intermediates. Thus, the SACs almost all display the optimized reaction barrier to promote the reaction process [17–19]. Many reviews have discussed the development of SACs [20–22]. However, limited by the atomically isolated single active site, SACs may not be the optimal catalysts for multiple intermediates reactions. Therefore, as the extension of SACs, the dual-metal-atom catalysts (DACs) have recently drawn ever-rising attention due to their more than one kind of adsorption sites, which can not only further optimize the adsorption/desorption properties, but also provide more adjacent and interactional active sites to couple the reaction pathways to accelerate reactions [23–29]. Considering the fast growth of this field, a timely review could help to promptly understand the advantages of DACs for these reactions and provide guidance for designing efficient catalysts. Herein, we summarize the recent development of DACs in these fields, and only discuss that the two metal atoms are adjacent and bridged (Scheme 1 ). Some important characterization methods will be introduced first. Then the typical synthetic strategies will be discussed. Emphasis is given to the latest understanding of the advantages of DACs for different catalytic reactions, clarifying the relationship between structure/composition and catalytic activities. Finally, personal perspectives about the challenges and directions for DACs are presented. 2 Characterization methods Currently, direct proofs for the structural characterization of DACs are still insufficient because of the limitations of catalysts and characterization techniques [21]. Thus, the characterization of DACs always needs a series of complementary techniques [30,31]. Herein, we summarize some of the most widely used techniques for the characterization of DACs, including their unique advantages and limitations (Fig. 1 ). 2.1 Electron microscopy Advanced electron microscopy can directly provide atomic-resolution imaging of heterogeneous catalysts. Especially, the aberration-corrected high-angle annular dark-field scanning transmission electron microscopy (AC HAADF-STEM) mode is widely applied for the characterization of SACs [6]. However, only the HAADF-STEM image makes it hard to distinguish atoms with similar atomic number, or obtain information about chemical surroundings of metal atoms. This may require the participation of electron energy loss spectroscopy (EELS) and energy dispersive X-ray spectroscopy (EDX) to further obtain atomic-resolution chemical information [32]. Thus, we should combine the HAADF-STEM images, EELS, and EDX to get more accurate information about the components of catalysts. These techniques have become indispensable characterization tools for DACs. For example, Zhang et al. used the scanning electron microscope (SEM) and STEM images to demonstrate the absence of nanoparticles in the Ni dual-atom catalyst (Ni2NC) [33]. Then the AC HAADF-STEM image showed the average distance of these adjacent dots was 0.25 nm, close to that of the simulated value (0.24 nm). The Ni dual atom anchored on NC was further verified using EELS. And the elemental mapping suggested the Ni, N, and C were distributed uniformly on Ni2NC (Fig. 2 a–d). Moreover, they also used in situ environmental scanning transmission electron microscopy (ESTEM) to detect the forming process of the Ni DAC during pyrolysis, which included the formation of the bulk phase by Ostwald ripening and then an atomization process for transforming the bulk phase to dual atoms (Fig. 2e). However, it is difficult to distinguish the single atoms in different depths because of the “transmission” signals [21]. Besides, scanning tunneling microscopy (STM) can be used for describing catalyst structure on an atomic scale, but the extremely high-test difficulty and the fact that it can be applied only on an atomically flat surface make it unfriendly for most catalysts [34]. Thus, we do not discuss it any more here. 2.2 X-ray absorption spectroscopy The X-ray absorption spectrum (XAS) is another indispensable means to characterize the DACs, especially in the valence, coordination environment, and structural parameters. The oxidation state of metal can be deduced from the X-ray absorption near edge structure (XANES), and the extended X-ray absorption fine structure (EXAFS) can provide more detailed information about the coordination environment of catalysts via the Fourier or wavelet transform (FT or WT) analysis and EXAFS fitting [35]. This valuable information contributes to understanding the structural models of metal active centers for further theoretical studies. One example of the XAS characterization for Ni–Zn atomic pair is shown in Fig. 3 [36]. The Ni valence of Ni–ZnNC was between + 1 and + 2, as the Ni XANES edge was between Ni foil and NiO (Fig. 3a). Fig. 3(b) showed the similar result for Zn. The major peaks at 1.29 Å in Fig. 3(c) and 1.45 Å in Fig. 3(d) were assigned to the Ni–N and Zn–N coordination, respectively. Besides, the peaks at 1.99 Å in Fig. 3(c) and 2.28 Å in Fig. 3(d) suggested their electronic interactions. No WT signal of Ni–Ni bond suggested the absence of nanoparticles in catalysts, and the signal at 8.9 Å−1 in Fig. 3(e) was attributed to Ni–Zn interaction paths. Moreover, the EXAFS curves of Ni–ZnNC fit well with the experimental results (Fig. 3g and h). Based on the EXAFS fitting and theoretical simulation, the metal atoms were coordinated with three N atoms. The XAS technique is also applied to in-situ/operando measurements to detect valence and structural changes of active centers under working conditions. For example, operando XANES spectroscopy combined with DFT calculations was used to demonstrate the structural evolution of an atomically dispersed Cu2+-N4 structure to Cu+–N3 and then to HO-Cu+–N2 under ORR process [37]. And the potential-induced restructuring of the Cu2+ reduction and the aggregation of Cu0 single atoms was demonstrated during the electrochemical synthesis of NH3 from nitrate. Interestingly, the aggregated nanoparticles can be reversibly restored to the Cu-N4 structure after electrolysis [38]. Significantly, the structure information deduced from XAS is an average result, which indicates that an inaccurate structure will be obtained if the catalyst contains many different coordination structures. Next, some fitted data, such as the low metal–metal coordination number, and the common coordination elements (C, N, and O) are sometimes difficult to utilize accurately. Thus, the XAS should unite with other characterization techniques to confirm the real coordination structure. 2.3 X-ray photoelectron spectroscopy X-ray photoelectron spectroscopy (XPS), a high-sensitivity surface chemistry characterization technique, is extensively applied to investigate the bonding information and electronic state. And the shift in peak position and heteroatomic doping can be related to the electrocatalytic performance. For instance, Hu et al. combined the XPS and XAS to demonstrate that pyrrolic type ligands contributed to maintaining the Fe sites as Fe3+ during CO2RR, which contributed to CO2 and CO adsorption [39]. It should be noted that only XPS cannot resolve the coordination environment of metal sites. 2.4 Mössbauer spectroscopy Mössbauer spectroscopy is another powerful technique to detect the local structure and electronic states of Mössbauer-active elements. For example, Li group performed Mössbauer spectroscopic to study the coordination structure of Fe–Co dual sites [40]. Typically, the Fe–Co dual sites catalyst consisted of three FeN4-centers, which were the Fe(II)N4 coordination with Fe(II) in a high-, intermediate-, and low-spin state, respectively. Especially, the singlet component of iron species suggested the presence of Fe–Co bond. Similar to XAS, the Mössbauer spectroscopy includes all types of metal sites in the catalyst. Thus, it may bring the difference in demonstrating the relationship between structure and activity. 2.5 Other characterization techniques Fourier-transform infrared (FTIR) spectroscopy is applied to research the chemisorption of probe molecules on different catalysts. The CO adsorption on transition metals can be with the linear (2030–2100 cm−1) and bridge (1750–1950 cm−1) configurations [41]. The bridging adsorption of CO indicates the presence of adjacent adsorption sites. Besides, the metal sites with cationic state would result in a blue-shift of the band position of linear COad [41]. Moreover, the in situ/operando IR spectroscopy, as well as Raman spectroscopy, has been widely applied for investigating the catalysis mechanisms. Besides, the inductively coupled plasma mass spectrometry (ICP-MS) is always used to confirm the metal content in DACs. Moreover, the theoretical simulation is also used to deduce the possible structures of DACs. The other unmentioned characterization methods for atomically dispersed catalysts can be seen in other reviews [20,21]. 3 Synthetic strategies The synthesis of DACs is more challenging because of their unique structural motifs and easy aggregation. This usually means the atomically dispersed dual-atomic-site must be strongly anchored on substrates. Thus, the surface coordination chemistry is crucial for the synthesis and activities of catalysts [21,42]. Here, we concisely summarize the currently reported routes for the synthesis of DACs. 3.1 High temperature pyrolysis High temperature pyrolysis is the general strategy to synthesize the SACs, and also the DACs, which has always employed the metal–organic frameworks (MOFs)/zeolitic imidazolate frameworks (ZIFs) as sacrificial templates because of their accessible ability to realize the atomically dispersed metal atom [43,44]. Wang et al. reported a host–guest design strategy to prepare the Fe-Co dual-site catalyst, which was synthesized via adjusting the bonding between Fe3+ precursors (guest) and Co nodes (host) within the confined space of Zn/Co bimetallic MOF (Fig. 4 a) [40]. And they also prepared the Fe–Co dual sites embedded in N-CNTs by the similar method [45]. Besides, the Zn–Co DAC was prepared through the coordination of metal ions with the amidogen and hydroxyl groups on chitosan chains, and then pyrolysis at 750 °C (Fig. 4b) [46]. Notably, this method can regulate the dispersion of metal atoms easily via the coordination, adsorption, and ion exchange, but the relatively low yields and poor reproducibility hinder its application in scalable synthesis of DACs. 3.2 Wet chemistry The wet chemistry method is typically low cost and easy synthesis to achieve atomic level dispersion. The wet chemistry synthesis process can roughly include introducing the precursors to the host (e.g., precipitation or impregnation) and then post-treatment, such as reduction, oxidation, or thermal treatment [47]. For example, Cu-Pt dual sites alloyed with Pd nanorings (Pd/Cu-Pt NRs) were prepared via introducing CuCl2·2H2O into Pd nanosheets, then introducing HCl solution with K2PtCl4 [48]. Besides, Li et al. used this method to prepare the copper atom-pair on Pd10Te3 nanowires (Fig. 4c) [49]. Especially, the wet-chemical methods always adopt a minor amount of metal precursors to produce atomically dispersed metal sites, but this is not always effective, and is also limited in precisely regulating the location of introduced atoms. 3.3 Electrochemical method The electrochemical method is mainly through electroplating target metal onto the conductive host. This always results in the deposited metal on the surface of supports, which is beneficial for improving the utilization of metal atoms and surface catalytic reactions. Hu et al. synthesized the Co–Fe double-atom catalyst (Co–FeNC) via the transformation of single-atom Co catalyst by this method (Fig. 4d) [50]. The activation process of CoNC can be proceeded in a “normal” KOH solution with a minor amount of Fe(NO3)3·9H2O. The possible formation process may be that the [Fe(OH)4]− species were absorbed on atomically dispersed Co sites under positive potential, resulting in the dimeric Co–Fe units. Moreover, the authors described that this transformation could also be used to prepare other Co/Fe/Ni-based DACs. However, the target catalysts may not be obtained by this method due to the other contaminants in solution, and the adhesion of atoms on the host should also be considered. 3.4 Atomic layer deposition Compared with pyrolyzing two metal precursors simultaneously, the atomic layer deposition (ALD) technique is beneficial for robust control of the structure and composition of catalyst though it always requires special equipment and harsh reaction conditions. Typically, the gas-phase metal precursor is taken to the reaction chamber, and then formed single atomic layer onto the prepared substrate with the help of a second gas reactant. The thickness of deposition can be finely regulated by simply changing the ALD cycles. After the first prepared Pt single atoms on graphene [51], Sun et al. fabricated the Pt-Ru dimers on NCNTs via a two-step ALD process recently, which was the first ALD process to synthesize single Pt atom on NCNTs, and then the second ALD process of Ru atoms. The pre-deposition of Pt was conducive to the subsequent deposit of Ru (Fig. 4e) [52]. Obviously, the DACs can be obtained easily via changing the number of ALD cycles, but this may also lead to produce other nanostructures, such as clusters and nanoparticles. 3.5 Chemical vapor deposition Only using chemical vapor deposition (CVD) to prepare DACs has not been reported, although Wu et al. have used CVD to synthesize the Fe/Co/Mn-based SACs [53]. However, Yang et al. combined the hydrothermal reaction and CVD to synthesize the O-coordinated W-Mo heterodimer anchored in N-doped graphene (W1Mo1-NG) (Fig. 4f) [54]. The hydrothermal reaction was first performed to form the W-Mo species on reduced GO. After freeze-drying, the W1Mo1-NG was finally prepared by CVD treatment. Moreover, the authors also demonstrated the formation mechanism of W1Mo1-NG, including the self-assembly, deoxidization, protonation, anchoring and nitridation (Fig. 4g). The other oxo-linked W-Mo DACs and homonuclear dimers based on Mo and W could also be synthesized by changing the synthesis process. The authors also suggested this synthetic strategy might be suitable for other polyoxometalates systems. Although the CVD process may be scalable for synthesis catalysts, it is still a self-limiting surface reaction, and always requires high temperature and additional treatment steps. 4 Advantages in different reactions 4.1 HER Hydrogen (H2), a clean energy carrier, has been considered a green avenue for alleviating the energy and environmental issues [55]. Thereinto, producing H2 from water splitting via the HER, which is driven by renewable energy resources, agrees well with future sustainable energy supply [56]. This process needs efficient electrocatalysts to improve the energy conversion efficiency. Currently, the research focus is reducing noble metal loading or exploring high-performance non-noble metal alternatives [57]. The efficient water splitting electrocatalysts should possess the low overpotential to achieve the 10 mA cm−2 (η 10), one important parameter to estimate the target electrocatalysts. Besides, the small Tafel slope and high exchange current density (j 0), which mean the superior reaction kinetics process, as well as the ultra-long stability are also needed. The overall HER process can be divided into three possible steps, which are the adsorption of H* (Volmer reaction) and then the H* desorption (Heyrovsky or Tafel reactions), thus forming two different mechanisms [58]. The mechanism can be deduced from the Tafel slope values. More importantly, from the Nørskov principle [59], the HER catalyst should exhibit the proper H* adsorption. This indicates the Gibbs free energy change of the H* adsorption (ΔG H*) should be close to zero [60]. Fortunately, DACs have the unique advantages for tuning the H* adsorption because of the special coordination structure. 4.1.1 Alloying effect Fabricating the atomic level Pt-based alloy catalysts is an attractive method to reduce the noble-metal loading and improve the intrinsic activity of each active site. For this purpose, the mentioned Pd/Cu-Pt NRs catalyst was designed for HER, which exhibited superior HER performance than commercial Pt/C in acidic solution, including the low onset potential of near-zero, 22.8 mV of the η 10, and Tafel slope of 25 mV dec−1. And the catalyst only needs the 50 mV overpotential to achieve the mass current density of 3002 A g−1 (Pd+Pt). DFT calculations demonstrated that the high HER activity was ascribed to the low adsorption of *H, better than that on Pt (111). The single Pt atom was confirmed as the H atoms binding site, and the neighboring Cu atoms further optimized the *H adsorption [48]. From this example, the atomic-level Pt-based alloy catalysts can improve the mass activity and tune the adsorption of intermediates simultaneously because of the size and alloying effects. Although the Pd/Cu-Pt NRs catalyst exhibited enhanced HER performance, the optimal composition of alloy is not clear. Therefore, screening the atomic level Pt-based alloy catalysts with the optimal H binding may be the focus of this field. 4.1.2 Regulating electronic structure The interaction of bimetallic dimer could generate a change in electronic structure, such as the metallicity transformation and electron delocalization, thus enhancing the catalytic performance. The Pt-Ru dimers on NCNTs were demonstrated to undergo the metallicity to covalence transformation, which exhibited superior HER activity with the overpotential of 50 mV to achieve the mass activity of 23.1 A mg−1 [52]. Theoretical studies showed that the superior HER activity was ascribed to the weak adsorption between the hydrogen and unoccupied d xz orbital of Ru. This work demonstrates the metallicity transformation of bimetallic dimer during HER process based on theoretical calculation and crystal field theory, deepening the understanding of bimetallic dimer catalysis, which may extend to other catalytic systems. The mutually optimizing the electronic states of DACs was also revealed in photocatalytic water splitting [61]. Especially, the single atom of Co and Pt on TiO2 with nonbonding Co–O–Pt dimers displayed a superior photocatalytic hydrogen evolution activity than Pt SAC and Pt clustered catalysts [62]. The enhanced performance was attributed to the mutually optimized electronic states of Pt and Co sites, thus weakening the H* binding. This result indicates the importance of nonbonding interactive dimer sites. Notably, this oxygen-coordinated nonbonding but interactive bimetallic dimer is not limited by electron-negativity and enthalpy, thus providing more opportunities for developing novel catalysts with new electronic states. But identifying such structures is a complicated process. The electron delocalization of the bimetallic dimer was demonstrated by the O-coordinated W1Mo1-NG [54]. The AC HAADF-STEM image displayed the isolated W–Mo atoms, and the enlarged W–Mo atomic distance indicated the other atom was introduced. Combined with the WT results at Mo K-edge and W L3-edge, as well as the DFT calculations, the authors deduced the most possible structure of this catalyst was W–O–MoOC configuration (Fig. 5 a–f). Due to this synergistic interaction of dual atoms, the W1Mo1-NG catalyst displayed the Pt-like HER activity, including the low onset potential of near-zero and 26, 24, and 67 mV of the η 10, Tafel slope of 30 and 45 mV dec−1, the j 0 of 1.78 and 0.26 mA cm−2, as well as high stability in acidic and alkaline media, respectively. DFT results demonstrated the electron delocalization of W–O–MoOC configuration in W1Mo1-NG provided the optimal ΔGH* and boosted the HER kinetics by reducing the energetic barrier and improving the electrical conductivity, thus synergistically promoting the HER activity (Fig. 5g–i). This work emphasizes the importance of electron delocalization in optimizing the adsorption behavior of H*, which should also be suitable for other catalytic reactions. From these results, the DACs can not only improve the mass activity of precious metals, but also contribute to optimizing the ΔG H* by the alloying effect and regulation of electronic structure, thus synergistically enhancing the activity. Thereinto, the electronic structure regulation can result in the transformation from metallicity to covalence, and the electron delocalization can provide the desirable ΔG H* and enhance reaction kinetics. Thus, applying the DFT calculations to screen and fabricate the Pt or non-precious metal-based DACs with the optimal ΔG H* should be the focus of the further research. 4.2 OER The OER has a crucial influence on electrochemical energy conversion systems [63,64]. And the OER is known as the critical bottleneck for water splitting due to its sluggish kinetics [65]. This leads to that the OER catalysts always exhibit a high overpotential of 300–400 mV. Therefore, tremendous works are to develop efficient OER electrocatalysts to reduce the overpotential. The Co/Fe/Ni-based metal compounds are one of the most efficient heterogeneous OER catalysts in alkaline electrolyte because of the synergy effect of different metals [66–68]. However, the real active center and reaction mechanism are always ambiguous due to the complicated structure of these heterogeneous catalysts. Typically, the OER is a four-electron oxidation reaction and involves the *OH, *O, and *OOH intermediates. Recently, the viewpoint of synergy effect deriving from different components in the same multi-component catalyst has drawn more and more attention [69]. This indicates that if the elementary reactions can proceed on different active sites, the whole reaction process will be out of the limiting between the single active sites and multiple intermediates, which will maximumly accelerate the reaction process. Therefore, one of the critical strategies to fabricate the efficient OER catalysts is how to break this scaling relationship. The DACs may contribute to resolving this issue, and also provide a simple and clear structure model of dual active sites for the fundamental studies. 4.2.1 Synergy effect The synergy effect of DACs for OER is ascribed to the dual atom sites for different intermediates’ adsorption/desorption. For example, the N-coordinated Ni-Fe sites on polymeric carbon nitride (PCN) were prepared for OER [70]. The Ni-Fe dual sites were deduced from the HAADF-STEM image, XAS analysis, Fe Mössbauer spectra and electron paramagnetic resonance (EPR) measurements. And this catalyst showed a low η 10 of 310 mV and small Tafel slope of 38 mV dec−1 in 1 M KOH. DFT calculations demonstrated the high activity was attributed to the synergistic effect of adjacent Ni and Fe atoms, which served as different active sites for intermediates, leading to a low energy barrier. This work shows that using different types of active sites to adsorb different intermediates could make the elementary reaction proceed smoothly. This is an enormous advantage for DACs, which should be given much attention when designing catalysts for multiple intermediates. Besides, the bimetallic SAC may occur the structural reconstruction into a dual-site catalyst under working conditions. For example, the single Ni sites promoted the structural reconstruction to form the Ni–O–Fe bonds in NiFe SAC through the in situ XAS characterization during water oxidation, which created the spin channels for electron transfer [71]. And a dual-site pathway for OER was provided, which was that the deprotonation of *OH occurred at both Ni and Fe sites, thus forming the O2 on adjacent dual sites (Fig. 6 ). This manifests the structural reconstruction or evolution of the catalyst under working condition. Therefore, revealing the real active site through in-situ characterization techniques contributes to the design of efficient DACs. 4.2.2 Fundamental study platform The DACs provide excellent platforms for OER mechanism study as the complex heterogeneous nature of the Co, Fe, and Ni-based metal oxides [72]. Hu et al. fabricated the Co/Fe/Ni-based DACs from corresponding SACs via an electrochemical method [73]. The distance of these dimers in AC HAADF-STEM images was in the range of 2 to 3 Å, suggesting the Ni–Fe dimer was bridged by oxygen, and this was consistent with the result of EXAFS data. The operando XANES spectra showed the Fe(IV) species were formed in Ni–FeNC under OER conditions (Fig. 7 a). And the authors used the operando K ß high-energy-resolution fluorescence detected (HERFD)-XAS to investigate the characters of frontier orbitals and the bonding state (Fig. 7b), which showed the hybridization between 2p(N/O) and 4p(Ni) states led to the electronic transition from a metal to ligand. The number of Fe ions reached about 25% based on operando HERFD-XAS (Fig. 7c and d). And adding one metal atom to other catalysts can obviously increase the TOFs (Fig. 7e). Finally, the possible reaction mechanism was proposed (Fig. 7f). The Ni(II) ion was firstly oxidized to Ni(III) (S0 → S1). The next step was that the Fe(III)–OH was oxidized to Fe(IV) = O (S1 → S2). The rate-determining step (RDS) was the Fe(III)–OOH formation (S2 → S3). The last step was the O2 formation and regeneration of the Ni(II)–Fe(III) (S3 → S4 → S0). This research not only demonstrates the advantage of bimetallic cooperation in DACs, but also provides the further understanding of heterogeneous catalysts with high OER performance, such as the presence of unusual high valence species (Fe(IV) = O, etc.). From the above examples, the DACs have great potential in multi-intermediates reactions due to the synergy effect, especially that the dual metal atom sites can adsorb different intermediates simultaneous, thus making the elementary reaction proceed smoothly. Besides, the special structural advantage of DACs makes them as attractive platforms to explore the OER mechanism on heterogeneous electrocatalysts, which may extend to other catalytic system. The following research may focus on bimetallic cooperation, stability improvement, and mechanism study to design effective catalysts. The DACs based on the Ru or Ir could also be considered. Various of DACs can exhibit bifunctional oxygen electrocatalysis. We will be discussed below. 4.3 ORR The ORR is of utmost importance in fuel cells and metal-air batteries, which are known as vital techniques to resolve the environmental and energy problems [74,75]. However, the application of these techniques is still restricted by the sluggish ORR kinetics, which was induced by the difficulties in O2 adsorption, OO bond activation/cleavage and oxygen intermediates adsorption/desorption [76]. And the ORR can also undergo a two-electron reduction pathway to form H2O2, an important industrial chemical, but this is not desired for above techniques because of the low efficiency of chemical energy conversion and corrosion of the equipment. Pt and its alloys are still the most efficient ORR catalysts, but the properties of noble metals hinder their large-scale application [77]. Thus, developing highly effective low Pt loading or Pt-free catalysts is still the research focus, especially in acidic conditions. In contrast with OER, the ORR also consists of four-electron processes for the O2 reduction to H2O or OH− with the possible OOH*, O*, and OH*intermediates. To boost the sluggish ORR kinetics, the ORR catalysts should be beneficial for O2 adsorption and activation, microenvironmental regulation, and adsorption or desorption of intermediates. Experimentally, the half-wave potential (E 1/2) and mass-transfer-limited current density (j L) are widely used to evaluate the ORR electrocatalysts. The reaction mechanism can also be deduced from Tafel slope. Besides, the transfer number (n), obtained from the Koutecky-Levich equation, is often used to estimate the ORR process. Thanks to the interaction of dual metal atom sites, unique coordination environment, and optimized charge distribution, the DACs display great potential in this field. 4.3.1 Boosting oxygen dissociation Elongating the OO bond is beneficial to its dissociation and thus improves the ORR efficiency [78–80]. DACs have the unique structural advantages for elongating the OO bond due to their adjacent bimetal atom active centers. For example, Yan et al. synthesized the Fe and Cu dual atoms immobilized on N-doped hollow carbon nanospheres (FeCu-N-HC) catalyst, and used the DFT calculations to demonstrate proper adsorption of *OO on the FeCuN6 structure could elongate the OO bond from 1.21 to 1.39 Å [81]. Similarly, the Fe–Co dual sites embedded on NC ((Fe,Co)/NC) [40], and the Zn–Co atomic pairs coordinated on NC (Zn/CoN–C) [46] were also demonstrated to elongate the OO bond to 1.40 and 1.43 Å, respectively. Besides, Xing et al. showed that the triangular FeCoN5-OH provided an optimal eg-orbital energy level for Fe to empower easy intermediate desorption, and a geometry configuration for OO adsorption, which could elongate the OO bond to 1.35 Å, thus facilitating the cleavage of OO bond [82]. Although these studies all demonstrate the elongated OO bond because of the bimetal dimer, the discussion of interactions between the intermediates and active sites, such as the electronic state, is not sufficient. Altering O2 adsorption configuration to effective activation of OO bond can also contribute to oxygen dissociation [83]. The number of clustered Fe atoms could change the O2 adsorption from superoxo-like to peroxo-like configuration toward better activation [84]. And Xie et al. synthesized the planar-like Fe2N6 structure via coupling isolated FeN4 sites [85]. From the operando XAS measurements results (Fig. 8 ), the authors reported that the planar-like Fe2N6 was changed from O x –Fe3+–Fe2+ to Fe2+–Fe2+. The adjacent Fe atoms could each adsorb an oxygenated intermediate to form a dual-side adsorption. Moreover, the authors suggested this redox transition contributed to optimizing oxygen intermediate adsorption and breaking OO bond. Notably, the change of O2 adsorption configuration is the deduced result, which is always relied on the theoretical calculation and data fitting, lacking solid evidence. Overall, fabricating the DACs to elongate the OO bond and/or alter O2 adsorption configuration is beneficial to enhance the ORR performance. 4.3.2 Regulating electronic structure The atomic M−M’ coupling can lead to the asymmetric of charge distribution around metal dimers, thus adjusting the adsorption/desorption properties of intermediates to improve the ORR performances [86–88]. The atomic Pt–Co NCbased catalyst was prepared by pyrolysis the Co–MOF and then electrochemical activation process [89]. The possible configuration is the (Co-Pt)@N8V4 deduced from the XAS and DFT calculations. The high performance was ascribed to the asymmetry in charge redistribution around Pt–Co centers and the d orbital up-shifting. Similarly, Sun et al. synthesized the Au–Co dual atoms via combining the host–guest and chemical doping strategies, which also demonstrated this encouraging way to fabricate effective electrocatalysts via regulation of D-orbitals symmetry [90]. Obviously, heteronuclear DACs can easily result in this asymmetry of charge distribution of metal dimers, which may have great application in optimizing the adsorption and desorption of intermediates. Introducing the other transition metals with the 3d unoccupied/filled orbitals into the Fe-based SACs can change the electronic structure of active sites [91]. Zhang et al. implanted the Mn–N moieties into Fe/NC to fabricate the atomically dispersed Fe,Mn/NC electrocatalyst by the pyrolysis process [92]. The most possible structure was Fe,Mn/N6–1 model deduced from the AC-STEM, XAS, and DFT simulation. The 57Fe Mossbauer spectroscopy analysis demonstrated the FeIII with the medium-spin structure was predominantly in the catalyst. And the magnetic susceptibility measurement confirmed the low-spin state of neighboring MnIII moieties led to electron delocalization of FeIII and made the spin state of FeIII transition from low spin (t2g5eg0) to intermediate spin (t2g4eg1). This one eg electron filling could penetrate the antibonding π-orbital of oxygen easily, realizing the activation of oxygen (Fig. 9 a–c). DFT calculations further revealed the Fe,Mn/NC could interact with oxygen properly, thus improving the reaction kinetics of ORR. Similarly, Li et al. used the systematic theoretical calculations on protonation free energy to finalize the Fe–Zn pair as the focused catalyst from five metallic elements (Fig. 9d–i) [93]. The introduction of Zn into diatomic sites can change the electronic structure and occur the transition from a semiconductor to half-metal, resulting in spontaneous spin-polarized electrons populated at the Fermi level. Moreover, the elevated protonation energy barrier and sacrificial Zn–N bond breakage can preserve the active center of FeN4, thus improving the durability of Fe-based DACs. These studies emphasize the effect of the change in spin state and spin-polarized electrons for the catalytic reactions, further deepening the understanding of electronic structure regulation. Besides, the electron accumulation through the charge transfer from the transition metal (3d orbitals) to the oxygen (2p anti-bonding orbitals) was demonstrated on the diatoms N3–Fe–Co–N3 structure, which was fabricated via electrospinning and then pyrolyzing [94]. DFT calculations demonstrated the intrinsic defects further promoted the ORR activity by reducing the energy barrier of the O* dissociation. From the above examples, the M−M’ coupling in DACs can result in the obvious change of electronic structure, such as the asymmetric of charge distribution, change in electrical conductivity, and electron accumulation, thus enhancing the catalytic performance via optimizing the adsorption/desorption of intermediates. 4.3.3 Synergy effect The enhanced ORR performance of the DACs is always the result of synergy effect, not only the effect of one aspect [95]. For example, the Co–Fe dual sites on NC were prepared by the carbonization and chemical etching, which was characterized by the HAADF-STEM, EELS, XAS, and DFT calculations [96]. Besides, the authors used the high-energy X-ray diffraction with atomic pair distribution function analysis to probe the structure of both local catalyst environment and host, and the bond information of M−N agreed with the EXAFS results. Moreover, the calculated XANES spectra fit well with the experimental XANES. Theoretical calculations demonstrated that the Co–Fe dimers could provide a low adsorption free energy for O2 through a side-on mode, which could elongate the OO bond to 1.44 Å. Further calculations revealed the ORR activity was attributed to the proper oxygenated species adsorption energies and the strong orbital interactions between the O2 and Co–Fe dimer sites. For the reactions with multiple intermediates, the DACs may provide the synergic cascade mechanism to promote the reaction process. Zhang et al. provided a dual-site cascade mechanism on the Fe/Mn–N x –C catalysts during the ORR process, which was prepared by pyrolysis of the ZnO@PDA–FeMn precursor [78]. Theoretical calculations revealed the synergic mechanism was that the first step of ORR occured on Fe–N x –C site, then the intermediate *OH transferred to adjacent Mn–N x –C site, thus enhancing the adsorption of *OH on Fe–N x –C site. It is worth noting that such synergic cascade mechanisms may have a great influence on reactions with multiple intermediates, which should be considered in the design of catalysts. Especially, the DACs can exhibit the high catalytic performance for OER and ORR simultaneously because of the synergy effect and electronic structure regulation, thus showing the excellent property in Zn-air battery [71,97–106]. Chen et al. prepared the Ir–Co atomic pair via the bimetallic organic framework encapsulation and then pyrolysis, which displayed the E 1/2 of 0.911 V and 330 mV overpotential at 10 mA cm−2 for OER, as well as the cyclability over 450 cycles in Zn–air battery [98]. DFT calculations demonstrated the synergy effects of this atomic pair site, in which the d-orbital energy level of Co was tuned by the incorporation of Ir atom. Finally, the low occupancy of d z 2 orbital contributed to forming the Co–O σ bond, thereby promoting reaction kinetics (Fig. 10 ). The advantages of DACs for ORR can be reflected in elongating the OO bond length, tuning electronic structure of active sites, and the synergy effect. Elongating the OO bond is beneficial to its following dissociation. Tuning electronic structure can optimize the adsorption/desorption property of intermediates, and then promoting the reaction occurring. And the synergy effect that both weakening OO bond and tuning the electronic structure or constructing the cascade reaction can accelerate the reaction process. Thus, the construction of efficient DACs for ORR should consider the above factors comprehensively. Moreover, the optimal metal diatomic combination can be screened by theoretical prediction. 4.4 CO2RR The electroreduction of CO2 to value-added fuels and chemical feedstocks provides an appealing strategy to alleviate the environmental and energy problems [107]. However, the CO2RR is a multielectron-proton transfer process involving various intermediates, corresponding to many reduction products [108]. But the relatively easier process of competitive HER results in the poor selectivity of CO2RR in aqueous electrolyte. Therefore, constructing the efficient catalysts with high selectivity and durability is crucial for practical application of CO2RR. For this reaction that includes multiple reduction products, the faradaic efficiency (FE) is an important parameter to evaluate the electrocatalyst, which is also directly used as the descriptor of the selectivity for CO2RR. For the 2e− products (CO and HCOOH), partial electrocatalysts have exhibited nearly the FE of 100% [109,110]. But for these more electron products, especially the higher alcohols, which have the higher potential application value, the CO2RR performance of current electrocatalysts is unsatisfactory. This is mainly attributed to the complicated intermediates and reaction process, leading to the presence of many competitive reactions [111]. From this aspect, the DACs have the unique advantages in optimizing the adsorption/desorption of intermediates and reaction pathways. 4.4.1 Facilitating CO2 adsorption/activation Optimizing the CO2 adsorption contributes to accelerating the sluggish kinetical reduction process [112]. Cobalt diatomic site catalyst was prepared by pyrolyzing supramolecular precursors, and the atomic structure of a Co2-N coordination was determined by the AC HAADF-STEM, XAS and theoretical analyses [113]. Thereinto, the obtained CoDAC containing 3.5% Co atoms exhibited high CO2 photoreduction performance with 65.0% CH4 selectivity, superior to that of CoSAC. The CoDAC with strong chemical adsorption of CO2 based on the CO2 temperature-programmed desorption was attributed to adjacent Co atoms, which provided dual sites to adsorb the C and O atoms simultaneously. And the STM images indicated the hybridization between the Co (d orbital) and C and O atoms (p orbitals). Moreover, the CO* intermediates easily became the CHO* rather than direct desorbing based on the in-situ FTIR, thus resulting in high CH4 selectivity. Theoretical analysis demonstrated that the charge enrichment of dual-atom Co sites contributed to optimizing the adsorption of the rate-limiting COOH* and CHO* intermediates and reducing the activation energy barrier. This study provides the comparison in catalytic performance between CoDAC and CoSAC, and the huge performance difference confirms the advantage of DACs from the side. The efficient CO2 activation can also enhance the sluggish kinetics reaction [114]. One representative example is the Cu atom-pair catalyst [49]. The Cu1 0-Cu1 x + pairs were confirmed by the AC HAADF-STEM, XAS, and theoretical calculations. Experimental and theoretical results suggested the Cu1 0-Cu1 x + site promoted the CO2 activation via a ‘biatomic activating bimolecular’ mechanism, which was that the Cu1 x + with adsorbed H2O molecule could stabilize the CO2 chemisorbed on neighboring Cu1 0 (Fig. 11 ). This resulted in a FECO of over 92%. This work demonstrates the different active sites to adsorb different molecules can reduce the activation energy, and this atomic level interface design may provide new opportunities for other more complex catalytic reactions. Thus, optimizing the CO2 adsorption and activation is beneficial for accelerating the reduction process, which provides the guide to design the DACs. 4.4.2 Regulating electronic structure The interaction of adjacent diatom provides the opportunities to adjust the electronic structure of active sites [36,115–122]. For example, the Ni-Zn dual-atom sites coordinated with NC, confirmed by AC HAADF-STEM and XAS characterizations, were prepared by carbonization and acidification [36]. Theoretical calculations revealed that Ni–Zn coordination modified their d-states, strengthening the electronic interaction between the intermediate and catalyst, which led to reduce the energy barrier of thermodynamic and activation energy. These advantages endowed this catalyst with a high FECO of > 90% in the wide voltage window. Similarly, the electron transfer/redistribution between the adjacent metal sites was also demonstrated in other DACs for CO2RR, such as Ni/CuNC [115], NiSn atomic-pair [116], Pd2 DAC [117], and Zn/CoNC [118], which all revealed the electronic structure regulation resulted in optimizing the intermediates adsorption, reaction barriers and pathways, finally facilitating the CO2RR. The d-d orbital coupling of metal dimer can induce the change of electronic structure. The Ni–Fe dual-atom anchored on NG was prepared for CO2RR and OER by pyrolysis and acidification [120]. Experimental and theoretical analyses demonstrated the Fe in Ni–Fe heteroatomic pair was the catalytic center, and the strong d-d orbital coupling with Ni resulted in decrease of orbital energy levels and electron delocalization, weakening the *CO binding strength. Meanwhile, the electron transferred from Fe to Ni and N, resulting in the Fe center with the large Bader charge and high oxidation state, promoting CO2 activation and CO desorption (Fig. 12 ). These advantages synergistically boosted CO2RR and OER performance. This work provides systematical discussion about the electronic structure regulation, rather than focusing on only one aspect. Similarly, the Fe acted as the active site and Cu acted as the activity promoter were also demonstrated by DFT calculations on dual-atom Cu/Fe–NC [123]. And from another perspective, the regulation of electronic structure can also make the bimetallic atoms serve as different active sites for different reactions [124], such as the Zn–Ln dual atomic catalysts to obtain syngas, where the Zn and La sites were responsible for the generation of CO and H2, respectively [121]. The tuning of electronic structure can lead to the electron transfer/redistribution and decrease of orbital energy levels, contributing to the CO2 activation and the adsorption/desorption of intermediates. Especially, the regulation of electronic structure makes the bimetallic atoms as different active sites for different intermediates, which should be paid attention. 4.4.3 Synergy effect For the multiple intermediate reactions, dual active sites can always exhibit the synergy effect for the adsorption/desorption of intermediates [33,125–127]. For example, the diatomic Ni–Fe sites on NC were prepared by pyrolysis [128]. The coordination structure of N3–Ni–Fe–N3 was deduced from the AC HAADF-STEM, XAS and theoretical simulation. DFT studies showed that the neighboring Ni–Fe centers synergistically decreased the reaction barrier for the COOH* formation and CO desorption, and one CO pre-adsorption mechanism was proposed (Fig. 13 a). Similar synergy was also reported on the Fe–Cu diatoms (Fig. 13b and c) [129]. Besides, the synergy effect of dual-atom active sites was studied by DFT calculations [130], and the results were that Fe-(Fe, Co, Ni, Cu)@C2N tended to form C2H4, while the Cu-(Co, Ni, Cu)@C2N was beneficial for CH4 formation, and the binding strength of co-adsorbed *CO + *CO was important for CO2 electroreduction to C2 products (Fig. 13d and e). Although the theoretical prediction has proven the high performance of DACs in this field, the experimental results of current catalysts are unsatisfactory. Importantly, the synergy effect of DACs can be reflected in the whole reduction process. Zhang et al. fabricated the Ni dual-atom sites with the N3–Ni–Ni–N3 structure based on the results of AC HAADF-STEM, EELS, XAS and theoretical simulation [33]. Combining the theoretical calculations and in situ XAFS measurement, they revealed the Ni2N6OH functioned as the real active sites for fast CO2RR kinetics and slow HER kinetics. And the synergy effect was reflected in that OHad made the Ni dual-atom sites with an electron-rich catalytic environment, thus promoting the CO2RR process by optimizing CO2 activation, *COOH formation, and *CO desorption. Notably, this work also discloses the effect of DACs in the regulation of the catalytic microenvironment, which can influence the selectivity of the reduction product. Thus, fabricating the DACs to synergistically regulate the CO2 activation, the adsorption/desorption of *COOH and *CO intermediate, the competing reaction of HER, can boost the performance of CO2RR. 4.4.4 Breaking scaling relations Theoretical analysis revealed the DACs with multiple active sites could break the scaling relations of active sites and intermediates towards CO2RR [131–133]. For example, ten heteronuclear and five homonuclear graphene-based dual metal catalysts (a N3–M1–M2–N3 moiety) were also discussed for CO2RR [132]. Three DACs (Cu–Mn, Ni–Mn and Ni–Fe) were considered as promising catalysts after screening via calculating the adsorption strength of OH* and COOH* species. Moreover, the linear relationship between the ΔG COOH* and ΔG CO* values was absent for DACs, leading to a high activity for CO2 electroreduction to CO, and the reason of this was attributed to that the adsorption of COOH* on DACs was bidentate, and CO* was monodentate. However, breaking of scaling relationship may be unsuitable for all the DACs because of the complex adsorption structure. Besides, twenty-one kinds of heteronuclear transition-metal dimers embedded in monolayer C2N were studied by theoretical calculations [131]. The results showed that the binding energy of the key intermediates on metal dimers was completely decoupled, leading the absence of the limitation of overpotential. And the proper dual-metal atoms could serve as the *C and *O binding sites respectively, which resulted in breaking the above-mentioned scaling relations. Based on the structural stability, activity (the binding energies of *COOH, *CO, and *CHO), and selectivity (the difference of limiting potentials for CO2RR and HER, UL(CO2)-UL(H2)), the CuCr/C2N and CuMn/C2N were regarded as promising catalysts for CO2 electroreduction to CH4 (Fig. 14 ). Besides, the Pt2, AgNi, Pd2, and AgPt supported on defective graphene were also reported as the promising candidates for CO2 electroreduction to CH4 by the first-principles approach, which also emphasized the importance of breaking scaling relations [133]. The adjacent dual active centers could easily break the scaling relations in the adsorption energies of different intermediates, thus reducing the limiting potential. From these results, fabricating the multiple active sites to break scaling relations is an efficient strategy to enhance the performance of multi-intermediate reactions. However, current research in this field mainly focuses on theoretical aspect, with little emphasis on experimental research, which might be paid much attention. 4.4.5 Promoting the CC coupling The adjacent bimetallic atoms in DACs may provide the proper active sites for CC coupling, which is always regarded as the RDS for C2 products [134]. Zheng et al. prepared the atomically dispersed Cu–N x catalyst to tune selectivity via changing Cu doping concentrations [135]. Experimental results showed that adjacent Cu atoms were beneficial for CC coupling and produced C2H4, while single atom site was favored for CH4 formation. DFT calculations confirmed two adjacent Cu-N2 sites contributed to forming C2H4 by two *CO binding, but the isolated/neighboring Cu–N4 and isolated Cu–N2 sites favored CH4 formation. Besides, Experimental and mechanistic investigation verified that the Cl- bridged dimer Cu units resulted in charge enrichment on the surrounding Cu centers, which provided moderate adsorption energy to realize the CC coupling [136]. Theoretically, the adjacent Cu atom should have great potential in realizing the CC coupling, but the research of CC coupling on DACs to obtain the multi-carbon hydrocarbons and oxygenates is not enough, which may be the focus of this field. 4.4.6 Ideal machine learning platform The relatively definite active sites and coordination environment of DACs provide proper platform for catalyst screening [137,138]. Sun et al. chose six crucial adsorption intermediates (CO, COOH, CHO, H, O and OH) to screen the efficient CO2RR catalysts based on the DFT and microkinetics modeling (Fig. 15 ) [139]. As a result, the Cu2, CuMn, and CuNi dimers on graphene with adjacent single vacancies (labeled as XY@2SV), exhibited high performance for CO2RR. Thereinto, Cu2@2SV preferred CO generation, and MnCu@2SV was selective toward CH4 formation, while NiCu@2SV promoted CH3OH production. It is worth noting that this large-scale screening-based DFT and machine learning will accelerate the discovery of efficient CO2RR catalysts, thus providing guidance and motivation for experimental research. Obviously, DFT calculations combined with active machine learning can also expand to other catalytic systems, which will undoubtedly become the research focus. From above examples, we conclude the DACs have great advantages in this multiple intermediates and pathways reaction. And the applications of DACs in CO2RR have exhibited the advantages of facilitating CO2 adsorption and activation, regulating electronic structure, synergy effect, breaking scaling relations, promoting the CC coupling, and ideal machine learning platform. Thereinto, the application of DACs for CO2RR to C2+ products, especially the Cu-based DACs, may become the focus of future research, and the adjacent bimetallic active centers of DACs bring great possibilities in tuning the intermediates adsorption/desorption and constructing the tandem reactions. 4.5 NRR The NRR is considered a promising approach for the ammonia synthesis with respect to the Haber-Bosch process with high energy consumption [140]. However, the N2 molecule is highly stable because of the strong triple bond and large energy gap [141,142], thus the reaction kinetics is much sluggish. Besides, the partial current density of NRR is very small due to the serious competing HER, which indicates the minute ammonia yield easily suffers from the ubiquitous contaminants plague during experimental practices. Thus, seeking the high-efficient catalysts to increase the real ammonia yield in an order of magnitude is still the focus of research in this field. Currently, the NRR is considered to proceed the dissociative or associative reaction mechanisms [5]. But the N2 activation on the active center is always considered as the potential-limiting step [143]. The efficient NRR catalysts should be beneficial for N2 activation and the subsequent hydrogenation steps, and while suppressing the HER process. The application of DACs in NRR mainly concentrates on the N2 activation and reducing the rate-determining step barrier. 4.5.1 Boosting N2 activation The special metallic diatom is beneficial for the chemisorption of N2 and activation of stable NN bond. The diatomic Pd–Cu sites on NC were prepared by a dissolution-and-carbonization method to prove this point [144]. The AC HAADF-STEM, XAS, and DFT calculations suggested the PdN2CuN2_556 structure was the active center to facilitate NRR. The Cu introduced could shift the partial DOS of Pd, thus promoting the d-2p* coupling between Pd and adsorbed N2. This would enhance the chemisorption and activated protonation of N2, as well as suppressed HER, eventually enhancing the selectivity of NRR by reducing the energy of the potential-determining step (PDS). Similarly, the Zn–Fe atomic pairs anchored on NC [145] and the atomic Fe and Mo dimers on defect-rich graphene [146] also demonstrated the favorable of N2 activation and reduction in the barrier of PDS. Although these studies have demonstrated the advantages of DACs in NRR, the catalytic performance is still far from satisfactory. Thus, screening the optimal dual metal atoms to effectively activate the stable NN bond is worth studying. 4.5.2 Reducing the rate-determining step barrier DFT calculations also demonstrated that the adjacent metal dimers are beneficial for optimizing the adsorption/desorption of NRR intermediates, thus reducing the RDS barrier. For example, DFT calculations revealed the metal dimers (Cr, Mn, Fe, Co, and Ni) anchored on C2N were superior to their SAAs. Thereinto, the Mn2-C2N endowed the highest catalytic activity with the lowest RDS potential of − 0.23 V (NHNH2* + H+ + e− → NH2NH2*) [147]. Another theoretical prediction showed the binary FeRh on N-doped porous graphene was the best catalyst because of its lowest limiting PDS potential for the N2H* species formation [148]. Besides, the first principles high-throughput screening based on five-step criteria, which were the high thermodynamic stability, sufficient N2 activation, low energy cost, and high NRR selectivity, was performed among 23 transition metal centers to discuss their NRR performance. And only Fe2/g-CN can satisfy above screening criteria (Fig. 16 ). Moreover, the authors found the limiting potential was related with the electron donation from transition metal to N2, thus determining the N2 activation and *NH3 formation [149]. Unfortunately, these conclusions are all the results of theoretical calculations, and there is no experimental data to prove the efficiency of these catalysts. Although some encouraging results have been obtained, there are still many challenges in the NRR. The N2 activation, nitrogen scaling relations, and the competing HER process seriously limit the activity of NRR catalysts. The DACs for NRR have exhibited advantages in N2 activation and reducing the RDS barrier. Thus, designing the proper DACs based on the above DFT calculation will accelerate the investigation process of efficient catalysts, and the innovation of catalytic system of NRR is also crucial for improving the catalytic performance, which may the focus of future research. 5 Conclusions and perspectives Overall, this review has mainly summarized the advantages of DACs for different catalytic reactions. A detailed comparison of their catalytic performances is listed in Table S1. Based on the above experimental and theoretical results, some significant conclusions are obtained: (i) The adjacent dual metal atoms provide the co-adsorption sites for the molecule, which is beneficial for the molecule activation by elongating the chemical bond or adjusting adsorption layout, etc. (ii) The strong interaction of dual metal atoms contributes to regulating the electronic structure, resulting in the covalence transformation or electron delocalization, thus optimizing the adsorption/desorption of intermediates to promote the reaction process. (iii) For the reaction of multiple intermediates and steps, the synergy effect of DACs can be reflected in breaking the scaling relations and/or constructing the cascade reaction to accelerate the reaction process. (iv) The molecular nature of active sites and the relatively definite structure of DACs make them as attractive platforms to study the reaction mechanism or screen for efficient catalysts. Furthermore, compared to other small size catalysts, the DACs can guarantee the atomic utilization while providing a relatively simple and clear coordination structure, which is important in designing catalysts and constructing theoretical models to study mechanisms. Despite the great potential in this field, the development of DACs still faces several major challenges. Here, several critical challenges and research directions for the future development of DACs are discussed below. (i) Breakthroughs in characterization techniques. Currently, the structures of DACs are all deduced from the AC STEM, XAS, and theoretical analysis. However, the above characterization techniques have their drawbacks, making it difficult to accurately characterize the dinuclear structure. Thus, more solid evidence to verify the dual-atom structure precisely is urgently needed. Besides, the remarkable performance difference compared to SACs or clusters might also be the sideways evidence for DACs, which should be provided if possible. (ii) Clarifying the synthesis mechanism clearly. The catalysts with only dual-atom structure have not been reported so far, and most reported studies only provided the synthesis procedure, but the mechanism or the reasons for synthesis of DACs are ambiguous. This may require to clarify the effects of ligands, coordination environment, and structural evolution in forming the DACs, etc. Clarifying the synthesis mechanism exactly contributes to improving the ratio of dimer structure and repeatability, which are worth much attention. Thereinto, designing the precursors with special coordination structures while monitoring the diatom formation process with in situ ESTEM during pyrolysis is an appealing method for controlled DACs synthesis. Besides, the ALD technique with special substrates to adjust the atom deposition and/or combined with other treatments may also be a good choice. (iii) Revealing the active sites under working conditions. The structures of catalysts always undergo the reconstruction/evolution during the reaction process. Revealing the real active sites under realistic reaction conditions plays a key role in understanding the reaction mechanism, which mainly relies on in-situ characterization techniques (in-situ Raman, IR, XAS, etc.). The application of in situ characterization techniques to monitor the structural reconstruction/evolution, including the coordination structure, valence state, etc., thus revealing the real active sites to clarify the reaction mechanism is always the focus of frontier research, which is also beneficial to design the effective catalysts. (iv) Combining the machine learning and DFT calculations. To accelerate the discovery of efficient catalysts, the machine-learning accelerated, high-throughput DFT framework is strongly suggested to be used to screen materials and explore the activity origin, as well as the design principles for DACs for different reactions. The combination of them will no doubt accelerate the optimizing process of catalysts, which should be considered for the future research. Although there are many challenges, the DACs are still worthy of attention due to their great advantages. Declaration of competing interest The authors declare that they have no known competing financial interests or personal relationships that could have appeared to influence the work reported in this paper. Acknowledgments The authors acknowledge the financial support from the Natural Science Foundation of Shandong Province (Nos. ZR2021QE096, ZR2021MB101, ZR2021ME113 and ZR2021ME177). Appendix A Supplementary material Supplementary data to this article can be found online at https://doi.org/10.1016/j.jechem.2023.01.021. Appendix A Supplementary material The following are the Supplementary data to this article: Supplementary data 1 References [1] W. Guo K. Zhang Z. Liang R. Zou Q. Xu Chem. Soc. Rev. 48 2019 5658 5716 W. Guo, K. Zhang, Z. Liang, R. Zou, Q. Xu, Chem. Soc. Rev. 48 (2019) 5658-5716. [2] W. Yuan Y. Ma H. Wu L. Cheng J. Energy Chem. 65 2022 254 279 W. Yuan, Y. Ma, H. Wu, L. Cheng, J. Energy Chem. 65 (2022) 254-279. [3] K.H. Liu H.X. Zhong S.J. Li Y.X. Duan M.M. Shi X.B. Zhang J.M. Yan Q. Jiang Prog. Mater. Sci. 92 2018 64 111 K. H. Liu, H. X. Zhong, S. J. Li, Y. X. Duan, M. M. Shi, X. B. Zhang, J. M. Yan, Q. Jiang, Prog. Mater. Sci. 92 (2018) 64-111. [4] P.D. Luna C. Hahn D. Higgins S.A. Jaffer T.F. Jaramillo E.H. Sargent Science 364 2019 6438 P. D. Luna, C. Hahn, D. Higgins, S. A. Jaffer, T. F. Jaramillo, E. H. Sargent, Science 364 (2019) 6438. [5] H. Zhong M. Wang G. Chen R. Dong X. Feng ACS Nano 16 2022 1759 1780 H. Zhong, M. Wang, G. Chen, R. Dong, X. Feng, ACS Nano 16 (2022) 1759-1780. [6] Y. Wang H. Su Y. He L. Li S. Zhu H. Shen P. Xie X. Fu G. Zhou C. Feng D. Zhao F. Xiao X. Zhu Y. Zeng M. Shao S. Chen G. Wu J. Zeng C. Wang Chem. Rev. 120 2020 12217 12314 Y. Wang, H. Su, Y. He, L. Li, S. Zhu, H. Shen, P. Xie, X. Fu, G. Zhou, C. Feng, D. Zhao, F. Xiao, X. Zhu, Y. Zeng, M. Shao, S. Chen, G. Wu, J. Zeng, C. Wang, Chem. Rev. 120 (2020) 12217-12314. [7] Z.H. Xue S.N. Zhang Y.X. Lin H. Su G.Y. Zhai J.T. Han Q.Y. Yu X.H. Li M. Antonietti J.S. Chen J. Am. Chem. Soc. 141 2019 14976 14980 Z. H. Xue, S. N. Zhang, Y. X. Lin, H. Su, G. Y. Zhai, J. T. Han, Q. Y. Yu, X. H. Li, M. Antonietti, J. S. Chen, J. Am. Chem. Soc. 141 (2019) 14976-14980. [8] R. Wan M. Luo J. Wen S. Liu X. Kang Y. Tian J. Energy Chem. 69 2022 44 53 R. Wan, M. Luo, J. Wen, S. Liu, X. Kang, Y. Tian, J. Energy Chem. 69 (2022) 44-53. [9] S. Hao H. Sheng M. Liu J. Huang G. Zheng F. Zhang X. Liu Z. Su J. Hu Y. Qian L. Zhou Y. He B. Song L. Lei X. Zhang S. Jin Nat. Nanotechnol. 16 2021 1371 1377 S. Hao, H. Sheng, M. Liu, J. Huang, G. Zheng, F. Zhang, X. Liu, Z. Su, J. Hu, Y. Qian, L. Zhou, Y. He, B. Song, L. Lei, X. Zhang, S. Jin, Nat. Nanotechnol. 16 (2021) 1371-1377. [10] M. Liu Y. Pang B. Zhang P.D. Luna O. Voznyy J. Xu X. Zheng C.T. Dinh F. Fan C. Cao F.P. de Arquer T.S. Safaei A. Mepham A. Klinkova E. Kumacheva T. Filleter D. Sinton S.O. Kelley E.H. Sargent Nature 537 2016 382 386 M. Liu, Y. Pang, B. Zhang, P. D. Luna, O. Voznyy, J. Xu, X. Zheng, C. T. Dinh, F. Fan, C. Cao, F. P. de Arquer, T. S. Safaei, A. Mepham, A. Klinkova, E. Kumacheva, T. Filleter, D. Sinton, S. O. Kelley, E. H. Sargent, Nature 537 (2016) 382-386. [11] J. Zhu L. Hu P. Zhao L.Y. Lee K.Y. Wong Chem Rev 120 2020 851 918 J. Zhu, L. Hu, P. Zhao, L. Y. Lee, K. Y. Wong, Chem Rev 120 (2020) 851-918. [12] B. Qiao A. Wang X. Yang L.F. Allard Z. Jiang Y. Cui J. Liu J. Li T. Zhang Nat. Chem. 3 2011 634 641 B. Qiao, A. Wang, X. Yang, L. F. Allard, Z. Jiang, Y. Cui, J. Liu, J. Li, T. Zhang, Nat. Chem. 3 (2011) 634-41. [13] J. Zhang Y. Zhao X. Guo C. Chen C.L. Dong R.S. Liu C.P. Han Y. Li Y. Gogotsi G. Wang Nat. Catal. 1 2018 985 992 J. Zhang, Y. Zhao, X. Guo, C. Chen, C. L. Dong, R. S. Liu, C. P. Han, Y. Li, Y. Gogotsi, G. Wang, Nat. Catal. 1 (2018) 985-992. [14] C. Lin J.L. Li X. Li S. Yang W. Luo Y. Zhang S.H. Kim D.H. Kim S.S. Shinde Y.F. Li Z.P. Liu Z. Jiang J.H. Lee Nat. Catal. 4 2021 1012 1023 C. Lin, J. L. Li, X. Li, S. Yang, W. Luo, Y. Zhang, S. H. Kim, D. H. Kim, S. S. Shinde, Y. F. Li, Z. P. Liu, Z. Jiang, J. H. Lee, Nat. Catal. 4 (2021) 1012-1023. [15] M.L. Xiao J.B. Zhu G.R. Li N. Li S. Li Z.P. Cano L. Ma P.X. Cui P. Xu G.P. Jiang H.L. Jin S. Wang T.P. Wu J. Lu A.P. Yu D. Su Z.W. Chen Angew. Chem. Int. Ed. 58 2019 9640 9645 M. L. Xiao, J. B. Zhu, G. R. Li, N. Li, S. Li, Z. P. Cano, L. Ma, P. X. Cui, P. Xu, G. P. Jiang, H. L. Jin, S. Wang, T. P. Wu, J. Lu, A. P. Yu, D. Su, and Z. W. Chen, Angew. Chem. Int. Ed. 58 (2019) 9640-9645. [16] X. Wang W. Wang M. Qiao G. Wu W. Chen T. Yuan Q. Xu M. Chen Y. Zhang X. Wang J. Wang J. Ge X. Hong Y. Li Y. Wu Y. Li Sci. Bull. 63 19 2018 1246 1253 X. Wang, W. Wang, M. Qiao, G. Wu, W. Chen, T. Yuan, Q. Xu, M. Chen, Y. Zhang, X. Wang, J. Wang, J. Ge, X. Hong, Y. Li, Y. Wu, Y. Li, Sci. Bull. 63(19) (2018) 1246-1253. [17] X. Wang Z. Chen X. Zhao T. Yao W. Chen R. You C. Zhao G. Wu J. Wang W. Huang J. Yang X. Hong S. Wei Y. Wu Y. Li Angew. Chem. Int. Ed. 57 2018 1944 1948 X. Wang, Z. Chen, X. Zhao, T. Yao, W. Chen, R. You, C. Zhao, G. Wu, J. Wang, W. Huang, J. Yang, X. Hong, S. Wei, Y. Wu, Y. Li, Angew. Chem. Int. Ed. 57 (2018) 1944-1948. [18] Y. Pan R. Lin Y. Chen S. Liu W. Zhu X. Cao W. Chen K. Wu W.C. Cheong Y. Wang L. Zheng J. Luo Y. Lin Y. Liu C. Liu J. Li Q. Lu X. Chen D. Wang Q. Peng C. Chen Y. Li J. Am. Chem. Soc. 140 2018 4218 4221 Y. Pan, R. Lin, Y. Chen, S. Liu, W. Zhu, X. Cao, W. Chen, K. Wu, W. C. Cheong, Y. Wang, L. Zheng, J. Luo, Y. Lin, Y. Liu, C. Liu, J. Li, Q. Lu, X. Chen, D. Wang, Q. Peng, C. Chen, Y. Li, J. Am. Chem. Soc. 140 (2018) 4218-4221. [19] H.B. Yang S.F. Hung S. Liu K. Yuan S. Miao L. Zhang X. Huang H.Y. Wang W. Cai R. Chen J. Gao X. Yang W. Chen Y. Huang H.M. Chen C.M. Li T. Zhang B. Liu Nat. Energy 3 2018 140 147 H. B. Yang, S. F. Hung, S. Liu, K. Yuan, S. Miao, L. Zhang, X. Huang, H. Y. Wang, W. Cai, R. Chen, J. Gao, X. Yang, W. Chen, Y. Huang, H. M. Chen, C. M. Li, T. Zhang, B. Liu, Nat. Energy 3 (2018) 140-147. [20] P. Zhou M.C. Luo S.J. Guo Nat. Rev. Chem. 6 2022 823 838 P. Zhou, M. C. Luo, and S. J. Guo, Nat. Rev. Chem. 6 (2022) 823-838. [21] R. Qin K. Liu Q. Wu N. Zheng Chem. Rev. 120 2020 1899 11810 11811 R. Qin, K. Liu, Q. Wu, N. Zheng, Chem. Rev. 120 (2020) 11810-11899. [22] W. Ma H. Wan L. Zhang J.Y. Zheng Z. Zhou J. Energy Chem. 63 2021 170 194 W. Ma, H. Wan, L. Zhang, J. Y. Zheng, Z. Zhou, J. Energy Chem. 63 (2021) 170-194. [23] L. Li K. Yuan Y. Chen Accounts Mater. Res. 3 2022 584 596 L. Li, K. Yuan, Y. Chen, Accounts Mater. Res. 3 (2022) 584-596. [24] W. Zhang Y. Chao W. Zhang J. Zhou F. Lv K. Wang F. Lin H. Luo J. Li M. Tong E. Wang S. Guo Adv. Mater. 33 2021 e2102576 W. Zhang, Y. Chao, W. Zhang, J. Zhou, F. Lv, K. Wang, F. Lin, H. Luo, J. Li, M. Tong, E. Wang, S. Guo, Adv. Mater. 33 (2021) e2102576. [25] R. Li D. Wang Adv. Energy Mater. 12 2022 2103564 R. Li, D. Wang, Adv. Energy Mater. 12 (2022) 2103564. [26] H. Liu H. Rong J. Zhang ChemSusChem 15 2022 e202200498 H. Liu, H. Rong, J. Zhang, ChemSusChem 15 (2022) e202200498. [27] S. Zhang Y. Wu Y.X. Zhang Z. Niu Sci. China Chem. 64 2021 1908 1922 S. Zhang, Y. Wu, Y. X. Zhang, Z. Niu, Sci. China Chem. 64 (2021) 1908-1922. [28] S. Qiao Q. Wang D. Lei X. Shi Q. Zhang C. Huang A. Liu G. He F. Zhang J. Mater. Chem. A 10 2022 11702 11711 S. Qiao, Q. Wang, D. Lei, X. Shi, Q. Zhang, C. Huang, A. Liu, G. He, F. Zhang, J. Mater. Chem. A 10 (2022) 11702-11711. [29] L. Shen Y.W. Song J. Wang C.X. Zhao C.X. Bi S.Y. Sun X.Q. Zhang B.Q. Li Q. Zhang Small Struct. 2022 10.1002/sstr.202200205 L. Shen, Y. W. Song, J. Wang, C. X. Zhao, C. X. Bi, S. Y. Sun, X. Q. Zhang, B. Q. Li, Q. Zhang, Small Struct. (2022), https://doi.org/10.1002/sstr.202200205. [30] K. Song Y. Feng W. Zhang W.T. Zheng J. Energy Chem. 67 2022 391 422 K. Song, Y. Feng, W. Zhang, W. T. Zheng, J. Energy Chem. 67 (2022) 391-422. [31] M. Wang H. Zhang Y. Liu Y. Pan J. Energy Chem. 72 2022 56 72 M. Wang, H. Zhang, Y. Liu, Y. Pan, J. Energy Chem. 72 (2022) 56-72. [32] X. Yu Z.Y. Yu X.L. Zhang Y.R. Zheng Y. Duan Q. Gao R. Wu B. Sun M.R. Gao G. Wang S.H. Yu J. Am. Chem. Soc. 141 2019 7537 7543 X. Yu, Z. Y. Yu, X. L. Zhang, Y. R. Zheng, Y. Duan, Q. Gao, R. Wu, B. Sun, M. R. Gao, G. Wang, S. H. Yu, J. Am. Chem. Soc. 141 (2019) 7537-7543. [33] Q. Hao H.X. Zhong J.Z. Wang K.H. Liu J.M. Yan Z.H. Ren N. Zhou X. Zhao H. Zhang D.X. Liu X. Liu L.W. Chen J. Luo X.B. Zhang Nat. synth. 1 2022 719 728 Q. Hao, H. X. Zhong, J. Z. Wang, K. H. Liu, J. M. Yan, Z. H. Ren, N Zhou, X. Zhao, H. Zhang, D. X. Liu, X. Liu, L. W. Chen, J. Luo, and X. B. Zhang, Nat. synth. 1 (2022) 719-728. [34] A. Pedersen J. Barrio A. Li R. Jervis D.J.L. Brett M.M. Titirici I.E.L. Stephens Adv. Energy Mater. 12 2021 2102715 A. Pedersen, J. Barrio, A. Li, R. Jervis, D. J. L. Brett, M. M. Titirici, I. E. L. Stephens, Adv. Energy Mater. 12 (2021) 2102715. [35] C.C. Hou H.F. Wang C. Li Q. Xu Energy Environ. Sci. 13 2020 1658 1693 C. C. Hou, H. F. Wang, C. Li, Q. Xu, Energy Environ. Sci. 13 (2020) 1658-1693. [36] Y. Li B. Wei M. Zhu J. Chen Q. Jiang B. Yang Y. Hou L. Lei Z. Li R. Zhang Y. Lu Adv. Mater. 33 2021 e2102212 Y. Li, B. Wei, M. Zhu, J. Chen, Q. Jiang, B. Yang, Y. Hou, L. Lei, Z. Li, R. Zhang, Y. Lu, Adv. Mater. 33 (2021) e2102212. [37] J. Yang W. Liu M. Xu X. Liu H. Qi L. Zhang X. Yang S. Niu D. Zhou Y. Liu Y. Su J.F. Li Z.Q. Tian W. Zhou A. Wang T. Zhang J. Am. Chem. Soc. 143 2021 14530 14539 J. Yang, W. Liu, M. Xu, X. Liu, H. Qi, L. Zhang, X. Yang, S. Niu, D. Zhou, Y. Liu, Y. Su, J. F. Li, Z. Q. Tian, W. Zhou, A. Wang, T. Zhang, J. Am. Chem. Soc. 143 (2021) 14530-14539. [38] J. Yang H. Qi A. Li X. Liu X. Yang S. Zhang Q. Zhao Q. Jiang Y. Su L. Zhang J.F. Li Z.Q. Tian W. Liu A. Wang T. Zhang J. Am. Chem. Soc. 144 2022 12062 12071 J. Yang, H. Qi, A. Li, X. Liu, X. Yang, S. Zhang, Q. Zhao, Q. Jiang, Y. Su, L. Zhang, J. F. Li, Z. Q. Tian, W. Liu, A. Wang, T. Zhang, J. Am. Chem. Soc. 144 (2022) 12062-12071. [39] J. Gu C. Hsu L.C. Bai H.M. Chen X. Hu Science 364 2019 1091 1094 J. Gu, C. Hsu, L. C. Bai, H. M. Chen, X. Hu, Science 364 (2019) 1091-1094. [40] J. Wang Z. Huang W. Liu C. Chang H. Tang Z. Li W. Chen C. Jia T. Yao S. Wei Y. Wu Y. Li J. Am. Chem. Soc. 139 2017 17281 17284 J. Wang, Z. Huang, W. Liu, C. Chang, H. Tang, Z. Li, W. Chen, C. Jia, T. Yao, S. Wei, Y. Wu, Y. Li, J. Am. Chem. Soc. 139 (2017) 17281-17284. [41] X. Li X. Yang J. Zhang Y. Huang B. Liu ACS Catal. 9 2019 2521 2531 X. Li, X. Yang, J. Zhang, Y. Huang, B. Liu, ACS Catal. 9 (2019) 2521-2531. [42] Y. Liu X. Zhang W. Zhang X. Ge Y. Wang X. Zou X. Zhou W.T. Zheng Energy Environ. Mater. 2022 10.1002/eem2.12438 Y. Liu, X. Zhang, W. Zhang, X. Ge, Y. Wang, X. Zou, X. Zhou, W. T. Zheng, Energy Environ. Mater. (2022), https://doi.org/10.1002/eem2.12438. [43] L. Ma J. Li Z. Zhang H. Yang X. Mu X. Gu H. Jin D. Chen S. Yan S. Liu S. Mu Nano Res. 15 2021 1966 1972 L. Ma, J. Li, Z. Zhang, H. Yang, X. Mu, X. Gu, H. Jin, D. Chen, S. Yan, S. Liu, S. Mu, Nano Res. 15 (2021) 1966-1972. [44] J. Barrio A. Pedersen J. Feng S.C. Sarma M. Wang A.Y. Li H. Yadegari H. Luo M.P. Ryan M.M. Titirici I.E.L. Stephens J. Mater. Chem. A 10 2022 6023 6030 J. Barrio, A. Pedersen, J. Feng, S. C. Sarma, M. Wang, A. Y. Li, H. Yadegari, H. Luo, M. P. Ryan, M. M. Titirici, I. E. L. Stephens, J. Mater. Chem. A 10 (2022) 6023-6030. [45] J. Wang W. Liu G. Luo Z. Li C. Zhao H. Zhang M. Zhu Q. Xu X. Wang C. Zhao Y. Qu Z. Yang T. Yao Y. Li Y. Lin Y. Wu Y. Li Energy Environ. Sci. 11 2018 3375 3379 J. Wang, W. Liu, G. Luo, Z. Li, C. Zhao, H. Zhang, M. Zhu, Q. Xu, X. Wang, C. Zhao, Y. Qu, Z. Yang, T. Yao, Y. Li, Y. Lin, Y. Wu, Y. Li, Energy Environ. Sci. 11 (2018) 3375-3379. [46] Z. Lu B. Wang Y. Hu W. Liu Y. Zhao R. Yang Z. Li J. Luo B. Chi Z. Jiang M. Li S. Mu S. Liao J. Zhang X. Sun Angew. Chem. Int. Ed. 58 2019 2622 2626 Z. Lu, B. Wang, Y. Hu, W. Liu, Y. Zhao, R. Yang, Z. Li, J. Luo, B. Chi, Z. Jiang, M. Li, S. Mu, S. Liao, J. Zhang, X. Sun, Angew. Chem. Int. Ed. 58 (2019) 2622-2626. [47] Y. Zhou W. Yang W. Utetiwabo Y.M. Lian X. Yin L. Zhou P. Yu R. Chen S. Sun J. Phys. Chem. Lett. 11 2020 1404 1410 Y. Zhou, W. Yang, W. Utetiwabo, Y. M. Lian, X. Yin, L. Zhou, P. Yu, R. Chen, S. Sun, J. Phys. Chem. Lett. 11 (2020) 1404-1410. [48] T. Chao X. Luo W. Chen B. Jiang J. Ge Y. Lin G. Wu X. Wang Y. Hu Z. Zhuang Y. Wu X. Hong Y. Li Angew. Chem. Int. Ed. 56 2017 16047 16051 T. Chao, X. Luo, W. Chen, B. Jiang, J. Ge, Y. Lin, G. Wu, X. Wang, Y. Hu, Z. Zhuang, Y. Wu, X. Hong, Y. Li, Angew. Chem. Int. Ed. 56 (2017) 16047-16051. [49] J. Jiao R. Lin S. Liu W.C. Cheong C. Zhang Z. Chen Y. Pan J. Tang K. Wu S.F. Hung H.M. Chen L. Zheng Q. Lu X. Yang B. Xu H. Xiao J. Li D. Wang Q. Peng C. Chen Y. Li Nat. Chem. 11 2019 222 228 J. Jiao, R. Lin, S. Liu, W. C. Cheong, C. Zhang, Z. Chen, Y. Pan, J. Tang, K. Wu, S. F. Hung, H. M. Chen, L. Zheng, Q. Lu, X. Yang, B. Xu, H. Xiao, J. Li, D. Wang, Q. Peng, C. Chen, Y. Li, Nat. Chem. 11 (2019) 222-228. [50] L. Bai C.S. Hsu D.T.L. Alexander H.M. Chen X. Hu J. Am. Chem. Soc. 141 2019 14190 14199 L. Bai, C. S. Hsu, D. T. L. Alexander, H. M. Chen, X. Hu, J. Am. Chem. Soc. 141 (2019) 14190-14199. [51] S. Sun G. Zhang N. Gauquelin N. Chen J. Zhou S. Yang W. Chen X. Meng D. Geng M.N. Banis R. Li S. Ye S. Knights G.A. Botton T.K. Sham X. Sun Sci. Rep. 3 2013 1775 S. Sun, G. Zhang, N. Gauquelin, N. Chen, J. Zhou, S. Yang, W. Chen, X. Meng, D. Geng, M. N. Banis, R. Li, S. Ye, S. Knights, G. A. Botton, T. K. Sham, X. Sun, Sci. Rep. 3 (2013) 1775. [52] L. Zhang R. Si H. Liu N. Chen Q. Wang K. Adair Z. Wang J. Chen Z. Song J. Li M.N. Banis R. Li T.K. Sham M. Gu L.M. Liu G.A. Botton X. Sun Nat. Commun. 10 2019 4936 L. Zhang, R. Si, H. Liu, N. Chen, Q. Wang, K. Adair, Z. Wang, J. Chen, Z. Song, J. Li, M. N. Banis, R. Li, T. K. Sham, M. Gu, L. M. Liu, G. A. Botton, X. Sun, Nat. Commun. 10 (2019) 4936. [53] S. Liu M. Wang X. Yang Q. Shi Z. Qiao M. Lucero Q. Ma K.L. More D.A. Cullen Z. Feng G. Wu Angew. Chem. Int. Ed. 59 2020 21698 21705 S. Liu, M. Wang, X. Yang, Q. Shi, Z. Qiao, M. Lucero, Q. Ma, K. L. More, D. A. Cullen, Z. Feng, G. Wu, Angew. Chem. Int. Ed. 59 (2020) 21698-21705. [54] Y. Yang Y.M. Qian H.J. Li Z.H. Zhang Y.W. Mu D. Do B. Zhou J. Dong W.J. Yan Y. Qin L. Fang R.F. Feng J.G. Zhou P. Zhang J.C. Dong G.H. Yu Y.Y. Liu X.M. Zhang X. J. Fan, Sci. Adv. 6 2020 eaba6586 Y. Yang, Y. M. Qian, H. J. Li, Z. H. Zhang, Y. W. Mu, D. Do, B. Zhou, J. Dong, W. J. Yan, Y. Qin, L. Fang, R. F. Feng, J. G. Zhou, P. Zhang, J. C, Dong, G. H. Yu, Y. Y. Liu, X. M. Zhang, X. J. Fan, Sci. Adv. 6 (2020) eaba6586. [55] W. Chen X. Zhu R. Wang W. Wei M. Liu S. Dong K.K. Ostrikov S.Q. Zang J. Energy Chem. 75 2022 16 25 W. Chen, X. Zhu, R. Wang, W. Wei, M. Liu, S. Dong, K. K. Ostrikov, S. Q. Zang, J. Energy Chem. 75 (2022) 16-25. [56] L.Y. Zeng Z.L. Zhao F. Lv Z.H. Xia S.Y. Lu J. Li K. Sun K. Wang Y.J. Sun Q. Huang Y. Chen Q.H. Zhang L. Gu G. Lu S.J. Guo Nat. Common. 13 2022 3822 L. Y. Zeng, Z. L. Zhao, F. Lv, Z. H. Xia, S. Y. Lu, J. Li, K. Sun, K. Wang, Y. J. Sun, Q. Huang, Y. Chen, Q. H. Zhang, L. Gu, G. Lu, S. J. Guo, Nat. Common. 13 (2022) 3822. [57] G. Zhan Y. Yao F. Quan H. Gu X. Liu L. Zhang J. Energy Chem. 72 2022 203 209 G. Zhan, Y. Yao, F. Quan, H. Gu, X. Liu, L. Zhang, J. Energy Chem. 72 (2022) 203-209. [58] C.G. Morales-Guio L.A. Stern X. Hu Chem. Soc. Rev. 43 2014 6555 6569 C. G. Morales-Guio, L. A. Stern, X. Hu, Chem. Soc. Rev. 43 (2014) 6555-69. [59] J.K. Nørskov T. Bligaard A. Logadottir J.R. Kitchin J.G. Chen S. Pandelov A.U. Stimming J. Electrochem. Soc. 152 2005 J23 J26 J. K. Nørskov, T. Bligaard, A. Logadottir, J. R. Kitchin, J. G. Chen, S. Pandelov, A. U. Stimming, J. Electrochem. Soc. 152 (2005) J23-J26. [60] X. Liu Y. Jiao Y. Zheng K. Davey S.Z. Qiao J. Mater. Chem. A 7 2019 3648 3654 X. Liu, Y. Jiao, Y. Zheng, K. Davey, S. Z. Qiao, J. Mater. Chem. A 7 (2019) 3648-3654. [61] T. Wei P. Ding T. Wang L.M. Liu X. An X. Yu ACS Catal. 11 2021 14669 14676 T. Wei, P. Ding, T. Wang, L. M. Liu, X. An, X. Yu, ACS Catal. 11 (2021) 14669-14676. [62] C. Wang K. Wang Y. Feng C. Li X. Zhou L. Gan Y. Feng H. Zhou B. Zhang X. Qu H. Li J. Li A. Li Y. Sun S. Zhang G. Yang Y. Guo S. Yang T. Zhou F. Dong K. Zheng L. Wang J. Huang Z. Zhang X. Han Adv. Mater. 33 2021 e2003327 C. Wang, K. Wang, Y. Feng, C. Li, X. Zhou, L. Gan, Y. Feng, H. Zhou, B. Zhang, X. Qu, H. Li, J. Li, A. Li, Y. Sun, S. Zhang, G. Yang, Y. Guo, S. Yang, T. Zhou, F. Dong, K. Zheng, L. Wang, J. Huang, Z. Zhang, X. Han, Adv. Mater. 33 (2021) e2003327. [63] J. Gao H. Tao B. Liu Adv. Mater. 33 2021 e2003786 J. Gao, H. Tao, B. Liu, Adv. Mater. 33 (2021) e2003786. [64] S. Du R. Chen W. Chen H. Gao J. Jia Z. Xiao C. Xie H. Li L. Tao J. Huo Y. Wang S. Wang J. Energy Chem. 75 2022 260 266 S. Du, R. Chen, W. Chen, H. Gao, J. Jia, Z. Xiao, C. Xie, H. Li, L. Tao, J. Huo, Y. Wang, S. Wang, J. Energy Chem. 75 (2022) 260-266. [65] B.M. Hunter H.B. Gray A.M. Muller Chem. Rev. 116 2016 14120 14136 B. M. Hunter, H. B. Gray, A. M. Muller, Chem. Rev. 116 (2016) 14120-14136. [66] F. Pan T. Jin W. Yang H. Li Y. Cao J. Hu X. Zhou H. Liu X. Duan Chem Catal. 1 2021 734 745 F. Pan, T. Jin, W. Yang, H. Li, Y. Cao, J. Hu, X. Zhou, H. Liu, X. Duan, Chem Catal. 1 (2021) 734-745. [67] C. Yang Y. Wu Y. Wang H.N. Zhang L.H. Zhu X.C. Wang Nanoscale 14 2021 187 195 C. Yang, Y. Wu, Y. Wang, H. N. Zhang, L. H. Zhu, X. C. Wang, Nanoscale 14 (2021) 187-195. [68] P. Zhai Y. Zhang Y. Wu J. Gao B. Zhang S. Cao Y. Zhang Z. Li L. Sun J. Hou Nat. Commun. 11 2020 5462 P. Zhai, Y. Zhang, Y. Wu, J. Gao, B. Zhang, S. Cao, Y. Zhang, Z. Li, L. Sun, J. Hou, Nat. Commun. 11 (2020) 5462. [69] D. Liu S. Ding C. Wu W. Gan C. Wang D. Cao Z.U. Rehman Y. Sang S. Chen X. Zheng Y. Wang B. Ge L. Song J. Mater. Chem. A 6 2018 6840 6846 D. Liu, S. Ding, C. Wu, W. Gan, C. Wang, D. Cao, Z. U. Rehman, Y. Sang, S. Chen, X. Zheng, Y. Wang, B. Ge, L. Song, J. Mater. Chem. A 6 (2018) 6840-6846. [70] C. Wu X. Zhang Z. Xia M. Shu H. Li X. Xu R. Si A.I. Rykov J. Wang S. Yu S. Wang G. Sun J. Mater Chem. A 7 2019 14001 14010 C. Wu, X. Zhang, Z. Xia, M. Shu, H. Li, X. Xu, R. Si, A. I. Rykov, J. Wang, S. Yu, S. Wang, G. Sun, J Mater. Chem. A 7 (2019) 14001-14010. [71] W. Wan Y. Zhao S. Wei C.A. Triana J. Li A. Arcifa C.S. Allen R. Cao G.R. Patzke Nat. Commun. 12 2021 5589 W. Wan, Y. Zhao, S. Wei, C. A. Triana, J. Li, A. Arcifa, C. S. Allen, R. Cao, G. R. Patzke, Nat. Commun. 12 (2021) 5589. [72] X. Zhang A. Chen Z.H. Zhang M. Jiao Z. Zhou J. Mater. Chem. A 6 2018 11446 11452 X. Zhang, A. Chen, Z. H. Zhang, M. Jiao, Z. Zhou, J. Mater. Chem. A 6 (2018) 11446-11452. [73] L. Bai C.S. Hsu D.T.L. Alexander H.M. Chen X. Hu Nat. Energy 6 2021 1054 1066 L. Bai, C. S. Hsu, D. T. L. Alexander, H. M. Chen, X. Hu, Nat. Energy 6 (2021) 1054-1066. [74] M. Liu L. Wang K. Zhao S. Shi Q. Shao L. Zhang X. Sun Y. Zhao J. Zhang Energy Environ. Sci. 12 2019 2890 2923 M. Liu, L. Wang, K. Zhao, S. Shi, Q. Shao, L. Zhang, X. Sun, Y. Zhao, J. Zhang, Energy Environ. Sci. 12 (2019) 2890-2923. [75] C.X. Zhao D. Ren J. Wang J.N. Liu C. Tang X. Chen B.Q. Li Q. Zhang J. Energy Chem. 73 2022 478 484 C. X. Zhao, D. Ren, J. Wang, J. N. Liu, C. Tang, X. Chen, B. Q. Li, Q. Zhang, J. Energy Chem. 73 (2022) 478-484. [76] L. Dai Y. Xue L. Qu H.J. Choi J.B. Baek Chem. Rev. 115 2015 4823 4892 L. Dai, Y. Xue, L. Qu, H. J. Choi, J. B. Baek, Chem. Rev. 115 (2015) 4823-4892. [77] Y. Nie L. Li Z. Wei Chem. Soc. Rev. 44 2015 2168 2201 Y. Nie, L. Li, Z. Wei, Chem. Soc. Rev. 44 (2015) 2168-2201. [78] Z. Chen X. Liao C. Sun K. Zhao D. Ye J. Li G. Wu J. Fang H. Zhao J. Zhang Appl. Catal. B: Environ. 288 2021 120021 Z. Chen, X. Liao, C. Sun, K. Zhao, D. Ye, J. Li, G. Wu, J. Fang, H. Zhao, J. Zhang, Appl. Catal. B: Environ. 288 (2021) 120021. [79] J. Xu S. Lai D. Qi M. Hu X. Peng Y. Liu W. Liu G. Hu H. Xu F. Li C. Li J. He L. Zhuo J. Sun Y. Qiu S. Zhang J. Luo X. Liu Nano Res. 14 2020 1374 1381 J. Xu, S. Lai, D. Qi, M. Hu, X. Peng, Y. Liu, W. Liu, G. Hu, H. Xu, F. Li, C. Li, J. He, L. Zhuo, J. Sun, Y. Qiu, S. Zhang, J. Luo, X. Liu, Nano Res. 14 (2020) 1374-1381. [80] L. Li Y. Li R. Huang X. Cao Y. Wen ChemCatChem 13 2021 4645 4651 L. Li, Y. Li, R. Huang, X. Cao, Y. Wen, ChemCatChem, 13 (2021) 4645-4651. [81] H. Sun M. Wang S. Zhang S. Liu X. Shen T. Qian X. Niu J. Xiong C. Yan Adv. Funct. Mater. 31 2020 2006533 H. Sun, M. Wang, S. Zhang, S. Liu, X. Shen, T. Qian, X. Niu, J. Xiong, C. Yan, Adv. Funct. Mater. 31 (2020) 2006533. [82] M. Xiao Y. Chen J. Zhu H. Zhang X. Zhao L. Gao X. Wang J. Zhao J. Ge Z. Jiang S. Chen C. Liu W. Xing J. Am. Chem. Soc. 141 2019 17763 17770 M. Xiao, Y. Chen, J. Zhu, H. Zhang, X. Zhao, L. Gao, X. Wang, J. Zhao, J. Ge, Z. Jiang, S. Chen, C. Liu, W. Xing, J. Am. Chem. Soc. 141 (2019) 17763-17770. [83] L. Jiao W. Ye Y. Kang Y. Zhang W. Xu Y. Wu W. Gu W. Song Y. Xiong C. Zhu Nano Res. 15 2021 959 964 L. Jiao, W. Ye, Y. Kang, Y. Zhang, W. Xu, Y. Wu, W. Gu, W. Song, Y. Xiong, C. Zhu, Nano Res. 15 (2021) 959-964. [84] W. Ye S. Chen Y. Lin L. Yang S. Chen X. Zheng Z. Qi C. Wang R. Long M. Chen J. Zhu P. Gao L. Song J. Jiang Y. Xiong Chem 5 2019 2865 2878 W. Ye, S. Chen, Y. Lin, L. Yang, S. Chen, X. Zheng, Z. Qi, C. Wang, R. Long, M. Chen, J. Zhu, P. Gao, L. Song, J. Jiang, Y. Xiong, Chem 5 (2019) 2865-2878. [85] N. Zhang T. Zhou J. Ge Y. Lin Z. Du C.a. Zhong W. Wang Q. Jiao R. Yuan Y. Tian W. Chu C. Wu Y. Xie Matter 3 2020 509 521 N. Zhang, T. Zhou, J. Ge, Y. Lin, Z. Du, C.a. Zhong, W. Wang, Q. Jiao, R. Yuan, Y. Tian, W. Chu, C. Wu, Y. Xie, Matter 3 (2020) 509-521. [86] R. Gao J. Wang Z.F. Huang R. Zhang W. Wang L. Pan J. Zhang W. Zhu X. Zhang C. Shi J. Lim J.J. Zou Nat. Energy 6 2021 614 623 R. Gao, J. Wang, Z. F. Huang, R. Zhang, W. Wang, L. Pan, J. Zhang, W. Zhu, X. Zhang, C. Shi, J. Lim, J. J. Zou, Nat. Energy 6 (2021) 614-623. [87] A.J. Medford A. Vojvodic J.S. Hummelshøj J. Voss F. Abild-Pedersen F. Studt T. Bligaard A. Nilsson J.K. Nørskov J. Catal. 328 2015 36 42 A. J. Medford, A. Vojvodic, J. S. Hummelshøj, J. Voss, F. Abild-Pedersen, F. Studt, T. Bligaard, A. Nilsson, J. K. Nørskov, J. Catal. 328 (2015) 36-42. [88] M. Xiao H. Zhang Y. Chen J. Zhu L. Gao Z. Jin J. Ge Z. Jiang S. Chen C. Liu W. Xing Nano Energy 46 2018 396 403 M. Xiao, H. Zhang, Y. Chen, J. Zhu, L. Gao, Z. Jin, J. Ge, Z. Jiang, S. Chen, C. Liu, W. Xing, Nano Energy 46 (2018) 396-403. [89] L. Zhang J. Fischer Y. Jia X. Yan W. Xu X. Wang J. Chen D. Yang H. Liu L. Zhuang M. Hankel D.J. Searles K. Huang S. Feng C.L. Brown X. Yao J. Am. Chem. Soc. 140 2018 10757 10763 L. Zhang, J. Fischer, Y. Jia, X. Yan, W. Xu, X. Wang, J. Chen, D. Yang, H. Liu, L. Zhuang, M. Hankel, D. J. Searles, K. Huang, S. Feng, C. L. Brown, X. Yao, J. Am. Chem. Soc. 140 (2018) 10757-10763. [90] F. Kong R. Si N. Chen Q. Wang J. Li G. Yin M. Gu J. Wang L.M. Liu X. Sun Appl. Catal. B: Environ. 301 2022 120782 F. Kong, R. Si, N. Chen, Q. Wang, J. Li, G. Yin, M. Gu, J. Wang, L. M. Liu, X. Sun, Appl. Catal. B: Environ. 301 (2022) 120782. [91] Y. Yan H. Cheng Z. Qu R. Yu F. Liu Q. Ma S. Zhao H. Hu Y. Cheng C. Yang Z. Li X. Wang S. Hao Y. Chen M. Liu J. Mater. Chem. A 9 2021 19489 19507 Y. Yan, H. Cheng, Z. Qu, R. Yu, F. Liu, Q. Ma, S. Zhao, H. Hu, Y. Cheng, C. Yang, Z. Li, X. Wang, S. Hao, Y. Chen, M. Liu, J. Mater. Chem. A 9 (2021) 19489-19507. [92] G. Yang J. Zhu P. Yuan Y. Hu G. Qu B.-A. Lu X. Xue H. Yin W. Cheng J. Cheng W. Xu J. Li J. Hu S. Mu J.N. Zhang Nat. Commun. 12 2021 1734 G. Yang, J. Zhu, P. Yuan, Y. Hu, G. Qu, B.-A. Lu, X. Xue, H. Yin, W. Cheng, J. Cheng, W. Xu, J. Li, J. Hu, S. Mu, J. N. Zhang, Nat. Commun. 12 (2021) 1734. [93] H. Li S. Di P. Niu S. Wang J. Wang L. Li Energy Environ. Sci. 15 2022 1601 1610 H. Li, S. Di, P. Niu, S. Wang, J. Wang, L. Li, Energy Environ. Sci. 15 (2022) 1601-1610. [94] M. Jiang F. Wang F. Yang H. He J. Yang W. Zhang J. Luo J. Zhang C. Fu Nano Energy 93 2022 106793 M. Jiang, F. Wang, F. Yang, H. He, J. Yang, W. Zhang, J. Luo, J. Zhang, C. Fu, Nano Energy 93 (2022) 106793. [95] Z. Wang X. Jin C. Zhu Y. Liu H. Tan R. Ku Y. Zhang L. Zhou Z. Liu S.J. Hwang H.J. Fan Adv. Mater. 33 2021 e2104718 Z. Wang, X. Jin, C. Zhu, Y. Liu, H. Tan, R. Ku, Y. Zhang, L. Zhou, Z. Liu, S. J. Hwang, H. J. Fan, Adv. Mater. 33 (2021) e2104718. [96] K. Wang J. Liu Z. Tang L. Li Z. Wang M. Zubair F. Ciucci L. Thomsen J. Wright N.M. Bedford J. Mater. Chem. A 9 2021 13044 13055 K. Wang, J. Liu, Z. Tang, L. Li, Z. Wang, M. Zubair, F. Ciucci, L. Thomsen, J. Wright, N. M. Bedford, J. Mater. Chem. A 9 (2021) 13044-13055. [97] Y. He X. Yang Y. Li L. Liu S. Guo C. Shu F. Liu Y. Liu Q. Tan G. Wu ACS Catal. 12 2022 1216 1227 Y. He, X. Yang, Y. Li, L. Liu, S. Guo, C. Shu, F. Liu, Y. Liu, Q. Tan, G. Wu, ACS Catal. 12 (2022) 1216-1227. [98] M. Xiao J. Zhu S. Li G. Li W. Liu Y.-P. Deng Z. Bai L. Ma M. Feng T. Wu D. Su J. Lu A. Yu Z. Chen ACS Catal. 11 2021 8837 8846 M. Xiao, J. Zhu, S. Li, G. Li, W. Liu, Y.-P. Deng, Z. Bai, L. Ma, M. Feng, T. Wu, D. Su, J. Lu, A. Yu, Z. Chen, ACS Catal. 11 (2021) 8837-8846. [99] X. Han X. Ling D. Yu D. Xie L. Li S. Peng C. Zhong N. Zhao Y. Deng W. Hu Adv. Mater. 31 2019 e1905622 X. Han, X. Ling, D. Yu, D. Xie, L. Li, S. Peng, C. Zhong, N. Zhao, Y. Deng, W. Hu, Adv. Mater. 31 (2019) e1905622. [100] M. Liu N. Li S. Cao X. Wang X. Lu L. Kong Y. Xu X.H. Bu Adv. Mater. 34 2022 e2107421 M. Liu, N. Li, S. Cao, X. Wang, X. Lu, L. Kong, Y. Xu, X.H. Bu, Adv. Mater. 34 (2022) e2107421. [101] Z. Li H. He H. Cao S. Sun W. Diao D. Gao P. Lu S. Zhang Z. Guo M. Li R. Liu D. Ren C. Liu Y. Zhang Z. Yang J. Jiang G. Zhang Appl. Catal. B: Environ. 240 2019 112 121 Z. Li, H. He, H. Cao, S. Sun, W. Diao, D. Gao, P. Lu, S. Zhang, Z. Guo, M. Li, R. Liu, D. Ren, C. Liu, Y. Zhang, Z. Yang, J. Jiang, G. Zhang, Appl. Catal. B: Environ. 240 (2019) 112-121. [102] M. Ma A. Kumar D. Wang Y. Wang Y. Jia Y. Zhang G. Zhang Z. Yan X. Sun Appl. Catal. B: Environ. 274 2020 119091 M. Ma, A. Kumar, D. Wang, Y. Wang, Y. Jia, Y. Zhang, G. Zhang, Z. Yan, X. Sun, Appl. Catal. B: Environ. 274 (2020) 119091. [103] Y.J. Wu X.H. Wu T.X. Tu P.F. Zhang J.T. Li Y. Zhou L. Huang S.G. Sun Appl. Catal. B: Environ. 278 2020 119159 Y. J. Wu, X. H. Wu, T. X. Tu, P. F. Zhang, J. T. Li, Y. Zhou, L. Huang, S. G. Sun, Appl. Catal. B: Environ. 278 (2020) 119159. [104] Y. Ma H. Fan C. Wu M. Zhang J. Yu L. Song K. Li J. He Carbon 185 2021 526 535 Y. Ma, H. Fan, C. Wu, M. Zhang, J. Yu, L. Song, K. Li, J. He, Carbon 185 (2021) 526-535. [105] X. Zhu D. Zhang C.J. Chen Q. Zhang R.S. Liu Z. Xia L. Dai R. Amal X. Lu Nano Energy 71 2020 104597 X. Zhu, D. Zhang, C. J. Chen, Q. Zhang, R. S. Liu, Z. Xia, L. Dai, R. Amal, X. Lu, Nano Energy 71 (2020) 104597. [106] B. Hu A. Huang X. Zhang Z. Chen R. Tu W. Zhu Z. Zhuang C. Chen Q. Peng Y. Li Nano Res. 14 2021 3482 3488 B. Hu, A. Huang, X. Zhang, Z. Chen, R. Tu, W. Zhu, Z. Zhuang, C. Chen, Q. Peng, Y. Li, Nano Res. 14 (2021) 3482-3488. [107] S.G. Wang Z.Y. Qian Q.Z. Huang Y.J. Tan F. Lv L.Y. Zeng C. Shang K. Wang G.Q. Wang Y.D. Mao Y. Wang Q.H. Zhang L. Gu S.J. Guo Adv. Energy Mater. 12 2022 2201278 S. G. Wang, Z. Y. Qian, Q. Z. Huang, Y. J. Tan, F. Lv, L. Y. Zeng, C. Shang, K. Wang, G. Q. Wang, Y. D. Mao, Y. Wang, Q. H. Zhang, L. Gu, and S. J. Guo, Adv. Energy Mater. 12 (2022) 2201278. [108] B. Mohanty S. Basu B.K. Jena J. Energy Chem. 70 2022 444 471 B. Mohanty, S. Basu, B. K. Jena, J. Energy Chem. 70 (2022) 444-471. [109] T. Zheng K. Jiang N. Ta Y. Hu J. Zeng J. Liu H. Wang Joule 3 2019 265 278 T. Zheng, K. Jiang, N. Ta, Y. Hu, J. Zeng, J. Liu, H. Wang, Joule 3 (2019) 265-278. [110] X. Zhang Y. Zhu Z. Liu F. Li W. Zhou Z. Dong J. Fan L. Liu C. Du J. Energy Chem. 75 2022 383 390 X. Zhang, Y. Zhu, Z. Liu, F. Li, W. Zhou, Z. Dong, J. Fan, L. Liu, C. Du, J. Energy Chem. 75 (2022) 383-390. [111] Z. Chen Y. Song Z. Zhang Y. Cai H. Liu W. Xie D. Deng J. Energy Chem. 74 2022 198 202 Z. Chen, Y. Song, Z. Zhang, Y. Cai, H. Liu, W. Xie, D. Deng, J. Energy Chem. 74 (2022) 198-202. [112] Y. Li C. Chen R. Cao Z. Pan H. He K. Zhou Appl. Catal. B: Environ. 268 2020 118747 Y. Li, C. Chen, R. Cao, Z. Pan, H. He, K. Zhou, Appl. Catal. B: Environ. 268 (2020) 118747. [113] J. Wang E. Kim D.P. Kumar A.P. Rangappa Y. Kim Y. Zhang T.K. Kim Angew. Chem. Int. Ed. 61 2022 e202113044 J. Wang, E. Kim, D. P. Kumar, A. P. Rangappa, Y. Kim, Y. Zhang, T. K. Kim, Angew. Chem. Int. Ed. 61 (2022) e202113044. [114] T. Ding X. Liu Z. Tao T. Liu T. Chen W. Zhang X. Shen D. Liu S. Wang B. Pang D. Wu L. Cao L. Wang T. Liu Y. Li H. Sheng M. Zhu T. Yao J. Am. Chem. Soc. 143 2021 11317 11324 T. Ding, X. Liu, Z. Tao, T. Liu, T. Chen, W. Zhang, X. Shen, D. Liu, S. Wang, B. Pang, D. Wu, L. Cao, L. Wang, T. Liu, Y. Li, H. Sheng, M. Zhu, T. Yao, J. Am. Chem. Soc. 143 (2021) 11317-11324. [115] H. Cheng X. Wu M. Feng X. Li G. Lei Z. Fan D. Pan F. Cui G. He ACS Catal. 11 2021 12673 12681 H. Cheng, X. Wu, M. Feng, X. Li, G. Lei, Z. Fan, D. Pan, F. Cui, G. He, ACS Catal. 11 (2021) 12673-12681. [116] W. Xie H. Li G. Cui J. Li Y. Song S. Li X. Zhang J.Y. Lee M. Shao M. Wei Angew. Chem. Int. Ed. 60 2021 7382 7388 W. Xie, H. Li, G. Cui, J. Li, Y. Song, S. Li, X. Zhang, J. Y. Lee, M. Shao, M. Wei, Angew. Chem. Int. Ed. 60 (2021) 7382-7388. [117] N. Zhang X. Zhang Y. Kang C. Ye R. Jin H. Yan R. Lin J. Yang Q. Xu Y. Wang Q. Zhang L. Gu L. Liu W. Song J. Liu D. Wang Y. Li Angew. Chem. Int. Ed. 60 2021 13388 13393 N. Zhang, X. Zhang, Y. Kang, C. Ye, R. Jin, H. Yan, R. Lin, J. Yang, Q. Xu, Y. Wang, Q. Zhang, L. Gu, L. Liu, W. Song, J. Liu, D. Wang, Y. Li, Angew. Chem. Int. Ed. 60 (2021) 13388-13393. [118] W. Zhu L. Zhang S. Liu A. Li X. Yuan C. Hu G. Zhang W. Deng K. Zang J. Luo Y. Zhu M. Gu Z.J. Zhao J. Gong Angew. Chem. Int. Ed. 59 2020 12664 12668 W. Zhu, L. Zhang, S. Liu, A. Li, X. Yuan, C. Hu, G. Zhang, W. Deng, K. Zang, J. Luo, Y. Zhu, M. Gu, Z. J. Zhao, J. Gong, Angew. Chem. Int. Ed. 59 (2020) 12664-12668. [119] Q. Gong Y. Wang X. Ren C. He J. Liu Q. Zhang ChemSusChem 14 2021 4499 4506 Q. Gong, Y. Wang, X. Ren, C. He, J. Liu, Q. Zhang, ChemSusChem 14 (2021) 4499-4506. [120] Z. Zeng L.Y. Gan H. Bin Yang X. Su J. Gao W. Liu H. Matsumoto J. Gong J. Zhang W. Cai Z. Zhang Y. Yan B. Liu P. Chen Nat. Commun. 12 2021 4088 Z. Zeng, L.Y. Gan, H. Bin Yang, X. Su, J. Gao, W. Liu, H. Matsumoto, J. Gong, J. Zhang, W. Cai, Z. Zhang, Y. Yan, B. Liu, P. Chen, Nat. Commun. 12 (2021) 4088. [121] Z. Liang L.P. Song M.Z. Song B.L. Huang Y.P. Du Sci. Adv. 7 2021 eabl4915 Z. Liang, L. P. Song, M. Z. Song, B. L. Huang, Y. P. Du, Sci. Adv. 7 (2021) eabl4915. [122] Y. Wang B.J. Park V.K. Paidi R. Huang Y. Lee K.J. Noh K.S. Lee J.W. Han ACS Energy Lett. 7 2022 640 649 Y. Wang, B. J. Park, V. K. Paidi, R. Huang, Y. Lee, K. J. Noh, K. S. Lee, J. W. Han, ACS Energy Lett. 7 (2022) 640-649. [123] X. Wei S. Wei S. Cao Y. Hu S. Zhou S. Liu Z. Wang X. Lu Appl. Surf. Sci. 564 2021 150423 X. Wei, S. Wei, S. Cao, Y. Hu, S. Zhou, S. Liu, Z. Wang, X. Lu, Appl. Surf. Sci. 564 (2021) 150423. [124] Z. Chen G. Zhang Y. Wen N. Chen W. Chen T. Regier J. Dynes Y. Zheng S. Sun Nano-micro Lett 14 2021 25 Z. Chen, G. Zhang, Y. Wen, N. Chen, W. Chen, T. Regier, J. Dynes, Y. Zheng, S. Sun, Nano-micro Lett 14 (2021) 25. [125] L. Cheng X. Yue L. Wang D. Zhang P. Zhang J. Fan Q. Xiang Adv. Mater. 2021 e2105135 L. Cheng, X. Yue, L. Wang, D. Zhang, P. Zhang, J. Fan, Q. Xiang, Adv. Mater. (2021) e2105135. [126] Y. Zhang T. Liu X. Wang Q. Dang M. Zhang S. Zhang X. Li S. Tang J. Jiang ACS Appl. Mater. Inter. 14 2022 9073 9083 Y. Zhang, T. Liu, X. Wang, Q. Dang, M. Zhang, S. Zhang, X. Li, S. Tang, J. Jiang, ACS Appl. Mater. Inter. 14 (2022) 9073-9083. [127] L. Lin H. Li C. Yan H. Li R. Si M. Li J. Xiao G. Wang X. Bao Adv. Mater. 31 2019 e1903470 L. Lin, H. Li, C. Yan, H. Li, R. Si, M. Li, J. Xiao, G. Wang, X. Bao, Adv. Mater. 31 (2019) e1903470. [128] W. Ren X. Tan W. Yang C. Jia S. Xu K. Wang S.C. Smith C. Zhao Angew. Chem. Int. Ed. 58 2019 6972 6976 W. Ren, X. Tan, W. Yang, C. Jia, S. Xu, K. Wang, S. C. Smith, C. Zhao, Angew. Chem. Int. Ed. 58 (2019) 6972-6976. [129] M. Feng X. Wu H. Cheng Z. Fan X. Li F. Cui S. Fan Y. Dai G. Lei G. He J. Mater. Chem. A 9 2021 23817 23827 M. Feng, X. Wu, H. Cheng, Z. Fan, X. Li, F. Cui, S. Fan, Y. Dai, G. Lei, G. He, J. Mater. Chem. A 9 (2021) 23817-23827. [130] H. Liu Q. Huang W. An Y. Wang Y. Men S. Liu J. Energy Chem. 61 2021 507 516 H. Liu, Q. Huang, W. An, Y. Wang, Y. Men, S. Liu, J. Energy Chem. 61 (2021) 507-516. [131] Y. Ouyang L. Shi X. Bai Q. Li J. Wang Chem. Sci. 11 2020 1807 1813 Y. Ouyang, L. Shi, X. Bai, Q. Li, J. Wang, Chem. Sci. 11 (2020) 1807-1813. [132] G. Luo Y. Jing Y. Li J. Mater. Chem. A 8 2020 15809 15815 G. Luo, Y. Jing, Y. Li, J. Mater. Chem. A 8 (2020) 15809-15815. [133] H. He C. Morrissey L.A. Curtiss P. Zapol J. Phys. Chem. C 122 2018 28629 28636 H. He, C. Morrissey, L. A. Curtiss, P. Zapol, J. Phys. Chem. C 122 (2018) 28629-28636. [134] T. Luo K. Liu J. Fu S. Chen H. Li J. Hu M. Liu J. Energy Chem. 70 2022 219 223 T. Luo, K. Liu, J. Fu, S. Chen, H. Li, J. Hu, M. Liu, J. Energy Chem. 70 (2022) 219-223. [135] A. Guan Z. Chen Y. Quan C. Peng Z. Wang T.K. Sham C. Yang Y. Ji L. Qian X. Xu G. Zheng ACS Energy Lett. 5 2020 1044 1053 A. Guan, Z. Chen, Y. Quan, C. Peng, Z. Wang, T. K. Sham, C. Yang, Y. Ji, L. Qian, X. Xu, G. Zheng, ACS Energy Lett. 5 (2020) 1044-1053. [136] P. Shao W. Zhou Q.L. Hong L. Yi L. Zheng W. Wang H.X. Zhang H. Zhang J. Zhang Angew. Chem. Int. Ed. 60 2021 16687 16692 P. Shao, W. Zhou, Q. L. Hong, L. Yi, L. Zheng, W. Wang, H. X. Zhang, H. Zhang, J. Zhang, Angew. Chem. Int. Ed. 60 (2021) 16687-16692. [137] M.J. Cheng E.L. Clark H.H. Pham A.T. Bell M. Head-Gordon ACS Catal. 6 2016 7769 7777 M. J. Cheng, E. L. Clark, H. H. Pham, A. T. Bell, M. Head-Gordon, ACS Catal. 6 (2016) 7769-7777. [138] X. Zhu J. Yan M. Gu T. Liu Y. Dai Y. Gu Y. Li J. Phys. Chem. Lett. 10 2019 7760 7766 X. Zhu, J. Yan, M. Gu, T. Liu, Y. Dai, Y. Gu, Y. Li, J. Phys. Chem. Lett. 10 (2019) 7760-7766. [139] Y. Li H. Su S.H. Chan Q. Sun ACS Catal. 5 2015 6658 6664 Y. Li, H. Su, S.H. Chan, Q. Sun, ACS Catal. 5 (2015) 6658-6664. [140] X. Zhang Z.H. Zhang Z. Zhou J. Mater. Chem. A 6 2018 18599 18604 X. Zhang, Z. H. Zhang and Z. Zhou, J. Mater. Chem. A 6 (2018) 18599-18604. [141] C. Tang S.Z. Qiao Chem. Soc. Rev. 48 2019 3166 3180 C. Tang, S. Z. Qiao, Chem. Soc. Rev. 48 (2019) 3166-3180. [142] L. Ma F. Xu L. Zhang Z. Nie K. Xia M. Guo M. Li X. Ding J. Energy Chem. 71 2022 182 187 L. Ma, F. Xu, L. Zhang, Z. Nie, K. Xia, M. Guo, M. Li, X. Ding, J. Energy Chem. 71 (2022) 182-187. [143] T. Sun S. Mitchell J. Li P. Lyu X. Wu J. Perez-Ramirez J. Lu Adv. Mater. 33 2021 e2003075 T. Sun, S. Mitchell, J. Li, P. Lyu, X. Wu, J. Perez-Ramirez, J. Lu, Adv. Mater. 33 (2021) e2003075. [144] L. Han Z. Ren P. Ou H. Cheng N. Rui L. Lin X. Liu L. Zhuo J. Song J. Sun J. Luo H.L. Xin Angew. Chem. Int. Ed. 60 2021 345 350 L. Han, Z. Ren, P. Ou, H. Cheng, N. Rui, L. Lin, X. Liu, L. Zhuo, J. Song, J. Sun, J. Luo, H. L. Xin, Angew. Chem. Int. Ed. 60 (2021) 345-350. [145] L. Zhang G. Fan W. Xu M. Yu L. Wang Z. Yan F. Cheng Chem. Commun. 56 2020 11957 11960 L. Zhang, G. Fan, W. Xu, M. Yu, L. Wang, Z. Yan, F. Cheng, Chem. Commun. 56 (2020) 11957-11960. [146] Y. Li Q. Zhang C. Li H.N. Fan W.B. Luo H.K. Liu S.X. Dou J. Mater Chem. A 7 2019 22242 22247 Y. Li, Q. Zhang, C. Li, H. N. Fan, W. B. Luo, H. K. Liu, S. X. Dou, J Mater. Chem. A 7 (2019) 22242-22247. [147] Z.W. Chen J.M. Yan Q. Jiang Small Methods 3 2018 1800291 Z. W. Chen, J. M. Yan, Q. Jiang, Small Methods 3 (2018) 1800291. [148] H. Li Z. Zhao Q. Cai L. Yin J. Zhao J. Mater. Chem. A 8 2020 4533 4543 H. Li, Z. Zhao, Q. Cai, L. Yin, J. Zhao, J. Mater. Chem. A 8 (2020) 4533-4543. [149] X. Lv W. Wei B. Huang Y. Dai T. Frauenheim Nano Lett. 21 2021 1871 1878 X. Lv, W. Wei, B. Huang, Y. Dai, T. Frauenheim, Nano Lett. 21 (2021) 1871-1878. Kaihua Liu got his Ph.D. degree in materials science from Jilin University in 2019. And then he worked as a project hired personnel at Changchun Institute of Applied Chemistry, Chinese Academy of Sciences. He is currently a lecturer at Yantai University. His research interests focus on the design and synthesis of electrocatalysts for catalytic reactions, such as water splitting and carbon dioxide reduction, etc. Jing Li is an assistant research fellow at Yantai University. She obtained her Ph.D. degree at Dalian Institute of Chemical Physics, Chinese Academy of Sciences (2015). Prior to this appointment, she worked as postdoctoral researcher at Shandong University. She is currently conducting research on the design and application of nanostructured energy materials for Li-S batteries. Yuanyuan Liu received her Ph.D. degree from Tianjin University. She is a lecturer at Yantai University. Her research is focused on rational design, synthesis, and fundamental investigation of key materials and components for electrochemical energy storage and conversion. Meiri Wang is a professor at Yantai University. Before that, she was an associate researcher at Dalian Institute of Chemical Physics, Chinese Academy of Sciences. Her current research focuses on the research and development of key materials and components for high performance lithium sulfur batteries. Hongtao Cui is a professor at Yantai University. He received Ph.D. degree from Changchun Institute of Applied Chemistry Chinese Academy of Sciences in 2002. Then, he worked as a postdoctoral fellow in Instituto de Ciencia de Materiales de Madrid. His research focuses on building ordered nanostructures for application in energy storage devices.",
      "scopus-id": "85148016545",
      "coredata": {
        "eid": "1-s2.0-S2095495623000335",
        "dc:description": "The dual-metal-atom catalysts (DACs) have aroused much attention as they possess the advantages of single-atom and metal alloy catalysts. And the DACs have exhibited enhanced performance in various electrocatalytic reactions, such as hydrogen/oxygen evolution and oxygen/carbon dioxide/nitrogen reduction. In this review, we mainly overview the latest understanding of the advantages of DACs for these reactions. This review will start with the familiar characterization methods for DACs, then the primary synthesis strategies for DACs will be discussed. Emphasis is given to the advantages of DACs in catalytic reactions, including the adsorption and activation, electronic structure regulation, breaking scaling relations, reducing energy barriers, cascading and coupling, synergy effect, and providing mechanism research platforms. Finally, personal perspectives and challenges for the further development of DACs are briefly discussed.",
        "openArchiveArticle": "false",
        "prism:coverDate": "2023-04-30",
        "openaccessUserLicense": null,
        "prism:aggregationType": "Journal",
        "prism:url": "https://api.elsevier.com/content/article/pii/S2095495623000335",
        "dc:creator": [
          {
            "@_fa": "true",
            "$": "Liu, Kaihua"
          },
          {
            "@_fa": "true",
            "$": "Li, Jing"
          },
          {
            "@_fa": "true",
            "$": "Liu, Yuanyuan"
          },
          {
            "@_fa": "true",
            "$": "Wang, Meiri"
          },
          {
            "@_fa": "true",
            "$": "Cui, Hongtao"
          }
        ],
        "link": [
          {
            "@_fa": "true",
            "@rel": "self",
            "@href": "https://api.elsevier.com/content/article/pii/S2095495623000335"
          },
          {
            "@_fa": "true",
            "@rel": "scidir",
            "@href": "https://www.sciencedirect.com/science/article/pii/S2095495623000335"
          }
        ],
        "dc:format": "application/json",
        "openaccessType": null,
        "pii": "S2095-4956(23)00033-5",
        "prism:volume": "79",
        "prism:publisher": "Science Press and Dalian Institute of Chemical Physics, Chinese Academy of Sciences.",
        "dc:title": "Dual metal atom catalysts: Advantages in electrocatalytic reactions",
        "prism:copyright": "© 2023 Science Press and Dalian Institute of Chemical Physics, Chinese Academy of Sciences. All rights reserved.",
        "openaccess": "0",
        "prism:issn": "20954956",
        "dcterms:subject": [
          {
            "@_fa": "true",
            "$": "Dual atom catalysts"
          },
          {
            "@_fa": "true",
            "$": "Synergy effect"
          },
          {
            "@_fa": "true",
            "$": "Scaling relation"
          },
          {
            "@_fa": "true",
            "$": "Mechanism study platform"
          }
        ],
        "openaccessArticle": "false",
        "prism:publicationName": "Journal of Energy Chemistry",
        "openaccessSponsorType": null,
        "prism:pageRange": "515-534",
        "prism:endingPage": "534",
        "pubType": "rev",
        "prism:coverDisplayDate": "April 2023",
        "prism:doi": "10.1016/j.jechem.2023.01.021",
        "prism:startingPage": "515",
        "dc:identifier": "doi:10.1016/j.jechem.2023.01.021",
        "openaccessSponsorName": null
      },
      "objects": {
        "object": [
          {
            "@category": "standard",
            "@height": "362",
            "@width": "535",
            "@_fa": "true",
            "$": "https://api.elsevier.com/content/object/eid/1-s2.0-S2095495623000335-gr10.jpg?httpAccept=%2A%2F%2A",
            "@multimediatype": "JPEG image file",
            "@type": "IMAGE-DOWNSAMPLED",
            "@size": "69978",
            "@ref": "gr10",
            "@mimetype": "image/jpeg"
          },
          {
            "@category": "standard",
            "@height": "452",
            "@width": "383",
            "@_fa": "true",
            "$": "https://api.elsevier.com/content/object/eid/1-s2.0-S2095495623000335-gr11.jpg?httpAccept=%2A%2F%2A",
            "@multimediatype": "JPEG image file",
            "@type": "IMAGE-DOWNSAMPLED",
            "@size": "61701",
            "@ref": "gr11",
            "@mimetype": "image/jpeg"
          },
          {
            "@category": "standard",
            "@height": "624",
            "@width": "681",
            "@_fa": "true",
            "$": "https://api.elsevier.com/content/object/eid/1-s2.0-S2095495623000335-gr12.jpg?httpAccept=%2A%2F%2A",
            "@multimediatype": "JPEG image file",
            "@type": "IMAGE-DOWNSAMPLED",
            "@size": "142411",
            "@ref": "gr12",
            "@mimetype": "image/jpeg"
          },
          {
            "@category": "standard",
            "@height": "524",
            "@width": "535",
            "@_fa": "true",
            "$": "https://api.elsevier.com/content/object/eid/1-s2.0-S2095495623000335-gr13.jpg?httpAccept=%2A%2F%2A",
            "@multimediatype": "JPEG image file",
            "@type": "IMAGE-DOWNSAMPLED",
            "@size": "89517",
            "@ref": "gr13",
            "@mimetype": "image/jpeg"
          },
          {
            "@category": "standard",
            "@height": "413",
            "@width": "628",
            "@_fa": "true",
            "$": "https://api.elsevier.com/content/object/eid/1-s2.0-S2095495623000335-gr14.jpg?httpAccept=%2A%2F%2A",
            "@multimediatype": "JPEG image file",
            "@type": "IMAGE-DOWNSAMPLED",
            "@size": "106816",
            "@ref": "gr14",
            "@mimetype": "image/jpeg"
          },
          {
            "@category": "standard",
            "@height": "222",
            "@width": "535",
            "@_fa": "true",
            "$": "https://api.elsevier.com/content/object/eid/1-s2.0-S2095495623000335-gr15.jpg?httpAccept=%2A%2F%2A",
            "@multimediatype": "JPEG image file",
            "@type": "IMAGE-DOWNSAMPLED",
            "@size": "52273",
            "@ref": "gr15",
            "@mimetype": "image/jpeg"
          },
          {
            "@category": "standard",
            "@height": "385",
            "@width": "712",
            "@_fa": "true",
            "$": "https://api.elsevier.com/content/object/eid/1-s2.0-S2095495623000335-gr16.jpg?httpAccept=%2A%2F%2A",
            "@multimediatype": "JPEG image file",
            "@type": "IMAGE-DOWNSAMPLED",
            "@size": "106316",
            "@ref": "gr16",
            "@mimetype": "image/jpeg"
          },
          {
            "@category": "standard",
            "@height": "320",
            "@width": "382",
            "@_fa": "true",
            "$": "https://api.elsevier.com/content/object/eid/1-s2.0-S2095495623000335-gr17.jpg?httpAccept=%2A%2F%2A",
            "@multimediatype": "JPEG image file",
            "@type": "IMAGE-DOWNSAMPLED",
            "@size": "40140",
            "@ref": "gr17",
            "@mimetype": "image/jpeg"
          },
          {
            "@category": "standard",
            "@height": "559",
            "@width": "534",
            "@_fa": "true",
            "$": "https://api.elsevier.com/content/object/eid/1-s2.0-S2095495623000335-gr2.jpg?httpAccept=%2A%2F%2A",
            "@multimediatype": "JPEG image file",
            "@type": "IMAGE-DOWNSAMPLED",
            "@size": "124293",
            "@ref": "gr2",
            "@mimetype": "image/jpeg"
          },
          {
            "@category": "standard",
            "@height": "556",
            "@width": "647",
            "@_fa": "true",
            "$": "https://api.elsevier.com/content/object/eid/1-s2.0-S2095495623000335-gr3.jpg?httpAccept=%2A%2F%2A",
            "@multimediatype": "JPEG image file",
            "@type": "IMAGE-DOWNSAMPLED",
            "@size": "145822",
            "@ref": "gr3",
            "@mimetype": "image/jpeg"
          },
          {
            "@category": "standard",
            "@height": "619",
            "@width": "535",
            "@_fa": "true",
            "$": "https://api.elsevier.com/content/object/eid/1-s2.0-S2095495623000335-gr4.jpg?httpAccept=%2A%2F%2A",
            "@multimediatype": "JPEG image file",
            "@type": "IMAGE-DOWNSAMPLED",
            "@size": "161878",
            "@ref": "gr4",
            "@mimetype": "image/jpeg"
          },
          {
            "@category": "standard",
            "@height": "488",
            "@width": "793",
            "@_fa": "true",
            "$": "https://api.elsevier.com/content/object/eid/1-s2.0-S2095495623000335-gr5.jpg?httpAccept=%2A%2F%2A",
            "@multimediatype": "JPEG image file",
            "@type": "IMAGE-DOWNSAMPLED",
            "@size": "172175",
            "@ref": "gr5",
            "@mimetype": "image/jpeg"
          },
          {
            "@category": "standard",
            "@height": "573",
            "@width": "796",
            "@_fa": "true",
            "$": "https://api.elsevier.com/content/object/eid/1-s2.0-S2095495623000335-gr6.jpg?httpAccept=%2A%2F%2A",
            "@multimediatype": "JPEG image file",
            "@type": "IMAGE-DOWNSAMPLED",
            "@size": "158493",
            "@ref": "gr6",
            "@mimetype": "image/jpeg"
          },
          {
            "@category": "standard",
            "@height": "458",
            "@width": "628",
            "@_fa": "true",
            "$": "https://api.elsevier.com/content/object/eid/1-s2.0-S2095495623000335-gr7.jpg?httpAccept=%2A%2F%2A",
            "@multimediatype": "JPEG image file",
            "@type": "IMAGE-DOWNSAMPLED",
            "@size": "84512",
            "@ref": "gr7",
            "@mimetype": "image/jpeg"
          },
          {
            "@category": "standard",
            "@height": "274",
            "@width": "535",
            "@_fa": "true",
            "$": "https://api.elsevier.com/content/object/eid/1-s2.0-S2095495623000335-gr8.jpg?httpAccept=%2A%2F%2A",
            "@multimediatype": "JPEG image file",
            "@type": "IMAGE-DOWNSAMPLED",
            "@size": "60008",
            "@ref": "gr8",
            "@mimetype": "image/jpeg"
          },
          {
            "@category": "standard",
            "@height": "546",
            "@width": "645",
            "@_fa": "true",
            "$": "https://api.elsevier.com/content/object/eid/1-s2.0-S2095495623000335-gr9.jpg?httpAccept=%2A%2F%2A",
            "@multimediatype": "JPEG image file",
            "@type": "IMAGE-DOWNSAMPLED",
            "@size": "117066",
            "@ref": "gr9",
            "@mimetype": "image/jpeg"
          },
          {
            "@category": "standard",
            "@height": "245",
            "@width": "291",
            "@_fa": "true",
            "$": "https://api.elsevier.com/content/object/eid/1-s2.0-S2095495623000335-ga1.jpg?httpAccept=%2A%2F%2A",
            "@multimediatype": "JPEG image file",
            "@type": "IMAGE-DOWNSAMPLED",
            "@size": "26828",
            "@ref": "ga1",
            "@mimetype": "image/jpeg"
          },
          {
            "@category": "standard",
            "@height": "155",
            "@width": "111",
            "@_fa": "true",
            "$": "https://api.elsevier.com/content/object/eid/1-s2.0-S2095495623000335-fx1.jpg?httpAccept=%2A%2F%2A",
            "@multimediatype": "JPEG image file",
            "@type": "IMAGE-DOWNSAMPLED",
            "@size": "5705",
            "@ref": "fx1",
            "@mimetype": "image/jpeg"
          },
          {
            "@category": "standard",
            "@height": "155",
            "@width": "111",
            "@_fa": "true",
            "$": "https://api.elsevier.com/content/object/eid/1-s2.0-S2095495623000335-fx2.jpg?httpAccept=%2A%2F%2A",
            "@multimediatype": "JPEG image file",
            "@type": "IMAGE-DOWNSAMPLED",
            "@size": "6975",
            "@ref": "fx2",
            "@mimetype": "image/jpeg"
          },
          {
            "@category": "standard",
            "@height": "155",
            "@width": "111",
            "@_fa": "true",
            "$": "https://api.elsevier.com/content/object/eid/1-s2.0-S2095495623000335-fx3.jpg?httpAccept=%2A%2F%2A",
            "@multimediatype": "JPEG image file",
            "@type": "IMAGE-DOWNSAMPLED",
            "@size": "5861",
            "@ref": "fx3",
            "@mimetype": "image/jpeg"
          },
          {
            "@category": "standard",
            "@height": "155",
            "@width": "111",
            "@_fa": "true",
            "$": "https://api.elsevier.com/content/object/eid/1-s2.0-S2095495623000335-fx4.jpg?httpAccept=%2A%2F%2A",
            "@multimediatype": "JPEG image file",
            "@type": "IMAGE-DOWNSAMPLED",
            "@size": "5502",
            "@ref": "fx4",
            "@mimetype": "image/jpeg"
          },
          {
            "@category": "standard",
            "@height": "155",
            "@width": "111",
            "@_fa": "true",
            "$": "https://api.elsevier.com/content/object/eid/1-s2.0-S2095495623000335-fx5.jpg?httpAccept=%2A%2F%2A",
            "@multimediatype": "JPEG image file",
            "@type": "IMAGE-DOWNSAMPLED",
            "@size": "4922",
            "@ref": "fx5",
            "@mimetype": "image/jpeg"
          },
          {
            "@category": "standard",
            "@height": "441",
            "@width": "535",
            "@_fa": "true",
            "$": "https://api.elsevier.com/content/object/eid/1-s2.0-S2095495623000335-gr1.jpg?httpAccept=%2A%2F%2A",
            "@multimediatype": "JPEG image file",
            "@type": "IMAGE-DOWNSAMPLED",
            "@size": "64686",
            "@ref": "gr1",
            "@mimetype": "image/jpeg"
          },
          {
            "@category": "thumbnail",
            "@height": "148",
            "@width": "219",
            "@_fa": "true",
            "$": "https://api.elsevier.com/content/object/eid/1-s2.0-S2095495623000335-gr10.sml?httpAccept=%2A%2F%2A",
            "@multimediatype": "GIF image file",
            "@type": "IMAGE-THUMBNAIL",
            "@size": "12544",
            "@ref": "gr10",
            "@mimetype": "image/gif"
          },
          {
            "@category": "thumbnail",
            "@height": "164",
            "@width": "139",
            "@_fa": "true",
            "$": "https://api.elsevier.com/content/object/eid/1-s2.0-S2095495623000335-gr11.sml?httpAccept=%2A%2F%2A",
            "@multimediatype": "GIF image file",
            "@type": "IMAGE-THUMBNAIL",
            "@size": "10820",
            "@ref": "gr11",
            "@mimetype": "image/gif"
          },
          {
            "@category": "thumbnail",
            "@height": "164",
            "@width": "179",
            "@_fa": "true",
            "$": "https://api.elsevier.com/content/object/eid/1-s2.0-S2095495623000335-gr12.sml?httpAccept=%2A%2F%2A",
            "@multimediatype": "GIF image file",
            "@type": "IMAGE-THUMBNAIL",
            "@size": "15686",
            "@ref": "gr12",
            "@mimetype": "image/gif"
          },
          {
            "@category": "thumbnail",
            "@height": "164",
            "@width": "167",
            "@_fa": "true",
            "$": "https://api.elsevier.com/content/object/eid/1-s2.0-S2095495623000335-gr13.sml?httpAccept=%2A%2F%2A",
            "@multimediatype": "GIF image file",
            "@type": "IMAGE-THUMBNAIL",
            "@size": "11221",
            "@ref": "gr13",
            "@mimetype": "image/gif"
          },
          {
            "@category": "thumbnail",
            "@height": "144",
            "@width": "219",
            "@_fa": "true",
            "$": "https://api.elsevier.com/content/object/eid/1-s2.0-S2095495623000335-gr14.sml?httpAccept=%2A%2F%2A",
            "@multimediatype": "GIF image file",
            "@type": "IMAGE-THUMBNAIL",
            "@size": "18587",
            "@ref": "gr14",
            "@mimetype": "image/gif"
          },
          {
            "@category": "thumbnail",
            "@height": "91",
            "@width": "219",
            "@_fa": "true",
            "$": "https://api.elsevier.com/content/object/eid/1-s2.0-S2095495623000335-gr15.sml?httpAccept=%2A%2F%2A",
            "@multimediatype": "GIF image file",
            "@type": "IMAGE-THUMBNAIL",
            "@size": "11419",
            "@ref": "gr15",
            "@mimetype": "image/gif"
          },
          {
            "@category": "thumbnail",
            "@height": "119",
            "@width": "219",
            "@_fa": "true",
            "$": "https://api.elsevier.com/content/object/eid/1-s2.0-S2095495623000335-gr16.sml?httpAccept=%2A%2F%2A",
            "@multimediatype": "GIF image file",
            "@type": "IMAGE-THUMBNAIL",
            "@size": "14273",
            "@ref": "gr16",
            "@mimetype": "image/gif"
          },
          {
            "@category": "thumbnail",
            "@height": "163",
            "@width": "195",
            "@_fa": "true",
            "$": "https://api.elsevier.com/content/object/eid/1-s2.0-S2095495623000335-gr17.sml?httpAccept=%2A%2F%2A",
            "@multimediatype": "GIF image file",
            "@type": "IMAGE-THUMBNAIL",
            "@size": "13015",
            "@ref": "gr17",
            "@mimetype": "image/gif"
          },
          {
            "@category": "thumbnail",
            "@height": "163",
            "@width": "156",
            "@_fa": "true",
            "$": "https://api.elsevier.com/content/object/eid/1-s2.0-S2095495623000335-gr2.sml?httpAccept=%2A%2F%2A",
            "@multimediatype": "GIF image file",
            "@type": "IMAGE-THUMBNAIL",
            "@size": "18273",
            "@ref": "gr2",
            "@mimetype": "image/gif"
          },
          {
            "@category": "thumbnail",
            "@height": "164",
            "@width": "191",
            "@_fa": "true",
            "$": "https://api.elsevier.com/content/object/eid/1-s2.0-S2095495623000335-gr3.sml?httpAccept=%2A%2F%2A",
            "@multimediatype": "GIF image file",
            "@type": "IMAGE-THUMBNAIL",
            "@size": "19574",
            "@ref": "gr3",
            "@mimetype": "image/gif"
          },
          {
            "@category": "thumbnail",
            "@height": "164",
            "@width": "142",
            "@_fa": "true",
            "$": "https://api.elsevier.com/content/object/eid/1-s2.0-S2095495623000335-gr4.sml?httpAccept=%2A%2F%2A",
            "@multimediatype": "GIF image file",
            "@type": "IMAGE-THUMBNAIL",
            "@size": "13658",
            "@ref": "gr4",
            "@mimetype": "image/gif"
          },
          {
            "@category": "thumbnail",
            "@height": "135",
            "@width": "219",
            "@_fa": "true",
            "$": "https://api.elsevier.com/content/object/eid/1-s2.0-S2095495623000335-gr5.sml?httpAccept=%2A%2F%2A",
            "@multimediatype": "GIF image file",
            "@type": "IMAGE-THUMBNAIL",
            "@size": "17456",
            "@ref": "gr5",
            "@mimetype": "image/gif"
          },
          {
            "@category": "thumbnail",
            "@height": "158",
            "@width": "219",
            "@_fa": "true",
            "$": "https://api.elsevier.com/content/object/eid/1-s2.0-S2095495623000335-gr6.sml?httpAccept=%2A%2F%2A",
            "@multimediatype": "GIF image file",
            "@type": "IMAGE-THUMBNAIL",
            "@size": "17094",
            "@ref": "gr6",
            "@mimetype": "image/gif"
          },
          {
            "@category": "thumbnail",
            "@height": "160",
            "@width": "219",
            "@_fa": "true",
            "$": "https://api.elsevier.com/content/object/eid/1-s2.0-S2095495623000335-gr7.sml?httpAccept=%2A%2F%2A",
            "@multimediatype": "GIF image file",
            "@type": "IMAGE-THUMBNAIL",
            "@size": "11282",
            "@ref": "gr7",
            "@mimetype": "image/gif"
          },
          {
            "@category": "thumbnail",
            "@height": "112",
            "@width": "219",
            "@_fa": "true",
            "$": "https://api.elsevier.com/content/object/eid/1-s2.0-S2095495623000335-gr8.sml?httpAccept=%2A%2F%2A",
            "@multimediatype": "GIF image file",
            "@type": "IMAGE-THUMBNAIL",
            "@size": "10854",
            "@ref": "gr8",
            "@mimetype": "image/gif"
          },
          {
            "@category": "thumbnail",
            "@height": "163",
            "@width": "193",
            "@_fa": "true",
            "$": "https://api.elsevier.com/content/object/eid/1-s2.0-S2095495623000335-gr9.sml?httpAccept=%2A%2F%2A",
            "@multimediatype": "GIF image file",
            "@type": "IMAGE-THUMBNAIL",
            "@size": "15008",
            "@ref": "gr9",
            "@mimetype": "image/gif"
          },
          {
            "@category": "thumbnail",
            "@height": "163",
            "@width": "194",
            "@_fa": "true",
            "$": "https://api.elsevier.com/content/object/eid/1-s2.0-S2095495623000335-ga1.sml?httpAccept=%2A%2F%2A",
            "@multimediatype": "GIF image file",
            "@type": "IMAGE-THUMBNAIL",
            "@size": "13558",
            "@ref": "ga1",
            "@mimetype": "image/gif"
          },
          {
            "@category": "thumbnail",
            "@height": "164",
            "@width": "117",
            "@_fa": "true",
            "$": "https://api.elsevier.com/content/object/eid/1-s2.0-S2095495623000335-fx1.sml?httpAccept=%2A%2F%2A",
            "@multimediatype": "GIF image file",
            "@type": "IMAGE-THUMBNAIL",
            "@size": "14287",
            "@ref": "fx1",
            "@mimetype": "image/gif"
          },
          {
            "@category": "thumbnail",
            "@height": "164",
            "@width": "117",
            "@_fa": "true",
            "$": "https://api.elsevier.com/content/object/eid/1-s2.0-S2095495623000335-fx2.sml?httpAccept=%2A%2F%2A",
            "@multimediatype": "GIF image file",
            "@type": "IMAGE-THUMBNAIL",
            "@size": "15260",
            "@ref": "fx2",
            "@mimetype": "image/gif"
          },
          {
            "@category": "thumbnail",
            "@height": "164",
            "@width": "117",
            "@_fa": "true",
            "$": "https://api.elsevier.com/content/object/eid/1-s2.0-S2095495623000335-fx3.sml?httpAccept=%2A%2F%2A",
            "@multimediatype": "GIF image file",
            "@type": "IMAGE-THUMBNAIL",
            "@size": "14378",
            "@ref": "fx3",
            "@mimetype": "image/gif"
          },
          {
            "@category": "thumbnail",
            "@height": "164",
            "@width": "117",
            "@_fa": "true",
            "$": "https://api.elsevier.com/content/object/eid/1-s2.0-S2095495623000335-fx4.sml?httpAccept=%2A%2F%2A",
            "@multimediatype": "GIF image file",
            "@type": "IMAGE-THUMBNAIL",
            "@size": "12173",
            "@ref": "fx4",
            "@mimetype": "image/gif"
          },
          {
            "@category": "thumbnail",
            "@height": "164",
            "@width": "117",
            "@_fa": "true",
            "$": "https://api.elsevier.com/content/object/eid/1-s2.0-S2095495623000335-fx5.sml?httpAccept=%2A%2F%2A",
            "@multimediatype": "GIF image file",
            "@type": "IMAGE-THUMBNAIL",
            "@size": "11838",
            "@ref": "fx5",
            "@mimetype": "image/gif"
          },
          {
            "@category": "thumbnail",
            "@height": "164",
            "@width": "199",
            "@_fa": "true",
            "$": "https://api.elsevier.com/content/object/eid/1-s2.0-S2095495623000335-gr1.sml?httpAccept=%2A%2F%2A",
            "@multimediatype": "GIF image file",
            "@type": "IMAGE-THUMBNAIL",
            "@size": "11384",
            "@ref": "gr1",
            "@mimetype": "image/gif"
          },
          {
            "@category": "high",
            "@height": "1604",
            "@width": "2368",
            "@_fa": "true",
            "$": "https://api.elsevier.com/content/object/eid/1-s2.0-S2095495623000335-gr10_lrg.jpg?httpAccept=%2A%2F%2A",
            "@multimediatype": "JPEG image file",
            "@type": "IMAGE-HIGH-RES",
            "@size": "374449",
            "@ref": "gr10",
            "@mimetype": "image/jpeg"
          },
          {
            "@category": "high",
            "@height": "2005",
            "@width": "1699",
            "@_fa": "true",
            "$": "https://api.elsevier.com/content/object/eid/1-s2.0-S2095495623000335-gr11_lrg.jpg?httpAccept=%2A%2F%2A",
            "@multimediatype": "JPEG image file",
            "@type": "IMAGE-HIGH-RES",
            "@size": "359416",
            "@ref": "gr11",
            "@mimetype": "image/jpeg"
          },
          {
            "@category": "high",
            "@height": "2763",
            "@width": "3015",
            "@_fa": "true",
            "$": "https://api.elsevier.com/content/object/eid/1-s2.0-S2095495623000335-gr12_lrg.jpg?httpAccept=%2A%2F%2A",
            "@multimediatype": "JPEG image file",
            "@type": "IMAGE-HIGH-RES",
            "@size": "767395",
            "@ref": "gr12",
            "@mimetype": "image/jpeg"
          },
          {
            "@category": "high",
            "@height": "2321",
            "@width": "2368",
            "@_fa": "true",
            "$": "https://api.elsevier.com/content/object/eid/1-s2.0-S2095495623000335-gr13_lrg.jpg?httpAccept=%2A%2F%2A",
            "@multimediatype": "JPEG image file",
            "@type": "IMAGE-HIGH-RES",
            "@size": "484706",
            "@ref": "gr13",
            "@mimetype": "image/jpeg"
          },
          {
            "@category": "high",
            "@height": "1828",
            "@width": "2782",
            "@_fa": "true",
            "$": "https://api.elsevier.com/content/object/eid/1-s2.0-S2095495623000335-gr14_lrg.jpg?httpAccept=%2A%2F%2A",
            "@multimediatype": "JPEG image file",
            "@type": "IMAGE-HIGH-RES",
            "@size": "612825",
            "@ref": "gr14",
            "@mimetype": "image/jpeg"
          },
          {
            "@category": "high",
            "@height": "984",
            "@width": "2368",
            "@_fa": "true",
            "$": "https://api.elsevier.com/content/object/eid/1-s2.0-S2095495623000335-gr15_lrg.jpg?httpAccept=%2A%2F%2A",
            "@multimediatype": "JPEG image file",
            "@type": "IMAGE-HIGH-RES",
            "@size": "295978",
            "@ref": "gr15",
            "@mimetype": "image/jpeg"
          },
          {
            "@category": "high",
            "@height": "1707",
            "@width": "3154",
            "@_fa": "true",
            "$": "https://api.elsevier.com/content/object/eid/1-s2.0-S2095495623000335-gr16_lrg.jpg?httpAccept=%2A%2F%2A",
            "@multimediatype": "JPEG image file",
            "@type": "IMAGE-HIGH-RES",
            "@size": "570288",
            "@ref": "gr16",
            "@mimetype": "image/jpeg"
          },
          {
            "@category": "high",
            "@height": "1419",
            "@width": "1693",
            "@_fa": "true",
            "$": "https://api.elsevier.com/content/object/eid/1-s2.0-S2095495623000335-gr17_lrg.jpg?httpAccept=%2A%2F%2A",
            "@multimediatype": "JPEG image file",
            "@type": "IMAGE-HIGH-RES",
            "@size": "248504",
            "@ref": "gr17",
            "@mimetype": "image/jpeg"
          },
          {
            "@category": "high",
            "@height": "1782",
            "@width": "1702",
            "@_fa": "true",
            "$": "https://api.elsevier.com/content/object/eid/1-s2.0-S2095495623000335-gr2_lrg.jpg?httpAccept=%2A%2F%2A",
            "@multimediatype": "JPEG image file",
            "@type": "IMAGE-HIGH-RES",
            "@size": "606799",
            "@ref": "gr2",
            "@mimetype": "image/jpeg"
          },
          {
            "@category": "high",
            "@height": "2463",
            "@width": "2866",
            "@_fa": "true",
            "$": "https://api.elsevier.com/content/object/eid/1-s2.0-S2095495623000335-gr3_lrg.jpg?httpAccept=%2A%2F%2A",
            "@multimediatype": "JPEG image file",
            "@type": "IMAGE-HIGH-RES",
            "@size": "871261",
            "@ref": "gr3",
            "@mimetype": "image/jpeg"
          },
          {
            "@category": "high",
            "@height": "2738",
            "@width": "2368",
            "@_fa": "true",
            "$": "https://api.elsevier.com/content/object/eid/1-s2.0-S2095495623000335-gr4_lrg.jpg?httpAccept=%2A%2F%2A",
            "@multimediatype": "JPEG image file",
            "@type": "IMAGE-HIGH-RES",
            "@size": "915887",
            "@ref": "gr4",
            "@mimetype": "image/jpeg"
          },
          {
            "@category": "high",
            "@height": "2161",
            "@width": "3509",
            "@_fa": "true",
            "$": "https://api.elsevier.com/content/object/eid/1-s2.0-S2095495623000335-gr5_lrg.jpg?httpAccept=%2A%2F%2A",
            "@multimediatype": "JPEG image file",
            "@type": "IMAGE-HIGH-RES",
            "@size": "1096741",
            "@ref": "gr5",
            "@mimetype": "image/jpeg"
          },
          {
            "@category": "high",
            "@height": "2540",
            "@width": "3526",
            "@_fa": "true",
            "$": "https://api.elsevier.com/content/object/eid/1-s2.0-S2095495623000335-gr6_lrg.jpg?httpAccept=%2A%2F%2A",
            "@multimediatype": "JPEG image file",
            "@type": "IMAGE-HIGH-RES",
            "@size": "794646",
            "@ref": "gr6",
            "@mimetype": "image/jpeg"
          },
          {
            "@category": "high",
            "@height": "2028",
            "@width": "2782",
            "@_fa": "true",
            "$": "https://api.elsevier.com/content/object/eid/1-s2.0-S2095495623000335-gr7_lrg.jpg?httpAccept=%2A%2F%2A",
            "@multimediatype": "JPEG image file",
            "@type": "IMAGE-HIGH-RES",
            "@size": "439997",
            "@ref": "gr7",
            "@mimetype": "image/jpeg"
          },
          {
            "@category": "high",
            "@height": "1213",
            "@width": "2368",
            "@_fa": "true",
            "$": "https://api.elsevier.com/content/object/eid/1-s2.0-S2095495623000335-gr8_lrg.jpg?httpAccept=%2A%2F%2A",
            "@multimediatype": "JPEG image file",
            "@type": "IMAGE-HIGH-RES",
            "@size": "331215",
            "@ref": "gr8",
            "@mimetype": "image/jpeg"
          },
          {
            "@category": "high",
            "@height": "2417",
            "@width": "2854",
            "@_fa": "true",
            "$": "https://api.elsevier.com/content/object/eid/1-s2.0-S2095495623000335-gr9_lrg.jpg?httpAccept=%2A%2F%2A",
            "@multimediatype": "JPEG image file",
            "@type": "IMAGE-HIGH-RES",
            "@size": "644346",
            "@ref": "gr9",
            "@mimetype": "image/jpeg"
          },
          {
            "@category": "high",
            "@height": "1085",
            "@width": "1288",
            "@_fa": "true",
            "$": "https://api.elsevier.com/content/object/eid/1-s2.0-S2095495623000335-ga1_lrg.jpg?httpAccept=%2A%2F%2A",
            "@multimediatype": "JPEG image file",
            "@type": "IMAGE-HIGH-RES",
            "@size": "151851",
            "@ref": "ga1",
            "@mimetype": "image/jpeg"
          },
          {
            "@category": "high",
            "@height": "413",
            "@width": "295",
            "@_fa": "true",
            "$": "https://api.elsevier.com/content/object/eid/1-s2.0-S2095495623000335-fx1_lrg.jpg?httpAccept=%2A%2F%2A",
            "@multimediatype": "JPEG image file",
            "@type": "IMAGE-HIGH-RES",
            "@size": "15236",
            "@ref": "fx1",
            "@mimetype": "image/jpeg"
          },
          {
            "@category": "high",
            "@height": "413",
            "@width": "295",
            "@_fa": "true",
            "$": "https://api.elsevier.com/content/object/eid/1-s2.0-S2095495623000335-fx2_lrg.jpg?httpAccept=%2A%2F%2A",
            "@multimediatype": "JPEG image file",
            "@type": "IMAGE-HIGH-RES",
            "@size": "23683",
            "@ref": "fx2",
            "@mimetype": "image/jpeg"
          },
          {
            "@category": "high",
            "@height": "413",
            "@width": "295",
            "@_fa": "true",
            "$": "https://api.elsevier.com/content/object/eid/1-s2.0-S2095495623000335-fx3_lrg.jpg?httpAccept=%2A%2F%2A",
            "@multimediatype": "JPEG image file",
            "@type": "IMAGE-HIGH-RES",
            "@size": "16817",
            "@ref": "fx3",
            "@mimetype": "image/jpeg"
          },
          {
            "@category": "high",
            "@height": "413",
            "@width": "295",
            "@_fa": "true",
            "$": "https://api.elsevier.com/content/object/eid/1-s2.0-S2095495623000335-fx4_lrg.jpg?httpAccept=%2A%2F%2A",
            "@multimediatype": "JPEG image file",
            "@type": "IMAGE-HIGH-RES",
            "@size": "17147",
            "@ref": "fx4",
            "@mimetype": "image/jpeg"
          },
          {
            "@category": "high",
            "@height": "413",
            "@width": "295",
            "@_fa": "true",
            "$": "https://api.elsevier.com/content/object/eid/1-s2.0-S2095495623000335-fx5_lrg.jpg?httpAccept=%2A%2F%2A",
            "@multimediatype": "JPEG image file",
            "@type": "IMAGE-HIGH-RES",
            "@size": "13253",
            "@ref": "fx5",
            "@mimetype": "image/jpeg"
          },
          {
            "@category": "high",
            "@height": "1950",
            "@width": "2368",
            "@_fa": "true",
            "$": "https://api.elsevier.com/content/object/eid/1-s2.0-S2095495623000335-gr1_lrg.jpg?httpAccept=%2A%2F%2A",
            "@multimediatype": "JPEG image file",
            "@type": "IMAGE-HIGH-RES",
            "@size": "373102",
            "@ref": "gr1",
            "@mimetype": "image/jpeg"
          },
          {
            "@category": "standard",
            "@_fa": "true",
            "$": "https://api.elsevier.com/content/object/eid/1-s2.0-S2095495623000335-mmc1.docx?httpAccept=%2A%2F%2A",
            "@multimediatype": "Microsoft Word file",
            "@type": "APPLICATION",
            "@size": "34903",
            "@ref": "mmc1",
            "@mimetype": "application/word"
          },
          {
            "@category": "standard",
            "@_fa": "true",
            "$": "https://api.elsevier.com/content/object/eid/1-s2.0-S2095495623000335-am.pdf?httpAccept=%2A%2F%2A",
            "@multimediatype": "Acrobat PDF file",
            "@type": "AAM-PDF",
            "@size": "3764306",
            "@ref": "am",
            "@mimetype": "application/pdf"
          }
        ]
      },
      "link": {
        "@rel": "abstract",
        "@href": "https://api.elsevier.com/content/abstract/scopus_id/85148016545"
      }
    }
  }
}