{
  "metadata": {
    "title": "Superhydrophobic Co/Fe sulfide nanoparticles and single-atoms doped carbon nanosheets composite air cathode for high-performance zinc-air batteries",
    "authors": "; ; ",
    "journal": "Journal of Energy Chemistry",
    "date": "2024-09-30",
    "doi": "10.1016/j.jechem.2024.05.013",
    "abstract": "",
    "uri": "https://api.elsevier.com/content/article/pii/S2095495624003565",
    "pii": "S2095495624003565"
  },
  "fulltext": {
    "full-text-retrieval-response": {
      "scopus-eid": "2-s2.0-85194362093",
      "originalText": "serial JL 286353 291210 291711 291744 291809 31 Journal of Energy Chemistry JOURNALENERGYCHEMISTRY 2024-05-17 2024-05-17 2024-05-30 2024-05-30 2025-01-27T15:58:53 1-s2.0-S2095495624003565 S2095-4956(24)00356-5 S2095495624003565 10.1016/j.jechem.2024.05.013 S300 S300.1 FULL-TEXT 1-s2.0-S2095495624X00066 2025-01-27T16:13:25.401202Z 0 0 20240901 20240930 2024 2024-05-17T17:01:32.573169Z absattachment articleinfo articletitlenorm authfirstinitialnorm authfirstsurnamenorm cid cids contenttype copyright crossmark dateloaded dateloadedtxt datesearch datesort dateupdated dco docsubtype doctype doi eid ewtransactionid hubeid indexeddate issn issnnorm itemstage itemtransactionid itemweight openaccess openarchive pg pgfirst pglast pii piinorm pubdateend pubdatestart pubdatetxt pubyr sortorder srctitle srctitlenorm srctype ssids alllist content subj subheadings suppl tomb volfirst volissue volumelist webpdf webpdfpagecount yearnav figure e-component body acknowledge affil appendices articletitle auth authfirstini authfull authkeywords authlast grantnumber grantsponsor grantsponsorid orcid primabst ref specialabst 2095-4956 20954956 false 96 96 C Volume 96 50 568 577 568 577 202409 September 2024 2024-09-01 2024-09-30 2024 article fla © 2024 Science Press and Dalian Institute of Chemical Physics, Chinese Academy of Sciences. Published by ELSEVIER B.V. and Science Press. All rights are reserved, including those for text and data mining, AI training, and similar technologies. SUPERHYDROPHOBICCOFESULFIDENANOPARTICLESSINGLEATOMSDOPEDCARBONNANOSHEETSCOMPOSITEAIRCATHODEFORHIGHPERFORMANCEZINCAIRBATTERIES TAN Y 1 Introduction 2 Experimental 2.1 Preparation of CoFeZn precursor nanosheet arrays 2.2 Preparation of Co3S4/FeS@CoFe/NC 2.3 Preparation of Co3S4@Co/NC, FeS@Fe/NC and Co3S4/FeS 3 Results and discussion 4 Conclusions CRediT authorship contribution statement Acknowledgments Appendix A Supplementary data References LI 2021 2004959 L YAN 2020 502 521 Y ZHU 2021 137 Y ZHOU 2021 2100024 Q SUN 2020 118139 H ZHAO 2023 2206067 D WANG 2020 7425 7433 Q WANG 2023 9565 9574 Q WU 2022 1183 1191 X HAN 2021 119411 J DU 2017 9210 9216 J HU 2021 2000961 X WANG 2022 134744 Y BO 2023 122536 L ZHOU 2023 3647 3655 Y XIA 2019 1906174 D CHEN 2021 25404 25410 Z WANG 2023 8622 8633 Z ZHAO 2023 e202313028 C WANG 2024 511 517 J YANG 2021 1734 G LIU 2021 13001 13009 Y SUN 2020 2003297 Y ZHAO 2023 27531 27538 C BAI 2023 2205638 H SHARPE 2016 3762 3768 R GRACIA 2019 9967 9972 J ZHANG 2023 202216837 Z LI 2021 119778 H RAN 2023 2206367 J WAN 2022 4535 4543 L ZHANG 2020 1731 Q FENG 2022 5960 5993 X WANG 2020 55 59 D AGARWAL 2020 100405 S LIU 2021 127569 X ZHANG 2021 2255 2264 H CAO 2018 18877 18883 J ZHANG 2022 2104248 Z WANG 2022 2204247 A SUN 2021 13926 13935 C JI 2018 14632 14640 L CHEN 2020 118729 D LUO 2022 1167 1179 W GU 2022 2212299 T XIE 2021 2102688 X CHEN 2023 47 S LU 2016 7155 7161 Z YAN 2023 2204245 L HAOLI 2021 13971 W ZHANG 2019 1657 Z ZHOU 2020 2003251 T TREIMER 2002 165 171 S LIU 2020 18162 18172 L XIE 2020 1044 1054 X REN 2021 2608 X ZHAO 2021 2008606 C ZHOU 2022 3392 3399 X WANG 2021 3640 3648 H XIUXIUMA 2017 9848 9857 X LI 2019 1900592 B DUAN 2020 9355 9363 X XIE 2019 1906477 W SARKAR 2022 7890 7903 S QIANG 2022 4002 4015 F PENGZUOCHEN 2017 610 614 T ZHAO 2023 122251 B GUAN 2019 243 250 C FENG 2022 211 218 Y LV 2024 144 151 Q PEI 2019 234 242 Z SHINDE 2021 592 604 S LV 2023 744 752 M KORDEK 2019 1802936 K TANX2024X568 TANX2024X568X577 TANX2024X568XY TANX2024X568X577XY 2026-05-30T00:00:00.000Z 2026-05-30T00:00:00.000Z http://creativecommons.org/licenses/by-nc-nd/4.0/ © 2024 Science Press and Dalian Institute of Chemical Physics, Chinese Academy of Sciences. Published by ELSEVIER B.V. and Science Press. All rights are reserved, including those for text and data mining, AI training, and similar technologies. 2024-06-01T04:17:13.344Z http://vtw.elsevier.com/data/voc/AddOnTypes/50.7/aggregated-refined Science and Technology Commission of Shanghai Municipality 21JC405700 STCSM Science and Technology Commission of Shanghai Municipality http://data.elsevier.com/vocabulary/SciValFunders/501100003399 http://sws.geonames.org/1814991/ Shanghai Key Laboratory of Special Artificial Microstructure Materials and Technology National Natural Science Foundation of China 51772213 12274324 12004283 NSFC National Natural Science Foundation of China http://data.elsevier.com/vocabulary/SciValFunders/501100001809 http://sws.geonames.org/1814991/ This work was supported by National Natural Science Foundation of China (Nos. 51772213, 12004283, 12274324), Science and Technology Commission of Shanghai Municipality (No 21JC405700), Shanghai Key Laboratory of Special Artificial Microstructure Materials and Technology. We gratefully acknowledge HZWTECH for providing computation facilities and the Anhui Absorption Spectroscopy Analysis Instrument Co, Ltd. for XAFS measurements and analysis. item S2095-4956(24)00356-5 S2095495624003565 1-s2.0-S2095495624003565 10.1016/j.jechem.2024.05.013 286353 2025-01-27T16:13:25.401202Z 2024-09-01 2024-09-30 1-s2.0-S2095495624003565-main.pdf https://s3-eu-west-1.amazonaws.com/prod-ucs-content-store-eu-west/content/pii:S2095495624003565/MAIN/application/pdf/9cfea0f8c20588810f82c50aacb1c3a9/main.pdf main.pdf pdf true 4105835 MAIN 10 1-s2.0-S2095495624003565-main_1.png https://s3-eu-west-1.amazonaws.com/prod-ucs-content-store-eu-west/content/pii:S2095495624003565/PREVIEW/image/png/42734aec22bd0bdb1fb3e0f2776ddcd1/main_1.png main_1.png png 60631 849 656 IMAGE-WEB-PDF 1 1-s2.0-S2095495624003565-ga1.jpg https://s3-eu-west-1.amazonaws.com/prod-ucs-content-store-eu-west/content/pii:S2095495624003565/ga1/HIGHRES/image/jpeg/e503429c0581d700c3bd0bd7a7a423e9/ga1.jpg ga1 true ga1.jpg jpg 35703 200 496 IMAGE-DOWNSAMPLED 1-s2.0-S2095495624003565-gr1.jpg https://s3-eu-west-1.amazonaws.com/prod-ucs-content-store-eu-west/content/pii:S2095495624003565/gr1/DOWNSAMPLED/image/jpeg/5103b7aeef5070315fdca50a03f95ce1/gr1.jpg gr1 gr1.jpg jpg 122122 532 647 IMAGE-DOWNSAMPLED 1-s2.0-S2095495624003565-gr2.jpg https://s3-eu-west-1.amazonaws.com/prod-ucs-content-store-eu-west/content/pii:S2095495624003565/gr2/DOWNSAMPLED/image/jpeg/9e3373d3f5ebe74f8fdec063a63dc6a7/gr2.jpg gr2 gr2.jpg jpg 97638 431 774 IMAGE-DOWNSAMPLED 1-s2.0-S2095495624003565-gr3.jpg https://s3-eu-west-1.amazonaws.com/prod-ucs-content-store-eu-west/content/pii:S2095495624003565/gr3/DOWNSAMPLED/image/jpeg/9756999a75248fd8e42d52fb50e06516/gr3.jpg gr3 gr3.jpg jpg 139625 445 774 IMAGE-DOWNSAMPLED 1-s2.0-S2095495624003565-gr4.jpg https://s3-eu-west-1.amazonaws.com/prod-ucs-content-store-eu-west/content/pii:S2095495624003565/gr4/DOWNSAMPLED/image/jpeg/481b8feb3253c7f4464a0ed9dde83410/gr4.jpg gr4 gr4.jpg jpg 68025 405 667 IMAGE-DOWNSAMPLED 1-s2.0-S2095495624003565-gr5.jpg https://s3-eu-west-1.amazonaws.com/prod-ucs-content-store-eu-west/content/pii:S2095495624003565/gr5/DOWNSAMPLED/image/jpeg/c08e7fb812ab7c38d4817bff8afd0655/gr5.jpg gr5 gr5.jpg jpg 156559 612 774 IMAGE-DOWNSAMPLED 1-s2.0-S2095495624003565-gr6.jpg https://s3-eu-west-1.amazonaws.com/prod-ucs-content-store-eu-west/content/pii:S2095495624003565/gr6/DOWNSAMPLED/image/jpeg/c477843e526cec3c40d442f91a407f6d/gr6.jpg gr6 gr6.jpg jpg 168986 654 667 IMAGE-DOWNSAMPLED 1-s2.0-S2095495624003565-gr7.jpg https://s3-eu-west-1.amazonaws.com/prod-ucs-content-store-eu-west/content/pii:S2095495624003565/gr7/DOWNSAMPLED/image/jpeg/1b523a933ff8de95309b2a5dafb430d2/gr7.jpg gr7 gr7.jpg jpg 109388 510 774 IMAGE-DOWNSAMPLED 1-s2.0-S2095495624003565-ga1.sml https://s3-eu-west-1.amazonaws.com/prod-ucs-content-store-eu-west/content/pii:S2095495624003565/ga1/THUMBNAIL/image/gif/2062e29b19c0b98a281ee5bd560d6e30/ga1.sml ga1 true ga1.sml sml 9474 88 219 IMAGE-THUMBNAIL 1-s2.0-S2095495624003565-gr1.sml https://s3-eu-west-1.amazonaws.com/prod-ucs-content-store-eu-west/content/pii:S2095495624003565/gr1/THUMBNAIL/image/gif/ce6306da4e50e6d5fb7aa5affede3efa/gr1.sml gr1 gr1.sml sml 19593 164 199 IMAGE-THUMBNAIL 1-s2.0-S2095495624003565-gr2.sml https://s3-eu-west-1.amazonaws.com/prod-ucs-content-store-eu-west/content/pii:S2095495624003565/gr2/THUMBNAIL/image/gif/a29cd3cc1c5e82f4562f63ab21626fb1/gr2.sml gr2 gr2.sml sml 11282 122 219 IMAGE-THUMBNAIL 1-s2.0-S2095495624003565-gr3.sml https://s3-eu-west-1.amazonaws.com/prod-ucs-content-store-eu-west/content/pii:S2095495624003565/gr3/THUMBNAIL/image/gif/dbb3cfc1f7b3ab74e28284da568e8c4a/gr3.sml gr3 gr3.sml sml 17147 126 219 IMAGE-THUMBNAIL 1-s2.0-S2095495624003565-gr4.sml https://s3-eu-west-1.amazonaws.com/prod-ucs-content-store-eu-west/content/pii:S2095495624003565/gr4/THUMBNAIL/image/gif/60c34b18be27d4b318e29a9bfd39d73c/gr4.sml gr4 gr4.sml sml 14492 133 219 IMAGE-THUMBNAIL 1-s2.0-S2095495624003565-gr5.sml https://s3-eu-west-1.amazonaws.com/prod-ucs-content-store-eu-west/content/pii:S2095495624003565/gr5/THUMBNAIL/image/gif/d472c270fb43194051570564ebdc8f45/gr5.sml gr5 gr5.sml sml 14817 164 207 IMAGE-THUMBNAIL 1-s2.0-S2095495624003565-gr6.sml https://s3-eu-west-1.amazonaws.com/prod-ucs-content-store-eu-west/content/pii:S2095495624003565/gr6/THUMBNAIL/image/gif/7bef3d931b5efa017d38ca55bd628f2a/gr6.sml gr6 gr6.sml sml 14279 164 167 IMAGE-THUMBNAIL 1-s2.0-S2095495624003565-gr7.sml https://s3-eu-west-1.amazonaws.com/prod-ucs-content-store-eu-west/content/pii:S2095495624003565/gr7/THUMBNAIL/image/gif/42901dc07e8deba965620dd6d95aadfe/gr7.sml gr7 gr7.sml sml 12977 144 219 IMAGE-THUMBNAIL 1-s2.0-S2095495624003565-ga1_lrg.jpg https://s3-eu-west-1.amazonaws.com/prod-ucs-content-store-eu-west/content/pii:S2095495624003565/HIGHRES/image/jpeg/6eca145cfb7a5c231cb83a2de43c98e7/ga1_lrg.jpg ga1 true ga1_lrg.jpg jpg 219147 886 2195 IMAGE-HIGH-RES 1-s2.0-S2095495624003565-gr1_lrg.jpg https://s3-eu-west-1.amazonaws.com/prod-ucs-content-store-eu-west/content/pii:S2095495624003565/HIGHRES/image/jpeg/18385415e02b2e24dff32aed5b63f00f/gr1_lrg.jpg gr1 gr1_lrg.jpg jpg 310359 1036 1260 IMAGE-HIGH-RES 1-s2.0-S2095495624003565-gr2_lrg.jpg https://s3-eu-west-1.amazonaws.com/prod-ucs-content-store-eu-west/content/pii:S2095495624003565/HIGHRES/image/jpeg/b64bcad01f2b3b14f0348bc9ee2b5ed6/gr2_lrg.jpg gr2 gr2_lrg.jpg jpg 545137 1908 3425 IMAGE-HIGH-RES 1-s2.0-S2095495624003565-gr3_lrg.jpg https://s3-eu-west-1.amazonaws.com/prod-ucs-content-store-eu-west/content/pii:S2095495624003565/HIGHRES/image/jpeg/f9b1ac761bb9617ed697fe9d62f4d1d0/gr3_lrg.jpg gr3 gr3_lrg.jpg jpg 823753 1969 3425 IMAGE-HIGH-RES 1-s2.0-S2095495624003565-gr4_lrg.jpg https://s3-eu-west-1.amazonaws.com/prod-ucs-content-store-eu-west/content/pii:S2095495624003565/HIGHRES/image/jpeg/bf678771759ab0d0445e7e1a47878881/gr4_lrg.jpg gr4 gr4_lrg.jpg jpg 389604 1792 2953 IMAGE-HIGH-RES 1-s2.0-S2095495624003565-gr5_lrg.jpg https://s3-eu-west-1.amazonaws.com/prod-ucs-content-store-eu-west/content/pii:S2095495624003565/MAIN/image/jpeg/4d735445f1c3b42556cd3ed04cd19599/gr5_lrg.jpg gr5 gr5_lrg.jpg jpg 850870 2710 3425 IMAGE-HIGH-RES 1-s2.0-S2095495624003565-gr6_lrg.jpg https://s3-eu-west-1.amazonaws.com/prod-ucs-content-store-eu-west/content/pii:S2095495624003565/HIGHRES/image/jpeg/2242c7a83315ade0139d4d251c24aa2d/gr6_lrg.jpg gr6 gr6_lrg.jpg jpg 981439 2896 2953 IMAGE-HIGH-RES 1-s2.0-S2095495624003565-gr7_lrg.jpg https://s3-eu-west-1.amazonaws.com/prod-ucs-content-store-eu-west/content/pii:S2095495624003565/HIGHRES/image/jpeg/edefbcf1315a53e902928168c98e41fc/gr7_lrg.jpg gr7 gr7_lrg.jpg jpg 700586 2257 3425 IMAGE-HIGH-RES 1-s2.0-S2095495624003565-mmc1.pdf https://s3-eu-west-1.amazonaws.com/prod-ucs-content-store-eu-west/content/pii:S2095495624003565/mmc1/MAIN/application/pdf/241b07bb2b16ee8e34badb36e0e6104b/mmc1.pdf mmc1 mmc1.pdf pdf false 2962675 APPLICATION 1-s2.0-S2095495624003565-am.pdf https://s3-eu-west-1.amazonaws.com/prod-ucs-content-store-eu-west/content/egi:10TT0NZXRDF/MAIN/application/pdf/339c29eb84e8eb944280ea8ae1ba2389/am.pdf am am.pdf pdf false 29111899 AAM-PDF JECHEM 3867 S2095-4956(24)00356-5 10.1016/j.jechem.2024.05.013 Science Press Fig. 1 (a) Schematic illustration of the preparation, (b and c) SEM images, (d) XRD pattern, (e and f) HR-TEM images, and (g) HAADF-STEM image of Co3S4/FeS@CoFe/NC. Fig. 2 High-resolution fine spectra of (a) Co 2p, (b) Fe 2p, (c) S 2p, (d) C 1s, (e) N 1s, and (f) O 1s of Co3S4/FeS@CoFe/NC. Fig. 3 (a and b) Normalized XANES spectra and (c and d) Fourier transforms of EXAFS spectra at the Co K-edge and Fe K-edge of Co3S4/FeS@CoFe/NC catalyst and the reference materials at R space. Wavelet transform (WT) of (e) Co K-edge and (f) Fe K-edge EXAFS spectra for Co foil, Fe foil, CoPc, FePc, and Co3S4/FeS@CoFe/NC, respectively. EXAFS curves represent fitted data based on (g) Co K-edge and (h) Fe K-edge and experimental data, with the fitted structure of Co3S4/FeS@CoFe/NC catalyst at the insets. Fig. 4 (a) Schematic diagram of the three-phase interface at the air electrode of ZABs. (b) Surface contact angles measured at Co3S4/FeS@CoFe/NC and Co3S4/FeS electrodes, (c) Evolution of O2 bubble desorption behaviors on the surface of Co3S4/FeS@CoFe/NC and Pt/C-RuO2 electrodes in KOH solution. (d) Finite element multi-physics field simulations of O2 diffusion and concentration distribution near Co3S4/FeS@CoFe/NC and Co3S4/FeS air cathodes. Fig. 5 (a) OER and (b) ORR LSV curves of Co3S4/FeS@CoFe/NC, Co3S4/FeS, Pt/C and RuO2. (c) ORR LSV curves and (d) Koutecky-Levith diagrams of Co3S4/FeS@CoFe/NC at different rotation speeds and potentials for ORR tests. (e) OER and (f) ORR polarization curves of Co3S4/FeS@CoFe/NC, Pt/C and RuO2 before and after 3000 CV cycles. (g) Bifunctional LSV curves of Co3S4/FeS@CoFe/NC, Co3S4/FeS, and Pt/C-RuO2. (h) Comparison of bifunctional catalytic performance between powdered Co3S4/FeS@CoFe/NC and other recently reported oxygen electrocatalysts (“[Bibliography Number]” refers to corresponding reference). Fig. 6 (a) The real-space distributions of spin density (the first row, the blue and orange colors of the electron cloud indicate two different spin orientations, respectively) and charge density difference (the second row, the charge accumulation and consumption regions are represented by yellow and blue, respectively) by DFT calculations for O adsorbed on Co3S4/FeS@CoFe/NC, Co3S4@Co/NC, FeS@Fe/NC, Co3S4/FeS. Dark blue, orange, yellow, blue gray, brown, red and white spheres represent cobalt, iron, sulfur, nitrogen, carbon, oxygen and hydrogen atoms, respectively. (b) O and HO adsorption energy of Co3S4/FeS@CoFe/NC, Co3S4@Co/NC, FeS@Fe/NC and Co3S4/FeS. (c) OER and (d) ORR free energy step diagrams in Co3S4/FeS@CoFe/NC, Co3S4@Co/NC, FeS@Fe/NC, Co3S4/FeS, Pt-111, and RuO2-110 at U = 0 V and 1.23 V. (e and f) Total densities of states (TDOSs) of Co3S4/FeS@CoFe/NC, Co3S4@Co/NC, FeS@Fe/NC and Co3S4/FeS before and after O adsorption. Fig. 7 (a) The discharge specific capacities curves and assembly diagram (inset), (b) polarization curves, power density curves and (c) galvanostatic charge–discharge cycling curves at 5 mA cm−2 of liquid ZABs based on Co3S4/FeS@CoFe/NC and Pt/C-RuO2 air cathode. (d) The discharge specific capacity curves of quasi-solid-state ZABs based on Co3S4/FeS@CoFe/NC and Pt/C-RuO2 as air cathode, and LED digital photos powered by three Co3S4/FeS@CoFe/NC-based quasi-solid-state ZABs in series (inset). (e) Charge-discharge curves of Co3S4/FeS@CoFe/NC-based quasi-solid-state ZABs at different bending angles. Superhydrophobic Co/Fe sulfide nanoparticles and single-atoms doped carbon nanosheets composite air cathode for high-performance zinc-air batteries Yan Tan Writing – review & editing Writing – original draft Visualization Software Investigation Formal analysis Data curation Conceptualization Yijie Wang Validation Software Investigation Aoshuang Li Validation Project administration Xiucai Jiang Supervision Formal analysis Yuzhong Zhang Writing – review & editing Supervision Software Funding acquisition ⁎ Chuanwei Cheng Writing – review & editing Supervision Methodology Funding acquisition ⁎ Shanghai Key Laboratory of Special Artificial Microstructure Materials and Technology, School of Physics Science and Engineering, Tongji University, Shanghai 200092, China Shanghai Key Laboratory of Special Artificial Microstructure Materials and Technology School of Physics Science and Engineering Tongji University Shanghai 200092 China Shanghai Key Laboratory of Special Artificial Microstructure Materials and Technology, School of Physics Science and Engineering, Tongji University, Shanghai 200092, China ⁎ Corresponding authors. Graphical abstract Sulfuration-strategy enhances OER activity of the SACs. 3D carbon shells improve hydrophobicity of Co3S4/FeS@CoFe/NC, promoting effective gas–liquid-solid interface. Above modification optimizes spin-state and adsorption-energy of oxygen adsorption intermediates, leading excellent electrocatalytic activity and ZABs performance. Development of a high-performance bifunctional catalyst is essential for the actual implementation of zinc-air batteries in practical applications. Herein, a bifunctional cathode of Co3S4/FeS heterogeneous nanoparticles embedded in Co/Fe single-atom-loaded nitrogen-doped carbon nanosheets is designed. Cobalt-iron sulfides and single atomic sites with Co-N4/Fe-N4 configurations are confirmed to coexist on the carbon matrix by EXAFS spectroscopy. 3D self-supported super-hydrophobic multiphase composite cathode provides abundant active sites and facilitates gas–liquid-solid three-phase interface reactions, resulting in excellent electrocatalytic activity and batteries performance, i.e., an OER overpotential (η 10) of 260 mV, a half-wave potential (E 1/2) of 0.872 V for ORR, a ΔE of 0.618 V, and a discharge power density of 170 mW cm−2, a specific capacity of 816.3 mAh g−1. DFT analysis shows multiphase coupling of sulfide heterojunction through single-atomic metal doped carbon nanosheets reduces offset on center of electronic density of states before and after oxygen adsorption, and spin density of adsorbed oxygen with same spin orientation, leading to weakened charge/spin interactions between adsorbed oxygen and substrate, and a lowered oxygen adsorption energy to accelerate OER/ORR. Keywords Zn-air battery Superhydrophobic interface Metal sulfide Heterostructure Spin density 1 Introduction In response to increasing energy demands and environmental pollution concerns, various energy conversion/storage technologies have been developed, including alkali metal batteries, fuel cells and metal-air batteries [1–3]. Zinc-air batteries (ZABs) are widely considered as next-generation energy storage device arising from their high theoretical energy density (up to 1086 Wh kg−1), intrinsic safety, environmental friendliness, and low cost [4,5]. The discharging and charging processes at the air cathode involve oxygen reduction reaction (ORR) and oxygen evolution reaction (OER) [6]. The oxygen catalytic activity of air cathodes greatly affects the power density and cycling durability of ZABs. Although noble metal electrocatalysts such as Pt and Ru/Ir based oxides are considered as the benchmark electrocatalysts for ORR and OER, respectively, their scarcity, high cost and poor stability severely limit their wide practical applications [7]. Therefore, development of non-precious metal ORR/OER bifunctional oxygen electrocatalysts with suitable electrode microstructure, high bifunctional oxygen activity and excellent stability is particularly urgent for high performance and durable ZABs. In recent years, transition metal oxides, hydroxides, sulfides, phosphates, carbon-based materials, transition metal-nitrogen-carbon materials (M−N−C) and their hybrids have been well investigated for oxygen electrocatalysts [8–10]. Transition metal sulfides (TMSs) are considered as potential OER electrocatalysts due to their variable valence states and superior OER activity. However, they still face the challenges of poor ORR activity and excessive hydrophilicity in ZABs applications [11–14]. Recently, transition metal-based single atomic catalysts (SACs) have shown great potential in ZABs area due to their amazing ORR catalytic activity [15–17]. While the OER activity of most transition metal SACs is still far from satisfactory. Though transition metal sulfides and single atom catalyst have been well investigated alone in previous reports, the integration of transition metal sulfides and single atomic metal species into a composite with excellent bifunctional activity is still a great challenge [18–20]. The charge and spin interactions have attracted more and more attention in oxygen-based catalysis process in recent years. Optimization of the interaction between the adsorbed substance and the reactive sites by the charge/spin interaction strength is essential for the design of high-performance catalysts [21–24]. In the OER/ORR-dominated field of oxygen electrocatalysis, the electron transfer exhibits highly spin-dependent features because the ground state of the O2 molecule is a triplet state, accounting for the paramagnetic of O2 [25–27]. The participation of triplet state O2 in either OER or ORR requires spin-dependent electron transfer along these oxygen reactions, which plays an important role in the reaction kinetics. However, the studies on charge/spin-modulated oxygen electrocatalysis are scarcely reported, and the charge/spin regulation mechanisms remain unclear [28–30]. Meanwhile, the discharge process of ZABs corresponds to the ORR process of the cathode dominated by oxygen diffusion. The concentrations of oxygen on the electrode surface are strongly correlated with the ORR rates, which in turn impacts the power density of ZABs [6]. As such, increasing the oxygen transport rates on the catalytic electrode is an effective way to improve the power density of ZABs. Previous studies have demonstrated that air cathode with surface hydrophobic characteristics would largely enhance the ORR kinetics and performance of ZABs [31–34]. Three-dimensional self-supported multiphase composite air cathode with super-hydrophobicity provides abundant accessible active sites and facilitates the gas–liquid-solid three-phase interface reactions. Herein, we report a bifunctional composite catalyst of bimetallic sulfide nanoparticles embedded in atomic Co/Fe doped carbon nanosheets, i.e., Co3S4/FeS@CoFe/NC, by a gas-phase metal–organic coordination, high-temperature pyrolysis, and subsequent sulfidation strategy. This bifunctional multiphase composite catalyst could provide a number of active sites for both OER and ORR process, wherein the graphitized NCNS with Co-N x /Fe-N x atomic sites contributes to ORR activity, while the Co3S4/FeS heterostructure nanoparticles take the task of catalyzing OER processes. Particularly, the sulfide-composite exhibits super-hydrophobic feature, which is beneficial to oxygen mass transfer and construction of an efficient gas–liquid-solid three-phase interface during the electrochemical reaction. Furthermore, the multiphase composite/doping strategy could optimize the catalyst electronic structure by charge/spin modulation, resulting in enhancement of the oxygen electrocatalytic activity. As a result, the as-fabricated composite catalyst delivers outstanding bifunctional oxygen activity with a low potential gap (ΔE) of 0.618 V and excellent ZABs performance. Further DFT calculations reveal that the coupling of bimetallic sulfide nanoparticles with atomic metal sites could lead a higher density of valence electron orbital states near the Fermi surface of the cobalt-iron sulfide. At the same time, the adsorbed oxygen has a moderate spin density in the same spin direction as the metal atoms, optimizing the adsorption strength of the adsorbed intermediate O*, leading to a lower oxygen adsorption energy and faster reaction kinetics. 2 Experimental 2.1 Preparation of CoFeZn precursor nanosheet arrays In a typical procedure, 1125 mg of urea, 175 mg of ammonium fluoride, 310 mg of zinc nitrate hexahydrate, 620 mg cobalt nitrate hexahydrate, and 430 mg ferric nitrate nine hydrate were dissolved in 37.5 mL deionized water. One piece of acid pre-treated carbon cloth (2 cm × 5 cm) with one side taped and the above solution was transferred to the PTFE reactor for hydrothermal growth at 90 °C for 7 h before being removed, cleaned with deionized water, and dried in a 65 °C oven. 2.2 Preparation of Co3S4/FeS@CoFe/NC The above precursor samples were heated at a rate of 5 °C min−1 for 2 h in air at 250 °C to cause mild oxidation. After being chilled to room temperature, the sample was placed in a single-way tube that contained 0.2 g of 2-methylimidazole quartz boat. Notice that the sample was positioned at downstream of 2-methylimidazole and then heated to 350 °C for 65 min, followed holding by 20 min of gas phase reaction and chilled to room temperature. The sample obtained above was put in a quartz tube, heated to 800 °C for 160 min, pyrolyzed for 2 h in an atmosphere of argon, and then cooled to room temperature. To obtain the Co3S4/FeS@CoFe/NC, as-prepared sample was inserted in a single-way tube with a quartz boat containing 50 mg sulfur powder. It should be noted that the sample was placed downstream of sulfur powder. The sample was then heated to 350 °C for 70 min, reacted for 60 min in Ar atmosphere and cooled to room temperature. 2.3 Preparation of Co3S4@Co/NC, FeS@Fe/NC and Co3S4/FeS Co3S4@Co/NC and FeS@Fe/NC were obtained in the same process as Co3S4/FeS@CoFe/NC except that the molar ratio of Co/Fe was controlled as 1:0 and 0:1 respectively during the hydrothermal growth of nanosheets. Co3S4/FeS can be obtained in the same process as Co3S4/FeS@CoFe/NC except without the processes of 2-methylimidazole reaction and high temperature cracking. 3 Results and discussion The fabrication processes of Co3S4/FeS@CoFe/NC are schematically illustrated in Fig. 1 (a). First, CoFeZn precursor nanosheets are hydrothermally grown on carbon cloth in Co2+, Fe3+, and Zn2+ solution environment. SEM images in Fig. S1(a–c) demonstrate that CoFeZn precursor nanosheet arrays are uniformly distributed on each carbon fiber. For comparison, CoZn and FeZn precursor nanosheet arrays were also prepared (as shown in Fig. S1d–i). The precursor nanosheet arrays were then pre-oxidized in air to maintain the array structure, and gas phase reacted with 2-methylimidazole vapor in argon atmosphere to form metal organic frameworks (MOF) structure [35]. The obtained sample was further subjected to high temperature pyrolysis and sulfated in argon atmosphere to obtain Co3S4/FeS@CoFe/NC, Co3S4@Co/NC and FeS@Fe/NC (Fig. 1b, c and Fig. S2a–f). During pyrolysis, MOFs spontaneously aromatized to create highly graphitized NCNS with Co-N x /Fe-N x single-atomic sites, and the high-temperature reduced Co/Fe nanoparticles were sulfated to form Co3S4/FeS heterostructure. Zinc species are evaporated at high temperatures and form a large number of micropores in the nanoparticles, which improves the dispersion of cobalt-iron species and increases the specific surface area [36]. As shown in Fig. 1(b and c), the nanosheet morphologies are well maintained, and obvious nanoparticles can be observed in the carbon nanosheets. In the absence of 2-methylimidazole gas reaction and high-temperature pyrolysis steps in the preparation of Co3S4/FeS@CoFe/NC, we obtained Co3S4/FeS nanosheets (Fig. S2g–i). The main physical phases of Co3S4/FeS@CoFe/NC were determined by XRD. Most of the XRD peaks in Fig. 1(d) belong to the C (002) of carbon substrate, Co3S4 (220) and FeS (011)/(020)/(131), respectively. A large carbon cloth background peak appears at 25° to 30°, accompanied by some test signal noise. The microstructure of Co3S4/FeS@CoFe/NC was examined by transmission electron microscopy (TEM) (Fig. S3a and b), which indicated a considerable number of ultrafine nanoparticles embedded in the carbon sheets. The EDX spectrum and TEM elemental mapping in Fig. S3(c and d) and Table S1 show the elemental composition and uniform elemental distribution of Co3S4/FeS@CoFe/NC. High-resolution TEM images (Fig. 1e and f) indicated that Co3S4 and FeS nanoparticles were anchored in the graphitic carbon layer, with crystal facet spacings of 3.34, 2.02, and 3.38 Å corresponding to the Co3S4 (220), FeS (131), and C (002) crystal facets, which is consistent with the results of XRD. Co3S4 and FeS coexist in Co3S4/FeS@CoFe/NC, forming a heterogeneous interface under carbon coating. The STEM image in Fig. 1(g) clearly shows the atomic Co/Fe (white dots) dispersed in carbon nanosheets at a high density. The interfacial charge transfer and the coupling effect between different components induced by the heterogeneous structure would improve the catalytic activity. The chemical composition and electronic states of the main elements in Co3S4/FeS@CoFe/NC were characterized by XPS. The overall XPS spectra in Fig. S4 and Table S2 confirm the chemical elements contained in Co3S4/FeS@CoFe/NC, including C, N, O, Co, Fe and S. The high-resolution Co 2p XPS spectrum in Fig. 2 (a) consists of typical 2p 1/2 and 2p 3/2 peaks and can be decoupled into Co3+ (778.85 and 793.50 eV), Co2+ (781.85 and 797.82 eV), and satellite peaks (784.98 and 803.60 eV), indicating the presence of a small amount of metal cobalt that has not yet been fully sulfurized and the oxidation state may be related to the surface oxidation of cobalt or the coordination of nitrogen [37–39]. Similar to Co 2p, the high-resolution XPS spectrum of Fe 2p (Fig. 2b) can be decomposed into Fe2+ (712.25, 723.92 eV) and Fe3+ (714.49, 727.09 eV), indicating the possible presence of ferrous sulfide or Fe-N x coordination bonds [39]. The high-resolution S 2p XPS spectrum is shown in Fig. 2(c). The characteristic peaks of C–S–N (164.96 eV), S2− (163.77 and 168.61 eV), and sulfate (169.29 eV) can be detected, indicating the presence of metal sulfide and sulfur doping in carbon composition [40]. In addition, the high-resolution C 1s XPS spectrum (Fig. 2d) shows the presence of C–C (284.51 eV), C=C (285.00 eV) and C–N (285.94 eV), indicating that the carbon composition is richly N-doped and highly graphitized [41]. The high-resolution N 1s XPS spectrum is shown in Fig. 2(e), which can be fitted to obtain three characteristic peaks of Pyridine N (398.61 eV), Pyrrole N (399.71 eV), and Graphite N (401.45 eV). The Graphite N and Pyrrole N have n-type doping properties, but the pyridine N has p-type doping characteristics. The electron-donating graphite nitrogen and pyrrole nitrogen can be regarded as the active catalytic site for ORR, and the electron-withdrawing pyridine N can be regarded as the active site for OER. In O 1s spectrum (Fig. 2f), two peaks, M−O−C (531.4 eV) and M−OH/SO (532.5 eV), can be observed, which may be due to the partial oxidation of the metal Co/Fe [42–44]. The electronic structure and local environment of Co/Fe atoms in Co3S4/FeS@CoFe/NC were investigated using X-ray absorption fine structure (XAFS). Fig. 3 (a and b) show the Co/Fe K-edge X-ray absorption near edge structure (XANES) of Co3S4/FeS@CoFe/NC and reference materials respectively. The Co/Fe K-edge absorption of Co3S4/FeS@CoFe/NC located between Co/Fe foil and Co3O4/Fe2O3, indicating that the Co/Fe in Co3S4/FeS@CoFe/NC is in oxidized states ranging from 0 to + 3. Fourier transform k 3-weighted extended X-ray absorption fine structure (EXAFS) spectra in Fig. 3(c and d) show that the coordination environments of Co3S4/FeS@CoFe/NC and cobalt phthalocyanine/iron phthalocyanine (CoPc/FePc) are similar. Co3S4/FeS@CoFe/NC shows a prominent peak at around 1.90 Å/1.91 Å, located between the Co-N/Fe-N scattering path of the first shell layer of CoPc/FePc and the Co–Co/Fe–Fe scattering path of the first shell layer of Co/Fe Foil, suggesting the coexistence of Co–N/Fe–N and Co–S/Fe–S in Co3S4/FeS@CoFe/NC [45]. The wavelet transform (WT) EXAFS is a potent method for differentiating backscattered atoms based on their elemental characteristics [46,47]. Fig. 3(e and f) illustrate that WT contour maps of Co3S4/FeS@CoFe/NC show a single maximum intensity value in k-space at around 8.3/8.2 Å−1, attributed to Co/Fe–N species and cobalt/iron sulfide, distinguishing it from WT plots of Co/Fe foil and CoPc/FePc, confirming the presence of atomic Co/Fe and Co/Fe sulfides in Co3S4/FeS@CoFe/NC. As shown in Fig. 3(g and h), Figs. S5, S6 and Table S3, the EXAFS fits indicate that the first Co–N/Fe–N scattering paths of Co3S4/FeS@CoFe/NC have a coordination number of four, implying the presence of CoN4/FeN4 configuration in the core Co/Fe site of Co3S4/FeS@CoFe/NC [10]. To achieve high catalytic efficiency during the charging and discharging of ZABs, effective three-phase interface and fast oxygen diffusion at the air electrode are required (Fig. 4 a) [48]. As shown in Fig. 4(b), Co3S4/FeS@CoFe/NC had a contact angle of 140.2°, and the Co3S4/FeS was extremely hydrophilic due to the absence of carbon cladding, indicating that the carbon nanosheet microstructures grown on carbon cloth had excellent hydrophobicity, which is a desired property for ZABs. The relatively low content of N–C species (Fig. 2d) may also contribute to the low hydrophobicity to Co3S4/FeS@CoFe/NC [49,50]. The cross-section view of the air cathode during OER was analyzed by optical microscopy. O2 bubbles released from the electrode interface immediately diffuse to the electrolyte within 0.13 s. In contrast, O2 bubbles are immobilized on the surface of the Pt/C-RuO2 electrode for up to 6.0 s (Fig. 4c), indicating that the diffusion of O2 at the interface is hindered. The gaseous oxygen concentration on the Co3S4/FeS@CoFe/NC and Co3S4/FeS electrodes was simulated using the finite element method to further reveal the key role of the hydrophobic air electrode in facilitating O2 diffusion. The simulation results show that the O2 concentration gradient at the hydrophobic Co3S4/FeS@CoFe/NC electrode is significantly higher than that at the hydrophilic Co3S4/FeS electrode (Fig. 4d). Hydrophobic aerophilic surface weakens the water flooding effect between the electrode and electrolyte, increasing the oxygen content and oxygen concentration gradient in the electrolyte on the electrode side, and promote the formation of an effective three-phase interface. These results corroborate that the improvement of hydrophobic and aerophilic properties of the air electrode can effectively accelerate the diffusion of oxygen at the three-phase interface. The OER performances of Co3S4/FeS@CoFe/NC, Co3S4@Co/NC, FeS@Fe/NC, Co3S4/FeS and the benchmark RuO2 catalysts were assessed using linear scanning voltammetry (LSV) measurements in 1.0 M KOH with a scanning rate of 5 mV s−1. As is shown in Fig. 5 (a) and Fig. S7 (a), the polarization curves demonstrate that Co3S4/FeS@CoFe/NC only requires an overpotential of 260 mV to generate a current density of 10 mA cm−2 (η = E 10−1.23 V), which is lower than that of Co3S4/FeS (311 mV), Co3S4@Co/NC(322 mV), FeS@Fe/NC(354 mV) and slightly higher than RuO2 (223 mV), but exhibit higher current density at high potential. Furthermore, the Tafel slope for Co3S4/FeS@CoFe/NC is 45.34 mV dec−1, which is lower than Co3S4/FeS (62.93 mV dec−1) and RuO2 (87.71 mV dec−1) (Fig. S8a). These results indicate that Co3S4/FeS@CoFe/NC has higher OER electrocatalytic activity as well as rapid reaction kinetics [51]. The ORR performance of the prepared catalysts was assessed using the rotating disk electrode (RDE) technique at 1600 r min−1 in oxygen-saturated 1.0 M KOH electrolyte [52]. Fig. S10 shows the cyclic voltammograms (CVs) of Co3S4/FeS@CoFe/NC and Co3S4/FeS. For the Ar-saturated electrolyte, no oxygen-related reduction peaks were observed in CVs. However, significant oxygen reduction peaks appeared in the O2-saturated Co3S4/FeS@CoFe/NC electrolyte at 1600 r min−1, suggesting that Co3S4/FeS@CoFe/NC electrodes have excellent ORR intrinsic activity. The LSV experiments demonstrate that Co3S4/FeS@CoFe/NC has a half-wave potential (E 1/2) of 0.872 V, which is higher than that of Co3S4/FeS, Co3S4@Co/NC(0.832 V), FeS@Fe/NC(0.730 V) and commercial Pt/C (0.854 V), as shown in Fig. 5(b) and Fig. S7(b). And we extracted and performed ORR tests for powdered Co3S4/FeS@CoFe/NC (E 1/2 = 0.870 V) and Pt/C (E 1/2 = 0.842 V) in 0.1 M KOH (Fig. S9). Furthermore, the Tafel slope of 45.00 mV dec−1 for Co3S4/FeS@CoFe/NC is superior to Co3S4/FeS (83.63 mV dec−1) and Pt/C (55.40 mV dec−1) catalysts (Fig. S8b), indicated the faster ORR kinetic process of Co3S4/FeS@CoFe/NC catalyst. LSV curves in O2-saturated electrolyte were measured at different rotational speeds to elucidate the ORR four-electron reaction mechanism of the Co3S4/FeS@CoFe/NC catalyst (Fig. 5c). The Koutecky-Levith (K-L) diagram [53] of Co3S4/FeS@CoFe/NC displayed a strong linear connection (Fig. 5d), and the electron transfer number per O2 (n) was 4.204. The electron transfer number slightly greater than 4 may be due to the lower accuracy of the LSV testing method for self-supported carbon cloth based materials at different rotational speeds compared to the RRDE testing for powder materials. But overall, the self-supported Co3S4/FeS@CoFe/NC electrode of the ORR has a nearly four-electron route [54]. The stability of catalysts is an important concern for practical applications. For the Co3S4/FeS@CoFe/NC, Pt/C, and RuO2, OER and ORR polarization tests were conducted both before and after 3000 CV cycles (1.196–1.496 V vs. RHE, 50 mV s−1, 25 °C in 1.0 M KOH for OER. 0.615–1.015 V vs. RHE, 50 mV s−1, 25 °C, 200 r min−1 in O2-saturated 1.0 M KOH for ORR) [55]. The Co3S4/FeS@CoFe/NC demonstrates increased durability for both OER and ORR tests. The E 10 and E 1/2 of Co3S4/FeS@CoFe/NC only degraded by 18 and 5 mV under accelerated durability tests (ADT) for OER and ORR, which is superior to that of Pt/C (ΔE 1/2 = 15 mV) and RuO2 (ΔE 10 = 78 mV) (Fig. 5e and f). The structural morphological evolution of Co3S4/FeS@CoFe/NC during OER/ORR durability tests was observed by SEM and XPS. During the OER process, from the SEM images in Fig. S11(a and b), significant morphology change can be observed due to severe surface reconstruction. As is shown by the SEM images in Fig. S11(c and d), Co3S4/FeS@CoFe/NC self-supported electrode underwent a stability test without appreciable morphological change after ORR tests, demonstrating a robust structural stability. XPS analysis showed that M−OH/SO (531.42 eV) and M−O−C (532.51 eV) peaks in O 1s fine spectrum still exist, whereas the characteristic signals appearing at 530.8 and 529.6 eV correspond to the formation of M−O and O2− in the reconfiguration of derivatized metal oxyhydroxides (Fig. S12a). After OER, the high-resolution S 2p spectrum has only sulfate-related peak at 169.2 eV and weakened peak of S2− at 163.77 eV, while the characteristic peaks attributed to S2− and C–S–N at 168.61 and 164.96 eV almost disappear (Fig. S12b). And the increase in the content of high-valent Co/Fe elements and peaks of metal-nitrogen coordination suggests that some of the metal elements were further oxidized (Fig. S12c and d) [56]. XPS results indicate that, the valence states of both Co and Fe increase in OER, as the ratio of Co3+/Co2+ rises from 0.33 to 0.77 and Fe3+/Fe2+ elevates from 0.79 to 1.57. The above changes prove that in OER, partial sulfides in Co3S4/FeS@CoFe/NC undergo surface reconstruction and convert to oxyhydroxides, i.e., CoOOH and FeOOH, which are considered as the activity origin towards OER. A portion of Co3+ is converted to Co2+, and the change in the Fe component is less pronounced. Abundant lattice defects formed after self-reconfiguration will provide sufficient sites with high intrinsic activity for reactions with oxygen-related intermediates, thus accelerating electrochemical processes [40]. The bifunctional oxygen activity is typically described using the potential gap ΔE (E 10−E 1/2) as an indication [57]. The ΔE of Co3S4/FeS@CoFe/NC is only 618 mV, significantly lower than that of Co3S4/FeS, and only marginally higher than that of the 20% Pt/C-RuO2 catalyst (600 mV) used as a reference (Fig. 5g). Additionally, Co3S4/FeS@CoFe/NC has high bifunctional catalytic activity and is comparable to the most advanced bifunctional catalysts, as listed in Fig. 5(h) [49,58–66]. To reveal the underlying mechanism in OER/ORR activity improvement in Co3S4/FeS@CoFe/NC, we performed a comparative DFT calculation of Co3S4/FeS@CoFe/NC, Co3S4@Co/NC, FeS@Fe/NC, Co3S4/FeS, Pt-111, and RuO2-110. To find the most appropriate structure models, total energies and forces were optimized, and the relaxed structures and calculated results of various O–adsorption intermediates (HOO*, O*, and HO*) are displayed in Supporting Information (Figs. S13, S14 and Table S4). Noting that both the charge and spin densities are considered in our calculations. Fig. 6 (a), Fig. S15 and Table S5 show the calculated charge density differences and spin densities of O/HO adsorbed on Co3S4/FeS@CoFe/NC, Co3S4@Co/NC, FeS@Fe/NC, Co3S4/FeS. The charge of the adsorbed intermediate O*/ HO* in the rate-limiting step of the reaction is mainly migrated toward the sulfur and oxygen atoms, while the spin density is mainly distributed on the cobalt and iron ions, and the adsorbed oxygen atoms also have a certain spin density due to the exchange interactions between spins of oxygen atoms and these transition metal ions. The coupling between the bimetallic sulfide nanoparticles via atomic metals doped carbon nanosheets makes the O/HO adsorbed on Co3S4/FeS@CoFe/NC having a lower spin density in the same spin direction as the metal atoms (0.054 μB, 0.076 μB), indicating a weaker exchange interaction with the substrate, thus resulting in a lower adsorption energy and facilitating the rapid OER/ORR process [11]. As shown in Fig. 6(b) and Table S6, the Co3S4/FeS@CoFe/NC indeed has a weaker adsorption energy of O/HO intermediates (ΔE 1 = −4.5105 eV, ΔE 2 = −3.6924 eV), supporting rapid OER/ORR reaction. Furthermore, based on the outcomes of the experiments, the DFT calculations were applied to investigate the four-electron reaction routes (details of the calculations can be seen in the Supporting Information). Gibbs free energy diagrams of OER/ORR in all configurations were developed in order to examine the mechanism of high OER/ORR activity, which includes four primary reactions (O2, HOO*, O*, and HO*), as depicted in Fig. 6(c and d). Theoretical overpotentials of ORR and OER (η OER and η ORR) are usually used as the ORR/OER activity evaluation standard for a catalyst [67,68]. The smaller theoretical overpotential values suggest the better ORR/OER catalytic activity. It can be seen that the overpotential of Co3S4/FeS@CoFe/NC (η OER = 0.61 V) is lower than that of Co3S4@Co/NC (η OER = 1.17 V), FeS@Fe/NC (η OER = 0.63 V), Co3S4/FeS (η OER = 2.07 V) and RuO2-110 (η OER = 1.21 V). ORR is the inverse process of OER, and it is easy to obtain the free energy diagram of the four basic steps of a typical ORR [69,70]. The ORR overpotential of Co3S4/FeS@CoFe/NC is 0.51 V, which is much lower than that of Co3S4@Co/NC (η ORR = 0.53 V), FeS@Fe/NC (η ORR = 1.11 V), Co3S4/FeS (η ORR = 2.50 V) and Pt-111 (η ORR = 0.69 V). As shown in Fig. 6(e and f), Fig. S16 and Table S7, before and after O/HO adsorption, the total density of states center of Co3S4/FeS@CoFe/NC has a smallest negative shift (ΔE c1 =−0.0341 eV, ΔE c2 = −0.0103 eV), indicating a weakest charge interaction between the oxygen atom and the substrate, leading to the lowest oxygen binding energy. The above results indicate that the coupling of Co/Fe sulfide heterojunction nanoparticles through atomic metals doped carbon nanosheets can weaken the charge/spin interactions between adsorbed oxygen and active sites, and lower the oxygen adsorption energy, as a result in promoting the OER/ORR activity. To demonstrate the possibility for practical application of Co3S4/FeS@CoFe/NC-based ZABs, we assembled liquid flow ZABs employing Co3S4/FeS@CoFe/NC, Zn foil, and 6.0 M KOH containing 0.2 M Zn(CH3COO)2 as the air cathode, anode, and electrolyte, respectively, as shown in the inset of Fig. 7 (a). For comparison, reference ZAB employing Pt/C and RuO2 with a mass ratio of 1:1 was also fabricated. Compared to Pt/C-RuO2 air cathode (1.32 V), liquid ZAB based on Co3S4/FeS@CoFe/NC had an open-circuit potential (OCP) of 1.34 V (Fig. S17). As is shown in Fig. 7(a), the specific capacity of Co3S4/FeS@CoFe/NC based ZABs at 10 mA cm−2 is 816.3 mAh g−1, which is comparable to the Pt/C-RuO2 air cathode based ZABs (780.4 mAh g−1). Many reported research works have also measured actual specific capacities higher than the theoretical specific capacity (820.0 mAh g−1), which may be due to the excess Zn provided by the anode zinc foil [39]. Moreover, the peak power density of Co3S4/FeS@CoFe/NC-based battery is 170 mW cm−2, which is greater than that of Pt/C-RuO2-based battery (114 mW cm−2), as illustrated in Fig. 7(b). As depicted in Fig. 7(c), the Co3S4/FeS@CoFe/NC-based ZABs maintained constant charging (2.00 V) and discharging (1.18 V) voltages under 5 mA cm−2 for more than 2040 cycles (more than 680 h), indicating its superior cycling durability. Moreover, the Co3S4/FeS@CoFe/NC electrocatalyst also exhibits stable constant current charge–discharge curve (1.08–2.08 V for more than 210 h, 630 cycles) at a current density of 10 mA cm−2 (Fig. S18). The bifunctional intrinsic activity and gas–liquid-solid three-phase interface optimized by super-hydrophobic composite structure greatly promote the OER/ORR process at the electrode interface, thus exhibiting excellent ZABs performance, which is superior to most of previously reported results, as summarized in Table S8 [59,61,64]. For flexible electronic energy equipment, it is vital to manufacture and develop quasi-solid-state ZABs [71–73]. We fabricated highly adaptable quasi-solid-state ZABs utilizing commercial zinc foil as the anode and PAM hydrogel saturated with KOH-Zn(CH3COO)2 as the quasi-solid-state electrolyte to demonstrate the advantages of air cathode with Co3S4/FeS@CoFe/NC [37,74]. Compared to Pt/C-RuO2 air cathode based ZAB (1.38 V), ZABs with Co3S4/FeS@CoFe/NC electrocatalyst had an open-circuit potential (OCP) of 1.31 V (Fig. S19). Fig. S20 depicts the as-fabricated power density curves and discharge polarization curves of ZABs. The power density of flexible Pt/C-RuO2 air cathodes is 51 mW cm−2, while the power density of Co3S4/FeS@CoFe/NC air cathodes is 56 mW cm−2. The ZABs with Co3S4/FeS@CoFe/NC air cathode has a higher specific capacity (845.6 mAh g−1) than that of Pt/C-RuO2 air cathode (596.6 mAh g−1) at a current density of 1 mA cm−2 (Fig. 7d). Fig. S21 demonstrates that the Co3S4/FeS@CoFe/NC-based solid-state ZAB exhibits excellent cycling stability, with steady charging (1.88 V) and discharging (1.05 V) voltages for over 177 cycles (more than 59 h) at a current density of 1 mA cm−2. Three Co3S4/FeS@CoFe/NC based quasi-solid-state ZABs connected in series can drive and light a red LED display while retaining the initial brightness for an extended period of time, demonstrating the practical application of quasi-solid-state ZABs (Fig. 7d inset). The Co3S4/FeS@CoFe/NC cathode-based quasi-solid-state ZAB demonstrates remarkable stability under 0°, 60°, 90°, and 180° bending conditions, as shown in Fig. 7(e), indicating its outstanding mechanical flexibility for flexible electronic applications. 4 Conclusions In summary, we have successfully constructed a self-supported bifunctional composite catalyst of bimetallic sulfide nanoparticles embedded in atomic Co/Fe doped carbon nanosheets, which can be used as an efficient air cathode for high-performance and durable rechargeable ZABs. The superior bifunctional oxygen activity of the array-type bimetallic sulfide composite catalyst can be attributed to abundant accessible active sites for interface reactions, multiphase coupling of the sulfide heterojunctions with single-atomic metal, and optimization of oxygen diffusion at the three-phase interface by super-hydrophobic feature. Our DFT calculations revealed that the coupling effect between multiphase bimetallic sulfide heterojunctions through single-atomic metal doped carbon nanosheets can reduce the shift of electron density of states center before and after oxygen adsorption and the magnetic moment of Co/Fe ions, leading to lower spin density on adsorbed oxygen. As a result, the charge/spin interactions between adsorbed oxygen and the substrate are diminished, leading to a lower oxygen adsorption energy and faster reaction kinetics. This study provides a guidance for preparation of high-performance bifunctional catalyst by multi-phase composite design and regulating oxygen electrocatalytic activity through charge-spin optimization. CRediT authorship contribution statement Yan Tan: Writing – review & editing, Writing – original draft, Visualization, Software, Investigation, Formal analysis, Data curation, Conceptualization. Yijie Wang: Validation, Software, Investigation. Aoshuang Li: Validation, Project administration. Xiucai Jiang: Supervision, Formal analysis. Yuzhong Zhang: Writing – review & editing, Supervision, Software, Funding acquisition. Chuanwei Cheng: Writing – review & editing, Supervision, Methodology, Funding acquisition. Declaration of competing interest The authors declare that they have no known competing financial interests or personal relationships that could have appeared to influence the work reported in this paper. Acknowledgments This work was supported by National Natural Science Foundation of China (Nos. 51772213, 12004283, 12274324), Science and Technology Commission of Shanghai Municipality (No 21JC405700), Shanghai Key Laboratory of Special Artificial Microstructure Materials and Technology. We gratefully acknowledge HZWTECH for providing computation facilities and the Anhui Absorption Spectroscopy Analysis Instrument Co, Ltd. for XAFS measurements and analysis. Appendix A Supplementary data Supplementary data to this article can be found online at https://doi.org/10.1016/j.jechem.2024.05.013. Appendix A Supplementary data The following are the Supplementary data to this article: Supplementary Data 1 References [1] L. Li W. Liu H. Dong Q. Gui Z. Hu Y. Li J. Liu Adv. Mater. 33 2021 2004959 L. Li, W. Liu, H. Dong, Q. Gui, Z. Hu, Y. Li, J. Liu, Adv. Mater., 33 (2021) 2004959. [2] Y. Yan X. Liu J. Yan C. Guan J. Wang Energy Environ. Mater. 4 2020 502 521 Y. Yan, X. Liu, J. Yan, C. Guan, J. Wang, Energy Environ. Mater., 4 (2020) 502-521. [3] Y. Zhu K. Yue C. Xia S. Zaman H. Yang X. Wang Y. Yan B.Y. Xia Nano-Micro Lett. 13 2021 137 Y. Zhu, K. Yue, C. Xia, S. Zaman, H. Yang, X. Wang, Y. Yan, B.Y. Xia, Nano-Micro Lett. , 13 (2021) 137. [4] Q. Zhou J. Cai Z. Zhang R. Gao B. Chen G. Wen L. Zhao Y. Deng H. Dou X. Gong Y. Zhang Y. Hu A. Yu X. Sui Z. Wang Z. Chen Small Methods 5 2021 2100024 Q. Zhou, J. Cai, Z. Zhang, R. Gao, B. Chen, G. Wen, L. Zhao, Y. Deng, H. Dou, X. Gong, Y. Zhang, Y. Hu, A. Yu, X. Sui, Z. Wang, Z. Chen, Small Methods, 5 (2021) 2100024. [5] H. Sun Q. Li Y. Lian C. Zhang P. Qi Q. Mu H. Jin B. Zhang M. Chen Z. Deng Y. Peng Appl. Catal., B 263 2020 118139 H. Sun, Q. Li, Y. Lian, C. Zhang, P. Qi, Q. Mu, H. Jin, B. Zhang, M. Chen, Z. Deng, Y. Peng, Appl. Catal., B, 263 (2020) 118139. [6] D. Zhao L. Zhang S. Zuo X. Lv M. Zhao P. Sun X. Sun T.L. Liu Small 19 2023 2206067 D. Zhao, L. Zhang, S. Zuo, X. Lv, M. Zhao, P. Sun, X. Sun, T.L. Liu, Small, 19 (2023) 2206067. [7] Q. Wang X. Huang Z.L. Zhao M. Wang B. Xiang J. Li Z. Feng H. Xu M. Gu J. Am. Chem. Soc. 142 2020 7425 7433 Q. Wang, X. Huang, Z.L. Zhao, M. Wang, B. Xiang, J. Li, Z. Feng, H. Xu, M. Gu, J. Am. Chem. Soc., 142 (2020) 7425-7433. [8] Q. Wang Y. Tan S. Tang W. Liu Y. Zhang X. Xiong Y. Lei ACS Nano 17 2023 9565 9574 Q. Wang, Y. Tan, S. Tang, W. Liu, Y. Zhang, X. Xiong, Y. Lei, ACS Nano, 17 (2023) 9565-9574. [9] X. Wu Q. Wang S. Yang J. Zhang Y. Cheng H. Tang L. Ma X. Min C. Tang S.P. Jiang F. Wu Y. Lei S. Ciampic S. Wang L. Dai Energy Environ. Sci. 15 2022 1183 1191 X. Wu, Q. Wang, S. Yang, J. Zhang, Y. Cheng, H. Tang, L. Ma, X. Min, C. Tang, S.P. Jiang, F. Wu, Y. Lei, S. Ciampic, S. Wang, L. Dai, Energy Environ. Sci., 15 (2022) 1183-1191. [10] J. Han H. Bao J.-Q. Wang L. Zheng S. Sun Z.L. Wang C. Sun Appl. Catal., B 280 2021 119411 J. Han, H. Bao, J.-Q. Wang, L. Zheng, S. Sun, Z.L. Wang, C. Sun, Appl. Catal., B, 280 (2021) 119411. [11] J. Du T. Zhang J. Xing C. Xu J. Mater. Chem. A 5 2017 9210 9216 J. Du, T. Zhang, J. Xing, C. Xu, J. Mater. Chem. A, 5 (2017) 9210-9216. [12] X. Hu P. Tan R. Dong M. Jiang L. Lu Y. Wang H. Liu Y. Liu J. Xie J. Pan Energy Technol. 9 2021 2000961 X. Hu, P. Tan, R. Dong, M. Jiang, L. Lu, Y. Wang, H. Liu, Y. Liu, J. Xie, J. Pan, Energy Technol., 9 (2021) 2000961. [13] Y. Wang X. Wu X. Jiang X. Wu Y. Tang D. Sun G. Fu Chem. Eng. J. 434 2022 134744 Y. Wang, X. Wu, X. Jiang, X. Wu, Y. Tang, D. Sun, G. Fu, Chem. Eng. J., 434 (2022) 134744. [14] L. Bo W. Shi F. Nian Y. Hu L. Pu P. Li Z. Zhang J. Tong Sep. Purif. Technol. 307 2023 122536 L. Bo, W. Shi, F. Nian, Y. Hu, L. Pu, P. Li, Z. Zhang, J. Tong, Sep. Purif. Technol., 307 (2023) 122536. [15] Y. Zhou R. Lu X. Tao Z. Qiu G. Chen J. Yang Y. Zhao X. Feng K. Müllen J. Am. Chem. Soc. 145 2023 3647 3655 Y. Zhou, R. Lu, X. Tao, Z. Qiu, G. Chen, J. Yang, Y. Zhao, X. Feng, K. Müllen, J. Am. Chem. Soc., 145 (2023) 3647-3655. [16] D. Xia X. Yang L. Xie Y. Wei W. Jiang M. Dou X. Li J. Li L. Gan F. Kang Adv. Funct. Mater. 29 2019 1906174 D. Xia, X. Yang, L. Xie, Y. Wei, W. Jiang, M. Dou, X. Li, J. Li, L. Gan, F. Kang, Adv. Funct. Mater., 29 (2019) 1906174. [17] Z. Chen H. Niu J. Ding H. Liu P.H. Chen Y.H. Lu Y.R. Lu W. Zuo L. Han Y. Guo S.F. Hung Y. Zhai Angew. Chem. Int. Ed. 60 2021 25404 25410 Z. Chen, H. Niu, J. Ding, H. Liu, P.H. Chen, Y.H. Lu, Y.R. Lu, W. Zuo, L. Han, Y. Guo, S.F. Hung, Y. Zhai, Angew. Chem. Int. Ed., 60 (2021) 25404-25410. [18] Z. Wang X. Jin R. Xu Z. Yang S. Ma T. Yan C. Zhu J. Fang Y. Liu S.J. Hwang Z. Pan H.J. Fan ACS Nano 17 2023 8622 8633 Z. Wang, X. Jin, R. Xu, Z. Yang, S. Ma, T. Yan, C. Zhu, J. Fang, Y. Liu, S.J. Hwang, Z. Pan, H.J. Fan, ACS Nano, 17 (2023) 8622-8633. [19] C.X. Zhao X. Liu J.N. Liu J. Wang X. Wan C. Wang X.Y. Li J. Shui L. Song H.J. Peng B.Q. Li Q. Zhang Angew. Chem. Int. Ed. 62 2023 e202313028 C.X. Zhao, X. Liu, J.N. Liu, J. Wang, X. Wan, C. Wang, X.Y. Li, J. Shui, L. Song, H.J. Peng, B.Q. Li, Q. Zhang, Angew. Chem. Int. Ed., 62 (2023) e202313028. [20] J. Wang X. Liu C.-X. Zhao Y.-W. Song J.-N. Liu X.-Y. Li C.-X. Bi X. Wan J. Shui H.-J. Peng B.-Q. Li J.-Q. Huang J. Energy Chem. 90 2024 511 517 J. Wang, X. Liu, C.-X. Zhao, Y.-W. Song, J.-N. Liu, X.-Y. Li, C.-X. Bi, X. Wan, J. Shui, H.-J. Peng, B.-Q. Li, J.-Q. Huang, J. Energy Chem., 90 (2024) 511-517. [21] G. Yang J. Zhu P. Yuan Y. Hu G. Qu B.A. Lu X. Xue H. Yin W. Cheng J. Cheng W. Xu J. Li J. Hu S. Mu J.N. Zhang Nat. Commun. 12 2021 1734 G. Yang, J. Zhu, P. Yuan, Y. Hu, G. Qu, B.A. Lu, X. Xue, H. Yin, W. Cheng, J. Cheng, W. Xu, J. Li, J. Hu, S. Mu, J.N. Zhang, Nat. Commun., 12 (2021) 1734. [22] Y. Liu Z. Zhao W. Wei X. Jin G. Wang K. Li Y. Lin ACS Appl. Nano Mater. 4 2021 13001 13009 Y. Liu, Z. Zhao, W. Wei, X. Jin, G. Wang, K. Li, Y. Lin, ACS Appl. Nano Mater., 4 (2021) 13001-13009. [23] Y. Sun S. Sun H. Yang S. Xi J. Gracia Z.J. Xu Adv. Mater. 32 2020 2003297 Y. Sun, S. Sun, H. Yang, S. Xi, J. Gracia, Z.J. Xu, Adv. Mater., 32 (2020) 2003297. [24] C.-X. Zhao X. Liu J.-N. Liu J. Wang X. Wan X.-Y. Li C. Tang C. Wang L. Song J. Shui H.-J. Peng B.-Q. Li Q. Zhang J. Am. Chem. Soc. 145 2023 27531 27538 C.-X. Zhao, X. Liu, J.-N. Liu, J. Wang, X. Wan, X.-Y. Li, C. Tang, C. Wang, L. Song, J. Shui, H.-J. Peng, B.-Q. Li, Q. Zhang, J. Am. Chem. Soc., 145 (2023) 27531-27538. [25] H. Bai J. Feng D. Liu P. Zhou R. Wu C.T. Kwok W.F. Ip W. Feng X. Sui H. Liu H. Pan Small 19 2023 2205638 H. Bai, J. Feng, D. Liu, P. Zhou, R. Wu, C.T. Kwok, W.F. Ip, W. Feng, X. Sui, H. Liu, H. Pan, Small, 19 (2023) 2205638. [26] R. Sharpe T. Lim Y. Jiao J.W.H. Niemantsverdriet J. Gracia ChemCatChem 8 2016 3762 3768 R. Sharpe, T. Lim, Y. Jiao, J.W.H. Niemantsverdriet, J. Gracia, ChemCatChem, 8 (2016) 3762-3768. [27] J. Gracia J. Phys. Chem. C 123 2019 9967 9972 J. Gracia, J. Phys. Chem. C 123 (2019) 9967-9972. [28] Z. Zhang P. Ma L. Luo X. Ding S. Zhou J. Zeng Angew. Chem. Int. Ed. 62 2023 202216837 Z. Zhang, P. Ma, L. Luo, X. Ding, S. Zhou, J. Zeng, Angew. Chem. Int. Ed., 62 (2023) 202216837. [29] H. Li J. Wang R. Qi Y. Hu J. Zhang H. Zhao J. Zhang Y. Zhao Appl. Catal., B 285 2021 119778 H. Li, J. Wang, R. Qi, Y. Hu, J. Zhang, H. Zhao, J. Zhang, Y. Zhao, Appl. Catal., B, 285 (2021) 119778. [30] J. Ran L. Wang M. Si X. Liang D. Gao Small 19 2023 2206367 J. Ran, L. Wang, M. Si, X. Liang, D. Gao, Small, 19 (2023) 2206367. [31] L. Wan Z. Xu Q. Cao Y. Liao B. Wang K. Liu Nano Lett. 22 2022 4535 4543 L. Wan, Z. Xu, Q. Cao, Y. Liao, B. Wang, K. Liu, Nano Lett., 22 (2022) 4535-4543. [32] Q. Zhang M. Zhou G. Ren Y. Li Y. Li X. Du Nat. Commun. 11 2020 1731 Q. Zhang, M. Zhou, G. Ren, Y. Li, Y. Li, X. Du, Nat. Commun., 11 (2020) 1731. [33] X. Feng X. Zhang G. Tian Nanoscale 14 2022 5960 5993 X. Feng, X. Zhang, G. Tian, Nanoscale, 14 (2022) 5960-5993. [34] D. Wang Q. Sun M.J. Hokkanen C. Zhang F.Y. Lin Q. Liu S.P. Zhu T. Zhou Q. Chang B. He Q. Zhou L. Chen Z. Wang R.H.A. Ras X. Deng Nature 582 2020 55 59 D. Wang, Q. Sun, M.J. Hokkanen, C. Zhang, F.Y. Lin, Q. Liu, S.P. Zhu, T. Zhou, Q. Chang, B. He, Q. Zhou, L. Chen, Z. Wang, R.H.A. Ras, X. Deng, Nature, 582 (2020) 55-59. [35] S. Agarwal X. Yu A. Manthiram Mater. Today Energy 16 2020 100405 S. Agarwal, X. Yu, A. Manthiram, Mater. Today Energy, 16 (2020) 100405. [36] X. Liu L. Wang G. Zhang F. Sun G. Xing C. Tian H. Fu Chem. Eng. J. 414 2021 127569 X. Liu, L. Wang, G. Zhang, F. Sun, G. Xing, C. Tian, H. Fu, Chem. Eng. J., 414 (2021) 127569. [37] H. Zhang M. Zhao H. Liu S. Shi Z. Wang B. Zhang L. Song J. Shang Y. Yang C. Ma L. Zheng Y. Han W. Huang Nano Lett. 21 2021 2255 2264 H. Zhang, M. Zhao, H. Liu, S. Shi, Z. Wang, B. Zhang, L. Song, J. Shang, Y. Yang, C. Ma, L. Zheng, Y. Han, W. Huang, Nano Lett., 21 (2021) 2255-2264. [38] J. Cao C. Lei J. Yang X. Cheng Z. Li B. Yang X. Zhang L. Lei Y. Hou K. Ostrikov J. Mater. Chem. A 6 2018 18877 18883 J. Cao, C. Lei, J. Yang, X. Cheng, Z. Li, B. Yang, X. Zhang, L. Lei, Y. Hou, K. Ostrikov, J. Mater. Chem. A, 6 (2018) 18877-18883. [39] Z. Zhang J. Li J. Qian Z. Li L. Jia D. Gao D. Xue Small 18 2022 2104248 Z. Zhang, J. Li, J. Qian, Z. Li, L. Jia, D. Gao, D. Xue, Small, 18 (2022) 2104248. [40] A. Wang X. Zhang S. Gao C. Zhao S. Kuang S. Lu J. Niu G. Wang W. Li D. Chen H. Zhang X. Zhou S. Zhang B. Zhang W. Wang Adv. Mater. 34 2022 2204247 A. Wang, X. Zhang, S. Gao, C. Zhao, S. Kuang, S. Lu, J. Niu, G. Wang, W. Li, D. Chen, H. Zhang, X. Zhou, S. Zhang, B. Zhang, W. Wang, Adv. Mater., 34 (2022) 2204247. [41] C. Sun J. Ding H. Wang J. Liu X. Han Y. Deng C. Zhong W. Hu J. Mater. Chem. A 9 2021 13926 13935 C. Sun, J. Ding, H. Wang, J. Liu, X. Han, Y. Deng, C. Zhong, W. Hu, J. Mater. Chem. A, 9 (2021) 13926-13935. [42] L. Ji J. Wang X. Teng H. Dong X. He Z. Chen ACS Appl. Mater. Interfaces 10 2018 14632 14640 L. Ji, J. Wang, X. Teng, H. Dong, X. He, Z. Chen, ACS Appl. Mater. Interfaces, 10 (2018) 14632-14640. [43] D. Chen J. Zhu X. Mu R. Cheng W. Li S. Liu Z. Pu C. Lin S. Mu Appl. Catal., B 268 2020 118729 D. Chen, J. Zhu, X. Mu, R. Cheng, W. Li, S. Liu, Z. Pu, C. Lin, S. Mu, Appl. Catal., B, 268 (2020) 118729. [44] W. Luo Y. Wang L. Luo S. Gong M. Wei Y. Li X. Gan Y. Zhao Z. Zhu Z. Li ACS Catal. 12 2022 1167 1179 W. Luo, Y. Wang, L. Luo, S. Gong, M. Wei, Y. Li, X. Gan, Y. Zhao, Z. Zhu, Z. Li, ACS Catal., 12 (2022) 1167-1179. [45] T. Gu D. Zhang Y. Yang C. Peng D. Xue C. Zhi M. Zhu J. Liu Adv. Funct. Mater. 33 2022 2212299 T. Gu, D. Zhang, Y. Yang, C. Peng, D. Xue, C. Zhi, M. Zhu, J. Liu, Adv. Funct. Mater. , 33 (2022) 2212299. [46] X. Xie L. Shang X. Xiong R. Shi T. Zhang Adv. Energy Mater. 12 2021 2102688 X. Xie, L. Shang, X. Xiong, R. Shi, T. Zhang, Adv. Energy Mater., 12 (2021) 2102688. [47] S. Chen X. Liang S. Hu X. Li G. Zhang S. Wang L. Ma C.L. Wu C. Zhi J.A. Zapien Nano-Micro Lett. 15 2023 47 S. Chen, X. Liang, S. Hu, X. Li, G. Zhang, S. Wang, L. Ma, C.L. Wu, C. Zhi, J.A. Zapien, Nano-Micro Lett., 15 (2023) 47. [48] Z. Lu W. Xu J. Ma Y. Li X. Sun L. Jiang Adv. Mater. 28 2016 7155 7161 Z. Lu, W. Xu, J. Ma, Y. Li, X. Sun, L. Jiang, Adv. Mater., 28 (2016) 7155-7161. [49] L. Yan B. Xie C. Yang Y. Wang J. Ning Y. Zhong Y. Hu Adv. Energy Mater. 13 2023 2204245 L. Yan, B. Xie, C. Yang, Y. Wang, J. Ning, Y. Zhong, Y. Hu, Adv. Energy Mater., 13 (2023) 2204245. [50] W.Y. Hao Li Wu Chongchong Xu Jiang Phys. Chem. Chem. Phys. 23 2021 13971 W.Y. Hao Li, Chongchong Wu, Jiang Xu Phys. Chem. Chem. Phys., 23 (2021) 13971. [51] Z. Zhang Y. Chen L. Zhou C. Chen Z. Han B. Zhang Q. Wu L. Yang L. Du Y. Bu P. Wang X. Wang H. Yang Z. Hu Nat. Commun. 10 2019 1657 Z. Zhang, Y. Chen, L. Zhou, C. Chen, Z. Han, B. Zhang, Q. Wu, L. Yang, L. Du, Y. Bu, P. Wang, X. Wang, H. Yang, Z. Hu, Nat. Commun., 10 (2019) 1657. [52] T. Zhou H. Shan H. Yu C. Zhong J. Ge N. Zhang W. Chu W. Yan Q. Xu H. Wu C. Wu Y. Xie Adv. Mater. 32 2020 2003251 T. Zhou, H. Shan, H. Yu, C. Zhong, J. Ge, N. Zhang, W. Chu, W. Yan, Q. Xu, H. Wu, C. Wu, Y. Xie, Adv. Mater., 32 (2020) 2003251. [53] S. Treimer A. Tang D.C. Johnson Electroanalysis 14 2002 165 171 S. Treimer, A. Tang, D.C. Johnson, Electroanalysis, 14 (2002) 165-171. [54] L. Liu X. Zhang F. Yan B. Geng C. Zhu Y. Chen J. Mater. Chem. A 8 2020 18162 18172 L. Liu, X. Zhang, F. Yan, B. Geng, C. Zhu, Y. Chen, J. Mater. Chem. A, 8 (2020) 18162-18172. [55] X. Xie C. He B. Li Y. He D.A. Cullen E.C. Wegener A.J. Kropf U. Martinez Y. Cheng M.H. Engelhard M.E. Bowden M. Song T. Lemmon X.S. Li Z. Nie J. Liu D.J. Myers P. Zelenay G. Wang G. Wu V. Ramani Y. Shao Nat. Catal. 3 2020 1044 1054 X. Xie, C. He, B. Li, Y. He, D.A. Cullen, E.C. Wegener, A.J. Kropf, U. Martinez, Y. Cheng, M.H. Engelhard, M.E. Bowden, M. Song, T. Lemmon, X.S. Li, Z. Nie, J. Liu, D.J. Myers, P. Zelenay, G. Wang, G. Wu, V. Ramani, Y. Shao, Nat. Catal., 3 (2020) 1044-1054. [56] X. Ren T. Wu Y. Sun Y. Li G. Xian X. Liu C. Shen J. Gracia H.J. Gao H. Yang Z.J. Xu Nat. Commun. 12 2021 2608 X. Ren, T. Wu, Y. Sun, Y. Li, G. Xian, X. Liu, C. Shen, J. Gracia, H.J. Gao, H. Yang, Z.J. Xu, Nat. Commun., 12 (2021) 2608. [57] C.X. Zhao J.N. Liu J. Wang D. Ren J. Yu X. Chen B.Q. Li Q. Zhang Adv. Mater. 33 2021 2008606 C.X. Zhao, J.N. Liu, J. Wang, D. Ren, J. Yu, X. Chen, B.Q. Li, Q. Zhang, Adv. Mater., 33 (2021) 2008606. [58] X. Zhou J. Gao Y. Hu Z. Jin K. Hu K.M. Reddy Q. Yuan X. Lin H.J. Qiu Nano Lett. 22 2022 3392 3399 X. Zhou, J. Gao, Y. Hu, Z. Jin, K. Hu, K.M. Reddy, Q. Yuan, X. Lin, H.J. Qiu, Nano Lett., 22 (2022) 3392–3399. [59] H.F. Wang L. Chen M. Wang Z. Liu Q. Xu Nano Lett. 21 2021 3640 3648 H.F. Wang, L. Chen, M. Wang, Z. Liu, Q. Xu, Nano Lett., 21 (2021) 3640-3648. [60] X.-H.-D. Xiu-Xiu Ma Xing-Quan He ACS Sustain. Chem. Eng. 5 2017 9848 9857 X.-H.D. Xiu-Xiu Ma, and Xing-Quan He, ACS Sustainable Chem. Eng., 5 (2017) 9848−9857. [61] B.Q. Li C.X. Zhao S. Chen J.N. Liu X. Chen L. Song Q. Zhang Adv. Mater. 31 2019 1900592 B.Q. Li, C.X. Zhao, S. Chen, J.N. Liu, X. Chen, L. Song, Q. Zhang, Adv. Mater., 31 (2019) 1900592. [62] X. Duan S. Ren N. Pan M. Zhang H. Zheng J. Mater. Chem. A 8 2020 9355 9363 X. Duan, S. Ren, N. Pan, M. Zhang, H. Zheng, J. Mater. Chem. A, 8 (2020) 9355-9363. [63] W. Xie Y. Song S. Li J. Li Y. Yang W. Liu M. Shao M. Wei Adv. Funct. Mater. 29 2019 1906477 W. Xie, Y. Song, S. Li, J. Li, Y. Yang, W. Liu, M. Shao, M. Wei, Adv. Funct. Mater., 29 (2019) 1906477. [64] S. Sarkar A. Biswas E.E. Siddharthan R. Thapa R.S. Dey ACS Nano 16 2022 7890 7903 S. Sarkar, A. Biswas, E.E. Siddharthan, R. Thapa, R.S. Dey, ACS Nano, 16 (2022) 7890–7903. [65] F. Qiang J. Feng H. Wang J. Yu J. Shi M. Huang Z. Shi S. Liu P. Li L. Dong ACS Catal. 12 2022 4002 4015 F. Qiang, J. Feng, H. Wang, J. Yu, J. Shi, M. Huang, Z. Shi, S. Liu, P. Li, L. Dong, ACS Catal., 12 (2022) 4002-4015. [66] T.Z. Pengzuo Chen Lili Xing Xu Kun Yun Tong Hui Xie Lidong Zhang Wensheng Yan Wangsheng Chu Wu Changzheng Yi Xie Angew. Chem. Int. Ed. 56 2017 610 614 T.Z. Pengzuo Chen, Lili Xing, Kun Xu, Yun Tong, Hui Xie, Lidong Zhang, Wensheng Yan, Wangsheng Chu, Changzheng Wu, and Yi Xie, Angew. Chem. Int. Ed. , 56 (2017) 610 –614. [67] B. Zhao D. Xue P. Yuan W. Yan J. Zhang S. Mu J.-N. Zhang Appl. Catal., B 324 2023 122251 B. Zhao, D. Xue, P. Yuan, W. Yan, J. Zhang, S. Mu, J.-N. Zhang, Appl. Catal., B, 324 (2023) 122251. [68] C. Guan A. Sumboja W. Zang Y. Qian H. Zhang X. Liu Z. Liu D. Zhao S.J. Pennycook J. Wang Energy Storage Mater. 16 2019 243 250 C. Guan, A. Sumboja, W. Zang, Y. Qian, H. Zhang, X. Liu, Z. Liu, D. Zhao, S.J. Pennycook, J. Wang, Energy Storage Mater., 16 (2019) 243-250. [69] Y. Feng K. Song W. Zhang X. Zhou S.J. Yoo J.-G. Kim S. Qiao Y. Qi X. Zou Z. Chen T. Qin N. Yue Z. Wang D. Li W. Zheng J. Energy Chem. 70 2022 211 218 Y. Feng, K. Song, W. Zhang, X. Zhou, S.J. Yoo, J.-G. Kim, S. Qiao, Y. Qi, X. Zou, Z. Chen, T. Qin, N. Yue, Z. Wang, D. Li, W. Zheng, J. Energy Chem., 70 (2022) 211-218. [70] Q. Lv M. Li X. Li X. Yan Z. Hou C. Huang J. Energy Chem. 90 2024 144 151 Q. Lv, M. Li, X. Li, X. Yan, Z. Hou, C. Huang, J. Energy Chem., 90 (2024) 144-151. [71] Z. Pei Y. Huang Z. Tang L. Ma Z. Liu Q. Xue Z. Wang H. Li Y. Chen C. Zhi Energy Storage Mater. 20 2019 234 242 Z. Pei, Y. Huang, Z. Tang, L. Ma, Z. Liu, Q. Xue, Z. Wang, H. Li, Y. Chen, C. Zhi, Energy Storage Mater., 20 (2019) 234-242. [72] S.S. Shinde J.Y. Jung N.K. Wagh C.H. Lee D.-H. Kim S.-H. Kim S.U. Lee J.-H. Lee Nat. Energy 6 2021 592 604 S.S. Shinde, J.Y. Jung, N.K. Wagh, C.H. Lee, D.-H. Kim, S.-H. Kim, S.U. Lee, J.-H. Lee, Nat. Energy, 6 (2021) 592-604. [73] M. Lv C. Luo J. Li Y. Zhang Q. Zeng N. Huang S. Wang Y. Zheng W. Liu L. Ye ACS Materials Lett. 5 2023 744 752 M. Lv, C. Luo, J. Li, Y. Zhang, Q. Zeng, N. Huang, S. Wang, Y. Zheng, W. Liu, L. Ye, ACS Materials Lett., 5 (2023) 744-752. [74] K. Kordek L. Jiang K. Fan Z. Zhu L. Xu M. Al-Mamun Y. Dou S. Chen P. Liu H. Yin P. Rutkowski H. Zhao Adv. Energy Mater. 9 2019 1802936 K. Kordek, L. Jiang, K. Fan, Z. Zhu, L. Xu, M. Al‐Mamun, Y. Dou, S. Chen, P. Liu, H. Yin, P. Rutkowski, H. Zhao, Adv. Energy Mater., 9 (2019) 1802936.",
      "scopus-id": "85194362093",
      "coredata": {
        "eid": "1-s2.0-S2095495624003565",
        "dc:description": "Development of a high-performance bifunctional catalyst is essential for the actual implementation of zinc-air batteries in practical applications. Herein, a bifunctional cathode of Co3S4/FeS heterogeneous nanoparticles embedded in Co/Fe single-atom-loaded nitrogen-doped carbon nanosheets is designed. Cobalt-iron sulfides and single atomic sites with Co-N4/Fe-N4 configurations are confirmed to coexist on the carbon matrix by EXAFS spectroscopy. 3D self-supported super-hydrophobic multiphase composite cathode provides abundant active sites and facilitates gas–liquid-solid three-phase interface reactions, resulting in excellent electrocatalytic activity and batteries performance, i.e., an OER overpotential (η 10) of 260 mV, a half-wave potential (E 1/2) of 0.872 V for ORR, a ΔE of 0.618 V, and a discharge power density of 170 mW cm−2, a specific capacity of 816.3 mAh g−1. DFT analysis shows multiphase coupling of sulfide heterojunction through single-atomic metal doped carbon nanosheets reduces offset on center of electronic density of states before and after oxygen adsorption, and spin density of adsorbed oxygen with same spin orientation, leading to weakened charge/spin interactions between adsorbed oxygen and substrate, and a lowered oxygen adsorption energy to accelerate OER/ORR.",
        "openArchiveArticle": "false",
        "prism:coverDate": "2024-09-30",
        "openaccessUserLicense": null,
        "prism:aggregationType": "Journal",
        "prism:url": "https://api.elsevier.com/content/article/pii/S2095495624003565",
        "dc:creator": [
          {
            "@_fa": "true",
            "$": "Tan, Yan"
          },
          {
            "@_fa": "true",
            "$": "Wang, Yijie"
          },
          {
            "@_fa": "true",
            "$": "Li, Aoshuang"
          },
          {
            "@_fa": "true",
            "$": "Jiang, Xiucai"
          },
          {
            "@_fa": "true",
            "$": "Zhang, Yuzhong"
          },
          {
            "@_fa": "true",
            "$": "Cheng, Chuanwei"
          }
        ],
        "link": [
          {
            "@_fa": "true",
            "@rel": "self",
            "@href": "https://api.elsevier.com/content/article/pii/S2095495624003565"
          },
          {
            "@_fa": "true",
            "@rel": "scidir",
            "@href": "https://www.sciencedirect.com/science/article/pii/S2095495624003565"
          }
        ],
        "dc:format": "application/json",
        "openaccessType": null,
        "pii": "S2095-4956(24)00356-5",
        "prism:volume": "96",
        "prism:publisher": "Science Press and Dalian Institute of Chemical Physics, Chinese Academy of Sciences. Published by ELSEVIER B.V. and Science Press. All rights are reserved, including those for text and data mining, AI training, and similar technologies.",
        "dc:title": "Superhydrophobic Co/Fe sulfide nanoparticles and single-atoms doped carbon nanosheets composite air cathode for high-performance zinc-air batteries",
        "prism:copyright": "© 2024 Science Press and Dalian Institute of Chemical Physics, Chinese Academy of Sciences. Published by ELSEVIER B.V. and Science Press. All rights are reserved, including those for text and data mining, AI training, and similar technologies.",
        "openaccess": "0",
        "prism:issn": "20954956",
        "dcterms:subject": [
          {
            "@_fa": "true",
            "$": "Zn-air battery"
          },
          {
            "@_fa": "true",
            "$": "Superhydrophobic interface"
          },
          {
            "@_fa": "true",
            "$": "Metal sulfide"
          },
          {
            "@_fa": "true",
            "$": "Heterostructure"
          },
          {
            "@_fa": "true",
            "$": "Spin density"
          }
        ],
        "openaccessArticle": "false",
        "prism:publicationName": "Journal of Energy Chemistry",
        "openaccessSponsorType": null,
        "prism:pageRange": "568-577",
        "prism:endingPage": "577",
        "pubType": "fla",
        "prism:coverDisplayDate": "September 2024",
        "prism:doi": "10.1016/j.jechem.2024.05.013",
        "prism:startingPage": "568",
        "dc:identifier": "doi:10.1016/j.jechem.2024.05.013",
        "openaccessSponsorName": null
      },
      "objects": {
        "object": [
          {
            "@category": "standard",
            "@height": "200",
            "@width": "496",
            "@_fa": "true",
            "$": "https://api.elsevier.com/content/object/eid/1-s2.0-S2095495624003565-ga1.jpg?httpAccept=%2A%2F%2A",
            "@multimediatype": "JPEG image file",
            "@type": "IMAGE-DOWNSAMPLED",
            "@size": "35703",
            "@ref": "ga1",
            "@mimetype": "image/jpeg"
          },
          {
            "@category": "standard",
            "@height": "532",
            "@width": "647",
            "@_fa": "true",
            "$": "https://api.elsevier.com/content/object/eid/1-s2.0-S2095495624003565-gr1.jpg?httpAccept=%2A%2F%2A",
            "@multimediatype": "JPEG image file",
            "@type": "IMAGE-DOWNSAMPLED",
            "@size": "122122",
            "@ref": "gr1",
            "@mimetype": "image/jpeg"
          },
          {
            "@category": "standard",
            "@height": "431",
            "@width": "774",
            "@_fa": "true",
            "$": "https://api.elsevier.com/content/object/eid/1-s2.0-S2095495624003565-gr2.jpg?httpAccept=%2A%2F%2A",
            "@multimediatype": "JPEG image file",
            "@type": "IMAGE-DOWNSAMPLED",
            "@size": "97638",
            "@ref": "gr2",
            "@mimetype": "image/jpeg"
          },
          {
            "@category": "standard",
            "@height": "445",
            "@width": "774",
            "@_fa": "true",
            "$": "https://api.elsevier.com/content/object/eid/1-s2.0-S2095495624003565-gr3.jpg?httpAccept=%2A%2F%2A",
            "@multimediatype": "JPEG image file",
            "@type": "IMAGE-DOWNSAMPLED",
            "@size": "139625",
            "@ref": "gr3",
            "@mimetype": "image/jpeg"
          },
          {
            "@category": "standard",
            "@height": "405",
            "@width": "667",
            "@_fa": "true",
            "$": "https://api.elsevier.com/content/object/eid/1-s2.0-S2095495624003565-gr4.jpg?httpAccept=%2A%2F%2A",
            "@multimediatype": "JPEG image file",
            "@type": "IMAGE-DOWNSAMPLED",
            "@size": "68025",
            "@ref": "gr4",
            "@mimetype": "image/jpeg"
          },
          {
            "@category": "standard",
            "@height": "612",
            "@width": "774",
            "@_fa": "true",
            "$": "https://api.elsevier.com/content/object/eid/1-s2.0-S2095495624003565-gr5.jpg?httpAccept=%2A%2F%2A",
            "@multimediatype": "JPEG image file",
            "@type": "IMAGE-DOWNSAMPLED",
            "@size": "156559",
            "@ref": "gr5",
            "@mimetype": "image/jpeg"
          },
          {
            "@category": "standard",
            "@height": "654",
            "@width": "667",
            "@_fa": "true",
            "$": "https://api.elsevier.com/content/object/eid/1-s2.0-S2095495624003565-gr6.jpg?httpAccept=%2A%2F%2A",
            "@multimediatype": "JPEG image file",
            "@type": "IMAGE-DOWNSAMPLED",
            "@size": "168986",
            "@ref": "gr6",
            "@mimetype": "image/jpeg"
          },
          {
            "@category": "standard",
            "@height": "510",
            "@width": "774",
            "@_fa": "true",
            "$": "https://api.elsevier.com/content/object/eid/1-s2.0-S2095495624003565-gr7.jpg?httpAccept=%2A%2F%2A",
            "@multimediatype": "JPEG image file",
            "@type": "IMAGE-DOWNSAMPLED",
            "@size": "109388",
            "@ref": "gr7",
            "@mimetype": "image/jpeg"
          },
          {
            "@category": "thumbnail",
            "@height": "88",
            "@width": "219",
            "@_fa": "true",
            "$": "https://api.elsevier.com/content/object/eid/1-s2.0-S2095495624003565-ga1.sml?httpAccept=%2A%2F%2A",
            "@multimediatype": "GIF image file",
            "@type": "IMAGE-THUMBNAIL",
            "@size": "9474",
            "@ref": "ga1",
            "@mimetype": "image/gif"
          },
          {
            "@category": "thumbnail",
            "@height": "164",
            "@width": "199",
            "@_fa": "true",
            "$": "https://api.elsevier.com/content/object/eid/1-s2.0-S2095495624003565-gr1.sml?httpAccept=%2A%2F%2A",
            "@multimediatype": "GIF image file",
            "@type": "IMAGE-THUMBNAIL",
            "@size": "19593",
            "@ref": "gr1",
            "@mimetype": "image/gif"
          },
          {
            "@category": "thumbnail",
            "@height": "122",
            "@width": "219",
            "@_fa": "true",
            "$": "https://api.elsevier.com/content/object/eid/1-s2.0-S2095495624003565-gr2.sml?httpAccept=%2A%2F%2A",
            "@multimediatype": "GIF image file",
            "@type": "IMAGE-THUMBNAIL",
            "@size": "11282",
            "@ref": "gr2",
            "@mimetype": "image/gif"
          },
          {
            "@category": "thumbnail",
            "@height": "126",
            "@width": "219",
            "@_fa": "true",
            "$": "https://api.elsevier.com/content/object/eid/1-s2.0-S2095495624003565-gr3.sml?httpAccept=%2A%2F%2A",
            "@multimediatype": "GIF image file",
            "@type": "IMAGE-THUMBNAIL",
            "@size": "17147",
            "@ref": "gr3",
            "@mimetype": "image/gif"
          },
          {
            "@category": "thumbnail",
            "@height": "133",
            "@width": "219",
            "@_fa": "true",
            "$": "https://api.elsevier.com/content/object/eid/1-s2.0-S2095495624003565-gr4.sml?httpAccept=%2A%2F%2A",
            "@multimediatype": "GIF image file",
            "@type": "IMAGE-THUMBNAIL",
            "@size": "14492",
            "@ref": "gr4",
            "@mimetype": "image/gif"
          },
          {
            "@category": "thumbnail",
            "@height": "164",
            "@width": "207",
            "@_fa": "true",
            "$": "https://api.elsevier.com/content/object/eid/1-s2.0-S2095495624003565-gr5.sml?httpAccept=%2A%2F%2A",
            "@multimediatype": "GIF image file",
            "@type": "IMAGE-THUMBNAIL",
            "@size": "14817",
            "@ref": "gr5",
            "@mimetype": "image/gif"
          },
          {
            "@category": "thumbnail",
            "@height": "164",
            "@width": "167",
            "@_fa": "true",
            "$": "https://api.elsevier.com/content/object/eid/1-s2.0-S2095495624003565-gr6.sml?httpAccept=%2A%2F%2A",
            "@multimediatype": "GIF image file",
            "@type": "IMAGE-THUMBNAIL",
            "@size": "14279",
            "@ref": "gr6",
            "@mimetype": "image/gif"
          },
          {
            "@category": "thumbnail",
            "@height": "144",
            "@width": "219",
            "@_fa": "true",
            "$": "https://api.elsevier.com/content/object/eid/1-s2.0-S2095495624003565-gr7.sml?httpAccept=%2A%2F%2A",
            "@multimediatype": "GIF image file",
            "@type": "IMAGE-THUMBNAIL",
            "@size": "12977",
            "@ref": "gr7",
            "@mimetype": "image/gif"
          },
          {
            "@category": "high",
            "@height": "886",
            "@width": "2195",
            "@_fa": "true",
            "$": "https://api.elsevier.com/content/object/eid/1-s2.0-S2095495624003565-ga1_lrg.jpg?httpAccept=%2A%2F%2A",
            "@multimediatype": "JPEG image file",
            "@type": "IMAGE-HIGH-RES",
            "@size": "219147",
            "@ref": "ga1",
            "@mimetype": "image/jpeg"
          },
          {
            "@category": "high",
            "@height": "1036",
            "@width": "1260",
            "@_fa": "true",
            "$": "https://api.elsevier.com/content/object/eid/1-s2.0-S2095495624003565-gr1_lrg.jpg?httpAccept=%2A%2F%2A",
            "@multimediatype": "JPEG image file",
            "@type": "IMAGE-HIGH-RES",
            "@size": "310359",
            "@ref": "gr1",
            "@mimetype": "image/jpeg"
          },
          {
            "@category": "high",
            "@height": "1908",
            "@width": "3425",
            "@_fa": "true",
            "$": "https://api.elsevier.com/content/object/eid/1-s2.0-S2095495624003565-gr2_lrg.jpg?httpAccept=%2A%2F%2A",
            "@multimediatype": "JPEG image file",
            "@type": "IMAGE-HIGH-RES",
            "@size": "545137",
            "@ref": "gr2",
            "@mimetype": "image/jpeg"
          },
          {
            "@category": "high",
            "@height": "1969",
            "@width": "3425",
            "@_fa": "true",
            "$": "https://api.elsevier.com/content/object/eid/1-s2.0-S2095495624003565-gr3_lrg.jpg?httpAccept=%2A%2F%2A",
            "@multimediatype": "JPEG image file",
            "@type": "IMAGE-HIGH-RES",
            "@size": "823753",
            "@ref": "gr3",
            "@mimetype": "image/jpeg"
          },
          {
            "@category": "high",
            "@height": "1792",
            "@width": "2953",
            "@_fa": "true",
            "$": "https://api.elsevier.com/content/object/eid/1-s2.0-S2095495624003565-gr4_lrg.jpg?httpAccept=%2A%2F%2A",
            "@multimediatype": "JPEG image file",
            "@type": "IMAGE-HIGH-RES",
            "@size": "389604",
            "@ref": "gr4",
            "@mimetype": "image/jpeg"
          },
          {
            "@category": "high",
            "@height": "2710",
            "@width": "3425",
            "@_fa": "true",
            "$": "https://api.elsevier.com/content/object/eid/1-s2.0-S2095495624003565-gr5_lrg.jpg?httpAccept=%2A%2F%2A",
            "@multimediatype": "JPEG image file",
            "@type": "IMAGE-HIGH-RES",
            "@size": "850870",
            "@ref": "gr5",
            "@mimetype": "image/jpeg"
          },
          {
            "@category": "high",
            "@height": "2896",
            "@width": "2953",
            "@_fa": "true",
            "$": "https://api.elsevier.com/content/object/eid/1-s2.0-S2095495624003565-gr6_lrg.jpg?httpAccept=%2A%2F%2A",
            "@multimediatype": "JPEG image file",
            "@type": "IMAGE-HIGH-RES",
            "@size": "981439",
            "@ref": "gr6",
            "@mimetype": "image/jpeg"
          },
          {
            "@category": "high",
            "@height": "2257",
            "@width": "3425",
            "@_fa": "true",
            "$": "https://api.elsevier.com/content/object/eid/1-s2.0-S2095495624003565-gr7_lrg.jpg?httpAccept=%2A%2F%2A",
            "@multimediatype": "JPEG image file",
            "@type": "IMAGE-HIGH-RES",
            "@size": "700586",
            "@ref": "gr7",
            "@mimetype": "image/jpeg"
          },
          {
            "@category": "standard",
            "@_fa": "true",
            "$": "https://api.elsevier.com/content/object/eid/1-s2.0-S2095495624003565-mmc1.pdf?httpAccept=%2A%2F%2A",
            "@multimediatype": "Acrobat PDF file",
            "@type": "APPLICATION",
            "@size": "2962675",
            "@ref": "mmc1",
            "@mimetype": "application/pdf"
          },
          {
            "@category": "standard",
            "@_fa": "true",
            "$": "https://api.elsevier.com/content/object/eid/1-s2.0-S2095495624003565-am.pdf?httpAccept=%2A%2F%2A",
            "@multimediatype": "Acrobat PDF file",
            "@type": "AAM-PDF",
            "@size": "29111899",
            "@ref": "am",
            "@mimetype": "application/pdf"
          }
        ]
      },
      "link": {
        "@rel": "abstract",
        "@href": "https://api.elsevier.com/content/abstract/scopus_id/85194362093"
      }
    }
  }
}