{
  "metadata": {
    "title": "Sulfur doping and oxygen vacancy in In<ce:inf loc=post>2</ce:inf>O<ce:inf loc=post>3</ce:inf> nanotube co-regulate intermediates of CO<ce:inf loc=post>2</ce:inf> electroreduction for efficient HCOOH production and rechargeable Zn-CO<ce:inf loc=post>2</ce:inf> battery",
    "authors": "; ; ",
    "journal": "Journal of Energy Chemistry",
    "date": "2025-02-28",
    "doi": "10.1016/j.jechem.2024.09.057",
    "abstract": "",
    "uri": "https://api.elsevier.com/content/article/pii/S209549562400682X",
    "pii": "S209549562400682X"
  },
  "fulltext": {
    "full-text-retrieval-response": {
      "scopus-eid": "2-s2.0-85207696463",
      "originalText": "serial JL 286353 291210 291711 291744 291809 31 Journal of Energy Chemistry JOURNALENERGYCHEMISTRY 2024-10-16 2024-10-16 2024-11-01 2024-11-01 2025-02-12T16:04:49 1-s2.0-S209549562400682X S2095-4956(24)00682-X S209549562400682X 10.1016/j.jechem.2024.09.057 S300 S300.1 FULL-TEXT 1-s2.0-S2095495624X0011X 2025-02-12T17:39:55.417013Z 0 0 20250201 20250228 2025 2024-10-16T23:55:12.202209Z absattachment articleinfo articletitlenorm authfirstinitialnorm authfirstsurnamenorm cid cids contenttype copyright crossmark dateloaded dateloadedtxt datesearch datesort dateupdated dco docsubtype doctype doi eid ewtransactionid hubeid indexeddate issn issnnorm itemstage itemtransactionid itemweight openaccess openarchive pg pgfirst pglast pii piinorm pubdateend pubdatestart pubdatetxt pubyr sortorder srctitle srctitlenorm srctype ssids alllist content subj subheadings suppl tomb volfirst volissue volumelist webpdf webpdfpagecount yearnav figure e-component body mmlmath acknowledge affil appendices articletitle auth authfirstini authfull authkeywords authlast grantnumber grantsponsor grantsponsorid primabst ref specialabst 2095-4956 20954956 false 101 101 C Volume 101 37 474 484 474 484 202502 February 2025 2025-02-01 2025-02-28 2025 article fla © 2024 Science Press and Dalian Institute of Chemical Physics, Chinese Academy of Sciences. Published by ELSEVIER B.V. and Science Press. All rights are reserved, including those for text and data mining, AI training, and similar technologies. SULFURDOPINGOXYGENVACANCYININ2O3NANOTUBECOREGULATEINTERMEDIATESCO2ELECTROREDUCTIONFOREFFICIENTHCOOHPRODUCTIONRECHARGEABLEZNCO2BATTERY LI Y 1 Introduction 2 Experimental 2.1 Materials preparation 2.2 Characterizations 2.3 Electrochemical measurements 2.4 Product analysis 2.5 In-situ attenuated total reflection surface enhanced infrared absorption spectroscopy (ATR-SEIRAS) 2.6 Density functional theory (DFT) calculation 2.7 Aqueous rechargeable Zn-CO2 electrochemical battery 3 Results and discussion 4 Conclusions CRediT authorship contribution statement Acknowledgments Appendix A Supplementary material References LIU 2017 15438 X GAO 2019 198 210 D XIE 2018 16996 17001 J YANG 2019 2575 2580 R WANG 2018 2551 2582 Y SAHA 2022 134 144 P BIRDJA 2019 732 745 Y WAGNER 2020 775 786 A WU 2020 2009070 Z YANG 2023 e12508 Z ZHANG 2019 5609 5613 J CHENG 2023 4021 4029 Q DAI 2020 5657 J WANG 2022 518 528 K BUI 2023 e2205814 T HAN 2021 105492 H MA 2021 888 926 Y FENG 2023 9857 9866 J LI 2022 1965 P ZHANG 2022 2200321 B DAIYAN 2020 1902106 R LIM 2014 11355 11361 H SHIN 2016 4124 4129 H KIM 2019 e1805617 C WU 2024 e2305562 W WULAN 2022 2209114 B WANG 2018 5037 5040 S ZHUANG 2020 14664 14670 L SHINAGAWA 2018 837 844 T LV 2023 e202303117 L JIA 2021 23342 23348 C SUN 2024 123389 X BLOCHL 1994 17953 17979 P PERDEW 1992 6671 6687 J GRIMME 2010 154104 S SKULASON 2012 1235 1245 E CAI 2020 13275 13289 Z WEI 2021 8236 8242 Z ZHAO 2020 11739 11750 S MO 2020 118464 S ZHANG 2023 6000 6012 H ZHENG 2022 14171 14186 Y ZHU 2013 771 778 C WEI 2022 3199 W CHI 2021 5835 L LIANG 2023 e202310740 S LV 2022 8213 8222 C CHEN 2021 2109336 K QI 2020 e1903915 Y SHANG 2020 22465 22469 H YAN 2023 2302 2312 K LU 2021 5671 5678 P YANG 2018 140 147 H GORTHY 2023 12924 12940 S ZHANG 2014 1734 1737 S SALEHIKHOJIN 2013 1627 1632 A MA 2019 892 W WANG 2022 e202200552 Z WANG 2023 1242 1250 S MA 2021 12897 12914 W LAI 2022 3603 3629 W ZHU 2017 15664 15667 S JIA 2023 14101 14111 B CAO 2020 15014 15020 C LI 2022 e202205632 Y WANG 2023 e202211174 T GUO 1987 21979 21987 W GENG 2018 6054 6059 Z HAN 2018 1320 N ZHENG 2023 107980 W URBAIN 2017 2256 2266 F WANG 2019 1807807 X LIX2025X474 LIX2025X474X484 LIX2025X474XY LIX2025X474X484XY 2026-11-01T00:00:00.000Z 2026-11-01T00:00:00.000Z http://creativecommons.org/licenses/by-nc-nd/4.0/ © 2024 Science Press and Dalian Institute of Chemical Physics, Chinese Academy of Sciences. Published by ELSEVIER B.V. and Science Press. All rights are reserved, including those for text and data mining, AI training, and similar technologies. 2024-11-05T12:40:01.795Z http://vtw.elsevier.com/data/voc/AddOnTypes/50.7/aggregated-refined Fundamental Research Funds for the Central Universities 22120230104 Fundamental Research Funds for the Central Universities http://data.elsevier.com/vocabulary/SciValFunders/501100012226 http://sws.geonames.org/1814991 This work was supported by the Fundamental Research Funds for the Central Universities (22120230104). item S2095-4956(24)00682-X S209549562400682X 1-s2.0-S209549562400682X 10.1016/j.jechem.2024.09.057 286353 2025-02-12T17:39:55.417013Z 2025-02-01 2025-02-28 1-s2.0-S209549562400682X-main.pdf https://s3-eu-west-1.amazonaws.com/prod-ucs-content-store-eu-west/content/pii:S209549562400682X/MAIN/application/pdf/34a41cfe94c2538cb4a98ef86e9ee94a/main.pdf main.pdf pdf true 4541279 MAIN 11 1-s2.0-S209549562400682X-main_1.png https://s3-eu-west-1.amazonaws.com/prod-ucs-content-store-eu-west/content/pii:S209549562400682X/PREVIEW/image/png/215f9f32216e4301618f400a40e18323/main_1.png main_1.png png 60609 849 656 IMAGE-WEB-PDF 1 1-s2.0-S209549562400682X-ga1.jpg https://s3-eu-west-1.amazonaws.com/prod-ucs-content-store-eu-west/content/pii:S209549562400682X/ga1/DOWNSAMPLED/image/jpeg/cf04e51b030032482a95cf87d33c46fe/ga1.jpg ga1 true ga1.jpg jpg 23371 200 405 IMAGE-DOWNSAMPLED 1-s2.0-S209549562400682X-gr1.jpg https://s3-eu-west-1.amazonaws.com/prod-ucs-content-store-eu-west/content/pii:S209549562400682X/gr1/DOWNSAMPLED/image/jpeg/1de8560a34552e2103c4f7c867fd3533/gr1.jpg gr1 gr1.jpg jpg 43855 250 535 IMAGE-DOWNSAMPLED 1-s2.0-S209549562400682X-gr2.jpg https://s3-eu-west-1.amazonaws.com/prod-ucs-content-store-eu-west/content/pii:S209549562400682X/gr2/DOWNSAMPLED/image/jpeg/43f5a89c7be7bc3cb21478ad61faea7d/gr2.jpg gr2 gr2.jpg jpg 195191 605 746 IMAGE-DOWNSAMPLED 1-s2.0-S209549562400682X-gr3.jpg https://s3-eu-west-1.amazonaws.com/prod-ucs-content-store-eu-west/content/pii:S209549562400682X/gr3/HIGHRES/image/jpeg/cbc95ba9beec4ffb845f556b30d9c81e/gr3.jpg gr3 gr3.jpg jpg 116553 460 766 IMAGE-DOWNSAMPLED 1-s2.0-S209549562400682X-gr4.jpg https://s3-eu-west-1.amazonaws.com/prod-ucs-content-store-eu-west/content/pii:S209549562400682X/gr4/DOWNSAMPLED/image/jpeg/1771dbbde255db4a1a2396c9240533fc/gr4.jpg gr4 gr4.jpg jpg 100085 435 729 IMAGE-DOWNSAMPLED 1-s2.0-S209549562400682X-gr5.jpg https://s3-eu-west-1.amazonaws.com/prod-ucs-content-store-eu-west/content/pii:S209549562400682X/gr5/DOWNSAMPLED/image/jpeg/58f8312e9d99921072df8de7e4a0018e/gr5.jpg gr5 gr5.jpg jpg 119414 541 666 IMAGE-DOWNSAMPLED 1-s2.0-S209549562400682X-gr6.jpg https://s3-eu-west-1.amazonaws.com/prod-ucs-content-store-eu-west/content/pii:S209549562400682X/gr6/HIGHRES/image/jpeg/45502ce757d140df2bb47a59acbf7778/gr6.jpg gr6 gr6.jpg jpg 167192 721 698 IMAGE-DOWNSAMPLED 1-s2.0-S209549562400682X-gr7.jpg https://s3-eu-west-1.amazonaws.com/prod-ucs-content-store-eu-west/content/pii:S209549562400682X/gr7/DOWNSAMPLED/image/jpeg/495845f6fc777508715aa12dd6d9ee5c/gr7.jpg gr7 gr7.jpg jpg 115150 750 657 IMAGE-DOWNSAMPLED 1-s2.0-S209549562400682X-ga1.sml https://s3-eu-west-1.amazonaws.com/prod-ucs-content-store-eu-west/content/pii:S209549562400682X/ga1/THUMBNAIL/image/gif/8d5af62f68407304da99439e95aea285/ga1.sml ga1 true ga1.sml sml 12868 108 219 IMAGE-THUMBNAIL 1-s2.0-S209549562400682X-gr1.sml https://s3-eu-west-1.amazonaws.com/prod-ucs-content-store-eu-west/content/pii:S209549562400682X/gr1/THUMBNAIL/image/gif/5ab6b2363f6849b53289eafb2ae89c28/gr1.sml gr1 gr1.sml sml 9988 102 219 IMAGE-THUMBNAIL 1-s2.0-S209549562400682X-gr2.sml https://s3-eu-west-1.amazonaws.com/prod-ucs-content-store-eu-west/content/pii:S209549562400682X/gr2/THUMBNAIL/image/gif/ee104f562da821c680f9697f205ed22b/gr2.sml gr2 gr2.sml sml 26925 164 202 IMAGE-THUMBNAIL 1-s2.0-S209549562400682X-gr3.sml https://s3-eu-west-1.amazonaws.com/prod-ucs-content-store-eu-west/content/pii:S209549562400682X/gr3/THUMBNAIL/image/gif/34516f564774c10476f7c6d98f9bdc06/gr3.sml gr3 gr3.sml sml 12425 132 219 IMAGE-THUMBNAIL 1-s2.0-S209549562400682X-gr4.sml https://s3-eu-west-1.amazonaws.com/prod-ucs-content-store-eu-west/content/pii:S209549562400682X/gr4/THUMBNAIL/image/gif/91bd8c3f5a0b51979381bb8590c11cb1/gr4.sml gr4 gr4.sml sml 15165 131 219 IMAGE-THUMBNAIL 1-s2.0-S209549562400682X-gr5.sml https://s3-eu-west-1.amazonaws.com/prod-ucs-content-store-eu-west/content/pii:S209549562400682X/gr5/THUMBNAIL/image/gif/e655ca1fe8cfd6ba1ced0f860d57bef8/gr5.sml gr5 gr5.sml sml 14436 164 202 IMAGE-THUMBNAIL 1-s2.0-S209549562400682X-gr6.sml https://s3-eu-west-1.amazonaws.com/prod-ucs-content-store-eu-west/content/pii:S209549562400682X/gr6/THUMBNAIL/image/gif/312cac2ce19acaf222f7cfe49da8661e/gr6.sml gr6 gr6.sml sml 12902 163 158 IMAGE-THUMBNAIL 1-s2.0-S209549562400682X-gr7.sml https://s3-eu-west-1.amazonaws.com/prod-ucs-content-store-eu-west/content/pii:S209549562400682X/gr7/THUMBNAIL/image/gif/107308bd4f578d17915fb7a2b021b810/gr7.sml gr7 gr7.sml sml 9920 163 143 IMAGE-THUMBNAIL 1-s2.0-S209549562400682X-ga1_lrg.jpg https://s3-eu-west-1.amazonaws.com/prod-ucs-content-store-eu-west/content/pii:S209549562400682X/HIGHRES/image/jpeg/c583c200c4f54af4cc5fa9e6f7063d3c/ga1_lrg.jpg ga1 true ga1_lrg.jpg jpg 64527 531 1076 IMAGE-HIGH-RES 1-s2.0-S209549562400682X-gr1_lrg.jpg https://s3-eu-west-1.amazonaws.com/prod-ucs-content-store-eu-west/content/pii:S209549562400682X/HIGHRES/image/jpeg/36f55e88641227c25154832c19345c78/gr1_lrg.jpg gr1 gr1_lrg.jpg jpg 253959 1105 2368 IMAGE-HIGH-RES 1-s2.0-S209549562400682X-gr2_lrg.jpg https://s3-eu-west-1.amazonaws.com/prod-ucs-content-store-eu-west/content/pii:S209549562400682X/HIGHRES/image/jpeg/7666b71dd37466319f41d8b1b7f0b8e7/gr2_lrg.jpg gr2 gr2_lrg.jpg jpg 802440 1667 2055 IMAGE-HIGH-RES 1-s2.0-S209549562400682X-gr3_lrg.jpg https://s3-eu-west-1.amazonaws.com/prod-ucs-content-store-eu-west/content/pii:S209549562400682X/HIGHRES/image/jpeg/e8a589cfe5619f456c02e8f72c654b37/gr3_lrg.jpg gr3 gr3_lrg.jpg jpg 631996 2039 3393 IMAGE-HIGH-RES 1-s2.0-S209549562400682X-gr4_lrg.jpg https://s3-eu-west-1.amazonaws.com/prod-ucs-content-store-eu-west/content/pii:S209549562400682X/THUMBNAIL/image/jpeg/bfc977370ddb085979e28d1681972372/gr4_lrg.jpg gr4 gr4_lrg.jpg jpg 622951 1928 3228 IMAGE-HIGH-RES 1-s2.0-S209549562400682X-gr5_lrg.jpg https://s3-eu-west-1.amazonaws.com/prod-ucs-content-store-eu-west/content/pii:S209549562400682X/THUMBNAIL/image/jpeg/29087197184ba8b982b2d91e32310caf/gr5_lrg.jpg gr5 gr5_lrg.jpg jpg 632580 2398 2951 IMAGE-HIGH-RES 1-s2.0-S209549562400682X-gr6_lrg.jpg https://s3-eu-west-1.amazonaws.com/prod-ucs-content-store-eu-west/content/pii:S209549562400682X/HIGHRES/image/jpeg/826b05722fd15358d094d3900d9deb58/gr6_lrg.jpg gr6 gr6_lrg.jpg jpg 1016431 3195 3091 IMAGE-HIGH-RES 1-s2.0-S209549562400682X-gr7_lrg.jpg https://s3-eu-west-1.amazonaws.com/prod-ucs-content-store-eu-west/content/pii:S209549562400682X/HIGHRES/image/jpeg/87d16ba517316beb29777b05fd48dc3e/gr7_lrg.jpg gr7 gr7_lrg.jpg jpg 771723 3321 2911 IMAGE-HIGH-RES 1-s2.0-S209549562400682X-mmc1.docx https://s3-eu-west-1.amazonaws.com/prod-ucs-content-store-eu-west/content/pii:S209549562400682X/mmc1/MAIN/application/vnd.openxmlformats-officedocument.wordprocessingml.document/7c34d377424d2489e088e874a5a524e2/mmc1.docx mmc1 mmc1.docx docx 5785505 APPLICATION 1-s2.0-S209549562400682X-si1.svg https://s3-eu-west-1.amazonaws.com/prod-ucs-content-store-eu-west/content/pii:S209549562400682X/STRIPIN/image/svg+xml/0251f178c291ba7fd31260ad121e1c2b/si1.svg si1 si1.svg svg 23087 ALTIMG 1-s2.0-S209549562400682X-si10.svg https://s3-eu-west-1.amazonaws.com/prod-ucs-content-store-eu-west/content/pii:S209549562400682X/STRIPIN/image/svg+xml/2e95e73f964206578a6e2bc070859992/si10.svg si10 si10.svg svg 19335 ALTIMG 1-s2.0-S209549562400682X-si11.svg https://s3-eu-west-1.amazonaws.com/prod-ucs-content-store-eu-west/content/pii:S209549562400682X/STRIPIN/image/svg+xml/437e2e994e61ecad32b94271fe03f5c5/si11.svg si11 si11.svg svg 1421 ALTIMG 1-s2.0-S209549562400682X-si12.svg https://s3-eu-west-1.amazonaws.com/prod-ucs-content-store-eu-west/content/pii:S209549562400682X/STRIPIN/image/svg+xml/6e43d30d494b7854e865cea6d11154d0/si12.svg si12 si12.svg svg 6414 ALTIMG 1-s2.0-S209549562400682X-si13.svg https://s3-eu-west-1.amazonaws.com/prod-ucs-content-store-eu-west/content/pii:S209549562400682X/STRIPIN/image/svg+xml/d7bec1e54fd4638d93003fed755cf565/si13.svg si13 si13.svg svg 13670 ALTIMG 1-s2.0-S209549562400682X-si14.svg https://s3-eu-west-1.amazonaws.com/prod-ucs-content-store-eu-west/content/pii:S209549562400682X/STRIPIN/image/svg+xml/b10d19ac65226f66853c1d526f6c8037/si14.svg si14 si14.svg svg 5273 ALTIMG 1-s2.0-S209549562400682X-si15.svg https://s3-eu-west-1.amazonaws.com/prod-ucs-content-store-eu-west/content/pii:S209549562400682X/STRIPIN/image/svg+xml/3eaded06a8ade5da196a70ed1e4dc5ba/si15.svg si15 si15.svg svg 5421 ALTIMG 1-s2.0-S209549562400682X-si16.svg https://s3-eu-west-1.amazonaws.com/prod-ucs-content-store-eu-west/content/pii:S209549562400682X/STRIPIN/image/svg+xml/ceef7b98473125c2068a68952f673cb4/si16.svg si16 si16.svg svg 2413 ALTIMG 1-s2.0-S209549562400682X-si17.svg https://s3-eu-west-1.amazonaws.com/prod-ucs-content-store-eu-west/content/pii:S209549562400682X/STRIPIN/image/svg+xml/a6a60bea05f1d7bcbe09486e2a96f1cc/si17.svg si17 si17.svg svg 1134 ALTIMG 1-s2.0-S209549562400682X-si18.svg https://s3-eu-west-1.amazonaws.com/prod-ucs-content-store-eu-west/content/pii:S209549562400682X/STRIPIN/image/svg+xml/46dbabc309b474c5acc994dcfc4be8b0/si18.svg si18 si18.svg svg 1542 ALTIMG 1-s2.0-S209549562400682X-si19.svg https://s3-eu-west-1.amazonaws.com/prod-ucs-content-store-eu-west/content/pii:S209549562400682X/STRIPIN/image/svg+xml/b3a50407279a84a37aa93c877b9e732b/si19.svg si19 si19.svg svg 4762 ALTIMG 1-s2.0-S209549562400682X-si2.svg https://s3-eu-west-1.amazonaws.com/prod-ucs-content-store-eu-west/content/pii:S209549562400682X/STRIPIN/image/svg+xml/5b8eadd6982707240c8c5a7d4b9e4c31/si2.svg si2 si2.svg svg 24591 ALTIMG 1-s2.0-S209549562400682X-si20.svg https://s3-eu-west-1.amazonaws.com/prod-ucs-content-store-eu-west/content/pii:S209549562400682X/STRIPIN/image/svg+xml/91aa8a358b011103b2e58b2706be993d/si20.svg si20 si20.svg svg 3523 ALTIMG 1-s2.0-S209549562400682X-si21.svg https://s3-eu-west-1.amazonaws.com/prod-ucs-content-store-eu-west/content/pii:S209549562400682X/STRIPIN/image/svg+xml/4c57d1df604256bdec1deecf29858803/si21.svg si21 si21.svg svg 3957 ALTIMG 1-s2.0-S209549562400682X-si22.svg https://s3-eu-west-1.amazonaws.com/prod-ucs-content-store-eu-west/content/pii:S209549562400682X/STRIPIN/image/svg+xml/8777a3d5b116b63a917ce654eb7a627d/si22.svg si22 si22.svg svg 3722 ALTIMG 1-s2.0-S209549562400682X-si23.svg https://s3-eu-west-1.amazonaws.com/prod-ucs-content-store-eu-west/content/pii:S209549562400682X/STRIPIN/image/svg+xml/6b4bf33d9ed29c915ac1b82aef779ec5/si23.svg si23 si23.svg svg 4928 ALTIMG 1-s2.0-S209549562400682X-si3.svg https://s3-eu-west-1.amazonaws.com/prod-ucs-content-store-eu-west/content/pii:S209549562400682X/STRIPIN/image/svg+xml/8bc13de9ec95f0bebaaff5c4431392d9/si3.svg si3 si3.svg svg 6810 ALTIMG 1-s2.0-S209549562400682X-si4.svg https://s3-eu-west-1.amazonaws.com/prod-ucs-content-store-eu-west/content/pii:S209549562400682X/STRIPIN/image/svg+xml/40b282d08a1387c35daded1d58dd3b72/si4.svg si4 si4.svg svg 1201 ALTIMG 1-s2.0-S209549562400682X-si5.svg https://s3-eu-west-1.amazonaws.com/prod-ucs-content-store-eu-west/content/pii:S209549562400682X/STRIPIN/image/svg+xml/38a3e4d130d0a3e06e14ceb89da63f25/si5.svg si5 si5.svg svg 1408 ALTIMG 1-s2.0-S209549562400682X-si6.svg https://s3-eu-west-1.amazonaws.com/prod-ucs-content-store-eu-west/content/pii:S209549562400682X/STRIPIN/image/svg+xml/3071cb17542304e4e8f7e5ecd6f529fe/si6.svg si6 si6.svg svg 7606 ALTIMG 1-s2.0-S209549562400682X-si7.svg https://s3-eu-west-1.amazonaws.com/prod-ucs-content-store-eu-west/content/pii:S209549562400682X/STRIPIN/image/svg+xml/472f8e55896320cc3ec1c9a465a62c12/si7.svg si7 si7.svg svg 1536 ALTIMG 1-s2.0-S209549562400682X-si8.svg https://s3-eu-west-1.amazonaws.com/prod-ucs-content-store-eu-west/content/pii:S209549562400682X/STRIPIN/image/svg+xml/16d465c42139ac908d6d32ba1f218f9d/si8.svg si8 si8.svg svg 1944 ALTIMG 1-s2.0-S209549562400682X-si9.svg https://s3-eu-west-1.amazonaws.com/prod-ucs-content-store-eu-west/content/pii:S209549562400682X/STRIPIN/image/svg+xml/beb5c9d4893d9dd8afc75aa0f2714fa9/si9.svg si9 si9.svg svg 5639 ALTIMG JECHEM 4168 S2095-4956(24)00682-X 10.1016/j.jechem.2024.09.057 Science Press Fig. 1 Schematic diagram of the synthetic procedure for Vo-S x -In2O3. Fig. 2 (a) SEM and (b) TEM images of Pure-In2O3. (c–e) TEM, (f) HRTEM images (inset: interplanar spacing), (g) EDS mapping of Vo-In2O3. (h, i) SEM, (j, k) TEM, (l) HRTEM images, (m) interplanar spacing and (n) EDS mapping of Vo-S53-In2O3. Fig. 3 (a) XRD patterns, (b) EPR spectra, XPS of (c) full spectra, (d) O 1s (e) S 2p and (f) In 3d for Pure-In2O3, Vo-In2O3, and Vo-S x -In2O3. Fig. 4 (a) In K-edge XANES spectra (inset: magnified view at 0.5 normalized χμ(E)), (b) k3 -weighted FT-EXAFS spectra of Vo-In2O3, Vo-S53-In2O3 and reference samples (In foil, standard In2O3 and In2S3). (c) FT-EXAFS fitting curve in R-space, (d) EXAFS fitting curve in k-space, (e–g) WT images of standard In2O3, Vo-In2O3 and Vo-S53-In2O3. Fig. 5 (a) LSV curves measured in Ar and CO2-saturated 0.1 M KHCO3, (b) FE of C1, (c) Partial current densities of HCOOH, (d) Single oxidative polarization curves in Ar-saturated 0.1 M KOH, (e) Current density plots against scan rates, (f) EIS curves of Pure-In2O3, Vo-In2O3 and Vo-S x -In2O3. (g) Schematic diagram of GDE. (h) FEHCOOH and partial current density of HCOOH (Error bar represented three independent tests), (i) I-t curve for Vo-S53-In2O3 in flow cell. Fig. 6 (a, b) In-situ ATR-SEIRAS spectra and corresponding contour image of Vo-S53-In2O3 from −0.5 V to −1.4 V vs. RHE. (c) Proposed CO2RR pathways over Vo-S53-In2O3, where blue, gray, red, yellow, pink balls and dashed circle represented C, H, O, S, In atoms and oxygen vacancy, respectively. Charge density difference of *OCHO over (d) Pure-In2O3, (e) Vo-In2O3, and (f) Vo-S-In2O3, where yellow and cyan represented the charge accumulation and depletion, respectively. (g) PDOS of different configurations. (h) Gibbs free energy of CO2-to-HCOOH, (i) Adsorption energy of *OCHO and *HCOOH over Pure-In2O3, Vo-In2O3 and Vo-S-In2O3. Fig. 7 (a) Schematic configuration of reversible aqueous Zn-CO2 battery with Vo-S53-In2O3 cathode during discharge. (b) Discharge and charge polarization curves, (c) Polarization and power density curves, (d) Galvanostatic discharge curves and corresponding FEHCOOH at different current densities, (e) Galvanostatic discharge–charge cycling curves at 5 mA cm−2 of Vo-S53-In2O3. Sulfur doping and oxygen vacancy in In2O3 nanotube co-regulate intermediates of CO2 electroreduction for efficient HCOOH production and rechargeable Zn-CO2 battery Yu Li Writing – original draft Methodology Investigation Conceptualization Zhengrong Xu Writing – review & editing Quanxin Guo Writing – review & editing Qin Li Methodology Rui Liu Writing – review & editing Supervision Funding acquisition ⁎ Key Laboratory of Advanced Civil Engineering Materials of Ministry of Education, School of Materials Science and Engineering, Tongji University, Shanghai 201804, China Key Laboratory of Advanced Civil Engineering Materials of Ministry of Education School of Materials Science and Engineering Tongji University Shanghai 201804 China Key Laboratory of Advanced Civil Engineering Materials of Ministry of Education, School of Materials Science and Engineering, Tongji University, Shanghai 201804, China ⁎ Corresponding author. Graphical abstract Sulfur doping and oxygen vacancy in In2O3 nanotubes (Vo-S53-In2O3) create a conducive electronic micro-environment for *OCHO adsorption and *HCOOH desorption. Vo-S53-In2O3 can be assembled in flow cell and Zn-CO2 battery with exceptional product selectivity and stability. By manipulating the distribution of surface electrons, defect engineering enables effective control over the adsorption energy between adsorbates and active sites in the CO2 reduction reaction (CO2RR). Herein, we report a hollow indium oxide nanotube containing both oxygen vacancy and sulfur doping (Vo-Sx-In2O3) for improved CO2-to-HCOOH electroreduction and Zn-CO2 battery. The componential synergy significantly reduces the *OCHO formation barrier to expedite protonation process and creates a favorable electronic micro-environment for *HCOOH desorption. As a result, the CO2RR performance of Vo-Sx-In2O3 outperforms Pure-In2O3 and Vo-In2O3, where Vo-S53-In2O3 exhibits a maximal HCOOH Faradaic efficiency of 92.4% at −1.2 V vs. reversible hydrogen electrode (RHE) in H-cell and above 92% over a wide window potential with high current density (119.1 mA cm−2 at −1.1 V vs. RHE) in flow cell. Furthermore, the rechargeable Zn-CO2 battery utilizing Vo-S53-In2O3 as cathode shows a high power density of 2.29 mW cm−2 and a long-term stability during charge–discharge cycles. This work provides a valuable perspective to elucidate co-defective catalysts in regulating the intermediates for efficient CO2RR. Keywords CO2 electroreduction Oxygen vacancy Sulfur doping In2O3 Intermediate Zn-CO2 battery 1 Introduction Utilizing renewable electricity for conversion of CO2 into valuable chemicals offers a viable technological solution to mitigate greenhouse gas accumulation [1,2]. Moreover, the Zn-CO2 battery, integrating the CO2 reduction reaction (CO2RR), enables intermittent conversion between electrical and chemical energy [3]. This device offers a secure and cost-effective method for energy conversion/storage technologies [4]. In this context, the performance of CO2RR occurring on the cathode side emerges as a prerequisite for feasible Zn-CO2 battery. Nonetheless, due to the thermodynamic stability of C = O bond (750 kJ mol−1) and the competitive hydrogen evolution reaction (HER), it is imperative to develop efficient catalysts for driving CO2RR [5,6]. Generally, activation of CO2 and subsequent adsorption of the pivotal intermediate (*OCHO, *COOH, *CHO, etc.) are paramount steps in determining the CO2RR performance [7,8]. Defective oxygen vacancy (Vo) has been found to profoundly shape the intrinsic electronic structure and the surface characteristic of catalysts, which plays a crucial role in the adsorption and activation of CO2 [9]. Concurrently, the change of local charge density induced by Vo promotes charge delocalization, facilitating the generation of vital intermediates and modulating their adsorption affinity on catalyst surface [10,11]. For instance, Cheng et al. demonstrated that rich oxygen vacancies could enhance the adsorption of *OCHO intermediates during CO2RR, resulting in an increased Faradaic efficiency (FE) of HCOOH (91.2%) compared to poor-Vo In2O3 (79.8%) [12]. However, electron traps originating from vacancy sites may be potentially occupied by *H in aqueous electrolytes, which may lead to partial suppression of charge transfer and impede the CO2RR activity [13–16]. Additional incorporation of heteroatom and construction of co-defects provide an avenue to redistribute the regional electron and further improve the charge transfer [17–19]. For example, Wang et al. found that Cu doping could effectively stabilize the adjacent oxygen vacancies in ZnO nanosheets, thus significantly weakening the *H adsorption and boosting the CO2RR performance [14]. The catalyst achieved the FE of CO exceeding 80% from −0.76 to −1.06 V, while maintaining stable current density and selectivity throughout a 10-hour electrolysis process. Zhang et al. simultaneously incorporated oxygen vacancy and nitrogen doping into the In2O3 nanosheets (Vo-N-InON nanosheets), in which the synergistic effect between vacancies and dopants promoted the activation of CO2 and decreased the reaction free energy of *OCHO formation [20]. Thus, Vo-N-InON nanosheets achieved a high HCOOH selectivity (95.1%) with a partial current density of 6.5 mA cm−2. Typically, a favorable CO2RR catalyst requires not only a robust binding strength for reactants, but also a weak energy barrier for product easily desorbing from the catalyst surface [21]. In CO2-to-CO process, a good catalyst surface should strongly bind with *COOH, but display a weak interaction with *CO for facile desorption of CO product [22,23]. Accordingly, regarding electrochemical CO2-to-HCOOH conversion process, apart from *OCHO intermediate, another important concern is the decent desorption energy of *HCOOH for the formation of final HCOOH. Therefore, proper selection of an appropriate dopant in conjunction with oxygen vacancy is expected to judiciously regulate the intermediates and thus improve the CO2RR performance. To date, transition metals (Zn, Ag, Pd, etc.) and p-block metals (In, Sn, Pb, Bi and their metal oxides, etc.) have turned out to be effective catalysts for CO2RR [24]. Among them, numerous studies have been dedicated to developing advanced In-based electrocatalysts, profiting from their environmental friendliness and minimal toxicity [25]. Particularly, In2O3 has garnered attentions due to its exceptional intrinsic activity for CO2RR and highly competitive overpotential of HER [11,26]. Furthermore, the diverse geometric and electronic structures of oxide impart inherent modifiability for performance enhancement. Hollow structures have been proven to effectively expose active sites, which is conducive to promoting CO2 adsorption and surface catalysis [27]. Meanwhile, vacancy engineering or heteroatom doping may also enable the regulation of charge distribution surrounding the active sites [28]. Considering the analogous properties of S and O atoms [29], incorporating S may reduce the electron accumulation reduced by Vo, which mitigates the trap states occupied by *H and suppresses HER. More importantly, due to the decent electronegativity and large atomic radius, S doping in synergy with O vacancy holds promise in regulating the electron distribution and optimizing the adsorption/desorption energy [30–32]. Herein, co-defective oxygen vacancy and sulfur doping (Ds) were concurrently introduced into hollow In2O3 nanotubes (Vo-S x -In2O3) by a facile solvothermal method. Sulfur doping in combination with oxygen vacancy effectively modulated the electronic structure surrounding the In sites, thus affording the robust adsorption and low reaction barrier for *OCHO intermediate. Additionally, the introduction of Ds facilitated *HCOOH desorption into the electrolyte to form HCOOH product. As a result, Vo-S x -In2O3 showed an enhanced CO2-to-HCOOH selectivity compared to Pure-In2O3 and Vo-In2O3. Especially, Vo-S53-In2O3 exhibited the FEHCOOH of 92.4% at −1.2 V vs. RHE in H-cell. In the flow cell test, Vo-S53-In2O3 achieved the FE of HCOOH exceeding 92% across a wide potential window (−0.4 ∼ −1.1 V) and a large current density of 119.1 mA cm−2 at −1.1 V. The assembled rechargeable Zn-CO2 battery delivered a high HCOOH selectivity and consistent charge and discharge cycles. 2 Experimental 2.1 Materials preparation The 0.4082 g of In(NO3)3·xH2O (99.9%) was dissolved in 5 mL N, N-dimethyl formamide (DMF, AR) with agitation for 0.5 h. Then, 0.2 g of 1,4-benzenedicarboxylic acid (H2BDC, 99%) was added into above solution for another 0.5 h of stirring. The mixture was transferred in a 25 mL Teflon-lined stainless-steel autoclave and heated to 100 °C for 24 h. The white product was centrifuged, washed with ethanol and water three times, and dried at 60 °C overnight. Then, the powder was calcinated at 500 °C for 2 h under air with a heating rate of 5 °C min−1. The residual light-yellow powders were named Pure-In2O3. The as-prepared Pure-In2O3 powders (0.055 g) were then added into 15 mL DMF containing x µmol thioacetamide (TAA, ≥ 98%) (x = 16, 53, 100 µmol). After vigorous stirring for 30 min, the mixture was transferred into a sealed autoclave and heated to 150 °C for 12 h. The product was collected by centrifugation, washed with ethanol three times and dried under vacuum at 60 °C overnight. These samples were labeled as Vo-S16-In2O3, Vo-S53-In2O3, and Vo-S100-In2O3 correspondingly. Vo-In2O3 was obtained using the same method excluding the addition of TAA. 2.2 Characterizations X-ray diffraction (XRD) patterns were acquired by a diffractometer (D8 ADVANCE) with Cu Kα radiation. Scanning electron microscope (SEM) images were captured on a field emission SEM (ZEISS SUPER®55). Transmission electron microscope (TEM), high-resolution TEM (HRTEM) and energy dispersive spectrometer (EDS) measurements were collected by Talos F200S with SUPER X. Raman spectroscopy was performed by Horiba LabRAM HR Evolution. X-ray photoelectron spectroscopy (XPS) was carried out by Thermo Scientific K-Alpha + . X-ray absorption near-edge structure (XANES) and extended X-ray absorption fine structure (EXAFS) of In K-edge were investigated using a synchrotron X-ray light source, in which In foil, In2O3 and In2S3 were employed as reference samples. Electron paramagnetic resonance (EPR) was performed on EMX-PLUS. 2.3 Electrochemical measurements Electrochemical performances for CO2RR were carried out on AUTOLAB workstation (AUT87107) with an airtight H-type electrolytic tank using 0.1 M KHCO3 as the electrolyte. CO2 flow rate was set at 30 sccm by the mass flow controller (Sevenstar, D07-7). Carbon paper coated by catalytic ink, Ag/AgCl electrode (saturated KCl) and Pt mesh were used as working electrode, reference electrode and counter electrode, respectively. For the preparation of working electrode, electrocatalyst powders (10 mg) were dispersed into 980 μL ethanol and 20 μL Nafion solution (5 wt%), followed by ultrasonication 30 min to form a homogeneous ink. Then, 100 μL ink was dropped evenly on a 1 cm2 glassy carbon paper and dried in a vacuum oven. Potentials were tested against the Ag/AgCl reference electrode and then converted to the reversible hydrogen electrode (RHE) scale according to the Eq. (1). (1) E vs . RHE = E vs . Ag / AgCl + 0.059 × pH + 0.197 V A cation exchange membrane (Nafion 117) was utilized to separate the cathodic and anodic compartment. A magnetic stirring device was placed under the cathode chamber at 450 r/min. The outlet-gas flow rate was verified by a soap-film flowmeter. Before testing, cathode electrolyte was inflated by CO2 (99.999%) for 0.5 h to achieve a CO2-saturated solution (pH ≈ 6.8). Then, the catalysts were activated through cyclic voltammogram (CV) with 100 mV s−1 from 0.4 to −1.4 V (vs. RHE) for 20 cycles to maintain the stability of following test. The scan rate for linear sweep voltammetry (LSV) was set as 10 mV s−1. Chronoamperometry test was conducted at each potential for 20 min. Double layer capacitance (Cdl) was analyzed through CV measurements between −0.05 to 0.05 V (vs. RHE) at different scanning rates (20 ∼ 120 mV s−1). Electrochemical impedance spectroscopy (EIS) was conducted at open circuit with frequency from 0.1 Hz to 105 Hz. Flow cell measurements were investigated by a self-designed reactor, in which cathode and anode chambers were separated by Nafion 117 and polytetrafluoroethylene (PTFE) gaskets were utilized as linking partitions to maintain air tightness. An electrolyte of 1 M KHCO3 and 1 M KOH was utilized, respectively. Catalysts loaded on gas diffusion electrode (GDE) (1 × 1 cm2 of effective area), Ag/AgCl electrode and Pt sheet were employed as working electrode, reference electrode and counter electrode, respectively. During the measurement, electrolyte was circulated utilizing the peristaltic pump (Chuxi-pump, CX100) with a flow rate of 15 mL min−1. The flow rate of inlet pure CO2 maintained at 40 sccm and outlet gas flow was measured with the soap-film flowmeter. 2.4 Product analysis Gas products were quantified by gas chromatography (GC-2014C, SHIMADZU), which was equipped with the thermal conductivity detector (TCD) and the flame ionization detector (FID) for online analysis. Argon was selected as carrier gas. Faradaic efficiency of gas product was calculated by the Eq. (2). (2) FE % = v vol % × V × N × F × p R × T × i total × 100 % where v vol % represents the volume concentration of gas detected by GC, V is the flow rate of gas injection, N is the number of electron transfers ( N H 2 , N co = 2 ), F , p , R and T are Faraday constant (96485 C mol−1), standard atmosphere (101.325 kPa), gas constant (8.314 J mol−1 K−1) and room temperature (298.15 K), respectively. i total is the total current at applied potential. 1H nuclear magnetic resonance (NMR, Bruker Avance NEO 400 MHz) was employed for quantitative measurement of liquid products. Faradaic efficiency of liquid product (HCOOH) was calculated by the Eq. (3). (3) FE % = N × F × c × V t × i total × 100 % where N , F, c , V and t represent the number of electron transfers ( N HCOOH = 2 ) , Faraday constant (96485 C mol−1), concentration of product, electrolyte volume and reaction time, respectively. i total is the total current at applied potential. 2.5 In-situ attenuated total reflection surface enhanced infrared absorption spectroscopy (ATR-SEIRAS) In-situ electrochemical ATR-SEIRAS measurement was conducted by a Thermo Nicolet 8700 spectrometer. The Si prism of chemical deposition Au film (∼60 nm) was uniformly coated with catalyst ink, which was employed as work electrode and assembled into a spectro electrochemical cell. Ag/AgCl electrode and Pt wire served as reference and counter electrode, respectively. The spectra were collected at −0.1 V intervals by varying the working electrode potential from −0.5 to −1.4 V vs. RHE in 0.1 M KHCO3 aqueous solution. 2.6 Density functional theory (DFT) calculation The first-principles DFT was performed by the projector augmented wave (PAW) method [33]. The exchange-functional was treated using the generalized gradient approximation (GGA) of Perdew-Burke-Emzerhof (PBE) [34] functional. Spin-polarizations were carried out for all calculations. The cutoff energy for the plane wave basis expansion was set to 450 eV. Convergence criterion of geometry relaxation was imposed with the force on each atom less than 0.05 eV/Å. K-points in the Brillouin zone were sampled by a 2 × 2 × 1 within Monkhorst Pack grid for structure optimization. The DFT-D3 method was introduced to consider the van der Waals interaction [35]. The self-consistent calculations apply a convergence energy threshold of 10−5 eV. A 15 Å vacuum was added along the z direction in order to avoid the interaction between periodic structures. The free energies of the CO2RR steps were calculated by the Eq. (4) [36]. (4) Δ G = Δ E DFT + Δ E ZPE - T Δ S where Δ E DFT is the DFT electronic energy difference of each step, Δ E ZPE and Δ S represent the correction of zero-point energy and the variation of entropy, which were obtained by vibration analysis, T is the temperature (T = 300 K). 2.7 Aqueous rechargeable Zn-CO2 electrochemical battery The aqueous rechargeable Zn-CO2 electrochemical battery was constructed with a double-electrolyte system separated by a bipolar membrane. 1 M KOH solution pumped with CO2 flow at a rate of 20 mL min−1 was employed as catholyte and a GDE loaded with 1 mg cm−2 catalysts was served as cathode. The 6 M KOH mixed with 0.2 M Zn(CH3COO)2 was used as anolyte and a polished Zn plate (2 × 5 cm2) was applied as the anode. All measurements were implemented on a CHI 660E electrochemical workstation. The current was controlled to be 5 mA in long-term galvanostatic discharge and charge tests. The Zn-CO2 battery was operated in ambient air conditions. 3 Results and discussion The synthetic pathway of Vo-S x -In2O3 (x represented the feeding amount of thioacetamide, µmol) was schematically illustrated in Fig. 1 . Briefly, MIL-68 (In) precursors were prepared and subsequently subjected to air calcination to yield Pure-In2O3 [37]. Then, Pure-In2O3 underwent the solvothermal treatment to obtain Vo-In2O3, which only contained oxygen vacancy. At the same time, accompanied with the addition of thioacetamide (TAA) as the sulfur source, the identical solvothermal method was employed to prepare Vo-S x -In2O3 with synchronous oxygen vacancy and sulfur doping. MIL-68 (In) revealed a typical hexagonal rod-like morphology (Fig. S1) and Pure-In2O3 featured a hollow nanotubular structure (Fig. 2 a and b). Vo-In2O3 maintained the hollow nanotubular morphology (Fig. 2c–f) and energy-dispersive X-ray spectroscopy (EDS) mapping substantiated a homogenous distribution of In and O elements (Fig. 2g). The obtained Vo-S16-In2O3, Vo-S53-In2O3 and Vo-S100-In2O3 still exhibited the hollow nanotubular structure (Fig. 2h–j and Fig. S2). Vo-S53-In2O3 was selected as a representative sample for detailed description. It was observed that Vo-S53-In2O3 nanotube consisted of nanoparticles with a diameter around 20 nm (Fig. 2k). The interplanar crystal spacing (0.29 nm) corresponded to the representative (222) crystal plane of In2O3 (Fig. 2l and m). EDS mapping confirmed the uniform dispersion of In, O and S elements throughout Vo-S53-In2O3 (Fig. 2n and Fig. S3). Raman spectroscopy of Pure-In2O3 revealed the absence of carbon characteristic peaks, which indicated no discernible carbon layer after synthesis (Fig. S4). XRD patterns revealed that Pure-In2O3, Vo-In2O3 and Vo-S x -In2O3 exhibited the diffraction peaks at 30.62°, 35.50°, 51.04° and 60.66°, which were consistent with (222), (400), (440) and (622) planes of In2O3 (JCPDS 06–0416), respectively (Fig. 3 a). Compared to Pure-In2O3, the (222) peak of Vo-In2O3 shifted slightly towards a higher diffraction angle due to that the presence of oxygen vacancies reduced the lattice spacing. After the incorporation of S doping, the (222) peak of Vo-S x -In2O3 shifted back to a lower angle, which was derived from the subtle In2O3 lattice expansion induced by S heteroatoms with larger atomic radius. The oxygen vacancy of the above samples was distinguished through electron paramagnetic resonance (EPR), which may provide finger printing information of unpaired electrons as the signal of Vo on both surface and bulk of the material (Fig. 3b) [38]. Pure-In2O3 showed no oxygen vacancy as evidenced by the absence of discernible signal peak. The emerging symmetrical signal of g = 2.003 confirmed the presence of Vo in Vo-In2O3 and Vo-S x -In2O3, whose intensity was associated with the concentration of oxygen vacancies [39,40]. Specifically, a small quantity of oxygen vacancies were observed in Vo-In2O3 as a result of lattice vibration at elevated temperature [41]. With the augmentation of TAA, the signal intensity increased from Vo-S16-In2O3 to Vo-S53-In2O3 and subsequently declined in Vo-S100-In2O3. This observation implied that partial reductive S species generated from TAA decomposition resulted in the removal of O atoms, whereas extra S atoms might substitute Vo and lead to a decrease in the concentration of Vo [20,42]. Moreover, as the feeding TAA content increased to 200 and 300 μmol, the crystalline structure of In2O3 was still observed in Vo-S200-In2O3 and Vo-S300-In2O3 instead of forming In2S3/In2O3 heterostructure (Fig. S5). X-ray photoelectron spectroscopy (XPS) was carried out to investigate the valence state of elements and electronic properties. In full survey spectra (Fig. 3c), it clearly indicated the coexistence of In and O elements in all In2O3-based samples while additional S peak in Vo-S x -In2O3. For O 1s spectra in Fig. 3(d) of Vo-In2O3 and Vo-S x -In2O3, the peaks located at 529.7 eV, 531.4 eV and 532.5 eV were assigned to lattice oxygen, vacancy oxygen and adsorbed oxygen, respectively [12]. Regarding Pure-In2O3, in addition of lattice oxygen and adsorbed oxygen, a small peak near 531.5 eV might be attributed to the C–O from trace amount of residual after MIL-68 calcination in air [43]. Notably, Vo-S53-In2O3 exhibited the highest Vo content, in line with the outcome from EPR results. With the increased supply of TAA, the generation of Vo and Ds weakened In–O bond and its electron richness, which consequently shifted the peak of lattice oxygen towards higher binding energy [44]. As depicted in Fig. 3(e), the deconvolution of S 2p XPS spectra unveiled distinct peaks corresponding to S 2p 3/2 (161.6 eV) and S 2p 1/2 (162.7 eV) [45,46]. With the increase of S content, more S atoms occupying the electron-rich Vo gave rise to the peaks of S 2p 3/2 and S 2p 1/2 shifting slightly towards lower binding energy. The incremental peak intensity and broadening of S 2p suggested that TAA led to a greater number of S atoms bonding with In atoms within the In2O3 lattice. For spin–orbit coupled doublet in In 3d spectra (Fig. 3f), two peaks at 444.6 eV and 452.1 eV belonged to In 3d 5/2 and In 3d 3/2, respectively [47]. Significantly, a slight negative shift was observed from Pure-In2O3, Vo-In2O3 to Vo-S16-In2O3 and Vo-S53-In2O3, suggesting that increasing Vo caused valence electrons clustering around In atoms [11]. Nevertheless, additional sulfur doping brought about a decrease in the content of Vo, which allowed partial electrons to redistribute towards the nonmetallic atoms from In and led to a positive shift from Vo-S53-In2O3 to Vo-S100-In2O3 [48]. X-ray absorption spectroscopy (XAS) was utilized for further exploration into the fine chemical surroundings. In the X-ray absorption near-edge structure (XANES) spectra (Fig. 4 a), the In K-edge position of Vo-In2O3 and Vo-S53-In2O3 was on a low-energy side of standard In2O3, which indicated a moderate oxidation state of In spanning from 0 to + 3 [49]. Compared to Vo-In2O3, a slight shift towards lower energy was observed for Vo-S53-In2O3, demonstrating the reduction in coordination number of In–O induced by more Vo (inset in Fig. 4a). More information of local atomic structure was inspected by Fourier-transform (FT) extended X-ray absorption fine structure (EXAFS). In Fig. 4(b), the peaks located at ca. 1.75 Å, 1.95 Å and 3.05 Å were ascribed to standard In–O, In–In and In–S bonds, respectively [50,51]. The lower intensity of In–O peak in Vo-In2O3 and Vo-S53-In2O3 than standard In2O3 verified the creation of oxygen vacancy [28]. Notably, the EXAFS spectra of Vo-S53-In2O3 did not exhibit In–S bond, indicating the absence of In2S3 in the crystalline structure. A minor yet strongest peak (2.21 Å and marked with red) with a bond length longer than In–O bond was visible in Vo-S53-In2O3. This observation was mainly derived from In–S scattering interactions in the first-shell coordination environment, which suggested the successful incorporation of S atoms into the In2O3 lattice [52,53]. The k3 -weighted FT-EXAFS fitting curve for In K-edge of Vo-S53-In2O3, Vo-In2O3 and standard In2O3 were displayed in Fig. 4(c and d) and Fig. S6. As seen, the inclusion of In–S path improved the fitting quality of Vo-S53-In2O3 and demonstrated the effective trapping of S atoms in Vo site to form In–S bonds. Contour plot of Wavelet transform (WT) of In K-edge EXAFS effectively visualized the distinct atomic environment (Fig. 4e–g). The intensity maximum at 5.85 Å−1 was assigned to In–O bond of Vo-S53-In2O3, which exhibited a lower value in comparison to standard In2O3 (6.21 Å−1) and Vo-In2O3 (6.13 Å−1). In–In bond (around 3 Å of the Y-axis) of these In2O3 samples gradually weakened, aligning with the consequences of R -spaces. All the aforementioned evidence collectively demonstrated that the local electronic structure and intimate electron interaction on In active sites were remarkably tuned after simultaneous incorporation of Vo and Ds. The above characterization analyses substantiated the material formation mechanism. Initially, defect-free Pure-In2O3 was synthesized by calcining MIL-68 at 500 °C in air. The following solvothermal treatment of Pure-In2O3 at elevated temperatures induced lattice vibration in In2O3, leading to a few amounts of oxygen vacancies in Vo-In2O3. The addition of TAA during solvothermal treatment generated reductive S species through TAA decomposition, which facilitated the removal of O atoms to create Vo. At the same time, partial S atoms replaced Vo to form In–S bonds. With the increasing feeding of TAA, the content of oxygen vacancies and sulfur doping enhanced simultaneously from Vo-S16-In2O3 to Vo-S53-In2O3. However, excessive addition of TAA content resulted in extra substitution of S atoms for Vo, which led to the increased Ds but reduced amount of Vo in Vo-S100-In2O3. The electrocatalytic CO2RR performances of as-prepared catalysts were first evaluated in a H-cell setup. In linear scanning voltammetry (LSV) measurement (Fig. 5 a), the current density of Pure-In2O3, Vo- In2O3, Vo-S x -In2O3 exhibited a pronounced increase in CO2-saturated electrolyte compared to Ar-saturated electrolyte, confirming certain CO2RR activity of all the In2O3-based catalysts. Vo-S53-In2O3 showed the highest current density when the potential was negative than −0.5 V (vs. RHE) among all studied samples, which indicated its optimal feasibility for CO2RR. Chronoamperometry test was recorded ranging from −0.8 to −1.4 V to evaluate the FE of products (Fig. S7). Liquid and gas products were analyzed by 1H nuclear magnetic resonance and online gas chromatography, respectively (Fig. S8). It was found that C1 (HCOOH and CO) was the main product accompanied by the side product H2. As illustrated in Fig. 5(b), Pure-In2O3 and Vo-In2O3 showcased mediocre FE of C1 products at all applied potentials. Upon further introducing S doping, CO2RR activity of Vo-S x -In2O3 was significantly improved. Notably, Vo-S53-In2O3 exhibited an outstanding FE of C1 above 90% from −1.0 to −1.4 V with a maximum of 95.5% at −1.2 V. Moreover, Vo-S53-In2O3 illustrated the lowest FE of H2 within all tested potentials and achieved a remarkable FE of the dominant HCOOH product up to 92.4% at −1.2 V (Fig. S9). Partial current density of HCOOH ( j HCOOH ), CO ( j CO ) and H2 ( j H 2 ) under different potentials were plotted in Fig. 5(c) and Fig. S10. The calculated j HCOOH at −1.4 V on Vo-S53-In2O3 was 3 and 2.2 times higher than Pure-In2O3 and Vo-In2O3, respectively. Additional experiments were performed to illustrate the underlying mechanism of intrinsic catalytic activity. Since OH− adsorbed on the catalyst surface could transfer electrons onto CO2 to form the adsorbed CO2 •−, the adsorption affinity of CO2 •− is directly proportional to OH−. Hence, OH− ions are generally employed as a surrogate to estimate the adsorption strength of active CO2 •− [54–56]. In Fig. 5(d), anodic polarization curve revealed that Vo-S53-In2O3 possessed a more negative potential, signifying an intensive binding affinity with OH−. This finding supported that the immobilized CO2 •− on Vo-S53-In2O3 had an optimized stability, which was conducive to CO2 activation. In Fig. S11 and Fig. 5(e), Vo-S53-In2O3 unveiled superior availability of active sites by attaining the highest double-layer capacitances (Cdl) of 0.83 mF cm−2. The ECSA-normalized current density of Vo-S53-In2O3 was observed to be the highest value, suggesting an enhancement of intrinsic activity by Ds and Vo (Fig. S12). The smallest charge-transfer resistance ( R ct ) of Vo-S53-In2O3 was observed in Nyquist diagrams (Fig. 5f), which suggested its low interfacial impedance and fast reaction kinetics. Obviously, the CO2RR performance of Vo-S x -In2O3 consistently outperformed Pure-In2O3 and Vo-In2O3. This enhancement may come from the cooperation of Ds and Vo intensifying the charge transfer and proton coupling adjacent to In-sites. As shown in Fig. S13, FEHCOOH first increased followed by a subsequent decline with the increase of sulfur content, indicating that there is a suitable ratio between Ds and Vo for promoting the CO2RR performance [57]. The mechanism will be discussed in the following parts. The stability of Vo-S53-In2O3 and Pure-In2O3 during continuous electrolysis was further investigated. As shown in Fig. S14(a), Vo-S53-In2O3 remained a stable current density at −1.2 V (vs. RHE) and FEHCOOH illustrated a marginal decrease of 3.9% during 21-hour electrolysis. In comparison, the selectivity for Pure-In2O3 noticeably reduced after 5 h (Fig. S14b). Additionally, there was no apparent change in the LSV and morphology of Vo-S53-In2O3 after electrolysis, indicating its remarkable stability (Fig. S15a and b). A small fraction of Vo-S53-In2O3 was reduced to metallic In after the prolonged operation (Fig. S15c), which was consistent with the previously reported works [58,59]. Limited diffusion of CO2 in an aqueous solution system invariably hampers mass transmission [60]. To this end, the CO2RR performance of Vo-S53-In2O3 was evaluated using a self-designed flow cell equipped with a gas diffusion electrode (GDE) to prompt reactions happening on the tri-phase interface (Fig. 5g and Fig. S16). The electrochemical test was firstly performed in flow cell with 1 M KHCO3 as the electrolyte (Fig. S17). It was observed that j H C O O H achieved 52.8 mA cm−2 at −1.1 V vs. RHE. An alkaline electrolyte can improve the reaction kinetics of CO2RR and suppress the competing HER in flow cell [61]. Thus, 1 M KOH was also employed as the electrolyte. Vo-S53-In2O3 delivered a remarkably large current density of 119.1 mA cm−2 at −1.1 V (vs. RHE) in 1 M KOH electrolyte (Fig. S18). As shown in Fig. 5(h), the j HCOOH of Vo-S53-In2O3 increased with the applied potential and reached a maximum value of 114.0 mA cm−2 at −1.1 V. Additionally, the FEHCOOH of Vo-S53-In2O3 kept above 92% at all applied potentials (−0.4 ∼ −1.1 V) and reached 94.5% at −0.6 V. When Vo-S53-In2O3 was operated in a flow cell with a high current density (∼50 mA cm−2) at −0.7 V, the FEHCOOH exhibited a slight decline and remained above 90% after 18 h (Fig. 5i). In comparison to the previously reported In- and Sn-based catalysts, Vo-S53-In2O3 demonstrated a superior CO2RR performance both in H-cell and flow cell (Fig. S19 and Table S1). In order to further elucidate the mechanism of CO2RR, in-situ ATR-SEIRAS was employed to detect the reaction intermediates and products (Fig. S20). The potential-dependent ATR-SEIRAS spectra of Vo-S53-In2O3 were collected within the range of 1150 and 2450 cm−1 in 0.1 M KHCO3. A couple of distinct infrared bands were observed in Fig. 6 (a and b). Two peaks at 1280 and 2340 cm−1 could be ascribed to adsorbed HCO3 − and CO2 consumption, respectively [62]. These peaks gradually intensified from −0.7 V to more negative potential applied, indicating a fast equilibrium between CO2 and HCO3 − [26]. Notably, the negative peak at 1400 cm−1 was attributed to C–O–C vibration in *OCHO species, whose intensities increased from −0.8 to −1.4 V [63]. This observation suggested a favorable protonation process for HCOOH formation. The peak at 1620 cm−1 corresponding to H2O remained almost unchanged. However, the peak strength of adsorbed HCO3 − and *OCHO simultaneously intensified from −0.8 to −1.4 V, suggesting that *OCHO intermediate was produced upon the consumption of adsorbed HCO3 − group as the possible proton donor [61,64]. Additionally, no obvious *COOH intermediates of CO product was detected, which was consistent with the experimental selectivity of Vo-S53-In2O3 towards HCOOH. Therefore, the conversion of CO2 to HCOOH was proposed to involve the following steps: (i) CO2 is activated and protonated to form *OCHO; (ii) *OCHO is further hydrogenated to form *HCOOH; (iii) *HCOOH detaches from the surface of catalyst (Fig. 6c). Density functional theory (DFT) calculations were further performed to explore the impact of oxygen vacancy and sulfur doping for reaction energetics of CO2RR. The models for Pure-In2O3, Vo-In2O3 and Vo-S-In2O3 were constructed in Fig. S21. Active sites on In2O3, Vo-In2O3 and Vo-S-In2O3 were designated as In, Vo–In and Vo–In–S, respectively. The adsorbed configurations of intermediates (*OCHO, *HCOOH) on interface structures were exhibited in Fig. S22. As illustrated in Fig. 6(d–f), the adsorption behavior of *OCHO in proximity to the active site was first elucidated by charge density difference. Pure-In2O3 indicated a lack of discernible electron transfer between *OCHO and active center sites [65]. Nonetheless, *OCHO upon Vo–In site and Vo–In–S site showcased significant electronic interaction, proving activity for adsorbing the intermediate [66]. Quantitatively, profiting from the S doping, *OCHO is capable of obtaining more electrons (0.695 |e|) in comparison to that of Pure-In2O3 (0.467 |e|) and Vo-In2O3 (0.685 |e|). As a consequence, the electronic structure of Vo-S-In2O3 was optimized to facilitate adsorbing *OCHO. To investigate the profound electronic properties on the catalyst’s surface, the projected density of states (PDOS) was employed (Fig. 6g). Compared to Pure-In2O3, new defect levels emerged at the Fermi level (Ef) originating from In 5p and O 2p orbitals in Vo-In2O3 [67]. S 3p orbitals exhibited an extra defect level near Ef and a more pronounced accumulation of charges was observed around valence band (VB) of Vo-S-In2O3 (Fig. 6g). These evidences substantiated Vo-S-In2O3 as the most competitive catalyst for transferring localized electrons around VB into antibonding orbitals of CO2, which facilitated charge interactions between active sites and intermediates [68,69]. In Fig. S23, the total density of states (TDOS) on Vo-S-In2O3 showed a narrower band gap energy (0.39 eV) than Pure-In2O3 (0.68 eV). It indicated an abundance of electrons in the vicinity of E f, which was conducive to optimizing the affinity of the adsorbate and reducing the reactive energy barrier [16]. The Gibbs free energy was calculated to compare the energetics of reaction on different sites (Fig. 6h). At the first step, Pure-In2O3 encountered a high barrier, whereas Vo-In2O3 and Vo-S-In2O3 exhibited a favorable downhill. This Vo-induced conversion of endothermic reaction into exothermic process promoted the generation of *OCHO. The free-energy change (△G) in the subsequent hydrogenation from *OCHO to *HCOOH on Vo-S-In2O3 (0.504 eV) was lower than that on Vo-In2O3 (0.633 eV), proving that the incorporation of Ds facilitated the formation of *HCOOH. Typically, the reaction kinetics for CO2-to-HCOOH necessitated a proper *OCHO adsorption and *HCOOH desorption. As shown in Fig. 6(i), decent adsorption of *OCHO at Vo–In site (−1.232 eV) and Vo–In–S site (−0.992 eV) demonstrated their superior activity for *OCHO formation compared to In site (1.850 eV). Meanwhile, *HCOOH onto Vo-S-In2O3 possessed more modest adsorption (−0.387 eV) than Vo-In2O3 (−0.499 eV), which avoided the severe aggregation of *HCOOH at the active sites and prompted the subsequent desorption for HCOOH formation. Conversely, the largest energy barrier for *H on Vo-S-In2O3 mightily obstructed *H occupied at the active surface and impeded HER (Fig. S24). Furthermore, the introduction of additional sulfur doping within In2O3 lattice was modeled and denoted as Vo-S2-In2O3. Excessive sulfur doping led to enhanced proton generation and decrease in the free energy of *H to intensify the competing HER, which was consistent with our experimental observation. Altogether, Vo in synergy with Ds effectively optimized the local electronic structure on the interface of Vo-S-In2O3, thereby preserving the strong activation ability of reactants while endowing the desirable product desorption performance. Fig. S25 revealed that Vo-S53-In2O3 exhibited feasible oxygen evolution reduction (OER) performance, which obtained an overpotential of 349 mV at a current density of 10 mA cm−2 and kept continuous electrolysis for 18 h. Considering the exceptional CO2RR and OER performance of Vo-S53-In2O3, an aqueous Zn-CO2 electrochemical battery was assembled to evaluate the extended application potential of CO2RR (Fig. 7 a and Fig. S26). The anode electrolyte consisted of a solution of 6 M KOH and 0.2 M Zn(CH3COO)2, while the cathode electrolyte comprised a 1 M KOH solution [4,70]. The bipolar membrane effectively stabilized the different pH values of cathode and anode fluids, enabling integration of charging and discharging processes within a single device [71]. The Zn-CO2 battery powered by Vo-S53-In2O3 exhibited an open-circuit voltage of 1.369 V for 90 min (Fig. S27). The discharge and charge polarization curves illustrated an increasing difference between polarization voltages with higher current densities and suggested the practical feasibility of rechargeable Zn-CO2 electrochemical battery (Fig. 7b) [72]. Fig. 7(c) presented the discharge polarization and power density of Vo-S53-In2O3, which demonstrated a high-power density of 2.29 mW cm−2 at a current density of 4.2 mA cm−2. Stable voltage plateaus for a duration of 30 min were measured under various discharge current densities (Fig. 7d). It was observed that the FEHCOOH of Vo-S53-In2O3 achieved 95.6% at 7 mA cm−2 (around 0.3 V), suggesting dominance of CO2-to-HCOOH conversion during discharge in Zn-CO2 battery. Furthermore, the galvanostatic charge–discharge curves of Vo-S53-In2O3 at 5 mA cm−2 indicated a stable voltage gap within 27 h (80 cycles), which proved the high durability of the battery (Fig. 7e). Compared with other reported catalysts (Table S2), Vo-S53-In2O3 exhibited favorable product selectivity, power density and rechargeability in reversible Zn-CO2 batteries. 4 Conclusions To conclude, a hollow Vo-S x -In2O3 nanotube with simultaneous oxygen vacancy and sulfur doping was fabricated through a facile solvothermal treatment on Pure-In2O3. The cooperative sites of oxygen vacancy and sulfur doping facilitated the electron transfer and reduced the reaction barrier to accelerate *OCHO formation. Meanwhile, the incorporation of sulfur weakened the adsorption of *HCOOH blocked on catalytic sites. Acting in the manner of altered local electronic structure originating from Vo–In–S site, Vo-S53-In2O3 demonstrated the highest FEHCOOH (92.4%) at −1.2 V, surpassing defect-free Pure-In2O3 (60.8%) and oxygen vacancy-containing Vo-In2O3 (64.2%). Meanwhile, Vo-S53-In2O3 afforded a large current density (119.1 mA cm−2) at −1.1 V and an impressive FEHCOOH (over 92%) over a wide window potential in the flow cell. Furthermore, the assembled Zn-CO2 battery based on Vo-S53-In2O3 exhibited a maximum power density of 2.29 mW cm−2 and an effective rechargeability. This study may furnish novel insights into the mechanism of co-defective vacancy and doping on the modulation of CO2RR performance and their potential application in energy conversion device. CRediT authorship contribution statement Yu Li: Writing – original draft, Methodology, Investigation, Conceptualization. Zhengrong Xu: Writing – review & editing. Quanxin Guo: Writing – review & editing. Qin Li: Methodology. Rui Liu: Writing – review & editing, Supervision, Funding acquisition. Declaration of competing interest The authors declare that they have no known competing financial interests or personal relationships that could have appeared to influence the work reported in this paper. Acknowledgments This work was supported by the Fundamental Research Funds for the Central Universities (22120230104). Appendix A Supplementary material Supplementary data to this article can be found online at https://doi.org/10.1016/j.jechem.2024.09.057. Appendix A Supplementary material The following are the Supplementary data to this article: Supplementary Data 1 References [1] X. Liu J. Xiao H. Peng X. Hong K. Chan J.K. Nørskov Nat. Commun. 8 2017 15438 X. Liu, J. Xiao, H. Peng, X. Hong, K. Chan, J.K. Nørskov, Nat. Commun. 8 (2017) 15438. [2] D. Gao R.M. Arán-Ais H.S. Jeon B. Roldan Cuenya Nat. Catal. 2 2019 198 210 D. Gao, R.M. Arán-Ais, H.S. Jeon, B. Roldan Cuenya, Nat. Catal. 2 (2019) 198–210. [3] J. Xie X. Wang J. Lv Y. Huang M. Wu Y. Wang J. Yao Angew. Chem., Int. Ed. 57 2018 16996 17001 J. Xie, X. Wang, J. Lv, Y. Huang, M. Wu, Y. Wang, J. Yao, Angew. Chem., Int. Ed. 57 (2018) 16996–17001. [4] R. Yang J. Xie Q. Liu Y. Huang J. Lv M.A. Ghausi X. Wang Z. Peng M. Wu Y. Wang J. Mater. Chem. A 7 2019 2575 2580 R. Yang, J. Xie, Q. Liu, Y. Huang, J. Lv, M.A. Ghausi, X. Wang, Z. Peng, M. Wu, Y. Wang, J. Mater. Chem. A 7 (2019) 2575–2580. [5] Y. Wang P. Han X. Lv L. Zhang G. Zheng Joule 2 2018 2551 2582 Y. Wang, P. Han, X. Lv, L. Zhang, G. Zheng, Joule 2 (2018) 2551–2582. [6] P. Saha S. Amanullah A. Dey Acc. Chem. Res. 55 2022 134 144 P. Saha, S. Amanullah, A. Dey, Acc. Chem. Res. 55 (2022) 134–144. [7] Y.Y. Birdja E. Pérez-Gallent M.C. Figueiredo A.J. Göttle F. Calle-Vallejo M.T.M. Koper Nat. Energy 4 2019 732 745 Y.Y. Birdja, E. Pérez-Gallent, M.C. Figueiredo, A.J. Göttle, F. Calle-Vallejo, M.T.M. Koper, Nat. Energy 4 (2019) 732–745. [8] A. Wagner C.D. Sahm E. Reisner Nat. Catal. 3 2020 775 786 A. Wagner, C.D. Sahm, E. Reisner, Nat. Catal. 3 (2020) 775–786. [9] Z. Wu Y. Zhao W. Jin B. Jia J. Wang T. Ma Adv. Funct. Mater. 31 2020 2009070 Z. Wu, Y. Zhao, W. Jin, B. Jia, J. Wang, T. Ma, Adv. Funct. Mater. 31 (2020) 2009070. [10] Z. Yang H. Wang X. Bi X. Tan Y. Zhao W. Wang Y. Zou H. Wang H. Ning M. Wu Energy Environ. Sci. 7 2023 e12508 Z. Yang, H. Wang, X. Bi, X. Tan, Y. Zhao, W. Wang, Y. Zou, H. Wang, H. Ning, M. Wu, Energy Environ. Sci. 7 (2023) e12508. [11] J. Zhang R. Yin Q. Shao T. Zhu X. Huang Angew. Chem., Int. Ed. 58 2019 5609 5613 J. Zhang, R. Yin, Q. Shao, T. Zhu, X. Huang, Angew. Chem., Int. Ed. 58 (2019) 5609–5613. [12] Q. Cheng M. Huang L. Xiao S. Mou X. Zhao Y. Xie G. Jiang X. Jiang F. Dong ACS Catal. 13 2023 4021 4029 Q. Cheng, M. Huang, L. Xiao, S. Mou, X. Zhao, Y. Xie, G. Jiang, X. Jiang, F. Dong, ACS Catal. 13 (2023) 4021–4029. [13] J. Dai Y. Zhu H.A. Tahini Q. Lin Y. Chen D. Guan C. Zhou Z. Hu H.J. Lin T.S. Chan C.T. Chen S.C. Smith H. Wang W. Zhou Z. Shao Nat. Commun. 11 2020 5657 J. Dai, Y. Zhu, H.A. Tahini, Q. Lin, Y. Chen, D. Guan, C. Zhou, Z. Hu, H.J. Lin, T.S. Chan, C.T. Chen, S.C. Smith, H. Wang, W. Zhou, Z. Shao, Nat. Commun. 11 (2020) 5657. [14] K. Wang D. Liu L. Liu J. Liu X. Hu P. Li M. Li A.S. Vasenko C. Xiao S. Ding eScience 2 2022 518 528 K. Wang, D. Liu, L. Liu, J. Liu, X. Hu, P. Li, M. Li, A.S. Vasenko, C. Xiao, S. Ding, eScience 2 (2022) 518–528. [15] T.S. Bui E.C. Lovell R. Daiyan R. Amal Adv. Mater. 35 2023 e2205814 T.S. Bui, E.C. Lovell, R. Daiyan, R. Amal, Adv. Mater. 35 (2023) e2205814. [16] H. Han S. Jin S. Park Y. Kim D. Jang M.H. Seo W.B. Kim Nano Energy 79 2021 105492 H. Han, S. Jin, S. Park, Y. Kim, D. Jang, M.H. Seo, W.B. Kim, Nano Energy 79 (2021) 105492. [17] Y. Ma J. Wang J. Yu J. Zhou X. Zhou H. Li Z. He H. Long Y. Wang P. Lu J. Yin H. Sun Z. Zhang Z. Fan Matter 4 2021 888 926 Y. Ma, J. Wang, J. Yu, J. Zhou, X. Zhou, H. Li, Z. He, H. Long, Y. Wang, P. Lu, J. Yin, H. Sun, Z. Zhang, Z. Fan, Matter 4 (2021) 888–926. [18] J. Feng L. Wu S. Liu L. Xu X. Song L. Zhang Q. Zhu X. Kang X. Sun B. Han J. Am. Chem. Soc. 145 2023 9857 9866 J. Feng, L. Wu, S. Liu, L. Xu, X. Song, L. Zhang, Q. Zhu, X. Kang, X. Sun, B. Han, J. Am. Chem. Soc. 145 (2023) 9857–9866. [19] P. Li J. Bi J. Liu Q. Zhu C. Chen X. Sun J. Zhang B. Han Nat. Commun. 13 2022 1965 P. Li, J. Bi, J. Liu, Q. Zhu, C. Chen, X. Sun, J. Zhang, B. Han, Nat. Commun. 13 (2022) 1965. [20] B. Zhang Y. Chang Y. Wu Z. Fan P. Zhai C. Wang J. Gao L. Sun J. Hou Adv. Energy Mater. 12 2022 2200321 B. Zhang, Y. Chang, Y. Wu, Z. Fan, P. Zhai, C. Wang, J. Gao, L. Sun, J. Hou, Adv. Energy Mater. 12 (2022) 2200321. [21] R. Daiyan W.H. Saputera H. Masood J. Leverett X. Lu R. Amal Adv. Energy Mater. 10 2020 1902106 R. Daiyan, W.H. Saputera, H. Masood, J. Leverett, X. Lu, R. Amal, Adv. Energy Mater. 10 (2020) 1902106. [22] H.K. Lim H. Shin W.A. Goddard 3rd Y.J. Hwang B.K. Min H. Kim J. Am. Chem. Soc. 136 2014 11355 11361 H.K. Lim, H. Shin, W.A. Goddard, 3rd, Y.J. Hwang, B.K. Min, H. Kim, J. Am. Chem. Soc. 136 (2014) 11355–11361. [23] H. Shin Y. Ha H. Kim J. Phys. Chem. Lett. 7 2016 4124 4129 H. Shin, Y. Ha, H. Kim, J. Phys. Chem. Lett. 7 (2016) 4124–4129. [24] C. Kim F. Dionigi V. Beermann X. Wang T. Moller P. Strasser Adv. Mater. 31 2019 e1805617 C. Kim, F. Dionigi, V. Beermann, X. Wang, T. Moller, P. Strasser, Adv. Mater. 31 (2019) e1805617. [25] W. Wu Y. Tong P. Chen Small 20 2024 e2305562 W. Wu, Y. Tong, P. Chen, Small 20 (2024) e2305562. [26] B. Wulan X. Cao D. Tan J. Ma J. Zhang Adv. Funct. Mater. 33 2022 2209114 B. Wulan, X. Cao, D. Tan, J. Ma, J. Zhang, Adv. Funct. Mater. 33 (2022) 2209114. [27] S. Wang B.Y. Guan X.W.D. Lou J. Am. Chem. Soc. 140 2018 5037 5040 S. Wang, B.Y. Guan, X.W.D. Lou, J. Am. Chem. Soc. 140 (2018) 5037–5040. [28] L. Zhuang Y. Jia H. Liu Z. Li M. Li L. Zhang X. Wang D. Yang Z. Zhu X. Yao Angew. Chem., Int. Ed. 59 2020 14664 14670 L. Zhuang, Y. Jia, H. Liu, Z. Li, M. Li, L. Zhang, X. Wang, D. Yang, Z. Zhu, X. Yao, Angew. Chem., Int. Ed. 59 (2020) 14664–14670. [29] T. Shinagawa G.O. Larrazábal A.J. Martín F. Krumeich J. Pérez-Ramírez ACS Catal. 8 2018 837 844 T. Shinagawa, G.O. Larrazábal, A.J. Martín, F. Krumeich, J. Pérez-Ramírez, ACS Catal. 8 (2018) 837–844. [30] L. Lv R. Lu J. Zhu R. Yu W. Zhang E. Cui X. Chen Y. Dai L. Cui J. Li L. Zhou W. Chen Z. Wang L. Mai Angew. Chem. Int. Ed. 62 2023 e202303117 L. Lv, R. Lu, J. Zhu, R. Yu, W. Zhang, E. Cui, X. Chen, Y. Dai, L. Cui, J. Li, L. Zhou, W. Chen, Z. Wang, L. Mai, Angew. Chem. Int. Ed. 62 (2023) e202303117. [31] C. Jia X. Tan Y. Zhao W. Ren Y. Li Z. Su S.C. Smith C. Zhao Angew. Chem. Int. Ed. 60 2021 23342 23348 C. Jia, X. Tan, Y. Zhao, W. Ren, Y. Li, Z. Su, S.C. Smith, C. Zhao, Angew. Chem. Int. Ed. 60 (2021) 23342–23348. [32] X. Sun L. Wang X. Lan Q. Lu Y. Tuo C. Ye D. Wang C. Xu Appl. Catal. B 342 2024 123389 X. Sun, L. Wang, X. Lan, Q. Lu, Y. Tuo, C. Ye, D. Wang, C. Xu, Appl. Catal. B 342 (2024) 123389. [33] P.E. Blochl Phys. Rev. B 50 1994 17953 17979 P.E. Blochl, Phys. Rev. B 50 (1994) 17953–17979. [34] J.P. Perdew J.A. Chevary S.H. Vosko K.A. Jackson M.R. Pederson D.J. Singh C. Fiolhais Phys. Rev. B 46 1992 6671 6687 J.P. Perdew, J.A. Chevary, S.H. Vosko, K.A. Jackson, M.R. Pederson, D.J. Singh, C. Fiolhais, Phys. Rev. B 46 (1992) 6671–6687. [35] S. Grimme J. Antony S. Ehrlich H. Krieg J. Chem. Phys. 132 2010 154104 S. Grimme, J. Antony, S. Ehrlich, H. Krieg, J. Chem. Phys. 132 (2010) 154104. [36] E. Skulason T. Bligaard S. Gudmundsdottir F. Studt J. Rossmeisl F. Abild-Pedersen T. Vegge H. Jonsson J.K. Norskov Phys. Chem. Chem. Phys. 14 2012 1235 1245 E. Skulason, T. Bligaard, S. Gudmundsdottir, F. Studt, J. Rossmeisl, F. Abild-Pedersen, T. Vegge, H. Jonsson, J.K. Norskov, Phys. Chem. Chem. Phys. 14 (2012) 1235–1245. [37] Z. Cai J. Dai W. Li K.B. Tan Z. Huang G. Zhan J. Huang Q. Li ACS Catal. 10 2020 13275 13289 Z. Cai, J. Dai, W. Li, K.B. Tan, Z. Huang, G. Zhan, J. Huang, Q. Li, ACS Catal. 10 (2020) 13275–13289. [38] Z. Wei W. Wang W. Li X. Bai J. Zhao E.C.M. Tse D.L. Phillips Y. Zhu Angew. Chem. Int. Ed. 60 2021 8236 8242 Z. Wei, W. Wang, W. Li, X. Bai, J. Zhao, E.C.M. Tse, D.L. Phillips, Y. Zhu, Angew. Chem. Int. Ed. 60 (2021) 8236–8242. [39] S. Zhao D. Kang Y. Liu Y. Wen X. Xie H. Yi X. Tang ACS Catal. 10 2020 11739 11750 S. Zhao, D. Kang, Y. Liu, Y. Wen, X. Xie, H. Yi, X. Tang, ACS Catal. 10 (2020) 11739–11750. [40] S. Mo Q. Zhang J. Li Y. Sun Q. Ren S. Zou Q. Zhang J. Lu M. Fu D. Mo J. Wu H. Huang D. Ye Appl. Catal. B 264 2020 118464 S. Mo, Q. Zhang, J. Li, Y. Sun, Q. Ren, S. Zou, Q. Zhang, J. Lu, M. Fu, D. Mo, J. Wu, H. Huang, D. Ye, Appl. Catal. B 264 (2020) 118464. [41] H. Zhang L. Wu R. Feng S. Wang C.S. Hsu Y. Ni A. Ahmad C. Zhang H. Wu H.M. Chen W. Zhang Y. Li P. Liu F. Song ACS Catal. 13 2023 6000 6012 H. Zhang, L. Wu, R. Feng, S. Wang, C.S. Hsu, Y. Ni, A. Ahmad, C. Zhang, H. Wu, H.M. Chen, W. Zhang, Y. Li, P. Liu, F. Song, ACS Catal. 13 (2023) 6000–6012. [42] Y. Zheng K. Fu Z. Yu Y. Su R. Han Q. Liu J. Mater. Chem. A 10 2022 14171 14186 Y. Zheng, K. Fu, Z. Yu, Y. Su, R. Han, Q. Liu, J. Mater. Chem. A 10 (2022) 14171–14186. [43] C. Zhu A. Osherov M.J. Panzer Electrochim. Acta 111 2013 771 778 C. Zhu, A. Osherov, M.J. Panzer, Electrochim. Acta 111 (2013) 771–778. [44] W. Wei Z. Wei R. Li Z. Li R. Shi S. Ouyang Y. Qi D.L. Philips H. Yuan Nat. Commun. 13 2022 3199 W. Wei, Z. Wei, R. Li, Z. Li, R. Shi, S. Ouyang, Y. Qi, D.L. Philips, H. Yuan, Nat. Commun. 13 (2022) 3199. [45] L.P. Chi Z.Z. Niu X.L. Zhang P.P. Yang J. Liao F.Y. Gao Z.Z. Wu K.B. Tang M.R. Gao Nat. Commun. 12 2021 5835 L.P. Chi, Z.Z. Niu, X.L. Zhang, P.P. Yang, J. Liao, F.Y. Gao, Z.Z. Wu, K.B. Tang, M.R. Gao, Nat. Commun. 12 (2021) 5835. [46] S. Liang J. Xiao T. Zhang Y. Zheng Q. Wang B. Liu Angew. Chem. Int. Ed. 62 2023 e202310740 S. Liang, J. Xiao, T. Zhang, Y. Zheng, Q. Wang, B. Liu, Angew. Chem. Int. Ed. 62 (2023) e202310740. [47] C. Lv C. Lee L. Zhong H. Liu J. Liu L. Yang C. Yan W. Yu H.H. Hng Z. Qi L. Song S. Li K.P. Loh Q. Yan G. Yu ACS Nano 16 2022 8213 8222 C. Lv, C. Lee, L. Zhong, H. Liu, J. Liu, L. Yang, C. Yan, W. Yu, H.H. Hng, Z. Qi, L. Song, S. Li, K.P. Loh, Q. Yan, G. Yu, ACS Nano 16 (2022) 8213–8222. [48] K. Chen T. Jiang T. Liu J. Yu S. Zhou A. Ali S. Wang Y. Liu L. Zhu X. Xu Adv. Funct. Mater. 32 2021 2109336 K. Chen, T. Jiang, T. Liu, J. Yu, S. Zhou, A. Ali, S. Wang, Y. Liu, L. Zhu, X. Xu, Adv. Funct. Mater. 32 (2021) 2109336. [49] Y. Qi L. Song S. Ouyang X. Liang S. Ning Q. Zhang J. Ye Adv. Mater. 32 2020 e1903915 Y. Qi, L. Song, S. Ouyang, X. Liang, S. Ning, Q. Zhang, J. Ye, Adv. Mater. 32 (2020) e1903915. [50] H. Shang T. Wang J. Pei Z. Jiang D. Zhou Y. Wang H. Li J. Dong Z. Zhuang W. Chen D. Wang J. Zhang Y. Li Angew. Chem. Int. Ed. 59 2020 22465 22469 H. Shang, T. Wang, J. Pei, Z. Jiang, D. Zhou, Y. Wang, H. Li, J. Dong, Z. Zhuang, W. Chen, D. Wang, J. Zhang, Y. Li, Angew. Chem. Int. Ed. 59 (2020) 22465–22469. [51] K. Yan D. Wu T. Wang C. Chen S. Liu Y. Hu C. Gao H. Chen B. Li ACS Catal. 13 2023 2302 2312 K. Yan, D. Wu, T. Wang, C. Chen, S. Liu, Y. Hu, C. Gao, H. Chen, B. Li, ACS Catal. 13 (2023) 2302–2312. [52] P. Lu X. Tan H. Zhao Q. Xiang K. Liu X. Zhao X. Yin X. Li X. Hai S. Xi A.T.S. Wee S.J. Pennycook X. Yu M. Yuan J. Wu G. Zhang S.C. Smith Z. Yin ACS Nano 15 2021 5671 5678 P. Lu, X. Tan, H. Zhao, Q. Xiang, K. Liu, X. Zhao, X. Yin, X. Li, X. Hai, S. Xi, A.T.S. Wee, S.J. Pennycook, X. Yu, M. Yuan, J. Wu, G. Zhang, S.C. Smith, Z. Yin, ACS Nano 15 (2021) 5671–5678. [53] H.B. Yang S.F. Hung S. Liu K. Yuan S. Miao L. Zhang X. Huang H.Y. Wang W. Cai R. Chen J. Gao X. Yang W. Chen Y. Huang H.M. Chen C.M. Li T. Zhang B. Liu Nat. Energy 3 2018 140 147 H.B. Yang, S.F. Hung, S. Liu, K. Yuan, S. Miao, L. Zhang, X. Huang, H.Y. Wang, W. Cai, R. Chen, J. Gao, X. Yang, W. Chen, Y. Huang, H.M. Chen, C.M. Li, T. Zhang, B. Liu, Nat. Energy 3 (2018) 140–147. [54] S. Gorthy S. Verma N. Sinha S. Shetty H. Nguyen M. Neurock ACS Catal. 13 2023 12924 12940 S. Gorthy, S. Verma, N. Sinha, S. Shetty, H. Nguyen, M. Neurock, ACS Catal. 13 (2023) 12924–12940. [55] S. Zhang P. Kang T.J. Meyer J. Am. Chem. Soc. 136 2014 1734 1737 S. Zhang, P. Kang, T.J. Meyer, J. Am. Chem. Soc. 136 (2014) 1734–1737. [56] A. Salehi-Khojin H.R.M. Jhong B.A. Rosen W. Zhu S. Ma P.J.A. Kenis R.I. Masel J. Phys. Chem. C 117 2013 1627 1632 A. Salehi-Khojin, H.R.M. Jhong, B.A. Rosen, W. Zhu, S. Ma, P.J.A. Kenis, R.I. Masel, J. Phys. Chem. C 117 (2013) 1627–1632. [57] W. Ma S. Xie X.G. Zhang F. Sun J. Kang Z. Jiang Q. Zhang D.Y. Wu Y. Wang Nat. Commun. 10 2019 892 W. Ma, S. Xie, X.G. Zhang, F. Sun, J. Kang, Z. Jiang, Q. Zhang, D.Y. Wu, Y. Wang, Nat. Commun. 10 (2019) 892. [58] Z. Wang Y. Zhou D. Liu R. Qi C. Xia M. Li B. You B.Y. Xia Angew. Chem. Int. Ed. 61 2022 e202200552 Z. Wang, Y. Zhou, D. Liu, R. Qi, C. Xia, M. Li, B. You, B.Y. Xia, Angew. Chem. Int. Ed. 61 (2022) e202200552. [59] S. Wang Q. Gao C. Xu S. Jiang M. Zhang X. Yin H.Q. Peng B. Liu Y.F. Song Nano Res. 17 2023 1242 1250 S. Wang, Q. Gao, C. Xu, S. Jiang, M. Zhang, X. Yin, H.Q. Peng, B. Liu, Y.F. Song, Nano Res. 17 (2023) 1242–1250. [60] W. Ma X. He W. Wang S. Xie Q. Zhang Y. Wang Chem. Soc. Rev. 50 2021 12897 12914 W. Ma, X. He, W. Wang, S. Xie, Q. Zhang, Y. Wang, Chem. Soc. Rev. 50 (2021) 12897–12914. [61] W. Lai Y. Qiao J. Zhang Z. Lin H. Huang Energy Environ. Sci. 15 2022 3603 3629 W. Lai, Y. Qiao, J. Zhang, Z. Lin, H. Huang, Energy Environ. Sci. 15 (2022) 3603–3629. [62] S. Zhu B. Jiang W.B. Cai M. Shao J. Am. Chem. Soc. 139 2017 15664 15667 S. Zhu, B. Jiang, W.B. Cai, M. Shao, J. Am. Chem. Soc. 139 (2017) 15664–15667. [63] B. Jia Z. Chen C. Li Z. Li X. Zhou T. Wang W. Yang L. Sun B. Zhang J. Am. Chem. Soc. 145 2023 14101 14111 B. Jia, Z. Chen, C. Li, Z. Li, X. Zhou, T. Wang, W. Yang, L. Sun, B. Zhang, J. Am. Chem. Soc. 145 (2023) 14101–14111. [64] C. Cao D.D. Ma J.F. Gu X. Xie G. Zeng X. Li S.G. Han Q.L. Zhu X.T. Wu Q. Xu Angew. Chem. Int. Ed. 59 2020 15014 15020 C. Cao, D.D. Ma, J.F. Gu, X. Xie, G. Zeng, X. Li, S.G. Han, Q.L. Zhu, X.T. Wu, Q. Xu, Angew. Chem. Int. Ed. 59 (2020) 15014–15020. [65] Y. Li W. Shan M.J. Zachman M. Wang S. Hwang H. Tabassum J. Yang X. Yang S. Karakalos Z. Feng G. Wang G. Wu Angew. Chem. Int. Ed. 61 2022 e202205632 Y. Li, W. Shan, M.J. Zachman, M. Wang, S. Hwang, H. Tabassum, J. Yang, X. Yang, S. Karakalos, Z. Feng, G. Wang, G. Wu, Angew. Chem. Int. Ed. 61 (2022) e202205632. [66] T. Wang J. Chen X. Ren J. Zhang J. Ding Y. Liu K.H. Lim J. Wang X. Li H. Yang Y. Huang S. Kawi B. Liu Angew. Chem. Int. Ed. 62 2023 e202211174 T. Wang, J. Chen, X. Ren, J. Zhang, J. Ding, Y. Liu, K.H. Lim, J. Wang, X. Li, H. Yang, Y. Huang, S. Kawi, B. Liu, Angew. Chem. Int. Ed. 62 (2023) e202211174. [67] W. Guo S. Liu X. Tan R. Wu X. Yan C. Chen Q. Zhu L. Zheng J. Ma J. Zhang Y. Huang X. Sun B. Han Angew. Chem. Int. Ed. 60 2021 1987 21979 21987 W. Guo, S. Liu, X. Tan, R. Wu, X. Yan, C. Chen, Q. Zhu, L. Zheng, J. Ma, J. Zhang, Y. Huang, X. Sun, B. Han, Angew. Chem. Int. Ed. 60 (2021) 21979–21987. [68] Z. Geng X. Kong W. Chen H. Su Y. Liu F. Cai G. Wang J. Zeng Angew. Chem. Int. Ed. 57 2018 6054 6059 Z. Geng, X. Kong, W. Chen, H. Su, Y. Liu, F. Cai, G. Wang, J. Zeng, Angew. Chem. Int. Ed. 57 (2018) 6054–6059. [69] N. Han Y. Wang H. Yang J. Deng J. Wu Y. Li Y. Li Nat. Commun. 9 2018 1320 N. Han, Y. Wang, H. Yang, J. Deng, J. Wu, Y. Li, Y. Li, Nat. Commun. 9 (2018) 1320. [70] W. Zheng D. Wang Y. Zhang S. Zheng B. Yang Z. Li R.D. Rodriguez T. Zhang L. Lei S. Yao Y. Hou Nano Energy 105 2023 107980 W. Zheng, D. Wang, Y. Zhang, S. Zheng, B. Yang, Z. Li, R.D. Rodriguez, T. Zhang, L. Lei, S. Yao, Y. Hou, Nano Energy 105 (2023) 107980. [71] F. Urbain P. Tang N.M. Carretero T. Andreu L.G. Gerling C. Voz J. Arbiol J.R. Morante Energy Environ. Sci. 10 2017 2256 2266 F. Urbain, P. Tang, N.M. Carretero, T. Andreu, L.G. Gerling, C. Voz, J. Arbiol, J.R. Morante, Energy Environ. Sci. 10 (2017) 2256–2266. [72] X. Wang J. Xie M.A. Ghausi J. Lv Y. Huang M. Wu Y. Wang J. Yao Adv. Mater. 31 2019 1807807 X. Wang, J. Xie, M.A. Ghausi, J. Lv, Y. Huang, M. Wu, Y. Wang, J. Yao, Adv. Mater. 31 (2019) 1807807.",
      "scopus-id": "85207696463",
      "coredata": {
        "eid": "1-s2.0-S209549562400682X",
        "dc:description": "By manipulating the distribution of surface electrons, defect engineering enables effective control over the adsorption energy between adsorbates and active sites in the CO2 reduction reaction (CO2RR). Herein, we report a hollow indium oxide nanotube containing both oxygen vacancy and sulfur doping (Vo-Sx-In2O3) for improved CO2-to-HCOOH electroreduction and Zn-CO2 battery. The componential synergy significantly reduces the *OCHO formation barrier to expedite protonation process and creates a favorable electronic micro-environment for *HCOOH desorption. As a result, the CO2RR performance of Vo-Sx-In2O3 outperforms Pure-In2O3 and Vo-In2O3, where Vo-S53-In2O3 exhibits a maximal HCOOH Faradaic efficiency of 92.4% at −1.2 V vs. reversible hydrogen electrode (RHE) in H-cell and above 92% over a wide window potential with high current density (119.1 mA cm−2 at −1.1 V vs. RHE) in flow cell. Furthermore, the rechargeable Zn-CO2 battery utilizing Vo-S53-In2O3 as cathode shows a high power density of 2.29 mW cm−2 and a long-term stability during charge–discharge cycles. This work provides a valuable perspective to elucidate co-defective catalysts in regulating the intermediates for efficient CO2RR.",
        "openArchiveArticle": "false",
        "prism:coverDate": "2025-02-28",
        "openaccessUserLicense": null,
        "prism:aggregationType": "Journal",
        "prism:url": "https://api.elsevier.com/content/article/pii/S209549562400682X",
        "dc:creator": [
          {
            "@_fa": "true",
            "$": "Li, Yu"
          },
          {
            "@_fa": "true",
            "$": "Xu, Zhengrong"
          },
          {
            "@_fa": "true",
            "$": "Guo, Quanxin"
          },
          {
            "@_fa": "true",
            "$": "Li, Qin"
          },
          {
            "@_fa": "true",
            "$": "Liu, Rui"
          }
        ],
        "link": [
          {
            "@_fa": "true",
            "@rel": "self",
            "@href": "https://api.elsevier.com/content/article/pii/S209549562400682X"
          },
          {
            "@_fa": "true",
            "@rel": "scidir",
            "@href": "https://www.sciencedirect.com/science/article/pii/S209549562400682X"
          }
        ],
        "dc:format": "application/json",
        "openaccessType": null,
        "pii": "S2095-4956(24)00682-X",
        "prism:volume": "101",
        "prism:publisher": "Science Press and Dalian Institute of Chemical Physics, Chinese Academy of Sciences. Published by ELSEVIER B.V. and Science Press. All rights are reserved, including those for text and data mining, AI training, and similar technologies.",
        "dc:title": "Sulfur doping and oxygen vacancy in In2O3 nanotube co-regulate intermediates of CO2 electroreduction for efficient HCOOH production and rechargeable Zn-CO2 battery",
        "prism:copyright": "© 2024 Science Press and Dalian Institute of Chemical Physics, Chinese Academy of Sciences. Published by ELSEVIER B.V. and Science Press. All rights are reserved, including those for text and data mining, AI training, and similar technologies.",
        "openaccess": "0",
        "prism:issn": "20954956",
        "dcterms:subject": [
          {
            "@_fa": "true",
            "$": "CO2 electroreduction"
          },
          {
            "@_fa": "true",
            "$": "Oxygen vacancy"
          },
          {
            "@_fa": "true",
            "$": "Sulfur doping"
          },
          {
            "@_fa": "true",
            "$": "In2O3"
          },
          {
            "@_fa": "true",
            "$": "Intermediate"
          },
          {
            "@_fa": "true",
            "$": "Zn-CO2 battery"
          }
        ],
        "openaccessArticle": "false",
        "prism:publicationName": "Journal of Energy Chemistry",
        "openaccessSponsorType": null,
        "prism:pageRange": "474-484",
        "prism:endingPage": "484",
        "pubType": "fla",
        "prism:coverDisplayDate": "February 2025",
        "prism:doi": "10.1016/j.jechem.2024.09.057",
        "prism:startingPage": "474",
        "dc:identifier": "doi:10.1016/j.jechem.2024.09.057",
        "openaccessSponsorName": null
      },
      "objects": {
        "object": [
          {
            "@category": "standard",
            "@height": "200",
            "@width": "405",
            "@_fa": "true",
            "$": "https://api.elsevier.com/content/object/eid/1-s2.0-S209549562400682X-ga1.jpg?httpAccept=%2A%2F%2A",
            "@multimediatype": "JPEG image file",
            "@type": "IMAGE-DOWNSAMPLED",
            "@size": "23371",
            "@ref": "ga1",
            "@mimetype": "image/jpeg"
          },
          {
            "@category": "standard",
            "@height": "250",
            "@width": "535",
            "@_fa": "true",
            "$": "https://api.elsevier.com/content/object/eid/1-s2.0-S209549562400682X-gr1.jpg?httpAccept=%2A%2F%2A",
            "@multimediatype": "JPEG image file",
            "@type": "IMAGE-DOWNSAMPLED",
            "@size": "43855",
            "@ref": "gr1",
            "@mimetype": "image/jpeg"
          },
          {
            "@category": "standard",
            "@height": "605",
            "@width": "746",
            "@_fa": "true",
            "$": "https://api.elsevier.com/content/object/eid/1-s2.0-S209549562400682X-gr2.jpg?httpAccept=%2A%2F%2A",
            "@multimediatype": "JPEG image file",
            "@type": "IMAGE-DOWNSAMPLED",
            "@size": "195191",
            "@ref": "gr2",
            "@mimetype": "image/jpeg"
          },
          {
            "@category": "standard",
            "@height": "460",
            "@width": "766",
            "@_fa": "true",
            "$": "https://api.elsevier.com/content/object/eid/1-s2.0-S209549562400682X-gr3.jpg?httpAccept=%2A%2F%2A",
            "@multimediatype": "JPEG image file",
            "@type": "IMAGE-DOWNSAMPLED",
            "@size": "116553",
            "@ref": "gr3",
            "@mimetype": "image/jpeg"
          },
          {
            "@category": "standard",
            "@height": "435",
            "@width": "729",
            "@_fa": "true",
            "$": "https://api.elsevier.com/content/object/eid/1-s2.0-S209549562400682X-gr4.jpg?httpAccept=%2A%2F%2A",
            "@multimediatype": "JPEG image file",
            "@type": "IMAGE-DOWNSAMPLED",
            "@size": "100085",
            "@ref": "gr4",
            "@mimetype": "image/jpeg"
          },
          {
            "@category": "standard",
            "@height": "541",
            "@width": "666",
            "@_fa": "true",
            "$": "https://api.elsevier.com/content/object/eid/1-s2.0-S209549562400682X-gr5.jpg?httpAccept=%2A%2F%2A",
            "@multimediatype": "JPEG image file",
            "@type": "IMAGE-DOWNSAMPLED",
            "@size": "119414",
            "@ref": "gr5",
            "@mimetype": "image/jpeg"
          },
          {
            "@category": "standard",
            "@height": "721",
            "@width": "698",
            "@_fa": "true",
            "$": "https://api.elsevier.com/content/object/eid/1-s2.0-S209549562400682X-gr6.jpg?httpAccept=%2A%2F%2A",
            "@multimediatype": "JPEG image file",
            "@type": "IMAGE-DOWNSAMPLED",
            "@size": "167192",
            "@ref": "gr6",
            "@mimetype": "image/jpeg"
          },
          {
            "@category": "standard",
            "@height": "750",
            "@width": "657",
            "@_fa": "true",
            "$": "https://api.elsevier.com/content/object/eid/1-s2.0-S209549562400682X-gr7.jpg?httpAccept=%2A%2F%2A",
            "@multimediatype": "JPEG image file",
            "@type": "IMAGE-DOWNSAMPLED",
            "@size": "115150",
            "@ref": "gr7",
            "@mimetype": "image/jpeg"
          },
          {
            "@category": "thumbnail",
            "@height": "108",
            "@width": "219",
            "@_fa": "true",
            "$": "https://api.elsevier.com/content/object/eid/1-s2.0-S209549562400682X-ga1.sml?httpAccept=%2A%2F%2A",
            "@multimediatype": "GIF image file",
            "@type": "IMAGE-THUMBNAIL",
            "@size": "12868",
            "@ref": "ga1",
            "@mimetype": "image/gif"
          },
          {
            "@category": "thumbnail",
            "@height": "102",
            "@width": "219",
            "@_fa": "true",
            "$": "https://api.elsevier.com/content/object/eid/1-s2.0-S209549562400682X-gr1.sml?httpAccept=%2A%2F%2A",
            "@multimediatype": "GIF image file",
            "@type": "IMAGE-THUMBNAIL",
            "@size": "9988",
            "@ref": "gr1",
            "@mimetype": "image/gif"
          },
          {
            "@category": "thumbnail",
            "@height": "164",
            "@width": "202",
            "@_fa": "true",
            "$": "https://api.elsevier.com/content/object/eid/1-s2.0-S209549562400682X-gr2.sml?httpAccept=%2A%2F%2A",
            "@multimediatype": "GIF image file",
            "@type": "IMAGE-THUMBNAIL",
            "@size": "26925",
            "@ref": "gr2",
            "@mimetype": "image/gif"
          },
          {
            "@category": "thumbnail",
            "@height": "132",
            "@width": "219",
            "@_fa": "true",
            "$": "https://api.elsevier.com/content/object/eid/1-s2.0-S209549562400682X-gr3.sml?httpAccept=%2A%2F%2A",
            "@multimediatype": "GIF image file",
            "@type": "IMAGE-THUMBNAIL",
            "@size": "12425",
            "@ref": "gr3",
            "@mimetype": "image/gif"
          },
          {
            "@category": "thumbnail",
            "@height": "131",
            "@width": "219",
            "@_fa": "true",
            "$": "https://api.elsevier.com/content/object/eid/1-s2.0-S209549562400682X-gr4.sml?httpAccept=%2A%2F%2A",
            "@multimediatype": "GIF image file",
            "@type": "IMAGE-THUMBNAIL",
            "@size": "15165",
            "@ref": "gr4",
            "@mimetype": "image/gif"
          },
          {
            "@category": "thumbnail",
            "@height": "164",
            "@width": "202",
            "@_fa": "true",
            "$": "https://api.elsevier.com/content/object/eid/1-s2.0-S209549562400682X-gr5.sml?httpAccept=%2A%2F%2A",
            "@multimediatype": "GIF image file",
            "@type": "IMAGE-THUMBNAIL",
            "@size": "14436",
            "@ref": "gr5",
            "@mimetype": "image/gif"
          },
          {
            "@category": "thumbnail",
            "@height": "163",
            "@width": "158",
            "@_fa": "true",
            "$": "https://api.elsevier.com/content/object/eid/1-s2.0-S209549562400682X-gr6.sml?httpAccept=%2A%2F%2A",
            "@multimediatype": "GIF image file",
            "@type": "IMAGE-THUMBNAIL",
            "@size": "12902",
            "@ref": "gr6",
            "@mimetype": "image/gif"
          },
          {
            "@category": "thumbnail",
            "@height": "163",
            "@width": "143",
            "@_fa": "true",
            "$": "https://api.elsevier.com/content/object/eid/1-s2.0-S209549562400682X-gr7.sml?httpAccept=%2A%2F%2A",
            "@multimediatype": "GIF image file",
            "@type": "IMAGE-THUMBNAIL",
            "@size": "9920",
            "@ref": "gr7",
            "@mimetype": "image/gif"
          },
          {
            "@category": "high",
            "@height": "531",
            "@width": "1076",
            "@_fa": "true",
            "$": "https://api.elsevier.com/content/object/eid/1-s2.0-S209549562400682X-ga1_lrg.jpg?httpAccept=%2A%2F%2A",
            "@multimediatype": "JPEG image file",
            "@type": "IMAGE-HIGH-RES",
            "@size": "64527",
            "@ref": "ga1",
            "@mimetype": "image/jpeg"
          },
          {
            "@category": "high",
            "@height": "1105",
            "@width": "2368",
            "@_fa": "true",
            "$": "https://api.elsevier.com/content/object/eid/1-s2.0-S209549562400682X-gr1_lrg.jpg?httpAccept=%2A%2F%2A",
            "@multimediatype": "JPEG image file",
            "@type": "IMAGE-HIGH-RES",
            "@size": "253959",
            "@ref": "gr1",
            "@mimetype": "image/jpeg"
          },
          {
            "@category": "high",
            "@height": "1667",
            "@width": "2055",
            "@_fa": "true",
            "$": "https://api.elsevier.com/content/object/eid/1-s2.0-S209549562400682X-gr2_lrg.jpg?httpAccept=%2A%2F%2A",
            "@multimediatype": "JPEG image file",
            "@type": "IMAGE-HIGH-RES",
            "@size": "802440",
            "@ref": "gr2",
            "@mimetype": "image/jpeg"
          },
          {
            "@category": "high",
            "@height": "2039",
            "@width": "3393",
            "@_fa": "true",
            "$": "https://api.elsevier.com/content/object/eid/1-s2.0-S209549562400682X-gr3_lrg.jpg?httpAccept=%2A%2F%2A",
            "@multimediatype": "JPEG image file",
            "@type": "IMAGE-HIGH-RES",
            "@size": "631996",
            "@ref": "gr3",
            "@mimetype": "image/jpeg"
          },
          {
            "@category": "high",
            "@height": "1928",
            "@width": "3228",
            "@_fa": "true",
            "$": "https://api.elsevier.com/content/object/eid/1-s2.0-S209549562400682X-gr4_lrg.jpg?httpAccept=%2A%2F%2A",
            "@multimediatype": "JPEG image file",
            "@type": "IMAGE-HIGH-RES",
            "@size": "622951",
            "@ref": "gr4",
            "@mimetype": "image/jpeg"
          },
          {
            "@category": "high",
            "@height": "2398",
            "@width": "2951",
            "@_fa": "true",
            "$": "https://api.elsevier.com/content/object/eid/1-s2.0-S209549562400682X-gr5_lrg.jpg?httpAccept=%2A%2F%2A",
            "@multimediatype": "JPEG image file",
            "@type": "IMAGE-HIGH-RES",
            "@size": "632580",
            "@ref": "gr5",
            "@mimetype": "image/jpeg"
          },
          {
            "@category": "high",
            "@height": "3195",
            "@width": "3091",
            "@_fa": "true",
            "$": "https://api.elsevier.com/content/object/eid/1-s2.0-S209549562400682X-gr6_lrg.jpg?httpAccept=%2A%2F%2A",
            "@multimediatype": "JPEG image file",
            "@type": "IMAGE-HIGH-RES",
            "@size": "1016431",
            "@ref": "gr6",
            "@mimetype": "image/jpeg"
          },
          {
            "@category": "high",
            "@height": "3321",
            "@width": "2911",
            "@_fa": "true",
            "$": "https://api.elsevier.com/content/object/eid/1-s2.0-S209549562400682X-gr7_lrg.jpg?httpAccept=%2A%2F%2A",
            "@multimediatype": "JPEG image file",
            "@type": "IMAGE-HIGH-RES",
            "@size": "771723",
            "@ref": "gr7",
            "@mimetype": "image/jpeg"
          },
          {
            "@category": "standard",
            "@_fa": "true",
            "$": "https://api.elsevier.com/content/object/eid/1-s2.0-S209549562400682X-mmc1.docx?httpAccept=%2A%2F%2A",
            "@multimediatype": "Microsoft Word file",
            "@type": "APPLICATION",
            "@size": "5785505",
            "@ref": "mmc1",
            "@mimetype": "application/word"
          },
          {
            "@category": "thumbnail",
            "@_fa": "true",
            "$": "https://api.elsevier.com/content/object/eid/1-s2.0-S209549562400682X-si1.svg?httpAccept=%2A%2F%2A",
            "@multimediatype": "Scalable Vector Graphics file",
            "@type": "ALTIMG",
            "@size": "23087",
            "@ref": "si1",
            "@mimetype": "image/svg+xml"
          },
          {
            "@category": "thumbnail",
            "@_fa": "true",
            "$": "https://api.elsevier.com/content/object/eid/1-s2.0-S209549562400682X-si10.svg?httpAccept=%2A%2F%2A",
            "@multimediatype": "Scalable Vector Graphics file",
            "@type": "ALTIMG",
            "@size": "19335",
            "@ref": "si10",
            "@mimetype": "image/svg+xml"
          },
          {
            "@category": "thumbnail",
            "@_fa": "true",
            "$": "https://api.elsevier.com/content/object/eid/1-s2.0-S209549562400682X-si11.svg?httpAccept=%2A%2F%2A",
            "@multimediatype": "Scalable Vector Graphics file",
            "@type": "ALTIMG",
            "@size": "1421",
            "@ref": "si11",
            "@mimetype": "image/svg+xml"
          },
          {
            "@category": "thumbnail",
            "@_fa": "true",
            "$": "https://api.elsevier.com/content/object/eid/1-s2.0-S209549562400682X-si12.svg?httpAccept=%2A%2F%2A",
            "@multimediatype": "Scalable Vector Graphics file",
            "@type": "ALTIMG",
            "@size": "6414",
            "@ref": "si12",
            "@mimetype": "image/svg+xml"
          },
          {
            "@category": "thumbnail",
            "@_fa": "true",
            "$": "https://api.elsevier.com/content/object/eid/1-s2.0-S209549562400682X-si13.svg?httpAccept=%2A%2F%2A",
            "@multimediatype": "Scalable Vector Graphics file",
            "@type": "ALTIMG",
            "@size": "13670",
            "@ref": "si13",
            "@mimetype": "image/svg+xml"
          },
          {
            "@category": "thumbnail",
            "@_fa": "true",
            "$": "https://api.elsevier.com/content/object/eid/1-s2.0-S209549562400682X-si14.svg?httpAccept=%2A%2F%2A",
            "@multimediatype": "Scalable Vector Graphics file",
            "@type": "ALTIMG",
            "@size": "5273",
            "@ref": "si14",
            "@mimetype": "image/svg+xml"
          },
          {
            "@category": "thumbnail",
            "@_fa": "true",
            "$": "https://api.elsevier.com/content/object/eid/1-s2.0-S209549562400682X-si15.svg?httpAccept=%2A%2F%2A",
            "@multimediatype": "Scalable Vector Graphics file",
            "@type": "ALTIMG",
            "@size": "5421",
            "@ref": "si15",
            "@mimetype": "image/svg+xml"
          },
          {
            "@category": "thumbnail",
            "@_fa": "true",
            "$": "https://api.elsevier.com/content/object/eid/1-s2.0-S209549562400682X-si16.svg?httpAccept=%2A%2F%2A",
            "@multimediatype": "Scalable Vector Graphics file",
            "@type": "ALTIMG",
            "@size": "2413",
            "@ref": "si16",
            "@mimetype": "image/svg+xml"
          },
          {
            "@category": "thumbnail",
            "@_fa": "true",
            "$": "https://api.elsevier.com/content/object/eid/1-s2.0-S209549562400682X-si17.svg?httpAccept=%2A%2F%2A",
            "@multimediatype": "Scalable Vector Graphics file",
            "@type": "ALTIMG",
            "@size": "1134",
            "@ref": "si17",
            "@mimetype": "image/svg+xml"
          },
          {
            "@category": "thumbnail",
            "@_fa": "true",
            "$": "https://api.elsevier.com/content/object/eid/1-s2.0-S209549562400682X-si18.svg?httpAccept=%2A%2F%2A",
            "@multimediatype": "Scalable Vector Graphics file",
            "@type": "ALTIMG",
            "@size": "1542",
            "@ref": "si18",
            "@mimetype": "image/svg+xml"
          },
          {
            "@category": "thumbnail",
            "@_fa": "true",
            "$": "https://api.elsevier.com/content/object/eid/1-s2.0-S209549562400682X-si19.svg?httpAccept=%2A%2F%2A",
            "@multimediatype": "Scalable Vector Graphics file",
            "@type": "ALTIMG",
            "@size": "4762",
            "@ref": "si19",
            "@mimetype": "image/svg+xml"
          },
          {
            "@category": "thumbnail",
            "@_fa": "true",
            "$": "https://api.elsevier.com/content/object/eid/1-s2.0-S209549562400682X-si2.svg?httpAccept=%2A%2F%2A",
            "@multimediatype": "Scalable Vector Graphics file",
            "@type": "ALTIMG",
            "@size": "24591",
            "@ref": "si2",
            "@mimetype": "image/svg+xml"
          },
          {
            "@category": "thumbnail",
            "@_fa": "true",
            "$": "https://api.elsevier.com/content/object/eid/1-s2.0-S209549562400682X-si20.svg?httpAccept=%2A%2F%2A",
            "@multimediatype": "Scalable Vector Graphics file",
            "@type": "ALTIMG",
            "@size": "3523",
            "@ref": "si20",
            "@mimetype": "image/svg+xml"
          },
          {
            "@category": "thumbnail",
            "@_fa": "true",
            "$": "https://api.elsevier.com/content/object/eid/1-s2.0-S209549562400682X-si21.svg?httpAccept=%2A%2F%2A",
            "@multimediatype": "Scalable Vector Graphics file",
            "@type": "ALTIMG",
            "@size": "3957",
            "@ref": "si21",
            "@mimetype": "image/svg+xml"
          },
          {
            "@category": "thumbnail",
            "@_fa": "true",
            "$": "https://api.elsevier.com/content/object/eid/1-s2.0-S209549562400682X-si22.svg?httpAccept=%2A%2F%2A",
            "@multimediatype": "Scalable Vector Graphics file",
            "@type": "ALTIMG",
            "@size": "3722",
            "@ref": "si22",
            "@mimetype": "image/svg+xml"
          },
          {
            "@category": "thumbnail",
            "@_fa": "true",
            "$": "https://api.elsevier.com/content/object/eid/1-s2.0-S209549562400682X-si23.svg?httpAccept=%2A%2F%2A",
            "@multimediatype": "Scalable Vector Graphics file",
            "@type": "ALTIMG",
            "@size": "4928",
            "@ref": "si23",
            "@mimetype": "image/svg+xml"
          },
          {
            "@category": "thumbnail",
            "@_fa": "true",
            "$": "https://api.elsevier.com/content/object/eid/1-s2.0-S209549562400682X-si3.svg?httpAccept=%2A%2F%2A",
            "@multimediatype": "Scalable Vector Graphics file",
            "@type": "ALTIMG",
            "@size": "6810",
            "@ref": "si3",
            "@mimetype": "image/svg+xml"
          },
          {
            "@category": "thumbnail",
            "@_fa": "true",
            "$": "https://api.elsevier.com/content/object/eid/1-s2.0-S209549562400682X-si4.svg?httpAccept=%2A%2F%2A",
            "@multimediatype": "Scalable Vector Graphics file",
            "@type": "ALTIMG",
            "@size": "1201",
            "@ref": "si4",
            "@mimetype": "image/svg+xml"
          },
          {
            "@category": "thumbnail",
            "@_fa": "true",
            "$": "https://api.elsevier.com/content/object/eid/1-s2.0-S209549562400682X-si5.svg?httpAccept=%2A%2F%2A",
            "@multimediatype": "Scalable Vector Graphics file",
            "@type": "ALTIMG",
            "@size": "1408",
            "@ref": "si5",
            "@mimetype": "image/svg+xml"
          },
          {
            "@category": "thumbnail",
            "@_fa": "true",
            "$": "https://api.elsevier.com/content/object/eid/1-s2.0-S209549562400682X-si6.svg?httpAccept=%2A%2F%2A",
            "@multimediatype": "Scalable Vector Graphics file",
            "@type": "ALTIMG",
            "@size": "7606",
            "@ref": "si6",
            "@mimetype": "image/svg+xml"
          },
          {
            "@category": "thumbnail",
            "@_fa": "true",
            "$": "https://api.elsevier.com/content/object/eid/1-s2.0-S209549562400682X-si7.svg?httpAccept=%2A%2F%2A",
            "@multimediatype": "Scalable Vector Graphics file",
            "@type": "ALTIMG",
            "@size": "1536",
            "@ref": "si7",
            "@mimetype": "image/svg+xml"
          },
          {
            "@category": "thumbnail",
            "@_fa": "true",
            "$": "https://api.elsevier.com/content/object/eid/1-s2.0-S209549562400682X-si8.svg?httpAccept=%2A%2F%2A",
            "@multimediatype": "Scalable Vector Graphics file",
            "@type": "ALTIMG",
            "@size": "1944",
            "@ref": "si8",
            "@mimetype": "image/svg+xml"
          },
          {
            "@category": "thumbnail",
            "@_fa": "true",
            "$": "https://api.elsevier.com/content/object/eid/1-s2.0-S209549562400682X-si9.svg?httpAccept=%2A%2F%2A",
            "@multimediatype": "Scalable Vector Graphics file",
            "@type": "ALTIMG",
            "@size": "5639",
            "@ref": "si9",
            "@mimetype": "image/svg+xml"
          }
        ]
      },
      "link": {
        "@rel": "abstract",
        "@href": "https://api.elsevier.com/content/abstract/scopus_id/85207696463"
      }
    }
  }
}