{
  "metadata": {
    "title": "Computational screening for novel solid-state electrolytes in Li<ce:inf loc=post>3</ce:inf>MX<ce:inf loc=post>6</ce:inf> composition",
    "authors": "; ; ",
    "journal": "Journal of Energy Chemistry",
    "date": "2026-01-31",
    "doi": "10.1016/j.jechem.2025.08.047",
    "abstract": "",
    "uri": "https://api.elsevier.com/content/article/pii/S2095495625007077",
    "pii": "S2095495625007077"
  },
  "fulltext": {
    "full-text-retrieval-response": {
      "originalText": "serial JL 286353 291210 291711 291744 291809 31 Journal of Energy Chemistry JOURNALENERGYCHEMISTRY 2025-09-02 2025-09-02 2025-09-23 2025-09-23 2025-09-23T21:38:43 1-s2.0-S2095495625007077 S2095-4956(25)00707-7 S2095495625007077 10.1016/j.jechem.2025.08.047 S250 S250.1 FULL-TEXT 1-s2.0-S2095495625X00103 2025-09-23T22:03:19.542602Z 0 0 20260101 20260131 2026 2025-09-02T23:37:30.051985Z absattachment articleinfo articletitlenorm authfirstinitialnorm authfirstsurnamenorm cid cids contenttype copyright crossmark dateloaded dateloadedtxt datesearch datesort dateupdated dco docsubtype doctype doi eid ewtransactionid hubeid indexeddate issn issnnorm itemstage itemtransactionid itemweight openaccess openarchive pg pgfirst pglast pii piinorm pubdateend pubdatestart pubdatetxt pubyr sortorder srctitle srctitlenorm srctype ssids alllist content subj subheadings suppl tomb volfirst volissue volumelist webpdf webpdfpagecount yearnav figure table e-component body mmlmath acknowledge affil appendices articletitle auth authfirstini authfull authkeywords authlast grantnumber grantsponsor orcid primabst ref specialabst 2095-4956 20954956 false 112 112 C Volume 112 38 495 504 495 504 202601 January 2026 2026-01-01 2026-01-31 2026 article fla © 2025 Science Press and Dalian Institute of Chemical Physics, Chinese Academy of Sciences. Published by Elsevier B.V. and Science Press. All rights are reserved, including those for text and data mining, AI training, and similar technologies. COMPUTATIONALSCREENINGFORNOVELSOLIDSTATEELECTROLYTESINLI3MX6COMPOSITION DALLAKYAN O 1 Introduction 2 Methods 3 Results and discussion 3.1 Detailed structure search 3.2 Phase diagrams 3.2.1 Li-In-F system 3.2.2 Li-In-I system 3.2.3 Novel compositions 3.3 Phonon calculation 3.4 Ionic conduction and diffusion coefficients 3.5 Electrochemical stability 3.6 Mechanical parameters 4 Conclusions CRediT authorship contribution statement Acknowledgments Appendix A Supplementary material References FICHTNER 2021 M MANTHIRAM 2017 1 16 A WANG 2015 1026 1031 Y ZHAO 2019 574 605 W NIE 2023 365 389 X GINNINGS 1930 1340 1345 D ASANO 2018 1 7 T LI 2020 1429 1461 X KIM 2021 3669 3677 K LIANG 2021 1023 1033 J LI 2019 2665 2671 X TOMITA 1998 4 10 Y WANG 2019 8039 8043 S WANG 2022 1 14 C PARK 2021 130630 J PARK 2020 34806 34814 D XU 2019 7425 7433 Z JAIN 2013 A KIRKLIN 2015 S MERCHANT 2023 80 85 A HUSSAIN 2022 13105 13113 F ZHOU 2020 2056 2063 L WANG 2024 1 10 Q OGANOV 2006 244704 A OGANOV 2009 104504 A LYAKHOV 2010 1623 1632 A OGANOV 2019 331 348 A IOSIMOVSKA 2024 163904 A MALTSEV 2024 101467 A PICKARD 2011 53201 C HUNANYAN 2024 160814 A KVASHNIN 2018 3470 3477 A ZAKARYAN 2017 10357 H SUKHANOVA 2022 152971 E CHEPKASOV 2022 I XIE 2019 205109 C HAUTIER 2011 656 663 G HOHENBERG 1964 B864 B871 P 1965 A1133 A1138 KRESSE 1994 14251 14269 G KRESSE 1996 11169 11186 G JOUBERT 1999 1758 1775 D PERDEW 1996 3865 3868 J AGHAMALYAN 2022 170 173 M AGHAMALYAN 2020 235 239 M TANTARDINI 2024 102402 C WANG 2021 A TOGO 2023 353001 A TOGO 2023 12001 A XIA 2024 15481 15501 L MALTSEV 2023 42511 42519 A NOVIKOV 2021 025002 I SHAPEEV 2016 1153 1173 A PODRYABINKIN 2017 171 180 E PODRYABINKIN 2019 1 7 E SAGOTRA 2019 35405 A PLIMPTON 1995 1 19 S THOMPSON 2022 108171 A HOOVER 1986 2499 W EVANS 1985 4069 4074 D ZHU 2015 23685 23693 Y BINNINGER 2020 1347 1359 T RICHARDS 2016 266 273 W ONG 2013 314 319 S WU 2007 54115 Z DENG 2015 A67 Z MOUHAT 2014 224104 F PARK 2020 533 539 K FEINAUER 2019 7196 7203 M ESAKA 1989 201 205 T KIM 2021 930 938 S LIU 2021 100719 J ZHAO 2023 11737 11745 T TYAGI 2000 135 141 A CHEN 2024 20009 20018 C LUTZ 1992 1687 1692 H CHAMPARNAUDMESJARD 1978 736 741 J SHWETHA 2015 120026 G ROCQUET 1985 6555 P HONLE 1988 147 155 W HONLE 1987 248 250 W HAMADENE 2006 1 5 M HAMADENE 1996 33 39 M GRAVEREAU 1992 769 771 P LI 2023 42481 42489 Z LIU 2020 1 11 Y MONROE 2005 A396 C DALLAKYANX2026X495 DALLAKYANX2026X495X504 DALLAKYANX2026X495XO DALLAKYANX2026X495X504XO 2027-09-23T00:00:00.000Z 2027-09-23T00:00:00.000Z http://creativecommons.org/licenses/by-nc-nd/4.0/ © 2025 Science Press and Dalian Institute of Chemical Physics, Chinese Academy of Sciences. Published by Elsevier B.V. and Science Press. All rights are reserved, including those for text and data mining, AI training, and similar technologies. 2025-09-02T18:52:59.275Z http://vtw.elsevier.com/data/voc/AddOnTypes/50.7/aggregated-refined 20TTSG-2F010 23AA-2F033 Higher Education and Science Committee of the Ministry of Education Science Culture and Sports of the Republic of Armenia http://data.elsevier.com/vocabulary/SciValFunders/501100007029 http://sws.geonames.org/174982 Novosibirsk State University Higher Education and Science Committee of Armenia Oracle Corporation http://data.elsevier.com/vocabulary/SciValFunders/100004682 http://sws.geonames.org/6252001 ANSEF EN-matsc-2660 Armenian National Science and Education Fund http://data.elsevier.com/vocabulary/SciValFunders/100009533 http://sws.geonames.org/6252001 Russian Science Foundation 19-72-30043 Russian Science Foundation http://data.elsevier.com/vocabulary/SciValFunders/501100006769 http://sws.geonames.org/2017370 The work was supported by the Higher Education and Science Committee of Armenia in the frames of the research projects 20TTSG-2F010, 23AA-2F033 and ANSEF (EN-matsc-2660) grant. Convex hull calculations were done on the Oracle HPC clouds provided by the Oracle for Research grant (16576595). The USPEX calculations were performed on the Armenian National Supercomputing Center (ANSCC). MLIP training and ionic conductivity calculations were performed with the support of the Russian Science Foundation (RSF) grant no. 19-72-30043, and using the resources of the Center for Information and Computing of the Research Center for Information and Computational Technologies at Novosibirsk State University. item S2095-4956(25)00707-7 S2095495625007077 1-s2.0-S2095495625007077 10.1016/j.jechem.2025.08.047 286353 2025-09-23T21:32:59.502529Z 2026-01-01 2026-01-31 1-s2.0-S2095495625007077-main.pdf https://s3-eu-west-1.amazonaws.com/prod-ucs-content-store-eu-west/content/pii:S2095495625007077/MAIN/application/pdf/7ab2c1bc6eec53fdf42e4db6561d199d/main.pdf main.pdf pdf true 1953682 MAIN 10 1-s2.0-S2095495625007077-main_1.png https://s3-eu-west-1.amazonaws.com/prod-ucs-content-store-eu-west/content/pii:S2095495625007077/PREVIEW/image/png/b00e9c39d16f55867823174ae85cd2c1/main_1.png main_1.png png 61700 928 656 IMAGE-WEB-PDF 1 1-s2.0-S2095495625007077-ga1.jpg https://s3-eu-west-1.amazonaws.com/prod-ucs-content-store-eu-west/content/pii:S2095495625007077/ga1/DOWNSAMPLED/image/jpeg/a46d8c45c32f75e8c8055641f78a34e3/ga1.jpg ga1 true ga1.jpg jpg 28794 200 420 IMAGE-DOWNSAMPLED 1-s2.0-S2095495625007077-gr1.jpg https://s3-eu-west-1.amazonaws.com/prod-ucs-content-store-eu-west/content/pii:S2095495625007077/gr1/DOWNSAMPLED/image/jpeg/4185998938b7ee3987ff141afd94d38f/gr1.jpg gr1 gr1.jpg jpg 89681 493 625 IMAGE-DOWNSAMPLED 1-s2.0-S2095495625007077-gr2.jpg https://s3-eu-west-1.amazonaws.com/prod-ucs-content-store-eu-west/content/pii:S2095495625007077/gr2/DOWNSAMPLED/image/jpeg/285c48eb424a4a6a130114798a5e39a9/gr2.jpg gr2 gr2.jpg jpg 48176 385 535 IMAGE-DOWNSAMPLED 1-s2.0-S2095495625007077-gr3.jpg https://s3-eu-west-1.amazonaws.com/prod-ucs-content-store-eu-west/content/pii:S2095495625007077/gr3/DOWNSAMPLED/image/jpeg/721d997f302418a2cedc4fc708519c1f/gr3.jpg gr3 gr3.jpg jpg 53201 389 535 IMAGE-DOWNSAMPLED 1-s2.0-S2095495625007077-gr4.jpg https://s3-eu-west-1.amazonaws.com/prod-ucs-content-store-eu-west/content/pii:S2095495625007077/gr4/DOWNSAMPLED/image/jpeg/dd2ab27e703d4aeee41800312bd880f3/gr4.jpg gr4 gr4.jpg jpg 31331 207 534 IMAGE-DOWNSAMPLED 1-s2.0-S2095495625007077-gr5.jpg https://s3-eu-west-1.amazonaws.com/prod-ucs-content-store-eu-west/content/pii:S2095495625007077/gr5/DOWNSAMPLED/image/jpeg/4217c71766b1e7f8d17f008cc186e8d6/gr5.jpg gr5 gr5.jpg jpg 62620 228 625 IMAGE-DOWNSAMPLED 1-s2.0-S2095495625007077-gr6.jpg https://s3-eu-west-1.amazonaws.com/prod-ucs-content-store-eu-west/content/pii:S2095495625007077/gr6/DOWNSAMPLED/image/jpeg/ae24f648d2c488f423241f0451d3a44f/gr6.jpg gr6 gr6.jpg jpg 78003 527 714 IMAGE-DOWNSAMPLED 1-s2.0-S2095495625007077-gr7.jpg https://s3-eu-west-1.amazonaws.com/prod-ucs-content-store-eu-west/content/pii:S2095495625007077/gr7/DOWNSAMPLED/image/jpeg/89d2a19a78cf11bdda548a9e81c38bd0/gr7.jpg gr7 gr7.jpg jpg 30193 190 714 IMAGE-DOWNSAMPLED 1-s2.0-S2095495625007077-ga1.sml https://s3-eu-west-1.amazonaws.com/prod-ucs-content-store-eu-west/content/pii:S2095495625007077/ga1/THUMBNAIL/image/gif/7d8502a6a491bc54576fc0e1b94f01fc/ga1.sml ga1 true ga1.sml sml 11582 104 219 IMAGE-THUMBNAIL 1-s2.0-S2095495625007077-gr1.sml https://s3-eu-west-1.amazonaws.com/prod-ucs-content-store-eu-west/content/pii:S2095495625007077/gr1/THUMBNAIL/image/gif/45c77df33e3e7d80b74adaff195163ab/gr1.sml gr1 gr1.sml sml 14724 164 208 IMAGE-THUMBNAIL 1-s2.0-S2095495625007077-gr2.sml https://s3-eu-west-1.amazonaws.com/prod-ucs-content-store-eu-west/content/pii:S2095495625007077/gr2/THUMBNAIL/image/gif/534716d61b7cf70bf11e923750c74e21/gr2.sml gr2 gr2.sml sml 12482 158 219 IMAGE-THUMBNAIL 1-s2.0-S2095495625007077-gr3.sml https://s3-eu-west-1.amazonaws.com/prod-ucs-content-store-eu-west/content/pii:S2095495625007077/gr3/THUMBNAIL/image/gif/97018fd1afb4b51583787b767421b301/gr3.sml gr3 gr3.sml sml 13097 159 219 IMAGE-THUMBNAIL 1-s2.0-S2095495625007077-gr4.sml https://s3-eu-west-1.amazonaws.com/prod-ucs-content-store-eu-west/content/pii:S2095495625007077/gr4/THUMBNAIL/image/gif/a6e5c35844684482e8071e6ff0e9a871/gr4.sml gr4 gr4.sml sml 10103 85 219 IMAGE-THUMBNAIL 1-s2.0-S2095495625007077-gr5.sml https://s3-eu-west-1.amazonaws.com/prod-ucs-content-store-eu-west/content/pii:S2095495625007077/gr5/THUMBNAIL/image/gif/5a3adf52e776d7ef701d5880b4ad16fb/gr5.sml gr5 gr5.sml sml 12215 80 219 IMAGE-THUMBNAIL 1-s2.0-S2095495625007077-gr6.sml https://s3-eu-west-1.amazonaws.com/prod-ucs-content-store-eu-west/content/pii:S2095495625007077/gr6/THUMBNAIL/image/gif/71f1cb24746540d2e8ad80f28efa4b0c/gr6.sml gr6 gr6.sml sml 11739 162 219 IMAGE-THUMBNAIL 1-s2.0-S2095495625007077-gr7.sml https://s3-eu-west-1.amazonaws.com/prod-ucs-content-store-eu-west/content/pii:S2095495625007077/gr7/THUMBNAIL/image/gif/12c247eb0864337000bb6a11e5f7621f/gr7.sml gr7 gr7.sml sml 4864 58 219 IMAGE-THUMBNAIL 1-s2.0-S2095495625007077-ga1_lrg.jpg https://s3-eu-west-1.amazonaws.com/prod-ucs-content-store-eu-west/content/pii:S2095495625007077/HIGHRES/image/jpeg/446c64783195db30efce68db8ee76f0c/ga1_lrg.jpg ga1 true ga1_lrg.jpg jpg 165710 886 1862 IMAGE-HIGH-RES 1-s2.0-S2095495625007077-gr1_lrg.jpg https://s3-eu-west-1.amazonaws.com/prod-ucs-content-store-eu-west/content/pii:S2095495625007077/HIGHRES/image/jpeg/1afbb7ae1a128bdc9e44a89cffdb33da/gr1_lrg.jpg gr1 gr1_lrg.jpg jpg 243502 1309 1660 IMAGE-HIGH-RES 1-s2.0-S2095495625007077-gr2_lrg.jpg https://s3-eu-west-1.amazonaws.com/prod-ucs-content-store-eu-west/content/pii:S2095495625007077/HIGHRES/image/jpeg/421276af9eb5f77b109543e839482b00/gr2_lrg.jpg gr2 gr2_lrg.jpg jpg 244652 1706 2368 IMAGE-HIGH-RES 1-s2.0-S2095495625007077-gr3_lrg.jpg https://s3-eu-west-1.amazonaws.com/prod-ucs-content-store-eu-west/content/pii:S2095495625007077/HIGHRES/image/jpeg/3b1eb55bfabeef446e38ca4d788f98cc/gr3_lrg.jpg gr3 gr3_lrg.jpg jpg 258511 1722 2368 IMAGE-HIGH-RES 1-s2.0-S2095495625007077-gr4_lrg.jpg https://s3-eu-west-1.amazonaws.com/prod-ucs-content-store-eu-west/content/pii:S2095495625007077/HIGHRES/image/jpeg/effc5f2804c3add61ce2644f4ed382f7/gr4_lrg.jpg gr4 gr4_lrg.jpg jpg 181545 915 2365 IMAGE-HIGH-RES 1-s2.0-S2095495625007077-gr5_lrg.jpg https://s3-eu-west-1.amazonaws.com/prod-ucs-content-store-eu-west/content/pii:S2095495625007077/HIGHRES/image/jpeg/66c46b157d47c0b8b66a27f572ad5f1c/gr5_lrg.jpg gr5 gr5_lrg.jpg jpg 231548 634 1737 IMAGE-HIGH-RES 1-s2.0-S2095495625007077-gr6_lrg.jpg https://s3-eu-west-1.amazonaws.com/prod-ucs-content-store-eu-west/content/pii:S2095495625007077/HIGHRES/image/jpeg/6c30047eebd5deb9886925d88eeedfe8/gr6_lrg.jpg gr6 gr6_lrg.jpg jpg 223300 1400 1896 IMAGE-HIGH-RES 1-s2.0-S2095495625007077-gr7_lrg.jpg https://s3-eu-west-1.amazonaws.com/prod-ucs-content-store-eu-west/content/pii:S2095495625007077/HIGHRES/image/jpeg/7486702148cdcc1e07b54d3e00309e7f/gr7_lrg.jpg gr7 gr7_lrg.jpg jpg 77395 505 1896 IMAGE-HIGH-RES 1-s2.0-S2095495625007077-mmc1.docx https://s3-eu-west-1.amazonaws.com/prod-ucs-content-store-eu-west/content/pii:S2095495625007077/mmc1/MAIN/application/vnd.openxmlformats-officedocument.wordprocessingml.document/5f275718a81c64d073b27ef721084f5e/mmc1.docx mmc1 mmc1.docx docx 20941443 APPLICATION 1-s2.0-S2095495625007077-si1.svg https://s3-eu-west-1.amazonaws.com/prod-ucs-content-store-eu-west/content/pii:S2095495625007077/STRIPIN/image/svg+xml/bd5397e992b58bbd02c2c9b04a8e5ffc/si1.svg si1 si1.svg svg 12701 ALTIMG 1-s2.0-S2095495625007077-si10.svg https://s3-eu-west-1.amazonaws.com/prod-ucs-content-store-eu-west/content/pii:S2095495625007077/STRIPIN/image/svg+xml/c3dcf15e9832d2940eeb734f384b57b5/si10.svg si10 si10.svg svg 6915 ALTIMG 1-s2.0-S2095495625007077-si100.svg https://s3-eu-west-1.amazonaws.com/prod-ucs-content-store-eu-west/content/pii:S2095495625007077/STRIPIN/image/svg+xml/bac7cb10144c353c8d9320cedc03ee23/si100.svg si100 si100.svg svg 4511 ALTIMG 1-s2.0-S2095495625007077-si101.svg https://s3-eu-west-1.amazonaws.com/prod-ucs-content-store-eu-west/content/pii:S2095495625007077/STRIPIN/image/svg+xml/93e871dc65cae18b604723a18e4e5e97/si101.svg si101 si101.svg svg 5680 ALTIMG 1-s2.0-S2095495625007077-si102.svg https://s3-eu-west-1.amazonaws.com/prod-ucs-content-store-eu-west/content/pii:S2095495625007077/STRIPIN/image/svg+xml/cbae9906bf105d7e69748177607c6c6b/si102.svg si102 si102.svg svg 4394 ALTIMG 1-s2.0-S2095495625007077-si103.svg https://s3-eu-west-1.amazonaws.com/prod-ucs-content-store-eu-west/content/pii:S2095495625007077/STRIPIN/image/svg+xml/520442a647571dad5f0497baeaa90753/si103.svg si103 si103.svg svg 5807 ALTIMG 1-s2.0-S2095495625007077-si104.svg https://s3-eu-west-1.amazonaws.com/prod-ucs-content-store-eu-west/content/pii:S2095495625007077/STRIPIN/image/svg+xml/791892a1c844c51490fb27fc3524b4e4/si104.svg si104 si104.svg svg 6926 ALTIMG 1-s2.0-S2095495625007077-si105.svg https://s3-eu-west-1.amazonaws.com/prod-ucs-content-store-eu-west/content/pii:S2095495625007077/STRIPIN/image/svg+xml/a1de21be81a4398cf12ecd201544e096/si105.svg si105 si105.svg svg 8573 ALTIMG 1-s2.0-S2095495625007077-si106.svg https://s3-eu-west-1.amazonaws.com/prod-ucs-content-store-eu-west/content/pii:S2095495625007077/STRIPIN/image/svg+xml/3d55d903b56fadf608b2e8e1e2319ea8/si106.svg si106 si106.svg svg 11716 ALTIMG 1-s2.0-S2095495625007077-si107.svg https://s3-eu-west-1.amazonaws.com/prod-ucs-content-store-eu-west/content/pii:S2095495625007077/STRIPIN/image/svg+xml/89c2f72c4948b6ecb38f37a8528f2b9e/si107.svg si107 si107.svg svg 7377 ALTIMG 1-s2.0-S2095495625007077-si108.svg https://s3-eu-west-1.amazonaws.com/prod-ucs-content-store-eu-west/content/pii:S2095495625007077/STRIPIN/image/svg+xml/8b11457456d6f5371187e087daaf7548/si108.svg si108 si108.svg svg 25581 ALTIMG 1-s2.0-S2095495625007077-si109.svg https://s3-eu-west-1.amazonaws.com/prod-ucs-content-store-eu-west/content/pii:S2095495625007077/STRIPIN/image/svg+xml/a4591b13dbc619469c254f96f8479921/si109.svg si109 si109.svg svg 1409 ALTIMG 1-s2.0-S2095495625007077-si11.svg https://s3-eu-west-1.amazonaws.com/prod-ucs-content-store-eu-west/content/pii:S2095495625007077/STRIPIN/image/svg+xml/d4312b75deaee4a9449dc56aabe20918/si11.svg si11 si11.svg svg 7682 ALTIMG 1-s2.0-S2095495625007077-si110.svg https://s3-eu-west-1.amazonaws.com/prod-ucs-content-store-eu-west/content/pii:S2095495625007077/STRIPIN/image/svg+xml/1e3e8a3b9e07695ce9710cf09d78c7e1/si110.svg si110 si110.svg svg 1630 ALTIMG 1-s2.0-S2095495625007077-si111.svg https://s3-eu-west-1.amazonaws.com/prod-ucs-content-store-eu-west/content/pii:S2095495625007077/STRIPIN/image/svg+xml/c5d7f85d805cad69969d87d6acded23d/si111.svg si111 si111.svg svg 3469 ALTIMG 1-s2.0-S2095495625007077-si112.svg https://s3-eu-west-1.amazonaws.com/prod-ucs-content-store-eu-west/content/pii:S2095495625007077/STRIPIN/image/svg+xml/07bbf1ed78009d3c3613bdb9b8a2f177/si112.svg si112 si112.svg svg 6592 ALTIMG 1-s2.0-S2095495625007077-si113.svg https://s3-eu-west-1.amazonaws.com/prod-ucs-content-store-eu-west/content/pii:S2095495625007077/STRIPIN/image/svg+xml/4bcf563d91ee48c442f4bedabc6344e1/si113.svg si113 si113.svg svg 4193 ALTIMG 1-s2.0-S2095495625007077-si114.svg https://s3-eu-west-1.amazonaws.com/prod-ucs-content-store-eu-west/content/pii:S2095495625007077/STRIPIN/image/svg+xml/0064ff96a60d834253b9cb361b7aaefe/si114.svg si114 si114.svg svg 1321 ALTIMG 1-s2.0-S2095495625007077-si115.svg https://s3-eu-west-1.amazonaws.com/prod-ucs-content-store-eu-west/content/pii:S2095495625007077/STRIPIN/image/svg+xml/53b7596b35ea30e07034a5672a427ffe/si115.svg si115 si115.svg svg 1569 ALTIMG 1-s2.0-S2095495625007077-si116.svg https://s3-eu-west-1.amazonaws.com/prod-ucs-content-store-eu-west/content/pii:S2095495625007077/STRIPIN/image/svg+xml/e1e8eae458c6a9824409ec39bcef3b26/si116.svg si116 si116.svg svg 11922 ALTIMG 1-s2.0-S2095495625007077-si117.svg https://s3-eu-west-1.amazonaws.com/prod-ucs-content-store-eu-west/content/pii:S2095495625007077/STRIPIN/image/svg+xml/97d3c6da744f2357449d0bc154157baa/si117.svg si117 si117.svg svg 1708 ALTIMG 1-s2.0-S2095495625007077-si118.svg https://s3-eu-west-1.amazonaws.com/prod-ucs-content-store-eu-west/content/pii:S2095495625007077/STRIPIN/image/svg+xml/4b4f9989c51bbd44cdd18d059f9f28ca/si118.svg si118 si118.svg svg 2661 ALTIMG 1-s2.0-S2095495625007077-si119.svg https://s3-eu-west-1.amazonaws.com/prod-ucs-content-store-eu-west/content/pii:S2095495625007077/STRIPIN/image/svg+xml/182f19d99f00fa765e1d90c72e71b809/si119.svg si119 si119.svg svg 1564 ALTIMG 1-s2.0-S2095495625007077-si12.svg https://s3-eu-west-1.amazonaws.com/prod-ucs-content-store-eu-west/content/pii:S2095495625007077/STRIPIN/image/svg+xml/b7bfb14cb3d14dd97dc891e5814f9f4d/si12.svg si12 si12.svg svg 6284 ALTIMG 1-s2.0-S2095495625007077-si120.svg https://s3-eu-west-1.amazonaws.com/prod-ucs-content-store-eu-west/content/pii:S2095495625007077/STRIPIN/image/svg+xml/f0ac9e599d853b8a4a0c5f5340d7e832/si120.svg si120 si120.svg svg 3831 ALTIMG 1-s2.0-S2095495625007077-si121.svg https://s3-eu-west-1.amazonaws.com/prod-ucs-content-store-eu-west/content/pii:S2095495625007077/STRIPIN/image/svg+xml/d9a128097865536d5b4245ee613fc2ee/si121.svg si121 si121.svg svg 3131 ALTIMG 1-s2.0-S2095495625007077-si122.svg https://s3-eu-west-1.amazonaws.com/prod-ucs-content-store-eu-west/content/pii:S2095495625007077/STRIPIN/image/svg+xml/62e9001e6eba41c06e520c054a3b4adf/si122.svg si122 si122.svg svg 1124 ALTIMG 1-s2.0-S2095495625007077-si123.svg https://s3-eu-west-1.amazonaws.com/prod-ucs-content-store-eu-west/content/pii:S2095495625007077/STRIPIN/image/svg+xml/ee7259d1a931d4fc8cc7a2b564788e4b/si123.svg si123 si123.svg svg 2716 ALTIMG 1-s2.0-S2095495625007077-si124.svg https://s3-eu-west-1.amazonaws.com/prod-ucs-content-store-eu-west/content/pii:S2095495625007077/STRIPIN/image/svg+xml/f8635d8f37a632bbc733017598fb2752/si124.svg si124 si124.svg svg 8379 ALTIMG 1-s2.0-S2095495625007077-si125.svg https://s3-eu-west-1.amazonaws.com/prod-ucs-content-store-eu-west/content/pii:S2095495625007077/STRIPIN/image/svg+xml/16f7f49ca668789206193f38ea08b1d0/si125.svg si125 si125.svg svg 3418 ALTIMG 1-s2.0-S2095495625007077-si126.svg https://s3-eu-west-1.amazonaws.com/prod-ucs-content-store-eu-west/content/pii:S2095495625007077/STRIPIN/image/svg+xml/dce0049b9285a90fee2392acb5dae0ac/si126.svg si126 si126.svg svg 14608 ALTIMG 1-s2.0-S2095495625007077-si127.svg https://s3-eu-west-1.amazonaws.com/prod-ucs-content-store-eu-west/content/pii:S2095495625007077/STRIPIN/image/svg+xml/57436dbd6db1180c0038f7c91b3ab031/si127.svg si127 si127.svg svg 1840 ALTIMG 1-s2.0-S2095495625007077-si128.svg https://s3-eu-west-1.amazonaws.com/prod-ucs-content-store-eu-west/content/pii:S2095495625007077/STRIPIN/image/svg+xml/42296a2f44e0656bb41c5ebce2db7b38/si128.svg si128 si128.svg svg 1283 ALTIMG 1-s2.0-S2095495625007077-si129.svg https://s3-eu-west-1.amazonaws.com/prod-ucs-content-store-eu-west/content/pii:S2095495625007077/STRIPIN/image/svg+xml/3edcc8dd74ad470acaf24af16eb79021/si129.svg si129 si129.svg svg 2953 ALTIMG 1-s2.0-S2095495625007077-si13.svg https://s3-eu-west-1.amazonaws.com/prod-ucs-content-store-eu-west/content/pii:S2095495625007077/STRIPIN/image/svg+xml/f95685da385eee795595813e1edc461b/si13.svg si13 si13.svg svg 7984 ALTIMG 1-s2.0-S2095495625007077-si130.svg https://s3-eu-west-1.amazonaws.com/prod-ucs-content-store-eu-west/content/pii:S2095495625007077/STRIPIN/image/svg+xml/5e091bdfa6b740024b9a3a619976cf6d/si130.svg si130 si130.svg svg 7786 ALTIMG 1-s2.0-S2095495625007077-si131.svg https://s3-eu-west-1.amazonaws.com/prod-ucs-content-store-eu-west/content/pii:S2095495625007077/STRIPIN/image/svg+xml/0c34f108ce38ac180e3bd00ba497f5bb/si131.svg si131 si131.svg svg 2947 ALTIMG 1-s2.0-S2095495625007077-si132.svg https://s3-eu-west-1.amazonaws.com/prod-ucs-content-store-eu-west/content/pii:S2095495625007077/STRIPIN/image/svg+xml/d3efec3f34efd6e331de6dec447cd426/si132.svg si132 si132.svg svg 11009 ALTIMG 1-s2.0-S2095495625007077-si133.svg https://s3-eu-west-1.amazonaws.com/prod-ucs-content-store-eu-west/content/pii:S2095495625007077/STRIPIN/image/svg+xml/77629d7e741a6baebffbd930488c01b8/si133.svg si133 si133.svg svg 8948 ALTIMG 1-s2.0-S2095495625007077-si134.svg https://s3-eu-west-1.amazonaws.com/prod-ucs-content-store-eu-west/content/pii:S2095495625007077/STRIPIN/image/svg+xml/2e7f6231b5b4e5e9d2f2a87216d8312a/si134.svg si134 si134.svg svg 12714 ALTIMG 1-s2.0-S2095495625007077-si135.svg https://s3-eu-west-1.amazonaws.com/prod-ucs-content-store-eu-west/content/pii:S2095495625007077/STRIPIN/image/svg+xml/239f1386ee53fd324d064ae040d5828c/si135.svg si135 si135.svg svg 12238 ALTIMG 1-s2.0-S2095495625007077-si136.svg https://s3-eu-west-1.amazonaws.com/prod-ucs-content-store-eu-west/content/pii:S2095495625007077/STRIPIN/image/svg+xml/202de2e68080d36c04f4d5312c345029/si136.svg si136 si136.svg svg 13349 ALTIMG 1-s2.0-S2095495625007077-si137.svg https://s3-eu-west-1.amazonaws.com/prod-ucs-content-store-eu-west/content/pii:S2095495625007077/STRIPIN/image/svg+xml/a77cc8a012ab54866c6dda3b321df478/si137.svg si137 si137.svg svg 13533 ALTIMG 1-s2.0-S2095495625007077-si138.svg https://s3-eu-west-1.amazonaws.com/prod-ucs-content-store-eu-west/content/pii:S2095495625007077/STRIPIN/image/svg+xml/12cb97ee56dbbdd2da2a81498eae9ec0/si138.svg si138 si138.svg svg 10415 ALTIMG 1-s2.0-S2095495625007077-si139.svg https://s3-eu-west-1.amazonaws.com/prod-ucs-content-store-eu-west/content/pii:S2095495625007077/STRIPIN/image/svg+xml/e837ef5a2358f02b97fc69f2380290e6/si139.svg si139 si139.svg svg 3603 ALTIMG 1-s2.0-S2095495625007077-si14.svg https://s3-eu-west-1.amazonaws.com/prod-ucs-content-store-eu-west/content/pii:S2095495625007077/STRIPIN/image/svg+xml/1f5bfa2401c8a87156fd1a7f0c719ee7/si14.svg si14 si14.svg svg 8215 ALTIMG 1-s2.0-S2095495625007077-si140.svg https://s3-eu-west-1.amazonaws.com/prod-ucs-content-store-eu-west/content/pii:S2095495625007077/STRIPIN/image/svg+xml/08c6e6861084064c7aa45817f2665193/si140.svg si140 si140.svg svg 8492 ALTIMG 1-s2.0-S2095495625007077-si141.svg https://s3-eu-west-1.amazonaws.com/prod-ucs-content-store-eu-west/content/pii:S2095495625007077/STRIPIN/image/svg+xml/18e184621a34c9d692c433c3e287b760/si141.svg si141 si141.svg svg 11589 ALTIMG 1-s2.0-S2095495625007077-si142.svg https://s3-eu-west-1.amazonaws.com/prod-ucs-content-store-eu-west/content/pii:S2095495625007077/STRIPIN/image/svg+xml/e5d1c8e8794575eff4fd1e565c8481d3/si142.svg si142 si142.svg svg 3869 ALTIMG 1-s2.0-S2095495625007077-si143.svg https://s3-eu-west-1.amazonaws.com/prod-ucs-content-store-eu-west/content/pii:S2095495625007077/STRIPIN/image/svg+xml/cedbdabd14335bff498ced0a61862487/si143.svg si143 si143.svg svg 5188 ALTIMG 1-s2.0-S2095495625007077-si144.svg https://s3-eu-west-1.amazonaws.com/prod-ucs-content-store-eu-west/content/pii:S2095495625007077/STRIPIN/image/svg+xml/5494929e674b572389b63a29bb276ede/si144.svg si144 si144.svg svg 4169 ALTIMG 1-s2.0-S2095495625007077-si145.svg https://s3-eu-west-1.amazonaws.com/prod-ucs-content-store-eu-west/content/pii:S2095495625007077/STRIPIN/image/svg+xml/5055bc4772d8282d1270d82f1af3aed6/si145.svg si145 si145.svg svg 3936 ALTIMG 1-s2.0-S2095495625007077-si146.svg https://s3-eu-west-1.amazonaws.com/prod-ucs-content-store-eu-west/content/pii:S2095495625007077/STRIPIN/image/svg+xml/68a6d1d6b0b473bf9db18ee22c7afb88/si146.svg si146 si146.svg svg 4928 ALTIMG 1-s2.0-S2095495625007077-si147.svg https://s3-eu-west-1.amazonaws.com/prod-ucs-content-store-eu-west/content/pii:S2095495625007077/STRIPIN/image/svg+xml/d0029331c9ffe546692fb57b5c4a5096/si147.svg si147 si147.svg svg 7889 ALTIMG 1-s2.0-S2095495625007077-si148.svg https://s3-eu-west-1.amazonaws.com/prod-ucs-content-store-eu-west/content/pii:S2095495625007077/STRIPIN/image/svg+xml/39fef4799ea3c020595ee94cf15c21d1/si148.svg si148 si148.svg svg 866 ALTIMG 1-s2.0-S2095495625007077-si149.svg https://s3-eu-west-1.amazonaws.com/prod-ucs-content-store-eu-west/content/pii:S2095495625007077/STRIPIN/image/svg+xml/c1c5e6ef8a7c2831238d2569c2712e97/si149.svg si149 si149.svg svg 1361 ALTIMG 1-s2.0-S2095495625007077-si15.svg https://s3-eu-west-1.amazonaws.com/prod-ucs-content-store-eu-west/content/pii:S2095495625007077/STRIPIN/image/svg+xml/9f451cdf6596ecf00f6dc8481f161ee3/si15.svg si15 si15.svg svg 7899 ALTIMG 1-s2.0-S2095495625007077-si150.svg https://s3-eu-west-1.amazonaws.com/prod-ucs-content-store-eu-west/content/pii:S2095495625007077/STRIPIN/image/svg+xml/c92c19b028bda7228d063272a7cc1f23/si150.svg si150 si150.svg svg 1026 ALTIMG 1-s2.0-S2095495625007077-si151.svg https://s3-eu-west-1.amazonaws.com/prod-ucs-content-store-eu-west/content/pii:S2095495625007077/STRIPIN/image/svg+xml/fc1c771c3719ce4147cfa112c9e2fc5f/si151.svg si151 si151.svg svg 12199 ALTIMG 1-s2.0-S2095495625007077-si152.svg https://s3-eu-west-1.amazonaws.com/prod-ucs-content-store-eu-west/content/pii:S2095495625007077/STRIPIN/image/svg+xml/a5f1ffd90ac59235e849a2727cbc5437/si152.svg si152 si152.svg svg 3919 ALTIMG 1-s2.0-S2095495625007077-si153.svg https://s3-eu-west-1.amazonaws.com/prod-ucs-content-store-eu-west/content/pii:S2095495625007077/STRIPIN/image/svg+xml/e468389684a8b87763930ec4e0839493/si153.svg si153 si153.svg svg 4135 ALTIMG 1-s2.0-S2095495625007077-si154.svg https://s3-eu-west-1.amazonaws.com/prod-ucs-content-store-eu-west/content/pii:S2095495625007077/STRIPIN/image/svg+xml/fbbeca27310daeb05dff108dcaa267ff/si154.svg si154 si154.svg svg 3145 ALTIMG 1-s2.0-S2095495625007077-si155.svg https://s3-eu-west-1.amazonaws.com/prod-ucs-content-store-eu-west/content/pii:S2095495625007077/STRIPIN/image/svg+xml/72013e1c6e72a992b1c7d91d77191b13/si155.svg si155 si155.svg svg 2007 ALTIMG 1-s2.0-S2095495625007077-si156.svg https://s3-eu-west-1.amazonaws.com/prod-ucs-content-store-eu-west/content/pii:S2095495625007077/STRIPIN/image/svg+xml/ae6af7a4cfe2204151e83e4c160c52e5/si156.svg si156 si156.svg svg 3039 ALTIMG 1-s2.0-S2095495625007077-si157.svg https://s3-eu-west-1.amazonaws.com/prod-ucs-content-store-eu-west/content/pii:S2095495625007077/STRIPIN/image/svg+xml/ab3bb242c3248e25aec1d069f611f1e2/si157.svg si157 si157.svg svg 9850 ALTIMG 1-s2.0-S2095495625007077-si158.svg https://s3-eu-west-1.amazonaws.com/prod-ucs-content-store-eu-west/content/pii:S2095495625007077/STRIPIN/image/svg+xml/3f5f087a12d16aa261142747b39c541d/si158.svg si158 si158.svg svg 8455 ALTIMG 1-s2.0-S2095495625007077-si159.svg https://s3-eu-west-1.amazonaws.com/prod-ucs-content-store-eu-west/content/pii:S2095495625007077/STRIPIN/image/svg+xml/244e35c9bfcaf31cda4b87f259c7885f/si159.svg si159 si159.svg svg 9173 ALTIMG 1-s2.0-S2095495625007077-si16.svg https://s3-eu-west-1.amazonaws.com/prod-ucs-content-store-eu-west/content/pii:S2095495625007077/STRIPIN/image/svg+xml/141afcfae09cad6b5eb5cc18cabc37ab/si16.svg si16 si16.svg svg 8802 ALTIMG 1-s2.0-S2095495625007077-si160.svg https://s3-eu-west-1.amazonaws.com/prod-ucs-content-store-eu-west/content/pii:S2095495625007077/STRIPIN/image/svg+xml/16f766f92b6f6acee114a7ffe5538a23/si160.svg si160 si160.svg svg 7701 ALTIMG 1-s2.0-S2095495625007077-si161.svg https://s3-eu-west-1.amazonaws.com/prod-ucs-content-store-eu-west/content/pii:S2095495625007077/STRIPIN/image/svg+xml/163ff8e534911898876df494dae2d330/si161.svg si161 si161.svg svg 6702 ALTIMG 1-s2.0-S2095495625007077-si162.svg https://s3-eu-west-1.amazonaws.com/prod-ucs-content-store-eu-west/content/pii:S2095495625007077/STRIPIN/image/svg+xml/bfd76403c6f9faa7c4e58f3d7e225cff/si162.svg si162 si162.svg svg 3630 ALTIMG 1-s2.0-S2095495625007077-si163.svg https://s3-eu-west-1.amazonaws.com/prod-ucs-content-store-eu-west/content/pii:S2095495625007077/STRIPIN/image/svg+xml/78152108f8294991bcde66cd88cd2d24/si163.svg si163 si163.svg svg 4264 ALTIMG 1-s2.0-S2095495625007077-si164.svg https://s3-eu-west-1.amazonaws.com/prod-ucs-content-store-eu-west/content/pii:S2095495625007077/STRIPIN/image/svg+xml/66fb4362dde4dcf4e506c1ee44dba51f/si164.svg si164 si164.svg svg 5935 ALTIMG 1-s2.0-S2095495625007077-si165.svg https://s3-eu-west-1.amazonaws.com/prod-ucs-content-store-eu-west/content/pii:S2095495625007077/STRIPIN/image/svg+xml/15f2903ddd977b9d9b16f350f6a11511/si165.svg si165 si165.svg svg 2739 ALTIMG 1-s2.0-S2095495625007077-si166.svg https://s3-eu-west-1.amazonaws.com/prod-ucs-content-store-eu-west/content/pii:S2095495625007077/STRIPIN/image/svg+xml/eb890e1cb2ffdd02e58ecd612e4f103a/si166.svg si166 si166.svg svg 5878 ALTIMG 1-s2.0-S2095495625007077-si167.svg https://s3-eu-west-1.amazonaws.com/prod-ucs-content-store-eu-west/content/pii:S2095495625007077/STRIPIN/image/svg+xml/09e720a37a699119bb3ed5b0bc85ffda/si167.svg si167 si167.svg svg 3479 ALTIMG 1-s2.0-S2095495625007077-si168.svg https://s3-eu-west-1.amazonaws.com/prod-ucs-content-store-eu-west/content/pii:S2095495625007077/STRIPIN/image/svg+xml/4117bb46203e8ffc4a7efe3b1b5b1053/si168.svg si168 si168.svg svg 10551 ALTIMG 1-s2.0-S2095495625007077-si169.svg https://s3-eu-west-1.amazonaws.com/prod-ucs-content-store-eu-west/content/pii:S2095495625007077/STRIPIN/image/svg+xml/81c9e84d2941582a8ea0e2887c5c0c8d/si169.svg si169 si169.svg svg 8195 ALTIMG 1-s2.0-S2095495625007077-si17.svg https://s3-eu-west-1.amazonaws.com/prod-ucs-content-store-eu-west/content/pii:S2095495625007077/STRIPIN/image/svg+xml/4f37a3269986c43ace1b66460f36e20d/si17.svg si17 si17.svg svg 7157 ALTIMG 1-s2.0-S2095495625007077-si170.svg https://s3-eu-west-1.amazonaws.com/prod-ucs-content-store-eu-west/content/pii:S2095495625007077/STRIPIN/image/svg+xml/4ccf217422d8519e6e73fc17fb14e164/si170.svg si170 si170.svg svg 3189 ALTIMG 1-s2.0-S2095495625007077-si171.svg https://s3-eu-west-1.amazonaws.com/prod-ucs-content-store-eu-west/content/pii:S2095495625007077/STRIPIN/image/svg+xml/f3d5072248f99c0059652691eb5a4d0b/si171.svg si171 si171.svg svg 5420 ALTIMG 1-s2.0-S2095495625007077-si172.svg https://s3-eu-west-1.amazonaws.com/prod-ucs-content-store-eu-west/content/pii:S2095495625007077/STRIPIN/image/svg+xml/70617865d776c24d32c4e6981d308ae2/si172.svg si172 si172.svg svg 7707 ALTIMG 1-s2.0-S2095495625007077-si173.svg https://s3-eu-west-1.amazonaws.com/prod-ucs-content-store-eu-west/content/pii:S2095495625007077/STRIPIN/image/svg+xml/5eb6eac013a382b0092ef18b50175324/si173.svg si173 si173.svg svg 12913 ALTIMG 1-s2.0-S2095495625007077-si174.svg https://s3-eu-west-1.amazonaws.com/prod-ucs-content-store-eu-west/content/pii:S2095495625007077/STRIPIN/image/svg+xml/ace0d9461f74e90c3560058bfcc04ad4/si174.svg si174 si174.svg svg 10122 ALTIMG 1-s2.0-S2095495625007077-si175.svg https://s3-eu-west-1.amazonaws.com/prod-ucs-content-store-eu-west/content/pii:S2095495625007077/STRIPIN/image/svg+xml/57148ccd9beb632ab84c94a72da10782/si175.svg si175 si175.svg svg 16184 ALTIMG 1-s2.0-S2095495625007077-si176.svg https://s3-eu-west-1.amazonaws.com/prod-ucs-content-store-eu-west/content/pii:S2095495625007077/STRIPIN/image/svg+xml/103907da3dbac35da3e9daf7da9ce9b1/si176.svg si176 si176.svg svg 11078 ALTIMG 1-s2.0-S2095495625007077-si177.svg https://s3-eu-west-1.amazonaws.com/prod-ucs-content-store-eu-west/content/pii:S2095495625007077/STRIPIN/image/svg+xml/c1df4c28d739411b562a1d06cf87a3d8/si177.svg si177 si177.svg svg 5526 ALTIMG 1-s2.0-S2095495625007077-si178.svg https://s3-eu-west-1.amazonaws.com/prod-ucs-content-store-eu-west/content/pii:S2095495625007077/STRIPIN/image/svg+xml/5b32177f0bc934d1d861a2e74e6f4039/si178.svg si178 si178.svg svg 6204 ALTIMG 1-s2.0-S2095495625007077-si179.svg https://s3-eu-west-1.amazonaws.com/prod-ucs-content-store-eu-west/content/pii:S2095495625007077/STRIPIN/image/svg+xml/d0826087997eca3a00d0e0157eb2cc44/si179.svg si179 si179.svg svg 5675 ALTIMG 1-s2.0-S2095495625007077-si18.svg https://s3-eu-west-1.amazonaws.com/prod-ucs-content-store-eu-west/content/pii:S2095495625007077/STRIPIN/image/svg+xml/bf81f55a81fc461dd1aac3e657290b5d/si18.svg si18 si18.svg svg 7238 ALTIMG 1-s2.0-S2095495625007077-si180.svg https://s3-eu-west-1.amazonaws.com/prod-ucs-content-store-eu-west/content/pii:S2095495625007077/STRIPIN/image/svg+xml/a91008b222bbe8abdcbff7f6a2a3089b/si180.svg si180 si180.svg svg 2532 ALTIMG 1-s2.0-S2095495625007077-si181.svg https://s3-eu-west-1.amazonaws.com/prod-ucs-content-store-eu-west/content/pii:S2095495625007077/STRIPIN/image/svg+xml/806bcbc85960875d72dbc0988c3b058e/si181.svg si181 si181.svg svg 1399 ALTIMG 1-s2.0-S2095495625007077-si182.svg https://s3-eu-west-1.amazonaws.com/prod-ucs-content-store-eu-west/content/pii:S2095495625007077/STRIPIN/image/svg+xml/964383c629642fbbf888c2175ba1fe74/si182.svg si182 si182.svg svg 2115 ALTIMG 1-s2.0-S2095495625007077-si183.svg https://s3-eu-west-1.amazonaws.com/prod-ucs-content-store-eu-west/content/pii:S2095495625007077/STRIPIN/image/svg+xml/13cdc5d41b4670836f5a7b5ca03e2589/si183.svg si183 si183.svg svg 2591 ALTIMG 1-s2.0-S2095495625007077-si184.svg https://s3-eu-west-1.amazonaws.com/prod-ucs-content-store-eu-west/content/pii:S2095495625007077/STRIPIN/image/svg+xml/744006b6dd436365a9803403e1d60b82/si184.svg si184 si184.svg svg 1065 ALTIMG 1-s2.0-S2095495625007077-si19.svg https://s3-eu-west-1.amazonaws.com/prod-ucs-content-store-eu-west/content/pii:S2095495625007077/STRIPIN/image/svg+xml/a966c600329cdf9c7190ca086b809f20/si19.svg si19 si19.svg svg 6638 ALTIMG 1-s2.0-S2095495625007077-si2.svg https://s3-eu-west-1.amazonaws.com/prod-ucs-content-store-eu-west/content/pii:S2095495625007077/STRIPIN/image/svg+xml/4a63d44f513065c5dfc63c1096127409/si2.svg si2 si2.svg svg 10334 ALTIMG 1-s2.0-S2095495625007077-si20.svg https://s3-eu-west-1.amazonaws.com/prod-ucs-content-store-eu-west/content/pii:S2095495625007077/STRIPIN/image/svg+xml/09313aeb96e531fda6123bc63049d5a2/si20.svg si20 si20.svg svg 4521 ALTIMG 1-s2.0-S2095495625007077-si21.svg https://s3-eu-west-1.amazonaws.com/prod-ucs-content-store-eu-west/content/pii:S2095495625007077/STRIPIN/image/svg+xml/9d2b72d976b68d4e085e4ce446d12f84/si21.svg si21 si21.svg svg 7573 ALTIMG 1-s2.0-S2095495625007077-si22.svg https://s3-eu-west-1.amazonaws.com/prod-ucs-content-store-eu-west/content/pii:S2095495625007077/STRIPIN/image/svg+xml/14623b31014535fe1f245692472b0587/si22.svg si22 si22.svg svg 6789 ALTIMG 1-s2.0-S2095495625007077-si23.svg https://s3-eu-west-1.amazonaws.com/prod-ucs-content-store-eu-west/content/pii:S2095495625007077/STRIPIN/image/svg+xml/1da47af1c31b1443531a14d728ded8ce/si23.svg si23 si23.svg svg 7557 ALTIMG 1-s2.0-S2095495625007077-si24.svg https://s3-eu-west-1.amazonaws.com/prod-ucs-content-store-eu-west/content/pii:S2095495625007077/STRIPIN/image/svg+xml/a933b9f72dad185179995faad4b41765/si24.svg si24 si24.svg svg 9903 ALTIMG 1-s2.0-S2095495625007077-si25.svg https://s3-eu-west-1.amazonaws.com/prod-ucs-content-store-eu-west/content/pii:S2095495625007077/STRIPIN/image/svg+xml/4f1dfe0b19d4278a78707ce1263c3b98/si25.svg si25 si25.svg svg 6718 ALTIMG 1-s2.0-S2095495625007077-si26.svg https://s3-eu-west-1.amazonaws.com/prod-ucs-content-store-eu-west/content/pii:S2095495625007077/STRIPIN/image/svg+xml/f0bd87562dbee815951314bb584eb77b/si26.svg si26 si26.svg svg 8259 ALTIMG 1-s2.0-S2095495625007077-si27.svg https://s3-eu-west-1.amazonaws.com/prod-ucs-content-store-eu-west/content/pii:S2095495625007077/STRIPIN/image/svg+xml/a72226132b1b177e655cf57b11776f1d/si27.svg si27 si27.svg svg 7489 ALTIMG 1-s2.0-S2095495625007077-si28.svg https://s3-eu-west-1.amazonaws.com/prod-ucs-content-store-eu-west/content/pii:S2095495625007077/STRIPIN/image/svg+xml/076438c1f864f92aabeb7e07541e1745/si28.svg si28 si28.svg svg 8053 ALTIMG 1-s2.0-S2095495625007077-si29.svg https://s3-eu-west-1.amazonaws.com/prod-ucs-content-store-eu-west/content/pii:S2095495625007077/STRIPIN/image/svg+xml/c9dd18362799e541355837c97ce33438/si29.svg si29 si29.svg svg 8237 ALTIMG 1-s2.0-S2095495625007077-si3.svg https://s3-eu-west-1.amazonaws.com/prod-ucs-content-store-eu-west/content/pii:S2095495625007077/STRIPIN/image/svg+xml/4560b8e35bd0e42b82fe96b8876ad0e6/si3.svg si3 si3.svg svg 6472 ALTIMG 1-s2.0-S2095495625007077-si30.svg https://s3-eu-west-1.amazonaws.com/prod-ucs-content-store-eu-west/content/pii:S2095495625007077/STRIPIN/image/svg+xml/7dbd0a295b454a505f735390a8837b9a/si30.svg si30 si30.svg svg 6979 ALTIMG 1-s2.0-S2095495625007077-si31.svg https://s3-eu-west-1.amazonaws.com/prod-ucs-content-store-eu-west/content/pii:S2095495625007077/STRIPIN/image/svg+xml/fb3d50d09eafca8a914358f7b817b5d1/si31.svg si31 si31.svg svg 7587 ALTIMG 1-s2.0-S2095495625007077-si32.svg https://s3-eu-west-1.amazonaws.com/prod-ucs-content-store-eu-west/content/pii:S2095495625007077/STRIPIN/image/svg+xml/54319932e098e4ccfa91cd88aee7dc87/si32.svg si32 si32.svg svg 6790 ALTIMG 1-s2.0-S2095495625007077-si33.svg https://s3-eu-west-1.amazonaws.com/prod-ucs-content-store-eu-west/content/pii:S2095495625007077/STRIPIN/image/svg+xml/bb204d5c9209ad0a6a07e0f30551fbc3/si33.svg si33 si33.svg svg 6289 ALTIMG 1-s2.0-S2095495625007077-si34.svg https://s3-eu-west-1.amazonaws.com/prod-ucs-content-store-eu-west/content/pii:S2095495625007077/STRIPIN/image/svg+xml/026b8e359078e8c8d0aaf25c314ef698/si34.svg si34 si34.svg svg 8509 ALTIMG 1-s2.0-S2095495625007077-si35.svg https://s3-eu-west-1.amazonaws.com/prod-ucs-content-store-eu-west/content/pii:S2095495625007077/STRIPIN/image/svg+xml/0cdb4e39fb32063ba38f27634556dd0f/si35.svg si35 si35.svg svg 6619 ALTIMG 1-s2.0-S2095495625007077-si36.svg https://s3-eu-west-1.amazonaws.com/prod-ucs-content-store-eu-west/content/pii:S2095495625007077/STRIPIN/image/svg+xml/13b9b8b5aadfb3aa1ef14d71b9d25f37/si36.svg si36 si36.svg svg 7279 ALTIMG 1-s2.0-S2095495625007077-si37.svg https://s3-eu-west-1.amazonaws.com/prod-ucs-content-store-eu-west/content/pii:S2095495625007077/STRIPIN/image/svg+xml/cd98107a42cfa2d16b1f84a407bf9a32/si37.svg si37 si37.svg svg 7399 ALTIMG 1-s2.0-S2095495625007077-si38.svg https://s3-eu-west-1.amazonaws.com/prod-ucs-content-store-eu-west/content/pii:S2095495625007077/STRIPIN/image/svg+xml/812946ea1389b31c5025099b69b84b2e/si38.svg si38 si38.svg svg 6174 ALTIMG 1-s2.0-S2095495625007077-si39.svg https://s3-eu-west-1.amazonaws.com/prod-ucs-content-store-eu-west/content/pii:S2095495625007077/STRIPIN/image/svg+xml/053ed10a9b5eb851ba40ac97f53b2865/si39.svg si39 si39.svg svg 4991 ALTIMG 1-s2.0-S2095495625007077-si4.svg https://s3-eu-west-1.amazonaws.com/prod-ucs-content-store-eu-west/content/pii:S2095495625007077/STRIPIN/image/svg+xml/8a13a9a0d07becb3e15dbbcaf9edf41c/si4.svg si4 si4.svg svg 5383 ALTIMG 1-s2.0-S2095495625007077-si40.svg https://s3-eu-west-1.amazonaws.com/prod-ucs-content-store-eu-west/content/pii:S2095495625007077/STRIPIN/image/svg+xml/f88b4d7a8bad710a2654c65d3f3f4e7b/si40.svg si40 si40.svg svg 4441 ALTIMG 1-s2.0-S2095495625007077-si41.svg https://s3-eu-west-1.amazonaws.com/prod-ucs-content-store-eu-west/content/pii:S2095495625007077/STRIPIN/image/svg+xml/66a9ef111150e283c42d28c0032fdb02/si41.svg si41 si41.svg svg 7705 ALTIMG 1-s2.0-S2095495625007077-si42.svg https://s3-eu-west-1.amazonaws.com/prod-ucs-content-store-eu-west/content/pii:S2095495625007077/STRIPIN/image/svg+xml/bb3f87995f1268d016de3e85b48986ab/si42.svg si42 si42.svg svg 8976 ALTIMG 1-s2.0-S2095495625007077-si43.svg https://s3-eu-west-1.amazonaws.com/prod-ucs-content-store-eu-west/content/pii:S2095495625007077/STRIPIN/image/svg+xml/89d692e63f35c7487464f977d1b737c0/si43.svg si43 si43.svg svg 8719 ALTIMG 1-s2.0-S2095495625007077-si44.svg https://s3-eu-west-1.amazonaws.com/prod-ucs-content-store-eu-west/content/pii:S2095495625007077/STRIPIN/image/svg+xml/db2f6dc6a8a8cde2bbe9a4e98eeef80d/si44.svg si44 si44.svg svg 6935 ALTIMG 1-s2.0-S2095495625007077-si45.svg https://s3-eu-west-1.amazonaws.com/prod-ucs-content-store-eu-west/content/pii:S2095495625007077/STRIPIN/image/svg+xml/93ca89a0eb89fa5b066c7bd457ac8d28/si45.svg si45 si45.svg svg 4567 ALTIMG 1-s2.0-S2095495625007077-si46.svg https://s3-eu-west-1.amazonaws.com/prod-ucs-content-store-eu-west/content/pii:S2095495625007077/STRIPIN/image/svg+xml/f327741f0d612ff6c563700cbea3af12/si46.svg si46 si46.svg svg 5470 ALTIMG 1-s2.0-S2095495625007077-si47.svg https://s3-eu-west-1.amazonaws.com/prod-ucs-content-store-eu-west/content/pii:S2095495625007077/STRIPIN/image/svg+xml/6217114834f8aec8ad4cca096be4a529/si47.svg si47 si47.svg svg 8984 ALTIMG 1-s2.0-S2095495625007077-si48.svg https://s3-eu-west-1.amazonaws.com/prod-ucs-content-store-eu-west/content/pii:S2095495625007077/STRIPIN/image/svg+xml/0a6491fb29826e4d7ccd45216d7969c5/si48.svg si48 si48.svg svg 4839 ALTIMG 1-s2.0-S2095495625007077-si49.svg https://s3-eu-west-1.amazonaws.com/prod-ucs-content-store-eu-west/content/pii:S2095495625007077/STRIPIN/image/svg+xml/b3b7c6c42a8c77b84d1975a2c743fa08/si49.svg si49 si49.svg svg 6496 ALTIMG 1-s2.0-S2095495625007077-si5.svg https://s3-eu-west-1.amazonaws.com/prod-ucs-content-store-eu-west/content/pii:S2095495625007077/STRIPIN/image/svg+xml/20c6758e718960a51e8967ff600255a2/si5.svg si5 si5.svg svg 10505 ALTIMG 1-s2.0-S2095495625007077-si50.svg https://s3-eu-west-1.amazonaws.com/prod-ucs-content-store-eu-west/content/pii:S2095495625007077/STRIPIN/image/svg+xml/69759d95dadded70e4165a4cb202723c/si50.svg si50 si50.svg svg 7098 ALTIMG 1-s2.0-S2095495625007077-si51.svg https://s3-eu-west-1.amazonaws.com/prod-ucs-content-store-eu-west/content/pii:S2095495625007077/STRIPIN/image/svg+xml/eebdb4a89b03fd36171a36c8de4e70db/si51.svg si51 si51.svg svg 6606 ALTIMG 1-s2.0-S2095495625007077-si52.svg https://s3-eu-west-1.amazonaws.com/prod-ucs-content-store-eu-west/content/pii:S2095495625007077/STRIPIN/image/svg+xml/515b7587d206cec9fd442fe66f1a0aed/si52.svg si52 si52.svg svg 7960 ALTIMG 1-s2.0-S2095495625007077-si53.svg https://s3-eu-west-1.amazonaws.com/prod-ucs-content-store-eu-west/content/pii:S2095495625007077/STRIPIN/image/svg+xml/6653ed9725798f9e345355cc32eae93c/si53.svg si53 si53.svg svg 7280 ALTIMG 1-s2.0-S2095495625007077-si54.svg https://s3-eu-west-1.amazonaws.com/prod-ucs-content-store-eu-west/content/pii:S2095495625007077/STRIPIN/image/svg+xml/dacdeddf9754a37029904e02c658848a/si54.svg si54 si54.svg svg 8069 ALTIMG 1-s2.0-S2095495625007077-si55.svg https://s3-eu-west-1.amazonaws.com/prod-ucs-content-store-eu-west/content/pii:S2095495625007077/STRIPIN/image/svg+xml/a8c0b5c4cae99ebf4140dd8709204425/si55.svg si55 si55.svg svg 8963 ALTIMG 1-s2.0-S2095495625007077-si56.svg https://s3-eu-west-1.amazonaws.com/prod-ucs-content-store-eu-west/content/pii:S2095495625007077/STRIPIN/image/svg+xml/ab62ff02937781f26a5f5abb86ad4eb9/si56.svg si56 si56.svg svg 10104 ALTIMG 1-s2.0-S2095495625007077-si57.svg https://s3-eu-west-1.amazonaws.com/prod-ucs-content-store-eu-west/content/pii:S2095495625007077/STRIPIN/image/svg+xml/eb381a3b40dc505d70c60b3836a2f86d/si57.svg si57 si57.svg svg 7423 ALTIMG 1-s2.0-S2095495625007077-si58.svg https://s3-eu-west-1.amazonaws.com/prod-ucs-content-store-eu-west/content/pii:S2095495625007077/STRIPIN/image/svg+xml/de4242ca04a7cc041b7eb5088b05073a/si58.svg si58 si58.svg svg 6618 ALTIMG 1-s2.0-S2095495625007077-si59.svg https://s3-eu-west-1.amazonaws.com/prod-ucs-content-store-eu-west/content/pii:S2095495625007077/STRIPIN/image/svg+xml/b6743ba1635ad37e601003b677c0b7fe/si59.svg si59 true si59.svg svg 6915 ALTIMG 1-s2.0-S2095495625007077-si6.svg https://s3-eu-west-1.amazonaws.com/prod-ucs-content-store-eu-west/content/pii:S2095495625007077/STRIPIN/image/svg+xml/2b1ab818a60ba8c365c45652aedf2f0f/si6.svg si6 si6.svg svg 8895 ALTIMG 1-s2.0-S2095495625007077-si60.svg https://s3-eu-west-1.amazonaws.com/prod-ucs-content-store-eu-west/content/pii:S2095495625007077/STRIPIN/image/svg+xml/fe2c358eb2707e543604b24d2a6abe6f/si60.svg si60 true si60.svg svg 6120 ALTIMG 1-s2.0-S2095495625007077-si61.svg https://s3-eu-west-1.amazonaws.com/prod-ucs-content-store-eu-west/content/pii:S2095495625007077/STRIPIN/image/svg+xml/1cd9340cf7db0160d6336e2c3091b134/si61.svg si61 si61.svg svg 7089 ALTIMG 1-s2.0-S2095495625007077-si62.svg https://s3-eu-west-1.amazonaws.com/prod-ucs-content-store-eu-west/content/pii:S2095495625007077/STRIPIN/image/svg+xml/54bf9cb55fc3af427f21984ecc7323a5/si62.svg si62 si62.svg svg 7515 ALTIMG 1-s2.0-S2095495625007077-si63.svg https://s3-eu-west-1.amazonaws.com/prod-ucs-content-store-eu-west/content/pii:S2095495625007077/STRIPIN/image/svg+xml/37dae223c23fb8d787b77c9706a816ab/si63.svg si63 si63.svg svg 6494 ALTIMG 1-s2.0-S2095495625007077-si64.svg https://s3-eu-west-1.amazonaws.com/prod-ucs-content-store-eu-west/content/pii:S2095495625007077/STRIPIN/image/svg+xml/33783f835a09d45bc6557cfa91786921/si64.svg si64 si64.svg svg 9007 ALTIMG 1-s2.0-S2095495625007077-si65.svg https://s3-eu-west-1.amazonaws.com/prod-ucs-content-store-eu-west/content/pii:S2095495625007077/STRIPIN/image/svg+xml/c383b83cebdbf67eae678f5ca0fca4f5/si65.svg si65 si65.svg svg 8440 ALTIMG 1-s2.0-S2095495625007077-si67.svg https://s3-eu-west-1.amazonaws.com/prod-ucs-content-store-eu-west/content/pii:S2095495625007077/STRIPIN/image/svg+xml/cf8fcd4f81e987193979138868fde991/si67.svg si67 true si67.svg svg 6612 ALTIMG 1-s2.0-S2095495625007077-si68.svg https://s3-eu-west-1.amazonaws.com/prod-ucs-content-store-eu-west/content/pii:S2095495625007077/STRIPIN/image/svg+xml/502f428e41cc77b1c9c2bf8681816c52/si68.svg si68 true si68.svg svg 11622 ALTIMG 1-s2.0-S2095495625007077-si69.svg https://s3-eu-west-1.amazonaws.com/prod-ucs-content-store-eu-west/content/pii:S2095495625007077/STRIPIN/image/svg+xml/e57346953dcd68a7973e40f7c7e5a457/si69.svg si69 true si69.svg svg 9749 ALTIMG 1-s2.0-S2095495625007077-si7.svg https://s3-eu-west-1.amazonaws.com/prod-ucs-content-store-eu-west/content/pii:S2095495625007077/STRIPIN/image/svg+xml/26b6630a063cd40ffab20684a65ff55d/si7.svg si7 si7.svg svg 12674 ALTIMG 1-s2.0-S2095495625007077-si70.svg https://s3-eu-west-1.amazonaws.com/prod-ucs-content-store-eu-west/content/pii:S2095495625007077/STRIPIN/image/svg+xml/f1edc3a8a618e4baebac553afa810da5/si70.svg si70 true si70.svg svg 6961 ALTIMG 1-s2.0-S2095495625007077-si71.svg https://s3-eu-west-1.amazonaws.com/prod-ucs-content-store-eu-west/content/pii:S2095495625007077/STRIPIN/image/svg+xml/ada04aa88884f466793068fdbbf1476a/si71.svg si71 true si71.svg svg 6184 ALTIMG 1-s2.0-S2095495625007077-si72.svg https://s3-eu-west-1.amazonaws.com/prod-ucs-content-store-eu-west/content/pii:S2095495625007077/STRIPIN/image/svg+xml/5975df4f39f583af350290b57720d8a0/si72.svg si72 true si72.svg svg 4884 ALTIMG 1-s2.0-S2095495625007077-si73.svg https://s3-eu-west-1.amazonaws.com/prod-ucs-content-store-eu-west/content/pii:S2095495625007077/STRIPIN/image/svg+xml/145e51cddafa2f7b67c9fca6e34f9542/si73.svg si73 true si73.svg svg 5302 ALTIMG 1-s2.0-S2095495625007077-si74.svg https://s3-eu-west-1.amazonaws.com/prod-ucs-content-store-eu-west/content/pii:S2095495625007077/STRIPIN/image/svg+xml/6d7a5e849e916663f8040299e7c7831e/si74.svg si74 true si74.svg svg 3753 ALTIMG 1-s2.0-S2095495625007077-si75.svg https://s3-eu-west-1.amazonaws.com/prod-ucs-content-store-eu-west/content/pii:S2095495625007077/STRIPIN/image/svg+xml/803b5f3703b6e060dc7ce6a76ad5e980/si75.svg si75 true si75.svg svg 7662 ALTIMG 1-s2.0-S2095495625007077-si76.svg https://s3-eu-west-1.amazonaws.com/prod-ucs-content-store-eu-west/content/pii:S2095495625007077/STRIPIN/image/svg+xml/17fe5b7c378675a53a23676c01b56cc4/si76.svg si76 true si76.svg svg 8136 ALTIMG 1-s2.0-S2095495625007077-si77.svg https://s3-eu-west-1.amazonaws.com/prod-ucs-content-store-eu-west/content/pii:S2095495625007077/STRIPIN/image/svg+xml/eb019df09fcae804c0ff4786b8897c5a/si77.svg si77 true si77.svg svg 6213 ALTIMG 1-s2.0-S2095495625007077-si78.svg https://s3-eu-west-1.amazonaws.com/prod-ucs-content-store-eu-west/content/pii:S2095495625007077/STRIPIN/image/svg+xml/d1dc4fb4441c287e9252e3120a0a664d/si78.svg si78 true si78.svg svg 6952 ALTIMG 1-s2.0-S2095495625007077-si79.svg https://s3-eu-west-1.amazonaws.com/prod-ucs-content-store-eu-west/content/pii:S2095495625007077/STRIPIN/image/svg+xml/1a9779c731d64e54adc342f17c4bfb82/si79.svg si79 true si79.svg svg 7430 ALTIMG 1-s2.0-S2095495625007077-si8.svg https://s3-eu-west-1.amazonaws.com/prod-ucs-content-store-eu-west/content/pii:S2095495625007077/STRIPIN/image/svg+xml/2e7c4ba1db6b5f9bf1d2de78feef2fec/si8.svg si8 si8.svg svg 7968 ALTIMG 1-s2.0-S2095495625007077-si80.svg https://s3-eu-west-1.amazonaws.com/prod-ucs-content-store-eu-west/content/pii:S2095495625007077/STRIPIN/image/svg+xml/5de546473c7fd9f4966ee07360ce4ca6/si80.svg si80 true si80.svg svg 5450 ALTIMG 1-s2.0-S2095495625007077-si81.svg https://s3-eu-west-1.amazonaws.com/prod-ucs-content-store-eu-west/content/pii:S2095495625007077/STRIPIN/image/svg+xml/96a88dda9a2b0caaf3f2b22858c8b7bc/si81.svg si81 si81.svg svg 7208 ALTIMG 1-s2.0-S2095495625007077-si82.svg https://s3-eu-west-1.amazonaws.com/prod-ucs-content-store-eu-west/content/pii:S2095495625007077/STRIPIN/image/svg+xml/0f107fcf46b8f54be922b4931b35598c/si82.svg si82 si82.svg svg 8175 ALTIMG 1-s2.0-S2095495625007077-si83.svg https://s3-eu-west-1.amazonaws.com/prod-ucs-content-store-eu-west/content/pii:S2095495625007077/STRIPIN/image/svg+xml/55e27598c4991c09896357b4919db315/si83.svg si83 si83.svg svg 7037 ALTIMG 1-s2.0-S2095495625007077-si84.svg https://s3-eu-west-1.amazonaws.com/prod-ucs-content-store-eu-west/content/pii:S2095495625007077/STRIPIN/image/svg+xml/e84a4034517b14e96d9fcf4dcb2641a0/si84.svg si84 si84.svg svg 6141 ALTIMG 1-s2.0-S2095495625007077-si85.svg https://s3-eu-west-1.amazonaws.com/prod-ucs-content-store-eu-west/content/pii:S2095495625007077/STRIPIN/image/svg+xml/9e09a50f9fa5c621be8f45c58cfb1615/si85.svg si85 si85.svg svg 4591 ALTIMG 1-s2.0-S2095495625007077-si86.svg https://s3-eu-west-1.amazonaws.com/prod-ucs-content-store-eu-west/content/pii:S2095495625007077/STRIPIN/image/svg+xml/8935df081ecace2ff87792ec126d5bf0/si86.svg si86 si86.svg svg 1359 ALTIMG 1-s2.0-S2095495625007077-si87.svg https://s3-eu-west-1.amazonaws.com/prod-ucs-content-store-eu-west/content/pii:S2095495625007077/STRIPIN/image/svg+xml/a258b01bf31269eaaa19e0a83537e45a/si87.svg si87 si87.svg svg 1749 ALTIMG 1-s2.0-S2095495625007077-si88.svg https://s3-eu-west-1.amazonaws.com/prod-ucs-content-store-eu-west/content/pii:S2095495625007077/STRIPIN/image/svg+xml/f45a359283c3f0a63ea8dd97b1b6c04c/si88.svg si88 si88.svg svg 8051 ALTIMG 1-s2.0-S2095495625007077-si89.svg https://s3-eu-west-1.amazonaws.com/prod-ucs-content-store-eu-west/content/pii:S2095495625007077/STRIPIN/image/svg+xml/75d14c21d0a3d62521d2767ac013c5c1/si89.svg si89 si89.svg svg 3489 ALTIMG 1-s2.0-S2095495625007077-si9.svg https://s3-eu-west-1.amazonaws.com/prod-ucs-content-store-eu-west/content/pii:S2095495625007077/STRIPIN/image/svg+xml/20e6c0a99c7a26dbd04162fbf217c204/si9.svg si9 si9.svg svg 6876 ALTIMG 1-s2.0-S2095495625007077-si90.svg https://s3-eu-west-1.amazonaws.com/prod-ucs-content-store-eu-west/content/pii:S2095495625007077/STRIPIN/image/svg+xml/79930a9c5149764f10ae302c440e73ef/si90.svg si90 si90.svg svg 5735 ALTIMG 1-s2.0-S2095495625007077-si91.svg https://s3-eu-west-1.amazonaws.com/prod-ucs-content-store-eu-west/content/pii:S2095495625007077/STRIPIN/image/svg+xml/28910d5830c303efceb1f55ee02df75b/si91.svg si91 si91.svg svg 9717 ALTIMG 1-s2.0-S2095495625007077-si92.svg https://s3-eu-west-1.amazonaws.com/prod-ucs-content-store-eu-west/content/pii:S2095495625007077/STRIPIN/image/svg+xml/58b6e58001f405899a5d514ebf05a080/si92.svg si92 si92.svg svg 6689 ALTIMG 1-s2.0-S2095495625007077-si93.svg https://s3-eu-west-1.amazonaws.com/prod-ucs-content-store-eu-west/content/pii:S2095495625007077/STRIPIN/image/svg+xml/ae3afbaef506d4c9da7306c75f551655/si93.svg si93 si93.svg svg 6922 ALTIMG 1-s2.0-S2095495625007077-si94.svg https://s3-eu-west-1.amazonaws.com/prod-ucs-content-store-eu-west/content/pii:S2095495625007077/STRIPIN/image/svg+xml/6d45a3fe2577c5649efbcdaa247a62b1/si94.svg si94 si94.svg svg 2423 ALTIMG 1-s2.0-S2095495625007077-si95.svg https://s3-eu-west-1.amazonaws.com/prod-ucs-content-store-eu-west/content/pii:S2095495625007077/STRIPIN/image/svg+xml/c3cb49e9ff314fd9354c9b54dc5821bd/si95.svg si95 si95.svg svg 1474 ALTIMG 1-s2.0-S2095495625007077-si96.svg https://s3-eu-west-1.amazonaws.com/prod-ucs-content-store-eu-west/content/pii:S2095495625007077/STRIPIN/image/svg+xml/72f394e221a48e0799c4b057cb2d9aae/si96.svg si96 si96.svg svg 2340 ALTIMG 1-s2.0-S2095495625007077-si97.svg https://s3-eu-west-1.amazonaws.com/prod-ucs-content-store-eu-west/content/pii:S2095495625007077/STRIPIN/image/svg+xml/af707eb1abfe9a969e8de21fbe0e99ec/si97.svg si97 si97.svg svg 7400 ALTIMG 1-s2.0-S2095495625007077-si98.svg https://s3-eu-west-1.amazonaws.com/prod-ucs-content-store-eu-west/content/pii:S2095495625007077/STRIPIN/image/svg+xml/29da020fb5657f164c206267abf6615d/si98.svg si98 si98.svg svg 2118 ALTIMG 1-s2.0-S2095495625007077-si99.svg https://s3-eu-west-1.amazonaws.com/prod-ucs-content-store-eu-west/content/pii:S2095495625007077/STRIPIN/image/svg+xml/1d6a508d5a10a21a2238554b3815e6b6/si99.svg si99 si99.svg svg 2425 ALTIMG JECHEM 4988 S2095-4956(25)00707-7 10.1016/j.jechem.2025.08.047 Science Press Fig. 1 Structure search method. (a) The flowchart of detailed structure search consisted of 1. Databases 2. Filtration 3. Substitution 4. Phase stability calculations 5. Battery related feature calculations. (b) The structure of predicted novel P 3 ¯ c 1 - Li 3 InF 6 . (c) The structure of predicted. C 2 / c - Li 3 InI 6 . Fig. 2 Phase diagram of Li - In - F ternary system. Stable materials are marked with black circles, metastable structures with crosses, the color of which varies according to above hull energy. Only stable, metastable and novel compositions are shown the figure for simplicity. Fig. 3 Phase diagram of Li - In - I ternary system. Stable materials are marked with black circles, metastable structures with crosses, the color of which color varies according to above hull energy. Only stable, metastable and novel compositions are shown the figure for simplicity. Fig. 4 Crystal structures of novel compositions. (a) Cmmm - Li 5 MX 8 , (b) P 1 - LiM 2 X 9 . Fig. 5 Phonon dispersion and phonon density of states of novel predicted materials. (a) P 3 ¯ c 1 - Li 3 InF 6 , (b) C 2 / c - Li 3 InI 6 . Fig. 6 Ionic conductivities and diffusion paths for novel materials. (a) Diffusion coefficient and (b) ionic conduction as functions of temperatures, (c and d) are crystal structure and Li-ion migration paths plotted with Li-ion density isosurface (with value 0.6/Å3) for Li 3 InF 6 and Li 3 InI 6 respectively. Fig. 7 Electrochemical stability windows, where stability against Li uptake and voltages are shown. The green background show the range of stability ranges of (a) Li 3 InF 6 and (b) Li 3 InI 6 materials. Table 1 Structure types of filtered materials. The composition is the taken from original structure. Also space group symbols with number in brackets, the source of database, Materials Project ID number, Experimentally observed, and Reference are listed. # Composition Space group [number] Source MP ID Experimentally observed Reference 1 L i 3 E r B r 6 C 2 / m 12 Literature mp-1222492 Yes [7,13] 2 L i 3 E r C l 6 P 3 ¯ m 1 164 Literature mp-676361 Yes [70] 3 L i 3 Y b C l 6 P n m a 62 Literature − Yes [70] 4 L i 3 S c I 6 P 2 / m 10 Literature − No [17] 5 L i 3 S c I 6 C 2 / c 15 Literature mp-1147621 No [17] 6 L i 3 S c I 6 C 2 5 Literature mp-686004 No [17] 7 L i 3 I n C l 6 C 2 5 Literature mp-676109 No [18] 8 L i 3 A l F 6 C 2 / c 15 Literature mp-15254 Yes [71] 9 L i 3 I n C l 6 Fm 3 ¯ m 255 Literature mp-1111288 No [18] 10 L i 3 A l F 6 Pna 2 1 33 Literature mp-556020 Yes [72] 11 L i 3 Y b C l 6 Pna 2 1 33 Literature mp-637363 Yes [73] 12 L i 3 S c F 6 P 3 ¯ c 1 165 DMSP mp-560890 Yes [74] 13 N a 3 I n C l 6 P 3 ¯ 1 c 163 DMSP mp-23503 Yes [75] 14 N a 3 I n F 6 P 2 1 / c 14 DMSP mp-1210420 No [18] 15 L i 3 F e F 6 P 3 ¯ 1 m 162 DMSP mp-755087 No [18] 16 L i 3 F e F 6 R 3 ¯ 148 DMSP mp-777459 No [18] 17 L i 3 C r F 6 P 4 ¯ n 2 118 DMSP mp-769881 No [18,76] 18 L i 3 V F 6 P 2 1 4 DMSP mp-767631 No [18] 19 L i 3 V F 6 C c 9 DMSP mp-767671 No [18] 20 N a 3 Y C l 6 R 3 ¯ 148 Literature mp-675104 No [77] 21 L i 2 S c 2 / 3 C l 4 Fd 3 ¯ m 227 Literature − Yes [22] 22 L i G a 2 I 9 P 1 ¯ 2 DeepMind − No [20] 23 L i 4 I n F 7 F 4 ¯ 3 m 216 DeepMind − No [20] 24 L i L a F 4 I 4 1 / a 88 DeepMind − No [20] 25 L i 5 C r C l 8 C m m m 65 DMSP mp-23361 Yes [78] 26 R b 2 I n 3 F 11 P 2 1 / m 11 DMSP mp-554576 Yes [79] 27 R b 2 L a C l 5 P n m a 62 DMSP mp-1209610 No [80] 28 N a 5 A l 3 F 14 P 4 / m n c 128 DMSP mp-4752 Yes [81] 29 L i G a C l 3 P n m a 62 Literature mp-29344 Yes [82] 30 L i G a C l 4 P 2 1 / c 14 Literature mp-28341 Yes [83] 31 L i 3 I n F 6 P 2 1 / m 11 Literature − Yes [84,85] Table 2 The important parameters of novel and known materials for battery applications. Composition Ionic conductivity (mS/cm) E a (meV) Electrochemical stability window (V) E g (eV) Ref. L i 3 I n F 6 0.55 259 4 5 this article L i 3 I n I 6 2.18 268 0.7 2.5 this article L i 3 S c F 6 0.28 310 5 6.7 [74] L i 3 Y C l 6 0.51 400 3.2 6.1 [7] L i 3 Y B r 6 1.7 400 2.2 5.1 [7] L i 3 L a I 6 0.99 298 2 3 [17] L i 3 I n C l 6 1.49 325 1.5 5 [9] L i 10 G e P 2 S 12 9 210 0.4 3.6 [4,52] L i 6 P S 5 C l 1.3 250 2 2.7 [4,52] Computational screening for novel solid-state electrolytes in Li3MX6 composition Olgert L. Dallakyan Methodology Investigation a b Alexey P. Maltsev Methodology Investigation c Ilya V. Chepkasov Investigation c Misha A. Aghamalyan Investigation d Areg A. Hunanyan Investigation d Nane Z. Petrosyan Investigation d Mikayel S. Chobanyan Investigation d Mikayel T. Sahakyan Investigation d Luiza G. Khachatryan Investigation d Artem R. Oganov Writing – review & editing Formal analysis c Hayk A. Zakaryan Writing – original draft Supervision Methodology Investigation Conceptualization d ⁎ a Asymmetric Catalysis Research Group, Yerevan State University, Alex Manoogian 1, Yerevan 0025, Armenia Asymmetric Catalysis Research Group Yerevan State University Alex Manoogian 1 Yerevan 0025 Armenia Asymmetric Catalysis Research Group, Yerevan State University, Alex Manoogian 1, Yerevan 0025, Armenia b Liquid Crystalline Nanosystems Laboratory, A.B. Nalbandyan Institute of Chemical Physics NAS RA, Yerevan, Armenia Liquid Crystalline Nanosystems Laboratory A.B. Nalbandyan Institute of Chemical Physics NAS RA Yerevan Armenia Liquid Crystalline Nanosystems Laboratory, A.B. Nalbandyan Institute of Chemical Physics NAS RA, Yerevan, Armenia c Skolkovo Institute of Science and Technology, Bolshoy Boulevard 30, bld. 1, Moscow 121205, Russia Skolkovo Institute of Science and Technology Bolshoy Boulevard 30 bld. 1 Moscow 121205 Russia Skolkovo Institute of Science and Technology, Bolshoy Boulevard 30, bld. 1, Moscow 121205, Russia d Computational Materials Science Laboratory, Yerevan State University, Alex Manoogian 1, Yerevan 0025, Armenia Computational Materials Science Laboratory Yerevan State University Alex Manoogian 1 Yerevan 0025 Armenia Computational Materials Science Laboratory, Yerevan State University, Alex Manoogian 1, Yerevan 0025, Armenia ⁎ Corresponding author. Graphical abstract We explored halide-based L i 3 M X 6 electrolytes, revealing metastable high-conductivity P 3 ¯ c 1 - L i 3 I n F 6 and C 2 / c - L i 3 I n I 6 structures with trigonal and monoclinic symmetries, and predicted several novel L i 5 I n M 8 and L i I n 2 M 9 stable phases for potential use in next-generation all-solid-state batteries. Halide solid-state electrolytes have gained significant attention in recent years due to their high ionic conductivity, making them promising candidates for future all-solid-state batteries. Recent studies have identified numerous crystal structures with the L i 3 M X 6 composition, although many remain unexplored across various chemical systems. In this research, we developed a comprehensive method to examine all conceivable space groups and structures within the L i - M - X system, where M includes In, Ga, and La, and X includes F, Cl, Br, and I. Our findings revealed two metastable structures: L i 3 I n F 6 with P 3 ¯ c 1 symmetry and L i 3 I n I 6 with C 2 / c symmetry, exhibiting ionic conductivities of 0.55 and 2.18 mS/cm at 300 K, respectively. Notably, the trigonal symmetry of L i 3 I n F 6 demonstrates that high ionic conductivities are not limited to monoclinic structures but can also be achieved with trigonal symmetries. The electrochemical stability windows, mechanical properties, and reaction energies of these materials with known cathodes suggest their potential for use in all-solid-state batteries. Additionally, we predicted the stability of novel materials, including L i 5 I n C l 8 , L i 5 I n B r 8 , L i 5 I n I 8 , L i I n 2 C l 9 , L i I n 2 B r 9 , and L i I n 2 I 9 . Keywords Solid state electrolyte Halides Novel materials DFT 1 Introduction The demand for energy storage solutions, particularly batteries, is experiencing exponential growth and is projected to reach unprecedented levels by 2030, surpassing the capabilities of current technologies [1]. Among the emerging technologies, all-solid-state lithium-ion batteries (ASSBs) utilizing solid electrolytes stand out as promising candidates [2]. These batteries offer notable safety and energy density advantages, albeit facing challenges such as interface stability with electrodes and low ionic conductivity [3]. For example, sulfides such L i 10 G e P 2 S 12 and L i 7 P 3 S 11 have high ionic conductivity (about 1 mS/cm) but lack stability against electrodes [4]. Oxides such as L i 6 P O 5 C l have low conductivity but are stable against electrodes and moisture [2]. Consequently, extensive research efforts are underway to discover novel solid-state electrolyte (SSE) materials capable of addressing these limitations [4]. Despite sulfides and oxides, halides emerge as promising candidates for solid-state electrolytes which can meet all requirements for SSE [5]. Early investigations into their ionic conductivity dating back to 1930 [6], a significant breakthrough occurred only in 2018 [7], by Asano et al. Their groundbreaking work unveiled the experimental synthesis of L i 3 Y C l 6 (isostructural to L i 3 E r C l 6 with the P 3 ¯ m 1 space group) and L i 3 Y B r 6 (isostructural to L i 3 E r B r 6 with the C 2 / m space group), having impressive ionic conductivities of 0.51 and 1.71 mS/cm, respectively [7]. The fact that L i 3 Y C l 6 and L i 3 Y B r 6 have high ionic conductivity along with hexagonal close-packed (hcp) and cubic close-packed (ccp) anion sub-lattices respectively, attracted much interest to L i 3 M X 6 materials [3]. This structural insight has induced a wave of research aimed at identifying novel L i 3 M X 6 SSE candidates (where M encompasses elements from groups 3 and 13 of the periodic table, such as In, Ga, La, Yb, and others, and X denotes F, Cl, Br, or I), leveraging these findings as a guiding design principle [8–10]. For instance, Li et al. demonstrated the stability and high ionic conductivity of L i 3 I n C l 6 with C 2 / m symmetry group, achieving a conductivity of 1.49 mS/cm alongside excellent air and water stability [11]. Similarly, L i 3 I n B r 6 , possessing the same symmetry group [12], exhibited a conductivity of approximately 1 mS/cm [8]. The intricate mechanism of ion migration within these materials was elucidated in detail by Wang et al. through ab initio molecular dynamics (AIMD). In both L i 3 Y C l 6 and L i 3 Y B r 6 , characterized by hexagonal (hcp) and cubic (ccp) close-packed anion motifs, respectively, ion diffusion occurs via Li-ion hopping between octahedral sites through existing vacant sites with minimal energy barriers [13]. Notably, ccp L i 3 Y B r 6 demonstrates isotropic fast Li+ diffusion, while hcp L i 3 Y C l 6 exhibits anisotropic diffusion, featuring fast one-dimensional c-channels, albeit vulnerable to blocking defects such as Y - L i anti-sites [13]. Given the three-dimensional nature of Li-ion migration paths and the low activation barriers associated with ccp frameworks (monoclinic crystal structure), some researchers propose these structures as promising candidates for solid-state electrolytes [9,13,14]. In several studies [9,15], researchers have explored the relationship between the crystal symmetry types of halides and their implications for the design of solid-state electrolytes (SSEs). Depending on cation ordering and structural distortion, crystals featuring hexagonal close-packed (hcp) and cubic close-packed (ccp) anion sublattices can exhibit various symmetries. For the hcp anion sublattice, two distinct crystal structures have been identified: the trigonal structure observed in L i 3 E r C l 6 (space group P 3 ¯ m 1 ) and the orthorhombic structure seen in L i 3 Y C l 6 (space group Pnma ) [15]. On the other hand, the ccp anion sublattice can give rise to structures such as the disordered spinel L i 2 S c 2 / 3 C l 6 (space group Fd 3 ¯ m ) and the monoclinic L i 3 E r C l 6 (space group C 2 / m ) [13]. While chloride compounds L i 3 M C l 6 can adopt either hcp or ccp anion sublattices (with M including E r , Y , Y b , among others), all known bromide counterparts L i 3 M B r 6 (with M ranging from Y to L u ) exhibit a monoclinic structure with ccp anion sublattice (space group C 2 / m ). Wang et al. suggested prioritizing the design of chloride and bromide SSEs due to their wider electrochemical stability window compared to oxides, iodides, and sulfides, along with their relatively high ionic conductivity [13]. While many investigations concentrate on the symmetry (trigonal, orthorhombic, and monoclinic) of halides, some researchers have explored other symmetries or space groups. For instance, Park et al. used a data-mined structure predictor (DMSP) and identified the most common space groups within L i 3 M C l 6 as C 2 (monoclinic), P 321 (trigonal), and Pna 2 1 (orthorhombic) [16]. In another study, Xu et al. computationally predicted novel metastable L i 3 L a I 6 and stable L i 3 S c I 6 structures with the C 2 space group, which exhibit high ionic conductivity [17]. These investigations demonstrate that the possible structures of halide SSEs are not confined to trigonal symmetry, particularly the P 3 ¯ m 1 space group, and monoclinic symmetry, particularly the C 2 / m space group. A more comprehensive investigation is necessary to search for novel structures within other crystal symmetries. For example, in systems like L i - I n - I , L i - L a - C l , L i - G a - C l , and many others, the L i 3 M X 6 composition in the C 2 / m space group and monoclinic symmetry has not been identified either experimentally or computationally. In this study, we undertake a detailed examination of all conceivable space groups and structures within the L i - M - X system ( M = I n , G a , a n d L a , and X = F , C l , B r , a n d I ), leveraging open databases such as Materials Project [18], OQMD [19] and literature sources not included in these databases or not predicted by DMSP or DeepMind [17,20–23]. Our objective is to discover novel solid-state electrolyte materials with the L i 3 M X 6 composition. 2 Methods Several effective methods are available for conducting structure searches. For instance, the utilization of evolutionary algorithms integrated into USPEX [24–27] has proven successful in predicting novel materials within the Li-Ge system [28], showcasing high ionic conductivity and introducing a new class of Ca-ion anode materials [29]. Additionally, the DeepMind team recently employed artificial intelligence to predict approximately 421,000 novel structures [20], demonstrating the potential of AI, which included new symmetry-aware partial substitutions (SAPS) [30] and random structure search combined with graph neural networks (GNNs) for stability calculation [20]. While these methods excel at uncovering previously unknown structures, they come with a significant computational cost during training step in creating DeepMind database or energy minimization step with ab initio methods in USPEX [31–38]. The simplest approach to structure prediction is the substitution of one atom type with a chemically similar atom in a known structure, followed by the calculation of stability using a convex hull diagram. This method forms the basis of the Data Mined Structure Prediction (DMSP) tool [39]. In previous studies, DMSP method has been applied to explore novel stable solid-state electrolytes within the Li-In-Cl system [16]. The method calculates the probability of stability after substitution using a probabilistic method trained on an experimental database of crystal structures [18,39]. However, it is important to note that the stability of predicted structures must be verified through density functional theory (DFT) calculations [40,41]. In our research, the detailed structure examination and novel material search were conducted in five steps, as illustrated in Fig. 1 . First, we collected a comprehensive structure database consisted from 3 parts, which are (a) novel materials from DeepMind, comprising over 400,000 structures, (b) structures generated by DMSP for M = I n , G a , L a and (c) structures gathered from literature that were not included in the previous datasets. Second, we performed filtration of the structures. For the DeepMind database, we selected halide ternary structures with M = I n , G a , L a . The filtration step for the DMSP method was performed using L i - M - X as input systems. Structures from the literature that were not included in DeepMind and were not predicted by DMSP were added in the final part of the filtration step. Third, after the filtration step, all gathered structure types were used for substitution, replacing Na with Li, metals with Ga, In, and La, and all halides. Overall, substitutions were performed for 12 systems. Fourth, following the substitution, the calculation of the phase diagram was conducted. Fifth, in the final step, battery-related features such as ionic conductivity, electrochemical stability window, and elastic constants were calculated for novel stable or metastable L i 3 M X 6 compositions. Structure relaxation and total energy calculations were done using the density functional theory as implemented in the Vienna ab initio simulation package (VASP) [42,43] within the projector augmented-wave (PAW) method [44] and generalized gradient approximation (GGA) functional of Perdew, Burke, and Ernzerhof (PBE) [45]. The convergence of plane-wave cutoff energy and k-point mesh was tested for each structure and the highest values among all structures were selected for further calculations. The structural relaxation of substituted materials was done in several steps by tightening relaxation parameters (details are written in Supplementary Materials) [46–48]. After structure relaxation, phase diagrams for ternary L i - M - X systems were calculated [27]. The correction scheme described in [49] was applied to improve the accuracy of computed enthalpies of formation and phase stability predictions. The supercell approach and the harmonic approximation, implemented through the Phonopy package [50,51], were utilized to compute vibrational frequencies. The dynamical stability of all structures, including both stable and metastable configurations, was confirmed by the absence of imaginary phonon frequencies. Diffusion coefficients were calculated using mean square displacements (MSD) of Li+ cations [52,53]. (1) D = l i m t → ∞ d ∑ i = 1 N < r i t - r i 0 2 > / N / d t / 6 where N − is number of the mobile atoms in the supercell, i − atomic number of mobile ion Li , r i 0 , r i t − radius vectors from the host center of mass to the i th atom at time 0 and t , respectively. Ionic conductivity of lithium was calculated using the Nernst-Einstein formula [52]. (2) σ = n q 2 D / H r k B T where n is the L i + ion density, q is the formal charge of the lithium ion q = 1 , k B is Boltzmann constant, T is temperature and H r is Haven ratio (assumed to be 1) [53]. To calculate ionic conductivity, more than 1 ns ab i n i t i o molecular dynamics simulation on a supercell is needed, which requires an enormous amount of computational time [52]. Therefore, the machine learned interatomic potential was constructed using MLIP-3 code [54]. Moment Tensor Potential (MTP) [55–57] of 20-th level was used for construction of potentials. The initial training set for the MLIPs was collected using AIMD and was improved within the Active Learning (AL) procedure [56]. We have performed validation tests for each MLIP. During calculation of ionic conductivities 2 % of Li vacancy was used, which may cause a little overestimation, though the method is reliable and widely used for ionic conductivity calculation [16,53,58]. For more details about the training procedure, validation and the accuracy of the MLIPs see Figs. S1–S5 and Table S1 of the Supplementary Materials. After construction of potentials, ionic conductivity was calculated using LAMMPS code [59,60] with NPT ensemble and Noose-Hoover thermostat [61,62]. Simulations were conducted for the supercells with lattice parameters no less than 30 Å and with 2 % vacancies on lithium sites. A timestep of 1 fs was used, and statistics were collected for 4 ns, with the preliminary equilibration of 1 ns at each temperature (300–500 K). Activation energy E a of diffusion was calculated using the Arrhenius formula. (3) D = D 0 × e x p - E a / k B T The electrochemical stability of a solid-state electrolyte (SSE) material against decomposition of the SSE phase is commonly evaluated by calculating its L i -grand canonical phase diagram [63–65]. These diagrams were constructed using the pymatgen code [66]. Consistent with prior research, the electrostatic potential ϕ was taken into account when determining the L i chemical potential μ L i . (4) μ L i ϕ = μ L i 0 - e ϕ where μ L i is the chemical potential of L i metal, and ϕ is the applied voltage referenced to Li metal. Interfacial stability between solid electrolytes and various cathode materials was also calculated using L i -grand canonical phase diagram as a function of L i chemical potential. The mechanical properties of novel materials were calculated regarding their symmetry, using elastic constants from VASP calculations [67,68]. The elastic constants were also used to estimate stability by Born elastic stability criterion. This criterion states that for a mechanically stable compound, the relevant elastic tensor must be positive definite, that means all its eigenvalues must be positive [69]. 3 Results and discussion 3.1 Detailed structure search Among the 400,000 novel structures predicted by DeepMind [20], only three are included within the L i - M - X systems: L i G a 2 I 9 with space group P 1 ¯ , F 4 ¯ 3 m - L i 4 I n F 7 and I 4 1 / a - L i L a F 4 . Each of these structures is classified as metastable and presents intriguing potential as ionic conductors due to their ability to provide intercalating pathways for Li-ion transport [20]. In addition to the structures previously described, the literature reports other experimentally synthesized or computationally predicted solid electrolytes. One notable example is L i 3 E r B r 6 [7], which crystallizes in the C 2 / m space group. Its stability has already been assessed for various systems, like L i 3 I n C l 6 [11] and L i 3 I n B r 6 [12]. To ensure the completeness of the structure type list, the L i 3 E r B r 6 structure with C 2 / m space group has also been included in our analysis. There are also a number of known and well-investigated structure types from literature [8], which are orthorhombic Pnma - L i 3 Y C l 6 , Pna 2 1 - L i 3 A l F 6 , Pna 2 1 - L i 3 Y b C l 6 , trigonal P 3 ¯ m 1 - L i 3 E r C l 6 , monoclinic C 2 / c - L i 3 A l F 6 (Table 1 ). In recent publications, several structures with high ionic conductivity have gained attention, yet they remain underexplored for other compositions. Chen et al. from Microsoft utilized the structure of N a 3 Y C l 6 with an R 3 ¯ space group to predict the metastable compound N a 2 L i Y C l 6 [77]. Similarly, Zhu et al. computationally predicted novel metastable structures of L i 3 S c I 6 and L i 3 L a I 6 , exhibiting monoclinic symmetry with C 2 and C 2 / c space groups [17]. In addition to the L i 3 M X 6 compositions, we included other non-stoichiometric compositions in our analysis due to their stable analogs in indium or gallium halide systems, such as L i G a C l 3 [82] and L i G a C l 4 [83]. Furthermore, the structure of L i 2 S c 2 / 3 C l 4 was added to the list, because the compound L i 2 I n 1 / 3 S c 2 / 3 C l 4 with high ionic conductivity has recently been synthesized, and it shows significant potential as a future solid-state electrolyte (SSE) [22]. Overall 31 structure types were filtered from DMSP, DeepMind and literature. These structures were further used for atom substitution and structure generation for 12 L i - M - X systems. 3.2 Phase diagrams For each of the 12 L i - M - X systems, we calculated the phase diagrams or convex hulls. In addition to the filtered structures, all known materials were incorporated into the stability diagrams. Our analysis confirmed the stability of all known double and ternary systems, validating the accuracy of our computational method. Furthermore, our calculations predicted that the known compounds L i 3 I n C l 6 and L i 3 I n B r 6 possess a C 2 / m space group, which matches existing literature [11,12]. Notably, even the 28.6 meV/atom above hull energy of the metastable compound L i 3 L a I 6 matched with the above hull energy mentioned in the literature [17]. 3.2.1 Li-In-F system Magnus-Goldschmidt rule was used for description and search for the possible L i - M - X compositions [10,14]. According to the rule, if the ratio of cation to anion radius exceeds 0.732, the atoms tend to form M X 8 cubes [10,14]. For example, L i - I n - F system I n F 8 cubes should be preferable, which is not aligned with experimental results [86], where I n F 6 is more favorable and form the L i I n F 4 [86] and α - L i 3 I n F 6 [84,85] compositions. In our computed convex hull (Fig. 2 ), α - L i 3 I n F 6 is classified as metastable, lying 16 meV/atom above the hull energy, a relatively small value that supports its classification as a metastable structure. In addition to the α , β , and γ phases have been synthesized. Our calculated phase diagram additionally reveals a novel structure with trigonal symmetry P 3 ¯ c 1 , which appears to be more stable, just 9 meV/atom above the hull energy. This structure type is already known from P 3 ¯ c 1 - L i 3 S c F 6 [74]. It features a hexagonal close-packed (hcp) anion sublattice with L i F 6 octahedra connected in a face-sharing manner along the c-axis and in an edge-sharing manner within the a-b plane (Fig. 1). 3.2.2 Li-In-I system In the case of L i - I n - I system, only L i I n I 4 is known from the literature, and our calculations also confirm that L i I n I 4 is stable (Fig. 3 ). Among the metastable L i 3 M X 6 compositions, the closest to hull structure type is L i 3 S c I 6 [17], which has a C 2 / c space group and lies just 4 meV/atom above the hull energy. Structures with C 2 / m and C 2 symmetries are very similar. The L i 3 I n I 6 structure with C 2 / c symmetry features I n I 6 octahedra that are stacked in an AB sequence, similar to the arrangement in L i 3 S c I 6 [17]. In contrast, the stacking sequence for the C 2 / m structure is AA, while for the C 2 structure, it is ABCD [17]. This variation in stacking can lower the total energy in certain materials, making them more favorable or stable compared to other L i 3 I n I 6 structures. In addition to the L i 3 M X 6 compositions, we also discovered novel stable compositions, namely L i 5 I n I 8 and L i I n 2 I 9 , within this system. Details regarding these structure types will be provided in the next section. 3.2.3 Novel compositions Two stable structure types have been identified in the I n and G a systems: Cmmm - L i 5 M X 8 [78,87] and P 1 ¯ - L i M 2 X 9 [20]. The compounds L i 5 I n C l 8 , L i 5 I n B r 8 and L i 5 I n I 8 are stable and lie on the convex hull. In contrast, L i 5 G a B r 8 and L i 5 G a I 8 are metastable, with energies less than 18 meV/atom above the hull. The L i 5 M X 8 structure features a face-centered cubic (fcc) anionic framework with orthorhombic symmetry, where the M and Li atoms form octahedra units with anions (Fig. 4 ). These M X 6 form isolated, edge-sharing, or corner-sharing units with L i X 6 octahedra and form layered structures [88], which may enhance the ionic conductivity in this composition [87,89]. The next structure type, L i M 2 X 9 , with triclinic P 1 ¯ symmetry, was predicted by DeepMind in the L i - G a - I system [20]. Interestingly, this composition is also thermodynamically stable in the M = I n and X = C l , B r , a n d I systems. An additional structure search for fixed composition was conducted using USPEX [24,25,27] to ensure structural stability. The resulting P 1 - L i M 2 X 9 structure is more favorable than the P 1 ¯ - L i M 2 X 9 structure from DeepMind. In the predicted structure, M atoms form tetrahedral M X 4 and octahedral M X 6 units (Fig. 4). The M X 4 units share edges with L i atoms situated between them, while the M X 6 units share two edges with nearby octahedra. 3.3 Phonon calculation The dynamical stability calculations for the P 3 ¯ c 1 - L i 3 I n F 6 and C 2 / c - L i 3 I n I 6 structures did not reveal any imaginary frequencies, confirming their dynamical stability (Fig. 5 a and b). Similarly, the non-stoichiometric structures L i 5 I n C l 8 , L i 5 I n B r 8 , L i 5 I n I 8 , L i I n 2 C l 9 , L i I n 2 B r 9 , and L i I n 2 I 9 also showed no imaginary frequencies (Fig. S7). 3.4 Ionic conduction and diffusion coefficients The lithium ion conductivities obtained from molecular dynamics simulations with MLIP are 0.55 mS/cm for P 3 ¯ c 1 - L i 3 I n F 6 and 2.18 mS/cm for C 2 / c - L i 3 I n I 6 at 300 K. To be considered a prospective solid-state electrolyte (SSE), a material should exhibit an ionic conductivity of approximately 1 m S / c m . The newly identified P 3 ¯ c 1 - L i 3 I n F 6 meets this requirement and even surpasses L i 3 S c F 6 ( 0.28 m S / c m )[74]. The C 2 / c - L i 3 I n I 6 phase outperforms all of its analogues, including L i 3 Y C l 6 , L i 3 Y B r 6 , L i 3 L a I 6 , and L i 3 I n C l 6 (Table 2 ). Although sulfide-based SSEs generally possess higher ionic conductivities, they have a narrower electrochemical stability window (Table 2). The Arrhenius plots for these L i 3 M X 6 materials are shown in Fig. 6 (a and b). The activation energies calculated from the Arrhenius plots are 259 meV for P 3 ¯ c 1 - L i 3 I n F 6 and 268 meV for C 2 / c - L i 3 I n I 6 . More details for activation energies, ionic conductivities and diffusion coefficients are shown in the Tables S4–S6 in the Supplementary Materials. These activation barriers are lower compared to those of P 3 ¯ c 1 - L i 3 S c C l 6 at 310 meV [74], L i 3 Y C l 6 at 400 meV [7], and C 2 / c - L i 3 L a I 6 [17], along with numerous other halide solid electrolytes [2,5,10]. Some researchers have shown that in general, monoclinic halide SSEs with cubic anion sublattices exhibit higher ionic conductivities, with the general trend being σ m o n o c l i n i c > σ o r t h o r h o m b i c > σ t r i g o n a l [14]. In contrast, L i 3 I n F 6 , which features a hexagonal anionic sublattice with P 3 ¯ c 1 symmetry, demonstrates a lower activation barrier and comparable ionic conductivity. This finding suggests that hexagonal anionic sublattices should also be considered as potential candidates for future research. Additionally, we calculated the activation energies along the a, b, and c directions for L i 3 I n F 6 and L i 3 I n I 6 using Arrhenius fitting; the results are presented in Table S4. As illustrated in Fig. 6 and Table S4, three-dimensional lithium diffusion channels exist with very low activation barriers. All other halide high-ionic conductors lack three-dimensional ionic paths, indicating that P 3 ¯ c 1 - L i 3 I n F 6 is a promising new high-ionic halide conductor. In the case of C 2 / c - L i 3 I n I 6 , the activation barriers differ, with higher values observed in the a and b directions, similar to other C 2 / m - L i 3 M X 6 materials [11]. The lithium ion migration paths in this monoclinic structure include three-dimensional cross-layer pathways (Fig. 6c and d) [7]. However, in all directions, the barrier values are not so high and enable homogeneous diffusion channels (Table S4). The AIMD with MLIP simulation also reveals the temperature stability of these materials until 600 K (Fig. S10), which can be a guide for experimental groups for synthesis. The volume change during heating and cooling show that starting from 600 K the structures undergoes volume distortions, which identify the instability (Fig. S10). 3.5 Electrochemical stability A wide band gap is a crucial characteristic of solid-state electrolytes, because it prevents the shortage of electrodes. Additionally, band gap enables the determination of the electrochemical stability window. The new compound P 3 ¯ c 1 - L i 3 I n F 6 exhibits a band gap of 5 eV, while L i 3 I n I 6 has a band gap of 2.5 eV. However, these band gaps represent only the upper limits of the electrochemical stability windows. To obtain more accurate stability windows, we employed grand canonical phase diagrams. As shown in Fig. 7 (a), P 3 ¯ c 1 - L i 3 I n F 6 has a wide stability window of approximately 4 V, which is consistent with other fluoride solid-state electrolytes [74]. In contrast, the stability window for C 2 / c - L i 3 I n I 6 is 0.7 eV (Fig. 7b), aligning with the stability windows observed for iodides [9]. The stability of these materials against common cathodes such as L i C o O 2 , L i F e P O 4 , and L i M n O 2 was assessed through reaction energy calculations using the grand canonical phase diagram across various voltages (Figs. S9 and S10). It is evident that all reaction energies are small compared to sulfides and are close to known halide solid-state electrolytes [4,17], confirming their stability against the selected cathodes. The combination of high ionic conductivity and stability against both anodes and cathodes makes P 3 ¯ c 1 - L i 3 I n F 6 and C 2 / c - L i 3 I n I 6 promising candidates for experimental exploration and application in all-solid-state electrolytes. 3.6 Mechanical parameters The calculated elastic constants are presented in Table S7. The analysis of elastic stability criteria confirmed the stability of P 3 ¯ c 1 - L i 3 I n F 6 , C 2 / c - L i 3 I n I 6 , and the novel compositions L i 5 I n C l 8 , L i 5 I n B r 8 , L i 5 I n I 8 , L i I n 2 C l 9 , L i I n 2 B r 9 , and L i I n 2 I 9 . Monroe et al. proposed that if the shear modulus of an SSE exceeds twice that of lithium (4.8 GPa at room temperature), lithium dendrites will not form. L i 3 I n F 6 exhibits a shear modulus of 28.08 GPa and a hardness of 5.5 GPa, making it a promising candidate for an SSE. All other mechanically stable materials also meet this criterion (Table S7) [90]. 4 Conclusions In this study, we conducted a detailed structural search for L i 3 M X 6 compositions, where M represents I n , G a , or L a , and X includes F , C l , B r , and I . This comprehensive search involved DMSP calculations and the compilation of novel structures from DeepMind data and existing literature. As a result, we identified two metastable structures: L i 3 I n F 6 with P 3 ¯ c 1 symmetry and L i 3 I n I 6 with C 2 / c symmetry. We also predicted the stable structures with new compositions of L i 5 I n C l 8 , L i 5 I n B r 8 , L i 5 I n I 8 , L i I n 2 C l 9 , L i I n 2 B r 9 and L i I n 2 I 9 . The stability of the new L i 3 M X 6 compound was further confirmed through phonon calculations, which revealed no imaginary frequencies, as well as through elastic stability criteria. Calculations of Li-ion conduction using ab initio molecular dynamics (AIMD) and machine learning interatomic potentials (MLIP) demonstrated that the novel compounds P 3 ¯ c 1 - L i 3 I n F 6 and C 2 / c - L i 3 I n I 6 exhibit high ionic conductivities of 0.55 and 2.18 mS/cm at 300 K, respectively. Ionic conduction path analyses using MD revealed a three-dimensional network, with low activation barriers 259 meV for P 3 ¯ c 1 - L i 3 I n F 6 and 268 meV for C 2 / c - L i 3 I n I 6 . The electrochemical stability windows for L i 3 I n I 6 and L i 3 I n F 6 are 0.7 and 4 V, respectively. Taken together, these materials emerge as promising solid electrolytes for next‐generation all‐solid‐state batteries. In future work, we will extend our investigation to the full range of newly predicted compositions and experimentally verify the stability of novel materials. CRediT authorship contribution statement Olgert L. Dallakyan: Methodology, Investigation. Alexey P. Maltsev: Methodology, Investigation. Ilya V. Chepkasov: Investigation. Misha A. Aghamalyan: Investigation. Areg A. Hunanyan: Investigation. Nane Z. Petrosyan: Investigation. Mikayel S. Chobanyan: Investigation. Mikayel T. Sahakyan: Investigation. Luiza G. Khachatryan: Investigation. Artem R. Oganov: Writing – review & editing, Formal analysis. Hayk A. Zakaryan: Writing – original draft, Supervision, Methodology, Investigation, Conceptualization. Declaration of competing interest The authors declare that they have no known competing financial interests or personal relationships that could have appeared to influence the work reported in this paper. Acknowledgments The work was supported by the Higher Education and Science Committee of Armenia in the frames of the research projects 20TTSG-2F010, 23AA-2F033 and ANSEF (EN-matsc-2660) grant. Convex hull calculations were done on the Oracle HPC clouds provided by the Oracle for Research grant (16576595). The USPEX calculations were performed on the Armenian National Supercomputing Center (ANSCC). MLIP training and ionic conductivity calculations were performed with the support of the Russian Science Foundation (RSF) grant no. 19-72-30043, and using the resources of the Center for Information and Computing of the Research Center for Information and Computational Technologies at Novosibirsk State University. Appendix A Supplementary material Supplementary data to this article can be found online at https://doi.org/10.1016/j.jechem.2025.08.047. Appendix A Supplementary material The following are the Supplementary data to this article: Supplementary Data 1 References [1] M. Fichtner K. Edström E. Ayerbe M. Berecibar A. Bhowmik I.E. Castelli S. Clark R. Dominko M. Erakca A.A. Franco A. Grimaud B. Horstmann A. Latz H. Lorrmann M. Meeus R. Narayan F. Pammer J. Ruhland H. Stein T. Vegge M. Weil Adv. Energy Mater. 2102904 2021 M. Fichtner, K. Edström, E. Ayerbe, M. Berecibar, A. Bhowmik, I.E. Castelli, S. Clark, R. Dominko, M. Erakca, A.A. Franco, A. Grimaud, B. Horstmann, A. Latz, H. Lorrmann, M. Meeus, R. Narayan, F. Pammer, J. Ruhland, H. Stein, T. Vegge, M. Weil, Adv. Energy Mater. 2102904 (2021). [2] A. Manthiram X. Yu S. Wang Nat. Rev. Mater. 2 2017 1 16 A. Manthiram, X. Yu, S. Wang, Nat. Rev. Mater. 2 (2017) 1–16. [3] Y. Wang W.D. Richards S.P. Ong L.J. Miara J.C. Kim Y. Mo G. Ceder Nat. Mater. 14 2015 1026 1031 Y. Wang, W.D. Richards, S.P. Ong, L.J. Miara, J.C. Kim, Y. Mo, G. Ceder, Nat. Mater. 14 (2015) 1026–1031. [4] W. Zhao J. Yi P. He H. Zhou Electrochem. Energy Rev. 2 2019 574 605 W. Zhao, J. Yi, P. He, H. Zhou, Electrochem. Energy Rev. 2 (2019) 574–605. [5] X. Nie J. Hu C. Li Interdiscip. Mater. 2 2023 365 389 X. Nie, J. Hu, C. Li, Interdiscip. Mater. 2 (2023) 365–389. [6] D.C. Ginnings T.E. Phipps J. Am. Chem. Soc. 52 1930 1340 1345 D.C. Ginnings, T.E. Phipps, J. Am. Chem. Soc. 52 (1930) 1340–1345. [7] T. Asano A. Sakai S. Ouchi M. Sakaida A. Miyazaki S. Hasegawa Adv. Mater. 30 2018 1 7 T. Asano, A. Sakai, S. Ouchi, M. Sakaida, A. Miyazaki, S. Hasegawa, Adv. Mater. 30 (2018) 1–7. [8] X. Li J. Liang X. Yang K.R. Adair C. Wang F. Zhao X. Sun Energy Environ. Sci. 13 2020 1429 1461 X. Li, J. Liang, X. Yang, K.R. Adair, C. Wang, F. Zhao, X. Sun, Energy Environ. Sci. 13 (2020) 1429–1461. [9] K. Kim D. Park H.G. Jung K.Y. Chung J.H. Shim B.C. Wood S. Yu Chem. Mater. 33 2021 3669 3677 K. Kim, D. Park, H.G. Jung, K.Y. Chung, J.H. Shim, B.C. Wood, S. Yu, Chem. Mater. 33 (2021) 3669–3677. [10] J. Liang X. Li K.R. Adair X. Sun Acc. Chem. Res. 54 2021 1023 1033 J. Liang, X. Li, K.R. Adair, X. Sun, Acc. Chem. Res. 54 (2021) 1023–1033. [11] X. Li J. Liang J. Luo M. Norouzi Banis C. Wang W. Li S. Deng C. Yu F. Zhao Y. Hu T.K. Sham L. Zhang S. Zhao S. Lu H. Huang R. Li K.R. Adair X. Sun Energy Environ. Sci. 12 2019 2665 2671 X. Li, J. Liang, J. Luo, M. Norouzi Banis, C. Wang, W. Li, S. Deng, C. Yu, F. Zhao, Y. Hu, T.K. Sham, L. Zhang, S. Zhao, S. Lu, H. Huang, R. Li, K.R. Adair, X. Sun, Energy Environ. Sci. 12 (2019) 2665–2671. [12] Y. Tomita K. Yamada H. Ohki T. Okuda Zeitschrift Für Naturforsch. A 53 1998 4 10 Y. Tomita, K. Yamada, H. Ohki, T. Okuda, Zeitschrift Für Naturforsch. A 53 (1998) 4–10. [13] S. Wang Q. Bai A.M. Nolan Y. Liu S. Gong Q. Sun Y. Mo Angew. Chemie - Int. Ed. 58 2019 8039 8043 S. Wang, Q. Bai, A.M. Nolan, Y. Liu, S. Gong, Q. Sun, Y. Mo, Angew. Chemie - Int. Ed. 58 (2019) 8039–8043. [14] C. Wang J. Liang J.T. Kim X. Sun Sci. Adv. 8 2022 1 14 C. Wang, J. Liang, J.T. Kim, X. Sun, Sci. Adv. 8 (2022) 1–14. [15] J. Park D. Han H. Kwak Y. Han Y.J. Choi K.W. Nam Y.S. Jung Chem. Eng. J. 425 2021 130630 J. Park, D. Han, H. Kwak, Y. Han, Y.J. Choi, K.W. Nam, Y.S. Jung, Chem. Eng. J. 425 (2021) 130630. [16] D. Park H. Park Y. Lee S.O. Kim H.G. Jung K.Y. Chung J.H. Shim S. Yu ACS Appl. Mater. Interfaces 12 2020 34806 34814 D. Park, H. Park, Y. Lee, S.O. Kim, H.G. Jung, K.Y. Chung, J.H. Shim, S. Yu, ACS Appl. Mater. Interfaces 12 (2020) 34806–34814. [17] Z. Xu X. Chen K. Liu R. Chen X. Zeng H. Zhu Chem. Mater. 31 2019 7425 7433 Z. Xu, X. Chen, K. Liu, R. Chen, X. Zeng, H. Zhu, Chem. Mater. 31 (2019) 7425–7433. [18] A. Jain S.P. Ong G. Hautier W. Chen W.D. Richards S. Dacek S. Cholia D. Gunter D. Skinner G. Ceder K.A. Persson APL Mater. 1 2013 A. Jain, S.P. Ong, G. Hautier, W. Chen, W.D. Richards, S. Dacek, S. Cholia, D. Gunter, D. Skinner, G. Ceder, K.A. Persson, APL Mater. 1 (2013). [19] S. Kirklin J.E. Saal B. Meredig A. Thompson J.W. Doak M. Aykol S. Rühl C. Wolverton Npj Comput. Mater. 1 2015 S. Kirklin, J.E. Saal, B. Meredig, A. Thompson, J.W. Doak, M. Aykol, S. Rühl, C. Wolverton, Npj Comput. Mater. 1 (2015). [20] A. Merchant S. Batzner S.S. Schoenholz M. Aykol G. Cheon E.D. Cubuk Nature 624 2023 80 85 A. Merchant, S. Batzner, S.S. Schoenholz, M. Aykol, G. Cheon, E.D. Cubuk, Nature 624 (2023) 80–85. [21] F. Hussain J. Zhu H. Xia Y. Zhao W. Xia J. Phys. Chem. C 126 2022 13105 13113 F. Hussain, J. Zhu, H. Xia, Y. Zhao, W. Xia, J. Phys. Chem. C 126 (2022) 13105–13113. [22] L. Zhou C.Y. Kwok A. Shyamsunder Q. Zhang X. Wu L.F. Nazar Energy Environ. Sci. 13 2020 2056 2063 L. Zhou, C.Y. Kwok, A. Shyamsunder, Q. Zhang, X. Wu, L.F. Nazar, Energy Environ. Sci. 13 (2020) 2056–2063. [23] Q. Wang Y. Zhou X. Wang H. Guo S. Gong Z. Yao F. Wu J. Wang S. Ganapathy X. Bai B. Li C. Zhao J. Janek M. Wagemaker Nat. Commun. 15 2024 1 10 Q. Wang, Y. Zhou, X. Wang, H. Guo, S. Gong, Z. Yao, F. Wu, J. Wang, S. Ganapathy, X. Bai, B. Li, C. Zhao, J. Janek, M. Wagemaker, Nat. Commun. 15 (2024) 1–10. [24] A.R. Oganov C.W. Glass J. Chem. Phys. 124 2006 244704 A.R. Oganov, C.W. Glass, J. Chem. Phys. 124 (2006) 244704. [25] A.R. Oganov M. Valle J. Chem. Phys. 130 2009 104504 A.R. Oganov, M. Valle, J. Chem. Phys. 130 (2009) 104504. [26] A.O. Lyakhov A.R. Oganov M. Valle Comput. Phys. Commun. 181 2010 1623 1632 A.O. Lyakhov, A.R. Oganov, M. Valle, Comput. Phys. Commun. 181 (2010) 1623–1632. [27] A.R. Oganov C.J. Pickard Q. Zhu R.J. Needs Nat. Rev. Mater. 4 2019 331 348 A.R. Oganov, C.J. Pickard, Q. Zhu, R.J. Needs, Nat. Rev. Mater. 4 (2019) 331–348. [28] A.V. Iosimovska A.P. Maltsev I.V. Chepkasov A.R. Oganov Appl. Phys. Lett. 124 2024 163904 A. V Iosimovska, A.P. Maltsev, I. V Chepkasov, A.R. Oganov, Appl. Phys. Lett. 124 (2024) 163904. [29] A.P. Maltsev I.V. Chepkasov A.R. Oganov Mater. Today Energy 39 2024 101467 A.P. Maltsev, I. V Chepkasov, A.R. Oganov, Mater. Today Energy 39 (2024) 101467. [30] C.J. Pickard R.J. Needs J. Phys. Condens. Matter 23 2011 53201 C.J. Pickard, R.J. Needs, J. Phys. Condens. Matter 23 (2011) 53201. [31] A. Hunanyan N. Petrosyan H. Zakaryan Appl. Surf. Sci. 672 2024 160814 A. Hunanyan, N. Petrosyan, H. Zakaryan, Appl. Surf. Sci. 672 (2024) 160814. [32] A. Hunanyan, V.M. Aroutiounian, H. Zakaryan, J. Phys. Chem. C 126 (n.d.) 4647–4654. [33] A. Kvashnin, C. Tantardini, H. Zakaryan, Y. Kvashnina, A. Oganov, Chem. Mater. 32 (n.d.) 7028–7035. [34] A.G. Kvashnin H.A. Zakaryan C. Zhao Y. Duan Y.A. Kvashnina C. Xie H. Dong A.R. Oganov J. Phys. Chem. Lett. 9 2018 3470 3477 A.G. Kvashnin, H.A. Zakaryan, C. Zhao, Y. Duan, Y.A. Kvashnina, C. Xie, H. Dong, A.R. Oganov, J. Phys. Chem. Lett. 9 (2018) 3470–3477. [35] H.A. Zakaryan A.G. Kvashnin A.R. Oganov Sci. Rep. 7 2017 10357 H.A. Zakaryan, A.G. Kvashnin, A.R. Oganov, Sci. Rep. 7 (2017) 10357. [36] E.V. Sukhanova A.G. Kvashnin L.A. Bereznikova H.A. Zakaryan M.A. Aghamalyan D.G. Kvashnin Z.I. Popov Appl. Surf. Sci. 589 2022 152971 E. V Sukhanova, A.G. Kvashnin, L.A. Bereznikova, H.A. Zakaryan, M.A. Aghamalyan, D.G. Kvashnin, Z.I. Popov, Appl. Surf. Sci. 589 (2022) 152971. [37] I.V. Chepkasov E.V. Sukhanova A.G. Kvashnin H.A. Zakaryan M.A. Aghamalyan Y.S. Mamasakhlisov A.M. Manakhov Z.I. Popov D.G. Kvashnin Nanomaterials 12 2022 I. V Chepkasov, E. V Sukhanova, A.G. Kvashnin, H.A. Zakaryan, M.A. Aghamalyan, Y.S. Mamasakhlisov, A.M. Manakhov, Z.I. Popov, D.G. Kvashnin, Nanomaterials 12 (2022). [38] C. Xie Q. Zhang H.A. Zakaryan H. Wan N. Liu A.G. Kvashnin A.R. Oganov J. Appl. Phys. 125 2019 205109 C. Xie, Q. Zhang, H.A. Zakaryan, H. Wan, N. Liu, A.G. Kvashnin, A.R. Oganov, J. Appl. Phys. 125 (2019) 205109. [39] G. Hautier C. Fischer V. Ehrlacher A. Jain G. Ceder Inorg. Chem. 50 2011 656 663 G. Hautier, C. Fischer, V. Ehrlacher, A. Jain, G. Ceder, Inorg. Chem. 50 (2011) 656–663. [40] P. Hohenberg W. Kohn Phys. Rev. 136 1964 B864 B871 P. Hohenberg, W. Kohn, Phys. Rev. 136 (1964) B864–B871. [41] Phys. Rev. 140 1965 A1133 A1138 Phys. Rev. 140 (1965) A1133–A1138. [42] G. Kresse J. Hafner Phys. Rev. B 49 1994 14251 14269 G. Kresse, J. Hafner, Phys. Rev. B 49 (1994) 14251–14269. [43] G. Kresse J. Furthmüller Phys. Rev. B 54 1996 11169 11186 G. Kresse, J. Furthmüller, Phys. Rev. B 54 (1996) 11169–11186. [44] D. Joubert Phys. Rev. B - Condens. Matter Mater. Phys. 59 1999 1758 1775 D. Joubert, Phys. Rev. B - Condens. Matter Mater. Phys. 59 (1999) 1758–1775. [45] J.P. Perdew K. Burke M. Ernzerhof Phys. Rev. Lett. 77 1996 3865 3868 John P. Perdew, K. Burke, M. Ernzerhof, Phys. Rev. Lett. 77 (1996) 3865–3868. [46] M.A. Aghamalyan V.M. Aroutiounian E.S. Mamasakhlisov E.V. Sukhanova A.G. Kvashnin Z.I. Popov A.A. Zakaryan J. Contemp. Phys. (Armenian Acad. Sci. 57 2022 170 173 M.A. Aghamalyan, V.M. Aroutiounian, E.S. Mamasakhlisov, E. V Sukhanova, A.G. Kvashnin, Z.I. Popov, A.A. Zakaryan, J. Contemp. Phys. (Armenian Acad. Sci. 57 (2022) 170–173. [47] M.A. Aghamalyan A.A. Hunanyan V.M. Aroutiounian M.S. Aleksanyan A.G. Sayunts H.A. Zakaryan J. Contemp. Phys. (Armen. Acad. Sci.) 55 2020 235 239 M.A. Aghamalyan, A.A. Hunanyan, V.M. Aroutiounian, M.S. Aleksanyan, A.G. Sayunts, H.A. Zakaryan, J. Contemp. Phys. (Armen. Acad. Sci.) 55 (2020) 235–239. [48] C. Tantardini H.A. Zakaryan Z. Han T. Altalhi S.V. Levchenko A.G. Kvashnin I. Yakobson J. Comput. Sci. 82 2024 102402 C. Tantardini, H.A. Zakaryan, Z. Han, T. Altalhi, S. V Levchenko, A.G. Kvashnin, I. Yakobson, J. Comput. Sci. 82 (2024) 102402. [49] A. Wang R. Kingsbury M. McDermott M. Horton A. Jain S.P. Ong S. Dwaraknath K.A. Persson Sci. Rep. 11 2021 A. Wang, R. Kingsbury, M. McDermott, M. Horton, A. Jain, S.P. Ong, S. Dwaraknath, K.A. Persson, Sci. Rep. 11 (2021). [50] A. Togo L. Chaput T. Tadano I. Tanaka J. Phys. Condens. Matter 35 2023 353001 A. Togo, L. Chaput, T. Tadano, I. Tanaka, J. Phys. Condens. Matter 35 (2023) 353001. [51] A. Togo J. Phys. Soc. Jpn. 92 2023 12001 A. Togo, J. Phys. Soc. Jpn. 92 (2023) 12001. [52] L. Xia H. Liu Y. Pei Nanoscale 2024 15481 15501 L. Xia, H. Liu, Y. Pei, Nanoscale (2024) 15481–15501. [53] A.P. Maltsev I.V. Chepkasov A.R. Oganov ACS Appl. Mater. \\& Interfaces 15 2023 42511 42519 A.P. Maltsev, I. V Chepkasov, A.R. Oganov, ACS Appl. Mater. \\& Interfaces 15 (2023) 42511–42519. [54] I.S. Novikov K. Gubaev E.V. Podryabinkin A.V. Shapeev Mach. Learn.: Sci. Technol. 2 2021 025002 I.S. Novikov, K. Gubaev, E. V Podryabinkin, A. V Shapeev, Mach. Learn. Sci. Technol. 2 (2021) 025002. [55] A.V. Shapeev Multiscale Model. & Simul. 14 2016 1153 1173 A. V Shapeev, Multiscale Model. \\& Simul. 14 (2016) 1153–1173. [56] E.V. Podryabinkin A.V. Shapeev Comput. Mater. Sci 140 2017 171 180 E. V Podryabinkin, A. V Shapeev, Comput. Mater. Sci. 140 (2017) 171–180. [57] E.V. Podryabinkin E.V. Tikhonov A.V. Shapeev A.R. Oganov Phys. Rev. B 99 2019 1 7 E. V. Podryabinkin, E. V. Tikhonov, A. V. Shapeev, A.R. Oganov, Phys. Rev. B 99 (2019) 1–7. [58] A.K. Sagotra D. Chu C. Cazorla Phys. Rev. Mater. 3 2019 35405 A.K. Sagotra, D. Chu, C. Cazorla, Phys. Rev. Mater. 3 (2019) 35405. [59] S. Plimpton J. Comput. Phys. 117 1995 1 19 S. Plimpton, J. Comput. Phys. 117 (1995) 1–19. [60] A.P. Thompson H.M. Aktulga R. Berger D.S. Bolintineanu W.M. Brown P.S. Crozier P.J. in’t Veld A. Kohlmeyer S.G. Moore T.D. Nguyen Comput. Phys. Commun. 271 2022 108171 A.P. Thompson, H.M. Aktulga, R. Berger, D.S. Bolintineanu, W.M. Brown, P.S. Crozier, P.J. in’t Veld, A. Kohlmeyer, S.G. Moore, T.D. Nguyen, others, Comput. Phys. Commun. 271 (2022) 108171. [61] W.G. Hoover Phys. Rev. A 34 1986 2499 W.G. Hoover, Phys. Rev. A 34 (1986) 2499. [62] D.J. Evans B.L. Holian J. Chem. Phys. 83 1985 4069 4074 D.J. Evans, B.L. Holian, J. Chem. Phys. 83 (1985) 4069–4074. [63] Y. Zhu X. He Y. Mo ACS Appl. Mater. Interfaces 7 2015 23685 23693 Y. Zhu, X. He, Y. Mo, ACS Appl. Mater. Interfaces 7 (2015) 23685–23693. [64] T. Binninger A. Marcolongo M. Mottet V. Weber T. Laino J. Mater. Chem. A 8 2020 1347 1359 T. Binninger, A. Marcolongo, M. Mottet, V. Weber, T. Laino, J. Mater. Chem. A 8 (2020) 1347–1359. [65] W.D. Richards L.J. Miara Y. Wang J.C. Kim G. Ceder Chem. Mater. 28 2016 266 273 W.D. Richards, L.J. Miara, Y. Wang, J.C. Kim, G. Ceder, Chem. Mater. 28 (2016) 266–273. [66] S.P. Ong W.D. Richards A. Jain G. Hautier M. Kocher S. Cholia D. Gunter V.L. Chevrier K.A. Persson G. Ceder Comput. Mater. Sci 68 2013 314 319 S.P. Ong, W.D. Richards, A. Jain, G. Hautier, M. Kocher, S. Cholia, D. Gunter, V.L. Chevrier, K.A. Persson, G. Ceder, Comput. Mater. Sci. 68 (2013) 314–319. [67] Z. Wu E. Zhao H. Xiang X. Hao X. Liu J. Meng Phys. Rev. B 76 2007 54115 Z. Wu, E. Zhao, H. Xiang, X. Hao, X. Liu, J. Meng, Phys. Rev. B 76 (2007) 54115. [68] Z. Deng Z. Wang I.-H. Chu J. Luo S.P. Ong J. Electrochem. Soc. 163 2015 A67 Z. Deng, Z. Wang, I.-H. Chu, J. Luo, S.P. Ong, J. Electrochem. Soc. 163 (2015) A67. [69] F. Mouhat F.-X. Coudert Phys. Rev. B 90 2014 224104 F. Mouhat, F.-X. Coudert, Phys. Rev. B 90 (2014) 224104. [70] K.H. Park K. Kaup A. Assoud Q. Zhang X. Wu L.F. Nazar ACS Energy Lett. 2020 533 539 K.H. Park, K. Kaup, A. Assoud, Q. Zhang, X. Wu, L.F. Nazar, ACS Energy Lett. (2020) 533–539. [71] M. Feinauer H. Euchner M. Fichtner M. Anji Reddy ACS Appl. Energy Mater. 2 2019 7196 7203 M. Feinauer, H. Euchner, M. Fichtner, M. Anji Reddy, ACS Appl. Energy Mater. 2 (2019) 7196–7203. [72] T. Esaka R. Okuyama H. Iwahara Solid State Ion. 34 1989 201 205 T. Esaka, R. Okuyama, H. Iwahara, Solid State Ionics 34 (1989) 201–205. [73] S.Y. Kim K. Kaup K.H. Park A. Assoud L. Zhou J. Liu X. Wu L.F. Nazar ACS Mater. Lett. 3 2021 930 938 S.Y. Kim, K. Kaup, K.H. Park, A. Assoud, L. Zhou, J. Liu, X. Wu, L.F. Nazar, ACS Mater. Lett. 3 (2021) 930–938. [74] J. Liu S. Wang Y. Qie Q. Sun Mater. Today Energy 21 2021 100719 J. Liu, S. Wang, Y. Qie, Q. Sun, Mater. Today Energy 21 (2021) 100719. [75] T. Zhao M.A. Kraft W.G. Zeier Inorg. Chem. 62 2023 11737 11745 T. Zhao, M.A. Kraft, W.G. Zeier, Inorg. Chem. 62 (2023) 11737–11745. [76] A.K. Tyagi J. Köhler Mater. Res. Bull. 35 2000 135 141 A.K. Tyagi, J. Köhler, Mater. Res. Bull. 35 (2000) 135–141. [77] C. Chen D.T. Nguyen S.J. Lee N.A. Baker A.S. Karakoti L. Lauw C. Owen K.T. Mueller B.A. Bilodeau V. Murugesan M. Troyer J. Am. Chem. Soc. 146 2024 20009 20018 C. Chen, D.T. Nguyen, S.J. Lee, N.A. Baker, A.S. Karakoti, L. Lauw, C. Owen, K.T. Mueller, B.A. Bilodeau, V. Murugesan, M. Troyer, J. Am. Chem. Soc. 146 (2024) 20009–20018. [78] H.D. Lutz P. Kuske A. Pfitzner H.-J. Steiner Zeitschrift Für Naturforsch. B 47 1992 1687 1692 H.D. Lutz, P. Kuske, A. Pfitzner, H.-J. Steiner, Zeitschrift Für Naturforsch. B 47 (1992) 1687–1692. [79] J.-C. Champarnaud-Mesjard B. Frit Acta Crystallogr. Sect. B 34 1978 736 741 J.-C. Champarnaud-Mesjard, B. Frit, Acta Crystallogr. Sect. B 34 (1978) 736–741. [80] G. Shwetha G. Vaitheeswaran V. Kanchana A.I.P. Conf Proc 1665 2015 120026 G. Shwetha, G. Vaitheeswaran, V. Kanchana, AIP Conf. Proc. 1665 (2015) 120026. [81] P. Rocquet M. Couzi A. Tressaud J.P. Chaminade C. Hauw J. Phys. C Solid State Phys. 18 1985 6555 P. Rocquet, M. Couzi, A. Tressaud, J.P. Chaminade, C. Hauw, J. Phys. C Solid State Phys. 18 (1985) 6555. [82] W. Hönle G. Miller A. Simon J. Solid State Chem. 75 1988 147 155 W. Hönle, G. Miller, A. Simon, J. Solid State Chem. 75 (1988) 147–155. [83] W. Hönle B. Hettich A. Simon Zeitschrift Für Naturforsch. B 42 1987 248 250 W. Hönle, B. Hettich, A. Simon, Zeitschrift Für Naturforsch. B 42 (1987) 248–250. [84] M. Hamadène F. Balegroune A. Guehria-Laïdoudi J. Grannec J. Ravez J. Chem. Crystallogr. 36 2006 1 5 M. Hamadène, F. Balegroune, A. Guehria-Laïdoudi, J. Grannec, J. Ravez, J. Chem. Crystallogr. 36 (2006) 1–5. [85] M. Hamadène J. Ravez J. Grannec A. Laïdoudi-Guehria Mater. Lett. 27 1996 33 39 M. Hamadène, J. Ravez, J. Grannec, A. Laïdoudi-Guehria, Mater. Lett. 27 (1996) 33–39. [86] P. Gravereau J.P. Chaminade T. Gaewdang J. Grannec M. Pouchard P. Hagenmuller Acta Crystallogr. Sect. C 48 1992 769 771 P. Gravereau, J.P. Chaminade, T. Gaewdang, J. Grannec, M. Pouchard, P. Hagenmuller, Acta Crystallogr. Sect. C 48 (1992) 769–771. [87] Q. Yang, J. Xu, Y. Wang, X. Fu, R. Xiao, H. Li, (2024). [88] Z. Li H. Dong B. Zhang ACS Appl. Mater. Interfaces 15 2023 42481 42489 Z. Li, H. Dong, B. Zhang, ACS Appl. Mater. Interfaces 15 (2023) 42481–42489. [89] Y. Liu S. Wang A.M. Nolan C. Ling Y. Mo Adv. Energy Mater. 10 2020 1 11 Y. Liu, S. Wang, A.M. Nolan, C. Ling, Y. Mo, Adv. Energy Mater. 10 (2020) 1–11. [90] C. Monroe J. Newman J. Electrochem. Soc. 152 2005 A396 C. Monroe, J. Newman, J. Electrochem. Soc. 152 (2005) A396.",
      "coredata": {
        "eid": "1-s2.0-S2095495625007077",
        "dc:description": "Halide solid-state electrolytes have gained significant attention in recent years due to their high ionic conductivity, making them promising candidates for future all-solid-state batteries. Recent studies have identified numerous crystal structures with the L i 3 M X 6 composition, although many remain unexplored across various chemical systems. In this research, we developed a comprehensive method to examine all conceivable space groups and structures within the L i - M - X system, where M includes In, Ga, and La, and X includes F, Cl, Br, and I. Our findings revealed two metastable structures: L i 3 I n F 6 with P 3 ¯ c 1 symmetry and L i 3 I n I 6 with C 2 / c symmetry, exhibiting ionic conductivities of 0.55 and 2.18 mS/cm at 300 K, respectively. Notably, the trigonal symmetry of L i 3 I n F 6 demonstrates that high ionic conductivities are not limited to monoclinic structures but can also be achieved with trigonal symmetries. The electrochemical stability windows, mechanical properties, and reaction energies of these materials with known cathodes suggest their potential for use in all-solid-state batteries. Additionally, we predicted the stability of novel materials, including L i 5 I n C l 8 , L i 5 I n B r 8 , L i 5 I n I 8 , L i I n 2 C l 9 , L i I n 2 B r 9 , and L i I n 2 I 9 .",
        "openArchiveArticle": "false",
        "prism:coverDate": "2026-01-31",
        "openaccessUserLicense": null,
        "prism:aggregationType": "Journal",
        "prism:url": "https://api.elsevier.com/content/article/pii/S2095495625007077",
        "dc:creator": [
          {
            "@_fa": "true",
            "$": "Dallakyan, Olgert L."
          },
          {
            "@_fa": "true",
            "$": "Maltsev, Alexey P."
          },
          {
            "@_fa": "true",
            "$": "Chepkasov, Ilya V."
          },
          {
            "@_fa": "true",
            "$": "Aghamalyan, Misha A."
          },
          {
            "@_fa": "true",
            "$": "Hunanyan, Areg A."
          },
          {
            "@_fa": "true",
            "$": "Petrosyan, Nane Z."
          },
          {
            "@_fa": "true",
            "$": "Chobanyan, Mikayel S."
          },
          {
            "@_fa": "true",
            "$": "Sahakyan, Mikayel T."
          },
          {
            "@_fa": "true",
            "$": "Khachatryan, Luiza G."
          },
          {
            "@_fa": "true",
            "$": "Oganov, Artem R."
          },
          {
            "@_fa": "true",
            "$": "Zakaryan, Hayk A."
          }
        ],
        "link": [
          {
            "@_fa": "true",
            "@rel": "self",
            "@href": "https://api.elsevier.com/content/article/pii/S2095495625007077"
          },
          {
            "@_fa": "true",
            "@rel": "scidir",
            "@href": "https://www.sciencedirect.com/science/article/pii/S2095495625007077"
          }
        ],
        "dc:format": "application/json",
        "openaccessType": null,
        "pii": "S2095-4956(25)00707-7",
        "prism:volume": "112",
        "prism:publisher": "Science Press and Dalian Institute of Chemical Physics, Chinese Academy of Sciences. Published by Elsevier B.V. and Science Press. All rights are reserved, including those for text and data mining, AI training, and similar technologies.",
        "dc:title": "Computational screening for novel solid-state electrolytes in Li3MX6 composition",
        "prism:copyright": "© 2025 Science Press and Dalian Institute of Chemical Physics, Chinese Academy of Sciences. Published by Elsevier B.V. and Science Press. All rights are reserved, including those for text and data mining, AI training, and similar technologies.",
        "openaccess": "0",
        "prism:issn": "20954956",
        "dcterms:subject": [
          {
            "@_fa": "true",
            "$": "Solid state electrolyte"
          },
          {
            "@_fa": "true",
            "$": "Halides"
          },
          {
            "@_fa": "true",
            "$": "Novel materials"
          },
          {
            "@_fa": "true",
            "$": "DFT"
          }
        ],
        "openaccessArticle": "false",
        "prism:publicationName": "Journal of Energy Chemistry",
        "openaccessSponsorType": null,
        "prism:pageRange": "495-504",
        "prism:endingPage": "504",
        "pubType": "fla",
        "prism:coverDisplayDate": "January 2026",
        "prism:doi": "10.1016/j.jechem.2025.08.047",
        "prism:startingPage": "495",
        "dc:identifier": "doi:10.1016/j.jechem.2025.08.047",
        "openaccessSponsorName": null
      },
      "objects": {
        "object": [
          {
            "@category": "standard",
            "@height": "200",
            "@width": "420",
            "@_fa": "true",
            "$": "https://api.elsevier.com/content/object/eid/1-s2.0-S2095495625007077-ga1.jpg?httpAccept=%2A%2F%2A",
            "@multimediatype": "JPEG image file",
            "@type": "IMAGE-DOWNSAMPLED",
            "@size": "28794",
            "@ref": "ga1",
            "@mimetype": "image/jpeg"
          },
          {
            "@category": "standard",
            "@height": "493",
            "@width": "625",
            "@_fa": "true",
            "$": "https://api.elsevier.com/content/object/eid/1-s2.0-S2095495625007077-gr1.jpg?httpAccept=%2A%2F%2A",
            "@multimediatype": "JPEG image file",
            "@type": "IMAGE-DOWNSAMPLED",
            "@size": "89681",
            "@ref": "gr1",
            "@mimetype": "image/jpeg"
          },
          {
            "@category": "standard",
            "@height": "385",
            "@width": "535",
            "@_fa": "true",
            "$": "https://api.elsevier.com/content/object/eid/1-s2.0-S2095495625007077-gr2.jpg?httpAccept=%2A%2F%2A",
            "@multimediatype": "JPEG image file",
            "@type": "IMAGE-DOWNSAMPLED",
            "@size": "48176",
            "@ref": "gr2",
            "@mimetype": "image/jpeg"
          },
          {
            "@category": "standard",
            "@height": "389",
            "@width": "535",
            "@_fa": "true",
            "$": "https://api.elsevier.com/content/object/eid/1-s2.0-S2095495625007077-gr3.jpg?httpAccept=%2A%2F%2A",
            "@multimediatype": "JPEG image file",
            "@type": "IMAGE-DOWNSAMPLED",
            "@size": "53201",
            "@ref": "gr3",
            "@mimetype": "image/jpeg"
          },
          {
            "@category": "standard",
            "@height": "207",
            "@width": "534",
            "@_fa": "true",
            "$": "https://api.elsevier.com/content/object/eid/1-s2.0-S2095495625007077-gr4.jpg?httpAccept=%2A%2F%2A",
            "@multimediatype": "JPEG image file",
            "@type": "IMAGE-DOWNSAMPLED",
            "@size": "31331",
            "@ref": "gr4",
            "@mimetype": "image/jpeg"
          },
          {
            "@category": "standard",
            "@height": "228",
            "@width": "625",
            "@_fa": "true",
            "$": "https://api.elsevier.com/content/object/eid/1-s2.0-S2095495625007077-gr5.jpg?httpAccept=%2A%2F%2A",
            "@multimediatype": "JPEG image file",
            "@type": "IMAGE-DOWNSAMPLED",
            "@size": "62620",
            "@ref": "gr5",
            "@mimetype": "image/jpeg"
          },
          {
            "@category": "standard",
            "@height": "527",
            "@width": "714",
            "@_fa": "true",
            "$": "https://api.elsevier.com/content/object/eid/1-s2.0-S2095495625007077-gr6.jpg?httpAccept=%2A%2F%2A",
            "@multimediatype": "JPEG image file",
            "@type": "IMAGE-DOWNSAMPLED",
            "@size": "78003",
            "@ref": "gr6",
            "@mimetype": "image/jpeg"
          },
          {
            "@category": "standard",
            "@height": "190",
            "@width": "714",
            "@_fa": "true",
            "$": "https://api.elsevier.com/content/object/eid/1-s2.0-S2095495625007077-gr7.jpg?httpAccept=%2A%2F%2A",
            "@multimediatype": "JPEG image file",
            "@type": "IMAGE-DOWNSAMPLED",
            "@size": "30193",
            "@ref": "gr7",
            "@mimetype": "image/jpeg"
          },
          {
            "@category": "thumbnail",
            "@height": "104",
            "@width": "219",
            "@_fa": "true",
            "$": "https://api.elsevier.com/content/object/eid/1-s2.0-S2095495625007077-ga1.sml?httpAccept=%2A%2F%2A",
            "@multimediatype": "GIF image file",
            "@type": "IMAGE-THUMBNAIL",
            "@size": "11582",
            "@ref": "ga1",
            "@mimetype": "image/gif"
          },
          {
            "@category": "thumbnail",
            "@height": "164",
            "@width": "208",
            "@_fa": "true",
            "$": "https://api.elsevier.com/content/object/eid/1-s2.0-S2095495625007077-gr1.sml?httpAccept=%2A%2F%2A",
            "@multimediatype": "GIF image file",
            "@type": "IMAGE-THUMBNAIL",
            "@size": "14724",
            "@ref": "gr1",
            "@mimetype": "image/gif"
          },
          {
            "@category": "thumbnail",
            "@height": "158",
            "@width": "219",
            "@_fa": "true",
            "$": "https://api.elsevier.com/content/object/eid/1-s2.0-S2095495625007077-gr2.sml?httpAccept=%2A%2F%2A",
            "@multimediatype": "GIF image file",
            "@type": "IMAGE-THUMBNAIL",
            "@size": "12482",
            "@ref": "gr2",
            "@mimetype": "image/gif"
          },
          {
            "@category": "thumbnail",
            "@height": "159",
            "@width": "219",
            "@_fa": "true",
            "$": "https://api.elsevier.com/content/object/eid/1-s2.0-S2095495625007077-gr3.sml?httpAccept=%2A%2F%2A",
            "@multimediatype": "GIF image file",
            "@type": "IMAGE-THUMBNAIL",
            "@size": "13097",
            "@ref": "gr3",
            "@mimetype": "image/gif"
          },
          {
            "@category": "thumbnail",
            "@height": "85",
            "@width": "219",
            "@_fa": "true",
            "$": "https://api.elsevier.com/content/object/eid/1-s2.0-S2095495625007077-gr4.sml?httpAccept=%2A%2F%2A",
            "@multimediatype": "GIF image file",
            "@type": "IMAGE-THUMBNAIL",
            "@size": "10103",
            "@ref": "gr4",
            "@mimetype": "image/gif"
          },
          {
            "@category": "thumbnail",
            "@height": "80",
            "@width": "219",
            "@_fa": "true",
            "$": "https://api.elsevier.com/content/object/eid/1-s2.0-S2095495625007077-gr5.sml?httpAccept=%2A%2F%2A",
            "@multimediatype": "GIF image file",
            "@type": "IMAGE-THUMBNAIL",
            "@size": "12215",
            "@ref": "gr5",
            "@mimetype": "image/gif"
          },
          {
            "@category": "thumbnail",
            "@height": "162",
            "@width": "219",
            "@_fa": "true",
            "$": "https://api.elsevier.com/content/object/eid/1-s2.0-S2095495625007077-gr6.sml?httpAccept=%2A%2F%2A",
            "@multimediatype": "GIF image file",
            "@type": "IMAGE-THUMBNAIL",
            "@size": "11739",
            "@ref": "gr6",
            "@mimetype": "image/gif"
          },
          {
            "@category": "thumbnail",
            "@height": "58",
            "@width": "219",
            "@_fa": "true",
            "$": "https://api.elsevier.com/content/object/eid/1-s2.0-S2095495625007077-gr7.sml?httpAccept=%2A%2F%2A",
            "@multimediatype": "GIF image file",
            "@type": "IMAGE-THUMBNAIL",
            "@size": "4864",
            "@ref": "gr7",
            "@mimetype": "image/gif"
          },
          {
            "@category": "high",
            "@height": "886",
            "@width": "1862",
            "@_fa": "true",
            "$": "https://api.elsevier.com/content/object/eid/1-s2.0-S2095495625007077-ga1_lrg.jpg?httpAccept=%2A%2F%2A",
            "@multimediatype": "JPEG image file",
            "@type": "IMAGE-HIGH-RES",
            "@size": "165710",
            "@ref": "ga1",
            "@mimetype": "image/jpeg"
          },
          {
            "@category": "high",
            "@height": "1309",
            "@width": "1660",
            "@_fa": "true",
            "$": "https://api.elsevier.com/content/object/eid/1-s2.0-S2095495625007077-gr1_lrg.jpg?httpAccept=%2A%2F%2A",
            "@multimediatype": "JPEG image file",
            "@type": "IMAGE-HIGH-RES",
            "@size": "243502",
            "@ref": "gr1",
            "@mimetype": "image/jpeg"
          },
          {
            "@category": "high",
            "@height": "1706",
            "@width": "2368",
            "@_fa": "true",
            "$": "https://api.elsevier.com/content/object/eid/1-s2.0-S2095495625007077-gr2_lrg.jpg?httpAccept=%2A%2F%2A",
            "@multimediatype": "JPEG image file",
            "@type": "IMAGE-HIGH-RES",
            "@size": "244652",
            "@ref": "gr2",
            "@mimetype": "image/jpeg"
          },
          {
            "@category": "high",
            "@height": "1722",
            "@width": "2368",
            "@_fa": "true",
            "$": "https://api.elsevier.com/content/object/eid/1-s2.0-S2095495625007077-gr3_lrg.jpg?httpAccept=%2A%2F%2A",
            "@multimediatype": "JPEG image file",
            "@type": "IMAGE-HIGH-RES",
            "@size": "258511",
            "@ref": "gr3",
            "@mimetype": "image/jpeg"
          },
          {
            "@category": "high",
            "@height": "915",
            "@width": "2365",
            "@_fa": "true",
            "$": "https://api.elsevier.com/content/object/eid/1-s2.0-S2095495625007077-gr4_lrg.jpg?httpAccept=%2A%2F%2A",
            "@multimediatype": "JPEG image file",
            "@type": "IMAGE-HIGH-RES",
            "@size": "181545",
            "@ref": "gr4",
            "@mimetype": "image/jpeg"
          },
          {
            "@category": "high",
            "@height": "634",
            "@width": "1737",
            "@_fa": "true",
            "$": "https://api.elsevier.com/content/object/eid/1-s2.0-S2095495625007077-gr5_lrg.jpg?httpAccept=%2A%2F%2A",
            "@multimediatype": "JPEG image file",
            "@type": "IMAGE-HIGH-RES",
            "@size": "231548",
            "@ref": "gr5",
            "@mimetype": "image/jpeg"
          },
          {
            "@category": "high",
            "@height": "1400",
            "@width": "1896",
            "@_fa": "true",
            "$": "https://api.elsevier.com/content/object/eid/1-s2.0-S2095495625007077-gr6_lrg.jpg?httpAccept=%2A%2F%2A",
            "@multimediatype": "JPEG image file",
            "@type": "IMAGE-HIGH-RES",
            "@size": "223300",
            "@ref": "gr6",
            "@mimetype": "image/jpeg"
          },
          {
            "@category": "high",
            "@height": "505",
            "@width": "1896",
            "@_fa": "true",
            "$": "https://api.elsevier.com/content/object/eid/1-s2.0-S2095495625007077-gr7_lrg.jpg?httpAccept=%2A%2F%2A",
            "@multimediatype": "JPEG image file",
            "@type": "IMAGE-HIGH-RES",
            "@size": "77395",
            "@ref": "gr7",
            "@mimetype": "image/jpeg"
          },
          {
            "@category": "standard",
            "@_fa": "true",
            "$": "https://api.elsevier.com/content/object/eid/1-s2.0-S2095495625007077-mmc1.docx?httpAccept=%2A%2F%2A",
            "@multimediatype": "Microsoft Word file",
            "@type": "APPLICATION",
            "@size": "20941443",
            "@ref": "mmc1",
            "@mimetype": "application/word"
          },
          {
            "@category": "thumbnail",
            "@_fa": "true",
            "$": "https://api.elsevier.com/content/object/eid/1-s2.0-S2095495625007077-si1.svg?httpAccept=%2A%2F%2A",
            "@multimediatype": "Scalable Vector Graphics file",
            "@type": "ALTIMG",
            "@size": "12701",
            "@ref": "si1",
            "@mimetype": "image/svg+xml"
          },
          {
            "@category": "thumbnail",
            "@_fa": "true",
            "$": "https://api.elsevier.com/content/object/eid/1-s2.0-S2095495625007077-si10.svg?httpAccept=%2A%2F%2A",
            "@multimediatype": "Scalable Vector Graphics file",
            "@type": "ALTIMG",
            "@size": "6915",
            "@ref": "si10",
            "@mimetype": "image/svg+xml"
          },
          {
            "@category": "thumbnail",
            "@_fa": "true",
            "$": "https://api.elsevier.com/content/object/eid/1-s2.0-S2095495625007077-si100.svg?httpAccept=%2A%2F%2A",
            "@multimediatype": "Scalable Vector Graphics file",
            "@type": "ALTIMG",
            "@size": "4511",
            "@ref": "si100",
            "@mimetype": "image/svg+xml"
          },
          {
            "@category": "thumbnail",
            "@_fa": "true",
            "$": "https://api.elsevier.com/content/object/eid/1-s2.0-S2095495625007077-si101.svg?httpAccept=%2A%2F%2A",
            "@multimediatype": "Scalable Vector Graphics file",
            "@type": "ALTIMG",
            "@size": "5680",
            "@ref": "si101",
            "@mimetype": "image/svg+xml"
          },
          {
            "@category": "thumbnail",
            "@_fa": "true",
            "$": "https://api.elsevier.com/content/object/eid/1-s2.0-S2095495625007077-si102.svg?httpAccept=%2A%2F%2A",
            "@multimediatype": "Scalable Vector Graphics file",
            "@type": "ALTIMG",
            "@size": "4394",
            "@ref": "si102",
            "@mimetype": "image/svg+xml"
          },
          {
            "@category": "thumbnail",
            "@_fa": "true",
            "$": "https://api.elsevier.com/content/object/eid/1-s2.0-S2095495625007077-si103.svg?httpAccept=%2A%2F%2A",
            "@multimediatype": "Scalable Vector Graphics file",
            "@type": "ALTIMG",
            "@size": "5807",
            "@ref": "si103",
            "@mimetype": "image/svg+xml"
          },
          {
            "@category": "thumbnail",
            "@_fa": "true",
            "$": "https://api.elsevier.com/content/object/eid/1-s2.0-S2095495625007077-si104.svg?httpAccept=%2A%2F%2A",
            "@multimediatype": "Scalable Vector Graphics file",
            "@type": "ALTIMG",
            "@size": "6926",
            "@ref": "si104",
            "@mimetype": "image/svg+xml"
          },
          {
            "@category": "thumbnail",
            "@_fa": "true",
            "$": "https://api.elsevier.com/content/object/eid/1-s2.0-S2095495625007077-si105.svg?httpAccept=%2A%2F%2A",
            "@multimediatype": "Scalable Vector Graphics file",
            "@type": "ALTIMG",
            "@size": "8573",
            "@ref": "si105",
            "@mimetype": "image/svg+xml"
          },
          {
            "@category": "thumbnail",
            "@_fa": "true",
            "$": "https://api.elsevier.com/content/object/eid/1-s2.0-S2095495625007077-si106.svg?httpAccept=%2A%2F%2A",
            "@multimediatype": "Scalable Vector Graphics file",
            "@type": "ALTIMG",
            "@size": "11716",
            "@ref": "si106",
            "@mimetype": "image/svg+xml"
          },
          {
            "@category": "thumbnail",
            "@_fa": "true",
            "$": "https://api.elsevier.com/content/object/eid/1-s2.0-S2095495625007077-si107.svg?httpAccept=%2A%2F%2A",
            "@multimediatype": "Scalable Vector Graphics file",
            "@type": "ALTIMG",
            "@size": "7377",
            "@ref": "si107",
            "@mimetype": "image/svg+xml"
          },
          {
            "@category": "thumbnail",
            "@_fa": "true",
            "$": "https://api.elsevier.com/content/object/eid/1-s2.0-S2095495625007077-si108.svg?httpAccept=%2A%2F%2A",
            "@multimediatype": "Scalable Vector Graphics file",
            "@type": "ALTIMG",
            "@size": "25581",
            "@ref": "si108",
            "@mimetype": "image/svg+xml"
          },
          {
            "@category": "thumbnail",
            "@_fa": "true",
            "$": "https://api.elsevier.com/content/object/eid/1-s2.0-S2095495625007077-si109.svg?httpAccept=%2A%2F%2A",
            "@multimediatype": "Scalable Vector Graphics file",
            "@type": "ALTIMG",
            "@size": "1409",
            "@ref": "si109",
            "@mimetype": "image/svg+xml"
          },
          {
            "@category": "thumbnail",
            "@_fa": "true",
            "$": "https://api.elsevier.com/content/object/eid/1-s2.0-S2095495625007077-si11.svg?httpAccept=%2A%2F%2A",
            "@multimediatype": "Scalable Vector Graphics file",
            "@type": "ALTIMG",
            "@size": "7682",
            "@ref": "si11",
            "@mimetype": "image/svg+xml"
          },
          {
            "@category": "thumbnail",
            "@_fa": "true",
            "$": "https://api.elsevier.com/content/object/eid/1-s2.0-S2095495625007077-si110.svg?httpAccept=%2A%2F%2A",
            "@multimediatype": "Scalable Vector Graphics file",
            "@type": "ALTIMG",
            "@size": "1630",
            "@ref": "si110",
            "@mimetype": "image/svg+xml"
          },
          {
            "@category": "thumbnail",
            "@_fa": "true",
            "$": "https://api.elsevier.com/content/object/eid/1-s2.0-S2095495625007077-si111.svg?httpAccept=%2A%2F%2A",
            "@multimediatype": "Scalable Vector Graphics file",
            "@type": "ALTIMG",
            "@size": "3469",
            "@ref": "si111",
            "@mimetype": "image/svg+xml"
          },
          {
            "@category": "thumbnail",
            "@_fa": "true",
            "$": "https://api.elsevier.com/content/object/eid/1-s2.0-S2095495625007077-si112.svg?httpAccept=%2A%2F%2A",
            "@multimediatype": "Scalable Vector Graphics file",
            "@type": "ALTIMG",
            "@size": "6592",
            "@ref": "si112",
            "@mimetype": "image/svg+xml"
          },
          {
            "@category": "thumbnail",
            "@_fa": "true",
            "$": "https://api.elsevier.com/content/object/eid/1-s2.0-S2095495625007077-si113.svg?httpAccept=%2A%2F%2A",
            "@multimediatype": "Scalable Vector Graphics file",
            "@type": "ALTIMG",
            "@size": "4193",
            "@ref": "si113",
            "@mimetype": "image/svg+xml"
          },
          {
            "@category": "thumbnail",
            "@_fa": "true",
            "$": "https://api.elsevier.com/content/object/eid/1-s2.0-S2095495625007077-si114.svg?httpAccept=%2A%2F%2A",
            "@multimediatype": "Scalable Vector Graphics file",
            "@type": "ALTIMG",
            "@size": "1321",
            "@ref": "si114",
            "@mimetype": "image/svg+xml"
          },
          {
            "@category": "thumbnail",
            "@_fa": "true",
            "$": "https://api.elsevier.com/content/object/eid/1-s2.0-S2095495625007077-si115.svg?httpAccept=%2A%2F%2A",
            "@multimediatype": "Scalable Vector Graphics file",
            "@type": "ALTIMG",
            "@size": "1569",
            "@ref": "si115",
            "@mimetype": "image/svg+xml"
          },
          {
            "@category": "thumbnail",
            "@_fa": "true",
            "$": "https://api.elsevier.com/content/object/eid/1-s2.0-S2095495625007077-si116.svg?httpAccept=%2A%2F%2A",
            "@multimediatype": "Scalable Vector Graphics file",
            "@type": "ALTIMG",
            "@size": "11922",
            "@ref": "si116",
            "@mimetype": "image/svg+xml"
          },
          {
            "@category": "thumbnail",
            "@_fa": "true",
            "$": "https://api.elsevier.com/content/object/eid/1-s2.0-S2095495625007077-si117.svg?httpAccept=%2A%2F%2A",
            "@multimediatype": "Scalable Vector Graphics file",
            "@type": "ALTIMG",
            "@size": "1708",
            "@ref": "si117",
            "@mimetype": "image/svg+xml"
          },
          {
            "@category": "thumbnail",
            "@_fa": "true",
            "$": "https://api.elsevier.com/content/object/eid/1-s2.0-S2095495625007077-si118.svg?httpAccept=%2A%2F%2A",
            "@multimediatype": "Scalable Vector Graphics file",
            "@type": "ALTIMG",
            "@size": "2661",
            "@ref": "si118",
            "@mimetype": "image/svg+xml"
          },
          {
            "@category": "thumbnail",
            "@_fa": "true",
            "$": "https://api.elsevier.com/content/object/eid/1-s2.0-S2095495625007077-si119.svg?httpAccept=%2A%2F%2A",
            "@multimediatype": "Scalable Vector Graphics file",
            "@type": "ALTIMG",
            "@size": "1564",
            "@ref": "si119",
            "@mimetype": "image/svg+xml"
          },
          {
            "@category": "thumbnail",
            "@_fa": "true",
            "$": "https://api.elsevier.com/content/object/eid/1-s2.0-S2095495625007077-si12.svg?httpAccept=%2A%2F%2A",
            "@multimediatype": "Scalable Vector Graphics file",
            "@type": "ALTIMG",
            "@size": "6284",
            "@ref": "si12",
            "@mimetype": "image/svg+xml"
          },
          {
            "@category": "thumbnail",
            "@_fa": "true",
            "$": "https://api.elsevier.com/content/object/eid/1-s2.0-S2095495625007077-si120.svg?httpAccept=%2A%2F%2A",
            "@multimediatype": "Scalable Vector Graphics file",
            "@type": "ALTIMG",
            "@size": "3831",
            "@ref": "si120",
            "@mimetype": "image/svg+xml"
          },
          {
            "@category": "thumbnail",
            "@_fa": "true",
            "$": "https://api.elsevier.com/content/object/eid/1-s2.0-S2095495625007077-si121.svg?httpAccept=%2A%2F%2A",
            "@multimediatype": "Scalable Vector Graphics file",
            "@type": "ALTIMG",
            "@size": "3131",
            "@ref": "si121",
            "@mimetype": "image/svg+xml"
          },
          {
            "@category": "thumbnail",
            "@_fa": "true",
            "$": "https://api.elsevier.com/content/object/eid/1-s2.0-S2095495625007077-si122.svg?httpAccept=%2A%2F%2A",
            "@multimediatype": "Scalable Vector Graphics file",
            "@type": "ALTIMG",
            "@size": "1124",
            "@ref": "si122",
            "@mimetype": "image/svg+xml"
          },
          {
            "@category": "thumbnail",
            "@_fa": "true",
            "$": "https://api.elsevier.com/content/object/eid/1-s2.0-S2095495625007077-si123.svg?httpAccept=%2A%2F%2A",
            "@multimediatype": "Scalable Vector Graphics file",
            "@type": "ALTIMG",
            "@size": "2716",
            "@ref": "si123",
            "@mimetype": "image/svg+xml"
          },
          {
            "@category": "thumbnail",
            "@_fa": "true",
            "$": "https://api.elsevier.com/content/object/eid/1-s2.0-S2095495625007077-si124.svg?httpAccept=%2A%2F%2A",
            "@multimediatype": "Scalable Vector Graphics file",
            "@type": "ALTIMG",
            "@size": "8379",
            "@ref": "si124",
            "@mimetype": "image/svg+xml"
          },
          {
            "@category": "thumbnail",
            "@_fa": "true",
            "$": "https://api.elsevier.com/content/object/eid/1-s2.0-S2095495625007077-si125.svg?httpAccept=%2A%2F%2A",
            "@multimediatype": "Scalable Vector Graphics file",
            "@type": "ALTIMG",
            "@size": "3418",
            "@ref": "si125",
            "@mimetype": "image/svg+xml"
          },
          {
            "@category": "thumbnail",
            "@_fa": "true",
            "$": "https://api.elsevier.com/content/object/eid/1-s2.0-S2095495625007077-si126.svg?httpAccept=%2A%2F%2A",
            "@multimediatype": "Scalable Vector Graphics file",
            "@type": "ALTIMG",
            "@size": "14608",
            "@ref": "si126",
            "@mimetype": "image/svg+xml"
          },
          {
            "@category": "thumbnail",
            "@_fa": "true",
            "$": "https://api.elsevier.com/content/object/eid/1-s2.0-S2095495625007077-si127.svg?httpAccept=%2A%2F%2A",
            "@multimediatype": "Scalable Vector Graphics file",
            "@type": "ALTIMG",
            "@size": "1840",
            "@ref": "si127",
            "@mimetype": "image/svg+xml"
          },
          {
            "@category": "thumbnail",
            "@_fa": "true",
            "$": "https://api.elsevier.com/content/object/eid/1-s2.0-S2095495625007077-si128.svg?httpAccept=%2A%2F%2A",
            "@multimediatype": "Scalable Vector Graphics file",
            "@type": "ALTIMG",
            "@size": "1283",
            "@ref": "si128",
            "@mimetype": "image/svg+xml"
          },
          {
            "@category": "thumbnail",
            "@_fa": "true",
            "$": "https://api.elsevier.com/content/object/eid/1-s2.0-S2095495625007077-si129.svg?httpAccept=%2A%2F%2A",
            "@multimediatype": "Scalable Vector Graphics file",
            "@type": "ALTIMG",
            "@size": "2953",
            "@ref": "si129",
            "@mimetype": "image/svg+xml"
          },
          {
            "@category": "thumbnail",
            "@_fa": "true",
            "$": "https://api.elsevier.com/content/object/eid/1-s2.0-S2095495625007077-si13.svg?httpAccept=%2A%2F%2A",
            "@multimediatype": "Scalable Vector Graphics file",
            "@type": "ALTIMG",
            "@size": "7984",
            "@ref": "si13",
            "@mimetype": "image/svg+xml"
          },
          {
            "@category": "thumbnail",
            "@_fa": "true",
            "$": "https://api.elsevier.com/content/object/eid/1-s2.0-S2095495625007077-si130.svg?httpAccept=%2A%2F%2A",
            "@multimediatype": "Scalable Vector Graphics file",
            "@type": "ALTIMG",
            "@size": "7786",
            "@ref": "si130",
            "@mimetype": "image/svg+xml"
          },
          {
            "@category": "thumbnail",
            "@_fa": "true",
            "$": "https://api.elsevier.com/content/object/eid/1-s2.0-S2095495625007077-si131.svg?httpAccept=%2A%2F%2A",
            "@multimediatype": "Scalable Vector Graphics file",
            "@type": "ALTIMG",
            "@size": "2947",
            "@ref": "si131",
            "@mimetype": "image/svg+xml"
          },
          {
            "@category": "thumbnail",
            "@_fa": "true",
            "$": "https://api.elsevier.com/content/object/eid/1-s2.0-S2095495625007077-si132.svg?httpAccept=%2A%2F%2A",
            "@multimediatype": "Scalable Vector Graphics file",
            "@type": "ALTIMG",
            "@size": "11009",
            "@ref": "si132",
            "@mimetype": "image/svg+xml"
          },
          {
            "@category": "thumbnail",
            "@_fa": "true",
            "$": "https://api.elsevier.com/content/object/eid/1-s2.0-S2095495625007077-si133.svg?httpAccept=%2A%2F%2A",
            "@multimediatype": "Scalable Vector Graphics file",
            "@type": "ALTIMG",
            "@size": "8948",
            "@ref": "si133",
            "@mimetype": "image/svg+xml"
          },
          {
            "@category": "thumbnail",
            "@_fa": "true",
            "$": "https://api.elsevier.com/content/object/eid/1-s2.0-S2095495625007077-si134.svg?httpAccept=%2A%2F%2A",
            "@multimediatype": "Scalable Vector Graphics file",
            "@type": "ALTIMG",
            "@size": "12714",
            "@ref": "si134",
            "@mimetype": "image/svg+xml"
          },
          {
            "@category": "thumbnail",
            "@_fa": "true",
            "$": "https://api.elsevier.com/content/object/eid/1-s2.0-S2095495625007077-si135.svg?httpAccept=%2A%2F%2A",
            "@multimediatype": "Scalable Vector Graphics file",
            "@type": "ALTIMG",
            "@size": "12238",
            "@ref": "si135",
            "@mimetype": "image/svg+xml"
          },
          {
            "@category": "thumbnail",
            "@_fa": "true",
            "$": "https://api.elsevier.com/content/object/eid/1-s2.0-S2095495625007077-si136.svg?httpAccept=%2A%2F%2A",
            "@multimediatype": "Scalable Vector Graphics file",
            "@type": "ALTIMG",
            "@size": "13349",
            "@ref": "si136",
            "@mimetype": "image/svg+xml"
          },
          {
            "@category": "thumbnail",
            "@_fa": "true",
            "$": "https://api.elsevier.com/content/object/eid/1-s2.0-S2095495625007077-si137.svg?httpAccept=%2A%2F%2A",
            "@multimediatype": "Scalable Vector Graphics file",
            "@type": "ALTIMG",
            "@size": "13533",
            "@ref": "si137",
            "@mimetype": "image/svg+xml"
          },
          {
            "@category": "thumbnail",
            "@_fa": "true",
            "$": "https://api.elsevier.com/content/object/eid/1-s2.0-S2095495625007077-si138.svg?httpAccept=%2A%2F%2A",
            "@multimediatype": "Scalable Vector Graphics file",
            "@type": "ALTIMG",
            "@size": "10415",
            "@ref": "si138",
            "@mimetype": "image/svg+xml"
          },
          {
            "@category": "thumbnail",
            "@_fa": "true",
            "$": "https://api.elsevier.com/content/object/eid/1-s2.0-S2095495625007077-si139.svg?httpAccept=%2A%2F%2A",
            "@multimediatype": "Scalable Vector Graphics file",
            "@type": "ALTIMG",
            "@size": "3603",
            "@ref": "si139",
            "@mimetype": "image/svg+xml"
          },
          {
            "@category": "thumbnail",
            "@_fa": "true",
            "$": "https://api.elsevier.com/content/object/eid/1-s2.0-S2095495625007077-si14.svg?httpAccept=%2A%2F%2A",
            "@multimediatype": "Scalable Vector Graphics file",
            "@type": "ALTIMG",
            "@size": "8215",
            "@ref": "si14",
            "@mimetype": "image/svg+xml"
          },
          {
            "@category": "thumbnail",
            "@_fa": "true",
            "$": "https://api.elsevier.com/content/object/eid/1-s2.0-S2095495625007077-si140.svg?httpAccept=%2A%2F%2A",
            "@multimediatype": "Scalable Vector Graphics file",
            "@type": "ALTIMG",
            "@size": "8492",
            "@ref": "si140",
            "@mimetype": "image/svg+xml"
          },
          {
            "@category": "thumbnail",
            "@_fa": "true",
            "$": "https://api.elsevier.com/content/object/eid/1-s2.0-S2095495625007077-si141.svg?httpAccept=%2A%2F%2A",
            "@multimediatype": "Scalable Vector Graphics file",
            "@type": "ALTIMG",
            "@size": "11589",
            "@ref": "si141",
            "@mimetype": "image/svg+xml"
          },
          {
            "@category": "thumbnail",
            "@_fa": "true",
            "$": "https://api.elsevier.com/content/object/eid/1-s2.0-S2095495625007077-si142.svg?httpAccept=%2A%2F%2A",
            "@multimediatype": "Scalable Vector Graphics file",
            "@type": "ALTIMG",
            "@size": "3869",
            "@ref": "si142",
            "@mimetype": "image/svg+xml"
          },
          {
            "@category": "thumbnail",
            "@_fa": "true",
            "$": "https://api.elsevier.com/content/object/eid/1-s2.0-S2095495625007077-si143.svg?httpAccept=%2A%2F%2A",
            "@multimediatype": "Scalable Vector Graphics file",
            "@type": "ALTIMG",
            "@size": "5188",
            "@ref": "si143",
            "@mimetype": "image/svg+xml"
          },
          {
            "@category": "thumbnail",
            "@_fa": "true",
            "$": "https://api.elsevier.com/content/object/eid/1-s2.0-S2095495625007077-si144.svg?httpAccept=%2A%2F%2A",
            "@multimediatype": "Scalable Vector Graphics file",
            "@type": "ALTIMG",
            "@size": "4169",
            "@ref": "si144",
            "@mimetype": "image/svg+xml"
          },
          {
            "@category": "thumbnail",
            "@_fa": "true",
            "$": "https://api.elsevier.com/content/object/eid/1-s2.0-S2095495625007077-si145.svg?httpAccept=%2A%2F%2A",
            "@multimediatype": "Scalable Vector Graphics file",
            "@type": "ALTIMG",
            "@size": "3936",
            "@ref": "si145",
            "@mimetype": "image/svg+xml"
          },
          {
            "@category": "thumbnail",
            "@_fa": "true",
            "$": "https://api.elsevier.com/content/object/eid/1-s2.0-S2095495625007077-si146.svg?httpAccept=%2A%2F%2A",
            "@multimediatype": "Scalable Vector Graphics file",
            "@type": "ALTIMG",
            "@size": "4928",
            "@ref": "si146",
            "@mimetype": "image/svg+xml"
          },
          {
            "@category": "thumbnail",
            "@_fa": "true",
            "$": "https://api.elsevier.com/content/object/eid/1-s2.0-S2095495625007077-si147.svg?httpAccept=%2A%2F%2A",
            "@multimediatype": "Scalable Vector Graphics file",
            "@type": "ALTIMG",
            "@size": "7889",
            "@ref": "si147",
            "@mimetype": "image/svg+xml"
          },
          {
            "@category": "thumbnail",
            "@_fa": "true",
            "$": "https://api.elsevier.com/content/object/eid/1-s2.0-S2095495625007077-si148.svg?httpAccept=%2A%2F%2A",
            "@multimediatype": "Scalable Vector Graphics file",
            "@type": "ALTIMG",
            "@size": "866",
            "@ref": "si148",
            "@mimetype": "image/svg+xml"
          },
          {
            "@category": "thumbnail",
            "@_fa": "true",
            "$": "https://api.elsevier.com/content/object/eid/1-s2.0-S2095495625007077-si149.svg?httpAccept=%2A%2F%2A",
            "@multimediatype": "Scalable Vector Graphics file",
            "@type": "ALTIMG",
            "@size": "1361",
            "@ref": "si149",
            "@mimetype": "image/svg+xml"
          },
          {
            "@category": "thumbnail",
            "@_fa": "true",
            "$": "https://api.elsevier.com/content/object/eid/1-s2.0-S2095495625007077-si15.svg?httpAccept=%2A%2F%2A",
            "@multimediatype": "Scalable Vector Graphics file",
            "@type": "ALTIMG",
            "@size": "7899",
            "@ref": "si15",
            "@mimetype": "image/svg+xml"
          },
          {
            "@category": "thumbnail",
            "@_fa": "true",
            "$": "https://api.elsevier.com/content/object/eid/1-s2.0-S2095495625007077-si150.svg?httpAccept=%2A%2F%2A",
            "@multimediatype": "Scalable Vector Graphics file",
            "@type": "ALTIMG",
            "@size": "1026",
            "@ref": "si150",
            "@mimetype": "image/svg+xml"
          },
          {
            "@category": "thumbnail",
            "@_fa": "true",
            "$": "https://api.elsevier.com/content/object/eid/1-s2.0-S2095495625007077-si151.svg?httpAccept=%2A%2F%2A",
            "@multimediatype": "Scalable Vector Graphics file",
            "@type": "ALTIMG",
            "@size": "12199",
            "@ref": "si151",
            "@mimetype": "image/svg+xml"
          },
          {
            "@category": "thumbnail",
            "@_fa": "true",
            "$": "https://api.elsevier.com/content/object/eid/1-s2.0-S2095495625007077-si152.svg?httpAccept=%2A%2F%2A",
            "@multimediatype": "Scalable Vector Graphics file",
            "@type": "ALTIMG",
            "@size": "3919",
            "@ref": "si152",
            "@mimetype": "image/svg+xml"
          },
          {
            "@category": "thumbnail",
            "@_fa": "true",
            "$": "https://api.elsevier.com/content/object/eid/1-s2.0-S2095495625007077-si153.svg?httpAccept=%2A%2F%2A",
            "@multimediatype": "Scalable Vector Graphics file",
            "@type": "ALTIMG",
            "@size": "4135",
            "@ref": "si153",
            "@mimetype": "image/svg+xml"
          },
          {
            "@category": "thumbnail",
            "@_fa": "true",
            "$": "https://api.elsevier.com/content/object/eid/1-s2.0-S2095495625007077-si154.svg?httpAccept=%2A%2F%2A",
            "@multimediatype": "Scalable Vector Graphics file",
            "@type": "ALTIMG",
            "@size": "3145",
            "@ref": "si154",
            "@mimetype": "image/svg+xml"
          },
          {
            "@category": "thumbnail",
            "@_fa": "true",
            "$": "https://api.elsevier.com/content/object/eid/1-s2.0-S2095495625007077-si155.svg?httpAccept=%2A%2F%2A",
            "@multimediatype": "Scalable Vector Graphics file",
            "@type": "ALTIMG",
            "@size": "2007",
            "@ref": "si155",
            "@mimetype": "image/svg+xml"
          },
          {
            "@category": "thumbnail",
            "@_fa": "true",
            "$": "https://api.elsevier.com/content/object/eid/1-s2.0-S2095495625007077-si156.svg?httpAccept=%2A%2F%2A",
            "@multimediatype": "Scalable Vector Graphics file",
            "@type": "ALTIMG",
            "@size": "3039",
            "@ref": "si156",
            "@mimetype": "image/svg+xml"
          },
          {
            "@category": "thumbnail",
            "@_fa": "true",
            "$": "https://api.elsevier.com/content/object/eid/1-s2.0-S2095495625007077-si157.svg?httpAccept=%2A%2F%2A",
            "@multimediatype": "Scalable Vector Graphics file",
            "@type": "ALTIMG",
            "@size": "9850",
            "@ref": "si157",
            "@mimetype": "image/svg+xml"
          },
          {
            "@category": "thumbnail",
            "@_fa": "true",
            "$": "https://api.elsevier.com/content/object/eid/1-s2.0-S2095495625007077-si158.svg?httpAccept=%2A%2F%2A",
            "@multimediatype": "Scalable Vector Graphics file",
            "@type": "ALTIMG",
            "@size": "8455",
            "@ref": "si158",
            "@mimetype": "image/svg+xml"
          },
          {
            "@category": "thumbnail",
            "@_fa": "true",
            "$": "https://api.elsevier.com/content/object/eid/1-s2.0-S2095495625007077-si159.svg?httpAccept=%2A%2F%2A",
            "@multimediatype": "Scalable Vector Graphics file",
            "@type": "ALTIMG",
            "@size": "9173",
            "@ref": "si159",
            "@mimetype": "image/svg+xml"
          },
          {
            "@category": "thumbnail",
            "@_fa": "true",
            "$": "https://api.elsevier.com/content/object/eid/1-s2.0-S2095495625007077-si16.svg?httpAccept=%2A%2F%2A",
            "@multimediatype": "Scalable Vector Graphics file",
            "@type": "ALTIMG",
            "@size": "8802",
            "@ref": "si16",
            "@mimetype": "image/svg+xml"
          },
          {
            "@category": "thumbnail",
            "@_fa": "true",
            "$": "https://api.elsevier.com/content/object/eid/1-s2.0-S2095495625007077-si160.svg?httpAccept=%2A%2F%2A",
            "@multimediatype": "Scalable Vector Graphics file",
            "@type": "ALTIMG",
            "@size": "7701",
            "@ref": "si160",
            "@mimetype": "image/svg+xml"
          },
          {
            "@category": "thumbnail",
            "@_fa": "true",
            "$": "https://api.elsevier.com/content/object/eid/1-s2.0-S2095495625007077-si161.svg?httpAccept=%2A%2F%2A",
            "@multimediatype": "Scalable Vector Graphics file",
            "@type": "ALTIMG",
            "@size": "6702",
            "@ref": "si161",
            "@mimetype": "image/svg+xml"
          },
          {
            "@category": "thumbnail",
            "@_fa": "true",
            "$": "https://api.elsevier.com/content/object/eid/1-s2.0-S2095495625007077-si162.svg?httpAccept=%2A%2F%2A",
            "@multimediatype": "Scalable Vector Graphics file",
            "@type": "ALTIMG",
            "@size": "3630",
            "@ref": "si162",
            "@mimetype": "image/svg+xml"
          },
          {
            "@category": "thumbnail",
            "@_fa": "true",
            "$": "https://api.elsevier.com/content/object/eid/1-s2.0-S2095495625007077-si163.svg?httpAccept=%2A%2F%2A",
            "@multimediatype": "Scalable Vector Graphics file",
            "@type": "ALTIMG",
            "@size": "4264",
            "@ref": "si163",
            "@mimetype": "image/svg+xml"
          },
          {
            "@category": "thumbnail",
            "@_fa": "true",
            "$": "https://api.elsevier.com/content/object/eid/1-s2.0-S2095495625007077-si164.svg?httpAccept=%2A%2F%2A",
            "@multimediatype": "Scalable Vector Graphics file",
            "@type": "ALTIMG",
            "@size": "5935",
            "@ref": "si164",
            "@mimetype": "image/svg+xml"
          },
          {
            "@category": "thumbnail",
            "@_fa": "true",
            "$": "https://api.elsevier.com/content/object/eid/1-s2.0-S2095495625007077-si165.svg?httpAccept=%2A%2F%2A",
            "@multimediatype": "Scalable Vector Graphics file",
            "@type": "ALTIMG",
            "@size": "2739",
            "@ref": "si165",
            "@mimetype": "image/svg+xml"
          },
          {
            "@category": "thumbnail",
            "@_fa": "true",
            "$": "https://api.elsevier.com/content/object/eid/1-s2.0-S2095495625007077-si166.svg?httpAccept=%2A%2F%2A",
            "@multimediatype": "Scalable Vector Graphics file",
            "@type": "ALTIMG",
            "@size": "5878",
            "@ref": "si166",
            "@mimetype": "image/svg+xml"
          },
          {
            "@category": "thumbnail",
            "@_fa": "true",
            "$": "https://api.elsevier.com/content/object/eid/1-s2.0-S2095495625007077-si167.svg?httpAccept=%2A%2F%2A",
            "@multimediatype": "Scalable Vector Graphics file",
            "@type": "ALTIMG",
            "@size": "3479",
            "@ref": "si167",
            "@mimetype": "image/svg+xml"
          },
          {
            "@category": "thumbnail",
            "@_fa": "true",
            "$": "https://api.elsevier.com/content/object/eid/1-s2.0-S2095495625007077-si168.svg?httpAccept=%2A%2F%2A",
            "@multimediatype": "Scalable Vector Graphics file",
            "@type": "ALTIMG",
            "@size": "10551",
            "@ref": "si168",
            "@mimetype": "image/svg+xml"
          },
          {
            "@category": "thumbnail",
            "@_fa": "true",
            "$": "https://api.elsevier.com/content/object/eid/1-s2.0-S2095495625007077-si169.svg?httpAccept=%2A%2F%2A",
            "@multimediatype": "Scalable Vector Graphics file",
            "@type": "ALTIMG",
            "@size": "8195",
            "@ref": "si169",
            "@mimetype": "image/svg+xml"
          },
          {
            "@category": "thumbnail",
            "@_fa": "true",
            "$": "https://api.elsevier.com/content/object/eid/1-s2.0-S2095495625007077-si17.svg?httpAccept=%2A%2F%2A",
            "@multimediatype": "Scalable Vector Graphics file",
            "@type": "ALTIMG",
            "@size": "7157",
            "@ref": "si17",
            "@mimetype": "image/svg+xml"
          },
          {
            "@category": "thumbnail",
            "@_fa": "true",
            "$": "https://api.elsevier.com/content/object/eid/1-s2.0-S2095495625007077-si170.svg?httpAccept=%2A%2F%2A",
            "@multimediatype": "Scalable Vector Graphics file",
            "@type": "ALTIMG",
            "@size": "3189",
            "@ref": "si170",
            "@mimetype": "image/svg+xml"
          },
          {
            "@category": "thumbnail",
            "@_fa": "true",
            "$": "https://api.elsevier.com/content/object/eid/1-s2.0-S2095495625007077-si171.svg?httpAccept=%2A%2F%2A",
            "@multimediatype": "Scalable Vector Graphics file",
            "@type": "ALTIMG",
            "@size": "5420",
            "@ref": "si171",
            "@mimetype": "image/svg+xml"
          },
          {
            "@category": "thumbnail",
            "@_fa": "true",
            "$": "https://api.elsevier.com/content/object/eid/1-s2.0-S2095495625007077-si172.svg?httpAccept=%2A%2F%2A",
            "@multimediatype": "Scalable Vector Graphics file",
            "@type": "ALTIMG",
            "@size": "7707",
            "@ref": "si172",
            "@mimetype": "image/svg+xml"
          },
          {
            "@category": "thumbnail",
            "@_fa": "true",
            "$": "https://api.elsevier.com/content/object/eid/1-s2.0-S2095495625007077-si173.svg?httpAccept=%2A%2F%2A",
            "@multimediatype": "Scalable Vector Graphics file",
            "@type": "ALTIMG",
            "@size": "12913",
            "@ref": "si173",
            "@mimetype": "image/svg+xml"
          },
          {
            "@category": "thumbnail",
            "@_fa": "true",
            "$": "https://api.elsevier.com/content/object/eid/1-s2.0-S2095495625007077-si174.svg?httpAccept=%2A%2F%2A",
            "@multimediatype": "Scalable Vector Graphics file",
            "@type": "ALTIMG",
            "@size": "10122",
            "@ref": "si174",
            "@mimetype": "image/svg+xml"
          },
          {
            "@category": "thumbnail",
            "@_fa": "true",
            "$": "https://api.elsevier.com/content/object/eid/1-s2.0-S2095495625007077-si175.svg?httpAccept=%2A%2F%2A",
            "@multimediatype": "Scalable Vector Graphics file",
            "@type": "ALTIMG",
            "@size": "16184",
            "@ref": "si175",
            "@mimetype": "image/svg+xml"
          },
          {
            "@category": "thumbnail",
            "@_fa": "true",
            "$": "https://api.elsevier.com/content/object/eid/1-s2.0-S2095495625007077-si176.svg?httpAccept=%2A%2F%2A",
            "@multimediatype": "Scalable Vector Graphics file",
            "@type": "ALTIMG",
            "@size": "11078",
            "@ref": "si176",
            "@mimetype": "image/svg+xml"
          },
          {
            "@category": "thumbnail",
            "@_fa": "true",
            "$": "https://api.elsevier.com/content/object/eid/1-s2.0-S2095495625007077-si177.svg?httpAccept=%2A%2F%2A",
            "@multimediatype": "Scalable Vector Graphics file",
            "@type": "ALTIMG",
            "@size": "5526",
            "@ref": "si177",
            "@mimetype": "image/svg+xml"
          },
          {
            "@category": "thumbnail",
            "@_fa": "true",
            "$": "https://api.elsevier.com/content/object/eid/1-s2.0-S2095495625007077-si178.svg?httpAccept=%2A%2F%2A",
            "@multimediatype": "Scalable Vector Graphics file",
            "@type": "ALTIMG",
            "@size": "6204",
            "@ref": "si178",
            "@mimetype": "image/svg+xml"
          },
          {
            "@category": "thumbnail",
            "@_fa": "true",
            "$": "https://api.elsevier.com/content/object/eid/1-s2.0-S2095495625007077-si179.svg?httpAccept=%2A%2F%2A",
            "@multimediatype": "Scalable Vector Graphics file",
            "@type": "ALTIMG",
            "@size": "5675",
            "@ref": "si179",
            "@mimetype": "image/svg+xml"
          },
          {
            "@category": "thumbnail",
            "@_fa": "true",
            "$": "https://api.elsevier.com/content/object/eid/1-s2.0-S2095495625007077-si18.svg?httpAccept=%2A%2F%2A",
            "@multimediatype": "Scalable Vector Graphics file",
            "@type": "ALTIMG",
            "@size": "7238",
            "@ref": "si18",
            "@mimetype": "image/svg+xml"
          },
          {
            "@category": "thumbnail",
            "@_fa": "true",
            "$": "https://api.elsevier.com/content/object/eid/1-s2.0-S2095495625007077-si180.svg?httpAccept=%2A%2F%2A",
            "@multimediatype": "Scalable Vector Graphics file",
            "@type": "ALTIMG",
            "@size": "2532",
            "@ref": "si180",
            "@mimetype": "image/svg+xml"
          },
          {
            "@category": "thumbnail",
            "@_fa": "true",
            "$": "https://api.elsevier.com/content/object/eid/1-s2.0-S2095495625007077-si181.svg?httpAccept=%2A%2F%2A",
            "@multimediatype": "Scalable Vector Graphics file",
            "@type": "ALTIMG",
            "@size": "1399",
            "@ref": "si181",
            "@mimetype": "image/svg+xml"
          },
          {
            "@category": "thumbnail",
            "@_fa": "true",
            "$": "https://api.elsevier.com/content/object/eid/1-s2.0-S2095495625007077-si182.svg?httpAccept=%2A%2F%2A",
            "@multimediatype": "Scalable Vector Graphics file",
            "@type": "ALTIMG",
            "@size": "2115",
            "@ref": "si182",
            "@mimetype": "image/svg+xml"
          },
          {
            "@category": "thumbnail",
            "@_fa": "true",
            "$": "https://api.elsevier.com/content/object/eid/1-s2.0-S2095495625007077-si183.svg?httpAccept=%2A%2F%2A",
            "@multimediatype": "Scalable Vector Graphics file",
            "@type": "ALTIMG",
            "@size": "2591",
            "@ref": "si183",
            "@mimetype": "image/svg+xml"
          },
          {
            "@category": "thumbnail",
            "@_fa": "true",
            "$": "https://api.elsevier.com/content/object/eid/1-s2.0-S2095495625007077-si184.svg?httpAccept=%2A%2F%2A",
            "@multimediatype": "Scalable Vector Graphics file",
            "@type": "ALTIMG",
            "@size": "1065",
            "@ref": "si184",
            "@mimetype": "image/svg+xml"
          },
          {
            "@category": "thumbnail",
            "@_fa": "true",
            "$": "https://api.elsevier.com/content/object/eid/1-s2.0-S2095495625007077-si19.svg?httpAccept=%2A%2F%2A",
            "@multimediatype": "Scalable Vector Graphics file",
            "@type": "ALTIMG",
            "@size": "6638",
            "@ref": "si19",
            "@mimetype": "image/svg+xml"
          },
          {
            "@category": "thumbnail",
            "@_fa": "true",
            "$": "https://api.elsevier.com/content/object/eid/1-s2.0-S2095495625007077-si2.svg?httpAccept=%2A%2F%2A",
            "@multimediatype": "Scalable Vector Graphics file",
            "@type": "ALTIMG",
            "@size": "10334",
            "@ref": "si2",
            "@mimetype": "image/svg+xml"
          },
          {
            "@category": "thumbnail",
            "@_fa": "true",
            "$": "https://api.elsevier.com/content/object/eid/1-s2.0-S2095495625007077-si20.svg?httpAccept=%2A%2F%2A",
            "@multimediatype": "Scalable Vector Graphics file",
            "@type": "ALTIMG",
            "@size": "4521",
            "@ref": "si20",
            "@mimetype": "image/svg+xml"
          },
          {
            "@category": "thumbnail",
            "@_fa": "true",
            "$": "https://api.elsevier.com/content/object/eid/1-s2.0-S2095495625007077-si21.svg?httpAccept=%2A%2F%2A",
            "@multimediatype": "Scalable Vector Graphics file",
            "@type": "ALTIMG",
            "@size": "7573",
            "@ref": "si21",
            "@mimetype": "image/svg+xml"
          },
          {
            "@category": "thumbnail",
            "@_fa": "true",
            "$": "https://api.elsevier.com/content/object/eid/1-s2.0-S2095495625007077-si22.svg?httpAccept=%2A%2F%2A",
            "@multimediatype": "Scalable Vector Graphics file",
            "@type": "ALTIMG",
            "@size": "6789",
            "@ref": "si22",
            "@mimetype": "image/svg+xml"
          },
          {
            "@category": "thumbnail",
            "@_fa": "true",
            "$": "https://api.elsevier.com/content/object/eid/1-s2.0-S2095495625007077-si23.svg?httpAccept=%2A%2F%2A",
            "@multimediatype": "Scalable Vector Graphics file",
            "@type": "ALTIMG",
            "@size": "7557",
            "@ref": "si23",
            "@mimetype": "image/svg+xml"
          },
          {
            "@category": "thumbnail",
            "@_fa": "true",
            "$": "https://api.elsevier.com/content/object/eid/1-s2.0-S2095495625007077-si24.svg?httpAccept=%2A%2F%2A",
            "@multimediatype": "Scalable Vector Graphics file",
            "@type": "ALTIMG",
            "@size": "9903",
            "@ref": "si24",
            "@mimetype": "image/svg+xml"
          },
          {
            "@category": "thumbnail",
            "@_fa": "true",
            "$": "https://api.elsevier.com/content/object/eid/1-s2.0-S2095495625007077-si25.svg?httpAccept=%2A%2F%2A",
            "@multimediatype": "Scalable Vector Graphics file",
            "@type": "ALTIMG",
            "@size": "6718",
            "@ref": "si25",
            "@mimetype": "image/svg+xml"
          },
          {
            "@category": "thumbnail",
            "@_fa": "true",
            "$": "https://api.elsevier.com/content/object/eid/1-s2.0-S2095495625007077-si26.svg?httpAccept=%2A%2F%2A",
            "@multimediatype": "Scalable Vector Graphics file",
            "@type": "ALTIMG",
            "@size": "8259",
            "@ref": "si26",
            "@mimetype": "image/svg+xml"
          },
          {
            "@category": "thumbnail",
            "@_fa": "true",
            "$": "https://api.elsevier.com/content/object/eid/1-s2.0-S2095495625007077-si27.svg?httpAccept=%2A%2F%2A",
            "@multimediatype": "Scalable Vector Graphics file",
            "@type": "ALTIMG",
            "@size": "7489",
            "@ref": "si27",
            "@mimetype": "image/svg+xml"
          },
          {
            "@category": "thumbnail",
            "@_fa": "true",
            "$": "https://api.elsevier.com/content/object/eid/1-s2.0-S2095495625007077-si28.svg?httpAccept=%2A%2F%2A",
            "@multimediatype": "Scalable Vector Graphics file",
            "@type": "ALTIMG",
            "@size": "8053",
            "@ref": "si28",
            "@mimetype": "image/svg+xml"
          },
          {
            "@category": "thumbnail",
            "@_fa": "true",
            "$": "https://api.elsevier.com/content/object/eid/1-s2.0-S2095495625007077-si29.svg?httpAccept=%2A%2F%2A",
            "@multimediatype": "Scalable Vector Graphics file",
            "@type": "ALTIMG",
            "@size": "8237",
            "@ref": "si29",
            "@mimetype": "image/svg+xml"
          },
          {
            "@category": "thumbnail",
            "@_fa": "true",
            "$": "https://api.elsevier.com/content/object/eid/1-s2.0-S2095495625007077-si3.svg?httpAccept=%2A%2F%2A",
            "@multimediatype": "Scalable Vector Graphics file",
            "@type": "ALTIMG",
            "@size": "6472",
            "@ref": "si3",
            "@mimetype": "image/svg+xml"
          },
          {
            "@category": "thumbnail",
            "@_fa": "true",
            "$": "https://api.elsevier.com/content/object/eid/1-s2.0-S2095495625007077-si30.svg?httpAccept=%2A%2F%2A",
            "@multimediatype": "Scalable Vector Graphics file",
            "@type": "ALTIMG",
            "@size": "6979",
            "@ref": "si30",
            "@mimetype": "image/svg+xml"
          },
          {
            "@category": "thumbnail",
            "@_fa": "true",
            "$": "https://api.elsevier.com/content/object/eid/1-s2.0-S2095495625007077-si31.svg?httpAccept=%2A%2F%2A",
            "@multimediatype": "Scalable Vector Graphics file",
            "@type": "ALTIMG",
            "@size": "7587",
            "@ref": "si31",
            "@mimetype": "image/svg+xml"
          },
          {
            "@category": "thumbnail",
            "@_fa": "true",
            "$": "https://api.elsevier.com/content/object/eid/1-s2.0-S2095495625007077-si32.svg?httpAccept=%2A%2F%2A",
            "@multimediatype": "Scalable Vector Graphics file",
            "@type": "ALTIMG",
            "@size": "6790",
            "@ref": "si32",
            "@mimetype": "image/svg+xml"
          },
          {
            "@category": "thumbnail",
            "@_fa": "true",
            "$": "https://api.elsevier.com/content/object/eid/1-s2.0-S2095495625007077-si33.svg?httpAccept=%2A%2F%2A",
            "@multimediatype": "Scalable Vector Graphics file",
            "@type": "ALTIMG",
            "@size": "6289",
            "@ref": "si33",
            "@mimetype": "image/svg+xml"
          },
          {
            "@category": "thumbnail",
            "@_fa": "true",
            "$": "https://api.elsevier.com/content/object/eid/1-s2.0-S2095495625007077-si34.svg?httpAccept=%2A%2F%2A",
            "@multimediatype": "Scalable Vector Graphics file",
            "@type": "ALTIMG",
            "@size": "8509",
            "@ref": "si34",
            "@mimetype": "image/svg+xml"
          },
          {
            "@category": "thumbnail",
            "@_fa": "true",
            "$": "https://api.elsevier.com/content/object/eid/1-s2.0-S2095495625007077-si35.svg?httpAccept=%2A%2F%2A",
            "@multimediatype": "Scalable Vector Graphics file",
            "@type": "ALTIMG",
            "@size": "6619",
            "@ref": "si35",
            "@mimetype": "image/svg+xml"
          },
          {
            "@category": "thumbnail",
            "@_fa": "true",
            "$": "https://api.elsevier.com/content/object/eid/1-s2.0-S2095495625007077-si36.svg?httpAccept=%2A%2F%2A",
            "@multimediatype": "Scalable Vector Graphics file",
            "@type": "ALTIMG",
            "@size": "7279",
            "@ref": "si36",
            "@mimetype": "image/svg+xml"
          },
          {
            "@category": "thumbnail",
            "@_fa": "true",
            "$": "https://api.elsevier.com/content/object/eid/1-s2.0-S2095495625007077-si37.svg?httpAccept=%2A%2F%2A",
            "@multimediatype": "Scalable Vector Graphics file",
            "@type": "ALTIMG",
            "@size": "7399",
            "@ref": "si37",
            "@mimetype": "image/svg+xml"
          },
          {
            "@category": "thumbnail",
            "@_fa": "true",
            "$": "https://api.elsevier.com/content/object/eid/1-s2.0-S2095495625007077-si38.svg?httpAccept=%2A%2F%2A",
            "@multimediatype": "Scalable Vector Graphics file",
            "@type": "ALTIMG",
            "@size": "6174",
            "@ref": "si38",
            "@mimetype": "image/svg+xml"
          },
          {
            "@category": "thumbnail",
            "@_fa": "true",
            "$": "https://api.elsevier.com/content/object/eid/1-s2.0-S2095495625007077-si39.svg?httpAccept=%2A%2F%2A",
            "@multimediatype": "Scalable Vector Graphics file",
            "@type": "ALTIMG",
            "@size": "4991",
            "@ref": "si39",
            "@mimetype": "image/svg+xml"
          },
          {
            "@category": "thumbnail",
            "@_fa": "true",
            "$": "https://api.elsevier.com/content/object/eid/1-s2.0-S2095495625007077-si4.svg?httpAccept=%2A%2F%2A",
            "@multimediatype": "Scalable Vector Graphics file",
            "@type": "ALTIMG",
            "@size": "5383",
            "@ref": "si4",
            "@mimetype": "image/svg+xml"
          },
          {
            "@category": "thumbnail",
            "@_fa": "true",
            "$": "https://api.elsevier.com/content/object/eid/1-s2.0-S2095495625007077-si40.svg?httpAccept=%2A%2F%2A",
            "@multimediatype": "Scalable Vector Graphics file",
            "@type": "ALTIMG",
            "@size": "4441",
            "@ref": "si40",
            "@mimetype": "image/svg+xml"
          },
          {
            "@category": "thumbnail",
            "@_fa": "true",
            "$": "https://api.elsevier.com/content/object/eid/1-s2.0-S2095495625007077-si41.svg?httpAccept=%2A%2F%2A",
            "@multimediatype": "Scalable Vector Graphics file",
            "@type": "ALTIMG",
            "@size": "7705",
            "@ref": "si41",
            "@mimetype": "image/svg+xml"
          },
          {
            "@category": "thumbnail",
            "@_fa": "true",
            "$": "https://api.elsevier.com/content/object/eid/1-s2.0-S2095495625007077-si42.svg?httpAccept=%2A%2F%2A",
            "@multimediatype": "Scalable Vector Graphics file",
            "@type": "ALTIMG",
            "@size": "8976",
            "@ref": "si42",
            "@mimetype": "image/svg+xml"
          },
          {
            "@category": "thumbnail",
            "@_fa": "true",
            "$": "https://api.elsevier.com/content/object/eid/1-s2.0-S2095495625007077-si43.svg?httpAccept=%2A%2F%2A",
            "@multimediatype": "Scalable Vector Graphics file",
            "@type": "ALTIMG",
            "@size": "8719",
            "@ref": "si43",
            "@mimetype": "image/svg+xml"
          },
          {
            "@category": "thumbnail",
            "@_fa": "true",
            "$": "https://api.elsevier.com/content/object/eid/1-s2.0-S2095495625007077-si44.svg?httpAccept=%2A%2F%2A",
            "@multimediatype": "Scalable Vector Graphics file",
            "@type": "ALTIMG",
            "@size": "6935",
            "@ref": "si44",
            "@mimetype": "image/svg+xml"
          },
          {
            "@category": "thumbnail",
            "@_fa": "true",
            "$": "https://api.elsevier.com/content/object/eid/1-s2.0-S2095495625007077-si45.svg?httpAccept=%2A%2F%2A",
            "@multimediatype": "Scalable Vector Graphics file",
            "@type": "ALTIMG",
            "@size": "4567",
            "@ref": "si45",
            "@mimetype": "image/svg+xml"
          },
          {
            "@category": "thumbnail",
            "@_fa": "true",
            "$": "https://api.elsevier.com/content/object/eid/1-s2.0-S2095495625007077-si46.svg?httpAccept=%2A%2F%2A",
            "@multimediatype": "Scalable Vector Graphics file",
            "@type": "ALTIMG",
            "@size": "5470",
            "@ref": "si46",
            "@mimetype": "image/svg+xml"
          },
          {
            "@category": "thumbnail",
            "@_fa": "true",
            "$": "https://api.elsevier.com/content/object/eid/1-s2.0-S2095495625007077-si47.svg?httpAccept=%2A%2F%2A",
            "@multimediatype": "Scalable Vector Graphics file",
            "@type": "ALTIMG",
            "@size": "8984",
            "@ref": "si47",
            "@mimetype": "image/svg+xml"
          },
          {
            "@category": "thumbnail",
            "@_fa": "true",
            "$": "https://api.elsevier.com/content/object/eid/1-s2.0-S2095495625007077-si48.svg?httpAccept=%2A%2F%2A",
            "@multimediatype": "Scalable Vector Graphics file",
            "@type": "ALTIMG",
            "@size": "4839",
            "@ref": "si48",
            "@mimetype": "image/svg+xml"
          },
          {
            "@category": "thumbnail",
            "@_fa": "true",
            "$": "https://api.elsevier.com/content/object/eid/1-s2.0-S2095495625007077-si49.svg?httpAccept=%2A%2F%2A",
            "@multimediatype": "Scalable Vector Graphics file",
            "@type": "ALTIMG",
            "@size": "6496",
            "@ref": "si49",
            "@mimetype": "image/svg+xml"
          },
          {
            "@category": "thumbnail",
            "@_fa": "true",
            "$": "https://api.elsevier.com/content/object/eid/1-s2.0-S2095495625007077-si5.svg?httpAccept=%2A%2F%2A",
            "@multimediatype": "Scalable Vector Graphics file",
            "@type": "ALTIMG",
            "@size": "10505",
            "@ref": "si5",
            "@mimetype": "image/svg+xml"
          },
          {
            "@category": "thumbnail",
            "@_fa": "true",
            "$": "https://api.elsevier.com/content/object/eid/1-s2.0-S2095495625007077-si50.svg?httpAccept=%2A%2F%2A",
            "@multimediatype": "Scalable Vector Graphics file",
            "@type": "ALTIMG",
            "@size": "7098",
            "@ref": "si50",
            "@mimetype": "image/svg+xml"
          },
          {
            "@category": "thumbnail",
            "@_fa": "true",
            "$": "https://api.elsevier.com/content/object/eid/1-s2.0-S2095495625007077-si51.svg?httpAccept=%2A%2F%2A",
            "@multimediatype": "Scalable Vector Graphics file",
            "@type": "ALTIMG",
            "@size": "6606",
            "@ref": "si51",
            "@mimetype": "image/svg+xml"
          },
          {
            "@category": "thumbnail",
            "@_fa": "true",
            "$": "https://api.elsevier.com/content/object/eid/1-s2.0-S2095495625007077-si52.svg?httpAccept=%2A%2F%2A",
            "@multimediatype": "Scalable Vector Graphics file",
            "@type": "ALTIMG",
            "@size": "7960",
            "@ref": "si52",
            "@mimetype": "image/svg+xml"
          },
          {
            "@category": "thumbnail",
            "@_fa": "true",
            "$": "https://api.elsevier.com/content/object/eid/1-s2.0-S2095495625007077-si53.svg?httpAccept=%2A%2F%2A",
            "@multimediatype": "Scalable Vector Graphics file",
            "@type": "ALTIMG",
            "@size": "7280",
            "@ref": "si53",
            "@mimetype": "image/svg+xml"
          },
          {
            "@category": "thumbnail",
            "@_fa": "true",
            "$": "https://api.elsevier.com/content/object/eid/1-s2.0-S2095495625007077-si54.svg?httpAccept=%2A%2F%2A",
            "@multimediatype": "Scalable Vector Graphics file",
            "@type": "ALTIMG",
            "@size": "8069",
            "@ref": "si54",
            "@mimetype": "image/svg+xml"
          },
          {
            "@category": "thumbnail",
            "@_fa": "true",
            "$": "https://api.elsevier.com/content/object/eid/1-s2.0-S2095495625007077-si55.svg?httpAccept=%2A%2F%2A",
            "@multimediatype": "Scalable Vector Graphics file",
            "@type": "ALTIMG",
            "@size": "8963",
            "@ref": "si55",
            "@mimetype": "image/svg+xml"
          },
          {
            "@category": "thumbnail",
            "@_fa": "true",
            "$": "https://api.elsevier.com/content/object/eid/1-s2.0-S2095495625007077-si56.svg?httpAccept=%2A%2F%2A",
            "@multimediatype": "Scalable Vector Graphics file",
            "@type": "ALTIMG",
            "@size": "10104",
            "@ref": "si56",
            "@mimetype": "image/svg+xml"
          },
          {
            "@category": "thumbnail",
            "@_fa": "true",
            "$": "https://api.elsevier.com/content/object/eid/1-s2.0-S2095495625007077-si57.svg?httpAccept=%2A%2F%2A",
            "@multimediatype": "Scalable Vector Graphics file",
            "@type": "ALTIMG",
            "@size": "7423",
            "@ref": "si57",
            "@mimetype": "image/svg+xml"
          },
          {
            "@category": "thumbnail",
            "@_fa": "true",
            "$": "https://api.elsevier.com/content/object/eid/1-s2.0-S2095495625007077-si58.svg?httpAccept=%2A%2F%2A",
            "@multimediatype": "Scalable Vector Graphics file",
            "@type": "ALTIMG",
            "@size": "6618",
            "@ref": "si58",
            "@mimetype": "image/svg+xml"
          },
          {
            "@category": "thumbnail",
            "@_fa": "true",
            "$": "https://api.elsevier.com/content/object/eid/1-s2.0-S2095495625007077-si59.svg?httpAccept=%2A%2F%2A",
            "@multimediatype": "Scalable Vector Graphics file",
            "@type": "ALTIMG",
            "@size": "6915",
            "@ref": "si59",
            "@mimetype": "image/svg+xml"
          },
          {
            "@category": "thumbnail",
            "@_fa": "true",
            "$": "https://api.elsevier.com/content/object/eid/1-s2.0-S2095495625007077-si6.svg?httpAccept=%2A%2F%2A",
            "@multimediatype": "Scalable Vector Graphics file",
            "@type": "ALTIMG",
            "@size": "8895",
            "@ref": "si6",
            "@mimetype": "image/svg+xml"
          },
          {
            "@category": "thumbnail",
            "@_fa": "true",
            "$": "https://api.elsevier.com/content/object/eid/1-s2.0-S2095495625007077-si60.svg?httpAccept=%2A%2F%2A",
            "@multimediatype": "Scalable Vector Graphics file",
            "@type": "ALTIMG",
            "@size": "6120",
            "@ref": "si60",
            "@mimetype": "image/svg+xml"
          },
          {
            "@category": "thumbnail",
            "@_fa": "true",
            "$": "https://api.elsevier.com/content/object/eid/1-s2.0-S2095495625007077-si61.svg?httpAccept=%2A%2F%2A",
            "@multimediatype": "Scalable Vector Graphics file",
            "@type": "ALTIMG",
            "@size": "7089",
            "@ref": "si61",
            "@mimetype": "image/svg+xml"
          },
          {
            "@category": "thumbnail",
            "@_fa": "true",
            "$": "https://api.elsevier.com/content/object/eid/1-s2.0-S2095495625007077-si62.svg?httpAccept=%2A%2F%2A",
            "@multimediatype": "Scalable Vector Graphics file",
            "@type": "ALTIMG",
            "@size": "7515",
            "@ref": "si62",
            "@mimetype": "image/svg+xml"
          },
          {
            "@category": "thumbnail",
            "@_fa": "true",
            "$": "https://api.elsevier.com/content/object/eid/1-s2.0-S2095495625007077-si63.svg?httpAccept=%2A%2F%2A",
            "@multimediatype": "Scalable Vector Graphics file",
            "@type": "ALTIMG",
            "@size": "6494",
            "@ref": "si63",
            "@mimetype": "image/svg+xml"
          },
          {
            "@category": "thumbnail",
            "@_fa": "true",
            "$": "https://api.elsevier.com/content/object/eid/1-s2.0-S2095495625007077-si64.svg?httpAccept=%2A%2F%2A",
            "@multimediatype": "Scalable Vector Graphics file",
            "@type": "ALTIMG",
            "@size": "9007",
            "@ref": "si64",
            "@mimetype": "image/svg+xml"
          },
          {
            "@category": "thumbnail",
            "@_fa": "true",
            "$": "https://api.elsevier.com/content/object/eid/1-s2.0-S2095495625007077-si65.svg?httpAccept=%2A%2F%2A",
            "@multimediatype": "Scalable Vector Graphics file",
            "@type": "ALTIMG",
            "@size": "8440",
            "@ref": "si65",
            "@mimetype": "image/svg+xml"
          },
          {
            "@category": "thumbnail",
            "@_fa": "true",
            "$": "https://api.elsevier.com/content/object/eid/1-s2.0-S2095495625007077-si67.svg?httpAccept=%2A%2F%2A",
            "@multimediatype": "Scalable Vector Graphics file",
            "@type": "ALTIMG",
            "@size": "6612",
            "@ref": "si67",
            "@mimetype": "image/svg+xml"
          },
          {
            "@category": "thumbnail",
            "@_fa": "true",
            "$": "https://api.elsevier.com/content/object/eid/1-s2.0-S2095495625007077-si68.svg?httpAccept=%2A%2F%2A",
            "@multimediatype": "Scalable Vector Graphics file",
            "@type": "ALTIMG",
            "@size": "11622",
            "@ref": "si68",
            "@mimetype": "image/svg+xml"
          },
          {
            "@category": "thumbnail",
            "@_fa": "true",
            "$": "https://api.elsevier.com/content/object/eid/1-s2.0-S2095495625007077-si69.svg?httpAccept=%2A%2F%2A",
            "@multimediatype": "Scalable Vector Graphics file",
            "@type": "ALTIMG",
            "@size": "9749",
            "@ref": "si69",
            "@mimetype": "image/svg+xml"
          },
          {
            "@category": "thumbnail",
            "@_fa": "true",
            "$": "https://api.elsevier.com/content/object/eid/1-s2.0-S2095495625007077-si7.svg?httpAccept=%2A%2F%2A",
            "@multimediatype": "Scalable Vector Graphics file",
            "@type": "ALTIMG",
            "@size": "12674",
            "@ref": "si7",
            "@mimetype": "image/svg+xml"
          },
          {
            "@category": "thumbnail",
            "@_fa": "true",
            "$": "https://api.elsevier.com/content/object/eid/1-s2.0-S2095495625007077-si70.svg?httpAccept=%2A%2F%2A",
            "@multimediatype": "Scalable Vector Graphics file",
            "@type": "ALTIMG",
            "@size": "6961",
            "@ref": "si70",
            "@mimetype": "image/svg+xml"
          },
          {
            "@category": "thumbnail",
            "@_fa": "true",
            "$": "https://api.elsevier.com/content/object/eid/1-s2.0-S2095495625007077-si71.svg?httpAccept=%2A%2F%2A",
            "@multimediatype": "Scalable Vector Graphics file",
            "@type": "ALTIMG",
            "@size": "6184",
            "@ref": "si71",
            "@mimetype": "image/svg+xml"
          },
          {
            "@category": "thumbnail",
            "@_fa": "true",
            "$": "https://api.elsevier.com/content/object/eid/1-s2.0-S2095495625007077-si72.svg?httpAccept=%2A%2F%2A",
            "@multimediatype": "Scalable Vector Graphics file",
            "@type": "ALTIMG",
            "@size": "4884",
            "@ref": "si72",
            "@mimetype": "image/svg+xml"
          },
          {
            "@category": "thumbnail",
            "@_fa": "true",
            "$": "https://api.elsevier.com/content/object/eid/1-s2.0-S2095495625007077-si73.svg?httpAccept=%2A%2F%2A",
            "@multimediatype": "Scalable Vector Graphics file",
            "@type": "ALTIMG",
            "@size": "5302",
            "@ref": "si73",
            "@mimetype": "image/svg+xml"
          },
          {
            "@category": "thumbnail",
            "@_fa": "true",
            "$": "https://api.elsevier.com/content/object/eid/1-s2.0-S2095495625007077-si74.svg?httpAccept=%2A%2F%2A",
            "@multimediatype": "Scalable Vector Graphics file",
            "@type": "ALTIMG",
            "@size": "3753",
            "@ref": "si74",
            "@mimetype": "image/svg+xml"
          },
          {
            "@category": "thumbnail",
            "@_fa": "true",
            "$": "https://api.elsevier.com/content/object/eid/1-s2.0-S2095495625007077-si75.svg?httpAccept=%2A%2F%2A",
            "@multimediatype": "Scalable Vector Graphics file",
            "@type": "ALTIMG",
            "@size": "7662",
            "@ref": "si75",
            "@mimetype": "image/svg+xml"
          },
          {
            "@category": "thumbnail",
            "@_fa": "true",
            "$": "https://api.elsevier.com/content/object/eid/1-s2.0-S2095495625007077-si76.svg?httpAccept=%2A%2F%2A",
            "@multimediatype": "Scalable Vector Graphics file",
            "@type": "ALTIMG",
            "@size": "8136",
            "@ref": "si76",
            "@mimetype": "image/svg+xml"
          },
          {
            "@category": "thumbnail",
            "@_fa": "true",
            "$": "https://api.elsevier.com/content/object/eid/1-s2.0-S2095495625007077-si77.svg?httpAccept=%2A%2F%2A",
            "@multimediatype": "Scalable Vector Graphics file",
            "@type": "ALTIMG",
            "@size": "6213",
            "@ref": "si77",
            "@mimetype": "image/svg+xml"
          },
          {
            "@category": "thumbnail",
            "@_fa": "true",
            "$": "https://api.elsevier.com/content/object/eid/1-s2.0-S2095495625007077-si78.svg?httpAccept=%2A%2F%2A",
            "@multimediatype": "Scalable Vector Graphics file",
            "@type": "ALTIMG",
            "@size": "6952",
            "@ref": "si78",
            "@mimetype": "image/svg+xml"
          },
          {
            "@category": "thumbnail",
            "@_fa": "true",
            "$": "https://api.elsevier.com/content/object/eid/1-s2.0-S2095495625007077-si79.svg?httpAccept=%2A%2F%2A",
            "@multimediatype": "Scalable Vector Graphics file",
            "@type": "ALTIMG",
            "@size": "7430",
            "@ref": "si79",
            "@mimetype": "image/svg+xml"
          },
          {
            "@category": "thumbnail",
            "@_fa": "true",
            "$": "https://api.elsevier.com/content/object/eid/1-s2.0-S2095495625007077-si8.svg?httpAccept=%2A%2F%2A",
            "@multimediatype": "Scalable Vector Graphics file",
            "@type": "ALTIMG",
            "@size": "7968",
            "@ref": "si8",
            "@mimetype": "image/svg+xml"
          },
          {
            "@category": "thumbnail",
            "@_fa": "true",
            "$": "https://api.elsevier.com/content/object/eid/1-s2.0-S2095495625007077-si80.svg?httpAccept=%2A%2F%2A",
            "@multimediatype": "Scalable Vector Graphics file",
            "@type": "ALTIMG",
            "@size": "5450",
            "@ref": "si80",
            "@mimetype": "image/svg+xml"
          },
          {
            "@category": "thumbnail",
            "@_fa": "true",
            "$": "https://api.elsevier.com/content/object/eid/1-s2.0-S2095495625007077-si81.svg?httpAccept=%2A%2F%2A",
            "@multimediatype": "Scalable Vector Graphics file",
            "@type": "ALTIMG",
            "@size": "7208",
            "@ref": "si81",
            "@mimetype": "image/svg+xml"
          },
          {
            "@category": "thumbnail",
            "@_fa": "true",
            "$": "https://api.elsevier.com/content/object/eid/1-s2.0-S2095495625007077-si82.svg?httpAccept=%2A%2F%2A",
            "@multimediatype": "Scalable Vector Graphics file",
            "@type": "ALTIMG",
            "@size": "8175",
            "@ref": "si82",
            "@mimetype": "image/svg+xml"
          },
          {
            "@category": "thumbnail",
            "@_fa": "true",
            "$": "https://api.elsevier.com/content/object/eid/1-s2.0-S2095495625007077-si83.svg?httpAccept=%2A%2F%2A",
            "@multimediatype": "Scalable Vector Graphics file",
            "@type": "ALTIMG",
            "@size": "7037",
            "@ref": "si83",
            "@mimetype": "image/svg+xml"
          },
          {
            "@category": "thumbnail",
            "@_fa": "true",
            "$": "https://api.elsevier.com/content/object/eid/1-s2.0-S2095495625007077-si84.svg?httpAccept=%2A%2F%2A",
            "@multimediatype": "Scalable Vector Graphics file",
            "@type": "ALTIMG",
            "@size": "6141",
            "@ref": "si84",
            "@mimetype": "image/svg+xml"
          },
          {
            "@category": "thumbnail",
            "@_fa": "true",
            "$": "https://api.elsevier.com/content/object/eid/1-s2.0-S2095495625007077-si85.svg?httpAccept=%2A%2F%2A",
            "@multimediatype": "Scalable Vector Graphics file",
            "@type": "ALTIMG",
            "@size": "4591",
            "@ref": "si85",
            "@mimetype": "image/svg+xml"
          },
          {
            "@category": "thumbnail",
            "@_fa": "true",
            "$": "https://api.elsevier.com/content/object/eid/1-s2.0-S2095495625007077-si86.svg?httpAccept=%2A%2F%2A",
            "@multimediatype": "Scalable Vector Graphics file",
            "@type": "ALTIMG",
            "@size": "1359",
            "@ref": "si86",
            "@mimetype": "image/svg+xml"
          },
          {
            "@category": "thumbnail",
            "@_fa": "true",
            "$": "https://api.elsevier.com/content/object/eid/1-s2.0-S2095495625007077-si87.svg?httpAccept=%2A%2F%2A",
            "@multimediatype": "Scalable Vector Graphics file",
            "@type": "ALTIMG",
            "@size": "1749",
            "@ref": "si87",
            "@mimetype": "image/svg+xml"
          },
          {
            "@category": "thumbnail",
            "@_fa": "true",
            "$": "https://api.elsevier.com/content/object/eid/1-s2.0-S2095495625007077-si88.svg?httpAccept=%2A%2F%2A",
            "@multimediatype": "Scalable Vector Graphics file",
            "@type": "ALTIMG",
            "@size": "8051",
            "@ref": "si88",
            "@mimetype": "image/svg+xml"
          },
          {
            "@category": "thumbnail",
            "@_fa": "true",
            "$": "https://api.elsevier.com/content/object/eid/1-s2.0-S2095495625007077-si89.svg?httpAccept=%2A%2F%2A",
            "@multimediatype": "Scalable Vector Graphics file",
            "@type": "ALTIMG",
            "@size": "3489",
            "@ref": "si89",
            "@mimetype": "image/svg+xml"
          },
          {
            "@category": "thumbnail",
            "@_fa": "true",
            "$": "https://api.elsevier.com/content/object/eid/1-s2.0-S2095495625007077-si9.svg?httpAccept=%2A%2F%2A",
            "@multimediatype": "Scalable Vector Graphics file",
            "@type": "ALTIMG",
            "@size": "6876",
            "@ref": "si9",
            "@mimetype": "image/svg+xml"
          },
          {
            "@category": "thumbnail",
            "@_fa": "true",
            "$": "https://api.elsevier.com/content/object/eid/1-s2.0-S2095495625007077-si90.svg?httpAccept=%2A%2F%2A",
            "@multimediatype": "Scalable Vector Graphics file",
            "@type": "ALTIMG",
            "@size": "5735",
            "@ref": "si90",
            "@mimetype": "image/svg+xml"
          },
          {
            "@category": "thumbnail",
            "@_fa": "true",
            "$": "https://api.elsevier.com/content/object/eid/1-s2.0-S2095495625007077-si91.svg?httpAccept=%2A%2F%2A",
            "@multimediatype": "Scalable Vector Graphics file",
            "@type": "ALTIMG",
            "@size": "9717",
            "@ref": "si91",
            "@mimetype": "image/svg+xml"
          },
          {
            "@category": "thumbnail",
            "@_fa": "true",
            "$": "https://api.elsevier.com/content/object/eid/1-s2.0-S2095495625007077-si92.svg?httpAccept=%2A%2F%2A",
            "@multimediatype": "Scalable Vector Graphics file",
            "@type": "ALTIMG",
            "@size": "6689",
            "@ref": "si92",
            "@mimetype": "image/svg+xml"
          },
          {
            "@category": "thumbnail",
            "@_fa": "true",
            "$": "https://api.elsevier.com/content/object/eid/1-s2.0-S2095495625007077-si93.svg?httpAccept=%2A%2F%2A",
            "@multimediatype": "Scalable Vector Graphics file",
            "@type": "ALTIMG",
            "@size": "6922",
            "@ref": "si93",
            "@mimetype": "image/svg+xml"
          },
          {
            "@category": "thumbnail",
            "@_fa": "true",
            "$": "https://api.elsevier.com/content/object/eid/1-s2.0-S2095495625007077-si94.svg?httpAccept=%2A%2F%2A",
            "@multimediatype": "Scalable Vector Graphics file",
            "@type": "ALTIMG",
            "@size": "2423",
            "@ref": "si94",
            "@mimetype": "image/svg+xml"
          },
          {
            "@category": "thumbnail",
            "@_fa": "true",
            "$": "https://api.elsevier.com/content/object/eid/1-s2.0-S2095495625007077-si95.svg?httpAccept=%2A%2F%2A",
            "@multimediatype": "Scalable Vector Graphics file",
            "@type": "ALTIMG",
            "@size": "1474",
            "@ref": "si95",
            "@mimetype": "image/svg+xml"
          },
          {
            "@category": "thumbnail",
            "@_fa": "true",
            "$": "https://api.elsevier.com/content/object/eid/1-s2.0-S2095495625007077-si96.svg?httpAccept=%2A%2F%2A",
            "@multimediatype": "Scalable Vector Graphics file",
            "@type": "ALTIMG",
            "@size": "2340",
            "@ref": "si96",
            "@mimetype": "image/svg+xml"
          },
          {
            "@category": "thumbnail",
            "@_fa": "true",
            "$": "https://api.elsevier.com/content/object/eid/1-s2.0-S2095495625007077-si97.svg?httpAccept=%2A%2F%2A",
            "@multimediatype": "Scalable Vector Graphics file",
            "@type": "ALTIMG",
            "@size": "7400",
            "@ref": "si97",
            "@mimetype": "image/svg+xml"
          },
          {
            "@category": "thumbnail",
            "@_fa": "true",
            "$": "https://api.elsevier.com/content/object/eid/1-s2.0-S2095495625007077-si98.svg?httpAccept=%2A%2F%2A",
            "@multimediatype": "Scalable Vector Graphics file",
            "@type": "ALTIMG",
            "@size": "2118",
            "@ref": "si98",
            "@mimetype": "image/svg+xml"
          },
          {
            "@category": "thumbnail",
            "@_fa": "true",
            "$": "https://api.elsevier.com/content/object/eid/1-s2.0-S2095495625007077-si99.svg?httpAccept=%2A%2F%2A",
            "@multimediatype": "Scalable Vector Graphics file",
            "@type": "ALTIMG",
            "@size": "2425",
            "@ref": "si99",
            "@mimetype": "image/svg+xml"
          }
        ]
      }
    }
  }
}