{
  "metadata": {
    "title": "Molten salt synthesis and supercapacitor properties of oxygen-vacancy LaMnO<ce:inf loc=post>3−</ce:inf><ce:italic><ce:inf loc=post>δ</ce:inf></ce:italic>",
    "authors": "; ; ",
    "journal": "Journal of Energy Chemistry",
    "date": "2020-04-30",
    "doi": "10.1016/j.jechem.2019.09.007",
    "abstract": "",
    "uri": "https://api.elsevier.com/content/article/pii/S2095495619308095",
    "pii": "S2095495619308095"
  },
  "fulltext": {
    "full-text-retrieval-response": {
      "scopus-eid": "2-s2.0-85072174838",
      "originalText": "serial JL 286353 291210 291711 291744 291809 31 Journal of Energy Chemistry JOURNALENERGYCHEMISTRY 2019-09-11 2019-09-11 2019-09-17 2019-09-17 2019-11-28T19:55:57 1-s2.0-S2095495619308095 S2095-4956(19)30809-5 S2095495619308095 10.1016/j.jechem.2019.09.007 S300 S300.1 FULL-TEXT 1-s2.0-S2095495619X00121 2020-09-22T01:35:54.977088Z 0 0 20200401 20200430 2020 2019-09-11T15:42:58.540644Z absattachment articleinfo articletitlenorm authfirstinitialnorm authfirstsurnamenorm cid cids contenttype copyright crossmark dateloaded dateloadedtxt datesearch datesort dateupdated dco docsubtype doctype doi eid ewtransactionid hubeid indexeddate issn issnnorm itemstage itemtransactionid itemweight openaccess openarchive pg pgfirst pglast pii piinorm pubdateend pubdatestart pubdatetxt pubyr sortorder srctitle srctitlenorm srctype ssids alllist content subj subheadings suppl tomb volfirst volissue volumelist webpdf webpdfpagecount yearnav figure table body acknowledge affil articletitle auth authfirstini authfull authkeywords authlast grantnumber grantsponsor grantsponsorid primabst ref specialabst 2095-4956 20954956 false 43 43 C Volume 43 23 173 181 173 181 202004 April 2020 2020-04-01 2020-04-30 2020 article fla © 2019 Science Press and Dalian Institute of Chemical Physics, Chinese Academy of Sciences. Published by Elsevier B.V. and Science Press. All rights reserved. MOLTENSALTSYNTHESISSUPERCAPACITORPROPERTIESOXYGENVACANCYLAMNO3 SONG Y 1 Introduction 2 Experimental 2.1 Preparation of LaMnO3-δ and LaMnO3 material 2.2 Material characterization 2.3 Preparation and electrochemical behavior measurement of LaMnO3-δ electrode 3 Results and discussion 3.1 Structural and morphological analysis 3.2 Electrochemical characterization 4 Conclusions Acknowledgments References WANG 2016 5925 5950 Y SIMON 2008 845 854 P GAO 2017 387 Y ZHANG 2018 1868 1878 L SUN 2017 9443 9464 J WANG 2017 941 949 Y CAO 2017 262 269 L YAO 2017 24689 24695 M REPP 2018 1877 1884 S WANG 2018 1802193 Y KIM 2017 454 460 H LIN 2014 24874 24883 C FENG 2017 169 176 X ELSIDDIG 2017 422 429 Z LIU 2016 23774 23783 Y MEFFORD 2014 726 732 J XU 2018 9415 9423 Z LIU 2018 1702604 1702614 Y YANG 2015 1234 1237 W SUNTIVICH 2011 1383 1385 J ZHAO 2018 613 621 Y HU 2017 15630 Z XIAO 2016 7427 7431 W SHAFI 2018 147 156 P LIU 2017 300 313 H ZHU 2018 200 207 M BIESINGER 2011 2717 2730 M XING 2011 4947 4949 M AFZAL 2017 692 703 S TABERNA 2003 A292 A300 P YAN 2018 9640 9648 Q HE 2018 17 25 L MO 2018 9733 9741 H PIBURN 2017 977 984 G ZHAO 2019 32 49 H XU 2014 13345 13351 Y JEON 2015 476 480 N SONGX2020X173 SONGX2020X173X181 SONGX2020X173XY SONGX2020X173X181XY 2021-09-17T00:00:00.000Z 2021-09-17T00:00:00.000Z http://creativecommons.org/licenses/by-nc-nd/4.0/ © 2019 Science Press and Dalian Institute of Chemical Physics, Chinese Academy of Sciences. Published by Elsevier B.V. and Science Press. All rights reserved. 2019-09-10T01:24:02.407Z http://vtw.elsevier.com/data/voc/AddOnTypes/50.7/eoas Fundamental Research Funds for the Central Universities http://data.elsevier.com/vocabulary/SciValFunders/501100012226 http://sws.geonames.org/1814991 NSFC National Natural Science Foundation of China http://data.elsevier.com/vocabulary/SciValFunders/501100001809 http://sws.geonames.org/1814991 item S2095-4956(19)30809-5 S2095495619308095 1-s2.0-S2095495619308095 10.1016/j.jechem.2019.09.007 286353 2020-09-22T01:35:54.977088Z 2020-04-01 2020-04-30 1-s2.0-S2095495619308095-main.pdf https://s3.amazonaws.com/prod-ucs-content-store-us-east/content/pii:S2095495619308095/MAIN/application/pdf/148c062b7cec39dc0981be4b1090f9cd/main.pdf main.pdf pdf true 3082957 MAIN 9 1-s2.0-S2095495619308095-main_1.png https://s3.amazonaws.com/prod-ucs-content-store-us-east/content/pii:S2095495619308095/PREVIEW/image/png/e9ee9894e518a279af9fa4670db4720d/main_1.png main_1.png png 54681 849 656 IMAGE-WEB-PDF 1 1-s2.0-S2095495619308095-gr1.sml https://s3.amazonaws.com/prod-ucs-content-store-us-east/content/pii:S2095495619308095/gr1/THUMBNAIL/image/gif/c4cfbd82fa924e724f53aa9a3e58f627/gr1.sml gr1 gr1.sml sml 5642 60 219 IMAGE-THUMBNAIL 1-s2.0-S2095495619308095-gr2.sml https://s3.amazonaws.com/prod-ucs-content-store-us-east/content/pii:S2095495619308095/gr2/THUMBNAIL/image/gif/44b13aa9e3789458126a3dfb09aeb02e/gr2.sml gr2 gr2.sml sml 5612 164 201 IMAGE-THUMBNAIL 1-s2.0-S2095495619308095-gr3.sml https://s3.amazonaws.com/prod-ucs-content-store-us-east/content/pii:S2095495619308095/gr3/THUMBNAIL/image/gif/ee53e4e0b767ee78131d697cd3ccf274/gr3.sml gr3 gr3.sml sml 10244 164 138 IMAGE-THUMBNAIL 1-s2.0-S2095495619308095-gr4.sml https://s3.amazonaws.com/prod-ucs-content-store-us-east/content/pii:S2095495619308095/gr4/THUMBNAIL/image/gif/6cfe84dd0c5863ecc7cd457bccf026d5/gr4.sml gr4 gr4.sml sml 10778 164 169 IMAGE-THUMBNAIL 1-s2.0-S2095495619308095-gr5.sml https://s3.amazonaws.com/prod-ucs-content-store-us-east/content/pii:S2095495619308095/gr5/THUMBNAIL/image/gif/69c1328e016be94be456cb52ac20f2c0/gr5.sml gr5 gr5.sml sml 7604 60 219 IMAGE-THUMBNAIL 1-s2.0-S2095495619308095-gr6.sml https://s3.amazonaws.com/prod-ucs-content-store-us-east/content/pii:S2095495619308095/gr6/THUMBNAIL/image/gif/63866815e8439dc400ee2b0d688cf007/gr6.sml gr6 gr6.sml sml 15073 164 152 IMAGE-THUMBNAIL 1-s2.0-S2095495619308095-gr7.sml https://s3.amazonaws.com/prod-ucs-content-store-us-east/content/pii:S2095495619308095/gr7/THUMBNAIL/image/gif/9bc3bd747a3fad7e94f4ec8fd334ac7b/gr7.sml gr7 gr7.sml sml 9375 164 136 IMAGE-THUMBNAIL 1-s2.0-S2095495619308095-gr8.sml https://s3.amazonaws.com/prod-ucs-content-store-us-east/content/pii:S2095495619308095/gr8/THUMBNAIL/image/gif/e39d7281c38684dcbd3047d7fcc3e5cc/gr8.sml gr8 gr8.sml sml 12411 117 219 IMAGE-THUMBNAIL 1-s2.0-S2095495619308095-fx1.sml https://s3.amazonaws.com/prod-ucs-content-store-us-east/content/pii:S2095495619308095/fx1/THUMBNAIL/image/gif/e9a8e049ee2fdced843141ee6b59f0dd/fx1.sml fx1 true fx1.sml sml 9390 134 219 IMAGE-THUMBNAIL 1-s2.0-S2095495619308095-gr1.jpg https://s3.amazonaws.com/prod-ucs-content-store-us-east/content/pii:S2095495619308095/gr1/DOWNSAMPLED/image/jpeg/570c80b357adf66c7d4fcf0fc9461f3e/gr1.jpg gr1 gr1.jpg jpg 32037 185 678 IMAGE-DOWNSAMPLED 1-s2.0-S2095495619308095-gr2.jpg https://s3.amazonaws.com/prod-ucs-content-store-us-east/content/pii:S2095495619308095/gr2/DOWNSAMPLED/image/jpeg/0f9f19e12d4e257bf301ebbedab867d4/gr2.jpg gr2 gr2.jpg jpg 16771 291 357 IMAGE-DOWNSAMPLED 1-s2.0-S2095495619308095-gr3.jpg https://s3.amazonaws.com/prod-ucs-content-store-us-east/content/pii:S2095495619308095/gr3/DOWNSAMPLED/image/jpeg/c48cfe844cddc66004d8559212f9ee53/gr3.jpg gr3 gr3.jpg jpg 98508 762 640 IMAGE-DOWNSAMPLED 1-s2.0-S2095495619308095-gr4.jpg https://s3.amazonaws.com/prod-ucs-content-store-us-east/content/pii:S2095495619308095/gr4/DOWNSAMPLED/image/jpeg/530072ee3a8f60f5106f8c0af1713b60/gr4.jpg gr4 gr4.jpg jpg 92759 596 614 IMAGE-DOWNSAMPLED 1-s2.0-S2095495619308095-gr5.jpg https://s3.amazonaws.com/prod-ucs-content-store-us-east/content/pii:S2095495619308095/gr5/DOWNSAMPLED/image/jpeg/a2fb5dc8ce382e56b9629b05f1af31eb/gr5.jpg gr5 gr5.jpg jpg 30524 187 678 IMAGE-DOWNSAMPLED 1-s2.0-S2095495619308095-gr6.jpg https://s3.amazonaws.com/prod-ucs-content-store-us-east/content/pii:S2095495619308095/gr6/DOWNSAMPLED/image/jpeg/a350a3bcebd91c3135850090492b7da8/gr6.jpg gr6 gr6.jpg jpg 158903 650 602 IMAGE-DOWNSAMPLED 1-s2.0-S2095495619308095-gr7.jpg https://s3.amazonaws.com/prod-ucs-content-store-us-east/content/pii:S2095495619308095/gr7/DOWNSAMPLED/image/jpeg/2a835043dc444cd1ac64e5586e636c84/gr7.jpg gr7 gr7.jpg jpg 124298 772 640 IMAGE-DOWNSAMPLED 1-s2.0-S2095495619308095-gr8.jpg https://s3.amazonaws.com/prod-ucs-content-store-us-east/content/pii:S2095495619308095/gr8/DOWNSAMPLED/image/jpeg/5f9f3085365ff1e35987e2676592b733/gr8.jpg gr8 gr8.jpg jpg 71114 373 696 IMAGE-DOWNSAMPLED 1-s2.0-S2095495619308095-fx1.jpg https://s3.amazonaws.com/prod-ucs-content-store-us-east/content/pii:S2095495619308095/fx1/DOWNSAMPLED/image/jpeg/4b11c8eeac97823b4b193fe45abdc5d8/fx1.jpg fx1 true fx1.jpg jpg 14727 185 301 IMAGE-DOWNSAMPLED 1-s2.0-S2095495619308095-gr1_lrg.jpg https://s3.amazonaws.com/prod-ucs-content-store-us-east/content/pii:S2095495619308095/gr1/HIGHRES/image/jpeg/7867a6a36182e11bdb18679cd4e4e53f/gr1_lrg.jpg gr1 gr1_lrg.jpg jpg 248333 818 3000 IMAGE-HIGH-RES 1-s2.0-S2095495619308095-gr2_lrg.jpg https://s3.amazonaws.com/prod-ucs-content-store-us-east/content/pii:S2095495619308095/gr2/HIGHRES/image/jpeg/8c6dd478340b5c0c2e63cf9ce50f2e20/gr2_lrg.jpg gr2 gr2_lrg.jpg jpg 110276 1291 1583 IMAGE-HIGH-RES 1-s2.0-S2095495619308095-gr3_lrg.jpg https://s3.amazonaws.com/prod-ucs-content-store-us-east/content/pii:S2095495619308095/gr3/HIGHRES/image/jpeg/ff288106b9690502deb113431ae8fb14/gr3_lrg.jpg gr3 gr3_lrg.jpg jpg 807759 3371 2833 IMAGE-HIGH-RES 1-s2.0-S2095495619308095-gr4_lrg.jpg https://s3.amazonaws.com/prod-ucs-content-store-us-east/content/pii:S2095495619308095/gr4/HIGHRES/image/jpeg/92cc493ffe45ed63476745bb6dac44e2/gr4_lrg.jpg gr4 gr4_lrg.jpg jpg 730815 2639 2720 IMAGE-HIGH-RES 1-s2.0-S2095495619308095-gr5_lrg.jpg https://s3.amazonaws.com/prod-ucs-content-store-us-east/content/pii:S2095495619308095/gr5/HIGHRES/image/jpeg/53d4fc71ec40e5f28ff592c3e59edeb7/gr5_lrg.jpg gr5 gr5_lrg.jpg jpg 319612 828 3000 IMAGE-HIGH-RES 1-s2.0-S2095495619308095-gr6_lrg.jpg https://s3.amazonaws.com/prod-ucs-content-store-us-east/content/pii:S2095495619308095/gr6/HIGHRES/image/jpeg/572652e42eb058e107dfdcf5eeb62015/gr6_lrg.jpg gr6 gr6_lrg.jpg jpg 1372730 2881 2667 IMAGE-HIGH-RES 1-s2.0-S2095495619308095-gr7_lrg.jpg https://s3.amazonaws.com/prod-ucs-content-store-us-east/content/pii:S2095495619308095/gr7/HIGHRES/image/jpeg/16d426a8fba80264382f5b7ee1f58246/gr7_lrg.jpg gr7 gr7_lrg.jpg jpg 937093 3417 2833 IMAGE-HIGH-RES 1-s2.0-S2095495619308095-gr8_lrg.jpg https://s3.amazonaws.com/prod-ucs-content-store-us-east/content/pii:S2095495619308095/gr8/HIGHRES/image/jpeg/023869b59f4c7e8d50ce96e0c01c25b2/gr8_lrg.jpg gr8 gr8_lrg.jpg jpg 569931 1651 3083 IMAGE-HIGH-RES 1-s2.0-S2095495619308095-fx1_lrg.jpg https://s3.amazonaws.com/prod-ucs-content-store-us-east/content/pii:S2095495619308095/fx1/HIGHRES/image/jpeg/9e73fffeca25b972dfaffddcb1c6052d/fx1_lrg.jpg fx1 true fx1_lrg.jpg jpg 116454 818 1333 IMAGE-HIGH-RES 1-s2.0-S2095495619308095-am.pdf am am.pdf pdf 28028040 AAM-PDF https://s3-eu-west-1.amazonaws.com/prod-ucs-content-store-eu-west/content/egi:10ZLF0V54CC/MAIN/application/pdf/06f5d8821d1b31c1444ea104def834c7/am.pdf JECHEM 942 S2095-4956(19)30809-5 10.1016/j.jechem.2019.09.007 Science Press and Dalian Institute of Chemical Physics, Chinese Academy of Sciences Fig. 1 Synthesis of perovskite-type oxide LaMnO3- δ via the molten salt method. Fig 1 Fig. 2 The thermogravimetric (TG) curve of KNO3 NaNO3 NaNO2 (53:7:40 wt%) mixture in air condition at 30 °C–800 °C. Fig 2 Fig. 3 The XRD patterns and the SEM images of the products synthesized in KNO3 NaNO3 NaNO2 (53:7:40 wt%) melt at (a, b) 200 °C, (c, d) 300 °C, and (e, f) 400 °C. Fig 3 Fig. 4 XPS spectrum and the results of the curve fitting of (a) La 3d, (b) Mn 2p and (c) O 1s of LaMnO3- δ powders. The comparison of (d) Mn 2p and (e) O 1s XPS spectra for LaMnO3 and LaMnO3- δ . Fig 4 Fig. 5 (a, b) TEM images and (c) HRTEM image of LaMnO3- δ powder synthesized by molten salt method. Fig 5 Fig. 6 (a) SEM image and EDS mapping results of (b) La, (c) Mn, (d) O, (e) Cl elements. (f) ZAF quantitative correction results of the selected area. Fig 6 Fig. 7 (a) Cyclic voltammetry curves at the scan rates of 2, 5, 10, 20, 50 and 100 mV/s. Galvanostatic charge–discharge curves at different current densities of (b) LaMnO3- δ and (c) LaMnO3. (d) Cycle stability test at current density of 1 A/g of LaMnO3- δ . (e) Electrochemical impedance spectra. The equivalent circuits fitting of (f) initial and (g) after 5000 cycles of LaMnO3- δ electrode in 6 M KOH. Fig 7 Fig. 8 Electrochemical reaction mechanism of LaMnO3- δ in alkaline solution. Fig 8 Table 1 The comparison with previous work on perovskite electrodes. Table 1 Materials Method Current or scan rates Specific capacitance (F/g) LaMnO3- δ [16] Reverse-phase hydrolysis 2 mV/s 609.8 PrBaMn2O6- δ [18] Ethylenediaminetetraacetic acid–anhydrous citric acid (EDTA–CA) complexing approach 1 A/g 1034.8 La0.5Ca0.5MnO3 [33] Improved sol–gel method 1 A/g 170 LaMnO3–SiO2 [34] Cyclohexene-assisted impregnation method 5 mV/s 270 La0.7Sr0.3CoO3- δ (LSC)@MnO2 [32] Controlled electrospinning combined with hydrothermal synthesis 1 A/g 570 LaMnO3- δ (our work) Molten salt method 1 A/g 973.6 Molten salt synthesis and supercapacitor properties of oxygen-vacancy LaMnO3− δ Ya-Li Song a Zi-Chang Wang a Yong-De Yan a b ⁎ Mi-Lin Zhang a Gui-Ling Wang a ⁎ Tai-Qi Yin a Yun Xue a Fan Gao b Min Qiu b a Key Laboratory of Superlight Materials and Surface Technology, Ministry of Education, College of Materials Science and Chemical Engineering, Harbin Engineering University, Harbin 150001, Heilongjiang, China Key Laboratory of Superlight Materials and Surface Technology Ministry of Education College of Materials Science and Chemical Engineering Harbin Engineering University Harbin Heilongjiang 150001 China aKey Laboratory of Superlight Materials and Surface Technology, Ministry of Education, College of Materials Science and Chemical Engineering, Harbin Engineering University, Harbin 150001, Heilongjiang, China b College of Science, Heihe University, Heihe 164300, Heilongjiang, China College of Science Heihe University Heihe Heilongjiang 164300 China bCollege of Science, Heihe University, Heihe 164300, Heilongjiang, China ⁎ Corresponding authors at: Key Laboratory of Superlight Materials and Surface Technology, Ministry of Education, College of Materials Science and Chemical Engineering, Harbin Engineering University, Harbin 150001, Heilongjiang, China. Key Laboratory of Superlight Materials and Surface Technology Ministry of Education College of Materials Science and Chemical Engineering Harbin Engineering University Harbin Heilongjiang 150001 China Due to the unique structure of perovskite materials, their capacitance can be improved by introducing oxygen vacancy. In this paper, the LaMnO3- δ material containing oxygen vacancy was synthesized by molten salt method in KNO3 NaNO3 NaNO2 melt. The La–Mn–O crystal grows gradually in molten salt with the increase of temperature. It was confirmed that LaMnO3- δ with perovskite structure and incomplete oxygen content were synthesized by molten salt method and presented a three-dimensional shape. LaMnO3- δ stores energy by redox reaction and adsorption of OH− in electrolyte simultaneously. In comparison with the stoichiometric LaMnO3 prepared by the sol–gel method, LaMnO3- δ prepared by molten salt method proffered higher capacitance and better performance. The galvanostatic charge–discharge curve showed specific capacitance of 973.5 F/g under current density of 1 A/g in 6 M KOH. The capacitance of LaMnO3- δ was 82.7% under condition of 5 A/g compared with the capacitance at the current of 1A/g, and the specific capacitances of 648.0 and 310.0 F/g were obtained after 2000 and 5000 cycles of galvanostatic charging–discharging, respectively. Molten salt synthesis method is relatively simple and suitable for industrial scale, presenting a promising prospect in the synthesis of perovskite oxide materials. Graphical abstract LaMnO3- δ containing oxygen vacancies was synthesized in KNO3 NaNO3 NaNO2 salt at 300 °C in air condition for energy storage. Image, graphical abstract Keywords LaMnO3- δ Perovskite oxide KNO3–NaNO3–NaNO2 melt Supercapacitor Molten salt synthesis 1 Introduction A new generation of energy storage equipment is being developed and chosen as alternative energy sources to the traditional fossil materials due to the reduction of non-renewable fossil fuel resources and the increasing demand for environmental protection [1]. Among various energy storage devices, supercapacitor has received a lot of attention in recent few decades [2,3]. Based on the different energy storage mechanisms, supercapacitor can be sorted into two categories: one is electrical double layer capacitance caused by pure electrostatic attraction at the electrode/electrolyte interface. The second one is the Faraday pseudocapacitance. Because of the highly reversible adsorption, desorption and redox chemical reactions, capacitance related to the electrode charging potential is obtained [4]. Among traditional pseudocapacitor materials, MnO2, NiO, SnO2 and V2O5 store energy by rapid redox reaction [5–8]. In recent years, several novel capacitive materials containing oxygen vacancies were synthesized by constructing lattice vacancy in traditional pseudo-capacitor materials. The capacitance can be generated by adsorption and desorption of ions in the electrolyte through oxygen vacancy on the surface of electrode along with redox reactions [9]. Such electrode material is of great significance in the selection of functional materials for portable equipment due to its high volume specific capacitance [10]. Oxygen-poor state MoO3- x leads to a larger layer spacing compared to the fully oxidized MoO3. This phenomenon is ascribed to the oxygen vacancy, which promotes faster charge storage kinetics and preserves the α-MoO3 structure during insertion and removal of Li ions [11]. Lin et al. [12] prepared monodisperse/polydisperse TiO2 precursor submicrospheres by sol–gel method through mixing the precursor with LiOH and sucrose to form Li4Ti5O12- x /C containing oxygen vacancy in argon atmosphere at 800 °C as a cathode material for lithium-ion batteries. The conductivity of Li4Ti5O12− x /C particles and Li+ ion diffusion were significantly higher than those of Li4Ti5O12 with complete stoichiometric ratio. The potential importance of introducing oxygen vacancy to transition metal oxides to improve the charge storage kinetics of active redox substances was extensively emphasized [13]. In recent years, perovskite-type metal oxides as supercapacitor materials have been presented in several reports [14,15]. Perovskite oxides with oxygen vacancy have become promising electrode materials. It was found that oxygen intercalation has a significant influence on layered perovskite nanoparticles as supercapacitor electrodes. Mefford et al. [16] prepared LaMnO3±0.09 by inverse hydrolysis reverse method, and found that the specific capacitance of LaMnO3.09 was higher than LaMnO2.91 in alkaline solution. They further explained that phenomenon by using alkaline solution of different anion concentrations and neutral electrolytes. In addition to traditional perovskite oxides, the synthesis of double perovskite material with oxygen vacancy has also been reported [17]. The PrBaMn2O6− δ was synthesized by ethylenediaminetetraacetic acid-anhydrous citric acid (EDTA-CA) complexing approach, which can reach a maximum gravimetric capacitance of 1034.8 F/g in 6 M KOH solution with a small specific surface area of only 7.83 m2/g [18]. At present, various methods for synthesizing, such as sol–gel, reverse hydrolysis, complexation method combined with argon or hydrogen sintering have been reported [19,20]. However, those methods require multi-step reactions for production of perovskite oxygen vacancy materials. Therefore, they are not easily applicable for large-scale industry. Herein, a new molten salt method is proposed for synthesizing the perovskite materials containing oxygen vacancy molten salt. KNO3 NaNO3 NaNO2 (53:7:40 wt%) system with the melting point range of 140 °C–155 °C was selected as molten salt media in which perovskite oxide was synthesized. Moreover, reaction precursor can sink at the bottom of crucible because of its small density and viscosity. The property of oxidation and the low melting point for our system facilitates reaction precursor to sink at the bottom of crucible, allowing the reaction to proceed without the need to contact with a large amount of air [21]. One advantage of molten salt method is that the sealing devices are not required for setting up the experimental conditions. As a result, huge amounts of perovskite materials can be simply produced [22,23]. For supercapacitor material, the energy can be stored by both redox reaction and vacancy adsorption of OH− ions in an alkaline electrolyte. Consequently, high capacitance can be obtained without using materials of high specific surface area. In this study, perovskite oxide LaMnO3- δ as a supercapacitor material was synthesized by the molten salt method. The morphology and oxygen vacancy of LaMnO3- δ were determined by various characterization methods. The electrochemical properties were characterized by several electrochemical measurements. The specific capacitance of the first gravimetric discharge cycle can reach 973.6 F/g at current density of 1 A/g in 6 M KOH. 2 Experimental 2.1 Preparation of LaMnO3-δ and LaMnO3 material Fig. 1 shows the schematic diagram of the preparation process of LaMnO3- δ using molten salt method. All the chemicals were dried in advance under vacuum conditions at 120 °C. The dried manganese chloride (MnCl2) and lanthanum chloride (LaCl3) with an equal molar ratio was placed in a mortar and grounded to a uniform mixing. An alumina crucible containing 30 g mixed salt KNO3 NaNO3 NaNO2 (53:7:40 wt%) was put in an open electric resistance furnace at 300 °C as maximum temperature with heating rate 10 °C/min. The mixed salt reached the melting point in about 15 min. Then, the ground sample (MnCl2 and LaCl3) was added to the molten salt through a fine corundum tube, and the preliminary product was obtained in air atmosphere at the set temperature for 3 h. After the chemical reaction, the sample in the corundum crucible was a black liquid. The product was then allowed to cool down to room temperature and washed with distilled water under vigorous magnetic stirring. The washing process was repeated several times until the pH value of the filtration liquid became around 7. Finally, crystallized black solid La–Mn–O was obtained after drying in a 100 °C vacuum oven for 10 h. The experimental processes at 200 °C and 400 °C were the same as the above, except for the final set temperature. The LaMnO3 was prepared by the sol–gel method as reported in Ref. [14]. 2.2 Material characterization The crystal structures of the samples were studied by X-ray diffraction (XRD, Bruker D8 type, Germany) in the range of 20°–90° with filtered Cu K α radiation (λ = 1.5418 Å). The X-ray photoelectron spectroscopy experiments were performed using the surface analysis system (XPS, Thermofisher Escalab Xi+). Al K α radiation (hν = 1486.6 eV) from a monochromatic X-ray source and a 500-µm light spot size was used. The valence spectrums were recorded at the pass energy of 20 eV with a step of 0.05 eV. The binding energy of other elements in the spectrum is corrected by the difference between the measured value of the carbon peak and the reference value (284.8 eV) as the charge-electric correction value. The surface morphologies of the samples were characterized by field emission scanning electron microscopy (SEM, Apreo S LoVac) and transmission electron microscope (TEM, JEM-2100 model). The compositions of elements coupled with SEM were analyzed by energy spectrometer-electron backscattering diffractometer (EDS, Octane Elect Super+Hikari Plus) for point and surface of samples. 2.3 Preparation and electrochemical behavior measurement of LaMnO3-δ electrode A mixture of the active materials (prepared LaMnO3- δ , 75 wt%), conductive agent (Super-P, 15 wt%), and binder (PTFE, 10 wt%) were placed in a small beaker and well distributed by magnetic stirring. After that, the slurry was treated with nickel foam after cleaning the foam nickel (4 × 1 cm2) ultrasonically in ethanol and deionized water for 30 min, and the areal density of the slurry was about 3 mg/cm2. The electrodes used in our system are, dried nickel electrode coated with electrode material (working electrode), Ag/AgCl electrode filled with saturated KCl (reference electrode), and carbon rod electrode as counter electrode, in addition to 6 M KOH solution as an electrolyte. The electrochemical performances of CV (cyclic voltammetry) were investigated by CHI760B electrochemical workstation (Shanghai). The galvanostatic charging–discharging (GCD) tests and EIS (electrochemical impedance spectroscopy) were conducted using AUTOLAB PGSTAT 302 N workstation. The equivalent circuits were fitted by Nova (1.8.14) software. 3 Results and discussion 3.1 Structural and morphological analysis Fig. 2 shows the thermogravimetric (TG) curve of KNO3 NaNO3 NaNO2 (53:7:40 wt%) mixture in air condition at 30 °C–800 °C. The obtained result reveals that the nitrate molten salt is very stable in air conditions within the range of 200 °C–400 °C, and the decomposition temperature of the mixed salt starts at 630 °C. Therefore, the ternary mixed nitrate molten salt can exist stably in air at 200 °C–400 °C. To understand the growth process of La–Mn–O compounds in KNO3 NaNO3 NaNO2 melt, three kinds of La–Mn–O powders were prepared at 200, 300 and 400 °C in KNO3 NaNO3 NaNO2 melt. The XRD patterns and the SEM images of the synthesized products are shown in Fig. 3 . As shown in Fig. 3(a, b), the average particle size of the product prepared at 200 °C is 20–40 nm. It is observed that the solid particles are relatively dispersed without agglomeration. However, there are many miscellaneous peaks in XRD pattern, and the matching single product is not detected. On the other hand, the particle size of the product prepared at 300 °C is about 0.5–1 µm, and the agglomeration phenomenon is observed as shown in Fig. 3(c and d). The position and intensities of the XRD peaks are in a good agreement with the characteristic peaks of La0.96MnO2.94 (PDF#89-0683). The characteristic peaks at 22.7°, 32.5°, 40°, 46.5°, 58°, 68° and 77° represent (101), (121), (220), (202), (123), (242) and (323) crystal planes, respectively, indicating that incomplete stoichiometric ratio LaMnO3- δ has been successfully prepared [24]. Moreover, there are barely miscellaneous peaks in the XRD pattern and crystal interface can be seen clearly, revealing that the product prepared by molten salt system has high purity with a clear crystal interface. When the temperature increase to 400 °C, the particle size grows to 2–5 µm with irregular morphology compared with LaMnO3- δ prepared at 300 °C, and the agglomeration phenomenon disappear as can be seen from Fig. 3(e). Compared with the XRD standard diffraction card of La0.96MnO3.15, the position of diffraction peak is basically the same as shown in Fig. 3(f). The La–Mn–O products prepared at different temperatures show similar polyhedral structures. Therefore, the temperature of the reaction does not significantly affect the morphology of La–Mn–O crystals in KNO3 NaNO3 NaNO2 melt. In molten salt system, crystal of the particles grows up through the mass transfer process in liquid phase [25]. The precursors MnCl2 and LaCl3 have certain solubility in KNO3 NaNO3 NaNO2 ternary molten salt, therefore the solute phase grows at a relatively lower temperature than its melting point [26]. Raw materials MnCl2 and LaCl3 were dissolved in molten KNO3 NaNO3 NaNO2. The structure of La3+ is stable and its valence is hard to change. While, the existence of oxygen in the molten salt aids oxidizing Mn2+ to form Mn3+ and Mn4+. At 200 °C, there are no aggregates observed for the precursor particles dissolved in molten salt. While by increasing the temperature to 300 °C, the dispersed ions of the precursor begin to aggregate, and the La–Mn–O nucleus were formed and grown. Therefore, the product is partially aggregated. With the growth of the nucleus, the oxygen dissolved in the molten salt is not adequate to form complete stoichiometric compound with the La and Mn precursors, leading to the formation of oxygen vacancy. By increasing the temperature to reach 400 °C, the size of La–Mn–O crystals grew from nano-sized to the micron-sized and detached from the aggregated crystal to form more dispersed and unique particles. At 400 °C, NaNO2 in melt decomposed into O2 and NO, leading to the replenishment of oxygen vacancy. The strong oxidation of NO could even lead to the formation of stoichiometric ratio La–Mn–O. The particle size of the crystal is inversely proportional to the width of XRD diffraction peak. Hence, the obtained results from Fig. 3 declare that the change of crystal particle size is in good agreement with the data from XRD measurements. The surface state of the material was studied by X-ray photoelectron spectroscopy (XPS) to characterize both the valence and content of the elements in the perovskite oxide. Based on the results of XPS spectra and fitting shown in Fig. 4 , La 3d region shows well separated spin-orbit components, and each spin-orbit component is further split by multiplet splitting. The peaks at 833.6 and 838.0 eV belong to the split peak of La 3d 5/2 and the peaks appearing at binding energy 850.4 and 854.8 eV are due to La 3d 3/2 as illustrated in Fig. 4(a). In addition, the doublet separation of the La 3d 5/2 and La 3d 3/2 is 16.8 eV, revealing presence of La3+ ions [14]. Generally, according to results in Fig. 4(b), the manganese exists as Mn2+, Mn3+ and Mn4+ in manganese oxides. The peaks located at 640.7, 641.9, and 643.5 eV correspond to Mn2+, Mn3+, and Mn4+, respectively. Moreover, a satellite feature appears at around 647.0 eV suggesting existence of Mn2+, while the identifiable shape at the top of the Mn 2p3/2 peak implies the formation of Mn4+ [27]. The proportion of Mn2+/Mn3+/Mn4+ was 0.30/0.47/0.23. Obviously, Mn3+ is the dominant species, and the content of Mn2+ is higher than that of Mn4+. Fig. 4(c) displays the spectrum of O 1 s, in which, the peak of 529.1 eV represents lattice oxygen, and the peak at 531.2 eV is the peak of adsorbed oxygen in air caused by environment and vacancy oxygen [14]. In order to prove the existence of vacancy oxygen, the LaMnO3 materials with complete stoichiometric ratio were prepared by traditional sol–gel method and investigated by XPS. Fig. 4(d, e) shows XPS spectra of Mn 2p and O 1 s for LaMnO3 and LaMnO3- δ . The raw curves were basically covered by the fitting curves. The binding energy of Mn 2p and O 1 s in the LaMnO3- δ synthesized by molten salt method moves 0.2 and 0.5 eV in the direction of increase. The formation of adjacent oxygen vacancies presents relatively high electron attraction and leads to higher binding energy [28]. The surface oxygen content of Oab/Ola in LaMnO3 (0.97) is lower than that in LaMnO3- δ (1.14) because of the oxygen vacancies. The crystal structure and element distribution of LaMnO3- δ were characterized by TEM and SEM-EDS as shown in Fig. 5 . The LaMnO3- δ synthesized by the molten salt method basically exhibits a three-dimensional cube shape with a distinct boundary after magnifying 10,000 times (Fig. 5a and b). The regular lattice fringes demonstrate a high degree of crystallization in Fig. 5(c). The width of lattice fringes in HRTEM is 0.28 nm, corresponding to (121) crystal plane of LaMnO3- δ . The EDS spectrum of the selected area in Fig. 6 (a) was recorded for further investigation. Fig. 6(b–e) reveals the existence of La, Mn, O and Cl in the synthesized material. The presence of small amount of Cl element may be due to the raw materials, MnCl2 and LaCl3. Fig. 6(f) shows that the atomic ratio of La/Mn is almost 1:1, at the meanwhile, the atomic ratio of oxygen to lanthanum or manganese is less than three on the basis of ZAF quantitative correction method. It is also confirmed that oxygen-deficient LaMnO3- δ was successfully synthesized by molten salt method. 3.2 Electrochemical characterization LaMnO3- δ oxide was studied as active material in the system of 6 M KOH solution in order to evaluate its potential application as an oxygen-negative intercalated supercapacitor electrode. The electrochemical test results are shown in Fig. 7 . The cyclic voltammetry (CV) measurements were performed in the potential range of 0–0.5 V (all the potentials in this study were referred to Ag/AgCl). The electrochemical reaction of LaMnO3- δ can be obtained from the CV curves at scan rates of 2 mV/s as shown in Fig. 7(a). Two peaks at 0.30 and 0.23 V correspond to the reduction of Mn4+ to Mn3+ and Mn3+ to Mn2+, respectively. While the oxidation peaks located at 0.29 and 0.38 V are due to the oxidation of Mn2+ to Mn3+ and Mn3+ to Mn4+. This result shows that LaMnO3- δ includes two steps of redox reaction in 6 M KOH under the investigated potential range. As the sweep speed increased, the CV curve shape did not change. The potential movements corresponding to the peak currents are ascribed to the polarization of the electrode. As shown in Fig. 7(b), the specific capacitances of LaMnO3- δ are 973.6, 863.5, 805.5, and 306 F/g at current densities of 1, 2, 5, and 10 A/g, respectively, confirming their reversible charge storage capability and the ability of withstanding large current density. The capacitance of LaMnO3- δ keeps constant at 82.7% under the condition of 5 A/g compared with the capacitance at the current density of 1 A/g, revealing a good rate performance. Fig. 7(c) presents the galvanostatic charging and discharging curve of LaMnO3. The specific capacitances 259.4, 216.1 and 123 F/g, at current densities of 1, 2 and 10 A/g, are much lower than those of LaMnO3- δ under the same investigated conditions. The electrode material was charged and discharged for 5000 times at applied current density of 1 A/g. The actual cycle discharge capacitance and coulomb efficiency are shown in Fig. 7(d). At 2000 cycle, the discharge specific capacitance is 648 F/g. However, more than 2000 cycles, the capacity starts to drop rapidly and only 310 F/g is left after 5000 cycles. The phenomena possibly due to the large particle size of the as-synthesized cube material and the change of the crystal structure after multiple charging and discharging, resulting in a decrease in capacity. Moreover, it is well known that La–Mn–O is an excellent catalyst for water oxidation, and oxygen vacancy can further improve the water oxidation [29]. The inset of Fig. 7(a) clearly shows occurrence of oxygen evolution near the positive scan limit. The oxygen evolution also accounts for the narrow potential range and the capacitance decay as in Fig. 7(d). In future research, precursor materials with smaller particle size or other molten salt systems to synthesize smaller particles should be applied to improve their cycling properties. Other electrolytes that are not easy to decompose can also be considered. Though the Coulomb efficiency has been maintained above 98%. The EIS spectrum is composed of a straight line in the low frequency region and a semicircle of the high frequency region. The slope of the former is related to the capacitance characteristics, while the diameter of the half circle represents the charge transfer resistor in the latter [30]. The EIS spectra before and after 5000 charge–discharge cycles were collected (Fig. 7e), and the equivalent circuits fitting were carried out by Nova software (Fig. 7f and g), and the existing parameters were quantitatively processed. Initially, the small resistance of the electrode material and the electrolyte itself (R s) was 1.69 Ω. There are two time-constants during the electrochemical reaction. The first one is related to the surface state of the electrode and the redox reaction at high frequency, and the second corresponds to the charge transfer process at low frequency. The R ct2 of 245 mΩ at the initial state easily facilities the electrode reaction for LaMnO3- δ . The Warburg impedance is very small, revealing the rapid ion transfer process. The value of R s increased by 0.1 Ω after 5000 charge–discharge cycles, indicating that the conductivity of the material is hardly changed. However, the value of R ct1 increased by 365 mΩ, indicating an increase in the surface roughness of the electrode after cyclic test which may be due to the decomposition of electrode materials during the charge and discharge progress. The increase in R ct2 from 245 to 528 mΩ implies the increased difficulty of charge transfer. The weakness of capacitance behavior is ascribed to the high value of Warburg impedance and the small slope of straight line. After circulation, the charge transfer and mass transfer processes of LaMnO3- δ became more difficult, as a result, the capacity decay in the cycle process occurred [31]. The comparison of our work with previous similar works is shown in Table 1 . The capacitance of LaMnO3- δ synthetized by molten salt method is higher than that of La0.7Sr0.3CoO3- δ (LSC)@MnO2 synthesized by controlled electrospinning combined with hydrothermal synthesis within 2000 GCD cycles [32]. Even after 5000 cycles, the capacitance of LaMnO3- δ presents higher capacitance than that of La0.5Ca0.5MnO3 synthetized by improved sol–gel method [33], and LaMnO3–SiO2 synthetized by cyclohexene-assisted impregnation method [34]. Although the capacitance of LaMnO3- δ is lower than that of PrBaMn2O6- δ synthesized by EDTA-CA method [18], but the experimental steps in this study are less with high one-off yield. In addition, the vacuum condition is not necessary and the reaction can be achieved in the air condition. Therefore, the preparation of LaMnO3- δ in molten salt is a suitable method for industrial scale because of its simple operation, low cost and high product conversion rate when compared with the traditional approaches for preparation of perovskite oxide containing oxygen vacancy. The oxygen vacancy materials synthesized by this method are not only limited to supercapacitors, but also can be used in catalysis, solar cells and many other applications [35–37]. However, the products synthesized by molten salt method possess large particle size and can easily agglomeration behavior. In the future research, the reaction conditions of molten salt will be optimized in order to obtain better quality with efficient properties. Combined with the results of a variety of electrochemical measurements above, the reaction mechanism of oxygen vacancy perovskite oxide in alkaline electrolyte is shown in Fig. 8 . The reaction is described as the following equations: (1) La(Mn2 δ 2+,Mn(1 – 2 δ ) 3+)O3− δ  + 2δOH− ↔ LaMn3+O3 + 2δe− + δH2O (2) LaMn3+O3 + 2δOH− ↔ La(Mn2 δ 4+,Mn(1 − 2 δ ) 3+)O3+ δ  + 2δe− + δH2O The LaMnO3- δ synthesized by the molten salt method includes three valence states of manganese. Two pairs of redox reactions can occur in the potential range of 0–0.5 V. The oxygen vacancy can provide ion transport channel. While the quick redox reactions produce pseudo-capacitance, the oxygen vacancies can also adsorb OH− in the alkaline electrolyte. Therefore, the prepared perovskite oxide has a large mass-specific capacitance. Moreover, the large radius of La3+ can maintain the perovskite structure of the product, which is beneficial to keep the capacity during cyclic charge and discharge processes [29]. 4 Conclusions In summary, highly pure perovskite oxides LaMnO3- δ containing oxygen vacancy was synthesized by molten salt method in KNO3 NaNO3 NaNO2 (53:7:40 wt%) melt at 300 °C. After magnifying 1000 times, the cubic particles with size of 0.5–1 µm were clearly observed. Electric charges can be stored in two ways resulting in a higher capacitance compared with the LaMnO3 of the complete stoichiometric ratio in alkaline electrolyte. Under the current density of 1 A/g, the specific capacitance of LaMnO3- δ was 973.6 F/g. After 2000 and 5000 cycles, the discharge specific capacitances were 648.0 and 310.0 F/g, respectively. The molten salt method is simple to operate, suitable for mass production, and environment-friendly, providing a new idea for the synthesis of oxygen vacancy perovskite electrode materials in the future. Acknowledgments The work was financially supported by the China Scholarship Council, the National Natural Science Foundation of China (21976047, 21790373 and 51774104), the Fundamental Research funds for the Central Universities (3072019CF1005), the Scientific Research and Special Foundation Heilongjiang Postdoctoral Science Foundation (LBH-Q15019, LBH-Q15020 and LBH-TZ0411), and Ph.D. Student Research and Innovation Fund of the Fundamental Research Funds for the Central Universities (3072019GIP1011). References [1] Wang Y. Song Y. Xia Y. Chem. Soc. Rev. 45 2016 5925 5950 Wang, Y., Song, Y., Xia, Y.Chem. Soc. Rev.45 (2016) 5925–5950. [2] P. Simon Y. Gogotsi Nat. Mater. 7 2008 845 854 Simon, P., Gogotsi, Y.Nat. Mater.7 (2008) 845–854. [3] Gao Y. Nanoscale Res. Lett. 12 2017 387 Gao, Y.Nanoscale Res. Lett.12 (2017) 387. [4] Zhang L. Hu X.S. Wang Z.P. Sun F.C. D.G. Dorrell Renew. Sustain. Energy Rev. 81 2018 1868 1878 Zhang, L., Hu, X.S., Wang, Z.P., Sun, F.C., Dorrell, D.G.Renew. Sustain. Energy Rev.81 (2018) 1868–1878. [5] Sun J. Wu C. Sun X. Hu H. Zhi C. Hou L. Yuan C. J. Mater. Chem. A 5 2017 9443 9464 Sun, J., Wu, C., Sun, X., Hu, H., Zhi, C., Hou, L., Yuan, C.J. Mater. Chem. A5 (2017) 9443–9464. [6] Wang Y. Lai W.H. Wang N. Jiang Z. Wang X.Y. Zou P.C. Lin Z.Y. Fan H.J. Kang F.Y. Wong C.P. Yang C. Energy Environ. Sci. 10 2017 941 949 Wang, Y., Lai, W.H., Wang, N., Jiang, Z., Wang, X.Y., Zou, P.C., Lin, Z.Y., Fan, H.J., Kang, F.Y., Wong, C.P., Yang, C.Energy Environ. Sci.10 (2017) 941–949. [7] Cao L.J. Tang G. Mei J. Liu H. J. Power Sources 359 2017 262 269 Cao, L.J., Tang, G., Mei, J., Liu, H.J. Power Sources359 (2017) 262–269. [8] Yao M.H. Wu P. Cheng S. Yang L.F. Zhu Y.Y. Wang M.K. Luo H.W. Wang B.F. Ye D.Q. Liu M.L. Phys. Chem. Chem. Phys. 19 2017 24689 24695 Yao, M.H., Wu, P., Cheng, S., Yang, L.F., Zhu, Y.Y., Wang, M.K., Luo, H.W., Wang, B.F., Ye, D.Q., Liu, M.L.Phys. Chem. Chem. Phys.19 (2017) 24689–24695. [9] S. Repp E. Harputlu S. Gurgen M. Castellano N. Kremer N. Pompe J. Worner A. Hoffmann R. Thomann F.M. Emen S. Weber K. Ocakoglu E. Erdem Nanoscale 10 2018 1877 1884 Repp, S., Harputlu, E., Gurgen, S., Castellano, M., Kremer, N., Pompe, N., Worner, J., Hoffmann, A., Thomann, R., Emen, F.M., Weber, S., Ocakoglu, K., Erdem, E.Nanoscale10 (2018) 1877–1884. [10] Wang Y. Xiao X. Li Q. Pang H. Small 14 2018 1802193 Wang, Y., Xiao, X., Li, Q., Pang, H.Small. 14 (2018) 1802193. [11] Kim H.S. Cook J.B. Lin H. Ko J.S. S.H. Tolbert V. Ozolins B. Dunn Nat. Mater. 16 2017 454 460 Kim, H.S., Cook, J.B., Lin, H., Ko, J.S., Tolbert, S.H., Ozolins, V., Dunn, B.Nat. Mater.16 (2017) 454–460. [12] Lin C. Lai M.O. Zhou H. Lu L. Phys. Chem. Chem. Phys. 16 2014 24874 24883 Lin, C., Lai, M.O., Zhou, H., Lu, L.Phys. Chem. Chem. Phys.16 (2014) 24874–24883. [13] Feng X. Fan Y. N. Nomura K. Kikuchi Wang L. Jiang W. A. Kawasaki Carbon 112 2017 169 176 Feng, X., Fan, Y., Nomura, N., Kikuchi, K., Wang, L., Jiang, W., Kawasaki, A.Carbon. 112 (2017) 169–176. [14] Z.A. Elsiddig Xu H. Wang D. Zhang W. Guo X. Zhang Y. Sun Z. Chen J. Electrochim. Acta 253 2017 422 429 Elsiddig, Z.A., Xu, H., Wang, D., Zhang, W., Guo, X., Zhang, Y., Sun, Z., Chen, J.Electrochim. Acta253 (2017) 422–429. [15] Liu Y. J. Dinh M.O. Tade Shao Z. ACS Appl. Mater. Interfaces 8 2016 23774 23783 Liu, Y., Dinh, J., Tade, M.O., Shao, Z.ACS Appl. Mater. Interfaces8 (2016) 23774–23783. [16] J.T. Mefford W.G. Hardin Dai S. K.P. Johnston K. Stevenson J. Nat. Mater. 13 2014 726 732 Mefford, J.T., Hardin, W.G., Dai, S., Johnston, K.P., Stevenson, K.J. Nat. Mater.13 (2014) 726–732. [17] Xu Z. Liu Y. Zhou W. M.O. Tade Shao Z. ACS Appl. Mater. Interfaces 10 2018 9415 9423 Xu, Z., Liu, Y., Zhou, W., Tade, M.O., Shao, Z.ACS Appl. Mater. Interfaces10 (2018) 9415–9423. [18] Liu Y. Wang Z.B. J.P.M. Veder Xu Z.Y. Zhong Y.J. Zhou W. M.O. Tade Wang S.B. Shao Z.P. Adv. Energy Mater. 8 2018 1702604 1702614 Liu, Y., Wang, Z.B., Veder, J.P.M., Xu, Z.Y., Zhong, Y.J., Zhou, W., Tade, M.O., Wang, S.B., Shao, Z.P.Adv. Energy Mater.8 (2018). [19] Yang W.S. Noh J.H. Jeon N.J. Kim Y.C. Ryu S. Seo J. Seok S.I. Science 348 2015 1234 1237 Yang, W.S., Noh, J.H., Jeon, N.J., Kim, Y.C., Ryu, S., Seo, J., Seok, S.I.Science. 348 (2015) 1234–1237. [20] J. Suntivich K.J. May H.A. Gasteiger J.B. Goodenough Shao-Horn Y. Science 334 2011 1383 1385 Suntivich, J., May, K.J., Gasteiger, H.A., Goodenough, J.B., Shao-Horn, Y.Science. 334 (2011) 1383–1385. [21] Zhao Y. Ji D.-B. Wang P. Yan Y.-D. Xue Y. Xu H.-B. Liang Y. Luo H.-J. Zhang M.-L. Han W. Chem. Eng. J. 349 2018 613 621 Zhao, Y., Ji, D.-.B., Wang, P., Yan, Y.-.D., Xue, Y., Xu, H.-.B., Liang, Y., Luo, H.-.J., Zhang, M.-.L., Han, W.Chem. Eng. J.349 (2018) 613–621. [22] Hu Z. Xiao X. Jin H. Li T. Chen M. Liang Z. Guo Z. Li J. Wan J. Huang L. Zhang Y. Feng G. Zhou J. Nat. Commun. 8 2017 15630 Hu, Z., Xiao, X., Jin, H., Li, T., Chen, M., Liang, Z., Guo, Z., Li, J., Wan, J., Huang, L., Zhang, Y., Feng, G., Zhou, J.Nat. Commun.. 8 (2017) 15630. [23] Xiao W. Zhou J. Yu L. Wang D. Lou X.W.D. Angew. Chem. Int. Ed. 55 2016 7427 7431 Xiao, W., Zhou, J., Yu, L., Wang, D., Lou, X.W.D.Angew. Chem. Int. Ed.55 (2016) 7427–7431. [24] P.M. Shafi N. Joseph A. Thirumurugan A.C. Bose Chem. Eng. J. 338 2018 147 156 Shafi, P.M., Joseph, N., Thirumurugan, A., Bose, A.C.Chem. Eng. J.338 (2018) 147–156. [25] Liu H. Chen D. Wang Z. Jing H. Zhang R. Appl. Catal. B 203 2017 300 313 Liu, H., Chen, D., Wang, Z., Jing, H., Zhang, R.Appl. Catal. B203 (2017) 300–313. [26] Zhu M. Zeng S. Zhang H. Li J. Cao B. Sol. Energy Mater. Sol. Cells 186 2018 200 207 Zhu, M., Zeng, S., Zhang, H., Li, J., Cao, B.Sol. Energy Mater. Sol. Cells186 (2018) 200–207. [27] M.C. Biesinger B.P. Payne A.P. Grosvenor Lau L.W.M. A.R. Gerson R.S. Smart Appl. Surf. Sci. 257 2011 2717 2730 Biesinger, M.C., Payne, B.P., Grosvenor, A.P., Lau, L.W.M., Gerson, A.R., Smart, R.S.Appl. Surf. Sci.257 (2011) 2717–2730. [28] Xing M. Zhang J. Chen F. Tian B. Chem. Commun. 47 2011 4947 4949 Xing, M., Zhang, J., Chen, F., Tian, B.Chem. Commun.47 (2011) 4947–4949. [29] S. Afzal Quan X. Zhang J. Appl. Catal. B 206 2017 692 703 Afzal, S., Quan, X., Zhang. J.Appl. Catal. B206 (2017) 692–703. [30] P.L. Taberna P. Simon J.F. Fauvarque J. Electrochem. Soc. 150 2003 A292 A300 Taberna, P.L., Simon, P., Fauvarque, J.F.J. Electrochem. Soc.150 (2003). [31] Yan Q. Wei T. Wu J. Yang X. Zhu M. Cheng K. Ye K. Zhu K. Yan J. Cao D. Wang G. Pan Y. ACS Susta. Chem. Eng. 6 2018 9640 9648 Q. Yan, T. Wei, J. Wu, X. Yang, M. Zhu, K. Cheng, K. Ye, K. Zhu, J. Yan, D. Cao, G. Wang, Y. Pan. ACS Susta. Chem. Eng.6 (2018) 9640–9648. [32] He L. Shu Y. Li W. Liu M. J. Mater. Sci.: Mater. Electron. 30 2018 17 25 He, L., Shu, Y., Li, W., Liu, M.J. Mater. Sci.: Mater. Electron.30 (2018) 17–25. [33] Mo H. Nan H. Lang X. Liu S. Qiao L. Hu X. H. Tian Ceram. Int. 44 2018 9733 9741 Mo, H., Nan, H., Lang, X., Liu, S., Qiao, L., Hu, X., Tian, H.Ceram. Int.44 (2018) 9733–9741. [34] G.W. Piburn J.T. Mefford N. Zinni K.J. Stevenson S.M. Humphrey Dalton Trans. 46 2017 977 984 Piburn, G.W., Mefford, J.T., Zinni, N., Stevenson, K.J., Humphrey, S.M.Dalton Trans.46 (2017) 977–984. [35] Zhao H. Xia J. Yin D. Luo M. Yan C. Du Y. Coord. Chem. Rev. 390 2019 32 49 Zhao, H., Xia, J., Yin, D., Luo, M., Yan, C., Du, Y.Coord. Chem. Rev.390 (2019) 32–49. [36] Xu Y. Jiang H. Li X. Xiao H. Xiao W. Wu T. J. Mater. Chem. A 2 2014 13345 13351 Xu, Y., Jiang, H., Li, X., Xiao, H., Xiao, W., Wu, T.J. Mater. Chem. A2 (2014) 13345–13351. [37] Jeon N.J. Noh J.H. Yang W.S. Kim Y.C. Ryu S. Seo J. Seok S.I. Nature 517 2015 476 480 Jeon, N.J., Noh, J.H., Yang, W.S., Kim, Y.C., Ryu, S., Seo, J., Seok, S.I.Nature517 (2015) 476–480.",
      "scopus-id": "85072174838",
      "coredata": {
        "eid": "1-s2.0-S2095495619308095",
        "dc:description": "Due to the unique structure of perovskite materials, their capacitance can be improved by introducing oxygen vacancy. In this paper, the LaMnO3- δ material containing oxygen vacancy was synthesized by molten salt method in KNO3 NaNO3 NaNO2 melt. The La–Mn–O crystal grows gradually in molten salt with the increase of temperature. It was confirmed that LaMnO3- δ with perovskite structure and incomplete oxygen content were synthesized by molten salt method and presented a three-dimensional shape. LaMnO3- δ stores energy by redox reaction and adsorption of OH− in electrolyte simultaneously. In comparison with the stoichiometric LaMnO3 prepared by the sol–gel method, LaMnO3- δ prepared by molten salt method proffered higher capacitance and better performance. The galvanostatic charge–discharge curve showed specific capacitance of 973.5 F/g under current density of 1 A/g in 6 M KOH. The capacitance of LaMnO3- δ was 82.7% under condition of 5 A/g compared with the capacitance at the current of 1A/g, and the specific capacitances of 648.0 and 310.0 F/g were obtained after 2000 and 5000 cycles of galvanostatic charging–discharging, respectively. Molten salt synthesis method is relatively simple and suitable for industrial scale, presenting a promising prospect in the synthesis of perovskite oxide materials.",
        "openArchiveArticle": "false",
        "prism:coverDate": "2020-04-30",
        "openaccessUserLicense": null,
        "prism:aggregationType": "Journal",
        "prism:url": "https://api.elsevier.com/content/article/pii/S2095495619308095",
        "dc:creator": [
          {
            "@_fa": "true",
            "$": "Song, Ya-Li"
          },
          {
            "@_fa": "true",
            "$": "Wang, Zi-Chang"
          },
          {
            "@_fa": "true",
            "$": "Yan, Yong-De"
          },
          {
            "@_fa": "true",
            "$": "Zhang, Mi-Lin"
          },
          {
            "@_fa": "true",
            "$": "Wang, Gui-Ling"
          },
          {
            "@_fa": "true",
            "$": "Yin, Tai-Qi"
          },
          {
            "@_fa": "true",
            "$": "Xue, Yun"
          },
          {
            "@_fa": "true",
            "$": "Gao, Fan"
          },
          {
            "@_fa": "true",
            "$": "Qiu, Min"
          }
        ],
        "link": [
          {
            "@_fa": "true",
            "@rel": "self",
            "@href": "https://api.elsevier.com/content/article/pii/S2095495619308095"
          },
          {
            "@_fa": "true",
            "@rel": "scidir",
            "@href": "https://www.sciencedirect.com/science/article/pii/S2095495619308095"
          }
        ],
        "dc:format": "application/json",
        "openaccessType": null,
        "pii": "S2095-4956(19)30809-5",
        "prism:volume": "43",
        "prism:publisher": "Science Press and Dalian Institute of Chemical Physics, Chinese Academy of Sciences. Published by Elsevier B.V. and Science Press.",
        "dc:title": "Molten salt synthesis and supercapacitor properties of oxygen-vacancy LaMnO3− δ",
        "prism:copyright": "© 2019 Science Press and Dalian Institute of Chemical Physics, Chinese Academy of Sciences. Published by Elsevier B.V. and Science Press. All rights reserved.",
        "openaccess": "0",
        "prism:issn": "20954956",
        "dcterms:subject": [
          {
            "@_fa": "true",
            "$": "LaMnO3- δ"
          },
          {
            "@_fa": "true",
            "$": "Perovskite oxide"
          },
          {
            "@_fa": "true",
            "$": "KNO3–NaNO3–NaNO2 melt"
          },
          {
            "@_fa": "true",
            "$": "Supercapacitor"
          },
          {
            "@_fa": "true",
            "$": "Molten salt synthesis"
          }
        ],
        "openaccessArticle": "false",
        "prism:publicationName": "Journal of Energy Chemistry",
        "openaccessSponsorType": null,
        "prism:pageRange": "173-181",
        "prism:endingPage": "181",
        "pubType": "fla",
        "prism:coverDisplayDate": "April 2020",
        "prism:doi": "10.1016/j.jechem.2019.09.007",
        "prism:startingPage": "173",
        "dc:identifier": "doi:10.1016/j.jechem.2019.09.007",
        "openaccessSponsorName": null
      },
      "objects": {
        "object": [
          {
            "@category": "thumbnail",
            "@height": "60",
            "@width": "219",
            "@_fa": "true",
            "$": "https://api.elsevier.com/content/object/eid/1-s2.0-S2095495619308095-gr1.sml?httpAccept=%2A%2F%2A",
            "@multimediatype": "GIF image file",
            "@type": "IMAGE-THUMBNAIL",
            "@size": "5642",
            "@ref": "gr1",
            "@mimetype": "image/gif"
          },
          {
            "@category": "thumbnail",
            "@height": "164",
            "@width": "201",
            "@_fa": "true",
            "$": "https://api.elsevier.com/content/object/eid/1-s2.0-S2095495619308095-gr2.sml?httpAccept=%2A%2F%2A",
            "@multimediatype": "GIF image file",
            "@type": "IMAGE-THUMBNAIL",
            "@size": "5612",
            "@ref": "gr2",
            "@mimetype": "image/gif"
          },
          {
            "@category": "thumbnail",
            "@height": "164",
            "@width": "138",
            "@_fa": "true",
            "$": "https://api.elsevier.com/content/object/eid/1-s2.0-S2095495619308095-gr3.sml?httpAccept=%2A%2F%2A",
            "@multimediatype": "GIF image file",
            "@type": "IMAGE-THUMBNAIL",
            "@size": "10244",
            "@ref": "gr3",
            "@mimetype": "image/gif"
          },
          {
            "@category": "thumbnail",
            "@height": "164",
            "@width": "169",
            "@_fa": "true",
            "$": "https://api.elsevier.com/content/object/eid/1-s2.0-S2095495619308095-gr4.sml?httpAccept=%2A%2F%2A",
            "@multimediatype": "GIF image file",
            "@type": "IMAGE-THUMBNAIL",
            "@size": "10778",
            "@ref": "gr4",
            "@mimetype": "image/gif"
          },
          {
            "@category": "thumbnail",
            "@height": "60",
            "@width": "219",
            "@_fa": "true",
            "$": "https://api.elsevier.com/content/object/eid/1-s2.0-S2095495619308095-gr5.sml?httpAccept=%2A%2F%2A",
            "@multimediatype": "GIF image file",
            "@type": "IMAGE-THUMBNAIL",
            "@size": "7604",
            "@ref": "gr5",
            "@mimetype": "image/gif"
          },
          {
            "@category": "thumbnail",
            "@height": "164",
            "@width": "152",
            "@_fa": "true",
            "$": "https://api.elsevier.com/content/object/eid/1-s2.0-S2095495619308095-gr6.sml?httpAccept=%2A%2F%2A",
            "@multimediatype": "GIF image file",
            "@type": "IMAGE-THUMBNAIL",
            "@size": "15073",
            "@ref": "gr6",
            "@mimetype": "image/gif"
          },
          {
            "@category": "thumbnail",
            "@height": "164",
            "@width": "136",
            "@_fa": "true",
            "$": "https://api.elsevier.com/content/object/eid/1-s2.0-S2095495619308095-gr7.sml?httpAccept=%2A%2F%2A",
            "@multimediatype": "GIF image file",
            "@type": "IMAGE-THUMBNAIL",
            "@size": "9375",
            "@ref": "gr7",
            "@mimetype": "image/gif"
          },
          {
            "@category": "thumbnail",
            "@height": "117",
            "@width": "219",
            "@_fa": "true",
            "$": "https://api.elsevier.com/content/object/eid/1-s2.0-S2095495619308095-gr8.sml?httpAccept=%2A%2F%2A",
            "@multimediatype": "GIF image file",
            "@type": "IMAGE-THUMBNAIL",
            "@size": "12411",
            "@ref": "gr8",
            "@mimetype": "image/gif"
          },
          {
            "@category": "thumbnail",
            "@height": "134",
            "@width": "219",
            "@_fa": "true",
            "$": "https://api.elsevier.com/content/object/eid/1-s2.0-S2095495619308095-fx1.sml?httpAccept=%2A%2F%2A",
            "@multimediatype": "GIF image file",
            "@type": "IMAGE-THUMBNAIL",
            "@size": "9390",
            "@ref": "fx1",
            "@mimetype": "image/gif"
          },
          {
            "@category": "standard",
            "@height": "185",
            "@width": "678",
            "@_fa": "true",
            "$": "https://api.elsevier.com/content/object/eid/1-s2.0-S2095495619308095-gr1.jpg?httpAccept=%2A%2F%2A",
            "@multimediatype": "JPEG image file",
            "@type": "IMAGE-DOWNSAMPLED",
            "@size": "32037",
            "@ref": "gr1",
            "@mimetype": "image/jpeg"
          },
          {
            "@category": "standard",
            "@height": "291",
            "@width": "357",
            "@_fa": "true",
            "$": "https://api.elsevier.com/content/object/eid/1-s2.0-S2095495619308095-gr2.jpg?httpAccept=%2A%2F%2A",
            "@multimediatype": "JPEG image file",
            "@type": "IMAGE-DOWNSAMPLED",
            "@size": "16771",
            "@ref": "gr2",
            "@mimetype": "image/jpeg"
          },
          {
            "@category": "standard",
            "@height": "762",
            "@width": "640",
            "@_fa": "true",
            "$": "https://api.elsevier.com/content/object/eid/1-s2.0-S2095495619308095-gr3.jpg?httpAccept=%2A%2F%2A",
            "@multimediatype": "JPEG image file",
            "@type": "IMAGE-DOWNSAMPLED",
            "@size": "98508",
            "@ref": "gr3",
            "@mimetype": "image/jpeg"
          },
          {
            "@category": "standard",
            "@height": "596",
            "@width": "614",
            "@_fa": "true",
            "$": "https://api.elsevier.com/content/object/eid/1-s2.0-S2095495619308095-gr4.jpg?httpAccept=%2A%2F%2A",
            "@multimediatype": "JPEG image file",
            "@type": "IMAGE-DOWNSAMPLED",
            "@size": "92759",
            "@ref": "gr4",
            "@mimetype": "image/jpeg"
          },
          {
            "@category": "standard",
            "@height": "187",
            "@width": "678",
            "@_fa": "true",
            "$": "https://api.elsevier.com/content/object/eid/1-s2.0-S2095495619308095-gr5.jpg?httpAccept=%2A%2F%2A",
            "@multimediatype": "JPEG image file",
            "@type": "IMAGE-DOWNSAMPLED",
            "@size": "30524",
            "@ref": "gr5",
            "@mimetype": "image/jpeg"
          },
          {
            "@category": "standard",
            "@height": "650",
            "@width": "602",
            "@_fa": "true",
            "$": "https://api.elsevier.com/content/object/eid/1-s2.0-S2095495619308095-gr6.jpg?httpAccept=%2A%2F%2A",
            "@multimediatype": "JPEG image file",
            "@type": "IMAGE-DOWNSAMPLED",
            "@size": "158903",
            "@ref": "gr6",
            "@mimetype": "image/jpeg"
          },
          {
            "@category": "standard",
            "@height": "772",
            "@width": "640",
            "@_fa": "true",
            "$": "https://api.elsevier.com/content/object/eid/1-s2.0-S2095495619308095-gr7.jpg?httpAccept=%2A%2F%2A",
            "@multimediatype": "JPEG image file",
            "@type": "IMAGE-DOWNSAMPLED",
            "@size": "124298",
            "@ref": "gr7",
            "@mimetype": "image/jpeg"
          },
          {
            "@category": "standard",
            "@height": "373",
            "@width": "696",
            "@_fa": "true",
            "$": "https://api.elsevier.com/content/object/eid/1-s2.0-S2095495619308095-gr8.jpg?httpAccept=%2A%2F%2A",
            "@multimediatype": "JPEG image file",
            "@type": "IMAGE-DOWNSAMPLED",
            "@size": "71114",
            "@ref": "gr8",
            "@mimetype": "image/jpeg"
          },
          {
            "@category": "standard",
            "@height": "185",
            "@width": "301",
            "@_fa": "true",
            "$": "https://api.elsevier.com/content/object/eid/1-s2.0-S2095495619308095-fx1.jpg?httpAccept=%2A%2F%2A",
            "@multimediatype": "JPEG image file",
            "@type": "IMAGE-DOWNSAMPLED",
            "@size": "14727",
            "@ref": "fx1",
            "@mimetype": "image/jpeg"
          },
          {
            "@category": "high",
            "@height": "818",
            "@width": "3000",
            "@_fa": "true",
            "$": "https://api.elsevier.com/content/object/eid/1-s2.0-S2095495619308095-gr1_lrg.jpg?httpAccept=%2A%2F%2A",
            "@multimediatype": "JPEG image file",
            "@type": "IMAGE-HIGH-RES",
            "@size": "248333",
            "@ref": "gr1",
            "@mimetype": "image/jpeg"
          },
          {
            "@category": "high",
            "@height": "1291",
            "@width": "1583",
            "@_fa": "true",
            "$": "https://api.elsevier.com/content/object/eid/1-s2.0-S2095495619308095-gr2_lrg.jpg?httpAccept=%2A%2F%2A",
            "@multimediatype": "JPEG image file",
            "@type": "IMAGE-HIGH-RES",
            "@size": "110276",
            "@ref": "gr2",
            "@mimetype": "image/jpeg"
          },
          {
            "@category": "high",
            "@height": "3371",
            "@width": "2833",
            "@_fa": "true",
            "$": "https://api.elsevier.com/content/object/eid/1-s2.0-S2095495619308095-gr3_lrg.jpg?httpAccept=%2A%2F%2A",
            "@multimediatype": "JPEG image file",
            "@type": "IMAGE-HIGH-RES",
            "@size": "807759",
            "@ref": "gr3",
            "@mimetype": "image/jpeg"
          },
          {
            "@category": "high",
            "@height": "2639",
            "@width": "2720",
            "@_fa": "true",
            "$": "https://api.elsevier.com/content/object/eid/1-s2.0-S2095495619308095-gr4_lrg.jpg?httpAccept=%2A%2F%2A",
            "@multimediatype": "JPEG image file",
            "@type": "IMAGE-HIGH-RES",
            "@size": "730815",
            "@ref": "gr4",
            "@mimetype": "image/jpeg"
          },
          {
            "@category": "high",
            "@height": "828",
            "@width": "3000",
            "@_fa": "true",
            "$": "https://api.elsevier.com/content/object/eid/1-s2.0-S2095495619308095-gr5_lrg.jpg?httpAccept=%2A%2F%2A",
            "@multimediatype": "JPEG image file",
            "@type": "IMAGE-HIGH-RES",
            "@size": "319612",
            "@ref": "gr5",
            "@mimetype": "image/jpeg"
          },
          {
            "@category": "high",
            "@height": "2881",
            "@width": "2667",
            "@_fa": "true",
            "$": "https://api.elsevier.com/content/object/eid/1-s2.0-S2095495619308095-gr6_lrg.jpg?httpAccept=%2A%2F%2A",
            "@multimediatype": "JPEG image file",
            "@type": "IMAGE-HIGH-RES",
            "@size": "1372730",
            "@ref": "gr6",
            "@mimetype": "image/jpeg"
          },
          {
            "@category": "high",
            "@height": "3417",
            "@width": "2833",
            "@_fa": "true",
            "$": "https://api.elsevier.com/content/object/eid/1-s2.0-S2095495619308095-gr7_lrg.jpg?httpAccept=%2A%2F%2A",
            "@multimediatype": "JPEG image file",
            "@type": "IMAGE-HIGH-RES",
            "@size": "937093",
            "@ref": "gr7",
            "@mimetype": "image/jpeg"
          },
          {
            "@category": "high",
            "@height": "1651",
            "@width": "3083",
            "@_fa": "true",
            "$": "https://api.elsevier.com/content/object/eid/1-s2.0-S2095495619308095-gr8_lrg.jpg?httpAccept=%2A%2F%2A",
            "@multimediatype": "JPEG image file",
            "@type": "IMAGE-HIGH-RES",
            "@size": "569931",
            "@ref": "gr8",
            "@mimetype": "image/jpeg"
          },
          {
            "@category": "high",
            "@height": "818",
            "@width": "1333",
            "@_fa": "true",
            "$": "https://api.elsevier.com/content/object/eid/1-s2.0-S2095495619308095-fx1_lrg.jpg?httpAccept=%2A%2F%2A",
            "@multimediatype": "JPEG image file",
            "@type": "IMAGE-HIGH-RES",
            "@size": "116454",
            "@ref": "fx1",
            "@mimetype": "image/jpeg"
          },
          {
            "@category": "standard",
            "@_fa": "true",
            "$": "https://api.elsevier.com/content/object/eid/1-s2.0-S2095495619308095-am.pdf?httpAccept=%2A%2F%2A",
            "@multimediatype": "Acrobat PDF file",
            "@type": "AAM-PDF",
            "@size": "28028040",
            "@ref": "am",
            "@mimetype": "application/pdf"
          }
        ]
      },
      "link": {
        "@rel": "abstract",
        "@href": "https://api.elsevier.com/content/abstract/scopus_id/85072174838"
      }
    }
  }
}