{
  "metadata": {
    "title": "Photocatalytic one-step synthesis of Ag nanoparticles without reducing agent and their catalytic redox performance supported on carbon",
    "authors": "; ; ",
    "journal": "Journal of Energy Chemistry",
    "date": "2019-09-30",
    "doi": "10.1016/j.jechem.2019.04.006",
    "abstract": "",
    "uri": "https://api.elsevier.com/content/article/pii/S2095495619301603",
    "pii": "S2095495619301603"
  },
  "fulltext": {
    "full-text-retrieval-response": {
      "scopus-eid": "2-s2.0-85064700138",
      "originalText": "serial JL 286353 291210 291711 291744 291809 31 Journal of Energy Chemistry JOURNALENERGYCHEMISTRY 2019-04-13 2019-04-13 2019-04-28 2019-04-28 2020-07-28T15:55:26 1-s2.0-S2095495619301603 S2095-4956(19)30160-3 S2095495619301603 10.1016/j.jechem.2019.04.006 S300 S300.2 FULL-TEXT 1-s2.0-S2095495619X0008X 2023-03-20T01:48:16.628216Z 0 0 20190901 20190930 2019 2019-04-13T06:24:25.922705Z absattachment articleinfo articletitlenorm authfirstinitialnorm authfirstsurnamenorm cid cids contenttype copyright crossmark dateloaded dateloadedtxt datesearch datesort dateupdated dco docsubtype doctype doi eid ewtransactionid hubeid indexeddate issn issnnorm itemstage itemtransactionid itemweight openaccess openarchive pg pgfirst pglast pii piinorm pubdateend pubdatestart pubdatetxt pubyr sortorder srctitle srctitlenorm srctype ssids alllist content subj subheadings suppl tomb vol volfirst volissue volumelist webpdf webpdfpagecount yearnav figure table e-component body acknowledge affil appendices articletitle auth authfirstini authfull authkeywords authlast grantnumber grantsponsor grantsponsorid primabst ref specialabst vitae 2095-4956 20954956 false 36 36 C Volume 36 5 37 46 37 46 201909 September 2019 2019-09-01 2019-09-30 2019 Special Issue: In celebration of the 70th anniversary of Dalian Institute of Chemical Physics, Chinese Academy of Sciences article fla © 2019 Science Press and Dalian Institute of Chemical Physics, Chinese Academy of Sciences. Published by Elsevier B.V. and Science Press. All rights reserved. PHOTOCATALYTICONESTEPSYNTHESISAGNANOPARTICLESWITHOUTREDUCINGAGENTCATALYTICREDOXPERFORMANCESUPPORTEDCARBON SHUI L 1 Introduction 2 Experimental 2.1 Materials 2.2 Synthesis of Ag NPs and Ag/carbon nanocomposites 2.3 Catalyst characterization 2.4 Catalytic tests 3 Results and discussion 3.1 Ag NPs, Ag/carbon composite preparation and characterization 3.2 p-Nitrophenol reduction in the liquid phase 3.3 Nitrobenzene hydrogenation in the gas phase 3.4 Oxygen reduction reaction 4 Conclusions Acknowledgments Appendix Supplementary material References XIU 2012 4271 4275 Z LIANG 2018 356 361 X ZHAO 1998 27 32 G CHOI 2016 7115 7122 D YANG 2016 10508 10517 P SU 2002 2176 2179 Y ZHENG 2008 10472 10473 J WASHIO 2006 1745 1749 I PILLAI 2004 945 951 Z MOSHE 2011 1239 1245 A STAMPLECOSKIE 2010 1825 1827 K CREIGHTON 1979 790 798 J KIM 2006 4019 4024 D GHOSH 2003 577 587 S HUANG 2008 1193 1202 L ZHOU 1999 850 852 Y SUN 2002 4736 4745 Y ZHU 2013 2118 2125 M HU 2004 183 189 J PANACEK 2014 1332 1339 A BANERJEE 2014 951 957 S REN 1998 1105 1107 Z GONG 2009 760 764 K LI 2007 2957 2960 N CHEN 2013 3192 3196 P WOAN 2009 2233 2239 K WEN 2008 743 747 Z ZHAO 2008 876 879 H LI 2010 939 943 N STEIGERWALT 2001 8097 8101 E LIU 2010 7279 7281 J PACHOLSKI 2004 4774 4777 C XIA 2009 919 922 W AN 2010 2570 2574 C TADAAKI 2009 88 94 T SCHUERCH 2003 204 207 D CAI 2014 5280 5286 B KUMAR 2016 015002 015014 V REDDY 2007 960 965 V JOURNALPHYSICSCONFERENCESERIES ZHENG 2015 948 957 Z PRICE 2015 9886 9889 S CHEN 2017 1197 1206 P KATSOUNAROS 2014 102 121 I HE 2016 2435 2443 B SHUIX2019X37 SHUIX2019X37X46 SHUIX2019X37XL SHUIX2019X37X46XL 2021-04-28T00:00:00.000Z 2021-04-28T00:00:00.000Z http://creativecommons.org/licenses/by-nc-nd/4.0/ © 2019 Science Press and Dalian Institute of Chemical Physics, Chinese Academy of Sciences. Published by Elsevier B.V. and Science Press. All rights reserved. 2019-04-15T09:27:52.198Z http://vtw.elsevier.com/data/voc/AddOnTypes/50.7/eoas South China Normal University http://data.elsevier.com/vocabulary/SciValFunders/501100003169 http://sws.geonames.org/1814991 Science and Technology Planning Project of Guangdong Province http://data.elsevier.com/vocabulary/SciValFunders/501100012245 http://sws.geonames.org/1814991 National Natural Science Foundation of China http://data.elsevier.com/vocabulary/SciValFunders/501100001809 http://sws.geonames.org/1814991 item S2095-4956(19)30160-3 S2095495619301603 1-s2.0-S2095495619301603 10.1016/j.jechem.2019.04.006 286353 2023-03-20T01:48:16.628216Z 2019-09-01 2019-09-30 1-s2.0-S2095495619301603-main.pdf https://s3-eu-west-1.amazonaws.com/prod-ucs-content-store-eu-west/content/pii:S2095495619301603/MAIN/application/pdf/0a505944f9710450fe71fa66a80288d0/main.pdf main.pdf pdf true 3737944 MAIN 10 1-s2.0-S2095495619301603-main_1.png https://s3-eu-west-1.amazonaws.com/prod-ucs-content-store-eu-west/content/pii:S2095495619301603/PREVIEW/image/png/a144b99136b601968c1800ec62e1dab4/main_1.png main_1.png png 60345 849 656 IMAGE-WEB-PDF 1 1-s2.0-S2095495619301603-gr1.jpg https://s3-eu-west-1.amazonaws.com/prod-ucs-content-store-eu-west/content/pii:S2095495619301603/gr1/DOWNSAMPLED/image/jpeg/ee06f186bc886b05ca5c16369134d3ce/gr1.jpg gr1 gr1.jpg jpg 29474 186 565 IMAGE-DOWNSAMPLED 1-s2.0-S2095495619301603-gr10.jpg https://s3-eu-west-1.amazonaws.com/prod-ucs-content-store-eu-west/content/pii:S2095495619301603/gr10/DOWNSAMPLED/image/jpeg/1c8a57c7bb741da0c57aa06e0035fff5/gr10.jpg gr10 gr10.jpg jpg 65179 395 386 IMAGE-DOWNSAMPLED 1-s2.0-S2095495619301603-gr11.jpg https://s3-eu-west-1.amazonaws.com/prod-ucs-content-store-eu-west/content/pii:S2095495619301603/gr11/DOWNSAMPLED/image/jpeg/8dce24fb35c992ce44e9aa2c93983b6c/gr11.jpg gr11 gr11.jpg jpg 101951 491 659 IMAGE-DOWNSAMPLED 1-s2.0-S2095495619301603-gr2.jpg https://s3-eu-west-1.amazonaws.com/prod-ucs-content-store-eu-west/content/pii:S2095495619301603/gr2/DOWNSAMPLED/image/jpeg/c3cf9954f9a576649fca7ccaef8120c9/gr2.jpg gr2 gr2.jpg jpg 46737 352 320 IMAGE-DOWNSAMPLED 1-s2.0-S2095495619301603-gr3.jpg https://s3-eu-west-1.amazonaws.com/prod-ucs-content-store-eu-west/content/pii:S2095495619301603/gr3/DOWNSAMPLED/image/jpeg/5db8f3e21ec9716e215034a6730038d2/gr3.jpg gr3 gr3.jpg jpg 20028 257 356 IMAGE-DOWNSAMPLED 1-s2.0-S2095495619301603-gr4.jpg https://s3-eu-west-1.amazonaws.com/prod-ucs-content-store-eu-west/content/pii:S2095495619301603/gr4/DOWNSAMPLED/image/jpeg/d03c40077cd72be15a5903554d391d64/gr4.jpg gr4 gr4.jpg jpg 23147 313 386 IMAGE-DOWNSAMPLED 1-s2.0-S2095495619301603-gr5.jpg https://s3-eu-west-1.amazonaws.com/prod-ucs-content-store-eu-west/content/pii:S2095495619301603/gr5/DOWNSAMPLED/image/jpeg/bdef40ef71ffc7c079d784f51ae031d7/gr5.jpg gr5 gr5.jpg jpg 176586 746 565 IMAGE-DOWNSAMPLED 1-s2.0-S2095495619301603-gr6.jpg https://s3-eu-west-1.amazonaws.com/prod-ucs-content-store-eu-west/content/pii:S2095495619301603/gr6/DOWNSAMPLED/image/jpeg/6c859739a080bd733c1b4cc51a1d0da9/gr6.jpg gr6 gr6.jpg jpg 7653 189 150 IMAGE-DOWNSAMPLED 1-s2.0-S2095495619301603-gr7.jpg https://s3-eu-west-1.amazonaws.com/prod-ucs-content-store-eu-west/content/pii:S2095495619301603/gr7/DOWNSAMPLED/image/jpeg/54ac7b99a123fc281289dfc844a8f305/gr7.jpg gr7 gr7.jpg jpg 134605 817 678 IMAGE-DOWNSAMPLED 1-s2.0-S2095495619301603-gr8.jpg https://s3-eu-west-1.amazonaws.com/prod-ucs-content-store-eu-west/content/pii:S2095495619301603/gr8/DOWNSAMPLED/image/jpeg/24f972b2422649e0b609ed4b7ec3c885/gr8.jpg gr8 gr8.jpg jpg 12321 109 565 IMAGE-DOWNSAMPLED 1-s2.0-S2095495619301603-gr9.jpg https://s3-eu-west-1.amazonaws.com/prod-ucs-content-store-eu-west/content/pii:S2095495619301603/gr9/DOWNSAMPLED/image/jpeg/aa7c72047d9c801bdd3cc938b88bd159/gr9.jpg gr9 gr9.jpg jpg 47267 344 489 IMAGE-DOWNSAMPLED 1-s2.0-S2095495619301603-fx1.jpg https://s3-eu-west-1.amazonaws.com/prod-ucs-content-store-eu-west/content/pii:S2095495619301603/fx1/DOWNSAMPLED/image/jpeg/8d9bdc988fd2d09ce42b376990b38062/fx1.jpg fx1 true fx1.jpg jpg 16410 184 301 IMAGE-DOWNSAMPLED 1-s2.0-S2095495619301603-fx2.jpg https://s3-eu-west-1.amazonaws.com/prod-ucs-content-store-eu-west/content/pii:S2095495619301603/fx2/DOWNSAMPLED/image/jpeg/58fb3485d944960020780723f1d52126/fx2.jpg fx2 fx2.jpg jpg 5114 151 113 IMAGE-DOWNSAMPLED 1-s2.0-S2095495619301603-fx3.jpg https://s3-eu-west-1.amazonaws.com/prod-ucs-content-store-eu-west/content/pii:S2095495619301603/fx3/DOWNSAMPLED/image/jpeg/62c6e6536e30a6705ff4e8f8613b8c4f/fx3.jpg fx3 fx3.jpg jpg 7126 151 113 IMAGE-DOWNSAMPLED 1-s2.0-S2095495619301603-fx4.jpg https://s3-eu-west-1.amazonaws.com/prod-ucs-content-store-eu-west/content/pii:S2095495619301603/fx4/DOWNSAMPLED/image/jpeg/75ac39817e2e439b659779cb298669f9/fx4.jpg fx4 fx4.jpg jpg 5746 151 113 IMAGE-DOWNSAMPLED 1-s2.0-S2095495619301603-gr1.sml https://s3-eu-west-1.amazonaws.com/prod-ucs-content-store-eu-west/content/pii:S2095495619301603/gr1/THUMBNAIL/image/gif/693969ff923b15d7546530cc6910e960/gr1.sml gr1 gr1.sml sml 4913 72 219 IMAGE-THUMBNAIL 1-s2.0-S2095495619301603-gr10.sml https://s3-eu-west-1.amazonaws.com/prod-ucs-content-store-eu-west/content/pii:S2095495619301603/gr10/THUMBNAIL/image/gif/315aaf4922b45773548e136392d2276d/gr10.sml gr10 gr10.sml sml 17438 164 160 IMAGE-THUMBNAIL 1-s2.0-S2095495619301603-gr11.sml https://s3-eu-west-1.amazonaws.com/prod-ucs-content-store-eu-west/content/pii:S2095495619301603/gr11/THUMBNAIL/image/gif/715bf97519c7e89c7e3cf14bc37f74f1/gr11.sml gr11 gr11.sml sml 10997 163 219 IMAGE-THUMBNAIL 1-s2.0-S2095495619301603-gr2.sml https://s3-eu-west-1.amazonaws.com/prod-ucs-content-store-eu-west/content/pii:S2095495619301603/gr2/THUMBNAIL/image/gif/8ae1befa257589556b83cfeb0eef7be0/gr2.sml gr2 gr2.sml sml 24446 164 149 IMAGE-THUMBNAIL 1-s2.0-S2095495619301603-gr3.sml https://s3-eu-west-1.amazonaws.com/prod-ucs-content-store-eu-west/content/pii:S2095495619301603/gr3/THUMBNAIL/image/gif/367196d7641aab06e69513ab2e95ca0c/gr3.sml gr3 gr3.sml sml 5780 158 219 IMAGE-THUMBNAIL 1-s2.0-S2095495619301603-gr4.sml https://s3-eu-west-1.amazonaws.com/prod-ucs-content-store-eu-west/content/pii:S2095495619301603/gr4/THUMBNAIL/image/gif/e7ba7fe344e77232d2f878ea440b8981/gr4.sml gr4 gr4.sml sml 5383 164 202 IMAGE-THUMBNAIL 1-s2.0-S2095495619301603-gr5.sml https://s3-eu-west-1.amazonaws.com/prod-ucs-content-store-eu-west/content/pii:S2095495619301603/gr5/THUMBNAIL/image/gif/561887be1fa2b6d30beb08fb5e405ce3/gr5.sml gr5 gr5.sml sml 16019 164 124 IMAGE-THUMBNAIL 1-s2.0-S2095495619301603-gr6.sml https://s3-eu-west-1.amazonaws.com/prod-ucs-content-store-eu-west/content/pii:S2095495619301603/gr6/THUMBNAIL/image/gif/bb3d82f44dcd8ea5eb825fff6207f3af/gr6.sml gr6 gr6.sml sml 15129 164 130 IMAGE-THUMBNAIL 1-s2.0-S2095495619301603-gr7.sml https://s3-eu-west-1.amazonaws.com/prod-ucs-content-store-eu-west/content/pii:S2095495619301603/gr7/THUMBNAIL/image/gif/608c82eca9c5dad9e775e33a7ea5ed8e/gr7.sml gr7 gr7.sml sml 7300 164 136 IMAGE-THUMBNAIL 1-s2.0-S2095495619301603-gr8.sml https://s3-eu-west-1.amazonaws.com/prod-ucs-content-store-eu-west/content/pii:S2095495619301603/gr8/THUMBNAIL/image/gif/e3abb56e31b65fe246b37797c61b4e8f/gr8.sml gr8 gr8.sml sml 2449 42 219 IMAGE-THUMBNAIL 1-s2.0-S2095495619301603-gr9.sml https://s3-eu-west-1.amazonaws.com/prod-ucs-content-store-eu-west/content/pii:S2095495619301603/gr9/THUMBNAIL/image/gif/a3166a0b6222871a960e73f53bf798b3/gr9.sml gr9 gr9.sml sml 8099 154 219 IMAGE-THUMBNAIL 1-s2.0-S2095495619301603-fx1.sml https://s3-eu-west-1.amazonaws.com/prod-ucs-content-store-eu-west/content/pii:S2095495619301603/fx1/THUMBNAIL/image/gif/b5d04b7dc8d2dfaf539158275d0cedde/fx1.sml fx1 true fx1.sml sml 11019 134 219 IMAGE-THUMBNAIL 1-s2.0-S2095495619301603-fx2.sml https://s3-eu-west-1.amazonaws.com/prod-ucs-content-store-eu-west/content/pii:S2095495619301603/fx2/THUMBNAIL/image/gif/b3001d0d9c0645ede73e009e8bc4346b/fx2.sml fx2 fx2.sml sml 15725 164 123 IMAGE-THUMBNAIL 1-s2.0-S2095495619301603-fx3.sml https://s3-eu-west-1.amazonaws.com/prod-ucs-content-store-eu-west/content/pii:S2095495619301603/fx3/THUMBNAIL/image/gif/7ed5ae1be3e824e6241565e8e9dae4cc/fx3.sml fx3 fx3.sml sml 15953 164 123 IMAGE-THUMBNAIL 1-s2.0-S2095495619301603-fx4.sml https://s3-eu-west-1.amazonaws.com/prod-ucs-content-store-eu-west/content/pii:S2095495619301603/fx4/THUMBNAIL/image/gif/14ec358b453ad180261b63159d3997f2/fx4.sml fx4 fx4.sml sml 15853 164 123 IMAGE-THUMBNAIL 1-s2.0-S2095495619301603-gr1_lrg.jpg https://s3-eu-west-1.amazonaws.com/prod-ucs-content-store-eu-west/content/pii:S2095495619301603/gr1/HIGHRES/image/jpeg/87c60204377372e2db9644428014ba0f/gr1_lrg.jpg gr1 gr1_lrg.jpg jpg 214034 821 2500 IMAGE-HIGH-RES 1-s2.0-S2095495619301603-gr10_lrg.jpg https://s3-eu-west-1.amazonaws.com/prod-ucs-content-store-eu-west/content/pii:S2095495619301603/gr10/HIGHRES/image/jpeg/c8480b4c4b2ee614e5bbe46725f8e70d/gr10_lrg.jpg gr10 gr10_lrg.jpg jpg 733002 1746 1708 IMAGE-HIGH-RES 1-s2.0-S2095495619301603-gr11_lrg.jpg https://s3-eu-west-1.amazonaws.com/prod-ucs-content-store-eu-west/content/pii:S2095495619301603/gr11/HIGHRES/image/jpeg/f24d45ab89155a472267d8294679dd25/gr11_lrg.jpg gr11 gr11_lrg.jpg jpg 792535 2175 2917 IMAGE-HIGH-RES 1-s2.0-S2095495619301603-gr2_lrg.jpg https://s3-eu-west-1.amazonaws.com/prod-ucs-content-store-eu-west/content/pii:S2095495619301603/gr2/HIGHRES/image/jpeg/6986f81a6e4f63ed2ad824690db64ae8/gr2_lrg.jpg gr2 gr2_lrg.jpg jpg 402780 1559 1417 IMAGE-HIGH-RES 1-s2.0-S2095495619301603-gr3_lrg.jpg https://s3-eu-west-1.amazonaws.com/prod-ucs-content-store-eu-west/content/pii:S2095495619301603/gr3/HIGHRES/image/jpeg/103eef41a0b22b2dffe7df26fe7cec5f/gr3_lrg.jpg gr3 gr3_lrg.jpg jpg 197370 1366 1891 IMAGE-HIGH-RES 1-s2.0-S2095495619301603-gr4_lrg.jpg https://s3-eu-west-1.amazonaws.com/prod-ucs-content-store-eu-west/content/pii:S2095495619301603/gr4/HIGHRES/image/jpeg/acd995e86220b7a4b33ea88c48ecb1cc/gr4_lrg.jpg gr4 gr4_lrg.jpg jpg 238995 1660 2050 IMAGE-HIGH-RES 1-s2.0-S2095495619301603-gr5_lrg.jpg https://s3-eu-west-1.amazonaws.com/prod-ucs-content-store-eu-west/content/pii:S2095495619301603/gr5/HIGHRES/image/jpeg/dae220f06961ab27672a4e93a7f890a6/gr5_lrg.jpg gr5 gr5_lrg.jpg jpg 1746565 3300 2500 IMAGE-HIGH-RES 1-s2.0-S2095495619301603-gr6_lrg.jpg https://s3-eu-west-1.amazonaws.com/prod-ucs-content-store-eu-west/content/pii:S2095495619301603/gr6/HIGHRES/image/jpeg/f9d343839d41522a781f91488167deb5/gr6_lrg.jpg gr6 gr6_lrg.jpg jpg 62788 842 667 IMAGE-HIGH-RES 1-s2.0-S2095495619301603-gr7_lrg.jpg https://s3-eu-west-1.amazonaws.com/prod-ucs-content-store-eu-west/content/pii:S2095495619301603/gr7/HIGHRES/image/jpeg/7f8e9e099bc4cbeb4365dafe5e1c6da8/gr7_lrg.jpg gr7 gr7_lrg.jpg jpg 1041604 3613 3000 IMAGE-HIGH-RES 1-s2.0-S2095495619301603-gr8_lrg.jpg https://s3-eu-west-1.amazonaws.com/prod-ucs-content-store-eu-west/content/pii:S2095495619301603/gr8/HIGHRES/image/jpeg/2593830b8a165c6ea8622f6e4720abe4/gr8_lrg.jpg gr8 gr8_lrg.jpg jpg 94007 482 2500 IMAGE-HIGH-RES 1-s2.0-S2095495619301603-gr9_lrg.jpg https://s3-eu-west-1.amazonaws.com/prod-ucs-content-store-eu-west/content/pii:S2095495619301603/gr9/HIGHRES/image/jpeg/aabb9dc69758de150a3aa0634c5c4e4c/gr9_lrg.jpg gr9 gr9_lrg.jpg jpg 321585 1523 2167 IMAGE-HIGH-RES 1-s2.0-S2095495619301603-fx1_lrg.jpg https://s3-eu-west-1.amazonaws.com/prod-ucs-content-store-eu-west/content/pii:S2095495619301603/fx1/HIGHRES/image/jpeg/3f559c38572e42074a6b11365abd1c36/fx1_lrg.jpg fx1 true fx1_lrg.jpg jpg 130291 816 1333 IMAGE-HIGH-RES 1-s2.0-S2095495619301603-fx2_lrg.jpg https://s3-eu-west-1.amazonaws.com/prod-ucs-content-store-eu-west/content/pii:S2095495619301603/fx2/HIGHRES/image/jpeg/ed45b0da12c78ad8fd2ddc9e6ec9b5fd/fx2_lrg.jpg fx2 fx2_lrg.jpg jpg 41331 667 500 IMAGE-HIGH-RES 1-s2.0-S2095495619301603-fx3_lrg.jpg https://s3-eu-west-1.amazonaws.com/prod-ucs-content-store-eu-west/content/pii:S2095495619301603/fx3/HIGHRES/image/jpeg/c96914befcfd8ea4c4774a7455e3ac0f/fx3_lrg.jpg fx3 fx3_lrg.jpg jpg 65038 667 500 IMAGE-HIGH-RES 1-s2.0-S2095495619301603-fx4_lrg.jpg https://s3-eu-west-1.amazonaws.com/prod-ucs-content-store-eu-west/content/pii:S2095495619301603/fx4/HIGHRES/image/jpeg/47b5d577a7a2b9f9f6f3abb60e8e3ab2/fx4_lrg.jpg fx4 fx4_lrg.jpg jpg 46234 667 500 IMAGE-HIGH-RES 1-s2.0-S2095495619301603-mmc1.docx https://s3-eu-west-1.amazonaws.com/prod-ucs-content-store-eu-west/content/pii:S2095495619301603/mmc1/MAIN/application/vnd.openxmlformats-officedocument.wordprocessingml.document/dbdb331c3f09cff196e128ce04cb15f2/mmc1.docx mmc1 mmc1.docx docx 1299825 APPLICATION 1-s2.0-S2095495619301603-am.pdf am am.pdf pdf 3470066 AAM-PDF https://s3-eu-west-1.amazonaws.com/prod-ucs-content-store-eu-west/content/egi:104RGNGL69M/MAIN/application/pdf/053e1037ecb639746d653029c3ff3992/am.pdf JECHEM 831 S2095-4956(19)30160-3 10.1016/j.jechem.2019.04.006 Science Press and Dalian Institute of Chemical Physics, Chinese Academy of Sciences Fig. 1 Different synthesis procedures: (a) sequential Ag NP synthesis-deposition method and (b) simultaneous Ag NP synthesis-deposition method. Fig 1 Fig. 2 Synthesis of Ag NPs supported on AC: (a) AgNO3–PVP solution, (b) after adding NaCl under sunlight, (c) after adding AC to the solution, and (d) after centrifugation to obtain Ag/AC at the bottom. Fig 2 Fig. 3 UV-Vis spectra of Ag NPs after exposure to natural light. Fig 3 Fig. 4 XRD patterns of synthesised catalysts. Fig 4 Fig. 5 High resolution TEM images of (a) Ag-AC, (b) AC-Ag, (c) Ag-OCNT, (d) OCNT-Ag; (e) magnified TEM image of Ag NPs in OCNT-Ag, (f) particle size distribution of the synthesised Ag NPs. Fig 5 Fig. 6 Reduction of p-nitrophenol (yellow solution) to p-aminophenol (transparent solution) in the presence of NaBH4 and carbon-supported silver nanoparticles. Fig 6 Fig. 7 Time dependent UV absorption spectra for the reduction of p-nitrophenol in the presence of (a) Ag-AC, (b) AC-Ag, (c) Ag-OCNT, (d) OCNT-Ag. (e) Plot of ln(C t/C 0) versus time for each sample. Fig 7 Fig. 8 Simplified reaction pathway for the hydrogenation of nitrobenzene. Fig 8 Fig. 9 Conversion and selectivity as a function of reaction time for the hydrogenation of nitrobenzene with Ag-based catalysts. Reaction conditions: 0.1 g catalysts, 0.3 mL/min nitrobenzene, 9 mL/min H2, temperature from 200 to 350 °C with an interval of 25 °C, 1 h at each temperature except 12 h at 350 °C. Fig 9 Fig. 10 TEM images of (a, b) AC-Ag and (c, d) OCNT-Ag after nitrobenzene hydrogenation. Fig 10 Fig. 11 Linear sweep voltammograms (LSVs, corrected for background currents) recorded in O2-saturated 0.1 M NaOH solution at a scan rate of 5 mV s−1 with different rotating rates (100, 400, 900 and 1600 rpm) showing the electrocatalytic ORR performance of (a) Ag-AC, (b) AC-Ag, (c) Ag-OCNT, and (d) OCNT-Ag. Fig 11 Table 1 BET specific surface areas and Ag loadings determined by AAS. Table 1 Samples AC OCNT Ag-AC AC-Ag Ag-OCNT OCNT-Ag Surface area (m2 g−1) 650 283 473 507 268 258 Ag loading (wt%) – – 2.6 2.7 1.8 1.2 Dedicated to the 70th anniversary of Dalian Institute of Chemical Physics, CAS, China. Photocatalytic one-step synthesis of Ag nanoparticles without reducing agent and their catalytic redox performance supported on carbon Lingling Shui a Guoxiu Zhang a Bin Hu b Xingxing Chen c Mingliang Jin a Guofu Zhou a d e Nan Li d ⁎ Martin Muhler b f ⁎ Baoxiang Peng b f ⁎ a Guangdong Provincial Key Laboratory of Optical Information Materials and Technology & Institute of Electronic Paper Displays, South China Academy of Advanced Optoelectronics, South China Normal University, Guangzhou 510006, Guangdong, China Guangdong Provincial Key Laboratory of Optical Information Materials and Technology & Institute of Electronic Paper Displays, South China Academy of Advanced Optoelectronics South China Normal University Guangzhou Guangdong 510006 China b Laboratory of Industrial Chemistry, Ruhr-University Bochum, D-44780 Bochum, Germany Laboratory of Industrial Chemistry Ruhr-University Bochum Bochum 44780 Germany c School of Chemical Engineering, University of Science and Technology Liaoning, Anshan 114051, Liaoning, China School of Chemical Engineering University of Science and Technology Liaoning Anshan Liaoning 114051 China d Shenzhen Guohua Optoelectronics Tech. Co. Ltd, Shenzhen 518110, Guangdong, China Shenzhen Guohua Optoelectronics Tech. Co. Ltd Shenzhen Guangdong 518110 China e Academy of Shenzhen Guohua Optoelectronics, Shenzhen 518110, Guangdong, China Academy of Shenzhen Guohua Optoelectronics Shenzhen Guangdong 518110 China f Max Planck Institute for Chemical Energy Conversion, D-45470 Mülheim an der Ruhr, Germany Max Planck Institute for Chemical Energy Conversion Mülheim an der Ruhr 45470 Germany ⁎ Corresponding authors. Synthesis of silver nanoparticles (Ag NPs) with state-of-the-art chemical or photo-reduction methods generally takes several steps and requires both reducing agents and stabilizers to obtain NPs with narrow size distribution. Herein, we report a novel method to synthesize Ag NPs rapidly in one step, achieving typical particle sizes in the range from 5 to 15 nm. The synthesis steps only involve three chemicals without any reducing agent: AgNO3 as precursor, polyvinylpyrrolidone (PVP) as stabilizer, and AgCl as photocatalyst. The Ag NPs were supported on carbon and showed excellent performance in thermal catalytic p-nitrophenol reduction and nitrobenzene hydrogenation, and as electrocatalyst for the oxygen reduction reaction. Graphical abstract A fast and facile synthesis method for preparing Ag nanoparticles was developed involving AgNO3 as precursor, polyvinylpyrrolidone as stabilizer, and AgCl as photocatalyst. The Ag nanoparticles supported on carbon showed excellent performance in thermal and electrocatalysis. Image, graphical abstract Keywords Silver Carbon Photoreduction Hydrogenation Oxygen reduction reaction 1 Introduction In recent years, noble-metal nanoparticles have received considerable interest because of their enhanced performance across a diverse range of fields. Among them, silver nanoparticles (Ag NPs) are currently the most widely commercialized nanomaterial. Ag NPs are applied in catalysis, energy, optoelectronics, photochemistry, and medicine [1,2]. It is also well known that silver-based compounds are highly toxic to microorganisms [3]. This property makes silver an excellent choice for medical applications. Moreover, silver is a catalyst with a long history in lab and industry, for example, in ethylene epoxidation. Various Ag NPs synthesis processes have been developed, including chemical synthesis, physical synthesis, photochemical synthesis, and biological synthesis [4–7]. Among all synthesis processes, chemical reduction is the most frequently applied method for the preparation of Ag NPs. Reduction of noble metal salts, including silver nitrate, is one of the most popular approaches [8–10]. Initially, the reduction of Ag+ ions leads to the formation of silver atoms, followed by agglomeration into oligomeric clusters. These clusters eventually turn into colloidal Ag NPs. When the nanoparticle size is much smaller than the wavelength of visible light, the colloidal solution shows different colours depending on particle size and shape [11]. The key challenge for large-scale applications is to achieve long-term-stable Ag NPs in a well-controlled process in terms of particle size and surface chemistry. Therefore, stabilizers are commonly used in combination with reducing agents, for example, the reduction of AgNO3 with NaBH4 at room temperature [12], or with ethylene glycol in the presence of polyvinylpyrrolidone (PVP), the so-called polyol process [13]. Normally, it yields 10 nm particles with a narrow size distribution. Ag NPs can also be obtained by direct photo-reduction of AgNO3 in aqueous Triton X-100 [14] or carboxymethylated chitosan (CMCTS) with UV light [15]. Both Triton X-100 and CMCTS serve simultaneously as reducing agents for the silver cations and stabilizing agents. 2–8 nm Ag NPs can be synthesised by this method. It has been reported by Zhou et al. [16] that Ag nanorods and dendrites can be obtained by photo-reduction of silver nitrate with polyvinylalcohol using UV irradiation. However, the process takes several hours under different temperatures rendering the synthesis complex. To the best of our knowledge, almost all reported photo-reduction processes require both reducing agents and stabilizers. Despite the success of the individual synthetic routes, the challenge of producing truly reproducible and highly homogeneous Ag NPs still remains. The lack of morphological control over the Ag NPs and the residual surfactants and reducing agents have significant impact on the accessibility of the Ag surface. Hence, it limits the function and applicability, especially in catalysis and medicine applications. Single reduction will typically result in a broad range of particle size (30–150 nm) and diverse shapes, e.g., spheres, rods, and plates [17–19]. Several functional agents including solvents, reducing agents and stabilizers are introduced into different stages during the synthesis process to control the morphology and particle size [20,21]. This often induces long and complicated processes. Therefore, it is difficult to reproduce and control such a process, which is one of the key objectives of this work. Carbon nanotubes (CNTs) have cylinder structure with one or more layers of graphene. All carbon atoms are bound in a hexagonal lattice except at the end in a perfect structure [22]. Multi-walled carbon nanotubes (MWCNTs) have very good mechanical and thermal stability with high conductivity. Therefore, they were first used as electrical conductive fillers in plastics. Its high surface area also renders CNTs a good candidate for catalytic applications [23,24]. Many studies have indicated an enhanced performance by employing CNTs as catalyst support [25,26]. Nanocomposites have been developed with numerous applications in the last decades, which can provide improved performance, higher stability or resistance, and economic benefit. Noble metal NPs, for practical applications, are often supported by carbon-based materials [27–30]. Research on Ag nanocomposites has been well established, e.g., Ag NPs growing on graphene oxide [31] and ZnO [32] by different reduction agents, resulting in enhanced performance [30]. This work aims at developing an efficient and highly reproducible method for the synthesis of Ag NPs supported on carbon materials in a well controllable way without using reducing agents. The developed method combines the advantages of both photochemical and chemical reactions. Ag NPs were synthesized by using AgNO3 aqueous solutions containing PVP as stabilizer and NaCl to form AgCl as photocatalyst with natural indoor daylight as light source. Both the morphology of the composites and their catalytic activities in p-nitrophenol reduction, nitrobenzene hydrogenation, and oxygen reduction reaction were investigated. 2 Experimental 2.1 Materials Sodium chloride (AR grade, Alfa Aesar), silver nitrate (AR grade, Sigma-Aldrich), PVP (M.W. 10,000, AR grade, Sigma-Aldrich), activated carbon (AC) and CNTs (Baytubes® C 150 P, Bayer AG) were applied in the synthesis. NaBH4 (AR grade, Fluka) and p-nitrophenol (AR grade, Sigma-Aldrich) were used for catalytic characterization. All chemicals and materials except CNTs were used as received without further treatment. Pristine CNTs were first washed with 1.5 M HNO3 solution at room temperature for 72 h to remove the residual growth catalyst. Purified CNTs were treated in nitric acid vapour at 200 °C under reflux for 48 h to obtain oxygen-functionalized CNTs (OCNTs) before use. A detailed description of the preparation of OCNTs can be found elsewhere [33]. Deionized water was used in all experiments. All glassware and instruments were rinsed by deionized water before use. 2.2 Synthesis of Ag NPs and Ag/carbon nanocomposites The typical synthesis protocol of Ag NPs in solution comprises the following steps: 55 mg PVP (0.5 mmol of PVP monomer) and 340 mg AgNO3 (2 mmol) were first dissolved in 400 mL deionized water, and then 2 mL NaCl (20 mM) aqueous solution was added to the AgNO3 solution. The solution was exposed to natural light with agitation for 10 min. Different amounts of PVP and NaCl were used, and the synthesis was optimized based on the optical properties of the solution. The typical synthesis procedure of Ag/carbon nanocomposite consists of the following steps: Ag NP-containing solution was synthesized first according to the protocol as mentioned above. Then, the carbon support (2.16 g) was added to the solution under agitation. The composites were labelled as Ag-AC for activated carbon support and Ag-OCNT for OCNT support (Fig. 1 a). Alternatively, the carbon support was added to the solution right after introducing NaCl aqueous solution, and then the mixed solution was exposed for 10 min to natural light. These samples were named as AC-Ag for the activated carbon support and OCNT-Ag for the OCNT support (Fig. 1b). After synthesis, all samples were centrifuged and subsequently dried in an oven overnight before further characterization or catalytic tests. 2.3 Catalyst characterization N2 physisorption was carried out at −196 °C using a NOVA 2000 series analyzer (Quantachrome Instruments). Prior to each measurement, the sample was first degassed at 200 °C for 2 h. The Ag content was determined by atomic absorption spectroscopy (AAS) (Hitachi Z-2000). X-ray diffraction (XRD) patterns were recorded using a PANalytical Empyrean Bragg-Brentano θ-θ diffractometer with Cu K α radiation. Transmission electron microscopy (TEM) measurements were carried out with a JEOL JEM-2100HR instrument. The TEM samples were prepared by dispersing the catalyst powder in ethanol under ultrasonication for 30 min and dropping the suspension on a copper grid. 2.4 Catalytic tests The reduction of p-nitrophenol to p-aminophenol with NaBH4 was employed to evaluate the catalytic activities of the prepared Ag-based catalyst. The reduction progress was followed with a UV-Vis spectrometer (Lambda 950, PerkinElmer) by monitoring the UV absorption of p-nitrophenol at 400 nm and the absorption of the product p-aminophenol at 300 nm. In a typical measurement, 2 mg carbon supported Ag NPs was added to 3 mL solution containing p-nitrophenol (0.1 mM) and NaBH4 (0.12 M), and the spectra were repeatedly recorded every 2 min in the range of 200–500 nm until the reaction was finished. The baseline shift had been eliminated when plotting the spectrum. Nitrobenzene hydrogenation was carried out in a continuous fixed-bed flow reactor in the gas phase (see Fig. S1 in the Supporting Information). The tubular quartz reactor was packed with 0.1 g of catalyst diluted with 1 g of quartz sand. Prior to the reaction, the catalyst was activated with 100 mL/min of 10 vol% H2 in He at 350 °C for 1 h. The reaction was then performed by feeding a reactant gas mixture containing 0.3 mL/min of nitrobenzene, 9 mL/min of H2 and 90.7 mL/min of He into the reactor at atmospheric pressure and temperatures ranging from 200 to 350 °C with an interval of 25 °C. A constant nitrobenzene flow (0.3 mL/min) was obtained by passing He through two nitrobenzene saturators at 80 °C. The duration of the catalytic test was 1 h for each temperature except at the highest temperature of 350 °C, which was tested for 12 h to evaluate the stability of the catalyst. The effluent products were analyzed every 10 min by an online gas chromatograph (Shimadzu GC-2014) equipped with a Valco sampling loop, a flame ionization detector (FID) and a HP-5 column. The electrochemical measurements were conducted at room temperature using a CH Instrument (CHI760E, China) in combination with a rotating disk electrode having an area of 0.2472 cm2 (PINE Research Instrumentation, USA) in 0.1 M NaOH. Ag/AgCl/3 M KCl and Pt-mesh electrode were used as reference and counter electrode, respectively. For the preparation of the catalyst ink, 5 mg of the catalyst powder was dispersed in a mixture of water, ethanol and Nafion (5%) using a volume ratio of 490:490:20, respectively, with the aid of ultrasonication for 30 min. A catalyst suspension of 10.4 µL was dropped on the glassy carbon electrode, which corresponds to a loading of 0.210 mg cm−2. The electrode was left to dry at room temperature in air for at least 30 min before being applied in the oxygen reduction reaction (ORR). The potential was scanned between 0 and −1 V (vs. Ag/AgCl/3 M KCl) at a scan rate of 5 mV s−1. The presented electrocatalytic currents were obtained by subtracting the current recorded with the electrolyte saturated with Ar from the currents measured under O2-saturated conditions. The potentials were reported with respect to the reversible hydrogen electrode (RHE) scale, according to the conversion E = E 0 + E Ag/AgCl + 0.059 × pH-iRs, where E 0 is the measured potential vs. Ag/AgCl/3 M KCl, E Ag/AgCl is the standard potential of the Ag/AgCl/3 M KCl reference electrode with respect to the standard hydrogen electrode at zero pH, 0.207 V for this case. i is the background-subtracted current measured in the O2-saturated solution. Rs is the electrolyte resistance, which was obtained directly from the CHI software at the open circuit potential. 3 Results and discussion 3.1 Ag NPs, Ag/carbon composite preparation and characterization Under the action of light, silver nitrate decomposes to metallic silver which generally appears black. This process produces large Ag/Ag2O grains in an uncontrolled way. Because of their light sensitivity, silver halides together with silver nitrate have been extensively used in photographic films and papers. A silver halide particle generates an electron-hole pair when absorbing a photon. Subsequently, the photo-generated electron combines with an Ag+ ion, which will be reduced to form an Ag0 atom, whereas the photogenerated holes oxidize H2O to O2 [34–37]. By adding trace amounts of NaCl to the AgNO3 solution, AgCl is formed. In the presence of sunlight, AgCl absorbs photons to generate electrons, which reduce Ag+ to Ag0. With PVP as stabilizer, Ag NPs are well dispersed in the aqueous solution. Different amounts of NaCl solution were added to the AgNO3 solution before exposure to sunlight, resulting in different concentrations of Cl¯ in the solution (1, 0.1, and 0.01 mM). As can be seen from the pictures in Table S1 (Supporting Information), the solution changed from transparent to pink/light-orange, which is an indication of Ag NP formation. When there was no NaCl present in the solution, the colour did not change even after 30 min, indicating a much lower reaction rate compared with that in the presence of AgCl. A significant colour change was observed for the 0.01 mM solution after 15 min. The solution started to change in colour after 10 min, when the concentration of Cl¯ was 0.1 mM in the AgNO3 solution, and it started to change significantly after 5 min at the Cl¯ concentration of 1 mM. This result implies that the amount of Cl¯ plays a key role in the Ag NPs reduction rate. More Cl¯ can generate more AgCl nuclei, and, accordingly, more electrons resulting in a higher reaction rate of Ag NP formation. Different amounts of PVP were tested during the Ag NP synthesis. The molar ratio between PVP monomer and AgNO3 was varied from 1:1 to 1:8. As can be seen from Table S2 (Supporting Information), the solution changed to different colours as a function of the amount of PVP. The colour also appeared at different periods of time during the exposure to sunlight. This result indicates that the amount of PVP has an impact on the shape and size of Ag NPs. As seen from Fig. 2 , the original AgNO3/PVP solution is transparent. After adding NaCl to the solution, it becomes light-orange, indicating the formation of Ag NPs. After adding the carbon support (AC) to the Ag NPs solution followed by centrifugation, the colour of the solution changes from light-orange to transparent due to the deposition of Ag NPs on AC. In the case of nanoscale metal particles, the absorption wavelength associated with the s-p transitions depends on the shape and size of the particles. This is a unique property of NPs due to the fact that the s-p (conduction) electrons are largely free to move throughout the NP, and their energies are therefore sensitive to the shape and size. For Ag NPs, the colour depends on their morphology and shape. The colour change of the solution from transparent to red/pink is a clear indication of Ag NP formation. When nanoparticles aggregate, the wavelengths of absorbed light change rationalizing the colour difference among the samples prepared from different amount of PVP. The UV-Vis spectra of Ag NPs were taken after exposure to natural light for different periods of time. As shown in Fig. 3 , the characteristic plasmon band of Ag at 380 nm after 7 and 14 min exposure indicates the presence of Ag NPs. However, there was no Ag NPs formation even after 14 min exposure without NaCl, indicating that Cl¯ and light exposure are the key factors in this Ag NPs synthesis strategy. The specific surface areas and Ag loadings of the prepared carbon-supported catalysts are summarized in Table 1 . The specific surface areas of AC- and OCNT-supported catalysts were close to those of the parent materials amounting to 650 m2 g−1 and 283 m2 g−1, respectively. The addition of the carbon support before or after Ag NP formation did not show a significant effect on the specific surface area. Ag loadings for Ag-AC, AC-Ag, Ag-OCNT and OCNT-Ag are 2.6, 2.7, 1.8 and 1.2 wt%, respectively. Compared with OCNT-supported Ag catalysts, AC-supported catalysts have higher Ag loadings, which is probably due to the higher specific surface area. The XRD patterns of the prepared samples are shown in Fig. 4 . AC-supported catalysts only show typical features of amorphous carbon, but no reflections of metallic Ag indicating highly dispersed small Ag particles. In comparison, both Ag-OCNT and OCNT-Ag show very small reflections at 38.1°, 44.2° and 64.4° due to metallic Ag NPs, indicating the successful synthesis of OCNT-supported Ag catalysts and the absence of large Ag particles. Furthermore, the small reflection at 32.3° (PDF# 00-001-1013) suggests a minor content of AgCl for all 4 samples. In order to assess the Ag NP morphology, high-resolution TEM was used to characterise all 4 samples. As can be seen from Fig. 5 , the Ag NPs are well dispersed on all samples. Fig. 5(a and b) is image of samples originating from adding AC to the solution before (Ag-AC) and after Ag NP (AC-Ag) formation, respectively. Fig. 5(c and d) is image of samples obtained by adding OCNTs to the solution before (Ag-OCNT) and after Ag NP (OCNT-Ag) formation, respectively. Furthermore, the lattice fringe spacings of Ag NPs in OCNT-Ag are determined to be 0.23 and 0.20 nm representing Ag (111) and Ag (200) lattice planes (Fig. 5e and Fig. S2), respectively. Fig. 5(f) shows a representative particle size distribution of the Ag-AC sample in the range up to 15 nm. Other samples show similar particle size distributions, which is consistent with the XRD results. There is no significant difference between adding the carbon support before or after the Ag NP formation. Homogeneous deposition of Ag NPs with narrow particle size distribution on the carbon supports demonstrates the advantages of the photocatalytic one-step synthesis. Because the trace amount of AgCl is well dispersed in the solution without precipitation, it acts as photocatalyst reducing Ag+ to Ag0, and PVP acts as stabilizer protecting the reduced Ag0 NPs from further agglomeration. As coupled reaction, H2O is oxidised to O2 providing electrons (oxygen evolution reaction, OER) [38,39]. As can be seen from Fig. 5, all Ag NPs are well dispersed on the carbon supports with similar particle sizes. Furthermore, there exists the possibility that the size of the Ag NPs would increase during the deposition on the carbon support. Therefore, it can be concluded that these directly synthesized Ag NPs have a particle size of less than 15 nm with an even distribution on the carbon support. 3.2 p-Nitrophenol reduction in the liquid phase The catalytic activities of the Ag-AC, AC-Ag, Ag-OCNT and OCNT-Ag samples were first examined by the reduction of p-nitrophenol to p-aminophenol in the presence of excess NaBH4. This reaction is a well-known test reaction and has been widely used to characterize the catalytic activity of functional materials. Metal NPs catalyze this reaction by facilitating electron relay from the donor BH4 − to the acceptor p-nitrophenol to overcome the kinetic barrier [40]. As can be seen from Fig. 6 , after adding carbon-supported Ag NPs to the solution, the colour of p-nitrophenol changes from yellow to transparent, clearly indicating the reduction from p-nitrophenol to p-aminophenol. The experimental blank tests with pure AC and OCNT samples were also performed. As shown in Fig. S3, it was confirmed that the reduction did not occur in the absence of Ag NPs. Fig. 7 shows typical UV-Vis spectra of the p-nitrophenol reduction with carbon-supported Ag NPs as catalyst. The absorption peak of p-nitrophenol at 400 nm gradually decreased with a concomitant increase of the 300 nm peak of p-aminophenol within 10 min after the addition of carbon-supported Ag NPs to the solution of p-nitrophenol and excess NaBH4. As can be seen from Fig. 7(a-d) (red line), the 300 nm peak is not present in the absence of supported Ag NPs in the solution. The amount of NaBH4 was much higher than that of p-nitrophenol during the test. Therefore, the concentration of NaBH4 is considered to be essentially constant during the whole reaction. The two absorption bands have the two principle components p-nitrophenol and p-aminophenol, allowing us to investigate the reaction kinetics by applying pseudo-first order kinetics. The ratio of C t and C 0 is the ratio of p-nitrophenol concentrations at time t and 0, which can be derived from the ratio of relative absorption intensity A t and A 0. The linear relationship of ln(C t/C 0) versus time indicates that the reactions follow first-order kinetics. The reaction rate constant is calculated from the slope of each straight line, which varies from 0.2 to 0.4 min−1 (Fig. 7e). The AC-supported Ag NPs show higher reaction rates than the OCNT-supported Ag NPs, which can be explained by the higher Ag loading. There are no significant differences between adding the carbon support before or after the formation of Ag NPs. Overall, all samples achieved high reaction rates demonstrating good catalytic performance. 3.3 Nitrobenzene hydrogenation in the gas phase In addition to p-nitrophenol reduction, the prepared Ag-based catalysts were also employed to catalyse the hydrogenation of nitrobenzene in the gas phase. Nitrobenzene hydrogenation is one of the most widely used approaches to produce aniline with a worldwide production capacity of 5 million metric tons annually, which is mainly used in the manufacture of precursors to polyurethane and other industrial chemicals, such as rubber processing chemicals, herbicides, dyes and pigments [41,42]. The simplified reaction pathway for the hydrogenation of nitrobenzene is shown in Fig. 8 . Nitrobenzene is first hydrogenated to nitrosobenzene, subsequently to phenylhydroxylamine and finally to aniline. The catalytic activities of the catalyst supports, i.e., AC and OCNTs, were first investigated as reference in the hydrogenation of nitrobenzene at temperatures ranging from 250 to 350 °C (see Fig. S4 in Supporting Information). The conversion of nitrobenzene was gradually increased from 0 to 2.2% with increasing the temperature from 250 to 350 °C over AC, and the selectivity was 100% to the partially hydrogenated intermediate nitrosobenzene. The conversion of nitrobenzene (i.e., from 0.4% to 7%) was considerably higher over OCNT than that over AC at all reaction temperatures, which probably can be attributed to the residual growth catalyst in OCNT despite of the intensive washing with nitric acid. The selectivity to aniline was between 60% to 80%, and the other product was nitrosobenzene. The support was stable, and there was only slight deactivation at the highest reaction temperature. The hydrogenation of nitrobenzene was further investigated with the prepared Ag-based catalysts in the temperature range between of 200 to 350 °C at atmospheric pressure (Fig. 9 ). The highest conversion of 95% was achieved with OCNT-Ag at 350 °C, whereas only 55% conversion was reached over Ag-AC at the same temperature. The selectivity of aniline was always 100% for both OCNT-based catalysts, while a maximum selectivity of 10% and 20% to nitrosobenzene was observed for AC-Ag and Ag-AC at lower temperatures, respectively. It can be seen that the conversion of nitrobenzene increases with temperature and follows the sequence OCNT-Ag > Ag-OCNT > AC-Ag > Ag-AC in the whole temperature range. In terms of turnover frequency (TOF), the trend for nitrobenzene hydrogenation is even more distinct, that is, OCNT-Ag >> Ag-OCNT >> AC-Ag > Ag-AC (see Fig. S5 in Supporting Information). In comparison with other Ag-based catalysts (Table S3), the TOF of OCNT-Ag is larger than that of previously reported Ag/TiO2 (i.e., 5.0  vs. 1.2 h−1 at 200 °C), but it is lower than that of Ag/Al2O3 applied in liquid-phase nitrobenzene hydrogenation, which can be attributed to the much lower nitrobenzene concentration and H2 pressure (1 bar vs. 30 bar). Despite the smaller specific surface area and lower Ag loading of OCNT-supported catalysts (Table 1), they showed much better activity for gas-phase nitrobenzene hydrogenation, suggesting superior structural properties. Regarding the catalyst synthesis sequence, it can be concluded that the simultaneous Ag NP formation and deposition on the support is better than the sequential Ag NP formation and deposition: OCNT-Ag > Ag-OCNT and AC-Ag > Ag-AC. Compared with the sequential NPs synthesis-deposition method, the Ag NPs formed by photoreduction were immediately adsorbed on the support during the simultaneous deposition synthesis, which prevented further aggregation of the Ag NPs. Fig. 9 shows catalyst deactivation in the whole temperature range especially at the highest temperature. All 4 catalysts lose around 30% of their activity during 12 h at 350 °C. It is worthwhile to mention that their deactivation rates are very similar, suggesting the same deactivation mechanism. Sintering of Ag NPs is assumed to be the main reason for the catalyst deactivation. By comparing the Ag particle size before and after reaction (see Fig. 10 for OCNT-Ag and AC-Ag after reaction), it is clear that the Ag particle size increases from 5 to 15 nm to 15–20 nm for OCNT-Ag and AC-Ag. However, other possible deactivation mechanisms like deposition of carbonaceous layers cannot be excluded. 3.4 Oxygen reduction reaction The development of inexpensive electrocatalysts for the oxygen reduction reaction (ORR) is a key challenge in the conversion of chemical fuels to electricity for many renewable energy conversion systems such as fuel cells and metal air batteries [43]. Therefore, we studied the electrocatalytic performances of the 4 samples in the ORR (Fig. 11 ). The linear sweep voltammograms of the Ag-AC, AC-Ag, Ag-OCNT and OCNT-Ag recorded in O2-saturated 0.1 M NaOH solution at a scan rate of 5 mV s−1 under hydrodynamic conditions by means of a rotating disk electrode (RDE) with different rotating speed (100, 400, 900 and 1600 rpm) are shown as Fig. 11(a-d), respectively. The measured current increased with higher rotating speed as expected as a result of faster O2 flux to the electrode surface [44]. The onset potential of the 4 catalysts, defined as the potential corresponding to a current density of −0.1 mA cm−2 at the rotating rate of 1600 rpm was in the order AC-Ag (0.908 V) > Ag-OCNT (0.885 V) > OCNT-Ag (0.872 V) > Ag-AC (0.865 V). However, Ag-OCNT required the lowest overpotential (0.700 V) compared with the other samples (OCNT-Ag (0.518 V), Ag-AC (0.478 V) and AC-Ag (0.449 V)) to reach a current density of −3 mA cm−2. Koutecky-Levich plots of the 4 samples at different potentials (0.2, 0.3, 0.4, 0.5 and 0.6 V) obtained from the corresponding LSVs are presented as the insets of Fig. 11(a-d). All the plots show fairly good linearity, indicating first-order reaction kinetics towards ORR. The number of electrons transferred per O2 molecule in the ORR at the potential of 0.2 V was derived to be 3.55, 3.49, 3.28 and 3.23 for AC-Ag, Ag-OCNT, OCNT-Ag and Ag-AC, respectively. It means that the catalysts favoured the selectivity of the ORR more towards the 4-electron transfer pathway. All prepared 4 samples showed good electrochemical performances, which are very similar to other reported Ag-based materials (Table S4). 4 Conclusions Ag NPs with typical sizes of 5–15 nm were synthesized by an efficient one-step method without employing reducing agents, which only involves AgNO3 as precursor, PVP as stabilizer, and AgCl as photocatalyst for providing electrons for Ag+ reduction. This synthesis requires only less than 10 min under ambient conditions in aqueous solution, rendering it suitable for continuous process conditions. All parameters are easy to control resulting in the reproducible synthesis of Ag NPs with the same physical properties. The Ag NPs were deposited on carbon supports (AC and OCNTs) to form composites as catalyst and applied in the liquid phase in p-nitrophenol reduction, in gas-phase nitrobenzene hydrogenation, and as electrocatalysts in the oxygen reduction reaction. All results demonstrated good catalytic performance. The developed process combines the advantages of photochemical and chemical synthesis, opening a highly efficient way to large-scale synthesis of Ag NPs. Acknowledgments The authors appreciate the financial support from the National Natural Science Foundation of China (61574065), Science and Technology Planning Project of Guangdong Province (2016B090906004, 2016B090918083), the Special Fund Project of Science and Technology Application in Guangdong (2017B020240002), graduate student abroad joint training project of South China Normal University. This work has also been partially supported by PCSIRT Project No. IRT_17R40, Guangdong Provincial Key Laboratory of Optical Information Materials and Technology (No. 2017B030301007), MOE International Laboratory for Optical Information Technologies, Shenzhen Science and Technology Plan (No. JSGG20170414143009027), National 111 Project and Guangdong Innovative Research Team Program (No. 2013C102). The authors would like to thank Shuting Xie at South China Normal University for UV-Vis measurement, Dr. Thomas Reinecke and Noushin Arshadi at Ruhr-University Bochum for the XRD and physisorption measurements, respectively. Supplementary material Supplementary material associated with this article can be found, in the online version, at doi:10.1016/j.jechem.2019.04.006. Appendix Supplementary material Image, application 1 References [1] Xiu Z.M. Zhang Q.B. H.L. Puppala V.L. Colvin P.J.J. Alvarez Nano. Lett. 12 2012 4271 4275 [2] Liang X.Z. Wang P. Li M.M. Zhang Q.Q. Wang Z.Y. Dai Y. Zhang X.Y. Liu Y.Y. Whangbo M.H. Huang B.B. Appl Catal B. 220 2018 356 361 [3] Zhao G.J. S.E. Stevens Biometals 11 1998 27 32 [4] Choi D.S. A.W. Robertson J.H. Warner Kim S.O. Kim H. Adv. Mater. 33 2016 7115 7122 [5] Yang P. Zheng J. Xu Y. Zhang Q. Jiang L. Adv. Mater. 47 2016 10508 10517 [6] Su Y. Xia Y. Science 5601 2002 2176 2179 [7] Zheng J. Ding Y. Tian B. Wang Z. Zhuang X. J. Am. Chem. Soc. 130 2008 10472 10473 [8] Washio I. Xiong Y. Yin Y. Xia Y. Adv. Mater. 13 2006 1745 1749 [9] Z.S. Pillai P.V. Kamat J. Phys. Chem. B 3 2004 945 951 [10] A. Moshe G. Markovich Chem. Mater. 23 2011 1239 1245 [11] K. Stamplecoskie J. Scaiano J. Am. Chem. Soc. 132 2010 1825 1827 [12] J.A. Creighton C.G. Blatchford M.G. Albrecht J. Chem. Soc., Faraday Trans. 2 1979 790 798 75 [13] Kim D. Jeong S. J. Moon Nanotechnology 17 2006 4019 4024 [14] S.K. Ghosh S. Kundu M. Mandal S. Nath T. Pal J. Nanopart. Res. 5–6 2003 577 587 [15] Huang L. Zhai M.L. Long D.W. Peng J. Xu L. Wu G.Z. Li J.Q. Wei G.S. J. Nanopart. Res. 10 2008 1193 1202 [16] Zhou Y. Yu S.H. Wang C.Y. Li X.G. Zhu Y.R. Chen Z.Y. Adv. Mater. 10 1999 850 852 [17] Sun Y. Yin Y. B.T. Mayers T. Herricks Xia Y. Chem. Mater. 14 2002 4736 4745 [18] Zhu M. Wang C. Meng D. Diao G. J. Mater. Chem. A 1 2013 2118 2125 [19] Hu J.Q. Chen Q. Xie Z.X. Han G.B. Wang R.H. Ren B. Zhang Y. Yang Z.L. Tian Z.Q. Adv. Funct. Mater. 2 2004 183 189 [20] A. Panáček R. Prucek J. Hrbáč T. Nevečná J. Šteffková R. Zbořil L. Kvítek Chem. Mater. 26 2014 1332 1339 [21] S. Banerjee K. Loza W. Meyer-Zaika O. Prymak M. Epple Chem. Mater. 26 2014 951 957 [22] Ren Z.F. Huang Z.P. Xu J.W. Wang J.H. Bush P. M.P. Siegal P.N. Provencio Science 5391 1998 1105 1107 [23] Gong K. Du F. Xia Z. M. Durstock Dai L. Science 5915 2009 760 764 [24] Li N. Chen X. L. Stoica Xia W. Qian J. J. Assmann W. Schuhmann M. Muhler Adv. Mater. 19 2007 2957 2960 [25] Chen P. Xiao T. Qian Y. Li S. Yu S. Adv. Mater. 23 2013 3192 3196 [26] Woan K. G. Pyrgiotakis W. Sigmund Adv. Mater. 21 2009 2233 2239 [27] Wen Z. Liu J. Li J. Adv. Mater. 4 2008 743 747 [28] Zhao H. Li L. Yang J. Zhang Y. Li H. Electrochem. Commun. 6 2008 876 879 [29] Li N. Xu Q. Zhou M. Xia W. Chen X. Bron M. W. Schuhmann M. Muhler Electrochem. Commun. 7 2010 939 943 [30] E.S. Steigerwalt G.A. Deluga D.E. Cliffel C.M. Lukehart J. Phys. Chem. B 105 2001 8097 8101 [31] Liu J. Fu S. Yuan B. Li Y. Deng Z. J. Am. Chem. Soc. 21 2010 7279 7281 [32] C. Pacholski A. Kornowski H. Weller Angew. Chem. Int. Ed. 36 2004 4774 4777 [33] Xia W. Jin C. S. Kundu M. Muhler Carbon 47 2009 919 922 [34] An C. Peng S. Sun Y. Avd. Mater. 23 2010 2570 2574 [35] Tadaaki T. Soc J. Photogr. Sci. Technol. Jpn. 72 2009 88 94 [36] D. Schuerch A. Currao Chimia 57 2003 204 207 [37] Cai B. Wang J. Gan S. Han D. Wu Z. Niu L. J. Mater. Chem. A 2 2014 5280 5286 [38] V. Kumar T. Uchida T. Mizuki Nakajima Y. Katsube Y. T. Hanajiri T. Maekawa Adv. Nat. Sci.: Nanosci. Nanotechnol. 7 2016 015002 015014 [39] V.R. Reddy A. Currao G. Calzaferri Journal Physics Conference Series 61 2007 960 965 [40] Zheng Z.K. Tachikawa T. T. Majima J. Am. Chem. Soc 137 2015 948 957 [41] S.W.T. Price K. Geraki K. Ignatyev P.T. Witte A.M. Beale J.F.W. Mosselmans Angew. Chem. Int. Ed. 54 2015 9886 9889 [42] Chen P. A. Khetan Yang F. V. Migunov P. Weide S.P. Stuermer Guo P. K. Kaehler Xia W. J. Mayer H. Pitsch U. Simon M. Muhler ACS Catal. 7 2017 1197 1206 [43] I. Katsounaros S. Cherevko A.R. Zeradjanin K.J.J. Mayrhofer Angew. Chem. Int. Ed. 26 2014 102 121 [44] He B.C. Chen X.X. Lu J.M. Yao S.D. Wei J. Zhao Q. Jing D.S. Huang X.N. Wang T. Electroanalysis 28 2016 2435 2443 Nan Li. Our research covers material science, chemistry and optoelectronics. Main focus is on advanced materials synthesis and their electronic application. The materials include polymers, Ag nanoparticles/nano rods, ZnO-supported nanocomposites. Photochemical, chemical, and physical methods have been used or developed during synthesis research. Both optical and electrical properties of the synthesized materials have been heavily studied. Matin Muhler's Group for Industrial Redox Catalysis. Our group performs fundamental research in the area of heterogeneous redox catalysis and aims to develop catalysts based on mechanistic insight. The examined reduction reactions comprise Fischer-Tropsch synthesis and the synthesis of methanol and higher alcohols. Oxidation catalysis focuses on the oxidative dehydrogenation of hydrocarbons and the selective oxidation of alcohols and hydrocarbons in the gas phase and in the liquid phase. Recently, we entered the fields of electrocatalysis (e.g., HER, OER, ORR and electrooxidation of alcohols) and photocatalysis (e.g., photocatalytic CO2 reduction or hydrogen generation via water splitting). Baoxiang Peng's Group for Three-Phase Catalysis. Our research interest is heterogeneous redox catalysis in the liquid phase under mild conditions. Reduction catalysis focuses on the hydrogenation of nitrobenzene and hydrodeoxygenation of biomass-derived platform chemicals such as glycerol and 5-hydroxymethylfurfural, whereas oxidation reaction comprises the selective oxidation of short chain alcohols and the challenging CH bond activation of hydrocarbons. In situ attenuated total reflection infrared spectroscopy is used to investigate reaction mechanisms of liquid-phase redox reactions.",
      "scopus-id": "85064700138",
      "coredata": {
        "eid": "1-s2.0-S2095495619301603",
        "dc:description": "Synthesis of silver nanoparticles (Ag NPs) with state-of-the-art chemical or photo-reduction methods generally takes several steps and requires both reducing agents and stabilizers to obtain NPs with narrow size distribution. Herein, we report a novel method to synthesize Ag NPs rapidly in one step, achieving typical particle sizes in the range from 5 to 15 nm. The synthesis steps only involve three chemicals without any reducing agent: AgNO3 as precursor, polyvinylpyrrolidone (PVP) as stabilizer, and AgCl as photocatalyst. The Ag NPs were supported on carbon and showed excellent performance in thermal catalytic p-nitrophenol reduction and nitrobenzene hydrogenation, and as electrocatalyst for the oxygen reduction reaction.",
        "openArchiveArticle": "false",
        "prism:coverDate": "2019-09-30",
        "openaccessUserLicense": null,
        "prism:aggregationType": "Journal",
        "prism:url": "https://api.elsevier.com/content/article/pii/S2095495619301603",
        "dc:creator": [
          {
            "@_fa": "true",
            "$": "Shui, Lingling"
          },
          {
            "@_fa": "true",
            "$": "Zhang, Guoxiu"
          },
          {
            "@_fa": "true",
            "$": "Hu, Bin"
          },
          {
            "@_fa": "true",
            "$": "Chen, Xingxing"
          },
          {
            "@_fa": "true",
            "$": "Jin, Mingliang"
          },
          {
            "@_fa": "true",
            "$": "Zhou, Guofu"
          },
          {
            "@_fa": "true",
            "$": "Li, Nan"
          },
          {
            "@_fa": "true",
            "$": "Muhler, Martin"
          },
          {
            "@_fa": "true",
            "$": "Peng, Baoxiang"
          }
        ],
        "link": [
          {
            "@_fa": "true",
            "@rel": "self",
            "@href": "https://api.elsevier.com/content/article/pii/S2095495619301603"
          },
          {
            "@_fa": "true",
            "@rel": "scidir",
            "@href": "https://www.sciencedirect.com/science/article/pii/S2095495619301603"
          }
        ],
        "dc:format": "application/json",
        "openaccessType": null,
        "pii": "S2095-4956(19)30160-3",
        "prism:volume": "36",
        "prism:publisher": "Science Press and Dalian Institute of Chemical Physics, Chinese Academy of Sciences. Published by Elsevier B.V. and Science Press.",
        "dc:title": "Photocatalytic one-step synthesis of Ag nanoparticles without reducing agent and their catalytic redox performance supported on carbon",
        "prism:copyright": "© 2019 Science Press and Dalian Institute of Chemical Physics, Chinese Academy of Sciences. Published by Elsevier B.V. and Science Press. All rights reserved.",
        "prism:issueName": "Special Issue: In celebration of the 70th anniversary of Dalian Institute of Chemical Physics, Chinese Academy of Sciences",
        "openaccess": "0",
        "prism:issn": "20954956",
        "dcterms:subject": [
          {
            "@_fa": "true",
            "$": "Silver"
          },
          {
            "@_fa": "true",
            "$": "Carbon"
          },
          {
            "@_fa": "true",
            "$": "Photoreduction"
          },
          {
            "@_fa": "true",
            "$": "Hydrogenation"
          },
          {
            "@_fa": "true",
            "$": "Oxygen reduction reaction"
          }
        ],
        "openaccessArticle": "false",
        "prism:publicationName": "Journal of Energy Chemistry",
        "openaccessSponsorType": null,
        "prism:pageRange": "37-46",
        "prism:endingPage": "46",
        "pubType": "fla",
        "prism:coverDisplayDate": "September 2019",
        "prism:doi": "10.1016/j.jechem.2019.04.006",
        "prism:startingPage": "37",
        "dc:identifier": "doi:10.1016/j.jechem.2019.04.006",
        "openaccessSponsorName": null
      },
      "objects": {
        "object": [
          {
            "@category": "standard",
            "@height": "186",
            "@width": "565",
            "@_fa": "true",
            "$": "https://api.elsevier.com/content/object/eid/1-s2.0-S2095495619301603-gr1.jpg?httpAccept=%2A%2F%2A",
            "@multimediatype": "JPEG image file",
            "@type": "IMAGE-DOWNSAMPLED",
            "@size": "29474",
            "@ref": "gr1",
            "@mimetype": "image/jpeg"
          },
          {
            "@category": "standard",
            "@height": "395",
            "@width": "386",
            "@_fa": "true",
            "$": "https://api.elsevier.com/content/object/eid/1-s2.0-S2095495619301603-gr10.jpg?httpAccept=%2A%2F%2A",
            "@multimediatype": "JPEG image file",
            "@type": "IMAGE-DOWNSAMPLED",
            "@size": "65179",
            "@ref": "gr10",
            "@mimetype": "image/jpeg"
          },
          {
            "@category": "standard",
            "@height": "491",
            "@width": "659",
            "@_fa": "true",
            "$": "https://api.elsevier.com/content/object/eid/1-s2.0-S2095495619301603-gr11.jpg?httpAccept=%2A%2F%2A",
            "@multimediatype": "JPEG image file",
            "@type": "IMAGE-DOWNSAMPLED",
            "@size": "101951",
            "@ref": "gr11",
            "@mimetype": "image/jpeg"
          },
          {
            "@category": "standard",
            "@height": "352",
            "@width": "320",
            "@_fa": "true",
            "$": "https://api.elsevier.com/content/object/eid/1-s2.0-S2095495619301603-gr2.jpg?httpAccept=%2A%2F%2A",
            "@multimediatype": "JPEG image file",
            "@type": "IMAGE-DOWNSAMPLED",
            "@size": "46737",
            "@ref": "gr2",
            "@mimetype": "image/jpeg"
          },
          {
            "@category": "standard",
            "@height": "257",
            "@width": "356",
            "@_fa": "true",
            "$": "https://api.elsevier.com/content/object/eid/1-s2.0-S2095495619301603-gr3.jpg?httpAccept=%2A%2F%2A",
            "@multimediatype": "JPEG image file",
            "@type": "IMAGE-DOWNSAMPLED",
            "@size": "20028",
            "@ref": "gr3",
            "@mimetype": "image/jpeg"
          },
          {
            "@category": "standard",
            "@height": "313",
            "@width": "386",
            "@_fa": "true",
            "$": "https://api.elsevier.com/content/object/eid/1-s2.0-S2095495619301603-gr4.jpg?httpAccept=%2A%2F%2A",
            "@multimediatype": "JPEG image file",
            "@type": "IMAGE-DOWNSAMPLED",
            "@size": "23147",
            "@ref": "gr4",
            "@mimetype": "image/jpeg"
          },
          {
            "@category": "standard",
            "@height": "746",
            "@width": "565",
            "@_fa": "true",
            "$": "https://api.elsevier.com/content/object/eid/1-s2.0-S2095495619301603-gr5.jpg?httpAccept=%2A%2F%2A",
            "@multimediatype": "JPEG image file",
            "@type": "IMAGE-DOWNSAMPLED",
            "@size": "176586",
            "@ref": "gr5",
            "@mimetype": "image/jpeg"
          },
          {
            "@category": "standard",
            "@height": "189",
            "@width": "150",
            "@_fa": "true",
            "$": "https://api.elsevier.com/content/object/eid/1-s2.0-S2095495619301603-gr6.jpg?httpAccept=%2A%2F%2A",
            "@multimediatype": "JPEG image file",
            "@type": "IMAGE-DOWNSAMPLED",
            "@size": "7653",
            "@ref": "gr6",
            "@mimetype": "image/jpeg"
          },
          {
            "@category": "standard",
            "@height": "817",
            "@width": "678",
            "@_fa": "true",
            "$": "https://api.elsevier.com/content/object/eid/1-s2.0-S2095495619301603-gr7.jpg?httpAccept=%2A%2F%2A",
            "@multimediatype": "JPEG image file",
            "@type": "IMAGE-DOWNSAMPLED",
            "@size": "134605",
            "@ref": "gr7",
            "@mimetype": "image/jpeg"
          },
          {
            "@category": "standard",
            "@height": "109",
            "@width": "565",
            "@_fa": "true",
            "$": "https://api.elsevier.com/content/object/eid/1-s2.0-S2095495619301603-gr8.jpg?httpAccept=%2A%2F%2A",
            "@multimediatype": "JPEG image file",
            "@type": "IMAGE-DOWNSAMPLED",
            "@size": "12321",
            "@ref": "gr8",
            "@mimetype": "image/jpeg"
          },
          {
            "@category": "standard",
            "@height": "344",
            "@width": "489",
            "@_fa": "true",
            "$": "https://api.elsevier.com/content/object/eid/1-s2.0-S2095495619301603-gr9.jpg?httpAccept=%2A%2F%2A",
            "@multimediatype": "JPEG image file",
            "@type": "IMAGE-DOWNSAMPLED",
            "@size": "47267",
            "@ref": "gr9",
            "@mimetype": "image/jpeg"
          },
          {
            "@category": "standard",
            "@height": "184",
            "@width": "301",
            "@_fa": "true",
            "$": "https://api.elsevier.com/content/object/eid/1-s2.0-S2095495619301603-fx1.jpg?httpAccept=%2A%2F%2A",
            "@multimediatype": "JPEG image file",
            "@type": "IMAGE-DOWNSAMPLED",
            "@size": "16410",
            "@ref": "fx1",
            "@mimetype": "image/jpeg"
          },
          {
            "@category": "standard",
            "@height": "151",
            "@width": "113",
            "@_fa": "true",
            "$": "https://api.elsevier.com/content/object/eid/1-s2.0-S2095495619301603-fx2.jpg?httpAccept=%2A%2F%2A",
            "@multimediatype": "JPEG image file",
            "@type": "IMAGE-DOWNSAMPLED",
            "@size": "5114",
            "@ref": "fx2",
            "@mimetype": "image/jpeg"
          },
          {
            "@category": "standard",
            "@height": "151",
            "@width": "113",
            "@_fa": "true",
            "$": "https://api.elsevier.com/content/object/eid/1-s2.0-S2095495619301603-fx3.jpg?httpAccept=%2A%2F%2A",
            "@multimediatype": "JPEG image file",
            "@type": "IMAGE-DOWNSAMPLED",
            "@size": "7126",
            "@ref": "fx3",
            "@mimetype": "image/jpeg"
          },
          {
            "@category": "standard",
            "@height": "151",
            "@width": "113",
            "@_fa": "true",
            "$": "https://api.elsevier.com/content/object/eid/1-s2.0-S2095495619301603-fx4.jpg?httpAccept=%2A%2F%2A",
            "@multimediatype": "JPEG image file",
            "@type": "IMAGE-DOWNSAMPLED",
            "@size": "5746",
            "@ref": "fx4",
            "@mimetype": "image/jpeg"
          },
          {
            "@category": "thumbnail",
            "@height": "72",
            "@width": "219",
            "@_fa": "true",
            "$": "https://api.elsevier.com/content/object/eid/1-s2.0-S2095495619301603-gr1.sml?httpAccept=%2A%2F%2A",
            "@multimediatype": "GIF image file",
            "@type": "IMAGE-THUMBNAIL",
            "@size": "4913",
            "@ref": "gr1",
            "@mimetype": "image/gif"
          },
          {
            "@category": "thumbnail",
            "@height": "164",
            "@width": "160",
            "@_fa": "true",
            "$": "https://api.elsevier.com/content/object/eid/1-s2.0-S2095495619301603-gr10.sml?httpAccept=%2A%2F%2A",
            "@multimediatype": "GIF image file",
            "@type": "IMAGE-THUMBNAIL",
            "@size": "17438",
            "@ref": "gr10",
            "@mimetype": "image/gif"
          },
          {
            "@category": "thumbnail",
            "@height": "163",
            "@width": "219",
            "@_fa": "true",
            "$": "https://api.elsevier.com/content/object/eid/1-s2.0-S2095495619301603-gr11.sml?httpAccept=%2A%2F%2A",
            "@multimediatype": "GIF image file",
            "@type": "IMAGE-THUMBNAIL",
            "@size": "10997",
            "@ref": "gr11",
            "@mimetype": "image/gif"
          },
          {
            "@category": "thumbnail",
            "@height": "164",
            "@width": "149",
            "@_fa": "true",
            "$": "https://api.elsevier.com/content/object/eid/1-s2.0-S2095495619301603-gr2.sml?httpAccept=%2A%2F%2A",
            "@multimediatype": "GIF image file",
            "@type": "IMAGE-THUMBNAIL",
            "@size": "24446",
            "@ref": "gr2",
            "@mimetype": "image/gif"
          },
          {
            "@category": "thumbnail",
            "@height": "158",
            "@width": "219",
            "@_fa": "true",
            "$": "https://api.elsevier.com/content/object/eid/1-s2.0-S2095495619301603-gr3.sml?httpAccept=%2A%2F%2A",
            "@multimediatype": "GIF image file",
            "@type": "IMAGE-THUMBNAIL",
            "@size": "5780",
            "@ref": "gr3",
            "@mimetype": "image/gif"
          },
          {
            "@category": "thumbnail",
            "@height": "164",
            "@width": "202",
            "@_fa": "true",
            "$": "https://api.elsevier.com/content/object/eid/1-s2.0-S2095495619301603-gr4.sml?httpAccept=%2A%2F%2A",
            "@multimediatype": "GIF image file",
            "@type": "IMAGE-THUMBNAIL",
            "@size": "5383",
            "@ref": "gr4",
            "@mimetype": "image/gif"
          },
          {
            "@category": "thumbnail",
            "@height": "164",
            "@width": "124",
            "@_fa": "true",
            "$": "https://api.elsevier.com/content/object/eid/1-s2.0-S2095495619301603-gr5.sml?httpAccept=%2A%2F%2A",
            "@multimediatype": "GIF image file",
            "@type": "IMAGE-THUMBNAIL",
            "@size": "16019",
            "@ref": "gr5",
            "@mimetype": "image/gif"
          },
          {
            "@category": "thumbnail",
            "@height": "164",
            "@width": "130",
            "@_fa": "true",
            "$": "https://api.elsevier.com/content/object/eid/1-s2.0-S2095495619301603-gr6.sml?httpAccept=%2A%2F%2A",
            "@multimediatype": "GIF image file",
            "@type": "IMAGE-THUMBNAIL",
            "@size": "15129",
            "@ref": "gr6",
            "@mimetype": "image/gif"
          },
          {
            "@category": "thumbnail",
            "@height": "164",
            "@width": "136",
            "@_fa": "true",
            "$": "https://api.elsevier.com/content/object/eid/1-s2.0-S2095495619301603-gr7.sml?httpAccept=%2A%2F%2A",
            "@multimediatype": "GIF image file",
            "@type": "IMAGE-THUMBNAIL",
            "@size": "7300",
            "@ref": "gr7",
            "@mimetype": "image/gif"
          },
          {
            "@category": "thumbnail",
            "@height": "42",
            "@width": "219",
            "@_fa": "true",
            "$": "https://api.elsevier.com/content/object/eid/1-s2.0-S2095495619301603-gr8.sml?httpAccept=%2A%2F%2A",
            "@multimediatype": "GIF image file",
            "@type": "IMAGE-THUMBNAIL",
            "@size": "2449",
            "@ref": "gr8",
            "@mimetype": "image/gif"
          },
          {
            "@category": "thumbnail",
            "@height": "154",
            "@width": "219",
            "@_fa": "true",
            "$": "https://api.elsevier.com/content/object/eid/1-s2.0-S2095495619301603-gr9.sml?httpAccept=%2A%2F%2A",
            "@multimediatype": "GIF image file",
            "@type": "IMAGE-THUMBNAIL",
            "@size": "8099",
            "@ref": "gr9",
            "@mimetype": "image/gif"
          },
          {
            "@category": "thumbnail",
            "@height": "134",
            "@width": "219",
            "@_fa": "true",
            "$": "https://api.elsevier.com/content/object/eid/1-s2.0-S2095495619301603-fx1.sml?httpAccept=%2A%2F%2A",
            "@multimediatype": "GIF image file",
            "@type": "IMAGE-THUMBNAIL",
            "@size": "11019",
            "@ref": "fx1",
            "@mimetype": "image/gif"
          },
          {
            "@category": "thumbnail",
            "@height": "164",
            "@width": "123",
            "@_fa": "true",
            "$": "https://api.elsevier.com/content/object/eid/1-s2.0-S2095495619301603-fx2.sml?httpAccept=%2A%2F%2A",
            "@multimediatype": "GIF image file",
            "@type": "IMAGE-THUMBNAIL",
            "@size": "15725",
            "@ref": "fx2",
            "@mimetype": "image/gif"
          },
          {
            "@category": "thumbnail",
            "@height": "164",
            "@width": "123",
            "@_fa": "true",
            "$": "https://api.elsevier.com/content/object/eid/1-s2.0-S2095495619301603-fx3.sml?httpAccept=%2A%2F%2A",
            "@multimediatype": "GIF image file",
            "@type": "IMAGE-THUMBNAIL",
            "@size": "15953",
            "@ref": "fx3",
            "@mimetype": "image/gif"
          },
          {
            "@category": "thumbnail",
            "@height": "164",
            "@width": "123",
            "@_fa": "true",
            "$": "https://api.elsevier.com/content/object/eid/1-s2.0-S2095495619301603-fx4.sml?httpAccept=%2A%2F%2A",
            "@multimediatype": "GIF image file",
            "@type": "IMAGE-THUMBNAIL",
            "@size": "15853",
            "@ref": "fx4",
            "@mimetype": "image/gif"
          },
          {
            "@category": "high",
            "@height": "821",
            "@width": "2500",
            "@_fa": "true",
            "$": "https://api.elsevier.com/content/object/eid/1-s2.0-S2095495619301603-gr1_lrg.jpg?httpAccept=%2A%2F%2A",
            "@multimediatype": "JPEG image file",
            "@type": "IMAGE-HIGH-RES",
            "@size": "214034",
            "@ref": "gr1",
            "@mimetype": "image/jpeg"
          },
          {
            "@category": "high",
            "@height": "1746",
            "@width": "1708",
            "@_fa": "true",
            "$": "https://api.elsevier.com/content/object/eid/1-s2.0-S2095495619301603-gr10_lrg.jpg?httpAccept=%2A%2F%2A",
            "@multimediatype": "JPEG image file",
            "@type": "IMAGE-HIGH-RES",
            "@size": "733002",
            "@ref": "gr10",
            "@mimetype": "image/jpeg"
          },
          {
            "@category": "high",
            "@height": "2175",
            "@width": "2917",
            "@_fa": "true",
            "$": "https://api.elsevier.com/content/object/eid/1-s2.0-S2095495619301603-gr11_lrg.jpg?httpAccept=%2A%2F%2A",
            "@multimediatype": "JPEG image file",
            "@type": "IMAGE-HIGH-RES",
            "@size": "792535",
            "@ref": "gr11",
            "@mimetype": "image/jpeg"
          },
          {
            "@category": "high",
            "@height": "1559",
            "@width": "1417",
            "@_fa": "true",
            "$": "https://api.elsevier.com/content/object/eid/1-s2.0-S2095495619301603-gr2_lrg.jpg?httpAccept=%2A%2F%2A",
            "@multimediatype": "JPEG image file",
            "@type": "IMAGE-HIGH-RES",
            "@size": "402780",
            "@ref": "gr2",
            "@mimetype": "image/jpeg"
          },
          {
            "@category": "high",
            "@height": "1366",
            "@width": "1891",
            "@_fa": "true",
            "$": "https://api.elsevier.com/content/object/eid/1-s2.0-S2095495619301603-gr3_lrg.jpg?httpAccept=%2A%2F%2A",
            "@multimediatype": "JPEG image file",
            "@type": "IMAGE-HIGH-RES",
            "@size": "197370",
            "@ref": "gr3",
            "@mimetype": "image/jpeg"
          },
          {
            "@category": "high",
            "@height": "1660",
            "@width": "2050",
            "@_fa": "true",
            "$": "https://api.elsevier.com/content/object/eid/1-s2.0-S2095495619301603-gr4_lrg.jpg?httpAccept=%2A%2F%2A",
            "@multimediatype": "JPEG image file",
            "@type": "IMAGE-HIGH-RES",
            "@size": "238995",
            "@ref": "gr4",
            "@mimetype": "image/jpeg"
          },
          {
            "@category": "high",
            "@height": "3300",
            "@width": "2500",
            "@_fa": "true",
            "$": "https://api.elsevier.com/content/object/eid/1-s2.0-S2095495619301603-gr5_lrg.jpg?httpAccept=%2A%2F%2A",
            "@multimediatype": "JPEG image file",
            "@type": "IMAGE-HIGH-RES",
            "@size": "1746565",
            "@ref": "gr5",
            "@mimetype": "image/jpeg"
          },
          {
            "@category": "high",
            "@height": "842",
            "@width": "667",
            "@_fa": "true",
            "$": "https://api.elsevier.com/content/object/eid/1-s2.0-S2095495619301603-gr6_lrg.jpg?httpAccept=%2A%2F%2A",
            "@multimediatype": "JPEG image file",
            "@type": "IMAGE-HIGH-RES",
            "@size": "62788",
            "@ref": "gr6",
            "@mimetype": "image/jpeg"
          },
          {
            "@category": "high",
            "@height": "3613",
            "@width": "3000",
            "@_fa": "true",
            "$": "https://api.elsevier.com/content/object/eid/1-s2.0-S2095495619301603-gr7_lrg.jpg?httpAccept=%2A%2F%2A",
            "@multimediatype": "JPEG image file",
            "@type": "IMAGE-HIGH-RES",
            "@size": "1041604",
            "@ref": "gr7",
            "@mimetype": "image/jpeg"
          },
          {
            "@category": "high",
            "@height": "482",
            "@width": "2500",
            "@_fa": "true",
            "$": "https://api.elsevier.com/content/object/eid/1-s2.0-S2095495619301603-gr8_lrg.jpg?httpAccept=%2A%2F%2A",
            "@multimediatype": "JPEG image file",
            "@type": "IMAGE-HIGH-RES",
            "@size": "94007",
            "@ref": "gr8",
            "@mimetype": "image/jpeg"
          },
          {
            "@category": "high",
            "@height": "1523",
            "@width": "2167",
            "@_fa": "true",
            "$": "https://api.elsevier.com/content/object/eid/1-s2.0-S2095495619301603-gr9_lrg.jpg?httpAccept=%2A%2F%2A",
            "@multimediatype": "JPEG image file",
            "@type": "IMAGE-HIGH-RES",
            "@size": "321585",
            "@ref": "gr9",
            "@mimetype": "image/jpeg"
          },
          {
            "@category": "high",
            "@height": "816",
            "@width": "1333",
            "@_fa": "true",
            "$": "https://api.elsevier.com/content/object/eid/1-s2.0-S2095495619301603-fx1_lrg.jpg?httpAccept=%2A%2F%2A",
            "@multimediatype": "JPEG image file",
            "@type": "IMAGE-HIGH-RES",
            "@size": "130291",
            "@ref": "fx1",
            "@mimetype": "image/jpeg"
          },
          {
            "@category": "high",
            "@height": "667",
            "@width": "500",
            "@_fa": "true",
            "$": "https://api.elsevier.com/content/object/eid/1-s2.0-S2095495619301603-fx2_lrg.jpg?httpAccept=%2A%2F%2A",
            "@multimediatype": "JPEG image file",
            "@type": "IMAGE-HIGH-RES",
            "@size": "41331",
            "@ref": "fx2",
            "@mimetype": "image/jpeg"
          },
          {
            "@category": "high",
            "@height": "667",
            "@width": "500",
            "@_fa": "true",
            "$": "https://api.elsevier.com/content/object/eid/1-s2.0-S2095495619301603-fx3_lrg.jpg?httpAccept=%2A%2F%2A",
            "@multimediatype": "JPEG image file",
            "@type": "IMAGE-HIGH-RES",
            "@size": "65038",
            "@ref": "fx3",
            "@mimetype": "image/jpeg"
          },
          {
            "@category": "high",
            "@height": "667",
            "@width": "500",
            "@_fa": "true",
            "$": "https://api.elsevier.com/content/object/eid/1-s2.0-S2095495619301603-fx4_lrg.jpg?httpAccept=%2A%2F%2A",
            "@multimediatype": "JPEG image file",
            "@type": "IMAGE-HIGH-RES",
            "@size": "46234",
            "@ref": "fx4",
            "@mimetype": "image/jpeg"
          },
          {
            "@category": "standard",
            "@_fa": "true",
            "$": "https://api.elsevier.com/content/object/eid/1-s2.0-S2095495619301603-mmc1.docx?httpAccept=%2A%2F%2A",
            "@multimediatype": "Microsoft Word file",
            "@type": "APPLICATION",
            "@size": "1299825",
            "@ref": "mmc1",
            "@mimetype": "application/word"
          },
          {
            "@category": "standard",
            "@_fa": "true",
            "$": "https://api.elsevier.com/content/object/eid/1-s2.0-S2095495619301603-am.pdf?httpAccept=%2A%2F%2A",
            "@multimediatype": "Acrobat PDF file",
            "@type": "AAM-PDF",
            "@size": "3470066",
            "@ref": "am",
            "@mimetype": "application/pdf"
          }
        ]
      },
      "link": {
        "@rel": "abstract",
        "@href": "https://api.elsevier.com/content/abstract/scopus_id/85064700138"
      }
    }
  }
}