{
  "metadata": {
    "title": "Molybdenum disulfide (MoS<ce:inf loc=post>2</ce:inf>)-based electrocatalysts for hydrogen evolution reaction: From mechanism to manipulation",
    "authors": "; ; ",
    "journal": "Journal of Energy Chemistry",
    "date": "2022-11-30",
    "doi": "10.1016/j.jechem.2022.06.031",
    "abstract": "",
    "uri": "https://api.elsevier.com/content/article/pii/S2095495622003382",
    "pii": "S2095495622003382"
  },
  "fulltext": {
    "full-text-retrieval-response": {
      "scopus-eid": "2-s2.0-85135347592",
      "originalText": "serial JL 286353 291210 291711 291744 291809 31 Journal of Energy Chemistry JOURNALENERGYCHEMISTRY 2022-06-24 2022-06-24 2022-08-01 2022-08-01 2022-10-19T19:56:36 1-s2.0-S2095495622003382 S2095-4956(22)00338-2 S2095495622003382 10.1016/j.jechem.2022.06.031 S300 S300.1 FULL-TEXT 1-s2.0-S2095495622X00065 2024-06-03T13:21:19.289994Z 0 0 20221101 20221130 2022 2022-06-24T03:43:35.179641Z absattachment articleinfo articletitlenorm authfirstinitialnorm authfirstsurnamenorm cid cids contenttype copyright crossmark dateloaded dateloadedtxt datesearch datesort dateupdated dco docsubtype doctype doi eid ewtransactionid hubeid indexeddate issn issnnorm itemstage itemtransactionid itemweight openaccess openarchive pg pgfirst pglast pii piinorm pubdateend pubdatestart pubdatetxt pubyr sortorder srctitle srctitlenorm srctype ssids alllist content subj subheadings suppl tomb volfirst volissue volumelist webpdf webpdfpagecount yearnav figure table body mmlmath acknowledge affil articletitle auth authfirstini authfull authkeywords authlast grantnumber grantsponsor grantsponsorid primabst pubtype ref specialabst vitae 2095-4956 20954956 false 74 74 C Volume 74 6 45 71 45 71 202211 November 2022 2022-11-01 2022-11-30 2022 article rev © 2022 Science Press and Dalian Institute of Chemical Physics, Chinese Academy of Sciences. Published by ELSEVIER B.V. and Science Press. All rights reserved. MOLYBDENUMDISULFIDEMOS2BASEDELECTROCATALYSTSFORHYDROGENEVOLUTIONREACTIONMECHANISMMANIPULATION XU Y 1 Introduction 2 The fundamental knowledge of MoS2 3 Electrocatalytic application of MoS2 3.1 The mechanisms of HER 3.2 Electrocatalytic performance of HER 3.2.1 Adsorption step 3.2.2 Desorption step 3.2.3 Release step 3.2.4 Practical application 4 Active surface/interface engineering in molybdenum disulfide 4.1 Phase engineering 4.2 Defect engineering 4.2.1 Intrinsic defects 4.2.2 Doping-induced defects 4.3 Morphology design 4.4 Heterostructure construction 5 Challenges of MoS2-based electrocatalysts 6 Summary and outlook Acknowledgments References WU 2021 473 507 H GE 2022 164084 R YU 2021 e1903378 Z XU 2022 234 265 H DUAN 2020 1 42 J WU 2021 382 446 F SEH 2017 eaad4998 Z LIANG 2021 e1903418 L ZHAO 2020 2215 2264 D THANGASAMY 2020 216 225 P ZHANG 2022 214493 Y ZHONG 2021 236 242 W CHI 2020 398 423 J LI 2021 547 566 R WANG 2021 451 479 Y JIN 2021 659 666 X ZHU 2019 4718 4729 M ZHANG 2017 3717 3797 W LEE 2018 441 454 H GAO 2020 117750 B LIU 2020 14835 14841 M XIAO 2021 508 522 Y ZHENG 2022 630 642 Y MA 2022 560 565 S XU 2020 e00172 Y WANG 2020 3321 3329 C YANG 2020 1315 1321 T REN 2020 118352 J WANG 2022 304 311 B YANG 2022 96 103 M YU 2019 401 412 W HUANG 2021 119854 Z LI 2020 114 121 T LI 2021 119502 R ZHANG 2022 120541 R YANG 2016 335 J HUO 2019 e00117 J JING 2018 533 540 S JIA 2017 12509 12518 J HE 2022 483 491 H GE 2020 118196 R HUANG 2020 105253 X ZHOU 2021 253 261 J LIN 2022 27 35 Y ZOU 2022 210 216 H MITTERREITER 2019 25 E TANG 2016 1600116 Y DENG 2017 14430 J SHAH 2019 1804545 S WANG 2020 1593 1616 Q HAN 2020 e2002584 W YU 2018 638 643 Y GUO 2020 4141 4152 Y SHAO 2019 1906069 G XIONG 2022 805 813 T CHA 2018 337 344 E LIU 2018 696 700 Y DING 2019 41 X RIES 2019 1112 1117 L ZHANG 2019 4226 J LI 2019 567 572 B WANG 2019 194 200 L ZHANG 2019 e1804903 K CHIA 2018 909 921 X CANTARELLA 2019 974 M ZHOU 2020 2923 2930 W ZHANG 2019 1900964 W WU 2019 4383 4389 L ZHANG 2019 1804903 K ZHANG 2019 1900653 J JI 2019 87 93 L MENG 2019 611 616 X MEI 2020 13393 13396 Y MUTHURASU 2019 202 210 A VISHNOI 2019 27780 27787 P KIM 2019 1809151 M ZHOU 2019 1900078 Y LI 2019 1419 1426 S GE 2021 e1903380 R CHIA 1966 11941 11951 X JAYABAL 2018 264 279 S ZHU 2020 851 918 J WEI 2019 e1806296 C HUO 2020 e00161 J FEI 2016 12206 L PATTENGALE 2020 4114 B OH 2019 5900 H FANG 2019 1127 S GBADAMASI 2021 4684 4729 S LUKOWSKI 2013 10274 10277 M BEDIAKO 2018 425 429 D PUENTESANTIAGO 2020 17923 17927 A LUO 2018 2120 Z CHEN 2019 17621 17624 X VOIRY 2013 6222 6227 D RAYBAUD 2000 129 146 P HINNEMANN 2005 5308 5309 B NIU 2020 1985 2002 S DUERLOO 2014 4214 K GENG 2016 10672 X RYOU 2016 29184 J BENCK 2014 3957 3971 J LI 2021 127804 Y FUKUZUMI 2011 2754 2766 S WAN 2022 44 53 R JUNG 2019 7546 7552 W MORALESGUIO 2014 6555 6569 C KAMILA 2017 8378 S ZANG 2019 1217 Y CHEN 2020 7161 7167 J MENG 2020 10502 10507 X FENG 2020 e2002850 Y HE 2020 5548 5551 S WEI 2018 75 J TSAI 2014 13156 13164 C WANG 2017 1605838 J ZHU 2019 1348 J PARK 2020 e2000855 H XIAO 2017 1602086 W LI 2019 e00114 W BENCK 2012 1916 1923 J LEI 2020 20794 20812 Y VOIRY 2018 9635 9638 D XU 2021 734 744 L SHIN 2015 1196 1202 S MA 2015 8361 8368 L GAO 2020 145368 B LIU 2021 6776 W WEI 2018 1800168 C ZHANG 2022 176 185 Z XU 2022 134126 Y TANG 2016 4953 4961 Q KANG 2014 6467 6471 Y EKSPONG 2018 1802744 J ANJUM 2018 1707105 M BENSON 2018 441 450 E LIN 2014 391 396 Y SHAH 2019 e1804545 S QIN 2019 e1803639 Q KADAM 2019 12036 S ZHANG 2017 74 80 B HU 2020 e2002212 J XU 2020 1759 1768 X HUANG 2019 1 11 Y ZHANG 2022 71 77 T WANG 2018 1801345 S GENG 2016 1 7 X LIU 2017 4738 4744 Q JIANG 2021 130611 L SHI 2015 24414 24421 S LI 2021 119708 X TAN 2018 1705509 C LIU 2019 296 302 Z CHEN 2020 2000551 W FENG 2020 2002850 Y LIU 2017 25291 25297 Z DONG 2021 128556 J ZHU 2019 1805511 D ZANG 2020 55884 55893 X LI 2021 105898 Y LI 2021 128158 M XIE 2013 5807 5813 J WANG 2020 4298 4308 X LI 2022 18 26 Z BOLAR 2019 432 442 S ZHANG 2018 1807086 H DENG 2019 16289 16296 S GUO 2015 15927 15934 Y REN 2015 15997 16000 X LI 2017 133 139 R GURUPRASAD 2019 6184 6194 K CHEN 2018 246 249 A MENG 2020 10588 10593 X ZHENG 2020 1 10 Z SHI 2017 15479 15485 Y LI 2016 48 53 H LI 2018 537 544 Y XIE 2017 1178 1188 J WU 2019 2029 2033 W HAN 2018 1828 1836 X GE 2019 129 139 R FENG 2020 135445 J LI 2018 7104 7110 Y SUN 2018 4368 4379 K ZHANG 2020 3724 C HU 2017 383 393 J WEI 2021 587 592 Y HU 2020 2002212 J WU 2019 25986 25995 A VIKRAMAN 2018 8400 8409 D MA 2022 136618 L LI 2021 516 522 G LI 2021 99 108 Y ZHOU 2020 45 51 Q CHEN 2020 90 96 T QI 2019 5231 K WANG 2019 1806 1854 Y HASANI 2019 47 A WANG 2017 7610 7614 L HUANG 2019 982 Y LIU 2015 5556 5564 Q ZHENG 2014 2995 J NGUYEN 2020 11533 11542 V ZHANG 2020 1905923 Y CHENG 2022 646 657 Y XU 2018 3209 3250 L YAO 2019 1803746 B XU 2022 185 193 S LI 2020 e1907879 W XIE 2020 11082 11098 C BERTOLAZZI 2017 1606760 S JI 2020 11900 11955 S PAN 2020 78 110 Y LIU 2020 e1905738 J LI 2019 6824 6834 L WANG 2020 4298 4308 X LI 2015 6587 6593 Z HONG 2015 6293 J ZHANG 2019 1806552 F LING 2019 1807771 T TSAI 2014 1381 1387 C DENG 2015 1594 1601 J WANG 2015 566 575 H SUN 2014 8359 8367 X DAI 2015 27242 27253 X WU 2017 470 477 L QI 2016 4025 4031 K MERKI 2012 2515 2525 D LI 2022 18 26 Z CHEN 2018 246 249 A PETO 2018 1246 1251 J DENG 2019 16289 16296 S GAUR 2020 146094 A DONG 2020 135885 T DING 2019 11217 11226 R SUN 2016 1704 1709 X LI 2022 10493 10502 J ZHANG 2018 384 392 C HU 2017 593 603 J LI 2022 W XUX2022X45 XUX2022X45X71 XUX2022X45XY XUX2022X45X71XY 2024-08-01T00:00:00.000Z 2024-08-01T00:00:00.000Z http://creativecommons.org/licenses/by-nc-nd/4.0/ © 2022 Science Press and Dalian Institute of Chemical Physics, Chinese Academy of Sciences. Published by ELSEVIER B.V. and Science Press. All rights reserved. 2022-08-08T23:55:21.300Z http://vtw.elsevier.com/data/voc/AddOnTypes/50.7/aggregated-refined Shanghai Institutions of Higher Learning Australian Research Council ARC Australian Research Council http://data.elsevier.com/vocabulary/SciValFunders/501100000923 http://sws.geonames.org/2077456/ National Natural Science Foundation of China 51572166 NSFC National Natural Science Foundation of China http://data.elsevier.com/vocabulary/SciValFunders/501100001809 http://sws.geonames.org/1814991/ China Postdoctoral Science Foundation 2021M702073 China Postdoctoral Science Foundation http://data.elsevier.com/vocabulary/SciValFunders/501100002858 http://sws.geonames.org/1814991/ Australian Renewable Energy Agency ARENA Australian Renewable Energy Agency http://data.elsevier.com/vocabulary/SciValFunders/501100005105 http://sws.geonames.org/2077456/ Rare and Precious Metals Material Genetic Engineering Project of Yunnan Province 202002AB080001-1 TP2014041 This work was financially supported by the National Natural Science Foundation of China (Grant No. 51572166 ), the China Postdoctoral Science Foundation (Grant No. 2021M702073 ), and the Rare and Precious Metals Material Genetic Engineering Project of Yunnan Province (Grant No. 202002AB080001-1 ). Wenxian Li acknowledges research support from the Program for Professors with Special Appointments (Eastern Scholar: TP2014041) at Shanghai Institutions of Higher Learning . Wenxian Li is a Professor at the School for Materials Science and Engineering, Shanghai University. Dr. Li received his Ph.D. from the University of Wollongong, Australia, in 2010. He got the Australian Postdoctoral Fellowship (Industrial) supported by the Australian Research Council in 2012 and then got financial support from the Australian Renewable Energy Agency as a Postdoctoral Fellowship. He joined the University of Western Sydney as a lecturer in the Solar Energy Technologies Group in November 2012. His research focuses on the electron configuration modulation induced performance optimization of function materials for renewable energy utilization. 0 item S2095-4956(22)00338-2 S2095495622003382 1-s2.0-S2095495622003382 10.1016/j.jechem.2022.06.031 286353 2022-10-19T22:26:09.254236Z 2022-11-01 2022-11-30 1-s2.0-S2095495622003382-main.pdf https://s3-eu-west-1.amazonaws.com/prod-ucs-content-store-eu-west/content/pii:S2095495622003382/MAIN/application/pdf/f007d69265c4155751485c287adc9e0c/main.pdf main.pdf pdf true 13292591 MAIN 27 1-s2.0-S2095495622003382-main_1.png https://s3-eu-west-1.amazonaws.com/prod-ucs-content-store-eu-west/content/pii:S2095495622003382/PREVIEW/image/png/4f09bc9d2afe5e94eb0c6f2654ad9660/main_1.png main_1.png png 56031 849 656 IMAGE-WEB-PDF 1 1-s2.0-S2095495622003382-fx1.jpg https://s3-eu-west-1.amazonaws.com/prod-ucs-content-store-eu-west/content/pii:S2095495622003382/fx1/DOWNSAMPLED/image/jpeg/73164dd39bc1b669a06c4f5fc7717c5b/fx1.jpg fx1 fx1.jpg jpg 5870 155 111 IMAGE-DOWNSAMPLED 1-s2.0-S2095495622003382-fx10.jpg https://s3-eu-west-1.amazonaws.com/prod-ucs-content-store-eu-west/content/pii:S2095495622003382/fx10/DOWNSAMPLED/image/jpeg/d6d9d338340d418ec1624e5863df201c/fx10.jpg fx10 fx10.jpg jpg 6238 155 111 IMAGE-DOWNSAMPLED 1-s2.0-S2095495622003382-fx2.jpg https://s3-eu-west-1.amazonaws.com/prod-ucs-content-store-eu-west/content/pii:S2095495622003382/fx2/DOWNSAMPLED/image/jpeg/a21ff12102be4050df3257f595911550/fx2.jpg fx2 fx2.jpg jpg 4740 155 111 IMAGE-DOWNSAMPLED 1-s2.0-S2095495622003382-fx3.jpg https://s3-eu-west-1.amazonaws.com/prod-ucs-content-store-eu-west/content/pii:S2095495622003382/fx3/DOWNSAMPLED/image/jpeg/26bd018db63090437950a6107bb6413d/fx3.jpg fx3 fx3.jpg jpg 9171 155 111 IMAGE-DOWNSAMPLED 1-s2.0-S2095495622003382-fx4.jpg https://s3-eu-west-1.amazonaws.com/prod-ucs-content-store-eu-west/content/pii:S2095495622003382/fx4/DOWNSAMPLED/image/jpeg/c994ba59fa557fb9710d7bf484d08326/fx4.jpg fx4 fx4.jpg jpg 6416 155 111 IMAGE-DOWNSAMPLED 1-s2.0-S2095495622003382-fx5.jpg https://s3-eu-west-1.amazonaws.com/prod-ucs-content-store-eu-west/content/pii:S2095495622003382/fx5/DOWNSAMPLED/image/jpeg/19428b0bc65c3d79234da8af1aa4e304/fx5.jpg fx5 fx5.jpg jpg 8044 155 111 IMAGE-DOWNSAMPLED 1-s2.0-S2095495622003382-fx6.jpg https://s3-eu-west-1.amazonaws.com/prod-ucs-content-store-eu-west/content/pii:S2095495622003382/fx6/DOWNSAMPLED/image/jpeg/b99944826bbcdd0cf1216484780659be/fx6.jpg fx6 fx6.jpg jpg 5833 155 111 IMAGE-DOWNSAMPLED 1-s2.0-S2095495622003382-fx7.jpg https://s3-eu-west-1.amazonaws.com/prod-ucs-content-store-eu-west/content/pii:S2095495622003382/fx7/DOWNSAMPLED/image/jpeg/97054a234ce81a735aaf22694b646481/fx7.jpg fx7 fx7.jpg jpg 6763 155 111 IMAGE-DOWNSAMPLED 1-s2.0-S2095495622003382-fx8.jpg https://s3-eu-west-1.amazonaws.com/prod-ucs-content-store-eu-west/content/pii:S2095495622003382/fx8/THUMBNAIL/image/jpeg/2763944634f3c518784bb752cc831f28/fx8.jpg fx8 fx8.jpg jpg 5917 155 111 IMAGE-DOWNSAMPLED 1-s2.0-S2095495622003382-fx9.jpg https://s3-eu-west-1.amazonaws.com/prod-ucs-content-store-eu-west/content/pii:S2095495622003382/fx9/DOWNSAMPLED/image/jpeg/a2902b7294e7b373ddfd20efa23e21c5/fx9.jpg fx9 fx9.jpg jpg 5970 155 111 IMAGE-DOWNSAMPLED 1-s2.0-S2095495622003382-ga1.jpg https://s3-eu-west-1.amazonaws.com/prod-ucs-content-store-eu-west/content/pii:S2095495622003382/ga1/DOWNSAMPLED/image/jpeg/93395959bd3cb9b6c57d0a663557154f/ga1.jpg ga1 true ga1.jpg jpg 35802 200 419 IMAGE-DOWNSAMPLED 1-s2.0-S2095495622003382-gr1.jpg https://s3-eu-west-1.amazonaws.com/prod-ucs-content-store-eu-west/content/pii:S2095495622003382/gr1/HIGHRES/image/jpeg/39a22dda207f30cb0a2eef6519ebc675/gr1.jpg gr1 gr1.jpg jpg 70196 382 382 IMAGE-DOWNSAMPLED 1-s2.0-S2095495622003382-gr10.jpg https://s3-eu-west-1.amazonaws.com/prod-ucs-content-store-eu-west/content/pii:S2095495622003382/gr10/DOWNSAMPLED/image/jpeg/18863caf73729b625dfd491ba388bc97/gr10.jpg gr10 gr10.jpg jpg 162834 699 687 IMAGE-DOWNSAMPLED 1-s2.0-S2095495622003382-gr11.jpg https://s3-eu-west-1.amazonaws.com/prod-ucs-content-store-eu-west/content/pii:S2095495622003382/gr11/DOWNSAMPLED/image/jpeg/b61539962f352b2b904b831ccd3c331b/gr11.jpg gr11 gr11.jpg jpg 137666 527 639 IMAGE-DOWNSAMPLED 1-s2.0-S2095495622003382-gr12.jpg https://s3-eu-west-1.amazonaws.com/prod-ucs-content-store-eu-west/content/pii:S2095495622003382/gr12/DOWNSAMPLED/image/jpeg/9d13b8b354c4d7042bb57e42b52ac4a0/gr12.jpg gr12 gr12.jpg jpg 149034 671 623 IMAGE-DOWNSAMPLED 1-s2.0-S2095495622003382-gr13.jpg https://s3-eu-west-1.amazonaws.com/prod-ucs-content-store-eu-west/content/pii:S2095495622003382/gr13/DOWNSAMPLED/image/jpeg/e8fc935ed8791223048fdea5afa4add7/gr13.jpg gr13 gr13.jpg jpg 140723 605 674 IMAGE-DOWNSAMPLED 1-s2.0-S2095495622003382-gr14.jpg https://s3-eu-west-1.amazonaws.com/prod-ucs-content-store-eu-west/content/pii:S2095495622003382/gr14/DOWNSAMPLED/image/jpeg/977367445509cae2eb0880bb3f9c6687/gr14.jpg gr14 gr14.jpg jpg 201955 874 711 IMAGE-DOWNSAMPLED 1-s2.0-S2095495622003382-gr15.jpg https://s3-eu-west-1.amazonaws.com/prod-ucs-content-store-eu-west/content/pii:S2095495622003382/gr15/DOWNSAMPLED/image/jpeg/08bbd934dd11618c0c09b2c906f37e79/gr15.jpg gr15 gr15.jpg jpg 154373 516 800 IMAGE-DOWNSAMPLED 1-s2.0-S2095495622003382-gr16.jpg https://s3-eu-west-1.amazonaws.com/prod-ucs-content-store-eu-west/content/pii:S2095495622003382/gr16/DOWNSAMPLED/image/jpeg/4b3cb439be70f56a564f62ea80296cde/gr16.jpg gr16 gr16.jpg jpg 217623 922 711 IMAGE-DOWNSAMPLED 1-s2.0-S2095495622003382-gr17.jpg https://s3-eu-west-1.amazonaws.com/prod-ucs-content-store-eu-west/content/pii:S2095495622003382/gr17/DOWNSAMPLED/image/jpeg/a22911535151c027890f663812afb579/gr17.jpg gr17 gr17.jpg jpg 103379 521 533 IMAGE-DOWNSAMPLED 1-s2.0-S2095495622003382-gr18.jpg https://s3-eu-west-1.amazonaws.com/prod-ucs-content-store-eu-west/content/pii:S2095495622003382/gr18/DOWNSAMPLED/image/jpeg/235918273eedb5b070abf5035501265a/gr18.jpg gr18 gr18.jpg jpg 118908 655 673 IMAGE-DOWNSAMPLED 1-s2.0-S2095495622003382-gr2.jpg https://s3-eu-west-1.amazonaws.com/prod-ucs-content-store-eu-west/content/pii:S2095495622003382/gr2/DOWNSAMPLED/image/jpeg/b78b97c9fe728c613f4b297265a8a639/gr2.jpg gr2 gr2.jpg jpg 150306 511 687 IMAGE-DOWNSAMPLED 1-s2.0-S2095495622003382-gr3.jpg https://s3-eu-west-1.amazonaws.com/prod-ucs-content-store-eu-west/content/pii:S2095495622003382/gr3/DOWNSAMPLED/image/jpeg/d17cd743aaadc17f7e94fa0b1190a2d4/gr3.jpg gr3 gr3.jpg jpg 55590 441 533 IMAGE-DOWNSAMPLED 1-s2.0-S2095495622003382-gr4.jpg https://s3-eu-west-1.amazonaws.com/prod-ucs-content-store-eu-west/content/pii:S2095495622003382/gr4/DOWNSAMPLED/image/jpeg/c9b248f0b8bbf2e59a3923b0b41cf4cd/gr4.jpg gr4 gr4.jpg jpg 73027 463 534 IMAGE-DOWNSAMPLED 1-s2.0-S2095495622003382-gr5.jpg https://s3-eu-west-1.amazonaws.com/prod-ucs-content-store-eu-west/content/pii:S2095495622003382/gr5/DOWNSAMPLED/image/jpeg/660dd563e7d8172e9413b41a58561fd2/gr5.jpg gr5 gr5.jpg jpg 116794 859 534 IMAGE-DOWNSAMPLED 1-s2.0-S2095495622003382-gr6.jpg https://s3-eu-west-1.amazonaws.com/prod-ucs-content-store-eu-west/content/pii:S2095495622003382/gr6/DOWNSAMPLED/image/jpeg/912339427e69ce24d30daceb4e38c248/gr6.jpg gr6 gr6.jpg jpg 185882 742 646 IMAGE-DOWNSAMPLED 1-s2.0-S2095495622003382-gr7.jpg https://s3-eu-west-1.amazonaws.com/prod-ucs-content-store-eu-west/content/pii:S2095495622003382/gr7/HIGHRES/image/jpeg/66c8040f4b0c2a1a3da2f87e0013947f/gr7.jpg gr7 gr7.jpg jpg 65517 349 533 IMAGE-DOWNSAMPLED 1-s2.0-S2095495622003382-gr8.jpg https://s3-eu-west-1.amazonaws.com/prod-ucs-content-store-eu-west/content/pii:S2095495622003382/gr8/DOWNSAMPLED/image/jpeg/7e53f70302b0d922d72e69ae252d8c46/gr8.jpg gr8 gr8.jpg jpg 258507 837 800 IMAGE-DOWNSAMPLED 1-s2.0-S2095495622003382-gr9.jpg https://s3-eu-west-1.amazonaws.com/prod-ucs-content-store-eu-west/content/pii:S2095495622003382/gr9/DOWNSAMPLED/image/jpeg/8425c907de04cb751c01bdd6eb21d8cc/gr9.jpg gr9 gr9.jpg jpg 38212 253 382 IMAGE-DOWNSAMPLED 1-s2.0-S2095495622003382-fx1.sml https://s3-eu-west-1.amazonaws.com/prod-ucs-content-store-eu-west/content/pii:S2095495622003382/fx1/THUMBNAIL/image/gif/a284085d2649262738265eafbafc898b/fx1.sml fx1 fx1.sml sml 12981 164 117 IMAGE-THUMBNAIL 1-s2.0-S2095495622003382-fx10.sml https://s3-eu-west-1.amazonaws.com/prod-ucs-content-store-eu-west/content/pii:S2095495622003382/fx10/THUMBNAIL/image/gif/4cda3b14f75ea880be3029c07e296f7a/fx10.sml fx10 fx10.sml sml 13600 164 117 IMAGE-THUMBNAIL 1-s2.0-S2095495622003382-fx2.sml https://s3-eu-west-1.amazonaws.com/prod-ucs-content-store-eu-west/content/pii:S2095495622003382/fx2/HIGHRES/image/gif/4501a5130c6ff2ff839e531553f1a4ba/fx2.sml fx2 fx2.sml sml 15047 164 117 IMAGE-THUMBNAIL 1-s2.0-S2095495622003382-fx3.sml https://s3-eu-west-1.amazonaws.com/prod-ucs-content-store-eu-west/content/pii:S2095495622003382/fx3/THUMBNAIL/image/gif/28008f380f3a4728681202aeb7d9c9b7/fx3.sml fx3 fx3.sml sml 18335 164 117 IMAGE-THUMBNAIL 1-s2.0-S2095495622003382-fx4.sml https://s3-eu-west-1.amazonaws.com/prod-ucs-content-store-eu-west/content/pii:S2095495622003382/fx4/DOWNSAMPLED/image/gif/3683526750c676ac6c4624041893620e/fx4.sml fx4 fx4.sml sml 12771 164 117 IMAGE-THUMBNAIL 1-s2.0-S2095495622003382-fx5.sml https://s3-eu-west-1.amazonaws.com/prod-ucs-content-store-eu-west/content/pii:S2095495622003382/fx5/THUMBNAIL/image/gif/859f7552cf49e117f8cc2190d7f62203/fx5.sml fx5 fx5.sml sml 16709 164 117 IMAGE-THUMBNAIL 1-s2.0-S2095495622003382-fx6.sml https://s3-eu-west-1.amazonaws.com/prod-ucs-content-store-eu-west/content/pii:S2095495622003382/fx6/THUMBNAIL/image/gif/799fba0047f653d9f5f029b3a84d77f3/fx6.sml fx6 fx6.sml sml 14953 164 117 IMAGE-THUMBNAIL 1-s2.0-S2095495622003382-fx7.sml https://s3-eu-west-1.amazonaws.com/prod-ucs-content-store-eu-west/content/pii:S2095495622003382/fx7/THUMBNAIL/image/gif/32a899191389733c3073bd9a0f73d338/fx7.sml fx7 fx7.sml sml 15492 164 117 IMAGE-THUMBNAIL 1-s2.0-S2095495622003382-fx8.sml https://s3-eu-west-1.amazonaws.com/prod-ucs-content-store-eu-west/content/pii:S2095495622003382/fx8/THUMBNAIL/image/gif/585f886fee3c45485bb4cdb7708defef/fx8.sml fx8 fx8.sml sml 16100 164 117 IMAGE-THUMBNAIL 1-s2.0-S2095495622003382-fx9.sml https://s3-eu-west-1.amazonaws.com/prod-ucs-content-store-eu-west/content/pii:S2095495622003382/fx9/DOWNSAMPLED/image/gif/989bd0dfbe723ceea16812361769ad68/fx9.sml fx9 fx9.sml sml 15423 164 117 IMAGE-THUMBNAIL 1-s2.0-S2095495622003382-ga1.sml https://s3-eu-west-1.amazonaws.com/prod-ucs-content-store-eu-west/content/pii:S2095495622003382/ga1/DOWNSAMPLED/image/gif/924fdc947edc8cac9319f16a439e4d03/ga1.sml ga1 true ga1.sml sml 11816 105 219 IMAGE-THUMBNAIL 1-s2.0-S2095495622003382-gr1.sml https://s3-eu-west-1.amazonaws.com/prod-ucs-content-store-eu-west/content/pii:S2095495622003382/gr1/THUMBNAIL/image/gif/fd942dd9201a4dea8aca74e69eab138c/gr1.sml gr1 gr1.sml sml 18822 164 164 IMAGE-THUMBNAIL 1-s2.0-S2095495622003382-gr10.sml https://s3-eu-west-1.amazonaws.com/prod-ucs-content-store-eu-west/content/pii:S2095495622003382/gr10/HIGHRES/image/gif/b0086be0bb3ce44c9be8a3c2e1abbfae/gr10.sml gr10 gr10.sml sml 12705 164 161 IMAGE-THUMBNAIL 1-s2.0-S2095495622003382-gr11.sml https://s3-eu-west-1.amazonaws.com/prod-ucs-content-store-eu-west/content/pii:S2095495622003382/gr11/THUMBNAIL/image/gif/0e06c7d9a377ab1d94bee27e4779e850/gr11.sml gr11 gr11.sml sml 23886 164 199 IMAGE-THUMBNAIL 1-s2.0-S2095495622003382-gr12.sml https://s3-eu-west-1.amazonaws.com/prod-ucs-content-store-eu-west/content/pii:S2095495622003382/gr12/THUMBNAIL/image/gif/0f55d40c0183a6983f1b4a13ff8e09b5/gr12.sml gr12 gr12.sml sml 13611 164 152 IMAGE-THUMBNAIL 1-s2.0-S2095495622003382-gr13.sml https://s3-eu-west-1.amazonaws.com/prod-ucs-content-store-eu-west/content/pii:S2095495622003382/gr13/THUMBNAIL/image/gif/1aea06942fbb93669874f1ad236cc27c/gr13.sml gr13 gr13.sml sml 16577 164 183 IMAGE-THUMBNAIL 1-s2.0-S2095495622003382-gr14.sml https://s3-eu-west-1.amazonaws.com/prod-ucs-content-store-eu-west/content/pii:S2095495622003382/gr14/THUMBNAIL/image/gif/800fad078e7a0b02aaa0faff6b37d952/gr14.sml gr14 gr14.sml sml 13987 164 133 IMAGE-THUMBNAIL 1-s2.0-S2095495622003382-gr15.sml https://s3-eu-west-1.amazonaws.com/prod-ucs-content-store-eu-west/content/pii:S2095495622003382/gr15/THUMBNAIL/image/gif/d56d04dc298c162e995635a514c51583/gr15.sml gr15 gr15.sml sml 20405 141 219 IMAGE-THUMBNAIL 1-s2.0-S2095495622003382-gr16.sml https://s3-eu-west-1.amazonaws.com/prod-ucs-content-store-eu-west/content/pii:S2095495622003382/gr16/THUMBNAIL/image/gif/66bfb5e98e4706bcd13109e595d60c14/gr16.sml gr16 gr16.sml sml 13200 163 126 IMAGE-THUMBNAIL 1-s2.0-S2095495622003382-gr17.sml https://s3-eu-west-1.amazonaws.com/prod-ucs-content-store-eu-west/content/pii:S2095495622003382/gr17/THUMBNAIL/image/gif/315db1248e3c3891f65cc683e3fc663e/gr17.sml gr17 gr17.sml sml 16791 163 167 IMAGE-THUMBNAIL 1-s2.0-S2095495622003382-gr18.sml https://s3-eu-west-1.amazonaws.com/prod-ucs-content-store-eu-west/content/pii:S2095495622003382/gr18/THUMBNAIL/image/gif/272b6c221b0a7da1d4da4af230228c81/gr18.sml gr18 gr18.sml sml 13494 164 168 IMAGE-THUMBNAIL 1-s2.0-S2095495622003382-gr2.sml https://s3-eu-west-1.amazonaws.com/prod-ucs-content-store-eu-west/content/pii:S2095495622003382/gr2/THUMBNAIL/image/gif/0d9fa8b1ae56871e80476d9830b46068/gr2.sml gr2 gr2.sml sml 17561 163 219 IMAGE-THUMBNAIL 1-s2.0-S2095495622003382-gr3.sml https://s3-eu-west-1.amazonaws.com/prod-ucs-content-store-eu-west/content/pii:S2095495622003382/gr3/THUMBNAIL/image/gif/670e5202fd24dedeb100b4284d8f2c01/gr3.sml gr3 gr3.sml sml 16357 164 198 IMAGE-THUMBNAIL 1-s2.0-S2095495622003382-gr4.sml https://s3-eu-west-1.amazonaws.com/prod-ucs-content-store-eu-west/content/pii:S2095495622003382/gr4/THUMBNAIL/image/gif/e06f307b43a98c2d7fa38877ca9d2b38/gr4.sml gr4 gr4.sml sml 12151 164 189 IMAGE-THUMBNAIL 1-s2.0-S2095495622003382-gr5.sml https://s3-eu-west-1.amazonaws.com/prod-ucs-content-store-eu-west/content/pii:S2095495622003382/gr5/THUMBNAIL/image/gif/6b33231486b244e4b7257e8ec8486fb5/gr5.sml gr5 gr5.sml sml 7830 164 102 IMAGE-THUMBNAIL 1-s2.0-S2095495622003382-gr6.sml https://s3-eu-west-1.amazonaws.com/prod-ucs-content-store-eu-west/content/pii:S2095495622003382/gr6/THUMBNAIL/image/gif/641fb2b696e42cd111176ef8f368ce39/gr6.sml gr6 gr6.sml sml 16649 163 142 IMAGE-THUMBNAIL 1-s2.0-S2095495622003382-gr7.sml https://s3-eu-west-1.amazonaws.com/prod-ucs-content-store-eu-west/content/pii:S2095495622003382/gr7/THUMBNAIL/image/gif/bb8b9163a08003361731175fb51da651/gr7.sml gr7 gr7.sml sml 19899 143 219 IMAGE-THUMBNAIL 1-s2.0-S2095495622003382-gr8.sml https://s3-eu-west-1.amazonaws.com/prod-ucs-content-store-eu-west/content/pii:S2095495622003382/gr8/THUMBNAIL/image/gif/112c52fd84cd11547305ebbbc1326dcd/gr8.sml gr8 gr8.sml sml 17361 164 157 IMAGE-THUMBNAIL 1-s2.0-S2095495622003382-gr9.sml https://s3-eu-west-1.amazonaws.com/prod-ucs-content-store-eu-west/content/pii:S2095495622003382/gr9/THUMBNAIL/image/gif/cd685fb1664245da630308f4cf44ea0a/gr9.sml gr9 gr9.sml sml 18856 145 219 IMAGE-THUMBNAIL 1-s2.0-S2095495622003382-fx1_lrg.jpg https://s3-eu-west-1.amazonaws.com/prod-ucs-content-store-eu-west/content/pii:S2095495622003382/HIGHRES/image/jpeg/674dc64cd0efb4d95b3e8ecd37d8499f/fx1_lrg.jpg fx1 fx1_lrg.jpg jpg 15862 413 295 IMAGE-HIGH-RES 1-s2.0-S2095495622003382-fx10_lrg.jpg https://s3-eu-west-1.amazonaws.com/prod-ucs-content-store-eu-west/content/pii:S2095495622003382/HIGHRES/image/jpeg/2a50bef526f79a855935f214c465a6e1/fx10_lrg.jpg fx10 fx10_lrg.jpg jpg 18135 413 295 IMAGE-HIGH-RES 1-s2.0-S2095495622003382-fx2_lrg.jpg https://s3-eu-west-1.amazonaws.com/prod-ucs-content-store-eu-west/content/pii:S2095495622003382/HIGHRES/image/jpeg/0c617b1721759a680b2a158f832fec6b/fx2_lrg.jpg fx2 fx2_lrg.jpg jpg 12450 413 295 IMAGE-HIGH-RES 1-s2.0-S2095495622003382-fx3_lrg.jpg https://s3-eu-west-1.amazonaws.com/prod-ucs-content-store-eu-west/content/pii:S2095495622003382/HIGHRES/image/jpeg/18e568dbf33978d2f6f69f2dedfb1a84/fx3_lrg.jpg fx3 fx3_lrg.jpg jpg 28193 413 295 IMAGE-HIGH-RES 1-s2.0-S2095495622003382-fx4_lrg.jpg https://s3-eu-west-1.amazonaws.com/prod-ucs-content-store-eu-west/content/pii:S2095495622003382/HIGHRES/image/jpeg/63d2c17b68e4b4f72b3282a3b5f81bc4/fx4_lrg.jpg fx4 fx4_lrg.jpg jpg 19640 413 295 IMAGE-HIGH-RES 1-s2.0-S2095495622003382-fx5_lrg.jpg https://s3-eu-west-1.amazonaws.com/prod-ucs-content-store-eu-west/content/pii:S2095495622003382/DOWNSAMPLED/image/jpeg/ff986342960ef42107fa14c7bd1f9833/fx5_lrg.jpg fx5 fx5_lrg.jpg jpg 31756 413 295 IMAGE-HIGH-RES 1-s2.0-S2095495622003382-fx6_lrg.jpg https://s3-eu-west-1.amazonaws.com/prod-ucs-content-store-eu-west/content/pii:S2095495622003382/HIGHRES/image/jpeg/59f76bd1ce25add372fff2d243c28278/fx6_lrg.jpg fx6 fx6_lrg.jpg jpg 15087 413 295 IMAGE-HIGH-RES 1-s2.0-S2095495622003382-fx7_lrg.jpg https://s3-eu-west-1.amazonaws.com/prod-ucs-content-store-eu-west/content/pii:S2095495622003382/HIGHRES/image/jpeg/ff4ad4db5717c01dd095cf206b1baf0f/fx7_lrg.jpg fx7 fx7_lrg.jpg jpg 20387 413 295 IMAGE-HIGH-RES 1-s2.0-S2095495622003382-fx8_lrg.jpg https://s3-eu-west-1.amazonaws.com/prod-ucs-content-store-eu-west/content/pii:S2095495622003382/HIGHRES/image/jpeg/34138282e99cdb04d34f5b2c8f3396d3/fx8_lrg.jpg fx8 fx8_lrg.jpg jpg 15623 413 295 IMAGE-HIGH-RES 1-s2.0-S2095495622003382-fx9_lrg.jpg https://s3-eu-west-1.amazonaws.com/prod-ucs-content-store-eu-west/content/pii:S2095495622003382/HIGHRES/image/jpeg/2db7a065d93a0f1d670448af17cc1d26/fx9_lrg.jpg fx9 fx9_lrg.jpg jpg 15375 413 295 IMAGE-HIGH-RES 1-s2.0-S2095495622003382-ga1_lrg.jpg https://s3-eu-west-1.amazonaws.com/prod-ucs-content-store-eu-west/content/pii:S2095495622003382/HIGHRES/image/jpeg/64037f1cbeb0e133aab17eed0bc7aab4/ga1_lrg.jpg ga1 true ga1_lrg.jpg jpg 272337 886 1854 IMAGE-HIGH-RES 1-s2.0-S2095495622003382-gr1_lrg.jpg https://s3-eu-west-1.amazonaws.com/prod-ucs-content-store-eu-west/content/pii:S2095495622003382/HIGHRES/image/jpeg/fcf06f415237d11725ec8421f6c52863/gr1_lrg.jpg gr1 gr1_lrg.jpg jpg 315783 1257 1257 IMAGE-HIGH-RES 1-s2.0-S2095495622003382-gr10_lrg.jpg https://s3-eu-west-1.amazonaws.com/prod-ucs-content-store-eu-west/content/pii:S2095495622003382/HIGHRES/image/jpeg/b914028c0e88c1cc73d52e2c0c78e314/gr10_lrg.jpg gr10 gr10_lrg.jpg jpg 992035 3095 3042 IMAGE-HIGH-RES 1-s2.0-S2095495622003382-gr11_lrg.jpg https://s3-eu-west-1.amazonaws.com/prod-ucs-content-store-eu-west/content/pii:S2095495622003382/HIGHRES/image/jpeg/3be8d6abaca54857baa5905d424de704/gr11_lrg.jpg gr11 gr11_lrg.jpg jpg 842029 2331 2829 IMAGE-HIGH-RES 1-s2.0-S2095495622003382-gr12_lrg.jpg https://s3-eu-west-1.amazonaws.com/prod-ucs-content-store-eu-west/content/pii:S2095495622003382/HIGHRES/image/jpeg/ae267e46dadbb917a5fda779ff7b57e8/gr12_lrg.jpg gr12 gr12_lrg.jpg jpg 898266 2970 2757 IMAGE-HIGH-RES 1-s2.0-S2095495622003382-gr13_lrg.jpg https://s3-eu-west-1.amazonaws.com/prod-ucs-content-store-eu-west/content/pii:S2095495622003382/HIGHRES/image/jpeg/c1bd280c0009268b9043c04b6de122d5/gr13_lrg.jpg gr13 gr13_lrg.jpg jpg 960112 2678 2984 IMAGE-HIGH-RES 1-s2.0-S2095495622003382-gr14_lrg.jpg https://s3-eu-west-1.amazonaws.com/prod-ucs-content-store-eu-west/content/pii:S2095495622003382/HIGHRES/image/jpeg/1d238e6093bcf197f156af7b3ee1056f/gr14_lrg.jpg gr14 gr14_lrg.jpg jpg 1427422 3873 3150 IMAGE-HIGH-RES 1-s2.0-S2095495622003382-gr15_lrg.jpg https://s3-eu-west-1.amazonaws.com/prod-ucs-content-store-eu-west/content/pii:S2095495622003382/HIGHRES/image/jpeg/c9e8c63251afb32baf1faad34f3dc34c/gr15_lrg.jpg gr15 gr15_lrg.jpg jpg 1187068 2285 3543 IMAGE-HIGH-RES 1-s2.0-S2095495622003382-gr16_lrg.jpg https://s3-eu-west-1.amazonaws.com/prod-ucs-content-store-eu-west/content/pii:S2095495622003382/HIGHRES/image/jpeg/2d6851f122d6127ac81e2b2eed001792/gr16_lrg.jpg gr16 gr16_lrg.jpg jpg 1549877 4083 3147 IMAGE-HIGH-RES 1-s2.0-S2095495622003382-gr17_lrg.jpg https://s3-eu-west-1.amazonaws.com/prod-ucs-content-store-eu-west/content/pii:S2095495622003382/HIGHRES/image/jpeg/356f2a68a29af13048c97ad1072ed4cd/gr17_lrg.jpg gr17 gr17_lrg.jpg jpg 729256 2310 2362 IMAGE-HIGH-RES 1-s2.0-S2095495622003382-gr18_lrg.jpg https://s3-eu-west-1.amazonaws.com/prod-ucs-content-store-eu-west/content/pii:S2095495622003382/HIGHRES/image/jpeg/0497b4d3edf4234380f76c3b375425e9/gr18_lrg.jpg gr18 gr18_lrg.jpg jpg 707632 2902 2981 IMAGE-HIGH-RES 1-s2.0-S2095495622003382-gr2_lrg.jpg https://s3-eu-west-1.amazonaws.com/prod-ucs-content-store-eu-west/content/pii:S2095495622003382/HIGHRES/image/jpeg/4ae5c09414ed52aac66536f62a15b621/gr2_lrg.jpg gr2 gr2_lrg.jpg jpg 847316 2263 3043 IMAGE-HIGH-RES 1-s2.0-S2095495622003382-gr3_lrg.jpg https://s3-eu-west-1.amazonaws.com/prod-ucs-content-store-eu-west/content/pii:S2095495622003382/HIGHRES/image/jpeg/7ad9a702fbe5c30aa476a609b2673c83/gr3_lrg.jpg gr3 gr3_lrg.jpg jpg 162411 1173 1417 IMAGE-HIGH-RES 1-s2.0-S2095495622003382-gr4_lrg.jpg https://s3-eu-west-1.amazonaws.com/prod-ucs-content-store-eu-west/content/pii:S2095495622003382/HIGHRES/image/jpeg/693c27ac2e04f10bed3546d5727d46b6/gr4_lrg.jpg gr4 gr4_lrg.jpg jpg 399590 2051 2364 IMAGE-HIGH-RES 1-s2.0-S2095495622003382-gr5_lrg.jpg https://s3-eu-west-1.amazonaws.com/prod-ucs-content-store-eu-west/content/pii:S2095495622003382/HIGHRES/image/jpeg/d1a481fea3d6d9a4bd436383222d5a59/gr5_lrg.jpg gr5 gr5_lrg.jpg jpg 740538 3802 2364 IMAGE-HIGH-RES 1-s2.0-S2095495622003382-gr6_lrg.jpg https://s3-eu-west-1.amazonaws.com/prod-ucs-content-store-eu-west/content/pii:S2095495622003382/HIGHRES/image/jpeg/830829fcab6fbb0db0841490adba0ba6/gr6_lrg.jpg gr6 gr6_lrg.jpg jpg 680674 2169 1888 IMAGE-HIGH-RES 1-s2.0-S2095495622003382-gr7_lrg.jpg https://s3-eu-west-1.amazonaws.com/prod-ucs-content-store-eu-west/content/pii:S2095495622003382/HIGHRES/image/jpeg/ce3e3fe7684ac893e7fa3d53a00a7c71/gr7_lrg.jpg gr7 gr7_lrg.jpg jpg 512881 1547 2362 IMAGE-HIGH-RES 1-s2.0-S2095495622003382-gr8_lrg.jpg https://s3-eu-west-1.amazonaws.com/prod-ucs-content-store-eu-west/content/pii:S2095495622003382/HIGHRES/image/jpeg/ce4f70660c4012ae0c75e225e814175e/gr8_lrg.jpg gr8 gr8_lrg.jpg jpg 1664373 3705 3543 IMAGE-HIGH-RES 1-s2.0-S2095495622003382-gr9_lrg.jpg https://s3-eu-west-1.amazonaws.com/prod-ucs-content-store-eu-west/content/pii:S2095495622003382/HIGHRES/image/jpeg/0c10dd7cc5ccf99f2478513d7cb10433/gr9_lrg.jpg gr9 gr9_lrg.jpg jpg 338630 1120 1693 IMAGE-HIGH-RES 1-s2.0-S2095495622003382-si1.svg https://s3-eu-west-1.amazonaws.com/prod-ucs-content-store-eu-west/content/pii:S2095495622003382/STRIPIN/image/svg+xml/f07d5e61f79b4258e039aad624881304/si1.svg si1 si1.svg svg 8600 ALTIMG 1-s2.0-S2095495622003382-si2.svg https://s3-eu-west-1.amazonaws.com/prod-ucs-content-store-eu-west/content/pii:S2095495622003382/STRIPIN/image/svg+xml/b9409d59b0736d1e9d4483764f05d0aa/si2.svg si2 si2.svg svg 9941 ALTIMG 1-s2.0-S2095495622003382-si3.svg https://s3-eu-west-1.amazonaws.com/prod-ucs-content-store-eu-west/content/pii:S2095495622003382/STRIPIN/image/svg+xml/503f32cddc3277fe2b64d346bc5debf6/si3.svg si3 si3.svg svg 3459 ALTIMG 1-s2.0-S2095495622003382-am.pdf https://s3-eu-west-1.amazonaws.com/prod-ucs-content-store-eu-west/content/egi:10D458QJ2PT/MAIN/application/pdf/cb3a70296f9b6a145dd0583849d14c8c/am.pdf am am.pdf pdf false 10281661 AAM-PDF JECHEM 2621 S2095-4956(22)00338-2 10.1016/j.jechem.2022.06.031 Science Press and Dalian Institute of Chemical Physics, Chinese Academy of Sciences Fig. 1 Schematic representation of the strategies of manipulation for MoS2-based catalysts toward HER. Fig. 2 Different phases of TMD with (a–c) crystal structures and (d–f) the corresponding band alignments. Reproduced from Ref. [98], Copyright 2020, Tsinghua University Press and Springer-Verlag GmbH Germany, part of Springer Nature. Fig. 3 Hydrogen evolution reaction volcano plot of MoS2 and some pure metals. Reproduced from Ref. [7], Copyright 2017, American Association for the Advancement of Science. Fig. 4 Schematic diagram of the relationships among different steps and the performance and measurement parameters of the catalyzed HER process, the GEO represents the geometrical specific surface area. Fig. 5 (a) The mechanisms of electrocatalytic HER on the MoS2-catalyzed electrode in acid electrolyte. The proton source is the water molecule (H2O) in neutral and alkaline solutions. Dashed arrow represents a H2 molecule physically adsorbed on the surface of MoS2. (b) EIS Nyquist plots of Mo2C-, MoS2- and C-MoS2-coated electrodes at a potential of 100 mV vs. RHE. Reproduced from Ref. [109], Copyright 2020, Springer Nature. (c) 2D representation of MoS2-based catalyst’s geometric surface area and electrochemically active surface area. Reproduced from Ref. [102], Copyright 2014, American Chemical Society. (d and e) The models of hydrogen release on hydrophobic and hydrophilic catalyst surfaces. Reproduced from Ref. [106], Copyright 2019, American Chemical Society. Fig. 6 (a) Illustration of the assembling process of 1T-MoS2/NiS2; (b) TEM and (c) CS-TEM images of 1T-MoS2/NiS2; (d) HAADF-STEM image of 1T-MoS2; (e) simulated HAADF-STEM images of the ideal 1T-MoS2; (f) the intensity profile along the red line in (d). (g) The LSV plots of 1T-MoS2/NiS2, 2H-MoS2/NiS2, NiS2, 2H-MoS2, and Pt/C. Reproduced from Ref. [94], Copyright 2019, Wiley-VCH. (h) Schematic illustration of the process of XO@1T-MoS2/CFP by incomplete sulfuration of XMo6. (i) HAADF STEM image and (j) aberration-corrected atomic resolution HAADF-STEM image of NiO@1T-MoS2 (green: Mo; orange: Ni). (k) LSV plots of all catalysts in 1.0 M KOH. Reproduced from Ref. [200], Copyright 2019, Springer Nature. Fig. 7 (a and b) TEM and (c) HRTEM images of 1T-MoS2/TiO2− x @Ti, the inset in (c) is the enlarged view image of 1T-MoS2. (d) HRTEM image of black TiO2− x . (e) LSV plots and (f) Tafel plots of Pt sheets, 1T-MoS2/TiO2− x @Ti and its precursor. Reproduced from Ref. [145], Copyright 2021, Science Press and Dalian Institute of Chemical Physics, Chinese Academy of Sciences. Fig. 8 (a) Schematic for the partial phase transition from 2H-MoS2 to 1T-MoS2 through inducing P atoms. (b and c) HRTEM images of 1T-2H MoS2. Yellow dots: S atoms and blue dots: Mo atoms. (d) Overpotentials at various current densities and (e) the conductivity of various samples. Reproduced from Ref. [146], Copyright 2018, Wiley-VCH. Atomic movements during 2H– to 1T-phase transformation in MoS2 at T = 600 °C. (f–i) STEM-ADF images, (j–m) schematics correlating with the ADF images at 0, 100, 110, 220 s. Reproduced from Ref. [137], Copyright 2014, Springer Nature. Fig. 9 The schematic models of intrinsic defects and doping-induced defects in MoS2. Fig. 10 (a) Schematic of MoS2 nanomesh with defective atomic-sized holes. Reproduced from Ref. [177], Copyright 2020, WILEY-VCH Verlag GmbH & Co. KGaA, Weinheim. (b) Schematic illustration of O,P-MoS2 and O-MoS2 with doping-induced defects. Reproduced from Ref. [214], Copyright 2018, Elsevier B.V. All rights reserved. (c) Schematic illustration of synthesizing defective multilayered MoS2 with a large range of surface S vacancy. Reproduced from Ref. [215], Copyright 2019, American Chemical Society. Fig. 11 (a) Structural model of the defect-rich structure of MoS2. (b) TEM image of the defect-rich MoS2 nanosheets. (c) HRTEM image and the corresponding area 1 in (b). (d) HRTEM image of the cross-section of area 2 in (b). (e) LSV curves of various samples. Reproduced from Ref. [162], Copyright 2013, Wiley-VCH. (f) Schematic of introducing sulfur vacancies by H2O2 chemical etch. HRTEM images of (g) P-MoS2 and (h) MoS2-60 s. (i) STEM image of MoS2 after etching. The S-vacancies are in yellow dotted circles. (j) Top-view and side view of the electron density model. (k) Polarization curves of different samples. Reproduced from Ref. [216], Copyright 2020, American Chemical Society. Fig. 12 Conduction and Valence band behavior at the interface between electrode and electrolyte: (a) before contact, (b) after contact, (c) under potential bias; (d and e) Mott-Schottky plots measured in 0.1 kHz in both 0.5 M H2SO4 and 1 M KOH, respectively, for MoS2, VMS1, VMS2 and VMS3 (with Mo: S: V (mmol) of 1: 2.5: 0.05, 1: 2.5: 0.1, 1: 2.5: 0.25, respectively); Polarization curve of MoS2, VMS1, VMS2, VMS3, GC and Pt/C at (f) 0.5 M H2SO4 and (g) 1 M KOH medium. Reproduced from Ref. [165], Copyright 2019, Elsevier. (h) Schematic of the synthesizing MCM@MoS2-Ni. (i) FESEM image of the MCM@MoS2-Ni nanofibers. (j) Ni K-edge EXAFS spectra of MCM@MoS2-Ni and Ni foil. In 0.5 M H2SO4, (k) polarization curves and (l) the corresponding Tafel plots for various samples. Reproduced from Ref. [166], Copyright 2018, Wiley-VCH. Fig. 13 (a) Schematic of Co doped MoS2, H: gray, Mo: green, S: yellow, Co: light blue, O: red, N: blue, and C: dark grey. (b) TEM image, (c and d) HRTEM images. LSV plots of various samples in (e) 1.0 M KOH, and (f) 0.5 M H2SO4. (g) ΔG H corresponding to the HER coordinates of different active sites. [229], Copyright 2022, Science Press and Dalian Institute of Chemical Physics, Chinese Academy of Sciences. Fig. 14 (a) Low- and (b) high-magnification SEM images of the sample of N-doped MoS2. (c) TEM and (d) HRTEM images of the sample of N-MoS2-3. (e) LSV plots of pure MoS2, Pt/C, as well as N content of 5, 6, and 8 at% for the samples of N-MoS2-1, N-MoS2-2, and N-MoS2-3, respectively. The Gibbs free energy diagrams of HER for different S sites in (f) S-edge, and (g) Mo-edge of pure and N-doped MoS2. Insets exhibit the N-doped edge or plain structure with H adsorption. Reproduced from Ref. [119], Copyright 2016, Wiley-VCH. (h) Schematic fabrication processes of N-MoS2/VG, PO4 3−-MoS2/VG, and (N, PO4 3−)-MoS2/VG. HAADF images of (i) pristine MoS2 and (j) (N, PO4 3−)-MoS2. (k) SEM image of (N, PO4 3−)-MoS2/VG. The inset is the corresponding FFT patterns. (l) Polarization curves and (m) Tafel plots. Reproduced from Ref. [232], Copyright 2019, Wiley-VCH. Fig. 15 (a) Schematic of the electron transfer pathways for photo-assisted HER in the RGO-M(Ni2+)-MoS2. TEM images of (b) RGO-MoS2 and (c) RGO-Ni2+-MoS2. (d) LSV curves of various electrocatalysts. Reproduced from Ref. [181], Copyright 2019, Elsevier. (e) Possible reaction mechanism for HER catalyzed by (C,P)3N4-M (Ni2+, Co2+)-MoS2. (f) TEM image of (C,P)3N4-M (Ni2+, Co2+)-MoS2. (g) LSV curves of various catalysts. Reproduced from Ref. [25], Copyright 2020, Elsevier. (h) Schematic illustration of the reaction mechanism in MoS2 on HG. (i) FE-SEM and (j) HRTEM images of MoS2/HG hybrid catalyst. (k) LSV at a scan rate of 10 mV s−1 obtained on different MoS2-based catalysts. Reproduced from Ref. [180], Copyright 2018, American Chemical Society. Fig. 16 (a) Schematic of the synthesis of HC-MoS2/Mo2C (“HC” means CH4/H2 thermal treatment). (b) HRTEM images of the MoS2; the corresponding fast FFT pattern is shown in the inset. (c) HRTEM images of HC-MoS2/Mo2C; the insets represent HRTEM images of a Mo2C nanocrystal in the red dotted box and a MoS2 flake in the blue dotted box, as well as a histogram of the size of the Mo2C. The scale bars in the insets are 1 nm. (d) LSV curves of different electrocatalysts for HER and (e) the corresponding Tafel plots. Reproduced from Ref. [185], Copyright 2020, Springer Nature. (f) Schematic of the synthetic route of 1T-MoS2/CoS2 heterostructure. (g) SEM image of molybdate cobalt oxide and the inset is the large view of SEM image. (h) TEM image. (i and j) HRTEM images of the 1T-MoS2/CoS2 heterostructure; the insets are the interlayer distance of MoS2 and the atomic structure of 1T- and 2H-MoS2. (k) The corresponding HRTEM marked in the white dotted box in (j). (l and m) LSV curves of Pt/C, MoS2/CoS2 heterostructure, MoS2 nanosheets, and CoS2 nanosheets, respectively. Reproduced from Ref. [112], Copyright 2020, Wiley-VCH. Fig. 17 (a) Schematic of the synthesis process of Ni(OH)2/MoS2@CC (carbon cloth) and (b) the corresponding TEM images of Ni(OH)2/MoS2@CC. The HRTEM of (c) MoS2@CC and (d) Ni(OH)2/MoS2@CC. (e) LSV curves and (f) Tafel plots of MoS2@CC, Ni(OH)2@CC, Ni(OH)2/MoS2@CC, and Pt/C, respectively. Reproduced from Ref. [141], Copyright 2017, Elsevier. (g) Illustration of synthesizing MoS2/NiCo-LDH heterostructure. (h) The HRTEM image of MoS2/NiCo-LDH composite and illustration of the alkaline HER in MoS2/LDH interface. (i) Free energy diagram for alkaline HER catalyzed by MoS2/NiCo-LDH. (j) LSV curves of different catalyst samples. Reproduced from Ref. [186], Copyright 2017, Elsevier. Fig. 18 (a) Schematic illustration of synthesizing Ni2P/MoS2/N:CNT. (b) iR-corrected polarization curves and (c) Tafel slopes of Pt/C, Ni2P, MoS2, Ni2P + MoS2, Ni2P/MoS2, Ni2P/MoS2/N:CNT, and Ni2P/MoS2/N:RGO (N-doped graphene) heterostructures in 0.5 M H2SO4. Reproduced from Ref. [76], Copyright 2019, WILEY-VCH Verlag GmbH & Co. KGaA, Weinheim. Table 1 The types, optimizing strategies, and HER performance of the reported MoS2 based catalysts in recent literature. Type Optimizing strategies Overpotential (mV) Tafel slope (mV dec−1) Electrolyte Ref. 1T-MoS2/NiS2 Phase engineering 116 72 1 m KOH [94] NiO@1T-MoS2 Phase engineering 46 52 1 m KOH [144] 1T-MoS2/TiO2− x @Ti Phase engineering 146 42 0.5 M H2SO4 [145] 1T-2H MoS2 Phase engineering 245 65 1 m KOH [146] 1T-MoS2-GNR Phase engineering 205 50 0.5 M H2SO4 [134] M−MoS2 Phase engineering 175 41 0.5 M H2SO4 [147] 1T-MoS2/SWNT Phase engineering 108 36 0.5 M H2SO4 [148] Se-MoS2(1T) Phase engineering 108 47 0.5 M H2SO4 [149] 1T@2H-MoS2/C Phase engineering 64 49 0.5 M H2SO4 [150] MoS2-Ti3C2(1T′) Phase engineering 163 45 0.5 M H2SO4 [151] MoSSe(1T) Phase engineering 49 140 0.5 M H2SO4 [152] 1T-MoS2/CC Phase engineering 151 55 0.5 M H2SO4 [153] 1T-MoS2/Ni(OH)2 Phase engineering 57 30 1 M KOH [154] 1T-MoS2/CoS2 Phase engineering 71 60 1 M KOH [155] 1T-MoS2/CoS2 Phase engineering 26 43 0.5 M H2SO4 [155] 1T/2H-MoS2 Phase engineering 220 61 0.5 M H2SO4 [156] CN/CNL/MoS2/CP(1T/2H) Phase engineering 112 77 0.5 M H2SO4 [157] Co-BDC/MoS2(1T) Phase engineering 248 86 0.5 M H2SO4 [158] N-1T-MoS2 Phase engineering 157 46 0.5 M H2SO4 [159] Pt@MoS2(1T) Phase engineering 88 56 0.5 M H2SO4 [160] V0.05Mo0.95S(1T) Phase engineering 156 54 0.5 M H2SO4 [161] defect-rich MoS2 nanosheets Defect engineering 193 50 0.5 M H2SO4 [162] single S vacancies MoS2 Defect engineering 131 48 0.5 M H2SO4 [163] Co-MoS2 Defect engineering 67 67 1 M KOH [164] Co-MoS2 Defect engineering 155 0.5 M H2SO4 [164] vanadium-doped MoS2 Defect engineering 206 89 1 M KOH [165] vanadium-doped MoS2 Defect engineering 194 59 0.5 M H2SO4 [165] MCM@MoS2-Ni Defect engineering 161 179 0.5 M H2SO4 [166] N-doped MoS2 Defect engineering 121 mV at 100 mA cm−2 41 0.5 M H2SO4 [119] (N, PO4 3−)-MoS2/VG Defect engineering 85 42 0.5 M H2SO4 [167] MoS2/NCNFs Defect engineering 135 48 0.5 M H2SO4 [168] Se-doped MoS2 Defect engineering 140 55 0.5 M H2SO4 [169] N-doped MoS2 Defect engineering 168 40 0.5 M H2SO4 [170] P-doped MoS2 Defect engineering 133 59 0.5 M H2SO4 [171] MoSP-10 Defect engineering 72 45 0.5 M H2SO4 [172] Rh-MoS2 Defect engineering 67 54 0.5 M H2SO4 [173] Se-MoS2-NF Defect engineering 132 75 0.5 M H2SO4 [174] Zn-MoS2 Defect engineering 140 51 0.5 M H2SO4 [175] R-MoS2@NF Defect engineering 71 100 1 M KOH [135] SV-MoS2 Defect engineering 170 60 0.5 M H2SO4 [176] MoS2 nanomesh Defect engineering 160 46 0.5 M H2SO4 [177] SA-Ru-MoS2 Defect engineering 76 21 1 M KOH [70] MoS2 nanowall Defect engineering 95 78 0.5 M H2SO4 [178] Zn@MoS2 Defect engineering 194 78 0.5 M H2SO4 [179] Vertical MoS2/HG Morphology design 124 41 0.5 M H2SO4 [180] Vertical MoS2/Ni2+/GO Morphology design 208 66 0.5 M H2SO4 [181] Vertical MoS2/Ni2+/C3N4 Morphology design 179 50 0.5 M H2SO4 [25] Core-shell ZnCo/NC@MoS2 Morphology design 130 60.2 0.5 M H2SO4 [182] meso-Fe-MoS2/CoMo2S4 Morphology design 122 90 1.0 M KOH [53] Winged Au@MoS2 Morphology design, heterostructure construction 120 52.9 0.5 M H2SO4 [183] 1T-phase MoS2 arrays Morphology design, defect engineering 76 47.4 0.5 M H2SO4 [184] MoS2/Mo2C Heterostructure construction 412 mV at 1000 mA cm−2 60 0.5 M H2SO4 [185] 1T-MoS2/CoS2 Heterostructure construction, phase engineering 26 60 0.5 M H2SO4 [112] 1T-MoS2/CoS2 Heterostructure construction, phase engineering 71 43 1.0 M KOH [112] Ni(OH)2/MoS2 Heterostructure construction 80 60 1.0 M KOH [141] NiCo-LDH/MoS2 Heterostructure construction 78 76.6 1.0 M KOH [186] MoS2/NiCo/CC Heterostructure construction, morphology design 153 49.7 0.5 M H2SO4 [187] MoS2/Ni2O3H Heterostructure construction 84 82.3 1.0 M KOH [188] MoP/MoS2 Heterostructure construction 54 58 1.0 M KOH [189] MoS2/GR Heterostructure construction 57 30 1.0 M KOH [154] MoS2-WS2 Heterostructure construction 129 72 0.5 M H2SO4 [190] Co3O4/MoS2 Heterostructure construction 205 mV at 20 mA cm−2 98 1.0 M KOH [74] 1T-2H MoS2/N-rGO Heterostructure construction, phase engineering 97 39 0.5 M H2SO4 [191] MoS2/ Bi2Te3/SrTiO3 Heterostructure construction 189 58 0.5 M H2SO4 [192] CoS2-MoS2 Heterostructure construction 82 59 1.0 M KOH [193] MoS2-MoP/FPC Heterostructure construction 144 41 0.5 M H2SO4 [194] Co9S8/MoS2 Heterostructure construction 194 96 1.0 M KOH [195] Co9S8/MoS2 Heterostructure construction 233 118 0.5 M H2SO4 [195] Review Molybdenum disulfide (MoS2)-based electrocatalysts for hydrogen evolution reaction: From mechanism to manipulation Yao Xu a Riyue Ge a Jack Yang b c Jiancheng Li d Sean Li b c ⁎ Ying Li a e Jiujun Zhang e f ⁎ Jing Feng g Bin Liu d Wenxian Li a b c e ⁎ a Institute of Materials, School of Materials Science and Engineering, Shanghai University, Shanghai 200444, China Institute of Materials School of Materials Science and Engineering Shanghai University Shanghai 200444 China Institute of Materials, School of Materials Science and Engineering, Shanghai University, Shanghai 200444, China b School of Materials Science and Engineering, University of New South Wales, Sydney NSW 2052, Australia School of Materials Science and Engineering University of New South Wales Sydney NSW 2052 Australia School of Materials Science and Engineering, University of New South Wales, Sydney NSW 2052, Australia c Materials and Manufacturing Futures Institute, University of New South Wales, Sydney NSW 2052, Australia Materials and Manufacturing Futures Institute University of New South Wales Sydney NSW 2052 Australia Materials and Manufacturing Futures Institute, University of New South Wales, Sydney NSW 2052, Australia d School of Materials Science and Engineering, Shanghai University, Shanghai 200444, China School of Materials Science and Engineering Shanghai University Shanghai 200444 China School of Materials Science and Engineering, Shanghai University, Shanghai 200444, China e Institute for Sustainable Energy, Shanghai University, Shanghai 200444, China Institute for Sustainable Energy Shanghai University Shanghai 200444 China Institute for Sustainable Energy, Shanghai University, Shanghai 200444, China f College of Materials Science and Engineering, Fuzhou University, Fuzhou 350108, Fujian, China College of Materials Science and Engineering Fuzhou University Fuzhou 350108 Fujian China College of Materials Science and Engineering, Fuzhou University, Fuzhou 350108, Fujian, China g Faculty of Materials Science and Engineering, Kunming University of Science and Technology, Kunming 650093, Yunnan, China Faculty of Materials Science and Engineering Kunming University of Science and Technology Kunming 650093 Yunnan China Faculty of Materials Science and Engineering, Kunming University of Science and Technology, Kunming 650093, Yunnan, China ⁎ Corresponding authors. Graphical abstract The underlying relationships among HER mechanisms, the surface/interface effect of MoS2, and HER performance are reviewed based on the analysis of the critical parameters, such as conductivity, active sites, ΔG H, and surface hydrophilicity. Molybdenum disulfide (MoS2)-based materials as the non-noble metal catalysts have displayed the potential capability to drive electrocatalytic hydrogen evolution reaction (HER) for green hydrogen production along with their intrinsic activity, tunable electronic properties, low cost, and abundance reserves, which have attracted intensive attention as alternatives to the low-abundance and high-cost platinum-based catalysts. However, their insufficient catalytic HER activities and stability are the major challenges for them to become practically applicable. Hereby, the MoS2-based electrocatalysts for HER are comprehensively reviewed to explain the fundamental science behind the manipulations of the crystal structure, microstructure, surface, and interface of MoS2 in order to enhance its catalytic performance through changing the electrical conductivity, the number of active sites, surface wettability, and the Gibbs free energy for hydrogen adsorption (ΔG H). Recent studies in surface/interface engineering, such as phase engineering, defect engineering, morphology design, and heterostructure construction, are analyzed to reveal the state-of-the-art strategies for designing and preparing the cost-effective and high-performance MoS2-based catalysts through optimizing the charge transfer, surface-active sites, ΔG H, and surface hydrophilicity. Lastly, the perspectives, challenges, and future research directions of HER electrocatalysis are also given to facilitate the further research and development of HER catalysts. Keywords Surface/interface engineering Hydrogen evolution reaction Molybdenum disulfide Mechanisms 1 Introduction The development of sustainable energy sources without carbon footprints such as solar, tidal, wind, waterfall, and geothermal energies, has attracted intensive interest in recent years with the growing concerns about the global shortages of fossil fuels and the environmental pollution problems [1–4]. However, there is a significant challenge in directly inputting and transmitting the electrical energy generated from these intermittent energy sources into the existing electricity grids. In this regard, developing energy storage technologies to efficiently store these electrical energies, including supercapacitors, batteries, and water-electrolysis to produce hydrogen, are critically needed [5–8]. In particular, water-electrolysis to produce hydrogen (H2) has been recognized as a feasible and sustainable option because of the widespread electrical source, zero-emission reaction process, and high-purity product of H2 [9–12]. In a water-electrolysis cell, the cathode process is the hydrogen evolution reaction (HER) [13–15]. The anode process is the oxygen evolution reaction (OER) [16]. Both of them require electrocatalysts to catalyze the chemical reactions with fast reaction kinetics [17–21]. Therefore, designing and synthesizing cost-efficiency and active electrocatalysts are essential for the large-scale manufacture of hydrogen through water-electrolysis [22–24]. Currently, the most popular commercial catalysts for HER include Pt/C (33 mV at 10 mA cm−2, 25 mV dec−1) [25] and Pd (110 mV at 10 mA cm−2, 87.8 mV dec−1) [26]. However, the low earth abundance of noble metals has significantly restricted their large industrial-scale applications [27,28]. Therefore, developing electrocatalysts with low mass loading of noble metals or even without noble metals is desired and essential to achieving affordable hydrogen production via electrolysis. To date, promising substitutes of noble metal catalysts include layered transition metal oxides [29–35], transition metal carbides (TMCs) [36–40], transition metal phosphides [41–44], transition metal nitrides (TMNs) [25,45], and transition metal dichalcogenides (TMDs) [46–54]. Layered metal oxides are environmentally friendly, cost-effective, accessible, and stable natures [55]. However, most metal oxides possess sluggish reaction kinetics and low electrical conductivity. Transitional metal carbides show high electrical conductivity, high mechanical strength, reasonable stability, and favorable intermediates-adsorption properties, but their interfacial reaction kinetics and catalytic activity are significantly worse compared with Pt-based catalyst materials. Transition metal phosphides are usually abundant, low-cost, and exhibit highly catalytic performance while their relatively unstable structures, agglomeration, and poisonous characteristics in their synthesis obstruct their widespread application. Transition metal nitrides usually have great electrical conductivity and corrosion resistance, and high mechanical hardness, but their HER activities are not particularly high. As a typical TMD, molybdenum disulfide (MoS2) with great potential as HER catalyst has attracted intensive attention in recent years [56–66]. MoS2 possesses intrinsic HER activity, but it is insufficient for mass production because of the low electrical conductivity, strong tendency towards agglomeration, low mechanical stability, and inert basal plane of MoS2. Surface/interface engineering could improve the HER performance of MoS2-based materials by overcoming these drawbacks of MoS2-based HER catalysts. Several material optimization strategies based on surface/interface engineering have been proposed for optimizing the electrical conductivity, inhibiting material agglomeration, increasing stability, decreasing the energy barriers of HER, and accelerating the catalytic HER process, as summarized in Fig. 1 . These methods include phase engineering [67–69], defect engineering [70,71], morphology design [72], and heterostructure construction [73–79]. The fabrication and application of MoS2-based catalysts have attracted significant attention in terms of the manipulations of electronic structures, the active catalytic centers, defect designs, synthetic methods, applications, etc. [80–84]. Chia et al. [80] summarized various strategies for enhancing HER on transition-metal dichalcogenides, such as MoS2, WS2, MoSe2, and MoSe2 including doping TMDs with Fe, Co, and Ni, synthesizing TMD hybrids on various catalyst supports, and increasing the number of active sites in the TMDs. It highlighted that further research should focus on the control of the phase transitions between TMDs’ metallic and semiconducting phases and the inherent electrochemical properties of TMDs. Jayabal et al. [81] reviewed the synthesis, characterization, and potential application areas of 1T-MoS2 and pointed out that the interface can be further studied in detail in future research to design unique high-performance 1T-MoS2 catalysts. The mechanism behind sustainable performance and the underlying structure-property relationship are still unclear and require further exploration. Zhu et al. [82] systemically summarized the relationship between the composition, structure, synthetic method, morphology, and activity of the MoS2-based electrocatalysts. The challenges for sustainable hydrogen generation include (i) the clarification of the mechanistic research at the atomic-scale level of MoS2-based electrocatalysts; (ii) in situ characterization techniques for the detection of active sites are still highly desirable; (iii) accurately comparing the performance of various catalysts is difficult for the lack of a universal standard. Wei et al. [83] discussed the experimental setup of electrocatalysis, providing some common guidelines which include the cell design, counter electrode, and reference electrode selection, working electrode preparation, data correction, as well as estimation of catalysts surface area. These reviews have described the physicochemical property, HER mechanism, and material improvement strategies in detail. In this paper, the mechanisms of HER catalyzed by MoS2-based catalysts are summarized to show how the HER performances can be enhanced through modification of the structures and compositions of the catalysts with surface/interface engineering. The underlying relationships among HER mechanisms, the surface/interface effect of MoS2, and HER performances are reviewed based on the analysis of the critical parameters that determine the catalytic performances, including charge transfer, active sites, ΔG H, and surface hydrophilicity. These relationships are discussed in detail concerning the three elementary steps involved in HER (Volmer reaction, Heyrovsky or Tafel reaction, and release step) to highlight how structural modifications in the layered MoS2 are beneficial for it to achieve high catalytic HER performances. Three steps are involved in HER: electrochemical adsorption step (Volmer reaction), electrochemical or chemical desorption step (corresponding to Heyrovsky or Tafel reaction), and release step, which is affected by the conductivity, wettability, the number and intrinsic activity of the active sites, and ΔG H of the MoS2 catalyst. Besides, the practical application of catalysts for HER should be sustainable and affordable, which requires lower overpotential for high-efficiency hydrogen production and good stability for the long-term HER process. Based on the optimization of these critical parameters, the optimizing strategies could boost the catalytic HER performance and are reviewed in this paper, including phase engineering, defect engineering, morphology control, and heterostructure construction, as illustrated in Fig. 1. The metallic 1T phase molybdenum disulfide possesses outstanding electronic conductivity and good wettability, leading to desirable electrochemical HER performances. We show that the electronic structure of MoS2 can be optimized through defect engineering to reach the optimum energetic balance between the adsorption and desorption of hydrogen intermediates. Thus the inert basal plane of MoS2 could be favourable for the hydrogen generation process. Two-dimension MoS2 tends to aggregate and stack. Controlling the morphologies of the MoS2 nanomaterials can expose more catalytic active sites to increase the specific areas of MoS2 thus accelerating fast ion/charge transfer at the interfaces. The abundant dangling bonds on the surface of MoS2 could provide sites for the connection between MoS2 and other materials, thus constructing the heterostructures. The construction of heterostructure will further confine the growth of MoS2 nanosheets to achieve a well-dispersed structure and produce more interfaces for enhancing interfacial electron transfer between semiconducting 2H phase MoS2 and the other components involved in the catalytic reactions. Combining these several strategies might remarkably improve the electrocatalytic performances. This review will deliver some insights into the design and optimization of MoS2-based catalysts even in the other energy conversion reactions. 2 The fundamental knowledge of MoS2 As a typical two-dimensional (2D) TMD, MoS2 monolayer consists of a trilayer structure with one layer of Mo atoms sandwiched between two layers of chalcogen S [85–88]. MoS2 has mostly active edges but neutral surfaces, which is similar to the other 2D materials including black phosphorus, silicene, graphene, antimonene, and borophene. These 2D materials may suffer from limitations because of their thermodynamically satisfied basal plane atoms. Nevertheless, the active edge planes and the adjustable band gap of MoS2 exhibit the enormous potential for electrocatalytic hydrogen generation [89]. As a polyphase material [90], the crystal structure of MoS2 includes the metastable phase of 1T, the thermodynamically stable phase of 2H, and the unstable phase of 3R. The bulk MoS2 is formed by stacked multiple trilayers and held together by van der Waals interaction [91,92]. The different phases of MoS2 have proven to exhibit different catalytic HER properties originating from the different metal coordination environments, as shown in Fig. 2 (a–c). The 1T-phase of MoS2 with octahedral metal coordination possesses metallic-like properties (Fig. 2d) [93], showing high electrical conductivity and electrocatalytic HER activity on basal planes [94,95]. The 2H– and 3R-phase of MoS2 are both semi-conducting with band gaps of 1.461 and 1.415 eV, respectively (Fig. 2e and f). The activity of 2H-MoS2 had been limited for decades due to its extremely inert basal planes until the theoretical calculations revealed that the edge planes were active for catalytic reactions [96,97]. 3R-MoS2 can hardly exist at ambient temperature. The MoS2-based catalysts are of particularly strong interest in the TMD family because they possess intrinsic activity induced by many active unsaturated sulfur atoms and Mo atoms in the material, which act as the catalytic active sites. MoS2 quantum dots [58], MoS2 monolayers [99], pure 1T-MoS2 [100], Co-doped mesoporous MoS2 foam [48], and many others, have been developed to enhance the exposure of the unsaturated atoms. These unsaturated atoms on MoS2 could interact with H to catalytically promote HER. However, HER catalyzed by MoS2 is significantly limited by the low electrical conductivity, strong tendency towards agglomeration, low mechanical stability, and inert basal plane of MoS2. More specifically: (1) The stable phase of bulk MoS2 is a semiconductor with a large bandgap of 1.8 eV [101], giving a large resistance in the vertical direction. MoS2 with a 6.5 Å van der Waals gap between each sheet results in the electron transfer about 2200 times faster along a basal plane direction than vertically across the van der Waals gap [102]. (2) As a two-dimensional material, MoS2 tends to aggregate and stack together to decrease its surface energy by exposing a less specific surface area (only about 4.36 m2 g−1) [103]. The small specific surface area severely limits the contact between the electrolyte and the catalysts in the HER; (3) The interlayers of MoS2 are bonded by the weak van der Waals interaction, which possesses lower stability compared to metal bonds in noble metals; (4) The edge planes of MoS2 with the Gibbs free energy of the adsorbed H (ΔG H) of 0.06 eV as shown in Fig. 3 when the basal planes of MoS2 with ΔG H of 1.92 eV, which means basal planes can hardly adsorb the H atom and are inactive towards HER, limiting the overall catalytic activity. 3 Electrocatalytic application of MoS2 3.1 The mechanisms of HER The process of electrocatalytic water splitting for hydrogen generation on the surface of materials includes three steps, i.e., adsorption, desorption, and release. The HER at the negative electrode (or cathode) is a two-electron transfer reaction [104,105] with intermediates such as the adsorbed hydrogen atom (Had) to produce hydrogen molecules. For further understanding of HER, two possible mechanisms, i.e., the Volmer-Tafel-release process and the Volmer-Heyrovsky-release process, have been proposed to describe the multi-step processes, as listed in the following equation [106]. In acidic (or neutral/alkaline) solution: Adsorption step (1) Volmer reaction: H3O+ (or H2O) + cat + e−→ cat-Had + H2O (or OH−) Desorption step (2) Heyrovsky reaction: cat-Had + H3O + (or H2O) + e−→cat---H2 + H2O (or OH−) (3) Tafel reaction: 2 cat-Had → cat---H2 + cat (4) Release step: cat---H2 → cat + H2↑ where the e− represents an electron, cat represents the catalyzed electrode surface, cat-Had represents an atom of hydrogen adsorbed on the catalyst surface, and cat---H2 represents a molecule physically adsorbed on the electrode surface. The Tafel slope is an inherent property of the reaction and indicates the rate-determining step of HER [107,108]. Regarding the catalytic HER process, three scenarios can be outlined as follows: (i) a slow Volmer reaction (1) leads to a large Tafel slope (~120 mV dec−1), (ii) a fast Volmer reaction followed by a limiting Heyrovsky reaction (2) gives a Tafel slope of ~40 mV dec−1, and (iii) the Tafel slope is ~30 mV dec−1 when a fast Volmer reaction followed by a rate-determining Tafel reaction (2). For the release step (4), H2 can be released from the electrode surface, which is mainly a physical process. The analysis of different Tafel slopes is helpful to understand the HER behavior on the MoS2-based electrode [82]. Regarding the Tafel slope values, HER catalyzed by MoS2 catalyst in alkaline solution showed a large Tafel slope of 129 mV dec−1, indicating that the rate-determining step is the Volmer reaction [109]. Chen et al. [110] synthesized a single-layer MoS2-coated Ag with a core–shell structure for accelerating the Volmer reaction to give a small Tafel slope of 41.1 mV dec−1. It was shown that controlling the morphologies of MoS2 or forming heterostructures between MoS2 and Ag could transform the catalytic pathway to a fast Volmer reaction followed by a slow Heyrovsky reaction [110]. Meng et al. [111] reported the catalyst of MoS2-confined single-atom rhodium could also drive a Volmer-Heyrovsky mechanism by defect engineering. Feng et al. [112] reported a 1T-MoS2/CoS2 heterostructure that could deliver low Tafel slopes of 60 mV dec−1 in 1.0 M KOH and 43 mV dec−1 in 0.5 M H2SO4, respectively. As identified, the combination of phase control and heterostructure construction strategy could result in a fast Volmer reaction followed by a slow Heyrovsky reaction [25,113]. The research of mechanisms in hydrogen evolution reaction catalyzed by MoS2-based catalysts could guide the modification of the structures and compositions for HER performance enhancement. The electrocatalytic performance was classified and discussed in the following parts of the HER process. 3.2 Electrocatalytic performance of HER The HER performance of MoS2 can be characterized by different techniques, either experimentally or theoretically, for every step discussed in Subsection 2.1 above. To better understand the catalyzed HER, Fig. 4 summarizes the detailed catalysis process and the process parameters affecting the mechanism of the HER. 3.2.1 Adsorption step In the adsorption step, the possible mechanism is the Volmer reaction on the active sites of the MoS2 catalyst loaded on the electrode surface. The adsorbed protons on the catalyst can couple with the electron to form cat-Had (Fig. 5 a) [114]. The conductivity and ΔG H of the catalyst are two key factors influencing this process. Normally, good conductivity can facilitate charge transfer to active sites on the catalysts. However, the semi-conductive MoS2 has a large charge resistance of 83.7 Ω (Fig. 5b) [109], which can decelerate the Volmer reaction. In addition, the thermoneutral interaction of proton with the surface (ΔG H ≅ 0) can benefit the adsorption of hydrogen. As reported by Tsai et al. [115], the values of ΔG H were 0.06 eV on the Mo-edge, −0.45 eV on S-edge, and 1.92 eV on the basal plane, meaning that the edge sites have proper adsorption and desorption capacities of hydrogen intermediates simultaneously. The conductivity of MoS2 can be characterized by electrochemical impedance spectroscopy (EIS). For example, Zang et al. [109] synthesized MoS2 with outstanding hydrogen evolution properties by carbon-induced orientation modulation, which can optimize the electronic and coordination structures of molybdenum disulfide. As shown in Fig. 5(b), Nyquist plots suggest that carbon doping in MoS2 could increase the interfacial electron-transfer kinetics. The EIS Nyquist plots could also provide the charge transfer resistance (R ct) of the catalyst, the uncompensated ohmic resistance of the electrochemical measurement system, and the ionic resistance of the electrolyte (R s). The constant-phase element (CPE) in the equivalent circuit model (inset in Fig. 5b) is used to fit impedance data. Regarding hydrogen evolution reaction, smaller R ct of the catalyst means faster electron transfer in Volmer reaction [116]. For semiconductors, the Mott-Schottky plot can be used for extracting the conduction and valence band positions of the semiconductive catalyst. The adsorption behavior of protons can also be determined by the θH (coverage of H) and ΔG H. θH represents the fraction of molybdenum or chalcogen atoms on the edge or basal plane that enables hydrogen binding. Higher θH could offer more sites for adsorbing the protons. The values of ΔG H can be used to describe the rate of reaction [80]. Weak bonding between hydrogen and the catalyst leads to a low concentration of proton being adsorbed on the catalyst; while strong bonding may limit the rate of the desorption step because Had always occupies the active sites of the catalyst. Thus the thermoneutral (ΔG H ≅ 0) interaction between hydrogen and the surface on catalysts is desired [80]. As indicated by previous work [7], Pt showing high catalytic activity of HER occurs for ΔG H ≅ 0. However, the activity of MoS2 is limited due to the extremely high ΔG H (=1.92 eV) on the basal plane of MoS2. The theoretical calculations revealed that the ΔG H on the edge sites of MoS2 was more thermo-neutral (0.08 eV) [96,97]. Therefore, several synthesis strategies were used to expose the edge plane and adjust the electronic structure of the surface on MoS2 [48,62,109]. Tang et al. [47] synthesized an ultrathin MoS2/nitrogen-doped rGO (the reduced graphene oxide) nanocomposite which presented a more preferable ΔG H value of −0.052 eV compared with the MoS2 nanosheet (−0.201 eV), resulting in the fast hydrogen desorption. 3.2.2 Desorption step In the desorption step expressed by Eqs. (2) or (3), the HER through the Tafel reaction is determined by the number and intrinsic activity of the active sites of the catalyst [117–119]. As discussed above, the HER rate through the Heyrovsky reaction can be influenced by conductivity, ΔG H, θH, and the number and intrinsic activity of the active sites. In order to increase the catalytic HER rate, increasing the number of active sites and the intrinsic activity of each active site are the two possible methods [102,120]. The number of active sites can be related to catalyst loading on the given electrode and its total catalytic active surface area. The mass loading of nonprecious materials, such as MoS2, is not seriously concerned because of their low cost. Measuring the total specific surface area is a rational procedure for determining the number of catalytic active sites of non-noble metal catalysts [121,122] because the total number of active sites usually scales with the total catalyst active surface area. The geometrical specific surface area (GEO) of an electrode can hardly represent the surface area of materials with nanostructures. Nano-engineering of catalysts can change the area substantially, which can be obtained by the Brunauer-Emmett-Teller (BET) method for assessing the geometrical specific surface area. BET relies on the adsorption of probe molecules such as N2 at the catalyst surface, which is valid for testing heterogeneous and complicated materials. However, the BET measurement of the catalyst might overestimate the active surface area due to the adsorption of some inactive parts of the catalyst (Fig. 5c) [102], leading to a conservative estimation of the intrinsic activity. It should be noted that the realistic reaction area might be dramatically different from the geometrical area of the flat electrode (Fig. 5c). Then, electrochemical active surface area (ECSA) is employed to estimate the active surface area in the electrochemical reaction through cyclic voltammetry measurements [123]. Combining the intrinsic activity of each catalytic site and its related physical and chemical properties is a way to understand catalytic behavior. However, non-Faradaic current, mass transport limitation, and/or catalyst instability can affect the measurement results of intrinsic activity. Li et al. [103] synthesized the vertical MoS2 nanolayers by the guidance of FeS2 sites supported on carbon nitride (C3N4) substrate to increase both the BET specific surface area and ECSA. An interfacial MoS2-based catalyst with polypyrrole substrate synthesized by a layer-by-layer strategy showed a much larger ECSA [124]. One of the well-known tools for assessing intrinsic per-site activity is the average turnover frequency (TOF), which is calculated by the equation of T O F = I / ( 2 F n ) , where I represents the current (A) during liner sweep measurement, n represents the number of active sites (mol), and F represents the Faraday constant (C mol−1). The factor 1/2 arrives by taking into account that two electrons are required to form one hydrogen molecule in HER [123,125,126]. Xu et al. [25] increased the TOF for MoS2 from 0.06 s−1 at an overpotential of 0.187 V to 0.138 s−1 at an overpotential of 0.179 V by constructing metal-ion bridging (C,P)3N4-M (Ni2+, Co2+)-MoS2 heterostructure through the hydrothermal method. Shin et al. [125] synthesized an amorphous MoS2 catalyst on Au with 1.45 s−1 at an overpotential of 0.2 V by an atomic layer deposition method. 3.2.3 Release step In the release step, the H2 is released from the surface of the catalyst, which is mainly influenced by the surface wettability of the catalyst. Catalysts with a hydrophilic surface can induce rapid detachment of hydrogen bubbles, resulting in enhanced HER performance. Fig. 5(d and e) shows the models of hydrogen detachment. During hydrogen evolution, the catalysts' surfaces with different contact angles can influence the speed of hydrogen gas detachment. The large contact angle of the liquid and solid leads to bubbles of large size, as shown in Fig. 5(d). On the other hand, the gas bubble can hardly grow up and may detach rapidly from the surface of the catalyst within a small contact angle. Thus, the adhesive contact area of the H2 bubbles is small (Fig. 5e). Furthermore, a hydrophilic catalyst can achieve an efficient and long-term hydrogen evolution reaction on account of the electrode-electrolyte interface with fewer adsorbed gas bubbles. Hence, the contact angle measurement can be applied to studying the hydrogen release. In this regard, Jung et al. [106] studied the effect of wettability and improved the hydrogen detachment by the controlling wettability of the MoS2 surface. A fast gas detachment from the catalytic surface of MoS2 was realized by minimizing the receding contact angle, resulting in an overpotential reduction in the MoS2. Gao et al. [127] optimized the adsorption of water molecules on the MoS2 catalyst by modifying the surface from hydrophobic to hydrophilic by introducing Ni3B4 dopants. The Ni3B4-doped MoS2 demonstrated a superior hydrophilic surface to pure-MoS2 [128]. 3.2.4 Practical application Lower overpotential and higher stability of the electrocatalysts are highly desired in the practical application of hydrogen generation, which are obtained by linear sweep voltammetry (LSV) and galvanostatic/potentiostatic electrolysis or repetitive cyclic voltammetry (CV), respectively. The Nernst potential of the hydrogen evolution reaction referenced to the reversible hydrogen electrode (RHE) is zero at 100 kPa and 298 K. But some adverse issues such as poor energy efficiency and high activation energy lead to high kinetic barriers. An extra applied potential to overcome the overpotential is required for the practical HER process. Meanwhile, the internal resistance of the catalyst cannot be ignored, which originates from the contact resistance of the electrochemical system and the intrinsic resistances of the electrocatalyst and electrolyte. Thus, the potential (E) necessary to drive HER is can be expressed by E = E H E R + i R + η , where E HER represents the Nernst potential, i is the current density, and R is the ohmic resistance when current flows across the electrochemical system. Usually, the overpotential at the current density of 10 mA cm−2 (per geometric area of an electrode), η 10 , is a widely used indicator to compare the activities of various catalysts in HER, corresponding to ∼10% solar-to-chemicals efficiency of HER [129]. η 10 value can estimate the activity of a catalyst faithfully with the same mass loading of the material on the electrode with the same geometrical area. Electrochemical stability is another important parameter for the practical application of HER. To evaluate the electrochemical durability of a catalyst, two electrocatalytic approaches for the stability measurements have been proposed: galvanostatic electrolysis (or potentiostatic electrolysis) and cyclic voltammetry. The potentiostatic (or galvanostatic) method is to monitor the current density (or potential) variation with reaction time at a constant overpotential (or current density). High stability is represented by the longer duration without or only with slight current density (or potential) change. The catalytic test should be lasted for at least 10 h under an applied current density of at least 10 mA cm−2. The repetitive CV method is first conducted in a certain cycling run (e.g., 10,000 runs) and then compared to find the difference in overpotentials before and after the CV. A small decrease in the overpotential suggests the high durability of the electrocatalyst [130]. The stability of most MoS2-based catalysts was only characterized for 24 h [82,98], which is far more from the practical application. The catalyst for industrial hydrogen production works for decades, which makes an enormous challenge for the stability of MoS2 electrocatalysts [131]. According to the proposed mechanism, the high-efficiency green production of H2 from electrocatalytic water splitting requires electrical conductivity, an abundant number of active sites, good surface wettability, and ΔG H. The large-scale manufacture of hydrogen energy demands high-efficiency, low-cost, and stable catalysts. The manipulation of the catalytic performance of MoS2 by active surface/interface engineering plays a significant role in hydrogen mass production. 4 Active surface/interface engineering in molybdenum disulfide Various strategies have been developed for enhancing the electrocatalytic performances by engineering the MoS2-based materials, such as phase engineering [132–137], defect engineering [119,138], morphology design [139,140], and heterostructure construction [112,141–143]. These strategies can provide various paths for optimizing the key factors which limit the electrocatalytic performances, i.e., the density of catalytic active sites, the electrical conductivity, the adsorption free energy of the reaction intermediates, and the surface wettability as mentioned in Section 2 in this review [80]. The types, optimizing strategies, and HER performance of the reported MoS2 based catalysts in recent literature were summarized in Table 1 . Tuning the contents of different phases in MoS2 could achieve enhancements in electrical conductivity because the metallic 1T-phased MoS2 could provide faster electron transfer for accelerating electrocatalytic reactions compared with the semiconducting 2H-phased MoS2 with a large bandgap. The intrinsic defects and the dopant-induced defects have shown profound impacts on catalytic performance as explained by structural-induced effect and electronic effect. Nanoscale catalysts with large surface areas and specific morphologies could efficiently boost the HER performance on account of the exposure of active crystal facets and abundant active sites, as well as fast mass transportation. Besides, constructing heterostructures can also provide abundant interfaces between the different components and optimize the electronic configuration by affecting the interfacial electron transfer, which optimizes ΔG H and simultaneously improves electrochemical activity, facilitating the overall HER process. 4.1 Phase engineering The crystal structure can show a strong influence on the physicochemical properties in electrocatalytic reactions [196], thermocatalytic reactions [197], and photocatalytic reactions [198,199]. Compared with 2H-MoS2, 1T-MoS2 possesses a modified structure and high active basal planes. Thus, the electrochemical performance could be promoted by increasing the content of metastable and active 1T-MoS2. The natural phase of 2H-MoS2 is thermodynamically stable, while the metastable 1T-MoS2 can only be obtained under harsh synthetic conditions, including the bottom-up synthesis through the hydrothermal/solvothermal reaction [200], confined template method [94], and colloidal synthesis [201], as well as the top-down synthesis through the lithium [90] or alkali metal intercalation-exfoliation [202], electron-beam irradiation [137], plasma hot-electron transfer [133,203], and mechanical strain [99]. The bottom-up methods, such as hydrothermal/solvothermal reactions, can be used for synthesizing 1T-MoS2 with reaction solvent molecules and precursor ions. While the growth kinetics are similar for these methods. The bottom-up methods can produce a few-layered 1T-MoS2 and 1T-MoS2 with specific morphologies (nanosheets, nanoparticles, etc.) by controlling the growth kinetics. Chen et al. [94] directly synthesized high-purity 1T-MoS2 with a 1T content of 83% using a hydrothermal method through a spatially confined template of layered Ni(OH)2, as demonstrated in Fig. 6 (a). The spherical aberration-corrected transmission electron microscopy (CS-TEM) observation indicates the close-coupling between the MoS2 flakes and NiS2 layers (Fig. 6b and c). The scanning transmission electron microscope high-angle annular dark-field (HAADF-STEM) image and its simulation (Fig. 6d and e) indicate that the MoS2 phase is a 1T-MoS2 crystal structure with an octahedral coordination atomic structure. The crystal phase of MoS2 can be also observed by the atomic arrangement of two S atoms between neighboring Mo atoms, as shown in Fig. 6(f). The 1T-MoS2/NiS2 catalyst exhibits a lower overpotential (116 mV at 10 mA cm−2) than that of the 2H-MoS2/NiS2 counterpart (Fig. 6g). This study revealed that the crystal phase control strategy for MoS2 nanomaterials can be achieved by using confining templates. Huang et al. [200] synthesized a metallic 1T-MoS2 with atomically engineered metal doping sites using Anderson-type polyoxometalates ([XH6Mo6O24] n −) as the precursors. The procedure for synthesizing XO@1T-MoS2 on carbon fiber paper with XMo6 through a hydrothermal reaction is shown in Fig. 6(h). The HAADF-STEM images in Fig. 6(i) show the structure of 1T-MoS2 is thin layers. The atomic arrangement of 1T-MoS2 is shown in the aberration-corrected atomic resolution HAADF-STEM image (Fig. 6j). The as-synthesized NiO@1T-MoS2 exhibited a low overpotential of 46 mV at 10 mA cm−2 in alkaline electrolyte. Combining the bottom-up methods with morphology design, Zhang et al. [145] prepared 1T-MoS2 by synthesizing 1T-MoS2 nanosheets embedded on black TiO2− x nanotube arrays grown on Ti plate (1T-MoS2/TiO2 − x @Ti) (Fig. 7 a). The TEM image in Fig. 7(b) demonstrates that ultrathin nanosheets are embedded in the TiO2− x nanotubes. The layered structure has lattice fringe spacings of 0.68 and 0.27 nm as shown in Fig. 7(c), which correspond to the (0 0 2) plane of 2H-MoS2 and (1 0 1) plane of 1T-MoS2. The inset in Fig. 7(c) shows the octahedral coordination of 1T-MoS2. The HRTEM in Fig. 7(d) exhibits that the interlayer spacing of 0.35 nm on the nanotube substrate corresponds to anatase TiO2. 1T-MoS2/TiO2− x @Ti shows the high activity of HER with a small overpotential (146 mV at 10 cm−2) and a small Tafel slope (42 mV dec−1), as shown in Fig. 7(e and f), because the ultrathin 1T-MoS2 nanosheets anchor on the TiO2− x nanotube arrays. The top-down methods usually intercalate various foreign Lewis bases and alkali-metal ions into the MoS2 interlayers to form 1T-MoS2. Compared with hydrothermal/solvothermal reactions, the top-down methods can achieve large-scale production of 1T phase MoS2. The ion intercalation can induce a conversion from 2H-phase to 1T-phase MoS2 by enlarging the interlayer spacing and changing the crystal structure of the MoS2 host lattice [90]. Wang et al. [146] synthesized an ultra-stable in-plane 1T-2H MoS2 heterostructure by introducing strain with phosphorus atoms, which could be stored for 500 days at room temperature. These heterostructures were obtained through the annealing treatment of 2H-MoS2 bulk under a mixture gas of phosphorous vapor and Ar (Fig. 8 a). The phosphorus can occupy the interspace of the interlayers in MoS2 to expand the lattice and embed it into the MoS2 bulk lattice to induce the partial phase transition from 2H– to 1T- MoS2. HRTEM images in Fig. 8(b and c) show the lattice fringes of 1T and 2H phases, and defects and deformation resulting from the inserted phosphorus atoms into MoS2. Remarkably, two distinct lattice regions with a similar crystalline space (~0.27 nm) are shown in a plane: the hexagonal lattice region contains (1 0 0) and (0 1 0) planes of 2H MoS2, and the trigonal lattice region involves the (1 0 1) plane of 1T MoS2. The improved HER performance shown in Fig. 8(d and e) demonstrates that the in-plane 1T-2H MoS2 heterostructure possesses a lower overpotential (245 mV at 10 mA cm−2) and higher electrical conductivity of 8620 S m−1, which is more suitable for HER than 2H-MoS2 bulk and 2H-MoS2 nanosheets. High electrical conductivity and electrocatalytic activity on basal planes of 1T-MoS2 develop the potential of molybdenum disulfide for fast HER. Bottom-up methods can produce 1T-MoS2 with high morphology quality but are limited by the yield. Thus these methods are mainly used for basic research. Top-down processes are cost-efficiency and suitable for mass production of 1T-MoS2. The synthesis of MoS2 with large content of 1T phase could achieve high activity towards HER because of the additional active basal planes. Furthermore, combining the 1T-MoS2 nanosheets with other materials [196] and accurately controlling the synthesis of 1T-MoS2 nanosheets [132] can deliver novel interfacial catalysts with a unique 1T-phase structure, leading to a fast Volmer reaction in HER. 4.2 Defect engineering Defects exist in all catalysts, which obey the second law of thermodynamics [204] and can be categorized into surface defects and bulk defects by their different positions. Defects show a deviation of the normal lattice in the nodes or adjacent regions [205]. These defects are usually thermodynamically unstable but quite effective and are most commonly used in the electrocatalytic process [206]. Through designing the surface defects, the electron density, electrical conductivity, coordination environment, interaction with surroundings, molecule adsorption/desorption energy, and energy bandgap of MoS2 can be modified for fast HER [207,208]. According to the origins of surface defects, they can be classified as doping-induced defects and intrinsic defects. An intrinsic defect occurs when atoms lose in the lattice node, while the doping-induced defect is the replacement of normal atoms or the occupation of gap positions in the normal lattice node by inducing heteroatoms, as shown in Fig. 9 . Generally, the classifications of defects are becoming more complicated and diversiform as knowledge of the theoretical and experimental expands. These defects can cause a redistribution of the electronic structure of the nanomaterials by disturbing or even breaking the periodic structure of crystals, providing ways to optimize the electrocatalytic performance by means of altering the contents, locations, and/or species of defects [209,210]. In recent years, the advanced research on defects design of MoS2-based materials has been reviewed as shown in Fig. 10 , which revealed that the defects can optimize electronic configuration and modulate their surface/interface microenvironments, enhancing their electrocatalytic performance [162,211–215]. 4.2.1 Intrinsic defects The introduction of intrinsic defects can produce high-density dangling bonds and unsaturated atoms and expose more active sites in the thermodynamically stable (0 0 2) planes of the MoS2 nanosheets [162]. The concentration and distribution of vacancies are the major factors influencing intrinsic defects. Xie et al. [162] used precursors to react with different amounts of thiourea for investigating the influence of vacancy concentration on catalysis. The reaction could control the defect generation in MoS2 ultrathin nanosheets. This strategy was a scalable path to introduce engineering defects into MoS2 surface to create partial cracking of the basal planes (Fig. 11 a) to expose active edge sites. The ultrathin nanosheet morphology is clearly shown in the TEM image (Fig. 11b). Many distortions and dislocations can also be observed in the (1 0 0) basal plane and (0 0 2) edge plane, as shown in the HRTEM images at the top (Fig. 11c) and side view (Fig. 11d), respectively. The disordered atom arrangement can cause the cracking of the basal planes and thus form additional edges. With the intrinsic defect-induced engineering, the defect-rich MoS2 nanosheets show outstanding HER performances with a small onset overpotential in Fig. 11(e) (193 mV at 10 mA cm−2). Wang et al. [216] investigated the impact of vacancy states on catalysis in addition to concentration via high throughput calculations. They developed a uniformly single S vacancy tailoring strategy by a mild H2O2 chemical etch on the basal plane (Fig. 11f). The spacing of typical crystal lattices increases from 0.64 to 0.68 nm after 60 s H2O2 etching (Fig. 11g and h). Fig. 11(i) exhibits few agglomerated S-vacancies and homogeneous distribution of single S-vacancies on the surface, while Fig. 11(j) indicates both the top and side views of a representative model. The optimal S-vacancy state is created on the MoS2 surface when the H2O2 etching duration is 60 s, resulting in a small η at 10 mA cm−2 (131 mV), as shown in Fig. 11(k). Intrinsic defects in the MoS2 lattice can deviate from the fixed molecular stoichiometries and tune the neighboring atomic and electronic arrangements [217,218]. The introduction of vacancy is an effective electronic structure engineering. This strategy can achieve high exposure of the catalytic edge active sites, activating the basal planes and intrinsic conductivity enhancement [219,220]. The intrinsic defect engineering can be extended to defect engineering to a more sophisticated level, thus further uncovering the potential of electrocatalytic HER performance enhancement. 4.2.2 Doping-induced defects The doping-induced defects can optimize the catalytic properties via integrating the unique 2D geometric structure with doping-induced electronic structure modulation on the basal plane. MoS2 nanosheets can support and stabilize the dopant with the crystallographic arrangement or the coordination environment of strong covalent bonds, but the doping atoms remain coordinately unsaturated, providing the active sites for catalysis reaction. Besides, the catalytic HER activity of the active sites on the MoS2 can be improved by the formation of new electronic states, resulting from the strong electronic interaction between the doping-induced defects and the MoS2 host. As reported, the MoS2 edges had metallic states while the basal plane of MoS2 nanosheets is semiconducting [221]. Enhancing the conductivity of the semiconducting basal plane is critical in promoting electrocatalytic HER activity. To enhance the conductivity of MoS2, Mo atoms in MoS2 could be replaced by a series of doping metals (Pt, V, Fe, Co, Ni, Cu, Zn, Mn, etc.) [175,222–226]. For example, Bolar et al. [165] prepared a vanadium-doped MoS2 (VMS) through a colloquial solvothermal method. As shown in Fig. 12 (a and b), when the electrode is in contact with the electrolyte, the Fermi level of VMS moves towards the conduction band, resulting in a band bending of the electrode. The junction is in flat potential when the band bending is absent in the junction between electrolyte and electrode at a certain applied potential. (Fig. 12c) Mott-Schottky plot in Fig. 12(d and e) exhibits the flat band potential of MoS2 changed with V-doping, leading to a fast charge transfer property at the interfaces. As a result, the low overpotentials of 206 and 194 mV at 10 mA cm−2 are obtained in basic and acidic media, respectively (Fig. 12f and g). However, inserting metal dopants with large atomic sizes, such as V, Fe, Co, and Ni, into the MoS2 matrix is technically challenging [227]. Metal atoms dopant in the basal plane of MoS2 may cause the undesirable growth of MoS3 or promotion on the terrace sites, resulting in instability of the MoS2 structure [223,228]. Zhang et al. [166] boosted catalytic HER activity through surface modulation at the atomic level, ruling out the affection of structural phase transitions. As shown in Fig. 12(h), the basal plane of MoS2 is decorated by the isolated Ni atom, which is supported on multichannel carbon nanofiber. The field-emission scanning electron (FESEM) image in Fig. 12(i) exhibits the randomly assembled nanosheets of the MoS2 shell. The extended X-ray absorption fine structure (EXAFS) results (Fig. 12j) show a dominant peak located at 1.63 Å which can be ascribed to the Ni–S bonding. No Ni–Ni bonding exists in MCM@MoS2, evidencing the absence of Ni clusters and particles. Compared with pristine MoS2 (297 mV) and MCM@MoS2 (263 mV), the overpotential of MCM@MoS2-Ni demonstrates a positive shift at 10 mA cm−2 (161 mV), as shown in Fig. 12(k). Besides, the Tafel slopes of pristine MoS2, MCM@MoS2, and MCM@MoS2-Ni in Fig. 12(l) are 81, 136, and 179 mV dec−1, respectively, indicating that the single-atom surface modification can accelerate HER kinetics. Li et al. [229] synthesized Co-doped MoS2 (Co-MoS2) with rich defects and edges through an in-situ sulphuration method (Fig. 13 a). The morphology of Co-doped MoS2 is a nanoscale particulate with abundant MoS2 layers, as shown in Fig. 13(b). Fig. 13(c) exhibits the structure of Co-doped MoS2 with short-range crystallinity, which originates from the spatial confinement effect of the retained carbon substrate. The lattice fringe (0.66 nm) in Fig. 13(d) corresponds to the MoS2. The lattice distortion and Co atom dopants in Co-doped MoS2 benefit electrocatalysis. The introduction of atomic Co into MoS2 gives rise to outstanding HER overpotentials in both alkaline (67 mV at 10.0 mA cm−2 in Fig. 13e) and acid (155 mV at 10 mA cm−2 in Fig. 13f) electrolytes. The ΔG H absolute values of edged Mo sites, edged S sites, and basal S sites in MoS2 decrease with the introduction of Co atoms (Fig. 13g), which indicates the doping effect could optimize the ΔG H and adjust the adsorption and desorption of HER. A deeper understanding of the promotional effect can benefit the development of HER electrocatalysts. The introduction of cation could activate the inert S atoms in the basal plane. Single-atom modification can provide a way to investigate the atomic coordination environment of the single heteroatom at the atomic level. Apart from the cation doping strategy, the replacement of S atoms with small atomic size nonmetal elements (N, O, Se, P, etc.) has been considered the feasible solution to accelerate the sluggish charge transfer [119,168–171,230,231]. For example, Xiao et al. [119] synthesized N-doped MoS2 nanosheets by a facile and cost-effective one-step sintering method. The thin nanosheets have clear edges in SEM images (Fig. 14 a and b). The typical 2D lamellar morphology of MoS2 offers some exposed edges which are active for HER. Besides, the deconvolution of MoS2 sheets could provide a large surface area that supports the hydrogen generation process. Fig. 14(c and d) demonstrates the less aggregation of MoS2 with only 2–4 layers. They also revealed that the N dopants in the MoS2 catalyst could activate HER activity and accelerate the charge transfer in the MoS2 basal plane, leading to a small overpotential (121 mV at 100 mA cm−2) (Fig. 14e). To further prove that the N substitution on S site (NS) dopants could activate the activity, they investigated the hydrogen absorption effect of NS in the Mo-edge and inert S-edge to tune the ΔG H. As shown in Fig. 14(f and g), the ΔG H values of pristine Mo-edge, S-edge, and basal plane change from −0.34, and −0.71 eV to −0.19, and 0.06 eV after N doping, respectively, which is conducive to HER process. The change of ΔG H values indicates that NS dopant could activate the HER activity of inert S-edge and Mo-edge. A novel strategy except single element doping, the intercalation of N plus PO4 3− was also used to produce a high proportion (ca. 41%) of 1T-MoS2 in 2H-MoS2, as reported by Deng et al. [232] 10% of single PO4 3− intercalation or ca. 28% of single N doping was obtained. The designed (N, PO4 3−)-MoS2 in Fig. 14(h) are combined with conductive substrate, the vertical graphene (VG) skeleton, to form binder-free arrays for further enhancing HER kinetics. The transformation from 2H-phase to 1T-phase is demonstrated in HAADF images of Fig. 14(i and j). Note that the (N, PO4 3−)-MoS2/VG remains the three-dimensional (3D) porous array architecture (Fig. 14k), suggesting good structure stability of the nanosheet. Owing to the doped effect and the control of phase, the designed (N, PO4 3−)-MoS2/VG electrocatalyst demonstrates an excellent HER performance, as shown in Fig. 14(l and m) (overpotential of 85 mV at 10 mA cm−2 and Tafel slope of 42 mV dec−1). The anion dopants can accelerate change transfer to enhance the electrocatalytic HER activity of the S-edge of MoS2 and improve the electrical conductivity of the basal plane of MoS2. Besides, the doped elements or intercalated ions can also achieve controllable phase transformation (1T-MoS2 from 2H-MoS2), boosting the change transfer within the MoS2. Defects, including vacancy and the doped exotic atoms, can affect the neighboring electronic structure and surface/interface property of MoS2-based catalyst by disrupting the original charge balance and creating a new distribution of charge, which then regulates the ΔG H and improves the conductivity of MoS2 [71]. Specifically, some defects on both edge and basal planes in MoS2 can also serve as active centers, providing unsaturated atoms for efficient HER [209]. However, controllable defect construction with specific types is challenging because of the complexity of defects in MoS2. In this sense, more accurate defect introduction methods are required to be further explored. 4.3 Morphology design The delicate design of morphology can simultaneously give both high electronic conductivity and large specific active surface areas of MoS2 nanosheets. Many morphological design methods have been developed to synthesize MoS2-based materials with various shapes and sizes as well as large active surface areas, such as vertical structure [25,180,181] and yolk-shell structure [139,182]. The formation of nanostructure with specific morphology can not only expose more catalytic active sites on the larger specific area of MoS2 but also provide many pathways for fast ion/charge transfer between layers of MoS2. The electrical conductivity along the layer was about 2200 times higher than that across the layers in the material [80]. Ge et al. [181] synthesized an electrocatalyst assembled by vertical growth MoS2 on the reduced graphene oxide (RGO) via the link of transition metal ions as bridges, as shown in Fig. 15 (a). The introduction of bridging metal ions can inhibit the agglomeration of MoS2 nanosheets as well as the restack and enfoldment of RGO nanosheets (Fig. 15b and c), resulting in MoS2 sheets grown uniformly and vertically on RGO. The metal ions can not only cling to the molybdate precursor with a negative charge, being the nucleation centers for MoS2 nanosheets and synthesizing highly dispersed nanosheets, but also bond with the O in RGO surface and Mo in MoS2 nanosheets as the fast channels for electron transfer between graphene substrate and MoS2 nanosheets, resulting in higher conductivity of the electrocatalysis. Thus, a low overpotential (198 mV at 10 mA cm−2) is obtained as shown in Fig. 15(d). Xu et al. [25] synthesized MoS2 nanosheets growing perpendicularly on the P-doped carbon nitride ((C,P)3N4) nanolayer under the assistance of Ni2+ and Co3+ metal-ion bridges, forming a high-quality (C,P)3N4-M (Ni2+, Co2+)-MoS2 electrocatalyst for HER, as shown in Fig. 15(e). Ni2+-and Co2+-assisted growth could remarkably increase charge transfer through the short-distance channels between (C,P)3N4 and MoS2 and enhance the exposure of the active site on account of less stack and more edge exposure of MoS2 (Fig. 15f). Furthermore, the basal plane of the carbon nitride substrate became more conductive with P doping. These strategies achieved charge transfer optimization, (C,P)3N4-M (Ni2+, Co2+)-MoS2 exhibited low overpotential (179 mV at 10 mA cm−2) in an acid medium (Fig. 15g). As identified, a high conductive substrate is desirable for constructing efficient vertical electrocatalysts. Vertical ultrathin MoS2 nanosheet arrays were grown on hydrogenated graphene (HG), as reported by Han et al. [180] (Fig. 15h). The wrinkled MoS2 nanosheets are vertically oriented without agglomeration, as shown in Fig. 15(i) and its insert. The expanded lattice space of 0.65 nm in Fig. 15(j) is corresponding to the (002) plane of MoS2, which confirms the interaction between MoS2 and HG. Fig. 15(k) shows the low overpotential of 124 mV at 10 mA cm−2 and a small Tafel slope of 41 mV dec−1. These outstanding HER properties have resulted from the synergistic effects among high conductivity, large surface area, more active sites, and reduced Had energy by specific perpendicular structure. The morphological design can also be combined with defect engineering to accelerate the catalytic HER process [233–235]. Dong et al. [234] synthesized hierarchical composite catalysts for HER, in which the nitrogen (N)-doped carbon nanotubes (CNTs) were decorated with Ni atoms-incorporated vertical MoS2 nanosheets. The incorporation of Ni atoms could induce abundant unsaturated S atoms on the basal plane, leading to intensive active site exposure. Meanwhile, the substrate of N-doped CNTs can guide the growth of MoS2 nanosheets and heighten the conductivity of the electrocatalyst. Based on the increased active sites and the enhanced conductivity, the hierarchical electrocatalyst exhibited low overpotentials (158 and 179 mV at 10 mA cm−2 in 0.5 M H2SO4 and 1.0 M KOH, respectively), small Tafel slopes (62.3 and 69.3 mV dec−1 in the alkaline and acidic solutions, respectively) and long-time durability in both acidic and alkaline electrolytes. Experimental and theoretical investigations have indicated that morphology design strategy can increase micro- and nano-scale roughness of MoS2-based catalysts, which is crucial for the mass transfer and gas release on the interface between MoS2 and electrolyte. In addition, the enhanced active site exposure originating from morphology design can lead to high catalytic HER activity. Owing to the rapid gas release and the increased active site exposure, controlling morphology can achieve fast kinetics of both hydrogen absorption/desorption processes as well as H2 gas release. However, morphology design and optimization of MoS2 can hardly boost intrinsic activity and accelerate electron transfer in the basal plane. The other interface/surface engineering methods need to be combined to improve the overall catalytic HER activity and conductivity. 4.4 Heterostructure construction Heterostructures possess superior electrochemical properties in comparison with their corresponding single components owing to the synergistic effect on interfaces. Abundant interfaces between the different components can be induced into hybrid catalyst and optimize the electronic configuration by affecting the interfacial electron configuration [236,237]. The design and synthesis of the MoS2-based hybrids could be a viable way to accelerate the sluggish HER kinetics. Constructing heterostructure can also optimize ΔG H and simultaneously improve electrochemical activity, facilitating the overall HER process [141]. The synergistic effect of different components in MoS2-based electrocatalysts can unlock abundant possibilities for the modulation of HER performances. The heterostructures can be made with molybdenum-based compounds, sulfides, etc. For example, Zhang et al. [185] developed an exfoliation technique followed by thermal treatment and produced an HC-MoS2/Mo2C heterostructure (Fig. 16 a). The 2D MoS2 flakes without clear defects in their edge and basal planes are shown in Fig. 16(b). The α-Mo2C is formed on 2D MoS2 flakes after the thermal treatment (Fig. 16c). HC-MoS2/Mo2C delivers an overpotential of 412 mV at 1000 mA cm−2 and a Tafel slope of 60 mV dec−1 for HER via combining the merits of MoS2 and Mo2C (Fig. 16d and e). Feng et al. [112] combined phase control and heterostructure construction to synthesize a 3D 1T-MoS2/CoS2 heterostructure through an in-situ self-growing strategy (Fig. 16f). Comparing with SEM images at various resolutions (Fig. 16g) of molybdate cobalt oxide, 1T-MoS2/CoS2 with calcination of thiourea shows the 1D nanorods decorated with abundant flexible nanosheets (Fig. 16h). The microstructure of the 3D 1T-MoS2/CoS2 heterostructure can be seen by TEM and HRTEM images (Fig. 16h and i). The (2 0 0) plane of CoS2 and the (0 0 2) plane of MoS2 can join together, indicating the vertical growth of MoS2 nanosheets on the CoS2 nanosheets. The highly exposed edge planes of the ultrathin MoS2 nanosheets (3–6 layers in Fig. 16j) can provide abundant active sites for high catalytic HER process. Notably, the hexagonal lattice of 2H-phase and trigonal lattice of 1T-phase coexist in a plane (Fig. 16k). This 3D heterostructure with a high content of 76.6% for 1T-MoS2, and the abundant interfaces between CoS2 and MoS2 nanosheets can effectively increase the catalytic active site exposure. Therefore, the obtained 3D 1T-MoS2/CoS2 possesses outstanding electrocatalytic HER activity in both acid and alkaline electrolytes (Fig. 16l and m). HER in the alkaline electrode is kinetically retarded on account of the slow water dissociation process. The kinetics of alkaline HER can be accelerated by combining MoS2 and components as an OH− acceptor. For example, Zhang et al. [141] synthesized a Ni(OH)2/MoS2 heterostructure with outstanding alkaline HER activity, resulting from the synergistic effect of Ni(OH)2 and MoS2 on their interface. The Ni(OH)2 could promote water dissociation and hydrogen intermediate production as well as the nearby MoS2 with active sites which could adsorb hydrogen intermediates and product hydrogen molecule, as illustrated in Fig. 17 (a). The TEM image in Fig. 17(b) confirms that Ni(OH)2 nanoparticles are dispersed on the surface of MoS2, generating abundant interfaces for hydrogen evolution reactions. The interlayer distance ascribed to the (0 0 2) plane of MoS2 slightly increases after the Ni(OH)2 is deposited (Fig. 17c and d). The typical lamellar heterostructure of Ni(OH)2/MoS2@CC has a low HER overpotential of 80 mV at 10 mA cm−2 (Fig. 17e) with a Tafel slope of 60 mV dec−1 (Fig. 17f). Hu et al. [186] dramatically improved the HER kinetics by constructing vertical MoS2 sheets with NiCo-based layered double hydroxide (NiCo-LDH), as shown in Fig. 17(g). The TEM image in Fig. 17(h) demonstrates the lattice fringes of 0.21, 0.26, and 0.62, which agree with the (015) and (012) lattice spacing of NiCo-LDH, as well as (002) lattice spacing of MoS2, respectively. The judicious hybridization of MoS2 and LDH (insert in Fig. 17h) can speed up water dissociation steps in alkaline HER by decreasing the activation energies of MoS2/NiCo-LDH (Fig. 17i). The lower overpotential of MoS2/NiCo-LDH heterostructure in Fig. 17(j) also confirms that the hybridization can enhance the HER activity of electrocatalyst. Wei et al. [187] developed an approach that combines heterostructure construction with morphology design. They synthesized the MoS2 arrays onto the NiCo-LDH template deposited on the carbon cloth substrate, which oriented the growth of molybdenum disulfide nanosheets. The template of NiCo-LDH enables the epitaxy of MoS2 and the large exposure of active sites. Thus, the electrode only requires a small overpotential (153 mV) at 10 mA cm−2 in 0.5 M H2SO4 electrolyte. Besides, heterostructure construction strategy can also activate the basal planes of MoS2. Kim et al. [76] developed a method to activate the basal planes of MoS2 through growing Ni2P nanoparticles on basal planes of MoS2. The Ni2P/MoS2 heterostructure with a substrate of N-doped carbon nanotube (Ni2P/MoS2/N:CNT, as shown in Fig. 18 a) achieves HER performance enhancement. The Ni2P/MoS2/N:CNT heterostructure exhibits an HER activity and outperforms the Pt/C electrocatalyst in the high current density region (>200 mA cm−2), as shown in Fig. 18(b). The small Tafel slope of Ni2P/MoS2/N:CNT shown in Fig. 18(c) shows that the mechanism is in agreement with the Volmer-Heyrovsky-release process. MoS2 demonstrates fast adsorption of Had when constructing heterostructure with other components such as metal oxides and hydroxides, which could be effective for cleaving the HO–H bond in both neutral and alkaline media [238–240], thus facilitating the overall catalytic HER process. The flexible modulation of composite interfaces for better HER performances can be achieved by the precise design of the component and dispersion corresponding heterostructure [37]. The interface effect in heterostructure hastens the slow Volmer reaction, thus leading to a Volmer step followed by a Heyrovsky mechanism with fast reaction kinetics. This is because the interface modification can decrease the energy barrier of hydrogen adsorption steps, thus enhancing the electrical activity of active sites. 5 Challenges of MoS2-based electrocatalysts MoS2-based catalysts possess catalytic HER activity and have been widely regarded as the substitute for noble metal catalysts. This is owing to their layered crystal structure and specific electronic structure. The active edge Mo and S sites of 2H-MoS2 have the ΔG H values close to neutral, which are favorable for electrocatalysis. The cost-effective MoS2 with earth-abundant elements of Mo and S is promising for practical application. Although achievements and advantages of MoS2-based electrocatalysts have been made till now, MoS2-based electrocatalysts for commercial hydrogen generation are still requiring further modification and manipulation to meet the requirements of practical application. Each modification strategy mentioned above has its bottlenecks, which limit the catalytic HER performance. The 1T-MoS2 possesses outstanding electronic conductivity, active basal plane, and hydrophilic surface, which is favorable for electrocatalytic hydrogen production. But, the research on 1T-MoS2 still suffers from worse phase stability. The content of the 1T-phase is mainly in a range of 40 wt% to 83 wt% in 2H-MoS2 [94,241]. The poor stability and low purity limit the exploration of the full potential of 1T-MoS2 in electrocatalytic reactions. Furthermore, the conventional exfoliated methods have low output and harsh preparation conditions. Thus, stability, large-yield, simple synthetic methods with high purity of metallic 1T-phase MoS2 should be further improved. The defects engineering could optimize electronic configuration and modulate surface/interface microenvironments of MoS2-based electrocatalysts. In the case of catalytic HER, defect introduction could simultaneously achieve conductivity improvement, activity increase, and ΔG H optimization in the basal plane. However, more controllable and accurate methods for defects introduction still need to be explored. Quantitative defect construction with specific types is difficult because of the complexity of defects in MoS2. Furthermore, the dynamic evolution of defect structures with high reactivity and high energy usually occur in the catalytic process, which plays a vital role in catalytic HER activity. The effects of defects’ dynamic evolution and the relationship between defect structures with the electrocatalytic property need to be investigated and clarified by in-situ characterization. As for morphology design, the formation of nanostructures with specific shapes and sizes could expose more catalytic active sites of the larger specific areas of MoS2 and also provide many pathways for fast ion/charge transfer in interfaces. However, the specific morphology of MoS2 could hardly increase the intrinsic activity of the active site and change electron transfer in the basal plane, which limits the overall activity and conductivity. In addition, the MoS2-based electrocatalysts with specific morphologies usually possess poorer stability than bulk or agglomerated MoS2. For heterostructure construction, the additional parts could confine and guide the growth of MoS2 for a well-dispersed structure and expose abundant active sites, such as MoS2/Co(OH)2 heterostructure. Though Co(OH)2 has little effect on ΔG H and the number and activity of edge active sites, the interfaces possess favorable ΔG H and can act as new highly tunable and active catalytic sites [117]. Furthermore, the interfaces in heterostructure can optimize the electronic configuration by means of affecting the interfacial electron transfer and improving the conductivity among semiconducting 2H phase MoS2 and the additional components. The great challenge of constructing heterostructure is how to combine MoS2 with other materials to achieve unusual chemical and physical properties which are not observed on the original single layers. 6 Summary and outlook The possible mechanisms of HER catalyzed by MoS2-based catalysts have been reviewed in this paper. Three steps of hydrogen production, including the adsorption step, desorption step, and release step have been discussed. The adsorption step and the Heyrovsky reaction are primarily affected by the conductivity, ΔG H value, and the active sites. The Tafel reaction is mainly influenced by ΔG H and the active sites. The wettability is a key factor affecting the release step. The researches of mechanisms reveal the factors that influence the hydrogen generation process, which could guide the synthesis of the promising MoS2-based electrocatalysts with high electrical conductivity, near-zero adsorption free energy of intermediates, a large number of active sites, and the super hydrophilic surface. We have attempted to provide an overview of recently developed surface and interface engineering methods for synthesizing high-active MoS2-based catalysts including the control of crystal structures, manufacturing defects, designing specific morphologies, and constructing heterostructures. Different phases of MoS2 with different structures exhibit excellent performance for different purposes; i.e., 1T-MoS2 shows favorable electrocatalytic activity because its metallic property is desirable for charger transfer while 2H-MoS2 is more suitable for photocatalysis with a direct bandgap. The metallic phase (1T-MoS2) possesses outstanding conductivity, which can accelerate the Volmer step in HER. However, phase engineering such as preparing a perfect crystal structure is not enough for a high-efficiency electrocatalyst. Benefited from the development of defect engineering, doping heteroatoms and intrinsic defects on the surface of MoS2 show another way of developing high-activity HER catalysts. Surface/interface engineering of the catalysts by the introduction of defects can prominently modulate the electronic structure, Mo/S atom local bonding environment, and the band structure of MoS2, and thus boost the charge transfer ability. Besides, introducing the substrates coupling with MoS2 to form artificial morphology could enhance the specific surface area and achieve high HER performance. Conductive substrates like carbon are feasible materials to increase the electronic conductivity and mass transfer of the catalysts. Morphological modification is a promising and intriguing way because higher conductivity and large active specific surface areas of MoS2 nanosheets can be achieved at the same time. Introducing other highly efficient materials for heterostructure construction can also benefit the HER. The flexible modulation of composite interfaces in heterostructure construction for better HER performance can be achieved by the delicate design of the corresponding part of the heterostructure. Novel MoS2-based materials with the precise control of electronic structure and morphology are still highly demanded. However, the majority of the modulating strategies for surface/interface engineering on the MoS2-based electrocatalysts require complicated multistep processes and costly structural and spectral characterizations, limiting the research of MoS2-based catalysts with well-engineered interfaces. Designing desirable catalysts through theoretical calculations is an instructive method. The calculated bond strengths of the reaction intermediates on the catalysts’ active sites could guide the electronic structure adjustment and the electrochemical HER optimization on the active sites. However, the research on rate-determining steps, simulating the energy transfer processes, and predicting the intermediate states are still needed to be further explored. Currently, many efforts are still on the way to achieving scalable and facile methods to synthesize catalysts for practical application. However, the large overpotential values and poor stability of HER catalyzed by MoS2-based materials are still far from applications in the industry. Developing MoS2-based catalysts with high stability and energy efficiency is largely dependent on the ingenious design and synthesis strategies in future electrocatalysis exploration. As the unremitting research of surface/interface engineering strategies and other strategies, novel MoS2-based electrocatalysts would be able to provide solutions for solving the obstacles in the way of their practical green energy applications. Declaration of competing interest The authors declare that they have no known competing financial interests or personal relationships that could have appeared to influence the work reported in this paper. Acknowledgments This work was financially supported by the National Natural Science Foundation of China (Grant No. 51572166), the China Postdoctoral Science Foundation (Grant No. 2021M702073), and the Rare and Precious Metals Material Genetic Engineering Project of Yunnan Province (Grant No. 202002AB080001-1). Wenxian Li acknowledges research support from the Program for Professors with Special Appointments (Eastern Scholar: TP2014041) at Shanghai Institutions of Higher Learning. References [1] H.M. Wu C.Q. Feng L. Zhang J.J. Zhang D.P. Wilkinson Electrochem. Energy Rev. 4 2021 473 507 H.M. Wu, C.Q. Feng, L. Zhang, J.J. Zhang, D.P. Wilkinson, Electrochem. Energy Rev. 4 (2021) 473–507. [2] R.Y. Ge J.J. Huo Y. Li T. Liao J.J. Zhang M.Y. Zhu T. Ahamad S. Li H. Liu L.Y. Feng W.X. Li J. Alloys Compd. 904 2022 164084 R.Y. Ge, J.J. Huo, Y. Li, T. Liao, J.J. Zhang, M.Y. Zhu, T. Ahamad, S. Li, H. Liu, L.Y. Feng, W.X. Li, J. Alloys Compd. 904 (2022) 164084. [3] Z.R. Yu H.B. Liu M.Y. Zhu Y. Li W.X. Li Small 17 2021 e1903378 Z.R. Yu, H.B. Liu, M.Y. Zhu, Y. Li, W.X. Li, Small. 17 (2021) e1903378. [4] H.D. Xu J. Yang R.Y. Ge J.J. Zhang Y. Li M.Y. Zhu L.M. Dai S. Li W.X. Li J. Energy Chem. 71 2022 234 265 H.D. Xu, J. Yang, R.Y. Ge, J.J. Zhang, Y. Li, M.Y. Zhu, L.M. Dai, S. Li, W.X. Li, J. Energy Chem. 71 (2022) 234–265. [5] J. Duan X. Tang H.F. Dai Y. Yang W.Y. Wu X.Z. Wei Y.H. Huang Electrochem. Energy Rev. 3 2020 1 42 J. Duan, X. Tang, H.F. Dai, Y. Yang, W.Y. Wu, X.Z. Wei, Y.H. Huang, Electrochem. Energy Rev. 3 (2020) 1–42. [6] F. Wu M.Q. Liu Y. Li X. Feng K. Zhang Y. Bai X.R. Wang C. Wu Electrochem. Energy Rev. 4 2021 382 446 F. Wu, M.Q. Liu, Y. Li, X. Feng, K. Zhang, Y. Bai, X.R. Wang, C. Wu, Electrochem. Energy Rev. 4 (2021) 382–446. [7] Z.W. Seh J. Kibsgaard C.F. Dickens I. Chorkendorff J.K. Norskov T.F. Jaramillo Science 355 2017 eaad4998 Z.W. Seh, J. Kibsgaard, C.F. Dickens, I. Chorkendorff, J.K. Norskov, T.F. Jaramillo, Science. 355 (2017) eaad4998. [8] L.L. Liang J.C. Li M.Y. Zhu Y. Li S.L. Chou W.X. Li Small 17 2021 e1903418 L.L. Liang, J.C. Li, M.Y. Zhu, Y. Li, S.L. Chou, W.X. Li, Small. 17 (2021) e1903418. [9] D. Zhao Z. Zhuang X. Cao C. Zhang Q. Peng C. Chen Y. Li Chem. Soc. Rev. 49 2020 2215 2264 D. Zhao, Z. Zhuang, X. Cao, C. Zhang, Q. Peng, C. Chen, Y. Li, Chem. Soc. Rev. 49 (2020) 2215–2264. [10] P. Thangasamy S. Oh S. Nam I.-K. Oh Carbon 158 2020 216 225 P. Thangasamy, S. Oh, S. Nam, I.-K. Oh, Carbon. 158 (2020) 216–225. [11] Y.Q. Zhang J. Yang R.Y. Ge J.J. Zhang J.M. Cairney Y. Li M.Y. Zhu S. Li W.X. Li Coord. Chem. Rev. 461 2022 214493 Y.Q. Zhang, J. Yang, R.Y. Ge, J.J. Zhang, J.M. Cairney, Y. Li, M.Y. Zhu, S. Li, W.X. Li, Coord. Chem. Rev. 461 (2022) 214493. [12] W.D. Zhong W.L. Li C.F. Yang J. Wu R. Zhao M. Idrees H. Xiang Q. Zhang X.K. Li J. Energy Chem. 61 2021 236 242 W.D. Zhong, W.L. Li, C.F. Yang, J. Wu, R. Zhao, M. Idrees, H. Xiang, Q. Zhang, X.K. Li, J. Energy Chem. 61 (2021) 236–242. [13] J.-Q. Chi M. Yang Y.-M. Chai Z. Yang L. Wang B. Dong J. Energy Chem. 48 2020 398 423 J.-Q. Chi, M. Yang, Y.-M. Chai, Z. Yang, L. Wang, B. Dong, J. Energy Chem. 48 (2020) 398–423. [14] R.P. Li Y. Li P.X. Yang D. Wang H. Xu B. Wang F. Meng J.Q. Zhang M.Z. An J. Energy Chem. 57 2021 547 566 R.P. Li, Y. Li, P.X. Yang, D. Wang, H. Xu, B. Wang, F. Meng, J.Q. Zhang, M.Z. An, J. Energy Chem. 57 (2021) 547–566. [15] Y. Wang Y. Zhao X. Ding L. Qiao J. Energy Chem. 60 2021 451 479 Y. Wang, Y. Zhao, X. Ding, L. Qiao, J. Energy Chem. 60 (2021) 451–479. [16] X.T. Jin X.L. Li H.T. Lei K. Guo B. Lv H.B. Guo D.D. Chen W. Zhang R. Cao J. Energy Chem. 63 2021 659 666 X.T. Jin, X.L. Li, H.T. Lei, K. Guo, B. Lv, H.B. Guo, D.D. Chen, W. Zhang, R. Cao, J. Energy Chem. 63 (2021) 659–666. [17] M.Y. Zhu S.J. Yu R.Y. Ge L.Y. Feng Y.X. Yu Y. Li W.X. Li ACS Appl. Energy Mater. 2 2019 4718 4729 M.Y. Zhu, S.J. Yu, R.Y. Ge, L.Y. Feng, Y.X. Yu, Y. Li, W.X. Li, ACS Appl. Energy Mater. 2 (2019) 4718–4729. [18] W. Zhang W.Z. Lai R. Cao Chem. Rev. 117 2017 3717 3797 W. Zhang, W.Z. Lai, R. Cao, Chem. Rev. 117 (2017) 3717–3797. [19] H. Lee S. Bak Y. Cho M. Kim S.H. Kang V.Q. Bui H.M. Le S.W. Kim H. Lee NPG Asia Mater. 10 2018 441 454 H. Lee, S. Bak, Y. Cho, M. Kim, S.H. Kang, V.Q. Bui, H.M. Le, S.W. Kim, H. Lee, NPG Asia Mater. 10 (2018) 441–454. [20] B. Gao X.Y. Du Y.M. Ma Y.X. Li Y.H. Li S.J. Ding Z.X. Song C.H. Xiao Appl. Catal. B 263 2020 117750 B. Gao, X.Y. Du, Y.M. Ma, Y.X. Li, Y.H. Li, S.J. Ding, Z.X. Song, C.H. Xiao, Appl. Catal. B. 263 (2020) 117750. [21] M. Liu M.S. Hybertsen Q. Wu Angew. Chem. Int. Ed. 59 2020 14835 14841 M. Liu, M.S. Hybertsen, Q. Wu, Angew. Chem. Int. Ed. 59 (2020) 14835–14841. [22] Y. Xiao X.Y. Guo N.C. Yang F.X. Zhang J. Energy Chem. 58 2021 508 522 Y. Xiao, X.Y. Guo, N.C. Yang, F.X. Zhang, J. Energy Chem. 58 (2021) 508–522. [23] Y.J. Zheng W.Y. Dai X.Q. Zhang J.-Q. Huang S. Maruyama H. Yuan R. Xiang J. Energy Chem. 70 2022 630 642 Y.J. Zheng, W.Y. Dai, X.Q. Zhang, J.-Q. Huang, S. Maruyama, H. Yuan, R. Xiang, J. Energy Chem. 70 (2022) 630–642. [24] S.Y. Ma J. Deng Y.P. Xu W.Y. Tao X.Q. Wang Z.P. Lin Q.H. Zhang L. Gu W.W. Zhong J. Energy Chem. 66 2022 560 565 S.Y. Ma, J. Deng, Y.P. Xu, W.Y. Tao, X.Q. Wang, Z.P. Lin, Q.H. Zhang, L. Gu, W.W. Zhong, J. Energy Chem. 66 (2022) 560–565. [25] Y. Xu J.T. Qu Y. Li M.Y. Zhu Y. Liu R.K. Zheng J.M. Cairney W.X. Li Sustain. Mater. Technol. 25 2020 e00172 Y. Xu, J.T. Qu, Y. Li, M.Y. Zhu, Y. Liu, R.K. Zheng, J.M. Cairney, W.X. Li, Sustainable Mater. Technol. 25 (2020) e00172. [26] C. Wang H. Xu H.Y. Shang L. Jin C.Y. Chen Y. Wang M.Y. Yuan Y.K. Du Inorg. Chem. 59 2020 3321 3329 C. Wang, H. Xu, H.Y. Shang, L. Jin, C.Y. Chen, Y. Wang, M.Y. Yuan, Y.K. Du, Inorg. Chem. 59 (2020) 3321–3329. [27] T.T. Yang T.L. Tan W.A. Saidi Chem. Mater. 32 2020 1315 1321 T.T. Yang, T.L. Tan, W.A. Saidi, Chem. Mater. 32 (2020) 1315–1321. [28] J.-T. Ren L. Chen D.-D. Yang Z.-Y. Yuan Appl. Catal. B 263 2020 118352 J.-T. Ren, L. Chen, D.-D. Yang, Z.-Y. Yuan, Appl. Catal. B. 263 (2020) 118352. [29] B. Wang Q. Zhang J.Q. He F. Huang C.F. Li M.Y. Wang J. Energy Chem. 65 2022 304 311 B. Wang, Q. Zhang, J.Q. He, F. Huang, C.F. Li, M.Y. Wang, J. Energy Chem. 65 (2022) 304–311. [30] M. Yang W.-H. Hu M.-X. Li Y.-N. Cao B. Dong Y. Ma H.-Y. Zhao F.-G. Wang J. Huang Y.-M. Chai J. Energy Chem. 68 2022 96 103 M. Yang, W.-H. Hu, M.-X. Li, Y.-N. Cao, B. Dong, Y. Ma, H.-Y. Zhao, F.-G. Wang, J. Huang, Y.-M. Chai, J. Energy Chem. 68 (2022) 96–103. [31] W.M. Yu Y. Liu Y.Z. Xu R.J. Li J.R. Chen B.-Q. Liao L.G. Shen H.J. Lin J. Membr. Sci. 581 2019 401 412 W.M. Yu, Y. Liu, Y.Z. Xu, R.J. Li, J.R. Chen, B.-Q. Liao, L.G. Shen, H.J. Lin, J. Membr. Sci. 581 (2019) 401–412. [32] Z.Y. Huang Q.Q. Zeng Y. Liu Y.C. Xu R.J. Li H.C. Hong L.G. Shen H.J. Lin J. Membr. Sci. 640 2021 119854 Z.Y. Huang, Q.Q. Zeng, Y. Liu, Y.C. Xu, R.J. Li, H.C. Hong, L.G. Shen, H.J. Lin, J. Membr. Sci. 640 (2021) 119854. [33] T. Li Y.R. Xiao D.X. Guo L.G. Shen R.J. Li Y. Jiao Y.C. Xu H.J. Lin J. Colloid Interface Sci. 572 2020 114 121 T. Li, Y.R. Xiao, D.X. Guo, L.G. Shen, R.J. Li, Y. Jiao, Y.C. Xu, H.J. Lin, J. Colloid Interface Sci. 572 (2020) 114–121. [34] R.J. Li L.H. Rao J.Z. Zhang L.G. Shen Y.C. Xu X.J. You B.-Q. Liao H.J. Lin J. Membr. Sci. 635 2021 119502 R.J. Li, L.H. Rao, J.Z. Zhang, L.G. Shen, Y.C. Xu, X.J. You, B.-Q. Liao, H.J. Lin, J. Membr. Sci. 635 (2021) 119502. [35] R.N. Zhang Y.C. Xu L.G. Shen R.J. Li H.J. Lin J. Membr. Sci. 653 2022 120541 R.N. Zhang, Y.C. Xu, L.G. Shen, R.J. Li, H.J. Lin, J. Membr. Sci. 653 (2022) 120541. [36] J.H. Yang J.K. Cooper F.M. Toma K.A. Walczak M. Favaro J.W. Beeman L.H. Hess C. Wang C.H. Zhu S. Gul J. Yano C. Kisielowski A. Schwartzberg I.D. Sharp Nat. Mater. 16 2016 335 J.H. Yang, J.K. Cooper, F.M. Toma, KarlA. Walczak, M. Favaro, JeffreyW. Beeman, LucasH. Hess, C. Wang, C.H. Zhu, S. Gul, J. Yano, C. Kisielowski, A. Schwartzberg, IanD. Sharp, Nat. Mater. 16 (2016) 335. [37] J.J. Huo Y.L. Chen Y. Liu J.J. Guo L. Lu W.X. Li Y. Wang H. Liu Sustain. Mater. Technol. 22 2019 e00117 J.J. Huo, Y.L. Chen, Y. Liu, J.J. Guo, L. Lu, W.X. Li, Y. Wang, H. Liu, Sustainable Mater. Technol. 22 (2019) e00117. [38] S.Y. Jing L.S. Zhang L. Luo J.J. Lu S.B. Yin P.K. Shen P. Tsiakaras Appl. Catal. B 224 2018 533 540 S.Y. Jing, L.S. Zhang, L. Luo, J.J. Lu, S.B. Yin, P.K. Shen, P. Tsiakaras, Appl. Catal. B. 224 (2018) 533–540. [39] J. Jia T.L. Xiong L.L. Zhao F.L. Wang H. Liu R.Z. Hu J. Zhou W.J. Zhou S.W. Chen ACS Nano 11 2017 12509 12518 J. Jia, T.L. Xiong, L.L. Zhao, F.L. Wang, H. Liu, R.Z. Hu, J. Zhou, W.J. Zhou, S.W. Chen, ACS Nano. 11 (2017) 12509–12518. [40] H.Y. He Y.X. Chen C.Z. Yang L. Yang Q.G. Jiang H.J. Huang J. Energy Chem. 67 2022 483 491 H.Y. He, Y.X. Chen, C.Z. Yang, L. Yang, Q.G. Jiang, H.J. Huang, J. Energy Chem. 67 (2022) 483–491. [41] R.Y. Ge J.J. Huo T. Liao Y. Liu M.Y. Zhu Y. Li J.J. Zhang W.X. Li Appl. Catal. B 260 2020 118196 R.Y. Ge, J.J. Huo, T. Liao, Y. Liu, M.Y. Zhu, Y. Li, J.J. Zhang, W.X. Li, Appl. Catal. B. 260 (2020) 118196. [42] X.K. Huang H.X. Xu D. Cao D.J. Cheng Nano Energy. 78 2020 105253 X.K. Huang, H.X. Xu, D. Cao, D.J. Cheng, Nano Energy. 78 (2020) 105253. [43] J. Zhou Y.B. Dou T. He X.-J. Kong L.-H. Xie J.-R. Li J. Energy Chem. 63 2021 253 261 J. Zhou, Y.B. Dou, T. He, X.-J. Kong, L.-H. Xie, J.-R. Li, J. Energy Chem. 63 (2021) 253–261. [44] Y. Lin X.M. Chen Y.X. Tuo Y. Pan J. Zhang J. Energy Chem. 70 2022 27 35 Y. Lin, X.M. Chen, Y.X. Tuo, Y. Pan, J. Zhang, J. Energy Chem. 70 (2022) 27–35. [45] H.-H. Zou W.-Q. Li C.-H. Song L.-M. Cao X.-F. Zhang X.-Y. Zhu Z.-Y. Du J. Zhang S.-L. Zhong C.-T. He J. Energy Chem. 72 2022 210 216 H.-H. Zou, W.-Q. Li, C.-H. Song, L.-M. Cao, X.-F. Zhang, X.-Y. Zhu, Z.-Y. Du, J. Zhang, S.-L. Zhong, C.-T. He, J. Energy Chem. 72 (2022) 210–216. [46] E. Mitterreiter Y. Liang M. Golibrzuch D. McLaughlin C. Csoklich J.D. Bartl A. Holleitner U. Wurstbauer A.S. Bandarenka NPJ 2D Mater. Appl. 3 2019 25 E. Mitterreiter, Y. Liang, M. Golibrzuch, D. McLaughlin, C. Csoklich, J.D. Bartl, A. Holleitner, U. Wurstbauer, A.S. Bandarenka, npj 2D Mater. Appl. 3 (2019) 25. [47] Y.J. Tang Y. Wang X.L. Wang S.L. Li W. Huang L.Z. Dong C.H. Liu Y.F. Li Y.Q. Lan Adv. Energy Mater. 6 2016 1600116 Y.J. Tang, Y. Wang, X.L. Wang, S.L. Li, W. Huang, L.Z. Dong, C.H. Liu, Y.F. Li, Y.Q. Lan, Adv. Energy Mater. 6 (2016) 1600116. [48] J. Deng H. Li S. Wang D. Ding M. Chen C. Liu Z. Tian K.S. Novoselov C. Ma D. Deng X. Bao Nat. Commun. 8 2017 14430 J. Deng, H. Li, S. Wang, D. Ding, M. Chen, C. Liu, Z. Tian, K.S. Novoselov, C. Ma, D. Deng, X. Bao, Nat. Commun. 8 (2017) 14430. [49] S.A. Shah X.P. Shen M.H. Xie G.X. Zhu Z.Y. Ji H.B. Zhou K.Q. Xu X.Y. Yue A.H. Yuan J. Zhu Small 15 2019 1804545 S.A. Shah, X.P. Shen, M.H. Xie, G.X. Zhu, Z.Y. Ji, H.B. Zhou, K.Q. Xu, X.Y. Yue, A.H. Yuan, J. Zhu, Small. 15 (2019) 1804545. [50] Q.C. Wang Y.P. Lei Y.C. Wang Y. Liu C.Y. Song J. Zeng Y.H. Song X.D. Duan D.S. Wang Y.D. Li Energy Environ. Sci. 13 2020 1593 1616 Q.C. Wang, Y.P. Lei, Y.C. Wang, Y. Liu, C.Y. Song, J. Zeng, Y.H. Song, X.D. Duan, D.S. Wang, Y.D. Li, Energy Environ. Sci. 13 (2020) 1593–1616. [51] W.Q. Han Z.H. Liu Y.B. Pan G.N. Guo J.X. Zou Y. Xia Z.M. Peng W. Li A. Dong Adv. Mater. 32 2020 e2002584 W.Q. Han, Z.H. Liu, Y.B. Pan, G.N. Guo, J.X. Zou, Y. Xia, Z.M. Peng, W. Li, A. Dong, Adv. Mater. 32 (2020) e2002584. [52] Y. Yu G.H. Nam Q. He X.J. Wu K. Zhang Z. Yang J. Chen Q. Ma M. Zhao Z. Liu F.R. Ran X. Wang H. Li X. Huang B. Li Q. Xiong Q. Zhang Z. Liu L. Gu Y. Du W. Huang H. Zhang Nat. Chem. 10 2018 638 643 Y. Yu, G.H. Nam, Q. He, X.J. Wu, K. Zhang, Z. Yang, J. Chen, Q. Ma, M. Zhao, Z. Liu, F.R. Ran, X. Wang, H. Li, X. Huang, B. Li, Q. Xiong, Q. Zhang, Z. Liu, L. Gu, Y. Du, W. Huang, H. Zhang, Nat. Chem. 10 (2018) 638–643. [53] Y. Guo J. Tang J. Henzie B. Jiang W. Xia T. Chen Y. Bando Y.M. Kang M.S.A. Hossain Y. Sugahara Y. Yamauchi ACS Nano 14 2020 4141 4152 Y. Guo, J. Tang, J. Henzie, B. Jiang, W. Xia, T. Chen, Y. Bando, Y.M. Kang, M.S.A. Hossain, Y. Sugahara, Y. Yamauchi, ACS Nano. 14 (2020) 4141–4152. [54] G.L. Shao X.X. Xue B.B. Wu Y.C. Lin M. Ouzounian T.S. Hu Y.Q. Xu X. Liu S.S. Li K. Suenaga Y.X. Feng S. Liu Adv. Funct. Mater. 30 2019 1906069 G.L. Shao, X.X. Xue, B.B. Wu, Y.C. Lin, M. Ouzounian, T.S. Hu, Y.Q. Xu, X. Liu, S.S. Li, K. Suenaga, Y.X. Feng, S. Liu, Adv. Funct. Mater. 30 (2019) 1906069. [55] T.Z. Xiong B.W. Huang J.J. Wei X.C. Yao R. Xiao Z.X. Zhu F. Yang Y.C. Huang H. Yang M.S. Balogun J. Energy Chem. 67 2022 805 813 T.Z. Xiong, B.W. Huang, J.J. Wei, X.C. Yao, R. Xiao, Z.X. Zhu, F. Yang, Y.C. Huang, H. Yang, M.S. Balogun, J. Energy Chem. 67 (2022) 805–813. [56] E. Cha M.D. Patel J. Park J. Hwang V. Prasad K. Cho W. Choi Nat. Nanotechnol. 13 2018 337 344 E. Cha, M.D. Patel, J. Park, J. Hwang, V. Prasad, K. Cho, W. Choi, Nat. Nanotechnol. 13 (2018) 337–344. [57] Y. Liu J. Guo E. Zhu L. Liao S.J. Lee M. Ding I. Shakir V. Gambin Y. Huang X. Duan Nature 557 2018 696 700 Y. Liu, J. Guo, E. Zhu, L. Liao, S.J. Lee, M. Ding, I. Shakir, V. Gambin, Y. Huang, X. Duan, Nature. 557 (2018) 696–700. [58] X. Ding F. Peng J. Zhou W. Gong G. Slaven K.P. Loh C.T. Lim D.T. Leong Nat. Commun. 10 2019 41 X. Ding, F. Peng, J. Zhou, W. Gong, G. Slaven, K.P. Loh, C.T. Lim, D.T. Leong, Nat. Commun. 10 (2019) 41. [59] L. Ries E. Petit T. Michel C.C. Diogo C. Gervais C. Salameh M. Bechelany S. Balme P. Miele N. Onofrio D. Voiry Nat. Mater. 18 2019 1112 1117 L. Ries, E. Petit, T. Michel, C.C. Diogo, C. Gervais, C. Salameh, M. Bechelany, S. Balme, P. Miele, N. Onofrio, D. Voiry, Nat. Mater. 18 (2019) 1112–1117. [60] J. Zhang L. Du S. Feng R.W. Zhang B. Cao C. Zou Y. Chen M. Liao B. Zhang S.A. Yang G. Zhang T. Yu Nat. Commun. 10 2019 4226 J. Zhang, L. Du, S. Feng, R.W. Zhang, B. Cao, C. Zou, Y. Chen, M. Liao, B. Zhang, S.A. Yang, G. Zhang, T. Yu, Nat. Commun. 10 (2019) 4226. [61] B. Li J. Yin X. Liu H. Wu J. Li X. Li W. Guo Nat. Nanotechnol. 14 2019 567 572 B. Li, J. Yin, X. Liu, H. Wu, J. Li, X. Li, W. Guo, Nat. Nanotechnol. 14 (2019) 567–572. [62] L.L. Wang X. Liu Q.F. Zhang G. Zhou Y. Pei S.H. Chen J. Wang A.M. Rao H.G. Yang B.A. Lu Nano Energy 61 2019 194 200 L.L. Wang, X. Liu, Q.F. Zhang, G. Zhou, Y. Pei, S.H. Chen, J. Wang, A.M. Rao, H.G. Yang, B.A. Lu, Nano Energy. 61 (2019) 194–200. [63] K. Zhang B. Jin Y. Gao S. Zhang H. Shin H. Zeng J.H. Park Small 15 2019 e1804903 K. Zhang, B. Jin, Y. Gao, S. Zhang, H. Shin, H. Zeng, J.H. Park, Small. 15 (2019) e1804903. [64] X.Y. Chia M. Pumera Nat. Catal. 1 2018 909 921 X.Y. Chia, M. Pumera, Nat. Catal. 1 (2018) 909–921. [65] M. Cantarella G. Gorrasi A. Di Mauro M. Scuderi G. Nicotra R. Fiorenza S. Scire M.E. Scalisi M.V. Brundo V. Privitera G. Impellizzeri Sci. Rep. 9 2019 974 M. Cantarella, G. Gorrasi, A. Di Mauro, M. Scuderi, G. Nicotra, R. Fiorenza, S. Scire, M.E. Scalisi, M.V. Brundo, V. Privitera, G. Impellizzeri, Sci. Rep. 9 (2019) 974. [66] W.D. Zhou M.Y. Chen M.M. Guo A.J. Hong T. Yu X.F. Luo C.L. Yuan W. Lei S.G. Wang Nano Lett. 20 2020 2923 2930 W.D. Zhou, M.Y. Chen, M.M. Guo, A.J. Hong, T. Yu, X.F. Luo, C.L. Yuan, W. Lei, S.G. Wang, Nano Lett. 20 (2020) 2923–2930. [67] W.C. Zhang X.B. Liao X.L. Pan M.Y. Yan Y.X. Li X.C. Tian Y. Zhao L. Xu L.Q. Mai Small 15 2019 1900964 W.C. Zhang, X.B. Liao, X.L. Pan, M.Y. Yan, Y.X. Li, X.C. Tian, Y. Zhao, L. Xu, L.Q. Mai, Small. 15 (2019) 1900964. [68] L.F. Wu A. Longo N.Y. Dzade A. Sharma M.M.R.M. Hendrix A.A. Bol N.H. de Leeuw E.J.M. Hensen J.P. Hofmann ChemSusChem 12 2019 4383 4389 L.F. Wu, A. Longo, N.Y. Dzade, A. Sharma, M.M.R.M. Hendrix, A.A. Bol, N.H. de Leeuw, E.J.M. Hensen, J.P. Hofmann, ChemSusChem. 12 (2019) 4383–4389. [69] K. Zhang B.J. Jin Y.J. Gao S.L. Zhang H. Shin H.B. Zeng J.H. Park Small 15 2019 1804903 K. Zhang, B.J. Jin, Y.J. Gao, S.L. Zhang, H. Shin, H.B. Zeng, J.H. Park, Small. 15 (2019) 1804903. [70] J.M. Zhang X.P. Xu L. Yang D.J. Cheng D.P. Cao Small Methods 3 2019 1900653 J.M. Zhang, X.P. Xu, L. Yang, D.J. Cheng, D.P. Cao, Small Methods. 3 (2019) 1900653. [71] L. Ji P.F. Yan C.H. Zhu C.Y. Ma W.Z. Wu C. Wei Y.L. Shen S.Q. Chu J.O. Wang Y. Du J. Chen X.N. Yang Q. Xu Appl. Catal. B 251 2019 87 93 L. Ji, P.F. Yan, C.H. Zhu, C.Y. Ma, W.Z. Wu, C. Wei, Y.L. Shen, S.Q. Chu, J.O. Wang, Y. Du, J. Chen, X.N. Yang, Q. Xu, Appl. Catal. B. 251 (2019) 87–93. [72] X.Y. Meng L. Yu C. Ma B. Nan R. Si Y.C. Tu J. Deng D.H. Deng X.H. Bao Nano Energy 61 2019 611 616 X.Y. Meng, L. Yu, C. Ma, B. Nan, R. Si, Y.C. Tu, J. Deng, D.H. Deng, X.H. Bao, Nano Energy. 61 (2019) 611–616. [73] Y. Mei T.T. Li J. Qian H. Li M. Wu Y.Q. Zheng Chem. Commun. 56 2020 13393 13396 Y. Mei, T.T. Li, J. Qian, H. Li, M. Wu, Y.Q. Zheng, Chem. Commun. 56 (2020) 13393–13396. [74] A. Muthurasu V. Maruthapandian H.Y. Kim Appl. Catal. B 248 2019 202 210 A. Muthurasu, V. Maruthapandian, H.Y. Kim, Appl. Catal. B. 248 (2019) 202–210. [75] P. Vishnoi K. Pramoda U. Gupta M. Chhetri R.G. Balakrishna C.N.R. Rao ACS Appl. Mater. Interfaces 11 2019 27780 27787 P. Vishnoi, K. Pramoda, U. Gupta, M. Chhetri, R.G. Balakrishna, C.N.R. Rao, ACS Appl. Mater. Interfaces. 11 (2019) 27780–27787. [76] M. Kim M.A.R. Anjum M. Lee B.J. Lee J.S. Lee Adv. Funct. Mater. 29 2019 1809151 M. Kim, M.A.R. Anjum, M. Lee, B.J. Lee, J.S. Lee, Adv. Funct. Mater. 29 (2019) 1809151. [77] Y. Zhou J.V. Pondick J.L. Silva J.M. Woods D.J. Hynek G. Matthews X. Shen Q.L. Feng W. Liu Z.X. Lu Z.X. Liang B. Brena Z. Cai M. Wu L.Y. Jiao S. Hu H.L. Wang C.M. Araujo J.J. Cha Small 15 2019 1900078 Y. Zhou, J.V. Pondick, J.L. Silva, J.M. Woods, D.J. Hynek, G. Matthews, X. Shen, Q.L. Feng, W. Liu, Z.X. Lu, Z.X. Liang, B. Brena, Z. Cai, M. Wu, L.Y. Jiao, S. Hu, H.L. Wang, C.M. Araujo, J.J. Cha, Small. 15 (2019) 1900078. [78] S.Z. Li W.J. Zang X.M. Liu S.J. Pennycook Z.K. Kou C.H. Yang C. Guan J. Wang Chem. Eng. J. 359 2019 1419 1426 S.Z. Li, W.J. Zang, X.M. Liu, S.J. Pennycook, Z.K. Kou, C.H. Yang, C. Guan, J. Wang, Chem. Eng. J. 359 (2019) 1419–1426. [79] R.Y. Ge J.J. Huo M.J. Sun M.Y. Zhu Y. Li S.L. Chou W.X. Li Small 17 2021 e1903380 R.Y. Ge, J.J. Huo, M.J. Sun, M.Y. Zhu, Y. Li, S.L. Chou, W.X. Li, Small. 17 (2021) e1903380. [80] X. Chia A.Y. Eng A. Ambrosi S.M. Tan M. Pumera Chem. Rev. 115 2015 1966 11941 11951 X. Chia, A.Y. Eng, A. Ambrosi, S.M. Tan, M. Pumera, Chem. Rev. 115 (2015) 11941–11966. [81] S. Jayabal J. Wu J.Y. Chen D.S. Geng X.B. Meng Mater. Today Energy 10 2018 264 279 S. Jayabal, J. Wu, J.Y. Chen, D.S. Geng, X.B. Meng, Mater. Today Energy. 10 (2018) 264–279. [82] J. Zhu L.S. Hu P.X. Zhao L.Y.S. Lee K.Y. Wong Chem. Rev. 120 2020 851 918 J. Zhu, L.S. Hu, P.X. Zhao, L.Y.S. Lee, K.Y. Wong, Chem. Rev. 120 (2020) 851–918. [83] C. Wei R.R. Rao J. Peng B. Huang I.E.L. Stephens M. Risch Z.J. Xu Y. Shao-Horn Adv. Mater. 31 2019 e1806296 C. Wei, R.R. Rao, J. Peng, B. Huang, I.E.L. Stephens, M. Risch, Z.J. Xu, Y. Shao-Horn, Adv. Mater. 31 (2019) e1806296. [84] J.J. Huo R.Y. Ge Y. Liu J.J. Guo L. Lu W.H. Chen C.T. Liu H. Gao H. Liu Sustain. Mater. Technol. 24 2020 e00161 J.J. Huo, R.Y. Ge, Y. Liu, J.J. Guo, L. Lu, W.H. Chen, C.T. Liu, H. Gao, H. Liu, Sustainable Mater. Technol. 24 (2020) e00161. [85] L.F. Fei S.J. Lei W.B. Zhang W. Lu Z.Y. Lin C.H. Lam Y. Chai Y. Wang Nat. Commun. 7 2016 12206 L.F. Fei, S.J. Lei, W.B. Zhang, W. Lu, Z.Y. Lin, C.H. Lam, Y. Chai, Y. Wang, Nat. Commun. 7 (2016) 12206. [86] B. Pattengale Y. Huang X. Yan S. Yang S. Younan W. Hu Z. Li S. Lee X. Pan J. Gu J. Huang Nat. Commun. 11 2020 4114 B. Pattengale, Y. Huang, X. Yan, S. Yang, S. Younan, W. Hu, Z. Li, S. Lee, X. Pan, J. Gu, J. Huang, Nat. Commun. 11 (2020) 4114. [87] H.M. Oh H. Kim H. Kim M.S. Jeong Sci. Rep. 9 2019 5900 H.M. Oh, H. Kim, H. Kim, M.S. Jeong, Sci. Rep. 9 (2019) 5900. [88] S. Fang Y. Wen C.S. Allen C. Ophus G.G.D. Han A.I. Kirkland E. Kaxiras J.H. Warner Nat. Commun. 10 2019 1127 S. Fang, Y. Wen, C.S. Allen, C. Ophus, G.G.D. Han, A.I. Kirkland, E. Kaxiras, J.H. Warner, Nat. Commun. 10 (2019) 1127. [89] S. Gbadamasi M. Mohiuddin V. Krishnamurthi R. Verma M.W. Khan S. Pathak K. Kalantar-Zadeh N. Mahmood Chem. Soc. Rev. 50 2021 4684 4729 S. Gbadamasi, M. Mohiuddin, V. Krishnamurthi, R. Verma, M.W. Khan, S. Pathak, K. Kalantar-Zadeh, N. Mahmood, Chem. Soc. Rev. 50 (2021) 4684–4729. [90] M.A. Lukowski A.S. Daniel F. Meng A. Forticaux L. Li S. Jin J. Am. Chem. Soc. 135 2013 10274 10277 M.A. Lukowski, A.S. Daniel, F. Meng, A. Forticaux, L. Li, S. Jin, J. Am. Chem. Soc. 135 (2013) 10274–10277. [91] D.K. Bediako M. Rezaee H. Yoo D.T. Larson S.Y.F. Zhao T. Taniguchi K. Watanabe T.L. Brower-Thomas E. Kaxiras P. Kim Nature 558 2018 425 429 D.K. Bediako, M. Rezaee, H. Yoo, D.T. Larson, S.Y.F. Zhao, T. Taniguchi, K. Watanabe, T.L. Brower-Thomas, E. Kaxiras, P. Kim, Nature. 558 (2018) 425–429. [92] A.R. Puente Santiago T. He O. Eraso M.A. Ahsan A.N. Nair V.S.N. Chava T. Zheng S. Pilla O. Fernandez-Delgado A. Du S.T. Sreenivasan L. Echegoyen J. Am. Chem. Soc. 142 2020 17923 17927 A.R. Puente Santiago, T. He, O. Eraso, M.A. Ahsan, A.N. Nair, V.S.N. Chava, T. Zheng, S. Pilla, O. Fernandez-Delgado, A. Du, S.T. Sreenivasan, L. Echegoyen, J. Am. Chem. Soc. 142 (2020) 17923–17927. [93] Z. Luo Y. Ouyang H. Zhang M. Xiao J. Ge Z. Jiang J. Wang D. Tang X. Cao C. Liu W. Xing Nat. Commun. 9 2018 2120 Z. Luo, Y. Ouyang, H. Zhang, M. Xiao, J. Ge, Z. Jiang, J. Wang, D. Tang, X. Cao, C. Liu, W. Xing, Nat. Commun. 9 (2018) 2120. [94] X. Chen Z. Wang Y. Wei X. Zhang Q. Zhang L. Gu L. Zhang N. Yang R. Yu Angew. Chem. Int. Ed. 58 2019 17621 17624 X. Chen, Z. Wang, Y. Wei, X. Zhang, Q. Zhang, L. Gu, L. Zhang, N. Yang, R. Yu, Angew. Chem. Int. Ed. 58 (2019) 17621–17624. [95] D. Voiry M. Salehi R. Silva T. Fujita M. Chen T. Asefa V.B. Shenoy G. Eda M. Chhowalla Nano Lett. 13 2013 6222 6227 D. Voiry, M. Salehi, R. Silva, T. Fujita, M. Chen, T. Asefa, V.B. Shenoy, G. Eda, M. Chhowalla, Nano Lett. 13 (2013) 6222–6227. [96] P. Raybaud J. Hafner G. Kresse S. Kasztelan H. Toulhoat J. Catal. 189 2000 129 146 P. Raybaud, J. Hafner, G. Kresse, S. Kasztelan, H. Toulhoat, J. Catal. 189 (2000) 129–146. [97] B. Hinnemann P.G. Moses J. Bonde K.P. Jørgensen J.H. Nielsen S. Horch I. Chorkendorff J.K. Nørskov J. Am. Chem. Soc. 127 2005 5308 5309 B. Hinnemann, P.G. Moses, J. Bonde, K.P. Jørgensen, J.H. Nielsen, S. Horch, I. Chorkendorff, J.K. Nørskov, J. Am. Chem. Soc. 127 (2005) 5308–5309. [98] S.W. Niu J.Y. Cai G.M. Wang Nano Res. 14 2020 1985 2002 S.W. Niu, J.Y. Cai, G.M. Wang, Nano Res. 14 (2020) 1985–2002. [99] K.A. Duerloo Y. Li E.J. Reed Nat. Commun. 5 2014 4214 K.A. Duerloo, Y. Li, E.J. Reed, Nat. Commun. 5 (2014) 4214. [100] X. Geng W. Sun W. Wu B. Chen A. Al-Hilo M. Benamara H. Zhu F. Watanabe J. Cui T.P. Chen Nat. Commun. 7 2016 10672 X. Geng, W. Sun, W. Wu, B. Chen, A. Al-Hilo, M. Benamara, H. Zhu, F. Watanabe, J. Cui, T.P. Chen, Nat. Commun. 7 (2016) 10672. [101] J. Ryou Y.-S. Kim S. Kc K. Cho Sci. Rep. 6 2016 29184 J. Ryou, Y.-S. Kim, S. Kc, K. Cho, Sci. Rep. 6 (2016) 29184. [102] J.D. Benck T.R. Hellstern J. Kibsgaard P. Chakthranont T.F. Jaramillo ACS Catal. 4 2014 3957 3971 J.D. Benck, T.R. Hellstern, J. Kibsgaard, P. Chakthranont, T.F. Jaramillo, ACS Catal. 4 (2014) 3957–3971. [103] Y. Li S.J. Zhu Y. Xu R.Y. Ge J.T. Qu M.Y. Zhu Y. Liu J.M. Cairney R.K. Zheng S. Li J.J. Zhang W.X. Li Chem. Eng. J. 421 2021 127804 Y. Li, S.J. Zhu, Y. Xu, R.Y. Ge, J.T. Qu, M.Y. Zhu, Y. Liu, J.M. Cairney, R.K. Zheng, S. Li, J.J. Zhang, W.X. Li, Chem. Eng. J. 421 (2021) 127804. [104] S. Fukuzumi Y. Yamada T. Suenobu K. Ohkubo H. Kotani Energy Environ. Sci. 4 2011 2754 2766 S. Fukuzumi, Y. Yamada, T. Suenobu, K. Ohkubo, H. Kotani, Energy Environ. Sci. 4 (2011) 2754–2766. [105] R.D. Wan M. Luo J.B. Wen S.L. Liu X.W. Kang Y. Tian J. Energy Chem. 69 2022 44 53 R.D. Wan, M. Luo, J.B. Wen, S.L. Liu, X.W. Kang, Y. Tian, J. Energy Chem. 69 (2022) 44–53. [106] W.B. Jung G.T. Yun Y. Kim M. Kim H.T. Jung ACS Appl. Mater. Interfaces. 11 2019 7546 7552 W.B. Jung, G.T. Yun, Y. Kim, M. Kim, H.T. Jung, ACS Appl. Mater. Interfaces. 11 (2019) 7546–7552. [107] C.G. Morales-Guio L.A. Stern X. Hu Chem. Soc. Rev. 43 2014 6555 6569 C.G. Morales-Guio, L.A. Stern, X. Hu, Chem. Soc. Rev. 43 (2014) 6555–6569. [108] S. Kamila B. Mohanty A.K. Samantara P. Guha A. Ghosh B. Jena P.V. Satyam B.K. Mishra B.K. Jena Sci. Rep. 7 2017 8378 S. Kamila, B. Mohanty, A.K. Samantara, P. Guha, A. Ghosh, B. Jena, P.V. Satyam, B.K. Mishra, B.K. Jena, Sci. Rep. 7 (2017) 8378. [109] Y. Zang S. Niu Y. Wu X. Zheng J. Cai J. Ye Y. Xie Y. Liu J. Zhou J. Zhu X. Liu G. Wang Y. Qian Nat. Commun. 10 2019 1217 Y. Zang, S. Niu, Y. Wu, X. Zheng, J. Cai, J. Ye, Y. Xie, Y. Liu, J. Zhou, J. Zhu, X. Liu, G. Wang, Y. Qian, Nat. Commun. 10 (2019) 1217. [110] J. Chen G. Liu Y.-Z. Zhu M. Su P. Yin X.-J. Wu Q. Lu C. Tan M. Zhao Z. Liu W. Yang H. Li G.-H. Nam L. Zhang Z. Chen X. Huang P.M. Radjenovic W. Huang Z.-Q. Tian J.-F. Li H. Zhang J. Am. Chem. Soc. 142 2020 7161 7167 J. Chen, G. Liu, Y.-z. Zhu, M. Su, P. Yin, X.-j. Wu, Q. Lu, C. Tan, M. Zhao, Z. Liu, W. Yang, H. Li, G.-H. Nam, L. Zhang, Z. Chen, X. Huang, P.M. Radjenovic, W. Huang, Z.-q. Tian, J.-f. Li, H. Zhang, J. Am. Chem. Soc. 142 (2020) 7161–7167. [111] X.Y. Meng C. Ma L.Z. Jiang R. Si X.G. Meng Y.C. Tu L. Yu X.H. Bao D.H. Deng Angew. Chem. Int. Ed. 59 2020 10502 10507 X.Y. Meng, C. Ma, L.Z. Jiang, R. Si, X.G. Meng, Y.C. Tu, L. Yu, X.H. Bao, D.H. Deng, Angew. Chem. Int. Ed. 59 (2020) 10502–10507. [112] Y.Y. Feng T. Zhang J.H. Zhang H. Fan C. He J.X. Song Small 16 2020 e2002850 Y.Y. Feng, T. Zhang, J.H. Zhang, H. Fan, C. He, J.X. Song, Small. 16 (2020) e2002850. [113] S. He H.F. Du K. Wang Q.C. Liu J.M. Sun Y.H. Liu Z.Z. Du L.H. Xie W. Ai W. Huang Chem. Commun. 56 2020 5548 5551 S. He, H.F. Du, K. Wang, Q.C. Liu, J.M. Sun, Y.H. Liu, Z.Z. Du, L.H. Xie, W. Ai, W. Huang, Chem. Commun. 56 (2020) 5548–5551. [114] J.M. Wei M. Zhou A.C. Long Y.M. Xue H.B. Liao C. Wei Z.J. Xu Nano-Micro Lett. 10 2018 75 J.M. Wei, M. Zhou, A.C. Long, Y.M. Xue, H.B. Liao, C. Wei, Z.J. Xu, Nano-Micro Lett. 10 (2018) 75. [115] C. Tsai K. Chan F. Abild-Pedersen J.K. Norskov Phys. Chem. Chem. Phys. 16 2014 13156 13164 C. Tsai, K. Chan, F. Abild-Pedersen, J.K. Norskov, Phys. Chem. Chem. Phys. 16 (2014) 13156–13164. [116] J. Wang F. Xu H.Y. Jin Y.Q. Chen Y. Wang Adv. Mater. 29 2017 1605838 J. Wang, F. Xu, H.Y. Jin, Y.Q. Chen, Y. Wang, Adv. Mater. 29 (2017) 1605838. [117] J. Zhu Z.C. Wang H. Dai Q. Wang R. Yang H. Yu M. Liao J. Zhang W. Chen Z. Wei N. Li L. Du D. Shi W. Wang L. Zhang Y. Jiang G. Zhang Nat. Commun. 10 2019 1348 J. Zhu, Z.C. Wang, H. Dai, Q. Wang, R. Yang, H. Yu, M. Liao, J. Zhang, W. Chen, Z. Wei, N. Li, L. Du, D. Shi, W. Wang, L. Zhang, Y. Jiang, G. Zhang, Nat. Commun. 10 (2019) 1348. [118] H. Park E. Lee M. Lei H. Joo S. Coh B.P.T. Fokwa Adv. Mater. 32 2020 e2000855 H. Park, E. Lee, M. Lei, H. Joo, S. Coh, B.P.T. Fokwa, Adv. Mater. 32 (2020) e2000855. [119] W. Xiao P.T. Liu J.Y. Zhang W.D. Song Y.P. Feng D.Q. Gao J. Ding Adv. Energy Mater. 7 2017 1602086 W. Xiao, P.T. Liu, J.Y. Zhang, W.D. Song, Y.P. Feng, D.Q. Gao, J. Ding, Adv. Energy Mater. 7 (2017) 1602086. [120] W.X. Li X.F. He R.Y. Ge M.Y. Zhu L.Y. Feng Y. Li Sustain. Mater. Technol. 22 2019 e00114 W.X. Li, X.F. He, R.Y. Ge, M.Y. Zhu, L.Y. Feng, Y. Li, Sustainable Mater. Technol. 22 (2019) e00114. [121] J.D. Benck Z. Chen L.Y. Kuritzky A.J. Forman T.F. Jaramillo ACS Catal. 2 2012 1916 1923 J.D. Benck, Z. Chen, L.Y. Kuritzky, A.J. Forman, T.F. Jaramillo, ACS Catal. 2 (2012) 1916–1923. [122] Y.P. Lei Y.C. Wang Y. Liu C.Y. Song Q. Li D.S. Wang Y.D. Li Angew. Chem. Int. Ed. 59 2020 20794 20812 Y.P. Lei, Y.C. Wang, Y. Liu, C.Y. Song, Q. Li, D.S. Wang, Y.D. Li, Angew. Chem. Int. Ed. 59 (2020) 20794–20812. [123] D. Voiry M. Chhowalla Y. Gogotsi N.A. Kotov Y. Li R.M. Penner R.E. Schaak P.S. Weiss ACS Nano 12 2018 9635 9638 D. Voiry, M. Chhowalla, Y. Gogotsi, N.A. Kotov, Y. Li, R.M. Penner, R.E. Schaak, P.S. Weiss, ACS Nano. 12 (2018) 9635–9638. [124] L. Xu Y.H. Zhang L.L. Feng X. Li Y.Y. Cui Q. An ACS Appl. Mater. Interfaces. 13 2021 734 744 L. Xu, Y.H. Zhang, L.L. Feng, X. Li, Y.Y. Cui, Q. An, ACS Appl. Mater. Interfaces. 13 (2021) 734–744. [125] S. Shin Z. Jin D.H. Kwon R. Bose Y.S. Min Langmuir 31 2015 1196 1202 S. Shin, Z. Jin, D.H. Kwon, R. Bose, Y.S. Min, Langmuir. 31 (2015) 1196–1202. [126] L. Ma L.R.L. Ting V. Molinari C. Giordano B.S. Yeo J. Mater. Chem. A 3 2015 8361 8368 L. Ma, L.R.L. Ting, V. Molinari, C. Giordano, B.S. Yeo, J. Mater. Chem. A. 3 (2015) 8361–8368. [127] B. Gao X.Y. Du Y.H. Li Z.X. Song Appl. Surf. Sci. 510 2020 145368 B. Gao, X.Y. Du, Y.H. Li, Z.X. Song, Appl. Surf. Sci. 510 (2020) 145368. [128] W. Liu X. Wang F. Wang K. Du Z. Zhang Y. Guo H. Yin D. Wang Nat. Commun. 12 2021 6776 W. Liu, X. Wang, F. Wang, K. Du, Z. Zhang, Y. Guo, H. Yin, D. Wang, Nat. Commun. 12 (2021) 6776. [129] C. Wei Z.J. Xu Small Methods 2 2018 1800168 C. Wei, Z.J. Xu, Small Methods. 2 (2018) 1800168. [130] Z. Zhang H.J. Liu L.W. Ni Z.-L. Zhao H. Li J. Energy Chem. 72 2022 176 185 Z. Zhang, H.J. Liu, L.W. Ni, Z.-L. Zhao, H. Li, J. Energy Chem. 72 (2022) 176–185. [131] Y. Xu J. Yang T. Liao R.Y. Ge Y. Liu J.J. Zhang Y. Li M.Y. Zhu S. Li W.X. Li Chem. Eng. J. 431 2022 134126 Y. Xu, J. Yang, T. Liao, R.Y. Ge, Y. Liu, J.J. Zhang, Y. Li, M.Y. Zhu, S. Li, W.X. Li, Chem. Eng. J. 431 (2022) 134126. [132] Q. Tang D.E. Jiang ACS Catal. 6 2016 4953 4961 Q. Tang, D.E. Jiang, ACS Catal. 6 (2016) 4953–4961. [133] Y. Kang S. Najmaei Z. Liu Y. Bao Y. Wang X. Zhu N.J. Halas P. Nordlander P.M. Ajayan J. Lou Z. Fang Adv. Mater. 26 2014 6467 6471 Y. Kang, S. Najmaei, Z. Liu, Y. Bao, Y. Wang, X. Zhu, N.J. Halas, P. Nordlander, P.M. Ajayan, J. Lou, Z. Fang, Adv. Mater. 26 (2014) 6467–6471. [134] J. Ekspong R. Sandström L.P. Rajukumar M. Terrones T. Wågberg E. Gracia-Espino Adv. Funct. Mater. 28 2018 1802744 J. Ekspong, R. Sandström, L.P. Rajukumar, M. Terrones, T. Wågberg, E. Gracia-Espino, Adv. Funct. Mater. 28 (2018) 1802744. [135] M.A.R. Anjum H.Y. Jeong M.H. Lee H.S. Shin J.S. Lee Adv. Mater. 30 2018 1707105 M.A.R. Anjum, H.Y. Jeong, M.H. Lee, H.S. Shin, J.S. Lee, Adv. Mater. 30 (2018) 1707105. [136] E.E. Benson H. Zhang S.A. Schuman S.U. Nanayakkara N.D. Bronstein S. Ferrere J.L. Blackburn E.M. Miller J. Am. Chem. Soc. 140 2018 441 450 E.E. Benson, H. Zhang, S.A. Schuman, S.U. Nanayakkara, N.D. Bronstein, S. Ferrere, J.L. Blackburn, E.M. Miller, J. Am. Chem. Soc. 140 (2018) 441–450. [137] Y.C. Lin D.O. Dumcenco Y.S. Huang K. Suenaga Nat. Nanotechnol. 9 2014 391 396 Y.C. Lin, D.O. Dumcenco, Y.S. Huang, K. Suenaga, Nat. Nanotechnol. 9 (2014) 391–396. [138] S.A. Shah X. Shen M. Xie G. Zhu Z. Ji H. Zhou K. Xu X. Yue A. Yuan J. Zhu Y. Chen Small 15 2019 e1804545 S.A. Shah, X. Shen, M. Xie, G. Zhu, Z. Ji, H. Zhou, K. Xu, X. Yue, A. Yuan, J. Zhu, Y. Chen, Small. 15 (2019) e1804545. [139] Q. Qin L. Chen T. Wei X. Liu Small 15 2019 e1803639 Q. Qin, L. Chen, T. Wei, X. Liu, Small. 15 (2019) e1803639. [140] S.R. Kadam S.W. Gosavi B.B. Kale N. Suzuki C. Terashima A. Fujishima Sci. Rep. 9 2019 12036 S.R. Kadam, S.W. Gosavi, B.B. Kale, N. Suzuki, C. Terashima, A. Fujishima, Sci. Rep. 9 (2019) 12036. [141] B. Zhang J. Liu J.S. Wang Y.J. Ruan X. Ji K. Xu C. Chen H.Z. Wan L. Miao J.J. Jiang Nano Energy 37 2017 74 80 B. Zhang, J. Liu, J.S. Wang, Y.J. Ruan, X. Ji, K. Xu, C. Chen, H.Z. Wan, L. Miao, J.J. Jiang, Nano Energy. 37 (2017) 74–80. [142] J. Hu C. Zhang Y. Zhang B. Yang Q. Qi M. Sun F. Zi M.K.H. Leung B. Huang Small 16 2020 e2002212 J. Hu, C. Zhang, Y. Zhang, B. Yang, Q. Qi, M. Sun, F. Zi, M.K.H. Leung, B. Huang, Small. 16 (2020) e2002212. [143] X.B. Xu W. Zhong S.L. Yan L. Zhang G.X. Liu Y.W. Du Int. J. Hydrogen Energy 45 2020 1759 1768 X.B. Xu, W. Zhong, S.L. Yan, L. Zhang, G.X. Liu, Y.W. Du, Int. J. Hydrogen Energy. 45 (2020) 1759–1768. [144] Y. Huang Y. Sun X. Zheng T. Aoki B. Pattengale J. Huang X. He W. Bian S. Younan N. Williams Nat. Commun. 10 2019 1 11 Y. Huang, Y. Sun, X. Zheng, T. Aoki, B. Pattengale, J. Huang, X. He, W. Bian, S. Younan, N. Williams, Nature communications. 10 (2019) 1–11. [145] T. Zhang T. Yang G. Qu S. Huang P. Cao W. Gao J. Energy Chem. 68 2022 71 77 T. Zhang, T. Yang, G. Qu, S. Huang, P. Cao, W. Gao, J. Energy Chem. 68 (2022) 71–77. [146] S. Wang D. Zhang B. Li C. Zhang Z. Du H. Yin X. Bi S. Yang Adv. Energy Mater. 8 2018 1801345 S. Wang, D. Zhang, B. Li, C. Zhang, Z. Du, H. Yin, X. Bi, S. Yang, Adv. Energy Mater. 8 (2018) 1801345. [147] X. Geng W. Sun W. Wu B. Chen A. Al-Hilo M. Benamara H. Zhu F. Watanabe J. Cui T.-P. Chen Nat. Commun. 7 2016 1 7 X. Geng, W. Sun, W. Wu, B. Chen, A. Al-Hilo, M. Benamara, H. Zhu, F. Watanabe, J. Cui, T.-p. Chen, Nature Commun. 7 (2016) 1–7. [148] Q. Liu Q. Fang W. Chu Y. Wan X. Li W. Xu M. Habib S. Tao Y. Zhou D. Liu Chem. Mater. 29 2017 4738 4744 Q. Liu, Q. Fang, W. Chu, Y. Wan, X. Li, W. Xu, M. Habib, S. Tao, Y. Zhou, D. Liu, Chem. Mater. 29 (2017) 4738–4744. [149] L. Jiang Y.-J. Zhang X.-H. Luo L. Yu H.-X. Li Y.-J. Li Chem. Eng. J. 425 2021 130611 L. Jiang, Y.-J. Zhang, X.-H. Luo, L. Yu, H.-X. Li, Y.-J. Li, Chem. Eng. J. 425 (2021) 130611. [150] S. Shi D. Gao B. Xia P. Liu D. Xue J. Mater. Chem. A 3 2015 24414 24421 S. Shi, D. Gao, B. Xia, P. Liu, D. Xue, J. Mater. Chem. A. 3 (2015) 24414–24421. [151] X. Li X. Lv X. Sun C. Yang Y.-Z. Zheng L. Yang S. Li X. Tao Appl. Catal. B: Environ. 284 2021 119708 X. Li, X. Lv, X. Sun, C. Yang, Y.-Z. Zheng, L. Yang, S. Li, X. Tao, Appl. Catalysis B: Environ. 284 (2021) 119708. [152] C. Tan Z. Luo A. Chaturvedi Y. Cai Y. Du Y. Gong Y. Huang Z. Lai X. Zhang L. Zheng Adv. Mater. 30 2018 1705509 C. Tan, Z. Luo, A. Chaturvedi, Y. Cai, Y. Du, Y. Gong, Y. Huang, Z. Lai, X. Zhang, L. Zheng, Adv. Mater. 30 (2018) 1705509. [153] Z. Liu L. Zhao Y. Liu Z. Gao S. Yuan X. Li N. Li S. Miao Appl. Catal. B: Environ. 246 2019 296 302 Z. Liu, L. Zhao, Y. Liu, Z. Gao, S. Yuan, X. Li, N. Li, S. Miao, Appl. Catalysis B: Environ. 246 (2019) 296–302. [154] W. Chen J. Gu Y. Du F. Song F. Bu J. Li Y. Yuan R. Luo Q. Liu D. Zhang Adv. Functional Mater. 30 2020 2000551 W. Chen, J. Gu, Y. Du, F. Song, F. Bu, J. Li, Y. Yuan, R. Luo, Q. Liu, D. Zhang, Adv. Functional Mater. 30 (2020) 2000551. [155] Y. Feng T. Zhang J. Zhang H. Fan C. He J. Song Small 16 2020 2002850 Y. Feng, T. Zhang, J. Zhang, H. Fan, C. He, J. Song, Small. 16 (2020) 2002850. [156] Z. Liu Z. Gao Y. Liu M. Xia R. Wang N. Li ACS Appl. Mater. Interfaces. 9 2017 25291 25297 Z. Liu, Z. Gao, Y. Liu, M. Xia, R. Wang, N. Li, ACS Appl. Mater. Interfaces. 9 (2017) 25291–25297. [157] J. Dong X. Zhang J. Huang J. Hu Z. Chen Y. Lai Chem. Eng. J. 412 2021 128556 J. Dong, X. Zhang, J. Huang, J. Hu, Z. Chen, Y. Lai, Chem. Eng. J. 412 (2021) 128556. [158] D. Zhu J. Liu Y. Zhao Y. Zheng S.Z. Qiao Small 15 2019 1805511 D. Zhu, J. Liu, Y. Zhao, Y. Zheng, S.Z. Qiao, Small. 15 (2019) 1805511. [159] X. Zang Y. Qin T. Wang F. Li Q. Shao N. Cao ACS Appl. Mater. Interfaces 12 2020 55884 55893 X. Zang, Y. Qin, T. Wang, F. Li, Q. Shao, N. Cao, ACS Appl. Mater. Interfaces. 12 (2020) 55884–55893. [160] Y. Li Q. Gu B. Johannessen Z. Zheng C. Li Y. Luo Z. Zhang Q. Zhang H. Fan W. Luo Nano Energy 84 2021 105898 Y. Li, Q. Gu, B. Johannessen, Z. Zheng, C. Li, Y. Luo, Z. Zhang, Q. Zhang, H. Fan, W. Luo, Nano Energy. 84 (2021) 105898. [161] M. Li B. Cai R. Tian X. Yu M.B. Breese X. Chu Z. Han S. Li R. Joshi A. Vinu Chem. Eng. J. 409 2021 128158 M. Li, B. Cai, R. Tian, X. Yu, M.B. Breese, X. Chu, Z. Han, S. Li, R. Joshi, A. Vinu, Chem. Eng. J. 409 (2021) 128158. [162] J. Xie H. Zhang S. Li R. Wang X. Sun M. Zhou J. Zhou X.W. Lou Y. Xie Adv. Mater. 25 2013 5807 5813 J. Xie, H. Zhang, S. Li, R. Wang, X. Sun, M. Zhou, J. Zhou, X.W. Lou, Y. Xie, Adv. Mater. 25 (2013) 5807–5813. [163] X. Wang Y. Zhang H. Si Q. Zhang J. Wu L. Gao X. Wei Y. Sun Q. Liao Z. Zhang J. Am. Chem. Soc. 142 2020 4298 4308 X. Wang, Y. Zhang, H. Si, Q. Zhang, J. Wu, L. Gao, X. Wei, Y. Sun, Q. Liao, Z. Zhang, J. Am. Chem. Soc. 142 (2020) 4298–4308. [164] Z. Li C. Li J. Chen X. Xing Y. Wang Y. Zhang M. Yang G. Zhang J. Energy Chem. 20 2022 18 26 Z. Li, C. Li, J. Chen, X. Xing, Y. Wang, Y. Zhang, M. Yang, G. Zhang, J. Energy Chem. 20 (2022) 18–26. [165] S. Bolar S. Shit J.S. Kumar N.C. Murmu R.S. Ganesh H. Inokawa T. Kuila Appl. Catal. B 254 2019 432 442 S. Bolar, S. Shit, J.S. Kumar, N.C. Murmu, R.S. Ganesh, H. Inokawa, T. Kuila, Appl. Catal., B. 254 (2019) 432–442. [166] H. Zhang L. Yu T. Chen W. Zhou X.W. Lou Adv. Functional Mater. 28 2018 1807086 H. Zhang, L. Yu, T. Chen, W. Zhou, X.W. Lou, Adv. Functional Mater. 28 (2018) 1807086. [167] S. Deng M. Luo C. Ai Y. Zhang B. Liu L. Huang Z. Jiang Q. Zhang L. Gu S. Lin Angew. Chem. Int. Ed. 58 2019 16289 16296 S. Deng, M. Luo, C. Ai, Y. Zhang, B. Liu, L. Huang, Z. Jiang, Q. Zhang, L. Gu, S. Lin, Angewandte Chemie International Edition. 58 (2019) 16289–16296. [168] Y. Guo X. Zhang X. Zhang T. You J. Mater. Chem. A 3 2015 15927 15934 Y. Guo, X. Zhang, X. Zhang, T. You, J. Mater. Chem. A. 3 (2015) 15927–15934. [169] X. Ren Q. Ma H. Fan L. Pang Y. Zhang Y. Yao X. Ren S.F. Liu Chem. Commun. 51 2015 15997 16000 X. Ren, Q. Ma, H. Fan, L. Pang, Y. Zhang, Y. Yao, X. Ren, S.F. Liu, Chem. Commun. 51 (2015) 15997–16000. [170] R. Li L. Yang T. Xiong Y. Wu L. Cao D. Yuan W. Zhou J. Power Sources 356 2017 133 139 R. Li, L. Yang, T. Xiong, Y. Wu, L. Cao, D. Yuan, W. Zhou, J. Power Sources. 356 (2017) 133–139. [171] K. Guruprasad T. Maiyalagan S. Shanmugam ACS Appl. Energy Mater. 2 2019 6184 6194 K. Guruprasad, T. Maiyalagan, S. Shanmugam, ACS Appl. Energy Mater. 2 (2019) 6184–6194. [172] A. Chen Y. He R. Cui J. Zhang Y. Pu J. Yang X.A. Li Mater. Lett. 233 2018 246 249 A. Chen, Y. He, R. Cui, J. Zhang, Y. Pu, J. Yang, X.a. Li, Mater. Lett. 233 (2018) 246–249. [173] X. Meng C. Ma L. Jiang R. Si X. Meng Y. Tu L. Yu X. Bao D. Deng Angew. Chem. 132 2020 10588 10593 X. Meng, C. Ma, L. Jiang, R. Si, X. Meng, Y. Tu, L. Yu, X. Bao, D. Deng, Angewandte Chemie. 132 (2020) 10588–10593. [174] Z. Zheng L. Yu M. Gao X. Chen W. Zhou C. Ma L. Wu J. Zhu X. Meng J. Hu Nat. Commun. 11 2020 1 10 Z. Zheng, L. Yu, M. Gao, X. Chen, W. Zhou, C. Ma, L. Wu, J. Zhu, X. Meng, J. Hu, Nature Commun. 11 (2020) 1–10. [175] Y. Shi Y. Zhou D.-R. Yang W.-X. Xu C. Wang F.-B. Wang J.-J. Xu X.-H. Xia H.-Y. Chen J. Am. Chem. Soc. 139 2017 15479 15485 Y. Shi, Y. Zhou, D.-R. Yang, W.-X. Xu, C. Wang, F.-B. Wang, J.-J. Xu, X.-H. Xia, H.-Y. Chen, J. Am. Chem. Soc. 139 (2017) 15479–15485. [176] H. Li C. Tsai A.L. Koh L. Cai A.W. Contryman A.H. Fragapane J. Zhao H.S. Han H.C. Manoharan F. Abild-Pedersen Nat. Mater. 15 2016 48 53 H. Li, C. Tsai, A.L. Koh, L. Cai, A.W. Contryman, A.H. Fragapane, J. Zhao, H.S. Han, H.C. Manoharan, F. Abild-Pedersen, Nat. Mater. 15 (2016) 48–53. [177] Y. Li K. Yin L.L. Wang X.L. Lu Y.Q. Zhang Y.T. Liu D.F. Yan Y.Z. Song S.L. Luo Appl. Catal. B 239 2018 537 544 Y. Li, K. Yin, L.L. Wang, X.L. Lu, Y.Q. Zhang, Y.T. Liu, D.F. Yan, Y.Z. Song, S.L. Luo, Appl. Catal., B. 239 (2018) 537–544. [178] J. Xie H. Qu J. Xin X. Zhang G. Cui X. Zhang J. Bao B. Tang Y. Xie Nano Res. 10 2017 1178 1188 J. Xie, H. Qu, J. Xin, X. Zhang, G. Cui, X. Zhang, J. Bao, B. Tang, Y. Xie, Nano Research. 10 (2017) 1178–1188. [179] W. Wu C. Niu C. Wei Y. Jia C. Li Q. Xu Angew. Chem. Int. Ed. 58 2019 2029 2033 W. Wu, C. Niu, C. Wei, Y. Jia, C. Li, Q. Xu, Angewandte Chemie International Edition. 58 (2019) 2029–2033. [180] X.X. Han X.L. Tong X.C. Liu A. Chen X.D. Wen N.J. Yang X.Y. Guo ACS Catal. 8 2018 1828 1836 X.X. Han, X.L. Tong, X.C. Liu, A. Chen, X.D. Wen, N.J. Yang, X.Y. Guo, ACS Catal. 8 (2018) 1828–1836. [181] R.Y. Ge W.X. Li J.J. Huo T. Liao N.Y. Cheng Y. Du M.Y. Zhu Y. Li J.J. Zhang Appl. Catal. B 246 2019 129 139 R.Y. Ge, W.X. Li, J.J. Huo, T. Liao, N.Y. Cheng, Y. Du, M.Y. Zhu, Y. Li, J.J. Zhang, Appl. Catal., B. 246 (2019) 129–139. [182] J.H. Feng H. Zhou D.Y. Chen T. Bian A.H. Yuan Electrochim. Acta 331 2020 135445 J.H. Feng, H. Zhou, D.Y. Chen, T. Bian, A.H. Yuan, Electrochim. Acta. 331 (2020) 135445. [183] Y. Li M.B. Majewski S.M. Islam S. Hao A.A. Murthy J.G. DiStefano E.D. Hanson Y. Xu C. Wolverton M.G. Kanatzidis M.R. Wasielewski X. Chen V.P. Dravid Nano Lett. 18 2018 7104 7110 Y. Li, M.B. Majewski, S.M. Islam, S. Hao, A.A. Murthy, J.G. DiStefano, E.D. Hanson, Y. Xu, C. Wolverton, M.G. Kanatzidis, M.R. Wasielewski, X. Chen, V.P. Dravid, Nano Lett. 18 (2018) 7104–7110. [184] K.A. Sun Y.Q. Liu Y. Pan H.Y. Zhu J.C. Zhao L.Y. Zeng Z. Liu C.G. Liu Nano Res. 11 2018 4368 4379 K.A. Sun, Y.Q. Liu, Y. Pan, H.Y. Zhu, J.C. Zhao, L.Y. Zeng, Z. Liu, C.G. Liu, Nano Res. 11 (2018) 4368–4379. [185] C. Zhang Y. Luo J. Tan Q. Yu F. Yang Z. Zhang L. Yang H.M. Cheng B. Liu Nat. Commun. 11 2020 3724 C. Zhang, Y. Luo, J. Tan, Q. Yu, F. Yang, Z. Zhang, L. Yang, H.M. Cheng, B. Liu, Nat Commun. 11 (2020) 3724. [186] J. Hu C.X. Zhang L. Jiang H. Lin Y.M. An D. Zhou M.K.H. Leung S.H. Yang Joule 1 2017 383 393 J. Hu, C.X. Zhang, L. Jiang, H. Lin, Y.M. An, D. Zhou, M.K.H. Leung, S.H. Yang, Joule. 1 (2017) 383–393. [187] Y.X. Wei Y.L. Lv B.D. Guo J.R. Gong J. Energy Chem. 57 2021 587 592 Y.X. Wei, Y.L. Lv, B.D. Guo, J.R. Gong, J. Energy Chem. 57 (2021) 587–592. [188] J. Hu C.X. Zhang Y.Z. Zhang B.M. Yang Q.L. Qi M.Z. Sun F.T. Zi M.K.H. Leung B.L. Huang Small 16 2020 2002212 J. Hu, C.X. Zhang, Y.Z. Zhang, B.M. Yang, Q.L. Qi, M.Z. Sun, F.T. Zi, M.K.H. Leung, B.L. Huang, Small. 16 (2020) 2002212. [189] A.P. Wu Y. Gu Y. Xie C.G. Tian H.J. Yan D.X. Wang X.M. Zhang Z.C. Cai H.G. Fu ACS Appl. Mater. Interfaces 11 2019 25986 25995 A.P. Wu, Y. Gu, Y. Xie, C.G. Tian, H.J. Yan, D.X. Wang, X.M. Zhang, Z.C. Cai, H.G. Fu, ACS Appl. Mater. Interfaces. 11 (2019) 25986–25995. [190] D. Vikraman S. Hussain K. Akbar L. Truong A. Kathalingam S.-H. Chun J. Jung H.J. Park H.-S. Kim ACS Sustain. Chem. Eng. 6 2018 8400 8409 D. Vikraman, S. Hussain, K. Akbar, L. Truong, A. Kathalingam, S.-H. Chun, J. Jung, H.J. Park, H.-S. Kim, ACS Sustainable Chem. Eng. 6 (2018) 8400–8409. [191] L. Ma L. Jiang X. Li P. Zuo C.Y. Xu Z.H. Cheng M.Y. Tian Y.J. Yuan X.Q. Zhang Y.B. Lu Y. Zhao L.T. Qu Chem. Eng. J. 445 2022 136618 L. Ma, L. Jiang, X. Li, P. Zuo, C.Y. Xu, Z.H. Cheng, M.Y. Tian, Y.J. Yuan, X.Q. Zhang, Y.B. Lu, Y. Zhao, L.T. Qu, Chem. Eng. J. 445 (2022) 136618. [192] G.W. Li J. Huang Q. Yang L.G. Zhang Q.G. Mu Y. Sun S. Parkin K. Chang C. Felser J. Energy Chem. 62 2021 516 522 G.W. Li, J. Huang, Q. Yang, L.G. Zhang, Q.G. Mu, Y. Sun, S. Parkin, K. Chang, C. Felser, J. Energy Chem. 62 (2021) 516–522. [193] Y.J. Li W.Y. Wang B.J. Huang Z.F. Mao R. Wang B.B. He Y.S. Gong H.W. Wang J. Energy Chem. 57 2021 99 108 Y.J. Li, W.Y. Wang, B.J. Huang, Z.F. Mao, R. Wang, B.B. He, Y.S. Gong, H.W. Wang, J. Energy Chem. 57 (2021) 99–108. [194] Q.S. Zhou J.R. Feng X.W. Peng L.X. Zhong R.C. Sun J. Energy Chem. 45 2020 45 51 Q.S. Zhou, J.R. Feng, X.W. Peng, L.X. Zhong, R.C. Sun, J. Energy Chem. 45 (2020) 45–51. [195] T.-T. Chen R. Wang L.-K. Li Z.-J. Li S.-Q. Zang J. Energy Chem. 44 2020 90 96 T.-T. Chen, R. Wang, L.-K. Li, Z.-J. Li, S.-Q. Zang, J. Energy Chem. 44 (2020) 90–96. [196] K. Qi X. Cui L. Gu S. Yu X. Fan M. Luo S. Xu N. Li L. Zheng Q. Zhang J. Ma Y. Gong F. Lv K. Wang H. Huang W. Zhang S. Guo W. Zheng P. Liu Nat. Commun. 10 2019 5231 K. Qi, X. Cui, L. Gu, S. Yu, X. Fan, M. Luo, S. Xu, N. Li, L. Zheng, Q. Zhang, J. Ma, Y. Gong, F. Lv, K. Wang, H. Huang, W. Zhang, S. Guo, W. Zheng, P. Liu, Nat. Commun. 10 (2019) 5231. [197] Y. Wang J. Mao X. Meng L. Yu D. Deng X. Bao Chem. Rev. 119 2019 1806 1854 Y. Wang, J. Mao, X. Meng, L. Yu, D. Deng, X. Bao, Chem. Rev. 119 (2019) 1806–1854. [198] A. Hasani Q.V. Le M. Tekalgne M.-J. Choi T.H. Lee H.W. Jang S.Y. Kim NPG Asia Mater. 11 2019 47 A. Hasani, Q.V. Le, M. Tekalgne, M.-J. Choi, T.H. Lee, H.W. Jang, S.Y. Kim, NPG Asia Mater. 11 (2019) 47. [199] L.L. Wang X. Liu J.M. Luo X.D. Duan J. Crittenden C.B. Liu S.Q. Zhang Y. Pei Y.X. Zeng X.F. Duan Angew. Chem. Int. Ed. 56 2017 7610 7614 L.L. Wang, X. Liu, J.M. Luo, X.D. Duan, J. Crittenden, C.B. Liu, S.Q. Zhang, Y. Pei, Y.X. Zeng, X.F. Duan, Angew. Chem. Int. Ed. 56 (2017) 7610–7614. [200] Y. Huang Y. Sun X. Zheng T. Aoki B. Pattengale J. Huang X. He W. Bian S. Younan N. Williams J. Hu J. Ge N. Pu X. Yan X. Pan L. Zhang Y. Wei J. Gu Nat. Commun. 10 2019 982 Y. Huang, Y. Sun, X. Zheng, T. Aoki, B. Pattengale, J. Huang, X. He, W. Bian, S. Younan, N. Williams, J. Hu, J. Ge, N. Pu, X. Yan, X. Pan, L. Zhang, Y. Wei, J. Gu, Nat. Commun. 10 (2019) 982. [201] Q. Liu X. Li Q. He A. Khalil D. Liu T. Xiang X. Wu L. Song Small 11 2015 5556 5564 Q. Liu, X. Li, Q. He, A. Khalil, D. Liu, T. Xiang, X. Wu, L. Song, Small. 11 (2015) 5556–5564. [202] J. Zheng H. Zhang S. Dong Y. Liu C.T. Nai H.S. Shin H.Y. Jeong B. Liu K.P. Loh Nat. Commun. 5 2014 2995 J. Zheng, H. Zhang, S. Dong, Y. Liu, C.T. Nai, H.S. Shin, H.Y. Jeong, B. Liu, K.P. Loh, Nat. Commun. 5 (2014) 2995. [203] V.-T. Nguyen P.A. Le Y.-C. Hsu K.-H. Wei ACS Appl. Mater. Interfaces 12 2020 11533 11542 V.-T. Nguyen, P.A. Le, Y.-C. Hsu, K.-H. Wei, ACS Appl. Mater. Interfaces. 12 (2020) 11533–11542. [204] Y.Q. Zhang L. Tao C. Xie D.D. Wang Y.Q. Zou R. Chen Y.Y. Wang C.K. Jia S.Y. Wang Adv. Mater. 32 2020 1905923 Y.Q. Zhang, L. Tao, C. Xie, D.D. Wang, Y.Q. Zou, R. Chen, Y.Y. Wang, C.K. Jia, S.Y. Wang, Adv. Mater. 32 (2020) 1905923. [205] Y. Cheng J.H. Gong B. Cao X. Xu P. Jing S.-P. Feng R. Cheng B.C. Liu R. Gao J. Zhang J. Energy Chem. 68 2022 646 657 Y. Cheng, J.H. Gong, B. Cao, X. Xu, P. Jing, S.-P. Feng, R. Cheng, B.C. Liu, R. Gao, J. Zhang, J. Energy Chem. 68 (2022) 646–657. [206] L. Xu H.W. Liang Y. Yang S.H. Yu Chem. Rev. 118 2018 3209 3250 L. Xu, H.W. Liang, Y. Yang, S.H. Yu, Chem. Rev. 118 (2018) 3209–3250. [207] B. Yao J. Zhang X.L. Fan J.P. He Y. Li Small 15 2019 1803746 B. Yao, J. Zhang, X.L. Fan, J.P. He, Y. Li, Small. 15 (2019) 1803746. [208] S.Y. Xu H. Li J. Lee N. Clament Sagaya Selvam B.T. Kang J.Y. Lee P.J. Yoo J. Energy Chem. 69 2022 185 193 S.Y. Xu, H. Li, J. Lee, N. Clament Sagaya Selvam, B.T. Kang, J.Y. Lee, P.J. Yoo, J. Energy Chem. 69 (2022) 185–193. [209] W. Li D. Wang Y. Zhang L. Tao T. Wang Y. Zou Y. Wang R. Chen S. Wang Adv. Mater. 32 2020 e1907879 W. Li, D. Wang, Y. Zhang, L. Tao, T. Wang, Y. Zou, Y. Wang, R. Chen, S. Wang, Adv. Mater. 32 (2020) e1907879. [210] C. Xie D.F. Yan H. Li S.Q. Du W. Chen Y.Y. Wang Y.Q. Zou R. Chen S.Y. Wang ACS Catal. 10 2020 11082 11098 C. Xie, D.F. Yan, H. Li, S.Q. Du, W. Chen, Y.Y. Wang, Y.Q. Zou, R. Chen, S.Y. Wang, ACS Catal. 10 (2020) 11082–11098. [211] S. Bertolazzi S. Bonacchi G. Nan A. Pershin D. Beljonne P. Samori Adv. Mater. 29 2017 1606760 S. Bertolazzi, S. Bonacchi, G. Nan, A. Pershin, D. Beljonne, P. Samori, Adv. Mater. 29 (2017) 1606760. [212] S. Ji Y. Chen X. Wang Z. Zhang D. Wang Y. Li Chem. Rev. 120 2020 11900 11955 S. Ji, Y. Chen, X. Wang, Z. Zhang, D. Wang, Y. Li, Chem. Rev. 120 (2020) 11900–11955. [213] Y. Pan C. Zhang Z. Liu C. Chen Y.D. Li Matter 2 2020 78 110 Y. Pan, C. Zhang, Z. Liu, C. Chen, Y.D. Li, Matter. 2 (2020) 78–110. [214] J.L. Liu Z.Y. Wang J. Li L.J. Cao Z.G. Lu D.D. Zhu Small 16 2020 e1905738 J.L. Liu, Z.Y. Wang, J. Li, L.J. Cao, Z.G. Lu, D.D. Zhu, Small. 16 (2020) e1905738. [215] L. Li Z. Qin L. Ries S. Hong T. Michel J. Yang C. Salameh M. Bechelany P. Miele D. Kaplan M. Chhowalla D. Voiry ACS Nano. 13 2019 6824 6834 L. Li, Z. Qin, L. Ries, S. Hong, T. Michel, J. Yang, C. Salameh, M. Bechelany, P. Miele, D. Kaplan, M. Chhowalla, D. Voiry, ACS Nano. 13 (2019) 6824–6834. [216] X. Wang Y. Zhang H. Si Q. Zhang J. Wu L. Gao X. Wei Y. Sun Q. Liao Z. Zhang K. Ammarah L. Gu Z. Kang Y. Zhang J. Am. Chem. Soc. 142 2020 4298 4308 X. Wang, Y. Zhang, H. Si, Q. Zhang, J. Wu, L. Gao, X. Wei, Y. Sun, Q. Liao, Z. Zhang, K. Ammarah, L. Gu, Z. Kang, Y. Zhang, J. Am. Chem. Soc. 142 (2020) 4298–4308. [217] Z. Li C. Xiao S.J. Fan Y. Deng W.S. Zhang B.J. Ye Y. Xie J. Am. Chem. Soc. 137 2015 6587 6593 Z. Li, C. Xiao, S.J. Fan, Y. Deng, W.S. Zhang, B.J. Ye, Y. Xie, J. Am. Chem. Soc. 137 (2015) 6587–6593. [218] J.H. Hong Z.X. Hu M. Probert K. Li D.H. Lv X.A. Yang L. Gu N.N. Mao Q.L. Feng L.M. Xie J. Zhang D.Z. Wu Z.Y. Zhang C.H. Jin W. Ji X.X. Zhang J. Yuan Z. Zhang Nat. Commun. 6 2015 6293 J.H. Hong, Z.X. Hu, M. Probert, K. Li, D.H. Lv, X.A. Yang, L. Gu, N.N. Mao, Q.L. Feng, L.M. Xie, J. Zhang, D.Z. Wu, Z.Y. Zhang, C.H. Jin, W. Ji, X.X. Zhang, J. Yuan, Z. Zhang, Nat. Commun. 6 (2015) 6293. [219] F.Y. Zhang S.B. Xi G.M. Lin X.L. Hu X.W. Lou K. Xie Adv. Mater. 31 2019 1806552 F.Y. Zhang, S.B. Xi, G.M. Lin, X.L. Hu, X.W. Lou, K. Xie, Adv. Mater. 31 (2019) 1806552. [220] T. Ling T. Zhang B.H. Ge L.L. Han L.R. Zheng F. Lin Z.R. Xu W.B. Hu X.W. Du K. Davey S.Z. Qiao Adv. Mater. 31 2019 1807771 T. Ling, T. Zhang, B.H. Ge, L.L. Han, L.R. Zheng, F. Lin, Z.R. Xu, W.B. Hu, X.W. Du, K. Davey, S.Z. Qiao, Adv. Mater. 31 (2019) 1807771. [221] C. Tsai F. Abild-Pedersen J.K. Nørskov Nano Lett. 14 2014 1381 1387 C. Tsai, F. Abild-Pedersen, J.K. Nørskov, Nano Lett. 14 (2014) 1381–1387. [222] J. Deng H.B. Li J.P. Xiao Y.C. Tu D.H. Deng H.X. Yang H.F. Tian J.Q. Li P.J. Ren X.H. Bao Energy Environ. Sci. 8 2015 1594 1601 J. Deng, H.B. Li, J.P. Xiao, Y.C. Tu, D.H. Deng, H.X. Yang, H.F. Tian, J.Q. Li, P.J. Ren, X.H. Bao, Energy Environ. Sci. 8 (2015) 1594–1601. [223] H.T. Wang C. Tsai D.S. Kong K. Chan F. Abild-Pedersen J.K. Nørskov Y. Cui Nano Res. 8 2015 566 575 H.T. Wang, C. Tsai, D.S. Kong, K. Chan, F. Abild-Pedersen, J.K. Nørskov, Y. Cui, Nano Res. 8 (2015) 566–575. [224] X. Sun J. Dai Y.Q. Guo C.Z. Wu F.T. Hu J.Y. Zhao X.C. Zeng Y. Xie Nanoscale. 6 2014 8359 8367 X. Sun, J. Dai, Y.Q. Guo, C.Z. Wu, F.T. Hu, J.Y. Zhao, X.C. Zeng, Y. Xie, Nanoscale. 6 (2014) 8359–8367. [225] X.P. Dai K.L. Du Z.Z. Li M.Z. Liu Y.D. Ma H. Sun X. Zhang Y. Yang ACS Appl. Mater. Interfaces. 7 2015 27242 27253 X.P. Dai, K.L. Du, Z.Z. Li, M.Z. Liu, Y.D. Ma, H. Sun, X. Zhang, Y. Yang, ACS Appl. Mater. Interfaces. 7 (2015) 27242–27253. [226] L.Q. Wu X.B. Xu Y.Q. Zhao K.Y. Zhang Y. Sun T.T. Wang Y.Q. Wang W. Zhong Y.W. Du Appl. Surf. Sci. 425 2017 470 477 L.Q. Wu, X.B. Xu, Y.Q. Zhao, K.Y. Zhang, Y. Sun, T.T. Wang, Y.Q. Wang, W. Zhong, Y.W. Du, Appl. Surf. Sci. 425 (2017) 470–477. [227] K. Qi S.S. Yu Q.Y. Wang W. Zhang J.C. Fan W.T. Zheng X.Q. Cui J. Mater. Chem. A 4 2016 4025 4031 K. Qi, S.S. Yu, Q.Y. Wang, W. Zhang, J.C. Fan, W.T. Zheng, X.Q. Cui, J. Mater. Chem. A. 4 (2016) 4025–4031. [228] D. Merki H. Vrubel L. Rovelli S. Fierro X. Hu Chem. Sci. 3 2012 2515 2525 D. Merki, H. Vrubel, L. Rovelli, S. Fierro, X. Hu, Chem. Sci. 3 (2012) 2515–2525. [229] Z.G. Li C.L. Li J.W. Chen X. Xing Y.Q. Wang Y. Zhang M.S. Yang G.X. Zhang J. Energy Chem. 70 2022 18 26 Z.G. Li, C.L. Li, J.W. Chen, X. Xing, Y.Q. Wang, Y. Zhang, M.S. Yang, G.X. Zhang, J. Energy Chem. 70 (2022) 18–26. [230] A.S. Chen Y.N. He R.J. Cui J. Zhang Y. Pu J.P. Yang X.A. Li Mater. Lett. 233 2018 246 249 A.S. Chen, Y.N. He, R.J. Cui, J. Zhang, Y. Pu, J.P. Yang, X.A. Li, Mater. Lett. 233 (2018) 246–249. [231] J. Pető T. Ollár P. Vancsó Z.I. Popov G.Z. Magda G. Dobrik C. Hwang P.B. Sorokin L. Tapasztó Nat. Chem. 10 2018 1246 1251 J. Pető, T. Ollár, P. Vancsó, Z.I. Popov, G.Z. Magda, G. Dobrik, C. Hwang, P.B. Sorokin, L. Tapasztó, Nat. Chem. 10 (2018) 1246–1251. [232] S. Deng M. Luo C. Ai Y. Zhang B. Liu L. Huang Z. Jiang Q. Zhang L. Gu S. Lin X. Wang L. Yu J. Wen J. Wang G. Pan X. Xia J. Tu Angew. Chem. Int. Ed. 58 2019 16289 16296 S. Deng, M. Luo, C. Ai, Y. Zhang, B. Liu, L. Huang, Z. Jiang, Q. Zhang, L. Gu, S. Lin, X. Wang, L. Yu, J. Wen, J. Wang, G. Pan, X. Xia, J. Tu, Angew. Chem. Int. Ed. 58 (2019) 16289–16296. [233] A.P.S. Gaur B.W. Zhang Y.H. Lui X.H. Tang S. Hu Appl. Surf. Sci. 516 2020 146094 A.P.S. Gaur, B.W. Zhang, Y.H. Lui, X.H. Tang, S. Hu, Appl. Surf. Sci. 516 (2020) 146094. [234] T. Dong X. Zhang P. Wang H.-S. Chen P. Yang Electrochim. Acta 338 2020 135885 T. Dong, X. Zhang, P. Wang, H.-S. Chen, P. Yang, Electrochim. Acta. 338 (2020) 135885. [235] R.M. Ding M.C. Wang X.F. Wang H.X. Wang L.C. Wang Y.W. Mu B.L. Lv Nanoscale 11 2019 11217 11226 R.M. Ding, M.C. Wang, X.F. Wang, H.X. Wang, L.C. Wang, Y.W. Mu, B.L. Lv, Nanoscale. 11 (2019) 11217–11226. [236] X. Sun H.T. Deng W.G. Zhu Z. Yu C.Z. Wu Y. Xie Angew. Chem. Int. Ed. 55 2016 1704 1709 X. Sun, H.T. Deng, W.G. Zhu, Z. Yu, C.Z. Wu, Y. Xie, Angew. Chem. Int. Ed. 55 (2016) 1704–1709. [237] J.C. Li R.Y. Ge P.P. Lan J. Yang J. Feng Y. Li S. Li B. Liu W.X. Li J. Mater. Chem. A 10 2022 10493 10502 J.C. Li, R.Y. Ge, P.P. Lan, J. Yang, J. Feng, Y. Li, S. Li, B. Liu, W.X. Li, J. Mater. Chem. A. 10 (2022) 10493–10502. [238] C.X. Zhang L. Jiang Y.J. Zhang J. Hu M.K.H. Leung J. Catal. 361 2018 384 392 C.X. Zhang, L. Jiang, Y.J. Zhang, J. Hu, M.K.H. Leung, J. Catal. 361 (2018) 384–392. [239] J. Hu B.L. Huang C.X. Zhang Z.L. Wang Y.M. An D. Zhou H. Lin M.K.H. Leung S. Yang Energy Environ. Sci. 10 2017 593 603 J. Hu, B.L. Huang, C.X. Zhang, Z.L. Wang, Y.M. An, D. Zhou, H. Lin, M.K.H. Leung, S. Yang, Energy Environ. Sci. 10 (2017) 593–603. [240] W.X. Li Z.H. Guo J. Yang Y. Li X.L. Li H.Y. Sun S. He J.J.Z. Li Electrochem. Energy Rev. 2022 10.1007/s41918-022-00169-z W.X. Li, Z.H. Guo, J. Yang, Y. Li, Li, X.L. Sun, H.Y. He, S. Li, J.J. Zhang, Electrochem. Energy Rev., DOI: 10.1007/s41918-022-00169-z (2022). [241] Z.d. Lei, J. Zhan, L. Tang, Y. Zhang, Y. Wang, Adv. Energy Mater. 8 (2018) 1703482. Yao Xu got his BSc degree from Qingdao University of Science and Technology in June 2017. He is currently a Ph.D. candidate at Shanghai University, under the supervision of Prof. Wenxian Li. His research focuses on the design and synthesis of molybdenum based catalysts for their electrochemical hydrogen evolution reaction, oxygen evolution reaction, and overall water splitting. Riyue Ge received his Ph.D. degree from the School of Materials Science and Engineering at Shanghai University, China, under the supervision of Prof. Wenxian Li. He is currently a postdoctoral research fellow at Shanghai University. His research interests focus on the synthesis, and characterization of functional nanomaterials for photo/electrochemical applications, including hydrogen evolution reaction, oxygen evolution reaction, and overall water splitting. Jack Yang is currently a lecturer in the School of Materials Science and Engineering at The University of New South Wales, Australia. He received his BSc (2007) and Ph.D. (2011) from the same institute. Before returning to UNSW in 2017, he was a postdoctoral fellow in Westfälische Wilhelms-Universität Münster, Germany and the University of Southampton, UK. His current research focuses on theory and machine-learning-driven material studies on functional perovskites for electronic, photovoltaic, and energy-conversion applications. Jiancheng Li enrolled as a master’s and doctoral degree candidate at Shanghai University in 2018 and 2020, respectively. His research focuses on the design and synthesis of nanostructured materials and their applications for energy conversion. Sean Li received his Ph.D. degree from The University of Auckland in 1998. He was subsequently appointed as an assistant professor at Nanyang Technological University, Singapore, and then joined The University of New South Wales in 2004. He is currently a director of UNSW Materials and Manufacturing Futures Institute. His research interest focuses on advanced functional complex oxides and their heterostructures. Ying Li is a Professor at the School for Materials Science and Engineering, Shanghai University. She received her Ph.D. from the National Chungnam University in 2001. She was a postdoctoral fellow at the Research Materials Research Center of Chungnam National University, South Korea, and National Chungnam University, South Korea from March 2001 to December 2002 and then joined Shanghai University as a professor. Her research activities include material chemistry, such as conductive molecules, conductive materials, and energy materials. Dr. Jiujun Zhang is a Professor in College at Shanghai University, and a former Principal Research Officer at the National Research Council of Canada (NRC). Dr. Zhang is a Fellow of the Canadian Academy of Engineering (CAE), Fellow of The Academy of Science of The Royal Society of Canada (FRSCCA), Fellow of The Engineering Institute of Canada (EIC), Fellow of the International Society of Electrochemistry (ISE), and Fellow of the Royal Society of Chemistry (RSC-UK). Dr. Zhang received his B.S. and M.Sc. in Electrochemistry from Peking University in 1982 and 1985, respectively, and his Ph.D. in Electrochemistry from Wuhan University in 1988. Dr. Zhang’s main research areas are Electrochemistry, Electrocatalysts, Fuel cells, Lithium batteries, Metal-air batteries, Supercapacitors, and H2O/CO2/N2 electrolysis. Jing Feng is a professor at Kunming University of Science and Technology. He received his Ph.D. degree from the Tsinghua University & Kunming University of Science and Technology. He worked at Harvard University and researched high-temperature thermal barrier coatings. His current research involves the use of MGI to explore high-temperature ceramics (rare earth Tantanlate, RE-Ta-O system) and bonding coating alloys. Bin Liu is a professor at Shanghai University. He received his Ph.D. degree from the Institute of Metal Research, Chinese Academy of Sciences. His current research involves the use of various modelling and simulation techniques to explore the structure-function relationship of high-temperature ceramics. Wenxian Li is a Professor at the School for Materials Science and Engineering, Shanghai University. Dr. Li received his Ph.D. from the University of Wollongong, Australia, in 2010. He got the Australian Postdoctoral Fellowship (Industrial) supported by the Australian Research Council in 2012 and then got financial support from the Australian Renewable Energy Agency as a Postdoctoral Fellowship. He joined the University of Western Sydney as a lecturer in the Solar Energy Technologies Group in November 2012. His research focuses on the electron configuration modulation induced performance optimization of function materials for renewable energy utilization.",
      "scopus-id": "85135347592",
      "coredata": {
        "eid": "1-s2.0-S2095495622003382",
        "dc:description": "Molybdenum disulfide (MoS2)-based materials as the non-noble metal catalysts have displayed the potential capability to drive electrocatalytic hydrogen evolution reaction (HER) for green hydrogen production along with their intrinsic activity, tunable electronic properties, low cost, and abundance reserves, which have attracted intensive attention as alternatives to the low-abundance and high-cost platinum-based catalysts. However, their insufficient catalytic HER activities and stability are the major challenges for them to become practically applicable. Hereby, the MoS2-based electrocatalysts for HER are comprehensively reviewed to explain the fundamental science behind the manipulations of the crystal structure, microstructure, surface, and interface of MoS2 in order to enhance its catalytic performance through changing the electrical conductivity, the number of active sites, surface wettability, and the Gibbs free energy for hydrogen adsorption (ΔG H). Recent studies in surface/interface engineering, such as phase engineering, defect engineering, morphology design, and heterostructure construction, are analyzed to reveal the state-of-the-art strategies for designing and preparing the cost-effective and high-performance MoS2-based catalysts through optimizing the charge transfer, surface-active sites, ΔG H, and surface hydrophilicity. Lastly, the perspectives, challenges, and future research directions of HER electrocatalysis are also given to facilitate the further research and development of HER catalysts.",
        "openArchiveArticle": "false",
        "prism:coverDate": "2022-11-30",
        "openaccessUserLicense": null,
        "prism:aggregationType": "Journal",
        "prism:url": "https://api.elsevier.com/content/article/pii/S2095495622003382",
        "dc:creator": [
          {
            "@_fa": "true",
            "$": "Xu, Yao"
          },
          {
            "@_fa": "true",
            "$": "Ge, Riyue"
          },
          {
            "@_fa": "true",
            "$": "Yang, Jack"
          },
          {
            "@_fa": "true",
            "$": "Li, Jiancheng"
          },
          {
            "@_fa": "true",
            "$": "Li, Sean"
          },
          {
            "@_fa": "true",
            "$": "Li, Ying"
          },
          {
            "@_fa": "true",
            "$": "Zhang, Jiujun"
          },
          {
            "@_fa": "true",
            "$": "Feng, Jing"
          },
          {
            "@_fa": "true",
            "$": "Liu, Bin"
          },
          {
            "@_fa": "true",
            "$": "Li, Wenxian"
          }
        ],
        "link": [
          {
            "@_fa": "true",
            "@rel": "self",
            "@href": "https://api.elsevier.com/content/article/pii/S2095495622003382"
          },
          {
            "@_fa": "true",
            "@rel": "scidir",
            "@href": "https://www.sciencedirect.com/science/article/pii/S2095495622003382"
          }
        ],
        "dc:format": "application/json",
        "openaccessType": null,
        "pii": "S2095-4956(22)00338-2",
        "prism:volume": "74",
        "prism:publisher": "Science Press and Dalian Institute of Chemical Physics, Chinese Academy of Sciences. Published by ELSEVIER B.V. and Science Press.",
        "dc:title": "Molybdenum disulfide (MoS2)-based electrocatalysts for hydrogen evolution reaction: From mechanism to manipulation",
        "prism:copyright": "© 2022 Science Press and Dalian Institute of Chemical Physics, Chinese Academy of Sciences. Published by ELSEVIER B.V. and Science Press. All rights reserved.",
        "openaccess": "0",
        "prism:issn": "20954956",
        "dcterms:subject": [
          {
            "@_fa": "true",
            "$": "Surface/interface engineering"
          },
          {
            "@_fa": "true",
            "$": "Hydrogen evolution reaction"
          },
          {
            "@_fa": "true",
            "$": "Molybdenum disulfide"
          },
          {
            "@_fa": "true",
            "$": "Mechanisms"
          }
        ],
        "openaccessArticle": "false",
        "prism:publicationName": "Journal of Energy Chemistry",
        "openaccessSponsorType": null,
        "prism:pageRange": "45-71",
        "prism:endingPage": "71",
        "pubType": "rev",
        "prism:coverDisplayDate": "November 2022",
        "prism:doi": "10.1016/j.jechem.2022.06.031",
        "prism:startingPage": "45",
        "dc:identifier": "doi:10.1016/j.jechem.2022.06.031",
        "openaccessSponsorName": null
      },
      "objects": {
        "object": [
          {
            "@category": "standard",
            "@height": "155",
            "@width": "111",
            "@_fa": "true",
            "$": "https://api.elsevier.com/content/object/eid/1-s2.0-S2095495622003382-fx1.jpg?httpAccept=%2A%2F%2A",
            "@multimediatype": "JPEG image file",
            "@type": "IMAGE-DOWNSAMPLED",
            "@size": "5870",
            "@ref": "fx1",
            "@mimetype": "image/jpeg"
          },
          {
            "@category": "standard",
            "@height": "155",
            "@width": "111",
            "@_fa": "true",
            "$": "https://api.elsevier.com/content/object/eid/1-s2.0-S2095495622003382-fx10.jpg?httpAccept=%2A%2F%2A",
            "@multimediatype": "JPEG image file",
            "@type": "IMAGE-DOWNSAMPLED",
            "@size": "6238",
            "@ref": "fx10",
            "@mimetype": "image/jpeg"
          },
          {
            "@category": "standard",
            "@height": "155",
            "@width": "111",
            "@_fa": "true",
            "$": "https://api.elsevier.com/content/object/eid/1-s2.0-S2095495622003382-fx2.jpg?httpAccept=%2A%2F%2A",
            "@multimediatype": "JPEG image file",
            "@type": "IMAGE-DOWNSAMPLED",
            "@size": "4740",
            "@ref": "fx2",
            "@mimetype": "image/jpeg"
          },
          {
            "@category": "standard",
            "@height": "155",
            "@width": "111",
            "@_fa": "true",
            "$": "https://api.elsevier.com/content/object/eid/1-s2.0-S2095495622003382-fx3.jpg?httpAccept=%2A%2F%2A",
            "@multimediatype": "JPEG image file",
            "@type": "IMAGE-DOWNSAMPLED",
            "@size": "9171",
            "@ref": "fx3",
            "@mimetype": "image/jpeg"
          },
          {
            "@category": "standard",
            "@height": "155",
            "@width": "111",
            "@_fa": "true",
            "$": "https://api.elsevier.com/content/object/eid/1-s2.0-S2095495622003382-fx4.jpg?httpAccept=%2A%2F%2A",
            "@multimediatype": "JPEG image file",
            "@type": "IMAGE-DOWNSAMPLED",
            "@size": "6416",
            "@ref": "fx4",
            "@mimetype": "image/jpeg"
          },
          {
            "@category": "standard",
            "@height": "155",
            "@width": "111",
            "@_fa": "true",
            "$": "https://api.elsevier.com/content/object/eid/1-s2.0-S2095495622003382-fx5.jpg?httpAccept=%2A%2F%2A",
            "@multimediatype": "JPEG image file",
            "@type": "IMAGE-DOWNSAMPLED",
            "@size": "8044",
            "@ref": "fx5",
            "@mimetype": "image/jpeg"
          },
          {
            "@category": "standard",
            "@height": "155",
            "@width": "111",
            "@_fa": "true",
            "$": "https://api.elsevier.com/content/object/eid/1-s2.0-S2095495622003382-fx6.jpg?httpAccept=%2A%2F%2A",
            "@multimediatype": "JPEG image file",
            "@type": "IMAGE-DOWNSAMPLED",
            "@size": "5833",
            "@ref": "fx6",
            "@mimetype": "image/jpeg"
          },
          {
            "@category": "standard",
            "@height": "155",
            "@width": "111",
            "@_fa": "true",
            "$": "https://api.elsevier.com/content/object/eid/1-s2.0-S2095495622003382-fx7.jpg?httpAccept=%2A%2F%2A",
            "@multimediatype": "JPEG image file",
            "@type": "IMAGE-DOWNSAMPLED",
            "@size": "6763",
            "@ref": "fx7",
            "@mimetype": "image/jpeg"
          },
          {
            "@category": "standard",
            "@height": "155",
            "@width": "111",
            "@_fa": "true",
            "$": "https://api.elsevier.com/content/object/eid/1-s2.0-S2095495622003382-fx8.jpg?httpAccept=%2A%2F%2A",
            "@multimediatype": "JPEG image file",
            "@type": "IMAGE-DOWNSAMPLED",
            "@size": "5917",
            "@ref": "fx8",
            "@mimetype": "image/jpeg"
          },
          {
            "@category": "standard",
            "@height": "155",
            "@width": "111",
            "@_fa": "true",
            "$": "https://api.elsevier.com/content/object/eid/1-s2.0-S2095495622003382-fx9.jpg?httpAccept=%2A%2F%2A",
            "@multimediatype": "JPEG image file",
            "@type": "IMAGE-DOWNSAMPLED",
            "@size": "5970",
            "@ref": "fx9",
            "@mimetype": "image/jpeg"
          },
          {
            "@category": "standard",
            "@height": "200",
            "@width": "419",
            "@_fa": "true",
            "$": "https://api.elsevier.com/content/object/eid/1-s2.0-S2095495622003382-ga1.jpg?httpAccept=%2A%2F%2A",
            "@multimediatype": "JPEG image file",
            "@type": "IMAGE-DOWNSAMPLED",
            "@size": "35802",
            "@ref": "ga1",
            "@mimetype": "image/jpeg"
          },
          {
            "@category": "standard",
            "@height": "382",
            "@width": "382",
            "@_fa": "true",
            "$": "https://api.elsevier.com/content/object/eid/1-s2.0-S2095495622003382-gr1.jpg?httpAccept=%2A%2F%2A",
            "@multimediatype": "JPEG image file",
            "@type": "IMAGE-DOWNSAMPLED",
            "@size": "70196",
            "@ref": "gr1",
            "@mimetype": "image/jpeg"
          },
          {
            "@category": "standard",
            "@height": "699",
            "@width": "687",
            "@_fa": "true",
            "$": "https://api.elsevier.com/content/object/eid/1-s2.0-S2095495622003382-gr10.jpg?httpAccept=%2A%2F%2A",
            "@multimediatype": "JPEG image file",
            "@type": "IMAGE-DOWNSAMPLED",
            "@size": "162834",
            "@ref": "gr10",
            "@mimetype": "image/jpeg"
          },
          {
            "@category": "standard",
            "@height": "527",
            "@width": "639",
            "@_fa": "true",
            "$": "https://api.elsevier.com/content/object/eid/1-s2.0-S2095495622003382-gr11.jpg?httpAccept=%2A%2F%2A",
            "@multimediatype": "JPEG image file",
            "@type": "IMAGE-DOWNSAMPLED",
            "@size": "137666",
            "@ref": "gr11",
            "@mimetype": "image/jpeg"
          },
          {
            "@category": "standard",
            "@height": "671",
            "@width": "623",
            "@_fa": "true",
            "$": "https://api.elsevier.com/content/object/eid/1-s2.0-S2095495622003382-gr12.jpg?httpAccept=%2A%2F%2A",
            "@multimediatype": "JPEG image file",
            "@type": "IMAGE-DOWNSAMPLED",
            "@size": "149034",
            "@ref": "gr12",
            "@mimetype": "image/jpeg"
          },
          {
            "@category": "standard",
            "@height": "605",
            "@width": "674",
            "@_fa": "true",
            "$": "https://api.elsevier.com/content/object/eid/1-s2.0-S2095495622003382-gr13.jpg?httpAccept=%2A%2F%2A",
            "@multimediatype": "JPEG image file",
            "@type": "IMAGE-DOWNSAMPLED",
            "@size": "140723",
            "@ref": "gr13",
            "@mimetype": "image/jpeg"
          },
          {
            "@category": "standard",
            "@height": "874",
            "@width": "711",
            "@_fa": "true",
            "$": "https://api.elsevier.com/content/object/eid/1-s2.0-S2095495622003382-gr14.jpg?httpAccept=%2A%2F%2A",
            "@multimediatype": "JPEG image file",
            "@type": "IMAGE-DOWNSAMPLED",
            "@size": "201955",
            "@ref": "gr14",
            "@mimetype": "image/jpeg"
          },
          {
            "@category": "standard",
            "@height": "516",
            "@width": "800",
            "@_fa": "true",
            "$": "https://api.elsevier.com/content/object/eid/1-s2.0-S2095495622003382-gr15.jpg?httpAccept=%2A%2F%2A",
            "@multimediatype": "JPEG image file",
            "@type": "IMAGE-DOWNSAMPLED",
            "@size": "154373",
            "@ref": "gr15",
            "@mimetype": "image/jpeg"
          },
          {
            "@category": "standard",
            "@height": "922",
            "@width": "711",
            "@_fa": "true",
            "$": "https://api.elsevier.com/content/object/eid/1-s2.0-S2095495622003382-gr16.jpg?httpAccept=%2A%2F%2A",
            "@multimediatype": "JPEG image file",
            "@type": "IMAGE-DOWNSAMPLED",
            "@size": "217623",
            "@ref": "gr16",
            "@mimetype": "image/jpeg"
          },
          {
            "@category": "standard",
            "@height": "521",
            "@width": "533",
            "@_fa": "true",
            "$": "https://api.elsevier.com/content/object/eid/1-s2.0-S2095495622003382-gr17.jpg?httpAccept=%2A%2F%2A",
            "@multimediatype": "JPEG image file",
            "@type": "IMAGE-DOWNSAMPLED",
            "@size": "103379",
            "@ref": "gr17",
            "@mimetype": "image/jpeg"
          },
          {
            "@category": "standard",
            "@height": "655",
            "@width": "673",
            "@_fa": "true",
            "$": "https://api.elsevier.com/content/object/eid/1-s2.0-S2095495622003382-gr18.jpg?httpAccept=%2A%2F%2A",
            "@multimediatype": "JPEG image file",
            "@type": "IMAGE-DOWNSAMPLED",
            "@size": "118908",
            "@ref": "gr18",
            "@mimetype": "image/jpeg"
          },
          {
            "@category": "standard",
            "@height": "511",
            "@width": "687",
            "@_fa": "true",
            "$": "https://api.elsevier.com/content/object/eid/1-s2.0-S2095495622003382-gr2.jpg?httpAccept=%2A%2F%2A",
            "@multimediatype": "JPEG image file",
            "@type": "IMAGE-DOWNSAMPLED",
            "@size": "150306",
            "@ref": "gr2",
            "@mimetype": "image/jpeg"
          },
          {
            "@category": "standard",
            "@height": "441",
            "@width": "533",
            "@_fa": "true",
            "$": "https://api.elsevier.com/content/object/eid/1-s2.0-S2095495622003382-gr3.jpg?httpAccept=%2A%2F%2A",
            "@multimediatype": "JPEG image file",
            "@type": "IMAGE-DOWNSAMPLED",
            "@size": "55590",
            "@ref": "gr3",
            "@mimetype": "image/jpeg"
          },
          {
            "@category": "standard",
            "@height": "463",
            "@width": "534",
            "@_fa": "true",
            "$": "https://api.elsevier.com/content/object/eid/1-s2.0-S2095495622003382-gr4.jpg?httpAccept=%2A%2F%2A",
            "@multimediatype": "JPEG image file",
            "@type": "IMAGE-DOWNSAMPLED",
            "@size": "73027",
            "@ref": "gr4",
            "@mimetype": "image/jpeg"
          },
          {
            "@category": "standard",
            "@height": "859",
            "@width": "534",
            "@_fa": "true",
            "$": "https://api.elsevier.com/content/object/eid/1-s2.0-S2095495622003382-gr5.jpg?httpAccept=%2A%2F%2A",
            "@multimediatype": "JPEG image file",
            "@type": "IMAGE-DOWNSAMPLED",
            "@size": "116794",
            "@ref": "gr5",
            "@mimetype": "image/jpeg"
          },
          {
            "@category": "standard",
            "@height": "742",
            "@width": "646",
            "@_fa": "true",
            "$": "https://api.elsevier.com/content/object/eid/1-s2.0-S2095495622003382-gr6.jpg?httpAccept=%2A%2F%2A",
            "@multimediatype": "JPEG image file",
            "@type": "IMAGE-DOWNSAMPLED",
            "@size": "185882",
            "@ref": "gr6",
            "@mimetype": "image/jpeg"
          },
          {
            "@category": "standard",
            "@height": "349",
            "@width": "533",
            "@_fa": "true",
            "$": "https://api.elsevier.com/content/object/eid/1-s2.0-S2095495622003382-gr7.jpg?httpAccept=%2A%2F%2A",
            "@multimediatype": "JPEG image file",
            "@type": "IMAGE-DOWNSAMPLED",
            "@size": "65517",
            "@ref": "gr7",
            "@mimetype": "image/jpeg"
          },
          {
            "@category": "standard",
            "@height": "837",
            "@width": "800",
            "@_fa": "true",
            "$": "https://api.elsevier.com/content/object/eid/1-s2.0-S2095495622003382-gr8.jpg?httpAccept=%2A%2F%2A",
            "@multimediatype": "JPEG image file",
            "@type": "IMAGE-DOWNSAMPLED",
            "@size": "258507",
            "@ref": "gr8",
            "@mimetype": "image/jpeg"
          },
          {
            "@category": "standard",
            "@height": "253",
            "@width": "382",
            "@_fa": "true",
            "$": "https://api.elsevier.com/content/object/eid/1-s2.0-S2095495622003382-gr9.jpg?httpAccept=%2A%2F%2A",
            "@multimediatype": "JPEG image file",
            "@type": "IMAGE-DOWNSAMPLED",
            "@size": "38212",
            "@ref": "gr9",
            "@mimetype": "image/jpeg"
          },
          {
            "@category": "thumbnail",
            "@height": "164",
            "@width": "117",
            "@_fa": "true",
            "$": "https://api.elsevier.com/content/object/eid/1-s2.0-S2095495622003382-fx1.sml?httpAccept=%2A%2F%2A",
            "@multimediatype": "GIF image file",
            "@type": "IMAGE-THUMBNAIL",
            "@size": "12981",
            "@ref": "fx1",
            "@mimetype": "image/gif"
          },
          {
            "@category": "thumbnail",
            "@height": "164",
            "@width": "117",
            "@_fa": "true",
            "$": "https://api.elsevier.com/content/object/eid/1-s2.0-S2095495622003382-fx10.sml?httpAccept=%2A%2F%2A",
            "@multimediatype": "GIF image file",
            "@type": "IMAGE-THUMBNAIL",
            "@size": "13600",
            "@ref": "fx10",
            "@mimetype": "image/gif"
          },
          {
            "@category": "thumbnail",
            "@height": "164",
            "@width": "117",
            "@_fa": "true",
            "$": "https://api.elsevier.com/content/object/eid/1-s2.0-S2095495622003382-fx2.sml?httpAccept=%2A%2F%2A",
            "@multimediatype": "GIF image file",
            "@type": "IMAGE-THUMBNAIL",
            "@size": "15047",
            "@ref": "fx2",
            "@mimetype": "image/gif"
          },
          {
            "@category": "thumbnail",
            "@height": "164",
            "@width": "117",
            "@_fa": "true",
            "$": "https://api.elsevier.com/content/object/eid/1-s2.0-S2095495622003382-fx3.sml?httpAccept=%2A%2F%2A",
            "@multimediatype": "GIF image file",
            "@type": "IMAGE-THUMBNAIL",
            "@size": "18335",
            "@ref": "fx3",
            "@mimetype": "image/gif"
          },
          {
            "@category": "thumbnail",
            "@height": "164",
            "@width": "117",
            "@_fa": "true",
            "$": "https://api.elsevier.com/content/object/eid/1-s2.0-S2095495622003382-fx4.sml?httpAccept=%2A%2F%2A",
            "@multimediatype": "GIF image file",
            "@type": "IMAGE-THUMBNAIL",
            "@size": "12771",
            "@ref": "fx4",
            "@mimetype": "image/gif"
          },
          {
            "@category": "thumbnail",
            "@height": "164",
            "@width": "117",
            "@_fa": "true",
            "$": "https://api.elsevier.com/content/object/eid/1-s2.0-S2095495622003382-fx5.sml?httpAccept=%2A%2F%2A",
            "@multimediatype": "GIF image file",
            "@type": "IMAGE-THUMBNAIL",
            "@size": "16709",
            "@ref": "fx5",
            "@mimetype": "image/gif"
          },
          {
            "@category": "thumbnail",
            "@height": "164",
            "@width": "117",
            "@_fa": "true",
            "$": "https://api.elsevier.com/content/object/eid/1-s2.0-S2095495622003382-fx6.sml?httpAccept=%2A%2F%2A",
            "@multimediatype": "GIF image file",
            "@type": "IMAGE-THUMBNAIL",
            "@size": "14953",
            "@ref": "fx6",
            "@mimetype": "image/gif"
          },
          {
            "@category": "thumbnail",
            "@height": "164",
            "@width": "117",
            "@_fa": "true",
            "$": "https://api.elsevier.com/content/object/eid/1-s2.0-S2095495622003382-fx7.sml?httpAccept=%2A%2F%2A",
            "@multimediatype": "GIF image file",
            "@type": "IMAGE-THUMBNAIL",
            "@size": "15492",
            "@ref": "fx7",
            "@mimetype": "image/gif"
          },
          {
            "@category": "thumbnail",
            "@height": "164",
            "@width": "117",
            "@_fa": "true",
            "$": "https://api.elsevier.com/content/object/eid/1-s2.0-S2095495622003382-fx8.sml?httpAccept=%2A%2F%2A",
            "@multimediatype": "GIF image file",
            "@type": "IMAGE-THUMBNAIL",
            "@size": "16100",
            "@ref": "fx8",
            "@mimetype": "image/gif"
          },
          {
            "@category": "thumbnail",
            "@height": "164",
            "@width": "117",
            "@_fa": "true",
            "$": "https://api.elsevier.com/content/object/eid/1-s2.0-S2095495622003382-fx9.sml?httpAccept=%2A%2F%2A",
            "@multimediatype": "GIF image file",
            "@type": "IMAGE-THUMBNAIL",
            "@size": "15423",
            "@ref": "fx9",
            "@mimetype": "image/gif"
          },
          {
            "@category": "thumbnail",
            "@height": "105",
            "@width": "219",
            "@_fa": "true",
            "$": "https://api.elsevier.com/content/object/eid/1-s2.0-S2095495622003382-ga1.sml?httpAccept=%2A%2F%2A",
            "@multimediatype": "GIF image file",
            "@type": "IMAGE-THUMBNAIL",
            "@size": "11816",
            "@ref": "ga1",
            "@mimetype": "image/gif"
          },
          {
            "@category": "thumbnail",
            "@height": "164",
            "@width": "164",
            "@_fa": "true",
            "$": "https://api.elsevier.com/content/object/eid/1-s2.0-S2095495622003382-gr1.sml?httpAccept=%2A%2F%2A",
            "@multimediatype": "GIF image file",
            "@type": "IMAGE-THUMBNAIL",
            "@size": "18822",
            "@ref": "gr1",
            "@mimetype": "image/gif"
          },
          {
            "@category": "thumbnail",
            "@height": "164",
            "@width": "161",
            "@_fa": "true",
            "$": "https://api.elsevier.com/content/object/eid/1-s2.0-S2095495622003382-gr10.sml?httpAccept=%2A%2F%2A",
            "@multimediatype": "GIF image file",
            "@type": "IMAGE-THUMBNAIL",
            "@size": "12705",
            "@ref": "gr10",
            "@mimetype": "image/gif"
          },
          {
            "@category": "thumbnail",
            "@height": "164",
            "@width": "199",
            "@_fa": "true",
            "$": "https://api.elsevier.com/content/object/eid/1-s2.0-S2095495622003382-gr11.sml?httpAccept=%2A%2F%2A",
            "@multimediatype": "GIF image file",
            "@type": "IMAGE-THUMBNAIL",
            "@size": "23886",
            "@ref": "gr11",
            "@mimetype": "image/gif"
          },
          {
            "@category": "thumbnail",
            "@height": "164",
            "@width": "152",
            "@_fa": "true",
            "$": "https://api.elsevier.com/content/object/eid/1-s2.0-S2095495622003382-gr12.sml?httpAccept=%2A%2F%2A",
            "@multimediatype": "GIF image file",
            "@type": "IMAGE-THUMBNAIL",
            "@size": "13611",
            "@ref": "gr12",
            "@mimetype": "image/gif"
          },
          {
            "@category": "thumbnail",
            "@height": "164",
            "@width": "183",
            "@_fa": "true",
            "$": "https://api.elsevier.com/content/object/eid/1-s2.0-S2095495622003382-gr13.sml?httpAccept=%2A%2F%2A",
            "@multimediatype": "GIF image file",
            "@type": "IMAGE-THUMBNAIL",
            "@size": "16577",
            "@ref": "gr13",
            "@mimetype": "image/gif"
          },
          {
            "@category": "thumbnail",
            "@height": "164",
            "@width": "133",
            "@_fa": "true",
            "$": "https://api.elsevier.com/content/object/eid/1-s2.0-S2095495622003382-gr14.sml?httpAccept=%2A%2F%2A",
            "@multimediatype": "GIF image file",
            "@type": "IMAGE-THUMBNAIL",
            "@size": "13987",
            "@ref": "gr14",
            "@mimetype": "image/gif"
          },
          {
            "@category": "thumbnail",
            "@height": "141",
            "@width": "219",
            "@_fa": "true",
            "$": "https://api.elsevier.com/content/object/eid/1-s2.0-S2095495622003382-gr15.sml?httpAccept=%2A%2F%2A",
            "@multimediatype": "GIF image file",
            "@type": "IMAGE-THUMBNAIL",
            "@size": "20405",
            "@ref": "gr15",
            "@mimetype": "image/gif"
          },
          {
            "@category": "thumbnail",
            "@height": "163",
            "@width": "126",
            "@_fa": "true",
            "$": "https://api.elsevier.com/content/object/eid/1-s2.0-S2095495622003382-gr16.sml?httpAccept=%2A%2F%2A",
            "@multimediatype": "GIF image file",
            "@type": "IMAGE-THUMBNAIL",
            "@size": "13200",
            "@ref": "gr16",
            "@mimetype": "image/gif"
          },
          {
            "@category": "thumbnail",
            "@height": "163",
            "@width": "167",
            "@_fa": "true",
            "$": "https://api.elsevier.com/content/object/eid/1-s2.0-S2095495622003382-gr17.sml?httpAccept=%2A%2F%2A",
            "@multimediatype": "GIF image file",
            "@type": "IMAGE-THUMBNAIL",
            "@size": "16791",
            "@ref": "gr17",
            "@mimetype": "image/gif"
          },
          {
            "@category": "thumbnail",
            "@height": "164",
            "@width": "168",
            "@_fa": "true",
            "$": "https://api.elsevier.com/content/object/eid/1-s2.0-S2095495622003382-gr18.sml?httpAccept=%2A%2F%2A",
            "@multimediatype": "GIF image file",
            "@type": "IMAGE-THUMBNAIL",
            "@size": "13494",
            "@ref": "gr18",
            "@mimetype": "image/gif"
          },
          {
            "@category": "thumbnail",
            "@height": "163",
            "@width": "219",
            "@_fa": "true",
            "$": "https://api.elsevier.com/content/object/eid/1-s2.0-S2095495622003382-gr2.sml?httpAccept=%2A%2F%2A",
            "@multimediatype": "GIF image file",
            "@type": "IMAGE-THUMBNAIL",
            "@size": "17561",
            "@ref": "gr2",
            "@mimetype": "image/gif"
          },
          {
            "@category": "thumbnail",
            "@height": "164",
            "@width": "198",
            "@_fa": "true",
            "$": "https://api.elsevier.com/content/object/eid/1-s2.0-S2095495622003382-gr3.sml?httpAccept=%2A%2F%2A",
            "@multimediatype": "GIF image file",
            "@type": "IMAGE-THUMBNAIL",
            "@size": "16357",
            "@ref": "gr3",
            "@mimetype": "image/gif"
          },
          {
            "@category": "thumbnail",
            "@height": "164",
            "@width": "189",
            "@_fa": "true",
            "$": "https://api.elsevier.com/content/object/eid/1-s2.0-S2095495622003382-gr4.sml?httpAccept=%2A%2F%2A",
            "@multimediatype": "GIF image file",
            "@type": "IMAGE-THUMBNAIL",
            "@size": "12151",
            "@ref": "gr4",
            "@mimetype": "image/gif"
          },
          {
            "@category": "thumbnail",
            "@height": "164",
            "@width": "102",
            "@_fa": "true",
            "$": "https://api.elsevier.com/content/object/eid/1-s2.0-S2095495622003382-gr5.sml?httpAccept=%2A%2F%2A",
            "@multimediatype": "GIF image file",
            "@type": "IMAGE-THUMBNAIL",
            "@size": "7830",
            "@ref": "gr5",
            "@mimetype": "image/gif"
          },
          {
            "@category": "thumbnail",
            "@height": "163",
            "@width": "142",
            "@_fa": "true",
            "$": "https://api.elsevier.com/content/object/eid/1-s2.0-S2095495622003382-gr6.sml?httpAccept=%2A%2F%2A",
            "@multimediatype": "GIF image file",
            "@type": "IMAGE-THUMBNAIL",
            "@size": "16649",
            "@ref": "gr6",
            "@mimetype": "image/gif"
          },
          {
            "@category": "thumbnail",
            "@height": "143",
            "@width": "219",
            "@_fa": "true",
            "$": "https://api.elsevier.com/content/object/eid/1-s2.0-S2095495622003382-gr7.sml?httpAccept=%2A%2F%2A",
            "@multimediatype": "GIF image file",
            "@type": "IMAGE-THUMBNAIL",
            "@size": "19899",
            "@ref": "gr7",
            "@mimetype": "image/gif"
          },
          {
            "@category": "thumbnail",
            "@height": "164",
            "@width": "157",
            "@_fa": "true",
            "$": "https://api.elsevier.com/content/object/eid/1-s2.0-S2095495622003382-gr8.sml?httpAccept=%2A%2F%2A",
            "@multimediatype": "GIF image file",
            "@type": "IMAGE-THUMBNAIL",
            "@size": "17361",
            "@ref": "gr8",
            "@mimetype": "image/gif"
          },
          {
            "@category": "thumbnail",
            "@height": "145",
            "@width": "219",
            "@_fa": "true",
            "$": "https://api.elsevier.com/content/object/eid/1-s2.0-S2095495622003382-gr9.sml?httpAccept=%2A%2F%2A",
            "@multimediatype": "GIF image file",
            "@type": "IMAGE-THUMBNAIL",
            "@size": "18856",
            "@ref": "gr9",
            "@mimetype": "image/gif"
          },
          {
            "@category": "high",
            "@height": "413",
            "@width": "295",
            "@_fa": "true",
            "$": "https://api.elsevier.com/content/object/eid/1-s2.0-S2095495622003382-fx1_lrg.jpg?httpAccept=%2A%2F%2A",
            "@multimediatype": "JPEG image file",
            "@type": "IMAGE-HIGH-RES",
            "@size": "15862",
            "@ref": "fx1",
            "@mimetype": "image/jpeg"
          },
          {
            "@category": "high",
            "@height": "413",
            "@width": "295",
            "@_fa": "true",
            "$": "https://api.elsevier.com/content/object/eid/1-s2.0-S2095495622003382-fx10_lrg.jpg?httpAccept=%2A%2F%2A",
            "@multimediatype": "JPEG image file",
            "@type": "IMAGE-HIGH-RES",
            "@size": "18135",
            "@ref": "fx10",
            "@mimetype": "image/jpeg"
          },
          {
            "@category": "high",
            "@height": "413",
            "@width": "295",
            "@_fa": "true",
            "$": "https://api.elsevier.com/content/object/eid/1-s2.0-S2095495622003382-fx2_lrg.jpg?httpAccept=%2A%2F%2A",
            "@multimediatype": "JPEG image file",
            "@type": "IMAGE-HIGH-RES",
            "@size": "12450",
            "@ref": "fx2",
            "@mimetype": "image/jpeg"
          },
          {
            "@category": "high",
            "@height": "413",
            "@width": "295",
            "@_fa": "true",
            "$": "https://api.elsevier.com/content/object/eid/1-s2.0-S2095495622003382-fx3_lrg.jpg?httpAccept=%2A%2F%2A",
            "@multimediatype": "JPEG image file",
            "@type": "IMAGE-HIGH-RES",
            "@size": "28193",
            "@ref": "fx3",
            "@mimetype": "image/jpeg"
          },
          {
            "@category": "high",
            "@height": "413",
            "@width": "295",
            "@_fa": "true",
            "$": "https://api.elsevier.com/content/object/eid/1-s2.0-S2095495622003382-fx4_lrg.jpg?httpAccept=%2A%2F%2A",
            "@multimediatype": "JPEG image file",
            "@type": "IMAGE-HIGH-RES",
            "@size": "19640",
            "@ref": "fx4",
            "@mimetype": "image/jpeg"
          },
          {
            "@category": "high",
            "@height": "413",
            "@width": "295",
            "@_fa": "true",
            "$": "https://api.elsevier.com/content/object/eid/1-s2.0-S2095495622003382-fx5_lrg.jpg?httpAccept=%2A%2F%2A",
            "@multimediatype": "JPEG image file",
            "@type": "IMAGE-HIGH-RES",
            "@size": "31756",
            "@ref": "fx5",
            "@mimetype": "image/jpeg"
          },
          {
            "@category": "high",
            "@height": "413",
            "@width": "295",
            "@_fa": "true",
            "$": "https://api.elsevier.com/content/object/eid/1-s2.0-S2095495622003382-fx6_lrg.jpg?httpAccept=%2A%2F%2A",
            "@multimediatype": "JPEG image file",
            "@type": "IMAGE-HIGH-RES",
            "@size": "15087",
            "@ref": "fx6",
            "@mimetype": "image/jpeg"
          },
          {
            "@category": "high",
            "@height": "413",
            "@width": "295",
            "@_fa": "true",
            "$": "https://api.elsevier.com/content/object/eid/1-s2.0-S2095495622003382-fx7_lrg.jpg?httpAccept=%2A%2F%2A",
            "@multimediatype": "JPEG image file",
            "@type": "IMAGE-HIGH-RES",
            "@size": "20387",
            "@ref": "fx7",
            "@mimetype": "image/jpeg"
          },
          {
            "@category": "high",
            "@height": "413",
            "@width": "295",
            "@_fa": "true",
            "$": "https://api.elsevier.com/content/object/eid/1-s2.0-S2095495622003382-fx8_lrg.jpg?httpAccept=%2A%2F%2A",
            "@multimediatype": "JPEG image file",
            "@type": "IMAGE-HIGH-RES",
            "@size": "15623",
            "@ref": "fx8",
            "@mimetype": "image/jpeg"
          },
          {
            "@category": "high",
            "@height": "413",
            "@width": "295",
            "@_fa": "true",
            "$": "https://api.elsevier.com/content/object/eid/1-s2.0-S2095495622003382-fx9_lrg.jpg?httpAccept=%2A%2F%2A",
            "@multimediatype": "JPEG image file",
            "@type": "IMAGE-HIGH-RES",
            "@size": "15375",
            "@ref": "fx9",
            "@mimetype": "image/jpeg"
          },
          {
            "@category": "high",
            "@height": "886",
            "@width": "1854",
            "@_fa": "true",
            "$": "https://api.elsevier.com/content/object/eid/1-s2.0-S2095495622003382-ga1_lrg.jpg?httpAccept=%2A%2F%2A",
            "@multimediatype": "JPEG image file",
            "@type": "IMAGE-HIGH-RES",
            "@size": "272337",
            "@ref": "ga1",
            "@mimetype": "image/jpeg"
          },
          {
            "@category": "high",
            "@height": "1257",
            "@width": "1257",
            "@_fa": "true",
            "$": "https://api.elsevier.com/content/object/eid/1-s2.0-S2095495622003382-gr1_lrg.jpg?httpAccept=%2A%2F%2A",
            "@multimediatype": "JPEG image file",
            "@type": "IMAGE-HIGH-RES",
            "@size": "315783",
            "@ref": "gr1",
            "@mimetype": "image/jpeg"
          },
          {
            "@category": "high",
            "@height": "3095",
            "@width": "3042",
            "@_fa": "true",
            "$": "https://api.elsevier.com/content/object/eid/1-s2.0-S2095495622003382-gr10_lrg.jpg?httpAccept=%2A%2F%2A",
            "@multimediatype": "JPEG image file",
            "@type": "IMAGE-HIGH-RES",
            "@size": "992035",
            "@ref": "gr10",
            "@mimetype": "image/jpeg"
          },
          {
            "@category": "high",
            "@height": "2331",
            "@width": "2829",
            "@_fa": "true",
            "$": "https://api.elsevier.com/content/object/eid/1-s2.0-S2095495622003382-gr11_lrg.jpg?httpAccept=%2A%2F%2A",
            "@multimediatype": "JPEG image file",
            "@type": "IMAGE-HIGH-RES",
            "@size": "842029",
            "@ref": "gr11",
            "@mimetype": "image/jpeg"
          },
          {
            "@category": "high",
            "@height": "2970",
            "@width": "2757",
            "@_fa": "true",
            "$": "https://api.elsevier.com/content/object/eid/1-s2.0-S2095495622003382-gr12_lrg.jpg?httpAccept=%2A%2F%2A",
            "@multimediatype": "JPEG image file",
            "@type": "IMAGE-HIGH-RES",
            "@size": "898266",
            "@ref": "gr12",
            "@mimetype": "image/jpeg"
          },
          {
            "@category": "high",
            "@height": "2678",
            "@width": "2984",
            "@_fa": "true",
            "$": "https://api.elsevier.com/content/object/eid/1-s2.0-S2095495622003382-gr13_lrg.jpg?httpAccept=%2A%2F%2A",
            "@multimediatype": "JPEG image file",
            "@type": "IMAGE-HIGH-RES",
            "@size": "960112",
            "@ref": "gr13",
            "@mimetype": "image/jpeg"
          },
          {
            "@category": "high",
            "@height": "3873",
            "@width": "3150",
            "@_fa": "true",
            "$": "https://api.elsevier.com/content/object/eid/1-s2.0-S2095495622003382-gr14_lrg.jpg?httpAccept=%2A%2F%2A",
            "@multimediatype": "JPEG image file",
            "@type": "IMAGE-HIGH-RES",
            "@size": "1427422",
            "@ref": "gr14",
            "@mimetype": "image/jpeg"
          },
          {
            "@category": "high",
            "@height": "2285",
            "@width": "3543",
            "@_fa": "true",
            "$": "https://api.elsevier.com/content/object/eid/1-s2.0-S2095495622003382-gr15_lrg.jpg?httpAccept=%2A%2F%2A",
            "@multimediatype": "JPEG image file",
            "@type": "IMAGE-HIGH-RES",
            "@size": "1187068",
            "@ref": "gr15",
            "@mimetype": "image/jpeg"
          },
          {
            "@category": "high",
            "@height": "4083",
            "@width": "3147",
            "@_fa": "true",
            "$": "https://api.elsevier.com/content/object/eid/1-s2.0-S2095495622003382-gr16_lrg.jpg?httpAccept=%2A%2F%2A",
            "@multimediatype": "JPEG image file",
            "@type": "IMAGE-HIGH-RES",
            "@size": "1549877",
            "@ref": "gr16",
            "@mimetype": "image/jpeg"
          },
          {
            "@category": "high",
            "@height": "2310",
            "@width": "2362",
            "@_fa": "true",
            "$": "https://api.elsevier.com/content/object/eid/1-s2.0-S2095495622003382-gr17_lrg.jpg?httpAccept=%2A%2F%2A",
            "@multimediatype": "JPEG image file",
            "@type": "IMAGE-HIGH-RES",
            "@size": "729256",
            "@ref": "gr17",
            "@mimetype": "image/jpeg"
          },
          {
            "@category": "high",
            "@height": "2902",
            "@width": "2981",
            "@_fa": "true",
            "$": "https://api.elsevier.com/content/object/eid/1-s2.0-S2095495622003382-gr18_lrg.jpg?httpAccept=%2A%2F%2A",
            "@multimediatype": "JPEG image file",
            "@type": "IMAGE-HIGH-RES",
            "@size": "707632",
            "@ref": "gr18",
            "@mimetype": "image/jpeg"
          },
          {
            "@category": "high",
            "@height": "2263",
            "@width": "3043",
            "@_fa": "true",
            "$": "https://api.elsevier.com/content/object/eid/1-s2.0-S2095495622003382-gr2_lrg.jpg?httpAccept=%2A%2F%2A",
            "@multimediatype": "JPEG image file",
            "@type": "IMAGE-HIGH-RES",
            "@size": "847316",
            "@ref": "gr2",
            "@mimetype": "image/jpeg"
          },
          {
            "@category": "high",
            "@height": "1173",
            "@width": "1417",
            "@_fa": "true",
            "$": "https://api.elsevier.com/content/object/eid/1-s2.0-S2095495622003382-gr3_lrg.jpg?httpAccept=%2A%2F%2A",
            "@multimediatype": "JPEG image file",
            "@type": "IMAGE-HIGH-RES",
            "@size": "162411",
            "@ref": "gr3",
            "@mimetype": "image/jpeg"
          },
          {
            "@category": "high",
            "@height": "2051",
            "@width": "2364",
            "@_fa": "true",
            "$": "https://api.elsevier.com/content/object/eid/1-s2.0-S2095495622003382-gr4_lrg.jpg?httpAccept=%2A%2F%2A",
            "@multimediatype": "JPEG image file",
            "@type": "IMAGE-HIGH-RES",
            "@size": "399590",
            "@ref": "gr4",
            "@mimetype": "image/jpeg"
          },
          {
            "@category": "high",
            "@height": "3802",
            "@width": "2364",
            "@_fa": "true",
            "$": "https://api.elsevier.com/content/object/eid/1-s2.0-S2095495622003382-gr5_lrg.jpg?httpAccept=%2A%2F%2A",
            "@multimediatype": "JPEG image file",
            "@type": "IMAGE-HIGH-RES",
            "@size": "740538",
            "@ref": "gr5",
            "@mimetype": "image/jpeg"
          },
          {
            "@category": "high",
            "@height": "2169",
            "@width": "1888",
            "@_fa": "true",
            "$": "https://api.elsevier.com/content/object/eid/1-s2.0-S2095495622003382-gr6_lrg.jpg?httpAccept=%2A%2F%2A",
            "@multimediatype": "JPEG image file",
            "@type": "IMAGE-HIGH-RES",
            "@size": "680674",
            "@ref": "gr6",
            "@mimetype": "image/jpeg"
          },
          {
            "@category": "high",
            "@height": "1547",
            "@width": "2362",
            "@_fa": "true",
            "$": "https://api.elsevier.com/content/object/eid/1-s2.0-S2095495622003382-gr7_lrg.jpg?httpAccept=%2A%2F%2A",
            "@multimediatype": "JPEG image file",
            "@type": "IMAGE-HIGH-RES",
            "@size": "512881",
            "@ref": "gr7",
            "@mimetype": "image/jpeg"
          },
          {
            "@category": "high",
            "@height": "3705",
            "@width": "3543",
            "@_fa": "true",
            "$": "https://api.elsevier.com/content/object/eid/1-s2.0-S2095495622003382-gr8_lrg.jpg?httpAccept=%2A%2F%2A",
            "@multimediatype": "JPEG image file",
            "@type": "IMAGE-HIGH-RES",
            "@size": "1664373",
            "@ref": "gr8",
            "@mimetype": "image/jpeg"
          },
          {
            "@category": "high",
            "@height": "1120",
            "@width": "1693",
            "@_fa": "true",
            "$": "https://api.elsevier.com/content/object/eid/1-s2.0-S2095495622003382-gr9_lrg.jpg?httpAccept=%2A%2F%2A",
            "@multimediatype": "JPEG image file",
            "@type": "IMAGE-HIGH-RES",
            "@size": "338630",
            "@ref": "gr9",
            "@mimetype": "image/jpeg"
          },
          {
            "@category": "thumbnail",
            "@_fa": "true",
            "$": "https://api.elsevier.com/content/object/eid/1-s2.0-S2095495622003382-si1.svg?httpAccept=%2A%2F%2A",
            "@multimediatype": "Scalable Vector Graphics file",
            "@type": "ALTIMG",
            "@size": "8600",
            "@ref": "si1",
            "@mimetype": "image/svg+xml"
          },
          {
            "@category": "thumbnail",
            "@_fa": "true",
            "$": "https://api.elsevier.com/content/object/eid/1-s2.0-S2095495622003382-si2.svg?httpAccept=%2A%2F%2A",
            "@multimediatype": "Scalable Vector Graphics file",
            "@type": "ALTIMG",
            "@size": "9941",
            "@ref": "si2",
            "@mimetype": "image/svg+xml"
          },
          {
            "@category": "thumbnail",
            "@_fa": "true",
            "$": "https://api.elsevier.com/content/object/eid/1-s2.0-S2095495622003382-si3.svg?httpAccept=%2A%2F%2A",
            "@multimediatype": "Scalable Vector Graphics file",
            "@type": "ALTIMG",
            "@size": "3459",
            "@ref": "si3",
            "@mimetype": "image/svg+xml"
          },
          {
            "@category": "standard",
            "@_fa": "true",
            "$": "https://api.elsevier.com/content/object/eid/1-s2.0-S2095495622003382-am.pdf?httpAccept=%2A%2F%2A",
            "@multimediatype": "Acrobat PDF file",
            "@type": "AAM-PDF",
            "@size": "10281661",
            "@ref": "am",
            "@mimetype": "application/pdf"
          }
        ]
      },
      "link": {
        "@rel": "abstract",
        "@href": "https://api.elsevier.com/content/abstract/scopus_id/85135347592"
      }
    }
  }
}