{
  "metadata": {
    "title": "Inner-pore reduction nucleation of palladium nanoparticles in highly conductive wurster-type covalent organic frameworks for efficient oxygen reduction electrocatalysis",
    "authors": "; ; ",
    "journal": "Journal of Energy Chemistry",
    "date": "2023-02-28",
    "doi": "10.1016/j.jechem.2022.11.032",
    "abstract": "",
    "uri": "https://api.elsevier.com/content/article/pii/S2095495622006295",
    "pii": "S2095495622006295"
  },
  "fulltext": {
    "full-text-retrieval-response": {
      "scopus-eid": "2-s2.0-85143717186",
      "originalText": "serial JL 286353 291210 291711 291744 291809 31 Journal of Energy Chemistry JOURNALENERGYCHEMISTRY 2022-11-25 2022-11-25 2023-01-02 2023-01-02 2023-03-21T19:57:12 1-s2.0-S2095495622006295 S2095-4956(22)00629-5 S2095495622006295 10.1016/j.jechem.2022.11.032 S300 S300.3 FULL-TEXT 1-s2.0-S2095495622X00090 2024-06-03T13:21:35.167045Z 0 0 20230201 20230228 2023 2022-11-25T15:59:25.176423Z absattachment articleinfo articletitlenorm authfirstinitialnorm authfirstsurnamenorm cid cids contenttype copyright crossmark dateloaded dateloadedtxt datesearch datesort dateupdated dco docsubtype doctype doi eid ewtransactionid hubeid indexeddate issn issnnorm itemstage itemtransactionid itemweight openaccess openarchive pg pgfirst pglast pii piinorm pubdateend pubdatestart pubdatetxt pubyr sortorder srctitle srctitlenorm srctype ssids alllist content subj subheadings suppl tomb volfirst volissue volumelist webpdf webpdfpagecount yearnav figure e-component body mmlmath acknowledge affil appendices articletitle auth authfirstini authfull authkeywords authlast orcid primabst ref specialabst 2095-4956 20954956 false 77 77 C Volume 77 53 543 552 543 552 202302 February 2023 2023-02-01 2023-02-28 2023 article fla © 2022 Science Press and Dalian Institute of Chemical Physics, Chinese Academy of Sciences. All rights reserved. INNERPOREREDUCTIONNUCLEATIONPALLADIUMNANOPARTICLESINHIGHLYCONDUCTIVEWURSTERTYPECOVALENTORGANICFRAMEWORKSFOREFFICIENTOXYGENREDUCTIONELECTROCATALYSIS WANG W 1 Introduction 2 Experimental 2.1 Materials 2.2 Synthesis of pristine WTA-COF 2.3 Synthesis of pristine WOTA-COF 2.4 Synthesis of Pd@WTA-COF and Pd@WOTA-COF through in-situ reduction of palladium salt 2.5 Preparation of COF on carbon cloths (COF/CC) through dissolution–recrystallization process 2.6 Characterizations 2.7 Electrochemical characterizations 3 Results and discussion 4 Conclusions Acknowledgments Appendix A Supplementary material References FENG 2022 211 218 Y HUANG 2017 1700544 Z XU 2021 2005092 H ZAMAN 2021 17832 17852 S ZHOU 2019 1807468 T CHEN 2021 3212 3221 Y LIU 2019 1802234 M SHEN 2022 184 194 T TIAN 2020 45 68 X MAO 2022 240 247 J WANG 2022 121172 H XIAO 2019 9640 9645 M ZHANG 2017 6930 6941 C ZHANG 2021 2006494 J WANG 2022 135539 H ZHENG 2022 153512 X LIU 2022 2200067 Q ERIKSON 2016 327 336 H LUSI 2022 116391 M KARUPPASAMY 2022 100799 L LI 2018 2264 2272 J HWANG 2020 77 85 J LUSI 2021 035401 M LIU 2022 e202200123 H NAVEEN 2021 575 585 M LUSI 2021 139132 M SUN 2021 111684 Y PARKASH 2020 065021 A ZHENG 2019 627 634 F ZHAI 2020 9747 9752 L CUI 2020 104525 X GENG 2020 8814 8933 K LIN 2018 1703646 C NING 2022 490 496 J ZHONG 2021 113 129 M HUANG 2022 214563 S MAHMOOD 2017 441 446 J WANG 2021 688 728 D KAMAI 2016 13184 13188 R MULLANGI 2016 1600110 D NANDI 2016 1601189 S PARK 2020 2596 2602 E TU 2018 1707582 W CHEON 2009 2899 2903 Y HAO 2021 12498 12503 Q KRISHNARAJ 2020 20107 20116 C ROTTER 2020 12843 12853 J LIU 2014 2544 2555 H XU 2022 214388 B YU 2021 12027 12031 H MONDAL 2018 622 630 S QIU 2015 992 1002 X WANG 2017 6643 6648 X ZHOU 2012 18 J SHI 2020 178 R ZHANG 2015 7610 7618 L WANG 2019 16644 16650 W ZHANG 2019 1903643 X ZHOU 2019 1900509 S HE 2022 2200849 Q HUANG 2013 8845 8849 W YANG 2020 5634 5640 L WANGX2023X543 WANGX2023X543X552 WANGX2023X543XW WANGX2023X543X552XW 2025-01-02T00:00:00.000Z 2025-01-02T00:00:00.000Z http://creativecommons.org/licenses/by-nc-nd/4.0/ © 2022 Science Press and Dalian Institute of Chemical Physics, Chinese Academy of Sciences. All rights reserved. 2022-12-15T09:14:06.463Z http://vtw.elsevier.com/data/voc/AddOnTypes/50.7/aggregated-refined Sichuan Science and Technology Department 2021YFH0180 SPDST Department of Science and Technology of Sichuan Province http://data.elsevier.com/vocabulary/SciValFunders/501100004829 http://sws.geonames.org/1814991/ National Natural Science Foundation of China 21674068 52161145402 52173133 NSFC National Natural Science Foundation of China http://data.elsevier.com/vocabulary/SciValFunders/501100001809 http://sws.geonames.org/1814991/ This work was financially supported by the National Natural Science Foundation of China (21674068, 52173133, 52161145402), the Sichuan Science and Technology Department (2021YFH0180). We would like to thank Daichuan Ma and Daibing Luo of the Analytical & Testing Center of Sichuan University for their help with computational simulation. item S2095-4956(22)00629-5 S2095495622006295 1-s2.0-S2095495622006295 10.1016/j.jechem.2022.11.032 286353 2023-03-21T20:12:11.267114Z 2023-02-01 2023-02-28 1-s2.0-S2095495622006295-main.pdf https://s3-eu-west-1.amazonaws.com/prod-ucs-content-store-eu-west/content/pii:S2095495622006295/MAIN/application/pdf/986e505ea05238a7ce7e7b661828c442/main.pdf main.pdf pdf true 4453780 MAIN 10 1-s2.0-S2095495622006295-main_1.png https://s3-eu-west-1.amazonaws.com/prod-ucs-content-store-eu-west/content/pii:S2095495622006295/PREVIEW/image/png/855646bee7d8da4cedd6fb7c60d0f99f/main_1.png main_1.png png 62131 849 656 IMAGE-WEB-PDF 1 1-s2.0-S2095495622006295-fx1.jpg https://s3-eu-west-1.amazonaws.com/prod-ucs-content-store-eu-west/content/pii:S2095495622006295/fx1/DOWNSAMPLED/image/jpeg/5d240f52099b080b5502041611aac224/fx1.jpg fx1 fx1.jpg jpg 5219 94 298 IMAGE-DOWNSAMPLED 1-s2.0-S2095495622006295-ga1.jpg https://s3-eu-west-1.amazonaws.com/prod-ucs-content-store-eu-west/content/pii:S2095495622006295/ga1/DOWNSAMPLED/image/jpeg/0d29a6338d92f5302fe3e0588a38d57b/ga1.jpg ga1 true ga1.jpg jpg 34139 200 399 IMAGE-DOWNSAMPLED 1-s2.0-S2095495622006295-gr1.jpg https://s3-eu-west-1.amazonaws.com/prod-ucs-content-store-eu-west/content/pii:S2095495622006295/gr1/DOWNSAMPLED/image/jpeg/a91601d8c5997c1f42c10cf0bcd96dc4/gr1.jpg gr1 gr1.jpg jpg 128637 607 662 IMAGE-DOWNSAMPLED 1-s2.0-S2095495622006295-gr2.jpg https://s3-eu-west-1.amazonaws.com/prod-ucs-content-store-eu-west/content/pii:S2095495622006295/gr2/THUMBNAIL/image/jpeg/38fa23138c9a452df944e3ff85d407ab/gr2.jpg gr2 gr2.jpg jpg 110900 458 535 IMAGE-DOWNSAMPLED 1-s2.0-S2095495622006295-gr3.jpg https://s3-eu-west-1.amazonaws.com/prod-ucs-content-store-eu-west/content/pii:S2095495622006295/gr3/DOWNSAMPLED/image/jpeg/eaadf97d70b07cc891e97630b1270480/gr3.jpg gr3 gr3.jpg jpg 150751 644 800 IMAGE-DOWNSAMPLED 1-s2.0-S2095495622006295-gr4.jpg https://s3-eu-west-1.amazonaws.com/prod-ucs-content-store-eu-west/content/pii:S2095495622006295/gr4/DOWNSAMPLED/image/jpeg/e51c727120d59bc807bdd22cc3740375/gr4.jpg gr4 gr4.jpg jpg 115516 572 656 IMAGE-DOWNSAMPLED 1-s2.0-S2095495622006295-gr5.jpg https://s3-eu-west-1.amazonaws.com/prod-ucs-content-store-eu-west/content/pii:S2095495622006295/gr5/HIGHRES/image/jpeg/8afed0702021f58661348bfa82c46455/gr5.jpg gr5 gr5.jpg jpg 194844 801 721 IMAGE-DOWNSAMPLED 1-s2.0-S2095495622006295-gr6.jpg https://s3-eu-west-1.amazonaws.com/prod-ucs-content-store-eu-west/content/pii:S2095495622006295/gr6/DOWNSAMPLED/image/jpeg/49f5cee8023a75e9eb3c2d7c6ba5119e/gr6.jpg gr6 gr6.jpg jpg 67844 369 663 IMAGE-DOWNSAMPLED 1-s2.0-S2095495622006295-fx1.sml https://s3-eu-west-1.amazonaws.com/prod-ucs-content-store-eu-west/content/pii:S2095495622006295/fx1/THUMBNAIL/image/gif/e4a024052fc94b93ed34e067f5c77535/fx1.sml fx1 fx1.sml sml 2553 69 219 IMAGE-THUMBNAIL 1-s2.0-S2095495622006295-ga1.sml https://s3-eu-west-1.amazonaws.com/prod-ucs-content-store-eu-west/content/pii:S2095495622006295/ga1/THUMBNAIL/image/gif/21dffce97fb0acdbb3fe9f9bba826d27/ga1.sml ga1 true ga1.sml sml 17553 110 219 IMAGE-THUMBNAIL 1-s2.0-S2095495622006295-gr1.sml https://s3-eu-west-1.amazonaws.com/prod-ucs-content-store-eu-west/content/pii:S2095495622006295/gr1/THUMBNAIL/image/gif/b76dfdf3a645162ea02e29d502a43384/gr1.sml gr1 gr1.sml sml 11738 164 179 IMAGE-THUMBNAIL 1-s2.0-S2095495622006295-gr2.sml https://s3-eu-west-1.amazonaws.com/prod-ucs-content-store-eu-west/content/pii:S2095495622006295/gr2/THUMBNAIL/image/gif/16ad123cc2d70d317aa44884780d6caf/gr2.sml gr2 gr2.sml sml 21993 164 192 IMAGE-THUMBNAIL 1-s2.0-S2095495622006295-gr3.sml https://s3-eu-west-1.amazonaws.com/prod-ucs-content-store-eu-west/content/pii:S2095495622006295/gr3/THUMBNAIL/image/gif/42465a228195c4d2bfdc16d779ca359a/gr3.sml gr3 gr3.sml sml 14414 163 203 IMAGE-THUMBNAIL 1-s2.0-S2095495622006295-gr4.sml https://s3-eu-west-1.amazonaws.com/prod-ucs-content-store-eu-west/content/pii:S2095495622006295/gr4/THUMBNAIL/image/gif/208d3bf0e59be979549a139f2c74175f/gr4.sml gr4 gr4.sml sml 12106 164 188 IMAGE-THUMBNAIL 1-s2.0-S2095495622006295-gr5.sml https://s3-eu-west-1.amazonaws.com/prod-ucs-content-store-eu-west/content/pii:S2095495622006295/gr5/THUMBNAIL/image/gif/923de15349151e3b7bceb3d7ac679db7/gr5.sml gr5 gr5.sml sml 14396 163 147 IMAGE-THUMBNAIL 1-s2.0-S2095495622006295-gr6.sml https://s3-eu-west-1.amazonaws.com/prod-ucs-content-store-eu-west/content/pii:S2095495622006295/gr6/THUMBNAIL/image/gif/04d350789a53239a3b212f01a9199c15/gr6.sml gr6 gr6.sml sml 11715 122 219 IMAGE-THUMBNAIL 1-s2.0-S2095495622006295-fx1_lrg.jpg https://s3-eu-west-1.amazonaws.com/prod-ucs-content-store-eu-west/content/pii:S2095495622006295/HIGHRES/image/jpeg/2486edcad4938d00763fa0af97e8ce2f/fx1_lrg.jpg fx1 fx1_lrg.jpg jpg 29974 416 1319 IMAGE-HIGH-RES 1-s2.0-S2095495622006295-ga1_lrg.jpg https://s3-eu-west-1.amazonaws.com/prod-ucs-content-store-eu-west/content/pii:S2095495622006295/THUMBNAIL/image/jpeg/cb4307831a7d74ab997349c19a9e4498/ga1_lrg.jpg ga1 true ga1_lrg.jpg jpg 312043 886 1769 IMAGE-HIGH-RES 1-s2.0-S2095495622006295-gr1_lrg.jpg https://s3-eu-west-1.amazonaws.com/prod-ucs-content-store-eu-west/content/pii:S2095495622006295/HIGHRES/image/jpeg/50c6108dd170fdf93fb102daa524dbb3/gr1_lrg.jpg gr1 gr1_lrg.jpg jpg 832056 2690 2933 IMAGE-HIGH-RES 1-s2.0-S2095495622006295-gr2_lrg.jpg https://s3-eu-west-1.amazonaws.com/prod-ucs-content-store-eu-west/content/pii:S2095495622006295/DOWNSAMPLED/image/jpeg/63774badbdfd3a4ee033ae10ebb62fd3/gr2_lrg.jpg gr2 gr2_lrg.jpg jpg 1019573 2025 2368 IMAGE-HIGH-RES 1-s2.0-S2095495622006295-gr3_lrg.jpg https://s3-eu-west-1.amazonaws.com/prod-ucs-content-store-eu-west/content/pii:S2095495622006295/HIGHRES/image/jpeg/2c667e8c927a33b9148eac914d3f990c/gr3_lrg.jpg gr3 gr3_lrg.jpg jpg 990839 2851 3540 IMAGE-HIGH-RES 1-s2.0-S2095495622006295-gr4_lrg.jpg https://s3-eu-west-1.amazonaws.com/prod-ucs-content-store-eu-west/content/pii:S2095495622006295/HIGHRES/image/jpeg/15aec51f8c5893c1d1891bc683ed7a2c/gr4_lrg.jpg gr4 gr4_lrg.jpg jpg 742568 2531 2904 IMAGE-HIGH-RES 1-s2.0-S2095495622006295-gr5_lrg.jpg https://s3-eu-west-1.amazonaws.com/prod-ucs-content-store-eu-west/content/pii:S2095495622006295/HIGHRES/image/jpeg/8f166c7a13cca348ce4b6655f51bebfb/gr5_lrg.jpg gr5 gr5_lrg.jpg jpg 1623277 3546 3191 IMAGE-HIGH-RES 1-s2.0-S2095495622006295-gr6_lrg.jpg https://s3-eu-west-1.amazonaws.com/prod-ucs-content-store-eu-west/content/pii:S2095495622006295/HIGHRES/image/jpeg/2070b13e69bd3c1af1a9176eeea2882c/gr6_lrg.jpg gr6 gr6_lrg.jpg jpg 444722 1633 2938 IMAGE-HIGH-RES 1-s2.0-S2095495622006295-mmc1.docx https://s3-eu-west-1.amazonaws.com/prod-ucs-content-store-eu-west/content/pii:S2095495622006295/mmc1/MAIN/application/vnd.openxmlformats-officedocument.wordprocessingml.document/ca6402edc742453760de8fd7126da7fd/mmc1.docx mmc1 mmc1.docx docx 28005749 APPLICATION 1-s2.0-S2095495622006295-si1.svg https://s3-eu-west-1.amazonaws.com/prod-ucs-content-store-eu-west/content/pii:S2095495622006295/STRIPIN/image/svg+xml/a83023ce90cd2d6c9462d22908efc5f4/si1.svg si1 si1.svg svg 12382 ALTIMG 1-s2.0-S2095495622006295-si2.svg https://s3-eu-west-1.amazonaws.com/prod-ucs-content-store-eu-west/content/pii:S2095495622006295/STRIPIN/image/svg+xml/fd1e32edf5abda3d2f107d48461afbc1/si2.svg si2 si2.svg svg 16901 ALTIMG 1-s2.0-S2095495622006295-am.pdf https://s3-eu-west-1.amazonaws.com/prod-ucs-content-store-eu-west/content/egi:1022ZH5T9RP/MAIN/application/pdf/b090977ea8c1b1d92c4b190a1f1c3669/am.pdf am am.pdf pdf false 13000859 AAM-PDF JECHEM 2862 S2095-4956(22)00629-5 10.1016/j.jechem.2022.11.032 Science Press and Dalian Institute of Chemical Physics, Chinese Academy of Sciences Fig. 1 (a) Schematic presentation of the synthesis of WTA-COF and WOTA-COF, and their crystalline and chemical structures. PXRD patterns and Pawley refinement of (b) WTA-COF and (c) WOTA-COF. (d) Nitrogen physisorption isotherms of WTA-COF and WOTA-COF. 13C CP-MAS spectra of (e) WTA-COF and (f) WOTA-COF (the insets are corresponding chemical structures). Fig. 2 (a) Schematic presentation of the in-situ reduction method to synthesize Pd@WTA-COF and Pd@WOTA-COF. SEM images of (b) WTA-COF and (d) WOTA-COF; HRTEM images of (c) WTA-COF and (e) WOTA-COF. TEM images of (f) Pd@WTA-COF and (h) Pd@WOTA-COF. HRTEM images of (g) Pd@WTA-COF and (i) Pd@WOTA-COF. (j) HAADF-STEM images and corresponding (l-n) element mapping of N and Pd for Pd@WTA-COF. (o) HAADF-STEM images and (q-s) corresponding element mapping of N and Pd for Pd@WOTA-COF. EDS elemental line scan profiles of (k) Pd@WTA-COF and (p) Pd@WOTA-COF. Fig. 3 (a) Elemental contents of C, N, O and Pd from XPS for WTA-COF, WOTA-COF, Pd@WTA-COF, and Pd@WOTA-COF. (b) Pd 3d XPS spectra of Pd@WTA-COF and Pd@WOTA-COF. (c) C 1s and (d) N 1s XPS spectra of WTA-COF and Pd@WTA-COF. (e) C 1s and (f) N 1s XPS spectra of WOTA-COF and Pd@WOTA-COF. (g) The conductivity of samples measured with a conductivity meter using the four-probe method. (h) EPR spectra of WTA-COF, WOTA-COF, Pd@WTA-COF, and Pd@WOTA-COF. (i) Schematic illustration of high conductivity for Pd@WTA-COF and their application for ORR. Fig. 4 (a) ORR polarization curves of Pd@WTA-COF, Pd@WOTA-COF, 20% Pt/C, and Pd@WTA-COF mixed with 20% Ketjenblack (KB). (b) The Tafel plots obtained from Pd@WTA-COF and Pd@WOTA-COF. (c) CV curves of Pd@WTA-COF and Pd@WOTA-COF measured in 0.1 M KOH solution saturated with O2. LSV curves of (d) Pd@WTA-COF and (f) Pd@WOTA-COF measured at different rotation speeds, and (e) corresponding K–L plots. (g) Nyquist plots of the impedance for Pd@WTA-COF, Pd@WOTA-COF, 20 wt% Pt/C, and 10 wt% Pd/C. (h) Methanol resistance test, and (i) stability test of Pd@WTA-COF, Pd@WOTA-COF, and 20 wt% Pt/C. Fig. 5 (a) Schematic illustration for the fabrication of Pd@WTA-COF/CC. (b–c) SEM images of Pd@WOTA-COF/CC. (d, e) element mapping of C and Pd for Pd@WOTA-COF/CC. (f) LSV curves, (g) EIS measures and (h) stability tests for Pd@WTA-COF/CC and Pd@WOTA-COF/CC. Fig. 6 (a) Schematic illustration of the Zn-air battery. (b) Initial open-circuit potential of Pd@WTA-COF-based Zn−air battery. (c) Photograph of LED (∼1 V) panel lighting by the Zn−air battery using Pd@WTA-COF catalyst on the air electrode. (d) Discharge polarization curve and corresponding power density of Zn-air batteries using Pd@WTA-COF and commercial Pt/C (20 wt%) as the air-catalyst. (e) Different current density discharges of Pd@WTA-COF and Pt/C (20 wt%). (f) Specific capacity normalized with the consumed zinc of Pd@WTA-COF and Pt/C (20 wt%) at 10 mA cm−2. Inner-pore reduction nucleation of palladium nanoparticles in highly conductive wurster-type covalent organic frameworks for efficient oxygen reduction electrocatalysis Weiwen Wang Lu Zhang Tianping Wang Zhen Zhang Xiangnan Wang Chong Cheng ⁎ Xikui Liu ⁎ College of Polymer Science and Engineering, State Key Laboratory of Polymer Materials Engineering, Sichuan University, Chengdu 610065, Sichuan, China College of Polymer Science and Engineering State Key Laboratory of Polymer Materials Engineering Sichuan University Chengdu 610065 Sichuan China College of Polymer Science and Engineering, State Key Laboratory of Polymer Materials Engineering, Sichuan University, Chengdu 610065, Sichuan, China ⁎ Corresponding authors. Graphical abstract An in-situ redox deposition strategy was adopted to grow uniform palladium nanoparticles in highly conductive Kagome covalent organic frameworks to enhance the activity of oxygen reduction reaction. Covalent organic frameworks (COFs) have emerged as a class of promising supports for electrocatalysis because of their advantages including good crystallinity, highly ordered pores, and structural diversity. However, their poor conductivity represents the main obstruction to their practical application. Here, we reported a novel synthesis strategy for synergistically endowing a triphenylamine-based COFs with improved electrical conductivity and excellent catalytic activity for oxygen reduction, via the in-situ redox deposition and confined growth of palladium nanoparticles inside the porous structure of COFs using reductive triphenylamine frameworks as reducing agent; meanwhile, the triphenylamine unit was oxidized to radical cation structure and affords radical cation COFs with conductivity as high as 3.2*10−1 S m−1. Such a uniform confine palladium nanoparticle on highly conductive COFs makes it an efficient electrocatalyst for four-electron oxygen reduction reaction (4e-ORR), showing excellent activities and fast kinetics with a remarkable half-wave potential (E 1/2) of 0.865 V and an ultralow Tafel slope of 39.7 mV dec−1 in alkaline media even in the absence of extra commercial conductive fillers. The generality of this strategy was proved by preparing the different metal and metal alloy nanoparticles supported on COFs (Au@COF, Pt@COF, AuPd@COF, AgPd@COF, and PtPd@COF) using reductive triphenylamine frameworks as reducing agent. This work not only provides a facile strategy for the fabrication of highly conductive COF supported ORR electrocatalysts, but also sheds new light on the practical application of Zn-air battery. Keywords Covalent organic frameworks Wurster-type structure In-situ reduction nucleation Palladium nanoparticles Oxygen reduction electrocatalysis 1 Introduction Oxygen reduction reaction (ORR) is of great importance for energy storage and conversion technologies, including fuel cells and metal-air batteries [1–5]. A highly active electrocatalyst is the key to these electrochemical applications. However, ORR suffered sluggish kinetics involving four sequential proton-coupled electron transfer steps [6–9]. Noble metals (Pt, Pd, Ir, Ru) are normally good electrocatalysts for these applications with extremely high half-wave potential due to their distinct electronic structure [10–14]. Although Pt-based electrocatalysts have shown excellent ORR activity due to their intrinsic properties, their large-scale utilization has been greatly limited by easy poisoning issues of Pt during ORR catalysis process [15,16]. Palladium-based catalysts, with better anti-CO poisoning, have received increasing attention as potential replacements for Pt-based materials for ORR due to their similarity to Pt in electronic configuration and chemical properties [17–22]. However, low noble metal utilization efficiency and sluggish ORR kinetics lead to the high cost or huge consumption of noble metals. To solve this problem, an attractive strategy is to disperse ultrafine noble metal nanoparticle catalysts on appropriate scaffolds with large surface areas and highly ordered pores; accordingly, low content of electroactive metals can make full advantages of noble metals. Various porous materials such as active carbon [23], N-doped carbon [24,25], mesoporous carbon [26,27], metal–organic frameworks [28,29], and covalent organic frameworks (COFs) [30] have been explored as the supporter for noble metal nanoparticles to enhance their activity and stability. COFs as crystalline porous polymers with highly ordered pores and highly accessible surface areas, have been regarded as one of the most potential scaffolds for anchoring catalytic metal nanoparticles [31–35]. Furthermore, the nitrogen-rich frameworks endow COFs with more advantages to be the ideal supports to upload active catalytic species for catalysis [36–38]. So far, various polycrystalline COFs materials have been proven versatile in the dispersion and confined growth of metal nanoparticles (NPs) to a narrow size distribution through metal coordination sites in the COFs skeleton. And the resulting metal NPs@COFs have shown significantly improved catalytic activity and stability in catalysis [30,39–42]. Albeit the progress achieved in fabricating COFs-supported noble metal NPs for ORR electrocatalysis, to the best of our knowledge, the development of this field is still elusive and largely underexplored, which is far lower than that of carbon-supported noble metal electrocatalytic materials. There are two main bottlenecks for the COFs to become substrates for noble metal-based electrocatalysis [31,32,41,43]. First, in the preparation process of NPs-embedded COFs, the reduction of metal ions does not have to occur in the pores of COFs material resulting from the randomness of the reduction reaction, where the metal ions can be directly reduced to metal NPs in solution. Currently, the reduction of NPs is uncontrolled and tends to grow into large-diameter morphologies with extremely low exposed active areas, then leading to the poor catalytic efficiency, which greatly decreases the utilization rate of precious metals. It is a great challenge to make the reduction of metal ions occur in the pores of COF materials with high selectivity. Another bottleneck to developing high-efficiency metal NPs@COFs electrocatalysts concerns the intrinsic poor conductivity stemmed from COFs scaffolds. The efficient flow of electrons is crucial for the electrocatalysis process, most of the COFs possess poorer conductivity than that of metal, metal oxide, or carbon materials. As a result, the catalytic activity of most COFs supported noble metal electrocatalysts is much lower than that of carbon-based electrocatalysts, mainly because of the charge-transfer limitation caused by the insulating nature of the COFs matrix in the electrocatalytic process. Thus, most synthesis routes to COFs-supported catalysts necessitate high-temperature pyrolysis to enhance their conductivity, which may lead to undesirable porous changes and uncertain electrical doping sites. In this respect, developing pyrolysis-free porous material-derived electrocatalysts with well-defined structures and predictable active sites is attracting interest and is essential, but it still remains challenging. Herein, we innovatively reported a new synthetic strategy to solve the above two bottlenecks through simultaneously immobilizing highly dispersed Pd NPs and introducing a highly conductive COFs matrix using highly conductive radical cation COFs. Both two porous COFs (named WTA-COF and WOTA-COF) are highly crystalline and form a Kagome lattice through the condensation of the N,N,N′,N′-tetrakis(4-aminophenyl)-1,4-phenylenediamine (Wurster type tetraamine) with terephthalaldehyde or 2,5-dimethoxy-1,4-benzenedicarboxaldehyde. The most important feature of this Wurster-type tetraamine monomer is that it contains phenylenediamine unit moiety, which can act as a strong reducing agent and promotes reduction [44–47]. So, when the as-prepared WTA-COF and WOTA-COF were immersed in palladium solution, the in-situ redox reaction occurred between reductive phenylenediamine unit and adsorbed palladium ions, which resulted in the formation of ultrafine and uniform Pd NPs and confined growth of Pd NPs inside the porous structure of COFs (Pd@WTA-COF and Pd@WOTA-COF). Due to the reductive phenylenediamine units being the linker of COF, the palladium reduction can occur inside the pores and surface of COFs, and cannot happen in the solution. More interesting, after in-situ reduction of palladium, the phenylenediamine units were oxidized to radical cation; both palladium species and radical cation afford radical cation COFs with conductivity as high as 3.2*10−1 S m−1. Furthermore, the spontaneous in situ reduction method prevent the aggregation of Pd NPs and expose more active sites, increasing the interaction between Pd species and COFs supports, which would improve ORR performance. Such a uniform confine palladium NPs on highly conductive COF make it an efficient electrocatalyst for oxygen reduction reaction (ORR) with Pd@WTA-COF showed a high half-wave potential of 0.865 V even in the absence of adding extra commercial conductive fillers. Moreover, the performance only slightly decreased after running for 20,000 s, thus conformed to their excellent stability. Our work provides a novel and simple strategy to directly fabricate metal NPs uniformly distributed in highly conductive COFs with superior electrochemical performance for energy storage and conversion applications. 2 Experimental 2.1 Materials N,N,N',N'-tetrakis (4-aminophenyl)-1,4-benzenediamine (Wurster type tetraamine, 97%), terephthalaldehyde (98%), Mesitylene (≥99%) and Palladium(II) acetate (≥99%, Pd: 47%) were purchased from Adamas. 2,5-dimethoxy-1,4-benzenedicarboxaldehyde (98%) were used as received from Zhengzhou Alfa Chemical Co., ltd. Dioxane, Benzyl Alcohol, N,N-Dimethylformamide (DMF), Tetrahydrofuran (THF), and 36% Acetic acid were purchased from Chengdu KELONG Chemical Co., ltd. Carbon cloth (WOS1009) was purchased from CeTech Co., ltd. All chemicals were analytical grade and used without further purification. 2.2 Synthesis of pristine WTA-COF At first, a mixture of Wurster-type tetraamine (12 mg, 0.025 mmol) and terephthalaldehyde (TA) (6.8 mg, 0.05 mmol) was suspended in 1 mL mesitylene plus 1 mL benzyl alcohol, then stirred for 15 min. After 0.05 mL 36% acetic acid was added, the above mixture was transferred into a Teflon-lined stainless-steel autoclave and maintained at 100 °C for 72 h. The resulting dark red suspension was filtrated and washed with DMF, THF and DI-water three times, respectively. After that, the precipitates were freeze-dried for 12 h, and then the WTA-COF was obtained. 2.3 Synthesis of pristine WOTA-COF Wurster type tetraamine (23.6 mg, 0.05 mmol), 1,4-Benzenedicarboxaldehyde,2,5-dimethoxy ((OMe)2TA) (19.4 mg, 0.1 mmol) were suspended in 0.3 mL mesitylene and 0.3 mL dioxane, and stirred 15 min. Subsequently, 0.1 mL 36% acetic acid was added. Then the mixed solution was transferred into a Teflon-lined stainless-steel autoclave and maintained at 120 °C for 72 h. The resulting dark red suspension was filtrated and washed with DMF, THF and DI-water three times, respectively. Finally, WOTA-COF was obtained after the plum precipitates were freeze-dried for 12 h. 2.4 Synthesis of Pd@WTA-COF and Pd@WOTA-COF through in-situ reduction of palladium salt In a typical synthesis, 20 mg Pd(OAc)2, 20 mg COFs (WTA-COF or WOTA-COF) powder and 10 mL ethanol were mixed in a glass vial, then ultrasonicated for 2 h at room temperature to yield a homogeneous solution. After filtration, the obtained sample was washed with ethanol and dried under a vacuum. the reaction equation was provided as follows: 2.5 Preparation of COF on carbon cloths (COF/CC) through dissolution–recrystallization process Commercial carbon cloth (CC) was immersed in 200 mL 30 wt% H2O2 and kept at 50 °C for 24 h. Then the CC was taken out, washed thoroughly with distilled water, and dried in a vacuum at 60 °C for 5 h. The 30% H2O2-treated carbon cloth (CC) and 30 mg obtained COFs were dispersed in the solvent system used in COFs synthesis (benzyl alcohol / trimethylbenzene for WTA-COF and dioxane / trimethylbenzene for WOTA-COF) and added 0.3 mL 36% acetic acid as catalyst. Then the above mixture was transferred into a Teflon-lined stainless-steel autoclave and maintained at 100 °C (for WTA-COF/CC) or 120 °C (for WOTA-COF/CC) for 72 h. For the synthesis of Pd@COF/CC, the COF/CC was immersed in a Pd(OAc)2 acetonitrile solution. After 2 h, the carbon cloth was washed several times with ethanol and then dried under vacuum to obtain Pd@COF/CC. 2.6 Characterizations Fourier transform infrared (FTIR) spectra were measured with a Nicolet 560 spectrometer (Nicolet Instrument Technologies, Madison, WI, USA). The morphologies and microstructural analyses were studied using scanning electron microscopy (FEI, Eindhoven, The Netherlands) and transmission electron microscope (TEM, FEI Talos F200X). Powder Xray diffraction (PXRD) patterns were recorded at room temperature on an X′Pert Pro MPD diffractometer (PANalytical B.V., Almelo, the Netherlands) with Cu Kα radiation at 30 kV and 15 mA, from 2θ = 1.5–35° with the scanning rate of 2° min−1. The X-ray photoelectric spectroscopic (XPS) characterization was carried out on a Thermo Scientific K-Alpha+ (Thermo Fisher), and Al Kα X-ray (6 mA, 12 kV) was utilized as the irradiation source. Nitrogen adsorption–desorption isotherms were measured at 77 K using a Tristar system; the surface area was calculated from the adsorption data using the Brunauer–Emmett–Teller (BET) method. The pore distributions were obtained from the adsorption branch using the nonlocal density functional theory (NLDFT) method. The solid-state NMR experiments have been carried out in AVANCE III 500 MHz at a magnetic field of 11.746 T equipped with a triple channel 2.5 mm magic-angel spinning (MAS) probe-head. The electrical conductivities of the materials were measured at room temperature using a Resistivity Tester (Four Probe Method, ST2722SD+ST2643). 2.7 Electrochemical characterizations All electrochemical measurements were performed on 0.1 M KOH electrolyte in a typical three-electrode system on an electrochemical station (Gamry), with the graphite rod and Ag/AgCl as the counter and reference electrodes, respectively, and a glassy carbon electrode (GCE, diameter: 5 mm, electrode area: ∼0.196 cm2) loaded with catalyst as the working electrode. All the potentials reported in this work were presented with iR corrections, which were calibrated to a reversible hydrogen electrode (RHE) according to E (RHE) = E (Ag/AgCl) + 0.197 V + 0.059 × pH. V in 0.1 M KOH. For the preparation of the working electrode, catalysts (5 mg) were dispersed in 0.5 wt% Nafion (500 μL), and the resulting mixture was sonicated for 2 h at room temperature to form a homogeneous catalysts ink. Then, 5 μL of the ink was pipetted onto the GCE disk to form a catalyst layer and dried at room temperature (the catalyst loading was ∼0.25 mg cm−2). ORR activity was proved by the electrochemical measurements of linear sweep voltammetry (LSV), cyclic voltammetry (CV), and the electrochemical impedance spectroscopy (EIS), which were carried out using a rotating disk electrode (RDE). CV curves were recorded within a potential of –0.46 – 1.04 V vs RHE at a scan rate of 10 mV s−1 after the electrolyte was purged with O2 for at least 30 min. Before recording, several fast CV (100 mV s−1) were recorded to stabilize the catalyst. LSV curves were measured in O2-saturated 0.1 M KOH electrolytes with the rotating speed from 2400 r min−1 to 400 r min−1 with a sweep rate of 10 mV s−1, and the potential region is 1 V to 0.04 V vs RHE. The Tafel plot was calculated by the result of LSV with a sweep rate of 10 mV s−1 and a rotating speed of 1600 r min−1. The electron transfer number was calculated by the different LSV results using the Koutecky–Levich (K–L) equations. 1 J = 1 J K + 1 J L = 1 J K + 1 B ω 1 / 2 B = 0.2 n FC 0 ( D 0 ) 2 / 3 v 1 / 6 Where J is the measured current density, J K, and J L represent the kinetic and the diffusion-limiting current density, respectively; ω is the rotating rate of the electrode; B is determined by the slop of the K–L plots; F is the Faraday constant (96,485C mol−1); C0 is the dissolved concentration of O2 (1.2*10−6 mol cm−3); D0 is the diffusion coefficient of O2 (1.9*10−5 cm2 s−1); v is the kinetic viscosity of the electrolyte (0.01 cm2 s−1). 3 Results and discussion WTA-COF and WOTA-COF were synthesized under solvothermal reaction by condensing N,N,N',N'-tetrakis (4-aminophenyl)-1,4-benzenediamine (Wurster) with terephthalaldehyde (TA) or 2,5-dimethoxy 1,4-Benzenedicarboxaldehyde ((OMe)2TA), respectively (Fig. 1 a). The results of PXRD, for both WTA-COF and WOTA-COF, show sharp reflections peaks with 2θ approximately at 2.4°, 4.2°, 4.8°, 6.4° and 8.7°, which are assigned to the (100), (110), (200), (210) and (310) planes, respectively [45–47]. Simultaneously, the theoretical structural simulations were used to determine the crystal structure of two types of COFs (Fig. 1b and c, and Fig. S1). Pawley refinement of the PXRD pattern for full profile fitting against the proposed models provides a P6-symmetric structure model with a unit cell of a = b = 43.1 Å and c = 4.48 Å, α = β = 90° and γ = 120° (Rwp = 6.64% and Rp = 5.33%) for WTA-COF; and the unit cell parameters of WOTA-COF were a = b = 45.1 Å, c = 4.50 Å, and α = β = 90° and γ = 120° (Rwp = 4.73% and Rp = 3.99%), which is consistent with experimental test data. The porous nature of the WOTA-COF and WTA-COF was investigated by a N2 sorption experiment at 77 K with a micropore option, and pore size distribution was calculated by NLDFT modeling based on N2 adsorption data. As shown in Fig. 1(d), the overall isotherm is a combination of type-I isotherms, indicating both microporous and mesoporous characteristics as expected in the Kagome type structure. And the Brunauer−Emmett−Teller (BET) surface area of WTA-COF and WOTA-COF powder was calculated to be 589 m2 g−1 and 836 m2 g−1 (Fig. 1d), and the pore size was 2.05 nm and 2.79 nm (Fig. S2), respectively. The high BET surface area and large total pore volume strongly support the porous nature of COFs. The above results of PXRD and BET demonstrate that the porous and highly crystalline COFs structures were obtained. To further confirm the structural information of COFs, Fourier transforms infrared spectroscopy (FTIR) and 13C Nuclear Magnetic Resonance (NMR) were carried out for WTA-COF and WOTA-COF. As depicted in Fig. S3, for both WTA-COF and WOTA-COF, the successful preparation of the Schiff base structure was corroborated by the emerging characteristic peak of the −C=N-stretching vibrational peak (1666 cm−1 for WTA-COF, and 1670 cm−1 for WOTA-COF), and the disappearance of the −NH2-stretching vibrational peaks at 3348 cm−1 and 3366 cm−1 in the Wurster monomer. These FTIR data indicate the complete conversion from molecular building blocks to COFs. All peaks in the solid-state 13C NMR spectra of WTA-COF and WOTA-COF are marked in the indicated groups of the inset chemical structure. The resonance signals at 159, 145 and 128 ppm can be assigned to imine linkage, −C−N− and carbons on the benzene ring, respectively, in WTA-COF (Fig. 1e). Similarly, the main characteristic peaks in 13C CP-MAS spectrum of WOTA-COF can also be assigned (Fig. 1f). All above results confirmed the occurrence of Schiff base reactions, and the successful synthesis of highly crystalline, high BET surface area and large total pore volume COFs. The morphologies of the obtained COFs were assessed by scanning electron microscopy (SEM) and transmission electron microscope (TEM), where the WTA-COF was composed of microcrystalline nanosheets with ∼45 nm in thickness (Fig. 2 b); and the WOTA-COF displays the similar nanosheets (Fig. 2d). The crystalline structures of WTA-COF and WOTA-COF were visualized by high-resolution transmission electron microscopy (HRTEM). The clear lattice fringes of (200), (310) and (210) crystal faces were shown in Fig. 2(c and e) for both WTA-COF and WOTA-COF, further confirming the simulated crystal structure (Fig. 1b and c). The as-synthesized WTA-COF and WOTA-COF have intrinsic reductive triarylamine structures with restricted pore channels, and the palladium-based ORR catalysts are widely investigated due to their similar electron configuration and chemical properties to platinum [48–50]. Therefore, we performed in-situ restricted redox growth of Pd@COFs without extra reductants as an ORR catalyst to further investigate its activity. Hence, as a proof of concept, Pd2+ was used to form Pd@WTA-COF (or Pd@WOTA-COF) by soaking a defined amount of COFs in Pd(OAc)2 ethanol solutions, then ultrasonicated for 2 h at room temperature (Fig. 2a). As shown in Fig. S4, the PXRD patterns of Pd@WTA-COF and Pd@WOTA-COF show that the crystallinity of the COF frameworks is retained after introducing Pd; and the insets of Fig. S4 prove that Pd crystal formed. As shown in Fig. S5, both Pd@WTA-COF and Pd@WOTA-COF exhibit lower BET surface area and smaller total pore volume compared with the initial COFs, which may be due to the pores being occupied by Pd NPs. Therefore, the Pd NP loading causes a drastic reduction in the porosity of the COF compared with pristine WTA-COF and WOTA-COF, which inflecting the palladium reduction tended to occur inside the pores and the surface of COFs rather than in the solution. In addition, the TEM images exhibit that Pd NPs uniformly distributed in the 2D-COFs plane for both Pd@WTA-COF and Pd@WOTA-COF (Fig. 2f and h). The HRTEM images of Pd@WTA-COF and Pd@WOTA-COF display-two lattices spacing of ∼0.22 and ∼0.18 nm (Fig. 2g and i), which are attributed to Pd (111) and Pd (200) facets, respectively. The high-angle annular dark-field scanning transmission electron microscope (HAADF-STEM) and corresponding energy dispersive spectrometer (EDS) analysis prove the uniform distribution of C, O, and N, while Pd NPs distributed over the Pd@WTA-COF (Fig. 2j, l−n, Fig. S6a and b) and Pd@WOTA-COF matrix (Fig. 2o, q−s, Fig. S6c and d); and the above results further confirmed by EDS line scan (Fig. 2k and p). The above PXRD, EDS, TEM and HRTEM analysis revealed that the Pd NPs with good crystallinity formed without damaging the COFs frameworks. On account of the reductive nature of triarylamine, the Pd NPs can be reduced in the pores of COFs in situ. This in-situ reduction method was supposed to be important to get small and uniform nanoparticles in the pores of COFs, and then promote the homogeneous distribution and accessibility of active sites during the ORR process. In addition, the structural information of the COFs and the state of the complexed palladium have a strong influence on its electrical conductivity and catalytic activity, so the X-ray photoelectron spectroscopy (XPS) was conducted to explore the surface electronic properties and chemical state of Pd@WTA-COF and Pd@WOTA-COF. The typical features of C, N, O or Pd in all four samples are shown in the wide-scan XPS spectra (Fig. S7). For Pd@WTA-COF and Pd@WOTA-COF, Pd surface element contents were determined to be 9.38 and 8.77 atom%, respectively (Fig. 3 a). Fig. 3(b) displays the Pd 3d XPS spectra of Pd@WTA-COF and Pd@WOTA-COF, in which the characteristic peaks at 335.32 eV (Pd 3d 5/2) and 340.60 eV (Pd 3d 3/2) correspond to Pd0, and the other two peaks are attributed to Pd2+ [51–54]. Especially, compared with Pd2+, more Pd0 contents (63.15% for Pd@WTA-COF and 69.41% for Pd@WOTA-COF) proves that the Pd NPs formed successfully. In high-resolution C 1s spectra of WTA-COF and Pd@WTA-COF (Fig. 3c), the peaks located at 284.31, 284.80, 285.55, 286.90 and 290.73 eV are ascribed to C=C, C−C, C−N, C=N bonds and π−π satellite, respectively [55,56]. As shown in Fig. 3(d), the N 1s XPS spectrum for WTA-COF can be deconvoluted to binding energies of 398.56 and 399.39 eV, which are assigned to C−N=C and N−(C)3. However, the binding energies of C−N=C and N−(C)3 for Pd@WTA-COF are 399.24 and 400.09 eV [57,58], which are positively shifted from those of the pristine WTA-COF by 0.68 and 0.70 eV, respectively. For N species, the increase of binding energy is usually ascribed to the reduction of electrons around N. Meanwhile, the high-resolution N 1s spectra of Pd@WTA-COF show an extra peak corresponding to the Pd−N bond appearing at 398.10 eV compared with WTA-COF [59], indicating the interaction between Pd and N. Therefore, the interatomic charge transfer occurred from N to Pd, where the electron-rich configuration around Pd sites may get more moderate binding ability with oxygen to balance the adsorption and desorption for oxygen-containing intermediates during ORR process, then improving the ORR performance [50]. A similar phenomenon is also found in WOTA-COF and Pd@WOTA-COF systems (Fig. 3e and f). The generality of this inner-pore reduction nucleation methodology for reducing other metal and metal alloy nanoparticles was further demonstrated using other different metal ions under the same synthetic conditions, where the successful preparation of Au@COF, Pt@COF, AuPd@COF, AgPd@COF and PtPd@COF materials can be confirmed by XRD and SEM measurements (Fig. S8–12). For a high-efficiency ORR catalyst, one of the most critical factors is electrical conductivity. Therefore, we further analyzed the conductivity of the as-prepared catalysts, taking the Pd@WTA-COF case as an example, so as to reveal the relationship between the structure and electrical conductivity. As shown in Fig. 3(g), the enhanced electrical conductivity of WTA-COF (∼7.33*10−3 S m−1) was confirmed by electric conduction measurements, which is higher than that of previously reported WTA-COF [47]. The conductivity of WTA-COF-I2 (obtained by treating WTA-COF with I2) is up to 2.15*10−2 S m−1, which is almost three times larger than that of pristine WTA-COF but much lower than that of Pd@WTA-COF, reflecting radical cation, Pd species (including Pd NPs and Pd2+) as well as AcO- (stemmed from Pd(OAc)2) have an influence on the conductivity. Electron paramagnetic resonance (EPR) tests (Fig. 3h) provide radical-forming evidence that both COFs and Pd@COFs gave EPR signals. It is reasonable that the cationic radicals generated in the Wurster-type structure contributed to the high electrical conductivity of the WTA-COF. After encapsulating Pd NPs in WTA-COF, its conductivity is further improved (∼3.2*10−1 S m−1) due to the contribution of metal palladium, which is a benefit to electrocatalytic activities (Fig. 3i). For most pyrolysis-free COFs, the high ORR activity is often restricted byinsufficient electrical conductivity; and the common strategy to solve this problem is adding conductive carbon materials (e.g. carbon black, carbon nanotubes, Ketjenblack etc.). Our in-situ reduction method caused by unique triarylamine structure and high conductivity stemming from cationic radicals inspired us to directly evaluate the ORR activity of Pd@WTA-COF and Pd@WOTA-COF without the help of other conducting materials. The catalytic activity and stability of Pd@WTA-COF and Pd@WOTA-COF were tested by rotating ring-disk electrode measurements in 0.1 M KOH solution. For comparison, the commercial 20 wt% Pt/C and 10 wt% Pd/C electrodes were also tested under the same experimental conditions (Fig. S13), where the half-wave potentials (E 1/2) of Pt/C and Pd/C are 0.856 V and 0.760 V, respectively. As shown in Fig. 4 (a), the E 1/2 of Pd@WTA-COF and Pd@WOTA-COF were up to 0.865 V and 0.803 V, and the onset potential was 0.975 V and 0.931 V, evincing its high catalytic activity. It is worth noting that both the limit current density and E 1/2 of Pd@WTA-COF increased after adding 20% Ketjenblack (KB), which is due to the increas conductivity, and the promotion of dissolved oxygen rate in the electrolyte and the adsorption degree of oxygen on the sample surface in the presence of KB. In order to prove the importance of Pd nanoparticles, the ORR activities of pristine WTA-COF and WOTA-COF without the loading of Pd nanoparticles were also investigated. As shown in Fig. S14, both pristine WTA-COF and WOTA-COF exhibit smaller limiting current densities, lower E 1/2, and higher charge transfer resistance (R ct) than that of Pd@WTA-COF and Pd@WOTA-COF, reflecting Pd NPs was the main active centers. To further quantitatively analyze the reaction kinetic activity of the as-prepared Pd@WTA-COF and Pd@WOTA-COF, the Tafel slopes were calculated. As shown in Fig. 4(b), both Pd@WTA-COF and Pd@WOTA-COF exhibit a lower linear slope of 39.7 mV dec−1 and 58.5 mV dec−1, indicating favorable reaction kinetics in ORR process. Similar results can be obtained from cyclic voltammetry (CV) curves (Fig. 4c), measured in 0.1 M KOH solution saturated with O2, in which Pd@WTA-COF and Pd@WOTA-COF exhibit a significant reaction peak at 0.855 V and 0.812 V, respectively. An average transferred electron number (n) of 3.84 and 3.92 can be determined from the Koutechy–Levich (K–L) plot at different rotation rates from 400 to 2400 r min−1 for Pd@WTA-COF and Pd@WOTA-COF, respectively (Fig. 4d–f), signifying a four-electron ORR pathway. Although the electronic conductivity has been proved by the above analysis, the charge transfer rate of electrocatalysts during the catalytic process should be further investigated. Thus, electrochemical impedance spectroscopic (EIS) was carried out to analyze charge transfer resistances (R ct) at 0.8 V. As shown in Fig. 4(g), Pd@WTA-COF and Pd@WOTA-COF exhibit a much lower R ct compared with 10 wt% Pd/C, even lower than that of 20 wt% Pt/C, indicating the fast reaction kinetics stemmed from the in-situ reduction process of Pd NPs. In addition to the catalytic activity, the stability of the catalyst is an important basis for evaluating the performance of the catalyst. Firstly, we assessed the resistance to methanol crossover (Fig. 4h), in which the effect of the addition of CH3OH on the polarization current is negligible compared with 20 wt% Pt/C. The chronoamperometric response in Fig. 4(i) displays only ∼6.3% and ∼8.2% decrease of current density at a constant voltage of 0.8 V (vs RHE) over 20,000 s for Pd@WTA-COF and Pd@WOTA-COF, respectively, whereas a ∼22% decrease occurred in Pt/C. The accelerated stability test of Pd@WTA-COF was carried out by cycling between 0.6 and 1.0 V versus RHE at 100 mV s−1 for 10, 000 cycles. LSV curve after 10, 000 cycles are shown in Fig. S15, where the E 1/2 and limiting current density are slightly better than the initial one; one reason should be attributed to the enhanced infiltration between the electrolyte and the pores of COFs (activation effect), which is stemmed from the porous nature of wurster-COF. The other reason is that Pd NPs are protected by COFs from being leached and from aggregating during cycling, which is mainly due to the confinement effect of porous wurster-COF on Pd NPs (Fig. S16). Combined with the activation effect and confinement effect during electrochemical testing, the ORR performance of Pd@WTA-COF is slightly improved after CV stabilization. The similar phenomenon is also reported by Gong et. al. [60] Based on the above analysis, it is reasonable to state that the excellent ORR performance of Pd@WTA-COF and Pd@WOTA-COF stem from their uniformly distributed Pd NPs and high conductivity. It can be observed that the synthesized Pd@WTA-COF shows high E 1/2 and low Tafel slope, and is comparable or even superior to many other Pd-based ORR electrocatalysts (Table S1). It is well-known that a larger electrode area is required for industrial applications of ORR (e.g., H2–O2 Fuel Cells); However, when it grows on the conductive substrate, COF will actually form an insulating layer with high resistance on the surface due to their poor conductivity, which greatly deteriorates their electrocatalytic performance. The high conductivity of Wurster-type COFs can overcome the problem of large-area electrode preparation caused by the lack of conductivity. As a proof-of-concept, carbon cloth (CC, 1 cm × 1 cm) was chosen as the nucleation substrate due to its ability to serve as nucleation sites for many polymers. In order to make COF grow more evenly on the surface of the carbon cloth, we take advantage of the dynamic nature of COF, and use COF as a precursor to growing a uniform COF electrocatalyst thin layer on the surface of the CC through a unique dissolution–recrystallization process (WTA-COF/CC, and WOTA-COF/CC) (Fig. 5 a) [61,62]. To decorate Pd NPs, the prepared WTA-COF/CC and WOTA-COF/CC were immersed in a Pd(OAc)2 acetonitrile solution. As shown in Fig. 5(b and d) and Fig. S17, the SEM images and corresponding EDS mapping of Pd@WTA-COF/CC and Pd@WOTA-COF/CC clearly revealed that large amounts of Pd@COF NPs were deposited on the surface of CC, and and the Pd NPs still grow in situ in the pore of the COF. The EDS elemental mapping images show that Pd was well-distributed over the whole CC (Fig. 5c and e). The ORR performance has been tested for Pd@COF/CC in 0.1 M KOH to extend its application, where the Pd@COF/CC exhibits a large ultimate current density, high E 1/2, faster electron transfer rate, as well as good stability (Fig. 5f–h). In order to show the unique advantage of dissolution–recrystallization process, COFs grew on CC by direct polycondensation of the monomers (Wurster and TA for WTA-COF, or Wurster and (OMe)2TA for WOTA-COF) (Fig. S18a). The SEM images (Fig. S18b and c) verify that WTA-COF and WOTA-COF growth uncontrolled thicker layers composed of nanosheets on the surface of CC. The ORR analysis exhibits an obvious decrease in ultimate current density and E 1/2, indicating that the too-thick COF layer led to a decrease in the electrocatalytic performance (Fig. S18d). To investigate the structure change of electrocatalysts (Pd@WTA-COF, Pd@WOTA-COF, Pd@WTA-COF/CC and Pd@WOTA-COF/CC) after stability tests, we have studied more related structural information after the electrochemical stability test. As illustrated in Fig. S19, the morphology and distribution of elements for Pd@WTA-COF and Pd@WOTA-COF are well maintained as evidenced by SEM and corresponding EDS mapping after stability tests. Furthermore, the Pd 3d profiles obtained by XPS measurements reveal that the Pd species on the surface of Pd@WTA-COF and Pd@WOTA-COF have not changed significantly before and after the stability test (Fig. S19c and g). In addition, when they are grown on carbon cloth, Pd@WTA-COF/CC and Pd@WOTA-COF/CC also exhibit intact morphology, similar to Pd@WTA-COF and Pd@WOTA-COF (Fig. S20) after the electrochemical stability test. The above confirmed the stability of our electrocatalyst. To demonstrate the practical application of Wurster-typy COF in real zinc-air batteries (ZABs), a primary Zn-air battery was constructed, in which the Pd@WTA-COF (blended with the same weight KB) electrocatalyst-loaded carbon cloth (the mass loading is 1.0 mg cm−2) was used as the air cathode and paired with a zinc plate in 6.0 M KOH (Fig. 6 a). Fig. 6(b) shows that the open-circuit potential of the ZABs employing Pd@WTA-COF as the air cathode was 1.518 V, which is slightly higher than that of battery using commercial Pt/C (1.512 V) as air cathode. The maximum power density of Pd@WTA-COF is as high as 189.7 mW cm−2, which is higher than that of commercial Pt/C (20 wt%) catalyst (152.2 mW cm−2) (Fig. 6d). Moreover, galvanostatic discharging curves (Fig. 6e) demonstrate the rate performance under different current densities ranging from 2 to 50 mA cm−2, where the galvanostatic discharge voltage of Pd@WTA-COF is gradually close to that of Pt/C with increasing current densities; while with the current density being again decreased back, the galvanostatic discharge voltage of Pd@WTA-COF has begun to eclipse that of Pt/C. As shown in Fig. 6(f), the specific capacity of Pd@WTA-COF normalized to the mass of consumed Zn is 770 mA h gZn −1 at a current density of 10 mA cm−2, which is much higher than that of the Pt/C based battery (672 mA h gZn −1), indicating that Pd@WTA-COF can more effectively utilize the zinc plate in zinc−air batteries compared to Pt/C. In Fig. 6(c), the ZABs using Pd@WTA-COF catalyst on the air electrode can easily power up a light-emitting diode panel, which further proves its feasibility in practical applications. 4 Conclusions In summary, we have successfully constructed and optimized Kagome COFs with predesigned Wurster-type redox sites for confining the growth of palladium NPs. Meanwhile, the Wurster-type unit was oxidized to a radical cation structure, which affords radical cation COFs with conductivity as high as 3.2*10−1 S m−1. Therefore, the Pd@COFs can be used as an ORR electrocatalyst without pyrolysis or additional commercial carbon materials. The Pd@WTA-COF shows excellent electrocatalytic activity toward ORR, showing excellent activities and fast kinetics with a remarkable half-wave potential of 0.865 V, an ultralow Tafel slope of 39.7 mV dec−1, and the lower R ct in alkaline media even in the absence of extra commercial conductive fillers. The high performance for ORR catalysis is attributed to the enhancement of conductivity and uniform Pd NPs in the Kagome COFs. Our work not only provides a facile strategy to directly fabricate metal NPs uniformly distributed in highly conductive COFs with superior electrochemical performance for oxygen reduction; but more importantly, the highly conductive radical cation COFs eliminates the use of carbon filler, thus significantly increasing volumetric activity which is of vital importance for their practical applications. Declaration of competing interest The authors declare that they have no known competing financial interests or personal relationships that could have appeared to influence the work reported in this paper. Acknowledgments This work was financially supported by the National Natural Science Foundation of China (21674068, 52173133, 52161145402), the Sichuan Science and Technology Department (2021YFH0180). We would like to thank Daichuan Ma and Daibing Luo of the Analytical & Testing Center of Sichuan University for their help with computational simulation. Appendix A Supplementary material Supplementary data to this article can be found online at https://doi.org/10.1016/j.jechem.2022.11.032. Appendix A Supplementary material The following are the Supplementary data to this article: Supplementary data 1 References [1] Y. Feng K. Song W. Zhang X. Zhou S.J. Yoo J.-G. Kim S. Qiao Y. Qi X. Zou Z. Chen T. Qin N. Yue Z. Wang D. Li W. Zheng J. Energy Chem. 70 2022 211 218 Y. Feng, K. Song, W. Zhang, X. Zhou, S.J. Yoo, J.-G. Kim, S. Qiao, Y. Qi, X. Zou, Z. Chen, T. Qin, N. Yue, Z. Wang, D. Li, W. Zheng, J. Energy Chem. 70 (2022) 211–218. [2] Z.-F. Huang J. Wang Y. Peng C.-Y. Jung A. Fisher X. Wang Adv. Energy Mater. 7 2017 1700544 Z.-F. Huang, J. Wang, Y. Peng, C.-Y. Jung, A. Fisher, X. Wang, Adv. Energy Mater. 7 (2017) 1700544. [3] H. Xu H. Shang C. Wang Y. Du Small 17 2021 2005092 H. Xu, H. Shang, C. Wang, Y. Du, Small 17 (2021) 2005092. [4] S. Zaman L. Huang A.I. Douka H. Yang B. You B.Y. Xia Angew. Chem. Int. Ed. 60 2021 17832 17852 S. Zaman, L. Huang, A.I. Douka, H. Yang, B. You, B.Y. Xia, Angew. Chem. Int. Ed. 60 (2021) 17832–17852. [5] T. Zhou W. Xu N. Zhang Z. Du C. Zhong W. Yan H. Ju W. Chu H. Jiang C. Wu Y. Xie Adv. Mater. 31 2019 1807468 T. Zhou, W. Xu, N. Zhang, Z. Du, C. Zhong, W. Yan, H. Ju, W. Chu, H. Jiang, C. Wu, Y. Xie, Adv. Mater. 31 (2019) 1807468. [6] Y. Chen R. Gao S. Ji H. Li K. Tang P. Jiang H. Hu Z. Zhang H. Hao Q. Qu X. Liang W. Chen J. Dong D. Wang Y. Li Angew. Chem. Int. Ed. 60 2021 3212 3221 Y. Chen, R. Gao, S. Ji, H. Li, K. Tang, P. Jiang, H. Hu, Z. Zhang, H. Hao, Q. Qu, X. Liang, W. Chen, J. Dong, D. Wang, Y. Li, Angew. Chem. Int. Ed. 60 (2021) 3212–3221. [7] M. Liu Z. Zhao X. Duan Y. Huang Adv. Mater. 31 2019 1802234 M. Liu, Z. Zhao, X. Duan, Y. Huang, Adv. Mater. 31 (2019) 1802234. [8] T. Shen X. Huang S. Xi W. Li S. Sun Y. Hou J. Energy Chem. 68 2022 184 194 T. Shen, X. Huang, S. Xi, W. Li, S. Sun, Y. Hou, J. Energy Chem. 68 (2022) 184–194. [9] X. Tian X.F. Lu B.Y. Xia X.W. Lou Joule 4 2020 45 68 X. Tian, X.F. Lu, B.Y. Xia, X.W. Lou, Joule 4 (2020) 45–68. [10] J. Mao P. Liu J. Li J. Yan S. Ye W. Song J. Energy Chem. 73 2022 240 247 J. Mao, P. Liu, J. Li, J. Yan, S. Ye, W. Song, J. Energy Chem. 73 (2022) 240–247. [11] H. Wang W. Wang H. Yu Q. Mao Y. Xu X. Li Z. Wang L. Wang Appl. Catal., B 307 2022 121172 H. Wang, W. Wang, H. Yu, Q. Mao, Y. Xu, X. Li, Z. Wang, L. Wang, Appl. Catal., B 307 (2022) 121172. [12] M. Xiao J. Zhu G. Li N. Li S. Li Z.P. Cano L. Ma P. Cui P. Xu G. Jiang H. Jin S. Wang T. Wu J. Lu A. Yu D. Su Z. Chen Angew. Chem. Int. Ed. 58 2019 9640 9645 M. Xiao, J. Zhu, G. Li, N. Li, S. Li, Z.P. Cano, L. Ma, P. Cui, P. Xu, G. Jiang, H. Jin, S. Wang, T. Wu, J. Lu, A. Yu, D. Su, Z. Chen, Angew. Chem. Int. Ed. 58 (2019) 9640–9645. [13] C. Zhang J. Sha H. Fei M. Liu S. Yazdi J. Zhang Q. Zhong X. Zou N. Zhao H. Yu Z. Jiang E. Ringe B.I. Yakobson J. Dong D. Chen J.M. Tour ACS Nano 11 2017 6930 6941 C. Zhang, J. Sha, H. Fei, M. Liu, S. Yazdi, J. Zhang, Q. Zhong, X. Zou, N. Zhao, H. Yu, Z. Jiang, E. Ringe, B.I. Yakobson, J. Dong, D. Chen, J.M. Tour, ACS Nano 11 (2017) 6930–6941. [14] J. Zhang Y. Yuan L. Gao G. Zeng M. Li H. Huang Adv. Mater. 33 2021 2006494 J. Zhang, Y. Yuan, L. Gao, G. Zeng, M. Li, H. Huang, Adv. Mater. 33 (2021) 2006494. [15] H. Wang H. Ren S. Liu S. Yin S. Jiao Y. Xu X. Li Z. Wang L. Wang Chem. Eng. J. 438 2022 135539 H. Wang, H. Ren, S. Liu, S. Yin, S. Jiao, Y. Xu, X. Li, Z. Wang, L. Wang, Chem. Eng. J. 438 (2022) 135539. [16] X. Zheng N. Wang Y. Zhao Y. Wu X. Wang Y. Zhao Appl. Surf. Sci. 595 2022 153512 X. Zheng, N. Wang, Y. Zhao, Y. Wu, X. Wang, Y. Zhao, Appl. Surf. Sci. 595 (2022) 153512. [17] Q. Liu Z. Li X. Zhou J. Xiao Z. Han X. Jiang G. Fu Y. Tang Adv. Energy Sustain. Res. 3 2022 2200067 Q. Liu, Z. Li, X. Zhou, J. Xiao, Z. Han, X. Jiang, G. Fu, Y. Tang, Advanced Energy and Sustainability Research 3 (2022) 2200067. [18] H. Erikson A. Sarapuu J. Solla-Gullón K. Tammeveski J. Electroanal. Chem. 780 2016 327 336 H. Erikson, A. Sarapuu, J. Solla-Gullón, K. Tammeveski, J. Electroanal. Chem. 780 (2016) 327-336. [19] M. Lüsi H. Erikson H.-M. Piirsoo P. Paiste J. Aruväli A. Kikas V. Kisand A. Tamm K. Tammeveski J. Electroanal. Chem. 917 2022 116391 M. Lüsi, H. Erikson, H.-M. Piirsoo, P. Paiste, J. Aruväli, A. Kikas, V. Kisand, A. Tamm, K. Tammeveski, J. Electroanal. Chem. 917 (2022) 116391. [20] L. Karuppasamy L. Gurusamy S. Anandan C.H. Liu J.J. Wu Mater. Today Chem. 24 2022 100799 L. Karuppasamy, L. Gurusamy, S. Anandan, C.H. Liu, J.J. Wu, Materials Today Chemistry 24 (2022) 100799. [21] J. Li H. Zhou H. Zhuo Z. Wei G. Zhuang X. Zhong S. Deng X. Li J. Wang J. Mater. Chem. A 6 2018 2264 2272 J. Li, H. Zhou, H. Zhuo, Z. Wei, G. Zhuang, X. Zhong, S. Deng, X. Li, J. Wang, J. Mater. Chem. A 6 (2018) 2264-2272. [22] J. Hwang Y. Kim M. Karuppnan T. Lim O.J. Kwon Electrocatalysis 11 2020 77 85 J. Hwang, Y. Kim, M. Karuppnan, T. Lim, O.J. Kwon, Electrocatalysis 11 (2020) 77-85. [23] M. Lüsi H. Erikson A. Treshchalov M. Rähn M. Merisalu A. Kikas V. Kisand V. Sammelselg K. Tammeveski Nanotechnology 32 2021 035401 M. Lüsi, H. Erikson, A. Treshchalov, M. Rähn, M. Merisalu, A. Kikas, V. Kisand, V. Sammelselg, K. Tammeveski, Nanotechnology 32 (2021) 035401. [24] H. Liu L. Hu W. Cai X. Feng F. Zhang R. Shao L. Wang B. Wang ChemElectroChem 9 2022 e202200123 H. Liu, L. Hu, W. Cai, X. Feng, F. Zhang, R. Shao, L. Wang, B. Wang, ChemElectroChem 9 (2022) e202200123. [25] M.H. Naveen Y. Huang S. Bisalere Kantharajappa K.-D. Seo D.-S. Park Y.-B. Shim ACS Appl. Energy Mater. 4 2021 575 585 M.H. Naveen, Y. Huang, S. Bisalere Kantharajappa, K.-D. Seo, D.-S. Park, Y.-B. Shim, ACS Appl. Energy Mater. 4 (2021) 575–585. [26] M. Lüsi H. Erikson K. Tammeveski A. Treshchalov A. Kikas H.-M. Piirsoo V. Kisand A. Tamm J. Aruväli J. Solla-Gullón J.M. Feliu Electrochim. Acta 394 2021 139132 M. Lüsi, H. Erikson, K. Tammeveski, A. Treshchalov, A. Kikas, H.-M. Piirsoo, V. Kisand, A. Tamm, J. Aruväli, J. Solla-Gullón, J.M. Feliu, Electrochim. Acta 394 (2021) 139132. [27] Y. Sun W. Zhang Q. Wang N. Han A. Núñez-Delgado Y. Cao W. Si F. Wang S. Liu Environ. Res. 202 2021 111684 Y. Sun, W. Zhang, Q. Wang, N. Han, A. Núñez-Delgado, Y. Cao, W. Si, F. Wang, S. Liu, Environ. Res. 202 (2021) 111684. [28] A. Parkash ECS J. Solid State Sci. Technol. 9 2020 065021 A. Parkash, ECS J. Solid State Sci. Technol. 9 (2020) 065021. [29] F. Zheng C. Zhang X. Gao C. Du Z. Zhuang W. Chen Electrochim. Acta 306 2019 627 634 F. Zheng, C. Zhang, X. Gao, C. Du, Z. Zhuang, W. Chen, Electrochim. Acta 306 (2019) 627–634. [30] L. Zhai S. Yang X. Yang W. Ye J. Wang W. Chen Y. Guo L. Mi Z. Wu C. Soutis Q. Xu Z. Jiang Chem. Mater. 32 2020 9747 9752 L. Zhai, S. Yang, X. Yang, W. Ye, J. Wang, W. Chen, Y. Guo, L. Mi, Z. Wu, C. Soutis, Q. Xu, Z. Jiang, Chem. Mater. 32 (2020) 9747–9752. [31] X. Cui S. Lei A.C. Wang L. Gao Q. Zhang Y. Yang Z. Lin Nano Energy 70 2020 104525 X. Cui, S. Lei, A.C. Wang, L. Gao, Q. Zhang, Y. Yang, Z. Lin, Nano Energy 70 (2020) 104525. [32] K. Geng T. He R. Liu S. Dalapati K.T. Tan Z. Li S. Tao Y. Gong Q. Jiang D. Jiang Chem. Rev. 120 2020 8814 8933 K. Geng, T. He, R. Liu, S. Dalapati, K.T. Tan, Z. Li, S. Tao, Y. Gong, Q. Jiang, D. Jiang, Chem. Rev. 120 (2020) 8814–8933. [33] C.-Y. Lin D. Zhang Z. Zhao Z. Xia Adv. Mater. 30 2018 1703646 C.-Y. Lin, D. Zhang, Z. Zhao, Z. Xia, Adv. Mater. 30 (2018) 1703646. [34] J. Ning Y. Gao X. Cao H. Wei B. Wang L. Hao J. Energy Chem. 65 2022 490 496 J. Ning, Y. Gao, X. Cao, H. Wei, B. Wang, L. Hao, J. Energy Chem. 65 (2022) 490–496. [35] M. Zhong M. Liu N. Li X.-H. Bu J. Energy Chem. 63 2021 113 129 M. Zhong, M. Liu, N. Li, X.-H. Bu, J. Energy Chem. 63 (2021) 113–129. [36] S. Huang K. Chen T.-T. Li Coord. Chem. Rev. 464 2022 214563 S. Huang, K. Chen, T.-T. Li, Coord. Chem. Rev. 464 (2022) 214563. [37] J. Mahmood F. Li S.-M. Jung M.S. Okyay I. Ahmad S.-J. Kim N. Park H.Y. Jeong J.-B. Baek Nat. Nanotechnol. 12 2017 441 446 J. Mahmood, F. Li, S.-M. Jung, M.S. Okyay, I. Ahmad, S.-J. Kim, N. Park, H.Y. Jeong, J.-B. Baek, Nat. Nanotechnol. 12 (2017) 441–446. [38] D.-G. Wang T. Qiu W. Guo Z. Liang H. Tabassum D. Xia R. Zou Energy Environ. Sci. 14 2021 688 728 D.-G. Wang, T. Qiu, W. Guo, Z. Liang, H. Tabassum, D. Xia, R. Zou, Energy Environ. Sci. 14 (2021) 688–728. [39] R. Kamai K. Kamiya K. Hashimoto S. Nakanishi Angew. Chem. Int. Ed. 55 2016 13184 13188 R. Kamai, K. Kamiya, K. Hashimoto, S. Nakanishi, Angew. Chem. Int. Ed. 55 (2016) 13184–13188. [40] D. Mullangi V. Dhavale S. Shalini S. Nandi S. Collins T. Woo S. Kurungot R. Vaidhyanathan Adv. Energy Mater. 6 2016 1600110 D. Mullangi, V. Dhavale, S. Shalini, S. Nandi, S. Collins, T. Woo, S. Kurungot, R. Vaidhyanathan, Adv. Energy Mater. 6 (2016) 1600110. [41] S. Nandi S.K. Singh D. Mullangi R. Illathvalappil L. George C.P. Vinod S. Kurungot R. Vaidhyanathan Adv. Energy Mater. 6 2016 1601189 S. Nandi, S.K. Singh, D. Mullangi, R. Illathvalappil, L. George, C.P. Vinod, S. Kurungot, R. Vaidhyanathan, Adv. Energy Mater. 6 (2016) 1601189. [42] E. Park J. Jack Y. Hu S. Wan S. Huang Y. Jin P.-C. Maness S. Yazdi Z. Ren W. Zhang Nanoscale 12 2020 2596 2602 E. Park, J. Jack, Y. Hu, S. Wan, S. Huang, Y. Jin, P.-C. Maness, S. Yazdi, Z. Ren, W. Zhang, Nanoscale 12 (2020) 2596–2602. [43] W. Tu Y. Xu S. Yin R. Xu Adv. Mater. 30 2018 1707582 W. Tu, Y. Xu, S. Yin, R. Xu, Adv. Mater. 30 (2018) 1707582. [44] Y.E. Cheon M.P. Suh Angew. Chem. Int. Ed. 48 2009 2899 2903 Y.E. Cheon, M.P. Suh, Angew. Chem. Int. Ed. 48 (2009) 2899–2903. [45] Q. Hao Z.-J. Li B. Bai X. Zhang Y.-W. Zhong L.-J. Wan D. Wang Angew. Chem. Int. Ed. 60 2021 12498 12503 Q. Hao, Z.-J. Li, B. Bai, X. Zhang, Y.-W. Zhong, L.-J. Wan, D. Wang, Angew. Chem. Int. Ed. 60 (2021) 12498–12503. [46] C. Krishnaraj H. Sekhar Jena L. Bourda A. Laemont P. Pachfule J. Roeser C.V. Chandran S. Borgmans S.M.J. Rogge K. Leus C.V. Stevens J.A. Martens V. Van Speybroeck E. Breynaert A. Thomas P. Van Der Voort J. Am. Chem. Soc. 142 2020 20107 20116 C. Krishnaraj, H. Sekhar Jena, L. Bourda, A. Laemont, P. Pachfule, J. Roeser, C.V. Chandran, S. Borgmans, S.M.J. Rogge, K. Leus, C.V. Stevens, J.A. Martens, V. Van Speybroeck, E. Breynaert, A. Thomas, P. Van Der Voort, J. Am. Chem. Soc. 142 (2020) 20107–20116. [47] J.M. Rotter R. Guntermann M. Auth A. Mähringer A. Sperlich V. Dyakonov D.D. Medina T. Bein Chem. Sci. 11 2020 12843 12853 J.M. Rotter, R. Guntermann, M. Auth, A. Mähringer, A. Sperlich, V. Dyakonov, D.D. Medina, T. Bein, Chem. Sci. 11 (2020) 12843–12853. [48] H. Liu C. Koenigsmann R. Adzic S. Wong ACS Catal. 4 2014 2544 2555 H. Liu, C. Koenigsmann, R. Adzic, S. Wong, ACS Catal. 4 (2014) 2544–2555. [49] B. Xu Y. Zhang L. Li Q. Shao X. Huang Coord. Chem. Rev. 459 2022 214388 B. Xu, Y. Zhang, L. Li, Q. Shao, X. Huang, Coord. Chem. Rev. 459 (2022) 214388. [50] H. Yu T. Zhou Z. Wang Y. Xu X. Li L. Wang H. Wang Angew. Chem. Int. Ed. 60 2021 12027 12031 H. Yu, T. Zhou, Z. Wang, Y. Xu, X. Li, L. Wang, H. Wang, Angew. Chem. Int. Ed. 60 (2021) 12027–12031. [51] S. Mondal S. Ghosh C.R. Raj ACS Omega 3 2018 622 630 S. Mondal, S. Ghosh, C.R. Raj, ACS Omega 3 (2018) 622–630. [52] X. Qiu H. Zhang Y. Dai F. Zhang P. Wu P. Wu Y. Tang Catalysts 5 2015 992 1002 X. Qiu, H. Zhang, Y. Dai, F. Zhang, P. Wu, P. Wu, Y. Tang, Catalysts 5 (2015) 992–1002. [53] X. Wang J. Chen J. Zeng Q. Wang Z. Li R. Qin C. Wu Z. Xie L. Zheng Nanoscale 9 2017 6643 6648 X. Wang, J. Chen, J. Zeng, Q. Wang, Z. Li, R. Qin, C. Wu, Z. Xie, L. Zheng, Nanoscale 9 (2017) 6643–6648. [54] J.C. Zhou C.M. Soto M.-S. Chen M.A. Bruckman M.H. Moore E. Barry B.R. Ratna P.E. Pehrsson B.R. Spies T.S. Confer J. Nanobiotechnol. 10 2012 18 J.C. Zhou, C.M. Soto, M.-S. Chen, M.A. Bruckman, M.H. Moore, E. Barry, B.R. Ratna, P.E. Pehrsson, B.R. Spies, T.S. Confer, J. Nanobiotechnol. 10 (2012) 18. [55] R. Shi L. Liu Y. Lu C. Wang Y. Li L. Li Z. Yan J. Chen Nat. Commun. 11 2020 178 R. Shi, L. Liu, Y. Lu, C. Wang, Y. Li, L. Li, Z. Yan, J. Chen, Nat. Commun. 11 (2020) 178. [56] L. Zhang X. Wang R. Wang M. Hong Chem. Mater. 27 2015 7610 7618 L. Zhang, X. Wang, R. Wang, M. Hong, Chem. Mater. 27 (2015) 7610–7618. [57] W. Wang H. Zhang S. Zhang Y. Liu G. Wang C. Sun H. Zhao Angew. Chem. Int. Ed. 58 2019 16644 16650 W. Wang, H. Zhang, S. Zhang, Y. Liu, G. Wang, C. Sun, H. Zhao, Angew. Chem. Int. Ed. 58 (2019) 16644–16650. [58] X. Zhang X. Luo X. Zheng X. Wu H. Xu Small 15 2019 1903643 X. Zhang, X. Luo, X. Zheng, X. Wu, H. Xu, Small 15 (2019) 1903643. [59] S. Zhou L. Shang Y. Zhao R. Shi G.I.N. Waterhouse Y.-C. Huang L. Zheng T. Zhang Adv. Mater. 31 2019 1900509 S. Zhou, L. Shang, Y. Zhao, R. Shi, G.I.N. Waterhouse, Y.-C. Huang, L. Zheng, T. Zhang, Adv. Mater. 31 (2019) 1900509. [60] Q. He T. Xu J. Li J. Wang C. Jin Q. Chen X. Gu X. Wang J. Wei H. Duan Y. Gong Adv. Energy Mater. 12 2022 2200849 Q. He, T. Xu, J. Li, J. Wang, C. Jin, Q. Chen, X. Gu, X. Wang, J. Wei, H. Duan, Y. Gong, Adv. Energy Mater. 12 (2022) 2200849. [61] W. Huang Y. Jiang X. Li X. Li J. Wang Q. Wu X. Liu ACS Appl. Mater. Interfaces 5 2013 8845 8849 W. Huang, Y. Jiang, X. Li, X. Li, J. Wang, Q. Wu, X. Liu, ACS Appl. Mater. Interfaces 5 (2013) 8845–8849. [62] L. Yang Q. Guo H. Kang R. Chen Y. Liu D. Wei Chem. Mater. 32 2020 5634 5640 L. Yang, Q. Guo, H. Kang, R. Chen, Y. Liu, D. Wei, Chem. Mater. 32 (2020) 5634–5640.",
      "scopus-id": "85143717186",
      "coredata": {
        "eid": "1-s2.0-S2095495622006295",
        "dc:description": "Covalent organic frameworks (COFs) have emerged as a class of promising supports for electrocatalysis because of their advantages including good crystallinity, highly ordered pores, and structural diversity. However, their poor conductivity represents the main obstruction to their practical application. Here, we reported a novel synthesis strategy for synergistically endowing a triphenylamine-based COFs with improved electrical conductivity and excellent catalytic activity for oxygen reduction, via the in-situ redox deposition and confined growth of palladium nanoparticles inside the porous structure of COFs using reductive triphenylamine frameworks as reducing agent; meanwhile, the triphenylamine unit was oxidized to radical cation structure and affords radical cation COFs with conductivity as high as 3.2*10−1 S m−1. Such a uniform confine palladium nanoparticle on highly conductive COFs makes it an efficient electrocatalyst for four-electron oxygen reduction reaction (4e-ORR), showing excellent activities and fast kinetics with a remarkable half-wave potential (E 1/2) of 0.865 V and an ultralow Tafel slope of 39.7 mV dec−1 in alkaline media even in the absence of extra commercial conductive fillers. The generality of this strategy was proved by preparing the different metal and metal alloy nanoparticles supported on COFs (Au@COF, Pt@COF, AuPd@COF, AgPd@COF, and PtPd@COF) using reductive triphenylamine frameworks as reducing agent. This work not only provides a facile strategy for the fabrication of highly conductive COF supported ORR electrocatalysts, but also sheds new light on the practical application of Zn-air battery.",
        "openArchiveArticle": "false",
        "prism:coverDate": "2023-02-28",
        "openaccessUserLicense": null,
        "prism:aggregationType": "Journal",
        "prism:url": "https://api.elsevier.com/content/article/pii/S2095495622006295",
        "dc:creator": [
          {
            "@_fa": "true",
            "$": "Wang, Weiwen"
          },
          {
            "@_fa": "true",
            "$": "Zhang, Lu"
          },
          {
            "@_fa": "true",
            "$": "Wang, Tianping"
          },
          {
            "@_fa": "true",
            "$": "Zhang, Zhen"
          },
          {
            "@_fa": "true",
            "$": "Wang, Xiangnan"
          },
          {
            "@_fa": "true",
            "$": "Cheng, Chong"
          },
          {
            "@_fa": "true",
            "$": "Liu, Xikui"
          }
        ],
        "link": [
          {
            "@_fa": "true",
            "@rel": "self",
            "@href": "https://api.elsevier.com/content/article/pii/S2095495622006295"
          },
          {
            "@_fa": "true",
            "@rel": "scidir",
            "@href": "https://www.sciencedirect.com/science/article/pii/S2095495622006295"
          }
        ],
        "dc:format": "application/json",
        "openaccessType": null,
        "pii": "S2095-4956(22)00629-5",
        "prism:volume": "77",
        "prism:publisher": "Science Press and Dalian Institute of Chemical Physics, Chinese Academy of Sciences.",
        "dc:title": "Inner-pore reduction nucleation of palladium nanoparticles in highly conductive wurster-type covalent organic frameworks for efficient oxygen reduction electrocatalysis",
        "prism:copyright": "© 2022 Science Press and Dalian Institute of Chemical Physics, Chinese Academy of Sciences. All rights reserved.",
        "openaccess": "0",
        "prism:issn": "20954956",
        "dcterms:subject": [
          {
            "@_fa": "true",
            "$": "Covalent organic frameworks"
          },
          {
            "@_fa": "true",
            "$": "Wurster-type structure"
          },
          {
            "@_fa": "true",
            "$": "In-situ reduction nucleation"
          },
          {
            "@_fa": "true",
            "$": "Palladium nanoparticles"
          },
          {
            "@_fa": "true",
            "$": "Oxygen reduction electrocatalysis"
          }
        ],
        "openaccessArticle": "false",
        "prism:publicationName": "Journal of Energy Chemistry",
        "openaccessSponsorType": null,
        "prism:pageRange": "543-552",
        "prism:endingPage": "552",
        "pubType": "fla",
        "prism:coverDisplayDate": "February 2023",
        "prism:doi": "10.1016/j.jechem.2022.11.032",
        "prism:startingPage": "543",
        "dc:identifier": "doi:10.1016/j.jechem.2022.11.032",
        "openaccessSponsorName": null
      },
      "objects": {
        "object": [
          {
            "@category": "standard",
            "@height": "94",
            "@width": "298",
            "@_fa": "true",
            "$": "https://api.elsevier.com/content/object/eid/1-s2.0-S2095495622006295-fx1.jpg?httpAccept=%2A%2F%2A",
            "@multimediatype": "JPEG image file",
            "@type": "IMAGE-DOWNSAMPLED",
            "@size": "5219",
            "@ref": "fx1",
            "@mimetype": "image/jpeg"
          },
          {
            "@category": "standard",
            "@height": "200",
            "@width": "399",
            "@_fa": "true",
            "$": "https://api.elsevier.com/content/object/eid/1-s2.0-S2095495622006295-ga1.jpg?httpAccept=%2A%2F%2A",
            "@multimediatype": "JPEG image file",
            "@type": "IMAGE-DOWNSAMPLED",
            "@size": "34139",
            "@ref": "ga1",
            "@mimetype": "image/jpeg"
          },
          {
            "@category": "standard",
            "@height": "607",
            "@width": "662",
            "@_fa": "true",
            "$": "https://api.elsevier.com/content/object/eid/1-s2.0-S2095495622006295-gr1.jpg?httpAccept=%2A%2F%2A",
            "@multimediatype": "JPEG image file",
            "@type": "IMAGE-DOWNSAMPLED",
            "@size": "128637",
            "@ref": "gr1",
            "@mimetype": "image/jpeg"
          },
          {
            "@category": "standard",
            "@height": "458",
            "@width": "535",
            "@_fa": "true",
            "$": "https://api.elsevier.com/content/object/eid/1-s2.0-S2095495622006295-gr2.jpg?httpAccept=%2A%2F%2A",
            "@multimediatype": "JPEG image file",
            "@type": "IMAGE-DOWNSAMPLED",
            "@size": "110900",
            "@ref": "gr2",
            "@mimetype": "image/jpeg"
          },
          {
            "@category": "standard",
            "@height": "644",
            "@width": "800",
            "@_fa": "true",
            "$": "https://api.elsevier.com/content/object/eid/1-s2.0-S2095495622006295-gr3.jpg?httpAccept=%2A%2F%2A",
            "@multimediatype": "JPEG image file",
            "@type": "IMAGE-DOWNSAMPLED",
            "@size": "150751",
            "@ref": "gr3",
            "@mimetype": "image/jpeg"
          },
          {
            "@category": "standard",
            "@height": "572",
            "@width": "656",
            "@_fa": "true",
            "$": "https://api.elsevier.com/content/object/eid/1-s2.0-S2095495622006295-gr4.jpg?httpAccept=%2A%2F%2A",
            "@multimediatype": "JPEG image file",
            "@type": "IMAGE-DOWNSAMPLED",
            "@size": "115516",
            "@ref": "gr4",
            "@mimetype": "image/jpeg"
          },
          {
            "@category": "standard",
            "@height": "801",
            "@width": "721",
            "@_fa": "true",
            "$": "https://api.elsevier.com/content/object/eid/1-s2.0-S2095495622006295-gr5.jpg?httpAccept=%2A%2F%2A",
            "@multimediatype": "JPEG image file",
            "@type": "IMAGE-DOWNSAMPLED",
            "@size": "194844",
            "@ref": "gr5",
            "@mimetype": "image/jpeg"
          },
          {
            "@category": "standard",
            "@height": "369",
            "@width": "663",
            "@_fa": "true",
            "$": "https://api.elsevier.com/content/object/eid/1-s2.0-S2095495622006295-gr6.jpg?httpAccept=%2A%2F%2A",
            "@multimediatype": "JPEG image file",
            "@type": "IMAGE-DOWNSAMPLED",
            "@size": "67844",
            "@ref": "gr6",
            "@mimetype": "image/jpeg"
          },
          {
            "@category": "thumbnail",
            "@height": "69",
            "@width": "219",
            "@_fa": "true",
            "$": "https://api.elsevier.com/content/object/eid/1-s2.0-S2095495622006295-fx1.sml?httpAccept=%2A%2F%2A",
            "@multimediatype": "GIF image file",
            "@type": "IMAGE-THUMBNAIL",
            "@size": "2553",
            "@ref": "fx1",
            "@mimetype": "image/gif"
          },
          {
            "@category": "thumbnail",
            "@height": "110",
            "@width": "219",
            "@_fa": "true",
            "$": "https://api.elsevier.com/content/object/eid/1-s2.0-S2095495622006295-ga1.sml?httpAccept=%2A%2F%2A",
            "@multimediatype": "GIF image file",
            "@type": "IMAGE-THUMBNAIL",
            "@size": "17553",
            "@ref": "ga1",
            "@mimetype": "image/gif"
          },
          {
            "@category": "thumbnail",
            "@height": "164",
            "@width": "179",
            "@_fa": "true",
            "$": "https://api.elsevier.com/content/object/eid/1-s2.0-S2095495622006295-gr1.sml?httpAccept=%2A%2F%2A",
            "@multimediatype": "GIF image file",
            "@type": "IMAGE-THUMBNAIL",
            "@size": "11738",
            "@ref": "gr1",
            "@mimetype": "image/gif"
          },
          {
            "@category": "thumbnail",
            "@height": "164",
            "@width": "192",
            "@_fa": "true",
            "$": "https://api.elsevier.com/content/object/eid/1-s2.0-S2095495622006295-gr2.sml?httpAccept=%2A%2F%2A",
            "@multimediatype": "GIF image file",
            "@type": "IMAGE-THUMBNAIL",
            "@size": "21993",
            "@ref": "gr2",
            "@mimetype": "image/gif"
          },
          {
            "@category": "thumbnail",
            "@height": "163",
            "@width": "203",
            "@_fa": "true",
            "$": "https://api.elsevier.com/content/object/eid/1-s2.0-S2095495622006295-gr3.sml?httpAccept=%2A%2F%2A",
            "@multimediatype": "GIF image file",
            "@type": "IMAGE-THUMBNAIL",
            "@size": "14414",
            "@ref": "gr3",
            "@mimetype": "image/gif"
          },
          {
            "@category": "thumbnail",
            "@height": "164",
            "@width": "188",
            "@_fa": "true",
            "$": "https://api.elsevier.com/content/object/eid/1-s2.0-S2095495622006295-gr4.sml?httpAccept=%2A%2F%2A",
            "@multimediatype": "GIF image file",
            "@type": "IMAGE-THUMBNAIL",
            "@size": "12106",
            "@ref": "gr4",
            "@mimetype": "image/gif"
          },
          {
            "@category": "thumbnail",
            "@height": "163",
            "@width": "147",
            "@_fa": "true",
            "$": "https://api.elsevier.com/content/object/eid/1-s2.0-S2095495622006295-gr5.sml?httpAccept=%2A%2F%2A",
            "@multimediatype": "GIF image file",
            "@type": "IMAGE-THUMBNAIL",
            "@size": "14396",
            "@ref": "gr5",
            "@mimetype": "image/gif"
          },
          {
            "@category": "thumbnail",
            "@height": "122",
            "@width": "219",
            "@_fa": "true",
            "$": "https://api.elsevier.com/content/object/eid/1-s2.0-S2095495622006295-gr6.sml?httpAccept=%2A%2F%2A",
            "@multimediatype": "GIF image file",
            "@type": "IMAGE-THUMBNAIL",
            "@size": "11715",
            "@ref": "gr6",
            "@mimetype": "image/gif"
          },
          {
            "@category": "high",
            "@height": "416",
            "@width": "1319",
            "@_fa": "true",
            "$": "https://api.elsevier.com/content/object/eid/1-s2.0-S2095495622006295-fx1_lrg.jpg?httpAccept=%2A%2F%2A",
            "@multimediatype": "JPEG image file",
            "@type": "IMAGE-HIGH-RES",
            "@size": "29974",
            "@ref": "fx1",
            "@mimetype": "image/jpeg"
          },
          {
            "@category": "high",
            "@height": "886",
            "@width": "1769",
            "@_fa": "true",
            "$": "https://api.elsevier.com/content/object/eid/1-s2.0-S2095495622006295-ga1_lrg.jpg?httpAccept=%2A%2F%2A",
            "@multimediatype": "JPEG image file",
            "@type": "IMAGE-HIGH-RES",
            "@size": "312043",
            "@ref": "ga1",
            "@mimetype": "image/jpeg"
          },
          {
            "@category": "high",
            "@height": "2690",
            "@width": "2933",
            "@_fa": "true",
            "$": "https://api.elsevier.com/content/object/eid/1-s2.0-S2095495622006295-gr1_lrg.jpg?httpAccept=%2A%2F%2A",
            "@multimediatype": "JPEG image file",
            "@type": "IMAGE-HIGH-RES",
            "@size": "832056",
            "@ref": "gr1",
            "@mimetype": "image/jpeg"
          },
          {
            "@category": "high",
            "@height": "2025",
            "@width": "2368",
            "@_fa": "true",
            "$": "https://api.elsevier.com/content/object/eid/1-s2.0-S2095495622006295-gr2_lrg.jpg?httpAccept=%2A%2F%2A",
            "@multimediatype": "JPEG image file",
            "@type": "IMAGE-HIGH-RES",
            "@size": "1019573",
            "@ref": "gr2",
            "@mimetype": "image/jpeg"
          },
          {
            "@category": "high",
            "@height": "2851",
            "@width": "3540",
            "@_fa": "true",
            "$": "https://api.elsevier.com/content/object/eid/1-s2.0-S2095495622006295-gr3_lrg.jpg?httpAccept=%2A%2F%2A",
            "@multimediatype": "JPEG image file",
            "@type": "IMAGE-HIGH-RES",
            "@size": "990839",
            "@ref": "gr3",
            "@mimetype": "image/jpeg"
          },
          {
            "@category": "high",
            "@height": "2531",
            "@width": "2904",
            "@_fa": "true",
            "$": "https://api.elsevier.com/content/object/eid/1-s2.0-S2095495622006295-gr4_lrg.jpg?httpAccept=%2A%2F%2A",
            "@multimediatype": "JPEG image file",
            "@type": "IMAGE-HIGH-RES",
            "@size": "742568",
            "@ref": "gr4",
            "@mimetype": "image/jpeg"
          },
          {
            "@category": "high",
            "@height": "3546",
            "@width": "3191",
            "@_fa": "true",
            "$": "https://api.elsevier.com/content/object/eid/1-s2.0-S2095495622006295-gr5_lrg.jpg?httpAccept=%2A%2F%2A",
            "@multimediatype": "JPEG image file",
            "@type": "IMAGE-HIGH-RES",
            "@size": "1623277",
            "@ref": "gr5",
            "@mimetype": "image/jpeg"
          },
          {
            "@category": "high",
            "@height": "1633",
            "@width": "2938",
            "@_fa": "true",
            "$": "https://api.elsevier.com/content/object/eid/1-s2.0-S2095495622006295-gr6_lrg.jpg?httpAccept=%2A%2F%2A",
            "@multimediatype": "JPEG image file",
            "@type": "IMAGE-HIGH-RES",
            "@size": "444722",
            "@ref": "gr6",
            "@mimetype": "image/jpeg"
          },
          {
            "@category": "standard",
            "@_fa": "true",
            "$": "https://api.elsevier.com/content/object/eid/1-s2.0-S2095495622006295-mmc1.docx?httpAccept=%2A%2F%2A",
            "@multimediatype": "Microsoft Word file",
            "@type": "APPLICATION",
            "@size": "28005749",
            "@ref": "mmc1",
            "@mimetype": "application/word"
          },
          {
            "@category": "thumbnail",
            "@_fa": "true",
            "$": "https://api.elsevier.com/content/object/eid/1-s2.0-S2095495622006295-si1.svg?httpAccept=%2A%2F%2A",
            "@multimediatype": "Scalable Vector Graphics file",
            "@type": "ALTIMG",
            "@size": "12382",
            "@ref": "si1",
            "@mimetype": "image/svg+xml"
          },
          {
            "@category": "thumbnail",
            "@_fa": "true",
            "$": "https://api.elsevier.com/content/object/eid/1-s2.0-S2095495622006295-si2.svg?httpAccept=%2A%2F%2A",
            "@multimediatype": "Scalable Vector Graphics file",
            "@type": "ALTIMG",
            "@size": "16901",
            "@ref": "si2",
            "@mimetype": "image/svg+xml"
          },
          {
            "@category": "standard",
            "@_fa": "true",
            "$": "https://api.elsevier.com/content/object/eid/1-s2.0-S2095495622006295-am.pdf?httpAccept=%2A%2F%2A",
            "@multimediatype": "Acrobat PDF file",
            "@type": "AAM-PDF",
            "@size": "13000859",
            "@ref": "am",
            "@mimetype": "application/pdf"
          }
        ]
      },
      "link": {
        "@rel": "abstract",
        "@href": "https://api.elsevier.com/content/abstract/scopus_id/85143717186"
      }
    }
  }
}