{
  "metadata": {
    "title": "Optimized electrochemical ammonia production: From metal-N<ce:inf loc=post>2</ce:inf>/NO<ce:inf loc=post><ce:italic>x</ce:italic></ce:inf> batteries to aqueous metal-NO<ce:inf loc=post><ce:italic>x</ce:italic></ce:inf><ce:sup loc=post>–</ce:sup> batteries",
    "authors": "; ; ",
    "journal": "Journal of Energy Chemistry",
    "date": "2024-11-30",
    "doi": "10.1016/j.jechem.2024.06.054",
    "abstract": "",
    "uri": "https://api.elsevier.com/content/article/pii/S2095495624004674",
    "pii": "S2095495624004674"
  },
  "fulltext": {
    "full-text-retrieval-response": {
      "scopus-eid": "2-s2.0-85199700335",
      "originalText": "serial JL 286353 291210 291711 291744 291809 31 Journal of Energy Chemistry JOURNALENERGYCHEMISTRY 2024-07-06 2024-07-06 2024-07-27 2024-07-27 2024-10-23T19:56:01 1-s2.0-S2095495624004674 S2095-4956(24)00467-4 S2095495624004674 10.1016/j.jechem.2024.06.054 S300 S300.1 FULL-TEXT 1-s2.0-S2095495624X0008X 2024-10-23T19:06:26.952271Z 0 0 20241101 20241130 2024 2024-07-06T16:36:15.258159Z absattachment articleinfo articletitlenorm authfirstinitialnorm authfirstsurnamenorm cid cids contenttype copyright crossmark dateloaded dateloadedtxt datesearch datesort dateupdated dco docsubtype doctype doi eid ewtransactionid hubeid indexeddate issn issnnorm itemstage itemtransactionid itemweight openaccess openarchive pg pgfirst pglast pii piinorm pubdateend pubdatestart pubdatetxt pubyr sortorder srctitle srctitlenorm srctype ssids alllist content subj subheadings suppl tomb volfirst volissue volumelist webpdf webpdfpagecount yearnav figure table body mmlmath acknowledge affil articletitle auth authfirstini authfull authkeywords authlast grantnumber grantsponsor grantsponsorid primabst pubtype ref specialabst 2095-4956 20954956 false 98 98 C Volume 98 45 541 555 541 555 202411 November 2024 2024-11-01 2024-11-30 2024 article ssu © 2024 Science Press and Dalian Institute of Chemical Physics, Chinese Academy of Sciences. Published by ELSEVIER B.V. and Science Press. All rights are reserved, including those for text and data mining, AI training, and similar technologies. OPTIMIZEDELECTROCHEMICALAMMONIAPRODUCTIONMETALN2NOXBATTERIESAQUEOUSMETALNOXBATTERIES YAN F 1 Introduction 2 Overview of metal-N redox batteries 2.1 Considerations for anodes 2.2 Considerations for cathodes 2.2.1 Value-added reduction reactions of cathodes 2.2.2 Catalysts of cathodes 2.3 Considerations for reaction parameters 3 Metal-N2/NO x redox batteries 3.1 Organic metal-N2 batteries 3.1.1 Reaction mechanism of organic Li/Na/Al-N2 batteries 3.1.2 Electrochemical performance of current organic metal-N2 batteries 3.2 Aqueous metal-N2 redox batteries 3.2.1 Reaction mechanism and primary/rechargeable metal-N2 battery 3.2.2 Strategies on improving electrochemical performance for the aqueous metal-N2 batteries 3.3 Aqueous Zn-NO x redox batteries 3.3.1 Reaction mechanism of aqueous Zn-NO x batteries 3.3.2 Strategies on improving electrochemical performance for the aqueous metal-NO x batteries 4 Aqueous Zn-NO x – redox batteries 4.1 Reaction mechanism of aqueous Zn-NO x – batteries 4.2 Strategies on improving electrochemical performance for the aqueous metal-NO x – batteries 5 Current problems with metal-N redox batteries 6 Conclusions and outlook CRediT authorship contribution statement Acknowledgments References REN 2024 49 113 J REN 2023 8319 8373 J REN 2024 2029 2038 J LARCHER 2015 19 29 D LELIEVELD 2015 367 371 J ROSS 2019 648 658 M WENG 2022 121190 C KANG 2009 190 193 B HAN 2018 1801396 X HUANG 2021 3106 Z WENG 2022 6456 6465 C ZHANG 2020 1905923 Y WU 2020 1569 1614 F ISLAM 2023 98 119 J MANTHIRAM 2020 1550 A CHAO 2020 eaba4098 D JU 2022 2201074 Z WU 2019 680 681 X LV 2021 2101856 X WANG 2022 e202213328 T PAN 2018 1700691 J WANG 2023 2302515 H LI 2021 2100460 Y YANG 2021 2007602 H SPATZAL 2014 1620 1623 T FENG 2023 4510 4518 Y FENG 2023 5225 5243 Y HE 2019 7311 7317 C HAN 2021 2460 2468 X LIU 2022 2103747 H MENG 2023 2300269 F YAN 2023 2212078 S XUE 2022 2104183 C LV 2021 119434 X WEN 2023 2212236 W HE 2023 107100 X LIU 2022 2106961 Q ZHANG 2023 650 657 W MA 2023 1125 1134 L ZHANG 2021 2954 3009 F YAN 2021 3327 3345 X YAN 2019 733 740 S LV 2020 3061 3078 X TIAN 2022 121764 W DHARMARAJ 2023 9675 9684 V JUN 2022 2103247 J MA 2023 19032 19042 X LI 2014 3307 3312 N HWANG 2017 11592 11600 S KUMAR 2019 196 202 A REN 2022 619 630 J TIAN 2020 5283 5286 W TIAN 2022 133210 W ELIA 2016 7564 7579 G LI 2019 209 217 J YANG 2023 215420 H ZHANG 2022 3024 3032 R ZHAO 2022 2107136 S WANG 2019 341 M ZHENG 2022 452 457 J ZHENG 2019 617 633 J KIM 2019 1805617 C CAO 2021 2100949 S WENG 2022 19 C LIU 2023 2325 2346 W JIAO 2019 1805173 F YANG 2023 e202215938 X REN 2021 1176 1193 Y XU 2022 2710 2758 H ZHANG 2022 2777 2787 X REN 2021 12106 12117 J TANG 2020 5051 5058 S MA 2017 525 532 J GE 2019 733 740 B GUO 2020 2888 2895 Y CHENG 2023 155481 Y BI 2022 2106148 X XU 2022 4100 4107 Y CAO 2022 40921 40929 D XU 2022 1761 1770 H LEONG 2022 111771 K ZHANG 2019 17782 17787 Z YANG 2022 135148 Y MENG 2023 e12298 F DU 2019 12801 12804 C REN 2021 11370 11380 J REN 2021 129447 J FANG 2019 1901034 C ZHAO 2019 1806482 Y ZHANG 2018 28251 28255 R CHEN 2022 4608 4613 H WANG 2023 e202204034 T LV 2021 4026 4035 X WANG 2020 118892 H LIU 2020 105078 W WANG 2021 105613 H WANG 2022 9049 9061 F QIAO 2023 142628 H BEALE 2015 7371 7405 A LONG 2020 9711 9718 J ROSCA 2009 2209 2244 V PENG 2020 105321 X WENG 2022 24743 24751 Y GRUBER 2008 293 296 N LV 2021 12109 12118 X REN 2020 118633 J ZHANG 2021 25263 25268 L MOU 2021 24268 24275 T LIU 2021 13562 13565 P LIN 2022 100611 Y LIANG 2022 1366 1372 J LIANG 2022 6454 6462 J LIANG 2022 e202202087 J LIU 2022 5032 5037 Q ZHANG 2022 8096 8102 L LI 2023 2300291 Z PENG 2020 105321 X MENG 2022 8097 8100 G MENG 2022 8890 8896 G WANG 2023 6899 6904 D LI 2022 100619 Z LIANG 2022 e9120010 J CHEN 2020 605 613 G GUO 2021 3938 3944 Y ZHOU 2022 2200436 F LIN 2022 2209464 W PATIL 2021 8121 8128 S DING 2023 110621 J JIANG 2023 e202218717 H TANG 2015 27518 27525 X MA 2023 6687 6697 J ZHANG 2022 2103872 R GAO 2023 122627 Y XIE 2022 49650 49657 L LI 2022 8914 8921 Z DENG 2022 135104 Z REN 2022 12895 12902 Z QIU 2022 24969 24974 H LIU 2022 e202202556 H LI 2023 1081 1090 X YANX2024X541 YANX2024X541X555 YANX2024X541XF YANX2024X541X555XF 2026-07-27T00:00:00.000Z 2026-07-27T00:00:00.000Z http://creativecommons.org/licenses/by-nc-nd/4.0/ © 2024 Science Press and Dalian Institute of Chemical Physics, Chinese Academy of Sciences. Published by ELSEVIER B.V. and Science Press. All rights are reserved, including those for text and data mining, AI training, and similar technologies. 2024-10-07T13:22:22.106Z http://vtw.elsevier.com/data/voc/AddOnTypes/50.7/aggregated-refined Tianjin Graduate Research and Innovation Project 2022BKY018 Graduate Research and Innovation Projects of Jiangsu Province http://data.elsevier.com/vocabulary/SciValFunders/501100012154 http://sws.geonames.org/1814991/ Tianjin Graduate Research and Innovation Project National Natural Science Foundation of China 22179065 NSFC National Natural Science Foundation of China http://data.elsevier.com/vocabulary/SciValFunders/501100001809 http://sws.geonames.org/1814991 This work was supported by the National Natural Science Foundation of China (22179065) and the Tianjin Graduate Research and Innovation Project (2022BKY018). item S2095-4956(24)00467-4 S2095495624004674 1-s2.0-S2095495624004674 10.1016/j.jechem.2024.06.054 286353 2024-10-23T19:06:26.952271Z 2024-11-01 2024-11-30 1-s2.0-S2095495624004674-main.pdf https://s3-eu-west-1.amazonaws.com/prod-ucs-content-store-eu-west/content/pii:S2095495624004674/MAIN/application/pdf/91968be5f5f3c3f2b98262d48e96294e/main.pdf main.pdf pdf true 2852939 MAIN 15 1-s2.0-S2095495624004674-main_1.png https://s3-eu-west-1.amazonaws.com/prod-ucs-content-store-eu-west/content/pii:S2095495624004674/PREVIEW/image/png/171eb25fd9c102122472559b946d2338/main_1.png main_1.png png 61220 849 656 IMAGE-WEB-PDF 1 1-s2.0-S2095495624004674-ga1.jpg https://s3-eu-west-1.amazonaws.com/prod-ucs-content-store-eu-west/content/pii:S2095495624004674/ga1/DOWNSAMPLED/image/jpeg/d5d064858ef20a92067953143c584269/ga1.jpg ga1 true ga1.jpg jpg 31292 245 245 IMAGE-DOWNSAMPLED 1-s2.0-S2095495624004674-gr1.jpg https://s3-eu-west-1.amazonaws.com/prod-ucs-content-store-eu-west/content/pii:S2095495624004674/gr1/DOWNSAMPLED/image/jpeg/e328986fbd6cb4113291e44513d65953/gr1.jpg gr1 gr1.jpg jpg 96782 395 711 IMAGE-DOWNSAMPLED 1-s2.0-S2095495624004674-gr2.jpg https://s3-eu-west-1.amazonaws.com/prod-ucs-content-store-eu-west/content/pii:S2095495624004674/gr2/DOWNSAMPLED/image/jpeg/1d1a190336064adf3b364a44237fa071/gr2.jpg gr2 gr2.jpg jpg 53319 374 711 IMAGE-DOWNSAMPLED 1-s2.0-S2095495624004674-gr3.jpg https://s3-eu-west-1.amazonaws.com/prod-ucs-content-store-eu-west/content/pii:S2095495624004674/gr3/DOWNSAMPLED/image/jpeg/e2f38d60c73a54ba8ebd14147be6affb/gr3.jpg gr3 gr3.jpg jpg 101113 383 711 IMAGE-DOWNSAMPLED 1-s2.0-S2095495624004674-gr4.jpg https://s3-eu-west-1.amazonaws.com/prod-ucs-content-store-eu-west/content/pii:S2095495624004674/gr4/DOWNSAMPLED/image/jpeg/acefb16aa19a167192b3c50a36dd26a4/gr4.jpg gr4 gr4.jpg jpg 87463 317 711 IMAGE-DOWNSAMPLED 1-s2.0-S2095495624004674-gr5.jpg https://s3-eu-west-1.amazonaws.com/prod-ucs-content-store-eu-west/content/pii:S2095495624004674/gr5/DOWNSAMPLED/image/jpeg/44eca784cfcb63d7df85b02443425d33/gr5.jpg gr5 gr5.jpg jpg 63942 282 711 IMAGE-DOWNSAMPLED 1-s2.0-S2095495624004674-gr6.jpg https://s3-eu-west-1.amazonaws.com/prod-ucs-content-store-eu-west/content/pii:S2095495624004674/gr6/DOWNSAMPLED/image/jpeg/bd775f515de95e2b8da7dde2bb7eab1a/gr6.jpg gr6 gr6.jpg jpg 106710 367 711 IMAGE-DOWNSAMPLED 1-s2.0-S2095495624004674-gr7.jpg https://s3-eu-west-1.amazonaws.com/prod-ucs-content-store-eu-west/content/pii:S2095495624004674/gr7/DOWNSAMPLED/image/jpeg/0b890dd4058e1d2aba5dbdbc92809e9c/gr7.jpg gr7 gr7.jpg jpg 35611 289 535 IMAGE-DOWNSAMPLED 1-s2.0-S2095495624004674-ga1.sml https://s3-eu-west-1.amazonaws.com/prod-ucs-content-store-eu-west/content/pii:S2095495624004674/ga1/THUMBNAIL/image/gif/35a11cfb6810788e903908c8e57e8727/ga1.sml ga1 true ga1.sml sml 15900 164 164 IMAGE-THUMBNAIL 1-s2.0-S2095495624004674-gr1.sml https://s3-eu-west-1.amazonaws.com/prod-ucs-content-store-eu-west/content/pii:S2095495624004674/gr1/THUMBNAIL/image/gif/58f12ce293e814c82462263a5f4e6eda/gr1.sml gr1 gr1.sml sml 16162 122 219 IMAGE-THUMBNAIL 1-s2.0-S2095495624004674-gr2.sml https://s3-eu-west-1.amazonaws.com/prod-ucs-content-store-eu-west/content/pii:S2095495624004674/gr2/THUMBNAIL/image/gif/9af4ff406b2f34465bd127843f2b5b37/gr2.sml gr2 gr2.sml sml 8697 115 219 IMAGE-THUMBNAIL 1-s2.0-S2095495624004674-gr3.sml https://s3-eu-west-1.amazonaws.com/prod-ucs-content-store-eu-west/content/pii:S2095495624004674/gr3/THUMBNAIL/image/gif/65a3b98032bb2790ad92671fe4c9c067/gr3.sml gr3 gr3.sml sml 13902 118 219 IMAGE-THUMBNAIL 1-s2.0-S2095495624004674-gr4.sml https://s3-eu-west-1.amazonaws.com/prod-ucs-content-store-eu-west/content/pii:S2095495624004674/gr4/THUMBNAIL/image/gif/d85229b1e9ec2b835a2efa1a04add2f6/gr4.sml gr4 gr4.sml sml 13903 98 219 IMAGE-THUMBNAIL 1-s2.0-S2095495624004674-gr5.sml https://s3-eu-west-1.amazonaws.com/prod-ucs-content-store-eu-west/content/pii:S2095495624004674/gr5/THUMBNAIL/image/gif/5570dd9d713e20a72cd9d6f6b689fd73/gr5.sml gr5 gr5.sml sml 8872 87 219 IMAGE-THUMBNAIL 1-s2.0-S2095495624004674-gr6.sml https://s3-eu-west-1.amazonaws.com/prod-ucs-content-store-eu-west/content/pii:S2095495624004674/gr6/THUMBNAIL/image/gif/fb655d446aa49b618f9f632aabc0cc64/gr6.sml gr6 gr6.sml sml 14486 113 219 IMAGE-THUMBNAIL 1-s2.0-S2095495624004674-gr7.sml https://s3-eu-west-1.amazonaws.com/prod-ucs-content-store-eu-west/content/pii:S2095495624004674/gr7/THUMBNAIL/image/gif/ce6b306ab85e77613c8ad3d6fb03df15/gr7.sml gr7 gr7.sml sml 6798 118 219 IMAGE-THUMBNAIL 1-s2.0-S2095495624004674-ga1_lrg.jpg https://s3-eu-west-1.amazonaws.com/prod-ucs-content-store-eu-west/content/pii:S2095495624004674/MAIN/image/jpeg/abd4b1ac99d8321872070e28220d7dda/ga1_lrg.jpg ga1 true ga1_lrg.jpg jpg 204499 1085 1085 IMAGE-HIGH-RES 1-s2.0-S2095495624004674-gr1_lrg.jpg https://s3-eu-west-1.amazonaws.com/prod-ucs-content-store-eu-west/content/pii:S2095495624004674/HIGHRES/image/jpeg/8493aa52d43e48d0b718387f039f62ac/gr1_lrg.jpg gr1 gr1_lrg.jpg jpg 540929 1752 3150 IMAGE-HIGH-RES 1-s2.0-S2095495624004674-gr2_lrg.jpg https://s3-eu-west-1.amazonaws.com/prod-ucs-content-store-eu-west/content/pii:S2095495624004674/HIGHRES/image/jpeg/52788fcd7f3d9310456dbe11e16a23b7/gr2_lrg.jpg gr2 gr2_lrg.jpg jpg 264071 1659 3150 IMAGE-HIGH-RES 1-s2.0-S2095495624004674-gr3_lrg.jpg https://s3-eu-west-1.amazonaws.com/prod-ucs-content-store-eu-west/content/pii:S2095495624004674/HIGHRES/image/jpeg/5ead140e517f1738b2f3aa588d3632e5/gr3_lrg.jpg gr3 gr3_lrg.jpg jpg 587939 1699 3150 IMAGE-HIGH-RES 1-s2.0-S2095495624004674-gr4_lrg.jpg https://s3-eu-west-1.amazonaws.com/prod-ucs-content-store-eu-west/content/pii:S2095495624004674/HIGHRES/image/jpeg/4d6bb65ee0510452f9cb6ec6c05e61b1/gr4_lrg.jpg gr4 gr4_lrg.jpg jpg 504379 1405 3149 IMAGE-HIGH-RES 1-s2.0-S2095495624004674-gr5_lrg.jpg https://s3-eu-west-1.amazonaws.com/prod-ucs-content-store-eu-west/content/pii:S2095495624004674/THUMBNAIL/image/jpeg/85f878632acd0fcb11da4802ef9d73be/gr5_lrg.jpg gr5 gr5_lrg.jpg jpg 350713 1251 3150 IMAGE-HIGH-RES 1-s2.0-S2095495624004674-gr6_lrg.jpg https://s3-eu-west-1.amazonaws.com/prod-ucs-content-store-eu-west/content/pii:S2095495624004674/HIGHRES/image/jpeg/58e69ec3a9085165309272de88830d31/gr6_lrg.jpg gr6 gr6_lrg.jpg jpg 599658 1625 3150 IMAGE-HIGH-RES 1-s2.0-S2095495624004674-gr7_lrg.jpg https://s3-eu-west-1.amazonaws.com/prod-ucs-content-store-eu-west/content/pii:S2095495624004674/HEAD-ONLY/image/jpeg/6c0d60f28210ec297a23f7d4ed363d29/gr7_lrg.jpg gr7 gr7_lrg.jpg jpg 180857 1278 2368 IMAGE-HIGH-RES 1-s2.0-S2095495624004674-si1.svg https://s3-eu-west-1.amazonaws.com/prod-ucs-content-store-eu-west/content/pii:S2095495624004674/STRIPIN/image/svg+xml/cabdb115097cec607278df43c85bd0bc/si1.svg si1 si1.svg svg 11448 ALTIMG 1-s2.0-S2095495624004674-si2.svg https://s3-eu-west-1.amazonaws.com/prod-ucs-content-store-eu-west/content/pii:S2095495624004674/STRIPIN/image/svg+xml/0622668d22e6ebc84f7f9a6fe760a2d7/si2.svg si2 si2.svg svg 9471 ALTIMG 1-s2.0-S2095495624004674-am.pdf https://s3-eu-west-1.amazonaws.com/prod-ucs-content-store-eu-west/content/egi:10HBB6SK7JB/MAIN/application/pdf/ded884cead9223c5b9e8f8db46f56f91/am.pdf am am.pdf pdf false 2042730 AAM-PDF JECHEM 3969 S2095-4956(24)00467-4 10.1016/j.jechem.2024.06.054 Science Press Fig. 1 Schematic illustration of metal-N series batteries. (a, b) Metal-N2 batteries. Reproduced with permission from Ref [34]. Copyright 2020, Royal Society of Chemistry. Reproduced with permission from Ref. [35]. Copyright 2021, Elsevier. (c, d) Metal-NO2 – batteries. Reproduced with permission from Ref. [36]. Copyright 2022, American Chemical Society. Reproduced with permission from Ref. [37]. Copyright 2023, Elsevier. (e, f) Metal-NO3 – batteries. Reproduced with permission from Ref. [38]. Copyright 2022, John Wiley and Sons. (g, h) Metal-NO x batteries. Reproduced with permission from Ref. [39]. Copyright 2023, Elsevier. Reproduced with permission from Ref. [40]. Copyright 2023, Royal Society of Chemistry. Fig. 2 Development and schematical description of organic or aqueous M−N series batteries. Fig. 3 (a) Structure of a Li-N2 battery. (b) N2 fixation and N2 evolution curves of the Li-N2 battery. (c)CVcurves of a Li-N2 battery at a scan rate of 0.05 mV s−1 in N2-saturated and Ar-saturated atmospheres. (d) Cyclic performance of a Li-N2 battery at a current density of 0.05 mA cm−2. Reproduced with permission [78]. Copyright 2017, Royal Society of Chemistry. (e) Schematic diagram showing the achievement of both energy storage and N2 fixation using the Al-N2 battery system. Reproduced with permission [34]. Copyright 2020, Royal Society of Chemistry. (f) Charge density distributions. (g) The top view of the above ions and clusters for the cathode after initial discharge process under N2. Reproduced with permission [84]. Copyright 2023, John Wiley and Sons. Fig. 4 (a) Schematic illustration of an aqueous Zn-N2 battery. (b) 1H NMR spectra of the 15N isotopic labeling experiment. (c) Polarization and power curves of the Zn-N2 aqueous battery with a scan rate of 0.5 mV s−1. (d) The cycle test results. Reproduced with permission [85]. Copyright 2019, Royal Society of Chemistry. (e) Schematic illustration of aqueous Zn-N2 battery with gas-diffusion electrode. (f) Dependence of the NH3 yield rate and the FE on the various discharge voltages of the CoPi/NPCS catalyzed Zn-N2 battery. (g) Charge-discharge polarization curves and corresponding power density of aqueous Zn-N2 battery with CoPi/NPCS catalyst. Reproduced with permission [86]. Copyright 2021, American Chemical Society. (h) Schematic illustration of an aqueous Al-N2 battery. (i) Schematic illustration of the synthetic procedure of MoPi/HSNPC. (j) Possible NRR pathway of MoPi/HSNPC for NH3 production. Reproduced with permission [87]. Copyright 2021, Elsevier. (k) Schematic illustration of OV-Ti2O3 synthesis. Reproduced with permission [91]. Copyright 2022, Royal Society of Chemistry. (l) Schematic diagram of FeHTN synthesis. Reproduced with permission [94]. Copyright 2021, Royal Society of Chemistry. (m) Schematic illustration of Vs-FePS3 NSs synthesis. (n) Power density plot and corresponding discharging polarization curve of Vs-FePS3 NSs. Reproduced with permission [97]. Copyright 2021, Elsevier. Fig. 5 (a) Schematic illustration of the aqueous Zn-NO battery. (b) Comparison of battery's NH3 yield and power density with those of recent metal-N2 battery systems. (c) Charge density differences for the Ni2P (111) surfaces with adsorbed NO. (d) Schematic depiction of the NORR reaction pathways for the end-on adsorbed NO. Reproduced with permission [108]. Copyright 2021, Royal Society of Chemistry. (e) Schematic diagram of nitric oxide reduction for ammonia synthesis. Geometrically optimized atomic structure of the (f) hcp-Co (top view) and (g) fcc-Co (top view). (h) Partial density of states (PDOS) of d orbitals in the hcp-Co and fcc-Co. The Fermi energy level is set to 0. Reproduced with permission [122]. Copyright 2023, American Chemical Society. Fig. 6 The electron density difference between the optimized (a) Pd/TiO2-NO3 – and (b) TiO2-NO3 – structures. (c) The comparison of the NH3 yields and FEs of Pd/TiO2 with the reported catalysts for the NORR and NRR. Reproduced with permission [118]. Copyright 2021, Royal Society of Chemistry. (d) Schematic illustration of nitrite reduction process for conventional phase Cu and metastable phase Cu. (e) The optimized structure models of NITRR intermediates adsorbed on metastable phase Cu. Reproduced with permission [128]. Copyright 2021, American Chemical Society. (f) Schematic illustration of nitrate reduction in the biological process, the mimicked [2 + 6]– electron pathway and the reported direct eight-electron route. (g) Schematic representation for the transformation of Cu active sites. (h) Simulated atomistic structure scheme shows a reaction pathway for the reduction of NO3 – to NH3 and the corresponding transition state (TS) energy barriers. Reproduced with permission [130]. Copyright 2023, John Wiley and Sons. (i) Schematic Illustration for the Preparation of NiCoBDC@HsGDY Nanowire Array. (j) Schematic illustration of the nitrate-to-ammonia on the interface of NiCoBDC@HsGDY. Reproduced with permission [133]. Copyright 2023, American Chemical Society. Fig. 7 Performance comparison of different metal-N series batteries. Table 1 Theoretical redox potentials and specific capacity of metal anodes. Metal anode Theoretical redox potential(V vs. SHE) Specific capacity(mA h g−1) Li −3.04 3806 Na −2.71 1165 Zn −1.25 819 Al −2.33 2980 Mg −2.37 2200 Table 2 Cathodic electrocatalysts reported for organic metal-N2 batteries. Cathode catalysts M−N2 battery Electrolyte(CV test) FE NH3 yield Reference CC LNB 1 M LiCF3SO3 in TEGDME (0.4–4.2 V) 59% − [75] Ru/CC LNB 1 M LiCF3SO3 in TEGDME (0.4–4.2 V) 67% − [75] ZrO2/CC LNB 1 M LiCF3SO3 in TEGDME (0.4–4.2 V) 71% − [75] Graphene LNB 1 M LiClO4 in TEGDME (0.4–4.2 V) − − [76] Mo2C/N-doped carbon nanosheets LNB 1 M LiCF3SO3 in TEGDME (0.8–4.5 V) − − [77] Alpha-MnO2 NWs/CC NNB 1 M NaCF3SO3 /TEGDME (1.2–4.4 V) − − [76] Graphene/Pd/CC ANB AlCl3/1-butyl-3-methylimidazolium chloride (0.3–2.6 V) 51.2% 27.1 mg gcat –1h−1 [77] SnO2@N-doped carbonnanosheets/CC LNB 1 M LiTFSI in TEGDME (0.5–4.5 V) − − [84] Table 3 Cathodic electrocatalysts reported for aqueous metal-N2 batteries. Cathodic catalyst Electrolyte(anodic/cathodic) FE (%, ZNB) NH3 yield Maximum power density(mW cm−2) Reference VN@NSC 0.1 M KOH − − 0.01642 [35] CoPi/HSNPC 1.0 M KOH 24.42 11.62 μg h−1 mgcat. –1 0.31 [83] Metallic Cu − − − 0.0101 [85] CoPi/NPCS 1.0 M KOH 16.35 14.7 μg h−1 mgcat. –1 0.49 [86] MoPi/HSNPC 1.0 M KOH + 2 mM Na2SnO3 + 0.1 mM In(OH)3 + 1.5 mM ZnO/1.0 M KOH − − 2.37 [87] OV-Ti2O3 1.0 M KOH/0.1 M HCl − 4.3 μg h−1 mgcat. –1 1.02 [91] Fe1.0HTNs 0.1 M KOH − 0.172 mg h−1 cm−2 0.01642 [93] Vs-FePS3 NSs − − − 2.6 [97] 2D CNQD 0.1 M KOH − − 31.94 [98] Fe-HCS Simulated seawater 40.81 − 0.15552 [99] Table 4 Cathodic electrocatalysts reported for aqueous metal-NO x batteries. Cathodic catalyst Electrolyte (anodic/cathodic) FE (%, ZNB) NH3 yield Maximum power density(mW cm−2) Reference Nano-NiO 2.0 M ZnCl2 − 4 mM h−1 90.5 [40] MoS2/GF 1.0 M KOH/0.1 M HCl + 0.5 mM FeSB − 411.8 μg h−1 mgcat. –1 1.04 [107] Ni2P/CP 1.0 M KOH/0.1 M HCl − 62.05 μg h−1 mgcat. –1 1.53 [108] NiO/TM 1.0 M NaOH/0.1 M Na2SO4 − 228 μg h−1 cm−2 0.88 [109] Bi NDs 1.0 M KOH/0.1 M Na2SO4 − 84.4 μg h−1 cm−2 2.33 [109] CoP/TM 1.0 M KOH/0.2 M Na2SO4 92 569.98 μg h−1 cm−2 0.496 [110] Fe2O3 nanorods 1.0 M KOH/0.1 M Na2SO4 82.5 145.28 μg h−1 mgcat. –1 1.18 [111] B2.6C@TiO2/Ti 1.0 M NaOH/0.1 M Na2SO4 − 1125 μg h−1 cm−2 1.7 [112] Bi@C 1.0 M NaOH/0.1 M Na2SO4 85.3 355.6 μg h−1 mgcat. –1 2.35 [113] CoS1- x 1.0 M KOH/0.2 M Na2SO4 − 1492.41 μg h−1 mgcat. –1 2.06 [114] TiO2- x /TP 1.0 M KOH/0.2 M PBS − − 0.84 [115] Ce-SA/NHCS − − 309.10 μg h−1 mgcat. –1 3.4 [117] NiFe-LDH/NSA − − 32 μmol h−1 cm−2 1.8 [118] MoC/CNS − − 782 μg h−1 cm−2 1.8 [119] hcp-Co 1.0 M NaOH/0.1 M Na2SO4 − 247.80 μg h−1 mgcat. –1 4.66 [120] Table 5 Cathodic electrocatalysts reported for aqueous metal-NO3 –/NO2 – batteries. Cathodic catalyst Cathode reactions Electrolyte (anodic/cathodic) FE(%, ZNB) NH3 yield Maximum power density(mW cm−2) Reference C/Co3O4 NO2 –RR 1.0 M KOH/0.5 M K2SO4 + 5 mM NO2 – 95.1 0.8 mg h−1 cm−2 6.03 [36] DM-Co NO3 –RR 1.0 M KOH + 0.2 M Zn (CH3COO)2/1.0 M KOH + 1.0 M KNO3 − − 25 [38] NiCo2O4/CC NO3 –RR 6.0 M KOH/0.1 M NaOH + 0.1 M NO3 – 96.1 485 μmol h−1 cm−2 3.94 [51] NiCoBDC@HsGDY NO3 –RR 6.0 M KOH/1.0 M KOH + 0.1 M NO3 – − − 3.66 [116] Pd-doped TiO2 NO3 –RR 5.0 M KOH/5.0 M LiCl + 0.25 M LiNO3 81.3 0.54 μg h−1 cm−2 0.87 [118] Ru/Ni hydroxide hybrid NO3 –RR 1.0 M KOH/1.0 M KOH + 1.0 M NaNO3 97 − 51.5 [125] MP-Cu NO3 –RR 5.0 M KOH/1.0 M KOH + 0.05 M NO3 – 93 76 μmol h−1 cm−2 7.56 [128] Cu nanowire NO3 –RR − − − 14.1 [130] Fe/Ni2P NO3 –RR 1.0 M KOH/0.2 M K2SO4 + 0.05 KNO3 – 85 22.6 μmol h−1 cm−2 3.25 [133] CeO2- x @NC/GP NO3 –RR 1.0 M KOH/0.1 M NaOH + 0.1 M NO3 – 96.09 145.08 μmol h−1 cm−2 3.44 [137] ZnCo2O4 NSA/CC NO3 –RR − 90 91.75 μmol h−1 cm−2 4.62 [138] Co2AlO4/CC NO3 –RR 1.0 M KOH/0.1 M PBS + 0.1 M NO3 – 95 750 μg h−1 cm−2 3.44 [139] WO2/W NO2 –RR − 90 1923.88 μg h−1 cm−2 5.05 [140] Perspective Optimized electrochemical ammonia production: From metal-N2/NO x batteries to aqueous metal-NO x – batteries Feng-Xiao Yan Writing – original draft Investigation Hao-Yu Wang Writing – review & editing Yi Feng Writing – review & editing Hao Wang Investigation Zhong-Yong Yuan Writing – review & editing Supervision ⁎ School of Materials Science and Engineering, Smart Sensing Interdisciplinary Science Center, Nankai University, Tianjin 300350, China School of Materials Science and Engineering Smart Sensing Interdisciplinary Science Center Nankai University Tianjin 300350 China School of Materials Science and Engineering, Smart Sensing Interdisciplinary Science Center, Nankai University, Tianjin 300350, China ⁎ Corresponding author. Graphical abstract Metal-nitrogen series batteries encompass aqueous/organic metal-N2, aqueous metal-NO x , and aqueous metal-NO x – batteries. These systems hold promise for simultaneous electricity generation, valuable ammonia synthesis, wastewater treatment, and gas decontamination. Ammonia plays a crucial role in contemporary society, impacting medicine, agriculture, and the chemical industry. The conventional industrial synthesis of NH3 through the Haber-Bosch technique, carried out under severe reaction conditions, leads to substantial energy consumption and environmental pollution. It is thus imperative for NH3 synthesis methods to be investigated under more favorable conditions. Synthesis of ammonia by electrocatalysis can effectively reduce the environmental damage and other urgent problems, which is a promising solution. Metal-nitrogen series batteries (M−N batteries), such as metal-nitrogen gas batteries, metal-nitrogen oxide batteries and metal-oxynitride batteries have been regarded recently as an exemplar of concurrent NH3 synthesis and energy production.Nonetheless, the large-scale application of these batteries is still limited by numerous challenges are currently existing in building high-efficiency M−N batteries, including poor Faradic efficiency and low NH3 yield. Therefore, a comprehensive overview of M−N batteries is offered, specifically focusing on advanced strategies for designing highly efficient cathode catalysts in anticipation of future developments. The metal anodes, cathodic electro-reduction reactions, and design principles are encompassed in the discussion, offering detailed insights to enhance understanding. Mechanisms, feasibility analyses, technoeconomic assessments, device combinations, and comparative evaluations are delved into in the review, contributing to a thorough comprehension of diverse systems and their application potential. Perspectives and opportunities for future research directions are also delineated. Keywords Metal-N2 batteries Metal-NO x – batteries Energy storage Ammonia production Electrocatalysts 1 Introduction The energy crisis primarily stems from the combustion of non-renewable fossil fuels, such as coal, oil, and natural gas [1]. The massive consumption of non-renewable fossil fuels not only exacerbates the energy crisis, but also places a significant strain on the environment due to the release of carbon dioxide. Consequently, it is crucial to underscore the imperative of reducing CO2 emissions and establishing a renewable energy framework [2–6]. Nonetheless, in spite of the promising future of renewable energy, the utilization of renewable energy is hindered by intermittency and volatility. A crucial step in realizing large-scale renewable energy utilization is the development and deployment of electrochemical energy conversion and storage technologies [7–9]. Batteries, as a typical energy storage device, can facilitate energy transfer and drive the implementation of novel energy applications [10–12]. Conventional lithium-ion batteries (LIBs) are preferred for their high energy density and consistent cycling performance, making them a popular choice among users [12–14]. Despite the practical implementation of LIBs, numerous challenges persist in their functionality. One of them is that LIBs tailored exclusively for high energy density lack the capacity to seamlessly integrate with renewable energy resources and store diverse forms of energy in the form of value-added chemicals [15]. Furthermore, lithium-ion batteries necessitate circuit protection mechanisms to avert overcharging or over-discharging, and there are limitations on the conditions under which they can be employed. Hence, the focus ought to be on investigating interconnected redox reactions alongside phase alterations during discharge and charge cycles, aiming to produce valuable substances within advanced metal-redox bifunctional catalyst (bicatalyst) batteries [16–18]. Among various value-added metal-redox bicatalyst batteries, the emergence of metal-N series batteries (M−N batteries) has captured the interest of scientific researchers [19–21]. M−N batteries (Fig. 1 ), including aqueous/organic metal-N2, aqueous metal-NO, aqueous metal-NO2, aqueous metal-NO3 –, and aqueous metal-NO2 – batteries [22–24], possess the capability to convert worthless or harmful N species into NH3 while simultaneously generating energy. As the product of M−N batteries, ammonia serves essential roles not only in the manufacturing but also plays a crucial part in the field of energy conversion [25–27]. The Haber-Bosch process currently stands as the predominant approach for ammonia synthesis. However, it demands elevated temperature and pressure conditions and consumes large amounts of coal and natural gas, resulting in a huge amount of carbon dioxide being released into the environment. Hence, M−N batteries, utilizing electrochemical methods to produce ammonia, emerge as a viable alternative to energy-intensive methods and environmentally burdensome Haber-Bosch process. The introduction of M−N batteries serves a twofold objective, as this technology not only enables ammonia production without CO2 emission but also simultaneously produces electricity. Nevertheless, as a nascent energy storage technology, M−N batteries still grapple with certain technical challenges. To guarantee the efficient and consistent functioning and achieve the rechargeable procedure of M−N batteries, numerous investigations have concentrated on developing electrocatalysts with diverse catalytic capabilities suitable for bifunctional electrolysis within the context of these batteries [28–30]. Recently, considerable progress has been achieved in researching bicatalyst batteries with partial metal-redox value addition, as evidenced by a number of remarkable review articles. Researchers conducted an in-depth analysis of recent advancements in carbon-based non-precious metal catalysts within the realm of metal-gas batteries, culminating a comprehensive summary of the current state of metal-gas batteries employing carbon-based non-precious metal catalysts [31]. A comprehensive review was conducted on the research progress of metal-N2 batteries, discussing the electrochemical reaction mechanisms in diverse metal-N2 batteries, offering a critical evaluation of existing obstacles and prospective applications [32]. The foundational principles and design concepts governing rechargeable/reversible aqueous metal-redox bicatalyst batteries, encompassing an examination of how individual components influence energy conversion and chemical production within these systems, were clarified. Additionally, the research encapsulated the electrocatalytic processes of reduction/oxidation, the existing systems dependent on redox reactions, and the associated bifunctional catalysts for redox reactions [33]. Metal-N2/NO x batteries and metal-NO x – batteries exhibit disparities not only in their reaction potentials but also in the involved reaction species. Surprisingly, there is a lack of comprehensive reviews that distinctly address these variations between the two battery types. To foster a more profound comprehension of M−N batteries, we offer an extensive and in-depth review encompassing battery mechanics and cathode discharging reactions, such as nitrogen reduction reaction (NRR), nitric oxide reduction reaction (NORR), nitrate reduction reaction (NO3 –RR) and nitrite reduction reaction (NO2 –RR). We firstly conduct an extensive analysis of both the cathodes and anodes incorporated in M−N batteries. Subsequently, we explore recent advancements in electrocatalyst design within diverse M−N battery configurations. Beginning with an examination of organic/aqueous metal-gas batteries, we proceed to introduce aqueous metal-nitrate/nitrite batteries. The emphasis lies on elucidating effective strategies to enhance electrocatalyst activity, selectivity and stability, with a keen consideration of their significance in battery applications. Lastly, we outline the prevailing challenges and potential opportunities confronting current M−N bifunctional catalyst batteries, offering valuable insights for future research endeavors. This review marks the inaugural attempt to assess the present status of two distinct M−N battery systems and forecast their future developmental trajectories. 2 Overview of metal-N redox batteries In a common setup featuring a metal-redox bicatalyst battery configuration, key components include a metallic anode, a cathode with bifunctional catalytic properties, and a bipolar separator. This separator divides the electrolytes into separate sections while managing their pH levels independently. During discharge, substances such as N2 are introduced into the cathodic section, accepting electrons to produce valuable products. At the same time, the metallic anodes undergo electron loss, transforming into oxides or hydroxides. This interaction between power generation and chemical synthesis lies at the heart of its operational mechanism. Gas, typically the primary reactant, requires a flow regulator within the electrochemical apparatus, guiding its movement from an external source to the cathode surface, where the resulting chemicals are accumulated. To delineate the battery charging process, there are three distinctions among metal-redox bicatalyst batteries: (a) The non-rechargeability of primary cells, potentially stemming from irreversible reactions or design deficiencies; (b) Reversible batteries undergo a reverse reaction during discharge, wherein the product accepts electrons and returns to its initial reactant state; (c) Rechargeable batteries involve the formation of discharge products, with new substances being oxidized during charging, typically via OER with water at the anode, thereby completing the cycle [41,42]. 2.1 Considerations for anodes The metallic anode plays a pivotal role in M−N species batteries. Alkali metals like Li and Na are better suited for non-aqueous environments, as indicated by prior research [43,44], whereas Mg, Al, and Zn are frequently employed in batteries using aqueous M−N species [45–47]. Among various metal negatives, lithium metal stands out due to its exceptionally light mass (M w = 6.94 g mol−1, ρ = 0.535 g cm−3), electronegativity of −3.045 V (in comparison to the standard hydrogen electrode SHE potential), and an impressive theoretical specific capacity of 3860 mA h g−1, underscoring its high activity [48,49]. Similar to lithium, sodium is a highly reactive metal with a low ionization energy, enabling rapid combination with nitrogen during the reaction [50,51]. On the contrast, Zn offers notable benefits including enhanced safety, environmental compatibility, and cost-effectiveness. The direct use of Zn foil as an anode electrode material can provide a theoretical specific capacity of 819 mA h g−1, which is one of the largest-scale energy storage battery technologies with great application potential (Fig. 2 ) [52–54]. Within the domain of metal-based cells, Al-based batteries stand out as a highly promising energy storage alternative due to the considerable advantages of the Al anode, including high specific capacity, cost-effectiveness, abundant reserves, and lightweight composition. Al demonstrates a theoretically gravimetric capacity of 2980 mA h g−1, which is much higher than that of Mg (2200 mA h g−1) or Zn (819 mA h g−1) and only lower than that of Li. From a volume standpoint, Al has a larger volume capacity (8040 A h cm−3) than lithium (2060 A h cm−3) [55,56]. Mg is another economically viable metal choice, and when used as a metal anode, the battery has a high theoretical voltage (3.09 V) and energy density (6.8 kW h kg−1). Mg metal electrodes also have the following advantages: low electrode potential (−2.37 V vs. SHE), high Faraday capacity (2.2 A h g−1), and very low density (1.74 g cm−3) [57]. Table 1 illustrates that Li, Na, Al, and Mg exhibit higher specific capacities, whereas Zn boasts the lowest electrode potential. Among these commonly employed metal anodes, Zn predominates as the material of choice. This preference arises from the increased adaptability of chemical reactions in Zn-based batteries, facilitating a more straightforward and reversible recharge process. 2.2 Considerations for cathodes 2.2.1 Value-added reduction reactions of cathodes In the M−N species batteries, hydrogen evolution reaction (HER) takes precedence over the NRR, NORR, NO3 –RR and NO2 –RR, resulting in a poor Faradic efficiency (FE) and NH3 yield. Therefore, proper regulation of the cathode catalyst is essential. Below, we provide examples of four distinct cathode reactants engaged in Zn-N batteries within an aqueous solution. Corresponding reduction potentials at pH = 0 and their reaction mechanisms are illustrated [58–62]. N2 + 8H+ +6e– → 2NH4 +, V RHE = 0.275 V NO + 6H+ + 5e– → NH4 + + H2O, V RHE = 0.836 V NO3 – + 10H+ + 8e– → NH4 + + 3H2O, V RHE = 0.875 V NO2 – + 8H+ + 6e– → NH4 + + 2H2O, V RHE = 0.897 V By comparison, we can see that N2 has the largest negative reduction potential, while NO2 –/NO3 – has the highest electrochemical reduction potential. Consequently, NRR faces thermodynamic challenges, leading to diminished yields of NH3 and suboptimal current efficiency. Hence, NO2 –/NO3 – species present more appealing prospects for energy conversion and chemical synthesis. Drawing upon the theoretical oxidation–reduction potentials of metal anodes alongside the reduction potentials of various incremental reactions, the theoretical electromotive forces of M−N series batteries can be obtained. E theo = E cathode - E anode The theoretical energy density (ED) of these batteries is calculated as follows. ED = C × E theo where C represents the energy density attributed to the metal anodes. Additionally, we present the reaction mechanisms of four different cathode reactants used in Zn-N batteries across alkaline and neutral electrolytes. Reaction mechanisms at pH = 14 are illustrated. N2 + 8H2O + 6e– → 2NH4OH + 6OH– NO + 5H2O + 5e– → NH4OH + 5OH– NO3 – + 7H2O + 8e– → NH4OH + 9OH– NO2 – + 6H2O + 6e– → NH4OH + 7OH– Reaction mechanisms at pH = 7 are depicted. N2 + 8H2O + 6e– → 2NH4 + + 8OH– NO + 5H2O + 5e– → NH4 + + 6OH– NO3 – + 7H2O + 8e– → NH4 + + 10OH– NO2 – + 6H2O + 6e– → NH4 + + 8OH– For the battery system in which the electrolyte of Li/Na-N2 battery is an organic solution, taking the Li-N2 battery as an example, the corresponding reaction mechanism can be illustrated as follows [14]. N2 + 6Li+ + 6e– ↔ 2Li3N Li3N + 3H2O → NH3 + 3LiOH 2.2.2 Catalysts of cathodes Improving the performance of M−N batteries necessitates the incorporation of appropriate electrocatalysts with high activity. These catalysts help mitigate the overpotential associated with various electroreduction reactions in batteries, thereby accelerating the otherwise sluggish reaction kinetics. Until now, endeavors have been undertaken to enhance the activity of half-reaction electrocatalysts in M−N batteries. Precious metal based electrocatalysts (such as Pd, Pt and Au) usually exhibit excellent activity in electroreduction reactions [63]. Nevertheless, the industrial advancement of M−N batteries is hindered by the scarcity and expense of precious metals. As a result, there has been considerable interest in electrocatalysts without precious metals (like Fe, Co, Ni, and Cu) and metal-free electrocatalysts that can match the activity of catalysts containing precious metals. This is attributable to various strategies that govern the composition, coordination environment, and structure [64]. Beyond solely focusing on the electrode's inherent activity, the judicious management of the cathode surface in M−N batteries holds pivotal significance. The reaction substrate properties in organic/aqueous metal-gas batteries and aqueous metal-liquid batteries differ, with one involving ions and the other gases. Therefore, distinct catalyst surfaces should be devised for each reaction system. Especially in organic/aqueous M−N batteries where gas participates at the cathode, as seen in systems like organic/aqueous metal-N2, aqueous metal-NO and metal-NO2 batteries, the catalytic activity of the electrocatalytic cathode half-reaction apart from the inherent reaction kinetics, the local environment at the triple-phase interfaces involving the solid catalyst, liquid electrolyte, and gaseous reactant or product during reactions can significantly influence the electrochemical performance. Factors such as mass transport, electron conduction, and accessibility of active sites are crucial for the electrocatalytic processes and can be highly sensitive to the microenvironment [65]. Moreover, the real operating conditions of the electrocatalyst in M−N batteries substantially differ from those of the cathode semi-reaction. Consequently, the slow transfer of charges and gas diffusion limitations at the cathode may result in the incomplete utilization of active sites [66]. Hence, it is imperative to methodically engineer the electrode surface structure, optimize the three-phase interface, and mitigate side reactions between the electrocatalyst and electrolyte. This approach accelerates specific reaction kinetics, enhancing the overall performance of M−N batteries. Furthermore, considering the intricate reaction environment in M−N batteries, it becomes crucial to address the stability and durability of the electrocatalyst. To mitigate electrocatalyst degradation, surface blockage, and interference from competing reactions, the preservation of the catalyst's active site and emphasis should be placed on the distinct structural features and surface characteristics. Certainly, from an economic standpoint, a pivotal aspect in enhancing the industrial application potential of electrocatalysts is cost reduction. It is imperative to consider not only the expenses related to raw materials but also those associated with the preparation process, transportation, and environmental considerations. 2.3 Considerations for reaction parameters Apart from the internal composition's influence on battery performance, external factors play a significant role in shaping the functionality of the battery. Hence, meticulous adjustment of the reaction parameters within the discussed M−N battery system is of utmost importance. By optimizing the electrolyte flow, electrolyte pH, chemical raw material concentration and reaction temperature, the ideal operating conditions for laboratory research and practical applications can be obtained. Furthermore, a filtration unit is essential to capture the dissolved chemical NH3 and purify the electrolytes utilized. Moreover, when fine-tuning reaction parameters, it's crucial to consider not just varying M−N battery configurations, but also diverse industrial demands, energy origins, and product preferences. 3 Metal-N2/NO x redox batteries 3.1 Organic metal-N2 batteries Ammonia holds particular significance as a key ingredient in numerous food products and fertilizers. Additionally, ammonia serves as a direct or indirect component in the composition of various pharmaceutical drugs. Given its extensive array of applications, ammonia stands as one of the most widely produced inorganic compounds on a global scale [67,68]. However, the Haber-Bosch method is presently the primary technique used for producing ammonia. Nonetheless, it requires high temperature and pressure settings and consumes significant quantities of coal and natural gas, leading to substantial carbon dioxide emissions [69–73]. Therefore, an environmentally friendly strategy is urgently required for NH3 production. Electrocatalytic NRR presents a promising alternative to the Haber-Bosch process, offering lower energy requirements, improved energy efficiency, and enhanced production safety [74]. We can integrate the NRR with M−N batteries to simultaneously generate energy and fix nitrogen, then produce NH3 (Table 2 ). 3.1.1 Reaction mechanism of organic Li/Na/Al-N2 batteries Due to their high theoretical energy and excellent reversibility, Li-N2 batteries (LNBs) have become extensively researched within the domain of electrochemical nitrogen fixation. Consequently, LNBs facilitate a simultaneous N2/Li3N cycle, positioning them as a potentially groundbreaking technology for future energy storage systems. A rechargeable LNB featuring a carbon cloth (CC) cathode and an electrolyte based on ethers was reported [75]. During discharge, solid Li3N is produced, which then fully converts back into the original feed reactants as the discharge product. The reversible reactions involved in the discharge–charge cycle can be summarized as follows. Anode reaction: 6Li → 6Li+ + 6e– Cathode reaction: N2 + 6Li+ + 6e– → 2Li3N Overall reaction: 6Li + N2 → 2Li3N A faradic efficiency (FE) of up to 59% for N2 fixation was reported in a N2 fixation battery system assembled (Fig. 3 a–d). Given that the catalysts play a crucial role in enhancing N2 fixation efficiency, Ru-CC and ZrO2-CC composite cathodes were explored, and remarkably, the lithium-nitrogen batteries assembled with catalysts exhibited higher faradic efficiency (FE) compared to pristine CC cathodes. Drawing upon the analogous chemical and structural characteristics shared by Li and Na, a systematic exploration of organic Na-N2 batteries has been undertaken. A proof of concept has been established to engineer reversible and rechargeable Na-N2 batteries (NNBs) through the utilization of α-MnO2 nanowires (NWs)/CC as the cathode catalyst. Notably, the charge–discharge reactions mirror those observed in lithium-nitrogen batteries (LNBs) [76]. This system demonstrates remarkable performance, exhibiting a reversible capacity of 600 mA h g−1 at 50 mA g−1. It sustains approximately 80 cycles with a controlled capacity of 400 mA h g−1 at discharge terminal voltage below 1.6 V, while achieving a high actual specific energy density based on total active materials (approximately 4900 W h kg−1) at a current density of 100 mA g−1. Moreover, it achieves a good efficiency of nitrogen fixation (∼26%). These impressive results are primarily attributed to the unique channel structure, high conductivity, and exceptional catalytic activity, as revealed by in-situ environmental transmission electron microscopy investigations. Although Li/Na-N2 batteries show potential for various applications, the considerable Gibbs free energy involved in the formation of Li3N or Na3N highlights the need for catalysts and the presence of significant electrochemical polarizations. Given the higher Gibbs free energy for the AlN formation reaction (−287 kJ mol−1), there is an exploration into organic rechargeable Al-N2 batteries. Initially, a rechargeable ANB focusing on N2 fixation was developed, employing graphene/Pd as the cathode catalyst along with an aprotic ionic liquid electrolyte. Below elucidates the reaction mechanism [77]. Anode reaction: 2Al + 14AlCl4 – → 8Al2Cl7 – + 6e– Cathode reaction: N2 + 8Al2Cl7 – + 6e– → 14AlCl4 – + 2AlN Overall reaction: 2Al + N2 → 2AlN In this setup, the creation and breakdown of the cathodic AlN product during cycling are essential for ensuring the battery's ability to recharge and maintain its cycle life (Fig. 3e). Remarkably, the battery demonstrates outstanding capabilities in fixing N2, boasting an impressive faradaic efficiency (FE) of 51.2%, surpassing performance seen in other systems. Additionally, in organic metal-N2 batteries, the solid electrolyte interphase (SEI) layer forms on the negative electrode surface through the reaction of inorganic electrolyte substances with the negative electrode material. This layer functions as a solid electrolyte, enabling efficient metal ion conductivity while insulating electrons. It effectively prevents solvent molecules from co-intercalating into the electrode material, thereby enhancing electrode cycle performance and lifespan. Thus, optimizing the SEI layer enhances overall battery performance [74–76]. In the realm of organic metal-N2 batteries, the sluggish reaction kinetics arising from the formation and dissolution of soluble and insulating discharge byproducts lead to heightened overpotential and decreased energy efficiency during cycling. Furthermore, the degradation of discharge capacity in metal-air batteries is exacerbated by the decomposition of organic electrolytes and the generation of side products, particularly under elevated current densities [79–82]. 3.1.2 Electrochemical performance of current organic metal-N2 batteries Due to the limited activity and durability of the cathode catalyst, the electrochemical performance of organic metal-N2 batteries does not meet optimal standards. Consequently, a range of strategies is imperative to enhance the overall electrochemical performance of these batteries. The graphene cathode catalyst and 1 M LiClO4 in TEGDME served as the electrolyte, demonstrating a respectable cut-off discharge capacity of 1000 mA h g−1 at 100 mA g−1 after 50 cycles with the LNB. Analysis uncovered the existence of both the discharge product Li3N and isolated LiOH on the cathode after undergoing a 50-hour deep discharge procedure [83]. Simultaneously, a decrease in the N element content on the cathode both pre and post cycle was also observed by the research team, indicating the possibility of more intricate discharge products during cycling. Through continued research efforts, the challenges in the application of organic Li-N2 batteries have been systematically addressed, leading to substantial improvements in their electrochemical performance. Nonetheless, controversies persist regarding their electrochemical reversibility and the intricacies of their reaction mechanisms. A heterostructure composed of Ru/Mo2C, synthesized on N-doped carbon nanotubes (NCNTs) through atomic layer deposition, was investigated as a cathode catalyst for N2 utilization and electrochemical energy storage in Li-N2 battery systems. The battery utilizing the Ru/Mo2C-NCNTs cathode showcases a specific capacity exceeding 8500 mA h g−1 and maintains stability over 50 discharge/charge cycles, with a consistently low overpotential of 2.4 V at a current density of 100 mA g−1 [83]. Additionally, a reversible and rechargeable Li-N2 battery was assembled using non-precious SnO2-dispersed N-doped carbon nanosheets (N-CNS)/CC cathode catalysts, and the previously employed LiCF3SO3 and LiClO4 electrolytes were replaced with LiTFSI. Notably, the Li-N2 battery demonstrated full reversibility, providing a high discharge capacity of around 500 mA h g−1 (0.25 mA h) even under extreme current rates of 1000 mA g−1 after 100 consecutive cycles. This remarkable performance can be attributed to the sturdy N2 adsorption/desorption properties of the SnO2 catalyst, the excellent conductivity of NCNS and CC, and the homogeneous pore distribution within the cathode catalysts (Fig. 3f and g). 3.2 Aqueous metal-N2 redox batteries 3.2.1 Reaction mechanism and primary/rechargeable metal-N2 battery The solvent in the electrolyte of aqueous M−N batteries (Table 3 ) replaces traditional organic solvents with water, providing distinct benefits: it is environmentally friendly, safe and cost-effective. Building upon this notion, research indicates that the surface mass transport properties of catalysts are crucial factors influencing the electrocatalytic selectivity of NRR over the competing HER in aqueous environments, particularly on metallic copper substrates. Thus, a primary Zn-N2 battery was assembled as a new application for the NRR [85]. By adjusting the thickness of Cu nanoparticles to a monolayer, a significant NRR FE of 33% was attained. The specific reaction pathway is outlined as follows (Fig. 4 a–d). Anode: Zn + 2OH– →ZnO + H2O + 2e– Cathode: N2 + 6H2O + 6e– → 2NH3 + 6OH– Overall reaction: 3Zn + N2 + 3H2O → NH3 + 3ZnO However, this non-rechargeable Zn-N2 battery is primarily tailored for applications like artificial nitrogen fixation and energy generation, serving as a primary power source. Ren et al. proposed an aqueous rechargeable Zn-N2 battery with active bifunctional NRR-OER catalysts (Fig. 4e) [86]. They constructed an aqueous rechargeable Zn-N2 battery by pairing bifunctional cobalt phosphate nanocrystals-loaded heteroatoms-doped carbon nanosheets (CoPi/NPCS) as the cathode electrocatalyst with a commercial Zn plate serving as the anode, employing KOH electrolyte. This CoPi/NPCS-catalyzed Zn-N2 battery achieved a high yield rate of N2 to NH3 at 14.7 μg h−1 mgcat. –1 and a FE of 16.35% at 0.6 V vs. Zn2+/Zn, while demonstrating a peak power density of 0.49 mW cm−2 and an energy density of 147.6 mW h gzn –1 (Fig. 4f and g). Apart from Zn, Al serves as another invaluable catalyst, showcasing outstanding properties. Accordingly, a proposed solution involves an aqueous Al-N2 battery featuring cathode electrocatalysts comprised of hollow molybdenum phosphate microspheres (Fig. 4h) [87]. Below elucidates the reaction mechanism. Anode: 2Al + 8OH– → 2AlO2 – + 4H2O + 6e– Cathode: N2 + 6H2O + 6e– → 2NH3 + 6OH– Overall reaction: 2Al + N2 + 2H2O + 2OH– → 2NH3 + 2AlO2 – Benefiting from the advantageous active components present in molybdenum phosphates and the increased exposure of active sites, the fabricated MoPi/HSNPC catalyst demonstrates remarkable performance in nitrogen reduction reactions (NRR) within alkaline electrolytes (Fig. 4i and g). The catalyst demonstrated a peak NH3 yield rate of 18.66 μg h−1 mgcat. –1 at −0.2 V vs. RHE, boasting a Faradaic efficiency of 9.04%. This performance level compares favorably with recently revealed non-precious catalysts for NRR. Moreover, it exhibited impressive long-term cycle stability, signaling a promising avenue for aqueous Al-N2 battery research. Electrochemical NRR is emerging as an eco-friendly approach to ammonia synthesis, leveraging room temperature conditions and readily available atmospheric nitrogen and water as feedstocks. Nonetheless, the substantial bond energy of N≡N bonds (941 kJ mol−1) and their limited solubility in water hinder efficient ammonia production, compounded by the competing HER, which compromises NRR performance. Hence, there's a pressing need for the development of highly efficient catalysts to address these challenges. 3.2.2 Strategies on improving electrochemical performance for the aqueous metal-N2 batteries Drawing from advancements in bifunctional catalysts and innovations in electrolyte and anode materials for aqueous metal-N2 batteries, future development trajectories and enhancement strategies are suggested for such batteries, focusing on the following aspects: Defect engineering offers a pragmatic approach to enhance electrocatalytic reduction efficiency by adeptly modulating the electronic characteristics and surface configuration of catalysts. Notably, vacancy defects within the crystal lattice have surfaced as a promising avenue for fine-tuning electrode materials [88–90]. An active and stable electrocatalyst for NRR by plasma-etched Ti2O3 with oxygen vacancies (OV-Ti2O3) was reported (Fig. 4k) [91]. An aqueous Zn-N2 battery equipped with the OV-Ti2O3 cathode demonstrated a power density of 1.02 mW cm−2 alongside an NH3 yield of 4.3 µg h−1 mgcat. –1 upon assembly. In addition, introducing heteroatom doping can effectively modulate the electronic configuration of the catalyst, thereby enhancing its catalytic activity. Drawing from the material's inherent structure, the introduction of various foreign atoms both metallic (e.g., Fe, Co, Ni, Cu) and non-metallic (e.g., N, O, C, B, P, S) can redistribute electron and spin densities within the catalyst. This adjustment facilitates the fine-tuning of reaction intermediate energetics at precise locations [92,93]. Leveraging this concept, a novel structure termed ultrathin N.S-codoped carbon matrix-embedded vanadium nitride nanodots (VN@NSC) was engineered. This innovative design showcased notable attributes including durable stability, elevated NH3 yield, and insensitivity to pH fluctuations during the electrochemical ammonia synthesis process [35]. Moreover, VN@NSC served as the active N2 cathode within an assembled aqueous Zn-N2 battery. This configuration facilitated both NH3 synthesis, with an average yield of 0.172 μg h−1 cm−2, and concurrent electricity generation, yielding a power density of 16.42 μW cm−2. Such performance underscores its considerable promise for real-world applications. Manipulating surface morphology offers a pathway to enhance the NRR performance of catalysts by modifying their physical and chemical characteristics. The catalytic performance of a material is profoundly affected by its specific surface area and microstructure. Consequently, adjusting the catalyst to a nanostructured form offers benefits such as increased surface area, enhanced mass transfer rates, and improved reaction stability. Inspired by the breathing process of mammalian alveoli, a shell-engineering approach was devised to craft iron-doped titanium dioxide hollow nanospheres (FeHTNs) abundant in oxygen vacancies, tailored for NRRs (Fig. 4l) [94]. The distinctive hollow configuration and porous shell of FeHTNs expedite N2 delivery into a structure akin to “alveoli”, extending contact time with the inner surface of electrocatalysts. This prolonged interaction accelerates NRR kinetics, thereby promoting efficient ammonia synthesis. When Fe1.0HTNs were employed as the N2 cathode in assembling aqueous Zn-N2 batteries, they demonstrated dual functionality: ammonia production (with an average NH3 yield of 0.172 mg h−1 cm−2) and electricity generation (yielding a power density of 16.42 mW cm−2). This dual capability presents an intriguing potential for practical utilization. In the same way, 2D transition metal compounds present promising candidates as electrocatalysts owing to their ultra-thin layered structure, expansive specific surface area, dense distribution of surface active sites, superior electrochemical characteristics, and facile interface transmission, thus facilitating shorter diffusion pathways [95,96]. An exfoliated FePS3 nanosheet, characterized by a porous structure and abundant sulfur vacancies (Vs-FePS3 NSs), was created through a combination of electrochemical exfoliation and hydrogenation processes (Fig. 4m) [97]. Due to their abundant sulfur vacancies and distinctive 2D structure, featuring a thickness of approximately 15 nm and lateral dimensions around 500 nm, Vs-FePS3 NSs exhibit remarkable electrochemical activity in NRR. This is evidenced by a high Faradaic efficiency of 12.36% at −0.20 V and an ammonia yield rate of 3.88 μg h−1 cm−2 at −0.25 V versus the reversible hydrogen electrode under acidic conditions. Furthermore, when employed as the cathode in a Zn-N2 battery configuration, Vs-FePS3 NSs demonstrate a notable power density of 2.6 mW cm−2 (Fig. 4n). 3.3 Aqueous Zn-NO x redox batteries 3.3.1 Reaction mechanism of aqueous Zn-NO x batteries NO poses a substantial threat to human health, primarily affecting the respiratory tract. This is due to its high oxidative nature [100–103], rendering it more amenable to reduction than the comparatively inert, non-polar N2. Hence, the development of aqueous Zn-NO batteries hold promise for achieving simultaneous NO abatement and NH3 production (Table 4 ). It is reported that an aqueous Zn-NO battery assembled with MoS2 nanosheet on graphite felt (MoS2/GF) acts as a 3D electrocatalyst for NO to NH3 conversion [101]. Below elucidates the reaction mechanism. Anode: Zn + 2OH– → ZnO + H2O + 2e– Cathode: NO + 5H+ + 5e– → NH3 + H2O Overall reaction: 5ZnO + 2NO + 3H2O → 5ZnO + 2NH3 The calculations analysis indicates that the positively charged Mo-edge site enhances the adsorption and activation of NO via a receiving-donation mechanism. However, this mechanism discourages proton binding and N–N bond coupling. In an acidic electrolyte, MoS2/GF achieves a peak Faradaic efficiency of 76.6% and yields a substantial NH3 production rate of up to 99.6 mmol cm–2 h−1. A power density of 1.04 mW cm−2 and an NH3 yield of 411.8 μg h−1 mgcat. –1 can be obtained in the aqueous Zn-NO battery when using this MoS2 nanosheet-loaded carbon as the cathode. NO demonstrates relatively subdued reactivity, yet it readily oxidizes into NO2 upon exposure to the atmosphere—an entity recognized for its potent corrosive and toxic attributes. This conversion significantly contributes to pollution in water, soil, and the atmosphere [104–107]. Hence, an imperative exists to devise a strategy that can concurrently alleviate the detrimental effects of nitrogen dioxide accumulation while generating value-added chemicals or electricity. The electrocatalytic transformation of NO2 into valuable compounds offers a hopeful strategy to mitigate disturbances caused by human activities in the worldwide nitrogen cycle. An envisioned electrochemical setup comprises an aqueous Zn-NO2 battery design, incorporating a cathode coated with a nano-NiO catalyst, a Zn foil anode, and an electrolyte consisting of a ZnCl2 aqueous solution [40]. Below elucidates the reaction mechanism. Anode: Zn → Zn2+ + 2e– Cathode: 2NO2 + 2e– → 2NO2 – Overall reaction: Zn + 2NO2 → Zn (NO2)2 The electrolyte effectively captures NO2, converting it into NO2 – and ultimately into valuable NH3, while also generating electrical power. Remarkably, pouch cells (2.4 A h) have achieved a high cell-level energy density of 553.2 W h kg–1 cell/1589.6 W h L–1 cell. And an electrochemical Haber-Bosch reactor was constructed, self-powered by the Zn-NO2 batteries to convert NO2 to NO2 – and further to NH3. The self-sustaining system can generate an NH3 yield of 4 mM h−1, maintaining a consistent output current density of 2.1 mA cm−2 at 3.0 V. This demonstrates the potential to harness residual kinetic energy from exhaust gas to facilitate valuable NH3 synthesis. 3.3.2 Strategies on improving electrochemical performance for the aqueous metal-NO x batteries Prudent nanoarray structure design imparts distinctive surface effects to the catalyst material, facilitating ease of size control. An efficient NORR electrocatalyst for the selective hydrogenation of NO to NH3 was devised, utilizing a Ni2P nanosheet array on carbon paper (Ni2P/CP) as the substrate [108]. In a 0.1 M HCl solution, Ni2P/CP demonstrates significant NH3 production at a rate of 33.47 mmol h−1 cm−2, coupled with a commendable faradaic efficiency of 76.9% at 0.2 V vs. the reversible hydrogen electrode. Moreover, it exhibits exceptional durability under operational circumstances. The aqueous Zn-NO battery assembled with Ni2P/CP delivers a discharge power density of 1.53 mW cm−2 and an NH3 yield of 62.05 mg h−1 mgcat. –1 (Fig. 5 a and b). Theoretical computations indicate that the Ni2P (111) surface facilitates NO adsorption and activation through an “acceptance-donation” mechanism, with the hydrogenation of *NO to *NOH identified as the potential-determining step (Fig. 5c and d). Furthermore, theoretical investigations were conducted to explore the competition of the HER and other byproducts. The findings substantiate the superior selectivity of the NO to NH3 conversion process. Additionally, the research team has made significant contributions in developing efficient catalysts, when used as the cathode of the aqueous Zn-NO battery, a high NH3 production selectivity can be demonstrated by these catalysts [109–116]. Furthermore, designing electrocatalytic NORR catalysts involves the effective strategy of constructing atomically dispersed catalysts with distinctive atomic structures and electronic properties [118]. Ce single atoms were incorporated onto nitrogen-doped hollow carbon spheres (Ce-SA/NHCS), a deliberate design choice [119]. Theoretical analysis suggests that the atomically scattered Co-N4 active component efficiently suppresses competing HER while simultaneously boosting the hydrogenation of reaction intermediates. As a result, Ce-SA/NHCS exhibits a FE of 91% and an NH3 yield rate of 1023 μg h−1 mgcat. –1 at −0.7 V vs. RHE. These findings surpass those of Ce nanoclusters (Ce-NC/NHCS), despite lower Ce contents, and are comparable to leading reported results. Notably, in a Zn-NO battery with Ce-SA/NHCS as the cathodic catalyst, a peak power density of 3.4 mW cm−2 and an impressive NH3 yield rate of 309 μg h−1 mgcat. –1 were achieved, marking a significant advancement over previous Zn-N2 batteries. This investigation expands the application of single-atom catalysts (SACs) for highly efficient NORR to NH3 conversion and NO removal. The team also prepared NORR electrocatalysts for nickel–iron layered double hydroxide nanosheet arrays [120] and nitrogen-doped carbon nanosheets encapsulating MoC nanocrystals [121], both of which showed excellent NORR electrocatalytic performance in Zn-NO aqueous solution batteries. Lattice regulation presents a novel approach to augmenting the properties of catalyst materials. An arrangement of cobalt nanosheets in a hexagonal-close-packed (hcp-Co) configuration was developed to efficiently transform NO into NH3 (Fig. 5e) [122]. The hcp phase of Co demonstrates superior performance, with a high NH3 yield of 439.50 μmol cm–2 h−1 and a Faraday efficiency of 72.58%. This outperforms the face-centered cubic phase (fcc-Co) of the Co nanosheet and surpasses the majority of previously reported results (Fig. 5f–h). By combining density functional theory calculations with NO temperature-programmed desorption experiments, the improved catalytic performance of hcp-Co in the NORR is due to its unique electron configurations and the facilitation of proton transfer. What's even more remarkable, the Zn-NO batteries shows a high open-circuit voltage of 2.06 VZn, an NH3 yield of 247.80 μg h−1 mgcat. –1 and a power density of 4.66 mW cm−2, when using the hcp-Co as the cathode. The batteries mentioned above are part of the metal-gas series batteries, including aqueous/organic metal-N2, aqueous metal-NO and aqueous metal-NO2 batteries. Unlike traditional organic metal-N2 batteries, the electrolyte solvent in aqueous metal-N2 and metal-NO x batteries substitutes the typical organic solvent with water, providing notable benefits such as environmental friendliness, safety, and cost-effectiveness. Additionally, our research and comparisons have consistently shown that aqueous metal-nitrogen oxide batteries outperform aqueous/organic metal-N2 batteries in terms of performance. 4 Aqueous Zn-NO x – redox batteries 4.1 Reaction mechanism of aqueous Zn-NO x – batteries Due to its higher reduction potential, NO2 – proves to be well-suited for constructing electrochemical systems capable of simultaneously generating ammonia and energy [123,124]. Therefore, NO2 –RR has broad application prospects in aqueous Zn-NO2 – batteries. A Zn-NO2 – battery was engineered, employing carbon-doped cobalt oxide (C/Co3O4) hollow nanotubes assembled from nanoparticles as the cathode. This configuration facilitates the concurrent degradation of NO2 –, NH3 production, and electricity generation [58]. Below elucidates the reaction mechanism. Anode: 3Zn → 3Zn2+ + 6e– Cathode: NO2 – + 6H2O + 6e– → NH4OH + 7OH– Overall reaction: 3Zn + NO2 – + 6H2O → 3Zn2+ + NH4OH + 7OH– The introduction of interstitial C dopants induces a local electric field, enhancing charge transfer and reducing the energy barrier of the rate-determining step (*N + e– + H2O − *NH + OH), thereby promoting the NO2 –RR process. Consequently, C/Co3O4 demonstrates a nearly 100% FE for NH3 production across a wide potential window from 0.1 to 0.6 V versus a reversible hydrogen electrode. The Zn-NO2 – battery, when assembled, achieves a power density of 6.03 mW cm−2 and a peak NH3 FE of 95.1%. Nitrates are pervasive environmental pollutants, commonly found in various forms, including gaseous water, surface water, groundwater, as well as within the bodies of animals and plants. Exceeding the recommended levels of nitrate in the human body can lead to severe and potentially fatal health consequences [125]. Hence, there is a pressing need to transform harmful nitrates into NH3, a compound beneficial to us, by means of nitrate electroreduction. By incorporating NO3 –RR into aqueous Zn-NO3 – batteries, we can simultaneously address nitrate pollution and generate electricity, offering a comprehensive solution to this environmental issue (Table 5 ). The conception and realization of a Zn-nitrate battery system coincided with the unveiling of a remarkably effective Pd-doped TiO2 nanoarray electrode tailored for NH3 synthesis via the NO3 –RR (Fig. 6 a and b). By introducing Pd, the catalyst exhibits reduced adsorption capacities towards intermediates, culminating in unprecedented NH3 yields of 1.12 mg cm–2 h−1, an impressive NH3 Faradaic efficiency of 92.1%, and exceptional nitrate conversion rates of 99.6%. In conjunction, the assembled aqueous Zn-NO3 – battery, integrated with Pd-TiO2, achieves a power density of 0.87 mW cm−2, coupled with a Faradaic efficiency of 81.3% (Fig. 6c). A recently documented aqueous Zn-NO3 – battery featured a design comprising Zn foil serving as the anode and nickel foam hosting Ru nanoparticles acting as the cathode. Below elucidates the reaction mechanism [126]. Anode: 4Zn + 8OH– → 4ZnO + 4H2O + 8e– Cathode: NO3 – + 7H2O + 8e– → NH4OH + 9OH– Overall: 4Zn + NO3 – + 3H2O → NH4OH + OH– Due to the creation of a Ru/Ni hydroxide hybrid, there is a notable enhancement in the reaction rate to 384 mmol h−1 mgRu –1, coupled with an impressive Faradaic efficiency of 97% ± 2% at −0.6 VRHE. Throughout ammonia generation, this Zn-NO3 – battery can sustain an impressive maximum power density of 51.5 mW cm−2 and 23.3 mW cm−2, while maintaining an exceptionally high Faradaic efficiency of 97% ± 4% at 40 mA cm−2 even during prolonged testing. 4.2 Strategies on improving electrochemical performance for the aqueous metal-NO x – batteries The two catalysts mentioned above are both precious metals (Pd and Ru), and the high cost and low durability of precious metal electrocatalysts hinder their practical application. Therefore, transition metals and their derivatives represent viable substitutes for mitigating these constraints. Since there are still some problems in the electrocatalytic activity of transition metal-based catalysts, various strategies for optimizing transition metal-based catalysts have been proposed [126,127]. A compact membranous Co nanomaterial (DM-Co) was fabricated on a copper substrate via a combination of chemical and electrochemical deposition techniques, showcasing superb electrocatalytic capabilities for selectively converting NO3 – to NH4 + and facilitating low overpotential alkaline OER [38]. The cathode catalyst facilitates both the reduction of NO3 – to NH4 + and the oxidation of OH– to O2 through pathways with low overpotentials, influencing the overall battery reaction: NO3 – + 3H2O → NH4 + + 2OH– + 2O2. The resulting electrochemical cell exhibits over 90% selectivity for NO– to NH4 +, achieves a power density exceeding 25 mW cm−2, and sustains stable cycling for 35 h at 12.5 mA cm−2. Additionally, this Zn-NO3 – battery can be powered by a photovoltaic cell, achieving a solar-to-NH3 efficiency of up to 19.5%. This is due to the intrinsic tendency of metallic Cu-based materials to manifest a comparatively diminished capacity for supplying atomic H*. In contrast to homogeneous catalysts, heterogeneous catalysts offer the advantage of multiple active centers and effective morphological control. Thus, a new and straightforward approach involving O2/Ar plasma oxidation followed by electroreduction was devised to produce a metastable phase of copper [36]. The metastable form of copper exhibits enhanced performance in NITRR compared to the conventional phase, boasting remarkable NH4 + selectivity (97.8%) and Faradaic efficiency (99.8%). The enhanced selectivity and Faradaic efficiency are likely due to the adjustment of the d band center towards the Fermi level in the metastable phase of copper, coupled with the strong adsorption of H, which aids in converting NO2/NO* to NOOH/NOH (Fig. 6d and e). When evaluated as the cathode, a high power density (7.56mWcm−2) and an NH4 + yield (76 µmolh−1 cm−2) are achieved. Moreover, the eight-electron transfer process in NO3 −RR stands as a crucial factor influencing its reactivity. Addressing the sluggish 8-electron transfer kinetics in NO3 –RR, a Cu nanowire array was utilized as a proficient electrocatalyst for nitrate reduction. This arrangement splits the NO3 –RR process into two phases using a [2 + 6]– electron pathway, reducing the kinetic barrier (Fig. 6f–h) [128,129]. When transition metals and their compounds are used as the cathode of aqueous Zn-NO3 – batteries, single-atom doped catalysts, structural engineering, interface engineering and defect engineering strategies can effectively optimize the activity and overall performance of electrocatalytic NO3 –RR [131–137]. Recently, single-atom doped catalysts have emerged as promising electrode materials in a variety of energy storage and conversion systems, owing to their unique features. As an illustration, an effective catalyst for NO3 –RR, Iron-doped nickel phosphide (Fe/Ni2P), was developed [134]. The NH3 Faradaic efficiency of the Fe/Ni2P catalyst is remarkable at 94.3%, with nitrate conversion efficiency nearly reaching 100% at −0.4 V vs. RHE. The Fe/Ni2P-integrated aqueous Zn-NO3 – battery achieves a notable power density of 3.25 mW cm−2 and a substantial Faradaic efficiency of 95.0% for NH3 production. Furthermore, a novel hybrid nanoarray of NiCoBDC@HsGDY with a multifunctional interface was proposed. This involves surface engineering of bimetallic Ni/Co-MOFs (NiCoBDC) with hydrogen-substituted graphdiyne (HsGDY) (Fig. 6i) [133]. By employing interface engineering, a fraction of electrons is transferred from Ni2+ to the coordination-unsaturated Co2+ sites on the surface of NiCoBDC. This dual effect not only enhances the reduction of *NO3 on Co2+ but also activates the hydrolytic dissociation to form *H on Ni2+. Furthermore, the conformally coated HsGDY facilitates the simultaneous accumulation of electrons and NO3 – ions at the NiCoBDC-HsGDY interface. This arrangement effectively promotes the reduction of *NO3 to *H on Ni2+ and·H2O on Co2+, transitioning from deoxidation to hydrogenation processes (Fig. 6j). Consequently, the NiCoBDC@HsGDY nanoarray exhibits substantial NH3 yield rates, maintaining a Faradaic efficiency exceeding 90% across broad potential and pH ranges. When integrated into an aqueous Zn-NO3 – battery configuration, it attains a notable power density of 3.66 mW cm−2, indicating promising prospects within the realm of aqueous Zn-based batteries. Recent reports highlight that the combined effects of hydrogen-bond interactions and hydrogen spillover significantly enhance NO3RR performance. A highly effective catalyst for NO3RR, sub-nm RuO x clusters anchored on a Pd metallene (RuO x /Pd), has been reported [141]. Operando spectroscopic characterizations, coupled with theoretical computations, reveal how the synergy between RuO x and Pd enhances NO3RR energetics via mechanisms involving hydrogen spillover and hydrogen-bond interactions. In detail, RuO x activates NO3 – to form intermediates, while Pd dissociates H2O to generate *H, which migrates spontaneously to the RuO x /Pd interface via a hydrogen spillover process. Further hydrogen-bond interactions between the spillovered *H and intermediates facilitate its desorption from the RuO x /Pd interface and its participation in intermediate hydrogenation, thereby enhancing the activity of RuO x /Pd for converting NO3 – to NH3. Based on the comprehensive analysis provided above, it is evident that aqueous metal-NO x – batteries consistently demonstrate superior performance compared to metal-NO x /N2 batteries across a range of performance indicators. These indicators include efficiency, NH3 yield rates and stability, making aqueous metal-NO x – batteries the preferred choice for power generation and storage applications due to their remarkable performance attributes. 5 Current problems with metal-N redox batteries Basically, metal-N species batteries, including aqueous/organic metal-N2, aqueous metal-NO, aqueous metal-NO2, aqueous metal-NO3 – and aqueous metal-NO2 – batteries can hold promise for converting seemingly useless or detrimental gases into valuable NH3 while simultaneously generating electricity. Nevertheless, in the context of these M−N batteries, the hydrogen evolution reaction always takes precedence over the NRR/NORR/NO3 –RR and NO2 –RR, resulting in a poor Faradic efficiency and low NH3 yield. The presence of the unwanted HER significantly reduces the conversion efficiency in M−N series batteries. In the above report, we summarize the efforts of many current researchers to improve the selectivity of these electro-reduction reactions. They designed highly efficient cathode catalysts for inhibiting HER to achieve higher voltages output, power densities, NH3 yield rates and FEs. Nonetheless, despite the development of relatively efficient cathode catalysts for catalyzing the reaction, the selectivity of the HER process still remains high. Consequently, there is an ongoing need to enhance the yield of NH3 production and establish efficient product separation facilities. Moreover, in the realm of power generation, the reported power density from these endeavors is still considerably below the desired ideal standards. Therefore, subsequent research efforts should prioritize enhancing the selectivity of these reactions while also augmenting the power density for improved power generation capabilities. In addition to exploring intrinsic catalytically active sites, catalytic processes and reaction mechanisms should be investigated using in-situ characterization methods and theoretical calculations. Despite the preparation of various electrocatalysts with excellent catalytic performance in recent years, there remains an insufficient in-depth understanding of their catalytic mechanisms. Advanced characterization methods, including X-ray absorption spectroscopy, electron paramagnetic resonance, and in-situ Raman spectroscopy, have been employed to investigate complex reaction mechanisms. However, further study is needed to explore the relationship between intrinsic activity, geometric and coordination structures, surface modulation of active sites, and their configuration during catalysis. Besides grappling with the competitive reaction challenges in M−N batteries, their development remains nascent, primarily confined to laboratory settings without widespread industrial application. In laboratory settings, the ideal experimental conditions, including electrolyte pH, gas flow rate, and electrode surface area are pivotal for conducting standardized tests and evaluating electrocatalyst designs effectively. Moreover, integrating battery configurations with operando characterization technology allows for comprehensive performance analysis under conditions mimicking real-world operation, offering valuable insights for catalyst refinement. Furthermore, addressing product separation concerns, particularly concerning the solubility of chemical byproducts, necessitates the incorporation of filtration mechanisms within battery setups to facilitate product collection and electrolyte purification. Further creative configurations for batteries are also required. Moreover, it is crucial to attain bifunctional electrocatalytic performance to facilitate the rechargeable processes of the battery. The mismatch between multi-element and multi-charge transfer rate requires the rational design of coupling active sites with high intrinsic activity at the atomic level. To comprehensively gauge the effectiveness of these strategies, computational studies emerge as indispensable tools for gaining in-depth insights into atomic and interface mechanisms. Incorporating computational methods into research efforts within this field is essential. Utilizing catalyst descriptors along with machine learning techniques facilitates catalyst screening, streamlining the design process. This approach provides a dependable interpretation of structure–activity relationships for the developed electrocatalysts. This streamlined approach holds the promise of circumventing the laborious trial-and-error practices commonly tied to traditional experimental methods. Furthermore, in the process of selecting an electrocatalyst for practical application, it is imperative to factor in the overall cost involved in catalyst development. This cost encompasses not only the expenses related to raw materials but also those tied to the preparation process, transportation, and its environmental footprint. As we chart the course for future research endeavors, a strong emphasis should be placed on prioritizing materials derived from earth's abundant resources, employing straightforward preparation techniques, sourcing materials locally, and minimizing adverse environmental impacts. By taking all these considerations into account, the integration of M−N batteries into everyday life and industrial production can be accelerated, thereby expanding their application prospects. 6 Conclusions and outlook This review delves into the latest advancements within M−N series battery technology, which have the capability to perform multiple electroreduction reactions at the cathode. This enables concurrent power generation alongside valuable chemical production, wastewater treatment, or product purification. We firstly provide a comprehensive and detailed review to describe batteries and cathode discharging reactions, including NRR, NORR, NO3 –RR and NO2 –RR. We comprehensively delve into the cathodes and anodes of M−N batteries. Subsequently, we meticulously explore the recent advancements in the design of electrocatalysts across various M−N batteries. The discussion covers recent research advancements, focusing on strategies to improve the activity, selectivity, and stability of electrocatalysts, as well as their practical suitability for battery applications. Finally, we present an insightful analysis of the challenges and opportunities confronting current M−N bifunctional catalyst batteries, offering valuable guidance for future research endeavors. The actual performance of batteries also relies on factors such as the electrode catalyst and battery configuration. Specifically concerning electricity generation, organic/aqueous metal-N2, aqueous metal-NO, metal-NO3 –, metal-NO2 – and metal-NO2 batteries achieve a peak power density ranging from 0 to 92 mW cm−2. and aqueous metal-NO x – batteries consistently exhibit superior performance compared to metal-NO x /N2 batteries (Fig. 7 ). Hence, within the M−N series battery, enhancing the overall battery performance is achievable through modifications in the substrate of nitrogen species. Our review underscores the viability of this concept, paving the way for promising avenues. Consequently, future scientific research endeavors can delve into the exploration of additional N species for their participation in the M−N series battery systems. Moreover, batteries employing noble metal-based catalysts typically demonstrate enhanced overall performance. Nevertheless, the widespread use of precious metal catalysts is hindered by their high cost and limited availability. Consequently, in pursuit of cost-effective alternatives, non-precious metal-based materials emerge as promising substitutes. The development of non-precious metal-based catalysts holds significant importance in achieving both cost reduction and broader applicability. In addition, the reactant sources of M−N batteries are considered to be zero cost, which is conducive to practical applications. Besides, removing the N source from the air and producing ammonia can create additional value. Future research endeavors should extensively investigate value-added metal-redox bicatalyst batteries, focusing on achieving high selectivity. Moreover, to enhance versatility and boost potential for industrialization, it is imperative to explore additional electroreduction reactions within configurations of metal-redox dual catalyst batteries, beyond the presently promising options. Given the progress of M−N batteries to date, as well as the challenges and opportunities for their future development, we are optimistic about the development potential in this area. The conception of a novel approach to value-added power generation holds significant promise for advancing the emergence of a renewable economy, contributing to environmental preservation and energy production. This review aims to offer insightful guidance for the advancement of M−N battery systems, potentially catalyzing further developments in this domain. CRediT authorship contribution statement Feng-Xiao Yan: Writing – original draft, Investigation. Hao-Yu Wang: Writing – review & editing. Yi Feng: Writing – review & editing. Hao Wang: Investigation. Zhong-Yong Yuan: Writing – review & editing, Supervision. Declaration of competing interest The authors declare that they have no known competing financial interests or personal relationships that could have appeared to influence the work reported in this paper. Acknowledgments This work was supported by the National Natural Science Foundation of China (22179065) and the Tianjin Graduate Research and Innovation Project (2022BKY018). References [1] J.T. Ren L. Chen H.Y. Wang W.W. Tian Z.Y. Yuan Energy Environ. Sci. 17 2024 49 113 J.T. Ren, L. Chen, H.Y. Wang, W.W. Tian, Z.Y. Yuan, Energy Environ. Sci. 17 (2024) 49-113. [2] J.T. Ren L. Chen H.Y. Wang Z.Y. Yuan Chem. Soc. Rev. 52 2023 8319 8373 J.T. Ren, L. Chen, H.Y. Wang, Z.Y. Yuan, Chem. Soc. Rev. 52 (2023) 8319-8373. [3] J.T. Ren L. Chen H.Y. Wang Z.Y. Yuan Inorg. Chem. Front. 11 2024 2029 2038 J.T. Ren, L. Chen, H.Y. Wang, Z.Y. Yuan, Inorg. Chem. Front. 11 (2024) 2029-2038. [4] D. Larcher J.M. Tarascon Nat. Chem. 7 2015 19 29 D. Larcher, J.M. Tarascon, Nat. Chem. 7 (2015) 19-29. [5] J. Lelieveld J.S. Evans M. Fnais D. Giannadaki A. Pozzer Nature 525 2015 367 371 J. Lelieveld, J.S. Evans, M. Fnais, D. Giannadaki, A. Pozzer, Nature 525 (2015) 367-371. [6] M.B. Ross P. De Luna Y. Li C.T. Dinh D. Kim P. Yang E.H. Sargent Nat. Catal. 2 2019 648 658 M.B. Ross, P. De Luna, Y. Li, C.T. Dinh, D. Kim, P. Yang, E.H. Sargent, Nat. Catal. 2 (2019) 648-658. [7] C.C. Weng J.T. Ren H.Y. Wang X.W. Lv Y.J. Song Y.S. Wang L. Chen W.W. Tian Z.Y. Yuan Appl. Catal. B-Environ. 307 2022 121190 C.C. Weng, J.T. Ren, H.Y. Wang, X.W. Lv, Y.J. Song, Y.S. Wang, L. Chen, W.W. Tian, Z.Y. Yuan, Appl. Catal. B-Environ. 307 (2022) 121190. [8] B. Kang G. Ceder Nature 458 2009 190 193 B. Kang, G. Ceder, Nature 458 (2009) 190-193. [9] X.P. Han X.P. Li J. White C. Zhong Y.D. Deng W.B. Hu T.Y. Ma Adv. Energy Mater. 8 2018 1801396 X.P. Han, X.P. Li, J. White, C. Zhong, Y.D. Deng, W.B. Hu, T.Y. Ma, Adv. Energy Mater. 8 (2018) 1801396. [10] Z.D. Huang Y. Hou T.R. Wang Y.W. Zhao G.J. Liang X.L. Li Y. Guo Q. Yang Z. Chen Q. Li L.T. Ma J. Fan C.Y. Zhi Nat. Commun. 12 2021 3106 Z.D. Huang, Y. Hou, T.R. Wang, Y.W. Zhao, G.J. Liang, X.L. Li, Y. Guo, Q. Yang, Z. Chen, Q. Li, L.T. Ma, J. Fan, C.Y. Zhi, Nat. Commun. 12 (2021) 3106. [11] C.C. Weng X.W. Lv J.T. Ren Y.S. Wang W.W. Tian L.J. Gao H.Y. Wang Z.Y. Yuan ACS Sustain. Chem. Eng. 10 2022 6456 6465 C.C. Weng, X.W. Lv, J.T. Ren, Y.S. Wang, W.W. Tian, L.J. Gao, H.Y. Wang, Z.Y. Yuan, ACS Sustainable Chem. Eng. 10 (2022) 6456-6465. [12] Y.Q. Zhang L. Tao C. Xie D.D. Wang Y.Q. Zou R. Chen Y.Y. Wang C.K. Jia S.Y. Wang Adv. Mater. 32 2020 1905923 Y.Q. Zhang, L. Tao, C. Xie, D.D. Wang, Y.Q. Zou, R. Chen, Y.Y. Wang, C.K. Jia, S.Y. Wang, Adv. Mater. 32 (2020) 1905923. [13] F.X. Wu J. Maier Y. Yu Chem. Soc. Rev. 49 2020 1569 1614 F.X. Wu, J. Maier, Y. Yu, Chem. Soc. Rev. 49 (2020) 1569-1614. [14] J. Islam M. Shareef H.M. Zabed X.H. Qi F.I. Chowdhury Energy Storage Mater. 54 2023 98 119 J. Islam, M. Shareef, H.M. Zabed, X.H. Qi, F.I. Chowdhury, Energy Storage Mater. 54 (2023) 98-119. [15] A. Manthiram Nat. Commun. 11 2020 1550 A. Manthiram, Nat. Commun. 11 (2020) 1550. [16] D.L. Chao W.H. Zhou F.X. Xie C. Ye H. Li M. Jaroniec S.Z. Qiao Sci. Adv. 6 2020 eaba4098 D.L. Chao, W.H. Zhou, F.X. Xie, C. Ye, H. Li, M. Jaroniec, S.Z. Qiao, Sci. Adv. 6 (2020) eaba4098. [17] Z.N. Ju Q. Zhao D.L. Chao Y. Hou H.G. Pan W.P. Sun Z.Y. Yuan H. Li T.Y. Ma D.W. Su B.H. Jia Adv. Energy Mater. 12 2022 2201074 Z.N. Ju, Q. Zhao, D.L. Chao, Y. Hou, H.G. Pan, W.P. Sun, Z.Y. Yuan, H. Li, T.Y. Ma, D.W. Su, B.H. Jia, Adv. Energy Mater. 12 (2022) 2201074. [18] X.Y. Wu X.L. Ji Nat. Chem. 11 2019 680 681 X.Y. Wu, X.L. Ji, Nat. Chem. 11 (2019) 680-681. [19] X.W. Lv W.S. Xu W.W. Tian H.Y. Wang Z.Y. Yuan Small 17 2021 2101856 X.W. Lv, W.S. Xu, W.W. Tian, H.Y. Wang, Z.Y. Yuan, Small 17 (2021) 2101856. [20] T.Z. Wang X.J. Cao L.F. Jiao Angew. Chem. Int. Ed. 61 2022 e202213328 T.Z. Wang, X.J. Cao, L.F. Jiao, Angew. Chem. Int. Ed. 61 (2022) e202213328. [21] J. Pan Y.Y. Xu H. Yang Z.H. Dong H.F. Liu B.Y. Xia Adv. Sci. 5 2018 1700691 J. Pan, Y.Y. Xu, H. Yang, Z.H. Dong, H.F. Liu, B.Y. Xia, Adv. Sci. 5 (2018) 1700691. [22] H.Y. Wang J.T. Ren M.L. Sun W.W. Tian Y. Feng Z.Y. Yuan Adv. Energy Mater. 14 2023 2302515 H.Y. Wang, J.T. Ren, M.L. Sun, W.W. Tian, Y. Feng, Z.Y. Yuan, Adv. Energy Mater. 14 (2023) 2302515. [23] Y. Li Q. Zhang Z.W. Mei S.N. Li W.B. Luo F. Pan H.K. Liu S.X. Dou Small Methods 5 2021 2100460 Y. Li, Q. Zhang, Z.W. Mei, S.N. Li, W.B. Luo, F. Pan, H.K. Liu, S.X. Dou, Small Methods 5 (2021) 2100460. [24] H. Yang X.T. Han A.I. Douka L. Huang L.Q. Gong C.F. Xia H.S. Park B.Y. Xia Adv. Funct. Mater. 31 2021 2007602 H. Yang, X.T. Han, A.I. Douka, L. Huang, L.Q. Gong, C.F. Xia, H.S. Park, B.Y. Xia, Adv. Funct. Mater. 31 (2021) 2007602. [25] I ˇCoríc, B.Q. Mercado, E. Bill, D.J. Vinyard, P.L. Holland, Nature 526 (2015) 96-99. [26] T. Spatzal K.A. Perez O. Einsle J.B. Howard D.C. Rees Science 345 2014 1620 1623 T. Spatzal, K.A. Perez, O. Einsle, J.B. Howard, D.C. Rees, Science 345 (2014) 1620-1623. [27] Y. Feng J.T. Ren H.Y. Wang Z.Y. Yuan Inorg. Chem. Front. 10 2023 4510 4518 Y. Feng, J.T. Ren, H.Y. Wang, Z.Y. Yuan, Inorg. Chem. Front. 10 (2023) 4510-4518. [28] Y. Feng L. Chen Z.Y. Yuan Inorg. Chem. Front. 10 2023 5225 5243 Y. Feng, L. Chen, Z.Y. Yuan, Inorg. Chem. Front. 10 (2023) 5225-5243. [29] C. He Z.Y. Wu L. Zhao M. Ming Y. Zhang Y.P. Yi J.S. Hu ACS Catal. 9 2019 7311 7317 C. He, Z.Y. Wu, L. Zhao, M. Ming, Y. Zhang, Y.P. Yi, J.S. Hu, ACS Catal. 9 (2019) 7311-7317. [30] X.T. Han N.N. Li Y.B. Kang Q.Y. Dou P.Y. Xiong Q. Liu J.Y. Lee L.M. Dai H.S. Park ACS Energy Lett. 6 2021 2460 2468 X.T. Han, N.N. Li, Y.B. Kang, Q.Y. Dou, P.Y. Xiong, Q. Liu, J.Y. Lee, L.M. Dai, H.S. Park, ACS Energy Lett. 6 (2021) 2460-2468. [31] H.R. Liu S.R. Shi Z.H. Wang Y.H. Han W. Huang Small 18 2022 2103747 H.R. Liu, S.R. Shi, Z.H. Wang, Y.H. Han, W. Huang, Small 18 (2022) 2103747. [32] F. Meng X. Xiong S. He Y. Liu R. Hu Adv. Energy Mater. 13 2023 2300269 F. Meng, X. Xiong, S. He, Y. Liu, R. Hu, Adv. Energy Mater. 13 (2023) 2300269. [33] S.C. Yan Y.Y. Feng J. Lin Y.B. Wang Adv. Mater. 35 2023 2212078 S.C. Yan, Y.Y. Feng, J. Lin, Y.B. Wang, Adv. Mater. 35 (2023) 2212078. [34] C. Xue X.R. Zhou X.H. Li N. Yang X. Xin Y.S. Wang W.N. Zhang J.S. Wu W.J. Liu F.W. Huo Adv. Sci. 9 2022 2104183 C. Xue, X.R. Zhou, X.H. Li, N. Yang, X. Xin, Y.S. Wang, W.N. Zhang, J.S. Wu, W.J. Liu, F.W. Huo, Adv. Sci. 9 (2022) 2104183. [35] X.W. Lv Y. Liu Y.S. Wang X.L. Liu Z.Y. Yuan Appl. Catal. B-Environ. 280 2021 119434 X.W. Lv, Y. Liu, Y.S. Wang, X.L. Liu, Z.Y. Yuan, Appl. Catal. B-Environ. 280 (2021) 119434. [36] W.D. Wen P. Yan W.P. Sun Y.T. Zhou X.Y. Yu Adv. Funct. Mater. 33 2023 2212236 W.D. Wen, P. Yan, W.P. Sun, Y.T. Zhou, X.Y. Yu, Adv. Funct. Mater. 33 (2023) 2212236. [37] X. He Z.X. Li J. Yao K. Dong X.H. Li L.S. Xie Q. Liu X.P. Sun iScience 26 2023 107100 X. He, Z.X. Li, J. Yao, K. Dong, X.H. Li, L.S. Xie, Q. Liu, X.P. Sun, iScience 26 (2023) 107100. [38] Q. Liu L.S. Xie J. Liang Y.C. Ren Y.Y. Wang L.C. Zhang Q.Q. Kong Q.Y. Wang D.W. Ma X.P. Sun Small 18 2022 2106961 Q. Liu, L.S. Xie, J. Liang, Y.C. Ren, Y.Y. Wang, L.C. Zhang, Q.Q. Kong, Q.Y. Wang, D.W. Ma, X.P. Sun, Small 18 (2022) 2106961. [39] W.Q. Zhang X.H. Qin T.R. Wei Q. Liu J. Luo X.J. Liu Colloid Interface Sci. 638 2023 650 657 W.Q. Zhang, X.H. Qin, T.R. Wei, Q. Liu, J. Luo, X.J. Liu, Colloid Interface Sci. 638 (2023) 650-657. [40] L.T. Ma S.M. Chen W.H. Yan G.B. Zhang W. Huang C.Y. Zhi Energy Environ. Sci. 16 2023 1125 1134 L.T. Ma, S.M. Chen, W.H. Yan, G.B. Zhang, W. Huang, C.Y. Zhi, Energy Environ. Sci. 16 (2023) 1125-1134. [41] F.F. Zhang Y.L. Zhu Q. Lin L. Zhang X.W. Zhang H.T. Wang Energy Environ. Sci. 5 2021 2954 3009 F.F. Zhang, Y.L. Zhu, Q. Lin, L. Zhang, X.W. Zhang, H.T. Wang, Energy Environ. Sci. 5 (2021) 2954-3009. [42] X.C. Yan L.Z. Zhuang Z.H. Zhu X.D. Yao Nanoscale 6 2021 3327 3345 X.C. Yan, L.Z. Zhuang, Z.H. Zhu, X.D. Yao, Nanoscale 6 (2021) 3327-3345. [43] S.C. Yan Y.Y. Feng J. Lin Y.B. Wang Energy Storage Mater. 23 2019 733 740 S.C. Yan, Y.Y. Feng, J. Lin, Y.B. Wang, Energy Storage Mater. 23 (2019) 733-740. [44] X.W. Lv C.C. Weng Z.Y. Yuan ChemSusChem 13 2020 3061 3078 X.W. Lv, C.C. Weng, Z.Y. Yuan, ChemSusChem 13 (2020) 3061-3078. [45] W.W. Tian J.T. Ren Z.Y. Yuan Appl. Catal. B-Environ. 317 2022 121764 W.W. Tian, J.T. Ren, Z.Y. Yuan, Appl. Catal. B-Environ. 317 (2022) 121764. [46] V.R. Dharmaraj A. Sarkar C.H. Yi K. Iputera S.Y. Huang R.J. Chung S.F. Hu R.S. Liu ACS Appl. Mater. Interfaces 15 2023 9675 9684 V.R. Dharmaraj, A. Sarkar, C.H. Yi, K. Iputera, S.Y. Huang, R.J. Chung, S.F. Hu, R.S. Liu, ACS Appl. Mater. Interfaces 15 (2023) 9675-9684. [47] J. Jun J. Mei T. Liao Q. Sun Z.G. Chen Z.Q. Sun Adv. Energy Mater. 12 2022 2103247 J. Jun, J. Mei, T. Liao, Q. Sun, Z.G. Chen, Z.Q. Sun, Adv. Energy Mater. 12 (2022) 2103247. [48] X.Y. Ma J. Li H.J. Zhou J.W. Zhao H. Sun ACS Appl. Mater. Interfaces 15 2023 19032 19042 X.Y. Ma, J. Li, H.J. Zhou, J.W. Zhao, H. Sun, ACS Appl. Mater. Interfaces 15 (2023) 19032-19042. [49] N. Li Z. Weng Y. Wang F. Li H.M. Cheng H. Zhou Energy Environ. Sci. 7 2014 3307 3312 N. Li, Z. Weng, Y. Wang, F. Li, H.M. Cheng, H. Zhou, Energy Environ. Sci. 7 (2014) 3307-3312. [50] S.M. Hwang W. Go H. Yu Y. Kim J. Mater. Chem. a. 5 2017 11592 11600 S.M. Hwang, W. Go, H. Yu, Y. Kim, J. Mater. Chem. A. 5 (2017) 11592-11600. [51] A. Kumar A. Ghosh A. Roy M.R. Panda M. Forsyth D.R. MacFarlane S. Mitra Energy Storage Mater. 20 2019 196 202 A. Kumar, A. Ghosh, A. Roy, M.R. Panda, M. Forsyth, D.R. MacFarlane, S. Mitra, Energy Storage Mater. 20 (2019) 196-202. [52] J.T. Ren Y.D. Ying Y.P. Liu W. Li Z.Y. Yuan J. Energy Chem. 71 2022 619 630 J.T. Ren, Y.D. Ying, Y.P. Liu, W. Li, Z.Y. Yuan, J. Energy Chem. 71 (2022) 619-630. [53] W.W. Tian J.T. Ren X.W. Lv L.J. Gao Z.Y. Yuan Chem. Commun. 56 2020 5283 5286 W.W. Tian, J.T. Ren, X.W. Lv, L.J. Gao, Z.Y. Yuan, Chem. Commun. 56 (2020) 5283-5286. [54] W.W. Tian J.T. Ren X.W. Lv Z.Y. Yuan Chem. Eng. J. 431 2022 133210 W.W. Tian, J.T. Ren, X.W. Lv, Z.Y. Yuan, Chem. Eng. J. 431 (2022) 133210. [55] G.A. Elia K. Marquardt K. Hoeppner S. Fantini R. Lin E. Knipping W. Peters J.F. Drillet S. Passerini R. Hahn Adv. Mater. 28 2016 7564 7579 G.A. Elia, K. Marquardt, K. Hoeppner, S. Fantini, R. Lin, E. Knipping, W. Peters, J.F. Drillet, S. Passerini, R. Hahn, Adv. Mater. 28 (2016) 7564-7579. [56] J.S. Li J.J. Chen H. Wan J. Xiao Y.G. Tang M. Liu H.Y. Wang Appl. Catal. B-Environ. 242 2019 209 217 J.S. Li, J.J. Chen, H. Wan, J. Xiao, Y.G. Tang, M. Liu, H.Y. Wang, Appl. Catal. B-Environ. 242 (2019) 209-217. [57] H.M. Yang C.C. Weng H.Y. Wang Z.Y. Yuan Coord. Chem. Rev. 496 2023 215420 H.M. Yang, C.C. Weng, H.Y. Wang, Z.Y. Yuan, Coord. Chem. Rev. 496 (2023) 215420. [58] R. Zhang S.C. Zhang Y. Guo C. Li J.H. Liu Z.D. Huang Y.W. Zhao Y.Y. Li C.Y. Zhi Energy Environ. Sci. 7 2022 3024 3032 R. Zhang, S.C. Zhang, Y. Guo, C. Li, J.H. Liu, Z.D. Huang, Y.W. Zhao, Y.Y. Li, C.Y. Zhi, Energy Environ. Sci. 7 (2022) 3024-3032. [59] S.Y. Zhao Z.Q. Zheng L. Qi Y.R. Xue Y.L. Li Small 18 2022 2107136 S.Y. Zhao, Z.Q. Zheng, L. Qi, Y.R. Xue, Y.L. Li, Small 18 (2022) 2107136. [60] M.F. Wang S.S. Liu T. Qian J. Liu J.Q. Zhou H.Q. Ji J. Xiong J. Zhong C.L. Yan Nat. Commun. 10 2019 341 M.F. Wang, S.S. Liu, T. Qian, J. Liu, J.Q. Zhou, H.Q. Ji, J. Xiong, J. Zhong, C.L. Yan, Nat. Commun. 10 (2019) 341. [61] J.Y. Zheng L. Jiang Y.H. Lyu S.P. Jiang S.Y. Wang Energy Environ. Mater. 5 2022 452 457 J.Y. Zheng, L. Jiang, Y.H. Lyu, S.P. Jiang, S.Y. Wang, Energy Environ. Mater. 5 (2022) 452-457. [62] J.Y. Zheng Y.H. Lyu M. Qiao R.L. Wang Y.Y. Zhou H. Li C. Chen Y.F. Li H.J. Zhou S.P. Jiang S.Y. Wang Chem 5 2019 617 633 J.Y. Zheng, Y.H. Lyu, M. Qiao, R.L. Wang, Y.Y. Zhou, H. Li, C. Chen, Y.F. Li, H.J. Zhou, S.P. Jiang, S.Y. Wang, Chem 5 (2019) 617-633. [63] C. Kim F. Dionigi V. Beermann X. Wang T. Möller P. Strasser Adv. Mater. 31 2019 1805617 C. Kim, F. Dionigi, V. Beermann, X. Wang, T. Möller, P. Strasser, Adv. Mater. 31 (2019) 1805617. [64] S.F. Cao S.X. Wei X.F. Wei S.N. Zhou H.Y. Chen Y.Y. Hu Z.J. Wang S.Y. Liu W.Y. Guo X.Q. Lu Small 17 2021 2100949 S.F. Cao, S.X. Wei, X.F. Wei, S.N. Zhou, H.Y. Chen, Y.Y. Hu, Z.J. Wang, S.Y. Liu, W.Y. Guo, X.Q. Lu, Small 17 (2021) 2100949. [65] C.C. Weng X.W. Lv J.T. Ren T.Y. Ma Z.Y. Yuan Electrochem. Energy r. 5 2022 19 C.C. Weng, X.W. Lv, J.T. Ren, T.Y. Ma, Z.Y. Yuan, Electrochem. Energy R. 5 (2022) 19. [66] W.X. Liu J.X. Feng T.R. Wei Q. Liu S.S. Zhang Y. Luo J. Luo X.J. Liu Nano Res. 16 2023 2325 2346 W.X. Liu, J.X. Feng, T.R. Wei, Q. Liu, S.S. Zhang, Y. Luo, J. Luo, X.J. Liu, Nano Res. 16 (2023) 2325-2346. [67] F. Jiao B.J. Xu Adv. Mater. 31 2019 1805173 F. Jiao, B.J. Xu, Adv. Mater. 31 (2019) 1805173. [68] X.X. Yang S. Mukherjee T. O'Carroll Y. Hou M.R. Singh J.A. Gauthier G. Wu Angew. Chem. Int. Ed. 62 2023 e202215938 X.X. Yang, S. Mukherjee, T. O'Carroll, Y. Hou, M.R. Singh, J.A. Gauthier, G. Wu, Angew.Chem. Int. Ed. 62 (2023) e202215938. [69] Y.W. Ren C. Yu X.Y. Tan H.L. Huang Q.B. Wei J.S. Qiu Energy Environ. Sci. 14 2021 1176 1193 Y.W. Ren, C. Yu, X.Y. Tan, H.L. Huang, Q.B. Wei, J.S. Qiu, Energy Environ. Sci. 14 (2021) 1176-1193. [70] H. Xu Y.Y. Ma J. Chen W.X. Zhang J.P. Yang Chem. Soc. Rev. 51 2022 2710 2758 H. Xu, Y.Y. Ma, J. Chen, W.X. Zhang, J.P. Yang, Chem. Soc. Rev. 51 (2022) 2710-2758. [71] X. Zhang Y.T. Wang Y.B. Wang Y.M. Guo X.Y. Xie Y.F. Yu B. Zhang Chem. Commun. 58 2022 2777 2787 X. Zhang, Y.T. Wang, Y.B. Wang, Y.M. Guo, X.Y. Xie, Y.F. Yu, B. Zhang, Chem. Commun. 58 (2022) 2777-2787. [72] J.T. Ren L. Chen H.Y. Wang Z.Y. Yuan ACS Appl. Mater. Interfaces 13 2021 12106 12117 J.T. Ren, L. Chen, H.Y. Wang, Z.Y. Yuan, ACS Appl. Mater. Interfaces 13 (2021) 12106-12117. [73] S.B. Tang T.Y. Liu Q. Dang X.H. Zhou X.K. Li T.T. Yang Y. Luo E. Sharman J. Jiang J. Phys. Chem. Lett. 11 2020 5051 5058 S.B. Tang, T.Y. Liu, Q. Dang, X.H. Zhou, X.K. Li, T.T. Yang, Y. Luo, E. Sharman, J. Jiang, J. Phys. Chem. Lett. 11 (2020) 5051-5058. [74] J.L. Ma D. Bao M.M. Shi J.M. Yan X.B. Zhang Chem 2 2017 525 532 J.L. Ma, D. Bao, M.M. Shi, J.M. Yan, X.B. Zhang, Chem 2 (2017) 525-532. [75] B. Ge Y. Wang Y. Sun Y. Li J. Huang Q. Peng Energy Storage Mater. 23 2019 733 740 B.Ge, Y. Wang, Y. Sun, Y. Li, J. Huang, Q. Peng, Energy Storage Mater. 23 (2019) 733-740. [76] Y. Guo Q. Yang D.H. Wang H.F. Li Z.D. Huang X.L. Li C.Y. Zhi Energy Environ. Sci. 13 2020 2888 2895 Y. Guo, Q. Yang, D.H. Wang, H.F. Li, Z.D. Huang, X.L. Li, C.Y. Zhi, Energy Environ. Sci. 13 (2020) 2888-2895. [77] Y.J. Cheng Y.Y. Dou D.X. Kan Y.Z. Wang Y.J. Wei Appl. Surf. Sci. 610 2023 155481 Y.J. Cheng, Y.Y. Dou, D.X. Kan, Y.Z. Wang, Y.J. Wei, Appl. Surf. Sci. 610 (2023) 155481. [78] X.X. Bi J.T. Li M. Dahbi J. Alami K. Amine J. Lu Adv. Mater. 34 2022 2106148 X.X. Bi, J.T. Li, M. Dahbi, J. Alami, K. Amine, J. Lu, Adv. Mater. 34 (2022) 2106148. [79] Y.Y. Xu C. Jiang H. Gong H.R. Xue B. Gao P. Li K. Chang X.L. Huang T. Wang J.P. He Nano Res. 15 2022 4100 4107 Y.Y. Xu, C. Jiang, H. Gong, H.R. Xue, B. Gao, P. Li, K. Chang, X.L. Huang, T. Wang, J.P. He, Nano Res. 15 (2022) 4100-4107. [80] D. Cao Y.Z. Hao Y.H. Wang Y. Bai Y. Li X.R. Wang J.H. Chen C. Wu ACS Appl. Mater. Interfaces 14 2022 40921 40929 D. Cao, Y.Z. Hao, Y.H. Wang, Y. Bai, Y. Li, X.R. Wang, J.H. Chen, C. Wu, ACS Appl. Mater. Interfaces 14 (2022) 40921-40929. [81] H.Y. Xu R.X. Zheng D.Y. Du L.F. Ren R.J. Li X.J. Wen C. Zhao T. Zeng B. Zhou C.Z. Shu Sci. China Mater. 65 2022 1761 1770 H.Y. Xu, R.X. Zheng, D.Y. Du, L.F. Ren, R.J. Li, X.J. Wen, C. Zhao, T. Zeng, B. Zhou, C.Z. Shu, Sci. China Mater. 65 (2022) 1761-1770. [82] K.W. Leong Y.F. Wang M. Ni W. Pan S.J. Luo D.Y. Leung Renew. Sust. Energy Rev. 154 2022 111771 K.W. Leong, Y.F. Wang, M. Ni, W. Pan, S.J. Luo, D.Y. Leung, Renew. Sust. Energy Rev. 154 (2022) 111771. [83] Z. Zhang S.S. Wu C. Yang L.Y. Zheng D.L. Xu R.H. Zha L. Tang K.Z. Cao X.G. Wang Z. Zhou Angew. Chem. Int. Ed. 58 2019 17782 17787 Z. Zhang, S.S. Wu, C. Yang, L.Y. Zheng, D.L. Xu, R.H. Zha, L. Tang, K.Z. Cao, X.G. Wang, Z. Zhou, Angew. Chem. Int. Ed. 58 (2019) 17782-17787. [84] Y.J. Yang N.B. Zhang Z.L. Zou X.H. Yi J.Q. Liu Chem. Eng. J. 435 2022 135148 Y.J. Yang, N.B. Zhang, Z.L. Zou, X.H. Yi, J.Q. Liu, Chem. Eng. J. 435 (2022) 135148. [85] F.B. Meng J.Y. Qin X.Y. Xiong X.J. Li R.Z. Hu Energy Environ. Mater. 6 2023 e12298 F.B. Meng, J.Y. Qin, X.Y. Xiong, X.J. Li, R.Z. Hu, Energy Environ. Mater. 6 (2023) e12298. [86] C. Du Y.J. Gao J.G. Wang W. Chen Chem. Commun. 55 2019 12801 12804 C. Du, Y.J. Gao, J.G. Wang, W. Chen, Chem. Commun. 55 (2019) 12801-12804. [87] J.T. Ren L. Chen Y.P. Liu Z.Y. Yuan J. Mater. Chem. A 9 2021 11370 11380 J.T. Ren, L. Chen, Y.P. Liu, Z.Y. Yuan, J. Mater. Chem. A 9 (2021) 11370-11380. [88] J.T. Ren L. Chen H.Y. Wang Z.Y. Yuan Chem. Eng. J. 418 2021 129447 J.T. Ren, L. Chen, H.Y. Wang, Z.Y. Yuan, Chem. Eng. J. 418 (2021) 129447. [89] C.H. Fang T. Bi X.X. Xu N. Yu Z.Q. Cui R.B. Jiang B.Y. Geng Adv. Mater. Interfaces 6 2019 1901034 C.H. Fang, T. Bi, X.X. Xu, N. Yu, Z.Q. Cui, R.B. Jiang, B.Y. Geng, Adv. Mater. Interfaces 6 (2019) 1901034. [90] Y.X. Zhao Y.F. Zhao R. Shi B. Wang G.I. Waterhouse L.Z. Wu C.H. Tung T.R. Zhang Adv. Mater. 31 2019 1806482 Y.X. Zhao, Y.F. Zhao, R. Shi, B. Wang, G.I. Waterhouse, L.Z. Wu, C.H. Tung, T.R. Zhang, Adv. Mater. 31 (2019) 1806482. [91] R. Zhang X. Ren X.F. Shi F.Y. Xie B.Z. Zheng X.D. Guo X.P. Sun ACS Appl. Mater. Interfaces 10 2018 28251 28255 R. Zhang, X. Ren, X.F. Shi, F.Y. Xie, B.Z. Zheng, X.D. Guo, X.P. Sun, ACS Appl. Mater. Interfaces 10 (2018) 28251-28255. [92] H.J. Chen Z.Q. Xu S.J. Sun Y.S. Luo Q. Liu M.S. Hamdy Z.S. Feng X.P. Sun Y. Wang Inorg. Chem. Front. 9 2022 4608 4613 H.J. Chen, Z.Q. Xu, S.J. Sun, Y.S. Luo, Q. Liu, M.S. Hamdy, Z.S. Feng, X.P. Sun, Y. Wang, Inorg. Chem. Front. 9 (2022) 4608-4613. [93] T.W. Wang S.S. Gao T.R. Wei Y.J. Qin S.S. Zhang J.Y. Ding Q. Liu J. Luo X.J. Liu Chem. Eur. J. 29 2023 e202204034 T.W. Wang, S.S. Gao, T.R. Wei, Y.J. Qin, S.S. Zhang, J.Y. Ding, Q. Liu, J. Luo, X.J. Liu, Chem. Eur. J. 29 (2023) e202204034. [94] X.W. Lv X.L. Liu L.J. Gao Y.P. Liu Z.Y. Yuan J. Mater. Chem. A 9 2021 4026 4035 X.W. Lv, X.L. Liu, L.J. Gao, Y.P. Liu, Z.Y. Yuan, J. Mater. Chem. A 9 (2021) 4026-4035. [95] H. Wang J.C. Si T.Y. Zhang Y. Li B. Yang Z.J. Li J. Chen Z.H. Wen C. Yuan L.C. Lei Y. Hou Appl. Catal. B-Environ. 270 2020 118892 H. Wang, J.C. Si, T.Y. Zhang, Y. Li, B. Yang, Z.J. Li, J. Chen, Z.H. Wen, C. Yuan, L.C. Lei, Y. Hou, Appl. Catal. B-Environ. 270 (2020) 118892. [96] W. Liu L.L. Han X.J. Liu H.T. Wang X.R. Zhao J. Luo Nano Energy 77 2020 105078 W. Liu, L.L. Han, X.J. Liu, H.T. Wang, X.R. Zhao, J. Luo, Nano Energy 77 (2020) 105078. [97] H. Wang Z.J. Li Y. Li B. Yang J. Chen L.C. Lei S.B. Wang Y. Hou Nano Energy 81 2021 105613 H. Wang, Z.J. Li, Y. Li, B. Yang, J. Chen, L.C. Lei, S.B. Wang, Y. Hou, Nano Energy 81 (2021) 105613. [98] F.F. Wang Q.G. Wang S.M. Wang K. Zhang S.Q. Jia J. Chen X.H. Wang ACS Nano 16 2022 9049 9061 F.F. Wang, Q.G. Wang, S.M. Wang, K. Zhang, S.Q. Jia, J. Chen, X.H. Wang, ACS Nano 16 (2022) 9049-9061. [99] H.C. Qiao Y. Han L. Yao X. Xu J. Ma B. Wen J. Hu H. Huang Chem. Eng. J. 464 2023 142628 H.C. Qiao, Y. Han, L. Yao, X. Xu, J. Ma, B. Wen, J. Hu, H. Huang, Chem. Eng. J. 464(2023) 142628. [100] A.M. Beale F. Gao I. Lezcano-Gonzalez C.H.F. Peden J. Szanyi Chem. Soc. Rev. 44 2015 7371 7405 A.M. Beale, F. Gao, I. Lezcano-Gonzalez, C.H.F. Peden, J. Szanyi, Chem. Soc. Rev. 44 (2015) 7371-7405. [101] J. Long S.M. Chen Y.L. Zhang C.X. Guo X.Y. Fu D.H. Deng J.P. Xiao Angew. Chem. Int. Ed. 59 2020 9711 9718 J. Long, S.M. Chen, Y.L. Zhang, C.X. Guo, X.Y. Fu, D.H. Deng, J.P. Xiao, Angew. Chem. Int. Ed. 59 (2020) 9711-9718. [102] V. Rosca M. Duca M.T. Groot M.T.M. Koper Chem. Rev. 109 2009 2209 2244 V. Rosca, M. Duca, M.T. Groot, M.T.M. Koper, Chem. Rev. 109 (2009) 2209-2244. [103] X.Y. Peng Y.Y. Mi H.H. Bao Y.F. Liu D.F. Qi Y. Qiu L.C. Zhuo S.Z. Zhao J. Luo Nano Energy 78 2020 105321 X.Y. Peng, Y.Y. Mi, H.H. Bao, Y.F. Liu, D.F. Qi, Y. Qiu, L.C. Zhuo, S.Z. Zhao, J. Luo, Nano Energy 78 (2020) 105321. [104] Y.X. Weng X.G. Ma G. Yuan H. Lv Z.Y. Yuan RSC Adv. 12 2022 24743 24751 Y.X. Weng, X.G. Ma, G. Yuan, H. Lv, Z.Y. Yuan, RSC Adv. 12 (2022) 24743-24751. [105] N. Gruber J.N. Galloway Nature 451 2008 293 296 N. Gruber, J.N. Galloway, Nature 451 (2008) 293-296. [106] X.W. Lv X.L. Liu Y.J. Suo Y.P. Liu Z.Y. Yuan ACS Nano 15 2021 12109 12118 X.W. Lv, X.L. Liu, Y.J. Suo, Y.P. Liu, Z.Y. Yuan, ACS Nano 15 (2021) 12109-12118. [107] J.T. Ren C.Y. Wan T.Y. Pei X.W. Lv Z.Y. Yuan Appl. Catal. B-Environ. 266 2020 118633 J.T. Ren, C.Y. Wan, T.Y. Pei, X.W. Lv, Z.Y. Yuan, Appl. Catal. B-Environ. 266 (2020) 118633. [108] L.C. Zhang J. Liang Y.Y. Wang T. Mou Y.T. Lin L.C. Yue T.S. Li Y.L. Luo D.W. Ma X.P. Sun Angew. Chem. Int. Ed. 60 2021 25263 25268 L.C. Zhang, J. Liang, Y.Y. Wang, T. Mou, Y.T. Lin, L.C. Yue, T.S. Li, Y.L. Luo, D.W. Ma, X.P. Sun, Angew. Chem. Int. Ed. 60 (2021) 25263-25268. [109] T. Mou J. Liang Z.Y. Ma L.C. Zhang Y.T. Lin T.S. Li X.P. Sun J. Mater. Chem. A 9 2021 24268 24275 T. Mou, J. Liang, Z.Y. Ma, L.C. Zhang, Y.T. Lin, T.S. Li, X.P. Sun, J. Mater. Chem. A 9 (2021) 24268-24275. [110] P.Y. Liu J. Liang J.Q. Wang L.C. Zhang N. Li B. Tang Q. Liu A.M. Asiri X.P. Sun Chem. Commun. 57 2021 13562 13565 P.Y. Liu, J. Liang, J.Q. Wang, L.C. Zhang, N. Li, B. Tang, Q. Liu, A.M. Asiri, X.P. Sun, Chem. Commun. 57 (2021) 13562-13565. [111] Y.T. Lin J. Liang H.B. Li L.C. Zhang T. Mou T.S. Li L.C. Yue Y.Y. Ji Q. Wu X.P. Sun Today Phys. 22 2022 100611 Y.T. Lin, J. Liang, H.B. Li, L.C. Zhang, T. Mou, T.S. Li, L.C. Yue, Y.Y. Ji, Q. Wu, X.P. Sun, Today Phys. 22 (2022) 100611. [112] J. Liang W.F. Hu B.Y. Song T. Mou L.C. Zhang Y.S. Luo X.P. Sun Inorg. Chem. Front. 9 2022 1366 1372 J. Liang, W.F. Hu, B.Y. Song, T. Mou, L.C. Zhang, Y.S. Luo, X.P. Sun, Inorg. Chem. Front. 9 (2022) 1366-1372. [113] J. Liang H.Y. Chen T. Mou L.C. Zhang Y.T. Lin L.C. Yue Y.S. Luo Q. Liu N. Li X.P. Sun J. Mater. Chem. A 10 2022 6454 6462 J. Liang, H.Y. Chen, T. Mou, L.C. Zhang, Y.T. Lin, L.C. Yue, Y.S. Luo, Q. Liu, N. Li, X.P. Sun, J. Mater. Chem. A 10 (2022) 6454-6462. [114] J. Liang P.Y. Liu Q.Y. Li T.S. Li L.C. Yue X.P. Sun Angew. Chem. Int. Ed. 61 2022 e202202087 J. Liang, P.Y. Liu, Q.Y. Li, T.S. Li, L.C. Yue, X.P. Sun, Angew. Chem. Int. Ed. 61 (2022) e202202087. [115] Q. Liu Y.T. Lin L.C. Yue J. Liang L.C. Zhang T.S. Li Y.S. Luo X.P. Sun Nano Res. 15 2022 5032 5037 Q. Liu, Y.T. Lin, L.C. Yue, J. Liang, L.C. Zhang, T.S. Li, Y.S. Luo, X.P. Sun, Nano Res. 15 (2022) 5032-5037. [116] L.C. Zhang Q. Zhou J. Liang L.C. Yue T.S. Li Y.S. Luo Q. Liu N. Li X.P. Sun Inorg. Chem. 61 2022 8096 8102 L.C. Zhang, Q. Zhou, J. Liang, L.C. Yue, T.S. Li, Y.S. Luo, Q. Liu, N. Li, X.P. Sun, Inorg. Chem. 61 (2022) 8096-8102. [117] Z.X. Li Q. Zhou J. Liang L.C. Zhang X.Y. Fan D.L. Zhao Z.W. Cai X.P. Sun Small 19 2023 2300291 Z.X. Li, Q. Zhou, J. Liang, L.C. Zhang, X.Y. Fan, D.L. Zhao, Z.W. Cai, X.P. Sun, Small 19 (2023) 2300291. [118] X.Y. Peng Y.Y. Mi H.H. Bao Y.F. Liu D.F. Qi Y. Qiu J. Luo X.J. Liu Nano Energy 78 2020 105321 X.Y. Peng, Y.Y. Mi, H.H. Bao, Y.F. Liu, D.F. Qi, Y. Qiu, J. Luo, X.J. Liu, Nano Energy 78 (2020) 105321. [119] G. Meng T.R. Wei W.J. Liu W.B. Li S.S. Zhang X.J. Liu Chem. Commun. 58 2022 8097 8100 G. Meng, T.R. Wei, W.J. Liu, W.B. Li, S.S. Zhang, X.J. Liu, Chem. Commun. 58 (2022) 8097-8100. [120] G. Meng M.M. Jin T.R. Wei Q. Liu S.S. Zhang X.Y. Peng J. Luo X.J. Liu Nano Res. 15 2022 8890 8896 G. Meng, M.M. Jin, T.R. Wei, Q. Liu, S.S. Zhang, X.Y. Peng, J. Luo, X.J. Liu, Nano Res. 15 (2022) 8890-8896. [121] D.D. Wang Z.W. Chen K.Z. Gu C. Chen Y.Y. Liu X.X. Wei C.V. Singh S.Y. Wang J. Am. Chem. Soc. 145 2023 6899 6904 D.D. Wang, Z.W. Chen, K.Z. Gu, C. Chen, Y.Y. Liu, X.X. Wei, C.V. Singh, S.Y. Wang, J. Am. Chem. Soc. 145 (2023) 6899-6904. [122] Z.R. Li J. Liang Q. Liu L.S. Xie L.C. Zhang Y.C. Ren Y.L. Luo Q.Q. Kong X.P. Sun Mater. Today Phys. 23 2022 100619 Z.R. Li, J. Liang, Q. Liu, L.S. Xie, L.C. Zhang, Y.C. Ren, Y.L. Luo, Q.Q. Kong, X.P. Sun, Mater. Today Phys. 23 (2022) 100619. [123] J. Liang Q. Liu A.A. Alshehri X.P. Sun Nano Res. Energy 2 2022 e9120010 J. Liang, Q. Liu, A.A. Alshehri, X.P. Sun, Nano Res. Energy, 2 (2022) e9120010. [124] G.F. Chen Y.F. Yuan H.F. Jiang S.Y. Ren L.X. Ding L. Ma T.P. Wu J. Lu H.H. Wang Nat. Energy 5 2020 605 613 G.F. Chen, Y.F. Yuan, H.F. Jiang, S.Y. Ren, L.X. Ding, L. Ma, T.P. Wu, J. Lu, H.H. Wang, Nat. Energy 5 (2020) 605-613. [125] Y. Guo R. Zhang S.C. Zhang Y.W. Zhao Q. Yang Z.D. Huang C.Y. Zhi Energy Environ. Sci. 14 2021 3938 3944 Y. Guo, R. Zhang, S.C. Zhang, Y.W. Zhao, Q. Yang, Z.D. Huang, C.Y. Zhi, Energy Environ. Sci. 14 (2021) 3938-3944. [126] F.L. Zhou C.H. Sun Small 18 2022 2200436 F.L. Zhou, C.H. Sun, Small 18 (2022) 2200436. [127] W. Lin E.B. Zhou J.F. Xie J. Lin Y.B. Wang Adv. Funct. Mater. 32 2022 2209464 W. Lin, E.B. Zhou, J.F. Xie, J. Lin, Y.B. Wang, Adv. Funct. Mater. 32 (2022) 2209464. [128] S.B. Patil T.R. Liu H.L. Chou Y.B. Huang C.C. Chang Y.C. Chen Y.S. Lin H. Li Y.C. Lee Y.J. Chang Y.H. Lai C.Y. Wen D.Y. Wang J. Phys. Chem. Lett. 12 2021 8121 8128 S.B. Patil, T.R. Liu, H.L. Chou, Y.B. Huang, C.C. Chang, Y.C. Chen, Y.S. Lin, H. Li, Y.C. Lee, Y.J. Chang, Y.H. Lai, C.Y. Wen, D.Y. Wang, J. Phys. Chem. Lett. 12 (2021) 8121-8128. [129] J.Y. Ding X.H. Hou Y. Qiu S.S. Zhang Q. Liu J. Luo X.J. Liu Inorg. Chem. Commun. 151 2023 110621 J.Y. Ding, X.H. Hou, Y. Qiu, S.S. Zhang, Q. Liu, J. Luo, X.J. Liu, Inorg. Chem. Commun. 151 (2023) 110621. [130] H.F. Jiang G.F. Chen O. Savateev J. Xue L.X. Ding Z.X. Liang M. Antonietti H.H. Wang Angew. Chem. Int. Ed. 62 2023 e202218717 H.F. Jiang, G.F. Chen, O. Savateev, J. Xue, L.X. Ding, Z.X. Liang, M. Antonietti, H.H. Wang, Angew. Chem. Int. Ed. 62 (2023) e202218717. [131] X. Tang R.Y. Jia T. Zhai H. Xia ACS Appl. Mater. Interfaces 7 2015 27518 27525 X. Tang, R.Y. Jia, T. Zhai, H. Xia, ACS Appl. Mater. Interfaces 7 (2015) 27518-27525. [132] J.H. Ma Y.T. Zhang B.W. Wang Z.X. Jiang Q.Y. Zhang S.F. Zhuo ACS Nano 17 2023 6687 6697 J.H. Ma, Y.T. Zhang, B.W. Wang, Z.X. Jiang, Q.Y. Zhang, S.F. Zhuo, ACS Nano 17 (2023) 6687-6697. [133] R. Zhang Y. Guo S.C. Zhang D. Chen Y.W. Zhao Z.D. Huang L.T. Ma P. Li Q. Yang G.J. Liang C.Y. Zhi Adv. Energy Mater. 13 2022 2103872 R. Zhang, Y. Guo, S.C. Zhang, D. Chen, Y.W. Zhao, Z.D. Huang, L.T. Ma, P. Li, Q. Yang, G.J. Liang, C.Y. Zhi, Adv. Energy Mater. 13 (2022) 2103872. [134] Y.H. Gao K.P. Wang C. Xu H. Fang H.L. Yu H. Zhang S.K. Li C.H. Li F.Z. Huang Appl. Catal. B-Environ. 330 2023 122627 Y.H. Gao, K.P. Wang, C. Xu, H. Fang, H.L. Yu, H. Zhang, S.K. Li, C.H. Li, F.Z. Huang, Appl. Catal. B-Environ. 330 (2023) 122627. [135] L.S. Xie S.J. Sun L. Hu J. Chen J. Li Q.Q. Kong Q. Liu X.P. Sun ACS Appl. Mater. Interfaces 14 2022 49650 49657 L.S. Xie, S.J. Sun, L. Hu, J. Chen, J. Li, Q.Q. Kong, Q. Liu, X.P. Sun, ACS Appl. Mater. Interfaces 14 (2022) 49650-49657. [136] Z.R. Li Z.Q. Deng L. Ouyang X.Y. Fan L.C. Zhang S.J. Sun Q. Liu X.P. Sun Nano Res. 15 2022 8914 8921 Z.R. Li, Z.Q. Deng, L. Ouyang, X.Y. Fan, L.C. Zhang, S.J. Sun, Q. Liu, X.P. Sun, Nano Res. 15 (2022) 8914-8921. [137] Z.Q. Deng J. Liang Q. Liu C.Q. Ma L.S. Xie L.C. Li B. Tang X.P. Sun Chem. Eng. J. 435 2022 135104 Z.Q. Deng, J. Liang, Q. Liu, C.Q. Ma, L.S. Xie, L.C. Li, B. Tang, X.P. Sun, Chem. Eng. J. 435 (2022) 135104. [138] Z.F. Ren Q.Y. Chen X.G. An Q. Liu L.S. Xie J. Zhang W.T. Yao Q.Q. Kong X.P. Sun Inorg. Chem. 61 2022 12895 12902 Z.F. Ren, Q.Y. Chen, X.G. An, Q. Liu, L.S. Xie, J. Zhang, W.T. Yao, Q.Q. Kong, X.P. Sun, Inorg. Chem. 61 (2022) 12895-12902. [139] H. Qiu Q.Y. Chen X.G. An Q. Liu L.S. Xie J. Zhang W.T. Yao Y.S. Luo Q.Q. Kong X.P. Sun J. Mater. Chem. A 10 2022 24969 24974 H. Qiu, Q.Y. Chen, X.G. An, Q. Liu, L.S. Xie, J. Zhang, W.T. Yao, Y.S. Luo, Q.Q. Kong, X.P. Sun, J. Mater. Chem. A 10 (2022) 24969-24974. [140] H.M. Liu X.Y. Lang C. Zhu J. Timoshenko M. Rüscher L.C. Bai N. Guijarro H.B. Yin Y. Peng J.H. Li Angew. Chem. Int. Ed. 61 2022 e202202556 H.M. Liu, X.Y. Lang, C. Zhu, J. Timoshenko, M. Rüscher, L.C. Bai, N. Guijarro, H.B. Yin, Y. Peng, J.H. Li, Angew. Chem. Int. Ed. 61 (2022) e202202556. [141] X.T. Li P. Shen X.C. Li D.W. Ma K. Chu ACS Nano 17 2023 1081 1090 X.T. Li, P. Shen, X.C. Li, D.W. Ma, K. Chu, ACS Nano 17 (2023) 1081-1090.",
      "scopus-id": "85199700335",
      "coredata": {
        "eid": "1-s2.0-S2095495624004674",
        "dc:description": "Ammonia plays a crucial role in contemporary society, impacting medicine, agriculture, and the chemical industry. The conventional industrial synthesis of NH3 through the Haber-Bosch technique, carried out under severe reaction conditions, leads to substantial energy consumption and environmental pollution. It is thus imperative for NH3 synthesis methods to be investigated under more favorable conditions. Synthesis of ammonia by electrocatalysis can effectively reduce the environmental damage and other urgent problems, which is a promising solution. Metal-nitrogen series batteries (M−N batteries), such as metal-nitrogen gas batteries, metal-nitrogen oxide batteries and metal-oxynitride batteries have been regarded recently as an exemplar of concurrent NH3 synthesis and energy production.Nonetheless, the large-scale application of these batteries is still limited by numerous challenges are currently existing in building high-efficiency M−N batteries, including poor Faradic efficiency and low NH3 yield. Therefore, a comprehensive overview of M−N batteries is offered, specifically focusing on advanced strategies for designing highly efficient cathode catalysts in anticipation of future developments. The metal anodes, cathodic electro-reduction reactions, and design principles are encompassed in the discussion, offering detailed insights to enhance understanding. Mechanisms, feasibility analyses, technoeconomic assessments, device combinations, and comparative evaluations are delved into in the review, contributing to a thorough comprehension of diverse systems and their application potential. Perspectives and opportunities for future research directions are also delineated.",
        "openArchiveArticle": "false",
        "prism:coverDate": "2024-11-30",
        "openaccessUserLicense": null,
        "prism:aggregationType": "Journal",
        "prism:url": "https://api.elsevier.com/content/article/pii/S2095495624004674",
        "dc:creator": [
          {
            "@_fa": "true",
            "$": "Yan, Feng-Xiao"
          },
          {
            "@_fa": "true",
            "$": "Wang, Hao-Yu"
          },
          {
            "@_fa": "true",
            "$": "Feng, Yi"
          },
          {
            "@_fa": "true",
            "$": "Wang, Hao"
          },
          {
            "@_fa": "true",
            "$": "Yuan, Zhong-Yong"
          }
        ],
        "link": [
          {
            "@_fa": "true",
            "@rel": "self",
            "@href": "https://api.elsevier.com/content/article/pii/S2095495624004674"
          },
          {
            "@_fa": "true",
            "@rel": "scidir",
            "@href": "https://www.sciencedirect.com/science/article/pii/S2095495624004674"
          }
        ],
        "dc:format": "application/json",
        "openaccessType": null,
        "pii": "S2095-4956(24)00467-4",
        "prism:volume": "98",
        "prism:publisher": "Science Press and Dalian Institute of Chemical Physics, Chinese Academy of Sciences. Published by ELSEVIER B.V. and Science Press. All rights are reserved, including those for text and data mining, AI training, and similar technologies.",
        "dc:title": "Optimized electrochemical ammonia production: From metal-N2/NO x batteries to aqueous metal-NO x – batteries",
        "prism:copyright": "© 2024 Science Press and Dalian Institute of Chemical Physics, Chinese Academy of Sciences. Published by ELSEVIER B.V. and Science Press. All rights are reserved, including those for text and data mining, AI training, and similar technologies.",
        "openaccess": "0",
        "prism:issn": "20954956",
        "dcterms:subject": [
          {
            "@_fa": "true",
            "$": "Metal-N2 batteries"
          },
          {
            "@_fa": "true",
            "$": "Metal-NO x – batteries"
          },
          {
            "@_fa": "true",
            "$": "Energy storage"
          },
          {
            "@_fa": "true",
            "$": "Ammonia production"
          },
          {
            "@_fa": "true",
            "$": "Electrocatalysts"
          }
        ],
        "openaccessArticle": "false",
        "prism:publicationName": "Journal of Energy Chemistry",
        "openaccessSponsorType": null,
        "prism:pageRange": "541-555",
        "prism:endingPage": "555",
        "pubType": "ssu",
        "prism:coverDisplayDate": "November 2024",
        "prism:doi": "10.1016/j.jechem.2024.06.054",
        "prism:startingPage": "541",
        "dc:identifier": "doi:10.1016/j.jechem.2024.06.054",
        "openaccessSponsorName": null
      },
      "objects": {
        "object": [
          {
            "@category": "standard",
            "@height": "245",
            "@width": "245",
            "@_fa": "true",
            "$": "https://api.elsevier.com/content/object/eid/1-s2.0-S2095495624004674-ga1.jpg?httpAccept=%2A%2F%2A",
            "@multimediatype": "JPEG image file",
            "@type": "IMAGE-DOWNSAMPLED",
            "@size": "31292",
            "@ref": "ga1",
            "@mimetype": "image/jpeg"
          },
          {
            "@category": "standard",
            "@height": "395",
            "@width": "711",
            "@_fa": "true",
            "$": "https://api.elsevier.com/content/object/eid/1-s2.0-S2095495624004674-gr1.jpg?httpAccept=%2A%2F%2A",
            "@multimediatype": "JPEG image file",
            "@type": "IMAGE-DOWNSAMPLED",
            "@size": "96782",
            "@ref": "gr1",
            "@mimetype": "image/jpeg"
          },
          {
            "@category": "standard",
            "@height": "374",
            "@width": "711",
            "@_fa": "true",
            "$": "https://api.elsevier.com/content/object/eid/1-s2.0-S2095495624004674-gr2.jpg?httpAccept=%2A%2F%2A",
            "@multimediatype": "JPEG image file",
            "@type": "IMAGE-DOWNSAMPLED",
            "@size": "53319",
            "@ref": "gr2",
            "@mimetype": "image/jpeg"
          },
          {
            "@category": "standard",
            "@height": "383",
            "@width": "711",
            "@_fa": "true",
            "$": "https://api.elsevier.com/content/object/eid/1-s2.0-S2095495624004674-gr3.jpg?httpAccept=%2A%2F%2A",
            "@multimediatype": "JPEG image file",
            "@type": "IMAGE-DOWNSAMPLED",
            "@size": "101113",
            "@ref": "gr3",
            "@mimetype": "image/jpeg"
          },
          {
            "@category": "standard",
            "@height": "317",
            "@width": "711",
            "@_fa": "true",
            "$": "https://api.elsevier.com/content/object/eid/1-s2.0-S2095495624004674-gr4.jpg?httpAccept=%2A%2F%2A",
            "@multimediatype": "JPEG image file",
            "@type": "IMAGE-DOWNSAMPLED",
            "@size": "87463",
            "@ref": "gr4",
            "@mimetype": "image/jpeg"
          },
          {
            "@category": "standard",
            "@height": "282",
            "@width": "711",
            "@_fa": "true",
            "$": "https://api.elsevier.com/content/object/eid/1-s2.0-S2095495624004674-gr5.jpg?httpAccept=%2A%2F%2A",
            "@multimediatype": "JPEG image file",
            "@type": "IMAGE-DOWNSAMPLED",
            "@size": "63942",
            "@ref": "gr5",
            "@mimetype": "image/jpeg"
          },
          {
            "@category": "standard",
            "@height": "367",
            "@width": "711",
            "@_fa": "true",
            "$": "https://api.elsevier.com/content/object/eid/1-s2.0-S2095495624004674-gr6.jpg?httpAccept=%2A%2F%2A",
            "@multimediatype": "JPEG image file",
            "@type": "IMAGE-DOWNSAMPLED",
            "@size": "106710",
            "@ref": "gr6",
            "@mimetype": "image/jpeg"
          },
          {
            "@category": "standard",
            "@height": "289",
            "@width": "535",
            "@_fa": "true",
            "$": "https://api.elsevier.com/content/object/eid/1-s2.0-S2095495624004674-gr7.jpg?httpAccept=%2A%2F%2A",
            "@multimediatype": "JPEG image file",
            "@type": "IMAGE-DOWNSAMPLED",
            "@size": "35611",
            "@ref": "gr7",
            "@mimetype": "image/jpeg"
          },
          {
            "@category": "thumbnail",
            "@height": "164",
            "@width": "164",
            "@_fa": "true",
            "$": "https://api.elsevier.com/content/object/eid/1-s2.0-S2095495624004674-ga1.sml?httpAccept=%2A%2F%2A",
            "@multimediatype": "GIF image file",
            "@type": "IMAGE-THUMBNAIL",
            "@size": "15900",
            "@ref": "ga1",
            "@mimetype": "image/gif"
          },
          {
            "@category": "thumbnail",
            "@height": "122",
            "@width": "219",
            "@_fa": "true",
            "$": "https://api.elsevier.com/content/object/eid/1-s2.0-S2095495624004674-gr1.sml?httpAccept=%2A%2F%2A",
            "@multimediatype": "GIF image file",
            "@type": "IMAGE-THUMBNAIL",
            "@size": "16162",
            "@ref": "gr1",
            "@mimetype": "image/gif"
          },
          {
            "@category": "thumbnail",
            "@height": "115",
            "@width": "219",
            "@_fa": "true",
            "$": "https://api.elsevier.com/content/object/eid/1-s2.0-S2095495624004674-gr2.sml?httpAccept=%2A%2F%2A",
            "@multimediatype": "GIF image file",
            "@type": "IMAGE-THUMBNAIL",
            "@size": "8697",
            "@ref": "gr2",
            "@mimetype": "image/gif"
          },
          {
            "@category": "thumbnail",
            "@height": "118",
            "@width": "219",
            "@_fa": "true",
            "$": "https://api.elsevier.com/content/object/eid/1-s2.0-S2095495624004674-gr3.sml?httpAccept=%2A%2F%2A",
            "@multimediatype": "GIF image file",
            "@type": "IMAGE-THUMBNAIL",
            "@size": "13902",
            "@ref": "gr3",
            "@mimetype": "image/gif"
          },
          {
            "@category": "thumbnail",
            "@height": "98",
            "@width": "219",
            "@_fa": "true",
            "$": "https://api.elsevier.com/content/object/eid/1-s2.0-S2095495624004674-gr4.sml?httpAccept=%2A%2F%2A",
            "@multimediatype": "GIF image file",
            "@type": "IMAGE-THUMBNAIL",
            "@size": "13903",
            "@ref": "gr4",
            "@mimetype": "image/gif"
          },
          {
            "@category": "thumbnail",
            "@height": "87",
            "@width": "219",
            "@_fa": "true",
            "$": "https://api.elsevier.com/content/object/eid/1-s2.0-S2095495624004674-gr5.sml?httpAccept=%2A%2F%2A",
            "@multimediatype": "GIF image file",
            "@type": "IMAGE-THUMBNAIL",
            "@size": "8872",
            "@ref": "gr5",
            "@mimetype": "image/gif"
          },
          {
            "@category": "thumbnail",
            "@height": "113",
            "@width": "219",
            "@_fa": "true",
            "$": "https://api.elsevier.com/content/object/eid/1-s2.0-S2095495624004674-gr6.sml?httpAccept=%2A%2F%2A",
            "@multimediatype": "GIF image file",
            "@type": "IMAGE-THUMBNAIL",
            "@size": "14486",
            "@ref": "gr6",
            "@mimetype": "image/gif"
          },
          {
            "@category": "thumbnail",
            "@height": "118",
            "@width": "219",
            "@_fa": "true",
            "$": "https://api.elsevier.com/content/object/eid/1-s2.0-S2095495624004674-gr7.sml?httpAccept=%2A%2F%2A",
            "@multimediatype": "GIF image file",
            "@type": "IMAGE-THUMBNAIL",
            "@size": "6798",
            "@ref": "gr7",
            "@mimetype": "image/gif"
          },
          {
            "@category": "high",
            "@height": "1085",
            "@width": "1085",
            "@_fa": "true",
            "$": "https://api.elsevier.com/content/object/eid/1-s2.0-S2095495624004674-ga1_lrg.jpg?httpAccept=%2A%2F%2A",
            "@multimediatype": "JPEG image file",
            "@type": "IMAGE-HIGH-RES",
            "@size": "204499",
            "@ref": "ga1",
            "@mimetype": "image/jpeg"
          },
          {
            "@category": "high",
            "@height": "1752",
            "@width": "3150",
            "@_fa": "true",
            "$": "https://api.elsevier.com/content/object/eid/1-s2.0-S2095495624004674-gr1_lrg.jpg?httpAccept=%2A%2F%2A",
            "@multimediatype": "JPEG image file",
            "@type": "IMAGE-HIGH-RES",
            "@size": "540929",
            "@ref": "gr1",
            "@mimetype": "image/jpeg"
          },
          {
            "@category": "high",
            "@height": "1659",
            "@width": "3150",
            "@_fa": "true",
            "$": "https://api.elsevier.com/content/object/eid/1-s2.0-S2095495624004674-gr2_lrg.jpg?httpAccept=%2A%2F%2A",
            "@multimediatype": "JPEG image file",
            "@type": "IMAGE-HIGH-RES",
            "@size": "264071",
            "@ref": "gr2",
            "@mimetype": "image/jpeg"
          },
          {
            "@category": "high",
            "@height": "1699",
            "@width": "3150",
            "@_fa": "true",
            "$": "https://api.elsevier.com/content/object/eid/1-s2.0-S2095495624004674-gr3_lrg.jpg?httpAccept=%2A%2F%2A",
            "@multimediatype": "JPEG image file",
            "@type": "IMAGE-HIGH-RES",
            "@size": "587939",
            "@ref": "gr3",
            "@mimetype": "image/jpeg"
          },
          {
            "@category": "high",
            "@height": "1405",
            "@width": "3149",
            "@_fa": "true",
            "$": "https://api.elsevier.com/content/object/eid/1-s2.0-S2095495624004674-gr4_lrg.jpg?httpAccept=%2A%2F%2A",
            "@multimediatype": "JPEG image file",
            "@type": "IMAGE-HIGH-RES",
            "@size": "504379",
            "@ref": "gr4",
            "@mimetype": "image/jpeg"
          },
          {
            "@category": "high",
            "@height": "1251",
            "@width": "3150",
            "@_fa": "true",
            "$": "https://api.elsevier.com/content/object/eid/1-s2.0-S2095495624004674-gr5_lrg.jpg?httpAccept=%2A%2F%2A",
            "@multimediatype": "JPEG image file",
            "@type": "IMAGE-HIGH-RES",
            "@size": "350713",
            "@ref": "gr5",
            "@mimetype": "image/jpeg"
          },
          {
            "@category": "high",
            "@height": "1625",
            "@width": "3150",
            "@_fa": "true",
            "$": "https://api.elsevier.com/content/object/eid/1-s2.0-S2095495624004674-gr6_lrg.jpg?httpAccept=%2A%2F%2A",
            "@multimediatype": "JPEG image file",
            "@type": "IMAGE-HIGH-RES",
            "@size": "599658",
            "@ref": "gr6",
            "@mimetype": "image/jpeg"
          },
          {
            "@category": "high",
            "@height": "1278",
            "@width": "2368",
            "@_fa": "true",
            "$": "https://api.elsevier.com/content/object/eid/1-s2.0-S2095495624004674-gr7_lrg.jpg?httpAccept=%2A%2F%2A",
            "@multimediatype": "JPEG image file",
            "@type": "IMAGE-HIGH-RES",
            "@size": "180857",
            "@ref": "gr7",
            "@mimetype": "image/jpeg"
          },
          {
            "@category": "thumbnail",
            "@_fa": "true",
            "$": "https://api.elsevier.com/content/object/eid/1-s2.0-S2095495624004674-si1.svg?httpAccept=%2A%2F%2A",
            "@multimediatype": "Scalable Vector Graphics file",
            "@type": "ALTIMG",
            "@size": "11448",
            "@ref": "si1",
            "@mimetype": "image/svg+xml"
          },
          {
            "@category": "thumbnail",
            "@_fa": "true",
            "$": "https://api.elsevier.com/content/object/eid/1-s2.0-S2095495624004674-si2.svg?httpAccept=%2A%2F%2A",
            "@multimediatype": "Scalable Vector Graphics file",
            "@type": "ALTIMG",
            "@size": "9471",
            "@ref": "si2",
            "@mimetype": "image/svg+xml"
          },
          {
            "@category": "standard",
            "@_fa": "true",
            "$": "https://api.elsevier.com/content/object/eid/1-s2.0-S2095495624004674-am.pdf?httpAccept=%2A%2F%2A",
            "@multimediatype": "Acrobat PDF file",
            "@type": "AAM-PDF",
            "@size": "2042730",
            "@ref": "am",
            "@mimetype": "application/pdf"
          }
        ]
      },
      "link": {
        "@rel": "abstract",
        "@href": "https://api.elsevier.com/content/abstract/scopus_id/85199700335"
      }
    }
  }
}