{
  "metadata": {
    "title": "Interfacial assembly of two-dimensional MXenes",
    "authors": "Chuanfang (John) Zhang",
    "journal": "Journal of Energy Chemistry",
    "date": "2021-09-30",
    "doi": "10.1016/j.jechem.2020.12.036",
    "abstract": "",
    "uri": "https://api.elsevier.com/content/article/pii/S2095495621000310",
    "pii": "S2095495621000310"
  },
  "fulltext": {
    "full-text-retrieval-response": {
      "scopus-eid": "2-s2.0-85101804953",
      "originalText": "serial JL 286353 291210 291711 291744 291809 31 Journal of Energy Chemistry JOURNALENERGYCHEMISTRY 2021-01-14 2021-01-14 2021-03-02 2021-03-02 2021-04-23T15:56:40 1-s2.0-S2095495621000310 S2095-4956(21)00031-0 S2095495621000310 10.1016/j.jechem.2020.12.036 S300 S300.1 FULL-TEXT 1-s2.0-S2095495621X00022 2021-04-23T16:45:14.292009Z 0 0 20210901 20210930 2021 2021-01-14T07:25:08.59495Z absattachment articleinfo articletitlenorm authfirstinitialnorm authfirstsurnamenorm cid cids contenttype copyright crossmark dateloaded dateloadedtxt datesearch datesort dateupdated dco docsubtype doctype doi eid ewtransactionid hubeid indexeddate issn issnnorm itemstage itemtransactionid itemweight openaccess openarchive pg pgfirst pglast pii piinorm pubdateend pubdatestart pubdatetxt pubyr sortorder srctitle srctitlenorm srctype ssids alllist content subj subheadings suppl tomb volfirst volissue volumelist webpdf webpdfpagecount yearnav figure table body acknowledge affil articletitle auth authfirstini authfull authkeywords authlast primabst pubtype ref specialabst 2095-4956 20954956 false 60 60 C Volume 60 43 417 434 417 434 202109 September 2021 2021-09-01 2021-09-30 2021 article rev © 2021 Science Press and Dalian Institute of Chemical Physics, Chinese Academy of Sciences. Published by ELSEVIER B.V. and Science Press. All rights reserved. INTERFACIALASSEMBLYTWODIMENSIONALMXENES ZHANG C 1 Introduction on MXenes 2 Important factors that governing the assembling of MXenes 2.1 MXene surface chemistry 2.2 MXene colloidal behaviors 3 Interfacial assembly of pure MXenes 3.1 Definition of interface and interfacial assembly 3.2 Assembly of delaminated MXene flakes 3.3 Interfacial grafting of MXenes 3.3.1 Physical grafting 3.3.2 Chemical grafting 4 Interfacial assembly of MXene-based composites 4.1 Electrostatic assembly 4.2 Heterogeneous assembly 4.3 Crosslinking assembly and gelation 5 Applications of assembled MXene architectures 5.1 Transparent conductive electrodes (TCE) 5.2 Electrochemical energy storage (EES) 5.2.1 Supercapacitors 5.2.2 Rechargeable batteries 5.3 Electromagnetic interference shielding (EMI) 6 Summary and perspectives Acknowledgments References NAGUIB 2012 1322 1331 M NAGUIB 2012 61 64 M NAGUIB 2014 992 1005 M NAGUIB 2011 4248 4253 M NAGUIB 2013 15966 15969 M GHIDIU 2014 78 81 M SHI 2020 8678 8688 H JOHNZHANG 2020 29 55 C ABDOLHOSSEINZADEH 2020 31004 S TANG 2018 1801897 X TANG 2019 1901907 H TANG 2018 1800502 H DU 2017 690 699 F BAO 2018 778 787 W LIU 2017 1702367 J ZHAO 2018 11193 11202 S KIM 2018 986 993 S SARYCHEVA 2018 eaau0920 A CHOI 2018 1701076 G HAN 2020 M ANASORI 2017 16098 B DEYSHER 2019 204 217 G TAO 2017 1 7 Q HALIM 2016 3118 3127 J LI 2020 894 899 Y SIM 2017 64 69 E MASHTALIR 2015 3501 3506 O LEE 2019 1603 1611 E HUANG 2019 1901117 D LV 2018 1804338 L GHIDIU 2014 9517 9520 M GOGOTSI 2019 8491 8494 Y ANASORI 2015 9507 9516 B AHMED 2020 2000894 B TAHINI 2017 7016 7020 H ZHANG 2020 2001093 J KIM 2020 55 70 H HART 2019 522 J DILLON 2016 4162 4168 A ZHANG 2019 102 125 C DE 2010 2713 2720 S DE 2010 458 464 S ZHANG 2017 1702678 C KIM 2019 32320 32327 S AHN 2020 2000919 S XIE 2014 6385 6394 Y KAMYSBAYEV 2020 eaba8311 V ZHANG 2019 1 14 P XU 2020 2007011 B ZHU 2020 630 660 Q WEI 2021 244 255 Y MIAO 2021 243 250 J DING 2020 8798 8804 L LI 2020 16649 16660 Z ZHAO 2020 X LAO 2018 12464 12471 J LIPATOV 2016 1600255 A ZHAO 2019 513 526 X HABIB 2018 20 T HU 2017 31773 31780 T ZHANG 2017 4848 4856 C ZHANG 2020 34032 34040 J NATU 2019 12655 12660 V SHI 2019 18171 18176 S ZHAO 2020 910 917 S LIU 2019 1 12 H DENG 2019 1902432 Y SHANG 2019 1903960 T WU 2020 1903077 Z GHIDIU 2017 1099 1106 M ALHABEB 2017 7633 7644 M HANTANASIRISAKUL 2019 2941 2951 K SCHULTZ 2019 6590 6597 T MIRANDA 2016 033102 A LI 2018 6223 6227 T SEREDYCH 2019 3332 M ELDEMELLAWI 2018 8485 8493 J MARIANO 2016 16371 16378 M HUANG 2019 1958 1966 S HUANG 2020 S HERNANDEZ 2010 3208 3213 Y MALESKI 2017 1632 1640 K SEYEDIN 2019 1900037 S HERNANDEZ 2008 563 568 Y ZHANG 2018 128 145 D JIANG 2016 2680 2687 L LI 2015 453 461 Y ZHANG 2018 eaat0098 Y HUANG 2020 292 301 X KIM 2019 13818 13828 D ZHANG 2016 4143 4151 C ZHANG 2016 3937 3943 C XIONG 2018 503 511 J WU 2017 X LIU 2016 15853 15856 Y PETUKHOV 2019 9980 9986 D BIAN 2018 3621 3625 R SHIM 2014 1388 1393 J YUN 2020 1906769 T UZUN 2019 1905015 S SEYEDIN 2017 24076 24082 S PARK 2019 6835 6844 T ZHANG 2020 254 265 J XIA 2018 409 412 Y NAFICY 2014 326 331 S AKUZUM 2018 2685 2694 B EOM 2020 2825 W ZHANG 2019 1804732 J WANG 2018 1802225 Z LEVITT 2020 2000739 A SUN 2013 13407 13413 Z CHEN 2017 8961 8969 D SUN 2020 8591 8595 H XU 2020 18116 18122 R CAIN 2019 12385 12392 J KUMAR 2018 S CAO 2019 1057 1065 W AAKYIIR 2020 125439 M XIA 2020 5111 5120 M ZHANG 2019 21766 21773 S LIU 2019 8854 8864 S CAO 2020 136211 D ZENG 2020 2000979 Z ZHAO 2015 339 345 M ABDOLHOSSEINZADEH 2020 2000716 S CHAPEL 2012 97 105 J ZHOU 2012 1086 1090 X XIE 2016 513 523 X ZHAO 2020 246 257 R GUO 2019 478 485 D NIU 2018 3937 S ROUSE 2003 59 62 J TOMIOKA 1998 1531 1534 N KOSTIAINEN 2013 52 56 M ZHENG 2013 1265 1270 G FANG 2006 487 491 B LI 2011 6003 6006 Y WU 2014 15753 15759 X LEE 2014 9655 9664 G YANG 2019 117956 Y SUN 2017 1702807 R ZHAO 2017 1702410 M ZHANG 2009 13 21 F ZHANG 2020 2000446 F WEI 2014 1042 1048 Q SONG 2013 5891 5899 M WANG 2020 9226 9235 S CUI 2020 1376 1383 Y GHOLAMVAND 2016 2641 2651 Z YU 2018 181 190 M XU 2018 479 488 S VIALAT 2014 n/a-n/a P WANG 2012 4124 4155 Q LIN 2019 24656 24663 P YANG 2020 2000351 Y NIU 2020 105 113 H ZHAO 2019 1904255 X TIAN 2019 2558 W MENG 2018 1801514 R SHI 2020 1901975 M HE 2020 119006 F LI 2019 4730 4737 M WANG 2020 19570 19575 J HUANG 2019 3448 3456 H NAGUIB 2014 7420 7423 M AHMED 2016 7580 7587 B JIAO 2019 1900219 L HAN 2017 20038 20045 M CHERTOPALOV 2018 6109 S LUO 2019 1808107 J ZHOU 2020 2077 T LIU 2018 Y PAN 2016 347 354 L PAN 2015 2726 2733 L DUAN 2016 828 833 Z IQBAL 2020 446 450 A LIN 2020 2109 2117 Z SHAHZAD 2016 1137 1140 F LING 2014 16676 16681 Z CHEN 2020 10471 10479 H GHIDIU 2016 3507 3514 M CHEN 2019 295 304 Y YUE 2018 4224 4232 Y CHUA 2014 291 312 C CHEN 2010 19885 19890 W WANG 2016 6731 6741 Z LIU 2018 1802479 J WU 2020 122622 X ZHAO 2019 10446 10455 X CAO 2016 9629 9636 J YEH 2015 166 170 C RASOOL 2019 80 102 K IHSANULLAH 2020 3 I GUO 2016 11446 11452 Z ZHAN 2020 235 258 X IHSANULLAH 2020 124340 I DE 2011 774 781 S BAE 2010 574 578 S LI 2009 4359 4363 X HANTANASIRISAKUL 2016 1600050 K ZHANG 2018 73 85 X LUKATSKAYA 2013 1502 1505 M CAI 2018 56 62 Y HU 2016 11344 11350 M SIMON 2020 1 13 P ZHOU 2016 5008 5013 J LUKATSKAYA 2017 17105 M SIMON 2017 2393 2396 P TIAN 2019 1902977 W FAN 2018 9642 Z YANG 2019 1902725 W DALLAGNESE 2015 2305 2309 Y ER 2014 11173 11179 D LIU 2020 1901094 J LI 2020 1907451 Y ZHANGX2021X417 ZHANGX2021X417X434 ZHANGX2021X417XC ZHANGX2021X417X434XC 2023-03-02T00:00:00.000Z 2023-03-02T00:00:00.000Z http://creativecommons.org/licenses/by-nc-nd/4.0/ © 2021 Science Press and Dalian Institute of Chemical Physics, Chinese Academy of Sciences. Published by ELSEVIER B.V. and Science Press. All rights reserved. 2021-01-10T11:48:42.540Z http://vtw.elsevier.com/data/voc/AddOnTypes/50.7/eoas ETH Eidgenössische Technische Hochschule Zürich http://data.elsevier.com/vocabulary/SciValFunders/501100003006 http://sws.geonames.org/2658434 item S2095-4956(21)00031-0 S2095495621000310 1-s2.0-S2095495621000310 10.1016/j.jechem.2020.12.036 286353 2021-04-23T16:45:14.292009Z 2021-09-01 2021-09-30 1-s2.0-S2095495621000310-main.pdf https://s3-eu-west-1.amazonaws.com/prod-ucs-content-store-eu-west/content/pii:S2095495621000310/MAIN/application/pdf/82d9e0f7657bd0b227c91278f58d8289/main.pdf main.pdf pdf true 4966063 MAIN 18 1-s2.0-S2095495621000310-main_1.png https://s3-eu-west-1.amazonaws.com/prod-ucs-content-store-eu-west/content/pii:S2095495621000310/PREVIEW/image/png/8ed60bfc3c18ab88f7de79036c980e3f/main_1.png main_1.png png 63269 849 656 IMAGE-WEB-PDF 1 1-s2.0-S2095495621000310-gr2.jpg https://s3-eu-west-1.amazonaws.com/prod-ucs-content-store-eu-west/content/pii:S2095495621000310/gr2/DOWNSAMPLED/image/jpeg/267f2e9d78e0b60d3d0739262e23fc61/gr2.jpg gr2 gr2.jpg jpg 158995 605 667 IMAGE-DOWNSAMPLED 1-s2.0-S2095495621000310-gr3.jpg https://s3-eu-west-1.amazonaws.com/prod-ucs-content-store-eu-west/content/pii:S2095495621000310/gr3/DOWNSAMPLED/image/jpeg/1f2cef18af77b5829720d0e19b686bb3/gr3.jpg gr3 gr3.jpg jpg 120831 465 774 IMAGE-DOWNSAMPLED 1-s2.0-S2095495621000310-gr4.jpg https://s3-eu-west-1.amazonaws.com/prod-ucs-content-store-eu-west/content/pii:S2095495621000310/gr4/DOWNSAMPLED/image/jpeg/9a2b21ccaa03f8fe3e898d8af15a80ca/gr4.jpg gr4 gr4.jpg jpg 132102 496 774 IMAGE-DOWNSAMPLED 1-s2.0-S2095495621000310-gr5.jpg https://s3-eu-west-1.amazonaws.com/prod-ucs-content-store-eu-west/content/pii:S2095495621000310/gr5/DOWNSAMPLED/image/jpeg/4885d587500eba2e964afc892ee73df0/gr5.jpg gr5 gr5.jpg jpg 99966 416 774 IMAGE-DOWNSAMPLED 1-s2.0-S2095495621000310-gr6.jpg https://s3-eu-west-1.amazonaws.com/prod-ucs-content-store-eu-west/content/pii:S2095495621000310/gr6/DOWNSAMPLED/image/jpeg/56adf2fc79bc98b783639439ae7d04b0/gr6.jpg gr6 gr6.jpg jpg 146014 491 774 IMAGE-DOWNSAMPLED 1-s2.0-S2095495621000310-gr7.jpg https://s3-eu-west-1.amazonaws.com/prod-ucs-content-store-eu-west/content/pii:S2095495621000310/gr7/DOWNSAMPLED/image/jpeg/4d96d65171cc9d68ba8a789b3662bf7a/gr7.jpg gr7 gr7.jpg jpg 89893 430 711 IMAGE-DOWNSAMPLED 1-s2.0-S2095495621000310-gr8.jpg https://s3-eu-west-1.amazonaws.com/prod-ucs-content-store-eu-west/content/pii:S2095495621000310/gr8/DOWNSAMPLED/image/jpeg/1d5b455c9aebbd1187912eab8229c540/gr8.jpg gr8 gr8.jpg jpg 48375 374 373 IMAGE-DOWNSAMPLED 1-s2.0-S2095495621000310-gr9.jpg https://s3-eu-west-1.amazonaws.com/prod-ucs-content-store-eu-west/content/pii:S2095495621000310/gr9/DOWNSAMPLED/image/jpeg/43314eb233dc6cb78e52572649270b5d/gr9.jpg gr9 gr9.jpg jpg 100284 361 774 IMAGE-DOWNSAMPLED 1-s2.0-S2095495621000310-ga1.jpg https://s3-eu-west-1.amazonaws.com/prod-ucs-content-store-eu-west/content/pii:S2095495621000310/ga1/DOWNSAMPLED/image/jpeg/a1c44d3d87afd23997972d3e97c39d53/ga1.jpg ga1 true ga1.jpg jpg 38694 172 500 IMAGE-DOWNSAMPLED 1-s2.0-S2095495621000310-gr1.jpg https://s3-eu-west-1.amazonaws.com/prod-ucs-content-store-eu-west/content/pii:S2095495621000310/gr1/DOWNSAMPLED/image/jpeg/ff206e4331b757312f14359bd1f2f8b5/gr1.jpg gr1 gr1.jpg jpg 44804 360 373 IMAGE-DOWNSAMPLED 1-s2.0-S2095495621000310-gr2.sml https://s3-eu-west-1.amazonaws.com/prod-ucs-content-store-eu-west/content/pii:S2095495621000310/gr2/THUMBNAIL/image/gif/6ffa046b11940a3ec19caffc2e94aa1e/gr2.sml gr2 gr2.sml sml 19098 164 181 IMAGE-THUMBNAIL 1-s2.0-S2095495621000310-gr3.sml https://s3-eu-west-1.amazonaws.com/prod-ucs-content-store-eu-west/content/pii:S2095495621000310/gr3/THUMBNAIL/image/gif/9d128aa9c5a43fc7aa6471454583cdd8/gr3.sml gr3 gr3.sml sml 16872 132 219 IMAGE-THUMBNAIL 1-s2.0-S2095495621000310-gr4.sml https://s3-eu-west-1.amazonaws.com/prod-ucs-content-store-eu-west/content/pii:S2095495621000310/gr4/THUMBNAIL/image/gif/3f773971a0440062d931d7e59002acc4/gr4.sml gr4 gr4.sml sml 18043 140 219 IMAGE-THUMBNAIL 1-s2.0-S2095495621000310-gr5.sml https://s3-eu-west-1.amazonaws.com/prod-ucs-content-store-eu-west/content/pii:S2095495621000310/gr5/THUMBNAIL/image/gif/93253501c8f32f88f55674f33aab68f9/gr5.sml gr5 gr5.sml sml 11518 118 219 IMAGE-THUMBNAIL 1-s2.0-S2095495621000310-gr6.sml https://s3-eu-west-1.amazonaws.com/prod-ucs-content-store-eu-west/content/pii:S2095495621000310/gr6/THUMBNAIL/image/gif/14657ce9b6964afc05809473c074824f/gr6.sml gr6 gr6.sml sml 18160 139 219 IMAGE-THUMBNAIL 1-s2.0-S2095495621000310-gr7.sml https://s3-eu-west-1.amazonaws.com/prod-ucs-content-store-eu-west/content/pii:S2095495621000310/gr7/THUMBNAIL/image/gif/24a926c61f6339ea2485f20aac80b8d7/gr7.sml gr7 gr7.sml sml 15694 133 219 IMAGE-THUMBNAIL 1-s2.0-S2095495621000310-gr8.sml https://s3-eu-west-1.amazonaws.com/prod-ucs-content-store-eu-west/content/pii:S2095495621000310/gr8/THUMBNAIL/image/gif/bfe7f9e81b10ab57293ac8b21068396e/gr8.sml gr8 gr8.sml sml 13780 163 163 IMAGE-THUMBNAIL 1-s2.0-S2095495621000310-gr9.sml https://s3-eu-west-1.amazonaws.com/prod-ucs-content-store-eu-west/content/pii:S2095495621000310/gr9/THUMBNAIL/image/gif/18929b2efc5ffbe6326b44bc6a489637/gr9.sml gr9 gr9.sml sml 12304 102 219 IMAGE-THUMBNAIL 1-s2.0-S2095495621000310-ga1.sml https://s3-eu-west-1.amazonaws.com/prod-ucs-content-store-eu-west/content/pii:S2095495621000310/ga1/THUMBNAIL/image/gif/10e349243775db997a481330e1cebaf1/ga1.sml ga1 true ga1.sml sml 13170 75 219 IMAGE-THUMBNAIL 1-s2.0-S2095495621000310-gr1.sml https://s3-eu-west-1.amazonaws.com/prod-ucs-content-store-eu-west/content/pii:S2095495621000310/gr1/THUMBNAIL/image/gif/12eab4efb1a8f8689ae13562ca103c74/gr1.sml gr1 gr1.sml sml 17763 164 170 IMAGE-THUMBNAIL 1-s2.0-S2095495621000310-gr2_lrg.jpg https://s3-eu-west-1.amazonaws.com/prod-ucs-content-store-eu-west/content/pii:S2095495621000310/gr2/HIGHRES/image/jpeg/4bd42316aec2537842e046e6f101a51f/gr2_lrg.jpg gr2 gr2_lrg.jpg jpg 1061774 2677 2953 IMAGE-HIGH-RES 1-s2.0-S2095495621000310-gr3_lrg.jpg https://s3-eu-west-1.amazonaws.com/prod-ucs-content-store-eu-west/content/pii:S2095495621000310/gr3/HIGHRES/image/jpeg/48fda3c360350a81118f54a43cf69aa5/gr3_lrg.jpg gr3 gr3_lrg.jpg jpg 746108 2059 3425 IMAGE-HIGH-RES 1-s2.0-S2095495621000310-gr4_lrg.jpg https://s3-eu-west-1.amazonaws.com/prod-ucs-content-store-eu-west/content/pii:S2095495621000310/gr4/HIGHRES/image/jpeg/05ebc0f89d40cb8244b28651bbe45637/gr4_lrg.jpg gr4 gr4_lrg.jpg jpg 815616 2193 3425 IMAGE-HIGH-RES 1-s2.0-S2095495621000310-gr5_lrg.jpg https://s3-eu-west-1.amazonaws.com/prod-ucs-content-store-eu-west/content/pii:S2095495621000310/gr5/HIGHRES/image/jpeg/08f6cc1d63fa72b3d4c5d309fa6f6fa3/gr5_lrg.jpg gr5 gr5_lrg.jpg jpg 594414 1842 3425 IMAGE-HIGH-RES 1-s2.0-S2095495621000310-gr6_lrg.jpg https://s3-eu-west-1.amazonaws.com/prod-ucs-content-store-eu-west/content/pii:S2095495621000310/gr6/HIGHRES/image/jpeg/b8da1af39031d7e397d8dbc89c3c4bc1/gr6_lrg.jpg gr6 gr6_lrg.jpg jpg 960531 2171 3425 IMAGE-HIGH-RES 1-s2.0-S2095495621000310-gr7_lrg.jpg https://s3-eu-west-1.amazonaws.com/prod-ucs-content-store-eu-west/content/pii:S2095495621000310/gr7/HIGHRES/image/jpeg/0a2bb38c2a9f0afb0db3c95ae19fd3e4/gr7_lrg.jpg gr7 gr7_lrg.jpg jpg 535302 1907 3150 IMAGE-HIGH-RES 1-s2.0-S2095495621000310-gr8_lrg.jpg https://s3-eu-west-1.amazonaws.com/prod-ucs-content-store-eu-west/content/pii:S2095495621000310/gr8/HIGHRES/image/jpeg/f6eab2de33066cee919d5716f5569847/gr8_lrg.jpg gr8 gr8_lrg.jpg jpg 333835 1659 1654 IMAGE-HIGH-RES 1-s2.0-S2095495621000310-gr9_lrg.jpg https://s3-eu-west-1.amazonaws.com/prod-ucs-content-store-eu-west/content/pii:S2095495621000310/gr9/HIGHRES/image/jpeg/7ff300d6e2ec067ae85e86d1214bd632/gr9_lrg.jpg gr9 gr9_lrg.jpg jpg 659665 1596 3425 IMAGE-HIGH-RES 1-s2.0-S2095495621000310-ga1_lrg.jpg https://s3-eu-west-1.amazonaws.com/prod-ucs-content-store-eu-west/content/pii:S2095495621000310/ga1/HIGHRES/image/jpeg/d74e2cf20012dd54e0e84bf9a2488866/ga1_lrg.jpg ga1 true ga1_lrg.jpg jpg 242077 760 2213 IMAGE-HIGH-RES 1-s2.0-S2095495621000310-gr1_lrg.jpg https://s3-eu-west-1.amazonaws.com/prod-ucs-content-store-eu-west/content/pii:S2095495621000310/gr1/HIGHRES/image/jpeg/caf4d0c4ee675ea370cb178712aefd10/gr1_lrg.jpg gr1 gr1_lrg.jpg jpg 319644 1596 1654 IMAGE-HIGH-RES 1-s2.0-S2095495621000310-am.pdf https://s3-eu-west-1.amazonaws.com/prod-ucs-content-store-eu-west/content/egi:10GHC2M66SN/MAIN/application/pdf/26df42e793fd6d82319c78439d7c6405/am.pdf am am.pdf pdf false 2342893 AAM-PDF JECHEM 1755 S2095-4956(21)00031-0 10.1016/j.jechem.2020.12.036 Science Press Fig. 1 Interfaces and interfacial assembly of MXenes. Fig. 2 (a) Self-assembled film on the MXene suspension with different pH with or without the addition of DOTAB. Reproduced with permission from Ref. [100], copyright 2019 Royal Society of Chemistry. (b) Scheme describing the effect of pH on the interaction between CTAB and Ti3C2T x MXene. Reproduced with permission from Ref. [101], copyright 2018 Royal Society of Chemistry. (c) Optical image of assembled Ti3C2T x MXene film transferred to polyethylene terephthalate (PET) (top panel) with the bottom panel showing its corresponding SEM image. Reproduced with permission from Ref. [47], copyright 2019 American Chemical Society. (d) Optical images of as-assembled transparent MXene films (left) and (e) Cross-section transmission electron microscopy (TEM) images of 5-layer (right) assembled MXene films, respectively. (f) Scheme of two-step assembly of MXene compact films at the liquid–air interface assisted by high-vapor-pressure solvents (i.e., EA). Reproduced with permission from Ref. [103], copyright 2020 Wiley-VCH. (g) Scheme of wet-spinning of MXene LC phases into fibers (left), illustration of the fast (top right) and slow (bottom right) coagulation mechanism using acetic acid and chitosan coagulation baths, respectively. Reproduced with permission from Ref. [107], copyright 2020 American Chemical Society. (h) SEM image of a wet-spin pure MXene fiber with NH4 + in the coagulation bath. Reproduced with permission from Ref. [111], copyright 2020 Springer Nature. Fig. 3 (a) Scheme of synthesis of MXene surfactant as building blocks for Janus MXene nanofilm (left panel) and MXene aerogel (right panel), respectively. Reproduced with permission from Ref. [68], copyright 2020 Royal Society of Chemistry. (b) Scheme of the construction of Pickering emulsions based on physically grafted MXene surfactants. (c) Interfacial tension of different oil–water systems plotted as a function of time (top panel) with their schemes shown in the bottom panel. Reproduced with permission from Ref. [67], copyright 2019 Wiley-VCH. (d) Scheme of 3D printing of MXene surfactants in silicone oil with inset shown the interfacial assembly of MXene surfactants. Reproduced with permission from Ref. [120], copyright 2019 American Chemical Society. (e) Scheme of interfacial chemical grafting of MXenes through condensation reaction and phase transfer. Reproduced with permission from Ref. [94], copyright 2019 American Chemical Society. (f) SEM image of PMMA-coated Si/MXene composite achieved through interfacial assembling followed by annealing at 500 °C. Reproduced with permission from Ref. [125], copyright 2020 American Chemical Society. Fig. 4 (a) A typical TEM image of hollow MXene spheres after annealing of electrostatic-assembled PMMA-MXene hybrid spheres at 450 °C to remove PMMA template (top panel). Scheme of fabrication of MXene@PS hybrid spheres obtained via electrostatic assembly (bottom panel). Reproduced with permission from Ref. [147,148], copyright 2017 Wiley-VCH. (b) Scheme shows preparation of MXene-CNT films through the electrostatic assembly method assisted by CTAB (top panel) based on the distinguished zeta potential (bottom left panel). The bottom right panel shows the digital images of each aqueous suspension. Reproduced with permission from Ref. [134], copyright 2016 Elsevier. (c) Scheme of synthesis of MXene/g-C3N4 as Schottky junction. Reproduced with permission from Ref. [146], copyright 2019 Elsevier. (d) Illustration on the CoAl-LDH/MXene heterostructure, showing synergistic effects between the edge-rich LDH and highly conductive MXenes. Reproduced with permission from Ref. [162], copyright 2020 Elsevier. (e) Scheme of LBL assembly of (MXene/TAEA) n multilayer films and (f) shows the AFM image of assembled multilayered film. Reproduced with permission from Ref. [164], copyright 2019 Springer Nature. Fig. 5 (a) Scheme of formation of FeNi-LDH on 2D MXene exfoliated nanosheets, enabling synergistically chemical and electronic coupling for catalytic improvement in OER. Reproduced with permission from Ref. [156], copyright 2018 Elsevier. (b) Scheme of the formation of carbon-MXene-carbon heterostructures. Reproduced with permission from Ref. [169], copyright 2020 Wiley-VCH. (c) Growth of MoS2 on carbon-plated MXene, forming hierarchical heterostructures. Reproduced with permission from Ref. [98], copyright 2017 Wiley-VCH. (d) Scheme of van der Waals interaction assembly of MXene-based heterstructures, including TiO2 nanorods and SnO2 nanowires. Reproduced with permission from Ref. [178], copyright 2018 Wiley-VCH. Fig. 6 (a) Illustration of thawing MXene preassembly in protic acid and DI-water, respectively, to show the critical role of the removal of Li+ in order to achieve stable macrostructurs. Reproduced with permission from Ref. [186], copyright 2020 American Chemical Society. (b and c) Schemes of formation mechanism of crosslinking assembly of MXene-rGO hydrogel. Reproduced with permission from Ref. [71], copyright 2019 Wiley-VCH. (d) Scheme of fabrication of MXene/rGO aerogels with ordered slit channels based on directional freezing method. Reproduced with permission from Ref. [17], copyright 2018 American Chemical Society. (e) SEM image of MXene-nanocellulose aerogels fabricated through directional freezing the hydrogels, showing ordered channels and honeycomb structures. Reproduced with permission from Ref. [129], copyright 2020 Wiley-VCH. (f) TEM image of MXene-PI aerogel obtained through annealing-induced polymerization of PAA at 300 °C, showing PI layers tightly covered on MXene sheets. Reproduced with permission from Ref. [193], copyright 2018 Wiley-VCH. (g) Electrical conductivity and density of as-formed PDMS-coated MXene-SA aerogel. Reproduced with permission from Ref. [194], copyright 2020 Elsevier. Fig. 7 (a) Scheme of formation of MXene hydrogel initiated by divalent metal ions. (b) O1s XPS spectra of pristine MXene and MXene monolith, showing the formation of FeO bonds in the monolith. (c) Optical images of MXene-metal ions mixture to reveal effect of metal ions on the hydrogel formation. Reproduced with permission from Ref. [70], copyright 2019 Wiley-VCH. (d) Scheme of ion-diffusion-induced gelation of MXene. (e) Free-standing Zn2+ MXene hydrogel and foam. (f) Zn K-edge XAS to show the ZnO bonding as gelation sites to coordinate with MXene and GO nanosheets. (g) Large-area MXene hydrogel showing the scalability of the gelation method. Reproduced with permission from Ref. [183], copyright 2020 American Chemical Society. Fig. 8 Properties and applications of interfacial-assembled MXene architectures. Fig. 9 (a) Illustration on formation of vertically-aligned MXLLC films assisted by the surfactant (C12E6) and shear plates shown in blue. Under mechanical shear flow, the randomly aligned assembly of MXLLCs are forced to align with the flow direction that is perpendicular to the shear direction. (b) Top view of SEM image of the MXLLC, showing vertical-aligned nanosheets. (c) Rate performance of vacuum-filtrated MXene papers and as-assembled MXLLC films (guided by liquid crystals) at different scan rates up to 100 V/s. Reproduced with permission from Ref. [108], copyright 2018 Springer Nature. (d) Cross sectional SEM image (left panel) and galvanostatic charge–discharge profiles at different cycles at 2.5C (right panel) of interfacial-assembled, macroporous V2CT x MXene film, indicating the promising application of this assembly in Na-ion battery. Reproduced with permission from Ref. [148], copyright 2017 Wiley-VCH. (e) Cyclic voltammogram of electrostatic-assembled MXene-CNT electrode at 0.1 mV/s for Na-ion battery. Reproduced with permission from Ref. [134], copyright 2016 Elsevier. (f) Specific shielding effectiveness, SSE/t, plot as a function of thickness for different high‐performance shielding materials. Reproduced with permission from Ref. [103], copyright 2020 Wiley-VCH. (g) SSE/t plots comparison of MXene-CNF assemblies with other MXene-based films/architectures, showing a record-high SSE/t in the MXene-CNF aerogels. Reproduced with permission from Ref. [129], copyright 2020 Wiley-VCH. Table 1 Summary of preferred applications of various assembled MXene structures. Assembly interfaces Assembly routes Assembled structures Preferred applications Interfacial assembly of pure MXene nanostructures Liquid-air Solvent evaporation Pure, compact, transparent films Schottky contacts, TCEs, photodetectors, EMI shielding Liquid-solid Extrusion; spinning of MXene LC inks Pure MXene fibers, long-range orientation Wearable smart garments, fiber-shape supercapacitors Solid-solid Chemical grafting, ball-milling MXene heterostructures Li-ion battery anodes, mechanical reinforcement Liquid-liquid Physical grafting, perturbation Janus MXene films or aerogels, surfactants EMI shielding, microwave absorption, structural liquids Interfacial assembly of MXene-based composites/architectures Solid-solid Electrostatic assembly, ELBL MXene-guest species composites/films Primarily electrochemical energy storage and catalysis Solid-solid Heterogeneous assembly, covalent interaction Multiscale MXene-based heterostructures Li-ion and Na-ion battery anodes, water splitting, microwave absorption, Solid-liquid vdWs interaction Micelle-like MXene-oxide structure Electrochemical energy storage (Li, Na-ion batteries) Solid-solid, Solid-liquid Crosslinking, gelation MXene macroassemblies, aerogels, monoliths, hydrogels EMI shielding, wireless communication, mechanical reinforcement, supercapacitors Review Interfacial assembly of two-dimensional MXenes Chuanfang (John) Zhang ⁎ Laboratory for Functional Polymers, Swiss Federal Laboratories for Materials Science and Technology (Empa), ETH Domain, Überlandstrasse 129, CH-8600 Dübendorf, Switzerland Laboratory for Functional Polymers Swiss Federal Laboratories for Materials Science and Technology (Empa) ETH Domain Überlandstrasse 129 CH-8600 Dübendorf Switzerland Laboratory for Functional Polymers, Swiss Federal Laboratories for Materials Science and Technology (Empa), ETH Domain, Überlandstrasse 129, CH-8600 Dübendorf, Switzerland ⁎ Corresponding author. Graphical abstract The assembling of MXenes at various interfaces to form various building blocks, including films, electrodes, aerogels, and other building blocks is summarized in detail. Mechanisms are explained. Applications of these architectures are also demonstrated. Two-dimensional (2D) transition metal carbides, carbonitrides and nitrides, known as MXenes, are emerging quickly at the frontiers of 2D materials world. Their exotic properties such as the highest electrical conductivity among all solution-processed 2D materials, the best electromagnetic interference shielding performance outperforming that of copper or aluminum at a nanoscale thickness, as well as the highest volumetric capacitance for pseudocapacitors, have been attracting extensive fundamental research and applications. Their unique surface chemistries, that is, hydrophilic groups terminated on the surface of MXenes after etching and delamination, enable plenty of opportunities for assembling into MXene building blocks. Particularly, assembling at liquid–liquid, liquid–solid, liquid–air, and solid–solid interfaces allows the efficient fabrication of various structures, including MXene surfactants, MXene heterostructures, MXene transparent films. Interfacial assembly of MXenes is of significance in unveiling more versatilities of MXenes as well as impacts on novel MXene-based architectures, based on which enhanced performance of devices is achieved. As such, this review focuses on the interfacial assembly of MXenes, explaining mechanisms behind various assembling and providing classical examples for corresponding interfacial assembling techniques. Applications of these as-assembled architectures are also discussed in brief. We believe this review may shed light on the interfacial chemistry of MXenes, thus guiding more efficient fabrication of MXene-based functional films/coatings/electrodes/devices. Keywords Interfacial assembly MXene Interfacial tension Crosslinking Heterostructures 1 Introduction on MXenes Transition metal carbides, nitrides, carbonitrides, so-called MXenes, have emerged as a rising family of two-dimensional (2D) materials [1–6], triggering extensive research in various applications ranging from electrochemical energy storage [7–14], water desalination [15], to electromagnetic interference shielding [16,17], sensing [18], radio-frequency identification [19–21], etc. MXenes possess a general formula of M n +1X n T x , where M is transition metal (such as Cr, Ti, V, Mn, Nb, Mo, etc), X is carbon and/or nitrogen, T x is the terminated surface groups (i.e.−OH, −O, −F, −Cl, −Br, −NH, etc), n = 1–4, and − ene symbolizes the analogue to graphene [3,22,23]. In general, MXenes are obtained through the selective removal of A atomic layers from MAX phases, where A is a group 13 or 14 element such as Al, Ga while M and X refer to the same ones in corresponding MXenes [1,24–26]. The first MXene member and the most extensively studied one is titanium carbide (Ti3C2T x ), which was discovered in 2011 through etching Ti3AlC2 in hydrofluoric acid (HF) [4]. Other MXenes, such as Ti2CT x [27], Nb2CT x [28], V2CT x [29,30], Mo2CT x [31], Nb4C3T x [32], Ta4C3T x [1], double-metal MXenes (i.e., Mo2Ti2C3T x , Mo2TiC2T x , Mo4VC4T x , etc.) [33,34], solid-solutions (i.e., (Ti0.5Nb0.5)2CT x , Ti3(C0.5N0.5)2T x ) [1], and in-plane ordered vacancies MXene (i.e., Mo1.33CT x ) [24,35,36], are also reported [22]. Up to now, >30 MXene members have been synthesized with hundreds are predicted to be thermodynamically stable [22,37]. Inherited from their MAX precursors, MXenes possess a hexagonal lattice symmetry coupled with excellent metallic conductivity up to 15,100 S/cm [38]. More importantly, such a metallic conductivity can switch to semiconducting behavior by replacing the M element [39,40]. On the other hand, single-layer MXene flakes allow the permission of 97% of visible light, indicating 3% of loss in transmittance per monolayer of MXenes (1.5 nm in Ti3C2T x ) [41–43], and surpassing that of graphene (2.3% loss per layer, 0.34 nm) [44,45] by taking the thickness into consideration. In other words, delaminated MXene flakes have shown quite promising applications in transparent conductive coatings [41,46], transparent sensors [47], light emitting diodes [39,48], and other fields that requiring a high transmittance as well as high electrical conductivity. Besides, MXenes are terminated with abundant groups such as −OH, −O, and/or −F on the surface after the selective removal of A element [49], rendering a good hydrophilicity on the resultant multilayered MXenes. The surface chemistry of MXenes can also be modified by halide molten salts etching (Lewis acidic etching) of the MAX phases [26,50]. As such, surface groups such as −Cl, −Br, −I, can be terminated on MXene surface [26]. Further reacting the molten-salt-etched MXene with other chemicals, these relatively weak-bonded halide groups can be substituted by −NH, −S or completely removed, enabling a fine tuning on the properties (electrical, optical, mechanical, magnetic, optoelectronic, photonic and phonic, band gap, work function, etc) [50]. The modifications of MXene surface chemistry imply strong impacts on the applications, including electrochemical energy storage [51–55], electromagnetic interference (EMI) shielding, wave absorption, environmental protection, sensing, and others [56,57]. The major limitation that greatly impedes MXenes from practical application is their poor stability in water and/or humid environment [35,58–62]. According to Zhang et al., the oxidation starts on the edges of flakes and inwards afterwards; the pinholes/defects accelerate the oxidation kinetics [63]. Water and dissolved oxygen are two main reasons for the shortened life of colloidal MXene dispersions [64]. Based on this conclusion, isolating the delaminated MXene flakes from dissolved oxygen and/or water [64], storing in low-temperature environment [65], and/or capping the reactive edge of the flakes using polyanions [66] or antioxidant [61], have been confirmed as effective measures to realize stable colloidal MXenes with much extended shelf life. In addition, when the delaminated flakes are assembled with a compact morphology, the external nanosheets tend to form a protective layer upon long-term storage in ambient condition, resulting in films that well preserve the intrinsic properties of MXenes. These approaches highlight the importance of assembling techniques on the MXene shelf life. In line with this message, interfacial assembling of MXenes forming 3D aerogels can nicely and gracefully address most of these challenges related to poor stability and production costs. It is generally believed that once the surface of MXene delaminated nanosheets are accommodated with guest species, the oxidation stability kinetics is thus greatly suppressed through the capping effect. Moreover, the assembling with guest species requires a small amount of MXenes, which greatly reduces the MXene production cost. On the other hand, the rich surface chemistry coupled with the van der Waals force endow MXene with plenty of opportunities to assemble into MXene building blocks such as films, aerogels, heterostructures. at the liquid–liquid or liquid–solid interfaces. For instance, chemically grafting MXenes dramatically changes the surface tension as well as hydrophilicity of MXenes, leading to self-assembly of MXene flakes at the water–oil interface and formation of compact MXene films which are transparent and conductive [67,68]. By adding dispersions in which the guest species are positively charged into MXene dispersions, spontaneous assembly occurs at the liquid–solid interface where MXene-based composites are thus formed [69]. On the other hand, by adding dispersions with divalent metal ions, the electrostatic repulsive force of MXenes can be destroyed while the cation works as joining sites, leading to gelation at the liquid–solid interface and thus formation of MXene-metal ion hydrogel framework [70,71]. Upon freeze-drying, highly porous yet conductive sponge with excellent mechanical properties are obtained [17]. These MXene films, composites and aerogels can be widely applied as building blocks in many applications, such as conductive transparent coatings, electrochemical energy storage, drug delivery, sensing, EMI shielding, and so on. In other words, interfacial assembly of MXenes into MXene-based building blocks is of crucial significance toward the practical applications. While some reviews focusing on the MXene synthesis, properties and electrochemical energy storage applications have been published, quite few of them have reviewed the progress on the MXene assembling except a very recent one, which focused on the three-dimensional assembling of MXenes [72]. A timely review on the interfacial assembly of MXenes is highly in demand to provide insights on the fabrication of MXene building blocks for their emerging applications. As such, here in this review, progresses on the interfacial assembling of MXenes, including different assembling techniques, are discussed in detail. Surface chemistry, aqueous and organic dispersions of MXene are firstly discussed before heading to assembling. Interfacial assembling of pure MXene films and MXene-based composites are classified as two big categories, containing specific assembling routes such as physical/chemical grafting, electrostatic, heterogeneous and crosslinking assembling, gelation. Applications of these architectures are also briefly discussed, focusing on transparent conductive electrodes, electrochemical energy storage as well as electromagnetic interference shielding. Finally, challenges and prospects of interfacial assembly of MXenes are highlighted. 2 Important factors that governing the assembling of MXenes As mentioned before, the hydrophilic nature of MXenes is due to the presence of surface groups after the selective removal of A element (i.e. Al, Si, Ga) via solution etching of MAX phases [1]. These surface groups strongly influence the formation of stable colloidal dispersions (aqueous or organic), which further impact on the interfacial assembling of MXene flakes. As such, the surface chemistry of MXenes as well as colloidal behaviors are discussed prior to the MXene assembling. 2.1 MXene surface chemistry Previous studies indicate that the surface functional groups are etching route dependent. Etching MAX phases with a higher HF concentration (HF or LiF-HCl route) leads to multilayered MXenes with a higher F terminations [60,73,74]. For instance, HF-etched MXenes generally possess a higher F content compared to that of LiF-HCl route, since the concentration of HF in use is sharply different (>30 wt.% in the former vs. 3 wt.%–5 wt.% in the latter) [74]. In other words, LiF-HCl route leads to MXenes with a higher O/F ratio compared to that of HF route, which affects the colloidal behaviors and interfacial assembly as will be discussed below. As a result, quality, electronic conductivity, work function, band gap and other properties of MXene flakes are correspondingly changed [75]. For instance, a higher F surface terminations endow MXenes with higher work function up to ~5.3 eV while decreases to ~4.6 eV in the −O terminated Ti3C2T x [21,76]. The higher electronegativity of F than O also decreases the electronic conductivity in the resultant HF-etched MXene up to one order of magnitude (~1500 S/cm in the HF-etched MXene vs. ~15100 S/cm in the LiF-HCl-etched MXene) [21,77]. It's worth mentioning that etching route also affects the lateral flake size and their density of defects, a mild etching and delamination route generally results in MXene flakes with higher quality, larger flake size and less pin holes, thus exhibiting higher electronic conductivity compared to that of aggressive HF-etched MXenes [60,74]. While the presence of −F surface groups are inevitable in HF-containing etched MXenes, F-free MXenes (terminated with −O and −OH) can be obtained through hydrothermal reaction of MAX phase in concentrated sodium hydroxide deaerated solution at 270 °C [78]. On the other hand, halide surface groups can be grafted on the MXenes through Lewis acidic etching in halide molten salts. After etching at 750 °C, −Cl (or −Br, −I) and O-containing groups are added to the MXene surface [26]. It's worth mentioning that the surface bonding of Cl−Ti and Br−Ti (i.e., Ti3C2T x ) is relatively weak in terms of bonding energy and bonds formation enthalpies compared to those of F−Ti and OH−Ti [50]. As such, the halide-terminations can be modified by reacting with Li2Se, Li2O and NaNH2, yielding Ti3C2Se, Ti3C2O, and Ti3C2(NH) MXenes, respectively [50]. On the other hand, by reacting with LiH at 300 °C, these halide groups can be removed completely, resulting in bare MXenes (Ti3C2□2 and Ti2C□2) with vacancy sites [50]. This means that the surface chemistries of MXenes are fully under control; MXenes with certain type of surface groups can be manipulated to provide new structural and electronic properties, thus enabling new applications. Apart from chemical reactions, vacuum annealing is another effective route to remove surface groups [58,79]. For instance, by heating up MXene powders in Ar at high temperature, surface moieties are produced due to the partial removal of −OH groups [76,80,81]. It should be noted that the pristine hexagonal structure of MXene is maintained up to 800 °C, beyond which Ti3C2T x MXene starts to restructuring into cubic TiC crystals [79]. In any case, surface modifications affect the contact angle of MXenes and thus the dispersibility of MXene flakes in aqueous medium, influencing the interfacial assembly accordingly. 2.2 MXene colloidal behaviors Thanks to the abundant surface groups, the as-etched MXenes are hydrophilic and can disperse in water at ease. Indeed, by repeatedly washing the as-etched MXenes with de-ionized (DI-) water, the intercalated Li+ exchanges with water, causing swelling of the multilayered structure and finally leading to delamination once overcoming the weak interactions between the adjacent sheets. Meanwhile, repeated wash with DI-water also brings the pH of the dispersion to neutral, endowing zeta potential up to −80 mV in the delaminated flakes. This suggests that the as-delaminated MXene flakes are negatively charged and possess strong electrostatic repulsive forces, resulting in stable aqueous colloidal solutions. Nevertheless, the pin holes/defects on the delaminated MXene flakes catalyze the oxidation process, leading to quick degradation of the aqueous dispersions and thus limiting the interfacial assembly [64]. It's found that the dissolved oxygen and water are two primary factors that shorten the shelf life of MXene dispersions [82,83]. In addition, flake size also heavily affects the nanosheets stability [61,64,66]. Transmission electron microscopy (TEM) studies revealed that oxidation starts from the edge and shreds the flakes toward inwards [64]. After oxidation, methane gas evolves above the Ti3C2T x aqueous dispersion while cloudy-white settles down on the bottom, which is TiO2 (anatase) [83]. Similarly, ammonium gas (NH3) may form after the oxidation of Ti3CNT x aqueous dispersion [83]. As such, synthesizing high-quality MXene flakes with few pin holes, storing the aqueous dispersions in Ar-filled hermetic vials and keeping them in a low-temperature environment (5 °C) significantly improve the shelf life of delaminated MXene flakes [64]. Very recently, it's found that after freezing the aqueous dispersions at −20 °C, the quality of MXene flakes is maintained after two years [65]. Apart from these energy-intensive methods, capping the active edges with polyanionic salts such as polyphosphates, polysilicates or polyborates) is effective to mitigate oxidation [66]. Similarly, adding antioxidant such as sodium L-ascorbate is also capable to minimize the oxidation degradation of the flakes, maintaining the pristine properties of MXenes even after months of room-temperature storage [61]. It's thus worth mentioning that the removal of these added salts adds additional steps in the subsequent processes, complexing the whole procedures. On the other hand, by completely replacing water with non-aqueous polar solvents, direct contacts of MXene flakes with these two oxidants are thus eliminated, ensuring much extended shelf life in MXene-organic dispersions [84]. In general, good organic solvents are those that minimize the solvent-nanosheets and solvent–solvent interactions [85]. N-methyl-2-pyrrolidone (NMP), dimethyl sulfoxide (DMSO), dimethylformamide (DMF) possess high dielectric constants (and thus a high solvent polarity index), suggesting a stronger capability to stabilize the negatively-charged Ti3C2T x MXene nanosheets [86]. In other words, organic solvents with relatively high polarity can disperse Ti3C2T x nanosheets much better than solvents with lower polarity such as ethanol and methanol. This is evidenced by the much higher MXene concentration achieved in NMP than in methanol [84]. From the concentration-Hansen solubility parameter (dispersion Hansen parameter, δ D, polarity Hansen parameter, δ P, and the hydrogen-bonding Hansen parameter, δ H) plots, it was found that good organic solvents for Ti3C2T x MXene typically possess not only a high polarity δ P, but also a high dispersion interaction strength (δ D) [86]. This well explains why MXene flakes disperse well in NMP, DMSO, DMF and water, since these solvents exhibit a high strength of both polarity and dispersion interactions. Water has an unusually high hydrogen bonding strength as well. On the other hand, for solvents (such as methanol) that possess a low polarity δ P and/or moderate dispersion interactions (δ D), quite limited amount of MXene nanosheets can be dispersed, resulting in a much lower concentration (<0.1 mg/mL in methanol). Ethanol disperses MXene flakes better than methanol and dispersions with a concentration of 0.5 mg/mL may be achieved [84]. Despite MXene organic dispersions can be prepared through multiple solvent exchange without sonication, their concentrations are relatively low [87]. 3 Interfacial assembly of pure MXenes 3.1 Definition of interface and interfacial assembly Due to the interlayer interactions as well as the high surface-to-volume ratio in the delaminated flakes, restacking of 2D nanosheets is common for all 2D materials ranging from graphene, transition metal dichalcogenides (TMDs), and boron nitrides to MXenes [88–91]. The high surface tension coupled with van der Waals force in the delaminated MXene flakes also lead to aggregation, despite the electrostatic repulsive force on their surface. As such, investigating the coupling phenomenon at the interface and initiating the interfacial assembling are expected to guide the “aggregation” in purpose but also to produce novel architectures with exotic properties, such as enhanced electronic conductivity, improved gas permittivity, boosted sensing gauge factor, strengthened mechanical properties and so on [72,92,93]. Here in this review, interface is defined as the boundary of two (or three) phases, including liquid–liquid, liquid–solid, liquid–gas, solid–solid and solid–gas interfaces (Fig. 1 ). As explained before, MXene flakes are able to disperse in solvents with a high polarity δ P and a high dispersion interaction strength δ D, forming stable colloidal solutions with flakes homogeneously distributed. Therefore, through adding organic ligands that pre-dissolved in “MXene bad solvent” to the MXene dispersions, the interfacial tension is decreased and MXene compact yet transparent films are assembled at the liquid–liquid interface (for example, water–oil interface) [68,94]. On the other hand, by purging CO2 gas to the multilayered MXene powders at 800 °C, MXene-based heterostructures consisting of external oxides “shell” and internal carbide “core” are obtained at the solid–gas interfaces [95,96]. Similarly, by utilizing the abundant electronegative surface groups as anchoring sites for metal cations, quantum dots (for example, SnO2)-MXene [69,97] and carbon-plated MoS2-MXene heterostructures [98] can be obtained at the liquid–solid interfaces, endowing thrilling opportunities in many fields such as Li-ion batteries, water splitting, sensing, etc. Therefore, MXene microscale assembling at different interfaces (instead of only focusing at the liquid–liquid interface), covering formation of pure MXene films, 3D macroassemblies, heterostructures, and hybrids, are of significance, and will be discussed in detail as below. 3.2 Assembly of delaminated MXene flakes As mentioned before, MXene surface is terminated with abundant hydrophilic, electronegatively charged groups, ensuring formation of stable colloidal solutions when dispersed in water. This unique nature endows facial interfacial assembly of MXene in the aqueous medium in the liquid–liquid, liquid–solid and liquid–air interfaces. For example, after dropcasting MXene aqueous dispersion on Si substrate, upon continuous evaporation of water in the liquid–air interface, smooth films are automatically assembled in the liquid–solid interface, ensuring Schottky contacts with n-Si and thus enabling the separation/transport of photoinduced carriers in photodetectors [99]. On the other hand, through creating MXene ligands, the latter spontaneously migrates to the immiscible boundary such as water–oil interface, and proceed the interfacial assembly [67,68]. These unique assembled films typically possess good flakes alignment, a compact film morphology and thus showing good electronic conductivity. Indeed, the MXene assembly in the liquid–air interface is pH-dependent. When pH > 8, directly MXene monolayer-assembly is achieved with thickness ~ 1.5 nm, ensuring the formation of continuous transparent conductive films. When pH < 4, the as-assembled MXene films are terminated with coordinated anions such as Braq − [100], as shown in Fig. 2 (a). Such a pH-control assembly process has further proven in the formation of MXene-based emulsions. Due to the interactions of positively charged − N(CH3)3 on cetyltrimethylammonium bromide (CTAB) with − O groups on MXenes (Fig. 2b, top panel), the hydrophilicity of MXenes can be tuned and stable emulsions are thus enabled (Fig. 2b, bottom panel) [101]. For pH < 7 (acidic medium), protons undermine the CTAB-MXene bonds thus emulsions become unstable. On the other hand, when pH > 7, stable water-in-oil emulsions (known as Pickering emulsions) are enabled. Further freeze-drying-annealing results in the construction of 3D MXene foams [101]. By utilizing the evaporation of high vapor pressure (or low-boiling point) of solvent (such as ethyl acetate, 77.1 °C, Hexane, 68.7 °C or dichloromethane, 39.6 °C), constant turbulence is created, based on which 2D flakes (such as graphene) start to assemble at the water-exposed regions on the surface due to the Marangoni effect [102]. Kim et al. suggested that the turbulence resulted from the floated layer of ethyl acetate (EA) on water lead to Rayleigh-Bénard convection, forming regions with high surface tension and driving fluctuating MXene flakes into films, which can be further compacted through breaking the repulsion between individual MXene sheets via adding HCl droplets [47]. As such, transparent MXene films are obtained (Fig. 2c, top panel), which exhibit a typical sheet resistance of 310 Ω/□ under an optical transmittance of 80%, despite apparent flake corners or junctions are visible according to the scanning electron microscopy (SEM, Fig. 2c, bottom panel) [47]. On the other hand, through tuning the pH of as-obtained MXene solution, followed by addition of EA, flexible, transparent MXene films (Fig. 2d) whose film thickness can be precisely adjusted through assembling different layers (Fig. 2e), are assembled at the water–air interface [103]. The assembling mechanism relies on two steps. First, the addition of EA creates a strong vertical Rayleigh-Bénard convection due to the endothermal evaporation of EA, the convection further delivers the suspended MXene flakes from the entire dispersion to the water–air interface. Second, the Marangoni effect derived from surface tension difference between water and EA, drive the floated MXene flakes into a densely packed film in a similar manner to that of pristine graphene films [102]. The two-step assembly mechanism is schematically illustrated in Fig. 2(f). For some occasions, strong yet flexible MXene fibers are more preferable compared to planar MXene films. To this end, engineering delaminated MXene flakes into highly conductive fibers is of significance. Through controlling the concentration of MXene colloidal dispersion, one can realize MXene liquid crystal (LC) phases that can be spun into strong and conductive fibers, holding great promises for flexible and wearable electronics [87,104–108]. Despite adding LC surfactant and single-walled carbon nanotubes (or graphene oxide [105]) lead to a “composited” MXene-based LC, with improved ion transport kinetics [108], these LC additives need to be removed in order to restore the pristine properties of MXenes, compromising the scalable feasibility. Importantly, by adjusting the aspect ratio as well as ink concentration, pure MXene nematic LC phase can be achieved [107]. Upon extruding aqueous MXene LC inks, the shear force lead to long-range orientational ordering of the delaminated flakes in the fine nozzle, which further result in pure MXene fibers after solidification in the coagulation bath, as schematically demonstrated in Fig. 2(g) (left panel). Coagulation rate is of importance during the MXene flakes assembly; a faster coagulation rate (i.e. acetic acid) resulted from the rapid solvent exchange leads to fibers with loosely packed nanosheets, while a slower coagulation rate (i.e. chitosan) leads to fibers with densely packed flakes, as demonstrated in Fig. 2(g) (right panel) [107]. Aside from the LC phase formation, the ratio of storage modulus to loss modulus (G′/G′′) can be used as the indicator for the spinnability of 2D LC colloidal dispersions [109]. Since MXene concentration governs the rheological properties of the delaminated solution [9,110] therefore, through tuning the concentration of colloidal MXene dispersions, one is able to achieve stable pure MXene fibers with strong gel strength. For instance, a lower concentration generally leads to a high G′/G′′ ratio, suggesting a weak gel strength that prevents the formation of stable MXene fibers. On the other hand, as the MXene concentration goes beyond 15 mg/mL, the G′/G′′ ratio reduces to 5.29, indicative of strong gel strength enabling successful spinning into pure MXene fibers with highly oriented, compacted nanosheets [111], as seen in Fig. 2(h). One needs to bear in mind that cations from the coagulation bath may greatly enhance the gelation of MXene fibers, due to the MXene surface is electronegatively charged. For instance, Han et al. suggested that the extruded MXene failed to form gel fibers without NH4 + in the coagulation bath [111]. Other hybrid fibers based on MXene-polymer (i.e. PEDOT [112]) [87], MXene-GO [112], MXene-CNT [113], and yarns based on MXene-cellulose [104,114], are also reported. 3.3 Interfacial grafting of MXenes 3.3.1 Physical grafting As mentioned before, the rich electronegatively charged groups on MXene surface enable plenty of opportunities to perform surface modifications. To this end, strategies on physical grafting the surface of MXenes are reported, relying on the physical ionic interaction between negatively charged MXene and positively charged species, such as CTAB [101]. Similarly, by direct mixing positively charged polystyrene (PS) with MXene dispersions, the nanosheets homogeneously wrap the PS spheres. By immersing in toluene, the PS spherical core are removed while the hydrophobic long chain is grafted to one side of MXene nanosheets, forming Janus MXene nanosheets that exhibiting both hydrophobicity and hydrophilicity [68]. These Janus MXene nanosheets (or so-called MXene surfactants) facilitate the interfacial assembly into microdroplets (which can be further processed into 3D MXene aerogel assisted by freeze-drying) or nanofilm at the liquid–liquid interface upon emulsification and aging, respectively (Fig. 3 a). In other words, interfacial assembly between two immiscible liquids (in this case, MXene aqueous solution and oil phase) allows the formation of functional building blocks and further mesoscale or even macroscale architectures (aerogels, films, etc.) at ease [67], opening vast opportunities for advanced membranes, electrodes, sensors, gas adsorption, and so on [115]. For instance, the oil-soluable amine-terminated polyhedral oligomeric sisesquioxane (POSS-NH2) is able to cooperative assemble with the negatively charged MXene surface, forming Janus MXene surfactant rapidly at the oil–water liquid–liquid interface and further developing into Janus MXene assembly when jammed [67]. Through further emulsification, Pickering emulsions are thus obtained, serving as template for hydrophobic, isotropic MXene aerogels (Fig. 3b) with excellent mechanical properties and electromagnetic interference shielding performances [16,67]. Reasons behind the interfacial assembling for the Janus MXene surfactants lie in the reduced interfacial tension induced by the POSS-NH2 from the oil phase and MXene from the aqueous phase, as evidenced in Fig. 3(c, top panel), sharing a similar kinetic model (bottom panel) of graphene oxide nanosheets and diblock copolymers [116,117]. Indeed, these jammed micro-droplets of MXene surfactant may function as structured liquids with arbitrary geometries, paving the road to three-dimensional (3D) printing of one liquid in another liquid, such as silicone oil or toluene [118–120]. By applying some external perturbation (i.e. mechanical force, moving the print head), interface area is increased, allowing additional MXene surfactants to populate at the newly formed interface. However, once the perturbation is removed, the whole system tends to minimize the surface area (or interfacial energy) through relaxation, yet is impeded by the jamming of MXene/n-butylamine (ligands) surfactants. As such, stabilized geometries consisted of MXene surfactants are obtained [120] (Fig. 3d). 3.3.2 Chemical grafting Beside the abovementioned physical grafting approaches, chemical grafting of MXene allows the preparation of organic dispersions at ease with much extended shelf life [86]. Typically, chemical condensation between hydroxyl groups of MXenes and alkoxy or chloro groups on alkylsilane (i.e. fluorinated or amine-terminated alkylsilanes [121–123]) is employed to chemically modify MXene surface in an alcohol or alcohol/water system. Considering the poor dispersion stability of MXene in alcohol, as well as the homocondensation of silane ligands in aqueous medium, one should choose a different ligand to give stable colloidal organic dispersion. For instance, by mixing MXene aqueous acidic solution with alkylphosphonic acid ligands dispersion, chemical condensation reactions occur at the liquid–liquid interface, leading to chemical grafting of the long hydrophobic tail to MXene nanosheets assisted by the formation of covalent TiOP bond [94] (Fig. 3e). Such chemically grafted MXene flakes are stable in organic dispersions in the absence of potential oxidation, and can serve as the building blocks for further assembling into macromonoliths in non-aqueous medium. Aside from chemical condensation to graft organic tails to MXene flakes, annealing of amines or other polymers is another way. For instance, Ti3C2T x MXene was decorated with −NH2 groups from annealing of allylamine [124]. These grafted groups endow significantly increased interfacial interaction between MXene flakes and common elastomers, such as nitrile butadiene rubber (NBR), through the formation of hydrogen and covalent bonding [124]. Likewise, poly(methyl methacrylate) (PMMA)-coated Si particles prefer to assemble with MXene nanosheets at the solid–solid interface due to the strong interfacial interaction between PMMA and MXene (Fig. 3f). Further annealing at 500 °C leads to the removal of PMMA and formation of SiOTi covalent bond that endowing Si nanoparticles with good mechanical stability [125]. Other methods, such as ball milling, are also capable to create new chemical bonds at the solid–solid interface [126,127]. 4 Interfacial assembly of MXene-based composites After discussing the assembly of pure MXenes in thorough, interfacial assembly of MXene-based composites also deserves to be paid attention, since MXene-enabled functional composites have already demonstrated splendid promising applications in various areas covering catalysis, energy storage and conversion, sensing, and wearable electronics and so on [8,11,13,97,128–131]. To differentiate “composites” formed in the pure MXene assembly since additional polymers or surfactants are required to assist the jamming of MXene flakes or formation of chemical bonds (see Section 3), here composites are defined as combination of key components (exclude ligands) acting a critical role toward specific application, and the amount of guest species is much higher compared to the amount of ligands required for pure MXene assembly. 4.1 Electrostatic assembly Electrostatic assembly is a powerful technique to realize “electrostatically layer-by-layer (ELBL)” assembly of two oppositely charged building blocks with an atomic precision at the nanoscale [132], serving as the main tool in manipulating thin films, coatings, clustering, colloids, capsules, supramolecules and others toward different applications [133–140]. In principle, electrostatic assembly relies on the alternative adsorption of the two building blocks through direct mixing procedure [132]. The main drawback of electrostatic assembly lies in the initial dilute mixing concentration to avoid potential interparticle bridging, which limits the yields of resultant precipitants [132]. Delaminated MXene nanosheets are predominantly single-layer, exposing a large surface area to guest species and thus being an ideal platform to proceed the electrostatic assembling. For those metallic MXenes, the thin lamellas function as conductive backbone, facilitating electron transport kinetics across the as-assembled multilayers. To achieve these multiscale MXene-based composites via the electrostatic assembly route, one needs to ensure the guest species are positively charged. This can be done either through surface modifications [141–143], such as cation surfactant coating [144], annealing amines to impart −NH2 groups [124,145]. or choosing species with intrinsic positive charges (such as graphitic-C3N4) [146]. Another big challenge is to disperse these guest species homogeneously in water, a process which may involve sonication despite the latter may change the size, thickness or even composition of the guest species. Polymers, in particular polystyrene (PSs) [147] and polymethyl methacrylate (PMMA) spheres [148], are frequently employed as the building blocks to perform the electrostatic assembly with MXene dispersions. This is because PSs (or PMMA) are positively charged due to the assist of cationic surfactant as stabilizer and comonomer during dispersion polymerization [149]. Upon mixing the two solutions, MXene flakes spontaneously wrap PSs or PMMA spheres, driven majorly by the electrostatic force as well as hydrogen bonding (due to surface hydroxyl groups) and van der Waals (vdWs) forces, and MXene-wrapped PSs or PMMA spheres (Fig. 4 a) are obtained [68,147,148]. It's worth noting that MXene content influences the architecture and assembly mechanism of hybrid spheres; a low amount of MXene nanosheets leads to a continuous assembly on the PS spheres primarily driven by the electrostatic forces, excessive nanosheets not only results in the neutralization of the surface charges of spheres electrostatically, but also initiates MXene self-assembly driven by the hydrogen bonds or vdWs forces, leading to PSs tightly covered by MXene interconnected network [147]. Using cation surfactant grafting method to impart positive charges to guest species (such as carbon nanotubes, CNTs, oxides) is an important step to proceed electrostatic assembling procedure. These surfactants include polyethyleneimine (PEI) [136], CTAB [150], poly(ethylene glycol), and others [101,144,151,152]. For instance, CNTs are grafted with CTAB surfactant, the latter endows positive charges on the hydrophobic CNTs (see the positive zeta potential in Fig. 4b, bottom left panel), rendering homogeneous aqueous dispersions (Fig. 4b, bottom right panel). Upon mixing two dispersions, CTAB-CNTs are attracted and grafted on the MXene flake surface, thereby the negative charges of MXene are screened and aggregations appear with clear supernatant is observed, indicative of successful electrostatic self-assembly [134]. Other composites, such as Fe3O4/C@MXene [153], amine-terminated Si/MXene [154], CTAB-CNT/MXene [150] or PEI-CNT/MXene [136], can be similarly fabricated as electrodes for Li-ion capacitors, Li-ion and Li-S batteries, respectively. The major disadvantages of physical grafting method on guest species are (1) one needs to remove these grafted polymers or surfactants, otherwise the conductivity of the composites would be greatly compromised, since these surfactants/polymers are large molecules impeding the electron transfer paths; and (2) realizing hybrids that are electrostatically assembled at atomic level is rather challenging. Solutions to issue 1 include but not limited to choose guest species that are intrinsically positively charged, such as graphitic C3N4 [146], layered double hydroxides, LDH [155–158], and the like [159]. Porous graphitic C3N4 exfoliated from bulk and protonated was reported to possess the zeta potential of 21 mV, serving an ideal building block to fabricate MXene-C3N4 heterostructures/interfacial Schottky junction (Fig. 4c) for various catalytic applications, including H2O2 production [146], hydrogen evolution [160], photocatalytic CO2 reduction [161]. On the other hand, LDHs intrinsically contain positively charged metal hydroxide host layers, rendering the electrostatic assembly quite favorable with intrinsically negatively charged MXene flakes. Exfoliated edge-rich CoAl-LDH/MXene heterostructure (Fig. 4d) [162], and CoMo-LDH/MXene hybrids [163] were reported, demonstrating a strong feasibility in fabricating multiscale functional composites with excellent applications. Solution to issue 2 includes using positively charged, yet small molecules, i.e. tris(2-aminoethyl) amine (TAEA), to assemble with MXenes. Such a process allows the assembly at atomic level (interlayer spacing expands by only 1 Å) with quasi-intimate small gap, thus the composites are compact, ordered and highly conductive (conductivity up to 730 S/cm) [164]. It's worth noting that the fine tuning of d-spacing enabled by TAEA molecules ensures strong interconnections among flakes, the slightly expanded interlayer spacing still improves the ion diffusion kinetics for enhanced energy storage properties [164]. 4.2 Heterogeneous assembly On the other hand, the rich surface chemistry of MXene suggests plenty of wet-chemistry choices to perform interfacial engineering, achieving efficient heterogeneous assembly with various multiscale architectures. These nanostructures include 0D/2D [97,165,166], 1D/2D [128], 2D/2D/0D heterostructures [167] and other combinations. Indeed, the surface groups on MXenes facilitate the heterogeneous nucleation of guest species, achieving the in-situ growth of guest species (ranging from 0D quantum dots to 3D structures) that strongly attach to the 2D MXene platform through either electrostatic force or interfacial bonds [165] or covalent bonds [94], and forming so-called hierarchical heterostructures. For instance, cations such as Ni2+ and Fe3+ prefer to attach to MXene nanosheets due to the strong interfacial interaction with polar −OH groups. Further hydrolysis and olation/oxolation of MO6 (M = Fe, Ni) units enable the in-situ growth of 2D NiFe-LDH/MXene hybrids (as shown in Fig. 5 a) [156]. Actually, similar LDH/MXene heterosturctures can be similarly assembled using this route [162]. The heterogeneous nucleation method can also be extended to other oxides, assembling into transition metal oxides/MXene hybrids such as SnO2/MXene, at the liquid–solid interface [97]. Furthermore, methods of tuning MXene surface chemistry have also been reported either through Lewis acidic molten salt etching to enrich the surface groups (−Cl, −Br, −I) [26,168] or completely remove these surface moistures [50], suggesting a large room for heterogeneous assembly of MXene-based composites. Typically, heterogeneous assembly requires a hydrothermal treatment of the blend suspension of MXenes-precursor of guest species in order to accelerate the nucleation/growth stage of the latter. However, under the hydrothermal condition, MXene nanosheets tends to be decayed due to the attack of water and dissolved oxygen [64]. To address this issue during heterogeneous assembly, one needs to cap the edge/basal planes of delaminated MXene flakes either through covering a layer of oxides [97], or carbon [98], or polymer [169] that proceed with a faster reaction kinetics compared to that of MXene oxidation under the same hydrothermal condition. For instance, Zhang et al. confirmed that the well coverage of in-situ nucleated SnO2 seeds on MXene nanosheets is the reason for the preservation of the conductive backbone from oxidation after hydrothermal reaction at 120 °C [97]. Based on this strategy, a broad range of MXene-based heterostructures with good electron and ion transport pathways can be similarly assembled for energy storage, catalysis, sensing etc., with state-of-the-art performance. Another good example is by formation of interfacial bonds between black phosphorous quantum dots and MXene nanosheets. The as-formed POTi interfacial bonds greatly assist interfacial electron transfer and interfacial structural stability of the composite [165], showcasing excellent electrochemical performance for Li-ion and Na-ion storage. When solution mixing MXene aqueous dispersions with guest molecules (in particular biomass, surfactant, resins, block copolymers, etc.), hydrogen bonds are typically formed between MXene nanosheets and guest molecules coupled with electrostatic interactions to reduce the total surface free energy. Therefore, through subsequent treatments (i.e. hydrothermal, polymerization, carbonization), one is able to convert these pre-assembled superstructures to carbon-coated MXenes (as shown in Fig. 5b) [169]. It's worth noting that the plated carbon well protects the MXene surface from oxidation under hydrothermal or annealing at high temperature, thus can serve as a 2D platform for further growth of multiscale heterostructures based on carbon-plated MXenes. In particular, Wang and Qiu et al. reported hierarchical MoS2/carbon-plated MXene heterostructures via the heterogeneous assembly of in-situ converted MoS2 (from the reaction of molybdate tetrahydrate with thiourea) onto MXene (Fig. 5c). The nanoplated carbon function as a thin layer of protective membrane for MXenes from being oxidized at hydrothermally reacting at 160 °C, and a “glue” for MoS2 such that heterostructures are formed with good electron transfer kinetics and mechanical stability [98]. This novel carbon nanoplating route for extending the stability of MXene flakes suggests limitless choices for heterogeneous growth of other guest species (i.e. MoSe2 [170]) on MXenes with good electron/ion transport kinetics and excellent interfacial binding interactions. Actually, the selective, mild oxidation of layered MXene lamellas also creates hierarchical MXene-oxides heterostructures in-situ [171,172]. For instance, annealing multilayered Nb4C3T x and Ti3C2T x MXenes in CO2 flow lead to the formation of Nb2O5/carbon@Nb2CT x and TiO2/carbon@Ti3C2T x heterostructures, respectively [96]. These oxides locate at the external of the heterostructures, which are strongly attached to the unoxidized multilayered MXenes core through the carbon “glue” [95,96]. Since the oxides are grown from the pristine MXene at the solid-air interface, therefore, good electrical conductivity is maintained and strong adhesion at the oxides/MXenes junctions are expected, ensuring excellent performances in batteries [95,171], catalysis [173], microwave absorption [174], and other applications [175]. Aside hydrogen bonding, covalent interaction is another route to proceed the heterogeneous assembly of MXene-based composites. Through harnessing the interlayer spacing of MXene lamellas, S can be covalently intercalated into pretreated MXenes, forming Ti − S covalent bonds in the interface [176]. On the other hand, MXene nanosheets can be employed to functionalize graphene oxide (GO) platelets based on the TiOC covalent bonds, resulting in more aligned and compact graphene sheets with enhanced mechanical toughness [177]. These two examples clearly indicate that, utilizing the interfacial covalent bonding between MXene sheets and other guest species, synergistic effects such as improved electrical, mechanical and electrochemical properties are anticipated in the as-assembled MXene-based heterostructures. Despite these abovementioned strategies in fabrication of MXene-based hybrids, assembling heterostructures still inevitably involve high temperature and/or pressure. While pristine structures of Ti3C2T x MXene may be persevered under the harsh conditions, other MXenes (in particular, Ti3CNT x , V2CT x , Ti2CT x , etc.) may not survive upon hydrothermal/annealing treatments. To this end, initiating the heterogeneous assembly under ambient conditions is of great significance. Xu and Gogotsi et al. have shown that by minimizing the high surface energy of MXene flakes using oxides (such as TiO2, SnO2) in MXene's poor solvent (i.e. tetrahydrofuran, THF), the poor dispersibility of MXene flakes can be greatly addressed, forming micelle-like TMO-MXene heterostructures spontaneously via vdWs interactions (Fig. 5d) [178]. Such a vdWs route driven by the surface tension at the interface to the assembly of MXene-based heterostructures is general, and effective in growth of other 2D materials (i.e. GO [179], MoS2 [180], hexagonal boron nitride, h-BN [181]), holding great promising in low-cost synthesis of advanced heterostructures at room temperature. 4.3 Crosslinking assembly and gelation Compared to planar compact MXene-based films and structures, three-dimensional (3D) architectures assembled from 2D nanosheets possess apparent advantages, such as more developed porosity, readily exposed active sites, lightweight nature, and improved ion diffusion kinetics. In addition, the fabricated 3D monolith well preserves the structural, electrical and electrochemical properties of its 2D nanosheets. As such, constructing 3D macroassemblies based on 2D nanosheets is of significance. This is especially true for the formation of MXene-based 3D aerogels/monoliths, as MXenes have already demonstrated a huge potential in ultralight electromagnetic interference shielding [103,182–184], wireless communication [19–21], and other cutting-edge technologies that prefer lightweight materials without compromising the key features substantially. Nevertheless, the as-assembled MXene 3D aerogels, if not challenging in preparation, are typically brittle and fragile (tensile strength of a MXene film was reported as 20 MPa [185], much lower than that of a graphene film) that they can't withstand too much stress. This is because the intrinsic interaction of MXene nanosheets is weak, leading to a low tensile strength [129]. Moreover, the as-prepared MXenes (etched from LiF + HCl route) typically contain Li+ even after repeated washing [74]. Pristine MXene 3D aerogels encounter the structural swollen and further disassembly issues if they are placed in deionized H2O, due to the ion exchange of the as-intercalated Li+ with water molecules [186]. As such, improving the structural stability of the preassemblies is of paramount importance for the realization of MXene-based 3D macroassemblies (monoliths/aerogels). One solution is to stabilize the preassemblies' microstructure by tuning the intercalation chemistry of MXenes [73,187]. To this end, Li et al. exchanged the intercalated Li+ with hydrated protons via thawing the unidirectional MXene/ice hydrogel in protic acids (HCl, HBr, H2SO4, etc.), leading to pure MXene hydrogel matrix with significantly suppressed hydration [186]. Interestingly, without the acid thawing, the pre-assembly get solvated and redispersed into solution thus no 3D matrix is formed (Fig. 6 a). This can be explained that the removal of Li+ prevents the intercalation of H2O, a process energetically favored by the presence of Li+ with a large hydration enthalpy [186,187]. Another strategy is to initiate crosslinking by choosing guest species as gelation agents. The anisotropic intersheet crosslinking effect renders the formation of MXene-based hydrogel pretty challenging, due to the super hydrophilic nature of this wonder 2D materials [188]. Graphene oxide is a perfect gelation agent for MXenes, since it possesses inherent flexibility and is able to neutralize the rigidity of the MXene flakes [71], thus has been widely employed to initiate the macroscopic assembly to give graphene-MXene hybrid aerogels [70,188,189]. A typical crosslinking process is shown in Fig. 6(b), where GO interact with MXene sheets at sites of oxygen dangling bonds, forming MXene hydrogels [71]. During crosslinking, a GO reductant (such as ethylenediamine, EDA [71], and ascorbic acid [17]) is required. Selection of the reductant poses a significant influence on the macroscopic assembly. Reductants with ring-opening of epoxy groups are able to crosslinking with GO layers via nucleophilic reactions to form oxygen dangling bonds [190,191]. Too strong (such as NaBH4) or too weak (i.e. KOH) reductants lead to excessive or inadequate reduction and thus no MXene-rGO hydrogel is formed. Moreover, the reductant should provide crosslinking sites for both MXene flakes and partially reduced GO, based on which the assembly of MXene flakes are driven by the vdWs force and supported with rGO nanosheets through the π–π interaction, as shown in Fig. 6(c) [71]. Inappropriate reductants would either lead to oxidation of MXene or formation of rGO hydrogel. It's worth mentioning that the as-assembled hydrogel is consisted of randomly distributed MXene nanosheets [71,72]. For applications (such as electromagnetic interference shielding) that preferring ordered porous channels, engineering the alignment of nanosheets becomes crucial. To this end, directional freezing of as-assembled hydrogel has proven effective in producing unidirectional aerogels [129,192]. Such a strategy relies on the growth of ice cylinders, which expel the rGO and MXene sheets to the external surface, and compel them to assemble among the vertical ice cylinders (shown in Fig. 6d) [17]. Following the removal of ice template via freeze-drying, MXene-based aerogels with ordered slit channels, and a honeycomb-lattice morphology is obtained (Fig. 6d and e) [17,129]. On the other hand, by employing polar chains obtained through interfacial polymerization, the tensile strength of as-fabricated MXene-based aerogels can be dramatically enhanced. For instance, annealing poly(amic acid) (PAA) initiates the polymerization of PAA, forming polyimides macromolecules that strongly covering on the MXene nanosheets surface through interfacial bonding (Fig. 6f). The coupling between PI chains and surface groups of MXene nanosheets results in hybrid aerogel with outstanding mechanical properties, in particular reversible compressibility with large strain up to 80% [193]. The weak gelation of MXene nanosheets in pure, pristine MXene aerogels can also be much improved through introducing strong hydrogen bonds between −OH/−O groups on MXene flakes and abundant −OH/−COOH groups on sodium alginate (SA). By optimizing the composition and further coating a polydimethylsiloxane (PDMS) layer, 3D hybrid MXene-SA aerogels with excellent electrical conductivity (up to 20 S/cm), compressibility and durability are thus achieved (Fig. 6g) [194]. Aside from GO, polymers [93,195] and biomass (such as nanocellulose [129]) to initiate crosslinking, metal cations can also be used to trigger the gelation of MXene nanosheets, similar as metal ion-induced solid–liquid interfacial assembly of graphene oxide [196]. Divalent metal ions, i.e. Fe2+, are able to destroy the electrostatic repulsion force among MXene nanosheets (step 1) and further crosslink the nanosheets into 3D network by forming FeO bonds (step 2), as seen in Fig. 7 (a and b) [70]. Other metal cations are also able to initiate the gelation of MXene flakes (Fig. 7c), with divalent metal ions (i.e. Mg2+, Co2+, Ni2+, etc.) being the most preferable. This is because that univalent K+ ions possesses poor hydration energy and leads to coagulation upon mixing (Fig. 7c), while trivalent metal ions (such as Al3+, Fe3+, Co3+) inevitably leads to fast destroy of the repulsion force, indicative of aggregation of MXene nanosheets, coupled with potential risks of MXene oxidation [70]. The concentration of MXene dispersion also matters when comes to the formation of MXene hydrogel mediated by metal ions. Another model to assemble MXene hydrogel, and further aerogel (through freeze-drying) is through so-called ion-diffusion-induced strategy, which typically requires a piece of metal foil, such as Zn foil. Such a process is similar to the preparation of large-area rGO paper on the Zn foil surface [196]. The key to the gelation of MXene and/or GO nanosheets is the ionization of Zn in the acidic solution, forming Zn2+ and increasing the ionic strength of the local dispersion near the substrate [197]. Thereby, negatively charged MXene and/or GO nanosheets start to aggregate underneath the substrate, while at the same time GO is partially reduced into rGO by accepting electrons from Zn, forming a MXene-rGO hydrogel and further a robust aerogel (Fig. 7d and e) [183]. The pore size and thickness of the aerogel are governed by pH value of the initial suspension and gelation time, respectively. According to the Zn K-edge X-ray absorption spectroscopy (XAS), intense signal belonging to ZnO bonds are observed (Fig. 7f), suggesting Zn2+ as gelation sites coordinating with oxygen atoms from MXene and GO, similar to that of the metal ion-induced assembly mechanism stated above [70,183,194]. Other metal foils such as Al, Co, Fe and Ni foils, etc., are also able to initiate the interfacial assembly of MXene and/or GO nanosheets in the acidic solution, forming macroscopic architectures with exotic properties. Such a metal ion-diffusion-induced strategy is also capable to scalable produce large-area, robust MXene-based hybrid aerogel (Fig. 7g). 5 Applications of assembled MXene architectures After interfacial assembly, the as-obtained MXene architectures typically preserves the intrinsic properties of MXene flakes, i.e. electronic/ionic conductivity, mechanical strength, polar surface, etc. suggesting promising applications in different fields (Fig. 8 ). This is especially true when applying the MXene assemblies in fields such as transparent conductive electrodes, energy storage, electromagnetic interference shielding, environmental protection (water treatment) [198–202]. 5.1 Transparent conductive electrodes (TCE) Transparent conductive electrodes are important components for electronics. Ideal TCEs should exhibit both high optical transmittance (T) and low sheet resistance (R s). The figure of merit (FoMe), defined as the ratio of DC conductivity to optical conductivity, is generally accepted to evaluate the optoelectronic properties of the film; a higher value of FoMe indicates films are more conductive at a given thickness. 1D CNT and 2D graphene or rGO are employed as TCEs for specific applications, however, the FoMe of pristine graphene is typically limit below 0.5 [44,203]. Doped graphene may exhibits quite high FoMe that is comparable to indium tin oxide (ITO), yet involving complicated procedures [204]. MXene on the other hand, possesses extremely high electronic conductivity (up to 15,100 S/cm [38]). In addition, transmittance of single-layer MXene nanosheets is as high as 97%, which is even more transparent compared to graphene at a given film thickness, since single-layer graphene (thickness of graphene is 4 times higher than that of MXene single layer) results in 3% loss in transmittance [43,205,206]. These unique properties render MXenes quite promising in applications such as touch panels, flexible displays, sensors. For instance, the self-assembled film reported by Kim et al. displayed a low sheet resistance of 310 Ω/□ at a thickness of 10 nm, corresponding to a conductivity of 3260 S/cm [47]. The lower conductivity of interfacial-assembled MXene films compared to that of spin-casted MXene film (DC conductivity up to 10,000 S/cm, FoMe up to 15) can be attributed to the relatively loose compact of nanosheets in the former [43,46]. Koo et al. found that when assembled into monolayer MXene film, the transmittance was 90% and R s was 1500 S/cm, which gradually decreases with increasing the stacking number. Importantly, the sheet resistance of as-assembled MXene films drops dramatically upon thermal annealing at 400 °C [103], due to the decreased interlayer spacing (rendering improved contacts among interlayers) coupled with the removal of water molecules. By sieving the particle size and/or optimizing the composition of MAX precursor, ultrathin films self-assembled from delaminated MXene flakes may exhibit even more outstanding optoelectronic properties. Needless to say that interfacial assembly of transparent MXene films holds a great promise for high-end applications, if these films can be assembled at a large scale. 5.2 Electrochemical energy storage (EES) 5.2.1 Supercapacitors One of the important properties for MXenes is their extraordinary performance in electrochemical energy storage, EES, in particular supercapacitors and rechargeable batteries [9,36,84,108,131,207,208]. This is because of the metallic conductivity as well as hydrophilic groups in the single-layer nanosheets, enabling continuous valance change of the M atomic layer thus leading to high pseudocapacitance, both gravimetrically and volumetrically [6,208–212]. However, the vdWs forces lead to severe restack of MXene nanosheets, which strongly affects the ion diffusion paths and further reduces the capacitance. To this end, engineering vertically-aligned MXene nanosheets has proven effective in addressing the sluggish ion diffusion kinetics [108]. Through the assistance of surfactant and sequent mechanical shear, MXene nanosheets are assembled (with surfactant via hydrogen bonding, Fig. 9 a) and highly aligned, forming liquid crystal film with the director being perpendicular to the shear direction (Fig. 9a). As such, directional ion diffusion paths (Fig. 9b) are created in the MXLLC, ensuring excellent capacitance at high charging rate (200 F/g at 2 V/s, Fig. 9c) that is independent with electrode thickness within the range of 200 μm [108]. The self-assembled MXene architecture with vertical alignment of nanosheets suggests fascinating applications in fields beyond EES, including filtration, fuel cells, catalysis. This also implies that the precise manipulation of directional assembly of functional materials like MXenes offers plenty of opportunities to build advanced nanostructures with exceptional performances [108]. Nevertheless, reports and strategies on the directional alignment of MXene assemblies need to be more investigated, as evidenced by the quick capacitance (or capacity) decay as ramping the charging rate. Other MXene-based assemblies also displayed outstanding capacitance and rate handling properties. For instance, MXene hydrogels provides rapid ion transport and excellent electronic conductivity, resulting in high volumetric capacitance up to 1500 F/cm3 [213]. MXene macroporous electrode (25 μm) produced via electrostatic assembly assisted by spherical templates, on the other hand, exhibited 280 F/g at 1 V/s and maintained 120 F/g at 10 V/s, which can be attributed to the developed porous channels to facilitate the rapid ion transport, as evidenced by the much reduced ion transport resistance compared to that of MXene hydrogels or vacuum-filtrated compact papers [213]. In other words, due to their pseudocapacitive site on the nanosheets surface, interfacial-assembled MXene or MXene-based architectures are promising supercapacitor electrodes, whose rate performance can be enhanced through pillaring effect [130,214,215], intercalants [73,164], or porosity engineering [70,71,216,217]. 5.2.2 Rechargeable batteries Aside from supercapacitor, the as-assembled MXene architectures also exhibit promising applications in rechargeable batteries (Li+, Na+, K+, etc.). The unique 2D sheets morphology coupled with outstanding electronic conductivity and mechanical properties endow MXene assemblies as high-performance electrode materials, or as 3D matrix/host for the guest species. For instance, the heterogeneous nucleated SnO2 seeds on MXene nanosheets effectively suppress the restack of MXenes while opening more favorable ion diffusion paths, resulting in high capacity (1021 mAh/g) when employing the SnO2 QDs/MXene assemblies as Li-ion battery anode [97]. On the other hand, the 3D macroporous V2CT x MXene film possess developed voids which greatly facilitate Na+ diffusion (Fig. 9d), best evidenced by the nondiffusion limited and pseudocapacitive mechanism when storing Na+ [148]. The electrode showcased 340 mAh/g at 0.25C (4 h to complete charging), maintained 310 mAh/g at 2.5 C after 1000 cycles and retained 170 mAh/g at 25C (2.4 min of charging time), implying excellent Na ion storage capacity benefited from the unique architecture design as well as broaden initial interlayer spacing [148]. Employing other low-dimensional nanomaterials (such as 0D quantum dots [69,165], 1D nanotubes [134], nanorodes and nanowires [178]) to enlarge the interlayer spacing in the resultant MXene-based assemblies is just another route to boost their metal ion (Li+, Na+, K+, etc.) storage performance (including capacity, rate, cycling and resistance). For instance, SnO2 QDs, which possess a high theoretical Li-ion storage capacity, exhibit excellent capacity up to 890 mAh/g coupled with stable cycling performance achieved in the interfacial-assembled composites [69,97]. CNTs are also effective in turning the sluggish Na+ transport kinetics, which has been confirmed in stacked MXene nanosheets [218,219], into non-diffusion limited, pseudocapacitive behavior (Fig. 9e) when comes to store Na+ in the electrostatic-assembled CNT-MXene heterostructure [134]. Despite the extensive studies on MXene assemblies for rechargeable battery applications, several challenges still deserve to be paid attention. These challenges include but not limited to: (1) Engineering more ion-favorable channels in the MXene-based assemblies at a low-cost, straightforward route without losing the electronic conductivity dramatically has proven quite difficult; (2) precisely controlling the MXene nanosheet stacking behavior such that both electronic and ionic conductivity in the assemblies are well balanced is still quite challenging; (3) scalability and compatibility of the assembly process with standard battery electrode fabrication procedures should be evaluated; (4) stability of the resultant MXene-based architectures should be emphasized. Electrochemical tests of both fresh, as-assembled MXene-based composites and aged ones in ambient condition should be performed and compared in order to ensure reasonable results interpretation. Besides, interfacial-assembled MXene structures should be prepared via routes with low-carbon emission. 5.3 Electromagnetic interference shielding (EMI) Another important application for the MXene assemblies is electromagnetic interference shielding (EMI). Vacuum-filtrated MXene films have shown excellent EMI shielding performance due to their metallic conductivity, surface reflection, bulk reflection and multiple internal reflections among the interlayers [182,184]. However, filtrated MXene films are typically compact, rendering the maximum usage of interlayers rather challenging. In this sense, MXene-assemblies may exhibit improved EMI shielding performance by enlarging interlayer spacing [103,220], constructing ultralight aerogels [17,129,183,221], and/or creating more sites for multiple internal reflections [17,147]. Koo et al. performed pioneering works on MXene for EMI shielding applications [182,184]. Recently, they confirmed that monolayer MXene assembled film offers ~20% shielding effectiveness of incident EM waves, whereas assembled, semi-transparent MXene film (55 nm in thickness) demonstrates a shielding effectiveness (SE) of 20 dB, corresponding to 99% of incident EM waves are shielded [103]. This is the first report on transparent EMI shielding materials that possess such a high SSE/t (specific SE normalized to film thickness), surpassing all other nanomaterials including nanoscale metals such as beam-evaporated Au (Fig. 9f) [103]. For these electrically thin MXene films (thickness below skin depth, calculated to be 7.86 μm for a MXene film with electrical conductivity of 5000 S/cm), absorption of incident EM waves dominates the shielding behavior, which can be well explained using the transfer matrix method [103,182]. Increasing the thickness of the as-assembled MXene structures generally results in the improvement of SE. For instance, MXene-GO assembled films demonstrated EMI SE of 50.2 dB at a thickness of 7 μm, and increased to 53.5 dB as increasing the thickness to 12 μm [220]. On the other hand, since the absorption mechanism majorly dominates the EM waves shielding behavior, one can realize enhanced EMI SE through creating more sites for EM waves absorption, such as 3D architectures, foams, aerogels. 3D MXene-sodium alginate (SA) aerogels, which possess strong hydrogen bonds such that the aerogels are capable to withstand compressions, exhibit a high EMI SE of 70 dB when MXene content is 95%. This indicates that 99.99999% of incident EM waves are shielded when passing through the MX-SA foams [194]. Other interfacial-assembled structures, such as MXene-polystyrene [147], MXene-rGO aerogels [17] which showcased a maximum of 62 dB (adding 1.9 vol% of Ti3C2T x MXene to PS) and 50 dB (adding 0.74 vol% to GO), respectively. Especially, the MXene-nanocellulose aerogels assembled through hydrogen bonding and fabricated via unidirectional freeze-drying strategy demonstrated an ultralow density down to 1.5 mg/cm3 and a highest EMI SE of 74.6 dB [129]. This corresponds to a normalized surface specific SE (SSE/t) of 189400 dB cm2/g, which significantly surpassing that of other EMI shielding materials or structures reported so far (Fig. 9g) [16,129]. Table 1 summarizes various interfacial assembled MXene-based architectures (including interfaces and assembly routes) and their corresponding potential applications. In general, assembly technique literally determines potential applications. Interfacial assembled pure MXene films are typically compact and transparent, therefore are especially suitable for transparent conductive films, transparent energy storage and other fields that requiring ultrathin conductive films with excellent volumetric performance. For instances, films assembled at the liquid–air interfaces driven by the Marangoni effect are conductive yet transparent, rendering promising applications such as transparent conductive coatings. On the other hand, the applications of interfacial assembled MXene-based composites depend on both techniques and the assembled interfaces. For instances, grafting (both physically and chemically)-induced electrostatic assembly of MXene-based composites are particularly suitable for energy storage, while cross-linking induced assemblies are ideal for mechanical reinforcement, gelation induced MXene-based composites are quite promising for electromagnetic interference shielding, to name just a few. 6 Summary and perspectives To summarize, here in this review, MXene-based architectures assembled at various interfaces, including liquid–air, liquid–liquid, liquid–solid, solid–solid and solid-air, are discussed in detail. Pure MXene assemblies well preserve the pristine properties of MXene nanosheets, and are especially promising for applications such as transparent conductive electrodes, EMI shielding, as well as transparent energy storage devices. For pure MXene assembling, one needs to overcome the electrostatic force among the nanosheets, either through lowering down the interfacial tension, or creating Rayleigh-Bénard convection to proceed the nanosheets self-assembly. For MXene-based composites, the fabrication is majorly relied on the unique surface chemistry of MXene, that is, electronegative polar groups like –OH, –O, –F. These groups electrostatically attract the guest species, or facilitate the heterogeneous nucleation, or initiate gelation which results in crosslinking of the nanosheets. Consequently, 2D hybrid films, 2D macroassemblies with micro 3D structures, and 3D aerogels are achieved. These multiscale architectures may find plenty of applications ranging from electrochemical energy storage to sensing, catalysis, environmental protection, EMI shielding and so on. Interfacial assembly of pure MXene films is the most straightforward route to realize compact, transparent, conductive coatings, thus are quite promising for transparent conductive electrodes, transparent energy storage, and transparent EMI shielding applications. However, due to the nanometer scale thickness, these as-assembled films tend to degrade in the ambient environment. Methods to protect the as-assembled films from oxidation need to be developed without sacrificing the transparency and conductivity. On the other hand, interfacial-assembled MXene based composites, ranging from grafting, electrostatic assembling to crosslinking and gelation are especially suitable for constructing thick electrodes or even 3D macrostructures, such as aerogels. These MXene architectures possess excellent charge storage performance and EMI shielding effectiveness. Nevertheless, the assembling process is more sophisticated, and the electronic conductivity of as-assembled composites is much lower, limiting their applications in fields that preferring high electrical conductivity. Despite the progresses on MXene assemblies achieved so far, there is still much room to further improve the rational design of assembled MXene architectures. First, understanding how surface chemistries precisely control the assembling behavior between MXene nanosheets and guest species. In particular, replacing–OH groups with other terminations (i.e. −Cl, −Br, −I, etc.) change the density of surface charges accordingly. Unraveling such changes and further investigating their influences on the assembling behaviors, are of paramount importance. Second, engineering the porous channels during assembling is still quite challenging. Despite the unidirectional freeze-drying method is effective, the pores are rather macroporous with the pore diameter up to 50 μm [129]. For applications that favoring a high specific surface area, i.e. energy storage, EMI shielding, assemblies with fine micro-mesoporous channels and thin walls are preferred. Thus, strategies are aiming to prepare such kind of MXene assemblies. Third, stability of as-assembled films has been largely unexplored. It's necessary to evaluate the stability of MXene assemblies, especially those assembled at the water interfaces. Thus for assemblies proceeded at water-containing interfaces, it's significant to determine whether water molecules are intercalated, as water molecules oxidize MXenes; methods to remove these oxidants should also be developed. Besides, thermal stability of the as-assembled MXene structures should be performed. Finally, for MXene-based assemblies aiming to real applications, large-scale interfacial assembly should be facilitated. This not only requires scalable production of MXene stable colloidal solutions, but also demands for scalable, advanced assembling techniques. It's also important to point that, despite MXene possess exotic properties in electrical, mechanical, electrochemical, electromagnetic fields, however, how to translate their unique properties into real devices with state-of-the-art performance is another story. To this end, more efforts are needed in fabrication of functional devices enabled by novel interfacial assembled MXenes. It goes without saying that these MXene assemblies will trigger broad applications. Declaration of Competing Interest The authors declare that they have no known competing financial interests or personal relationships that could have appeared to influence the work reported in this paper. Acknowledgments The author wants to thank Sina Abdolhosseinzadeh for his assistances on figure plots. The author also wants to thank the supports from ETH board, and grants from Empa, ETH Domain, for the internal research call 2018 and 2020 (IRC 2018 and IRC 2020-NitFixMXene). References [1] M. Naguib O. Mashtalir J. Carle V. Presser J. Lu L. Hultman Y. Gogotsi M.W. Barsoum ACS Nano 6 2012 1322 1331 M. Naguib, O. Mashtalir, J. Carle, V. Presser, J. Lu, L. Hultman, Y. Gogotsi, M.W. Barsoum, ACS Nano 6 (2012) 1322–31. [2] M. Naguib J. Come B. Dyatkin V. Presser P.-L. Taberna P. Simon M.W. Barsoum Y. Gogotsi Electrochem. Commun. 16 2012 61 64 M. Naguib, J. Come, B. Dyatkin, V. Presser, P.-L. Taberna, P. Simon, M.W. Barsoum, Y. Gogotsi, Electrochem. Commun. 16 (2012) 61–64. [3] M. Naguib V.N. Mochalin M.W. Barsoum Y. Gogotsi Adv. Mater. 26 2014 992 1005 M. Naguib, V.N. Mochalin, M.W. Barsoum, Y. Gogotsi, Adv. Mater. 26 (2014) 992–1005. [4] M. Naguib M. Kurtoglu V. Presser J. Lu J. Niu M. Heon L. Hultman Y. Gogotsi M.W. Barsoum Adv. Mater. 23 2011 4248 4253 M. Naguib, M. Kurtoglu, V. Presser, J. Lu, J. Niu, M. Heon, L. Hultman, Y. Gogotsi, M.W. Barsoum, Adv. Mater. 23 (2011) 4248–53. [5] M. Naguib J. Halim J. Lu K.M. Cook L. Hultman Y. Gogotsi M.W. Barsoum J. Am. Chem. Soc. 135 2013 15966 15969 M. Naguib, J. Halim, J. Lu, K.M. Cook, L. Hultman, Y. Gogotsi, M.W. Barsoum, J. Am. Chem. Soc. 135 (2013) 15966–15969. [6] M. Ghidiu M.R. Lukatskaya M.-Q. Zhao Y. Gogotsi M.W. Barsoum Nature 516 2014 78 81 M. Ghidiu, M.R. Lukatskaya, M.-Q. Zhao, Y. Gogotsi, M.W. Barsoum, Nature 516 (2014) 78–81. [7] H. Shi M. Yue C.J. Zhang Y. Dong P. Lu S. Zheng H. Huang J. Chen P. Wen Z. Xu Q. Zheng X. Li Y. Yu Z.-S. Wu ACS Nano 14 2020 8678 8688 H. Shi, M. Yue, C.J. Zhang, Y. Dong, P. Lu, S. Zheng, H. Huang, J. Chen, P. Wen, Z. Xu, Q. Zheng, X. Li, Y. Yu, Z.-S. Wu, ACS Nano 14 (2020) 8678–8688. [8] C. (John) Zhang Y. Ma X. Zhang S. Abdolhosseinzadeh H. Sheng W. Lan A. Pakdel J. Heier F. Nüesch Energy Environ. Mater. 3 2020 29 55 C. (John) Zhang, Y. Ma, X. Zhang, S. Abdolhosseinzadeh, H. Sheng, W. Lan, A. Pakdel, J. Heier, F. Nüesch, ENERGY Environ. Mater. 3 (2020) 29–55 [9] S. Abdolhosseinzadeh J. Heier C. Zhang J. Phys. Energy 2 2020 31004 S. Abdolhosseinzadeh, J. Heier, C. Zhang, J. Phys. Energy 2 (2020) 31004. [10] X. Tang X. Guo W. Wu G. Wang Adv. Energy Mater. 8 2018 1801897 X. Tang, X. Guo, W. Wu, G. Wang, Adv. Energy Mater. 8 (2018) 1801897. [11] C. (John) Zhang, L. Cui, S. Abdolhosseinzadeh, J. Heier, InfoMat 2 (2020) 613–638. [12] H. Tang W. Li L. Pan K. Tu F. Du T. Qiu J. Yang C.P. Cullen N. McEvoy C.(John) Zhang Adv. Funct. Mater. 29 2019 1901907 H. Tang, W. Li, L. Pan, K. Tu, F. Du, T. Qiu, J. Yang, C.P. Cullen, N. McEvoy, C. (John) Zhang, Adv. Funct. Mater. 29 (2019) 1901907. [13] H. Tang W. Li L. Pan C.P. Cullen Y. Liu A. Pakdel D. Long J. Yang N. McEvoy G.S. Duesberg V. Nicolosi C.J. Zhang Adv. Sci. 4 2018 1800502 H. Tang, W. Li, L. Pan, C.P. Cullen, Y. Liu, A. Pakdel, D. Long, J. Yang, N. McEvoy, G.S. Duesberg, V. Nicolosi, C.J. Zhang, Adv. Sci. 4 (2018) 1800502. [14] F. Du H. Tang L. Pan T. Zhang H. Lu J. Xiong J. Yang C.(John) Zhang Electrochim. Acta 235 2017 690 699 F. Du, H. Tang, L. Pan, T. Zhang, H. Lu, J. Xiong, J. Yang, C. (John) Zhang, Electrochim. Acta 235 (2017) 690–699. [15] W. Bao X. Tang X. Guo S. Choi C. Wang Y. Gogotsi G. Wang Joule 2 2018 778 787 W. Bao, X. Tang, X. Guo, S. Choi, C. Wang, Y. Gogotsi, G. Wang, Joule 2 (2018) 778–787. [16] J. Liu H. Bin Zhang R. Sun Y. Liu Z. Liu A. Zhou Z.Z. Yu Adv. Mater. 29 2017 1702367 J. Liu, H. Bin Zhang, R. Sun, Y. Liu, Z. Liu, A. Zhou, Z.Z. Yu, Adv. Mater. 29 (2017) 1702367. [17] S. Zhao H. Bin Zhang J.Q. Luo Q.W. Wang B. Xu S. Hong Z.Z. Yu ACS Nano 12 2018 11193 11202 S. Zhao, H. Bin Zhang, J.Q. Luo, Q.W. Wang, B. Xu, S. Hong, Z.Z. Yu, ACS Nano 12 (2018) 11193–11202. [18] S.J. Kim H.J. Koh C.E. Ren O. Kwon K. Maleski S.Y. Cho B. Anasori C.K. Kim Y.K. Choi J. Kim Y. Gogotsi H.T. Jung ACS Nano 12 2018 986 993 S.J. Kim, H.J. Koh, C.E. Ren, O. Kwon, K. Maleski, S.Y. Cho, B. Anasori, C.K. Kim, Y.K. Choi, J. Kim, Y. Gogotsi, H.T. Jung, ACS Nano 12 (2018) 986–993. [19] A. Sarycheva A. Polemi Y. Liu K. Dandekar B. Anasori Y. Gogotsi Sci. Adv. 4 2018 eaau0920 A. Sarycheva, A. Polemi, Y. Liu, K. Dandekar, B. Anasori, Y. Gogotsi, Sci. Adv. 4 (2018) eaau0920. [20] G. Choi F. Shahzad Y.-M. Bahk Y.M. Jhon H. Park M. Alhabeb B. Anasori D.-S. Kim C.M. Koo Y. Gogotsi M. Seo Adv. Opt. Mater. 6 2018 1701076 G. Choi, F. Shahzad, Y.-M. Bahk, Y.M. Jhon, H. Park, M. Alhabeb, B. Anasori, D.-S. Kim, C.M. Koo, Y. Gogotsi, M. Seo, Adv. Opt. Mater. 6 (2018) 1701076. [21] M. Han K. Maleski C.E. Shuck Y. Yang J.T. Glazar A.C. Foucher K. Hantanasirisakul A. Sarycheva N.C. Frey S.J. May V.B. Shenoy E.A. Stach Y. Gogotsi J. Am. Chem. Soc. 142 2020 M. Han, K. Maleski, C.E. Shuck, Y. Yang, J.T. Glazar, A.C. Foucher, K. Hantanasirisakul, A. Sarycheva, N.C. Frey, S.J. May, V.B. Shenoy, E.A. Stach, Y. Gogotsi, J. Am. Chem. Soc. 142 (2020). [22] B. Anasori M.R. Lukatskaya Y. Gogotsi Nat. Rev. Mater. 2 2017 16098 B. Anasori, M.R. Lukatskaya, Y. Gogotsi, Nat. Rev. Mater. 2 (2017) 16098. [23] G. Deysher C.E. Shuck K. Hantanasirisakul N.C. Frey A.C. Foucher K. Maleski A. Sarycheva V.B. Shenoy E.A. Stach B. Anasori Y. Gogotsi ACS Nano 14 2019 204 217 G. Deysher, C.E. Shuck, K. Hantanasirisakul, N.C. Frey, A.C. Foucher, K. Maleski, A. Sarycheva, V.B. Shenoy, E.A. Stach, B. Anasori, Y. Gogotsi, ACS Nano 14 (2019) 204–217. [24] Q. Tao M. Dahlqvist J. Lu S. Kota R. Meshkian J. Halim J. Palisaitis L. Hultman M.W. Barsoum P.O.Å. Persson J. Rosen Nat. Commun. 8 2017 1 7 Q. Tao, M. Dahlqvist, J. Lu, S. Kota, R. Meshkian, J. Halim, J. Palisaitis, L. Hultman, M.W. Barsoum, P.O.Å. Persson, J. Rosen, Nat. Commun. 8 (2017) 1–7. [25] J. Halim S. Kota M.R. Lukatskaya M. Naguib M.Q. Zhao E.J. Moon J. Pitock J. Nanda S.J. May Y. Gogotsi M.W. Barsoum Adv. Funct. Mater. 26 2016 3118 3127 J. Halim, S. Kota, M.R. Lukatskaya, M. Naguib, M.Q. Zhao, E.J. Moon, J. Pitock, J. Nanda, S.J. May, Y. Gogotsi, M.W. Barsoum, Adv. Funct. Mater. 26 (2016) 3118–3127. [26] Y. Li H. Shao Z. Lin J. Lu L. Liu B. Duployer P.O.Å. Persson P. Eklund L. Hultman M. Li K. Chen X.H. Zha S. Du P. Rozier Z. Chai E. Raymundo-Piñero P.L. Taberna P. Simon Q. Huang Nat. Mater. 19 2020 894 899 Y. Li, H. Shao, Z. Lin, J. Lu, L. Liu, B. Duployer, P.O.Å. Persson, P. Eklund, L. Hultman, M. Li, K. Chen, X.H. Zha, S. Du, P. Rozier, Z. Chai, E. Raymundo-Piñero, P.L. Taberna, P. Simon, Q. Huang, Nat. Mater. 19 (2020) 894–899. [27] E.S. Sim G.S. Yi M. Je Y. Lee Y.-C. Chung J. Power Sour. 342 2017 64 69 E.S. Sim, G.S. Yi, M. Je, Y. Lee, Y.-C. Chung, J. Power Sources 342 (2017) 64–69. [28] O. Mashtalir M.R. Lukatskaya M.-Q. Zhao M.W. Barsoum Y. Gogotsi Adv. Mater. 27 2015 3501 3506 O. Mashtalir, M.R. Lukatskaya, M.-Q. Zhao, M.W. Barsoum, Y. Gogotsi, Adv. Mater. 27 (2015) 3501–3506. [29] E. Lee A. Vahidmohammadi Y.S. Yoon M. Beidaghi D.J. Kim ACS Sensors 4 2019 1603 1611 E. Lee, A. Vahidmohammadi, Y.S. Yoon, M. Beidaghi, D.J. Kim, ACS Sensors 4 (2019) 1603–1611. [30] D. Huang Y. Xie D. Lu Z. Wang J. Wang H. Yu H. Zhang Adv. Mater. 31 2019 1901117 D. Huang, Y. Xie, D. Lu, Z. Wang, J. Wang, H. Yu, H. Zhang, Adv. Mater. 31 (2019) 1901117. [31] L. Lv C. Guo W. Sun Y. Wang Small 15 2018 1804338 L. Lv, C. Guo, W. Sun, Y. Wang, Small 15 (2018) 1804338. [32] M. Ghidiu M. Naguib C. Shi O. Mashtalir L.M. Pan B. Zhang J. Yang Y. Gogotsi S.J.L. Billinge M.W. Barsoum Chem. Commun. 50 2014 9517 9520 M. Ghidiu, M. Naguib, C. Shi, O. Mashtalir, L.M. Pan, B. Zhang, J. Yang, Y. Gogotsi, S.J.L. Billinge, M.W. Barsoum, Chem. Commun. 50 (2014) 9517–20. [33] Y. Gogotsi B. Anasori ACS Nano 13 2019 8491 8494 Y. Gogotsi, B. Anasori, ACS Nano 13 (2019) 8491–8494. [34] B. Anasori Y. Xie M. Beidaghi J. Lu B.C. Hosler L. Hultman P.R.C. Kent Y. Gogotsi M.W. Barsoum ACS Nano 9 2015 9507 9516 B. Anasori, Y. Xie, M. Beidaghi, J. Lu, B.C. Hosler, L. Hultman, P.R.C. Kent, Y. Gogotsi, M.W. Barsoum, ACS Nano 9 (2015) 9507–9516. [35] J. Palisaitis, I. Persson, J. Halim, J. Rosen, P.O.Å. Persson, Nanoscale (2018). [36] B. Ahmed A. El Ghazaly J. Rosen Adv. Funct. Mater. 2020 2000894 B. Ahmed, A. El Ghazaly, J. Rosen, Adv. Funct. Mater. (2020) 2000894. [37] H.A. Tahini X. Tan S.C. Smith Nanoscale 9 2017 7016 7020 H.A. Tahini, X. Tan, S.C. Smith, Nanoscale 9 (2017) 7016–7020. [38] J. Zhang N. Kong S. Uzun A. Levitt S. Seyedin P.A. Lynch S. Qin M. Han W. Yang J. Liu X. Wang Y. Gogotsi J.M. Razal Adv. Mater. 2020 2001093 J. Zhang, N. Kong, S. Uzun, A. Levitt, S. Seyedin, P.A. Lynch, S. Qin, M. Han, W. Yang, J. Liu, X. Wang, Y. Gogotsi, J.M. Razal, Adv. Mater. (2020) 2001093. [39] H. Kim H.N. Alshareef ACS Mater. Lett. 2 2020 55 70 H. Kim, H.N. Alshareef, ACS Mater. Lett. 2 (2020) 55–70. [40] J.L. Hart K. Hantanasirisakul A.C. Lang B. Anasori D. Pinto Y. Pivak J.T. van Omme S.J. May Y. Gogotsi M.L. Taheri Nat. Commun. 10 2019 522 J.L. Hart, K. Hantanasirisakul, A.C. Lang, B. Anasori, D. Pinto, Y. Pivak, J.T. van Omme, S.J. May, Y. Gogotsi, M.L. Taheri, Nat. Commun. 10 (2019) 522. [41] A.D. Dillon M.J. Ghidiu A.L. Krick J. Griggs S.J. May Y. Gogotsi M.W. Barsoum A.T. Fafarman Adv. Funct. Mater. 26 2016 4162 4168 A.D. Dillon, M.J. Ghidiu, A.L. Krick, J. Griggs, S.J. May, Y. Gogotsi, M.W. Barsoum, A.T. Fafarman, Adv. Funct. Mater. 26 (2016) 4162–4168. [42] C.J. Zhang, V. Nicolosi, in: 2D Met. Carbides Nitrides Struct. Prop. Appl., Springer International Publishing, 2019, pp. 481–501. [43] C.(John) Zhang V. Nicolosi Energy Storage Mater. 16 2019 102 125 C. (John) Zhang, V. Nicolosi, Energy Storage Mater. 16 (2019) 102–125. [44] S. De J.N. Coleman ACS Nano 4 2010 2713 2720 S. De, J.N. Coleman, ACS Nano 4 (2010) 2713–2720. [45] S. De P.J. King M. Lotya A. O’Neill E.M. Doherty Y. Hernandez G.S. Duesberg J.N. Coleman Small 6 2010 458 464 S. De, P.J. King, M. Lotya, A. O’Neill, E.M. Doherty, Y. Hernandez, G.S. Duesberg, J.N. Coleman, Small 6 (2010) 458–464. [46] C.J. Zhang B. Anasori A. Seral-Ascaso S.-H. Park N. McEvoy A. Shmeliov G.S. Duesberg J.N. Coleman Y. Gogotsi V. Nicolosi Adv. Mater. 29 2017 1702678 C.J. Zhang, B. Anasori, A. Seral-Ascaso, S.-H. Park, N. McEvoy, A. Shmeliov, G.S. Duesberg, J.N. Coleman, Y. Gogotsi, V. Nicolosi, Adv. Mater. 29 (2017) 1702678. [47] S.J. Kim J. Choi K. Maleski K. Hantanasirisakul H.T. Jung Y. Gogotsi C.W. Ahn ACS Appl. Mater. Interfaces 11 2019 32320 32327 S.J. Kim, J. Choi, K. Maleski, K. Hantanasirisakul, H.T. Jung, Y. Gogotsi, C.W. Ahn, ACS Appl. Mater. Interfaces 11 (2019) 32320–32327. [48] S. Ahn T. Han K. Maleski J. Song Y. Kim M. Park H. Zhou S. Yoo Y. Gogotsi T. Lee Adv. Mater. 32 2020 2000919 S. Ahn, T. Han, K. Maleski, J. Song, Y. Kim, M. Park, H. Zhou, S. Yoo, Y. Gogotsi, T. Lee, Adv. Mater. 32 (2020) 2000919. [49] Y. Xie M. Naguib V.N. Mochalin M.W. Barsoum Y. Gogotsi X. Yu K.W. Nam X.Q. Yang A.I. Kolesnikov P.R.C. Kent J. Am. Chem. Soc. 136 2014 6385 6394 Y. Xie, M. Naguib, V.N. Mochalin, M.W. Barsoum, Y. Gogotsi, X. Yu, K.W. Nam, X.Q. Yang, A.I. Kolesnikov, P.R.C. Kent, J. Am. Chem. Soc. 136 (2014) 6385–6394. [50] V. Kamysbayev A.S. Filatov H. Hu X. Rui F. Lagunas D. Wang R.F. Klie D.V. Talapin Science 2020 eaba8311 V. Kamysbayev, A.S. Filatov, H. Hu, X. Rui, F. Lagunas, D. Wang, R.F. Klie, D. V. Talapin, Science (2020) eaba8311. [51] P. Zhang D. Wang Q. Zhu N. Sun F. Fu B. Xu Nano-Micro Lett. 11 2019 1 14 P. Zhang, D. Wang, Q. Zhu, N. Sun, F. Fu, B. Xu, Nano-Micro Lett. 11 (2019) 1–14. [52] B. Xu Y. Gogotsi Adv. Funct. Mater. 30 2020 2007011 B. Xu, Y. Gogotsi, Adv. Funct. Mater. 30 (2020) 2007011. [53] Q. Zhu J. Li P. Simon B. Xu Energy Storage Mater. 35 2020 630 660 Q. Zhu, J. Li, P. Simon, B. Xu, Energy Storage Mater. 35 (2020) 630–660. [54] Y. Wei R.A. Soomro X. Xie B. Xu J. Energy Chem. 55 2021 244 255 Y. Wei, R.A. Soomro, X. Xie, B. Xu, J. Energy Chem. 55 (2021) 244–255. [55] J. Miao Q. Zhu K. Li P. Zhang Q. Zhao B. Xu J. Energy Chem. 52 2021 243 250 J. Miao, Q. Zhu, K. Li, P. Zhang, Q. Zhao, B. Xu, J. Energy Chem. 52 (2021) 243–250. [56] L. Ding D. Xiao Z. Lu J. Deng Y. Wei J. Caro H. Wang Angew. Chem. 132 2020 8798 8804 L. Ding, D. Xiao, Z. Lu, J. Deng, Y. Wei, J. Caro, H. Wang, Angew. Chemie 132 (2020) 8798–8804. [57] Z. Li Y. Dall’Agnese J. Guo H. Huang X. Liang S. Xu J. Mater. Chem. A 8 2020 16649 16660 Z. Li, Y. Dall’Agnese, J. Guo, H. Huang, X. Liang, S. Xu, J. Mater. Chem. A 8 (2020) 16649–16660. [58] X. Zhao D.E. Holta Z. Tan J.-H. Oh I.J. Echols M. Anas H. Cao J.L. Lutkenhaus M. Radovic M.J. Green ACS Appl. Nano Mater. 4 2020 acsanm.0c02473 X. Zhao, D.E. Holta, Z. Tan, J.-H. Oh, I.J. Echols, M. Anas, H. Cao, J.L. Lutkenhaus, M. Radovic, M.J. Green, ACS Appl. Nano Mater. 4 (2020) acsanm.0c02473. [59] J. Lao R. Lv J. Gao A. Wang J. Wu J. Luo ACS Nano 12 2018 12464 12471 J. Lao, R. Lv, J. Gao, A. Wang, J. Wu, J. Luo, ACS Nano 12 (2018) 12464–12471. [60] A. Lipatov M. Alhabeb M.R. Lukatskaya A. Boson Y. Gogotsi A. Sinitskii Adv. Electron. Mater. 2 2016 1600255 A. Lipatov, M. Alhabeb, M.R. Lukatskaya, A. Boson, Y. Gogotsi, A. Sinitskii, Adv. Electron. Mater. 2 (2016) 1600255. [61] X. Zhao A. Vashisth E. Prehn W. Sun S.A. Shah T. Habib Y. Chen Z. Tan J.L. Lutkenhaus M. Radovic M.J. Green Matter 1 2019 513 526 X. Zhao, A. Vashisth, E. Prehn, W. Sun, S.A. Shah, T. Habib, Y. Chen, Z. Tan, J.L. Lutkenhaus, M. Radovic, M.J. Green, Matter 1 (2019) 513–526. [62] T. Habib X. Zhao S.A. Shah Y. Chen W. Sun H. An J.L. Lutkenhaus M. Radovic M.J. Green Npj 2D Mater. Appl. 2 2018 20 T. Habib, X. Zhao, S.A. Shah, Y. Chen, W. Sun, H. An, J.L. Lutkenhaus, M. Radovic, M.J. Green, Npj 2D Mater. Appl. 2 (2018) 20. [63] T. Hu J. Yang X. Wang Phys. Chem. Chem. Phys. 19 2017 31773 31780 T. Hu, J. Yang, X. Wang, Phys. Chem. Chem. Phys. 19 (2017) 31773–31780. [64] C.J. Zhang S. Pinilla N. McEvoy C.P. Cullen B. Anasori E. Long S.-H. Park A. Seral-Ascaso A. Shmeliov D. Krishnan C. Morant X. Liu G.S. Duesberg Y. Gogotsi V. Nicolosi Chem. Mater. 29 2017 4848 4856 C.J. Zhang, S. Pinilla, N. McEvoy, C.P. Cullen, B. Anasori, E. Long, S.-H. Park, A. Seral-Ascaso, A. Shmeliov, D. Krishnan, C. Morant, X. Liu, G.S. Duesberg, Y. Gogotsi, V. Nicolosi, Chem. Mater. 29 (2017) 4848–4856. [65] J. Zhang N. Kong D. Hegh K.A.S. Usman G. Guan S. Qin I. Jurewicz W. Yang J.M. Razal ACS Appl. Mater. Interfaces 12 2020 34032 34040 J. Zhang, N. Kong, D. Hegh, K.A.S. Usman, G. Guan, S. Qin, I. Jurewicz, W. Yang, J.M. Razal, ACS Appl. Mater. Interfaces 12 (2020) 34032–34040. [66] V. Natu J.L. Hart M. Sokol H. Chiang M.L. Taheri M.W. Barsoum Angew. Chem. Int. Ed. 58 2019 12655 12660 V. Natu, J.L. Hart, M. Sokol, H. Chiang, M.L. Taheri, M.W. Barsoum, Angew. Chemie Int. Ed. 58 (2019) 12655–12660. [67] S. Shi B. Qian X. Wu H. Sun H. Wang H. Zhang Z. Yu T.P. Russell Angew. Chem. Int. Ed. 58 2019 18171 18176 S. Shi, B. Qian, X. Wu, H. Sun, H. Wang, H. Zhang, Z. Yu, T.P. Russell, Angew. Chemie Int. Ed. 58 (2019) 18171–18176. [68] S. Zhao L. Li H. Bin Zhang B. Qian J.Q. Luo Z. Deng S. Shi T.P. Russell Z.Z. Yu Mater. Chem. Front. 4 2020 910 917 S. Zhao, L. Li, H. Bin Zhang, B. Qian, J.Q. Luo, Z. Deng, S. Shi, T.P. Russell, Z.Z. Yu, Mater. Chem. Front. 4 (2020) 910–917. [69] H. Liu X. Zhang Y. Zhu B. Cao Q. Zhu P. Zhang B. Xu F. Wu R. Chen Nano-Micro Lett. 11 2019 1 12 H. Liu, X. Zhang, Y. Zhu, B. Cao, Q. Zhu, P. Zhang, B. Xu, F. Wu, R. Chen, Nano-Micro Lett. 11 (2019) 1–12. [70] Y. Deng T. Shang Z. Wu Y. Tao C. Luo J. Liang D. Han R. Lyu C. Qi W. Lv F. Kang Q. Yang Adv. Mater. 31 2019 1902432 Y. Deng, T. Shang, Z. Wu, Y. Tao, C. Luo, J. Liang, D. Han, R. Lyu, C. Qi, W. Lv, F. Kang, Q. Yang, Adv. Mater. 31 (2019) 1902432. [71] T. Shang Z. Lin C. Qi X. Liu P. Li Y. Tao Z. Wu D. Li P. Simon Q. Yang Adv. Funct. Mater. 29 2019 1903960 T. Shang, Z. Lin, C. Qi, X. Liu, P. Li, Y. Tao, Z. Wu, D. Li, P. Simon, Q. Yang, Adv. Funct. Mater. 29 (2019) 1903960. [72] Z. Wu T. Shang Y. Deng Y. Tao Q.H. Yang Adv. Sci. 2020 1903077 Z. Wu, T. Shang, Y. Deng, Y. Tao, Q.H. Yang, Adv. Sci. (2020) 1903077. [73] M. Ghidiu S. Kota J. Halim A.W. Sherwood N. Nedfors J. Rosen V.N. Mochalin M.W. Barsoum Chem. Mater. 29 2017 1099 1106 M. Ghidiu, S. Kota, J. Halim, A.W. Sherwood, N. Nedfors, J. Rosen, V.N. Mochalin, M.W. Barsoum, Chem. Mater. 29 (2017) 1099–1106. [74] M. Alhabeb K. Maleski B. Anasori P. Lelyukh L. Clark S. Sin Y. Gogotsi Chem. Mater. 29 2017 7633 7644 M. Alhabeb, K. Maleski, B. Anasori, P. Lelyukh, L. Clark, S. Sin, Y. Gogotsi, Chem. Mater. 29 (2017) 7633–7644. [75] K. Hantanasirisakul M. Alhabeb A. Lipatov K. Maleski B. Anasori P. Salles C. Ieosakulrat P. Pakawatpanurut A. Sinitskii S.J. May Y. Gogotsi Chem. Mater. 31 2019 2941 2951 K. Hantanasirisakul, M. Alhabeb, A. Lipatov, K. Maleski, B. Anasori, P. Salles, C. Ieosakulrat, P. Pakawatpanurut, A. Sinitskii, S.J. May, Y. Gogotsi, Chem. Mater. 31 (2019) 2941–2951. [76] T. Schultz N.C. Frey K. Hantanasirisakul S. Park S.J. May V.B. Shenoy Y. Gogotsi N. Koch Chem. Mater. 31 2019 6590 6597 T. Schultz, N.C. Frey, K. Hantanasirisakul, S. Park, S.J. May, V.B. Shenoy, Y. Gogotsi, N. Koch, Chem. Mater. 31 (2019) 6590–6597. [77] A. Miranda J. Halim M.W. Barsoum A. Lorke Appl. Phys. Lett. 108 2016 033102 A. Miranda, J. Halim, M.W. Barsoum, A. Lorke, Appl. Phys. Lett. 108 (2016) 033102. [78] T. Li L. Yao Q. Liu J. Gu R. Luo J. Li X. Yan W. Wang P. Liu B. Chen W. Zhang W. Abbas R. Naz D. Zhang Angew. Chem. Int. Ed. Engl. 130 2018 6223 6227 T. Li, L. Yao, Q. Liu, J. Gu, R. Luo, J. Li, X. Yan, W. Wang, P. Liu, B. Chen, W. Zhang, W. Abbas, R. Naz, D. Zhang, Angew. Chem. Int. Ed. Engl. 130 (2018) 6223–6227. [79] M. Seredych C.E. Shuck D. Pinto M. Alhabeb E. Precetti G. Deysher B. Anasori N. Kurra Y. Gogotsi Chem. Mater. 31 2019 3332 M. Seredych, C.E. Shuck, D. Pinto, M. Alhabeb, E. Precetti, G. Deysher, B. Anasori, N. Kurra, Y. Gogotsi, Chem Mater 31 (2019) 3332. [80] J.K. El-Demellawi S. Lopatin J. Yin O.F. Mohammed H.N. Alshareef ACS Nano 12 2018 8485 8493 J.K. El-Demellawi, S. Lopatin, J. Yin, O.F. Mohammed, H.N. Alshareef, ACS Nano 12 (2018) 8485–8493. [81] M. Mariano O. Mashtalir F.Q. Antonio W.-H. Ryu B. Deng F. Xia Y. Gogotsi A.D. Taylor Nanoscale 8 2016 16371 16378 M. Mariano, O. Mashtalir, F.Q. Antonio, W.-H. Ryu, B. Deng, F. Xia, Y. Gogotsi, A.D. Taylor, Nanoscale 8 (2016) 16371–16378. [82] S. Huang V.N. Mochalin Inorg. Chem. 58 2019 1958 1966 S. Huang, V.N. Mochalin, Inorg. Chem. 58 (2019) 1958–1966. [83] S. Huang V. Mochalin ACS Nano 2020 10.1021/acsnano.0c03602 S. Huang, V. Mochalin, ACS Nano (2020) doi.org/10.1021/acsnano.0c03602. [84] C. (John) Zhang, L. McKeon, M.P. Kremer, S.H. Park, O. Ronan, A. Seral‐Ascaso, S. Barwich, C. Coileáin, N. McEvoy, H.C. Nerl, B. Anasori, J.N. Coleman, Y. Gogotsi, V. Nicolosi, Nat. Commun. 10 (2019) 1795. [85] Y. Hernandez M. Lotya D. Rickard S.D. Bergin J.N. Coleman Langmuir 26 2010 3208 3213 Y. Hernandez, M. Lotya, D. Rickard, S.D. Bergin, J.N. Coleman, Langmuir 26 (2010) 3208–3213. [86] K. Maleski V.N. Mochalin Y. Gogotsi Chem. Mater. 29 2017 1632 1640 K. Maleski, V.N. Mochalin, Y. Gogotsi, Chem. Mater. 29 (2017) 1632–1640. [87] S. Seyedin J. Zhang K.A.S. Usman S. Qin A.M. Glushenkov E.R.S. Yanza R.T. Jones J.M. Razal Glob. Challenges 3 2019 1900037 S. Seyedin, J. Zhang, K.A.S. Usman, S. Qin, A.M. Glushenkov, E.R.S. Yanza, R.T. Jones, J.M. Razal, Glob. Challenges 3 (2019) 1900037. [88] Y. Hernandez V. Nicolosi M. Lotya F.M. Blighe Z. Sun S. De I.T. McGovern B. Holland M. Byrne Y.K. Gun’Ko J.J. Boland P. Niraj G. Duesberg S. Krishnamurthy R. Goodhue J. Hutchison V. Scardaci A.C. Ferrari J.N. Coleman Nat. Nanotechnol. 3 2008 563 568 Y. Hernandez, V. Nicolosi, M. Lotya, F.M. Blighe, Z. Sun, S. De, I.T. McGovern, B. Holland, M. Byrne, Y.K. Gun’Ko, J.J. Boland, P. Niraj, G. Duesberg, S. Krishnamurthy, R. Goodhue, J. Hutchison, V. Scardaci, A.C. Ferrari, J.N. Coleman, Nat. Nanotechnol. 3 (2008) 563–8. [89] D. Zhang S. Wang Y. Ma S. Yang J. Energy Chem. 27 2018 128 145 D. Zhang, S. Wang, Y. Ma, S. Yang, J. Energy Chem. 27 (2018) 128–145. [90] L. Jiang B. Lin X. Li X. Song H. Xia L. Li H. Zeng ACS Appl. Mater. Interfaces 8 2016 2680 2687 L. Jiang, B. Lin, X. Li, X. Song, H. Xia, L. Li, H. Zeng, ACS Appl. Mater. Interfaces 8 (2016) 2680–7. [91] Y. Li Y. Liang F.C. Robles Hernandez H. Deog Yoo Q. An Y. Yao Nano Energy 15 2015 453 461 Y. Li, Y. Liang, F.C. Robles Hernandez, H. Deog Yoo, Q. An, Y. Yao, Nano Energy 15 (2015) 453–461. [92] Y.-Z. Zhang K.H. Lee D.H. Anjum R. Sougrat Q. Jiang H. Kim H.N. Alshareef Sci. Adv. 4 2018 eaat0098 Y.-Z. Zhang, K.H. Lee, D.H. Anjum, R. Sougrat, Q. Jiang, H. Kim, H.N. Alshareef, Sci. Adv. 4 (2018) eaat0098. [93] X. Huang P. Wu Mater. Chem. Front. 4 2020 292 301 X. Huang, P. Wu, Mater. Chem. Front. (2020). [94] D. Kim T.Y. Ko H. Kim G.H. Lee S. Cho C.M. Koo ACS Nano 13 2019 13818 13828 D. Kim, T.Y. Ko, H. Kim, G.H. Lee, S. Cho, C.M. Koo, ACS Nano 13 (2019) 13818–13828. [95] C.J. Zhang S.J. Kim M. Ghidiu M.-Q. Zhao M.W. Barsoum V. Nicolosi Y. Gogotsi Adv. Funct. Mater. 26 2016 4143 4151 C.J. Zhang, S.J. Kim, M. Ghidiu, M.-Q. Zhao, M.W. Barsoum, V. Nicolosi, Y. Gogotsi, Adv. Funct. Mater. 26 (2016) 4143–4151. [96] C. Zhang M. Beidaghi M. Naguib M.R. Lukatskaya M.-Q. Zhao B. Dyatkin K.M. Cook S.J. Kim B. Eng X. Xiao D. Long W. Qiao B. Dunn Y. Gogotsi Chem. Mater. 28 2016 3937 3943 C. Zhang, M. Beidaghi, M. Naguib, M.R. Lukatskaya, M.-Q. Zhao, B. Dyatkin, K.M. Cook, S.J. Kim, B. Eng, X. Xiao, D. Long, W. Qiao, B. Dunn, Y. Gogotsi, Chem. Mater. 28 (2016) 3937–3943. [97] J. Xiong L. Pan H. Wang F. Du Y. Chen J. Yang C.(John) Zhang Electrochim. Acta 268 2018 503 511 J. Xiong, L. Pan, H. Wang, F. Du, Y. Chen, J. Yang, C. (John) Zhang, Electrochim. Acta 268 (2018) 503–511. [98] X. Wu Z. Wang M. Yu L. Xiu J. Qiu Adv. Mater. 29 2017 X. Wu, Z. Wang, M. Yu, L. Xiu, J. Qiu, Adv. Mater. 29 (2017). [99] Y. Liu H. Xiao W.A. Goddard J. Am. Chem. Soc. 138 2016 15853 15856 Y. Liu, H. Xiao, W.A. Goddard, J. Am. Chem. Soc. 138 (2016) 15853–15856. [100] D.I. Petukhov A.P. Chumakov A.S. Kan V.A. Lebedev A.A. Eliseev O.V. Konovalov A.A. Eliseev Nanoscale 11 2019 9980 9986 D.I. Petukhov, A.P. Chumakov, A.S. Kan, V.A. Lebedev, A.A. Eliseev, O. V. Konovalov, A.A. Eliseev, Nanoscale 11 (2019) 9980–9986. [101] R. Bian R. Lin G. Wang G. Lu W. Zhi S. Xiang T. Wang P.S. Clegg D. Cai W. Huang Nanoscale 10 2018 3621 3625 R. Bian, R. Lin, G. Wang, G. Lu, W. Zhi, S. Xiang, T. Wang, P.S. Clegg, D. Cai, W. Huang, Nanoscale 10 (2018) 3621–3625. [102] J. Shim J. Moon Yun T. Yun P. Kim K. Eun Lee W. Jun Lee R. Ryoo D.J. Pine G.-R. Yi S. Ouk Kim Nano Lett. 14 2014 1388 1393 J. Shim, J. Moon Yun, T. Yun, P. Kim, K. Eun Lee, W. Jun Lee, R. Ryoo, D.J. Pine, G.-R. Yi, S. Ouk Kim, Nano Lett. 14 (2014) 1388–1393. [103] T. Yun H. Kim A. Iqbal Y.S. Cho G.S. Lee M. Kim S.J. Kim D. Kim Y. Gogotsi S.O. Kim C.M. Koo Adv. Mater. 32 2020 1906769 T. Yun, H. Kim, A. Iqbal, Y.S. Cho, G.S. Lee, M. Kim, S.J. Kim, D. Kim, Y. Gogotsi, S.O. Kim, C.M. Koo, Adv. Mater. 32 (2020) 1906769. [104] S. Uzun S. Seyedin A.L. Stoltzfus A.S. Levitt M. Alhabeb M. Anayee C.J. Strobel J.M. Razal G. Dion Y. Gogotsi Adv. Funct. Mater. 29 2019 1905015 S. Uzun, S. Seyedin, A.L. Stoltzfus, A.S. Levitt, M. Alhabeb, M. Anayee, C.J. Strobel, J.M. Razal, G. Dion, Y. Gogotsi, Adv. Funct. Mater. 29 (2019) 1905015. [105] S. Seyedin E.R.S. Yanza J.M. Razal J. Mater. Chem. A 5 2017 24076 24082 S. Seyedin, E.R.S. Yanza, J.M. Razal, J. Mater. Chem. A 5 (2017) 24076–24082. [106] T.H. Park S. Yu M. Koo H. Kim E.H. Kim J.E. Park B. Ok B. Kim S.H. Noh C. Park E. Kim C.M. Koo C. Park ACS Nano 13 2019 6835 6844 T.H. Park, S. Yu, M. Koo, H. Kim, E.H. Kim, J.E. Park, B. Ok, B. Kim, S.H. Noh, C. Park, E. Kim, C.M. Koo, C. Park, ACS Nano 13 (2019) 6835–6844. [107] J. Zhang S. Uzun S. Seyedin P.A. Lynch B. Akuzum Z. Wang S. Qin M. Alhabeb C.E. Shuck W. Lei E.C. Kumbur W. Yang X. Wang G. Dion J.M. Razal Y. Gogotsi ACS Cent. Sci. 6 2020 254 265 J. Zhang, S. Uzun, S. Seyedin, P.A. Lynch, B. Akuzum, Z. Wang, S. Qin, M. Alhabeb, C.E. Shuck, W. Lei, E.C. Kumbur, W. Yang, X. Wang, G. Dion, J.M. Razal, Y. Gogotsi, ACS Cent. Sci. 6 (2020) 254–265. [108] Y. Xia T.S. Mathis M.-Q. Zhao B. Anasori A. Dang Z. Zhou H. Cho Y. Gogotsi S. Yang Nature 557 2018 409 412 Y. Xia, T.S. Mathis, M.-Q. Zhao, B. Anasori, A. Dang, Z. Zhou, H. Cho, Y. Gogotsi, S. Yang, Nature 557 (2018) 409–412. [109] S. Naficy R. Jalili S.H. Aboutalebi R.A. Gorkin K. Konstantinov P.C. Innis G.M. Spinks P. Poulin G.G. Wallace Mater. Horizons 1 2014 326 331 S. Naficy, R. Jalili, S.H. Aboutalebi, R.A. Gorkin, K. Konstantinov, P.C. Innis, G.M. Spinks, P. Poulin, G.G. Wallace, Mater. Horizons 1 (2014) 326–331. [110] B. Akuzum K. Maleski B. Anasori P. Lelyukh N.J. Alvarez E.C. Kumbur Y. Gogotsi ACS Nano 12 2018 2685 2694 B. Akuzum, K. Maleski, B. Anasori, P. Lelyukh, N.J. Alvarez, E.C. Kumbur, Y. Gogotsi, ACS Nano 12 (2018) 2685–2694. [111] W. Eom H. Shin R.B. Ambade S.H. Lee K.H. Lee D.J. Kang T.H. Han Nat. Commun. 11 2020 2825 W. Eom, H. Shin, R.B. Ambade, S.H. Lee, K.H. Lee, D.J. Kang, T.H. Han, Nat. Commun. 11 (2020) 2825. [112] J. Zhang S. Seyedin S. Qin Z. Wang S. Moradi F. Yang P.A. Lynch W. Yang J. Liu X. Wang J.M. Razal Small 15 2019 1804732 J. Zhang, S. Seyedin, S. Qin, Z. Wang, S. Moradi, F. Yang, P.A. Lynch, W. Yang, J. Liu, X. Wang, J.M. Razal, Small 15 (2019) 1804732. [113] Z. Wang S. Qin S. Seyedin J. Zhang J. Wang A. Levitt N. Li C. Haines R. Ovalle-Robles W. Lei Y. Gogotsi R.H. Baughman J.M. Razal Small 14 2018 1802225 Z. Wang, S. Qin, S. Seyedin, J. Zhang, J. Wang, A. Levitt, N. Li, C. Haines, R. Ovalle-Robles, W. Lei, Y. Gogotsi, R.H. Baughman, J.M. Razal, Small 14 (2018) 1802225. [114] A. Levitt J. Zhang G. Dion Y. Gogotsi J.M. Razal Adv. Funct. Mater. 30 2020 2000739 A. Levitt, J. Zhang, G. Dion, Y. Gogotsi, J.M. Razal, Adv. Funct. Mater. 30 (2020) 2000739. [115] H.E. Karahan, K. Goh, C. (John) Zhang, E. Yang, C. Yıldırım, C.Y. Chuah, M.G. Ahunbay, J. Lee, Ş.B. Tantekin‐Ersolmaz, Y. Chen, T. Bae, Adv. Mater. 32 (2020) 1906697. [116] Z. Sun T. Feng T.P. Russell Langmuir 29 2013 13407 13413 Z. Sun, T. Feng, T.P. Russell, Langmuir 29 (2013) 13407–13413. [117] D. Chen Z. Sun T.P. Russell L. Jin Langmuir 33 2017 8961 8969 D. Chen, Z. Sun, T.P. Russell, L. Jin, Langmuir 33 (2017) 8961–8969. [118] H. Sun L. Li T.P. Russell S. Shi J. Am. Chem. Soc. 142 2020 8591 8595 H. Sun, L. Li, T.P. Russell, S. Shi, J. Am. Chem. Soc. 142 (2020) 8591–8595. [119] R. Xu T. Liu H. Sun B. Wang S. Shi T.P. Russell ACS Appl. Mater. Interfaces 12 2020 18116 18122 R. Xu, T. Liu, H. Sun, B. Wang, S. Shi, T.P. Russell, ACS Appl. Mater. Interfaces 12 (2020) 18116–18122. [120] J.D. Cain A. Azizi K. Maleski B. Anasori E.C. Glazer P.Y. Kim Y. Gogotsi B.A. Helms T.P. Russell A. Zettl ACS Nano 13 2019 12385 12392 J.D. Cain, A. Azizi, K. Maleski, B. Anasori, E.C. Glazer, P.Y. Kim, Y. Gogotsi, B.A. Helms, T.P. Russell, A. Zettl, ACS Nano 13 (2019) 12385–12392. [121] S. Kumar Y. Lei N.H. Alshareef M.A. Quevedo-Lopez K.N. Salama Biosens. Bioelectron. 2018 S. Kumar, Y. Lei, N.H. Alshareef, M.A. Quevedo-Lopez, K.N. Salama, Biosens. Bioelectron. (2018). [122] J. Zhao, Y. Yang, C. Yang, Y. Tian, Y. Han, J. Liu, X. Yin, W. Que, J. Mater. Chem. A (2018). [123] W.T. Cao W. Feng Y.Y. Jiang C. Ma Z.F. Zhou M.G. Ma Y. Chen F. Chen Mater. Horizons 6 2019 1057 1065 W.T. Cao, W. Feng, Y.Y. Jiang, C. Ma, Z.F. Zhou, M.G. Ma, Y. Chen, F. Chen, Mater. Horizons (2019). [124] M. Aakyiir H. Yu S. Araby W. Ruoyu A. Michelmore Q. Meng D. Losic N.R. Choudhury J. Ma Chem. Eng. J. 397 2020 125439 M. Aakyiir, H. Yu, S. Araby, W. Ruoyu, A. Michelmore, Q. Meng, D. Losic, N.R. Choudhury, J. Ma, Chem. Eng. J. 397 (2020) 125439. [125] M. Xia B. Chen F. Gu L. Zu M. Xu Y. Feng Z. Wang H. Zhang C. Zhang J. Yang ACS Nano 14 2020 5111 5120 M. Xia, B. Chen, F. Gu, L. Zu, M. Xu, Y. Feng, Z. Wang, H. Zhang, C. Zhang, J. Yang, ACS Nano 14 (2020) 5111–5120. [126] S. Zhang H. Liu B. Cao Q. Zhu P. Zhang X. Zhang R. Chen F. Wu B. Xu J. Mater. Chem. A 7 2019 21766 21773 S. Zhang, H. Liu, B. Cao, Q. Zhu, P. Zhang, X. Zhang, R. Chen, F. Wu, B. Xu, J. Mater. Chem. A 7 (2019) 21766–21773. [127] S. Liu X. Zhang P. Yan R. Cheng Y. Tang M. Cui B. Wang L. Zhang X. Wang Y. Jiang L. Wang H. Yu ACS Nano 13 2019 8854 8864 S. Liu, X. Zhang, P. Yan, R. Cheng, Y. Tang, M. Cui, B. Wang, L. Zhang, X. Wang, Y. Jiang, L. Wang, H. Yu, ACS Nano 13 (2019) 8854–8864. [128] D. Cao M. Ren J. Xiong L. Pan Y. Wang X. Ji T. Qiu J. Yang C.(John) Zhang Electrochim. Acta 348 2020 136211 D. Cao, M. Ren, J. Xiong, L. Pan, Y. Wang, X. Ji, T. Qiu, J. Yang, C. (John) Zhang, Electrochim. Acta 348 (2020) 136211. [129] Z. Zeng C. Wang G. Siqueira D. Han A. Huch S. Abdolhosseinzadeh J. Heier F. Nüesch C. (John) Zhang G. Nyström Adv. Sci. 7 2020 2000979 Z. Zeng, C. Wang, G. Siqueira, D. Han, A. Huch, S. Abdolhosseinzadeh, J. Heier, F. Nüesch, C. (John) Zhang, G. Nyström, Adv. Sci. 7 (2020) 2000979. [130] M.-Q. Zhao C.E. Ren Z. Ling M.R. Lukatskaya C. Zhang K.L. Van Aken M.W. Barsoum Y. Gogotsi Adv. Mater. 27 2015 339 345 M.-Q. Zhao, C.E. Ren, Z. Ling, M.R. Lukatskaya, C. Zhang, K.L. Van Aken, M.W. Barsoum, Y. Gogotsi, Adv. Mater. 27 (2015) 339–45. [131] S. Abdolhosseinzadeh R. Schneider A. Verma J. Heier F. Nüesch C.(John) Zhang Adv. Mater. 32 2020 2000716 S. Abdolhosseinzadeh, R. Schneider, A. Verma, J. Heier, F. Nüesch, C. (John) Zhang, Adv. Mater. 32 (2020) 2000716. [132] J.P. Chapel J.F. Berret Curr. Opin. Colloid Interface Sci. 17 2012 97 105 J.P. Chapel, J.F. Berret, Curr. Opin. Colloid Interface Sci. 17 (2012) 97–105. [133] X. Zhou Y.-X. Yin L.-J. Wan Y.-G. Guo Adv. Energy Mater. 2 2012 1086 1090 X. Zhou, Y.-X. Yin, L.-J. Wan, Y.-G. Guo, Adv. Energy Mater. 2 (2012) 1086–1090. [134] X. Xie M.-Q. Zhao B. Anasori K. Maleski C.E. Ren J. Li B.W. Byles E. Pomerantseva G. Wang Y. Gogotsi Nano Energy 26 2016 513 523 X. Xie, M.-Q. Zhao, B. Anasori, K. Maleski, C.E. Ren, J. Li, B.W. Byles, E. Pomerantseva, G. Wang, Y. Gogotsi, Nano Energy 26 (2016) 513–523. [135] R. Zhao H. Di X. Hui D. Zhao R. Wang C. Wang L. Yin Energy Environ. Sci. 13 2020 246 257 R. Zhao, H. Di, X. Hui, D. Zhao, R. Wang, C. Wang, L. Yin, Energy Environ. Sci. 13 (2020) 246–257. [136] D. Guo F. Ming H. Su Y. Wu W. Wahyudi M. Li M.N. Hedhili G. Sheng L.J. Li H.N. Alshareef Y. Li Z. Lai Nano Energy 61 2019 478 485 D. Guo, F. Ming, H. Su, Y. Wu, W. Wahyudi, M. Li, M.N. Hedhili, G. Sheng, L.J. Li, H.N. Alshareef, Y. Li, Z. Lai, Nano Energy 61 (2019) 478–485. [137] S. Niu Z. Wang M. Yu M. Yu L. Xiu S. Wang X. Wu J. Qiu ACS Nano 12 2018 3937 S. Niu, Z. Wang, M. Yu, M. Yu, L. Xiu, S. Wang, X. Wu, J. Qiu, ACS Nano 12 (2018) 3937. [138] J.H. Rouse P.T. Lillehei Nano Lett. 3 2003 59 62 J.H. Rouse, P.T. Lillehei, Nano Lett. 3 (2003) 59–62. [139] N. Tomioka D. Takasu T. Takahashi T. Aida Angew. Chem. Int. Ed. 37 1998 1531 1534 N. Tomioka, D. Takasu, T. Takahashi, T. Aida, Angew. Chemie - Int. Ed. 37 (1998) 1531–1534. [140] M.A. Kostiainen P. Hiekkataipale A. Laiho V. Lemieux J. Seitsonen J. Ruokolainen P. Ceci Nat. Nanotechnol. 8 2013 52 56 M.A. Kostiainen, P. Hiekkataipale, A. Laiho, V. Lemieux, J. Seitsonen, J. Ruokolainen, P. Ceci, Nat. Nanotechnol. 8 (2013) 52–56. [141] G. Zheng Q. Zhang J.J. Cha Y. Yang W. Li Z.W. Seh Y. Cui Nano Lett. 13 2013 1265 1270 G. Zheng, Q. Zhang, J.J. Cha, Y. Yang, W. Li, Z.W. Seh, Y. Cui, Nano Lett. 13 (2013) 1265–1270. [142] B. Fang Y.Z. Wei M. Kumagai J. Power Sour. 155 2006 487 491 B. Fang, Y.Z. Wei, M. Kumagai, J. Power Sources 155 (2006) 487–491. [143] Y. Li M. van Zijll S. Chiang N. Pan J. Power Sour. 196 2011 6003 6006 Y. Li, M. van Zijll, S. Chiang, N. Pan, J. Power Sources 196 (2011) 6003–6006. [144] X. Wu S. Li Y. Zhao Y. Tang J. Liu X. Guo D. Wu G. He ACS Appl. Mater. Interfaces 6 2014 15753 15759 X. Wu, S. Li, Y. Zhao, Y. Tang, J. Liu, X. Guo, D. Wu, G. He, ACS Appl. Mater. Interfaces 6 (2014) 15753–15759. [145] G. Lee D. Kim J. Yun Y. Ko J. Cho J.S. Ha Nanoscale 6 2014 9655 9664 G. Lee, D. Kim, J. Yun, Y. Ko, J. Cho, J.S. Ha, Nanoscale 6 (2014) 9655–64. [146] Y. Yang Z. Zeng G. Zeng D. Huang R. Xiao C. Zhang C. Zhou W. Xiong W. Wang M. Cheng W. Xue H. Guo X. Tang D. He Appl. Catal. B Environ. 258 2019 117956 Y. Yang, Z. Zeng, G. Zeng, D. Huang, R. Xiao, C. Zhang, C. Zhou, W. Xiong, W. Wang, M. Cheng, W. Xue, H. Guo, X. Tang, D. He, Appl. Catal. B Environ. 258 (2019) 117956. [147] R. Sun H. Bin Zhang J. Liu X. Xie R. Yang Y. Li S. Hong Z.Z. Yu Adv. Funct. Mater. 27 2017 1702807 R. Sun, H. Bin Zhang, J. Liu, X. Xie, R. Yang, Y. Li, S. Hong, Z.Z. Yu, Adv. Funct. Mater. 27 (2017) 1702807. [148] M.-Q. Zhao X. Xie C.E. Ren T. Makaryan B. Anasori G. Wang Y. Gogotsi Adv. Mater. 29 2017 1702410 M.-Q. Zhao, X. Xie, C.E. Ren, T. Makaryan, B. Anasori, G. Wang, Y. Gogotsi, Adv. Mater. 29 (2017) 1702410. [149] F. Zhang Y. Bai Y. Ma W. Yang J. Colloid Interface Sci. 334 2009 13 21 F. Zhang, Y. Bai, Y. Ma, W. Yang, J. Colloid Interface Sci. 334 (2009) 13–21. [150] F. Zhang X. Guo P. Xiong J. Zhang J. Song K. Yan X. Gao H. Liu G. Wang Adv. Energy Mater. 10 2020 2000446 F. Zhang, X. Guo, P. Xiong, J. Zhang, J. Song, K. Yan, X. Gao, H. Liu, G. Wang, Adv. Energy Mater. 10 (2020) 2000446. [151] Q. Wei Q. An D. Chen L. Mai S. Chen Y. Zhao K.M. Hercule L. Xu A. Minhas-Khan Q. Zhang Nano Lett. 14 2 2014 1042 1048 Q. Wei, Q. An, D. Chen, L. Mai, S. Chen, Y. Zhao, K.M. Hercule, L. Xu, A. Minhas-Khan, Q. Zhang, Nano Lett. (2014). [152] M.-K. Song Y. Zhang E.J. Cairns Nano Lett. 13 2013 5891 5899 M.-K. Song, Y. Zhang, E.J. Cairns, Nano Lett. 13 (2013) 5891–5899. [153] S. Wang D. Jin Y. Bian R. Wang L. Zhang ACS Appl. Mater. Interfaces 12 2020 9226 9235 S. Wang, D. Jin, Y. Bian, R. Wang, L. Zhang, ACS Appl. Mater. Interfaces 12 (2020) 9226–9235. [154] Y. Cui J. Wang X. Wang J. Qin M. Cao Chem. Asian J. 15 2020 1376 1383 Y. Cui, J. Wang, X. Wang, J. Qin, M. Cao, Chem. – An Asian J. 15 (2020) 1376–1383. [155] Z. Gholamvand D. Mcateer A. Harvey C. Backes J.N. Coleman Chem. Mater. 28 2016 2641 2651 Z. Gholamvand, D. Mcateer, A. Harvey, C. Backes, J.N. Coleman, Chem. Mater. 28 (2016) 2641–2651. [156] M. Yu S. Zhou Z. Wang J. Zhao J. Qiu Nano Energy 44 2018 181 190 M. Yu, S. Zhou, Z. Wang, J. Zhao, J. Qiu, Nano Energy 44 (2018) 181–190. [157] S. Xu Y. Dall’Agnese G. Wei C. Zhang Y. Gogotsi W. Han Nano Energy 50 2018 479 488 S. Xu, Y. Dall’Agnese, G. Wei, C. Zhang, Y. Gogotsi, W. Han, Nano Energy 50 (2018) 479–488. [158] P. Vialat C. Mousty C. Taviot-Gueho G. Renaudin H. Martinez J.-C. Dupin E. Elkaim F. Leroux Adv. Funct. Mater. 2014 n/a-n/a P. Vialat, C. Mousty, C. Taviot-Gueho, G. Renaudin, H. Martinez, J.-C. Dupin, E. Elkaim, F. Leroux, Adv. Funct. Mater. (2014) n/a-n/a. [159] Q. Wang D. O’Hare Chem. Rev. 112 2012 4124 4155 Q. Wang, D. O’Hare, Chem. Rev. 112 (2012) 4124–4155. [160] P. Lin J. Shen X. Yu Q. Liu D. Li H. Tang Ceram. Int. 45 2019 24656 24663 P. Lin, J. Shen, X. Yu, Q. Liu, D. Li, H. Tang, Ceram. Int. 45 (2019) 24656–24663. [161] Y. Yang D. Zhang J. Fan Y. Liao Q. Xiang Sol. RRL 2020 2000351 Y. Yang, D. Zhang, J. Fan, Y. Liao, Q. Xiang, Sol. RRL (2020) 2000351. [162] H. Niu X. Yang Q. Wang X. Jing K. Cheng K. Zhu K. Ye G. Wang D. Cao J. Yan J. Energy Chem. 46 2020 105 113 H. Niu, X. Yang, Q. Wang, X. Jing, K. Cheng, K. Zhu, K. Ye, G. Wang, D. Cao, J. Yan, J. Energy Chem. 46 (2020) 105–113. [163] X. Zhao H. Xu Z. Hui Y. Sun C. Yu J. Xue R. Zhou L. Wang H. Dai Y. Zhao J. Yang J. Zhou Q. Chen G. Sun W. Huang Small 15 2019 1904255 X. Zhao, H. Xu, Z. Hui, Y. Sun, C. Yu, J. Xue, R. Zhou, L. Wang, H. Dai, Y. Zhao, J. Yang, J. Zhou, Q. Chen, G. Sun, W. Huang, Small 15 (2019) 1904255. [164] W. Tian A. VahidMohammadi Z. Wang L. Ouyang M. Beidaghi M.M. Hamedi Nat. Commun. 10 2019 2558 W. Tian, A. VahidMohammadi, Z. Wang, L. Ouyang, M. Beidaghi, M.M. Hamedi, Nat. Commun. 10 (2019) 2558. [165] R. Meng J. Huang Y. Feng L. Zu C. Peng L. Zheng L. Zheng Z. Chen G. Liu B. Chen Y. Mi J. Yang Adv. Energy Mater. 8 2018 1801514 R. Meng, J. Huang, Y. Feng, L. Zu, C. Peng, L. Zheng, L. Zheng, Z. Chen, G. Liu, B. Chen, Y. Mi, J. Yang, Adv. Energy Mater. 8 (2018) 1801514. [166] M. Shi P. Xiao J. Lang C. Yan X. Yan Adv. Sci. 7 2020 1901975 M. Shi, P. Xiao, J. Lang, C. Yan, X. Yan, Adv. Sci. 7 (2020) 1901975. [167] F. He B. Zhu B. Cheng J. Yu W. Ho W. Macyk Appl. Catal. B Environ. 272 2020 119006 F. He, B. Zhu, B. Cheng, J. Yu, W. Ho, W. Macyk, Appl. Catal. B Environ. 272 (2020) 119006. [168] M. Li J. Lu K. Luo Y. Li K. Chang K. Chen J. Zhou J. Rosen L. Hultman P. Eklund P.O.Å. Persson S. Du Z. Chai Z. Huang Q. Huang J. Am. Chem. Soc. 141 2019 4730 4737 M. Li, J. Lu, K. Luo, Y. Li, K. Chang, K. Chen, J. Zhou, J. Rosen, L. Hultman, P. Eklund, P.O.Å. Persson, S. Du, Z. Chai, Z. Huang, Q. Huang, J. Am. Chem. Soc. 141 (2019) 4730–4737. [169] J. Wang Z. Chang B. Ding T. Li G. Yang Z. Pang T. Nakato M. Eguchi Y.-M. Kang J. Na B.Y. Guan Y. Yamauchi Angew. Chem. Int. Ed. 59 2020 19570 19575 J. Wang, Z. Chang, B. Ding, T. Li, G. Yang, Z. Pang, T. Nakato, M. Eguchi, Y.-M. Kang, J. Na, B.Y. Guan, Y. Yamauchi, Angew. Chemie Int. Ed. 59 (2020) 19570–19575. [170] H. Huang J. Cui G. Liu R. Bi L. Zhang ACS Nano 13 2019 3448 3456 H. Huang, J. Cui, G. Liu, R. Bi, L. Zhang, ACS Nano 13 (2019) 3448–3456. [171] M. Naguib O. Mashtalir M.R. Lukatskaya B. Dyatkin C. Zhang V. Presser Y. Gogotsi M.W. Barsoum Chem. Commun. 50 2014 7420 7423 M. Naguib, O. Mashtalir, M.R. Lukatskaya, B. Dyatkin, C. Zhang, V. Presser, Y. Gogotsi, M.W. Barsoum, Chem. Commun. 50 (2014) 7420–7423. [172] B. Ahmed D.H. Anjum M.N. Hedhili Y. Gogotsi H.N. Alshareef Nanoscale 8 2016 7580 7587 B. Ahmed, D.H. Anjum, M.N. Hedhili, Y. Gogotsi, H.N. Alshareef, Nanoscale 8 (2016) 7580–7587. [173] L. Jiao C. Zhang C. Geng S. Wu H. Li W. Lv Y. Tao Z. Chen G. Zhou J. Li G. Ling Y. Wan Q. Yang Adv. Energy Mater. 9 2019 1900219 L. Jiao, C. Zhang, C. Geng, S. Wu, H. Li, W. Lv, Y. Tao, Z. Chen, G. Zhou, J. Li, G. Ling, Y. Wan, Q. Yang, Adv. Energy Mater. 9 (2019) 1900219. [174] M. Han X. Yin X. Li B. Anasori L. Zhang L. Cheng Y. Gogotsi ACS Appl. Mater. Interfaces 9 2017 20038 20045 M. Han, X. Yin, X. Li, B. Anasori, L. Zhang, L. Cheng, Y. Gogotsi, ACS Appl. Mater. Interfaces 9 (2017) 20038–20045. [175] S. Chertopalov V.N. Mochalin ACS Nano 12 2018 6109 S. Chertopalov, V.N. Mochalin, ACS Nano 12 (2018) 6109. [176] J. Luo J. Zheng J. Nai C. Jin H. Yuan O. Sheng Y. Liu R. Fang W. Zhang H. Huang Y. Gan Y. Xia C. Liang J. Zhang W. Li X. Tao Adv. Funct. Mater. 29 2019 1808107 J. Luo, J. Zheng, J. Nai, C. Jin, H. Yuan, O. Sheng, Y. Liu, R. Fang, W. Zhang, H. Huang, Y. Gan, Y. Xia, C. Liang, J. Zhang, W. Li, X. Tao, Adv. Funct. Mater. 29 (2019) 1808107. [177] T. Zhou C. Wu Y. Wang A.P. Tomsia M. Li E. Saiz S. Fang R.H. Baughman L. Jiang Q. Cheng Nat. Commun. 11 2020 2077 T. Zhou, C. Wu, Y. Wang, A.P. Tomsia, M. Li, E. Saiz, S. Fang, R.H. Baughman, L. Jiang, Q. Cheng, Nat. Commun. 11 (2020) 2077. [178] Y.T. Liu P. Zhang N. Sun B. Anasori Q.Z. Zhu H. Liu Y. Gogotsi B. Xu Adv. Mater. 30 2018 Y.T. Liu, P. Zhang, N. Sun, B. Anasori, Q.Z. Zhu, H. Liu, Y. Gogotsi, B. Xu, Adv. Mater. 30 (2018). [179] L. Pan X.D. Zhu K.N. Sun Y.T. Liu X.M. Xie X.Y. Ye Nano Energy 30 2016 347 354 L. Pan, X.D. Zhu, K.N. Sun, Y.T. Liu, X.M. Xie, X.Y. Ye, Nano Energy 30 (2016) 347–354. [180] L. Pan X.D. Zhu X.M. Xie Y.T. Liu J. Mater. Chem. A 3 2015 2726 2733 L. Pan, X.D. Zhu, X.M. Xie, Y.T. Liu, J. Mater. Chem. A 3 (2015) 2726–2733. [181] Z.-Q. Duan Y.-T. Liu X.-M. Xie X.-Y. Ye X.-D. Zhu Chem. Asian J. 11 2016 828 833 Z.-Q. Duan, Y.-T. Liu, X.-M. Xie, X.-Y. Ye, X.-D. Zhu, Chem. - An Asian J. 11 (2016) 828–833. [182] A. Iqbal F. Shahzad K. Hantanasirisakul M.K. Kim J. Kwon J. Hong H. Kim D. Kim Y. Gogotsi C.M. Koo Science 369 2020 446 450 A. Iqbal, F. Shahzad, K. Hantanasirisakul, M.K. Kim, J. Kwon, J. Hong, H. Kim, D. Kim, Y. Gogotsi, C.M. Koo, Science 369 (2020) 446–450. [183] Z. Lin J. Liu W. Peng Y. Zhu Y. Zhao K. Jiang M. Peng Y. Tan ACS Nano 14 2020 2109 2117 Z. Lin, J. Liu, W. Peng, Y. Zhu, Y. Zhao, K. Jiang, M. Peng, Y. Tan, ACS Nano 14 (2020) 2109–2117. [184] F. Shahzad M. Alhabeb C.B. Hatter B. Anasori S. Man Hong C.M. Koo Y. Gogotsi Science 353 2016 1137 1140 F. Shahzad, M. Alhabeb, C.B. Hatter, B. Anasori, S. Man Hong, C.M. Koo, Y. Gogotsi, Science 353 (2016) 1137–40. [185] Z. Ling C.E. Ren M.-Q. Zhao J. Yang J.M. Giammarco J. Qiu M.W. Barsoum Y. Gogotsi Proc. Natl. Acad. Sci. 111 2014 16676 16681 Z. Ling, C.E. Ren, M.-Q. Zhao, J. Yang, J.M. Giammarco, J. Qiu, M.W. Barsoum, Y. Gogotsi, Proc. Natl. Acad. Sci. 111 (2014) 16676–81. [186] H. Chen H. Ma P. Zhang Y. Wen L. Qu C. Li ACS Nano 14 2020 10471 10479 H. Chen, H. Ma, P. Zhang, Y. Wen, L. Qu, C. Li, ACS Nano 14 (2020) 10471–10479. [187] M. Ghidiu J. Halim S. Kota D. Bish Y. Gogotsi M.W. Barsoum Chem. Mater. 28 2016 3507 3514 M. Ghidiu, J. Halim, S. Kota, D. Bish, Y. Gogotsi, M.W. Barsoum, Chem. Mater. 28 (2016) 3507–3514. [188] Y. Chen X. Xie X. Xin Z.R. Tang Y.J. Xu ACS Nano 13 2019 295 304 Y. Chen, X. Xie, X. Xin, Z.R. Tang, Y.J. Xu, ACS Nano 13 (2019) 295–304. [189] Y. Yue N. Liu Y. Ma S. Wang W. Liu C. Luo H. Zhang F. Cheng J. Rao X. Hu J. Su Y. Gao ACS Nano 12 2018 4224 4232 Y. Yue, N. Liu, Y. Ma, S. Wang, W. Liu, C. Luo, H. Zhang, F. Cheng, J. Rao, X. Hu, J. Su, Y. Gao, ACS Nano 12 (2018) 4224–4232. [190] C.K. Chua M. Pumera Chem. Soc. Rev. 43 2014 291 312 C.K. Chua, M. Pumera, Chem. Soc. Rev. 43 (2014) 291–312. [191] W. Chen L. Yan P.R. Bangal J. Phys. Chem. C 114 2010 19885 19890 W. Chen, L. Yan, P.R. Bangal, J. Phys. Chem. C 114 (2010) 19885–19890. [192] Z. Wang X. Shen N.M. Han X. Liu Y. Wu W. Ye J.K. Kim Chem. Mater. 28 2016 6731 6741 Z. Wang, X. Shen, N.M. Han, X. Liu, Y. Wu, W. Ye, J.K. Kim, Chem. Mater. 28 (2016) 6731–6741. [193] J. Liu H.-B. Zhang X. Xie R. Yang Z. Liu Y. Liu Z.-Z. Yu Small 14 2018 1802479 J. Liu, H.-B. Zhang, X. Xie, R. Yang, Z. Liu, Y. Liu, Z.-Z. Yu, Small 14 (2018) 1802479. [194] X. Wu B. Han H. Bin Zhang X. Xie T. Tu Y. Zhang Y. Dai R. Yang Z.Z. Yu Chem. Eng. J. 381 2020 122622 X. Wu, B. Han, H. Bin Zhang, X. Xie, T. Tu, Y. Zhang, Y. Dai, R. Yang, Z.Z. Yu, Chem. Eng. J. 381 (2020) 122622. [195] X. Zhao X.J. Zha J.H. Pu L. Bai R.Y. Bao Z.Y. Liu M.B. Yang W. Yang J. Mater. Chem. A 7 2019 10446 10455 X. Zhao, X.J. Zha, J.H. Pu, L. Bai, R.Y. Bao, Z.Y. Liu, M.B. Yang, W. Yang, J. Mater. Chem. A (2019). [196] J. Cao C. Chen Q. Zhao N. Zhang Q. Lu X. Wang Z. Niu J. Chen Adv. Mater. 28 2016 9629 9636 J. Cao, C. Chen, Q. Zhao, N. Zhang, Q. Lu, X. Wang, Z. Niu, J. Chen, Adv. Mater. 28 (2016) 9629–9636. [197] C.N. Yeh K. Raidongia J. Shao Q.H. Yang J. Huang Nat. Chem. 7 2015 166 170 C.N. Yeh, K. Raidongia, J. Shao, Q.H. Yang, J. Huang, Nat. Chem. (2015). [198] K. Rasool R.P. Pandey P.A. Rasheed S. Buczek Y. Gogotsi K.A. Mahmoud Mater. Today 30 2019 80 102 K. Rasool, R.P. Pandey, P.A. Rasheed, S. Buczek, Y. Gogotsi, K.A. Mahmoud, Mater. Today 30 (2019) 80–102. [199] I. Ihsanullah Nano-Micro Lett. 12 2020 3 I. Ihsanullah, Nano-Micro Lett. 12 (2020) 3. [200] Z. Guo J. Zhou L. Zhu Z. Sun J. Mater. Chem. A 4 2016 11446 11452 Z. Guo, J. Zhou, L. Zhu, Z. Sun, J. Mater. Chem. A 4 (2016) 11446–11452. [201] X. Zhan C. Si J. Zhou Z. Sun Nanoscale Horizons 5 2020 235 258 X. Zhan, C. Si, J. Zhou, Z. Sun, Nanoscale Horizons 5 (2020) 235–258. [202] I. Ihsanullah Chem. Eng. J. 388 2020 124340 I. Ihsanullah, Chem. Eng. J. 388 (2020) 124340. [203] S. De J.N. Coleman MRS Bull. 36 2011 774 781 S. De, J.N. Coleman, MRS Bull. 36 (2011) 774–781. [204] S. Bae H. Kim Y. Lee X. Xu J.-S. Park Y. Zheng J. Balakrishnan T. Lei H. Ri Kim Y. Il Song Y.-J. Kim K.S. Kim B. Özyilmaz J.-H. Ahn B.H. Hong S. Iijima Nat. Nanotechnol. 5 2010 574 578 S. Bae, H. Kim, Y. Lee, X. Xu, J.-S. Park, Y. Zheng, J. Balakrishnan, T. Lei, H. Ri Kim, Y. Il Song, Y.-J. Kim, K.S. Kim, B. Özyilmaz, J.-H. Ahn, B.H. Hong, S. Iijima, Nat. Nanotechnol. 5 (2010) 574–578. [205] X. Li Y. Zhu W. Cai M. Borysiak B. Han D. Chen R.D. Piner L. Colombo R.S. Ruoff Nano Lett. 9 2009 4359 4363 X. Li, Y. Zhu, W. Cai, M. Borysiak, B. Han, D. Chen, R.D. Piner, L. Colombo, R.S. Ruoff, Nano Lett. 9 (2009) 4359–4363. [206] K. Hantanasirisakul M.-Q. Zhao P. Urbankowski J. Halim B. Anasori S. Kota C.E. Ren M.W. Barsoum Y. Gogotsi Adv. Electron. Mater. 2 2016 1600050 K. Hantanasirisakul, M.-Q. Zhao, P. Urbankowski, J. Halim, B. Anasori, S. Kota, C.E. Ren, M.W. Barsoum, Y. Gogotsi, Adv. Electron. Mater. 2 (2016) 1600050. [207] X. Zhang Z. Zhang Z. Zhou J. Energy Chem. 27 2018 73 85 X. Zhang, Z. Zhang, Z. Zhou, J. Energy Chem. 27 (2018) 73–85. [208] M.R. Lukatskaya O. Mashtalir C.E. Ren Y. Dall’Agnese P. Rozier P.L. Taberna M. Naguib P. Simon M.W. Barsoum Y. Gogotsi Science 341 2013 1502 1505 M.R. Lukatskaya, O. Mashtalir, C.E. Ren, Y. Dall’Agnese, P. Rozier, P.L. Taberna, M. Naguib, P. Simon, M.W. Barsoum, Y. Gogotsi, Science 341 (2013) 1502–5. [209] Y. Cai J. Shen G. Ge Y. Zhang W. Jin W. Huang J. Shao J. Yang X. Dong ACS Nano 12 2018 56 62 Y. Cai, J. Shen, G. Ge, Y. Zhang, W. Jin, W. Huang, J. Shao, J. Yang, X. Dong, ACS Nano 12 (2018) 56–62. [210] M. Hu Z. Li T. Hu S. Zhu C. Zhang X. Wang ACS Nano 10 2016 11344 11350 M. Hu, Z. Li, T. Hu, S. Zhu, C. Zhang, X. Wang, ACS Nano 10 (2016) 11344–11350. [211] P. Simon Y. Gogotsi Nat. Mater. 2020 1 13 P. Simon, Y. Gogotsi, Nat. Mater. (2020) 1–13. [212] J. Zhou X. Zha F.Y. Chen Q. Ye P. Eklund S. Du Q. Huang Angew. Chem. Int. Ed. 55 2016 5008 5013 J. Zhou, X. Zha, F.Y. Chen, Q. Ye, P. Eklund, S. Du, Q. Huang, Angew. Chemie - Int. Ed. 55 (2016) 5008–5013. [213] M.R. Lukatskaya S. Kota Z. Lin M.-Q. Zhao N. Shpigel M.D. Levi J. Halim P.-L. Taberna M.W. Barsoum P. Simon Y. Gogotsi Nat. Energy 2 2017 17105 M.R. Lukatskaya, S. Kota, Z. Lin, M.-Q. Zhao, N. Shpigel, M.D. Levi, J. Halim, P.-L. Taberna, M.W. Barsoum, P. Simon, Y. Gogotsi, Nat. Energy 2 (2017) 17105. [214] P. Simon ACS Nano 11 3 2017 2393 2396 P. Simon, ACS Nano (2017). [215] W. Tian A. VahidMohammadi M.S. Reid Z. Wang L. Ouyang J. Erlandsson T. Pettersson L. Wågberg M. Beidaghi M.M. Hamedi Adv. Mater. 2019 1902977 W. Tian, A. VahidMohammadi, M.S. Reid, Z. Wang, L. Ouyang, J. Erlandsson, T. Pettersson, L. Wågberg, M. Beidaghi, M.M. Hamedi, Adv. Mater. (2019) 1902977. [216] Z. Fan Y. Wang Z. Xie X. Xu Y. Yuan Z. Cheng Y. Liu Nanoscale 10 2018 9642 Z. Fan, Y. Wang, Z. Xie, X. Xu, Y. Yuan, Z. Cheng, Y. Liu, Nanoscale 10 (2018) 9642. [217] W. Yang J. Yang J.J. Byun F.P. Moissinac J. Xu S.J. Haigh M. Domingos M.A. Bissett R.A.W. Dryfe S. Barg Adv. Mater. 31 2019 1902725 W. Yang, J. Yang, J.J. Byun, F.P. Moissinac, J. Xu, S.J. Haigh, M. Domingos, M.A. Bissett, R.A.W. Dryfe, S. Barg, Adv. Mater. 31 (2019) 1902725. [218] Y. Dall’Agnese P.-L. Taberna Y. Gogotsi P. Simon J. Phys. Chem. Lett. 6 2015 2305 2309 Y. Dall’Agnese, P.-L. Taberna, Y. Gogotsi, P. Simon, J. Phys. Chem. Lett. 6 (2015) 2305–2309. [219] D. Er J. Li M. Naguib Y. Gogotsi V.B. Shenoy ACS Appl. Mater. Interfaces 6 2014 11173 11179 D. Er, J. Li, M. Naguib, Y. Gogotsi, V.B. Shenoy, ACS Appl. Mater. Interfaces 6 (2014) 11173–11179. [220] J. Liu Z. Liu H. Bin Zhang W. Chen Z. Zhao Q.W. Wang Z.Z. Yu Adv. Electron. Mater. 6 2020 1901094 J. Liu, Z. Liu, H. Bin Zhang, W. Chen, Z. Zhao, Q.W. Wang, Z.Z. Yu, Adv. Electron. Mater. 6 (2020) 1901094. [221] Y. Li X. Tian S. Gao L. Jing K. Li H. Yang F. Fu J.Y. Lee Y. Guo J.S. Ho P. Chen Adv. Funct. Mater. 30 2020 1907451 Y. Li, X. Tian, S. Gao, L. Jing, K. Li, H. Yang, F. Fu, J.Y. Lee, Y. Guo, J.S. Ho, P. Chen, Adv. Funct. Mater. 30 (2020) 1907451.",
      "scopus-id": "85101804953",
      "coredata": {
        "eid": "1-s2.0-S2095495621000310",
        "dc:description": "Two-dimensional (2D) transition metal carbides, carbonitrides and nitrides, known as MXenes, are emerging quickly at the frontiers of 2D materials world. Their exotic properties such as the highest electrical conductivity among all solution-processed 2D materials, the best electromagnetic interference shielding performance outperforming that of copper or aluminum at a nanoscale thickness, as well as the highest volumetric capacitance for pseudocapacitors, have been attracting extensive fundamental research and applications. Their unique surface chemistries, that is, hydrophilic groups terminated on the surface of MXenes after etching and delamination, enable plenty of opportunities for assembling into MXene building blocks. Particularly, assembling at liquid–liquid, liquid–solid, liquid–air, and solid–solid interfaces allows the efficient fabrication of various structures, including MXene surfactants, MXene heterostructures, MXene transparent films. Interfacial assembly of MXenes is of significance in unveiling more versatilities of MXenes as well as impacts on novel MXene-based architectures, based on which enhanced performance of devices is achieved. As such, this review focuses on the interfacial assembly of MXenes, explaining mechanisms behind various assembling and providing classical examples for corresponding interfacial assembling techniques. Applications of these as-assembled architectures are also discussed in brief. We believe this review may shed light on the interfacial chemistry of MXenes, thus guiding more efficient fabrication of MXene-based functional films/coatings/electrodes/devices.",
        "openArchiveArticle": "false",
        "prism:coverDate": "2021-09-30",
        "openaccessUserLicense": null,
        "prism:aggregationType": "Journal",
        "prism:url": "https://api.elsevier.com/content/article/pii/S2095495621000310",
        "dc:creator": {
          "@_fa": "true",
          "$": "Zhang, Chuanfang (John)"
        },
        "link": [
          {
            "@_fa": "true",
            "@rel": "self",
            "@href": "https://api.elsevier.com/content/article/pii/S2095495621000310"
          },
          {
            "@_fa": "true",
            "@rel": "scidir",
            "@href": "https://www.sciencedirect.com/science/article/pii/S2095495621000310"
          }
        ],
        "dc:format": "application/json",
        "openaccessType": null,
        "pii": "S2095-4956(21)00031-0",
        "prism:volume": "60",
        "prism:publisher": "Science Press and Dalian Institute of Chemical Physics, Chinese Academy of Sciences. Published by ELSEVIER B.V. and Science Press.",
        "dc:title": "Interfacial assembly of two-dimensional MXenes",
        "prism:copyright": "© 2021 Science Press and Dalian Institute of Chemical Physics, Chinese Academy of Sciences. Published by ELSEVIER B.V. and Science Press. All rights reserved.",
        "openaccess": "0",
        "prism:issn": "20954956",
        "dcterms:subject": [
          {
            "@_fa": "true",
            "$": "Interfacial assembly"
          },
          {
            "@_fa": "true",
            "$": "MXene"
          },
          {
            "@_fa": "true",
            "$": "Interfacial tension"
          },
          {
            "@_fa": "true",
            "$": "Crosslinking"
          },
          {
            "@_fa": "true",
            "$": "Heterostructures"
          }
        ],
        "openaccessArticle": "false",
        "prism:publicationName": "Journal of Energy Chemistry",
        "openaccessSponsorType": null,
        "prism:pageRange": "417-434",
        "prism:endingPage": "434",
        "pubType": "rev",
        "prism:coverDisplayDate": "September 2021",
        "prism:doi": "10.1016/j.jechem.2020.12.036",
        "prism:startingPage": "417",
        "dc:identifier": "doi:10.1016/j.jechem.2020.12.036",
        "openaccessSponsorName": null
      },
      "objects": {
        "object": [
          {
            "@category": "standard",
            "@height": "605",
            "@width": "667",
            "@_fa": "true",
            "$": "https://api.elsevier.com/content/object/eid/1-s2.0-S2095495621000310-gr2.jpg?httpAccept=%2A%2F%2A",
            "@multimediatype": "JPEG image file",
            "@type": "IMAGE-DOWNSAMPLED",
            "@size": "158995",
            "@ref": "gr2",
            "@mimetype": "image/jpeg"
          },
          {
            "@category": "standard",
            "@height": "465",
            "@width": "774",
            "@_fa": "true",
            "$": "https://api.elsevier.com/content/object/eid/1-s2.0-S2095495621000310-gr3.jpg?httpAccept=%2A%2F%2A",
            "@multimediatype": "JPEG image file",
            "@type": "IMAGE-DOWNSAMPLED",
            "@size": "120831",
            "@ref": "gr3",
            "@mimetype": "image/jpeg"
          },
          {
            "@category": "standard",
            "@height": "496",
            "@width": "774",
            "@_fa": "true",
            "$": "https://api.elsevier.com/content/object/eid/1-s2.0-S2095495621000310-gr4.jpg?httpAccept=%2A%2F%2A",
            "@multimediatype": "JPEG image file",
            "@type": "IMAGE-DOWNSAMPLED",
            "@size": "132102",
            "@ref": "gr4",
            "@mimetype": "image/jpeg"
          },
          {
            "@category": "standard",
            "@height": "416",
            "@width": "774",
            "@_fa": "true",
            "$": "https://api.elsevier.com/content/object/eid/1-s2.0-S2095495621000310-gr5.jpg?httpAccept=%2A%2F%2A",
            "@multimediatype": "JPEG image file",
            "@type": "IMAGE-DOWNSAMPLED",
            "@size": "99966",
            "@ref": "gr5",
            "@mimetype": "image/jpeg"
          },
          {
            "@category": "standard",
            "@height": "491",
            "@width": "774",
            "@_fa": "true",
            "$": "https://api.elsevier.com/content/object/eid/1-s2.0-S2095495621000310-gr6.jpg?httpAccept=%2A%2F%2A",
            "@multimediatype": "JPEG image file",
            "@type": "IMAGE-DOWNSAMPLED",
            "@size": "146014",
            "@ref": "gr6",
            "@mimetype": "image/jpeg"
          },
          {
            "@category": "standard",
            "@height": "430",
            "@width": "711",
            "@_fa": "true",
            "$": "https://api.elsevier.com/content/object/eid/1-s2.0-S2095495621000310-gr7.jpg?httpAccept=%2A%2F%2A",
            "@multimediatype": "JPEG image file",
            "@type": "IMAGE-DOWNSAMPLED",
            "@size": "89893",
            "@ref": "gr7",
            "@mimetype": "image/jpeg"
          },
          {
            "@category": "standard",
            "@height": "374",
            "@width": "373",
            "@_fa": "true",
            "$": "https://api.elsevier.com/content/object/eid/1-s2.0-S2095495621000310-gr8.jpg?httpAccept=%2A%2F%2A",
            "@multimediatype": "JPEG image file",
            "@type": "IMAGE-DOWNSAMPLED",
            "@size": "48375",
            "@ref": "gr8",
            "@mimetype": "image/jpeg"
          },
          {
            "@category": "standard",
            "@height": "361",
            "@width": "774",
            "@_fa": "true",
            "$": "https://api.elsevier.com/content/object/eid/1-s2.0-S2095495621000310-gr9.jpg?httpAccept=%2A%2F%2A",
            "@multimediatype": "JPEG image file",
            "@type": "IMAGE-DOWNSAMPLED",
            "@size": "100284",
            "@ref": "gr9",
            "@mimetype": "image/jpeg"
          },
          {
            "@category": "standard",
            "@height": "172",
            "@width": "500",
            "@_fa": "true",
            "$": "https://api.elsevier.com/content/object/eid/1-s2.0-S2095495621000310-ga1.jpg?httpAccept=%2A%2F%2A",
            "@multimediatype": "JPEG image file",
            "@type": "IMAGE-DOWNSAMPLED",
            "@size": "38694",
            "@ref": "ga1",
            "@mimetype": "image/jpeg"
          },
          {
            "@category": "standard",
            "@height": "360",
            "@width": "373",
            "@_fa": "true",
            "$": "https://api.elsevier.com/content/object/eid/1-s2.0-S2095495621000310-gr1.jpg?httpAccept=%2A%2F%2A",
            "@multimediatype": "JPEG image file",
            "@type": "IMAGE-DOWNSAMPLED",
            "@size": "44804",
            "@ref": "gr1",
            "@mimetype": "image/jpeg"
          },
          {
            "@category": "thumbnail",
            "@height": "164",
            "@width": "181",
            "@_fa": "true",
            "$": "https://api.elsevier.com/content/object/eid/1-s2.0-S2095495621000310-gr2.sml?httpAccept=%2A%2F%2A",
            "@multimediatype": "GIF image file",
            "@type": "IMAGE-THUMBNAIL",
            "@size": "19098",
            "@ref": "gr2",
            "@mimetype": "image/gif"
          },
          {
            "@category": "thumbnail",
            "@height": "132",
            "@width": "219",
            "@_fa": "true",
            "$": "https://api.elsevier.com/content/object/eid/1-s2.0-S2095495621000310-gr3.sml?httpAccept=%2A%2F%2A",
            "@multimediatype": "GIF image file",
            "@type": "IMAGE-THUMBNAIL",
            "@size": "16872",
            "@ref": "gr3",
            "@mimetype": "image/gif"
          },
          {
            "@category": "thumbnail",
            "@height": "140",
            "@width": "219",
            "@_fa": "true",
            "$": "https://api.elsevier.com/content/object/eid/1-s2.0-S2095495621000310-gr4.sml?httpAccept=%2A%2F%2A",
            "@multimediatype": "GIF image file",
            "@type": "IMAGE-THUMBNAIL",
            "@size": "18043",
            "@ref": "gr4",
            "@mimetype": "image/gif"
          },
          {
            "@category": "thumbnail",
            "@height": "118",
            "@width": "219",
            "@_fa": "true",
            "$": "https://api.elsevier.com/content/object/eid/1-s2.0-S2095495621000310-gr5.sml?httpAccept=%2A%2F%2A",
            "@multimediatype": "GIF image file",
            "@type": "IMAGE-THUMBNAIL",
            "@size": "11518",
            "@ref": "gr5",
            "@mimetype": "image/gif"
          },
          {
            "@category": "thumbnail",
            "@height": "139",
            "@width": "219",
            "@_fa": "true",
            "$": "https://api.elsevier.com/content/object/eid/1-s2.0-S2095495621000310-gr6.sml?httpAccept=%2A%2F%2A",
            "@multimediatype": "GIF image file",
            "@type": "IMAGE-THUMBNAIL",
            "@size": "18160",
            "@ref": "gr6",
            "@mimetype": "image/gif"
          },
          {
            "@category": "thumbnail",
            "@height": "133",
            "@width": "219",
            "@_fa": "true",
            "$": "https://api.elsevier.com/content/object/eid/1-s2.0-S2095495621000310-gr7.sml?httpAccept=%2A%2F%2A",
            "@multimediatype": "GIF image file",
            "@type": "IMAGE-THUMBNAIL",
            "@size": "15694",
            "@ref": "gr7",
            "@mimetype": "image/gif"
          },
          {
            "@category": "thumbnail",
            "@height": "163",
            "@width": "163",
            "@_fa": "true",
            "$": "https://api.elsevier.com/content/object/eid/1-s2.0-S2095495621000310-gr8.sml?httpAccept=%2A%2F%2A",
            "@multimediatype": "GIF image file",
            "@type": "IMAGE-THUMBNAIL",
            "@size": "13780",
            "@ref": "gr8",
            "@mimetype": "image/gif"
          },
          {
            "@category": "thumbnail",
            "@height": "102",
            "@width": "219",
            "@_fa": "true",
            "$": "https://api.elsevier.com/content/object/eid/1-s2.0-S2095495621000310-gr9.sml?httpAccept=%2A%2F%2A",
            "@multimediatype": "GIF image file",
            "@type": "IMAGE-THUMBNAIL",
            "@size": "12304",
            "@ref": "gr9",
            "@mimetype": "image/gif"
          },
          {
            "@category": "thumbnail",
            "@height": "75",
            "@width": "219",
            "@_fa": "true",
            "$": "https://api.elsevier.com/content/object/eid/1-s2.0-S2095495621000310-ga1.sml?httpAccept=%2A%2F%2A",
            "@multimediatype": "GIF image file",
            "@type": "IMAGE-THUMBNAIL",
            "@size": "13170",
            "@ref": "ga1",
            "@mimetype": "image/gif"
          },
          {
            "@category": "thumbnail",
            "@height": "164",
            "@width": "170",
            "@_fa": "true",
            "$": "https://api.elsevier.com/content/object/eid/1-s2.0-S2095495621000310-gr1.sml?httpAccept=%2A%2F%2A",
            "@multimediatype": "GIF image file",
            "@type": "IMAGE-THUMBNAIL",
            "@size": "17763",
            "@ref": "gr1",
            "@mimetype": "image/gif"
          },
          {
            "@category": "high",
            "@height": "2677",
            "@width": "2953",
            "@_fa": "true",
            "$": "https://api.elsevier.com/content/object/eid/1-s2.0-S2095495621000310-gr2_lrg.jpg?httpAccept=%2A%2F%2A",
            "@multimediatype": "JPEG image file",
            "@type": "IMAGE-HIGH-RES",
            "@size": "1061774",
            "@ref": "gr2",
            "@mimetype": "image/jpeg"
          },
          {
            "@category": "high",
            "@height": "2059",
            "@width": "3425",
            "@_fa": "true",
            "$": "https://api.elsevier.com/content/object/eid/1-s2.0-S2095495621000310-gr3_lrg.jpg?httpAccept=%2A%2F%2A",
            "@multimediatype": "JPEG image file",
            "@type": "IMAGE-HIGH-RES",
            "@size": "746108",
            "@ref": "gr3",
            "@mimetype": "image/jpeg"
          },
          {
            "@category": "high",
            "@height": "2193",
            "@width": "3425",
            "@_fa": "true",
            "$": "https://api.elsevier.com/content/object/eid/1-s2.0-S2095495621000310-gr4_lrg.jpg?httpAccept=%2A%2F%2A",
            "@multimediatype": "JPEG image file",
            "@type": "IMAGE-HIGH-RES",
            "@size": "815616",
            "@ref": "gr4",
            "@mimetype": "image/jpeg"
          },
          {
            "@category": "high",
            "@height": "1842",
            "@width": "3425",
            "@_fa": "true",
            "$": "https://api.elsevier.com/content/object/eid/1-s2.0-S2095495621000310-gr5_lrg.jpg?httpAccept=%2A%2F%2A",
            "@multimediatype": "JPEG image file",
            "@type": "IMAGE-HIGH-RES",
            "@size": "594414",
            "@ref": "gr5",
            "@mimetype": "image/jpeg"
          },
          {
            "@category": "high",
            "@height": "2171",
            "@width": "3425",
            "@_fa": "true",
            "$": "https://api.elsevier.com/content/object/eid/1-s2.0-S2095495621000310-gr6_lrg.jpg?httpAccept=%2A%2F%2A",
            "@multimediatype": "JPEG image file",
            "@type": "IMAGE-HIGH-RES",
            "@size": "960531",
            "@ref": "gr6",
            "@mimetype": "image/jpeg"
          },
          {
            "@category": "high",
            "@height": "1907",
            "@width": "3150",
            "@_fa": "true",
            "$": "https://api.elsevier.com/content/object/eid/1-s2.0-S2095495621000310-gr7_lrg.jpg?httpAccept=%2A%2F%2A",
            "@multimediatype": "JPEG image file",
            "@type": "IMAGE-HIGH-RES",
            "@size": "535302",
            "@ref": "gr7",
            "@mimetype": "image/jpeg"
          },
          {
            "@category": "high",
            "@height": "1659",
            "@width": "1654",
            "@_fa": "true",
            "$": "https://api.elsevier.com/content/object/eid/1-s2.0-S2095495621000310-gr8_lrg.jpg?httpAccept=%2A%2F%2A",
            "@multimediatype": "JPEG image file",
            "@type": "IMAGE-HIGH-RES",
            "@size": "333835",
            "@ref": "gr8",
            "@mimetype": "image/jpeg"
          },
          {
            "@category": "high",
            "@height": "1596",
            "@width": "3425",
            "@_fa": "true",
            "$": "https://api.elsevier.com/content/object/eid/1-s2.0-S2095495621000310-gr9_lrg.jpg?httpAccept=%2A%2F%2A",
            "@multimediatype": "JPEG image file",
            "@type": "IMAGE-HIGH-RES",
            "@size": "659665",
            "@ref": "gr9",
            "@mimetype": "image/jpeg"
          },
          {
            "@category": "high",
            "@height": "760",
            "@width": "2213",
            "@_fa": "true",
            "$": "https://api.elsevier.com/content/object/eid/1-s2.0-S2095495621000310-ga1_lrg.jpg?httpAccept=%2A%2F%2A",
            "@multimediatype": "JPEG image file",
            "@type": "IMAGE-HIGH-RES",
            "@size": "242077",
            "@ref": "ga1",
            "@mimetype": "image/jpeg"
          },
          {
            "@category": "high",
            "@height": "1596",
            "@width": "1654",
            "@_fa": "true",
            "$": "https://api.elsevier.com/content/object/eid/1-s2.0-S2095495621000310-gr1_lrg.jpg?httpAccept=%2A%2F%2A",
            "@multimediatype": "JPEG image file",
            "@type": "IMAGE-HIGH-RES",
            "@size": "319644",
            "@ref": "gr1",
            "@mimetype": "image/jpeg"
          },
          {
            "@category": "standard",
            "@_fa": "true",
            "$": "https://api.elsevier.com/content/object/eid/1-s2.0-S2095495621000310-am.pdf?httpAccept=%2A%2F%2A",
            "@multimediatype": "Acrobat PDF file",
            "@type": "AAM-PDF",
            "@size": "2342893",
            "@ref": "am",
            "@mimetype": "application/pdf"
          }
        ]
      },
      "link": {
        "@rel": "abstract",
        "@href": "https://api.elsevier.com/content/abstract/scopus_id/85101804953"
      }
    }
  }
}