{
  "metadata": {
    "title": "Enhancing MXene-based supercapacitors: Role of synthesis and 3D architectures",
    "authors": "; ; ",
    "journal": "Journal of Energy Chemistry",
    "date": "2024-04-30",
    "doi": "10.1016/j.jechem.2023.11.020",
    "abstract": "",
    "uri": "https://api.elsevier.com/content/article/pii/S2095495623006666",
    "pii": "S2095495623006666"
  },
  "fulltext": {
    "full-text-retrieval-response": {
      "scopus-eid": "2-s2.0-85181166272",
      "originalText": "serial JL 286353 291210 291711 291744 291809 31 Journal of Energy Chemistry JOURNALENERGYCHEMISTRY 2023-11-25 2023-11-25 2023-12-30 2023-12-30 2024-03-22T15:56:53 1-s2.0-S2095495623006666 S2095-4956(23)00666-6 S2095495623006666 10.1016/j.jechem.2023.11.020 S300 S300.1 FULL-TEXT 1-s2.0-S2095495623X0014X 2024-03-22T16:10:16.869606Z 0 0 20240401 20240430 2024 2023-11-26T00:45:09.335124Z absattachment articleinfo articletitlenorm authfirstinitialnorm authfirstsurnamenorm cid cids contenttype copyright crossmark dateloaded dateloadedtxt datesearch datesort dateupdated dco docsubtype doctype doi eid ewtransactionid hubeid indexeddate issn issnnorm itemstage itemtransactionid itemweight openaccess openarchive pg pgfirst pglast pii piinorm pubdateend pubdatestart pubdatetxt pubyr sortorder srctitle srctitlenorm srctype ssids alllist content subj subheadings suppl tomb volfirst volissue volumelist webpdf webpdfpagecount yearnav figure e-component body acknowledge affil appendices articletitle auth authfirstini authfull authkeywords authlast grantnumber grantsponsor grantsponsorid primabst pubtype ref specialabst vitae 2095-4956 20954956 false 91 91 C Volume 91 1 1 26 1 26 202404 April 2024 2024-04-01 2024-04-30 2024 article rev © 2023 Science Press and Dalian Institute of Chemical Physics, Chinese Academy of Sciences. Published by ELSEVIER B.V. and Science Press. All rights reserved. ENHANCINGMXENEBASEDSUPERCAPACITORSROLESYNTHESIS3DARCHITECTURES POH W 1 Introduction 2 Charge storage mechanism of MXene-based supercapacitors 3 2D MXene synthesis techniques 3.1 Conventional approaches 3.2 Emerging approaches 3.3 Innovative approaches 4 Fundamental design of 2D MXene 4.1 MAX phase precursors 4.2 Synthesis conditions 5 Revolutionary architecturing of 3D MXene 5.1 Unidimensional architecturing 5.1.1 Self-assembly 5.1.2 Templating methods 5.2 Multidimensional architecturing 6 Summary, challenges and future perspective Acknowledgments Appendix A Supplementary material References LIU 2021 18931 18973 S LIU 2021 2004689 S LI 2022 2107226 M YANG 2022 2109479 X LIU 2022 2104507 S LIU 2020 167 177 S FU 2021 2006054 B LUKATSKAYA 2017 17105 M MATHIS 2021 6420 6429 T HUANG 2021 21347 21356 Y ZHOU 2020 2077 T LI 2020 147214 Q NATU 2018 27745 27753 V ZHAO 2020 246 257 R LIBICH 2018 224 227 J KARTHIKEYAN 2021 3984 3988 S WANG 2016 225 255 H AUGUSTYN 2014 1597 1614 V LIU 2019 1806778 L MAJUMDAR 2021 114825 D ANDO 2020 2000820 Y PATRA 2023 e411 A VAHIDMOHAMMADI 2019 1806931 A LI 2020 306 322 J KARKUZHALI 2022 122727 R TOMAR 2022 86 95 A BERGMAN 2023 2203154 G JALALI 2021 922 929 H SUGAHARA 2019 1 7 A LUKATSKAYA 2013 1502 1505 M JOHNSON 2022 e202200555 D MU 2019 1902953 X SHAO 2019 456 461 H KAMAJA 2022 703 709 C JIANG 2018 1703043 Q TANG 2019 17849 17855 J LORENCOVA 2017 471 479 L LIANG 2021 10335 10344 W HU 2019 6899 6905 M CHATTERJEE 2021 15880 15918 D LIM 2014 8968 8978 E ABBASI 2021 8395 8465 N WANG 2021 106242 X MAHMOOD 2022 19314 19323 M LI 2020 1906851 K XIAO 2017 2180 2186 X ZHANG 2017 034002 F GOGOTSI 2015 1079 1080 Y WANG 2023 1242 1247 D GENG 2017 1700072 D XU 2015 1135 1141 C SHUCK 2020 1901241 C JOLLY 2021 100139 S LIU 2020 6934 6939 A GHOSH 2012 47 80 N ADVANCESINSCIENCETECHNOLOGYMN1AXNPHASES 3CONSOLIDATIONSYNTHESISMAXPHASESBYSPARKPLASMASINTERINGSPSAREVIEW NAGUIB 2014 992 1005 M NAGUIB 2011 4248 4253 M GHIDIU 2014 9517 9520 M NAGUIB 2013 15966 15969 M NAGUIB 2012 1322 1331 M ZHOU 2016 5008 5013 J GHIDIU 2014 78 81 M ALHABEB 2017 7633 7644 M HOPE 2016 5099 5102 M KAJIYAMA 2017 1601873 S ZHAN 2018 1223 1228 C ZHANG 2021 4384 4390 G YAHAYA 2022 104520 M RESHAK 2013 327 332 A ANASORI 2017 1 17 B NAN 2021 1902085 J LI 2018 6115 6119 T XUAN 2016 14789 14794 J ZHANG 2017 4848 4856 C ZOU 2017 12219 12229 G URBANKOWSKI 2016 11385 11391 P LI 2019 4730 4737 M WU 2022 153380 Q SHI 2021 8689 8693 H JAWAID 2021 2771 2777 A CHEN 2022 2461 2470 J SONG 2020 2001546 M SUN 2017 21663 21668 W HEIDARPOUR 2022 11466 11474 A YANG 2018 15717 15721 S HAN 2019 8443 8452 F ZHANG 2022 120718 L PANG 2019 9610 9616 S ZHAO 2015 4810 4814 M MEI 2020 125111 J CHAN 2021 105417 Y PRIYA 2021 N ZADA 2020 6601 6606 S HUSMANN 2020 11082 11085 S MEI 2020 e00156 J GHAZALY 2021 4287 4293 A SHAO 2020 2873 2880 H DEYSHER 2020 204 217 G LI 2022 134578 Y HALIM 2021 311 319 J ZHANG 2020 2025 2032 F MESHKIAN 2018 1706409 R ZHANG 2018 045004 N SHUCK 2019 3368 3376 C SYAMSAI 2021 688 R HAKIM 2023 106662 M WANG 2023 170128 Q GANDLA 2022 7190 7198 D XIAO 2023 233 240 J SU 2018 32 39 X SEREDYCH 2019 3324 3332 M FATHEEMA 2022 255 283 J METALOXIDECARBONHYBRIDMATERIALS TWODIMENSIONALTRANSITIONMETALCARBIDEMXENEFORENHANCEDENERGYSTORAGE ZHU 2019 11 18 K ANAYEE 2020 6090 6093 M WANG 2020 233 240 X RAJAVEL 2018 095605 K BABAR 2020 25669 25678 Z PERSSON 2018 1703676 I KUMAR 1845 41837 141834 S LEE 2021 161304 J MIAO 2021 243 250 J ZHANG 2021 417 434 C WANG 2021 57 66 J TU 2021 2101374 T SHANG 2019 1903960 T MA 2021 126694 L DENG 2019 1902432 Y YANG 2021 2101087 X VENKATESHALU 2020 17983 17992 S GUAN 2020 025010 Y WANG 2019 414 421 X DING 2022 136255 Y NIU 2020 105 113 H WU 2021 2102874 Z DUTTA 2022 2204622 P BORCHARDT 2018 1800892 L GAO 2022 114605 G ZHANG 2019 315 321 X HUANG 2022 2200829 X ZHAO 2018 11193 11202 S ZHAO 2020 855 865 X MA 2018 3634 3643 Z KONG 2020 2266 2274 J ZHANG 2020 2000922 P HUANG 2021 2101664 X FAN 2018 9642 9652 Z GUO 2022 114590 T LI 2020 104971 K LV 2022 2202203 K MA 2022 R YAO 2020 124057 M ZHU 2020 104734 Y MA 2022 9713 9727 R IBRAGIMOVA 2022 2896 2906 R XIA 2019 23330 23337 F YANG 2022 2699 2710 C WANG 2021 128767 F YANG 2020 18 25 Z YU 2020 229075 X ORANGI 2020 640 650 J YANG 2019 1902725 W LI 2020 1903794 X TETIK 2022 2104980 H ABDOLHOSSEINZADEH 2020 2000716 S YUAN 2023 138686 M ZHANG 2019 1795 C YU 2019 1901839 L YOON 2018 1703173 Y PENG 2021 101911 X JAIN 2020 388 396 S REGEHLY 2020 620 624 M LI 2022 2111030 H CHEN 2023 108147 N ZHANG 2020 1247 1254 S CHEN 2023 113031 Z LI 2021 385 398 Y MASHTALIR 2013 147 152 O LAKHE 2019 1570 1579 P CAO 2022 2107554 F IQBAL 2021 9 A LIAO 2021 2103960 L ZHANG 2020 2001093 J POHX2024X1 POHX2024X1X26 POHX2024X1XW POHX2024X1X26XW 2025-12-30T00:00:00.000Z 2025-12-30T00:00:00.000Z http://creativecommons.org/licenses/by-nc-nd/4.0/ © 2023 Science Press and Dalian Institute of Chemical Physics, Chinese Academy of Sciences. Published by ELSEVIER B.V. and Science Press. All rights reserved. 2024-01-06T05:02:46.834Z http://vtw.elsevier.com/data/voc/AddOnTypes/50.7/aggregated-refined Xiamen University Malaysia XMUMRF/2023-C11/IENG/0056 Ministry of Higher Education Malaysia FRGS/1/2021/STG04/XMU/02/1 FRGS/1/2022/TK09/XMU/03/2 MOHE Ministry of Higher Education, Malaysia http://data.elsevier.com/vocabulary/SciValFunders/501100003093 http://sws.geonames.org/1733045/ This work was supported by the Fundamental Research Grant Scheme by Ministry of Higher Education Malaysia ( FRGS/1/2021/STG04/XMU/02/1 and FRGS/1/2022/TK09/XMU/03/2 ), and the Xiamen University Malaysia Research Fund ( XMUMRF/2023-C11/IENG/0056 ). item S2095-4956(23)00666-6 S2095495623006666 1-s2.0-S2095495623006666 10.1016/j.jechem.2023.11.020 286353 2024-03-22T16:10:16.869606Z 2024-04-01 2024-04-30 1-s2.0-S2095495623006666-main.pdf https://s3-eu-west-1.amazonaws.com/prod-ucs-content-store-eu-west/content/pii:S2095495623006666/STRIPIN/application/pdf/c50a31ac647a943093487f769cbf4876/main.pdf main.pdf pdf true 7785323 MAIN 26 1-s2.0-S2095495623006666-main_1.png https://s3-eu-west-1.amazonaws.com/prod-ucs-content-store-eu-west/content/pii:S2095495623006666/PREVIEW/image/png/76b54905760f33023eec60aee54ff2ba/main_1.png main_1.png png 60029 849 656 IMAGE-WEB-PDF 1 1-s2.0-S2095495623006666-fx1.jpg https://s3-eu-west-1.amazonaws.com/prod-ucs-content-store-eu-west/content/pii:S2095495623006666/fx1/DOWNSAMPLED/image/jpeg/30efe5b7aa55f048725a933332664cf8/fx1.jpg fx1 fx1.jpg jpg 6214 154 111 IMAGE-DOWNSAMPLED 1-s2.0-S2095495623006666-fx2.jpg https://s3-eu-west-1.amazonaws.com/prod-ucs-content-store-eu-west/content/pii:S2095495623006666/fx2/DOWNSAMPLED/image/jpeg/d61bfae768c5fe3f5e2065edc55849f4/fx2.jpg fx2 fx2.jpg jpg 5264 155 111 IMAGE-DOWNSAMPLED 1-s2.0-S2095495623006666-fx3.jpg https://s3-eu-west-1.amazonaws.com/prod-ucs-content-store-eu-west/content/pii:S2095495623006666/fx3/DOWNSAMPLED/image/jpeg/0648236e4039634b1645529cc7a76eef/fx3.jpg fx3 fx3.jpg jpg 6543 155 111 IMAGE-DOWNSAMPLED 1-s2.0-S2095495623006666-fx4.jpg https://s3-eu-west-1.amazonaws.com/prod-ucs-content-store-eu-west/content/pii:S2095495623006666/fx4/DOWNSAMPLED/image/jpeg/4763f5e2ee472660c3097e0e5eae6017/fx4.jpg fx4 fx4.jpg jpg 6424 155 111 IMAGE-DOWNSAMPLED 1-s2.0-S2095495623006666-fx5.jpg https://s3-eu-west-1.amazonaws.com/prod-ucs-content-store-eu-west/content/pii:S2095495623006666/fx5/DOWNSAMPLED/image/jpeg/ef1afc44c7beb5df7d9d38e32305278c/fx5.jpg fx5 fx5.jpg jpg 5958 155 111 IMAGE-DOWNSAMPLED 1-s2.0-S2095495623006666-ga1.jpg https://s3-eu-west-1.amazonaws.com/prod-ucs-content-store-eu-west/content/pii:S2095495623006666/ga1/DOWNSAMPLED/image/jpeg/0323ab786bbaa9e46e898084e3829654/ga1.jpg ga1 true ga1.jpg jpg 26004 200 400 IMAGE-DOWNSAMPLED 1-s2.0-S2095495623006666-gr1.jpg https://s3-eu-west-1.amazonaws.com/prod-ucs-content-store-eu-west/content/pii:S2095495623006666/gr1/DOWNSAMPLED/image/jpeg/6136c061c1f9a54d0d1cb88f5ad67bdd/gr1.jpg gr1 gr1.jpg jpg 113712 613 679 IMAGE-DOWNSAMPLED 1-s2.0-S2095495623006666-gr10.jpg https://s3-eu-west-1.amazonaws.com/prod-ucs-content-store-eu-west/content/pii:S2095495623006666/gr10/DOWNSAMPLED/image/jpeg/fe28d3c55b0ede71daa1b620e9a4d645/gr10.jpg gr10 gr10.jpg jpg 217234 974 650 IMAGE-DOWNSAMPLED 1-s2.0-S2095495623006666-gr2.jpg https://s3-eu-west-1.amazonaws.com/prod-ucs-content-store-eu-west/content/pii:S2095495623006666/gr2/DOWNSAMPLED/image/jpeg/dace4525fe5789efb8dba06466296c14/gr2.jpg gr2 gr2.jpg jpg 80330 486 542 IMAGE-DOWNSAMPLED 1-s2.0-S2095495623006666-gr3.jpg https://s3-eu-west-1.amazonaws.com/prod-ucs-content-store-eu-west/content/pii:S2095495623006666/gr3/DOWNSAMPLED/image/jpeg/453c0ce882e8cefc90eac705418d5636/gr3.jpg gr3 gr3.jpg jpg 22794 216 343 IMAGE-DOWNSAMPLED 1-s2.0-S2095495623006666-gr4.jpg https://s3-eu-west-1.amazonaws.com/prod-ucs-content-store-eu-west/content/pii:S2095495623006666/gr4/DOWNSAMPLED/image/jpeg/151246eaeb227add4228f0486497788f/gr4.jpg gr4 gr4.jpg jpg 31864 295 355 IMAGE-DOWNSAMPLED 1-s2.0-S2095495623006666-gr5.jpg https://s3-eu-west-1.amazonaws.com/prod-ucs-content-store-eu-west/content/pii:S2095495623006666/gr5/DOWNSAMPLED/image/jpeg/ae9bfeaf1de4936aea47f94f400a0b3e/gr5.jpg gr5 gr5.jpg jpg 218558 868 688 IMAGE-DOWNSAMPLED 1-s2.0-S2095495623006666-gr6.jpg https://s3-eu-west-1.amazonaws.com/prod-ucs-content-store-eu-west/content/pii:S2095495623006666/gr6/DOWNSAMPLED/image/jpeg/c7a8166e7d4a0845897be0a5e3bc46f7/gr6.jpg gr6 gr6.jpg jpg 142327 910 576 IMAGE-DOWNSAMPLED 1-s2.0-S2095495623006666-gr7.jpg https://s3-eu-west-1.amazonaws.com/prod-ucs-content-store-eu-west/content/pii:S2095495623006666/gr7/DOWNSAMPLED/image/jpeg/1f79f4ba2782f1fa8465158827977e57/gr7.jpg gr7 gr7.jpg jpg 202766 834 691 IMAGE-DOWNSAMPLED 1-s2.0-S2095495623006666-gr8.jpg https://s3-eu-west-1.amazonaws.com/prod-ucs-content-store-eu-west/content/pii:S2095495623006666/gr8/DOWNSAMPLED/image/jpeg/0141274dd8af596fd5d098b633f9fba3/gr8.jpg gr8 gr8.jpg jpg 179330 749 687 IMAGE-DOWNSAMPLED 1-s2.0-S2095495623006666-gr9.jpg https://s3-eu-west-1.amazonaws.com/prod-ucs-content-store-eu-west/content/pii:S2095495623006666/gr9/DOWNSAMPLED/image/jpeg/7353efaa169f17371c90b4f464f21292/gr9.jpg gr9 gr9.jpg jpg 227757 855 693 IMAGE-DOWNSAMPLED 1-s2.0-S2095495623006666-fx1.sml https://s3-eu-west-1.amazonaws.com/prod-ucs-content-store-eu-west/content/pii:S2095495623006666/fx1/THUMBNAIL/image/gif/ff9ff3f00c4b6a5bcfe07fc2d73cfcc4/fx1.sml fx1 fx1.sml sml 13059 164 118 IMAGE-THUMBNAIL 1-s2.0-S2095495623006666-fx2.sml https://s3-eu-west-1.amazonaws.com/prod-ucs-content-store-eu-west/content/pii:S2095495623006666/fx2/THUMBNAIL/image/gif/132deaf9156bf957ff314ae428218ec7/fx2.sml fx2 fx2.sml sml 14769 164 117 IMAGE-THUMBNAIL 1-s2.0-S2095495623006666-fx3.sml https://s3-eu-west-1.amazonaws.com/prod-ucs-content-store-eu-west/content/pii:S2095495623006666/fx3/DOWNSAMPLED/image/gif/e4876f62b81845f9c007f8a46ae60ccd/fx3.sml fx3 fx3.sml sml 15230 164 117 IMAGE-THUMBNAIL 1-s2.0-S2095495623006666-fx4.sml https://s3-eu-west-1.amazonaws.com/prod-ucs-content-store-eu-west/content/pii:S2095495623006666/fx4/THUMBNAIL/image/gif/2911d3e855b52b10cdb8899497aa81f4/fx4.sml fx4 fx4.sml sml 15007 164 117 IMAGE-THUMBNAIL 1-s2.0-S2095495623006666-fx5.sml https://s3-eu-west-1.amazonaws.com/prod-ucs-content-store-eu-west/content/pii:S2095495623006666/fx5/THUMBNAIL/image/gif/681888342f6b6a9be4f58c1d026904d5/fx5.sml fx5 fx5.sml sml 13652 164 117 IMAGE-THUMBNAIL 1-s2.0-S2095495623006666-ga1.sml https://s3-eu-west-1.amazonaws.com/prod-ucs-content-store-eu-west/content/pii:S2095495623006666/ga1/THUMBNAIL/image/gif/5c572f95f18c211f036a989555ab7b21/ga1.sml ga1 true ga1.sml sml 15408 110 219 IMAGE-THUMBNAIL 1-s2.0-S2095495623006666-gr1.sml https://s3-eu-west-1.amazonaws.com/prod-ucs-content-store-eu-west/content/pii:S2095495623006666/gr1/THUMBNAIL/image/gif/25a9be7466e5082fafebb095b239bddf/gr1.sml gr1 gr1.sml sml 14516 163 181 IMAGE-THUMBNAIL 1-s2.0-S2095495623006666-gr10.sml https://s3-eu-west-1.amazonaws.com/prod-ucs-content-store-eu-west/content/pii:S2095495623006666/gr10/THUMBNAIL/image/gif/9c38f83ad27b35ef79cec12577def546/gr10.sml gr10 gr10.sml sml 11612 163 109 IMAGE-THUMBNAIL 1-s2.0-S2095495623006666-gr2.sml https://s3-eu-west-1.amazonaws.com/prod-ucs-content-store-eu-west/content/pii:S2095495623006666/gr2/THUMBNAIL/image/gif/9f447a679a5b02a026091e9d417faa34/gr2.sml gr2 gr2.sml sml 13534 164 183 IMAGE-THUMBNAIL 1-s2.0-S2095495623006666-gr3.sml https://s3-eu-west-1.amazonaws.com/prod-ucs-content-store-eu-west/content/pii:S2095495623006666/gr3/THUMBNAIL/image/gif/51b1d342188dc92b37c7480a1e153fa2/gr3.sml gr3 gr3.sml sml 9190 138 219 IMAGE-THUMBNAIL 1-s2.0-S2095495623006666-gr4.sml https://s3-eu-west-1.amazonaws.com/prod-ucs-content-store-eu-west/content/pii:S2095495623006666/gr4/THUMBNAIL/image/gif/e76e69e8d96cc54cde314223ad90ca0a/gr4.sml gr4 gr4.sml sml 10241 164 197 IMAGE-THUMBNAIL 1-s2.0-S2095495623006666-gr5.sml https://s3-eu-west-1.amazonaws.com/prod-ucs-content-store-eu-west/content/pii:S2095495623006666/gr5/THUMBNAIL/image/gif/2bb1123892d7fbee7dafddd49279ac4e/gr5.sml gr5 gr5.sml sml 15926 164 130 IMAGE-THUMBNAIL 1-s2.0-S2095495623006666-gr6.sml https://s3-eu-west-1.amazonaws.com/prod-ucs-content-store-eu-west/content/pii:S2095495623006666/gr6/THUMBNAIL/image/gif/ccfe93ceae4d2916a558d2e860f5b212/gr6.sml gr6 gr6.sml sml 8547 163 103 IMAGE-THUMBNAIL 1-s2.0-S2095495623006666-gr7.sml https://s3-eu-west-1.amazonaws.com/prod-ucs-content-store-eu-west/content/pii:S2095495623006666/gr7/THUMBNAIL/image/gif/aa73474149a36ef3559761a639ed7fb8/gr7.sml gr7 gr7.sml sml 14264 164 136 IMAGE-THUMBNAIL 1-s2.0-S2095495623006666-gr8.sml https://s3-eu-west-1.amazonaws.com/prod-ucs-content-store-eu-west/content/pii:S2095495623006666/gr8/THUMBNAIL/image/gif/36d88dba2a12f02845d62117e31a3259/gr8.sml gr8 gr8.sml sml 13796 164 150 IMAGE-THUMBNAIL 1-s2.0-S2095495623006666-gr9.sml https://s3-eu-west-1.amazonaws.com/prod-ucs-content-store-eu-west/content/pii:S2095495623006666/gr9/THUMBNAIL/image/gif/c484588b7249f0b514214686ff1d4a65/gr9.sml gr9 gr9.sml sml 15543 164 133 IMAGE-THUMBNAIL 1-s2.0-S2095495623006666-fx1_lrg.jpg https://s3-eu-west-1.amazonaws.com/prod-ucs-content-store-eu-west/content/pii:S2095495623006666/HIGHRES/image/jpeg/58853f945a10b36463bee6fab30e6cf8/fx1_lrg.jpg fx1 fx1_lrg.jpg jpg 19361 410 295 IMAGE-HIGH-RES 1-s2.0-S2095495623006666-fx2_lrg.jpg https://s3-eu-west-1.amazonaws.com/prod-ucs-content-store-eu-west/content/pii:S2095495623006666/HIGHRES/image/jpeg/2f6fea49f35f05baaa066ea61d73bd74/fx2_lrg.jpg fx2 fx2_lrg.jpg jpg 17650 413 295 IMAGE-HIGH-RES 1-s2.0-S2095495623006666-fx3_lrg.jpg https://s3-eu-west-1.amazonaws.com/prod-ucs-content-store-eu-west/content/pii:S2095495623006666/HIGHRES/image/jpeg/66b710deaa621a8df270e468f5f4ac56/fx3_lrg.jpg fx3 fx3_lrg.jpg jpg 20882 413 295 IMAGE-HIGH-RES 1-s2.0-S2095495623006666-fx4_lrg.jpg https://s3-eu-west-1.amazonaws.com/prod-ucs-content-store-eu-west/content/pii:S2095495623006666/DOWNSAMPLED/image/jpeg/e19202adf8dbaaa6a35911abe610c6e6/fx4_lrg.jpg fx4 fx4_lrg.jpg jpg 19686 413 295 IMAGE-HIGH-RES 1-s2.0-S2095495623006666-fx5_lrg.jpg https://s3-eu-west-1.amazonaws.com/prod-ucs-content-store-eu-west/content/pii:S2095495623006666/HIGHRES/image/jpeg/04a5d23af027e8b19b91cfd0cdcf5eb0/fx5_lrg.jpg fx5 fx5_lrg.jpg jpg 16134 413 295 IMAGE-HIGH-RES 1-s2.0-S2095495623006666-ga1_lrg.jpg https://s3-eu-west-1.amazonaws.com/prod-ucs-content-store-eu-west/content/pii:S2095495623006666/HIGHRES/image/jpeg/71636604f4d503ce67a069157ad18e98/ga1_lrg.jpg ga1 true ga1_lrg.jpg jpg 92031 531 1062 IMAGE-HIGH-RES 1-s2.0-S2095495623006666-gr1_lrg.jpg https://s3-eu-west-1.amazonaws.com/prod-ucs-content-store-eu-west/content/pii:S2095495623006666/HIGHRES/image/jpeg/08fba4ca706a95a1411fc7c584160a0c/gr1_lrg.jpg gr1 gr1_lrg.jpg jpg 733488 2713 3005 IMAGE-HIGH-RES 1-s2.0-S2095495623006666-gr10_lrg.jpg https://s3-eu-west-1.amazonaws.com/prod-ucs-content-store-eu-west/content/pii:S2095495623006666/HIGHRES/image/jpeg/6caecd922d694aa22ea3b29742d76422/gr10_lrg.jpg gr10 gr10_lrg.jpg jpg 1582126 4311 2878 IMAGE-HIGH-RES 1-s2.0-S2095495623006666-gr2_lrg.jpg https://s3-eu-west-1.amazonaws.com/prod-ucs-content-store-eu-west/content/pii:S2095495623006666/HIGHRES/image/jpeg/c49abd1813fa16c9e8d839012a4f9342/gr2_lrg.jpg gr2 gr2_lrg.jpg jpg 566682 2155 2402 IMAGE-HIGH-RES 1-s2.0-S2095495623006666-gr3_lrg.jpg https://s3-eu-west-1.amazonaws.com/prod-ucs-content-store-eu-west/content/pii:S2095495623006666/MAIN/image/jpeg/4366c0227ae68b32a9cd2774940d629c/gr3_lrg.jpg gr3 gr3_lrg.jpg jpg 148926 960 1521 IMAGE-HIGH-RES 1-s2.0-S2095495623006666-gr4_lrg.jpg https://s3-eu-west-1.amazonaws.com/prod-ucs-content-store-eu-west/content/pii:S2095495623006666/HIGHRES/image/jpeg/95181c9e141dabf13a151b7a484c6db7/gr4_lrg.jpg gr4 gr4_lrg.jpg jpg 211612 1308 1574 IMAGE-HIGH-RES 1-s2.0-S2095495623006666-gr5_lrg.jpg https://s3-eu-west-1.amazonaws.com/prod-ucs-content-store-eu-west/content/pii:S2095495623006666/HIGHRES/image/jpeg/577796af898b49d4f8e9f7291f0e4f51/gr5_lrg.jpg gr5 gr5_lrg.jpg jpg 1632814 3843 3045 IMAGE-HIGH-RES 1-s2.0-S2095495623006666-gr6_lrg.jpg https://s3-eu-west-1.amazonaws.com/prod-ucs-content-store-eu-west/content/pii:S2095495623006666/HIGHRES/image/jpeg/be16fe2d3989a2ac3954dfbbd4b3346d/gr6_lrg.jpg gr6 gr6_lrg.jpg jpg 956910 4034 2552 IMAGE-HIGH-RES 1-s2.0-S2095495623006666-gr7_lrg.jpg https://s3-eu-west-1.amazonaws.com/prod-ucs-content-store-eu-west/content/pii:S2095495623006666/HIGHRES/image/jpeg/77718812517a307907c7421095962d7d/gr7_lrg.jpg gr7 gr7_lrg.jpg jpg 1501354 3692 3059 IMAGE-HIGH-RES 1-s2.0-S2095495623006666-gr8_lrg.jpg https://s3-eu-west-1.amazonaws.com/prod-ucs-content-store-eu-west/content/pii:S2095495623006666/HIGHRES/image/jpeg/2957731974bbbcbbcd809e55d837e3f7/gr8_lrg.jpg gr8 gr8_lrg.jpg jpg 1192375 3316 3041 IMAGE-HIGH-RES 1-s2.0-S2095495623006666-gr9_lrg.jpg https://s3-eu-west-1.amazonaws.com/prod-ucs-content-store-eu-west/content/pii:S2095495623006666/HIGHRES/image/jpeg/202fabfc96eb8d73daa6051b853b9646/gr9_lrg.jpg gr9 gr9_lrg.jpg jpg 1653173 3786 3067 IMAGE-HIGH-RES 1-s2.0-S2095495623006666-mmc1.docx https://s3-eu-west-1.amazonaws.com/prod-ucs-content-store-eu-west/content/pii:S2095495623006666/mmc1/MAIN/application/vnd.openxmlformats-officedocument.wordprocessingml.document/1ef6493575b9ee397140435b01cd0e6c/mmc1.docx mmc1 mmc1.docx docx 82750 APPLICATION 1-s2.0-S2095495623006666-am.pdf https://s3-eu-west-1.amazonaws.com/prod-ucs-content-store-eu-west/content/egi:10JHLNGSV9C/MAIN/application/pdf/3e68a38095b4c62b7eb6c4adef3b77a6/am.pdf am am.pdf pdf false 5674522 AAM-PDF JECHEM 3511 S2095-4956(23)00666-6 10.1016/j.jechem.2023.11.020 Science Press Fig. 1 (a) Schematic of hydrated ions induced EDLC; CV profiles of MXene electrode in NaOH, KOH, and LiOH (b), and K2SO4, Al2(SO4)3, and Al(NO3)3 (c) solutions at 20 mV s−1. Reproduced with permission from Ref. [30]. Copyright 2013, American Association for the Advancement of Science. Schematic of pseudocapacitance (d), volume fluctuation in MXene with changes in potential (e). Reproduced with permission from Ref. [32]. Copyright 2019, Wiley. CV profiles of MXene in various electrolytes (f). Reproduced with permission from Ref. [34]. Copyright 2022, American Chemical Society. Asymmetric MXene supercapacitor (g), CV profiles of CNT-HQ, Ti3C2Tx and the assembled hybrid supercapacitor at 20 mV s−1 (h). Reproduced with permission from Ref. [39]. Copyright 2021, American Chemical Society. (i) Specific capacitance of MoO3/MXene@CC versus MoO3@CC. Reproduced with permission from Ref. [44]. Copyright 2022, Elsevier. Fig. 2 Evolution of MXene synthesis techniques. Fig. 3 Fluoride-free etching techniques for supercapacitor-friendly MXene. Fig. 4 Innovative MXene etching techniques for potential supercapacitor application. Fig. 5 SEM images of Ti3AlC2 synthesized by graphite (a), TiC (b), and carbon lampblack (c) as carbon source. Reproduced with permission from Ref. [104]. Copyright 2019, American Chemical Society. XRD patterns of samples prepared at etching temperature 6 °C (d), 25 °C (e), 60 °C (f) under various etching time. SEM images of ball milled samples for 12 h, and then HF etching at 60 °C for 9 h (g), 12 h (h), and 24 h (i). Reproduced with permission from Ref. [110]. Copyright 2018, Elsevier. (j) Etching process of (Mo2/3Y1/3)2AlC with STEM image of (Mo2/3Y1/3)2AlC i-MAX with the illustrated structure model attached to next. Selective etching process for Al, forming (Mo2/3Y1/3)2C MXene (top); selective etching process Al and Y, forming Mo4/3C MXene (bottom). Reproduced with permission from Ref. [118]. Copyright 2018, Wiley 2018. Fig. 6 (a) Schematic of the preparation of Ti3C2Tx/GO hydrogel. Reproduced with permission from Ref. [125]. Copyright 2019, Wiley. (b) Ti3C2Tx@Chitosan film. Reproduced with permission from Ref. [132]. Copyright 2022, Elsevier 2022. (c) Ti3C2Tx, RAMX, and microgel film. Reproduced with permission from Ref. [134]. Copyright 2021, Wiley 2021. Fig. 7 (a) Structural modification induced by KOH treatment. Reproduced with permission from Ref. [143]. Copyright 2020, American Chemical Society 2020. (b) Ion transport pathways facilitated by addition of CNT spacers. Reproduced with permission from Ref. [144]. Copyright 2020, Wiley. (c) Generation of vertically aligned mesopore channels by unidirectional freezing. Reproduced with permission from Ref. [145]. Copyright 2021, Wiley. FESEM images of the generated structure from cross sectional view (d) and top view (e). Reproduced with permission from Ref. [145]. Copyright 2021, Wiley. Fig. 8 (a) CV curve comparison of pristine Ti3C2Tx film with the incorporation of various in-situ carbonized polymers. Reproduced with permission from Ref. [153]. Copyright 2022, American Chemical Society. (b) Capacitive contribution of respective films. Reproduced with permission from Ref. [153]. Copyright 2021, American Chemical Society. (c) Fabrication of nanoporous Ti3C2Tx film by intercalation of Fe(OH)3 nanoparticles. Reproduced with permission from Ref. [146]. Copyright 2021, Wiley. Comparison of cross-sectional structure between pristine Ti3C2Tx film (d) and as-fabricated nanoporous film (e). Reproduced with permission from Ref. [146]. Copyright 2021, Wiley. (f) Illustration of bidirectional ion transport in curved and porous Ti3C2Tx layers. Reproduced with permission from Ref. [152]. Copyright 2020, Elsevier. Fig. 9 Effect of different PMMA nanosphere template sizes (a–c) on the resulting porous structure of Ti3C2Tx film (d–f). Reproduced with permission from Ref. [149]. Copyright 2022, Wiley. (g–i) Illustration of ion transport pathways within respective porous structure. Reproduced with permission from Ref. [149]. Copyright 2022, Wiley. (j) Fabrication of high-performance compressed positive electrode using PS spherical template and coated with PANI. Reproduced with permission from Ref. [45]. Copyright 2019, Wiley. (k) Electrochemical performance of the positive electrode. Reproduced with permission from Ref. [45]. Copyright 2019, Wiley. Fig. 10 Illustration of the mechanistic difference in ion transport and charge storage between pristine MXene and various 3D architecturing methods (a), cross-sectional SEM image of air-dried DIW printed electrode (b). Reproduced with permission from Ref. [160]. Copyright 2019, American Chemical Society. SEM and digital images (inset) of EBP printed freestanding lattice macrostructure (c) and cross-sectional SEM image of a single extruded strand (d). Reproduced with permission from Ref. [161]. Copyright 2019, Wiley. (e) Illustration of UFC-incorporated EBP fabrication process to construct honeycomb-like scaffolds. Reproduced with permission from Ref. [162]. Copyright 2020, Wiley. (f) SEM image showing the top view of 3DFP printed macrostructure and high-resolution SEM image showing directional pore alignment. Reproduced with permission from Ref. [163]. Copyright 2021, Wiley. (g) MXene aerogels fabricated with various 3D architectures. Reproduced with permission from Ref. [156]. Copyright 2022, American Chemical Society. Review Enhancing MXene-based supercapacitors: Role of synthesis and 3D architectures Wen Siong Poh a b Wen Jie Yiang a b Wee-Jun Ong a c Pau Loke Show d e f g Chuan Yi Foo a b ⁎ a School of Energy and Chemical Engineering, Xiamen University Malaysia, Selangor Darul Ehsan, Malaysia & College of Chemistry and Chemical Engineering, Xiamen University, Xiamen 361005, Fujian, China School of Energy and Chemical Engineering Xiamen University Malaysia Selangor Darul Ehsan, Malaysia & College of Chemistry and Chemical Engineering Xiamen University Xiamen Fujian 361005 China School of Energy and Chemical Engineering, Xiamen University Malaysia, Selangor Darul Ehsan, Malaysia & College of Chemistry and Chemical Engineering, Xiamen University, Xiamen 361005, Fujian, China b Kelip-kelip! Center of Excellence for Light Enabling Technologies, Xiamen University Malaysia, Selangor Darul Ehsan 43900, Malaysia Kelip-kelip! Center of Excellence for Light Enabling Technologies Xiamen University Malaysia Selangor Darul Ehsan 43900 Malaysia Kelip-kelip! Center of Excellence for Light Enabling Technologies, Xiamen University Malaysia, Selangor Darul Ehsan 43900, Malaysia c Center of Excellence for NaNo Energy & Catalysis Technology (CONNECT), Xiamen University Malaysia, Selangor Darul Ehsan 43900, Malaysia Center of Excellence for NaNo Energy & Catalysis Technology (CONNECT) Xiamen University Malaysia Selangor Darul Ehsan 43900 Malaysia Center of Excellence for NaNo Energy & Catalysis Technology (CONNECT), Xiamen University Malaysia, Selangor Darul Ehsan 43900, Malaysia d Department of Chemical Engineering, Khalifa University, Shakhbout Bin Sultan St - Zone 1, Abu Dhabi, United Arab Emirates Department of Chemical Engineering Khalifa University Shakhbout Bin Sultan St - Zone 1 Abu Dhabi United Arab Emirates Department of Chemical Engineering, Khalifa University, Shakhbout Bin Sultan St - Zone 1, Abu Dhabi, United Arab Emirates e Zhejiang Provincial Key Laboratory for Subtropical Water Environment and Marine Biological Resources Protection, Wenzhou University, Wenzhou 325035, Zhejiang, China Zhejiang Provincial Key Laboratory for Subtropical Water Environment and Marine Biological Resources Protection Wenzhou University Wenzhou Zhejiang 325035 China Zhejiang Provincial Key Laboratory for Subtropical Water Environment and Marine Biological Resources Protection, Wenzhou University, Wenzhou 325035, Zhejiang, China f Department of Chemical and Environmental Engineering, Faculty of Science and Engineering, University of Nottingham Malaysia, Jalan Broga, 43500 Semenyih, Selangor Darul Ehsan, Malaysia Department of Chemical and Environmental Engineering Faculty of Science and Engineering University of Nottingham Malaysia Jalan Broga Semenyih Selangor Darul Ehsan 43500 Malaysia Department of Chemical and Environmental Engineering, Faculty of Science and Engineering, University of Nottingham Malaysia, Jalan Broga, 43500 Semenyih, Selangor Darul Ehsan, Malaysia g Department of Sustainable Engineering, Saveetha School of Engineering, SIMATS, Chennai 602105, India Department of Sustainable Engineering Saveetha School of Engineering SIMATS Chennai 602105 India Department of Sustainable Engineering, Saveetha School of Engineering, SIMATS, Chennai 602105, India ⁎ Corresponding author. Graphical abstract Modifying etching reaction from MAX phase tunes conductivity and surface termination of 2D MXene, construction of 3D MXene modulates specific surface area, interlayer spacing and ion transport pathway, optimization enhances electrochemical performance of MXene electrodes. MXene has been the limelight for studies on electrode active materials, aiming at developing supercapacitors with boosted energy density to meet the emerging influx of wearable and portable electronic devices. Despite its various desirable properties including intrinsic flexibility, high specific surface area, excellent metallic conductivity and unique abundance of surface functionalities, its full potential for electrochemical performance is hindered by the notorious restacking phenomenon of MXene nanosheets. Ascribed to its two-dimensional (2D) nature and surface functional groups, inevitable Van der Waals interactions drive the agglomeration of nanosheets, ultimately reducing the exposure of electrochemically active sites to the electrolyte, as well as severely lengthening electrolyte ion transport pathways. As a result, energy and power density deteriorate, limiting the application versatility of MXene-based supercapacitors. Constructing 3D architectures using 2D nanosheets presents as a straightforward yet ingenious approach to mitigate the fatal flaws of MXene. However, the sheer number of distinct methodologies reported, thus far, calls for a systematic review that unravels the rationale behind such 3D MXene structural designs. Herein, this review aims to serve this purpose while also scrutinizing the structure–property relationship to correlate such structural modifications to their ensuing electrochemical performance enhancements. Besides, the physicochemical properties of MXene play fundamental roles in determining the effective charge storage capabilities of 3D MXene-based electrodes. This largely depends on different MXene synthesis techniques and synthesis condition variations, hence, elucidated in this review as well. Lastly, the challenges and perspectives for achieving viable commercialization of MXene-based supercapacitor electrodes are highlighted. Keywords MXene 3D architectures Synthesis design Supercapacitor Energy storage 1 Introduction The proliferation of the Internet of Things technologies is inevitable to facilitate convenient and extensive control over various devices and machineries to aid with the increasingly complex human lifestyle. Amidst the global endeavor to normalize clean and sustainable energy, these intelligent electronics are designed to be highly portable and decentralized, self-powered by means of renewable energy (RE) harvesting devices such as photovoltaic and triboelectric nanogenerators. Advanced energy storage systems (ESSs) are imperative to regulate power input and output in these devices. Lithium-ion batteries (LIB) have been the quintessential ESSs for portable electronics but the geographically scattered and impending depletion of lithium mineral resources declined their future prospects. Despite numerous studies directed towards realizing naturally abundant metal-ion batteries such as sodium-ion and potassium-ion batteries, sluggish charge-transfer and lacklustre cyclic stability remain critical problems to be tackled due to migration and insertion kinetics of bulkier Na+ and K+ ions [1,2]. Hence, supercapacitors play an irreplaceable role in enabling reliable storage for energy scavenged from intermittent RE sources due to their extended cycle life (up to 100,000 cycles) compared to batteries (up to 10,000 cycles) [3,4]. To minimize the weight and volume occupancy of these portable ESSs, energy density becomes a crucial performance parameter in gravimetric, areal, and volumetric terms, which is especially lacking for supercapacitors. The study of supercapacitor electrode active materials to explore novel syntheses, formulations, and combinations targeted at augmenting energy density is, therefore, widely prevalent. Active materials nanostructuring and surface property engineering have been effective strategies to amplify their surface area and electrochemical activity, respectively, for enhanced charge storage performance [5,6]. MXene has, thus, garnered substantial research attention due to its intrinsic properties, possessing geometrically high surface area and highly functionalizable surfaces. MXene is an emerging family of 2D transitional metal carbides or nitrides with the general formula of M n +1X n Tx. M is an early transition metal (Sc, Ti, V, Cr, Y, Zr, Nb, Mo, Hf, Ta, W); X is carbon or nitrogen; n is an integer between 1 and 4; Tx stands for the surface functional groups which include oxygen (O), hydroxyl (OH) and fluoride terminations (-F) [7]. Appreciable appeal for MXene-based supercapacitor electrodes is attributed to its intrinsic metallic conductivity up to 20,000 S cm−1 and metal oxide-like redox-active surface that leads to exceptional pseudocapacitive behavior with a theoretical specific capacitance up to 1,116 F g−1 [8,9]. Numerous work managed to capitalize on its nanoscale mechanical flexibility and fabricated highly flexible free-standing films. These films readily served as supercapacitor electrodes via simple vacuum filtration of MXene dispersions, proving its versatility in supercapacitor applications [10,11]. Furthermore, MXene offers high degree of tunability in its physicochemical properties. This is done by modifying its synthesis technique and precursor selection, as well as kinetically controlling the synthesis process by varying the reaction temperature, duration and reactant concentration. Facile tweaking of MXene qualities and characteristics such as electrical conductivity, nanosheet flake sizes, and surface terminating elements is consequently beneficial to facilitate high-rate, high-volume electrochemical energy storage of MXene-based supercapacitors. Concomitantly, it is equally essential to tackle the Achilles’ heel of MXene for ion transfer and charge storage purposes. Attributed to its 2D layered nanostructure and abundance of surface terminations, strong Van der Waals interactions and hydrogen bonding between adjacent layers inevitably induces the well-known restacking and aggregation issue of 2D MXene [12,13]. This severely hampers the accessibility of electrolyte ions to electrochemically active sites, reducing the probability of surface redox reactions and ultimately degrading its pseudocapacitance [14]. Hence, microstructure and macrostructure modification strategies of 2D MXene are widely sought-after solutions for constructing 3D MXene architectures with enlarged specific surface area along with improved electrolyte interaction, further boosting its electrochemical performance. Hitherto, the fascinating inherent properties of MXene have amassed a vast number of studies developing multifaceted methodologies for constructing novel 3D architectures. However, the expansion of such studies is gradually approaching a bottleneck. Unidimensional strategies involving a single structural formation process, create 3D features with dimensions of uniformly similar magnitudes, limiting the final structural designability. This limitation is faced with an inevitable trade-off where large generated pore sizes lead to good rate performance but poor specific capacitance, and vice versa for small pore sizes. Currently, there are inadequate existing reviews that scrutinize reported 3D architectures in such aspects. Consequently, there lacks a clear future direction of such studies in order to realize structures of higher complexity for eliminating the performance trade-off. Herein, this review aims to provide a comprehensive overview of constructing high-performance 3D MXene architectures, particularly encompassing the rationale behind exploring diverse 2D MXene synthesis techniques, conducting precise synthesis process optimizations and introducing 3D architectures through advanced structural modification strategies. First, the charge storage mechanism of MXene-based supercapacitors is elucidated. Various synthesis techniques, categorizable as conventional, emerging, and innovative techniques, are highlighted along with their subsequent impacts on the characteristics of the synthesized MXene. The effects of synthesis parameters, including the selection of MAX phase precursors, alteration of synthesis conditions, and modification of surface terminations, are then scrutinized accordingly. This is followed by underscoring state-of-the-art dimensional evolutions of 2D MXene into 3D structures, the thought process behind designing such structures, and the improvements it imparts to the electrochemical performance of the final electrode. The concept of unidimensional and multidimensional architecturing is exclusively introduced to explicate the progression of existing strategies in terms of structural complexity and its ability to simultaneously achieve high specific capacitance and rate performance. Lastly, challenges and future perspectives of pushing the capacitive capability limits of MXene-based supercapacitors via 3D architecturing strategies, as well as their commercialization are summarized to direct concentrated research efforts towards addressing these impending issues. 2 Charge storage mechanism of MXene-based supercapacitors Supercapacitors are generally categorized into two main types, which are electric-double layer capacitors (EDLCs) and pseudocapacitors. They are characterized by their charge storage mechanisms, which are highly dependent on the choice of active materials. The charge–discharge process of EDLC is based on rapid electrosorption of ions driven by electrostatic attraction, in which ions in the electrolyte migrate into the pores of electrodes with opposite charges during charging and desorb from the pores during discharging. The ion arrangement to the different poles causes the build-up of opposite polarity charge pairs at the electrode/electrolyte interfaces, forming the Helmholtz double layer [15]. EDLC has power density that is considerably high due to its mechanistic ion adsorption–desorption that is merely a physical, and therefore rapid process. With neither chemical reactions nor compositional changes occurring in an EDLC, its charge storage mechanisms are highly reversible, allowing more superior cyclic stability than electrochemical batteries by several orders of magnitude [16]. Pseudocapacitor stores charges electrochemically via faradaic redox reactions occurring between electrode and electrolyte. Unlike the physical nature of EDLC mechanism that limits its energy density, the potential to improve the charge storage ability of a pseudocapacitive electrode is much more promising as it strongly depends on the chemical affinity between the electrode active materials and the ions adsorbed on the electrode surface [17]. There are three possible pseudocapacitive mechanisms, including intercalation pseudocapacitance, where ions intercalate into the layers of active material, followed by subsequent faradaic charge transfer without any crystallographic phase changes [18]. Redox pseudocapacitance refers to ions undergoing simultaneous faradaic charge transfer and electrochemical adsorption onto the active material surfaces [19]. Underpotential deposition is an uncommon mechanism, where metal ions form an absorption monolayer on a dissimilar metal surface with a much higher redox potential [20]. Fascinatingly, the charge storage process in MXene is not governed by a single mechanism, and it is rather interchangeable, determined by the magnitude of electrostatic potential difference applied across the electrode/electrolyte interface as well as the type of electrolyte ions and surface terminations [21]. MXene is likely to exemplify EDLC capacitance in H+-deficient environment, such as in neutral (e.g., K2SO4 [22], and MgSO4 [23]) and basic (e.g., NaOH [24], KOH [25]) electrolytes. Conversely, its charge storage is preponderantly underpinned by pseudocapacitive behaviors when deploying acidic electrolyte (e.g., 3 M H2SO4 solution) [26]. This is corroborated by the well-known MXene pseudocapacitive mechanism, acknowledged by numerous works, in which H+ ions in the electrolyte undergo highly reversible protonation/deprotonation with -O terminations of MXene [21,27]. The lack of H+ ions in neutral and basic electrolytes has denied pseudocapacitive charge storage, rather, electrolyte ions tend to be encapsulated in strong hydration shells that acts as a dielectric, preventing orbital hybridization between the ions and MXene surface terminations. As a consequence, charge storage stems from the segregation of hydrated ions to different poles, forming electric double layers (Fig. 1 a) [28,29]. CV profiles recorded by MXene operating in neutral and basic electrolytes; therefore, display pseudorectangular shapes (Fig. 1b and c) [30]. On the contrary, MXene in acidic electrolyte, H2SO4 in particular, exhibits a combination of EDLC, intercalation pseudocapacitance and redox pseudocapacitance. The proportion of occurrence for each mechanism largely depends on the polarization voltage and surface termination composition. Since only -O terminations instigate protonation reactions, MXene that is heavily decorated with other terminations will tend to display EDLC-dominant characteristics. Sufficiently negative voltage applied is required to overcome the adsorption potential of intercalated positive hydronium ions (natural state of H+ ions in aqueous environment) [31]. When this happens, the hydration shells are negated and orbital hybridization allow the direct adsorption of hydronium ions with O termination species, giving rise to intercalation pseudocapacitance (Fig. 1d) [21]. At increasingly negative potentials, O terminations are accumulatively converted to OH terminations via continuous adsorption of hydronium ions, electrostatic repulsion from identically charged OH terminals expands the MXene interlayer, causing volume fluctuations (Fig. 1e) [32]. As the interlayer spacing continues to expand, the MXene surface is increasingly exposed such that ion intercalation is no longer required, instead the ions undergo rapid surface redox and the resulting changes in the oxidation states of “M” layer contribute towards redox pseudocapacitance [33]. The diverse nature of charge storage mechanism displayed by MXene in H2SO4 electrolyte has unveiled the potential of MXene as a promising pseudocapacitive electrode material with enhanced current response, indicating greater amount of stored charge (Fig. 1f) [34]. Quantitatively, it is noticeable that the specific capacitance of Ti3C2Tx MXene in acidic H2SO4 electrolyte is 239.8 F g−1, which is nearly six-times higher compared to the neutral Na2SO4, LiCl and MgCl2 electrolyte at negative potential region. Conversely, MXene is mainly showing EDLC properties under positive potentials due to the bounded pseudocapacitive charge storage caused by anodic oxidation. The anodic oxidation of MXene, particularly Ti3C2Tx, stands as a significant concern that deeply impacting the cyclic stability and charge storage capability as supercapacitor electrode. The Ti3C2Tx electrode is susceptible to oxidation at anodic potentials, attributed to their facile electron loss and the subsequent formation of a TiO2 in aqueous solutions [35]. Unfortunately, this oxidation process is irreversible, leading to diminished electrochemical activity compared to the pristine material. This enduring change in electrochemical behavior extends beyond surface composition alterations, surface Ti atoms connected to O are removed, resulting in TiO2- x F x formation, and exposed C atoms likely form CC bonds [36]. Continued oxidation and TiO2 formation led to emergence of insulative oxide layer that enlarges the electrochemically inactive sites, and ultimately, causes substantial capacitance losses. Moreover, the anodic potential initiates the dissolution of Ti3C2Tx material after the TiO2 forming complex with F− ions, and dissolute in aqueous electrolyte. This will eventually reduce the electrochemically active site compared to the initial pristine Ti3C2Tx. From the macroscopic perspective, noticeable layer detachment can usually be found at the Ti3C2Tx after several charge/discharge cycles which leads to losses in active material and cease in capacitance [37]. Therefore, it is necessary to hybridize MXene with foreign materials to create stable composites at positive potentials, thereby mitigating the irreversible oxidation problem and enhancing the capacitance, stability, and energy density of the fabricated electrode. To combine the features of high-power density from EDLCs and high-energy density from pseudocapacitors, hybrid supercapacitors has thus been developed. One of the methods to do this is by employing dissimilar electrodes, one EDLC and one pseudocapacitive, forming an asymmetric hybrid supercapacitor (Fig. 1g) [38]. This kind of hybrid supercapacitor operates with faradaic and non-faradaic processes combined. An asymmetric Ti3C2Tx-CNT supercapacitor suggests a widen potential window up to 1.6 V, which ultimately enables the delivery of high specific capacitance of 176 F g−1 and energy density of 62 W h kg−1 at a scan rate of 2 mV s−1 (Fig. 1h) [39]. CNT serves as the EDLC electrode, which is designed with superior porosity to maximize the contact surface for ion adsorption–desorption, whereas MXene provides pseudocapacitance through reversible redox reactions [40,41]. Vice versa, MXene can also serve the EDLC role in non-acidic electrolytes and be coupled with pseudocapacitive materials such as conducting polymers and metal oxides. Beside electrode hybridization, the flexible charge storage nature of MXene nanosheets allows its compositing with either EDLC or pseudocapacitive materials into symmetric supercapacitor. Supporting materials can act as spacers to expand the MXene interlayers, enlarging its active surface area [42,43]. Such MXene-based nanocomposites (e.g., V2C MXene-PANI and MXene-MoO3) exemplified enhanced charge transfer kinetics that resulted in a high capacitance of 783.4 F g−1 at 5 mV s−1 (Fig. 1i), on top of improved structural stability [44]. Delves into the perspective of improved structural stability, compositing MXene with PANI promotes higher resistance to anodic oxidation at positive potential region. This is evident by the high-rate capability up to 65.4% from the current density of 1 to 1,000 A g−1 at the positive potentials (0.0–0.5 V). Eventually, this allows the MXene composite electrode to operate at wider operating potential that results in boosted energy density when assembling into a full cell [45]. To sum up, understanding the charge storage mechanisms of MXene in various electrolyte and further research into MXene-based hybrid materials is crucial to the development of high-performance supercapacitors with improved energy storage capacity. 3 2D MXene synthesis techniques Synthesis strategies of 2D MXene can be merely classified into bottom-up and top-down methods. Chemical vapor deposition (CVD), templating method and plasma enhanced pulsed laser deposition are among the many bottom-up methods explored [46,47]. They principally involve stringently controlled atom-by-atom deposition in layered configuration to construct individual MXene nanosheets, thus allowing a high degree of customizability in the MXene synthesized with regard to morphology, crystal size, crystallinity, and thickness [48]. For example, the recently reported zirconium-based MXenes, Zr2CCl2 and Zr2CBr2 are directly synthesized through CVD method by reacting CH4 and ZrCl4 or ZrBr4 with Zr foil at 975 °C [49]. In addition, both titanium carbide-based and nitride-based MXene, namely Ti2CCl2 and Ti2NCl2 can be synthesized following the similar routes. The CVD-derived MXenes can be synthesized by reacting the Ti metal with gaseous precursors such as CH4 for carbon source, and N2 for nitrogen source, under different reaction temperatures. The synthesized MXenes are perpendicularly aligned to the substrate, allowing efficient ion transfer. Consequently, multiple works have employed CVD to obtain large area, highly crystalline MXene flakes with low defect concentration. However, the proposed CVD routes demand reaction temperatures close to 1,000 °C. MXene crystals are also generally grown in-situ on substrates of other materials; post-processing is necessary to extract the crystals and obtain pure MXene, adding meticulosity to supercapacitor electrode fabrication [50,51]. Bottom-up methods, therefore, encounter a severe bottleneck in their process scalability for commercialization due to their requirements for exceedingly complex operations and harsh synthesis conditions, eventually leading to high cost and poor production efficiency. In contrast, top-down MXene synthesis involves a single element being selectively etched from a ternary transition metal compound via wet processing, mainly relying on chemical interactions between reactants under external stimuli such as elevated temperatures and energy waves. Thus, scaling up the synthesis process is rather straightforward by methodically manipulating the reactant compositions and stimuli intensity. In fact, it has been proven feasible to scale up Ti3C2Tx MXene production by fiftyfold without modification of chemical reactant ratios, reaction time, and temperature [52]. Moreover, top-down methods are practicable under much milder operation conditions that are liberally moderated compared to bottom-up methods. Along with the increasingly inexpensive precursor materials that are widely attainable, top-down etching methods present reliable sources of MXene with high yield, readily integrated into supercapacitor electrode fabrication [53,54]. Researchers have been continuously inventing novel top-down approaches to discover the best performing synthesis route in terms of reactant cost, reactant toxicity, safety, operating condition requirements and quality of the synthesized MXene. These are categorizable into conventional, emerging and innovative approaches, illustrated in Fig. 2 . The performances of the conventional, emerging and innovative etching approaches are listed in Table S1 in the supplementary materials. 3.1 Conventional approaches Conventional approaches include well-established methods that are already widely prevalent in ESS studies. 2D MXene is mostly derived from polycrystalline nanolaminates of ternary carbides and nitrides in a layered hexagonal structure called MAX phases [55]. The general equation of MAX phase is M n +1AX n , where M and X were identified above, A is a group IIIA or IVA species. The weaker MA bonds relative to MX bonds ease the selective removal of the A layer via acid etching [56]. The pioneering synthesis of Ti3C2Tx MXene was performed by immersing Ti3AlC2 powder in 50% HF at room temperature for 2 h [57]. HF etching was proven to be a consistent method to remove Al layers from their respective MAX phases to obtain various other MXene like V2CTx, Nb4C3Tx, Ta4C3Tx and Zr3C2Tx [58–61]. To avoid handling high concentrations of extremely hazardous HF acid, in-situ HF etching was reported by dissolving Ti3AlC2 powder in an aqueous solution of 5 M lithium fluoride (LiF) in 6 M hydrochloric acid (HCl) at 40 °C for 45 h [62]. Later on, the minimally intensive layer delamination (MILD) method was developed to optimize the molar composition, where the reaction was carried out in 12 M LiF/9 M HCl at room temperature [63]. The as-synthesized MXene has larger flake sizes and fewer surface defects, which are favorable for charge storage in supercapacitors. As evidenced in a nuclear magnetic resonance (NMR) study, MXene synthesized via MILD method exhibits four times lesser -F terminations than that synthesized from HF etching. Instead, they are replaced with -Cl terminations introduced by HCl [64]. Ascribed to the larger ionic radius of Cl− compared to F−, the steric effect from -Cl terminations effectively expands the interlayer spacing. The increased surface area exposed to electrolyte ameliorates ion accessibility towards concealed macropores and redox-active sites, thereby facilitating higher degree of ion adsorption and redox reactions [65]. The enlarged interlayer spacing also allows Li+ ions and water molecules to act as intercalants, facilitating facile delamination into MXene nanosheets by gentle shaking. On the other hand, HF requires the use of organic intercalants such as dimethyl sulfoxide and tetraalkylammonium hydroxide (TMAOH), followed by ultrasonication for complete delamination [63]. This tedious procedure produces smaller MXene flakes with higher defects, diminishing the overall electrical conductivity. It was also revealed that LiF/HCl etched MXene yields higher content of O than F and OH terminations [64]. The dominant O terminations increase the probability of protonation-deprotonation reactions and effectively improve pseudocapacitance [66]. Recognizing the fact that F terminations are undesirable in the sense that they are redox inactive, they pose as the main hurdle towards realizing MXene with improved pseudocapacitive behavior. In response, there is a surge in the research on a multiplicity of different novel synthesis approaches, principally pivoting on the elimination of -F terminations and maximization of O terminations via fluoride-free techniques. 3.2 Emerging approaches Emerging approaches refer to relatively new methods gaining increasing attention owing to their capability to synthesize fluoride-free MXene-based supercapacitors which stands out from conventional HF etching. These emerging methods include alkali etching, molten salt etching, halogen/interhalogen-based etching, and electrochemical etching, as summarized in Fig. 3 . The mentioned techniques have historically found applications in fields such as semiconductor manufacturing [67], metallurgy [68] and photovoltaics [69]. These methods do not require fluoride-containing etchant, unlike conventional HF etching that highly relies on the strong affinity of fluorine towards “A” layers, which leads to the formation of compounds that can be easily removed. The unique selective etching mechanisms of these methods are mainly based on alternative etchants that serves similar purpose as fluoride-containing etchant, rendering them particularly suited for MXene synthesis. The functioning of alkali etching lies in the amphoteric nature of the “A” layer (i.e., Al and Si) in MAX phase precursors, which enables them to form soluble Al(OH)4 − complexes with alkali etchants. Similar to acid etching, alkali etching can produce carbide-based MXene, but have the exclusive ability to prevent the formation of fluoride terminations that dampens its electrochemical performance [70,71]. The etching process is accomplished by the oxidation of Al followed by the dissolution of Al(OH)4 − in concentrated alkali etchant (e.g., 27.5 M NaOH) at high temperature (e.g., 270 °C). The process yielded Ti3C2Tx MXene with 92 wt% purity alongside abundant O and OH instead of -F terminations and exhibited pseudocapacitive behavior in symmetric orientation. However, the high etching temperature and etchant concentration have limited the scalability of alkali etching. This is inevitable as reducing the etching temperature can lead to a “jamming effect” that forms insoluble Al(OH)3 and AlO(OH) [72]. These compounds cannot be dissolved in alkali and remain in the MAX phase precursor, leading to MXene formation failure. Thus, high etching temperature is applied for alkali etching to promote the transformation of Al(OH)3 and AlO(OH) into dissolvable Al(OH)4 − [73]. On the other hand, reducing the etchant concentration can lead to the undesired formation of sodium-titanate (Na2Ti5O11) owing to the oxidation of Ti in water [74,75]. Molten salt etching, also known as Lewis acidic etching, stands out from conventional HF-etching as it can synthesize both fluoride-free carbide- and nitride-based MXene. The incapability of conventional HF etching for M n +1AN n MAX phase is due to the stronger covalent bonds and stable structure of nitrides, making it less susceptible to be etched by acid alone. Additionally, the M n +1AN n MAX phase has higher formation energy, thus requiring more energy to extract the “A” element [76,77]. A hexagonal Ti3C2Tx MXene can be prepared via microwave-assisted selective etching of the precursor mixture (Lewis acid salts (i.e., ZnCl2, NaCl, and KCl) and Ti3AlC2) in NH4F aqueous solution. The as-prepared MXene has outperformed the conventional HF-etched MXene due to absence of fluoride content, engendering 40% higher specific capacitance under same current density [78]. However, this method is highly energy intensive as it requires high temperature to produce a homogenous molten mixture, thereby limiting the transition from lab scale to mass production. Therefore, it is necessary to consider alternative methods with lower temperature requirements to reduce the risk of material degradation during the process, and promote the ease of production implementation. The halogen/interhalogen-based etching is another thermal-driven process to synthesize MXene, which demands relatively low etching temperatures compared to alkali and molten salt etching. The highly reactive halogens (i.e., Cl2, Br2, and I2) and interhalogen compound (i.e., IBr, and ICl) can react with the “A” layer, thus realizing selective etching to produce MXene. The etching mechanism is based on the dissociation of halogen molecules, forming radicals that prone to react with “A” elements. For instance, the I2 can be employed to etch Al from Ti3AlC2 in anhydrous acetonitrile (CH3CN) by forming AlI3. The produced AlI3 is removed after treatment with HCl, leaving accordion-like Ti3C2Tx [79]. The reaction state of halogen/interhalogen-based etching is essentially dormant at room temperature but increasing the etching temperature from 60 to 100 °C has been proven to reduce the Al content by six-fold and produce MXene with higher purity. However, the temperature requirement becomes less stringent with increasing reactivity of the etchant used. In fact, the selective etching of Al can be achieved at room temperature using Br2 etchant [80]. Another emerging approach is electrochemical etching, that utilizes a two/three-electrodes system to remove the “A” layer from MAX phases precursor through anodic corrosion, thereby forming fluoride-free MXene. The selective etching process is conducted in Cl− containing electrolytes (e.g., HCl, NaCl, FeCl3 and NH4Cl) at a certain voltage. The MAX phase precursor is the working electrode and is connected in series with the counter electrode (e.g., Pt foil, Li foil) [81,82]. This approach can be performed at room temperature without involving hazardous fluoride-containing etchant, which is beneficial for industrial production. The etching mechanism of this approach involves the oxidation of “A” element from MAX phases, followed by the recovery of “A” metal ions at counter electrode via reduction process. With regards to the mentioned mechanism, the formation of electrochemically etched MXene is principally governed by the etching time, as well as the potential window and concentration of electrolyte [83]. Increase in electrical potential facilitates the breaking of MA bonds, thereby accelerates the removal of “A” layers from the MAX phases, and reduce the etching time required. In terms of electrolyte concentration, increase amount of etchant favours high etching rate owing to more aggressive material removal environment. However, aggressive synthesis parameters stimulate the formation of carbide-derived carbon (CDC) layers on the surface of the MAX phase precursor, ceasing the yield of MXene [63,84]. For instance, the viability of MXene production through electrochemical etching rely on the bond strength and selectivity of element removal in MAX phases, where the weaker MA bonds are prone to break before stronger MX bonds. Increasing the electrical potential, etching time, and electrolyte concentration allows the “M” elements to be etched as well, thereby forming CDC. Reducing the magnitude of the mentioned parameters diminishes the chance of yielding CDC but unavoidably leads to incomplete etching process and low synthesis yield. Further exploration on the optimal parameter combination is required to maximize the production rate while maintaining high purity of the yielded MXene. With the known fact that CDC is usually produced under a relatively harsh condition, a milder etching condition coupled with alternative electrolytes can be employed. It has been reported that the electrochemical system uses binary aqueous electrolyte consisting of 1 M NH4Cl and 0.2 M TMAOH can effectively produce MXene from MAX phases, with high synthesis yield greater than 90% [85]. The introduction of TMAOH can effectively increase the interlayer spacing of MAX phases precursor, allowing greater accessibility of Cl− to the “A” layer. In the case of Ti3AlC2, this has facilitated the etching of internal MAX phases by breaking more Ti-Al bonds [86,87]. Owing to the absence of fluoride-containing etchant throughout the process, the electrochemically etched MXene has abundant oxygen and hydroxyl terminations, corresponding to high pseudocapacitive performance [88]. In summary, the present state of emerging approaches demonstrates favorable scalability and established application. Despite their potential, these methods encounter substantial obstacles, including the elevated temperatures, limited MXene variants synthesized, and the generation of waste materials. Therefore, a comprehensive understanding of the underlying mechanisms and parameter optimization is essential to maximize the versatility of these methods. Additionally, it is evident that addressing these challenges also requires a call for innovative solutions. 3.3 Innovative approaches The intrinsic and coveted properties of MXene led to tremendous efforts in scaling up the production of MXene while minimizing the usage of hazardous etchant, decreasing etching temperatures, and reducing the waste production. Several novel synthesis routes that capable of solving the mentioned issues in conventional and emerging methods were reported in recent years, namely, thermal reduction etching, algae etching, ionic liquid etching, and wave-assisted etching, as summarized in Fig. 4 . Despite that the as-mentioned innovative methods are not primarily designed for supercapacitor application, it is noteworthy that these methods can produce MXene with similar morphology as that from conventional and emerging etching techniques, favorable for the production of MXene-based supercapacitor electrodes. Different from alkali and molten salt etching that requires large amount of etchant, the thermal reduction etching is solely a temperature dependent approach that capable to transform MAX phases to MXene with the assistance of H2 under inert condition. This eliminates the generation of hazardous acid, and alkali waste throughout the etching process. Aside from the minimized pollutant, this method is by far the first approach to transform sulfur-containing MAX phases into MXenes. The conventional HF etching will only yield carbon/sulfur amorphous, rather than MXene due to the inertness of sulfur [89]. The etching mechanism of thermal reduction is removing the weakly-bonded sulfur from MAX phases in the form of volatile hydrogen sulfide (H2S) after reacting with H2 under elevated temperatures. For instance, the multilayer Ti2C MXene can be obtained by removing the sulfur species in Ti2SC MAX phase at 800 °C [90]. Moreover, the loosely stacked multilayer MXene obtained after thermal reduction etching can be simply delaminated through ultrasonication without the presence of intercalant. This approach demonstrates a versatile solution in MXene synthesis without the need for hazardous wet chemical etching. It is crucial to consider the environmentally friendliness and safety while venturing from lab-to-commercial production. With the fact that most of the conventional and emerging MXene synthesis still involves acidic or alkali etchant, there is necessity to call for a hazardous-free method for MXene production. Replacing chemical reagent with bioderived organic acids extracted from microorganism in MXene synthesis appears to be one of the best solutions to mitigate the implementation of acidic and alkali etchants. The self-sustaining algae has been integrated into various green synthesis protocol for nanomaterials [91,92]. In terms of MXene synthesis, algae-assisted etching is reported to yield up to 90% vanadium carbide, V2C from V2AlC. The organic acids extracted from algae can efficiently intercalate, attack the amphoteric Al, and delaminate the V2AlC MAX phase [93]. The discovery of biochemical-based etching provides an alternative to the synthesis of underexplored vanadium and molybdenum-based MXene. In addition, the algae etching technique can be utilized to bulk produce MXene in a cost-effective manner owing to the ease in algae cultivation. Another innovative etching approach utilizes ionic liquid–water mixture as the etchant to produce carbide-based MXene. The mechanism of ionic liquid etching is extremely similar to that of the in-situ HF etching, where the etchant not only facilitates in the selective removal of “A” elements, but also served as an intercalant, enabling the delamination of multilayer nanosheets through mechanical exfoliation. For instance, the Ti3AlC2 and Ti2AlC MAX phases can be etched via hydrolysis by fluoride-containing ionic liquid (e.g., 1-butyl-3-methylimidazolium hexafluoro-phosphate, and 1-ethyl-3-methylimidazolium tetrafluoroborate), that leads to the selective removal of Al [94]. The fluorine in ionic liquid does not dissociate into fluoride ion, but present in the form of organic anion such as BF4 − and PF6 −, leading to minimal amount of fluoride termination on the yielded MXene. The additional merit of ionic liquid etching is its facile post-treatment compared to conventional acid etching. The pH of MXene-ionic liquid mixture is close to neutral range, allowing rapid isolation of the as-synthesized MXene. In addition, ionic liquid etching can fully retain oxide by-products in the ionic liquid–water mixture. The absence of oxide by-products can mitigate the oxidation of MXene and allow long-duration storage. However, the minimum period for complete reaction between ionic liquid and MAX phases is 20 h, a negligible reduction compared to the conventional acidic etching. The use of milder etchant has led to slower reaction rate, and thereby, highlight the necessity of applying external energy to accelerate the production rate. An alternative solution to the low reaction rate can be wave-assisted etching that provides additional energy, enabling a more efficient chemical reaction between etchant and MAX phases. For example, the electromagnetic and mechanical wave-assisted etching has been reported as a timely and milder approach to etch layered MAX precursors. Molybdenum-based MXene, Mo2C, can be produced from Mo2Ga2C with the aid of UV-light in a milder phosphoric acid (H3PO4) within 3 to 5 h. This technique enables high-yield production of fluoride-free mesoporous MXene, which is conducive for efficient electrolyte diffusion and charge transfer, highly-preferred for supercapacitor application [95]. In terms of mechanical wave-assisted etching, the Ti3C2 MXene can be produced rapidly in 0.05 M LiF under the exposure of surface acoustic waves [96]. The surface acoustic waves induce the dissociation of pure water to produce proton, followed by the in-situ formation of HF from the reaction of LiF and proton. The etching and delamination mechanism is similar to that of the in-situ HF etching with the only difference of the increased etching rate of Al from MAX phases owing to the incorporation of highly localized mechanical vibration, shortening the production period from the typical full day synthesis to 40 min. In addition to the accelerated etching kinetics, the aforementioned wave-assisted etching method eliminates the need for the neutralization process of the etchant-product mixture, which typically generates a significant amount of waste. This is achieved because neither acidic nor alkaline reagents are involved in the etching and delamination process. Specifically, the pH reduction caused by the in-situ HF formation returns to the neutral range once the wave is halted. These advantages collectively enhance the commercial potential of wave-assisted MXene synthesis, stemming from negligible waste generation and exceptional efficiency. These innovative approaches open up the opportunity for the synthesis of new MXene species that is only theoretically feasible at the moment. Meanwhile, these innovative techniques can be facilely incorporated with the existing synthesis methods as auxiliary mechanisms to synergistically increase the yield and production rate of MXene. Particularly, the wave-assisted etching technique can be integrated into in-situ HF etching method to accelerate the removal process of A layer in MAX phase precursors. 4 Fundamental design of 2D MXene As discussed above, the charge storage nature of MXene is fairly complex and concomitantly contributed by EDLC, intercalation, and surface redox pseudocapacitive mechanisms, ascribed to its diverse, rich surface chemistry and inherent nanostructure [21,32,33,66,97]. Considering that, the physical characteristics and surface functionalities of 2D MXene nanosheets are highly sensitive to the reactant composition and synthesis conditions. 2D MXene nanosheets are elementary building blocks for constructing 3D MXene architectures. Thus, the synthesis of 2D multi-layered or single-layered MXene determines the quality of the final 3D MXene architectures. The etching parameters that govern the quality of synthesized MXene include the particle size of the MAX phase or non-MAX phase precursors, etching period, etching temperature, and etchants used (nature of etchant and concentration). The combined effects of different parameters result in MXene with varying structural properties such as layer thickness, lateral size, number of defects, and composition of surface termination groups. Ultimately, these properties can be measured electrochemically to evaluate the specific capacitance, power density, energy density, and cyclic stability. 4.1 MAX phase precursors The forming materials, stoichiometry compositions, and valence states of MAX phase precursors have determining effects on the electrochemical properties of the resulting MXene. One way to categorize MXenes is based on the transition metals present in their structure which is solely governed by the elemental composition of their respective MAX phase precursors. Firstly, there are single transition metal or mono-metallic MXenes, such as the typical Ti3C2Tx with ordered MX layered structure synthesized from Ti3AlC2 [57]. Besides, the double transition metal or bi-metallic MXenes, which involve two different transition metals such as ordered Mo4VC4 with consistent layered pattern derived from Mo4VAlC4 [98], and solid solution-type TiVCTx with randomly distributed “Ti” and “V” in “M” layer derived from TiVAlC MAX phase [99]. Furthermore, MXenes can also be defined based on the presence of vacancies in their atomic structure. For example, the divacancy transition metal MXene contains two ordered “M” vacancy sites resulting from the selective removal of two distinct “A” elements [100]. Additionally, MXenes can be further classified into out-of-plane and in-plane structures based on the configuration of elements. In out-of-plane MXene, each of the “M” and “A” elements occupies entire layers in an alternating pattern, as seen in Ti3C2Tx with three “Ti” layers sandwiching two “C” layers [101]. In contrast, in in-plane MXene, the “M” and “A” elements are arranged in a hexagonal lattice pattern, as observed in the case of W1.33C Tx [102]. Moreover, MXene can also be classified into carbide-based, nitride-based, or carbonitride-based depending on the “X” counterpart present in the MAX phase precursor [103]. MXene inherits its properties from its parent precursor. MAX phase precursors produced from different carbon sources can result in carbide-based MXenes with non-identical flake sizes and morphologies. The graphite and TiC-synthesized Ti3AlC2 produce larger MXene flakes with high electrical conductivity up to 4400 and 3480 S cm−1 respectively [104]. The remarkable electrical conductivity is contributed by the high nucleation energy of the carbons used, thereby leading to few nucleation sites and resulting in larger crystal sizes with layered morphology (Fig. 5 a and b). On the contrary, the carbon lampblack has significantly lower nucleation energy, resulting in abundant nucleation sites and inevitably leading to smaller MXene crystals without a layered structure (Fig. 5c). The carbon lampblack-derived MXene has a relatively lower electrical conductivity of 1020 S cm−1. Moreover, the lack of layered configuration leads to easy restacking of MXene that essentially inhibits the intercalation of ions and utilization of redox-active sites, thereby hindering the charge transfer process for efficient energy storage. Besides the mono-transition-metal MXenes, a distinct subset within the MXene family can be synthesized by modifying the elemental composition of the MAX phase. The incorporation of two transition metal elements within the MAX phase structure can produce double-transition-metals MXenes, commonly referred to as bi-metallic MXenes ((M’M’’) n +1X n Tx). The synthesis of bi-metallic MXenes can be achieved through the conventional direct HF or in-situ HF etching of bi-metallic MAX phases [105,106]. In terms of their physical properties, bi-metallic MXenes exhibit significantly larger interlayer spacing when compared to their mono-transition metal MXene counterparts [107]. This expanded interlayer spacing promotes the diffusion and transportation of ions within the electrolyte system. For instance, the bi-metallic MXene Mo2Ti2C3, synthesized from the Mo2Ti2AlC3 MAX phase, boasts an interlayer spacing of 2.4 nm. This is 127% larger than the mono-transition-metal Ti3C2 MXene synthesized under the same conditions [108]. As a result, the Mo2Ti2C3 demonstrates a substantially higher specific capacitance of 152 F g−1, compared to the Ti3C2 electrode with 61 F g−1, at a current density of 10 mA cm−2 in a 1 M solution of 1-ethyl-3-methylimidazolium bis(trifluoromethylsulfonyl)-imide (EMIMTFSI) electrolyte. This improvement can be attributed to the reversible and more efficient intercalation of EMIM+ ions between the layers of the Mo2Ti2C3, whereas the lower specific capacitance of Ti3C2 may be attributed to the insufficient intercalation of EMIM+ ions, which primarily adhere to the outer surface and cannot diffuse into the interlayer. The high pseudocapacitive current contribution of Mo2Ti2C3 in comparison to Ti3C2 is primarily due to intercalation pseudocapacitance. The larger interlayer spacing facilitates the free and reversible intercalation/deintercalation of both bare and solvated EMIM+ and TFSI− ions. This is supported by the higher percentage of surface-controlled capacitance in Mo2Ti2C3, reaching 91%, in contrast to Ti3C2 with a lesser surface-controlled capacitance of 63% at a scan rate of 200 mV s−1. Electrochemical impedance spectroscopy further underscores the significance of larger interlayer spacing. The charge transfer resistance of Mo2Ti2C3 is 3.4 Ω, considerably smaller than the value of 8.7 Ω for Ti3C2. This reduction in charge transfer resistance for Mo2Ti2C3 is attributed to its larger d-spacing, which facilitates the faster intercalation/deintercalation of bulky EMIM+ and TFSI− ions between the layers. In terms of cyclic stability, Mo2Ti2C3 demonstrates a higher capacitance retention of 86%, while Ti3C2 exhibits a lower retention rate of 64% after 5,000 charge/discharge cycles at a current density of 200 mA cm−2. A similar performance trend is evident with (Ti0.5V0.5)3C3Tx. In this case, the charge transfer resistance of the bi-metallic (Ti0.5V0.5)3C3Tx MXene is limited to 0.2 Ω, approximately two times lower than that of Ti3C2Tx MXene, and five times lower when compared to V2CTx MXene [109]. In terms of reliability as a supercapacitor electrode, (Ti0.5V0.5)3C3Tx MXene exhibits minimal degradation even after 100,000 cycles of continuous charge/discharge at a current density of 20 A/g. In contrast, the cyclic stability of V2CTx MXene decreases to 81% after only 10,000 charge/discharge cycles. The electrochemically stable bi-metallic (Ti0.5V0.5)3C3Tx MXene also demonstrates a surface-dominant charge storage mechanism, with a capacitance control ratio of 52% even at a low scan rate of 5 mV s−1. This indicates a surface-controlled charge storage. Conversely, Ti3C2Tx and V2CTx MXenes exhibit a relatively diffusion-controlled charge storage, with capacitance ratios of nearly 32% and 16% at the same scan rate. The surface-controlled charge storage suggests a larger interlayer spacing in (Ti0.5V0.5)3C3Tx MXene, enabling seamless ion transfer. Ultimately, this efficient ion transfer accounts for the outstanding charge storage capability and cyclic stability performance of (Ti0.5V0.5)3C3Tx MXene. Crucially, the bi-metallic MXenes discussed here do not involve the introduction of spacers or undergo structural modifications to form a 3D assembly. Therefore, the improved charge storage behaviour is solely attributed by the inherent stability of the layered structure and the naturally occurring larger interlayer spacing in these bi-metallic MXenes. On top of the selection of MAX phases with different transition metal counterpart, the choice of raw material for “A” elements has definite impact on the purity and structural integrity of the yielded MXene. The finding suggests that the vacancy-ordered Mo1.33CTx MXene synthesized from AlY2.3 alloy-derived (Mo2/3Y1/3)2AlC i-MAX has six-fold higher yield compared to the Mo1.33CTx synthesized from elemental Y-derived (Mo3/2Y1/3)2AlC i-MAX [100]. The latter MAX phases synthesis protocol has suppressed Mo1.33CTx MXene yield due to the higher tendency to form byproduct, namely Mo3Al2C. On top of the enhanced yield, the MXene synthesized from AlY2.3 alloy-derived (Mo2/3Y1/3)2AlC i-MAX has larger interlayer spacing, allowing efficient proton diffusion and increased charge storage site. Ultimately, the synthesized MXene exhibits higher charge storage capability with significantly higher specific volumetric capacitance at low scan rate compared to the MXene produced from Y-derived (Mo3/2Y1/3)2AlC i-MAX, providing that both of the MXene are technically “Mo1.33CTx”. Aside from the purity of MAX phases, the quantity of “A” elements used in the preparation of these phases significantly influences the physical properties of the synthesized MXene. Taking Ti3AlC2 as the example, increasing the amount of Al beyond the stoichiometry ratio of 3:1:2 promotes the diffusion of Al. This diffusion process leads to the development of Ti3AlC2 grains with enhanced structural integrity, thereby facilitating the creation of Ti3C2 with an optimal 3:2 ratio of Ti to C. Recent research indicates that MXene derived from the aforementioned MAX phases exhibits improved oxidation stability due to fewer defects in the carbon sublattice [9]. The highly stoichiometric MAX phases contribute to the resulting MXene with remarkable electronic conductivity up to 20,000 S cm−1, along with a prolonged shelf life exceeding 10 months, demonstrating minimal degradation over time. This synthesis protocol can be potentially applied to the synthesis of various MAX phases for high quality MXene. However, excess material indicates additional cost to the overall production cycle, and it is crucial to consider the cost efficiency beyond performance. Hence, integrating recycled materials into the synthesis of MAX phases offers a viable alternative for advancing the commercialization of MXene production. It has been reported that MAX phases derived from the utilization of inexpensive (i.e., TiO2) and recycled (i.e., secondary aluminum, and tire-derived carbon) materials can produce Ti3C2Tx MXene with a specific capacitance of 285 F g−1 (1,012 F cm−3) at 20 mV s−1, and electrical conductivity of 5857 ± 680 S cm−1 [53]. The electrochemical results are comparable to MXene synthesized from laboratory grade materials-derived MAX phases, yet with higher cost efficiency as no elemental precursors were used. These studies conclude that the foundation of achieving high-quality MXene lies in ensuring the production of high-quality MAX phases. MAX phases serve as the precursors from which MXene are derived, and their characteristics have a profound influence on the properties of the resulting MXene. Therefore, refining the properties of MAX phases is pivotal to unveil the full potential of MXene in supercapacitor application. 4.2 Synthesis conditions Being a kinetically controlled process, a strong relationship exists between etching temperature, etching duration, and properties of the as-synthesized MXene. The structural properties (particle size, number of defects, and surface termination groups) and electrochemical properties (capacitance and conductivity) of MXene are varied under different reaction conditions. The effects of etching temperature and ball milling on the etching process and the ensuing capacitance of Ti3C2Tx MXene using a 40 wt% HF solution were studied [110]. The research showed that pristine Ti3C2Tx MXene can be obtained after 48 h under the etching temperature of 35 °C and further reduced to 24 h under the etching temperature of 60 °C. XRD analysis revealed that the Ti3AlC2 MAX phase precursor was not fully etched to form Ti3C2Tx MXene at low etching temperature despite undergoing a longer etching period. The XRD patterns of samples (Fig. 5d-f) indicate that low etching temperature is ineffective in facilitating the complete elimination of Al layers from Ti3AlC2 MAX phase precursor. The assistance of ball milling in treating the precursor halved the etching time within the tested temperature range. The incorporation of ball milling produces MAX phase precursor with uniform and finer particle size, as well as enhance the overall surface-to-volume ratio by breaking the Van Der Waals interaction between the MAX phase layers. This pre-etching process ensures larger fraction of MAX phase precursor actively interact with the etchant to facilitate the selective removal of “A” element from the layered structure. In addition, ball milling has improved the specific capacitance and capacitance retention of etched Ti3C2Tx MXene by 37.5% and 6% respectively. This concludes that Ti3C2Tx MXene can be synthesized in a shorter time under a relatively higher etching temperature. Ball milling is also thus proven to be able to enhance the capacitance while reducing the etching time without disrupting the crystalline phase. Besides, the concentration of etchants also plays a crucial role in determining the etching protocols and quality of the etched MXene. In general, most of the reported HF-etching of Al from Ti3AlC2 MAX phase precursor uses 10 to 50 wt% HF. The concentration of HF decides the etching duration required for the transformation from precursor to MXene. A higher concentration (i.e., 10 wt%, 30 wt%, 40 wt%, and 50 wt%) is usually suggested to extract the “A” element from the MAX phase precursor [111]. Nevertheless, using lower HF concentration (i.e., 5 wt% for 24 h) has been proven to produce similar results as in the case of higher concentration [112,113]. However, Ti3C2Tx MXene obtained using diluted 5 wt% HF solution exhibits accordion-like morphology but with thicker lamellas, which is unfavorable for delamination process [114]. In addition, it was also reported to consist of fewer -F surface terminations that reduces the steric hindrance on the mobility of excess H2O molecules in the interlayers. The mobilized H2O molecules increase the interlayer spacing, allowing excess ions to reach the active sites [115]. Unfortunately, the utilization of diluted HF etchant will increase etching time, leading to structural instability and increase in sheet resistivity with a larger formation of AlF3 [116]. Nonetheless, the etching time also depends on the strength of the metallic M−A bonding in the MAX phase. Typically, precursors with greater metallic bonding between the transition metals, “M” and “A” species, require harsher etching conditions. For example, the etching of Nb2AlC requires 90 h, 45 times longer than that required for Ti3AlC2, which only requires 2 h with 50 wt% HF at 25 °C [117]. The longer etching duration is caused by a stronger Nb-Al bond compared to Ti-Al bond. As a remedy, the etching temperature is increased to 55 °C to reduce the etching time under the same etchant concentration. The combined effect of etching temperature, etching duration, and etchant concentration can significantly alter the synthesized MXene. Two different HF etching protocols were reported to prepare molybdenum-based MXene (Fig. 5j). The first approach is etching Al from (Mo2/3Y1/3)2AlC i-MAX in 48 wt% concentrated HF in a ratio of 1 g of (Mo2/3Y1/3)2AlC to 20 mL of etchant at room temperature and stirred for 12 h. This protocol yields (Mo2/3Y1/3)2C MXene with in-plane elemental order that can reach a volumetric capacitance of 1,550 F cm−3 in 6 M KOH electrolyte. In the second protocol, both Al and Y elements were etched from (Mo2/3Y1/3)2AlC i-MAX in 10 wt% HF solution in a ratio of 1 g of (Mo2/3Y1/3)2AlC to 20 mL of etchant at room temperature and stirred for 72 h with fresh 10 wt% HF substituted at every 24 h. This protocol yields Mo4/3C MXene with ordered vacancies, and the as-synthesized Mo4/3C MXene attained a volumetric capacitance of 1,200 F cm−3 in 1 M KOH electrolyte [118]. Aside from controlling the types of MXene yielded through various combination of etching parameters, it is noteworthy that different combination of etching temperature, etching duration, and etchant concentration will also affect the structural stability and charge transfer capability of the etched MXene. As Ti3C2Tx MXene is prone to oxidation when preparing in aqueous etchant with dissolved oxygen, the high etching temperature and duration will accelerate the formation of TiO2 which will cease the overall electrical conductivity of MXene owing to its dielectric nature. It has been reported that MXene synthesized at 80 °C can reach high oxygen content up to 29 wt% even it is etched in milder HCl/LiF etchant [119]. Meanwhile, the mentioned MXene has significant defect as evident from high intensity D band in Raman spectra which can be attributed to high temperature etching. On the contrary, the MXene synthesized below 50 °C yields relatively lower oxygen content and displays higher electrical conductivity with minimal defects. In the context of charge storage capability, the MXene synthesized at 80 °C has a specific capacitance of 396 F g−1 at 5 mV s−1 which is nearly half of the value compared to the MXene synthesized at 50 °C. In terms of cyclic stability, the MXene synthesized at 80 °C achieve a capacitance retention of 88% after 3,000 charge/discharge cycles at 1,000 mV s−1, slightly lower compared to the 50 °C sample with capacitance retention of 94%. The reduced specific capacitance and cyclic performance for MXene synthesized at 80 °C can be attributed to the excessive oxide layer that prevents the double layer formation on the MXene surface and also defect-rich surface that reduce the redox active sites. In addition, the oxidized MXene prevents efficient ion diffusion near the MXene surface which leads to a relatively higher charge transfer resistance. These reported findings suggest the auspicious potential of tailoring desirable properties for efficacious fabrication of MXene supercapacitors by fine tuning the synthesis parameters. In essence, moderate etching temperature alongside suitable etchant concentration is pivotal in ensuring high yield of high-quality MXene. Higher etching temperatures accelerate the transformation of MAX phases into multi-layered MXene. However, this could trigger surface oxidation that forms undesired TiO2 by-products and suppresses its overall electrical conductivity. On the contrary, low etching temperature reduces the etching rate owing to decreased etchant reactivity, leading to incomplete etching. Similarly, low etchant concentration provides less amount of active intercalant that can be reacted with “A” elements, thus retarding the etching process and yielding MXene with low purity. Consequently, the average synthesis time of MXene is bounded to hour-day scale due to inevitable trade-off between etching rate and product quality that is yet to be mitigated. Taking that into account, other means of reaction intensifying techniques such as microwave and ultrasound assistance can be integrated to complement the synthesis process instead. This can possibly accelerate the etching process without harshening it, preserving the MXene nanosheets from degradation. 5 Revolutionary architecturing of 3D MXene It is important to acknowledge that the electrochemical charge storage capability of an electrode is mainly governed by both charge and ion transport kinetics. Charge transport kinetic is derived from the nature of redox reactions occurring on the electrode surface and their reactivity, characterized by MXene chemical compositions, as well as the behavior of electron migration within the active material, dependent on its electronic states. All of which can be tuned via synthesis design, as discussed above. On the other hand, ion transport kinetic is used to describe to extend of electrolyte ion migration resistance and distance during charging/discharging operations. To tackle this, the pliability of MXene nanosheets allows the design of intricate and effective 3D MXene architectures. The porous 3D interconnected network of MXene retains the intrinsic properties of the 2D MXene nanosheets while realizing higher surface utilization by inhibiting restacking [120,121]. The assembly approaches define the electrochemical properties, including specific capacitance, rate capability, and cyclic stability by tuning the crucial parameters. This includes interlayer spacing, structural tortuosity and pore size control, all of which govern the ion transfer kinetic. Moreover, the chemical and physical stability of these 3D architectures upon repeated charging/discharging cycles is a crucial aspect to be considered as gradual degradation of these structures generally translates to poor cyclic stability. The performances of the different 3D MXene architectures are summarized in Table S2 in the supplementary materials. 5.1 Unidimensional architecturing As studies on exploring novel 3D MXene architectures become widely prevalent recently, the vast amounts of methods reported can be categorizable based on the complexity progression of the structural design. Unidimensional architecturing methods are classified as the strategies involving a single structural formation process that results in 3D architectures with features of similar dimensions. To date, such MXene frameworks are mainly achieved through self-assembly and templating methods. Multidimensional architecturing methods include strategies involving a secondary structural formation process that achieves sequential patterning of features of distinct dimensions, observing a hierarchical effect on the fabricated 3D architectures. This approach describes an array of studies that incorporated templating methods into additive manufacturing technologies, yielding structures with higher levels of intricacy. 5.1.1 Self-assembly The formation of 3D MXene architectures can be facilely accomplished by electrostatic self-assembly technique, wherein 2D MXene building blocks undergo spontaneous gelation with multiple nanomaterials into cross-linked 3D porous structures such as hydrogel or aerogel. In this technique, reductant is needed to initiate gelation process between separate MXene nanosheets via crosslinking of oxygen dangling bonds into an ensemble microstructure, typically with the assistance of a crosslinking agent [122]. Crosslinker also provides abundant functional groups, which can be grafted onto the nanosheets, granting them improved electrochemical reactivity. The assembly of 3D MXene is self-driven through van der Waals attraction between the MXene nanosheets alongside π-π interaction of crosslinker with MXene [123,124]. MXene hydrogel obtained from the crosslinking of nanosheets aided by graphene oxide (GO) and ethylenediamine has abundant macropores and low tortuosity contributed by the elimination of self-restacking and agglomeration of MXene nanosheets (Fig. 6 a) [125]. The as-fabricated supercapacitor delivered 50% higher specific capacitance compared to 2D MXene film, up to 370 F g−1 at 5 A g−1, and remarkable rate capability at ultrahigh scan rate. The enhanced specific capacitance is ascribed to the interconnected channel in self-assembled MXene hydrogel that allows unimpeded ion transfer. Other than ethylenediamine, NH2 and –SH groups on L-cysteine can be used to react with the OH group on MXene and GO to construct a cross-linked hydrogel macrostructure [4]. The assembled 3D macroporous structure offers the increase of lattice spacing and elimination of MXene nanosheets self-restacking, which results in abundant electrochemical active sites. In addition, the staggered channels provide shorter omnidirectional ions transport pathways, thereby facilitating excellent rate capability up to 52.0% under a 1500-fold scan rate increase. In terms of the charge storage mechanism, the 3D macroscopic structure demonstrates capacitive behavior, characterized by a steeper slope at lower frequency ranges in electrochemical impedance spectroscopy. Furthermore, the smooth ion transfer within the macroporous channel is quantitatively evident through power-law calculation with a 'b' value approaching 1, signifying ideal capacitive-controlled charge storage. This low ion transfer resistance environment ultimately mitigates internal resistance fluctuations during charge/discharge cycles. As a result, the 3D MXene electrode maintains more than 98% of its initial capacitance even after undergoing 10,000 cycles of charge/discharge at a scan rate of 1,000 mV s−1. Another work reported the usage of a low-cost bio-derived reductant, lignosulfonate, to address the surface-to-surface restacking issue for MXene by functionalizing the crosslinker and forming a 3D hydrogel under π–π interaction [126]. The self-assembled composite electrode exhibits a noticeable leftward shift from 6.98° to 6.05° in XRD, indicating an increased d-spacing from 1.26 to 1.47 nm. Besides, the interconnected porous structure creates accessible electrochemically active sites to electrolyte ions. As a result, the lignosulfonate-assembled MXene electrode exhibits nearly 200% higher specific capacitance up to 241F/g compared to 2D MXene electrode at a scan rate of 100 mV s−1. In the view of electrochemical impedance spectroscopy, the MXene composite electrode demonstrates nearly vertical impedance in low frequency region, implying excellent capacitive behavior that contributed by efficient ion transfer in 3D porous structure. Collectively, the 3D architecture formed with the assistance of organic crosslinker is capable of retaining 96.3% of its initial capacitance with a coulombic efficiency of 97.4% after 10,000 cycles. On the other hand, cation-induced gelation of MXene nanosheets into porous crosslinked structures can also be conducted with the assistance of metal ions. The introduction of metal ions disrupts electrostatic repulsion between the MXene nanosheets by bonding with the OH groups anchored on the “M” layers and subsequently binding the MXene nanosheets into interconnected porous networks [127]. The formation of MXene hydrogel is preferably catalyzed by divalent metal ions (e.g., Fe2+, Co2+, and Ni2+), that offer sufficient hydration energy to initiate the gelation process. A recent work has shown that the construction of 3D MXene hydrogel relies on the assistance of Zn2+ ions to diminish the electrostatic repulsive forces between MXene nanosheets and serve as a linker to initiate the gelation of MXene and reduced GO [128]. The assembled hydrogel has higher utilization of electrochemically active sites and increased interlayer spacing which allows faster ion transport. As a result, the hydrogel exhibits predominantly surface-controlled capacitive behavior, which leads to excellent rate capability and high specific capacitance of 393 F g−1 at 2 mV s−1, much higher than recently reported 2D MXene electrodes [129,130]. However, the self-assembling of 3D porous MXene architecture is highly disordered and uncontrollable, leading to the formation of void spaces from the unutilized macroscale pores, ultimately decreasing the structural density and volumetric capacitance. To address that, it is recommended to minimize excess void spaces to attain MXene electrodes with dense and ordered interconnected structures that offer enhanced volumetric capacitance [131]. A porous and ordered cross-linked structure can be obtained through self-assembly of Ti3C2Tx nanosheets and chitosan via hydrogen bonding and electrostatic interaction (Fig. 6b) [132]. This Ti3C2Tx@chitosan architecture exhibits a high specific surface area of 194.5 m2 g−1, which is 12-fold greater than pure Ti3C2Tx film, implying that larger ion accessible active sites can be utilized. Moreover, uniformly interconnected porous structure shortens the ion diffusion pathways, thereby allowing faster ion transfer. As a result, the charge storage kinetics of Ti3C2Tx@chitosan electrode is principally governed by surface-controlled capacitive processes. This is evidently shown by the excellent rate capability it displays, enabling it to retain high specific capacitance even at ultrahigh scan rate [133]. Furthermore, the Ti3C2Tx@chitosan electrode demonstrates outstanding cyclic stability, retaining 95.8% of its initial capacitance over 10,000 charge/discharge cycles, even at a high scan rate of 100 mV s−1. This exceptional stability can be attributed to the 3D porous structure induced by chitosan, which effectively minimizes the volume expansion and contraction of the electrode during the charge/discharge cycle. As a result, this structural reinforcement prevents the breakdown of MXene nanosheets, ensuring a consistently stable energy storage performance. In another work, dense 3D MXene network with a tunable porous structure can also be achieved by dissembling 3D MXene hydrogel into microgels and reassembling it with individual MXene nanosheets (Fig. 6c) [134]. The enhanced mesopores proportion contributed by the introduction of microgels facilitates undisturbed ion diffusion kinetics, which is favorable for developing electrodes with high charge storage ability. Notably, the reassembled MXene film attains high specific capacitance up to 736 F cm−3 even under increasing scan rate up to 2,000 mV s−1. Besides, the Trasatti analysis deduces high proportion of surface-controlled capacitance up to 90.8% in microgel-reassembled MXene film, implying efficient utilization of the moderately porous nanostructure. The results underscore the critical role of achieving an optimal balance between porosity and density in achieving exceptional volumetric capacitance, coupled with outstanding rate performance. These studies mark the necessity to explore high-density MXene film with well-distributed mesopores that enhance the ion transfer through the electrode. On the whole, self-assembly is a facile and simple technique to convert 2D MXene nanosheets into 3D porous architectures. The specific capacitance is boosted remarkably from such dimensional evolution, attributed to the enlarged surface area, increased interlayer spacing, interconnected pores and increased amount of exposed active functional groups for alleviated surface-controlled capacitance. The distribution of surface functionalities on 2D MXene nanosheets serves a primary role in establishing the location of crosslinking sites and initiating the process. Thus, nanosheets which are decorated with high concentration of surface functionalities can promote rich interactions with the functional groups of the crosslinker, aiding the facile formation of dense yet highly interconnected porous structures without requiring highly complex assembly procedures. However, it should be noted that self-assembly process lacks the ability to offer high resolution modulation of the resulting porous structure due to the spontaneity and unpredictability of the process itself. Therefore, it results in highly disordered MXene architectures, which tend to perturb ion transport. There has been reported techniques to rapidly align the orientation of MXene nanosheets via electric field during the gelation process to provide higher orderliness of pore arrangement but it is still unable to tune the pore size effectively [135]. It has been widely established that the pore size of these architectures should be similar to that of electrolyte ions, inaccurate size matching will bring about overall capacitance deterioration [136]. Hence, template-assisted formation comes in place as an alternative to offer the perk of precise porosity modulation while building the 3D porous structure. 5.1.2 Templating methods Capitalizing on the mechanical flexibility of delaminated 2D MXene nanosheets, template-assisted assembly facilitates porous structure tuning of the resulting electrode by introducing a backbone scaffold. This is to assist the favorable alignment and directional layer-by-layer construction of MXene nanosheets, contouring the structure of the scaffold material. The scaffold or template material is then removed selectively, resulting in a hollow MXene structure with an intricate porous network (Fig. 7 c and d) that ameliorates ion transport process. Precise porosity modulation of 3D MXene structures is commonly performed by incorporating either ice or polymer template, due to their chemical inertness and versatile shape forming abilities. In fact, tuning the reaction conditions or including functional additives has been reported to be greatly efficacious in customizing the physical characteristics of these templates, leading to a myriad of distinct 3D MXene structures. The facile template designability of this approach allows higher control over the porous structure formation as compared to self-assembly. Hence, numerous research exploited this by probing the effects of various methodically designed 3D MXene structures on the electrode electrochemical properties. The ultimate goal is to collectively strive towards exhaustive optimization of ion transport kinetic, in order to realize high specific capacitance and rate performance simultaneously. Imparted by its abundant negatively charged surface terminations, the high aqueous stability of 2D MXene nanosheets allows the convenient in-situ formation of ice crystals among the nanosheet dispersion. This expands the dense, layered structure and minimizes interlayer Van der Waals interactions [137]. Low pressure sublimation of these ice crystals effectively obtains a highly uniform 3D MXene network formation. A simplistic method was developed where Ti3C2Tx aqueous suspensions were subjected to rapid freezing via immersion in liquid nitrogen, followed by freeze drying and annealing [138]. Two distinct MXene structures of 3D macroporous film and aerogel were obtained, displaying outstanding specific surface areas of 45.1 and 177.6 m2 g−1 respectively. At the low scan rate of 1 mV s−1, the 3D macroporous film achieved a gravimetric capacitance of 378 F g−1 in 3 M H2SO4, which is further increased to 414 F g−1 for MXene aerogel. Calculations showed that 59% and 63% of the capacitive performance were contributed by surface-controlled capacitance for 3D macroporous film and aerogel respectively. This can be logically deduced that the open network of generated macropores in the aerogel provided a more significant specific surface area enhancement, thereby expediting the access of electrolyte ions toward redox-active sites. Consequently, higher redox-active site utilization led to improved gravimetric capacitance, while the larger macropore network aided rapid ion diffusion for boosted surface-controlled capacitance. However, the 3D macroporous film was shown to exhibit a higher volumetric capacitance of 1,355 F cm−3 at 1 A g−1, compared to that of the aerogel at 1,293 F cm−3. Due to different freezing modes, the formation of large interconnected pores within the aerogel occupied higher volume without contributing electrochemical activity, diluting the volumetric capacitance performance. This shows that variation in ice template formations is able to tailor the electrode performance in different aspects, displaying great tunability for specific applications. Unfortunately, strong electrostatic repulsion of negatively charged MXene nanosheets resulted in their weak gelation ability [139–141]. Simple freeze drying of MXene suspension will only yield structures constituted of randomly aligned, sparsely connected nanosheets that impede rapid electron traveling. GO has been commonly used as a gelation agent, but its low conductivity and inferior specific capacitance may degrade the electrochemical performance of the resulting composite structure [125,140,142]. KOH was reportedly added into Ti3C2Tx suspension to weaken the nanosheets’ electronegativity by substituting –F with less electronegative –OH terminations [143]. This aided with the flocculation of colloidal Ti3C2Tx suspension into aggregates and the freeze-dried product obtained an ordered honeycomb-like structure, as shown in Fig. 7(a). Comparing their specific capacitances, the KOH-treated freeze-dried film achieved an enhanced value of 358.8 F g−1 at 20 mV s−1 compared to partially reduced GO as a gelation agent with a value of 218.1 F g−1. The strengthened interlayer bonding between Ti3C2Tx nanosheets suppresses charge transfer resistance, that is otherwise increased by poorly electrical conducting GO. The enhanced charge transfer kinetic alongside excellent ion transfer kinetic induced by the ordered 3D structure, led to the combination of higher specific capacitance and favorable rate performance, retaining 58.6% of its capacitance when increasing the scan rate from 10 to 10,000 mV s−1. Furthermore, 93.8% of its capacitance was retained after 10,000 CV cycles, owing to the strong ordered structure that maintained structural integrity even at high active material mass loading of 16.18 mg cm−2. High areal capacitance of 3.731F cm−2 obtained indicated its thickness-independent performance attributed to the exposure of deep redox-active sites by the construction of such 3D architecture. Aside from KOH treatment, CNT was used as a supporting material where the incorporation of CNT multifunctional spacers prior to freeze drying expands the interlaying spacing of Ti3C2Tx, allowing deeper penetration of water molecules into the internal structure [144]. Referring to Fig. 7(b), the higher amount of interlayer water accommodated during the freezing stage induced a more developed formation of ice crystal networks. Consequently, after the addition of CNT spacers, the specific capacitance evidently increased from 323.3 to 375 F g−1 at scan rate of 5 mV s−1, while the proportion of surface-controlled capacitance increased from 89.6% to 94.5%, owing to greater exposure of redox-active MXene nanosheets surfaces to electrolyte and unhindered ion transport respectively, both contributed by the highly open architecture. Beyond accelerating electron shuttling within the internal electrode microstructures by providing highly conductive pathways, the integrated CNT also improve the structural integrity and flexibility of the fabricated film, successfully obtaining a capacitance retention of 95.9% after 10,000 cycles. Aside from introducing electrochemically inactive materials to tune the porous structure, optimizing the freezing technique and parameters allow variations in the ice crystal growth, thereby altering the direction, shape, and size of the developed macropores. An interesting method was proposed to realize unidirectional freezing where ice crystals were allowed to grow in a single direction following a designed temperature gradient [145]. As a result, Ti3C2Tx nanosheets aligned accordingly such that vertical channels were formed orderly, as shown in Fig. 7(c–e). Subsequent thawing of the frozen structure using H2SO4 removes the ice crystals without destroying the integrity of the remaining microstructure. Among various works reporting the construction of 3D MXene architectures using ice templates, the present technique features a structure with the lowest tortuosity, which is the dominating factor determining its ion transfer kinetic. The ordered Ti3C2Tx hydrogel exhibited excellent specific capacitance of 393.0F/g at 5 mV s−1 and was able to retain 50.3% of it at 1,000 mV s−1. This is attributed to the vertical hollow channels acting as ion transport “highways”, providing unobstructed accessibility toward most redox-active sites even at high scan rates. Aside from maximizing ion transport efficiency, these channels with ultralow tortuosity minimizes structural alterations caused by the process of ions traversing in and out of the channels. Simultaneously, protons contributed by H2SO4 intercalate into the interlayer of Ti3C2Tx, which counteract Van der Waals attraction forces to hinder disassembly of the pre-assembled architecture. Synergistic preservation of the 3D architecture allows a capacitance retention of 95.5% after 10,000 cycles. When fabricated into a micro-supercapacitor (MSC), an areal capacitance of 2.0F cm−2 was achieved at 1.2 mA cm−2. It is suggested that this value can be potentially boosted by optimizing the diameter of the vertically constructed channels to minimize unnecessary void occupancy while maintaining minimal hindrance towards electrolyte ion transport. Another work proposed a dual-step freezing strategy to ensure intricate control over the formation kinetics of ice crystals [137]. The multistage process involved prior rapid freezing at −196 °C; this ultralow freezing temperature triggered a nucleate-dominant process that could initiate uniformly small ice crystallization within the dense interlayer of Ti3C2Tx nanosheets while inhibiting excessive growth of these crystals. This is followed by a second stage of slow rate freezing at −20 °C. The growth-dominant process ensuing from this freezing temperature allows the ice nuclei to grow into large anisotropic crystals, effectively disrupting the interlayer Van der Waals interactions. The elaborate design of ice template network allows the thorough seeding of ice crystals into deep MXene structures before expanding these enclosed layers, maximizing uniform formation between every layer, that is otherwise, unachievable through conventional single-step freeze drying. The comprehensive unravelling of dense internal structures resulted in the high specific capacitance of 398 F g−1 at 0.5 A g−1. However, the generation of highly concentrated, vast porous channels within the MXene structures inevitably degrades areal and volumetric capacitance, demanding further exploration of 3D architectures to address this dilemma. While utilizing an ice crystal template offers a straightforward and inexpensive approach to constructing desirable porous structures, the degree of designability is still relatively limited. On that account, polymer and metal-based spherical templates provide an intriguing alternative as their size and morphology can be directly altered based on their synthesis procedures. As such, a great deal of research has embedded a variety of nanoparticles synthesized from polystyrene (PS), poly(methyl methacrylate) (PMMA), iron (III) hydroxide (Fe(OH)3), and magnesium oxide (MgO) into 2D MXene nanosheet dispersion [45,70,146–152]. This is generally followed by vacuum filtration of the composite material, and further annealing ensures complete template removal; what remains is a MXene skeletal structure with well-defined macropores engraved by the respective template. Therefore, the tweaking of the physicochemical properties of the template material can be directly reflected in the distinct porous structure of the derived MXene films. A comprehensive method was presented to fabricate a high performance flexible MXene-based electrode on the basis of microscale structural engineering and surface chemistry modification [153]. Essentially, PMMA nanospheres were used as template spacers which intercalate into Ti3C2Tx interlayer to facilitate even in-situ polymerization of reactive polymer monomers on the layer surfaces. The combination of PMMA nanospheres and various grown polymers provides the interlayer expansion necessary for the following alkalization step. Alkali treatment with KOH replaces the redox-inactive -F terminations with OH terminations, while K+ ions further participate in the enlargement of interlayer spacing. Removal of PMMA nanospheres and carbonization of the in-situ grown polymer was then performed via calcination, where the OH terminations were also converted to redox-active O terminations. Polymer carbonization successfully grafts its functional groups onto Ti3C2Tx layers, supplying more electrochemically active sites for increased capacitance. Consequently, in-situ carbonization of different polymer types has conspicuously enhanced the capacitive behavior compared to pure Ti3C2Tx film, as shown in Fig. 8 (a). The magnitude of enhancements is dependent on the interlayer expansion and surface functional groups grafting imparted by the different polymers. Similarly, despite undergoing carbonization, the incorporation of different polymers displayed variation in ion transport kinetic of the resulting electrode, influenced by the inherent chemical structure of these polymers. Fig. 8(b) summarizes the varying surface-controlled capacitive proportion for the different carbonized polymers. Notably, the polythiophene-modified electrode (P-MXene/CPTh-A) suffers from exceedingly poor rate performance. This is due to carbonized polythiophene possessing the structure of agglomerated lumps and carrying bulky sulfone bridges, both causing massive hindrance towards ion transport in between MXene nanosheets. Tunability of the electrode capacitive and rate performance is derived from the scrutinization of polymer selected to be incorporated. Conceptually, it can be argued that incorporating large PMMA spherical templates leads to poor volumetric capacitance as the template sacrificial creates large “dead volumes” that does not contribute electrochemical activities. To address this, small Fe(OH)3 nanoparticles with a diameter of 3–5 nm were used to construct nanoscale porous channels within Ti3C2Tx layers [146]. As illustrated in Fig. 8(c), the positive charge of Fe(OH)3 nanoparticles and the negative charge of Ti3C2Tx nanosheets allow tight embedment of nanoparticles onto the layer surfaces via electrostatic attraction. Fig. 8(d and e) distinguish a typical Ti3C2Tx film and the nanoporous film; the generated nanochannels maximize interlayer connectivity and ion accessibility without significantly altering the typical layered structure. Minimal “dead volume” occupied by these nanochannels ensued a remarkable volumetric capacitance of 1,142 F cm−3 was reported, alongside a notable enhancement in the rate capability. The relaxation time constant, τ 0 of the optimized film electrode was calculated to be 1.96 s, experiencing approximately 90% reduction compared to pristine Ti3C2Tx film at 17.24 s, signifying accelerated ion transport. Nonetheless, this comparison was made relative to pure Ti3C2Tx film with restacked layers without any forms of structural modification. There is a possibility that the nanochannels facilitate inferior ion transport kinetic compared to other works that features larger spacious pore channels for suppressed ion transport hindrance. Furthermore, the porous structures discussed thus far have not deviated much from layered configuration; ion diffusion direction perpendicular to the plane of MXene layers is, therefore, only possible along the edges of the nanosheets. The need for electrolyte ions to navigate to the edges in order to traverse into the inner layers for complete surface utilization poses the problem of long diffusion pathways and is reflected in its sluggish ion transport. To target this issue, a recommended methodology is illustrated in Fig. 8(f) [152]. It combines the utilization of MgO nanoparticles as sacrificial templates to indent Ti3C2Tx nanosheets into curvy layers for preventing dense stacking. This was complemented with the intercalation and in-situ decomposition of urea on the curvy Ti3C2Tx nanosheets that create in-plane macropores. The in-plane macropores serve as shortcuts to accelerate the ion shuttling process between adjacent nanosheets. The combined integration of MgO nanoparticles and urea obtained curvy porous layers that ease bidirectional ion transport, parallel and perpendicular to the alignment plane of Ti3C2Tx nanosheets. Unfortunately, the generation of in-plane macropores does not come without a price. The introduction of in-plane surface point defects reduces the amount of surface redox-active sites for charge storage, decreasing its maximum capacitive capability. This may be reflected in mediocre areal and volumetric capacitance, which were not reported in this work. The surface point defects were also shown to act as nucleation sites that escalate localized oxidation into TiO2 crystals, eventually degrading the quality of MXene nanosheets [154,155]. Another approach is to match the template size to that of MXene nanosheets to ensure that the MXene nanosheets tightly contour the template circumference. Removal of the template leads to the remaining MXene structure closely retaining the 3D spherical morphology; this, in turn, completely eliminates the long ion diffusion pathway issue associated with the typical layered structure. An example of this macroporous structure was achieved by wholly wrapping PMMA microspheres with Ti3C2Tx nanosheets [147]. The open spherical morphology drastically shortened the ion diffusion pathways, revealing excellent rate performance. The fabricated macroporous film exhibited extremely low τ0 value of 316 ms, indicating a much more rapid ion transport than the nanoporous film discussed above. This is further supported by the 89% capacitive contribution by surface-controlled activity at the scan rate of 100 mV s−1. This proves that the establishment of “dead volume” minimized nanochannels intensifies its volumetric capacitance, but is plagued with heightened hinderance to the transfer rate of electrolyte ions. From this, it can be deduced that the template size is one of the determining factors that dictates the ion transport kinetic. Realizing the need for an in-depth study on this, the effect of the size difference between the templates and Ti3C2Tx nanosheets on the morphology of as-fabrication Ti3C2Tx foam was investigated [149]. By using PS nanospheres of varying diameters (80, 310, and 570 nm), shown in Fig. 9 (a–c), MXene foams with the corresponding varying cavity diameters were acquired, as shown in Fig. 9(d–f). Comparing the ion transport route for each structure, as shown in Fig. 9(g–i), the appropriate size matching between templates and nanosheets resulted in the shortest transport pathway. Too small a template size still causes the majority of nanosheets to stack layer-by-layer at certain regions, while too large a size squeezes the nanosheets to the free space in between the spherical templates, causing severe stacking at that area as well. The optimized template size also achieved the highest exposure of charge storage sites, resulting in highest utilization of active material, as evident in its highest gravimetric and volumetric capacitance of 474 F g−1 and 1,121 F cm−3 at scan rate of 2 mV s−1, respectively. The least tortuous ion transport pathways allow the highest capacitive retention of 115 F g−1 and 268 F cm−3 as well. Owing to the large pore volume present within these highly porous structures, a final mechanical compression can be performed on the macroporous film to reduce excess void spaces for enhanced areal and volumetric capacitance while retaining its high surface area nature. A high-performance positive electrode was realized by using PS nanospheres as templates and subsequent coating of PANI on the 3D architecture, as illustrated in Fig. 9(j) [45]. The 3D spherical morphology allows uniform surface coating of PANI, which simultaneously amplifies the specific capacitance and protects the Ti3C2Tx nanosheets underneath from oxidation at the anodic potential. After PS sphere removal via annealing, a compact film can be obtained by compressing the hollow porous structure. The electrochemical performance of the fabricated electrode is presented in Fig. 9(k). At a scan rate of 10 mV s−1, excellent gravimetric and volumetric capacitance of 510 F g−1 and 1,632 F cm−3 was achieved at 10 mV s−1, respectively. Its remarkable rate performance is demonstrated by its ability to operate at ultrahigh current density. As reported, a relatively high capacitance retention of 65.4% was observed when raising the current density from 1 to 1,000 A g−1. This is strongly correlated to the high contribution of surface-controlled capacitance at 10 mV s−1, occupying 84% of total capacitance, as depicted through the enclosed area label as “C-10 mV s−1” in the cyclic voltammogram. From this, it is shown that mechanical compression post processing has successfully condense the 3D architecture which improved volumetric capacitance, while also retaining sufficient ion transport macroporous channels to preserve rapid ion transfer kinetic, characterized by its remarkable rate performance. However, it is important to note that its reproducibility should also be considered. As different 3D architectures produced have distinct microstructures that vary from one another, slight local variations in the microstructures may cause amplified consequences on the compressed film. For example, 3D architectures containing locally dense structure may lead to total blockage of ion transport pathways at that area upon compression, ultimately resulting in detrimental rate performance deterioration. Upon critical discussion of a wide range of developed porous structures, it can be concluded that it is incredibly challenging to truly accomplish both high capacitance and high-rate performance concurrently. In fact, it is stressed that the electrode structure should be tailored to meet different performance requirements [70]. A fabricated typical densely packed, 2D layered Ti3C2Tx film attained outstanding volumetric performance of up to 1,500 F cm−3 but severely lagged behind in its rate performance. The opposite was observed for a macroporous Ti3C2Tx film fabricated using PMMA microspheres as sacrificial template. Taking a look at the ion transport resistance for both films, the resistance of macroporous film remained at 0.04 Ω cm2 for all scanning potentials which is multiple magnitudes lower than that of the layered film, associated with the minimization of ion transport distance. Evidently, it still remains a challenge to alleviate the obvious trade-off between the two determining electrode performance parameters [8]. This discovered trade-off can be used to describe the bottleneck faced by self-assembly and templating methods. Referring to Table S2, 3D architectures fabricated via self-assembly techniques generally offers superior rate performance, commonly reported to be able to operate at ultrahigh current densities of 1,000 A g−1, but suffers from poor areal/volumetric capacitance. On the contrary, templating method is able to yield electrodes exhibiting appealing areal and volumetric capacitive performance, often obtaining values beyond 3 F cm−2 and 1000 F cm−3 respectively, they however, lags behind in terms of rate performance. This raises the impending need to further increase the structural design freedom of porous MXene electrodes in order to simultaneously boost both performance parameters beyond the trade-off bounded limitations. Thus, rising research interest are directed towards using additive manufacturing to customize template material with extremely high resolution features [156]. 5.2 Multidimensional architecturing Constructing various 3D architectures via self-assembly and templating strategies have been proven to be widely efficacious in mitigating the restacking phenomenon of MXene, validated by exceptional enhancements of electrode specific surface area, gravimetric capacitance and rate performance. The improved gravimetric capacitance stems from the higher charge storage utilization of MXene nanosheets, essentially reducing “dead mass” that does not contribute electrochemically. Nevertheless, pores formed during the construction of these 3D architectures, regardless of the size, usually generates “dead volume” that brings adverse impacts to its areal or volumetric capacitance. This is undesirable to minimize footprint area and bulkiness in miniatured wearable electronic applications. The pore size draws the trade-off line between areal/volumetric capacitance and rate performance, such that small pore size causes the MXene nanosheets to be more densely packed, offering more charge storage sites per unit area or volume, but induces higher ion transfer resistance with its tortuous pathways. This is vice versa for larger pore size, as illustrated in Fig. 10 (a). In self-assembly techniques, 3D macrostructures are directly assembled by altering the alignment and orientation 2D MXene nanosheets, generally obtaining architectures with larger pore size. In contrast, MXene nanosheets are individually bent to offer microstructure fine tuning with smaller pore size in templating methods. Both approaches are positioned at both ends of the spectrum, where the complexity of structural engineering offered are restricted either by the chemical properties of crosslinking agents for self-assembly, or constraints inherent to mould-based fabrication for templating methods. Hence, there rises a need to look beyond unidimensional approaches and venture into multidimensional architecturing strategies to engineer microstructures onto macrostructures with high structural precision to construct “microstructured macrostructures”. The macrostructure serves as a base network with sufficiently large pore channels for bulk transportation of electrolyte ions while microstructures are built onto the base macrostructure to amplify the concentration of available charge storage sites. Such high precision engineering of miniscule structures is achievable with the inclusion of additive manufacturing technologies. Furthermore, this technological progression is in line with the current trend of fabricating thick electrodes in order to meet the demand for high-power devices [157–159]. Active materials in these electrodes are usually not completely utilized, in the sense that, electrolyte ions have to travel tremendously long pathways through the thick structures. It is often the case that the ions are unable to reach the inner layers, rendering them inactive materials, ultimately degrading its specific capacitance. Additive manufacturing provides the customizability to manually space out dense structures for effortless deep penetration of electrolyte ions, granting it superior thickness-independent capacitance. It is well known that optimizing the formulation of printing ink remains the primary pressing issue to be solved for extrusion-based 3D printing (EBP). MXene, possessing desirable properties intrinsically, presents as a compelling nanomaterial choice for the formulation of these inks. The hydrophilicity of MXene, attributed to its negatively-charged surface functional groups, allows facile dispersion in aqueous media. It has been commonly reported that these MXene inks can be directly employed, displaying shear-thinning properties favourable for its smooth and continuous extrudability, without additive requirements to regulate its rheological properties [164–166]. In fact, by varying the MXene concentration, the ink viscosity can be tuned accordingly [161]. However, additional requirements for a well-formulated ink include excellent electrical conductivity, strong thixotropic behaviour for rapid viscosity recovery at zero-shear state and appropriate viscoelastic characteristics for structural sustainability of 3D printed structures. Therefore, increasing amounts of studies are currently dedicated towards formulating MXene-based 3D printing inks with synergistic properties. A highly concentrated, additive-free, aqueous Ti3C2Tx dispersion was synthesized and utilized as printing ink for direct ink writing (DIW) [160]. Due to the fact that the printed electrodes were air-dried, the Ti3C2Tx nanosheets were deposited layer-by-layer and retained a dense layered structure with severe restacking upon drying, as displayed in Fig. 10(b). Although it was demonstrated that multiple layers can be printed on top of each other while maintaining structural integrity for the fabrication of thick electrodes, the increase in areal capacitance is not proportional to the number of printed layers. At 2 mV s−1, the fabricated MSC attained areal capacitances of 168.1, 315.8, 685.4 and 1,035 mF cm−2 with 1, 2, 5 and 10 printed layers respectively. It can be estimated that the areal capacitances only managed to achieve 93.9%, 81.5% and 61.6% of the ideal value achievable at 2, 5 and 10 layers respectively, assuming it increases proportionally with every layer deposited. Moreover, the rate capability of these electrodes decays with increasing number of printed layers, corroborated by the high τ 0 values of 5.5 s and 24.3 s for single and 10 printed layers respectively, drastically higher than that of the nanoporous and macroporous films discussed above. The MSC with 10 printed layers also exhibited substandard rate performance, with its areal capacitance dropping from 695 mF cm−2 at 10 mV s−1 to a mere 20 mF cm−2 at 1,000 mV s−1. This shows that, despite EBP being able to provide macrostructure designing, it inherently results in dense layered microstructure similar to that of pristine MXene without any auxiliary processing steps, inevitably leading to sluggish ion transfer kinetic. When increasing the number of printed layers, electrolyte ions have to traverse through longer tortuous pathways. Higher proportion of them are unable to reach deep charge storage sites, resulting in disparity between number of printed layers and the ensuing areal capacitance enhancement. Realizing the need to incorporate microstructures onto these macrostructures, an additional step of freeze drying was employed on the wet 3D architectures fabricated from EBP [161]. In this study, an aqueous ink was formulated using high aspect ratio Ti3C2TX nanosheets, this allows rheology tuning at low concentrations, reducing the probability of restacking. The 3D printed structures were freeze dried to rapidly remove water content within the microstructures while maintaining structural integrity of the remaining Ti3C2Tx nanosheets network, resulting in 3D microstructures. Fig. 10(c and d) provide an overview of the 3D printed macrostructure and the subsequent microstructure imprinted by freeze drying. The printed MSC was able to achieve an areal capacitance of 2.1 F cm−2 at 1.7 mA cm−2 and retained a value of 1.0 F cm−2 at 42.7 mA cm−2 (25-fold increase), indicating rate performance enhancement imparted by microstructuring, as compared to the previous work. To further modulate the pore formations of these microstructures, the technique of unidirectional freeze casting (UFC), similar to the one discussed above, was hybridized into a EBP study [162]. In this study, a printing ink comprising of Ti3C2Tx nanosheets, silver nanowires (AgNWs), manganese dioxide wires (MnONWs) and fullerene (C60) was formulated. The inclusion of AgNWs, MnONWs and C60 are to provide electrical conductivity enhancement, boost pseudocapacitance and serve as nanolubricant to minimize sliding friction between adjacent Ti3C2Tx nanosheets for structural flexibility, respectively. A temperature gradient was used to catalyze unidirectional growth of ice crystals, the resulting parallel orientation of Ti3C2Tx nanosheets constructed a honeycomb-like scaffold, as illustrated in Fig. 10(e). The highly dense formation of parallel macroporous channels enables unhindered ion transport in deep charge storage sites, leading to good rate performance, attaining areal capacitance of 216.2 mF cm−2 at 10 mV s−1 and maintaining a value of 72.8 mF cm−2 at high scan rate of 2,000 mV s−1. Furthermore, electrolyte can infiltrate the scaffold to fill up the macropore channels, indirectly preventing the collapse of the microstructures. Consequently, 85% retention of the initial capacitance was achieved after 10,000 charging/discharging cycles. Another study has raised the concern that, these vertical channels are constructed via anisotropic alignment of MXene sheets, ameliorating ion transfer process in the z direction [163]. Due to the fact that electrical conductivity is an anisotropic property as well, the microstructure exhibits good electrical conductivity in the z direction but lags behind in the x-y plane. As a solution, inkjet printing was used to fabricate a current collector, followed by air drying, resulting in horizontally aligned Ti3C2Tx nanosheets. Subsequently, a novel 3D freeze-printing (3DFP) was developed such that droplets of Ti3C2Tx nanosheet dispersion were instantly frozen on the substrate, the printed current collector in this case, following a temperature gradient. Upon freeze drying, the printed MSC consists of bidirectional orientation of Ti3C2Tx nanosheets. Horizontally aligned current collector limits charge transfer resistance in the x-y plane and the vertically aligned macroporous channels accelerate ion transfer process in the z direction, comprehensively enhancing its rate performance. Fig. 10(f) shows the printed macrostructure along with its corresponding aligned microstructure formations. It is also demonstrated that such formation of macroporous channels is advantageous towards achieving thickness-independent performance, where its gravimetric capacitance did not degrade when increasingly thick electrodes were printed. As discussed above, nitride-based MXenes present the advantage of higher electrical conductivity compared to carbide-based MXenes but its utilization is impeded by synthesis limitations. Nitrogen doping (N-doping) carbide-based MXenes presents as a convenient alternative. A study reported the usage of melamine formaldehyde (MF) nanospheres as sacrificial templates, where Ti3C2Tx nanosheets spontaneously encapsulates the nanospheres due to electrostatic interactions [167]. The removal of MF nanospheres via annealing resulted in crumpled N-doped Ti3C2Tx nanosheets. It was subsequently mixed with CNT, GO and activated carbon (AC) to formulate the printing ink for EBP. The presence of Ti-N bonds, validated by X-ray photoelectron spectroscopy, indicated the successful substitution of carbon atoms with the rich nitrogen species contributed by MF. After EBP, the N-doped Ti3C2Tx nanosheets managed to retain their crumpled nature and established 3D microstructures within the printed macrostructures. As a result, the printed single-layer MSC demonstrated excellent areal capacitance of 3.4 F cm−2 at 10 mV s−1. However, it achieved a value of 5.2 F cm−2 with double printed layers, 76.5% of the ideal value achievable if the areal capacitance increases proportionally with printed layers. At three layers, it attained 8.2 F cm−2, 80.4% of the ideal value, which is not a downgraded performance compared to double-layers electrode. This signifies that the areal capacitance enhancement is only marginal at the second printed layer of the electrode. This is possibly due to the weight of the second layer applying stress on the bottom layer, compressing it onto the substrate beneath, causing the 3D microstructures to collapse. The macropores provided by the 3D microstructures in the bottom layer allow interstitial filling of the second layer, minimizing compression stress on the second layer when a third layer is deposited, this applies for any subsequent layers printed. The 3D architecture was proven to be relatively stable upon cycling, retaining 96.2% of the initial capacitance after 5,000 cycles. Majority of the studies incorporating EBP reported thus far, fabricated interdigitated macrostructures for its practical manufacturing of MSCs. The layer-on-layer deposition of EBP comes with the drawback of structural collapse of the bottom layer, this issue may exacerbate when large number of layers are printed to fabricate thick electrodes to meet the demand of high-power demand applications. It is imperative to explore truly 3D macrostructures embedded with overhang features to construct omnidirectional periodic structures. These pre-assembled macrostructures facilitate precise tuning of pore channel diameter and distribution while providing rigidity to limit strain caused by stress induced in all directions, comprehensively preserving ion transport pathways for rapid transfer processes. This allows intensification of areal/volumetric capacitance by building thick electrodes without compromising its rate performance. As it is extremely challenging to obtain such overhang features embedded-macrostructures via EBP, an interesting study incorporated digital light processing (DLP) 3D printing instead [156]. The higher printing resolution of DLP as compared to EBP allowed the printing of a 3D lattice resin template with tiny hollow struts, an aqueous Ti3C2Tx ink was then injected into the hollow struts, completely infusing the template internally. The impregnated template was immersed in NaOH solution to etch the template shell and catalyze the crosslinking of Ti3C2Tx nanosheets into hydrogel network. A final freeze-drying step yielded MXene aerogels with the combination of 3D macrostructures and microstructures, as shown in Fig. 10(g). Owing to the hampered tortuosity contributed by the macrostructure along with the maximization of electrode/electrolyte interface contributed by the microstructure, the 3D architecture electrode exhibited exceptional areal capacitance and rate performance. It managed to achieve 1.23 F cm−2 at 1 mA cm−2 with 83.7% retention at 100 mA cm−2. This is supported by the high capacitive contribution of 91.5% and 93% by surface-controlled mechanisms at 5 and 50 mV s−1 respectively. It also tackles the capacitive performance deterioration associated with thick electrodes, where a capacitance retention of 87% was observed when the mass loading was increased from 9.5 to 54.1 mg cm−2, corresponding a thickness increment from 1 to 6 mm. At the high mass loading of 54.1 mg cm−2, it managed to attain remarkable areal capacitance of 7.5 F cm−2. The assembled 3D architecture aerogel was also proven to be stable, demonstrating a capacitance retention of 97.1% after 10,000 cycles. Conclusively, constructing microstructured macrostructures emerges as an approach that sets the trend for future studies on developing 3D MXene architectures, possessing high potential to negate the seemingly insurmountable trade-off between areal/volumetric capacitance and rate performance. Additive manufacturing technologies, specifically EBP and DLP, provides promising avenues to optimize such 3D architectures owing to their high degree of freedom in designing such structures and precision in fabricating them. 6 Summary, challenges and future perspective MXene has taken a conspicuous place as a formidable electrochemically active material, which is the cornerstone to realize environmentally friendly, clean energy storage and utilization. It is endowed with excellent conductivity, hydrophilicity, and highly tunable chemical and structural diversity which give prospect for designing high performance supercapacitor, featuring high energy density, high power density and long cycle life. A multitude of mechanistic studies have been conducted to unravel the convoluted nature of charge storage process in MXene. It can be generally concluded that MXene shows EDLC behavior in H+-deficient electrolytes such as neutral and basic aqueous electrolytes. The presence of H+ ions allow facile protonation/deprotonation of oxygen-containing terminations on MXene, accompanied by variations in oxidation state of the “M” layer. Pseudocapacitance arose from these interactions offers considerably higher energy density than EDLC realized through physical ion adsorption. Therefore, tuning of the structural properties including interlayer spacing and lateral size, as well as surface functionalities are scrutinized to enhance pseudocapacitance in MXene. Conventional synthesis approaches like HF and in-situ HF etching are extremely hazardous to handle and would impart redox inactive -F terminations in the as-synthesized MXene, subverting redox activity. Alkali and molten salt etching are exceptional techniques to yield fluoride-free MXene but aggressive reaction conditions are seen as an inevitable requirement to attain commensurable effects. Halogen/interhalogen-based and electrochemical etching, thus, offer milder condition requirements. Novel approaches like thermal reduction etching, algae etching, wave-assisted etching and ionic liquid etching were further discovered that prioritize eco-friendliness and energy efficiency. Nevertheless, their as-synthesized MXene has yet to be explored for electrochemical properties, their implementation still needs further investigations, particularly on their reaction mechanisms and the resulting impacts on the MXene properties. Parallel with the propelling research on leveraging the common Ti3C2Tx MXene, new MXene species have been constantly discovered over the years, such as non-titanium-based counterparts of Mo2CTx, Nb3C2Tx, and V4C3Tx, and MXene with a double transition metals layer (e.g., Mo2TiC2Tx). Overall, it can be deduced that the nitride-based MXenes is favourable for supercapacitor electrode over carbide-based MXenes due to the enhanced metallic characteristics resulting from the presence of extra electrons in nitrogen [168]. Furthermore, bi-metallic MXenes outperform their mono-metallic counterparts due to the enhanced electrical conductivity resulting from the presence of multiple transition metal elements. Additionally, the significantly expanded interlayer spacing in bi-metallic MXenes promotes ion diffusion and transfer within electrolyte systems, thereby increasing the number of electrochemically active sites for efficient charge storage. With these advantages in mind, exploring multi-transition metal-based MXenes holds great promise for the future of supercapacitor technology. However, there are numerous theoretically predicted MXenes that have yet to be synthesized. Further effort is required in the discovery of new MAX phase structures to broaden the family of MXene and unveil more potential applications in electrochemical energy storage and conversion. The need to streamline synthesis techniques of nitride- and carbonitride-based MXene is impending as they potentially confer to higher capacitance due to enhanced electrical conductivity stemming from the presence of extra electron from the nitrogen atoms. In spite of the significant progress made in optimizing MXene synthesis methods for enhanced resulting properties, 2D MXene nanosheets with high surface energy are susceptible to agglomeration and restacking. The formation of MXene clusters with smaller surface areas results in longer ion transport path and low density of redox active sites. To avert this shortfall, the 2D MXene nanosheets have been designed to evolve towards 3D MXene architectures with a combination of characteristics that is conducive for both high-rate and high-volume charge storage. In summary, it is essential for an ideal 3D MXene structure to have the following properties working in synergy: (1) hierarchically porous network that maximizes the surface area of MXene nanosheets exposed to electrolyte for better accessibility of redox-active sites and greater active surface utilization; (2) vast amounts of interconnected pores that diminish ion transport hindrance to facilitate rapid omnidirectional ion diffusion between the interspaces of MXene nanosheets; (3) low tortuosity that eliminates redundant and lengthy ion transport pathways to allow high-rate operation of the as-fabricated electrodes; and (4) excellent conductive electron pathways to expedite efficient electron shuttling throughout the entire MXene structure via interconnected MXene nanosheets or addition of conductive spacers. However, the design of 3D MXene architectures often suffers from the trade-off between areal/volumetric capacitance and rate performance. Unidimensional architecturing experiences limited degree of freedom in varying the dimensions of structural fabrication, usually obtaining pores of homogeneous sizes. This bounds the resulting 3D architectures to either possess high areal/volumetric capacitance and low-rate performance, catering to applications such as renewable energy harvesting devices or vice versa, for applications that require short bursts of power like camera flash and power tools. The imminent development of wearable electronics with high-end functions such as smart watches and health monitoring devices drives the demand for ESSs that excel in both performance parameters, as they require high power output and device longevity. On that note, unidimensional architecturing strategies have reached its bottleneck and multidimensional architecturing sets the research direction for future studies, capable of realizing the unprecedented benefits of attaining “microstructured macrostructures”. The coupling of structures with varying dimensions presents the opportunity to challenge the status quo of the mentioned trade-off. The future development of 3D MXene architectures with increasing complexity is largely constraint by the resolution of additive manufacturing technologies. Although EBP provides an inexpensive and rapid method for fabricating freestanding macrostructures, its resolution is currently limited at ∼100 µm [169,170]. Hence, DLP presents an attractive alternative, with reported resolution up to ∼20 µm [171,172]. Technological advancement in higher resolution is beneficial to further reduce the dimensions of printed features, in order to fit in a macrostructure network with higher intricacy per unit area/volume for amplified electrochemical performance. Nonetheless, DLP has only been employed to fabricate templates as its shape forming mechanism relies on heavy chemical additives that essentially retards electrochemical activities. Studies directed towards formulating DLP printing inks with electrochemically active components are thus crucial. Beside tweaking the microscale structure, coupling MXene-based supercapacitors with RE-powered systems is a crucial way out for sustainable energy storage and utilization. The intermittency nature of RE give rise to irregular high energy surges, which can only be effectively captured by high-power density supercapacitors. As portable and wearable devices gained ubiquity nowadays, MXene-based supercapacitors offer greater advantages over other materials due to its superior flexibility that retains electrochemical activity under deformation. Nonetheless, there is a need for discerning a safer electrolyte rather than strong acid and alkali, which can jeopardize human life if leaked during bending. Ideally, more studies on surface termination and electrolyte ion matching are essential to realize novel pseudocapacitive mechanisms that do not necessarily rely on protonation/deprotonation mechanism, eliminating the common mandatory requirement of H2SO4 electrolyte. On top of this, the partial oxidation of MXene due to dissolved oxygen in an aqueous electrolyte can hinder the charge storage performance. The solid electrolyte or transparent gel polymer electrolyte, which allowed significant deformation, can be considered to extend the lifetime of a MXene-based supercapacitor. Upon remediating the innate challenges of fabricating practical, high performance MXene-based supercapacitor, the next question in mind is its potential for large scale manufacturing. There is an emergence of studies aiming at discovering novel MXene synthesis methods that emphasize on production scaling practicality, where a yield of ∼1 kg was successfully attained via etching with supercritical carbon dioxide [173,174]. Nonetheless, the proofs-of-concept in terms of systematic production scalability, provided by these studies were relatively shallow, such that there remain possible underlying problems that must be realized and mitigated. For example, the etching reaction of MAX phase is exothermic by nature, performing it under supercritical environment may cause problematic process heat management. The generation of high temperature, high pressure localities due to inhomogeneous exothermic release not only causes localized oxidation of the MXene product, but also creates overwhelming burden onto the process equipment, leading to costly construction and maintenance fee [175,176]. Thus far, there has only been one study that featured in-depth analysis for the scaling up of Ti3C2TX MXene synthesis, from 1 to 50 g per batch [52]. Despite the study showing indifferent characteristics of MXene synthesized from either batch, issues potentially arising from further scaling up to pilot scale remain unexplored. As discussed above, properties of the MXene product depend heavily on the etching reaction kinetics. Homogeneity of MAX phase particle size and reaction heat distribution are of primary concerns to prevent overetching or incomplete etching in different localities [177]. In terms of process safety, there lies the hazard of metal powder ignition during the synthesis of MAX phase as well as the notorious evolution of HF vapor due to excess exothermic release [178]. However, these issues can be tackled methodically by process engineering such as enclosing MAX phase synthesis reactions in highly inert environment, regulating reaction exothermic release by controlling the feeding rate of MAX phase or directing intense research studies into uncovering the large-scale potential of HF-free synthesis techniques. Regardless of the countless studies showing the attractive prospects of MXene in a broad spectrum of applications beyond energy storage, there is a disproportionate lack of research interest in venturing into scaling up its synthesis and fabrication technologies. A possible reason is that, another hurdle to be tackled is its storage inconvenience and shelf-life limitations. Degradation mechanism of MXene nanosheets and its mitigation strategies have been proposed such as nanosheet edge passivation and optimized storage in organic solvents. However, the complexity of these methods coupled with the numerous concerns present in the upstream processes significantly hamper the reward-to-effort ratio of MXene production [179,180]. While it is crucial to streamline upstream processes, it is equally vital to consider the industrialization of application-driven fabrication. The maturity of downstream processes will generate a steady demand flux for MXene, in turn, placing immense pressure to push the advancements of large-scale upstream technologies. There have been several studies demonstrating the development of scalable methodologies for the fabrication of strong, highly conductive Ti3C2Tx MXene films, but such studies are still non-existent for the fabrication of MXene with 3D architectures [181,182]. A wide range of ingenious methods to construct 3D MXene architectures have been highlighted in this review, but a portion of them involve meticulous procedures and may have low practical value for industrialization. In conclusion, it is recommended that parallel research attention should be given towards both performance enhancement and large-scale practicality when conducting studies on constructing novel architectures for the fabrication of MXene-based supercapacitor electrodes. On that note, the incorporation of additive manufacturing technologies presents a promising direction towards achieving both aspects, ultimately positioning 3D MXene architecture-based supercapacitors at the frontier of ESS studies at both the research and industrial level. Declaration of competing interest The authors declare that they have no known competing financial interests or personal relationships that could have appeared to influence the work reported in this paper. Acknowledgments This work was supported by the Fundamental Research Grant Scheme by Ministry of Higher Education Malaysia (FRGS/1/2021/STG04/XMU/02/1 and FRGS/1/2022/TK09/XMU/03/2), and the Xiamen University Malaysia Research Fund (XMUMRF/2023-C11/IENG/0056). Appendix A Supplementary material Supplementary data to this article can be found online at https://doi.org/10.1016/j.jechem.2023.11.020. Appendix A Supplementary material The following are the Supplementary data to this article: Supplementary data 1 References [1] S. Liu L. Kang J. Henzie J. Zhang J. Ha M.A. Amin M.S.A. Hossain S.C. Jun Y. Yamauchi ACS Nano 15 2021 18931 18973 S. Liu, L. Kang, J. Henzie, J. Zhang, J. Ha, M.A. Amin, M.S.A. Hossain, S.C. Jun, Y. Yamauchi, ACS Nano 15 (2021) 18931-18973. [2] S. Liu L. Kang S.C. Jun Adv. Mater. 33 2021 2004689 S. Liu, L. Kang, S.C. Jun, Adv. Mater. 33 (2021) 2004689. [3] M. Li J. Yang Y. Shi Z. Chen P. Bai H. Su P. Xiong M. Cheng J. Zhao Y. Xu Adv. Mater. 34 2022 2107226 M. Li, J. Yang, Y. Shi, Z. Chen, P. Bai, H. Su, P. Xiong, M. Cheng, J. Zhao, Y. Xu, Adv. Mater. 34 (2022) 2107226. [4] X. Yang Y. Yao Q. Wang K. Zhu K. Ye G. Wang D. Cao J. Yan Adv. Funct. Mater. 32 2022 2109479 X. Yang, Y. Yao, Q. Wang, K. Zhu, K. Ye, G. Wang, D. Cao, J. Yan, Adv. Funct. Mater. 32 (2022) 2109479. [5] S. Liu L. Kang J. Hu E. Jung J. Henzie A. Alowasheeir J. Zhang L. Miao Y. Yamauchi S.C. Jun Small 18 2022 2104507 S. Liu, L. Kang, J. Hu, E. Jung, J. Henzie, A. Alowasheeir, J. Zhang, L. Miao, Y. Yamauchi, S.C. Jun, Small 18 (2022) 2104507. [6] S. Liu L. Kang J. Zhang E. Jung S. Lee S.C. Jun Energy Storage Mater. 32 2020 167 177 S. Liu, L. Kang, J. Zhang, E. Jung, S. Lee, S.C. Jun, Energy Storage Mater. 32 (2020) 167-177. [7] B. Fu J. Sun C. Wang C. Shang L. Xu J. Li H. Zhang Small 17 2021 2006054 B. Fu, J. Sun, C. Wang, C. Shang, L. Xu, J. Li, H. Zhang, Small 17 (2021) 2006054. [8] M.R. Lukatskaya S. Kota Z. Lin M.-Q. Zhao N. Shpigel M.D. Levi J. Halim P.-L. Taberna M.W. Barsoum P. Simon Y. Gogotsi Nat. Energy 2 2017 17105 M.R. Lukatskaya, S. Kota, Z. Lin, M.-Q. Zhao, N. Shpigel, M.D. Levi, J. Halim, P.-L. Taberna, M.W. Barsoum, P. Simon, Y. Gogotsi, Nat. Energy 2 (2017) 17105. [9] T.S. Mathis K. Maleski A. Goad A. Sarycheva M. Anayee A.C. Foucher K. Hantanasirisakul C.E. Shuck E.A. Stach Y. Gogotsi ACS Nano 15 2021 6420 6429 T.S. Mathis, K. Maleski, A. Goad, A. Sarycheva, M. Anayee, A.C. Foucher, K. Hantanasirisakul, C.E. Shuck, E.A. Stach, Y. Gogotsi, ACS Nano 15 (2021) 6420-6429. [10] Y.-L. Huang S.-W. Bian J. Mater. Chem. A 9 2021 21347 21356 Y.-L. Huang, S.-W. Bian, J. Mater. Chem. A 9 (2021) 21347-21356. [11] T. Zhou C. Wu Y. Wang A.P. Tomsia M. Li E. Saiz S. Fang R.H. Baughman L. Jiang Q. Cheng Nat. Commun. 11 2020 2077 T. Zhou, C. Wu, Y. Wang, A.P. Tomsia, M. Li, E. Saiz, S. Fang, R.H. Baughman, L. Jiang, Q. Cheng, Nat. Commun. 11 (2020) 2077. [12] Q. Li J. Zhou F. Li Z. Sun Appl. Surf. Sci. 530 2020 147214 Q. Li, J. Zhou, F. Li, Z. Sun, Appl. Surf. Sci. 530 (2020) 147214. [13] V. Natu M. Sokol L. Verger M.W. Barsoum J. Phys. Chem. C 122 2018 27745 27753 V. Natu, M. Sokol, L. Verger, M.W. Barsoum, J. Phys. Chem. C 122 (2018) 27745-27753. [14] R. Zhao H. Di X. Hui D. Zhao R. Wang C. Wang L. Yin Energy Environ. Sci. 13 2020 246 257 R. Zhao, H. Di, X. Hui, D. Zhao, R. Wang, C. Wang, L. Yin, Energy Environ. Sci. 13 (2020) 246-257. [15] J. Libich J. Máca J. Vondrák O. Čech M. Sedlaříková J. Energy Storage 17 2018 224 227 J. Libich, J. Máca, J. Vondrák, O. Čech, M. Sedlaříková, J. Energy Storage 17 (2018) 224-227. [16] S. Karthikeyan B. Narenthiran A. Sivanantham L.D. Bhatlu T. Maridurai Mater. Today Proc. 46 2021 3984 3988 S. Karthikeyan, B. Narenthiran, A. Sivanantham, L.D. Bhatlu, T. Maridurai, Mater. Today Proc. 46 (2021) 3984-3988. [17] H. Wang J. Lin Z.X. Shen J. Sci. Adv. Mater. Devices 1 2016 225 255 H. Wang, J. Lin, Z.X. Shen, J. Sci. Adv. Mater. Devices 1 (2016) 225-255. [18] V. Augustyn P. Simon B. Dunn Energy Environ. Sci. 7 2014 1597 1614 V. Augustyn, P. Simon, B. Dunn, Energy Environ. Sci. 7 (2014) 1597-1614. [19] L. Liu L. Su Y. Lu Q. Zhang L. Zhang S. Lei S. Shi M.D. Levi X. Yan Adv. Funct. Mater. 29 2019 1806778 L. Liu, L. Su, Y. Lu, Q. Zhang, L. Zhang, S. Lei, S. Shi, M.D. Levi, X. Yan, Adv. Funct. Mater. 29 (2019) 1806778. [20] D. Majumdar J. Electroanal. Chem. 880 2021 114825 D. Majumdar, J. Electroanal. Chem. 880 (2021) 114825. [21] Y. Ando M. Okubo A. Yamada M. Otani Ad. Funct. Mater. 30 2020 2000820 Y. Ando, M. Okubo, A. Yamada, M. Otani, Ad. Funct. Mater. 30 (2020) 2000820. [22] A. Patra C.S. Rout Energy Storage 5 2023 e411 A. Patra, C.S. Rout, Energy Storage 5 (2023) e411. [23] A. VahidMohammadi M. Mojtabavi N.M. Caffrey M. Wanunu M. Beidaghi Adv. Mater. 31 2019 1806931 A. VahidMohammadi, M. Mojtabavi, N.M. Caffrey, M. Wanunu, M. Beidaghi, Adv. Mater. 31 (2019) 1806931. [24] J. Li H. Wang X. Xiao Energy Environ. Mater. 3 2020 306 322 J. Li, H. Wang, X. Xiao, Energy Environ. Mater. 3 (2020) 306-322. [25] R. Karkuzhali S. Manoj K. Shanmugapriya A.V. Narendra Kumar G. Gopu N. Muniyappan B.-H. Jeon S. Muthu Prabhu J. Solid State Chem. 306 2022 122727 R. Karkuzhali, S. Manoj, K. Shanmugapriya, A.V. Narendra Kumar, G. Gopu, N. Muniyappan, B.-H. Jeon, S. Muthu Prabhu, J. Solid State Chem. 306 (2022) 122727. [26] A.K. Tomar T. Kshetri N.H. Kim J.H. Lee Energy Storage Mater. 50 2022 86 95 A.K. Tomar, T. Kshetri, N.H. Kim, J.H. Lee, Energy Storage Mater. 50 (2022) 86-95. [27] G. Bergman E. Ballas Q. Gao A. Nimkar B. Gavriel M.D. Levi D. Sharon F. Malchik X. Wang N. Shpigel D. Mandler D. Aurbach Adv. Energy Mater. 2023 2203154 G. Bergman, E. Ballas, Q. Gao, A. Nimkar, B. Gavriel, M.D. Levi, D. Sharon, F. Malchik, X. Wang, N. Shpigel, D. Mandler, D. Aurbach, Adv. Energy Mater. n/a (2023) 2203154. [28] H. Jalali F. Khoeini F.M. Peeters M. Neek-Amal Nanoscale 13 2021 922 929 H. Jalali, F. Khoeini, F.M. Peeters, M. Neek-Amal, Nanoscale 13 (2021) 922-929. [29] A. Sugahara Y. Ando S. Kajiyama K. Yazawa K. Gotoh M. Otani M. Okubo A. Yamada Nat. Commun. 10 2019 1 7 A. Sugahara, Y. Ando, S. Kajiyama, K. Yazawa, K. Gotoh, M. Otani, M. Okubo, A. Yamada, Nat. Commun. 10 (2019) 1-7. [30] M.R. Lukatskaya O. Mashtalir C.E. Ren Y. Dall’Agnese P. Rozier P.L. Taberna M. Naguib P. Simon M.W. Barsoum Y. Gogotsi Science 341 2013 1502 1505 M.R. Lukatskaya, O. Mashtalir, C.E. Ren, Y. Dall’Agnese, P. Rozier, P.L. Taberna, M. Naguib, P. Simon, M.W. Barsoum, Y. Gogotsi, Science 341 (2013) 1502-1505. [31] D. Johnson K. Hansen R. Yoo A. Djire ChemElectroChem 9 2022 e202200555 D. Johnson, K. Hansen, R. Yoo, A. Djire, ChemElectroChem 9 (2022) e202200555. [32] X. Mu D. Wang F. Du G. Chen C. Wang Y. Wei Y. Gogotsi Y. Gao Y. Dall'Agnese Adv. Funct. Mater. 29 2019 1902953 X. Mu, D. Wang, F. Du, G. Chen, C. Wang, Y. Wei, Y. Gogotsi, Y. Gao, Y. Dall'Agnese, Adv. Funct. Mater. 29 (2019) 1902953. [33] H. Shao Z. Lin K. Xu P.-L. Taberna P. Simon Energy Storage Mater. 18 2019 456 461 H. Shao, Z. Lin, K. Xu, P.-L. Taberna, P. Simon, Energy Storage Mater. 18 (2019) 456-461. [34] C.K. Kamaja S. Mitra Gaganjot M. Katiyar Energy Fuels 36 2022 703 709 C.K. Kamaja, S. Mitra, Gaganjot, M. Katiyar, Energy Fuels 36 (2022) 703-709. [35] Q. Jiang N. Kurra M. Alhabeb Y. Gogotsi H.N. Alshareef Adv. Energy Mater. 8 2018 1703043 Q. Jiang, N. Kurra, M. Alhabeb, Y. Gogotsi, H.N. Alshareef, Adv. Energy Mater. 8 (2018) 1703043. [36] J. Tang T.S. Mathis N. Kurra A. Sarycheva X. Xiao M.N. Hedhili Q. Jiang H.N. Alshareef B. Xu F. Pan Y. Gogotsi Angew. Chem. Int. Ed. 58 2019 17849 17855 J. Tang, T.S. Mathis, N. Kurra, A. Sarycheva, X. Xiao, M.N. Hedhili, Q. Jiang, H.N. Alshareef, B. Xu, F. Pan, Y. Gogotsi, Angew. Chem. Int. Ed. 58 (2019) 17849-17855. [37] L. Lorencova T. Bertok E. Dosekova A. Holazova D. Paprckova A. Vikartovska V. Sasinkova J. Filip P. Kasak M. Jerigova D. Velic K.A. Mahmoud J. Tkac Electrochim. Acta 235 2017 471 479 L. Lorencova, T. Bertok, E. Dosekova, A. Holazova, D. Paprckova, A. Vikartovska, V. Sasinkova, J. Filip, P. Kasak, M. Jerigova, D. Velic, K.A. Mahmoud, J. Tkac, Electrochim. Acta 235 (2017) 471-479. [38] W. Liang I. Zhitomirsky J. Mater. Chem. A 9 2021 10335 10344 W. Liang, I. Zhitomirsky, J. Mater. Chem. A 9 (2021) 10335-10344. [39] M. Hu C. Cui C. Shi Z.-S. Wu J. Yang R. Cheng T. Guang H. Wang H. Lu X. Wang ACS Nano 13 2019 6899 6905 M. Hu, C. Cui, C. Shi, Z.-S. Wu, J. Yang, R. Cheng, T. Guang, H. Wang, H. Lu, X. Wang, ACS Nano 13 (2019) 6899-6905. [40] D.P. Chatterjee A.K. Nandi J. Mater. Chem. A 9 2021 15880 15918 D.P. Chatterjee, A.K. Nandi, J. Mater. Chem. A 9 (2021) 15880-15918. [41] E. Lim H. Kim C. Jo J. Chun K. Ku S. Kim H.I. Lee I.-S. Nam S. Yoon K. Kang ACS Nano 8 2014 8968 8978 E. Lim, H. Kim, C. Jo, J. Chun, K. Ku, S. Kim, H.I. Lee, I.-S. Nam, S. Yoon, K. Kang, ACS Nano 8 (2014) 8968-8978. [42] N.M. Abbasi Y. Xiao L. Zhang L. Peng Y. Duo L. Wang P. Yin Y. Ge H. Zhu B. Zhang J. Mater. Chem. C 9 2021 8395 8465 N.M. Abbasi, Y. Xiao, L. Zhang, L. Peng, Y. Duo, L. Wang, P. Yin, Y. Ge, H. Zhu, B. Zhang, J. Mater. Chem. C 9 (2021) 8395-8465. [43] X. Wang D. Zhang H. Zhang L. Gong Y. Yang W. Zhao S. Yu Y. Yin D. Sun Nano Energy 88 2021 106242 X. Wang, D. Zhang, H. Zhang, L. Gong, Y. Yang, W. Zhao, S. Yu, Y. Yin, D. Sun, Nano Energy 88 (2021) 106242. [44] M. Mahmood K. Chaudhary M. Shahid I. Shakir P.O. Agboola M. Aadil Ceram. Int. 48 2022 19314 19323 M. Mahmood, K. Chaudhary, M. Shahid, I. Shakir, P.O. Agboola, M. Aadil, Ceram. Int. 48 (2022) 19314-19323. [45] K. Li X. Wang S. Li P. Urbankowski J. Li Y. Xu Y.J.S. Gogotsi Small 16 2020 1906851 K. Li, X. Wang, S. Li, P. Urbankowski, J. Li, Y. Xu, Y.J.S. Gogotsi, Small 16 (2020) 1906851. [46] X. Xiao H. Yu H. Jin M. Wu Y. Fang J. Sun Z. Hu T. Li J. Wu L. Huang Y. Gogotsi J. Zhou ACS Nano 11 2017 2180 2186 X. Xiao, H. Yu, H. Jin, M. Wu, Y. Fang, J. Sun, Z. Hu, T. Li, J. Wu, L. Huang, Y. Gogotsi, J. Zhou, ACS Nano 11 (2017) 2180-2186. [47] F. Zhang Z. Zhang H. Wang C.H. Chan N.Y. Chan X.X. Chen J.-Y. Dai Phys. Rev. Mater. 1 2017 034002 F. Zhang, Z. Zhang, H. Wang, C.H. Chan, N.Y. Chan, X.X. Chen, J.-Y. Dai, Phys. Rev. Mater. 1 (2017) 034002. [48] Y. Gogotsi Nat. Mater. 14 2015 1079 1080 Y. Gogotsi, Nat. Mater. 14 (2015) 1079-1080. [49] D. Wang C. Zhou A.S. Filatov W. Cho F. Lagunas M. Wang S. Vaikuntanathan C. Liu R.F. Klie D.V.J.S. Talapin Science 379 2023 1242 1247 D. Wang, C. Zhou, A.S. Filatov, W. Cho, F. Lagunas, M. Wang, S. Vaikuntanathan, C. Liu, R.F. Klie, D.V.J.S. Talapin, Science 379 (2023) 1242-1247. [50] D. Geng X. Zhao Z. Chen W. Sun W. Fu J. Chen W. Liu W. Zhou K.P. Loh Adv. Mater. 29 2017 1700072 D. Geng, X. Zhao, Z. Chen, W. Sun, W. Fu, J. Chen, W. Liu, W. Zhou, K.P. Loh, Adv. Mater. 29 (2017) 1700072. [51] C. Xu L. Wang Z. Liu L. Chen J. Guo N. Kang X.-L. Ma H.-M. Cheng W. Ren Nat. Mater. 14 2015 1135 1141 C. Xu, L. Wang, Z. Liu, L. Chen, J. Guo, N. Kang, X.-L. Ma, H.-M. Cheng, W. Ren, Nat. Mater. 14 (2015) 1135-1141. [52] C.E. Shuck A. Sarycheva M. Anayee A. Levitt Y. Zhu S. Uzun V. Balitskiy V. Zahorodna O. Gogotsi Y. Gogotsi Adv. Eng. Mater. 22 2020 1901241 C.E. Shuck, A. Sarycheva, M. Anayee, A. Levitt, Y. Zhu, S. Uzun, V. Balitskiy, V. Zahorodna, O. Gogotsi, Y. Gogotsi, Adv. Eng. Mater. 22 (2020) 1901241. [53] S. Jolly M.P. Paranthaman M. Naguib Mater. Today Adv. 10 2021 100139 S. Jolly, M.P. Paranthaman, M. Naguib, Mater. Today Adv. 10 (2021) 100139. [54] A. Liu Q. Yang X. Ren F. Meng L. Gao M. Gao Y. Yang T. Ma G. Wu Ceram. Inter. 46 2020 6934 6939 A. Liu, Q. Yang, X. Ren, F. Meng, L. Gao, M. Gao, Y. Yang, T. Ma, G. Wu, Ceram. Inter. 46 (2020) 6934-6939. [55] N.C. Ghosh S.P. Harimkar 3 - Consolidation and synthesis of MAX phases by Spark Plasma Sintering (SPS): a review I.M. Low Advances in Science and Technology of Mn+1AXn Phases 2012 Woodhead Publishing United Kingdom 47 80 N.C. Ghosh, S.P. Harimkar, 3 - Consolidation and synthesis of MAX phases by Spark Plasma Sintering (SPS): a review, in: I.M. Low (Ed.) Advances in Science and Technology of Mn+1AXn Phases, Woodhead Publishing, United Kingdom, 2012, pp. 47-80. [56] M. Naguib V.N. Mochalin M.W. Barsoum Y. Gogotsi Adv. Mater. 26 2014 992 1005 M. Naguib, V.N. Mochalin, M.W. Barsoum, Y. Gogotsi, Adv. Mater. 26 (2014) 992-1005. [57] M. Naguib M. Kurtoglu V. Presser J. Lu J. Niu M. Heon L. Hultman Y. Gogotsi M.W. Barsoum Adv. Mater. 23 2011 4248 4253 M. Naguib, M. Kurtoglu, V. Presser, J. Lu, J. Niu, M. Heon, L. Hultman, Y. Gogotsi, M.W. Barsoum, Adv. Mater. 23 (2011) 4248-4253. [58] M. Ghidiu M. Naguib C. Shi O. Mashtalir L.M. Pan B. Zhang J. Yang Y. Gogotsi S.J.L. Billinge M.W. Barsoum Chem. Commun. 50 2014 9517 9520 M. Ghidiu, M. Naguib, C. Shi, O. Mashtalir, L.M. Pan, B. Zhang, J. Yang, Y. Gogotsi, S.J.L. Billinge, M.W. Barsoum, Chem. Commun. 50 (2014) 9517-9520. [59] M. Naguib J. Halim J. Lu K.M. Cook L. Hultman Y. Gogotsi M.W. Barsoum J. Am. Chem. Soc. 135 2013 15966 15969 M. Naguib, J. Halim, J. Lu, K.M. Cook, L. Hultman, Y. Gogotsi, M.W. Barsoum, J. Am. Chem. Soc. 135 (2013) 15966-15969. [60] M. Naguib O. Mashtalir J. Carle V. Presser J. Lu L. Hultman Y. Gogotsi M.W. Barsoum ACS Nano 6 2012 1322 1331 M. Naguib, O. Mashtalir, J. Carle, V. Presser, J. Lu, L. Hultman, Y. Gogotsi, M.W. Barsoum, ACS Nano 6 (2012) 1322-1331. [61] J. Zhou X. Zha F.Y. Chen Q. Ye P. Eklund S. Du Q. Huang Angew. Chem. Int. Ed. 55 2016 5008 5013 J. Zhou, X. Zha, F.Y. Chen, Q. Ye, P. Eklund, S. Du, Q. Huang, Angew. Chem. Int. Ed. 55 (2016) 5008-5013. [62] M. Ghidiu M.R. Lukatskaya M.-Q. Zhao Y. Gogotsi M.W. Barsoum Nature 516 2014 78 81 M. Ghidiu, M.R. Lukatskaya, M.-Q. Zhao, Y. Gogotsi, M.W. Barsoum, Nature 516 (2014) 78-81. [63] M. Alhabeb K. Maleski B. Anasori P. Lelyukh L. Clark S. Sin Y. Gogotsi Chem. Mater. 29 2017 7633 7644 M. Alhabeb, K. Maleski, B. Anasori, P. Lelyukh, L. Clark, S. Sin, Y. Gogotsi, Chem. Mater. 29 (2017) 7633-7644. [64] M.A. Hope A.C. Forse K.J. Griffith M.R. Lukatskaya M. Ghidiu Y. Gogotsi C.P. Grey Phys. Chem. Chem. Phys. 18 2016 5099 5102 M.A. Hope, A.C. Forse, K.J. Griffith, M.R. Lukatskaya, M. Ghidiu, Y. Gogotsi, C.P. Grey, Phys. Chem. Chem. Phys. 18 (2016) 5099-5102. [65] S. Kajiyama L. Szabova H. Iinuma A. Sugahara K. Gotoh K. Sodeyama Y. Tateyama M. Okubo A. Yamada Adv. Energy Mater. 7 2017 1601873 S. Kajiyama, L. Szabova, H. Iinuma, A. Sugahara, K. Gotoh, K. Sodeyama, Y. Tateyama, M. Okubo, A. Yamada, Adv. Energy Mater. 7 (2017) 1601873. [66] C. Zhan M. Naguib M. Lukatskaya P.R.C. Kent Y. Gogotsi D.-E. Jiang J. Phys. Chem. Lett. 9 2018 1223 1228 C. Zhan, M. Naguib, M. Lukatskaya, P.R.C. Kent, Y. Gogotsi, D.-e. Jiang, J. Phys. Chem. Lett. 9 (2018) 1223-1228. [67] G. Zhang H. Xu J. Hu Adv. Powder Technol. 32 2021 4384 4390 G. Zhang, H. Xu, J. Hu, Adv. Powder Technol. 32 (2021) 4384-4390. [68] M.Z. Yahaya M.F.M. Nazeri N.A. Salleh A. Kurt S. Kheawhom B. Illes A. Skwarek A.M. Abdullah A.A. Mohamad Mater. Today Commun. 33 2022 104520 M.Z. Yahaya, M.F.M. Nazeri, N.A. Salleh, A. Kurt, S. Kheawhom, B. Illes, A. Skwarek, A.M. Abdullah, A.A. Mohamad, Mater. Today Commun. 33 (2022) 104520. [69] A.H. Reshak M.M. Shahimin S. Shaari N. Johan Prog. Biophys. Mol. Biol. 113 2013 327 332 A.H. Reshak, M.M. Shahimin, S. Shaari, N. Johan, Prog. Biophys. Mol. Biol. 113 (2013) 327-332. [70] B. Anasori M.R. Lukatskaya Y. Gogotsi Nat. Rev. Mater. 2 2017 1 17 B. Anasori, M.R. Lukatskaya, Y. Gogotsi, Nat. Rev. Mater. 2 (2017) 1-17. [71] J. Nan X. Guo J. Xiao X. Li W. Chen W. Wu H. Liu Y. Wang M. Wu G. Wang Small 17 2021 1902085 J. Nan, X. Guo, J. Xiao, X. Li, W. Chen, W. Wu, H. Liu, Y. Wang, M. Wu, G. Wang, Small 17 (2021) 1902085. [72] T. Li L. Yao Q. Liu J. Gu R. Luo J. Li X. Yan W. Wang P. Liu B. Chen Angew. Chem. Int. Ed. 57 2018 6115 6119 T. Li, L. Yao, Q. Liu, J. Gu, R. Luo, J. Li, X. Yan, W. Wang, P. Liu, B. Chen, Angew. Chem. Int. Ed. 57 (2018) 6115-6119. [73] J. Xuan Z. Wang Y. Chen D. Liang L. Cheng X. Yang Z. Liu R. Ma T. Sasaki F. Geng Angew. Chem. 128 2016 14789 14794 J. Xuan, Z. Wang, Y. Chen, D. Liang, L. Cheng, X. Yang, Z. Liu, R. Ma, T. Sasaki, F. Geng, Angew. Chem. 128 (2016) 14789-14794. [74] C.J. Zhang S. Pinilla N. McEvoy C.P. Cullen B. Anasori E. Long S.-H. Park A. Seral-Ascaso A. Shmeliov D. Krishnan Chem. Mater. 29 2017 4848 4856 C.J. Zhang, S. Pinilla, N. McEvoy, C.P. Cullen, B. Anasori, E. Long, S.-H. Park, A. Seral-Ascaso, A. Shmeliov, D. Krishnan, Chem. Mater. 29 (2017) 4848-4856. [75] G. Zou Q. Zhang C. Fernandez G. Huang J. Huang Q. Peng ACS Nano 11 2017 12219 12229 G. Zou, Q. Zhang, C. Fernandez, G. Huang, J. Huang, Q. Peng, ACS Nano 11 (2017) 12219-12229. [76] P. Urbankowski B. Anasori T. Makaryan D. Er S. Kota P.L. Walsh M. Zhao V.B. Shenoy M.W. Barsoum Y. Gogotsi Nanoscale 8 2016 11385 11391 P. Urbankowski, B. Anasori, T. Makaryan, D. Er, S. Kota, P.L. Walsh, M. Zhao, V.B. Shenoy, M.W. Barsoum, Y. Gogotsi, Nanoscale 8 (2016) 11385-11391. [77] M. Li J. Lu K. Luo Y. Li K. Chang K. Chen J. Zhou J. Rosen L. Hultman P. Eklund J. Am. Chem. Soc. 141 2019 4730 4737 M. Li, J. Lu, K. Luo, Y. Li, K. Chang, K. Chen, J. Zhou, J. Rosen, L. Hultman, P. Eklund, J. Am. Chem. Soc. 141 (2019) 4730-4737. [78] Q. Wu P. Li Y. Wang F. Wu Appl. Surf. Sci. 593 2022 153380 Q. Wu, P. Li, Y. Wang, F. Wu, Appl. Surf. Sci. 593 (2022) 153380. [79] H. Shi P. Zhang Z. Liu S. Park M.R. Lohe Y. Wu A. Shaygan Nia S. Yang X. Feng Angew Chem. Int. Ed. 60 2021 8689 8693 H. Shi, P. Zhang, Z. Liu, S. Park, M.R. Lohe, Y. Wu, A. Shaygan Nia, S. Yang, X. Feng, Angew. Chem. Int. Ed. 60 (2021) 8689-8693. [80] A. Jawaid A. Hassan G. Neher D. Nepal R. Pachter W.J. Kennedy S. Ramakrishnan R.A. Vaia ACS Nano 15 2021 2771 2777 A. Jawaid, A. Hassan, G. Neher, D. Nepal, R. Pachter, W.J. Kennedy, S. Ramakrishnan, R.A. Vaia, ACS Nano 15 (2021) 2771-2777. [81] J. Chen M. Chen W. Zhou X. Xu B. Liu W. Zhang C. Wong ACS Nano 16 2022 2461 2470 J. Chen, M. Chen, W. Zhou, X. Xu, B. Liu, W. Zhang, C. Wong, ACS Nano 16 (2022) 2461-2470. [82] M. Song S.-Y. Pang F. Guo M.-C. Wong J. Hao Adv. Sci. 7 2020 2001546 M. Song, S.-Y. Pang, F. Guo, M.-C. Wong, J. Hao, Adv. Sci. 7 (2020) 2001546. [83] W. Sun S.A. Shah Y. Chen Z. Tan H. Gao T. Habib M. Radovic M.J. Green J. Mater. Chem. A 5 2017 21663 21668 W. Sun, S.A. Shah, Y. Chen, Z. Tan, H. Gao, T. Habib, M. Radovic, M.J. Green, J. Mater. Chem. A, 5 (2017) 21663-21668. [84] A. Heidarpour M. Faraji A. Haghighi Ceram. Int. 48 2022 11466 11474 A. Heidarpour, M. Faraji, A. Haghighi, Ceram. Int. 48 (2022) 11466-11474. [85] S. Yang P. Zhang F. Wang A.G. Ricciardulli M.R. Lohe P.W.M. Blom X. Feng Angew. Chem. 130 2018 15717 15721 S. Yang, P. Zhang, F. Wang, A.G. Ricciardulli, M.R. Lohe, P.W.M. Blom, X. Feng, Angew. Chem. 130 (2018) 15717-15721. [86] F. Han S. Luo L. Xie J. Zhu W. Wei X. Chen F. Liu W. Chen J. Zhao L. Dong ACS Appl. Mater. Interfaces 11 2019 8443 8452 F. Han, S. Luo, L. Xie, J. Zhu, W. Wei, X. Chen, F. Liu, W. Chen, J. Zhao, L. Dong, ACS Appl. Mater. Interfaces 11 (2019) 8443-8452. [87] L. Zhang D. Huang P. Zhao G. Yue L. Yang W. Dan Sep. Purif. Technol. 288 2022 120718 L. Zhang, D. Huang, P. Zhao, G. Yue, L. Yang, W. Dan, Sep. Purif. Technol. 288 (2022) 120718. [88] S.-Y. Pang Y.-T. Wong S. Yuan Y. Liu M.-K. Tsang Z. Yang H. Huang W.-T. Wong J. Hao J. Am. Chem. Soc. 141 2019 9610 9616 S.-Y. Pang, Y.-T. Wong, S. Yuan, Y. Liu, M.-K. Tsang, Z. Yang, H. Huang, W.-T. Wong, J. Hao, J. Am. Chem. Soc. 141 (2019) 9610-9616. [89] M.Q. Zhao M. Sedran Z. Ling M.R. Lukatskaya O. Mashtalir M. Ghidiu B. Dyatkin D.J. Tallman T. Djenizian M.W. Barsoum Y. Gogotsi Angew. Chem. Int. Ed. 54 2015 4810 4814 M.Q. Zhao, M. Sedran, Z. Ling, M.R. Lukatskaya, O. Mashtalir, M. Ghidiu, B. Dyatkin, D.J. Tallman, T. Djenizian, M.W. Barsoum, Y. Gogotsi, Angew. Chem. Int. Ed. 54 (2015) 4810-4814. [90] J. Mei G.A. Ayoko C. Hu Z. Sun J. Chem. Eng. 395 2020 125111 J. Mei, G.A. Ayoko, C. Hu, Z. Sun, J. Chem. Eng. 395 (2020) 125111. [91] Y.Y. Chan Y.L. Pang S. Lim W.C. Chong J. Environ. Chem. Eng. 9 2021 105417 Y.Y. Chan, Y.L. Pang, S. Lim, W.C. Chong, J. Environ. Chem. Eng. 9 (2021). [92] N. Priya K. Kaur A.K. Sidhu Front. Nanotechnol. 3 2021 10.3389/fnano.2021.655062 Priya, Naveen, K. Kaur, A.K. Sidhu, Front. Nanotechnol. 3 (2021). [93] S. Zada W. Dai Z. Kai H. Lu X. Meng Y. Zhang Y. Cheng F. Yan P. Fu X. Zhang Angew. Chem. Int. Ed. 59 2020 6601 6606 S. Zada, W. Dai, Z. Kai, H. Lu, X. Meng, Y. Zhang, Y. Cheng, F. Yan, P. Fu, X. Zhang, Angew. Chem. Int. Ed. 59 (2020) 6601-6606. [94] S. Husmann Ö. Budak H. Shim K. Liang M. Aslan A. Kruth A. Quade M. Naguib V. Presser Chem. Commun. 56 2020 11082 11085 S. Husmann, Ö. Budak, H. Shim, K. Liang, M. Aslan, A. Kruth, A. Quade, M. Naguib, V. Presser, Chem. Commun. 56 (2020) 11082-11085. [95] J. Mei G.A. Ayoko C. Hu J.M. Bell Z. Sun Sustain. Mater. Technol. 25 2020 e00156 J. Mei, G.A. Ayoko, C. Hu, J.M. Bell, Z. Sun, Sustain. Mater. Technol. 25 (2020) e00156. [96] A.E. Ghazaly H. Ahmed A.R. Rezk J. Halim P.O. Persson L.Y. Yeo J. Rosen ACS Nano 15 2021 4287 4293 A.E. Ghazaly, H. Ahmed, A.R. Rezk, J. Halim, P.O. Persson, L.Y. Yeo, J. Rosen, ACS Nano 15 (2021) 4287-4293. [97] H. Shao K. Xu Y.-C. Wu A. Iadecola L. Liu H. Ma L. Qu E. Raymundo-Piñero J. Zhu Z. Lin P.-L. Taberna P. Simon ACS Energy Lett. 5 2020 2873 2880 H. Shao, K. Xu, Y.-C. Wu, A. Iadecola, L. Liu, H. Ma, L. Qu, E. Raymundo-Piñero, J. Zhu, Z. Lin, P.-L. Taberna, P. Simon, ACS Energy Lett. 5 (2020) 2873-2880. [98] G. Deysher C.E. Shuck K. Hantanasirisakul N.C. Frey A.C. Foucher K. Maleski A. Sarycheva V.B. Shenoy E.A. Stach B. Anasori Y. Gogotsi ACS Nano 14 2020 204 217 G. Deysher, C.E. Shuck, K. Hantanasirisakul, N.C. Frey, A.C. Foucher, K. Maleski, A. Sarycheva, V.B. Shenoy, E.A. Stach, B. Anasori, Y. Gogotsi, ACS Nano 14 (2020) 204-217. [99] Y. Li J. Zhang Y. Cheng K. Feng J. Li L. Yang S. Yin J. Chem. Eng. 433 2022 134578 Y. Li, J. Zhang, Y. Cheng, K. Feng, J. Li, L. Yang, S. Yin, J. Chem. Eng. 433 (2022) 134578. [100] J. Halim A.S. Etman A. Elsukova P. Polcik J. Palisaitis M.W. Barsoum P.O. Persson J. Rosen Nanoscale 13 2021 311 319 J. Halim, A.S. Etman, A. Elsukova, P. Polcik, J. Palisaitis, M.W. Barsoum, P.O. Persson, J. Rosen, Nanoscale 13 (2021) 311-319. [101] F. Zhang Y. Zhou Y. Zhang D. Li Z. Huang Nanophotonics 9 2020 2025 2032 F. Zhang, Y. Zhou, Y. Zhang, D. Li, Z. Huang, Nanophotonics 9 (2020) 2025-2032. [102] R. Meshkian M. Dahlqvist J. Lu B. Wickman J. Halim J. Thörnberg Q. Tao S. Li S. Intikhab J. Snyder Adv. Mater. 30 2018 1706409 R. Meshkian, M. Dahlqvist, J. Lu, B. Wickman, J. Halim, J. Thörnberg, Q. Tao, S. Li, S. Intikhab, J. Snyder, Adv. Mater. 30 (2018) 1706409. [103] N. Zhang Y. Hong S. Yazdanparast M. Asle Zaeem 2D Mater. 5 2018 045004 N. Zhang, Y. Hong, S. Yazdanparast, M. Asle Zaeem, 2D Mater. 5 (2018) 045004. [104] C.E. Shuck M. Han K. Maleski K. Hantanasirisakul S.J. Kim J. Choi W.E.B. Reil Y. Gogotsi ACS Appl. Nano Mater. 2 2019 3368 3376 C.E. Shuck, M. Han, K. Maleski, K. Hantanasirisakul, S.J. Kim, J. Choi, W.E.B. Reil, Y. Gogotsi, ACS Appl. Nano Mater. 2 (2019) 3368-3376. [105] R. Syamsai J.R. Rodriguez V.G. Pol Q. Van Le K.M. Batoo S.F. Adil S. Pandiaraj M. Muthumareeswaran E.H. Raslan A.N. Grace J. Sci. Rep. 11 2021 688 R. Syamsai, J.R. Rodriguez, V.G. Pol, Q. Van Le, K.M. Batoo, S.F. Adil, S. Pandiaraj, M. Muthumareeswaran, E.H. Raslan, A.N.J.S.r. Grace, Sci. 11 (2021) 688. [106] M.W. Hakim S. Fatima R. Tahir M.Z. Iqbal H. Li S. Rizwan J. Energy Storage 61 2023 106662 M.W. Hakim, S. Fatima, R. Tahir, M.Z. Iqbal, H. Li, S.J.J.o.E.S. Rizwan, J. Energy Storage 61 (2023) 106662. [107] Q. Wang X. Zhang Z. Chen Y. Zhao W. Yao J. Xu Compounds 954 2023 170128 Q. Wang, X. Zhang, Z. Chen, Y. Zhao, W. Yao, J.J.J.o.A. Xu, Compounds 954 (2023) 170128. [108] D. Gandla F. Zhang D.Q. Tan ACS Omega 7 2022 7190 7198 D. Gandla, F. Zhang, D.Q.J.A.o. Tan, ACS Omega 7 (2022) 7190-7198. [109] J. Xiao P. Yu K. Zhao H. Gao J. Colloid Interface Sci. 639 2023 233 240 J. Xiao, P. Yu, K. Zhao, H. Gao, J. Colloid Interface Sci. 639 (2023) 233-240. [110] X. Su J. Zhang H. Mu J. Zhao Z. Wang Z. Zhao C. Han Z. Ye J. Alloys Compd. 752 2018 32 39 X. Su, J. Zhang, H. Mu, J. Zhao, Z. Wang, Z. Zhao, C. Han, Z. Ye, J. Alloys Compd. 752 (2018) 32-39. [111] M. Seredych C.E. Shuck D. Pinto M. Alhabeb E. Precetti G. Deysher B. Anasori N. Kurra Y. Gogotsi Chem. Mater. 31 2019 3324 3332 M. Seredych, C.E. Shuck, D. Pinto, M. Alhabeb, E. Precetti, G. Deysher, B. Anasori, N. Kurra, Y. Gogotsi, Chem. Mater. 31 (2019) 3324-3332. [112] J. Fatheema D. Akinwande S. Rizwan Two-dimensional transition metal carbide (MXene) for enhanced energy storage M.A. Chaudhry R. Hussain F.K. Butt Metal Oxide-Carbon Hybrid Materials 2022 Elsevier Netherlands 255 283 J. Fatheema, D. Akinwande, S. Rizwan, Two-dimensional transition metal carbide (MXene) for enhanced energy storage, in: M.A. Chaudhry, R. Hussain, F.K. Butt, Eds., Metal Oxide-Carbon Hybrid Materials, Elsevier, Netherlands, 2022, pp. 255-283. [113] K. Zhu Y. Jin F. Du S. Gao Z. Gao X. Meng G. Chen Y. Wei Y. Gao J. Energy Chem. 31 2019 11 18 K. Zhu, Y. Jin, F. Du, S. Gao, Z. Gao, X. Meng, G. Chen, Y. Wei, Y. Gao, J. Energy Chem. 31 (2019) 11-18. [114] M. Anayee N. Kurra M. Alhabeb M. Seredych M.N. Hedhili A.-H. Emwas H.N. Alshareef B. Anasori Y. Gogotsi Chem. Commun. 56 2020 6090 6093 M. Anayee, N. Kurra, M. Alhabeb, M. Seredych, M.N. Hedhili, A.-H. Emwas, H.N. Alshareef, B. Anasori, Y. Gogotsi, Chem. Commun. 56 (2020) 6090-6093. [115] X. Wang L. Dong W. Liu Y. Huang X. Pu J. Wang F. Kang J. Li C. Xu J. Energy Chem. 48 2020 233 240 X. Wang, L. Dong, W. Liu, Y. Huang, X. Pu, J. Wang, F. Kang, J. Li, C. Xu, J. Energy Chem. 48 (2020) 233-240. [116] K. Rajavel T. Ke K. Yang D. Lin Nanotechnology 29 2018 095605 K. Rajavel, T. Ke, K. Yang, D. Lin, Nanotechnology 29 (2018) 095605. [117] Z.U.D. Babar J. Fatheema N. Arif M.S. Anwar S. Gul M. Iqbal S. Rizwan RSC Adv. 10 2020 25669 25678 Z.U.D. Babar, J. Fatheema, N. Arif, M.S. Anwar, S. Gul, M. Iqbal, S. Rizwan, RSC Adv. 10 (2020) 25669-25678. [118] I. Persson A. El Ghazaly Q. Tao J. Halim S. Kota V. Darakchieva J. Palisaitis M.W. Barsoum J. Rosen P.O. Persson Small 14 2018 1703676 I. Persson, A. El Ghazaly, Q. Tao, J. Halim, S. Kota, V. Darakchieva, J. Palisaitis, M.W. Barsoum, J. Rosen, P.O. Persson, Small 14 (2018) 1703676. [119] S. Kumar D. Kang H. Hong M.A. Rehman Y.-J. Lee N. Lee Y. Seo RSC Adv. 10 2020 1845 41837 141834 S. Kumar, D. Kang, H. Hong, M.A. Rehman, Y.-j. Lee, N. Lee, Y. Seo, RSC Adv. 10 (2020) 41837-41845. [120] J.B. Lee G.H. Choi P.J. Yoo J. Alloys Compd. 887 2021 161304 J.B. Lee, G.H. Choi, P.J. Yoo, J. Alloys Compd. 887 (2021) 161304. [121] J. Miao Q. Zhu K. Li P. Zhang Q. Zhao B. Xu J. Energy Chem. 52 2021 243 250 J. Miao, Q. Zhu, K. Li, P. Zhang, Q. Zhao, B. Xu, J. Energy Chem. 52 (2021) 243-250. [122] C. Zhang J. Energy Chem. 60 2021 417 434 C. Zhang, J. Energy Chem. 60 (2021) 417-434. [123] J. Wang H. Kang H. Ma Y. Liu Z. Xie Y. Wang Z. Fan Eng. Sci. 15 2021 57 66 J. Wang, H. Kang, H. Ma, Y. Liu, Z. Xie, Y. Wang, Z. Fan, Eng. Sci. 15 (2021) 57-66. [124] T. Tu B. Liang S. Zhang T. Li B. Zhang S. Xu X. Mao Y. Cai L. Fang X. Ye Adv. Funct. Mater. 31 2021 2101374 T. Tu, B. Liang, S. Zhang, T. Li, B. Zhang, S. Xu, X. Mao, Y. Cai, L. Fang, X. Ye, Adv. Funct. Mater. 31 (2021) 2101374. [125] T. Shang Z. Lin C. Qi X. Liu P. Li Y. Tao Z. Wu D. Li P. Simon Q.H. Yang Adv. Funct. Mater. 29 2019 1903960 T. Shang, Z. Lin, C. Qi, X. Liu, P. Li, Y. Tao, Z. Wu, D. Li, P. Simon, Q.H. Yang, Adv. Funct. Mater. 29 (2019) 1903960. [126] L. Ma T. Zhao F. Xu T. You X. Zhang J. Chem. Eng. 405 2021 126694 L. Ma, T. Zhao, F. Xu, T. You, X. Zhang, J. Chem. Eng. 405 (2021) 126694. [127] Y. Deng T. Shang Z. Wu Y. Tao C. Luo J. Liang D. Han R. Lyu C. Qi W. Lv Adv. Mater. 31 2019 1902432 Y. Deng, T. Shang, Z. Wu, Y. Tao, C. Luo, J. Liang, D. Han, R. Lyu, C. Qi, W. Lv, Adv. Mater. 31 (2019) 1902432. [128] X. Yang Q. Wang K. Zhu K. Ye G. Wang D. Cao J. Yan Adv. Funct. Mater. 31 2021 2101087 X. Yang, Q. Wang, K. Zhu, K. Ye, G. Wang, D. Cao, J. Yan, Adv. Funct. Mater. 31 (2021) 2101087. [129] S. Venkateshalu J. Cherusseri M. Karnan K.S. Kumar P. Kollu M. Sathish J. Thomas S.K. Jeong A.N. Grace ACS Omega 5 2020 17983 17992 S. Venkateshalu, J. Cherusseri, M. Karnan, K.S. Kumar, P. Kollu, M. Sathish, J. Thomas, S.K. Jeong, A.N. Grace, ACS Omega 5 (2020) 17983-17992. [130] Y. Guan S. Jiang Y. Cong J. Wang Z. Dong Q. Zhang G. Yuan Y. Li X. Li 2D Materials 7 2020 025010 Y. Guan, S. Jiang, Y. Cong, J. Wang, Z. Dong, Q. Zhang, G. Yuan, Y. Li, X. Li, 2D Materials 7 (2020) 025010. [131] X. Wang S. Lin H. Tong Y. Huang P. Tong B. Zhao J. Dai C. Liang H. Wang X. Zhu Electrochim. Acta 307 2019 414 421 X. Wang, S. Lin, H. Tong, Y. Huang, P. Tong, B. Zhao, J. Dai, C. Liang, H. Wang, X. Zhu, Electrochim. Acta 307 (2019) 414-421. [132] Y. Ding Y. Liu X. Sun Y. Yao B. Yuan T. Huang J. Tang J. Chem. Eng. 442 2022 136255 Y. Ding, Y. Liu, X. Sun, Y. Yao, B. Yuan, T. Huang, J. Tang, J. Chem. Eng. 442 (2022) 136255. [133] H. Niu X. Yang Q. Wang X. Jing K. Cheng K. Zhu K. Ye G. Wang D. Cao J. Yan J. Energy Chem. 46 2020 105 113 H. Niu, X. Yang, Q. Wang, X. Jing, K. Cheng, K. Zhu, K. Ye, G. Wang, D. Cao, J. Yan, J. Energy Chem. 46 (2020) 105-113. [134] Z. Wu X. Liu T. Shang Y. Deng N. Wang X. Dong J. Zhao D. Chen Y. Tao Q.H. Yang Adv. Funct. Mater. 31 2021 2102874 Z. Wu, X. Liu, T. Shang, Y. Deng, N. Wang, X. Dong, J. Zhao, D. Chen, Y. Tao, Q.H. Yang, Adv. Funct. Mater. 31 (2021) 2102874. [135] P. Dutta S.K. Deb A. Patra A. Majumdar G.M. Karim C.K. Parashar M.K. Mohanta M. Qureshi U.N. Maiti Adv. Funct. Mater. 32 2022 2204622 P. Dutta, S.K. Deb, A. Patra, A. Majumdar, G.M. Karim, C.K. Parashar, M.K. Mohanta, M. Qureshi, U.N. Maiti, Adv. Funct. Mater. 32 (2022) 2204622. [136] L. Borchardt D. Leistenschneider J. Haase M. Dvoyashkin Adv. Energy Mater. 8 2018 1800892 L. Borchardt, D. Leistenschneider, J. Haase, M. Dvoyashkin, Adv. Energy Mater. 8 (2018) 1800892. [137] G. Gao S. Yang S. Wang L. Li Scr. Mater. 213 2022 114605 G. Gao, S. Yang, S. Wang, L. Li, Scr. Mater. 213 (2022) 114605. [138] X. Zhang X. Liu S. Dong J. Yang Y. Liu Appl. Mater. Today 16 2019 315 321 X. Zhang, X. Liu, S. Dong, J. Yang, Y. Liu, Appl. Mater. Today 16 (2019) 315-321. [139] X. Huang J. Huang G. Zhou Y. Wei P. Wu A. Dong D. Yang Small 18 2022 2200829 X. Huang, J. Huang, G. Zhou, Y. Wei, P. Wu, A. Dong, D. Yang, Small 18 (2022) 2200829. [140] S. Zhao H.-B. Zhang J.-Q. Luo Q.-W. Wang B. Xu S. Hong Z.-Z. Yu ACS Nano 12 2018 11193 11202 S. Zhao, H.-B. Zhang, J.-Q. Luo, Q.-W. Wang, B. Xu, S. Hong, Z.-Z. Yu, ACS Nano 12 (2018) 11193-11202. [141] X. Zhao L.-M. Peng C.-Y. Tang J.-H. Pu X.-J. Zha K. Ke R.-Y. Bao M.-B. Yang W. Yang Mater. Horizons 7 2020 855 865 X. Zhao, L.-M. Peng, C.-Y. Tang, J.-H. Pu, X.-J. Zha, K. Ke, R.-Y. Bao, M.-B. Yang, W. Yang, Mater. Horizons 7 (2020) 855-865. [142] Z. Ma X. Zhou W. Deng D. Lei Z. Liu ACS Appl. Mater. Interfaces 10 2018 3634 3643 Z. Ma, X. Zhou, W. Deng, D. Lei, Z. Liu, ACS Appl. Mater. Interfaces 10 (2018) 3634-3643. [143] J. Kong H. Yang X. Guo S. Yang Z. Huang X. Lu Z. Bo J. Yan K. Cen K.K. Ostrikov ACS Energy Lett. 5 2020 2266 2274 J. Kong, H. Yang, X. Guo, S. Yang, Z. Huang, X. Lu, Z. Bo, J. Yan, K. Cen, K.K. Ostrikov, ACS Energy Lett. 5 (2020) 2266-2274. [144] P. Zhang Q. Zhu R.A. Soomro S. He N. Sun N. Qiao B. Xu Adv. Funct. Mater. 30 2020 2000922 P. Zhang, Q. Zhu, R.A. Soomro, S. He, N. Sun, N. Qiao, B. Xu, Adv. Funct. Mater. 30 (2020) 2000922. [145] X. Huang J. Huang D. Yang P. Wu Adv. Sci. 8 2021 2101664 X. Huang, J. Huang, D. Yang, P. Wu, Adv. Sci. 8 (2021) 2101664. [146] Z. Fan Y. Wang Z. Xie X. Xu Y. Yuan Z. Cheng Y. Liu Nanoscale 10 2018 9642 9652 Z. Fan, Y. Wang, Z. Xie, X. Xu, Y. Yuan, Z. Cheng, Y. Liu, Nanoscale 10 (2018) 9642-9652. [147] T. Guo D. Zhou L. Pang M.A. Darwish Z. Shi Scr. Mater. 213 2022 114590 T. Guo, D. Zhou, L. Pang, M.A. Darwish, Z. Shi, Scr. Mater. 213 (2022) 114590. [148] K. Li X. Wang X. Wang M. Liang V. Nicolosi Y. Xu Y. Gogotsi Nano Energy 75 2020 104971 K. Li, X. Wang, X. Wang, M. Liang, V. Nicolosi, Y. Xu, Y. Gogotsi, Nano Energy 75 (2020) 104971. [149] K. Lv J. Zhang X. Zhao N. Kong J. Tao J. Zhou Small 18 2022 2202203 K. Lv, J. Zhang, X. Zhao, N. Kong, J. Tao, J. Zhou, Small 18 (2022) 2202203. [150] R. Ma X. Zhang J. Zhuo L. Cao Y. Song Y. Yin X. Wang G. Yang F. Yi ACS Nano 2022 R. Ma, X. Zhang, J. Zhuo, L. Cao, Y. Song, Y. Yin, X. Wang, G. Yang, F. Yi, ACS Nano (2022). [151] M. Yao Y. Chen Z. Wang C. Shao J. Dong Q. Zhang L. Zhang X. Zhao J. Chem. Eng. 395 2020 124057 M. Yao, Y. Chen, Z. Wang, C. Shao, J. Dong, Q. Zhang, L. Zhang, X. Zhao, J. Chem. Eng. 395 (2020) 124057. [152] Y. Zhu K. Rajouâ S. Le Vot O. Fontaine P. Simon F. Favier Nano Energy 73 2020 104734 Y. Zhu, K. Rajouâ, S. Le Vot, O. Fontaine, P. Simon, F. Favier, Nano Energy 73 (2020) 104734. [153] R. Ma X. Zhang J. Zhuo L. Cao Y. Song Y. Yin X. Wang G. Yang F. Yi ACS Nano 16 2022 9713 9727 R. Ma, X. Zhang, J. Zhuo, L. Cao, Y. Song, Y. Yin, X. Wang, G. Yang, F. Yi, ACS Nano 16 (2022) 9713-9727. [154] R. Ibragimova P. Rinke H.-P. Komsa Chem. Mater. 34 2022 2896 2906 R. Ibragimova, P. Rinke, H.-P. Komsa, Chem. Mater. 34 (2022) 2896-2906. [155] F. Xia J. Lao R. Yu X. Sang J. Luo Y. Li J. Wu Nanoscale 11 2019 23330 23337 F. Xia, J. Lao, R. Yu, X. Sang, J. Luo, Y. Li, J. Wu, Nanoscale 11 (2019) 23330-23337. [156] C. Yang X. Wu H. Xia J. Zhou Y. Wu R. Yang G. Zhou L. Qiu ACS Nano 16 2022 2699 2710 C. Yang, X. Wu, H. Xia, J. Zhou, Y. Wu, R. Yang, G. Zhou, L. Qiu, ACS Nano 16 (2022) 2699-2710. [157] F. Wang J.Y. Cheong Q. He G. Duan S. He L. Zhang Y. Zhao I.-D. Kim S. Jiang J. Chem. Eng. 414 2021 128767 F. Wang, J.Y. Cheong, Q. He, G. Duan, S. He, L. Zhang, Y. Zhao, I.-D. Kim, S. Jiang, J. Chem. Eng. 414 (2021) 128767. [158] Z. Yang J. Tian Z. Ye Y. Jin C. Cui Q. Xie J. Wang G. Zhang Z. Dong Y. Miao X. Yu W. Qian F. Wei Energy Storage Mater. 33 2020 18 25 Z. Yang, J. Tian, Z. Ye, Y. Jin, C. Cui, Q. Xie, J. Wang, G. Zhang, Z. Dong, Y. Miao, X. Yu, W. Qian, F. Wei, Energy Storage Mater. 33 (2020) 18-25. [159] X. Yu N. Li S. Zhang C. Liu L. Chen S. Han Y. Song M. Han Z. Wang J. Power Sources 478 2020 229075 X. Yu, N. Li, S. Zhang, C. Liu, L. Chen, S. Han, Y. Song, M. Han, Z. Wang, J. Power Sources 478 (2020) 229075. [160] J. Orangi F. Hamade V.A. Davis M. Beidaghi ACS Nano 14 2020 640 650 J. Orangi, F. Hamade, V.A. Davis, M. Beidaghi, ACS Nano 14 (2020) 640-650. [161] W. Yang J. Yang J.J. Byun F.P. Moissinac J. Xu S.J. Haigh M. Domingos M.A. Bissett R.A.W. Dryfe S. Barg Adv. Mater. 31 2019 1902725 W. Yang, J. Yang, J.J. Byun, F.P. Moissinac, J. Xu, S.J. Haigh, M. Domingos, M.A. Bissett, R.A.W. Dryfe, S. Barg, Adv. Mater. 31 (2019) 1902725. [162] X. Li H. Li X. Fan X. Shi J. Liang Adv. Energy Mater. 10 2020 1903794 X. Li, H. Li, X. Fan, X. Shi, J. Liang, Adv. Energy Mater. 10 (2020) 1903794. [163] H. Tetik J. Orangi G. Yang K. Zhao S.B. Mujib G. Singh M. Beidaghi D. Lin Adv. Mater. 34 2022 2104980 H. Tetik, J. Orangi, G. Yang, K. Zhao, S.B. Mujib, G. Singh, M. Beidaghi, D. Lin, Adv. Mater. 34 (2022) 2104980. [164] S. Abdolhosseinzadeh R. Schneider A. Verma J. Heier F. Nüesch C. Zhang Adv. Mater. 32 2020 2000716 S. Abdolhosseinzadeh, R. Schneider, A. Verma, J. Heier, F. Nüesch, C. Zhang, Adv. Mater. 32 (2020) 2000716. [165] M. Yuan L. Wang X. Liu X. Du G. Zhang Y. Chang Q. Xia Q. Hu A. Zhou J. Chem. Eng. 451 2023 138686 M. Yuan, L. Wang, X. Liu, X. Du, G. Zhang, Y. Chang, Q. Xia, Q. Hu, A. Zhou, J. Chem. Eng. 451 (2023) 138686. [166] C. Zhang L. McKeon M.P. Kremer S.-H. Park O. Ronan A. Seral-Ascaso S. Barwich C.Ó. Coileáin N. McEvoy H.C. Nerl B. Anasori J.N. Coleman Y. Gogotsi V. Nicolosi Nat. Commun. 10 2019 1795 C. Zhang, L. McKeon, M.P. Kremer, S.-H. Park, O. Ronan, A. Seral‐Ascaso, S. Barwich, C.Ó. Coileáin, N. McEvoy, H.C. Nerl, B. Anasori, J.N. Coleman, Y. Gogotsi, V. Nicolosi, Nat. Commun. 10 (2019) 1795. [167] L. Yu Z. Fan Y. Shao Z. Tian J. Sun Z. Liu Adv. Energy Mater. 9 2019 1901839 L. Yu, Z. Fan, Y. Shao, Z. Tian, J. Sun, Z. Liu, Adv. Energy Mater. 9 (2019) 1901839. [168] Y. Yoon M. Lee S.K. Kim G. Bae W. Song S. Myung J. Lim S.S. Lee T. Zyung K.-S. An Adv. Energy Mater. 8 2018 1703173 Y. Yoon, M. Lee, S.K. Kim, G. Bae, W. Song, S. Myung, J. Lim, S.S. Lee, T. Zyung, K.-S. An, Adv. Energy Mater. 8 (2018) 1703173. [169] X. Peng X. Kuang D.J. Roach Y. Wang C.M. Hamel C. Lu H.J. Qi Addit. Manuf. 40 2021 101911 X. Peng, X. Kuang, D.J. Roach, Y. Wang, C.M. Hamel, C. Lu, H.J. Qi, Addit. Manuf. 40 (2021) 101911. [170] S. Jain T. Fuoco M.A. Yassin K. Mustafa A. Finne-Wistrand Biomacromolecules 21 2020 388 396 S. Jain, T. Fuoco, M.A. Yassin, K. Mustafa, A. Finne-Wistrand, Biomacromolecules 21 (2020) 388-396. [171] M. Regehly Y. Garmshausen M. Reuter N.F. König E. Israel D.P. Kelly C.-Y. Chou K. Koch B. Asfari S. Hecht Nature 588 2020 620 624 M. Regehly, Y. Garmshausen, M. Reuter, N.F. König, E. Israel, D.P. Kelly, C.-Y. Chou, K. Koch, B. Asfari, S. Hecht, Nature 588 (2020) 620-624. [172] H. Li B. Zhang R. Wang X. Yang X. He H. Ye J. Cheng C. Yuan Y.-F. Zhang Q. Ge Adv. Funct. Mater. 32 2022 2111030 H. Li, B. Zhang, R. Wang, X. Yang, X. He, H. Ye, J. Cheng, C. Yuan, Y.-F. Zhang, Q. Ge, Adv. Funct. Mater. 32 (2022) 2111030. [173] N. Chen Z. Duan W. Cai Y. Wang B. Pu H. Huang Y. Xie Q. Tang H. Zhang W. Yang Nano Energy 107 2023 108147 N. Chen, Z. Duan, W. Cai, Y. Wang, B. Pu, H. Huang, Y. Xie, Q. Tang, H. Zhang, W. Yang, Nano Energy 107 (2023) 108147. [174] S. Zhang P. Huang J. Wang Z. Zhuang Z. Zhang W.-Q. Han J. Phys. Chem. Lett. 11 2020 1247 1254 S. Zhang, P. Huang, J. Wang, Z. Zhuang, Z. Zhang, W.-Q. Han, J. Phys. Chem. Lett. 11 (2020) 1247-1254. [175] Z. Chen H. Chen Y. Xu M. Hu Z. Hu J. Wang Z. Pan Renew. Sust. Energ. Rev. 171 2023 113031 Z. Chen, H. Chen, Y. Xu, M. Hu, Z. Hu, J. Wang, Z. Pan, Renew. Sust. Energ. Rev. 171 (2023) 113031. [176] Y. Li S. Wang T. Xu J. Li Y. Zhang T. Xu J. Yang Process Saf. Environ. Prot. 149 2021 385 398 Y. Li, S. Wang, T. Xu, J. Li, Y. Zhang, T. Xu, J. Yang, Process Saf. Environ. Prot. 149 (2021) 385-398. [177] O. Mashtalir M. Naguib B. Dyatkin Y. Gogotsi M.W. Barsoum Mater. Chem. Phys. 139 2013 147 152 O. Mashtalir, M. Naguib, B. Dyatkin, Y. Gogotsi, M.W. Barsoum, Mater. Chem. Phys. 139 (2013) 147-152. [178] P. Lakhe E.M. Prehn T. Habib J.L. Lutkenhaus M. Radovic M.S. Mannan M.J. Green Ind. Eng. Chem. Res. 58 2019 1570 1579 P. Lakhe, E.M. Prehn, T. Habib, J.L. Lutkenhaus, M. Radovic, M.S. Mannan, M.J. Green, Ind. Eng. Chem. Res. 58 (2019) 1570-1579. [179] F. Cao Y. Zhang H. Wang K. Khan A.K. Tareen W. Qian H. Zhang H. Ågren Adv. Mater. 34 2022 2107554 F. Cao, Y. Zhang, H. Wang, K. Khan, A.K. Tareen, W. Qian, H. Zhang, H. Ågren, Adv. Mater. 34 (2022) 2107554. [180] A. Iqbal J. Hong T.Y. Ko C.M. Koo Nano Converg. 8 2021 9 A. Iqbal, J. Hong, T.Y. Ko, C.M. Koo, Nano Converg. 8 (2021) 9. [181] L. Liao D. Jiang K. Zheng M. Zhang J. Liu Adv. Funct. Mater. 31 2021 2103960 L. Liao, D. Jiang, K. Zheng, M. Zhang, J. Liu, Adv. Funct. Mater. 31 (2021) 2103960. [182] J. Zhang N. Kong S. Uzun A. Levitt S. Seyedin P.A. Lynch S. Qin M. Han W. Yang J. Liu X. Wang Y. Gogotsi J.M. Razal Adv. Mater. 32 2020 2001093 J. Zhang, N. Kong, S. Uzun, A. Levitt, S. Seyedin, P.A. Lynch, S. Qin, M. Han, W. Yang, J. Liu, X. Wang, Y. Gogotsi, J.M. Razal, Adv. Mater. 32 (2020) 2001093. Wen Siong Poh received his Bachelor of Engineering majoring in new energy science and engineering with Honors from Xiamen University, Malaysia in 2021. He is currently a postgraduate research student at the School of Energy and Chemical Engineering at Xiamen University, Malaysia under the supervision of Dr. Chuan Yi Foo. His current research interests include gel polymer electrolytes, MXene-based supercapacitors and flexible solid-state supercapacitors. Wen Jie Yiang received his Bachelor of Engineering majoring in new energy science and engineering with Honors from Xiamen University, Malaysia in 2022. He is currently a postgraduate research student at the School of Energy and Chemical Engineering at Xiamen University, Malaysia under the supervision of Dr. Chuan Yi Foo. His current research interests include flexible supercapacitor, and MXene-based supercapacitor. Wee-Jun Ong received his B.Eng. and Ph.D. degrees in chemical engineering from Monash University. He is an associate professor and Assistant Dean in School of Energy and Chemical Engineering at Xiamen University Malaysia. Starting from 2021, he becomes a director of “CONNECT” research center. Previously, he was a scientist at Agency for Science, Technology and Research (A*STAR), Singapore. In 2019, he was a visiting scientist at Technische Universität Dresden and a visiting professor at Lawrence Berkeley National Laboratory. His research interests include nanomaterials for energy storage devices, photocatalytic, photoelectrocatalytic, and electrochemical H2O splitting, CO2 reduction and N2 fixation. Pau-Loke Show received his BSc. degree and Ph.D. degree from Universiti Putra Malaysia. He is a Full Professor at the Department of Chemical and Environmental Engineering, Faculty of Science and Engineering, University of Nottingham Malaysia. In the year of 2022, he is elected as a Fellow of IChemE (FIChemE). He is currently a Professional Engineer (PEng) registered with the Board of Engineers Malaysia, Fellow of the Engineering Council UK (CEng), Cooperate Member of The Institution of Engineers, and Professional Technologies (PTech) registered with the Malaysia Board of Technologists. Chuan Yi Foo received his BSc. degree and Ph.D. degree from Universiti Putra Malaysia (2015 and 2018, respectively). He worked as a postdoc at Xiamen University Malaysia and currently an Assistant Professor in New Energy Science and Engineering at Xiamen University Malaysia since 2019. He is particularly interested in unravelling the potential and workability of advanced manufacturing technology in nanomaterials fabrication, as well as improve the performance of current electrochemical energy storagedevices.",
      "scopus-id": "85181166272",
      "coredata": {
        "eid": "1-s2.0-S2095495623006666",
        "dc:description": "MXene has been the limelight for studies on electrode active materials, aiming at developing supercapacitors with boosted energy density to meet the emerging influx of wearable and portable electronic devices. Despite its various desirable properties including intrinsic flexibility, high specific surface area, excellent metallic conductivity and unique abundance of surface functionalities, its full potential for electrochemical performance is hindered by the notorious restacking phenomenon of MXene nanosheets. Ascribed to its two-dimensional (2D) nature and surface functional groups, inevitable Van der Waals interactions drive the agglomeration of nanosheets, ultimately reducing the exposure of electrochemically active sites to the electrolyte, as well as severely lengthening electrolyte ion transport pathways. As a result, energy and power density deteriorate, limiting the application versatility of MXene-based supercapacitors. Constructing 3D architectures using 2D nanosheets presents as a straightforward yet ingenious approach to mitigate the fatal flaws of MXene. However, the sheer number of distinct methodologies reported, thus far, calls for a systematic review that unravels the rationale behind such 3D MXene structural designs. Herein, this review aims to serve this purpose while also scrutinizing the structure–property relationship to correlate such structural modifications to their ensuing electrochemical performance enhancements. Besides, the physicochemical properties of MXene play fundamental roles in determining the effective charge storage capabilities of 3D MXene-based electrodes. This largely depends on different MXene synthesis techniques and synthesis condition variations, hence, elucidated in this review as well. Lastly, the challenges and perspectives for achieving viable commercialization of MXene-based supercapacitor electrodes are highlighted.",
        "openArchiveArticle": "false",
        "prism:coverDate": "2024-04-30",
        "openaccessUserLicense": null,
        "prism:aggregationType": "Journal",
        "prism:url": "https://api.elsevier.com/content/article/pii/S2095495623006666",
        "dc:creator": [
          {
            "@_fa": "true",
            "$": "Poh, Wen Siong"
          },
          {
            "@_fa": "true",
            "$": "Yiang, Wen Jie"
          },
          {
            "@_fa": "true",
            "$": "Ong, Wee-Jun"
          },
          {
            "@_fa": "true",
            "$": "Show, Pau Loke"
          },
          {
            "@_fa": "true",
            "$": "Foo, Chuan Yi"
          }
        ],
        "link": [
          {
            "@_fa": "true",
            "@rel": "self",
            "@href": "https://api.elsevier.com/content/article/pii/S2095495623006666"
          },
          {
            "@_fa": "true",
            "@rel": "scidir",
            "@href": "https://www.sciencedirect.com/science/article/pii/S2095495623006666"
          }
        ],
        "dc:format": "application/json",
        "openaccessType": null,
        "pii": "S2095-4956(23)00666-6",
        "prism:volume": "91",
        "prism:publisher": "Science Press and Dalian Institute of Chemical Physics, Chinese Academy of Sciences. Published by ELSEVIER B.V. and Science Press.",
        "dc:title": "Enhancing MXene-based supercapacitors: Role of synthesis and 3D architectures",
        "prism:copyright": "© 2023 Science Press and Dalian Institute of Chemical Physics, Chinese Academy of Sciences. Published by ELSEVIER B.V. and Science Press. All rights reserved.",
        "openaccess": "0",
        "prism:issn": "20954956",
        "dcterms:subject": [
          {
            "@_fa": "true",
            "$": "MXene"
          },
          {
            "@_fa": "true",
            "$": "3D architectures"
          },
          {
            "@_fa": "true",
            "$": "Synthesis design"
          },
          {
            "@_fa": "true",
            "$": "Supercapacitor"
          },
          {
            "@_fa": "true",
            "$": "Energy storage"
          }
        ],
        "openaccessArticle": "false",
        "prism:publicationName": "Journal of Energy Chemistry",
        "openaccessSponsorType": null,
        "prism:pageRange": "1-26",
        "prism:endingPage": "26",
        "pubType": "rev",
        "prism:coverDisplayDate": "April 2024",
        "prism:doi": "10.1016/j.jechem.2023.11.020",
        "prism:startingPage": "1",
        "dc:identifier": "doi:10.1016/j.jechem.2023.11.020",
        "openaccessSponsorName": null
      },
      "objects": {
        "object": [
          {
            "@category": "standard",
            "@height": "154",
            "@width": "111",
            "@_fa": "true",
            "$": "https://api.elsevier.com/content/object/eid/1-s2.0-S2095495623006666-fx1.jpg?httpAccept=%2A%2F%2A",
            "@multimediatype": "JPEG image file",
            "@type": "IMAGE-DOWNSAMPLED",
            "@size": "6214",
            "@ref": "fx1",
            "@mimetype": "image/jpeg"
          },
          {
            "@category": "standard",
            "@height": "155",
            "@width": "111",
            "@_fa": "true",
            "$": "https://api.elsevier.com/content/object/eid/1-s2.0-S2095495623006666-fx2.jpg?httpAccept=%2A%2F%2A",
            "@multimediatype": "JPEG image file",
            "@type": "IMAGE-DOWNSAMPLED",
            "@size": "5264",
            "@ref": "fx2",
            "@mimetype": "image/jpeg"
          },
          {
            "@category": "standard",
            "@height": "155",
            "@width": "111",
            "@_fa": "true",
            "$": "https://api.elsevier.com/content/object/eid/1-s2.0-S2095495623006666-fx3.jpg?httpAccept=%2A%2F%2A",
            "@multimediatype": "JPEG image file",
            "@type": "IMAGE-DOWNSAMPLED",
            "@size": "6543",
            "@ref": "fx3",
            "@mimetype": "image/jpeg"
          },
          {
            "@category": "standard",
            "@height": "155",
            "@width": "111",
            "@_fa": "true",
            "$": "https://api.elsevier.com/content/object/eid/1-s2.0-S2095495623006666-fx4.jpg?httpAccept=%2A%2F%2A",
            "@multimediatype": "JPEG image file",
            "@type": "IMAGE-DOWNSAMPLED",
            "@size": "6424",
            "@ref": "fx4",
            "@mimetype": "image/jpeg"
          },
          {
            "@category": "standard",
            "@height": "155",
            "@width": "111",
            "@_fa": "true",
            "$": "https://api.elsevier.com/content/object/eid/1-s2.0-S2095495623006666-fx5.jpg?httpAccept=%2A%2F%2A",
            "@multimediatype": "JPEG image file",
            "@type": "IMAGE-DOWNSAMPLED",
            "@size": "5958",
            "@ref": "fx5",
            "@mimetype": "image/jpeg"
          },
          {
            "@category": "standard",
            "@height": "200",
            "@width": "400",
            "@_fa": "true",
            "$": "https://api.elsevier.com/content/object/eid/1-s2.0-S2095495623006666-ga1.jpg?httpAccept=%2A%2F%2A",
            "@multimediatype": "JPEG image file",
            "@type": "IMAGE-DOWNSAMPLED",
            "@size": "26004",
            "@ref": "ga1",
            "@mimetype": "image/jpeg"
          },
          {
            "@category": "standard",
            "@height": "613",
            "@width": "679",
            "@_fa": "true",
            "$": "https://api.elsevier.com/content/object/eid/1-s2.0-S2095495623006666-gr1.jpg?httpAccept=%2A%2F%2A",
            "@multimediatype": "JPEG image file",
            "@type": "IMAGE-DOWNSAMPLED",
            "@size": "113712",
            "@ref": "gr1",
            "@mimetype": "image/jpeg"
          },
          {
            "@category": "standard",
            "@height": "974",
            "@width": "650",
            "@_fa": "true",
            "$": "https://api.elsevier.com/content/object/eid/1-s2.0-S2095495623006666-gr10.jpg?httpAccept=%2A%2F%2A",
            "@multimediatype": "JPEG image file",
            "@type": "IMAGE-DOWNSAMPLED",
            "@size": "217234",
            "@ref": "gr10",
            "@mimetype": "image/jpeg"
          },
          {
            "@category": "standard",
            "@height": "486",
            "@width": "542",
            "@_fa": "true",
            "$": "https://api.elsevier.com/content/object/eid/1-s2.0-S2095495623006666-gr2.jpg?httpAccept=%2A%2F%2A",
            "@multimediatype": "JPEG image file",
            "@type": "IMAGE-DOWNSAMPLED",
            "@size": "80330",
            "@ref": "gr2",
            "@mimetype": "image/jpeg"
          },
          {
            "@category": "standard",
            "@height": "216",
            "@width": "343",
            "@_fa": "true",
            "$": "https://api.elsevier.com/content/object/eid/1-s2.0-S2095495623006666-gr3.jpg?httpAccept=%2A%2F%2A",
            "@multimediatype": "JPEG image file",
            "@type": "IMAGE-DOWNSAMPLED",
            "@size": "22794",
            "@ref": "gr3",
            "@mimetype": "image/jpeg"
          },
          {
            "@category": "standard",
            "@height": "295",
            "@width": "355",
            "@_fa": "true",
            "$": "https://api.elsevier.com/content/object/eid/1-s2.0-S2095495623006666-gr4.jpg?httpAccept=%2A%2F%2A",
            "@multimediatype": "JPEG image file",
            "@type": "IMAGE-DOWNSAMPLED",
            "@size": "31864",
            "@ref": "gr4",
            "@mimetype": "image/jpeg"
          },
          {
            "@category": "standard",
            "@height": "868",
            "@width": "688",
            "@_fa": "true",
            "$": "https://api.elsevier.com/content/object/eid/1-s2.0-S2095495623006666-gr5.jpg?httpAccept=%2A%2F%2A",
            "@multimediatype": "JPEG image file",
            "@type": "IMAGE-DOWNSAMPLED",
            "@size": "218558",
            "@ref": "gr5",
            "@mimetype": "image/jpeg"
          },
          {
            "@category": "standard",
            "@height": "910",
            "@width": "576",
            "@_fa": "true",
            "$": "https://api.elsevier.com/content/object/eid/1-s2.0-S2095495623006666-gr6.jpg?httpAccept=%2A%2F%2A",
            "@multimediatype": "JPEG image file",
            "@type": "IMAGE-DOWNSAMPLED",
            "@size": "142327",
            "@ref": "gr6",
            "@mimetype": "image/jpeg"
          },
          {
            "@category": "standard",
            "@height": "834",
            "@width": "691",
            "@_fa": "true",
            "$": "https://api.elsevier.com/content/object/eid/1-s2.0-S2095495623006666-gr7.jpg?httpAccept=%2A%2F%2A",
            "@multimediatype": "JPEG image file",
            "@type": "IMAGE-DOWNSAMPLED",
            "@size": "202766",
            "@ref": "gr7",
            "@mimetype": "image/jpeg"
          },
          {
            "@category": "standard",
            "@height": "749",
            "@width": "687",
            "@_fa": "true",
            "$": "https://api.elsevier.com/content/object/eid/1-s2.0-S2095495623006666-gr8.jpg?httpAccept=%2A%2F%2A",
            "@multimediatype": "JPEG image file",
            "@type": "IMAGE-DOWNSAMPLED",
            "@size": "179330",
            "@ref": "gr8",
            "@mimetype": "image/jpeg"
          },
          {
            "@category": "standard",
            "@height": "855",
            "@width": "693",
            "@_fa": "true",
            "$": "https://api.elsevier.com/content/object/eid/1-s2.0-S2095495623006666-gr9.jpg?httpAccept=%2A%2F%2A",
            "@multimediatype": "JPEG image file",
            "@type": "IMAGE-DOWNSAMPLED",
            "@size": "227757",
            "@ref": "gr9",
            "@mimetype": "image/jpeg"
          },
          {
            "@category": "thumbnail",
            "@height": "164",
            "@width": "118",
            "@_fa": "true",
            "$": "https://api.elsevier.com/content/object/eid/1-s2.0-S2095495623006666-fx1.sml?httpAccept=%2A%2F%2A",
            "@multimediatype": "GIF image file",
            "@type": "IMAGE-THUMBNAIL",
            "@size": "13059",
            "@ref": "fx1",
            "@mimetype": "image/gif"
          },
          {
            "@category": "thumbnail",
            "@height": "164",
            "@width": "117",
            "@_fa": "true",
            "$": "https://api.elsevier.com/content/object/eid/1-s2.0-S2095495623006666-fx2.sml?httpAccept=%2A%2F%2A",
            "@multimediatype": "GIF image file",
            "@type": "IMAGE-THUMBNAIL",
            "@size": "14769",
            "@ref": "fx2",
            "@mimetype": "image/gif"
          },
          {
            "@category": "thumbnail",
            "@height": "164",
            "@width": "117",
            "@_fa": "true",
            "$": "https://api.elsevier.com/content/object/eid/1-s2.0-S2095495623006666-fx3.sml?httpAccept=%2A%2F%2A",
            "@multimediatype": "GIF image file",
            "@type": "IMAGE-THUMBNAIL",
            "@size": "15230",
            "@ref": "fx3",
            "@mimetype": "image/gif"
          },
          {
            "@category": "thumbnail",
            "@height": "164",
            "@width": "117",
            "@_fa": "true",
            "$": "https://api.elsevier.com/content/object/eid/1-s2.0-S2095495623006666-fx4.sml?httpAccept=%2A%2F%2A",
            "@multimediatype": "GIF image file",
            "@type": "IMAGE-THUMBNAIL",
            "@size": "15007",
            "@ref": "fx4",
            "@mimetype": "image/gif"
          },
          {
            "@category": "thumbnail",
            "@height": "164",
            "@width": "117",
            "@_fa": "true",
            "$": "https://api.elsevier.com/content/object/eid/1-s2.0-S2095495623006666-fx5.sml?httpAccept=%2A%2F%2A",
            "@multimediatype": "GIF image file",
            "@type": "IMAGE-THUMBNAIL",
            "@size": "13652",
            "@ref": "fx5",
            "@mimetype": "image/gif"
          },
          {
            "@category": "thumbnail",
            "@height": "110",
            "@width": "219",
            "@_fa": "true",
            "$": "https://api.elsevier.com/content/object/eid/1-s2.0-S2095495623006666-ga1.sml?httpAccept=%2A%2F%2A",
            "@multimediatype": "GIF image file",
            "@type": "IMAGE-THUMBNAIL",
            "@size": "15408",
            "@ref": "ga1",
            "@mimetype": "image/gif"
          },
          {
            "@category": "thumbnail",
            "@height": "163",
            "@width": "181",
            "@_fa": "true",
            "$": "https://api.elsevier.com/content/object/eid/1-s2.0-S2095495623006666-gr1.sml?httpAccept=%2A%2F%2A",
            "@multimediatype": "GIF image file",
            "@type": "IMAGE-THUMBNAIL",
            "@size": "14516",
            "@ref": "gr1",
            "@mimetype": "image/gif"
          },
          {
            "@category": "thumbnail",
            "@height": "163",
            "@width": "109",
            "@_fa": "true",
            "$": "https://api.elsevier.com/content/object/eid/1-s2.0-S2095495623006666-gr10.sml?httpAccept=%2A%2F%2A",
            "@multimediatype": "GIF image file",
            "@type": "IMAGE-THUMBNAIL",
            "@size": "11612",
            "@ref": "gr10",
            "@mimetype": "image/gif"
          },
          {
            "@category": "thumbnail",
            "@height": "164",
            "@width": "183",
            "@_fa": "true",
            "$": "https://api.elsevier.com/content/object/eid/1-s2.0-S2095495623006666-gr2.sml?httpAccept=%2A%2F%2A",
            "@multimediatype": "GIF image file",
            "@type": "IMAGE-THUMBNAIL",
            "@size": "13534",
            "@ref": "gr2",
            "@mimetype": "image/gif"
          },
          {
            "@category": "thumbnail",
            "@height": "138",
            "@width": "219",
            "@_fa": "true",
            "$": "https://api.elsevier.com/content/object/eid/1-s2.0-S2095495623006666-gr3.sml?httpAccept=%2A%2F%2A",
            "@multimediatype": "GIF image file",
            "@type": "IMAGE-THUMBNAIL",
            "@size": "9190",
            "@ref": "gr3",
            "@mimetype": "image/gif"
          },
          {
            "@category": "thumbnail",
            "@height": "164",
            "@width": "197",
            "@_fa": "true",
            "$": "https://api.elsevier.com/content/object/eid/1-s2.0-S2095495623006666-gr4.sml?httpAccept=%2A%2F%2A",
            "@multimediatype": "GIF image file",
            "@type": "IMAGE-THUMBNAIL",
            "@size": "10241",
            "@ref": "gr4",
            "@mimetype": "image/gif"
          },
          {
            "@category": "thumbnail",
            "@height": "164",
            "@width": "130",
            "@_fa": "true",
            "$": "https://api.elsevier.com/content/object/eid/1-s2.0-S2095495623006666-gr5.sml?httpAccept=%2A%2F%2A",
            "@multimediatype": "GIF image file",
            "@type": "IMAGE-THUMBNAIL",
            "@size": "15926",
            "@ref": "gr5",
            "@mimetype": "image/gif"
          },
          {
            "@category": "thumbnail",
            "@height": "163",
            "@width": "103",
            "@_fa": "true",
            "$": "https://api.elsevier.com/content/object/eid/1-s2.0-S2095495623006666-gr6.sml?httpAccept=%2A%2F%2A",
            "@multimediatype": "GIF image file",
            "@type": "IMAGE-THUMBNAIL",
            "@size": "8547",
            "@ref": "gr6",
            "@mimetype": "image/gif"
          },
          {
            "@category": "thumbnail",
            "@height": "164",
            "@width": "136",
            "@_fa": "true",
            "$": "https://api.elsevier.com/content/object/eid/1-s2.0-S2095495623006666-gr7.sml?httpAccept=%2A%2F%2A",
            "@multimediatype": "GIF image file",
            "@type": "IMAGE-THUMBNAIL",
            "@size": "14264",
            "@ref": "gr7",
            "@mimetype": "image/gif"
          },
          {
            "@category": "thumbnail",
            "@height": "164",
            "@width": "150",
            "@_fa": "true",
            "$": "https://api.elsevier.com/content/object/eid/1-s2.0-S2095495623006666-gr8.sml?httpAccept=%2A%2F%2A",
            "@multimediatype": "GIF image file",
            "@type": "IMAGE-THUMBNAIL",
            "@size": "13796",
            "@ref": "gr8",
            "@mimetype": "image/gif"
          },
          {
            "@category": "thumbnail",
            "@height": "164",
            "@width": "133",
            "@_fa": "true",
            "$": "https://api.elsevier.com/content/object/eid/1-s2.0-S2095495623006666-gr9.sml?httpAccept=%2A%2F%2A",
            "@multimediatype": "GIF image file",
            "@type": "IMAGE-THUMBNAIL",
            "@size": "15543",
            "@ref": "gr9",
            "@mimetype": "image/gif"
          },
          {
            "@category": "high",
            "@height": "410",
            "@width": "295",
            "@_fa": "true",
            "$": "https://api.elsevier.com/content/object/eid/1-s2.0-S2095495623006666-fx1_lrg.jpg?httpAccept=%2A%2F%2A",
            "@multimediatype": "JPEG image file",
            "@type": "IMAGE-HIGH-RES",
            "@size": "19361",
            "@ref": "fx1",
            "@mimetype": "image/jpeg"
          },
          {
            "@category": "high",
            "@height": "413",
            "@width": "295",
            "@_fa": "true",
            "$": "https://api.elsevier.com/content/object/eid/1-s2.0-S2095495623006666-fx2_lrg.jpg?httpAccept=%2A%2F%2A",
            "@multimediatype": "JPEG image file",
            "@type": "IMAGE-HIGH-RES",
            "@size": "17650",
            "@ref": "fx2",
            "@mimetype": "image/jpeg"
          },
          {
            "@category": "high",
            "@height": "413",
            "@width": "295",
            "@_fa": "true",
            "$": "https://api.elsevier.com/content/object/eid/1-s2.0-S2095495623006666-fx3_lrg.jpg?httpAccept=%2A%2F%2A",
            "@multimediatype": "JPEG image file",
            "@type": "IMAGE-HIGH-RES",
            "@size": "20882",
            "@ref": "fx3",
            "@mimetype": "image/jpeg"
          },
          {
            "@category": "high",
            "@height": "413",
            "@width": "295",
            "@_fa": "true",
            "$": "https://api.elsevier.com/content/object/eid/1-s2.0-S2095495623006666-fx4_lrg.jpg?httpAccept=%2A%2F%2A",
            "@multimediatype": "JPEG image file",
            "@type": "IMAGE-HIGH-RES",
            "@size": "19686",
            "@ref": "fx4",
            "@mimetype": "image/jpeg"
          },
          {
            "@category": "high",
            "@height": "413",
            "@width": "295",
            "@_fa": "true",
            "$": "https://api.elsevier.com/content/object/eid/1-s2.0-S2095495623006666-fx5_lrg.jpg?httpAccept=%2A%2F%2A",
            "@multimediatype": "JPEG image file",
            "@type": "IMAGE-HIGH-RES",
            "@size": "16134",
            "@ref": "fx5",
            "@mimetype": "image/jpeg"
          },
          {
            "@category": "high",
            "@height": "531",
            "@width": "1062",
            "@_fa": "true",
            "$": "https://api.elsevier.com/content/object/eid/1-s2.0-S2095495623006666-ga1_lrg.jpg?httpAccept=%2A%2F%2A",
            "@multimediatype": "JPEG image file",
            "@type": "IMAGE-HIGH-RES",
            "@size": "92031",
            "@ref": "ga1",
            "@mimetype": "image/jpeg"
          },
          {
            "@category": "high",
            "@height": "2713",
            "@width": "3005",
            "@_fa": "true",
            "$": "https://api.elsevier.com/content/object/eid/1-s2.0-S2095495623006666-gr1_lrg.jpg?httpAccept=%2A%2F%2A",
            "@multimediatype": "JPEG image file",
            "@type": "IMAGE-HIGH-RES",
            "@size": "733488",
            "@ref": "gr1",
            "@mimetype": "image/jpeg"
          },
          {
            "@category": "high",
            "@height": "4311",
            "@width": "2878",
            "@_fa": "true",
            "$": "https://api.elsevier.com/content/object/eid/1-s2.0-S2095495623006666-gr10_lrg.jpg?httpAccept=%2A%2F%2A",
            "@multimediatype": "JPEG image file",
            "@type": "IMAGE-HIGH-RES",
            "@size": "1582126",
            "@ref": "gr10",
            "@mimetype": "image/jpeg"
          },
          {
            "@category": "high",
            "@height": "2155",
            "@width": "2402",
            "@_fa": "true",
            "$": "https://api.elsevier.com/content/object/eid/1-s2.0-S2095495623006666-gr2_lrg.jpg?httpAccept=%2A%2F%2A",
            "@multimediatype": "JPEG image file",
            "@type": "IMAGE-HIGH-RES",
            "@size": "566682",
            "@ref": "gr2",
            "@mimetype": "image/jpeg"
          },
          {
            "@category": "high",
            "@height": "960",
            "@width": "1521",
            "@_fa": "true",
            "$": "https://api.elsevier.com/content/object/eid/1-s2.0-S2095495623006666-gr3_lrg.jpg?httpAccept=%2A%2F%2A",
            "@multimediatype": "JPEG image file",
            "@type": "IMAGE-HIGH-RES",
            "@size": "148926",
            "@ref": "gr3",
            "@mimetype": "image/jpeg"
          },
          {
            "@category": "high",
            "@height": "1308",
            "@width": "1574",
            "@_fa": "true",
            "$": "https://api.elsevier.com/content/object/eid/1-s2.0-S2095495623006666-gr4_lrg.jpg?httpAccept=%2A%2F%2A",
            "@multimediatype": "JPEG image file",
            "@type": "IMAGE-HIGH-RES",
            "@size": "211612",
            "@ref": "gr4",
            "@mimetype": "image/jpeg"
          },
          {
            "@category": "high",
            "@height": "3843",
            "@width": "3045",
            "@_fa": "true",
            "$": "https://api.elsevier.com/content/object/eid/1-s2.0-S2095495623006666-gr5_lrg.jpg?httpAccept=%2A%2F%2A",
            "@multimediatype": "JPEG image file",
            "@type": "IMAGE-HIGH-RES",
            "@size": "1632814",
            "@ref": "gr5",
            "@mimetype": "image/jpeg"
          },
          {
            "@category": "high",
            "@height": "4034",
            "@width": "2552",
            "@_fa": "true",
            "$": "https://api.elsevier.com/content/object/eid/1-s2.0-S2095495623006666-gr6_lrg.jpg?httpAccept=%2A%2F%2A",
            "@multimediatype": "JPEG image file",
            "@type": "IMAGE-HIGH-RES",
            "@size": "956910",
            "@ref": "gr6",
            "@mimetype": "image/jpeg"
          },
          {
            "@category": "high",
            "@height": "3692",
            "@width": "3059",
            "@_fa": "true",
            "$": "https://api.elsevier.com/content/object/eid/1-s2.0-S2095495623006666-gr7_lrg.jpg?httpAccept=%2A%2F%2A",
            "@multimediatype": "JPEG image file",
            "@type": "IMAGE-HIGH-RES",
            "@size": "1501354",
            "@ref": "gr7",
            "@mimetype": "image/jpeg"
          },
          {
            "@category": "high",
            "@height": "3316",
            "@width": "3041",
            "@_fa": "true",
            "$": "https://api.elsevier.com/content/object/eid/1-s2.0-S2095495623006666-gr8_lrg.jpg?httpAccept=%2A%2F%2A",
            "@multimediatype": "JPEG image file",
            "@type": "IMAGE-HIGH-RES",
            "@size": "1192375",
            "@ref": "gr8",
            "@mimetype": "image/jpeg"
          },
          {
            "@category": "high",
            "@height": "3786",
            "@width": "3067",
            "@_fa": "true",
            "$": "https://api.elsevier.com/content/object/eid/1-s2.0-S2095495623006666-gr9_lrg.jpg?httpAccept=%2A%2F%2A",
            "@multimediatype": "JPEG image file",
            "@type": "IMAGE-HIGH-RES",
            "@size": "1653173",
            "@ref": "gr9",
            "@mimetype": "image/jpeg"
          },
          {
            "@category": "standard",
            "@_fa": "true",
            "$": "https://api.elsevier.com/content/object/eid/1-s2.0-S2095495623006666-mmc1.docx?httpAccept=%2A%2F%2A",
            "@multimediatype": "Microsoft Word file",
            "@type": "APPLICATION",
            "@size": "82750",
            "@ref": "mmc1",
            "@mimetype": "application/word"
          },
          {
            "@category": "standard",
            "@_fa": "true",
            "$": "https://api.elsevier.com/content/object/eid/1-s2.0-S2095495623006666-am.pdf?httpAccept=%2A%2F%2A",
            "@multimediatype": "Acrobat PDF file",
            "@type": "AAM-PDF",
            "@size": "5674522",
            "@ref": "am",
            "@mimetype": "application/pdf"
          }
        ]
      },
      "link": {
        "@rel": "abstract",
        "@href": "https://api.elsevier.com/content/abstract/scopus_id/85181166272"
      }
    }
  }
}