{
  "metadata": {
    "title": "Spin and orbital manipulation of multiple atomic sites by high-entropy effect for catalyzing cascade sulfur conversion",
    "authors": "; ; ",
    "journal": "Journal of Energy Chemistry",
    "date": "2025-10-31",
    "doi": "10.1016/j.jechem.2025.06.017",
    "abstract": "",
    "uri": "https://api.elsevier.com/content/article/pii/S2095495625004929",
    "pii": "S2095495625004929"
  },
  "fulltext": {
    "full-text-retrieval-response": {
      "scopus-eid": "2-s2.0-105009003171",
      "originalText": "serial JL 286353 291210 291711 291744 291809 31 Journal of Energy Chemistry JOURNALENERGYCHEMISTRY 2025-06-16 2025-06-16 2025-06-27 2025-06-27 2025-09-22T23:56:24 1-s2.0-S2095495625004929 S2095-4956(25)00492-9 S2095495625004929 10.1016/j.jechem.2025.06.017 S300 S300.1 FULL-TEXT 1-s2.0-S2095495625X00073 2025-09-22T23:06:26.139923Z 0 0 20251001 20251031 2025 2025-06-16T15:14:37.881792Z absattachment articleinfo articletitlenorm authfirstinitialnorm authfirstsurnamenorm cid cids contenttype copyright crossmark dateloaded dateloadedtxt datesearch datesort dateupdated dco docsubtype doctype doi eid ewtransactionid hubeid indexeddate issn issnnorm itemstage itemtransactionid itemweight openaccess openarchive pg pgfirst pglast pii piinorm pubdateend pubdatestart pubdatetxt pubyr sortorder srctitle srctitlenorm srctype ssids alllist content subj subheadings suppl tomb volfirst volissue volumelist webpdf webpdfpagecount yearnav figure e-component body mmlmath acknowledge affil appendices articletitle auth authfirstini authfull authkeywords authlast footnotes grantnumber grantsponsor grantsponsorid orcid primabst ref specialabst 2095-4956 20954956 false 109 109 C Volume 109 54 671 680 671 680 202510 October 2025 2025-10-01 2025-10-31 2025 article fla © 2025 Science Press and Dalian Institute of Chemical Physics, Chinese Academy of Sciences. Published by Elsevier B.V. and Science Press. All rights are reserved, including those for text and data mining, AI training, and similar technologies. SPINORBITALMANIPULATIONMULTIPLEATOMICSITESBYHIGHENTROPYEFFECTFORCATALYZINGCASCADESULFURCONVERSION GONG W 1 Introduction 2 Results and discussion 3 Conclusions Experimental section CRediT authorship contribution statement Acknowledgments Appendix A Supplementary material References MANTHIRAM 2014 11751 11787 A YANG 2025 H SONG 2023 e13 B LIU 2024 98 104 R ZHANG 2024 2410583 X ZHANG 2023 1728 1739 Y BI 2024 2411197 C HUA 2021 2101006 W SHEN 2025 2418090 Z XIAOFEI 2024 2024030 Y LI 2025 4822 4873 X SONG 2024 588 596 Y CAO 2025 G YE 2023 102855 Z HE 2025 192 201 L LI 2025 G ZHAO 1852 21845 121842 J LI 2022 e202114671 X DAI 2024 2315563 G ZHUANG 2024 123273 H CAI 2025 G LI 2025 8250 8259 C WANG 2024 33405 33417 H WANG 2024 34858 34869 Y LIU 2024 101300 D LIAN 2025 104054 M XU 2024 7735 7748 M HAN 2025 9182 9195 F WANG 2025 H THEIBAULT 2023 18402 18410 M SHEN 2024 7634 7644 N LEI 2023 816 826 X ZHANG 2025 2413653 Y TAMTAJI 2024 2309883 M CHEN 2024 598 607 Z YAN 2024 154482 W LV 2025 2403223 Q CHEN 2024 2409369 W WU 2025 e202422208 G ZHANG 2023 2302249 T YAN 2023 e202215414 R WU 2024 13468 13483 Q WANG 2023 2305991 R ZHAI 2022 253 262 S WANG 2023 15794 15810 J HAN 2021 2105947 Z HACKER 2022 1 9 J JIANG 2024 100203 W CHEN 2024 34791 34802 K LI 2025 12021 12032 B LI 2024 17774 17785 J WANG 2024 e202406065 B LI 2024 103477 S ZHANG 2023 2300293 S DONG 2024 2407070 C ZHAO 2024 2402175 C LU 2024 103458 M YANG 2024 3231 Q ZHANG 2024 2306806 T DING 2024 123553 Y YAN 2024 e202404019 R YE 2017 1700598 Y CAI 2024 13055 13065 G LIN 2024 2404983 H ZHOU 2024 e202405417 R YANG 2024 2083 2091 D SONI 2022 97 107 R CHEN 2025 e202423046 L GONGX2025X671 GONGX2025X671X680 GONGX2025X671XW GONGX2025X671X680XW 2027-06-27T00:00:00.000Z 2027-06-27T00:00:00.000Z http://creativecommons.org/licenses/by-nc-nd/4.0/ © 2025 Science Press and Dalian Institute of Chemical Physics, Chinese Academy of Sciences. Published by Elsevier B.V. and Science Press. All rights are reserved, including those for text and data mining, AI training, and similar technologies. 2025-06-29T02:40:34.219Z http://vtw.elsevier.com/data/voc/AddOnTypes/50.7/aggregated-refined Macao Young Scholars Program AM2023011 Macao Young Scholars Program http://sws.geonames.org/1814991 282022554 Yuanguang Scholars Program http://sws.geonames.org/1814991 Hebei University of Technology HEBUT Hebei University of Technology http://data.elsevier.com/vocabulary/SciValFunders/501100010850 http://sws.geonames.org/1814991/ National Natural Science Foundation of China 52302240 National Natural Science Foundation of China http://data.elsevier.com/vocabulary/SciValFunders/501100001809 http://sws.geonames.org/1814991 This work was supported by the National Natural Science Foundation of China (52302240), the Macao Young Scholars Program (AM2023011), and the Yuanguang Scholars Program, Hebei University of Technology (282022554). item S2095-4956(25)00492-9 S2095495625004929 1-s2.0-S2095495625004929 10.1016/j.jechem.2025.06.017 286353 2025-09-22T23:06:26.139923Z 2025-10-01 2025-10-31 1-s2.0-S2095495625004929-main.pdf https://s3-eu-west-1.amazonaws.com/prod-ucs-content-store-eu-west/content/pii:S2095495625004929/MAIN/application/pdf/a2b964a7ea151b4c336c3d6f521216c4/main.pdf main.pdf pdf true 3425305 MAIN 10 1-s2.0-S2095495625004929-main_1.png https://s3-eu-west-1.amazonaws.com/prod-ucs-content-store-eu-west/content/pii:S2095495625004929/PREVIEW/image/png/52a9d7bf205adb7dbfdb5e395873dfa3/main_1.png main_1.png png 63206 928 656 IMAGE-WEB-PDF 1 1-s2.0-S2095495625004929-ga1.jpg https://s3-eu-west-1.amazonaws.com/prod-ucs-content-store-eu-west/content/pii:S2095495625004929/ga1/DOWNSAMPLED/image/jpeg/0ad17bca3f91fb604c362d0f75e59780/ga1.jpg ga1 true ga1.jpg jpg 24011 200 397 IMAGE-DOWNSAMPLED 1-s2.0-S2095495625004929-gr1.jpg https://s3-eu-west-1.amazonaws.com/prod-ucs-content-store-eu-west/content/pii:S2095495625004929/gr1/DOWNSAMPLED/image/jpeg/7b2584aed4281eaff9071fdf542b238b/gr1.jpg gr1 gr1.jpg jpg 173826 784 774 IMAGE-DOWNSAMPLED 1-s2.0-S2095495625004929-gr2.jpg https://s3-eu-west-1.amazonaws.com/prod-ucs-content-store-eu-west/content/pii:S2095495625004929/gr2/DOWNSAMPLED/image/jpeg/2412d627b449c4bfa62a41ae18e62b63/gr2.jpg gr2 gr2.jpg jpg 131020 624 734 IMAGE-DOWNSAMPLED 1-s2.0-S2095495625004929-gr3.jpg https://s3-eu-west-1.amazonaws.com/prod-ucs-content-store-eu-west/content/pii:S2095495625004929/gr3/DOWNSAMPLED/image/jpeg/0b26c887c6ad4af5fda00185a93f343b/gr3.jpg gr3 gr3.jpg jpg 122202 701 787 IMAGE-DOWNSAMPLED 1-s2.0-S2095495625004929-gr4.jpg https://s3-eu-west-1.amazonaws.com/prod-ucs-content-store-eu-west/content/pii:S2095495625004929/gr4/HIGHRES/image/jpeg/9d5f203491026364e830e9f1f245e5bd/gr4.jpg gr4 gr4.jpg jpg 129441 543 707 IMAGE-DOWNSAMPLED 1-s2.0-S2095495625004929-gr5.jpg https://s3-eu-west-1.amazonaws.com/prod-ucs-content-store-eu-west/content/pii:S2095495625004929/gr5/DOWNSAMPLED/image/jpeg/153574632394d0f7e1229303420cc13a/gr5.jpg gr5 gr5.jpg jpg 101903 583 685 IMAGE-DOWNSAMPLED 1-s2.0-S2095495625004929-ga1.sml https://s3-eu-west-1.amazonaws.com/prod-ucs-content-store-eu-west/content/pii:S2095495625004929/ga1/THUMBNAIL/image/gif/c9a4f3c7b94cf558aa1a4ba1b0d3928c/ga1.sml ga1 true ga1.sml sml 14683 110 219 IMAGE-THUMBNAIL 1-s2.0-S2095495625004929-gr1.sml https://s3-eu-west-1.amazonaws.com/prod-ucs-content-store-eu-west/content/pii:S2095495625004929/gr1/THUMBNAIL/image/gif/e152b5c9015e2f66402739e5f41fc76d/gr1.sml gr1 gr1.sml sml 13476 164 162 IMAGE-THUMBNAIL 1-s2.0-S2095495625004929-gr2.sml https://s3-eu-west-1.amazonaws.com/prod-ucs-content-store-eu-west/content/pii:S2095495625004929/gr2/THUMBNAIL/image/gif/05a0062290c9f6672f1237ea2c035013/gr2.sml gr2 gr2.sml sml 13379 164 193 IMAGE-THUMBNAIL 1-s2.0-S2095495625004929-gr3.sml https://s3-eu-west-1.amazonaws.com/prod-ucs-content-store-eu-west/content/pii:S2095495625004929/gr3/DOWNSAMPLED/image/gif/a88b51ed0f440c725ce36e6ff0304163/gr3.sml gr3 gr3.sml sml 11151 164 184 IMAGE-THUMBNAIL 1-s2.0-S2095495625004929-gr4.sml https://s3-eu-west-1.amazonaws.com/prod-ucs-content-store-eu-west/content/pii:S2095495625004929/gr4/THUMBNAIL/image/gif/21ba3aa0fe8e78a04302f5c3419b0dfb/gr4.sml gr4 gr4.sml sml 14468 164 214 IMAGE-THUMBNAIL 1-s2.0-S2095495625004929-gr5.sml https://s3-eu-west-1.amazonaws.com/prod-ucs-content-store-eu-west/content/pii:S2095495625004929/gr5/THUMBNAIL/image/gif/0d98e1c792b66d44d1a884073ab8a29b/gr5.sml gr5 gr5.sml sml 12522 164 193 IMAGE-THUMBNAIL 1-s2.0-S2095495625004929-ga1_lrg.jpg https://s3-eu-west-1.amazonaws.com/prod-ucs-content-store-eu-west/content/pii:S2095495625004929/HIGHRES/image/jpeg/f939b3caf8d7c6306bbbeb0087aca37e/ga1_lrg.jpg ga1 true ga1_lrg.jpg jpg 132618 886 1758 IMAGE-HIGH-RES 1-s2.0-S2095495625004929-gr1_lrg.jpg https://s3-eu-west-1.amazonaws.com/prod-ucs-content-store-eu-west/content/pii:S2095495625004929/HIGHRES/image/jpeg/b7d91cfceee3700f86dc86d763c696e0/gr1_lrg.jpg gr1 gr1_lrg.jpg jpg 1201144 3469 3425 IMAGE-HIGH-RES 1-s2.0-S2095495625004929-gr2_lrg.jpg https://s3-eu-west-1.amazonaws.com/prod-ucs-content-store-eu-west/content/pii:S2095495625004929/HIGHRES/image/jpeg/47653985b1ac148326bab32d6d48e9b8/gr2_lrg.jpg gr2 gr2_lrg.jpg jpg 892837 2761 3248 IMAGE-HIGH-RES 1-s2.0-S2095495625004929-gr3_lrg.jpg https://s3-eu-west-1.amazonaws.com/prod-ucs-content-store-eu-west/content/pii:S2095495625004929/HIGHRES/image/jpeg/c01d58931b2a749993cc58eeb8ea0aae/gr3_lrg.jpg gr3 gr3_lrg.jpg jpg 699482 3102 3484 IMAGE-HIGH-RES 1-s2.0-S2095495625004929-gr4_lrg.jpg https://s3-eu-west-1.amazonaws.com/prod-ucs-content-store-eu-west/content/pii:S2095495625004929/HIGHRES/image/jpeg/32f0dbe4c7ad4a494a349e6f90f6e769/gr4_lrg.jpg gr4 gr4_lrg.jpg jpg 948318 2402 3130 IMAGE-HIGH-RES 1-s2.0-S2095495625004929-gr5_lrg.jpg https://s3-eu-west-1.amazonaws.com/prod-ucs-content-store-eu-west/content/pii:S2095495625004929/HIGHRES/image/jpeg/19d7332a49173fd9d093ab0b641785f5/gr5_lrg.jpg gr5 gr5_lrg.jpg jpg 651113 2579 3031 IMAGE-HIGH-RES 1-s2.0-S2095495625004929-mmc1.docx https://s3-eu-west-1.amazonaws.com/prod-ucs-content-store-eu-west/content/pii:S2095495625004929/mmc1/MAIN/application/vnd.openxmlformats-officedocument.wordprocessingml.document/eea50b49cae9cdcdf863d5e9ad88e27a/mmc1.docx mmc1 mmc1.docx docx 6526327 APPLICATION 1-s2.0-S2095495625004929-si1.svg https://s3-eu-west-1.amazonaws.com/prod-ucs-content-store-eu-west/content/pii:S2095495625004929/STRIPIN/image/svg+xml/84c0fed877b1b39b7f14c2d7d9f0ef3f/si1.svg si1 si1.svg svg 9710 ALTIMG JECHEM 4791 S2095-4956(25)00492-9 10.1016/j.jechem.2025.06.017 Science Press and Dalian Institute of Chemical Physics, Chinese Academy of Sciences Fig. 1 (a) SEM images, (b) HRTEM image, (c) SAED pattern, and (d) AC-HAADF-STEM images of HE-SA. (e–i) XPS spectra of (e) Mn 2p, (f) Fe 2p, (g) Co 2p, (h) Ni 2p, and (i) Cu 2p for HE-SA. (j) The charge density difference of HE-SA. (k) Charge transfer numbers of different atoms in HE-SA obtained from Bader analysis, where M atoms charge loss and surrounding N charge accumulation were depicted on left and right, respectively. (l) Top view of the spin density distribution of HE-SA. (m) The magnetic moments of different single atoms in HE-SA. (n) Schematic illustration of the electron spin configuration for different metal d-orbitals in HE-SA. (o) The orbital interactions between Fe (left) and Mn (right) sites in HE-SA and different LiPS intermediates. (p) Schematic of the interaction between N 2p in HE-SAs and Li 2s orbitals in LiPS reaction intermediates. Fig. 2 (a) UV-vis adsorption spectra profiles and optical photograph inset of Li2S4 solution trapped by various atomic catalysts. (b) Adsorption energies for Li2S4 on the surface of Fe and Co sites in HE-SA and LE-SA. Top view of charge density difference for Li2S4 adsorption on the surface of (c) HE-SA and (d) LE-SA (the blue and pink areas mean the electron accumulation and depletion, respectively). (e) Analysis of d and p band center of different metal atomic sites in HE-SA. (f) Adsorption energies for Li2S4 of various metal sites in HE-SA. The COHP of (g) M–S bond and (h) Li–N bond in Li2S4 adsorbed HE-SA system. (i) Analysis of ICOHP of Li–N bond and M–S bond for Li2S4 adsorbed on different metal sites in HE-SA system. (j) CV curves of HE-SA-containing electrodes at different sweep rates from 0.1 to 0.5 mV s−1. (k) Linear fitting of current responses of cathodic and anodic peaks versus square root of sweep rates for different electrodes. (l) CV profiles of symmetric cells with HE-SA and LE-SA electrodes. (m) Chronoamperometry profiles of different symmetric cells. Fig. 3 (a) Adsorption energies for Li2S of various metal sites in HE-SA. (b) Adsorption energies for Li2S on the surface of Fe and Co sites in LE-SA. Side view of charge density difference for Li2S4 adsorption on the surface of (c) HE-SA and (d) LE-SA (the blue and pink areas mean the electron accumulation and depletion, respectively). COHP curves of (e) M–S and (f) Li–N bonds of Li2S adsorbed on the different metal sites in HE-SA. (g) The ICOHP values of M–S and Li–N bonds of Li2S adsorbed on the surface of HE-SA. (h, i) Potentiostatic discharge curves of Li2S nucleation. The dissolution profiles of Li2S with (j) HE-SA and (k) LE-SA. (l) Relative activation energy of sulfur redox reaction derived from the Arrhenius plots. Fig. 4 (a) CV profiles of Li-S batteries with different sulfur cathodes. (b) Galvanostatic charge/discharge profiles at 0.2 C. (c) Rate capability of Li-S batteries with different sulfur cathodes. (d) Charge/discharge curves of HE-SA-based Li-S cell at various current-rates. (e) Potential gap between the charge and discharge plateau at different current densities. (f) Rate performance comparison of HE-SA with previous reported work. (g) Cycling performance at 0.2 C. (h) Long-term cycling stability at 1 C of different cells. (i) Capacity decay rate comparison of the HE-SA sulfur electrode with relevant reported work. (j–m) Cycling performance and corresponding charge/discharge curves of HE-SA-based sulfur cathode under different conditions of high loading and lean electrolyte at 0.05 C. Fig. 5 (a–c) In situ EIS measurement of HE-SA-based Li-S cell and corresponding fitting values of R S, R SEI, and R ct. DRT contour plots of (d, f, g) HE-SA and (e) LE-SA. (h–j) The corresponding DRT plots for HE-SA and LE-SA cells at different states. Spin and orbital manipulation of multiple atomic sites by high-entropy effect for catalyzing cascade sulfur conversion Weihao Gong Writing – review & editing Writing – original draft Validation Investigation Data curation Conceptualization a 1 Guangfu Dai Writing – review & editing Writing – original draft Data curation Conceptualization a 1 Hongjiao Liu Validation Supervision Data curation a 1 Haobo Sun Writing – original draft Data curation a Zeyi Wu Writing – original draft a Xinpeng Zhao Writing – original draft a Haoting Miao Writing – original draft a Ying Jiang Writing – review & editing Software c Zhengqing Ye Writing – review & editing Supervision Software Resources Project administration Methodology Investigation Funding acquisition Conceptualization a b ⁎ a Tianjin Key Laboratory of Materials Laminating Fabrication and Interface Control Technology, School of Material Science and Engineering, Hebei University of Technology, Tianjin 300401, China Tianjin Key Laboratory of Materials Laminating Fabrication and Interface Control Technology School of Material Science and Engineering Hebei University of Technology Tianjin 300401 China Tianjin Key Laboratory of Materials Laminating Fabrication and Interface Control Technology, School of Material Science and Engineering, Hebei University of Technology, Tianjin 300401, China b Joint Key Laboratory of the Ministry of Education, Institute of Applied Physics and Materials Engineering, University of Macau, Avenida da Universidade, Taipa, Macau 999078, China Joint Key Laboratory of the Ministry of Education Institute of Applied Physics and Materials Engineering University of Macau Avenida da Universidade Taipa Macau 999078 China Joint Key Laboratory of the Ministry of Education, Institute of Applied Physics and Materials Engineering, University of Macau, Avenida da Universidade, Taipa, Macau 999078, China c School of Material Science and Engineering, Tianjin University of Technology, Tianjin 300384, China School of Material Science and Engineering Tianjin University of Technology Tianjin 300384 China School of Material Science and Engineering, Tianjin University of Technology, Tianjin 300384, China ⁎ Corresponding author. 1 These authors contributed equally to this work. Graphical abstract Spin and orbital modulation of multi-atomic sites by high-entropy effect was proposed to catalyze cascade sulfur conversion. The high-spin Fe and Mn strongly interact with LiPS through d-p and p-s hybridization, which facilitates the sulfur reduction and evolution reaction. Lithium-sulfur (Li-S) batteries are considered a potential candidate for next-generation energy-dense and sustainable energy storage. However, the slow conversion and severe shuttle of polysulfides (LiPSs) result in rapid performance degradation over long-term cycling. Herein, we report a high-entropy single-atom (HE-SA) catalyst to regulate the multi-step conversion of LiPS to attain a high-performance Li-S battery. Both the density functional theory calculations and the experimental results prove that the Fe atomic site with high spin configurations strongly interacts with Li2S4 through d-p and s-p synergistic orbital hybridization which facilitates the reduction of LiPS. Moreover, S-dominant p-d hybridization between Li2S and a high-spin Mn site weakens the Li–S bond and facilitates the rapid sulfur evolution reaction. Consequently, the Li-S battery with a bifunctional HE-SA catalyst shows an ultralow capacity decay of 0.026 % per cycle over 1900 cycles at 1 C. This work proposes a high-entropy strategy for sculpting electronic structures to enable spin and orbital hybridization modulation in advanced catalysts toward long-cycling Li-S batteries. Keywords Electronic spin state Orbital hybridization High-entropy effect Multi-atomic catalysts Sulfur conversion reaction Li-S battery 1 Introduction Currently, traditional lithium-ion batteries (LIBs) have been difficult to fulfill human needs and social development owing to their low specific energy (350 Wh kg−1) [1–3]. Lithium-sulfur batteries (LSBs) are regarded as a promising candidate within the field of energy storage systems because of their promising high energy density of 2600 Wh kg−1 [4–7]. Moreover, the cathode material sulfur is earth-abundant, environmentally friendly, and inexpensive. Nevertheless, severe challenges have obstructed the practical application of the sulfur cathode. Typical LSBs fully achieve the high theoretical capacity (1675 mAh g−1) from the conversion of sulfur, wherein slow kinetics and drastic volume variation occur that involve the generation of soluble lithium polysulfide (Li2S n , 4 ≤ n ≤ 8) intermediates, consequently resulting in a continuous loss of the active materials and poor cycling life [8–12]. Utilizing electrocatalysts that can immobilize and expedite the redox reaction of LiPSs is regarded as a root-cause approach to tackle these challenges [13–18]. In particular, the atomic-level electrocatalysts, involving single-atom (SA) and dual-atom (DA), have been explored to improve sulfur utilization and performance because of their extremely high atom utilization efficiency [19–24]. Unfortunately, SA catalysts suffer from the positive correlation between the activity of catalysts and the symmetry reduction, which hinders the aspect of maximizing the adsorption and redox reaction of LiPS. Although DA catalysts break this symmetry to some extent, the scaling relationship limit, which leads to slow sulfur conversion kinetics, has not been fundamentally resolved. In this regard, a chaotic system with high-entropy single atoms (HE-SA) could be the ideal method to solve the above problem. In terms of composition, the high-entropy materials are single-phase solid solutions, which are composed of five or more metallic elements with a concentration of each metallic element being between 5 and 35 atom% [25]. Moreover, high-entropy materials can be defined by a configurational entropy (S config) ≥ 1.5 R (calculated by S config = −R ∑ i = 1 n x i l n x i , where R represents the ideal gas constant, n represents the total number of compositional elements, and xi represents the molar concentration of the ith element) and have attracted substantial attention in the energy-dense batteries based on conversion reactions [26–31]. Particularly, HE-SA has emerged with promising properties because of their compositional diversity on isolated metal (M) atomic sites. Compared with traditional SA and DA catalysts, the existence of the multiple atomic metal sites in HE-SA leads to resilient lattice arrangement at the atomic scale and enables the cooperative regulation of the electronic configuration and d-band engineering, which is referred to as the cocktail effect [32]. In addition, the existence of various active metal sites can regulate the electronic structure, orbital configuration, and catalytic activity through long-range interaction, similar to DA catalysts [33]. More importantly, it has been found that the spin states of the transition metal at the atomic level play a critical role in determining catalytic activity [34]. This enables researchers to tune the catalytic activity of HE-SA by changing the spin-configurations of metal sites leading to promising opportunities to design the desired electrocatalyst toward sulfur conversion reaction, surpassing the performance of SA and DA catalysts. In principle, the atomic magnetic moment in the 3d transition metals is mainly determined through the spin electron orbital filling and its exchange interactions [35]. Meanwhile, the sulfur conversion reaction behavior is intricately connected to the electronic spin configurations and the orbital interactions. For example, Yan et al. found that nitrogen doping in Co-SA catalysts (CoSAC@NC) can induce more electrons to fill higher-energy d-orbitals, thus triggering an alteration of crystal field splitting and a degeneracy-lift in Co d-orbital, which ultimately results in a high-spin state of Co [36]. The improvement of the d-p orbital interactions by the high-spin configuration reduces the energy barrier and improves the kinetics of the sulfur reduction reaction (SRR). Wang's group reported that the strong interaction between the conducive hexagonal cobalt-organic framework (Co-HTP) and the carboxyl graphene (CG) via axial Co–O coordination can modulate the electronic configuration of Co site from low-spin to high-spin state, thus enhancing orbital hybridization with polysulfides and resulting in easier LiPSs adsorption and faster conversion kinetics [37]. Similarly, the degeneracy of the 3d-orbital and the electronic spin state of Fe are switched from the intermediate spin to the low spin by the axial click confinement [38]. Therefore, the d-p orbital interaction between the Fe atoms and the LiPSs is enhanced, leading to improved adsorption energy and catalytic activity in Li-S batteries. In addition to S-dominant p-d orbital hybridization, recently, researchers have also begun to focus on the s-p orbital hybridization between polysulfides and multisite SA catalysts, which also plays a vital role in the catalytic activity [39]. However, the spin regulation of HE-SA catalysts and the synergistic mechanism of d-p and s-p hybridization with LiPS remain unexplored in Li-S batteries. Herein, considering the distinct d-electron configurations of fourth-period transition metals, a HE-SA catalyst with five homogeneously dispersed transition metal centers (Mn, Fe, Co, Ni, and Cu) is synthesized for the cascade catalysis of multi-step polysulfide conversion for the Li-S batteries. Enlightened by density functional theory (DFT) calculations, we are excited to find that high-spin Fe and Mn in the HE-SA play dominant roles during the SRR and sulfur evolution reaction (SER) processes, respectively. Specifically, the Fe site dominates the reduction reaction of Li2S4 through the synergistic mechanism of d-p and s-p hybridization, and the Mn site mainly dominates the oxidation reaction of Li2S through d-p hybridization. The realized rapid bidirectional catalysis in the sulfur redox process was confirmed by a series of spectrum and electrochemical characterization technologies. Thus, the Li-S batteries with the HE-SA exhibit a high capacity of 1060 mAh g−1 at 1 C and show excellent cycling stability with an extremely low decay rate of 0.026 % for 1900 cycles. This study illustrates that the spin regulation of HE-SA catalysts and the synergistic effects mechanism of d-p and s-p hybridization with LiPS can efficiently facilitate the redox reactions of Li-S batteries, offering novel perspectives on the rational design of the catalysts with multiple active sites. 2 Results and discussion The microstructure and morphology of the as-obtained HE-SA on the carbon cloth (CC) were characterized by field-emission scanning electron microscopy (FESEM) and high-resolution transmission electron microscopy (HRTEM), as exhibited in Fig. 1 (a, b). The catalyst materials in the shape of a rhombododecahedron are stably dispersed on the CC. Selected area electron diffraction (SAED) analyses verify the non-crystalline structure of the particles and eliminate the existence of metal clusters or nanoparticles, illustrating a good distribution of Mn, Fe, Co, Ni, and Cu atoms, which corresponds to energy dispersive spectrometer (EDS) results (Fig. 1c and Fig. S1). A spherical aberration-corrected high-angle annular dark-field scanning transmission electron microscopy (AC-HAADF-STEM) image exhibits the good dispersion of metal single atoms in the carbon substrate (Fig. 1d). To further reveal the coordination environments of HE-SA, the distance between metal-metal dots was 0.65 ± 0.009 nm by statistical analysis based on the AC-HAADF-STEM tests (Fig. S2), indicating the absence of metallic bonding interactions. The X-ray diffraction (XRD) pattern of HE-SA exhibits two broad peaks centered at 26° and 44° (Fig. S3), which can be assigned to (002) and (100) lattice planes of amorphous carbon and partial graphitized carbon, respectively. It is notable that no other diffraction peaks are associated with the metallic and the oxidized forms present in this XRD pattern, indicating that the metal atoms are highly distributed and do not aggregate into nanoparticles. To further explore surface chemical environments and the valence state of different elements, X-ray photoelectron spectroscopy (XPS) measurements were conducted. The element contents of Mn, Fe, Co, Ni, and Cu were quantified by the XPS measurement (Fig. S4). The results show that the atomic ratios of Mn, Fe, Co, Ni, and Cu in HE-SA are 25.38 %, 33.16 %, 12.69 %, 14.33 %, and 14.45 % (Table S1), indicating that the high entropy materials were successfully synthesized [25]. The XPS spectrum of Mn 2p is presented in Fig. 1(e). The 2p 3/2 peak can be resolved into two pairs at 641.1 and 643.0 eV, which correspond to the presence of Mn2+ and Mn3+, separately [40]. The peak at 646.2 eV pertains to the satellite feature of Mn2+. The Fe region scan also exhibits two primary peaks in the Fe 2p 3/2 , with binding energies of 709.2 and 711.9 eV, corresponding to the Fe2+ and Fe3+ valence states, respectively (Fig. 1f) [41]. In addition, the Co 2p spectrum shows two peaks located at 781.2 and 795.9 eV and the associated satellite peaks, corresponding to Co 2p 3/2 and Co 2p 1/2 of the Co–N bonds (Fig. 1g) [42]. The Ni 2p XPS spectrum manifests that the binding energy of the Ni in HE-SA is 855.0 eV (Ni 2p 3/2), which is centered between Ni0 and Ni2+, therefore demonstrating the presence of Ni δ + (0 < δ < 2) centers (Fig. 1h) [43]. In Fig. 1(i), the Cu 2p spectrum shows two peaks at 932.7 and 952.5 eV, which is attributed to Cu 2p 3/2 and Cu 2p 1/2 of the cation Cu2+ in HE-SA, respectively [44]. No zero-valent metal peaks are detected for all XPS spectra of HE-SA, therefore demonstrating no metallic clusters or particles in the HE-SA. To further understand the benefits of HE-SA compared to low-entropy single-atom (LE-SA) at the atomic level, DFT calculations were conducted by using two rationally simplified structure models (Fig. S5). The pink-colored area in the charge density differences (CDD) profiles indicates charge depletion, while the blue-colored area corresponds to charge accumulation (Fig. 1j and Fig. S6). The CDD calculations of HE-SA and LE-SA exhibit that the strong electron-accepting capacity of the nitrogen (N) atoms triggered the charge transfers from metal (M) atoms and would result in the positive oxidation state of M sites. Evidently, the Mn and Fe atomic sites of HE-SA showed a larger charge transfer than other metal sites (Fig. 1k and Fig. S7), which could trigger charge redistribution, beneficial for polysulfide adsorption and subsequent conversion process. Furthermore, the partial density of states (PDOS) of the Fe d-orbitals in HE-SA and LE-SA both exhibit larger asymmetry as compared to Co d-orbital counterparts. In addition, the electronic states of Mn and Fe d-orbitals in HE-SA also exhibit larger asymmetry compared to other metal atomic sites, originating from the non-uniform distribution of the electronic states between spin up and spin down (Fig. S8). The asymmetry of the d-orbitals for Fe and Mn in HE-SA will induce spontaneous spin polarization that can supply spin electrons, which is advantageous for bonding with LiPS molecules [41]. To further quantify the spin polarization of HE-SA and LE-SA, corresponding spin density and magnetic moments were calculated (Fig. 1l, m, Figs. S9 and S10). The computational results uncover the existence of two obvious electron spin state domains (spin up and spin down) within the HE-SA/LE-SA material. An examination of the Fe spin electron density shows that HE-SA exhibits a much stronger intensity as compared to LE-SA, which is consistent with the results of magnetic moments. Moreover, Mn and Fe in HE-SA possess a larger magnetic moment than other metal atomic sites, demonstrating their superior spin polarization degree. Generally, the large spin magnetic moment of the transition metals promotes the orbital overlap between the LiPS intermediate and the d-orbital of the metal atomic site, which favors the generation of spin channels for electron transfer, thereby promoting the adsorption of the intermediate [45]. According to the DFT calculations analysis, it can be deduced that the spin states of various metal d-orbitals in HE-SA exhibit different electron filling and energy-level arrangements including Mn (dxy 1 dz 2 1 dx 2− y 2 1 dxz 1 dyz 1), Fe (dxy 2 dz 2 1 dxz 1 dyz 1 dx 2− y 2 1), Co (dxy 2 dx 2− y 2 2 dyz 2 dz 2 1 dxz 0), Ni (dxy 2 dx 2− y 2 2 dyz 2 dz 2 1 dxz 1), and Cu (dxy 2 dx 2− y 2 2 dz 2 2 dyz 2 dxz 1) (Fig. 1n). To explore the polysulfide conversion process detected by different atomic sites in HE-SA, we first investigated their d-p orbital hybridization interaction according to the coordination field theory. In general, the interactions between the metal dxy and dx 2− y 2 orbitals and the molecular orbitals of adsorbate are insignificant due to symmetrical conservation [46]. Thus, the bond strength between the metal sites and LiPSs intermediates is primarily attributed to the hybridization of the metal dxz , dz 2, and dyz orbitals with the adsorbed LiPSs p-orbitals, respectively. Specifically, the metal dz 2-orbital can strongly interact with the S 3pz -orbital of LiPSs to generate σ* and σ bonds, while the metal dyz and dxz orbitals can hybridize with the S py and px orbitals to form Π* and Π bonds, respectively. For HE-SA, Mn and Fe sites with high-spin states can generate high bond orders with different LiPSs by the d-p hybridization (Fig. 1o, Figs. S11 and S12). Therefore, the presence of different cations around the active metal atom sites can participate in the regulation of their electronic spin state, orbital hybridization, and electrocatalytic activity via the non-bonding interaction [34]. Moreover, metal-N coordinated atomic catalysts can also immobilize the LiPSs via the chemical interaction of N–Li bonds. It is more reasonable to consider the s-p hybridization between Li 2s orbitals of LiPS and N 2p orbitals of N coordination atoms. The PDOS results demonstrate the p-band center (εp ) of the N atoms coordinated with Mn, Fe, Co, Ni, and Cu being −5.74, −4.87, −5.65, −5.80, and −5.73 eV, respectively. Remarkably, the higher εp will result in a decrease in the occupancy states of antibonding sigma orbital (σ*) generated via the s-p hybridization between the Li+ and the N, therefore weakening the electronic repulsion between the Li+ and the N and improving the interaction between the Li+ and the N, as shown in Fig. 1(p). It is considered that the efficient adsorption of Li2S4 intermediates is crucial to simultaneously accelerate the conversion process and suppress the shuttling effect. To investigate the adsorption capacity of HE-SA and LE-SA catalysts to confine Li2S4, Ultraviolet-visible spectrophotometry (UV-vis) spectra and visualized static adsorption experiments were conducted. Obvious color differences were detected between the various vials. In the absence of adsorbents, the Li2S4 solution shows a dark brown color. After overnight adsorption, the solution including HE-SA was colorless and transparent, demonstrating that most Li2S4 has been adsorbed. On the contrary, the solutions containing LE-SA maintain a strong brown appearance, demonstrating poor Li2S4 adsorption effectiveness. The UV-vis adsorption spectra show that the solution with HE-SA exhibits a much lower absorption peak intensity of Li2S4 than LE-SA. In particular, LiPSs peak of the Li2S4 solution at about 600 nm is observed, which is probably attributed to the polysulfide radical S3·− and almost entirely disappears after adsorption by LE-SA and HE-SA (Fig. 2 a), further confirming that HE-SA has stronger adsorption capability for LiPSs [47,48]. To systematically illustrate the potential of HE-SA to improve adsorption capacity and promote sulfur conversion, DFT calculations were performed. The optimized adsorption energy of Li2S4 (Fig. 2b, Figs. S13 and S14) on the surface of the Fe site in HE-SA is higher than that in LE-SA. Charge density difference analysis between catalysts and Li2S4 further reveals the electron interactions during the adsorption process (Fig. 2c, d). The pink area in CDD diagrams indicates charge depletion, while the blue area corresponds to charge accumulation. The metal-sulfur (M–S) and lithium-nitrogen (Li–N) interactions are witnessed in terms of the significant charge transfer in between. The lithiophilic-sulfiphilic dual functions of HE-SA are expected to improve polysulfide capture and conversion kinetics. The HE-SA shows a higher density state close to the Fermi level compared with LE-SA (Fig. S15), indicating that the entropy-stabilized structure improves the electronic conductivity, potentially accelerating charge transfer in the sulfur reaction processes. Furthermore, the DOS calculation exhibits that the d-band centers of metals atomic sites in HE-SA positively shift toward the Fermi level from Cu to Mn (Fig. 2e), resulting in an increasing interaction between Li2S4 and HE-SA because of less occupied anti-bonding states of M–S bonds. Therefore, Fe and Mn sites possess higher binding energies with Li2S4 among the five metal sites in HE-SA (Fig. 2f). However, the difference in the Li2S4 adsorption strength in Fe and Mn sites of HE-SA is ascribed to the different chemical bonding strengths between the coordinated N site of metal and the Li atoms of Li2S4. Furthermore, the atomic N site of Fe presents the highest p-band center energy level among coordinated N sites in five metals, leading to a corresponding decrease in the occupancy states of the Li–N σ* orbital, thus strengthening the chemical interaction between N and Li. The adsorption and catalysis mechanism of the HE-SA towards Li2S4 in Li-S chemistry was systematically investigated by projected crystal orbital Hamilton population (pCOHP) analysis. The interatomic bonding strength can be assessed by analyzing the integral COHP (ICOHP) below the Fermi level, where the positive and negative ICOHP stands for the antibonding and bonding contribution, respectively. As shown in Fig. 2(g) from Mn to Cu, more anti-bonding states of M–S bonds shift down away from the Fermi level and are occupied, indicating that the M–S bonds are weakened. Meanwhile, the ICOHP of M–S bonds yields a less negative value from Mn to Cu, which is closely correlated to the down-shift of d-band centers. In addition, the COHP of Li–N between N sites in HE-SA and Li in Li2S4 is presented in Fig. 2(h). For Fe–N sites, the bonding states of Li–N are predominantly below the Fermi level with more states filled, while antibonding states of Li–N shift obviously toward the Fermi level, resulting in a reduced occupied state. The Fe–N site in HE-SA has the most negative ICOHP value of Li–N bonds among the five coordinated metal-N sites (Fig. 2i), indicating the strongest Li–N interaction and s-p orbital hybridization, which is consistent with the above analysis results of COHP. Considering that the favorable binding site of LiPS is two Li atoms bonding with HE-SA catalysts, the lithium-ion diffusion kinetics of sulfur electrodes with the different catalysts was evaluated by measuring the cyclic voltammetry (CV) curves under different sweep rates (Fig. 2j). The D Li+ was calculated based on the classical Randles-Sevcik equation: I P = (2.69 × 105)n 1.5 AD 0.5 Cv 0.5, where I p is peak current, n is the number of electrons transferred in the redox process, A is the effective electrode area, D is the Li+ diffusion coefficient, C is Li+ concentration in the electrode, and ν represents the scanning rate. Fig. 2(k) shows that the slope of the fitting line precisely reflects the Li+ mobility in the sulfur cathode. Compared with the LE-SA-based cell, the HE-SA-based battery exhibits higher D Li+ during the SRR and SER process, which means a faster lithium-ion diffusion rate and significantly accelerated sulfur conversion kinetics. In addition, we assembled the symmetrical battery using the same working electrodes to reveal the unique function of HE-SA in the sulfur conversion kinetics. Fig. 2(l) shows the CV curves of symmetrical cells for HE-SA and LE-SA electrodes at a scan rate of 3 mV s−1. Obviously, the HE-SA electrode has a relatively higher current response than LE-SA, which indicates that HE-SA facilitates the catalytic conversion of LiPSs and promotes sulfur reaction kinetics. The enhanced current responses in the chronoamperometry profiles of the various symmetric cells with Li2S4 indicate the lithiation/delithiation process [49]. The HE-SA cell presents a higher current response value (2.31 mA cm−2) in chronoamperometry profiles than the LE-SA cell counterpart (1.53 mA cm−2), implying the maximum conversion reaction efficiency on the surface of the HE-SA electrode (Fig. 2m). Fig. 3 (a, b) and Figs. S16–S18 show the adsorption energies of Li2S and corresponding optimized adsorption configurations for different metal sites on various atomic catalyst surfaces. Benefitting from the unique high-entropy effect, the HE-SA exhibits higher adsorption energy values than LE-SA and Mn-SA for Li2S. The calculated charge density difference between different catalysts and Li2S further unveils the electron interaction. The pink-filled region in CDD diagrams indicates charge depletion, while the blue-filled region corresponds to charge accumulation. Under the optimal configuration, Mn sites in HE-SA exhibit greater charge transfer than Fe sites in LE-SA, indicating a superior anchoring effect of Li2S, significantly facilitating the conversion process of Li2S (Fig. 3c, d) [50]. Furthermore, we calculated the COHP for the M–S bonds on different metal sites in HE-SA. From Mn to Cu, the antibonding states of the M–S in HE-SA shift down with more states occupied, while bonding states shift up, contributing to less negative ICOHP (Fig. 3e, g). Due to filling more electrons into the antibonding states and the positive shift of bonding states, the M–S bonds from Mn to Cu in HE-SA are weakened. Moreover, the trends of COHP profiles and ICOHP changes after the adsorption of Li2S by HE-SA are similar, suggesting the approximate degree of s-p orbital hybridization on different M–N active sites (Fig. 3f, g). Additionally, when the discharge product of Li2S is adsorbed on different metal sites in HE-SA, the bond length of S1–Li2 on different mental sites in HE-SA is different. The S1–Li2 bond length on the Mn site is the longest among all the metal sites, indicating that the dissolution of Li2S is most favorable on the Mn site in HE-SA (Fig. S19). This indicates that the HE-SA can effectively accelerate the SER kinetics and improve the bifunctional conversion rate of sulfur. The nucleation process of Li2S was explored through deposition experiments. Based on Faraday’s law, the Li2S precipitation capacity of HE-SA is 340.6 mAh g−1, higher than that of LE-SA (301.0 mAh g−1) (Fig. 3h, i), indicating a stronger acceleration of transformation kinetics in the Li2S deposition process. In addition, HE-SA exhibits a shorter response time to the peak current compared to LE-SA. Furthermore, the nucleation and growth behaviors of Li2S in the two samples were further investigated by utilizing the classical nucleation mode (Fig. S20). HE-SA is more like a two-dimensional transient nucleation model (2DI model) compared to LE-SA, suggesting a more rapid generation of Li2S nucleation [51]. Such rapid nucleation under sudden polarization can lead to an obviously optimized distribution, which is conducive to uniform growth and avoids the formation of dead sulfur. To further explore the effect of high-entropy and spin engineering on the SER ability of HE-SA, Li2S dissolution tests are also conducted by utilizing different asymmetric cells. As shown in Fig. 3(j, k), the HE-SA electrode shows a higher dissolution capacity and a shorter conversion time (450.2 mAh g−1, 32 s) in comparison to LE-SA (383.2 mAh g−1, 58 s). This result indicates that HE-SA can effectively accelerate the dissolution kinetics of Li2S and suppress the passivation effect for catalysts, thus promoting the electrochemical performance in Li-S batteries [52]. In addition, when simulating Li2S6 adsorbed on the HE-SA (Fig. S21), the relatively more negative adsorption energy values in the Fe (−1.03 eV) and Ni (−1.01 eV) sites, indicating that these two metal atoms in the HE-SA dominate the Li2S6 adsorption process. To further explore the sulfur conversion capability of HE-SA and LE-SA, we calculated the activation energy(E a) for the SRR and SER according to the following Arrhenius equation j ∝ k = A × e− E a/ RT , where E a represents the activation energy, R represents the gas constant, A represents a pre-exponential factor, and T represents temperature (Fig. 3l and Fig. S22). In both the long-chain and short-chain LiPSs reaction steps, the E a values of HE-SA are 12.0 and 29.4 kJ mol−1, which are lower than those of LE-SA counterparts, indicating rapid SRR kinetics. In the SER stage, the E a values for the conversion from Li2S to S8 are both smaller compared with LE-SA, suggesting that HE-SA significantly accelerates the SER kinetics. Consequently, the application of HE-SA can obviously reduce the energy barrier of bi-directional sulfur conversion reactions. All in all, the non-bonding interaction of HE-SAs synergistically modulates the electronic spin configuration and accelerates cascade sulfur conversion kinetics, therefore achieving highly efficient electrocatalytic activity of HE-SAs in LSBs. The electrochemical performance of the designed sulfur catalysts was tested in Li-S coin cells. As shown in CV profiles in Fig. 4 (a), the Li-S cell with HE-SA catalysts exhibits a higher peak current and a smaller polarization gap compared to its LE-SA counterpart. Moreover, the magnified galvanostatic charge-discharge (GCD) curves exhibit that the Li-S cell with HE-SA catalysts exhibits a smaller interfacial energy barrier (16.2 mV) compared with that of the LE-SA-based Li-S cell (18.0 mV), indicating the enhanced nucleation and deposition dynamics of Li2S. The improved discharging capacity could be further verified via the lower initial potential (1.72 V) for the HE-SA-based Li-S battery, demonstrating more reductive Li2S in this battery. Moreover, the activation potential barrier of Li2S in the HE-SA-based Li-S battery (2.28 V) is lower than the LE-SA-based battery (2.29 V), demonstrating the superior catalytic ability of HE-SA toward Li2S oxidation (Fig. 4b). In addition, the HE-SA-based Li-S battery displays superior rate performance in comparison to the LE-SA-based battery, realizing specific capacities of 1572, 1290, 1056, 907, 813, and 740 mAh g−1 at current rates of 0.1, 0.2, 0.5, 1, 2, and 3 C, separately. Specifically, the HE-SA-based cell achieves an impressive discharge capacity of 1572 mAh g−1, corresponding to an outstanding sulfur utilization of 94 % at 0.1 C (1 C = 1675 mAh g−1). This capacity is remarkably higher compared with that of the LE-SA-based (1001 mAh g−1) cases. Upon returning the current rate to 0.1 C, the battery displays a significantly recovered capacity of 1304 mAh g−1, reflecting excellent capacity retention of 83.0 % at 0.1 C (Fig. 4c). The GCD curves of the HE-SA-based Li-S battery exhibit a higher discharge capacity and a smaller polarization voltage than those of the LE-SA-based battery at different current rates (Fig. 4d, e and Fig. S23). This confirms the rapid polysulfide conversion kinetics of the HE-SA-based Li-S battery. To efficiently evaluate the advantages of HE-SA in the sulfur redox process under different current densities, the discharge capacities of the high-voltage plateau (Q 1) and the discharge capacities of the low-voltage plateau (Q 2) were determined (Fig. 4d). Obviously, the HE-SA-based Li-S cell shows higher Q 2/Q 1compared to the cell based on LE-SA, indicating that HE-SA has superior catalytic activity and effectively enhances the conversion kinetics of LiPSs (Fig. S24). Moreover, this study possesses a significant advance in terms of rate capability compared with those of the previously reported SA catalysts (Fig. 4f and Table S2) [40,53–61]. The rate-capability curve further illustrates that the HE-SA-based catalyst has outstanding catalytic performance, enabling an enhancement of the discharge capacity. Fig. 4(g) exhibits the long-term cyclic performance of various cells at a current density of 0.2 C. The HE-SA-based Li-S cell has a remarkable initial specific capacity of 1373 mAh g−1 and maintains at 914 mAh g−1 after 100 cycles, which is significantly higher than that of the LE-SA-based cell (433 mAh g−1 after 100 cycles). To further prove the superiority of HE-SA, even at a high current density of 1 C, the HE-SA-based battery still achieves a commendable discharge capacity of 1060 mAh g−1 upon activation in the subsequent cycles. Interestingly, the HE-SA cell undergoes a reactivation process and a rapidly increasing discharge capacity during the first few cycles. As the reaction proceeded, sulfur species were rearranged and redistributed uniformly, and the deeper buried sulfur species could be fully utilized [62]. After 1900 cycles, the cell with HE-SA catalysts still possesses a reversible capacity of 533 mAh g−1, with an ultralow capacity decay rate of 0.026 % per cycle (Fig. 4h). In addition, the capacity decay rate of the HE-SA sulfur electrode at 1 C is comparable to, or even exceeds, that of numerous advanced benchmark materials (Fig. 4i and Table S2) [20,42,63–66]. These results suggest that the Li-S cell with HE-SA-based catalysts exhibits high sulfur utilization and outstanding cyclic stability owing to maximized activity by the cocktail effect of multiple metal-N sites. In addition, we verify that HE-SA maintains electrochemically inert cell cycling in the Li-S voltage window (Fig. S25). Therefore, the HE-SA catalyst with similar atomic ratios has a higher configurational entropy, which is beneficial for achieving superior catalytic activity and stability for fast and durable LiPS conversion. Developing energy-dense Li-S batteries requires an electrode with high mass loading and low electrolyte/sulfur ratio (E/S). As depicted in Fig. 4(j), the HE-SA-based Li-S cell with a sulfur loading of 4.1 mg cm−2 and E/S ratio of 12.4 μL mg−1 shows an initial discharge capacity of 1130.6 mAh g−1 after activation in the first cycle. After 140 cycles, the high discharge capacity maintains stable at 773.0 mAh g−1 with only a 0.22 % decay rate per cycle. Furthermore, the corresponding GCD profiles manifest obviously defined plateaus, which coincide with the superior catalytic performance of HE-SA (Fig. 4k). Furthermore, the HE-SA-based electrode exhibits a reversible areal capacity of 4.2 mAh cm−2 when increasing the sulfur loading to 5.0 mg cm−2 and E/S ratio of 9.0 μL mg−1 (Fig. 4l). The two clear discharge plateaus are still maintained during diverse cycles (Fig. 4m). Even further decreasing the E/S ratio to 5.0 μL mg−1, a two-plateau voltage profile is still achievable, with an areal capacity of 5.2 mAh cm−2 (Fig. S26). Charging and discharging in LSBs is intricate electrochemical redox behaviors (Fig. 5 a). Because of the constraints of CV in evaluating battery kinetics, we examined this behavior in detail under real operation conditions by the in-situ electrochemical impedance spectroscopy (EIS) and the distribution of relaxation times (DRT) analysis. Initially, the dynamic variations of the intrinsic system resistance (R S), the electrolyte/electrode interfacial resistance (R SEI), and the charge transfer resistance (R ct) were also monitored during discharge and charge (Fig. 5b, c and Fig. S27). The HE-SA cell consistently keeps lower R S, R SEI, and R ct than LE-SA, confirming that the former possesses the superior capability of promoting sulfur conversion kinetics. In order to further identify and correlate the principal time constants in impedance measurement to specific electrochemical processes, the impedance spectra were subsequently analyzed by a semi-quantitative DRT approach. As reported by Miller’s group [67], the charging-discharging process of the Li-S battery can be classified into the following eight regions according to DRT analysis, each representing a polarization resistance. Specifically, peaks P1–P3 involve the inter-particle resistance (P1), the double-layer relaxation (P2), and the solid-electrolyte interphase (P3). Peaks P4–P6 are attributed to the conversion of LiPSs at the cathode interface, suggesting the multi-electron charge transfer behavior. Peaks P7 and P8 are associated with Warburg impedance originating from diffusion processes, containing polysulfide diffusion (P7) and bulk ion diffusion (P8), respectively. During the discharge and charge processes, the DRT counter plots of the cells using either HE-SA or LE-SA catalysts show multiple peaks, suggesting specific electrochemical processes across different interfaces. As depicted in Fig. 5(d, e), during the discharge and charge processes, the intensity of the P8 peak first decreases and then increases, demonstrating that the sulfur species undergo solid-liquid-solid transformation reactions. In addition, the P1 peak is almost independent of the various discharge and charge states, which can be ascribed to the total Ohmic resistance (Fig. 5f and Fig. S28a). During the discharge and charge processes, the P2 and P3 combine into a broad peak. The peak intensity firstly increases and then decreases, suggesting that the Li+ resistance at the lithium metal anode progressively increases during the initial solid electrolyte interphase (SEI) generation and begins to diminish as the SEI is stabilized. The P4–P6 peaks in the HE-SA cells exhibit lower intensities than that in the LE-SA cell (Fig. 5g and Fig. S28b), suggesting that HE-SA can effectively accelerate charge transfer and reduce polarization and indicating more rapid kinetics of Li-S conversion. In order to further investigate the conversion process of short-chain LiPS, the fitting DRT curves at discharge to 2.0 and 1.7 V and charge to 2.3 V are shown in Fig. 5(h–j). During the discharge at 2.0 V, the DRT curves of Li-S cells with different catalysts both show P8-dominated peaks. The HE-SA catalyst has a lower peak intensity than the LE-SA catalyst, indicating that the HE-SA catalyst may enhance the complete reduction of the LiPSs into Li2S2 and Li2S. The high-intensity peak in the LE-SA catalyst suggests the incomplete reduction of the short-chain LiPSs, leading to poor S utilization and capacity (Fig. 5h). At a fully discharged state of 1.7 V, the HE-SA catalyst has a higher P8 peak and a lower P6 peak than the LE-SA catalyst, indicating more effective Li2S precipitation induced by virtue of fast charge transfer ability in HE-SA (Fig. 5i) [68]. During the charging process at 2.3 V, the HE-SA and LE-SA catalysts exhibit similar relaxation processes including dominated P6, P7, and P8 peaks. In comparison with the LE-SA catalyst, the HE-SA catalyst exhibits smaller intensity peaks, which can be ascribed to the enhanced conversion rate of polysulfides and improved dissolution efficiency of solid discharge products (Fig. 5j). 3 Conclusions In summary, to address the sluggish kinetics of the SRR and SER processes, we construct multi-active HE-SA catalysts. DFT calculations demonstrate that the high-spin regulation of Fe and Mn active sites in HE-SA as well as the combination of d-p and s-p orbital hybridization with polysulfides can synergistically improve the kinetics of the sulfur redox reaction, leading to an efficient and bidirectional catalytic activity of HE-SA. The HE-SA achieves efficient bidirectional conversion kinetics of sulfur, which is further confirmed by a series of catalysis measurements as well as in-situ EIS and corresponding DRT technologies. Consequently, the Li-S batteries with the HE-SA catalyst illustrate high-rate capability (740 mAh g−1 at 3 C), outstanding cycling stability (0.026 %), and high areal capacity (4.2 mAh cm−2). This study provides a deeper understanding of the synergistic mechanisms of the spin regulation and orbital hybridization of HE-SA with LiPS, enabling the rational design of HE-SA toward boosted Li-S electrocatalysis and beyond. Experimental section Experimental details can be found in the Supporting Information. CRediT authorship contribution statement Weihao Gong: Writing – review & editing, Writing – original draft, Validation, Investigation, Data curation, Conceptualization. Guangfu Dai: Writing – review & editing, Writing – original draft, Data curation, Conceptualization. Hongjiao Liu: Validation, Supervision, Data curation. Haobo Sun: Writing – original draft, Data curation. Zeyi Wu: Writing – original draft. Xinpeng Zhao: Writing – original draft. Haoting Miao: Writing – original draft. Ying Jiang: Writing – review & editing, Software. Zhengqing Ye: Writing – review & editing, Supervision, Software, Resources, Project administration, Methodology, Investigation, Funding acquisition, Conceptualization. Declaration of competing interest The authors declare that they have no known competing financial interests or personal relationships that could have appeared to influence the work reported in this paper. Acknowledgments This work was supported by the National Natural Science Foundation of China (52302240), the Macao Young Scholars Program (AM2023011), and the Yuanguang Scholars Program, Hebei University of Technology (282022554). Appendix A Supplementary material Supplementary data to this article can be found online at https://doi.org/10.1016/j.jechem.2025.06.017. Appendix A Supplementary material The following are the Supplementary data to this article: Supplementary Data 1 References [1] A. Manthiram Y. Fu S.-H. Chung C. Zu Y.-S. Su Chem. Rev. 114 2014 11751 11787 A. Manthiram, Y. Fu, S.-H. Chung, C. Zu, Y.-S. Su, Chem. Rev. 114 (2014) 11751–11787. [2] H. Yang Y. Xu Y. Zhao C. Geng H. Ge L. Wang W. Lv C. Yang W. Chen Q.-H. Yang Adv. Funct. Mater. 2025 10.1002/adfm.202426089 H. Yang, Y. Xu, Y. Zhao, C. Geng, H. Ge, L. Wang, W. Lv, C. Yang, W. Chen, Q.-H. Yang, Adv. Funct. Mater. (2025). https://doi.org/10.1002/adfm.202426089. [3] B. Song L. Su X. Liu W. Gao T. Wang Y. Ma Y. Zhong X.-B. Cheng Z. Zhu J. He Y. Wu Electron 1 2023 e13 B. Song, L. Su, X. Liu, W. Gao, T. Wang, Y. Ma, Y. Zhong, X.-B. Cheng, Z. Zhu, J. He, Y. Wu, Electron. 1 (2023) e13. [4] R. Liu Z. Wei L. Peng L. Zhang A. Zohar R. Schoeppner P. Wang C. Wan D. Zhu H. Liu Z. Wang S.H. Tolbert B. Dunn Y. Huang P. Sautet X. Duan Nat 626 2024 98 104 R. Liu, Z. Wei, L. Peng, L. Zhang, A. Zohar, R. Schoeppner, P. Wang, C. Wan, D. Zhu, H. Liu, Z. Wang, S. H. Tolbert, B. Dunn, Y. Huang, P. Sautet, X. Duan, Nat. 626 (2024) 98–104. [5] X. Zhang X. Bai C. Wei B. Xi S. Xiong J. Feng Adv. Funct. Mater. 34 2024 2410583 X. Zhang, X. Bai, C. Wei, B. Xi, S. Xiong, J. Feng, Adv. Funct. Mater. 34 (2024) 2410583. [6] Y. Zhang C. Kang W. Zhao Y. Song J. Zhu H. Huo Y. Ma C. Du P. Zuo S. Lou G. Yin J. Am. Chem. Soc. 145 2023 1728 1739 Y. Zhang, C. Kang, W. Zhao, Y. Song, J. Zhu, H. Huo, Y. Ma, C. Du, P. Zuo, S. Lou, G. Yin, J. Am. Chem. Soc. 145 (2023) 1728–1739. [7] C.-X. Bi N. Yao X.-Y. Li Q.-K. Zhang X. Chen X.-Q. Zhang B.-Q. Li J.-Q. Huang Adv. Mater. 36 2024 2411197 C.-X. Bi, N. Yao, X.-Y. Li, Q.-K. Zhang, X. Chen, X.-Q. Zhang, B.-Q. Li, J.-Q. Huang, Adv. Mater. 36 (2024) 2411197. [8] W. Hua H. Li C. Pei J. Xia Y. Sun C. Zhang W. Lv Y. Tao Y. Jiao B. Zhang S.-Z. Qiao Y. Wan Q.-H. Yang Adv. Mater. 33 2021 2101006 W. Hua, H. Li, C. Pei, J. Xia, Y. Sun, C. Zhang, W. Lv, Y. Tao, Y. Jiao, B. Zhang, S.-Z. Qiao, Y. Wan, Q.-H. Yang, Adv. Mater. 33 (2021) 2101006. [9] Z. Shen P. Song W. Xie L. Tannesia K. Tang Y. Sun S. Xi Z.J. Xu Adv. Mater. 37 2025 2418090 Z. Shen, P. Song, W. Xie, L. Tannesia, K. Tang, Y. Sun, S. Xi, Z. J. Xu, Adv. Mater. 37 (2025) 2418090. [10] Y. Xiao-Fei S. Dao-Yu X. Juan C. Jianyu Microstructures 4 2024 2024030 Y. Xiao-Fei, S. Dao-Yu, X. Juan, C. Jianyu, Microstructures 4 (2024) 2024030. [11] X.-Y. Li M. Zhao Y.-W. Song C.-X. Bi Z. Li Z.-X. Chen X.-Q. Zhang B.-Q. Li J.-Q. Huang Chem. Soc. Rev. 54 2025 4822 4873 X.-Y. Li, M. Zhao, Y.-W. Song, C.-X. Bi, Z. Li, Z.-X. Chen, X.-Q. Zhang, B.-Q. Li, J.-Q. Huang, Chem. Soc. Rev. 54 (2025) 4822-4873. [12] Y.-W. Song L. Shen X.-Y. Li C.-X. Zhao J. Zhou B.-Q. Li J.-Q. Huang Q. Zhang Nat. Chem. Eng. 1 2024 588 596 Y.-W. Song, L. Shen, X.-Y. Li, C.-X. Zhao, J. Zhou, B.-Q. Li, J.-Q. Huang, Q. Zhang, Nat. Chem. Eng. 1 (2024) 588-596. [13] G. Cao X. Li M. Li X. Yang R. Duan M. Li Q. Jiang J. Li J. Wang M. Bai H. Yang Y. Xi W. Li H. Qian Y. Luo J. Zhang Adv. Funct. Mater. 2025 10.1002/adfm.202504228 G. Cao, X. Li, M. Li, X. Yang, R. Duan, M. Li, Q. Jiang, J. Li, J. Wang, M. Bai, H. Yang, Y. Xi, W. Li, H. Qian, Y. Luo, J. Zhang, Adv. Funct. Mater. (2025). https://doi.org/10.1002/adfm.202504228. [14] Z. Ye H. Sun H. Gao L. Sun J. Guo Y. Jiang C. Wu S. Zheng Energy Storage Mater. 60 2023 102855 Z. Ye, H. Sun, H. Gao, L. Sun, J. Guo, Y. Jiang, C. Wu, S. Zheng, Energy Storage Mater. 60 (2023) 102855. [15] L. He Z. Luo P. Liu X. Zhu W. Fan Q. Yu X. Liu H. Li EcoEnergy 3 2025 192 201 L. He, Z. Luo, P. Liu, X. Zhu, W. Fan, Q. Yu, X. Liu, H. Li, EcoEnergy. 3 (2025) 192–201. [16] G. Li J. Zhang Z. Wu H. Li Y. Song S. Zhang Mater. Today 2025 10.1016/j.mattod.2025.02.007 G. Li, J. Zhang, Z. Wu, H. Li, Y. Song, S. Zhang, Mater. Today. (2025). https://doi.org/10.1016/j.mattod.2025.02.007. [17] J.-J. Zhao Z.-X. Chen Q. Cheng M. Zhao X. Ma X.-Q. Zhang J.-Q. Huang B.-Q. Li J. Mater. Chem. A 12 2024 1852 21845 121842 J.-J. Zhao, Z.-X. Chen, Q. Cheng, M. Zhao, X. Ma, X.-Q. Zhang, J.-Q. Huang, B.-Q. Li, J. Mater. Chem. A. 12 (2024) 21845-21852. [18] X.-Y. Li S. Feng M. Zhao C.-X. Zhao X. Chen B.-Q. Li J.-Q. Huang Q. Zhang Angew. Chem. Int. Ed. 61 2022 e202114671 X.-Y. Li, S. Feng, M. Zhao, C.-X. Zhao, X. Chen, B.-Q. Li, J.-Q. Huang, Q. Zhang, Angew. Chem. Int. Ed. 61 (2022) e202114671. [19] G. Dai S. Li M. Shi L. Sun Y. Jiang K.N. Hui Z. Ye Adv. Funct. Mater. 34 2024 2315563 G. Dai, S. Li, M. Shi, L. Sun, Y. Jiang, K. N. Hui, Z. Ye, Adv. Funct. Mater. 34 (2024) 2315563. [20] H. Zhuang T. Zhang H. Xiao F. Zhang P. Han H. Gu J. Jiao W. Chen Q. Gao Appl. Catal. B. 340 2024 123273 H. Zhuang, T. Zhang, H. Xiao, F. Zhang, P. Han, H. Gu, J. Jiao, W. Chen, Q. Gao, Appl. Catal. B 340 (2024) 123273. [21] G. Cai G. Zhang Y. Li L. Wang S. Xie J. Zhang Y.-R. Lu T.-S. Chan X. Kong X. Wu S. Jin J. Lu H. Ji Adv. Funct. Mater. 2025 10.1002/adfm.202501600 G. Cai, G. Zhang, Y. Li, L. Wang, S. Xie, J. Zhang, Y.-R. Lu, T.-S. Chan, X. Kong, X. Wu, S. Jin, J. Lu, H. Ji, Adv. Funct. Mater. (2025). https://doi.org/10.1002/adfm.202501600. [22] C. Li J. Yu D. Yang H. Li Y. Cheng Y. Ren X. Bi J. Ma R. Zhao Y. Zhou J. Wang C. Huang J. Li I. Pinto-Huguet J. Arbiol H. Zhang S. Xin A. Cabot J. Am. Chem. Soc. 147 2025 8250 8259 C. Li, J. Yu, D. Yang, H. Li, Y. Cheng, Y. Ren, X. Bi, J. Ma, R. Zhao, Y. Zhou, J. Wang, C. Huang, J. Li, I. Pinto-Huguet, J. Arbiol, H. Zhang, S. Xin, A. Cabot, J. Am. Chem. Soc. 147 (2025) 8250–8259. [23] H. Wang H. Yuan W. Wang L. Shen J. Sun X. Liu J. Yang X. Wang T. Wang N. Wen Y. Gao K. Song D. Chen S. Wang Y.-W. Zhang J. Wang ACS Nano 18 2024 33405 33417 H. Wang, H. Yuan, W. Wang, L. Shen, J. Sun, X. Liu, J. Yang, X. Wang, T. Wang, N. Wen, Y. Gao, K. Song, D. Chen, S. Wang, Y.-W. Zhang, J. Wang, ACS Nano 18 (2024) 33405–33417. [24] Y. Wang C. Xu B. Li M. Tian M. Liu D. Zhu S. Dou Q. Zhang J. Sun ACS Nano 18 2024 34858 34869 Y. Wang, C. Xu, B. Li, M. Tian, M. Liu, D. Zhu, S. Dou, Q. Zhang, J. Sun, ACS Nano 18 (2024) 34858–34869. [25] D. Liu P. Guo H. Pan R. Wu Prog. Mater Sci. 145 2024 101300 D. Liu, P. Guo, H. Pan, R. Wu, Prog. Mater Sci. 145 (2024) 101300. [26] M. Lian W. Gong S. Guo Y. Jiang Z. Ye Energy Storage Mater. 75 2025 104054 M. Lian, W. Gong, S. Guo, Y. Jiang, Z. Ye, Energy Storage Mater. 75 (2025) 104054. [27] M. Xu Q. Zhu Y. Li Y. Gao N. Sun B. Xu Energ. Environ. Sci. 17 2024 7735 7748 M. Xu, Q. Zhu, Y. Li, Y. Gao, N. Sun, B. Xu, Energy Environ. Sci. 17 (2024) 7735–7748. [28] F. Han L. Zhang Q. Jin X. Ma Z. Zhang Z. Sun X. Zhang L. Wu ACS Nano 19 2025 9182 9195 F. Han, L. Zhang, Q. Jin, X. Ma, Z. Zhang, Z. Sun, X. Zhang, L. Wu, ACS Nano 19 (2025) 9182–9195. [29] H. Wang Y. Shi M. Li Y. Ye Y. Zhang T. Rong Z. Wang J. Zhang H. Chen Y. Tao Q. Zhao J. Gu F. Ye L. Mai Z. Du S. Yang Adv. Mater. 2025 10.1002/adma.202500321 H. Wang, Y. Shi, M. Li, Y. Ye, Y. Zhang, T. Rong, Z. Wang, J. Zhang, H. Chen, Y. Tao, Q. Zhao, J. Gu, F. Ye, L. Mai, Z. Du, S. Yang, Adv. Mater. (2025). https://doi.org/10.1002/adma.202500321. [30] M.J. Theibault C.R. McCormick S. Lang R.E. Schaak H.D. Abruña ACS Nano 17 2023 18402 18410 M. J. Theibault, C. R. McCormick, S. Lang, R. E. Schaak, H. D. Abruña, ACS Nano 17 (2023) 18402–18410. [31] N. Shen T. Li B. Li Y. Wang H. Liu C. Guo X. Chen J. Li Nanoscale 16 2024 7634 7644 N. Shen, T. Li, B. Li, Y. Wang, H. Liu, C. Guo, X. Chen, J. Li, Nanoscale. 16 (2024) 7634-7644. [32] X. Lei Q. Tang Y. Zheng P. Kidkhunthod X. Zhou B. Ji Y. Tang Nat. Sustain. 6 2023 816 826 X. Lei, Q. Tang, Y. Zheng, P. Kidkhunthod, X. Zhou, B. Ji, Y. Tang, Nat. Sustain. 6 (2023) 816–826. [33] Y. Zhang T. Yu R. Xiao P. Tang R. Fang Z. Li H.-M. Cheng Z. Sun F. Li Adv. Mater. 37 2025 2413653 Y. Zhang, T. Yu, R. Xiao, P. Tang, R. Fang, Z. Li, H.-M. Cheng, Z. Sun, F. Li, Adv. Mater. 37 (2025) 2413653. [34] M. Tamtaji M.G. Kim J. Wang P.R. Galligan H. Zhu F.-F. Hung Z. Xu Y. Zhu Z. Luo W.A. Goddard G. Chen Adv. Sci. 11 2024 2309883 M. Tamtaji, M. G. Kim, J. Wang, P. R. Galligan, H. Zhu, F.-F. Hung, Z. Xu, Y. Zhu, Z. Luo, W. A. Goddard, G. Chen, Adv. Sci. 11 (2024) 2309883. [35] Z.-J. Chen T. Zhang J. Wu X. Yang Y. Zheng Y. Tang H.-B. Yu J. Peng H.-M. Cheng Sci. China Mater. 67 2024 598 607 Z.-J. Chen, T. Zhang, J. Wu, X. Yang, Y. Zheng, Y. Tang, H.-B. Yu, J. Peng, H.-M. Cheng, Sci. China Mater. 67 (2024) 598–607. [36] W. Yan J. Chen T. Wang A. Mateen L. Tang S. Sun C. Jin J. Li H. Li J. Chen G. Gao G. Wu H. Seok Kang Z. Bao Chem. Eng. J. 497 2024 154482 W. Yan, J. Chen, T. Wang, A. Mateen, L. Tang, S. Sun, C. Jin, J. Li, H. Li, J. Chen, G. Gao, G. Wu, H. Seok Kang, Z. Bao, Chem. Eng. J. 497 (2024) 154482. [37] Q. Lv Y. Sun B. Li C. Li Q. Zhang L. Wang Adv. Energy Mater. 15 2025 2403223 Q. Lv, Y. Sun, B. Li, C. Li, Q. Zhang, L. Wang, Adv. Energy Mater. 15 (2025) 2403223. [38] W. Chen Y. Yu Y. Du Y. Wang Y. Zhao K. Guo P. Yuan J.-N. Zhang G. Qu Adv. Mater. 36 2024 2409369 W. Chen, Y. Yu, Y. Du, Y. Wang, Y. Zhao, K. Guo, P. Yuan, J.-N. Zhang, G. Qu, Adv. Mater. 36 (2024) 2409369. [39] G. Wu T. Liu Z. Lao Y. Cheng T. Wang J. Mao H. Zhang E. Liu C. Shi G. Zhou C. He W. Hu N. Zhao N. Wu B. Chen Angew. Chem. Int. Ed. 64 2025 e202422208 G. Wu, T. Liu, Z. Lao, Y. Cheng, T. Wang, J. Mao, H. Zhang, E. Liu, C. Shi, G. Zhou, C. He, W. Hu, N. Zhao, N. Wu, B. Chen, Angew. Chem. Int. Ed. 64 (2025) e202422208. [40] T. Zhang D. Luo H. Xiao X. Liang F. Zhang H. Zhuang M. Li L. Zheng Q. Gao Small 19 2023 2302249 T. Zhang, D. Luo, H. Xiao, X. Liang, F. Zhang, H. Zhuang, M. Li, L. Zheng, Q. Gao, Small 19 (2023) 2302249. [41] R. Yan Z. Zhao M. Cheng Z. Yang C. Cheng X. Liu B. Yin S. Li Angew. Chem. Int. Ed. 62 2023 e202215414 R. Yan, Z. Zhao, M. Cheng, Z. Yang, C. Cheng, X. Liu, B. Yin, S. Li, Angew. Chem. Int. Ed. 62 (2023) e202215414. [42] Q. Wu K. Chen Z. Shadike C. Li ACS Nano 18 2024 13468 13483 Q. Wu, K. Chen, Z. Shadike, C. Li, ACS Nano 18 (2024) 13468–13483. [43] R. Wang J. Qin F. Pei Z. Li P. Xiao Y. Huang L. Yuan D. Wang Adv. Funct. Mater. 33 2023 2305991 R. Wang, J. Qin, F. Pei, Z. Li, P. Xiao, Y. Huang, L. Yuan, D. Wang, Adv. Funct. Mater. 33 (2023) 2305991. [44] S. Zhai A.M. Abraham B. Chen Z. Fan J. Hu Z. Cai V. Thangadurai Carbon 195 2022 253 262 S. Zhai, A. M. Abraham, B. Chen, Z. Fan, J. Hu, Z. Cai, V. Thangadurai, Carbon 195 (2022) 253–262. [45] J. Wang Y. Song C. Chen X. Zhao W. Fan ACS Catal. 13 2023 15794 15810 J. Wang, Y. Song, C. Chen, X. Zhao, W. Fan, ACS Catal. 13 (2023) 15794–15810. [46] Z. Han S. Zhao J. Xiao X. Zhong J. Sheng W. Lv Q. Zhang G. Zhou H.-M. Cheng Adv. Mater. 33 2021 2105947 Z. Han, S. Zhao, J. Xiao, X. Zhong, J. Sheng, W. Lv, Q. Zhang, G. Zhou, H.-M. Cheng, Adv. Mater. 33 (2021) 2105947. [47] J. Häcker D.H. Nguyen T. Rommel Z. Zhao-Karger N. Wagner K.A. Friedrich ACS Energy Lett. 7 2022 1 9 J. Häcker, D. H. Nguyen, T. Rommel, Z. Zhao-Karger, N. Wagner, K. A. Friedrich, ACS Energy Lett. 7 (2022) 1–9. [48] W. Jiang T. Zhang R. Mao Z. Song S. Liu C. Song X. Jian F. Hu eScience 4 2024 100203 W. Jiang, T. Zhang, R. Mao, Z. Song, S. Liu, C. Song, X. Jian, F. Hu, eScience 4 (2024) 100203. [49] K. Chen Y. Zhu Z. Huang B. Han Q. Xu X. Fang J. Xu ACS Nano 18 2024 34791 34802 K. Chen, Y. Zhu, Z. Huang, B. Han, Q. Xu, X. Fang, J. Xu, ACS Nano 18 (2024) 34791–34802. [50] B. Li H. Wang Y. Shen Z. Zhang Y. Xiong M. Wang W. Li W. Zhou J. He ACS Nano 19 2025 12021 12032 B. Li, H. Wang, Y. Shen, Z. Zhang, Y. Xiong, M. Wang, W. Li, W. Zhou, J. He, ACS Nano 19 (2025) 12021–12032. [51] J. Li G. Li R. Wang Q. He W. Liu C. Hu H. Zhang J. Hui F. Huo ACS Nano 18 2024 17774 17785 J. Li, G. Li, R. Wang, Q. He, W. Liu, C. Hu, H. Zhang, J. Hui, F. Huo, ACS Nano 18 (2024) 17774–17785. [52] B. Wang L. Wang M. Mamoor C. Wang Y. Zhai F. Wang Z. Jing G. Qu Y. Kong L. Xu Angew. Chem. Int. Ed. 63 2024 e202406065 B. Wang, L. Wang, M. Mamoor, C. Wang, Y. Zhai, F. Wang, Z. Jing, G. Qu, Y. Kong, L. Xu, Angew. Chem. Int. Ed. 63 (2024) e202406065. [53] S. Li L. Li Y. Zhao H. Yang H. Tong S. Fan Z. Wang W. Xu Energy Storage Mater. 70 2024 103477 S. Li, L. Li, Y. Zhao, H. Yang, H. Tong, S. Fan, Z. Wang, W. Xu, Energy Storage Mater. 70 (2024) 103477. [54] S. Zhang Y. Zhang L. Ma C. Ma C. Zhang Y. Chen L. Chen L. Zhou W. Wei Small 19 2023 2300293 S. Zhang, Y. Zhang, L. Ma, C. Ma, C. Zhang, Y. Chen, L. Chen, L. Zhou, W. Wei, Small 19 (2023) 2300293. [55] C. Dong C. Ma C. Zhou Y. Yu J. Wang K. Yu C. Shen J. Gu K. Yan A. Zheng M. Gong X. Xu L. Mai Adv. Mater. 36 2024 2407070 C. Dong, C. Ma, C. Zhou, Y. Yu, J. Wang, K. Yu, C. Shen, J. Gu, K. Yan, A. Zheng, M. Gong, X. Xu, L. Mai, Adv. Mater. 36 (2024) 2407070. [56] C. Zhao F. Huo Y. Yang J. Ruan F. Chai H. Xu Y. Liu L. Zhang A. Cabot Z. Sun Y. Zhang Adv. Funct. Mater. 34 2024 2402175 C. Zhao, F. Huo, Y. Yang, J. Ruan, F. Chai, H. Xu, Y. Liu, L. Zhang, A. Cabot, Z. Sun, Y. Zhang, Adv. Funct. Mater. 34 (2024) 2402175. [57] M. Lu T. Yan Y. Ding S. Chen Z. Chen J. Gu X. Chen L. Zhang M. Tian J. Sun Energy Storage Mater. 70 2024 103458 M. Lu, T. Yan, Y. Ding, S. Chen, Z. Chen, J. Gu, X. Chen, L. Zhang, M. Tian, J. Sun, Energy Storage Mater. 70 (2024) 103458. [58] Q. Yang J. Cai G. Li R. Gao Z. Han J. Han D. Liu L. Song Z. Shi D. Wang G. Wang W. Zheng G. Zhou Y. Song Nat. Commun. 15 2024 3231 Q. Yang, J. Cai, G. Li, R. Gao, Z. Han, J. Han, D. Liu, L. Song, Z. Shi, D. Wang, G. Wang, W. Zheng, G. Zhou, Y. Song, Nat. Commun. 15 (2024) 3231. [59] T. Zhang D. Luo H. Xiao X. Liang F. Zhang H. Zhuang M. Xu W. Dai S. Qi L. Zheng Q. Gao Small 20 2024 2306806 T. Zhang, D. Luo, H. Xiao, X. Liang, F. Zhang, H. Zhuang, M. Xu, W. Dai, S. Qi, L. Zheng, Q. Gao, Small 20 (2024) 2306806. [60] Y. Ding T. Yan J. Wu M. Tian M. Lu C. Xu J. Gu H. Zhao Y. Wang X. Pan S.X. Dou L. Zhang J. Sun Appl. Catal. B. 343 2024 123553 Y. Ding, T. Yan, J. Wu, M. Tian, M. Lu, C. Xu, J. Gu, H. Zhao, Y. Wang, X. Pan, S. X. Dou, L. Zhang, J. Sun, Appl. Catal. B 343 (2024) 123553. [61] R. Yan Z. Zhao R. Zhu M. Wu X. Liu M. Adeli B. Yin C. Cheng S. Li Angew. Chem. Int. Ed. 63 2024 e202404019 R. Yan, Z. Zhao, R. Zhu, M. Wu, X. Liu, M. Adeli, B. Yin, C. Cheng, S. Li, Angew. Chem. Int. Ed. 63 (2024) e202404019. [62] Y. Ye F. Wu Y. Liu T. Zhao J. Qian Y. Xing W. Li J. Huang L. Li Q. Huang X. Bai R. Chen Adv. Mater. 29 2017 1700598 Y. Ye, F. Wu, Y. Liu, T. Zhao, J. Qian, Y. Xing, W. Li, J. Huang, L. Li, Q. Huang, X. Bai, R. Chen, Adv. Mater. 29 (2017) 1700598. [63] G. Cai H. Lv G. Zhang D. Liu J. Zhang J. Zhu J. Xu X. Kong S. Jin X. Wu H. Ji J. Am. Chem. Soc. 146 2024 13055 13065 G. Cai, H. Lv, G. Zhang, D. Liu, J. Zhang, J. Zhu, J. Xu, X. Kong, S. Jin, X. Wu, H. Ji, J. Am. Chem. Soc. 146 (2024) 13055–13065. [64] H. Lin Z. Guo Q. Zhang Q. Yang M. Wang Y. Chen S. Shen X. Wei L. Song Y. Song H. Pan Small 20 2024 2404983 H. Lin, Z. Guo, Q. Zhang, Q. Yang, M. Wang, Y. Chen, S. Shen, X. Wei, L. Song, Y. Song, H. Pan, Small 20 (2024) 2404983. [65] R. Zhou Y. Ren W. Li M. Guo Y. Wang H. Chang X. Zhao W. Hu G. Zhou S. Gu Angew. Chem. Int. Ed. 63 2024 e202405417 R. Zhou, Y. Ren, W. Li, M. Guo, Y. Wang, H. Chang, X. Zhao, W. Hu, G. Zhou, S. Gu, Angew. Chem. Int. Ed. 63 (2024) e202405417. [66] D. Yang J. Wang C. Lou M. Li C. Zhang A. Ramon C. Li M. Tang G. Henkelman M. Xu J. Li J. Llorca J. Arbiol D. Mitlin G. Zhou A. Cabot ACS Energy Lett. 9 2024 2083 2091 D. Yang, J. Wang, C. Lou, M. Li, C. Zhang, A. Ramon, C. Li, M. Tang, G. Henkelman, M. Xu, J. Li, J. Llorca, J. Arbiol, D. Mitlin, G. Zhou, A. Cabot, ACS Energy Lett. 9 (2024) 2083–2091. [67] R. Soni J.B. Robinson P.R. Shearing D.J.L. Brett A.J.E. Rettie T.S. Miller Energy Storage Mater. 51 2022 97 107 R. Soni, J. B. Robinson, P. R. Shearing, D. J. L. Brett, A. J. E. Rettie, T. S. Miller, Energy Storage Mater. 51 (2022) 97–107. [68] L. Chen J. Lai X. Guan H. Zou J. Liu L. Peng J. Wang Y.-P. Cai Q. Zheng Angew. Chem. Int. Ed. 64 2025 e202423046 L. Chen, J. Lai, X. Guan, H. Zou, J. Liu, L. Peng, J. Wang, Y.-P. Cai, Q. Zheng, Angew. Chem. Int. Ed. 64 (2025) e202423046.",
      "scopus-id": "105009003171",
      "coredata": {
        "eid": "1-s2.0-S2095495625004929",
        "dc:description": "Lithium-sulfur (Li-S) batteries are considered a potential candidate for next-generation energy-dense and sustainable energy storage. However, the slow conversion and severe shuttle of polysulfides (LiPSs) result in rapid performance degradation over long-term cycling. Herein, we report a high-entropy single-atom (HE-SA) catalyst to regulate the multi-step conversion of LiPS to attain a high-performance Li-S battery. Both the density functional theory calculations and the experimental results prove that the Fe atomic site with high spin configurations strongly interacts with Li2S4 through d-p and s-p synergistic orbital hybridization which facilitates the reduction of LiPS. Moreover, S-dominant p-d hybridization between Li2S and a high-spin Mn site weakens the Li–S bond and facilitates the rapid sulfur evolution reaction. Consequently, the Li-S battery with a bifunctional HE-SA catalyst shows an ultralow capacity decay of 0.026 % per cycle over 1900 cycles at 1 C. This work proposes a high-entropy strategy for sculpting electronic structures to enable spin and orbital hybridization modulation in advanced catalysts toward long-cycling Li-S batteries.",
        "openArchiveArticle": "false",
        "prism:coverDate": "2025-10-31",
        "openaccessUserLicense": null,
        "prism:aggregationType": "Journal",
        "prism:url": "https://api.elsevier.com/content/article/pii/S2095495625004929",
        "dc:creator": [
          {
            "@_fa": "true",
            "$": "Gong, Weihao"
          },
          {
            "@_fa": "true",
            "$": "Dai, Guangfu"
          },
          {
            "@_fa": "true",
            "$": "Liu, Hongjiao"
          },
          {
            "@_fa": "true",
            "$": "Sun, Haobo"
          },
          {
            "@_fa": "true",
            "$": "Wu, Zeyi"
          },
          {
            "@_fa": "true",
            "$": "Zhao, Xinpeng"
          },
          {
            "@_fa": "true",
            "$": "Miao, Haoting"
          },
          {
            "@_fa": "true",
            "$": "Jiang, Ying"
          },
          {
            "@_fa": "true",
            "$": "Ye, Zhengqing"
          }
        ],
        "link": [
          {
            "@_fa": "true",
            "@rel": "self",
            "@href": "https://api.elsevier.com/content/article/pii/S2095495625004929"
          },
          {
            "@_fa": "true",
            "@rel": "scidir",
            "@href": "https://www.sciencedirect.com/science/article/pii/S2095495625004929"
          }
        ],
        "dc:format": "application/json",
        "openaccessType": null,
        "pii": "S2095-4956(25)00492-9",
        "prism:volume": "109",
        "prism:publisher": "Science Press and Dalian Institute of Chemical Physics, Chinese Academy of Sciences. Published by Elsevier B.V. and Science Press. All rights are reserved, including those for text and data mining, AI training, and similar technologies.",
        "dc:title": "Spin and orbital manipulation of multiple atomic sites by high-entropy effect for catalyzing cascade sulfur conversion",
        "prism:copyright": "© 2025 Science Press and Dalian Institute of Chemical Physics, Chinese Academy of Sciences. Published by Elsevier B.V. and Science Press. All rights are reserved, including those for text and data mining, AI training, and similar technologies.",
        "openaccess": "0",
        "prism:issn": "20954956",
        "dcterms:subject": [
          {
            "@_fa": "true",
            "$": "Electronic spin state"
          },
          {
            "@_fa": "true",
            "$": "Orbital hybridization"
          },
          {
            "@_fa": "true",
            "$": "High-entropy effect"
          },
          {
            "@_fa": "true",
            "$": "Multi-atomic catalysts"
          },
          {
            "@_fa": "true",
            "$": "Sulfur conversion reaction"
          },
          {
            "@_fa": "true",
            "$": "Li-S battery"
          }
        ],
        "openaccessArticle": "false",
        "prism:publicationName": "Journal of Energy Chemistry",
        "openaccessSponsorType": null,
        "prism:pageRange": "671-680",
        "prism:endingPage": "680",
        "pubType": "fla",
        "prism:coverDisplayDate": "October 2025",
        "prism:doi": "10.1016/j.jechem.2025.06.017",
        "prism:startingPage": "671",
        "dc:identifier": "doi:10.1016/j.jechem.2025.06.017",
        "openaccessSponsorName": null
      },
      "objects": {
        "object": [
          {
            "@category": "standard",
            "@height": "200",
            "@width": "397",
            "@_fa": "true",
            "$": "https://api.elsevier.com/content/object/eid/1-s2.0-S2095495625004929-ga1.jpg?httpAccept=%2A%2F%2A",
            "@multimediatype": "JPEG image file",
            "@type": "IMAGE-DOWNSAMPLED",
            "@size": "24011",
            "@ref": "ga1",
            "@mimetype": "image/jpeg"
          },
          {
            "@category": "standard",
            "@height": "784",
            "@width": "774",
            "@_fa": "true",
            "$": "https://api.elsevier.com/content/object/eid/1-s2.0-S2095495625004929-gr1.jpg?httpAccept=%2A%2F%2A",
            "@multimediatype": "JPEG image file",
            "@type": "IMAGE-DOWNSAMPLED",
            "@size": "173826",
            "@ref": "gr1",
            "@mimetype": "image/jpeg"
          },
          {
            "@category": "standard",
            "@height": "624",
            "@width": "734",
            "@_fa": "true",
            "$": "https://api.elsevier.com/content/object/eid/1-s2.0-S2095495625004929-gr2.jpg?httpAccept=%2A%2F%2A",
            "@multimediatype": "JPEG image file",
            "@type": "IMAGE-DOWNSAMPLED",
            "@size": "131020",
            "@ref": "gr2",
            "@mimetype": "image/jpeg"
          },
          {
            "@category": "standard",
            "@height": "701",
            "@width": "787",
            "@_fa": "true",
            "$": "https://api.elsevier.com/content/object/eid/1-s2.0-S2095495625004929-gr3.jpg?httpAccept=%2A%2F%2A",
            "@multimediatype": "JPEG image file",
            "@type": "IMAGE-DOWNSAMPLED",
            "@size": "122202",
            "@ref": "gr3",
            "@mimetype": "image/jpeg"
          },
          {
            "@category": "standard",
            "@height": "543",
            "@width": "707",
            "@_fa": "true",
            "$": "https://api.elsevier.com/content/object/eid/1-s2.0-S2095495625004929-gr4.jpg?httpAccept=%2A%2F%2A",
            "@multimediatype": "JPEG image file",
            "@type": "IMAGE-DOWNSAMPLED",
            "@size": "129441",
            "@ref": "gr4",
            "@mimetype": "image/jpeg"
          },
          {
            "@category": "standard",
            "@height": "583",
            "@width": "685",
            "@_fa": "true",
            "$": "https://api.elsevier.com/content/object/eid/1-s2.0-S2095495625004929-gr5.jpg?httpAccept=%2A%2F%2A",
            "@multimediatype": "JPEG image file",
            "@type": "IMAGE-DOWNSAMPLED",
            "@size": "101903",
            "@ref": "gr5",
            "@mimetype": "image/jpeg"
          },
          {
            "@category": "thumbnail",
            "@height": "110",
            "@width": "219",
            "@_fa": "true",
            "$": "https://api.elsevier.com/content/object/eid/1-s2.0-S2095495625004929-ga1.sml?httpAccept=%2A%2F%2A",
            "@multimediatype": "GIF image file",
            "@type": "IMAGE-THUMBNAIL",
            "@size": "14683",
            "@ref": "ga1",
            "@mimetype": "image/gif"
          },
          {
            "@category": "thumbnail",
            "@height": "164",
            "@width": "162",
            "@_fa": "true",
            "$": "https://api.elsevier.com/content/object/eid/1-s2.0-S2095495625004929-gr1.sml?httpAccept=%2A%2F%2A",
            "@multimediatype": "GIF image file",
            "@type": "IMAGE-THUMBNAIL",
            "@size": "13476",
            "@ref": "gr1",
            "@mimetype": "image/gif"
          },
          {
            "@category": "thumbnail",
            "@height": "164",
            "@width": "193",
            "@_fa": "true",
            "$": "https://api.elsevier.com/content/object/eid/1-s2.0-S2095495625004929-gr2.sml?httpAccept=%2A%2F%2A",
            "@multimediatype": "GIF image file",
            "@type": "IMAGE-THUMBNAIL",
            "@size": "13379",
            "@ref": "gr2",
            "@mimetype": "image/gif"
          },
          {
            "@category": "thumbnail",
            "@height": "164",
            "@width": "184",
            "@_fa": "true",
            "$": "https://api.elsevier.com/content/object/eid/1-s2.0-S2095495625004929-gr3.sml?httpAccept=%2A%2F%2A",
            "@multimediatype": "GIF image file",
            "@type": "IMAGE-THUMBNAIL",
            "@size": "11151",
            "@ref": "gr3",
            "@mimetype": "image/gif"
          },
          {
            "@category": "thumbnail",
            "@height": "164",
            "@width": "214",
            "@_fa": "true",
            "$": "https://api.elsevier.com/content/object/eid/1-s2.0-S2095495625004929-gr4.sml?httpAccept=%2A%2F%2A",
            "@multimediatype": "GIF image file",
            "@type": "IMAGE-THUMBNAIL",
            "@size": "14468",
            "@ref": "gr4",
            "@mimetype": "image/gif"
          },
          {
            "@category": "thumbnail",
            "@height": "164",
            "@width": "193",
            "@_fa": "true",
            "$": "https://api.elsevier.com/content/object/eid/1-s2.0-S2095495625004929-gr5.sml?httpAccept=%2A%2F%2A",
            "@multimediatype": "GIF image file",
            "@type": "IMAGE-THUMBNAIL",
            "@size": "12522",
            "@ref": "gr5",
            "@mimetype": "image/gif"
          },
          {
            "@category": "high",
            "@height": "886",
            "@width": "1758",
            "@_fa": "true",
            "$": "https://api.elsevier.com/content/object/eid/1-s2.0-S2095495625004929-ga1_lrg.jpg?httpAccept=%2A%2F%2A",
            "@multimediatype": "JPEG image file",
            "@type": "IMAGE-HIGH-RES",
            "@size": "132618",
            "@ref": "ga1",
            "@mimetype": "image/jpeg"
          },
          {
            "@category": "high",
            "@height": "3469",
            "@width": "3425",
            "@_fa": "true",
            "$": "https://api.elsevier.com/content/object/eid/1-s2.0-S2095495625004929-gr1_lrg.jpg?httpAccept=%2A%2F%2A",
            "@multimediatype": "JPEG image file",
            "@type": "IMAGE-HIGH-RES",
            "@size": "1201144",
            "@ref": "gr1",
            "@mimetype": "image/jpeg"
          },
          {
            "@category": "high",
            "@height": "2761",
            "@width": "3248",
            "@_fa": "true",
            "$": "https://api.elsevier.com/content/object/eid/1-s2.0-S2095495625004929-gr2_lrg.jpg?httpAccept=%2A%2F%2A",
            "@multimediatype": "JPEG image file",
            "@type": "IMAGE-HIGH-RES",
            "@size": "892837",
            "@ref": "gr2",
            "@mimetype": "image/jpeg"
          },
          {
            "@category": "high",
            "@height": "3102",
            "@width": "3484",
            "@_fa": "true",
            "$": "https://api.elsevier.com/content/object/eid/1-s2.0-S2095495625004929-gr3_lrg.jpg?httpAccept=%2A%2F%2A",
            "@multimediatype": "JPEG image file",
            "@type": "IMAGE-HIGH-RES",
            "@size": "699482",
            "@ref": "gr3",
            "@mimetype": "image/jpeg"
          },
          {
            "@category": "high",
            "@height": "2402",
            "@width": "3130",
            "@_fa": "true",
            "$": "https://api.elsevier.com/content/object/eid/1-s2.0-S2095495625004929-gr4_lrg.jpg?httpAccept=%2A%2F%2A",
            "@multimediatype": "JPEG image file",
            "@type": "IMAGE-HIGH-RES",
            "@size": "948318",
            "@ref": "gr4",
            "@mimetype": "image/jpeg"
          },
          {
            "@category": "high",
            "@height": "2579",
            "@width": "3031",
            "@_fa": "true",
            "$": "https://api.elsevier.com/content/object/eid/1-s2.0-S2095495625004929-gr5_lrg.jpg?httpAccept=%2A%2F%2A",
            "@multimediatype": "JPEG image file",
            "@type": "IMAGE-HIGH-RES",
            "@size": "651113",
            "@ref": "gr5",
            "@mimetype": "image/jpeg"
          },
          {
            "@category": "standard",
            "@_fa": "true",
            "$": "https://api.elsevier.com/content/object/eid/1-s2.0-S2095495625004929-mmc1.docx?httpAccept=%2A%2F%2A",
            "@multimediatype": "Microsoft Word file",
            "@type": "APPLICATION",
            "@size": "6526327",
            "@ref": "mmc1",
            "@mimetype": "application/word"
          },
          {
            "@category": "thumbnail",
            "@_fa": "true",
            "$": "https://api.elsevier.com/content/object/eid/1-s2.0-S2095495625004929-si1.svg?httpAccept=%2A%2F%2A",
            "@multimediatype": "Scalable Vector Graphics file",
            "@type": "ALTIMG",
            "@size": "9710",
            "@ref": "si1",
            "@mimetype": "image/svg+xml"
          }
        ]
      },
      "link": {
        "@rel": "abstract",
        "@href": "https://api.elsevier.com/content/abstract/scopus_id/105009003171"
      }
    }
  }
}