{
  "metadata": {
    "title": "Facilitating sulfur species capture and bi-directional redox in Li-S batteries with single-atomic Co-O<ce:inf loc=post>2</ce:inf>N<ce:inf loc=post>2</ce:inf> coordination structure",
    "authors": "; ; ",
    "journal": "Journal of Energy Chemistry",
    "date": "2024-12-31",
    "doi": "10.1016/j.jechem.2024.08.003",
    "abstract": "",
    "uri": "https://api.elsevier.com/content/article/pii/S2095495624005515",
    "pii": "S2095495624005515"
  },
  "fulltext": {
    "full-text-retrieval-response": {
      "scopus-eid": "2-s2.0-85202586746",
      "originalText": "serial JL 286353 291210 291711 291744 291809 31 Journal of Energy Chemistry JOURNALENERGYCHEMISTRY 2024-08-12 2024-08-12 2024-08-31 2024-08-31 2024-11-20T09:09:50 1-s2.0-S2095495624005515 S2095-4956(24)00551-5 S2095495624005515 10.1016/j.jechem.2024.08.003 S300 S300.1 FULL-TEXT 1-s2.0-S2095495624X00091 2024-11-20T09:18:53.241168Z 0 0 20241201 20241231 2024 2024-08-12T21:24:24.993787Z absattachment articleinfo articletitlenorm authfirstinitialnorm authfirstsurnamenorm cid cids contenttype copyright crossmark dateloaded dateloadedtxt datesearch datesort dateupdated dco docsubtype doctype doi eid ewtransactionid hubeid indexeddate issn issnnorm itemstage itemtransactionid itemweight openaccess openarchive pg pgfirst pglast pii piinorm pubdateend pubdatestart pubdatetxt pubyr sortorder srctitle srctitlenorm srctype ssids alllist content subj subheadings suppl tomb volfirst volissue volumelist webpdf webpdfpagecount yearnav figure e-component body acknowledge affil appendices articletitle auth authfirstini authfull authkeywords authlast footnotes grantnumber grantsponsor grantsponsorid primabst ref specialabst 2095-4956 20954956 false 99 99 C Volume 99 50 604 614 604 614 202412 December 2024 2024-12-01 2024-12-31 2024 article fla © 2024 Science Press and Dalian Institute of Chemical Physics, Chinese Academy of Sciences. Published by ELSEVIER B.V. and Science Press. All rights are reserved, including those for text and data mining, AI training, and similar technologies. FACILITATINGSULFURSPECIESCAPTUREBIDIRECTIONALREDOXINLISBATTERIESSINGLEATOMICCOO2N2COORDINATIONSTRUCTURE ZHANG Y 1 Introduction 2 Results and discussion 3 Conclusions Experimental section CRediT authorship contribution statement Acknowledgments Appendix A Supplementary material References HOU 2022 300 305 L SONG 2024 e202400343 Y ZHENG 2023 e202308726 Q LU 2024 e202318859 H SHI 2023 2306933 H ZHAO 2023 625 657 F JIANG 2023 2304965 Y WANG 2022 2200424 R LI 2022 14638 14646 X JIN 2024 2017 2029 M LI 2022 513 532 J LI 2024 14754 14764 X WANG 2023 e202306901 X LI 2023 108813 X RAZAQ 2024 2302897 R CHEN 2023 e202311693 P ZHANG 2023 2306578 D REN 2024 5307 5318 T LIANG 2022 2200102 Z PAN 2020 78 110 Y HUANG 2022 2203902 T YANG 2024 103240 D GREENBURG 2023 5967 5974 L ZHANG 2021 9691 9698 S ZHU 2023 203 210 J ZHOU 2024 e12703 R HAN 2021 2105947 Z SUN 2023 2306049 T LU 2024 103458 M WANG 2023 e306 Z LIU 2021 50826 Y DONG 2023 2301505 C GU 2023 2204014 H GUO 2024 1330 1367 Y ZHANG 2023 102885 H LI 2024 8863 8875 Y ZHOU 2024 2402114 W GUO 2023 18253 18265 Y ZHAO 2024 2302586 C LIU 2024 98 104 R YANG 2019 1901220 X ZHOU 2022 486 499 Z ZHANG 2024 103320 Y SONG 2023 141907 B ZHOU 2024 150719 J DU 2019 3977 3985 Z WU 2023 24651 24660 C ZHANGX2024X604 ZHANGX2024X604X614 ZHANGX2024X604XY ZHANGX2024X604X614XY 2026-08-31T00:00:00.000Z 2026-08-31T00:00:00.000Z http://creativecommons.org/licenses/by-nc-nd/4.0/ © 2024 Science Press and Dalian Institute of Chemical Physics, Chinese Academy of Sciences. Published by ELSEVIER B.V. and Science Press. All rights are reserved, including those for text and data mining, AI training, and similar technologies. 2024-09-10T16:35:18.612Z http://vtw.elsevier.com/data/voc/AddOnTypes/50.7/aggregated-refined NSFC 22208174 52272221 2021GXRC068 NSFC National Natural Science Foundation of China http://data.elsevier.com/vocabulary/SciValFunders/501100001809 http://sws.geonames.org/1814991/ Shandong Academy of Sciences 2023PY002 SDAS Shandong Academy of Sciences http://data.elsevier.com/vocabulary/SciValFunders/501100008118 http://sws.geonames.org/1814991/ Basic Research Projects of Science, Education, and Industry Integration Pilot Engineering of Qilu University of Technology Natural Science Foundation of Shandong Province ZR2022MB143 Natural Science Foundation of Shandong Province http://data.elsevier.com/vocabulary/SciValFunders/501100007129 http://sws.geonames.org/1814991/ Universities Youth Innovation Team Development Plan of Shandong Province 2023KJ140 This work was supported financially by the National Natural Science Foundation of China (NSFC) (Grant No. 22208174 and 52272221), the New Colleges and Universities Twenty Foundational Projects of Jinan City (2021GXRC068), the Universities Youth Innovation Team Development Plan of Shandong Province (2023KJ140), the Natural Science Foundation of Shandong Province (ZR2022MB143), the Basic Research Projects of Science, Education, and Industry Integration Pilot Engineering of Qilu University of Technology (Shandong Academy of Sciences) (2023PY002). item S2095-4956(24)00551-5 S2095495624005515 1-s2.0-S2095495624005515 10.1016/j.jechem.2024.08.003 286353 2024-11-20T09:18:53.241168Z 2024-12-01 2024-12-31 1-s2.0-S2095495624005515-main.pdf https://s3-eu-west-1.amazonaws.com/prod-ucs-content-store-eu-west/content/pii:S2095495624005515/MAIN/application/pdf/9a44d0bc2fe835023efe3201427c1fd3/main.pdf main.pdf pdf true 5449226 MAIN 11 1-s2.0-S2095495624005515-main_1.png https://s3-eu-west-1.amazonaws.com/prod-ucs-content-store-eu-west/content/pii:S2095495624005515/PREVIEW/image/png/71e760e0600a4d8eef82ebe270c6836d/main_1.png main_1.png png 62132 849 656 IMAGE-WEB-PDF 1 1-s2.0-S2095495624005515-ga1.jpg https://s3-eu-west-1.amazonaws.com/prod-ucs-content-store-eu-west/content/pii:S2095495624005515/ga1/THUMBNAIL/image/jpeg/aed7d1db3d47aaf5a0e0d0d3b0f15715/ga1.jpg ga1 true ga1.jpg jpg 24119 200 250 IMAGE-DOWNSAMPLED 1-s2.0-S2095495624005515-gr1.jpg https://s3-eu-west-1.amazonaws.com/prod-ucs-content-store-eu-west/content/pii:S2095495624005515/gr1/DOWNSAMPLED/image/jpeg/3adae3e64b05e866a6a7c0d1b57e57c1/gr1.jpg gr1 gr1.jpg jpg 41963 320 535 IMAGE-DOWNSAMPLED 1-s2.0-S2095495624005515-gr2.jpg https://s3-eu-west-1.amazonaws.com/prod-ucs-content-store-eu-west/content/pii:S2095495624005515/gr2/DOWNSAMPLED/image/jpeg/26cf8cf3f4ddfc9b46ea0410fe71b0c0/gr2.jpg gr2 gr2.jpg jpg 243329 618 799 IMAGE-DOWNSAMPLED 1-s2.0-S2095495624005515-gr3.jpg https://s3-eu-west-1.amazonaws.com/prod-ucs-content-store-eu-west/content/pii:S2095495624005515/gr3/HIGHRES/image/jpeg/853573262fb23c24a775bf1cbdf74a38/gr3.jpg gr3 gr3.jpg jpg 208371 742 734 IMAGE-DOWNSAMPLED 1-s2.0-S2095495624005515-gr4.jpg https://s3-eu-west-1.amazonaws.com/prod-ucs-content-store-eu-west/content/pii:S2095495624005515/gr4/DOWNSAMPLED/image/jpeg/cfe25bee09b32dfc23dece37c048efe5/gr4.jpg gr4 gr4.jpg jpg 121616 432 734 IMAGE-DOWNSAMPLED 1-s2.0-S2095495624005515-gr5.jpg https://s3-eu-west-1.amazonaws.com/prod-ucs-content-store-eu-west/content/pii:S2095495624005515/gr5/DOWNSAMPLED/image/jpeg/f1b1e82b2d819c589eae31220bdf4b23/gr5.jpg gr5 gr5.jpg jpg 168221 619 734 IMAGE-DOWNSAMPLED 1-s2.0-S2095495624005515-gr6.jpg https://s3-eu-west-1.amazonaws.com/prod-ucs-content-store-eu-west/content/pii:S2095495624005515/gr6/DOWNSAMPLED/image/jpeg/62c039e74b473fe3497622156125e76b/gr6.jpg gr6 gr6.jpg jpg 117869 415 734 IMAGE-DOWNSAMPLED 1-s2.0-S2095495624005515-gr7.jpg https://s3-eu-west-1.amazonaws.com/prod-ucs-content-store-eu-west/content/pii:S2095495624005515/gr7/DOWNSAMPLED/image/jpeg/0e5bfb41dc78c62211ce416cdbcb4542/gr7.jpg gr7 gr7.jpg jpg 157277 803 645 IMAGE-DOWNSAMPLED 1-s2.0-S2095495624005515-ga1.sml https://s3-eu-west-1.amazonaws.com/prod-ucs-content-store-eu-west/content/pii:S2095495624005515/ga1/THUMBNAIL/image/gif/4dfffc70ae1a97dc96b4ff76d26fe704/ga1.sml ga1 true ga1.sml sml 16079 164 205 IMAGE-THUMBNAIL 1-s2.0-S2095495624005515-gr1.sml https://s3-eu-west-1.amazonaws.com/prod-ucs-content-store-eu-west/content/pii:S2095495624005515/gr1/DOWNSAMPLED/image/gif/f361895f421a4586f94317aeed494423/gr1.sml gr1 gr1.sml sml 10643 131 219 IMAGE-THUMBNAIL 1-s2.0-S2095495624005515-gr2.sml https://s3-eu-west-1.amazonaws.com/prod-ucs-content-store-eu-west/content/pii:S2095495624005515/gr2/THUMBNAIL/image/gif/b519ea9a0c7f6789c2820e73fb7f2617/gr2.sml gr2 gr2.sml sml 28342 164 212 IMAGE-THUMBNAIL 1-s2.0-S2095495624005515-gr3.sml https://s3-eu-west-1.amazonaws.com/prod-ucs-content-store-eu-west/content/pii:S2095495624005515/gr3/DOWNSAMPLED/image/gif/4ff32280f3a200869cf58ff56f1d27fe/gr3.sml gr3 gr3.sml sml 14944 164 162 IMAGE-THUMBNAIL 1-s2.0-S2095495624005515-gr4.sml https://s3-eu-west-1.amazonaws.com/prod-ucs-content-store-eu-west/content/pii:S2095495624005515/gr4/THUMBNAIL/image/gif/30f96f4a3129a3584f0dc03007eb6382/gr4.sml gr4 gr4.sml sml 12874 129 219 IMAGE-THUMBNAIL 1-s2.0-S2095495624005515-gr5.sml https://s3-eu-west-1.amazonaws.com/prod-ucs-content-store-eu-west/content/pii:S2095495624005515/gr5/DOWNSAMPLED/image/gif/dbb941e97abaf355b3950f81a2f93f6e/gr5.sml gr5 gr5.sml sml 14833 164 194 IMAGE-THUMBNAIL 1-s2.0-S2095495624005515-gr6.sml https://s3-eu-west-1.amazonaws.com/prod-ucs-content-store-eu-west/content/pii:S2095495624005515/gr6/THUMBNAIL/image/gif/19734117076f41c3191cf263a2fd9d8f/gr6.sml gr6 gr6.sml sml 12898 124 219 IMAGE-THUMBNAIL 1-s2.0-S2095495624005515-gr7.sml https://s3-eu-west-1.amazonaws.com/prod-ucs-content-store-eu-west/content/pii:S2095495624005515/gr7/THUMBNAIL/image/gif/e7343b2a1fb76dd16edf5d9409551f1a/gr7.sml gr7 gr7.sml sml 9032 163 131 IMAGE-THUMBNAIL 1-s2.0-S2095495624005515-ga1_lrg.jpg https://s3-eu-west-1.amazonaws.com/prod-ucs-content-store-eu-west/content/pii:S2095495624005515/HIGHRES/image/jpeg/aa24d3802bb5bc341b03f5f0b1bea122/ga1_lrg.jpg ga1 true ga1_lrg.jpg jpg 134427 886 1107 IMAGE-HIGH-RES 1-s2.0-S2095495624005515-gr1_lrg.jpg https://s3-eu-west-1.amazonaws.com/prod-ucs-content-store-eu-west/content/pii:S2095495624005515/THUMBNAIL/image/jpeg/b279e6c43339b4e89bd0e343a25a3de2/gr1_lrg.jpg gr1 gr1_lrg.jpg jpg 233082 1416 2368 IMAGE-HIGH-RES 1-s2.0-S2095495624005515-gr2_lrg.jpg https://s3-eu-west-1.amazonaws.com/prod-ucs-content-store-eu-west/content/pii:S2095495624005515/HIGHRES/image/jpeg/18515ac14af867cc99cd1a37507c02dd/gr2_lrg.jpg gr2 gr2_lrg.jpg jpg 878967 1640 2122 IMAGE-HIGH-RES 1-s2.0-S2095495624005515-gr3_lrg.jpg https://s3-eu-west-1.amazonaws.com/prod-ucs-content-store-eu-west/content/pii:S2095495624005515/HIGHRES/image/jpeg/36263ed752a5e5313c1499474703e071/gr3_lrg.jpg gr3 gr3_lrg.jpg jpg 1385857 3284 3248 IMAGE-HIGH-RES 1-s2.0-S2095495624005515-gr4_lrg.jpg https://s3-eu-west-1.amazonaws.com/prod-ucs-content-store-eu-west/content/pii:S2095495624005515/HIGHRES/image/jpeg/d35b1e5ef9adb4de6fc3d53b61158fa9/gr4_lrg.jpg gr4 gr4_lrg.jpg jpg 744674 1913 3248 IMAGE-HIGH-RES 1-s2.0-S2095495624005515-gr5_lrg.jpg https://s3-eu-west-1.amazonaws.com/prod-ucs-content-store-eu-west/content/pii:S2095495624005515/HIGHRES/image/jpeg/7b36149495d1efc042ad08f8f3a64f22/gr5_lrg.jpg gr5 gr5_lrg.jpg jpg 1066305 2738 3248 IMAGE-HIGH-RES 1-s2.0-S2095495624005515-gr6_lrg.jpg https://s3-eu-west-1.amazonaws.com/prod-ucs-content-store-eu-west/content/pii:S2095495624005515/HIGHRES/image/jpeg/2707caca027ce9f3081f8c7844dfadcd/gr6_lrg.jpg gr6 gr6_lrg.jpg jpg 705567 1837 3248 IMAGE-HIGH-RES 1-s2.0-S2095495624005515-gr7_lrg.jpg https://s3-eu-west-1.amazonaws.com/prod-ucs-content-store-eu-west/content/pii:S2095495624005515/HIGHRES/image/jpeg/6fce754e7a75ce65a159bdfa2e6130f9/gr7_lrg.jpg gr7 gr7_lrg.jpg jpg 1021470 3554 2854 IMAGE-HIGH-RES 1-s2.0-S2095495624005515-mmc1.docx https://s3-eu-west-1.amazonaws.com/prod-ucs-content-store-eu-west/content/pii:S2095495624005515/mmc1/MAIN/application/vnd.openxmlformats-officedocument.wordprocessingml.document/575053e0ee192df07c7a0187ede553ae/mmc1.docx mmc1 mmc1.docx docx 20383906 APPLICATION 1-s2.0-S2095495624005515-am.pdf https://s3-eu-west-1.amazonaws.com/prod-ucs-content-store-eu-west/content/egi:10GSTQ34GX3/MAIN/application/pdf/828b0de84031a54f6b9c136a8398fead/am.pdf am am.pdf pdf false 8845863 AAM-PDF JECHEM 4045 S2095-4956(24)00551-5 10.1016/j.jechem.2024.08.003 Science Press Fig. 1 Illustration of the Co/NOC synthesis. Fig. 2 (a and b) Surface and (c) cross-section SEM views of Co/NOC. (d) TEM and (e) high-resolution TEM images of Co/NOC (inset: selected area electron diffraction pattern). (f) HAADF-STEM image of Co/NOC showing the presence of single Co atoms. (g–k) EDS mappings of the elements (C (red), N (navy blue), O (green), and Co (aubergine)) in the Co/NOC. Fig. 3 High-resolution XPS spectra for (a) Co 2p, (b) N 1s, and (c) O 1s of the Co/NOC. (d) Co K-edge XANES spectra, (e) first-order derivative curves, and (f) Co K-edge FT-EXAFS spectra of the Co/NOC and reference samples. (g) EXAFS spectra between the experimental result and the fit of Co/NOC at Co K-edge (the inset exhibits a simulated structure model of the Co/NOC, red for O atom, gray for N atom, and navy blue for Co atom). WT Co K-edge EXAFS profiles for (h) Co-foil, (i) Co3O4, (j) CoPc, and (k) Co/NOC. Fig. 4 (a) CV profiles of LSBs-α, LSBs-β, and LSBs-γ at 0.1 mV s−1. Corresponding Tafel plots for the (b) liquid-solid reduction reaction and (c) solid-liquid oxidation process. (d) CV profiles of symmetric batteries at 20 mV s−1. (e) Potentiostatic nucleation curves at 2.05 V and (f) potentiostatic dissolution curves at 2.35 V for Co/NOC-based cathodes. Fig. 5 (a) Cycling performances at 0.5 C, (b and c) first GCD curves at 0.1 C, and (d) rate performance of LSBs-α, LSBs-β, and LSBs-γ. (e) GCD profiles of LSBs-γ at different current-rates. (f and g) Cycling performance of LSBs-α, LSBs-β, and LSBs-γ (f) at 1 C for 500 cycles and (g) at 2 C for 1000 cycles. (h) OCV curves exhibiting self-discharge behavior. The S areal loading of LSBs-α, LSBs-β, and LSBs-γ is ∼2.0 mg cm−2. Fig. 6 (a) Adsorbability of NG, Co-N4-C, and Co/NOC for Li2S, Li2S4, and Li2S8. (b) Electron charge difference analysis of Co-N4 and Co-O2N2 moiety (The color code of the atoms is the same as that in Fig. S19. Cyan means electron depletion and yellow means electron accumulation). (c) Energy profiles for the reduction of S8, Li2S8, Li2S6, Li2S4, Li2S2, as well as Li2S on NG, Co-N4-C, and Co/NOC. Energy curves for the dissolution of Li2S on (d) NG, (e) Co-N4, and (f) Co-O2N2. Fig. 7 (a) Cycling stability of LSBs-γ with various S areal loadings of 5.6, 8.8, and 12.0 mg cm−2 at a current density of 0.2 C. Electrochemical properties of LSBs-γ with the S areal loading of 2.0 mg cm−2 while changing operating temperatures: (b) GCD profiles of LSBs-γ at 0.2 C, (c) cycling ability of LSBs-γ at 0.2 C, (d) cycle capacity of LSBs-γ at 1 C at −10 °C. Facilitating sulfur species capture and bi-directional redox in Li-S batteries with single-atomic Co-O2N2 coordination structure Yunqiang Zhang Writing – original draft Visualization Resources Funding acquisition Formal analysis a 1 Huaming Yuan Writing – review & editing Validation Investigation Data curation a 1 Enyan Guo Writing – original draft Validation Methodology Investigation Formal analysis a ⁎ Shunwei Chen Software Methodology Formal analysis a Manman Ren Methodology Formal analysis a Jingyun Ma Resources Investigation Funding acquisition Data curation a Jiaxi Cui Writing – review & editing Resources b Mei Li Writing – review & editing Resources Methodology Funding acquisition Formal analysis Conceptualization a ⁎ Laiying Jing Formal analysis Data curation a Li Li Writing – review & editing Validation Supervision Project administration c ⁎ a School of Materials Science and Engineering, Qilu University of Technology (Shandong Academy of Sciences), Jinan 250353, Shandong, China School of Materials Science and Engineering Qilu University of Technology (Shandong Academy of Sciences) Jinan Shandong 250353 China School of Materials Science and Engineering, Qilu University of Technology (Shandong Academy of Sciences), Jinan 250353, Shandong, China b Institute of Fundamental and Frontier Sciences, University of Electronic Science and Technology of China, Chengdu 610054, Sichuan, China Institute of Fundamental and Frontier Sciences University of Electronic Science and Technology of China Chengdu Sichuan 610054 China Institute of Fundamental and Frontier Sciences, University of Electronic Science and Technology of China, Chengdu 610054, Sichuan, China c School of Metallurgy, Northeastern University, Shenyang 110819, Liaoning, China School of Metallurgy Northeastern University Shenyang Liaoning 110819 China School of Metallurgy, Northeastern University, Shenyang 110819, Liaoning, China ⁎ Corresponding authors. 1 These authors contributed equally to this work. Graphical abstract Single atom Co with a novel Co-O2N2 coordination configuration is a multifunctional active center, which not only effectively enhances the chemisorption of LiPSs, but also significantly catalyzes the bidirectional LiPSs conversion, thereby inhibiting the shuttle effect. Lithium-sulfur (Li-S) batteries suffer from the shuttle effect of soluble lithium polysulfides (LiPSs) and slow redox kinetics, significantly limiting their practical application. Although single-atom catalysts (SACs) offer a promising strategy to address these challenges, designing materials with optimal adsorption force and high catalytic activity remains a grand challenge. Here, we present a cobalt (Co)-based SAC with unique Co-O2N2 coordination structures for Li-S batteries. Both experimental and theoretical studies demonstrate that O, N-coordinated Co single atoms anchored on a porous carbon framework (Co/NOC) effectively capture LiPSs and dramatically catalyze bidirectional polysulfide conversion. The expanded carbon layer spacing facilitates lithium ions diffusion and maximizes the exposure of active sites. As a result, Li-S batteries incorporating Co/NOC as separators exhibit outstanding rate performance (906.6 mAh g−1 at 3 C) and exceptional cycling stability, even at −10 °C. Furthermore, with a high sulfur loading of 12.0 mg cm−2, the areal specific capacity reaches up to 12.36 mAh cm−2. This work provides some useful insights for the design of high-performance SACs for Li-S batteries. Keywords Asymmetrically coordinated Co-O2N2 Zeolitic imidazolate framework-67 Melamine resin Carbon nanoflakes Shuttle effect 1 Introduction Among many battery energy storage technologies, lithium-sulfur (Li-S) batteries have received much attention because of their excellent gravimetric energy density (E g, ∼2600 Wh kg−1), low manufacturing costs, and environmental friendliness [1,2]. However, in addition to the low conductivity of sulfur (S) and discharge products (Li2S/Li2S2) and the apparent volume change of S electrode during the charge and discharge processes, the shuttle effect of high-order lithium polysulfides (LiPSs) between the two electrodes and the slow solid-liquid phase transformation kinetics of S species also hinder the actual use of Li-S batteries to a large extent [3]. Even worse, under harsh operating conditions such as high S loadings, lean electrolyte usage, and low temperatures, the above defects result in lower specific capacity (C s) and S utilization of Li-S batteries, as well as poorer coulombic efficiency, rate capability, and cycle life [4–6]. In this connection, it is very necessary to add effective adsorption-catalytic media to fix the lithium polysulfides and promote the transformation dynamics between multiphase S. At present, various metal-based catalysts, such as metal (e.g., Pt, Ni, and Co) nanoparticles [7,8], metal compounds [9–12], metal organic frameworks (MOFs) [13–15], and heterojunctions (e.g., FeCoO x S y , WO3− x -W3N4, and NbP-NbC) [16–18], have been designed to achieve rapid capture-transport-conversion of LiPSs, hoping to fundamentally solve the above problems of Li-S batteries. However, the active sites of these electrocatalysts cannot be completely exposed, and the electrocatalytic activity can only be enhanced through increasing the weight percentage of the catalysts, which is bound to sacrifice the total E g of the Li-S batteries [19]. Moreover, the surface structure of most catalysts is heterogeneous and complex, which makes it easy to produce different catalytic sites (such as faces/edges/corners), resulting in the difficulties in accurately identifying the active centers [20]. Hence, it is of great significance to design high-exposure exemplary catalysts with controllable active sites, which facilitate the disclosure of the structure-performance relationships and guide the synthesis of catalytic active materials tailored for Li-S batteries. Single-atom catalysts (SACs) have become a research hotspot in the field of catalysis in recent years because of their unique quantum size effect, sharply increased surface free energy, high catalytic activity, and 100% theoretical atom-utilization [21,22]. Crucially, SACs feature monatomically dispersed metal active centers anchored in the substrate, providing an ideal channel to better clarify the intrinsic link between the active centers and the catalytic mechanisms [23]. Considering the above premises, SACs have been extensively studied in the field of Li-S batteries. The active centers of the most explored SACs in Li-S batteries so far all have the same coordination atomic structure as M−N4 (M = Co, V, Cu, Fe, Mn, Ni, and Ti) [24–26]. Nevertheless, for SACs with a coordination configuration of M−N4, the d-p orbital hybridization when interacting with S is mainly based on the hybridization of metal dz 2 orbitals and sulfur pz orbitals or metal dxz / yz orbitals and sulfur px / y orbitals, while the metal dx 2 − y 2 and dxy orbitals do not participate in hybridization [27]. This leads to some limitations in the anchoring and catalytic conversion of LiPSs. Simultaneously, the metal site matching four nitrogen (N) atoms has a plane-symmetric structure, resulting in a uniform distribution of electrons, which is also difficult to achieve optimal LiPSs adsorption [28]. Hence, it is worth considering to design novel 3d-orbital electronic structures and local chemical environments of the central metal atoms by regulating the coordination N atoms number (M−N x , x = 2–6) or introducing heteroatoms (O, B, S, and P) with different electron spin densities and atomic radius to achieve enhanced polysulfide affinity and accelerated bidirectional transformation between LiPSs and Li2S2/Li2S. For example, Zhang et al. introduced a S atom to replace the N atom in Co-N4, causing electron redistribution and enhancing the d-p orbital hybridization between S species and SACs by regulating the 3d orbital energy level of Co [28]. Recently, Sun et al. also screened Co-N3B moiety with stronger LiPSs binding ability and lower reaction barrier from a series of Co-N3X (X = N, S, P, B, Se, or Te) structures [29]. For asymmetric coordination SACs, M−N2X2 (M as the center atom, X as the coordination atom) coordination structures are currently less studied than M−N3X coordination structures. Hence, the study of the function of SACs with M−N2X2 coordination structure has guiding significance for the design and fabrication of multifunctional materials to enhance the performance of Li-S batteries. It should be pointed out that in addition to the metal centers, coordination environments, and metal load content, the effect of the substrate materials on the electrochemical activity of SACs should not be underestimated. By optimizing the structure and composition of the substrate materials and naturally matching SACs, their potential can be fully realized to synergistically increase the catalytic reaction kinetics and enhance the suppression of shuttle effect. However, how to prepare these excellent materials in straightforward and economical steps and how to reveal in detail the mechanism by which they improve the electrochemical properties of Li-S batteries remain difficult challenges. In this paper, a novel kind of O, N co-coordinated Co SACs implanted in N, O-rich carbon framework (named as Co/NOC) is developed by a mild and scalable self-templating and self-reduction way and used as a multipurpose diaphragm modification material for Li-S batteries. The exact coordination configuration of Co atoms with N/O atoms (Co-O2N2) is verified via X-ray absorption fine structure (XAFS) analysis. The experimental and theoretical investigation shows that the unique Co-O2N2 coordination structure can not only improve the adsorption capacity of LiPSs by enhancing the polarity, but also significantly promote the bidirectional transformation kinetics of polysulfide as a reaction site. At the same time, the integration of N, O, and Co atoms in the Co/NOC framework improves the charge transfer performance and the number of highly polar active centers, and speeds up the kinetics of the bidirectional S redox reaction. In addition, the carbon framework containing N, O, and Co atoms possesses increased carbon layer spacing and higher specific surface area, which are conducive to the diffusion of lithium ions (Li+), exposure of SACs active site, and physical confinement of LiPSs. Consequently, the electrochemical performance of Li-S batteries based on Co/NOC modified separator has been greatly improved, which provides a satisfactory initial gravimetric C s (1581.7 mAh g−1, 0.1 C), distinguished rate performance (906.6 mAh g−1, 3 C), extraordinary cycling stability (74.47% retention after 500 cycles at 1 C), expected areal C s (up to 12.36 mAh cm−2), and exciting low-temperature durability (81.97% capacity retention at −10 °C). This study further confirms the enormous potential of Co-O2N2 SACs to propel the practical use of Li-S batteries with high energy storage. 2 Results and discussion Co/NOC was prepared through the route shown in Fig. 1 . Briefly, a mixture of zeolitic imidazolate framework-67 (ZIF-67) and cetyltrimethyl ammonium bromide (CTAB) was added into the oligomer solution of melamine and formaldehyde, and thoroughly mixed evenly. Then, the melamine resin spheres (named as MF-CTAB-Co, Fig. S1a, e, and i) were synthesized by polycondensation of melamine and formaldehyde oligomers with a precisely controlled amount of glacial acetic acid that used as the catalyst for accelerating polymerization of oligomers and the etching agent for decomposing ZIF-67 (Fig. S2). At this stage, the formed melamine resin can act as a chelating agent to combine with cobalt ions released by the decomposition of ZIF-67 to prevent high-density agglomeration. Interestingly, the use of ZIF-67 as a self-sacrificing template is conducive to more uniform growth of the melamine resin spheres, as evidenced by the lower proportion of small and medium-sized spheres in Fig. S1(a, b, e, and f) than in Fig. S1(c, d, g, and h). Finally, Co SACs anchored in an N and O co-doped carbon framework (Co/NOC, Fig. 2 a and b) with unique Co-O2N2 coordination structure were formed after annealing at 800 °C. For comparison, the N and O co-doped carbon framework (denoted as NOC, Fig. S3a and b) was synthesized without the addition of ZIF-67. Meanwhile, the N and O co-doped carbon framework containing the targeted synthesized Co SACs was also prepared under otherwise identical conditions without CTAB, denoted as Co/NOC-WC (Fig. S3c and d). It can be found that since the precursors are all based on melamine resin (Fig. S2), the Co/NOC, NOC, and Co/NOC-WC prepared by carbonization are similar in morphology to the melamine resin derived carbon (named as MC, Fig. S3e and f), showing an irregular carbon framework structure with a gully surface. Notably, the cross-sectional scanning electron microscopy (SEM) image in Fig. 2(c) displays that the interior of the Co/NOC consists of crumpled ultra-thin carbon nanoflakes similar to the morphology of graphene (GN), which is beneficial to the intensive electron transport during the electrochemical process. Furthermore, the high Brunauer-Emmett-Teller (BET) specific surface area (S BET = 180.35 m2 g−1) and abundant mesoporous structure (Fig. S4) facilitate the exposure of more electrocatalytically active surfaces and adsorption sites, offering efficient channels for electrolyte ions transport. The rich microporous structure of Co/NOC can alleviate the overflow of soluble LiPSs, and thus efficiently physically constrain LiPSs [30]. The transmission electron microscope (TEM) image (Fig. 2d) further confirms that Co/NOC contains corrugated carbon nanosheets. Clearly, no distinct Co-derived nanoparticles or clusters are observed in Co/NOC. Unlike ZIF-67 derived carbon (denoted as ZC), there are no obvious peaks corresponding to Co-related substances in the X-ray diffraction spectra (XRD, Fig. S5a) and Raman spectra (Fig. S5b) of Co/NOC, again confirming that Co atoms do not aggregate. The XRD patterns of Co/NOC-WC and MC show a wide diffraction peak centered at 2θ = 26°, which belongs to the (002) lattice plane of graphite, proving a carbonaceous turbocharged stacked structure [31]. Compared with Co/NOC-WC and MC, the significant shifts of (002) peak of Co/NOC and NOC toward smaller diffraction angle manifest their larger carbon layer spacing (∼0.4 nm), attributed to the decomposition of CTAB inserted into the melamine resin. Appropriately increased (002) interlayer distance facilitates Li+ diffusion and exposes more active sites toward accessible polysulfides, resulting in improved C s and rate performance. After the loading of Co single atoms, the I D/I G (the intensity ratio of the disorder-induced band (D-band) and the graphite band (G-band)) value of Raman spectra increases dramatically (Fig. S5b), indicating that the addition of Co single atoms can significantly change the electronic construction as well as internal disorder of melamine resin derived carbon framework, which is conducive to elevating its electronic conductivity. The high-resolution TEM image and selected area electron diffraction results (Fig. 2e) exhibit that Co/NOC is essentially amorphous, which is consistent with the results of Raman spectroscopy. To further clarify the configuration of Co/NOC at the atomic scale, a spherical aberration-corrected high-angle annular dark field scanning transmission electron microscopy (HAADF-STEM) test was performed. The HAADF-STEM result (Fig. 2f) reveals that numerous Co single atoms characterized by bright spots (about 2–3 Å; some of them are marked with orange circles) are evenly dispersed in the Co/NOC framework, and the distance between neighboring single atoms is much less than 1 nm. The content of Co in Co/NOC is ∼2.86 wt% by inductively coupled plasma-optical emission spectroscopy (ICP-OES). High-loading Co single atoms can adsorb LiPSs and accelerate its catalytic transformation as active sites, thus effectively inhibiting the shuttle effect. Furthermore, the energy-dispersive X-ray spectroscopy (EDS) elemental mapping (Fig. 2g–k) also shows that C, N, O, and Co atoms are uniformly distributed in the Co/NOC framework. The valence state of Co in Co/NOC was studied via X-ray photoelectron spectroscopy (XPS, Fig. 3 a). The high-resolution Co 2p spectrum of Co/NOC exhibits peaks located at 779.8/795.9 and 781.7/798.3 eV with a satellite peak of 787.2/802.3 eV, regarded as Co 2p 3/2 and Co 2p 1/2 orbitals of Co3+ and Co2+, respectively [29]. In the fitted spectra of N 1s (Fig. 3b) and O 1s (Fig. 3c), distinct peaks associated with Co–N and Co–O bonds are observed, respectively, verifying that the Co atom is coordinated with both N and O. Further, the local chemical states and coordination structures of Co atoms in Co/NOC were determined by XAFS measurements. In Fig. 3(d), the Co K-edge X-ray absorption near-edge structure (XANES) spectra show that the pre-edge curve of Co/NOC lies between those of Co foil and Co3O4, and is closer to that of Co3O4, illustrating that the single atom Co in Co/NOC has a positive charge [32]. The corresponding first-order derivative spectra of XANES (Fig. 3e) can further support the above results. Fig. 3(f) presents the Co K-edge Fourier transformed (FT) extended X-ray absorption fine structure (FT-EXAFS) spectra of Co/NOC, Co foil, Co3O4, and CoPc. The major peaks of Co3O4 and CoPc are located at near 1.47 Å, belonging to Co–O or Co–N coordination, and move to a relatively higher energy level (1.52 Å) in the Co/NOC, indicating a change in the Co coordination environment [28]. Besides, there is no obvious signal of Co–Co bond at 2.18 Å in Co/NOC compared to the spectrum of Co foil, which adequately indicates that the Co atoms are mostly monodisperse and coordinated with oxygen (nitrogen). As shown in Fig. 3(g) and Fig. S6, the EXAFS fitting curves of Co in Co/NOC and reference samples are in good agreement with the measured experimental data. Simulated EXAFS spectra (Fig. 3g) and fitted quantitative data (Table S1) not only prove the existence of Co–O and Co–N bonds, but also verify that the average coordination of individual Co atom in Co/NOC is double O atoms and double N atoms (namely Co-O2N2 configuration, inset in Fig. 3g). It is important to note that the EXAFS data analysis mainly exhibits statistics. Because of disorder or in-plane/edge defects, a certain amount of Co-O x N y with slightly different coordination structures will inevitably appear in Co/NOC, which will not be discussed further here. To intuitively distinguish the coordination state of the Co atoms, the wavelet transform (WT, Fig. 3h–k) was carried out at the same time, because this method possesses a high recognizability in both radial range and K-space. The WT contour chart of Co/NOC (Fig. 3k) exhibits a maximum intensity of around 3.5 Å−1, close to the first shell maximum intensity of Co3O4 (5.3 Å−1, Fig. 3i) and the maximum intensity of CoPc (4.4 Å−1, Fig. 3j), most likely owing to the backscattering between Co and O/N atoms. Moreover, the maximum WT value of the Co foil is about 7.1 Å−1, corresponding to the Co–Co bonding (Fig. 3h). Nevertheless, the Co–Co information cannot be seen in Co/NOC, suggesting the atomic dispersion of cobalt. The above synchrotron radiation results manifest that the as-prepared Co/NOC has single-atom Co center and Co-O2N2 coordination structure, which may offer a new opportunity to improve the interaction with polysulfides. On the whole, Co/NOC shows considerably practical value as an ideal membrane modifier with polar heteroatom (N and O) dopants and distinctive Co-O2N2 coordination structure, which is expected to heighten the trapping ability of lithium polysulfides and help accelerate the bidirectional S redox conversion. The Co/NOC, Co/NOC-WC, NOC, and MC were coated on a marketable polypropylene (PP) separator using blade cladding technology (the mass load of the modified coating is approximately 1.1 mg cm−2), denoted as Co/NOC@PP, Co/NOC-WC@PP, NOC@PP, and MC@PP, respectively. As seen from Table S2, the PP separator modified with the samples prepared by adding CTAB is more conducive to improving the C s and current discharge capacity of Li-S batteries, which may be caused by the expanded carbon layer spacing of the conductive framework which is beneficial to the transport of the Li+ and the exposure of the active site of adsorption/catalytic conversion. Then, we mainly took the Co/NOC and NOC prepared by CTAB as the research object for detailed characterization and analysis in the follow-up work. The SEM images of the upper surface and cross-section of the Co/NOC@PP are presented in Fig. S7(a and b), where Co/NOC is uniformly deposited on the PP membrane to build a tight protective layer with a thickness of ∼40 μm, which contribute to physically blocking the soluble polysulfide shuttle through plugging the macropores in the PP membrane. Fig. S7(c and d) is the camera photos of the Co/NOC@PP separator with the diameter of 1.6 cm undergoing folding. It is commendable that Co/NOC maintains good durability and high anchoring ability in highly folded cases and is able to resist the stress caused by bending without peeling, indicating an excellent compatibility between Co/NOC and PP. The upper surface and cross-sectional SEM photos of the NOC@PP separator are also presented in Fig. S8, displaying the surface morphology and thickness similar to that of the Co/NOC@PP separator. As displayed in Fig. S9, the fortes of the Co/NOC@PP diaphragm are first reflected in the ultra-fast electrolyte wetting speed, which can be fully wetted within 1.5 s. Since this, the rapid transport of Li+ and the efficient utilization of S can also be ensured under the condition of deficit electrolyte [33,34]. Furthermore, the transport capacity of Li+ through the separators was quantitatively evaluated by measuring the ionic conductivity (σ, Fig. S10) of the electrolyte soaked separators. The σ of Co/NOC@PP (2.87 mS cm−1) and NOC@PP (2.73 mS cm−1) separators is elevated a little compared with that of commercial PP separator (1.17 mS cm−1), manifesting that the hierarchical porous melamine resin-derived carbon rich in O and N heteroatoms accelerates the transmembrane migration of Li+ in some degree, which is beneficial to optimizing the reversible redox-reaction process of lithium polysulfides [35]. Successful preparation of polar heteroatom (N and O) dopants and monoatomic Co sites within the melamine resin-derived carbon urges further exploration on the interaction with polysulfide molecules. To directly testify the interaction between the modified separators and LiPSs, a visual penetration test was carried out using a H-model penetration device with the right side immitted with 50 mmol L−1 Li2S6 solution and the left side immitted with a mixture of dimethoxyethane (DME) and dioxolame (DOL) in equal volume ratio, which was isolated by employing PP, NOC@PP, and Co/NOC@PP separators, respectively (Fig. S11). The Co/NOC@PP separator shows an effective limitation on the diffusion of LiPSs, in which the solution in the left region maintains almost transparent even after 20 h. However, a noticeable yellow color appears in the NOC@PP penetration device and the solution on the left becomes much darker in the presence of original PP diaphragm. The powerful adsorption of LiPSs illustrates that there is a good interaction force between Co/NOC and LiPSs, which provides a favourable prerequisite for the adsorption-diffusion-transformation process of LiPSs. Meanwhile, the strong chemical interaction of Co/NOC on Li2S6 was verified by XPS measurements (Fig. S12). The S 2p XPS spectrum exhibits double coupled peaks at 162.7 and 163.7 eV, related to terminal S (ST −1) and bridging S (SB 0), respectively. Three peaks were also observed at 167.9 eV (thiosulfate), 169.7 eV (polythionate), and 170.9 eV (sulfate), indicating that Co/NOC has a good anchoring effect for Li2S6. Theoretically, the atomically controllable surface chemical structure and the outstanding ion transport rate can synergistically vest Co/NOC with a distinctive ability to regulate S conversion reactions. In order to prove this, the whole reaction process of Li-S batteries was first explored using cyclic voltammetry (CV) testing technique (Fig. 4 a). All CV curves display double reduction peaks (peak I R1, I R2) resulting from the conversion of S8 to soluble lithium polysulfides and then to insoluble Li2S2/Li2S. The two closely related oxidation peaks (peak I O2 and I O1) near 2.38 and 2.46 V refer to the oxidation of Li2S2/Li2S to LiPSs and S [36]. Notably, the Li-S batteries with Co/NOC@PP (LSBs-γ) possess the largest current density and the smallest polarization voltage at the redox peaks, demonstrating a faster S conversion kinetics, which profits by the weakened S–S bonds of LiPSs and Li–S bonds of Li2S, thanks to the bonding of Co/NOC with LiPSs and Li2S. The corresponding Tafel plots fitted from the CV curves are shown in Fig. 4(b and c). The reduction and oxidation Tafel slopes of LSBs-γ are lower than those of Li-S batteries using PP and NOC@PP (LSBs-α and LSBs-β), certifying the remarkable catalytic activity of Co/NOC in solid-liquid redox conversion. Additionally, the lithium-ions diffusion coefficient (D Li+) of Li-S batteries was determined depending on the Randles-Sevcik equation [37] employing CV results obtained at different scanning rates to identify the competence of separator modified materials to promote lithium-ions migration (Fig. S13). As expected, LSBs-γ (Fig. S13f) shows the significantly predominant D Li+ at peaks I R1, I R2, I O2, and I O1 (7.61 × 10−8, 1.52 × 10−7, 2.86 × 10−7, and 2.46 × 10−7 cm2 s−1), meaning that the addition of Co single atoms to NOC and the particular coordination environment favor the Li+ diffusion and battery redox dynamics. These outcomes indicate that Co/NOC can be used as a promising catalytic material for sulfur reduction and oxidation reactions to synchronously promote the liquid-liquid transformation of lithium polysulfides, deposition of Li2S, and subsequent reverse dissolution reactions. To uncover the electrochemical catalytic effect of the modifiers on the liquid-liquid transformation of polysulfide, the symmetrical batteries using the as-prepared compounds and Li2S6 electrolyte were assembled and assessed by the CV curves of 20 mV s−1 (Fig. 4d). Without Li2S6, the electric signal response of the battery with Co/NOC can be ignored, suggesting that the polarization phenomenon is mainly caused by the redox current of LiPSs. This is further demonstrated by a slight increase in polarization when the symmetrical battery is paired with blank stainless steel mesh electrodes and Li2S6 electrolyte. Obviously, the Co/NOC battery shows larger response currents than the NOC battery at specific polarization voltages, demonstrating that the novel Co-O2N2 coordination structure supported on NOC provides an accelerating channel for the electron transport between the electrode and LiPSs, and catalyzes the interfacial redox conversion of LiPSs. The well-matched electrochemical impedance spectra (EIS) of the symmetrical batteries also strongly validate this greatly increased charge transfer rate, as shown in Fig. S14. It can be observed that the charge transfer resistance (R ct, 11.1 Ω) of the Co/NOC battery is lower than that of the NOC battery (21.4 Ω), which suggests that the charge transport rate at the Co/NOC auxiliary electrode/polysulfide interface is much quicker than that at the NOC based interface, further demonstrating the fluent interfacial dynamics of liquid phase lithium polysulfides transformation. With the help of the as-prepared compounds, the potentiostatic nucleation/decomposition tests of Li2S were used to investigate why Co/NOC can improve the solid-liquid transformation kinetics of polysulfides. As illustrated in Fig. 4(e) and Fig. S15(a), the nucleation test of Li2S using the Co/NOC exhibits a more obvious and earlier discharge current response than that for NOC at a constant potential of 2.05 V. In addition, a more predominant Li2S nucleation C s (446.3 mAh g−1) for Co/NOC battery contrasted to NOC battery (172.5 mAh g−1) can be noted, indicating that Co/NOC enhances the LiPSs capture and Li2S precipitation kinetics, thereby promoting the liquid-solid reactions of Li-S batteries [38]. Similarly, a higher dissolution current response (187.8 mA g−1) on the Co/NOC catalyst during the dissolution of Li2S at a constant voltage of 2.35 V (Fig. 4f and Fig. S15b) confirms its catalytic effect on the denuclearization of Li2S [39]. These characterization results can verify the anterior CV test. Carefully optimized Co/NOC with rich Co-O2N2 structure can expedite the liquid-liquid transformation of polysulfides and the deposition/dissolution of Li2S quickly, so as to enhance the C s and rate performance of Li-S batteries. The electrochemical performance directly reflects the function of Co/NOC as a diaphragm modification material in Li-S batteries. The cycle performances at 0.5 C are presented in Fig. 5 (a). LSBs-γ delivers a high initial C s of 1398.1 mAh g−1 and retains 1162.0 mAh g−1 with a remarkable C s retention of 83.11% after 200 cycles. In sharp contrast, LSBs-α and LSBs-β possess discharge C s of 669.6 and 1071.3 mAh g−1 in the initial cycle, and their remaining C s is only 382.9 and 756.0 mAh g−1 after 200 cycles, respectively. The enhanced C s retention of LSBs-γ proves that the passivation and slow redox conversion dynamics of S species are greatly resolved by the novel Co-O2N2 structure in Co/NOC with good catalytic properties and strong LiPSs chemical interactions. It is worth mentioning that the catalytic performance of Co/NOC can also be analyzed from the details of the galvanostatic charge/discharge (GCD) curves of Li-S batteries. Fig. 5(b and c) exhibits the initial GCD profiles of the LSBs-α, LSBs-β, and LSBs-γ at 0.1 C. It can be seen that the first short discharge platform is concentrated at ∼2.3 V and a long platform is at the lower voltage of about 2.1 V, where the top platform corresponds to the reduction of S to the long-chain LiPSs (Li2S n , 4 ≤ n ≤ 8), which conforms to CV curves. The top platform discharge C s of LSBs-γ is about 418.1 mAh g−1, approaching 99.79% of the theoretical C s (419.0 mAh g−1), which is 99.2 and 49.9 mAh g−1 higher than LSBs-α and LSBs-β, respectively, indicating the better utilization rate of S and the polysulfide diffusion is highly limited by the Co/NOC dense coating [40]. Moreover, there is a distinct voltage “valley” between the first discharge platform and the second discharge platform, called the Li2S “nucleation point” (Fig. 5c). The nucleation dynamics of Li2S can be determined by the voltage difference between the “nucleation point” and the tangent line of the voltage platform [41]. LSBs-α displays a large overpotential of 22.6 mV, manifesting a high interfacial energy barrier for nucleation and deposition of Li2S. Correspondingly, the Li2S nucleation behavior of LSBs-β and LSBs-γ is greatly changed, showing an obviously decreased interfacial energy barrier (LSBs-β: 16.8 mV, LSBs-γ: 9.3 mV), which is also confirmed by the above Li2S nucleation measurements. As for the next discharge platform, the LSBs-α, LSBs-β, and LSBs-γ offer 456.4, 842.0, and 1163.6 mAh g−1, respectively. The higher C s collected for LSBs-γ at the second discharge platform indicates a higher conversion rate from long-chain polysulfide to insoluble Li2S2/Li2S. So that, the Co/NOC-modified Li-S batteries show a large increase in initial discharge capacity (1581.7 mAh g−1, 0.1 C) and a smaller voltage hysteresis (ΔE γ = 178 mV), illustrating that the Co/NOC coating layer can effectively capture polysulfide and enhance the dynamics of redox processes. Furthermore, the initial potential of the charge profiles can be used to explain the oxidation of Li2S, where the smaller initial charging voltage for the LSBs-γ (1.91 V) demonstrates that more abundant Li2S is derived on the positive side compared with the LSBs-α (2.15 V) and LSBs-β (1.95 V). This phenomenon reflects that atomic Co has exceptional catalytic activity for the nucleation and deposition of Li2S. To explore the resistance of cells with different separators, the EIS measurements were carried out. As shown in Fig. S16, LSBs-γ displays the lowest charge transfer resistance (R ct, 38.3 Ω), suggesting the best conductivity and the fastest electrochemical kinetics (104.9 and 73.1 Ω for LSBs-α and LSBs-β, respectively). The Li-S batteries with multi-step charge/discharge processes involve various intermediate products, and the R ct values of different solid-liquid-solid transformation steps can accurately respond to the variations of dynamic characteristics [42]. The ex-situ EIS results of Li-S batteries are recorded in Fig. S17. It can be observed that the R ct of all batteries decreases significantly with the discharge process proceeding, which may be related to the battery activation behavior and the reduction of S species with low conductivity. During the subsequent charge process, the R ct first decreases and then rises because of the dissolution of insulating Li2S and the final rebirth of S. It is noteworthy that the R ct of LSBs-γ is always the lowest throughout the GCD cycle, which verifies the optimal electron and ionic conductivity and good solid-liquid-solid transformation dynamics with the help of Co-O2N2 structure. The rate performance of three Li-S batteries at different current rates from 0.1 to 3 C was studied (Fig. 5d). The discharge C s of LSBs-γ is 1530.1, 1250.2, 1100.5, 1005.5, and 906.6 mAh g−1 at 0.1, 0.5, 1, 2, and 3 C, respectively, which are significantly higher than those of LSBs-α and LSBs-β. When it returns to 0.2 C, the C s of the LSBs-γ can rise to 1410.2 mAh g−1, still higher than that of LSBs-α (630.1 mAh g−1) and LSBs-β (1030.3 mAh g−1), demonstrating the high reversibility of the batteries. The GCD curves of the three Li-S batteries under different current densities are also given (Fig. 5e and Fig. S18). LSBs-γ still maintains flat and stable charge/discharge platforms well at the high rate of 3 C, while the other two batteries, especially the LSBs-α, undergo severe C s degradation and larger polarization with the increase of rate. The excellent rate capability of LSBs-γ confirms that the Co/NOC coating boosts the kinetic conversion of Li-S batteries, which is attributed to the efficient catalytic activity of Co-O2N2 coordination configuration and the favourable Li-ion affinity of the modified diaphragm. The long-term cyclic stability at 1 and 2 C was also investigated, respectively, and the test data are recorded in Fig. 5(f and g). After 500 cycles at 1 C, the discharge C s of LSBs-γ remained at 905.6 mAh g−1, and after 1000 cycles at 2 C, the discharge C s remained at 771.1 mAh g−1, still showing superior C s and distinguished cyclic stability to LSBs-α and LSBs-β. Although the as-assembled Li-S batteries have the above differences in electrochemical characteristics, the Coulombic efficiency under different charge/discharge conditions is approaching 100%, indicating the highly reversible S chemistry. Maintaining a relatively constant anode potential in the open circuit state can ensure the long-term application of Li-S batteries [43]. Hence, the anti-self-discharge performance under open circuit conditions is the key index to evaluate the actual use capability of Li-S batteries. The open circuit voltage (OCV) of the LSBs-α (2.14 V) and LSBs-β (2.26 V) is significantly reduced in Fig. 5(h). In contrast, the employment of Co/NOC modified separator can greatly weaken the self-discharge problem and afford a more stable OCV of 2.57 V, suggesting the vital role of Co-O2N2 structure in the restriction of LiPSs. To reveal the reasons for the optimization of the adsorption properties and catalytic behaviors of Co-O2N2 coordination environments at the atomic level, the first-principle calculations were performed. Fig. 6 (a) shows the calculated adsorption energies of nitrogen-doped GN (NG), Co-N4-C, and Co/NOC for Li2S8, Li2S4, and Li2S, respectively. Notably, the Co/NOC exhibits stronger adsorption property to Li2S8, Li2S4, and Li2S than Co-N4-C and NG because of the synergistic effect of S n 2−–Co and Li+–O chemical bonds, which accords with the Lewis acid-base interaction mechanism. Differential charge density calculations and Bader charge calculations were used to clarify the advantage of introducing Co-O2N2 moiety for improving S affinity compared with Co-N4 coordination structure. As presented in Fig. 6(b), a more denser electron cloud appears on the Co–S bonds in the Li2S-Co-O2N2 model than that in the Li2S-Co-N4 model, which is due to the addition of strongly electronegative O atoms (The electronegativity difference with Co atoms is more obvious) to improve the matrix polarity. This makes the adsorbed Li2S have stronger Co–S bonds, which is highly consistent with the adsorption energy calculation. Besides, the charge transfer amount of Li2S to Co-O2N2 (0.772 e−) is greater than that to Co-N4 (0.493 e−) based on the Bader charge calculation, which confirms that the addition of more electronegative O atoms improves the electron adsorption ability of Co-O2N2. The calculation results mentioned above reveal the enhanced interaction between Co-O2N2 structure and Li2S, favorably accelerating the electron migration, that is, the precondition of catalytic conversion [44]. Moreover, the Gibbs free energy data of S reduction reactions on the NG, Co-N4-C, and Co/NOC were calculated theoretically (Fig. 6c and Fig. S19). The Gibbs free energy change (ΔG) in the transformation of Li2S2 to Li2S shows the largest rise, suggesting the rate-determining procedure. The ΔG value at the rate-determining procedure for the Co/NOC (0.51 eV) is lower than that for the NG (0.87 eV) and Co-N4-C (0.69 eV), indicating that the thermodynamics of S reduction on the Co/NOC is more favorable. In order to further uncover the increased electrocatalytic capacity of Co-O2N2 moiety, the dissolution energy barrier of Li2S on NG, Co-N4, and Co-O2N2 was also calculated (Fig. 6d–f). Induced by the Co-N4 electrocatalyst, the barrier for Li2S dissolution (1.067 eV) is much lower than that on NG (1.214 eV), indicating that Co atoms in Co-N4 are the active centers to promote Li2S decomposition. More importantly, the solid-liquid phase conversion of Li2S is further accelerated through the reduced dissolution barrier for Co-O2N2 (0.784 eV) with double oxygen heteroatoms being introduced into the Co coordination environments. Density functional theory (DFT) calculations display that the unique Co-O2N2 structure in Li-S batteries enhances the adsorbability and bidirectional redox conversion kinetics of LiPSs, which implies the significance of introducing befitting heteroatoms for regulation into the chemical coordination environments of Co single-atoms for the electrocatalyst design. Encouraged by the excellent electrocatalytic activity and enhanced chemical adsorption capacity of the Co-O2N2-modified diaphragm, we performed an ex-situ XPS characterization (Fig. S20a–e) to investigate its interactions with LiPSs. It is well known that electrons can be transferred from Sn2− of LiPSs to the empty orbital of the oxidized Co according to the Lewis acid-base theory [27,45]. Hence, the XPS peaks of atomic Co move significantly toward the lower binding energy during discharging progress (Fig. S20a). During the subsequent charging process, the XPS peaks reversibly shift to the left, declaring the chemical stability of Co single atoms in the redox process of Li-S batteries. In the S 2p spectra, the peak structures at 170.1 and 169.0 eV are associated with polythionate and thiosulfate, respectively (Fig. S20b). At 1.7 and 2.3 V, the formation of the S–Co bonds can be seen in the fitted S 2p spectra. Furthermore, the double peaks attributed to Li2S/Li2S2 at 163.3 and 162.1 eV are significantly enhanced at full discharge to 1.7 V, which agrees with the experimental results reported by Du et al. [46]. At a later charging step, the peak intensities of Li2S/Li2S2 become weaker with reversible oxidation of LiPSs, which is also easily seen in the Li 1s spectra (Fig. S20e). In view of the strong chemical bond between Co and polysulfide negative ions, the Li-ions of lithium polysulfides will spontaneously interact with the N atoms of Co-O2N2 and pyridinic N. The XPS peaks of the N–Co bond and pyridinic N increased from 398.3 and 397.6 to 398.9 eV during the discharge process, respectively (Fig. S20c). Meanwhile, the XPS peak of the O–Co bond increases from 530.6 to 531.5 eV due to the transfer of electrons from the oxygen atoms to Li ions (Fig. S20d). Importantly, the active centers of Co/NOC returned to the primordial state after charging, which is reflected by the right shift of the N 1s and O 1s XPS spectra, demonstrating a long-period validity of the electrocatalysts during the operation of Li-S batteries. For the Li2S6 solution in the presence of Co/NOC, the Raman peaks of Li2S6 are significantly weakened, which also verifies the strong adsorption of the Co-O2N2 moiety on polysulfides, thus suppressing the shuttle behavior of polysulfides (Fig. S20f). Other factors including large S loading, low temperature environment as well as barren electrolyte also need to be considered in the real application of Li-S batteries. In this research, we characterized the cyclic performance of LSBs-γ with different S loadings at 0.2 C (Fig. 7 a). The incipient reversible C s of LSBs-γ at various S areal loadings of 5.6, 8.8, and 12.0 mg cm−2 is 1160.7, 1120.0, and 1030.1 mAh g−1, respectively. After 100 cycles, the reversible C s is 900.5, 836.6, and 710.1 mAh g−1, and the C s retentions are 77.58%, 74.70%, and 68.94%, respectively. Therefore, LSBs-γ can provide a high areal C s of 12.36 mAh cm−2 and retain a desirable areal C s of 8.52 mAh cm−2 after 100 cycles, far exceeding the excellent lithium cell (∼4.0 mAh cm−2) [47] and surpassing many Li-S batteries employing other modified diaphragms (Table S3). At the same time, the LSBs-γ was further tested under the harsh low-temperature operating conditions. Fig. 7(b) shows the discharge and charge curves at 0.2 C within a broad temperature range of −20 to 28 °C. LSBs-γ has the typical discharge and charge curves of S redox within −10 to 28 °C, indicating outstanding low-temperature tolerance. When the temperature drops from 28 to −10 °C, the C s declines slightly from 1440.1 to 874.2 mAh g−1. Nevertheless, further decreasing the temperature to −20 °C leads to a sharp drop in the C s of LSBs-γ (271.7 mAh g−1) and a significant increase in overpotential, which can be resolved through innovating the electrolytes. Fig. 7(c) presents the stability of LSBs-γ under temperature changes. We find that LSBs-γ operates stably at every temperature, once again demonstrating the distinguished temperature resistance of Li-S batteries using Co/NOC modified separators. The increased discharge C s from −20 °C to room temperature (28 °C) can be ascribed to the enhanced interaction between the Co/NOC@PP separator and polysulfides, reduced electrolyte viscosity, and improved reaction kinetics. Besides, the long-period performance of LSBs-γ at low temperatures was tested (Fig. 7d). At −10 °C, the C s of LSBs-γ is 688.7 mAh g−1 in the first cycle and can still reach 564.5 mAh g−1 after 100 cycles at 1 C. These results manifest the effectiveness of the Co/NOC@PP separator in suppressing the shuttle effect of lithium polysulfides and imparting good low-temperature long cycle performance to Li-S batteries. Low electrolyte dosage is the key condition for realizing low-cost and high-energy-density Li-S batteries. Here, we assembled Li-S batteries containing Co/NOC@PP separator using the cathode with a high S loading of 5.6 mg cm−2 and performed multi-cycle measurements in the barren electrolyte (electrolyte volume/S mass (E/S = 5.1 µL mg−1)). As depicted in Fig. S21, the areal C s of Li-S batteries equipped with Co/NOC@PP separator reaches 4.1 mAh cm−2 after 60 cycles at 0.2 C. The exceptional performance of the Co/NOC@PP separator is attributed to the special structure of Co/NOC, including GN-like carbon nanosheets with high S BET and suitable hierarchical porous structure, as well as well-dispersed monoatomic Co with O2N2 coordination. These prominent physical/chemical properties verify that Co/NOC@PP separator possesses good application prospects in Li-S batteries. 3 Conclusions In summary, monatomic Co with novel Co-O2N2 coordination configuration anchored in heteroatom (N, O)-doped carbon matrix (Co/NOC) is successfully prepared and used as a multifunctional separator modification material. Homogeneous integration of monodisperse Co-O2N2 and carbon matrix with increased carbon layer spacing is conducive to providing fast charge/mass transfer channels and exposing more SACs active sites. The results of experiments and first-principle calculations verify that Co-O2N2 moiety is a multifunctional active center, which not only effectively enhances the chemisorption of LiPSs, but also significantly catalyzes the bidirectional LiPSs conversion, thereby inhibiting the shuttle effect. What is even more impressive, the structure-property relationship between the special Co-O2N2 coordination structure and improved adsorption capacity and catalytic activity is accurately revealed. Therefore, the Li-S batteries with Co/NOC modified diaphragms at room temperature show a large initial C s of 1581.7 mAh g−1 at 0.1 C, extraordinary rate performance (906.6 mAh g−1 at 3 C), excellent cycling performance of 771.1 mAh g−1 after 1000 cycles at 2 C, and a high areal C s of 12.36 mAh cm−2 at high S loading. Furthermore, the superior areal C s of 5.98 mAh cm−2 can still be achieved under a lean electrolyte volume of E/S = 5.1 µL mg−1 and high S loading of 5.6 mg cm−2. What is more, the Li-S batteries can operate stably for a long time at 1 C at −10 °C. This work reveals the specific effects of the modulation of the local coordination environment of SACs on the adsorption and catalytic activity of polysulfide, and has important reference significance for the development of highly active SACs for high-value Li-S batteries. Experimental section Experimental details can be found in the Supporting Information. CRediT authorship contribution statement Yunqiang Zhang: Writing – original draft, Visualization, Resources, Funding acquisition, Formal analysis. Huaming Yuan: Writing – review & editing, Validation, Investigation, Data curation. Enyan Guo: Writing – original draft, Validation, Methodology, Investigation, Formal analysis. Shunwei Chen: Software, Methodology, Formal analysis. Manman Ren: Methodology, Formal analysis. Jingyun Ma: Resources, Investigation, Funding acquisition, Data curation. Jiaxi Cui: Writing – review & editing, Resources. Mei Li: Writing – review & editing, Resources, Methodology, Funding acquisition, Formal analysis, Conceptualization. Laiying Jing: Formal analysis, Data curation. Li Li: Writing – review & editing, Validation, Supervision, Project administration. Declaration of competing interest The authors declare that they have no known competing financial interests or personal relationships that could have appeared to influence the work reported in this paper. Acknowledgments This work was supported financially by the National Natural Science Foundation of China (NSFC) (Grant No. 22208174 and 52272221), the New Colleges and Universities Twenty Foundational Projects of Jinan City (2021GXRC068), the Universities Youth Innovation Team Development Plan of Shandong Province (2023KJ140), the Natural Science Foundation of Shandong Province (ZR2022MB143), the Basic Research Projects of Science, Education, and Industry Integration Pilot Engineering of Qilu University of Technology (Shandong Academy of Sciences) (2023PY002). Appendix A Supplementary material Supplementary data to this article can be found online at https://doi.org/10.1016/j.jechem.2024.08.003. Appendix A Supplementary material The following are the Supplementary data to this article: Supplementary Data 1 References [1] L.-P. Hou L.-Y. Yao C.-X. Bi J. Xie B.-Q. Li J.-Q. Huang X.-Q. Zhang J. Energy Chem. 68 2022 300 305 L.-P. Hou, L.-Y. Yao, C.-X. Bi, J. Xie, B.-Q. Li, J.-Q. Huang, X.-Q. Zhang, J. Energy Chem. 68 (2022) 300–305. [2] Y.-W. Song L. Shen N. Yao S. Feng Q. Cheng J. Ma X. Chen B.-Q. Li Q. Zhang Angew. Chem. Int. Ed. 63 2024 e202400343 Y.-W. Song, L. Shen, N. Yao, S. Feng, Q. Cheng, J. Ma, X. Chen, B.-Q. Li, Q. Zhang, Angew. Chem. Int. Ed. 63 (2024) e202400343. [3] Q. Zheng Q. Hou Z. Shu G. Liu X. Fan K. Wang J. Fan R. Yuan M. Zheng Q. Dong Angew. Chem. Int. Ed. 62 2023 e202308726 Q. Zheng, Q. Hou, Z. Shu, G. Liu, X. Fan, K. Wang, J. Fan, R. Yuan, M. Zheng, Q. Dong, Angew. Chem. Int. Ed. 62 (2023) e202308726. [4] H. Lu Q. Zeng L. Xu Y. Xiao L. Xie J. Yang J. Rong J. Weng C. Zheng Q. Zhang S. Huang Angew. Chem. Int. Ed. 63 2024 e202318859 H. Lu, Q. Zeng, L. Xu, Y. Xiao, L. Xie, J. Yang, J. Rong, J. Weng, C. Zheng, Q. Zhang, S. Huang, Angew. Chem. Int. Ed. 63 (2024) e202318859. [5] H. Shi W. Sun J. Cao S. Han G. Lu Z.A. Ghazi X. Zhu H. Lan W. Lv Adv. Funct. Mater. 33 2023 2306933 H. Shi, W. Sun, J. Cao, S. Han, G. Lu, Z. A. Ghazi, X. Zhu, H. Lan, W. Lv, Adv. Funct. Mater. 33 (2023) 2306933. [6] F. Zhao J. Xue W. Shao H. Yu W. Huang J. Xiao J. Energy Chem. 80 2023 625 657 F. Zhao, J. Xue, W. Shao, H. Yu, W. Huang, J. Xiao, J. Energy Chem. 80 (2023) 625–657. [7] Y. Jiang S. Liu X. Gao G. Li Adv. Funct. Mater. 33 2023 2304965 Y, Jiang, S, Liu, X, Gao, G, Li, Adv. Funct. Mater. 33 (2023) 2304965. [8] R. Wang R. Wu X. Yan D. Liu P. Guo W. Li H. Pan Adv. Funct. Mater. 32 2022 2200424 R. Wang, R. Wu, X. Yan, D. Liu, P. Guo, W. Li, H. Pan, Adv. Funct. Mater. 32 (2022) 2200424. [9] X.-Y. Li S. Feng C.-X. Zhao Q. Cheng Z.-X. Chen S.-Y. Sun X. Chen X.-Q. Zhang B.-Q. Li J.-Q. Huang Q. Zhang J. Am. Chem. Soc. 144 2022 14638 14646 X.-Y. Li, S. Feng, C.-X. Zhao, Q. Cheng, Z.-X. Chen, S.-Y. Sun, X. Chen, X.-Q. Zhang, B.-Q. Li, J.-Q. Huang, Q. Zhang, J. Am. Chem. Soc. 144 (2022) 14638–14646. [10] M. Jin G. Sun Y. Wang J. Yuan H. Zhao G. Wang J. Zhou E. Xie X. Pan ACS Nano 18 2024 2017 2029 M. Jin, G. Sun, Y. Wang, J. Yuan, H. Zhao, G. Wang, J. Zhou, E. Xie, X. Pan, ACS Nano 18 (2024) 2017–2029. [11] J. Li Z. Xiong Y. Wu H. Li X. Liu H. Peng Y. Zheng Q. Zhang Q. Liu J. Energy Chem. 73 2022 513 532 J. Li, Z. Xiong, Y. Wu, H. Li, X. Liu, H. Peng, Y. Zheng, Q. Zhang, Q. Liu, J. Energy Chem. 73 (2022) 513–532. [12] X.-Y. Li S. Feng Y.-W. Song C.-X. Zhao Z. Li Z.-X. Chen Q. Cheng X. Chen X.-Q. Zhang B.-Q. Li J.-Q. Huang Q. Zhang J. Am. Chem. Soc. 146 2024 14754 14764 X.-Y. Li, S. Feng, Y.-W. Song, C.-X. Zhao, Z. Li, Z.-X. Chen, Q. Cheng, X. Chen, X.-Q. Zhang, B.-Q. Li, J.-Q. Huang, Q. Zhang, J. Am. Chem. Soc. 146 (2024) 14754–14764. [13] X. Wang X. Zhang Y. Zhao D. Luo L. Shui Y. Li G. Ma Y. Zhu Y. Zhang G. Zhou A. Yu Z. Chen Angew. Chem. Int. Ed. 62 2023 e202306901 X. Wang, X. Zhang, Y. Zhao, D. Luo, L. Shui, Y. Li, G. Ma, Y. Zhu, Y. Zhang, G. Zhou, A. Yu, Z. Chen, Angew. Chem. Int. Ed. 62 (2023) e202306901. [14] X. Li Y. Xiao Q. Zeng L. Xu S. Guo C. Zheng Q. Zhang S. Huang Nano Energy 116 2023 108813 X. Li, Y. Xiao, Q. Zeng, L. Xu, S. Guo, C. Zheng, Q. Zhang, S. Huang, Nano Energy 116 (2023) 108813. [15] R. Razaq M.M.U. Din D.R. Småbråten V. Eyupoglu S. Janakiram T.O. Sunde N. Allahgoli D. Rettenwander L. Deng Adv. Energy Mater. 14 2024 2302897 R. Razaq, M. M. U. Din, D. R. Småbråten, V. Eyupoglu, S. Janakiram, T. O. Sunde, N. Allahgoli, D. Rettenwander, L. Deng, Adv. Energy Mater. 14 (2024) 2302897. [16] P. Chen T. Wang D. He T. Shi M. Chen K. Fang H. Lin J. Wang C. Wang H. Pang Angew. Chem. Int. Ed. 62 2023 e202311693 P. Chen, T. Wang, D. He, T. Shi, M. Chen, K. Fang, H. Lin, J. Wang, C. Wang, H. Pang, Angew. Chem. Int. Ed. 62 (2023) e202311693. [17] D. Zhang T. Duan Y. Luo S. Liu W. Zhang Y. He K. Zhu L. Huang Y. Yang R. Yu X. Yang H. Shu Y. Pei X. Wang M. Chen Adv. Funct. Mater. 33 2023 2306578 D. Zhang, T. Duan, Y. Luo, S. Liu, W. Zhang, Y. He, K. Zhu, L. Huang, Y. Yang, R. Yu, X. Yang, H. Shu, Y. Pei, X. Wang, M. Chen, Adv. Funct. Mater. 33 (2023) 2306578. [18] T. Ren X. Wang N. Wang D. Huang Y. Zhu P.K. Shen J. Zhu J. Mater. Chem. A 12 2024 5307 5318 T. Ren, X. Wang, N. Wang, D. Huang, Y. Zhu, P. K. Shen, J. Zhu, J. Mater. Chem. A 12 (2024) 5307–5318. [19] Z. Liang J. Shen X. Xu F. Li J. Liu B. Yuan Y. Yu M. Zhu Adv. Mater. 34 2022 2200102 Z. Liang, J. Shen, X. Xu, F. Li, J. Liu, B. Yuan, Y. Yu, M. Zhu, Adv. Mater. 34 (2022) 2200102. [20] Y. Pan C. Zhang Z. Liu C. Chen Y. Li Matter 2 2020 78 110 Y. Pan, C. Zhang, Z. Liu, C. Chen, Y. Li, Matter 2 (2020) 78–110. [21] T. Huang Y. Sun J. Wu Z. Shi Y. Ding M. Wang C. Su Y. Li J. Sun Adv. Funct. Mater. 32 2022 2203902 T. Huang, Y. Sun, J. Wu, Z. Shi, Y. Ding, M. Wang, C. Su, Y. Li, J. Sun, Adv. Funct. Mater. 32 (2022) 2203902. [22] D. Yang C. Li M. Sharma M. Li J. Wang J. Wei K. Liu Y. Zhang J. Li G. Henkelman Q. Zhang A. Cabot Energy Storage Mater. 66 2024 103240 D. Yang, C. Li, M. Sharma, M. Li, J. Wang, J. Wei, K. Liu, Y. Zhang, J. Li, G. Henkelman, Q. Zhang, A. Cabot, Energy Storage Mater. 66 (2024) 103240. [23] L.C. Greenburg X. Gao P. Zhang X. Zheng J. Wang R.A. Vilá Y. Cui Nano Lett. 23 2023 5967 5974 L. C. Greenburg, X. Gao, P. Zhang, X. Zheng, J. Wang, R. A. Vilá, Y. Cui, Nano Lett. 23 (2023) 5967–5974. [24] S. Zhang X. Ao J. Huang B. Wei Y. Zhai D. Zhai W. Deng C. Su D. Wang Y. Li Nano Lett. 21 2021 9691 9698 S. Zhang, X. Ao, J. Huang, B. Wei, Y. Zhai, D. Zhai, W. Deng, C. Su, D. Wang, Y. Li, Nano Lett. 21 (2021) 9691–9698. [25] J. Zhu X. Wang T. Ke M. Jia B. Jin Y. Li Q. Yang L. Ren Y. Ren D. Cheng J. Lu X. Gao Q. He Y. Hou X. Zhan Q. Zhang J. Energy Chem. 78 2023 203 210 J. Zhu, X. Wang, T. Ke, M. Jia, B. Jin, Y. Li, Q. Yang, L. Ren, Y. Ren, D. Cheng, J. Lu, X. Gao, Q. He, Y. Hou, X. Zhan, Q. Zhang, J. Energy Chem. 78 (2023) 203–210. [26] R. Zhou S. Gu M. Guo S. Xu G. Zhou Energy Environ. Mater. 7 2024 e12703 R. Zhou, S. Gu, M. Guo, S. Xu, G. Zhou, Energy Environ. Mater. 7 (2024) e12703. [27] Z. Han S. Zhao J. Xiao X. Zhong J. Sheng W. Lv Q. Zhang G. Zhou H.-M. Cheng Adv. Mater. 33 2021 2105947 Z. Han, S. Zhao, J. Xiao, X. Zhong, J. Sheng, W. Lv, Q. Zhang, G. Zhou, H.-M. Cheng, Adv. Mater. 33 (2021) 2105947. [28] T. Sun F. Huang J. Liu H. Yu X. Feng X. Feng Y. Yang H. Shu F. Zhang Adv. Funct. Mater. 33 2023 2306049 T. Sun, F. Huang, J. Liu, H. Yu, X. Feng, X. Feng, Y. Yang, H. Shu, F. Zhang, Adv. Funct. Mater. 33 (2023) 2306049. [29] M. Lu T. Yan Y. Ding S. Chen Z. Chen J. Gu X. Chen L. Zhang M. Tian J. Sun Energy Storage Mater. 70 2024 103458 M. Lu, T. Yan, Y. Ding, S. Chen, Z. Chen, J. Gu, X. Chen, L. Zhang, M. Tian, J. Sun, Energy Storage Mater. 70 (2024) 103458. [30] Z. Wang Y. Yan Y. Zhang Y. Chen X. Peng X. Wang W. Zhao C. Qin Q. Liu X. Liu Z. Chen Carbon Energy 5 2023 e306 Z. Wang, Y. Yan, Y. Zhang, Y. Chen, X. Peng, X. Wang, W. Zhao, C. Qin, Q. Liu, X. Liu, Z. Chen, Carbon Energy 5 (2023) e306. [31] Y. Liu B. Niu R. Qi Y. Zhang Y. Zhang M. Li J. Appl. Polym. Sci. 138 2021 50826 Y. Liu, B. Niu, R. Qi, Y. Zhang, Y. Zhang, M. Li, J. Appl. Polym. Sci. 138 (2021) 50826. [32] C. Dong C. Zhou M. Wu Y. Yu K. Yu K. Yan C. Shen J. Gu M. Yan C. Sun L. Mai X. Xu Adv. Energy Mater. 13 2023 2301505 C. Dong, C. Zhou, M. Wu, Y. Yu, K. Yu, K. Yan, C. Shen, J. Gu, M. Yan, C. Sun, L. Mai, X. Xu, Adv. Energy Mater. 13 (2023) 2301505. [33] H. Gu W. Yue J. Hu X. Niu H. Tang F. Qin Y. Li Q. Yan X. Liu W. Xu Z. Sun Q. Liu W. Yan L. Zheng Y. Wang H. Wang X. Li L. Zhang G. Xia W. Chen Adv. Energy Mater. 13 2023 2204014 H. Gu, W. Yue, J. Hu, X. Niu, H. Tang, F. Qin, Y. Li, Q. Yan, X. Liu, W. Xu, Z. Sun, Q. Liu, W. Yan, L. Zheng, Y. Wang, H. Wang, X. Li, L. Zhang, G. Xia, W. Chen, Adv. Energy Mater. 13 (2023) 2204014. [34] Y. Guo Q. Niu F. Pei Q. Wang Y. Zhang L. Du Y. Zhang Y. Zhang Y. Zhang L. Fan Q. Zhang L. Yuan Y. Huang Energy Environ. Sci. 17 2024 1330 1367 Y. Guo, Q. Niu, F. Pei, Q. Wang, Y. Zhang, L. Du, Y. Zhang, Y. Zhang, Y. Zhang, L. Fan, Q. Zhang, L. Yuan, Y. Huang, Energy Environ. Sci. 17 (2024) 1330–1367. [35] H. Zhang J. Chen J. Liu X. Zhang J. Yang Y. Nuli H. Ma J. Wang Energy Storage Mater. 61 2023 102885 H. Zhang, J. Chen, J. Liu, X. Zhang, J. Yang, Y. Nuli, H. Ma, J. Wang, Energy Storage Mater. 61 (2023) 102885. [36] Y. Li Z. Wang H. Gu H. Jia Z. Long X. Yan ACS Nano 18 2024 8863 8875 Y. Li, Z. Wang, H. Gu, H. Jia, Z. Long, X. Yan, ACS Nano 18 (2024) 8863–8875. [37] W. Zhou M. Chen D. Zhao C. Zhu N. Wang W. Lei Y. Guo L. Li Adv. Funct. Mater. 2024 2402114 W. Zhou, M. Chen, D. Zhao, C. Zhu, N. Wang, W. Lei, Y. Guo, L. Li, Adv. Funct. Mater. (2024) 2402114. [38] Y. Guo J. Li G. Yuan J. Guo Y. Zheng Y. Huang Q. Zhang J. Li J. Shen C. Shu J. Xu Y. Tang W. Lei H. Shao ACS Nano 17 2023 18253 18265 Y. Guo, J. Li, G. Yuan, J. Guo, Y. Zheng, Y. Huang, Q. Zhang, J. Li, J. Shen, C. Shu, J. Xu, Y. Tang, W. Lei, H. Shao, ACS Nano 17 (2023) 18253–18265. [39] C. Zhao Y. Huang B. Jiang Z. Chen X. Yu X. Sun H. Zhou Y. Zhang N. Zhang Adv. Energy Mater. 14 2024 2302586 C. Zhao, Y. Huang, B. Jiang, Z. Chen, X. Yu, X. Sun, H. Zhou, Y. Zhang, N. Zhang, Adv. Energy Mater. 14 (2024) 2302586. [40] R. Liu Z. Wei L. Peng L. Zhang A. Zohar R. Schoeppner P. Wang C. Wan D. Zhu H. Liu Z. Wang S.H. Tolbert B. Dunn Y. Huang P. Sautet X. Duan Nature 626 2024 98 104 R. Liu, Z. Wei, L. Peng, L. Zhang, A. Zohar, R. Schoeppner, P. Wang, C. Wan, D. Zhu, H. Liu, Z. Wang, S. H. Tolbert, B. Dunn, Y. Huang, P. Sautet, X. Duan, Nature 626 (2024) 98–104. [41] X. Yang X. Gao Q. Sun S.P. Jand Y. Yu Y. Zhao X. Li K. Adair L.-Y. Kuo J. Rohrer J. Liang X. Lin M.N. Banis Y. Hu H. Zhang X. Li R. Li H. Zhang P. Kaghazchi T.-K. Sham X. Sun Adv. Mater. 31 2019 1901220 X. Yang, X. Gao, Q. Sun, S. P. Jand, Y. Yu, Y. Zhao, X. Li, K. Adair, L.-Y. Kuo, J. Rohrer, J. Liang, X. Lin, M. N. Banis, Y. Hu, H. Zhang, X. Li, R. Li, H. Zhang, P. Kaghazchi, T.-K. Sham, X. Sun, Adv. Mater. 31 (2019) 1901220. [42] Z. Zhou Z. Chen H. Lv Y. Zhao H. Wei B. Chen Y. Wang Energy Storage Mater. 51 2022 486 499 Z. Zhou, Z. Chen, H. Lv, Y. Zhao, H. Wei, B. Chen, Y. Wang, Energy Storage Mater. 51 (2022) 486–499. [43] Y. Zhang W. Wang Z. Jia J. Ding L. Hua M. Sun Y. Li G. Wang C. Li Energy Storage Mater. 67 2024 103320 Y. Zhang, W. Wang, Z. Jia, J. Ding, L. Hua, M. Sun, Y. Li, G. Wang, C. Li, Energy Storage Mater. 67 (2024) 103320. [44] B. Song H. Zhao G. Zhao H. Li C. Ge G. Yan J. Fang Chem. Eng. J. 460 2023 141907 B. Song, H. Zhao, G. Zhao, H. Li, C. Ge, G. Yan, J. Fang, Chem. Eng. J. 460 (2023) 141907. [45] J. Zhou A. Sun Chem. Eng. J. 488 2024 150719 J. Zhou, A. Sun, Chem. Eng. J. 488 (2024) 150719. [46] Z. Du X. Chen W. Hu C. Chuang S. Xie A. Hu W. Yan X. Kong X. Wu H. Ji L.-J. Wan J. Am. Chem. Soc. 141 2019 3977 3985 Z. Du, X. Chen, W. Hu, C. Chuang, S. Xie, A. Hu, W. Yan, X. Kong, X. Wu, H. Ji, L.-J. Wan, J. Am. Chem. Soc. 141 (2019) 3977–3985. [47] C.-C. Wu Y.-C. Ho S.-H. Chung J. Mater. Chem. A 11 2023 24651 24660 C.-C. Wu, Y.-C. Ho, S.-H. Chung, J. Mater. Chem. A 11 (2023) 24651–24660.",
      "scopus-id": "85202586746",
      "coredata": {
        "eid": "1-s2.0-S2095495624005515",
        "dc:description": "Lithium-sulfur (Li-S) batteries suffer from the shuttle effect of soluble lithium polysulfides (LiPSs) and slow redox kinetics, significantly limiting their practical application. Although single-atom catalysts (SACs) offer a promising strategy to address these challenges, designing materials with optimal adsorption force and high catalytic activity remains a grand challenge. Here, we present a cobalt (Co)-based SAC with unique Co-O2N2 coordination structures for Li-S batteries. Both experimental and theoretical studies demonstrate that O, N-coordinated Co single atoms anchored on a porous carbon framework (Co/NOC) effectively capture LiPSs and dramatically catalyze bidirectional polysulfide conversion. The expanded carbon layer spacing facilitates lithium ions diffusion and maximizes the exposure of active sites. As a result, Li-S batteries incorporating Co/NOC as separators exhibit outstanding rate performance (906.6 mAh g−1 at 3 C) and exceptional cycling stability, even at −10 °C. Furthermore, with a high sulfur loading of 12.0 mg cm−2, the areal specific capacity reaches up to 12.36 mAh cm−2. This work provides some useful insights for the design of high-performance SACs for Li-S batteries.",
        "openArchiveArticle": "false",
        "prism:coverDate": "2024-12-31",
        "openaccessUserLicense": null,
        "prism:aggregationType": "Journal",
        "prism:url": "https://api.elsevier.com/content/article/pii/S2095495624005515",
        "dc:creator": [
          {
            "@_fa": "true",
            "$": "Zhang, Yunqiang"
          },
          {
            "@_fa": "true",
            "$": "Yuan, Huaming"
          },
          {
            "@_fa": "true",
            "$": "Guo, Enyan"
          },
          {
            "@_fa": "true",
            "$": "Chen, Shunwei"
          },
          {
            "@_fa": "true",
            "$": "Ren, Manman"
          },
          {
            "@_fa": "true",
            "$": "Ma, Jingyun"
          },
          {
            "@_fa": "true",
            "$": "Cui, Jiaxi"
          },
          {
            "@_fa": "true",
            "$": "Li, Mei"
          },
          {
            "@_fa": "true",
            "$": "Jing, Laiying"
          },
          {
            "@_fa": "true",
            "$": "Li, Li"
          }
        ],
        "link": [
          {
            "@_fa": "true",
            "@rel": "self",
            "@href": "https://api.elsevier.com/content/article/pii/S2095495624005515"
          },
          {
            "@_fa": "true",
            "@rel": "scidir",
            "@href": "https://www.sciencedirect.com/science/article/pii/S2095495624005515"
          }
        ],
        "dc:format": "application/json",
        "openaccessType": null,
        "pii": "S2095-4956(24)00551-5",
        "prism:volume": "99",
        "prism:publisher": "Science Press and Dalian Institute of Chemical Physics, Chinese Academy of Sciences. Published by ELSEVIER B.V. and Science Press. All rights are reserved, including those for text and data mining, AI training, and similar technologies.",
        "dc:title": "Facilitating sulfur species capture and bi-directional redox in Li-S batteries with single-atomic Co-O2N2 coordination structure",
        "prism:copyright": "© 2024 Science Press and Dalian Institute of Chemical Physics, Chinese Academy of Sciences. Published by ELSEVIER B.V. and Science Press. All rights are reserved, including those for text and data mining, AI training, and similar technologies.",
        "openaccess": "0",
        "prism:issn": "20954956",
        "dcterms:subject": [
          {
            "@_fa": "true",
            "$": "Asymmetrically coordinated Co-O2N2"
          },
          {
            "@_fa": "true",
            "$": "Zeolitic imidazolate framework-67"
          },
          {
            "@_fa": "true",
            "$": "Melamine resin"
          },
          {
            "@_fa": "true",
            "$": "Carbon nanoflakes"
          },
          {
            "@_fa": "true",
            "$": "Shuttle effect"
          }
        ],
        "openaccessArticle": "false",
        "prism:publicationName": "Journal of Energy Chemistry",
        "openaccessSponsorType": null,
        "prism:pageRange": "604-614",
        "prism:endingPage": "614",
        "pubType": "fla",
        "prism:coverDisplayDate": "December 2024",
        "prism:doi": "10.1016/j.jechem.2024.08.003",
        "prism:startingPage": "604",
        "dc:identifier": "doi:10.1016/j.jechem.2024.08.003",
        "openaccessSponsorName": null
      },
      "objects": {
        "object": [
          {
            "@category": "standard",
            "@height": "200",
            "@width": "250",
            "@_fa": "true",
            "$": "https://api.elsevier.com/content/object/eid/1-s2.0-S2095495624005515-ga1.jpg?httpAccept=%2A%2F%2A",
            "@multimediatype": "JPEG image file",
            "@type": "IMAGE-DOWNSAMPLED",
            "@size": "24119",
            "@ref": "ga1",
            "@mimetype": "image/jpeg"
          },
          {
            "@category": "standard",
            "@height": "320",
            "@width": "535",
            "@_fa": "true",
            "$": "https://api.elsevier.com/content/object/eid/1-s2.0-S2095495624005515-gr1.jpg?httpAccept=%2A%2F%2A",
            "@multimediatype": "JPEG image file",
            "@type": "IMAGE-DOWNSAMPLED",
            "@size": "41963",
            "@ref": "gr1",
            "@mimetype": "image/jpeg"
          },
          {
            "@category": "standard",
            "@height": "618",
            "@width": "799",
            "@_fa": "true",
            "$": "https://api.elsevier.com/content/object/eid/1-s2.0-S2095495624005515-gr2.jpg?httpAccept=%2A%2F%2A",
            "@multimediatype": "JPEG image file",
            "@type": "IMAGE-DOWNSAMPLED",
            "@size": "243329",
            "@ref": "gr2",
            "@mimetype": "image/jpeg"
          },
          {
            "@category": "standard",
            "@height": "742",
            "@width": "734",
            "@_fa": "true",
            "$": "https://api.elsevier.com/content/object/eid/1-s2.0-S2095495624005515-gr3.jpg?httpAccept=%2A%2F%2A",
            "@multimediatype": "JPEG image file",
            "@type": "IMAGE-DOWNSAMPLED",
            "@size": "208371",
            "@ref": "gr3",
            "@mimetype": "image/jpeg"
          },
          {
            "@category": "standard",
            "@height": "432",
            "@width": "734",
            "@_fa": "true",
            "$": "https://api.elsevier.com/content/object/eid/1-s2.0-S2095495624005515-gr4.jpg?httpAccept=%2A%2F%2A",
            "@multimediatype": "JPEG image file",
            "@type": "IMAGE-DOWNSAMPLED",
            "@size": "121616",
            "@ref": "gr4",
            "@mimetype": "image/jpeg"
          },
          {
            "@category": "standard",
            "@height": "619",
            "@width": "734",
            "@_fa": "true",
            "$": "https://api.elsevier.com/content/object/eid/1-s2.0-S2095495624005515-gr5.jpg?httpAccept=%2A%2F%2A",
            "@multimediatype": "JPEG image file",
            "@type": "IMAGE-DOWNSAMPLED",
            "@size": "168221",
            "@ref": "gr5",
            "@mimetype": "image/jpeg"
          },
          {
            "@category": "standard",
            "@height": "415",
            "@width": "734",
            "@_fa": "true",
            "$": "https://api.elsevier.com/content/object/eid/1-s2.0-S2095495624005515-gr6.jpg?httpAccept=%2A%2F%2A",
            "@multimediatype": "JPEG image file",
            "@type": "IMAGE-DOWNSAMPLED",
            "@size": "117869",
            "@ref": "gr6",
            "@mimetype": "image/jpeg"
          },
          {
            "@category": "standard",
            "@height": "803",
            "@width": "645",
            "@_fa": "true",
            "$": "https://api.elsevier.com/content/object/eid/1-s2.0-S2095495624005515-gr7.jpg?httpAccept=%2A%2F%2A",
            "@multimediatype": "JPEG image file",
            "@type": "IMAGE-DOWNSAMPLED",
            "@size": "157277",
            "@ref": "gr7",
            "@mimetype": "image/jpeg"
          },
          {
            "@category": "thumbnail",
            "@height": "164",
            "@width": "205",
            "@_fa": "true",
            "$": "https://api.elsevier.com/content/object/eid/1-s2.0-S2095495624005515-ga1.sml?httpAccept=%2A%2F%2A",
            "@multimediatype": "GIF image file",
            "@type": "IMAGE-THUMBNAIL",
            "@size": "16079",
            "@ref": "ga1",
            "@mimetype": "image/gif"
          },
          {
            "@category": "thumbnail",
            "@height": "131",
            "@width": "219",
            "@_fa": "true",
            "$": "https://api.elsevier.com/content/object/eid/1-s2.0-S2095495624005515-gr1.sml?httpAccept=%2A%2F%2A",
            "@multimediatype": "GIF image file",
            "@type": "IMAGE-THUMBNAIL",
            "@size": "10643",
            "@ref": "gr1",
            "@mimetype": "image/gif"
          },
          {
            "@category": "thumbnail",
            "@height": "164",
            "@width": "212",
            "@_fa": "true",
            "$": "https://api.elsevier.com/content/object/eid/1-s2.0-S2095495624005515-gr2.sml?httpAccept=%2A%2F%2A",
            "@multimediatype": "GIF image file",
            "@type": "IMAGE-THUMBNAIL",
            "@size": "28342",
            "@ref": "gr2",
            "@mimetype": "image/gif"
          },
          {
            "@category": "thumbnail",
            "@height": "164",
            "@width": "162",
            "@_fa": "true",
            "$": "https://api.elsevier.com/content/object/eid/1-s2.0-S2095495624005515-gr3.sml?httpAccept=%2A%2F%2A",
            "@multimediatype": "GIF image file",
            "@type": "IMAGE-THUMBNAIL",
            "@size": "14944",
            "@ref": "gr3",
            "@mimetype": "image/gif"
          },
          {
            "@category": "thumbnail",
            "@height": "129",
            "@width": "219",
            "@_fa": "true",
            "$": "https://api.elsevier.com/content/object/eid/1-s2.0-S2095495624005515-gr4.sml?httpAccept=%2A%2F%2A",
            "@multimediatype": "GIF image file",
            "@type": "IMAGE-THUMBNAIL",
            "@size": "12874",
            "@ref": "gr4",
            "@mimetype": "image/gif"
          },
          {
            "@category": "thumbnail",
            "@height": "164",
            "@width": "194",
            "@_fa": "true",
            "$": "https://api.elsevier.com/content/object/eid/1-s2.0-S2095495624005515-gr5.sml?httpAccept=%2A%2F%2A",
            "@multimediatype": "GIF image file",
            "@type": "IMAGE-THUMBNAIL",
            "@size": "14833",
            "@ref": "gr5",
            "@mimetype": "image/gif"
          },
          {
            "@category": "thumbnail",
            "@height": "124",
            "@width": "219",
            "@_fa": "true",
            "$": "https://api.elsevier.com/content/object/eid/1-s2.0-S2095495624005515-gr6.sml?httpAccept=%2A%2F%2A",
            "@multimediatype": "GIF image file",
            "@type": "IMAGE-THUMBNAIL",
            "@size": "12898",
            "@ref": "gr6",
            "@mimetype": "image/gif"
          },
          {
            "@category": "thumbnail",
            "@height": "163",
            "@width": "131",
            "@_fa": "true",
            "$": "https://api.elsevier.com/content/object/eid/1-s2.0-S2095495624005515-gr7.sml?httpAccept=%2A%2F%2A",
            "@multimediatype": "GIF image file",
            "@type": "IMAGE-THUMBNAIL",
            "@size": "9032",
            "@ref": "gr7",
            "@mimetype": "image/gif"
          },
          {
            "@category": "high",
            "@height": "886",
            "@width": "1107",
            "@_fa": "true",
            "$": "https://api.elsevier.com/content/object/eid/1-s2.0-S2095495624005515-ga1_lrg.jpg?httpAccept=%2A%2F%2A",
            "@multimediatype": "JPEG image file",
            "@type": "IMAGE-HIGH-RES",
            "@size": "134427",
            "@ref": "ga1",
            "@mimetype": "image/jpeg"
          },
          {
            "@category": "high",
            "@height": "1416",
            "@width": "2368",
            "@_fa": "true",
            "$": "https://api.elsevier.com/content/object/eid/1-s2.0-S2095495624005515-gr1_lrg.jpg?httpAccept=%2A%2F%2A",
            "@multimediatype": "JPEG image file",
            "@type": "IMAGE-HIGH-RES",
            "@size": "233082",
            "@ref": "gr1",
            "@mimetype": "image/jpeg"
          },
          {
            "@category": "high",
            "@height": "1640",
            "@width": "2122",
            "@_fa": "true",
            "$": "https://api.elsevier.com/content/object/eid/1-s2.0-S2095495624005515-gr2_lrg.jpg?httpAccept=%2A%2F%2A",
            "@multimediatype": "JPEG image file",
            "@type": "IMAGE-HIGH-RES",
            "@size": "878967",
            "@ref": "gr2",
            "@mimetype": "image/jpeg"
          },
          {
            "@category": "high",
            "@height": "3284",
            "@width": "3248",
            "@_fa": "true",
            "$": "https://api.elsevier.com/content/object/eid/1-s2.0-S2095495624005515-gr3_lrg.jpg?httpAccept=%2A%2F%2A",
            "@multimediatype": "JPEG image file",
            "@type": "IMAGE-HIGH-RES",
            "@size": "1385857",
            "@ref": "gr3",
            "@mimetype": "image/jpeg"
          },
          {
            "@category": "high",
            "@height": "1913",
            "@width": "3248",
            "@_fa": "true",
            "$": "https://api.elsevier.com/content/object/eid/1-s2.0-S2095495624005515-gr4_lrg.jpg?httpAccept=%2A%2F%2A",
            "@multimediatype": "JPEG image file",
            "@type": "IMAGE-HIGH-RES",
            "@size": "744674",
            "@ref": "gr4",
            "@mimetype": "image/jpeg"
          },
          {
            "@category": "high",
            "@height": "2738",
            "@width": "3248",
            "@_fa": "true",
            "$": "https://api.elsevier.com/content/object/eid/1-s2.0-S2095495624005515-gr5_lrg.jpg?httpAccept=%2A%2F%2A",
            "@multimediatype": "JPEG image file",
            "@type": "IMAGE-HIGH-RES",
            "@size": "1066305",
            "@ref": "gr5",
            "@mimetype": "image/jpeg"
          },
          {
            "@category": "high",
            "@height": "1837",
            "@width": "3248",
            "@_fa": "true",
            "$": "https://api.elsevier.com/content/object/eid/1-s2.0-S2095495624005515-gr6_lrg.jpg?httpAccept=%2A%2F%2A",
            "@multimediatype": "JPEG image file",
            "@type": "IMAGE-HIGH-RES",
            "@size": "705567",
            "@ref": "gr6",
            "@mimetype": "image/jpeg"
          },
          {
            "@category": "high",
            "@height": "3554",
            "@width": "2854",
            "@_fa": "true",
            "$": "https://api.elsevier.com/content/object/eid/1-s2.0-S2095495624005515-gr7_lrg.jpg?httpAccept=%2A%2F%2A",
            "@multimediatype": "JPEG image file",
            "@type": "IMAGE-HIGH-RES",
            "@size": "1021470",
            "@ref": "gr7",
            "@mimetype": "image/jpeg"
          },
          {
            "@category": "standard",
            "@_fa": "true",
            "$": "https://api.elsevier.com/content/object/eid/1-s2.0-S2095495624005515-mmc1.docx?httpAccept=%2A%2F%2A",
            "@multimediatype": "Microsoft Word file",
            "@type": "APPLICATION",
            "@size": "20383906",
            "@ref": "mmc1",
            "@mimetype": "application/word"
          },
          {
            "@category": "standard",
            "@_fa": "true",
            "$": "https://api.elsevier.com/content/object/eid/1-s2.0-S2095495624005515-am.pdf?httpAccept=%2A%2F%2A",
            "@multimediatype": "Acrobat PDF file",
            "@type": "AAM-PDF",
            "@size": "8845863",
            "@ref": "am",
            "@mimetype": "application/pdf"
          }
        ]
      },
      "link": {
        "@rel": "abstract",
        "@href": "https://api.elsevier.com/content/abstract/scopus_id/85202586746"
      }
    }
  }
}