{
  "metadata": {
    "title": "Multivalent metal–sulfur batteries for green and cost-effective energy storage: Current status and challenges",
    "authors": "; ; ",
    "journal": "Journal of Energy Chemistry",
    "date": "2022-01-31",
    "doi": "10.1016/j.jechem.2021.04.054",
    "abstract": "",
    "uri": "https://api.elsevier.com/content/article/pii/S2095495621002667",
    "pii": "S2095495621002667"
  },
  "fulltext": {
    "full-text-retrieval-response": {
      "scopus-eid": "2-s2.0-85106870434",
      "originalText": "serial JL 286353 291210 291711 291744 291809 31 Journal of Energy Chemistry JOURNALENERGYCHEMISTRY 2021-05-04 2021-05-04 2021-05-19 2021-05-19 2021-12-15T23:55:35 1-s2.0-S2095495621002667 S2095-4956(21)00266-7 S2095495621002667 10.1016/j.jechem.2021.04.054 S300 S300.2 FULL-TEXT 1-s2.0-S2095495621X00058 2022-10-29T02:08:15.034045Z 0 0 20220101 20220131 2022 2021-05-04T15:22:24.300444Z absattachment articleinfo articletitlenorm authfirstinitialnorm authfirstsurnamenorm cid cids contenttype copyright crossmark dateloaded dateloadedtxt datesearch datesort dateupdated dco docsubtype doctype doi eid ewtransactionid hubeid indexeddate issn issnnorm itemstage itemtransactionid itemweight openaccess openarchive pg pgfirst pglast pii piinorm pubdateend pubdatestart pubdatetxt pubyr sortorder srctitle srctitlenorm srctype ssids alllist content subj subheadings suppl tomb volfirst volissue volumelist webpdf webpdfpagecount yearnav figure body mmlmath acknowledge affil articletitle auth authfirstini authfull authkeywords authlast grantnumber grantsponsor grantsponsorid orcid primabst pubtype ref specialabst 2095-4956 20954956 false 64 64 C Volume 64 17 144 165 144 165 202201 January 2022 2022-01-01 2022-01-31 2022 article rev © 2021 Science Press and Dalian Institute of Chemical Physics, Chinese Academy of Sciences. Published by ELSEVIER B.V. and Science Press. All rights reserved. MULTIVALENTMETALSULFURBATTERIESFORGREENCOSTEFFECTIVEENERGYSTORAGECURRENTSTATUSCHALLENGES YANG Y 1 Introduction 2 Mg–S Batteries 2.1 Cathode materials 2.1.1 Charge/discharge mechanism of polysulfide 2.1.2 Sulfur-carbon composite cathodes 2.2 Electrolytes 2.2.1 Non-nucleophilic electrolyte 2.2.2 Novel non-corrosive electrolyte 2.3 Magnesium anodes 2.4 Current collector and separator modification for Mg–S battery 3 Al–S batteries 3.1 Cathode materials 3.1.1 Electrochemical behavior of polysulfide in IL electrolyte 3.1.2 Sulfur–carbon composite cathodes 3.2 Electrolytes 3.2.1 Ionic-liquid electrolytes 3.2.2 Low price and non-corrosive electrolyte system design 3.3 Aluminum anodes 3.4 Current collector and separator modification for Al–S battery 4 New emerging multivalent M−S batteries 4.1 Calcium–sulfur (Ca–S) batteries 4.2 Zinc–sulfur (Zn–S) and iron–sulfur (Fe–S) batteries 5 Conclusions and outlook Acknowledgments References BRUCE 2011 19 29 P LI 2016 728 735 Y YANG 2012 560 563 P DUNN 2011 928 935 B ARMAND 2008 652 657 M BRUCE 2011 172 P WU 2017 149 156 F BAI 2009 145 148 Y WU 2014 3369 3376 F CHENG 2016 1500213 X NAZAR 2014 436 442 L ZHANG 2013 153 162 S WILD 2015 3477 3494 M WANG 2021 35 66 X NELSON 2012 6337 6343 J CUISINIER 2013 3227 3232 M KUMARESAN 2008 A576 A582 K HAGEN 2015 1401986 M POPE 2015 1614 6832 M WANG 2013 9382 D BORCHARDT 2016 7324 7351 L ADELHELM 2015 1016 1055 P XIN 2014 1261 1265 S WEI 2016 11722 S MANTHIRAM 2015 2108 2114 A XIE 2019 1805061 J ZHANG 2020 2004187 X LIANG 2020 646 656 Y WANG 2019 1905248 P KONG 2018 100 112 L CUISINIER 2015 1401801 M HONG 2019 1802822 X ELIA 2016 7564 7579 G YU 2017 1700217 X AURBACH 2002 405 416 D SALAMA 2019 436 446 M PARK 2013 20531 20541 J KIM 2011 427 H HA 2014 4063 4073 S ZHAOKARGER 2015 1401155 Z ZHENG 2013 1265 1270 G ZHANG 2017 1602055 Z ROBBA 2020 227672 A GAO 2015 12388 12393 T VINAYAN 2016 3296 3306 B DU 2017 2616 2625 A MUTHURAJ 2018 684 689 D XU 2019 2928 2934 Y HACKER 2020 135787 J ZHOU 2015 1402263 G ZHANG 2016 3982 3986 J GAO 2017 1704313 T JI 2009 500 506 X ZHAO 2014 3410 M SU 2013 2985 Y ZHANG 2016 319 380 B ZHAOKARGER 2017 10815 10820 Z GAO 2017 13526 13530 T YANG 2019 9062 9072 Y ZHAOKARGER 2018 2005 2013 Z DU 2017 1702277 H ZHOU 2018 1704166 X VINAYAN 2019 25490 25502 B WANG 2018 26764 26776 W ZENG 2017 A2504 A2512 L ZHAO 2019 6086 6089 X XU 2019 1800981 Y LI 2016 6516 6520 W JAY 2019 11414 11420 R HU 2018 453 459 X CHENG 2014 9644 9646 Y ROBBA 2017 9555 9564 A YU 2016 431 437 X SIEVERT 2017 413 424 B SHAO 2014 255 260 Y WU 2015 5849 5853 N MARIN 2011 191 208 E WANG 2016 27444 27448 H CHANG 2008 180 190 J TONG 2016 9979 9985 X LI 2017 1606422 Q XUE 2011 4718 4720 X GULLAPALLI 2011 1697 1700 H LI 2013 6400 6406 X STRIEBEL 2005 33 38 K WU 2012 301 304 H WU 2019 1806510 F ZHU 2021 9204217 N DAS 2017 6347 6367 S REYNOLDS 1985 109 118 G WANG 2015 80 84 H WANG 2015 22677 22686 H GU 2017 9 17 S WU 2018 71 77 F ZHU 2020 72 80 N YANG 2020 98 102 H WANG 2013 1392 1400 H LICHT 1997 L133 L136 S COHN 2015 416 422 G XIA 2015 167 175 S GAO 2016 9898 9901 T GUO 2019 1807676 Y YU 2017 1700561 X YU 2018 586 598 X CHU 2019 418 423 W LAMPKIN 2020 3514 3523 J YANG 2018 1898 1902 H JI 2011 18522 18525 L SONG 2013 5891 5899 M HU 2016 1603 1609 G WANG 2013 65 69 X ZHOU 2014 2715 2724 J XU 2018 2797 2807 J LI 2015 4029 4038 Z LIANG 2017 1603040 X SONG 2016 29427 J ZHANG 2018 1707578 Y GUO 2020 22963 22967 Y TAO 2014 5288 5294 X SUN 2013 5630 5638 F SHI 2015 5243 5252 J YANG 1996 11978 11981 H HU 2017 1606132 Y WU 2019 73 C GAO 2020 732 740 Y HU 2020 2023 2026 Z QI 2021 685 693 S QI 2021 2009013 S LI 2021 6600 6608 F ZUO 2017 1700389 T REED 2013 A915 A917 L WANG 2017 32288 32293 C ZHOU 2015 240 249 G TAN 2018 3707 3713 L ZHENG 2020 1630 1641 X ZHAO 2020 3297 3311 M ZHAO 2020 22 29 S LIANG 2019 176 181 X WANG 2018 6959 6966 H SEE 2013 1056 1061 K YU 2019 1803794 X ZHAO 2020 2003070 Y WU 2019 1902422 X JEON 2019 139 147 D ZHAO 2021 2007298 M KNOOP 2020 86 106 J KONG 2019 17 22 L YANGX2022X144 YANGX2022X144X165 YANGX2022X144XY YANGX2022X144X165XY 2023-05-19T00:00:00.000Z 2023-05-19T00:00:00.000Z http://creativecommons.org/licenses/by-nc-nd/4.0/ © 2021 Science Press and Dalian Institute of Chemical Physics, Chinese Academy of Sciences. Published by ELSEVIER B.V. and Science Press. All rights reserved. 2021-06-05T13:31:29.090Z http://vtw.elsevier.com/data/voc/AddOnTypes/50.7/aggregated-refined National Natural Science Foundation of China 22075028 NSFC National Natural Science Foundation of China http://data.elsevier.com/vocabulary/SciValFunders/501100001809 http://sws.geonames.org/1814991/ Beijing Institute of Technology Research Fund Program for Young Scholars 2019CX04092 Beijing Institute of Technology Research Fund Program for Young Scholars http://data.elsevier.com/vocabulary/SciValFunders/501100012236 http://sws.geonames.org/1814991/ The present work is supported by the National Natural Science Foundation of China ( 22075028 ) and the Beijing Institute of Technology Research Fund Program for Young Scholars ( 2019CX04092 ). 0 item S2095-4956(21)00266-7 S2095495621002667 1-s2.0-S2095495621002667 10.1016/j.jechem.2021.04.054 286353 2022-10-29T02:08:15.034045Z 2022-01-01 2022-01-31 1-s2.0-S2095495621002667-main.pdf https://s3-eu-west-1.amazonaws.com/prod-ucs-content-store-eu-west/content/pii:S2095495621002667/MAIN/application/pdf/6239344647c762f7f54c69a8048f4be0/main.pdf main.pdf pdf true 9005470 MAIN 22 1-s2.0-S2095495621002667-main_1.png https://s3-eu-west-1.amazonaws.com/prod-ucs-content-store-eu-west/content/pii:S2095495621002667/PREVIEW/image/png/dee7e9bce8a90b2f6a7101a8467ee421/main_1.png main_1.png png 62751 849 656 IMAGE-WEB-PDF 1 1-s2.0-S2095495621002667-gr10.jpg https://s3-eu-west-1.amazonaws.com/prod-ucs-content-store-eu-west/content/pii:S2095495621002667/gr10/DOWNSAMPLED/image/jpeg/18330febce33bd0ec5a1381c980c9caa/gr10.jpg gr10 gr10.jpg jpg 70722 665 621 IMAGE-DOWNSAMPLED 1-s2.0-S2095495621002667-gr11.jpg https://s3-eu-west-1.amazonaws.com/prod-ucs-content-store-eu-west/content/pii:S2095495621002667/gr11/DOWNSAMPLED/image/jpeg/ebfad754c1f35b7a77b5f89cb451ee24/gr11.jpg gr11 gr11.jpg jpg 105905 598 533 IMAGE-DOWNSAMPLED 1-s2.0-S2095495621002667-gr12.jpg https://s3-eu-west-1.amazonaws.com/prod-ucs-content-store-eu-west/content/pii:S2095495621002667/gr12/DOWNSAMPLED/image/jpeg/9d066d86b1e35548f24fa20f7f674c09/gr12.jpg gr12 gr12.jpg jpg 120829 710 778 IMAGE-DOWNSAMPLED 1-s2.0-S2095495621002667-gr13.jpg https://s3-eu-west-1.amazonaws.com/prod-ucs-content-store-eu-west/content/pii:S2095495621002667/gr13/DOWNSAMPLED/image/jpeg/874314e994aa75f846264739fc5916bc/gr13.jpg gr13 gr13.jpg jpg 106915 614 778 IMAGE-DOWNSAMPLED 1-s2.0-S2095495621002667-gr14.jpg https://s3-eu-west-1.amazonaws.com/prod-ucs-content-store-eu-west/content/pii:S2095495621002667/gr14/DOWNSAMPLED/image/jpeg/8db6ae0a20dbabe5753a60c427b7e3d6/gr14.jpg gr14 gr14.jpg jpg 104580 496 645 IMAGE-DOWNSAMPLED 1-s2.0-S2095495621002667-gr15.jpg https://s3-eu-west-1.amazonaws.com/prod-ucs-content-store-eu-west/content/pii:S2095495621002667/gr15/DOWNSAMPLED/image/jpeg/f540dcf52e5f8eb89786bc83033d2df4/gr15.jpg gr15 gr15.jpg jpg 125505 696 645 IMAGE-DOWNSAMPLED 1-s2.0-S2095495621002667-gr16.jpg https://s3-eu-west-1.amazonaws.com/prod-ucs-content-store-eu-west/content/pii:S2095495621002667/gr16/DOWNSAMPLED/image/jpeg/6e09701437451d6ff929d2131773d4e8/gr16.jpg gr16 gr16.jpg jpg 46565 365 378 IMAGE-DOWNSAMPLED 1-s2.0-S2095495621002667-gr2.jpg https://s3-eu-west-1.amazonaws.com/prod-ucs-content-store-eu-west/content/pii:S2095495621002667/gr2/DOWNSAMPLED/image/jpeg/97eede4621090ddd9d4290f77a3613c0/gr2.jpg gr2 gr2.jpg jpg 205604 856 756 IMAGE-DOWNSAMPLED 1-s2.0-S2095495621002667-gr3.jpg https://s3-eu-west-1.amazonaws.com/prod-ucs-content-store-eu-west/content/pii:S2095495621002667/gr3/DOWNSAMPLED/image/jpeg/ff3644e6f1ea5fbf9e57b42f9c4d5377/gr3.jpg gr3 gr3.jpg jpg 164200 1002 519 IMAGE-DOWNSAMPLED 1-s2.0-S2095495621002667-gr4.jpg https://s3-eu-west-1.amazonaws.com/prod-ucs-content-store-eu-west/content/pii:S2095495621002667/gr4/DOWNSAMPLED/image/jpeg/c3b4c4bc3ff4ced3d0795adbe4929d25/gr4.jpg gr4 gr4.jpg jpg 175247 808 778 IMAGE-DOWNSAMPLED 1-s2.0-S2095495621002667-gr5.jpg https://s3-eu-west-1.amazonaws.com/prod-ucs-content-store-eu-west/content/pii:S2095495621002667/gr5/DOWNSAMPLED/image/jpeg/3afbea729f153400ed6a201a369dd7f8/gr5.jpg gr5 gr5.jpg jpg 127071 684 778 IMAGE-DOWNSAMPLED 1-s2.0-S2095495621002667-gr6.jpg https://s3-eu-west-1.amazonaws.com/prod-ucs-content-store-eu-west/content/pii:S2095495621002667/gr6/DOWNSAMPLED/image/jpeg/280b0ebb95e859294dd85fdae08f8d41/gr6.jpg gr6 gr6.jpg jpg 145686 609 778 IMAGE-DOWNSAMPLED 1-s2.0-S2095495621002667-gr7.jpg https://s3-eu-west-1.amazonaws.com/prod-ucs-content-store-eu-west/content/pii:S2095495621002667/gr7/DOWNSAMPLED/image/jpeg/b0e126bcfc35f9a815476624f65ab63e/gr7.jpg gr7 gr7.jpg jpg 137194 546 645 IMAGE-DOWNSAMPLED 1-s2.0-S2095495621002667-gr8.jpg https://s3-eu-west-1.amazonaws.com/prod-ucs-content-store-eu-west/content/pii:S2095495621002667/gr8/DOWNSAMPLED/image/jpeg/236bcc145b9155ed8a34565c161193ef/gr8.jpg gr8 gr8.jpg jpg 121807 595 645 IMAGE-DOWNSAMPLED 1-s2.0-S2095495621002667-gr9.jpg https://s3-eu-west-1.amazonaws.com/prod-ucs-content-store-eu-west/content/pii:S2095495621002667/gr9/DOWNSAMPLED/image/jpeg/e60b30cd42dbe04b0797272c103136b5/gr9.jpg gr9 gr9.jpg jpg 193935 948 756 IMAGE-DOWNSAMPLED 1-s2.0-S2095495621002667-ga1.jpg https://s3-eu-west-1.amazonaws.com/prod-ucs-content-store-eu-west/content/pii:S2095495621002667/ga1/DOWNSAMPLED/image/jpeg/ce02914fe328c3515691141535e5d4b8/ga1.jpg ga1 true ga1.jpg jpg 22717 200 397 IMAGE-DOWNSAMPLED 1-s2.0-S2095495621002667-gr1.jpg https://s3-eu-west-1.amazonaws.com/prod-ucs-content-store-eu-west/content/pii:S2095495621002667/gr1/DOWNSAMPLED/image/jpeg/a48f4221a3212fe9af2c57c5c43604e6/gr1.jpg gr1 gr1.jpg jpg 68692 529 623 IMAGE-DOWNSAMPLED 1-s2.0-S2095495621002667-gr10.sml https://s3-eu-west-1.amazonaws.com/prod-ucs-content-store-eu-west/content/pii:S2095495621002667/gr10/THUMBNAIL/image/gif/037eaafc74958c18450d05ff44c53cb4/gr10.sml gr10 gr10.sml sml 7101 164 153 IMAGE-THUMBNAIL 1-s2.0-S2095495621002667-gr11.sml https://s3-eu-west-1.amazonaws.com/prod-ucs-content-store-eu-west/content/pii:S2095495621002667/gr11/THUMBNAIL/image/gif/bad837ed5b2cf9740b06bfed81920336/gr11.sml gr11 gr11.sml sml 11404 164 146 IMAGE-THUMBNAIL 1-s2.0-S2095495621002667-gr12.sml https://s3-eu-west-1.amazonaws.com/prod-ucs-content-store-eu-west/content/pii:S2095495621002667/gr12/THUMBNAIL/image/gif/2c6dd7587713017da66a0394d82a8913/gr12.sml gr12 gr12.sml sml 10443 163 179 IMAGE-THUMBNAIL 1-s2.0-S2095495621002667-gr13.sml https://s3-eu-west-1.amazonaws.com/prod-ucs-content-store-eu-west/content/pii:S2095495621002667/gr13/THUMBNAIL/image/gif/38dab072e264f7540177b0ba42927ee1/gr13.sml gr13 gr13.sml sml 11160 164 208 IMAGE-THUMBNAIL 1-s2.0-S2095495621002667-gr14.sml https://s3-eu-west-1.amazonaws.com/prod-ucs-content-store-eu-west/content/pii:S2095495621002667/gr14/THUMBNAIL/image/gif/016a7d0ac048a23533e2d9d49e8288a4/gr14.sml gr14 gr14.sml sml 15541 164 213 IMAGE-THUMBNAIL 1-s2.0-S2095495621002667-gr15.sml https://s3-eu-west-1.amazonaws.com/prod-ucs-content-store-eu-west/content/pii:S2095495621002667/gr15/THUMBNAIL/image/gif/30c3330bbb7641f5f83d91322bc434e0/gr15.sml gr15 gr15.sml sml 11896 164 152 IMAGE-THUMBNAIL 1-s2.0-S2095495621002667-gr16.sml https://s3-eu-west-1.amazonaws.com/prod-ucs-content-store-eu-west/content/pii:S2095495621002667/gr16/THUMBNAIL/image/gif/8e9da439a8755a363031181a5cca3d7e/gr16.sml gr16 gr16.sml sml 13888 164 170 IMAGE-THUMBNAIL 1-s2.0-S2095495621002667-gr2.sml https://s3-eu-west-1.amazonaws.com/prod-ucs-content-store-eu-west/content/pii:S2095495621002667/gr2/THUMBNAIL/image/gif/f5f421aff350f48cdadd76cd25c51191/gr2.sml gr2 gr2.sml sml 11498 164 145 IMAGE-THUMBNAIL 1-s2.0-S2095495621002667-gr3.sml https://s3-eu-west-1.amazonaws.com/prod-ucs-content-store-eu-west/content/pii:S2095495621002667/gr3/THUMBNAIL/image/gif/e1b7d1c6e9faf4540ddeae59a5accc32/gr3.sml gr3 gr3.sml sml 8399 164 85 IMAGE-THUMBNAIL 1-s2.0-S2095495621002667-gr4.sml https://s3-eu-west-1.amazonaws.com/prod-ucs-content-store-eu-west/content/pii:S2095495621002667/gr4/THUMBNAIL/image/gif/b916c2061f97d5d3361dcbddede84e6d/gr4.sml gr4 gr4.sml sml 12249 164 158 IMAGE-THUMBNAIL 1-s2.0-S2095495621002667-gr5.sml https://s3-eu-west-1.amazonaws.com/prod-ucs-content-store-eu-west/content/pii:S2095495621002667/gr5/THUMBNAIL/image/gif/f8f99d79765be01844ee88bb3650ac4f/gr5.sml gr5 gr5.sml sml 10549 163 186 IMAGE-THUMBNAIL 1-s2.0-S2095495621002667-gr6.sml https://s3-eu-west-1.amazonaws.com/prod-ucs-content-store-eu-west/content/pii:S2095495621002667/gr6/THUMBNAIL/image/gif/6be2e2e45ffebe7ceff3fc3f78ec4d9d/gr6.sml gr6 gr6.sml sml 14602 163 209 IMAGE-THUMBNAIL 1-s2.0-S2095495621002667-gr7.sml https://s3-eu-west-1.amazonaws.com/prod-ucs-content-store-eu-west/content/pii:S2095495621002667/gr7/THUMBNAIL/image/gif/4f025685a611b89e4561c0376891e07c/gr7.sml gr7 gr7.sml sml 21920 163 193 IMAGE-THUMBNAIL 1-s2.0-S2095495621002667-gr8.sml https://s3-eu-west-1.amazonaws.com/prod-ucs-content-store-eu-west/content/pii:S2095495621002667/gr8/THUMBNAIL/image/gif/0863a69dc73c17ccb0665789f8d7ff3e/gr8.sml gr8 gr8.sml sml 12890 164 178 IMAGE-THUMBNAIL 1-s2.0-S2095495621002667-gr9.sml https://s3-eu-west-1.amazonaws.com/prod-ucs-content-store-eu-west/content/pii:S2095495621002667/gr9/THUMBNAIL/image/gif/e331c9d5f9b431df4532bb183c99f7d9/gr9.sml gr9 gr9.sml sml 9170 163 130 IMAGE-THUMBNAIL 1-s2.0-S2095495621002667-ga1.sml https://s3-eu-west-1.amazonaws.com/prod-ucs-content-store-eu-west/content/pii:S2095495621002667/ga1/THUMBNAIL/image/gif/bf3ec81247bb0b4f256e4a7105e4098d/ga1.sml ga1 true ga1.sml sml 7244 110 219 IMAGE-THUMBNAIL 1-s2.0-S2095495621002667-gr1.sml https://s3-eu-west-1.amazonaws.com/prod-ucs-content-store-eu-west/content/pii:S2095495621002667/gr1/THUMBNAIL/image/gif/dda8b7cee6f72b2aac364b432d3751ab/gr1.sml gr1 gr1.sml sml 8818 164 193 IMAGE-THUMBNAIL 1-s2.0-S2095495621002667-gr10_lrg.jpg https://s3-eu-west-1.amazonaws.com/prod-ucs-content-store-eu-west/content/pii:S2095495621002667/gr10/HIGHRES/image/jpeg/faa2713bab3f9750fedf6af00caa9ab9/gr10_lrg.jpg gr10 gr10_lrg.jpg jpg 193456 1767 1650 IMAGE-HIGH-RES 1-s2.0-S2095495621002667-gr11_lrg.jpg https://s3-eu-west-1.amazonaws.com/prod-ucs-content-store-eu-west/content/pii:S2095495621002667/gr11/HIGHRES/image/jpeg/7bdd39790c73e152d8b0dfbb8328b3f8/gr11_lrg.jpg gr11 gr11_lrg.jpg jpg 330402 1590 1417 IMAGE-HIGH-RES 1-s2.0-S2095495621002667-gr12_lrg.jpg https://s3-eu-west-1.amazonaws.com/prod-ucs-content-store-eu-west/content/pii:S2095495621002667/gr12/HIGHRES/image/jpeg/b6e221cbd5ed893024b8cb0be37d4027/gr12_lrg.jpg gr12 gr12_lrg.jpg jpg 329970 1887 2067 IMAGE-HIGH-RES 1-s2.0-S2095495621002667-gr13_lrg.jpg https://s3-eu-west-1.amazonaws.com/prod-ucs-content-store-eu-west/content/pii:S2095495621002667/gr13/HIGHRES/image/jpeg/ad1b2afa3648cacb5611650e9c05c6cb/gr13_lrg.jpg gr13 gr13_lrg.jpg jpg 293977 1630 2067 IMAGE-HIGH-RES 1-s2.0-S2095495621002667-gr14_lrg.jpg https://s3-eu-west-1.amazonaws.com/prod-ucs-content-store-eu-west/content/pii:S2095495621002667/gr14/HIGHRES/image/jpeg/c4f044772aeb5387e7546fe0b8591cb6/gr14_lrg.jpg gr14 gr14_lrg.jpg jpg 302159 1316 1713 IMAGE-HIGH-RES 1-s2.0-S2095495621002667-gr15_lrg.jpg https://s3-eu-west-1.amazonaws.com/prod-ucs-content-store-eu-west/content/pii:S2095495621002667/gr15/HIGHRES/image/jpeg/d76b19b9b820d5f2a636a3d4e56b140b/gr15_lrg.jpg gr15 gr15_lrg.jpg jpg 352107 1849 1713 IMAGE-HIGH-RES 1-s2.0-S2095495621002667-gr16_lrg.jpg https://s3-eu-west-1.amazonaws.com/prod-ucs-content-store-eu-west/content/pii:S2095495621002667/gr16/HIGHRES/image/jpeg/14967ae8c7f4f7d0e471d8720dfc674d/gr16_lrg.jpg gr16 gr16_lrg.jpg jpg 129985 969 1004 IMAGE-HIGH-RES 1-s2.0-S2095495621002667-gr2_lrg.jpg https://s3-eu-west-1.amazonaws.com/prod-ucs-content-store-eu-west/content/pii:S2095495621002667/gr2/HIGHRES/image/jpeg/05bcc911da5a9a55b5c343fbe470c37f/gr2_lrg.jpg gr2 gr2_lrg.jpg jpg 648892 2274 2008 IMAGE-HIGH-RES 1-s2.0-S2095495621002667-gr3_lrg.jpg https://s3-eu-west-1.amazonaws.com/prod-ucs-content-store-eu-west/content/pii:S2095495621002667/gr3/HIGHRES/image/jpeg/2040be009fc7e41a260ee687859c74b7/gr3_lrg.jpg gr3 gr3_lrg.jpg jpg 498572 2662 1379 IMAGE-HIGH-RES 1-s2.0-S2095495621002667-gr4_lrg.jpg https://s3-eu-west-1.amazonaws.com/prod-ucs-content-store-eu-west/content/pii:S2095495621002667/gr4/HIGHRES/image/jpeg/d406aae704e8a00e734c7f748ed8372d/gr4_lrg.jpg gr4 gr4_lrg.jpg jpg 525741 2147 2067 IMAGE-HIGH-RES 1-s2.0-S2095495621002667-gr5_lrg.jpg https://s3-eu-west-1.amazonaws.com/prod-ucs-content-store-eu-west/content/pii:S2095495621002667/gr5/HIGHRES/image/jpeg/50f94cf370b401f27c0351fc4b19c3bf/gr5_lrg.jpg gr5 gr5_lrg.jpg jpg 369612 1816 2067 IMAGE-HIGH-RES 1-s2.0-S2095495621002667-gr6_lrg.jpg https://s3-eu-west-1.amazonaws.com/prod-ucs-content-store-eu-west/content/pii:S2095495621002667/gr6/HIGHRES/image/jpeg/78dd4c15d13fa81dd8ec4d8a90230d6a/gr6_lrg.jpg gr6 gr6_lrg.jpg jpg 422673 1617 2067 IMAGE-HIGH-RES 1-s2.0-S2095495621002667-gr7_lrg.jpg https://s3-eu-west-1.amazonaws.com/prod-ucs-content-store-eu-west/content/pii:S2095495621002667/gr7/HIGHRES/image/jpeg/ea4e8d7a082b7982bdcaa65ee8711d98/gr7_lrg.jpg gr7 gr7_lrg.jpg jpg 427029 1451 1713 IMAGE-HIGH-RES 1-s2.0-S2095495621002667-gr8_lrg.jpg https://s3-eu-west-1.amazonaws.com/prod-ucs-content-store-eu-west/content/pii:S2095495621002667/gr8/HIGHRES/image/jpeg/d5569950f95cba2394979b397641ea6d/gr8_lrg.jpg gr8 gr8_lrg.jpg jpg 347905 1579 1713 IMAGE-HIGH-RES 1-s2.0-S2095495621002667-gr9_lrg.jpg https://s3-eu-west-1.amazonaws.com/prod-ucs-content-store-eu-west/content/pii:S2095495621002667/gr9/HIGHRES/image/jpeg/abcaac0d216ce65188a573082a53f6b0/gr9_lrg.jpg gr9 gr9_lrg.jpg jpg 595690 2518 2008 IMAGE-HIGH-RES 1-s2.0-S2095495621002667-ga1_lrg.jpg https://s3-eu-west-1.amazonaws.com/prod-ucs-content-store-eu-west/content/pii:S2095495621002667/ga1/HIGHRES/image/jpeg/88b7672d7750f64fbfbc7eb5c51ac277/ga1_lrg.jpg ga1 true ga1_lrg.jpg jpg 65483 531 1056 IMAGE-HIGH-RES 1-s2.0-S2095495621002667-gr1_lrg.jpg https://s3-eu-west-1.amazonaws.com/prod-ucs-content-store-eu-west/content/pii:S2095495621002667/gr1/HIGHRES/image/jpeg/62b64517b9a86dde84493bfd6d6dce35/gr1_lrg.jpg gr1 gr1_lrg.jpg jpg 203203 1405 1654 IMAGE-HIGH-RES 1-s2.0-S2095495621002667-si1.svg https://s3-eu-west-1.amazonaws.com/prod-ucs-content-store-eu-west/content/pii:S2095495621002667/STRIPIN/image/svg+xml/95f385e6bb4e6a3b2c2fa554c612fe77/si1.svg si1 si1.svg svg 18362 ALTIMG 1-s2.0-S2095495621002667-si2.svg https://s3-eu-west-1.amazonaws.com/prod-ucs-content-store-eu-west/content/pii:S2095495621002667/STRIPIN/image/svg+xml/50607077cd51ad78cf0df448d25bbbb4/si2.svg si2 si2.svg svg 13953 ALTIMG 1-s2.0-S2095495621002667-si3.svg https://s3-eu-west-1.amazonaws.com/prod-ucs-content-store-eu-west/content/pii:S2095495621002667/STRIPIN/image/svg+xml/91be81dcfbae44168bca08cfd97688f2/si3.svg si3 si3.svg svg 12982 ALTIMG 1-s2.0-S2095495621002667-si4.svg https://s3-eu-west-1.amazonaws.com/prod-ucs-content-store-eu-west/content/pii:S2095495621002667/STRIPIN/image/svg+xml/92da95bdbcc2aa5a8e3f4b0bf80ae0e0/si4.svg si4 si4.svg svg 12115 ALTIMG 1-s2.0-S2095495621002667-si5.svg https://s3-eu-west-1.amazonaws.com/prod-ucs-content-store-eu-west/content/pii:S2095495621002667/STRIPIN/image/svg+xml/a6c66484f1d14b2fb01e8d1b69b56860/si5.svg si5 si5.svg svg 9555 ALTIMG 1-s2.0-S2095495621002667-am.pdf am am.pdf pdf 2490933 AAM-PDF https://s3-eu-west-1.amazonaws.com/prod-ucs-content-store-eu-west/content/egi:10488C2T2DM/MAIN/application/pdf/542e14df6b470e193e1c98b598432404/am.pdf JECHEM 1940 S2095-4956(21)00266-7 10.1016/j.jechem.2021.04.054 Science Press Fig. 1 Comparison of multivalent M−S batteries. (a and b) Specific capacity and elemental cost/abundance of S, Al, Mg, K, Na, Li; (c) specific gravimetric/volumetric energy density with electrode reaction and Gibbs free energies. Fig. 2 (a) Schematic diagram of sulfur–carbon composite cathodes confining the shuttle effect, which is reprinted from Ref. [41]. (b) Schematic diagram of regulating electrolyte, which is reprinted from Ref. [42]. (c) Schematic demonstration of functional separator modification. (d) Schematic demonstration of advanced current collector design, which is reprinted from Ref. [43]. (e) Summary of the highlighted progress and strategies of Mg–S batteries over the last ten years, figure i is reprinted from Ref. [38]; figure ii is reprinted from Ref. [39]; figure iii is reprinted from Ref. [44]; figure iv is reprinted from Ref. [45]; figure v is reprinted from Ref. [46]; figure vi is reprinted from Ref. [47]; figure vii is reprinted from Ref. [48]; figure viii is reprinted from Ref. [49]. Fig. 3 (a) Schematic diagram of synthesis process of CMK-3/sulfur composite cathode materials. Reproduced with permission [53]. Copyright 2009, Springer. (b) Schematic diagram of the reaction mechanism of Mg–S batteries with CMK-3/sulfur composite cathodes. Reproduced with permission [40]. Copyright 2015, Wiley. Schematic of sulfur reduction mechanism. (c) The structure of the carbon/sulfur composite cathode. The carbon wall is covered by a sulfur layer. (d) The kinetic processes during discharge. (e) Concentration of Mg in Mg–S binary compound. (f) Sulfur reduction mechanism. Stages I/II involve both surface magnesiation and bulk magnesiation, and Stage III has only bulk magnesiation. Reproduced with permission [52]. Copyright 2017, Wiley. (g, h) Schematic diagram of S K-edge XAS spectra in first discharging process. (i, j) Schematic diagram of S K-edge XAS spectra in first charging and second discharging processes. Reproduced with permission [48]. Copyright 2019, American Chemical Society. Fig. 4 (a) Schematic diagram of the synthesis procedure adopted for synthesizing graphene-based sulfur nanocomposite and SEM image of S-reduced graphene oxide (rGO) composite. Reproduced with permission [45]. Copyright 2016, Royal Society of Chemistry. (b) Schematic diagram of SGDY prepared by thermal synthesis procedure, short-chain polysulfides (1 < x < 5) are confined in the structure. (c) Schematic diagram of the second and third charge/discharge profiles of Mg-SGDY battery at 50 mA g−1. (d) Schematic diagram of cycle stability test at 50 mA g−1. Reproduced with permission [61]. Copyright 2017, Wiley. (e) Schematic diagram of the procedure for synthesizing ZIF-C-S. (f) SEM image of ZIF-C-S with corresponding EDX mapping images of C, N, Co, and sulfur elements. Reproduced with permission [62]. Copyright 2018, Wiley. (g) BET surface area of the nitrogen-doped G-MWCNT nanocomposite. (h) The first, second and 25th charge/discharge profiles of the Mg–S/NC battery at a current rate of 0.02C. (i) Schematic diagram of cycling performance a current rate of 0.02C. Reproduced with permission [63]. Copyright 2019, Royal Society of Chemistry. Fig. 5 (a) The structure of the [Mg2(µ-Cl)3][HMDSAlCl3]. (b) Schematic diagram of the cyclic voltammograms of HMDSMgCl (green), in-situ generated product from the reaction of HMDSMgCl with AlCl3 (3:1) (blue) and the crystalline product (red) applying a scan rate of 25 mV S−1. (c) Cycle performance of discharge and charge of the Mg–S battery at 50 and 25 μA. Reproduced with permission [38]. Copyright 2011, Nature Publishing Group. (d) Cyclic voltammograms of the (HMDS)2Mg-2AlCl3 electrolyte in diglyme (DEG), tetraglyme (TEG). (e) Diglyme(DEG) and PP14TFSI (DEGIL), tetraglyme (TEG) and PP14TFSI (TEGIL). (f) The first charge/discharge curves with different electrolyte using PVDF binders. (g) The cycle performance using PVDF and CMC binders. Reproduced with permission [40]. Copyright 2015, Wiley. (h) The 1st 4th 6th and 8th Charge/discharge profiles of the Mg–S battery in 0.1 M MgHMDS + 1.0 M LiTFSI electrolyte, the arrow indicates the capacity change trend. Reproduced with permission [44]. Copyright 2015, American Chemical Society. Fig. 6 (a) The structure of [Mg4Cl6(DME)6][B(HFP)4]2. (b) Linear sweep voltammogram (LSV) curves using 0.5 M OMBB electrolyte on diverse working electrodes (Cu, SS, Al, GF, and Pt). (c) Polarization properties of Mg/Mg symmetrical cells with the 0.5 M OMBB electrolyte at different current densities. (d) The cycle performance with different cathodes at 0.1C. Reproduced with permission [46]. Copyright 2017, Royal Society of Chemistry. (e) The cycle efficiency of Mg plating/stripping on stainless steel with an MBA-AlCl3/THF electrolyte at different molar ratios of MBA:AlCl3. (f) The different cycle performances with 0.25 mol L−1 BMA + 2AlCl3 + 1.0 mol L−1 LiCl/THF and 0.4 (PhMgCl)2 + AlCl3 + 1.0 mol L−1 LiCl/THF electrolytes. (g, h) The first three discharge and charge curves with 0.25 mol L−1 BMA + AlCl3/THF and 0.25 mol L−1 BMA + 2AlCl3 + 0.5 mol L−1 LiCl/THF. Reproduced with permission [66]. Copyright 2019, Royal Society of Chemistry. (i) Cycle stability of Mg–S battery with Y-based and Al-based electrolyte. Reproduced with permission [67]. Copyright 2019, Wiley. Fig. 7 (a) The schematic design of Mg/MgPS battery with the Y-based electrolyte. (b, c) SEM images of the MgPS cathode discharged to 0.3 V and fully charged in the Y-based and Al-based electrolyte (The red dotted line are aggregated MgS particles). Reproduced with permission [67]. Copyright 2019, Wiley. SEM images of Mg deposited on the Cu substrate from (d, e) Mg(CB11H12)2 and (g, h) Mg(TFSI)2 electrolytes with a constant current at 1 mA cm−2 for 12 h at room temperature. Insets are the digital images of Mg deposited on Cu; SEM image of Mg deposited from (f) Mg(CB11H12)2 and (i) Mg(TFSI)2 electrolytes with EDS mapping. Reproduced with permission [69]. Copyright 2019, American Chemical Society. Fig. 8 (a) Schematic diagram of transformation processes of the Mg deposition/stripping in weak solvation DEG system (a1–a7) and strong solvation TEG system (b1–b7). Reproduced with permission [70]. Copyright 2018, Elsevier. (b) Schematic diagram of a battery with a CNF coated separator. (c) Schematic diagram of the vacuum filtration process. (d) Cycle performance of the Mg–S battery with a CNF coated separator at 0.02C, 0.05C and 0.1C contrast with uncoated separator at 0.02C. Reproduced with permission [73]. Copyright 2016, American Chemical Society. (e) Schematic diagram of the principle of TiS2 with MgS in the battery. (f) Cycle performance of the cell with TiS2 coated separator. Reproduced with permission [48]. Copyright 2016, American Chemical Society. Fig. 9 (a) Schematic diagram of sulfur-carbon composite cathodes confining the shuttle effect. The figure is reprinted from Ref. [102]. (b) Schematic diagram of regulating electrolyte. (c) Schematic demonstration of functional separator modification. (d) Schematic demonstration of advanced current collector design. (e) Summary of the highlighted progress and strategies of Al–S batteries over the last six years, the figure i is reprinted from Ref. [99]; the figure ii is reprinted from Ref. [101]; the figure iii is reprinted from Ref. [103]; the figure iv is reprinted from Ref. [104]; the figure v is reprinted from Ref. [105]; the figure vi is reprinted from Ref. [106]. Fig. 10 (a) Schematic diagram of ultraviolet–visible (UV–vis) spectra of the discharged sulfur cathodes in Li–S, Na–S, and Al–S battery. Reproduced with permission [103]. Copyright 2017, Wiley. (b) Schematic illustration of the first non-aqueous Al–S battery configuration with IL as electrolyte and sulfur element with carbon black as cathode. (c) The Al–S battery discharge curves at 50 mA g−1 with replacing the sulfur cathode. Reproduced with permission [99]. Copyright 2015, Elsevier. (d) The discharge and charge profiles of the Al–S battery at room temperature with ACC/Sulfur cathode at 50 mA g−1. (e) Cycle performance of the battery at 50 and 500 mA g−1. (f) The charge/discharge curve at 50 °C. (g) dQ/dV profiles at different temperatures. Reproduced with permission [101]. Copyright 2016, Wiley. Fig. 11 (a) SEM image of sulfur/CMK-3 cathode. (b and c) C and sulfur distribution maps of the selected region in (a). (b) The discharging/charging curves of the Al–S battery with AlCl3/AcA–1.3 electrolyte at 100 mA g−1. Reproduced with permission [105]. Copyright 2019, Elsevier. (c) Schematic diagram of the preparation process of sulfur/HKUST-1-C. (d) The discharge/charge curves of the cell with sulfur/HKUST-1-C cathode. (e) Cycle stability of the battery with different cathode materials sulfur/HKUSTC-1-C, sulfur/C, and sulfur at 1 A g−1. Reproduced with permission [102]. Copyright 2019, Wiley. Fig. 12 (a) Cycle stability of the battery with (AlCl3)/(Et3NHCl) composite electrolyte adding DCM. Reproduced with permission [100]. Copyright 2015, Elsevier. (b) Schematic diagram of the process enhances the reversibility of the cell. (c) Cycle stability and coulombic efficiencies of the Al–S battery with and without Li salt. Reproduced with permission [104]. Copyright 2018, Elsevier. (d and e) Energy profiles of dissociation reactions of Al2Cl7 – and Al2Cl6Br– anions. (f) The discharge/charge profiles of the Al–S cell with EMIBr/AlCl3 or EMICl/AlCl3 (inset) electrolytes at 251 mA g−1. (g) Cycle performance with the NBMPBr/AlCl3 electrolyte (inset: the first discharge/charge capacity with time) Reproduced with permission [107]. Copyright 2018, Wiley. Fig. 13 (a and b) Energy profiles of dissociation reactions of Al2Cl7 – and [AlCl2·(AcA)2]+. Reproduced with permission [105]. Copyright 2019, Elsevier. (c and d) The first three discharge/charge profiles of the Al–S battery with acetalumina and uralumina electrolytes at 100 mA g−1. Reproduced with permission [106]. Copyright 2020, Wiley. (e) The schematic illustration of the relative concentration of H2S influenced by the electrolyte containing various concentrations of LiTFSI. (f) The first and second discharge/charge curves of the rechargeable aqueous Al–S cell at 200 mA g−1. (g) Galvanostatic discharge profile of the Al–S batteries measured with electrolytes under different configurations. (h) The cycle performance and coulombic efficiency of the cell with Al(OTF)3/LiTFSI/HCl electrolytes. Reproduced with permission [126]. Copyright 2020, Royal Society of Chemistry. Fig. 14 (a) The schematic illustration of the cathode-separator with SWCNT coating assembly for an Al–S battery. Reproduced with permission [103]. Copyright 2017, Wiley. (b) The schematic design of the Al–S battery during the working process with an rGO coated separator. (c) The discharge/charge curves of the cells with cathode/rGO-separator, cathode + separator, and cathode without sulfur at 50 mA g−1. Reproduced with permission [135]. Copyright 2019, Royal Society of Chemistry. Fig. 15 (a) The schematic illustration of the working process of Ca–S battery. (b) The discharge capacity on the various electrolyte composition with a sulfur/CMK-3 cathode. The highest capacity is pure ACN solvent. And the discharge capacity does not increase with the use of a high surface area, porous structured carbon host (sulfur/CMK-3 and sulfur/OMC-8). Reproduced with permission [140]. Copyright 2013, Wiley. (c) Schematic illustration of the preparation process of IL-PLSD and LF-PLSD cathodes. (d and e) Schematic photographs of the dynamic contact angles of PLSD and LF-PLSD with 1 M Zn(TFSI)2 electrolyte. Reproduced with permission [142]. Copyright 2020, Wiley. (f) Schematic illustration of the working mechanism of Fe–S battery. (g) Schematic illustration of the discharge/charge curves of structure conversion process between the S8, FeS2, Fe3S4, and FeS. Reproduced with permission [143]. Copyright 2019, Wiley. Fig. 16 The overview map of future perspectives of multivalent M−S batteries in cathodes, electrolytes, anodes and configurations. Review Multivalent metal–sulfur batteries for green and cost-effective energy storage: Current status and challenges Yue Yang a Haoyi Yang a Xinran Wang a ⁎ Ying Bai a Chuan Wu a b ⁎ a Beijing Key Laboratory of Environmental Science and Engineering, School of Materials Science & Engineering, Beijing Institute of Technology, Beijing 100081, China Beijing Key Laboratory of Environmental Science and Engineering School of Materials Science & Engineering Beijing Institute of Technology Beijing 100081 China Beijing Key Laboratory of Environmental Science and Engineering, School of Materials Science & Engineering, Beijing Institute of Technology, Beijing 100081, China b Collaborative Innovation Center of Electric Vehicles in Beijing, Beijing 100081, China Collaborative Innovation Center of Electric Vehicles in Beijing Beijing 100081 China Collaborative Innovation Center of Electric Vehicles in Beijing, Beijing 100081, China ⁎ Corresponding authors at: Beijing Key Laboratory of Environmental Science and Engineering, School of Materials Science & Engineering, Beijing Institute of Technology, Beijing 100081, China. Beijing Key Laboratory of Environmental Science and Engineering School of Materials Science & Engineering Beijing Institute of Technology Beijing 100081 China Graphic abstract Novel design of multivalent metal-sulfur batteries opens up opportunities for green, energy-dense and cost-effective energy storage with wide applications, such as power gird and portable devices. Multivalent metal–sulfur (M-S, where M = Mg, Al, Ca, Zn, Fe, etc.) batteries offer unique opportunities to achieve high specific capacity, elemental abundancy and cost-effectiveness beyond lithium-ion batteries (LIBs). However, the slow diffusion of multivalent-metal ions and the shuttle of soluble polysulfide result in impoverished reversible capacity and limited cycle performance of M−S (Mg–S, Al–S, Ca–S, Zn–S, Fe–S, etc.) batteries. It is a necessity to optimize the electrochemical performance, while deepening the understanding of the unique electrochemical reaction mechanism, such as the intrinsic multi-electron reaction process, polysulfides dissolution and the instability of metal anodes. To solve these problems, we have summarized the state-of-the-art progress of current M−S batteries, and sorted out the existing challenges for different multivalent M−S batteries according to sulfur cathode, electrolytes, metallic anode and current collectors/separators, respectively. In this literature, we have surveyed and exemplified the strategies developed for better M−S batteries to strengthen the application of green, cost-effective and high energy density M−S batteries. Keywords Multivalent metal-sulfur batteries Cost-effectiveness Green energy storage Shuttle effect Electrolyte 1 Introduction Since the first Industrial Revolution, there is an overwhelming increase in the need for energy. Renewable energy resources, such as biological and geothermal energy, compensate for the deficiencies and shortage of conventional fossil fuels, which have potentially fulfilled the social sustainable development. Nowadays, these renewable energies have already become practically available and achieved promising environmental benign. However, due to the fluctuation of natural resources, their intermittent power supply has blocked the large-scale utilization and the stability of electrical grid. Such unique problem has triggered wide attention to the adaptable rechargeable batteries for energy storage [1–3]. On this matter, lithium-ion batteries (LIBs), such as LiCoO2/graphite or Li(Ni0.8Co0.1Mn0.1)O2/graphite, have dominated the current choice of rechargeable batteries owing to the acceptable energy density and lifespan [4,5]. Nevertheless, large-scale use of LIBs has been potentially restrained by the low contents of lithium, cobalt, and other rare metals, the reserves of which may not be sufficient to support the rapid demands of LIBs manufacturing. Meanwhile, the energy density of current LIBs, which is the most essential parameter for rechargeable batteries, has already approached to the upper limit (~300 Wh kg−1). New electrodes and systems based on abundant and cost-effective elements are urgently required to break through these obstacles [6,7]. For a certain electrode material, the theoretical specific capacity can be determined by Eq. (1) as follows [8,9]: (1) Capacity ( C ) = n F / 3.6 M , where C, F, n, and M represent the theoretical capacity of the electrode material, the Faraday constant, the total electron transferred, and the molar mass of the electrode material, respectively. According to Eq. (1), reducing M or increasing n are both effective ways to improve energy density. In order to maximally fulfill the criteria, in this regard, sulfur is highlighted because of relatively low molar weight [10–13], two-electron transfer [14], and high crustal content [15,16]. It can provide a theoretical specific capacity as high as 1672 mAh g−1 [17] with respect of Li+, triggering wide interests to its alloying-type electrode reaction [18–21]. For example, the lithium–sulfur (Li–S) battery has become the most widely-explored M−S battery systems with continuous outcomes and performance upgradation. However, the current status of Li–S battery is still subject to many other restrictions, such as the scarcity of lithium resources and safety issues [22–25]. Even with relatively lower theoretical energy density, the researches on light-weight univalent metal-sulfur batteries, such as potassium–sulfur (K–S) and sodium–sulfur (Na–S) batteries, can alleviate the shortage of lithium resources. For comparison, when coupled with a sulfur cathode, light-weight multivalent metals can alternatively provide an even higher theoretical specific capacity, such as magnesium (Mg) and aluminum (Al) with a theoretical volumetric capacity of 1820 and 2424 Ah L−1, respectively [26–28]. Furthermore, the volumetric energy density of magnesium–sulfur (Mg–S) and aluminum–sulfur (Al–S) batteries even surpass that in Li–S (Fig. 1 ), which are particularly available for stationary energy storage and smart grid regulation [29,30]. Though being promising, these M−S batteries suffer from fundamental problems: (1) the elemental sulfur has intrinsically poor electronic conductivity [31]; (2) both sulfur cathode and multivalent metallic anode occur multi-electron reactions with insufficient electrochemical kinetics [32–34]; (3) passivation of these metal anodes generally blocks the ion/electron transfer, requiring corrosive electrolyte systems yet with minimum side reactions [35]; (4) shuttle effect of sulfur destroys the interface stability, induces low coulombic efficiency, and shortens the operational lifespan of multivalent M−S batteries [32,36,37]. The purpose of this article is to summarize the development of mainstream Mg–S, Al–S, and other novel types of multivalent M−S batteries. Concerning the problems that multivalent M−S batteries encounter, we consequently disclose the reaction mechanisms of sulfur, thoroughly explain the current progress in terms of electrolytes, electrodes and separators, and briefly introduce the strategy to enhance the overall battery performances. Last but not least, the metal electrodes design and interface issues are introduced, which have become the detrimental factor to typical M−S batteries with passivated interlayers during electrochemical process. Meanwhile, we summarize the current status and promising perspectives of multivalent M−S batteries upon the great development and research opportunities in future. 2 Mg–S Batteries Toyota Motor research group [38] reported the first rechargeable Mg–S battery in 2011. They synthesized a non-nucleophilic electrolyte through the reaction of hexamethyldisilazide magnesium chloride (HMDSMgCl) and aluminum trichloride (AlCl3). The as-formed active molecular species [Mg2(µ-Cl)3·6THF]+ can guarantee the reversibility of Mg2+/Mg. It is revealed from this research that the regulation of electrolytes plays a significant part in the success of the Mg–S battery. In 2014, researchers found that the electrolytes containing magnesium(II) bis(trifluoromethane sulfonyl) imide [Mg(TFSI)2], [Mg2(Cl)3] [HMDSAlCl3]− active species [39,40] can also realize the Mg stripping/deposition. It contributes to an excellent anodic stability by forming an appropriate solvation sheath structure based on ion–dipole interaction to dissociate the highly concentrated Mg salt. Till now, several other types of research have been also carried out on sulfur cathode, Mg anode and the electrolytes, promoting the development of Mg–S system. For example, the sulfur cathode modification can synergistically mitigate the overcharge behavior, ameliorate sulfur utilization and improve its compatibility with the electrolyte. The research direction and progress highlighted in the case of Mg–S batteries over the last ten years have been summarized as follows (Fig. 2 ), including the sulfur-carbon composite cathodes, electrolyte regulation, functional separator modification and advanced current collector design. We elaborate on the status and problems of the cathode from the electrolyte, current collector, and separator aspects, respectively. 2.1 Cathode materials Analogous to Li–S battery, the problem of the cathode in M−S battery includes the shuttle effect of sulfur [50], which causes the low sulfur utilization, poor coulombic efficiency [51], and the attenuated battery life [13]. The charge/discharge mechanism of polysulfide is summarized and the mostly-applied sulfur–carbon composites are introduced to enhance electrochemical performance by suppressing the diffusion of polysulfide. 2.1.1 Charge/discharge mechanism of polysulfide At present, there is no well-defined reaction path for Mg and sulfur to form Mg polysulfide. Scholars generally believe that the reaction mechanism is similar to that of the Li–S battery. Mg polysulfide with different chain lengths (such as MgS4, Mg3S8, and MgS2) are formed in multi-step reactions [40,52]. Specifically, the electrochemical reaction path of the Mg–S battery in the first cycle is shown in Fig. 3 b by using (HMDS)2Mg-2AlCl3-MgCl2/tetraacetamine electrolyte and sulfur/CMK-3 composite cathode (Fig. 3a) [40]. In particular, S8 is first reduced to the polysulfide S8 − and dissolved into the electrolyte, then gradually reduced to S6 − and S4 − to form a stable phase MgS4. During the discharging process, a plateau of ~ 1.5 V appears, corresponding to a specific capacity of 370 mAh g−1 [40]. This process can be written as follows: (2) S 8 + 4 e - + 2 M g 2 + = 2 M g S 4 The stable liquid MgS4 intermediate continues to be transformed into MgS2 solid phase, contributing to the second discharging stage of ~ 0.9 V with a specific capacity of 420 mAh g−1 (Fig. 3b and Eq. (3)) [40]. The final process associates with the reduction of the MgS2 solid phase into a stable MgS phase. (3) 2 M g S 4 + 4 e - + 2 M g 2 + = 4 M g S 2 (4) 2 M g S 2 + 4 e - + 2 M g 2 + = 4 M g S These three steps reflect the multiple-phase transition reactions and valence changes involved in the initial discharge process. More recent, Gao et al. [52] studied the thermodynamics, reaction pathway, and related kinetics of the Mg–S battery by using activated carbon clothes (ACC)/sulfur cathode and MgTFSI2-1,2-dimethoxyethane (DME) electrolyte. According to their observation, the sulfur reduction could be divided into three steps: (1) the sulfur element is first reduced to the polysulfide (S8 −) chain, showing a slope voltage drop to 1.5 V without an obvious discharge platform. (2) The S8 − is further reduced, and the liquid–solid phase transformation (according to the electrospray-ionization mass spectrometry) [52] is realized from S8 − to MgS2, which has a stable discharge plateau of 1.5 V. (3) The final step of solid-phase transformation from short-chain polysulfide MgS2 to MgS. The MgS2–MgS transition process is suffering from large kinetic barriers and high polarization with a voltage drop of 1.5–0.5 V [52]. The corresponding reaction mechanism of sulfur is shown in Fig. 3(c–f). The composite cathode materials of CMK-3/sulfur and ACC/sulfur have very similar electrochemical reaction mechanisms under different electrolyte conditions. Furthermore, in 2019, Xu and his collaborative research team [48] discovered the fading mechanism by studying the properties of polysulfide through the spin-polarized density functional theory (DFT) method. The structures of Mg x S8 (x = 1, 2, 3, 8) are amorphous, while the most stable structure MgS is crystalline [48]. The results of in-situ X-ray absorption spectroscopy (XAS) measurements (Fig. 3g–j) show that the conversion from Mg3S8 to elemental sulfur is irreversible. After the first cycle, the conversion from Mg3S8 to MgS contributes to the major reversible capacity of about 400 mAh g−1 because MgS is unfortunately electrochemically inactivated [48]. The study on the electrochemical mechanism of the Mg–S battery system can theoretically grasp the reaction mechanism of amorphous phase formed by intermediate products and overcome the shuttle effect of Mg polysulfide, but it still requires more effort and insights. 2.1.2 Sulfur-carbon composite cathodes The structural design of sulfur cathode in Mg–S battery draws lessons from the Li–S battery system. The sulfur-carbon composites are still the most effective cathodes to synergistically improve the conductivity and the utilization of sulfur [54–56]. In 2011, Hee-Soo Kim from Toyota [38] proposed a pioneering work to introduce sulfur/carbon black composite materials into Mg–S battery. A variety of carbon substrates have been applied accordingly for the encapsulation of sulfur-based and polysulfides. The most representative work is proposed by Nazar group [53] in 2009, which first introduced the CMK-3/sulfur composites to M−S batteries. After fully mixing CMK-3 with sulfur, the mixture was evaporated at 155 °C for 12 h to sublimate the sulfur-based materials into mesoporous materials with a pore size of 3–4 nm. This compositing process can improve the electrical conductivity, and immobilize polysulfide inside the mesopore to restrain the polysulfide shuttle (Fig. 3a) [53]. Maximilian Fichtner group [40] further optimized the preparation process by pretreating CMK-3 with concentrated nitric acid and uniformly covering the CMK-3/sulfur surface with polyethylene glycol (PEG). The effect of confining sulfur was greatly improved because of additional heat treatment at 400 °C [40]. Other carbon materials, such as carbon nanotubes (CNTs) [57], CNFs [39,58], graphene-based nanostructures (Fig. 4 a) [45], and ACC [48,59,60], have been also used in Mg–S batteries. In addition, other types of carbon materials have been also applied, broadening other possible directions for sulfur-carbon compositing. Du et al. [61] synthesized sulfur-based graphdiyne (SGDY) materials as a cathode with all phenyl complex (APC) electrolytes. Graphdiyne is a layered structure composed of benzene rings and connected by butadiyne linkages [61] (shown in Fig. 4b), which can immobilize sulfur and its polysulfide into nanostructures. The designed SGDY cathode can achieve an initial discharge capacity of 1125 mAh g−1 and maintain a cycle capacity of 540 mAh g−1 after 35 cycles [61]. But there was serious overcharge phenomenon in the system, and the battery failed after 36 cycles (Fig. 4d) possibly due to electrolyte consumption or battery corrosion [61]. The use of metal–organic framework (MOF) and its derivatives is another example to achieve a high-performance Mg–S battery by nanostructuring with carbon materials. Zhou and coworkers [62] introduced MOF–templated carbon as a sulfur host with nitrogen and cobalt doping (Fig. 4e and f) that could trap polysulfide through strong chemical interactions. The ZIF-C-S composite will inspire more researchers to pursue the design of a framework, which possess ultrahigh surface area and diverse structural topologies. The unique architecture is beneficial for infiltration of sulfur as well as charge and mass transfer during electrochemical reaction. One-dimensional and two-dimensional carbon materials with a large surface-volume ratio are also mentioned to be promising regarding the polysulfide dissolution. By applying nitrogen-doped hybrid nanocomposite of multiwall carbon nanotubes (MWCNTs) and graphene, the Fichtner research team [63] designed cathode hosts for Mg–S batteries. These more accessible conductive host matrix can also improve the restriction of polysulfides and supply an efficient charge transport [63]. Such nanocomposite has advantage of high Brunauer-Emmett-Teller (BET) surface area of 644 m2 g−1 (Fig. 4g) with sulfur loading of 76.2 wt%. In the sulfur loading of 3 mgsulfur cm−2, the battery can deliver an initial capacity of 431 mAh g−1 (Fig. 4h) and a reversible capacity of 228 mAh g−1 after 50 cycles at a current rate of 0.02C (Fig. 4i) [63]. 2.2 Electrolytes The ideal properties of electrolytes for Mg–S batteries should include: (1) High ionic conductivity with high permittivity and low viscosity; (2) Chemical and electrochemical stability with relatively wide electrochemical window; (3) Good thermal stability in a broad range of temperature; (4) Sufficient interface stability with electrodes and current collectors; (5) Safety, environmental protection, and low cost. For the exploitation of new electrolytes, it is still challenging to meet the criteria of (1), (2), and (4). Especially for Mg–S batteries, it is difficult to find suitable electrolytes to cover the theoretical potential of magnesium and sulfur reactions while realizing sufficient reaction reversibility. Additionally, the electrolyte should be ideally side-reaction free while being poor solvents for polysulfide dissolution. At present, the commonly used electrolyte of Mg batteries are nucleophilic, but the sulfur cathodes are unfortunately incompatible with nucleophilic electrolytes [64,65]. Therefore, it is particularly important to develop new types of non-nucleophilic electrolytes for the Mg–S battery. 2.2.1 Non-nucleophilic electrolyte The non-nucleophilic electrolyte of Hauser base-derived magnesium HMDSMgCl and AlCl3 has proved the feasibility of Mg–S battery for the first time [38], which opens up a new way for the exploitation of non-nucleophilic electrolyte for Mg–S battery. They modified HMDSMgCl electrolyte to form an active species of [Mg2(µ-Cl)3][HMDSAlCl3] (Fig. 5 a) [38]. The characteristics of cyclic voltammetry tests are shown in Fig. 5(b) among unmodified HMDSMgCl, in-situ generated [Mg2(µ-Cl)3][HMDSAlCl3] and [Mg2(µ-Cl)3][HMDSAlCl3] electrolytes, which were purified and crystallized by tetrahydrofuran (THF) solvent. The potential stability of [Mg2(µ-Cl)3][HMDSAlCl3] electrolyte was greatly increased from 2.5 to 3.3 V after purification by THF. This significant increase in potential stability was resulted from the purification step to remove unreacted HMDSMgCl in the electrolyte, which starts to decompose at 2.5 V [38]. The cycle performance of the battery (Fig. 5c) shows that the initial open-circuit voltage (0.55 V) is quite different from the theoretical one (1.77 V). It largely results from the oxide layer on the Mg electrode. The initial discharge capacity reached up to 1200 mAh g−1 [38], whereas a rapid decrease of discharge capacity occurred at the second cycle (394 mAh g−1). Fichtner and coworkers [40] further developed a different approach of one-step reaction between hexamethyldiishydrazine, [(HMDS)2Mg] and AlCl3 in diglyme (DEG) and tetraglyme (TEG). These reaction species prevents the formation of metal–carbon bonds and yields an Mg complex [40]. It was found that the [Mg2Cl3][HMDSAlCl3] active species formed accordingly, which supported the successful deposition and dissolution of Mg (Fig. 5d) [40]. Furthermore, by adding ionic liquid (IL) of N-methyl-N-butylpiperidinium bis(trifluoromethanesulfonyl)imide (PP14TFSI), the solubility of the Mg polysulfide might be declined due to the weak coordinating of TFSI− in ILs with relatively low donor numbers [40] (Fig. 5e). The comparison shows that the electrochemical performance of IL-containing electrolyte is better and two discharge plateaus are presented similar to that of Li–S batteries (Fig. 5f). Using this optimized electrolyte with DEG and PP14TFSI, the initial discharge capacity of the Mg–S battery can reach up to 800 mAh g−1 and the specific capacity remains 280 mAh g−1 after 20 cycles (Fig. 5g) [40]. The electrochemical reversibility of discharge products in the electrolyte is important to realize the long cycle of Mg–S batteries. In 2015, Gao et al. [44] added LiTFSI to the 0.1 M (HMDS)2Mg-2AlCl3-MgCl2 electrolyte, and the mixed electrolytes can enable a reduced voltage hysteresis, showing a stabilized discharge plateau at 2.8 V (Fig. 5h). By sharp contrast, the discharge specific capacity of the LiTFSI-free electrolyte is only about 10 mAh g−1. Due to the formation of hybrid magnesium-lithium polysulfide (MgLi–PS), the kinetic barrier of the Mg polysulfide system decreases, and a discharge capacity of 1000 mAh g−1 can be maintained at 0.03C for more than 30 cycles [44]. Attempts have also been made for the development of novel Mg–S electrolytes by introducing organic magnesium borates-based electrolyte (OMBB) from tris(hexafluoroisopropyl) borate (B[HFP]3), MgCl2, and Mg powder in dimethyl ether [46]. The electrolytes contain different active species in the form of [Mg4Cl6(DME)6]2+, and tetra(hexafluoroisopropyl) borate anion ([B(HFP)4]−) (Fig. 6 a) [46], which can effectively reduce the energy required for Mg deposition and improve the reversible cycling of the system. Under the optimal condition [46], the potential stability on platinum can reach up to 3.3 V (vs. Mg/Mg2+) (Fig. 6b). Furthermore, the deposition/dissolution polarization is lower than 0.11 V (Fig. 6c). The compatibility of the electrolytes with different sulfur-based cathode materials was also examined, and the sulfur/CNT cathode material presents the optimized specific capacity of 1000 mAh g−1 at 0.1C (Fig. 6d). An original Mg bis(diisopropyl)amide (MBA)-based electrolytes have also been developed for Mg–S batteries [66]. By adjusting the ratio of MBA and AlCl3 in THF solution, the cycling performance of the rechargeable Mg–S batteries has been improved. Fig. 6e shows that the AlCl3 content improves the cycle stability of Mg–S battery to a great extent because the molar ratio of MBA to AlCl3 can affect the Mg plating/stripping and oxidative decomposition potential of the electrolytes [66], and the coulombic efficiency maintained at 99% after 200 cycles at a molar ratio of 1:2 (MBA/AlCl3). At the same time, the composite electrolyte with high AlCl3 content also shows excellent cycle stability and discharge specific capacity retention, which is better than APC nucleophilic electrolyte, i.e. (PhMgCl)2-AlCl3/THF (Fig. 6f). Interestingly, the researchers also explored the role of lithium chloride (LiCl) in the composite electrolyte [66]. Fig. 6(g and h) illustrates that the discharge plateau of the LiCl system is significantly increased to about 1.1 V and the discharge capacity can reach 800 mAh g−1, three to four times higher than that without LiCl. And the specific capacity remains 537 mAh g−1 after 30 cycles [66]. This proves the importance of lithium salt in Mg–S electrolyte, which can effectively reduce the content of Mg polysulfide and improve the oxidation kinetic energy barrier of the system. Adding appropriate additives is effective for electrolyte optimization. Gao et al. [58] added MgCl2 to the Mg(TFSI)2-based electrolyte in dimethoxyethane (DME). It can form [Mg2(μ-Cl)3]+active species, while chloride ion helps to remove the passivation layer on the Mg electrode [58]. Similarly, AlCl3 was added as Lewis acid to improve the deposition and dissolution of Mg and reduce the overpotential of the system [59], but the discharge capacity decreased rapidly after two cycles to about 50 mAh g−1 after 50 cycles. It was deduced to result from the insufficient reaction of sulfur in the electrolyte and the low dissociation of magnesium-ions. Meanwhile, Wang et al. [59] added LiCl and LiCF3SO3 to the electrolyte respectively, and found that the latter had a higher discharge specific capacity of 1200 mAh g−1 in the first cycle. After 50 cycles, the capacity is still about 400 mAh g−1. All these cases indicate that the selection of appropriate lithium salt additives can regulate the oxidation kinetics energy barriers of Mg polysulfides and greatly ameliorate the property of Mg–S battery. 2.2.2 Novel non-corrosive electrolyte Chlorides are generally considered to cause corrosion and side effects, which exist in most of the current electrolytes for Mg–S batteries. Therefore, it is of great significance to develop a new type of non-corrosive electrolyte. Li et al. [68] synthesized [Mg(THF)6][AlCl4]2 to replace MgCl2, which effectively restrains the corrosion of the system, but the cycle performance decreases to a certain extent. The initial discharge capacity can reach 700 mAh g−1 at 0.01C, but the cycle stability is not desired as only a capacity of 130 mAh g−1 remained after 19 cycles [68]. Inspired by the addition of AlCl3 as Lewis acid additives, Xu et al. [67] synthesized yttrium chloride (YCl3) type non-corrosive electrolyte (Fig. 7 a). Compared with aluminum-ion (Al3+), yttrium-ion (Y3+) has a lower standard electrode potential, which prevents Y3+ from depositing on the Mg electrode. In contrast to Al-based electrolytes, the YCl3 additive can inhibit the aggregation of MgS particles, which results in a conspicuously increased sulfur utilization (Fig. 7b and c). At the same time, YCl3 is very reactive with water to particularly eliminate trace water in the electrolyte, which inhibits the formation of the oxide layer on the surface of anode. Compared with the Al-based electrolyte where the battery attenuated to 50 mAh g−1 after 50 cycles, the capacity in such electrolyte can maintain above 900 mAh g−1 (Fig. 6i) [67]. Up to now, researchers continue to broaden the types of non-corrosive electrolytes, for example the weak coordination anion (WCAs) electrolyte with low nucleophilic and high solubility. Zhao-Karger research team [57] synthesized magnesium fluoroalkoxy borate electrolyte, which is considered to be a candidate WCAs electrolyte for Mg–S battery system. Moreover, Guo et al. [69] investigated the Mg/electrolyte interface, which is derived from two WCAs electrolytes: magnesium monocarborane (Mg(CB11H12)2) and Mg(TFSI)2. They found that Mg(CB11H12)2 has superior Mg plating-stripping property than that of Mg(TFSI)2. Due to the cathodic stability of (CB11H12)− anions, there is smooth deposition with almost no aggregated particles formed during Mg plating process (Fig. 7d–h). On the other hand, Mg (TFSI)2 has inferior performance because of its more severe passivation layer formation of MgS and S–O bonds (Fig. 7f and i). The current development trend of non-corrosive electrolyte and electrolyte additives is still far from the demand of commercialization that requires much attention and effort. 2.3 Magnesium anodes The metallic anode is one of the most essential components in the multivalent M−S battery system as the anode, greatly determining the long-term cycling of batteries. At present, most commercial LIBs use carbon materials as anode [35], while metallic anode regains the attention of researchers to achieve a high energy density of the cell up to 500 Wh kg−1. Likewise, Mg, Ca, Al, and other metals can be used as anodes for metal-ion batteries and multivalent M−S batteries, but they need to overcome some problems for practical use, such as poor compatibility between the metal anode and electrolyte, poor surface contact with the electrolyte, and poor cycle stability. Compared with reactive metals (Li and Na), Mg is stable in air and can be easily processed in general, which greatly improves the safety and stability of the battery. In the Mg batteries, polar non-proton solvents such as carbonate and nitrile can form a passivation layer that hinders the diffusion of metal ions on the electrode surface through self-hydrolysis or reaction with a trace amount of water. In different ether-based electrolytes, Hu et al. [70] observed the Mg deposition/stripping process at the anode/electrolyte interface of Mg–S batteries through electrochemical atomic force microscopy (AFM) (Fig. 8 a). The TEG-based electrolyte system showed better reversibility because the TEG system could reduce the desolvation process to achieve more uniform nucleation and crystallization, while the DEG system has rapid dynamics. At present, there are many studies on the electrolyte in the Mg batteries, but fewer researchers modify the Mg electrode to adapt the electrolyte and so on. Most of the electrode is composed of metal Mg, while a small part is a mixture of magnesium and carbon materials. Metallic Mg in form of Mg discs [39,71], plates [44], ribbons [59], or foils [39,46,57,60,62,72,73], provides magnesium sources for magnesium-ion batteries. These electrodes have dense surface layers that cause the poor contact of electrodes with the electrolyte and low utilization. To address the above issues, Friedrich and co-workers [74] proposed to use Mg and graphite powder to prepare powder-based Mg anode. They set the mass ratio of Mg powder to graphite powder at 4:1, different anodes were prepared by ball milling and hydraulic press under the conditions of 75 and 350 MPa, respectively [74]. In this regard, pressed anode at low pressure (PALP) had a higher specific surface area and better contact with the electrolyte, and the specific discharge capacity of PALP could reach 600 mAh g−1 in the first cycle. Another optimization idea of Mg anode refers to the intercalated anode material in LIBs [75–77], which can realize the intercalation and de-intercalation of Mg ions. In particular, intercalation compounds can reduce the anode volume expansion and inhibit the formation of magnesium oxide passivation film as well, but so far there is no related report on such application in Mg–S battery. The alloying phenomenon of Mg metal with other elements serves a novel direction for the Mg2+ and Mg–S battery, Liu and co-workers [75] used bismuth metal nanostructure alloyed anode material for magnesium-ion battery, it can adapt to the large volume change of the system and reduce the diffusion length of Mg2+ [75]. Similarly, a conductive interface can be designed on the surface of an Mg electrode concerning the current popular lithium metal battery artificial solid electrolyte interface (SEI), such as adding a conductive ultra-thin physically deposited atomic layer of Mg anode to inhibit the corrosion of Mg during charging [78]. 2.4 Current collector and separator modification for Mg–S battery The modification of current collectors and separators is obviously effective in stabilizing the sulfur cathode and metal anode interfaces. At present, collectors in LIBs are Al foil [79,80], copper foil [81,82], stainless steel foil [83,84] and surface carbon-coated Al foil [85,86]. Unfortunately, the electrolytes available for the Mg–S battery contain corrosive substances, such as halogen, so it is impossible to use these traditional current collectors. Theoretically, the copper foil will react with halogen-containing electrolytes. However, Zeng et al. [65] found that when copper was used as a current collector, the sulfur cathode can stably exist in nucleophilic electrolyte APC. It is because the Cu can react with sulfur to form Cu sulfides, and can provide a strong chemical interaction between Cu and sulfur, which increases its stability with nucleophilic electrolyte APC. Inspired by this work, other researchers found that copper foils can also be compatible with other electrolytes, such as OMBB [46] and MBA electrolyte [66]. In addition to the traditional current collector, the most commonly applied corrosion-resistant current collectors are molybdenum foil, titanium foil, carbon paper, and chromium-nickel–iron alloy Inconel 625. At present, only chromium-nickel–iron alloy Inconel 625 is used as the current collector in the Mg–S battery. Muthuraj et al. [47] creatively developed a kind of double-doped carbon cloth (DCC) that can not only resist corrosion but also absorb polysulfide as the current collector. The current collector with a three-dimensional porous structure has excellent conductivity and good stability. Using HMDS as electrolyte and S/rGO as a cathode material, the battery can offer a specific capacity of 388 mAh g−1 after 40 cycles [47]. The current collector for the future Mg–S battery is expected to possess high conductivity, high stability, adsorption of polysulfide, and high catalytic properties. The use of a modified separator is mainly to solve the shuttle effect of polysulfides. The main types of separators for traditional LIBs are polyethylene (PE) and polypropylene (PP), while the separators for M−S batteries are mainly glass fibers and other polymer separators, such as microporous polymer membranes. In Mg–S batteries, Yu et al. [73] proposed to use a CNF-modified glass fiber separator (Fig. 8b and c). The optimal discharge specific capacity of the CNF-modified battery system is approaching to 1200 mAh g−1, and the specific capacity maintains at 800 mAh g−1 after 20 cycles [73]. By comparison, the specific capacity of the unmodified separator battery can only reach 200 mAh g−1 after 20 cycles (Fig. 8d). The immobilization of polysulfide intermediates contributes to the improved stability and sulfur utilization. Metal sulfides are also used and proved to be effective to stabilize polysulfides in Mg–S batteries. Xu and co-workers [48] proposed to use a vacuum filtration process to modify the TiS2 layer on the separator. The introduction of the Ti–S bond and the catalysis of Ti atoms are able to absorb and catalyze polysulfide and improve the overall electrochemical kinetics. Furthermore, the researchers confirmed that the TiS2 can break the Mg–S bond and successfully reoxidize MgS and Mg3S8 back to higher-order polysulfides and S (Fig. 8e), and this structure can deliver 800 mAh g−1 for 30 cycles (Fig. 8f) [48]. 3 Al–S batteries The theoretical gravimetric capacity of Al metal reaches up to 2980 mAh g−1, with a volumetric capacity of 8040 mAh cm−3 [87], which is the highest among these light-weight multivalent metals. As an additional bonus, aluminum is the most abundant metal element in the earth’s crust, which is potential to be cost-effective [88,89]. Al–S battery combines the characteristics of light elements multi-electron reaction of both cathodes and anodes with great potentials for high energy density. Because of the amphoteric nature of Al, most electrolytes are not able to achieve feasible Al deposition and dissolution. The exception is the AlCl3-based ILs, which is capable of reversible Al deposition [90], and have been widely used for rechargeable aluminum batteries recently [91–97], therefore indirectly promotes the development of Al–S battery [98]. Archer et al. [99] proposed a rechargeable Al–S battery with such non-aqueous IL electrolytes. Inspired by their work, a series of achievements have been made in this field in the past six years. Wu et al. [100] developed a new type of Et3NHCl/AlCl3 IL electrolyte and optimized the performance by adding 1,2-dichloroethane (DCE), dichloromethane (DCM), and other additives, but the discharge specific capacity was limited to be only 1/10 of the theoretical one. In 2016, Wang and his colleagues [101] used the selected 1-ethyl-3-methylimidazolium chloride (EMICl)/AlCl3 (1:1.3) IL as the electrolyte and achieved a capacity of more than 1000 mAh g−1 for 20 cycles. Similarly, the research direction and highlighted progress of the Al–S batteries over the last six years have been summarized as follows (Fig. 9 ). 3.1 Cathode materials In the rechargeable Al–S battery, the strong solvation of multivalent Al3+ and extremely high intrinsic charge density will lead to slow diffusion and high reaction energy barrier, which leads to poor electrochemical kinetics and polarization of the battery. This part summarizes the current electrochemical behavior of polysulfide in IL electrolyte and the development of sulfur–carbon cathode, which improves electrochemical performance by suppressing the diffusion of polysulfide and increasing the conductivity of the cathode. 3.1.1 Electrochemical behavior of polysulfide in IL electrolyte In 2016, Wang et al. [101] put forward that the total reaction of the Al–S battery is a solid-state reaction process: 3 S + 2 A l = A l 2 S 3 , and it does not involve the multiphase reaction process. However, Manthiram et al. [103] proved that if the x number of S x 2− (1 ≤ x < 6) in the Al–S system is less than 6, it will be insoluble in EMICl/AlCl3 (1:1.3) IL electrolyte, and otherwise the S x 2− are soluble (Fig. 10 a). This shows that the dissolution of long-chain sulfur in the electrolyte can be controlled by optimizing of electrolyte, and the electrochemical reversibility of the Al–S battery can be improved by inhibiting the shuttle of short-chain sulfur through physical limitation and chemical bonding. At the same time, the poor conductivity of sulfur and the slow kinetics are also important factors that hinder the stable cycle of the battery. To solve these problems the design of efficient sulfur cathode materials is indispensable. 3.1.2 Sulfur–carbon composite cathodes Using carbon materials and sulfur composite is the most-applied approach to enhance the conductivity. In 2015, Archer et al. [99] designed the first rechargeable Al–S battery with non-aqueous IL as the electrolyte. The cathode was made by mixing sulfur element with carbon black (Ketjen black carbon) (Fig. 10b) and it delivered a discharge specific capacity of 1300 mAh g−1 after 6 cycles (Fig. 10c) [99], which shows the acceptable reversibility of Al–S battery. Wang et al. [101] optimized the electrolyte ratio and compounded sulfur with ACC, and they made sulfur sublimation evaporation into carbon pores (carbon pore diameter ≤ 2 nm) at 155 °C. Through these measures, the battery could achieve stable cycle stability of 20 cycles and deliver a capacity of more than 1000 mAh g−1 (Fig. 10d and e). When elevating the experimental temperature to 50 °C [101], the polarizations was greatly reduced (Fig. 10f) and the voltage hysteresis was declined to 0.5 V (Fig. 10g). Manthiram et al. [103] designed a new type of sulfur cathode structure and dispersed S/Al[EMI]Cl4 slurry onto CNF to construct self-assembled cathode materials. This structure can achieve maximum contact with active species in the electrolyte and inhibit the shuttle effect of polysulfide. At present, the most widely-used sulfur cathode in Al–S battery is CMK-3/sulfur composite (Fig. 11 a) [105,107], which restricts the sulfide in the channel and enhances the electrical contact of sulfur-based cathode materials. This structure can serve as a pathway for the reaction with sulfur and promote the redox kinetic process. Although great progress has been made by the cathode optimization [105], the overall stability of these Al–S prototypes is far from satisfactory (Fig. 11b). Despite this physical confinement by porous carbon materials, other adsorption materials, such as GO/rGO [108–111], MOF [112–114], and MXene [115–117], can inhibit polysulfides through chemical bonding. The MOF-modified composite cathode (immobilized sulfur on carbonized HKUST-1 (sulfur/HKUST-1-C)) can form Cu x S ion clusters with polysulfides. The strong interaction between the polysulfides and the Cu nanoparticle surface can enhance the reversibility of sulfur in the charge and discharge process (Fig. 11c) [102]. Besides, the Cu in HKUST-1 also increases the electronic conductivity of the cathode interface, which narrows the kinetic barrier in the electrochemical conversion process. In this system, it can deliver a high discharge specific capacity of 1200 mAh g−1 in the first cycle (Fig. 11d) with a reversible capacity of 460 mAh g−1 after 500 cycles (Fig. 11e) [102]. Similarly, Guo et al. [118] used Co as an electrochemical catalyst which formed cobalt sulfides to increase the reaction activity and reduce the voltage hysteresis. Despite sulfur–carbon composites, other new composites of metal nanoparticles [119], sulfur-based materials [120], and self-assembly systems [121] are the potential directions to enhance the electrical conductivity and realize the physical limitation and chemisorption of polysulfides. 3.2 Electrolytes 3.2.1 Ionic-liquid electrolytes The large polarization phenomenon (about 0.8–1 V) and slow dynamic process are typical characteristics of current Al–S battery systems, which refers to high voltage hysteresis and poor cycle stability. At the same time, the oxidation layer on the surface of Al anode is also considered to be a challenge to achieve sufficient cycle stability. The battery performance optimization is inseparable from the improvement of electrolytes. In 2015, Archer et al. [99] designed the first rechargeable Al–S battery, using AlCl3 and EMICl as the electrolyte. They investigated the electrochemical behavior of the Al–S battery by adjusting the different ratio of EMICl and AlCl3. A stable discharge platform of 1.2 V could be achieved at a molar ratio of 1:1.5 [99]. Based on such pioneering and inspiring work, Wu et al. [100] prepared a new type of IL by using (AlCl3)/(Et3NHCl) with toluene, benzene, DCM, and DCE. In the presence of DCM, it can achieve 40 stable cycles and the capacity retention rate is over 97%. However, the discharge specific capacity of this work can only reach 110 mAh g−1 (Fig. 12 a) [100], which is far from the theoretical one. Moreover, Wang et al. [101] and Manthiram et al. [103] found that when the ratio of EMICl/AlCl3 IL electrolyte reached up to 1.3:1, the electrochemical reversibility can be improved. The [Al2Cl7]− can ensure reversible deposition and dissolution of Al [122]. Other researches get very similar results and conclusion [123]. EMICl/AlCl3 (1.3:1) IL electrolyte can gurantee the reversibility of Al–S battery, but exhibited poor cycle performance. Lithium salt additives in the M−S battery system is another good choice for electrolyte optimization [44]. Reported by Manthiram et al. [104], adding lithium-ion to the electrolyte has elevated the formation of soluble polysulfide and reduced the electrochemical kinetic energy barrier of reduction or oxidation of Al polysulfide (Fig. 12b). The results of XPS analysis and DFT calculation showed that the existence of lithium-ion greatly improved the electrochemical reversibility by inhibiting the formation of Al = S bond during the discharge process and promoting the reactivation of sulfide species [104].This electrolyte system can achieve a discharge specific capacity of more than 1000 mAh g−1 in the first cycle and maintain a high discharge capacity of 600 mAh g−1 after 50 cycles (Fig. 12c). In this respect, the high charge density is another more prominent defect for high-valent Al–S batteries, leading to some other problems, such as low discharge capacity. Li et al. [107] used Al2Cl6Br− instead of Al2Cl7 − as a dissociation reagent. DFT calculation shows that the dissociation reaction of Al2Cl7 − to Al3+ at interface is replaced, and the dissociation reaction is accelerated (by almost 15 times) [107], as the dissociation energy barrier is greatly reduced (Fig. 12d and e). Furthermore, in the condition of a high discharge current density of 251 mA g−1, it can deliver a discharge capacity of more than 1500 mAh g−1 in the first cycle (Fig. 12f) [107]. Furthermore, using N-butyl-N-methyl-piperidinium (NBMP+) cations to replace all EMI+ cations in the Al–S battery. This structure achieves a high sulfur utilization and sustains a discharge capacity of 600 mAh g−1 after 20 cycles (Fig. 12g). The Al–S battery with the EMIBr/AlCl3 electrolyte shows inferior cycling performance owing to the side reactions between electrophilic polysulfide intermediates and the nucleophilic C2 carbon in the imidazole ring of EMI+ [107]. It is deduced that the substitution of NBMP+ with EMI+ cations could inhibit the side reaction of intermediate polysulfide products. 3.2.2 Low price and non-corrosive electrolyte system design The high price and extremely strong corrosive characteristics of imidazolium-type electrolyte are some of the important reasons that hinder the commercial use of Al batteries. In 2019, Yu et al. [105] synthesized a low eutectic solvent electrolyte by replacing imidazole salts with acetamides (AcA). The AcA electrolyte has the advantages of excellent cycling performance, low price, and reduced voltage polarization. The nuclear magnetic resonance (NMR) analysis suggests a significant increase of the [AlCl2(AcA)2]+. Meanwhile, the DFT results indicate that the energy barrier of Al2Cl7 − species in the reaction was lower than that of [AlCl2(AcA)2]+ (Fig. 13 a and b) [105]. Therefore, the reaction mechanism is similar to EMICl/AlCl3 electrolyte yet with more desirable kinetics. However, the side reaction derived from the AcA-type electrolyte needs to be further improved. Furthermore, John et al. [106] studied the effect of different kinds of electrolytes on the side reaction of Al–S battery. The obtained discharge capacity was higher than the theoretical one (Fig. 13c and d) when acetalumina and uralumina were introduced into electrolytes. They proposed that acetalumina and uralumina could not exist stably, and the corresponding side reaction attributed to the additional discharge capacity [106]. The high viscosity of these electrolytes is another aspect that may limit the mass loading of the sulfur cathode and reduce the overall energy density of Al–S battery, as the deep eutectic electrolytes may not penetrate the electrode with certain thickness [106]. From the perspective of highly safety and environmental friendliness [124,125], the aqueous electrolyte has attracted wide attention. However, the oxide layer on the Al electrode and the hydrolysis of polysulfide in an aqueous electrolyte constitute the serious obstacles for the aqueous Al–S battery. In 2020, Hu et al. [126] developed an aqueous Al–S battery system which used the high concentration LiTFSI to prevent from the hydrolysis of Al polysulfide (Fig. 13e). In this configuration, the battery could deliver an initial capacity of 1410 mAh g−1 (Fig. 13f) and a reversible capacity of 420 mAh g−1 after 30 cycles (Fig. 13h) [126]. Actually, the development of Al–S battery electrolyte is still in its infancy. Addressing the issues of stability, kinetics, and other practical problems, especially to realize cost-effective and non-corrosive electrolytes, will make a significant contribution to the practical application of the Al–S battery system. 3.3 Aluminum anodes The multivalent, abundant and low-price Al metal should be an ideal anode material, and yet the application of Al is not as feasible as desired. The oxide film formed on the surface of Al is the most challenging issue for the effective Al deposition. As a result, contrast to lithium metal most researches on Al-ion batteries are still in the experimental stage [127-129], engaging to improve the kinetics and promote stability by developing new electrolytes systems. For most of studies, directly polished Al electrodes are utilized in order to exclude the possible cell failure by passivating oxide layers. Our team proposed in 2016 that the anode Al3+ pathway could be constructed by immersing halogen corrosive electrolyte, and coupled the activated Al anode with non-corrosive Al(OTF)/[BMIM]OTF to construct an Al battery system with high voltage and high electrochemical activity [130]. On the other hand, Al is likely to form dendritic protrusions during deposition, which will destroy the interface stability and even lead to cell failure and safety risks. In the Al batteries, Reed and co-workers [131] directly observed the formation of dendritic substances, and proved that the dendrites were composed of aluminum, iron, chlorine, and other elements. However, for the unpolished Al electrode, there were no corresponding reports to prove the presence of dendritic substances [131]. At present, it is considered that the passivation film reduces the nucleation sites of Al dendrites to a great extent so that Al dendrites will not grow unlimitedly on the surface of the metal anode [122]. A new type of Al battery system with Al alloy foil as the anode was reported by Jiao et al. [132]. The electrode potential of Mg-containing compounds in the alloy is more negative than that of Al, which is primarily dissolved in the reaction. Mg can alleviate hydrogen evolution and corrosion, thus enhancing the electrochemical capability of Al anode. Besides this, in contrast with the pure Al anode, the battery has a high efficiency and low-cost advantages. 3.4 Current collector and separator modification for Al–S battery The stability of the current collector in Al–S batteries should be highlighted because the electrolytes in Al–S batteries are highly corrosive imidazole salt-based ILs. In this case, the traditional Al foil, Cu foil, and stainless steel foil can not be used because of the side reaction with the electrolyte. At present, there is no related report on the application of functional collectors, which are similar to that used in the Mg–S battery system. In theory, catalytic current collector [133] can be used to promote the electrochemical kinetics of the Al–S battery while achieving high conductivity and stability. Similar to other M−S batteries, modification of separator is another approach to regulating the polysulfides shuttle in the Al–S system. Manthiram et al. [103,104] made a modified glass fiber separator with single wall carbon nanotubes (SWCNTs) (Fig. 14 a). It could significantly improve cycle stability and reduce the polarization of the Al–S battery (Fig. 12c). Inspired by the separator modification in the Li–S battery, rGO modification could inhibit sulfur and polysulfide by charge transfer, thus alleviating the shuttle effect [134]. Xiao et al. [135] designed a room-temperature Al–S battery with an rGO-coated separator. This structure (Fig. 14b) led to the reduced voltage hysteresis during cycling (Fig. 14c), which implied that the rGO coating acted as an upper current collector to the lower barrier of reaction kinetics [135]. 4 New emerging multivalent M−S batteries 4.1 Calcium–sulfur (Ca–S) batteries Calcium is the fifth most abundant element in the earth’s crust and has a high melting point, and it has the characteristic of a low cost compared with the traditional Li–S battery [136-139], so it will be a promising energy storage device in the future. The current study on Ca–S batteries focuses on electrolyte optimization and the corresponding mechanism. In 2013, Seshadri et al. [140] first reported a Ca–S battery with Ca(ClO4)2 electrolyte in acetonitrile (Fig. 15 a). The battery could deliver 600 mAh g−1 discharge specific capacity in the first cycle [140], but the SEI layer formed on the surface of the calcium electrode limited the reversibility and hindered the cycle stability (Fig. 15b). Manthiram et al. [141] proposed a reversible Ca–S battery system with a Ca(CF3SO3)2 and LiCF3SO3 hybrid electrolyte in tetraethylene glycol dimethyl ether (TEGDME) solvent, which synergistically improved the reversibility of electrode reaction and increased the utilization of sulfur cathode. The mechanism analysis showed that Li+ promoted the charge transfer of the reactions owing to it serves as a mediator-ion to facilitate the ionic charge transfer in the SEI layer [141] while reducing the impedance of the Ca–S battery. 4.2 Zinc–sulfur (Zn–S) and iron–sulfur (Fe–S) batteries Nowadays the aqueous Zn-ion batteries (ZIBs) have received widespread attention. Zhi et al. [142] reported the first reversible aqueous zinc–sulfur (Zn–S) battery in this field. A liquid film was developed, rendering the Zn2+-transfer channels and polysulfide cathode with better structural stability [142]. The Zn–S battery used the 4-(3-butyl-1-imidazolio)-1-butanesulfoni IL activated poly(Li2S6-random-(1,3-diisopropenylbenzene)) (poly(Li2S6-r-DIB) copolymer (abbreviated as PLSD) as the cathode (Fig. 15c), and it was synthesized by liquid-phase synthesis process at room temperature. The wettability of the cathode is closely related to the electronic and ionic conductivity of the electrode, which seriously affects the electrochemical reversibility of batteries [144]. As is shown in Fig. 15d, the PLSD electrode has poor electrolyte wettability, while the IL-PLSD electrode obtained by IL cast on the cathode shows good hydrophilicity (Fig. 15e) [133]. Moreover compared with PLSD and IL-PLSD used as the cathode, the LF-PLSD delivered an excellent capacity of 1148 mAh g−1 at 0.3 A g−1 [142]. Furthermore, the reversibility and cycle life of the Zn–S battery could be significantly improved by using a highly concentrated electrolyte. The addition of 21 M LiTFSI enables reactivation of short-chain ZnS2 and ZnS either through forming strong coordination of Li+ with the S2 2− and S2− in the form of Zn x Li y S3−8 or through converting them to Li2S2 and Li2S by ion exchange [142]. It increases ZnS2 and ZnS solubility, and reduces the kinetic barriers of re-oxidation. They also analyzed the mechanism of the battery which revealed that, upon discharging, S6 2− was dominantly reduced by Zn to S2− (S6 → S2−). These short chains were oxidized to form long-chain Zn x Li y S3−6 during charging [142]. A similar effort has also been paid on the Fe–S battery. Refering to the principle of Li–S battery [145–147], Ji et al. [143] has proposed the mechanism of Fe–S battery (Fig. 15f) that the redox mechanism of Fe–S battery is a solid–solid conversion process, which goes through consequent solid-phase transition S8 ↔ FeS2 ↔ Fe3S4 ↔ FeS (Fig. 15g) [143]. In the discharge process, S8 was gradually reduced to the final product FeS through FeS2 and Fe3S4 during this course. When the battery is charged, FeS firstly converts into a mixture of Fe3S4/FeS2, and then transforms to S8/FeS2. The incomplete transition during charging may be caused by poor electrode reversibility and slow dynamics [143]. The work revealed that the insolubility of iron sulfides in an aqueous solution is of great significance to the Fe–S battery, and it also provides a new idea to avoid the polysulfide shuttle. 5 Conclusions and outlook Here we backtrack the course of multivalent M−S batteries over the last ten years. First, challenges still exist for sulfur cathodes, such as poor conductivity, loss of active material, product volume expansion, and low sulfur utilization. The design principles of the sulfur cathode in Li–S batteries are also applicable to M−S batteries, among which surface physical limitation, chemisorptivity, conductivity, and carbon-based electrode porosity are anticipated to play crucial roles in regulating the above problem. Second, the optimization of the system is also inseparable from the combination with other components, and the electrolyte is also vital to M−S batteries due to the issues arising from the diverse metal/electrolyte interface. For instance, in the Mg–S battery, mainly to optimize the compatibility of Mg anode and sulfur-based cathode, non-nucleophilic electrolytes are free of side effects. These electrolytes are recognized as an appropriate option, especially that the development of chlorine-free or non-corrosive electrolytes is conducive to improve battery safety. At the same time, electrolytes containing boron and Al-based weakly coordinated anions can achieve high coulombic efficiency and long cycle due to the metal additives, such as lithium-ion mediation. In terms of Al–S batteries, the intrinsic high charge density and oxide surface film are essential factors to limit the selection of electrolyte. Researchers have always believed that IL electrolytes enable reversible Al plating/stripping at room temperature, but the high price and strong corrosive properties may hinder its commercialization. The emergence of deep eutectic solvents and high concentration aqueous electrolytes indeed promote the development of low-cost, safe, and non-corrosive electrolytes. For Ca–S, Zn–S, and Fe–S batteries, exploring stable electrochemical reversibility and high electrochemical window electrolytes will be a promising yet challenging direction in the future. Third, the metal anode is another key to the long cycle life of batteries, and the deposition process of these multivalent metals varies according to the types of metals and their pretreatment. For most Mg anodes, no dendrites would be formed in the charging process, which intrinsically determines the safety of the battery. On the contrary, it is well known that the passivation film is easily formed on the surface of the Al anode, and there are fewer penetration centers for untreated Al electrodes than polished ones. The electrolyte reacts with the metal through these penetration centers, which greatly reduces the nucleation position of Al dendrites so that Al dendrites will not grow infinitely. The sulfur battery with other metals as electrodes are less concerned by researchers, and the behavior of metal electrodes has yet been further clarified. There is no doubt that LIBs have made remarkable progress in the field of consumer electronics and electric mobility in recent years, but the shortcomings of cost, resource, and energy density are important factors that may limit its further development. The new M−S battery systems represented by the Al–S battery can provide competitive energy density. However, most M−S batteries have the problem of dissolution of intermediate polysulfide, which will cause overcharge, loss of active material, low sulfur utilization, and metal electrode failure. Here, we mainly focus on the reaction system of the multi-electron M−S batteries. Different from the mechanism of the Li–S battery, the electrochemical behavior of polysulfide is different due to the difference between the metal anode, electrolyte, and phase diagrams of M−S. Multiple bonds of metal–sulfur (e.g. Mg = S, Al = S, Fe = S, and Zn = S) always have high binding energy, which means that the final discharge product is electrochemically inactive and poor solubility with different electrolytes. The interaction mechanism between the electrolytes and the sulfur cathode is not clear, which is prone to side reactions and ultra-high discharge specific capacity. On the other hand, the discharge plateau obtained from experiments far below the theoretical one needs to be further studied, which may be affected by the sluggish kinetics, the side reactions of electrolyte, and the passivation of the metal electrode. It can be seen that although some progress has been made in many areas, there are still some important challenges, which are the driving force for the researchers, and will also become the direction of future research (Fig. 16 ), which means that we should pay more attention to new metal nanoparticles, self-assembly systems and covalent binding of sulfur to carbon cathode materials to inhibit the dissolution of sulfur and polysulfide. As for novel electrolyte design, the development of electrolytes is still in its infancy, especially in the efforts to the cost-effective and non-corrosive electrolyte. What’s more, looking for alloying anode materials and constructing ideal SEI film are feasible methods to improve the performance of multivalent metal anode. Despite we have made a lot of attempts, there is still a long way to go to achieve the high efficiency, stability, low price, and environment friendly multivalent M−S batteries. Declaration of Competing Interest The authors declare that they have no known competing financial interests or personal relationships that could have appeared to influence the work reported in this paper. Acknowledgments The present work is supported by the National Natural Science Foundation of China (22075028) and the Beijing Institute of Technology Research Fund Program for Young Scholars (2019CX04092). References [1] P.G. Bruce S.A. Freunberger L.J. Hardwick J.M. Tarascon Nat. Mater. 11 2011 19 29 P.G. Bruce, S.A. Freunberger, L.J. Hardwick, J.M. Tarascon, Nat. Mater. 11 (2011) 19-29. [2] Y. Li Y. Bai X. Bi J. Qian L. Ma J. Tian C. Wu F. Wu J. Lu K. Amine ChemSusChem 9 2016 728 735 Y. Li, Y. Bai, X. Bi, J. Qian, L. Ma, J. Tian, C. Wu, F. Wu, J. Lu, K. Amine, ChemSusChem 9 (2016) 728-735. [3] P. Yang J.-M. Tarascon Nat. Mater. 11 2012 560 563 P. Yang, J.-M. Tarascon, Nat. Mater. 11 (2012) 560-563. [4] B. Dunn H. Kamath J.M. Tarascon Science 334 2011 928 935 B. Dunn, H. Kamath, J.M. Tarascon, Science 334 (2011) 928-935. [5] M. Armand J.M. Tarascon Nature 451 2008 652 657 M. Armand, J.M. Tarascon, Nature 451 (2008) 652-657. [6] P.G. Bruce S.A. Freunberger L.J. Hardwick J.-M. Tarascon Nat. Mater. 11 2011 172 P.G. Bruce, S.A. Freunberger, L.J. Hardwick, J.-M. Tarascon, Nat. Mater. 11 (2011) 172-172. [7] F. Wu H. Wang Y. Bai Y. Li C. Wu G. Chen L. Liu Q. Ni X. Wang J. Zhou Solid State Ion. 300 2017 149 156 F. Wu, H. Wang, Y. Bai, Y. Li, C. Wu, G. Chen, L. Liu, Q. Ni, X. Wang, J. Zhou, Solid State Ion. 300 (2017) 149-156. [8] Y. Bai C. Wu F. Wu L.-X. Yang B.-R. Wu Electrochem. Commun. 11 2009 145 148 Y. Bai, C. Wu, F. Wu, L.-X. Yang, B.-R. Wu, Electrochem. Commun. 11 (2009) 145-148. [9] F. Wu C. Wu Chin. Sci. Bull. 59 2014 3369 3376 F. Wu, C. Wu, Chin. Sci. Bull. 59 (2014) 3369-3376. [10] X.B. Cheng R. Zhang C.Z. Zhao F. Wei J.G. Zhang Q. Zhang Adv. Sci. 3 2016 1500213 X.B. Cheng, R. Zhang, C.Z. Zhao, F. Wei, J.G. Zhang, Q. Zhang, Adv. Sci. 3 (2016) 1500213. [11] L.F. Nazar M. Cuisinier Q. Pang MRS Bull. 39 2014 436 442 L.F. Nazar, M. Cuisinier, Q. Pang, MRS Bull. 39 (2014) 436-442. [12] S.S. Zhang J. Power Sources 231 2013 153 162 S.S. Zhang, J. Power Sources 231 (2013) 153-162. [13] M. Wild L. O’neill T. Zhang R. Purkayastha G. Minton M. Marinescu G.J. Offer Energy Environ. Sci. 8 2015 3477 3494 M. Wild, L. O'neill, T. Zhang, R. Purkayastha, G. Minton, M. Marinescu, G.J. Offer, Energy Environ. Sci. 8 (2015) 3477-3494. [14] X. Wang G. Tan Y. Bai F. Wu C. Wu Electrochem. Energy Rev. 4 2021 35 66 X. Wang, G. Tan, Y. Bai, F. Wu, C. Wu, Electrochem Energy Rev 4 (2021) 35-66. [15] J. Nelson S. Misra Y. Yang A. Jackson Y. Liu H. Wang H. Dai J.C. Andrews Y. Cui M.F. Toney J. Am. Chem. Soc. 134 2012 6337 6343 J. Nelson, S. Misra, Y. Yang, A. Jackson, Y. Liu, H. Wang, H. Dai, J.C. Andrews, Y. Cui, M.F. Toney, J. Am. Chem. Soc. 134 (2012) 6337-6343. [16] M. Cuisinier P.-E. Cabelguen S. Evers G. He M. Kolbeck A. Garsuch T. Bolin M. Balasubramanian L.F. Nazar J. Phys. Chem. Lett. 4 2013 3227 3232 M. Cuisinier, P.-E. Cabelguen, S. Evers, G. He, M. Kolbeck, A. Garsuch, T. Bolin, M. Balasubramanian, L.F. Nazar, J. Phys. Chem. Lett. 4 (2013) 3227-3232. [17] K. Kumaresan Y. Mikhaylik R.E. White J. Electrochem. Soc. 155 2008 A576 A582 K. Kumaresan, Y. Mikhaylik, R.E. White, J. Electrochem. Soc. 155 (2008) A576-A582. [18] M. Hagen D. Hanselmann K. Ahlbrecht R. Maça D. Gerber J. Tübke Adv. Energy Mater. 5 2015 1401986 M. Hagen, D. Hanselmann, K. Ahlbrecht, R. Maça, D. Gerber, J. Tübke, Adv. Energy Mater. 5 (2015) 1401986. [19] M.A. Pope I.A. Aksay Adv. Energy Mater. 5 2015 1614 6832 M.A. Pope, I.A. Aksay, Adv. Energy Mater. 5 (2015) 1614-6832. [20] D.-W. Wang Q. Zeng G. Zhou L. Yin F. Li H.-M. Cheng I.R. Gentle G.Q.M. Lu J. Mater. Chem. A 1 2013 9382 D.-W. Wang, Q. Zeng, G. Zhou, L. Yin, F. Li, H.-M. Cheng, I.R. Gentle, G.Q.M. Lu, J. Mater. Chem. A 1 (2013) 9382. [21] L. Borchardt M. Oschatz S. Kaskel Chem. Eur. J. 22 2016 7324 7351 L. Borchardt, M. Oschatz, S. Kaskel, Chem. Eur. J.22 (2016) 7324-7351. [22] P. Adelhelm P. Hartmann C.L. Bender M. Busche C. Eufinger J. Janek Beilstein J. Nanotechnol. 6 2015 1016 1055 P. Adelhelm, P. Hartmann, C.L. Bender, M. Busche, C. Eufinger, J. Janek, Beilstein J. Nanotechnol. 6 (2015) 1016-1055. [23] S. Xin Y.X. Yin Y.G. Guo L.J. Wan Adv. Mater. 26 2014 1261 1265 S. Xin, Y.X. Yin, Y.G. Guo, L.J. Wan, Adv. Mater. 26 (2014) 1261-1265. [24] S.Y. Wei S.M. Xu A. Agrawral S. Choudhury Y.Y. Lu Z.Y. Tu L. Ma L.A. Archer Nat. Commun. 7 2016 11722 S.Y. Wei, S.M. Xu, A. Agrawral, S. Choudhury, Y.Y. Lu, Z.Y. Tu, L. Ma, L.A. Archer, Nat. Commun. 7 (2016) 11722. [25] A. Manthiram X.W. Yu Small 11 2015 2108 2114 A. Manthiram, X.W. Yu, Small 11 (2015) 2108-2114. [26] J. Xie Q.C. Zhang Small 15 2019 1805061 J. Xie, Q.C. Zhang, Small 15 (2019) 1805061. [27] X. Zhang R. Lv W. Tang G. Li A. Wang A. Dong X. Liu J. Luo Adv. Funct. Mater. 30 2020 2004187 X. Zhang, R. Lv, W. Tang, G. Li, A. Wang, A. Dong, X. Liu, J. Luo, Adv. Funct. Mater. 30 (2020) 2004187. [28] Y.L. Liang H. Dong D. Aurbach Y. Yao Nat. Energy 5 2020 646 656 Y.L. Liang, H. Dong, D. Aurbach, Y. Yao, Nat. Energy 5 (2020) 646-656. [29] P. Wang M.R. Buchmeiser Adv. Funct. Mater. 29 2019 1905248 P. Wang, M.R. Buchmeiser, Adv. Funct. Mater. 29 (2019) 1905248. [30] L. Kong C. Yan J.-Q. Huang M.-Q. Zhao M.-M. Titirici R. Xiang Q. Zhang Energy Environ. Mater. 1 2018 100 112 L. Kong, C. Yan, J.-Q. Huang, M.-Q. Zhao, M.-M. Titirici, R. Xiang, Q. Zhang, Energy Environ. Mater. 1 (2018) 100-112. [31] M. Cuisinier C. Hart M. Balasubramanian A. Garsuch L.F. Nazar Adv. Energy Mater. 5 2015 1401801 M. Cuisinier, C. Hart, M. Balasubramanian, A. Garsuch, L.F. Nazar, Adv. Energy Mater. 5 (2015) 1401801. [32] X. Hong J. Mei L. Wen Y. Tong A.J. Vasileff L. Wang J. Liang Z. Sun S.X. Dou Adv. Mater. 31 2019 1802822 X. Hong, J. Mei, L. Wen, Y. Tong, A.J. Vasileff, L. Wang, J. Liang, Z. Sun, S.X. Dou, Adv. Mater. 31 (2019) 1802822. [33] G.A. Elia K. Marquardt K. Hoeppner S. Fantini R. Lin E. Knipping W. Peters J.F. Drillet S. Passerini R. Hahn Adv. Mater. 28 2016 7564 7579 G.A. Elia, K. Marquardt, K. Hoeppner, S. Fantini, R. Lin, E. Knipping, W. Peters, J.F. Drillet, S. Passerini, R. Hahn, Adv. Mater. 28 (2016) 7564-7579. [34] X.W. Yu A. Manthiram Small Methods 1 2017 1700217 X.W. Yu, A. Manthiram, Small Methods 1 (2017) 1700217. [35] D. Aurbach E. Zinigrad Y. Cohen H. Teller Solid State Ion. 148 2002 405 416 D. Aurbach, E. Zinigrad, Y. Cohen, H. Teller, Solid State Ion. 148 (2002) 405-416. [36] M. Salama Rosy R. Attias R. Yemini Y. Gofer D. Aurbach M. Noked ACS Energy Lett. 4 2019 436 446 M. Salama, Rosy, R. Attias, R. Yemini, Y. Gofer, D. Aurbach, M. Noked, ACS Energy Lett. 4 (2019) 436-446. [37] J.-W. Park K. Ueno N. Tachikawa K. Dokko M. Watanabe J. Phys. Chem. C 117 2013 20531 20541 J.-W. Park, K. Ueno, N. Tachikawa, K. Dokko, M. Watanabe, J. Phys. Chem. C 117 (2013) 20531-20541. [38] H.S. Kim T.S. Arthur G.D. Allred J. Zajicek J.G. Newman A.E. Rodnyansky A.G. Oliver W.C. Boggess J. Muldoon Nat. Commun. 2 2011 427 H.S. Kim, T.S. Arthur, G.D. Allred, J. Zajicek, J.G. Newman, A.E. Rodnyansky, A.G. Oliver, W.C. Boggess, J. Muldoon, Nat. Commun. 2 (2011) 427. [39] S.Y. Ha Y.W. Lee S.W. Woo B. Koo J.S. Kim J. Cho K.T. Lee N.S. Choi ACS Appl. Mater. Interfaces 6 2014 4063 4073 S.Y. Ha, Y.W. Lee, S.W. Woo, B. Koo, J.S. Kim, J. Cho, K.T. Lee, N.S. Choi, ACS Appl. Mater. Interfaces 6 (2014) 4063-4073. [40] Z. Zhao-Karger X. Zhao D. Wang T. Diemant R.J. Behm M. Fichtner Adv. Energy Mater. 5 2015 1401155 Z. Zhao-Karger, X. Zhao, D. Wang, T. Diemant, R.J. Behm, M. Fichtner, Adv. Energy Mater. 5 (2015) 1401155. [41] G. Zheng Q. Zhang J.J. Cha Y. Yang W. Li Z.W. Seh Y. Cui Nano Lett. 13 2013 1265 1270 G. Zheng, Q. Zhang, J.J. Cha, Y. Yang, W. Li, Z.W. Seh, Y. Cui, Nano Lett. 13 (2013) 1265-1270. [42] Z. Zhang Z. Cui L. Qiao J. Guan H. Xu X. Wang P. Hu H. Du S. Li X. Zhou Adv. Energy Mater. 7 2017 1602055 Z. Zhang, Z. Cui, L. Qiao, J. Guan, H. Xu, X. Wang, P. Hu, H. Du, S. Li, X. Zhou, Adv. Energy Mater. 7 (2017) 1602055. [43] A. Robba M. Mežnar A. Vizintin J. Bitenc J. Bobnar I. Arčon A. Randon-Vitanova R. Dominko J. Power Sources 450 2020 227672 A. Robba, M. Mežnar, A. Vizintin, J. Bitenc, J. Bobnar, I. Arčon, A. Randon-Vitanova, R. Dominko, J. Power Sources 450 (2020) 227672. [44] T. Gao M. Noked A.J. Pearse E. Gillette X. Fan Y. Zhu C. Luo L. Suo M.A. Schroeder K. Xu S.B. Lee G.W. Rubloff C. Wang J. Am. Chem. Soc. 137 2015 12388 12393 T. Gao, M. Noked, A.J. Pearse, E. Gillette, X. Fan, Y. Zhu, C. Luo, L. Suo, M.A. Schroeder, K. Xu, S.B. Lee, G.W. Rubloff, C. Wang, J. Am. Chem. Soc. 137 (2015) 12388-12393. [45] B.P. Vinayan Z. Zhao-Karger T. Diemant V.S.K. Chakravadhanula M. Fichtner Nanoscale 8 2016 3296 3306 B.P. Vinayan, Z. Zhao-Karger, T. Diemant, V.S.K. Chakravadhanula, M. Fichtner, Nanoscale 8 (2016) 3296-3306. [46] A. Du Z. Zhang H. Qu Z. Cui L. Qiao L. Wang J. Chai T. Lu S. Dong T. Dong H. Xu X. Zhou G. Cui Energy Environ. Sci. 10 2017 2616 2625 A. Du, Z. Zhang, H. Qu, Z. Cui, L. Qiao, L. Wang, J. Chai, T. Lu, S. Dong, T. Dong, H. Xu, X. Zhou, G. Cui, Energy Environ. Sci. 10 (2017) 2616-2625. [47] D. Muthuraj A. Ghosh A. Kumar S. Mitra ChemElectroChem 6 2018 684 689 D. Muthuraj, A. Ghosh, A. Kumar, S. Mitra, ChemElectroChem 6 (2018) 684-689. [48] Y. Xu Y. Ye S. Zhao J. Feng J. Li H. Chen A. Yang F. Shi L. Jia Y. Wu X. Yu P.A. Glans-Suzuki Y. Cui J. Guo Y. Zhang Nano Lett. 19 2019 2928 2934 Y. Xu, Y. Ye, S. Zhao, J. Feng, J. Li, H. Chen, A. Yang, F. Shi, L. Jia, Y. Wu, X. Yu, P.A. Glans-Suzuki, Y. Cui, J. Guo, Y. Zhang, Nano Lett. 19 (2019) 2928-2934. [49] J. Häcker C. Danner B. Sievert I. Biswas Z. Zhao-Karger N. Wagner K.A. Friedrich Electrochim. Acta 338 2020 135787 J. Häcker, C. Danner, B. Sievert, I. Biswas, Z. Zhao-Karger, N. Wagner, K.A. Friedrich, Electrochim. Acta 338 (2020) 135787. [50] G.M. Zhou Y.B. Zhao A. Manthiram Adv. Energy Mater. 5 2015 1402263 G.M. Zhou, Y.B. Zhao, A. Manthiram, Adv. Energy Mater. 5 (2015) 1402263. [51] J.T. Zhang H. Hu Z. Li X.W. Lou Angew. Chem. Int. Ed. 55 2016 3982 3986 J.T. Zhang, H. Hu, Z. Li, X.W. Lou, Angew. Chem. Int. Ed. 55 (2016) 3982-3986. [52] T. Gao X. Ji S. Hou X. Fan C. Wang Adv. Mater. 30 2017 1704313 T. Gao, X. Ji, S. Hou, X. Fan, C. Wang, Adv. Mater. 30 (2017) 1704313. [53] X. Ji K.T. Lee L.F. Nazar Nat. Mater. 8 2009 500 506 X. Ji, K.T. Lee, L.F. Nazar, Nat. Mater. 8 (2009) 500-506. [54] M.Q. Zhao Q. Zhang J.Q. Huang G.L. Tian J.Q. Nie H.J. Peng F. Wei Nat. Commun. 5 2014 3410 M.Q. Zhao, Q. Zhang, J.Q. Huang, G.L. Tian, J.Q. Nie, H.J. Peng, F. Wei, Nat. Commun. 5 (2014) 3410. [55] Y.S. Su Y.Z. Fu T. Cochell A. Manthiram Nat. Commun. 4 2013 2985 Y.S. Su, Y.Z. Fu, T. Cochell, A. Manthiram, Nat. Commun. 4 (2013) 2985. [56] B.A. Zhang F.Y. Kang J.M. Tarascon J.K. Kim Prog. Mater Sci. 76 2016 319 380 B.A. Zhang, F.Y. Kang, J.M. Tarascon, J.K. Kim, Prog. Mater Sci. 76 (2016) 319-380. [57] Z. Zhao-Karger M.E. Gil Bardaji O. Fuhr M. Fichtner J. Mater. Chem. A 5 2017 10815 10820 Z. Zhao-Karger, M.E. Gil Bardaji, O. Fuhr, M. Fichtner, J. Mater. Chem. A 5 (2017) 10815-10820. [58] T. Gao S. Hou F. Wang Z. Ma X. Li K. Xu C. Wang Angew. Chem. Int. Ed. 56 2017 13526 13530 T. Gao, S. Hou, F. Wang, Z. Ma, X. Li, K. Xu, C. Wang, Angew. Chem. Int. Ed. 56 (2017) 13526-13530. [59] Y. Yang W. Wang Y. Nuli J. Yang J. Wang ACS Appl. Mater. Interfaces 11 2019 9062 9072 Y. Yang, W. Wang, Y. Nuli, J. Yang, J. Wang, ACS Appl. Mater. Interfaces 11 (2019) 9062-9072. [60] Z. Zhao-Karger R. Liu W. Dai Z. Li T. Diemant B.P. Vinayan C. Bonatto Minella X. Yu A. Manthiram R.J. Behm M. Ruben M. Fichtner ACS Energy Lett. 3 2018 2005 2013 Z. Zhao-Karger, R. Liu, W. Dai, Z. Li, T. Diemant, B.P. Vinayan, C. Bonatto Minella, X. Yu, A. Manthiram, R.J. Behm, M. Ruben, M. Fichtner, ACS Energy Lett. 3 (2018) 2005-2013. [61] H. Du Z. Zhang J. He Z. Cui J. Chai J. Ma Z. Yang C. Huang G. Cui Small 13 2017 1702277 H. Du, Z. Zhang, J. He, Z. Cui, J. Chai, J. Ma, Z. Yang, C. Huang, G. Cui, Small 13 (2017) 1702277. [62] X. Zhou J. Tian J. Hu C. Li Adv. Mater. 30 2018 1704166 X. Zhou, J. Tian, J. Hu, C. Li, Adv. Mater. 30 (2018) 1704166. [63] B.P. Vinayan H. Euchner Z. Zhao-Karger M.A. Cambaz Z. Li T. Diemant R.J. Behm A. Gross M. Fichtner J. Mater. Chem. A 7 2019 25490 25502 B.P. Vinayan, H. Euchner, Z. Zhao-Karger, M.A. Cambaz, Z. Li, T. Diemant, R.J. Behm, A. Gross, M. Fichtner, J. Mater. Chem. A 7 (2019) 25490-25502. [64] W. Wang H. Yuan Y. Nuli J. Zhou J. Yang J. Wang J. Phys. Chem. C 122 2018 26764 26776 W. Wang, H. Yuan, Y. Nuli, J. Zhou, J. Yang, J. Wang, J. Phys. Chem. C 122 (2018) 26764–26776. [65] L. Zeng N. Wang J. Yang J.L. Wang Y. Nuli J. Electrochem. Soc. 164 2017 A2504 A2512 L. Zeng, N. Wang, J. Yang, J.L. Wang, Y. Nuli, J. Electrochem. Soc. 164 (2017) A2504-A2512. [66] X. Zhao Y. Yang Y. Nuli D. Li Y. Wang X. Xiang Chem. Commun. 55 2019 6086 6089 X. Zhao, Y. Yang, Y. Nuli, D. Li, Y. Wang, X. Xiang, Chem. Commun. 55 (2019) 6086-6089. [67] Y. Xu G.M. Zhou S.Y. Zhao W.F. Li F.F. Shi J. Li J. Feng Y.X. Zhao Y. Wu J.H. Guo Y. Cui Y.G. Zhang Adv. Sci. 6 2019 1800981 Y. Xu, G.M. Zhou, S.Y. Zhao, W.F. Li, F.F. Shi, J. Li, J. Feng, Y.X. Zhao, Y. Wu, J.H. Guo, Y. Cui, Y.G. Zhang, Adv. Sci. 6 (2019) 1800981. [68] W. Li S. Cheng J. Wang Y. Qiu Z. Zheng H. Lin S. Nanda Q. Ma Y. Xu F. Ye Angew. Chem. Int. Ed. 128 2016 6516 6520 W. Li, S. Cheng, J. Wang, Y. Qiu, Z. Zheng, H. Lin, S. Nanda, Q. Ma, Y. Xu, F. Ye, Angew. Chem. Int. Ed. 128 (2016) 6516-6520. [69] R. Jay A.W. Tomich J. Zhang Y. Zhao J. Guo ACS Appl. Mater. Interfaces 11 2019 11414 11420 R. Jay, A.W. Tomich, J. Zhang, Y. Zhao, J. Guo, ACS Appl. Mater. Interfaces 11 (2019) 11414–11420. [70] X.-C. Hu Y. Shi S.-Y. Lang X. Zhang L. Gu Y.-G. Guo R. Wen L.-J. Wan Nano Energy 49 2018 453 459 X.-C. Hu, Y. Shi, S.-Y. Lang, X. Zhang, L. Gu, Y.-G. Guo, R. Wen, L.-J. Wan, Nano Energy 49 (2018) 453-459. [71] Y. Cheng Y. Shao J.-G. Zhang V.L. Sprenkle J. Liu G. Li Chem. Commun. 50 2014 9644 9646 Y. Cheng, Y. Shao, J.-G. Zhang, V.L. Sprenkle, J. Liu, G. Li, Chem. Commun. 50 (2014) 9644-9646. [72] A. Robba A. Vizintin J. Bitenc G. Mali I. Arčon M. Kavčič M. Žitnik K. Bučar G. Aquilanti C. Martineau-Corcos A. Randon-Vitanova R. Dominko Chem. Mater. 29 2017 9555 9564 A. Robba, A. Vizintin, J. Bitenc, G. Mali, I. Arčon, M. Kavčič, M. Žitnik, K. Bučar, G. Aquilanti, C. Martineau-Corcos, A. Randon-Vitanova, R. Dominko, Chem. Mater. 29 (2017) 9555-9564. [73] X. Yu A. Manthiram ACS Energy Lett. 1 2016 431 437 X. Yu, A. Manthiram, ACS Energy Lett. 1 (2016) 431-437. [74] B. Sievert J. Häcker F. Bienen N. Wagner K. Friedrich ECS Trans. 77 2017 413 424 B. Sievert, J. Häcker, F. Bienen, N. Wagner, K. Friedrich, ECS Trans. 77 (2017) 413-424. [75] Y. Shao M. Gu X. Li Z. Nie P. Zuo G. Li T. Liu J. Xiao Y. Cheng C. Wang Nano Lett. 14 2014 255 260 Y. Shao, M. Gu, X. Li, Z. Nie, P. Zuo, G. Li, T. Liu, J. Xiao, Y. Cheng, C. Wang, Nano Lett. 14 (2014) 255–260. [76] N. Wu Z.Z. Yang H.R. Yao Y.X. Yin L. Gu Y.G. Guo Angew. Chem. Int. Ed. 127 2015 5849 5853 N. Wu, Z.Z. Yang, H.R. Yao, Y.X. Yin, L. Gu, Y.G. Guo, Angew. Chem. Int. Ed. 127 (2015) 5849-5853. [77] E. Marin A. Lanzutti F. Andreatta M. Lekka L. Guzman L. Fedrizzi Corros. Rev. 29 2011 191 208 E. Marin, A. Lanzutti, F. Andreatta, M. Lekka, L. Guzman, L. Fedrizzi, Corros. Rev. 29 (2011) 191–208. [78] H. Wang S. Gu Y. Bai S. Chen F. Wu C. Wu ACS Appl. Mater. Interfaces 8 2016 27444 27448 H. Wang, S. Gu, Y. Bai, S. Chen, F. Wu, C. Wu, ACS Appl. Mater. Interfaces 8 (2016) 27444-27448. [79] J.Y. Chang Y.D. Kuan S.M. Lee S.R. Lee J. Power Sources 184 2008 180 190 J.Y. Chang, Y.D. Kuan, S.M. Lee, S.R. Lee, J. Power Sources 184 (2008) 180-190. [80] X.F. Tong F. Zhang B.F. Ji M.H. Sheng Y.B. Tang Adv. Mater. 28 2016 9979 9985 X.F. Tong, F. Zhang, B.F. Ji, M.H. Sheng, Y.B. Tang, Adv. Mater. 28 (2016) 9979-9985. [81] Q. Li S.P. Zhu Y.Y. Lu Adv. Funct. Mater. 27 2017 1606422 Q. Li, S.P. Zhu, Y.Y. Lu, Adv. Funct. Mater. 27 (2017) 1606422. [82] X.Y. Xue S.A. Yuan L.L. Xing Z.H. Chen B. He Y.J. Chen Chem. Commun. 47 2011 4718 4720 X.Y. Xue, S.A. Yuan, L.L. Xing, Z.H. Chen, B. He, Y.J. Chen, Chem. Commun. 47 (2011) 4718-4720. [83] H. Gullapalli A.L.M. Reddy S. Kilpatrick M. Dubey P.M. Ajayan Small 7 2011 1697 1700 H. Gullapalli, A.L.M. Reddy, S. Kilpatrick, M. Dubey, P.M. Ajayan, Small 7 (2011) 1697-1700. [84] X. Li L. Qiao D. Li X. Wang W. Xie D. He J. Mater. Chem. A 1 2013 6400 6406 X. Li, L. Qiao, D. Li, X. Wang, W. Xie, D. He, J. Mater. Chem. A 1 (2013) 6400-6406. [85] K. Striebel J. Shim A. Sierra H. Yang X. Song R. Kostecki K. Mccarthy J. Power Sources 146 2005 33 38 K. Striebel, J. Shim, A. Sierra, H. Yang, X. Song, R. Kostecki, K. Mccarthy, J. Power Sources 146 (2005) 33-38. [86] H.-C. Wu E. Lee N.-L. Wu T.R. Jow J. Power Sources 197 2012 301 304 H.-C. Wu, E. Lee, N.-L. Wu, T.R. Jow, J. Power Sources 197 (2012) 301-304. [87] F. Wu H. Yang Y. Bai C. Wu Adv. Mater. 31 2019 1806510 F. Wu, H. Yang, Y. Bai, C. Wu, Adv. Mater. 31 (2019) 1806510. [88] N. Zhu K. Zhang F. Wu Y. Bai C. Wu Energy Mater. Adv. 2021 2021 9204217 N. Zhu, K. Zhang, F. Wu, Y. Bai, C. Wu, Energy Mater. Adv. 2021 (2021) 9204217. [89] S.K. Das S. Mahapatra H. Lahan J. Mater. Chem. A 5 2017 6347 6367 S.K. Das, S. Mahapatra, H. Lahan, J. Mater. Chem. A 5 (2017) 6347-6367. [90] G.F. Reynolds C.J. Dymek J. Power Sources 15 1985 109 118 G.F. Reynolds, C.J. Dymek, J. Power Sources 15 (1985) 109-118. [91] H. Wang Y. Bai S. Chen X. Luo C. Wu F. Wu J. Lu K. Amine ACS Appl. Mater. Interfaces 7 2015 80 84 H. Wang, Y. Bai, S. Chen, X. Luo, C. Wu, F. Wu, J. Lu, K. Amine, ACS Appl. Mater. Interfaces 7 (2015) 80-84. [92] H. Wang S. Gu Y. Bai S. Chen N. Zhu C. Wu F. Wu J. Mater. Chem. A 3 2015 22677 22686 H. Wang, S. Gu, Y. Bai, S. Chen, N. Zhu, C. Wu, F. Wu, J. Mater. Chem. A 3 (2015) 22677-22686. [93] S. Gu H. Wang C. Wu Y. Bai H. Li F. Wu Energy Storage Mater. 6 2017 9 17 S. Gu, H. Wang, C. Wu, Y. Bai, H. Li, F. Wu, Energy Storage Mater. 6 (2017) 9-17. [94] F. Wu N. Zhu Y. Bai Y. Gao C. Wu Green Energy Environ. 3 2018 71 77 F. Wu, N. Zhu, Y. Bai, Y. Gao, C. Wu, Green Energy Environ. 3 (2018) 71-77. [95] N. Zhu F. Wu Z. Wang L. Ling H. Yang Y. Gao S. Guo L. Suo H. Li H. Xu Y. Bai C. Wu J. Energy Chem. 51 2020 72 80 N. Zhu, F. Wu, Z. Wang, L. Ling, H. Yang, Y. Gao, S. Guo, L. Suo, H. Li, H. Xu, Y. Bai, C. Wu, J. Energy Chem. 51 (2020) 72-80. [96] H. Yang F. Wu Y. Bai C. Wu J. Energy Chem. 45 2020 98 102 H. Yang, F. Wu, Y. Bai, C. Wu, J. Energy Chem. 45 (2020) 98-102. [97] H. Wang Y. Bai S. Chen F. Wu C. Wu Prog. Chem. 25 2013 1392 1400 H. Wang, Y. Bai, s. Chen, F. Wu, C. Wu, Prog. Chem. 25 (2013) 1392-1400. [98] Stuart Licht J. Electrochem. Soc. 144 1997 L133 L136 Licht, Stuart, J. Electrochem. Soc. 144 (1997) L133-L136. [99] G. Cohn L. Ma L.A. Archer J. Power Sources 283 2015 416 422 G. Cohn, L. Ma, L.A. Archer, J. Power Sources 283 (2015) 416-422. [100] S. Xia X.-M. Zhang K. Huang Y.-L. Chen Y.-T. Wu J. Electroanal. Chem. 757 2015 167 175 S. Xia, X.-M. Zhang, K. Huang, Y.-L. Chen, Y.-T. Wu, J. Electroanal. Chem. 757 (2015) 167-175. [101] T. Gao X. Li X. Wang J. Hu F. Han X. Fan L. Suo A.J. Pearse S.B. Lee G.W. Rubloff K.J. Gaskell M. Noked C. Wang Angew. Chem. Int. Ed. 55 2016 9898 9901 T. Gao, X. Li, X. Wang, J. Hu, F. Han, X. Fan, L. Suo, A.J. Pearse, S.B. Lee, G.W. Rubloff, K.J. Gaskell, M. Noked, C. Wang, Angew. Chem. Int. Ed. 55 (2016) 9898-9901. [102] Y. Guo H. Jin Z. Qi Z. Hu H. Ji L.-J. Wan Adv. Funct. Mater. 29 2019 1807676 Y. Guo, H. Jin, Z. Qi, Z. Hu, H. Ji, L.-J. Wan, Adv. Funct. Mater. 29 (2019) 1807676. [103] X. Yu A. Manthiram Adv. Energy Mater. 7 2017 1700561 X. Yu, A. Manthiram, Adv. Energy Mater. 7 (2017) 1700561. [104] X. Yu M.J. Boyer G.S. Hwang A. Manthiram Chem 4 2018 586 598 X. Yu, M.J. Boyer, G.S. Hwang, A. Manthiram, Chem 4 (2018) 586-598. [105] W. Chu X. Zhang J. Wang S. Zhao S. Liu H. Yu Energy Storage Mater. 22 2019 418 423 W. Chu, X. Zhang, J. Wang, S. Zhao, S. Liu, H. Yu, Energy Storage Mater. 22 (2019) 418-423. [106] J. Lampkin H. Li L. Furness R. Raccichini N. Garcia-Araez ChemSusChem 13 2020 3514 3523 J. Lampkin, H. Li, L. Furness, R. Raccichini, N. Garcia-Araez, ChemSusChem 13 (2020) 3514-3523. [107] H. Yang L. Yin J. Liang Z. Sun Y. Wang H. Li K. He L. Ma Z. Peng S. Qiu C. Sun H.M. Cheng F. Li Angew. Chem. Int. Ed. 57 2018 1898 1902 H. Yang, L. Yin, J. Liang, Z. Sun, Y. Wang, H. Li, K. He, L. Ma, Z. Peng, S. Qiu, C. Sun, H.M. Cheng, F. Li, Angew. Chem. Int. Ed. 57 (2018) 1898-1902. [108] L. Ji M. Rao H. Zheng L. Zhang Y. Li W. Duan J. Guo E.J. Cairns Y. Zhang J. Am. Chem. Soc. 133 2011 18522 18525 L. Ji, M. Rao, H. Zheng, L. Zhang, Y. Li, W. Duan, J. Guo, E.J. Cairns, Y. Zhang, J. Am. Chem. Soc. 133 (2011) 18522-18525. [109] M.-K. Song Y. Zhang E.J. Cairns Nano Lett. 13 2013 5891 5899 M.-K. Song, Y. Zhang, E.J. Cairns, Nano Lett. 13 (2013) 5891-5899. [110] G. Hu C. Xu Z. Sun S. Wang H.-M. Cheng F. Li W. Ren Adv. Mater. 28 2016 1603 1609 G. Hu, C. Xu, Z. Sun, S. Wang, H.-M. Cheng, F. Li, W. Ren, Adv. Mater. 28 (2016) 1603-1609. [111] X. Wang Z. Wang L. Chen J. Power Sources 242 2013 65 69 X. Wang, Z. Wang, L. Chen, J. Power Sources 242 (2013) 65-69. [112] J. Zhou R. Li X. Fan Y. Chen R. Han W. Li J. Zheng B. Wang X. Li Energy Environ. Sci. 7 2014 2715 2724 J. Zhou, R. Li, X. Fan, Y. Chen, R. Han, W. Li, J. Zheng, B. Wang, X. Li, Energy Environ. Sci. 7 (2014) 2715-2724. [113] J. Xu W. Zhang Y. Chen H. Fan D. Su G. Wang J. Mater. Chem. A 6 2018 2797 2807 J. Xu, W. Zhang, Y. Chen, H. Fan, D. Su, G. Wang, J. Mater. Chem. A 6 (2018) 2797-2807. [114] Z. Li L. Yin ACS Appl. Mater. Interfaces 7 2015 4029 4038 Z. Li, L. Yin, ACS Appl. Mater. Interfaces 7 (2015) 4029-4038. [115] X. Liang Y. Rangom C.Y. Kwok Q. Pang L.F. Nazar Adv. Mater. 29 2017 1603040 X. Liang, Y. Rangom, C.Y. Kwok, Q. Pang, L.F. Nazar, Adv. Mater. 29 (2017) 1603040. [116] J. Song D. Su X. Xie X. Guo W. Bao G. Shao G. Wang ACS Appl. Mater. Interfaces 2016 29427 J. Song, D. Su, X. Xie, X. Guo, W. Bao, G. Shao, G. Wang, ACS Appl. Mater. Interfaces (2016) 29427. [117] Y. Zhang Z. Mu C. Yang Z. Xu S. Zhang X. Zhang Y. Li J. Lai Z. Sun Y. Yang Y. Chao C. Li X. Ge W. Yang S. Guo Adv. Funct. Mater. 28 2018 1707578 Y. Zhang, Z. Mu, C. Yang, Z. Xu, S. Zhang, X. Zhang, Y. Li, J. Lai, Z. Sun, Y. Yang, Y. Chao, C. Li, X. Ge, W. Yang, S. Guo, Adv. Funct. Mater. 28 (2018) 1707578. [118] Y. Guo Z. Hu J. Wang Z. Peng J. Zhu H. Ji L.J. Wan Angew. Chem. Int. Ed. 59 2020 22963 22967 Y. Guo, Z. Hu, J. Wang, Z. Peng, J. Zhu, H. Ji, L.J. Wan, Angew. Chem. Int. Ed. 59 (2020) 22963-22967. [119] X. Tao J. Wang Z. Ying Q. Cai G. Zheng Y. Gan H. Huang Y. Xia C. Liang W. Zhang Y. Cui Nano Lett. 14 2014 5288 5294 X. Tao, J. Wang, Z. Ying, Q. Cai, G. Zheng, Y. Gan, H. Huang, Y. Xia, C. Liang, W. Zhang, Y. Cui, Nano Lett. 14 (2014) 5288-5294. [120] F. Sun J. Wang H. Chen W. Li W. Qiao D. Long L. Ling ACS Appl. Mater. Interfaces 5 2013 5630 5638 F. Sun, J. Wang, H. Chen, W. Li, W. Qiao, D. Long, L. Ling, ACS Appl. Mater. Interfaces 5 (2013) 5630-5638. [121] J.L. Shi C. Tang H.J. Peng L. Zhu X.B. Cheng J.Q. Huang W.C. Zhu Q. Zhang Small 11 2015 5243 5252 J.L. Shi, C. Tang, H.J. Peng, L. Zhu, X.B. Cheng, J.Q. Huang, W.C. Zhu, Q. Zhang, Small 11 (2015) 5243-5252. [122] H. Yang H. Li J. Li Z. Sun K. He H.M. Cheng F. Li Angew. Chem. Int. Ed. 58 2019 1996 11978 11981 H. Yang, H. Li, J. Li, Z. Sun, K. He, H.M. Cheng, F. Li, Angew. Chem. Int. Ed. 58 (2019) 11978-11996. [123] Y.X. Hu B. Luo D.L. Ye X.B. Zhu M.Q. Lyu L.Z. Wang Adv. Mater. 29 2017 1606132 Y.X. Hu, B. Luo, D.L. Ye, X.B. Zhu, M.Q. Lyu, L.Z. Wang, Adv. Mater. 29 (2017) 1606132. [124] C. Wu S. Gu Q. Zhang Y. Bai M. Li Y. Yuan H. Wang X. Liu Y. Yuan N. Zhu F. Wu H. Li L. Gu J. Lu Nat. Commun. 10 2019 73 C. Wu, S. Gu, Q. Zhang, Y. Bai, M. Li, Y. Yuan, H. Wang, X. Liu, Y. Yuan, N. Zhu, F. Wu, H. Li, L. Gu, J. Lu, Nat. Commun. 10 (2019) 73. [125] Y. Gao H. Yang X. Wang Y. Bai N. Zhu S. Guo L. Suo H. Li H. Xu C. Wu ChemSusChem 13 2020 732 740 Y. Gao, H. Yang, X. Wang, Y. Bai, N. Zhu, S. Guo, L. Suo, H. Li, H. Xu, C. Wu, ChemSusChem 13 (2020) 732-740. [126] Z. Hu Y. Guo H. Jin H. Ji L.J. Wan Chem. Commun. 56 2020 2023 2026 Z. Hu, Y. Guo, H. Jin, H. Ji, L.J. Wan, Chem. Commun. 56 (2020) 2023-2026. [127] S. Qi H. Wang J. He J. Liu C. Cui M. Wu F. Li Y. Feng J. Ma Sci. Bull. 66 2021 685 693 S. Qi, H. Wang, J. He, J. Liu, C. Cui, M. Wu, F. Li, Y. Feng, J. Ma, Sci. Bull. 66 (2021) 685-693. [128] S. Qi J. He J. Liu H. Wang M. Wu F. Li D. Wu X. Li J. Ma Adv. Funct. Mater. 31 2021 2009013 S. Qi, J. He, J. Liu, H. Wang, M. Wu, F. Li, D. Wu, X. Li, J. Ma, Adv. Funct. Mater. 31 (2021) 2009013. [129] F. Li J. He J. Liu M. Wu Y. Hou H. Wang S. Qi Q. Liu J. Hu J. Ma Angew. Chem. Int. Ed. 60 2021 6600 6608 F. Li, J. He, J. Liu, M. Wu, Y. Hou, H. Wang, S. Qi, Q. Liu, J. Hu, J. Ma, Angew. Chem. Int. Ed. 60 (2021) 6600-6608. [130] T.-T. Zuo X.-W. Wu C.-P. Yang Y.-X. Yin H. Ye N.-W. Li Y.-G. Guo Adv. Mater. 29 2017 1700389 T.-T. Zuo, X.-W. Wu, C.-P. Yang, Y.-X. Yin, H. Ye, N.-W. Li, Y.-G. Guo, Adv. Mater. 29 (2017) 1700389. [131] L.D. Reed E. Menke J. Electrochem. Soc. 160 2013 A915 A917 L.D. Reed, E. Menke, J. Electrochem. Soc. 160 (2013) A915-A917. [132] C. Wang J. Li H. Jiao J. Tu S. Jiao RSC Adv. 7 2017 32288 32293 C. Wang, J. Li, H. Jiao, J. Tu, S. Jiao, RSC Adv. 7 (2017) 32288-32293. [133] G.M. Zhou Y.B. Zhao C.X. Zu A. Manthiram Nano Energy 12 2015 240 249 G.M. Zhou, Y.B. Zhao, C.X. Zu, A. Manthiram, Nano Energy 12 (2015) 240-249. [134] L. Tan X.H. Li Z.X. Wang H.J. Guo J.X. Wang ACS Appl. Mater. Interfaces 10 2018 3707 3713 L. Tan, X.H. Li, Z.X. Wang, H.J. Guo, J.X. Wang, ACS Appl. Mater. Interfaces 10 (2018) 3707-3713. [135] X. Zheng R. Tang Y. Zhang L. Ma X. Wang Y. Dong G. Kong L. Wei Sustain. Energy Fuels 4 2020 1630 1641 X. Zheng, R. Tang, Y. Zhang, L. Ma, X. Wang, Y. Dong, G. Kong, L. Wei, Sustain. Energy Fuels 4 (2020) 1630-1641. [136] M. Zhao B.-Q. Li X. Chen J. Xie H. Yuan J.-Q. Huang Chem 6 2020 3297 3311 M. Zhao, B.-Q. Li, X. Chen, J. Xie, H. Yuan, J.-Q. Huang, Chem 6 (2020) 3297-3311. [137] S. Zhao X. Tian Y. Zhou B. Ma A. Natarajan J. Energy Chem. 46 2020 22 29 S. Zhao, X. Tian, Y. Zhou, B. Ma, A. Natarajan, J. Energy Chem. 46 (2020) 22-29. [138] X. Liang J. Yun K. Xu H. Xiang Y. Wang Y. Sun Y. Yu J. Energy Chem. 39 2019 176 181 X. Liang, J. Yun, K. Xu, H. Xiang, Y. Wang, Y. Sun, Y. Yu, J. Energy Chem. 39 (2019) 176-181. [139] H. Wang M. Ling Y. Bai S. Chen Y. Yuan G. Liu C. Wu F. Wu J. Mater. Chem. A 6 2018 6959 6966 H. Wang, M. Ling, Y. Bai, S. Chen, Y. Yuan, G. Liu, C. Wu, F. Wu, J. Mater. Chem. A 6 (2018) 6959-6966. [140] K.A. See J.A. Gerbec Y.-S. Jun F. Wudl G.D. Stucky R. Seshadri Adv. Energy Mater. 3 2013 1056 1061 K.A. See, J.A. Gerbec, Y.-S. Jun, F. Wudl, G.D. Stucky, R. Seshadri, Adv. Energy Mater. 3 (2013) 1056-1061. [141] X. Yu M.J. Boyer G.S. Hwang A. Manthiram Adv. Energy Mater. 9 2019 1803794 X. Yu, M.J. Boyer, G.S. Hwang, A. Manthiram, Adv. Energy Mater. 9 (2019) 1803794. [142] Y. Zhao D. Wang X. Li Q. Yang Y. Guo F. Mo Q. Li C. Peng H. Li C. Zhi Adv. Mater. 32 2020 2003070 Y. Zhao, D. Wang, X. Li, Q. Yang, Y. Guo, F. Mo, Q. Li, C. Peng, H. Li, C. Zhi, Adv. Mater. 32 (2020) 2003070. [143] X. Wu A. Markir Y. Xu E.C. Hu K.T. Dai C. Zhang W. Shin D.P. Leonard K.I. Kim X. Ji Adv. Energy Mater. 9 2019 1902422 X. Wu, A. Markir, Y. Xu, E.C. Hu, K.T. Dai, C. Zhang, W. Shin, D.P. Leonard, K.I. Kim, X. Ji, Adv. Energy Mater. 9 (2019) 1902422. [144] D.H. Jeon Energy Storage Mater. 18 2019 139 147 D.H. Jeon, Energy Storage Mater. 18 (2019) 139-147. [145] M. Zhao X. Chen X.-Y. Li B.-Q. Li J.-Q. Huang Adv. Mater. 39 2021 2007298 M. Zhao, X. Chen, X.-Y. Li, B.-Q. Li, J.-Q. Huang, Adv. Mater. 39 (2021) 2007298. [146] J.E. Knoop S. Ahn J. Energy Chem. 47 2020 86 106 J.E. Knoop, S. Ahn, J. Energy Chem. 47 (2020) 86-106. [147] L. Kong Q. Jin X.-T. Zhang B.-Q. Li J.-X. Chen W.-C. Zhu J.-Q. Huang Q. Zhang J. Energy Chem. 39 2019 17 22 L. Kong, Q. Jin, X.-T. Zhang, B.-Q. Li, J.-X. Chen, W.-C. Zhu, J.-Q. Huang, Q. Zhang, J. Energy Chem. 39 (2019) 17-22.",
      "scopus-id": "85106870434",
      "coredata": {
        "eid": "1-s2.0-S2095495621002667",
        "dc:description": "Multivalent metal–sulfur (M-S, where M = Mg, Al, Ca, Zn, Fe, etc.) batteries offer unique opportunities to achieve high specific capacity, elemental abundancy and cost-effectiveness beyond lithium-ion batteries (LIBs). However, the slow diffusion of multivalent-metal ions and the shuttle of soluble polysulfide result in impoverished reversible capacity and limited cycle performance of M−S (Mg–S, Al–S, Ca–S, Zn–S, Fe–S, etc.) batteries. It is a necessity to optimize the electrochemical performance, while deepening the understanding of the unique electrochemical reaction mechanism, such as the intrinsic multi-electron reaction process, polysulfides dissolution and the instability of metal anodes. To solve these problems, we have summarized the state-of-the-art progress of current M−S batteries, and sorted out the existing challenges for different multivalent M−S batteries according to sulfur cathode, electrolytes, metallic anode and current collectors/separators, respectively. In this literature, we have surveyed and exemplified the strategies developed for better M−S batteries to strengthen the application of green, cost-effective and high energy density M−S batteries.",
        "openArchiveArticle": "false",
        "prism:coverDate": "2022-01-31",
        "openaccessUserLicense": null,
        "prism:aggregationType": "Journal",
        "prism:url": "https://api.elsevier.com/content/article/pii/S2095495621002667",
        "dc:creator": [
          {
            "@_fa": "true",
            "$": "Yang, Yue"
          },
          {
            "@_fa": "true",
            "$": "Yang, Haoyi"
          },
          {
            "@_fa": "true",
            "$": "Wang, Xinran"
          },
          {
            "@_fa": "true",
            "$": "Bai, Ying"
          },
          {
            "@_fa": "true",
            "$": "Wu, Chuan"
          }
        ],
        "link": [
          {
            "@_fa": "true",
            "@rel": "self",
            "@href": "https://api.elsevier.com/content/article/pii/S2095495621002667"
          },
          {
            "@_fa": "true",
            "@rel": "scidir",
            "@href": "https://www.sciencedirect.com/science/article/pii/S2095495621002667"
          }
        ],
        "dc:format": "application/json",
        "openaccessType": null,
        "pii": "S2095-4956(21)00266-7",
        "prism:volume": "64",
        "prism:publisher": "Science Press and Dalian Institute of Chemical Physics, Chinese Academy of Sciences. Published by ELSEVIER B.V. and Science Press.",
        "dc:title": "Multivalent metal–sulfur batteries for green and cost-effective energy storage: Current status and challenges",
        "prism:copyright": "© 2021 Science Press and Dalian Institute of Chemical Physics, Chinese Academy of Sciences. Published by ELSEVIER B.V. and Science Press. All rights reserved.",
        "openaccess": "0",
        "prism:issn": "20954956",
        "dcterms:subject": [
          {
            "@_fa": "true",
            "$": "Multivalent metal-sulfur batteries"
          },
          {
            "@_fa": "true",
            "$": "Cost-effectiveness"
          },
          {
            "@_fa": "true",
            "$": "Green energy storage"
          },
          {
            "@_fa": "true",
            "$": "Shuttle effect"
          },
          {
            "@_fa": "true",
            "$": "Electrolyte"
          }
        ],
        "openaccessArticle": "false",
        "prism:publicationName": "Journal of Energy Chemistry",
        "openaccessSponsorType": null,
        "prism:pageRange": "144-165",
        "prism:endingPage": "165",
        "pubType": "rev",
        "prism:coverDisplayDate": "January 2022",
        "prism:doi": "10.1016/j.jechem.2021.04.054",
        "prism:startingPage": "144",
        "dc:identifier": "doi:10.1016/j.jechem.2021.04.054",
        "openaccessSponsorName": null
      },
      "objects": {
        "object": [
          {
            "@category": "standard",
            "@height": "665",
            "@width": "621",
            "@_fa": "true",
            "$": "https://api.elsevier.com/content/object/eid/1-s2.0-S2095495621002667-gr10.jpg?httpAccept=%2A%2F%2A",
            "@multimediatype": "JPEG image file",
            "@type": "IMAGE-DOWNSAMPLED",
            "@size": "70722",
            "@ref": "gr10",
            "@mimetype": "image/jpeg"
          },
          {
            "@category": "standard",
            "@height": "598",
            "@width": "533",
            "@_fa": "true",
            "$": "https://api.elsevier.com/content/object/eid/1-s2.0-S2095495621002667-gr11.jpg?httpAccept=%2A%2F%2A",
            "@multimediatype": "JPEG image file",
            "@type": "IMAGE-DOWNSAMPLED",
            "@size": "105905",
            "@ref": "gr11",
            "@mimetype": "image/jpeg"
          },
          {
            "@category": "standard",
            "@height": "710",
            "@width": "778",
            "@_fa": "true",
            "$": "https://api.elsevier.com/content/object/eid/1-s2.0-S2095495621002667-gr12.jpg?httpAccept=%2A%2F%2A",
            "@multimediatype": "JPEG image file",
            "@type": "IMAGE-DOWNSAMPLED",
            "@size": "120829",
            "@ref": "gr12",
            "@mimetype": "image/jpeg"
          },
          {
            "@category": "standard",
            "@height": "614",
            "@width": "778",
            "@_fa": "true",
            "$": "https://api.elsevier.com/content/object/eid/1-s2.0-S2095495621002667-gr13.jpg?httpAccept=%2A%2F%2A",
            "@multimediatype": "JPEG image file",
            "@type": "IMAGE-DOWNSAMPLED",
            "@size": "106915",
            "@ref": "gr13",
            "@mimetype": "image/jpeg"
          },
          {
            "@category": "standard",
            "@height": "496",
            "@width": "645",
            "@_fa": "true",
            "$": "https://api.elsevier.com/content/object/eid/1-s2.0-S2095495621002667-gr14.jpg?httpAccept=%2A%2F%2A",
            "@multimediatype": "JPEG image file",
            "@type": "IMAGE-DOWNSAMPLED",
            "@size": "104580",
            "@ref": "gr14",
            "@mimetype": "image/jpeg"
          },
          {
            "@category": "standard",
            "@height": "696",
            "@width": "645",
            "@_fa": "true",
            "$": "https://api.elsevier.com/content/object/eid/1-s2.0-S2095495621002667-gr15.jpg?httpAccept=%2A%2F%2A",
            "@multimediatype": "JPEG image file",
            "@type": "IMAGE-DOWNSAMPLED",
            "@size": "125505",
            "@ref": "gr15",
            "@mimetype": "image/jpeg"
          },
          {
            "@category": "standard",
            "@height": "365",
            "@width": "378",
            "@_fa": "true",
            "$": "https://api.elsevier.com/content/object/eid/1-s2.0-S2095495621002667-gr16.jpg?httpAccept=%2A%2F%2A",
            "@multimediatype": "JPEG image file",
            "@type": "IMAGE-DOWNSAMPLED",
            "@size": "46565",
            "@ref": "gr16",
            "@mimetype": "image/jpeg"
          },
          {
            "@category": "standard",
            "@height": "856",
            "@width": "756",
            "@_fa": "true",
            "$": "https://api.elsevier.com/content/object/eid/1-s2.0-S2095495621002667-gr2.jpg?httpAccept=%2A%2F%2A",
            "@multimediatype": "JPEG image file",
            "@type": "IMAGE-DOWNSAMPLED",
            "@size": "205604",
            "@ref": "gr2",
            "@mimetype": "image/jpeg"
          },
          {
            "@category": "standard",
            "@height": "1002",
            "@width": "519",
            "@_fa": "true",
            "$": "https://api.elsevier.com/content/object/eid/1-s2.0-S2095495621002667-gr3.jpg?httpAccept=%2A%2F%2A",
            "@multimediatype": "JPEG image file",
            "@type": "IMAGE-DOWNSAMPLED",
            "@size": "164200",
            "@ref": "gr3",
            "@mimetype": "image/jpeg"
          },
          {
            "@category": "standard",
            "@height": "808",
            "@width": "778",
            "@_fa": "true",
            "$": "https://api.elsevier.com/content/object/eid/1-s2.0-S2095495621002667-gr4.jpg?httpAccept=%2A%2F%2A",
            "@multimediatype": "JPEG image file",
            "@type": "IMAGE-DOWNSAMPLED",
            "@size": "175247",
            "@ref": "gr4",
            "@mimetype": "image/jpeg"
          },
          {
            "@category": "standard",
            "@height": "684",
            "@width": "778",
            "@_fa": "true",
            "$": "https://api.elsevier.com/content/object/eid/1-s2.0-S2095495621002667-gr5.jpg?httpAccept=%2A%2F%2A",
            "@multimediatype": "JPEG image file",
            "@type": "IMAGE-DOWNSAMPLED",
            "@size": "127071",
            "@ref": "gr5",
            "@mimetype": "image/jpeg"
          },
          {
            "@category": "standard",
            "@height": "609",
            "@width": "778",
            "@_fa": "true",
            "$": "https://api.elsevier.com/content/object/eid/1-s2.0-S2095495621002667-gr6.jpg?httpAccept=%2A%2F%2A",
            "@multimediatype": "JPEG image file",
            "@type": "IMAGE-DOWNSAMPLED",
            "@size": "145686",
            "@ref": "gr6",
            "@mimetype": "image/jpeg"
          },
          {
            "@category": "standard",
            "@height": "546",
            "@width": "645",
            "@_fa": "true",
            "$": "https://api.elsevier.com/content/object/eid/1-s2.0-S2095495621002667-gr7.jpg?httpAccept=%2A%2F%2A",
            "@multimediatype": "JPEG image file",
            "@type": "IMAGE-DOWNSAMPLED",
            "@size": "137194",
            "@ref": "gr7",
            "@mimetype": "image/jpeg"
          },
          {
            "@category": "standard",
            "@height": "595",
            "@width": "645",
            "@_fa": "true",
            "$": "https://api.elsevier.com/content/object/eid/1-s2.0-S2095495621002667-gr8.jpg?httpAccept=%2A%2F%2A",
            "@multimediatype": "JPEG image file",
            "@type": "IMAGE-DOWNSAMPLED",
            "@size": "121807",
            "@ref": "gr8",
            "@mimetype": "image/jpeg"
          },
          {
            "@category": "standard",
            "@height": "948",
            "@width": "756",
            "@_fa": "true",
            "$": "https://api.elsevier.com/content/object/eid/1-s2.0-S2095495621002667-gr9.jpg?httpAccept=%2A%2F%2A",
            "@multimediatype": "JPEG image file",
            "@type": "IMAGE-DOWNSAMPLED",
            "@size": "193935",
            "@ref": "gr9",
            "@mimetype": "image/jpeg"
          },
          {
            "@category": "standard",
            "@height": "200",
            "@width": "397",
            "@_fa": "true",
            "$": "https://api.elsevier.com/content/object/eid/1-s2.0-S2095495621002667-ga1.jpg?httpAccept=%2A%2F%2A",
            "@multimediatype": "JPEG image file",
            "@type": "IMAGE-DOWNSAMPLED",
            "@size": "22717",
            "@ref": "ga1",
            "@mimetype": "image/jpeg"
          },
          {
            "@category": "standard",
            "@height": "529",
            "@width": "623",
            "@_fa": "true",
            "$": "https://api.elsevier.com/content/object/eid/1-s2.0-S2095495621002667-gr1.jpg?httpAccept=%2A%2F%2A",
            "@multimediatype": "JPEG image file",
            "@type": "IMAGE-DOWNSAMPLED",
            "@size": "68692",
            "@ref": "gr1",
            "@mimetype": "image/jpeg"
          },
          {
            "@category": "thumbnail",
            "@height": "164",
            "@width": "153",
            "@_fa": "true",
            "$": "https://api.elsevier.com/content/object/eid/1-s2.0-S2095495621002667-gr10.sml?httpAccept=%2A%2F%2A",
            "@multimediatype": "GIF image file",
            "@type": "IMAGE-THUMBNAIL",
            "@size": "7101",
            "@ref": "gr10",
            "@mimetype": "image/gif"
          },
          {
            "@category": "thumbnail",
            "@height": "164",
            "@width": "146",
            "@_fa": "true",
            "$": "https://api.elsevier.com/content/object/eid/1-s2.0-S2095495621002667-gr11.sml?httpAccept=%2A%2F%2A",
            "@multimediatype": "GIF image file",
            "@type": "IMAGE-THUMBNAIL",
            "@size": "11404",
            "@ref": "gr11",
            "@mimetype": "image/gif"
          },
          {
            "@category": "thumbnail",
            "@height": "163",
            "@width": "179",
            "@_fa": "true",
            "$": "https://api.elsevier.com/content/object/eid/1-s2.0-S2095495621002667-gr12.sml?httpAccept=%2A%2F%2A",
            "@multimediatype": "GIF image file",
            "@type": "IMAGE-THUMBNAIL",
            "@size": "10443",
            "@ref": "gr12",
            "@mimetype": "image/gif"
          },
          {
            "@category": "thumbnail",
            "@height": "164",
            "@width": "208",
            "@_fa": "true",
            "$": "https://api.elsevier.com/content/object/eid/1-s2.0-S2095495621002667-gr13.sml?httpAccept=%2A%2F%2A",
            "@multimediatype": "GIF image file",
            "@type": "IMAGE-THUMBNAIL",
            "@size": "11160",
            "@ref": "gr13",
            "@mimetype": "image/gif"
          },
          {
            "@category": "thumbnail",
            "@height": "164",
            "@width": "213",
            "@_fa": "true",
            "$": "https://api.elsevier.com/content/object/eid/1-s2.0-S2095495621002667-gr14.sml?httpAccept=%2A%2F%2A",
            "@multimediatype": "GIF image file",
            "@type": "IMAGE-THUMBNAIL",
            "@size": "15541",
            "@ref": "gr14",
            "@mimetype": "image/gif"
          },
          {
            "@category": "thumbnail",
            "@height": "164",
            "@width": "152",
            "@_fa": "true",
            "$": "https://api.elsevier.com/content/object/eid/1-s2.0-S2095495621002667-gr15.sml?httpAccept=%2A%2F%2A",
            "@multimediatype": "GIF image file",
            "@type": "IMAGE-THUMBNAIL",
            "@size": "11896",
            "@ref": "gr15",
            "@mimetype": "image/gif"
          },
          {
            "@category": "thumbnail",
            "@height": "164",
            "@width": "170",
            "@_fa": "true",
            "$": "https://api.elsevier.com/content/object/eid/1-s2.0-S2095495621002667-gr16.sml?httpAccept=%2A%2F%2A",
            "@multimediatype": "GIF image file",
            "@type": "IMAGE-THUMBNAIL",
            "@size": "13888",
            "@ref": "gr16",
            "@mimetype": "image/gif"
          },
          {
            "@category": "thumbnail",
            "@height": "164",
            "@width": "145",
            "@_fa": "true",
            "$": "https://api.elsevier.com/content/object/eid/1-s2.0-S2095495621002667-gr2.sml?httpAccept=%2A%2F%2A",
            "@multimediatype": "GIF image file",
            "@type": "IMAGE-THUMBNAIL",
            "@size": "11498",
            "@ref": "gr2",
            "@mimetype": "image/gif"
          },
          {
            "@category": "thumbnail",
            "@height": "164",
            "@width": "85",
            "@_fa": "true",
            "$": "https://api.elsevier.com/content/object/eid/1-s2.0-S2095495621002667-gr3.sml?httpAccept=%2A%2F%2A",
            "@multimediatype": "GIF image file",
            "@type": "IMAGE-THUMBNAIL",
            "@size": "8399",
            "@ref": "gr3",
            "@mimetype": "image/gif"
          },
          {
            "@category": "thumbnail",
            "@height": "164",
            "@width": "158",
            "@_fa": "true",
            "$": "https://api.elsevier.com/content/object/eid/1-s2.0-S2095495621002667-gr4.sml?httpAccept=%2A%2F%2A",
            "@multimediatype": "GIF image file",
            "@type": "IMAGE-THUMBNAIL",
            "@size": "12249",
            "@ref": "gr4",
            "@mimetype": "image/gif"
          },
          {
            "@category": "thumbnail",
            "@height": "163",
            "@width": "186",
            "@_fa": "true",
            "$": "https://api.elsevier.com/content/object/eid/1-s2.0-S2095495621002667-gr5.sml?httpAccept=%2A%2F%2A",
            "@multimediatype": "GIF image file",
            "@type": "IMAGE-THUMBNAIL",
            "@size": "10549",
            "@ref": "gr5",
            "@mimetype": "image/gif"
          },
          {
            "@category": "thumbnail",
            "@height": "163",
            "@width": "209",
            "@_fa": "true",
            "$": "https://api.elsevier.com/content/object/eid/1-s2.0-S2095495621002667-gr6.sml?httpAccept=%2A%2F%2A",
            "@multimediatype": "GIF image file",
            "@type": "IMAGE-THUMBNAIL",
            "@size": "14602",
            "@ref": "gr6",
            "@mimetype": "image/gif"
          },
          {
            "@category": "thumbnail",
            "@height": "163",
            "@width": "193",
            "@_fa": "true",
            "$": "https://api.elsevier.com/content/object/eid/1-s2.0-S2095495621002667-gr7.sml?httpAccept=%2A%2F%2A",
            "@multimediatype": "GIF image file",
            "@type": "IMAGE-THUMBNAIL",
            "@size": "21920",
            "@ref": "gr7",
            "@mimetype": "image/gif"
          },
          {
            "@category": "thumbnail",
            "@height": "164",
            "@width": "178",
            "@_fa": "true",
            "$": "https://api.elsevier.com/content/object/eid/1-s2.0-S2095495621002667-gr8.sml?httpAccept=%2A%2F%2A",
            "@multimediatype": "GIF image file",
            "@type": "IMAGE-THUMBNAIL",
            "@size": "12890",
            "@ref": "gr8",
            "@mimetype": "image/gif"
          },
          {
            "@category": "thumbnail",
            "@height": "163",
            "@width": "130",
            "@_fa": "true",
            "$": "https://api.elsevier.com/content/object/eid/1-s2.0-S2095495621002667-gr9.sml?httpAccept=%2A%2F%2A",
            "@multimediatype": "GIF image file",
            "@type": "IMAGE-THUMBNAIL",
            "@size": "9170",
            "@ref": "gr9",
            "@mimetype": "image/gif"
          },
          {
            "@category": "thumbnail",
            "@height": "110",
            "@width": "219",
            "@_fa": "true",
            "$": "https://api.elsevier.com/content/object/eid/1-s2.0-S2095495621002667-ga1.sml?httpAccept=%2A%2F%2A",
            "@multimediatype": "GIF image file",
            "@type": "IMAGE-THUMBNAIL",
            "@size": "7244",
            "@ref": "ga1",
            "@mimetype": "image/gif"
          },
          {
            "@category": "thumbnail",
            "@height": "164",
            "@width": "193",
            "@_fa": "true",
            "$": "https://api.elsevier.com/content/object/eid/1-s2.0-S2095495621002667-gr1.sml?httpAccept=%2A%2F%2A",
            "@multimediatype": "GIF image file",
            "@type": "IMAGE-THUMBNAIL",
            "@size": "8818",
            "@ref": "gr1",
            "@mimetype": "image/gif"
          },
          {
            "@category": "high",
            "@height": "1767",
            "@width": "1650",
            "@_fa": "true",
            "$": "https://api.elsevier.com/content/object/eid/1-s2.0-S2095495621002667-gr10_lrg.jpg?httpAccept=%2A%2F%2A",
            "@multimediatype": "JPEG image file",
            "@type": "IMAGE-HIGH-RES",
            "@size": "193456",
            "@ref": "gr10",
            "@mimetype": "image/jpeg"
          },
          {
            "@category": "high",
            "@height": "1590",
            "@width": "1417",
            "@_fa": "true",
            "$": "https://api.elsevier.com/content/object/eid/1-s2.0-S2095495621002667-gr11_lrg.jpg?httpAccept=%2A%2F%2A",
            "@multimediatype": "JPEG image file",
            "@type": "IMAGE-HIGH-RES",
            "@size": "330402",
            "@ref": "gr11",
            "@mimetype": "image/jpeg"
          },
          {
            "@category": "high",
            "@height": "1887",
            "@width": "2067",
            "@_fa": "true",
            "$": "https://api.elsevier.com/content/object/eid/1-s2.0-S2095495621002667-gr12_lrg.jpg?httpAccept=%2A%2F%2A",
            "@multimediatype": "JPEG image file",
            "@type": "IMAGE-HIGH-RES",
            "@size": "329970",
            "@ref": "gr12",
            "@mimetype": "image/jpeg"
          },
          {
            "@category": "high",
            "@height": "1630",
            "@width": "2067",
            "@_fa": "true",
            "$": "https://api.elsevier.com/content/object/eid/1-s2.0-S2095495621002667-gr13_lrg.jpg?httpAccept=%2A%2F%2A",
            "@multimediatype": "JPEG image file",
            "@type": "IMAGE-HIGH-RES",
            "@size": "293977",
            "@ref": "gr13",
            "@mimetype": "image/jpeg"
          },
          {
            "@category": "high",
            "@height": "1316",
            "@width": "1713",
            "@_fa": "true",
            "$": "https://api.elsevier.com/content/object/eid/1-s2.0-S2095495621002667-gr14_lrg.jpg?httpAccept=%2A%2F%2A",
            "@multimediatype": "JPEG image file",
            "@type": "IMAGE-HIGH-RES",
            "@size": "302159",
            "@ref": "gr14",
            "@mimetype": "image/jpeg"
          },
          {
            "@category": "high",
            "@height": "1849",
            "@width": "1713",
            "@_fa": "true",
            "$": "https://api.elsevier.com/content/object/eid/1-s2.0-S2095495621002667-gr15_lrg.jpg?httpAccept=%2A%2F%2A",
            "@multimediatype": "JPEG image file",
            "@type": "IMAGE-HIGH-RES",
            "@size": "352107",
            "@ref": "gr15",
            "@mimetype": "image/jpeg"
          },
          {
            "@category": "high",
            "@height": "969",
            "@width": "1004",
            "@_fa": "true",
            "$": "https://api.elsevier.com/content/object/eid/1-s2.0-S2095495621002667-gr16_lrg.jpg?httpAccept=%2A%2F%2A",
            "@multimediatype": "JPEG image file",
            "@type": "IMAGE-HIGH-RES",
            "@size": "129985",
            "@ref": "gr16",
            "@mimetype": "image/jpeg"
          },
          {
            "@category": "high",
            "@height": "2274",
            "@width": "2008",
            "@_fa": "true",
            "$": "https://api.elsevier.com/content/object/eid/1-s2.0-S2095495621002667-gr2_lrg.jpg?httpAccept=%2A%2F%2A",
            "@multimediatype": "JPEG image file",
            "@type": "IMAGE-HIGH-RES",
            "@size": "648892",
            "@ref": "gr2",
            "@mimetype": "image/jpeg"
          },
          {
            "@category": "high",
            "@height": "2662",
            "@width": "1379",
            "@_fa": "true",
            "$": "https://api.elsevier.com/content/object/eid/1-s2.0-S2095495621002667-gr3_lrg.jpg?httpAccept=%2A%2F%2A",
            "@multimediatype": "JPEG image file",
            "@type": "IMAGE-HIGH-RES",
            "@size": "498572",
            "@ref": "gr3",
            "@mimetype": "image/jpeg"
          },
          {
            "@category": "high",
            "@height": "2147",
            "@width": "2067",
            "@_fa": "true",
            "$": "https://api.elsevier.com/content/object/eid/1-s2.0-S2095495621002667-gr4_lrg.jpg?httpAccept=%2A%2F%2A",
            "@multimediatype": "JPEG image file",
            "@type": "IMAGE-HIGH-RES",
            "@size": "525741",
            "@ref": "gr4",
            "@mimetype": "image/jpeg"
          },
          {
            "@category": "high",
            "@height": "1816",
            "@width": "2067",
            "@_fa": "true",
            "$": "https://api.elsevier.com/content/object/eid/1-s2.0-S2095495621002667-gr5_lrg.jpg?httpAccept=%2A%2F%2A",
            "@multimediatype": "JPEG image file",
            "@type": "IMAGE-HIGH-RES",
            "@size": "369612",
            "@ref": "gr5",
            "@mimetype": "image/jpeg"
          },
          {
            "@category": "high",
            "@height": "1617",
            "@width": "2067",
            "@_fa": "true",
            "$": "https://api.elsevier.com/content/object/eid/1-s2.0-S2095495621002667-gr6_lrg.jpg?httpAccept=%2A%2F%2A",
            "@multimediatype": "JPEG image file",
            "@type": "IMAGE-HIGH-RES",
            "@size": "422673",
            "@ref": "gr6",
            "@mimetype": "image/jpeg"
          },
          {
            "@category": "high",
            "@height": "1451",
            "@width": "1713",
            "@_fa": "true",
            "$": "https://api.elsevier.com/content/object/eid/1-s2.0-S2095495621002667-gr7_lrg.jpg?httpAccept=%2A%2F%2A",
            "@multimediatype": "JPEG image file",
            "@type": "IMAGE-HIGH-RES",
            "@size": "427029",
            "@ref": "gr7",
            "@mimetype": "image/jpeg"
          },
          {
            "@category": "high",
            "@height": "1579",
            "@width": "1713",
            "@_fa": "true",
            "$": "https://api.elsevier.com/content/object/eid/1-s2.0-S2095495621002667-gr8_lrg.jpg?httpAccept=%2A%2F%2A",
            "@multimediatype": "JPEG image file",
            "@type": "IMAGE-HIGH-RES",
            "@size": "347905",
            "@ref": "gr8",
            "@mimetype": "image/jpeg"
          },
          {
            "@category": "high",
            "@height": "2518",
            "@width": "2008",
            "@_fa": "true",
            "$": "https://api.elsevier.com/content/object/eid/1-s2.0-S2095495621002667-gr9_lrg.jpg?httpAccept=%2A%2F%2A",
            "@multimediatype": "JPEG image file",
            "@type": "IMAGE-HIGH-RES",
            "@size": "595690",
            "@ref": "gr9",
            "@mimetype": "image/jpeg"
          },
          {
            "@category": "high",
            "@height": "531",
            "@width": "1056",
            "@_fa": "true",
            "$": "https://api.elsevier.com/content/object/eid/1-s2.0-S2095495621002667-ga1_lrg.jpg?httpAccept=%2A%2F%2A",
            "@multimediatype": "JPEG image file",
            "@type": "IMAGE-HIGH-RES",
            "@size": "65483",
            "@ref": "ga1",
            "@mimetype": "image/jpeg"
          },
          {
            "@category": "high",
            "@height": "1405",
            "@width": "1654",
            "@_fa": "true",
            "$": "https://api.elsevier.com/content/object/eid/1-s2.0-S2095495621002667-gr1_lrg.jpg?httpAccept=%2A%2F%2A",
            "@multimediatype": "JPEG image file",
            "@type": "IMAGE-HIGH-RES",
            "@size": "203203",
            "@ref": "gr1",
            "@mimetype": "image/jpeg"
          },
          {
            "@category": "thumbnail",
            "@_fa": "true",
            "$": "https://api.elsevier.com/content/object/eid/1-s2.0-S2095495621002667-si1.svg?httpAccept=%2A%2F%2A",
            "@multimediatype": "Scalable Vector Graphics file",
            "@type": "ALTIMG",
            "@size": "18362",
            "@ref": "si1",
            "@mimetype": "image/svg+xml"
          },
          {
            "@category": "thumbnail",
            "@_fa": "true",
            "$": "https://api.elsevier.com/content/object/eid/1-s2.0-S2095495621002667-si2.svg?httpAccept=%2A%2F%2A",
            "@multimediatype": "Scalable Vector Graphics file",
            "@type": "ALTIMG",
            "@size": "13953",
            "@ref": "si2",
            "@mimetype": "image/svg+xml"
          },
          {
            "@category": "thumbnail",
            "@_fa": "true",
            "$": "https://api.elsevier.com/content/object/eid/1-s2.0-S2095495621002667-si3.svg?httpAccept=%2A%2F%2A",
            "@multimediatype": "Scalable Vector Graphics file",
            "@type": "ALTIMG",
            "@size": "12982",
            "@ref": "si3",
            "@mimetype": "image/svg+xml"
          },
          {
            "@category": "thumbnail",
            "@_fa": "true",
            "$": "https://api.elsevier.com/content/object/eid/1-s2.0-S2095495621002667-si4.svg?httpAccept=%2A%2F%2A",
            "@multimediatype": "Scalable Vector Graphics file",
            "@type": "ALTIMG",
            "@size": "12115",
            "@ref": "si4",
            "@mimetype": "image/svg+xml"
          },
          {
            "@category": "thumbnail",
            "@_fa": "true",
            "$": "https://api.elsevier.com/content/object/eid/1-s2.0-S2095495621002667-si5.svg?httpAccept=%2A%2F%2A",
            "@multimediatype": "Scalable Vector Graphics file",
            "@type": "ALTIMG",
            "@size": "9555",
            "@ref": "si5",
            "@mimetype": "image/svg+xml"
          },
          {
            "@category": "standard",
            "@_fa": "true",
            "$": "https://api.elsevier.com/content/object/eid/1-s2.0-S2095495621002667-am.pdf?httpAccept=%2A%2F%2A",
            "@multimediatype": "Acrobat PDF file",
            "@type": "AAM-PDF",
            "@size": "2490933",
            "@ref": "am",
            "@mimetype": "application/pdf"
          }
        ]
      },
      "link": {
        "@rel": "abstract",
        "@href": "https://api.elsevier.com/content/abstract/scopus_id/85106870434"
      }
    }
  }
}