{
  "metadata": {
    "title": "NiCo-LDH/Ti<ce:inf loc=post>3</ce:inf>C<ce:inf loc=post>2</ce:inf> MXene hybrid materials for lithium ion battery with high-rate capability and long cycle life",
    "authors": "; ; ",
    "journal": "Journal of Energy Chemistry",
    "date": "2020-11-30",
    "doi": "10.1016/j.jechem.2020.03.018",
    "abstract": "",
    "uri": "https://api.elsevier.com/content/article/pii/S2095495620301339",
    "pii": "S2095495620301339"
  },
  "fulltext": {
    "full-text-retrieval-response": {
      "scopus-eid": "2-s2.0-85082872371",
      "originalText": "serial JL 286353 291210 291711 291744 291809 31 Journal of Energy Chemistry JOURNALENERGYCHEMISTRY 2020-03-19 2020-03-19 2020-04-09 2020-04-09 2020-09-19T03:55:24 1-s2.0-S2095495620301339 S2095-4956(20)30133-9 S2095495620301339 10.1016/j.jechem.2020.03.018 S300 S300.2 FULL-TEXT 1-s2.0-S2095495620X00040 2020-09-19T03:03:20.123951Z 0 0 20201101 20201130 2020 2020-03-19T17:09:13.595857Z absattachment articleinfo articletitlenorm authfirstinitialnorm authfirstsurnamenorm cid cids contenttype copyright crossmark dateloaded dateloadedtxt datesearch datesort dateupdated dco docsubtype doctype doi eid ewtransactionid hubeid indexeddate issn issnnorm itemstage itemtransactionid itemweight openaccess openarchive pg pgfirst pglast pii piinorm pubdateend pubdatestart pubdatetxt pubyr sortorder srctitle srctitlenorm srctype ssids alllist content subj subheadings suppl tomb volfirst volissue volumelist webpdf webpdfpagecount yearnav figure table e-component body mmlmath acknowledge affil appendices articletitle auth authfirstini authfull authkeywords authlast footnotes grantnumber grantsponsor grantsponsorid orcid primabst ref specialabst 2095-4956 20954956 false 50 50 C Volume 50 16 143 153 143 153 202011 November 2020 2020-11-01 2020-11-30 2020 article fla © 2020 Science Press and Dalian Institute of Chemical Physics, Chinese Academy of Sciences. Published by Elsevier B.V. and Science Press. All rights reserved. NICOLDHTI3C2MXENEHYBRIDMATERIALSFORLITHIUMIONBATTERYHIGHRATECAPABILITYLONGCYCLELIFE ZHANG R 1 Introduction 2 Experimental 2.1 Synthesis of NiCo-LDH/Ti3C2 nanocomposites material 2.2 Material characterization 2.3 Electrochemical measurements 3 Results and discussion 4 Conclusions Acknowledgments Appendix Supplementary materials References ZHAO 2012 675 694 M WANG 2017 1286 1293 X WANG 2017 306 314 D FAN 2014 7040 7066 G KUTLU 2013 91 95 B LUO 2014 1593 1596 J LIU 2019 12451 12456 J FANG 2019 5635 5645 G LEI 2019 C HE 2010 570 573 Y ZHU 2014 364 369 X ZHAO 2016 603 613 M SHI 2017 9 17 J LI 2011 3159 3161 B YUE 2020 237 246 B XIONG 2018 1768 1777 P JIA 2017 29 Y ZHAO 2014 2938 2946 J NAGUIB 2012 1322 1331 M FENG 2017 161 166 A NAGUIB 2012 61 64 M DALLAGNESE 2014 118 122 Y NAGUIB 2015 128 135 M ZHANG 2018 73 85 X JIANG 2015 445 451 J CHEN 2014 934 942 H LIU 2005 13869 13874 Z LIPATOV 2016 9 A YANG 2018 11 J YAN 2017 37 50 Q WU 2008 2217 2220 Z LEE 2011 19445 19454 J YANG 2007 2095 2101 L PATIL 2014 19075 19083 U REN 2016 689 693 C BAO 2018 W NAGUIB 2014 7420 7423 M ZHAO 2016 15661 15667 C LI 2018 6115 6119 T HALIM 2016 406 417 J SUN 2019 460 467 S YANG 2015 2109 2116 J YU 2014 3097 3104 C HAN 2016 21011 21019 M YU 2018 181 190 M MASHTALIR 2014 14334 14338 O MA 2018 9 K YE 2017 9 C XIA 2017 G ZHU 2017 54939 54946 S PARK 2014 7 G ZHANG 2019 190 197 M HU 2013 1130 1136 Y DU 2017 690 699 F SHI 2018 16437 16443 L ZHOU 2015 12022 12029 X LIU 2015 13161 13166 H WU 2017 8 X LI 2018 1234 1243 J ZHANG 2016 3937 3943 C KONG 2015 11200 11208 L AUGUSTYN 2013 518 522 V WU 2017 1560 1565 Y SU 2013 276 282 L TANG 2012 16909 16916 Q LIN 2015 14096 14100 Z LUO 2016 2491 2499 J LUO 2017 2459 2469 J ZHANGX2020X143 ZHANGX2020X143X153 ZHANGX2020X143XR ZHANGX2020X143X153XR 2022-04-09T00:00:00.000Z 2022-04-09T00:00:00.000Z http://creativecommons.org/licenses/by-nc-nd/4.0/ © 2020 Science Press and Dalian Institute of Chemical Physics, Chinese Academy of Sciences. Published by Elsevier B.V. and Science Press. All rights reserved. 2020-03-14T07:05:31.340Z http://vtw.elsevier.com/data/voc/AddOnTypes/50.7/eoas NSFC National Natural Science Foundation of China http://data.elsevier.com/vocabulary/SciValFunders/501100001809 http://sws.geonames.org/1814991 CU Chulalongkorn University http://data.elsevier.com/vocabulary/SciValFunders/501100002873 http://sws.geonames.org/1605651 item S2095-4956(20)30133-9 S2095495620301339 1-s2.0-S2095495620301339 10.1016/j.jechem.2020.03.018 286353 2020-09-19T03:03:20.123951Z 2020-11-01 2020-11-30 1-s2.0-S2095495620301339-main.pdf https://s3-eu-west-1.amazonaws.com/prod-ucs-content-store-eu-west/content/pii:S2095495620301339/MAIN/application/pdf/2083dd73cc707b6b58120c417873b79f/main.pdf main.pdf pdf true 5526431 MAIN 11 1-s2.0-S2095495620301339-main_1.png https://s3-eu-west-1.amazonaws.com/prod-ucs-content-store-eu-west/content/pii:S2095495620301339/PREVIEW/image/png/89786f9254c4631055c3b709273219e5/main_1.png main_1.png png 58952 849 656 IMAGE-WEB-PDF 1 1-s2.0-S2095495620301339-gr1.jpg https://s3-eu-west-1.amazonaws.com/prod-ucs-content-store-eu-west/content/pii:S2095495620301339/gr1/DOWNSAMPLED/image/jpeg/a0eedef96d0b0366585e843ee71bf7f4/gr1.jpg gr1 gr1.jpg jpg 62780 388 583 IMAGE-DOWNSAMPLED 1-s2.0-S2095495620301339-gr2.jpg https://s3-eu-west-1.amazonaws.com/prod-ucs-content-store-eu-west/content/pii:S2095495620301339/gr2/DOWNSAMPLED/image/jpeg/d32bd142f2481ba3a37807f49e74d652/gr2.jpg gr2 gr2.jpg jpg 197955 536 731 IMAGE-DOWNSAMPLED 1-s2.0-S2095495620301339-gr3.jpg https://s3-eu-west-1.amazonaws.com/prod-ucs-content-store-eu-west/content/pii:S2095495620301339/gr3/DOWNSAMPLED/image/jpeg/1119c883b177df2853372c3ae7667e70/gr3.jpg gr3 gr3.jpg jpg 192253 765 649 IMAGE-DOWNSAMPLED 1-s2.0-S2095495620301339-gr4.jpg https://s3-eu-west-1.amazonaws.com/prod-ucs-content-store-eu-west/content/pii:S2095495620301339/gr4/DOWNSAMPLED/image/jpeg/9ebb616b3b9e6fe2484f7cd439736633/gr4.jpg gr4 gr4.jpg jpg 162802 691 642 IMAGE-DOWNSAMPLED 1-s2.0-S2095495620301339-gr5.jpg https://s3-eu-west-1.amazonaws.com/prod-ucs-content-store-eu-west/content/pii:S2095495620301339/gr5/DOWNSAMPLED/image/jpeg/c8ca2d28cff976a029b35092cf8ae089/gr5.jpg gr5 gr5.jpg jpg 189501 585 654 IMAGE-DOWNSAMPLED 1-s2.0-S2095495620301339-gr6.jpg https://s3-eu-west-1.amazonaws.com/prod-ucs-content-store-eu-west/content/pii:S2095495620301339/gr6/DOWNSAMPLED/image/jpeg/c53d7b7a0611f03d745f2aa48faec766/gr6.jpg gr6 gr6.jpg jpg 159017 752 653 IMAGE-DOWNSAMPLED 1-s2.0-S2095495620301339-gr7.jpg https://s3-eu-west-1.amazonaws.com/prod-ucs-content-store-eu-west/content/pii:S2095495620301339/gr7/DOWNSAMPLED/image/jpeg/7f05661a472f8924d7b9974db1c83981/gr7.jpg gr7 gr7.jpg jpg 148265 856 569 IMAGE-DOWNSAMPLED 1-s2.0-S2095495620301339-fx1.jpg https://s3-eu-west-1.amazonaws.com/prod-ucs-content-store-eu-west/content/pii:S2095495620301339/fx1/DOWNSAMPLED/image/jpeg/8f276c2ec9317f0fa8654398a0a87eec/fx1.jpg fx1 true fx1.jpg jpg 22497 168 301 IMAGE-DOWNSAMPLED 1-s2.0-S2095495620301339-gr1.sml https://s3-eu-west-1.amazonaws.com/prod-ucs-content-store-eu-west/content/pii:S2095495620301339/gr1/THUMBNAIL/image/gif/ff5040549179b7941019030be77671c0/gr1.sml gr1 gr1.sml sml 8875 146 219 IMAGE-THUMBNAIL 1-s2.0-S2095495620301339-gr2.sml https://s3-eu-west-1.amazonaws.com/prod-ucs-content-store-eu-west/content/pii:S2095495620301339/gr2/THUMBNAIL/image/gif/beb2554ad86f0b4343f7849065551796/gr2.sml gr2 gr2.sml sml 27230 161 219 IMAGE-THUMBNAIL 1-s2.0-S2095495620301339-gr3.sml https://s3-eu-west-1.amazonaws.com/prod-ucs-content-store-eu-west/content/pii:S2095495620301339/gr3/THUMBNAIL/image/gif/ffb7a6ea580643f3c20482ba8edf7473/gr3.sml gr3 gr3.sml sml 10947 164 139 IMAGE-THUMBNAIL 1-s2.0-S2095495620301339-gr4.sml https://s3-eu-west-1.amazonaws.com/prod-ucs-content-store-eu-west/content/pii:S2095495620301339/gr4/THUMBNAIL/image/gif/eadd758bbc48cf297192109ba6702582/gr4.sml gr4 gr4.sml sml 10766 164 152 IMAGE-THUMBNAIL 1-s2.0-S2095495620301339-gr5.sml https://s3-eu-west-1.amazonaws.com/prod-ucs-content-store-eu-west/content/pii:S2095495620301339/gr5/THUMBNAIL/image/gif/1d6c6cf596c01b96f9ac45c8a64c277d/gr5.sml gr5 gr5.sml sml 26513 164 183 IMAGE-THUMBNAIL 1-s2.0-S2095495620301339-gr6.sml https://s3-eu-west-1.amazonaws.com/prod-ucs-content-store-eu-west/content/pii:S2095495620301339/gr6/THUMBNAIL/image/gif/7fcc823338b9029ecbcbc944f5c69ecd/gr6.sml gr6 gr6.sml sml 10606 163 142 IMAGE-THUMBNAIL 1-s2.0-S2095495620301339-gr7.sml https://s3-eu-west-1.amazonaws.com/prod-ucs-content-store-eu-west/content/pii:S2095495620301339/gr7/THUMBNAIL/image/gif/0c2d60100b16f32446dda91b6f6cbb93/gr7.sml gr7 gr7.sml sml 9306 164 109 IMAGE-THUMBNAIL 1-s2.0-S2095495620301339-fx1.sml https://s3-eu-west-1.amazonaws.com/prod-ucs-content-store-eu-west/content/pii:S2095495620301339/fx1/THUMBNAIL/image/gif/85f3b2bacc64263cdef38596bec7196d/fx1.sml fx1 true fx1.sml sml 11828 122 219 IMAGE-THUMBNAIL 1-s2.0-S2095495620301339-gr1_lrg.jpg https://s3-eu-west-1.amazonaws.com/prod-ucs-content-store-eu-west/content/pii:S2095495620301339/gr1/HIGHRES/image/jpeg/784327d6b14614ea682c229efc0506fc/gr1_lrg.jpg gr1 gr1_lrg.jpg jpg 457424 1718 2581 IMAGE-HIGH-RES 1-s2.0-S2095495620301339-gr2_lrg.jpg https://s3-eu-west-1.amazonaws.com/prod-ucs-content-store-eu-west/content/pii:S2095495620301339/gr2/HIGHRES/image/jpeg/1c99d5a8ccc069d946325ddd0f6e6577/gr2_lrg.jpg gr2 gr2_lrg.jpg jpg 2199455 2376 3238 IMAGE-HIGH-RES 1-s2.0-S2095495620301339-gr3_lrg.jpg https://s3-eu-west-1.amazonaws.com/prod-ucs-content-store-eu-west/content/pii:S2095495620301339/gr3/HIGHRES/image/jpeg/34e91046af6454703f47b43eb7535738/gr3_lrg.jpg gr3 gr3_lrg.jpg jpg 1493265 3389 2876 IMAGE-HIGH-RES 1-s2.0-S2095495620301339-gr4_lrg.jpg https://s3-eu-west-1.amazonaws.com/prod-ucs-content-store-eu-west/content/pii:S2095495620301339/gr4/HIGHRES/image/jpeg/5cf320a9231d5c43a0787b8755dfa34a/gr4_lrg.jpg gr4 gr4_lrg.jpg jpg 1306755 3056 2841 IMAGE-HIGH-RES 1-s2.0-S2095495620301339-gr5_lrg.jpg https://s3-eu-west-1.amazonaws.com/prod-ucs-content-store-eu-west/content/pii:S2095495620301339/gr5/HIGHRES/image/jpeg/e19524c0283b403d4d9b5dd56ab6bbf3/gr5_lrg.jpg gr5 gr5_lrg.jpg jpg 1875061 2593 2898 IMAGE-HIGH-RES 1-s2.0-S2095495620301339-gr6_lrg.jpg https://s3-eu-west-1.amazonaws.com/prod-ucs-content-store-eu-west/content/pii:S2095495620301339/gr6/HIGHRES/image/jpeg/32321bfd7bb9b5553a3cb87638bf8696/gr6_lrg.jpg gr6 gr6_lrg.jpg jpg 1273131 3329 2892 IMAGE-HIGH-RES 1-s2.0-S2095495620301339-gr7_lrg.jpg https://s3-eu-west-1.amazonaws.com/prod-ucs-content-store-eu-west/content/pii:S2095495620301339/gr7/HIGHRES/image/jpeg/1b9b29d2d6b12e628a6952a13eb98a93/gr7_lrg.jpg gr7 gr7_lrg.jpg jpg 1151301 3792 2520 IMAGE-HIGH-RES 1-s2.0-S2095495620301339-fx1_lrg.jpg https://s3-eu-west-1.amazonaws.com/prod-ucs-content-store-eu-west/content/pii:S2095495620301339/fx1/HIGHRES/image/jpeg/9631903e4c32050f89156c743cd037da/fx1_lrg.jpg fx1 true fx1_lrg.jpg jpg 162186 743 1333 IMAGE-HIGH-RES 1-s2.0-S2095495620301339-mmc1.docx https://s3-eu-west-1.amazonaws.com/prod-ucs-content-store-eu-west/content/pii:S2095495620301339/mmc1/MAIN/application/vnd.openxmlformats-officedocument.wordprocessingml.document/3a1aa6e1e45faef805e72e94e8a7fbe7/mmc1.docx mmc1 mmc1.docx docx 5422628 APPLICATION 1-s2.0-S2095495620301339-si4.svg https://s3-eu-west-1.amazonaws.com/prod-ucs-content-store-eu-west/content/pii:S2095495620301339/STRIPIN/image/svg+xml/3e5bcd10a022b826f4afa5dab7444105/si4.svg si4 si4.svg svg 6411 ALTIMG 1-s2.0-S2095495620301339-si1.svg https://s3-eu-west-1.amazonaws.com/prod-ucs-content-store-eu-west/content/pii:S2095495620301339/STRIPIN/image/svg+xml/37f9acaee56575dd39c8855b467431a3/si1.svg si1 si1.svg svg 4131 ALTIMG 1-s2.0-S2095495620301339-si2.svg https://s3-eu-west-1.amazonaws.com/prod-ucs-content-store-eu-west/content/pii:S2095495620301339/STRIPIN/image/svg+xml/0e33f080ee77c93701af9ca009cb7ff4/si2.svg si2 si2.svg svg 7038 ALTIMG 1-s2.0-S2095495620301339-si3.svg https://s3-eu-west-1.amazonaws.com/prod-ucs-content-store-eu-west/content/pii:S2095495620301339/STRIPIN/image/svg+xml/d6b6eb68702d4cb019b3a2903609d519/si3.svg si3 si3.svg svg 6140 ALTIMG 1-s2.0-S2095495620301339-am.pdf https://s3-eu-west-1.amazonaws.com/prod-ucs-content-store-eu-west/content/egi:105RC090HC9/MAIN/application/pdf/9bccf025bfb82db83609f1e91de2c90c/am.pdf am am.pdf pdf false 2413458 AAM-PDF JECHEM 1162 S2095-4956(20)30133-9 10.1016/j.jechem.2020.03.018 Fig. 1 (a) Schematic illustration of the formation of nanoflower-like NiCo-LDH. (b) The formation process of NiCo-LDH nanosheets grown on Ti3C2 MXene surface. Fig 1 Fig. 2 (a) SEM images of pristine Ti3C2 MXene. (b, c) SEM image of as-prepared NiCo-LDH/Ti3C2 Nanosheets. (d, e) TEM images of NiCo-LDH/Ti3C2 monolayer flakes. (f) HRTEM image of single crystalline NiCo-LDH nanoplates. (g) The elemental mapping of Ti, C, Ni, Co, O in NiCo-LDH/Ti3C2 nanosheets. Fig 2 Fig. 3 (a) XRD patterns of Ti3C2 MXene, NiCo-LDH and NiCo-LDH/Ti3C2. (b) XRD patterns of selected area in (a). (c) FT-IR spectra. (d) Raman spectra. High resolution XPS spectra of (e) C 1s, (f) Ti 2p for Ti3C2 MXene and NiCo-LDH/Ti3C2. Fig 3 Fig. 4 (a) CV curves of NiCo-LDH/Ti3C2. (b) Discharge-charge voltage profiles of NiCo-LDH/Ti3C2 and NiCo-LDH/GO electrodes at 0.1 A g−1. (c) Nyquist plots and corresponding fitted curves of different electrodes (the inset is a corresponding equivalent circuit model). (d) Rate capability of obtained electrodes at varied current densities of 0.1‒10.0 A g−1. (e) The cycling stability of NiCo-LDH/Ti3C2, Ti3C2 MXene and NiCo-LDH at 5.0 A g−1 for 200 cycles. (f) The cycling stability of NiCo-LDH/Ti3C2 and NiCo-LDH/GO at 5.0 A g−1 for 800 cycles. Fig 4 Fig. 5 SEM images of NiCo-LDH/Ti3C2 electrode: (a) fresh, (b) after 1 cycle, and (c) after 200 cycles. SEM images of NiCo-LDH electrode: (d) fresh, (e) after 1 cycle, and (f) after 200 cycles. (g) Cross section SEM image of NiCo-LDH/Ti3C2 electrode after 1 cycle. (h) Cross section SEM image of NiCo-LDH after 1 cycle. Cross section SEM images (i1) NiCo-LDH/Ti3C2 electrode after 200 cycles, (i2) NiCo-LDH electrode after 200 cycles. Fig 5 Fig. 6 Nitrogen adsorption–desorption isotherms (a), and the corresponding pore-size distribution of the NiCo-LDH/Ti3C2, NiCo-LDH and Ti3C2 MXene (b). (c) CV curves. (d) Relationships between peak currents and sweep rates for determining the b value of cathodic peaks and anodic. (e) Normalized contribution ratio of capacitive and diffusion-controlled capacities at different sweep rates. (f) The CV curve of NiCo-LDH/Ti3C2 at 5.0 mV s−1 with an estimated capacitive contribution in the shaded region. Fig 6 Fig. 7 (a) Interaction energy as a function of the reaction coordinates of Li on Co(OH)2 slab. (b) Schematic illustration of the electrochemical process. (c) Total and partial densities of states for each step. The dash line indicates the Fermi level. Fig 7 Table 1 The specific capacities at varied current densities (0.1‒5.0 A g−1). Table 1 Samples Current density 0.1 A g−1 0.2 A g−1 0.5 A g−1 1.0 A g−1 5.0 A g−1 0.1 A g−1 NiCo-LDH/Ti3C2 1023.3 906.7 790.9 724.8 517.7 1076.7 NiCo-LDH/GO 1118.5 966.5 843.4 729.1 373.1 1163.5 Table 2 The specific capacities at varied current densities (1.0‒10.0 A g−1). Table 2 Samples Current density 1.0 A g−1 2.0 A g−1 5.0 A g−1 10.0 A g−1 1.0 A g−1 NiCo-LDH/Ti3C2 923.1 790.3 572.8 370.6 910.5 NiCo-LDH/GO 764.0 467.5 206.4 77.3 596.3 Table 3 MXene composites for Li ions storage under high current density. Table 3 Sample Current density Cycle number Specific capacity (mAh g−1) Ref. Ti3C2T x /NiCo2O4 5 C 150 410 [12] MoS2-in-Ti3C2 5 A g−1 1000 390 [47] Ti3C2-CNF 1 C 300 320 [66] Ti3C2-CNF 100 C 2900 97 [66] PVP-Sn(IV)@Ti3C2 0.5 A g−1 500 544 [67] CTAB−Sn(IV)@Ti3C2 1 A g−1 250 506 [68] NiCo-LDH/Ti3C2 5 A g−1 800 562 This work NiCo-LDH/GO 5 A g−1 800 457 This work NiCo-LDH/Ti3C2-H 5 A g−1 800 305 This work NiCo-LDH/Ti3C2-L 5 A g−1 800 374 This work NiCo-LDH/Ti3C2 MXene hybrid materials for lithium ion battery with high-rate capability and long cycle life Rui Zhang a 1 Zhe Xue b 1 Jiaqian Qin b ⁎ Montree Sawangphruk c Xinyu Zhang a ⁎ Riping Liu a a State Key Laboratory of Metastable Materials Science and Technology, Yanshan University, Qinhuangdao 066004, Hebei, China State Key Laboratory of Metastable Materials Science and Technology Yanshan University Qinhuangdao Hebei 066004 China aState Key Laboratory of Metastable Materials Science and Technology, Yanshan University, Qinhuangdao 066004, Hebei, China b Research Unit of Advanced Materials for Energy Storage, Metallurgy and Materials Science Research Institute, Chulalongkorn University, Bangkok 10330, Thailand Research Unit of Advanced Materials for Energy Storage Metallurgy and Materials Science Research Institute Chulalongkorn University Bangkok 10330 Thailand bResearch Unit of Advanced Materials for Energy Storage, Metallurgy and Materials Science Research Institute, Chulalongkorn University, Bangkok 10330, Thailand c Centre of Excellence for Energy Storage Technology (CEST), Department of Chemical and Biomolecular Engineering, School of Energy Science and Engineering, Vidyasirimedhi Institute of Science and Technology, Rayong 21210, Thailand Centre of Excellence for Energy Storage Technology (CEST) Department of Chemical and Biomolecular Engineering School of Energy Science and Engineering Vidyasirimedhi Institute of Science and Technology Rayong 21210 Thailand cCentre of Excellence for Energy Storage Technology (CEST), Department of Chemical and Biomolecular Engineering, School of Energy Science and Engineering, Vidyasirimedhi Institute of Science and Technology, Rayong 21210, Thailand ⁎ Corresponding authors. 1 These authors contributed equally to this work. Nickel/cobalt-layered double hydroxides (NiCo-LDH) have been attracted increasing interest in the applications of anode materials for lithium ion battery (LIB), but the low cycle stability and rate performance are still limited its practice applications. To achieve high performance LIB, the surface-confined strategy has been applied to design and fabricate a new anode material of NiCo-LDH nanosheet anchored on the surface of Ti3C2 MXene (NiCo-LDH/Ti3C2). The ultra-thin, bended and wrinkled α-phase crystal with an interlayer spacing of 8.1 Å can arrange on the conductive substrates Ti3C2 MXene directly, resulting in high electrolyte diffusion ability and low internal resistance. Furthermore, chemical bond interactions between the highly conductive Ti3C2 MXene and NiCo-LDH nanosheets can greatly increase the ion and electron transport and reduce the volume expansion of NiCo-LDH during Li ion intercalation. As expected, the discharge capacity of 562 mAh g−1 at 5.0 A g−1 for 800 cycles without degradation can be achieved, rate capability and cycle performance are better than that of NiCo-LDH (~100 mAh g−1). Furthermore, the density function theory (DFT) calculations were performed to demonstrate that NiCo-LDH/Ti3C2 system can be used as a highly desirable and promising anode material for lithium ion battery. Graphical abstract NiCo-LDH/Ti3C2 MXene hybrid materials were synthesized by electrostatic attraction strategy. This structure effectively promotes ion diffusion, alleviates the volume expansion for lithium ion battery anode with high-rate capability and long cycle life. Image, graphical abstract Keywords MXene Ti3C2 NiCo-LDH Lithium ion battery First-principles calculation 1 Introduction The layered double hydroxide (LDH) is an inorganic layered material that has been known for over 150 years [1]. The general formula of LDH should be represented as M2+ 1- x M3+ x (OH)2An− x / n ·mH2O [2]. The anion exchange and the structure remains unchanged while changing its own metal cations properties [3], could make LDHs wide applications in the fields of catalysis [4], biology [5], energy conversion and storage [6]. With the increasing demand for energy has attracted broad research on energy storage and conversion devices from alternative energy sources [7–9]. As anode materials applied in lithium ion battery, although LDHs themselves possess a high specific capacity [10], the extremely low electronic conductivity, slow ion diffusion ability and the huge volume changing seriously limit its practice applications [11]. To overcome these shortcomings, converting metal hydroxides into metal oxides by annealing treatment is a feasible solution [12]. On the other hand, the composite with matrix materials can also protect the fragile structure without changing the composition and structure of LDHs [10,11]. To best our knowledge, NiCo-LDH as the most representative double hydroxide, the electrochemical properties are still not completely boosted [13,14]. In this instance, it is highly desired to develop a facile and effective strategy based on surface interactions which ultra-thin NiCo-LDH uniformly arranged on matrix material towards to the 3D conductive network and open architecture. Thereby reducing the huge volume change during Li ion intercalation and enhancing the electrochemical activity. For carbon conversion materials such as graphene, carbon nanotubes and carbon nanowires, inducing the assembly of LDH into an open 3D conductive network often requires complex surface modification to complete tedious assembly [15–18]. Herein, we focused on the new member of the two-dimensional materials family (MXenes), which can be obtained by selectively etching Al in HF or HF-forming etchants for an appropriate time from the precursor Ti3AlC2 [19,20]. During the process of etching Al, general formula changes from M n +1AX n to M n +1X n T x , where T x represent the various surface terminations (OH, O, and/or F groups). With the substitution of T x for A, the strong metallic bonds between M and A eventually turn into two-dimensional materials linked by Van der Waals forces [21,22]. Because of the existence of these surface functional groups, Ti3C2 MXene in water has the negatively charge (ζ-potential of about −40 mV) [23,24], the positively charged nickel-cobalt ions can be anchored on the negatively charged nature of the Ti3C2 MXene surface by electrostatic forces and the ultra-thin, bended, wrinkled and larger interlayer spaced NiCo-LDH are built on the MXene surface (NiCo-LDH/Ti3C2). Unlike free addition NiCo-LDH, designed and synthesized NiCo-LDH in MXene conductive network by using surface-confined strategy can overcome the low ion diffusion capability, poor conductivity, and structure degradation problems. Furthermore, strong interfacial interaction and matched electronic coupling make NiCo-LDH/Ti3C2 not only guarantee the excellent rate ability (1076.7 mAh g−1 for 0.1 A g−1, and 370.6 mAh g−1 for 10 A g−1), but also significantly improve cycle life (800 cycles without reduction at 5 A g−1). The excellent performance of NiCo-LDH/Ti3C2 in lithium ion batteries provides a wider application prospect for double metal hydroxide in the field of energy conversion and storage. 2 Experimental 2.1 Synthesis of NiCo-LDH/Ti3C2 nanocomposites material The detailed process of Ti3C2 MXene synthesis can be found in the Supporting Information. In general, the as-prepared d-Ti3C2 (185 mg) was added to the conical flask containing 300 mL deionized water and the ultrasound was applied for 30 min. 1 mmol nickel chloride hexahydrate (NiCl2·6H2O), 1 mmol cobalt chloride hexahydrate (CoCl2·6H2O), were added into the above solution. Subsequently, 8.75 mmol hexamethylenetetramine (HMT) was added with magnetic stirring, the solution was treated at 95 °C for 5 h in argon atmosphere. Afterwards, the solid residue was collected by centrifugation for several times with water and alcohol before freeze-drying and named NiCo-LDH/Ti3C2. For comparison, the high content of d-Ti3C2 (370.0 mg) (named NiCo-LDH/Ti3C2-H, the molar rate of Ti3C2:Co:Ni = 2:1:1), and less amount of d-Ti3C2 (92.5 mg) (named NiCo-LDH/Ti3C2-L, the molar rate of Ti3C2:Co:Ni = 0.75:1:1), d-Ti3C2 (0 mg) (named NiCo-LDH) and graphene oxide (GO) (30.0 mg) (named NiCo-LDH/GO, the molar rate of GO:Co:Ni = 1:1:1) were mixed with 1 mmol NiCl2·6H2O, 1 mmol CoCl2·6H2O, 8.75 mmol HMT under the same condition as described above. 2.2 Material characterization The morphology of the sample was characterized with Field emission scanning electron microscopy (FE-SEM) (Hitachi, S-4800) and transmission electron microscopy (TEM) (FEI Talos). Powder X-ray diffraction (XRD) patterns were recorded on a d-MAX 2500 spectrometer. The surface structural information was detected by Fourier-transform infrared (FT-IR) spectroscopy (EQUINOX55) and Raman spectroscopy (E55+FRA106) using laser excitation at 532 nm. The binding energy was studied by X-ray photoelectron spectroscopy (XPS) (ESCALAB 250Xi). The thickness of the samples was determined by Atomic Force Microscopy (AFM) (SPA-300HV/SPI3800N). The Brunauer-Emmett-Teller (BET) of samples can be measured by ASAP 2020. The weight percent of Ni, Co and Ti element in the sample was measured by Inductively Coupled Plasma (ICP) (ICAP6300). 2.3 Electrochemical measurements The as-prepared materials (NiCo-LDH/Ti3C2, NiCo-LDH/Ti3C2-H, NiCo-LDH/Ti3C2-L, NiCo-LDH or d-Ti3C2), acetylene black and polyvinylidene fluoride (PVDF) were mixed in 1-methyl-2-pyrrolidinone (NMP) with a weight ratio of 70:15:15. Average mass loading of the electrodes was ~1.5 mg cm−2. The electrolyte was 1 M LiPF6 in ethylene carbonate (EC) and dimethyl carbonate (DMC) (1:1 v:v%). The battery performance was tested with GCD method on Battery Testing System (BTS, CT-4008, Neware, China) with a voltage window of 0.01 to 3 V. CV measurements were conducted in the voltage range of 3‒0.01 V (versus Li/Li+) on CHI660E. All capacity was calculated based on the weight of the active material. EIS was tested in a frequency range from 100 kHz to 0.1 Hz on PARSTAT 3000A-DX. 3 Results and discussion The synthesis process and reaction mechanism of NiCo-LDH/Ti3C2 nanosheets is shown in Fig. 1 . Without the help of Ti3C2 MXene (Fig. 1a), Ni2+ and Co2+ ions can react with hydroxyl groups formed by hydrolysis of HMT to form nickel and cobalt hydroxide monomers. Due to the presence of dissolved oxygen in water and the hydrolysate of HMT, divalent cobalt is partially oxidized to trivalent cobalt. Through olation reactions and crystallization trivalent cobalt, divalent nickel and the remaining unoxidized divalent cobalt hydroxide monomers are converted to NiCo-LDH nanoflower which contains accounts for a large proportion of β-phase crystal (interlayer spacing of ≈4.6 Å) and possession of a small proportion of α-phase crystal (interlayer spacing of ≈8.1 Å) [25,26]. The colloidal Ti3C2 MXene solution can be selectively etched by HCl/LiF from Ti3AlC2 and sonicated to obtain a dark green (Fig. S1a). With the addition of Ni and Co ions (Fig. S1b), the sediment can be observed because of the electrostatic interaction happened between the metal cation and Ti3C2 MXene (Fig. S1c). Therefore, NiCo-LDH nanosheets can be in situ grown on the surface of Ti3C2 MXene under hydrothermal conditions. Furthermore, it can effectively inhibit the generation of β-phase with the unique interaction forces between Ti3C2 and NiCo-LDH, which is derived from the structural degradation of the α-phase [27]. As a result, the ultra-thin, bended, and wrinkled NiCo-LDH anchored on Ti3C2 MXene firmly with an interlayer spacing of ≈8.1 Å can be successfully synthesized, which will be more conducive to the diffusion of electrolyte ions and lithium ions to the reaction sites. FE-SEM observations indicate that the obtained Ti3AlC2 exhibits the typical layered structure (Fig. S2a). The etched Ti3C2 MXene has an accordion-like morphology (Fig. S2b), and the delaminated Ti3C2 MXene possess a planar surface with a transverse size of ~300 nm (Fig. S3). The unique two-dimensional structure and large surface area of Ti3C2 MXene facilitates the nucleation and uniform growth of 3D interconnected NiCo-LDH network on the surface of Ti3C2(Fig. 2 b, c). Without the supporting of Ti3C2 MXene, only the flower-like NiCo-LDH can be obtained under the same conditions (Fig. S2c). We also synthesized different ratios (NiCo-LDH/Ti3C2-H and NiCo-LDH/Ti3C2-L) and NiCo-LDH/GO under the same conditions, the similar morphology for all NiCo-LDH on two-dimensional (2D) material can be obtained, which demonstrates that this surface confinement method is generally applicable to 2D material with negative charges on the surface (Fig. S4a-f). TEM image (Fig. 2d) indicates that the successful growth of the bended and highly wrinkled NiCo-LDH nanosheets on Ti3C2 MXene surface can be successfully assembled. We have noticed that this strategy of surface confinement can effectively reduce the thickness of NiCo-LDH, which is estimated to be <10 nm based on these frizzy nanosheets edges (Fig. 2e), thinner than that of pure NiCo-LDH plate (30–31 nm) based on TEM (Fig. S5a-c) and AFM analysis (Fig. S5e, f). High-resolution TEM (HRTEM) results reveal the distinct lattice fringes of 0.26 nm corresponds to the (012) plane of NiCo-LDH crystal (Fig. 2f). Furthermore, the existence and uniform distribution of Ti, C, Ni, Co and O elements can be detected by elemental mapping analysis of NiCo-LDH/Ti3C2 nanosheets (Fig. 2g). Fig. S6(a) exhibits a typical XRD pattern of Ti3AlC2, which demonstrates that the obtained sample contains a primary phase of Ti3AlC2 and a small quantity of TiC (< 2 wt%). The structural characteristics of Ti3C2 MXene, NiCo-LDH and NiCo-LDH/Ti3C2 powders are determined by XRD (Fig. 3 a). Delamination of Ti3C2 MXene is accompanied by (002), (004) and other series of 00l reflections, resulting in a layered structure of stacked flakes with an interplanar distance of 1.406 nm [28]. Pure NiCo-LDH includes the mainly β phase (interlayer spacing of 4.6 Å) and 22.4 wt% of α phase (interlayer spacing of 8.1 Å) [27,29]. However, when NiCo-LDH nanosheets grow on Ti3C2 MXene surface, the main diffraction peaks at 2θ of 19.2°, 32.9°, and 38.4°, which corresponding to (001), (100), and (101) planes of the β-phase hydroxides, almost disappear, and only α-phase with super-large interlayer spacing can be observed. The same phenomenon also occurs in NiCo-LDH/GO (Fig. S6b). Furthermore, the XRD results indicate that the corresponding (002) layer spacing along the c-axis rises from 1.406 nm to 1.560 nm, resulting in the suppressing the restacking of MXene sheets by the formation of NiCo-LDH nanosheets (Fig. 3b). Due to the vertical growth of LDH forming a tunnel-like network between the MXene layers and increasing the layer spacing, the restacking of MXene can be suppressed and fast the diffusion ability of ions. To further confirm the synthesized α-NiCo-LDH on Ti3C2 nanosheets, the FT-IR spectroscopy was performed (Fig. 3c). Due to the stretching vibrations of -OH group contributed by the brucite-like layers, the lattice water and the interlayer water molecules, the square-built absorption band associated with 3446 cm−1 and 1635 cm−1 can be observed for both NiCo-LDH/Ti3C2 and NiCo-LDH samples [30,31]. Two faint absorption band at 2923 and 2855 cm−1 of asymmetric stretching of C—H can be attributed to the insertion of HMT molecules during the formation of hydroxide monomers by hydrothermal reaction [32]. A trace amount of interlayer CO3 2− anions for charge balance at 1399 cm−1 may result from the micro-dissolution of CO2 in the air and/or oxidation of HMT during the reaction [27]. The most important is the disappearance of the band at 3637 cm−1, belong to the free-OH groups of the typical β-phase, which can further prove that α-NiCo-LDH successfully grows on Ti3C2 nanosheets [33]. The Raman spectra of NiCo-OH can be seen in Fig. S6(c), sharp peaks at ~445.4 and ~508.6 cm−1 observed for sample can be assigned to NiCo-LDH [34]. Compared with Ti3C2 MXene, NiCo-LDH/Ti3C2 not only have the characteristic peak of Ti3C2 (~135.5, ~274.1, ~406.2 and ~618.8 cm−1) [35–39], but also have peaks belonging to LDH at the wavelength of ~548 cm−1 (Fig. 3d) [13]. And the FT-IR also shows Ti3C2 MXene characteristic peak at 2980 cm−1 (Fig. S7) in NiCo-LDH/Ti3C2 (Fig. 3c). The Raman and the FT-IR results confirm the existence of Ti3C2 MXene and the incorporation of Ti3C2 MXene into NiCo-LDH. XPS was applied to further clarify the state bonding between NiCo-LDH and Ti3C2 MXene. The binding energy of C1s for Ti3C2 MXene at 284.80 eV, 286.03 eV and 282.78 eV can be assigned to CC, CO, C-Ti-Tx, respectively (Fig. 3e) [40]. The C-Ti-Tx is completely transformed into C-Ti at 281.53 eV, which demonstrates that the terminated groups (Tx) on Ti3C2 MXene are replaced entirely by NiCo-LDH [40,41]. The peak at 288.78 eV corresponding to OCO can enhance the bonding strength between the LDH and Ti3C2 substrate, which is also reported in the CoNi-LDH/GO system (Fig. S9) [29,42,43]. In addition, the high resolution XPS of Ti 2p spectrum of the NiCo-LDH/Ti3C2 nanosheets can be fitted into four main peaks corresponding to the Ti-C, Ti2+, Ti3+, and Ti-O, respectively (Fig. 3f) [35,40,44–46]. The percentage of Ti-O bond increases from 5.50% in the Ti3C2 MXene to 25.09% in the NiCo-LDH/Ti3C2, however, no TiO2 can be found in XRD results (Fig. 3a). It indicates the NiCo-LDH can be successfully grown on the surface of Ti3C2 MXene via oxygen (OCO, Ti-O), and the coverage of LDH can effectively inhibit the further oxidation of Ti3C2 MXene. The results imply that the construction of NiCo-LDH and MXene is strong covalent bond interaction rather than simply physical contact, which can be further evidenced by Ti 2p peaks migrate to lower regions of binding energy contrast with Ti3C2 MXene [47]. The analysis of composition and surface chemical state about NiCo-LDH/Ti3C2 can be found in supporting information. 3D interconnected conductive network structure can be formed by self-assembly of NiCo-LDH/Ti3C2 MXene, which could exhibit excellent lithium ion storage performance. Therefore, CR2032 coin-type cells with NiCo-LDH/Ti3C2, NiCo-LDH/GO, NiCo-LDH and Ti3C2 MXene as the working electrode and lithium metal foils as the counter electrode are fabricated to study the lithium ion storage performance [48]. Fig. 4 (a) shows the 1st, 2nd and 5th cyclic voltammetry (CV) curve of NiCo-LDH/Ti3C2 electrodes with the voltage window of 0.01−3.0 V at a scan rate of 0.1 mV s− 1 (vs. Li+/Li). One reduction and three oxidation peaks can be detected during the first cycle of lithium intercalation-deintercalation. The apparent cathodic peak located at potentials ~0.71 V is contributed by forming the solid electrolyte interphase (SEI) film on electroactive materials (containing Li2CO3 and alkyl carbonates via electrolyte decomposition and the trap of the lithium in crystal lattice) [49,50], the process of transition from Co (Ni) ions to Co (Ni) in metallic state (describing by the following equation: M(OH)2 + 2Li+ + 2e− → M + 2LiOH) [10,51] and the reversible decomposition of the intermediate product LiOH (describing by the following equation: 2LiOH+ 2Li+ + 2e−→ Li2O + 2LiH) [11,52,53]. The inconspicuous anodic peak located at 1.96 V should be ascribed to Li+ de-insertion process from MXene [35,54]. For the intense anodic peak located at 1.46 V represent the formation of LiOH and the multistep oxidation of metallic state Co to the corresponding hydroxide [53,55]. For the anodic peak located at 2.32 V represent the multistep oxidation of metallic state Ni to the corresponding hydroxides [52,55]. After the first cycle, the broad cathodic peak disappears and splits into two relatively weak peaks during the subsequent reduction process, which reveals that the irreversible SEI film has been formed on the surface of the active material [56]. In subsequent cycles, compared to NiCo-LDH (Fig. S10), NiCo-LDH/Ti3C2 shows the almost superposition CV curves, resulting in the highly reversible electrochemical behavior in the process of lithium ions intercalation and deintercalation [57]. Fig. 4(b) shows the first two laps of GCD voltage profiles at a current density of 0.1 A g−1 with cutoff voltage window of 0.01–3.0 V. The initial discharge/charge capacity dropped from 1879.9 to 1108.9 mAh g−1 and 1827.3 to 1266.4 mAh g−1, with the initial coulombic efficiency of 59.0% and 69.3%, for NiCo-LDH/GO and NiCo-LDH/Ti3C2, respectively. The NiCo-LDH/Ti3C2 exhibits the higher initial coulombic efficiency than that of NiCo-LDH/GO. The low initial coulombic efficiency could be caused by the formation of SEI film and the irreversible side reaction between Li+ and electrolyte. Ti3C2 MXene has a relatively low initial capacity of 410 mAh g−1 (Fig. 5 d) than that of NiCo-LDH (1939.5 mAh g−1, Fig S11). Ti3C2 MXene contributes very less for the capacity of NiCo-LDH/Ti3C2, however, it can boost the rate performance of layered double hydroxides in lithium-ion battery. Furthermore, the introduction of Ti3C2 greatly reduces the thickness of the NiCo-LDH nanosheets from the TEM and AFM results (Figs. 2e, S5), increases the interlayer spacing and exposes more active sites to facilitate the diffusion ability of lithium ions. Electrochemical impedance spectroscopy (EIS) is shown in Fig. 4(c), the inset is an equivalent circuit model. Apparently, the fitting results show the charge-transfer impedance (Fig. 4c) of NiCo-LDH/Ti3C2 electrodes (R ct = 74.8 Ω) is two times lower than that of NiCo-LDH (R ct = 180.9 Ω). Since Ti3C2 MXene has much better charge-transfer impedance than that of GO (Fig. S12) [58], NiCo-LDH/Ti3C2 has lower charge-transfer impedance than that of NiCo-LDH/GO. The rate capability of the obtained samples has been examined at different current densities (Fig. 4d). NiCo-LDH has a large volume change during lithium intercalation and deintercalation, so the large changes of volume could cause the rapidly degradation of the capacity. The results demonstrate that the NiCo-LDH/Ti3C2 shows the superior rate capability compare to the NiCo-LDH/GO (Fig. 4d). At low current densities (<1 A g−1), NiCo-LDH/Ti3C2 and NiCo-LDH/GO show the similar specific capacity (Table 1 ). When the current density is higher than 1 A g−1, the specific capacity of NiCo-LDH/GO drops faster than that of NiCo-LDH/Ti3C2. In the next 50 cycles at varied current densities of 1–10 A g−1 (Table 2 ). NiCo-LDH/Ti3C2 shows excellent rate performance with a high reversible capacity of 923.1 mAh g−1 at 1 A g−1. Even at 10 A g−1 (the charge/discharge is completed within only 96.5 s), the NiCo-LDH/Ti3C2 still exhibits a capacity as high as 370.6 mAh g−1. When current density returns to 1 A g−1, an average specific capacity of 910 mAh g−1 can be maintained. Due to this unique structural design, ultra-thin NiCo-LDH grown on Ti3C2 substrate greatly reduces the internal stress generated when Li ions are embedded, resulting in the stable structure of NiCo-LDH. Pure NiCo-LDH can only retain 10% of initial capacity after 200 cycles, and Ti3C2 MXene itself does not have high capacity (Fig. 4e). With the incorporation of Ti3C2, the capacity of NiCo-LDH can keep almost constant. Furthermore, the presence covalent bonds of Ti-O and C(O)O makes NiCo-LDH/Ti3C2 having stronger interfacial interaction compare to NiCo-LDH/GO which only has a C(O)O bond. It means that NiCo-LDH/Ti3C2 can withstand stronger volume expansion than NiCo-LDH/GO, maintains a capacity of 562 mAh g−1 at 5.0 A g−1 for 800 cycles without degradation. On the contrary, the CoNi-LDH/GO shows a rapid capacity loss over 36.6% after 800 cycles. In order to further understand the stabilization of Ti3C2 MXene for NiCo-LDH, we applied SEM to observe the surface morphology of the electrode before and after the cycle. The NiCo-LDH/Ti3C2 electrode has a flat surface for fresh and after the first discharge (Fig. 5a, b). Even after 200 cycles, only few holes appear on the surface of the electrode (Fig. 5c). While some holes appear on the surface of the NiCo-LDH electrode after the first discharge (Fig. 5d,e), and the surface topography is completely destroyed after 200 cycles, a large amount of active material is detached from the current collector (Fig. 5f), resulting in the fast decreasing of specific capacity during cycling. Ti3C2 MXene can effectively boost the volume expansion after lithium ion intercalation in NiCo-LDH, reducing the thickness increase from 117.0% (NiCo-LDH) to 19.2% (NiCo-LDH/Ti3C2). This facilitates the formation of a stable SEI film and promotes structural stability (Fig. 5g, h). After 200 cycles, NiCo-LDH/Ti3C2 is still firmly attached to the current collector (Fig. 5i) rather than peeled off from the current collector (Fig. 5i). Moreover, NiCo-LDH is still anchored onto the surface of Ti3C2 MXene (Fig. S13a, b, c) after 800 cycles. The content of NiCo-LDH in the nanocomposites can be calculated to be 71.0 wt% (NiCo-LDH/Ti3C2-L), 60.4 wt% (NiCo-LDH/Ti3C2), and 43.3 wt% (NiCo-LDH/Ti3C2-H) by inductively coupled plasma optical emission spectroscopy (ICP-OES). For the sample with high content of NiCo-LDH, β-phase NiCo-LDH cannot fully change to α-phase NiCo-LDH. β-phase NiCo-LDH can be detected by XRD in NiCo-LDH/Ti3C2-L (Fig. S14a), which causes a negative effect on electrochemical performance (Figs. S15, S14c, e). While no β-phase exists (Fig. S14b) in NiCo-LDH/Ti3C2-H. A decrease in α-phase NiCo-LDH content also leads to the capacity decay (Fig. S14d, f). Therefore, NiCo-LDH/Ti3C2 sample can reach the optimized Li ion storage in this work. Fig. 6 (a) shows the BET surface area of Ti3C2 MXene is poor (7.9 m2/g). However, after introducing Ti3C2 MXene in NiCo-LDH system, a nearly fourfold increasing (80.5 m2/g) than NiCo-LDH (22.8 m2/g) can be achieved. Furthermore, 3D conductive network and open architecture can also increase the pore­volume distribution about two times higher than that of NiCo-LDH with the pore-size from 15 nm to 2000 nm (Fig. 6b), resulting in a fast lithium ion diffusion and low volumetric expansion during the ions insertion-deinsertion process for NiCo-LDH/Ti3C2. The electrochemical kinetics of lithium storage mechanism of NiCo-LDH/Ti3C2 were studied using CV tests in different scan rates from 0.1 to 5 mV s−1 (Fig. 6c). The relationship between the measured current (i) with scan rate (ν) can be described by the following equation: [59] (1) i = a v b (2) lg ( i ) = b lg ( v ) + lg ( a ) where i denotes the peak current, υ denotes the sweep rate, a is a constant and b means the slope of the lg(υ)-lg(i) plot [60]. If the value of b is approximately 1, a capacitive behavior plays a major role. If the value of b is approximately 0.5, it means that the diffusion controlled process plays a major role [61]. The b value of NiCo-LDH/Ti3C2 is 0.84 and 0.88 for anodic and cathodic, respectively (Fig. 6d), which gives a strong evidence of typical capacitive behavior process in lithium storage [62]. Through the following equation about current response at a fixed potential, the contribution ratio of capacitive component to the total capacity can be further quantified. It can be expressed as the combination of two mentioned mechanisms: the capacitive effects (k 1 υ) and diffusion controlled processes (k 2 υ 1/ 2) [63] (3) i ( V ) = k 1 v + k 2 v 1 / 2 k 1 is the slope of the i(V)/υ 1/2 υ 1/2 plot. For better analysis, Eq. (3) is rearranged slightly to (4) i ( V ) / v 1 / 2 = k 1 v 1 / 2 + k 2 As shown in Fig. 6(e), the percentage of the capacitive contribution increases from 46.3% to 85.9% gradually with the increasing of scan rate. In addition, Fig. 6(f) gives the typical voltage profile for the capacitive current (grid area) in comparison to the total current. Fig. S16 shows the detailed calculation process. Our layered double hydroxides exhibit capacitive behavior during rapid lithium ion diffusion, which makes NiCo-LDH/Ti3C2 nanosheets having high rate performance. To elucidate the underlying mechanism of NiCo-LDH/Ti3C2 for superior rate performance, we carried out a series of density function theory (DFT) calculations, as summarized in Fig. 6. The computational method and details have been presented in the Supplementary Information. As mentioned in Fig. 3(a), the mainly exposed surface of NiCo-LDH in the experiments is (001) slab, and we noticed that the α-phase NiCo-LDH has a considerably high interlayer spacing of 8.1 Å, implying the interaction between the slabs in z direction is negligible. Hence, a single-layer p(2 × 2) unit cells of NiCo-LDH was constructed with a 20 Å vacuum along the vertical direction to avoid the interactions between the periodic images. Taking Co(OH)2 as an example, to analyze lithium ion intercalation-deintercalation process more deeply, the interaction energy Ei as well as the theoretical capacities were carefully examined, as illustrated in Fig. 7 (a). It can be clearly seen that the values of Ei rapidly decrease from approximately −4 to −18 eV with the increasing of Li concentration, corresponding the theoretical capacities of Li for four typical steps are calculated to be 288, 577, 1154 and 1731 mAh g−1, respectively. The redox of Co ions/Co0 contributed a third of the capacity, and the reversible conversion of LiOH contributed a larger proportion. In fact, some research results show that metal nanoparticles are essential in the complicated electrolytes of sealed LIBs, promote the smooth progress of LiOH reversible reaction [53,64]. Furthermore, the theoretical predictions have completely verified the lithium ion intercalation process on NiCo-LDH-based anode materials, as proposed in Refs. [10,51–53,55]. That is, Co(OH)2 reacts with Li obeying the following reactions, step one: Co(OH)2 + Li+ + e − → CoOH + LiOH; step two: CoOH + LiOH + Li+ + e − → Co + 2LiOH; step three: Co + 2LiOH + 2Li+ + 2e− → Co + LiOH + LiH + Li2O; step four: Co + LiOH + LiH + Li2O + 2Li+ + 2e− → Co + 2LiH + 2Li2O, as displayed in Fig. 7(b). Since the electrical conductivity is strongly correlated with the electrochemical performance of an electrode material, the density of states (DOS) as well as the projected density of states (PDOS) for each step were further calculated (Fig. 7c). It can be observed that all the models considered here either before or after adsorption of Li atoms exhibit metallic-like character because considerable electronic states have been found near their Fermi levels. In addition, the -F and -OH terminated groups on Ti3C2 MXene surfaces were removed during the reaction process (Fig. S8a), resulting in the high electrical conductivity, lower diffusion barrier, low open circuit voltage and high theoretical Li capacity [65]. Our results also reveal that Ti3C2 phase provides good electrical conductivity and high structural stability in NiCo-LDH/Ti3C2, beneficial for prompting the rate performance of NiCo-LDH/Ti3C2 anode material. Combining theoretical calculations and experimental results, NiCo-LDH/Ti3C2 system can be used as a highly desirable and promising anode material for lithium ion batteries. The comparison of other MXene composites for Li ions storage under high current density is shown in Table 3 . The excellent performance under high current density indicates NiCo-LDH/Ti3C2 has a wide range of application prospects for Li ions anode materials. 4 Conclusions In this work, through the electrostatic interaction between the metal cation and Ti3C2 MXene, the ultra-thin, bended, wrinkled and larger interlayer spaced NiCo-LDH nanosheets on the Ti3C2 MXene surface can be successfully synthesized. NiCo-LDH tightly anchored onto the Ti3C2 MXene surface, greatly strengthening the structural durability. The unique microstructure of NiCo-LDH exposes more active sites to facilitate the diffusion of lithium ions inside the active material. The layered NiCo-LDH/Ti3C2 MXene can greatly reduce the volume expansion of NiCo-LDH during Li ion intercalation. As a result, the outstanding performance of NiCo-LDH for lithium storage is completely boosting, which exhibits excellent rate capacities of 1076.7‒370.6 mAh g−1 for the varied current densities of 0.1‒10 A g−1 and superior long cycle capability of 562 mAh g−1 at 5.0 A g−1 for 800 cycles without degradation. Finally, a series of density function theory calculations confirmed that NiCo-LDH/Ti3C2 system can be used as a highly desirable and promising anode material for lithium ion batteries. Declaration of Competing Interest The authors declare no conflict of interest. Acknowledgments This work is supported by Rachadapisek Sompoch project, Chulalongkorn University (CU_GR_62_14_62_02), and the Energy Conservation and Promotion Fund Office, Ministry of Energy. We also gratefully acknowledge the NSFC (grant 51421091), and National Science Foundation for Distinguished Young Scholars for Hebei Province of China (grant E2016203376), and Asahi Glass Foundation. Supplementary materials Supplementary material associated with this article can be found, in the online version, at doi:10.1016/j.jechem.2020.03.018. Appendix Supplementary materials Image, application 1 References [1] M.Q. Zhao Q. Zhang J.Q. Huang F. Wei Adv. Funct. Mater 22 2012 675 694 M.Q. Zhao, Q. Zhang, J.Q. Huang, F. Wei, Adv. Funct. Mater. 22 (2012) 675–694. [2] X.Q. Wang X.M. Li X. Du X.L. Ma X.G. Hao C.F. Xue H.Y. Zhu S.S. Li Electroanalysis 29 2017 1286 1293 X.Q. Wang, X.M. Li, X. Du, X.L. Ma, X.G. Hao, C.F. Xue, H.Y. Zhu, S.S. Li, Electroanalysis29 (2017) 1286–1293. [3] D. Wang J.L. Wu D.X. Bai R.R. Wang F. Yao S.L. Xu J. Alloys Compd 726 2017 306 314 D. Wang, J.L. Wu, D.X. Bai, R.R. Wang, F. Yao, S.L. Xu, J. Alloys Compd. 726 (2017) 306–314. [4] G.L. Fan F. Li D.G. Evans X. Duan Chem. Soc. Rev 43 2014 7040 7066 G.L. Fan, F. Li, D.G. Evans, X. Duan, Chem. Soc. Rev. 43 (2014) 7040–7066. [5] B. Kutlu A. Leuteritz R. Boldt D. Jehnichen U. Wagenknecht G. Heinrich Appl. Clay Sci 72 2013 91 95 B. Kutlu, A. Leuteritz, R. Boldt, D. Jehnichen, U. Wagenknecht, G. Heinrich, Appl. Clay Sci. 72 (2013) 91–95. [6] J.S. Luo J.H. Im M.T. Mayer M. Schreier M.K. Nazeeruddin N.G. Park S.D. Tilley H.J. Fan M. Gratzel Science 345 2014 1593 1596 J.S. Luo, J.H. Im, M.T. Mayer, M. Schreier, M.K. Nazeeruddin, N.G. Park, S.D. Tilley, H.J. Fan, M. Gratzel, Science345 (2014) 1593–1596. [7] J.J. Liu T. He Q.C. Wang Z.X. Zhou Y.Q. Zhang H.Q. Wu Q. Li J. Zheng Z.F. Sun Y.P. Lei J.M. Ma Y. Zhang J. Mater. Chem. A 7 2019 12451 12456 J.J. Liu, T. He, Q.C. Wang, Z.X. Zhou, Y.Q. Zhang, H.Q. Wu, Q. Li, J. Zheng, Z.F. Sun, Y.P. Lei, J.M. Ma, Y. Zhang, J. Mater. Chem. A7 (2019) 12451–12456. [8] G.Z. Fang Q.C. Wang J. Zhou Y.P. Lei Z.X. Chen Z.Q. Wang A.Q. Pan S.Q. Liang ACS Nano 13 2019 5635 5645 G.Z. Fang, Q.C. Wang, J. Zhou, Y.P. Lei, Z.X. Chen, Z.Q. Wang, A.Q. Pan, S.Q. Liang, ACS Nano13 (2019) 5635–5645. [9] C.S. Lei W. Zhou Q.G. Feng Y.P. Lei Y. Zhang Y. Chen J.Q. Qin Nano-Micro Lett 11 2019 C.S. Lei, W. Zhou, Q.G. Feng, Y.P. Lei, Y. Zhang, Y. Chen, J.Q. Qin, Nano-Micro Lett. 11 (2019). [10] Y.S. He D.W. Bai X.W. Yang J. Chen X.Z. Liao Z.F. Ma Electrochem. Commun 12 2010 570 573 Y.S. He, D.W. Bai, X.W. Yang, J. Chen, X.Z. Liao, Z.F. Ma, Electrochem. Commun. 12 (2010) 570–573. [11] X.J. Zhu Y. Zhong H.D. Zhai Z. Yan D.F. Li Electrochim. Acta 132 2014 364 369 X.J. Zhu, Y. Zhong, H.D. Zhai, Z. Yan, D.F. Li, Electrochim. Acta132 (2014) 364–369. [12] M.Q. Zhao M. Torelli C.E. Ren M. Ghidiu Z. Ling B. Anasori M.W. Barsoum Y. Gogotsi Nano Energy 30 2016 603 613 M.Q. Zhao, M. Torelli, C.E. Ren, M. Ghidiu, Z. Ling, B. Anasori, M.W. Barsoum, Y. Gogotsi, Nano Energy30 (2016) 603–613. [13] J.H. Shi N.X. Du W.J. Zheng X.C. Li Y. Dai G.H. He Chem. Eng. J 327 2017 9 17 J.H. Shi, N.X. Du, W.J. Zheng, X.C. Li, Y. Dai, G.H. He, Chem. Eng. J. 327 (2017) 9–17. [14] B.J. Li H.Q. Cao J. Shao H. Zheng Y.X. Lu J.F. Yin M.Z. Qu Chem. Commun 47 2011 3159 3161 B.J. Li, H.Q. Cao, J. Shao, H. Zheng, Y.X. Lu, J.F. Yin, M.Z. Qu, Chem. Commun. 47 (2011) 3159–3161. [15] B.L.J. Yue D.D. Jia J.G. Tang A.T. Zhang F. Liu T. Chen C. Barrow W.R. Yang J.Q. Liu J. Colloid Interface Sci 560 2020 237 246 B.L.J. Yue, D.D. Jia, J.G. Tang, A.T. Zhang, F. Liu, T. Chen, C. Barrow, W.R. Yang, J.Q. Liu, J. Colloid Interface Sci. 560 (2020) 237–246. [16] P. Xiong R.Z. Ma N. Sakai T. Sasaki ACS Nano 12 2018 1768 1777 P. Xiong, R.Z. Ma, N. Sakai, T. Sasaki, ACS Nano12 (2018) 1768–1777. [17] Y. Jia L.Z. Zhang G.P. Gao H. Chen B. Wang J.Z. Zhou M.T. Soo M. Hong X.C. Yan G.R. Qian J. Zou A.J. Du X.D. Yao Adv. Mater 2017 29 Y. Jia, L.Z. Zhang, G.P. Gao, H. Chen, B. Wang, J.Z. Zhou, M.T. Soo, M. Hong, X.C. Yan, G.R. Qian, J. Zou, A.J. Du, X.D. Yao, Adv. Mater. 29 (2017). [18] J.W. Zhao J. Chen S.M. Xu M.F. Shao Q. Zhang F. Wei J. Ma M. Wei D.G. Evans X. Duan Adv. Funct. Mater 24 2014 2938 2946 J.W. Zhao, J. Chen, S.M. Xu, M.F. Shao, Q. Zhang, F. Wei, J. Ma, M. Wei, D.G. Evans, X. Duan, Adv. Funct. Mater. 24 (2014) 2938–2946. [19] M. Naguib O. Mashtalir J. Carle V. Presser J. Lu L. Hultman Y. Gogotsi M.W. Barsoum ACS Nano 6 2012 1322 1331 M. Naguib, O. Mashtalir, J. Carle, V. Presser, J. Lu, L. Hultman, Y. Gogotsi, M.W. Barsoum, ACS Nano6 (2012) 1322–1331. [20] A.H. Feng Y. Yu Y. Wang F. Jiang Y. Yu L. Mi L.X. Song Mater. Des 114 2017 161 166 A.H. Feng, Y. Yu, Y. Wang, F. Jiang, Y. Yu, L. Mi, L.X. Song, Mater. Des. 114 (2017) 161–166. [21] M. Naguib J. Come B. Dyatkin V. Presser P.L. Taberna P. Simon M.W. Barsoum Y. Gogotsi Electrochem. Commun 16 2012 61 64 M. Naguib, J. Come, B. Dyatkin, V. Presser, P.L. Taberna, P. Simon, M.W. Barsoum, Y. Gogotsi, Electrochem. Commun. 16 (2012) 61–64. [22] Y. Dall'Agnese M.R. Lukatskaya K.M. Cook P.L. Taberna Y. Gogotsi P. Simon Electrochem. Commun 48 2014 118 122 Y. Dall'Agnese, M.R. Lukatskaya, K.M. Cook, P.L. Taberna, Y. Gogotsi, P. Simon, Electrochem. Commun. 48 (2014) 118–122. [23] M. Naguib Y. Gogotsi Acc. Chem. Res 48 2015 128 135 M. Naguib, Y. Gogotsi, Acc. Chem. Res. 48 (2015) 128–135. [24] X. Zhang Z.H. Zhang Z. Zhou J. Energy Chem 27 2018 73 85 X. Zhang, Z.H. Zhang, Z. Zhou, J. Energy Chem. 27 (2018) 73–85. [25] J. Jiang A.L. Zhang L.L. Li L.H. Ai J. Power Sources 278 2015 445 451 J. Jiang, A.L. Zhang, L.L. Li, L.H. Ai, J. Power Sources278 (2015) 445–451. [26] H. Chen L.F. Hu M. Chen Y. Yan L.M. Wu Adv. Funct. Mater 24 2014 934 942 H. Chen, L.F. Hu, M. Chen, Y. Yan, L.M. Wu, Adv. Funct. Mater. 24 (2014) 934–942. [27] Z.P. Liu R.Z. Ma M. Osada K. Takada T. Sasaki J. Am. Chem. Soc 127 2005 13869 13874 Z.P. Liu, R.Z. Ma, M. Osada, K. Takada, T. Sasaki, J. Am. Chem. Soc. 127 (2005) 13869–13874. [28] A. Lipatov M. Alhabeb M.R. Lukatskaya A. Boson Y. Gogotsi A. Sinitskii Adv. Electron. Mater 2 2016 9 A. Lipatov, M. Alhabeb, M.R. Lukatskaya, A. Boson, Y. Gogotsi, A. Sinitskii, Adv. Electron. Mater. 2 (2016) 9. [29] J. Yang C. Yu C. Hu M. Wang S.F. Li H.W. Huang K. Bustillo X.T. Han C.T. Zhao W. Guo Z.Y. Zeng H.M. Zheng J.S. Qiu Adv. Funct. Mater 28 2018 11 J. Yang, C. Yu, C. Hu, M. Wang, S.F. Li, H.W. Huang, K. Bustillo, X.T. Han, C.T. Zhao, W. Guo, Z.Y. Zeng, H.M. Zheng, J.S. Qiu, Adv. Funct. Mater. 28 (2018) 11. [30] Q.H. Yan Y. Nie R.Y. Yang Y.H. Cui D. O'Hare Q. Wang Appl. Catal., A 538 2017 37 50 Q.H. Yan, Y. Nie, R.Y. Yang, Y.H. Cui, D. O'Hare, Q. Wang, Appl. Catal., A538 (2017) 37–50. [31] Z.B. Wu R.B. Jin Y. Liu H.Q. Wang Catal. Commun 9 2008 2217 2220 Z.B. Wu, R.B. Jin, Y. Liu, H.Q. Wang, Catal. Commun. 9 (2008) 2217–2220. [32] J.W. Lee J.M. Ko J.D. Kim J. Phys. Chem. C 115 2011 19445 19454 J.W. Lee, J.M. Ko, J.D. Kim, J. Phys. Chem. C115 (2011) 19445–19454. [33] L.X. Yang Y.J. Zhu H. Tong Z.H. Liang L. Li L. Zhang J. Solid State Chem 180 2007 2095 2101 L.X. Yang, Y.J. Zhu, H. Tong, Z.H. Liang, L. Li, L. Zhang, J. Solid State Chem. 180 (2007) 2095–2101. [34] U.M. Patil M.S. Nam J.S. Sohn S.B. Kulkarni R. Shin S. Kang S. Lee J.H. Kim S.C. Jun J. Mater. Chem. A 2 2014 19075 19083 U.M. Patil, M.S. Nam, J.S. Sohn, S.B. Kulkarni, R. Shin, S. Kang, S. Lee, J.H. Kim, S.C. Jun, J. Mater. Chem. A2 (2014) 19075–19083. [35] C.E. Ren M.Q. Zhao T. Makaryan J. Halim M. Boota S. Kota B. Anasori M.W. Barsoum Y. Gogotsi Chemelectrochem 3 2016 689 693 C.E. Ren, M.Q. Zhao, T. Makaryan, J. Halim, M. Boota, S. Kota, B. Anasori, M.W. Barsoum, Y. Gogotsi, Chemelectrochem3 (2016) 689–693. [36] W. Bao L. Liu C. Wang S. Choi D. Wang G. Wang Adv. Energy Mater 8 2018 W. Bao, L. Liu, C. Wang, S. Choi, D. Wang, G. Wang, Adv. Energy Mater. 8 (2018). [37] M. Naguib O. Mashtalir M.R. Lukatskaya B. Dyatkin C.F. Zhang V. Presser Y. Gogotsi M.W. Barsoum Chem. Commun 50 2014 7420 7423 M. Naguib, O. Mashtalir, M.R. Lukatskaya, B. Dyatkin, C.F. Zhang, V. Presser, Y. Gogotsi, M.W. Barsoum, Chem. Commun. 50 (2014) 7420–7423. [38] C.J. Zhao Q. Wang H. Zhang S. Passerini X.Z. Qian ACS Appl. Mater. Interfaces 8 2016 15661 15667 C.J. Zhao, Q. Wang, H. Zhang, S. Passerini, X.Z. Qian, ACS Appl. Mater. Interfaces8 (2016) 15661–15667. [39] T.F. Li L.L. Yao Q.L. Liu J.J. Gu R.C. Luo J.H. Li X.D. Yan W.Q. Wang P. Liu B. Chen W. Zhang W. Abbas R. Naz D. Zhang Angew. Chem.-Int. Edit 57 2018 6115 6119 T.F. Li, L.L. Yao, Q.L. Liu, J.J. Gu, R.C. Luo, J.H. Li, X.D. Yan, W.Q. Wang, P. Liu, B. Chen, W. Zhang, W. Abbas, R. Naz, D. Zhang, Angew. Chem.-Int. Edit. 57 (2018) 6115–6119. [40] J. Halim K.M. Cook M. Naguib P. Eklund Y. Gogotsi J. Rosen M.W. Barsoum Appl. Surf. Sci 362 2016 406 417 J. Halim, K.M. Cook, M. Naguib, P. Eklund, Y. Gogotsi, J. Rosen, M.W. Barsoum, Appl. Surf. Sci. 362 (2016) 406–417. [41] S.J. Sun Z.L. Xie Y.R. Yan S.P. Wu Chem. Eng. J 366 2019 460 467 S.J. Sun, Z.L. Xie, Y.R. Yan, S.P. Wu, Chem. Eng. J. 366 (2019) 460–467. [42] J. Yang C. Yu X.M. Fan C.T. Zhao J.S. Qiu Adv. Funct. Mater 25 2015 2109 2116 J. Yang, C. Yu, X.M. Fan, C.T. Zhao, J.S. Qiu, Adv. Funct. Mater. 25 (2015) 2109–2116. [43] C. Yu J. Yang C.T. Zhao X.M. Fan G. Wang J.S. Qiu Nanoscale 6 2014 3097 3104 C. Yu, J. Yang, C.T. Zhao, X.M. Fan, G. Wang, J.S. Qiu, Nanoscale6 (2014) 3097–3104. [44] M.K. Han X.W. Yin H. Wu Z.X. Hou C.Q. Song X.L. Li L.T. Zhang L.F. Cheng ACS Appl. Mater. Interfaces 8 2016 21011 21019 M.K. Han, X.W. Yin, H. Wu, Z.X. Hou, C.Q. Song, X.L. Li, L.T. Zhang, L.F. Cheng, ACS Appl. Mater. Interfaces8 (2016) 21011–21019. [45] M.Z. Yu S. Zhou Z.Y. Wang J.J. Zhao J.S. Qiu Nano Energy 44 2018 181 190 M.Z. Yu, S. Zhou, Z.Y. Wang, J.J. Zhao, J.S. Qiu, Nano Energy44 (2018) 181–190. [46] O. Mashtalir K.M. Cook V.N. Mochalin M. Crowe M.W. Barsoum Y. Gogotsi J. Mater. Chem. A 2 2014 14334 14338 O. Mashtalir, K.M. Cook, V.N. Mochalin, M. Crowe, M.W. Barsoum, Y. Gogotsi, J. Mater. Chem. A2 (2014) 14334–14338. [47] K. Ma H. Jiang Y.J. Hu C.Z. Li Adv. Funct. Mater 28 2018 9 K. Ma, H. Jiang, Y.J. Hu, C.Z. Li, Adv. Funct. Mater. 28 (2018) 9. [48] C. Ye L. Zhang C.X. Guo D.D. Li A. Vasileff H.H. Wang S.Z. Qiao Adv. Funct. Mater 27 2017 9 C. Ye, L. Zhang, C.X. Guo, D.D. Li, A. Vasileff, H.H. Wang, S.Z. Qiao, Adv. Funct. Mater. 27 (2017) 9. [49] G.L. Xia Q.L. Gao D.L. Sun X.B. Yu Small 13 2017 G.L. Xia, Q.L. Gao, D.L. Sun, X.B. Yu, Small13 (2017). [50] S.P. Zhu L. Fan Y.Y. Lu RSC Adv. 7 2017 54939 54946 S.P. Zhu, L. Fan, Y.Y. Lu, RSC Adv.7 (2017) 54939–54946. [51] G.D. Park Y.N. Ko Y.C. Kang Sci. Rep. 4 2014 7 G.D. Park, Y.N. Ko, Y.C. Kang, Sci. Rep.. 4 (2014) 7. [52] M. Zhang Z.X. Wei T. Wang S. Muhammad J. Zhou J.L. Liu J. Zhu J.W. Hu Electrochim. Acta 296 2019 190 197 M. Zhang, Z.X. Wei, T. Wang, S. Muhammad, J. Zhou, J.L. Liu, J. Zhu, J.W. Hu, Electrochim. Acta296 (2019) 190–197. [53] Y.Y. Hu Z.G. Liu K.W. Nam O.J. Borkiewicz J. Cheng X. Hua M.T. Dunstan X.Q. Yu K.M. Wiaderek L.S. Du K.W. Chapman P.J. Chupas X.Q. Yang C.P. Grey Nat. Mater 12 2013 1130 1136 Y.Y. Hu, Z.G. Liu, K.W. Nam, O.J. Borkiewicz, J. Cheng, X. Hua, M.T. Dunstan, X.Q. Yu, K.M. Wiaderek, L.S. Du, K.W. Chapman, P.J. Chupas, X.Q. Yang, C.P. Grey, Nat. Mater. 12 (2013) 1130–1136. [54] F. Du H. Tang L.M. Pan T. Zhang H.M. Lu J. Xiong J. Yang C. Zhang Electrochim. Acta 235 2017 690 699 F. Du, H. Tang, L.M. Pan, T. Zhang, H.M. Lu, J. Xiong, J. Yang, C. Zhang, Electrochim. Acta235 (2017) 690–699. [55] L.L. Shi Y.X. Chen R.Y. He X.H. Chen H.H. Song PCCP 20 2018 16437 16443 L.L. Shi, Y.X. Chen, R.Y. He, X.H. Chen, H.H. Song, PCCP20 (2018) 16437–16443. [56] X.L. Zhou Y.R. Zhong M. Yang Q. Zhang J.P. Wei Z. Zhou ACS Appl. Mater. Interfaces 7 2015 12022 12029 X.L. Zhou, Y.R. Zhong, M. Yang, Q. Zhang, J.P. Wei, Z. Zhou, ACS Appl. Mater. Interfaces7 (2015) 12022–12029. [57] H. Liu W. Li D.K. Shen D.Y. Zhao G.X. Wang J. Am. Chem. Soc 137 2015 13161 13166 H. Liu, W. Li, D.K. Shen, D.Y. Zhao, G.X. Wang, J. Am. Chem. Soc. 137 (2015) 13161–13166. [58] X.H. Wu Z.Y. Wang M.Z. Yu L.Y. Xiu J.S. Qiu Adv. Mater 29 2017 8 X.H. Wu, Z.Y. Wang, M.Z. Yu, L.Y. Xiu, J.S. Qiu, Adv. Mater. 29 (2017) 8. [59] J.B. Li D. Yan S.J. Hou Y.Q. Li T. Lu Y.F. Yao L.K. Pan J. Mater. Chem. A 6 2018 1234 1243 J.B. Li, D. Yan, S.J. Hou, Y.Q. Li, T. Lu, Y.F. Yao, L.K. Pan, J. Mater. Chem. A6 (2018) 1234–1243. [60] C.F. Zhang M. Beidaghi M. Naguib M.R. Lukatskaya M.Q. Zhao B. Dyatkin K.M. Cook S.J. Kim B. Eng X. Xiao D.H. Long W.M. Qiao B. Dunn Y. Gogotsi Chem. Mater 28 2016 3937 3943 C.F. Zhang, M. Beidaghi, M. Naguib, M.R. Lukatskaya, M.Q. Zhao, B. Dyatkin, K.M. Cook, S.J. Kim, B. Eng, X. Xiao, D.H. Long, W.M. Qiao, B. Dunn, Y. Gogotsi, Chem. Mater. 28 (2016) 3937–3943. [61] L.P. Kong C.F. Zhang J.T. Wang W.M. Qiao L.C. Ling D.H. Long ACS Nano 9 2015 11200 11208 L.P. Kong, C.F. Zhang, J.T. Wang, W.M. Qiao, L.C. Ling, D.H. Long, ACS Nano9 (2015) 11200–11208. [62] V. Augustyn J. Come M.A. Lowe J.W. Kim P.L. Taberna S.H. Tolbert H.D. Abruna P. Simon B. Dunn Nat. Mater 12 2013 518 522 V. Augustyn, J. Come, M.A. Lowe, J.W. Kim, P.L. Taberna, S.H. Tolbert, H.D. Abruna, P. Simon, B. Dunn, Nat. Mater. 12 (2013) 518–522. [63] Y.T. Wu P. Nie J.M. Jiang B. Ding H. Dou X.G. Zhang Chemelectrochem 4 2017 1560 1565 Y.T. Wu, P. Nie, J.M. Jiang, B. Ding, H. Dou, X.G. Zhang, Chemelectrochem4 (2017) 1560–1565. [64] L.W. Su Z. Zhou X. Qin Q.W. Tang D.H. Wu P.W. Shen Nano Energy 2 2013 276 282 L.W. Su, Z. Zhou, X. Qin, Q.W. Tang, D.H. Wu, P.W. Shen, Nano Energy2 (2013) 276–282. [65] Q. Tang Z. Zhou P.W. Shen J. Am. Chem. Soc 134 2012 16909 16916 Q. Tang, Z. Zhou, P.W. Shen, J. Am. Chem. Soc. 134 (2012) 16909–16916. [66] Z.Y. Lin D.F. Sun Q. Huang J. Yang M.W. Barsoum X.B. Yan J. Mater. Chem. A 3 2015 14096 14100 Z.Y. Lin, D.F. Sun, Q. Huang, J. Yang, M.W. Barsoum, X.B. Yan, J. Mater. Chem. A3 (2015) 14096–14100. [67] J.M. Luo X.Y. Tao J. Zhang Y. Xia H. Huang L.Y. Zhang Y.P. Gan C. Liang W.K. Zhang ACS Nano 10 2016 2491 2499 J.M. Luo, X.Y. Tao, J. Zhang, Y. Xia, H. Huang, L.Y. Zhang, Y.P. Gan, C. Liang, W.K. Zhang, ACS Nano10 (2016) 2491–2499. [68] J.M. Luo W.K. Zhang H.D. Yuan C.B. Jin L.Y. Zhang H. Huang C. Liang Y. Xia J. Zhang Y.P. Gan X.Y. Tao ACS Nano 11 2017 2459 2469 J.M. Luo, W.K. Zhang, H.D. Yuan, C.B. Jin, L.Y. Zhang, H. Huang, C. Liang, Y. Xia, J. Zhang, Y.P. Gan, X.Y. Tao, ACS Nano11 (2017) 2459–2469.",
      "scopus-id": "85082872371",
      "coredata": {
        "eid": "1-s2.0-S2095495620301339",
        "dc:description": "Nickel/cobalt-layered double hydroxides (NiCo-LDH) have been attracted increasing interest in the applications of anode materials for lithium ion battery (LIB), but the low cycle stability and rate performance are still limited its practice applications. To achieve high performance LIB, the surface-confined strategy has been applied to design and fabricate a new anode material of NiCo-LDH nanosheet anchored on the surface of Ti3C2 MXene (NiCo-LDH/Ti3C2). The ultra-thin, bended and wrinkled α-phase crystal with an interlayer spacing of 8.1 Å can arrange on the conductive substrates Ti3C2 MXene directly, resulting in high electrolyte diffusion ability and low internal resistance. Furthermore, chemical bond interactions between the highly conductive Ti3C2 MXene and NiCo-LDH nanosheets can greatly increase the ion and electron transport and reduce the volume expansion of NiCo-LDH during Li ion intercalation. As expected, the discharge capacity of 562 mAh g−1 at 5.0 A g−1 for 800 cycles without degradation can be achieved, rate capability and cycle performance are better than that of NiCo-LDH (~100 mAh g−1). Furthermore, the density function theory (DFT) calculations were performed to demonstrate that NiCo-LDH/Ti3C2 system can be used as a highly desirable and promising anode material for lithium ion battery.",
        "openArchiveArticle": "false",
        "prism:coverDate": "2020-11-30",
        "openaccessUserLicense": null,
        "prism:aggregationType": "Journal",
        "prism:url": "https://api.elsevier.com/content/article/pii/S2095495620301339",
        "dc:creator": [
          {
            "@_fa": "true",
            "$": "Zhang, Rui"
          },
          {
            "@_fa": "true",
            "$": "Xue, Zhe"
          },
          {
            "@_fa": "true",
            "$": "Qin, Jiaqian"
          },
          {
            "@_fa": "true",
            "$": "Sawangphruk, Montree"
          },
          {
            "@_fa": "true",
            "$": "Zhang, Xinyu"
          },
          {
            "@_fa": "true",
            "$": "Liu, Riping"
          }
        ],
        "link": [
          {
            "@_fa": "true",
            "@rel": "self",
            "@href": "https://api.elsevier.com/content/article/pii/S2095495620301339"
          },
          {
            "@_fa": "true",
            "@rel": "scidir",
            "@href": "https://www.sciencedirect.com/science/article/pii/S2095495620301339"
          }
        ],
        "dc:format": "application/json",
        "openaccessType": null,
        "pii": "S2095-4956(20)30133-9",
        "prism:volume": "50",
        "prism:publisher": "Science Press and Dalian Institute of Chemical Physics, Chinese Academy of Sciences. Published by Elsevier B.V. and Science Press.",
        "dc:title": "NiCo-LDH/Ti3C2 MXene hybrid materials for lithium ion battery with high-rate capability and long cycle life",
        "prism:copyright": "© 2020 Science Press and Dalian Institute of Chemical Physics, Chinese Academy of Sciences. Published by Elsevier B.V. and Science Press. All rights reserved.",
        "openaccess": "0",
        "prism:issn": "20954956",
        "dcterms:subject": [
          {
            "@_fa": "true",
            "$": "MXene"
          },
          {
            "@_fa": "true",
            "$": "Ti3C2"
          },
          {
            "@_fa": "true",
            "$": "NiCo-LDH"
          },
          {
            "@_fa": "true",
            "$": "Lithium ion battery"
          },
          {
            "@_fa": "true",
            "$": "First-principles calculation"
          }
        ],
        "openaccessArticle": "false",
        "prism:publicationName": "Journal of Energy Chemistry",
        "openaccessSponsorType": null,
        "prism:pageRange": "143-153",
        "prism:endingPage": "153",
        "pubType": "fla",
        "prism:coverDisplayDate": "November 2020",
        "prism:doi": "10.1016/j.jechem.2020.03.018",
        "prism:startingPage": "143",
        "dc:identifier": "doi:10.1016/j.jechem.2020.03.018",
        "openaccessSponsorName": null
      },
      "objects": {
        "object": [
          {
            "@category": "standard",
            "@height": "388",
            "@width": "583",
            "@_fa": "true",
            "$": "https://api.elsevier.com/content/object/eid/1-s2.0-S2095495620301339-gr1.jpg?httpAccept=%2A%2F%2A",
            "@multimediatype": "JPEG image file",
            "@type": "IMAGE-DOWNSAMPLED",
            "@size": "62780",
            "@ref": "gr1",
            "@mimetype": "image/jpeg"
          },
          {
            "@category": "standard",
            "@height": "536",
            "@width": "731",
            "@_fa": "true",
            "$": "https://api.elsevier.com/content/object/eid/1-s2.0-S2095495620301339-gr2.jpg?httpAccept=%2A%2F%2A",
            "@multimediatype": "JPEG image file",
            "@type": "IMAGE-DOWNSAMPLED",
            "@size": "197955",
            "@ref": "gr2",
            "@mimetype": "image/jpeg"
          },
          {
            "@category": "standard",
            "@height": "765",
            "@width": "649",
            "@_fa": "true",
            "$": "https://api.elsevier.com/content/object/eid/1-s2.0-S2095495620301339-gr3.jpg?httpAccept=%2A%2F%2A",
            "@multimediatype": "JPEG image file",
            "@type": "IMAGE-DOWNSAMPLED",
            "@size": "192253",
            "@ref": "gr3",
            "@mimetype": "image/jpeg"
          },
          {
            "@category": "standard",
            "@height": "691",
            "@width": "642",
            "@_fa": "true",
            "$": "https://api.elsevier.com/content/object/eid/1-s2.0-S2095495620301339-gr4.jpg?httpAccept=%2A%2F%2A",
            "@multimediatype": "JPEG image file",
            "@type": "IMAGE-DOWNSAMPLED",
            "@size": "162802",
            "@ref": "gr4",
            "@mimetype": "image/jpeg"
          },
          {
            "@category": "standard",
            "@height": "585",
            "@width": "654",
            "@_fa": "true",
            "$": "https://api.elsevier.com/content/object/eid/1-s2.0-S2095495620301339-gr5.jpg?httpAccept=%2A%2F%2A",
            "@multimediatype": "JPEG image file",
            "@type": "IMAGE-DOWNSAMPLED",
            "@size": "189501",
            "@ref": "gr5",
            "@mimetype": "image/jpeg"
          },
          {
            "@category": "standard",
            "@height": "752",
            "@width": "653",
            "@_fa": "true",
            "$": "https://api.elsevier.com/content/object/eid/1-s2.0-S2095495620301339-gr6.jpg?httpAccept=%2A%2F%2A",
            "@multimediatype": "JPEG image file",
            "@type": "IMAGE-DOWNSAMPLED",
            "@size": "159017",
            "@ref": "gr6",
            "@mimetype": "image/jpeg"
          },
          {
            "@category": "standard",
            "@height": "856",
            "@width": "569",
            "@_fa": "true",
            "$": "https://api.elsevier.com/content/object/eid/1-s2.0-S2095495620301339-gr7.jpg?httpAccept=%2A%2F%2A",
            "@multimediatype": "JPEG image file",
            "@type": "IMAGE-DOWNSAMPLED",
            "@size": "148265",
            "@ref": "gr7",
            "@mimetype": "image/jpeg"
          },
          {
            "@category": "standard",
            "@height": "168",
            "@width": "301",
            "@_fa": "true",
            "$": "https://api.elsevier.com/content/object/eid/1-s2.0-S2095495620301339-fx1.jpg?httpAccept=%2A%2F%2A",
            "@multimediatype": "JPEG image file",
            "@type": "IMAGE-DOWNSAMPLED",
            "@size": "22497",
            "@ref": "fx1",
            "@mimetype": "image/jpeg"
          },
          {
            "@category": "thumbnail",
            "@height": "146",
            "@width": "219",
            "@_fa": "true",
            "$": "https://api.elsevier.com/content/object/eid/1-s2.0-S2095495620301339-gr1.sml?httpAccept=%2A%2F%2A",
            "@multimediatype": "GIF image file",
            "@type": "IMAGE-THUMBNAIL",
            "@size": "8875",
            "@ref": "gr1",
            "@mimetype": "image/gif"
          },
          {
            "@category": "thumbnail",
            "@height": "161",
            "@width": "219",
            "@_fa": "true",
            "$": "https://api.elsevier.com/content/object/eid/1-s2.0-S2095495620301339-gr2.sml?httpAccept=%2A%2F%2A",
            "@multimediatype": "GIF image file",
            "@type": "IMAGE-THUMBNAIL",
            "@size": "27230",
            "@ref": "gr2",
            "@mimetype": "image/gif"
          },
          {
            "@category": "thumbnail",
            "@height": "164",
            "@width": "139",
            "@_fa": "true",
            "$": "https://api.elsevier.com/content/object/eid/1-s2.0-S2095495620301339-gr3.sml?httpAccept=%2A%2F%2A",
            "@multimediatype": "GIF image file",
            "@type": "IMAGE-THUMBNAIL",
            "@size": "10947",
            "@ref": "gr3",
            "@mimetype": "image/gif"
          },
          {
            "@category": "thumbnail",
            "@height": "164",
            "@width": "152",
            "@_fa": "true",
            "$": "https://api.elsevier.com/content/object/eid/1-s2.0-S2095495620301339-gr4.sml?httpAccept=%2A%2F%2A",
            "@multimediatype": "GIF image file",
            "@type": "IMAGE-THUMBNAIL",
            "@size": "10766",
            "@ref": "gr4",
            "@mimetype": "image/gif"
          },
          {
            "@category": "thumbnail",
            "@height": "164",
            "@width": "183",
            "@_fa": "true",
            "$": "https://api.elsevier.com/content/object/eid/1-s2.0-S2095495620301339-gr5.sml?httpAccept=%2A%2F%2A",
            "@multimediatype": "GIF image file",
            "@type": "IMAGE-THUMBNAIL",
            "@size": "26513",
            "@ref": "gr5",
            "@mimetype": "image/gif"
          },
          {
            "@category": "thumbnail",
            "@height": "163",
            "@width": "142",
            "@_fa": "true",
            "$": "https://api.elsevier.com/content/object/eid/1-s2.0-S2095495620301339-gr6.sml?httpAccept=%2A%2F%2A",
            "@multimediatype": "GIF image file",
            "@type": "IMAGE-THUMBNAIL",
            "@size": "10606",
            "@ref": "gr6",
            "@mimetype": "image/gif"
          },
          {
            "@category": "thumbnail",
            "@height": "164",
            "@width": "109",
            "@_fa": "true",
            "$": "https://api.elsevier.com/content/object/eid/1-s2.0-S2095495620301339-gr7.sml?httpAccept=%2A%2F%2A",
            "@multimediatype": "GIF image file",
            "@type": "IMAGE-THUMBNAIL",
            "@size": "9306",
            "@ref": "gr7",
            "@mimetype": "image/gif"
          },
          {
            "@category": "thumbnail",
            "@height": "122",
            "@width": "219",
            "@_fa": "true",
            "$": "https://api.elsevier.com/content/object/eid/1-s2.0-S2095495620301339-fx1.sml?httpAccept=%2A%2F%2A",
            "@multimediatype": "GIF image file",
            "@type": "IMAGE-THUMBNAIL",
            "@size": "11828",
            "@ref": "fx1",
            "@mimetype": "image/gif"
          },
          {
            "@category": "high",
            "@height": "1718",
            "@width": "2581",
            "@_fa": "true",
            "$": "https://api.elsevier.com/content/object/eid/1-s2.0-S2095495620301339-gr1_lrg.jpg?httpAccept=%2A%2F%2A",
            "@multimediatype": "JPEG image file",
            "@type": "IMAGE-HIGH-RES",
            "@size": "457424",
            "@ref": "gr1",
            "@mimetype": "image/jpeg"
          },
          {
            "@category": "high",
            "@height": "2376",
            "@width": "3238",
            "@_fa": "true",
            "$": "https://api.elsevier.com/content/object/eid/1-s2.0-S2095495620301339-gr2_lrg.jpg?httpAccept=%2A%2F%2A",
            "@multimediatype": "JPEG image file",
            "@type": "IMAGE-HIGH-RES",
            "@size": "2199455",
            "@ref": "gr2",
            "@mimetype": "image/jpeg"
          },
          {
            "@category": "high",
            "@height": "3389",
            "@width": "2876",
            "@_fa": "true",
            "$": "https://api.elsevier.com/content/object/eid/1-s2.0-S2095495620301339-gr3_lrg.jpg?httpAccept=%2A%2F%2A",
            "@multimediatype": "JPEG image file",
            "@type": "IMAGE-HIGH-RES",
            "@size": "1493265",
            "@ref": "gr3",
            "@mimetype": "image/jpeg"
          },
          {
            "@category": "high",
            "@height": "3056",
            "@width": "2841",
            "@_fa": "true",
            "$": "https://api.elsevier.com/content/object/eid/1-s2.0-S2095495620301339-gr4_lrg.jpg?httpAccept=%2A%2F%2A",
            "@multimediatype": "JPEG image file",
            "@type": "IMAGE-HIGH-RES",
            "@size": "1306755",
            "@ref": "gr4",
            "@mimetype": "image/jpeg"
          },
          {
            "@category": "high",
            "@height": "2593",
            "@width": "2898",
            "@_fa": "true",
            "$": "https://api.elsevier.com/content/object/eid/1-s2.0-S2095495620301339-gr5_lrg.jpg?httpAccept=%2A%2F%2A",
            "@multimediatype": "JPEG image file",
            "@type": "IMAGE-HIGH-RES",
            "@size": "1875061",
            "@ref": "gr5",
            "@mimetype": "image/jpeg"
          },
          {
            "@category": "high",
            "@height": "3329",
            "@width": "2892",
            "@_fa": "true",
            "$": "https://api.elsevier.com/content/object/eid/1-s2.0-S2095495620301339-gr6_lrg.jpg?httpAccept=%2A%2F%2A",
            "@multimediatype": "JPEG image file",
            "@type": "IMAGE-HIGH-RES",
            "@size": "1273131",
            "@ref": "gr6",
            "@mimetype": "image/jpeg"
          },
          {
            "@category": "high",
            "@height": "3792",
            "@width": "2520",
            "@_fa": "true",
            "$": "https://api.elsevier.com/content/object/eid/1-s2.0-S2095495620301339-gr7_lrg.jpg?httpAccept=%2A%2F%2A",
            "@multimediatype": "JPEG image file",
            "@type": "IMAGE-HIGH-RES",
            "@size": "1151301",
            "@ref": "gr7",
            "@mimetype": "image/jpeg"
          },
          {
            "@category": "high",
            "@height": "743",
            "@width": "1333",
            "@_fa": "true",
            "$": "https://api.elsevier.com/content/object/eid/1-s2.0-S2095495620301339-fx1_lrg.jpg?httpAccept=%2A%2F%2A",
            "@multimediatype": "JPEG image file",
            "@type": "IMAGE-HIGH-RES",
            "@size": "162186",
            "@ref": "fx1",
            "@mimetype": "image/jpeg"
          },
          {
            "@category": "standard",
            "@_fa": "true",
            "$": "https://api.elsevier.com/content/object/eid/1-s2.0-S2095495620301339-mmc1.docx?httpAccept=%2A%2F%2A",
            "@multimediatype": "Microsoft Word file",
            "@type": "APPLICATION",
            "@size": "5422628",
            "@ref": "mmc1",
            "@mimetype": "application/word"
          },
          {
            "@category": "thumbnail",
            "@_fa": "true",
            "$": "https://api.elsevier.com/content/object/eid/1-s2.0-S2095495620301339-si4.svg?httpAccept=%2A%2F%2A",
            "@multimediatype": "Scalable Vector Graphics file",
            "@type": "ALTIMG",
            "@size": "6411",
            "@ref": "si4",
            "@mimetype": "image/svg+xml"
          },
          {
            "@category": "thumbnail",
            "@_fa": "true",
            "$": "https://api.elsevier.com/content/object/eid/1-s2.0-S2095495620301339-si1.svg?httpAccept=%2A%2F%2A",
            "@multimediatype": "Scalable Vector Graphics file",
            "@type": "ALTIMG",
            "@size": "4131",
            "@ref": "si1",
            "@mimetype": "image/svg+xml"
          },
          {
            "@category": "thumbnail",
            "@_fa": "true",
            "$": "https://api.elsevier.com/content/object/eid/1-s2.0-S2095495620301339-si2.svg?httpAccept=%2A%2F%2A",
            "@multimediatype": "Scalable Vector Graphics file",
            "@type": "ALTIMG",
            "@size": "7038",
            "@ref": "si2",
            "@mimetype": "image/svg+xml"
          },
          {
            "@category": "thumbnail",
            "@_fa": "true",
            "$": "https://api.elsevier.com/content/object/eid/1-s2.0-S2095495620301339-si3.svg?httpAccept=%2A%2F%2A",
            "@multimediatype": "Scalable Vector Graphics file",
            "@type": "ALTIMG",
            "@size": "6140",
            "@ref": "si3",
            "@mimetype": "image/svg+xml"
          },
          {
            "@category": "standard",
            "@_fa": "true",
            "$": "https://api.elsevier.com/content/object/eid/1-s2.0-S2095495620301339-am.pdf?httpAccept=%2A%2F%2A",
            "@multimediatype": "Acrobat PDF file",
            "@type": "AAM-PDF",
            "@size": "2413458",
            "@ref": "am",
            "@mimetype": "application/pdf"
          }
        ]
      },
      "link": {
        "@rel": "abstract",
        "@href": "https://api.elsevier.com/content/abstract/scopus_id/85082872371"
      }
    }
  }
}