{
  "metadata": {
    "title": "Boosting the catalytic activity toward oxygen reduction via a heterostructure of porous iron oxide-decorated 2D NiO/NG nanosheets",
    "authors": "; ; ",
    "journal": "Journal of Energy Chemistry",
    "date": "2024-06-30",
    "doi": "10.1016/j.jechem.2024.01.051",
    "abstract": "",
    "uri": "https://api.elsevier.com/content/article/pii/S2095495624000895",
    "pii": "S2095495624000895"
  },
  "fulltext": {
    "full-text-retrieval-response": {
      "scopus-eid": "2-s2.0-85189018219",
      "originalText": "serial JL 286353 291210 291711 291744 291809 31 Journal of Energy Chemistry JOURNALENERGYCHEMISTRY 2024-03-13 2024-03-13 2024-05-09 2024-05-09 2024-05-09T04:00:25 1-s2.0-S2095495624000895 S2095-4956(24)00089-5 S2095495624000895 10.1016/j.jechem.2024.01.051 S300 S300.1 FULL-TEXT 1-s2.0-S2095495624X00030 2024-07-05T13:06:06.254024Z 0 0 20240601 20240630 2024 2024-03-13T14:09:21.457994Z absattachment articleinfo articletitlenorm authfirstinitialnorm authfirstsurnamenorm cid cids contenttype copyright crossmark dateloaded dateloadedtxt datesearch datesort dateupdated dco docsubtype doctype doi eid ewtransactionid hubeid indexeddate issn issnnorm itemstage itemtransactionid itemweight openaccess openarchive pg pgfirst pglast pii piinorm pubdateend pubdatestart pubdatetxt pubyr sortorder srctitle srctitlenorm srctype ssids alllist content subj subheadings suppl tomb volfirst volissue volumelist webpdf webpdfpagecount yearnav figure e-component body mmlmath acknowledge affil appendices articletitle auth authfirstini authfull authkeywords authlast grantnumber grantsponsor grantsponsorid orcid primabst ref specialabst 2095-4956 20954956 false 93 93 C Volume 93 60 669 681 669 681 202406 June 2024 2024-06-01 2024-06-30 2024 article fla © 2024 Science Press and Dalian Institute of Chemical Physics, Chinese Academy of Sciences. Published by ELSEVIER B.V. and Science Press. All rights reserved. BOOSTINGCATALYTICACTIVITYTOWARDOXYGENREDUCTIONVIAAHETEROSTRUCTUREPOROUSIRONOXIDEDECORATED2DNIONGNANOSHEETS MAITI K 1 Introduction 2 Experimental 2.1 Chemical reagents 2.2 Synthesis of graphene oxide (GO) and N-doped graphene (NG) 2.3 Synthesis of porous Fe2O3@NiO-layered NG (Fe2O3@NiO / NG) hybrids 2.4 Material characterization 2.5 Electrochemical characterization 3 Results and discussion 3.1 Morphological and structural characterization 3.2 Electrocatalytic activity 3.3 Theoretical interpretation 3.4 Electrochemical stability 3.5 Catalytic reaction mechanism for Fe2O3@NiO / NG hybrid 4 Conclusions Acknowledgments Appendix A Supplementary material References ZHOU 2015 6697 6707 W AHSAN 2020 14688 14701 M ZHAO 2018 129 137 Y WANG 2017 1700467 Q ZHOU 2018 1701905 D YANG 2019 1096 1102 W TIAN 2018 2150 2158 T WU 2022 5911 5920 Z KANG 2021 3818 3835 Q JIAO 2008 5262 5266 F GODINEZSALOMON 2018 10498 10520 F CZELEJ 2018 73 75 K LU 2014 6479 6482 Z PENG 2017 15139 L TIAN 2020 18668 18678 L WU 2021 105409 M CHANDRASEKARAN 2020 105080 S ZAFAR 2022 68 114 Z YAN 2017 1606459 D KUZNETSOV 2018 225 244 D SUN 2019 215 238 T KHANI 2020 1903215 H ZOU 2011 2615 2620 Y DENG 2009 022108 R MAITI 2018 18734 18745 K MAITI 2021 128358 K BAGHBANZADEH 2011 11312 11359 M GORLIN 2017 2070 2082 M ZHANG 2010 18 34 J MAITI 2021 2101670 K DENG 2016 197 212 S LONG 2014 7714 7718 X SUN 2014 13635 M DHAVALE 2015 20117 20125 V IBRAHIM 2018 309 315 K MAITI 2018 32220 32232 K MOLLAMAHALE 2018 15 18 Y ZHAO 2016 6517 6524 Y CHEN 2016 29381 M JIANG 2020 2436 2444 L JIANG 2019 9100 9111 Y LI 2020 1417 1423 J GETSOIAN 2014 13684 13697 A YUN 2021 824 T WOLF 2023 11536 11543 S SUN 2021 2100110 Z JIANG 2017 5140 5147 T WANG 2019 1900788 P WANG 2021 7805 7817 C KIM 2021 1399 1408 J YANG 2020 5075 H ZHENG 2019 10722 10728 Y LOUIE 2013 12329 12337 M HU 2003 588 596 C MAITI 2021 130233 K SHIN 2017 5244 5253 K FUKUDA 2013 2280 2282 K TAKIMOTO 2019 5743 5751 D SHEN 2019 1720 1728 X SEO 2016 1600661 J BU 2018 359 371 L MAITIX2024X669 MAITIX2024X669X681 MAITIX2024X669XK MAITIX2024X669X681XK 2026-05-09T00:00:00.000Z 2026-05-09T00:00:00.000Z http://creativecommons.org/licenses/by-nc-nd/4.0/ © 2024 Science Press and Dalian Institute of Chemical Physics, Chinese Academy of Sciences. Published by ELSEVIER B.V. and Science Press. All rights reserved. 2024-04-05T00:46:40.263Z http://vtw.elsevier.com/data/voc/AddOnTypes/50.7/aggregated-refined 2022R1A5A1033719 NRF National Research Foundation of Korea http://data.elsevier.com/vocabulary/SciValFunders/501100003725 http://sws.geonames.org/1835841 ERC Center Ministry of Science and ICT RS-2023-00235596 RS-2023-00302697 MSIP Ministry of Science, ICT and Future Planning http://data.elsevier.com/vocabulary/SciValFunders/501100003621 http://sws.geonames.org/1835841/ This work was supported by the National Research Foundation of Korea (NRF) funded by Ministry of Science and ICT (MSIT) (RS-2023-00235596) and ERC Center (2022R1A5A1033719). This work was supported by the National Research Foundation of Korea (NRF) funded by Ministry of Science and ICT (MSIT) (RS-2023-00235596, RS-2023-00302697) and ERC Center (Grant No. 2022R1A5A1033719). item S2095-4956(24)00089-5 S2095495624000895 1-s2.0-S2095495624000895 10.1016/j.jechem.2024.01.051 286353 2024-07-05T13:06:06.254024Z 2024-06-01 2024-06-30 1-s2.0-S2095495624000895-main.pdf https://s3-eu-west-1.amazonaws.com/prod-ucs-content-store-eu-west/content/pii:S2095495624000895/MAIN/application/pdf/e2c201e9cc896a5aa6883979c4798bfe/main.pdf main.pdf pdf true 5341972 MAIN 13 1-s2.0-S2095495624000895-main_1.png https://s3-eu-west-1.amazonaws.com/prod-ucs-content-store-eu-west/content/pii:S2095495624000895/PREVIEW/image/png/052f6d1a4d847572b5d2e0bb894bb2f1/main_1.png main_1.png png 61996 849 656 IMAGE-WEB-PDF 1 1-s2.0-S2095495624000895-ga1.jpg https://s3-eu-west-1.amazonaws.com/prod-ucs-content-store-eu-west/content/pii:S2095495624000895/ga1/DOWNSAMPLED/image/jpeg/8573f6847538308a07b5859e0b4af87d/ga1.jpg ga1 true ga1.jpg jpg 36619 200 259 IMAGE-DOWNSAMPLED 1-s2.0-S2095495624000895-gr1.jpg https://s3-eu-west-1.amazonaws.com/prod-ucs-content-store-eu-west/content/pii:S2095495624000895/gr1/DOWNSAMPLED/image/jpeg/3fdbe3a4a812c3a011c4bc626f511d7d/gr1.jpg gr1 gr1.jpg jpg 221550 866 676 IMAGE-DOWNSAMPLED 1-s2.0-S2095495624000895-gr2.jpg https://s3-eu-west-1.amazonaws.com/prod-ucs-content-store-eu-west/content/pii:S2095495624000895/gr2/DOWNSAMPLED/image/jpeg/269e58fcc993c7ee75d38a64b0ffba3d/gr2.jpg gr2 gr2.jpg jpg 265627 819 674 IMAGE-DOWNSAMPLED 1-s2.0-S2095495624000895-gr3.jpg https://s3-eu-west-1.amazonaws.com/prod-ucs-content-store-eu-west/content/pii:S2095495624000895/gr3/DOWNSAMPLED/image/jpeg/f75c17511c1f892a18bad17af65989c6/gr3.jpg gr3 gr3.jpg jpg 185047 769 698 IMAGE-DOWNSAMPLED 1-s2.0-S2095495624000895-gr4.jpg https://s3-eu-west-1.amazonaws.com/prod-ucs-content-store-eu-west/content/pii:S2095495624000895/gr4/DOWNSAMPLED/image/jpeg/fe13e7d71cdcae5f330f0a584a653587/gr4.jpg gr4 gr4.jpg jpg 156929 725 685 IMAGE-DOWNSAMPLED 1-s2.0-S2095495624000895-gr5.jpg https://s3-eu-west-1.amazonaws.com/prod-ucs-content-store-eu-west/content/pii:S2095495624000895/gr5/DOWNSAMPLED/image/jpeg/4842a5359cffa6e80fd31a9e89c98940/gr5.jpg gr5 gr5.jpg jpg 103362 789 631 IMAGE-DOWNSAMPLED 1-s2.0-S2095495624000895-gr6.jpg https://s3-eu-west-1.amazonaws.com/prod-ucs-content-store-eu-west/content/pii:S2095495624000895/gr6/HEAD-ONLY-JATS/image/jpeg/9df0fac5c2334a184906ace80023ef98/gr6.jpg gr6 gr6.jpg jpg 64696 239 729 IMAGE-DOWNSAMPLED 1-s2.0-S2095495624000895-ga1.sml https://s3-eu-west-1.amazonaws.com/prod-ucs-content-store-eu-west/content/pii:S2095495624000895/ga1/THUMBNAIL/image/gif/88eb171716416831f741fe99e0966f07/ga1.sml ga1 true ga1.sml sml 27925 164 212 IMAGE-THUMBNAIL 1-s2.0-S2095495624000895-gr1.sml https://s3-eu-west-1.amazonaws.com/prod-ucs-content-store-eu-west/content/pii:S2095495624000895/gr1/THUMBNAIL/image/gif/b8261d7e40ac0b89c2feed28738eec82/gr1.sml gr1 gr1.sml sml 14558 164 128 IMAGE-THUMBNAIL 1-s2.0-S2095495624000895-gr2.sml https://s3-eu-west-1.amazonaws.com/prod-ucs-content-store-eu-west/content/pii:S2095495624000895/gr2/THUMBNAIL/image/gif/ba9c05226d38557b0b5f5811e03b9614/gr2.sml gr2 gr2.sml sml 20632 164 135 IMAGE-THUMBNAIL 1-s2.0-S2095495624000895-gr3.sml https://s3-eu-west-1.amazonaws.com/prod-ucs-content-store-eu-west/content/pii:S2095495624000895/gr3/THUMBNAIL/image/gif/a4efe0a1dc8b514de3293e8323daad18/gr3.sml gr3 gr3.sml sml 11646 164 149 IMAGE-THUMBNAIL 1-s2.0-S2095495624000895-gr4.sml https://s3-eu-west-1.amazonaws.com/prod-ucs-content-store-eu-west/content/pii:S2095495624000895/gr4/THUMBNAIL/image/gif/3a63efce4b5c68d1c9dceccbdaa13ab3/gr4.sml gr4 gr4.sml sml 11630 164 155 IMAGE-THUMBNAIL 1-s2.0-S2095495624000895-gr5.sml https://s3-eu-west-1.amazonaws.com/prod-ucs-content-store-eu-west/content/pii:S2095495624000895/gr5/THUMBNAIL/image/gif/d912a0f653f3ffc567f9ab63f3eae439/gr5.sml gr5 gr5.sml sml 6626 164 131 IMAGE-THUMBNAIL 1-s2.0-S2095495624000895-gr6.sml https://s3-eu-west-1.amazonaws.com/prod-ucs-content-store-eu-west/content/pii:S2095495624000895/gr6/THUMBNAIL/image/gif/8f66229064ce8e548990c11e87ec6d7d/gr6.sml gr6 gr6.sml sml 8583 72 219 IMAGE-THUMBNAIL 1-s2.0-S2095495624000895-ga1_lrg.jpg https://s3-eu-west-1.amazonaws.com/prod-ucs-content-store-eu-west/content/pii:S2095495624000895/HIGHRES/image/jpeg/4bf311040c0ab96c000ba6bccdfd6413/ga1_lrg.jpg ga1 true ga1_lrg.jpg jpg 144195 531 688 IMAGE-HIGH-RES 1-s2.0-S2095495624000895-gr1_lrg.jpg https://s3-eu-west-1.amazonaws.com/prod-ucs-content-store-eu-west/content/pii:S2095495624000895/HIGHRES/image/jpeg/1a240ed93c02e579ae399c20870796c6/gr1_lrg.jpg gr1 gr1_lrg.jpg jpg 1757133 3833 2992 IMAGE-HIGH-RES 1-s2.0-S2095495624000895-gr2_lrg.jpg https://s3-eu-west-1.amazonaws.com/prod-ucs-content-store-eu-west/content/pii:S2095495624000895/HIGHRES/image/jpeg/8572c930d73ff79a92e0830942481e28/gr2_lrg.jpg gr2 gr2_lrg.jpg jpg 1826017 3627 2984 IMAGE-HIGH-RES 1-s2.0-S2095495624000895-gr3_lrg.jpg https://s3-eu-west-1.amazonaws.com/prod-ucs-content-store-eu-west/content/pii:S2095495624000895/HIGHRES/image/jpeg/1c9a1fd3d0d062fc69373e263bb5c95d/gr3_lrg.jpg gr3 gr3_lrg.jpg jpg 1208860 3404 3091 IMAGE-HIGH-RES 1-s2.0-S2095495624000895-gr4_lrg.jpg https://s3-eu-west-1.amazonaws.com/prod-ucs-content-store-eu-west/content/pii:S2095495624000895/HIGHRES/image/jpeg/5c2afddf96accd0244b543fca3567269/gr4_lrg.jpg gr4 gr4_lrg.jpg jpg 1025246 3208 3031 IMAGE-HIGH-RES 1-s2.0-S2095495624000895-gr5_lrg.jpg https://s3-eu-west-1.amazonaws.com/prod-ucs-content-store-eu-west/content/pii:S2095495624000895/PUBMED/image/jpeg/1ac9c76fc669387a98fb204d61d02097/gr5_lrg.jpg gr5 gr5_lrg.jpg jpg 589788 3497 2795 IMAGE-HIGH-RES 1-s2.0-S2095495624000895-gr6_lrg.jpg https://s3-eu-west-1.amazonaws.com/prod-ucs-content-store-eu-west/content/pii:S2095495624000895/HIGHRES/image/jpeg/e0f5147a14b576d3993db54e6fe3610e/gr6_lrg.jpg gr6 gr6_lrg.jpg jpg 404378 1056 3226 IMAGE-HIGH-RES 1-s2.0-S2095495624000895-mmc1.pdf https://s3-eu-west-1.amazonaws.com/prod-ucs-content-store-eu-west/content/pii:S2095495624000895/mmc1/MAIN/application/pdf/5fd7e80a911f3ac939851d468f45b793/mmc1.pdf mmc1 mmc1.pdf pdf false 4647192 APPLICATION 1-s2.0-S2095495624000895-si1.svg https://s3-eu-west-1.amazonaws.com/prod-ucs-content-store-eu-west/content/pii:S2095495624000895/STRIPIN/image/svg+xml/1e48420ad65f523aa17133148858a024/si1.svg si1 true si1.svg svg 791 ALTIMG 1-s2.0-S2095495624000895-si2.svg https://s3-eu-west-1.amazonaws.com/prod-ucs-content-store-eu-west/content/pii:S2095495624000895/STRIPIN/image/svg+xml/72f1868d6c55df7f0f6d175b11eb543e/si2.svg si2 si2.svg svg 12383 ALTIMG 1-s2.0-S2095495624000895-si3.svg https://s3-eu-west-1.amazonaws.com/prod-ucs-content-store-eu-west/content/pii:S2095495624000895/STRIPIN/image/svg+xml/0186b3e68ea01d82fa04bbda552bf218/si3.svg si3 si3.svg svg 17631 ALTIMG 1-s2.0-S2095495624000895-si4.svg https://s3-eu-west-1.amazonaws.com/prod-ucs-content-store-eu-west/content/pii:S2095495624000895/STRIPIN/image/svg+xml/262dc63d77775e36c306fea2c5b4d791/si4.svg si4 si4.svg svg 32853 ALTIMG 1-s2.0-S2095495624000895-si5.svg https://s3-eu-west-1.amazonaws.com/prod-ucs-content-store-eu-west/content/pii:S2095495624000895/STRIPIN/image/svg+xml/ea91a19c9e2a0f265462e09a781ae847/si5.svg si5 si5.svg svg 15264 ALTIMG 1-s2.0-S2095495624000895-si6.svg https://s3-eu-west-1.amazonaws.com/prod-ucs-content-store-eu-west/content/pii:S2095495624000895/STRIPIN/image/svg+xml/cebeb43c8648eac3698f2924ea6e9553/si6.svg si6 si6.svg svg 8428 ALTIMG 1-s2.0-S2095495624000895-si7.svg https://s3-eu-west-1.amazonaws.com/prod-ucs-content-store-eu-west/content/pii:S2095495624000895/STRIPIN/image/svg+xml/0cc11a7f1b9d5d685b0ed395a386e15a/si7.svg si7 si7.svg svg 1081 ALTIMG 1-s2.0-S2095495624000895-si8.svg https://s3-eu-west-1.amazonaws.com/prod-ucs-content-store-eu-west/content/pii:S2095495624000895/STRIPIN/image/svg+xml/7fc848c284ac101fe970d858e9220958/si8.svg si8 si8.svg svg 7697 ALTIMG 1-s2.0-S2095495624000895-si9.svg https://s3-eu-west-1.amazonaws.com/prod-ucs-content-store-eu-west/content/pii:S2095495624000895/STRIPIN/image/svg+xml/05fb07cf8bdba76a85fe962a2346b21c/si9.svg si9 si9.svg svg 13360 ALTIMG 1-s2.0-S2095495624000895-am.pdf am am.pdf pdf 2849159 AAM-PDF https://s3-eu-west-1.amazonaws.com/prod-ucs-content-store-eu-west/content/egi:10NZFVH7H22/MAIN/application/pdf/31ff26b657b7b1ade2a2e1e79dfd0d01/am.pdf JECHEM 3641 S2095-4956(24)00089-5 10.1016/j.jechem.2024.01.051 Science Press and Dalian Institute of Chemical Physics, Chinese Academy of Sciences. Fig. 1 FE-SEM images of (a) NiO / NG and (b, c) Fe2O3@NiO / NG hybrids, with corresponding (c) Fe2O3 crystal particle size distribution (inset), (d) schematic illustration of crystal model, and (e) EDX analysis of Fe2O3@NiO / NG hybrid after acid leaching. (f) XRD spectra comparison of Fe2O3@NiO / NG, Fe2O3 / NG, and NiO / NG hybrids. Lines are offset for clarity. Fig. 2 (a-c) TEM and corresponding HR-TEM images of NiO / NG hybrids. The inset of (b) shows the corresponding SAED pattern of NiO / NG hybrids. (d–f) TEM and HR-TEM images of Fe2O3@NiO / NG hybrids. (g–k) Differently magnified HR-TEM images and corresponding SAED (inset) patterns of Fe2O3@NiO / NG hybrids. (l) Dark-field STEM elemental compositional analysis of selected Fe2O3@NiO / NG hybrid areas. Corresponding elemental mappings depict (m) all studied elements, (n) Fe, (o) O, (p) Ni, (q) C, and (r) N. Fig. 3 Comparisons of (a) Raman spectra and (b) N2 sorption isotherms of NG, NiO / NG, Fe2O3 / NG, and Fe2O3@NiO / NG hybrids. Matching (c) Fe 2p HP-XPS spectra of Fe2O3 / NG and Fe2O3@NiO / NG hybrids. (d) Ni 2p HP-XPS spectra of NiO / NG and Fe2O3@NiO / NG hybrids. (e) N 1s spectra of Fe2O3@NiO / NG hybrids, and (f) O 1s spectra of Fe2O3@NiO / NG hybrids. Fig. 4 (a) LSV curves of NG, Fe2O3@NiO, Fe2O3 / NG, NiO / NG, Fe2O3@NiO / NG hybrids, and Pt/C. (b) Comparison of E onset and E half between different catalysts. (c) Tafel plots of as-prepared NG, Fe2O3@NiO, Fe2O3 / NG, NiO / NG, and Fe2O3@NiO / NG hybrids. (d) LSV curves of the Fe2O3@NiO / NG hybrid at different rotation potentials. (e) Plot of J −1 vs. ω −1/2 for Fe2O3@NiO / NG hybrids at different electrode potentials according to the Koutecky − Levich equation. (f) Comparison of E onset between studied catalysts and those from previous literature. Fig. 5 Relative energy profiles for ORR on (a) NiO and NG, (b) 2D / 2D (NiO / NG), Fe2O3 / 2D (Fe2O3 / NG and Fe2O3@NiO), and hybrid (Fe2O3@NiO / NG) structures. (c) Relationship between O binding energy and charge transfer from 2D material(s) to Fe2O3. (d) Charge density difference when Fe2O3 is introduced on the 2D / 2D structure. Yellow and cyan indicate charge density accumulation and depletion, respectively. Isosurface levels for charge density visualization were set to 0.05 e Å−3. (e) Relationship between O binding energy and experimentally measured Tafel slope. (f) Oxygen vacancy (Ov) formation energy on candidate materials. Scheme 1 Schematic diagram depicting the synthetic processing of a Fe2O3@NiO / NG hybrid. Boosting the catalytic activity toward oxygen reduction via a heterostructure of porous iron oxide-decorated 2D NiO/NG nanosheets Kakali Maiti a d Matthew T. Curnan a Hyung Jun Kim b Kyeounghak Kim c ⁎ Jeong Woo Han b ⁎ a Department of Chemical Engineering, Pohang University of Science and Technology (POSTECH), Pohang, Gyeongbuk 37673, Republic of Korea Department of Chemical Engineering Pohang University of Science and Technology (POSTECH) Pohang Gyeongbuk 37673 Republic of Korea Department of Chemical Engineering, Pohang University of Science and Technology (POSTECH), Pohang, Gyeongbuk 37673, Republic of Korea b Department of Materials Science and Engineering, Research Institute of Advanced Materials, Seoul National University, Seoul 08826, Republic of Korea Department of Materials Science and Engineering Research Institute of Advanced Materials Seoul National University Seoul 08826 Republic of Korea Department of Materials Science and Engineering, Research Institute of Advanced Materials, Seoul National University, Seoul 08826, Republic of Korea c Department of Chemical Engineering, Clean-Energy Research Institute, Hanyang University, Seoul 04763, Republic of Korea Department of Chemical Engineering Clean-Energy Research Institute Hanyang University Seoul 04763 Republic of Korea Department of Chemical Engineering, Clean-Energy Research Institute, Hanyang University, Seoul 04763, Republic of Korea d CSIR-Institute of Minerals and Materials Technology, RRL Campus, Acharya Vihar, Bhubaneswar, Odisha 751013, India CSIR-Institute of Minerals and Materials Technology RRL Campus Acharya Vihar Bhubaneswar Odisha 751013 India CSIR-Institute of Minerals and Materials Technology, RRL Campus, Acharya Vihar, Bhubaneswar, Odisha 751013, India ⁎ Corresponding authors. Graphical abstract A porous iron oxide-decorated 2D / 2D nanosheets of NiO and nitrogen-doped graphene facilitates charge transport and exposes formerly inaccessible reaction sites, maximizing active site density utilization, thereby improving electrocatalytic performance for ORR. As a noble metal substitute, two-dimensional (2D) hierarchical nano-frame structures have attracted great interest as candidate catalysts due to their remarkable advantages – high intrinsic activity, high electron mobility, and straightforward surface functionalization. Therefore, they may replace Pt-based catalysts in oxygen reduction reaction (ORR) applications. Herein, a simple method is developed to design hierarchical nano-frame structures assembled via 2D NiO and N-doped graphene (NG) nanosheets. This procedure can yield nanostructures that satisfy the criteria correlated with improved electrocatalytic performance, such as large surface area, numerous undercoordinated atoms, and high defect densities. Further, porous NG nanosheet architectures, featuring NiO nanosheets densely coordinated with accessible holey Fe2O3 moieties, can enhance mesoporosity and balance hydrophilicity. Such improvements can facilitate charge transport and expose formerly inaccessible reaction sites, maximizing active site density utilization. Density functional theory (DFT) calculations reveal favored O2 adsorption and dissociation on Fe2O3 hybrid structures when supported by 2D NiO and NG nanomaterials, given 2D materials donated charge to Fe2O3 active sites. Our systematic studies reveal that synergistic contributions are responsible for enriching the catalytic activity of Fe2O3@NiO / NG in alkaline media – encompassing internal voids and pores, unique hierarchical support structures, and concentrated N-dopant and bimetallic atomic interactions. Ultimately, this work expands the toolbox for designing and synthesizing highly efficient 2D / 2D shelled functional nanomaterials with transition metals, endeavoring to benefit energy conversion and related ORR applications. Keywords N-doped graphene Holey Fe2O3 nanocrystals NiO nanosheets High catalytic performance, ORR 1 Introduction ORR is a key consideration in fuel cell and metal–air battery cathode operation. This reaction requires active catalysts to achieve desired electronic properties. In addition, such catalysts should have high densities of reaction sites, strong electrochemical activity, and excellent stability within studied electrolytes [1,2]. Further, they should be synthesized using a reproducible procedure [3]. Thus, transition metal (M) oxide (M = Co, Fe, Ni) based nanostructures may meet these requirements [3–5] by substituting expensive Pt with M. Inexpensive mesoporous two-dimensiaonal (2D) nanostructures of nickel (Ni) oxides have desirable properties, such as high capacity, rate capability, and cycling stability [5–8]. Multiple accessible Ni valence states enable flexibility in redox reactions relative to other oxides [4,8]. Moreover, 2D layered Ni oxides [7,9] have been identified as energy storage candidates due to their low overpotentials and Tafel slopes. The ultra-high surface area of mesoporous 2D NiO exposes a large fraction of surface atoms to reactions, [10,11] and provides numerous active sites that improve catalytic reaction kinetics [12]. Furthermore, 2D NiO has hierarchical layered nanostructures that provide remarkable permeable channels for fast transportation and adsorption of ions. Such channels facilitate rapid electron transfer by accelerating catalytic reaction processes [13,14]. However, the interfaces of mesoporous NiO nanostructures can feature constrained close-packed basal planes. They yield high concentrations of valence-rich oxidized Ni states, which limit catalytic performance [15]. Controlling nanosheet thickness helps minimize diffusion path length, thereby ensuring rapid interfacial charge transport during electrocatalytic processes and thus optimizing catalytic performance. In addition, the number of defect-rich structures generally increases as 2D nanosheet thickness is reduced [16]. Such defects influence the physicochemical properties of these catalysts, and are linked to improvements in electrocatalytic performance [7,17]. Therefore, appropriate engineering of such properties could provide tremendous potential towards improving ORR catalytic activity. In this regard, defect engineering would provide suitable opportunities to exploit structure–property–performance relationships for rational catalyst design. Towards this end, numerous features including vacancies and interfacial facets could be controlled [3,17–20]. Usually, nanoscale NiO structures allow lattice deformations and surface dangling bonds, which increase the occurrence of structural defects [20]. Therefore, engineering of defects in 2D NiO should focus on activation of basal planes. Effective interactions between nanoscale NiO and highly conducting 2D carbonaceous supports can increase the concentrations of defects [5], including edge-defect sites, distorted surfaces, expanded structural pores, and grain boundaries [19–21]. Typically, amorphous transition metal oxides (TMOs) undergo huge volume changes and drastic structural reorganization during electrochemical processes. However, TMO structural components can be effectively maintained by integration with flexible and robust graphene supports [22], which improve TMO stability during electrochemical cycling. Further, NG nanostructures such as disordered/amorphous carbon networks provide the synergistic benefits of such interactions between catalyst and support [2,4,22]. Thus, hybridized NiO and NG nanosheet layers are strong candidates for the active basal planes of nanostructure surfaces [21,22]. Despite these advantages, amorphous 2D nanomaterials often suffer from active-site deficits that are caused by irreversible restacking of individual nanosheets, which inhibit ion storage and transport [22]. Incorporating metallic p-type holes in the p/n heterojunction interfaces of NiO / NG (2D / 2D) nanostructures can induce electrical conductivity. Such holes can be achieved by overcoming nanosheet aggregation [23]. Experimental results demonstrate that iron oxide (Fe2O3) serves multiple purposes, including modifying catalyst electronic structure to enhance electrocatalysis. Fe2O3 strongly increases the metallic character of nanostructures by shifting Fe 3d states towards the Fermi level. Furthermore, Fe2O3 improves the redox activity of the catalyst surface, which causes changes in active sites. This allows thermodynamically favorable oxygen adsorption on catalyst surfaces and lowers pertinent activation energies of oxygen adsorption [24]. Finally, the synergistic effects of hybridizing 2D NiO with Fe2O3 nanocrystals (NCs) are expected to develop highly active catalysts, which will deliver high rate capability and good recyclability. This article presents a simple two-step strategy to synthesize mesoporous Fe2O3@NiO-layered NG (Fe2O3@NiO / NG) hybrids as active catalysts for ORR. Given the combined advantages of ultrathin and defect-rich surfaces comprised of 2D nanosheets (NiO and NG) and porous Fe2O3 NCs, optimized Fe2O3@NiO / NG hybrids exhibit remarkably high ORR activity and stability in alkaline media. Furthermore, oxygen vacancies are more easily formed in Fe2O3@NiO / NG hybrid catalysts than in isolated 2D nanosheets, thus vacancies strongly enhance catalytic activity. Thereby, varying oxygen binding energies synergistically improves catalyst activity in association with Fe2O3 NCs, and accelerates catalytic charge transfer during ORR. By combining theoretical calculations with experimental studies, this work illuminates how atomic-scale defect engineering promotes electrocatalytic activity. This study also provides a way to design advanced electrocatalysts that have stable ORR performance. 2 Experimental 2.1 Chemical reagents Graphite flake (<∼20 μm, synthetic), sulfuric acid (H2SO4, 99%), potassium permanganate (KMnO4, ≥∼99%), hydrogen peroxide (H2O2, ∼30%), hydrochloric acid (HCl, ∼35%), melamine (C3H6N6, >99.9%), ferric (ΙΙΙ) chloride hexahydrate (FeCl3·6H2O, >99.9%), nickel (ΙΙ) chloride hexahydrate (NiCl2·6H2O, >99.9%), ammonium hydroxide (NH4OH, 28.0% NH3 in H2O), and Nafion (0.05 wt. %) solutions were all purchased from Sigma-Aldrich. Potassium hydroxide (KOH, ≥∼99.5%), ethanol (EtOH, ≥∼99.9%), methanol (MeOH, ≥∼99.9%), and carbon supported platinum (Pt/C, 20 wt.%) were received from Samchun Chemical Co. Ltd. (South Korea). Deionized (DI) water was distilled using a Steel Ace (SA-2100E1) filtering system from EYELA (Tokyo Rikakikai Co., Ltd., Japan). 2.2 Synthesis of graphene oxide (GO) and N-doped graphene (NG) Graphene oxide (GO) has been synthesized by Hummer’s method [25], as described in previous literature. To prepare NG, 50 mg of GO was first dispersed in 50 mL of DI water and ultrasonicated for 50 min. To the above highly dispersed GO solution, 250 mg of melamine was added and then stirred at 80 °C for 12 h. Then, the well mixed solution was dried completely and the obtained powder was finely grinded. Therefore, this fine powder was used for high temperature pyrolysis at 900 °C for 1 h under Ar gas flow to get NG nanosheets. 2.3 Synthesis of porous Fe2O3@NiO-layered NG (Fe2O3@NiO / NG) hybrids Porous hybrids of Fe2O3 enveloped in 2D NiO heterostructures (Fe2O3@NiO), which are wrapped in layered NG supports (Fe2O3@NiO / NG), were synthesized via an alkalization-assisted hydrothermal method followed by calcination. Synthesis proceeded firstly by mixing 1 mmol Ni salt and 2 mmol Fe salt in a dispersed NG solution, maintaining a suitable alkaline pH condition with sodium hydroxide (NaOH) addition. This homogenous solution was subjected to alkalization at ∼100 °C via a hydrothermal reaction with an ethanol and water mixture for 12 h. The result of alkalization was cooled down, washed, and neutralized by centrifugation with water and subsequently dried. The obtained powder was pyrolyzed for 3 h at ∼400–600 °C by varying temperature under an inert (Ar) atmosphere, and then cooled down to room temperature. The Fe2O3@NiO heterostructure without its support material (NG) was also prepared at ∼400 °C under similar experimental conditions for comparative purposes. Finally, each sample was collected and chemically leached into 0.5 M H2SO4 solution at ∼80 °C for 10 h, which removed unnecessary metallic reactants and impurities. Filtration ensued by repeated centrifugation with DI water, followed by drying at 60 °C under vacuum conditions. Following this procedure, the active studied ORR catalyst, or a porous Fe2O3@NiO-layered NG hybrid (Fe2O3@NiO / NG), was yielded. 2.4 Material characterization The morphological and structural characteristics of materials were investigated using field-emission scanning electron microscopy (FE-SEM) and energy-dispersive X-ray spectroscopy (EDS) through a Supra 40 VP instrument (JEOL, JSM-7800F, FESEM-EDS). Transmission electron microscopy (TEM) and high-resolution TEM (HR-TEM) were carried out to examine the structures of materials in detail (JEOL, JEM-2200FS, HRTEM). X-ray diffraction (XRD) analysis was used to identify crystalline structures and chemical components using a D/Max 2500 V/PC (Rigaku Co., Japan) within a given 2θ range (10°–90°), and with Cu K α radiation (λ = 0.154 nm). The elemental compositions of catalysts were analyzed by inductively coupled plasma-atomic emission spectroscopy (ICP-AES, Optima 8300; PerkinElmer Inc.). Using a thermal conductivity detector (BELJapanInc., BELCAT-M), H2-temperature programmed reduction (H2-TPR) was completed to measure the temperature and intensity of H2 consumption throughout conversion to H2O during reactions with lattice oxygen from surfaces. 20 mg of catalyst was used, and the pretreatment was conducted at 120 °C for 1 h under Ar flow. The content was then cooled to RT. From 30 to 900 °C, the temperature was increased at a rate of 10 °C min−1 while a 10% H2/Ar flow was maintained. The elemental compositions and valence states of elements on the surfaces of materials were observed using a High-Performance X-ray Photoelectron Spectrometer (HP-XPS). The specific surface areas of materials were measured by N2 adsorption at −196 °C, namely via the Brunauer–Emmett–Teller method performed on a volumetric gas adsorption analyzer (BEL Japan Inc., BELSORP-mini II). Analysis of catalyst structure was completed via Raman spectroscopy (inVia Reflex, Renishaw), applying an instrumental measurement range of 200–3000 cm−1, a 532 nm laser, and a 0.5 cm−1 resolution. 2.5 Electrochemical characterization An electrochemical materials study was performed via a combined three-electrode cell system, consisting of a potentiostat (Autolab PGSTAT302N, Metrohm AG), a working electrode comprised of a studied catalyst, a glassy carbon counter electrode, and an Ag/AgCl reference electrode. Prior to use, the glassy carbon surfaces of rotating disk electrodes (surface area = 0.071 cm2) were mechanically polished by alumina slurries to reduce their thicknesses (from 0.5–0.7 μm to 0.03–0.05 μm), yielding mirror-like interfaces. Such surfaces were then washed with mixed ethanol and water solvents, and were finally dried at room temperature. For catalyst ink preparation, 2.5 mg of catalysts were dispersed in a water and ethanol mixture (4:1) with drops (5 µL) of 0.5 wt.% Nafion (Sigma-Aldrich) solution. This was done by continuous sonication, forming a homogeneous ink solution. Next, 5 μL of ink was dropped onto a working electrode surface and dried in air. Prior to starting ORR measurements, the electrode was cleaned for 30 min by electrolyte saturation in a N2 atmosphere. Then, CV voltammograms were taken of yielded catalysts in an O2-saturated electrolyte, which are compared with corresponding commercial 20 wt.% Pt/C catalyst reference measurements. All CV measurements and linear sweep voltammetry (LSV) curves were respectively recorded at scan rates of 50 and 10 mV s−1 in 0.1 M KOH solution. Preceding each ORR test, O2 was purged from KOH electrolytes for at least 30 min. The number of electrons transferred during ORR was deduced from LSVs over varying rotation speeds (400–2400 r min−1), namely within an operating potential window from −0.8 to +0.2 V. The stabilities and methanol tolerances of studied catalysts were examined at an applied potential of ∼0.66 V by chronoamperometric measurements under an O2 atmosphere, following the US Department of Energy protocol. Electron transfer number (n) values were calculated using the Koutecky–Levich (K-L) equations (Eqs. (1) and (2)) [26]. (1) 1 J = 1 J L + 1 J K = 1 J K + 1 B ω 1 / 2 (2) B = 0.2 n F C O 2 D o 2 2 / 3 V - γ / 6 J represents current density (mA cm−2), J L denotes diffusion-limiting current density (mA cm−2), J K signifies kinetic current density (mA cm−2), F stands for the Faraday constant (96,485 C mol−1), C O2 is dissolved O2 concentration (1.2 × 10−6 mol cm−3), D O2 signifies the diffusion coefficient of O2 gas (1.9 × 10−5 cm2 s−1), and V stands for the kinetic viscosity of the 0.1 M KOH solution (0.01 cm2 s−1). Expressing the angular velocity (ω) of the rotating disk (working) electrode in revolutions per minute (r min−1), a Levich constant (B) of ∼0.2 was calculated. All potentials were referenced to the reversible hydrogen electrode (RHE) potential (E RHE), such that the pH conversion equation of an electrolyte potential (E Ag/AgCl) in alkaline solution – namely relative to its respective reference electrode (E 0 Ag/AgCl) – is Eq. (3). (3) E R H E = E A g / A g C l + 0.059 ( pH ) + E A g / A g C l o , w i t h E A g / A g C l o = 0.1976 V a t 25 ° C Rotating ring disk electrode (RRDE) measurements were performed to determine H2O2 yields and electron transfer numbers (n) at a scan rate of 10 mV s−1 at 1600 r min−1. The yield of H2O2 product and n were calculated by the following equations, respectively. Note that I D is disk current, I R is ring current, and N is current collection efficiency (0.4) of the Pt ring (Eqs. (4) and (5)). (4) H 2 O 2 % = 200 × I R / N I D + I R / N (5) n = 4 × I D I D + I R / N 3 Results and discussion 3.1 Morphological and structural characterization Here, we demonstrate efficiently-stabilized heterostructures composed of 2D / 2D-coupled layers of NiO and mesoporous NG nanosheets (Fig. S1). These layered structures induce growth of nano-sized Fe2O3. Such layering accounts for enriched surface defect sites, which uniquely link mesostructure with microstructure in a Fe2O3@NiO / NG catalyst. Field-emission scanning electron microscopy (FE-SEM) revealed crumpled NG conformations, composed of wrinkled sites and edges, were caused by folded surfaces. Such conformations provide suitable defect sites from the greater N-doping of graphene backbones relative to pristine graphene oxide (GO) sheets without impurities (Fig. S2a–d). Scheme 1 illustrates a 2D / 2D mesoporous network of NG-coupled NiO nanosheets, supported by shelled and holey Fe2O3 NCs (Fe2O3@NiO / NG). These catalysts are synthesized by initial hydrothermal alkalization followed by annealing and further chemical-etching treatments (Supplementary Information: Experimental Methods and Scheme 1). Homogeneous alkalization of Ni(II) and Fe(II) solutions at low temperature can promote adsorption of iron and nickel (Ni x +, Fe x +, x ∈ (2, 3)) ions on NG surfaces. Generally, hydrothermal reactions at high pressures activate reactant species at super-saturation points. This activation leads to instantaneous formation of ultrafine Ni and Fe reaction intermediates. Both kinetic and thermodynamic factors favor metal (Ni, Fe) hydroxide formation as dominant reaction intermediates [27,28] during such hydrothermal alkalization reactions (Figs. S3 and S4, Eqs. (6) and (7)). (6) N a O H → N a + + O H - (7) M 2 + + 2 O H - → M ( O H ) 2 M = N i , F e Ni(OH)2 / Fe(OH)2 NCs, in conjunction with NG nanosheets, spontaneously self-assemble to form layered structures. This process occurs as a result of the synergistic effects of their chemical interconnections, as is reinforced by oriented attachment kinetics [28,29]. The 2D anisotropic growth of Ni(OH)2 nanosheets encourages the accumulation of nanostructures in alkaline media. Given their intrinsic lamellar properties [1], such nanostructures have gauze-like morphologies (Fig. S4). Finally, calcination at 400 °C yields complete decomposition of Ni(OH)2 to consistent sheet-like NiO nanostructures [Ni(OH)2 → NiO + H2O] [1]. Therefore, a stable mesoporous 2D / 2D heterostructure (Fig. 1 a and Fig. S5) is obtained without damaged or broken components, even after annealing. Mesoporous carbon layers were homogenously immobilized on the heterojunction interfaces of NiO / NG layers, as confirmed by the uniform distributions of Ni, C, N, and O elements (Fig. S5d–h). These ultrathin micron-sized nanosheets were uniformly arranged in various orientations. However, some of these nanosheets are comprised of rough surfaces, possibly as a result of grain boundaries and surface defects (Fig. S5a–c). Such defect structures could improve interfacial porosity by accretion of holey Fe2O3 NCs in the edges of NiO / NG matrices. The existence of Fe2O3 NCs within layered heterojunction interfaces of NiO / NG nanosheets could overcome the irreversible restacking of individual nanosheets. This claim is supported by the observed strong attachment of Fe2O3 NCs within the layered heterosurfaces of NiO / NG nanosheets by electrostatic and coordination interactions (Fig. S6a–c). Previous literature indicates that point defects on supportive surfaces are bonded to various metal oxides, and bind catalytically active adsorbates by metal-adsorbate electrostatic interactions. The strength of such binding can be controlled by the effect of oxidation state on metal coordination [24,30]. Such defect engineering can be generalized to the currently studied Fe2O3@NiO / NG, namely through modifying effective oxidation states of catalytically active metals by adjusting Fe/Ni ratios of relevant structures (later shown through XRD results). FESEM images depict the growth of Fe2O3 NCs on NiO / NG layered interfaces (Fig. 1b and c and Fig. S6a–c), and how they develop efficient porous hybrids of NG-coupled 2D NiO-shelled holey Fe2O3 NCs (Fe2O3@Ni / NG) for active catalysts. Fig. 1(d) illustrates the structure of Fe2O3@NiO / NG, wherein Fe2O3 NCs were shelled by 2D / 2D mesoporous networks of NG-coupled NiO nanosheets. Although our simulation models are not exactly the same as TEM images due to the computational costs, it is enough to explain the effect of heterojunction structures of NiO / NG and Fe2O3 / NiO on the ORR electrocatalytic performance, which was observed in our TEM images. Across the complete heterostructure morphology, both supports (NiO and NG) are strongly induced to improve hierarchical porous architectures via interconnected NiO and NG layers. FE-SEM images show that Fe2O3 NCs have diameters of 20–25 nm (Fig. 1c, inset) and may effectively prevent nanosheet aggregation. Remarkably, prominent wrinkles span entire Fe2O3@NiO / NG nanostructure surfaces; this may be due to effective strain, which produces wrinkles to resist compression. The energy-dispersive X-ray spectroscopy (EDX) elemental analysis of Fe2O3@NiO / NG hybrids was determined to have an approximate 1.66/1 final weight ratio of Fe/Ni after acid leaching (Fig. 1e). This analysis identified significant losses of impurities, possibly because of acid treatment (Fig. S7). The atomic ratio of Fe/Ni was determined to be about 2/1 from the results of ICP-AES analyses (Table S1), which is in good agreement with X-ray photoelectron spectroscopy (XPS) outcomes (detailed study in XPS analysis; Table S2). This synthesis step strongly increases catalytic activity by minimizing impurity effects. Therefore, the unstacked 2D frameworks (NiO / NG) of Fe2O3@NiO / NG hybrids can feature high micropore and mesopore densities with good dispersity [4,28]. Such pores are largely located on nanosheet surface edges, and within the interiors of nanosheets wrapped around Fe2O3. Concurrently, oxygen defects were evidenced (Fig. S8 ) via H2-TPR, and further explained in XPS spectra, by introducing the Fe2O3 and NiO nanostructures on NG support basal planes. This results in higher oxygen vacancies within Fe2O3@NiO / NG hybrids [21,31]. Elemental color mappings (Fig. S9) also reveal the homogenous distributions of C, N, O, Ni, and Fe in Fe2O3@NiO / NG hybrids. Thus, defect-enriched mesoporous heterostructures of NG-coupled, NiO-encapsulated holey Fe2O3 (Fe2O3@NiO / NG) can maximize active site concentrations. This maximization occurs by active site exposure on the unique basal planes of 2D / 2D matrices [21,32], which are encompassed by Fe2O3 NCs. The structural evolution of the synthesized hybrids was confirmed by X-ray diffraction (XRD) spectra. The α-Fe2O3 crystal phases in Fe2O3 / NG hybrids (Fig. 1f) yield XRD 2θ peaks at ∼33.0°, ∼35.5°, ∼40.8°, and ∼43.5°. These respectively correspond to (104), (110), (113) and (202) diffraction planes [33,34]. During Fe2O3@NiO / NG hybrid synthesis, calcination is mainly responsible for the formation of the most dominant iron oxide (Fe2O3) α-phase (JCPDS No. 33‐0664) [33,35] of studied bimetallic oxides (Fe2O3@NiO), converting metal hydroxides to metal oxides (Fig. 1f and Fig. S3). The dominance of such conversion is ensured by significant resistance of Fe species to acidic corrosion [36]. In Fe2O3@NiO / NG hybrids (Fig. 1e), NiO (Ni2+) integration into Fe2O3 crystals does not alter crystal faceting. The similar atomic radii of Fe3+ and Ni2+ ions preclude lattice mismatch, thus resulting in interfacial faceting [9,13]. Fe2O3@NiO / NG hybrids exhibit stronger and sharper peaks than Fe2O3 / NG hybrids; this difference suggests the presence of NiO-assembled Fe2O3 (Fe2O3@NiO) heterostructures, which are more crystalline than Fe2O3 / NG. Therefore, Fe2O3@NiO heterostructures in Fe2O3@NiO / NG hybrids may be developed by homogeneous confinement of Fe2O3 within the shells of NiO layers (further explained in TEM analysis), namely as a consequence of the chemical instability of Ni-based impurities in acidic environments [37]. This development of heterostructures increases the number of pores in Fe2O3@NiO / NG hybrids, as verified by EDS analysis. Therefore, acid leaching might induce the formation of surface pores in nanostructures [13]. Surface defects that develop in the Fe2O3@NiO / NG hybrids can include oxygen vacancies (Fig. S8), as well as interstitial oxygen defects. The NiO (012) and Fe2O3 (202) lattice peaks coincide in the Fe2O3@NiO / NG hybrid (Fig. 1f). However, HR-TEM analysis (Fig. 2 ) clearly confirms the existence of distinct (012) NiO planes [33], which are represented by a lattice spacing d spacing = 0.21 nm [38,39]. Further, the existence of (002) carbon planes [36] confirms the presence of NG nanosheets in Fe2O3@NiO / NG, Fe2O3 / NG, and NiO / NG hybrids (Fig. 1f). Additionally, possible interactions between NG and NiO layers in Fe2O3@NiO / NG hybrids are implied by a leftward shift in their (002) crystal planes (∼25.1°) relative to corresponding (002) NG carbon planes (26.3°), corresponding to elongation of C–C d spacing to 0.354 nm (Fig. 1f and Fig. S10a). Such elongation is accompanied by crystalline Fe2O3 encapsulation in layer-by-layer hybridized nanosheets (NG and NiO / NG). Thereby, Fe2O3 NCs act as strong bridging media that connect with NiO nanosheets and coupled NG supports, constructing porous nanoarchitectures of metal oxides with robust conductive networks of sandwich-like nanosheet (NG / Fe2O3 / NiO) nanostructures [40,41]. These heterostructures have great potential for electrochemical applications. At temperatures >400 °C, Fe2O3@NiO nanostructures are controllably converted to NiFe alloy phases (Fig. S10b). This transition is ascribed to the evolution of excessive gaseous moieties (H2, CO2, and CO) during pyrolysis, which promotes the structural conversion of bimetallic oxides (Fe2O3@NiO) to NiFe alloy nanostructures [42]. Therefore, NiFe-NG alloy nanostructures might lose surface area due to the absence of 2D/2D (NiO / NG) interactions [13,30,34]. Comparative XRD analyses of other hybrids that feature different Ni/Fe ratios confirmed the suitability of the optimal Fe:Ni precursor composition ratio (2:1, Fe2Ni1) for Fe2O3@NiO / NG hybrid catalysts (Fig. 1f and Fig. S10c). Thus, the Fe2O3@NiO / NG hybrid is an efficient catalyst due to the strong ionic interactions between its Ni+2 (NiO) and Fe3+ (Fe2O3) ions. NiO interaction with Fe2O3 crystal defect sites can shift Fe2O3@NiO / NG electronic bands towards their band gaps. Such shifts improve localized metallic bond character by increasing conduction-valence band overlap and decreasing bandgap [43,44], thereby increasing electrical conductivity of the Fe2O3@NiO / NG heterostructure. TEM and HR-TEM analyses were performed to characterize the 2D porous structures of NiO / NG hybrids (Fig. 2a–c and Fig. S11). Ultrathin 2D NiO layered surfaces are uniformly enveloped by NG layers within large domains [38,45] to yield multilayered mesoporous architectures (Fig. 2a and Fig. S11a–d). Thus, in situ grown NiO nanosheets, which are each several nanometers thick (∼4–8 nm) (Fig. S11c and d), contain numerous mesopores (Fig. S11e and f). Entire NG-layered NiO complexes are composed of well-organized layered constructions, which consist of distinct graphene sheets with mesoporous NiO layers. Aligned NiO nanosheets are uniformly dispersed on smooth 2D NG interfaces (Fig. S12). This dispersion develops layered 2D / 2D (NiO / NG) porous architectures (Fig. 2a–c). HR-TEM images confirm that the interplanar spacing of such NiO layers (d spacing ∼ 0.21 nm) corresponds to the (012) plane. Such layers overlap with lattice-compressed (002) NG carbon planes (d spacing ∼ 0.34 nm) due to the effective interactions between NiO and NG nanosheets (Fig. 2b and c). Consequently, numerous Fe2O3 NCs (∼25 nm) grow on the interfacial junctions of NiO and NG nanosheet surfaces, resulting in layer-by-layer heterostructures (Fig. 2d–k and Fig. S13). These structures possess elongated d spacing (∼0.354 nm) along their (002) carbon planes relative to NiO d spacing values (0.21 nm). Porous Fe2O3@NiO heterostructures are developed by fastening such NCs to these junctions via strong coupling interactions involving NiO and holey Fe2O3 (Figs. S14 and S15). Additional NG matrix interactions ultimately yield highly-stabilized mesoporous Fe2O3@NiO / NG hybrids (Fig. 2d and e). HR-TEM images of Fe2O3@NiO / NG hybrids depict holey structured Fe2O3 NCs (Fig. 2e) that are adequately wrapped by NG-layered NiO nanosheet surfaces, and confirm the presence of several mesopores (∼2–3 nm) in Fe2O3 NCs (Fig. 2f). The inset of Fig. 2(e) also reveals that porous NG and NiO nanosheets combine with perfect holey Fe2O3 NCs; this process yields efficient mesoporous hybrids by forming Fe2O3 NCs encased in suitably-aligned NG and NiO layers. Corresponding d spacing values of ∼0.25 nm and 0.38 nm refer respectively to the (110) and (012) lattice planes of Fe2O3 within them [46]. Selected area electron diffraction (SAED) patterns illustrate the intersection of NG and NiO shells by highlighting their (002) (d spacing ∼ 0.354 nm) carbon planes and the (012) (d spacing ∼ 0.21 nm) lattice planes of adjacent NiO (inset of Fig. 2g and h). Therefore, each NG and NiO nanosheet undergoes persistent interfacial growth involving effective attachment with Fe2O3. Such growth is facilitated by increasing the inter-planar C–C spacing (NG) of Fe2O3@NiO / NG hybrids. Calcination and acid leaching effectively remove metallic impurities from hybrids, creating a number of holes to generate holey Fe2O3 NCs [47]. Such procedures construct mesoporous core–shell heterostructures (Fe2O3@NiO / NG). Furthermore, the detection of (113) (d spacing ∼ 0.22 nm) and (014) (d spacing ∼ 0.27 nm) crystal planes of Fe2O3 (Fig. 2j and k) demonstrates successful NC encapsulation by NG (d spacing ∼ 0.354 nm) layers. This conclusion is also supported by their corresponding SAED patterns (Fig. 2j and k insets). EDS line-maps clearly demonstrate uniform dispersions of Fe2O3 over the surfaces of NG and NiO nanosheets (Fig. 2l). Corresponding elemental color mappings of Fe2O3@NiO / NG hybrids were assessed by annular dark field – scanning transmission electron microscopy – energy dispersive X-ray spectroscopy (ADF-STEM-EDS). These results also reveal significant trapping of Fe2O3 NCs within the shells of combined supports (NG and NiO nanosheets) (Figs. S13 and Fig. S16). These observations further confirm the homogeneous distributions of Fe, O, Ni, C, and N (Fig. 2m–r) elements over entire core–shell heterostructures of Fe2O3@NiO / NG hybrids. Core-shell morphologies can greatly improve NiO nanosheet electrical conductivity by ensuring close attachment with NG nanosheets [48]. These morphologies can also increase the hydrophilicity of entire nanostructures by wrapping nanosheets around Fe2O3. This wrapping resultantly reinforces O-O bond polarity [49,50], which significantly influences ORR activity. Therefore, Fe2O3@NiO / NG core–shell hybrids achieve ultra-fast electronic charge transfer by reducing the length of ionic diffusion pathways. Such pathways are networked with specially coupled 2D / 2D (NG / NiO) heterostructure interfaces, which increase electrochemical activity [40]. Raman spectroscopy was used to investigate interfacial structural disorder by exploiting localized surface stress differentials of carbon-based nanostructures to distinguish bonding types (Fig. 3 a). The Fe2O3@NiO / NG hybrid showed prominent Raman peaks in the elastic modes of the D band (∼1355 cm−1), G band (∼1579 cm−1), 2D band (∼2709 cm−1), and D + G band (∼2917 cm−1) [4,5]. The D band represents disordered sp 3 bonding phases with defective sites, and the G band represents sp 2-hybridized graphitic carbons. The 2D (∼2709 cm−1) and D + G (∼2917 cm−1) bands are linked to the effective conversion of GO to NG [31]. These results are evidence for increases in defect densities. Ratios of the D band intensity (I D) to G band intensity (I G) quantify the number of large defect densities with disordered graphitic sites. NG had the highest I D / I G ratio (∼1.13) of all compared structures (Fig. 3a); this result suggests more structural defects were introduced into its graphitic network. In contrast, integrating NiO and Fe2O3 into NG networks lowers the I D/I G ratios of Fe2O3 / NG (to 1.09) and NiO / NG (to 1.11); these changes indicate the improvement of structural order. NiO incorporation into Fe2O3 / NG nanostructures induces strong bonding across Fe2O3@NiO heterostructures, and improves structural order in Fe2O3@NiO / NG hybrids (I D/I G ∼ 1.08), compared to the more-defective Fe2O3 / NG (I D/I G = 1.09) and NiO/NG (I D / I G ∼ 1.11) hybrids. Structurally-ordered Fe2O3@NiO / NG hybrids have large concentrations of oxygen vacancies and other defects [3,7] (Fig. S8), which may increase the number of catalytic ORR sites. G band shifting also confirms strong interactions between NG nanosheets and Fe2O3-NiO heterostructures (Fig. S17). Moreover, the nanostructures studied have additional Raman peaks ranging from ∼300 to ∼800 cm−1 (Fig. 3a, inset). A 1g and F 2g vibrational modes, which correspond to M−O (Fe−O and Ni−O) symmetric and asymmetric stretching bonds, are assigned to peaks at ∼654 and ∼450 cm−1, respectively. Asymmetric metal oxygen bending is linked to the peak at ∼316 cm−1 [50,51]. These peaks result from strong coupling interactions between Fe2O3 and NiO nanostructures of Fe2O3@NiO / NG hybrids, and are consistent with XRD and HR-TEM results. N2 adsorption–desorption isotherm (ADI) tests were conducted to confirm the porous structures of as-synthesized hybrids (Fig. 3b). Atomically ultrathin features of NG-layered NiO nanosheets and Fe2O3 NCs (Fe2O3@NiO / NG) contain holes, which can facilitate mass transport of reactants [14,47]. Mesoporous structures were revealed by N2-ADI curves, which display hysteresis loops characteristic of type IV isotherms. Fe2O3@NiO / NG hybrids contain abundant mesopores with diameters of ∼2–50 nm. High specific surface areas (SSAs) of Fe2O3@NiO / NG hybrids (∼190.12 m2 g−1) are obtained due to the interconnected holey Fe2O3 NCs between consecutive porous 2D nanosheets (NiO / NG: ∼150 m2 g−1). Nano-sized, holey Fe2O3 NCs act as bridges between NG and NiO nanosheets by interfacial bonds, which separate NiO and NG enough to inhibit self-agglomeration (Fe2O3 / NG: ∼102 m2 g−1; NG: 80 m2 g−1). This bonding greatly increases the SSAs of porous Fe2O3@NiO / NG nanostructures [47] and gives them excellent catalytic activity. X-ray photoelectron spectroscopy (XPS) was performed to identify how the different elemental components of as-prepared catalysts affect their electronic structural features. These components encompass variations in the elemental valence states of surface atoms. XPS analysis of Fe2O3@NiO / NG hybrids (Fig. S18) demonstrates the presence of Fe (2p), Ni (2p), N (1s), O (1s), and C (1s) elements with corresponding core level spectra (Fig. 3c–f and Fig. S19). The Fe 2p XPS spectrum (Fig. 3c) has major peaks at ∼710 and ∼723.8 eV, which result from spin − orbital interactions involving Fe 2p 3/2 and Fe 2p 1/2 doublets, respectively. The deconvoluted Fe 2p 3/2 core-level spectrum (Fig. 3c) shows satellite features of Fe3+ and Fe2+ cations. These features are located at ∼713.4, ∼710.2, and ∼717.1 eV. Another peak at ∼723.8 eV is assigned to Fe 2p 1/2 orbitals, which is ascribed to Fe3+ cations [46]. The synergistic interaction between Fe and Ni oxides produces a downward shift (∼0.30 eV) in binding energy peaks (Fig. 3c). Therefore, the charge transfer between Fe2O3 and NiO in Fe2O3@NiO-NG hybrids can modify the electronic states of Fe surfaces [13]. This phenomenon may account for high ORR activity and durability. Fig. 3(d) displays deconvoluted Ni 2p spectral doublets separated by ∼17.6 eV, which represent Ni 2p 3/2 and Ni 2p 1/2 satellite peaks. Deconvoluted subset peaks of the Ni 2p 3/2 core–shell spectrum portray the coexistence of metallic Ni and Ni2+/Ni3+ oxidized moieties for both NiO-NG and Fe2O3@NiO-NG hybrids. Two additional peaks connected to Ni3+ (∼872.5 eV) and Ni2+ (∼876.8 eV) valence states can be attributed to Ni 2p 1/2 spin–orbit coupling [7]. Binding energy shifts in Ni 2p spin orbits also correlate with strong synergistic interactions [48], which exist between Fe2O3 and NiO crystals in Fe2O3@NiO-NG hybrids. Successful introduction of N atoms into the carbon backbones of graphitic matrices was confirmed by XPS study (Fig. 3e). High-resolution, multimodal N 1s spectra can be classified by the variously-coordinated N atoms that they represent [4,5]. These configurations include pyridinic N-oxides (at ∼402.4 eV for N), graphitic N (at ∼400.8 eV for N2), pyrrolic N (at ∼399.5 eV for N3), and pyridinic N (at ∼398.1 eV for N4). These different N-moieties critically affect the increase in ORR activity. The core level O 1s spectra of Fe2O3@NiO / NG (Fig. 3f) depict three peaks typical of M−O bonds. The peaks (Fig. 3f) are assigned to lattice oxygen (O2−, ∼530.1 eV), defect sites or oxygen vacancies (∼531.5 eV), and surface-adsorbed oxygen (∼533.1 eV). Thus, Fe2O3@NiO / NG hybrids provide high ratios of lattice oxygen to oxygen vacancies, which create additional lattice defects in nanostructures as a consequence [52]. This observation is supported by Raman (Fig. 3a) and TPR studies (Fig. S8), and such results might be responsible for promoting oxygen adsorption and desorption reactions. High-resolution C 1s spectra (Fig. S19a) demonstrate five deconvoluted peaks linked to C=C (∼284.5 eV), C−N (∼285.6 eV), C−O−C (∼286.8 eV), C=O (∼287.9 eV), and COO (∼289 eV) bonds [6]. N doping concentrations in the graphene sheets of Fe2O3@NiO / NG hybrid catalysts were ∼6.2% (Table S2). Therefore, N doping could significantly contribute to improving catalytic activity during oxygen reduction. 3.2 Electrocatalytic activity ORR activities of studied catalysts were evaluated by drop-casting procedures, placing catalysts on working electrode surfaces at loadings of ∼0.65 mg cm−2. Three-electrode-system cyclic voltammetry (CV) and LSV (Fig. 4 ) of the catalysts were measured in O2-saturated 0.1 M KOH solutions. The ORR activities of monometallic oxides (NiO and Fe2O3) embedded in NG (NiO / NG, Fe2O3 / NG) were evaluated to compare the effectiveness of the 2D / 2D NG–coupled bimetallic NiO shelled (2D / 2D) holey Fe2O3 (Fe2O3@NiO / NG). Comparison of CV curves in Ar and O2-saturated alkaline solutions (Fig. S20) reveals distinct ORR cathodic peaks for all studied oxide structures [4]. These peaks represent electrochemical reduction processes at interfaces. The best ORR activity was obtained using a particularly composed Fe2O3@NiO / NG hybrid (Fe2Ni1) at an optimized temperature (400 °C) (Fig. S21), as confirmed by its strong and positive oxygen electrochemical reduction peak at 0.80 V (vs. RHE) (Fig. S20). Adding monometallic (Ni, Fe) or bimetallic (Fe2O3@NiO) oxides to isolated NG increases its ORR activity, and improves its other material characteristics related to catalysis [5] (Fig. 4a and b and Fig. S20 and S21). Catalyst ORR polarization and voltammetric potential curves (Fig. 4a) corroborate the superior onset potential (0.96 V vs. RHE) and half-wave potential (0.83 V vs. RHE) results for Fe2O3@NiO / NG hybrids (Fig. 4b). The high catalytic activity of Fe2O3@NiO / NG hybrid is further examined by electrochemical impedance spectroscopy (EIS) spectra (Fig. S22), which shows a smaller R ct value (∼84.6 Ω) for Fe2O3@NiO / NG hybrid than for NiO / NG (∼115.7 Ω) hybrid and Fe2O3 / NG hybrid catalysts (∼148.6 Ω). Fe2O3@NiO / NG features several attributes that are advantageous to ORR catalysis. Brunauer, Emmett and Teller (BET) surface-area analysis (Fig. 3b) confirmed that the NiO and NG components of Fe2O3@NiO / NG hybrids strengthen interactions between reactants and surfaces. This effect is a result of the increase of component SSAs from 2D/2D combination, specifically from ∼80 m2 g−1 for isolated NG to 150 m2 g−1 for NiO / NG hybrids. The electronic structures of studied catalyst surfaces are modified by introducing holey Fe2O3, leading to favorable oxygen adsorption. Such favorability is enabled by exposing highly active sites and promoting synergistic interactions between bimetallic oxides and NG supports [21,22]. Tafel plots (Fig. 4c and Fig. S23) confirm the relatively strong ORR activity of Fe2O3@NiO / NG hybrids, and their higher electron transfer, larger intrinsic activity, and faster ORR kinetics than other studied catalysts. These plots also indicate that high coverage of reaction intermediates on catalyst surfaces reduces ORR reaction rates by diminishing the exchange of surface oxygen with oxygen from reactants [17]. The Fe2O3@NiO / NG hybrid had a lower apparent Tafel slope than Pt/C. This difference serves as evidence of facile reaction kinetics of such oxygen exchange reactions, namely due to increasing oxygen vacancy (VO) concentration ([VO]) in Fe2O3@NiO / NG hybrids. This improved [VO] can be attributed to the increase in active site densities [3,18]. This enhancement results from the increased graphitization in NG supports bearing Fe2O3@NiO / NG nanostructures, as well as improved Fe2O3@NiO interactions. Usually, Ni and Fe have slightly higher effective atomic charge magnitudes on pristine surfaces than on defective surfaces. This difference implies that removal of oxygen induces charge accumulation around resulting VO defects [18]. Such accumulation improves the ORR catalytic activity of Fe2O3@NiO / NG, specifically compared to monometallic (Fe2O3 and NiO) surfaces that have lower [VO] [3]. VO formation also results in charge transfer from Fe to Ni. This transfer improves catalytic activity and efficiency [13]. Nevertheless, Fe in Fe2O3@NiO / NG that is responsible for such transfer remains within the cores of studied nanostructures. Maintaining this location enables Fe to enhance the ORR, likely due to the strengthening of Fe-Ni binding throughout ORR redox cycles [20,24,53]. This hypothesis was evaluated by comparing the CV scans of differently controlled Fe2O3@NiO / NG catalysts, all of which were designed to vary over Fe / Ni ratios and temperatures (Fig. S21). Improvement in Fe content increased the bifunctional activity up to a Fe/Ni ratio of 2:1, after which such ORR activity decreased. Therefore, when bimetallic oxide interactions (Fe2O3@NiO) are tuned to optimize core − shell activity, the metal catalyst composition must be considered [13,54]. Furthermore, as Fe concentrations increased, the particle size enlarged and led to particle agglomeration on 2D / 2D (NiO / NG) coupled surfaces. The enlarged particle size and agglomeration also likely reduced nanostructure surface area, and thereby decreased bifunctional ORR activity [36]; this response accounts for the optimized 2:1 Fe/Ni ratio. XRD and HR-TEM analyses (Figs. 1f and 2g–k) showed the distinct separation of various Fe2O3 crystal phases on NiO / NG interfaces. Therefore, nanostructure separation is correlated with increased catalytic performance, and this relationship can be utilized to design Fe2O3@NiO / NG structures with activity matching or superseding that of leading engineered ORR electrocatalysts (Fig. 4c). Rotating-disk voltammetry (RDV) evaluating electrocatalytic ORR kinetic parameters was conducted at a scan rate of 5 mV s−1 and rotation speeds of 400–2400 r min−1 (Fig. 4d and Fig. S24). Within this experimental range, two distinct kinetic regimes were discernable over potential domains. Current density increased from 4.00 to 7.11 mA cm−2 as rotating disk speed was increased from 400 to 2400 r min−1 (Fig. 4d and Fig. S24), which is within the current and thus diffusion-limited regime. A corresponding Fe2O3@NiO / NG hybrid K-L plot (Fig. 4e) confirmed a first-order reaction for O2 dissolution. This K-L plot also shows that increasing rotation speeds elevated oxygen flux towards electrode surfaces, and thus increased the currents obtained [55]. Parameters of the fitted K-L equations indicated an average electron transfer number n = 3.97 (Fig. S25) per oxygen molecule (0.6 V vs. RHE). Moreover, RRDE results demonstrate that the H2O2 yield of the Fe2O3@NiO / NG catalyst is approximately 8%–9% during operation within the potential interval of 0.4–0.8 V, and the average n is ∼3.9. This verifies a high 4e− selectivity for the reduction of oxygen to water (Fig. S26). This conclusion verifies that ORR on Fe2O3@NiO / NG uses an efficient four-electron pathway, and its activity is comparable with those of other catalysts that have recently been reported elsewhere (Fig. 4f and Table S3). 3.3 Theoretical interpretation In order to investigate differences in the origins of higher ORR activity of Fe2O3@NiO / NG hybrids versus other 2D or 2D/2D catalysts, we performed DFT calculations to plot the relative energy profiles of NG, NiO, NG/NiO, Fe2O3 / NG, Fe2O3/NiO, and NG/Fe2O3/NiO. The details of DFT calculations are included in Supplementary Information. At first, we compared the catalytic activities of pure NG and NiO (Fig. 5a). Oxygen adsorption is more favorable on NiO (–0.63 eV) than NG (−0.17 eV). However, oxygen dissociation is endothermic on NiO (2.03 eV), whereas it is exothermic on NG (−1.75 eV). This implies that NiO is advantageous to molecular oxygen adsorption, but NG is favorable to oxygen dissociation. Therefore, oxygen dissociation activity is significantly increased when NG is introduced to NiO (blue line in Fig. 5b). Surprisingly, oxygen adsorption strength is even further increased by introducing iron oxide to NiO or NG, regardless of the type of support material used (Figs. S32–S35). When iron oxide is introduced to NG (Fe2O3 / NG) and NiO (Fe2O3@NiO), the active sites for O2 adsorption and dissociation are changed to Fe2O3 sites (Figs. S27–S35). Upon the introduction of Fe2O3, the adsorption energy of O2 is enhanced from −0.17 to −2.20 eV on NG and from −0.63 eV to −1.34 eV on NiO, respectively. However, oxygen dissociation becomes significantly less favorable on Fe2O3 / NG (−0.29 eV) compared to pure NG (−1.75 eV). This may be attributed to differences in active sites for oxygen dissociation between NG and Fe2O3 structures, given their relative O2 and O adsorption strengths (Fig. S32a and Table S4). To be an ideal catalyst, both strong adsorption and easier dissociation of O2 are required. In this sense, Fe2O3@NiO / NG hybrid catalysts showed balanced energetics for O2 adsorption (−1.27 eV) and dissociation (−1.45 eV). For example, O2 dissociation on Fe2O3@NiO / NG (−1.45 eV) was a bit less favorable than that on NG (−1.75 eV). However, O2 adsorption is much stronger on Fe2O3@NiO / NG (−1.27 eV) than on NG (−0.17 eV). Therefore, the overall activity of the hybrid catalyst is enhanced compared to that of NG. This moderate interaction between oxygen and surface can be a key to designing enhanced catalysts for ORR. In this regard, the trade-offs imposed by the Sabatier rule ensure that excessively strong catalyst-adsorbate binding [14,40] induces necessary initial surface oxidation. However, such bonds cause catalyst over-binding and ultimately poisoning, which decreases long-term activity [56]. In contrast, excessively weak binding energies enable fast desorption of oxygen from active sites, while also diminishing the initial adsorption of reactive species required for oxidation [2]. As a result of this trade-off, intermediate oxygen binding energies (E OB) optimize ORR activity by simultaneously describing initial catalytic surface oxidation and desorption reactions [52]. Thus, modulating E OB, which is a descriptor broadly applied to ORR and other reactions, can tune the electrocatalytic activity of studied Fe2O3@NiO / NG. Therefore, we calculated E OB on iron oxide catalysts with different support materials (Fe2O3 / NG, Fe2O3/NiO, and Fe2O3@NiO / NG). |E OB| increases as the amount of charge transfer from 2D material(s) to Fe2O3 improves (Fig. 5c). This implies that (1) stronger binding energies originate through enhancing charge transfer from 2D material(s) to Fe2O3 (Fig. 5d) and (2) the optimal value of E OB might be more negative than that of Fe2O3@NiO / NG. This tendency is also effective in the relationship between DFT-calculated E OB and experimentally measured Tafel slopes (Fig. 5e): more negative E OB result in lower Tafel slopes. Therefore, we conclude that the reason for the high catalytic activity of Fe2O3@NiO / NG is the closeness of its E OB to the optimal point for ORR. In addition, VO formation is also relatively favorable on Fe2O3@NiO / NG compared to other catalysts (Fig. 5f), and E OB decreases from −1.42 to −1.92 eV on Fe2O3@NiO / NG upon addition of an oxygen vacancy. These theoretical outcomes are in good agreement with our XPS results (Fig. 3f). Since VO can serve as active sites for oxygen adsorption, increased VO concentration improves active site densities [7,17], thereby improving the catalytic activity of ORR. 3.4 Electrochemical stability To determine whether Fe2O3@NiO / NG hybrids are effective candidates to supersede commercial Pt/C electrodes in ORR catalysis, we evaluated their electrochemical stability in methanol crossover tests. When catalysts were subjected to 3.0 M methanol/ethanol, the current–time (i-t) chronoamperometric responses for ORR (Fig. S36) were nearly constant with Fe2O3@NiO / NG hybrid electrodes, but current sharply decreased with Pt/C electrodes. This observation indicates favorable Fe2O3@NiO / NG selectivity for ORR, and that hybrids have greater tolerance to methanol than Pt/C electrocatalysts. Durability testing (Fig. S37) using a chronoamperometric method at 0.6 V contrasts Fe2O3@NiO / NG and commercial Pt/C electrode capabilities during ORR. After continuous operation for 30,000 s, Fe2O3@NiO / NG catalysts underwent mild current attenuation, whereas Pt/C catalysts underwent major current decay (84% retention). These differences in catalyst durability can be attributed to the core–shell structures of Fe2O3@NiO / NG hybrids. Nanostructures with high concentrations of low-coordination atoms are usually less kinetically favorable [57]. Further, nanostructures also generally feature elevated surface energies, and are therefore thermodynamically unstable [58]. This instability induces nanostructure interfaces to change during reactions, with resulting decreases in surface energies [55]. Consistent with this unstable character, Pt nanoparticles on carbon surfaces were easily oxidized under exposure to atmosphere [59], and NiFe alloy nanoparticles (treated at >400 °C, Fig. S10b) oxidized these surfaces more readily than corresponding Fe2O3 crystals attached to NG-coupled NiO nanosheets (Fig. S37). These differences in response can be ascribed to nanosheet morphology, which retains better structural stability upon distortion than corresponding nanoparticle/alloy combinations [60]. Comparably active Pt/C aggregates during reactions, which explains its poor stability during long-term testing. In contrast, Fe2O3@NiO / NG electrocatalysts are more stable than Pt/C over time (Fig. S38), and this trait indicates that Fe2O3@NiO / NG electrocatalysts have practical applications in fabricated ORR catalytic films. To help reveal the connection between catalytic stability and morphology, FESEM and XRD were conducted on studied catalysts (Fig. S39) to evaluate ORR cycling stability over 2,000 cycles. SEM imaging showed no apparent morphological changes in Fe2O3@NiO / NG catalysts; this result is consistent with the premise that small and relatively confined Fe2O3 NCs interacted with NiO and mesoporous NG layers. However, some Ni leaching occurred during stability testing, as evidenced by EDX results with greater decreases in Ni than Fe content likely due to NiO shell presence (inset of Fig. S39b). XRD patterns (Fig. S39c) also demonstrated long-term stability of Fe2O3 NCs in Fe2O3@NiO/NG catalysts, which further exhibit well-retained crystallinity and electrocatalytic durability. All of these observations verify the stability of the Fe2O3@NiO / NG catalyst. 3.5 Catalytic reaction mechanism for Fe2O3@NiO / NG hybrid In alkaline (KOH) media, a likely mechanism responsible for catalyzing Fe2O3@NiO / NG hybrid ORR activity entails several steps. Initially, defects on the Fe2O3@NiO interface interact with their encompassing N-doped graphitic carbon shells. Ultimately, this mechanism yields doubled shells of NiO / NG around Fe2O3 surfaces (Fig. S40). These multilayered, bimetallic-oxide-heterostructure interfaces favorably stabilize needed reaction intermediates and otherwise increase electrochemical reduction rates. Molecular orbital modeling of relevant transition metal oxide catalysis indicates that ORR activity is induced by bonding between metal d states and O 2p states [44]. Specifically, the e g orbitals of transition metal ions on catalyst surfaces interact by σ-bonding with the anions of adsorbates. Therefore, eg orbital d-electron filling affects bonding of oxygenated reaction intermediates to catalysts, thereby optimizing catalyst activity [61]. Orbital modeling further indicates that increases in the covalent character of this metal–oxygen bonding is responsible for improvement of ORR activity. Thus, improved ORR activity and durability of Fe2O3@NiO/NG catalysts in alkaline electrolytic media are the results of contributions from several sources. (i) Augmenting covalent M−O bonding character between catalytically active sites and adsorbates, enabling the adsorption of reactants comprised of O and subsequent reaction steps. (ii) Forming 2D/2D support nanostructures, improving catalyst surface area and active site exposure to electrolytes comprised of alkaline media [22,35]. (iii) Engineering Fe-Ni charge transfer to delocalize charge density across Ni, thereby further increasing catalytic activity [4,13,24]. (iv) For Fe2O3@NiO / NG hybrids, inducing synergistic effects between N-doped graphene supports and bonded bimetallic oxides (Fe2O3@NiO). This synergy produces M−N interactions that favor charge transport over entire catalysts, expanding beyond readily-exposed active sites. 4 Conclusions In this work, holey Fe2O3 NCs were anchored to supports comprised of NG and 2D NiO nanosheet shells (Fe2O3@NiO / NG). They were designed and synthesized by alkalization, followed by annealing. Multiple structural properties of these catalysts were engineered to yield stable Fe2O3@NiO / NG hybrids, namely by developing doubled shells around catalytic Fe2O3 surfaces. Such properties include Fe2O3 NC size, crystal structure attributes, and 2D/2D (NiO / NG) support interaction character. Fe:Ni ratios were modulated to tune the electronic and structural properties of bimetallic heterostructures (Fe2O3@NiO). Experimental and computational analyses determined that local crystalline lattice distortions of bimetallic nanostructured (Fe2O3@NiO) surfaces were connected to Fe and Ni d-band downshifting and decreased intermediate binding energies of the ORR. This downshifting was correlated with increases in electron-transfer rates and ORR kinetics of active sites on studied catalytic surfaces. Comparisons of binding energies obtained using DFT calculations substantiated experimental observations of relatively strong electrocatalytic efficiency for Fe2O3@NiO / NG hybrids. Results achieved in this study provide a direct structure − catalytic correlation, which can be exploited to understand the functional engineering of NG-encapsulated Fe2O3@NiO nanostructures. These conclusions inspire the rational design of multi-functional and cost-effective catalysts for many applications. Declaration of competing interest The authors declare that they have no known competing financial interests or personal relationships that could have appeared to influence the work reported in this paper. Acknowledgments This work was supported by the National Research Foundation of Korea (NRF) funded by Ministry of Science and ICT (MSIT) (RS-2023-00235596) and ERC Center (2022R1A5A1033719). Appendix A Supplementary material Supplementary material to this article can be found online at https://doi.org/10.1016/j.jechem.2024.01.051. Appendix A Supplementary material The following are the Supplementary material to this article: Supplementary data 1 References [1] W. Zhou L. Guo Chem. Soc. Rev. 44 2015 6697 6707 W. Zhou, L. Guo, Chem. Soc. Rev. 44 (2015) 6697-6707. [2] M.A. Ahsan A.R.P. Santiago Y. Hong N. Zhang M. Cano E.R. Castellon L. Echegoyen S.T. Sreenivasan J.C. Noveron J. Am. Chem. Soc. 142 2020 14688 14701 M.A. Ahsan, A.R.P. Santiago, Y. Hong, N. Zhang, M. Cano, E. R-Castellon, L Echegoyen, S.T. Sreenivasan, J.C. Noveron, J. Am. Chem. Soc. 142 (2020) 14688−14701. [3] Y. Zhao J. Zhang W. Wu X. Guo P. Xiong H. Liu G. Wang Nano Energy 54 2018 129 137 Y. Zhao, J. Zhang, W. Wu, X. Guo, P. Xiong, H. Liu, G. Wang, Nano Energy 54 (2018) 129–137. [4] Q. Wang L. Shang R. Shi X. Zhang Y. Zhao G.I.N. Waterhouse L.-Z. Wu C.-H. Tung T. Zhang Adv. Energy Mater. 7 2017 1700467 Q. Wang, L. Shang, R. Shi, X. Zhang, Y. Zhao, G.I.N. Waterhouse, L-Z. Wu, C-H. Tung, T. Zhang, Adv. Energy Mater. 7 (2017) 1700467. [5] D. Zhou Z. Cai X. Lei W. Tian Y. Bi Y. Jia N. Han T. Gao Q. Zhang Y. Kuang J. Pan X. Sun X. Duan Adv. Energy Mater. 8 2018 1701905 D. Zhou, Z. Cai, X. Lei, W. Tian, Y. Bi, Y. Jia, N. Han, T. Gao, Q. Zhang, Y. Kuang, J. Pan, X. Sun, X. Duan, Adv. Energy Mater. 8 (2018) 1701905. [6] W. Yang X. Yang J. Jia C. Hou H. Gao Y. Mao C. Wang J. Lin X. LuO Appl. Catal. B: Environ. 244 2019 1096 1102 W. Yang, X. Yang, J. Jia, C. Hou, H. Gao, Y. Mao, C. Wang, J, Lin, X. LuO, Appl. Catal. B: Environ. 244 (2019) 1096−1102. [7] T. Tian H. Gao X. Zhou L. Zheng J. Wu K. Li Y. Ding ACS Energy Lett. 3 2018 2150 2158 T. Tian, H. Gao, X. Zhou, L. Zheng, J. Wu, K. Li, Y. Ding, ACS Energy Lett. 3 (2018) 2150−2158. [8] Z. Wu T. Wang J. Zou Y. Li C. Zhang ACS Catal. 12 2022 5911 5920 Z. Wu, T. Wang, J-. Zou, Y. Li, C. Zhang, ACS Catal. 12 (2022) 5911–5920. [9] Q. Kang D. Lai W. Tang Q. Lu F. Gao Chem. Sci. 12 2021 3818 3835 Q. Kang, D. Lai, W, Tang, Q, Lu, F. Gao, Chem. Sci. 12 (2021) 3818-3835. [10] F. Jiao A.H. Hill A. Harrison A. Berko A.V. Chadwick P.G. Bruce J. Am. Chem. Soc. 130 2008 5262 5266 F. Jiao, A.H. Hill, A. Harrison, A. Berko, A.V. Chadwick, P.G. Bruce, J. Am. Chem. Soc. 130 (2008) 5262–5266. [11] F. Godínez-Salomon L. Albiter S.M. Alia B.S. Pivovar L.E. Camacho-Forero P.B. Balbuena R. Mendoza-Cruz M.J. Arellano-Jimenez C.P. Rhodes ACS Catal. 8 2018 10498 10520 F. Godínez-Salomon, ́L. Albiter, S.M. Alia, B.S. Pivovar, L.E. Camacho-Forero, P.B. Balbuena, R. Mendoza-Cruz, M.J. Arellano-Jimenez, C.P. Rhodes, ACS Catal. 8 (2018) 10498–10520. [12] K. Czelej K. Cwieka J.C. Colmenares K.J. Kurzydlowski Appl. Catal. B: Environ. 222 2018 73 75 K. Czelej, K. Cwieka, J.C. Colmenares, K.J. Kurzydlowski, Appl. Catal. B: Environ. 222 (2018) 73–75. [13] Z. Lu W. Xu W. Zhu Q. Yang X. Lei J. Liu Y. Li X. Sun X. Duan Chem. Comm. 50 2014 6479 6482 Z. Lu, W. Xu, W. Zhu, Q. Yang, X. Lei, J. Liu, Y. Li, X. Sun, X. Duan, Chem. Comm. 50 (2014) 6479−6482. [14] L. Peng P. Xiong L. Ma Y. Yuan Y. Zhu D. Chen X. Luo J. Lu K. Amine G. Yu Nat. Commun. 8 2017 15139 L. Peng, P. Xiong, L. Ma, Y. Yuan, Y. Zhu, D. Chen, X. Luo, J. Lu, K. Amine, G. Yu, Nat. Commun. 8 (2017) 15139. [15] L. Tian R. Tyburski C. Wen R. Sun M. Abdellah J. Huang L. D’Amario G. Boschloo L. Hammarström H. Tian J. Am. Chem. Soc. 142 2020 18668 18678 L. Tian, R. Tyburski, C. Wen, R. Sun, M. Abdellah, J. Huang, L. D’Amario, G. Boschloo, L. Hammarström, H. Tian, J. Am. Chem. Soc. 142 (2020) 18668−18678. [16] M. Wu G. Zhang H. Tong X. Liu L. Du N. Chen J. Wang T. Sun T. Regier S. Sun Nano Energy 79 2021 105409 M. Wu, G. Zhang, H. Tong, X. Liu, L. Du, N. Chen, J. Wang, T, Sun, T. Regier, S. Sun, Nano Energy 79 (2021) 105409. [17] S. Chandrasekaran D. Ma Y. Ge L. Deng C. Bowen J. Roscow Y. Zhang Z. Lin R.D.K. Misra J. Li P. Zhang H. Zhang Nano Energy 77 2020 105080 S. Chandrasekaran, D. Ma, Y. Ge, L. Deng, C. Bowen, J. Roscow, Y. Zhang, Z. Lin, R.D.K. Misra, J. Li, P. Zhang, H. Zhang, Nano Energy 77 (2020) 105080. [18] Z. Zafar S. Yi J. Li C. Li Y. Zhu A. Zada W. Yao Z. Liu X. Yue Energy Environ. Mater. 5 2022 68 114 Z. Zafar, S. Yi, J. Li, C. Li, Y. Zhu, A. Zada, W. Yao, Z. Liu, and X. Yue, Energy Environ. Mater. 5 (2022) 68–114. [19] D. Yan Y. Li J. Huo R. Chen L. Dai S. Wang Adv. Mater. 29 2017 1606459 D. Yan, Y. Li, J. Huo, R. Chen, L. Dai, S. Wang, Adv. Mater. 29 (2017) 1606459. [20] D.A. Kuznetsov B. Han Y. Yu R.R. Rao J. Hwang Y.R. Leshkov Y.S. Horn Joule 2 2018 225 244 D.A. Kuznetsov, B. Han, Y. Yu, R.R. Rao, J. Hwang, Y.R -Leshkov, Y.S-Horn, Joule 2 (2018) 225–244. [21] T. Sun G. Zhang D. Xu X. Lian H. Li W. Chen C. Su Mater. Today Energy 12 2019 215 238 T. Sun, G. Zhang, D. Xu, X. Lian, H. Li, W. Chen, C. Su, Mater. Today Energy 12 (2019) 215-238. [22] H. Khani N.S. Grundish D.O. Wipf J.B. Goodenough Adv. Energy Mater. 10 2020 1903215 H. Khani, N.S. Grundish, D.O. Wipf, J.B. Goodenough, Adv. Energy Mater. 10 (2020) 1903215. [23] Y. Zou Y. Wang Nanoscale 3 2011 2615 2620 Y. Zou, Y. Wang, Nanoscale, 3 (2011) 2615–2620. [24] R. Deng B. Yao Y.F. Li Y.M. Zhao B.H. Li C.X. Shan Z.Z. Zhang D.X. Zhao J.Y. Zhang D.Z. Shen X.W. Fan J. Appl. Phys. 94 2009 022108 R. Deng, B. Yao, Y.F. Li, Y.M. Zhao, B.H. Li, C.X. Shan, Z.Z. Zhang, D.X. Zhao, J.Y. Zhang, D.Z. Shen, X.W. Fan, J. Appl. Phys. 94 (2009) 022108. [25] K. Maiti J. Balamurugan S.G. Peera N.H. Kim J.H. Lee ACS Appl. Mater. Interfaces 10 2018 18734 18745 K. Maiti, J. Balamurugan, S.G. Peera, N.H. Kim, J.H. Lee, ACS Appl. Mater. Interfaces 10 (2018) 18734–18745. [26] K. Maiti N.H. Kim J.H. Lee Chem. Eng. J. 410 2021 128358 K. Maiti, N.H. Kim, J.H. Lee, Chem. Eng. J. 410 (2021), 128358. [27] M. Baghbanzadeh P.D.C.L. Cozzoli C.O. Kappe Angew. Chem. Int. Ed. 50 2011 11312 11359 M. Baghbanzadeh, P.D.C.L. Cozzoli, C.O. Kappe, Angew. Chem. Int. Ed. 50 (2011) 11312–11359. [28] M. Görlin J.F.d. Araujo H. Schmies D. Bernsmeier S. Dresp M. Gliech Z. Jusys P. Chernev R. Kraehnert H. Dau J. Am. Chem. Soc. 139 2017 2070 2082 M. Görlin, J.F.d. Araujo, H. Schmies, D. Bernsmeier, S. Dresp, M. Gliech, Z. Jusys, P. Chernev, R. Kraehnert, H. Dau, J. Am. Chem. Soc. 139 (2017) 2070−2082. [29] J. Zhang F. Huang Z. Lin Nanoscale 2 2010 18 34 J. Zhang, F. Huang, Z. Lin, Nanoscale, 2 (2010) 18-34. [30] K. Maiti S. Maiti M.T. Curnan H.J. Kim J.W. Han Adv. Energy Mater. 11 2021 2101670 K. Maiti, S. Maiti, M. T. Curnan, H.J. Kim, J.W. Han, Adv. Energy Mater. 11 (2021) 2101670. [31] S. Deng V. Berry Mater. Today 19 2016 197 212 S. Deng, V. Berry, Mater. Today 19 (2016) 197-212. [32] X. Long J. Li S. Xiao K. Yan Z. Wang H. Chen S. Yang Angew. Chem. Int. Ed. 126 2014 7714 7718 X. Long, J. Li, S. Xiao, K. Yan, Z. Wang, H. Chen, S. Yang, Angew. Chem. Int. Ed. 126 (2014) 7714−7718. [33] M. Sun Y. Dong G. Zhang J. Qu J. Li J. Mater. Chem. A 2 2014 13635 M. Sun, Y. Dong, G. Zhang, J. Qu, J. Li, J. Mater. Chem. A, 2 (2014) 13635. [34] V.M. Dhavale S.K. Singh A. Nadeema S.S. Gaikwada S. Kurungot Nanoscale 7 2015 20117 20125 V.M. Dhavale, S.K. Singh, A. Nadeema, S.S. Gaikwada, S. Kurungot, Nanoscale, 7 (2015) 20117-20125. [35] K.B. Ibrahim W.-N. Su M.-C. Tsai S.A. Chala A.W. Kahsay M.-H. Yeh H.-M. Chen A.D. Duma H. Dai B.-J. Hwang Nano Energy 47 2018 309 315 K.B. Ibrahim, W.-N. Su, M.-C. Tsai, S.A. Chala, A.W. Kahsay, M.-H. Yeh, H.-M. Chen, A.D. Duma, H. Dai, B.-J. Hwang, Nano Energy 47 (2018) 309–315. [36] K. Maiti J. Balamurugan J. Gautam N.H. Kim J.H. Lee ACS Appl. Mater. Interfaces 10 2018 32220 32232 K. Maiti, J. Balamurugan, J. Gautam, N.H. Kim, J.H. Lee, ACS Appl. Mater. Interfaces 10 (2018) 32220−32232. [37] Y.B. Mollamahale N. Jafari D. Hosseini Mater. Lett. 213 2018 15 18 Y.B. Mollamahale, N. Jafari. D. Hosseini, Mater. Lett. 213 (2018) 15–18. [38] Y. Zhao X. Jia G. Chen L. Shang G.I.N. Waterhouse L.-Z. Wu C.-H. Tung D. O’Hare T. Zhang J. Am. Chem. Soc. 138 2016 6517 6524 Y. Zhao, X Jia, G. Chen, L. Shang, G.I.N. Waterhouse, L.-Z. Wu, C.-H. Tung, D. O’Hare, T. Zhang, J. Am. Chem. Soc. 138 (2016) 6517−6524. [39] M. Chen E. Zhao Q. Yan Z. Hu X. Xiao D. Chen Sci. Rep. 6 2016 29381 M. Chen, E. Zhao , Q.Yan, Z. Hu, X. Xiao, D. Chen, Sci. Rep. 6 (2016), 29381. [40] L. Jiang J. Duan J. Zhu S. Chen M. Antonietti ACS Nano 14 2020 2436 2444 L. Jiang, J. Duan, J. Zhu, S. Chen, M. Antonietti, ACS Nano 14 (2020) 2436−2444. [41] Y. Jiang D. Song J. Wu Z. Wang S. Huang Y. Xu Z. Chen B. Zhao J. Zhang ACS Nano 13 2019 9100 9111 Y. Jiang, D. Song, J. Wu, Z. Wang, S. Huang, Y. Xu, Z. Chen, B. Zhao, J. Zhang, ACS Nano 13 (2019) 9100−9111. [42] J. Li L. Jiao E. Wegener L.L. Richard E. Liu A. Zitolo M.T. Sougrati S. Mukerjee Z. Zhao Y. Huang F. Yang S. Zhong H. Xu A.J. Kropf F. Jaouen D.J. Myers Q. Jia J. Am. Chem. Soc. 142 2020 1417 1423 J. Li, L. Jiao, E. Wegener, L.L. Richard, E. Liu, A. Zitolo, M.T. Sougrati, S. Mukerjee, Z. Zhao, Y. Huang, F. Yang, S. Zhong, H. Xu, A. J. Kropf, F.Jaouen, D.J. Myers, Q. Jia, J. Am. Chem. Soc. 142 (2020) 1417−1423. [43] A.B. Getsoian Z. Zhai A.T. Bell J. Am. Chem. Soc. 136 2014 13684 13697 A.B. Getsoian, Z. Zhai, A.T. Bell, J. Am. Chem. Soc. 136 (2014) 13684−13697. [44] T.G. Yun Y. Heo H.B. Bae S.-Y. Chung Nat. Commun. 12 2021 824 T.G. Yun, Y. Heo, H.B. Bae, S.-Y. Chung, Nat. Commun. 12 (2021) 824. [45] S. Wolf M. Roschger B. Genorio D. Garstenauer V. Hacker ACS Omega 8 2023 11536 11543 S.Wolf, M. Roschger, B.Genorio, D. Garstenauer, V. Hacker, ACS Omega 8 (2023) 11536−11543. [46] Z. Sun X. Cao M. Tian K. Zeng Y. Jiang M.H. Rummeli P. Strasser R. Yang Adv. Energy Mater. 11 2021 2100110 Z. Sun, X. Cao, M. Tian, K. Zeng, Y. Jiang, M.H. Rummeli, P. Strasser, R. Yang, Adv. Energy Mater. 11 (2021) 2100110. [47] T. Jiang F. Bu X. Feng I. Shakir G. Hao Y. Xu ACS Nano 11 2017 5140 5147 T. Jiang, F. Bu, X. Feng, I. Shakir, G. Hao, Y. Xu, ACS Nano 11 (2017) 5140−5147. [48] P. Wang C. Li S. Dong X. Ge P. Zhang X. Miao R. Wang Z. Zhang L. Yin Adv. Energy Mater. 9 2019 1900788 P. Wang, C. Li, S. Dong, X. Ge, P. Zhang, X. Miao, R. Wang, Z. Zhang, L. Yin, Adv. Energy Mater. 9 (2019) 1900788. [49] C. Wang N. Smieszek V. Chakrapani Chem. Mater. 33 2021 7805 7817 C. Wang, N. Smieszek, V. Chakrapani, Chem. Mater. 33 (2021) 7805−7817. [50] J. Kim H. Jung S.-M. Jung J. Hwang D.Y. Kim N. Lee K.-S. Kim H. Kwon Y.-T. Kim J.W. Han J.K. Kim J. Am. Chem. Soc. 143 2021 1399 1408 J. Kim, H. Jung, S.-M. Jung, J. Hwang, D.Y. Kim, N. Lee, K.-S. Kim, H. Kwon, Y.-T. Kim, J.W. Han, J.K. Kim, J. Am. Chem. Soc. 143 (2021) 1399−1408. [51] H. Yang L. Gong H. Wang C. Dong J. Wang K. Qi H. Liu X. Guo B.Y. Xia Nat. Commun. 11 2020 5075 H. Yang, L. Gong, H. Wang, C. Dong, J. Wang, K. Qi, H. Liu, X. Guo, B.Y. Xia, Nat. Commun. 11 (2020) 5075. [52] Y. Zheng S. Thampy N. Ashburn S. Dillon L. Wang Y. Jangjou K. Tan F. Kong Y. Nie M.J. Kim W.S. Epling Y.J. Chabal J.W.P. Hsu K. Cho J. Am. Chem. Soc. 141 2019 10722 10728 Y. Zheng, S. Thampy, N. Ashburn, S. Dillon, L. Wang, Y. Jangjou, K. Tan, F. Kong, Y. Nie, M.J. Kim, W.S. Epling, Y.J. Chabal, J.W.P. Hsu, K. Cho, J. Am. Chem. Soc. 141 (2019), 10722−10728. [53] M.W. Louie A.T. Bell J. Am. Chem. Soc. 135 2013 12329 12337 M.W. Louie, A.T. Bell, J. Am. Chem. Soc. 135 (2013) 12329−12337. [54] C.-C. Hu Y.-R. Wu Mater. Chem. Phys. 82 2003 588 596 C.-C. Hu, Y.-R. Wu, Mater. Chem. Phys. 82 (2003) 588−596. [55] K. Maiti K. Kim K.-J. Noh J.W. Han Chem. Eng. J. 423 2021 130233 K. Maiti, K. Kim, K.-J. Noh, J.W. Han, Chem. Eng. J. 423 (2021) 130233. [56] K. Shin L. Zhang H. An H. Ha M. Yoo H.M. Lee G. Henkelman H.Y. Kim Nanoscale 9 2017 5244 5253 K. Shin, L. Zhang, H. An, H. Ha, M. Yoo, H.M. Lee, G. Henkelman, H.Y. Kim, Nanoscale 9 (2017) 5244–5253. [57] K. Fukuda J. Sato T. Saida W. Sugimoto Y. Ebina T. Shibata M. Osada T. Sasaki Inorg. Chem. 52 2013 2280 2282 K. Fukuda, J. Sato, T. Saida, W. Sugimoto, Y. Ebina, T. Shibata, M. Osada, T. Sasaki, Inorg. Chem. 52 (2013) 2280−2282. [58] D. Takimoto W. Sugimoto Q. Yuan N. Takao T. Itoh T.V.T. Duy T. Ohwaki H. Imai ACS Appl. Nano Mater. 2 2019 5743 5751 D. Takimoto, W. Sugimoto, Q. Yuan, N. Takao, T. Itoh, T. V. T. Duy, T. Ohwaki, H. Imai, ACS Appl. Nano Mater. 2 (2019) 5743−5751. [59] X. Shen S. Dai S. Zhang Z. Lu C. Zhang G.W. Graham Y. Lei X. Pan Z. Peng Chem. Mater. 31 2019 1720 1728 X. Shen, S. Dai, S. Zhang, Z. Lu, C. Zhang, G.W. Graham, Y. Lei, X. Pan, Z. Peng, Chem. Mater. 31 (2019) 1720−1728. [60] J. Seo X. Jin M. Kim I.Y. Kim Y.K. Jo S. Bera N.-S. Lee W.I. Lee H. Kim S.-J. Hwang Adv. Mater. Interfaces 3 2016 1600661 J. Seo, X, Jin, M. Kim, I.Y. Kim, Y.K. Jo, S. Bera, N.-S. Lee, W.I. Lee, H. Kim, S.-J. Hwang, Adv. Mater. Interfaces 3 (2016) 1600661. [61] L. Bu Q. Shao Y. Pi J. Yao M. Luo J. Lang S. Hwang H. Xin B. Huang J. Guo D. Su S. Guo X. Huang Chem 4 2018 359 371 L. Bu, Q. Shao, Y. Pi, J. Yao, M. Luo, J. Lang, S. Hwang, H. Xin, B. Huang, J. Guo, D. Su, S. Guo, X. Huang, Chem 4 (2018) 359–371.",
      "scopus-id": "85189018219",
      "coredata": {
        "eid": "1-s2.0-S2095495624000895",
        "dc:description": "As a noble metal substitute, two-dimensional (2D) hierarchical nano-frame structures have attracted great interest as candidate catalysts due to their remarkable advantages – high intrinsic activity, high electron mobility, and straightforward surface functionalization. Therefore, they may replace Pt-based catalysts in oxygen reduction reaction (ORR) applications. Herein, a simple method is developed to design hierarchical nano-frame structures assembled via 2D NiO and N-doped graphene (NG) nanosheets. This procedure can yield nanostructures that satisfy the criteria correlated with improved electrocatalytic performance, such as large surface area, numerous undercoordinated atoms, and high defect densities. Further, porous NG nanosheet architectures, featuring NiO nanosheets densely coordinated with accessible holey Fe2O3 moieties, can enhance mesoporosity and balance hydrophilicity. Such improvements can facilitate charge transport and expose formerly inaccessible reaction sites, maximizing active site density utilization. Density functional theory (DFT) calculations reveal favored O2 adsorption and dissociation on Fe2O3 hybrid structures when supported by 2D NiO and NG nanomaterials, given 2D materials donated charge to Fe2O3 active sites. Our systematic studies reveal that synergistic contributions are responsible for enriching the catalytic activity of Fe2O3@NiO / NG in alkaline media – encompassing internal voids and pores, unique hierarchical support structures, and concentrated N-dopant and bimetallic atomic interactions. Ultimately, this work expands the toolbox for designing and synthesizing highly efficient 2D / 2D shelled functional nanomaterials with transition metals, endeavoring to benefit energy conversion and related ORR applications.",
        "openArchiveArticle": "false",
        "prism:coverDate": "2024-06-30",
        "openaccessUserLicense": null,
        "prism:aggregationType": "Journal",
        "prism:url": "https://api.elsevier.com/content/article/pii/S2095495624000895",
        "dc:creator": [
          {
            "@_fa": "true",
            "$": "Maiti, Kakali"
          },
          {
            "@_fa": "true",
            "$": "Curnan, Matthew T."
          },
          {
            "@_fa": "true",
            "$": "Kim, Hyung Jun"
          },
          {
            "@_fa": "true",
            "$": "Kim, Kyeounghak"
          },
          {
            "@_fa": "true",
            "$": "Han, Jeong Woo"
          }
        ],
        "link": [
          {
            "@_fa": "true",
            "@rel": "self",
            "@href": "https://api.elsevier.com/content/article/pii/S2095495624000895"
          },
          {
            "@_fa": "true",
            "@rel": "scidir",
            "@href": "https://www.sciencedirect.com/science/article/pii/S2095495624000895"
          }
        ],
        "dc:format": "application/json",
        "openaccessType": null,
        "pii": "S2095-4956(24)00089-5",
        "prism:volume": "93",
        "prism:publisher": "Science Press and Dalian Institute of Chemical Physics, Chinese Academy of Sciences. Published by ELSEVIER B.V. and Science Press.",
        "dc:title": "Boosting the catalytic activity toward oxygen reduction via a heterostructure of porous iron oxide-decorated 2D NiO/NG nanosheets",
        "prism:copyright": "© 2024 Science Press and Dalian Institute of Chemical Physics, Chinese Academy of Sciences. Published by ELSEVIER B.V. and Science Press. All rights reserved.",
        "openaccess": "0",
        "prism:issn": "20954956",
        "dcterms:subject": [
          {
            "@_fa": "true",
            "$": "N-doped graphene"
          },
          {
            "@_fa": "true",
            "$": "Holey Fe2O3 nanocrystals"
          },
          {
            "@_fa": "true",
            "$": "NiO nanosheets"
          },
          {
            "@_fa": "true",
            "$": "High catalytic performance, ORR"
          }
        ],
        "openaccessArticle": "false",
        "prism:publicationName": "Journal of Energy Chemistry",
        "openaccessSponsorType": null,
        "prism:pageRange": "669-681",
        "prism:endingPage": "681",
        "pubType": "fla",
        "prism:coverDisplayDate": "June 2024",
        "prism:doi": "10.1016/j.jechem.2024.01.051",
        "prism:startingPage": "669",
        "dc:identifier": "doi:10.1016/j.jechem.2024.01.051",
        "openaccessSponsorName": null
      },
      "objects": {
        "object": [
          {
            "@category": "standard",
            "@height": "200",
            "@width": "259",
            "@_fa": "true",
            "$": "https://api.elsevier.com/content/object/eid/1-s2.0-S2095495624000895-ga1.jpg?httpAccept=%2A%2F%2A",
            "@multimediatype": "JPEG image file",
            "@type": "IMAGE-DOWNSAMPLED",
            "@size": "36619",
            "@ref": "ga1",
            "@mimetype": "image/jpeg"
          },
          {
            "@category": "standard",
            "@height": "866",
            "@width": "676",
            "@_fa": "true",
            "$": "https://api.elsevier.com/content/object/eid/1-s2.0-S2095495624000895-gr1.jpg?httpAccept=%2A%2F%2A",
            "@multimediatype": "JPEG image file",
            "@type": "IMAGE-DOWNSAMPLED",
            "@size": "221550",
            "@ref": "gr1",
            "@mimetype": "image/jpeg"
          },
          {
            "@category": "standard",
            "@height": "819",
            "@width": "674",
            "@_fa": "true",
            "$": "https://api.elsevier.com/content/object/eid/1-s2.0-S2095495624000895-gr2.jpg?httpAccept=%2A%2F%2A",
            "@multimediatype": "JPEG image file",
            "@type": "IMAGE-DOWNSAMPLED",
            "@size": "265627",
            "@ref": "gr2",
            "@mimetype": "image/jpeg"
          },
          {
            "@category": "standard",
            "@height": "769",
            "@width": "698",
            "@_fa": "true",
            "$": "https://api.elsevier.com/content/object/eid/1-s2.0-S2095495624000895-gr3.jpg?httpAccept=%2A%2F%2A",
            "@multimediatype": "JPEG image file",
            "@type": "IMAGE-DOWNSAMPLED",
            "@size": "185047",
            "@ref": "gr3",
            "@mimetype": "image/jpeg"
          },
          {
            "@category": "standard",
            "@height": "725",
            "@width": "685",
            "@_fa": "true",
            "$": "https://api.elsevier.com/content/object/eid/1-s2.0-S2095495624000895-gr4.jpg?httpAccept=%2A%2F%2A",
            "@multimediatype": "JPEG image file",
            "@type": "IMAGE-DOWNSAMPLED",
            "@size": "156929",
            "@ref": "gr4",
            "@mimetype": "image/jpeg"
          },
          {
            "@category": "standard",
            "@height": "789",
            "@width": "631",
            "@_fa": "true",
            "$": "https://api.elsevier.com/content/object/eid/1-s2.0-S2095495624000895-gr5.jpg?httpAccept=%2A%2F%2A",
            "@multimediatype": "JPEG image file",
            "@type": "IMAGE-DOWNSAMPLED",
            "@size": "103362",
            "@ref": "gr5",
            "@mimetype": "image/jpeg"
          },
          {
            "@category": "standard",
            "@height": "239",
            "@width": "729",
            "@_fa": "true",
            "$": "https://api.elsevier.com/content/object/eid/1-s2.0-S2095495624000895-gr6.jpg?httpAccept=%2A%2F%2A",
            "@multimediatype": "JPEG image file",
            "@type": "IMAGE-DOWNSAMPLED",
            "@size": "64696",
            "@ref": "gr6",
            "@mimetype": "image/jpeg"
          },
          {
            "@category": "thumbnail",
            "@height": "164",
            "@width": "212",
            "@_fa": "true",
            "$": "https://api.elsevier.com/content/object/eid/1-s2.0-S2095495624000895-ga1.sml?httpAccept=%2A%2F%2A",
            "@multimediatype": "GIF image file",
            "@type": "IMAGE-THUMBNAIL",
            "@size": "27925",
            "@ref": "ga1",
            "@mimetype": "image/gif"
          },
          {
            "@category": "thumbnail",
            "@height": "164",
            "@width": "128",
            "@_fa": "true",
            "$": "https://api.elsevier.com/content/object/eid/1-s2.0-S2095495624000895-gr1.sml?httpAccept=%2A%2F%2A",
            "@multimediatype": "GIF image file",
            "@type": "IMAGE-THUMBNAIL",
            "@size": "14558",
            "@ref": "gr1",
            "@mimetype": "image/gif"
          },
          {
            "@category": "thumbnail",
            "@height": "164",
            "@width": "135",
            "@_fa": "true",
            "$": "https://api.elsevier.com/content/object/eid/1-s2.0-S2095495624000895-gr2.sml?httpAccept=%2A%2F%2A",
            "@multimediatype": "GIF image file",
            "@type": "IMAGE-THUMBNAIL",
            "@size": "20632",
            "@ref": "gr2",
            "@mimetype": "image/gif"
          },
          {
            "@category": "thumbnail",
            "@height": "164",
            "@width": "149",
            "@_fa": "true",
            "$": "https://api.elsevier.com/content/object/eid/1-s2.0-S2095495624000895-gr3.sml?httpAccept=%2A%2F%2A",
            "@multimediatype": "GIF image file",
            "@type": "IMAGE-THUMBNAIL",
            "@size": "11646",
            "@ref": "gr3",
            "@mimetype": "image/gif"
          },
          {
            "@category": "thumbnail",
            "@height": "164",
            "@width": "155",
            "@_fa": "true",
            "$": "https://api.elsevier.com/content/object/eid/1-s2.0-S2095495624000895-gr4.sml?httpAccept=%2A%2F%2A",
            "@multimediatype": "GIF image file",
            "@type": "IMAGE-THUMBNAIL",
            "@size": "11630",
            "@ref": "gr4",
            "@mimetype": "image/gif"
          },
          {
            "@category": "thumbnail",
            "@height": "164",
            "@width": "131",
            "@_fa": "true",
            "$": "https://api.elsevier.com/content/object/eid/1-s2.0-S2095495624000895-gr5.sml?httpAccept=%2A%2F%2A",
            "@multimediatype": "GIF image file",
            "@type": "IMAGE-THUMBNAIL",
            "@size": "6626",
            "@ref": "gr5",
            "@mimetype": "image/gif"
          },
          {
            "@category": "thumbnail",
            "@height": "72",
            "@width": "219",
            "@_fa": "true",
            "$": "https://api.elsevier.com/content/object/eid/1-s2.0-S2095495624000895-gr6.sml?httpAccept=%2A%2F%2A",
            "@multimediatype": "GIF image file",
            "@type": "IMAGE-THUMBNAIL",
            "@size": "8583",
            "@ref": "gr6",
            "@mimetype": "image/gif"
          },
          {
            "@category": "high",
            "@height": "531",
            "@width": "688",
            "@_fa": "true",
            "$": "https://api.elsevier.com/content/object/eid/1-s2.0-S2095495624000895-ga1_lrg.jpg?httpAccept=%2A%2F%2A",
            "@multimediatype": "JPEG image file",
            "@type": "IMAGE-HIGH-RES",
            "@size": "144195",
            "@ref": "ga1",
            "@mimetype": "image/jpeg"
          },
          {
            "@category": "high",
            "@height": "3833",
            "@width": "2992",
            "@_fa": "true",
            "$": "https://api.elsevier.com/content/object/eid/1-s2.0-S2095495624000895-gr1_lrg.jpg?httpAccept=%2A%2F%2A",
            "@multimediatype": "JPEG image file",
            "@type": "IMAGE-HIGH-RES",
            "@size": "1757133",
            "@ref": "gr1",
            "@mimetype": "image/jpeg"
          },
          {
            "@category": "high",
            "@height": "3627",
            "@width": "2984",
            "@_fa": "true",
            "$": "https://api.elsevier.com/content/object/eid/1-s2.0-S2095495624000895-gr2_lrg.jpg?httpAccept=%2A%2F%2A",
            "@multimediatype": "JPEG image file",
            "@type": "IMAGE-HIGH-RES",
            "@size": "1826017",
            "@ref": "gr2",
            "@mimetype": "image/jpeg"
          },
          {
            "@category": "high",
            "@height": "3404",
            "@width": "3091",
            "@_fa": "true",
            "$": "https://api.elsevier.com/content/object/eid/1-s2.0-S2095495624000895-gr3_lrg.jpg?httpAccept=%2A%2F%2A",
            "@multimediatype": "JPEG image file",
            "@type": "IMAGE-HIGH-RES",
            "@size": "1208860",
            "@ref": "gr3",
            "@mimetype": "image/jpeg"
          },
          {
            "@category": "high",
            "@height": "3208",
            "@width": "3031",
            "@_fa": "true",
            "$": "https://api.elsevier.com/content/object/eid/1-s2.0-S2095495624000895-gr4_lrg.jpg?httpAccept=%2A%2F%2A",
            "@multimediatype": "JPEG image file",
            "@type": "IMAGE-HIGH-RES",
            "@size": "1025246",
            "@ref": "gr4",
            "@mimetype": "image/jpeg"
          },
          {
            "@category": "high",
            "@height": "3497",
            "@width": "2795",
            "@_fa": "true",
            "$": "https://api.elsevier.com/content/object/eid/1-s2.0-S2095495624000895-gr5_lrg.jpg?httpAccept=%2A%2F%2A",
            "@multimediatype": "JPEG image file",
            "@type": "IMAGE-HIGH-RES",
            "@size": "589788",
            "@ref": "gr5",
            "@mimetype": "image/jpeg"
          },
          {
            "@category": "high",
            "@height": "1056",
            "@width": "3226",
            "@_fa": "true",
            "$": "https://api.elsevier.com/content/object/eid/1-s2.0-S2095495624000895-gr6_lrg.jpg?httpAccept=%2A%2F%2A",
            "@multimediatype": "JPEG image file",
            "@type": "IMAGE-HIGH-RES",
            "@size": "404378",
            "@ref": "gr6",
            "@mimetype": "image/jpeg"
          },
          {
            "@category": "standard",
            "@_fa": "true",
            "$": "https://api.elsevier.com/content/object/eid/1-s2.0-S2095495624000895-mmc1.pdf?httpAccept=%2A%2F%2A",
            "@multimediatype": "Acrobat PDF file",
            "@type": "APPLICATION",
            "@size": "4647192",
            "@ref": "mmc1",
            "@mimetype": "application/pdf"
          },
          {
            "@category": "thumbnail",
            "@_fa": "true",
            "$": "https://api.elsevier.com/content/object/eid/1-s2.0-S2095495624000895-si1.svg?httpAccept=%2A%2F%2A",
            "@multimediatype": "Scalable Vector Graphics file",
            "@type": "ALTIMG",
            "@size": "791",
            "@ref": "si1",
            "@mimetype": "image/svg+xml"
          },
          {
            "@category": "thumbnail",
            "@_fa": "true",
            "$": "https://api.elsevier.com/content/object/eid/1-s2.0-S2095495624000895-si2.svg?httpAccept=%2A%2F%2A",
            "@multimediatype": "Scalable Vector Graphics file",
            "@type": "ALTIMG",
            "@size": "12383",
            "@ref": "si2",
            "@mimetype": "image/svg+xml"
          },
          {
            "@category": "thumbnail",
            "@_fa": "true",
            "$": "https://api.elsevier.com/content/object/eid/1-s2.0-S2095495624000895-si3.svg?httpAccept=%2A%2F%2A",
            "@multimediatype": "Scalable Vector Graphics file",
            "@type": "ALTIMG",
            "@size": "17631",
            "@ref": "si3",
            "@mimetype": "image/svg+xml"
          },
          {
            "@category": "thumbnail",
            "@_fa": "true",
            "$": "https://api.elsevier.com/content/object/eid/1-s2.0-S2095495624000895-si4.svg?httpAccept=%2A%2F%2A",
            "@multimediatype": "Scalable Vector Graphics file",
            "@type": "ALTIMG",
            "@size": "32853",
            "@ref": "si4",
            "@mimetype": "image/svg+xml"
          },
          {
            "@category": "thumbnail",
            "@_fa": "true",
            "$": "https://api.elsevier.com/content/object/eid/1-s2.0-S2095495624000895-si5.svg?httpAccept=%2A%2F%2A",
            "@multimediatype": "Scalable Vector Graphics file",
            "@type": "ALTIMG",
            "@size": "15264",
            "@ref": "si5",
            "@mimetype": "image/svg+xml"
          },
          {
            "@category": "thumbnail",
            "@_fa": "true",
            "$": "https://api.elsevier.com/content/object/eid/1-s2.0-S2095495624000895-si6.svg?httpAccept=%2A%2F%2A",
            "@multimediatype": "Scalable Vector Graphics file",
            "@type": "ALTIMG",
            "@size": "8428",
            "@ref": "si6",
            "@mimetype": "image/svg+xml"
          },
          {
            "@category": "thumbnail",
            "@_fa": "true",
            "$": "https://api.elsevier.com/content/object/eid/1-s2.0-S2095495624000895-si7.svg?httpAccept=%2A%2F%2A",
            "@multimediatype": "Scalable Vector Graphics file",
            "@type": "ALTIMG",
            "@size": "1081",
            "@ref": "si7",
            "@mimetype": "image/svg+xml"
          },
          {
            "@category": "thumbnail",
            "@_fa": "true",
            "$": "https://api.elsevier.com/content/object/eid/1-s2.0-S2095495624000895-si8.svg?httpAccept=%2A%2F%2A",
            "@multimediatype": "Scalable Vector Graphics file",
            "@type": "ALTIMG",
            "@size": "7697",
            "@ref": "si8",
            "@mimetype": "image/svg+xml"
          },
          {
            "@category": "thumbnail",
            "@_fa": "true",
            "$": "https://api.elsevier.com/content/object/eid/1-s2.0-S2095495624000895-si9.svg?httpAccept=%2A%2F%2A",
            "@multimediatype": "Scalable Vector Graphics file",
            "@type": "ALTIMG",
            "@size": "13360",
            "@ref": "si9",
            "@mimetype": "image/svg+xml"
          },
          {
            "@category": "standard",
            "@_fa": "true",
            "$": "https://api.elsevier.com/content/object/eid/1-s2.0-S2095495624000895-am.pdf?httpAccept=%2A%2F%2A",
            "@multimediatype": "Acrobat PDF file",
            "@type": "AAM-PDF",
            "@size": "2849159",
            "@ref": "am",
            "@mimetype": "application/pdf"
          }
        ]
      },
      "link": {
        "@rel": "abstract",
        "@href": "https://api.elsevier.com/content/abstract/scopus_id/85189018219"
      }
    }
  }
}