{
  "metadata": {
    "title": "The energy-chemistry nexus: A vision of the future from sustainability perspective",
    "authors": "; ; ",
    "journal": "Journal of Energy Chemistry",
    "date": "2015-09-30",
    "doi": "10.1016/j.jechem.2015.08.005",
    "abstract": "",
    "uri": "https://api.elsevier.com/content/article/pii/S2095495615000522",
    "pii": "S2095495615000522"
  },
  "fulltext": {
    "full-text-retrieval-response": {
      "scopus-eid": "2-s2.0-84944731839",
      "originalText": "serial JL 286353 291210 291711 291744 291809 31 Journal of Energy Chemistry JOURNALENERGYCHEMISTRY 2015-09-03 2015-09-03 2015-10-24 2015-10-24 2017-03-03T04:42:12 1-s2.0-S2095495615000522 S2095-4956(15)00052-2 S2095495615000522 10.1016/j.jechem.2015.08.005 S300 S300.2 FULL-TEXT 1-s2.0-S2095495615X00064 2025-07-16T18:26:50.170656Z 0 0 20150901 20150930 2015 2015-09-03T11:16:23.139551Z absattachment articleinfo articletitlenorm authfirstinitialnorm authfirstsurnamenorm cid cids contenttype copyright crossmark dateloaded dateloadedtxt datesearch datesort dateupdated dco docsubtype doctype doi eid ewtransactionid hubeid indexeddate issfirst issn issnnorm issuelist itemstage itemtransactionid itemweight openaccess openarchive pg pgfirst pglast pii piinorm pubdateend pubdatestart pubdatetxt pubyr sectiontitle sortorder srctitle srctitlenorm srctype ssids alllist content subj subheadings tomb volfirst volissue volumelist webpdf webpdfpagecount yearnav figure table body mmlmath acknowledge affil articletitle auth authfirstini authfull authkeywords authlast primabst pubtype ref specialabst 2095-4956 20954956 false 24 24 5 5 Volume 24, Issue 5 2 535 547 535 547 201509 September 2015 2015-09-01 2015-09-30 2015 Perspectives article sco Copyright © 2015 Science Press and Dalian Institute of Chemical Physics. Published by Elsevier B.V. All rights reserved. ENERGYCHEMISTRYNEXUSAVISIONFUTURESUSTAINABILITYPERSPECTIVE ABATE S 1 Introduction 2 Moving to a new sustainable energy scenario 3 Energy storage: from smart grids to chemical storage of energy 4 Toward solar (bio)refineries and solar fuels 5 Integrating bio- and solar-refineries to move to new economy 6 Methanol: at the crossover of new energy-chemistry nexus 7 The role of chemistry in this new scenario 8 Nanomaterials for a sustainable energy 9 Nanocarbons to design advanced energy conversion and storage devices 10 Exploiting solar energy 11 Exploiting methane 12 Conclusions Acknowledgments References CENTI 2011 269 G CHEMICALELEMENTCHEMISTRYSCONTRIBUTIONGLOBALFUTURE ABATE 2015 143 S ARMAROLI 2006 2 N CAVANI 2009 F SUSTAINABLEINDUSTRIALCHEMISTRYPRINCIPLESTOOLSINDUSTRIALEXAMPLES CENTI 2008 G CATALYSISFORRENEWABLESFEEDSTOCKENERGYPRODUCTION LANZAFAME 2014 2 P LANZAFAME 2014 7562 P PERATHONER 2014 1274 S PERATHONER 2014 719 S SCHLOGL 2011 6424 R SCHLOGL 2010 209 R SOVACOOL 2008 2940 B KOCH 2000 F HYDROPOWERINTERNALISEDCOSTSEXTERNALISEDBENEFITS INTERNATIONALENERGYAGENCYIEA 2012 RE2014MEDIUMTERMMARKETREPORT IEA 2014 TECHNOLOGYROADMAP2014SOLARPHOTOVOLTAICENERGY SAMAD 2012 76 T SHAAHID 2009 625 S COSMI 2009 763 C DASILVA 2005 289 N GHANADAN 2005 1117 R CENTI 2009 3851 G CENTI 2011 1480 G CENTI 2011 913 G CHARLES 2009 172 D USDEPARTMENTOFENERGY 2008 SMARTGRIDINTRODUCTION WORLDENERGYCOUNCIL 2010 CENTI 2013 1711 G AMPELLI 2015 20140177 C CENTI 2009 948 G CENTI 2010 195 G SCHLOGL 2013 1 R CHEMICALENERGYSTORAGE SCHLOGL 2013 233 R BENSAID 2012 500 S CENTI 2014 1 G KIRKOTHMERENCYCLOPEDIACHEMICALTECHNOLOGY CENTI 2013 529 G ROLECATALYSISFORSUSTAINABLEPRODUCTIONBIOFUELSBIOCHEMICALS ZHANG 2013 27 Y SHARIFZADEH 2015 151 M ABATE 2015 S ZHANG 2012 301 Y ZHANG 2013 760 Y RAZZAK 2013 622 S ABISHEK 2014 M WU 2014 675 Y VANTHOORKOOPMANS 2013 142 M CHISTI 2013 201 Y LAM 2012 673 M PIENKOS 2009 431 P UGGETTI 2014 516 E LI 2015 2485 X ABANADES 2011 209 S CHEN 2011 490 D NAVARRO 2010 3 R ENERGYPRODUCTIONSTORAGE HAN 2014 2537 Z ELDOUKKALI 2014 1066 M XE 2009 149 X ROLLIN 2015 4964 J MARTINDELCAMPO 2013 4587 J HIGHFIELD 2015 6739 J BOWKER 2011 2235 M AMPELLI 2014 1270 C RAHMAN 2014 18951 M BARBATO 2014 453 L TIAN 2015 1922 P 2010 NANOTECHNOLOGYFORENERGYCHALLENGE STOCKER 2008 9200 M LIU 2008 676 J 2008 NANOSTRUCTUREDMATERIALSINELECTROCHEMISTRY YI 2009 75 C ARICO 2005 366 A SU 2013 202 D LIU 2010 E28 C FERGUS 2010 939 J LIANG 2008 3696 C RYOO 2001 677 R SU 2013 5782 D CENTI 2014 149 G VILATELA 2012 456 J CENTI 2014 429 G NANOCARBONINORGANICHYBRIDS UMEYAMA 2013 3195 T ABE 2010 179 R IWASE 2011 11054 A KONAGAI 2008 193 M GAUDIAN 2010 1288 R TANABE 2009 504 K AMERI 2009 347 T FAN 2009 648 Z GRATZEL 2007 993 M CENTI 2015 212 G ARMOR 2013 21 J IAQUANIELLO 2015 717 G CAPOFERRI 2011 1787 D ZAVYALOVA 2011 1935 U HAMMOND 2012 1668 C WOLF 2014 986 E GUO 2014 3480 Z NOZAKI 2013 29 T VANELDEREN 2013 483 P HAACK 2014 4282 P ABATE 2015 3 S SMALLSCALEGASLIQUIDFUELSYNTHESIS HAMMOND 2012 5129 C WU 2013 13567 J PARK 2013 977 D KLUCZKA 2014 850 S KRENZKE 2014 4088 P GOKON 2014 773 N BHAVSAR 2014 96 S HAVRAN 2011 7089 V SHI 2013 183847 L MOTA 2011 325 N ABATEX2015X535 ABATEX2015X535X547 ABATEX2015X535XS ABATEX2015X535X547XS 2017-10-24T00:00:00Z http://creativecommons.org/licenses/by-nc-nd/4.0/ item S2095-4956(15)00052-2 S2095495615000522 1-s2.0-S2095495615000522 10.1016/j.jechem.2015.08.005 286353 2017-03-03T00:09:22.182663-05:00 2015-09-01 2015-09-30 1-s2.0-S2095495615000522-main.pdf https://s3-eu-west-1.amazonaws.com/prod-ucs-content-store-eu-west/content/pii:S2095495615000522/MAIN/application/pdf/521294263af62fda63b4a73a4c889fe2/main.pdf https://s3.amazonaws.com/prod-ucs-content-store-us-east/content/pii:S2095495615000522/MAIN/application/pdf/521294263af62fda63b4a73a4c889fe2/main.pdf main.pdf pdf true 1551681 MAIN 13 1-s2.0-S2095495615000522-main_1.png https://s3-eu-west-1.amazonaws.com/prod-ucs-content-store-eu-west/content/pii:S2095495615000522/PREVIEW/image/png/04f8ef82731f7b95bd4adf90c529dab5/main_1.png https://s3.amazonaws.com/prod-ucs-content-store-us-east/content/pii:S2095495615000522/PREVIEW/image/png/04f8ef82731f7b95bd4adf90c529dab5/main_1.png main_1.png png 59719 849 656 IMAGE-WEB-PDF 1 1-s2.0-S2095495615000522-fx1.sml https://s3-eu-west-1.amazonaws.com/prod-ucs-content-store-eu-west/content/pii:S2095495615000522/fx1/THUMBNAIL/image/gif/3891915f60635933c8e17a6b2573bf5a/fx1.sml https://s3.amazonaws.com/prod-ucs-content-store-us-east/content/pii:S2095495615000522/fx1/THUMBNAIL/image/gif/3891915f60635933c8e17a6b2573bf5a/fx1.sml fx1 true fx1.sml sml 15829 128 219 IMAGE-THUMBNAIL 1-s2.0-S2095495615000522-gr1.sml https://s3-eu-west-1.amazonaws.com/prod-ucs-content-store-eu-west/content/pii:S2095495615000522/gr1/THUMBNAIL/image/gif/b9aeecdb4f9f52691f662ab537dcfd97/gr1.sml https://s3.amazonaws.com/prod-ucs-content-store-us-east/content/pii:S2095495615000522/gr1/THUMBNAIL/image/gif/b9aeecdb4f9f52691f662ab537dcfd97/gr1.sml gr1 gr1.sml sml 11379 138 219 IMAGE-THUMBNAIL 1-s2.0-S2095495615000522-gr2.sml https://s3-eu-west-1.amazonaws.com/prod-ucs-content-store-eu-west/content/pii:S2095495615000522/gr2/THUMBNAIL/image/gif/08bf597b898afd428a49901943b7cba8/gr2.sml https://s3.amazonaws.com/prod-ucs-content-store-us-east/content/pii:S2095495615000522/gr2/THUMBNAIL/image/gif/08bf597b898afd428a49901943b7cba8/gr2.sml gr2 gr2.sml sml 13139 139 219 IMAGE-THUMBNAIL 1-s2.0-S2095495615000522-gr3.sml https://s3-eu-west-1.amazonaws.com/prod-ucs-content-store-eu-west/content/pii:S2095495615000522/gr3/THUMBNAIL/image/gif/24ae6071cff5892e73de3b440254d9d7/gr3.sml https://s3.amazonaws.com/prod-ucs-content-store-us-east/content/pii:S2095495615000522/gr3/THUMBNAIL/image/gif/24ae6071cff5892e73de3b440254d9d7/gr3.sml gr3 gr3.sml sml 7689 57 219 IMAGE-THUMBNAIL 1-s2.0-S2095495615000522-gr4.sml https://s3-eu-west-1.amazonaws.com/prod-ucs-content-store-eu-west/content/pii:S2095495615000522/gr4/THUMBNAIL/image/gif/9fe05fc25ec8d505a9ca362591a2985a/gr4.sml https://s3.amazonaws.com/prod-ucs-content-store-us-east/content/pii:S2095495615000522/gr4/THUMBNAIL/image/gif/9fe05fc25ec8d505a9ca362591a2985a/gr4.sml gr4 gr4.sml sml 17645 164 204 IMAGE-THUMBNAIL 1-s2.0-S2095495615000522-fx1.jpg https://s3-eu-west-1.amazonaws.com/prod-ucs-content-store-eu-west/content/pii:S2095495615000522/fx1/DOWNSAMPLED/image/jpeg/73f45d1dacc74dea8d1c7c277b679993/fx1.jpg https://s3.amazonaws.com/prod-ucs-content-store-us-east/content/pii:S2095495615000522/fx1/DOWNSAMPLED/image/jpeg/73f45d1dacc74dea8d1c7c277b679993/fx1.jpg fx1 true fx1.jpg jpg 23336 200 341 IMAGE-DOWNSAMPLED 1-s2.0-S2095495615000522-gr1.jpg https://s3-eu-west-1.amazonaws.com/prod-ucs-content-store-eu-west/content/pii:S2095495615000522/gr1/DOWNSAMPLED/image/jpeg/89c364518e9eeaa1b16ffa66028972f3/gr1.jpg https://s3.amazonaws.com/prod-ucs-content-store-us-east/content/pii:S2095495615000522/gr1/DOWNSAMPLED/image/jpeg/89c364518e9eeaa1b16ffa66028972f3/gr1.jpg gr1 gr1.jpg jpg 48668 355 565 IMAGE-DOWNSAMPLED 1-s2.0-S2095495615000522-gr2.jpg https://s3-eu-west-1.amazonaws.com/prod-ucs-content-store-eu-west/content/pii:S2095495615000522/gr2/DOWNSAMPLED/image/jpeg/c0d735d7b02ba68658e8cf9853dbd874/gr2.jpg https://s3.amazonaws.com/prod-ucs-content-store-us-east/content/pii:S2095495615000522/gr2/DOWNSAMPLED/image/jpeg/c0d735d7b02ba68658e8cf9853dbd874/gr2.jpg gr2 gr2.jpg jpg 35473 250 393 IMAGE-DOWNSAMPLED 1-s2.0-S2095495615000522-gr3.jpg https://s3-eu-west-1.amazonaws.com/prod-ucs-content-store-eu-west/content/pii:S2095495615000522/gr3/DOWNSAMPLED/image/jpeg/9343fb3fe4deb6e7b9c34792f2f4dedb/gr3.jpg https://s3.amazonaws.com/prod-ucs-content-store-us-east/content/pii:S2095495615000522/gr3/DOWNSAMPLED/image/jpeg/9343fb3fe4deb6e7b9c34792f2f4dedb/gr3.jpg gr3 gr3.jpg jpg 18846 102 392 IMAGE-DOWNSAMPLED 1-s2.0-S2095495615000522-gr4.jpg https://s3-eu-west-1.amazonaws.com/prod-ucs-content-store-eu-west/content/pii:S2095495615000522/gr4/DOWNSAMPLED/image/jpeg/67efac4fdcb8189d36c24b5d9ab7f04a/gr4.jpg https://s3.amazonaws.com/prod-ucs-content-store-us-east/content/pii:S2095495615000522/gr4/DOWNSAMPLED/image/jpeg/67efac4fdcb8189d36c24b5d9ab7f04a/gr4.jpg gr4 gr4.jpg jpg 74867 394 489 IMAGE-DOWNSAMPLED 1-s2.0-S2095495615000522-fx1_lrg.jpg https://s3-eu-west-1.amazonaws.com/prod-ucs-content-store-eu-west/content/pii:S2095495615000522/fx1/HIGHRES/image/jpeg/1559b1667f8d36678a96278b07a9d12f/fx1_lrg.jpg https://s3.amazonaws.com/prod-ucs-content-store-us-east/content/pii:S2095495615000522/fx1/HIGHRES/image/jpeg/1559b1667f8d36678a96278b07a9d12f/fx1_lrg.jpg fx1 true fx1_lrg.jpg jpg 182064 886 1512 IMAGE-HIGH-RES 1-s2.0-S2095495615000522-gr1_lrg.jpg https://s3-eu-west-1.amazonaws.com/prod-ucs-content-store-eu-west/content/pii:S2095495615000522/gr1/HIGHRES/image/jpeg/8df8fe871fc083e0ae48a15c726aba51/gr1_lrg.jpg https://s3.amazonaws.com/prod-ucs-content-store-us-east/content/pii:S2095495615000522/gr1/HIGHRES/image/jpeg/8df8fe871fc083e0ae48a15c726aba51/gr1_lrg.jpg gr1 gr1_lrg.jpg jpg 337838 1571 2500 IMAGE-HIGH-RES 1-s2.0-S2095495615000522-gr2_lrg.jpg https://s3-eu-west-1.amazonaws.com/prod-ucs-content-store-eu-west/content/pii:S2095495615000522/gr2/HIGHRES/image/jpeg/10ca7710459921a82f6573fe76bab82e/gr2_lrg.jpg https://s3.amazonaws.com/prod-ucs-content-store-us-east/content/pii:S2095495615000522/gr2/HIGHRES/image/jpeg/10ca7710459921a82f6573fe76bab82e/gr2_lrg.jpg gr2 gr2_lrg.jpg jpg 301363 1105 1740 IMAGE-HIGH-RES 1-s2.0-S2095495615000522-gr3_lrg.jpg https://s3-eu-west-1.amazonaws.com/prod-ucs-content-store-eu-west/content/pii:S2095495615000522/gr3/HIGHRES/image/jpeg/de87dc1339d78bf8ba0cf9109fde929a/gr3_lrg.jpg https://s3.amazonaws.com/prod-ucs-content-store-us-east/content/pii:S2095495615000522/gr3/HIGHRES/image/jpeg/de87dc1339d78bf8ba0cf9109fde929a/gr3_lrg.jpg gr3 gr3_lrg.jpg jpg 140303 451 1737 IMAGE-HIGH-RES 1-s2.0-S2095495615000522-gr4_lrg.jpg https://s3-eu-west-1.amazonaws.com/prod-ucs-content-store-eu-west/content/pii:S2095495615000522/gr4/HIGHRES/image/jpeg/83ef3114a666a686a3314f29b5cc9289/gr4_lrg.jpg https://s3.amazonaws.com/prod-ucs-content-store-us-east/content/pii:S2095495615000522/gr4/HIGHRES/image/jpeg/83ef3114a666a686a3314f29b5cc9289/gr4_lrg.jpg gr4 gr4_lrg.jpg jpg 991466 1744 2167 IMAGE-HIGH-RES 1-s2.0-S2095495615000522-si1.gif https://s3-eu-west-1.amazonaws.com/prod-ucs-content-store-eu-west/content/pii:S2095495615000522/STRIPIN/image/gif/813bd42f3667dc2d701e645b4d349ebc/si1.gif https://s3.amazonaws.com/prod-ucs-content-store-us-east/content/pii:S2095495615000522/STRIPIN/image/gif/813bd42f3667dc2d701e645b4d349ebc/si1.gif si1 si1.gif gif 545 18 97 ALTIMG 1-s2.0-S2095495615000522-si2.gif https://s3-eu-west-1.amazonaws.com/prod-ucs-content-store-eu-west/content/pii:S2095495615000522/STRIPIN/image/gif/934c63f0041063dd624d28354f7bb39b/si2.gif https://s3.amazonaws.com/prod-ucs-content-store-us-east/content/pii:S2095495615000522/STRIPIN/image/gif/934c63f0041063dd624d28354f7bb39b/si2.gif si2 si2.gif gif 388 17 61 ALTIMG 1-s2.0-S2095495615000522-si3.gif https://s3-eu-west-1.amazonaws.com/prod-ucs-content-store-eu-west/content/pii:S2095495615000522/STRIPIN/image/gif/c240dc959bf4fe726ee91feb5b4b0f21/si3.gif https://s3.amazonaws.com/prod-ucs-content-store-us-east/content/pii:S2095495615000522/STRIPIN/image/gif/c240dc959bf4fe726ee91feb5b4b0f21/si3.gif si3 si3.gif gif 278 17 46 ALTIMG JECHEM 29 S2095-4956(15)00052-2 10.1016/j.jechem.2015.08.005 Science Press and Dalian Institute of Chemical Physics Fig. 1 The solar (bio)refinery concept for chemical energy storage science and technologies. Modified from the original presented by Schlögl [27]. Fig 1 Fig. 2 Methanol at the crossover of new energy-chemistry nexus: paths to produce methanol and main routes to produce fuels and chemicals from methanol. Fig 2 Fig. 3 Energy chain and the role of chemistry to enable a sustainable energy production and use. Adapted from Ref. [1a]. Fig 3 Fig. 4 Scheme of the current and under development catalytic routes for indirect and direct conversion of methane. Adapted from Abate et al. [1b]. Fig 4 Table 1 Emissions produced by 1 kWh of electricity based on life-cycle analysis (LCA). Adapted from Ref. [8]. Table 1 Energy source GHG emissions ( g C O 2 eq / kWh ) SO2 emissions (mg/kWh) NO x emissions (mg/kWh) NMVOC a (mg/kWh) Particulate matter (g/kWh) Hydropower 2–50 5–60 3–40 0 5 Wind 5–120 20–90 15–50 0 5–35 Solar photovoltaic 10–730 25–500 15–340 70 10–190 Biomass forestry waste combustion 15–200 15–150 700–2000 0 220–320 Natural gas (combined cycle) shale gas b 400–500 800–1000 4–500 13–1500 72–164 1–10 Extra-heavy oil, shale oil/tar sand b 700–1200 500–30,000 500–5000 20–30 30–500 Coal–modern plant 800–1200 700–30,000 700–5300 20–30 30–660 a NMVOC means non-methane volatile organic compounds. b Estimated. Perspective The energy-chemistry nexus: A vision of the future from sustainability perspective Salvatore Abate Gabriele Centi * Paola Lanzafame Siglinda Perathoner Department of DIECII, Section Industrial Chemistry, University of Messina, INSTM/CASPE (Laboratory of Catalysis for Sustainable Production and Energy) and ERIC aisbl (European Research Institute of Catalysis), V.le F. Stagno D'Alcontres 31, 98166 Messina, Italy Department of DIECII Section Industrial Chemistry University of Messina INSTM/CASPE (Laboratory of Catalysis for Sustainable Production and Energy) and ERIC aisbl (European Research Institute of Catalysis) V.le F. Stagno D'Alcontres 31 98166 Messina Italy * Corresponding author. The changing energy-chemistry nexus is discussed in this perspective paper about the future of sustainable energy and chemical production to identify the priorities and open issues on which focus research and development. Topics discussed regard (i) the new sustainable energy scenario, (ii) the role of energy storage (from smart grids to chemical storage of energy), (iii) the outlooks and role of solar (bio)refineries and solar fuels, (iv) how to integrate bio- and solar-refineries to move to new economy, (v) the role of methanol at the crossover of new energy-chemistry nexus, (vi) the role of chemistry in this new scenario, (vii) the role of nanomaterials for a sustainable energy, (viii) the use of nanocarbons to design advanced energy conversion and storage devices, and (ix) possibilities and routes to exploit solar energy and methane (shale gas). The contribution provides a glimpse of the emerging directions and routes with some elements about their possible role in the future scenario, but does not provide a detailed analysis of the state of the art in these directions. Graphical abstract A glimpse of the emerging directions and routes, priorities and open issues of the changing energy-chemistry nexus and scenario for sustainable energy and chemical production. Image, graphical abstract Keywords Energy Chemistry Future scenario Catalysis Sustainability 1 Introduction Energy and chemistry are at the core of our current society [1,2], but the nexus between them has not been often discussed specifically, neither how it is evolving in parallel to the changing scenario for a sustainable energy and chemistry. An analysis of these aspects and of the underlying vision for the future in this area (from a sustainability perspective) is necessary to identify new directions of research and opportunities for competiveness. We are in fact likely at the beginning of a transition to a new economy and production system. The evolution of industrial production is not linear, but shows a cyclic evolution [3]. In chemistry and energy production, most of the technologies and processes were developed over a half century ago, and are at the stage of maturity now. But new technologies, focused on the use of renewable resources and energy, are emerging and will constitute the backbone of the future economic cycle [3]. The transition to this new cycle, which is driven from the combined availability of new raw materials and technologies together with novel social demands, is quite fast, as shown for example about 60 years ago after the introduction of chemical processes based on olefins and of new refinery processes. It is thus necessary, from an industrial perspective, to understand and anticipate this transition, to maintain competiveness. A key element is to examine the changing energy-chemistry nexus to identify the priorities and open issues on which focus research and development. This perspective contribution, opening the change in editorial direction of Journal of Energy Chemistry (JEC), will address these issues to provide a basis for discussion on the strategic elements around which the journal aims to growth. It is indicated as vision, because it is mainly based on a thought and concept of the future model of sustainable energy and chemical production. Different opinions may exist on these aspects, but it is not the aim to discuss in depth them here, and analyze pro/cons of the various ideas. There is a general agreement that the use of alternative “green/sustainable and renewable” resources is at the core of this transition to a new economic cycle [4], even if fossil fuels are and will be still for at least the next two-three decades available at relatively low costs. However, it is an error to consider that for this reason there is no need to change the current energy and chemistry economy. It is the push to innovation and competiveness, combined with other driving factors (socio-environmental motivations, greenhouse gas–GHG–education, resource security and related motivations, creating new value chains and other aspects) that will determine the change. Enable the transition requires to insert the new technologies/processes within the current economic and productive infrastructure, in order to reduce the investments that otherwise will be too large. Drop-in products or processes, e.g. those inserting within the current energy-chemistry system largely depending on the use of fossil-fuels, are thus necessary. However, it is essential to change the current energy-chemistry nexus. Chemistry should provide new solutions, from materials to energy conversion and storage, to develop a more sustainable use of energy [1]. A closer integration between energy and chemistry is needed in many areas, to develop new effective models of biorefineries for example [5]. It is necessary to overcome through chemistry the use of energy mainly as thermal energy, including in chemical processes, with related thermodynamic limitations and exploit potentially more efficient routes such as the direct use of electrons and photons [5c]. In other words, it should be realize an energy intensification to parallel the more known concept of process intensification. A larger integration of solar energy within the energy-chemistry value chain going beyond the use of only photovoltaic cells is a compulsory step, requiring the development of new advanced energy materials. But extending the use to other renewable energy (RE) sources, from geothermy to wind energy, hydropower, etc., is another relevant element, which implementation requires also often chemistry solutions, for example to store and transport to long distance RE through suitable chemical energy vectors. An effective transition to a sustainable energy and chemistry future requires extending also the use of alternative fossil fuels, creating the new chemistry and processes for their clean utilization [5]. The future of chemistry will be likely based on an extended use of new raw materials going beyond the current oil-centric vision [5d]. These and other aspects are changing the energy-chemistry nexus and the future of sustainable energy and chemical production. They are core topics of JEC which aims to become a forum of discussion of these changes, the future scenario for energy chemistry and the related science and technology developments. 2 Moving to a new sustainable energy scenario In order to progress toward a sustainable energy production and use it is imperative to increase progressively the use of renewable (regenerative) energy (solar, wind, hydro, etc.), and in the transitory to increase the smarter use of biomass (e.g. use of biomass in more eco-efficient processes than simple combustion) [4,6]. In fact, on a LCA (life cycle analysis) basis [7,8] (Table 1), electrical energy generated from coal has an estimated impact about twice (in terms of grams of CO2 equivalent per kWh) than that of natural gas (but value for shale gas is higher), while RE sources (biomass, wind, solar photovoltaic-PV, hydro, etc.) have on the average an impact ten times lower than that of coal. The impact of extra-heavy crude, tar sands, shale oil is similar to coal, in some cases even worse on a LCA basis. There is also a proportional decrease in the emissions of pollutants such as NO x and SO x , and particulate matter as well. While it may be long discussed on the absolute values of these different energy technologies (recent technology development for PV cells for example, issues in biomass utilization-land change use for example, etc. have to be better considered), the trend is clear and demonstrated the need of moving to a new vision of production and use of energy, to contrast the natural trend in the expansion of demand related to the increasing population accessing to a large fruition of energy. Despite the international economic crisis and other issues, the global demand for RE continued to rise during last years. Renewable power generation continued to grow strongly, reaching almost 22% of the global mix in 2013, compared with 21% in 2012 and 18% in 2007 [9a]. Globally, renewable electricity generation is now on par with that of natural gas, which remained relatively stable in last years. Globally, wind power accounted for about 40% of renewable power capacity added recently, followed by hydropower and solar PV, each accounting for approximately 26% [10]. However, hydropower remains still the largest contribution to modern renewables. In year 2013, it accounted for nearly 75% of world renewable electricity generation (about 5 PWh) and estimations for year 2017 indicate still about 70% of about 6.4 PWh produced of worldwide renewable electricity [9]. It is interesting to observe that the expansion in the use of RE sources is larger than that expected from agencies such as IEA (International Energy Agency) about 10–15 years ago. For example, IEA predicted in its World Energy Outlook 2000 that non-hydro RE would comprise 3% of global energy by 2020. That benchmark was reached in 2008. This is due to an underestimation of the (i) capability of technology development, (ii) lowering in the costs of production (PV cells, wind powered devices, for example), (iii) governmental push in some countries, Germany for example, and (iv) other important factors. Between these, the investment costs. A distributed energy production such as the case of PV cells or wind powered devices requires relatively small investments per unit with respect to centralized systems (power plants, etc.) which find also an increasing social opposition. Although many units are necessary to reach the same capacity of a centralized unit, there are many more investors interested in the investment, differently from centralized units for which a quasi-monopoly system exists. As a consequence, when supported from governmental incentives, the rate of introduction of RE was faster than supposed. Clearly, a distributed energy generation system requires having an adequate grid system able to accept and distribute this RE to users. This is an element which development has not proceeded in parallel with the expansion of PV installations, and is now one of the critical bottlenecks for further expansion. A critical factor is also the decoupling between demand, research development and production. While Europe contributed to about 60% of the total cumulated PV installations in 2013, in contrast to China and Taiwan accounting for 13% of the total cumulated installations, the latter have a market share of about 70% of the worldwide shipments, with over 90% of the production based on old technologies (single or multi-crystalline modules) [9b]. A similar observation could be made on the difference between research intensity market shares. In addition, the predictions about the change in technology of PV cells also failed. While large advances in efficiencies have been made from technological sides (with peak efficiencies over 46% in multi-junction cells), the largest part of the market is still dominated from the first generation (silicon-based) cells and the change to more efficient cells is slower than initially forecasted [10]. IEA observed the decoupling between efficiency and marked perspectives [9b]. The lowest PV costs are not necessarily achieved with the highest efficiencies, and small improvements in efficiency can come at too high a cost to be worthwhile. Record cell efficiencies achieved on very small surface areas do not immediately translate into affordable commercial high-efficiency modules. Several PV-producing companies get in crisis having assumed a faster introduction of new generation PV cells. The market in RE has a dynamic partly decoupled from the advances in nanotechnology, because efficiency considerations have been predominant over cost-efficiency ones, a lesson that should be further considered in analyzing the priorities for the future. The actual limit in advanced countries to the further expansion in the production and use of RE is the passage to a smart grid system [11]. In fact, RE sources such as wind and solar produce electrical energy in a discontinuous and fluctuating way (over the day and the year), which matches only in part the fluctuating energy demand. This causes destabilization of the electric grids with potential blackouts, weakening voltage and damage to industrial equipment [12]. Smart grids [11] incorporate in principle different technologies for energy storage, from novel advanced batteries (including flow batteries) to traditional systems such as pumped hydro and compressed air energy storage. These storage devices are characterized from different energy storage capacity, power output and discharge time to balance the mismatch between supply and demand, but there are critical aspects regarding the long-term storage and long-distance distribution. Today a significant fraction of the potential RE (by wind, in particular) is lost because cannot be introduced in the grid. These aspects will be discussed in a more detail in the next section, because it is necessary to introduce shortly before other elements. Different energy scenarios have been proposed in literature, for example by Shaahid et al. [13], Cosmi et al. [14], da Silva et al. [15], Ghahadan and Koomey [16]. These approaches rarely start from the analysis of the technological possibilities and constrains, having thus limits in the predictions. On the other hand, the analysis of the possible energy scenarios [6] is a key element to identify how de-bottlenecking the system to accelerate the introduction of sustainable energy as well as to recognize earlier the possible “game changer” technologies. An important element to consider in this analysis, although often missing, is that it is necessary to guarantee a smooth transition to the new energy system. The use of biomass and non-conventional fossil fuels plays a relevant role from this perspective [1,4,6]. However, there are other relevant elements not always recognized, such as how to trade, distribute and store RE on a world scale, as currently occurs with oil and derivate energy vectors. This objective cannot be reached even with long distance smart grids, but can be realized by chemical energy storage, particularly in the form of liquid fuels. The relevance of these aspects becomes critical, when substitution of the use of fossil fuels by RE sources becomes higher than about 40%. There are various countries aiming to higher targets within few years Denmark has the target to arrive within 2050 to the complete elimination of importing fossil fuels, using a mix of RE produced mainly by wind and biogas. Germany is also planning to get 80% of its energy from RE by 2050. Other countries in Europe will also move in this direction, although with a slower speed. Other countries in the word have instead different targets: (i) to become net energy exporter based on oil and gas (shale gas) own resources (US), (ii) to exploit own biomass (Brazil, Argentina) or (iii) coal (China) resources. In general, there are different regional scenarios to pass from an oil-centric vision (based on an extensive energy trading) to a future where the exploitation of own resources will be a dominant factor. Energy cost and security are driving elements to proceed in this direction, but it is clear that when fossil fuels or biomass resources are not sufficient to supply the regional demand, RE and in particular solar energy are the necessary pushing factors to proceed along energy independency. If the irradiance on only 1% of the Earth's surface could be converted into electric energy with 10% efficiency, it would provide a resource base of 105 TW, e.g. ten times the estimated world energy increase by year 2050. The use of solar irradiation is thus a necessary factor to meet a RE scenario and energy independency. This target requires developing in a synergetic way different technologies, from energy generation to conversion and storage. Energy is need for different purpose, from mobility to industrial and residential use. There are different requirements in terms of energy density for these applications that should be considered in looking at the energy scenario. We may comment that the chemical storage of energy (in the form of liquid fuels) will remain a technology outperforming the energy density in batteries, even considering the possible future developments in terms of energy materials [17–19]. Liquid fuels will remain in the future, in our opinion, an essential component for mobility requiring high energy density vectors. These liquid fuels could derive from different sources, biomass or solar fuels (see later). 3 Energy storage: from smart grids to chemical storage of energy Energy needs to be stored to match demand, as introduced before. Smart grids use a combination of different devices and regulatory tools [20] to meet this goal requiring to create a hierarchy of storage solutions which different in terms of energy storage capacity and time. Although a single definition of smart grid does not exist, it is commonly accepted that comprises a broad range of technology solutions that optimize the energy value chain [21]. There are various key elements in a smart grid: (i) distributed and centralized energy production systems, (ii) storage systems with different time of operation and power to compensate positive and negative fluctuations in the energy consumption and demand, (iii) a grid to distribute the energy and a management system to control all. A smart grid is a necessary next-step for the future energy infrastructure and will be the backbone of the future decarbonized power system. Energy storage devices are the key element, which allow the implementation of this vision, but still many challenges exist to raise the performances of these devices (batteries, for example) to the requested performances. The extension of smart grid concept is a general intelligent system able to optimize the energy production and use at a regional/country level and which extends beyond the electrical grid by including the natural gas network, etc. A part of this vision is related to the development of technologies and device which enable trading of energy at a long distance, e.g. > of about 500–1000 km. Transport of electrical energy requires a grid, and it is not efficient over long distances. Conversion of electrical to chemical energy allows a better and more efficient transport at long distance, and the storage of energy for rather long times. In terms of smart grid, this solution enables also to import (and trade on world scale) the RE produced in remote areas. This is a key aspect missed to how limit their vision to extended smart grids. In fact, the transition to a new sustainable energy system requires to implement an energy system at least equivalent in functionality to that actually present. This is largely oil-centric for one specific reason: the easy possibility of storage and transport to long distance of oil and derivate energy vectors. Natural gas is cleaner than oil, but being a gas has technical limits in storage and in the transport out of a grid. Coal is a cheaper fossil fuel than oil in several countries, although has a higher environmental impact as shown also in Table 1. In addition, the transport of coal and storage in open air creates additional problems related to dust emissions. For this reason, conversion to liquid fuels or chemical (methanol, for example, as discussed later) is an effective and clean option for its larger use. The world scale implementation of a sustainable energy system based on RE demands to develop RE vectors equivalent to those actually in use, e.g. with high energy density, relatively safe in use, easy to transport and store. This is the main motivation to develop liquid solar fuels. To note that often H2 is indicated as solar fuel, but does not has the characteristics indicated above. Methane produced from CO2 reduction is also indicated as solar fuel, when produced for example from excess wind electrical energy (power to gas process). However, also this fuel fails to have the characteristics indicated above, even if may be find use in some energy storage situations (it is actually largely push in Germany). It should be also remarked that there is a large untapped hydropower potential. The global technically exploitable hydropower potential is estimated at more than 16.4 PWh per year, e.g. over 80% of the potential is still unexploited [22]. A large part of this potential can be utilized only when effective ways to transport this RE to long-distances (>500 km) are developed. This solution offers the great opportunity to combine a cost-effective increase in generation capacity to the diversification of energy sources and thus better energy security. Deserts and arid regions offer also a large, unexploited potential for large-scale generation of RE (PV, wind), which can be effectively exploited only when the transport to long-distance of the produced electrical energy is solved. The cost of production of electrical energy by wind and by solar photovoltaic (PV) panels is rapidly falling and in desert/arid areas, where density of population and fauna is limited, the impact on land and environment is reduced. Finally, the conversion of electrical to chemical energy, by synthetizing liquid energy vectors such as methanol, allows solving the issue of intermittency in energy generation by wind and solar PV panels. The potential of wind and solar energy production costing less than 50€/MWh (in 2050) was estimated to be over 10 PWh [23]. Assuming that only a fraction of this potential RE can be exploited, there is still a potential of over 10 PWh/year of electrical energy which can be produced from unexploited renewable sources and which use can be enabled from the development of effective technologies to store and transport the RE using suitable energy vectors. These should well integrate within the actual energy (and chemical) production chain to avoid the costs and time related to changing the actual infrastructure. In addition, electrical energy accounts for about one third of global consumption of energy today, while RE sources produce mainly electrical energy as output. Converting electrical to chemical energy by producing suitable energy vectors allows a more flexible use of energy in different applications (transport, residential, industry, etc.). Suitable energy vectors can be used also as base raw materials for the chemistry sector enabling a new low-carbon economy [24]. It is thus reasonable the estimation that within the next two decades about 10 PWh/year of additional RE could be exploited by enabling an effective route for electrical to chemical energy conversion to store and transport RE, and by integrating this possibility into an extended smart grid. In order to have an idea of the dimension of 10 PWh/year, we can indicate that the overall fuel and power consumption of European chemical industry is about 54 Mtoe, which correspond to about 63 TWh/h. The suffix Tera indicates 1012, while the suffix Peta indicates 1018. Enabling the trading of RE through the use of CO2 may be thus a game changer for the future sustainability of energy use, with relevant implications also on the smart grids, because part of the issue related to grid instability due to the discontinuous production of RE by solar panels and wind-powered devices are solved by a larger use of the conversion of electrical to chemical energy. 4 Toward solar (bio)refineries and solar fuels Chemical storage of energy will have an increasing role in the future of sustainable energy production and use [25], as discussed in the previous section. Solar fuels indicate generically those energy vectors which are produced using RE (not only limited to solar direct use) and thus utilized to store and transport RE [26]. Solar (bio)refineries [27] are a key part of this vision. Fig. 1 illustrates briefly the concept of solar (bio)refineries and the integration with the energy infrastructure. The flow chart of key components of a “solar (bio)refinery” indicates how hydrogen generation options can be combined with molecular precursors to form a couple of platform molecules. These can be further converted into useful classes of energy carriers in a similar way as that present today in refineries. Fig. 1 evidences the systemic character of chemical energy storage, the integration with biomass use, the need of a tight integration between fuels and chemicals production, and the interrelation with the energy systems. In other words, the energy-chemistry nexus introduced before. Enabling this vision for the future of a sustainable energy system requires to progress in many important scientific areas, some of them will be discussed later. The solar (bio)refinery provides a framework concept for chemical energy storage and integration of RE within bio-economy. Some of the elements will be integrated in the future to single devices (artificial leaf-like) [28], which lump together the different steps necessary today. For example: - a first step of generation of electrical energy (ee) (wind, hydro, solar photovoltaic-PV or thermal-CSP e.g. concentrated solar power, one method of solar thermal energy harvesting); - a second step of generation of H2 by water electrolysis (this can be at low temperature using PEM-polymer electrolyte membrane cells, or high temperature SOEC-solid oxide electrolyzer cell); - a third step of use of this renewable H2 (eventually after compression) in combination with CO2 to synthetize platform molecules that can be eventually further converted to drop-in refinery products or chemicals. The use of biomass well integrates into this vision, and the CO2 produced (each ton of bioethanol produced forms about one ton of high purity CO2) could be used as CO2 source [29]. The availability of large amounts of clean water is pre-requisite, a resource that may be scarce in future times. The solar refinery concept is based on the idea that the produced solar fuels are integrated within the existing infrastructure and technologies, but in perspective novel energy vectors can be introduced with better application characteristics than the pool of hydrocarbons derived from oil. In a long-term strategy, the function of charge separation and chemical conversion of storage molecules water and CO2 may be combined in single processes referred to as “artificial leaf” strategies [28]. Despite the impressive progress in these areas, still about two decades will be necessary to develop such systems to dimensions delivering grid-relevant amounts of energy. However, some aspects of the integration of bio- and solar-refineries [5] can be realized in a short term to provide an effective path for the transition to the new low-carbon and sustainable economy. 5 Integrating bio- and solar-refineries to move to new economy Lowering the impact on greenhouse gas (GHG) emissions, in addition to other motivations (energy security, promote rural living, etc.) is a major motivation for regulations and incentives for biofuel utilization. The possibility to further expand the use of biomass to move to a new (bio)economy is necessary to make a step forward in reducing GHG and environmental impact. Being large amounts of CO2 produced in fermentation processes [29], one of the key elements in biofuel production, the integration of renewable (solar) energy and CO2 reuse within biorefinery cycle is a crucial step forward. In fact, the transformation of CO2 to fuels allows to incorporate RE in the chemical energy of the fuel (or chemical), providing the more functional way to introduce RE into the energy and chemical value chain, while the direct use of electrical energy (the main actual output of RE sources) is not very effective for many constrains [24]. In addition, the conversion of CO2 using RE may also produce raw materials for chemistry, evidencing the nexus between energy-chemistry to move to a new low-carbon economy. Zhang [30a] remarked how the next generation biorefineries based on artificial photosynthesis could produce large amount chemicals from H2/electricity and CO2. Carbon dioxide utilization in integrated biorefineries was also discussed in detail by Sharifzadeh et al. [30b] . As an indication of the possible impact of integration of CO2 (re)use within a biorefinery scheme, it is possible to consider the integration of renewable methanol production within a second generation bioethanol production plant [31]. The CO2 produced from biological fermentation is send to a methanol synthesis unit, fed with hydrogen produced by electrolysis. The oxygen produced from the electrolysis, together with the heat deriving from the exothermic methanol synthesis unit is utilized in the biomass pretreatment unit (before the biological fermentation). Heat recovery from these units is used for the fermentation stage. The heat produced in the electrolysis may be recovered as well. This combined production of bioethanol and renewable methanol allows increasing the energy efficiency from about 66% to up to over 80%–85% (in preliminary estimations), with a parallel increase in the carbon efficiency of biomass utilization, e.g. a significant decrease of the carbon footprint of the process and of biofuels use [31]. This is well in agreement with Sharifzadeh et al. [30b] indications of the possibility to increase biomass to fuel conversion from 55% to 73%, when CO2 utilization is integrated in biorefinery. This scheme of integration, however, requires some technology development. It is necessary, for example, to use either novel low-temperature biomass treatments (operating below about 60–70 °C, for example using ionic liquids) or high-temperature electrolyzer (solid oxide electrolyzers, temperature of operations >600 °C) instead that the more conventional PEM-type electrolyzers operating at around 80 °C. However, it is evident that this is an interesting direction to progress to a more efficient use of bioethanol process. There are other main options to integrate solar (renewable) energy within a bio-refinery/-factory scheme: (i) Use of this energy to produce chemicals (or intermediates needed to produce the final chemicals, such as H2), either locally (in particular, exploiting the electrical energy which is in excess to that which can be introduced to the grid), or remote, where unexploited resources can be utilized. (ii) Use of light-active micro-organisms. Regarding the second option, there are two types of possibilities. The first regards synthetic enzymatic pathways for CO2 utilization powered by electricity, as proposed for example by Zhang et al. [32] and the second regards the use of microalgae [33]. The use of microalgae is still under active discussion regarding whether or not may be economically sustainable, but may be noted that large scale microalgae cultivations (in open ponds) are already in operations by many companies [33] and many R&D projects are running on large scale worldwide from years. Cost of production in open ponds, especially using seawater or wastewater, is lower than the cost to produce an equivalent biomass (on oil bases) [33]. High harvesting and downstream processing costs are aspects significantly improved recently [34]. New technologies of oil recovery avoid the need to concentrate from around 5% to over 99% the algae slurry to recover the algal oil. These technologies decrease largely energy and costs in algae downstream processing. By combining these advances with the full utilization of microalgae biomass, positive economics are possible, especially when the process is integrated with a specific value chain. Therefore, even if issues to solve still remain, there are many indications [33–39] about the sustainability of micro-algae process. One of the challenges is to analyze the opportunities offered by its integration within the bio-based production scheme [40] and how the use of CO2 and wastewater streams to grow the microalgae can combine improved economics, lower GHG emissions and improved water and waste management. There are various other possibilities of integration of CO2 utilization within bio-economy value chain to make a step-forward to an innovative, sustainable and inclusive bio-economy. They were discussed elsewhere [5,31] and will be thus only briefly remarked here. It should be pointed, however, that there are other possibilities of use of CO2 in chemical production, for example to produce polycarbonate, but which do not well integrate within the scheme of biorefineries. This is a fast evolving area of research, although few authors have analyzed in depth the various possibilities of integration of CO2 use within biorefineries. A key element, however, is the availability of renewable H2 (rH2), e.g. not using fossil fuels for the production (we exclude here nuclear energy mainly due to the low social acceptance). This is a determining element to enable CO2 reduction routes, but also relevant in several paths to produce chemicals and especially fuels from biomass. There are different possible routes: - bio-processes based on enzymes or bacteria, - solar thermal or using semiconductors, - advanced electrolysis coupled with renewable electrical energy, - catalytic either in gas or liquid phase using waste or byproducts streams from biomass transformation, - microbial electrolysis. It is out of the scope to discuss and compare here these routes. It should be remarked, however, that often data are missing for a true comparison and economic estimation, even if preliminary. From an applicative perspective, electrolysis using PEM (polymer electrolyte membrane) electrolyzers and aqueous phase reforming (APR) of waste streams are the only technologies exploitable today. The first can be competitive only when the cost of electrical energy is lower than about 5ȼ/kW, while the second requires developing still more stable and productive catalysts for real feeds rather than model compounds [41–46]. In both cases, however, H2 is produced under pressure (>30 bar), while almost other methods produce H2 at atmospheric pressure. Recompression of H2 to typical conditions of use (for CO2 reduction or biomass hydrogenation) makes further costly the process. In addition, productivities in most of the cases are still rather low. In bio-hydrogen, for example, one of the best enzymatic hydrogen production rates reported [47] in optimized conditions from mixed sugars was 54 mmo l H 2 /(L h). In photocatalysis, using sugars as sacrificial alcohols, productivities are lower or comparable at the best [48]. In APR reaction, an estimated productivity [49] is four to five times higher than that of enzymatic production. Virent BioForming process (DoE Working Group) for H2 production by APR claims a productivity of around 5–10 mo l H 2 /(L . h), thus about two order of magnitude higher than best enzymatic bio-H2 production rate, although at least one order of magnitude lower than current productivity in H2 production by methane steam reforming. Costs of H2 production from non-fossil-fuels are still at least twice higher than those from fossil-fuels, except when rather cheap electrical energy is available [50]. 6 Methanol: at the crossover of new energy-chemistry nexus Methanol is at the crossover of the new energy-chemistry nexus, because shows unique characteristics of flexibility, one of the characterizing requirements for the future energy-chemistry scenario. Methanol can be used both as (1) chemical and raw material for large-volume chemicals, and (2) fuel, both as blending component or to produce a range of other components for fuels. It may be produced both from (i) fossil fuels (methane, and from coal, the latter in rapid expansion in China) and (ii) non-fossil-fuel sources (residue/biomass/renewable + CO2). Methanol is thus one of the most important and versatile platform chemicals for chemical industry, but also a key element in the transformation to a sustainable energy future, for example to trade RE on world scale [50]. There are different pushes to promote methanol larger use: (i) to exploit coal in Asian region, (ii) to promote use of renewables in Europe, and (iii) to utilize shale gas in a more flexible way in United States. Methanol is one of the chemicals/fuels with the largest growing rate in the last decade, with its demand increasing, from about 35 MMT (million metric tons) in 2005 to over 70 MMT in 2015, nearly doubling the CAGR (compound annual growth rate) in the last 5 years with respect to the average in the decade before. A significant increase is shown by use to produce - formaldehyde, driven from expansion in polymers and resins particular in Asian market, - olefins (MTO/MPT processes) in the last few years, particularly in China, - DME (also especially in China), - gasoline/fuel/biodiesel (especially in Europe). An overview of the paths to produce methanol as well of the main routes to produce fuels and chemicals from methanol is reported in Fig. 2 which evidences how methanol it is at the crossroad between past and future, being a key element to allow an efficient transition to sustainable energy and chemistry. There is no other equivalent chemical with a so large range of possibilities of production from fossil and non-fossil sources and a so wide range of applications, from energy to chemical area, including a key role to allow an efficient transition to a low-carbon economy. In the area of energy and energy carriers (fuels), we may distinguish different paths of utilization of methanol: (1) As direct energy carrier (gas turbines, heat generation, DMFC) (2) As component of the fuel mix (direct blending in gasoline or diesel) (3) As energy storage/transport chemical (via CO2/rH2 conversion) (4) As raw material to produce other energy carriers (DME, gasoline by MTG) (5) As co-reactant to produce components of fuel mix (MTBE, TAME, biodiesel) Methanol and DME are key intermediate to produce liquid fuels (gasoline, kero and gasoil) by different routes which are currently investigated by many companies. DME can be synthetized either directly from syngas, or in a two-step process via methanol. The latter is the most used industrially. The methanol dehydration reaction to DME is catalyzed by acidic compounds such as γ-alumina, silica-alumina, zeolites (HZSM-5, NaHZSM-5, HY, Ferrierite) or meso-porous materials (MCM and SAPO families), or ZrO2. The main factors influencing the activity and selectivity are the acidic sites strength and the structural characteristics (e.g. pore size distribution). High acidity strength is undesirable, because it is further catalyzing the DME conversion to hydrocarbons. Therefore, the sites with medium acidity insure better performances. For this reason, creation of mesoporosity to improve diffusivity may enhance also deactivation, without a precise control of the type of acid sites created in the process. Methanol can be thus considered the ideal energy vector to guarantee a smooth and effective transition from the actual, oil-centric, energy system to the new, more sustainable energy future. Methanol use in chemical production is also of increasing relevance for the role of methanol as ideal transitional molecule between - the current use of fossil fuels, - the extended use of fossil fuels (coal and unconventional fossil fuels, and CO2 deriving from fossil fuels), - the use of new “renewable” raw materials (biomass and CO2, when the latter derives from biomass processes) and energy, including to introduce RE in the chemical industry and to trade on large scale RE. It may be distinguished different branches for chemical use of methanol: (i) the acetic acid branch, e.g. the production of acetic acid (and derivate) by carbonylation of methanol, (ii) the formaldehyde branch and (iii) the DME and olefin branch. DME can be converted (it is the intermediate when starting from methanol) in the MTO and derived (MTP) processes. Propylene (MPT) is of particular interest recently, due to shortage consequently to shift from naphtha to ethane in steam crackers. Adapting the MTO process (e.g. the catalyst), aromatics can be targets (MTA) as main product. MTO and analogous processes, including MTA, are emerging methanol demand segment. Olefin production from methanol/DME is fast growing particularly in China, with several plants completed or advanced stage of construction for a total capacity of over 18 MMT. Few of these are based on 2nd general processes which integrate a downstream stage to crack ≥C4 hydrocarbons to lighter one. An example is the second generation DMTO process developed by DICP (China) [51]. MTO process is characterized by a high selectivity and yield to light olefins, particularly on zeolite catalysts such as SAPO-34 giving >90% selectivity to C2–C4 olefins. Fast deactivation and exothermicity requires the use of a fluid bed reactor with continuous regeneration. A turbulent fluidized bed reactor offers operational advantages over the bubbling and fast fluidized bed due to the excellent catalyst−gas contact, high mass transfer efficiency, and large solids holdup. 7 The role of chemistry in this new scenario Chemistry will thus play a significant role in the arena of energy storage and energy chain, although the role is often hidden. Fig. 3 gives a schematic representation of this energy chain that in reality is a complex energy system with many interactions. There is a set of primary energy resources, processes and technologies for conversion, transport, storage and final uses of energy. Chemistry has a main role in many of the critical components of this energy chain, as schematically shown in Fig. 3 in terms of key elements to realize a sustainable energy production and use. We may further distinguish three main elements to realize a sustainable energy: (i) conservation, (ii) rational use of fossil fuels, and (iii) use of renewable sources. We have excluded here the use of nuclear energy being progressively banned in several countries. Chemistry is the strategic core discipline for the conversion processes based on solar energy, but it is indispensable to save energy in both production and use. Catalysis, in particular heterogeneous catalysis, is a key factor to develop novel or improved energy-saving processes and to reduce the resource intensity as well the impact on the environment. Improved nanomaterial are critical for energy saving and to enable more energy-efficient processes. Electrical energy storage in Li ion or redox flow batteries requires to understand many chemical aspects at the basis of a rational design of functional electrodes and storage materials. Next generation clean and energy-efficient technologies will emerge from new materials made available by emerging nanoscience and nanotechnologies [52]. Examples are materials that (i) maintain performances at extreme conditions, (ii) self-heal in harsh environments, (iii) lighter that steel but also stronger, (iv) convert sunlight or produce light more efficiently, (v) allow to save energy in separation processes, (vi) permit higher energy density storage, etc. The development in nanotechnology over the last decades allowed passing now from the lab scale to the commercial application, and we thus expect a boost in new materials with properties optimized to sustainable energy technology requirements. Addressing the energy challenge thus require a multidisciplinary approach and the identification of clear targets and R&D objectives, some of which are briefly summarized below according to the three main sectors cited before [1a]: – Energy saving e.g. reduce the energy and raw materials consumption by introducing new processes, materials and technologies. For example: (i) new more selective processes and/or that operate with lower energy consumption, (ii) new materials (for example, foams for improved thermal isolation, new materials to reduce car consumption – lighter materials substituting steel, nanostructured paints to increase the vehicle aerodynamic, tires with reduced friction, etc., solid-state lighting, e.g. LEDs, etc.), (iii) new technologies (for example, new materials to recover electrical energy from waste low-temperature streams or save energy in the conditioning of buildings). We may classify in this class also fuel cells, particularly low temperature proton exchange membrane fuel cells, also known as polymer electrolyte membrane (PEM) fuel cells, for mobile applications (cars, etc.), and high temperature solid oxide fuel cell (SOFC) for residential applications. The main objective of fuel cells, in fact, is to improve the efficiency in chemical to electrical energy. – Sustainable use of fossil fuels, with the introduction of new processes and technologies, which together with a further reduction of the impact of current refineries (only about half of the petroleum entering in a refinery is converted to valuable products, the remaining is used for the energy needs of refinery), allow the valorization in a sustainable approach of not- or less-conventional fossil fuels: (i) coal (for example, coal combustion integrated with emissions purification and CO2 sequestration/use; coal to liquid–CTL), (ii) shale gas and strained natural gas (NG), e.g. the large amounts of NG which are in remote areas and for which transport by pipelines or liquefaction is not convenient (for example, by converting to liquid fuels–GTL), (iii) extra-heavy oils, tar sand or oil shale, bitumen etc. for example developing new energy-effective membranes for O2 separation, which is used then for the combustion of these fractions – the air separation method by distillation used currently is very energy-intensive). – Use of RE resources, first of all solar energy by developing new (nanostructured) materials able to more efficiently harvest and convert light to electrical energy and in long-term to use solar energy to produce solar fuels. Within this area falls also that related to the use of biomass and in general to the development of a bio-based (energy efficient) economy [53]. A critical aspect for electrical energy is the difficult storage of electrons, and therefore this area includes the intense developments related to the improvement of e− storage (Li batteries, supercapacitors, etc.) [17,52,54]. In general, storage and transport (out of the grid) of the electrical energy is the critical issue which determines the need of developing suitable energy vectors, where chemistry plays a central role. Other forms of RE depend also in one or more aspects from the improved materials, which can be developed by chemistry. For example, rotor blade reinforced with carbon nanotubes allow to improve the performances of wind turbines. 8 Nanomaterials for a sustainable energy The development of novel and/or improved materials is a key element to realize the targets cited before, and a significant push has been given to this sector from the development of nanotechnologies. Nanomaterials are defined those which properties stem from their nanoscale dimensions. This dimension refers to the characteristic dimension of the functional units in the nanometer range. An interesting example showing how novel nanomaterials concepts contributes to develop improved devices and technologies for sustainable energy is given from the analysis of the role of the nano-architecture in the development of advanced electrodes [17,54–58]. There are several key technological areas of the energy sector, which require a better design of the electrode nanostructure to overcome current limits and/or move to new levels of their performances: (i) photo-electrochemical solar cells, (ii) water photoelectrolysis, (iii) photoelectrocatalytic devices for the conversion of CO2 to fuels, (iv) advanced Li-batteries, (v) supercapacitors, (vi) fuel cells, (vii) third generation photovoltaic cells and (viii) nanostructured thermoelectric devices. In all these electrodes, the common problem is how to control/optimize the mass and charge transport (i.e. electronic and ionic mobility), the electron-transfer kinetics in multi-phase boundaries, and the modifications on these processes, which occur upon application of a potential between the electrodes. Therefore, optimization of the performances requires the ability to control a complex reaction environment, where many kinetic aspects simultaneously concur in determining the performances. Many of these controlling aspects are size dependent. Recently, it was recognized that not only the nano-dimension would be relevant, but critical is also the nano-architecture of these materials. In general, there is a design problem related to find the optimal compromise between nanosize, nanoarchitecture, robustness and stability, and performances per unit weight or volume, together with a method of producing the electrode, which is cost-effective and scalable. The concept of hierarchical organized materials is a useful approach to reach the above objectives with the development of a multilevel 3D organization based on a host macrostructure, which allows the right tridimensional organization necessary for a fast mass-transport, for example. On this host macrostructure, a secondary guest micro- and/or nano-scale sub-structure is built in order to take advantage of the properties of nanometer-sized building blocks and micron-sized assemblies. Lithium-ion batteries (LIB) are rechargeable devices in which lithium (Li) ions move from the negative electrode to the positive electrode during discharge, and back when charging [59,60]. Unlike Li primary batteries (which are disposable), Li-ion cells use an intercalated Li compound as the electrode material instead of metallic Li. LIBs are common in consumer electronics, because have the best energy-to-weight ratios, no memory effect, and a slow loss of charge when not in use. Their relevance is increasing for military, electric vehicle, and aerospace applications, but the energy density storage should be further improved. Traditional electrode materials for LIBs are based on micrometer-sized materials which have both mixed electron and ion transport (for Li+), such as (i) layered metal oxides that have high redox potentials, and act as positive electrodes, and (ii) graphitic carbons capable of reversible uptake of Li at low potentials which act as negative electrodes. The use of nanostructured solid-state materials, due to the intimate nanoscale contact, allows not only increasing the power density, but also to enhance Li reversibility and thus life cycle. In fact, the cycle ability of Li+ ion transfer depends on the dimensional stability of the host material during insertion and deinsertion of Li+ ions. Mechanical stress occurs during charge/discharge cycles, causing cracks and finally loss of performances. The necessary breakthrough to increase specific storage capacities relies from one side on the in-depth understanding of the complex interface processes of the charge-carrying chemical species (Li) during discharge and charge of the battery, and from the other side on the development of synthetic procedures to prepare the nano-designed electrodes. Developing oriented nanostructures on a nanoscale is one of the directions of research actively explored. There are many advanced methods to prepare tailored hierarchical organized structures for electrodes. Ordered metal nanostructures with hierarchical porosity (macropores in combination with micro- or mesopores) can be prepared using colloidal crystals (or artificial opals), i.e. an ordered array of silica or polymer microspheres, as template on which the metal particles are deposited. By careful removal of the template material, it may be then obtained an ordered metal nanostructure. The extension of the concept of template synthesis for tailored nanomaterials is the synthesis of replica mesostructures by nanocasting. Nanocasting, using highly ordered mesoporous silica as a template, has brought forward incredible possibilities in preparation of novel mesostructured materials, and has led to a great number of ordered nanowire arrays with (i) small diameter (<10 nm), (ii) large surface areas (up to 2500 m2/g) and uniform mesopores (1.5–10 nm) diameter, (iii) tunable 2D or 3D mesostructures, (iv) controlled morphology such as spheres, rods, films, and monoliths and (v) different components including carbons, metals, metal oxides and metal sulfides. The method has been initially used in the preparation of ordered mesoporous carbon materials [61,62]. Recent breakthroughs in the preparation of porous materials have resulted in the development of methods for the preparation of mesoporous carbon materials with extremely high surface areas and ordered mesostructures. Current syntheses can be categorized as either hard-template or soft-template methods, but the synthesis essentially involves C precursor infiltration in the template pores, its carbonization, and subsequent template removal. Consecutive surface functionalization of the carbon materials obtained, for a further optimization of their characteristics is possible. The carbon replica material can be then also the template for other replica materials. The nanocasting method can be used for preparation of a variety of mesostructured and mesoporous materials, including mesostructured metal and semiconductor nanowires. Although powerful, the nanocasting method has limits in terms of cost and scale-up. The alternative approach is based on the synthesis of small-size particle units using the various available physico-chemical methods, such as colloidal, sol–gel and micelle methods as well as other wet or gas phase procedures. These nanounits may be then organized in 2D and 3D super-structures by self- or directed-assembling, seeded or field-induced growth, epitaxial growth or other nano-structuring procedures. An interesting area in fast development is also that of assisting the self-assembling (in particular, to avoid a fractal-type growth) by an electrical field. An example of these electrochemical methods is the anodic oxidation. The electrical field created at the interface between the electrode and electrolyte is a powerful factor for orientation of nanostructure growth. There are several other methods to prepare nanotailored materials for energy application, and the above discussion was not finalized to discuss exhaustively the topic, but to give a glimpse of the possibilities. This is a very fast emerging area of chemistry S&T with high relevance to produce new sustainable solutions for energy. 9 Nanocarbons to design advanced energy conversion and storage devices In order to evidence in a more detail the role of nano-tech materials to enable the development of new devices for energy conversion and storage, and to allow the transition to a sustainable energy system, it is useful to briefly discuss the specific case of nanocarbons. Carbon materials play a limited role in a fossil fuel dominated energy scenario, but their importance is increasing progressively to the moving to this new energy scenario and the need of our society for a distributed and transportable high-density energy. Graphite is the mostly used anode materials in the commercialized lithium ion batteries. Activated carbon remains the only active materials for supercapacitors, and carbon black the support for electrocatalysts in fuel cells. All these are energy conversion and storage devices that can be transferred into a solar energy-based future energy scenario, however, their performances are below the requirements for a non-fossil energy based society in which not only cellar phone, laptop or cars but also power station, long-distance transport, lighting and heating needs to be powered. This future energy scenario is the driving force for the current activities in carbon materials research for energy and chemical synthesis application [58,63,64]. The motivations for the choice of carbon are many: carbon is cheaper, abundant, environmental friendly, and carbon with its various bonding states and allotropes allows a derivation of a family of new carbon materials, the basis of the so-called nanocarbon science. These nanocarbon materials are foreseen to play a special role in the future energy scenario that the classical carbon cannot have. Comparing to conventional energy materials, carbon nanomaterials possess unique size-/surface-dependent (e.g., morphology, electrical, optical, and mechanical) properties that allow a step-forward in enhancing the energy-conversion and storage performances. The basic members of the new carbon family are fullerene, graphene, and carbon nanotube (CNTs). Derived from them are carbon quantum dots, nanohorn, nanofiber, nano ribbon, nanocapsulate, nanocage and other nanomorphology. The common advantages of these new carbon materials are their low dimension, specific morphology and the morphology-defined properties. All sp2-hybridization derived nanocarbon are well ordered and possess a long-range ordering, but they differ from classical bulk graphite. The nano-dimension with the specific morphology gives them physical and chemical properties that other classical carbons do not have: high electroconductivity, good thermal conductivity, and outstanding mechanical properties. It is possible to tailor the electronic structure by introducing heteroatoms, to adapt the physical property by controlling the pore structure, and to change the chemical property by introducing functional groups on the surface. In this way it is possible to introduce a level of control in the characteristics of these materials not possible in other systems. Another important characteristic of the new carbon materials is the possibility to design and architecture hybrid or composite materials [18]. An interesting example, with large interest to develop improved systems for producing solar fuels, is given from TiO2-nanocarbons (CNTs, graphene, etc.) hybrids [65,66]. TiO2 nanoparticles deposited over graphene (which acts as electron acceptor) show an enhanced charge separation and improved performances in water photoelectrolysis. Nanocarbon can act also as electron donors, i.e. photosensitizers (carbon quantum dots). The intrinsic properties of TiO2 may also change by this interaction with nanocarbons and the creation of hybrid materials. As a consequence, these hybrid nanomaterials show several potential advantages in photochemical application, due to the different modalities in which nanocarbon can modify the TiO2 properties. Nanocarbons can 1. transfer electrons into the inorganic compound and so act as a photosensitizer in extending the absorption range; 2. accept photoexcited electrons from the inorganic compound, thus separating them from the photoactive holes; 3. conduct away excess heat during the catalytic reaction; 4. act as a template and heat sink to stabilize smaller catalyst particles whose larger specific surface area can convert more reactant molecules; 5. reduce the amount of active catalyst, decrease their weight and improve cyclability and overall lifetime. In most cases, the obtained hybrid or composite materials with hierarchical structure have a strong synergistic effort combining the advantage of the two building blocks. On the other hand, only a careful control in the preparation and nature of the hybrid material allows exploiting these potential characteristics. Another interesting example is that of the carbon–carbon hybrids composed by different type of nanocarbons. For example, zero-, one-, and two-dimensional nanostructured carbon allotropes, i.e., fullerenes, SWCNT and graphenes in combination with electron-donating conjugated molecules are promising building blocks for artificial photosynthesis and solar energy conversion [67]. In porphyrin–fullerene linked dyads, efficient photoinduced electron transfer occurs to yield the charge-separated state in competition with the decay of the excited states to the ground state. Moderate length-spacers between donor (porphyrin) and acceptor (fullerenes) are essential to produce a long-lived charge-separated state efficiently. However, in a solid material or when these dyads are deposited over a surface, intermolecular direct quenching between different dyads dominates the overall performances, if not a highly diluted system is realized. The use of these systems requires thus to create a superstructure which avoids/minimize from one side these effects allowing at the same time a high density of dyads to improve productivity and overall performances. One of the possibilities is to realize supramolecular hybridization of SWCNT with fullerenes [67]. SWCNT can act as both electron-acceptor and -donor in the SWCNT–fullerene composites, and also act as efficient wire on the charge-transporting properties. In this way, devices could be realized having well dispersed linked dyads (minimizing their direct interaction) over a substrate using the SWCNT as backbone and at the same time wire to improve the electrical communication between the dyads and the collecting substrate [67]. These materials are promising to develop new artificial photosynthesis devices and solar cells. A different interesting possibility is the development of advanced Z-schemes for water splitting [68]. One of the main approaches for achieving water splitting using visible light is to apply a two-step photoexcitation mechanism between two different photocatalysts. This process was inspired by natural photosynthesis in green plants and is known as Z-scheme. In two-step systems, the water splitting reaction is broken up into two stages: one for H2 evolution and the other for O2 evolution; these are combined by using a shuttle redox couple (Red/Ox, for example the I3 −/I− pair) in the solution. Over a H2 evolution photocatalyst, the photoexcited electrons reduce water to H2 and holes in the valence band oxidize the reductant (Red) to an oxidant (Ox). The oxidant is reduced back to the reductant by photoexcited electrons generated over an O2 evolution photocatalyst, where the holes oxidize water to O2. This system lowers the energy required for photocatalysis, allowing visible light to be utilized more efficiently than in conventional water-splitting systems. The use of solutions has a number of practical problems to realize solar cells (sealing, light scattering, etc.). A recent interesting development is based the use of photoreduced graphene oxide as a solid electron mediator for water splitting in the Z-scheme photocatalysis system [69]. The graphene sheet can shuttle photogenerated electrons from an O2-evolving photocatalyst (BiVO4) to a H2-evolving photocatalyst (Ru/SrTiO3:Rh), triplicating the consumption of electron–hole pairs in the water splitting reaction under visible-light irradiation. These examples show the potential to use advanced hybrid nanoarchitectures based on nanocarbons for producing solar fuels. 10 Exploiting solar energy Enabling the new proposed sustainable energy scenario requires also improving the current performances of solar cells by a better design of nanostructure to optimize the light harvesting and efficiency in the conversion to electrical energy at cost-competitive conditions. In fact, current new generation photovoltaic (PV) cell (multi-junction devices) already allow to obtain high conversion yields up to 40%, but the costs are too high and commercially solar cells (based on crystalline or amorphous Si) ensure 12%–18% yields. There are also some other constrains in silicon solar panels related to their architectural integration. They are dark in color, rigid and should be positioned at 45° to the incidence of sunlight for optimum efficiency. The maximum theoretical efficiency of a single solar cell is limited to 33%, but this limit could be overcome using multiple cells, with varying band gaps, in a serial (tandem) arrangement. The first generation of PV cells was based upon silicon wafers, in which material costs accounted for over 70% of the total cost, and overall efficiency was of around 20%. Thin-film techniques were used in the second generation of PV cells. The primary benefit is a reduction in production costs at the expenses of efficiency limited to between 5% and 10%. So-called third generation PV cells seek to achieve efficiencies greater than 50% [70,71], with the hope of approaching the thermodynamic limit of 93%, without radically changing the manufacturing process of second-generation cells. If manufacturing costs can be kept comparable to those of thin film cells, and efficiency greatly improved, then the overall cost per kWh can be dramatically decreased. The operation principle of a PV cell is apparently simple. When a photon with energy higher than the band gap of absorber material hits a p–n junction, it creates an electron hole pair and due to the inbuilt electric field, photo-produced carriers are transported to the electrodes. Thus for making a solar cell, the basic requirements are an absorber material and a junction with an electric field that assists the transport of the photo-generated carriers to the electrodes. There is also a probability that photo-generated carriers can recombine before reaching the electrodes. Therefore, the charge separation time of photo generated carriers must be smaller than the minority carrier lifetime for crystalline and polycrystalline solar cells. The energy associated to photons greater than the energy band gap of silicon is converted into heat. This is one of the reasons of the limit in the efficiency. In tandem solar cells [72], already used for manufacturing amorphous silicon solar cells and III–V-based high efficiency concentrator solar cells, materials with different band-gaps are used to improve this efficiency. In multiple-junction solar cells, several different materials are used to reach efficiencies up to 40%–42%, but with exponentially increasing costs. A different approach is based on the use of nanostructures to build new highly efficient solar cells, based on the following concept: - Hot carriers generated by absorbing photons of energy more than the energy band gap can be employed to generate additional current and or voltage. - Energy states in the energy band gap can be used to trap carriers generated from photon of energy lower than the energy band gap. Various approaches based on one-, two-, and three-dimensional nanostructures (quantum dots and semiconductor nanocrystals) are currently investigated [73]. For example, well-ordered arrays of nanopillars in Si, to be used as the inorganic semiconductor-phase in bulk-heterojunction PV cells, could be prepared by nanocasting. The method could be extended to develop nanocrystals-based tandem solar cells, based also on other semiconductors. It was also shown recently that it is also possible to fabricate highly ordered nanopillar-based solar-cell modules on flexible substrates using techniques compatible with roll-to-roll processing, which potentially brings down costs [74]. It is thus an area in fast expansion, which is driven from the increasing knowledge in nanotechnology and chemistry of nanomaterials. A different approach in third-generation solar cells is that of the dye-sensitized solar cells (DSSCs, often indicated as Grätzel-type cells) [75] and of organic and conductive polymers, in particular to develop ultra-low-cost solar cells. DSSCs utilize three main components to perform photo-electro conversion: a metal oxide semiconductor (TiO2), dye and an electrolyte. A dye is used to create electron hole pairs and other two materials transport these photogenerated charge carriers to the electrodes. The best efficiency reported is about 11%–12%, and still a number of technical problems have to be solved, in terms of electrolyte, stability, sealing, etc. However, there are a number of aspects making attracting these materials, besides the potential to decrease the cost of production: lightness, transparency and flexibility, possibility to deposit on any surface (including fabrics), possibility to produce in different colors, varying the chemical nature of the dye sensitizer. These PV devices thus have high potential in terms of adaptability and integration with the environment and architecture, for example, the creation of PV windows or roofs in historic centers. 11 Exploiting methane Availability and low cost of shale-gas is another of the elements which determine the future energy and chemistry scenario, although it is still under discussion which effective impact will have [1b,76,77]. Natural gas (methane) catalytic conversion to liquid fuels or chemicals is an active research line. Pearl GTL (gas-to-liquid) (Shell, Qatar) is an example of large plant (140.000 barrels a day) to convert methane to middle distillate, based on the use of cobalt-based catalysts for Fisher-Tropsch reaction. Around one third of natural gas resources (NG) are defined as stranded, e.g. not usable because too far to be introduced in NG pipeline network or because they cannot be transported by liquefaction. GTL is one possibility to convert these resources to a liquid fuel (diesel) for the market. Notwithstanding the high expectation, this solution has not be spread over the specific Qatar situation, due to the need to have very large gas fields, the high costs of operation and other issues. There is thus still the need to develop novel catalytic solutions able to produce liquid fuels, may be alternative to middle distillate, which apply to small-medium size stranded gas fields. The need to produce syngas from NG is a significant part of the cost in GTL process, around one third of the total cost. Therefore, the solution for small-middle scale conversion of methane is its direct conversion (e.g. without passing from syngas), to produce directly fuels such as methanol, DME (dimethylether), aromatics. There is a large attempt to develop novel catalysts to develop these novel direct routes for the selective conversion of methane, as summarized in Fig. 4 . On the other hand, the possibility to reduce energy use and costs of the production of syngas, for example by introduction of new process schemes based on the integration of membranes, is a valuable option particularly for small-medium size applications [78]. Although some of the routes summarized in Fig. 4 are known from several years (oxidative coupling of methane, OCM, for example), the changing landscape in methane cost due to availability of shale gas, the competiveness push to develop new solutions to enter into a highly competitive market (particularly for venture capital companies) and novel scientific advances in both homogeneous and heterogeneous catalysts, and bio-catalysts as well, have largely stimulate both scientific and industrial interest in this area [79–81]. For example, a number of companies (for example, Chevron, Exxon Mobil, Shell, Honeywell–UOP, etc.) are actively investigating the possibility to develop a commercially viable gas-to-ethylene process. Various other companies are looking to the other processes indicated in Fig. 4. Various novel companies are exploring unconventional solutions to address this challenging area, like as examples: (i) Siluria Technologies that is using virus-based templates to guide the growth of nanowire inorganic catalysts for OCM reaction; (ii) Synfuels that is developing a process in which methane is transformed to acetylene in a pyrolysis reactor and then in a liquid phase hydrogenation acetylene is converted to ethylene; (iii) Calysta Energy Inc. that is developing novel biocatalytic routes of methane fermentation to produce various chemicals, including lactic acid (building block for NatureWorks Ingeo™ lactide intermediates and polymers used in consumer and industrial products worldwide). Also the traditional area of syngas production (a raising market expected to grow at a CAGR of 8.7%, over the next 5 years to reach 117,400 MW thermal by 2018) characterized by many technology licensors (Air Liquide, Haldor Topsoe, Air Products & Chemicals, KBR, Siemens, MHI and Foster Wheeler among several others), shows many new attracting directions of development (listed in Fig. 4) to improve energy efficiency of the process. There is a return of interest, both at academic and industrial level, on OCM reaction. The alternative route via halomethane has some practical interest, but also severe limitations for exploitation, due to the difficulties and safety aspects related to the use of large amounts of halogen compounds [80,82]. The route of methane pyrolysis and hydrogenation has also various limits in exploitation, although actively pushed from the company Synfuels. Catalytic methane decomposition is mainly dedicated to specific niche applications. The presence of mixed homogeneous-heterogeneous reactions in OCM is still a main issue that determines not only severe problems in scale-up of traditional reactors, but also in approaching the reaction in microreactors. Attempts to combine the exothermic OCM reaction with endothermic steam reforming (SR) reaction appear conceptually a very valid option to operate in autothermal conditions and thus improve energy efficiency of the whole process. However, the implementation of this concept still shows severe technical issues. Another emerging route is related to the use of non-thermal plasma, in the various different possible options to generate the plasma [83]. This approach presents a conceptual change of paradigm, from the issue of methane activation (or simultaneous CO2 and/or H2O activation) to the control of selectivity in the pathway of catalytic further conversion. In fact, the plasma is able to activate in very mild conditions (close to room temperature) these molecules and generate very active (mainly radical-type) species. The challenge is thus to design specific catalysts able to operate with these reactive species (without quenching them) and convert them (selectively) to the target products. Up to now, catalysts and catalyst-plasma (hybrid plasma) interaction has been not enough considered from these perspectives, which open very interesting possibilities to move plasma-based process from mainly lab-scale to industrialization. The use of metal transition in zeolites (Zn, Cu, Ga, etc.) is opening new rather interesting possibilities for new gas and liquid phase transformations of methane to products such as methanol, olefins etc. [84–86]. However, productivity is a main issue and still a clear route to overcome this problem has not been identified. In addition, still different reaction conditions and temperatures are necessary to close the catalytic cycle, although modern reactor technologies can solve this issue. Thus, enhance productivity is the key aspect to be solved. There are also various approaches reported in literature using alternative oxidants that O2 (H2O2, N2O, etc.) [87]. However, in most of the latter cases, even the basic economic conditions to explore industrial feasibility are not present. The same is valid for some “dream” reactions, such as the direct conversion of CH4 and CO2 to acetic acid on metal-containing zeolites [88]. Main environmental and technical limits also hinder exploitability of approaches using fuming sulfuric acid (Periana-type catalysts) or superacids such AlBr3–HBr. Studies continue in this directly also very recently, although not addressing the effective key limits for exploitability of these routes. Biocatalytic routes is one of the growing area with very interesting perspectives, also taking into account the significant progresses made in the reaction mechanism [89]. The key for exploitability is to enhance productivity. The combination with solid (photo)catalysts to enhance the rate of reaction and/or close the cycle is one of the (slowly) emerging areas, but that likely will play a critical role in the future, perhaps in combination with suitable “vector molecules” that can enhance methane solubility in aqueous media. The use of solar energy, to supply the heat necessary in endothermic reactions (such as methane reforming) or to induce redox changes in oxides to perform thermochemical cycles for converting methane is a potentially interesting route, but also suffering of severe limits in moving from pilot units to exploitation [90,91]. An emerging possibility is instead to use molten salts as heat-transfer and storage medium [92]. This valuable route will likely find application in a near future. Similar, the integration of membrane in the process schemes to: - produce syngas from methane, - control methane partial oxidation, - improve H2 recovery, is an emerging routes, that will soon pass from pilot to exploitation phase. It may be briefly mentioned that chemical looping [93] also show increasing interest as alternative solution, even though cost is still high. Dry reforming of methane, stimulated from the idea of converting two greenhouse gases (CH4 and CO2) to useful products (syngas), has attracted a very intense research interest in the last years [94,95]. There are some possibilities of industrialization, but in general, other methane conversion routes are preferable from the energy perspective. In specific cases, such as the conversion of biogas containing a mixture of methane and carbon dioxide, this could be a valuable option. It is necessary to turn the perspective of approaching this reaction, and thus related catalysts needs. The use of non-thermal plasma is one of the interesting possibilities, because allow in particular to develop energy-efficient processes on small-medium scale, well suited for applications such as in converting biogas. Biogas, for the possibility to utilize waste resources, is one of the key elements shaping the future of RE [96]. Actual forecast are of a rapid extension of digestors and biogas production that will require the possibility to store in the form of liquid fuels some of the energy produced. Biogas transformation routes are thus one of the emerging routes. In addition to non-thermal plasma, the solar-assisted dry reforming is another valuable option, especially when solar heat is stored in the form of molten salts. These two emerging routes require a new catalyst design with respect to those actually available. In conclusions, there are many progresses in methane direct and indirect conversion routes, stimulated from the (i) availability of NG resources, which cannot be exploited via conventional pipeline or liquefaction/regasification routes, and (ii) break down of parity between NG and oil, making thus methane an interesting source also to produce chemicals. There are some emerging and converging routes, as highlighted above, and some of the options will likely be industrialized in a near future. However, it is necessary to better driven the scientific progresses in this area with a clear identification of the key issues. 12 Conclusions The brief discussion presented here cannot be exhaustive of the complex topic of the future of energy and chemistry, the change of their nexus, the emerging new needs in terms of materials and technologies to make possible and sustainable this changeover. We have thus provided only a glimpse about the future vision of a sustainable energy-chemistry system, the key enabling technologies and some examples of the role of nanotechnology and chemistry in developing them. As indicated, this perspective paper is not intended to be a review on this area, being too broad, but only a (largely personal) vision of the future. References are thus limited as well a detailed discussion of pro/con ideas about this future. The aim is to outline the evolving scenario, and some of the key topics to enable this transition, as the basis to remark the role which may be played from JEC to enable this future. The topics discussed in this perspective paper are part of the strategic elements around which the journal aims to growth, and which put JEC at the crossover of the future model of sustainable energy and chemical production. We could further stress the concept that chemistry, catalysis and chemical engineering had, and will continue to play, a pivotal role in enabling societal needs of energy, in terms of amount and quality of the products, but also of protection of the environment from their use. Energy-chemistry nexus is changing and understanding this change is the basis to develop more focused R&D to enable this sustainable future. We have to remark that several aspects were not included, or very limited discussed, for conciseness. Between these we have at least to cite the role of catalysis in both enabling the use of biomass, and in developing new energy-saving processes for a low-carbon economy. Catalysis and chemistry also plays a role in mitigating the impact on environment of the production and use of energy, for example in reducing pollutant emissions from industrial processes and cars. Enabling a sustainable energy future presents many great challenges, for example related to substitute fossil fuels, allow the large use of renewable as well as alternative energy sources, provide energy security and reliability of the grid and energy net, etc. In many of these challenges, chemistry operates in synergy with other branches of science and technology to make possible the necessary progress. Chemistry is thus a strategic science and technology for solving the energy challenge, providing tailored structural and functional materials, processes and technologies for energy saving, for a better and more efficient use of natural resources by diversification of those actual in use, and for the use of RE. This will require also improving the educational effort in training chemists for this interdisciplinary approach needed to provide creative and scalable solutions to the energy issues. Acknowledgments The authors acknowledge the PRIN10-11 projects ``Mechanisms of activation of CO2 for the design of new materials for energy and resource efficiency'' and ``Innovative processes for the conversion of algal biomass for the production of jet fuel and green diesel'' for the financial support. References [1] Centi G. Perathoner S. The Chemical Element: Chemistry's Contribution to Our Global Future Garcia-Martinez J. Serrano-Torregrosa E. 2011 Wiley-VCH Weinheim, Germany 269 Chapter 8 Abate S. Centi G. Perathoner S. Natl. Sci. Rev. 2 2015 143 [2] Armaroli N. Balzani V. Angew. Chem. Int. Ed. 45 2006 2 [3] Cavani F. Centi G. Perathoner S. Trifiro F. Sustainable Industrial Chemistry: Principles, Tools and Industrial Examples 2009 Wiley-VCH Weinheim, Germany [4] Centi G. van Santen R.A. Catalysis for Renewables: From Feedstock to Energy Production 2008 Wiley-VCH Weinheim, Germany [5] Lanzafame P. Centi G. Perathoner S. Catal. Today 234 2014 2 Lanzafame P. Centi G. Perathoner S. Chem. Soc. Rev. 43 2014 7562 Perathoner S. Centi G. ChemSusChem 7 2014 1274 Perathoner S. Centi G. J. Chin. Chem. Soc. 61 2014 719 [6] Schlögl R. Angew. Chem. Int. Ed. 50 2011 6424 Schlögl R. ChemSusChem 3 2010 209 [7] Sovacool B.K. Energy Policy 36 2008 2940 [8] Koch F.H. Hydropower-Internalised Costs and Externalised Benefits 2000 International Energy Agency (IEA) Paris , France [9] International Energy Agency (IEA) RE 2014. Medium-term Market Report 2012 IEA Paris, France IEA Technology Roadmap 2014. Solar Photovoltaic Energy 2014 IEA France (c) RE Policy Network for the 21st Century (REN21), Renewables 2013 Global Status Report, 2013 [10] Franunhofer Institute, Photovoltaic Report 2014, 2014. [11] Samad T. Kiliccote S. Comput. Chem. Eng. 47 2012 76 [12] Institute for Energy Research, Germany's Green Energy Destabilizing Electric Grids Wind, 2013, http://www.instituteforenergyresearch.org/2013/01/23/germanys-green-energy-destabilizing-electric-grids/. [13] Shaahid S.M. El-Amin I. Renew. Sustain. Energy Rev. 13 2009 625 [14] Cosmi C. Di Leo S. Loperte S. Macchiato M. Pietrapertosa F. Salvia M. Cuomo V. Renew. Sustain. Energy Rev. 13 2009 763 [15] da Silva N.F. Rosa L.P. Araujo M.R. Renew. Sustain. Energy Rev. 9 2005 289 [16] Ghanadan R. Koomey J.G. Energy Policy 33 2005 1117 [17] Centi G. Perathoner S. Eur. J. Inorg. Chem. 26 2009 3851 [18] Centi G. Perathoner S. Coord. Chem. Rev. 255 2011 1480 [19] Centi G. Perathoner S. ChemSusChem 4 2011 913 [20] Charles D. Science 324 2009 172 [21] U.S. Department of Energy The Smart Grid: An Introduction 2008 U.S. Department of Energy Washington, DC http://www.oe.energy.gov/1165.htm [22] World Energy Council Survey Energy Resour. 2010 http://www.worldenergy.org/documents/ser_2010_report_1.pdf [23] F. Zickfeld, A. Wieland, Desert Power 2050, Dic, 2012, http://www.diieumena.com/fileadmin/flippingbooks/dp2050_exec_sum_engl_web.pdf. [24] Centi G. Quadrelli E.A. Perathoner S. Energy Environ. Sci. 6 2013 1711 Ampelli C. Perathoner S. Centi G. Phil. Trans. R. Soc. Lond. A: Math., Phys. Eng. Sci. 373 2015 20140177 [25] Centi G. Perathoner S. Top. Catal. 52 2009 948 [26] Centi G. Perathoner S. ChemSusChem 3 2010 195 [27] Schlögl R. Schlög R. Chemical Energy Storage 2013 De Gruyter Berlin , Germany 1 Chapter 1.1 Schlögl R. Green 2 2013 233 [28] Bensaid S. Centi G. Garrone E. Perathoner S. Saracco G. ChemSusChem 5 2012 500 Centi G. Perathoner S. Kirk-Othmer Encyclopedia of Chemical Technology 2014 Wiley 1 10.1002/0471238961.articent.a01 [29] Centi G. Perathoner S. The Role of Catalysis for the Sustainable Production of Bio-fuels and Bio-chemicals Triantafyllidis K. Lappas A. Stöcker M. 2013 Elsevier Science Amsterdam 529 Chapter 16 [30] Zhang Y.-H.P. Energy Sci. Eng 1 2013 27 Sharifzadeh M. Wang L. Shah N. Renew. Sustain. Energy Rev. 47 2015 151 [31] Abate S. Lanzafame P. Perathoner S. Centi G. ChemSusChem 2015 10.1002/cssc.201500277 Early view [32] Zhang Y.-H.P. Huang W.-D. Trends Biotechnol 30 2012 301 Zhang Y.-H.P. Xu J.-H. Zhong J.-J. Int. J. Energy Res. 37 2013 760 [33] Razzak S.A. Hossain M.M. Lucky R.A. Bassi A.S. de Lasa H. Renew. Sustain. Energy Rev. 27 2013 622 [34] Abishek M.P. Patel J. Rajan A.P. Biotechnol. Res. Int. 2014 2014 10.1155/2014/272814 Article ID 272814, 8 pages [35] Wu Y.-H. Hu H.-Y. Yu Y. Zhang T.-Y. Zhu S.-F. Zhuang L.-L. Zhang X. Lu Y. Renew. Sustain. Energy Rev. 33 2014 675 [36] Vanthoor-Koopmans M. Wijffels R.H. Barbosa M.J. Eppink M.H.M. Bioresour. Technol. 135 2013 142 [37] Chisti Y. J. Biotechnol. 167 2013 201 [38] Lam M.K. Lee K.T. Biotechnol. Adv. 30 2012 673 [39] Pienkos P.T. Darzins A. Biofuels Bioprod. Bioref. 3 2009 431 [40] Uggetti E. Sialve B. Trably E. Steyer J.-P. Biofuels Bioprod. Bioref. 8 2014 516 [41] Li X. Yu J. Low J. Fang Y. Xiao J. Chen X. J. Mater. Chem. A: Mater. Energy Sustain. 3 2015 2485 [42] Abanades S. Green 1 2011 209 [43] Chen D. He L. ChemCatChem 3 2011 490 [44] Navarro R.M. Sanchez-Sanchez M.C. Alvarez-Galvan M.C. Fierro J.L.G. Al-Zaharani S.M. Energy Production and Storage Crabtree R.H. 2010 Wiley & Sons 3 [45] Han Z. Eisenberg R. Acc. Chem. Res. 47 2014 2537 [46] El Doukkali M. Iriondo A. Cambra J.F. Arias P.L. Top. Catal. 57 2014 1066 [47] Xe X. Wang Y. Hopkins R.C. Adams M.W.W. Evans B.R. Mielenz J.R. Zhang Y.-H.P. ChemSusChem 2 2009 149 Rollin J.A. del Campo J.M. Myung S. Sun F. You C. PNAS 112 2015 4964 Martin del Campo J.S. Rollin J. Myung S. Chun Y. Chandrayan S. Angew. Chem. Int. Ed. 52 2013 4587 [48] Highfield J. Molecules 20 2015 6739 Bowker M. Green Chem. 13 2011 2235 Ampelli C. Genovese C. Passalacqua R. Perathoner S. Centi G. Appl. Thermal Eng. 70 2014 1270 [49] Rahman M.M. Church T.L. Variava M.F. Harris A.T. Minett A.I. RSC Adv. 4 2014 18951 [50] Barbato L. Centi G. Iaquaniello G. Mangiapane A. Perathoner S. Energy Technol. 2 2014 453 [51] Tian P. Wei Y. Ye M. Liu Z. ACS Catal. 5 2015 1922 [52] Garcia-Martinez J. Nanotechnology for the Energy Challenge 2010 Wiley-VCH Weinheim, Germany [53] Stöcker M. Angew. Chem. Int. Ed. 47 2008 9200 [54] Liu J. Cao G. Yang Z. Wang D. Dubois D. Zhou X. Graff G.L. Pederson L.R. Zhang J.G. ChemSusChem 1 2008 676 [55] Eftekhari A. Nanostructured Materials in Electrochemistry 2008 Wiley-VCH Weinheim, Germany [56] Yi C. Liu D. Yang M. Curr. Nanosci. 5 2009 75 [57] Aricò A.S. Bruce P. Scrosati B. Tarascon J.-M. van Schalkwijk W. Nat. Mater. 4 2005 366 [58] Su D. Centi G. J. Energy Chem. 22 2013 202 [59] Liu C. Li F. Lai-Peng M. Cheng H.-M. Adv. Mater. 22 2010 E28 [60] Fergus J.W. J. Power Sources 195 2010 939 [61] Liang C. Li Z. Dai S. Angew. Chem. Int. Ed. 47 2008 3696 [62] Ryoo R. Joo S.H. Kruk M. Jaroniec M. Adv. Mater. 13 2001 677 [63] Su D.S. Perathoner S. Centi G. Chem. Rev. 113 2013 5782 [64] Centi G. Perathoner S. Su D.S. Catal. Survey Asia 18 2014 149 [65] Vilatela J.J. Eder D. ChemSusChem 5 2012 456 [66] Centi G. Perathoner S. Nanocarbon–Inorganic Hybrids Eder D. Schlögl R. 2014 De Gruyter Berlin, Germany 429 Chapter 16 [67] Umeyama T. Imahori H. J. Phys. Chem. C 117 2013 3195 [68] Abe R. J. Photochem. Photobiol. C: Photochem. Rev. 11 2010 179 [69] Iwase A. Hau Ng Y. Ishiguro Y. Kudo A. Amal R. J. Am. Chem. Soc. 133 2011 11054 [70] Konagai M. Kurokawa Y. J. Jpn. Inst. Energy 87 2008 193 [71] Gaudian R. J. Phys. Chem. Lett. 1 2010 1288 [72] Tanabe K. Energies 2 2009 504 [73] Ameri T. Dennler G. Lungenschmied C. Brabec C.J. Energy Environ. Sci. 2 2009 347 [74] Fan Z. Razavi H. Do J.-W. Moriwaki A. Ergen O. Chueh Y.-L. Nat. Mater. 8 2009 648 [75] Grätzel M. Phil. Trans. R. Soc. A: Math Phys. Eng. Sci. 365 2007 993 [76] Centi G. ChemSusChem 8 2015 212 [77] Armor J.N. J. Energy Chem. 22 2013 21 [78] Iaquaniello G. Salladini A. Palo E. Centi G. ChemSusChem 8 2015 717 Capoferri D. Cucchiella B. Iaquaniello G. Mangiapane A. Abate S. Centi G. ChemSusChem 4 2011 1787 [79] Zavyalova U. Holena M. Schlögl R. Baerns M. ChemCatChem 3 2011 1935 [80] Hammond C. Conrad S. Hermans I. ChemSusChem 5 2012 1668 [81] Wolf E.E. J. Phys. Chem. Lett. 5 2014 986 [82] Guo Z. Liu B. Zhang Q. Deng W. Wang Y. Yang Y. Chem. Soc. Rev. 43 2014 3480 [83] Nozaki T. Okazaki K. Catal. Today 211 2013 29 [84] Vanelderen P. Vancauwenbergh J. Sels B.F. Schoonheydt R.A. Coord. Chem. Rev. 257 2013 483 [85] Haack P. Limberg C. Angew. Chem. Int. Ed. 53 2014 4282 [86] Abate S. Centi G. Perathoner S. Small-Scale Gas to Liquid Fuel Synthesis Kanellopoulos 2015 CRC Press 3 Chapter 1 [87] Hammond C. Forde M.M. Ab Rahim M.H. Thetford A. He Q. Jenkins R.L. Angew. Chem. Int. Ed. 51 2012 5129 [88] Wu J.-F. Yu S.-M. Wang W.D. Fan Y.-X. Bai S. Zhang C.-W. Gao Q. Huang J. Wang W. J. Am. Chem. Soc. 135 2013 13567 [89] Park D. Lee J. Korean J. Chem. Eng. 30 2013 977 [90] Kluczka S. Eckstein J. Alexopoulos S. Vaessen C. Roeb M. Energy Proc. 49 2014 850 [91] Krenzke P.T. Davidson J.H. Energy Fuels 28 2014 4088 [92] Gokon N. Nakamura S. Hatamachi T. Kodama T. Energy 68 2014 773 [93] Bhavsar S. Najera M. Solunke R. Veser G. Catal. Today 228 2014 96 [94] Havran V. Dudukovic M.P. Lo C.S. Ind. Eng. Chem. Res. 50 2011 7089 [95] Shi L. Yang G. Tao K. Yoneyama Y. Tan Y. Tsubaki N. Acc. Chem. Res. 46 2013 183847 [96] Mota N. Alvarez-Galvan C. Navarro R.M. Fierro J.L.G. Biofuels 2 2011 325",
      "scopus-id": "84944731839",
      "coredata": {
        "eid": "1-s2.0-S2095495615000522",
        "dc:description": "The changing energy-chemistry nexus is discussed in this perspective paper about the future of sustainable energy and chemical production to identify the priorities and open issues on which focus research and development. Topics discussed regard (i) the new sustainable energy scenario, (ii) the role of energy storage (from smart grids to chemical storage of energy), (iii) the outlooks and role of solar (bio)refineries and solar fuels, (iv) how to integrate bio- and solar-refineries to move to new economy, (v) the role of methanol at the crossover of new energy-chemistry nexus, (vi) the role of chemistry in this new scenario, (vii) the role of nanomaterials for a sustainable energy, (viii) the use of nanocarbons to design advanced energy conversion and storage devices, and (ix) possibilities and routes to exploit solar energy and methane (shale gas). The contribution provides a glimpse of the emerging directions and routes with some elements about their possible role in the future scenario, but does not provide a detailed analysis of the state of the art in these directions.",
        "openArchiveArticle": "false",
        "prism:coverDate": "2015-09-30",
        "openaccessUserLicense": null,
        "prism:aggregationType": "Journal",
        "prism:url": "https://api.elsevier.com/content/article/pii/S2095495615000522",
        "dc:creator": [
          {
            "@_fa": "true",
            "$": "Abate, Salvatore"
          },
          {
            "@_fa": "true",
            "$": "Centi, Gabriele"
          },
          {
            "@_fa": "true",
            "$": "Lanzafame, Paola"
          },
          {
            "@_fa": "true",
            "$": "Perathoner, Siglinda"
          }
        ],
        "link": [
          {
            "@_fa": "true",
            "@rel": "self",
            "@href": "https://api.elsevier.com/content/article/pii/S2095495615000522"
          },
          {
            "@_fa": "true",
            "@rel": "scidir",
            "@href": "https://www.sciencedirect.com/science/article/pii/S2095495615000522"
          }
        ],
        "dc:format": "application/json",
        "openaccessType": null,
        "pii": "S2095-4956(15)00052-2",
        "prism:volume": "24",
        "prism:publisher": "Science Press and Dalian Institute of Chemical Physics. Published by Elsevier B.V.",
        "dc:title": "The energy-chemistry nexus: A vision of the future from sustainability perspective",
        "prism:copyright": "Copyright © 2015 Science Press and Dalian Institute of Chemical Physics. Published by Elsevier B.V. All rights reserved.",
        "openaccess": "0",
        "prism:issn": "20954956",
        "prism:issueIdentifier": "5",
        "dcterms:subject": [
          {
            "@_fa": "true",
            "$": "Energy"
          },
          {
            "@_fa": "true",
            "$": "Chemistry"
          },
          {
            "@_fa": "true",
            "$": "Future scenario"
          },
          {
            "@_fa": "true",
            "$": "Catalysis"
          },
          {
            "@_fa": "true",
            "$": "Sustainability"
          }
        ],
        "openaccessArticle": "false",
        "prism:publicationName": "Journal of Energy Chemistry",
        "prism:number": "5",
        "openaccessSponsorType": null,
        "prism:pageRange": "535-547",
        "prism:endingPage": "547",
        "pubType": "sco",
        "prism:coverDisplayDate": "September 2015",
        "prism:doi": "10.1016/j.jechem.2015.08.005",
        "prism:startingPage": "535",
        "dc:identifier": "doi:10.1016/j.jechem.2015.08.005",
        "openaccessSponsorName": null
      },
      "objects": {
        "object": [
          {
            "@category": "thumbnail",
            "@height": "128",
            "@width": "219",
            "@_fa": "true",
            "$": "https://api.elsevier.com/content/object/eid/1-s2.0-S2095495615000522-fx1.sml?httpAccept=%2A%2F%2A",
            "@multimediatype": "GIF image file",
            "@type": "IMAGE-THUMBNAIL",
            "@size": "15829",
            "@ref": "fx1",
            "@mimetype": "image/gif"
          },
          {
            "@category": "thumbnail",
            "@height": "138",
            "@width": "219",
            "@_fa": "true",
            "$": "https://api.elsevier.com/content/object/eid/1-s2.0-S2095495615000522-gr1.sml?httpAccept=%2A%2F%2A",
            "@multimediatype": "GIF image file",
            "@type": "IMAGE-THUMBNAIL",
            "@size": "11379",
            "@ref": "gr1",
            "@mimetype": "image/gif"
          },
          {
            "@category": "thumbnail",
            "@height": "139",
            "@width": "219",
            "@_fa": "true",
            "$": "https://api.elsevier.com/content/object/eid/1-s2.0-S2095495615000522-gr2.sml?httpAccept=%2A%2F%2A",
            "@multimediatype": "GIF image file",
            "@type": "IMAGE-THUMBNAIL",
            "@size": "13139",
            "@ref": "gr2",
            "@mimetype": "image/gif"
          },
          {
            "@category": "thumbnail",
            "@height": "57",
            "@width": "219",
            "@_fa": "true",
            "$": "https://api.elsevier.com/content/object/eid/1-s2.0-S2095495615000522-gr3.sml?httpAccept=%2A%2F%2A",
            "@multimediatype": "GIF image file",
            "@type": "IMAGE-THUMBNAIL",
            "@size": "7689",
            "@ref": "gr3",
            "@mimetype": "image/gif"
          },
          {
            "@category": "thumbnail",
            "@height": "164",
            "@width": "204",
            "@_fa": "true",
            "$": "https://api.elsevier.com/content/object/eid/1-s2.0-S2095495615000522-gr4.sml?httpAccept=%2A%2F%2A",
            "@multimediatype": "GIF image file",
            "@type": "IMAGE-THUMBNAIL",
            "@size": "17645",
            "@ref": "gr4",
            "@mimetype": "image/gif"
          },
          {
            "@category": "standard",
            "@height": "200",
            "@width": "341",
            "@_fa": "true",
            "$": "https://api.elsevier.com/content/object/eid/1-s2.0-S2095495615000522-fx1.jpg?httpAccept=%2A%2F%2A",
            "@multimediatype": "JPEG image file",
            "@type": "IMAGE-DOWNSAMPLED",
            "@size": "23336",
            "@ref": "fx1",
            "@mimetype": "image/jpeg"
          },
          {
            "@category": "standard",
            "@height": "355",
            "@width": "565",
            "@_fa": "true",
            "$": "https://api.elsevier.com/content/object/eid/1-s2.0-S2095495615000522-gr1.jpg?httpAccept=%2A%2F%2A",
            "@multimediatype": "JPEG image file",
            "@type": "IMAGE-DOWNSAMPLED",
            "@size": "48668",
            "@ref": "gr1",
            "@mimetype": "image/jpeg"
          },
          {
            "@category": "standard",
            "@height": "250",
            "@width": "393",
            "@_fa": "true",
            "$": "https://api.elsevier.com/content/object/eid/1-s2.0-S2095495615000522-gr2.jpg?httpAccept=%2A%2F%2A",
            "@multimediatype": "JPEG image file",
            "@type": "IMAGE-DOWNSAMPLED",
            "@size": "35473",
            "@ref": "gr2",
            "@mimetype": "image/jpeg"
          },
          {
            "@category": "standard",
            "@height": "102",
            "@width": "392",
            "@_fa": "true",
            "$": "https://api.elsevier.com/content/object/eid/1-s2.0-S2095495615000522-gr3.jpg?httpAccept=%2A%2F%2A",
            "@multimediatype": "JPEG image file",
            "@type": "IMAGE-DOWNSAMPLED",
            "@size": "18846",
            "@ref": "gr3",
            "@mimetype": "image/jpeg"
          },
          {
            "@category": "standard",
            "@height": "394",
            "@width": "489",
            "@_fa": "true",
            "$": "https://api.elsevier.com/content/object/eid/1-s2.0-S2095495615000522-gr4.jpg?httpAccept=%2A%2F%2A",
            "@multimediatype": "JPEG image file",
            "@type": "IMAGE-DOWNSAMPLED",
            "@size": "74867",
            "@ref": "gr4",
            "@mimetype": "image/jpeg"
          },
          {
            "@category": "high",
            "@height": "886",
            "@width": "1512",
            "@_fa": "true",
            "$": "https://api.elsevier.com/content/object/eid/1-s2.0-S2095495615000522-fx1_lrg.jpg?httpAccept=%2A%2F%2A",
            "@multimediatype": "JPEG image file",
            "@type": "IMAGE-HIGH-RES",
            "@size": "182064",
            "@ref": "fx1",
            "@mimetype": "image/jpeg"
          },
          {
            "@category": "high",
            "@height": "1571",
            "@width": "2500",
            "@_fa": "true",
            "$": "https://api.elsevier.com/content/object/eid/1-s2.0-S2095495615000522-gr1_lrg.jpg?httpAccept=%2A%2F%2A",
            "@multimediatype": "JPEG image file",
            "@type": "IMAGE-HIGH-RES",
            "@size": "337838",
            "@ref": "gr1",
            "@mimetype": "image/jpeg"
          },
          {
            "@category": "high",
            "@height": "1105",
            "@width": "1740",
            "@_fa": "true",
            "$": "https://api.elsevier.com/content/object/eid/1-s2.0-S2095495615000522-gr2_lrg.jpg?httpAccept=%2A%2F%2A",
            "@multimediatype": "JPEG image file",
            "@type": "IMAGE-HIGH-RES",
            "@size": "301363",
            "@ref": "gr2",
            "@mimetype": "image/jpeg"
          },
          {
            "@category": "high",
            "@height": "451",
            "@width": "1737",
            "@_fa": "true",
            "$": "https://api.elsevier.com/content/object/eid/1-s2.0-S2095495615000522-gr3_lrg.jpg?httpAccept=%2A%2F%2A",
            "@multimediatype": "JPEG image file",
            "@type": "IMAGE-HIGH-RES",
            "@size": "140303",
            "@ref": "gr3",
            "@mimetype": "image/jpeg"
          },
          {
            "@category": "high",
            "@height": "1744",
            "@width": "2167",
            "@_fa": "true",
            "$": "https://api.elsevier.com/content/object/eid/1-s2.0-S2095495615000522-gr4_lrg.jpg?httpAccept=%2A%2F%2A",
            "@multimediatype": "JPEG image file",
            "@type": "IMAGE-HIGH-RES",
            "@size": "991466",
            "@ref": "gr4",
            "@mimetype": "image/jpeg"
          },
          {
            "@category": "thumbnail",
            "@height": "18",
            "@width": "97",
            "@_fa": "true",
            "$": "https://api.elsevier.com/content/object/eid/1-s2.0-S2095495615000522-si1.gif?httpAccept=%2A%2F%2A",
            "@multimediatype": "GIF image file",
            "@type": "ALTIMG",
            "@size": "545",
            "@ref": "si1",
            "@mimetype": "image/gif"
          },
          {
            "@category": "thumbnail",
            "@height": "17",
            "@width": "61",
            "@_fa": "true",
            "$": "https://api.elsevier.com/content/object/eid/1-s2.0-S2095495615000522-si2.gif?httpAccept=%2A%2F%2A",
            "@multimediatype": "GIF image file",
            "@type": "ALTIMG",
            "@size": "388",
            "@ref": "si2",
            "@mimetype": "image/gif"
          },
          {
            "@category": "thumbnail",
            "@height": "17",
            "@width": "46",
            "@_fa": "true",
            "$": "https://api.elsevier.com/content/object/eid/1-s2.0-S2095495615000522-si3.gif?httpAccept=%2A%2F%2A",
            "@multimediatype": "GIF image file",
            "@type": "ALTIMG",
            "@size": "278",
            "@ref": "si3",
            "@mimetype": "image/gif"
          }
        ]
      },
      "link": {
        "@rel": "abstract",
        "@href": "https://api.elsevier.com/content/abstract/scopus_id/84944731839"
      }
    }
  }
}