{
  "metadata": {
    "title": "Hollow NiMo-based nitride heterojunction with super-hydrophilic/aerophobic surface for efficient urea-assisted hydrogen production",
    "authors": "; ; ",
    "journal": "Journal of Energy Chemistry",
    "date": "2024-08-31",
    "doi": "10.1016/j.jechem.2024.04.002",
    "abstract": "",
    "uri": "https://api.elsevier.com/content/article/pii/S2095495624002730",
    "pii": "S2095495624002730"
  },
  "fulltext": {
    "full-text-retrieval-response": {
      "scopus-eid": "2-s2.0-85190722243",
      "originalText": "serial JL 286353 291210 291711 291744 291809 31 Journal of Energy Chemistry JOURNALENERGYCHEMISTRY 2024-04-10 2024-04-10 2024-04-20 2024-04-20 2024-06-09T07:59:29 1-s2.0-S2095495624002730 S2095-4956(24)00273-0 S2095495624002730 10.1016/j.jechem.2024.04.002 S300 S300.1 FULL-TEXT 1-s2.0-S2095495624X00054 2024-06-16T05:21:34.54256Z 0 0 20240801 20240831 2024 2024-04-10T15:17:25.119196Z absattachment articleinfo articletitlenorm authfirstinitialnorm authfirstsurnamenorm cid cids contenttype copyright crossmark dateloaded dateloadedtxt datesearch datesort dateupdated dco docsubtype doctype doi eid ewtransactionid hubeid indexeddate issn issnnorm itemstage itemtransactionid itemweight openaccess openarchive pg pgfirst pglast pii piinorm pubdateend pubdatestart pubdatetxt pubyr sortorder srctitle srctitlenorm srctype ssids alllist content subj subheadings suppl tomb volfirst volissue volumelist webpdf webpdfpagecount yearnav figure e-component body mmlmath acknowledge affil appendices articletitle auth authfirstini authfull authkeywords authlast grantnumber grantsponsor grantsponsorid orcid primabst ref specialabst 2095-4956 20954956 false 95 95 C Volume 95 34 428 439 428 439 202408 August 2024 2024-08-01 2024-08-31 2024 article fla © 2024 Science Press and Dalian Institute of Chemical Physics, Chinese Academy of Sciences. Published by ELSEVIER B.V. and Science Press. All rights are reserved, including those for text and data mining, AI training, and similar technologies. HOLLOWNIMOBASEDNITRIDEHETEROJUNCTIONSUPERHYDROPHILICAEROPHOBICSURFACEFOREFFICIENTUREAASSISTEDHYDROGENPRODUCTION FAN Y 1 Introduction 2 Experimental 2.1 Preparation of 3D hollow nano-sheet arrays Ni/NiMoN catalyst 2.2 Preparation of NiMoN catalyst 2.3 Preparation of Ni catalyst 2.4 Preparation of Ni/NiN catalyst 2.5 Preparation of Mo3N2 catalyst 2.6 Characterizations 2.7 Electrochemical measurements 2.8 Theoretical calculation 3 Results and discussion 3.1 Synthesis and characterization 3.2 Electrocatalytic performance 3.3 DFT calculations 3.4 Urea assisted water electrolysis performance 4 Conclusions CRediT authorship contribution statement Acknowledgments Appendix A Supplementary material References ZHENG 2023 e202217449 X TIAN 2019 1808066 X ZHANG 2019 1808167 J JIAO 2021 1722 1770 S SUN 2020 2001818 Q XIAO 2021 2105830 X GAO 2021 358 363 Z YANG 2022 3125 G MORALES 2022 982 992 D ZHENG 2022 258 265 S XU 2023 116 125 X GAO 2024 1552 X LI 2021 26656 26662 J ZHANG 2022 3254 3270 J LI 2022 506 515 M WANG 2022 2210322 L WANG 2022 5785 L SHANG 2020 105375 L ZHANG 2023 2300959 K JIANG 2022 848 857 Z ZHAO 2023 2300283 L WU 2021 2010437 Z HUANG 2023 2301130 C WANG 2021 10577 10582 L LI 2023 2300725 P ZHENG 2024 123214 Z LIAO 2023 2303300 Y BU 2022 135379 X ZHANG 2021 2101758 R YANG 2020 2002260 C XU 2024 123312 X MAHESKUMAR 2023 2300212 V WANG 2023 4091 4100 T GU 2021 6673 6681 Y WANG 2021 69 74 T SONG 2022 2104522 J ZHANG 2022 2103561 W LI 2023 8853 8862 J SONG 2022 120303 W XIONG 2023 71 81 T HAO 2023 1100 1110 Y SONG 2018 4531 F KIM 2020 1399 1408 J GONG 2019 13671 13678 Y WANG 2020 426 434 A CHEN 2022 2105869 Y ZHANG 2020 3007 3013 B WU 2018 353 363 A SHEN 2022 2206388 X CAO 2013 19186 19192 B ZHANG 2016 1600221 Y YAN 2017 1704156 H DU 2021 7051 7055 W WANG 2022 131190 X YU 2019 5106 L LI 2015 1737 1744 Y ZHOU 2023 122168 Y CHEN 2021 7297 7307 W YU 2023 2212811 H WANG 2023 2300687 P QIAN 2023 e368 G FANX2024X428 FANX2024X428X439 FANX2024X428XY FANX2024X428X439XY 2026-04-20T00:00:00.000Z 2026-04-20T00:00:00.000Z http://creativecommons.org/licenses/by-nc-nd/4.0/ © 2024 Science Press and Dalian Institute of Chemical Physics, Chinese Academy of Sciences. Published by ELSEVIER B.V. and Science Press. All rights are reserved, including those for text and data mining, AI training, and similar technologies. 2024-05-03T12:35:27.860Z http://vtw.elsevier.com/data/voc/AddOnTypes/50.7/aggregated-refined National Natural Science Foundation of China 22271081 91961111 NSFC National Natural Science Foundation of China http://data.elsevier.com/vocabulary/SciValFunders/501100001809 http://sws.geonames.org/1814991 Heilongjiang University in Heilongjiang Province 2021-KYYWF-0039 Natural Science Foundation of Heilongjiang Province ZD2021B003 Natural Science Foundation of Heilongjiang Province http://data.elsevier.com/vocabulary/SciValFunders/501100005046 http://sws.geonames.org/1814991/ Heilongjiang University Excellent Youth Foundation National Key R&D Program of China 2022YFA1503003 NKRDPC National Key Research and Development Program of China http://data.elsevier.com/vocabulary/SciValFunders/501100012166 http://sws.geonames.org/1814991/ University Nursing Program for Young Scholars with Creative Talents in Heilongjiang Province UNPYSCT-2020004 University Nursing Program for Young Scholar with Creative Talents in Heilongjiang Province http://data.elsevier.com/vocabulary/SciValFunders/501100012676 http://sws.geonames.org/1814991 This work was financially supported by the National Key R&D Program of China (2022YFA1503003), the National Natural Science Foundation of China (91961111, 22271081), the Natural Science Foundation of Heilongjiang Province (ZD2021B003), the University Nursing Program for Young Scholars with Creative Talents in Heilongjiang Province (UNPYSCT-2020004). Thanks to Prof. G. A. Iridievich for the support on the work. The Basic Research Fund of Heilongjiang University in Heilongjiang Province (2021-KYYWF-0039), and the Heilongjiang University Excellent Youth Foundation are also acknowledged. item S2095-4956(24)00273-0 S2095495624002730 1-s2.0-S2095495624002730 10.1016/j.jechem.2024.04.002 286353 2024-06-16T05:21:34.54256Z 2024-08-01 2024-08-31 1-s2.0-S2095495624002730-main.pdf https://s3-eu-west-1.amazonaws.com/prod-ucs-content-store-eu-west/content/pii:S2095495624002730/MAIN/application/pdf/4f3101e49e589a4a304db3c4f221c6de/main.pdf main.pdf pdf true 4580559 MAIN 12 1-s2.0-S2095495624002730-main_1.png https://s3-eu-west-1.amazonaws.com/prod-ucs-content-store-eu-west/content/pii:S2095495624002730/PREVIEW/image/png/f2e680daadb88f01c39b52a0017cab96/main_1.png main_1.png png 63696 849 656 IMAGE-WEB-PDF 1 1-s2.0-S2095495624002730-ga1.jpg https://s3-eu-west-1.amazonaws.com/prod-ucs-content-store-eu-west/content/pii:S2095495624002730/ga1/DOWNSAMPLED/image/jpeg/fb7dc637a12e458ec8ee726896415c2f/ga1.jpg ga1 true ga1.jpg jpg 40930 200 409 IMAGE-DOWNSAMPLED 1-s2.0-S2095495624002730-gr1.jpg https://s3-eu-west-1.amazonaws.com/prod-ucs-content-store-eu-west/content/pii:S2095495624002730/gr1/DOWNSAMPLED/image/jpeg/0bf7a41ebb8b21caed65845b7d6c5260/gr1.jpg gr1 gr1.jpg jpg 156463 619 578 IMAGE-DOWNSAMPLED 1-s2.0-S2095495624002730-gr2.jpg https://s3-eu-west-1.amazonaws.com/prod-ucs-content-store-eu-west/content/pii:S2095495624002730/gr2/DOWNSAMPLED/image/jpeg/75ee09ff1d45f6a280166a89e02bb92e/gr2.jpg gr2 gr2.jpg jpg 94753 476 576 IMAGE-DOWNSAMPLED 1-s2.0-S2095495624002730-gr3.jpg https://s3-eu-west-1.amazonaws.com/prod-ucs-content-store-eu-west/content/pii:S2095495624002730/gr3/DOWNSAMPLED/image/jpeg/470216af33ab49125f9d5c517d57355f/gr3.jpg gr3 gr3.jpg jpg 71176 402 578 IMAGE-DOWNSAMPLED 1-s2.0-S2095495624002730-gr4.jpg https://s3-eu-west-1.amazonaws.com/prod-ucs-content-store-eu-west/content/pii:S2095495624002730/gr4/DOWNSAMPLED/image/jpeg/a677931ec3cea757d1f5092e69748874/gr4.jpg gr4 gr4.jpg jpg 115467 532 622 IMAGE-DOWNSAMPLED 1-s2.0-S2095495624002730-gr5.jpg https://s3-eu-west-1.amazonaws.com/prod-ucs-content-store-eu-west/content/pii:S2095495624002730/gr5/DOWNSAMPLED/image/jpeg/4bc5e2e4b1007630efcdbadd4f1529af/gr5.jpg gr5 gr5.jpg jpg 129125 572 667 IMAGE-DOWNSAMPLED 1-s2.0-S2095495624002730-gr6.jpg https://s3-eu-west-1.amazonaws.com/prod-ucs-content-store-eu-west/content/pii:S2095495624002730/gr6/DOWNSAMPLED/image/jpeg/7752cdf44029116b540e0b892967d2c8/gr6.jpg gr6 gr6.jpg jpg 89256 387 667 IMAGE-DOWNSAMPLED 1-s2.0-S2095495624002730-gr7.jpg https://s3-eu-west-1.amazonaws.com/prod-ucs-content-store-eu-west/content/pii:S2095495624002730/gr7/DOWNSAMPLED/image/jpeg/8dc2edf1c1f6e97c6e798b5a874e08d2/gr7.jpg gr7 gr7.jpg jpg 98574 374 667 IMAGE-DOWNSAMPLED 1-s2.0-S2095495624002730-gr8.jpg https://s3-eu-west-1.amazonaws.com/prod-ucs-content-store-eu-west/content/pii:S2095495624002730/gr8/DOWNSAMPLED/image/jpeg/b91a68fbebe5f1cd9c8894e58eaedba9/gr8.jpg gr8 gr8.jpg jpg 138067 574 667 IMAGE-DOWNSAMPLED 1-s2.0-S2095495624002730-ga1.sml https://s3-eu-west-1.amazonaws.com/prod-ucs-content-store-eu-west/content/pii:S2095495624002730/ga1/THUMBNAIL/image/gif/5847909d737bcd6d3ef35cc7e03a7a30/ga1.sml ga1 true ga1.sml sml 18664 107 219 IMAGE-THUMBNAIL 1-s2.0-S2095495624002730-gr1.sml https://s3-eu-west-1.amazonaws.com/prod-ucs-content-store-eu-west/content/pii:S2095495624002730/gr1/THUMBNAIL/image/gif/ebe6a90f39ed88d34a59b79c504c1e15/gr1.sml gr1 gr1.sml sml 17871 164 153 IMAGE-THUMBNAIL 1-s2.0-S2095495624002730-gr2.sml https://s3-eu-west-1.amazonaws.com/prod-ucs-content-store-eu-west/content/pii:S2095495624002730/gr2/HIGHRES/image/gif/a7e32d702da0293bbc27c8528da7e73d/gr2.sml gr2 gr2.sml sml 15597 164 198 IMAGE-THUMBNAIL 1-s2.0-S2095495624002730-gr3.sml https://s3-eu-west-1.amazonaws.com/prod-ucs-content-store-eu-west/content/pii:S2095495624002730/gr3/THUMBNAIL/image/gif/93c0c6fa4438d1a81b2c9d12f3ebf015/gr3.sml gr3 gr3.sml sml 12558 152 219 IMAGE-THUMBNAIL 1-s2.0-S2095495624002730-gr4.sml https://s3-eu-west-1.amazonaws.com/prod-ucs-content-store-eu-west/content/pii:S2095495624002730/gr4/THUMBNAIL/image/gif/17fbcabd1eb34ea8782ebb6e59a7039d/gr4.sml gr4 gr4.sml sml 14306 163 191 IMAGE-THUMBNAIL 1-s2.0-S2095495624002730-gr5.sml https://s3-eu-west-1.amazonaws.com/prod-ucs-content-store-eu-west/content/pii:S2095495624002730/gr5/DOWNSAMPLED/image/gif/03fae9d0b305b0eb859250f558e05264/gr5.sml gr5 gr5.sml sml 14565 164 191 IMAGE-THUMBNAIL 1-s2.0-S2095495624002730-gr6.sml https://s3-eu-west-1.amazonaws.com/prod-ucs-content-store-eu-west/content/pii:S2095495624002730/gr6/THUMBNAIL/image/gif/7f82a7e278e7feacc281f6b81b3e5414/gr6.sml gr6 gr6.sml sml 11247 127 219 IMAGE-THUMBNAIL 1-s2.0-S2095495624002730-gr7.sml https://s3-eu-west-1.amazonaws.com/prod-ucs-content-store-eu-west/content/pii:S2095495624002730/gr7/THUMBNAIL/image/gif/ec6d487ba795ae09e9d9518139e4223e/gr7.sml gr7 gr7.sml sml 15110 123 219 IMAGE-THUMBNAIL 1-s2.0-S2095495624002730-gr8.sml https://s3-eu-west-1.amazonaws.com/prod-ucs-content-store-eu-west/content/pii:S2095495624002730/gr8/THUMBNAIL/image/gif/f5fe6b8c678e046207a6f09177704c01/gr8.sml gr8 gr8.sml sml 19441 164 191 IMAGE-THUMBNAIL 1-s2.0-S2095495624002730-ga1_lrg.jpg https://s3-eu-west-1.amazonaws.com/prod-ucs-content-store-eu-west/content/pii:S2095495624002730/HIGHRES/image/jpeg/45ade38beba9a22aff4ea932d6a72129/ga1_lrg.jpg ga1 true ga1_lrg.jpg jpg 301466 886 1812 IMAGE-HIGH-RES 1-s2.0-S2095495624002730-gr1_lrg.jpg https://s3-eu-west-1.amazonaws.com/prod-ucs-content-store-eu-west/content/pii:S2095495624002730/DOWNSAMPLED/image/jpeg/be00c31f41cdadff3e04be8651b517fd/gr1_lrg.jpg gr1 gr1_lrg.jpg jpg 1314210 2740 2559 IMAGE-HIGH-RES 1-s2.0-S2095495624002730-gr2_lrg.jpg https://s3-eu-west-1.amazonaws.com/prod-ucs-content-store-eu-west/content/pii:S2095495624002730/HIGHRES/image/jpeg/1293a6373b8ba1160a9ebf0b193c96ac/gr2_lrg.jpg gr2 gr2_lrg.jpg jpg 604507 2108 2552 IMAGE-HIGH-RES 1-s2.0-S2095495624002730-gr3_lrg.jpg https://s3-eu-west-1.amazonaws.com/prod-ucs-content-store-eu-west/content/pii:S2095495624002730/HIGHRES/image/jpeg/e17ce48692e7f653cdf0c6a93f8d6f12/gr3_lrg.jpg gr3 gr3_lrg.jpg jpg 437385 1778 2559 IMAGE-HIGH-RES 1-s2.0-S2095495624002730-gr4_lrg.jpg https://s3-eu-west-1.amazonaws.com/prod-ucs-content-store-eu-west/content/pii:S2095495624002730/THUMBNAIL/image/jpeg/57ccd9299d72315c9a8968de810817e0/gr4_lrg.jpg gr4 gr4_lrg.jpg jpg 731243 2356 2754 IMAGE-HIGH-RES 1-s2.0-S2095495624002730-gr5_lrg.jpg https://s3-eu-west-1.amazonaws.com/prod-ucs-content-store-eu-west/content/pii:S2095495624002730/HIGHRES/image/jpeg/4b46fd22db1f4c703758ad8e40297167/gr5_lrg.jpg gr5 gr5_lrg.jpg jpg 901061 2533 2953 IMAGE-HIGH-RES 1-s2.0-S2095495624002730-gr6_lrg.jpg https://s3-eu-west-1.amazonaws.com/prod-ucs-content-store-eu-west/content/pii:S2095495624002730/DOWNSAMPLED/image/jpeg/f44cb5cbec3a127a94ac3f54d7f8dfdb/gr6_lrg.jpg gr6 gr6_lrg.jpg jpg 528967 1712 2953 IMAGE-HIGH-RES 1-s2.0-S2095495624002730-gr7_lrg.jpg https://s3-eu-west-1.amazonaws.com/prod-ucs-content-store-eu-west/content/pii:S2095495624002730/HIGHRES/image/jpeg/db6f0fc23a6e5b5741ed94216c983e8c/gr7_lrg.jpg gr7 gr7_lrg.jpg jpg 626914 1657 2953 IMAGE-HIGH-RES 1-s2.0-S2095495624002730-gr8_lrg.jpg https://s3-eu-west-1.amazonaws.com/prod-ucs-content-store-eu-west/content/pii:S2095495624002730/HIGHRES/image/jpeg/156e2a9c5444de2ec0bb86af6053c4a9/gr8_lrg.jpg gr8 gr8_lrg.jpg jpg 886800 2541 2955 IMAGE-HIGH-RES 1-s2.0-S2095495624002730-mmc1.mp4 https://s3-eu-west-1.amazonaws.com/prod-ucs-content-store-eu-west/content/pii:S2095495624002730/mmc1/MAIN/video/mp4/78d6604a2534c096fda9be5eb477b39c/mmc1.mp4 mmc1 mmc1.mp4 mp4 2286735 VIDEO 1-s2.0-S2095495624002730-mmc2.doc https://s3-eu-west-1.amazonaws.com/prod-ucs-content-store-eu-west/content/pii:S2095495624002730/mmc2/MAIN/application/msword/f0225be1e339da27690a5746794c9d7a/mmc2.doc mmc2 mmc2.doc doc 19246080 APPLICATION 1-s2.0-S2095495624002730-mmc1.jpg https://s3-eu-west-1.amazonaws.com/prod-ucs-content-store-eu-west/content/pii:S2095495624002730/mmc1/DOWNSAMPLED/image/jpeg/13b98263d26b3ca2ea54f90a34dcf76d/mmc1.jpg mmc1 mmc1.jpg jpg 33241 271 482 IMAGE-MMC-DOWNSAMPLED 1-s2.0-S2095495624002730-mmc1.sml https://s3-eu-west-1.amazonaws.com/prod-ucs-content-store-eu-west/content/pii:S2095495624002730/mmc1/THUMBNAIL/image/gif/fb48c6d8ce1ddd02faa37a010ad51f5b/mmc1.sml mmc1 mmc1.sml sml 26274 123 219 IMAGE-MMC-THUMBNAIL 1-s2.0-S2095495624002730-si1.svg https://s3-eu-west-1.amazonaws.com/prod-ucs-content-store-eu-west/content/pii:S2095495624002730/STRIPIN/image/svg+xml/71fc33fae2de71af383b079dc072ff28/si1.svg si1 si1.svg svg 24223 ALTIMG 1-s2.0-S2095495624002730-si2.svg https://s3-eu-west-1.amazonaws.com/prod-ucs-content-store-eu-west/content/pii:S2095495624002730/STRIPIN/image/svg+xml/52483bdd9b62afad8062d0d96f031a6b/si2.svg si2 si2.svg svg 9073 ALTIMG 1-s2.0-S2095495624002730-si3.svg https://s3-eu-west-1.amazonaws.com/prod-ucs-content-store-eu-west/content/pii:S2095495624002730/STRIPIN/image/svg+xml/2f5507bdafae935c5a1bf9264725e3a9/si3.svg si3 si3.svg svg 9235 ALTIMG 1-s2.0-S2095495624002730-am.pdf am am.pdf pdf 11320457 AAM-PDF https://s3-eu-west-1.amazonaws.com/prod-ucs-content-store-eu-west/content/egi:10SLLM1MG6D/MAIN/application/pdf/eed5df526f7a91cce761c57152d07051/am.pdf JECHEM 3800 S2095-4956(24)00273-0 10.1016/j.jechem.2024.04.002 Science Press Fig. 1 (a) Schematic illustrations of the preparation process of hollow Ni/NiMoN nano-sheet arrays catalyst; (b) XRD pattern (the inset is the enlarged XRD pattern); (c, d) SEM images; (e, f) TEM images; (g) HRTEM images; (h) STEM image and the corresponding EDX element mapping for Mo, Ni, and N of Ni/NiMoN. Fig. 2 (a) XPS survey spectra; (b) Ni 2p spectra of Ni/NiMoN and Ni samples; (c) Mo 3d spectra; (d) N 1s spectra of Ni/NiMoN and NiMoN-24E samples. Fig. 3 Droplet contact angle measurement (upper panel) and underwater gas-bubble contact angle measurement (lower panel) of (a) Ni/NiMoN, (b) NiMoN-6E, and (c) Ni samples; (d) gas-bubble adhesive force tests of Ni/NiMoN. Insets 1–3 exhibit the bubble states during the adhesive force test process. Fig. 4 (a) Polarization curves, (b) correlation overpotentials, and (c) Tafel plots of Pt/C, Ni/NiMoN, Mo3N2, Ni, and NiMoN-6E in 1.0 M KOH; (d) plots displaying the extracted C dl; (e) related Nyquist plots for different catalysts; (f) polarization curves of Ni/NiMoN before and after CV tests of 3000 and 8000 cycles. Inset: I-t curve of Ni/NiMoN for 96 h; (g) the comparison of η 10 with that of the reported NiMo-based catalysts. Fig. 5 (a) Polarization curves, (b) relative overpotentials, and (c) Tafel plots of Pt/C, Ni/NiMoN, Mo3N2, Ni, and NiMoN-6E in 1.0 M PBS; (d) plots indicating the extracted C dl; (e) relevant Nyquist plots for different catalysts; (f) polarization curves of Ni/NiMoN before and after 3000 and 8000 CV tests. Inset: the I-t curve lasting for 80 h for Ni/NiMoN electrode in 1.0 M PBS; (g) the contrast of η 10 with that of the reported non-noble metal catalysts. Fig. 6 (a) Polarization curves of Ni/NiMoN for OER and UOR with a scan rate of 2 mV s−1; (b) polarization curves of UOR; (c) corresponding Tafel plots of Ni/NiMoN, Mo3N2, Ni, NiMoN-6E, and RuO2; (d) plots displaying the extracted C dl; (e) corresponding Nyquist plots for different catalysts; (f) polarization curves for Ni/NiMoN before and after 2000 and 5000 CV tests. Inset: I-t curve of Ni/NiMoN for 72 h in 1.0 M KOH with 0.5 M urea. Fig. 7 (a) Charge density difference analysis of Ni/NiMoN; (b) calculated results of partial DOS; (c) DOS of Ni/NiMoN, Ni, and NiMoN; (d) calculated ΔG H* values of HER; (e) Gibbs free energy diagrams for the HER paths of Ni/NiMoN, NiMoN, and Ni; (f) calculated adsorption energy of water and urea. Fig. 8 (a) Polarization curves of the Ni/NiMoN electrodes in HER&OER and HER&UOR systems; (b) the cell voltage of Ni/NiMoN electrodes for HER&OER and HER&UOR systems at different current densities; (c) polarization curves of Ni/NiMoN||Ni/NiMoN electrodes and Pt/C||RuO2 electrodes in HER&UOR system; (d) comparison of cell voltage for Ni/NiMoN||Ni/NiMoN electrodes and Pt/C||RuO2 electrodes in HER&UOR system; (e) the stability test of assembled Ni/NiMoN electrodes in HER&UOR system; (f) Faradaic efficiency of H2 generation in HER&UOR system; (g) device for collecting gas by drainage method to measure Faraday efficiency; (h) photograph of HER&UOR system using Ni/NiMoN as both cathode and anode; (i) the magnified photos of electrolysis. The bubbles of H2 and N2 + CO2 can be seen on the Ni/NiMoN electrodes, respectively. Hollow NiMo-based nitride heterojunction with super-hydrophilic/aerophobic surface for efficient urea-assisted hydrogen production Yuying Fan Data curation Investigation Writing – original draft a Ying Gu Formal analysis Investigation Methodology b ⁎ Dongxu Wang Formal analysis Investigation a Yanqing Jiao Formal analysis Investigation a Aiping Wu Conceptualization Investigation Methodology Writing – review & editing a ⁎ Chungui Tian Conceptualization Supervision Writing – review & editing a ⁎ a Key Laboratory of Functional Inorganic Material Chemistry, Ministry of Education of the People’s Republic of China, Heilongjiang University, Harbin 150080, Heilongjiang, China Key Laboratory of Functional Inorganic Material Chemistry Ministry of Education of the People’s Republic of China Heilongjiang University Harbin Heilongjiang 150080 China Key Laboratory of Functional Inorganic Material Chemistry, Ministry of Education of the People’s Republic of China, Heilongjiang University, Harbin 150080, Heilongjiang, China b College of Chemistry, Chemical Engineering and Resource Utilization, Northeast Forestry University, Harbin 150040, Heilongjiang, China College of Chemistry, Chemical Engineering and Resource Utilization Northeast Forestry University Harbin Heilongjiang 150040 China College of Chemistry, Chemical Engineering and Resource Utilization, Northeast Forestry University, Harbin 150040, Heilongjiang, China ⁎ Corresponding authors. Graphical abstract Hollow Ni/NiMoN spheres composed of nano-sheet arrays with optimized interfacial electron structure and superhydrophilic/aerophobic surface are constructed as bifunctional electrocatalysts for hydrogen evolution reaction (HER) and urea oxidation reaction (UOR), which shows a low cell voltage of 1.42 V at 10 mA cm−2 for HER&UOR system. Hydrogen evolution reaction (HER) and urea oxidation reaction (UOR) are key reactions of the water-cycling associated catalytic process/device. The design of catalysts with a super-hydrophilic/aerophobic structure and optimized electron distribution holds great promise. Here, we have designed a three-dimensional (3D) hollow Ni/NiMoN hierarchical structure with arrayed-sheet surface based on a one-pot hydrothermal route for efficient urea-assisted HER based on a simple hydrothermal process. The Ni/NiMoN catalyst exhibits super-hydrophilic/aerophobic properties with a small droplet contact angle of 6.07° and an underwater bubble contact angle of 155.7°, thus facilitating an escape of bubbles from the electrodes. Density functional theory calculations and X-ray photoelectron spectroscopy results indicate the optimized electronic structure at the interface of Ni and NiMoN, which can promote the adsorption/desorption of reactants and intermediates. The virtues combining with a large specific surface area endow Ni/NiMoN with efficient catalytic activity of low potentials of 25 mV for HER and 1.33 V for UOR at 10 mA cm−2. The coupled HER and UOR system demonstrates a low cell voltage of 1.42 V at 10 mA cm−2, which is approximately 209 mV lower than water electrolysis. Keywords Hydrogen evolution Transition metal nitrides Hollow heterojunctions Urea electrooxidation Super hydrophilic/aerophobic 1 Introduction Hydrogen with high energy density and zero carbon emission is an ideal replacement for traditional fuels [1–3]. Hydrogen evolution via electrocatalytic water splitting powered by solar- or wind-derived electricity is a promising route to address the issues [4–6]. It is reasonable to substitute the oxygen evolution reaction (OER) by the more save-energy anode reaction [7–9]. Urea oxidation reaction (UOR) is an alternative to OER due to its lower thermodynamic equilibrium potential (0.37 V vs. 1.23 V) [10–12]. Additionally, it also offers a hopeful approach for the purification of urea wastewater [13,14]. Nowadays, noble metal catalysts are considered as ideal electrocatalysts, but their uses are limited by the high cost and low reserves. The design of the effective non-noble metal-based catalysts by tailoring size, morphology and constructing the heterostructures is promising for the practical development of the field [15]. The bimetallic catalysts with abundant heterogeneous interfaces generally exhibit better performance than the corresponding single compounds [16,17]. Notably, the construction of the super-hydrophilic/aerophobic surface has also received much attention in recent years [18,19]. The manipulation facilitates the contact of catalysts with the water and the escape of bubbles from the electrodes, which is one of the keys to promote the reaction rates involving gases in aqueous phase [20]. The surface properties of electrode materials could be increased by enhancing amorphous region, constructing more defect sites, and introducing hierarchical nanostructure in the electrode material surface [21]. For example, Wang et al. reported that RuO2-modified FeOOH nanosheets with hierarchical structure have super-hydrophilic/aerophobic surface, which guarantees intimate contact with the electrolyte and accelerates the instantaneous escape of produced gas bubbles during the electrocatalytic process [22]. The development of non-noble-metal-based catalysts by the combination of the manipulation of surface properties and structure with electron-regulation engineering is promising for UOR assisted energy-efficient H2 production. The Ni-based materials have been promised in UOR by the formation of Ni3+ active phase (NiOOH) during the anodization process [23–25]. The studies have focused on manipulating the surface property and electronic structure for enhancing the performance [26,27]. The combination of Ni and Mo species with empty d orbitals can accelerate the reaction process based on the “d-electron complementation” effect [28–30]. Typically, the NiSe2/MoSe2 [31] and Mo-doped Ni/NiO [32] have been developed for UOR and HER. Also, a combination of metals (Mo and Ni) with N can give the electronic structure similar to Pt, thus enhancing the catalytic ability for HER/UOR [33]. The Ni x N, Mo x N, and especially the NiMoN have shown large potential as the effective electrocatalysts. A synchronous manipulation of the electronic structure and surface property is useful to give the Ni-Mo based catalysts with improved performance [34,35]. A Ni/NiMoN nanowire array has shown enhanced HER performance benefiting from super-hydrophilic/aerophobic properties (the bubble contact angle is 152°) by promoting the evolution/detachment of gas bubbles [18]. The microstructure and morphology of the catalysts have an important influence on the application performance. The hollow structure provides an microreactor environment with numerous active sites, making it promising for catalytic reaction [36]. There are many reports about the hollow structure composed of small particles from the hard-template route for energy and catalytic application [37]. An array structure is favorable to giving a super-hydrophilic/aerophobic surface [38]. Thus, the design of hollow Ni-Mo based heterojunctions with array structured surface holds promises for effective urea-assisted hydrogen production. Herein, a three-dimensional (3D) hollow Ni/NiMoN heterojunction catalyst with a surface composed of nano-sheet arrays was fabricated for effective urea-assisted hydrogen production. Benefiting from an interconnected nano-sheet arrayed surface, the Ni/NiMoN catalyst exhibits super-hydrophilic/aerophobic properties with a small droplet contact angle of 6.07° and an underwater bubble contact angle of 155.7°, thus facilitating an escape of bubbles from the electrodes. Besides, the interface with an optimized electronic structure can be formed based on electronic interaction of Ni and NiMoN. The Ni/NiMoN catalyst demonstrates excellent HER activity, achieving low overpotentials of 25 and 68 mV at the current density of 10 mA cm−2 in 1.0 M KOH. Simultaneously, the Ni/NiMoN catalyst demonstrates a satisfactory UOR activity with the cell voltages of 1.33 and 1.39 V at 10 and 100 mA cm−2. Furthermore, the coupled HER/UOR system based on the catalyst needs a low cell voltage of 1.42 V to achieve the current density of 10 mA cm−2 with good stability, which is 209 mV lower than that of the traditional HER/OER system. The work highlights the significance of combining super-hydrophilic and electron-regulation engineering for energy-efficient hydrogen production. 2 Experimental 2.1 Preparation of 3D hollow nano-sheet arrays Ni/NiMoN catalyst The hollow nano-sheet arrays Ni/NiMoN catalyst was obtained by controllable nitridation of the flower-like NiMoO4 precursor prepared by hydrothermal process. In a simple synthesis, Ni(NO3)3·6H2O (3 mmol), Na2MoO4·2H2O (3 mmol), and 0.12 g urea were added to 80 mL water to obtain green solution under the magnetic stirring. Then, the solution was moved to stainless steel autoclave with a Teflon liner and maintained at 180 °C for 12 h. After natural cooling to room temperature, the light green samples (NiMoO4 precursor) were gathered and cleansed several times with deionized water and dried at 60 °C for 12 h. Finally, the precursor was heated at 600 °C for 2 h with a ramp rate of 3 °C min−1 under the NH3 atmosphere to obtain Ni/Ni0.2Mo0.8N catalyst (abbreviated as Ni/NiMoN in the text). To regulate the micro-structures and composition, the nitriding treatment was also performed at 500 °C (Ni/NiMoN-5) and 700 °C (Ni/NiMoN-7) with the other conditions unchanged. 2.2 Preparation of NiMoN catalyst The NiMoN-6E catalyst was acquired by soaking the as-prepared Ni/NiMoN catalyst in 2.0 M HCl solution for 6 h. To better explain the influence of the interaction between Ni and NiMoN on the properties, the experiments with different immersion times were also carried out (marked as NiMoN-6E, NiMoN-12E, and NiMoN-24E respectively). The X-ray diffraction (XRD) results indicate that the metal nickel was almost completely etched after 24 h of etching. Table S1 presents the parameters of the different catalysts in the text. 2.3 Preparation of Ni catalyst The synthesis process of Ni catalyst was same as that of Ni/NiMoN sample except that only 6 mmol Ni(NO3)3·6H2O was added in the hydrothermal process. 2.4 Preparation of Ni/NiN catalyst The synthesis and method for the Ni/NiN catalyst are similar to Ni/NiMoN. Initially, only Ni source (6 mmol) was added during the hydrothermal process, without the addition of the Mo source. Subsequently, the Ni(OH)2 precursor was obtained and heated at 380 °C under NH3 atmosphere for 2 h, resulting in the formation of the Ni/Ni3N catalyst (referred to Ni/NiN in the paper). 2.5 Preparation of Mo3N2 catalyst The synthesis process of Mo3N2 catalyst was same as that of Ni/NiMoN sample except that only 6 mmol Na2MoO4·2H2O and 15 mL of HNO3 (1.0 M) solution were added in a hydrothermal process. 2.6 Characterizations XRD patterns were recorded in Bruke D8 equipped with Cu-K α (λ = 1.5406 Å) radiation and Rigaku Mini-flex600 diffractometer. Scanning electron microscopy (SEM) was carried out on ZEISS Sigma-500 instrument with accelerating voltage of 5 kV. Transmission electron microscopy (TEM) and energy dispersive X-ray spectroscopy (EDX) elemental mapping characterizations were performed on JEM-F200 electron microscope (JEOL, Japan) with operating voltage of 200 kV. X-ray photoelectron spectroscopy (XPS) analysis was carried out using a VG ESCALABMK II with Mg-K α radiation (1253.6 eV). The Brunauer-Emmett-Teller method was performed to calculate the specific surface area (77 K). Contact angle and adhesion tests were performed by using Lauda Scientific LSA100 from Germany. For the contact angle experiment, the catalyst was first pressed onto the substrate to form a flat surface, and then 10 μL of water was dropped onto the flat surface. For the underwater bubble contact angle test, the bubble volume is 10 μL and the tableting pressure is 10 MPa. The adhesion test conditions are as follows: bubble volume is 10 μL, lifting stage moving speed is 0.6 mm min−1, and a contact threshold is 3 mg. 2.7 Electrochemical measurements All the electrochemical measurements were performed on the CHI electrochemical workstation (model 760E) with a three-electrode system at 25 °C. The Hg/HgO electrode and carbon rod were used as reference electrode and counter electrode, respectively. The working electrode was prepared by mixing 5 mg of catalyst and 1 mg of carbon black dispersed in 50 μL of water/ethanol (v/v = 1:1) solution. Then, 30 μL Nafion was added to get the catalyst slurry. Subsequently, the catalyst slurry was scraped on the cleaned nickel foam (1.0 × 1.0 cm2). Before the electrochemical measurements, the electrolyte solutions (1 M KOH and 1 M phosphate buffered solutions (PBS)) were bubbled with N2 for 1 h to remove the dissolved gases. The polarization curves were recorded using linear sweep voltammograms (LSV) test at a scan rate of 2 mV s−1, which was performed after 20 cycles of cyclic voltammetry (CV) tests. All the reported potentials were converted to the reversible hydrogen electrode (RHE) according to E RHE = E HgO/Hg + 0.059 × pH + E θ HgO/Hg. Tafel plots were derived from polarization curves. The Tafel slope reveals the dependence of the compensation overpotential on the current density, which can be calculated by the Tafel equation η = a + blogj, where η is the UOR potential, b is the Tafel slope, and j is the measured current [23]. CV curve was performed at a scan rate of 10–80 mV s−1 in the non-faradaic potential range to estimate the electrochemical double layer capacitance (C dl). The stability of the catalysts was evaluated by performing CV cycles and chronoamperometry test. All tests were performed without IR corrections. The electrochemically active surface area (ECSA) is the electrochemical active surface area, which can be calculated from the following formula. ECSA = specific capacitance / 40 μF cm - 2 where specific capacitance is C dl, and 40 μF cm−2 is constant to convert capacitance to ECSA. The specific capacitance can be converted into ECSA using the specific capacitance value for flat standard with 1 cm2 of real surface area. Turnover frequency (TOF) was calculated by supposing every corresponding metal atom as active sites involved in catalytic reaction, as shown the equation TOF = j S / z F n where j is measured current density (mA cm−2); S is geometrical surface area of working electrode (1 cm−2); z is electron transfer number per molecule generated H2 (z = 2 for HER); F is Faraday’s constant (96485.3 C mol−1); and n is the moles of the corresponding metal atom (mol) within the catalyst loading. The faradaic efficiency (FE) for HER was calculated by comparing the experimentally determined and theoretically calculated amounts of H2. In the two-electrode cell, the generated hydrogen was collected via a simple drainage method. Constant potential electrolysis was performed at 33 mA cm−2 for 60 min in closed H-shaped electrolytic cell. The theoretical H2 amount was calculated as follows. n H 2 = Q / z F where n(H2), Q, and F are the moles of produced hydrogen, the electrode charge, and Faraday's constant (96485 C mol−1), respectively. z is the number of electrons transferred during water splitting (for HER, z = 2). 2.8 Theoretical calculation Density functional theory (DFT) simulations were performed by employing Cambridge Sequential Total Energy Package (CASTEP) module implemented in Material Studio. The generalized gradient approximation (GGA) with Perdew-Burke-Ernzerhof (PBE) functional was used to describe the electronic exchange and correlation effects, and the plane-wave energy cutoff was set to 500 eV. The self-consistent field (SCF) tolerance was 2 × 10−5 eV. To calculate the adsorption energy, the (111), (001), and (100) surfaces respectively for Ni, NiMoN, and Ni/NiMoN catalysts were modeled with vacuum width of 15 Å to avoid periodic interactions along the surface normal. The lattice vectors that are used to generate the corresponding crystal planes were [100] (axis a) and [010] (axis b) for NiMoN (001) surface, [1−10] (axis a) and [01−1] (axis b) for Ni (111) surface, and [010] (axis a) and [001] (axis b) for Ni/NiMoN (100) surface. A (3 × 3 × 1) Monkhorst-Pack mesh was used to perform geometry optimization, during which the convergence was established when the total energy change was smaller than 2 × 10−5 eV and the force on the atoms was less than 0.05 eV Å−1. The adsorption free energies of H (ΔG H*) is an effective descriptor for HER activity and the catalyst with ΔG H*=0 is an excellent candidate for HER. The Gibbs free-energy of H*(ΔG H*) can be calculated by the equation ΔG H* = ΔE H* + ΔE ZPE − TΔS, where ΔE H* is the adsorption energy of atomic hydrogen on the given unit cell; ΔE ZPE and ΔS are the difference corresponding to the zero-point energy between the adsorbed hydrogen and hydrogen in the gas phase and the entropy change of H* adsorption, respectively. ΔS can be obtained by ΔS = S (H*) − 1/2S 0 H2 (S 0 H2 is the entropy of H2 in the gas phase at standard conditions). As the entropy of hydrogen in absorbed state is negligible, ΔS can be calculated as −1/2S 0 H2. Therefore, the Gibbs free energy of H* can be taken as: ΔG H* = ΔE H*+ 0.24 eV. The adsorption energy (E ads) is given by the following equation: E ads = E system − E substrate − E adsorbate, where E system refers to the total energy of the optimized system; E substrate and E adsorbate refer to the energy of adsorbed layer and isolated adsorbate molecules, respectively. 3 Results and discussion 3.1 Synthesis and characterization The preparation process of the 3D hollow Ni/NiMoN nano-sheet arrays is schematically depicted in Fig. 1 (a). Initially, the NiMoO4 nanoflower precursor is synthesized through a simple hydrothermal process. After nitridation in NH3 atmosphere, the green powder turns black and the products exhibits noticeable magnetism, which is conducive to the separation of catalyst. The structure of the precursor is described via SEM and TEM. The SEM image (Fig. S1a) indicates the formation of 3D flower-like structure assembled from two-dimensional (2D) nano-sheet arrays with smooth surfaces. The formation of flower-like structure should be related with the use of urea as “slow-release” alkali [39]. Notably, the product shows rod-like structure without adding urea (Fig. S1b). The TEM images further confirm the 3D hollow structure of the NiMoO4 precursor (Fig. S1c and d). The scanning TEM (STEM) image and the elemental mappings (Fig. S1e) demonstrate the homogeneous distribution of Ni, Mo, and O throughout the nanosheets. After the nitriding, the diffraction peaks of the sample (Fig. 1b) can be allocated to the Ni metal (JCPDS:89-7128) and Ni0.2Mo0.8N (JCPDS:89-5026) phases, indicating the successful preparation of Ni/NiMoN compound. The SEM images of Ni/NiMoN (Fig. 1c and d) show a flower-like morphology assembled from 2D nano-sheet arrays without collapsing, being similar to that of the precursor. The high-magnification SEM images reveal the rough surface of Ni/NiMoN sample, which is beneficial for exposing more active sites. The 3D hierarchical nano-sheet arrays structure can effectively promote the electrolyte diffusion and the release of air bubbles during electrocatalysis [14,18,20]. All these characteristics contribute to the improvement of electrocatalytic performance. TEM test was conducted to give further insights into the structure and composition information. The TEM image (Fig. 1e) indicates the apparent hollow structure. The high-magnification TEM image further demonstrates the rough surface of nanosheets and there are some nanoparticles at the edges of the nanosheets (Fig. 1f). The adjacent lattice fringes of the (200) planes of Ni and (100) planes of Ni0.2Mo0.8N can be obviously observed in high-resolution TEM (HRTEM) image (Fig. 1g), confirming the formation of Ni0.2Mo0.8N and Ni heterointerfaces. The construction of heterogeneous surfaces promotes the electron redistribution, leading to effective synergistic catalysis [21]. In electrocatalytic reactions, the heterogeneous interfaces adjust the surrounding electronic environment, expose numerous active sites, enhance electron transfer, and optimize the adsorption/desorption of reactants and intermediates, thus enhancing the performance largely [40,41]. The elemental mapping (Fig. 1h) displays the uniform distribution of Mo, Ni, and N elements in the Ni/NiMoN catalyst. Additionally, EDX line scanning was conducted to study the elemental distribution of particles in Ni/NiMoN nano-sheet arrays. Two lines (L1 and L2 in Fig. S2) were selected to detect Ni, Mo, and N elements. As shown in Fig. S2, the Ni, Mo, and N elements are evenly distributed throughout the entire Ni/NiMoN nano-sheet arrays, consistent with the EDX mapping results. XPS analysis was carried out to analyze elemental composition and the surface chemical states of the samples. The XPS survey spectra of Ni/NiMoN and NiMoN-24E samples display the existence of Ni, Mo, N, C, and O elements (Fig. 2 a). The survey spectrum of Ni/NiMoN shows the coexistence of Mo with Ni and N elements, which agrees well with the EDX results. As shown in Ni 2p spectrum (Fig. 2b), the peaks at 873.4 and 855.7 eV can be attributed to Ni2+ 2p 1/2 and Ni2+ 2p 3/2 from the Ni, respectively [42]. The weaker peaks at 869.5 and 852.4 eV can be identified as Ni0 from the metallic Ni [43]. The relative content of Ni to NiMoN-24E was further determined by calculating the peak areas of Ni0 and Ni2+ displayed in the Ni 2p spectrum. The peak area of Ni0 accounts for 30.04 at%, and that of Ni2+ accounts for 6.92 at%. The ratio of Ni to NiMoN-24E is 1:4.34 (Table S2) [44,45]. The Ni 2p peaks of Ni/NiMoN exhibit a positive shift of 0.4 eV compared to the Ni sample, indicating that electrons transfer from Ni to the nearby atoms [46]. The Mo 3d spectrum (Fig. 2c) shows that there are three valence states (+3, +4, and +6) in Ni/NiMoN catalyst [47]. The peaks observed at 228.9 and 232.4 eV indicate the presence of Mo3+ in metal nitride. These Mo3+ ions can be considered as the main active center for HER due to following characteristics [48]. For example, an unfilled d orbital of Mo3+ can better participate in the electron transfer process to promote the electrochemical reactions [49]. The vacancy energy level on Mo3+ is favorable to catalyzing water dissociation and the generation of hydrogen atoms [50]. Moreover, Mo3+ is more stable in water than Mo with other valence states, being favorable to maintaining long-term activity [51]. Meanwhile, the Mo 3d 5/2/3d 3/2 peaks of Mo4+ and Mo6+ are located at 230.3/233.4 eV and 231.9/235.2 eV, respectively [52,53]. The Mo 3d peaks for Ni/NiMoN shift negatively by 0.3 eV compared to that of the NiMoN-24E sample. The above results indicate that there is an interaction between Ni and NiMoN-24E, which leads to the redistribution of electrons at the hetero-interface and the adjustment of the electronic structure, thus improving the electrocatalytic performance. Fig. 2(d) displays the spectrum of N 1s. The peak at 397.1 eV corresponds to N bonding to Mo/Ni, further indicating the formation of the nitride. Meanwhile, the peak at 394.8 eV corresponds to Mo 3p 3/2. The peak located at 399.1 eV can be attributed to the N–H groups, suggesting the abundance of H species on the surface of samples [54]. These surface H species may originate from an incomplete reaction with NH3. The result suggests that the surface N ions can interact strongly with H species, which is beneficial for promoting HER [55]. XPS analysis confirms the presence of Ni, Mo, and N corresponding to the Ni/NiMoN compounds. It also indicates the occurrence of electron transfer between Ni and NiMoN-24E components. This transfer leads to the redistribution of electrons at the heterogeneous interface, thereby modulating the electronic structure and improving the catalytic performance [17] To investigate the phase and morphology evolution process of the 3D hollow hierarchical nano-sheet arrays structure, the temperature-dependent experiments were performed. The formation process of the hybrid structure was detected by XRD, TEM, and SEM. Fig. S3(a and d) shows the XRD patterns of Ni/NiMoN-5 and Ni/NiMoN-7 samples. The peak position is the same as that of the Ni/NiMoN sample, but the intensity has a certain change, indicating that the crystallinity of the catalyst can be effectively controlled. From the TEM and SEM images of Ni/NiMoN-5 (Fig. S3 b and c), the morphology of nanoflowers assembled from nano-sheet arrays can be maintained. Nevertheless, as the temperature rises to 700 °C, the Ni/NiMoN-7 sample exhibits significant aggregation phenomenon (Fig. S3e and f), which reduces the exposure of active sites. Furthermore, the contrastive samples (Ni and Mo3N2) were also characterized by XRD and SEM. As depicted in Figs. S4 and S5, the Ni sample exhibits nanoparticle morphology, and the Mo3N2 sample shows the morphology of aggregated nanoribbons. Fig. S6 shows the N2 adsorption/desorption isotherms of Ni/NiMoN catalysts. The specific surface area of the Ni/NiMoN is 60.8 m2 g−1, larger than that of Ni/NiMoN-5 (46.6 m2 g−1) and Ni/NiMoN-7 (35.2 m2 g−1), which is favorable for the mass transfer and the contact between electrolyte and active sites to promote electrocatalysis. Considering that the reaction process takes place at the three-phase interface of solid-liquid-gas, it involves both the generation and release of gas. Therefore, mass transfer and bubble release have a significant impact on the overall electrocatalytic efficiency [22]. According to the droplet contact angle measurements (the upper panel of Fig. 3a–c), it was observed that the Ni/NiMoN sample displayed a small droplet contact angle (CA) of 6.07°, indicating its super-hydrophilic nature in comparison to the NiMoN-6E (CA = 17.49°) and Ni (CA = 47.60°) samples, proving that the Ni/NiMoN sample was super-hydrophilic. Besides, underwater bubble contact angle analysis (the lower panel of Fig. 3a–c) revealed that Ni/NiMoN exhibited the bubble contact angle of is 155.7°, while Ni and NiMoN-6E showed bubble contact angles of 144.0° and 154.5°, respectively. This reflects the good aerophobicity performance of Ni/NiMoN [38]. Moreover, the superaerophobic properties of Ni/NiMoN were further proved by testing the adhesive force of bubbles to the electrode surface in water [18]. As shown in Fig. 3(d), the bubble adhesion force on the Ni/NiMoN catalyst is 28.81 μN, which is even lower than the reported 76.0 μN of adhesive force for Pt nanosphere films [56]. The results demonstrate that the complex nano-sheet arrays structure of the Ni/NiMoN catalyst creates a superoxophobic surface that significantly reduces bubble adhesion [20]. The low adhesive force is beneficial for enhancing gas bubble separation from the electrode surface, thereby improving the performance. In a word, owing to the unique 3D hollow hierarchical nano-sheet arrays structure and chemical composition, the Ni/NiMoN sample is super-hydrophilic and aerophobicity. When Ni/NiMoN is used as the catalysts for HER and UOR, the super-hydrophilic surface will promote the effective contact between the reactants and catalyst in the electrolyte, and the aerophobicity surface will enhance the emission of the generated bubbles (H2, N2, and CO2) [21,56]. Thus, the good mass transfer kinetics and the catalytic properties of Ni/NiMoN for HER and UOR can be ensured. 3.2 Electrocatalytic performance The electrocatalytic performance of the Ni/NiMoN catalysts was assessed in a three-electrode system. To avoid any possible effect of Pt, graphite rod was used as counter electrode. The HER catalytic activity of the as-prepared catalysts was measured mainly in 1.0 M KOH electrolyte and the polarization curves without iR rectification were gained by LSV tests. Fig. 4 (a) displays the polarization curves of different samples. A rapidly increased cathodic current response for the Ni/NiMoN sample is observed at low overpotentials, indicating its excellent HER activity. Several materials are commonly used as substrate for supporting the electrocatalysts, primarily including foam nickel (NF) and carbon paper (CP). In present work, the catalytic performance of Ni/NiMoN on CP substrate is slightly inferior to that on NF substrate. Additionally, the bare NF substrate showed a poor activity with the onset potential of 256 mV and the overpotential at 10 mA cm−2 (η 10) of 345 mV, implying its minimal effect on the HER performance of Ni/NiMoN catalyst (Fig. S7). In Fig. 4(b) and Fig. S8(a), the Ni/NiMoN catalyst needs low overpotentials of 25 and 130 mV to reach 10 and 100 mA cm−2 current density, respectively, much smaller than those of Ni (145 and 331 mV), Mo3N2 (173 and 333 mV), Ni/NiMoN-5 (35 and 186 mV), and Ni/NiMoN-7 (76 and 290 mV), as well as close to commercial 20% Pt/C (19 and 117 mV) catalysts, indicating that the construction of heterointerface and 3D architecture can significantly improve electrocatalytic performance. The heterointerface may modulate electron distribution and enhance electron transfer, thereby promoting the adsorption/desorption of both intermediates and reactants. To better explain the collaborative effect between Ni and NiMoN, the prepared Ni/NiMoN sample was immersed in 2 M HCl and stirred for different times to remove a certain amount of metal nickel in Ni/NiMoN catalyst to reduce the heterointerface. With the increase of etching time, the peak intensity of Ni decreased gradually in the XRD patterns (Fig. S9a), indicating that the content of metal nickel in the sample is getting less and less. The change in the proportion of metal after etching was also confirmed by inductively coupled plasma optical emission spectrometer (ICP-OES). According to the results of the ICP-OES test, the ratio of Ni to Mo in Ni/NiMoN catalyst is 1.25:1. The ratio of Ni to Mo in NiMoN-6E, NiMoN-12E, and NiMoN-24E is 1:6.63, 1:8.69, and 1:14.98, respectively. With the increase of etching time, the proportion of nickel gradually decreases. This demonstrates the successful etching of the nickel metal (Table S3). As shown in Fig. S9(b), with the increase of soaking time, the HER activity of the obtained samples becomes worse, which further proves that the construction of heterointerface can effectively promote the catalytic activity. Tafel slope values were subsequently computed to explain the inherent catalytic kinetics of as-prepared catalysts. As displayed in Fig. 4(c) and Fig. S8(b), Ni/NiMoN catalyst has low Tafel slope value of 49 mV dec−1, which is close to the standard commercial Pt/C catalysts (43 mV dec−1) and smaller than the other contrast samples, indicating that the HER kinetics of Ni/NiMoN is faster than that of other catalysts and the HER on Ni/NiMoN catalysts should follow the Volmer-Heyrovsky mechanism. As shown in Fig. S10, the exchange current density (j 0) of Ni/NiMoN is 2.51 mA cm−2, larger than Ni/NiMoN-5 (1.58 mA cm−2), Ni/NiMoN-7 (0.71 mA cm−2), Ni (0.99 mA cm−2), Mo3N2 (0.35 mA cm−2), and NiMoN-6E (1.98 mA cm−2), suggesting the remarkable H2 evolution activity of the Ni/NiMoN. The C dl is roughly proportional to the ECSA, which was measured by CV within the non-faradaic potential region (0.12–0.22 V vs. RHE) at different scan rates (Fig. S11). The C dl value of Ni/NiMoN is 85.0 mF cm−2 (Fig. 4d and Fig. S12a), larger than that of the other studied electrocatalysts. The high C dl value of Ni/NiMoN catalyst suggests the presence of numerous catalytic active sites, contributing to good HER performance. Thanks to the flower-like structure and rich phase boundaries in the catalyst, the ECSA of Ni/NiMoN (2125 cm2) is twice that of the NiMoN-6E (1005 cm2), and much larger than that of the Ni (485 cm2) and Mo3N2 (235 cm2) catalysts (Fig. S12b). Moreover, the ECSA-normalized LSV curves show that Ni/NiMoN catalyst has higher current density than the other catalysts at the same potential (Fig. S12c and d), suggesting a higher intrinsic per-site activity of the Ni/NiMoN catalyst. In addition, the TOF of the samples was tested. At an overpotential of 100 mV, Ni/NiMoN exhibited a higher TOF value (0.519 s−1) compared to the other samples, suggesting additional highly active sites of Ni/NiMoN (Fig. S13). Electrochemical impedance spectroscopy (EIS) measurements were performed to assess the charge transfer resistance (R ct) of the catalyst. In Fig. 4(e), semicircular shapes are showed by fitting the EIS data. The corresponding fitted equivalent circuit model is shown in the inset in Fig. 4(e). The smaller R ct proves faster catalytic kinetics and higher charge transfer rate [57]. The Ni/NiMoN catalyst has a smaller R ct of 4.7 Ω at the electrode/electrolyte interface compared to other catalysts, indicating the faster electron transport during the electrocatalytic reaction. The stability of Ni/NiMoN was also evaluated (Fig. 4f). The polarization curves of Ni/NiMoN catalyst after 3000 and 8000 cycles of CV testing almost overlap with the initial one. In addition, the I-t curve reveals that the current density slightly decays after the Ni/NiMoN catalyst is continuously operated for 96 h, demonstrating excellent stability of Ni/NiMoN for HER (insert in Fig. 4f). The samples were subsequently analyzed by XRD, SEM, and XPS after the stability test. The SEM image (Fig. S14a) shows that the Ni/NiMoN still maintains hierarchical structure after HER test. The XRD pattern (Fig. S14b) presents the similar diffraction peaks before and after the HER test, indicating that the crystal phase has not changed. Furthermore, the XPS spectra of Ni 2p and Mo 3d also demonstrate similar peaks to the original spectra (Fig. S14c and d), further proving the structural stability of Ni/NiMoN. The contents of Mo and Ni in catalyst and electrolyte after HER were also analyzed by ICP-OES (Table S3). After HER test, the Mo content of Ni/NiMoN catalyst slightly decreases, while the Mo is detected in the electrolyte. This indicates the dissolution of Mo in the catalyst during the HER test. The dissolved Mo contributes to the HER activity and durability of Ni/NiMoN through dissolution-re-deposition cycles [53]. Overall, these experimental results indicate that the Ni/NiMoN catalyst exhibits excellent stability for HER. Moreover, the HER activity of Ni/NiMoN is superior to the most reported NiMo-based catalysts (Fig. 4g and Table S4). The results indicate the Ni/NiMoN catalyst shows good HER activity and stability in 1.0 M KOH solution. We further evaluated the electrocatalytic performance of Ni/NiMoN catalysts in neutral media (1.0 M PBS). As shown in Fig. 5 (a and b) and Fig. S15(a), Ni/NiMoN displays superior electrocatalytic behavior for HER (η 10 = 68 mV), exceeding NiMoN-6E (η 10 = 142 mV), Ni (η 10 = 251 mV), Mo3N2 (η 10 = 290 mV), Ni/NiMoN-5 (η 10 = 100 mV), Ni/NiMoN-7 (η 10 = 181 mV), and most of reported catalysts (Fig. 5g and Table S5). Fig. 5(c) exhibits that the Tafel slope of Ni/NiMoN is 60 mV dec−1, which is lower than that of the other samples. The low Tafel slope suggests that Ni/NiMoN catalyst also obeys the Volmer-Heyrovsky mechanism in the neutral solution. In addition, Ni/NiMoN catalyst has much larger j 0 value than Ni/NiMoN-5, Ni/NiMoN-7, NiMoN-6E, Mo3N2, and Ni catalysts (Fig. S15c and d), further demonstrating its good HER performance in 1.0 M PBS. The C dl values of different samples were also computed (Fig. S16a–f). The C dl value for Ni/NiMoN-5, Ni/NiMoN, Ni/NiMoN-7, Mo3N2, Ni, and NiMoN-6E catalysts is 35.7, 64.8, 12.9, 5.1, 13.8, and 33.5 mF cm−2, respectively (Fig. 5d and Fig. S16g). The larger C dl value and higher current density from the ECSA normalized polarization curves (Fig. S16h) indicate that the Ni/NiMoN has visible advantage in terms of catalytic active sites and active surface area over other catalysts. Moreover, Ni/NiMoN catalyst presents the fastest charge transfer rate among the as-prepared catalysts (Fig. 5e), because of the synergism of NiMoN and Ni. Besides, the Ni/NiMoN heterojunction catalyst also displays excellent durability in 1.0 M PBS solution (Fig. 5f). The Ni/NiMoN heterojunction retains significant activity after 80 h of continuous testing in 1 M PBS electrolyte (the inset of Fig. 5f). To achieve the energy-saving H2 production, UOR was selected to replace the sluggish OER [23]. The UOR and OER activity of Ni/NiMoN catalyst was assessed by LSV in 1.0 M KOH with 0.5 M urea and 1.0 M KOH, respectively. As displayed in Fig. 6 (a), the Ni/NiMoN catalyst achieves a lower UOR onset potential of 1.31 V (vs. RHE), and the current density increases rapidly after the potential is exceeded. In addition, Ni/NiMoN catalyst needs the cell voltage of 1.39 V to reach 100 mA cm−2 current density in catalytic UOR, which is 277 mV lower than that in the OER. The result indicates that UOR is more favorable than OER at low potential. Furthermore, the UOR current density of the Ni/NiMoN catalyst was higher than that of Ni/NiMoN-5, Ni/NiMoN-7, NiMoN-6E, NiMoN-24E, Ni, Mo3N2, and RuO2 at the potential of 1.395 V (Fig. 6b and Fig. S17a), suggesting that the formation of heterojunctions can significantly improve the UOR activity. Additionally, to determine the role of Mo in the catalyst, we synthesized a Ni/NiN catalyst following a methodology similar to the Ni/NiMoN. As displayed in Fig. S18, the Ni/NiN catalyst exhibits inferior HER and UOR performance compared to Ni/NiMoN catalysts, revealing that the synergy between Ni and Mo is beneficial for improving catalytic performance. The UOR kinetics of Ni/NiMoN catalysts was explored. The Ni/NiMoN catalyst has a small Tafel slope of 22 mV dec−1, smaller than that of Ni/NiMoN-5 (35 mV dec−1), Ni/NiMoN-7 (49 mV dec−1), NiMoN-6E (39 mV dec−1), Ni (50 mV dec−1), Mo3N2 (75 mV dec−1), and RuO2 (66 mV dec−1) samples (Fig. 6c and Fig. S17b), demonstrating the fast electron transfer rate and a superior UOR catalytic kinetics of the Ni/NiMoN catalyst. In addition, based on the obtained CVs (Fig. S19a–f), the Ni/NiMoN catalyst has the largest C dl value (72.2 mF cm−2) compared with other catalysts (Fig. 6d and Fig. S19g). Moreover, the ECSA of Ni/NiMoN (1805 cm2) is much larger than that of NiMoN-6E (1202.5 cm2), Ni (497.5 cm2), Mo3N2 (285 cm2), Ni/NiMoN-5 (1372.5 cm2), and Ni/NiMoN-7 (622.5 cm2) catalysts (Fig. S19h). The results showed that the controlled nitridation treatment to construct 3D hollow flower-like structures can effectively increase the exposure of catalytic active sites, thus contributing significantly to improve the catalytic activity. In addition, the EIS was performed to investigate the UOR kinetics. In Fig. 6(e), the Ni/NiMoN catalyst has the lowest R ct value (4.2 Ω), in agreement with the Tafel slope, further confirming its good UOR charge transfer kinetic properties. The Ni/NiMoN catalyst shows a low Tafel slope, large ECSA, and small charge transfer resistance, implying a good UOR performance, which is superior to most of the non-noble metal catalysts reported recently (Table S6). In comparison to the Mo3N2 sample, the enhanced catalytic activity of the Ni/NiMoN, Ni, and NiMoN-6E catalysts suggests that the Ni species may serve as the electrocatalytically active sites of UOR [33]. For these Ni-based materials, the formation of Ni3+ (NiOOH) during the anodization process has been identified as the catalytic active site [31,35]. The long-term stability of the catalysts was also measured. Notably, the LSV curve of the Ni/NiMoN catalyst displays a slight variation at high current density after 3000 and 5000 cycles (Fig. 6f), demonstrating its excellent catalytic stability. More, the chronoamperometric response of the catalyst at 1.33 V shows that the current density remains reasonably stable for 72 h of continuous operation (the inset of Fig. 6f). The SEM images (Fig. S20a and b) reveal that the morphology of the Ni/NiMoN catalyst is slightly changed, but still possesses the structure of nanosheets. TEM image (Fig. S20c) further shows the formation of many small nanolayers, which proves that the structural recombination occurs during the UOR process. The HRTEM image (Fig. S20d) displays the clear amorphous layer with thickness approximately 5 nm. It is inferred that the amorphous layer (nickel hydrogen oxide or nickel oxygen) was formed in situ on NiMoN [31,32]. The XRD pattern (Fig. S20e) of the post-UOR sample is consistent with that of the fresh catalyst. The XPS results (Fig. S20f and g) reveal the formation of Ni3+ and the increased Mo6+ content after UOR treatment. These results are caused by the surface corrosion and oxidation of Ni/NiMoN to produce the corresponding oxide/oxy(hydroxide) species, which can further optimize the oxidation activity as main UOR species [33]. ICP-OES analysis was conducted to determine the Mo and Ni contents in the catalyst and electrolyte after UOR. Table S3 demonstrates that the electrolyte contains a low level of Ni and high-level of Mo throughout the process. This observation suggests that the surface reconstruction process of Ni/NiMoN is rapid and self-terminating, preventing complete reconstruction and forming stable high-valent Ni active structures. The Mo in Ni/NiMoN is assumed to be oxidized and subsequently dissolved in the electrolyte, leaving the amorphous nickel hydrogen oxide or nickel oxygen [27]. The above results clearly indicate the outstanding stability of Ni/NiMoN for UOR in the alkaline environment. The molecular structure of urea is intricate, featuring both electron-donating amino (NH2) groups and electron-withdrawing carbonyl (CO) groups [58]. The adsorption behavior of urea on catalysts has a significant impact on the reaction dynamics of UOR. To elucidate the crucial role of the NH2 and CO groups in UOR, we investigated the electro-oxidation reaction of urea analogues (methylurea and thiourea here) on Ni/NiMoN catalyst (Fig. S21). In this case, the O or H atom in urea is substituted with a S atom or a methyl group. The Ni/NiMoN catalyst shows low catalytic activity for both methylurea and thiourea oxidation. This outcome highlights the influence of the groups present in the reactants (such as urea) on the adsorption of reactant molecules in the oxidation reaction [33]. Meanwhile, the influence of urea on the HER performance of the Ni/NiMoN catalyst was also evaluated (Fig. S22), and it was found that the difference in the HER polarization curves in the presence of urea was negligible, indicating that the catalyst can resist urea interference during the HER and can be used as an electrode to promote H2 generation in coupled HER and UOR systems. 3.3 DFT calculations DFT calculations were performed to gain insights into the synergistic effects of heterogeneous surface engineering of Ni/NiMoN on enhancing the electrocatalytic activity of UOR and HER (Fig. S23a). Theoretical models of single-phase NiMoN and Ni were also built as a comparison (Fig. S23b and c). The charge density differences (Fig. 7 a) indicate the presence of electron aggregation at the interface, with the pink and blue regions being the electron depletion and electron accumulation regions, respectively [8]. The results confirm the existence of the strong charge interaction between Ni and NiMoN. To get a better understanding of the effect of d-electron modulation on the electrocatalytic performance of HER, the density of states (DOS) was calculated for Ni, NiMoN, and Ni/NiMoN, respectively (Fig. 7b). DFT calculations display that the d-band centers (ε d ) of Ni/NiMoN, Ni, and NiMoN are −0.90, −1.25, and −0.72 eV, respectively. The εd value of Ni is the farthest from the Fermi level (E f), indicating that the Ni catalyst is not conducive to adsorption. On the other hand, the εd value of NiMoN is closer to the E f, indicating stronger adsorption capability of the active sites on the NiMoN surface for reaction intermediates. In the heterostructure formed by Ni and NiMoN, the interfacial electric field within the heterojunction regulates the d-band center at different locations, thereby enhancing the electronic environment around the metal. This improvement results in enhanced adsorption performance for intermediates and achieves an equilibrium state of adsorption and desorption. Compared with single-phase NiMoN and Ni, Ni/NiMoN heterojunction has a moderate d-band center to reach the adsorption-desorption equilibrium, thus optimizing the Gibbs free energy of hydrogen adsorption (ΔG H*) and improving the inherent electrocatalytic activity [1,33]. Furthermore, the continuous distribution of the density of states near the Fermi energy level in Fig. 7(c) suggests the Ni/NiMoN has good electrical conductivity, indicating the fast electron transport [59]. ΔG H* serves as a key parameter for evaluating the HER activity. To achieve optimal hydrogen adsorption and desorption strength, the ΔG H* value should be close to zero. We conducted calculations to determine the ΔG H* on different sites, as depicted in Fig. 7(d). In the Ni/NiMoN catalyst, the ΔG H* value of the N site (−0.07 eV) is closer to zero compared to that of the Ni site (−0.7 eV) and Mo site (−0.62 eV), indicating that the adsorption of H on N sites is more active than that on Ni and Mo sites. Furthermore, by comparing the ΔG H* value of different sites of Ni (0.17 eV) and NiMoN (−0.88 eV), it is observed that Ni/NiMoN exhibits more favorable H* adsorption kinetics for HER. Therefore, the introduction of N adjusts the surrounding electronic environment and influences the d-band center, ultimately affecting the adsorption capacity of different intermediates and optimizing the catalytic activity [58,60]. Additionally, five main stages were considered in the DFT calculations, including water adsorption, dissociation to form H* intermediates (Volmer step), and hydrogen gas generation (Tafel step or Heyrovsky step). The free energy diagram of the model is shown in Fig. 7(e). The results indicate that Ni and NiMoN require overcoming higher energy barriers (0.79 and 0.98 eV) in the process of *[OH–H] to *H. Conversely, the energy barrier for Ni/NiMoN is considerably lower (0.53 eV), suggesting that the formation of the heterojunction can effectively enhances the kinetics of the HER process. Therefore, Ni synergistically promotes the thermodynamics and kinetics of alkaline HER with NiMoN, which is consistent with the experimental results. Meanwhile, the adsorption energy of H2O and urea on Ni, NiMoN, and Ni/NiMoN heterojunction catalysts is calculated (Fig. 7f and Fig. S24). The water adsorption energy of Ni/NiMoN heterojunction (−0.60 eV) is lower than that of Ni (−0.50 eV) and NiMoN (−0.11 eV), suggesting that heterostructure catalyst is prone to the initial catalytic-H2O state, which is favorable for the HER process in alkaline electrolyte. Meanwhile, Ni/NiMoN heterojunction catalyst has a more negative urea adsorption energy (−0.68 eV) compared to NiMoN (−0.30 eV) and Ni (−0.12 eV), which suggests that the Ni/NiMoN heterojunction can effectively bind and enhance the individual component advantage, optimizing the adsorption of urea molecules at a large extent, thereby achieving efficient urea oxidation performance. The redistribution of charges during the catalytic reaction directly affects the adsorption/desorption energy of intermediate and enhances the separation of water and urea [11,61]. The results of DFT calculations show that the construction of Ni/NiMoN heterostructures can effectively tune the electronic structure, thereby Optimizing adsorption/desorption of reactants and intermediates to improve electrocatalytic performance. 3.4 Urea assisted water electrolysis performance Based on the outstanding HER and UOR electrocatalytic performance of Ni/NiMoN electrode, the energy-saving H2 production system was constructed, using Ni/NiMoN as both anode and cathode for UOR and HER. For comparison, the traditional electrolytic water (HER and OER) was also carried out. The polarization curves of HER&UOR system and the traditional HER&OER system are shown in Fig. 8 (a). The Ni/NiMoN||Ni/NiMoN coupled HER&UOR system needs only 1.42 V cell voltage to obtain the current density of 10 mA cm−2, significantly smaller than traditional water splitting (1.61 V). In addition, the HER&UOR system shows greater advantages with the increase of current density (Fig. 8b), indicating that substituting OER with UOR is an efficient way for energy-efficient H2 production. Moreover, the overall electrocatalytic performance of Ni/NiMoN||Ni/NiMoN is even superior to the noble metal-based catalysts (Pt/C||RuO2) (Fig. 8c and d). The long-term stability of the catalyst in the HER&UOR system was tested. As shown in Fig. 8(e), only a slight decay in current density was observed after chronoamperometric test for 96 h, showing the high stability of Ni/NiMoN||Ni/NiMoN for urea electrolysis system. The produced hydrogen was measured by the drainage method (Fig. 8g). The Faradaic efficiency in HER was measured to be 98.9% (Fig. 8f), indicating that the Ni/NiMoN catalyst has a strong ability of hydrogen production in the HER&UOR system. For practical applications, building solar systems is a prospective approach to achieve economical and continual H2 production. Fig. 8(h) shows that the HER&UOR system can be driven by the solar panel at a lower battery voltage of 1.42 V. The anode generates N2 and CO2 bubbles through UOR, and the cathode generates and escapes H2 bubbles (Fig. 8i and Video S1). This result indicates that the 3D hollow flower-like structure not only facilitates the permeation of electrolytes and reactants, but also provides an efficient dispersion pathway for the quick release of gaseous products. In addition, the Ni/NiMoN||Ni/NiMoN shows better overall electrocatalytic performance than many reported noble metal-free catalysts (Table S7), indicating that the Ni/NiMoN can become a prospective electrode for the energy-efficient H2 production in the coupled HER&UOR system. 4 Conclusions In summary, we have proved that the hollow Ni/NiMoN materials are suitable as bifunctional electrocatalysts for HER and UOR. The design of a 3D hierarchical structure with arrayed-sheet surface provides the super-hydrophilic/aerophobic properties, causing the easy escape of bubbles from the electrode. The heterojunctions can promote the transfer of the electrons and modify the interface electronic structure, optimizing adsorption/desorption of reactants and intermediates. So, the Ni/NiMoN catalysts exhibit excellent HER performance close to that of Pt/C catalysts and excellent UOR performance. The cell voltage of the urea-assisted electrolytic H2 production system (HER&UOR) based on the catalyst dropped significantly to 1.42 V at 10 mA cm−2, 209 mV lower than traditional HER&OER system. This work shows that a combined manipulation of the surface property and electronic structure provides an effective way for designing effective catalysts. CRediT authorship contribution statement Yuying Fan: Data curation, Investigation, Writing – original draft. Ying Gu: Formal analysis, Investigation, Methodology. Dongxu Wang: Formal analysis, Investigation. Yanqing Jiao: Formal analysis, Investigation. Aiping Wu: Conceptualization, Investigation, Methodology, Writing – review & editing. Chungui Tian: Conceptualization, Supervision, Writing – review & editing. Declaration of competing interest The authors declare that they have no known competing financial interests or personal relationships that could have appeared to influence the work reported in this paper. Acknowledgments This work was financially supported by the National Key R&D Program of China (2022YFA1503003), the National Natural Science Foundation of China (91961111, 22271081), the Natural Science Foundation of Heilongjiang Province (ZD2021B003), the University Nursing Program for Young Scholars with Creative Talents in Heilongjiang Province (UNPYSCT-2020004). Thanks to Prof. G. A. Iridievich for the support on the work. The Basic Research Fund of Heilongjiang University in Heilongjiang Province (2021-KYYWF-0039), and the Heilongjiang University Excellent Youth Foundation are also acknowledged. Appendix A Supplementary material Supplementary data to this article can be found online at https://doi.org/10.1016/j.jechem.2024.04.002. Appendix A Supplementary material The following are the Supplementary data to this article: Supplementary video 1 Supplementary Data 2 References [1] X. Zheng J. Yang P. Li Z. Jiang P. Zhu Q. Wang J. Wu E. Zhang W. Sun S. Dou D. Wang Y. Li Angew. Chem. Int. Ed. 62 2023 e202217449 X. Zheng, J. Yang, P. Li, Z. Jiang, P. Zhu, Q. Wang, J. Wu, E. Zhang, W. Sun, S. Dou, D. Wang, Y. Li, Angew. Chem. Int. Ed. 62 (2023) e202217449. [2] X. Tian P. Zhao W. Sheng Adv. Mater. 31 2019 1808066 X. Tian, P. Zhao, W. Sheng, Adv. Mater. 31 (2019) 1808066. [3] J. Zhang Q. Zhang X. Feng Adv. Mater. 31 2019 1808167 J. Zhang, Q. Zhang, X. Feng, Adv. Mater. 31 (2019) 1808167. [4] S. Jiao X. Fu S. Wang Y. Zhao Energy Environ. Sci. 14 2021 1722 1770 S. Jiao, X. Fu, S. Wang, Y. Zhao, Energy Environ. Sci. 14 (2021) 1722–1770. [5] Q. Sun N. Wang Q. Xu J. Yu Adv. Mater. 32 2020 2001818 Q. Sun, N. Wang, Q. Xu, J. Yu, Adv. Mater. 32 (2020) 2001818. [6] X. Xiao L. Yang W. Sun Y. Chen H. Yu K. Li B. Jia L. Zhang T. Ma Small 18 2021 2105830 X. Xiao, L. Yang, W. Sun, Y. Chen, H. Yu, K. Li, B. Jia, L. Zhang, T. Ma, Small 18 (2021) 2105830. [7] Z. Gao L. Xiao X. Su X. He Y. Yu X. Huang F. Luo J. Energy Chem. 53 2021 358 363 Z. Gao, L. Xiao, X. Su, X. He, Y. Yu, X. Huang, F. Luo, J. Energy Chem. 53 (2021) 358–363. [8] G. Yang Y. Jiao H. Yan Y. Xie C. Tian A. Wu Y. Wang H. Fu Nat. Commun. 13 2022 3125 G. Yang, Y. Jiao, H. Yan, Y. Xie, C. Tian, A. Wu, Y. Wang, H. Fu, Nat. Commun. 13 (2022) 3125. [9] D.M. Morales D. Jambrec M.A. Kazakova M. Braun N. Sikdar A. Koul A.C. Brix S. Seisel C. Andronescu W. Schuhmann ACS Catal. 12 2022 982 992 D.M. Morales, D. Jambrec, M.A. Kazakova, M. Braun, N. Sikdar, A. Koul, A.C. Brix, S. Seisel, C. Andronescu, W. Schuhmann, ACS Catal. 12 (2022) 982–992. [10] S. Zheng H. Qin X. Cao T. Wang W. Lu L. Jiao J. Energy Chem. 70 2022 258 265 S. Zheng, H. Qin, X. Cao, T. Wang, W. Lu, L. Jiao, J. Energy Chem. 70 (2022) 258–265. [11] X. Xu X. Wei L. Xu M. Huang A. Toghan J. Energy Chem. 85 2023 116 125 X. Xu, X. Wei, L. Xu, M. Huang, A. Toghan, J. Energy Chem. 85 (2023) 116–125. [12] X. Gao S. Zhang P. Wang M. Jaroniec Y. Zheng S. Qiao Chem. Soc. Rev. 53 2024 1552 X. Gao, S. Zhang, P. Wang, M. Jaroniec, Y. Zheng, S Qiao, Chem. Soc. Rev. 53 (2024) 1552. [13] J. Li J. Li T. Liu L. Chen Y. Li H. Wang X. Chen M. Gong Z.P. Liu X. Yang Angew. Chem. Int. Ed. 60 2021 26656 26662 J. Li, J. Li, T. Liu, L. Chen, Y. Li, H. Wang, X. Chen, M. Gong, Z.P. Liu, X. Yang, Angew. Chem. Int. Ed. 60 (2021) 26656–26662. [14] J. Zhang X. Song L. Kang J. Zhu L. Liu Q. Zhang D.J.L. Brett P.R. Shearing L. Mai I.P. Parkin G. He Chem Catal. 2 2022 3254 3270 J. Zhang, X. Song, L. Kang, J. Zhu, L. Liu, Q. Zhang, D.J.L. Brett, P.R. Shearing, L. Mai, I.P. Parkin, G. He, Chem Catal. 2 (2022) 3254–3270. [15] M. Li X. Wu K. Liu Y. Zhang X. Jiang D. Sun Y. Tang K. Huang G. Fu J. Energy Chem. 69 2022 506 515 M. Li, X. Wu, K. Liu, Y. Zhang, X. Jiang, D. Sun, Y. Tang, K. Huang, G. Fu, J. Energy Chem. 69 (2022) 506–515. [16] L. Wang L. Song Z. Yang Y.M. Chang F. Hu L. Li L. Li H.Y. Chen S. Peng Adv. Funct. Mater. 33 2022 2210322 L. Wang, L. Song, Z. Yang, Y.M. Chang, F. Hu, L. Li, L. Li, H.Y. Chen, S. Peng, Adv. Funct. Mater. 33 (2022) 2210322. [17] L. Wang Y. Hao L. Deng F. Hu S. Zhao L. Li S. Peng Nat. Commun. 13 2022 5785 L. Wang, Y. Hao, L. Deng, F. Hu, S. Zhao, L. Li, S. Peng, Nat. Commun. 13 (2022) 5785. [18] L. Shang Y. Zhao X.-Y. Kong R. Shi G.I.N. Waterhouse L. Wen T. Zhang Nano Energy 78 2020 105375 L. Shang, Y. Zhao, X.-Y. Kong, R. Shi, G.I.N. Waterhouse, L. Wen, T. Zhang, Nano Energy 78 (2020) 105375. [19] K. Zhang S. Wang X. Li H. Li Y. Ni Small 19 2023 2300959 K. Zhang, S. Wang, X. Li, H. Li, Y. Ni, Small 19 (2023) 2300959. [20] Z. Jiang L. Zheng C. Sheng H. Xu S. Chen Y. Liao Y. Qing Y. Wu J. Colloid Interface Sci. 626 2022 848 857 Z. Jiang, L. Zheng, C. Sheng, H. Xu, S. Chen, Y. Liao, Y. Qing, Y. Wu, J. Colloid Interface Sci. 626 (2022) 848–857. [21] L. Zhao Y. Li M. Yu Y. Peng F. Ran Adv. Sci. 10 2023 2300283 L. Zhao, Y. Li, M. Yu, Y. Peng, F. Ran, Adv. Sci. 10 (2023) 2300283. [22] Z. Wu Y. Zhao H. Wu Y. Gao Z. Chen W. Jin J. Wang T. Ma L. Wang Adv. Funct. Mater. 31 2021 2010437 Z. Wu, Y. Zhao, H. Wu, Y. Gao, Z. Chen, W. Jin, J. Wang, T. Ma, L. Wang, Adv. Funct. Mater. 31 (2021) 2010437. [23] C.J. Huang H.M. Xu T.Y. Shuai Q.N. Zhan Z.J. Zhang G.R. Li Small 19 2023 2301130 C.J. Huang, H.M. Xu, T.Y. Shuai, Q.N. Zhan, Z.J. Zhang, G.R. Li, Small 19 (2023) 2301130. [24] L. Wang Y. Zhu Y. Wen S. Li C. Cui F. Ni Y. Liu H. Lin Y. Li H. Peng B. Zhang Angew. Chem. Int. Ed. 60 2021 10577 10582 L. Wang, Y. Zhu, Y. Wen, S. Li, C. Cui, F. Ni, Y. Liu, H. Lin, Y. Li, H. Peng, B. Zhang, Angew. Chem. Int. Ed. 60 (2021) 10577–10582. [25] P. Li W. Li Y. Huang Q. Huang S. Tian Small 19 2023 2300725 P. Li, W. Li, Y. Huang, Q. Huang, S. Tian, Small 19 (2023) 2300725. [26] Z. Zheng D. Wu L. Chen S. Chen H. Wan G. Chen N. Zhang X. Liu R. Ma Appl. Catal. B-Environ. 340 2024 123214 Z. Zheng, D. Wu, L. Chen, S. Chen, H. Wan, G. Chen, N. Zhang, X. Liu, R. Ma, Appl. Catal. B-Environ. 340 (2024) 123214. [27] Y. Liao Y. Chen L. Li S. Luo Y. Qing C. Tian H. Xu J. Zhang Y. Wu Adv. Funct. Mater. 33 2023 2303300 Y. Liao, Y. Chen, L. Li, S. Luo, Y. Qing, C. Tian, H. Xu, J. Zhang, Y. Wu, Adv. Funct. Mater. 33 (2023) 2303300. [28] X. Bu X. Liang Y. Bu Q. Quan Y. Meng Z. Lai W. Wang C. Liu J. Lu C.-M. Lawrence Wu J.C. Ho Chem. Eng. J. 438 2022 135379 X. Bu, X. Liang, Y. Bu, Q. Quan, Y. Meng, Z. Lai, W. Wang, C. Liu, J. Lu, C.-M. Lawrence Wu, J.C. Ho, Chem. Eng. J. 438 (2022) 135379. [29] R. Zhang Z. Wei G. Ye G. Chen J. Miao X. Zhou X. Zhu X. Cao X. Sun Adv. Energy Mater. 11 2021 2101758 R. Zhang, Z. Wei, G. Ye, G. Chen, J. Miao, X. Zhou, X. Zhu, X. Cao, X. Sun, Adv. Energy Mater. 11 (2021) 2101758. [30] C. Yang R. Zhao H. Xiang J. Wu W. Zhong W. Li Q. Zhang N. Yang X. Li Adv. Energy Mater. 10 2020 2002260 C. Yang, R. Zhao, H. Xiang, J. Wu, W. Zhong, W. Li, Q. Zhang, N. Yang, X. Li, Adv. Energy Mater. 10 (2020) 2002260. [31] X. Xu H. Liao L. Huang S. Chen R. Wang S. Wu Y. Wu Z. Sun H. Huang Appl. Catal. B-Environ. 341 2024 123312 X. Xu, H. Liao, L. Huang, S. Chen, R. Wang, S. Wu, Y. Wu, Z. Sun, H. Huang, Appl. Catal. B-Environ. 341 (2024) 123312. [32] V. Maheskumar A. Min C.J. Moon R.A. Senthil M.Y. Choi Small Structures 4 2023 2300212 V. Maheskumar, A. Min, C.J. Moon, R.A. Senthil, M.Y. Choi, Small Structures 4 (2023) 2300212. [33] T. Wang L. Miao S. Zheng H. Qin X. Cao L. Yang L. Jiao ACS Catal. 13 2023 4091 4100 T. Wang, L. Miao, S. Zheng, H. Qin, X. Cao, L. Yang, L. Jiao, ACS Catal. 13 (2023) 4091–4100. [34] Y. Gu A. Wu Y. Jiao H. Zheng X. Wang Y. Xie L. Wang C. Tian H. Fu Angew. Chem. Int. Ed. 60 2021 6673 6681 Y. Gu, A. Wu, Y. Jiao, H. Zheng, X. Wang, Y. Xie, L. Wang, C. Tian, H. Fu, Angew. Chem. Int. Ed. 60 (2021) 6673–6681. [35] T. Wang X. Cao L. Jiao eScience 1 2021 69 74 T. Wang, X. Cao, L. Jiao, eScience 1 (2021) 69–74. [36] J. Song Y. Chen H. Huang J. Wang S.C. Huang Y.F. Liao A.E. Fetohi F. Hu H.Y. Chen L. Li X. Han K.M. El-Khatib S. Peng Adv. Sci. 9 2022 2104522 J. Song, Y. Chen, H. Huang, J. Wang, S.C. Huang, Y.F. Liao, A.E. Fetohi, F. Hu, H.y. Chen, L. Li, X. Han, K.M. El-Khatib, S. Peng, Adv. Sci. 9 (2022) 2104522. [37] W. Zhang N. Han J. Luo X. Han S. Feng W. Guo S. Xie Z. Zhou P. Subramanian K. Wan J. Arbiol C. Zhang S. Liu M. Xu X. Zhang J. Fransaer Small 18 2022 2103561 W. Zhang, N. Han, J. Luo, X. Han, S. Feng, W. Guo, S. Xie, Z. Zhou, P. Subramanian, K. Wan, J. Arbiol, C. Zhang, S. Liu, M. Xu, X. Zhang, and J. Fransaer, Small 18 (2022) 2103561. [38] J. Li X. Xu X. Hou S. Zhang G. Su W. Tian H. Wang M. Huang A. Toghan Nano Res. 16 2023 8853 8862 J. Li, X. Xu, X. Hou, S. Zhang, G. Su, W. Tian, H. Wang, M. Huang, A. Toghan, Nano Res. 16 (2023) 8853–8862. [39] W. Song X. Liang Y. Zhang Y. Zhu F. Zhang Y. Bai M. Li H. Zhang C. Wei X. Liu L. Wu X. Ge T. Xu J. Membr. Sci. 647 2022 120303 W. Song, X. Liang, Y. Zhang, Y. Zhu, F. Zhang, Y. Bai, M. Li, H. Zhang, C. Wei, X. Liu, L. Wu, X. Ge, T. Xu, J. Membr. Sci. 647 (2022) 120303. [40] T. Xiong J. Li J. Chandra Roy M. Koroma Z. Zhu H. Yang L. Zhang T. Ouyang M.S. Balogun M. Al-Mamun J. Energy Chem. 81 2023 71 81 T. Xiong, J. Li, J. Chandra Roy, M. Koroma, Z. Zhu, H. Yang, L. Zhang, T. Ouyang, M.S. Balogun, M. Al-Mamun, J. Energy Chem. 81 (2023) 71–81. [41] Y. Hao D. Yu S. Zhu C.-H. Kuo Y.-M. Chang L. Wang H.-Y. Chen M. Shao S. Peng Energy Environ. Sci. 16 2023 1100 1110 Y. Hao, D. Yu, S. Zhu, C.-H. Kuo, Y.-M. Chang, L. Wang, H.-Y. Chen, M. Shao, S. Peng, Energy Environ. Sci. 16 (2023) 1100–1110. [42] F. Song W. Li J. Yang G. Han P. Liao Y. Sun Nat. Commun. 9 2018 4531 F. Song, W. Li, J. Yang, G. Han, P. Liao, Y. Sun, Nat. Commun. 9 (2018) 4531. [43] J. Kim H. Jung S.-M. Jung J. Hwang D.Y. Kim N. Lee K.-S. Kim H. Kwon Y.-T. Kim J.W. Han J.K. Kim J. Am. Chem. Soc. 143 2020 1399 1408 J. Kim, H. Jung, S.-M. Jung, J. Hwang, D.Y. Kim, N. Lee, K.-S. Kim, H. Kwon, Y.-T. Kim, J.W. Han, J.K. Kim, J. Am. Chem. Soc. 143 (2020) 1399–1408. [44] Y. Gong L. Wang H. Xiong M. Shao L. Xu A. Xie S. Zhuang Y. Tang X. Yang Y. Chen P. Wan J. Mater. Chem. A 7 2019 13671 13678 Y. Gong, L. Wang, H. Xiong, M. Shao, L. Xu, A. Xie, S. Zhuang, Y. Tang, X. Yang, Y. Chen, P. Wan, J. Mater. Chem. A 7 (2019) 13671–13678. [45] A. Wang Z. Cao J. Wang S. Wang C. Li N. Li L. Xie Y. Xiang T. Li X. Niu L. Ding F. Hao J. Energy Chem. 48 2020 426 434 A. Wang, Z. Cao, J. Wang, S. Wang, C. Li, N. Li, L. Xie, Y. Xiang, T. Li, X. Niu, L. Ding, F. Hao, J. Energy Chem. 48 (2020) 426–434. [46] Y. Chen Y. Wang J. Yu G. Xiong H. Niu Y. Li D. Sun X. Zhang H. Liu W. Zhou Adv. Sci. 9 2022 2105869 Y. Chen, Y. Wang, J. Yu, G. Xiong, H. Niu, Y. Li, D. Sun, X. Zhang, H. Liu, W. Zhou, Adv. Sci. 9 (2022) 2105869. [47] B. Zhang L. Zhang Q. Tan J. Wang J. Liu H. Wan L. Miao J. Jiang Energy Environ. Sci. 13 2020 3007 3013 B. Zhang, L. Zhang, Q. Tan, J. Wang, J. Liu, H. Wan, L. Miao, J. Jiang, Energy Environ. Sci., 13 (2020) 3007–3013. [48] A. Wu Y. Xie H. Ma C. Tian Y. Gu H. Yan X. Zhang G. Yang H. Fu Nano Energy 44 2018 353 363 A. Wu, Y. Xie, H. Ma, C. Tian, Y. Gu, H. Yan, X. Zhang, G. Yang, H. Fu, Nano Energy 44 (2018) 353–363. [49] X. Shen S. Shi B. Li S. Li H. Zhang S. Chen H. Deng Q. Zhang J. Zhu X. Duan Adv. Funct. Mater. 32 2022 2206388 X. Shen, S. Shi, B. Li, S. Li, H. Zhang, S. Chen, H. Deng, Q. Zhang, J. Zhu, X. Duan, Adv. Funct. Mater. 32 (2022) 2206388. [50] B. Cao G.M. Veith J.C. Neuefeind R.R. Adzic P.G. Khalifah J. Am. Chem. Soc. 135 2013 19186 19192 B. Cao, G.M. Veith, J.C. Neuefeind, R.R. Adzic, P.G. Khalifah, J. Am. Chem. Soc. 135 (2013) 19186–19192. [51] Y. Zhang B. Ouyang J. Xu S. Chen R.S. Rawat H.J. Fan Adv. Energy Mater. 6 2016 1600221 Y. Zhang, B. Ouyang, J. Xu, S. Chen, R.S. Rawat, H.J. Fan, Adv. Energy Mater. 6 (2016) 1600221. [52] H. Yan Y. Xie Y. Jiao A. Wu C. Tian X. Zhang L. Wang H. Fu Adv. Mater. 30 2017 1704156 H. Yan, Y. Xie, Y. Jiao, A. Wu, C. Tian, X. Zhang, L. Wang, H. Fu, Adv. Mater. 30 (2017) 1704156. [53] W. Du Y. Shi W. Zhou Y. Yu B. Zhang Angew. Chem. Int. Ed. 60 2021 7051 7055 W. Du, Y. Shi, W. Zhou, Y. Yu, B. Zhang, Angew. Chem. Int. Ed. 60 (2021) 7051–7055. [54] X. Wang G. Huang Z. Pan S. Kang S. Ma P.K. Shen J. Zhu Chem. Eng. J. 428 2022 131190 X. Wang, G. Huang, Z. Pan, S. Kang, S. Ma, P.K. Shen, J. Zhu, Chem. Eng. J. 428 (2022) 131190. [55] L. Yu Q. Zhu S. Song B. McElhenny D. Wang C. Wu Z. Qin J. Bao Y. Yu S. Chen Z. Ren Nat. Commun. 10 2019 5106 L. Yu, Q. Zhu, S. Song, B. McElhenny, D. Wang, C. Wu, Z. Qin, J. Bao, Y. Yu, S. Chen, Z. Ren, Nat. Commun. 10 (2019) 5106. [56] Y. Li H. Zhang T. Xu Z. Lu X. Wu P. Wan X. Sun L. Jiang Adv. Funct. Mater. 25 2015 1737 1744 Y. Li, H. Zhang, T. Xu, Z. Lu, X. Wu, P. Wan, X. Sun, L. Jiang, Adv. Funct. Mater. 25 (2015) 1737–1744. [57] Y. Zhou B. Chu Z. Sun L. Dong F. Wang B. Li M. Fan Z. Chen Appl. Catal. B-Environ. 323 2023 122168 Y. Zhou, B. Chu, Z. Sun, L. Dong, F. Wang, B. Li, M. Fan, Z. Chen, Appl. Catal. B-Environ. 323 (2023) 122168. [58] W. Chen L. Xu X. Zhu Y.C. Huang W. Zhou D. Wang Y. Zhou S. Du Q. Li C. Xie L. Tao C.L. Dong J. Liu Y. Wang R. Chen H. Su C. Chen Y. Zou Y. Li Q. Liu S. Wang Angew. Chem. Int. Ed. 60 2021 7297 7307 W. Chen, L. Xu, X. Zhu, Y.C. Huang, W. Zhou, D. Wang, Y. Zhou, S. Du, Q. Li, C. Xie, L. Tao, C.L. Dong, J. Liu, Y. Wang, R. Chen, H. Su, C. Chen, Y. Zou, Y. Li, Q. Liu, S. Wang, Angew. Chem. Int. Ed. 60 (2021) 7297–7307. [59] H. Yu S. Zhu Y. Hao Y.M. Chang L. Li J. Ma H.Y. Chen M. Shao S. Peng Adv. Funct. Mater. 33 2023 2212811 H. Yu, S. Zhu, Y. Hao, Y.M. Chang, L. Li, J. Ma, H.Y. Chen, M. Shao, S. Peng, Adv. Funct. Mater. 33 (2023) 2212811. [60] P. Wang X. Bai H. Jin X. Gao K. Davey Y. Zheng Y. Jiao S.Z. Qiao Adv. Funct. Mater. 33 2023 2300687 P. Wang, X. Bai, H. Jin, X. Gao, K. Davey, Y. Zheng, Y. Jiao, S.Z. Qiao, Adv. Funct. Mater. 33 (2023) 2300687. [61] G. Qian J. Chen W. Jiang T. Yu K. Tan S. Yin Carbon Energy 5 2023 e368 G. Qian, J. Chen, W. Jiang, T. Yu, K. Tan, S. Yin, Carbon Energy 5 (2023) e368.",
      "scopus-id": "85190722243",
      "coredata": {
        "eid": "1-s2.0-S2095495624002730",
        "dc:description": "Hydrogen evolution reaction (HER) and urea oxidation reaction (UOR) are key reactions of the water-cycling associated catalytic process/device. The design of catalysts with a super-hydrophilic/aerophobic structure and optimized electron distribution holds great promise. Here, we have designed a three-dimensional (3D) hollow Ni/NiMoN hierarchical structure with arrayed-sheet surface based on a one-pot hydrothermal route for efficient urea-assisted HER based on a simple hydrothermal process. The Ni/NiMoN catalyst exhibits super-hydrophilic/aerophobic properties with a small droplet contact angle of 6.07° and an underwater bubble contact angle of 155.7°, thus facilitating an escape of bubbles from the electrodes. Density functional theory calculations and X-ray photoelectron spectroscopy results indicate the optimized electronic structure at the interface of Ni and NiMoN, which can promote the adsorption/desorption of reactants and intermediates. The virtues combining with a large specific surface area endow Ni/NiMoN with efficient catalytic activity of low potentials of 25 mV for HER and 1.33 V for UOR at 10 mA cm−2. The coupled HER and UOR system demonstrates a low cell voltage of 1.42 V at 10 mA cm−2, which is approximately 209 mV lower than water electrolysis.",
        "openArchiveArticle": "false",
        "prism:coverDate": "2024-08-31",
        "openaccessUserLicense": null,
        "prism:aggregationType": "Journal",
        "prism:url": "https://api.elsevier.com/content/article/pii/S2095495624002730",
        "dc:creator": [
          {
            "@_fa": "true",
            "$": "Fan, Yuying"
          },
          {
            "@_fa": "true",
            "$": "Gu, Ying"
          },
          {
            "@_fa": "true",
            "$": "Wang, Dongxu"
          },
          {
            "@_fa": "true",
            "$": "Jiao, Yanqing"
          },
          {
            "@_fa": "true",
            "$": "Wu, Aiping"
          },
          {
            "@_fa": "true",
            "$": "Tian, Chungui"
          }
        ],
        "link": [
          {
            "@_fa": "true",
            "@rel": "self",
            "@href": "https://api.elsevier.com/content/article/pii/S2095495624002730"
          },
          {
            "@_fa": "true",
            "@rel": "scidir",
            "@href": "https://www.sciencedirect.com/science/article/pii/S2095495624002730"
          }
        ],
        "dc:format": "application/json",
        "openaccessType": null,
        "pii": "S2095-4956(24)00273-0",
        "prism:volume": "95",
        "prism:publisher": "Science Press and Dalian Institute of Chemical Physics, Chinese Academy of Sciences. Published by ELSEVIER B.V. and Science Press. All rights are reserved, including those for text and data mining, AI training, and similar technologies.",
        "dc:title": "Hollow NiMo-based nitride heterojunction with super-hydrophilic/aerophobic surface for efficient urea-assisted hydrogen production",
        "prism:copyright": "© 2024 Science Press and Dalian Institute of Chemical Physics, Chinese Academy of Sciences. Published by ELSEVIER B.V. and Science Press. All rights are reserved, including those for text and data mining, AI training, and similar technologies.",
        "openaccess": "0",
        "prism:issn": "20954956",
        "dcterms:subject": [
          {
            "@_fa": "true",
            "$": "Hydrogen evolution"
          },
          {
            "@_fa": "true",
            "$": "Transition metal nitrides"
          },
          {
            "@_fa": "true",
            "$": "Hollow heterojunctions"
          },
          {
            "@_fa": "true",
            "$": "Urea electrooxidation"
          },
          {
            "@_fa": "true",
            "$": "Super hydrophilic/aerophobic"
          }
        ],
        "openaccessArticle": "false",
        "prism:publicationName": "Journal of Energy Chemistry",
        "openaccessSponsorType": null,
        "prism:pageRange": "428-439",
        "prism:endingPage": "439",
        "pubType": "fla",
        "prism:coverDisplayDate": "August 2024",
        "prism:doi": "10.1016/j.jechem.2024.04.002",
        "prism:startingPage": "428",
        "dc:identifier": "doi:10.1016/j.jechem.2024.04.002",
        "openaccessSponsorName": null
      },
      "objects": {
        "object": [
          {
            "@category": "standard",
            "@height": "200",
            "@width": "409",
            "@_fa": "true",
            "$": "https://api.elsevier.com/content/object/eid/1-s2.0-S2095495624002730-ga1.jpg?httpAccept=%2A%2F%2A",
            "@multimediatype": "JPEG image file",
            "@type": "IMAGE-DOWNSAMPLED",
            "@size": "40930",
            "@ref": "ga1",
            "@mimetype": "image/jpeg"
          },
          {
            "@category": "standard",
            "@height": "619",
            "@width": "578",
            "@_fa": "true",
            "$": "https://api.elsevier.com/content/object/eid/1-s2.0-S2095495624002730-gr1.jpg?httpAccept=%2A%2F%2A",
            "@multimediatype": "JPEG image file",
            "@type": "IMAGE-DOWNSAMPLED",
            "@size": "156463",
            "@ref": "gr1",
            "@mimetype": "image/jpeg"
          },
          {
            "@category": "standard",
            "@height": "476",
            "@width": "576",
            "@_fa": "true",
            "$": "https://api.elsevier.com/content/object/eid/1-s2.0-S2095495624002730-gr2.jpg?httpAccept=%2A%2F%2A",
            "@multimediatype": "JPEG image file",
            "@type": "IMAGE-DOWNSAMPLED",
            "@size": "94753",
            "@ref": "gr2",
            "@mimetype": "image/jpeg"
          },
          {
            "@category": "standard",
            "@height": "402",
            "@width": "578",
            "@_fa": "true",
            "$": "https://api.elsevier.com/content/object/eid/1-s2.0-S2095495624002730-gr3.jpg?httpAccept=%2A%2F%2A",
            "@multimediatype": "JPEG image file",
            "@type": "IMAGE-DOWNSAMPLED",
            "@size": "71176",
            "@ref": "gr3",
            "@mimetype": "image/jpeg"
          },
          {
            "@category": "standard",
            "@height": "532",
            "@width": "622",
            "@_fa": "true",
            "$": "https://api.elsevier.com/content/object/eid/1-s2.0-S2095495624002730-gr4.jpg?httpAccept=%2A%2F%2A",
            "@multimediatype": "JPEG image file",
            "@type": "IMAGE-DOWNSAMPLED",
            "@size": "115467",
            "@ref": "gr4",
            "@mimetype": "image/jpeg"
          },
          {
            "@category": "standard",
            "@height": "572",
            "@width": "667",
            "@_fa": "true",
            "$": "https://api.elsevier.com/content/object/eid/1-s2.0-S2095495624002730-gr5.jpg?httpAccept=%2A%2F%2A",
            "@multimediatype": "JPEG image file",
            "@type": "IMAGE-DOWNSAMPLED",
            "@size": "129125",
            "@ref": "gr5",
            "@mimetype": "image/jpeg"
          },
          {
            "@category": "standard",
            "@height": "387",
            "@width": "667",
            "@_fa": "true",
            "$": "https://api.elsevier.com/content/object/eid/1-s2.0-S2095495624002730-gr6.jpg?httpAccept=%2A%2F%2A",
            "@multimediatype": "JPEG image file",
            "@type": "IMAGE-DOWNSAMPLED",
            "@size": "89256",
            "@ref": "gr6",
            "@mimetype": "image/jpeg"
          },
          {
            "@category": "standard",
            "@height": "374",
            "@width": "667",
            "@_fa": "true",
            "$": "https://api.elsevier.com/content/object/eid/1-s2.0-S2095495624002730-gr7.jpg?httpAccept=%2A%2F%2A",
            "@multimediatype": "JPEG image file",
            "@type": "IMAGE-DOWNSAMPLED",
            "@size": "98574",
            "@ref": "gr7",
            "@mimetype": "image/jpeg"
          },
          {
            "@category": "standard",
            "@height": "574",
            "@width": "667",
            "@_fa": "true",
            "$": "https://api.elsevier.com/content/object/eid/1-s2.0-S2095495624002730-gr8.jpg?httpAccept=%2A%2F%2A",
            "@multimediatype": "JPEG image file",
            "@type": "IMAGE-DOWNSAMPLED",
            "@size": "138067",
            "@ref": "gr8",
            "@mimetype": "image/jpeg"
          },
          {
            "@category": "thumbnail",
            "@height": "107",
            "@width": "219",
            "@_fa": "true",
            "$": "https://api.elsevier.com/content/object/eid/1-s2.0-S2095495624002730-ga1.sml?httpAccept=%2A%2F%2A",
            "@multimediatype": "GIF image file",
            "@type": "IMAGE-THUMBNAIL",
            "@size": "18664",
            "@ref": "ga1",
            "@mimetype": "image/gif"
          },
          {
            "@category": "thumbnail",
            "@height": "164",
            "@width": "153",
            "@_fa": "true",
            "$": "https://api.elsevier.com/content/object/eid/1-s2.0-S2095495624002730-gr1.sml?httpAccept=%2A%2F%2A",
            "@multimediatype": "GIF image file",
            "@type": "IMAGE-THUMBNAIL",
            "@size": "17871",
            "@ref": "gr1",
            "@mimetype": "image/gif"
          },
          {
            "@category": "thumbnail",
            "@height": "164",
            "@width": "198",
            "@_fa": "true",
            "$": "https://api.elsevier.com/content/object/eid/1-s2.0-S2095495624002730-gr2.sml?httpAccept=%2A%2F%2A",
            "@multimediatype": "GIF image file",
            "@type": "IMAGE-THUMBNAIL",
            "@size": "15597",
            "@ref": "gr2",
            "@mimetype": "image/gif"
          },
          {
            "@category": "thumbnail",
            "@height": "152",
            "@width": "219",
            "@_fa": "true",
            "$": "https://api.elsevier.com/content/object/eid/1-s2.0-S2095495624002730-gr3.sml?httpAccept=%2A%2F%2A",
            "@multimediatype": "GIF image file",
            "@type": "IMAGE-THUMBNAIL",
            "@size": "12558",
            "@ref": "gr3",
            "@mimetype": "image/gif"
          },
          {
            "@category": "thumbnail",
            "@height": "163",
            "@width": "191",
            "@_fa": "true",
            "$": "https://api.elsevier.com/content/object/eid/1-s2.0-S2095495624002730-gr4.sml?httpAccept=%2A%2F%2A",
            "@multimediatype": "GIF image file",
            "@type": "IMAGE-THUMBNAIL",
            "@size": "14306",
            "@ref": "gr4",
            "@mimetype": "image/gif"
          },
          {
            "@category": "thumbnail",
            "@height": "164",
            "@width": "191",
            "@_fa": "true",
            "$": "https://api.elsevier.com/content/object/eid/1-s2.0-S2095495624002730-gr5.sml?httpAccept=%2A%2F%2A",
            "@multimediatype": "GIF image file",
            "@type": "IMAGE-THUMBNAIL",
            "@size": "14565",
            "@ref": "gr5",
            "@mimetype": "image/gif"
          },
          {
            "@category": "thumbnail",
            "@height": "127",
            "@width": "219",
            "@_fa": "true",
            "$": "https://api.elsevier.com/content/object/eid/1-s2.0-S2095495624002730-gr6.sml?httpAccept=%2A%2F%2A",
            "@multimediatype": "GIF image file",
            "@type": "IMAGE-THUMBNAIL",
            "@size": "11247",
            "@ref": "gr6",
            "@mimetype": "image/gif"
          },
          {
            "@category": "thumbnail",
            "@height": "123",
            "@width": "219",
            "@_fa": "true",
            "$": "https://api.elsevier.com/content/object/eid/1-s2.0-S2095495624002730-gr7.sml?httpAccept=%2A%2F%2A",
            "@multimediatype": "GIF image file",
            "@type": "IMAGE-THUMBNAIL",
            "@size": "15110",
            "@ref": "gr7",
            "@mimetype": "image/gif"
          },
          {
            "@category": "thumbnail",
            "@height": "164",
            "@width": "191",
            "@_fa": "true",
            "$": "https://api.elsevier.com/content/object/eid/1-s2.0-S2095495624002730-gr8.sml?httpAccept=%2A%2F%2A",
            "@multimediatype": "GIF image file",
            "@type": "IMAGE-THUMBNAIL",
            "@size": "19441",
            "@ref": "gr8",
            "@mimetype": "image/gif"
          },
          {
            "@category": "high",
            "@height": "886",
            "@width": "1812",
            "@_fa": "true",
            "$": "https://api.elsevier.com/content/object/eid/1-s2.0-S2095495624002730-ga1_lrg.jpg?httpAccept=%2A%2F%2A",
            "@multimediatype": "JPEG image file",
            "@type": "IMAGE-HIGH-RES",
            "@size": "301466",
            "@ref": "ga1",
            "@mimetype": "image/jpeg"
          },
          {
            "@category": "high",
            "@height": "2740",
            "@width": "2559",
            "@_fa": "true",
            "$": "https://api.elsevier.com/content/object/eid/1-s2.0-S2095495624002730-gr1_lrg.jpg?httpAccept=%2A%2F%2A",
            "@multimediatype": "JPEG image file",
            "@type": "IMAGE-HIGH-RES",
            "@size": "1314210",
            "@ref": "gr1",
            "@mimetype": "image/jpeg"
          },
          {
            "@category": "high",
            "@height": "2108",
            "@width": "2552",
            "@_fa": "true",
            "$": "https://api.elsevier.com/content/object/eid/1-s2.0-S2095495624002730-gr2_lrg.jpg?httpAccept=%2A%2F%2A",
            "@multimediatype": "JPEG image file",
            "@type": "IMAGE-HIGH-RES",
            "@size": "604507",
            "@ref": "gr2",
            "@mimetype": "image/jpeg"
          },
          {
            "@category": "high",
            "@height": "1778",
            "@width": "2559",
            "@_fa": "true",
            "$": "https://api.elsevier.com/content/object/eid/1-s2.0-S2095495624002730-gr3_lrg.jpg?httpAccept=%2A%2F%2A",
            "@multimediatype": "JPEG image file",
            "@type": "IMAGE-HIGH-RES",
            "@size": "437385",
            "@ref": "gr3",
            "@mimetype": "image/jpeg"
          },
          {
            "@category": "high",
            "@height": "2356",
            "@width": "2754",
            "@_fa": "true",
            "$": "https://api.elsevier.com/content/object/eid/1-s2.0-S2095495624002730-gr4_lrg.jpg?httpAccept=%2A%2F%2A",
            "@multimediatype": "JPEG image file",
            "@type": "IMAGE-HIGH-RES",
            "@size": "731243",
            "@ref": "gr4",
            "@mimetype": "image/jpeg"
          },
          {
            "@category": "high",
            "@height": "2533",
            "@width": "2953",
            "@_fa": "true",
            "$": "https://api.elsevier.com/content/object/eid/1-s2.0-S2095495624002730-gr5_lrg.jpg?httpAccept=%2A%2F%2A",
            "@multimediatype": "JPEG image file",
            "@type": "IMAGE-HIGH-RES",
            "@size": "901061",
            "@ref": "gr5",
            "@mimetype": "image/jpeg"
          },
          {
            "@category": "high",
            "@height": "1712",
            "@width": "2953",
            "@_fa": "true",
            "$": "https://api.elsevier.com/content/object/eid/1-s2.0-S2095495624002730-gr6_lrg.jpg?httpAccept=%2A%2F%2A",
            "@multimediatype": "JPEG image file",
            "@type": "IMAGE-HIGH-RES",
            "@size": "528967",
            "@ref": "gr6",
            "@mimetype": "image/jpeg"
          },
          {
            "@category": "high",
            "@height": "1657",
            "@width": "2953",
            "@_fa": "true",
            "$": "https://api.elsevier.com/content/object/eid/1-s2.0-S2095495624002730-gr7_lrg.jpg?httpAccept=%2A%2F%2A",
            "@multimediatype": "JPEG image file",
            "@type": "IMAGE-HIGH-RES",
            "@size": "626914",
            "@ref": "gr7",
            "@mimetype": "image/jpeg"
          },
          {
            "@category": "high",
            "@height": "2541",
            "@width": "2955",
            "@_fa": "true",
            "$": "https://api.elsevier.com/content/object/eid/1-s2.0-S2095495624002730-gr8_lrg.jpg?httpAccept=%2A%2F%2A",
            "@multimediatype": "JPEG image file",
            "@type": "IMAGE-HIGH-RES",
            "@size": "886800",
            "@ref": "gr8",
            "@mimetype": "image/jpeg"
          },
          {
            "@category": "standard",
            "@_fa": "true",
            "$": "https://api.elsevier.com/content/object/eid/1-s2.0-S2095495624002730-mmc1.mp4?httpAccept=%2A%2F%2A",
            "@multimediatype": "MPEG-4 movie",
            "@type": "VIDEO",
            "@size": "2286735",
            "@ref": "mmc1",
            "@mimetype": "video/mp4"
          },
          {
            "@category": "standard",
            "@_fa": "true",
            "$": "https://api.elsevier.com/content/object/eid/1-s2.0-S2095495624002730-mmc2.doc?httpAccept=%2A%2F%2A",
            "@multimediatype": "Microsoft Word file",
            "@type": "APPLICATION",
            "@size": "19246080",
            "@ref": "mmc2",
            "@mimetype": "application/word"
          },
          {
            "@category": "standard",
            "@height": "271",
            "@width": "482",
            "@_fa": "true",
            "$": "https://api.elsevier.com/content/object/eid/1-s2.0-S2095495624002730-mmc1.jpg?httpAccept=%2A%2F%2A",
            "@multimediatype": "JPEG image file",
            "@type": "IMAGE-MMC-DOWNSAMPLED",
            "@size": "33241",
            "@ref": "mmc1",
            "@mimetype": "image/jpeg"
          },
          {
            "@category": "thumbnail",
            "@height": "123",
            "@width": "219",
            "@_fa": "true",
            "$": "https://api.elsevier.com/content/object/eid/1-s2.0-S2095495624002730-mmc1.sml?httpAccept=%2A%2F%2A",
            "@multimediatype": "GIF image file",
            "@type": "IMAGE-MMC-THUMBNAIL",
            "@size": "26274",
            "@ref": "mmc1",
            "@mimetype": "image/gif"
          },
          {
            "@category": "thumbnail",
            "@_fa": "true",
            "$": "https://api.elsevier.com/content/object/eid/1-s2.0-S2095495624002730-si1.svg?httpAccept=%2A%2F%2A",
            "@multimediatype": "Scalable Vector Graphics file",
            "@type": "ALTIMG",
            "@size": "24223",
            "@ref": "si1",
            "@mimetype": "image/svg+xml"
          },
          {
            "@category": "thumbnail",
            "@_fa": "true",
            "$": "https://api.elsevier.com/content/object/eid/1-s2.0-S2095495624002730-si2.svg?httpAccept=%2A%2F%2A",
            "@multimediatype": "Scalable Vector Graphics file",
            "@type": "ALTIMG",
            "@size": "9073",
            "@ref": "si2",
            "@mimetype": "image/svg+xml"
          },
          {
            "@category": "thumbnail",
            "@_fa": "true",
            "$": "https://api.elsevier.com/content/object/eid/1-s2.0-S2095495624002730-si3.svg?httpAccept=%2A%2F%2A",
            "@multimediatype": "Scalable Vector Graphics file",
            "@type": "ALTIMG",
            "@size": "9235",
            "@ref": "si3",
            "@mimetype": "image/svg+xml"
          },
          {
            "@category": "standard",
            "@_fa": "true",
            "$": "https://api.elsevier.com/content/object/eid/1-s2.0-S2095495624002730-am.pdf?httpAccept=%2A%2F%2A",
            "@multimediatype": "Acrobat PDF file",
            "@type": "AAM-PDF",
            "@size": "11320457",
            "@ref": "am",
            "@mimetype": "application/pdf"
          }
        ]
      },
      "link": {
        "@rel": "abstract",
        "@href": "https://api.elsevier.com/content/abstract/scopus_id/85190722243"
      }
    }
  }
}