{
  "metadata": {
    "title": "Multi-dimensional catalysis: From macroscopic 3D structures to microscopic Ti-V synergistic interaction in lithium-sulfur batteries",
    "authors": "; ; ",
    "journal": "Journal of Energy Chemistry",
    "date": "2025-05-31",
    "doi": "10.1016/j.jechem.2025.01.020",
    "abstract": "",
    "uri": "https://api.elsevier.com/content/article/pii/S2095495625000610",
    "pii": "S2095495625000610"
  },
  "fulltext": {
    "full-text-retrieval-response": {
      "scopus-eid": "2-s2.0-85217980773",
      "originalText": "serial JL 286353 291210 291711 291744 291809 31 Journal of Energy Chemistry JOURNALENERGYCHEMISTRY 2025-01-23 2025-01-23 2025-02-15 2025-02-15 2025-03-27T19:56:08 1-s2.0-S2095495625000610 S2095-4956(25)00061-0 S2095495625000610 10.1016/j.jechem.2025.01.020 S300 S300.1 FULL-TEXT 1-s2.0-S2095495625X00024 2025-03-27T20:09:55.664498Z 0 0 20250501 20250531 2025 2025-01-23T23:58:20.442749Z absattachment articleinfo articletitlenorm authfirstinitialnorm authfirstsurnamenorm cid cids contenttype copyright crossmark dateloaded dateloadedtxt datesearch datesort dateupdated dco docsubtype doctype doi eid ewtransactionid hubeid indexeddate issn issnnorm itemstage itemtransactionid itemweight openaccess openarchive pg pgfirst pglast pii piinorm pubdateend pubdatestart pubdatetxt pubyr sortorder srctitle srctitlenorm srctype ssids alllist content subj subheadings suppl tomb volfirst volissue volumelist webpdf webpdfpagecount yearnav figure e-component body acknowledge affil appendices articletitle auth authfirstini authfull authkeywords authlast footnotes grantnumber grantsponsor grantsponsorid primabst ref specialabst 2095-4956 20954956 false 104 104 C Volume 104 53 585 593 585 593 202505 May 2025 2025-05-01 2025-05-31 2025 article fla © 2025 Science Press and Dalian Institute of Chemical Physics, Chinese Academy of Sciences. Published by Elsevier B.V. and Science Press. All rights are reserved, including those for text and data mining, AI training, and similar technologies. MULTIDIMENSIONALCATALYSISMACROSCOPIC3DSTRUCTURESMICROSCOPICTIVSYNERGISTICINTERACTIONINLITHIUMSULFURBATTERIES CAO Y 1 Introduction 2 Experimental 2.1 Materials 2.2 Batteries assembly and electrochemical testing 3 Results and discussion 3.1 Synthesis and characterization of a-TiVC 3.2 Electrochemical characterization of a-TiVC 3.3 Electrochemical performance of Li-S batteries with the a-TiVC catalyst 3.4 Reaction kinetics of LiPSs catalyzed by a-TiVC 4 Conclusions CRediT authorship contribution statement Acknowledgments Appendix A Supplementary material References RAZA 2023 29 H BONNICK 2020 4808 4833 P LI 2022 34 64 H LI 2019 901730 T WANG 2022 2107166 J ZHAO 2024 545 557 M ZHOU 2022 2202094 L HAN 2024 109543 J CHEN 2024 97 L LI 2024 110306 Q LIU 2023 e9120049 H SU 2024 e9120094 C WANG 2024 2 T LI 2024 2404328 F ZHANG 2020 78 S ZHANG 2020 112 S ZHAO 2021 2100457 Q LIU 2024 98 104 R GU 2024 8339 8349 Q WANG 2021 19457 19467 T GU 2024 266 Q LIU 2023 24330 24337 R CHEN 2023 00771 L LV 2024 397 409 Y JIN 2024 2309624 Q LIU 2024 1 10 L RATZKER 2024 1 14 B ZHAO 2023 2210037 W CAI 2023 145862 L CHEN 2023 488 497 Y GU 2022 488 497 Q HE 2023 2305251 Z HE 2022 4072 4083 Z HUANG 2021 151002 S LIU 2024 364 370 P DONG 2017 4792 4800 Y DONG 2018 2381 2388 Y LIAN 2017 1 8 P SHI 2020 4212 4219 H XU 2021 21429 21439 M XU 2022 2203263 M YAZDANPARAST 2020 20129 20137 S LIU 2024 483 493 X ZHANG 2019 5432 5453 L GU 2021 139 145 Q CHENG 2023 14695 14705 H FENG 2023 142022 K LI 2021 669 678 J GUO 2023 18253 18265 Y SUN 2021 2104858 R LI 2020 339 347 H GUND 2019 164 176 G SHEN 2022 555 563 Z CHEN 2023 507 512 Z JIANG 2023 2304965 Y ZENG 2022 425 432 P JING 2023 2204880 W LIU 2022 2201411 G QI 2023 123 135 Y XU 2021 2105178 J CHEN 2017 21206 21216 C CHU 2022 2205393 F GU 2022 490 496 Q TALIAN 2022 2101116 S WALUS 2020 136944 S CAOX2025X585 CAOX2025X585X593 CAOX2025X585XY CAOX2025X585X593XY 2027-02-15T00:00:00.000Z 2027-02-15T00:00:00.000Z http://creativecommons.org/licenses/by-nc-nd/4.0/ © 2025 Science Press and Dalian Institute of Chemical Physics, Chinese Academy of Sciences. Published by Elsevier B.V. and Science Press. All rights are reserved, including those for text and data mining, AI training, and similar technologies. 2025-02-25T18:03:44.275Z http://vtw.elsevier.com/data/voc/AddOnTypes/50.7/aggregated-refined Liaoning Revitalization Talents Program XLYC1807175 Liaoning Revitalization Talents Program http://data.elsevier.com/vocabulary/SciValFunders/501100018617 http://sws.geonames.org/1814991/ Development Plan of Science and Technology of Jilin Province YDZJ202301ZYTS280 Natural Science Foundation of Jilin Province YDZJ202401316ZYTS Jilin Provincial Natural Science Foundation http://data.elsevier.com/vocabulary/SciValFunders/100007847 http://sws.geonames.org/1814991 National Natural Science Foundation of China 51932005 NSFC National Natural Science Foundation of China http://data.elsevier.com/vocabulary/SciValFunders/501100001809 http://sws.geonames.org/1814991 The authors gratefully acknowledge the financial support provided by the National Natural Science Foundation of China (No. 51932005), the Liaoning Revitalization Talents Program (No. XLYC1807175), the Development Plan of Science and Technology of Jilin Province, China (YDZJ202301ZYTS280), the Natural Science Foundation of Jilin Province (YDZJ202401316ZYTS). item S2095-4956(25)00061-0 S2095495625000610 1-s2.0-S2095495625000610 10.1016/j.jechem.2025.01.020 286353 2025-03-27T20:09:55.664498Z 2025-05-01 2025-05-31 1-s2.0-S2095495625000610-main.pdf https://s3-eu-west-1.amazonaws.com/prod-ucs-content-store-eu-west/content/pii:S2095495625000610/MAIN/application/pdf/522bc82d9ba486312b8dae644aa4b7a2/main.pdf main.pdf pdf true 3170139 MAIN 9 1-s2.0-S2095495625000610-main_1.png https://s3-eu-west-1.amazonaws.com/prod-ucs-content-store-eu-west/content/pii:S2095495625000610/PREVIEW/image/png/f7ea487db48f5e0237e33b983d4100a5/main_1.png main_1.png png 61390 849 656 IMAGE-WEB-PDF 1 1-s2.0-S2095495625000610-ga1.jpg https://s3-eu-west-1.amazonaws.com/prod-ucs-content-store-eu-west/content/pii:S2095495625000610/ga1/DOWNSAMPLED/image/jpeg/67af83aad244a3183c01ac7a4e799ebe/ga1.jpg ga1 true ga1.jpg jpg 29492 200 339 IMAGE-DOWNSAMPLED 1-s2.0-S2095495625000610-gr1.jpg https://s3-eu-west-1.amazonaws.com/prod-ucs-content-store-eu-west/content/pii:S2095495625000610/gr1/DOWNSAMPLED/image/jpeg/ba3027a7f20ee61f277088f1224e52e2/gr1.jpg gr1 gr1.jpg jpg 164116 694 778 IMAGE-DOWNSAMPLED 1-s2.0-S2095495625000610-gr2.jpg https://s3-eu-west-1.amazonaws.com/prod-ucs-content-store-eu-west/content/pii:S2095495625000610/gr2/DOWNSAMPLED/image/jpeg/0310dc59904e87f4a72731ecee7c298c/gr2.jpg gr2 gr2.jpg jpg 124170 587 778 IMAGE-DOWNSAMPLED 1-s2.0-S2095495625000610-gr3.jpg https://s3-eu-west-1.amazonaws.com/prod-ucs-content-store-eu-west/content/pii:S2095495625000610/gr3/DOWNSAMPLED/image/jpeg/0f3e21c4da8f337b247d6dc5812ebfb7/gr3.jpg gr3 gr3.jpg jpg 96455 433 778 IMAGE-DOWNSAMPLED 1-s2.0-S2095495625000610-gr4.jpg https://s3-eu-west-1.amazonaws.com/prod-ucs-content-store-eu-west/content/pii:S2095495625000610/gr4/THUMBNAIL/image/jpeg/7d9685cf0f827ca406fadb21ad632a3a/gr4.jpg gr4 gr4.jpg jpg 89828 448 778 IMAGE-DOWNSAMPLED 1-s2.0-S2095495625000610-gr5.jpg https://s3-eu-west-1.amazonaws.com/prod-ucs-content-store-eu-west/content/pii:S2095495625000610/gr5/DOWNSAMPLED/image/jpeg/be282ca8b18859f8a74663fb65e4fc7d/gr5.jpg gr5 gr5.jpg jpg 166046 587 778 IMAGE-DOWNSAMPLED 1-s2.0-S2095495625000610-gr6.jpg https://s3-eu-west-1.amazonaws.com/prod-ucs-content-store-eu-west/content/pii:S2095495625000610/gr6/DOWNSAMPLED/image/jpeg/019f1d8354b6a6f604eeac4dbea46f95/gr6.jpg gr6 gr6.jpg jpg 43899 329 383 IMAGE-DOWNSAMPLED 1-s2.0-S2095495625000610-ga1.sml https://s3-eu-west-1.amazonaws.com/prod-ucs-content-store-eu-west/content/pii:S2095495625000610/ga1/THUMBNAIL/image/gif/cca9989a56a9eec65ddc999031cc6c62/ga1.sml ga1 true ga1.sml sml 21599 129 219 IMAGE-THUMBNAIL 1-s2.0-S2095495625000610-gr1.sml https://s3-eu-west-1.amazonaws.com/prod-ucs-content-store-eu-west/content/pii:S2095495625000610/gr1/THUMBNAIL/image/gif/3e40ea96489130f4f2ad410244270484/gr1.sml gr1 gr1.sml sml 16752 164 184 IMAGE-THUMBNAIL 1-s2.0-S2095495625000610-gr2.sml https://s3-eu-west-1.amazonaws.com/prod-ucs-content-store-eu-west/content/pii:S2095495625000610/gr2/THUMBNAIL/image/gif/f30273b8977f21ad305807ac2a671568/gr2.sml gr2 gr2.sml sml 15415 164 217 IMAGE-THUMBNAIL 1-s2.0-S2095495625000610-gr3.sml https://s3-eu-west-1.amazonaws.com/prod-ucs-content-store-eu-west/content/pii:S2095495625000610/gr3/HIGHRES/image/gif/c7536e71b063d6385f817ca92fb09c18/gr3.sml gr3 gr3.sml sml 11435 122 219 IMAGE-THUMBNAIL 1-s2.0-S2095495625000610-gr4.sml https://s3-eu-west-1.amazonaws.com/prod-ucs-content-store-eu-west/content/pii:S2095495625000610/gr4/THUMBNAIL/image/gif/708d3415d319c608e8660709bcd6bdfd/gr4.sml gr4 gr4.sml sml 8569 126 219 IMAGE-THUMBNAIL 1-s2.0-S2095495625000610-gr5.sml https://s3-eu-west-1.amazonaws.com/prod-ucs-content-store-eu-west/content/pii:S2095495625000610/gr5/THUMBNAIL/image/gif/02f9ccec4f8fc5649e6b528cbb888ecf/gr5.sml gr5 gr5.sml sml 17154 164 217 IMAGE-THUMBNAIL 1-s2.0-S2095495625000610-gr6.sml https://s3-eu-west-1.amazonaws.com/prod-ucs-content-store-eu-west/content/pii:S2095495625000610/gr6/THUMBNAIL/image/gif/888dcff8115400f20e0b9efc396a0d51/gr6.sml gr6 gr6.sml sml 12587 164 191 IMAGE-THUMBNAIL 1-s2.0-S2095495625000610-ga1_lrg.jpg https://s3-eu-west-1.amazonaws.com/prod-ucs-content-store-eu-west/content/pii:S2095495625000610/HIGHRES/image/jpeg/63625973af5bc900bbbcfb2ca6ff878c/ga1_lrg.jpg ga1 true ga1_lrg.jpg jpg 178055 886 1500 IMAGE-HIGH-RES 1-s2.0-S2095495625000610-gr1_lrg.jpg https://s3-eu-west-1.amazonaws.com/prod-ucs-content-store-eu-west/content/pii:S2095495625000610/HIGHRES/image/jpeg/803107002ef53bb3625591fd1cbe99a1/gr1_lrg.jpg gr1 gr1_lrg.jpg jpg 1025906 3072 3445 IMAGE-HIGH-RES 1-s2.0-S2095495625000610-gr2_lrg.jpg https://s3-eu-west-1.amazonaws.com/prod-ucs-content-store-eu-west/content/pii:S2095495625000610/HIGHRES/image/jpeg/6b1584956c972baa39b99dd845392976/gr2_lrg.jpg gr2 gr2_lrg.jpg jpg 623567 2601 3445 IMAGE-HIGH-RES 1-s2.0-S2095495625000610-gr3_lrg.jpg https://s3-eu-west-1.amazonaws.com/prod-ucs-content-store-eu-west/content/pii:S2095495625000610/HIGHRES/image/jpeg/99514a1e44b8d61f7123085f0b63f498/gr3_lrg.jpg gr3 gr3_lrg.jpg jpg 484134 1917 3445 IMAGE-HIGH-RES 1-s2.0-S2095495625000610-gr4_lrg.jpg https://s3-eu-west-1.amazonaws.com/prod-ucs-content-store-eu-west/content/pii:S2095495625000610/HIGHRES/image/jpeg/f162f81bb5c969abd8acc0994e2787dd/gr4_lrg.jpg gr4 gr4_lrg.jpg jpg 468501 1984 3445 IMAGE-HIGH-RES 1-s2.0-S2095495625000610-gr5_lrg.jpg https://s3-eu-west-1.amazonaws.com/prod-ucs-content-store-eu-west/content/pii:S2095495625000610/THUMBNAIL/image/jpeg/ed6a7d5171d786cd93ae136d803040a8/gr5_lrg.jpg gr5 gr5_lrg.jpg jpg 971593 2598 3445 IMAGE-HIGH-RES 1-s2.0-S2095495625000610-gr6_lrg.jpg https://s3-eu-west-1.amazonaws.com/prod-ucs-content-store-eu-west/content/pii:S2095495625000610/HIGHRES/image/jpeg/c656507e444d8982eed30f7074e375f5/gr6_lrg.jpg gr6 gr6_lrg.jpg jpg 314252 1459 1699 IMAGE-HIGH-RES 1-s2.0-S2095495625000610-mmc1.docx https://s3-eu-west-1.amazonaws.com/prod-ucs-content-store-eu-west/content/pii:S2095495625000610/mmc1/MAIN/application/vnd.openxmlformats-officedocument.wordprocessingml.document/699e56eb07b45e2a66f010b1d4882873/mmc1.docx mmc1 mmc1.docx docx 5804978 APPLICATION JECHEM 4409 S2095-4956(25)00061-0 10.1016/j.jechem.2025.01.020 Science Press Fig. 1 Structural and morphological characterizations of a-TiVC catalysts. (a) XRD of monolayer TiVC and a-TiVC. (b) TEM image of monolayer TiVC. (c) TEM image of a-TiVC. (d) HRTEM image and fast Fourier transform (FFT) of a-TiVC. (e, f) HAADF-STEM image and EDX elemental maps of a-TiVC. (g–i) Ti 2p, V 2p, and O 1s XPS spectra of a-TiVC. Fig. 2 (a) Visualized adsorption tests of Li2S6 with TiVC and a-TiVC electrodes. (b, c) CV curves and the corresponding Tafel slopes. (d, e) CV curves at different scan rates and the corresponding linear fits. (f) CV curves of symmetrical Li-S batteries with a-TiVC at 10 mV s−1. (g, h) CV curves at different temperatures and corresponding activation energy for a-TiVC. Fig. 3 (a, b) Potentiostatic discharge curves of the Li2S deposition tests using a-TiVC and TiVC as substrates (the insets are SEM images regarding the Li2S deposition morphology on the different substrates). (c) Statistics of sulfur content on different substrates after Li2S deposition. (d, e) Potentiostatic charge curves of the Li2S dissolution tests using a-TiVC and TiVC as substrates (the insets are SEM images regarding the Li2S dissolution morphology on the different substrates). (f) Statistics of sulfur content on different substrates after Li2S dissolution. Fig. 4 (a) Rate performance of a-TiVC and TiVC batteries. (b) Galvanostatic charge/discharge profiles of a-TiVC and TiVC batteries at 0.2 C. (c) Nyquist curves for Li-S batteries with different catalysts. (d) Cycling performance of a-TiVC and TiVC batteries at 0.2 C for 400 cycles. (e) Cycling performance with a high sulfur mass loading of 5.20 mg cm−2 at 0.05 C. Fig. 5 (a, c) In-situ Raman spectra obtained during the discharging/charging process of TiVC and a-TiVC with the first discharge/charge curves. (b, d) Corresponding Raman spectra at different voltages of TiVC and a-TiVC. (e) Ex-situ S 2p XPS of the a-TiVC cathode. (f) TEM and HRTEM images of a-TiVC at the end of the discharging/charging. Fig. 6 Charging curve and different EIS test states of (a) TiVC and (b) a-TiVC. 3D Nyquist plots of different charging and discharging stages of (c) TiVC and (d) a-TiVC. Multi-dimensional catalysis: From macroscopic 3D structures to microscopic Ti-V synergistic interaction in lithium-sulfur batteries Yiqi Cao Writing – original draft Visualization Methodology Formal analysis Data curation Conceptualization a b 1 Qinhua Gu Writing – original draft Visualization Methodology Formal analysis Data curation Conceptualization b 1 Yujie Qi Validation Methodology Investigation b Xiao Tao Validation Methodology Investigation b e Wenjuan Han Writing – review & editing Validation e Bo Liu Writing – review & editing Validation e Chunbo Liu Writing – review & editing Supervision a Chuyan Zhang Visualization Resources b Nan Huang Visualization Resources b d Guangbo Che Writing – review & editing Visualization Supervision Resources a c ⁎ Ming Lu Writing – review & editing Writing – original draft Supervision Resources Project administration Funding acquisition Conceptualization b e ⁎ Bingsen Zhang Writing – review & editing Validation Supervision Resources Project administration Funding acquisition Conceptualization b d ⁎ a Jilin Joint Technology Innovation Laboratory of Developing and Utilizing Materials of Reducing Pollution and Carbon Emissions, College of Engineering, Jilin Normal University, Siping 136000, Jilin, China Jilin Joint Technology Innovation Laboratory of Developing and Utilizing Materials of Reducing Pollution and Carbon Emissions College of Engineering Jilin Normal University Siping Jilin 136000 China Jilin Joint Technology Innovation Laboratory of Developing and Utilizing Materials of Reducing Pollution and Carbon Emissions, College of Engineering, Jilin Normal University, Siping 136000, Jilin, China b Shenyang National Laboratory for Materials Science, Institute of Metal Research, Chinese Academy of Sciences, Shenyang 110016, Liaoning, China Shenyang National Laboratory for Materials Science Institute of Metal Research Chinese Academy of Sciences Shenyang Liaoning 110016 China Shenyang National Laboratory for Materials Science, Institute of Metal Research, Chinese Academy of Sciences, Shenyang 110016, Liaoning, China c College of Chemistry, Baicheng Normal University, Baicheng 137018, Jilin, China College of Chemistry Baicheng Normal University Baicheng Jilin 137018 China College of Chemistry, Baicheng Normal University, Baicheng 137018, Jilin, China d School of Materials Science and Engineering, University of Science and Technology of China, Shenyang 110016, Liaoning, China School of Materials Science and Engineering University of Science and Technology of China Shenyang Liaoning 110016 China School of Materials Science and Engineering, University of Science and Technology of China, Shenyang 110016, Liaoning, China e The Joint Laboratory of MXene Materials, Key Laboratory of Functional Materials Physics and Chemistry of the Ministry of Education, Key Laboratory of Preparation and Application of Environmental Friendly Materials of the Ministry of Education, Jilin Normal University, Changchun 130103, Jilin, China The Joint Laboratory of MXene Materials Key Laboratory of Functional Materials Physics and Chemistry of the Ministry of Education Key Laboratory of Preparation and Application of Environmental Friendly Materials of the Ministry of Education Jilin Normal University Changchun Jilin 130103 China The Joint Laboratory of MXene Materials, Key Laboratory of Functional Materials Physics and Chemistry of the Ministry of Education, Key Laboratory of Preparation and Application of Environmental Friendly Materials of the Ministry of Education, Jilin Normal University, Changchun 130103, Jilin, China ⁎ Corresponding authors. 1 These authors contributed equally to this work. Graphical abstract This study enhances lithium-sulfur reaction efficiency by transforming MXene to a three-dimensional (3D) structure, increasing surface area and catalytic sites. Ti-V synergy boosts electron/ion transport, improving sulfur phase transitions and batteries lifespan. Lithium-sulfur (Li-S) chemistry reaction opens a new battery era with high energy density; meanwhile, multiple electrons migration leads to the complex phase transition of sulfur species. To manipulate the binding strength of multiple key intermediates more efficiently, the bimetallic TiVC MXene is utilized to realize multi-dimensional catalysis. Based on the macroscopic three-dimensional (3D) structure using two-dimensional (2D) MXene architecture, electron conductivity and sulfur utilization are improved. Microscopically, Ti-V catalytic systems regulate multiple reaction intermediates through intermetallic synergies customized surface properties and atomic scale coordination, thereby improving electronic and ionic conductivity. In-situ Raman spectroscopy and electrochemical analysis show that the conversion rate of polysulfides was accelerated during the charge-discharge process. The Ti-V interaction exhibits unique catalytic activity and regulates multiple continuous processes of sulfur species phase transformation, which are essential for the excellent energy performance of Li-S batteries. This study not only clarifies the catalytic mechanism of Ti-V at different dimensions but also proposes a promising strategy for the design of advanced catalytic systems in energy storage technology. Keywords Bimetallic MXene Three-dimensional structure Catalysis Lithium-sulfur batteries In-situ characterizations 1 Introduction Lithium-sulfur (Li-S) batteries are considered highly promising for future energy storage technologies due to their high theoretical energy density (2600 Wh kg−1), low cost, and environmental benignity [1]. However, their practical application is hindered by the slow redox kinetics of sulfur species and the shuttle effect of lithium polysulfides (LiPSs) [2–6]. Catalysis has emerged as a promising approach, particularly through an adsorption-transformation-desorption mechanism that facilitates the conversion of liquid LiPSs into solid Li2S2/Li2S, thereby lowering LiPSs concentration in the electrolyte [7–13]. Among the various catalysts explored, MXenes have attracted widespread interest for their conductivity, rapid charge response, and specific surface area. During the solid-liquid-solid transformation of sulfur species, MXenes exhibit strong chemisorption and catalytic conversion capabilities, which enhance the conversion of LiPSs and improve redox activity [14–17]. Currently, MXene-based catalysts primarily focus on monometallic MXenes [18,19], such as Ti3C2 [20–22] and V2C [23–25]. However, monometallic MXenes contain only one type of metal element, resulting in a relatively simple energy level structure characterized by a straightforward bandwidth and energy level distribution [26]. This simplicity can lead to inferior energy level matching with specific reaction intermediates, thereby hindering charge transfer between the material surface and these intermediates. By diversifying the composition at the metal sites, bimetallic MXenes exhibit the potential to tailor specific properties. The introduction of a second element with dimensions like the main metal can modify the electronic structure of the metal sites within the lattice, enhancing the adsorption of reaction intermediates and addressing the limitations of monometallic MXenes. For instance, introducing the transition metal vanadium (V) into the transition metal layer of MXene results in the formation of the bimetallic solid solution TiVC. The interactions between elements in this solid solution are typically stronger, which enhances ion and electron transport within the material. Additionally, V possesses high oxidative activity, and its incorporation into MXene can improve catalytic efficiency toward LiPSs, reducing the formation of reaction intermediates. However, MXene tends to agglomerate and restack, which reduces the surface area, blocks active sites, and increases internal resistance, ultimately degrading catalytic performance [27,28]. Therefore, further research is needed to fully understand the catalytic interfaces, electronic properties, and overall performance [29–32]. Herein, inspired by the unique spatial structures and highly adjustable metal compositions of MXenes, three-dimensional (3D) bimetallic TiVC MXene catalysts were prepared based on an alkalization method (a-TiVC). The catalyst was employed as the catalytic cathode in Li-S batteries [33–35] and was focused on the catalytic capabilities of LiPSs. Structural characterization demonstrated that surface engineering preserves crystal structure, minimizes band gaps and internal resistance, and facilitates the full exposure of active sites. Additionally, in-situ characterization techniques revealed the catalytic mechanisms of this bimetallic catalyst for LiPSs. The a-TiVC exhibits tandem catalytic capabilities, improves the adsorption of LiPSs, reduces reaction barriers, and leverages synergistic interaction between Ti and V, enhancing interfacial chemical bonding [36–41]. 2 Experimental 2.1 Materials Preparation of TiVC nanosheets. Firstly, 2 g of lithium fluoride (LiF) powder was added into 20 mL of 12 M hydrochloric acid (HCl), and magnetic stirring was carried out at room temperature with a speed of 450 r min−1 and a stirring time of 20–30 min to make a homogeneous mixture. Then 1 g of TiVAlC ceramic powder was slowly added into the mixture, and the temperature was raised to 50 °C, and the mixture was stirred with continuous heating for 72 h. Subsequently, the mixture was centrifuged at 8000 r min−1 to collect the black precipitate and discard the supernatant, and the collected precipitate was centrifuged and washed with deionized water and ethanol several times until the pH reached about 5.5. Then the precipitate was mixed with ethanol and sonicated under nitrogen atmosphere for 2 h. The solution was filtered and freeze-dried to obtain TiVC nanosheets. Preparation of a-TiVC: 200 mg of dried and finished nanosheets were taken and 50 mL of deionized water was added and stirred to make a solution. At the same time, 50 mL of 4 M KOH solution was prepared and slowly added into the nanosheet solution under stirring. The solution was stirred continuously at room temperature for 24 h. Finally, the precipitate was collected by filtration and freeze-dried to obtain a-TiVC. 2.2 Batteries assembly and electrochemical testing Structure and morphology of TiVC nanosheets and a-TiVC. The prepared catalysts were characterized by an X-ray diffractometer operating (Karlsruhe, Germany) at 40 kV, 30 mA with Cu-K radiation (λ = 0.15405 nm), and the powder XRD patterns were collected in a range of diffraction angles (2θ) from 5° to 60°. The field emission scanning electron microscopy (SEM, FEI Nova Nano 450) and transmission electron microscopy (TEM, FEI Tecnai G2 F20) equipped with high-angle annular dark-field scanning TEM (HAADF-STEM) and energy-dispersive X-ray spectroscopy (EDX) detectors were conducted to study the morphology and microstructures of the catalysts. X-ray photoelectron spectroscopy (XPS) characterizations were obtained by an ESCALAB 250 instrument (Waltham, USA) with Al K α X-rays (1489.6 eV, 150 W, 50.0 eV pass energy). Li-S batteries assembly. Firstly, the materials (TiVC, a-TiVC) and sublimation sulfur were mixed and milled uniformly according to the mass ratio of 3:7, kept warm at 155 °C for 12 h, and then heated to 180 °C and kept warm for 2 h. The positive electrode active material was prepared, and the active material, Cochin black, and polyvinylidene difluoride (PVDF) binder were mixed in N-methyl-2-pyrrolidone (NMP) according to the mass ratio of 7:2:1, milled to make a slurry to prepare the working electrode, and held in a vacuum at 55 °C for 12 h. After drying, it was cut into a circular piece with a diameter of 10 mm as the cathode. The sulfur loading of the cathode was about 1 mg cm−1. Subsequently, CR2032 coin batteries were assembled in an argon-filled glove box with humidity and oxygen concentration below 0.5 ppm, with pure lithium foil as the negative electrode and Celgard 2500 film as the diaphragm, and each battery was injected with 40 µL of electrolyte solution. The electrolyte solution consisted of 1.0 M lithium bis-triflfluoromethanesulphonylimide (LiTFSI) in 1:1 (v/v) 1,2-dimethoxyethane: 1,3-dioxolane (DME:DOL) and 1 wt% LiNO3. For Li-S batteries with high sulfur loading, electrolyte additions were made at an electrolyte/sulfur (E/S) ratio of 11:1. All batteries were set aside for 4–6 h before cycling to ensure that the electrolyte penetrated the electrodes sufficiently. Electrochemical performance was measured using a NEWARE-CT4008 instrument in a room temperature voltage window of 1.7–2.7 V vs. Li/Li+. The specific capacity was calculated based on the mass of sulfur. Cyclic voltammetry (CV) curves and electrochemical impedance spectra (EIS) of the samples were determined using an electrochemical workstation. The voltages of CV test ranged from 1.7 to 2.8 V with a scan rate of 0.1 mV s−1. EIS analyses were acquired in the range of 0.01 Hz to 100 kHz. 3 Results and discussion 3.1 Synthesis and characterization of a-TiVC The TiVAlC powder with MAX phase (Fig. S1) was etched with a LiF/HCl solution to selectively remove the Al atomic layer, resulting in multilayered TiVC [28,42,43]. SEM analysis (Fig. S2a) revealed the typical MXene multilayered structure and EDX spectroscopy (Fig. S2b) confirmed the elemental composition of Ti, V, and C. Fig. 1 (a) presents the XRD pattern analysis, where a distinct peak at 6.59° is characteristic of MXenes, indicating that the alkalization of the MXene does not change the structure. The multilayered MXene was then sonicated to expand interlayer spacing, transforming the accordion-like morphology to a two-dimensional (2D) monolayer structure (Fig. 1b). Transparent flakes observed by SEM further corroborated the formation of monolayer and few-layer TiVC (Fig. S3). High-resolution TEM (HRTEM) reveals a lattice spacing of 0.23 nm (Fig. S4). Following alkalization with KOH, TiVC nanosheets transform into nanoribbons due to ion exchange and directional crystal cleavage. The substitution of surface F groups by OH groups alters the chemical environment, while OH− ions selectively etch the weaker Ti–O and V–O bonds along specific crystal orientation, driving delamination and anisotropic restructuring into one-dimensional nanoribbons [38]. TEM (Fig. 1c) reveals an interwoven nanoribbon-nanosheet structure. As shown in Fig. 1(d), the crystal structure and plane spacing of a-TiVC nanosheets were analyzed using HRTEM images. These results confirmed that the nanosheets possess high crystallinity with a hexagonal close-packed (HCP) structure. A comparison with the pristine TiVC nanosheets reveals a leftward shift in the (002) peak and a slight increase in the full width at half maximum (FWHM), suggesting an enlargement of the interlayer spacing in the MXenes following the alkalization process, which aligns with the formation of nanoribbons. SEM and TEM images of a-TiVC illustrate the development of a 3D structure. HAADF-STEM and EDX elemental maps further show the distribution of C, O, Ti, and V elements within the a-TiVC catalyst (Fig. 1e and f). These results indicate that the nanobelts are uniformly derived from TiVC. XPS) was employed to identify the elemental composition and valence states in the a-TiVC MXene. The Ti 2p XPS peaks are observed at 457.1, 458.6, 462.6, and 464.3 eV, corresponding to Ti–C and Ti–O bonds, respectively (Fig. 1g). The V 2p XPS peaks are located at 513.7, 516.4, 521.0, and 532.8 eV, which are associated with V–C and V4+ species (Fig. 1h). The O 1s XPS spectra display three peaks denoted Ti–O, V–O and O–H (Fig. 1i). A comparison of the Ti 2p and V 2p XPS spectra of TiVC confirms that the structure of the a-TiVC MXene remains unchanged post-alkalization (FigS. S5 and S6) [44–48]. 3.2 Electrochemical characterization of a-TiVC The adsorption capacity of catalysts for LiPSs is crucial in Li-S batteries, as it not only mitigates the loss of active materials but also enhances the catalytic conversion of LiPSs on the catalyst surface. To evaluate the adsorption capacity of TiVC and a-TiVC, the static adsorption experiments were conducted using equal masses of each catalyst powder as adsorbents, with a fixed concentration and volume of Li2S6 solution [49,50]. The experimental results reveal that the solution containing a-TiVC catalysts was colorless after 2 h of immersion, whereas the solution with TiVC retained its color (Fig. 2 a). This observation is consistent with literature reports, indicating that a lighter color corresponds to a lower concentration of LiPSs. These results suggest that a-TiVC possesses a higher density of bimetallic sites, which form stronger interactions with LiPSs. To further elucidate the role of the a-TiVC catalyst in Li-S batteries, CV measurements were performed. The CV measurements were conducted at a rate of 0.1 mV s−1, with the voltage windows ranging from 1.7 to 2.8 V. The CV curves of the Li-S batteries exhibit two distinct reduction peaks and two oxidation peaks. Specifically, the oxidation peak at 2.5 V corresponds to the oxidation of Li2S2/Li2S to S8, which aligns with the charging plateau. Conversely, the reduction peak at 2.3 V is attributed to the reduction of long-chain LiPSs (Li2S n , 4 ≤ n ≤ 8), corresponding to the first discharge plateau. Notably, the reduction peaks (I, II) and oxidation peaks (I', II') for the a-TiVC catalyst are more compact compared to those for the TiVC catalyst, indicating a reduction in polarization (Fig. 2b and Table S1). To further evaluate the sulfur redox kinetics, the Tafel slope of the liquid-solid transition was computed, as displayed in Fig. 2(c). The Tafel slope for the a-TiVC battery in converting Li2S n to Li2S is 68.8 mV dec−1, which is lower than that of the TiVC battery being 102.9 mV dec−1. This reduction in Tafel slope for the a-TiVC battery indicates a more efficient catalytic conversion of long-chain LiPSs to short-chain LiPSs, attributed to the increased presence of Ti and V metals. The Tafel slope for the a-TiVC battery in converting Li2S to Li2S n is 65.4 mV dec−1. The lower Tafel slope observed for the oxidative process in a-TiVC signifies an enhanced kinetic rate for the conversion of LiPSs [51]. Additionally, the Li+ diffusion behavior was assessed through CV curves at varying scanning rates (0.1 to 0.5 mV s−1), and the Li+ diffusion coefficients for peaks I, II, and III were determined using the Randles-Sevcik equation [52]. The higher ionic diffusion coefficients are observed for the a-TiVC batteries, in comparison to the TiVC batteries, suggesting a more rapid diffusion of Li+ during the redox reactions (Fig. 2d, e and Fig. S7). These findings confirm that the increased exposure of bimetallic active sites in a-TiVC effectively lowers the energy barrier for Li+ diffusion, thereby accelerating the subsequent conversion of LiPSs. As illustrated in Fig. 2(f), to elucidate the catalytic abilities provided by a-TiVC in Li-S batteries, symmetric batteries with TiVC and a-TiVC electrodes were assembled. Both CV profiles display two pairs of redox peaks characteristic of LiPSs conversion. However, the a-TiVC symmetric batteries exhibit sharper and more pronounced peaks compared to the TiVC batteries, indicating improved kinetics of redox reaction during the liquid-liquid transformation. This indicates higher exposure of bimetallic catalytic sites and more effective promotion of LiPSs conversion, highlighting the superior catalytic performance of a-TiVC in Li-S batteries. To further elucidate the catalytic role in enhancing the conversion kinetics in Li-S batteries, the activation energy (E a) was assessed. Temperature-dependent CV experiments were conducted at various temperatures (40, 50, and 60 °C) to determine the E a associated with the liquid-solid phase transformation of LiPSs (Fig. 2g and Fig. S8) [53]. The peak current (j) in the CV curves is directly related to the reaction rate (k), allowing the application of the Arrhenius equation (j ∝ k = A × e−E a/ RT ). The fitting results presented in Fig. 2(h) reveal that a-TiVC exhibits a lower E a compared to TiVC. This lower activation energy indicates that a-TiVC significantly enhances the catalytic activity, facilitating a more efficient LiPSs conversion process in Li-S batteries. In Li-S batteries, the liquid-to-solid phase transition of sulfur species is a critical rate-limiting step due to its high energy barrier. To evaluate the catalytic performance of TiVC and a-TiVC in facilitating the transition processes, the Li2S deposition capability of both materials was investigated [54,55]. TiVC and a-TiVC were coated on carbon paper and assembled into asymmetric batteries with a Li2S8 solution as the electrolyte. The batteries were first discharged at a constant current until 2.06 V and then held at a constant voltage of 2.045 V. The results show that the Li2S deposition capacity of a-TiVC catalysts achieved 271.5 mAh g−1 (Fig. 3 a and b). SEM and EDX analysis (Fig. 3c and Fig. S9) confirmed the morphology and composition of the Li2S deposits. The results suggest that a-TiVC catalysts, with its greater exposure of bimetallic sites, lowered the nucleation energy barrier and promoted the rate of nucleation. In Li-S batteries, the reversible charging and discharging processes involve the dissolution of Li2S and conversion to S8, making efficient Li2S dissolution essential for cycling stability [56]. To investigate the problem, constant potential measurements were used. The a-TiVC cathode demonstrated the highest decomposition capacity of 671.5 mAh g−1, surpassing that of the TiVC cathode (Fig. 3d and e). SEM and EDX analysis revealed that the a-TiVC electrode surface became smoother with significantly reduced sulfur content (Fig. 3f and Fig. S10). This indicates that bimetallic sites of a-TiVC enhance the dissolution of Li2S during charging by facilitating electron and ion transfer at the electrode interface, thereby improving battery performance. 3.3 Electrochemical performance of Li-S batteries with the a-TiVC catalyst To investigate the impact of a-TiVC catalysts, Li-S batteries were assembled using TiVC and a-TiVC, with lithium metal as the cathode. Fig. 4 (a) shows the capacities of the a-TiVC cathode at varying current densities (0.1 to 2 C), which were 1157.6, 928.4, 807.1, 719.3, 692.3, and 656.2 mAh g−1, respectively. When the current density was reduced back to 0.1 C, the capacity increased to 884.3 mAh g−1, which is higher than that of the TiVC electrode. The a-TiVC battery shows a much lower overpotential (159.0 mV) than the TiVC battery (194.6 mV), indicating the faster electrochemical conversion kinetics of LiPSs (Fig. 4b and Fig. S11a). To further evaluate the effect of TiVC and a-TiVC, EIS was performed. As shown in Fig. 4(c), the results indicate that the a-TiVC electrode exhibits lower R e and R ct values compared to TiVC, suggesting improved charge transfer efficiency (Table S2), demonstrating that the 3D conductive network of a-TiVC facilitates faster electron and ion transport, enhancing overall electrode performance. The cycling stability of the two cathodes was assessed at a rate of 0.2 C, as illustrated in Fig. 4(d). The initial specific capacity of the a-TiVC cathode is 927.2 mAh g−1. After 400 cycles at 0.2 C, a-TiVC retains a specific capacity of 467.13 mAh g−1, demonstrating excellent stability, while TiVC shows a reduced discharge capacity of 350.26 mAh g−1 under the same conditions. Furthermore, with a sulfur mass loading of 5.20 mg cm−2 and an electrolyte-to-sulfur ratio of 11:1, the a-TiVC batteries maintain high capacity after 100 cycles at a lower current rate of 0.05 C (Fig. 4e, Figs. S11b and S12). 3.4 Reaction kinetics of LiPSs catalyzed by a-TiVC To examine the transformation of LiPSs in Li-S batteries during charging and discharging cycles, we utilized the experimental setup shown in Fig. S13 and evaluated how effectively the electrode materials mitigate the shuttling effect. This setup allowed the laser incident beam to pass through a quartz observation window for real-time qualitative detection of LiPSs on the cathode side, with in-situ Raman spectra recorded under constant-current discharge conditions [57–60]. Fig. 5 presents Raman images of TiVC and a-TiVC electrodes at various voltage states throughout the charging and discharging processes. During discharge, S8 is progressively converted into LiPSs, while charging reversibly oxidizes the short-chain Li2S2/Li2S back to S8. For TiVC electrodes (Fig. 5a and b), the characteristic peaks corresponding to S4 2− and S3 2− were consistently observed throughout both charging and discharging, indicating the presence of the shuttle effect and slower LiPSs conversion kinetics. In contrast, the Raman signals of LiPSs in the alkali-treated a-TiVC electrode were largely undetectable during both discharge and charge cycles (Fig. 5c and d). This observation suggests that the a-TiVC electrode effectively adsorbs and facilitates the rapid conversion of LiPSs on the cathode side, thereby significantly reducing the LiPSs shuttling phenomenon and enhancing the conversion kinetics. To further investigate the catalytic transformation of LiPSs on a-TiVC, XPS was conducted at various states during the charging and discharging cycles (Fig. 5e and Fig. S14). The XPS results show that the characteristic peak of Li–S appeared at 2.1 and 1.7 V, which correspond to LiPSs and Li2S/Li2S2, diminishing in intensity during the charge process. With the electron capture and loss process of sulfur species, the S–S binding energy shifts distinctly. The formation of Ti–S and V–S peaks suggests that Ti and V chemically bond with sulfur atoms in the LiPSs. This interaction between the Ti, V transition metals and LiPSs concurrently facilitates the transformation of LiPSs, highlighting the catalytic efficacy of a-TiVC in improving sulfur redox processes. In conjunction with the TEM characterization results (Fig. 5f), it was observed that a-TiVC exhibited a significant formation of Li2S particles on its surface by the end of the discharge process. This finding corroborates the Raman spectroscopy data, and further demonstrates the enhanced catalytic conversion of LiPSs by a-TiVC. Upon completion of the charging cycle, a-TiVC retained its 3D interwoven structure, demonstrating notable structural stability, which is advantageous for improving cycling performance. During the discharge process of Li-S batteries, the liquid-solid phase transformation contributes significantly, accounting for three-quarters of the total capacity. However, the accumulation of intermediate products increases the internal impedance, which restricts the redox kinetics. Therefore, analyzing the EIS data can provide valuable insights into the complex sulfur redox reactions and the changes occurring at the cathode of the Li-S battery [61–65]. We conducted in-situ impedance measurements on the battery at different charge and discharge states (Fig. 6 a and b). As illustrated in Fig. 6(c and d), at the beginning of the discharge process, the conversion of solid S8 into long-chain LiPSs primarily affects the high-frequency region, which is related to the evolution of electrolyte resistance. As the LiPSs concentration increases, high-frequency impedance rises slightly, while low-frequency impedance decreases. The formation of intermediates results in the solid electrode interface, causing the obstacles of charge transfer at the electrode/electrolyte interface. This manifests as two semicircles in the high-to-mid frequency range. The formation of soluble long-chain LiPSs inevitably increases the viscosity of the electrolyte. However, during the discharge process, long-chain LiPSs are converted into short-chain LiPSs, which participate more in surface construction. High-frequency impedance gradually decreases as solid Li2S begins to form, and the consumption of soluble materials reduces electrolyte viscosity, thereby lowering electrolyte resistance. During the charging, reversible reactions occur, accompanied by the dissolution of solid Li2S, which in turn leads to an increase in electrolyte viscosity. In comparison with TiVC, a-TiVC has more active sites and shows minimal change in impedance throughout the charging process compared to the initial discharge. Conversely, the electrolyte resistance of TiVC does not return to its initial value and remains slightly elevated. This difference in behavior may contribute to the fact that even at the end of the first discharge and charge cycles, some LiPSs remain in the electrolyte, indicating incomplete reversibility, as supported by the in-situ Raman results. The results demonstrate that a-TiVC enhances the redox kinetics of LiPSs during the charge and discharge processes. 4 Conclusions The unique characteristics of intermediate species in the Li-S chemistry suggest that constructing a TiVC MXene bimetallic catalyst with intermetallic synergy is an effective strategy to optimize the reaction pathway and enhance overall catalytic activity. By employing an alkalization method, the surface functional group hydrolysis of the MXene induces the dissolution and reconstruction of transition metals into a 3D structure. This process significantly increases the specific surface area and generates abundant catalytic sites, which are crucial for enhancing the Ti-V catalytic activity. The Ti-V intermetallic synergy significantly enhances the electron and ion transport between the catalytic interface and LiPSs, facilitating more efficient reactions. This multi-faceted catalytic approach leverages the synergistic effects of 3D structural and intermetallic interactions, where the a-TiVC MXene catalyst not only enhances mass transfer during the Li-S reaction but also optimizes the electronic and ionic interactions at the catalyst interface, thereby facilitating seamless phase transitions. Electrochemical analysis demonstrates that the catalyst exhibits high capacity and excellent cycling stability, sustaining 467.13 mAh g−1 after 400 cycles. This study emphasizes the importance of bimetallic catalysts and multi-dimensional catalysis in optimizing catalytic performance, offering a new approach to improving energy storage systems. CRediT authorship contribution statement Yiqi Cao: Writing – original draft, Visualization, Methodology, Formal analysis, Data curation, Conceptualization. Qinhua Gu: Writing – original draft, Visualization, Methodology, Formal analysis, Data curation, Conceptualization. Yujie Qi: Validation, Methodology, Investigation. Xiao Tao: Validation, Methodology, Investigation. Wenjuan Han: Writing – review & editing, Validation. Bo Liu: Writing – review & editing, Validation. Chunbo Liu: Writing – review & editing, Supervision. Chuyan Zhang: Visualization, Resources. Nan Huang: Visualization, Resources. Guangbo Che: Writing – review & editing, Visualization, Supervision, Resources. Ming Lu: Writing – review & editing, Writing – original draft, Supervision, Resources, Project administration, Funding acquisition, Conceptualization. Bingsen Zhang: Writing – review & editing, Validation, Supervision, Resources, Project administration, Funding acquisition, Conceptualization. Declaration of competing interest The authors declare that they have no known competing financial interests or personal relationships that could have appeared to influence the work reported in this paper. Acknowledgments The authors gratefully acknowledge the financial support provided by the National Natural Science Foundation of China (No. 51932005), the Liaoning Revitalization Talents Program (No. XLYC1807175), the Development Plan of Science and Technology of Jilin Province, China (YDZJ202301ZYTS280), the Natural Science Foundation of Jilin Province (YDZJ202401316ZYTS). Appendix A Supplementary material Supplementary data to this article can be found online at https://doi.org/10.1016/j.jechem.2025.01.020. Appendix A Supplementary material The following are the Supplementary data to this article: Supplementary Data 1 References [1] H. Raza S. Bai J. Cheng S. Majumder H. Zhu Q. Liu G. Zheng X. Li G. Chen Energy Rev. 6 2023 29 H. Raza, S. Bai, J. Cheng, S. Majumder, H. Zhu, Q. Liu, G. Zheng, X. Li, G. Chen, Energy Rev. 6 (2023) 29. [2] P. Bonnick J. Muldoon Energy Environ. Sci. 13 2020 4808 4833 P. Bonnick, J. Muldoon, Energy Environ. Sci. 13 (2020) 4808-4833. [3] H. Li Y. Li L. Zhang SusMat 2 2022 34 64 H. Li, Y. Li, L. Zhang, Susmat 2 (2022) 34-64. [4] T. Li X. Bai U. Gulzar Y.-J. Bai C. Capiglia W. Deng X. Zhou Z. Liu Z. Feng R.P. Zaccaria Adv. Funct. Mater. 29 2019 901730 T. Li, X. Bai, U. Gulzar, Y.-J. Bai, C. Capiglia, W. Deng, X. Zhou, Z. Liu, Z. Feng, R.P. Zaccaria, Adv. Funct. Mater. 29 (2019) 901730. [5] J. Wang W.-Q. Han Adv. Funct. Mater. 32 2022 2107166 J. Wang, W.-Q. Han, Adv. Funct. Mater. 32 (2022) 2107166. [6] M. Zhao H.-J. Peng B.-Q. Li J.-Q. Huang Acc. Chem. Res. 57 2024 545 557 M. Zhao, H.-J. Peng, B.-Q. Li, J.-Q. Huang, Acc. Chem. Res. 57 (2024) 545-557. [7] L. Zhou D.L. Danilov F. Qiao J. Wang H. Li R.-A. Eichel P.H.L. Notten Adv. Energy Mater. 12 2022 2202094 L. Zhou, D.L. Danilov, F. Qiao, J. Wang, H. Li, R.-A. Eichel, P.H.L. Notten, Adv. Energy Mater. 12 (2022) 2202094. [8] J. Han P. Wang H. Zhang N. Song X. An B. Xi S. Xiong Chin. Chem. Lett. 35 2024 109543 J. Han, P. Wang, H. Zhang, N. Song, X. An, B. Xi, S. Xiong, Chin. Chem. Lett. 35 (2024) 109543. [9] L. Chen G. Cao Y. Li G. Zu R. Duan Y. Bai K. Xue Y. Fu Y. Xu J. Wang X. Li Nano-Micro Lett. 169 2024 97 L. Chen, G. Cao, Y. Li, G. Zu, R. Duan, Y. Bai, K. Xue, Y. Fu, Y. Xu, J. Wang, X. Li, Nano-Micro Lett. 169 (2024) 97. [10] Q. Li J. Liu F. Chu J. Zhou J. Chen Z. Guan X. Yang J. Lei F. Wu Chin. Chem. Lett. 24 2024 110306 Q. Li, J. Liu, F. Chu, J. Zhou, J. Chen, Z. Guan, X. Yang, J. Lei, F. Wu, Chin. Chem. Lett. 24 (2024) 110306. [11] H. Liu F. Liu Z. Qu J. Chen H. Liu Y. Tan J. Guo Y. Yan S. Zhao X. Zhao X. Nie X. Ma Z. Pei M. Liu Nano Res. Energy 2 2023 e9120049 H. Liu, F. Liu, Z. Qu, J. Chen, H. Liu, Y. Tan, J. Guo, Y. Yan, S. Zhao, X. Zhao, X. Nie, X. Ma, Z. Pei, M. Liu, Nano Res. Energy 2 (2023) e9120049. [12] C. Su X. Gao K. Liu Y. Dai H. Dong Y. Liu J. Zhu Q. Zhang H. He G. He Nano Res. Energy 3 2024 e9120094 C. Su, X. Gao, K. Liu, Y. Dai, H. Dong, Y. Liu, J. Zhu, Q. Zhang, H. He, G. He, Nano Res. Energy 3 (2024) e9120094. [13] T. Wang Q. Dong C. Li Z. Wei Acta Phys. -Chim. Sin. 40 2024 2 T. Wang, Q. Dong, C. Li, Z. Wei, Acta Phys. -Chim. Sin. 40 (2024) 2. [14] F. Li S. Mei X. Ye H. Yuan X. Li J. Tan X. Zhao T. Wu X. Chen F. Wu Y. Xiang H. Pan M. Huang Z. Xue Adv. Sci. 11 2024 2404328 F. Li, S. Mei, X. Ye, H. Yuan, X. Li, J. Tan, X. Zhao, T. Wu, X. Chen, F. Wu, Y. Xiang, H. Pan, M. Huang, Z. Xue, Adv. Sci. 11 (2024) 2404328. [15] S. Zhang H. Ying B. Yuan R. Hu W.-Q. Han Nano-Micro Lett. 12 2020 78 S. Zhang, H. Ying, B. Yuan, R. Hu, W.-Q. Han, Nano-Micro Lett. 12 (2020) 78. [16] S. Zhang N. Zhong X. Zhou M. Zhang X. Huang X. Yang R. Meng X. Liang Nano-Micro Lett. 12 2020 112 S. Zhang, N. Zhong, X. Zhou, M. Zhang, X. Huang, X. Yang, R. Meng, X. Liang, Nano-Micro Lett. 12 (2020) 112. [17] Q. Zhao Q. Zhu Y. Liu B. Xu Adv. Funct. Mater. 31 2021 2100457 Q. Zhao, Q. Zhu, Y. Liu, B. Xu, Adv. Funct. Mater. 31 (2021) 2100457. [18] R. Liu Z. Wei L. Peng L. Zhang A. Zohar R. Schoeppner P. Wang C. Wan D. Zhu H. Liu Z. Wang S.H. Tolbert B. Dunn Y. Huang P. Sautet X. Duan Nature 626 2024 98 104 R. Liu, Z. Wei, L. Peng, L. Zhang, A. Zohar, R. Schoeppner, P. Wang, C. Wan, D. Zhu, H. Liu, Z. Wang, S.H. Tolbert, B. Dunn, Y. Huang, P. Sautet, X. Duan, Nature 626 (2024) 98-104. [19] Q. Gu Y. Cao M. Lu B. Zhang Chem. Commun. 60 2024 8339 8349 Q. Gu, Y. Cao, M. Lu, B. Zhang, Chem. Commun. 60 (2024) 8339-8349. [20] T. Wang D. Luo Y. Zhang Z. Zhang J. Wang G. Cui X. Wang A. Yu Z. Chen ACS Nano 15 2021 19457 19467 T. Wang, D. Luo, Y. Zhang, Z. Zhang, J. Wang, G. Cui, X. Wang, A. Yu, Z. Chen, ACS Nano 15 (2021) 19457-19467. [21] Q. Gu Y. Cao J. Chen Y. Qi Z. Zhai M. Lu N. Huang B. Zhang Nano-Micro Lett. 16 2024 266 Q. Gu, Y. Cao, J. Chen, Y. Qi, Z. Zhai, M. Lu, N. Huang, B. Zhang, Nano-Micro Lett. 16 (2024) 266. [22] R. Liu S. Zhai Z. Ye M. Liu Y. Xu C. Li X. Wang T. Mei J. Mater. Chem. A 11 2023 24330 24337 R. Liu, S. Zhai, Z. Ye, M. Liu, Y. Xu, C. Li, X. Wang, T. Mei, J. Mater. Chem. A 11 (2023) 24330-24337. [23] L. Chen Y. Sun X. Wei L. Song G. Tao X. Cao D. Wang G. Zhou Y. Song Adv. Mater. 35 2023 00771 L. Chen, Y. Sun, X. Wei, L. Song, G. Tao, X. Cao, D. Wang, G. Zhou, Y. Song, Adv. Mater. 35 (202323Please check the year of Ref. [23], and correct if necessary.) 00771. [24] Y. Lv L. Bai Q. Jin S. Deng X. Ma F. Han J. Wang L. Zhang L. Wu X. Zhang J. Energy Chem. 89 2024 397 409 Y. Lv, L. Bai, Q. Jin, S. Deng, X. Ma, F. Han, J. Wang, L. Zhang, L. Wu, X. Zhang, J. Energy Chem. 89 (2024) 397-409. [25] Q. Jin L. Zhang M. Zhao L. Li X. Yu J. Xiao L. Kong X. Zhang Adv. Funct. Mater 34 2024 2309624 Q. Jin, L. Zhang, M. Zhao, L. Li, X. Yu, J. Xiao, L. Kong, X. Zhang, Adv. Funct. Mater 34 (2024) 2309624. [26] L. Liu G. Ying Q. Jiang D. Wen P. Wang M. Wu Z. Ji Y. Zheng X. Wang J. Adv. Ceram. 13 2024 1 10 L. Liu, G. Ying, Q. Jiang, D. Wen, P. Wang, M. Wu, Z. Ji, Y. Zheng, X. Wang, J. Adv. Ceram. 13 (2024) 1-10. [27] B. Ratzker B. Favelukis M. Baranov Y. Rathod A. Greenberg O. Messer D.A. Goldstein A. Upcher V. Ezersky N. Maman I. Biran V. Natu M. Sokol Adv. Funct. Mater. 34 2024 1 14 B. Ratzker, B. Favelukis, M. Baranov, Y. Rathod, A. Greenberg, O. Messer, D.A. Goldstein, A. Upcher, V. Ezersky, N. Maman, I. Biran, V. Natu, M. Sokol, Adv. Funct. Mater. 34 (2024) 1-14. [28] W. Zhao Y. Yang Q. Deng Q. Dai Z. Fang X. Fu W. Yan L. Wu Y. Zhou Adv. Funct. Mater. 33 2023 2210037 W. Zhao, Y. Yang, Q. Deng, Q. Dai, Z. Fang, X. Fu, W. Yan, L. Wu, Y. Zhou, Adv. Funct. Mater. 33 (2023) 2210037. [29] L. Cai H. Ying P. Huang Z. Zhang H. Tan Q. Han W.-Q. Han Chem. Eng. J. 474 2023 145862 L. Cai, H. Ying, P. Huang, Z. Zhang, H. Tan, Q. Han, W.-Q. Han, Chem. Eng. J. 474 (2023) 145862. [30] Y. Chen Y. Kang H. Yang H. Hua J. Qin P. Liu Y. Zhang Y. Zhang J. Zhao Energy Storage Mater. 54 2023 488 497 Y. Chen, Y. Kang, H. Yang, H. Hua, J. Qin, P. Liu, Y. Zhang, Y. Zhang, J. Zhao, Energy Storage Mater. 54 (2023) 488-497. [31] Q. Gu Y. Qi J. Chen M. Lu B. Zhang Small 18 2022 488 497 Q. Gu, Y. Qi, J. Chen, M. Lu, B. Zhang, Small 18 (2022) 488-497. [32] Z. He L. Yao W. Guo N. Sun F. Wang Y. Wang R. Wang F. Wang Adv. Funct. Mater. 33 2023 2305251 Z. He, L. Yao, W. Guo, N. Sun, F. Wang, Y. Wang, R. Wang, F. Wang, Adv. Funct. Mater. 33 (2023) 2305251. [33] Z. He T. Rong Y. Li J. Ma Q. Li F. Wu Y. Wang F. Wang ACS Nano 16 2022 4072 4083 Z. He, T. Rong, Y. Li, J. Ma, Q. Li, F. Wu, Y. Wang, F. Wang, ACS Nano 16 (2022) 4072-4083. [34] S.-P. Huang J. Zhang Y.-R. Ren W.-K. Chen Appl. Surf. Sci. 569 2021 151002 S.-P. Huang, J. Zhang, Y.-R. Ren, W.-K. Chen, Appl. Surf. Sci. 569 (2021) 151002. [35] P. Liu H. Xu X. Wang G. Tian X. Wen C. Wang C. Zeng S. Wang F. Fan T. Zeng S. Liu C. Shu J. Colloid Interface Sci. 655 2024 364 370 P. Liu, H. Xu, X. Wang, G. Tian, X. Wen, C. Wang, C. Zeng, S. Wang, F. Fan, T. Zeng, S. Liu, C. Shu, J. Colloid Interface Sci. 655 (2024) 364-370. [36] Y. Dong Z.-S. Wu S. Zheng X. Wang J. Qin S. Wang X. Shi X. Bao ACS Nano 11 2017 4792 4800 Y. Dong, Z.-S. Wu, S. Zheng, X. Wang, J. Qin, S. Wang, X. Shi, X. Bao, ACS Nano 11 (2017) 4792-4800. [37] Y. Dong S. Zheng J. Qin X. Zhao H. Shi X. Wang J. Chen Z.-S. Wu ACS Nano 12 2018 2381 2388 Y. Dong, S. Zheng, J. Qin, X. Zhao, H. Shi, X. Wang, J. Chen, Z.-S. Wu, ACS Nano 12 (2018) 2381-2388. [38] P. Lian Y. Dong Z.-S. Wu S. Zheng X. Wang S. Wang C. Sun J. Qin X. Shi X. Bao Nano Energy 40 2017 1 8 P. Lian, Y. Dong, Z.-S. Wu, S. Zheng, X. Wang, S. Wang, C. Sun, J. Qin, X. Shi, X. Bao, Nano Energy 40 (2017) 1-8. [39] H. Shi Y. Dong S. Zheng C. Dong Z.-S. Wu Nanoscale Adv. 2 2020 4212 4219 H. Shi, Y. Dong, S. Zheng, C. Dong, Z.-S. Wu, Nanoscale Adv. 2 (2020) 4212-4219. [40] M. Xu T. Wu J. Qi D. Zhou Z. Xiao J. Mater. Chem. A 9 2021 21429 21439 M. Xu, T. Wu, J. Qi, D. Zhou, Z. Xiao, J. Mater. Chem. A 9 (2021) 21429-21439. [41] M. Xu D. Zhou T. Wu J. Qi Q. Du Z. Xiao Adv. Funct. Mater. 32 2022 2203263 M. Xu, D. Zhou, T. Wu, J. Qi, Q. Du, Z. Xiao, Adv. Funct. Mater. 32 (2022) 2203263. [42] S. Yazdanparast S. Soltanmohammad A. Fash-White G.J. Tucker G.L. Brennecka ACS Appl. Mater. Interfaces 12 2020 20129 20137 S. Yazdanparast, S. Soltanmohammad, A. Fash-White, G.J. Tucker, G.L. Brennecka, ACS Appl. Mater. Interfaces 12 (2020) 20129-20137. [43] X. Liu T. Li T.-C. Lee Y. Sun Y. Liu L. Shang Y. Han W. Deng Z. Yuan A. Dang ACS Sens. 9 2024 483 493 X. Liu, T. Li, T.-C. Lee, Y. Sun, Y. Liu, L. Shang, Y. Han, W. Deng, Z. Yuan, A. Dang, ACS Sens. 9 (2024) 483-493. [44] L. Zhang T. Qian X. Zhu Z. Hu M. Wang L. Zhang T. Jiang J.-H. Tian C. Yan Chem. Soc. Rev. 48 2019 5432 5453 L. Zhang, T. Qian, X. Zhu, Z. Hu, M. Wang, L. Zhang, T. Jiang, J.-H. Tian, C. Yan, Chem. Soc. Rev. 48 (2019) 5432-5453. [45] Q. Gu M. Lu J. Chen Y. Qi B. Zhang Particuology 57 2021 139 145 Q. Gu, M. Lu, J. Chen, Y. Qi, B. Zhang, Particuology 57 (2021) 139-145. [46] H. Cheng Z. Shen W. Liu M. Luo F. Huo J. Hui Q. Zhu H. Zhang ACS Nano 17 2023 14695 14705 H. Cheng, Z. Shen, W. Liu, M. Luo, F. Huo, J. Hui, Q. Zhu, H. Zhang, ACS Nano 17 (2023) 14695-14705. [47] K. Feng Y. Li C. Xu M. Zhang X. Yang Y. Cheng Y. Wang L. Yang S. Yin Electrochim. Acta 444 2023 142022 K. Feng, Y. Li, C. Xu, M. Zhang, X. Yang, Y. Cheng, Y. Wang, L. Yang, S. Yin, Electrochim. Acta 444 (2023) 142022. [48] J. Li K. Han J. Huang G. Li S. Peng N. Li J. Wang W. Zhang Y. Du Y. Fan W. Wang F. Dang Energy Storage Mater. 35 2021 669 678 J. Li, K. Han, J. Huang, G. Li, S. Peng, N. Li, J. Wang, W. Zhang, Y. Du, Y. Fan, W. Wang, F. Dang, Energy Storage Mater. 35 (2021) 669-678. [49] Y. Guo J. Li G. Yuan J. Guo Y. Zheng Y. Huang Q. Zhang J. Li J. Shen C. Shu J. Xu Y. Tang W. Lei H. Shao ACS Nano 17 2023 18253 18265 Y. Guo, J. Li, G. Yuan, J. Guo, Y. Zheng, Y. Huang, Q. Zhang, J. Li, J. Shen, C. Shu, J. Xu, Y. Tang, W. Lei, H. Shao, ACS Nano 17 (2023) 18253-18265. [50] R. Sun J. Hu X. Shi J. Wang X. Zheng Y. Zhang B. Han K. Xia Q. Gao C. Zhou L. Mai Adv. Funct. Mater. 31 2021 2104858 R. Sun, J. Hu, X. Shi, J. Wang, X. Zheng, Y. Zhang, B. Han, K. Xia, Q. Gao, C. Zhou, L. Mai, Adv. Funct. Mater. 31 (2021) 2104858. [51] H. Li L. Fei R. Zhang S. Yu Y. Zhang L. Shu Y. Li Y. Wang J. Energy Chem. 49 2020 339 347 H. Li, L. Fei, R. Zhang, S. Yu, Y. Zhang, L. Shu, Y. Li, Y. Wang, J. Energy Chem. 49 (2020) 339-347. [52] G.S. Gund J.H. Park R. Harpalsinh M. Kota J.H. Shin T.-I. Kim Y. Gogotsi H.S. Park Joule 3 2019 164 176 G.S. Gund, J.H. Park, R. Harpalsinh, M. Kota, J.H. Shin, T.-i. Kim, Y. Gogotsi, H.S. Park, Joule 3 (2019) 164-176. [53] Z. Shen X. Jin J. Tian M. Li Y. Yuan S. Zhang S. Fang X. Fan W. Xu H. Lu J. Lu H. Zhang Nat. Catal. 5 2022 555 563 Z. Shen, X. Jin, J. Tian, M. Li, Y. Yuan, S. Zhang, S. Fang, X. Fan, W. Xu, H. Lu, J. Lu, H. Zhang, Nat. Catal. 5 (2022) 555-563. [54] Z.-X. Chen Y.-T. Zhang C.-X. Bi M. Zhao R. Zhang B.-Q. Li J.-Q. Huang J. Energy Chem. 82 2023 507 512 Z.-X. Chen, Y.-T. Zhang, C.-X. Bi, M. Zhao, R. Zhang, B.-Q. Li, J.-Q. Huang, J. Energy Chem. 82 (2023) 507-512. [55] Y. Jiang S. Liu X. Gao G. Li Adv. Funct. Mater. 33 2023 2304965 Y. Jiang, S. Liu, X. Gao, G. Li, Adv. Funct. Mater. 33 (2023) 2304965. [56] P. Zeng C. Yuan J. An X. Yang C. Cheng T. Yan G. Liu T.-S. Chan J. Kang L. Zhang X. Sun Energy Storage Mater. 44 2022 425 432 P. Zeng, C. Yuan, J. An, X. Yang, C. Cheng, T. Yan, G. Liu, T.-S. Chan, J. Kang, L. Zhang, X. Sun, Energy Storage Mater. 44 (2022) 425-432. [57] W. Jing Q. Tan Y. Duan K. Zou X. Dai Y. Song M. Shi J. Sun Y. Chen Y. Liu Small 19 2023 2204880 W. Jing, Q. Tan, Y. Duan, K. Zou, X. Dai, Y. Song, M. Shi, J. Sun, Y. Chen, Y. Liu, Small 19 (2023) 2204880. [58] G.-X. Liu J. Wan Y. Shi H.-J. Guo Y.-X. Song K.-C. Jiang Y.-G. Guo R. Wen L.-J. Wan Adv. Energy Mater. 12 2022 2201411 G.-X. Liu, J. Wan, Y. Shi, H.-J. Guo, Y.-X. Song, K.-C. Jiang, Y.-G. Guo, R. Wen, L.-J. Wan, Adv. Energy Mater. 12 (2022) 2201411. [59] Y. Qi N. Chai Q. Gu J. Chen Z. Zhai M. Lu Y. Niu N. Huang X. Zhang B. Zhang J. Energy Chem. 87 2023 123 135 Y. Qi, N. Chai, Q. Gu, J. Chen, Z. Zhai, M. Lu, Y. Niu, N. Huang, X. Zhang, B. Zhang, J. Energy Chem. 87 (2023) 123-135. [60] J. Xu S. An X. Song Y. Cao N. Wang X. Qiu Y. Zhang J. Chen X. Duan J. Huang W. Li Y. Wang Adv. Mater. 33 2021 2105178 J. Xu, S. An, X. Song, Y. Cao, N. Wang, X. Qiu, Y. Zhang, J. Chen, X. Duan, J. Huang, W. Li, Y. Wang, Adv. Mater. 33 (2021) 2105178. [61] C.-F. Chen A. Mistry P.P. Mukherjee J. Phys. Chem. C 121 2017 21206 21216 C.-F. Chen, A. Mistry, P.P. Mukherjee, J. Phys. Chem. C 121 (2017) 21206-21216. [62] F. Chu M. Wang J. Liu Z. Guan H. Yu B. Liu F. Wu Adv. Funct. Mater. 32 2022 2205393 F. Chu, M. Wang, J. Liu, Z. Guan, H. Yu, B. Liu, F. Wu, Adv. Funct. Mater. 32 (2022) 2205393. [63] Q. Gu Y. Qi W. Hua T. Shang J. Chen L. Jiang L. Li M. Lu Y. Zhang X. Liu Y. Wan B. Zhang J. Energy Chem. 69 2022 490 496 Q. Gu, Y. Qi, W. Hua, T. Shang, J. Chen, L. Jiang, L. Li, M. Lu, Y. Zhang, X. Liu, Y. Wan, B. Zhang, J. Energy Chem. 69 (2022) 490-496. [64] S.D. Talian J. Moskon R. Dominko M. Gaberscek Adv. Mater. Interfaces 9 2022 2101116 S.D. Talian, J. Moskon, R. Dominko, M. Gaberscek, Adv. Mater. Interfaces 9 (2022) 2101116. [65] S. Walus C. Barchasz R. Bouchet F. Alloin Electrochim. Acta 359 2020 136944 S. Walus, C. Barchasz, R. Bouchet, F. Alloin, Electrochim. Acta 359 (2020) 136944.",
      "scopus-id": "85217980773",
      "coredata": {
        "eid": "1-s2.0-S2095495625000610",
        "dc:description": "Lithium-sulfur (Li-S) chemistry reaction opens a new battery era with high energy density; meanwhile, multiple electrons migration leads to the complex phase transition of sulfur species. To manipulate the binding strength of multiple key intermediates more efficiently, the bimetallic TiVC MXene is utilized to realize multi-dimensional catalysis. Based on the macroscopic three-dimensional (3D) structure using two-dimensional (2D) MXene architecture, electron conductivity and sulfur utilization are improved. Microscopically, Ti-V catalytic systems regulate multiple reaction intermediates through intermetallic synergies customized surface properties and atomic scale coordination, thereby improving electronic and ionic conductivity. In-situ Raman spectroscopy and electrochemical analysis show that the conversion rate of polysulfides was accelerated during the charge-discharge process. The Ti-V interaction exhibits unique catalytic activity and regulates multiple continuous processes of sulfur species phase transformation, which are essential for the excellent energy performance of Li-S batteries. This study not only clarifies the catalytic mechanism of Ti-V at different dimensions but also proposes a promising strategy for the design of advanced catalytic systems in energy storage technology.",
        "openArchiveArticle": "false",
        "prism:coverDate": "2025-05-31",
        "openaccessUserLicense": null,
        "prism:aggregationType": "Journal",
        "prism:url": "https://api.elsevier.com/content/article/pii/S2095495625000610",
        "dc:creator": [
          {
            "@_fa": "true",
            "$": "Cao, Yiqi"
          },
          {
            "@_fa": "true",
            "$": "Gu, Qinhua"
          },
          {
            "@_fa": "true",
            "$": "Qi, Yujie"
          },
          {
            "@_fa": "true",
            "$": "Tao, Xiao"
          },
          {
            "@_fa": "true",
            "$": "Han, Wenjuan"
          },
          {
            "@_fa": "true",
            "$": "Liu, Bo"
          },
          {
            "@_fa": "true",
            "$": "Liu, Chunbo"
          },
          {
            "@_fa": "true",
            "$": "Zhang, Chuyan"
          },
          {
            "@_fa": "true",
            "$": "Huang, Nan"
          },
          {
            "@_fa": "true",
            "$": "Che, Guangbo"
          },
          {
            "@_fa": "true",
            "$": "Lu, Ming"
          },
          {
            "@_fa": "true",
            "$": "Zhang, Bingsen"
          }
        ],
        "link": [
          {
            "@_fa": "true",
            "@rel": "self",
            "@href": "https://api.elsevier.com/content/article/pii/S2095495625000610"
          },
          {
            "@_fa": "true",
            "@rel": "scidir",
            "@href": "https://www.sciencedirect.com/science/article/pii/S2095495625000610"
          }
        ],
        "dc:format": "application/json",
        "openaccessType": null,
        "pii": "S2095-4956(25)00061-0",
        "prism:volume": "104",
        "prism:publisher": "Science Press and Dalian Institute of Chemical Physics, Chinese Academy of Sciences. Published by Elsevier B.V. and Science Press. All rights are reserved, including those for text and data mining, AI training, and similar technologies.",
        "dc:title": "Multi-dimensional catalysis: From macroscopic 3D structures to microscopic Ti-V synergistic interaction in lithium-sulfur batteries",
        "prism:copyright": "© 2025 Science Press and Dalian Institute of Chemical Physics, Chinese Academy of Sciences. Published by Elsevier B.V. and Science Press. All rights are reserved, including those for text and data mining, AI training, and similar technologies.",
        "openaccess": "0",
        "prism:issn": "20954956",
        "dcterms:subject": [
          {
            "@_fa": "true",
            "$": "Bimetallic MXene"
          },
          {
            "@_fa": "true",
            "$": "Three-dimensional structure"
          },
          {
            "@_fa": "true",
            "$": "Catalysis"
          },
          {
            "@_fa": "true",
            "$": "Lithium-sulfur batteries"
          },
          {
            "@_fa": "true",
            "$": "In-situ characterizations"
          }
        ],
        "openaccessArticle": "false",
        "prism:publicationName": "Journal of Energy Chemistry",
        "openaccessSponsorType": null,
        "prism:pageRange": "585-593",
        "prism:endingPage": "593",
        "pubType": "fla",
        "prism:coverDisplayDate": "May 2025",
        "prism:doi": "10.1016/j.jechem.2025.01.020",
        "prism:startingPage": "585",
        "dc:identifier": "doi:10.1016/j.jechem.2025.01.020",
        "openaccessSponsorName": null
      },
      "objects": {
        "object": [
          {
            "@category": "standard",
            "@height": "200",
            "@width": "339",
            "@_fa": "true",
            "$": "https://api.elsevier.com/content/object/eid/1-s2.0-S2095495625000610-ga1.jpg?httpAccept=%2A%2F%2A",
            "@multimediatype": "JPEG image file",
            "@type": "IMAGE-DOWNSAMPLED",
            "@size": "29492",
            "@ref": "ga1",
            "@mimetype": "image/jpeg"
          },
          {
            "@category": "standard",
            "@height": "694",
            "@width": "778",
            "@_fa": "true",
            "$": "https://api.elsevier.com/content/object/eid/1-s2.0-S2095495625000610-gr1.jpg?httpAccept=%2A%2F%2A",
            "@multimediatype": "JPEG image file",
            "@type": "IMAGE-DOWNSAMPLED",
            "@size": "164116",
            "@ref": "gr1",
            "@mimetype": "image/jpeg"
          },
          {
            "@category": "standard",
            "@height": "587",
            "@width": "778",
            "@_fa": "true",
            "$": "https://api.elsevier.com/content/object/eid/1-s2.0-S2095495625000610-gr2.jpg?httpAccept=%2A%2F%2A",
            "@multimediatype": "JPEG image file",
            "@type": "IMAGE-DOWNSAMPLED",
            "@size": "124170",
            "@ref": "gr2",
            "@mimetype": "image/jpeg"
          },
          {
            "@category": "standard",
            "@height": "433",
            "@width": "778",
            "@_fa": "true",
            "$": "https://api.elsevier.com/content/object/eid/1-s2.0-S2095495625000610-gr3.jpg?httpAccept=%2A%2F%2A",
            "@multimediatype": "JPEG image file",
            "@type": "IMAGE-DOWNSAMPLED",
            "@size": "96455",
            "@ref": "gr3",
            "@mimetype": "image/jpeg"
          },
          {
            "@category": "standard",
            "@height": "448",
            "@width": "778",
            "@_fa": "true",
            "$": "https://api.elsevier.com/content/object/eid/1-s2.0-S2095495625000610-gr4.jpg?httpAccept=%2A%2F%2A",
            "@multimediatype": "JPEG image file",
            "@type": "IMAGE-DOWNSAMPLED",
            "@size": "89828",
            "@ref": "gr4",
            "@mimetype": "image/jpeg"
          },
          {
            "@category": "standard",
            "@height": "587",
            "@width": "778",
            "@_fa": "true",
            "$": "https://api.elsevier.com/content/object/eid/1-s2.0-S2095495625000610-gr5.jpg?httpAccept=%2A%2F%2A",
            "@multimediatype": "JPEG image file",
            "@type": "IMAGE-DOWNSAMPLED",
            "@size": "166046",
            "@ref": "gr5",
            "@mimetype": "image/jpeg"
          },
          {
            "@category": "standard",
            "@height": "329",
            "@width": "383",
            "@_fa": "true",
            "$": "https://api.elsevier.com/content/object/eid/1-s2.0-S2095495625000610-gr6.jpg?httpAccept=%2A%2F%2A",
            "@multimediatype": "JPEG image file",
            "@type": "IMAGE-DOWNSAMPLED",
            "@size": "43899",
            "@ref": "gr6",
            "@mimetype": "image/jpeg"
          },
          {
            "@category": "thumbnail",
            "@height": "129",
            "@width": "219",
            "@_fa": "true",
            "$": "https://api.elsevier.com/content/object/eid/1-s2.0-S2095495625000610-ga1.sml?httpAccept=%2A%2F%2A",
            "@multimediatype": "GIF image file",
            "@type": "IMAGE-THUMBNAIL",
            "@size": "21599",
            "@ref": "ga1",
            "@mimetype": "image/gif"
          },
          {
            "@category": "thumbnail",
            "@height": "164",
            "@width": "184",
            "@_fa": "true",
            "$": "https://api.elsevier.com/content/object/eid/1-s2.0-S2095495625000610-gr1.sml?httpAccept=%2A%2F%2A",
            "@multimediatype": "GIF image file",
            "@type": "IMAGE-THUMBNAIL",
            "@size": "16752",
            "@ref": "gr1",
            "@mimetype": "image/gif"
          },
          {
            "@category": "thumbnail",
            "@height": "164",
            "@width": "217",
            "@_fa": "true",
            "$": "https://api.elsevier.com/content/object/eid/1-s2.0-S2095495625000610-gr2.sml?httpAccept=%2A%2F%2A",
            "@multimediatype": "GIF image file",
            "@type": "IMAGE-THUMBNAIL",
            "@size": "15415",
            "@ref": "gr2",
            "@mimetype": "image/gif"
          },
          {
            "@category": "thumbnail",
            "@height": "122",
            "@width": "219",
            "@_fa": "true",
            "$": "https://api.elsevier.com/content/object/eid/1-s2.0-S2095495625000610-gr3.sml?httpAccept=%2A%2F%2A",
            "@multimediatype": "GIF image file",
            "@type": "IMAGE-THUMBNAIL",
            "@size": "11435",
            "@ref": "gr3",
            "@mimetype": "image/gif"
          },
          {
            "@category": "thumbnail",
            "@height": "126",
            "@width": "219",
            "@_fa": "true",
            "$": "https://api.elsevier.com/content/object/eid/1-s2.0-S2095495625000610-gr4.sml?httpAccept=%2A%2F%2A",
            "@multimediatype": "GIF image file",
            "@type": "IMAGE-THUMBNAIL",
            "@size": "8569",
            "@ref": "gr4",
            "@mimetype": "image/gif"
          },
          {
            "@category": "thumbnail",
            "@height": "164",
            "@width": "217",
            "@_fa": "true",
            "$": "https://api.elsevier.com/content/object/eid/1-s2.0-S2095495625000610-gr5.sml?httpAccept=%2A%2F%2A",
            "@multimediatype": "GIF image file",
            "@type": "IMAGE-THUMBNAIL",
            "@size": "17154",
            "@ref": "gr5",
            "@mimetype": "image/gif"
          },
          {
            "@category": "thumbnail",
            "@height": "164",
            "@width": "191",
            "@_fa": "true",
            "$": "https://api.elsevier.com/content/object/eid/1-s2.0-S2095495625000610-gr6.sml?httpAccept=%2A%2F%2A",
            "@multimediatype": "GIF image file",
            "@type": "IMAGE-THUMBNAIL",
            "@size": "12587",
            "@ref": "gr6",
            "@mimetype": "image/gif"
          },
          {
            "@category": "high",
            "@height": "886",
            "@width": "1500",
            "@_fa": "true",
            "$": "https://api.elsevier.com/content/object/eid/1-s2.0-S2095495625000610-ga1_lrg.jpg?httpAccept=%2A%2F%2A",
            "@multimediatype": "JPEG image file",
            "@type": "IMAGE-HIGH-RES",
            "@size": "178055",
            "@ref": "ga1",
            "@mimetype": "image/jpeg"
          },
          {
            "@category": "high",
            "@height": "3072",
            "@width": "3445",
            "@_fa": "true",
            "$": "https://api.elsevier.com/content/object/eid/1-s2.0-S2095495625000610-gr1_lrg.jpg?httpAccept=%2A%2F%2A",
            "@multimediatype": "JPEG image file",
            "@type": "IMAGE-HIGH-RES",
            "@size": "1025906",
            "@ref": "gr1",
            "@mimetype": "image/jpeg"
          },
          {
            "@category": "high",
            "@height": "2601",
            "@width": "3445",
            "@_fa": "true",
            "$": "https://api.elsevier.com/content/object/eid/1-s2.0-S2095495625000610-gr2_lrg.jpg?httpAccept=%2A%2F%2A",
            "@multimediatype": "JPEG image file",
            "@type": "IMAGE-HIGH-RES",
            "@size": "623567",
            "@ref": "gr2",
            "@mimetype": "image/jpeg"
          },
          {
            "@category": "high",
            "@height": "1917",
            "@width": "3445",
            "@_fa": "true",
            "$": "https://api.elsevier.com/content/object/eid/1-s2.0-S2095495625000610-gr3_lrg.jpg?httpAccept=%2A%2F%2A",
            "@multimediatype": "JPEG image file",
            "@type": "IMAGE-HIGH-RES",
            "@size": "484134",
            "@ref": "gr3",
            "@mimetype": "image/jpeg"
          },
          {
            "@category": "high",
            "@height": "1984",
            "@width": "3445",
            "@_fa": "true",
            "$": "https://api.elsevier.com/content/object/eid/1-s2.0-S2095495625000610-gr4_lrg.jpg?httpAccept=%2A%2F%2A",
            "@multimediatype": "JPEG image file",
            "@type": "IMAGE-HIGH-RES",
            "@size": "468501",
            "@ref": "gr4",
            "@mimetype": "image/jpeg"
          },
          {
            "@category": "high",
            "@height": "2598",
            "@width": "3445",
            "@_fa": "true",
            "$": "https://api.elsevier.com/content/object/eid/1-s2.0-S2095495625000610-gr5_lrg.jpg?httpAccept=%2A%2F%2A",
            "@multimediatype": "JPEG image file",
            "@type": "IMAGE-HIGH-RES",
            "@size": "971593",
            "@ref": "gr5",
            "@mimetype": "image/jpeg"
          },
          {
            "@category": "high",
            "@height": "1459",
            "@width": "1699",
            "@_fa": "true",
            "$": "https://api.elsevier.com/content/object/eid/1-s2.0-S2095495625000610-gr6_lrg.jpg?httpAccept=%2A%2F%2A",
            "@multimediatype": "JPEG image file",
            "@type": "IMAGE-HIGH-RES",
            "@size": "314252",
            "@ref": "gr6",
            "@mimetype": "image/jpeg"
          },
          {
            "@category": "standard",
            "@_fa": "true",
            "$": "https://api.elsevier.com/content/object/eid/1-s2.0-S2095495625000610-mmc1.docx?httpAccept=%2A%2F%2A",
            "@multimediatype": "Microsoft Word file",
            "@type": "APPLICATION",
            "@size": "5804978",
            "@ref": "mmc1",
            "@mimetype": "application/word"
          }
        ]
      },
      "link": {
        "@rel": "abstract",
        "@href": "https://api.elsevier.com/content/abstract/scopus_id/85217980773"
      }
    }
  }
}