{
  "metadata": {
    "title": "Construction of photothermal hybrid with surface-polarized carbon nanotube twined oxygen-vacancy engineered cuprous oxide for improved PMS activation and water purification",
    "authors": "; ; ",
    "journal": "Molecular Catalysis",
    "date": "2025-05-01",
    "doi": "10.1016/j.mcat.2025.114994",
    "abstract": "",
    "uri": "https://api.elsevier.com/content/article/pii/S2468823125001804",
    "pii": "S2468823125001804"
  },
  "fulltext": {
    "full-text-retrieval-response": {
      "scopus-eid": "2-s2.0-85219496906",
      "originalText": "serial JL 315758 291210 291744 291790 291809 31 Molecular Catalysis MOLECULARCATALYSIS 2025-03-06 2025-03-06 2025-03-06 2025-03-06 2025-04-19T07:55:48 1-s2.0-S2468823125001804 S2468-8231(25)00180-4 S2468823125001804 10.1016/j.mcat.2025.114994 S300 S300.1 FULL-TEXT 1-s2.0-S2468823125X00055 2025-04-19T07:05:30.147882Z 0 0 20250501 2025 2025-03-06T23:11:41.896751Z absattachment articleinfo articlenumber articletitlenorm authfirstinitialnorm authfirstsurnamenorm cid cids contenttype copyright crossmark dateloaded dateloadedtxt datesearch datesort dateupdated dco docsubtype doctype doi eid ewtransactionid hubeid indexeddate issn issnnorm itemstage itemtransactionid itemweight openaccess openarchive pg pgfirst pii piinorm pubdatestart pubdatetxt pubyr sectiontitle sortorder srctitle srctitlenorm srctype ssids alllist content subj subheadings suppl tomb volfirst volissue volumelist webpdf webpdfpagecount yearnav figure e-component body acknowledge affil appendices articletitle auth authfirstini authfull authkeywords authlast footnotes grantnumber grantsponsor highlightsabst orcid primabst ref specialabst 2468-8231 24688231 true 578 578 C Volume 578 4 114994 114994 114994 20250501 1 May 2025 2025-05-01 2025 Regular Papers article fla © 2025 Elsevier B.V. All rights are reserved, including those for text and data mining, AI training, and similar technologies. CONSTRUCTIONPHOTOTHERMALHYBRIDSURFACEPOLARIZEDCARBONNANOTUBETWINEDOXYGENVACANCYENGINEEREDCUPROUSOXIDEFORIMPROVEDPMSACTIVATIONWATERPURIFICATION GAO Y 1 Introduction 2 Experimental section 2.1 Chemicals and reagents 2.2 Synthesis of catalyst 2.3 Characterizations 2.4 Catalytic performance assessment 2.5 Integrated photothermal degradation and cleanwater regeneration 3 Results and discussion 4 Conclusions CRediT authorship contribution statement Acknowledgments Appendix Supplementary materials References LI 2022 138147 M WEI 2024 18986 18992 Y DENG 2023 144653 Y HAN 2023 136608 E SONG 2024 155601 W ZHAO 2024 154682 Z MO 2024 109 123 Q YAN 2024 e202301778 Y LU 2019 140 149 H WANG 2018 1502 1517 J CAO 2023 144663 H CAI 2024 13495 13505 Y ZHU 2022 107758 W QI 2023 3971 3982 M ZHANG 2024 19029 19038 L HUANG 2021 206 214 Y SUN 2022 112133 Y DING 2023 134761 X FANG 2024 126849 C LI 2024 114474 Y LIU 2023 129905 S ZENG 2022 6028 6037 K TU 2024 3146 3160 W ZENG 2016 7874 7881 K MA 2019 8035 8044 S ZHAO 2024 178 189 Y ZHENG 2021 116961 W GASIM 2023 586 600 M SHAO 2024 113991 X LUO 2021 118196 H LONG 2019 542 552 Y SU 2023 2307619 P LIU 2024 121926 M LI 2023 117160 Y YANG 2024 117701 Z LIU 2017 1606034 Y LIU 2020 125498 B WANG 2023 122807 S QI 2025 129 138 M QI 2021 13051 13085 M QI 2020 14327 14335 M TIE 2024 126752 L WANG 2022 57 70 W LI 2020 126623 W DIAO 2024 112559 S HUANG 2024 e202412707 Z WANG 2021 129762 X ZHANG 2019 10003 10007 N LI 2024 114356 X YAN 2024 2898 2913 X WANG 2022 3390 3399 C TANG 2022 9023 9057 B YUAN 2024 115667 M GU 2022 104762 H LI 2023 110260 Q ZHANG 2024 234234 Q QI 2024 150752 Y VINAYAGAM 2024 117500 V MARIMUTHU 2021 1002 1028 M ZAZOULI 2017 2459 2468 M LIU 2023 109939 M LI 2020 124382 Y WANG 2024 151886 P ZHONG 2023 143298 C DING 2020 123378 Y LIU 2018 731 740 Y XU 2022 136250 S ZHU 2024 1686 1701 H MO 2022 119276 H LIN 2023 136148 S WU 2022 1323 1331 Y WANG 2024 130975 D QI 2022 17444 17453 M QI 2020 3194 3202 M HOU 2022 310 320 X LI 2024 142416 Y YANG 2024 e535 J CHEN 2020 1908537 G MU 2023 916 924 W WU 2022 169 180 Z GAOX2025X114994 GAOX2025X114994XY 2027-03-06T00:00:00.000Z 2027-03-06T00:00:00.000Z http://creativecommons.org/licenses/by-nc-nd/4.0/ © 2025 Elsevier B.V. All rights are reserved, including those for text and data mining, AI training, and similar technologies. 2025-03-08T07:36:15.838Z http://vtw.elsevier.com/data/voc/AddOnTypes/50.7/aggregated-refined China National Natural Science Foundation 21908085 National Natural Science Foundation of China http://data.elsevier.com/vocabulary/SciValFunders/501100001809 http://sws.geonames.org/1814991 China Postdoctoral Science Foundation 2023M731422 China Postdoctoral Science Foundation http://data.elsevier.com/vocabulary/SciValFunders/501100002858 http://sws.geonames.org/1814991/ Natural Science Foundation of Jiangsu province BK20241950 Natural Science Foundation of Jiangsu Province http://data.elsevier.com/vocabulary/SciValFunders/501100004608 http://sws.geonames.org/1814991/ Science, Technology Plan School-Enterprise Cooperation Industry-University-Research Forward-looking Project of Zhangjiagang ZKYY2341 Hubei Key Laboratory of Processing and Application of Catalytic materials 202441204 Suzhou Gusu Health Talent Program-Youth Open project of State Key Laboratory of Materials Chemical Engineering SKL-MCE-23B The research received financial support from China National Natural Science Foundation (21908085), Natural Science Foundation of Jiangsu province (BK20241950), China Postdoctoral Science Foundation (2023M731422), Open project of State Key Laboratory of Materials Chemical Engineering (SKL-MCE-23B), Hubei Key Laboratory of Processing and Application of Catalytic materials (202441204) and the Science, Technology Plan School-Enterprise Cooperation Industry-University-Research Forward-looking Project of Zhangjiagang (ZKYY2341) and Suzhou Gusu Health Talent Program-Youth Top Talent ((2024) 210). https://doi.org/10.15223/policy-017 https://doi.org/10.15223/policy-037 https://doi.org/10.15223/policy-012 https://doi.org/10.15223/policy-029 https://doi.org/10.15223/policy-004 item S2468-8231(25)00180-4 S2468823125001804 1-s2.0-S2468823125001804 10.1016/j.mcat.2025.114994 315758 2025-04-19T07:05:30.147882Z 2025-05-01 1-s2.0-S2468823125001804-main.pdf https://s3-eu-west-1.amazonaws.com/prod-ucs-content-store-eu-west/content/pii:S2468823125001804/MAIN/application/pdf/ce4ccaef5733a50699e487b5cd18b386/main.pdf main.pdf pdf true 10402849 MAIN 12 1-s2.0-S2468823125001804-main_1.png https://s3-eu-west-1.amazonaws.com/prod-ucs-content-store-eu-west/content/pii:S2468823125001804/PREVIEW/image/png/e74cf61019b53fe03285cfe98e4d08be/main_1.png main_1.png png 57343 849 656 IMAGE-WEB-PDF 1 1-s2.0-S2468823125001804-gr3.jpg https://s3-eu-west-1.amazonaws.com/prod-ucs-content-store-eu-west/content/pii:S2468823125001804/gr3/DOWNSAMPLED/image/jpeg/0dce504986108f8e5a14959970afdd48/gr3.jpg gr3 gr3.jpg jpg 46306 235 655 IMAGE-DOWNSAMPLED 1-s2.0-S2468823125001804-gr2.jpg https://s3-eu-west-1.amazonaws.com/prod-ucs-content-store-eu-west/content/pii:S2468823125001804/gr2/DOWNSAMPLED/image/jpeg/c2258d9d48787e2b8101e2f67f55fd64/gr2.jpg gr2 gr2.jpg jpg 94826 436 781 IMAGE-DOWNSAMPLED 1-s2.0-S2468823125001804-ga1.jpg https://s3-eu-west-1.amazonaws.com/prod-ucs-content-store-eu-west/content/pii:S2468823125001804/ga1/DOWNSAMPLED/image/jpeg/20a9b9748cfb155dd1ea5cb0d9160da7/ga1.jpg ga1 true ga1.jpg jpg 43873 200 411 IMAGE-DOWNSAMPLED 1-s2.0-S2468823125001804-gr1.jpg https://s3-eu-west-1.amazonaws.com/prod-ucs-content-store-eu-west/content/pii:S2468823125001804/gr1/DOWNSAMPLED/image/jpeg/e7a8bfdb68ebae74e9dbb0bede676472/gr1.jpg gr1 gr1.jpg jpg 152427 435 640 IMAGE-DOWNSAMPLED 1-s2.0-S2468823125001804-gr7.jpg https://s3-eu-west-1.amazonaws.com/prod-ucs-content-store-eu-west/content/pii:S2468823125001804/gr7/DOWNSAMPLED/image/jpeg/9318ddf800c6a667b2bae404f7840221/gr7.jpg gr7 gr7.jpg jpg 176858 689 715 IMAGE-DOWNSAMPLED 1-s2.0-S2468823125001804-gr6.jpg https://s3-eu-west-1.amazonaws.com/prod-ucs-content-store-eu-west/content/pii:S2468823125001804/gr6/DOWNSAMPLED/image/jpeg/0579349d0eecd7b2f1f58e2bbb49e9b4/gr6.jpg gr6 gr6.jpg jpg 126009 639 645 IMAGE-DOWNSAMPLED 1-s2.0-S2468823125001804-gr5.jpg https://s3-eu-west-1.amazonaws.com/prod-ucs-content-store-eu-west/content/pii:S2468823125001804/gr5/DOWNSAMPLED/image/jpeg/c3a13a707b5a306ceeb02f3155d6c557/gr5.jpg gr5 gr5.jpg jpg 75851 374 644 IMAGE-DOWNSAMPLED 1-s2.0-S2468823125001804-gr4.jpg https://s3-eu-west-1.amazonaws.com/prod-ucs-content-store-eu-west/content/pii:S2468823125001804/gr4/DOWNSAMPLED/image/jpeg/1257e7b23b1b1650d79b4fe2bc5af8fa/gr4.jpg gr4 gr4.jpg jpg 81598 349 489 IMAGE-DOWNSAMPLED 1-s2.0-S2468823125001804-gr8.jpg https://s3-eu-west-1.amazonaws.com/prod-ucs-content-store-eu-west/content/pii:S2468823125001804/gr8/DOWNSAMPLED/image/jpeg/5c2038135c477e578a247ff7173ed22e/gr8.jpg gr8 gr8.jpg jpg 187245 732 781 IMAGE-DOWNSAMPLED 1-s2.0-S2468823125001804-gr3.sml https://s3-eu-west-1.amazonaws.com/prod-ucs-content-store-eu-west/content/pii:S2468823125001804/gr3/THUMBNAIL/image/gif/7baa902b39600e36945e8d338813ca60/gr3.sml gr3 gr3.sml sml 8171 79 219 IMAGE-THUMBNAIL 1-s2.0-S2468823125001804-gr2.sml https://s3-eu-west-1.amazonaws.com/prod-ucs-content-store-eu-west/content/pii:S2468823125001804/gr2/THUMBNAIL/image/gif/6c1f08467c6ec9c6972df36432fd506b/gr2.sml gr2 gr2.sml sml 12459 122 219 IMAGE-THUMBNAIL 1-s2.0-S2468823125001804-ga1.sml https://s3-eu-west-1.amazonaws.com/prod-ucs-content-store-eu-west/content/pii:S2468823125001804/ga1/THUMBNAIL/image/gif/b03d44d0e214c7fdc93b985b5697dde4/ga1.sml ga1 true ga1.sml sml 20689 106 219 IMAGE-THUMBNAIL 1-s2.0-S2468823125001804-gr1.sml https://s3-eu-west-1.amazonaws.com/prod-ucs-content-store-eu-west/content/pii:S2468823125001804/gr1/THUMBNAIL/image/gif/864b4cef4dc3879228219c8d16f09a20/gr1.sml gr1 gr1.sml sml 27465 149 219 IMAGE-THUMBNAIL 1-s2.0-S2468823125001804-gr7.sml https://s3-eu-west-1.amazonaws.com/prod-ucs-content-store-eu-west/content/pii:S2468823125001804/gr7/THUMBNAIL/image/gif/f92237fcbfa3415fbaf0aafa14e70302/gr7.sml gr7 gr7.sml sml 15067 164 170 IMAGE-THUMBNAIL 1-s2.0-S2468823125001804-gr6.sml https://s3-eu-west-1.amazonaws.com/prod-ucs-content-store-eu-west/content/pii:S2468823125001804/gr6/THUMBNAIL/image/gif/98d6d19620067670a768fcfc011313f5/gr6.sml gr6 gr6.sml sml 11813 164 165 IMAGE-THUMBNAIL 1-s2.0-S2468823125001804-gr5.sml https://s3-eu-west-1.amazonaws.com/prod-ucs-content-store-eu-west/content/pii:S2468823125001804/gr5/THUMBNAIL/image/gif/d3cc41fc94b70bb45d0016a39c3a2eed/gr5.sml gr5 gr5.sml sml 12790 127 219 IMAGE-THUMBNAIL 1-s2.0-S2468823125001804-gr4.sml https://s3-eu-west-1.amazonaws.com/prod-ucs-content-store-eu-west/content/pii:S2468823125001804/gr4/THUMBNAIL/image/gif/349910db88048d15fe64249994c3f8fd/gr4.sml gr4 gr4.sml sml 24158 156 219 IMAGE-THUMBNAIL 1-s2.0-S2468823125001804-gr8.sml https://s3-eu-west-1.amazonaws.com/prod-ucs-content-store-eu-west/content/pii:S2468823125001944/gr8/THUMBNAIL/image/gif/c2a7d6cb356ef071a68796c5c675fa95/gr8.sml gr8 gr8.sml sml 23294 164 175 IMAGE-THUMBNAIL 1-s2.0-S2468823125001804-gr3_lrg.jpg https://s3-eu-west-1.amazonaws.com/prod-ucs-content-store-eu-west/content/pii:S2468823125001804/HIGHRES/image/jpeg/6b2c62b71916f919288d58dcd9164d8d/gr3_lrg.jpg gr3 gr3_lrg.jpg jpg 336857 1041 2900 IMAGE-HIGH-RES 1-s2.0-S2468823125001804-gr2_lrg.jpg https://s3-eu-west-1.amazonaws.com/prod-ucs-content-store-eu-west/content/pii:S2468823125001804/HIGHRES/image/jpeg/29567ac1dfa3f60bff349d8e45a58902/gr2_lrg.jpg gr2 gr2_lrg.jpg jpg 696298 1929 3458 IMAGE-HIGH-RES 1-s2.0-S2468823125001804-ga1_lrg.jpg https://s3-eu-west-1.amazonaws.com/prod-ucs-content-store-eu-west/content/pii:S2468823125001804/HIGHRES/image/jpeg/21778560ade7762d9e9cf11ed3ec26f2/ga1_lrg.jpg ga1 true ga1_lrg.jpg jpg 359638 886 1822 IMAGE-HIGH-RES 1-s2.0-S2468823125001804-gr1_lrg.jpg https://s3-eu-west-1.amazonaws.com/prod-ucs-content-store-eu-west/content/pii:S2468823125001804/HIGHRES/image/jpeg/a5d65b026738902f3f011bde5ac71b96/gr1_lrg.jpg gr1 gr1_lrg.jpg jpg 1561992 1926 2833 IMAGE-HIGH-RES 1-s2.0-S2468823125001804-gr7_lrg.jpg https://s3-eu-west-1.amazonaws.com/prod-ucs-content-store-eu-west/content/pii:S2468823125001804/HIGHRES/image/jpeg/425a6765ca9c2d076da3187a51619a05/gr7_lrg.jpg gr7 gr7_lrg.jpg jpg 1300761 3052 3167 IMAGE-HIGH-RES 1-s2.0-S2468823125001804-gr6_lrg.jpg https://s3-eu-west-1.amazonaws.com/prod-ucs-content-store-eu-west/content/pii:S2468823125001804/HIGHRES/image/jpeg/50cb1b1c82ead4e60bd11ef3f477701c/gr6_lrg.jpg gr6 gr6_lrg.jpg jpg 930080 2833 2858 IMAGE-HIGH-RES 1-s2.0-S2468823125001804-gr5_lrg.jpg https://s3-eu-west-1.amazonaws.com/prod-ucs-content-store-eu-west/content/pii:S2468823125001804/HIGHRES/image/jpeg/1edb1d289f5487bc96d3a46582aa8d7d/gr5_lrg.jpg gr5 gr5_lrg.jpg jpg 621877 1657 2850 IMAGE-HIGH-RES 1-s2.0-S2468823125001804-gr4_lrg.jpg https://s3-eu-west-1.amazonaws.com/prod-ucs-content-store-eu-west/content/pii:S2468823125001804/HIGHRES/image/jpeg/dda629e404b06951b878ea5baacbd82e/gr4_lrg.jpg gr4 gr4_lrg.jpg jpg 681579 1546 2167 IMAGE-HIGH-RES 1-s2.0-S2468823125001804-gr8_lrg.jpg https://s3-eu-west-1.amazonaws.com/prod-ucs-content-store-eu-west/content/pii:S2468823125001944/HIGHRES/image/jpeg/c4826b8442955dfa7f9fcd7aa6f220b3/gr8_lrg.jpg gr8 gr8_lrg.jpg jpg 1421345 3241 3458 IMAGE-HIGH-RES 1-s2.0-S2468823125001804-mmc1.docx https://s3-eu-west-1.amazonaws.com/prod-ucs-content-store-eu-west/content/pii:S2468823125001804/mmc1/FP/application/vnd.openxmlformats-officedocument.wordprocessingml.document/9200c6e9b88711f934854f2125288334/mmc1.docx mmc1 mmc1.docx docx 3392690 APPLICATION MCAT 114994 114994 S2468-8231(25)00180-4 10.1016/j.mcat.2025.114994 Elsevier B.V. Fig. 1 (a) Schematic of the synthesis of targeted materials, (b, c) representative TEM images of Cu-N/CNT30, (d) HRTEM images of Cu-N/CNT30, (e) inverse fast Fourier transform (FFT) pattern of Cu2O (110) plane, (f) Annular dark-field STEM image and corresponding elemental mapping images of Cu-N/CNT30. Fig 1 Fig. 2 Wide-angle XRD patterns of Cu-N/CNT30 (a), XPS survey spectrum (b), and high-resolution spectra of C 1s (c), N 1s (d), Cu 2p (e), and O 1s (f) core levels derived from Cu-N/CNT30. Fig 2 Fig. 3 (a) Electrochemical impedance spectroscopy (EIS), (b) Linear Sweep Voltammetry (LSV) curves, and (c) Open-circuit voltage (OCV) test of the key comparative catalysts. Fig 3 Fig. 4 IR photothermal images of wet catalyst membrane into DI water (a), TC (b), BPA (c), NFX (d) solution; (e) Time-dependent temperature change curves of wet catalyst membrane into DI water, TC, BPA, and NFX solution. Fig 4 Fig. 5 Time-dependent catalytic degradation process curves of NFX by different catalysts under the reaction conditions of [BPA]=20 mg·L-1, [PMS]=0.2 g·L-1, and [catalyst]=0.2 g·L-1 (a), and the correspondence between ln(C0/C) and reaction time (b), and the excitation-emission-matrix spectra of NFX solutions in the presence of Cu-N/CNT with time (e, f). Fig 5 Fig. 6 Catalytic degradation curves of BPA with reaction time over Cu-N/CNT30 at the different PMS dosages (a) and the corresponding kinetic curves: ln(C0/C) v.s. Reaction time(b) under the reaction conditions of [BPA] = 20 mg·L-1, and [catalyst] = 0.2 g·L-1; catalytic degradation curves of BPA with reaction time over Cu-N/CNT30 using the different catalyst dosages (c) and the corresponding kinetic curves: ln(C0/C) v.s. Reaction time(d) under the reaction conditions of [BPA] = 20 mg·L-1, and [PMS]= 0.2 g·L-1; catalytic degradation curves of BPA with reaction time over Cu-N/CNT30 at the different BPA concentrations (e) and the corresponding kinetic curves: ln(C0/C) v.s. Reaction time (f) under the reaction conditions of [PMS]=0.2 g·L-1, and [catalyst]=0.2 g·L-1; catalytic degradation curves of BPA with reaction time over Cu-N/CNT30 at different temperatures (g) and the corresponding kinetic curves: ln(C0/C) v.s. Reaction time (h) under the reaction conditions of [BPA] = 20 mg·L-1, [PMS] = 0.2 g·L-1, and [catalyst] = 0.2 g·L-1;(i) corresponding kinetic curve: lnk v.s.T-1. Fig 6 Fig. 7 Effect of different quenching agents on the degradation performance (a) and comparison of the corresponding reaction rate constants (b) under the reaction conditions of [BPA]=20 mg·L-1, [PMS]=0.2 g·L-1 and [catalyst]=0.2 g·L-1; effect of different anions on the degradation performance (c); effect of different anions on the degradation performance under the 1 under the reaction conditions of [BPA] = 20 mg·L-1, [PMS] = 0.2 g·L-1 and [catalyst] = 0.2 g·L-1 (c); the effect of different contaminants on the degradation performance under the reaction conditions of [BPA] = 20 mg·L-1, [PMS] = 0.8 g·L-1 and [catalyst] = 0.2 g·L-1 (d); the effect of different contaminants on the degradation performance under the reaction conditions of [BPA] = 20 mg·L-1, [PMS] = 0.8 g·L-1 and [catalyst] = 0.8 g·L-1 under the reaction conditions, the degradation curves of total organic carbon (TOC) of different pollutants as a function of time (e) and the corresponding TOC degradation rates (f). (g) effect of water source on the degradation performance, (h) stability test of Cu-N-CNT30 for NFX degradation, (i) comprehensive comparison of Cu-N-CNT30 with reported works for NFX degradation. Fig 7 Fig. 8 Photo images of pure sponge (a) and catalyst modified sponge (b), photothermal evaporation models of intergrated evaporator (c, d), BPA degradation equipment of monolith catalyst in beaker, SEM images for sponge support (f), hydrogel modified sponge (g), and the modified monolith evaporator (h), evaporation curves of different contaminant solution (i), time-dependent degradation course curves for different contaminants using monolith catalyst (j), recycles measurement of monolith evaporator for BPA degradation (k). Fig 8 Construction of photothermal hybrid with surface-polarized carbon nanotube twined oxygen-vacancy engineered cuprous oxide for improved PMS activation and water purification Yarao Gao Writing – original draft Investigation a 1 Hongyao Zhao Investigation Formal analysis a 1 Mengting Liu Investigation a Yanyun Wang Investigation Formal analysis a Yangping Zhang Investigation Formal analysis a Linzhi Zhai Formal analysis a Xiang Liu Formal analysis b Feng Zeng Formal analysis c Jianming Pan Formal analysis d Danhong Shang Writing – review & editing Formal analysis a ⁎⁎ Fu Yang Writing – review & editing Investigation Funding acquisition Conceptualization a ⁎ a School of Environmental and Chemical Engineering, Jiangsu University of Science and Technology, Zhenjiang 212003, Jiangsu, China School of Environmental and Chemical Engineering Jiangsu University of Science and Technology Zhenjiang Jiangsu 212003 China aSchool of Environmental and Chemical Engineering, Jiangsu University of Science and Technology, Zhenjiang 212003, Jiangsu, China b Jiangsu Higher Vocational College Engineering Research Center of Green Energy and Low Carbon Materials & School of Pharmaceutical & Chemical Technology, Zhenjiang College, Zhenjiang 212028, China Jiangsu Higher Vocational College Engineering Research Center of Green Energy and Low Carbon Materials & School of Pharmaceutical & Chemical Technology Zhenjiang College Zhenjiang 212028 China bJiangsu Higher Vocational College Engineering Research Center of Green Energy and Low Carbon Materials & School of Pharmaceutical & Chemical Technology, Zhenjiang College, Zhenjiang 212028, China c State Key Laboratory of Materials-Oriented Chemical Engineering, College of Chemical Engineering, Nanjing Tech University, Nanjing 211816, Jiangsu, China State Key Laboratory of Materials-Oriented Chemical Engineering College of Chemical Engineering Nanjing Tech University Nanjing Jiangsu 211816 China cState Key Laboratory of Materials-Oriented Chemical Engineering, College of Chemical Engineering, Nanjing Tech University, Nanjing 211816, Jiangsu, China d School of Chemistry and Chemical Engineering, Jiangsu University, Zhenjiang 212013, China School of Chemistry and Chemical Engineering Jiangsu University Zhenjiang 212013 China dSchool of Chemistry and Chemical Engineering, Jiangsu University, Zhenjiang 212013, China ⁎ Corresponding author. ⁎⁎ Corresponding author at: School of Environmental and Chemical Engineering, Jiangsu University of Science and Technology, Zhenjiang 212003, Jiangsu, China. School of Environmental and Chemical Engineering Jiangsu University of Science and Technology Zhenjiang Jiangsu 212003 China 1 These authors equally contributed to this work. Photothermal hybrids composed of nanocarbon and metal species are promising in solar-driven photothermal conversion and later application of water purification. Herein, the photothermal hybrid with surface-polarized carbon nanotube (CNT) twined oxygen vacancy-engineered cuprous oxides was constructed. The surface polar oxygen and nitrogen moieties were introduced onto the CNT, enriching the surface polarity of the nanocarbon, which further twined the in-situ generated oxygen vacancy-engineered cuprous oxides. The constructed catalyst was endowed with abundant Cu(I) reactive sites and oxygen vacancy, providing the efficient trapping effect and enough exposed active sites to trigger improved peroxymonosulfate (PMS) activation. In addition, the obtained catalyst affords superior photothermal conversion efficiency, thereby showcasing the great potential in solar-driven water purification. Therefore, the catalyst shows excellent bisphenol A (BPA) degradation performance with a reaction rate constant of 0.47 min-1, and activation energy (Ea=9.38 kJ·mol-1).. The reaction mechanism study indicates the main contribution of singlet oxygen and superoxide radicals in the BPA degradation. More importantly, the obtained catalyst affords the excellent total organic carbon (TOC) removal ability for mixed contaminants, higher than that of single contaminant removal, which shows great potential for practical complicated wastewater purification. Finally, the obtained photothermal hybrids were anchored onto the tailored sponge through a hydrogel tethering strategy, which acts as a monolith evaporator to enable cleanwater regeneration and contaminant degradation. Graphical abstract Image, graphical abstract Keywords Photothermal hybrid Cuprous oxides Oxygen vacancy Pollutants degradation Monolith evaporator Data availability Data will be made available on request. 1 Introduction The rapid development of industry has caused gradually serious water pollution, which threatens the health of human society and makes the water resource shortage serious [1,2]. In particular, water body containing organic contaminants such as BPA is widely used in plastics in many industrial productions, and corresponding evidence has demonstrated that BPA has been released from plastic containers into water bodies, which possibly enters into human bodies resulting in failing in efficient metabolism [3,4]. In addition to BPA, the massive use of antibiotics globally each year inevitably leads to their introduction into the real world, such as tetracycline, oxytetracycline, norfloxacin, etc., which has a great impact on the environment [5]. Correspondingly, the removal of pollutants from water and the regeneration of clean water have become hot issues that need to be solved urgently. In recent years, the advanced oxidation process (AOP) has received increasing attention and was gradually applied in the treatment of water pollution especially for degrading pollutants in water [6–8]. AOPs can degrade pollutants in water through various strong oxidative radicals, note that PMS affords huge advantages in pollutant degradation because the asymmetric structure of PMS can be easily decomposed into various radical species such as sulfate radical (SO4 · -), Hydroxyl radical (·OH), superoxide radicals (·O2 -) and singlet oxygen (1O2), resulting in high degradation rate and mineralization efficiency for difficult-to-degrade pollutants. In particular,·OH and SO4 · - have strong oxidative potential, wherein the standard redox potential ( EHO= 3.1 eV) of SO4 · - is higher than that of hydroxyl radical ( EHO= 1.8–2.7 eV). Therefore, the sulfate radical involving AOP is considered a feasible technology to replace the traditional Fe2+/H2O2 system [9,10]. Note that ·O2 - and 1O2 generally afford longer half-life periods and stronger stability compared to ·OH and SO4 · - especially in the real water world containing various quenching substances, which against the rapid quenching effect of radicals. Therefore, the promoted generation of ·O2 - and 1O2 is beneficial to wastewater treatment in the real world. The controlled generation of these oxidative active species needs to be studied to cater to the practical application process. In general, PMS molecule has the lowest unoccupied molecular orbitals with low energies and are more easily activated by transition metal catalysts such as Co, Mn, Fe, Co, and Cu and their derivative [11,12]. by inducing the electrons to transfer from PMS molecules to metal sites. Through constructing a site-specific catalytic center, the O-O or O-S cleavage of PMS can be oriented and controlled to generate expected active species [13–15]. Although cobalt-based materials have excellent performance for PMS activation, the easy leaching of the high toxicity of cobalt from catalysts would possibly lead to secondary pollution and poor practical application potential. In contrast, copper-based catalyst affords low toxicity, high stability, high activation efficiency, and low leaching rate, which is promising in later applications [16–18]. However, the low valence abundance of copper species makes it have worse redox in the reaction process. Correspondingly, the modulation of PMS activation to trigger more generation of ·O2 - and 1O2 is challenged. Previous studies reveal that the compositing metal species with carbon-based materials afford a large advantage in PMS activation. In particular, the improvement of copper-based catalyst anchored onto nanocarbon induced the improved electron transfer is possibly beneficial for controlling the O-O cleavage of PMS [19,20]. Various carbon nanomaterials, such as graphene, activated carbon, nanodiamonds, and CNTs, have received extensive attention in recent years [21,22]. CNTs, featuring a large surface area, high electrical conductivity, and abundant free electron structure defects on their surfaces, have been demonstrated to be active for PMS activation and radical generation [23–25]. However, CNTs have limited ability for PMS activation in a specific pH range, showcasing poor flexibility in controlling the generation of various active radicals [26,27]. Heteroatom doping can adjust the charge density of carbon-based materials, causing a higher defect level and surface polarity [28,29]. Some edge and corner sites composed of ending moieties possibly act as active centers [30]. Specifically, the negatively charged nitrogen graphite atoms can positively polarize the neighboring carbon atoms, which attracts the negatively charged PMS to approach and promotes the excitation of PMS, while the pyridine nitrogen can be used as an adsorption site to adsorb pollutants and enrich pollutants, which further shortens the attack distance from the reactive oxygen species (ROS) generated in the catalytic center to the pollutants [31,32]. However, an efficient combination of metal species with CNTs still requires a deep exploration to solve with the stability of ultrafine metal species and electron transport between large metal nanoparticles and CNTs. Inspired by the above thoughts, we constructed surface polarized CNT twined oxygen-vacancy engineered cuprous oxide photothermal nanocomposite hybrids through triggering polydopamine incorporated Cu precursor modified CNT, and the highly defective carbon shell with surface-polarized properties due to the doped O/N species can be formed by high-temperature pyrolysis. These modified CNTs twined the generated Cu2O nanoparticles and endow the composites with abundant porous structure and oxygen vacancy sites, which benefits the mass transfer and PMS adsorption. The resulting catalysts were characterized to identify the physicochemical properties. The systematical catalytic performance was evaluated by leveraging the composite catalyst to activate PMS. Various contaminants adaptability study was implemented to identify the universal catalytic ability of this developed catalyst. The contribution of active species was explored through radical quenching experiments. In addition, using the Ca ions triggered cross-linking of sodium alginate, this catalyst was immobilized on a melamine sponge to obtain a bifunctional monolithic evaporator for wastewater treatment and solar-driven freshwater regeneration. 2 Experimental section 2.1 Chemicals and reagents Methanol (99.9 %, CH3OH), Tert-butanol (99.5 %, C4H10O), L-histidine (99 %, C6H9N₃O₂), P-benzoquinone (98 %, C6H4O2), 3-Hydroxytyramine hydrochloride (C8H12ClNO2), Carbon nanotube (CNT), Copper acetate(Cu(CH3COO)2·H2O), ethanol (EtOH), Tris (hydroxymethyl)aminomethane (NH2C(CH2OH)3), Hydrochloric acid (HCl), Potassium peroxymonosulfate complex salt (PMS) and Bisphenol A (BPA, AR) were purchased from Energy Co. Ltd. Oxytetracycline (OTC, 98 %, C22H24N2O9), tetracycline (TC, CP, C22H24N2O8), norfloxacin (NFX, CP, C16H18FN3O3) and sodium alginate (SA, AR, (C6H7O6Na)n) were purchased from Shanghai Macklin Biochemical Technology Co., Ltd chemicals. All the were used as received. The melamine sponge was purchased from Xianxu Insulation and Sound Insulation Building Materials Company. 2.2 Synthesis of catalyst Before the experiment, 6.057 g of tris-hydroxyaminomethane was dissolved in 12 ml of hydrochloric acid solution at a concentration of 2 mol·L-1 and fixed to 1 L to obtain Tris–HCl buffer solution. 0.4828 g of dopamine hydrochloride was dissolved in 50 ml of Tris–HCl buffer solution at a concentration of 50 mmol·L-1, and then 0.5g of CNT was dispersed by ultrasonication for 10 min, stirred for 6 h, and then added to copper acetate solution (50 ml, 0.03 M), stirred for 12 h, collected by centrifugation and dried at 60 °C. The dried sample was calcined in a nitrogen atmosphere (600 °C, 2 h, 5 °C·min-1), and the final sample was named Cu-N/CNT30. By varying the concentration of copper acetate (0.02 M, 0.04 M, 0.05 M), a series of comparison samples (Cu-N/CNT20, Cu-N/CNT40, Cu-N/CNT50) can be obtained. 2.3 Characterizations The morphology and structure of the samples were determined using Field emission scanning electron microscopy (FE-SEM, S4800, Hitachi, Japan), and high-resolution transmission electron microscopy (HR-TEM, JEM-2010 EX, JEOL, Japan). X-ray photoelectron spectroscopy (XPS, ULVAC-PHI, Kanagawa, Japan) equipped with Al Kα radiation (1486.6 eV) was used to determine the elemental composition and chemical state of the samples. The C1s peak at 284.6 eV was used as the reference for binding energies. XRD results were performed using a Smartlab TM 9 KW (XPS, Rigaku Corporation, Tokyo, Japan) equipped with a rotating anode and Cu Kα radiation (λ= 0.154178 nm). Open circuit voltage (OCP), linear scanning voltammetry (LSV), electrochemical impedance (EIS), and cyclic voltammetry (CV) were investigated on a CHI 760 E electrochemical workstation using a standard three-electrode method with a Pt electrode as the counter electrode and an Ag/AgCl electrode as the reference electrode. The photothermal performance tests were performed using a UTi260B thermal imager (UNI-T, Yulide Technology, China) to record temperature variations and a daylight solar simulator (solar-500t, Beijing Newbit Technology, China) to provide simulated sunlight. 2.4 Catalytic performance assessment The catalytic performance of the catalysts was measured by evaluating the degradation rate of pollutants with PMS as an oxidizing agent. A certain amount of PMS was added to a BPA solution with an initial concentration of 0.2 g·L-1, and the initial concentration before adding the catalyst was recorded using an ultraviolet (UV) spectrophotometer (MAPADA P1800). Subsequently, the catalyst was dispersed in the BPA solution, followed by the addition of PMS solution at certain intervals, the BPA solution concentration was determined by separating the catalyst at certain intervals from the mixed solution using an aqueous filter membrane (0.45 µm) and subjected into detection of UV spectrophotometer. The reaction parameters were optimized by performing the control experiments with different concentrations of catalyst, PMS, and BPA. Degradation experiments of different pollutants (NFX\\TC\\OTC) were carried out according to the optimized reaction parameters, keeping other conditions constant. In addition, to explore the reaction mechanism of BPA degradation under optimal conditions, free radical quenching experiments were conducted using various radical quenching agents. The initial concentration was C0 (mg·L-1), the real-time concentration of the pollutant was Ct (mg·L-1), t (min) was taken as the reaction time, and the kinetic parameter was calculated as ln (Ct/C0) = -kt based on the reaction rate constant (k), and the pollutant degradation curves were obtained as a function of time to evaluate the degradation performance of the catalyst. 2.5 Integrated photothermal degradation and cleanwater regeneration To better determine the application potential of Cu-N/CNT in practical scenarios, a bifunctional floatable monolithic evaporator for sewage degradation and freshwater regeneration was constructed for experimental determination. 40 mg of Cu-N/CNT was dispersed in sodium alginate solution, and the above solution was dripped drop by drop onto a round melamine sponge with a diameter of 3.5 cm using a rubber-tipped burette, and then the sponge was immersed in CaCl2 solution for cross-linking, and the catalyst was fixed on the monolithic evaporator. Under simulated sunlight conditions, the integral evaporator was placed in the center of a beaker containing 50 ml of deionized water with a dust-free cloth, and the surface temperature of the sample was recorded every 10 min using an infrared thermal imager, and the mass change of the deionized water was recorded every 100 s using an electronic balance to calculate the photo-thermal conversion efficiency and the water evaporation rate of the integral evaporator. The deionized water was replaced with a solution of contaminants such as BPA, TC, NFX, OTC, etc., and the rate of water evaporation in the presence of the contaminants was determined in accordance with the above photothermal conditions. In addition, the degradation effect of the pollutants at 20 mg L-1 was determined using UV spectrophotometry under sunlight irradiation, and the device is recyclable and can be reused. 3 Results and discussion The synthetic approach of Cu-N/CNT is shown in Fig. 1 a, bird-nest-like surface-polarized CNT twined cuprous oxide nanoparticles can be constructed by coating polydopamine and copper species followed by high-temperature calcination under a nitrogen atmosphere. The resulting composites were endowed with improved surface polarity, abundant oxygen vacancy, and excellent photothermal properties. In particular, CNTs have an out-of-plane π-bonded and highly conjugated structure, which contributes to the reduction of the bandgap and also red-shifts the absorption wavelength, allowing for unique absorption in the near-infrared band [33], which affords excellent visible light absorption, broad absorption spectrum, and high stability. Moreover, CNT has good thermal conductivity, which can effectively absorb solar energy and transfer heat, and this characteristic can be utilized to use CNT as a photothermal material for photothermal conversion and later application in photothermal catalysis and freshwater regeneration [34,35]. Fig. 1(b, c) shows the representative TEM images of typical bird nest-like samples, the nanoparticles (∼100 nm) were twined with curving CNTs, wherein CNT was observed with a diameter of 12.8 nm and a thickness of 4.3 nm. The porous channel of CNTs can help the transport of contaminant molecules and trigger their local enrichment around the catalytic sites. In particular, these twined CNTs modified with N/O species can restrain the escaping of enriching contaminants, triggering an improved dynamical reaction process [36]. Fig. 1c showcases the High-resolution TEM image of Cu-N/CNT30, and the measured lattice spacing by FFT (Fig. 1e) corresponds to a lattice stripe of 0.301 nm in the (110) plane of Cu2O, confirming the successful introduction of Cu2O in the CNTs composites. To further identify the elemental composition and distribution of Cu-N/CNT30, we further analyzed the composite by EDX elemental mapping. Fig. 1f shows that C, N, and O elements were uniformly distributed in the catalyst. On the other hand, the aggregated Cu and O elements in the local region confirm the dominant oxidation state of copper species. Such observations demonstrate the special structure of the catalyst and specific composition state. Fig. 2 a shows the wide-angle XRD diffraction result of a series of comparative samples of Cu-N/CNT x (x=10, 20, 30, 50). All the samples showed a broad diffraction at 26.3°, attributed to the characteristic peak of the (002) crystal plane of CNT, affirming the existence of CNTs [37]. The diffraction peak at 36.4° was identified and corresponded to the (111) crystallographic plane of Cu2O, in agreement with the standard Cu2O (PDF#78–2076). Since increasing Cu loading in the sample, the intensity of the corresponding Cu2O diffraction becomes enlarged gradually. Despite the observation of big Cu2O nanoparticles, the small diffraction of nanoparticles indicates that the size of nanocrystals in the big particle is enough small, which benefits the catalytic reaction. To further determine the chemical environment and elemental composition of the Cu-N/CNT30 surface, we performed X-ray photoelectron spectroscopy analysis. Fig. 2b verifies the main elemental compositions of C, N, O, and Cu of the sample. According to the precise deconvolution result of various elements (Fig. 2c), it can be seen that the high-resolution C 1s was deconvolved into three binding energy peaks at 283.3 eV, 284.8 eV, and 290 eV, corresponding to C-C, C-N/O, and C=C, respectively. Among them, the presence of C-N/O bonds indicates successful doping with N or O species, which would improve the surface polarity of CNTs [38–41]. The high-resolution spectrum of N 1s in Fig. 2d demonstrates individual peaks for pyridine N (398.3 eV), pyrrole N (400.0 eV), and graphite N (404.7 eV). The two active N species, pyrrole N and pyridine N, in the samples, often contribute to the improved adsorption performance of the samples for contaminants [42]. The lone pair of electrons possessed by pyridine N can enhance the charge density of the sample, which is favorable for electron transfer during degradation and can also be used as an active site to activate PMS and increase the degradation rate [43,44]. From the high-resolution spectra of Cu 2p in Fig. 2e, it can be seen that the deconvolution peaks at 953.0 eV and 935.0 eV can be attributed to little fraction of Cu2+ in Cu 2p1/2 and Cu 2p3/2, respectively, while the deconvolution peaks at 952.0 eV and 932.5 eV were observed to occupied the dominant role, which can be attributed to Cu+ in Cu 2p1/2 and Cu 2p3/2, respectively, which confirms the state of cuprous oxides species in Cu-N/CNTs [45]. On the other hand, the O 1s spectrum was provided and deconvoluted into three core levels, corresponding to lattice oxygen, oxygen vacancy, and surface adsorption oxygen. In particular, the high fraction of oxygen vacancy accounts for the more surface trapping sites for PMS molecules, which improves the activation of PMS toward active species [46]. The successful introduction of nitrogen doping and cuprous oxide in the modified carbon nanotubes was confirmed in Fig. S1 and Table S1 to be essential for improving the catalytic degradation performance of the catalysts. To further understand the electron transfer ability of the catalyst, several key electrochemical characterizations were performed such as Electrochemical impedance spectroscopy (EIS, Fig. 3 a), Linear Sweep Voltammetry (LSV, Fig. 3b) curves, and Open-circuit voltage test (OCV, Fig. 3c). In the EIS spectra (Fig. 3a), the semicircle diameter at high-frequency region is related to the charge transfer resistance (CTR). A smaller semicircle of Cu-incorporated CNTs implies a lower CTR, indicating more facile electron transfer at the electrode-electrolyte interface compared to the pure CNTs. This indicates that the construction of special N/O co-modified CNT twined oxygen-vacancy engineered cuprous oxide releases a superior ability to promote charge transfer, which is beneficial for redox reactions. This could be due to its unique surface properties or chemical composition that provides more active sites for electron exchange [47,48]. As electron-rich sites, oxygen vacancies can capture electrons and reduce the charge transfer energy barrier. Their high proportion provides more sites for electron transfer. The excellent electrical conductivity of carbon nanotubes and their close connection with cuprous oxide provide a pathway for electron transport, and the N/O co-modification further enhances the interaction between the two. In fact, the decrease in charge transfer resistance mainly stems from the synergistic effect of oxygen vacancies and the interaction between carbon nanotubes and cuprous oxide. LSV curves (Fig. 3b) show the onset potential and the current density in the potential range providing valuable insights. Cu-N/CNT30 exhibits a lower onset potential, meaning easier electron loss from the catalyst to trigger reaction occurrence. It demonstrates a higher catalytic activity in the initial stage [49,50]. The OCV test showcases some key information for electron transfer, especially for the PMS-containing solution. The addition of PMS in the process induces the potential variation at the specific time, in particular, the curve of Cu-N/CNT30 changes to a greater extent when introducing the PMS molecule, which indicates that the electron transfer occurrence between PMS and catalyst, wherein the big potential variation accounts for the more electron transfer and stronger PMS activation process. Apart from the above properties, the photothermal conversion ability was further explored. As shown in Fig. 4 and Fig. S2, the photothermal images of Cu-N/CNT30 wet membrane on the air-laid paper dipping in DI water, TC, BPA, and NFX solution were collected at different times. The obvious temperature variation of the Cu-N/CNT30 wet membrane under the irradiation of one sunlight can be identified, and the surface temperature can enhanced to beyond 40 °C, indicating the excellent photothermal conversion ability of the catalyst [51–53]. Note that the different contaminants containing solution make the temperature variation different, which possibly results from the adsorption of large contaminant molecules on the catalyst affecting the photothermal conversion properties. According to the time-dependent temperature variation curves (Fig. 4e), the temperature rise is drastic at the initial 10 min, the temperature can reach ∼35 °C, the temperature rise becomes slow after 10 min, and reach 40 °C at the end of the irradiation. This result indicates the catalyst affords excellent photothermal conversion performance, which can be applied for later photothermal catalysis and solar-driven interfacial water evaporation. To investigate the catalytic performance of Cu-N/CNTx series catalysts, the degradation performance curves of different catalysts for the target pollutant BPA under PMS were determined. Fig. 5 a shows the degradation curves of Cu-N/CNT series catalysts on BPA. Note that the untreated CNTs can also reduce the concentration of pollutants in water because their exposed surface can adsorb organic pollutants. At the same time, their good electron conduction performance promotes electron transfer to participate in redox reactions, and the presence of defects or functional groups on the surface can act as catalytic active sites to participate in the reaction triggering the PMS activation and degradation. The BPA degradation efficiency of CNTs increased significantly after loading metal Cu, confirming that the introduction of metal Cu improved the degradation performance of the catalysts. According to Fig. 5b, the order of the reaction kinetic constants of the five catalysts was Cu-N/CNT40 (0.52 min-1) > Cu-N/CNT30 (0.47 min-1) > Cu-N/CNT20 (0.34 min-1) > CNT (0.10 min-1). Among them, both Cu-N/CNT30 and Cu-N/CNT40 were able to degrade BPA completely within 10 min, and their reaction kinetic constants were comparable, in the principle of environmental protection and conservation, Cu-N/CNT30, with a lower concentration of Cu ions, was finally selected as the optimal catalyst. Fig. 5(c-f) shows the spectra of triple-D fluorescence of BPA degradation in the presence of the optimal Cu-N/CNT30 under the action of PMS, and it can be seen that the color of the central ring at the wavelength of 200–400 nm representing contaminants slowly becomes lighter with prolonged time, indicating that the concentration of BPA in the solution gradually decreases, which proves that the catalyst has excellent degradation performance [54]. To further investigate the optimal conditions for the application of the Cu-N/CNT30/PMS system, the effects of the reaction parameters on the BPA degradation experiments were investigated based on the control of PMS dosage, the catalyst dosage, the BPA concentration, and the temperature as variables. Fig. 6 (a, b) shows the BPA degradation curves and the fitted reaction kinetics curves by changing the PMS dosage only. With the increment of the PMS dosage, the active centers of the reaction increased and the degradation rate was accelerated, and the BPA could be degraded completely in about 5 min. Excessive amount of PMS may be over-adsorbed on the catalyst, which may inhibit the activation by weakening the activation effect, therefore, the most appropriate dosage of PMS was selected as 0.2 g·L-1. The results showed that the PMS dosage of 0.2 g·L-1 was suitable for the degradation of BPA [43]. Fig. 6(c, d) shows that when other conditions remained unchanged and only the catalyst dosage was changed, increasing the amount of catalyst resulted in more active sites in contact with pollutants and a significant increase in the reaction rate, but the increase in the catalyst dosage from 0.2 to 0.3 g·L-1, and the increase in the catalyst dosage from 0.1 to 0.2 g·L-1, did not increase the reaction rate much, which indicated that the excess catalyst was not very useful in the enhancement of the degradation rate. This indicates that the excess catalyst is not useful for the enhancement of the degradation rate. For the consideration of material cost, 0.2 g·L-1 of catalyst was chosen as the optimum condition. For the consideration of material cost, 0.2 g·L-1 of catalyst was chosen as the optimum condition. Fig. 6(e, f) shows that the catalytic degradation performance decreases with the increase of pollutant BPA concentration, and the catalyst and PMS can play a better role at low BPA concentration. The effect of temperature on the degradation performance was investigated in Fig. 6(g-i), the degradation rate was accelerated with the increase in temperature, and the kinetic constants of the reaction were in accordance with this characteristic: 50 °C (0.909 min-1) > 40 °C (0.862 min-1) > 30 °C (0.838 min-1). The activation energy Ea = 9.378 kJ mol-1 is calculated using the Arrhenius equation. In the reaction of degrading BPA by activating PMS with a catalyst, this value has obvious advantages. At the same temperature, it can increase the reaction rate constant, accelerate the reaction rate, improve the treatment efficiency in wastewater treatment, and at the same time reduce the temperature requirements of the reaction, save energy, and facilitate the application and promotion of industrial-scale wastewater treatment processes. To investigate the ROS in the degradation of BPA by Cu-N/CNT30, we added four kinds of quenching agents, namely, methanol (MeOH), tert-butanol (TBA), histidine (L-his), and p-benzoquinone (p-BQ), and searched for the ROS that play a major role in degradation through the effect of the bursts. MeOH can quench both the ·OH and ·SO4 - radicals and TBA is mainly used to quench ·OH. The L-his and p-BQ can be used as ·O2 - and 1O2 quenching agents, respectively [55]. As shown in Fig. 7 a, the quenching effects were reduced to different degrees after the addition of the bursting agents, but the bursting effects of MeOH and TBA were very weak, in contrast to that of L-his and p-BQ, which were very obvious. The results of Fig. S3 and Fig. 7b show that after adding MeOH, TBA, L-his and p-BQ, the kinetic constant of the reaction decreased from 0.839 min-1 to 0.815 min-1, 0.777 min-1, 0.086 min-1 and 0.081 min-1 respectively, indicating that the effects of ·OH and ·SO4 - on the degradation process were very weak, whereas ·O2 - and 1O2 were the main ROS. This indicates that longer-activity-life ·O2 - and 1O2 can be generated in this system, which is beneficial for the unremitting pollutant degradation. To test the effect of inorganic anions in the environment on the catalytic degradation of BPA, the degradation effect of Cu-N/CNT30 was examined by adding different inorganic anions. Fig. 7c shows the experimental results after adding different anions under the optimal experimental conditions. The results show that the inhibition of BPA degradation by the studied anions is CO3 2- > HCO3 - > H2PO4 - >Cl- > SO4 -. Among them, Cl- and SO4 2- in a neutral environment did not interfere, while the addition of H2PO4 -, HCO3 -, and CO3 2- weakened the catalytic degradation performance of BPA. This is because HCO3 - and CO3 2- are reducible. They consume active species, adsorb on the catalyst surface, change the charge distribution and microenvironment of the active center, and compete with pollutants for active sites. The presence of H2PO4 - can interfere with the proton transfer process, thus inhibiting the effective activation of PMS and further exerting a certain inhibitory effect on the reaction. Cl-, on the other hand, is stable in the system, not easily oxidized or reduced, weakly binds to the active center of the catalyst, and does not impede the reaction. SO4 - is components or products of PMS. They do not interfere with the activation of PMS and the generation of active species, nor do they cause side reactions with pollutants or active species [56,57]. A variety of antibiotics have been widely used, but overuse and improper handling of antibiotics have caused antibiotics to accumulate in water, with harmful effects on the environment and the human body [57–59]. Therefore, to verify that the Cu-N/CNT/PMS system has an appreciable degradation performance for both BPA and antibiotics produced from degraded plastics, therefore, antibiotic degradation experiments were conducted. The results in Fig. 7d show that Cu-N/CNT30 exhibits high catalytic activity in the oxidative degradation of tetracycline and oxytetracycline, which are degraded completely at 3 min, however, the catalytic activity exhibited in the application to norfloxacin is relatively weak. During the oxidation process, organic macromolecules are broken down into small molecules, but these small molecules have the potential to be toxic or even larger, so the TOC of the process of degrading organic matter was measured to determine the effect of mineralization of organic matter [60]. Fig. 7(e, f) shows that TOC removal in NFX was the hardest compared to other organic pollutants. For the 60 min degradation process, the TOC removal rates were 61.0% (BPA) > 47.7% (TC) > 39.9% (NFX) for the single pollutant TOC removal determination, respectively. And it can be visualized that the TOC removal rate of mixed pollutants is even higher than that of single pollutants, which is advantageous in the practical application of mixed pollutant water treatment, and the TOC removal rates of mixed pollutants were 86.7% (BPA&TC)>79.4% (BPA&TC&NFX) > 78.8% (BPA&NFX) > 57.0% (TC&NFX). Taken together, Cu-N/CNT30 shows good potential for application in the field of catalytic degradation of organic pollutants. To explore the practical application potential of Cu-N-CNT30, the water treatment as well as the recycling performance of the catalyst in tap water and lake water were tested. Relative to the degradation process in the BPA solution in Fig. 7g and Fig. S4, BPA can also be degraded completely in tap water in about 5 min, but the lake water has more impurities, which will make the removal of BPA more difficult. There are natural organic substances in lake water, such as humic acid, fulvic acid, etc. These organic substances possess certain reducibility and reactivity. They will compete with the target organic pollutants for active species and consume free radicals. In addition, these natural organic substances may also adsorb on the surface of the catalyst, block the active sites, or change the surface properties of the catalyst, thus affecting the adsorption and degradation of organic pollutants by the catalyst. The stability of Cu-N/CNT30 was examined by the catalytic degradation cycle experiment of BPA (Fig. 7h). At the end of each experiment, the active sites and pores on the catalyst surface would be blocked by undegraded pollutants and degradation intermediates, which made the adsorption of PMS on the catalyst surface somewhat reduced and slowed down the electron transfer, resulting in a decrease in the activity of Cu-N/CNT catalyst. The performance of the catalyst decreased slightly after cycling, which could be attributed to the high carbon content in the catalyst and the partial loss of activity of the metal active sites after the reaction, but the catalyst still showed high activity after several cycles [61]. The results showed that the catalyst is recyclable in practical applications. The degradation of BPA by different catalysts under the most use of PMS is reported in Fig. 7i and Table S2 [62–67]. In environmental management, some pollutants are difficult to remove together by a single method, so freshwater reclamation from wastewater is also critical [68]. Solar-driven evaporation of interfacial water has received much attention in recent years for freshwater reclamation. This method removes heavy metals, microorganisms, and most organic pollutants from water and yields clean distilled water, which is one of the effective solutions to water scarcity [69]. Carbon-based materials with excellent photothermal conversion properties and chemical stability stand out among photothermal materials [70]. Therefore, the construction of composite materials with dual functions of degrading wastewater and regenerating fresh water can provide effective solutions to wastewater treatment problems and desalination problems. Increasing water scarcity and pollution pose a great challenge to human society, and the search for suitable freshwater regeneration methods is imminent. In recent years, interfacial solar water evaporation has attracted much attention for its low dependence on infrastructure and energy efficiency [71]. Solar-driven interfacial water evaporation is a viable technology for freshwater reclamation by utilizing photothermal materials placed at the water-air interface to drive solar energy into thermal energy, and by limiting the conversion of solar energy to thermal energy at the top of the target body of water, which greatly reduces heat loss [72]. Fig. 8 (a, b) shows the initial sponge support and monolithic evaporator made of Cu-N/CNT30 immobilized in a melamine sponge using a hydrogel crosslinked with sodium alginate and CaCl2, which was measured to be 3.4 cm in diameter. Fig. 8(c, d, e) exhibits the experimental setup diagram and details of water evaporation and degradation under simulated sunlight. Fig. 8(f, g, h) showcases the SEM images of sponge framework, the monolithic evaporator made from hydrogel modified blank sponge, and catalyst and hydrogel modified evaporator. The change in water body mass was recorded at 100 s intervals during the 60 min water evaporation using an electronic balance. Fig. 8i records the rate of water evaporation during 60 min, which was 1.86 kg·m-2·h-1 in BPA solution, 1.85 kg·m-2·h-1 in NFX solution, and 1.89 kg·m-2·h-1 in TC solution. In deionized water, the rate of water evaporation was up to 1.62 kg·m-2·h-1, and the efficiency of the photo-thermal conversion was as high as 88.30%. The catalytic degradation performance of BPA (Fig. 8j) shows that the catalyst could degrade about 93% of BPA within 1 h. This demonstrated the successful application of the integral evaporator of the catalyst Cu-N/CNT30 for wastewater degradation and freshwater regeneration, and the catalyst was integrated on a sponge with excellent recoverability has a significant advantage in the practical application of water treatment [73,74]. Specifically, the four reaction cycles for BPA using a monolith evaporator show consistent degradation efficiency, further indicating the huge potential in the stable practical application. In addition, comparing Cu-N/CNT30 with other reported photothermal materials according to Fig. S5 and Table S3, the results show that the catalyst has significant advantages in both water evaporation rate and photothermal conversion efficiency [75–80]. 4 Conclusions In summary, a photothermal hybrid composed of surface-polarized CNTs twined oxygen-vacancy engineered cuprous oxide (Cu-N/CNT30) was successfully constructed. Its special nest-like structural characteristics were confirmed by various characterization methods. Impressively, the abundant oxygen vacancy sites can be formed in the cuprous oxides, which is beneficial to the trapping effect of PMS, evidenced by the open circuit voltage test. The surface polarity of CNTs due to the N/O co-doping effect can trigger improved enrichment of polar contaminants, which would shorten the diffusion of ROS toward the contaminants and improve the lifespan. In addition, this catalyst was endowed with excellent photothermal conversion ability. In terms of catalytic degradation of pollutants, the introduction of copper onto the CNT improved the catalytic PMS activation compared to untreated CNTs. The optimal catalystCu-N/CNT30 showcased the excellent catalytic degradation of BPA with the reaction rate constant reaching 0.47 min-1, and the activation energy is 9.38 kJ·mol-1. The reaction mechanism demonstrated the dominant role of ·O2 - and 1O2 for pollutant degradation. Besides, the optimal catalyst also showed great flexibility for a variety of antibiotics, and the TOC removal rate (78.8%) of mixed pollutants was demonstrated to be higher than a single one. The great degradation performance of pollutants in tap water can be attained. The monolithic evaporator fabricated performs well in pollutant degradation and clean water regeneration, providing an effective way for wastewater treatment and freshwater regeneration. CRediT authorship contribution statement Yarao Gao: Writing – original draft, Investigation. Hongyao Zhao: Investigation, Formal analysis. Mengting Liu: Investigation. Yanyun Wang: Investigation, Formal analysis. Yangping Zhang: Investigation, Formal analysis. Linzhi Zhai: Formal analysis. Xiang Liu: Formal analysis. Feng Zeng: Formal analysis. Jianming Pan: Formal analysis. Danhong Shang: Writing – review & editing, Formal analysis. Fu Yang: Writing – review & editing, Investigation, Funding acquisition, Conceptualization. Declaration of competing interest The authors declare that they have no known competing financial interests or personal relationships that could have appeared to influence the work reported in this paper. Acknowledgments The research received financial support from China National Natural Science Foundation (21908085), Natural Science Foundation of Jiangsu province (BK20241950), China Postdoctoral Science Foundation (2023M731422), Open project of State Key Laboratory of Materials Chemical Engineering (SKL-MCE-23B), Hubei Key Laboratory of Processing and Application of Catalytic materials (202441204) and the Science, Technology Plan School-Enterprise Cooperation Industry-University-Research Forward-looking Project of Zhangjiagang (ZKYY2341) and Suzhou Gusu Health Talent Program-Youth Top Talent ((2024) 210). Supplementary materials Supplementary material associated with this article can be found, in the online version, at doi:10.1016/j.mcat.2025.114994. Appendix Supplementary materials Image, application 1 References [1] M. Li H. Zhang Z. Liu Y. Su C. Du Surface lattice oxygen mobility inspired peroxymonosulfate activation over Mn2O3 exposing different crystal faces toward bisphenol A degradation Chem. Eng. J. 450 2022 138147 10.1016/j.cej.2022.138147 M. Li, H. Zhang, Z. Liu, Y. Su, C. Du. Surface lattice oxygen mobility inspired peroxymonosulfate activation over Mn2O3 exposing different crystal faces toward bisphenol A degradation, Chem. Eng. J. 450 (2022) 138147. https://doi.org/10.1016/j.cej.2022.138147. [2] Y. Wei Y. Wu J. Wang Y.-H. Wu Z. Weng W.-Y. Huang Rationally designed dual cocatalysts on ZnIn2S4 nanoflowers for photoredox coupling of benzyl alcohol oxidation with H2 evolution J. Mater. Chem. A. 12 2024 18986 18992 10.1039/D4TA02289K Y. Wei, Y. Wu, J. Wang, Y.-H. Wu, Z. Weng, W.-Y. Huang, et al. Rationally designed dual cocatalysts on ZnIn2S4 nanoflowers for photoredox coupling of benzyl alcohol oxidation with H2 evolution, J. Mater. Chem. A. 12 (2024) 18986–18992. https://doi.org/10.1039/D4TA02289K. [3] Y.-H. Deng J. Jeon E.M. Kim S. Ding S.A. Lee C. Ryu In situ immobilization of δ-MnO2 nanosheets on a porous support for rapid and continuous cleaning of bisphenol A-spiked water Chem. Eng. J. 472 2023 144653 10.1016/j.cej.2023.144653 Y.-H. Deng, J. Jeon, E.M. Kim, S. Ding, S.A. Lee, C. Ryu, et al. In situ immobilization of δ-MnO2 nanosheets on a porous support for rapid and continuous cleaning of bisphenol A-spiked water, Chem. Eng. J. 472 (2023) 144653. https://doi.org/10.1016/j.cej.2023.144653. [4] E. Han Y. Pan L. Li J. Cai Bisphenol A detection based on nano gold-doped molecular imprinting electrochemical sensor with enhanced sensitivity Food Chem 426 2023 136608 10.1016/j.foodchem.2023.136608 E. Han, Y. Pan, L. Li, J. Cai. Bisphenol A detection based on nano gold-doped molecular imprinting electrochemical sensor with enhanced sensitivity, Food Chem. 426 (2023) 136608. https://doi.org/10.1016/j.foodchem.2023.136608. [5] W. Song Z. Yu H. Li Y. Ji L. Cao L. Ren Insights into the factors influencing the oxidation of antibiotic pollutants in nitrogen-doped biochar/PMS system: the roles of physicochemical properties and reaction pathways Chem. Eng. J. 498 2024 155601 10.1016/j.cej.2024.155601 W. Song, Z. Yu, H. Li, Y. Ji, L. Cao, L. Ren, et al. Insights into the factors influencing the oxidation of antibiotic pollutants in nitrogen-doped biochar/PMS system: the roles of physicochemical properties and reaction pathways, Chem. Eng. J. 498 (2024) 155601. https://doi.org/10.1016/j.cej.2024.155601. [6] Z. Zhao L. Lin S. Liu Y. Chen S.V. Daniels Z. Xu Unveiling the versatile performance of transition metal sulfides in peroxymonosulfate activation Chem. Eng. J. 497 2024 154682 10.1016/j.cej.2024.154682 Z. Zhao, L. Lin, S. Liu, Y. Chen, S.V. Daniels, Z. Xu, et al. Unveiling the versatile performance of transition metal sulfides in peroxymonosulfate activation, Chem. Eng. J. 497 (2024) 154682. https://doi.org/10.1016/j.cej.2024.154682. [7] Q.-L. Mo R. Xiong J.-H. Dong B.-S. Sa J.-Y. Zheng Q. Chen Identification of origin of insulating polymer maneuvered photoredox catalysis Chinese J. Catal. 63 2024 109 123 10.1016/S1872-2067(24)60070-7 Q.-L. Mo, R. Xiong, J.-H. Dong, B.-S. Sa, J.-Y. Zheng, Q. Chen, et al. Identification of origin of insulating polymer maneuvered photoredox catalysis, Chinese J. Catal. 63 (2024) 109–123. https://doi.org/10.1016/S1872-2067(24)60070-7. [8] Y.-Q. Yan Y.-Z. Wu Y.-H. Wu Z.-L. Weng S.-J. Liu Z.-G. Liu Recent advances of CeO2-based composite materials for photocatalytic applications ChemSusChem 17 2024 e202301778 10.1002/cssc.202301778 Y.-Q. Yan, Y.-Z. Wu, Y.-H. Wu, Z.-L. Weng, S.-J. Liu, Z.-G. Liu, et al. Recent advances of CeO2-based composite materials for photocatalytic applications, ChemSusChem. 17 (2024) e202301778. https://doi.org/10.1002/cssc.202301778. [9] H. Lu M. Sui B. Yuan J. Wang Y. Lv Efficient degradation of nitrobenzene by Cu-Co-Fe-LDH catalyzed peroxymonosulfate to produce hydroxyl radicals Chem. Eng. J. 357 2019 140 149 10.1016/j.cej.2018.09.111 H. Lu, M. Sui, B. Yuan, J. Wang, Y. Lv. Efficient degradation of nitrobenzene by Cu-Co-Fe-LDH catalyzed peroxymonosulfate to produce hydroxyl radicals, Chem. Eng. J. 357 (2019) 140–149. https://doi.org/10.1016/j.cej.2018.09.111. [10] J. Wang S. Wang Activation of persulfate (PS) and peroxymonosulfate (PMS) and application for the degradation of emerging contaminants Chem. Eng. J. 334 2018 1502 1517 10.1016/j.cej.2017.11.059 J. Wang, S. Wang. Activation of persulfate (PS) and peroxymonosulfate (PMS) and application for the degradation of emerging contaminants, Chem. Eng. J. 334 (2018) 1502–1517. https://doi.org/10.1016/j.cej.2017.11.059. [11] H. Cao Y. Lu X. Zhang W. Dong W. Shi Y. Huang Engineering a simple multisignal-output probe for measuring residual peroxymonosulfate in advanced oxidation reactions Chem. Eng. J. 471 2023 144663 10.1016/j.cej.2023.144663 H. Cao, Y. Lu, X. Zhang, W. Dong, W. Shi, Y. Huang. Engineering a simple multisignal-output probe for measuring residual peroxymonosulfate in advanced oxidation reactions, Chem. Eng. J. 471 (2023) 144663. https://doi.org/10.1016/j.cej.2023.144663. [12] Y.-S. Cai J.-Q. Chen P. Su X. Yan Q. Chen Y. Wu Atomically precise metal nanoclusters combine with MXene towards solar CO2 conversion Chem. Sci. 15 2024 13495 13505 10.1039/D4SC03663H Y.-S. Cai, J.-Q. Chen, P. Su, X. Yan, Q. Chen, Y. Wu, et al. Atomically precise metal nanoclusters combine with MXene towards solar CO2 conversion, Chem. Sci. 15 (2024) 13495–13505. https://doi.org/10.1039/D4SC03663H. [13] W. Zhu S. Ndayiragije X. Zuo X. Zhang G. Wang X. Wang ZIF-8-derived single-atom Cu and N co-coordinated porous carbon as bifunctional material for SMX removal J. Environ. Chem. Eng. 10 2022 107758 10.1016/j.jece.2022.107758 W. Zhu, S. Ndayiragije, X. Zuo, X. Zhang, G. Wang, X. Wang. ZIF-8-derived single-atom Cu and N co-coordinated porous carbon as bifunctional material for SMX removal, J. Environ. Chem. Eng. 10 (2022) 107758. https://doi.org/10.1016/j.jece.2022.107758. [14] M.-Y. Qi Z.-R. Tang Y.-J. Xu Near field scattering optical model-based catalyst design for artificial photoredox transformation ACS Catal 13 2023 3971 3982 10.1021/acscatal.2c06397 M.-Y. Qi, Z.-R. Tang, Y.-J. Xu. Near field scattering optical model-based catalyst design for artificial photoredox transformation, ACS Catal. 13 (2023) 3971–3982. https://doi.org/10.1021/acscatal.2c06397. [15] L.-X. Zhang Z.-R. Tang M.-Y. Qi Y.-J. Xu Engineering semiconductor quantum dots for co-upcycling of CO2 and biomass-derived alcohol J. Mater. Chem. A. 12 2024 19029 19038 10.1039/D4TA01996B L.-X. Zhang, Z.-R. Tang, M.-Y. Qi, Y.-J. Xu. Engineering semiconductor quantum dots for co-upcycling of CO2 and biomass-derived alcohol, J. Mater. Chem. A. 12 (2024) 19029–19038. https://doi.org/10.1039/D4TA01996B. [16] Y. Huang J. Li P. Du X. Lu Rational design of copper encapsulated within nitrogen-doped carbon core-shell nanosphere for efficiently photocatalytic peroxymonosulfate activation J. Colloid Interface Sci. 597 2021 206 214 10.1016/j.jcis.2021.04.016 Y. Huang, J. Li, P. Du, X. Lu. Rational design of copper encapsulated within nitrogen-doped carbon core-shell nanosphere for efficiently photocatalytic peroxymonosulfate activation, J. Colloid Interface Sci. 597 (2021) 206–214. https://doi.org/10.1016/j.jcis.2021.04.016. [17] Y. Sun J. Yu X. Zhan L. Chen Y. Zhao H. Wang A copper-loaded N-doped carbon catalyst with mesoporous hollow sphere structure for bisphenol A removing via peroxymonosulfate activation Micropor. Mesopor. Mater. 342 2022 112133 10.1016/j.micromeso.2022.112133 Y. Sun, J. Yu, X. Zhan, L. Chen, Y. Zhao, H. Wang, et al. A copper-loaded N-doped carbon catalyst with mesoporous hollow sphere structure for bisphenol A removing via peroxymonosulfate activation, Micropor. Mesopor. Mater. 342 (2022) 112133. https://doi.org/10.1016/j.micromeso.2022.112133. [18] X. Ding W. Ahmad J. Wu Y. Rong Q. Ouyang Q. Chen Bipyridine-mediated fluorescence charge transfer process based on copper ion grafted upconversion nanoparticle platform for ciprofloxacin sensing in aquatic products Food Chem 404 2023 134761 10.1016/j.foodchem.2022.134761 X. Ding, W. Ahmad, J. Wu, Y. Rong, Q. Ouyang, Q. Chen. Bipyridine-mediated fluorescence charge transfer process based on copper ion grafted upconversion nanoparticle platform for ciprofloxacin sensing in aquatic products, Food Chem. 404 (2023) 134761. https://doi.org/10.1016/j.foodchem.2022.134761. [19] C. Fang J. Yan Y. Wang N. Zhang X. Liu Facile synthesis of N-doped carbon nanorods for antibiotics degradation via PMS activation: mechanism insight and biotoxicity assessment Sep. Purif. Technol. 340 2024 126849 10.1016/j.seppur.2024.126849 C. Fang, J. Yan, Y. Wang, N. Zhang, X. Liu. Facile synthesis of N-doped carbon nanorods for antibiotics degradation via PMS activation: mechanism insight and biotoxicity assessment, Sep. Purif. Technol. 340 (2024) 126849. https://doi.org/10.1016/j.seppur.2024.126849. [20] Y.-H. Li Z.-S. Huang M.-Y. Qi Z.-R. Tang Benchmark comparison study on metal single atom versus metal nanoparticle in photoredox catalysis: which is better? Mol. Catal. 567 2024 114474 10.1016/j.mcat.2024.114474 Y.-H. Li, Z.-S. Huang, M.-Y. Qi, Z.-R. Tang. Benchmark comparison study on metal single atom versus metal nanoparticle in photoredox catalysis: which is better?, Mol. Catal. 567 (2024) 114474. https://doi.org/10.1016/j.mcat.2024.114474. [21] S. Liu S. Yin Z. Zhang L. Feng Y. Liu L. Zhang Regulation of defects and nitrogen species on carbon nanotube by plasma-etching for peroxymonosulfate activation: inducing non-radical/radical oxidation of organic contaminants J. Hazard. Mater. 441 2023 129905 10.1016/j.jhazmat.2022.129905 S. Liu, S. Yin, Z. Zhang, L. Feng, Y. Liu, L. Zhang. Regulation of defects and nitrogen species on carbon nanotube by plasma-etching for peroxymonosulfate activation: inducing non-radical/radical oxidation of organic contaminants, J. Hazard. Mater. 441 (2023) 129905. https://doi.org/10.1016/j.jhazmat.2022.129905. [22] K. Zeng B. Chen Y. Li H. Meng Q. Wu J. Yang Gold nanoparticle-carbon nanotube nanohybrids with peroxidase-like activity for the highly-sensitive immunoassay of kanamycin in milk Int. J. Food Sci. Technol. 57 2022 6028 6037 10.1111/ijfs.15955 K. Zeng, B. Chen, Y. Li, H. Meng, Q. Wu, J. Yang, et al. Gold nanoparticle-carbon nanotube nanohybrids with peroxidase-like activity for the highly-sensitive immunoassay of kanamycin in milk, Int. J. Food Sci. Technol. 57 (2022) 6028–6037. https://doi.org/10.1111/ijfs.15955. [23] W.-L. Tu G. Wang Y. Zhang H.-Y. Zhu R.-R. Du H.-Y. Zhao Coupling N-doping and confined Co3O4 on carbon nanotubes by polydopamine coating strategy for pleiotropic water purification Rare Met 43 2024 3146 3160 10.1007/s12598-024-02661-5 W.-L. Tu, G. Wang, Y. Zhang, H.-Y. Zhu, R.-R. Du, H.-Y. Zhao, et al. Coupling N-doping and confined Co3O4 on carbon nanotubes by polydopamine coating strategy for pleiotropic water purification, Rare Met. 43 (2024) 3146–3160. https://doi.org/10.1007/s12598-024-02661-5. [24] K. Zeng W. Wei L. Jiang F. Zhu D. Du Use of carbon nanotubes as a solid support to establish quantitative (Centrifugation) and qualitative (Filtration) immunoassays to detect gentamicin contamination in commercial milk J. Agric. Food Chem. 64 2016 7874 7881 10.1021/acs.jafc.6b03332 K. Zeng, W. Wei, L. Jiang, F. Zhu, D. Du. Use of carbon nanotubes as a solid support to establish quantitative (Centrifugation) and qualitative (Filtration) immunoassays to detect gentamicin contamination in commercial milk, J. Agric. Food Chem. 64 (2016) 7874–7881. https://doi.org/10.1021/acs.jafc.6b03332. [25] S. Ma M. Wang T. You K. Wang Using magnetic multiwalled carbon nanotubes as modified QuEChERS adsorbent for simultaneous determination of multiple mycotoxins in grains by UPLC-MS/MS J. Agric. Food Chem. 67 2019 8035 8044 10.1021/acs.jafc.9b00090 S. Ma, M. Wang, T. You, K. Wang. Using magnetic multiwalled carbon nanotubes as modified QuEChERS adsorbent for simultaneous determination of multiple mycotoxins in grains by UPLC-MS/MS, J. Agric. Food Chem. 67 (2019) 8035–8044. https://doi.org/10.1021/acs.jafc.9b00090. [26] Y. Zhao L. Qiao M. Zhang Y. Xiao Y. Tao F. Yang Roles of BOCu sites and graphite nitrogen on persulfate non-radical activation for tetracycline degradation J. Colloid Interface Sci. 673 2024 178 189 10.1016/j.jcis.2024.06.033 Y. Zhao, L. Qiao, M. Zhang, Y. Xiao, Y. Tao, F. Yang, et al. Roles of BOCu sites and graphite nitrogen on persulfate non-radical activation for tetracycline degradation, J. Colloid Interface Sci. 673 (2024) 178–189. https://doi.org/10.1016/j.jcis.2024.06.033. [27] W. Zheng Y. Liu W. Liu H. Ji F. Li C. Shen A novel electrocatalytic filtration system with carbon nanotube supported nanoscale zerovalent copper toward ultrafast oxidation of organic pollutants Water Res 194 2021 116961 10.1016/j.watres.2021.116961 W. Zheng, Y. Liu, W. Liu, H. Ji, F. Li, C. Shen, et al. A novel electrocatalytic filtration system with carbon nanotube supported nanoscale zerovalent copper toward ultrafast oxidation of organic pollutants, Water Res. 194 (2021) 116961. https://doi.org/10.1016/j.watres.2021.116961. [28] M.F. Gasim A. Veksha G. Lisak S.-C. Low T.S. Hamidon M.H. Hussin Importance of carbon structure for nitrogen and sulfur co-doping to promote superior ciprofloxacin removal via peroxymonosulfate activation J. Colloid Interface Sci. 634 2023 586 600 10.1016/j.jcis.2022.12.072 M.F. Gasim, A. Veksha, G. Lisak, S.-C. Low, T.S. Hamidon, M.H. Hussin, et al. Importance of carbon structure for nitrogen and sulfur co-doping to promote superior ciprofloxacin removal via peroxymonosulfate activation, J. Colloid Interface Sci. 634 (2023) 586–600. https://doi.org/10.1016/j.jcis.2022.12.072. [29] X.-N. Shao Y.-F. Wang M.-Y. Qi Z.-R. Tang MoS2 decorated CdS composite catalyst for photoredox-mediated C–N coupling of amines to imines and hydrogen production Mol. Catal. 557 2024 113991 10.1016/j.mcat.2024.113991 X.-N. Shao, Y.-F. Wang, M.-Y. Qi, Z.-R. Tang. MoS2 decorated CdS composite catalyst for photoredox-mediated C–N coupling of amines to imines and hydrogen production, Mol. Catal. 557 (2024) 113991. https://doi.org/10.1016/j.mcat.2024.113991. [30] H. Luo X. Zhou Q. Chen J. Zhou Removal of 2,4-dichlorophenoxyacetic acid by the boron-nitrogen co-doped carbon nanotubes: insights into peroxymonosulfate adsorption and activation Sep. Purif. Technol. 259 2021 118196 10.1016/j.seppur.2020.118196 H. Luo, X. Zhou, Q. Chen, J. Zhou. Removal of 2,4-dichlorophenoxyacetic acid by the boron-nitrogen co-doped carbon nanotubes: insights into peroxymonosulfate adsorption and activation, Sep. Purif. Technol. 259 (2021) 118196. https://doi.org/10.1016/j.seppur.2020.118196. [31] Y. Long Y. Huang H. Wu X. Shi L. Xiao Peroxymonosulfate activation for pollutants degradation by Fe-N-codoped carbonaceous catalyst: structure-dependent performance and mechanism insight Chem. Eng. J. 369 2019 542 552 10.1016/j.cej.2019.03.097 Y. Long, Y. Huang, H. Wu, X. Shi, L. Xiao. Peroxymonosulfate activation for pollutants degradation by Fe-N-codoped carbonaceous catalyst: structure-dependent performance and mechanism insight, Chem. Eng. J. 369 (2019) 542–552. https://doi.org/10.1016/j.cej.2019.03.097. [32] P. Su B. Tang F.-X. Xiao Layer-by-Layer assembly of atomically precise alloy nanoclusters photosystems for solar water oxidation Small 20 2023 2307619 10.1002/smll.202307619 P. Su, B. Tang, F.-X. Xiao. Layer-by-Layer assembly of atomically precise alloy nanoclusters photosystems for solar water oxidation, Small. 20 (2023) 2307619. https://doi.org/10.1002/smll.202307619. [33] M. Liu B. Zhu N. Chen J. Zhu C. Lei R. Li Broadband efficient light-absorbing SS-PPy@CNT membranes prepared by electrochemical deposition for photothermal conversion Renew. Energy. 237 2024 121926 10.1016/j.renene.2024.121926 M. Liu, B. Zhu, N. Chen, J. Zhu, C. Lei, R. Li, et al. Broadband efficient light-absorbing SS-PPy@CNT membranes prepared by electrochemical deposition for photothermal conversion, Renew. Energy. 237 (2024) 121926. https://doi.org/10.1016/j.renene.2024.121926. [34] Y. Li J. Wang C. Fu L. Huang L. Chen Y. Ni Designing flexible CNT/CNF films with highly light-absorbing for solar energy harvesting: seawater desalination, photothermal power generation and light- driven actuators Energy Convers. Manag. 289 2023 117160 10.1016/j.enconman.2023.117160 Y. Li, J. Wang, C. Fu, L. Huang, L. Chen, Y. Ni, et al. Designing flexible CNT/CNF films with highly light-absorbing for solar energy harvesting: seawater desalination, photothermal power generation and light- driven actuators, Energy Convers. Manag. 289 (2023) 117160. https://doi.org/10.1016/j.enconman.2023.117160. [35] Z. Yang Y. Shu G. Zhang J. Zhang R. Liu W. Liu A hierarchically cellulose porous monolith doped with CNTs/Al2O3 fibers, exhibiting super-hydrophilicity and underwater superoleophobicity for efficient solar-driven desalination Desalination 583 2024 117701 10.1016/j.desal.2024.117701 Z. Yang, Y. Shu, G. Zhang, J. Zhang, R. Liu, W. Liu, et al. A hierarchically cellulose porous monolith doped with CNTs/Al2O3 fibers, exhibiting super-hydrophilicity and underwater superoleophobicity for efficient solar-driven desalination, Desalination. 583 (2024) 117701. https://doi.org/10.1016/j.desal.2024.117701. [36] Y. Liu F. Chen W. Ye M. Zeng N. Han F. Zhao High-performance oxygen reduction electrocatalyst derived from polydopamine and cobalt supported on carbon nanotubes for metal–Air batteries Adv. Funct. Mater. 27 2017 1606034 10.1002/adfm.201606034 Y. Liu, F. Chen, W. Ye, M. Zeng, N. Han, F. Zhao, et al. High-performance oxygen reduction electrocatalyst derived from polydopamine and cobalt supported on carbon nanotubes for metal–Air batteries, Adv. Funct. Mater. 27 (2017) 1606034. https://doi.org/10.1002/adfm.201606034. [37] B. Liu W. Song H. Wu Z. Liu Y. Teng Y. Sun Degradation of norfloxacin with peroxymonosulfate activated by nanoconfinement Co3O4@CNT nanocomposite Chem. Eng. J. 398 2020 125498 10.1016/j.cej.2020.125498 B. Liu, W. Song, H. Wu, Z. Liu, Y. Teng, Y. Sun, et al. Degradation of norfloxacin with peroxymonosulfate activated by nanoconfinement Co3O4@CNT nanocomposite, Chem. Eng. J. 398 (2020) 125498. https://doi.org/10.1016/j.cej.2020.125498. [38] S. Wang J. Wang Bimetallic and nitrogen co-doped biochar for peroxymonosulfate (PMS) activation to degrade emerging contaminants Sep. Purif. Technol. 307 2023 122807 10.1016/j.seppur.2022.122807 S. Wang, J. Wang. Bimetallic and nitrogen co-doped biochar for peroxymonosulfate (PMS) activation to degrade emerging contaminants, Sep. Purif. Technol. 307 (2023) 122807. https://doi.org/10.1016/j.seppur.2022.122807. [39] M.-Y. Qi W.-Y. Xiao M. Conte Z.-R. Tang Y.-J. Xu Interfacial synergy of Ni single atom/clusters and MXene enabling semiconductor quantum dots based superior photoredox catalysis ACS Catal 15 2025 129 138 10.1021/acscatal.4c05842 M.-Y. Qi, W.-Y. Xiao, M. Conte, Z.-R. Tang, Y.-J. Xu. Interfacial synergy of Ni single atom/clusters and MXene enabling semiconductor quantum dots based superior photoredox catalysis, ACS Catal. 15 (2025) 129–138. https://doi.org/10.1021/acscatal.4c05842. [40] M.-Y. Qi M. Conte M. Anpo Z.-R. Tang Y.-J. Xu Cooperative coupling of oxidative organic synthesis and hydrogen production over semiconductor-based photocatalysts Chem. Rev. 121 2021 13051 13085 10.1021/acs.chemrev.1c00197 M.-Y. Qi, M. Conte, M. Anpo, Z.-R. Tang, Y.-J. Xu. Cooperative coupling of oxidative organic synthesis and hydrogen production over semiconductor-based photocatalysts, Chem. Rev. 121 (2021) 13051–13085. https://doi.org/10.1021/acs.chemrev.1c00197. [41] M.-Y. Qi Y.-H. Li M. Anpo Z.-R. Tang Y.-J. Xu Efficient photoredox-mediated C–C coupling organic synthesis and hydrogen production over engineered semiconductor quantum dots ACS Catal 10 2020 14327 14335 10.1021/acscatal.0c04237 M.-Y. Qi, Y.-H. Li, M. Anpo, Z.-R. Tang, Y.-J. Xu. Efficient photoredox-mediated C–C coupling organic synthesis and hydrogen production over engineered semiconductor quantum dots, ACS Catal. 10 (2020) 14327–14335. https://doi.org/10.1021/acscatal.0c04237. [42] L. Tie W.-x. Zhang Z. Deng Composite hydrogel derived iron/nitrogen co-doped carbon for bisphenol A removal Sep. Purif. Technol. 340 2024 126752 10.1016/j.seppur.2024.126752 L. Tie, W.-x. Zhang, Z. Deng. Composite hydrogel derived iron/nitrogen co-doped carbon for bisphenol A removal, Sep. Purif. Technol. 340 (2024) 126752. https://doi.org/10.1016/j.seppur.2024.126752. [43] W. Wang M. Chen Catalytic degradation of sulfamethoxazole by peroxymonosulfate activation system composed of nitrogen-doped biochar from pomelo peel: important roles of defects and nitrogen, and detoxification of intermediates J. Colloid Interface Sci. 613 2022 57 70 10.1016/j.jcis.2022.01.006 W. Wang, M. Chen. Catalytic degradation of sulfamethoxazole by peroxymonosulfate activation system composed of nitrogen-doped biochar from pomelo peel: important roles of defects and nitrogen, and detoxification of intermediates, J. Colloid Interface Sci. 613 (2022) 57–70. https://doi.org/10.1016/j.jcis.2022.01.006. [44] W. Li X. Hu Q. Li Y. Shi X. Zhai Y. Xu Copper nanoclusters @ nitrogen-doped carbon quantum dots-based ratiometric fluorescence probe for lead (II) ions detection in porphyra Food Chem 320 2020 126623 10.1016/j.foodchem.2020.126623 W. Li, X. Hu, Q. Li, Y. Shi, X. Zhai, Y. Xu, et al. Copper nanoclusters @ nitrogen-doped carbon quantum dots-based ratiometric fluorescence probe for lead (II) ions detection in porphyra, Food Chem. 320 (2020) 126623. https://doi.org/10.1016/j.foodchem.2020.126623. [45] S. Diao L. Meng L. Feng Microenvironment modulation of MoS2-based single-atom catalyst for accelerating electron-transfer process to activate PMS and degrade pollutant J. Environ. Chem. Eng. 12 2024 112559 10.1016/j.jece.2024.112559 S. Diao, L. Meng, L. Feng. Microenvironment modulation of MoS2-based single-atom catalyst for accelerating electron-transfer process to activate PMS and degrade pollutant, J. Environ. Chem. Eng. 12 (2024) 112559. https://doi.org/10.1016/j.jece.2024.112559. [46] Z.-S. Huang Y.-F. Wang M.-Y. Qi M. Conte Z.-R. Tang Y.-J. Xu Interface synergy of exposed oxygen vacancy and Pd Lewis acid sites enabling superior cooperative photoredox synthesis Angew. Chem. Int. Edit. 63 2024 e202412707 10.1002/anie.202412707 Z.-S. Huang, Y.-F. Wang, M.-Y. Qi, M. Conte, Z.-R. Tang, Y.-J. Xu. Interface synergy of exposed oxygen vacancy and Pd Lewis acid sites enabling superior cooperative photoredox synthesis, Angew. Chem. Int. Edit. 63 (2024) e202412707. https://doi.org/10.1002/anie.202412707. [47] X. Wang Y. Xu Y. Li Y. Li Z. Li W. Zhang Rapid detection of cadmium ions in meat by a multi-walled carbon nanotubes enhanced metal-organic framework modified electrochemical sensor Food Chem 357 2021 129762 10.1016/j.foodchem.2021.129762 X. Wang, Y. Xu, Y. Li, Y. Li, Z. Li, W. Zhang, et al. Rapid detection of cadmium ions in meat by a multi-walled carbon nanotubes enhanced metal-organic framework modified electrochemical sensor, Food Chem. 357 (2021) 129762. https://doi.org/10.1016/j.foodchem.2021.129762. [48] N. Zhang M.-Y. Qi L. Yuan X. Fu Z.-R. Tang J. Gong Broadband light harvesting and unidirectional electron flow for efficient electron accumulation for hydrogen generation Angew. Chem. Int. Edit. 58 2019 10003 10007 10.1002/anie.201905981 N. Zhang, M.-Y. Qi, L. Yuan, X. Fu, Z.-R. Tang, J. Gong, et al. Broadband light harvesting and unidirectional electron flow for efficient electron accumulation for hydrogen generation, Angew. Chem. Int. Edit. 58 (2019) 10003–10007. https://doi.org/10.1002/anie.201905981. [49] X.-J. Li H.-T. Wan M.-Y. Qi C.-L. Tan Z.-R. Tang Photocatalytic imines synthesis integrated with H2 evolution over Ni doped Mn0.25Cd0.75S catalyst Mol. Catal. 564 2024 114356 10.1016/j.mcat.2024.114356 X.-J. Li, H.-T. Wan, M.-Y. Qi, C.-L. Tan, Z.-R. Tang. Photocatalytic imines synthesis integrated with H2 evolution over Ni doped Mn0.25Cd0.75S catalyst, Mol. Catal. 564 (2024) 114356. https://doi.org/10.1016/j.mcat.2024.114356. [50] X. Yan J.-H. Dong J.-Y. Zheng Y. Wu F.-X. Xiao Customizing precise, tunable, and universal cascade charge transfer chains towards versatile photoredox catalysis Chem. Sci. 15 2024 2898 2913 10.1039/D3SC05761E X. Yan, J.-H. Dong, J.-Y. Zheng, Y. Wu, F.-X. Xiao. Customizing precise, tunable, and universal cascade charge transfer chains towards versatile photoredox catalysis, Chem. Sci. 15 (2024) 2898–2913. https://doi.org/10.1039/D3SC05761E. [51] C. Wang X. Zhao C. Gu F. Xu W. Zhang X. Huang Fabrication of a versatile aptasensing chip for aflatoxin B1 in photothermal and electrochemical dual modes Food Anal. Methods. 15 2022 3390 3399 10.1007/s12161-022-02366-4 C. Wang, X. Zhao, C. Gu, F. Xu, W. Zhang, X. Huang, et al. Fabrication of a versatile aptasensing chip for aflatoxin B1 in photothermal and electrochemical dual modes, Food Anal. Methods. 15 (2022), 3390–3399. https://doi.org/10.1007/s12161-022-02366-4. [52] B. Tang F.-X. Xiao An overview of solar-driven photoelectrochemical CO2 conversion to chemical fuels ACS Catal 12 2022 9023 9057 10.1021/acscatal.2c01667 B. Tang, F.-X. Xiao. An overview of solar-driven photoelectrochemical CO2 conversion to chemical fuels, ACS Catal. 12 (2022) 9023–9057. https://doi.org/10.1021/acscatal.2c01667. [53] M. Yuan X. Yan J.-N. Yuan P. Su Q. Chen F.-X. Xiao Maneuvering magic-sized transition metal chalcogenides nanoclusters for solar-to-hydrogen conversion J. Catal. 437 2024 115667 10.1016/j.jcat.2024.115667 M. Yuan, X. Yan, J.-N. Yuan, P. Su, Q. Chen, F.-X. Xiao. Maneuvering magic-sized transition metal chalcogenides nanoclusters for solar-to-hydrogen conversion, J. Catal. 437 (2024) 115667. https://doi.org/10.1016/j.jcat.2024.115667. [54] H. Gu R. Lv X. Huang Q. Chen Y. Dong Rapid quantitative assessment of lipid oxidation in a rapeseed oil-in-water (o/w) emulsion by three-dimensional fluorescence spectroscopy J. Food Compos. Anal. 114 2022 104762 10.1016/j.jfca.2022.104762 H. Gu, R. Lv, X. Huang, Q. Chen, Y. Dong. Rapid quantitative assessment of lipid oxidation in a rapeseed oil-in-water (o/w) emulsion by three-dimensional fluorescence spectroscopy, J. Food Compos. Anal. 114 (2022) 104762. https://doi.org/10.1016/j.jfca.2022.104762. [55] Q. Li F. Li X. Zhang H. Xia High efficient manganese‑nitrogen co-doped lignin-based carbon catalysts to activate peroxymonosulfate for the degradation of bisphenol A Diamond Relat. Mater. 139 2023 110260 10.1016/j.diamond.2023.110260 Q. Li, F. Li, X. Zhang, H. Xia. High efficient manganese‑nitrogen co-doped lignin-based carbon catalysts to activate peroxymonosulfate for the degradation of bisphenol A, Diamond Relat. Mater. 139 (2023) 110260. https://doi.org/10.1016/j.diamond.2023.110260. [56] Q. Zhang Y. Liu Y. Zheng Y. Guo Y. Huang L. He Boosting Li ion kinetics in H–Co3O4@CNT electrode by synergic design of CNT coating and hollow structure J J. Power Sources. 599 2024 234234 10.1016/j.jpowsour.2024.234234 Q. Zhang, Y. Liu, Y. Zheng, Y. Guo, Y. Huang, L. He, et al. Boosting Li ion kinetics in H–Co3O4@CNT electrode by synergic design of CNT coating and hollow structure, J J. Power Sources. 599 (2024) 234234. https://doi.org/10.1016/j.jpowsour.2024.234234. [57] Y. Qi Y. Chen H. Liu J. Zhao Y. Yu R. Wang Construction of highly hydrophilic PAN-co-IA/CNTs@TA composite membrane with large flux and high retention for purification of dye wastewater Chem. Eng. J. 487 2024 150752 10.1016/j.cej.2024.150752 Y. Qi, Y. Chen, H. Liu, J. Zhao, Y. Yu, R. Wang, et al. Construction of highly hydrophilic PAN-co-IA/CNTs@TA composite membrane with large flux and high retention for purification of dye wastewater, Chem. Eng. J. 487 (2024) 150752. https://doi.org/10.1016/j.cej.2024.150752. [58] V. Vinayagam K.N. Palani S. Ganesh S. Rajesh V.V. Akula R. Avoodaiappan Recent developments on advanced oxidation processes for degradation of pollutants from wastewater with focus on antibiotics and organic dyes Environ. Res. 240 2024 117500 10.1016/j.envres.2023.117500 V. Vinayagam, K.N. Palani, S. Ganesh, S. Rajesh, V.V. Akula, R. Avoodaiappan, et al. Recent developments on advanced oxidation processes for degradation of pollutants from wastewater with focus on antibiotics and organic dyes, Environ. Res. 240 (2024) 117500. https://doi.org/10.1016/j.envres.2023.117500. [59] M. Marimuthu S.S. Arumugam D. Sabarinathan H. Li Q. Chen Metal organic framework based fluorescence sensor for detection of antibiotics Trends Food Sci. Technol. 116 2021 1002 1028 10.1016/j.tifs.2021.08.022 M. Marimuthu, S.S. Arumugam, D. Sabarinathan, H. Li, Q. Chen. Metal organic framework based fluorescence sensor for detection of antibiotics, Trends Food Sci. Technol. 116 (2021) 1002–1028. https://doi.org/10.1016/j.tifs.2021.08.022. [60] M.A. Zazouli F. Ghanbari M. Yousefi S. Madihi-Bidgoli Photocatalytic degradation of food dye by Fe3O4–TiO2 nanoparticles in presence of peroxymonosulfate: the effect of UV sources J. Environ. Chem. Eng. 5 2017 2459 2468 10.1016/j.jece.2017.04.037 M.A. Zazouli, F. Ghanbari, M. Yousefi, S. Madihi-Bidgoli. Photocatalytic degradation of food dye by Fe3O4–TiO2 nanoparticles in presence of peroxymonosulfate: the effect of UV sources, J. Environ. Chem. Eng. 5 (2017) 2459–2468. https://doi.org/10.1016/j.jece.2017.04.037. [61] M. Liu H. Zhu R. Du W. Zhang W. Shi Z. Guo Constructing functional thermal-insulation-layer on Co3O4 nanosphere for reinforced local-microenvironment photothermal PMS activation in pollutant degradation J. Environ. Chem. Eng. 11 2023 109939 10.1016/j.jece.2023.109939 M. Liu, H. Zhu, R. Du, W. Zhang, W. Shi, Z. Guo, et al. Constructing functional thermal-insulation-layer on Co3O4 nanosphere for reinforced local-microenvironment photothermal PMS activation in pollutant degradation, J. Environ. Chem. Eng. 11 (2023) 109939. https://doi.org/10.1016/j.jece.2023.109939. [62] Y. Li T. Yang S. Qiu W. Lin J. Yan S. Fan Uniform N-coordinated single-atomic iron sites dispersed in porous carbon framework to activate PMS for efficient BPA degradation via high-valent iron-oxo species Chem. Eng. J. 389 2020 124382 10.1016/j.cej.2020.124382 Y. Li, T. Yang, S. Qiu, W. Lin, J. Yan, S. Fan, et al. Uniform N-coordinated single-atomic iron sites dispersed in porous carbon framework to activate PMS for efficient BPA degradation via high-valent iron-oxo species, Chem. Eng. J. 389 (2020) 124382. https://doi.org/10.1016/j.cej.2020.124382. [63] P. Wang Y. Zhang J. Zhu J. Wei J. Qi T. Cao Catalytic degradation of BPA by bamboo leaf-derived KOH-activated porous biocarbon loaded with CoFe2O4-activated peroxymonosulfate Chem. Eng. J. 492 2024 151886 10.1016/j.cej.2024.151886 P. Wang, Y. Zhang, J. Zhu, J. Wei, J. Qi, T. Cao, et al. Catalytic degradation of BPA by bamboo leaf-derived KOH-activated porous biocarbon loaded with CoFe2O4-activated peroxymonosulfate, Chem. Eng. J. 492 (2024) 151886. https://doi.org/10.1016/j.cej.2024.151886. [64] C. Zhong S. Zhang S. Yang B. Yuan Q. Xu Z. Xie Mo and N co-doped iron biochar materials activating peroxymonosulfate for enhanced degradation of bisphenol A: mechanism discussion and practical application Chem. Eng. J. 466 2023 143298 10.1016/j.cej.2023.143298 C. Zhong, S. Zhang, S. Yang, B. Yuan, Q. Xu, Z. Xie, et al. Mo and N co-doped iron biochar materials activating peroxymonosulfate for enhanced degradation of bisphenol A: mechanism discussion and practical application, Chem. Eng. J. 466 (2023) 143298. https://doi.org/10.1016/j.cej.2023.143298. [65] Y. Ding C. Pan X. Peng Q. Mao Y. Xiao L. Fu Deep mineralization of bisphenol A by catalytic peroxymonosulfate activation with nano CuO/Fe3O4 with strong Cu-Fe interaction Chem. Eng. J. 384 2020 123378 10.1016/j.cej.2019.123378 Y. Ding, C. Pan, X. Peng, Q. Mao, Y. Xiao, L. Fu, et al. Deep mineralization of bisphenol A by catalytic peroxymonosulfate activation with nano CuO/Fe3O4 with strong Cu-Fe interaction, Chem. Eng. J. 384 (2020) 123378. https://doi.org/10.1016/j.cej.2019.123378. [66] Y. Liu R. Luo Y. Li J. Qi C. Wang J. Li Sandwich-like Co3O4/MXene composite with enhanced catalytic performance for bisphenol A degradation Chem. Eng. J. 347 2018 731 740 10.1016/j.cej.2018.04.155 Y. Liu, R. Luo, Y. Li, J. Qi, C. Wang, J. Li, et al. Sandwich-like Co3O4/MXene composite with enhanced catalytic performance for bisphenol A degradation, Chem. Eng. J. 347 (2018) 731–740. https://doi.org/10.1016/j.cej.2018.04.155. [67] S. Xu L. Wen C. Yu S. Li J. Tang Activation of peroxymonosulfate by MnFe2O4@BC composite for bisphenol A degradation: the coexisting of free-radical and non-radical pathways Chem. Eng. J. 442 2022 136250 10.1016/j.cej.2022.136250 S. Xu, L. Wen, C. Yu, S. Li, J. Tang. Activation of peroxymonosulfate by MnFe2O4@BC composite for bisphenol A degradation: the coexisting of free-radical and non-radical pathways, Chem. Eng. J. 442 (2022) 136250. https://doi.org/10.1016/j.cej.2022.136250. [68] H.-Y. Zhu M.-T. Liu G. Wang R.-R. Du H.-Y. Zhao H. Lu Constructing core@shell structured photothermal nanosphere with thin carbon layer confined Co-Mn bimetals for pollutant degradation and solar interfacial water evaporation Rare Met 43 2024 1686 1701 10.1007/s12598-023-02499-3 H.-Y. Zhu, M.-T. Liu, G. Wang, R.-R. Du, H.-Y. Zhao, H. Lu, et al. Constructing core@shell structured photothermal nanosphere with thin carbon layer confined Co-Mn bimetals for pollutant degradation and solar interfacial water evaporation, Rare Met. 43 (2024) 1686–1701. https://doi.org/10.1007/s12598-023-02499-3. [69] H. Mo Y. Wang A bionic solar-driven interfacial evaporation system with a photothermal-photocatalytic hydrogel for VOC removal during solar distillation Water Res 226 2022 119276 10.1016/j.watres.2022.119276 H. Mo, Y. Wang. A bionic solar-driven interfacial evaporation system with a photothermal-photocatalytic hydrogel for VOC removal during solar distillation, Water Res. 226 (2022) 119276. https://doi.org/10.1016/j.watres.2022.119276. [70] S. Lin H. Qi P. Hou K. Liu Resource recovery from textile wastewater: dye, salt, and water regeneration using solar-driven interfacial evaporation J. Clean. Prod. 391 2023 136148 10.1016/j.jclepro.2023.136148 S. Lin, H. Qi, P. Hou, K. Liu. Resource recovery from textile wastewater: dye, salt, and water regeneration using solar-driven interfacial evaporation, J. Clean. Prod. 391 (2023) 136148. https://doi.org/10.1016/j.jclepro.2023.136148. [71] Y. Wu R. Kong C. Ma L. Li Y. Zheng Y. Lu Simulation-guided design of bamboo leaf-derived carbon-based high-efficiency evaporator for solar-driven interface water evaporation Energy Environ. Mater. 5 2022 1323 1331 10.1002/eem2.12251 Y. Wu, R. Kong, C. Ma, L. Li, Y. Zheng, Y. Lu, et al. Simulation-guided design of bamboo leaf-derived carbon-based high-efficiency evaporator for solar-driven interface water evaporation, Energy Environ. Mater. 5 (2022) 1323–1331. https://doi.org/10.1002/eem2.12251. [72] D. Wang X. Zhang C. Yang F. Qu J. Huang J. He Photocatalysis assisted solar-driven interfacial water evaporation: principles, advances and trends Sep. Purif. Technol. 360 2024 130975 10.1016/j.seppur.2024.130975 D. Wang, X. Zhang, C. Yang, F. Qu, J. Huang, J. He, et al. Photocatalysis assisted solar-driven interfacial water evaporation: principles, advances and trends, Sep. Purif. Technol. 360 (2024) 130975. https://doi.org/10.1016/j.seppur.2024.130975. [73] M.-Y. Qi M. Conte Z.-R. Tang Y.-J. Xu Engineering semiconductor quantum dots for selectivity switch on high-performance heterogeneous coupling photosynthesis ACS Nano 16 2022 17444 17453 10.1021/acsnano.2c08652 M.-Y. Qi, M. Conte, Z.-R. Tang, Y.-J. Xu. Engineering semiconductor quantum dots for selectivity switch on high-performance heterogeneous coupling photosynthesis, ACS Nano. 16 (2022) 17444–17453. https://doi.org/10.1021/acsnano.2c08652. [74] M.-Y. Qi Y.-H. Li F. Zhang Z.-R. Tang Y. Xiong Y.-J. Xu Switching light for site-directed spatial loading of cocatalysts onto heterojunction photocatalysts with boosted redox catalysis ACS Catal 10 2020 3194 3202 10.1021/acscatal.9b05420 M.-Y. Qi, Y.-H. Li, F. Zhang, Z.-R. Tang, Y. Xiong, Y.-J. Xu. Switching light for site-directed spatial loading of cocatalysts onto heterojunction photocatalysts with boosted redox catalysis, ACS Catal. 10 (2020) 3194–3202. https://doi.org/10.1021/acscatal.9b05420. [75] X. Hou R. Zhang D. Fang Flexible MCNTs cross-linked polyimide membranes with high light absorbance and hierarchical pore distribution for photo-thermal conversion in solar water evaporation Carbon 187 2022 310 320 10.1016/j.carbon.2021.11.002 X. Hou, R. Zhang, D. Fang. Flexible MCNTs cross-linked polyimide membranes with high light absorbance and hierarchical pore distribution for photo-thermal conversion in solar water evaporation, Carbon. 187 (2022) 310–320. https://doi.org/10.1016/j.carbon.2021.11.002. [76] Y. Li C. Fu Z. Wang L. Huang L. Chen G. Liao Novel cellulose-based films with highly efficient photothermal performance for sustainable solar evaporation and solar-thermal power generation J. Clean. Prod. 458 2024 142416 10.1016/j.jclepro.2024.142416 Y. Li, C. Fu, Z. Wang, L. Huang, L. Chen, G. Liao, et al. Novel cellulose-based films with highly efficient photothermal performance for sustainable solar evaporation and solar-thermal power generation, J. Clean. Prod. 458 (2024) 142416. https://doi.org/10.1016/j.jclepro.2024.142416. [77] J.-C. Yang L. Wu L. Wang R. Ren P. Chen C. Qi An efficient photothermal conversion material based on D-A type luminophore for solar-driven desalination Aggregate 5 2024 e535 10.1002/agt2.535 J.-C. Yang, L. Wu, L. Wang, R. Ren, P. Chen, C. Qi, et al. An efficient photothermal conversion material based on D-A type luminophore for solar-driven desalination, Aggregate. 5 (2024) e535. https://doi.org/10.1002/agt2.535. [78] G. Chen J. Sun Q. Peng Q. Sun G. Wang Y. Cai Biradical-featured stable organic-small-molecule photothermal materials for highly efficient solar-driven water evaporation Adv. Mater. 32 2020 1908537 10.1002/adma.201908537 G. Chen, J. Sun, Q. Peng, Q. Sun, G. Wang, Y. Cai, et al. Biradical-featured stable organic-small-molecule photothermal materials for highly efficient solar-driven water evaporation, Adv. Mater. 32 (2020) 1908537. https://doi.org/10.1002/adma.201908537. [79] W. Mu Y. Yu H. Sun Z. Zhu J. Li W. Liang Fabrication of ATP/PEG/MnO2NWs composite for solar steam generation with high conversion efficiency J. Colloid Interface Sci. 648 2023 916 924 10.1016/j.jcis.2023.06.063 W. Mu, Y. Yu, H. Sun, Z. Zhu, J. Li, W. Liang. Fabrication of ATP/PEG/MnO2NWs composite for solar steam generation with high conversion efficiency, J. Colloid Interface Sci. 648 (2023) 916–924. https://doi.org/10.1016/j.jcis.2023.06.063. [80] Z. Wu J. Li S. Zhang J. Yan J. Gao N. Zheng Chitosan assisted MXene decoration onto polymer fabric for high efficiency solar driven interfacial evaporation of oil contaminated seawater J. Colloid Interface Sci. 622 2022 169 180 10.1016/j.jcis.2022.04.074 Z. Wu, J. Li, S. Zhang, J. Yan, J. Gao, N. Zheng, et al. Chitosan assisted MXene decoration onto polymer fabric for high efficiency solar driven interfacial evaporation of oil contaminated seawater, J. Colloid Interface Sci. 622 (2022) 169–180. https://doi.org/10.1016/j.jcis.2022.04.074.",
      "scopus-id": "85219496906",
      "coredata": {
        "eid": "1-s2.0-S2468823125001804",
        "dc:description": "Photothermal hybrids composed of nanocarbon and metal species are promising in solar-driven photothermal conversion and later application of water purification. Herein, the photothermal hybrid with surface-polarized carbon nanotube (CNT) twined oxygen vacancy-engineered cuprous oxides was constructed. The surface polar oxygen and nitrogen moieties were introduced onto the CNT, enriching the surface polarity of the nanocarbon, which further twined the in-situ generated oxygen vacancy-engineered cuprous oxides. The constructed catalyst was endowed with abundant Cu(I) reactive sites and oxygen vacancy, providing the efficient trapping effect and enough exposed active sites to trigger improved peroxymonosulfate (PMS) activation. In addition, the obtained catalyst affords superior photothermal conversion efficiency, thereby showcasing the great potential in solar-driven water purification. Therefore, the catalyst shows excellent bisphenol A (BPA) degradation performance with a reaction rate constant of 0.47 min-1, and activation energy (Ea=9.38 kJ·mol-1).. The reaction mechanism study indicates the main contribution of singlet oxygen and superoxide radicals in the BPA degradation. More importantly, the obtained catalyst affords the excellent total organic carbon (TOC) removal ability for mixed contaminants, higher than that of single contaminant removal, which shows great potential for practical complicated wastewater purification. Finally, the obtained photothermal hybrids were anchored onto the tailored sponge through a hydrogel tethering strategy, which acts as a monolith evaporator to enable cleanwater regeneration and contaminant degradation.",
        "openArchiveArticle": "false",
        "prism:coverDate": "2025-05-01",
        "openaccessUserLicense": null,
        "prism:aggregationType": "Journal",
        "prism:url": "https://api.elsevier.com/content/article/pii/S2468823125001804",
        "dc:creator": [
          {
            "@_fa": "true",
            "$": "Gao, Yarao"
          },
          {
            "@_fa": "true",
            "$": "Zhao, Hongyao"
          },
          {
            "@_fa": "true",
            "$": "Liu, Mengting"
          },
          {
            "@_fa": "true",
            "$": "Wang, Yanyun"
          },
          {
            "@_fa": "true",
            "$": "Zhang, Yangping"
          },
          {
            "@_fa": "true",
            "$": "Zhai, Linzhi"
          },
          {
            "@_fa": "true",
            "$": "Liu, Xiang"
          },
          {
            "@_fa": "true",
            "$": "Zeng, Feng"
          },
          {
            "@_fa": "true",
            "$": "Pan, Jianming"
          },
          {
            "@_fa": "true",
            "$": "Shang, Danhong"
          },
          {
            "@_fa": "true",
            "$": "Yang, Fu"
          }
        ],
        "link": [
          {
            "@_fa": "true",
            "@rel": "self",
            "@href": "https://api.elsevier.com/content/article/pii/S2468823125001804"
          },
          {
            "@_fa": "true",
            "@rel": "scidir",
            "@href": "https://www.sciencedirect.com/science/article/pii/S2468823125001804"
          }
        ],
        "dc:format": "application/json",
        "openaccessType": null,
        "pii": "S2468-8231(25)00180-4",
        "prism:volume": "578",
        "articleNumber": "114994",
        "prism:publisher": "Elsevier B.V. All rights are reserved, including those for text and data mining, AI training, and similar technologies.",
        "dc:title": "Construction of photothermal hybrid with surface-polarized carbon nanotube twined oxygen-vacancy engineered cuprous oxide for improved PMS activation and water purification",
        "prism:copyright": "© 2025 Elsevier B.V. All rights are reserved, including those for text and data mining, AI training, and similar technologies.",
        "openaccess": "0",
        "prism:issn": "24688231",
        "dcterms:subject": [
          {
            "@_fa": "true",
            "$": "Photothermal hybrid"
          },
          {
            "@_fa": "true",
            "$": "Cuprous oxides"
          },
          {
            "@_fa": "true",
            "$": "Oxygen vacancy"
          },
          {
            "@_fa": "true",
            "$": "Pollutants degradation"
          },
          {
            "@_fa": "true",
            "$": "Monolith evaporator"
          }
        ],
        "openaccessArticle": "false",
        "prism:publicationName": "Molecular Catalysis",
        "openaccessSponsorType": null,
        "prism:pageRange": "114994",
        "pubType": "fla",
        "prism:coverDisplayDate": "1 May 2025",
        "prism:doi": "10.1016/j.mcat.2025.114994",
        "prism:startingPage": "114994",
        "dc:identifier": "doi:10.1016/j.mcat.2025.114994",
        "openaccessSponsorName": null
      },
      "objects": {
        "object": [
          {
            "@category": "standard",
            "@height": "235",
            "@width": "655",
            "@_fa": "true",
            "$": "https://api.elsevier.com/content/object/eid/1-s2.0-S2468823125001804-gr3.jpg?httpAccept=%2A%2F%2A",
            "@multimediatype": "JPEG image file",
            "@type": "IMAGE-DOWNSAMPLED",
            "@size": "46306",
            "@ref": "gr3",
            "@mimetype": "image/jpeg"
          },
          {
            "@category": "standard",
            "@height": "436",
            "@width": "781",
            "@_fa": "true",
            "$": "https://api.elsevier.com/content/object/eid/1-s2.0-S2468823125001804-gr2.jpg?httpAccept=%2A%2F%2A",
            "@multimediatype": "JPEG image file",
            "@type": "IMAGE-DOWNSAMPLED",
            "@size": "94826",
            "@ref": "gr2",
            "@mimetype": "image/jpeg"
          },
          {
            "@category": "standard",
            "@height": "200",
            "@width": "411",
            "@_fa": "true",
            "$": "https://api.elsevier.com/content/object/eid/1-s2.0-S2468823125001804-ga1.jpg?httpAccept=%2A%2F%2A",
            "@multimediatype": "JPEG image file",
            "@type": "IMAGE-DOWNSAMPLED",
            "@size": "43873",
            "@ref": "ga1",
            "@mimetype": "image/jpeg"
          },
          {
            "@category": "standard",
            "@height": "435",
            "@width": "640",
            "@_fa": "true",
            "$": "https://api.elsevier.com/content/object/eid/1-s2.0-S2468823125001804-gr1.jpg?httpAccept=%2A%2F%2A",
            "@multimediatype": "JPEG image file",
            "@type": "IMAGE-DOWNSAMPLED",
            "@size": "152427",
            "@ref": "gr1",
            "@mimetype": "image/jpeg"
          },
          {
            "@category": "standard",
            "@height": "689",
            "@width": "715",
            "@_fa": "true",
            "$": "https://api.elsevier.com/content/object/eid/1-s2.0-S2468823125001804-gr7.jpg?httpAccept=%2A%2F%2A",
            "@multimediatype": "JPEG image file",
            "@type": "IMAGE-DOWNSAMPLED",
            "@size": "176858",
            "@ref": "gr7",
            "@mimetype": "image/jpeg"
          },
          {
            "@category": "standard",
            "@height": "639",
            "@width": "645",
            "@_fa": "true",
            "$": "https://api.elsevier.com/content/object/eid/1-s2.0-S2468823125001804-gr6.jpg?httpAccept=%2A%2F%2A",
            "@multimediatype": "JPEG image file",
            "@type": "IMAGE-DOWNSAMPLED",
            "@size": "126009",
            "@ref": "gr6",
            "@mimetype": "image/jpeg"
          },
          {
            "@category": "standard",
            "@height": "374",
            "@width": "644",
            "@_fa": "true",
            "$": "https://api.elsevier.com/content/object/eid/1-s2.0-S2468823125001804-gr5.jpg?httpAccept=%2A%2F%2A",
            "@multimediatype": "JPEG image file",
            "@type": "IMAGE-DOWNSAMPLED",
            "@size": "75851",
            "@ref": "gr5",
            "@mimetype": "image/jpeg"
          },
          {
            "@category": "standard",
            "@height": "349",
            "@width": "489",
            "@_fa": "true",
            "$": "https://api.elsevier.com/content/object/eid/1-s2.0-S2468823125001804-gr4.jpg?httpAccept=%2A%2F%2A",
            "@multimediatype": "JPEG image file",
            "@type": "IMAGE-DOWNSAMPLED",
            "@size": "81598",
            "@ref": "gr4",
            "@mimetype": "image/jpeg"
          },
          {
            "@category": "standard",
            "@height": "732",
            "@width": "781",
            "@_fa": "true",
            "$": "https://api.elsevier.com/content/object/eid/1-s2.0-S2468823125001804-gr8.jpg?httpAccept=%2A%2F%2A",
            "@multimediatype": "JPEG image file",
            "@type": "IMAGE-DOWNSAMPLED",
            "@size": "187245",
            "@ref": "gr8",
            "@mimetype": "image/jpeg"
          },
          {
            "@category": "thumbnail",
            "@height": "79",
            "@width": "219",
            "@_fa": "true",
            "$": "https://api.elsevier.com/content/object/eid/1-s2.0-S2468823125001804-gr3.sml?httpAccept=%2A%2F%2A",
            "@multimediatype": "GIF image file",
            "@type": "IMAGE-THUMBNAIL",
            "@size": "8171",
            "@ref": "gr3",
            "@mimetype": "image/gif"
          },
          {
            "@category": "thumbnail",
            "@height": "122",
            "@width": "219",
            "@_fa": "true",
            "$": "https://api.elsevier.com/content/object/eid/1-s2.0-S2468823125001804-gr2.sml?httpAccept=%2A%2F%2A",
            "@multimediatype": "GIF image file",
            "@type": "IMAGE-THUMBNAIL",
            "@size": "12459",
            "@ref": "gr2",
            "@mimetype": "image/gif"
          },
          {
            "@category": "thumbnail",
            "@height": "106",
            "@width": "219",
            "@_fa": "true",
            "$": "https://api.elsevier.com/content/object/eid/1-s2.0-S2468823125001804-ga1.sml?httpAccept=%2A%2F%2A",
            "@multimediatype": "GIF image file",
            "@type": "IMAGE-THUMBNAIL",
            "@size": "20689",
            "@ref": "ga1",
            "@mimetype": "image/gif"
          },
          {
            "@category": "thumbnail",
            "@height": "149",
            "@width": "219",
            "@_fa": "true",
            "$": "https://api.elsevier.com/content/object/eid/1-s2.0-S2468823125001804-gr1.sml?httpAccept=%2A%2F%2A",
            "@multimediatype": "GIF image file",
            "@type": "IMAGE-THUMBNAIL",
            "@size": "27465",
            "@ref": "gr1",
            "@mimetype": "image/gif"
          },
          {
            "@category": "thumbnail",
            "@height": "164",
            "@width": "170",
            "@_fa": "true",
            "$": "https://api.elsevier.com/content/object/eid/1-s2.0-S2468823125001804-gr7.sml?httpAccept=%2A%2F%2A",
            "@multimediatype": "GIF image file",
            "@type": "IMAGE-THUMBNAIL",
            "@size": "15067",
            "@ref": "gr7",
            "@mimetype": "image/gif"
          },
          {
            "@category": "thumbnail",
            "@height": "164",
            "@width": "165",
            "@_fa": "true",
            "$": "https://api.elsevier.com/content/object/eid/1-s2.0-S2468823125001804-gr6.sml?httpAccept=%2A%2F%2A",
            "@multimediatype": "GIF image file",
            "@type": "IMAGE-THUMBNAIL",
            "@size": "11813",
            "@ref": "gr6",
            "@mimetype": "image/gif"
          },
          {
            "@category": "thumbnail",
            "@height": "127",
            "@width": "219",
            "@_fa": "true",
            "$": "https://api.elsevier.com/content/object/eid/1-s2.0-S2468823125001804-gr5.sml?httpAccept=%2A%2F%2A",
            "@multimediatype": "GIF image file",
            "@type": "IMAGE-THUMBNAIL",
            "@size": "12790",
            "@ref": "gr5",
            "@mimetype": "image/gif"
          },
          {
            "@category": "thumbnail",
            "@height": "156",
            "@width": "219",
            "@_fa": "true",
            "$": "https://api.elsevier.com/content/object/eid/1-s2.0-S2468823125001804-gr4.sml?httpAccept=%2A%2F%2A",
            "@multimediatype": "GIF image file",
            "@type": "IMAGE-THUMBNAIL",
            "@size": "24158",
            "@ref": "gr4",
            "@mimetype": "image/gif"
          },
          {
            "@category": "thumbnail",
            "@height": "164",
            "@width": "175",
            "@_fa": "true",
            "$": "https://api.elsevier.com/content/object/eid/1-s2.0-S2468823125001804-gr8.sml?httpAccept=%2A%2F%2A",
            "@multimediatype": "GIF image file",
            "@type": "IMAGE-THUMBNAIL",
            "@size": "23294",
            "@ref": "gr8",
            "@mimetype": "image/gif"
          },
          {
            "@category": "high",
            "@height": "1041",
            "@width": "2900",
            "@_fa": "true",
            "$": "https://api.elsevier.com/content/object/eid/1-s2.0-S2468823125001804-gr3_lrg.jpg?httpAccept=%2A%2F%2A",
            "@multimediatype": "JPEG image file",
            "@type": "IMAGE-HIGH-RES",
            "@size": "336857",
            "@ref": "gr3",
            "@mimetype": "image/jpeg"
          },
          {
            "@category": "high",
            "@height": "1929",
            "@width": "3458",
            "@_fa": "true",
            "$": "https://api.elsevier.com/content/object/eid/1-s2.0-S2468823125001804-gr2_lrg.jpg?httpAccept=%2A%2F%2A",
            "@multimediatype": "JPEG image file",
            "@type": "IMAGE-HIGH-RES",
            "@size": "696298",
            "@ref": "gr2",
            "@mimetype": "image/jpeg"
          },
          {
            "@category": "high",
            "@height": "886",
            "@width": "1822",
            "@_fa": "true",
            "$": "https://api.elsevier.com/content/object/eid/1-s2.0-S2468823125001804-ga1_lrg.jpg?httpAccept=%2A%2F%2A",
            "@multimediatype": "JPEG image file",
            "@type": "IMAGE-HIGH-RES",
            "@size": "359638",
            "@ref": "ga1",
            "@mimetype": "image/jpeg"
          },
          {
            "@category": "high",
            "@height": "1926",
            "@width": "2833",
            "@_fa": "true",
            "$": "https://api.elsevier.com/content/object/eid/1-s2.0-S2468823125001804-gr1_lrg.jpg?httpAccept=%2A%2F%2A",
            "@multimediatype": "JPEG image file",
            "@type": "IMAGE-HIGH-RES",
            "@size": "1561992",
            "@ref": "gr1",
            "@mimetype": "image/jpeg"
          },
          {
            "@category": "high",
            "@height": "3052",
            "@width": "3167",
            "@_fa": "true",
            "$": "https://api.elsevier.com/content/object/eid/1-s2.0-S2468823125001804-gr7_lrg.jpg?httpAccept=%2A%2F%2A",
            "@multimediatype": "JPEG image file",
            "@type": "IMAGE-HIGH-RES",
            "@size": "1300761",
            "@ref": "gr7",
            "@mimetype": "image/jpeg"
          },
          {
            "@category": "high",
            "@height": "2833",
            "@width": "2858",
            "@_fa": "true",
            "$": "https://api.elsevier.com/content/object/eid/1-s2.0-S2468823125001804-gr6_lrg.jpg?httpAccept=%2A%2F%2A",
            "@multimediatype": "JPEG image file",
            "@type": "IMAGE-HIGH-RES",
            "@size": "930080",
            "@ref": "gr6",
            "@mimetype": "image/jpeg"
          },
          {
            "@category": "high",
            "@height": "1657",
            "@width": "2850",
            "@_fa": "true",
            "$": "https://api.elsevier.com/content/object/eid/1-s2.0-S2468823125001804-gr5_lrg.jpg?httpAccept=%2A%2F%2A",
            "@multimediatype": "JPEG image file",
            "@type": "IMAGE-HIGH-RES",
            "@size": "621877",
            "@ref": "gr5",
            "@mimetype": "image/jpeg"
          },
          {
            "@category": "high",
            "@height": "1546",
            "@width": "2167",
            "@_fa": "true",
            "$": "https://api.elsevier.com/content/object/eid/1-s2.0-S2468823125001804-gr4_lrg.jpg?httpAccept=%2A%2F%2A",
            "@multimediatype": "JPEG image file",
            "@type": "IMAGE-HIGH-RES",
            "@size": "681579",
            "@ref": "gr4",
            "@mimetype": "image/jpeg"
          },
          {
            "@category": "high",
            "@height": "3241",
            "@width": "3458",
            "@_fa": "true",
            "$": "https://api.elsevier.com/content/object/eid/1-s2.0-S2468823125001804-gr8_lrg.jpg?httpAccept=%2A%2F%2A",
            "@multimediatype": "JPEG image file",
            "@type": "IMAGE-HIGH-RES",
            "@size": "1421345",
            "@ref": "gr8",
            "@mimetype": "image/jpeg"
          },
          {
            "@category": "standard",
            "@_fa": "true",
            "$": "https://api.elsevier.com/content/object/eid/1-s2.0-S2468823125001804-mmc1.docx?httpAccept=%2A%2F%2A",
            "@multimediatype": "Microsoft Word file",
            "@type": "APPLICATION",
            "@size": "3392690",
            "@ref": "mmc1",
            "@mimetype": "application/word"
          }
        ]
      },
      "link": {
        "@rel": "abstract",
        "@href": "https://api.elsevier.com/content/abstract/scopus_id/85219496906"
      }
    }
  }
}