{
  "metadata": {
    "title": "Efficient fixation of CO<ce:inf loc=post>2</ce:inf> with epoxides catalyzed by Mg(II)-N4 complexes",
    "authors": "; ; ",
    "journal": "Molecular Catalysis",
    "date": "2025-05-15",
    "doi": "10.1016/j.mcat.2025.115090",
    "abstract": "",
    "uri": "https://api.elsevier.com/content/article/pii/S2468823125002767",
    "pii": "S2468823125002767"
  },
  "fulltext": {
    "full-text-retrieval-response": {
      "scopus-eid": "2-s2.0-105001655970",
      "originalText": "serial JL 315758 291210 291744 291790 291809 31 Molecular Catalysis MOLECULARCATALYSIS 2025-04-04 2025-04-04 2025-04-04 2025-04-04 2025-04-12T03:56:21 1-s2.0-S2468823125002767 S2468-8231(25)00276-7 S2468823125002767 10.1016/j.mcat.2025.115090 S300 S300.1 FULL-TEXT 1-s2.0-S2468823125X00067 2025-04-12T03:20:31.354505Z 0 0 20250515 2025 2025-04-04T08:22:08.943699Z absattachment articleinfo articlenumber articletitlenorm authfirstinitialnorm authfirstsurnamenorm cid cids contenttype copyright crossmark dateloaded dateloadedtxt datesearch datesort dateupdated dco docsubtype doctype doi eid ewtransactionid hubeid indexeddate issn issnnorm itemstage itemtransactionid itemweight openaccess openarchive pg pgfirst pii piinorm pubdatestart pubdatetxt pubyr sectiontitle sortorder srctitle srctitlenorm srctype ssids alllist content subj subheadings suppl tomb volfirst volissue volumelist webpdf webpdfpagecount yearnav figure table e-component body acknowledge affil appendices articletitle auth authfirstini authfull authkeywords authlast grantnumber grantsponsor grantsponsorid highlightsabst orcid primabst ref specialabst 2468-8231 24688231 true 579 579 C Volume 579 39 115090 115090 115090 20250515 15 May 2025 2025-05-15 2025 Regular Papers article fla © 2025 Elsevier B.V. All rights are reserved, including those for text and data mining, AI training, and similar technologies. EFFICIENTFIXATIONCO2EPOXIDESCATALYZEDBYMGIIN4COMPLEXES XIA C 1 Introduction 2 Results and discussion 2.1 Synthesis and characterization of Mg(ii) complexes 2.2 Evaluation of catalytic activity 2.3 Reusability of Mg(ii)-N4 catalyst 2.4 Reaction mechanism 3 Conclusions CRediT authorship contribution statement Appendix Supplementary materials References WEI 2021 112 118 Y EYITAYO 2024 119713 S CASTROPARDO 2022 227 270 S SAKAKURA 2007 2365 2387 T TAKHTRAVANCHI 2021 172 194 M CENTI 2009 191 205 G HASAN 2021 12427 12430 M SONG 2017 3707 3728 Q WANG 2024 127252 P HE 2013 9620 9633 M HE 2022 e202112835 M LIU 2015 5933 Q OMAE 2012 1384 1405 I DALLE 2019 2752 2875 K OVERA 2022 638 648 S MARTIN 2015 1353 1370 C MISHRA 2024 100796 V GHORAI 2024 113720 S KEMP 2014 249 260 T YADAV 2019 724 754 N GUO 2016 1 5 W KHAN 2014 6557 6560 A CAI 2016 14194 14197 A SCHAFFNER 2010 4554 4581 B SU 2019 284 292 C YOU 2022 8584 8593 D COKOJA 2011 8510 8537 M ROCHA 2016 29 39 C CAO 2012 416 424 T PENG 2001 639 641 J LIU 2016 2851 2863 M SONG 2019 9489 9497 H XU 2025 130922 Z COMERFORD 2015 1966 1987 J MARTIN 2015 1353 1370 C DECORTES 2010 9822 9837 A PRASAD 2022 356 443 D DAI 2021 618 626 Z EMA 2014 15270 15279 T YANG 2021 4434 4448 G JIANG 2016 3567 3576 X BAI 2012 1752 1758 D QIN 2015 2853 2858 Y LUO 2021 R LIU 2021 29522 29531 L MAEDA 2015 134 138 C WANG 2017 4523 4528 W VALENTINO 2023 115143 L TAORMINA 2024 102875 B VICENS 2020 8611 8631 L SUN 2019 2370 2381 W OTTENBACHER 2018 78 90 R XIAO 2023 1553 1633 X KAVEEN 2021 119395 K WANG 2023 10386 10393 B WANG 2024 9156 9163 B WHITE 2001 7194 7195 M COSTAS 2002 2179 2181 M MASBALLESTE 2006 7489 7500 R HONG 2011 11876 11879 S LIN 2020 11857 11863 J CAMPISCIANO 2020 132 140 V WHITEOAK 2013 2233 2239 C DELLAMONICA 2016 3231 3243 F RULEV 2016 216 222 Y CHEN 2021 16210 16219 J MAYER 1975 1235 1257 U MA 2016 226 231 R XIAX2025X115090 XIAX2025X115090XC 2027-04-04T00:00:00.000Z 2027-04-04T00:00:00.000Z http://creativecommons.org/licenses/by-nc-nd/4.0/ © 2025 Elsevier B.V. All rights are reserved, including those for text and data mining, AI training, and similar technologies. 2025-04-06T01:29:47.548Z http://vtw.elsevier.com/data/voc/AddOnTypes/50.7/aggregated-refined Major Project of Gansu Province 22ZD6GA003 Lanzhou Institute of Chemical Physics LICP, CAS Lanzhou Institute of Chemical Physics, Chinese Academy of Sciences http://data.elsevier.com/vocabulary/SciValFunders/501100011192 http://sws.geonames.org/1814991/ CAS CAS Chinese Academy of Sciences http://data.elsevier.com/vocabulary/SciValFunders/501100002367 http://sws.geonames.org/1814991/ National Natural Science Foundation of China 22361142751 22372183 22302213 National Natural Science Foundation of China http://data.elsevier.com/vocabulary/SciValFunders/501100001809 http://sws.geonames.org/1814991 We acknowledge financial support of this work from the National Natural Science Foundation of China (no. 22361142751, 22372183, 22302213), the Major Project of Gansu Province, China (no. 22ZD6GA003), and the Major Program of the Lanzhou Institute of Chemical Physics, CAS. https://doi.org/10.15223/policy-017 https://doi.org/10.15223/policy-037 https://doi.org/10.15223/policy-012 https://doi.org/10.15223/policy-029 https://doi.org/10.15223/policy-004 item S2468-8231(25)00276-7 S2468823125002767 1-s2.0-S2468823125002767 10.1016/j.mcat.2025.115090 315758 2025-04-12T03:20:31.354505Z 2025-05-15 1-s2.0-S2468823125002767-main.pdf https://s3-eu-west-1.amazonaws.com/prod-ucs-content-store-eu-west/content/pii:S2468823125002767/MAIN/application/pdf/6f93c6656a0abe55f8808f36b143bd95/main.pdf main.pdf pdf true 1455274 MAIN 8 1-s2.0-S2468823125002767-main_1.png https://s3-eu-west-1.amazonaws.com/prod-ucs-content-store-eu-west/content/pii:S2468823125002767/PREVIEW/image/png/0256780221438e029dd0b1c876519ecb/main_1.png main_1.png png 62247 849 656 IMAGE-WEB-PDF 1 1-s2.0-S2468823125002767-gr6.jpg https://s3-eu-west-1.amazonaws.com/prod-ucs-content-store-eu-west/content/pii:S2468823125002767/gr6/DOWNSAMPLED/image/jpeg/7aa77fec563f25d27edb1325670b4e54/gr6.jpg gr6 gr6.jpg jpg 29967 446 454 IMAGE-DOWNSAMPLED 1-s2.0-S2468823125002767-gr5.jpg https://s3-eu-west-1.amazonaws.com/prod-ucs-content-store-eu-west/content/pii:S2468823125002767/gr5/DOWNSAMPLED/image/jpeg/25669b8c2bb3b377c1e7fd698ca76e60/gr5.jpg gr5 gr5.jpg jpg 24421 372 452 IMAGE-DOWNSAMPLED 1-s2.0-S2468823125002767-fx1.jpg https://s3-eu-west-1.amazonaws.com/prod-ucs-content-store-eu-west/content/pii:S2468823125002767/fx1/DOWNSAMPLED/image/jpeg/5995ca40cf71ab587ef35a1ed28d345f/fx1.jpg fx1 fx1.jpg jpg 8153 88 345 IMAGE-DOWNSAMPLED 1-s2.0-S2468823125002767-fx2.jpg https://s3-eu-west-1.amazonaws.com/prod-ucs-content-store-eu-west/content/pii:S2468823125002767/fx2/DOWNSAMPLED/image/jpeg/0bc7c5222a6c7d28a9cf8b4a9e5cf037/fx2.jpg fx2 fx2.jpg jpg 59963 715 640 IMAGE-DOWNSAMPLED 1-s2.0-S2468823125002767-gr2.jpg https://s3-eu-west-1.amazonaws.com/prod-ucs-content-store-eu-west/content/pii:S2468823125002767/gr2/DOWNSAMPLED/image/jpeg/042045cd031892af175d1b5a508358bf/gr2.jpg gr2 gr2.jpg jpg 36640 337 645 IMAGE-DOWNSAMPLED 1-s2.0-S2468823125002767-ga1.jpg https://s3-eu-west-1.amazonaws.com/prod-ucs-content-store-eu-west/content/pii:S2468823125002767/ga1/DOWNSAMPLED/image/jpeg/2574bf82a45365c042ef810a20d70823/ga1.jpg ga1 true ga1.jpg jpg 30696 200 482 IMAGE-DOWNSAMPLED 1-s2.0-S2468823125002767-gr1.jpg https://s3-eu-west-1.amazonaws.com/prod-ucs-content-store-eu-west/content/pii:S2468823125002767/gr1/DOWNSAMPLED/image/jpeg/459877ee489a3cd4d766378c0cb3b0df/gr1.jpg gr1 gr1.jpg jpg 71185 519 725 IMAGE-DOWNSAMPLED 1-s2.0-S2468823125002767-gr4.jpg https://s3-eu-west-1.amazonaws.com/prod-ucs-content-store-eu-west/content/pii:S2468823125002767/gr4/DOWNSAMPLED/image/jpeg/3162c58f7dbdc1cdef5a59e5b982a096/gr4.jpg gr4 gr4.jpg jpg 19678 340 208 IMAGE-DOWNSAMPLED 1-s2.0-S2468823125002767-gr3.jpg https://s3-eu-west-1.amazonaws.com/prod-ucs-content-store-eu-west/content/pii:S2468823125002767/gr3/DOWNSAMPLED/image/jpeg/9cb9a5475b3e7fd19b6ad297ccc4eff8/gr3.jpg gr3 gr3.jpg jpg 54806 752 358 IMAGE-DOWNSAMPLED 1-s2.0-S2468823125002767-gr6.sml https://s3-eu-west-1.amazonaws.com/prod-ucs-content-store-eu-west/content/pii:S2468823125002767/gr6/THUMBNAIL/image/gif/1ed13abc25396e2414044cc168abba20/gr6.sml gr6 gr6.sml sml 6216 164 167 IMAGE-THUMBNAIL 1-s2.0-S2468823125002767-gr5.sml https://s3-eu-west-1.amazonaws.com/prod-ucs-content-store-eu-west/content/pii:S2468823125002767/gr5/THUMBNAIL/image/gif/1b2eda1208bfa1cdeb5537de71e9aacf/gr5.sml gr5 gr5.sml sml 6576 164 199 IMAGE-THUMBNAIL 1-s2.0-S2468823125002767-fx1.sml https://s3-eu-west-1.amazonaws.com/prod-ucs-content-store-eu-west/content/pii:S2468823125002767/fx1/THUMBNAIL/image/gif/a44780495d55ee7980693d86732b85b1/fx1.sml fx1 fx1.sml sml 4276 56 219 IMAGE-THUMBNAIL 1-s2.0-S2468823125002767-fx2.sml https://s3-eu-west-1.amazonaws.com/prod-ucs-content-store-eu-west/content/pii:S2468823125002767/fx2/THUMBNAIL/image/gif/6524ee1c908ac8ec3e0eb52ae97ac0e8/fx2.sml fx2 fx2.sml sml 3932 164 147 IMAGE-THUMBNAIL 1-s2.0-S2468823125002767-gr2.sml https://s3-eu-west-1.amazonaws.com/prod-ucs-content-store-eu-west/content/pii:S2468823125002767/gr2/THUMBNAIL/image/gif/59d4aaf9df94aa916e8351d45b39514e/gr2.sml gr2 gr2.sml sml 4793 114 219 IMAGE-THUMBNAIL 1-s2.0-S2468823125002767-ga1.sml https://s3-eu-west-1.amazonaws.com/prod-ucs-content-store-eu-west/content/pii:S2468823125002767/ga1/THUMBNAIL/image/gif/346f4d3f1ba4cfdba158819ba850c53b/ga1.sml ga1 true ga1.sml sml 7422 91 219 IMAGE-THUMBNAIL 1-s2.0-S2468823125002767-gr1.sml https://s3-eu-west-1.amazonaws.com/prod-ucs-content-store-eu-west/content/pii:S2468823125002767/gr1/THUMBNAIL/image/gif/404643267441cc14007f95d97da7247d/gr1.sml gr1 gr1.sml sml 8762 157 219 IMAGE-THUMBNAIL 1-s2.0-S2468823125002767-gr4.sml https://s3-eu-west-1.amazonaws.com/prod-ucs-content-store-eu-west/content/pii:S2468823125002767/gr4/THUMBNAIL/image/gif/99fa4aa87aadb0f0b2c7f91d64b428b5/gr4.sml gr4 gr4.sml sml 8287 164 100 IMAGE-THUMBNAIL 1-s2.0-S2468823125002767-gr3.sml https://s3-eu-west-1.amazonaws.com/prod-ucs-content-store-eu-west/content/pii:S2468823125002767/gr3/THUMBNAIL/image/gif/a820b2fb352a285a2e41767f60eab9b4/gr3.sml gr3 gr3.sml sml 5443 164 78 IMAGE-THUMBNAIL 1-s2.0-S2468823125002767-gr6_lrg.jpg https://s3-eu-west-1.amazonaws.com/prod-ucs-content-store-eu-west/content/pii:S2468823125002767/HIGHRES/image/jpeg/fafeb00416dd40eebb1d611a73f9f46a/gr6_lrg.jpg gr6 gr6_lrg.jpg jpg 210458 1973 2010 IMAGE-HIGH-RES 1-s2.0-S2468823125002767-gr5_lrg.jpg https://s3-eu-west-1.amazonaws.com/prod-ucs-content-store-eu-west/content/pii:S2468823125002767/HIGHRES/image/jpeg/0994ccf6e1a8de4721653e0c2920221b/gr5_lrg.jpg gr5 gr5_lrg.jpg jpg 145467 1647 2000 IMAGE-HIGH-RES 1-s2.0-S2468823125002767-fx1_lrg.jpg https://s3-eu-west-1.amazonaws.com/prod-ucs-content-store-eu-west/content/pii:S2468823125002767/HIGHRES/image/jpeg/b0e1d9a78b71973b5400f32d3ac3a588/fx1_lrg.jpg fx1 fx1_lrg.jpg jpg 42652 390 1527 IMAGE-HIGH-RES 1-s2.0-S2468823125002767-fx2_lrg.jpg https://s3-eu-west-1.amazonaws.com/prod-ucs-content-store-eu-west/content/pii:S2468823125002767/HIGHRES/image/jpeg/2e78df79d460b575c68ad2d0f5534d5e/fx2_lrg.jpg fx2 fx2_lrg.jpg jpg 469561 3163 2833 IMAGE-HIGH-RES 1-s2.0-S2468823125002767-gr2_lrg.jpg https://s3-eu-west-1.amazonaws.com/prod-ucs-content-store-eu-west/content/pii:S2468823125002767/HIGHRES/image/jpeg/29a1307b1dea73bc78602dbabee188d5/gr2_lrg.jpg gr2 gr2_lrg.jpg jpg 274210 1491 2855 IMAGE-HIGH-RES 1-s2.0-S2468823125002767-ga1_lrg.jpg https://s3-eu-west-1.amazonaws.com/prod-ucs-content-store-eu-west/content/pii:S2468823125002767/HIGHRES/image/jpeg/c8c29fd21ab0907ef222eb4cf9a8966c/ga1_lrg.jpg ga1 true ga1_lrg.jpg jpg 197794 886 2133 IMAGE-HIGH-RES 1-s2.0-S2468823125002767-gr1_lrg.jpg https://s3-eu-west-1.amazonaws.com/prod-ucs-content-store-eu-west/content/pii:S2468823125002767/HIGHRES/image/jpeg/a86c0f54001ceddbc701b68545ce2a07/gr1_lrg.jpg gr1 gr1_lrg.jpg jpg 560900 2297 3211 IMAGE-HIGH-RES 1-s2.0-S2468823125002767-gr4_lrg.jpg https://s3-eu-west-1.amazonaws.com/prod-ucs-content-store-eu-west/content/pii:S2468823125002767/HIGHRES/image/jpeg/5c3dbabe52abe2efec7cf8d6847190ae/gr4_lrg.jpg gr4 gr4_lrg.jpg jpg 162061 1512 924 IMAGE-HIGH-RES 1-s2.0-S2468823125002767-gr3_lrg.jpg https://s3-eu-west-1.amazonaws.com/prod-ucs-content-store-eu-west/content/pii:S2468823125002767/HIGHRES/image/jpeg/5013fb565c3312f5c38f52850ee2a6f8/gr3_lrg.jpg gr3 gr3_lrg.jpg jpg 459630 3333 1586 IMAGE-HIGH-RES 1-s2.0-S2468823125002767-mmc1.docx https://s3-eu-west-1.amazonaws.com/prod-ucs-content-store-eu-west/content/pii:S2468823125002767/mmc1/MAIN/application/vnd.openxmlformats-officedocument.wordprocessingml.document/e14bf4b92d7e27b2bdab77eeb883aa5a/mmc1.docx mmc1 mmc1.docx docx 3777759 APPLICATION MCAT 115090 115090 S2468-8231(25)00276-7 10.1016/j.mcat.2025.115090 Elsevier B.V. Fig. 1 Previously reported Mg(TPP)-based catalysts. Fig 1 Fig. 2 Structures of magnesium (II) complexes. Fig 2 Fig. 3 (a) 1H NMR spectrum of the MEP ligand in chloroform-d, (b) 1H NMR spectrum of Mg-1 in methanol-d, (c) 1H NMR spectrum of Me2NMEP ligand in chloroform-d, and (d) 1H NMR spectrum of Mg-1 in methanol-d, (d) structures of cis-α Mg-1, cis-β Mg-1 and trans Mg-1. Fig 3 Fig. 4 Crystal structure of magnesium complex Mg-1 [MEP-Mg(H2O)Br2] (CCDC 2389195). Hydrogen atoms (except the water molecule) and two bromide ions are omitted for clarity. Atom colors are pink for Mg, blue for N, gray for C, and red for O. Fig 4 Fig. 5 Recyclability of catalyst Mg-1 for the coupling of CO2 with epichlorohydrin (The first cycle was carried out under solvent-free conditions: 10 mmol epoxides, 0.5 mol % Mg-1, and 10 bar CO2 at 100 °C for 6 h. The second and subsequent cycles included the addition of a fresh 10 mmol of 1a to the reaction mixture after each 6 h reaction period. Yield was determined by 1H NMR analysis.). Fig 5 Fig. 6 Proposed mechanism for the coupling reaction of CO2 with epoxides catalyzed by Mg-N4 complex. Fig 6 Table 1 Catalyst screening for the cycloaddition of epichlorohydrin and CO2 a . Table 1 Image, table 1 Entry Catalyst(mol %) Cat/1a(mol ratio) Temp( °C) Pressure(bar) Time(h) Conv.( %) b Yield( %) b TOF(h-1) 1 Mg-1 1/100 80 10 6 90 88 2 Mg-2 1/100 80 10 6 100 98 3 Mg-3 1/100 80 10 6 84 83 4 Mg-4 1/100 80 10 6 59 58 5 Mg-5 1/100 80 10 6 82 81 6 Mg-2 1/100 80 10 3 88 87 7 Mg-2 1/100 80 10 5 100 99 8 Mg-1 1/100 100 10 6 100 99 9 Mg-1 1/100 100 10 3 63 62 10 Mg-1 5/1000 100 10 6 98 97 11 Mg-1 1/1000 100 10 6 47 44 12 Mg-2 1/1000 100 10 6 56 49 13 c Mg-1 1/1000 100 10 6 99 98 14 d Mg-1 1/1000 100 10 6 98 97 15 Mg-1 1/10,000 100 10 6 5 3 16 e Mg-1 1/10,000 120 20 1 21 19 2100 a All reactions were carried out under solvent-free conditions: 10 mmol of epichlorohydrin 1a, Mg(II) complex. b Determined by 1H NMR using 1,1,2,2-tetrachloroethane as an internal standard. c 0.5 mol % TBAB was used. d 0.5 mol % PPNCl was used. e 0.05 mol % PPNCl was used, 120 °C, 20 bar CO2, 1 h. Table 2 Coupling of various epoxides with CO2 using complex Mg-1 or Mg-2 as the catalyst a . Table 2 Image, table 2 b 0.5 mol % Mg-1, and 10 bar CO2, 120 °C, 7 h (Condition B). c 0.5 mol % Mg-2, and 10 bar CO2, 120 °C. 7 h (Condition C). d 0.5 mol % Mg-2, and 10 bar CO2, 120 °C, 12 h (Condition D). e 0.5 mol % Mg-2, 0.5 mol % PPNCl and 10 bar CO2, 120 °C, 24 h (Condition E, without PPNCl, 67 % yield of cis-cyclic carbonate). a The reactions were carried out under solvent-free conditions: 10 mmol epoxides or 5 mmol bis-epoxides, 0.5 mol % Mg-1, and 10 bar CO2, 100 °C, 6 h (Condition A), and isolated yield was obtained. Efficient fixation of CO2 with epoxides catalyzed by Mg(II)-N4 complexes Chunnian Xia Writing – review & editing Supervision a ⁎ Xinyi Wu Writing – original draft Methodology Investigation Conceptualization a Bingyang Wang Writing – review & editing Conceptualization b Han Zhang Conceptualization a Kailin Chen Investigation Conceptualization a Nuoqi Jin Conceptualization a Qiangsheng Sun Investigation Formal analysis b Wei Sun Writing – review & editing Supervision b ⁎ a College of Pharmaceutical Sciences, Zhejiang University of Technology, Hangzhou 310014, PR China College of Pharmaceutical Sciences Zhejiang University of Technology Hangzhou 310014 PR China aCollege of Pharmaceutical Sciences, Zhejiang University of Technology, Hangzhou 310014, PR China b State Key Laboratory of Low Carbon Catalysis and CO2 Utilization, Lanzhou Institute of Chemical Physics, Chinese Academy of Sciences, Lanzhou 730000, PR China State Key Laboratory of Low Carbon Catalysis and CO2 Utilization Lanzhou Institute of Chemical Physics Chinese Academy of Sciences Lanzhou 730000 PR China bState Key Laboratory of Low Carbon Catalysis and CO2 Utilization, Lanzhou Institute of Chemical Physics, Chinese Academy of Sciences, Lanzhou 730000, PR China ⁎ Corresponding authors. In this study, a series of Mg(II) complexes supported by aminopyridine-N4 (MEP, DAP, TPA) and TMC (14-TMC) ligands were synthesized and characterized using various spectroscopic techniques. These Mg(II) complexes were investigated the catalytic activity for the cycloaddition of carbon dioxide with epoxides to obtain cyclic carbonates under cocatalyst- and solvent-free conditions, providing moderate to excellent yields depending on the specific N4 ligands used. The study involved analyzing the spectroscopic characterizations and experimental results to discuss the possible ligand topological structures of Mg-N4 complexes and their impact on catalytic performance. Moreover, the addition of (triphenylphosphoranylidene)ammonium chloride (PPNCl) as a cocatalyst significantly enhanced the turnover frequency (TOF) to 2100 h-1 for the Mg-1 [MEP-Mg(II), 0.01 mol % catalyst loading]. Also, the Mg-1 catalyst demonstrates excellent stability under the reaction conditions, allowing for multiple reuses. Graphical abstract A series of Mg(II) complexes of N4 (MEP, DAP, TPA, and 14-TMC) ligands were synthesized. These Mg(II) complexes demonstrated good catalytic activity for the coupling reaction of CO2 with epoxides in the absence/presence of cocatalyst (such as, PPNCl). The possible ligand topological structures of Mg-N4 complexes were discussed based on the 1H NMR spectra and crystal structure. Image, graphical abstract Keywords CO2 conversion Mg(II) N4 complexe Cyclic carbonates Epoxides Data availability No data was used for the research described in the article. 1 Introduction Carbon dioxide, a byproduct of fossil fuel combustion, is a major greenhouse gas that significantly contributes to environmental challenges. Hence, controlling CO2 concentration in the atmosphere is a worldwide issue, and carbon dioxide capture, utilization, and storage (CCUS) has garnered significant attention [1–3]. Additionally, it is a non-toxic and abundant resource that holds promise as a renewable carbon feedstock [4–6]. In light of sustainable development and the principles of green chemistry, the conversion of CO2 into high-value-added chemicals not only aids in reducing carbon emissions but also yields valuable products [7–9]. Over the past few decades, researchers have developed various catalytic systems aimed at converting CO2 into essential chemical feedstocks and fuels [10–15]. Among these transformations, the coupling reaction of CO2 with epoxides to produce five-membered cyclic carbonates is noteworthy due to its high atom economy [16–18]. In addition, these five-membered cyclic carbonates serve not only as important intermediates in biodegradable polymers [19,20] and pharmaceuticals [21–23] but also as polar aprotic solvents [24] and electrolytes in lithium-ion batteries [25,26]. To date, a diverse array of functionalized catalysts has been successfully developed for synthesizing cyclic carbonates from epoxides and carbon dioxide [27]. These catalysts include quaternary ammonium salts [28,29], ionic liquids [30–33], metal-based catalysts [34–37], and so on. Based on these reports, an efficient catalytic system typically features a Lewis acid center to activate the epoxide and a nucleophilic site for the epoxide ring-opening step [38–40]. Among the well-established binary/bifunctional catalytic systems (e.g., quaternary ammonium salts, ionic liquids, metal complexes), biomimetic metalloporphyrin complexes (such as those containing Co, Zn, Al, and Mg) have been extensively studied for the catalytic fixation of CO2 with epoxides to produce cyclic carbonates [41–45]. Notably, magnesium is abundant, biocompatible, and plays a crucial role in biological processes, making it an ideal candidate for sustainable catalytic systems that lower environmental impact and advance green chemistry. In 2012, Jing and coworkers examined several metal porphyrin complexes, including Al, Mg, and Sn, for the coupling reaction of CO2 with epoxides. Notably, Mg(TPP) (TPP is tetraphenylporphyrin) combined with tetra-n-butylammonium iodide has been identified as an effective binary catalytic system for cyclic carbonate synthesis (Fig. 1 a) [42]. Furthermore, Ema and colleagues reported the development of a highly active bifunctional di- and tri-porphyrin catalyst with multiple nucleophilic active sites on its side chains. The Mg complex achieved impressive turnover numbers (TON) and turnover frequencies (TOF) of 220,000 and 46,000 h-1, respectively (Fig. 1b) [46]. Ding and coworkers presented a magnesium-based catalyst (Mg-por/pho@POP) that integrates porphyrin and phosphonium salt within a porous organic polymer, enabling efficient production of cyclic carbonates from epoxides and CO2 at mild conditions, even at room temperature (Fig. 1c) [47]. Also, Gruttadauria, Aprile, Giacalone, and coworkers reported bifunctional magnesium porphyrin-imidazolium bromide polymer (TSP-Mg-imi) for the coupling of CO2 with epoxides, giving TON of 24,700 [48]. Very recently, they demonstrated that the imidazolium bromide substituted magnesium phthalocyanine polymers as efficient bifunctional catalysts for the coupling of CO2 with epoxides with TON of 5950 [49]. Similarly, tetradentate nitrogen ligands (N4), which mimic non-heme enzymes, are highly versatile and easy to synthesize [50–53]. Recently, Cho and co-workers reported C 3-symmertric zinc complexes of tripodal tren-based ligands for transforming CO2 into cyclic carbonates without any cocatalysts [54]. Also, we developed a series of bifunctional zinc(II) and cobalt(II)-N4 complexes that demonstrate effective catalytic performance in the reaction of carbon dioxide with epoxides [55,56]. Interestingly, single-crystal X-ray diffraction analysis of the Zn complexes revealed two distinct coordination modes. One of these is N3 coordination mode, which facilitates the release of a pyridine group capable of activating CO2 [56]. Given the diverse coordination modes of N4 ligands and the potential geometric structures of the resulting metal complexes, we are very interested in expanding their catalytic applications. In this work, we report the synthesis of magnesium (II) complexes with linear aminopyridine N4 ligands, as well as magnesium (II) complexes with TPA (a tripodal N4 ligand, TPA = tris(2-pyridylmethyl)amine) and 14-TMC (a macrocyclic N4 ligand, 14-TMC = N,N',N'',N'''-tetramethyl-1,4,8,11- tetraazacyclotetradecane). We demonstrate that these magnesium (II) complexes act as single-component catalysts, exhibiting good to excellent catalytic activity in the synthesis of cyclic carbonates from CO2 and epoxides (Fig. 2). The supporting ligands play a crucial role in regulating the catalytic activity. 2 Results and discussion 2.1 Synthesis and characterization of Mg(ii) complexes The linear aminopyridine (MEP = N,N'-dimethyl-N,N'-bis(2-pyridylmethyl) −1,2-ethanediamine; The magnesium(II) complexes Mg-1–5 could be readily synthesized by the reaction of MgBr2 with the corresponding N4 ligands [N, N'-dimethyl-N, N'-bis(2-pyridylmethyl)-1,2-ethylenediamine (MEP) [57], N, N'-bis((4-(dimethylamino)- pyridin-2-yl)methyl)-N,N'-di-methylethane-1,2-ethylene-diamine (Me2NMEP) [56], 1,4-bis(2-pyridylmethyl)-1,4-diazacycl-oheptane (DAP) [55], TPA and 14-TMC] in excellent yields. In general, linear tetradentate N4 ligands can coordinate to octahedral metal centers in three possible topologies, including cis-α, cis-β, and trans [58–61]. As previously reported, 1H NMR spectroscopy can provide direct evidence for identifying the possible geometric isomers of these complexes [55,58]. Each geometric isomer produces characteristic chemical shift patterns for the α-H atoms of pyridine. For instance, the α-H atoms of pyridines in the cis-β isomer are unequal, resulting in two peaks in the 1H NMR. The 1H NMR spectrum of the Mg-1 (MEP-Mg(H2O)2Br2) complex displayed seven peaks in the aromatic region (Fig. 3 b). In contrast, the spectrum of the MEP ligand (Fig. 3a), which shows only four peaks between 7–8 ppm, suggests that the Mg-1 complex likely contains two sets of peaks corresponding to two isomers. Given the number of peaks, both isomers should be C2-symmetric structure, indicating the presence of cis-α and trans isomers, as a C1-symmetric structure would show more peaks. Subsequently, one of the isomer of Mg-1 was identified as the cis-α topology by single crystal X-ray crystallography diffraction (Fig. 4 ). In this structure, two pyridine rings are coordinated to the metal center in a trans relationship, with the N-methyl groups positioned opposite each other. The structure of Mg-1 also demonstrates that both water molecules are coordinated to the Mg(II) center rather than bromide ions. This may be due to the presence of trace amount of water in the solvents during the process for growth crystals. In this structure, both bromide ions are counter anions, thus indicating that the bromide ions in Mg-1 can more readily serve as nucleophiles in the coupling of CO2 with epoxides. Specifically, the 1H NMR spectrum of the Mg-2 (Me2NMEP-MgBr2) complex with Me2NMEP ligand shows one peak at 8.18 ppm (Fig. 3c and d), corresponding to the α-H of the pyridine, suggesting that the complex shows a stable configuration consistent with the cis-α topology. Similarly, the 1H NMR spectra of the Mg-3 (DAP-MgBr2), Mg-4 (TPA-MgBr2) and Mg-5 (14-TMC-MgBr2) reveal that these complexes are obtained as single topological structure. 2.2 Evaluation of catalytic activity Using epichlorohydrin 1a as a model substrate, we initially investigated the catalytic performance of magnesium complexes Mg-1–5 under cocatalyst- and solvent-free conditions at 80 °C and 10 bar of CO2. We found that these magnesium complexes could catalyze the cycloaddition reaction of epichlorohydrin 1a and CO2 to yield corresponding cyclic carbonate 2a with yields ranging from 58 % to 98 % at a 1a/ catalyst ratio of 1/100 (Table 1 , entries 1 − 5). When employing Mg-1, 2a was obtained in 88 % yield under the same conditions (Table 1, entry 1). As expected, the complex Mg-2 exhibited the highest catalytic activity, resulting in a 98 % yield of cyclic carbonate 2a (Table 1, entry 2). This impressive performance of Mg-2 is likely attributed to the -NMe2 groups on the both pyridine rings, which can directly activate CO2. The Mg-3 complex, featuring a 1,4-diazacycloheptane skeleton, was also examined; it demonstrated lower activity compared to Mg-1 and Mg-2, potentially due to steric hindrance within its structure (Table 1, entry 3). To further explore the impact of structural variations on catalytic performance, Mg-4 complex containing a tripodal TPA ligand and Mg-5 with macrocyclic 14-TMC ligand were studied (Table 1, entries 4–5). Compared to the complexes Mg-1–3, Mg-4 resulted in a lowest yield of 58 % (Table 1, entry 4), while Mg-5, Mg(II)-14-TMC, produced comparable result to that of Mg-3 (Table 1, entries 3 and 5). Given the ease preparation of Mg-1, and its comparable catalytic performance to Mg-2, we then focused on optimizing the reaction conditions using the Mg-1 complex, including temperature, time, and catalyst loading. Increasing the temperature to 100 °C achieved complete conversion of epichlorohydrin, and a 99 % yield of product 2a was observed (Table 1, entry 8). However, further investigations into reducing the reaction time at 100 °C resulted in a significant decrease in activity (Table 1, entry 9). We also optimized the process by testing different catalyst loadings while maintaining constant reaction temperature and CO2 pressure. To our delight, a catalyst loading of 0.5 mol % could maintain the quantitative conversion of the substrate (Table 1, entry 10). However, reducing the catalyst loading to 0.1 mol % resulted in only a 50 % yield (Table 1, entry 11). It is known that commonly used cocatalysts, such as tetrabutylammonium bromide (TBAB) and (triphenylphosphoranylidene) ammonium chloride (PPNCl), can significantly influence catalytic activity [43,56]. As expected, the addition of cocatalyst, even with a 0.1 mol % catalyst loading of Mg-1, led to a yield of 97 % (Table 1, entries 13 and 14). Remarkably, using an extremely low catalytic loading of 0.01 mol % Mg-1 combined with PPNCl as a cocatalyst, we achieved a turnover frequency (TOF) of 2100 h−1 at 120 °C (Table 1, entries 15 and 16). The synergistic effect between Mg-1 and PPNCl leads to an enhancement on the catalytic activity [62]. To explore the potential and general applicability of the Mg-N4 complexes, the coupling reaction of CO2 with a variety of mono-substituted epoxides were investigated under the optimized conditions (Table 2 ). The scope of epoxides included aliphatic, aromatic, ether-substitution, halogenated, and olefinic groups. The halogen-containing carbonates 2a and 2b, from the substrates 1a and 1b, were isolated in excellent yields. Propylene oxide 1c and epoxide 1e were converted into the target products with good yields (Table 2, 2c, 82 %; 2e, 82 %). However, some epoxides, such as styrene oxide, did not yield satisfactory yield at 100 °C. Based on previous studies, increasing the reaction temperature could enhance substrate conversion [55]. Consequently, we elevated the temperature to 120 °C for epoxides containing phenyl and alkyl groups, as well as a series of glycidyl ethers. This adjustment was particularly beneficial for the challenging styrene oxide 1d, increasing the yield of the cyclic carbonate to 70 % (Table 2, 2d). Additionally, epoxides 1e-i, bearing various ether substitutions, could be well converted into cyclic carbonate 2e-i in ranging from 74 % to 96 %. Due to the inherently lower reactivity of alkyl-substituted epoxides, in the case of epoxide 1k, switching to catalyst Mg-2 resulted in an excellent yield of 96 % for 2k at 120 °C. Furthermore, at increased reaction time and with Mg-2 as the catalyst, two functionalized di-epoxides, 1l and 1m, were smoothly transformed into their corresponding products with excellent yields (2l, 98 % yield; 2m, 92 % yield). The cycloaddition of CO2 with more challenging cyclohexene oxide was also performed with Mg-2 as catalyst, it provided the desired cis-cyclic carbonate 2n in 67 % yield at 120 °C for 24 h. Further, the yield of cis-cyclic carbonate 2n could be improved to 87 % when using 0.5 mol % PPNCl as cocatalyst [63,64]. These results demonstrate that the Mg-N4 complexes, particularly Mg-2, are efficient one-component catalysts for the synthesis of cyclic carbonates from CO2 and a wide range of epoxides. 2.3 Reusability of Mg(ii)-N4 catalyst To further test the stability of the Mg-1 complex, its recyclability was assessed in the coupling reaction of CO2 with epichlorohydrin 1a under standard conditions. Given the good solubility of Mg-1 in cyclic carbonate 2a, fresh epichlorohydrin was directly added to the reaction vessel for the subsequent run after the each reaction [65]. The Mg-1 complex could be reused five times, and a slight decline in activity after each cycle was observed, largely due to the gradually reduced catalyst concentration (Fig. 5 ). Furthermore, the catalyst could be recovered from the product via vacuum distillation. Thus, this method shows inherent limitation for the synthesis of high-boiling-point cyclic carbonates due to the soluble nature of Mg-N4 complex. Based on the 1H NMR spectra, the recycled catalyst was nearly identical to the fresh catalyst, thereby indicating that the Mg-1 complex is stable enough during the catalytic reaction. 2.4 Reaction mechanism After investigating the performance of these Mg(II) complexes in the coupling of CO2 with epoxides, we are interesting in understanding how the N4 ligand affects the catalytic activity. It is well-known that the Lewis acidity of the metal center can modulate the activation of the epoxide; increased Lewis acidity facilitates the ring-opening of epoxide by a nucleophilic halide anion more easily [66]. The trend in the Lewis acidity of complexes Mg-1, Mg-2 has been qualitatively evaluated by a 31P NMR chemical downfield shift compared to free Et3PO (Fig. S1, 13.03 ppm for Mg-1, 13.13 ppm for Mg-2.) [67,68], Mg-2 exhibits higher Lewis acidity, aligning well with the catalytic activities of complexes Mg-1, and Mg-2 (Table 1, entries 1 and 2). Also, comparison of the chemical downfield shifts of analogues of Zn-N4 complexes [55] and Co-N4 complexes [56] indicates that Mg-N4 complexes demonstrate higher Lewis acidity (see the Supporting Information, Fig. S1). As shown in the crystal structure of complex Mg-1 (Fig. 4), Br- anions can readily dissociate from the magnesium(II) complex, acting as nucleophiles for breaking the epoxide ring [55,63]. Based on previous reports and these above observations [39,46,64,66], we propose a mechanism for the magnesium(II)-catalyzed coupling reaction of CO2 with epoxides, illustrated in Fig. 6 . The catalytic cycle begins with the activation of the epoxide by the Mg(II) complex, and the bromide anion facilitates the ring-opening of epoxide, generating the alkoxide intermediate C. This intermediate then reacts with CO2 to produce carbonate species D. Finally, the desired cyclic carbonates are released after an intramolecular nucleophilic attack of species D. 3 Conclusions In conclusion, we synthesized a series of Mg-N4 complexes including linear N4 ligands, tripodal TPA ligand, and 14-TMC ligand. These Mg complexes proved to be effective catalysts, especially, Mg-1 (MEP-MgBr2) and Mg-2 (Me2NMEP-MgBr2), for the coupling reaction of CO2 with epoxides under solvent- and cocatalyst-free conditions. In combination with TBAB or PPNCl, the magnesium(II) complexes demonstrated higher catalytic activity for this reaction (catalyst loading as low as 0.01 mol %), and TOF of 2100 h-1 was abserved. Additionally, the Mg(II) complexes could be reused five times only with a slight decrease in catalytic activity due to the gradually reduced catalyst concentration. On the basis of the results, the topological structures of the Mg(II) complexes play a crucial role for controlling the reactivity. Future studies will continue to understand the structure-activity relationship of this type of metal-N4 complexes. CRediT authorship contribution statement Chunnian Xia: Writing – review & editing, Supervision. Xinyi Wu: Writing – original draft, Methodology, Investigation, Conceptualization. Bingyang Wang: Writing – review & editing, Conceptualization. Han Zhang: Conceptualization. Kailin Chen: Investigation, Conceptualization. Nuoqi Jin: Conceptualization. Qiangsheng Sun: Investigation, Formal analysis. Wei Sun: Writing – review & editing, Supervision. Declaration of competing interest The authors declare that they have no known competing financial interests or personal relationships that could have appeared to influence the work reported in this paper. Acknowledgments We acknowledge financial support of this work from the National Natural Science Foundation of China (no. 22361142751, 22372183, 22302213), the Major Project of Gansu Province, China (no. 22ZD6GA003), and the Major Program of the Lanzhou Institute of Chemical Physics, CAS. Supplementary materials Supplementary material associated with this article can be found, in the online version, at doi:10.1016/j.mcat.2025.115090. Appendix Supplementary materials Image, application 1 References [1] Y.M. Wei J.N. Kang L.C. Liu Q. Li P.T. Wang J.J. Hou Q.M. Liang H. Liao S.F. Huang B. Yu Nature Climate Chang 11 2021 112 118 Y.M. Wei, J.N. Kang, L.C. Liu, Q. Li, P.T. Wang, J.J. Hou, Q.M. Liang, H. Liao, S.F. Huang, B. Yu, Nature Climate Chang, 11 (2021) 112–118. [2] S.I. Eyitayo C.J. Okere A. Hussain T. Gamadi M.C. Watson J. Environ. Manag. 351 2024 119713 S.I. Eyitayo, C.J. Okere, A. Hussain, T. Gamadi, M.C. Watson, J. Environ. Manag. 351 (2024) 119713. [3] S. Castro-Pardo S. Bhattacharyya R.M. Yadav A.P. de Carvalho Teixeira M.A. Campos Mata T. Prasankumar M.A. Kabbani M.G. Kibria T. Xu S. Roy P.M. Ajayan Mater. Today 60 2022 227 270 S. Castro-Pardo, S. Bhattacharyya, R.M. Yadav, A.P. de Carvalho Teixeira, M.A. Campos Mata, T. Prasankumar, M.A. Kabbani, M.G. Kibria, T. Xu, S. Roy, P.M. Ajayan, Mater. Today 60 (2022) 227–270. [4] T. Sakakura C.J. Choi H. Yasuda Chem. Rev. 107 2007 2365 2387 T. Sakakura, C.J. Choi, H. Yasuda, Chem. Rev. 107 (2007) 2365–2387. [5] M. Takht Ravanchi S. Sahebdelfar Process Saf. Environ. Prot. 145 2021 172 194 M. Takht Ravanchi, S. Sahebdelfar, Process Saf. Environ. Prot. 145 (2021) 172–194. [6] G. Centi S. Perathoner Catal. Today. 148 2009 191 205 G. Centi, S. Perathoner, Catal. Today. 148 (2009) 191–205. [7] M.M.F. Hasan L.M. Rossi D.P. Debecker K.C. Leonard Z. Li B.C.E. Makhubela C. Zhao A. Kleij ACS Sustainable Chem. Eng. 9 2021 12427 12430 M.M.F. Hasan, L.M. Rossi, D.P. Debecker, K.C. Leonard, Z. Li, B.C.E. Makhubela, C. Zhao, A. Kleij, ACS Sustainable Chem. Eng. 9 (2021) 12427–12430. [8] Q.W. Song Z.H. Zhou L.N. He Green Chem 19 2017 3707 3728 Q.W. Song, Z.H. Zhou, L.N. He, Green Chem. 19 (2017) 3707–3728. [9] P. Wang Z. Liu Z. Pan J. González-Arias L. Shang Y. Wang Z. Zhang Sep. Purif. Technol. 346 2024 127252 P. Wang, Z. Liu, Z. Pan, J. González-Arias, L. Shang, Y. Wang, Z. Zhang, Sep. Purif. Technol. 346 (2024) 127252. [10] M. He Y. Sun B. Han Angew. Chem., Int. Ed. 52 2013 9620 9633 M. He, Y. Sun, B. Han, Angew. Chem., Int. Ed. 52 (2013) 9620–9633. [11] M. He Y. Sun B. Han Angew. Chem., Int. Ed. 61 2022 e202112835 M. He, Y. Sun, B. Han, Angew. Chem., Int. Ed. 61 (2022) e202112835. [12] Q. Liu L. Wu R. Jackstell M. Beller Nat. Commun. 6 2015 5933 Q. Liu, L. Wu, R. Jackstell, M. Beller, Nat. Commun. 6 (2015) 5933. [13] I. Omae Coord. Chem. Rev. 256 2012 1384 1405 I. Omae, Coord. Chem. Rev. 256 (2012) 1384–1405. [14] K.E. Dalle J. Warnan J.J. Leung B. Reuillard I.S. Karmel E. Reisner Chem. Rev. 119 2019 2752 2875 K.E. Dalle, J. Warnan, J.J. Leung, B. Reuillard, I.S. Karmel, E. Reisner, Chem. Rev. 119 (2019) 2752–2875. [15] S. Overa B.H. Ko Y. Zhao F. Jiao Acc. Chem. Res. 55 2022 638 648 S. Overa, B.H. Ko, Y. Zhao, F. Jiao, Acc. Chem. Res. 55 (2022) 638–648. [16] C. Martín G. Fiorani A.W. Kleij ACS Catal 5 2015 1353 1370 C. Martín, G. Fiorani, A.W. Kleij, ACS Catal. 5 (2015) 1353–1370. [17] V. Mishra S.C. Peter Chem. Catal. 4 2024 100796 V. Mishra, S.C. Peter, Chem. Catal. 4 (2024) 100796. [18] S. Ghorai D. Nanda A. Ghosh P.S. Dash Mol. Catal. 553 2024 113720 S. Ghorai, D. Nanda, A. Ghosh, P.S. Dash, Mol. Catal. 553 (2024) 113720. [19] T.J. Kemp Sci Prog 97 2014 249 260 T.J. Kemp, Sci Prog. 97 (2014) 249–260. [20] N. Yadav F. Seidi D. Crespy V. D'Elia ChemSusChem 12 2019 724 754 N. Yadav, F. Seidi, D. Crespy, V. D'Elia, ChemSusChem. 12 (2019) 724–754. [21] W. Guo L. Martinez-Rodriguez E. Martin E.C. Escudero-Adan A.W. Kleij Angew. Chem., Int. Ed. 128 2016 1 5 W. Guo, L. Martinez-Rodriguez, E. Martin, E.C. Escudero-Adan, A.W. Kleij, Angew. Chem., Int. Ed. 128 (2016) 1–5. [22] A. Khan R. Zheng Y. Kan J. Ye J. Xing Y.J. Zhang Angew. Chem., Int. Ed. 126 2014 6557 6560 A. Khan, R. Zheng, Y. Kan, J. Ye, J. Xing, Y.J. Zhang, Angew. Chem., Int. Ed. 126 (2014) 6557–6560. [23] A. Cai W. Guo L. Martinez-Rodriguez A.W. Kleij J. Am. Chem. Soc. 138 2016 14194 14197 A. Cai, W. Guo, L. Martinez-Rodriguez, A.W. Kleij, J. Am. Chem. Soc. 138 (2016) 14194–14197. [24] B. Schaffner F. Schaffner S.P. Verevkin A. Borner Chem. Rev. 110 2010 4554 4581 B. Schaffner, F. Schaffner, S.P. Verevkin, A. Borner, Chem. Rev. 110 (2010) 4554–4581. [25] C.C. Su M. He R. Amine Z.H. Chen R.N. Sahore D. Rago K. Amine Energy Storage Mater 17 2019 284 292 C.C. Su, M. He, R. Amine, Z.H. Chen, R.N. Sahore, D. Rago, K. Amine, Energy Storage Mater. 17 (2019) 284–292. [26] D. You W. Hu L. Song W. Wei H. Xiong A.C.S. Appl Polym. Mater. 4 2022 8584 8593 D. You, W. Hu, L. Song, W. Wei, H. Xiong, A.C.S. Appl. Polym. Mater. 4 (2022) 8584–8593. [27] M. Cokoja C. Bruckmeier B. Rieger W.A. Herrmann F.E. Kühn Angew. Chem., Int. Ed. 50 2011 8510 8537 M. Cokoja, C. Bruckmeier, B. Rieger, W.A. Herrmann, F.E. Kühn, Angew. Chem., Int. Ed. 50 (2011) 8510–8537. [28] C.Carvalho Rocha T. Onfroy J. Pilmé A. Denicourt-Nowicki A. Roucoux F. Launay J. Catal. 333 2016 29 39 C.Carvalho Rocha, T. Onfroy, J. Pilmé, A. Denicourt-Nowicki, A. Roucoux, F. Launay, J. Catal. 333 (2016) 29–39. [29] T. Cao L. Sun Y. Shi L. Hua R. Zhang L. Guo W. Zhu Z. Hou Chin. J. Catal. 33 2012 416 424 T. Cao, L. Sun, Y. Shi, L. Hua, R. Zhang, L. Guo, W. Zhu, Z. Hou, Chin. J. Catal. 33 (2012) 416–424. [30] J.J. Peng Y.Q. Deng New J. Chem. 25 2001 639 641 J.J. Peng, Y.Q. Deng, New J. Chem. 25 (2001) 639–641. [31] M. Liu L. Liang X. Li X. Gao J. Sun Green Chem 18 2016 2851 2863 M. Liu, L. Liang, X. Li, X. Gao, J. Sun, Green Chem. 18 (2016) 2851–2863. [32] H. Song Y. Wang M. Xiao L. Liu Y. Liu X. Liu H. Gai ACS Sustainable Chem. Eng. 7 2019 9489 9497 H. Song, Y. Wang, M. Xiao, L. Liu, Y. Liu, X. Liu, H. Gai, ACS Sustainable Chem. Eng. 7 (2019) 9489–9497. [33] Z. Xu F. Zhao Y. Wang P. Liu Y. Qu Z. Chen W. Yang T. Zhao Sep. Purif. Technol. 360 2025 130922 Z. Xu, F. Zhao, Y. Wang, P. Liu, Y. Qu, Z. Chen, W. Yang, T. Zhao, Sep. Purif. Technol. 360 (2025) 130922. [34] J.W. Comerford I.D.V. Ingram M. North X. Wu Green Chem 17 2015 1966 1987 J.W. Comerford, I.D.V. Ingram, M. North, X. Wu, Green Chem. 17 (2015) 1966–1987. [35] C. Martín G. Fiorani A.W. Kleij ACS Catal 5 2015 1353 1370 C. Martín, G. Fiorani, A.W. Kleij, ACS Catal. 5 (2015) 1353–1370. [36] A. Decortes A.M. Castilla A.W. Kleij Angew. Chem., Int. Ed. 49 2010 9822 9837 A. Decortes, A.M. Castilla, A.W. Kleij, Angew. Chem., Int. Ed. 49 (2010) 9822–9837. [37] D. Prasad K.N. Patil N.K. Chaudhari H. Kim B.M. Nagaraja A.H. Jadhav Catal. Rev. Sci. Eng. 64 2022 356 443 D. Prasad, K.N. Patil, N.K. Chaudhari, H. Kim, B.M. Nagaraja, A.H. Jadhav, Catal. Rev. Sci. Eng. 64 (2022) 356–443. [38] Z. Dai Y. Tang F. Zhang Y. Xiong S. Wang Q. Sun L. Wang X. Meng L. Zhao F.S. Xiao Chin. J. Catal. 42 2021 618 626 Z. Dai, Y. Tang, F. Zhang, Y. Xiong, S. Wang, Q. Sun, L. Wang, X. Meng, L. Zhao, F.S. Xiao, Chin. J. Catal. 42 (2021) 618–626. [39] T. Ema Y. Miyazaki J. Shimonishi C. Maeda J.Y. Hasegawa J. Am. Chem. Soc. 136 2014 15270 15279 T. Ema, Y. Miyazaki, J. Shimonishi, C. Maeda, J.Y. Hasegawa, J. Am. Chem. Soc. 136 (2014) 15270–15279. [40] G.W. Yang Y.Y. Zhang G.P. Wu Acc. Chem. Res. 54 2021 4434 4448 G.W. Yang, Y.Y. Zhang, G.P. Wu, Acc. Chem. Res. 54 (2021) 4434–4448. [41] X. Jiang F. Gou F. Chen H. Jing Green Chem 18 2016 3567 3576 X. Jiang, F. Gou, F. Chen, H. Jing, Green Chem. 18 (2016) 3567–3576. [42] D. Bai S. Duan L. Hai H. Jing ChemCatChem 4 2012 1752 1758 D. Bai, S. Duan, L. Hai, H. Jing, ChemCatChem. 4 (2012) 1752–1758. [43] Y. Qin H. Guo X. Sheng X. Wang W. Wang Green Chem 17 2015 2853 2858 Y. Qin, H. Guo, X. Sheng, X. Wang, W. Wang, Green Chem. 17 (2015) 2853–2858. [44] R. Luo M. Chen F. Zhou J. Zhan Q. Deng Y. Yu Y. Zhang W. Xu Y. Fang J. Mater. Chem. A. 9 2021 25731-2574 R. Luo, M. Chen, F. Zhou, J. Zhan, Q. Deng, Y. Yu, Y. Zhang, W. Xu, Y. Fang, J. Mater. Chem. A. 9 (2021) 25731-2574. [45] L. Liu S. Jayakumar J. Chen L. Tao H. Li Q. Yang C. Li ACS Appl. Mater. Interfaces. 13 2021 29522 29531 L. Liu, S. Jayakumar, J. Chen, L. Tao, H. Li, Q. Yang, C. Li, ACS Appl. Mater. Interfaces. 13 (2021) 29522–29531. [46] C. Maeda T. Taniguchi K. Ogawa T. Ema Angew. Chem., Int. Ed. 54 2015 134 138 C. Maeda, T. Taniguchi, K. Ogawa, T. Ema, Angew. Chem., Int. Ed. 54 (2015) 134–138. [47] W. Wang Y. Wang C. Li L. Yan M. Jiang Y. Ding ACS Sustainable Chem. Eng. 5 2017 4523 4528 W. Wang, Y. Wang, C. Li, L. Yan, M. Jiang, Y. Ding, ACS Sustainable Chem. Eng. 5 (2017) 4523–4528. [48] L. Valentino V. Campisciano C. Célis V. Lemaur R. Lazzaroni M. Gruttadauria C. Aprile F. Giacalone J. Catal. 428 2023 115143 L. Valentino, V. Campisciano, C. Célis, V. Lemaur, R. Lazzaroni, M. Gruttadauria, C. Aprile, F. Giacalone, J. Catal. 428 (2023) 115143 [49] B. Taormina R. Jouclas V. Marsala M. Gruttadauria F. Giacalone C. Aprile J. CO2 Util. 85 2024 102875 B. Taormina, R. Jouclas, V. Marsala, M. Gruttadauria, F. Giacalone, C. Aprile, J. CO2 Util. 85 (2024) 102875. [50] L. Vicens G. Olivo M. Costas ACS Catal. 10 2020 8611 8631 L. Vicens, G. Olivo, M. Costas, ACS Catal. 10 (2020) 8611–8631. [51] W. Sun Q.S. Sun Acc. Chem. Res. 52 2019 2370 2381 W. Sun, Q.S. Sun, Acc. Chem. Res. 52 (2019) 2370–2381. [52] R.V. Ottenbacher E.P. Talsi K.P. Bryliakov Chem. Rec. 18 2018 78 90 R.V. Ottenbacher, E.P. Talsi, K.P. Bryliakov, Chem. Rec. 18 (2018) 78–90. [53] X. Xiao K. Xu Z.H. Gao Z.H. Zhu C. Ye B. Zhao S. Luo S. Ye Y.G. Zhou S. Xu S.F. Zhu H. Bao W. Sun X. Wang K. Ding Sci. China Chem. 66 2023 1553 1633 X. Xiao, K. Xu, Z.H. Gao, Z.H. Zhu, C. Ye, B. Zhao, S. Luo, S. Ye, Y.G. Zhou, S. Xu, S.F. Zhu, H. Bao, W. Sun, X. Wang, K. Ding, Sci. China Chem. 66 (2023) 1553–1633. [54] K. Kaveen H. Ji T.S. Kim D. Kim D.H. Cho App. Catal. B: Environ. 280 2021 119395 K. Kaveen, H. Ji, T.S. Kim, D. Kim, D.H. Cho, App. Catal. B: Environ. 280 (2021) 119395. [55] B.Y. Wang J.Lin L.X.Wang C.G. Xia W. Sun ACS Catal. 13 2023 10386 10393 B.Y. Wang, L.X.Wang, J.Lin, C.G. Xia, W. Sun, ACS Catal. 13 (2023) 10386–10393. [56] B.Y. Wang X.Y. Cao L.X. Wang X.Y. Meng Y. Wang W. Sun Inorg. Chem. 63 2024 9156 9163 B.Y. Wang, X.Y. Cao, L.X. Wang, X.Y. Meng, Y. Wang, W. Sun, Inorg. Chem. 63 (2024) 9156–9163. [57] M.C. White A.G. Doyle E.N. Jacobsen J. Am. Chem. Soc. 123 2001 7194 7195 M.C. White, A.G. Doyle, E.N. Jacobsen, J. Am. Chem. Soc. 123 (2001) 7194–7195. [58] M. Costas L. Que Jr Angew. Chem., Int. Ed. 41 2002 2179 2181 M. Costas, Que, L. Jr, Angew. Chem., Int. Ed. 41 (2002) 2179–2181. [59] R. Mas-Ballesté M. Costas T. van den Berg L. Que Jr Chem. Eur. J. 12 2006 7489 7500 R. Mas-Ballesté, M. Costas, T. van den Berg, Que, L. Jr, Chem. Eur. J. 12 (2006) 7489–7500. [60] S. Hong Y.M. Lee K.B. Cho K. Sundaravel J. Cho M.J. Kim W. Shin W. Nam J. Am. Chem. Soc. 133 2011 11876 11879 S. Hong, Y.M. Lee, K.B. Cho, K. Sundaravel, J. Cho, M.J. Kim, W. Shin, W. Nam, J. Am. Chem. Soc. 133 (2011) 11876–11879. [61] J. Lin C. Miao F. Wang P. Yang Q. Sun W. Sun ACS Catal. 10 2020 11857 11863 J. Lin, C. Miao, F. Wang, P. Yang, Q. Sun, W. Sun, ACS Catal. 10 (2020) 11857–11863. [62] V. Campisciano C. Calabrese F. Giacalone C. Aprile P.L. Meo M. Gruttadauria J. CO2 Util. 38 2020 132 140 V. Campisciano, C. Calabrese, F. Giacalone, C. Aprile, P.L. Meo, M. Gruttadauria, J. CO2 Util. 38 (2020) 132–140. [63] C.J. Whiteoak E. Martin E. Escudero-Adán A.W. Kleij Adv. Synth. Catal. 355 2013 2233 2239 C.J. Whiteoak, E. Martin, E. Escudero-Adán, A.W. Kleij. Adv. Synth. Catal. 355 (2013) 2233–2239. [64] F. Della Monica S.V. Vummaleti A. Buonerba A.D. Nisi M. Monari S. Milione A. Grassi L. Cavallo C. Capacchione Adv. Synth. Catal. 358 2016 3231 3243 F. Della Monica, S.V. Vummaleti, A. Buonerba, A.D. Nisi, M. Monari, S. Milione, A. Grassi. L. Cavallo. C. Capacchione. Adv. Synth. Catal. 358 (2016) 3231–3243. [65] Y.A. Rulev V.A. Larionov A.V. Lokutova M.A. Moskalenko Og.L. Lependina V.I. Maleev M. North Y.N. Belokon ChemSusChem 9 2016 216 222 Y.A. Rulev, V.A. Larionov, A.V. Lokutova, M.A. Moskalenko, Og.L. Lependina, V.I. Maleev, M. North, Y.N. Belokon, ChemSusChem 9 (2016) 216–222. [66] J. Chen X. Wu H. Ding N. Liu B. Liu L. He ACS Sustainable Chem. Eng. 9 2021 16210 16219 J. Chen, X. Wu, H. Ding, N. Liu, B. Liu, L. He, ACS Sustainable Chem. Eng. 9 (2021) 16210–16219. [67] U. Mayer V. Gutmann W. Gerger Monatsh. Chem. 106 1975 1235 1257 U. Mayer, V. Gutmann, W. Gerger, Monatsh. Chem. 106 (1975) 1235–1257. [68] R. Ma L.N. He Y.B. Zhou Green Chem 18 2016 226 231 R. Ma, L.N. He, Y.B. Zhou, Green Chem. 18 (2016) 226–231.",
      "scopus-id": "105001655970",
      "coredata": {
        "eid": "1-s2.0-S2468823125002767",
        "dc:description": "In this study, a series of Mg(II) complexes supported by aminopyridine-N4 (MEP, DAP, TPA) and TMC (14-TMC) ligands were synthesized and characterized using various spectroscopic techniques. These Mg(II) complexes were investigated the catalytic activity for the cycloaddition of carbon dioxide with epoxides to obtain cyclic carbonates under cocatalyst- and solvent-free conditions, providing moderate to excellent yields depending on the specific N4 ligands used. The study involved analyzing the spectroscopic characterizations and experimental results to discuss the possible ligand topological structures of Mg-N4 complexes and their impact on catalytic performance. Moreover, the addition of (triphenylphosphoranylidene)ammonium chloride (PPNCl) as a cocatalyst significantly enhanced the turnover frequency (TOF) to 2100 h-1 for the Mg-1 [MEP-Mg(II), 0.01 mol % catalyst loading]. Also, the Mg-1 catalyst demonstrates excellent stability under the reaction conditions, allowing for multiple reuses.",
        "openArchiveArticle": "false",
        "prism:coverDate": "2025-05-15",
        "openaccessUserLicense": null,
        "prism:aggregationType": "Journal",
        "prism:url": "https://api.elsevier.com/content/article/pii/S2468823125002767",
        "dc:creator": [
          {
            "@_fa": "true",
            "$": "Xia, Chunnian"
          },
          {
            "@_fa": "true",
            "$": "Wu, Xinyi"
          },
          {
            "@_fa": "true",
            "$": "Wang, Bingyang"
          },
          {
            "@_fa": "true",
            "$": "Zhang, Han"
          },
          {
            "@_fa": "true",
            "$": "Chen, Kailin"
          },
          {
            "@_fa": "true",
            "$": "Jin, Nuoqi"
          },
          {
            "@_fa": "true",
            "$": "Sun, Qiangsheng"
          },
          {
            "@_fa": "true",
            "$": "Sun, Wei"
          }
        ],
        "link": [
          {
            "@_fa": "true",
            "@rel": "self",
            "@href": "https://api.elsevier.com/content/article/pii/S2468823125002767"
          },
          {
            "@_fa": "true",
            "@rel": "scidir",
            "@href": "https://www.sciencedirect.com/science/article/pii/S2468823125002767"
          }
        ],
        "dc:format": "application/json",
        "openaccessType": null,
        "pii": "S2468-8231(25)00276-7",
        "prism:volume": "579",
        "articleNumber": "115090",
        "prism:publisher": "Elsevier B.V. All rights are reserved, including those for text and data mining, AI training, and similar technologies.",
        "dc:title": "Efficient fixation of CO2 with epoxides catalyzed by Mg(II)-N4 complexes",
        "prism:copyright": "© 2025 Elsevier B.V. All rights are reserved, including those for text and data mining, AI training, and similar technologies.",
        "openaccess": "0",
        "prism:issn": "24688231",
        "dcterms:subject": [
          {
            "@_fa": "true",
            "$": "CO2 conversion"
          },
          {
            "@_fa": "true",
            "$": "Mg(II) N4 complexe"
          },
          {
            "@_fa": "true",
            "$": "Cyclic carbonates"
          },
          {
            "@_fa": "true",
            "$": "Epoxides"
          }
        ],
        "openaccessArticle": "false",
        "prism:publicationName": "Molecular Catalysis",
        "openaccessSponsorType": null,
        "prism:pageRange": "115090",
        "pubType": "fla",
        "prism:coverDisplayDate": "15 May 2025",
        "prism:doi": "10.1016/j.mcat.2025.115090",
        "prism:startingPage": "115090",
        "dc:identifier": "doi:10.1016/j.mcat.2025.115090",
        "openaccessSponsorName": null
      },
      "objects": {
        "object": [
          {
            "@category": "standard",
            "@height": "446",
            "@width": "454",
            "@_fa": "true",
            "$": "https://api.elsevier.com/content/object/eid/1-s2.0-S2468823125002767-gr6.jpg?httpAccept=%2A%2F%2A",
            "@multimediatype": "JPEG image file",
            "@type": "IMAGE-DOWNSAMPLED",
            "@size": "29967",
            "@ref": "gr6",
            "@mimetype": "image/jpeg"
          },
          {
            "@category": "standard",
            "@height": "372",
            "@width": "452",
            "@_fa": "true",
            "$": "https://api.elsevier.com/content/object/eid/1-s2.0-S2468823125002767-gr5.jpg?httpAccept=%2A%2F%2A",
            "@multimediatype": "JPEG image file",
            "@type": "IMAGE-DOWNSAMPLED",
            "@size": "24421",
            "@ref": "gr5",
            "@mimetype": "image/jpeg"
          },
          {
            "@category": "standard",
            "@height": "88",
            "@width": "345",
            "@_fa": "true",
            "$": "https://api.elsevier.com/content/object/eid/1-s2.0-S2468823125002767-fx1.jpg?httpAccept=%2A%2F%2A",
            "@multimediatype": "JPEG image file",
            "@type": "IMAGE-DOWNSAMPLED",
            "@size": "8153",
            "@ref": "fx1",
            "@mimetype": "image/jpeg"
          },
          {
            "@category": "standard",
            "@height": "715",
            "@width": "640",
            "@_fa": "true",
            "$": "https://api.elsevier.com/content/object/eid/1-s2.0-S2468823125002767-fx2.jpg?httpAccept=%2A%2F%2A",
            "@multimediatype": "JPEG image file",
            "@type": "IMAGE-DOWNSAMPLED",
            "@size": "59963",
            "@ref": "fx2",
            "@mimetype": "image/jpeg"
          },
          {
            "@category": "standard",
            "@height": "337",
            "@width": "645",
            "@_fa": "true",
            "$": "https://api.elsevier.com/content/object/eid/1-s2.0-S2468823125002767-gr2.jpg?httpAccept=%2A%2F%2A",
            "@multimediatype": "JPEG image file",
            "@type": "IMAGE-DOWNSAMPLED",
            "@size": "36640",
            "@ref": "gr2",
            "@mimetype": "image/jpeg"
          },
          {
            "@category": "standard",
            "@height": "200",
            "@width": "482",
            "@_fa": "true",
            "$": "https://api.elsevier.com/content/object/eid/1-s2.0-S2468823125002767-ga1.jpg?httpAccept=%2A%2F%2A",
            "@multimediatype": "JPEG image file",
            "@type": "IMAGE-DOWNSAMPLED",
            "@size": "30696",
            "@ref": "ga1",
            "@mimetype": "image/jpeg"
          },
          {
            "@category": "standard",
            "@height": "519",
            "@width": "725",
            "@_fa": "true",
            "$": "https://api.elsevier.com/content/object/eid/1-s2.0-S2468823125002767-gr1.jpg?httpAccept=%2A%2F%2A",
            "@multimediatype": "JPEG image file",
            "@type": "IMAGE-DOWNSAMPLED",
            "@size": "71185",
            "@ref": "gr1",
            "@mimetype": "image/jpeg"
          },
          {
            "@category": "standard",
            "@height": "340",
            "@width": "208",
            "@_fa": "true",
            "$": "https://api.elsevier.com/content/object/eid/1-s2.0-S2468823125002767-gr4.jpg?httpAccept=%2A%2F%2A",
            "@multimediatype": "JPEG image file",
            "@type": "IMAGE-DOWNSAMPLED",
            "@size": "19678",
            "@ref": "gr4",
            "@mimetype": "image/jpeg"
          },
          {
            "@category": "standard",
            "@height": "752",
            "@width": "358",
            "@_fa": "true",
            "$": "https://api.elsevier.com/content/object/eid/1-s2.0-S2468823125002767-gr3.jpg?httpAccept=%2A%2F%2A",
            "@multimediatype": "JPEG image file",
            "@type": "IMAGE-DOWNSAMPLED",
            "@size": "54806",
            "@ref": "gr3",
            "@mimetype": "image/jpeg"
          },
          {
            "@category": "thumbnail",
            "@height": "164",
            "@width": "167",
            "@_fa": "true",
            "$": "https://api.elsevier.com/content/object/eid/1-s2.0-S2468823125002767-gr6.sml?httpAccept=%2A%2F%2A",
            "@multimediatype": "GIF image file",
            "@type": "IMAGE-THUMBNAIL",
            "@size": "6216",
            "@ref": "gr6",
            "@mimetype": "image/gif"
          },
          {
            "@category": "thumbnail",
            "@height": "164",
            "@width": "199",
            "@_fa": "true",
            "$": "https://api.elsevier.com/content/object/eid/1-s2.0-S2468823125002767-gr5.sml?httpAccept=%2A%2F%2A",
            "@multimediatype": "GIF image file",
            "@type": "IMAGE-THUMBNAIL",
            "@size": "6576",
            "@ref": "gr5",
            "@mimetype": "image/gif"
          },
          {
            "@category": "thumbnail",
            "@height": "56",
            "@width": "219",
            "@_fa": "true",
            "$": "https://api.elsevier.com/content/object/eid/1-s2.0-S2468823125002767-fx1.sml?httpAccept=%2A%2F%2A",
            "@multimediatype": "GIF image file",
            "@type": "IMAGE-THUMBNAIL",
            "@size": "4276",
            "@ref": "fx1",
            "@mimetype": "image/gif"
          },
          {
            "@category": "thumbnail",
            "@height": "164",
            "@width": "147",
            "@_fa": "true",
            "$": "https://api.elsevier.com/content/object/eid/1-s2.0-S2468823125002767-fx2.sml?httpAccept=%2A%2F%2A",
            "@multimediatype": "GIF image file",
            "@type": "IMAGE-THUMBNAIL",
            "@size": "3932",
            "@ref": "fx2",
            "@mimetype": "image/gif"
          },
          {
            "@category": "thumbnail",
            "@height": "114",
            "@width": "219",
            "@_fa": "true",
            "$": "https://api.elsevier.com/content/object/eid/1-s2.0-S2468823125002767-gr2.sml?httpAccept=%2A%2F%2A",
            "@multimediatype": "GIF image file",
            "@type": "IMAGE-THUMBNAIL",
            "@size": "4793",
            "@ref": "gr2",
            "@mimetype": "image/gif"
          },
          {
            "@category": "thumbnail",
            "@height": "91",
            "@width": "219",
            "@_fa": "true",
            "$": "https://api.elsevier.com/content/object/eid/1-s2.0-S2468823125002767-ga1.sml?httpAccept=%2A%2F%2A",
            "@multimediatype": "GIF image file",
            "@type": "IMAGE-THUMBNAIL",
            "@size": "7422",
            "@ref": "ga1",
            "@mimetype": "image/gif"
          },
          {
            "@category": "thumbnail",
            "@height": "157",
            "@width": "219",
            "@_fa": "true",
            "$": "https://api.elsevier.com/content/object/eid/1-s2.0-S2468823125002767-gr1.sml?httpAccept=%2A%2F%2A",
            "@multimediatype": "GIF image file",
            "@type": "IMAGE-THUMBNAIL",
            "@size": "8762",
            "@ref": "gr1",
            "@mimetype": "image/gif"
          },
          {
            "@category": "thumbnail",
            "@height": "164",
            "@width": "100",
            "@_fa": "true",
            "$": "https://api.elsevier.com/content/object/eid/1-s2.0-S2468823125002767-gr4.sml?httpAccept=%2A%2F%2A",
            "@multimediatype": "GIF image file",
            "@type": "IMAGE-THUMBNAIL",
            "@size": "8287",
            "@ref": "gr4",
            "@mimetype": "image/gif"
          },
          {
            "@category": "thumbnail",
            "@height": "164",
            "@width": "78",
            "@_fa": "true",
            "$": "https://api.elsevier.com/content/object/eid/1-s2.0-S2468823125002767-gr3.sml?httpAccept=%2A%2F%2A",
            "@multimediatype": "GIF image file",
            "@type": "IMAGE-THUMBNAIL",
            "@size": "5443",
            "@ref": "gr3",
            "@mimetype": "image/gif"
          },
          {
            "@category": "high",
            "@height": "1973",
            "@width": "2010",
            "@_fa": "true",
            "$": "https://api.elsevier.com/content/object/eid/1-s2.0-S2468823125002767-gr6_lrg.jpg?httpAccept=%2A%2F%2A",
            "@multimediatype": "JPEG image file",
            "@type": "IMAGE-HIGH-RES",
            "@size": "210458",
            "@ref": "gr6",
            "@mimetype": "image/jpeg"
          },
          {
            "@category": "high",
            "@height": "1647",
            "@width": "2000",
            "@_fa": "true",
            "$": "https://api.elsevier.com/content/object/eid/1-s2.0-S2468823125002767-gr5_lrg.jpg?httpAccept=%2A%2F%2A",
            "@multimediatype": "JPEG image file",
            "@type": "IMAGE-HIGH-RES",
            "@size": "145467",
            "@ref": "gr5",
            "@mimetype": "image/jpeg"
          },
          {
            "@category": "high",
            "@height": "390",
            "@width": "1527",
            "@_fa": "true",
            "$": "https://api.elsevier.com/content/object/eid/1-s2.0-S2468823125002767-fx1_lrg.jpg?httpAccept=%2A%2F%2A",
            "@multimediatype": "JPEG image file",
            "@type": "IMAGE-HIGH-RES",
            "@size": "42652",
            "@ref": "fx1",
            "@mimetype": "image/jpeg"
          },
          {
            "@category": "high",
            "@height": "3163",
            "@width": "2833",
            "@_fa": "true",
            "$": "https://api.elsevier.com/content/object/eid/1-s2.0-S2468823125002767-fx2_lrg.jpg?httpAccept=%2A%2F%2A",
            "@multimediatype": "JPEG image file",
            "@type": "IMAGE-HIGH-RES",
            "@size": "469561",
            "@ref": "fx2",
            "@mimetype": "image/jpeg"
          },
          {
            "@category": "high",
            "@height": "1491",
            "@width": "2855",
            "@_fa": "true",
            "$": "https://api.elsevier.com/content/object/eid/1-s2.0-S2468823125002767-gr2_lrg.jpg?httpAccept=%2A%2F%2A",
            "@multimediatype": "JPEG image file",
            "@type": "IMAGE-HIGH-RES",
            "@size": "274210",
            "@ref": "gr2",
            "@mimetype": "image/jpeg"
          },
          {
            "@category": "high",
            "@height": "886",
            "@width": "2133",
            "@_fa": "true",
            "$": "https://api.elsevier.com/content/object/eid/1-s2.0-S2468823125002767-ga1_lrg.jpg?httpAccept=%2A%2F%2A",
            "@multimediatype": "JPEG image file",
            "@type": "IMAGE-HIGH-RES",
            "@size": "197794",
            "@ref": "ga1",
            "@mimetype": "image/jpeg"
          },
          {
            "@category": "high",
            "@height": "2297",
            "@width": "3211",
            "@_fa": "true",
            "$": "https://api.elsevier.com/content/object/eid/1-s2.0-S2468823125002767-gr1_lrg.jpg?httpAccept=%2A%2F%2A",
            "@multimediatype": "JPEG image file",
            "@type": "IMAGE-HIGH-RES",
            "@size": "560900",
            "@ref": "gr1",
            "@mimetype": "image/jpeg"
          },
          {
            "@category": "high",
            "@height": "1512",
            "@width": "924",
            "@_fa": "true",
            "$": "https://api.elsevier.com/content/object/eid/1-s2.0-S2468823125002767-gr4_lrg.jpg?httpAccept=%2A%2F%2A",
            "@multimediatype": "JPEG image file",
            "@type": "IMAGE-HIGH-RES",
            "@size": "162061",
            "@ref": "gr4",
            "@mimetype": "image/jpeg"
          },
          {
            "@category": "high",
            "@height": "3333",
            "@width": "1586",
            "@_fa": "true",
            "$": "https://api.elsevier.com/content/object/eid/1-s2.0-S2468823125002767-gr3_lrg.jpg?httpAccept=%2A%2F%2A",
            "@multimediatype": "JPEG image file",
            "@type": "IMAGE-HIGH-RES",
            "@size": "459630",
            "@ref": "gr3",
            "@mimetype": "image/jpeg"
          },
          {
            "@category": "standard",
            "@_fa": "true",
            "$": "https://api.elsevier.com/content/object/eid/1-s2.0-S2468823125002767-mmc1.docx?httpAccept=%2A%2F%2A",
            "@multimediatype": "Microsoft Word file",
            "@type": "APPLICATION",
            "@size": "3777759",
            "@ref": "mmc1",
            "@mimetype": "application/word"
          }
        ]
      },
      "link": {
        "@rel": "abstract",
        "@href": "https://api.elsevier.com/content/abstract/scopus_id/105001655970"
      }
    }
  }
}