{
  "metadata": {
    "title": "Bimetallic Co-Mn catalyzed chemselective oxidation of 5-hydroxymethylfurfural to 2,5-furandicarboxylic acid",
    "authors": "; ; ",
    "journal": "Molecular Catalysis",
    "date": "2025-06-01",
    "doi": "10.1016/j.mcat.2025.115135",
    "abstract": "",
    "uri": "https://api.elsevier.com/content/article/pii/S2468823125003207",
    "pii": "S2468823125003207"
  },
  "fulltext": {
    "full-text-retrieval-response": {
      "scopus-eid": "2-s2.0-105002859224",
      "originalText": "serial JL 315758 291210 291744 291790 291809 31 Molecular Catalysis MOLECULARCATALYSIS 2025-04-18 2025-04-18 2025-04-18 2025-04-18 2025-04-25T00:06:19 1-s2.0-S2468823125003207 S2468-8231(25)00320-7 S2468823125003207 10.1016/j.mcat.2025.115135 S300 S300.1 FULL-TEXT 1-s2.0-S2468823125X00079 2025-04-25T01:24:02.003134Z 0 0 20250601 2025 2025-04-18T21:29:31.449545Z absattachment articleinfo articlenumber articletitlenorm authfirstinitialnorm authfirstsurnamenorm cid cids contenttype copyright crossmark dateloaded dateloadedtxt datesearch datesort dateupdated dco docsubtype doctype doi eid ewtransactionid hubeid indexeddate issn issnnorm itemstage itemtransactionid itemweight openaccess openarchive pg pgfirst pii piinorm pubdatestart pubdatetxt pubyr sectiontitle sortorder srctitle srctitlenorm srctype ssids alllist content subj subheadings suppl tomb volfirst volissue volumelist webpdf webpdfpagecount yearnav figure table e-component body mmlmath acknowledge affil appendices articletitle auth authfirstini authfull authkeywords authlast grantnumber grantsponsor highlightsabst orcid primabst pubtype ref specialabst 2468-8231 24688231 true 580 580 C Volume 580 34 115135 115135 115135 20250601 1 June 2025 2025-06-01 2025 Regular Papers article fla © 2025 Elsevier B.V. All rights are reserved, including those for text and data mining, AI training, and similar technologies. BIMETALLICCOMNCATALYZEDCHEMSELECTIVEOXIDATION5HYDROXYMETHYLFURFURAL25FURANDICARBOXYLICACID ZHU R Introduction Experimental section Materials and reagents Preparation of the catalyst Typical experimental procedures for synthesis of FDCA from HMF Catalyst recycling Catalysts characterization Results and discussion Conclusions CRediT authorship contribution statement Acknowledgements Appendix Supplementary materials References WELSBY 2021 230 234 D KAR 2022 1288 1295 S NAIM 2020 11512 11521 W SUDARSANAM 2019 2366 2421 P HUANG 2022 197 214 Z ZHANG 2018 1351 1390 Z XU 2020 4273 4306 C LI 2023 113629 X DEJONG 2022 943 E SOUSA 2021 8795 8820 A HWANG 2020 124636 K LI 2022 10080 10114 N ALBONETTI 2022 e202201057 S YANG 2021 158 173 Z LI 2021 11336 11359 C LI 2025 X VILLA 2013 609 612 A AITRASS 2013 2240 2251 H CHEN 2017 11300 11306 C CASANOVA 2009 1138 1144 O GAO 2018 53 68 T BONINCONTRO 2019 117279 D BONINCONTRO 2019 4090 4099 D CATTANEO 2020 420 426 S MEGIASSAYAGO 2020 1177 1183 C LIUZZI 2023 990 F GAO 2020 252 262 T ZHANG 2018 19 22 S AMARASEKARA 2022 12642 12650 A LE 2023 113017 T QIN 2015 3718 3722 Y WANG 2015 406 412 S WANG 2023 16887 16898 F DAS 2024 5575 5585 S GAO 2024 1191 1200 D PRASAD 2024 e202400973 S FAN 2018 588 595 X FANG 2018 17643 17655 W LIU 2022 4913 4924 C WANG 2023 141621 H GUO 2022 1409 W ZHU 2025 120084 R ZHU 2025 120084 R SALAZARCONTRERAS 2019 414 426 H ZHOU 2022 3392 3399 X CHEN 2020 17076 17084 S ZHUX2025X115135 ZHUX2025X115135XR 2027-04-18T00:00:00.000Z 2027-04-18T00:00:00.000Z http://creativecommons.org/licenses/by-nc-nd/4.0/ © 2025 Elsevier B.V. All rights are reserved, including those for text and data mining, AI training, and similar technologies. 2025-04-23T02:26:31.556Z http://vtw.elsevier.com/data/voc/AddOnTypes/50.7/aggregated-refined National Natural Science Foundation of China 22308121 National Natural Science Foundation of China http://data.elsevier.com/vocabulary/SciValFunders/501100001809 http://sws.geonames.org/1814991 Wuxi Science and Technology Development Fund Project K20221001 This work was supported by the National Natural Science Foundation of China ( 22308121 ), and the Wuxi Science and Technology Development Fund Project ( K20221001 ). https://doi.org/10.15223/policy-017 https://doi.org/10.15223/policy-037 https://doi.org/10.15223/policy-012 https://doi.org/10.15223/policy-029 https://doi.org/10.15223/policy-004 item S2468-8231(25)00320-7 S2468823125003207 1-s2.0-S2468823125003207 10.1016/j.mcat.2025.115135 315758 2025-04-25T01:24:02.003134Z 2025-06-01 1-s2.0-S2468823125003207-main.pdf https://s3-eu-west-1.amazonaws.com/prod-ucs-content-store-eu-west/content/pii:S2468823125003207/MAIN/application/pdf/2df809bed9c5143411561852f6463ba6/main.pdf main.pdf pdf true 7827038 MAIN 10 1-s2.0-S2468823125003207-main_1.png https://s3-eu-west-1.amazonaws.com/prod-ucs-content-store-eu-west/content/pii:S2468823125003207/PREVIEW/image/png/e147d3ca973874e725f135b8f4c34384/main_1.png main_1.png png 59536 849 656 IMAGE-WEB-PDF 1 1-s2.0-S2468823125003207-gr3.jpg https://s3-eu-west-1.amazonaws.com/prod-ucs-content-store-eu-west/content/pii:S2468823125003207/gr3/DOWNSAMPLED/image/jpeg/6f4ca07ca46201ebc7dfee37e6cf5de7/gr3.jpg gr3 gr3.jpg jpg 60085 410 753 IMAGE-DOWNSAMPLED 1-s2.0-S2468823125003207-gr4.jpg https://s3-eu-west-1.amazonaws.com/prod-ucs-content-store-eu-west/content/pii:S2468823125003207/gr4/DOWNSAMPLED/image/jpeg/dcab5f92668141e97ef00386cf27d2ed/gr4.jpg gr4 gr4.jpg jpg 156018 887 715 IMAGE-DOWNSAMPLED 1-s2.0-S2468823125003207-gr1.jpg https://s3-eu-west-1.amazonaws.com/prod-ucs-content-store-eu-west/content/pii:S2468823125003207/gr1/DOWNSAMPLED/image/jpeg/42e8af3ad106bf5f8ff44144d9ce3601/gr1.jpg gr1 gr1.jpg jpg 23960 287 357 IMAGE-DOWNSAMPLED 1-s2.0-S2468823125003207-gr2.jpg https://s3-eu-west-1.amazonaws.com/prod-ucs-content-store-eu-west/content/pii:S2468823125003207/gr2/DOWNSAMPLED/image/jpeg/2a2ebf55bdce663def4899929a24a36e/gr2.jpg gr2 gr2.jpg jpg 69920 308 715 IMAGE-DOWNSAMPLED 1-s2.0-S2468823125003207-ga1.jpg https://s3-eu-west-1.amazonaws.com/prod-ucs-content-store-eu-west/content/pii:S2468823125003207/ga1/DOWNSAMPLED/image/jpeg/8371bb555155b0b5dfb0db2ab1f05266/ga1.jpg ga1 true ga1.jpg jpg 32108 196 500 IMAGE-DOWNSAMPLED 1-s2.0-S2468823125003207-sc1.jpg https://s3-eu-west-1.amazonaws.com/prod-ucs-content-store-eu-west/content/pii:S2468823125003207/sc1/DOWNSAMPLED/image/jpeg/9821862dad4982104e3e2903a08ce726/sc1.jpg sc1 sc1.jpg jpg 21518 158 678 IMAGE-DOWNSAMPLED 1-s2.0-S2468823125003207-gr7.jpg https://s3-eu-west-1.amazonaws.com/prod-ucs-content-store-eu-west/content/pii:S2468823125003207/gr7/DOWNSAMPLED/image/jpeg/b8b990e8c6624089a7c25dcc952059e5/gr7.jpg gr7 gr7.jpg jpg 42315 195 753 IMAGE-DOWNSAMPLED 1-s2.0-S2468823125003207-gr8.jpg https://s3-eu-west-1.amazonaws.com/prod-ucs-content-store-eu-west/content/pii:S2468823125003207/gr8/DOWNSAMPLED/image/jpeg/ca0b15a577d2482045fb1b75219a10ec/gr8.jpg gr8 gr8.jpg jpg 138014 766 621 IMAGE-DOWNSAMPLED 1-s2.0-S2468823125003207-gr5.jpg https://s3-eu-west-1.amazonaws.com/prod-ucs-content-store-eu-west/content/pii:S2468823125003207/gr5/DOWNSAMPLED/image/jpeg/49106de42c30004c4274835bac9726cf/gr5.jpg gr5 gr5.jpg jpg 186992 585 678 IMAGE-DOWNSAMPLED 1-s2.0-S2468823125003207-gr6.jpg https://s3-eu-west-1.amazonaws.com/prod-ucs-content-store-eu-west/content/pii:S2468823125003207/gr6/DOWNSAMPLED/image/jpeg/506a0b1835b959da32943347611e1367/gr6.jpg gr6 gr6.jpg jpg 37640 194 753 IMAGE-DOWNSAMPLED 1-s2.0-S2468823125003207-gr3.sml https://s3-eu-west-1.amazonaws.com/prod-ucs-content-store-eu-west/content/pii:S2468823125003207/gr3/THUMBNAIL/image/gif/7a841729e7bbebcfc4bef9b85e08fa9b/gr3.sml gr3 gr3.sml sml 7356 119 219 IMAGE-THUMBNAIL 1-s2.0-S2468823125003207-gr4.sml https://s3-eu-west-1.amazonaws.com/prod-ucs-content-store-eu-west/content/pii:S2468823125003207/gr4/THUMBNAIL/image/gif/1253c5285d09041d1fd66733d0988884/gr4.sml gr4 gr4.sml sml 10663 164 132 IMAGE-THUMBNAIL 1-s2.0-S2468823125003207-gr1.sml https://s3-eu-west-1.amazonaws.com/prod-ucs-content-store-eu-west/content/pii:S2468823125003207/gr1/THUMBNAIL/image/gif/b2f7eef3d21376e78e034785729e8b5f/gr1.sml gr1 gr1.sml sml 8996 164 204 IMAGE-THUMBNAIL 1-s2.0-S2468823125003207-gr2.sml https://s3-eu-west-1.amazonaws.com/prod-ucs-content-store-eu-west/content/pii:S2468823125003207/gr2/THUMBNAIL/image/gif/ddfa1d76242eb1eb40450ff346eef71d/gr2.sml gr2 gr2.sml sml 9094 94 219 IMAGE-THUMBNAIL 1-s2.0-S2468823125003207-ga1.sml https://s3-eu-west-1.amazonaws.com/prod-ucs-content-store-eu-west/content/pii:S2468823125003207/ga1/THUMBNAIL/image/gif/912616821d516e93f787864b8fee07da/ga1.sml ga1 true ga1.sml sml 9760 86 219 IMAGE-THUMBNAIL 1-s2.0-S2468823125003207-sc1.sml https://s3-eu-west-1.amazonaws.com/prod-ucs-content-store-eu-west/content/pii:S2468823125003207/sc1/THUMBNAIL/image/gif/184385ffbab6195e62e98b7991acb464/sc1.sml sc1 sc1.sml sml 4714 51 219 IMAGE-THUMBNAIL 1-s2.0-S2468823125003207-gr7.sml https://s3-eu-west-1.amazonaws.com/prod-ucs-content-store-eu-west/content/pii:S2468823125003207/gr7/THUMBNAIL/image/gif/9e9c565009ad48d3cc076e3222de245a/gr7.sml gr7 gr7.sml sml 6693 57 219 IMAGE-THUMBNAIL 1-s2.0-S2468823125003207-gr8.sml https://s3-eu-west-1.amazonaws.com/prod-ucs-content-store-eu-west/content/pii:S2468823125003128/gr8/THUMBNAIL/image/gif/adf0d351489ad84a14a6480170cbdb2d/gr8.sml gr8 gr8.sml sml 12419 164 133 IMAGE-THUMBNAIL 1-s2.0-S2468823125003207-gr5.sml https://s3-eu-west-1.amazonaws.com/prod-ucs-content-store-eu-west/content/pii:S2468823125003128/gr5/THUMBNAIL/image/gif/757a9c1d3cbd767a88b1405ee4ee8221/gr5.sml gr5 gr5.sml sml 25153 164 190 IMAGE-THUMBNAIL 1-s2.0-S2468823125003207-gr6.sml https://s3-eu-west-1.amazonaws.com/prod-ucs-content-store-eu-west/content/pii:S2468823125003207/gr6/THUMBNAIL/image/gif/e104c3822e56c8b461701b255c923bfa/gr6.sml gr6 gr6.sml sml 6936 56 219 IMAGE-THUMBNAIL 1-s2.0-S2468823125003207-gr3_lrg.jpg https://s3-eu-west-1.amazonaws.com/prod-ucs-content-store-eu-west/content/pii:S2468823125003207/HIGHRES/image/jpeg/1d87959d309a8c80e06b5fde8b56c0bc/gr3_lrg.jpg gr3 gr3_lrg.jpg jpg 449548 1815 3333 IMAGE-HIGH-RES 1-s2.0-S2468823125003207-gr4_lrg.jpg https://s3-eu-west-1.amazonaws.com/prod-ucs-content-store-eu-west/content/pii:S2468823125003207/HIGHRES/image/jpeg/a274cbc7134d2e18ff7ba4de449209aa/gr4_lrg.jpg gr4 gr4_lrg.jpg jpg 1205494 3929 3167 IMAGE-HIGH-RES 1-s2.0-S2468823125003207-gr1_lrg.jpg https://s3-eu-west-1.amazonaws.com/prod-ucs-content-store-eu-west/content/pii:S2468823125003207/HIGHRES/image/jpeg/a3a0b59913f8ebdd2553d43073c51ab9/gr1_lrg.jpg gr1 gr1_lrg.jpg jpg 141280 1273 1583 IMAGE-HIGH-RES 1-s2.0-S2468823125003207-gr2_lrg.jpg https://s3-eu-west-1.amazonaws.com/prod-ucs-content-store-eu-west/content/pii:S2468823125003207/HIGHRES/image/jpeg/8fee2094d318859948401a37a570cd0c/gr2_lrg.jpg gr2 gr2_lrg.jpg jpg 445891 1366 3167 IMAGE-HIGH-RES 1-s2.0-S2468823125003207-ga1_lrg.jpg https://s3-eu-west-1.amazonaws.com/prod-ucs-content-store-eu-west/content/pii:S2468823125003207/HIGHRES/image/jpeg/46b9a31879d4076cb9e3d27e70d86f1c/ga1_lrg.jpg ga1 true ga1_lrg.jpg jpg 209206 868 2213 IMAGE-HIGH-RES 1-s2.0-S2468823125003207-sc1_lrg.jpg https://s3-eu-west-1.amazonaws.com/prod-ucs-content-store-eu-west/content/pii:S2468823125003207/HIGHRES/image/jpeg/c3d398954e8fafd9279574814d642f5c/sc1_lrg.jpg sc1 sc1_lrg.jpg jpg 141028 699 3000 IMAGE-HIGH-RES 1-s2.0-S2468823125003207-gr7_lrg.jpg https://s3-eu-west-1.amazonaws.com/prod-ucs-content-store-eu-west/content/pii:S2468823125003207/HIGHRES/image/jpeg/f9cdd0f9b5cd39100ecbc607feafe049/gr7_lrg.jpg gr7 gr7_lrg.jpg jpg 284690 862 3333 IMAGE-HIGH-RES 1-s2.0-S2468823125003207-gr8_lrg.jpg https://s3-eu-west-1.amazonaws.com/prod-ucs-content-store-eu-west/content/pii:S2468823125003128/HIGHRES/image/jpeg/0a56742cc219c79f9099b4d31976b823/gr8_lrg.jpg gr8 gr8_lrg.jpg jpg 1357487 3391 2750 IMAGE-HIGH-RES 1-s2.0-S2468823125003207-gr5_lrg.jpg https://s3-eu-west-1.amazonaws.com/prod-ucs-content-store-eu-west/content/pii:S2468823125003128/HIGHRES/image/jpeg/2b7c5c8b133ac353ed2227251c781ab5/gr5_lrg.jpg gr5 gr5_lrg.jpg jpg 2180429 2587 3000 IMAGE-HIGH-RES 1-s2.0-S2468823125003207-gr6_lrg.jpg https://s3-eu-west-1.amazonaws.com/prod-ucs-content-store-eu-west/content/pii:S2468823125003128/HIGHRES/image/jpeg/2218f965f85820dcd5e840b5d8528424/gr6_lrg.jpg gr6 gr6_lrg.jpg jpg 239134 857 3333 IMAGE-HIGH-RES 1-s2.0-S2468823125003207-mmc1.docx https://s3-eu-west-1.amazonaws.com/prod-ucs-content-store-eu-west/content/pii:S2468823125003207/mmc1/MAIN/application/vnd.openxmlformats-officedocument.wordprocessingml.document/b8d38b73daf722698a32f35e8fe3f11e/mmc1.docx mmc1 mmc1.docx docx 2642445 APPLICATION 1-s2.0-S2468823125003207-si1.svg https://s3-eu-west-1.amazonaws.com/prod-ucs-content-store-eu-west/content/pii:S2468823125003207/image/svg+xml/e7e43fa0fb81cbe033162fcd36ed03e2/si1.svg si1 si1.svg svg 11157 ALTIMG 1-s2.0-S2468823125003207-si2.svg https://s3-eu-west-1.amazonaws.com/prod-ucs-content-store-eu-west/content/pii:S2468823125003207/image/svg+xml/0ba42b239c7669cb972c0a66d531b5c4/si2.svg si2 si2.svg svg 10691 ALTIMG 1-s2.0-S2468823125003207-si3.svg https://s3-eu-west-1.amazonaws.com/prod-ucs-content-store-eu-west/content/pii:S2468823125003207/image/svg+xml/0845db4a094e48f5b2a7c5cea032c22a/si3.svg si3 si3.svg svg 14434 ALTIMG MCAT 115135 115135 S2468-8231(25)00320-7 10.1016/j.mcat.2025.115135 Elsevier B.V. Fig. 1 Catalyst screening for the oxidation reaction of HMF. Reaction conditions: 0.1 mmol HMF, 10 mg catalyst, 1 mL MeCN, 10 eq. t-BuOOH, 80 °C, 12 h. The conversion and yield of this reaction were detected by HPLC. Fig. 1 Fig. 2 XRD patterns and Raman spectra of Fe-NC, Co-NC, Ni-NC, Mn-NC and CoMn-NC. Fig. 2 Fig. 3 Nitrogen sorption isotherms of Fe-NC, Co-NC, Ni-NC, Mn-NC and CoMn-NC. Fig. 3 Fig. 4 XPS spectra of the catalyst samples. a) XPS spectra survey of CoMn-NC; b) C 1 s spectra of CoMn-NC; c) O 1 s spectra of CoMn-NC; d) N 1 s spectra of CoMn-NC; e) Co 2p spectra of CoMn-NC; f) Mn 2p spectra of CoMn-NC; g) Co 2p spectra of Co-NC; h) Mn 2p spectra of Mn-NC; i) N 1 s spectra of Fe-NC; j) N 1 s spectra of Co-NC; k) N 1 s spectra of Ni-NC; l) N 1 s spectra of Mn-NC. Fig. 4 Fig. 5 Microstructure characterizations of the CoMn-NC sample. a) SEM image; b) TEM image; c-h) HAADF-STEM image, BF-STEM image, and EDX-mapping images of the CoMn-NC sample. Fig. 5 Fig. 6 Reaction temperature (a), solvent screening (b) and oxidant dosage screening (c) for the oxidation performance of HMF catalyzed by CoMn-NC. Reaction conditions: 0.1 mmol HMF, 10 mg catalyst, 1 mL solvent, 0–20 eq. t-BuOOH, 80 °C, 12 h. The conversion and yield of this reaction were detected by HPLC. Fig. 6 Fig. 7 The oxidation progress of HMF (a), DFF (b) and FFCA (c) with different reaction time. Reaction conditions: 0.1 mmol substrate, 10 mg catalyst, 1 mL MeCN, 10 eq. t-BuOOH, 80 °C, 0–20 h. The conversion and yield of this reaction were detected by HPLC. Fig. 7 Fig. 8 The investigation of catalyst stability. a) Catalyst cycle experiment. b) XPS Co 2p spectra of fresh and used CoMn-NC; c) XPS Mn 2p spectra of fresh and used CoMn-NC; d) TEM image of fresh CoMn-NC; e) TEM image of used CoMn-NC. Fig. 8 Scheme 1 Reaction pathways for the selective oxidation of HMF to FDCA. Scheme 1 Table 1 N2 physical adsorption results and metal content of catalyst samples. Table 1 Entry Catalyst SBET (m2/g) Average pore width (nm) Average pore volume (cm³/g) Metal contents (wt. %) 1 Fe-NC 522.4 15.61 0.946 2.1 2 Co-NC 455.8 10.59 0.362 2.3 3 Ni-NC 469.8 13.49 0.552 1.9 4 Mn-NC 858.3 11.02 0.696 1.0 5 CoMn-NC 585.4 10.95 0.513 Co: 2.3; Mn: 0.6 Multipoint BET surface area. Cumulative volume of pores and average pore width determined by the BJH method. Research Paper Bimetallic Co-Mn catalyzed chemselective oxidation of 5-hydroxymethylfurfural to 2,5-furandicarboxylic acid Rui Zhu Writing – review & editing Writing – original draft Resources Project administration Methodology Investigation Funding acquisition Formal analysis Conceptualization a ⁎ Fang Gao Writing – original draft Validation Formal analysis Data curation Conceptualization a Xinglong Li Writing – review & editing Formal analysis Conceptualization b ⁎ a School of Biotechnology and Key Laboratory of Industrial Biotechnology of Ministry of Education, Jiangnan University, Wuxi, 214122, China School of Biotechnology and Key Laboratory of Industrial Biotechnology of Ministry of Education Jiangnan University Wuxi 214122 China aSchool of Biotechnology and Key Laboratory of Industrial Biotechnology of Ministry of Education, Jiangnan University, Wuxi, 214122, China b School of Carbon Neutrality Science and Engineering, Aust Hefei Institute for Advanced Research, Anhui University of Science and Technology, Hefei, 231131, PR China School of Carbon Neutrality Science and Engineering Aust Hefei Institute for Advanced Research Anhui University of Science and Technology Hefei 231131 PR China bSchool of Carbon Neutrality Science and Engineering, Aust Hefei Institute for Advanced Research, Anhui University of Science and Technology, Hefei, 231131, PR China ⁎ Corresponding authors. The development of efficient catalysts for the stepwise oxidation of 5-hydroxymethylfurfural (HMF) to 2,5-diformyl furan (DFF), 5-hydroxymethyl-2-furancarboxylic acid (HMFCA), 5-Formyl-2-furancarboxylic acid (FFCA) or 2,5-furandicarboxylic acid (FDCA) is critical for biomass valorization. Herein, we reported a bimetallic Co-Mn catalyst anchored on nitrogen-doped porous carbon, which was used for the oxidation of HMF to FDCA, avoiding the use of high temperature and high-pressure oxygen. High FDCA selectivity (>95 %) was achieved through reaction condition optimization. And HMF→DFF→FFCA→FDCA was considered to be the main reaction pathway during the whole oxidation process. Additionally, the chemical environment of the constituent elements of the used catalyst was analyzed by XPS. TEM revealed that the catalyst retained its porous structure and excellent metal dispersion after the reaction. This structural stability was corroborated by sustained >90 % FDCA selectivity over five consecutive reaction cycles. This work established a dual-metal synergy strategy for multi-step oxidation pathways, offering insights into the design of robust catalysts for biomass-derived platform molecule upgrading. Graphical abstract Image, graphical abstract Keywords Oxidation 5-Hydroxymethylfurfural 2,5-furandicarboxylic acid Bimetallic cobalt and manganese catalyst Tert-butyl hydroperoxide Data availability Data will be made available on request. Introduction The green and sustainable development of renewable resources is pivotal in addressing the pressing environmental issues and resource scarcity that our planet currently faces. In this context, lignocellulosic biomass, primarily composed of cellulose, hemicellulose, and lignin, emerges as a significant renewable resource [1,2]. The comprehensive utilization of lignocellulosic materials presents an encouraging prospect for achieving decarbonization goals within energy and chemical supply chains, thereby facilitating the early realization of net-zero carbon emissions [3]. Through the catalytic conversion of lignocellulosic resources, a myriad of high-value chemicals can be synthesized, including acetic acid, furfural, 5-hydroxymethylfurfural (HMF), vanillin, and ferulic acid, among others [4,5]. Notably, HMF is considered a key platform compound. Its catalytic transformation can yield vital bio-based monomers such as diformylfuran (DFF) and furan dicarboxylic acid (FDCA) [6–8]. These bio-based monomers are poised to replace molecules derived from fossil fuels, advancing the cause of carbon neutrality. Specifically, FDCA is viewed as a substitute for petroleum-derived terephthalic acid (TPA), used in the production of polyethylene furanoate (PEF), a type of bioplastic. The PEF derived from FDCA holds significant promise to replace PET materials and play a pivotal role in applications spanning food packaging, electronics, automotive, and textile industries [9–12]. This makes it a promising alternative to PET in applications spanning food packaging, electronics, automotive, and textile industries. By 2025, the market value of FDCA is projected to reach around 770 million euros, with an annual compound growth rate of about 11 % [13]. Consequently, research into efficient and eco-friendly synthesis techniques for converting HMF into FDCA is both crucial and urgent. In recent years, significant advancements in catalytic strategies have been developed to enhance the efficient utilization of HMF for the selective synthesis of FDCA [14–16]. The conversion of HMF to FDCA involves sequential oxidation of both hydroxyl and aldehyde functional groups [17], accompanied by the generation of multiple reactive intermediates. This process necessitates precise regulation of active sites on catalyst surfaces, including oxygen vacancies, acid-base properties, and activated oxygen species derived from oxidants. Despite progress, achieving high efficiency and selectivity in FDCA synthesis remains challenging. Noble metal-based catalysts (e.g., Au, Pd, Pt, Ru) have demonstrated notable catalytic performance in HMF oxidation [17–26]. However, their high cost and limited scalability hinder commercial applications in biomass valorization [27]. Consequently, the development of cost-effective non-noble metal catalysts has emerged as a critical research focus. Transition metal oxides, such as MnCo2O4, have been explored for FDCA production, achieving a 71 % yield under 1 MPa O2 (Zhang et al.) [28]. Similarly, LiNixMnγCo2O2 catalysts reported by Amarasekara et al. delivered FDCA yields of 82–97 % at 120–140 °C [29]. These studies highlighted the requirement for elevated oxygen pressures to enhance solvent oxygen solubility and reaction efficiency. Alternative oxidants, including H2O2, AcOOH, and t-BuOOH, were also investigated. For instance, Co-Cu/AC catalysts coupled with H2O2 and Na2CO3 achieved 99 % HMF conversion and 92 % FDCA yield at 170 °C over 9 h (Chanatip Samart et al.) [30]. The Baeyer-Villiger oxidation mechanism predominated when AcOOH was employed for aldehyde-to-carboxyl conversion [31]. Moreover, t-BuOOH was also a highly effective oxidant that has been frequently investigated in recent years. Wang et al. developed an Fe3O4 CoOx system in DMSO, yielding 68 % FDCA at 80 °C over 720 min [32]. Notably, non-noble Cu-Mn oxides achieved 96 % FDCA yield under t-BuOOH-mediated conditions [33]. Fe-grafted MOF catalysts (Richard I. Walton et al.) exhibited high activity (TOF > 800 h⁻¹), attaining full HMF conversion and 70–80 % FDCA yield [34]. Furthermore, S- and P-doped CoFeS and CoFeP-400 catalysts (Gao et al.) achieved >87 % FDCA yields under optimized conditions [35]. Prasad et al. demonstrated that Ni-Co oxide catalysts with tunable Co/Ni ratios enhanced oxidative activity [36]. These studies underscored the critical role of multi-metal synergism in improving catalytic performance, attributed to enhanced redox properties, acid-base tunability, and high oxygen mobility facilitated by 3d orbital interactions [37,38]. Nevertheless, challenges persisted in the stability of metal oxide catalysts under acidic and corrosive reaction environments. Future efforts could prioritize the design of robust, non-noble heterogeneous catalysts to advance scalable FDCA production. In this manuscript, a bimetallic CoMn-NC catalytic system used for the catalytic oxidation of HMF to FDCA was developed, and t-BuOOH was used as the oxidant. A series of catalysts were synthesized to leverage the synergistic redox interplay between Co and Mn species, optimizing both activity and stability. Systematic investigations were conducted to elucidate the effects of reaction parameters (temperature, solvent, oxidant loading) on catalytic performance, complemented by advanced characterization techniques (XPS, TEM, XRD, BET) to probe structural and electronic properties. Time-resolved profiling and intermediate tracking were employed to validate the stepwise oxidation pathway. Comprehensive post-reaction characterization via XPS and TEM provided critical insights into the catalyst's stability and active-site evolution. Experimental section Materials and reagents All chemical reagents and solvents were procured from commercial suppliers, including Alfa Aesar, Sigma, Adamas - beta, Energy Chemical, TCI, and Aladdin. These materials were directly utilized in the experiments without undergoing any additional purification steps. Preparation of the catalyst The synthesis method of the catalyst described in the manuscript was refered to previous work [39]. Briefly, 2.5 mmol CoCl2, 2.5 mmol MnCl2, and 2 g of 1,10-phenanthroline were added to 200 mL of ethanol. The resulting mixture was stirred at 60 °C for 30 min. Subsequently, 20 g Mg(OH)2 was added and stirring continued for 120 min. After the reaction was completed, the mixture was cooled to room temperature and ethanol was removed via vacuum distillation. The resulting solid mixture was dried overnight in a vacuum oven at 60 °C and ground into powder. The powder was calcined in a tubular furnace under N2 atmosphere at 700 °C for 2 h (heating rate of 5 °C/min). The obtained black powder was then stirred in a 4 M HNO3 solution at room temperature for 12 h. After filtration and drying, the obtained catalyst was named CoMn-NC. The synthesis methods of Fe-NC, Co-NC, Ni-NC, and Mn-NC were the similar as above. Typical experimental procedures for synthesis of FDCA from HMF To a 10 mL reaction tube equipped with a stir bar, 0.1 mmol HMF and 10 mg catalyst were added to the reaction tube. Then, 1 mL of acetonitrile was introduced as the solvent and 1 mmol t-BuOOH (70 % aqueous solution, calculated in t-BuOOH quantity) was also added. The reaction mixture was stirred for 12 h at 80 °C. Quantitative analysis of HMF, DFF, FFCA and FDCA was performed via HPLC with a C18 column at 30 °C. The mobile phase used by HPLC was MeOH (20 %) and H2O (80 %, containing 0.5 % CF3COOH). The conversion of the substrate and products yield were calculated as follows: Conversion ( % ) = ( 1 − n n 0 ) × 100 % Yield ( % ) = n p n 0 × 100 % Carbon Yield ( % ) = n c n 0 × 100 % where n0 meant the initial mole of the substrate before the reaction; n and np meant the moles of the substrate and products after the reaction; nc meant the total moles of DFF, FFCA and FDCA. Catalyst recycling After the reaction, the mixture was cooled to room temperature and centrifuged at 10,000 rpm for 5 min to separate the solid catalyst from the liquid phase. The recovered catalyst was washed thoroughly with acetonitrile to remove residual reactants and organic byproducts, followed by centrifugation after each washing cycle. The washed catalyst was then dried in a vacuum oven at 60 °C for 6 h to eliminate residual solvent. The dried CoMn-NC catalyst was directly reused in subsequent catalytic cycles without further treatment. Catalysts characterization The physicochemical properties of the synthesized catalysts were systematically investigated using a combination of advanced characterization techniques. Scanning electron microscopy (SEM) analysis was performed on a field-emission SEM instrument (ZEISS Sigma 300) to examine the surface morphology and particle size distribution. Transmission electron microscopy (TEM) images were acquired using the FEI Talos F200X G2 microscope. Additionally, energy-dispersive X-ray spectroscopy mapping (EDX-Mapping) coupled with the TEM was employed to confirm the homogeneous distribution of elements across the catalyst surface. The powder X-ray diffraction (XRD) patterns were obtained by theta rotating anode X-ray diffractometer (Rigaku SmartLab SE) with Cu Kα radiation (λ = 1.5406 Å) in the 2θ range of 10°−80° at a scanning rate of 2° min⁻¹. X-ray photoelectron spectroscopy (XPS) measurements were conducted on a Thermo Scientific K-Alpha spectrometer using a monochromatic Al Kα X-ray source (1486.6 eV), and all binding energies were calibrated against the C 1 s peak (284.8 eV) to evaluate surface elemental composition and chemical states. N₂ adsorption-desorption (BET) of M-CN samples were measured on a fully automatic specific surface area, pore volume, and pore size distribution (Tristar II 3020 M). Raman spectra of the catalysts were acquired using a Horiba LabRAM HR Evolution spectrometer (Horiba Scientific, France) equipped with a 532 nm laser as the excitation source. The measurements were performed in the wavenumber range of 500–3500 cm-1. The d-band (∼1350 cm⁻¹) and G-band (∼1580 cm⁻¹) intensities were extracted using peak fitting software (OriginPro 2021), and the intensity ratio ID/IG was calculated to quantify the structural defects in the carbon matrix. Results and discussion The catalytic performance of the as-prepared catalysts was initially evaluated for the oxidation of HMF under optimized conditions using acetonitrile as the solvent and t-BuOOH as the oxidant. As illustrated in Fig. 1 , Fe-NC, Co-NC, Ni-NC, Mn-NC, and CoMn-NC exhibited distinct catalytic behaviors. All catalysts achieved near-complete HMF conversion (>99 %). However, significant differences in product selectivity were observed. For Fe-NC, the reaction yielded a mixture of DFF (∼13 %), FFCA (∼38 %), and FDCA (∼31 %). Ni-NC produced a ternary mixture of DFF (∼9 %), FFCA (∼37 %), and FDCA (∼47 %). In contrast, Co-NC predominantly generated FFCA (∼30 %) and FDCA (∼59 %), with negligible DFF detected. Similarly, Mn-NC favored the formation of FDCA (∼67 %) and FFCA (∼28 %), bypassing DFF accumulation. Additionally, a blank experiment was also conducted as a control. Without catalyst addition, ∼23 % HMF conversion was observed, yielding ∼2 % DFF, ∼11 % FFCA, and ∼7 % FDCA. These results highlight the critical role of the catalyst in the overall oxidation process. Evidently, based on the experimental results presented above, the catalyst samples demonstrated higher oxidation efficiency toward hydroxyl functional groups compared to aldehyde functional groups during the HMF oxidation process. Furthermore, these findings confirmed that Co-NC and Mn-NC catalysts exhibited enhanced activity in accelerating the conversion of DFF intermediates into FFCA and FDCA products. This observation corresponded with previous mechanistic studies emphasizing the synergistic redox interactions between Co and M. species during catalytic cycles [40]. To leverage this synergy, a bimetallic CoMn-NC catalyst was synthesized. Remarkably, CoMn-NC achieved complete HMF conversion with exceptional FDCA selectivity (∼95 %), demonstrating accelerated oxidation kinetics for both DFF and FFCA intermediates. Additionally, hot filtration experiments were conducted to verify the heterogeneous nature of the catalytic reaction, and inductively coupled plasma mass spectrometry (ICP-MS) was employed to detect metal content in the filtrate. At the reaction temperature of 80 °C, the catalyst (e.g., CoMn-NC) was mixed with the t-BuOOH/HMF system. After 1 hour of reaction, the mixture was rapidly filtered through a preheated 0.22 μm polytetrafluoroethylene (PTFE) membrane to separate the catalyst from the reaction solution. At this point, HMF conversion reached approximately 78 %, yielding ∼20 % DFF, ∼44 % FFCA, and ∼14 % FDCA. The filtrate was further reacted under identical conditions for up to 12 h. HPLC analysis revealed that HMF conversion exceeded 95 %, but product yields (15 % DFF, 60 % FFCA, and 22 % FDCA) were significantly lower than those obtained under standard reaction conditions. These results suggested that t-BuOOH alone could oxidize HMF, prompting supplementary control experiments. Under standard reaction conditions without catalyst addition (Fig. 1), ∼23 % HMF conversion was observed, generating ∼2 % DFF, ∼11 % FFCA, and ∼7 % FDCA, corroborating this hypothesis. Additionally, ICP-MS analysis of the filtrate detected no measurable metal ions, confirming that reaction activity primarily originated from the heterogeneous catalyst and demonstrating the stability of CoMn-NC with negligible metal leaching during the process. The divergent catalytic activities observed among the synthesized catalysts (Fe-NC, Co-NC, Ni-NC, Mn-NC, and CoMn-NC) might be primarily attributed to variations in their intrinsic physicochemical properties, including the electronic configuration of metal centers, metal loading efficiency, oxidation states, and nanostructural heterogeneity. To systematically elucidate these structure-activity relationships, a comprehensive suite of characterization techniques was employed. The crystallographic features of the catalysts were investigated by X-ray diffraction (XRD). As illustrated in Fig. 2 a, all samples exhibited a prominent diffraction peak at 26.5°, corresponding to the (002) crystallographic plane of graphitic carbon, indicative of a multilayered carbon matrix. Notably, the absence of discernible diffraction peaks associated with metallic phases or metal oxides across all five catalysts suggests the atomic-level dispersion of metal species within the carbonaceous framework. This high dispersion state was usually critical for maximizing accessible active sites in heterogeneous catalysis [39]. The lack of crystalline metal-related phases further implied that metal atoms were likely coordinated to nitrogen ligands, forming stable active centers resistant to aggregation during synthesis. Unlike bulk metal oxides, atomically dispersed metal centers minimize site-blocking effects, potentially improving catalytic efficiency in biomass conversion reactions. Subsequently, the ID/IG values of five catalysts via Raman spectroscopy were systematically analyzed, and the results demonstrated that different metal dopants significantly regulated the defect density of the carbon matrix. All samples exhibited typical d-band (∼1350 cm⁻¹) and G-band (∼1580 cm⁻¹), which corresponded to the disordered structural defects and graphitized structural features of carbon materials, respectively. The defective structures of carbon materials could expose more active sites, enhance charge transfer efficiency, and regulate metal–support interactions [41]. Specifically, Mn single-doping (Mn-NC) exhibits the highest defect density (ID/IG = 2.88), while Co-Mn bimetallic doping (CoMn-NC) balances defect generation and structural stability through a synergistic effect (ID/IG = 2.81). These data align with the mechanism of carbon etching induced by metal doping reported in the literature [42] and further validate the critical role of defect engineering in optimizing catalytic activity. Therefore, the high ID/IG ratios of Co-NC, Mn-NC, and CoMn-NC in this study provide a structural basis for their excellent catalytic performance. The textural properties of the catalysts, including specific surface area, pore volume, and pore size, were systematically investigated via N₂ adsorption-desorption isotherms. As depicted in Fig. 3 and Table 1 , Fe-NC, Co-NC, and Ni-NC exhibited comparable specific surface areas (455.8–522.4 m²/g), while Mn-NC demonstrated a significantly larger surface area (858.3 m²/g). This observation suggests that Mn incorporation enhances the development of porous structures. Consistent with this hypothesis, the bimetallic CoMn-NC displayed an increased surface area (585.4 m²/g) compared to Co-NC. Elemental analysis revealed distinct metal-loading patterns: Fe-NC, Co-NC, and Ni-NC contained approximately 2 wt % metal content, whereas Mn-NC showed reduced incorporation (1 wt %). Notably, the CoMn-NC composite achieved higher total metal loading with 2.3 wt % Co and 0.6 wt % Mn, demonstrating favorable metal co-doping efficiency. The superior catalytic performance of CoMn-NC could therefore be attributed to the optimized combination of enhanced surface area and increased active metal content. The chemical states and coordination environments of CoMn-NC were probed by FT-IR spectra (Figure S1) and XPS spectra (Fig. 4 and Table S1) [39]. As illustrated in Fig. 4b, the C 1 s spectrum deconvoluted into three primary components: graphitic CC (284.5 eV), CN (285.3 eV), and a minor oxidized CO contribution (286.8 eV) [43], the latter likely arising from ambient exposure. The dominance of CN bonding underscored the successful integration of nitrogen into the carbon matrix, a critical feature for stabilizing metal centers and modulating electronic conductivity in catalytic processes. The N 1 s spectrum (Fig. 4d) resolves five distinct nitrogen species: pyridinic N (398.5 eV), metal-coordinated N (Co/Mn-N, 399.6 eV), pyrrolic N (400.2 eV), graphitic N (401.4 eV), and π-π* satellite peaks (405.8 eV) [44]. Comparative analysis of N 1 s spectra across different catalysts (Fig. 4i-l, and Figures S2–5) confirmed consistent N speciation but distinct distribution ratios, implying metal-dependent modulation of carbon-nitrogen frameworks during synthesis. The Co 2p3/2 and Mn 2p3/2 core-level spectra (Fig. 4f-g) confirmed the absence of metallic Co (778.1 eV) or Mn (638.9 eV) phases [45], with binding energies centered at 780.7 eV and 641.2 eV, respectively. These observations, coupled with the lack of metal nanoparticles in TEM (Fig. 5 ), strongly supported the high dispersion of Co and Mn within the N-doped carbon lattice. Intriguingly, the Co binding energy in CoMn-NC exhibited a positive shift compared to Co-NC, while Mn in CoMn-NC showed a negative shift relative to Mn-NC. This reciprocal electronic perturbation implied charge redistribution between Co and Mn centers via bridging nitrogen ligands-a phenomenon consistent with bimetallic synergistic effects observed in CoFe-N-C systems for oxygen reduction [46]. The microstructural characteristics of the CoMn-NC sample were investigated via SEM and TEM. As illustrated in Fig. 1a, the CoMn-NC sample exhibited a hierarchically porous architecture with pore sizes ranging 100–200 nm, devoid of observable metal aggregates. Furthermore, TEM analysis provided additional insights into the morphology of the CoMn-NC sample (Fig. 5), revealing a predominantly uniform layered porous structure, with no evident presence of metallic nanoparticles under the high-resolution image. This observation further substantiated the high dispersion of Co and Mn elements across the catalyst surface, rather than their existence in the form of nano-clusters. Concurrently, HAADF-STEM image, BF-STEM image and EDX-mapping images (Fig. 5c-h) confirmed homogeneous distribution of C, N, Co, and Mn throughout the catalyst matrix, further supporting the absence of metal aggregation. As illustrated in Fig. 1, the CoMn-NC sample exhibited superior catalytic activity, making it the subject of subsequent investigations. The catalytic oxidation of HMF to FDCA over CoMn-NC was systematically investigated under varying reaction temperatures from room temperature to 100 °C. As illustrated in Fig. 6 a and Table S2, a pronounced temperature dependence was observed in both HMF conversion and product distribution. At room temperature, HMF conversion reached 54 %, yielding about 30 % DFF, 11 % FFCA, and 10 % FDCA (51 % carbon yield). Elevating the temperature to 40 °C significantly enhanced HMF conversion (>99 %), with FFCA (37 %) and FDCA (53 %) dominating the product profile, while DFF selectivity dropped to 8 %. And the carbon yield was about 98 %. Further increasing the temperature to 60 °C nearly eliminated DFF formation, shifting selectivity toward FDCA (71 %) with residual FFCA (25 %). Optimal performance was achieved at 80 °C, where FDCA selectivity reached 95 % with complete HMF conversion. Remarkably, at 100 °C, FDCA selectivity further improved to 97 %, demonstrating the thermal stability of the CoMn-NC catalyst under harsh conditions. At lower temperatures (40–80 °C), the reaction kinetics favored intermediate formation (DFF and FFCA), reflecting energy barriers associated with sequential oxidation steps. In contrast, elevated temperatures provided sufficient activation energy to overcome these barriers, driving the reaction toward the thermodynamically stable FDCA. The retention of high FDCA selectivity at 100 °C underscored the robustness of CoMn-NC, likely attributable to strong metal-nitrogen coordination and the hierarchical porous structure, which mitigated metal leaching or aggregation. The effect of the solvent in modulating product distribution was explored using H₂O, MeOH, EtOAc, AcOH, and MeCN (as shown in Fig. 6b, and carbon yields shown in Table S3). When using H₂O, MeOH, or AcOH as the reaction solvent, high HMF conversion (>90 %) was achieved, and FDCA selectivity varied drastically. Low FDCA yields (<30 %) accompanied by unidentified byproducts, likely due to competitive hydration of intermediates or acid-catalyzed side reactions. When H₂O or AcOH was used as the solvent, the formation of levulinic acid was detected in the reaction solution. In contrast, furyl carboxylate esters were observed in the reaction mixture when MeOH served as the solvent. Notably, no humins were detected in any of the reactions described above. When using MeCN or EtOAc as the reaction solvent, superior FDCA selectivity (89–95 %) was achieved with MeCN outperforming EtOAc slightly. The superior performance of MeCN might stem from its ability to facilitate electron transfer at the catalyst surface. Notably, the absence of proton donors in aprotic solvents suppresses the formation of gem‑diol intermediates, which were prone to over-oxidation or polymerization in protic media. These findings underscored the importance of solvent engineering in tandem with catalyst design for selective biomass valorization. The necessity of t-BuOOH as an oxidant was confirmed by control experiments: Without t-BuOOH, HMF remained unreacted (Fig. 6c). Theoretical stoichiometry predicted a 3:1 t-BuOOH:HMF ratio for complete FDCA formation. However, empirical testing revealed that 3 equivalents of t-BuOOH yielded only 80 % HMF conversion, primarily to DFF (27 %) and FFCA (42 %), with minimal FDCA (<5 %). Increasing t-BuOOH to 5 equivalents improved FDCA selectivity to 23 %, while 10 equivalents achieved quantitative HMF conversion with 95 % FDCA yield. Excess oxidant (20 equivalents) provided no further benefit, indicating saturation of active oxygen species. The multi-step nature of HMF oxidation necessitated stoichiometric excess of t-BuOOH to sustain sequential oxygen insertion. Initial steps (HMF → DFF → FFCA) required one equivalent of t-BuOOH each, and the final oxidation (FFCA → FDCA) also demanded one equivalent due to the aldehyde functionalization. Comprehensive temporal profiling of reactant conversion and product distribution was indispensable for unraveling reaction kinetics, identifying intermediates, and validating mechanistic hypotheses. In this study, we systematically tracked the oxidation of HMF to FDCA using CoMn-NC as the catalyst, with parallel experiments initiated from HMF, DFF, and FFCA under identical conditions. As shown in Fig. 7 a, HMF underwent rapid dehydrogenation, achieving 78 % conversion within 1 h, followed by gradual saturation (>95 % at 2 h, ∼100 % at 12 h). DFF selectivity peaked at 20 % within the first hour before declining, consistent with its role as a transient intermediate. Concurrently, FFCA accumulated to 53 % at 2 h, then diminished as FDCA became dominant (≥95 % at 12 h). This sequential profile (HMF → DFF → FFCA → FDCA) aligns with prior reports of hydroxymethyl-first oxidation pathways [32]. Initiation with DFF (Fig. 7b) revealed rapid consumption (75 % conversion at 1 h), accompanied by FFCA accumulation (peak at 65 %), which subsequently decreased as FDCA formed. By 8 h, DFF was fully depleted, and FDCA selectivity reached 92 %, confirming DFF→FFCA→FDCA as the dominant pathway. The kinetic lag in FDCA formation (∼3 h induction period) suggests rate-limiting steps in the final carboxylation of FFCA, likely due to steric hindrance or electronic effects at the catalyst surface. When FFCA was used as the substrate (Fig. 7c), FDCA production mirrored FFCA depletion, achieving near-quantitative conversion (>98 %) within 12 h. This direct correlation underscores FFCA as the immediate precursor to FDCA, with no detectable side products, highlighting the catalyst’s selectivity for aldehyde-to-carboxyl oxidation. The oxidation of HMF to form FDCA was generally proposed to occur through two competing pathways as shown in Scheme 1 . In Pathway I, the process involved the sequential oxidation of the hydroxymethyl group (-CH₂OH → -CHO) to produce DFF, which was then subjected to dual aldehyde oxidation (DFF → FFCA → FDCA). In Pathway II, the initial step was the oxidation of the aldehyde group (-CHO → -COOH), resulting in the formation of HMFCA, which was subsequently oxidized to FFCA and FDCA. Pathway II dominated in basic aqueous media (e.g., NaOH system) due to enhanced aldehyde hydration [29]. While the absence of HMFCA in all temporal profiles, coupled with the transient accumulation of DFF and FFCA, unambiguously established Pathway I as the operative route in this system. This preference might be attributed to the catalytic site specificity. Co/Mn=O species would exhibit stronger affinity for the hydroxymethyl group [47]. By integrating time-resolved kinetic profiling with mechanistic discrimination, this study conclusively established Pathway I as the dominant route for HMF oxidation over CoMn-NC. The catalyst’s unique ability to stabilize DFF and FFCA intermediates while avoiding HMFCA formation provided a blueprint for designing selective oxidation systems. The recyclability and structural robustness of the CoMn-NC catalyst were rigorously evaluated through five consecutive oxidation cycles of HMF to FDCA. As depicted in Fig. 8 a, the catalyst maintained exceptional performance, with HMF conversion >99 % and FDCA selectivity >90 % across all cycles. The above experimental results compellingly demonstrated that the CoMn-NC catalytic system could still maintain excellent catalytic performance after being used multiple times, without showing obvious signs of deactivation. On this basis, the used CoMn-NC was further recycled, and its elemental valence states and microscopic morphologies were analyzed through XPS and TEM characterization. XPS analysis (Fig. 8b-c, Figures S6 and Table S1) identified a positive shift in Co 2p3/2 binding energy, indicative of Co2+ oxidation to Co3+—a transition associated with the formation of reactive Co3+=O intermediates critical for -CH₂OH group or -CHO group activation. The spectral profile of Mn also exhibits a minor shift, suggesting the potential for interconversion between Mn2+ and Mn³+ oxidation states, which facilitated electron transfer during -CH2OH group or -CHO group oxidation. Notably, our experimental results confirmed that Co-NC, Mn-NC, and CoMn-NC all demonstrated effective catalytic activity for the oxidative conversion of HMF to DFF, FFCA, and FDCA. Among these catalysts, CoMn-NC exhibited superior catalytic performance, which we attributed to the synergistic interaction between Co and M. species. This conclusion was supported not only by the aforementioned XPS and Raman spectroscopic analyses but also by O2-TPD characterization of the three catalysts. As shown in Figure S7, O2-TPD profiles of Co-NC, Mn-NC, and CoMn-NC displayed distinct desorption peak temperatures. Co-NC exhibited the highest desorption temperature (∼120 °C), while Mn-NC and CoMn-NC showed similar desorption temperatures (∼110 °C). Generally, a higher desorption temperature indicated stronger binding between oxygen species and the catalyst surface. The strongest oxygen binding on Co-NC might be attributed to the electronic structure and coordination environment of Co atoms, which facilitated chemisorption of oxygen molecules. Notably, the lower desorption temperature of bimetallic CoMn-NC compared to both single-metal catalysts further confirmed the synergistic effect between Co and Mn. This synergy likely arose from two mechanisms: 1) electron transfer between the two metals altered the adsorption and activation of oxygen molecules on the catalyst surface, reducing the oxygen-catalyst binding energy; and 2) structural complementarity generated new active sites with distinct oxygen adsorption/desorption behaviors compared to single-metal sites. Such synergistic effects were critical in catalysis, as more readily desorbed oxygen species could participate more efficiently in reactions, potentially enhancing both activity and selectivity. Additionally, the C 1 s and N 1 s spectra remained virtually unchanged (Figure S6), demonstrating the structural integrity of the nitrogen-doped carbon matrix and its role in stabilizing metal centers through strong Co/Mn-N-C coordination. Furthermore, the changes in the microstructures of the used catalyst and the fresh catalyst were investigated via TEM. As shown in Fig. 8d-e, the used catalyst still retained its porous microstructure, and no obvious structural collapse was observed. Notably, there was no agglomeration of metal elements in the used catalyst, and it still maintained good dispersibility. This could be mainly attributed to the strong interaction between the metal and the support. In particular, the abundant N in the support provided effective anchoring sites for the metal elements, which can effectively inhibit the agglomeration of metal atoms and ensured that the active sites remain in an atomically dispersed state throughout multiple catalytic cycles. Conclusions In conclusion, a bimetallic CoMn-NC catalyst was successfully developed for the catalytic oxidation of HMF to FDCA in this manuscript. A systematic investigation into the reaction parameters, including solvent composition, temperature, oxidant dosage, and reaction duration, revealed their distinct mechanistic roles in governing the oxidation pathway. Optimization of these conditions achieved an exceptional FDCA yield exceeding 95 %, demonstrating the catalyst's superior performance. Crucially, the hierarchical porous architecture of the CoMn-NC framework, coupled with robust Co/Mn-N-C coordination bonds, effectively mitigated metal leaching and nanoparticle aggregation during prolonged catalysis. This structural stability was corroborated by sustained >90 % FDCA selectivity over five consecutive reaction cycles, highlighting its potential for industrial scalability. Comprehensive post-reaction characterization via XPS, and TEM provided critical insights into the catalyst's stability and active-site evolution. This work established a dual-metal synergy strategy for multi-step oxidation pathways, offering insights into the design of robust catalysts for biomass-derived platform molecule upgrading. CRediT authorship contribution statement Rui Zhu: Writing – review & editing, Writing – original draft, Resources, Project administration, Methodology, Investigation, Funding acquisition, Formal analysis, Conceptualization. Fang Gao: Writing – original draft, Validation, Formal analysis, Data curation, Conceptualization. Xinglong Li: Writing – review & editing, Formal analysis, Conceptualization. Declaration of competing interest The authors declare that they have no known competing financial interests or personal relationships that could have appeared to influence the work reported in this paper. Acknowledgements This work was supported by the National Natural Science Foundation of China (22308121), and the Wuxi Science and Technology Development Fund Project (K20221001). Supplementary materials Supplementary material associated with this article can be found, in the online version, at doi:10.1016/j.mcat.2025.115135. Appendix Supplementary materials Image, application 1 References [1] D. Welsby J. Price S. Pye P. Ekins Unextractable fossil fuels in a 1.5 °C world Nature 597 2021 230 234 10.1038/s41586-021-03821-8 D. Welsby, J. Price, S. Pye, P. Ekins, Unextractable fossil fuels in a 1.5 °C world, Nature, 597 (2021) 230–234, https://doi.org/10.1038/s41586-021-03821-8. [2] S. Kar Q.-Q. Zhou Y. Ben-David D. Milstein Catalytic furfural/5-hydroxymethyl furfural oxidation to furoic acid/furan-2,5-dicarboxylic acid with H2 production using alkaline Water as the formal oxidant J. Am. Chem. Soc. 144 2022 1288 1295 10.1021/jacs.1c10908 S. Kar, Q.-Q. Zhou, Y. Ben-David, D. Milstein, Catalytic furfural/5-hydroxymethyl furfural oxidation to furoic acid/furan-2,5-dicarboxylic acid with H2 production using alkaline Water as the formal oxidant, J. Am. Chem. Soc., 144 (2022) 1288–1295, https://doi.org/10.1021/jacs.1c10908. [3] W. Naim O.R. Schade E. Saraçi D. Wüst A. Kruse J.-D. Grunwaldt Toward an intensified process of biomass-derived monomers: the influence of 5-(Hydroxymethyl)furfural byproducts on the gold-catalyzed synthesis of 2,5-furandicarboxylic acid ACS Sustain. Chem. Eng. 8 2020 11512 11521 10.1021/acssuschemeng.0c01319 W. Naim, O.R. Schade, E. Saraçi, D. Wüst, A. Kruse, J.-D. Grunwaldt, Toward an intensified process of biomass-derived monomers: the influence of 5-(Hydroxymethyl)furfural byproducts on the gold-catalyzed synthesis of 2,5-furandicarboxylic acid, ACS Sustain. Chem. Eng., 8 (2020) 11512–11521, https://doi.org/10.1021/acssuschemeng.0c01319. [4] P. Sudarsanam E. Peeters E.V. Makshina V.I. Parvulescu B.F. Sels Advances in porous and nanoscale catalysts for viable biomass conversion Chem. Soc. Rev. 48 2019 2366 2421 10.1039/C8CS00452H P. Sudarsanam, E. Peeters, E.V. Makshina, V.I. Parvulescu, B.F. Sels, Advances in porous and nanoscale catalysts for viable biomass conversion, Chem. Soc. Rev., 48 (2019) 2366–2421, https://doi.org/10.1039/C8CS00452H. [5] Z. Huang N. Luo C. Zhang F. Wang Radical generation and fate control for photocatalytic biomass conversion Nat. Rev. Chem. 6 2022 197 214 10.1038/s41570-022-00359-9 Z. Huang, N. Luo, C. Zhang, F. Wang, Radical generation and fate control for photocatalytic biomass conversion, Nat. Rev. Chem., 6 (2022) 197–214, https://doi.org/10.1038/s41570-022-00359-9. [6] Z. Zhang G.W. Huber Catalytic oxidation of carbohydrates into organic acids and furan chemicals Chem. Soc. Rev. 47 2018 1351 1390 10.1039/C7CS00213K Z. Zhang, G.W. Huber, Catalytic oxidation of carbohydrates into organic acids and furan chemicals, Chem. Soc. Rev., 47 (2018) 1351–1390, https://doi.org/10.1039/C7CS00213K. [7] C. Xu E. Paone D. Rodríguez-Padrón R. Luque F. Mauriello Recent catalytic routes for the preparation and the upgrading of biomass derived furfural and 5-hydroxymethylfurfural Chem. Soc. Rev. 49 2020 4273 4306 10.1039/D0CS00041H C. Xu, E. Paone, D. Rodríguez-Padrón, R. Luque, F. Mauriello, Recent catalytic routes for the preparation and the upgrading of biomass derived furfural and 5-hydroxymethylfurfural, Chem. Soc. Rev., 49 (2020) 4273–4306, https://doi.org/10.1039/D0CS00041H. [8] X. Li Current approaches of the functional and synergetic catalytic systems for converting renewable carbohydrates into 2,5-diformylfuran Molec. Catal. 551 2023 113629 10.1016/j.mcat.2023.113629 X. Li, Current approaches of the functional and synergetic catalytic systems for converting renewable carbohydrates into 2,5-diformylfuran, Molec. Catal., 551 (2023) 113629, https://doi.org/10.1016/j.mcat.2023.113629. [9] E. de Jong H.A. Visser A.S. Dias C. Harvey G.-J.M. Gruter The road to bring FDCA and PEF to the market Polymers (Basel) 14 2022 943 10.3390/polym14050943 E. de Jong, H.A. Visser, A.S. Dias, C. Harvey, G.-J.M. Gruter, The road to bring FDCA and PEF to the market, Polymers (Basel), 14 (2022) 943, https://doi.org/10.3390/polym14050943. [10] A.F. Sousa R. Patrício Z. Terzopoulou D.N. Bikiaris T. Stern J. Wenger K. Loos N. Lotti V. Siracusa A. Szymczyk S. Paszkiewicz K.S. Triantafyllidis A. Zamboulis M.S. Nikolic P. Spasojevic S. Thiyagarajan D.S. van Es N. Guigo Recommendations for replacing PET on packaging, fiber, and film materials with biobased counterparts Green Chem 23 2021 8795 8820 10.1039/D1GC02082J A.F. Sousa, R. Patrício, Z. Terzopoulou, D.N. Bikiaris, T. Stern, J. Wenger, K. Loos, N. Lotti, V. Siracusa, A. Szymczyk, S. Paszkiewicz, K.S. Triantafyllidis, A. Zamboulis, M.S. Nikolic, P. Spasojevic, S. Thiyagarajan, D.S. van Es, N. Guigo, Recommendations for replacing PET on packaging, fiber, and film materials with biobased counterparts, Green Chem., 23 (2021) 8795–8820, https://doi.org/10.1039/D1GC02082J. [11] K.-R. Hwang W. Jeon S.Y. Lee M.-S. Kim Y.-K. Park Sustainable bioplastics: recent progress in the production of bio-building blocks for the bio-based next-generation polymer PEF Chem. Eng. J. 390 2020 124636 10.1016/j.cej.2020.124636 K.-R. Hwang, W. Jeon, S.Y. Lee, M.-S. Kim, Y.-K. Park, Sustainable bioplastics: recent progress in the production of bio-building blocks for the bio-based next-generation polymer PEF, Chem. Eng. J., 390 (2020) 124636, https://doi.org/10.1016/j.cej.2020.124636. [12] N. Li M.-H. Zong (Chemo)biocatalytic upgrading of biobased furanic platforms to chemicals, fuels, and materials: a comprehensive review ACS Catal 12 2022 10080 10114 10.1021/acscatal.2c02912 N. Li, M.-H. Zong, (Chemo)biocatalytic upgrading of biobased furanic platforms to chemicals, fuels, and materials: a comprehensive review, ACS Catal., 12 (2022) 10080–10114, https://doi.org/10.1021/acscatal.2c02912. [13] S. Albonetti C. Hu S. Saravanamurugan Preface to special issue on green conversion of HMF Chem. Sus. Chem. 15 2022 e202201057 10.1002/cssc.202201057 S. Albonetti, C. Hu, S. Saravanamurugan, Preface to special issue on green conversion of HMF, Chem. Sus. Chem., 15 (2022) e202201057, https://doi.org/10.1002/cssc.202201057. [14] Z. Yang J. Zhang G. Qian X. Duan X. Zhou Production of biomass-derived monomers through catalytic conversion of furfural and hydroxymethylfurfural Green Chem. Eng. 2 2021 158 173 10.1016/j.gce.2020.11.001 Z. Yang, J. Zhang, G. Qian, X. Duan, X. Zhou, Production of biomass-derived monomers through catalytic conversion of furfural and hydroxymethylfurfural, Green Chem. Eng., 2 (2021) 158–173, https://doi.org/10.1016/j.gce.2020.11.001. [15] C. Li J. Li L. Qin P. Yang D.G. Vlachos Recent advances in the photocatalytic conversion of biomass-derived furanic compounds ACS Catal 11 2021 11336 11359 10.1021/acscatal.1c02551 C. Li, J. Li, L. Qin, P. Yang, D.G. Vlachos, Recent advances in the photocatalytic conversion of biomass-derived furanic compounds, ACS Catal., 11 (2021) 11336–11359, https://doi.org/10.1021/acscatal.1c02551. [16] X. Li R. Zhu H. Xu Recent advances in direct synthesis of 2,5-furandicarboxylic acid from carbohydrates ACS Sustain. Chem. Eng. 2025 10.1021/acssuschemeng.4c09659 X. Li, R. Zhu, H. Xu, Recent advances in direct synthesis of 2,5-furandicarboxylic acid from carbohydrates, ACS Sustain. Chem. Eng., (2025), https://doi.org/10.1021/acssuschemeng.4c09659. [17] A. Villa M. Schiavoni S. Campisi G.M. Veith L. Prati Pd-modified Au on carbon as an effective and durable catalyst for the direct oxidation of HMF to 2,5-furandicarboxylic acid Chem. Sus. Chem. 6 2013 609 612 10.1002/cssc.201200778 A. Villa, M. Schiavoni, S. Campisi, G.M. Veith, L. Prati, Pd-modified Au on carbon as an effective and durable catalyst for the direct oxidation of HMF to 2,5-furandicarboxylic acid, Chem. Sus. Chem., 6 (2013) 609–612, https://doi.org/10.1002/cssc.201200778. [18] H. Ait Rass N. Essayem M. Besson Selective aqueous phase oxidation of 5-hydroxymethylfurfural to 2,5-furandicarboxylic acid over Pt/C catalysts: influence of the base and effect of bismuth promotion Green Chem 15 2013 2240 2251 10.1039/C3GC40727F H. Ait Rass, N. Essayem, M. Besson, Selective aqueous phase oxidation of 5-hydroxymethylfurfural to 2,5-furandicarboxylic acid over Pt/C catalysts: influence of the base and effect of bismuth promotion, Green Chem., 15 (2013) 2240–2251, https://doi.org/10.1039/C3GC40727F. [19] C. Chen X. Li L. Wang T. Liang L. Wang Y. Zhang J. Zhang Highly porous nitrogen- and phosphorus-codoped graphene: an outstanding support for Pd catalysts to oxidize 5-hydroxymethylfurfural into 2,5-furandicarboxylic acid ACS Sustain. Chem. Eng. 5 2017 11300 11306 10.1021/acssuschemeng.7b02049 C. Chen, X. Li, L. Wang, T. Liang, L. Wang, Y. Zhang, J. Zhang, Highly porous nitrogen- and phosphorus-codoped graphene: an outstanding support for Pd catalysts to oxidize 5-hydroxymethylfurfural into 2,5-furandicarboxylic acid, ACS Sustain. Chem. Eng., 5 (2017) 11300–11306, https://doi.org/10.1021/acssuschemeng.7b02049. [20] O. Casanova S. Iborra A. Corma Biomass into chemicals: aerobic oxidation of 5-hydroxymethyl-2-furfural into 2,5-furandicarboxylic acid with gold nanoparticle catalysts Chem. Sus. Chem. 2 2009 1138 1144 10.1002/cssc.200900137 O. Casanova, S. Iborra, A. Corma, Biomass into chemicals: aerobic oxidation of 5-hydroxymethyl-2-furfural into 2,5-furandicarboxylic acid with gold nanoparticle catalysts, Chem. Sus. Chem., 2 (2009) 1138–1144, https://doi.org/10.1002/cssc.200900137. [21] T. Gao J. Chen W. Fang Q. Cao W. Su F. Dumeignil Ru/MnXCe1OY catalysts with enhanced oxygen mobility and strong metal-support interaction: exceptional performances in 5-hydroxymethylfurfural base-free aerobic oxidation J. Catal. 368 2018 53 68 10.1016/j.jcat.2018.09.034 T. Gao, J. Chen, W. Fang, Q. Cao, W. Su, F. Dumeignil, Ru/MnXCe1OY catalysts with enhanced oxygen mobility and strong metal-support interaction: exceptional performances in 5-hydroxymethylfurfural base-free aerobic oxidation, J. Catal., 368 (2018) 53–68, https://doi.org/10.1016/j.jcat.2018.09.034. [22] D. Bonincontro A. Lolli A. Storione A. Gasparotto B. Berti S. Zacchini N. Dimitratos S. Albonetti Pt and Pt/Sn carbonyl clusters as precursors for the synthesis of supported metal catalysts for the base-free oxidation of HMF Appl. Catal. a-General 588 2019 117279 10.1016/j.apcata.2019.117279 D. Bonincontro, A. Lolli, A. Storione, A. Gasparotto, B. Berti, S. Zacchini, N. Dimitratos, S. Albonetti, Pt and Pt/Sn carbonyl clusters as precursors for the synthesis of supported metal catalysts for the base-free oxidation of HMF, Appl. Catal. a-General, 588 (2019) 117279, https://doi.org/10.1016/j.apcata.2019.117279. [23] D. Bonincontro A. Lolli A. Villa L. Prati N. Dimitratos G.M. Veith L.E. Chinchilla G.A. Botton F. Cavani S. Albonetti AuPd-nNiO as an effective catalyst for the base-free oxidation of HMF under mild reaction conditions Green Chem 21 2019 4090 4099 10.1039/c9gc01283d D. Bonincontro, A. Lolli, A. Villa, L. Prati, N. Dimitratos, G.M. Veith, L.E. Chinchilla, G.A. Botton, F. Cavani, S. Albonetti, AuPd-nNiO as an effective catalyst for the base-free oxidation of HMF under mild reaction conditions, Green Chem., 21 (2019) 4090–4099, https://doi.org/10.1039/c9gc01283d. [24] S. Cattaneo D. Bonincontro T. Bere C.J. Kiely G.J. Hutchings N. Dimitratos S. Albonetti Continuous flow synthesis of bimetallic AuPd catalysts for the selective oxidation of 5-hydroxymethylfurfural to 2,5-furandicarboxylic acid Chem. Nano. Mat. 6 2020 420 426 10.1002/cnma.201900704 S. Cattaneo, D. Bonincontro, T. Bere, C.J. Kiely, G.J. Hutchings, N. Dimitratos, S. Albonetti, Continuous flow synthesis of bimetallic AuPd catalysts for the selective oxidation of 5-hydroxymethylfurfural to 2,5-furandicarboxylic acid, Chem. Nano. Mat., 6 (2020) 420–426, https://doi.org/10.1002/cnma.201900704. [25] C. Megías-Sayago A. Lolli D. Bonincontro A. Penkova S. Albonetti F. Cavani J.A. Odriozola S. Ivanova Effect of gold particles size over Au/C catalyst selectivity in HMF oxidation reaction Chem. Cat. Chem. 12 2020 1177 1183 10.1002/cctc.201901742 C. Megías-Sayago, A. Lolli, D. Bonincontro, A. Penkova, S. Albonetti, F. Cavani, J.A. Odriozola, S. Ivanova, Effect of gold particles size over Au/C catalyst selectivity in HMF oxidation reaction, Chem. Cat. Chem., 12 (2020) 1177–1183, https://doi.org/10.1002/cctc.201901742. [26] F. Liuzzi A. Ventimiglia A. Allegri E. Rodríguez-Aguado J.A. Cecilia I. Rivalta N. Dimitratos S. Albonetti Effect of capping ligands for the synthesis of gold nanoparticles and on the catalytic performance for the oxidation of 5-hydroxymethyl-2-furfural Catalysts 13 2023 990 10.3390/catal13060990 F. Liuzzi, A. Ventimiglia, A. Allegri, E. Rodríguez-Aguado, J.A. Cecilia, I. Rivalta, N. Dimitratos, S. Albonetti, Effect of capping ligands for the synthesis of gold nanoparticles and on the catalytic performance for the oxidation of 5-hydroxymethyl-2-furfural, Catalysts, 13 (2023) 990, https://doi.org/10.3390/catal13060990. [27] T. Gao Y. Yin G. Zhu Q. Cao W. Fang Co3O4 NPs decorated Mn-Co-O solid solution as highly selective catalyst for aerobic base-free oxidation of 5-HMF to 2,5-FDCA in water Catal. Today 355 2020 252 262 10.1016/j.cattod.2019.03.065 T. Gao, Y. Yin, G. Zhu, Q. Cao, W. Fang, Co3O4 NPs decorated Mn-Co-O solid solution as highly selective catalyst for aerobic base-free oxidation of 5-HMF to 2,5-FDCA in water, Catal. Today, 355 (2020) 252–262, https://doi.org/10.1016/j.cattod.2019.03.065. [28] S. Zhang X. Sun Z. Zheng L. Zhang Nanoscale center-hollowed hexagon MnCo2O4 spinel catalyzed aerobic oxidation of 5-hydroxymethylfurfural to 2,5-furandicarboxylic acid Catal. Commun. 113 2018 19 22 10.1016/j.catcom.2018.05.004 S. Zhang, X. Sun, Z. Zheng, L. Zhang, Nanoscale center-hollowed hexagon MnCo2O4 spinel catalyzed aerobic oxidation of 5-hydroxymethylfurfural to 2,5-furandicarboxylic acid, Catal. Commun., 113 (2018) 19–22, https://doi.org/10.1016/j.catcom.2018.05.004. [29] A.S. Amarasekara S.K. Pinzon T. Rockward H.N.K. Herath Spent Li-ion battery electrode material with lithium nickel manganese cobalt oxide as a reusable catalyst for oxidation of biofurans ACS Sustain. Chem. Eng. 10 2022 12642 12650 10.1021/acssuschemeng.2c03346 A.S. Amarasekara, S.K. Pinzon, T. Rockward, H.N.K. Herath, Spent Li-ion battery electrode material with lithium nickel manganese cobalt oxide as a reusable catalyst for oxidation of biofurans, ACS Sustain. Chem. Eng., 10 (2022) 12642–12650, https://doi.org/10.1021/acssuschemeng.2c03346. [30] T.K.T. Le S. Kongparakul H. Zhang J. Zhao G. Guan N. Chanlek T.T.V. Tran C. Samart Highly efficient liquid-phase oxidation of 5-hydroxymethylfurfural over Co-Cu/activated carbon catalysts Mol. Catal. 539 2023 113017 10.1016/j.mcat.2023.113017 T.K.T. Le, S. Kongparakul, H. Zhang, J. Zhao, G. Guan, N. Chanlek, T.T.V. Tran, C. Samart, Highly efficient liquid-phase oxidation of 5-hydroxymethylfurfural over Co-Cu/activated carbon catalysts, Mol. Catal., 539 (2023) 113017, https://doi.org/10.1016/j.mcat.2023.113017. [31] Y.-Z. Qin Y.-M. Li M.-H. Zong H. Wu N. Li Enzyme-catalyzed selective oxidation of 5-hydroxymethylfurfural (HMF) and separation of HMF and 2,5-diformylfuran using deep eutectic solvents Green Chem 17 2015 3718 3722 10.1039/C5GC00788G Y.-Z. Qin, Y.-M. Li, M.-H. Zong, H. Wu, N. Li, Enzyme-catalyzed selective oxidation of 5-hydroxymethylfurfural (HMF) and separation of HMF and 2,5-diformylfuran using deep eutectic solvents, Green Chem., 17 (2015) 3718–3722, https://doi.org/10.1039/C5GC00788G. [32] S. Wang Z. Zhang B. Liu Catalytic conversion of fructose and 5-hydroxymethylfurfural into 2,5-furandicarboxylic acid over a recyclable Fe3O4–CoOx magnetite nanocatalyst ACS Sustain. Chem. Eng0 3 2015 406 412 10.1021/sc500702q S. Wang, Z. Zhang, B. Liu, Catalytic conversion of fructose and 5-hydroxymethylfurfural into 2,5-furandicarboxylic acid over a recyclable Fe3O4–CoOx magnetite nanocatalyst, ACS Sustain. Chem. Eng0, 3 (2015) 406–412, https://doi.org/10.1021/sc500702q. [33] F. Wang J. Lai Z. Liu S. Wen X. Liu Copper-manganese oxide for highly selective oxidation of 5-hydroxymethylfurfural to bio-monomer 2,5-furandicarboxylic acid Biomass Conv. Biorefinery 13 2023 16887 16898 10.1007/s13399-021-02143-z F. Wang, J. Lai, Z. Liu, S. Wen, X. Liu, Copper-manganese oxide for highly selective oxidation of 5-hydroxymethylfurfural to bio-monomer 2,5-furandicarboxylic acid, Biomass Conv. Biorefinery, 13 (2023) 16887–16898, https://doi.org/10.1007/s13399-021-02143-z. [34] S. Das G. Cibin R.I. Walton Selective oxidation of biomass-derived 5-hydroxymethylfurfural catalyzed by an iron-grafted metal–Organic framework with a sustainably sourced ligand ACS Sustain. Chem. Eng. 12 2024 5575 5585 10.1021/acssuschemeng.3c08564 S. Das, G. Cibin, R.I. Walton, Selective oxidation of biomass-derived 5-hydroxymethylfurfural catalyzed by an iron-grafted metal–Organic framework with a sustainably sourced ligand, ACS Sustain. Chem. Eng., 12 (2024) 5575–5585, https://doi.org/10.1021/acssuschemeng.3c08564. [35] D. Gao F. Fang G.I.N. Waterhouse F. Han Y. Li P modified S CoFe-LDH derived CoFeS and CoFeP-400 catalysts efficiently catalyze the oxidation of HMF to FDCA Catal. Sci. Technol. 14 2024 1191 1200 10.1039/D4CY00010B D. Gao, F. Fang, G.I.N. Waterhouse, F. Han, Y. Li, S, P modified CoFe-LDH derived CoFeS and CoFeP-400 catalysts efficiently catalyze the oxidation of HMF to FDCA, Catal. Sci. Technol., 14 (2024) 1191–1200, https://doi.org/10.1039/D4CY00010B. [36] S. Prasad A. Kumar S. Dutta E. Ahmad Chemocatalytic oxidation of 5-hydroxymethylfurfural into 2,5-furandicarboxylic acid over nickel cobalt oxide Chem. Cat. Chem. 16 2024 e202400973 10.1002/cctc.202400973 S. Prasad, A. Kumar, S. Dutta, E. Ahmad, Chemocatalytic oxidation of 5-hydroxymethylfurfural into 2,5-furandicarboxylic acid over nickel cobalt oxide, Chem. Cat. Chem., 16 (2024) e202400973, https://doi.org/10.1002/cctc.202400973. [37] X. Fan L. Li F. Jing J. Li W. Chu Effects of preparation methods on CoAlOx/CeO2 catalysts for methane catalytic combustion Fuel 225 2018 588 595 10.1016/j.fuel.2018.03.006 X. Fan, L. Li, F. Jing, J. Li, W. Chu, Effects of preparation methods on CoAlOx/CeO2 catalysts for methane catalytic combustion, Fuel, 225 (2018) 588–595, https://doi.org/10.1016/j.fuel.2018.03.006. [38] W. Fang Y. Romani Y. Wei M. Jiménez-Ruiz H. Jobic S. Paul L. Jalowiecki-Duhamel Steam reforming and oxidative steam reforming for hydrogen production from bioethanol over Mg2AlNiXHZOY nano-oxyhydride catalysts Int. J. Hydrogen Energy 43 2018 17643 17655 10.1016/j.ijhydene.2018.07.103 W. Fang, Y. Romani, Y. Wei, M. Jiménez-Ruiz, H. Jobic, S. Paul, L. Jalowiecki-Duhamel, Steam reforming and oxidative steam reforming for hydrogen production from bioethanol over Mg2AlNiXHZOY nano-oxyhydride catalysts, Int. J. Hydrogen Energy, 43 (2018) 17643–17655, https://doi.org/10.1016/j.ijhydene.2018.07.103. [39] C. Liu T. Li X. Dai J. Zhao D. He G. Li B. Wang X. Cui Catalytic activity enhancement on alcohol dehydrogenation via directing reaction pathways from single- to double-atom catalysis J. Am. Chem. Soc. 144 2022 4913 4924 10.1021/jacs.1c12705 C. Liu, T. Li, X. Dai, J. Zhao, D. He, G. Li, B. Wang, X. Cui, Catalytic activity enhancement on alcohol dehydrogenation via directing reaction pathways from single- to double-atom catalysis, J. Am. Chem. Soc., 144 (2022) 4913–4924, https://doi.org/10.1021/jacs.1c12705. [40] G.X. Jianan Teng, Yao Fu, Aerobic oxidation of 5-hydroxymethylfurfural to Dimethyl furan-2,5-dicarboxylate over CoMn@NC catalysts using atmospheric oxygen, 38 (2022) 2204031, 10.3866/pku.Whxb202204031. [41] H.Y. Wang H.H. You G.Q. Wu L. Huang J. Yan X.J. Liu Y.K. Ma M.J. Wu Y.L. Zeng J.X. Yu H.G. Zhang Co/Fe co-doped ZIF-8 derived hierarchically porous composites as high-performance electrode materials for Cu2+ions capacitive deionization Chem. Eng. J. 460 2023 141621 10.1016/j.cej.2023.141621 H.Y. Wang, H.H. You, G.Q. Wu, L. Huang, J. Yan, X.J. Liu, Y.K. Ma, M.J. Wu, Y.L. Zeng, J.X. Yu, H.G. Zhang, Co/Fe co-doped ZIF-8 derived hierarchically porous composites as high-performance electrode materials for Cu2+ions capacitive deionization, Chem. Eng. J., 460 (2023) 141621, https://doi.org/10.1016/j.cej.2023.141621. [42] W. Guo C.C. Dun C. Yu X.D. Song F.P. Yang W.Z. Kuang Y.Y. Xie S.F. Li Z. Wang J.H. Yu G.S. Fu J.H. Guo M.A. Marcus J.J. Urban Q.Y. Zhang J.S. Qiu Mismatching integration-enabled strains and defects engineering in LDH microstructure for high-rate and long-life charge storage Nat. Commun. 13 2022 1409 10.1038/s41467-022-28918-0 W. Guo, C.C. Dun, C. Yu, X.D. Song, F.P. Yang, W.Z. Kuang, Y.Y. Xie, S.F. Li, Z. Wang, J.H. Yu, G.S. Fu, J.H. Guo, M.A. Marcus, J.J. Urban, Q.Y. Zhang, J.S. Qiu, Mismatching integration-enabled strains and defects engineering in LDH microstructure for high-rate and long-life charge storage, Nat. Commun., 13 (2022) 1409, https://doi.org/10.1038/s41467-022-28918-0. [43] R. Zhu Y.X. Wang M.S. Cui Metal-free decarboxylative oxygenation of α-amino acids to amide compounds via photoredox catalysis Appl. Catal. A-General 691 2025 120084 10.1016/j.apcata.2024.120084 R. Zhu, Y.X. Wang, M.S. Cui, Metal-free decarboxylative oxygenation of α-amino acids to amide compounds via photoredox catalysis, Appl. Catal. A-General, 691 (2025) 120084, https://doi.org/10.1016/j.apcata.2024.120084. [44] R. Zhu Y.X. Wang M.S. Cui Metal-free decarboxylative oxygenation of α-amino acids to amide compounds via photoredox catalysis Appl. Catal. a-General 691 2025 120084 10.1016/j.apcata.2024.120084 R. Zhu, Y.X. Wang, M.S. Cui, Metal-free decarboxylative oxygenation of α-amino acids to amide compounds via photoredox catalysis, Appl. Catal. a-General, 691 (2025), https://doi.org/10.1016/j.apcata.2024.120084 ARTN 120084. [45] H.G. Salazar-Contreras A. Martínez-Hernández A.A. Boix G.A. Fuentes E. Torres-García Effect of Mn on Co/HMS-Mn and Co/SiO2-Mn catalysts for the Fischer-Tropsch reaction Appl. Catal., B 244 2019 414 426 10.1016/j.apcatb.2018.11.067 H.G. Salazar-Contreras, A. Martínez-Hernández, A.A. Boix, G.A. Fuentes, E. Torres-García, Effect of Mn on Co/HMS-Mn and Co/SiO2-Mn catalysts for the Fischer-Tropsch reaction, Appl. Catal., B, 244 (2019) 414–426, https://doi.org/10.1016/j.apcatb.2018.11.067. [46] X. Zhou J. Gao Y. Hu Z. Jin K. Hu K.M. Reddy Q. Yuan X. Lin H.-J. Qiu Theoretically revealed and experimentally demonstrated synergistic electronic interaction of CoFe dual-metal sites on N-doped carbon for boosting both oxygen reduction and evolution reactions Nano Lett 22 2022 3392 3399 10.1021/acs.nanolett.2c00658 X. Zhou, J. Gao, Y. Hu, Z. Jin, K. Hu, K.M. Reddy, Q. Yuan, X. Lin, H.-J. Qiu, Theoretically revealed and experimentally demonstrated synergistic electronic interaction of CoFe dual-metal sites on N-doped carbon for boosting both oxygen reduction and evolution reactions, Nano Lett., 22 (2022) 3392–3399, https://doi.org/10.1021/acs.nanolett.2c00658. [47] S. Chen Y. Cheng H. Ban Y. Zhang L. Zheng L. Wang X. Li Liquid-phase aerobic oxidation of 5-hydroxymethylfurfural to 2,5-furandicarboxylic acid over Co/Mn/Br catalyst Ind. Eng. Chem. Res. 59 2020 17076 17084 10.1021/acs.iecr.0c01309 S. Chen, Y. Cheng, H. Ban, Y. Zhang, L. Zheng, L. Wang, X. Li, Liquid-phase aerobic oxidation of 5-hydroxymethylfurfural to 2,5-furandicarboxylic acid over Co/Mn/Br catalyst, Ind. Eng. Chem. Res., 59 (2020) 17076–17084, https://doi.org/10.1021/acs.iecr.0c01309.",
      "scopus-id": "105002859224",
      "coredata": {
        "eid": "1-s2.0-S2468823125003207",
        "dc:description": "The development of efficient catalysts for the stepwise oxidation of 5-hydroxymethylfurfural (HMF) to 2,5-diformyl furan (DFF), 5-hydroxymethyl-2-furancarboxylic acid (HMFCA), 5-Formyl-2-furancarboxylic acid (FFCA) or 2,5-furandicarboxylic acid (FDCA) is critical for biomass valorization. Herein, we reported a bimetallic Co-Mn catalyst anchored on nitrogen-doped porous carbon, which was used for the oxidation of HMF to FDCA, avoiding the use of high temperature and high-pressure oxygen. High FDCA selectivity (>95 %) was achieved through reaction condition optimization. And HMF→DFF→FFCA→FDCA was considered to be the main reaction pathway during the whole oxidation process. Additionally, the chemical environment of the constituent elements of the used catalyst was analyzed by XPS. TEM revealed that the catalyst retained its porous structure and excellent metal dispersion after the reaction. This structural stability was corroborated by sustained >90 % FDCA selectivity over five consecutive reaction cycles. This work established a dual-metal synergy strategy for multi-step oxidation pathways, offering insights into the design of robust catalysts for biomass-derived platform molecule upgrading.",
        "openArchiveArticle": "false",
        "prism:coverDate": "2025-06-01",
        "openaccessUserLicense": null,
        "prism:aggregationType": "Journal",
        "prism:url": "https://api.elsevier.com/content/article/pii/S2468823125003207",
        "dc:creator": [
          {
            "@_fa": "true",
            "$": "Zhu, Rui"
          },
          {
            "@_fa": "true",
            "$": "Gao, Fang"
          },
          {
            "@_fa": "true",
            "$": "Li, Xinglong"
          }
        ],
        "link": [
          {
            "@_fa": "true",
            "@rel": "self",
            "@href": "https://api.elsevier.com/content/article/pii/S2468823125003207"
          },
          {
            "@_fa": "true",
            "@rel": "scidir",
            "@href": "https://www.sciencedirect.com/science/article/pii/S2468823125003207"
          }
        ],
        "dc:format": "application/json",
        "openaccessType": null,
        "pii": "S2468-8231(25)00320-7",
        "prism:volume": "580",
        "articleNumber": "115135",
        "prism:publisher": "Elsevier B.V. All rights are reserved, including those for text and data mining, AI training, and similar technologies.",
        "dc:title": "Bimetallic Co-Mn catalyzed chemselective oxidation of 5-hydroxymethylfurfural to 2,5-furandicarboxylic acid",
        "prism:copyright": "© 2025 Elsevier B.V. All rights are reserved, including those for text and data mining, AI training, and similar technologies.",
        "openaccess": "0",
        "prism:issn": "24688231",
        "dcterms:subject": [
          {
            "@_fa": "true",
            "$": "Oxidation"
          },
          {
            "@_fa": "true",
            "$": "5-Hydroxymethylfurfural"
          },
          {
            "@_fa": "true",
            "$": "2,5-furandicarboxylic acid"
          },
          {
            "@_fa": "true",
            "$": "Bimetallic cobalt and manganese catalyst"
          },
          {
            "@_fa": "true",
            "$": "Tert-butyl hydroperoxide"
          }
        ],
        "openaccessArticle": "false",
        "prism:publicationName": "Molecular Catalysis",
        "openaccessSponsorType": null,
        "prism:pageRange": "115135",
        "pubType": "fla",
        "prism:coverDisplayDate": "1 June 2025",
        "prism:doi": "10.1016/j.mcat.2025.115135",
        "prism:startingPage": "115135",
        "dc:identifier": "doi:10.1016/j.mcat.2025.115135",
        "openaccessSponsorName": null
      },
      "objects": {
        "object": [
          {
            "@category": "standard",
            "@height": "410",
            "@width": "753",
            "@_fa": "true",
            "$": "https://api.elsevier.com/content/object/eid/1-s2.0-S2468823125003207-gr3.jpg?httpAccept=%2A%2F%2A",
            "@multimediatype": "JPEG image file",
            "@type": "IMAGE-DOWNSAMPLED",
            "@size": "60085",
            "@ref": "gr3",
            "@mimetype": "image/jpeg"
          },
          {
            "@category": "standard",
            "@height": "887",
            "@width": "715",
            "@_fa": "true",
            "$": "https://api.elsevier.com/content/object/eid/1-s2.0-S2468823125003207-gr4.jpg?httpAccept=%2A%2F%2A",
            "@multimediatype": "JPEG image file",
            "@type": "IMAGE-DOWNSAMPLED",
            "@size": "156018",
            "@ref": "gr4",
            "@mimetype": "image/jpeg"
          },
          {
            "@category": "standard",
            "@height": "287",
            "@width": "357",
            "@_fa": "true",
            "$": "https://api.elsevier.com/content/object/eid/1-s2.0-S2468823125003207-gr1.jpg?httpAccept=%2A%2F%2A",
            "@multimediatype": "JPEG image file",
            "@type": "IMAGE-DOWNSAMPLED",
            "@size": "23960",
            "@ref": "gr1",
            "@mimetype": "image/jpeg"
          },
          {
            "@category": "standard",
            "@height": "308",
            "@width": "715",
            "@_fa": "true",
            "$": "https://api.elsevier.com/content/object/eid/1-s2.0-S2468823125003207-gr2.jpg?httpAccept=%2A%2F%2A",
            "@multimediatype": "JPEG image file",
            "@type": "IMAGE-DOWNSAMPLED",
            "@size": "69920",
            "@ref": "gr2",
            "@mimetype": "image/jpeg"
          },
          {
            "@category": "standard",
            "@height": "196",
            "@width": "500",
            "@_fa": "true",
            "$": "https://api.elsevier.com/content/object/eid/1-s2.0-S2468823125003207-ga1.jpg?httpAccept=%2A%2F%2A",
            "@multimediatype": "JPEG image file",
            "@type": "IMAGE-DOWNSAMPLED",
            "@size": "32108",
            "@ref": "ga1",
            "@mimetype": "image/jpeg"
          },
          {
            "@category": "standard",
            "@height": "158",
            "@width": "678",
            "@_fa": "true",
            "$": "https://api.elsevier.com/content/object/eid/1-s2.0-S2468823125003207-sc1.jpg?httpAccept=%2A%2F%2A",
            "@multimediatype": "JPEG image file",
            "@type": "IMAGE-DOWNSAMPLED",
            "@size": "21518",
            "@ref": "sc1",
            "@mimetype": "image/jpeg"
          },
          {
            "@category": "standard",
            "@height": "195",
            "@width": "753",
            "@_fa": "true",
            "$": "https://api.elsevier.com/content/object/eid/1-s2.0-S2468823125003207-gr7.jpg?httpAccept=%2A%2F%2A",
            "@multimediatype": "JPEG image file",
            "@type": "IMAGE-DOWNSAMPLED",
            "@size": "42315",
            "@ref": "gr7",
            "@mimetype": "image/jpeg"
          },
          {
            "@category": "standard",
            "@height": "766",
            "@width": "621",
            "@_fa": "true",
            "$": "https://api.elsevier.com/content/object/eid/1-s2.0-S2468823125003207-gr8.jpg?httpAccept=%2A%2F%2A",
            "@multimediatype": "JPEG image file",
            "@type": "IMAGE-DOWNSAMPLED",
            "@size": "138014",
            "@ref": "gr8",
            "@mimetype": "image/jpeg"
          },
          {
            "@category": "standard",
            "@height": "585",
            "@width": "678",
            "@_fa": "true",
            "$": "https://api.elsevier.com/content/object/eid/1-s2.0-S2468823125003207-gr5.jpg?httpAccept=%2A%2F%2A",
            "@multimediatype": "JPEG image file",
            "@type": "IMAGE-DOWNSAMPLED",
            "@size": "186992",
            "@ref": "gr5",
            "@mimetype": "image/jpeg"
          },
          {
            "@category": "standard",
            "@height": "194",
            "@width": "753",
            "@_fa": "true",
            "$": "https://api.elsevier.com/content/object/eid/1-s2.0-S2468823125003207-gr6.jpg?httpAccept=%2A%2F%2A",
            "@multimediatype": "JPEG image file",
            "@type": "IMAGE-DOWNSAMPLED",
            "@size": "37640",
            "@ref": "gr6",
            "@mimetype": "image/jpeg"
          },
          {
            "@category": "thumbnail",
            "@height": "119",
            "@width": "219",
            "@_fa": "true",
            "$": "https://api.elsevier.com/content/object/eid/1-s2.0-S2468823125003207-gr3.sml?httpAccept=%2A%2F%2A",
            "@multimediatype": "GIF image file",
            "@type": "IMAGE-THUMBNAIL",
            "@size": "7356",
            "@ref": "gr3",
            "@mimetype": "image/gif"
          },
          {
            "@category": "thumbnail",
            "@height": "164",
            "@width": "132",
            "@_fa": "true",
            "$": "https://api.elsevier.com/content/object/eid/1-s2.0-S2468823125003207-gr4.sml?httpAccept=%2A%2F%2A",
            "@multimediatype": "GIF image file",
            "@type": "IMAGE-THUMBNAIL",
            "@size": "10663",
            "@ref": "gr4",
            "@mimetype": "image/gif"
          },
          {
            "@category": "thumbnail",
            "@height": "164",
            "@width": "204",
            "@_fa": "true",
            "$": "https://api.elsevier.com/content/object/eid/1-s2.0-S2468823125003207-gr1.sml?httpAccept=%2A%2F%2A",
            "@multimediatype": "GIF image file",
            "@type": "IMAGE-THUMBNAIL",
            "@size": "8996",
            "@ref": "gr1",
            "@mimetype": "image/gif"
          },
          {
            "@category": "thumbnail",
            "@height": "94",
            "@width": "219",
            "@_fa": "true",
            "$": "https://api.elsevier.com/content/object/eid/1-s2.0-S2468823125003207-gr2.sml?httpAccept=%2A%2F%2A",
            "@multimediatype": "GIF image file",
            "@type": "IMAGE-THUMBNAIL",
            "@size": "9094",
            "@ref": "gr2",
            "@mimetype": "image/gif"
          },
          {
            "@category": "thumbnail",
            "@height": "86",
            "@width": "219",
            "@_fa": "true",
            "$": "https://api.elsevier.com/content/object/eid/1-s2.0-S2468823125003207-ga1.sml?httpAccept=%2A%2F%2A",
            "@multimediatype": "GIF image file",
            "@type": "IMAGE-THUMBNAIL",
            "@size": "9760",
            "@ref": "ga1",
            "@mimetype": "image/gif"
          },
          {
            "@category": "thumbnail",
            "@height": "51",
            "@width": "219",
            "@_fa": "true",
            "$": "https://api.elsevier.com/content/object/eid/1-s2.0-S2468823125003207-sc1.sml?httpAccept=%2A%2F%2A",
            "@multimediatype": "GIF image file",
            "@type": "IMAGE-THUMBNAIL",
            "@size": "4714",
            "@ref": "sc1",
            "@mimetype": "image/gif"
          },
          {
            "@category": "thumbnail",
            "@height": "57",
            "@width": "219",
            "@_fa": "true",
            "$": "https://api.elsevier.com/content/object/eid/1-s2.0-S2468823125003207-gr7.sml?httpAccept=%2A%2F%2A",
            "@multimediatype": "GIF image file",
            "@type": "IMAGE-THUMBNAIL",
            "@size": "6693",
            "@ref": "gr7",
            "@mimetype": "image/gif"
          },
          {
            "@category": "thumbnail",
            "@height": "164",
            "@width": "133",
            "@_fa": "true",
            "$": "https://api.elsevier.com/content/object/eid/1-s2.0-S2468823125003207-gr8.sml?httpAccept=%2A%2F%2A",
            "@multimediatype": "GIF image file",
            "@type": "IMAGE-THUMBNAIL",
            "@size": "12419",
            "@ref": "gr8",
            "@mimetype": "image/gif"
          },
          {
            "@category": "thumbnail",
            "@height": "164",
            "@width": "190",
            "@_fa": "true",
            "$": "https://api.elsevier.com/content/object/eid/1-s2.0-S2468823125003207-gr5.sml?httpAccept=%2A%2F%2A",
            "@multimediatype": "GIF image file",
            "@type": "IMAGE-THUMBNAIL",
            "@size": "25153",
            "@ref": "gr5",
            "@mimetype": "image/gif"
          },
          {
            "@category": "thumbnail",
            "@height": "56",
            "@width": "219",
            "@_fa": "true",
            "$": "https://api.elsevier.com/content/object/eid/1-s2.0-S2468823125003207-gr6.sml?httpAccept=%2A%2F%2A",
            "@multimediatype": "GIF image file",
            "@type": "IMAGE-THUMBNAIL",
            "@size": "6936",
            "@ref": "gr6",
            "@mimetype": "image/gif"
          },
          {
            "@category": "high",
            "@height": "1815",
            "@width": "3333",
            "@_fa": "true",
            "$": "https://api.elsevier.com/content/object/eid/1-s2.0-S2468823125003207-gr3_lrg.jpg?httpAccept=%2A%2F%2A",
            "@multimediatype": "JPEG image file",
            "@type": "IMAGE-HIGH-RES",
            "@size": "449548",
            "@ref": "gr3",
            "@mimetype": "image/jpeg"
          },
          {
            "@category": "high",
            "@height": "3929",
            "@width": "3167",
            "@_fa": "true",
            "$": "https://api.elsevier.com/content/object/eid/1-s2.0-S2468823125003207-gr4_lrg.jpg?httpAccept=%2A%2F%2A",
            "@multimediatype": "JPEG image file",
            "@type": "IMAGE-HIGH-RES",
            "@size": "1205494",
            "@ref": "gr4",
            "@mimetype": "image/jpeg"
          },
          {
            "@category": "high",
            "@height": "1273",
            "@width": "1583",
            "@_fa": "true",
            "$": "https://api.elsevier.com/content/object/eid/1-s2.0-S2468823125003207-gr1_lrg.jpg?httpAccept=%2A%2F%2A",
            "@multimediatype": "JPEG image file",
            "@type": "IMAGE-HIGH-RES",
            "@size": "141280",
            "@ref": "gr1",
            "@mimetype": "image/jpeg"
          },
          {
            "@category": "high",
            "@height": "1366",
            "@width": "3167",
            "@_fa": "true",
            "$": "https://api.elsevier.com/content/object/eid/1-s2.0-S2468823125003207-gr2_lrg.jpg?httpAccept=%2A%2F%2A",
            "@multimediatype": "JPEG image file",
            "@type": "IMAGE-HIGH-RES",
            "@size": "445891",
            "@ref": "gr2",
            "@mimetype": "image/jpeg"
          },
          {
            "@category": "high",
            "@height": "868",
            "@width": "2213",
            "@_fa": "true",
            "$": "https://api.elsevier.com/content/object/eid/1-s2.0-S2468823125003207-ga1_lrg.jpg?httpAccept=%2A%2F%2A",
            "@multimediatype": "JPEG image file",
            "@type": "IMAGE-HIGH-RES",
            "@size": "209206",
            "@ref": "ga1",
            "@mimetype": "image/jpeg"
          },
          {
            "@category": "high",
            "@height": "699",
            "@width": "3000",
            "@_fa": "true",
            "$": "https://api.elsevier.com/content/object/eid/1-s2.0-S2468823125003207-sc1_lrg.jpg?httpAccept=%2A%2F%2A",
            "@multimediatype": "JPEG image file",
            "@type": "IMAGE-HIGH-RES",
            "@size": "141028",
            "@ref": "sc1",
            "@mimetype": "image/jpeg"
          },
          {
            "@category": "high",
            "@height": "862",
            "@width": "3333",
            "@_fa": "true",
            "$": "https://api.elsevier.com/content/object/eid/1-s2.0-S2468823125003207-gr7_lrg.jpg?httpAccept=%2A%2F%2A",
            "@multimediatype": "JPEG image file",
            "@type": "IMAGE-HIGH-RES",
            "@size": "284690",
            "@ref": "gr7",
            "@mimetype": "image/jpeg"
          },
          {
            "@category": "high",
            "@height": "3391",
            "@width": "2750",
            "@_fa": "true",
            "$": "https://api.elsevier.com/content/object/eid/1-s2.0-S2468823125003207-gr8_lrg.jpg?httpAccept=%2A%2F%2A",
            "@multimediatype": "JPEG image file",
            "@type": "IMAGE-HIGH-RES",
            "@size": "1357487",
            "@ref": "gr8",
            "@mimetype": "image/jpeg"
          },
          {
            "@category": "high",
            "@height": "2587",
            "@width": "3000",
            "@_fa": "true",
            "$": "https://api.elsevier.com/content/object/eid/1-s2.0-S2468823125003207-gr5_lrg.jpg?httpAccept=%2A%2F%2A",
            "@multimediatype": "JPEG image file",
            "@type": "IMAGE-HIGH-RES",
            "@size": "2180429",
            "@ref": "gr5",
            "@mimetype": "image/jpeg"
          },
          {
            "@category": "high",
            "@height": "857",
            "@width": "3333",
            "@_fa": "true",
            "$": "https://api.elsevier.com/content/object/eid/1-s2.0-S2468823125003207-gr6_lrg.jpg?httpAccept=%2A%2F%2A",
            "@multimediatype": "JPEG image file",
            "@type": "IMAGE-HIGH-RES",
            "@size": "239134",
            "@ref": "gr6",
            "@mimetype": "image/jpeg"
          },
          {
            "@category": "standard",
            "@_fa": "true",
            "$": "https://api.elsevier.com/content/object/eid/1-s2.0-S2468823125003207-mmc1.docx?httpAccept=%2A%2F%2A",
            "@multimediatype": "Microsoft Word file",
            "@type": "APPLICATION",
            "@size": "2642445",
            "@ref": "mmc1",
            "@mimetype": "application/word"
          },
          {
            "@category": "thumbnail",
            "@_fa": "true",
            "$": "https://api.elsevier.com/content/object/eid/1-s2.0-S2468823125003207-si1.svg?httpAccept=%2A%2F%2A",
            "@multimediatype": "Scalable Vector Graphics file",
            "@type": "ALTIMG",
            "@size": "11157",
            "@ref": "si1",
            "@mimetype": "image/svg+xml"
          },
          {
            "@category": "thumbnail",
            "@_fa": "true",
            "$": "https://api.elsevier.com/content/object/eid/1-s2.0-S2468823125003207-si2.svg?httpAccept=%2A%2F%2A",
            "@multimediatype": "Scalable Vector Graphics file",
            "@type": "ALTIMG",
            "@size": "10691",
            "@ref": "si2",
            "@mimetype": "image/svg+xml"
          },
          {
            "@category": "thumbnail",
            "@_fa": "true",
            "$": "https://api.elsevier.com/content/object/eid/1-s2.0-S2468823125003207-si3.svg?httpAccept=%2A%2F%2A",
            "@multimediatype": "Scalable Vector Graphics file",
            "@type": "ALTIMG",
            "@size": "14434",
            "@ref": "si3",
            "@mimetype": "image/svg+xml"
          }
        ]
      },
      "link": {
        "@rel": "abstract",
        "@href": "https://api.elsevier.com/content/abstract/scopus_id/105002859224"
      }
    }
  }
}