{
  "metadata": {
    "title": "Methyl mercaptan-to-hydrocarbons: Effect of topology of zeolite catalysts",
    "authors": "; ; ",
    "journal": "Molecular Catalysis",
    "date": "2024-12-31",
    "doi": "10.1016/j.mcat.2024.114541",
    "abstract": "",
    "uri": "https://api.elsevier.com/content/article/pii/S2468823124007235",
    "pii": "S2468823124007235"
  },
  "fulltext": {
    "full-text-retrieval-response": {
      "scopus-eid": "2-s2.0-85203546700",
      "originalText": "serial JL 315758 291210 291744 291790 291809 31 90 Molecular Catalysis MOLECULARCATALYSIS 2024-09-11 2024-09-11 2024-09-11 2024-09-11 2024-11-15T16:17:10 1-s2.0-S2468823124007235 S2468-8231(24)00723-5 S2468823124007235 10.1016/j.mcat.2024.114541 S300 S300.1 FULL-TEXT 1-s2.0-S2468823124X00152 2024-11-15T17:47:59.052827Z 0 0 20241201 20241231 2024 2024-09-11T17:33:55.470336Z absattachment articleinfo articlenumber articletitlenorm authfirstinitialnorm authfirstsurnamenorm cid cids contenttype copyright crossmark dateloaded dateloadedtxt datesearch datesort dateupdated dco docsubtype doctype doi eid ewtransactionid fundingbodyid hubeid indexeddate issn issnnorm itemstage itemtransactionid itemweight oauserlicense openaccess openarchive pg pgfirst pii piinorm pubdateend pubdatestart pubdatetxt pubyr sectiontitle sortorder sponsoredaccesstype srctitle srctitlenorm srctype ssids alllist content oa subj subheadings suppl tomb volfirst volissue volumelist webpdf webpdfpagecount yearnav figure table e-component body acknowledge affil appendices articletitle auth authfirstini authfull authkeywords authlast highlightsabst orcid primabst ref specialabst 2468-8231 24688231 UNLIMITED FRENCHYB24 true 569 569 C Volume 569 12 114541 114541 114541 202412 December 2024 2024-12-01 2024-12-31 2024 Regular Papers article fla © 2024 The Author(s). Published by Elsevier B.V. METHYLMERCAPTANTOHYDROCARBONSEFFECTTOPOLOGYZEOLITECATALYSTS BAYOUT A 1 Introduction 2 Experimental 2.1 Catalysts 2.2 Catalyst characterization 2.3 Catalytic testing 3 Results and discussion 3.1 Catalyst characterization 3.2 Catalytic conversion of methyl mercaptan over zeolites with diverse topology 3.3 Catalytic conversion of methyl mercaptan over H-SSZ-13 zeolites 4 Conclusions CRediT authorship contribution statement Acknowledgment Appendix Supplementary materials References MATAR 2001 1 S CHEMISTRYPETROCHEMICALPROCESSES BRICKER 2012 1315 1323 J BUTTER 1975 S CONVERSIONALCOHOLSMERCAPTANSSULFIDESHALIDESANDORAMIDES OLAH 1984 2143 2149 G MASHKINA 1990 357 362 A HUGUET 2013 344 348 E HULEA 2014 547 553 V CAMMARANO 2014 128 133 C XIE 2023 130029 Y HE 2017 60 69 D HE 2017 66 74 D HE 2018 579 586 D LU 2018 185 197 J TIAN 2023 1443 1455 R CAO 2019 1083 1090 X HE 2018 31 34 D YU 2017 21 27 J YU 2021 3323 3326 M WATANABE 2023 21441 21447 R FABBIANI 2022 111678 M TREACY 2001 M COLLECTIONSIMULATEDXRDPOWDERPATTERNSFORZEOLITESINTERNATIONALZEOLITEASSOCIATIONSTRUCTURECOMMISSION DAHL 1996 304 309 I ILIAS 2013 18 31 S SVELLE 2006 14770 14771 S BJORGEN 2007 195 207 M PARK 2009 180 188 J TEKETEL 2015 22 32 S BALTRUSAITIS 2016 195 203 J BJORGEN 2010 170 180 M BJORGEN 2009 90 97 M LIU 2023 67 92 R BAYOUTX2024X114541 BAYOUTX2024X114541XA Full 2024-09-08T17:49:36Z FundingBody French institutions 2024: Hybrid journals http://creativecommons.org/licenses/by-nc/4.0/ 2026-09-11T00:00:00.000Z 2026-09-11T00:00:00.000Z http://creativecommons.org/licenses/by-nc-nd/4.0/ This is an open access article under the CC BY-NC license. © 2024 The Author(s). Published by Elsevier B.V. 2024-09-18T16:58:42.930Z http://vtw.elsevier.com/data/voc/AddOnTypes/50.7/aggregated-refined TotalEnergies One Tech This work was supported by TotalEnergies One Tech, Belgium. We thank Di Renzo (ICGM) for providing the MCM-22 sample. Amine Geneste (ICGM) is thanked for the TGA-MS measurements. item S2468-8231(24)00723-5 S2468823124007235 1-s2.0-S2468823124007235 10.1016/j.mcat.2024.114541 315758 2024-11-15T17:47:59.052827Z 2024-12-01 2024-12-31 UNLIMITED FRENCHYB24 1-s2.0-S2468823124007235-main.pdf https://s3-eu-west-1.amazonaws.com/prod-ucs-content-store-eu-west/content/pii:S2468823124007235/MAIN/application/pdf/b026d99a5a128b5fb2faa71f880103ca/main.pdf main.pdf pdf true 2130216 MAIN 8 1-s2.0-S2468823124007235-main_1.png https://s3-eu-west-1.amazonaws.com/prod-ucs-content-store-eu-west/content/pii:S2468823124007235/PREVIEW/image/png/76d898436b60594ffef91d27721515fe/main_1.png main_1.png png 60789 849 656 IMAGE-WEB-PDF 1 1-s2.0-S2468823124007235-gr6.jpg https://s3-eu-west-1.amazonaws.com/prod-ucs-content-store-eu-west/content/pii:S2468823124007235/gr6/DOWNSAMPLED/image/jpeg/c5e22418c7c708ea3497c10523f9b43a/gr6.jpg gr6 gr6.jpg jpg 27641 453 565 IMAGE-DOWNSAMPLED 1-s2.0-S2468823124007235-gr5.jpg https://s3-eu-west-1.amazonaws.com/prod-ucs-content-store-eu-west/content/pii:S2468823124007235/gr5/DOWNSAMPLED/image/jpeg/91cdfea5b437bb48ca1f4d9a9c7b6218/gr5.jpg gr5 gr5.jpg jpg 26018 210 565 IMAGE-DOWNSAMPLED 1-s2.0-S2468823124007235-gr4.jpg https://s3-eu-west-1.amazonaws.com/prod-ucs-content-store-eu-west/content/pii:S2468823124007235/gr4/DOWNSAMPLED/image/jpeg/1150df199a99bd719d622f20e54bdfcc/gr4.jpg gr4 gr4.jpg jpg 29158 466 565 IMAGE-DOWNSAMPLED 1-s2.0-S2468823124007235-gr12.jpg https://s3-eu-west-1.amazonaws.com/prod-ucs-content-store-eu-west/content/pii:S2468823124007235/gr12/DOWNSAMPLED/image/jpeg/ffbc5fe4f1e6c89eca017567e1794565/gr12.jpg gr12 gr12.jpg jpg 29870 259 376 IMAGE-DOWNSAMPLED 1-s2.0-S2468823124007235-gr3.jpg https://s3-eu-west-1.amazonaws.com/prod-ucs-content-store-eu-west/content/pii:S2468823124007235/gr3/DOWNSAMPLED/image/jpeg/c301a9ad19acf43c707ba072c2d2452a/gr3.jpg gr3 gr3.jpg jpg 14432 304 376 IMAGE-DOWNSAMPLED 1-s2.0-S2468823124007235-gr2.jpg https://s3-eu-west-1.amazonaws.com/prod-ucs-content-store-eu-west/content/pii:S2468823124007235/gr2/DOWNSAMPLED/image/jpeg/637e34f3e313d91eea9575ce16fbc3d2/gr2.jpg gr2 gr2.jpg jpg 29629 343 376 IMAGE-DOWNSAMPLED 1-s2.0-S2468823124007235-gr1.jpg https://s3-eu-west-1.amazonaws.com/prod-ucs-content-store-eu-west/content/pii:S2468823124007235/gr1/DOWNSAMPLED/image/jpeg/58ae17ccc001c35819516e87aa8bffe9/gr1.jpg gr1 gr1.jpg jpg 74325 853 791 IMAGE-DOWNSAMPLED 1-s2.0-S2468823124007235-sc1.jpg https://s3-eu-west-1.amazonaws.com/prod-ucs-content-store-eu-west/content/pii:S2468823124007235/sc1/DOWNSAMPLED/image/jpeg/1f0e66674aec6538b356d984202f80b2/sc1.jpg sc1 sc1.jpg jpg 38099 222 565 IMAGE-DOWNSAMPLED 1-s2.0-S2468823124007235-gr10.jpg https://s3-eu-west-1.amazonaws.com/prod-ucs-content-store-eu-west/content/pii:S2468823124007235/gr10/DOWNSAMPLED/image/jpeg/fb781cc4e2318019417d1289a64e4bb3/gr10.jpg gr10 gr10.jpg jpg 28326 306 376 IMAGE-DOWNSAMPLED 1-s2.0-S2468823124007235-gr11.jpg https://s3-eu-west-1.amazonaws.com/prod-ucs-content-store-eu-west/content/pii:S2468823124007235/gr11/DOWNSAMPLED/image/jpeg/85382354741fba2c34c991222fd78479/gr11.jpg gr11 gr11.jpg jpg 20938 299 376 IMAGE-DOWNSAMPLED 1-s2.0-S2468823124007235-ga1.jpg https://s3-eu-west-1.amazonaws.com/prod-ucs-content-store-eu-west/content/pii:S2468823124007235/ga1/DOWNSAMPLED/image/jpeg/4dd44f50b2f23b0b182b805e7c3ef1b4/ga1.jpg ga1 true ga1.jpg jpg 17841 200 317 IMAGE-DOWNSAMPLED 1-s2.0-S2468823124007235-gr9.jpg https://s3-eu-west-1.amazonaws.com/prod-ucs-content-store-eu-west/content/pii:S2468823124007235/gr9/DOWNSAMPLED/image/jpeg/435c5fd8d374e0d8ad15254281ebdf66/gr9.jpg gr9 gr9.jpg jpg 30460 260 342 IMAGE-DOWNSAMPLED 1-s2.0-S2468823124007235-gr8.jpg https://s3-eu-west-1.amazonaws.com/prod-ucs-content-store-eu-west/content/pii:S2468823124007235/gr8/DOWNSAMPLED/image/jpeg/3c5b8fd6acb422d347fa508e4795b19d/gr8.jpg gr8 gr8.jpg jpg 13474 184 791 IMAGE-DOWNSAMPLED 1-s2.0-S2468823124007235-gr7.jpg https://s3-eu-west-1.amazonaws.com/prod-ucs-content-store-eu-west/content/pii:S2468823124007235/gr7/DOWNSAMPLED/image/jpeg/a4b9a30efc1f9764b5b0a7e64f7a5a23/gr7.jpg gr7 gr7.jpg jpg 21454 201 791 IMAGE-DOWNSAMPLED 1-s2.0-S2468823124007235-gr6.sml https://s3-eu-west-1.amazonaws.com/prod-ucs-content-store-eu-west/content/pii:S2468823124007235/gr6/THUMBNAIL/image/gif/1d96d43fcb99d9d3b6e2681d5363a9e4/gr6.sml gr6 gr6.sml sml 6626 164 204 IMAGE-THUMBNAIL 1-s2.0-S2468823124007235-gr5.sml https://s3-eu-west-1.amazonaws.com/prod-ucs-content-store-eu-west/content/pii:S2468823124007235/gr5/THUMBNAIL/image/gif/09bcf81c642f060d7e43c4255e8bc8a8/gr5.sml gr5 gr5.sml sml 6379 81 219 IMAGE-THUMBNAIL 1-s2.0-S2468823124007235-gr4.sml https://s3-eu-west-1.amazonaws.com/prod-ucs-content-store-eu-west/content/pii:S2468823124007235/gr4/THUMBNAIL/image/gif/cc60629022989819a847a166bddb846c/gr4.sml gr4 gr4.sml sml 6425 164 199 IMAGE-THUMBNAIL 1-s2.0-S2468823124007235-gr12.sml https://s3-eu-west-1.amazonaws.com/prod-ucs-content-store-eu-west/content/pii:S2468823124007235/gr12/THUMBNAIL/image/gif/3aca4c6f642589d00647cbf580b71338/gr12.sml gr12 gr12.sml sml 8692 151 219 IMAGE-THUMBNAIL 1-s2.0-S2468823124007235-gr3.sml https://s3-eu-west-1.amazonaws.com/prod-ucs-content-store-eu-west/content/pii:S2468823124007235/gr3/THUMBNAIL/image/gif/fad219b2cfe0c740ca1699f97ad5fa14/gr3.sml gr3 gr3.sml sml 5449 164 203 IMAGE-THUMBNAIL 1-s2.0-S2468823124007235-gr2.sml https://s3-eu-west-1.amazonaws.com/prod-ucs-content-store-eu-west/content/pii:S2468823124007235/gr2/THUMBNAIL/image/gif/8cdc4a9aa784f646a0a3f5958a079195/gr2.sml gr2 gr2.sml sml 9284 164 180 IMAGE-THUMBNAIL 1-s2.0-S2468823124007235-gr1.sml https://s3-eu-west-1.amazonaws.com/prod-ucs-content-store-eu-west/content/pii:S2468823124007235/gr1/THUMBNAIL/image/gif/67f1f8cc547f12ae8c4796a7e999258c/gr1.sml gr1 gr1.sml sml 6506 164 152 IMAGE-THUMBNAIL 1-s2.0-S2468823124007235-sc1.sml https://s3-eu-west-1.amazonaws.com/prod-ucs-content-store-eu-west/content/pii:S2468823124007235/sc1/THUMBNAIL/image/gif/826f3b3b6a5101d7a71e722d357130c8/sc1.sml sc1 sc1.sml sml 6858 86 219 IMAGE-THUMBNAIL 1-s2.0-S2468823124007235-gr10.sml https://s3-eu-west-1.amazonaws.com/prod-ucs-content-store-eu-west/content/pii:S2468823124007235/gr10/THUMBNAIL/image/gif/0460102dc0473c9fd8443218cbf7a627/gr10.sml gr10 gr10.sml sml 8193 164 201 IMAGE-THUMBNAIL 1-s2.0-S2468823124007235-gr11.sml https://s3-eu-west-1.amazonaws.com/prod-ucs-content-store-eu-west/content/pii:S2468823124007235/gr11/THUMBNAIL/image/gif/bd85be551af2ad5d3f17143e445360c3/gr11.sml gr11 gr11.sml sml 5977 164 206 IMAGE-THUMBNAIL 1-s2.0-S2468823124007235-ga1.sml https://s3-eu-west-1.amazonaws.com/prod-ucs-content-store-eu-west/content/pii:S2468823124007235/ga1/THUMBNAIL/image/gif/d701917a93f2597934f4e7e92f25fd8b/ga1.sml ga1 true ga1.sml sml 10688 138 219 IMAGE-THUMBNAIL 1-s2.0-S2468823124007235-gr9.sml https://s3-eu-west-1.amazonaws.com/prod-ucs-content-store-eu-west/content/pii:S2468823124007235/gr9/THUMBNAIL/image/gif/5e366c85929e6e19437605beef666680/gr9.sml gr9 gr9.sml sml 12021 164 215 IMAGE-THUMBNAIL 1-s2.0-S2468823124007235-gr8.sml https://s3-eu-west-1.amazonaws.com/prod-ucs-content-store-eu-west/content/pii:S2468823124007235/gr8/THUMBNAIL/image/gif/d50f3e160af252debead94886bd69a9d/gr8.sml gr8 gr8.sml sml 4332 51 219 IMAGE-THUMBNAIL 1-s2.0-S2468823124007235-gr7.sml https://s3-eu-west-1.amazonaws.com/prod-ucs-content-store-eu-west/content/pii:S2468823124007235/gr7/THUMBNAIL/image/gif/fb05be5d39eb5f5d71ef522d4f90a720/gr7.sml gr7 gr7.sml sml 5058 56 219 IMAGE-THUMBNAIL 1-s2.0-S2468823124007235-gr6_lrg.jpg https://s3-eu-west-1.amazonaws.com/prod-ucs-content-store-eu-west/content/pii:S2468823124007235/HIGHRES/image/jpeg/c1e98b846bb171a92bf4e0369a277811/gr6_lrg.jpg gr6 gr6_lrg.jpg jpg 176716 2004 2500 IMAGE-HIGH-RES 1-s2.0-S2468823124007235-gr5_lrg.jpg https://s3-eu-west-1.amazonaws.com/prod-ucs-content-store-eu-west/content/pii:S2468823124007235/HIGHRES/image/jpeg/5e2c4ae45cb84a8099829ede95bef333/gr5_lrg.jpg gr5 gr5_lrg.jpg jpg 133203 927 2500 IMAGE-HIGH-RES 1-s2.0-S2468823124007235-gr4_lrg.jpg https://s3-eu-west-1.amazonaws.com/prod-ucs-content-store-eu-west/content/pii:S2468823124007235/HIGHRES/image/jpeg/b38d562ade859090ff7dcfa5711c8ebf/gr4_lrg.jpg gr4 gr4_lrg.jpg jpg 178806 2062 2500 IMAGE-HIGH-RES 1-s2.0-S2468823124007235-gr12_lrg.jpg https://s3-eu-west-1.amazonaws.com/prod-ucs-content-store-eu-west/content/pii:S2468823124007235/HIGHRES/image/jpeg/d3003ff3bf0ba388c35cb2c197e401cc/gr12_lrg.jpg gr12 gr12_lrg.jpg jpg 206444 1147 1667 IMAGE-HIGH-RES 1-s2.0-S2468823124007235-gr3_lrg.jpg https://s3-eu-west-1.amazonaws.com/prod-ucs-content-store-eu-west/content/pii:S2468823124007235/HIGHRES/image/jpeg/14aa83c90cc7530b81ca265a9b0f32b0/gr3_lrg.jpg gr3 gr3_lrg.jpg jpg 111243 1347 1667 IMAGE-HIGH-RES 1-s2.0-S2468823124007235-gr2_lrg.jpg https://s3-eu-west-1.amazonaws.com/prod-ucs-content-store-eu-west/content/pii:S2468823124007235/HIGHRES/image/jpeg/72464730e2f14aa76d9476364c5ebe47/gr2_lrg.jpg gr2 gr2_lrg.jpg jpg 185900 1520 1667 IMAGE-HIGH-RES 1-s2.0-S2468823124007235-gr1_lrg.jpg https://s3-eu-west-1.amazonaws.com/prod-ucs-content-store-eu-west/content/pii:S2468823124007235/HIGHRES/image/jpeg/e9a02b4579a4242bb56d48ab38dc0ab8/gr1_lrg.jpg gr1 gr1_lrg.jpg jpg 475348 3776 3500 IMAGE-HIGH-RES 1-s2.0-S2468823124007235-sc1_lrg.jpg https://s3-eu-west-1.amazonaws.com/prod-ucs-content-store-eu-west/content/pii:S2468823124007235/HIGHRES/image/jpeg/fc06bb226de483f490ad67efad34b927/sc1_lrg.jpg sc1 sc1_lrg.jpg jpg 258686 981 2500 IMAGE-HIGH-RES 1-s2.0-S2468823124007235-gr10_lrg.jpg https://s3-eu-west-1.amazonaws.com/prod-ucs-content-store-eu-west/content/pii:S2468823124007235/HIGHRES/image/jpeg/a8c6656bd2647af072f29aba954211e2/gr10_lrg.jpg gr10 gr10_lrg.jpg jpg 181814 1356 1667 IMAGE-HIGH-RES 1-s2.0-S2468823124007235-gr11_lrg.jpg https://s3-eu-west-1.amazonaws.com/prod-ucs-content-store-eu-west/content/pii:S2468823124007235/HIGHRES/image/jpeg/d9e6476ec2d1362676f479033972ef8c/gr11_lrg.jpg gr11 gr11_lrg.jpg jpg 169820 1327 1667 IMAGE-HIGH-RES 1-s2.0-S2468823124007235-ga1_lrg.jpg https://s3-eu-west-1.amazonaws.com/prod-ucs-content-store-eu-west/content/pii:S2468823124007235/HIGHRES/image/jpeg/7f0f17ab8b6679c9f28745298c9f891e/ga1_lrg.jpg ga1 true ga1_lrg.jpg jpg 118773 886 1403 IMAGE-HIGH-RES 1-s2.0-S2468823124007235-gr9_lrg.jpg https://s3-eu-west-1.amazonaws.com/prod-ucs-content-store-eu-west/content/pii:S2468823124007235/HIGHRES/image/jpeg/3aa6f24d45c8816f3c565c0b8a819e09/gr9_lrg.jpg gr9 gr9_lrg.jpg jpg 182304 1153 1516 IMAGE-HIGH-RES 1-s2.0-S2468823124007235-gr8_lrg.jpg https://s3-eu-west-1.amazonaws.com/prod-ucs-content-store-eu-west/content/pii:S2045232219156313/HIGHRES/image/jpeg/0766ca9d853628e577e6f323632169f7/gr8_lrg.jpg gr8 gr8_lrg.jpg jpg 93001 816 3500 IMAGE-HIGH-RES 1-s2.0-S2468823124007235-gr7_lrg.jpg https://s3-eu-west-1.amazonaws.com/prod-ucs-content-store-eu-west/content/pii:S2045232219156313/HIGHRES/image/jpeg/5495c277a7518f9b3ebf5c6115b3c962/gr7_lrg.jpg gr7 gr7_lrg.jpg jpg 163333 890 3500 IMAGE-HIGH-RES 1-s2.0-S2468823124007235-mmc1.docx https://s3-eu-west-1.amazonaws.com/prod-ucs-content-store-eu-west/content/pii:S2468823124007235/mmc1/MAIN/application/vnd.openxmlformats-officedocument.wordprocessingml.document/c63faa8eab37c4f54357fda83c48cd1d/mmc1.docx mmc1 mmc1.docx docx 284945 APPLICATION 1-s2.0-S2468823124007235-am.pdf https://s3-eu-west-1.amazonaws.com/prod-ucs-content-store-eu-west/content/egi:10LLT722G6P/MAIN/application/pdf/6ec36c9877a1b08f80a47042a9b6a1cc/am.pdf am am.pdf pdf false 538007 AAM-PDF MCAT 114541 114541 S2468-8231(24)00723-5 10.1016/j.mcat.2024.114541 The Author(s) Fig. 1 GC-FID chromatograms for the methyl mercaptan decomposition on zeolites with various topologies. Conditions: mcat = 100 mg; T = 450 °C; volume flow rate = 10 mL min-1; P = 1 atm; WHSV = 0.64 gCH3SH gcat -1 h-1; tos = 60 min; C1 - methane, C2= - ethylene, C2 - ethane, C3= - propylene, C3 - propane. Fig 1 Fig. 2 Distribution of aliphatic hydrocarbons and DMS on zeolites with various topologies. Conditions: mcat = 100 mg; T = 450 °C; volume flow rate = 10 mL min-1; P = 1 atm; WHSV = 0.64 gCH3SH gcat -1 h-1; tos = 60 min. Fig 2 Fig. 3 Amount of aromatics based on peak area in chromatograms. Conditions: mcat = 100 mg; T = 450 °C; volume flow rate = 10 mL min-1; P = 1 atm; WHSV = 0.64 gCH3SH gcat -1 h-1; tos = 60 min. Fig 3 Fig. 4 GC-FPD chromatograms for the methyl mercaptan decomposition on H-ZSM-5 et H-SSZ-13 zeolites. Conditions: mcat = 100 mg; T = 450 °C; volume flow rate = 10 mL min-1; P = 1 atm; WHSV = 0.64 gCH3SH gcat -1 h-1; tos = 60 min. Fig 4 Scheme 1 Plausible reactions involved in the conversion of methyl mercaptan into hydrocarbons (PMA = polymethyl aromatics). Scheme 1 Fig. 5 GC-FID chromatograms for the methyl mercaptan decomposition on H-ZSM-5 et H-SSZ-13 zeolites. Conditions: mcat = 100 mg; T = 500 °C; volume flow rate = 10 mL min-1; P = 1 atm; WHSV = 0.64 gCH3SH gcat -1 h-1 ; tos = 60 min; C1 - methane, C2= - ethylene, C2 - ethane, C3= - propylene, C3 - propane. Fig 5 Fig. 6 GC-FID chromatograms for the methyl mercaptan decomposition on H-ZSM-5 et H-SSZ-13 zeolites. T = 500 °C. Fig 6 Fig. 7 GC-FID chromatogram for the methyl mercaptan decomposition on H-SSZ-13 zeolites. Conditions: mcat = 200 mg; T = 400 °C; volume flow rate = 10 mL min-1; P = 1 atm; WHSV = 0.32 gCH3SH gcat -1 h-1; tos = 60 min. Fig 7 Fig. 8 GC-FPD chromatogram for the methyl mercaptan decomposition on H-SSZ-13 zeolites. T = 400 °C. Fig 8 Fig. 9 CH3SH conversion (black curve) and C-based product distribution (columns) as a function of time on stream over H-SSZ-13 zeolite. Conditions: mcat = 200 mg; T = 400 °C; volume flow rate = 10 mL min-1; P = 1 atm; WHSV = 0.32 gCH3SH gcat -1 h-1. Fig 9 Fig. 10 Composition of sulfur products as a function of time on stream over H-SSZ-13 zeolite. Conditions: mcat = 200 mg; T = 400 °C; volume flow rate = 10 mL min-1; P = 1 atm; WHSV = 0.32 gCH3SH gcat -1 h-1. Fig 10 Fig. 11 Nitrogen sorption isotherms. Catalytic test carried out at 400 °C, for 6.5 h on stream. Fig 11 Fig. 12 TGA profile and MS signal of CO2 (red, m/z = 44) and SO2 (blue, m/z = 64) of the SSZ-13 used catalyst. Catalytic test carried out at 400 °C, for 6.5 h on stream. Fig 12 Table 1 Textural properties of the fresh and used catalyst. Table 1 H-SSZ-13 (fresh) H-SSZ-13 (used) Loss % Total surface area (BET) a , m2 g-1 626 415 34 External surface area (BET) b , m2 g-1 90 70 22 Micropores surface area (BET) b , m2 g-1 536 345 36 Micropore volume b , mL g-1 0.21 0 .13 38 a Surface area determined using the BET method. b Calculated using the t-plot method. Methyl mercaptan-to-hydrocarbons: Effect of topology of zeolite catalysts Abdelilah Bayout Writing – original draft Formal analysis Data curation a Claudia Cammarano Writing – review & editing Writing – original draft Supervision Methodology Conceptualization a Olinda Gimello Validation Data curation a Izabel Medeiros Costa Validation Supervision Conceptualization b Gleb Veryasov Validation Supervision Resources Conceptualization c Vasile Hulea Writing – review & editing Validation Supervision Project administration Methodology Conceptualization a ⁎ a Charles Gerhardt Institute of Montpellier, University of Montpellier, CNRS, ENSCM, 1919 Rte de Mende, 34293, Montpellier Cedex 5, France Charles Gerhardt Institute of Montpellier University of Montpellier CNRS ENSCM Cedex 5 1919 Rte de Mende Montpellier 34293 France aCharles Gerhardt Institute of Montpellier, University of Montpellier, CNRS, ENSCM, 1919 Rte de Mende, 34293, Montpellier Cedex 5, France b TotalEnergies One Tech, Courbevoie, France TotalEnergies One Tech Courbevoie France bTotalEnergies One Tech, Courbevoie, France c Total Energies One Tech, Zone Industrielle C, 7181, Feluy, Belgium Total Energies One Tech Zone Industrielle C Feluy 7181 Belgium cTotal Energies One Tech, Zone Industrielle C, 7181, Feluy, Belgium ⁎ Corresponding author. The conversion of methyl mercaptan was examined over zeolites with MFI, FAU, BEA, MOR, CHA and MWW topology and Si/Al ratio between 10 and 19. At 450 °C, over all catalysts, the reagent has been primarily consumed into hydrocarbons and H2S. The crucial variables affecting the hydrocarbon distribution over zeolites were mainly their pore size/architecture and the amount of the acid sites. Over 3D H-ZSM-5, H-β and H-MOR zeolite, many aromatics and only few olefins were produced. In contrast, and analogous to methanol-to-hydrocarbons process, H-SSZ-13 and H-MCM-22 zeolite (containing cages and small pores) mainly produced C2-C3 olefins. Graphical abstract Image, graphical abstract Keywords Methyl mercaptan Zeolites Heterogeneous catalysis Hydrocarbons Data availability The authors do not have permission to share data. 1 Introduction Methyl mercaptan is a common contaminant in natural and industrial gases. The current technologies used for removing this toxic and corrosive compound require specific solvents or include reactions using additional reagents such as H2, O2, olefins, NaOH, etc. [1,2]. Because these processes often generate waste, research efforts have been undertaken to develop alternative routes that do not need additional reagents. Among these, the catalytic conversion of methyl mercaptan into hydrocarbons and H2S (CH3SH → Hydrocarbons + H2S) is considered one of the most promising and environmentally friendly technologies. H2S produced in this reaction can be recovered by absorption in amines, and then it can be converted into elemental sulfur using the Claus process. Before 2010, only few data and discussion concerning this topic could be found in the open literature [3-5]. Accordingly, catalysts like ZSM-5 or WO3/Al2O3 were able to catalyse the methyl mercaptan conversion into dimethyl sulfide, methane and H2S as main products. Systematic studies on the catalytic conversion of CH3SH have been realized by the Montpellier group [6-8]. The authors showed that over zeolites CH3SH can be selectively converted into H2S and hydrocarbons. This process was called M2TH (for Methyl Mercaptan To Hydrocarbons). At temperatures higher than 500 °C the reaction products were methane, ethane, propane (C1-C3), and small amount of aromatics (benzene, toluene and xylene). To improve the catalyst activity and the stability against the coking, some research groups added metals and oxides to zeolites [9]. In a series of studies, Luo and collab. [10-15] examined the decomposition of CH3SH in the presence of HZSM-5 modified with rare earth metals (La, Ce, Pr, Sm, Nd, Y, Er). Methane and H2S were the major reaction products, besides small amount of C2H4 and C2H6. The same research group used Na- and Cr-modified HZSM-5 catalysts for the CH3SH degradation [16,17]. Both catalysts were more active and stable than the parent HZSM-5. The studies cited above were regularly performed at temperatures higher than 500 °C and the methyl mercaptan was transformed into H2S and a mixture of unsaturated C1-C3 hydrocarbons. Some recent publications showed that at moderate temperatures, over specific zeolite catalysts, CH3SH can be selectively converted into light olefins, which are molecules with high added value. Yu et al. [18] reported about an original methanethiol-to-olefins process, similar to the well-known methanol-to-olefins process. Accordingly, in the temperature range of 400–450 °C, CH3SH can be converted to ethylene and propylene over SSZ-13, a zeolite with CHA topology. Yields up to 50% in olefins have been obtained during the first 2 h on stream. High selectivities to light olefins, especially to ethylene, have been reported by Watanabe et al. [19] in the methanethiol-to-olefins process catalyzed by Ga-ZSM-5. This performance has been related to the low strength of the acidic sites generated by the Ga species. The aim of our contribution was to gather more knowledge on methanethiol-to-hydrocarbon process, and particularly to understand the role of the catalyst. Thus, we studied for the first time the catalytic conversion of methyl mercaptan at moderate temperatures by comparing zeolites with variable topology. Zeolites used in this study were chosen among the most used catalysts in the industrial technologies. Thus, protonic zeolites with different pore systems, including H-ZSM-5 (MFI), H-Y (FAU), H-β (BEA), H-Mordenite (MOR), H-MCM-22 (MWW) and H-SSZ-13 (CHA) were selected for this work. ZSM-5 is characterized by a 3D channel architecture and 10-membered ring (MR) pores (0.53 × 0.56 nm). Y porosity consists in large cages (1.2 nm) which are interconnected by windows of 0.74 nm. β is a 3D zeolite, with pores of 12 MR (0.66 × 0.67; 0.56 × 0.56 nm). The pore system of mordenite consists of 12 MR main channels of 0.65 × 0.7 nm, which are connected by 8 MR pores of 0.26 × 0.57 nm. MCM-22 has a 2D pore network of sinusoidal channels (0.4 × 0.55 nm) and cages (0.7 × 0.7 × 1.87 nm) which are accessible through 10 MR apertures (0.41 × 0.51 nm). Additionally, pockets of 0.71 nm in diameter and 0.70 nm in height are placed on the external surface. H-SSZ-13 consists of a 3D network possessing ellipsoidal cages (0.67 × 1.1 nm) interconnected by 8 MR micropores (0.38 × 0.38 nm). The conversion of methyl mercaptan over zeolites is carried out in a fixed bed-flow reactor, at atmospheric pressure. The work focuses on the activity and particularly to product distribution of each catalyst. The performances of zeolites will be mainly related to their topology. 2 Experimental 2.1 Catalysts Zeolites ZSM-5 (Si/Al = 15), Faujasite Y (Si/Al = 15), Mordenite (Si/Al = 10) and β (Si/Al = 12.5) were purchased from Zeolyst International. SSZ-13 zeolite (Si/Al = 12) was provided by TotalEnergies. H-MCM-22 (Si/Al = 19) was synthesized by a hydrothermal method [20] using hexamethyleneimine (HMI, template), Aerosil 200 V fumed silica (Si source) and alkaline aqueous solution of sodium aluminate (Al source). The gel molar composition was Na 0.133/HMI 0.500/Al 0.050/Si/H2O 45. 2.2 Catalyst characterization The crystallinity of the catalysts was examined by X-ray diffraction, in the ranges 2θ = 4–50° with an angular step size of 0.0197° and an acquisition time of 0.2 s (Bruker D8 Advance device with a Bragg-Brentano configuration, Bruker Lynx Eye detector, Cu Kα radiation). Nitrogen physisorption measurements were carried out at -196 °C on a Micromeritics Tristar sorptomer, using samples outgassed under vacuum at 250 °C for 6 h. The specific surface area was determined using the BET technique. The micropore area and volume and the external surface area were determined using the t-plot method. The thermal gravimetric-mass spectrometry analysis (TGA-MS) were performed on a STA 449 F1 Jupiter instrument coupled to a mass spectrometer QMS 403 Aëolos Quadro. 10 mg of spent catalyst were heated from 40 to 900 °C at 10 °C min-1 in an air flow (30 mL min-1). The acidity of the H+-form zeolites was evaluated by temperature-programmed desorption of ammonia. 2.3 Catalytic testing The catalytic reactions were conducted in continuous mode, using a stainless-steel plug flow reactor (0.45 cm ID, L = 13.6 cm). Prior to reaction, the catalyst (100 mg zeolite in protonic form, 150–250 μm particle size, mixed with quartz) was activated at 550 °C for 8 h (heating rate of 5 °C min-1) in an air flow. The reactor was then cooled to reaction conditions under a nitrogen flow (30 mL min-1). In a typical run, a feed consisting of CH3SH/nitrogen = 5/95 (mol/mol) was introduced into the reactor with a flow rate of 10 mL min-1 (WHSV = 0.64 gCH3SH gcat -1 h-1). The complete reactor effluent was analyzed online by gas chromatography, using two apparatus/columns/detectors. The hydrocarbons were analyzed on a Varian 3900, CP-WAX-57-CB (25 m x 0.32 mm x 0.20 μm), FID, while the S-containing compounds were analyzed on a Shimadzu GC 2014, Supel-Q Plot (30 m x 0.32 mm x 0.15 μm), FPD. 3 Results and discussion 3.1 Catalyst characterization The X-ray diffraction patterns reported in Fig. S1 (Supplementary Material) confirmed that the samples have the expected structure [21]. The nitrogen adsorption isotherms (Fig. S2), and the textural properties of zeolites (Table S1), are well characteristic of each topology. The NH3-TPD profiles consist in two peaks representing respectively the ammonia desorbed from weak and strong acid sites (Fig. S3). The amounts of acid sites are given in Table S1. 3.2 Catalytic conversion of methyl mercaptan over zeolites with diverse topology At temperatures lower than 400 °C, over all zeolites, the methyl mercaptan was mostly converted into dimethyl sulfide (DMS) and H2S (Figs. S4 and S5) with conversions ranging from 50% to 60%. At 400 °C, DMS was still the main product, but some quantities of C1-C3 hydrocarbons were also produced, notably in the presence of H-MCM-22 and H-SSZ-13. The most relevant results were obtained at 450 °C. At this temperature, the conversions of methyl mercaptan was about 56% for H-ZSM-5, H-Y and H-MCM-22, 63% for H-β and 72% for H-MOR and H-SSZ-13. These values did not vary significantly between 20 and 240 min on stream. In contrast to the previous studies carried out in the presence of zeolites [18,19], in which the aromatic hydrocarbons, dimethyl sulfide and H2S were not given, we considered all the products formed during the conversion of methyl mercaptan. Thus, beside DMS, significant quantities of saturated and unsaturated light hydrocarbons (C1-C3) and C6-C11 aromatics were formed (Fig. 1 ). For each zeolite, the ratio between the products (measured by GC between 20 and 240 min on stream) was quasi-constant during the catalytic test. The FID chromatograms plotted in Fig. 1 clearly show that the nature of the products generated as well as their proportion were strongly dependent on the zeolite used. We distinguish two families of hydrocarbons: aliphatic C1-C3 (methane, ethylene, ethane, propylene, propane) and aromatic (toluene, xylenes, trimethylbenzenes, tetramethylbenzenes and pentamethylbenzenes). Only traces of C4+ aliphatics and benzene were observed in some catalytic tests. The largest quantities of C1-C3 hydrocarbons, notably ethylene, were produced on the H-SSZ-13 and H-MOR zeolites (Fig. 2 ). In contrast, only small amount of low olefins were produced over H-ZSM-5 and H-MCM-22. In the presence of H-β and H-Y, the major aliphatic hydrocarbon was the methane. Significant quantity of aromatic hydrocarbons, like methyl- and poly-methylbenzenes, were obtained in the presence of H-ZSM-5, H-MOR and H-β zeolites (Fig. 3 ). The chromatograms presented in Fig. 4 (FPD detector) show that at 450 °C the two sulfur compounds obtained were hydrogen sulfide and DMS. In order to explain the formation of different classes of hydrocarbons, we will assume that the mechanism of transformation of methyl mercaptan into hydrocarbons is similar to that proposed for the conversion of methanol into hydrocarbons (MTH). For this process, there is a general consensus that lower olefins like ethylene and propylene are the result of a so-called “Hydrocarbon Pool” (HP) mechanism [22,23]. According to this mechanism, the aromatic species trapped in the pores/cages of the zeolites undergo successive stages of methylation by methanol and eliminate the light alkenes. In Scheme 1 we have adapted this mechanism to the conversion of methyl mercaptan. The primary hydrocarbons, notably propylene, can be easily involved in further acid-catalyzed reactions, such as methylation and oligomerization, leading to the formation of C4, C5 and C6+ olefins (Olefins Carbon Pool). Aliphatic C6+ species are involved either in cracking processes (to form propylene) or in hydrogen transfer reactions (with light olefins) leading to the formation of saturated hydrocarbons (methane, ethane, propane), aromatics and coke. In the case of methanol, methylation and cracking of alkenes has been shown to be an important route to the formation of C3+ alkenes, while ethylene is formed primarily from aromatic intermediates [24,25]. The results obtained in our study with methyl mercaptan show that over all zeolites, and under all conditions, ethylene was formed in higher quantities compared to propylene. According to data in Figs. 1 and 2, the molar ratio between ethylene and propylene was ∼ 2 for H-MCM-22, 3 for H-SSZ-13, 8 for H-MOR, and more than 10 for H-Y and H-β. Based on these results, we can state that the conversion of methyl mercaptan occurs primarily through the “aromatic” pathway in Scheme 1. The topology of the catalyst is crucial in the formation of the active intermediates involved in the HP mechanism. For example, 3D zeolites allow the fast diffusion of methylbenzenes towards the product flow, avoiding the accumulation of the HP active species in the pores of the catalyst [26,27]. On the other hand, the catalysts with large cages and small pores prevent to a certain extent the diffusion of these species. A first consequence of such behavior concerns the ratio between the aliphatic hydrocarbons (notably light alkenes) and the aromatic hydrocarbons formed in reaction. In the case of zeolites H-SSZ-13 and H-MCM-22, which have large cages and small pores, the methyl aromatics formed in cages cannot escape, and thus their presence among the products is insignificant. In a manner similar to that observed for the MTH process, H-SSZ-13 zeolite (with CHA topology) displayed the highest selectivity in light olefins [27]. Note that the selective transformation of methyl mercaptan into ethylene on a CHA catalyst has been predicted by Baltrusaitis in a previous DFT study [28]. In contrast, over 3D H-β and H-ZSM-5 zeolite, many aromatics and only few olefins were produced. This product spectrum rich in aromatics agrees with previous reports on the methanol conversion over similar zeolites [27,29,30]. The only exception in our case is H-Y zeolite, for which the amount of aromatics produced is insignificant. This difference could be explained by considering the density of the acidic sites on the surface. It is known that a high density of acid sites favors hydrogen transfer reactions, which are responsible for the formation of aromatics. Thus, the quantities of aromatics produced on the zeolites H-ZSM-5 (acidity of 1.92 µmol NH3/m2), H-MOR (2.08 µmol NH3/m2) and H-β (1. 50 µmol NH3/m2) were larger than that obtained on the H-Y zeolite (0.52 µmol NH3/m2). As shown in Fig. 1, the nature of the aromatics depended on the pore size of the 3D zeolites. Thus, the size of the channel intersection of the H-ZSM-5 zeolite allows the formation of benzene-toluene-xylene-trimethylbenzenes, but does not allow the formation of more hindered compounds, such as tetra- and penta-methylbenzenes. On the other hand, in the presence of large-pore zeolites, such as H-MOR and H-β, tetramethylbenzenes and pentamethylbenzenes are the mainly formed aromatics. When the catalytic tests were carried out at 500 °C, the methyl mercaptan conversion was of 90–95% over H-Y, H-MOR, H-β and H-MCM-22, and 98% over H-ZSM-5 and H-SSZ-13. At this temperature, the hydrogen transfer reactions were strongly favored and thus the main products were methane and aromatics, as shown in Fig. 5 for H-ZSM-5 et H-SSZ-13 zeolites. It is important to highlight the high aromatization capacity of methyl mercaptan shown by H-ZSM-5. According to the GC-FPD analysis, at 500 °C, an additional sulfur molecule, namely carbon disulfide, was produced (Fig. 6 ). The greatest amount of carbon disulfide was obtained in the presence of the H-SSZ-13 zeolite (15–30 times more than other catalysts), with a molar ratio between methane and carbon disulfide (the only two products obtained at 500°) of 3/1. The overall reaction which could explain the formation of the products identified at 500 °C is as follows: 4CH3SH → 3CH4 + 2H2S + CS2. 3.3 Catalytic conversion of methyl mercaptan over H-SSZ-13 zeolites Considering the performances demonstrated by the H-SSZ-13 zeolite in terms of olefin selectivity, we performed further investigations on this catalyst. The methyl mercaptan conversion was carried out at 400 °C and at atmospheric pressure, doubling the catalyst quantity (200 mg in place of 100 mg). Fig. 7 shows a typical chromatogram of CH3SH decomposition products. The product mixture is dominated by light olefins, mainly ethylene and propylene. Propane was also produced in significant quantities, and small quantities of methane, ethane and C4+ were produced. H2S and DMS were the dominant S-containing compounds (Fig. 8 ). However, they are not in equivalent quantities, suggesting that a large quantity of H2S comes from methyl mercaptan transformed into olefins: (2 CH3SH → C2H4 + 2 H2S; 3 CH3SH → C3H6 + 3 H2S). Fig. 9 shows the evolution of the methyl mercaptan conversion and the product distribution versus time on stream. The reagent conversion varied between 80 and 84% during the first three hours on stream, and it slowly declined afterward. At the beginning of the catalytic run (i.e. 10 min on stream), DMS was the main product (83%). The amounts of DMS and H2S were almost equal (Fig. 10 ). At 60 min on stream, the main products were ethylene-propylene (56%), propane (15%) and DMS (20%). The highest amount of olefins was 65% at 2 h on stream, but it significantly decreased thereafter, to reach 45% at 6 h on stream. In contrast, the quantity of DMS regularly increased, to reach 55% at the end of the run. This evolution of the product composition could be due to the deactivation of the catalyst. In summary, the chemical transformation of the methyl mercaptan with time on stream can be divided in three stages: (i) induction, with DMS as main product, (ii) steady state, when the olefins were the major products, and (iii) deactivation stage. Such an evolution is similar to that described for the methanol conversion into hydrocarbons [31]. As shown in Scheme 1, in a first stage, the methyl mercaptan is converted into DMS (a thioether). Further, molecules containing C-C bonds, particularly aromatics, are formed. These molecules, trapped in the cages of the H-SSZ-13 zeolite, will start the “hydrocarbon pool” mechanism, which is at the origin of the production of light olefins. As in the case of methanol, H-SSZ-13 (with CHA topology) deactivates rapidly because of the poly-aromatic species formed and confined in its cages. After the tests, the catalyst was completely black, proving that it underwent deactivation. The physical properties of the spent catalyst were determined using the same methods applied for the fresh samples. Before characterization, after the reaction run, the reactor was flushed with nitrogen at 400 °C for 30 min, in order to desorb the volatile species confined in the catalyst. The textural properties were evaluated from the nitrogen physisorption isotherms (Fig. 11 ). Comparing to the fresh samples, the coked catalyst shows lower adsorption capabilities at low relative pressures. This proves a reduction in the volume of the micropores, as well as the surface areas (Table 1 ). The amount and the nature of the species built up and retained on the spent zeolite have been determined by TG-MS analysis (Fig. 12 ). The CO2 and SO2 MS signals come from the combustion of C- and S-containing species. The overall mass loss was 5.72%. It was mainly recorded at temperatures higher than 500 °C, which correspond to the oxidative decomposition of the hard coke, most likely confined in the catalyst cages. The CO2 MS signal between 500 and 650 °C suggests that the hard coke contains only carbonaceous species. TGA-MS profiles also reveal a small SO2 MS peak appeared between 450 and 550 °C, as well as a shoulder in the CO2 MS signal. This can be likely related to the combustion of heavy S containing molecules, e.g., polysulfides located in the catalyst matrix. After a catalytic run (6 hours on stream) the catalyst was regenerated for 6 h, at 550 °C (temperature rise of 5 °C/min, under an air flow of 30 mL/min). The regenerated catalyst exhibited catalytic properties (activity and product distribution) similar to those of the original catalyst (Figs. S6 and S7). 4 Conclusions We have investigated the conversion of the methyl mercaptan catalyzed by zeolites with different topology. Based on the experimental results, some comments can be made as conclusion. • All zeolites are able to catalyze the conversion of methyl mercaptan into DMS and H2S (at temperatures lower than 450 °C) and into hydrocarbons and H2S (at temperatures higher than 450 °C). • The crucial variables affecting the nature of the hydrocarbons obtained over different zeolites were their pore size/architecture. The 3D zeolites mainly produced methylbenzenes, while the catalysts with large cages and small pores mainly produced light aliphatic hydrocarbons. • In the presence of H-SSZ-13 zeolite, at 400 °C, the methyl mercaptan was selectively transformed into ethylene and propylene. This behavior is analogous to that previously described for the methanol conversion into hydrocarbons. • The experimental results suggest that the conversion of methyl mercaptan over examined zeolites occurred mainly through the “aromatic” pathway in the Hydrocarbon Pools mechanism. CRediT authorship contribution statement Abdelilah Bayout: Writing – original draft, Formal analysis, Data curation. Claudia Cammarano: Writing – review & editing, Writing – original draft, Supervision, Methodology, Conceptualization. Olinda Gimello: Validation, Data curation. Izabel Medeiros Costa: Validation, Supervision, Conceptualization. Gleb Veryasov: Validation, Supervision, Resources, Conceptualization. Vasile Hulea: Writing – review & editing, Validation, Supervision, Project administration, Methodology, Conceptualization. Declaration of competing interest The authors declare that they have no known competing financial interests or personal relationships that could have appeared to influence the work reported in this paper. Acknowledgment This work was supported by TotalEnergies One Tech, Belgium. We thank Di Renzo (ICGM) for providing the MCM-22 sample. Amine Geneste (ICGM) is thanked for the TGA-MS measurements. Supplementary materials Supplementary material associated with this article can be found, in the online version, at doi:10.1016/j.mcat.2024.114541. Appendix Supplementary materials Image, application 1 References [1] S. Matar L.F. Hatch Chemistry of Petrochemical Processes 2nd ed 2001 Butterworth-Heinemann 1 S. Matar, L.F. Hatch, Chemistry of Petrochemical Processes, 2nd ed, Butterworth-Heinemann, 2001, p. 1. [2] J.C. Bricker L. Laricchia Advances in Merox™ process and catalysis for thiol oxidation Top. Catal. 55 2012 1315 1323 J.C. Bricker, L. Laricchia, Advances in Merox™ process and catalysis for thiol oxidation, Top. Catal. 55 (2012) 1315–1323. [3] S.A. Butter A.T. Jurewicz W.W. Kaeding Conversion of Alcohols, Mercaptans, Sulfides, Halides, and/or Amides 1975 Mobil Oil Corporation New York US Patent 3894107 S.A. Butter, A.T. Jurewicz, W.W. Kaeding (1975) Conversion of Alcohols, Mercaptans, Sulfides, Halides, and/or Amides, US Patent 3894107, Mobil Oil Corporation, New York. [4] G.A. Olah H. Doggweiler J.D. Felberg S. Frohlich M.Jo Grdina R. Karpeles T. Keumi S. Inaba W.M. Ip K. Lammertsma G. Salem D.C. Tabor Onium ylide chemistry. 1. Bifunctional acid-base-catalyzed conversion of heterosubstituted methanes into ethylene and derived hydrocarbons. The onium ylide mechanism of the C1 → C2 conversion J. Am. Chem. Soc. 106 1984 2143 2149 G.A. Olah, H. Doggweiler, J.D. Felberg, S. Frohlich, M. Jo Grdina, R. Karpeles, T. Keumi, S. Inaba, W.M. Ip, K. Lammertsma, G. Salem, D.C. Tabor, Onium ylide chemistry. 1. Bifunctional acid-base-catalyzed conversion of heterosubstituted methanes into ethylene and derived hydrocarbons. The onium ylide mechanism of the C1 → C2 conversion, J. Am. Chem. Soc. 106 (1984) 2143–2149. [5] A.V. Mashkina V.R. Grunvald V.I. Nasteka B.P. Borodin V.N. Yakovleva L.N. Khairulina Decomposition of alkanethiols to dialkyl sulfides and hydrogen sulfide React. Kinet. Catal. Lett. 41 1990 357 362 A.V. Mashkina, V.R. Grunvald, V.I. Nasteka, B.P. Borodin, V.N. Yakovleva, L.N. Khairulina, Decomposition of alkanethiols to dialkyl sulfides and hydrogen sulfide, React. Kinet. Catal. Lett. 41 (1990) 357–362. [6] E. Huguet B. Coq R. Durand C. Leroi R. Cadours V. Hulea A highly efficient process for transforming methyl mercaptan into hydrocarbons and H2S on solid acid catalysts Appl. Catal. B Environ. 134-135 2013 344 348 E. Huguet, B. Coq, R. Durand, C. Leroi, R. Cadours, V. Hulea, A highly efficient process for transforming methyl mercaptan into hydrocarbons and H2S on solid acid catalysts. Appl. Catal. B Environ., 134-135 (2013) 344–348. [7] V. Hulea E. Huguet C. Cammarano A. Lacarriere R. Durand C. Leroi R. Cadours B. Coq Conversion of methyl mercaptan and methanol to hydrocarbons over solid acid catalysts - a comparative study Appl. Catal. B Environ. 144 2014 547 553 V. Hulea, E. Huguet, C. Cammarano, A. Lacarriere, R. Durand, C. Leroi, R. Cadours, B. Coq, Conversion of methyl mercaptan and methanol to hydrocarbons over solid acid catalysts - a comparative study, Appl. Catal. B Environ. 144 (2014) 547–553. [8] C. Cammarano E. Huguet R. Cadours C. Leroi B. Coq V. Hulea Selective transformation of methyl and ethyl mercaptans mixture to hydrocarbons and H2S on solid acid catalysts Appl. Catal. B Environ. 156-157 2014 128 133 C. Cammarano, E. Huguet, R. Cadours, C. Leroi, B. Coq, V. Hulea, Selective transformation of methyl and ethyl mercaptans mixture to hydrocarbons and H2S on solid acid catalysts. Appl. Catal. B Environ., 156-157 (2014) 128–133. [9] Y. Xie J. Bao X. Song X. Sun P. Ning C. Wang F. Wang Y. Ma M. Fan K. Li Catalysts for gaseous organic sulfur removal J. Hazard Mater. 442 2023 130029 Y. Xie, J. Bao, X. Song, X. Sun, P. Ning, C. Wang, F. Wang, Y. Ma, M. Fan, K. Li, Catalysts for gaseous organic sulfur removal, J. Hazard Mater. 442 (2023) 130029. [10] D. He D. Chen H. Hao J. Yu J. Liu J. Lu G. Wan S. He K. Li Y. Luo Enhanced activity and stability of Sm-doped HZSM-5 zeolite catalysts for catalytic methyl mercaptan (CH3SH) decomposition Chem. Eng. J. 317 2017 60 69 D. He, D. Chen, H. Hao, J. Yu, J. Liu, J. Lu, G. Wan, S. He, K. Li, Y. Luo, Enhanced activity and stability of Sm-doped HZSM-5 zeolite catalysts for catalytic methyl mercaptan (CH3SH) decomposition, Chem. Eng. J. 317 (2017) 60–69. [11] D. He H. Hao D. Chen J. Liu J. Yu J. Lu F. Liu S. He J. Li Y. Luo Effects of rare-earth (Nd, Er and Y) doping on catalytic performance of HZSM-5 zeolite catalysts for methyl mercaptan (CH3SH) decomposition Appl. Catal. A Gen. 533 2017 66 74 D. He, H. Hao, D. Chen, J. Liu, J. Yu, J. Lu, F. Liu, S. He, J. Li, Y. Luo, Effects of rare-earth (Nd, Er and Y) doping on catalytic performance of HZSM-5 zeolite catalysts for methyl mercaptan (CH3SH) decomposition, Appl. Catal. A Gen. 533 (2017) 66–74. [12] D. He Y. Zhao S. Yang Y. Mei J. Yu J. Liu D. Chen S. He Y. Luo Enhancement of catalytic performance and resistance to carbonaceous deposit of lanthanum (La) doped HZSM-5 catalysts for decomposition of methyl mercaptan Chem. Eng. J. 336 2018 579 586 D. He, Y. Zhao, S. Yang, Y. Mei, J. Yu, J. Liu, D. Chen, S. He, Y. Luo, Enhancement of catalytic performance and resistance to carbonaceous deposit of lanthanum (La) doped HZSM-5 catalysts for decomposition of methyl mercaptan, Chem. Eng. J. 336 (2018) 579–586. [13] J. Lu H. Hao L. Zhang Z. Xu L. Zhong Y. Zhao D. He J. Liu D. Chen H. Pu S. He Y. Luo The investigation of the role of basic lanthanum (La) species on the improvement of catalytic activity and stability of HZSM-5 material for eliminating methanethiol (CH3SH) Appl. Catal. B Environ. 237 2018 185 197 J. Lu, H. Hao, L. Zhang, Z. Xu, L. Zhong, Y. Zhao, D. He, J. Liu, D. Chen, H. Pu, S. He, Y. Luo, The investigation of the role of basic lanthanum (La) species on the improvement of catalytic activity and stability of HZSM-5 material for eliminating methanethiol (CH3SH), Appl. Catal. B Environ. 237 (2018) 185–197. [14] R. Tian J. Lu Z. Xu W. Zhang J. Liu L. Wang Y. Xie Y. Zhao X. Cao Y. Luo Unraveling the synergistic reaction and the deactivation mechanism for the catalytic degradation of double components of sulfur-containing VOCs over ZSM-5-based materials Environ. Sci. Technol. 57 2023 1443 1455 R. Tian, J. Lu, Z. Xu, W. Zhang, J. Liu, L. Wang, Y. Xie, Y. Zhao, X. Cao, Y. Luo, Unraveling the synergistic reaction and the deactivation mechanism for the catalytic degradation of double components of sulfur-containing VOCs over ZSM-5-based materials, Environ. Sci. Technol. 57 (2023) 1443–1455. [15] X. Cao D. He J. Lu Y. Zhao Y. Mei C. Han Y. Luo The negative effect of P addition of La/HZSM-5 on the catalytic performance in methyl mercaptan abatement Appl. Surf. Sci. 494 2019 1083 1090 X. Cao, D. He, J. Lu, Y. Zhao, Y. Mei, C. Han, Y. Luo, The negative effect of P addition of La/HZSM-5 on the catalytic performance in methyl mercaptan abatement, Appl. Surf. Sci. 494 (2019)1083–1090. [16] D. He J. Yu Y. Mei J. Liu Y. Zhao S. Yang X. Cao S. He Y. Luo The effects of Cr addition in HZSM-5 on its structure, physicochemical and catalytic properties for methyl mercaptan abatement Catal. Commun. 112 2018 31 34 D. He, J. Yu, Y. Mei, J. Liu, Y. Zhao, S. Yang, X. Cao, S. He, Y. Luo, The effects of Cr addition in HZSM-5 on its structure, physicochemical and catalytic properties for methyl mercaptan abatement, Catal. Commun. 112 (2018) 31–34. [17] J. Yu D. He D. Chen J. Liu J. Lu F. Liu P. Liu Y. Zhao Z. Xu Y. Luo Investigating the effects of alkali metal Na addition on catalytic activity of HZSM-5 for methyl mercaptan elimination Appl. Surf. Sci. 420 2017 21 27 J. Yu, D. He, D. Chen, J. Liu, J. Lu, F. Liu, P. Liu, Y. Zhao, Z. Xu, Y. Luo, Investigating the effects of alkali metal Na addition on catalytic activity of HZSM-5 for methyl mercaptan elimination, Appl. Surf. Sci. 420 (2017) 21–27. [18] M. Yu N. Tormene A. Bolshakov B. Mezari A. Liutkova N. Kosinov E.J.M. Hensen Selective methanethiol-to-olefins conversion over HSSZ-13 zeolite Chem. Commun. 57 2021 3323 3326 M. Yu, N. Tormene, A. Bolshakov, B. Mezari, A. Liutkova, N. Kosinov, E.J.M. Hensen, Selective methanethiol-to-olefins conversion over HSSZ-13 zeolite, Chem. Commun. 57 (2021) 3323–3326. [19] R. Watanabe N. Oba S. Smith K. Oshima M. Kishida K. Miyake N. Nishiyama P. Verma C. Fukuhara Effect of Ga substitution with Al in ZSM-5 zeolite in methanethiol-to-hydrocarbon conversion RSC Adv. 13 2023 21441 21447 R. Watanabe, N. Oba, S. Smith, K. Oshima, M. Kishida, K. Miyake, N. Nishiyama, P. Verma, C. Fukuhara, Effect of Ga substitution with Al in ZSM-5 zeolite in methanethiol-to-hydrocarbon conversion, RSC Adv.. 13 (2023) 21441–21447. [20] M. Fabbiani A. Morsli G. Confalonieri T. Cacciaguerra F. Fajula J. Haines A. Bengueddach R. Arletti F. Di Renzo On the chemical condensation of the layers of zeolite precursor MCM-22(P) Microporous Mesoporous Mater. 332 2022 111678 M. Fabbiani, A. Morsli, G. Confalonieri, T. Cacciaguerra, F. Fajula, J. Haines, A. Bengueddach, R. Arletti, F. Di Renzo, On the chemical condensation of the layers of zeolite precursor MCM-22(P), Microporous Mesoporous Mater.. 332 (2022) 111678. [21] M.M.J. Treacy J.B. Higgins Collection of Simulated XRD Powder Patterns For Zeolites. International Zeolite Association. Structure Commission 4th rev. ed. 2001 Elsevier Amsterdam M.M.J. Treacy, J.B. Higgins, Collection of Simulated XRD Powder Patterns For Zeolites. International Zeolite Association. Structure Commission. 4th rev. ed., Elsevier, Amsterdam, 2001. [22] I.M. Dahl S. Kolboe On the reaction mechanism for hydrocarbon formation from methanol over SAPO-34. 2. Isotopic labeling studies of the co-reaction of propene and methanol J. Catal. 161 1996 304 309 I.M. Dahl, S. Kolboe, On the reaction mechanism for hydrocarbon formation from methanol over SAPO-34. 2. Isotopic labeling studies of the co-reaction of propene and methanol, J. Catal. 161 (1996) 304–309. [23] S. Ilias A. Bhan Mechanism of the catalytic conversion of methanol to hydrocarbons ACS Catal. 3 2013 18 31 S. Ilias, A. Bhan, Mechanism of the catalytic conversion of methanol to hydrocarbons, ACS Catal.. 3 (2013) 18–31. [24] S. Svelle F. Joensen J. Nerlov U. Olsbye K.P. Lillerud S. Kolboe M. Bjørgen Conversion of methanol into hydrocarbons over zeolite H-ZSM-5: ethene formation is mechanistically separated from the formation of higher alkenes J. Am. Chem. Soc. 128 2006 14770 14771 S. Svelle, F. Joensen, J. Nerlov, U. Olsbye, K.P. Lillerud, S. Kolboe, M. Bjørgen, Conversion of methanol into hydrocarbons over zeolite H-ZSM-5: ethene formation is mechanistically separated from the formation of higher alkenes, J. Am. Chem. Soc. 128 (2006) 14770–14771. [25] M. Bjørgen S. Svelle F. Joensen J. Nerlov S. Kolboe F. Bonino L. Palumbo S. Bordiga U. Olsbye Conversion of methanol to hydrocarbons over zeolite H-ZSM-5: On the origin of the olefinic species J. Catal. 249 2007 195 207 M. Bjørgen, S. Svelle, F. Joensen, J. Nerlov, S. Kolboe, F. Bonino, L. Palumbo, S. Bordiga, U. Olsbye, Conversion of methanol to hydrocarbons over zeolite H-ZSM-5: On the origin of the olefinic species, J. Catal. 249 (2007) 195–207. [26] J.W. Park G. Seo IR Study on methanol-to-olefin reaction over zeolites with different pore structure and acidities Appl. Catal. A Gen. 356 2009 180 188 J.W. Park, G. Seo, IR Study on methanol-to-olefin reaction over zeolites with different pore structure and acidities, Appl. Catal. A Gen. 2009 (356) 180–188. [27] S. Teketel L.F. Lundegaard W. Skistad S.M. Chavan U. Olsbye K.P. Lillerud P. Beato S. Svelle Morphology-induced shape selectivity in zeolite catalysis J. Catal. 327 2015 22 32 S. Teketel, L.F. Lundegaard, W. Skistad, S.M. Chavan, U. Olsbye, K.P. Lillerud, P. Beato, S. Svelle, Morphology-induced shape selectivity in zeolite catalysis, J. Catal. 327 (2015) 22–32. [28] J. Baltrusaitis T. Bucko W. Michaels M. Makkee G. Mul Catalytic methyl mercaptan coupling to ethylene in chabazite: DFT study of the first C-C bond formation Appl. Catal. B Environ. 187 2016 195 203 J. Baltrusaitis, T. Bucko, W. Michaels, M. Makkee, G. Mul, Catalytic methyl mercaptan coupling to ethylene in chabazite: DFT study of the first C-C bond formation, Appl. Catal. B Environ. 187 (2016) 195–203. [29] M. Bjørgen S. Akyalcin U. Olsbye S. Benard S. Kolboe S. Svelle Methanol to hydrocarbons over large cavity zeolites: Toward a unified description of catalyst deactivation and the reaction mechanism J. Catal. 275 2010 170 180 M. Bjørgen, S. Akyalcin, U. Olsbye, S. Benard, S. Kolboe, S. Svelle, Methanol to hydrocarbons over large cavity zeolites: Toward a unified description of catalyst deactivation and the reaction mechanism, J. Catal. 275 (2010) 170–180. [30] M. Bjørgen F. Joensen K.-P. Lillerud U. Olsbye S. Svelle The mechanisms of ethene and propene formation from methanol over high silica H-ZSM-5 and H-beta Catal. Today 142 2009 90 97 M. Bjørgen, F. Joensen, K.-P. Lillerud, U. Olsbye, S. Svelle, The mechanisms of ethene and propene formation from methanol over high silica H-ZSM-5 and H-beta, Catal. Today 142 (2009) 90–97. [31] R. Liu X. Shao C. Wang W. Dai N. Guan Reaction mechanism of methanol-to-hydrocarbons conversion: Fundamental and application, Chin J. Catal. 47 2023 67 92 R. Liu, X. Shao, C. Wang, W. Dai, N. Guan, Reaction mechanism of methanol-to-hydrocarbons conversion: Fundamental and application, Chin. J. Catal. 47 (2023) 67–92.",
      "scopus-id": "85203546700",
      "coredata": {
        "eid": "1-s2.0-S2468823124007235",
        "dc:description": "The conversion of methyl mercaptan was examined over zeolites with MFI, FAU, BEA, MOR, CHA and MWW topology and Si/Al ratio between 10 and 19. At 450 °C, over all catalysts, the reagent has been primarily consumed into hydrocarbons and H2S. The crucial variables affecting the hydrocarbon distribution over zeolites were mainly their pore size/architecture and the amount of the acid sites. Over 3D H-ZSM-5, H-β and H-MOR zeolite, many aromatics and only few olefins were produced. In contrast, and analogous to methanol-to-hydrocarbons process, H-SSZ-13 and H-MCM-22 zeolite (containing cages and small pores) mainly produced C2-C3 olefins.",
        "openArchiveArticle": "false",
        "prism:coverDate": "2024-12-31",
        "openaccessUserLicense": "http://creativecommons.org/licenses/by-nc/4.0/",
        "prism:aggregationType": "Journal",
        "prism:url": "https://api.elsevier.com/content/article/pii/S2468823124007235",
        "dc:creator": [
          {
            "@_fa": "true",
            "$": "Bayout, Abdelilah"
          },
          {
            "@_fa": "true",
            "$": "Cammarano, Claudia"
          },
          {
            "@_fa": "true",
            "$": "Gimello, Olinda"
          },
          {
            "@_fa": "true",
            "$": "Medeiros Costa, Izabel"
          },
          {
            "@_fa": "true",
            "$": "Veryasov, Gleb"
          },
          {
            "@_fa": "true",
            "$": "Hulea, Vasile"
          }
        ],
        "link": [
          {
            "@_fa": "true",
            "@rel": "self",
            "@href": "https://api.elsevier.com/content/article/pii/S2468823124007235"
          },
          {
            "@_fa": "true",
            "@rel": "scidir",
            "@href": "https://www.sciencedirect.com/science/article/pii/S2468823124007235"
          }
        ],
        "dc:format": "application/json",
        "openaccessType": "Full",
        "pii": "S2468-8231(24)00723-5",
        "prism:volume": "569",
        "articleNumber": "114541",
        "prism:publisher": "The Author(s). Published by Elsevier B.V.",
        "dc:title": "Methyl mercaptan-to-hydrocarbons: Effect of topology of zeolite catalysts",
        "prism:copyright": "© 2024 The Author(s). Published by Elsevier B.V.",
        "openaccess": "1",
        "prism:issn": "24688231",
        "dcterms:subject": [
          {
            "@_fa": "true",
            "$": "Methyl mercaptan"
          },
          {
            "@_fa": "true",
            "$": "Zeolites"
          },
          {
            "@_fa": "true",
            "$": "Heterogeneous catalysis"
          },
          {
            "@_fa": "true",
            "$": "Hydrocarbons"
          }
        ],
        "openaccessArticle": "true",
        "prism:publicationName": "Molecular Catalysis",
        "openaccessSponsorType": "FundingBody",
        "prism:pageRange": "114541",
        "pubType": "fla",
        "prism:coverDisplayDate": "December 2024",
        "prism:doi": "10.1016/j.mcat.2024.114541",
        "prism:startingPage": "114541",
        "dc:identifier": "doi:10.1016/j.mcat.2024.114541",
        "openaccessSponsorName": "French institutions 2024: Hybrid journals"
      },
      "objects": {
        "object": [
          {
            "@category": "standard",
            "@height": "453",
            "@width": "565",
            "@_fa": "true",
            "$": "https://api.elsevier.com/content/object/eid/1-s2.0-S2468823124007235-gr6.jpg?httpAccept=%2A%2F%2A",
            "@multimediatype": "JPEG image file",
            "@type": "IMAGE-DOWNSAMPLED",
            "@size": "27641",
            "@ref": "gr6",
            "@mimetype": "image/jpeg"
          },
          {
            "@category": "standard",
            "@height": "210",
            "@width": "565",
            "@_fa": "true",
            "$": "https://api.elsevier.com/content/object/eid/1-s2.0-S2468823124007235-gr5.jpg?httpAccept=%2A%2F%2A",
            "@multimediatype": "JPEG image file",
            "@type": "IMAGE-DOWNSAMPLED",
            "@size": "26018",
            "@ref": "gr5",
            "@mimetype": "image/jpeg"
          },
          {
            "@category": "standard",
            "@height": "466",
            "@width": "565",
            "@_fa": "true",
            "$": "https://api.elsevier.com/content/object/eid/1-s2.0-S2468823124007235-gr4.jpg?httpAccept=%2A%2F%2A",
            "@multimediatype": "JPEG image file",
            "@type": "IMAGE-DOWNSAMPLED",
            "@size": "29158",
            "@ref": "gr4",
            "@mimetype": "image/jpeg"
          },
          {
            "@category": "standard",
            "@height": "259",
            "@width": "376",
            "@_fa": "true",
            "$": "https://api.elsevier.com/content/object/eid/1-s2.0-S2468823124007235-gr12.jpg?httpAccept=%2A%2F%2A",
            "@multimediatype": "JPEG image file",
            "@type": "IMAGE-DOWNSAMPLED",
            "@size": "29870",
            "@ref": "gr12",
            "@mimetype": "image/jpeg"
          },
          {
            "@category": "standard",
            "@height": "304",
            "@width": "376",
            "@_fa": "true",
            "$": "https://api.elsevier.com/content/object/eid/1-s2.0-S2468823124007235-gr3.jpg?httpAccept=%2A%2F%2A",
            "@multimediatype": "JPEG image file",
            "@type": "IMAGE-DOWNSAMPLED",
            "@size": "14432",
            "@ref": "gr3",
            "@mimetype": "image/jpeg"
          },
          {
            "@category": "standard",
            "@height": "343",
            "@width": "376",
            "@_fa": "true",
            "$": "https://api.elsevier.com/content/object/eid/1-s2.0-S2468823124007235-gr2.jpg?httpAccept=%2A%2F%2A",
            "@multimediatype": "JPEG image file",
            "@type": "IMAGE-DOWNSAMPLED",
            "@size": "29629",
            "@ref": "gr2",
            "@mimetype": "image/jpeg"
          },
          {
            "@category": "standard",
            "@height": "853",
            "@width": "791",
            "@_fa": "true",
            "$": "https://api.elsevier.com/content/object/eid/1-s2.0-S2468823124007235-gr1.jpg?httpAccept=%2A%2F%2A",
            "@multimediatype": "JPEG image file",
            "@type": "IMAGE-DOWNSAMPLED",
            "@size": "74325",
            "@ref": "gr1",
            "@mimetype": "image/jpeg"
          },
          {
            "@category": "standard",
            "@height": "222",
            "@width": "565",
            "@_fa": "true",
            "$": "https://api.elsevier.com/content/object/eid/1-s2.0-S2468823124007235-sc1.jpg?httpAccept=%2A%2F%2A",
            "@multimediatype": "JPEG image file",
            "@type": "IMAGE-DOWNSAMPLED",
            "@size": "38099",
            "@ref": "sc1",
            "@mimetype": "image/jpeg"
          },
          {
            "@category": "standard",
            "@height": "306",
            "@width": "376",
            "@_fa": "true",
            "$": "https://api.elsevier.com/content/object/eid/1-s2.0-S2468823124007235-gr10.jpg?httpAccept=%2A%2F%2A",
            "@multimediatype": "JPEG image file",
            "@type": "IMAGE-DOWNSAMPLED",
            "@size": "28326",
            "@ref": "gr10",
            "@mimetype": "image/jpeg"
          },
          {
            "@category": "standard",
            "@height": "299",
            "@width": "376",
            "@_fa": "true",
            "$": "https://api.elsevier.com/content/object/eid/1-s2.0-S2468823124007235-gr11.jpg?httpAccept=%2A%2F%2A",
            "@multimediatype": "JPEG image file",
            "@type": "IMAGE-DOWNSAMPLED",
            "@size": "20938",
            "@ref": "gr11",
            "@mimetype": "image/jpeg"
          },
          {
            "@category": "standard",
            "@height": "200",
            "@width": "317",
            "@_fa": "true",
            "$": "https://api.elsevier.com/content/object/eid/1-s2.0-S2468823124007235-ga1.jpg?httpAccept=%2A%2F%2A",
            "@multimediatype": "JPEG image file",
            "@type": "IMAGE-DOWNSAMPLED",
            "@size": "17841",
            "@ref": "ga1",
            "@mimetype": "image/jpeg"
          },
          {
            "@category": "standard",
            "@height": "260",
            "@width": "342",
            "@_fa": "true",
            "$": "https://api.elsevier.com/content/object/eid/1-s2.0-S2468823124007235-gr9.jpg?httpAccept=%2A%2F%2A",
            "@multimediatype": "JPEG image file",
            "@type": "IMAGE-DOWNSAMPLED",
            "@size": "30460",
            "@ref": "gr9",
            "@mimetype": "image/jpeg"
          },
          {
            "@category": "standard",
            "@height": "184",
            "@width": "791",
            "@_fa": "true",
            "$": "https://api.elsevier.com/content/object/eid/1-s2.0-S2468823124007235-gr8.jpg?httpAccept=%2A%2F%2A",
            "@multimediatype": "JPEG image file",
            "@type": "IMAGE-DOWNSAMPLED",
            "@size": "13474",
            "@ref": "gr8",
            "@mimetype": "image/jpeg"
          },
          {
            "@category": "standard",
            "@height": "201",
            "@width": "791",
            "@_fa": "true",
            "$": "https://api.elsevier.com/content/object/eid/1-s2.0-S2468823124007235-gr7.jpg?httpAccept=%2A%2F%2A",
            "@multimediatype": "JPEG image file",
            "@type": "IMAGE-DOWNSAMPLED",
            "@size": "21454",
            "@ref": "gr7",
            "@mimetype": "image/jpeg"
          },
          {
            "@category": "thumbnail",
            "@height": "164",
            "@width": "204",
            "@_fa": "true",
            "$": "https://api.elsevier.com/content/object/eid/1-s2.0-S2468823124007235-gr6.sml?httpAccept=%2A%2F%2A",
            "@multimediatype": "GIF image file",
            "@type": "IMAGE-THUMBNAIL",
            "@size": "6626",
            "@ref": "gr6",
            "@mimetype": "image/gif"
          },
          {
            "@category": "thumbnail",
            "@height": "81",
            "@width": "219",
            "@_fa": "true",
            "$": "https://api.elsevier.com/content/object/eid/1-s2.0-S2468823124007235-gr5.sml?httpAccept=%2A%2F%2A",
            "@multimediatype": "GIF image file",
            "@type": "IMAGE-THUMBNAIL",
            "@size": "6379",
            "@ref": "gr5",
            "@mimetype": "image/gif"
          },
          {
            "@category": "thumbnail",
            "@height": "164",
            "@width": "199",
            "@_fa": "true",
            "$": "https://api.elsevier.com/content/object/eid/1-s2.0-S2468823124007235-gr4.sml?httpAccept=%2A%2F%2A",
            "@multimediatype": "GIF image file",
            "@type": "IMAGE-THUMBNAIL",
            "@size": "6425",
            "@ref": "gr4",
            "@mimetype": "image/gif"
          },
          {
            "@category": "thumbnail",
            "@height": "151",
            "@width": "219",
            "@_fa": "true",
            "$": "https://api.elsevier.com/content/object/eid/1-s2.0-S2468823124007235-gr12.sml?httpAccept=%2A%2F%2A",
            "@multimediatype": "GIF image file",
            "@type": "IMAGE-THUMBNAIL",
            "@size": "8692",
            "@ref": "gr12",
            "@mimetype": "image/gif"
          },
          {
            "@category": "thumbnail",
            "@height": "164",
            "@width": "203",
            "@_fa": "true",
            "$": "https://api.elsevier.com/content/object/eid/1-s2.0-S2468823124007235-gr3.sml?httpAccept=%2A%2F%2A",
            "@multimediatype": "GIF image file",
            "@type": "IMAGE-THUMBNAIL",
            "@size": "5449",
            "@ref": "gr3",
            "@mimetype": "image/gif"
          },
          {
            "@category": "thumbnail",
            "@height": "164",
            "@width": "180",
            "@_fa": "true",
            "$": "https://api.elsevier.com/content/object/eid/1-s2.0-S2468823124007235-gr2.sml?httpAccept=%2A%2F%2A",
            "@multimediatype": "GIF image file",
            "@type": "IMAGE-THUMBNAIL",
            "@size": "9284",
            "@ref": "gr2",
            "@mimetype": "image/gif"
          },
          {
            "@category": "thumbnail",
            "@height": "164",
            "@width": "152",
            "@_fa": "true",
            "$": "https://api.elsevier.com/content/object/eid/1-s2.0-S2468823124007235-gr1.sml?httpAccept=%2A%2F%2A",
            "@multimediatype": "GIF image file",
            "@type": "IMAGE-THUMBNAIL",
            "@size": "6506",
            "@ref": "gr1",
            "@mimetype": "image/gif"
          },
          {
            "@category": "thumbnail",
            "@height": "86",
            "@width": "219",
            "@_fa": "true",
            "$": "https://api.elsevier.com/content/object/eid/1-s2.0-S2468823124007235-sc1.sml?httpAccept=%2A%2F%2A",
            "@multimediatype": "GIF image file",
            "@type": "IMAGE-THUMBNAIL",
            "@size": "6858",
            "@ref": "sc1",
            "@mimetype": "image/gif"
          },
          {
            "@category": "thumbnail",
            "@height": "164",
            "@width": "201",
            "@_fa": "true",
            "$": "https://api.elsevier.com/content/object/eid/1-s2.0-S2468823124007235-gr10.sml?httpAccept=%2A%2F%2A",
            "@multimediatype": "GIF image file",
            "@type": "IMAGE-THUMBNAIL",
            "@size": "8193",
            "@ref": "gr10",
            "@mimetype": "image/gif"
          },
          {
            "@category": "thumbnail",
            "@height": "164",
            "@width": "206",
            "@_fa": "true",
            "$": "https://api.elsevier.com/content/object/eid/1-s2.0-S2468823124007235-gr11.sml?httpAccept=%2A%2F%2A",
            "@multimediatype": "GIF image file",
            "@type": "IMAGE-THUMBNAIL",
            "@size": "5977",
            "@ref": "gr11",
            "@mimetype": "image/gif"
          },
          {
            "@category": "thumbnail",
            "@height": "138",
            "@width": "219",
            "@_fa": "true",
            "$": "https://api.elsevier.com/content/object/eid/1-s2.0-S2468823124007235-ga1.sml?httpAccept=%2A%2F%2A",
            "@multimediatype": "GIF image file",
            "@type": "IMAGE-THUMBNAIL",
            "@size": "10688",
            "@ref": "ga1",
            "@mimetype": "image/gif"
          },
          {
            "@category": "thumbnail",
            "@height": "164",
            "@width": "215",
            "@_fa": "true",
            "$": "https://api.elsevier.com/content/object/eid/1-s2.0-S2468823124007235-gr9.sml?httpAccept=%2A%2F%2A",
            "@multimediatype": "GIF image file",
            "@type": "IMAGE-THUMBNAIL",
            "@size": "12021",
            "@ref": "gr9",
            "@mimetype": "image/gif"
          },
          {
            "@category": "thumbnail",
            "@height": "51",
            "@width": "219",
            "@_fa": "true",
            "$": "https://api.elsevier.com/content/object/eid/1-s2.0-S2468823124007235-gr8.sml?httpAccept=%2A%2F%2A",
            "@multimediatype": "GIF image file",
            "@type": "IMAGE-THUMBNAIL",
            "@size": "4332",
            "@ref": "gr8",
            "@mimetype": "image/gif"
          },
          {
            "@category": "thumbnail",
            "@height": "56",
            "@width": "219",
            "@_fa": "true",
            "$": "https://api.elsevier.com/content/object/eid/1-s2.0-S2468823124007235-gr7.sml?httpAccept=%2A%2F%2A",
            "@multimediatype": "GIF image file",
            "@type": "IMAGE-THUMBNAIL",
            "@size": "5058",
            "@ref": "gr7",
            "@mimetype": "image/gif"
          },
          {
            "@category": "high",
            "@height": "2004",
            "@width": "2500",
            "@_fa": "true",
            "$": "https://api.elsevier.com/content/object/eid/1-s2.0-S2468823124007235-gr6_lrg.jpg?httpAccept=%2A%2F%2A",
            "@multimediatype": "JPEG image file",
            "@type": "IMAGE-HIGH-RES",
            "@size": "176716",
            "@ref": "gr6",
            "@mimetype": "image/jpeg"
          },
          {
            "@category": "high",
            "@height": "927",
            "@width": "2500",
            "@_fa": "true",
            "$": "https://api.elsevier.com/content/object/eid/1-s2.0-S2468823124007235-gr5_lrg.jpg?httpAccept=%2A%2F%2A",
            "@multimediatype": "JPEG image file",
            "@type": "IMAGE-HIGH-RES",
            "@size": "133203",
            "@ref": "gr5",
            "@mimetype": "image/jpeg"
          },
          {
            "@category": "high",
            "@height": "2062",
            "@width": "2500",
            "@_fa": "true",
            "$": "https://api.elsevier.com/content/object/eid/1-s2.0-S2468823124007235-gr4_lrg.jpg?httpAccept=%2A%2F%2A",
            "@multimediatype": "JPEG image file",
            "@type": "IMAGE-HIGH-RES",
            "@size": "178806",
            "@ref": "gr4",
            "@mimetype": "image/jpeg"
          },
          {
            "@category": "high",
            "@height": "1147",
            "@width": "1667",
            "@_fa": "true",
            "$": "https://api.elsevier.com/content/object/eid/1-s2.0-S2468823124007235-gr12_lrg.jpg?httpAccept=%2A%2F%2A",
            "@multimediatype": "JPEG image file",
            "@type": "IMAGE-HIGH-RES",
            "@size": "206444",
            "@ref": "gr12",
            "@mimetype": "image/jpeg"
          },
          {
            "@category": "high",
            "@height": "1347",
            "@width": "1667",
            "@_fa": "true",
            "$": "https://api.elsevier.com/content/object/eid/1-s2.0-S2468823124007235-gr3_lrg.jpg?httpAccept=%2A%2F%2A",
            "@multimediatype": "JPEG image file",
            "@type": "IMAGE-HIGH-RES",
            "@size": "111243",
            "@ref": "gr3",
            "@mimetype": "image/jpeg"
          },
          {
            "@category": "high",
            "@height": "1520",
            "@width": "1667",
            "@_fa": "true",
            "$": "https://api.elsevier.com/content/object/eid/1-s2.0-S2468823124007235-gr2_lrg.jpg?httpAccept=%2A%2F%2A",
            "@multimediatype": "JPEG image file",
            "@type": "IMAGE-HIGH-RES",
            "@size": "185900",
            "@ref": "gr2",
            "@mimetype": "image/jpeg"
          },
          {
            "@category": "high",
            "@height": "3776",
            "@width": "3500",
            "@_fa": "true",
            "$": "https://api.elsevier.com/content/object/eid/1-s2.0-S2468823124007235-gr1_lrg.jpg?httpAccept=%2A%2F%2A",
            "@multimediatype": "JPEG image file",
            "@type": "IMAGE-HIGH-RES",
            "@size": "475348",
            "@ref": "gr1",
            "@mimetype": "image/jpeg"
          },
          {
            "@category": "high",
            "@height": "981",
            "@width": "2500",
            "@_fa": "true",
            "$": "https://api.elsevier.com/content/object/eid/1-s2.0-S2468823124007235-sc1_lrg.jpg?httpAccept=%2A%2F%2A",
            "@multimediatype": "JPEG image file",
            "@type": "IMAGE-HIGH-RES",
            "@size": "258686",
            "@ref": "sc1",
            "@mimetype": "image/jpeg"
          },
          {
            "@category": "high",
            "@height": "1356",
            "@width": "1667",
            "@_fa": "true",
            "$": "https://api.elsevier.com/content/object/eid/1-s2.0-S2468823124007235-gr10_lrg.jpg?httpAccept=%2A%2F%2A",
            "@multimediatype": "JPEG image file",
            "@type": "IMAGE-HIGH-RES",
            "@size": "181814",
            "@ref": "gr10",
            "@mimetype": "image/jpeg"
          },
          {
            "@category": "high",
            "@height": "1327",
            "@width": "1667",
            "@_fa": "true",
            "$": "https://api.elsevier.com/content/object/eid/1-s2.0-S2468823124007235-gr11_lrg.jpg?httpAccept=%2A%2F%2A",
            "@multimediatype": "JPEG image file",
            "@type": "IMAGE-HIGH-RES",
            "@size": "169820",
            "@ref": "gr11",
            "@mimetype": "image/jpeg"
          },
          {
            "@category": "high",
            "@height": "886",
            "@width": "1403",
            "@_fa": "true",
            "$": "https://api.elsevier.com/content/object/eid/1-s2.0-S2468823124007235-ga1_lrg.jpg?httpAccept=%2A%2F%2A",
            "@multimediatype": "JPEG image file",
            "@type": "IMAGE-HIGH-RES",
            "@size": "118773",
            "@ref": "ga1",
            "@mimetype": "image/jpeg"
          },
          {
            "@category": "high",
            "@height": "1153",
            "@width": "1516",
            "@_fa": "true",
            "$": "https://api.elsevier.com/content/object/eid/1-s2.0-S2468823124007235-gr9_lrg.jpg?httpAccept=%2A%2F%2A",
            "@multimediatype": "JPEG image file",
            "@type": "IMAGE-HIGH-RES",
            "@size": "182304",
            "@ref": "gr9",
            "@mimetype": "image/jpeg"
          },
          {
            "@category": "high",
            "@height": "816",
            "@width": "3500",
            "@_fa": "true",
            "$": "https://api.elsevier.com/content/object/eid/1-s2.0-S2468823124007235-gr8_lrg.jpg?httpAccept=%2A%2F%2A",
            "@multimediatype": "JPEG image file",
            "@type": "IMAGE-HIGH-RES",
            "@size": "93001",
            "@ref": "gr8",
            "@mimetype": "image/jpeg"
          },
          {
            "@category": "high",
            "@height": "890",
            "@width": "3500",
            "@_fa": "true",
            "$": "https://api.elsevier.com/content/object/eid/1-s2.0-S2468823124007235-gr7_lrg.jpg?httpAccept=%2A%2F%2A",
            "@multimediatype": "JPEG image file",
            "@type": "IMAGE-HIGH-RES",
            "@size": "163333",
            "@ref": "gr7",
            "@mimetype": "image/jpeg"
          },
          {
            "@category": "standard",
            "@_fa": "true",
            "$": "https://api.elsevier.com/content/object/eid/1-s2.0-S2468823124007235-mmc1.docx?httpAccept=%2A%2F%2A",
            "@multimediatype": "Microsoft Word file",
            "@type": "APPLICATION",
            "@size": "284945",
            "@ref": "mmc1",
            "@mimetype": "application/word"
          },
          {
            "@category": "standard",
            "@_fa": "true",
            "$": "https://api.elsevier.com/content/object/eid/1-s2.0-S2468823124007235-am.pdf?httpAccept=%2A%2F%2A",
            "@multimediatype": "Acrobat PDF file",
            "@type": "AAM-PDF",
            "@size": "538007",
            "@ref": "am",
            "@mimetype": "application/pdf"
          }
        ]
      },
      "link": {
        "@rel": "abstract",
        "@href": "https://api.elsevier.com/content/abstract/scopus_id/85203546700"
      }
    }
  }
}