{
  "metadata": {
    "title": "Bimetallic Ni-Co/SBA-15 catalysts for reforming of ethanol: How cobalt modifies the nickel metal phase and product distribution",
    "authors": "; ",
    "journal": "Molecular Catalysis",
    "date": "2018-04-30",
    "doi": "10.1016/j.mcat.2018.02.011",
    "abstract": "",
    "uri": "https://api.elsevier.com/content/article/pii/S246882311830066X",
    "pii": "S246882311830066X"
  },
  "fulltext": {
    "full-text-retrieval-response": {
      "scopus-eid": "2-s2.0-85045885410",
      "originalText": "serial JL 315758 291210 291744 291790 291809 31 Molecular Catalysis MOLECULARCATALYSIS 2018-03-20 2018-03-20 2018-03-20 2018-03-20 2019-03-18T15:57:50 1-s2.0-S246882311830066X S2468-8231(18)30066-X S246882311830066X 10.1016/j.mcat.2018.02.011 S300 S300.2 FULL-TEXT 1-s2.0-S2468823118X00042 2019-03-18T17:09:49.60684Z 0 0 20180401 20180430 2018 2018-03-20T11:56:37.748695Z absattachment articleinfo articletitlenorm authfirstinitialnorm authfirstsurnamenorm cid cids contenttype copyright crossmark dateloaded dateloadedtxt datesearch datesort dateupdated dco docsubtype doctype doi eid ewtransactionid hubeid indexeddate issn issnnorm itemstage itemtransactionid itemweight openaccess openarchive pg pgfirst pglast pii piinorm pubdateend pubdatestart pubdatetxt pubyr sectiontitle sortorder srctitle srctitlenorm srctype ssids alllist content subj subheadings suppl tomb volfirst volissue volumelist webpdf webpdfpagecount yearnav figure table body mmlmath acknowledge affil articletitle auth authfirstini authfull authkeywords authlast highlightsabst primabst ref specialabst 2468-8231 24688231 true 449 449 C Volume 449 17 122 130 122 130 201804 April 2018 2018-04-01 2018-04-30 2018 Regular Papers article fla © 2018 Elsevier B.V. All rights reserved. BIMETALLICNICOSBA15CATALYSTSFORREFORMINGETHANOLHOWCOBALTMODIFIESNICKELMETALPHASEPRODUCTDISTRIBUTION RODRIGUEZGOMEZ A 1 Introduction 2 Experimental 2.1 Preparation of the catalysts 2.2 Catalytic test 2.3 N2-physisorption 2.4 TEM 2.5 XRD 2.6 TPR 2.7 XPS 2.8 XAS 3 Results and discussion 3.1 Characterization of calcined and reduced catalysts 3.2 Steam reforming of ethanol 3.3 Characterization studies after steam reforming of ethanol 3.4 Further characterization of carbide phase 4 Conclusions Acknowledgments References OYAMA 2012 10444 10450 S BHAVANI 2013 1537 1544 A RODRIGUEZGOMEZ 2017 5243 5247 A HUBER 2006 4044 4098 G TANKSALE 2010 166 182 A SHARMA 2017 89 103 Y WU 2017 276 284 C CHEN 2017 4627 4637 J PALMA 2014 73 84 V ITO 2010 157 160 S DIVINS 2015 99 105 N SU 2008 6947 6952 S GOULA 2004 135 144 M HOU 2015 137 140 T SONG 2010 3796 3801 H ELDOUKKALI 2012 8298 8309 M BARROSO 2011 124 131 M PROFETI 2008 482 489 L DUAN 2005 6381 6386 S PARLETT 2017 76 79 C MATTOS 2012 4094 4123 L GONZALEZDELACRUZ 2012 2919 2926 V ZHANG 2007 300 310 J WANG 2013 654 661 L SILVA 2011 665 668 C RODRIGUEZGOMEZ 2018 A ZHAO 1998 548 552 D MALET 1988 2369 2375 P RODRIGUEZGOMEZ 2017 94 97 A KONG 2015 5914 5920 X ZHANG 2012 161 173 C KIM 2017 1606893 J GALVEZ 2015 143 150 M RODRIGUEZGOMEZ 2018 500 510 A ESPINOS 1992 415 422 J LU 2015 56444 56454 B TODOROVA 2007 3315 3320 S KENGNE 2015 508 514 B TODOROVA 2012 43 51 S LLORCA 2004 3573 3578 J VIZCAINO 2016 99 109 A ZHAO 2012 598 604 Y RODRIGUEZGOMEZX2018X122 RODRIGUEZGOMEZX2018X122X130 RODRIGUEZGOMEZX2018X122XA RODRIGUEZGOMEZX2018X122X130XA © 2018 Elsevier B.V. All rights reserved. item S2468-8231(18)30066-X S246882311830066X 1-s2.0-S246882311830066X 10.1016/j.mcat.2018.02.011 315758 2019-03-18T17:09:49.60684Z 2018-04-01 2018-04-30 1-s2.0-S246882311830066X-main.pdf https://s3.amazonaws.com/prod-ucs-content-store-us-east/content/pii:S246882311830066X/MAIN/application/pdf/f234b5a17e74cc954307d1849c283b4e/main.pdf main.pdf pdf true 5890732 MAIN 9 1-s2.0-S246882311830066X-main_1.png https://s3.amazonaws.com/prod-ucs-content-store-us-east/content/pii:S246882311830066X/PREVIEW/image/png/a25ae5da15a273879d0b559c29513463/main_1.png main_1.png png 53115 849 656 IMAGE-WEB-PDF 1 1-s2.0-S246882311830066X-fx1.sml https://s3.amazonaws.com/prod-ucs-content-store-us-east/content/pii:S246882311830066X/fx1/THUMBNAIL/image/gif/46b175c24bb032b59d6e7fa969731231/fx1.sml fx1 true fx1.sml sml 25673 154 219 IMAGE-THUMBNAIL 1-s2.0-S246882311830066X-gr1.sml https://s3.amazonaws.com/prod-ucs-content-store-us-east/content/pii:S246882311830066X/gr1/THUMBNAIL/image/gif/0b8ded4fb7ca2bb19131de1171e9d2d2/gr1.sml gr1 gr1.sml sml 21701 143 219 IMAGE-THUMBNAIL 1-s2.0-S246882311830066X-gr10.sml https://s3.amazonaws.com/prod-ucs-content-store-us-east/content/pii:S246882311830066X/gr10/THUMBNAIL/image/gif/23230c2f3097ca4a33bbf7d2f8640c66/gr10.sml gr10 gr10.sml sml 8346 164 207 IMAGE-THUMBNAIL 1-s2.0-S246882311830066X-gr11.sml https://s3.amazonaws.com/prod-ucs-content-store-us-east/content/pii:S246882311830066X/gr11/THUMBNAIL/image/gif/d180b4dac13f7046b825a6167da76a4f/gr11.sml gr11 gr11.sml sml 8291 159 219 IMAGE-THUMBNAIL 1-s2.0-S246882311830066X-gr12.sml https://s3.amazonaws.com/prod-ucs-content-store-us-east/content/pii:S246882311830066X/gr12/THUMBNAIL/image/gif/7e5b530e494e8691f7ee12e963e6738b/gr12.sml gr12 gr12.sml sml 8091 127 219 IMAGE-THUMBNAIL 1-s2.0-S246882311830066X-gr13.sml https://s3.amazonaws.com/prod-ucs-content-store-us-east/content/pii:S246882311830066X/gr13/THUMBNAIL/image/gif/8c63b629389eee21ba28c1d577a11468/gr13.sml gr13 gr13.sml sml 7427 158 219 IMAGE-THUMBNAIL 1-s2.0-S246882311830066X-gr2.sml https://s3.amazonaws.com/prod-ucs-content-store-us-east/content/pii:S246882311830066X/gr2/THUMBNAIL/image/gif/d22a2fda32d814c7786ef290bbd1d082/gr2.sml gr2 gr2.sml sml 9826 128 219 IMAGE-THUMBNAIL 1-s2.0-S246882311830066X-gr3.sml https://s3.amazonaws.com/prod-ucs-content-store-us-east/content/pii:S246882311830066X/gr3/THUMBNAIL/image/gif/ca9c2560d49bb0b01bd3263830fda61b/gr3.sml gr3 gr3.sml sml 7535 164 202 IMAGE-THUMBNAIL 1-s2.0-S246882311830066X-gr4.sml https://s3.amazonaws.com/prod-ucs-content-store-us-east/content/pii:S246882311830066X/gr4/THUMBNAIL/image/gif/25204965b9640b82e1570dd758dadf56/gr4.sml gr4 gr4.sml sml 20939 143 219 IMAGE-THUMBNAIL 1-s2.0-S246882311830066X-gr5.sml https://s3.amazonaws.com/prod-ucs-content-store-us-east/content/pii:S246882311830066X/gr5/THUMBNAIL/image/gif/87e1a1c85c1933f992627f14faccb5f7/gr5.sml gr5 gr5.sml sml 4922 107 219 IMAGE-THUMBNAIL 1-s2.0-S246882311830066X-gr6.sml https://s3.amazonaws.com/prod-ucs-content-store-us-east/content/pii:S246882311830066X/gr6/THUMBNAIL/image/gif/debde17af0e8e176c335d9f369b1a75a/gr6.sml gr6 gr6.sml sml 5280 88 219 IMAGE-THUMBNAIL 1-s2.0-S246882311830066X-gr7.sml https://s3.amazonaws.com/prod-ucs-content-store-us-east/content/pii:S246882311830066X/gr7/THUMBNAIL/image/gif/f5a9517e8e5c6b6ecc9c6eab35e9ebe6/gr7.sml gr7 gr7.sml sml 7262 162 219 IMAGE-THUMBNAIL 1-s2.0-S246882311830066X-gr8.sml https://s3.amazonaws.com/prod-ucs-content-store-us-east/content/pii:S246882311830066X/gr8/THUMBNAIL/image/gif/4770dc5ff8e6f94c4e9d11b6a22d0a94/gr8.sml gr8 gr8.sml sml 20261 143 219 IMAGE-THUMBNAIL 1-s2.0-S246882311830066X-gr9.sml https://s3.amazonaws.com/prod-ucs-content-store-us-east/content/pii:S246882311830066X/gr9/THUMBNAIL/image/gif/41d5e3c15b1853677b39729fb3543d8f/gr9.sml gr9 gr9.sml sml 8651 159 219 IMAGE-THUMBNAIL 1-s2.0-S246882311830066X-fx1.jpg https://s3.amazonaws.com/prod-ucs-content-store-us-east/content/pii:S246882311830066X/fx1/DOWNSAMPLED/image/jpeg/f46334aedc5524bc40077afb3a9ea856/fx1.jpg fx1 true fx1.jpg jpg 14859 200 285 IMAGE-DOWNSAMPLED 1-s2.0-S246882311830066X-gr1.jpg https://s3.amazonaws.com/prod-ucs-content-store-us-east/content/pii:S246882311830066X/gr1/DOWNSAMPLED/image/jpeg/17df7a60de7bf02ab5ed0e3f0159ac12/gr1.jpg gr1 gr1.jpg jpg 121319 442 678 IMAGE-DOWNSAMPLED 1-s2.0-S246882311830066X-gr10.jpg https://s3.amazonaws.com/prod-ucs-content-store-us-east/content/pii:S246882311830066X/gr10/DOWNSAMPLED/image/jpeg/2927628cb4f18817aa40941c1822b24a/gr10.jpg gr10 gr10.jpg jpg 23157 242 305 IMAGE-DOWNSAMPLED 1-s2.0-S246882311830066X-gr11.jpg https://s3.amazonaws.com/prod-ucs-content-store-us-east/content/pii:S246882311830066X/gr11/DOWNSAMPLED/image/jpeg/5ed063396018112b56c698f74de63793/gr11.jpg gr11 gr11.jpg jpg 51483 410 565 IMAGE-DOWNSAMPLED 1-s2.0-S246882311830066X-gr12.jpg https://s3.amazonaws.com/prod-ucs-content-store-us-east/content/pii:S246882311830066X/gr12/DOWNSAMPLED/image/jpeg/717de1b032007dde70e803a8c8988bf1/gr12.jpg gr12 gr12.jpg jpg 67086 395 678 IMAGE-DOWNSAMPLED 1-s2.0-S246882311830066X-gr13.jpg https://s3.amazonaws.com/prod-ucs-content-store-us-east/content/pii:S246882311830066X/gr13/DOWNSAMPLED/image/jpeg/759566c137a65731d53b6dcd8cadd617/gr13.jpg gr13 gr13.jpg jpg 19844 221 305 IMAGE-DOWNSAMPLED 1-s2.0-S246882311830066X-gr2.jpg https://s3.amazonaws.com/prod-ucs-content-store-us-east/content/pii:S246882311830066X/gr2/DOWNSAMPLED/image/jpeg/e31d95012cde6fee1e6e06050c0a30b1/gr2.jpg gr2 gr2.jpg jpg 56600 331 567 IMAGE-DOWNSAMPLED 1-s2.0-S246882311830066X-gr3.jpg https://s3.amazonaws.com/prod-ucs-content-store-us-east/content/pii:S246882311830066X/gr3/DOWNSAMPLED/image/jpeg/26d1c3a548148190bed16ae4f3c9e7b2/gr3.jpg gr3 gr3.jpg jpg 21073 244 301 IMAGE-DOWNSAMPLED 1-s2.0-S246882311830066X-gr4.jpg https://s3.amazonaws.com/prod-ucs-content-store-us-east/content/pii:S246882311830066X/gr4/DOWNSAMPLED/image/jpeg/745d6ec5d0e3ce3e1bcf9e7dde1af458/gr4.jpg gr4 gr4.jpg jpg 117409 442 678 IMAGE-DOWNSAMPLED 1-s2.0-S246882311830066X-gr5.jpg https://s3.amazonaws.com/prod-ucs-content-store-us-east/content/pii:S246882311830066X/gr5/DOWNSAMPLED/image/jpeg/d416867e19853005d2efb2a828f3944a/gr5.jpg gr5 gr5.jpg jpg 39732 331 678 IMAGE-DOWNSAMPLED 1-s2.0-S246882311830066X-gr6.jpg https://s3.amazonaws.com/prod-ucs-content-store-us-east/content/pii:S246882311830066X/gr6/DOWNSAMPLED/image/jpeg/40dc6509849d2ce50aa27fe15a4ca238/gr6.jpg gr6 gr6.jpg jpg 33772 228 565 IMAGE-DOWNSAMPLED 1-s2.0-S246882311830066X-gr7.jpg https://s3.amazonaws.com/prod-ucs-content-store-us-east/content/pii:S246882311830066X/gr7/DOWNSAMPLED/image/jpeg/e400b59be06ee0d3fca2e8950ccb06be/gr7.jpg gr7 gr7.jpg jpg 18455 224 303 IMAGE-DOWNSAMPLED 1-s2.0-S246882311830066X-gr8.jpg https://s3.amazonaws.com/prod-ucs-content-store-us-east/content/pii:S246882311830066X/gr8/DOWNSAMPLED/image/jpeg/fec77b41910335828fb4d7c29e0abb57/gr8.jpg gr8 gr8.jpg jpg 111640 442 678 IMAGE-DOWNSAMPLED 1-s2.0-S246882311830066X-gr9.jpg https://s3.amazonaws.com/prod-ucs-content-store-us-east/content/pii:S246882311830066X/gr9/DOWNSAMPLED/image/jpeg/c7e536bf9f831e580e24e2d17419ae8d/gr9.jpg gr9 gr9.jpg jpg 20464 220 303 IMAGE-DOWNSAMPLED 1-s2.0-S246882311830066X-si1.gif https://s3.amazonaws.com/prod-ucs-content-store-us-east/content/pii:S246882311830066X/STRIPIN/image/gif/922e61448b6731b663b1fff3c51f010a/si1.gif si1 si1.gif gif 2600 25 765 ALTIMG 1-s2.0-S246882311830066X-si2.gif https://s3.amazonaws.com/prod-ucs-content-store-us-east/content/pii:S246882311830066X/STRIPIN/image/gif/ac7a721c99d7eb719cdaa0c1b2b14f6a/si2.gif si2 si2.gif gif 2509 25 738 ALTIMG 1-s2.0-S246882311830066X-si3.gif https://s3.amazonaws.com/prod-ucs-content-store-us-east/content/pii:S246882311830066X/STRIPIN/image/gif/986883627428d9ee705de457b76f8374/si3.gif si3 si3.gif gif 1050 34 171 ALTIMG MCAT 497 S2468-8231(18)30066-X 10.1016/j.mcat.2018.02.011 Elsevier B.V. Fig. 1 TEM images for calcined 10Ni/SBA-15 (a), 8Ni-2Co/SBA-15 (b), 5Ni-5Co/SBA-15 (c), 2Ni-8Co/SBA-15 (d) and 10Co/SBA-15 (e) catalysts. Fig. 1 Fig. 2 XRD patterns for (left) calcined and (right) treated in 5%H2/Ar at 750 °C nickel-cobalt-based systems. Fig. 2 Fig. 3 Temperature-programmed reduction profiles for the calcined Ni-Co/SBA-15 catalytic systems. Fig. 3 Fig. 4 TEM images of 10Ni/SBA-15 (a), 8Ni-2Co/SBA-15 (b), 5Ni-5Co/SBA-15 (c), 2Ni-8Co/SBA-15 (d), and 10Co/SBA-15 (e), after hydrogen reduction at 750 °C. Fig. 4 Fig. 5 Histograms of particle sizes for 10Ni/SBA-15 (a), 8Ni-2Co/SBA-15 (b), 5Ni-5Co/SBA-15 (c), 2Ni-8Co/SBA-15 (d), and 10Co/SBA-15 (e), after reduction (black bars) and after being submitted to SRE reaction conditions (red bars). (For interpretation of the references to colour in this figure legend, the reader is referred to the web version of this article.) Fig. 5 Fig. 6 XPS spectra of calcined Ni-Co/SBA-15 systems (a) and same spectra normalized to metal percentage (b). Fig. 6 Fig. 7 XPS spectra of reduced Ni-Co/SBA-15 systems normalized to metal percentage. Fig. 7 Fig. 8 TEM images for 10Ni/SBA-15 (a), 8Ni-2Co/SBA-15 (b), 5Ni-5Co/SBA-15 (c), 2Ni-8Co/SBA-15 (d), and 10Co/SBA-15 (e), after SRE reaction. Fig. 8 Fig. 9 XPS spectra of reduced (thin line) and spent (thick line) Ni-Co/SBA-15 systems normalized to metal percentage. Fig. 9 Fig. 10 TPR profiles of Ni-Co/SBA-15 catalysts up to 750 °C plus 1 h isotherm. Thin line: first TPR. Thick line: second TPR after SRE reaction. Fig. 10 Fig. 11 Co (left) and Ni (right) K-edge XANES spectra and Fourier transform functions of the EXAFS oscillations after different treatments. Fig. 11 Fig. 12 TCD and Mass Spectrometer signals coming from H2 (m/e− = 2) and methane (m/e− = 15) for 10Ni/SBA-15 (a), 8Ni-2Co/SBA-15 (b), 5Ni-5Co/SBA-15 (c), 2Ni-8Co/SBA-15 (d), and 10Co/SBA-15 (e). Fig. 12 Fig. 13 XPS spectra of reduced, spent and hydrogenated 10Co/SBA-15 system. Fig. 13 Table 1 Characterization data of the Ni-Co/SBA-15 catalytic systems. Table 1 SBET (m2 g−1) Average pore size (nm) a Ni/Cosurf. by XPS (%at) Crystallite size (XRD b ) [Calc/Red] Average metallic particle size (TEM c ) [Red/SRE] SBA-15 738 6.7 – – – SBA-15 treated with urea 249 9.1 – – – 10Ni/SBA-15 283 10.3 11.3/0.0 5.4/4.1 4.3/4.2 8Ni-2Co/SBA-15 272 11.1 7.8/2.6 7.6/4.1 4.4/4.0 5Ni-5Co/SBA-15 261 12.0 4.2/3.1 7.0/4.5 5.9/8.6 2Ni-8Co/SBA-15 269 10.3 1.9/7.1 6.5/8.2 8.6/7.0 10Co/SBA-15 DP 280 9.8 0.0/7.1 5.1/13.2 14.4/9.6 a Obtained by the BJH method. b Calculated from the Scherrer equation. c Obtained by sampling 150 particles. Table 2 Atomic percentage of Ni and/or Co as determined from XPS signals. Table 2 Calcined catalysts Reduced catalysts At% Ni (N%) a At% Co (N%) a At% Ni (N%) a At% Co (N%) a 10Ni/SBA-15 10.89 (1.09) – 2.5 (0.25) – 8Ni-2Co/SBA-15 7.88 (0.99) 2.18 (1.09) 2.2 (0.28) 0.61 (0.31) 5Ni-5Co/SBA-15 4.17 (0.83) 3.80 (0.76) 0.73 (0.15) 0.75 (0.15) 2Ni-8Co/SBA-15 1.83 (0.91) 7.14 (0.89) 0.33 (0.17) 0.59 (0.07) 10Co/SBA-15 – 4.78 (0.48) – 0.9 (0.09) a N%: atomic percentage normalized to nominal Ni/Co metal content (10–8%). Table 3 Catalytic performances in Steam Reforming of Ethanol after 12 h of TOS. Table 3 Conv. (%) Selectivities (%) H2 CO2 H2/CO2 CO CH4 CH3CHO 10Ni/SBA-15 69.3 59.4 59.5 1.00 19.6 13.8 3.8 8Ni2Co/SBA-15 85.6 62.4 60.3 1.03 18.3 21.0 0.1 5Ni5Co/SBA-15 68.0 62.2 60.9 1.02 19.1 14.0 4.4 2Ni8Co/SBA-15 59.3 70.1 62.6 1.12 14.2 14.9 8.5 Co/SBA-15 88.6 55.1 38.9 1.42 14.1 3.7 43.5 Bimetallic Ni-Co/SBA-15 catalysts for reforming of ethanol: How cobalt modifies the nickel metal phase and product distribution Alberto Rodriguez-Gomez Alfonso Caballero ⁎ Instituto de Ciencia de Materiales de Sevilla (CSIC-University of Seville) and Departamento de Quimica Inorganica, University of Seville, Av. Americo Vespucio, 49, 41092 Seville, Spain Instituto de Ciencia de Materiales de Sevilla (CSIC-University of Seville) and Departamento de Quimica Inorganica University of Seville Av. Americo Vespucio, 49 Seville 41092 Spain ⁎ Corresponding author. Graphical abstract In this study, five mono and bimetallic xNi-(10-x)Co/SBA-15 catalysts (x = 10, 8, 5, 2 and 0, with a total metallic content of 10 wt%) have been synthesized using a deposition-precipitation (DP) methodology. Catalytic performances on the steam reforming of ethanol reaction (SRE) have been determined and correlated with their physical and chemical state. A nickel content of 5% or higher yields catalytic systems with good activity, high selectivity to hydrogen and a low production of acetaldehyde (less than 5%). However, in the systems where the cobalt is the main component of the metallic phase (8–10%), the selectivity changes, mainly due to the production of an excess of acetaldehyde, which is also reflected in the larger H2/CO2 ratio. In agreement with previous findings, this important modification in the selectivity comes from the formation of a cobalt carbide phase, where only takes place in the cobalt enriched systems, and is inhibited with nickel content larger than 5%. The formation of this carbide phase seems to be responsible for the decrease of cobalt particle size during the SRE reaction. Even though this cobalt carbide phase is thermodynamically metastable against decomposition to metallic cobalt and graphite carbon, our results have shown that it only reacts and decomposes after a hydrogen treatment at 600 °C. Keywords Nickel cobalt catalysts In situ XPS Hydrogen production Cobalt carbide Ethanol steam reforming Acetaldehyde 1 Introduction Although methane steam reforming is currently the most industrial competitive process for obtaining hydrogen [1–3], the impact on climate of using fossil fuels, and the limited availability of methane due to the remote locations of some of the major natural gas fields makes the use of renewable chemicals as bioethanol a very interesting alternative to reduce the environmental impact [4,5]. This product of the biomass processing is easily available, with low toxicity and also very important, the existing infrastructure for storage and transportation is spread worldwide [6–8]. Ethanol steam reforming has been extensively studied in the last decades. As in other reactions such as the methane reforming, the use of noble metals yields good catalytic performance with high selectivity to hydrogen and a limited amount of carbon deposits poisoning the catalyst [9–14]. Once again, the high price and poor availability of metals as Ru, Pt, Rh or Pd, advises the use of cheaper alternatives, especially Ni, but also Co and/or Cu [15–19], even though these metals favor the deposition of carbonaceous deposits. The carbon deposition processes can be mitigated in several ways, as changing the ethanol/water ratio, introducing oxygen in the feed mixture or using different kind of supports [20,21]. An alternative strategy to overcome this issue involves the use of bimetallic systems, where the synergistic effects of the two metals can improve their catalytic performances. In this sense Ni-Co is one of the most popular couple being used for this SRE reaction but also for reforming of methane [19,22–26]. It has been previously reported that the combining effect of this two metals is able to produce less amount but also less harmful carbon deposits [6]. In this work we have synthesized five catalysts containing nickel and/or cobalt supported on the mesoporous silica SBA-15. The catalytic systems, with a total metal loading of 10 wt%, has been prepared by means of a deposition-precipitation method (xNi-(10-x)Co/SBA-15 catalysts, x = 10, 8, 5, 2 and 0). We have measured the catalytic performances of these systems, and characterized their states after calcination, hydrogen reduction and steam reforming of ethanol reaction conditions using among others, XPS, XAS and TEM. The results have allowed correlating the catalytic performances with the initial state of metallic phases and its evolution under catalytic conditions. The formation of a Ni-Co bimetallic phase and the stabilization of a cobalt carbide phase in the Co-enriched systems are the major factors determining the catalytic performances of these Ni-Co/SBA-15 catalysts. 2 Experimental 2.1 Preparation of the catalysts Ni-Co catalytic systems were synthesized by a deposition-precipitation method over a mesoporous support of SBA-15 which was prepared by the Zhao et al. protocol [27] using a TEOS/P123/HCl/H2O (TEOS: Sigma-Aldrich, CAS: 78-10-4; HCl: Sigma-Aldrich, CAS: 7647-01-0; Pluronic® P-123: Sigma-Aldrich, CAS: 9003-11-6) molar relation of 1/0.02/9.91/320. Typically, 3 g of PEG-PPG-PEG (P123) were dissolved in 140 mL of HCl 1.8 M. After total solution, the mix was heated up to 50 °C and 5.9 mL of TEOS were added with stirring. The solution was kept on static at 50 °C for 18 h, and the gel obtained was filtered and washed several times with distilled water. The product was dried and calcined on static air for 3 h at 550 °C. The metallic phase was loaded by heating up to 105 °C during 2 h a solution containing 1 g of as-prepared SBA-15, 150 mL of HNO3 0.01 M (Sigma-Aldrich, CAS: 7697-37-2), the metal precursors [Ni(NO3)2·6H2O (Panreac, CAS: 13478-00-7) or/and Co(NO3)2·6H2O (Panreac, CAS: 10026-22-9]) and 11.37 g of urea (Alfa Aesar, CAS: 57-13-6), for a total metallic charge of 10% and different xNi/(10-x)Co ratio (x = 0, 2, 5, 8, 10). After this time, the resulting solution was filtered and washed with distilled water, dried at 110 °C and calcined on static air for 3 h at 550 °C. 2.2 Catalytic test SRE catalytic tests were performed over 100 mg of catalyst held in a tubular quartz reactor. Samples were pre-reduced in hydrogen at 750 °C for 1 h using a heating ramp of 10 °C min−1 and reaction was carried out at 500 °C by injecting 0.02 mL min−1 of a H2O/EtOH solution (3.7 molar ratio) and 100 mL min−1 of helium as carrier gas. Products were analyzed by gas chromatography using an Agilent’s 490 microGC equipment, connected on-line with the reactor, provided with three columns and TCD detectors: two molecular sieves for the analysis of lighter molecules as H2, CO, CH4 and CO, and a capillary column (PoraPLOT-U) for the analysis of CO2, H2O, ethanol and acetaldehyde. Quantitative calculations were as follows: Ethanol conversion (%): X E t O H = F E t O H i n − F E t O H o u t F E t O H i n · 100 , being FEtOHin and FEtOHout the ethanol molar flow in the inlet and outlet gas, respectively. Selectivity to different products (%): S i = F i o u t c i ( F E t O H i n − F E t O H o u t ) · 100 , being Fi the component i molar flow. Ci is a stoichiometric value obtained by the equation: c i = carbon atoms in EtOH carbon atoms in i In the case of H2 selectivity we estimated the value given by the EtOH/H2 stoichiometric relation in SRE, being ci = 6. 2.3 N2-physisorption N2 adsorption/desorption isotherms were obtained at −196 °C in a TRISTAR II (Micromeritics) equipment. With a minimum amount of 50 mg, each sample was pre-treated under vacuum at 150 °C prior to the adsorption/desorption experiment. Surface areas and porosity were calculated according to the BET and BJH method, respectively. 2.4 TEM Transmission electron microscopy was carried out in a Philips CM200 microscope operating at 200 kV using a copper grid coated with lacey carbon as sample support. Analysis of particle size was performed by sampling 150 particles. 2.5 XRD Diffractogram patterns of calcined and reduced samples were obtained in a PANalytical X-Pert PRO diffractometer with a Cu anode (λ = 1.5418 Å, Cu Kα), using a Bragg-Brentano configuration in the 2θ range of 10–80°, with a step of 0.05° and an effective acquisition time of 240 s. 2.6 TPR Temperature-programmed reduction experiments were done using a thermal conductivity detector calibrated with a commercial NiO. An estimated amount of calcined sample for consuming 100 μmol of H2 was used in each case. Conventional experiments were carried out from room temperature up to 1000 °C with a heating ramp of 10 °C min−1. Experimental conditions were chosen to avoid peak coalescence [28]. A mass spectrometer was used to determine the evolution of gases during the reduction treatments of oxidized and post-reaction samples: CH4 (m/e− = 15), H2 (m/e− = 2) and H2O (m/e− = 18). 2.7 XPS X-ray photoelectron spectroscopy was performed in a VG-ESCALAB 210 equipment. Acquisition was performed in a chamber equipped with a SPECS Phoibos 100 hemispheric analyzer at 10−9 Torr using an anticathode of MgKα (E = 1.5418 eV) with 12 kV of potential acceleration and 20 mA of current. Catalytic systems were analyzed as-prepared and after different, consecutive in situ treatments: 1. 5%H2/Ar at 750 °C during 1 h with a heating ramp of 10 °C min−1. 2. SRE conditions at 500 °C during 1 h by bubbling an ethanol/water solution with 100 mL min−1 of argon for obtaining a similar flow gas composition as the catalytic test. 3. Hydrogen treatment with 5%H2/Ar at 400 °C, during 1 h. 4. Hydrogen treatment with 5%H2/Ar at 550 °C, during 1 h. 5. Hydrogen treatment with 5%H2/Ar at 600 °C, during 1 h. 2.8 XAS X-ray absorption spectra were carried out at the BL22 CLAESS beamline at the ALBA synchrotron facility (Spain). Pelletized samples were analyzed in transmission mode in an in situ cell for gas-solid reactions with an amount of sample estimated to maximize the signal/noise ratio. Due to beamtime limitations, only monometallic samples were studied. These catalytic systems were analyzed as-prepared and after different in situ treatments: 1. 5%H2/Ar at 750 °C during 1 h with a heating ramp of 10 °C min−1. 2. SRE conditions at 500 °C during 1 h by bubbling an ethanol/water solution with 100 mL min−1 of argon for obtaining a similar flow gas composition as the catalytic test. Standard nickel and cobalt foils were measured and used for energy calibration. XAS spectra were recorded from 7600 to 9200 eV (including both Ni and Co K-edge energies). 3 Results and discussion 3.1 Characterization of calcined and reduced catalysts The five catalytic systems were characterized by N2 adsorption analysis (BET, BJH), XRD, TEM, TPR and XPS. XAS spectra were just collected for the two monometallic systems. As reflected in Table 1 , during the alkaline treatment with urea, all samples undergo important changes of BET surface area and mean porous size. From the original value of 738 m2 g−1 of the pristine SBA-15, the BET of the treated solids decrease to 250–280 m2 g−1. Simultaneously, the average pore size increases from 6.7 to 9–12 nm. Despite this loss of surface area and porosity, the images of the calcined catalysts obtained by TEM (Fig. 1 ) shows that the channeled structure of the SBA-15 support is preserved, with the “fibrous” structures of phyllosilicate phases generated during this treatment being visible [29–31]. The formation of (NiCo)3Si2O5(OH)4 and/or (NiCo)3Si4O10(OH)2 phyllosilicate phases [32] can be confirmed in the XRD diagrams of Fig. 2 (left) by the wide peaks appearing around 35 and 61° [33], the only phases detected in the calcined samples. As it can be observed in the inset, the bimetallic samples, and in particular the 5Ni-5Co/SBA-15, only show one peak near 61°, indicating the formation of a bimetallic nickel cobalt phyllosilicate phase. According to the TPR profiles included in Fig. 3 , the 10Ni/SBA-15 catalyst presents two different reduction processes, characterized by a small shoulder at 475 °C and a main peak centered at 675 °C, previously assigned to the reduction of a small amount of nickel oxide and a nickel phyllosilicate phase, respectively [29,34]. Likewise, the 10Co/SBA-15 system has the main peak at higher temperature (750 °C) with a shoulder centered at 850 °C [26]. All the bimetallic catalysts present intermediate profiles, with the main peak centered at higher temperatures as the cobalt content increases. Thus, these profiles once again suggest the formation of bimetallic phases in the calcined catalysts. The diffraction diagrams of these systems reduced in hydrogen at 750 °C, included in Fig. 2 (right) show diffraction peaks around 44.5 and 52°, the result of well reduced nickel and/or cobalt phases. As detailed in the figure, the shift of these peaks with the Ni/Co content also suggests the formation of a Ni-Co bimetallic phase. The TEM images of the catalytic systems obtained after hydrogen reduction are depicted in Fig. 4 . It can be observed how the sizes of the metallic particles are dependent on the Ni/Co ratio. Thus, the smaller particles (4–6 nm, black bars in Fig. 5 ) are obtained for the 10Ni/SBA-15 catalyst, and the size progressively increases with the Co content, reaching an average value of 14.4 nm for the 10Co/SBA-15 (Table 1). These results clearly show a stronger interaction of nickel with the SBA-15 support, allowing a larger dispersion of the metallic phase. Additionally, both Figs. 4 and 5 show that the increasing amount of cobalt gives rise to higher size heterogeneity, reaching a range around 3–25 nm in the monometallic 10Co/SBA-15 system. XPS spectroscopy of these five catalysts has shed light on the origin of the observed differences in particle sizes. Fig. 6 a depicts the contiguous Ni 2p and Co 2p XPS regions of calcined samples, showing the presence of Ni2+ and Co2+ species of metal phyllosilicates, respectively [35–39]. As the nickel and cobalt contents are different in each system, the spectra are better understood when normalized to the respective Ni and Co contents (Fig. 6b). Quantification of peaks intensities are presented in Table 2 , where nominal and normalized to the metal content values is included for each catalytic system. Thus, while for calcined samples the normalized intensity of nickel remains virtually unchanged (0.9 ± 0.1), cobalt is strongly affected by the presence of nickel so that it increases the dispersion over the SBA-15 support when the amount of nickel increases. Especially striking is the high intensity of the Co 2p signal obtained for 8Ni-2Co/SBA-15, more than two times the normalized value of the cobalt monometallic system (0.48 and 1.09, respectively). Anyhow, these results indicate that the smaller particle sizes obtained for the reduced nickel containing catalysts are related with the initial better dispersion of the phyllosilicate phases generated by calcination. It can be also seen in Table 2 how after reduction the intensity of Ni 2p peaks included in Fig. 7 slightly decreases by the presence of cobalt (0.25–0.17), while the Co 2p region signals increases 3.5 times its normalized intensity when nickel is present, from 0.09 in the Co/SBA-15 to 0.31 in 8Ni-2Co/SBA-15. These results are in agreement with the previous characterization data indicating an important increase in the cobalt dispersion when in the bimetallic systems. 3.2 Steam reforming of ethanol The catalytic performances of the five Ni-Co/SBA-15 systems were studied in the steam reforming of ethanol reaction (SRE) at 500 °C using an H2O:EtOH ratio of 3.7. Table 3 includes conversion and selectivity values after 12 h on stream. After an initial deactivating interval of 1–2 h, all the catalytic systems were stable without noticeable deactivation during the whole studied period under ethanol reforming conditions. As shown, ethanol conversion values range from 60 to 90%, but other important differences can be noted among the five catalytic systems. Both 10Ni/SBA-15 and 5Ni-5Co/SBA-15 have exactly the same behaviour in conversion and selectivity towards all products, including a H2/CO2 ratio near 1. However, the 8Ni-2Co/SBA-15, with an intermediate metallic composition presents a higher conversion up to 85.6%, in part due to the higher production on methane (21% versus 14%). This change is accompanied by the almost total disappearance of the product acetaldehyde, which had reached values close to 4% in the first two described catalysts. As this catalyst presents the higher cobalt dispersion as determined by XPS (Table 2) and a Ni/Co ratio of 4, this singular behaviour could be related with the formation of a homogeneous well dispersed Ni4Co1 bimetallic phase. Finally, the 2Ni-8Co/SBA-15 and 10Co/SBA-15 are characterized by the successive increase in the selectivity to acetaldehyde (8.5 and 43.5%, respectively), together with a parallel increase in the H2/CO2 ratio (1.12 and 1.42), revealing the gradual high dehydrogenation activity of these two catalytic systems (C2H5OH → C2H4O + H2). It is worth to mention that the high performance of the 10Co/SBA-15 catalyst for acetaldehyde production had been previously reported by our group as a result of the formation of a cobalt carbide phase under SRE reaction conditions [3]. Other authors also reported cobalt containing catalytic systems presenting values for acetaldehyde production with selectivity values up to 50% [40,41]. 3.3 Characterization studies after steam reforming of ethanol In order to clarify the origin of the different catalytic performances in the catalytic systems studied in this work, we have performed additional characterization studies after submitting the catalysts to SRE reaction conditions. Thus, after the SRE reaction the catalysts present the appearance showed in the TEM images of Fig. 8 . According to the analysis of particles sizes in the five systems (see histograms included in Fig. 5), two different behaviors can be observed. The two systems with the higher Ni content essentially maintain their size and distribution of the freshly reduced 10Ni and 8Ni-2Co/SBA-15 catalysts. Surprisingly, the analysis of the TEM images of both catalysts with the higher cobalt content (2Ni-8Co and 10Co/SBA-15) makes it clear that the particle size decreases, which is more evident in the 10Co/SBA-15 catalyst, where no nickel is present. According to our previous findings [3], this unexpected redispersion of metallic particles could be related to the formation of a cobalt carbide phase, which apparently breaks the cobalt metallic particles, significantly reducing the particle size. In turn, this phenomenon seems to correlate with the higher acetaldehyde production observed in these two systems (Table 3). In order to deepen the origin of this phenomenon, we have carried out an in situ XPS study of the catalysts after the SRE reaction, which results are depicted in Fig. 9 . The comparison between the spectra before and after SRE reaction shows essentially that there are no significant changes in the Ni 2p region of the four Ni-containing catalysts, except for a slight increase in the intensity for the 2Ni-8Co/SBA-15, which agrees with higher dispersion after reaction observed previously by TEM (Fig. 5). In a first inspection, a similar behavior is observed in the Co 2p region of the two more Ni-enriched systems (8Ni-2Co and 5Ni-5Co/SBA-15), while the Co 2p regions of 2Ni-8Co and especially, 10Co/SBA-15 catalysts are clearly modified, shifting the main peak from 778.0 eV to lower binding energy values. This red shift of cobalt to an apparently more reduced state has been previously observed by us in the monometallic catalytic system and ascribed to the formation of a new cobalt carbide phase under SRE reaction conditions. In fact, the observed peak is an envelope of two different ones coming from a mixture of cobalt carbide (centered at 776.6 eV) and metallic phases (centered at 778.0 eV) [3]. Deconvolution of this peak reveals the presence of 70% metallic cobalt, 30% cobalt carbide in the 10Co/SBA-15 catalyst, and 79% metallic cobalt, 21% of cobalt carbide in the 2Ni-8Co/SBA-15 catalyst. The different amounts of carbide phase detected in these catalysts could account for the different acetaldehyde production observed in these two catalytic systems (Table 3). In this sense, it is worth to mention that, although less obvious, even the Co 2p region of 5Ni-5Co/SBA-15 presents a small red shift which can be convoluted with a 10% contribution of a cobalt carbide phase at 776.6 eV. The fact that this catalyst has the same acetaldehyde production as the 10Ni/SBA-15 indicates that there is a minimum amount of carbide needed to increase the acetaldehyde production. This could be due to the fact that the adsorption of ethanol on the cobalt surface, the first step in both reforming and dehydrogenation of ethanol, is a structure sensitive reaction [20] and therefore needing the formation of a specific ensemble of active atoms to constitute the cobalt carbide active site. 3.4 Further characterization of carbide phase In order to understand the state of this carbide phase, a new set of TPR experiments have been performed. In this case, a first TPR has been recorded just up to 750 °C, maintaining isothermally the same reducing conditions during 1 h. Afterwards, the systems were submitted to SRE reaction conditions at 500 °C during 1 h and a second TPR recorded. The two TPR profiles are depicted in Fig. 10 . As expected, the profiles corresponding to the first TPR up to 750 °C (thin line) are similar to those of Fig. 3. Likewise, all the profiles of the second TPRs (thick line) have two distinct parts. A first positive peak at low temperature (around 520 °C), indicating depletion of hydrogen, which in the 10Co and 2Ni-8Co/SBA-15 catalysts is accompanied with a shoulder or small peak at 620 °C. Along with this, a negative peak appears at higher temperature, centred at 750 °C, which must correspond to desorption of previously adsorbed hydrogen on the metallic particles. It is important to note that other processes or the formation of other products (i.e. methane) could affect the signal from the TCD detector during TPR, which will be discussed below. Thus, the hydrogen consumption process observed at low temperature (525 °C) could be due to the reduction of metal particles previously oxidized during the SRE reaction. This possibility has been discarded in view of the results obtained by XAS spectroscopy under similar SRE reaction conditions (Fig. 11 ). As shown in XANES and Fourier Transform curves, after reaction, both nickel and cobalt remain completely reduced. Thus, the depletion of hydrogen only can be due to reduction of carbon deposited during the SRE reaction, which can be confirmed in Fig. 12 , where are depicted the TCD and mass spectrometer profiles obtained during the second TPR. Methane (m/e− = 15) is formed coinciding with the depletion of hydrogen (m/e− = 2), confirming that carbon is eliminated in this low temperature process. However, a deeper comparison of the profiles of the five catalysts shows once again two different patterns. On the one hand, in the three catalysts with the high amount of nickel (10Ni, 8Ni-2Co and 5Ni-5Co/SBA-15) the peak maxima for H2 and CH4 approximately appear at the same temperature (521, 527 and 529 ± 3 °C, respectively), and consist in asymmetric peaks with a soft tail a high temperature. But the profiles for the two Co-enriched catalysts follow a different pattern. In both cases (10Co and 2Ni-8Co/SBA-15) the m/e− = 2 peak coming from H2 species is complex, with at less two maxima at different temperatures (528 and 625 °C for 10Co/SBA-15; 528 and 610 °C for 2Ni-8Co/SBA-15). Moreover, maxima for H2 and CH4 do not match, with the maxima for methane appearing at a temperature 35 °C higher. The fact that in these two systems the higher methane production does not match the higher hydrogen consumption must indicate that the methane formed during the TPR comes from a different carbon phase, more hydrogenated and therefore consuming less hydrogen. As this effect, much more intense in the cobalt monometallic system, correlates with the amount of cobalt carbide phase in these two systems, it could be due to the hydrogenation of this carbide phase, which is thermodynamically unstable [42], and could adsorb a certain amount of hydrogen before decompose (CoCx + H2 → Co0 + CH4). If this were the case, a hydrogen treatment of the catalysts presenting the cobalt carbide phase should reverse the red shift of the Co 2p peak observed by XPS. As shown in Fig. 13 , this is really what happens when the 10Co/SBA-15 catalyst is treated under SRE conditions and later in hydrogen at increasing temperatures up to 600 °C, the higher reachable in our XPS equipment. The SRE treatment causes the red shift of the Co 2p peak, which does not move significantly when treated in hydrogen till 550 °C. At higher temperature, a blue shift is observed, indicating that the carbide phase is decomposing and the metallic cobalt restored. 4 Conclusions We have characterized five Ni-Co/SBA-15 bimetallic systems active in the steam reforming of ethanol reaction at 500 °C. The presence of nickel favors the dispersion of metallic phases after reduction, while the cobalt tends to generate larger metallic particles. However, these Co-enriched particles significantly reduce their size after SRE reaction, and in parallel, the higher cobalt content increases the acetaldehyde production. Both effects, high acetaldehyde production and breakage of metallic particles can be explained accepting the formation of a cobalt carbide phase, which although thermodynamically metastable, has proved to remain stable under hydrogen at 550 °C. Acknowledgments We thank the “Ministerio de Economia and Competitividad” of Spain (Projects CTQ2014-60524-R and ENE2017-88818-C2-1-R) and the ESRF facility and staff (BM25 SPLINE beamline), and the ALBA facility and staff (BL22 CLAESS beamline) for their experimental support. A.R.G thanks also the Spanish Government for the PhD fellowship (BES-2012-061744). References [1] S.T. Oyama P. Hacarlioglu Y.F. Gu D. Lee Int. J. Hydrogen Energy 37 2012 10444 10450 [2] A.G. Bhavani W.Y. Kim J.S. Lee ACS Catal. 3 2013 1537 1544 [3] A. Rodriguez-Gomez J.P. Holgado A. Caballero ACS Catal. 7 2017 5243 5247 [4] G.W. Huber S. Iborra A. Corma Chem. Rev. 106 2006 4044 4098 [5] A. Tanksale J.N. Beltramini G.Q.M. Lu Renew. Sustain. Energy Rev. 14 2010 166 182 [6] Y.C. Sharma A. Kumar R. Prasad S.N. Upadhyay Renew. Sustain. Energy Rev. 74 2017 89 103 [7] C. Wu V. Dupont M.A. Nahil B. Dou H. Chen P.T. Williams J. Energy Inst. 90 2017 276 284 [8] J. Chen J. Sun Y. Wang Ind. Eng. Chem. Res. 56 2017 4627 4637 [9] V. Palma F. Castaldo P. Ciambelli G. Iaquaniello Appl. Catal. B: Environ. 145 2014 73 84 [10] S.-i. Ito K. Tomishige Catal. Commun. 12 2010 157 160 [11] N.J. Divins A. Casanovas W. Xu S.D. Senanayake D. Wiater A. Trovarelli J. Llorca Catal. Today 253 2015 99 105 [12] S. Su W. Li Z. Bai H. Xiang Int. J. Hydrogen Energy 33 2008 6947 6952 [13] M.A. Goula S.K. Kontou P.E. Tsiakaras Appl. Catal. B: Environ. 49 2004 135 144 [14] T.F. Hou B. Yu S.Y. Zhang T.K. Xu D.Z. Wang W.J. Cai Catal. Commun. 58 2015 137 140 [15] H. Song U.S. Ozkan J. Phys. Chem. 114 2010 3796 3801 [16] M. El Doukkali A. Iriondo P.L. Arias J.F. Cambra I. Gandarias V.L. Barrio Int. J. Hydrogen Energy 37 2012 8298 8309 [17] M.N. Barroso A.E. Galetti M.C. Abello Appl. Catal. A: Gen. 394 2011 124 131 [18] L.P.R. Profeti E.A. Ticianelli E.M. Assaf J. Power Sources 175 2008 482 489 [19] S. Duan S. Senkan Ind. Eng. Chem. Res. 44 2005 6381 6386 [20] C.M.A. Parlett A. Aydin L.J. Durndell L. Frattini M.A. Isaacs A.F. Liu Lee X. Olivi L. Trofimovaite R. Wilson K. Wu Catal. Commun. 91 2017 76 79 [21] L.V. Mattos G. Jacobs B.H. Davis F.B. Noronha Chem. Rev. 112 2012 4094 4123 [22] V.M. Gonzalez-Delacruz R. Pereñiguez F. Ternero J.P. Holgado A.J. Caballero J. Phys. Chem. C 116 2012 2919 2926 [23] J. Zhang H. Wang A.K. Dalai J. Catal. 249 2007 300 310 [24] L. Wang D. Li M. Koike H. Watanabe Y. Xu Y. Nakagawa K. Tomishige Fuel 112 2013 654 661 [25] C.R.B. Silva L. Conceicao N.F.P. Ribeiro M.M.V.M. Souza Catal. Commun. 12 2011 665 668 [26] A. Rodriguez-Gomez R. Pereñiguez A. Caballero Catal. Today 2018 10.1016/j.cattod.2017.02.020 [27] D.Y. Zhao J.L. Feng Q.S. Huo N. Melosh G.H. Fredrickson B.F. Chmelka G.D. Stucky Science 279 1998 548 552 [28] P. Malet A. Caballero Chem. Soc. Faraday Trans. 84 1988 2369 2375 [29] A. Rodriguez-Gomez A. Caballero ChemNanoMat 3 2017 94 97 [30] X. Kong Y. Zhu H. Zheng X. Li Y. Zhu Y. Li ACS Catal. 5 2015 5914 5920 [31] C. Zhang H. Yue Z. Huang S. Li G. Wu X. Ma J. Gong ACS Sustain. Chem. Eng. 1 2012 161 173 [32] J.S. Kim I. Park E. Jeong K. Jin W.M. Seong G. Yoon H. Kim B. Kim K.T. Nam K. Kang Adv. Mater. 29 2017 1606893 [33] M.E. Galvez A. Albarazi P. Da Costa Appl. Catal. A: Gen. 504 2015 143 150 [34] A. Rodriguez-Gomez R. Pereñiguez A. Caballero J. Phys. Chem. B 122 2018 500 510 [35] J.P. Espinos A.R. Gonzalez-Elipe A. Caballero J. Garcia G. Munuera J. Catal. 136 1992 415 422 [36] B. Lu Y. Ju T. Abe K. Kawamoto RSC Adv. 5 2015 56444 56454 [37] S. Todorova G. Kadinov K. Tenchev Y. Kalvachev V. Kostov-Kytin J. Mater. Sci. 42 2007 3315 3320 [38] B.F. Kengne A.M. Alayat G. Luo A.G. McDonald J. Brown H. Smotherman D.N. McIlroy Appl. Surf. Sci. 359 2015 508 514 [39] S. Todorova A. Naydenov H. Kolev J.P. Holgado G. Ivanov G. Kadinov A. Caballero Appl. Catal. A: Gen. 413 2012 43 51 [40] J. Llorca P. Ramirez de la Piscina J.-A. Dalmon N. Homs Chem. Mater. 16 2004 3573 3578 [41] A.J. Vizcaíno A. Carrero J.A. Calles Fuel Process. Technol. 146 2016 99 109 [42] Y.H. Zhao H.Y. Su K. Sun J. Liu W.X. Li Surf. Sci. 606 2012 598 604",
      "scopus-id": "85045885410",
      "coredata": {
        "eid": "1-s2.0-S246882311830066X",
        "dc:description": "In this study, five mono and bimetallic xNi-(10-x)Co/SBA-15 catalysts (x = 10, 8, 5, 2 and 0, with a total metallic content of 10 wt%) have been synthesized using a deposition-precipitation (DP) methodology. Catalytic performances on the steam reforming of ethanol reaction (SRE) have been determined and correlated with their physical and chemical state. A nickel content of 5% or higher yields catalytic systems with good activity, high selectivity to hydrogen and a low production of acetaldehyde (less than 5%). However, in the systems where the cobalt is the main component of the metallic phase (8–10%), the selectivity changes, mainly due to the production of an excess of acetaldehyde, which is also reflected in the larger H2/CO2 ratio. In agreement with previous findings, this important modification in the selectivity comes from the formation of a cobalt carbide phase, where only takes place in the cobalt enriched systems, and is inhibited with nickel content larger than 5%. The formation of this carbide phase seems to be responsible for the decrease of cobalt particle size during the SRE reaction. Even though this cobalt carbide phase is thermodynamically metastable against decomposition to metallic cobalt and graphite carbon, our results have shown that it only reacts and decomposes after a hydrogen treatment at 600 °C.",
        "openArchiveArticle": "false",
        "prism:coverDate": "2018-04-30",
        "openaccessUserLicense": null,
        "prism:aggregationType": "Journal",
        "prism:url": "https://api.elsevier.com/content/article/pii/S246882311830066X",
        "dc:creator": [
          {
            "@_fa": "true",
            "$": "Rodriguez-Gomez, Alberto"
          },
          {
            "@_fa": "true",
            "$": "Caballero, Alfonso"
          }
        ],
        "link": [
          {
            "@_fa": "true",
            "@rel": "self",
            "@href": "https://api.elsevier.com/content/article/pii/S246882311830066X"
          },
          {
            "@_fa": "true",
            "@rel": "scidir",
            "@href": "https://www.sciencedirect.com/science/article/pii/S246882311830066X"
          }
        ],
        "dc:format": "application/json",
        "openaccessType": null,
        "pii": "S2468-8231(18)30066-X",
        "prism:volume": "449",
        "prism:publisher": "Elsevier B.V.",
        "dc:title": "Bimetallic Ni-Co/SBA-15 catalysts for reforming of ethanol: How cobalt modifies the nickel metal phase and product distribution",
        "prism:copyright": "© 2018 Elsevier B.V. All rights reserved.",
        "openaccess": "0",
        "prism:issn": "24688231",
        "dcterms:subject": [
          {
            "@_fa": "true",
            "$": "Nickel cobalt catalysts"
          },
          {
            "@_fa": "true",
            "$": "In situ XPS"
          },
          {
            "@_fa": "true",
            "$": "Hydrogen production"
          },
          {
            "@_fa": "true",
            "$": "Cobalt carbide"
          },
          {
            "@_fa": "true",
            "$": "Ethanol steam reforming"
          },
          {
            "@_fa": "true",
            "$": "Acetaldehyde"
          }
        ],
        "openaccessArticle": "false",
        "prism:publicationName": "Molecular Catalysis",
        "openaccessSponsorType": null,
        "prism:pageRange": "122-130",
        "prism:endingPage": "130",
        "pubType": "fla",
        "prism:coverDisplayDate": "April 2018",
        "prism:doi": "10.1016/j.mcat.2018.02.011",
        "prism:startingPage": "122",
        "dc:identifier": "doi:10.1016/j.mcat.2018.02.011",
        "openaccessSponsorName": null
      },
      "objects": {
        "object": [
          {
            "@category": "thumbnail",
            "@height": "154",
            "@width": "219",
            "@_fa": "true",
            "$": "https://api.elsevier.com/content/object/eid/1-s2.0-S246882311830066X-fx1.sml?httpAccept=%2A%2F%2A",
            "@multimediatype": "GIF image file",
            "@type": "IMAGE-THUMBNAIL",
            "@size": "25673",
            "@ref": "fx1",
            "@mimetype": "image/gif"
          },
          {
            "@category": "thumbnail",
            "@height": "143",
            "@width": "219",
            "@_fa": "true",
            "$": "https://api.elsevier.com/content/object/eid/1-s2.0-S246882311830066X-gr1.sml?httpAccept=%2A%2F%2A",
            "@multimediatype": "GIF image file",
            "@type": "IMAGE-THUMBNAIL",
            "@size": "21701",
            "@ref": "gr1",
            "@mimetype": "image/gif"
          },
          {
            "@category": "thumbnail",
            "@height": "164",
            "@width": "207",
            "@_fa": "true",
            "$": "https://api.elsevier.com/content/object/eid/1-s2.0-S246882311830066X-gr10.sml?httpAccept=%2A%2F%2A",
            "@multimediatype": "GIF image file",
            "@type": "IMAGE-THUMBNAIL",
            "@size": "8346",
            "@ref": "gr10",
            "@mimetype": "image/gif"
          },
          {
            "@category": "thumbnail",
            "@height": "159",
            "@width": "219",
            "@_fa": "true",
            "$": "https://api.elsevier.com/content/object/eid/1-s2.0-S246882311830066X-gr11.sml?httpAccept=%2A%2F%2A",
            "@multimediatype": "GIF image file",
            "@type": "IMAGE-THUMBNAIL",
            "@size": "8291",
            "@ref": "gr11",
            "@mimetype": "image/gif"
          },
          {
            "@category": "thumbnail",
            "@height": "127",
            "@width": "219",
            "@_fa": "true",
            "$": "https://api.elsevier.com/content/object/eid/1-s2.0-S246882311830066X-gr12.sml?httpAccept=%2A%2F%2A",
            "@multimediatype": "GIF image file",
            "@type": "IMAGE-THUMBNAIL",
            "@size": "8091",
            "@ref": "gr12",
            "@mimetype": "image/gif"
          },
          {
            "@category": "thumbnail",
            "@height": "158",
            "@width": "219",
            "@_fa": "true",
            "$": "https://api.elsevier.com/content/object/eid/1-s2.0-S246882311830066X-gr13.sml?httpAccept=%2A%2F%2A",
            "@multimediatype": "GIF image file",
            "@type": "IMAGE-THUMBNAIL",
            "@size": "7427",
            "@ref": "gr13",
            "@mimetype": "image/gif"
          },
          {
            "@category": "thumbnail",
            "@height": "128",
            "@width": "219",
            "@_fa": "true",
            "$": "https://api.elsevier.com/content/object/eid/1-s2.0-S246882311830066X-gr2.sml?httpAccept=%2A%2F%2A",
            "@multimediatype": "GIF image file",
            "@type": "IMAGE-THUMBNAIL",
            "@size": "9826",
            "@ref": "gr2",
            "@mimetype": "image/gif"
          },
          {
            "@category": "thumbnail",
            "@height": "164",
            "@width": "202",
            "@_fa": "true",
            "$": "https://api.elsevier.com/content/object/eid/1-s2.0-S246882311830066X-gr3.sml?httpAccept=%2A%2F%2A",
            "@multimediatype": "GIF image file",
            "@type": "IMAGE-THUMBNAIL",
            "@size": "7535",
            "@ref": "gr3",
            "@mimetype": "image/gif"
          },
          {
            "@category": "thumbnail",
            "@height": "143",
            "@width": "219",
            "@_fa": "true",
            "$": "https://api.elsevier.com/content/object/eid/1-s2.0-S246882311830066X-gr4.sml?httpAccept=%2A%2F%2A",
            "@multimediatype": "GIF image file",
            "@type": "IMAGE-THUMBNAIL",
            "@size": "20939",
            "@ref": "gr4",
            "@mimetype": "image/gif"
          },
          {
            "@category": "thumbnail",
            "@height": "107",
            "@width": "219",
            "@_fa": "true",
            "$": "https://api.elsevier.com/content/object/eid/1-s2.0-S246882311830066X-gr5.sml?httpAccept=%2A%2F%2A",
            "@multimediatype": "GIF image file",
            "@type": "IMAGE-THUMBNAIL",
            "@size": "4922",
            "@ref": "gr5",
            "@mimetype": "image/gif"
          },
          {
            "@category": "thumbnail",
            "@height": "88",
            "@width": "219",
            "@_fa": "true",
            "$": "https://api.elsevier.com/content/object/eid/1-s2.0-S246882311830066X-gr6.sml?httpAccept=%2A%2F%2A",
            "@multimediatype": "GIF image file",
            "@type": "IMAGE-THUMBNAIL",
            "@size": "5280",
            "@ref": "gr6",
            "@mimetype": "image/gif"
          },
          {
            "@category": "thumbnail",
            "@height": "162",
            "@width": "219",
            "@_fa": "true",
            "$": "https://api.elsevier.com/content/object/eid/1-s2.0-S246882311830066X-gr7.sml?httpAccept=%2A%2F%2A",
            "@multimediatype": "GIF image file",
            "@type": "IMAGE-THUMBNAIL",
            "@size": "7262",
            "@ref": "gr7",
            "@mimetype": "image/gif"
          },
          {
            "@category": "thumbnail",
            "@height": "143",
            "@width": "219",
            "@_fa": "true",
            "$": "https://api.elsevier.com/content/object/eid/1-s2.0-S246882311830066X-gr8.sml?httpAccept=%2A%2F%2A",
            "@multimediatype": "GIF image file",
            "@type": "IMAGE-THUMBNAIL",
            "@size": "20261",
            "@ref": "gr8",
            "@mimetype": "image/gif"
          },
          {
            "@category": "thumbnail",
            "@height": "159",
            "@width": "219",
            "@_fa": "true",
            "$": "https://api.elsevier.com/content/object/eid/1-s2.0-S246882311830066X-gr9.sml?httpAccept=%2A%2F%2A",
            "@multimediatype": "GIF image file",
            "@type": "IMAGE-THUMBNAIL",
            "@size": "8651",
            "@ref": "gr9",
            "@mimetype": "image/gif"
          },
          {
            "@category": "standard",
            "@height": "200",
            "@width": "285",
            "@_fa": "true",
            "$": "https://api.elsevier.com/content/object/eid/1-s2.0-S246882311830066X-fx1.jpg?httpAccept=%2A%2F%2A",
            "@multimediatype": "JPEG image file",
            "@type": "IMAGE-DOWNSAMPLED",
            "@size": "14859",
            "@ref": "fx1",
            "@mimetype": "image/jpeg"
          },
          {
            "@category": "standard",
            "@height": "442",
            "@width": "678",
            "@_fa": "true",
            "$": "https://api.elsevier.com/content/object/eid/1-s2.0-S246882311830066X-gr1.jpg?httpAccept=%2A%2F%2A",
            "@multimediatype": "JPEG image file",
            "@type": "IMAGE-DOWNSAMPLED",
            "@size": "121319",
            "@ref": "gr1",
            "@mimetype": "image/jpeg"
          },
          {
            "@category": "standard",
            "@height": "242",
            "@width": "305",
            "@_fa": "true",
            "$": "https://api.elsevier.com/content/object/eid/1-s2.0-S246882311830066X-gr10.jpg?httpAccept=%2A%2F%2A",
            "@multimediatype": "JPEG image file",
            "@type": "IMAGE-DOWNSAMPLED",
            "@size": "23157",
            "@ref": "gr10",
            "@mimetype": "image/jpeg"
          },
          {
            "@category": "standard",
            "@height": "410",
            "@width": "565",
            "@_fa": "true",
            "$": "https://api.elsevier.com/content/object/eid/1-s2.0-S246882311830066X-gr11.jpg?httpAccept=%2A%2F%2A",
            "@multimediatype": "JPEG image file",
            "@type": "IMAGE-DOWNSAMPLED",
            "@size": "51483",
            "@ref": "gr11",
            "@mimetype": "image/jpeg"
          },
          {
            "@category": "standard",
            "@height": "395",
            "@width": "678",
            "@_fa": "true",
            "$": "https://api.elsevier.com/content/object/eid/1-s2.0-S246882311830066X-gr12.jpg?httpAccept=%2A%2F%2A",
            "@multimediatype": "JPEG image file",
            "@type": "IMAGE-DOWNSAMPLED",
            "@size": "67086",
            "@ref": "gr12",
            "@mimetype": "image/jpeg"
          },
          {
            "@category": "standard",
            "@height": "221",
            "@width": "305",
            "@_fa": "true",
            "$": "https://api.elsevier.com/content/object/eid/1-s2.0-S246882311830066X-gr13.jpg?httpAccept=%2A%2F%2A",
            "@multimediatype": "JPEG image file",
            "@type": "IMAGE-DOWNSAMPLED",
            "@size": "19844",
            "@ref": "gr13",
            "@mimetype": "image/jpeg"
          },
          {
            "@category": "standard",
            "@height": "331",
            "@width": "567",
            "@_fa": "true",
            "$": "https://api.elsevier.com/content/object/eid/1-s2.0-S246882311830066X-gr2.jpg?httpAccept=%2A%2F%2A",
            "@multimediatype": "JPEG image file",
            "@type": "IMAGE-DOWNSAMPLED",
            "@size": "56600",
            "@ref": "gr2",
            "@mimetype": "image/jpeg"
          },
          {
            "@category": "standard",
            "@height": "244",
            "@width": "301",
            "@_fa": "true",
            "$": "https://api.elsevier.com/content/object/eid/1-s2.0-S246882311830066X-gr3.jpg?httpAccept=%2A%2F%2A",
            "@multimediatype": "JPEG image file",
            "@type": "IMAGE-DOWNSAMPLED",
            "@size": "21073",
            "@ref": "gr3",
            "@mimetype": "image/jpeg"
          },
          {
            "@category": "standard",
            "@height": "442",
            "@width": "678",
            "@_fa": "true",
            "$": "https://api.elsevier.com/content/object/eid/1-s2.0-S246882311830066X-gr4.jpg?httpAccept=%2A%2F%2A",
            "@multimediatype": "JPEG image file",
            "@type": "IMAGE-DOWNSAMPLED",
            "@size": "117409",
            "@ref": "gr4",
            "@mimetype": "image/jpeg"
          },
          {
            "@category": "standard",
            "@height": "331",
            "@width": "678",
            "@_fa": "true",
            "$": "https://api.elsevier.com/content/object/eid/1-s2.0-S246882311830066X-gr5.jpg?httpAccept=%2A%2F%2A",
            "@multimediatype": "JPEG image file",
            "@type": "IMAGE-DOWNSAMPLED",
            "@size": "39732",
            "@ref": "gr5",
            "@mimetype": "image/jpeg"
          },
          {
            "@category": "standard",
            "@height": "228",
            "@width": "565",
            "@_fa": "true",
            "$": "https://api.elsevier.com/content/object/eid/1-s2.0-S246882311830066X-gr6.jpg?httpAccept=%2A%2F%2A",
            "@multimediatype": "JPEG image file",
            "@type": "IMAGE-DOWNSAMPLED",
            "@size": "33772",
            "@ref": "gr6",
            "@mimetype": "image/jpeg"
          },
          {
            "@category": "standard",
            "@height": "224",
            "@width": "303",
            "@_fa": "true",
            "$": "https://api.elsevier.com/content/object/eid/1-s2.0-S246882311830066X-gr7.jpg?httpAccept=%2A%2F%2A",
            "@multimediatype": "JPEG image file",
            "@type": "IMAGE-DOWNSAMPLED",
            "@size": "18455",
            "@ref": "gr7",
            "@mimetype": "image/jpeg"
          },
          {
            "@category": "standard",
            "@height": "442",
            "@width": "678",
            "@_fa": "true",
            "$": "https://api.elsevier.com/content/object/eid/1-s2.0-S246882311830066X-gr8.jpg?httpAccept=%2A%2F%2A",
            "@multimediatype": "JPEG image file",
            "@type": "IMAGE-DOWNSAMPLED",
            "@size": "111640",
            "@ref": "gr8",
            "@mimetype": "image/jpeg"
          },
          {
            "@category": "standard",
            "@height": "220",
            "@width": "303",
            "@_fa": "true",
            "$": "https://api.elsevier.com/content/object/eid/1-s2.0-S246882311830066X-gr9.jpg?httpAccept=%2A%2F%2A",
            "@multimediatype": "JPEG image file",
            "@type": "IMAGE-DOWNSAMPLED",
            "@size": "20464",
            "@ref": "gr9",
            "@mimetype": "image/jpeg"
          },
          {
            "@category": "thumbnail",
            "@height": "25",
            "@width": "765",
            "@_fa": "true",
            "$": "https://api.elsevier.com/content/object/eid/1-s2.0-S246882311830066X-si1.gif?httpAccept=%2A%2F%2A",
            "@multimediatype": "GIF image file",
            "@type": "ALTIMG",
            "@size": "2600",
            "@ref": "si1",
            "@mimetype": "image/gif"
          },
          {
            "@category": "thumbnail",
            "@height": "25",
            "@width": "738",
            "@_fa": "true",
            "$": "https://api.elsevier.com/content/object/eid/1-s2.0-S246882311830066X-si2.gif?httpAccept=%2A%2F%2A",
            "@multimediatype": "GIF image file",
            "@type": "ALTIMG",
            "@size": "2509",
            "@ref": "si2",
            "@mimetype": "image/gif"
          },
          {
            "@category": "thumbnail",
            "@height": "34",
            "@width": "171",
            "@_fa": "true",
            "$": "https://api.elsevier.com/content/object/eid/1-s2.0-S246882311830066X-si3.gif?httpAccept=%2A%2F%2A",
            "@multimediatype": "GIF image file",
            "@type": "ALTIMG",
            "@size": "1050",
            "@ref": "si3",
            "@mimetype": "image/gif"
          }
        ]
      },
      "link": {
        "@rel": "abstract",
        "@href": "https://api.elsevier.com/content/abstract/scopus_id/85045885410"
      }
    }
  }
}