{
  "metadata": {
    "title": "Theoretical study on the synthesis of vinyl acetate from acetylene and acetic acid over nonmetallic catalysts with different carbon-nitrogen ratios",
    "authors": "; ; ",
    "journal": "Molecular Catalysis",
    "date": "2022-05-31",
    "doi": "10.1016/j.mcat.2022.112299",
    "abstract": "",
    "uri": "https://api.elsevier.com/content/article/pii/S2468823122001857",
    "pii": "S2468823122001857"
  },
  "fulltext": {
    "full-text-retrieval-response": {
      "scopus-eid": "2-s2.0-85128676341",
      "originalText": "serial JL 315758 291210 291744 291790 291809 31 Molecular Catalysis MOLECULARCATALYSIS 2022-04-20 2022-04-20 2022-04-20 2022-04-20 2022-09-21T04:21:23 1-s2.0-S2468823122001857 S2468-8231(22)00185-7 S2468823122001857 10.1016/j.mcat.2022.112299 S300 S300.1 FULL-TEXT 1-s2.0-S2468823122X00072 2024-06-26T17:47:42.367221Z 0 0 20220501 20220531 2022 2022-04-20T21:22:04.295316Z absattachment articleinfo articlenumber articletitlenorm authfirstinitialnorm authfirstsurnamenorm cid cids contenttype copyright crossmark dateloaded dateloadedtxt datesearch datesort dateupdated dco docsubtype doctype doi eid ewtransactionid hubeid indexeddate issn issnnorm itemstage itemtransactionid itemweight openaccess openarchive pg pgfirst pii piinorm pubdateend pubdatestart pubdatetxt pubyr sectiontitle sortorder srctitle srctitlenorm srctype ssids alllist content subj subheadings suppl tomb volfirst volissue volumelist webpdf webpdfpagecount yearnav figure table e-component body mmlmath acknowledge affil appendices articletitle auth authfirstini authfull authkeywords authlast grantnumber grantsponsor highlightsabst primabst ref specialabst 2468-8231 24688231 true 524 524 C Volume 524 31 112299 112299 112299 202205 May 2022 2022-05-01 2022-05-31 2022 Regular Papers article fla © 2022 Elsevier B.V. All rights reserved. THEORETICALSTUDYSYNTHESISVINYLACETATEACETYLENEACETICACIDOVERNONMETALLICCATALYSTSDIFFERENTCARBONNITROGENRATIOS ZHANG X 1 Introduction 2 Computational methods 3 Results and discussion 3.1 Geometries of the reactants 3.2 Adsorption of C2H2 and CH3COOH over catalysts 3.3 Reaction mechanism of acetylene acetate reaction catalyzed by C2N, C3N, C4N, and C5N 3.3.1 Reaction mechanism over C2N 3.3.2 Reaction mechanism over C3N 3.3.3 Reaction mechanism over C4N 3.3.4 Reaction mechanism over C5N 3.3.5 Comparison of acetylene acetate reaction over CN catalysts 4 Conclusion CRediT authorship contribution statement Acknowledgements Appendix Supplementary materials Reference ZHA 2021 1841 1857 Z PLATA 2009 11758 11762 J HARTLEY 1959 397 417 F SHIRAISHI 1970 135 140 M YAN 2010 838 842 F FLEMING 2011 277 288 R GRUBER 2014 B PROCEEDINGSADHESIVESEALANTCONVENTIONSPRINGCONFERENCEEXPOSITION VINYLACETATEETHYLENEVAECOPOLYMERDISPERSIONSANATURALGASDERIVEDTECHNOLOGYFORCAULKSSEALANTSPPT HONG 2009 E PROCEEDINGSIAEEINTERNATIONALCONFERENCE MISCIBLILITYPHYSICALPROPERTIESPOLYLACTICACIDPLAPOLYVINYLACETATEPVACBLENDS KOLL 2011 23 26 B 2014 79 YAN 2010 796 801 F KAWAGUCHI 1988 113 127 T GARCIAMOTA 2008 14406 14407 M CARANTON 2018 5256 5269 A POLADURA 2013 2810 2813 B BAEI 2013 1007 1013 M LIU 2018 20131 20136 W WANG 2014 2339 2344 X NOVOSELOV 2004 666 669 K CHERNYAK 2020 193 202 S KONG 2017 144 150 D BA 2014 49 52 E AYKUT 2019 8204 8216 C YU 2017 087301 S ZHONG 2018 11105 11112 W HUANG 2018 137104 W SADEGHZADEH 2018 257 265 S SADEGHZADEH 2020 107555 S DING 2001 5170 5179 Y LI 2017 285 290 L LI 2020 243 247 Y HU 2011 126101 Q WU 2018 385402 Q WANG 2014 2339 2344 X XUAN 2021 80 87 T ZHAO 2019 240 249 J PETERSSON 1991 6081 6090 G VOSKO 1980 1200 1211 S RHODES 1999 166 202 C GONZALEZ 1989 2154 2161 C LU 2021 113249 T SCHLEGEL 1994 1569 1574 H STACHO 1999 328 334 L MURDOCH 1981 32 36 J LI 2017 1603685 B PU 2017 2669 2674 C LU 2012 580 592 T FUKUI 1952 722 725 K RUIZMORALES 2012 11283 11308 Y PUTZ 2012 M APPLICATIONSDENSITYFUNCTIONALTHEORYCHEMICALREACTIVITYJ HUMPHREY 1996 33 38 W JIANG 1996 356 362 G PRASAD 1981 338 346 K ZHANG 2010 2569 2576 Z DONG 2018 7363 7373 X MORROW 1984 328 332 B MIYAZAWA 1958 44 46 S HU 2020 1155 1162 L WU 2017 X ZHANGX2022X112299 ZHANGX2022X112299XX 2024-04-20T00:00:00.000Z 2024-04-20T00:00:00.000Z http://creativecommons.org/licenses/by-nc-nd/4.0/ © 2022 Elsevier B.V. All rights reserved. 2022-04-27T21:31:24.972Z http://vtw.elsevier.com/data/voc/AddOnTypes/50.7/aggregated-refined Taishan Scholars Program of Shandong Province tsqn202103051 Taishan Scholar Project of Shandong Province http://data.elsevier.com/vocabulary/SciValFunders/501100010040 http://sws.geonames.org/1814991/ This work was supported by the Taishan Scholars Program of Shandong Province ( tsqn202103051 ). 0 https://doi.org/10.15223/policy-017 https://doi.org/10.15223/policy-037 https://doi.org/10.15223/policy-012 https://doi.org/10.15223/policy-029 https://doi.org/10.15223/policy-004 item S2468-8231(22)00185-7 S2468823122001857 1-s2.0-S2468823122001857 10.1016/j.mcat.2022.112299 315758 2022-09-21T04:09:31.530386Z 2022-05-01 2022-05-31 1-s2.0-S2468823122001857-main.pdf https://s3-eu-west-1.amazonaws.com/prod-ucs-content-store-eu-west/content/pii:S2468823122001857/MAIN/application/pdf/b5327285bc349ad833114e1ef6eaa85e/main.pdf main.pdf pdf true 7397019 MAIN 10 1-s2.0-S2468823122001857-main_1.png https://s3-eu-west-1.amazonaws.com/prod-ucs-content-store-eu-west/content/pii:S2468823122001857/PREVIEW/image/png/da504c048e311c2c41da894b88fcb954/main_1.png main_1.png png 58468 849 656 IMAGE-WEB-PDF 1 1-s2.0-S2468823122001857-gr7.jpg https://s3-eu-west-1.amazonaws.com/prod-ucs-content-store-eu-west/content/pii:S2468823122001857/gr7/DOWNSAMPLED/image/jpeg/7d6158252351f7369b89a8a1344692ee/gr7.jpg gr7 gr7.jpg jpg 61545 312 393 IMAGE-DOWNSAMPLED 1-s2.0-S2468823122001857-gr8.jpg https://s3-eu-west-1.amazonaws.com/prod-ucs-content-store-eu-west/content/pii:S2468823122001857/gr8/DOWNSAMPLED/image/jpeg/8b5cce21628e94ea62a55a8d4524abe9/gr8.jpg gr8 gr8.jpg jpg 59511 308 393 IMAGE-DOWNSAMPLED 1-s2.0-S2468823122001857-gr5.jpg https://s3-eu-west-1.amazonaws.com/prod-ucs-content-store-eu-west/content/pii:S2468823122001857/gr5/DOWNSAMPLED/image/jpeg/fc8b04dc5d47dbe15bec56ca9f054f6c/gr5.jpg gr5 gr5.jpg jpg 58205 318 809 IMAGE-DOWNSAMPLED 1-s2.0-S2468823122001857-gr6.jpg https://s3-eu-west-1.amazonaws.com/prod-ucs-content-store-eu-west/content/pii:S2468823122001857/gr6/DOWNSAMPLED/image/jpeg/418eef22381464e0132c64b4ca7d0206/gr6.jpg gr6 gr6.jpg jpg 91715 508 809 IMAGE-DOWNSAMPLED 1-s2.0-S2468823122001857-gr3.jpg https://s3-eu-west-1.amazonaws.com/prod-ucs-content-store-eu-west/content/pii:S2468823122001857/gr3/DOWNSAMPLED/image/jpeg/cc0f6e2973801bfd3a396eb488d10948/gr3.jpg gr3 gr3.jpg jpg 72552 305 393 IMAGE-DOWNSAMPLED 1-s2.0-S2468823122001857-gr4.jpg https://s3-eu-west-1.amazonaws.com/prod-ucs-content-store-eu-west/content/pii:S2468823122001857/gr4/DOWNSAMPLED/image/jpeg/5ca429f126597cfddf0b3bede0378c8a/gr4.jpg gr4 gr4.jpg jpg 69117 359 565 IMAGE-DOWNSAMPLED 1-s2.0-S2468823122001857-gr1.jpg https://s3-eu-west-1.amazonaws.com/prod-ucs-content-store-eu-west/content/pii:S2468823122001857/gr1/DOWNSAMPLED/image/jpeg/d00b3cd79e46e0d905bb7ce0ab1a786b/gr1.jpg gr1 gr1.jpg jpg 41152 284 393 IMAGE-DOWNSAMPLED 1-s2.0-S2468823122001857-gr2.jpg https://s3-eu-west-1.amazonaws.com/prod-ucs-content-store-eu-west/content/pii:S2468823122001857/gr2/DOWNSAMPLED/image/jpeg/8ac798a9e846124dfbe8944099073597/gr2.jpg gr2 gr2.jpg jpg 170829 870 809 IMAGE-DOWNSAMPLED 1-s2.0-S2468823122001857-ga1.jpg https://s3-eu-west-1.amazonaws.com/prod-ucs-content-store-eu-west/content/pii:S2468823122001857/ga1/DOWNSAMPLED/image/jpeg/5546d02ef907d5223c8c1faca94a8adb/ga1.jpg ga1 true ga1.jpg jpg 28533 178 301 IMAGE-DOWNSAMPLED 1-s2.0-S2468823122001857-gr7.sml https://s3-eu-west-1.amazonaws.com/prod-ucs-content-store-eu-west/content/pii:S2468823122001857/gr7/THUMBNAIL/image/gif/213997d48c0e509b5fb4e8dce45b49fa/gr7.sml gr7 gr7.sml sml 15673 164 206 IMAGE-THUMBNAIL 1-s2.0-S2468823122001857-gr8.sml https://s3-eu-west-1.amazonaws.com/prod-ucs-content-store-eu-west/content/pii:S2468823122001857/gr8/THUMBNAIL/image/gif/c53777a7a72273d1d1e26b1b6dcafcb3/gr8.sml gr8 gr8.sml sml 14996 164 209 IMAGE-THUMBNAIL 1-s2.0-S2468823122001857-gr5.sml https://s3-eu-west-1.amazonaws.com/prod-ucs-content-store-eu-west/content/pii:S2468823122001857/gr5/THUMBNAIL/image/gif/53a681a83b95f0b535e815488e4d2c0c/gr5.sml gr5 gr5.sml sml 7433 86 219 IMAGE-THUMBNAIL 1-s2.0-S2468823122001857-gr6.sml https://s3-eu-west-1.amazonaws.com/prod-ucs-content-store-eu-west/content/pii:S2468823122001857/gr6/THUMBNAIL/image/gif/65fbd36d82bd5650b2e2980028ba7ee4/gr6.sml gr6 gr6.sml sml 11802 138 219 IMAGE-THUMBNAIL 1-s2.0-S2468823122001857-gr3.sml https://s3-eu-west-1.amazonaws.com/prod-ucs-content-store-eu-west/content/pii:S2468823122001857/gr3/THUMBNAIL/image/gif/50b7c4e1f8e44d960181be51cbd5a34f/gr3.sml gr3 gr3.sml sml 21708 164 211 IMAGE-THUMBNAIL 1-s2.0-S2468823122001857-gr4.sml https://s3-eu-west-1.amazonaws.com/prod-ucs-content-store-eu-west/content/pii:S2468823122001857/gr4/THUMBNAIL/image/gif/ee19bccb0411955198542220994da57c/gr4.sml gr4 gr4.sml sml 12673 139 219 IMAGE-THUMBNAIL 1-s2.0-S2468823122001857-gr1.sml https://s3-eu-west-1.amazonaws.com/prod-ucs-content-store-eu-west/content/pii:S2468823122001857/gr1/THUMBNAIL/image/gif/25f0b25afc8ce42d772f3c80e10e88b2/gr1.sml gr1 gr1.sml sml 13579 158 219 IMAGE-THUMBNAIL 1-s2.0-S2468823122001857-gr2.sml https://s3-eu-west-1.amazonaws.com/prod-ucs-content-store-eu-west/content/pii:S2468823122001857/gr2/THUMBNAIL/image/gif/6fcea5ce6b56c8a679a9e16d9d5defe2/gr2.sml gr2 gr2.sml sml 11480 163 152 IMAGE-THUMBNAIL 1-s2.0-S2468823122001857-ga1.sml https://s3-eu-west-1.amazonaws.com/prod-ucs-content-store-eu-west/content/pii:S2468823122001857/ga1/THUMBNAIL/image/gif/a7e16d0092de79628de2f6342e0f9fce/ga1.sml ga1 true ga1.sml sml 12485 129 219 IMAGE-THUMBNAIL 1-s2.0-S2468823122001857-gr7_lrg.jpg https://s3-eu-west-1.amazonaws.com/prod-ucs-content-store-eu-west/content/pii:S2468823122001857/gr7/HIGHRES/image/jpeg/4b265a9f412539a4a419d1f2abb4aecf/gr7_lrg.jpg gr7 gr7_lrg.jpg jpg 761289 1384 1742 IMAGE-HIGH-RES 1-s2.0-S2468823122001857-gr8_lrg.jpg https://s3-eu-west-1.amazonaws.com/prod-ucs-content-store-eu-west/content/pii:S2468823122001857/gr8/HIGHRES/image/jpeg/07834258e3184013872b38196603049e/gr8_lrg.jpg gr8 gr8_lrg.jpg jpg 524834 1366 1742 IMAGE-HIGH-RES 1-s2.0-S2468823122001857-gr5_lrg.jpg https://s3-eu-west-1.amazonaws.com/prod-ucs-content-store-eu-west/content/pii:S2468823122001857/gr5/HIGHRES/image/jpeg/c36dc5e58d22dd2d8e824403d0a12dbf/gr5_lrg.jpg gr5 gr5_lrg.jpg jpg 516394 1410 3583 IMAGE-HIGH-RES 1-s2.0-S2468823122001857-gr6_lrg.jpg https://s3-eu-west-1.amazonaws.com/prod-ucs-content-store-eu-west/content/pii:S2468823122001857/gr6/HIGHRES/image/jpeg/519f67b294e80fd14f0be8f93758302a/gr6_lrg.jpg gr6 gr6_lrg.jpg jpg 839386 2252 3583 IMAGE-HIGH-RES 1-s2.0-S2468823122001857-gr3_lrg.jpg https://s3-eu-west-1.amazonaws.com/prod-ucs-content-store-eu-west/content/pii:S2468823122001857/gr3/HIGHRES/image/jpeg/0a24ed034bec120166bc570d95e3c127/gr3_lrg.jpg gr3 gr3_lrg.jpg jpg 1117134 1353 1742 IMAGE-HIGH-RES 1-s2.0-S2468823122001857-gr4_lrg.jpg https://s3-eu-west-1.amazonaws.com/prod-ucs-content-store-eu-west/content/pii:S2468823122001857/gr4/HIGHRES/image/jpeg/10ba32f3168ae7abe2d077f0ef1e7e1d/gr4_lrg.jpg gr4 gr4_lrg.jpg jpg 569112 1588 2500 IMAGE-HIGH-RES 1-s2.0-S2468823122001857-gr1_lrg.jpg https://s3-eu-west-1.amazonaws.com/prod-ucs-content-store-eu-west/content/pii:S2468823122001857/gr1/HIGHRES/image/jpeg/60855dbaede26ebbb55831ff6b1ea4d5/gr1_lrg.jpg gr1 gr1_lrg.jpg jpg 337917 1260 1742 IMAGE-HIGH-RES 1-s2.0-S2468823122001857-gr2_lrg.jpg https://s3-eu-west-1.amazonaws.com/prod-ucs-content-store-eu-west/content/pii:S2468823122001857/gr2/HIGHRES/image/jpeg/83383abd682321dd571c176ab5ea6110/gr2_lrg.jpg gr2 gr2_lrg.jpg jpg 2696390 3852 3583 IMAGE-HIGH-RES 1-s2.0-S2468823122001857-ga1_lrg.jpg https://s3-eu-west-1.amazonaws.com/prod-ucs-content-store-eu-west/content/pii:S2468823122001857/ga1/HIGHRES/image/jpeg/54a5aa39024942234d8ed6a1f2a7d12a/ga1_lrg.jpg ga1 true ga1_lrg.jpg jpg 186292 787 1333 IMAGE-HIGH-RES 1-s2.0-S2468823122001857-mmc1.docx https://s3-eu-west-1.amazonaws.com/prod-ucs-content-store-eu-west/content/pii:S2468823122001857/mmc1/MAIN/application/vnd.openxmlformats-officedocument.wordprocessingml.document/b235a70314b5b2ebd32ac04ce39e0a9a/mmc1.docx mmc1 mmc1.docx docx 4673672 APPLICATION 1-s2.0-S2468823122001857-si1.svg https://s3-eu-west-1.amazonaws.com/prod-ucs-content-store-eu-west/content/pii:S2468823122001857/STRIPIN/image/svg+xml/068eafd81ff039be5267ca59b3180dcb/si1.svg si1 si1.svg svg 17586 ALTIMG 1-s2.0-S2468823122001857-si2.svg https://s3-eu-west-1.amazonaws.com/prod-ucs-content-store-eu-west/content/pii:S2468823122001857/STRIPIN/image/svg+xml/e39670419b0431d460c26a318b90c669/si2.svg si2 si2.svg svg 12184 ALTIMG 1-s2.0-S2468823122001857-si3.svg https://s3-eu-west-1.amazonaws.com/prod-ucs-content-store-eu-west/content/pii:S2468823122001857/STRIPIN/image/svg+xml/f1b67e54b9c8b75f75ea60908b49160a/si3.svg si3 si3.svg svg 5296 ALTIMG 1-s2.0-S2468823122001857-si4.svg https://s3-eu-west-1.amazonaws.com/prod-ucs-content-store-eu-west/content/pii:S2468823122001857/STRIPIN/image/svg+xml/15e630473be9407d1cae99fb53e5eafa/si4.svg si4 si4.svg svg 13525 ALTIMG 1-s2.0-S2468823122001857-si5.svg https://s3-eu-west-1.amazonaws.com/prod-ucs-content-store-eu-west/content/pii:S2468823122001857/STRIPIN/image/svg+xml/9127e32d938d14bb3ec3c886b15615e5/si5.svg si5 si5.svg svg 14275 ALTIMG 1-s2.0-S2468823122001857-si6.svg https://s3-eu-west-1.amazonaws.com/prod-ucs-content-store-eu-west/content/pii:S2468823122001857/STRIPIN/image/svg+xml/b604b3db22aa0132b29e531f34cf7bd9/si6.svg si6 si6.svg svg 1128 ALTIMG 1-s2.0-S2468823122001857-am.pdf https://s3-eu-west-1.amazonaws.com/prod-ucs-content-store-eu-west/content/egi:10L8BH46455/MAIN/application/pdf/ce79a76d5b03bd1d8c096a5459282196/am.pdf am am.pdf pdf false 3585055 AAM-PDF MCAT 112299 112299 S2468-8231(22)00185-7 10.1016/j.mcat.2022.112299 Fig. 1 Optimized structures of C2H2, CH3COOH and C2N(a), C3N(b), C4N(c) and C5N(d) (Red for oxygen, blue for nitrogen, gray for carbon, and white for H). Fig 1 Fig. 2 TDOS and PDOS of C2N(a), C3N(b), C4N(c) and C5N(d) (The black line is the TDOS curve of CN catalyst, the red line is the PDOS curve of carbon atom, and the blue line is the PDOS curve of N atom), and bar diagrams(e) of HOMO, LUMO and HOMO-LUMO gap of four CN catalysts (The yellow column is HOMO, the green column is LUMO, and the purple column is HOMO-LUMO gap). Fig 2 Fig. 3 Cross sectional view of molecular surface electrostatic potential of C2N(a), C3N(b), C4N(c), and C5N(d) (electron density:0.0005 electrons/bohr3). Fig 3 Fig. 4 At 1 atm and 393.15 K, the dsorption configuration of acetylene on C2N(a), adsorption configuration of acetic acid on C2N(b), adsorption configuration of acetylene on C3N(c), adsorption configuration of acetic acid on C3N(d), adsorption configuration of acetylene on C4N(e), adsorption configuration of acetic acid on C4N(f), adsorption configuration of acetylene on C5N(g), adsorption configuration of acetic acid on C5N(h). Fig 4 Fig. 5 The fitting curve of adsorption capacity of CN catalyst for acetylene(a) and acetic acid(b) at 1 atm, 393.15–493.15 K (The black line is C2N, the red line is C3N, the green line is C4N, the blue line is C5N). Fig 5 Fig. 6 The co-adsorption structures of acetylene and acetic acid on C2N(a), C3N(b), C4N(c) and C5N(d) were optimized at 1 atm, 393.15 K, and the columnar energy diagrams(e) for the co-adsorption of acetylene and acetic acid by four CN catalysts at 1 atm, 393.15–493.15 K. Fig 6 Fig. 7 Reaction processes, energy changes and corresponding states of C2H2 and CH3COOH on C2N and C3N (black lines are reaction paths on C2N, red lines and blue lines are two reaction paths on C3N. In addition, Re for reactants, * for catalyst, blue arrow in the transition state structure for the vibration direction of the corresponding virtual frequency). Fig 7 Fig. 8 Reaction processes, energy changes and corresponding states of C2H2 and CH3COOH on C4N and C5N (black lines are reaction paths on C4N, red lines and blue lines are two reaction paths on C5N. In addition, Re for reactants, * for catalysts). Fig 8 Table 1 At 1 atm and 393.15 K, the free energy barrier of rate control step on C2N, C3N, C4N, and C5N. Table 1 Catalyst Energy barrier (kcal/mol) C2N 33.09 C3N-p1 44.54 C3N-p2 30.57 C4N 35.02 C5N-p1 34.60 C5N-p2 42.19 Theoretical study on the synthesis of vinyl acetate from acetylene and acetic acid over nonmetallic catalysts with different carbon-nitrogen ratios Xunchao Zhang Data curation Formal analysis Investigation Validation Writing – original draft a Junqing Li Formal analysis Investigation a Lihua Kang Conceptualization Project administration Supervision Investigation Writing – review & editing a b ⁎ Mingyuan Zhu Funding acquisition Writing – review & editing b ⁎ a School of Chemistry and Chemical Engineering of Shihezi University, Shihezi, Xinjiang 832000, China School of Chemistry and Chemical Engineering of Shihezi University Shihezi Xinjiang 832000 China aSchool of Chemistry and Chemical Engineering of Shihezi University, Shihezi, Xinjiang 832000, China b College of Chemistry & Chemical Engineering Yantai University Yantai, Shandong 264005, China College of Chemistry & Chemical Engineering Yantai University Yantai Shandong 264005 China bCollege of Chemistry & Chemical Engineering Yantai University Yantai, Shandong 264005, China ⁎ Corresponding authors at: School of Chemistry and Chemical Engineering of Shihezi University, Shihezi, Xinjiang 832000, China. School of Chemistry and Chemical Engineering of Shihezi University Shihezi Xinjiang 832000 China At present, the acetylene acetic acid reaction catalysts studied are metal catalysts. Whether there are non-metallic materials that can catalyze the reaction is very worth exploring. In this study, we used density functional theory (DFT) to calculate the feasibility of preparing vinyl acetate (VAc) on four CN non-metallic materials (C2N, C3N, C4N and C5N) under the reaction conditions of 1 atm, 393.15–493.15 K at B3LYP/6-31G(d, p) level. It is found that after considering the reaction temperature, only C2N and C3N show good adsorption capacity for acetylene and acetic acid, and C3N has stronger adsorption capacity for reactants. After that, we calculated and simulated the reaction process of acetylene acetic acid reaction catalyzed by four CN materials. It is found that among the four CN materials, the energy barrier of the reaction rate control step of C3N is the lowest (the free energy barrier of the rate control step is only 30.57 kcal/mol at 393.15 K), and the interior of CN non-metallic materials has higher activity than the boundary of hydrogen sealing. We also found that the reaction process on CN non-metallic material is consistent with the acid catalysis mechanism, which shows that the non-metallic catalyst is theoretically feasible for catalyzing the acetic acid acidification of acetylene, and the two-dimensional C3N material is likely to be a potential non-metallic catalyst for the preparation of vinyl acetate by acetylene gas phase method. Graphical abstract Image, graphical abstract Keywords Acetylene Acetic acid Vinyl acetate Nonmetallic catalyst CN material 1 Introduction Vinyl acetate (VAc) is a colorless flammable liquid with a sweet ether odor. As a widely used organic chemical raw material, VAc is one of the 50 chemical raw materials with the largest production volume in the world [1–3]. Several important polymers, such as polyvinyl alcohol [4,5], polyacrylonitrile [6,7], ethylene–vinyl acetate copolymer resin [8], polyvinyl acetate emulsion and resin, [9] and copolymer resin [10], are based on VAc as a raw material. It is widely used in fiber synthesis, leather processing, coating, soil improvement, and other fields. As a widely used chemical raw material, VAc is produced by the acetylene or ethylene methods [11]. Compared with acetylene method, ethylene method has more mature application technology and better performance in industrial production. However, acetylene process is more competitive than ethylene process in China, India and other countries where coal resources are abundant but oil resources are scarce. At present, the production process of acetylene preparation of vinyl acetate mainly relies on zinc acetate catalyst [12,13]. But the traditional zinc acetate catalyst has some disadvantages such as rapid activity decline, low productivity and short catalyst life. Precious metal (Pb, Au, etc.) catalysts [3,14,15] have limited resources and high prices, so it is difficult to be applied in large-scale industry. Compared with metal catalysts, non-metallic catalysts have the characteristics of abundant reserves, simple preparation, environmental friendliness and high stability [16]. In addition, nonmetallic catalysts have been proved to have good catalytic activity in some fields of efficient utilization of acetylene [17–19]. Therefore, it is of great significance to investigate whether nonmetallic catalysts have catalytic activity for acetylene acetate reaction. Monolayer graphene has been the focus of scientific research since it was developed by Geim and Novoselov in 2004 [20]. Because of graphene's limited number of active sites, its nonmetallic catalytic activity and selectivity are not satisfactory. However, when examining the derivatives on the basis of graphene, it can be seen that they demonstrate impressive nonmetallic catalytic performance, which provides a direction for further research into the acetylation of acetylene over nonmetallic catalysts [21,22]. To compensate for the defects, heteroatom doping is a novel and efficient method, such as nitrogen (N), phosphorus (P), and boron (B) doping [23,24]. In recent years, CN catalysts have been extensively studied by researchers, and two dimensional CN materials have gradually become a research hotspot in the field of catalysis, including C2N, [25–27] C3N, [28–30] C4N, [31–33] C5N, [34,35] and other nonmetallic CN catalysts. Although there is no report on the reaction of acetylene and acetic acid catalyzed by CN materials, CN non-metallic catalysts have shown good catalytic effect in some areas of efficient utilization of acetylene [36–38]. This also provides corresponding support for further study on whether non-metallic CN materials have catalytic activity for the reaction of acetic acid and acetylene. Herein, based on the reaction conditions of acetylene gas phase method, the catalytic performance of different C/N ratios catalysts (C2N, C3N, C4N, C5N) at the temperature of 393.15–493.15 K was investigated under the pressure of 1 atm. Firstly, we constructed and optimized the initial structures of C2N, C3N, C4N and C5N catalysts, studied the adsorption and Co-adsorption process of acetylene and acetic acid on the catalysts, and discussed the adsorption effects of different adsorption sites. Based on the co-adsorption structure, the transition state structure of the reaction process was found and the reaction energy barrier of the reaction rate control step was calculated. The effects of temperature on the catalytic properties were compared, and the reasons for the differences of catalytic properties of four CN materials were further speculated. The results show that with the increase of reaction temperature, the adsorption capacity of catalyst for acetylene and acetic acid decreases, and the energy barrier of reaction rate control step increases slightly. Due to the different CN ratio and basic structure of the catalyst, the adsorption energy of acetylene and acetic acid on different catalysts will change greatly, the order of adsorption capacity of the four catalysts for reactants is C3N > C2N > C4N > C5N. Under the condition of 393.15–493.15 K, the adsorption process of C2N is exothermic adsorption when the reaction temperature is low, and gradually becomes endothermic adsorption with the increase of temperature. The adsorption of C3N to reactants is exothermic. The adsorption of C4N and C5N to reactants is endothermic. In addition, there are some differences in the catalytic capacity of the four catalysts, the order of catalytic capacity of the four catalysts for reaction is C3N > C2N > C5N > C4N. The reaction energy barrier of C3N is the lowest, 30.57 kcal/mol at 393.15 K. We found that the catalytic performance of C3N is better than that of C5N with similar structure, and C3N and C5N structures have two reaction paths, respectively, while C2N and C4N structures with holes not only have lower catalytic performance than C3N, but also only one reaction path. Among the four catalysts we studied, C3N not only has a stronger adsorption capacity for reactants, but also shows a lower reaction energy barrier, which is a potential catalyst for the preparation of ethylene acetate by acetylene gas phase method. 2 Computational methods All the studies in this paper were conducted using the Becke, 3-parameter, Lee–Yang–Parr (B3LYP) functional of density functional theory (DFT) [39,40], and calculations were performed using the Gaussian 09 [41] software package. The B3LYP nonlocal correlation functional with the 6-31G(d,p) [42] basis set was applied to C, N, O, and H atoms. The DFT-D3 method [43] was used to calculate the density functional dispersion correction. Considering the influence of reaction temperature and base group superposition error, the relative energy of all optimized configurations along the reaction path is the Sum of electronic and thermal Free Energies(G) at the same optimization level, and no symmetry constraints were assumed in the geometrical optimization. Gibbs free energy can be calculated as follows Eq. (1): (1) G = E ( e l e c ) + Z P E + E ( v i b ) + E ( r o l ) + E ( t r a n s ) + R T − T S Where G is the Gibbs free energy of the system, E(elec) is the total electronic energy of the system, ZPE is the zero point energies of the system. E(vib), E(rol) and E(transl) are the vibrational energy, rotational energy and translational energy of the system respectively, and S is the entropy of the system. The calculation formulas of entropy (s) and zero point energy (ZPE) are shown in equations Eqs. (2) and (3). In addition, in order to explore the influence of different temperatures, we used Shermo code [44] to calculate the Gibbs free energy (G) of each structure at different reaction temperatures. (2) S = N k B + N k B l n ( q ( V , T ) N ) + N k B T ( ∂ l n q ∂ T ) V (3) Z P E = ∑ h v 2 In this work, all structural optimization and transition state calculation are carried out on the basis of the same calculation level, and the state of the optimized stable point is verified by calculating the harmonic vibration frequency. The stable point is the point where the force is zero on the potential energy surface, which may be either a minimum or a saddle point. The minimum is minimal in all directions of the potential energy surface, that is, the structure of reactants, products or intermediates in the reaction process. The saddle point is minimal in some directions, but maximal in one direction, that is, the so-called transition state structure. Based on the above theory, we verify that the optimized geometry has no frequency through harmonic vibration frequency, and all eigenvalues of its force constant matrix are positive, so as to ensure that the structure is a stable minimum point on the electron energy plane. Similarly, by calculating the resonant frequency of the transition state structure, it is found that there is an imaginary frequency, and the eigenvalue of the force constant matrix has only a negative value. However, the correct transition state(Ts) does not only have a virtual frequency, and the vibration direction of this virtual frequency is related to the desired reactants and products. A better way is to judge whether the reactant products are related to the obtained transition state through the calculation of the intrinsic reaction coordinators (IRC) [45,46]. Finally, we calculate the intrinsic reaction coordinates (IRC) of the transition state structure, and verify the reactants and products connected at both ends of Ts, so as to determine the correct transition state structure. During this study, the method of calculating adsorption energy and CO adsorption energy is shown in Eqs. (4) and (5). The process of calculating the energy barrier of reaction rate control step on each reaction path adopts the method of finding rate control step proposed by Murdoch [47] (4) Δ G a d s = G a d s − s t a t e − ( G C 2 H 2 / C H 3 C O O H + G C a t a l y s t ) (5) Δ G C o − a d s = G C o − a d s − s t a t e − ( G C 2 H 2 + G C H 3 C O O H + G C a t a l y s t ) where Gads-state and GCo-ads-state represent the total Gibbs free energy of the adsorbed substance and catalyst, and GCatalyst, GC2H2 , and GCH3COOH are the Gibbs free energy of a single catalyst and a single reactant, respectively. 3 Results and discussion 3.1 Geometries of the reactants In this study, the catalysts used included C2N, C3N, C4N, and C5N, and the reactants included acetylene and acetic acid molecules. Fig. 1 shows their optimized geometry. Fig. 1(a) shows the structure of C2N, a two-dimensional single-layer structure composed of a benzene ring connected by N atoms. C2N can also be considered a honeycomb lattice, composed of N atoms connected to a benzene ring with large cavities at the center [48]. Fig. 1(b) shows the C3N structure, a two-dimensional C and N crystal without cavities. In the honeycomb structure of the C3N monolayer, there are two types of hexagonal rings, a CN ring consisting of two N and four C atoms and a ring consisting of six carbon atoms; both the C and N atoms demonstrate D6h symmetry [29]. Fig. 1(c) shows a monolayer C4N structure. C4N structures are composed of alternating C–N hexagons and C–N pentagon–octagon–pentagons. C–C and C–N bonds can be single or double bonds, indicating that the electrons are well localized in the ring and the structure has a certain stability [49]. Fig. 1(d) shows a monolayer C5N structure. C5N is made up of a C atom on a benzene ring replaced by an N atom. The C5N layer configuration has hexagonal symmetry with a P 6 ¯ 2m space group [35]. The support information Table S1 describes the bond length between different atoms and the charge carried by each atom in the C2N, C3N, C4N and C5N structures in Fig. 1. The density-of-states (DOS) of the catalyst was analyzed using the Mutiwfn software package [50]. (a–d) in Fig. 2 are the state density diagrams of C2N, C3N, C4N and C5N, respectively. The corresponding frontier molecular orbital was analyzed, and the contributions of the P orbital of carbon-atom and the P orbital of nitrogen-atoms to the highest occupied molecular orbital (HOMO) and the lowest unoccupied molecular orbital (LUMO) in different catalysts were compared. For C2N, C3N, C4N, and C5N, the density-of-state diagram shows that the contribution of the P orbitals of carbon-atoms to the highest occupied molecular orbital(HOMO) and the lowest unoccated molecular orbital(LUMO) is greater than that of the P orbitals of nitrogen-atoms. The levels of HOMO, LUMO and HOMO-LUMO gap are shown in Fig. 2(e), and specific data are shown in Table S2 of Support information. According to the frontier orbital theory proposed by Fukui et al. [51], the value of HOMO-LUMO energy gap between the highest occupied molecular orbital (HOMO) and the lowest unoccued molecular orbital (LUMO) reflects the ability of the electron to transition from occupied orbital to vacant orbital, so it represents the strength of a molecule's ability to participate in chemical reactions to a certain extent [52]. At the same time, the larger the HOMO-LUMO gap, the less likely the electron transition is to occur, and the more stable the molecule is [53]. By comparing the HOMO-LUMO gap in Fig. 2(e), we find that the HOMO-LUMO gap of C3N is much smaller than that of the other three CN materials, indicating that electrons on C3N are easier to transition from occupied orbit to vacant orbit. Therefore, we speculate that C3N may have the best catalytic activity among the four CN materials. Before studying the reaction process, we carried out electrostatic potential analysis on the catalyst. Fig. 3 shows the molecular electrostatic potential diagrams of the C2N, C3N, C4N, and C5N catalysts. Blue and red represent positive and negative charges, respectively. The darker the color, the more concentrated the corresponding charge. We found that as the proportion of C/N ratios on the catalyst increased, the charge transfer inside the catalyst became more obvious. By analyzing the molecular electrostatic potential of the four catalysts, we were better able to identify the adsorption and reaction sites. Since acetylene acetate reaction is electrophilic, we predict that where the negative charge accumulates will be the site of the reaction, and based on this prediction, we carried out the next research. 3.2 Adsorption of C2H2 and CH3COOH over catalysts First, the adsorption of single CH3COOH and C2H2 molecules on C2N, C3N, C4N and C5N at 393.15 K was analyzed. The different adsorption sites were calculated (The adsorption structures and adsorption energies are shown in Table S3 of Support information), and the most stable CH3COOH and C2H2 adsorption structure to be adsorbed on the surface of CN catalyst were determined, as shown in Fig. 4 . By comparing the molecular electrostatic potential of the four catalysts in Fig. 3, we found that the adsorption sites of acetylene and acetic acid were greatly related to the positive and negative values and distribution of molecular electrostatic potential on the catalyst surface. In Fig. 4(a) and (b), the adsorption sites of acetylene and acetic acid molecules on C2N are the holes with obvious negative charge accumulation on C2N, and both acetylene and acetic acid molecules are adsorbed in a way that hydrogen atoms are close to the center of the holes and almost perpendicular to the catalyst plane. In Fig. 4(c) and (d), the adsorption sites of acetylene and acetic acid molecules on C3N are also concentrated at the positions with negative charge accumulation. Although the charge transfer on C4N and C5N is not as good as that on C2N and C3N, the relatively stable adsorption site is still near the negative charge aggregation position on the catalyst. This indicates that the adsorption of acetylene and acetic acid on CN catalyst may be related to the accumulation of negative charge caused by charge transfer between atoms on the catalyst after N atoms doping. After that, we investigated the adsorption properties of the catalysts at 393.15–493.15 K with a temperature gradient of 10 K. Fig. 5 (a) and (b) show the fitting curves of adsorption energy of CN catalysts for acetylene and acetic acid at 393.15 K to 493.15 K, respectively. As can be seen from the Fig. 5, the order of adsorption capacity of the four CN catalysts for acetylene is C3N > C2N > C4N > C5N, and the order of adsorption capacity for acetic acid is C3N > C2N > C5N > C4N. With the change of reaction temperature, the adsorption capacity of the four CN catalysts to reactants decreased to a certain extent. Detailed data of adsorption energy of acetylene and acetic acid at different temperatures are shown in Table S4 of Support information. To further study the reaction of acetylene and acetic acid molecules on the catalyst, their Co-adsorption structure was investigated. In Fig. 6 , (a–d) are the optimal adsorption configurations optimized on C2N, C3N, C4N and C5N under the reaction conditions of 1 atm and 393.15 K, respectively. Fig. 6(e) shows the adsorption energy of acetylene and acetic acid on four CN catalysts at 393.15–493.15 K. It can be seen from Fig. 6(e) that the adsorption energy of acetylene and acetic acid on different catalysts changed greatly with the change of catalyst C/N ratios. At 393.15–493.15 K, the co-adsorption energy of acetylene and acetic acid on C2N is negative at 393.15 K, and becomes positive gradually with the increase of temperature. The Co-adsorption energy of acetylene and acetic acid on C3N is negative, and the Co-adsorption energy on C4N and C5N is positive. By comparing the adsorption energy of acetylene and acetic acid, it can be found that C2Nand C3N are more conducive to the transition from single adsorption to Co-adsorption in thermodynamics, while C4N and C5N need to absorb higher energy before the transition from single adsorption to co-adsorption. Detailed data of adsorption energy of acetylene and acetic acid at different temperatures are shown in Table S4 of Support information. In addition, we also compare the energy of single adsorption energy and Co-adsorption energy, and find that the sum of single adsorption energy of acetylene and acetic acid molecules on C2N and C3N is greater than their co-adsorption energy, while the sum of single adsorption energy of acetylene and acetic acid molecules on C4N and C5N is less than their co-adsorption energy. This difference may be caused by the different N doping ratio in the catalyst. Because the adsorption site on the catalyst has a certain adsorption capacity for the two reactant molecules, when a single molecule is first adsorbed on a site of C2N and C3N catalyst to form a stable structure, it will inhibit the adsorption of the second reactant, resulting in acetylene and acetic acid molecules at the site of mutual exclusion. The repulsion between the reactants causes the adsorption energy of co-adsorption to be less than the sum of single adsorption. For C4N and C5N, due to the decrease of N doping ratio, the interatomic charge transfer on the catalyst is not strong enough, so that C4N and C5N have almost no adsorption capacity for the reactants, and even the single reactants need to absorb certain energy from the outside to form a stable adsorption structure. There will not be corresponding competition between the two reactant molecules on the catalyst, and there will be a certain interaction between acetylene and acetic acid molecules to form a stable structure between the two molecules and the catalyst. Therefore, the sum of the single adsorption energies on C4N and C5N will be less than co-adsorption. In addition, we draw IRI diagram (Fig. S1 of Supporting information) through Multiwfn and VMD program [54], and find that this interaction between adsorbate and surface in stable Co-adsorption structure is van der Waals force. 3.3 Reaction mechanism of acetylene acetate reaction catalyzed by C2N, C3N, C4N, and C5N There are many studies [55–59] on the reaction mechanism of acetylene gas-phase production of vinyl acetate, but there is no unified view on the reaction mechanism of acetylene vinegar acidification. Presently, the three mechanisms most widely accepted by researchers are the acid catalysis mechanism, the Kripylo mechanism, and the Furukawa mechanism. See Supporting information Fig. S2 for the specific reaction process and flow chart of the above three mechanisms. In these studies, Dong et al. [58] Studied the reaction mechanism of acetylene and acetic acid catalyzed by zinc acetate based on three reaction mechanisms, and found that Furukawa mechanism has obvious defects, while kripylo's mechanism and acid catalysis mechanism are feasible, and the effect of kripylo's mechanism is better for zinc acetate catalyst. Miyazawa [60] found that using V2O5-ZnO, Fe2O3-ZnO two-component oxides, 24ZnO·8Cr2O3·V2O5 and 16ZnO·32Fe2O3·V2O5 as active components, the catalytic activity is much higher than that of industrial catalysts at high temperature (250 °C), but its high cost Due to the disadvantages of high reaction temperature and rapid deactivation, such catalysts are still in the stage of laboratory research. Hu et al. [61] also found ZnO-N-C catalyst with excellent performance, which can reach 100% within ten hours of reaction, and the content of by-products is low, but it also has the problem of rapid deactivation. However, it is impossible to explain the source of activity of these non zinc acetate catalysts if Furukawa mechanism and Kripylo mechanism are used. Therefore, we believe that the acid catalysis mechanism is very likely to be a suitable mechanism for non zinc acetate catalysts. In the acid catalysis mechanism, the reaction is through the formation of vinyl cations. The action of the catalyst leads to acetic acid molecular dissociation, the generation of H+ and acetic acid with ions (Eq. (6)); the addition of acetylene molecules to produce vinyl cations (Eq. (7)); the vinyl cations then react with the acetic acid and anions to produce VAc (Eq. (8)). The equations for the reactions are as follows: (6) CH3COOH → CH3COO− + H+ (7) CHCH + H+ → CH2=C+H (8) CH2=C+H + CH3COO− → CH2=CHOOCCH3 In addition, Wu et al. [62] showed that activated carbon alone or zinc acetate alone is inactive. Obviously, the role of carbon is not only to provide a dispersion medium, zinc acetate, but also likely to play other roles in the catalytic process. In this regard, we have carried out corresponding theoretical research on the reaction of acetylene and acetic acid on non-metallic CN materials according to the acid catalysis mechanism, so as to explore the possibility of non-metallic materials catalyzing the reaction of acetylene and acetic acid. All the calculation results in the subsequent papers are based on the reaction conditions at 1 atm and 393.15 K. The specific data of the reaction process from 393.15–493.15 K with 10 K as the temperature gradient at 1atm are given in the Support information. 3.3.1 Reaction mechanism over C2N The black paths in Fig. 7 shows the detailed reaction process and energy changes of acetylene and acetic acid over C2N catalysts. Based on the mechanism of acid catalytic reaction, when vinyl acetate is generated between acetylene and acetic acid molecules on C2N, the O−H bond on the carboxyl group of acetic acid molecule will break and generate CH3COO− and H+, and the H+ from acetic acid dissociation will attack CHCH. During the attack of H+, the CC triple bond of CHCH will break to form C=C double bond, and then CH2=C+H will be formed. Finally, The O− on CH3COO− attacks the C+ on CH2=C+H to form vinyl acetate(VAc). The transition state structure of this reaction process is the configuration with the highest energy when H+ attacks CHCH, as shown in Ts1 in Fig. 7. Through the harmonic vibration frequency analysis of the transition state structure(Ts1), it was found that the Ts1 structure had only one virtual frequency (−1407.57 cm−1), and the vibration direction of this frequency was related to the tensile vibration of H+ disintegrated by CH3COOH between CH3COO− and C2H2, See support information S1 for resonance frequency data of all transition state structures in this paper. The reaction energy barrier from the Co-ads to the Ts1 is 33.09 kcal/mol. The intrinsic reaction coordinators (IRC) of the Ts1 structure was calculated, and the Co-ads and Fs of Ts1 connection were verified, which also indicated that there was no additional intermediate in the reaction process. Due to the influence of C2N catalyst, the generated vinyl acetate is adsorbed near the C2N hole, as shown in Fig. 7 Fs. We desorbed vinyl acetate on the catalyst, and the product structure was VAc as shown in Fig. 7, with a desorption energy of 0.24 kcal/mol. By comparing the whole reaction process, it is found that the rate-control step of the reaction is from the Co-ads to the Ts1, and its rate-control step energy barrier is 33.09 kcal/mol. Energy data at other reaction temperatures are shown in Support information Table S4. 3.3.2 Reaction mechanism over C3N Path 1 on C3N: The red and blue paths in Fig. 7 show the two detailed reaction processes and energy changes of acetylene and acetic acid over a C3N catalyst. In path 1, the Co-adsorption structure (Co-ads) forms the CH2=CH* complex (p1-Im1) with the C atom on C3N through the transition state structure (p1-Ts1). The reaction energy barrier for this step is 35.43 kcal/mol. As shown in Fig. 7, the p1-Ts1 is the highest energy configuration in the formation of CH2=CH* complex, in which acetylene molecules undergo obvious deformation and tend to approach C3N. Through the harmonic vibration frequency analysis, it was found that the p1-Ts1 structure had only one virtual frequency (−540.71 cm−1). The vibration of this frequency is mainly related to the close vibration between the C atoms of C2H2 and the C atoms of C3N, and there is also a certain degree of vibration between the H atom of the carboxyl group of CH3COOH and C2H2. Then the intermediate structure (p1-Im1) was determined by IRC calculation, and the correctness of p1-Ts1 was verified. Subsequently, the CH2=CH* complex in the p1-Im1 will decompose to form CH2=C+H and C3N catalyst, and CH2=C+H will react with CH3COO− to form vinyl acetate (VAc). In this reaction process, the reaction system will pass through the highest energy state (p1-Ts2), as shown in Fig. 7. In order to generate ethylene acetate, the p1-Im1 needs to absorb 44.54 kcal/mol energy to over the saddle point of potential energy surface(p1-Ts2). Similarly, Through the harmonic vibration frequency analysis, it was found that the p1-Ts2 had only one virtual frequency (−145.50 cm−1), and the vibration direction of this frequency is related to the tensile vibration of CH2=C+H between C3N and CH3COO−. In addition, the correctness of p1-Ts2 connecting p1-Im1 and Fs was verified by IRC. Finally, VAc was desorbed at an energy of 11.19 kcal / mol. By comparing the energy changes in the whole reaction process, we found that the process from the p1-Im1 to the p1-Ts2 is the rate-controlled step of acetylene acetate reaction on C3N, and the rate-controlled step energy barrier is 44.54 kcal/mol. Path 2 on C3N: In path 2, the O−H bond on the carboxyl group of acetic acid molecule breaks to form CH3COO− and H+, and the H+ after acetic acid dissociates attacks CHCH to form CH2=C+H, CH2=C+H reacts with CH3COO− to form VAc1. The transition state structure (p2-Ts1) of this process is shown in Fig. 7, and the reaction energy barrier is 30.57 kcal/mol. This structure is very similar to the transition state structure of C2N, that is, the highest energy configuration in the process of CH3COOH dissociating H+ attacking CHCH. Through the harmonic vibration frequency analysis, it was found that the p2-Ts1 structure had only one virtual frequency (−792.40 cm−1), and the vibration direction of this frequency was related to the tensile vibration of H+ disintegrated by CH3COOH between CH3COO− and C2H2. However, we found that the product VAc1 on C3N has a different structure from the product VAc on C2N (as shown in Fig. 7). By comparing the energy of the two structures, it is found that the energy of VAc structure is lower than that of VAc1 structure, and the structure is more stable. This indicates that VAc1 structure (p2-Im1) generated on C3N is only an intermediate structure, so we explored the conversion process of VAc1 to VAc on this basis. It was found that the reaction energy barrier was as high as 45.97 kcal/mol due to the influence of catalyst when VAc1 was converted to VAc on C3N. Its transition state structure is shown in p2-Ts2 in Fig. 7. The p2-Ts2 has only one virtual frequency (−686.80 cm−1), and the vibration direction of this frequency is related to the tensile vibration of CH2=C+H between two O atoms of CH3COO−. The p2-Im1 passes through the p2-Ts2 and then transforms into the Fs. Finally, the Fs absorbs 11.19 kcal/mol and makes vinyl acetate (VAc) desorbed from C3N. In addition, we also found that if the product VAc1 was desorbed on C3N first, its desorption energy was 10.38 kcal/mol. VAc1 only needs 2.31 kcal/mol energy to cross the transition state structure (p2-Ts3) and generate VAc without the influence of catalyst. The p2-Ts3 has only one virtual frequency (−100.31 cm−1), and the vibration direction of this frequency is related to the torsional vibration of vinyl acetate (VAc) itself. At the reaction temperature of 393.15 K, the energy barrier of 2.31 kcal/mol is almost negligible. If this energy barrier is ignored, it can be considered that VAc1 is not an intermediate structure, but VAc that has undergone certain deformation under the action of CN catalyst, and the final product VAc is obtained after desorption. At this time, p2-Ts2 can also be considered as a redundant process. We confirmed the correctness of the transition state through the intrinsic reaction coordinate (IRC) in all the above processes. By comparing the energy barrier sizes of different reaction paths, we found that the optimal reaction path existed in path 2, and the reaction energy barrier of its speed control step was 30.57 kcal/mol. Energy data at other reaction temperatures are shown in Support information Table S4. 3.3.3 Reaction mechanism over C4N The reaction process of acetylene and acetic acid on C4N is very similar to path 2 of C3N, but because the adsorption process of C4N to reactants is endothermic, it requires more energy for the reactants on C4N to jump over the transition state structure (Ts1). The reactants need to absorb 35.02 kcal/mol energy from the initial state to the Co-ads and then to the Ts1. The transition state structure on C4N is shown in Ts1 in Fig. 8 , the Ts1 has only one virtual frequency (−826.82 cm−1), and the vibration direction of this frequency was related to the tensile vibration of H+ disintegrated by CH3COOH between CH3COO− and C2H2. Like C3N, the intermediate structure (Im1) is formed after the Ts1, and the product on Im1 is VAc1. In this regard, VAc1 was desorbed based on the reaction process of C4N, and its desorption energy was -2.22 kcal/mol. VAc1 was converted into VAc after absorbing 2.31 kcal/mol energy and jumping over the Ts2. Similarly, we also calculated that VAc1 was directly converted into VAc on C4N, with an energy barrier of 46.91 kcal/mol. The specific structure of the transition state and the corresponding energy are shown in support information Fig. S3. Energy data at other reaction temperatures are shown in Support information Table S4. 3.3.4 Reaction mechanism over C5N Path 1 on C5N: As shown in Fig. 8, the reaction path 1 of acetylene and acetic acid on C5N is very similar to the path and energy of C4N. The adsorption process of C5N on the reactants is also endothermic, and the energy barrier from the initial structure to the transition state structure (p1-Ts1) is 34.60 kcal/mol. The transition state structure on C4N is shown in p1-Ts1 in Fig. 8, the p1-Ts1 has only one virtual frequency (−790.64 cm−1). In this regard, VAc1 was desorbed based on the reaction process of C5N, and its desorption energy was -1.68 kcal/mol. VAc1 was converted into VAc after absorbing 2.31 kcal/mol energy and jumping over the Ts2. Similarly, we also calculated that VAc1 was directly converted into VAc on C5N, with an energy barrier of 47.50 kcal/mol. The specific structure of the transition state and the corresponding energy are shown in support information Fig. S3. By comparing the energy changes of the whole reaction path, the rate-controlled energy barrier of this path is 34.60 kcal/mol. Energy data at other reaction temperatures are shown in Support information Table S4. Path 2 on C5N: In path 2, the Co-adsorption structure (Co-ads) forms the CH2=CH* complex (p2-Im1) with the C atom on C5N through the transition state structure (p2-Ts1). The reaction energy barrier for this step is 25.47 kcal/mol. As shown in p1-Ts1 in Fig. 8, through the harmonic vibration frequency analysis, it was found that the p2-Ts1 structure had only one virtual frequency (−475.42 cm−1). The vibration of this frequency is mainly related to the close vibration between the C atoms of C2H2 and the C atoms of C5N, and there is also a certain degree of vibration between the H atom of the carboxyl group of CH3COOH and C2H2. The IRC of the p1-Ts1 structure was calculated, and the correctness of the p2-Ts1 connected Co-adsorption structure (Co-ads) and intermediate structure (p2-Im1) was verified. It can be seen from p2-Im1 in Fig. 8, some torsion is required to continue the reaction between CH2=CH* and CH3COO−, so that the C atom connected to the C5N catalyst on CH2=CH* is closer to CH3COO−. The transition state structure of this process is shown as p2-Ts2 in Fig. 8, and the reaction energy barrier is 4.39 kcal/mol. the p2-Ts2 has only one virtual frequency (−121.05 cm−1). The p2-Im1 is twisted to form the p2-Im2, after which CH3COO− attacks the C atom connected to C5N on the vinyl to form vinyl acetate (VAc).The transition state structure of this process is shown as p2-Ts3 in Fig. 8, the p2-Ts3 has only one virtual frequency (−494.57 cm−1), and the vibrational side of this frequency corresponds to the offensive direction of CH3COO− towards the C atom on CH2=CH*. The reaction energy barrier of this process is 42.19 kcal/mol, much larger than that of other steps, so this step is also the speed control step of this reaction path. Finally, vinyl acetate (VAc) was desorbed on C5N with a desorption energy of -3.74 kcal/mol. Energy data at other reaction temperatures are shown in Support information Table S4. 3.3.5 Comparison of acetylene acetate reaction over CN catalysts By comparing the complete reaction processes of four CN materials, the first factor affecting the catalytic performance of CN non-metallic materials is the adsorption performance of materials for acetylene and acetic acid. Among the four CN materials, the adsorption energy of C4N and C5N to reactants is positive at 343.15–493.15 K; Although C2N shows certain adsorption, its spontaneous adsorption performance gradually decreases and disappears with the increase of reaction temperature. Therefore, C2N, C4N and C5N can not meet the conditions of catalyzing acetylene acetic acid reaction at higher temperature in experiment or industry. However, the adsorption free energy of C3N is still negative even if the reaction temperature increases to 493.15 K. In addition, compared with the other three catalysts, the energy barrier of the speed control step of the reaction of acetylene and acetic acid on C3N is also the lowest, which is the most potential catalyst among the four CN materials. The specific rate control steps and energy barriers of acetic acid acetylene reaction on four CN catalysts are shown in Table 1 . At 393.15 K and 1atm, the best reaction path on C3N is: The Co-adsorption structure absorbs 30.57 kcal/mol energy to jump over the p2-Ts1 to generate intermediate VAc1. After that, the system absorbs 10.38 kcal/mol energy to adsorb VAc1 on C3N for desorption. VAc1 absorbed 2.31 kcal/mol of energy to jump over the p2-Ts3 to form the product VAc. Based on the previous work, we calculated the activation energy of C3N with the best performance among the four CN materials and compared it with the experimental data. It is found that the activation energy(Ea) of acetylene acetic acid reaction on C3N is 26.52 kcal/mol, which still lags behind the activation energy of zinc acetate catalyst (19.164 kcal/mol). See Appendix A of Supporting information for details. In addition, we also roughly explored the catalytic performance of the boundary positions of the four CN materials. We found that the acetylene acetic acid reaction showed a large reaction energy barrier at the boundary position of hydrogen closure, which may not be the best reaction site. For details, see Appendix B of the Supporting information. 4 Conclusion Based on the reaction conditions of acetylene gas phase method, the reaction mechanism of four non-metallic catalysts with different C/N ratios for acetylene gas phase synthesis of VAc was studied by density functional theory. The order of the adsorption properties of the four catalysts to the reactants is C3N > C2N > C4N > C5N, and the order of the energy barrier of the rate control step in the catalytic process is C3N < C2N < C5N < C4N. We can see that C3N not only has the strongest adsorption capacity for reactants, but also has the lowest reaction energy barrier. In addition, the reaction process on CN non-metallic materials is also consistent with the acid catalysis mechanism, which shows that non-metallic catalysts are theoretically feasible for catalyzing acetylene acetate acidification. Although the activation energy of C3N catalyst is slightly higher than that of Zn/AC catalyst, C3N catalyst has lower price and wider range of raw materials. Compared with zinc acetate based catalyst, C3N will not have the problem of loss of active components (zinc acetate sublimation, zinc acetate thermal decomposition, etc.). Therefore, we predict that the two-dimensional C3N material is likely to be a potential non-metallic catalyst for the preparation of vinyl acetate by acetylene gas phase method. At the same time, we also hope that this conclusion can further promote the exploration of acetylene acetic acid acidification catalyzed by non-metallic CN materials, so as to break the monopoly of metal catalysts in acetylene acetic acid reaction. CRediT authorship contribution statement Xunchao Zhang: Data curation, Formal analysis, Investigation, Validation, Writing – original draft. Junqing Li: Investigation. Lihua Kang: Project administration, Supervision, Investigation, Writing – review & editing. Mingyuan Zhu: Writing – review & editing. Declaration of Competing Interest None. Acknowledgements This work was supported by the Taishan Scholars Program of Shandong Province (tsqn202103051). Supplementary materials Supplementary material associated with this article can be found, in the online version, at doi:10.1016/j.mcat.2022.112299. Appendix Supplementary materials Image, application 1 Reference [1] Hanson J R. Steroids: reactions and partial synthesis[J]. Natural Product Reports, 14 (1997) 373-386. [2] Z. Zha P. Deshlahra Mechanistic framework and effects of high coverage in vinyl acetate synthesis[J] ACS Catal. 11 2021 1841 1857 Zha Z., Deshlahra P. Mechanistic framework and effects of high coverage in vinyl acetate synthesis[J]. ACS Catal., 11 (2021) 1841-1857. [3] J.J. Plata M. Garcia-Mota A.A.C. Braga Vinyl acetate synthesis on homogeneous and heterogeneous Pd-based catalysts: atheoretical analysis on the reaction mechanisms[J] J. Phys. Chem. A Mol. Spectrosc. Kinet. Environ. Gen. Theory 113 2009 11758 11762 Plata J.J., Garcia-Mota M., Braga A.A.C., et al. Vinyl acetate synthesis on homogeneous and heterogeneous Pd-based catalysts: atheoretical analysis on the reaction mechanisms[J]. J. Phys. Chem. A Mol. Spectrosc. Kinet. Environ. Gen. Theory, 113 (2009) 11758-11762. [4] F.D. Hartley Graft copolymer formation during the polymerization of vinyl acetate in the presence of polyvinyl alcohol[J] J. Polym. Sci. 34 1959 397 417 Hartley F.D.. Graft copolymer formation during the polymerization of vinyl acetate in the presence of polyvinyl alcohol[J]. J. Polym. Sci., 34 (1959) 397-417. [5] M. Shiraishi Interactions of polyvinyl alcohol and vinyl acetate monomer in aqueous solution in relation to emulsion polymerisation of vinyl acetate[J] Br. Polym. J. 2 1970 135 140 Shiraishi M. Interactions of polyvinyl alcohol and vinyl acetate monomer in aqueous solution in relation to emulsion polymerisation of vinyl acetate[J]. Br. Polym. J., 2 (1970) 135-140. [6] F. Yan X. Changfa Y. Bingchao Studies on a novel polyacrylonitrile copolymer/cellulose acetate blending water absorbency fiber[J] Fibers Polym. 11 2010 838 842 Yan F., Changfa X., Bingchao Y. Studies on a novel polyacrylonitrile copolymer/cellulose acetate blending water absorbency fiber[J]. Fibers Polym., 11 (2010) 838-842. [7] R.R. Fleming L.C. Pardini C.A.R. Brito Plasma treatment of polyacrylonitrile/vinyl acetate films obtained by the extrusion process[J] Polym. Bull. 66 2011 277 288 Fleming R.R., Pardini L.C., Brito C.A.R.. Plasma treatment of polyacrylonitrile/vinyl acetate films obtained by the extrusion process[J]. Polym. Bull., 66 (2011) 277-288. [8] B. Gruber Vinyl acetate-ethylene (VAE) copolymer dispersions: a natural gas-derived technology for caulks and sealants (PPT) Proceedings of the Adhesive and Sealant Convention Spring Conference and Exposition Orlando, Florida(US) 2014 [C] Gruber B. Vinyl acetate-ethylene (VAE) copolymer dispersions: a natural gas-derived technology for caulks and sealants (PPT): Proceedings of the Adhesive and Sealant Convention Spring Conference and Exposition, Orlando, Florida(US), 2014[C]. [9] E. Hong S. Lim Y. Song Misciblility and physical properties of poly(lactic acid) (PLA) /poly(vinyl acetate) (PVAc) blends Proceedings of the IAEE International Conference San Francisco (US) 2009 [C] Hong E., Lim S., Song Y. Misciblility and physical properties of poly(lactic acid) (PLA) /poly(vinyl acetate) (PVAc) blends: Proceedings of the IAEE International Conference, San Francisco (US), 2009[C]. [10] B. Koll H. du Preez PVB film: the alternatives to ethylene-vinyl acetate (EVA)[J] SA Mech. Eng. 61 2011 23 26 Koll B., du Preez H. PVB film: the alternatives to ethylene-vinyl acetate (EVA)[J]. SA Mech. Eng., 61 (2011) 23-26. [11] Group PPP Trends in global ethylene vinyl acetate (VLEVA, LEVA, MEVA & HEVA) market[J] Pop. Plast. Packag. 59 2014 79 Group PPPTrends in global ethylene vinyl acetate (VLEVA, LEVA, MEVA & HEVA) market[J]. Pop. Plast. Packag., 59 (2014) 79. [12] F.W. Yan C.Y. Guo F. Yan Vinyl acetate formation in the reaction of acetylene with acetic acid catalyzed by zinc acetate supported on porous carbon spheres[J] Russ. J. Phys. Chem. 84 2010 796 801 Yan F.W., Guo C.Y., Yan F., et al. Vinyl acetate formation in the reaction of acetylene with acetic acid catalyzed by zinc acetate supported on porous carbon spheres[J]. Russ. J. Phys. Chem., 84 (2010) 796-801. [13] T. Kawaguchi T. Wakasugi Continuous preparation of activated carbon supported zinc acetate catalyst and industrial synthesis of vinyl acetate from acetylene[J] J. Chem. Technol. Biotechnol. 42 1988 113 127 Kawaguchi T., Wakasugi T. Continuous preparation of activated carbon supported zinc acetate catalyst and industrial synthesis of vinyl acetate from acetylene[J]. J. Chem. Technol. Biotechnol., 42 (1988) 113-127. [14] M. García-Mota N. López Template effects in vinyl acetate synthesis on PdAu surface alloys: a density functional theory study[J] J. Am. Chem. Soc. 130 2008 14406 14407 García-Mota M., López N. Template effects in vinyl acetate synthesis on PdAu surface alloys: a density functional theory study[J]. J. Am. Chem. Soc., 130 (2008) 14406-14407. [15] A.R.G. Caranton J. Dille J. Barreto Nanostructured Pd−Cu catalysts supported on Zr−Al and Zr−Ti for synthesis of vinyl acetate[J] ChemCatChem 10 2018 5256 5269 Caranton A.R.G., Dille J., Barreto J., et al. Nanostructured Pd−Cu catalysts supported on Zr−Al and Zr−Ti for synthesis of vinyl acetate[J]. ChemCatChem, 10 (2018) 5256-5269. [16] B. Poladura Á. Martínez-Casta Eda H. Rodríguez-Solla General metal-free baeyer-villiger-type synthesis of vinyl acetates[J] Org. Lett. 15 2013 2810 2813 Poladura B., Martínez-Casta Eda Á., Rodríguez-Solla H., et al. General metal-free baeyer-villiger-type synthesis of vinyl acetates[J]. Org. Lett., 15 (2013) 2810-2813. [17] M.T. Baei A.A. Peyghan Z. Bagheri A density functional theory study on acetylene-functionalized BN nanotubes[J] Struct. Chem. 24 2013 1007 1013 Baei M.T., Peyghan A.A., Bagheri Z. A density functional theory study on acetylene-functionalized BN nanotubes[J]. Struct. Chem., 24 (2013) 1007-1013. [18] W. Liu M. Zhu B. Dai Nitrogen doped nanoflower porous carbon as a nonmetal catalyst for acetylene hydrochlorination[J] New J. Chem. 42 2018 20131 20136 Liu W., Zhu M., Dai B. Nitrogen doped nanoflower porous carbon as a nonmetal catalyst for acetylene hydrochlorination[J]. New J. Chem., 42 (2018) 20131-20136. [19] X. Wang B. Dai Y. Wang Nitrogen-doped pitch-based spherical active carbon as a nonmetal catalyst for acetylene hydrochlorination[J] ChemCatChem 6 2014 2339 2344 Wang X., Dai B., Wang Y., et al. Nitrogen-doped pitch-based spherical active carbon as a nonmetal catalyst for acetylene hydrochlorination[J]. ChemCatChem, 6 (2014) 2339-2344. [20] K.S. Novoselov A.K. Geim S.V. Morozov Electric Field Effect in Atomically Thin Carbon Films[J] Science 306 2004 666 669 Novoselov K S, Geim A K, Morozov S V, et al. Electric Field Effect in Atomically Thin Carbon Films[J]. Science, 306 (2004) 666-669. [21] S.A. Chernyak D.N. Stolbov A.S. Ivanov Effect of type and localization of nitrogen in graphene nanoflake support on structure and catalytic performance of Co-based fischer-tropsch catalysts[J] Catal. Today 357 2020 193 202 Chernyak S.A., Stolbov D.N., Ivanov A.S., et al. Effect of type and localization of nitrogen in graphene nanoflake support on structure and catalytic performance of Co-based fischer-tropsch catalysts[J]. Catal. Today, 357 (2020) 193-202. [22] D. Kong W. Yuan C. Li Synergistic effect of Nitrogen-doped hierarchical porous carbon/graphene with enhanced catalytic performance for oxygen reduction reaction[J] Appl. Surf. Sci. 393 2017 144 150 A Journal Devoted to the Properties of Interfaces in Relation to the Synthesis and Behaviour of Materials Kong D., Yuan W., Li C., et al. Synergistic effect of Nitrogen-doped hierarchical porous carbon/graphene with enhanced catalytic performance for oxygen reduction reaction[J]. Appl. Surf. Sci. A Journal Devoted to the Properties of Interfaces in Relation to the Synthesis and Behaviour of Materials, 393 (2017) 144-150. [23] E.Y. Ba H.D. Lim Y.S. Yun Catalytic effects of heteroatom-doped graphene nanosheets on the performance of Li-O2 batteries[J] J. Electrochem. Sci. Technol. 5 2014 49 52 Ba E.Y., Lim H.D., Yun Y.S., et al. Catalytic effects of heteroatom-doped graphene nanosheets on the performance of Li-O2 batteries[J]. J. Electrochem. Sci. Technol., 5 (2014) 49-52. [24] C. Aykut U. Berdan S. Ozlem Synthesis of in situ N-, S-, and B-doped few-layer graphene by chemical vapor deposition technique and their superior glucose electrooxidation activity[J] Int. J. Energy Res. 43 2019 8204 8216 Aykut C., Berdan U., Ozlem S., et al. Synthesis of in situ N-, S-, and B-doped few-layer graphene by chemical vapor deposition technique and their superior glucose electrooxidation activity[J]. Int. J. Energy Res., 43 (2019) 8204-8216. [25] S. Yu Y.C. Rao X.M. Duan Modulating the properties of monolayer C2N: a promising metal-free photocatalyst for water splitting[J] Chin. Phys. B 26 2017 087301 S. Yu, Y.C. Rao, X.M. Duan, et al. Modulating the properties of monolayer C2N: A promising metal-free photocatalyst for water splitting[J]. Chinese Physics B, 26 (2017) 087301. [26] Chen Y., Liu G.H., Li Y.P., et al. Structural stability, electronic and magnetic properties of O-doped monolayer C2N[J]. 38 (2019) 8. [27] W. Zhong Y. Liu M. Deng C2N-supported single metal ion catalysts for HCOOH dehydrogenation[J] J. Mater. Chem. A. Mater. Energy Sustain. 6 2018 11105 11112 Zhong W., Liu Y., Deng M., et al. C2N-supported single metal ion catalysts for HCOOH dehydrogenation[J]. J. Mater. Chem. A. Mater. Energy Sustain., 6 (2018) 11105-11112. [28] W. Huang W. Li X. Liu Exotic ferromagnetism in the two-dimensional quantum material C3N[J] Front. Phys. 13 2018 137104 Huang W., Li W., Liu X. Exotic ferromagnetism in the two-dimensional quantum material C3N[J]. Front. Phys., 13 (2018). [29] S. Sadeghzadeh Effects of vacancies and divacancies on the failure of C3N nanosheets[J] Diam. Relat. Mater. 89 2018 257 265 Sadeghzadeh S. Effects of vacancies and divacancies on the failure of C3N nanosheets[J]. Diam. Relat. Mater., 89 (2018) 257-265. [30] S. Sadeghzadeh M. Ghojavand J. Mahmoudi Influence of stone-wales defects on the mechanical properties of graphene-like polyaniline (PANI) C3N nanosheets[J] Diam. Relat. Mater. 101 2020 107555 Sadeghzadeh S., Ghojavand M., Mahmoudi J. Influence of stone-wales defects on the mechanical properties of graphene-like polyaniline (PANI) C3N nanosheets[J]. Diam. Relat. Mater., 101 (2020). [31] Y. Ding J. Liu X. Huang C_4N: the first C_nN radical with stable cyclic isomers[J] J. Chem. Phys. 114 2001 5170 5179 Ding Y., Liu J., Huang X., et al. C_4N: the first C_nN radical with stable cyclic isomers[J]. J. Chem. Phys., 114 (2001) 5170-5179. [32] L. Li X. Kong O. Leenaerts Carbon-rich carbon nitride monolayers with dirac cones: dumbbell C4N[J] Carbon 118 2017 285 290 An International Journal Sponsored by the American Carbon Society Li L., Kong X., Leenaerts O., et al. Carbon-rich carbon nitride monolayers with dirac cones: dumbbell C4N[J]. Carbon: An International Journal Sponsored by the American Carbon Society, 118 (2017) 285-290. [33] Y. Li C. Mo J. Li Pyrazine-nitrogen-rich exfoliated C4N nanosheets as efficient metal-free polymeric catalysts for oxygen reduction reaction[J] J. Energy Chem. 49 2020 243 247 Li Y., Mo C., Li J., et al. Pyrazine-nitrogen-rich exfoliated C4N nanosheets as efficient metal-free polymeric catalysts for oxygen reduction reaction[J]. J. Energy Chem., 49 (2020) 243-247. [34] Q-Ku Hu Structural and electronic properties, and pressure-induced phase transition of layered C5N: a first-principles investigation[J] Chin. Phys. Lett. 28 2011 126101 Hu, Q-Ku, et al. Structural and electronic properties, and pressure-induced phase transition of layered C5N: a first-principles investigation[J]. Chin. Phys. Lett., 28 (2011) 126101. [35] Q. Wu Q. Hu Y. Hou Ground-state structures, physical properties and phase diagram of carbon-rich nitride C5N[J] J. Phys. Condens. Matter 30 2018 385402 Wu Q., Hu Q., Hou Y., et al. Ground-state structures, physical properties and phase diagram of carbon-rich nitride C5N[J]. J. Phys. Condens. Matter, 30 (2018). [36] X. Wang B. Dai Y. Wang Nitrogen-doped pitch-based spherical active carbon as a nonmetal catalyst for acetylene hydrochlorination[J] ChemCatChem 6 2014 2339 2344 Wang X., Dai B., Wang Y., et al. Nitrogen-doped pitch-based spherical active carbon as a nonmetal catalyst for acetylene hydrochlorination[J]. ChemCatChem, 6 (2014) 2339-2344. [37] T. Xuan C. Fangyong X. Yonggang Microporous nitrogen-doped carbon from polyaniline as a highly efficient and stable catalyst for acetylene hydrochlorination[J] J. Taiwan Inst. Chem. Eng. 126 2021 80 87 T. Xuan, C. Fangyong, X. Yonggang, et al., Microporous nitrogen-doped carbon from polyaniline as a highly efficient and stable catalyst for acetylene hydrochlorination[J], J. Taiwan Inst. Chem. Eng. 126 (2021) 80-87. [38] J. Zhao B. Wang Y. Yue Nitrogen- and phosphorus-codoped carbon-based catalyst for acetylene hydrochlorination[J] J. Catal. 373 2019 240 249 Zhao J., Wang B., Yue Y., et al. Nitrogen- and phosphorus-codoped carbon-based catalyst for acetylene hydrochlorination[J]. J. Catal., 373 (2019) 240-249. [39] G.A. Petersson M.A.A. Hyphen Laham A complete basis set model chemistry. II. Open&hyphen;shell systems and the total energies of the first&hyphen;row atoms[J] J. Chem. Phys. 94 1991 6081 6090 Petersson G.A., Hyphen M.A.A., Laham. A complete basis set model chemistry. II. Open&hyphen;shell systems and the total energies of the first&hyphen;row atoms[J]J. Chem. Phys., 94 (1991) 6081-6090. [40] S.H. Vosko L. Wilk M. Nusair Accurate spin-dependent electron liquid correlation energies for local spin density calculations: a critical analysis[J] Can. J. Phys. 58 1980 1200 1211 Vosko S.H., Wilk L., Nusair M. Accurate spin-dependent electron liquid correlation energies for local spin density calculations: a critical analysis[J]. Can. J. Phys., 58 (1980) 1200-1211. [41] Frisch M., Trucks G.W., Schlegel H.B., Scuseria G.E., Robb M.A., Cheeseman J.R., Scalmani G., Barone V., Mennucci B., Petersson G.E., Gaussian∼09 Revision D. 01.[CP/OL], (2014). [42] C.J. Rhodes Chapter 7. Electron spin resonance[J] Annual Reports Section ‘C’ (Physical Chemistry) 102 1999 166 202 Rhodes C J. Chapter 7. Electron spin resonance[J]. Annual Reports Section 'C' (Physical Chemistry), 102 (1999) 166-202. [43] C. Gonzalez HB. Schlegel An improved algorithm for reaction path following[J] J. Chem. Phys. 90 1989 2154 2161 Gonzalez C., Schlegel HB. An improved algorithm for reaction path following[J]. J. Chem. Phys., 90 (1989) 2154-2161. [44] T. Lu Q. Chen Shermo: a general code for calculating molecular thermochemistry properties[J] Comput. Theor. Chem. 1200 2021 113249 Lu T., Chen Q. Shermo: a general code for calculating molecular thermochemistry properties[J]. Comput. Theor. Chem., (2021) 113249. [45] H.B. Schlegel Some thoughts on reaction-path following[J] J. Chem. Soc. Faraday Trans. 90 1994 1569 1574 Schlegel H.B.. Some thoughts on reaction-path following[J]. J. Chem. Soc. Faraday Trans., 90 (1994) 1569-1574. [46] L.L. Stacho G. Domotor M.I. Ban On the Elber-Karplus reaction path-following method and related procedures[J] Chem. Phys. Lett. 311 1999 328 334 Stacho L.L., Domotor G., Ban M.I.. On the Elber-Karplus reaction path-following method and related procedures[J]. Chem. Phys. Lett., 311 (1999) 328-334. [47] JR. Murdoch What is the rate-limiting step of a multistep reaction?[J] J. Chem. Educ. 58 1981 32 36 Murdoch, JR. What is the rate-limiting step of a multistep reaction?[J]. J. Chem. Educ., 58 (1981) 32-36. [48] B. Li W. Li J.M. Perez-Aguilar Mild binding of protein to C2N monolayer reveals its suitable biocompatibility[J] Small 13 2017 1603685 Li B., Li W., Perez-Aguilar J.M., et al. Mild binding of protein to C2N monolayer reveals its suitable biocompatibility[J]. Small, 13 (2017). [49] C. Pu D. Zhou Y. Li Two-dimensional C4N global minima: unique structural topologies and nanoelectronic properties[J] J. Phys. Chem. C Nanomater. Interfaces 121 2017 2669 2674 Pu C., Zhou D., Li Y., et al. Two-dimensional C4N global minima: unique structural topologies and nanoelectronic properties[J]. J. Phys. Chem. C Nanomater. Interfaces, 121 (2017) 2669-2674. [50] T. Lu F. Chen Multiwfn: a multifunctional wavefunction analyzer[J] J. Comput. Chem. 33 2012 580 592 Lu T, Chen F. Multiwfn: a multifunctional wavefunction analyzer[J]. Journal of computational chemistry, 33 (2012) 580-592. [51] K. Fukui T. Yonezawa H. Shingu A molecular orbital theory of reactivity in aromatic hydrocarbons[J] J. Chem. Phys. 20 1952 722 725 Fukui K., Yonezawa T., Shingu H. A molecular orbital theory of reactivity in aromatic hydrocarbons[J]. J. Chem. Phys., 20 (1952) 722-725. [52] Y. Ruiz-Morales HOMOLUMO Gap as an Index of Molecular Size and Structure for Polycyclic Aromatic Hydrocarbons (PAHs) and Asphaltenes: A Theoretical Study. I[J] J. Phys. Chem. A 106 2012 11283 11308 Ruiz-Morales Y. HOMOLUMO Gap as an Index of Molecular Size and Structure for Polycyclic Aromatic Hydrocarbons (PAHs) and Asphaltenes: A Theoretical Study. I[J]. Journal of Physical Chemistry A, 106 (2012) 11283-11308. [53] M.V. Putz D.M.P. Mingos A. Chatterjee Applications of Density Functional Theory to Chemical Reactivity[J] 2012 Springer Berlin Putz M.V., Mingos D.M.P., Chatterjee A. Applications of Density Functional Theory to Chemical Reactivity[J]. Springer, Berlin, (2012). [54] W.F. Humphrey A. Dalke K. Schulten VMD: visual molecular dynamics[J] J. Mol. Graph. 14 1996 33 38 27-28 Humphrey W.F., Dalke A., Schulten K. VMD: visual molecular dynamics[J]. J. Mol. Graph., 14 (1996) 33-38, 27-28. [55] G. Jiang The optimal operation of the gas phase synthesis of vinyl acetate via the acetylene method in a packed bed reactor (Ⅰ)study of the reaction kinetics on the zn(ac) 2 catalyst[J] Chem. React. Eng. Technol. 12 1996 356 362 Jiang G. The optimal operation of the gas phase synthesis of vinyl acetate via the acetylene method in a packed bed reactor (Ⅰ)study of the reaction kinetics on the zn(ac) 2 catalyst[J]. Chem. React. Eng. Technol., (1996). [56] K. Prasad A two-step rate-control model of vinyl acetate synthesis[J] J. Catal. 72 1981 338 346 Prasad K. A two-step rate-control model of vinyl acetate synthesis[J]. J. Catal., 72 (1981) 338-346. [57] Z. Zhang Z. Zhang Y. Fernandez Adsorption isotherms and kinetics of methylene blue on a low-cost adsorbent recovered from a spent catalyst of vinyl acetate synthesis[J] Appl. Surf. Sci. 256 2010 2569 2576 Zhang Z., Zhang Z., Fernandez Y., et al. Adsorption isotherms and kinetics of methylene blue on a low-cost adsorbent recovered from a spent catalyst of vinyl acetate synthesis[J]. Appl. Surf. Sci., 256 (2010) 2569-2576. [58] X. Dong Y. Wang Y. Yu DFT investigation on the synthesis mechanism of vinyl acetate from acetylene and acetic acid catalyzed by ordered mesoporous carbon supported zinc acetate[J] Ind. Eng. Chem. Res. 57 2018 7363 7373 X. Dong, Y. Wang, Y. Yu, et al., DFT investigation on the synthesis mechanism of vinyl acetate from acetylene and acetic acid catalyzed by ordered mesoporous carbon supported zinc acetate[J], Ind. Eng. Chem. Res. 57 (2018) 7363-7373. [59] B.A. Morrow The initial mechanism of vinyl acetate synthesis from acetic acid and acetylene catalyzed by active carbon-zinc acetate[J] J. Catal. 86 1984 328 332 Morrow B.A.. The initial mechanism of vinyl acetate synthesis from acetic acid and acetylene catalyzed by active carbon-zinc acetate[J]. J. Catal., 86 (1984) 328-332. [60] S. Miyazawa Metal oxide catalyzer for vinyl acetate synthesis [J] J. Soc. Chem. Ind. Jpn. 61 1958 44 46 Miyazawa S. Metal oxide catalyzer for vinyl acetate synthesis [J]. J. Soc. Chem. Ind. Jpn., 1958, 61: 44-46. [61] L. Hu Z. Xu P. He Zinc and nitrogen-doped carbon in-situ wrapped ZnO nanoparticles as a high-activity catalyst for acetylene acetoxylation[J] Catal. Lett. 150 2020 1155 1162 Hu L., Xu Z., He P. et al. Zinc and nitrogen-doped carbon in-situ wrapped ZnO nanoparticles as a high-activity catalyst for acetylene acetoxylation[J]. Catal. Lett., 150 (2020) 1155-1162. [62] X. Wu P. He X. Wang Zinc acetate supported on N-doped activated carbon as catalysts for acetylene acetoxylation[J] Chem. Eng. J. 2017 Wu X., He P., Wang X., et al. Zinc acetate supported on N-doped activated carbon as catalysts for acetylene acetoxylation[J]. Chem. Eng. J., (2017).",
      "scopus-id": "85128676341",
      "coredata": {
        "eid": "1-s2.0-S2468823122001857",
        "dc:description": "At present, the acetylene acetic acid reaction catalysts studied are metal catalysts. Whether there are non-metallic materials that can catalyze the reaction is very worth exploring. In this study, we used density functional theory (DFT) to calculate the feasibility of preparing vinyl acetate (VAc) on four CN non-metallic materials (C2N, C3N, C4N and C5N) under the reaction conditions of 1 atm, 393.15–493.15 K at B3LYP/6-31G(d, p) level. It is found that after considering the reaction temperature, only C2N and C3N show good adsorption capacity for acetylene and acetic acid, and C3N has stronger adsorption capacity for reactants. After that, we calculated and simulated the reaction process of acetylene acetic acid reaction catalyzed by four CN materials. It is found that among the four CN materials, the energy barrier of the reaction rate control step of C3N is the lowest (the free energy barrier of the rate control step is only 30.57 kcal/mol at 393.15 K), and the interior of CN non-metallic materials has higher activity than the boundary of hydrogen sealing. We also found that the reaction process on CN non-metallic material is consistent with the acid catalysis mechanism, which shows that the non-metallic catalyst is theoretically feasible for catalyzing the acetic acid acidification of acetylene, and the two-dimensional C3N material is likely to be a potential non-metallic catalyst for the preparation of vinyl acetate by acetylene gas phase method.",
        "openArchiveArticle": "false",
        "prism:coverDate": "2022-05-31",
        "openaccessUserLicense": null,
        "prism:aggregationType": "Journal",
        "prism:url": "https://api.elsevier.com/content/article/pii/S2468823122001857",
        "dc:creator": [
          {
            "@_fa": "true",
            "$": "Zhang, Xunchao"
          },
          {
            "@_fa": "true",
            "$": "Li, Junqing"
          },
          {
            "@_fa": "true",
            "$": "Kang, Lihua"
          },
          {
            "@_fa": "true",
            "$": "Zhu, Mingyuan"
          }
        ],
        "link": [
          {
            "@_fa": "true",
            "@rel": "self",
            "@href": "https://api.elsevier.com/content/article/pii/S2468823122001857"
          },
          {
            "@_fa": "true",
            "@rel": "scidir",
            "@href": "https://www.sciencedirect.com/science/article/pii/S2468823122001857"
          }
        ],
        "dc:format": "application/json",
        "openaccessType": null,
        "pii": "S2468-8231(22)00185-7",
        "prism:volume": "524",
        "articleNumber": "112299",
        "prism:publisher": "Elsevier B.V.",
        "dc:title": "Theoretical study on the synthesis of vinyl acetate from acetylene and acetic acid over nonmetallic catalysts with different carbon-nitrogen ratios",
        "prism:copyright": "© 2022 Elsevier B.V. All rights reserved.",
        "openaccess": "0",
        "prism:issn": "24688231",
        "dcterms:subject": [
          {
            "@_fa": "true",
            "$": "Acetylene"
          },
          {
            "@_fa": "true",
            "$": "Acetic acid"
          },
          {
            "@_fa": "true",
            "$": "Vinyl acetate"
          },
          {
            "@_fa": "true",
            "$": "Nonmetallic catalyst"
          },
          {
            "@_fa": "true",
            "$": "CN material"
          }
        ],
        "openaccessArticle": "false",
        "prism:publicationName": "Molecular Catalysis",
        "openaccessSponsorType": null,
        "prism:pageRange": "112299",
        "pubType": "fla",
        "prism:coverDisplayDate": "May 2022",
        "prism:doi": "10.1016/j.mcat.2022.112299",
        "prism:startingPage": "112299",
        "dc:identifier": "doi:10.1016/j.mcat.2022.112299",
        "openaccessSponsorName": null
      },
      "objects": {
        "object": [
          {
            "@category": "standard",
            "@height": "312",
            "@width": "393",
            "@_fa": "true",
            "$": "https://api.elsevier.com/content/object/eid/1-s2.0-S2468823122001857-gr7.jpg?httpAccept=%2A%2F%2A",
            "@multimediatype": "JPEG image file",
            "@type": "IMAGE-DOWNSAMPLED",
            "@size": "61545",
            "@ref": "gr7",
            "@mimetype": "image/jpeg"
          },
          {
            "@category": "standard",
            "@height": "308",
            "@width": "393",
            "@_fa": "true",
            "$": "https://api.elsevier.com/content/object/eid/1-s2.0-S2468823122001857-gr8.jpg?httpAccept=%2A%2F%2A",
            "@multimediatype": "JPEG image file",
            "@type": "IMAGE-DOWNSAMPLED",
            "@size": "59511",
            "@ref": "gr8",
            "@mimetype": "image/jpeg"
          },
          {
            "@category": "standard",
            "@height": "318",
            "@width": "809",
            "@_fa": "true",
            "$": "https://api.elsevier.com/content/object/eid/1-s2.0-S2468823122001857-gr5.jpg?httpAccept=%2A%2F%2A",
            "@multimediatype": "JPEG image file",
            "@type": "IMAGE-DOWNSAMPLED",
            "@size": "58205",
            "@ref": "gr5",
            "@mimetype": "image/jpeg"
          },
          {
            "@category": "standard",
            "@height": "508",
            "@width": "809",
            "@_fa": "true",
            "$": "https://api.elsevier.com/content/object/eid/1-s2.0-S2468823122001857-gr6.jpg?httpAccept=%2A%2F%2A",
            "@multimediatype": "JPEG image file",
            "@type": "IMAGE-DOWNSAMPLED",
            "@size": "91715",
            "@ref": "gr6",
            "@mimetype": "image/jpeg"
          },
          {
            "@category": "standard",
            "@height": "305",
            "@width": "393",
            "@_fa": "true",
            "$": "https://api.elsevier.com/content/object/eid/1-s2.0-S2468823122001857-gr3.jpg?httpAccept=%2A%2F%2A",
            "@multimediatype": "JPEG image file",
            "@type": "IMAGE-DOWNSAMPLED",
            "@size": "72552",
            "@ref": "gr3",
            "@mimetype": "image/jpeg"
          },
          {
            "@category": "standard",
            "@height": "359",
            "@width": "565",
            "@_fa": "true",
            "$": "https://api.elsevier.com/content/object/eid/1-s2.0-S2468823122001857-gr4.jpg?httpAccept=%2A%2F%2A",
            "@multimediatype": "JPEG image file",
            "@type": "IMAGE-DOWNSAMPLED",
            "@size": "69117",
            "@ref": "gr4",
            "@mimetype": "image/jpeg"
          },
          {
            "@category": "standard",
            "@height": "284",
            "@width": "393",
            "@_fa": "true",
            "$": "https://api.elsevier.com/content/object/eid/1-s2.0-S2468823122001857-gr1.jpg?httpAccept=%2A%2F%2A",
            "@multimediatype": "JPEG image file",
            "@type": "IMAGE-DOWNSAMPLED",
            "@size": "41152",
            "@ref": "gr1",
            "@mimetype": "image/jpeg"
          },
          {
            "@category": "standard",
            "@height": "870",
            "@width": "809",
            "@_fa": "true",
            "$": "https://api.elsevier.com/content/object/eid/1-s2.0-S2468823122001857-gr2.jpg?httpAccept=%2A%2F%2A",
            "@multimediatype": "JPEG image file",
            "@type": "IMAGE-DOWNSAMPLED",
            "@size": "170829",
            "@ref": "gr2",
            "@mimetype": "image/jpeg"
          },
          {
            "@category": "standard",
            "@height": "178",
            "@width": "301",
            "@_fa": "true",
            "$": "https://api.elsevier.com/content/object/eid/1-s2.0-S2468823122001857-ga1.jpg?httpAccept=%2A%2F%2A",
            "@multimediatype": "JPEG image file",
            "@type": "IMAGE-DOWNSAMPLED",
            "@size": "28533",
            "@ref": "ga1",
            "@mimetype": "image/jpeg"
          },
          {
            "@category": "thumbnail",
            "@height": "164",
            "@width": "206",
            "@_fa": "true",
            "$": "https://api.elsevier.com/content/object/eid/1-s2.0-S2468823122001857-gr7.sml?httpAccept=%2A%2F%2A",
            "@multimediatype": "GIF image file",
            "@type": "IMAGE-THUMBNAIL",
            "@size": "15673",
            "@ref": "gr7",
            "@mimetype": "image/gif"
          },
          {
            "@category": "thumbnail",
            "@height": "164",
            "@width": "209",
            "@_fa": "true",
            "$": "https://api.elsevier.com/content/object/eid/1-s2.0-S2468823122001857-gr8.sml?httpAccept=%2A%2F%2A",
            "@multimediatype": "GIF image file",
            "@type": "IMAGE-THUMBNAIL",
            "@size": "14996",
            "@ref": "gr8",
            "@mimetype": "image/gif"
          },
          {
            "@category": "thumbnail",
            "@height": "86",
            "@width": "219",
            "@_fa": "true",
            "$": "https://api.elsevier.com/content/object/eid/1-s2.0-S2468823122001857-gr5.sml?httpAccept=%2A%2F%2A",
            "@multimediatype": "GIF image file",
            "@type": "IMAGE-THUMBNAIL",
            "@size": "7433",
            "@ref": "gr5",
            "@mimetype": "image/gif"
          },
          {
            "@category": "thumbnail",
            "@height": "138",
            "@width": "219",
            "@_fa": "true",
            "$": "https://api.elsevier.com/content/object/eid/1-s2.0-S2468823122001857-gr6.sml?httpAccept=%2A%2F%2A",
            "@multimediatype": "GIF image file",
            "@type": "IMAGE-THUMBNAIL",
            "@size": "11802",
            "@ref": "gr6",
            "@mimetype": "image/gif"
          },
          {
            "@category": "thumbnail",
            "@height": "164",
            "@width": "211",
            "@_fa": "true",
            "$": "https://api.elsevier.com/content/object/eid/1-s2.0-S2468823122001857-gr3.sml?httpAccept=%2A%2F%2A",
            "@multimediatype": "GIF image file",
            "@type": "IMAGE-THUMBNAIL",
            "@size": "21708",
            "@ref": "gr3",
            "@mimetype": "image/gif"
          },
          {
            "@category": "thumbnail",
            "@height": "139",
            "@width": "219",
            "@_fa": "true",
            "$": "https://api.elsevier.com/content/object/eid/1-s2.0-S2468823122001857-gr4.sml?httpAccept=%2A%2F%2A",
            "@multimediatype": "GIF image file",
            "@type": "IMAGE-THUMBNAIL",
            "@size": "12673",
            "@ref": "gr4",
            "@mimetype": "image/gif"
          },
          {
            "@category": "thumbnail",
            "@height": "158",
            "@width": "219",
            "@_fa": "true",
            "$": "https://api.elsevier.com/content/object/eid/1-s2.0-S2468823122001857-gr1.sml?httpAccept=%2A%2F%2A",
            "@multimediatype": "GIF image file",
            "@type": "IMAGE-THUMBNAIL",
            "@size": "13579",
            "@ref": "gr1",
            "@mimetype": "image/gif"
          },
          {
            "@category": "thumbnail",
            "@height": "163",
            "@width": "152",
            "@_fa": "true",
            "$": "https://api.elsevier.com/content/object/eid/1-s2.0-S2468823122001857-gr2.sml?httpAccept=%2A%2F%2A",
            "@multimediatype": "GIF image file",
            "@type": "IMAGE-THUMBNAIL",
            "@size": "11480",
            "@ref": "gr2",
            "@mimetype": "image/gif"
          },
          {
            "@category": "thumbnail",
            "@height": "129",
            "@width": "219",
            "@_fa": "true",
            "$": "https://api.elsevier.com/content/object/eid/1-s2.0-S2468823122001857-ga1.sml?httpAccept=%2A%2F%2A",
            "@multimediatype": "GIF image file",
            "@type": "IMAGE-THUMBNAIL",
            "@size": "12485",
            "@ref": "ga1",
            "@mimetype": "image/gif"
          },
          {
            "@category": "high",
            "@height": "1384",
            "@width": "1742",
            "@_fa": "true",
            "$": "https://api.elsevier.com/content/object/eid/1-s2.0-S2468823122001857-gr7_lrg.jpg?httpAccept=%2A%2F%2A",
            "@multimediatype": "JPEG image file",
            "@type": "IMAGE-HIGH-RES",
            "@size": "761289",
            "@ref": "gr7",
            "@mimetype": "image/jpeg"
          },
          {
            "@category": "high",
            "@height": "1366",
            "@width": "1742",
            "@_fa": "true",
            "$": "https://api.elsevier.com/content/object/eid/1-s2.0-S2468823122001857-gr8_lrg.jpg?httpAccept=%2A%2F%2A",
            "@multimediatype": "JPEG image file",
            "@type": "IMAGE-HIGH-RES",
            "@size": "524834",
            "@ref": "gr8",
            "@mimetype": "image/jpeg"
          },
          {
            "@category": "high",
            "@height": "1410",
            "@width": "3583",
            "@_fa": "true",
            "$": "https://api.elsevier.com/content/object/eid/1-s2.0-S2468823122001857-gr5_lrg.jpg?httpAccept=%2A%2F%2A",
            "@multimediatype": "JPEG image file",
            "@type": "IMAGE-HIGH-RES",
            "@size": "516394",
            "@ref": "gr5",
            "@mimetype": "image/jpeg"
          },
          {
            "@category": "high",
            "@height": "2252",
            "@width": "3583",
            "@_fa": "true",
            "$": "https://api.elsevier.com/content/object/eid/1-s2.0-S2468823122001857-gr6_lrg.jpg?httpAccept=%2A%2F%2A",
            "@multimediatype": "JPEG image file",
            "@type": "IMAGE-HIGH-RES",
            "@size": "839386",
            "@ref": "gr6",
            "@mimetype": "image/jpeg"
          },
          {
            "@category": "high",
            "@height": "1353",
            "@width": "1742",
            "@_fa": "true",
            "$": "https://api.elsevier.com/content/object/eid/1-s2.0-S2468823122001857-gr3_lrg.jpg?httpAccept=%2A%2F%2A",
            "@multimediatype": "JPEG image file",
            "@type": "IMAGE-HIGH-RES",
            "@size": "1117134",
            "@ref": "gr3",
            "@mimetype": "image/jpeg"
          },
          {
            "@category": "high",
            "@height": "1588",
            "@width": "2500",
            "@_fa": "true",
            "$": "https://api.elsevier.com/content/object/eid/1-s2.0-S2468823122001857-gr4_lrg.jpg?httpAccept=%2A%2F%2A",
            "@multimediatype": "JPEG image file",
            "@type": "IMAGE-HIGH-RES",
            "@size": "569112",
            "@ref": "gr4",
            "@mimetype": "image/jpeg"
          },
          {
            "@category": "high",
            "@height": "1260",
            "@width": "1742",
            "@_fa": "true",
            "$": "https://api.elsevier.com/content/object/eid/1-s2.0-S2468823122001857-gr1_lrg.jpg?httpAccept=%2A%2F%2A",
            "@multimediatype": "JPEG image file",
            "@type": "IMAGE-HIGH-RES",
            "@size": "337917",
            "@ref": "gr1",
            "@mimetype": "image/jpeg"
          },
          {
            "@category": "high",
            "@height": "3852",
            "@width": "3583",
            "@_fa": "true",
            "$": "https://api.elsevier.com/content/object/eid/1-s2.0-S2468823122001857-gr2_lrg.jpg?httpAccept=%2A%2F%2A",
            "@multimediatype": "JPEG image file",
            "@type": "IMAGE-HIGH-RES",
            "@size": "2696390",
            "@ref": "gr2",
            "@mimetype": "image/jpeg"
          },
          {
            "@category": "high",
            "@height": "787",
            "@width": "1333",
            "@_fa": "true",
            "$": "https://api.elsevier.com/content/object/eid/1-s2.0-S2468823122001857-ga1_lrg.jpg?httpAccept=%2A%2F%2A",
            "@multimediatype": "JPEG image file",
            "@type": "IMAGE-HIGH-RES",
            "@size": "186292",
            "@ref": "ga1",
            "@mimetype": "image/jpeg"
          },
          {
            "@category": "standard",
            "@_fa": "true",
            "$": "https://api.elsevier.com/content/object/eid/1-s2.0-S2468823122001857-mmc1.docx?httpAccept=%2A%2F%2A",
            "@multimediatype": "Microsoft Word file",
            "@type": "APPLICATION",
            "@size": "4673672",
            "@ref": "mmc1",
            "@mimetype": "application/word"
          },
          {
            "@category": "thumbnail",
            "@_fa": "true",
            "$": "https://api.elsevier.com/content/object/eid/1-s2.0-S2468823122001857-si1.svg?httpAccept=%2A%2F%2A",
            "@multimediatype": "Scalable Vector Graphics file",
            "@type": "ALTIMG",
            "@size": "17586",
            "@ref": "si1",
            "@mimetype": "image/svg+xml"
          },
          {
            "@category": "thumbnail",
            "@_fa": "true",
            "$": "https://api.elsevier.com/content/object/eid/1-s2.0-S2468823122001857-si2.svg?httpAccept=%2A%2F%2A",
            "@multimediatype": "Scalable Vector Graphics file",
            "@type": "ALTIMG",
            "@size": "12184",
            "@ref": "si2",
            "@mimetype": "image/svg+xml"
          },
          {
            "@category": "thumbnail",
            "@_fa": "true",
            "$": "https://api.elsevier.com/content/object/eid/1-s2.0-S2468823122001857-si3.svg?httpAccept=%2A%2F%2A",
            "@multimediatype": "Scalable Vector Graphics file",
            "@type": "ALTIMG",
            "@size": "5296",
            "@ref": "si3",
            "@mimetype": "image/svg+xml"
          },
          {
            "@category": "thumbnail",
            "@_fa": "true",
            "$": "https://api.elsevier.com/content/object/eid/1-s2.0-S2468823122001857-si4.svg?httpAccept=%2A%2F%2A",
            "@multimediatype": "Scalable Vector Graphics file",
            "@type": "ALTIMG",
            "@size": "13525",
            "@ref": "si4",
            "@mimetype": "image/svg+xml"
          },
          {
            "@category": "thumbnail",
            "@_fa": "true",
            "$": "https://api.elsevier.com/content/object/eid/1-s2.0-S2468823122001857-si5.svg?httpAccept=%2A%2F%2A",
            "@multimediatype": "Scalable Vector Graphics file",
            "@type": "ALTIMG",
            "@size": "14275",
            "@ref": "si5",
            "@mimetype": "image/svg+xml"
          },
          {
            "@category": "thumbnail",
            "@_fa": "true",
            "$": "https://api.elsevier.com/content/object/eid/1-s2.0-S2468823122001857-si6.svg?httpAccept=%2A%2F%2A",
            "@multimediatype": "Scalable Vector Graphics file",
            "@type": "ALTIMG",
            "@size": "1128",
            "@ref": "si6",
            "@mimetype": "image/svg+xml"
          },
          {
            "@category": "standard",
            "@_fa": "true",
            "$": "https://api.elsevier.com/content/object/eid/1-s2.0-S2468823122001857-am.pdf?httpAccept=%2A%2F%2A",
            "@multimediatype": "Acrobat PDF file",
            "@type": "AAM-PDF",
            "@size": "3585055",
            "@ref": "am",
            "@mimetype": "application/pdf"
          }
        ]
      },
      "link": {
        "@rel": "abstract",
        "@href": "https://api.elsevier.com/content/abstract/scopus_id/85128676341"
      }
    }
  }
}