{
  "metadata": {
    "title": "Reaction-driven protonation of pyridine nitrogen as active sites for efficient acetylene hydrochlorination",
    "authors": "; ; ",
    "journal": "Molecular Catalysis",
    "date": "2024-06-15",
    "doi": "10.1016/j.mcat.2024.114240",
    "abstract": "",
    "uri": "https://api.elsevier.com/content/article/pii/S2468823124004231",
    "pii": "S2468823124004231"
  },
  "fulltext": {
    "full-text-retrieval-response": {
      "scopus-eid": "2-s2.0-85194056560",
      "originalText": "serial JL 315758 291210 291744 291790 291809 31 Molecular Catalysis MOLECULARCATALYSIS 2024-05-28 2024-05-28 2024-05-28 2024-05-28 2024-12-20T16:03:32 1-s2.0-S2468823124004231 S2468-8231(24)00423-1 S2468823124004231 10.1016/j.mcat.2024.114240 S300 S300.1 FULL-TEXT 1-s2.0-S2468823124X00097 2024-12-20T19:02:06.189517Z 0 0 20240615 2024 2024-05-28T03:38:11.56833Z absattachment articleinfo articlenumber articletitlenorm authfirstinitialnorm authfirstsurnamenorm cid cids contenttype copyright crossmark dateloaded dateloadedtxt datesearch datesort dateupdated dco docsubtype doctype doi eid ewtransactionid hubeid indexeddate issn issnnorm itemstage itemtransactionid itemweight openaccess openarchive pg pgfirst pii piinorm pubdatestart pubdatetxt pubyr sectiontitle sortorder srctitle srctitlenorm srctype ssids alllist content subj subheadings suppl tomb volfirst volissue volumelist webpdf webpdfpagecount yearnav figure table e-component body mmlmath acknowledge affil appendices articletitle auth authfirstini authfull authkeywords authlast footnotes grantnumber grantsponsor grantsponsorid highlightsabst primabst ref specialabst 2468-8231 24688231 true 563 563 C Volume 563 9 114240 114240 114240 20240615 15 June 2024 2024-06-15 2024 Regular Papers article fla © 2024 Published by Elsevier B.V. REACTIONDRIVENPROTONATIONPYRIDINENITROGENACTIVESITESFOREFFICIENTACETYLENEHYDROCHLORINATION WANG S 1 Introduction 2 Experimental 2.1 Materials 2.2 Catalyst preparation 2.3 Catalyst characterization 2.4 Catalyst tests 2.5 Computational details 3 Results and discussion 3.1 Synthesis and characterization of the CN catalysts 3.2 Catalytic performance 3.3 Catalytic descriptors evaluation 3.4 Long-term stability test and regeneration of the CN-800 catalyst 4 Conclusions CRediT authorship contribution statement Appendix Supplementary materials References NKSOSI 1991 366 377 B HUTCHINGS 2005 55 61 G CONTE 2007 231 239 M CONTE 2008 190 198 M CONTE 2008 165 167 M WANG 2009 102 109 S MALTA 2017 1399 1403 G ZHAO 2015 1152 1160 J ZHAO 2021 334 346 J ZHOU 2015 356 364 K ZHANG 2013 829 836 H CHEN 2024 965 980 Z SONG 2010 1825 1833 Q KRASNYAKOVA 2012 33 43 T WANG 2013 187 194 L ZHAO 2019 38 46 J GIULIMONDI 2023 5557 5570 V KAISER 2020 376 385 S KAISER 2021 4016 4024 S KAISER 2022 606 612 S ZHANG 2023 3103 3113 Q SHANG 2017 3510 3520 S WANG 2020 1683 1691 X ZHANG 2021 7350 7356 H YANG 2023 1141 1153 Y WANG 2023 119382 119391 S YUE 2023 9777 9791 Y WANG 2023 1128 1140 B JIA 2022 20401 20410 Y FAUSTAKL 2023 2211464 2211476 D ZHANG 2023 8307 8316 T QIU 2020 14877 14880 Y CHAO 2017 39789 39798 S QIU 2019 406 412 Y WANG 2018 72 78 J LI 2014 3688 3695 X LIN 2018 1114 1121 R WU 2022 112719 112728 S LI 2021 194 203 F YUE 2020 5174 5177 Y ALI 2019 574 580 S ZHAO 2019 240 249 J QI 2020 34612 34620 X PANOMSUWAN 2016 6962 6971 G AYIANIA 2020 528 544 M HELLGREN 2005 19 34 N RABCHINSKII 2021 593 604 M WANGX2024X114240 WANGX2024X114240XS 2026-05-28T00:00:00.000Z 2026-05-28T00:00:00.000Z http://creativecommons.org/licenses/by-nc-nd/4.0/ © 2024 Published by Elsevier B.V. 2024-05-29T08:19:37.439Z http://vtw.elsevier.com/data/voc/AddOnTypes/50.7/aggregated-refined NSFC 21606199 21976129 NSFC National Natural Science Foundation of China http://data.elsevier.com/vocabulary/SciValFunders/501100001809 http://sws.geonames.org/1814991/ National Key Research and Development Program of China 2021YFA1501802 NKRDPC National Key Research and Development Program of China http://data.elsevier.com/vocabulary/SciValFunders/501100012166 http://sws.geonames.org/1814991/ Zhejiang Provincial Key R&D Project 2023C01211 Financial support from the National Key Research and Development Program of China ( 2021YFA1501802 ), Zhejiang Provincial Key R&D Project ( 2023C01211 ) and the Financial support from the National Natural Science Foundation of China (NSFC; grant No. 21606199, 21976129 ) are gratefully acknowledged. https://doi.org/10.15223/policy-017 https://doi.org/10.15223/policy-037 https://doi.org/10.15223/policy-012 https://doi.org/10.15223/policy-029 https://doi.org/10.15223/policy-004 item S2468-8231(24)00423-1 S2468823124004231 1-s2.0-S2468823124004231 10.1016/j.mcat.2024.114240 315758 2024-12-20T19:02:06.189517Z 2024-06-15 1-s2.0-S2468823124004231-main.pdf https://s3-eu-west-1.amazonaws.com/prod-ucs-content-store-eu-west/content/pii:S2468823124004231/MAIN/application/pdf/fc335c5b9d62e96827d549e6772da6f7/main.pdf main.pdf pdf true 6582522 MAIN 10 1-s2.0-S2468823124004231-main_1.png https://s3-eu-west-1.amazonaws.com/prod-ucs-content-store-eu-west/content/pii:S2468823124004231/PREVIEW/image/png/e4891487de12b6cf2b36a478da3feda6/main_1.png main_1.png png 57262 849 656 IMAGE-WEB-PDF 1 1-s2.0-S2468823124004231-gr2.jpg https://s3-eu-west-1.amazonaws.com/prod-ucs-content-store-eu-west/content/pii:S2468823124004231/gr2/DOWNSAMPLED/image/jpeg/18bc5f516a19f036118355e6c7a702f8/gr2.jpg gr2 gr2.jpg jpg 140134 819 659 IMAGE-DOWNSAMPLED 1-s2.0-S2468823124004231-ga1.jpg https://s3-eu-west-1.amazonaws.com/prod-ucs-content-store-eu-west/content/pii:S2468823124004231/ga1/DOWNSAMPLED/image/jpeg/cbdbd16b1a3021679d5598d30ddd7c6b/ga1.jpg ga1 true ga1.jpg jpg 25670 200 390 IMAGE-DOWNSAMPLED 1-s2.0-S2468823124004231-gr3.jpg https://s3-eu-west-1.amazonaws.com/prod-ucs-content-store-eu-west/content/pii:S2468823124004231/gr3/DOWNSAMPLED/image/jpeg/6267fd61d3ce2206c552144313053d98/gr3.jpg gr3 gr3.jpg jpg 77790 572 659 IMAGE-DOWNSAMPLED 1-s2.0-S2468823124004231-gr1.jpg https://s3-eu-west-1.amazonaws.com/prod-ucs-content-store-eu-west/content/pii:S2468823124004231/gr1/DOWNSAMPLED/image/jpeg/786fd8eb7aed3c5705741e149f5e86b2/gr1.jpg gr1 gr1.jpg jpg 70467 339 659 IMAGE-DOWNSAMPLED 1-s2.0-S2468823124004231-gr6.jpg https://s3-eu-west-1.amazonaws.com/prod-ucs-content-store-eu-west/content/pii:S2468823124004231/gr6/DOWNSAMPLED/image/jpeg/022cb1650d8ee9af6883530d66198b82/gr6.jpg gr6 gr6.jpg jpg 77674 442 659 IMAGE-DOWNSAMPLED 1-s2.0-S2468823124004231-gr4.jpg https://s3-eu-west-1.amazonaws.com/prod-ucs-content-store-eu-west/content/pii:S2468823124004231/gr4/DOWNSAMPLED/image/jpeg/7a2e7ddda0e8e2b8bb7f36a9033ade18/gr4.jpg gr4 gr4.jpg jpg 48656 248 659 IMAGE-DOWNSAMPLED 1-s2.0-S2468823124004231-gr5.jpg https://s3-eu-west-1.amazonaws.com/prod-ucs-content-store-eu-west/content/pii:S2468823124004231/gr5/DOWNSAMPLED/image/jpeg/957aea0d1bdfc33d8d3c3e14c9fd9be0/gr5.jpg gr5 gr5.jpg jpg 70319 357 659 IMAGE-DOWNSAMPLED 1-s2.0-S2468823124004231-gr2.sml https://s3-eu-west-1.amazonaws.com/prod-ucs-content-store-eu-west/content/pii:S2468823124004231/gr2/THUMBNAIL/image/gif/5f8c6c91ab7bd177f9c0acb11d054401/gr2.sml gr2 gr2.sml sml 11193 164 132 IMAGE-THUMBNAIL 1-s2.0-S2468823124004231-ga1.sml https://s3-eu-west-1.amazonaws.com/prod-ucs-content-store-eu-west/content/pii:S2468823124004231/ga1/THUMBNAIL/image/gif/ae68cf49f2f0fb79fd2e2a9fd13e6030/ga1.sml ga1 true ga1.sml sml 12634 112 219 IMAGE-THUMBNAIL 1-s2.0-S2468823124004231-gr3.sml https://s3-eu-west-1.amazonaws.com/prod-ucs-content-store-eu-west/content/pii:S2468823124004231/gr3/THUMBNAIL/image/gif/f2f4af8d60647f3a90458bf6b7394c2c/gr3.sml gr3 gr3.sml sml 13341 164 189 IMAGE-THUMBNAIL 1-s2.0-S2468823124004231-gr1.sml https://s3-eu-west-1.amazonaws.com/prod-ucs-content-store-eu-west/content/pii:S2468823124004231/gr1/THUMBNAIL/image/gif/c931f23d7993ad95e65670cb52be803f/gr1.sml gr1 gr1.sml sml 17300 113 219 IMAGE-THUMBNAIL 1-s2.0-S2468823124004231-gr6.sml https://s3-eu-west-1.amazonaws.com/prod-ucs-content-store-eu-west/content/pii:S2468823124004231/gr6/THUMBNAIL/image/gif/b5fa23e2354d71ab54c7e2523b64db85/gr6.sml gr6 gr6.sml sml 14600 147 219 IMAGE-THUMBNAIL 1-s2.0-S2468823124004231-gr4.sml https://s3-eu-west-1.amazonaws.com/prod-ucs-content-store-eu-west/content/pii:S2468823124004231/gr4/THUMBNAIL/image/gif/159625f258a0e9fb92407b24287f663d/gr4.sml gr4 gr4.sml sml 9172 83 219 IMAGE-THUMBNAIL 1-s2.0-S2468823124004231-gr5.sml https://s3-eu-west-1.amazonaws.com/prod-ucs-content-store-eu-west/content/pii:S2468823124004231/gr5/THUMBNAIL/image/gif/f87c9c0b80c9f227c737801f2ae959a2/gr5.sml gr5 gr5.sml sml 11997 119 219 IMAGE-THUMBNAIL 1-s2.0-S2468823124004231-gr2_lrg.jpg https://s3-eu-west-1.amazonaws.com/prod-ucs-content-store-eu-west/content/pii:S2468823124004231/HIGHRES/image/jpeg/e66895bf97be41ed4ab34ca79bad89ce/gr2_lrg.jpg gr2 gr2_lrg.jpg jpg 1116658 3627 2917 IMAGE-HIGH-RES 1-s2.0-S2468823124004231-ga1_lrg.jpg https://s3-eu-west-1.amazonaws.com/prod-ucs-content-store-eu-west/content/pii:S2468823124004231/HIGHRES/image/jpeg/09c91614d84cd8ba86c7ceadfd496525/ga1_lrg.jpg ga1 true ga1_lrg.jpg jpg 214436 886 1726 IMAGE-HIGH-RES 1-s2.0-S2468823124004231-gr3_lrg.jpg https://s3-eu-west-1.amazonaws.com/prod-ucs-content-store-eu-west/content/pii:S2468823124004231/HIGHRES/image/jpeg/d49912046960aa9902180da08462df50/gr3_lrg.jpg gr3 gr3_lrg.jpg jpg 598753 2534 2917 IMAGE-HIGH-RES 1-s2.0-S2468823124004231-gr1_lrg.jpg https://s3-eu-west-1.amazonaws.com/prod-ucs-content-store-eu-west/content/pii:S2468823124004231/HIGHRES/image/jpeg/c8151179652a9ca10708d9b5601d2d4f/gr1_lrg.jpg gr1 gr1_lrg.jpg jpg 611280 1502 2917 IMAGE-HIGH-RES 1-s2.0-S2468823124004231-gr6_lrg.jpg https://s3-eu-west-1.amazonaws.com/prod-ucs-content-store-eu-west/content/pii:S2468823124004231/HIGHRES/image/jpeg/3a395c871b29d4431c41431e1baee5fc/gr6_lrg.jpg gr6 gr6_lrg.jpg jpg 621178 1958 2917 IMAGE-HIGH-RES 1-s2.0-S2468823124004231-gr4_lrg.jpg https://s3-eu-west-1.amazonaws.com/prod-ucs-content-store-eu-west/content/pii:S2468823124004231/HIGHRES/image/jpeg/c6cbdf0e6eb77044ae47397c04e0dfe0/gr4_lrg.jpg gr4 gr4_lrg.jpg jpg 401540 1099 2917 IMAGE-HIGH-RES 1-s2.0-S2468823124004231-gr5_lrg.jpg https://s3-eu-west-1.amazonaws.com/prod-ucs-content-store-eu-west/content/pii:S2468823124004231/HIGHRES/image/jpeg/421e3884591f4a65e52cc01bb4057ebe/gr5_lrg.jpg gr5 gr5_lrg.jpg jpg 546582 1580 2917 IMAGE-HIGH-RES 1-s2.0-S2468823124004231-mmc1.docx https://s3-eu-west-1.amazonaws.com/prod-ucs-content-store-eu-west/content/pii:S2468823124004231/mmc1/MAIN/application/vnd.openxmlformats-officedocument.wordprocessingml.document/dbdd223bd170a5d32c471cda954fb401/mmc1.docx mmc1 mmc1.docx docx 1745949 APPLICATION 1-s2.0-S2468823124004231-si1.svg https://s3-eu-west-1.amazonaws.com/prod-ucs-content-store-eu-west/content/pii:S2468823124004231/image/svg+xml/1e53f71efb4e409a59f1bef3eaa45821/si1.svg si1 si1.svg svg 16055 ALTIMG 1-s2.0-S2468823124004231-si2.svg https://s3-eu-west-1.amazonaws.com/prod-ucs-content-store-eu-west/content/pii:S2468823124004231/image/svg+xml/fd00f51cfa9d1f91192a3740e9b99cfe/si2.svg si2 si2.svg svg 16402 ALTIMG 1-s2.0-S2468823124004231-si3.svg https://s3-eu-west-1.amazonaws.com/prod-ucs-content-store-eu-west/content/pii:S2468823124004231/image/svg+xml/3d4598307d4a6cda1192ffe44f734505/si3.svg si3 si3.svg svg 12262 ALTIMG 1-s2.0-S2468823124004231-am.pdf https://s3-eu-west-1.amazonaws.com/prod-ucs-content-store-eu-west/content/egi:10C24LC7GQS/MAIN/application/pdf/6989ca56d0feb8f5f3c4d77ee699c470/am.pdf am am.pdf pdf false 1293260 AAM-PDF MCAT 114240 114240 S2468-8231(24)00423-1 10.1016/j.mcat.2024.114240 Fig. 1 (a) Schematic illustration for the synthesis of CN materials. (b) and c SEM images of CN-800. (d) TEM images of CN-800. (e) corresponding element mapping images showing the distribution of C (yellow), N (green), O (red) within the catalyst. Fig 1 Fig. 2 (a) Raman spectra of the CN-X materials. (b) XRD patterns of the CN-X materials. (c) N 1 s XPS spectra of the CN-X materials, and (d) corresponding N contents of the CN-X materials. Fig 2 Fig. 3 (a) C2H2 Conversion over CN-X catalysts at a GHSV(C2H2) of 90 h −1 and 180 °C; (b) C2H2 Conversion over the CN-800 catalyst at different reaction temperatures, GHSV(C2H2) = 90 h −1; (c) C2H2 Conversion over the CN-800 catalyst at different GHSV(C2H2), Tem. = 220 °C; (d) VCM productivities of CN-800 and other catalysts reported in the literature. The red points indicate the productivity of the CN-800 catalyst at different GHSV(C2H2) values. Fig 3 Fig. 4 (a) Radar plot charting the relation of the catalytic activity with respective indicators for the activity. (b) respectively and the relationship between different kinds of nitrogen species content and the catalytic performance of CN-X materials. Fig 4 Fig. 5 (a) HCl-TPD profiles of CN-X catalysts; (b) C2H2-TPD profiles of CN-X catalysts; (c) Adsorption energies of C2H2 and HCl. Bond lengths of HCl at different adsorption sites: pyridinic N (d), pyrolic N (e), graphitic N (f), pyridinic N + O − (g) and Protonated pyridinic N (h). Fig 5 Fig. 6 (a) Long-term stability test of the CN-800 catalyst, reaction conditions:GHSV(C2H2) = 360 h −1, Temperature = 220 °C. (b) The specific surface area and performance of the CN-800 catalyst in different states. (c) and (d) N 1 s XPS of CN-800–50 h and used CN-800-Re catalysts. Fig 6 Table 1 Textural properties of the CN catalysts. Table 1 Sample SBET (m2 g‒1) a Volume (cm3 g‒1) b Diameter (nm) c CN-600 202 0.05 3.04 CN-600–12h 55 0.03 3.04 CN-700 537 0.27 2.75 CN-700–12h 254 0.12 2.75 CN-800 535 0.26 2.74 CN-800–12h 243 0.11 2.73 CN-800–50h 43 0.02 3.81 CN-800-Re 317 0.16 2.78 CN-900 485 0.28 2.74 CN-900–12h 397 0.13 3.05 a Measured using the Brunauer‐Emmett‐Teller (BET) method. b calculated based on the adsorbed N2 vol. c determined by the Barret-Joyner-Halenda (BJH) method. Reaction-driven protonation of pyridine nitrogen as active sites for efficient acetylene hydrochlorination Saisai Wang Writing – review & editing Writing – original draft Formal analysis Data curation a † Zhixin Liu Validation Investigation Formal analysis Conceptualization a † Da Xu Visualization Validation a Siyu Pei Visualization Validation Conceptualization a Jianbo Wu Data curation a Kaixuan Zhuge Software a Chunxiao Jin Software a Haiting Cai Writing – review & editing Conceptualization a Renqin Chang Visualization Validation c Yuxue Yue Writing – review & editing Formal analysis a b Jia Zhao Writing – review & editing Investigation Funding acquisition a ⁎ Xiaonian Li Writing – review & editing Funding acquisition a a Industrial Catalysis Institute of Zhejiang University of Technology, Hangzhou 310014, China Industrial Catalysis Institute of Zhejiang University of Technology Hangzhou 310014 China aIndustrial Catalysis Institute of Zhejiang University of Technology, Hangzhou 310014, China b Department of Environmental Engineering, Zhejiang University of Technology, Hangzhou 310014, China Department of Environmental Engineering Zhejiang University of Technology Hangzhou 310014 China bDepartment of Environmental Engineering, Zhejiang University of Technology, Hangzhou 310014, China c Research Center of Analysis Measurement of Zhejiang University of Technology, Hangzhou 310014, China Research Center of Analysis Measurement of Zhejiang University of Technology Hangzhou 310014 China cResearch Center of Analysis Measurement of Zhejiang University of Technology, Hangzhou 310014, China ⁎ Corresponding author. † These authors contributed equally. Non-metallic catalysts present significant potential for environmentally friendly industrialization of acetylene hydrochlorination. However, the challenge of low activity in non-metallic catalysts hampers their practical application. In this study, we propose the use of a dual-template method to fabricate a layered N-doped carbon catalyst, subsequently applying it to acetylene hydrochlorination reactions. Experimental results indicate that the catalyst exhibits exceptional catalytic performance in acetylene hydrochlorination. Combined with characterization results, the catalyst's performance is positively correlated with its surface area and nitrogen content. Furthermore, DFT calculations suggest that protonated pyridinic nitrogen and pyridinic N + O − have moderate adsorption on HCl, potentially serving as active sites for the catalyst. This study analyzes the impact of various parameters of N-doped carbon catalysts on catalytic performance, providing direction for developing non-metallic catalysts suitable for industrial applications. Graphical abstract Image, graphical abstract Keywords Acetylene hydrochlorination Metal-free catalyst N-doping Data availability Data will be made available on request. 1 Introduction Polyvinyl chloride (PVC), ranked as the world's third-largest polymer, acquires the vinyl chloride monomer needed for polymerization through the catalytic reaction of acetylene and hydrogen chloride. However, the use of HgCl2 catalyst in this production process poses substantial environmental challenges and poses severe risks to human health. A notable instance is the Minamata disease, recognized as one of the world's eight major environmental pollution incidents. In safeguarding public health, the international community unanimously embraced the Minamata Convention, imposing stringent restrictions on the utilization of toxic mercury (Hg) catalysts [1–6]. Considering the irreplaceability of the calcium carbide method, particularly in coal-rich China, the imperative development of more environmentally friendly, mercury-free catalysts has emerged as an exceptionally important research topic. Over the past few decades, researchers have predominantly concentrated on noble metal catalysts renowned for their high activity, such as Au [7–12], Pd [13–16], Pt [17–21], Ru [22–26]. However, the cost associated with noble metals and challenges linked to the reduction of catalytic active centers impose limitations on their applications. Non-noble metals, exemplified by Cu [27–31], generally exhibit lower performance and poorer stability compared to their noble metal counterparts. In contrast to metal catalysts, environmentally friendly carbon materials, distinguished by high defects, tunable surface properties, and robust mechanical strength, have garnered widespread attention in the realm of acetylene hydrochlorination. To investigate the active centers of carbon carriers, Li et al. [32]. selected nanodiamond and graphite-based carbons as catalysts. They adjusted the hybrid ratio (sp2: sp3) in the carbon carriers to scrutinize the influence of this ratio on the activity of carbon-based catalysts in acetylene hydrochlorination. The results reveal a volcano relationship between the surface hybrid structure of non-metallic carbon catalysts and their catalytic performance during the acetylene hydrochlorination process, specifically with nanodiamond-oriented and graphite-oriented carbon catalysts. The optimized surface sp2 content for nanodiamond-oriented carbon and the optimized surface sp3 content for graphite-oriented carbon both fall within the range of 32–35 %. It is noteworthy that, owing to the uniform charge distribution and structural stability of carbon-based materials, their interaction with reactants is weakened, leading to a failure of their catalytic performance to meet industrial requirements. Doping heteroatoms, such as N [33–39], B [40,41], P [42], S [43], etc., not only generates additional defect sites on the carbon base but also strengthens the adsorption and activation of reactants, thereby enhancing the catalytic performance of doped catalysts. Nitrogen doping, among these heteroatoms, has attracted significant attention due to the ease of obtaining nitrogen sources and the exceptional catalytic performance demonstrated by nitrogen-doped catalysts. In a study conducted by Bao et al., a pyrrolic nitrogen-doped carbon-based catalyst was synthesized by cultivating an NC layer on pre-formed silicon carbide particles, placing particular emphasis on identifying pyrrolic nitrogen as the active site [36]. Perez-Ramirez and colleagues synthesized nitrogen-doped carbon catalysts with varying electrical conductivities through the carbonization of aniline polymers [37]. They emphasized the role of a high pyrrolic nitrogen content in promoting reactant adsorption, while good conductivity additionally influences the surface diffusion of adsorbed species. These factors collectively contribute to the overall catalytic performance. In a separate study, Li and team prepared a CNH3 catalyst with a notable pyridinic nitrogen content through the thermolysis of ZIF-8 in an NH3 atmosphere [33]. Comparative analysis with the CN2 catalyst, characterized by a high pyrrolic nitrogen content, revealed that CNH3 exhibited superior catalytic performance, suggesting that the active site might be attributed to pyridinic nitrogen. Cao and colleagues employed walnut shell as a raw material to fabricate nitrogen-doped carbon catalysts with a high content of graphitic nitrogen through pyrolysis [38]. The catalyst's activity was attributed to the presence of graphitic nitrogen sites. In a separate study, Zhang and team induced the in-situ copolymerization of pyrrole and aniline, followed by thermal treatment to obtain a hollow structure-decorated carbon material derived from the copolymerization of polyaniline and pyrrole [39]. The material exhibited abundant pyridinic N + O − sites, which played a crucial role in activating HCl molecules and facilitating the reaction. However, it is worth noting that the current research on heteroatom-doped carbon often primarily focuses on analyzing potential active sites, potentially overlooking other properties of the material itself. In this investigation, we employed a soft template, namely, an ionic liquid, to dissolve naturally abundant casein, serving as a source of carbon and nitrogen, while MgCl2 functioned as a hard template to establish an expanded pore structure. Layered N-doped materials were synthesized at diverse carbonization temperatures, displaying exceptional catalytic performance in acetylene hydrochlorination reactions. Through a comprehensive analysis of the CN catalyst's performance and various parameters, we identified the essential properties that nitrogen-doped carbon catalysts should possess. Additionally, we utilized DFT theoretical calculations to scrutinize the active sites of the catalyst. The long-term experiments and regeneration studies on the catalyst demonstrate its tremendous industrial application prospects. The outcomes of this study provide insights into the design of non-metal-based acetylene hydrochlorination catalysts that align with industrial demands. 2 Experimental 2.1 Materials The casein and hydrochloric acid (36–38 %) were purchased from Shanghai Titan. 1-Butyl-3-methylimidazole chloride (Bmim-Cl) was obtained from Shanghai chengjie. MgCl2 was purchased from Aladdin. Acetylene (C2H2, 98 %) and Hydrogen chloride (HCl, 99.999 %) was supplied by Hangzhou Minxing Chemical Technology Co., Ltd. All materials are without special treatment. 2.2 Catalyst preparation The CN materials derived from ionic liquids was prepared via a one-step method. First, weigh 20 g of ionic liquid and place it into a beaker, then heat it to 100 °C. Once the ionic liquid is completely melted, add 4 g of casein while maintaining the temperature at 100 °C and stirring at a speed of 300 r/min. After continuous stirring for 4 h, the casein is completely dissolved, and the mixture becomes a brownish sticky substance. Next, weigh 4 g of MgCl2 and add it to the mixture. Stir for 30 min, then pour the mixture into a quartz boat and subject it to pyrolysis in a tubular furnace. The gel-like mixture carbonizes into a black substance at high temperatures (600–900 °C). The resulting material is named CN-Mg-X, where CN-Mg-X represents a carbonization temperature of 600 °C. Subsequently, the obtained CN-Mg-X material is etched in a beaker containing 200 ml of hydrochloric acid (1 mol/ml) to remove Mg ions. After 12 h, clean several times the CN-X materials with deionized water and transfer it to an oven for drying. The resulting sample is named CN-X. 2.3 Catalyst characterization The Nitrogen adsorption-desorption isotherms of the investigated catalysts at 77 K were acquired using the Kubo X1000 gas adsorption instrument by BJ builder. Temperature-programmed analyses were conducted using the BJ PCA-1200 chemisorption analyzer, including C2H2 and HCl temperature-programmed desorption (TPD). In a typical experiment, approximately 100 mg of the sample was placed in a quartz reactor. Gaseous C2H2 or HCl gas (for TPD) was introduced into the quartz reactor at room temperature with a flow rate of 30 ml/min for 1 hour. Subsequently, helium (99.999 %, for TPD) was used to purge the samples and the pipeline for 1 hour. The reactor was then heated to 500 °C (for TPD) at a constant heating rate of 5 °C/min, while recording the C2H2 signal (TPD-MS) and HCl signal (TPD-TCD) data. Acetylene signals were detected using the Quantitative Gas Analysis Mass Spectrometer (QGA) from Hiden, UK. X-ray diffraction (XRD) spectra were recorded on a PANalytical-X'Pert PRO instrument. X-ray photoelectron spectroscopy (XPS) was carried out using the ESCALAB 250 X-ray photoelectron spectrometer with Al Kα X-rays (1489.6 eV, 150 W, 50.0 eV pass energy). The morphology and structure of the catalyst were examined using a scanning electron microscope (SEM) manufactured by Hitachi. Defects in CN materials were analyzed using a confocal Raman microscopy system (HORIBA HR Evolution5). High-resolution transmission electron microscopy (HR-TEM) was conducted using a Tecnai G2 F30 S-Twin microscope, operated at an acceleration potential of 300 kV (Uacc = 300 kV) with a cold-field emitter electron gun (∆E ≈ 0.35 eV). Samples were prepared by immersing a copper grid in an ethanol suspension of the solid and subsequently air-drying it. 2.4 Catalyst tests The performance testing of the prepared CN-Xs catalysts was conducted in a fixed-bed microreactor, as detailed in our previous work [26]. First, the required amount of catalyst (0.8 g) was loaded into the fixed-bed reactor (quartz tube). Prior to the reaction, the entire pipeline system was purged with nitrogen to eliminate the influence of water or other impurity gases on the reaction process Subsequently, the catalyst underwent treatment with HCl at 180 °C for 30 min. Following this, HCl (3 ml/min) and C2H2 (2.5 ml/min) were individually introduced into the reactor, the flow rates of each being meticulously regulated by separate mass flowmeters. Simultaneously, the temperature controller was employed to elevate the temperature of the catalyst bed to the desired set point (180 - 240 °C), maintaining a Gas Hourly Space Velocity (GHSV) of 90 h⁻¹ for C2H2. The gaseous effluent from the reactor system was subjected to treatment with a NaOH solution and subsequently analyzed using gas chromatography equipped with a Porapak N packed column (6 ft × 1/800 stainless steel). The peak areas were normalized for a thorough investigation of gas-phase products. The conversion was quantified by dividing the amount of reacted C2H2 by the total quantity of introduced C2H2. Selectivity to VCM was computed as the amount of VCM formed divided by the quantity of C2H2 reacted. Notably, the carbon balance, calculated based on these products, approached 100 % The conversion of acetylene and the productivity to VCM were calculated by Eqs. (1)-(2), as follows: (1) Acetylene conversion ( % ) = ( 1 − F A F A 0 ) * 100 % (2) Productivity = K g VCM K g cat . * h Where FA0, and FA represent the volume fraction of acetylene in the raw gas, and the volume fraction of remaining acetylene, respectively. 2.5 Computational details The mechanism governing acetylene hydrochlorination was elucidated through Density Functional Theory (DFT) calculations employing the Vienna Ab initio Simulation Package (VASP). Electronic exchange-correlation calculations were conducted using the generalized gradient approximation (GGA) method with the Perdew-Burke-Ernzerhof (PBE) functional. The interaction between the atomic nucleus and the valence electrons was modeled using the conjugated projection wave pseudopotential (PAW). A cutoff energy of 450 eV was applied for the plane wave basis set. Convergence was achieved utilizing the Gaussian smearing method with a bandwidth of 0.05 eV. The K-points mesh was optimized to 1 × 1 × 1 Γ-centered configuration. Convergence criteria for structure optimization and energy calculation were set at an energy convergence of 1.0 × 10–7 eV and an atomic force convergence of 0.05 eV/Å. The adsorption energies (Eads) of reactants or products on CN-Xs were calculated as part of the analysis. E ads = E sup + m o l e c u l e − E sup − E m o l e c u l e where Eads represents the adsorption energy; Esup+molecule represents the total energy of the adsorbed C2H2 or HCl with the model, Emolecule denotes the energy of the adsorbates in the ideal gas phase, and Esup indicates the energy of the N-containing model molecule. 3 Results and discussion 3.1 Synthesis and characterization of the CN catalysts The porous CN materials employed in this study were prepared using a one-pot pyrolysis and etching process, as illustrated in Fig. 1 a. In this method, an ionic liquid was employed as a soft template to dissolve casein, thereby serving as a carbon and nitrogen source. Additionally, MgCl2 acted as a hard template, aiding in the creation of pores within the CN material. To analyze the morphology and structural features of the CN materials, scanning electron microscopy (SEM) and transmission electron microscopy (TEM) techniques were utilized. Figs. 1b and 1c depict the porous layered structure of the CN-800 material. Further TEM characterization results (Fig. 1d) reveal that the CN-800 material exhibits a web-like two-dimensional structure resembling fine gauze. In addition, EDS-mapping (Fig. 1e, Figure S1) was employed to analyze the elemental distribution on the surface of the CN-800 material. As shown in the figure, the spectroscopic results indicate that abundant C (yellow), N (green), and O (red) elements are uniformly distributed on the surface of the CN-800 material. Among them, carbon (C) has the highest content, followed by nitrogen (N), and oxygen (O) has the lowest content, consistent with the results of XPS spectra (Figure S2, Table S1). However, it is worth noting that MgCl2 was not detected in the EDS-mapping spectrum, likely due to its low Mg content on the CN-800 material's surface, rendering it undetectable. In the XPS spectrum (Figure S2, Table S1), only trace amounts of Mg elements were detected, indicating the effective removal of metallic Mg. This study underscores the substantial influence of pyrolysis temperature and etching processes on the physical properties and structure of the material. The results are detailed in Table 1 and Figure S3, which illustrate the physical properties of CN-X materials at varying pyrolysis temperatures. As depicted in Figure S3, all CN materials exhibit Type II nitrogen adsorption-desorption isotherms. Notably, at lower temperatures, CN-600 (202 m2 g‒1) exhibits a lower specific surface area. However, as the temperature surpasses 700 °C, both CN-700 (537 m2 g‒1) and CN-800 (535 m2 g‒1) materials demonstrate higher specific surface areas. Remarkably, at 900 °C, the CN-900 (485 m2 g‒1) material starts to experience a decrease in specific surface area, pore size, and pore volume, potentially attributed to pore collapse induced by excessively high temperatures. Additionally, elevated temperatures promote the formation of dense graphite-like carbon nitride structures, leading to a further reduction in the material's specific surface area. Following the surface morphology characterization of the material, we conducted comprehensive analyses focusing on the crystal phase, defects, and nitrogen-element doping structure utilizing spectroscopic techniques. Initially, X-ray diffraction (XRD) was employed to assess the material's crystal phase structure. As depicted in Fig. 2 a, all specimens exhibit two distinct peaks at 2θ = 24.5° and 2θ = 43.5°, corresponding to the (002) and (101) crystal planes of carbon materials, respectively. Notably, as the carbonization temperature increases, the (002) diffraction peak of CN materials shifts significantly to higher diffraction angles, indicating a reduction in the average interlayer spacing of the carbon material. This shift may be attributed to an augmented nitrogen doping content, leading to a decrease in the graphite phase of the material. Raman spectroscopy was applied to assess the level of graphitization and the extent of defects in CN catalysts prepared at various pyrolysis temperatures, with the aim of investigating the impact of temperature on the catalyst's structure and performance. Fig. 2b illustrates two distinct characteristic peaks appearing at wavenumbers approximately 1346 cm−1 and 1602 cm−1, corresponding to the D peak and G peak of carbon materials, respectively. The ID/IG ratio, commonly used to evaluate structural defects and graphitization degree, was employed. It is evident that as the pyrolysis temperature increases, the ID/IG ratio initially rises from 1.03 (CN-600) to 1.06 and then decreases to 0.97 (CN-900). This trend suggests that at higher temperatures, the generation of defect sites becomes more prevalent. Previous studies have indicated that material defects facilitate the exposure of active sites, ultimately influencing the catalytic performance. However, when the temperature rises to 900 °C, a significant graphitization phenomenon becomes evident in the carbon material, aligning consistently with the BET results. The types and contents of the elements in the CN materials were meticulously examined through X-ray photoelectron spectroscopy (XPS) characterization. Data provided in Table S1 reveal that the predominant element in this catalyst is carbon (∼80 %). Due to the significant incorporation of N and O heteroatoms detected in the catalyst, the C 1 s XPS signal is resolved into six distinct species [44,45] (Figure S4 and Table S2). The CC sp2 peak (centered at 284.6 eV, content:∼62 %) is attributed to carbon atoms bonded exclusively to carbon neighbors, as found in graphite and amorphous carbon. The peak (content:∼17 %) at 285.5 eV is identified as C(Csp2-N), bonded with N through sp2 hybridization, as observed in pyridine and pyrrole, or as C existing in sp3 hybridized form. The third peak (content:∼10 %) at 286.1 eV can be attributed to CO (ether ground found in esters and lactone) or C N = O (nitrogen oxides). The fourth peak (content:∼3 %) is assigned to C = O (Pyridone) or NC = O (amide), located at 287.6 eV. Peaks at 288.1 eV and 289.1 eV are attributed to C = O (carbonyl, content:∼2 %) and OC = O (carboxyl, content:∼2 %), respectively. The last peak (content:∼2 %) at 291.1 eV corresponds to the π-π interaction of the carbon rings. Nitrogen doping acts as the primary active site for the catalyst. In the CN materials prepared in this study, a substantial nitrogen content is observed, particularly in CN-800, where the nitrogen content reaches 10.29 % (Table S1). Fig. 2c presents the XPS spectra of N 1 s along with the corresponding contents of various nitrogen species. The N 1 s spectrum displays four distinct peaks at 398.3, 400.3, 401.2, and 403.1 eV [44,46,47], corresponding to pyridinic nitrogen, pyrrolic nitrogen, graphitic nitrogen, and pyridinic N + O −. Data from Fig. 2d and Table S3 indicate that nitrogen primarily exists in the forms of pyridinic nitrogen and pyrrolic nitrogen. Notably, as the carbonization temperature increases, the content of pyridinic nitrogen and pyrrolic nitrogen in the catalyst gradually decreases. As indicated in Table S3, the content of pyridinic nitrogen decreases from 43.08 % (CN-600) to 33.64 % (CN-900), while the pyrrolic nitrogen content decreases from 45.65 % (CN-600) to 33 % (CN-900). Concurrently, there is an increase in graphitic nitrogen and pyridinic N + O −. Particularly at 900 °C, the transformation of nitrogen components toward graphitic nitrogen becomes more pronounced, escalating from 8.79 % (CN-600) to 25.23 % (CN-900). This shift is attributed to the high temperature favoring the transformation of CN materials into a denser structure, in accordance with the findings of Raman spectroscopy studies. The XPS spectra and corresponding fitting data for the elements O 1 s, Cl 2p, and Mg 1 s, which exhibit lower content in CN catalysts, are presented in Figure S5–7 and Table S4–6. Further detailed discussion is not provided in this section. 3.2 Catalytic performance In this study, following qualitative and quantitative analysis of the structural properties of CN catalysts and the content of various nitrogen-doped components, we proceeded to conduct performance tests for acetylene hydrochlorination utilizing the synthesized CN catalysts. Initially, tests were conducted on various CN-X catalysts under specific reaction conditions at 180 °C and a gas hourly space velocity (GHSV) of 90 h −1. As depicted in Fig. 3 a, the acetylene conversion performance of the CN-600 catalyst is 43 %, and the catalyst's efficiency steadily improves with increasing temperature. Notably, the CN-800 catalyst exhibits the highest catalytic performance, achieving 81.6 %. This improvement can be attributed to the corresponding increase in the catalyst's specific surface area. However, at a carbonization temperature of 900 °C, the performance of the CN-900 catalyst experiences a significant decline, possibly due to the transformation of nitrogen species into non-active components, such as graphitic nitrogen. It is crucial to highlight that all catalysts demonstrate selectivity for vinyl chloride monomer (VCM) above 98 %, as depicted in Figure S8. Additionally, taking into account the potential influence of trace amounts of magnesium (Mg) detected by X-ray photoelectron spectroscopy (XPS), We tested the CN-Mg-X catalyst containing a significant amount of Mg components. Surprisingly, the performance of all catalysts was limited to approximately 10 % efficiency, as demonstrated in Figure S9. This observation suggests that Mg components does not have a significant catalytic effect on the acetylene hydrochlorination reaction. For the CN-800 catalyst, which demonstrated the most promising performance, further comprehensive performance tests were conducted. Illustrated in Fig. 3b and Figure S10b, the results showcase the performance of the CN-800 catalyst at an acetylene space velocity of 90 h −1 and varying reaction temperatures. The catalyst's efficiency increases proportionally with the elevation in reaction temperature. Upon reaching 220 °C, the CN-800 catalyst achieves its peak performance, recording an impressive 98.5 %. Further escalation of the temperature to 240 °C does not yield a significant enhancement in the catalyst's efficiency; instead, it marginally decreases to 96.5 %. This phenomenon could be attributed to excessively high temperatures limiting the contact adsorption process between the active sites of the catalyst and reactant molecules. Therefore, 220 °C appears to be the optimal reaction temperature for this catalyst. Furthermore, we assessed the performance of the CN-800 catalyst under varying acetylene space velocities. As depicted in Fig. 3c (Figure S10c), the catalyst exhibited catalytic efficiency exceeding 80 % at acetylene space velocities up to 180 h −1. However, a notable decline occurred when the velocity was increased to 1000 h −1, resulting in an acetylene conversion rate plummeting to 31.5 %. Fig. 3d and Table S7 present the VCM production data of various non-metallic catalysts reported in the literature. In comparison to these catalysts, the CN-800 catalyst developed in this study displayed exceptional performance at different space velocities. Specifically, under reaction conditions of 220 °C and an acetylene space velocity of 360 h −1, its VCM production reached a remarkable 1.38 KgVCM·h −1·Kgcat −1. 3.3 Catalytic descriptors evaluation In the preceding discussion, we briefly explored the impact of nitrogen-doped materials on catalyst performance. In this section, we have established a comprehensive correlation between various properties of CN materials and their catalytic performance, aiming to elucidate a more precise structure-performance relationship. This approach allows us to speculate further on the performance descriptors of nitrogen-doped carbon non-metallic catalysts in the acetylene hydrochlorination reaction. Illustrated in Fig. 4 a, the radar chart outlines the relationship between defects, physical properties, nitrogen (N), oxygen (O) doping content, and catalytic performance of different CN materials. From the Fig. 4a, it is evident that the NC-800 catalyst, displaying superior catalytic performance, possesses a higher specific surface area and more defects. This suggests that an elevated specific surface area and an increased presence of defects can enhance catalytic reactions. Notably, all CN materials, with the exception of CN-600, demonstrated negligible differences in specific surface area and defects. Consequently, there might be other crucial factors influencing the catalyst's catalytic performance. Upon examining the surface content of oxygen (O) and nitrogen (N) in various CN materials, it becomes evident that, in comparison to surface oxygen, nitrogen can more effectively enhance the catalyst's performance. The nitrogen content of the catalysts follows the sequence from high to low: CN-800 (10.29 %) > CN-700 (9.75 %) > CN-600 (8.35 %) > CN-900 (6.92 %). Notably, the catalytic efficiency of CN-600, despite having a higher nitrogen content, is lower than that of CN-900, which possesses a lower nitrogen content. This disparity could be attributed to the excessively low specific surface area and defects of the CN-600 catalyst, hindering timely contact between reactant molecules and the active nitrogen species (N). In summary, highly active non-metallic catalysts appear to necessitate a certain specific surface area and abundant nitrogen content. Furthermore, to establish a more detailed correlation between the various nitrogen-doped components and their respective catalytic performances, aimed at identifying the true active sites, we conducted an analysis. Contrary to our expectations, no significant correlation between the catalyst's activity and any single nitrogen component was observed, as depicted in Fig. 4b. Notably, the catalyst's efficiency exhibited a strong correlation with its pyridinic nitrogen and pyridinic N + O − components. This phenomenon suggests that pyridinic nitrogen and pyridinic N + O − may serve as potential active sites of the catalyst, facilitating the adsorption and activation of acetylene and hydrogen chloride reactants. In general, a catalyst's ability to adsorb and activate reactant molecules directly correlates with its catalytic performance. To explore potential active sites, we employed temperature-programmed desorption (TPD) techniques and Density Functional Theory (DFT) calculations. Figs. 5 a and 5b respectively illustrate the hydrogen chloride (HCl) and acetylene (C2H2) TPD profiles of different CN-X catalysts. As depicted in Fig. 5a, the desorption temperatures of HCl follow this order: CN-800 (219 °C) > CN-700 (167 °C) > CN-900 (161 °C) > CN-600 (142 °C). Overall, as the carbonization temperature increases, the catalyst's adsorption strength for HCl gradually intensifies. The reduced HCl adsorption by the CN-900 catalyst can be attributed to the loss of nitrogen content. Fig. 5b reveals that all catalysts exhibit similar acetylene adsorption strengths, occurring at approximately 200 °C. However, CN-800 demonstrates a higher acetylene adsorption capacity compared to other catalysts. This phenomenon can be attributed to the abundance of π-functional groups (C = C/C = N, -COO) in this catalyst, enhancing its adsorption and activation capability for acetylene. These findings align consistently with the C 1 s XPS results (Figure S4). Density Functional Theory (DFT) calculations were further employed to explore the adsorption capacities of different nitrogen (N) sites for C2H2 and HCl. As illustrated in Fig. 5c, the N sites of the catalyst exhibit stronger adsorption capabilities for hydrogen chloride compared to acetylene. Specifically, pyridinic nitrogen demonstrates a high adsorption energy of −1.14 eV for HCl, and it is noteworthy that the distance between H and Cl atoms in the HCl molecule increases from 1.27 Å to 1.937 Å (Fig. 5d). Additionally, pyridinic nitrogen with oxygen (pyridinic N + O −, −0.387 eV) also showcases robust adsorption capability for HCl, with the distance between H and Cl atoms elongated to 1.425 Å (Fig. 5g). This indicates that pyridinic N + O − possesses a strong adsorption activation capability for HCl and can serve as an active site for catalytic reactions. Meanwhile, pyrrolic nitrogen and graphitic nitrogen exhibit adsorption energies of −0.03 eV and 0.0014 eV for HCl, respectively, suggesting minimal interaction forces between them and HCl. It is noteworthy that when pyridinic nitrogen serves as the active site for HCl adsorption, a dissociation process occurs during the reaction. This results in the formation of a robust adsorption structure where the hydrogen (H) atom interacts with the pyridinic nitrogen site(N6H). We further demonstrate the presence of pyridine nitrogen protonation by differences in the electrochemical properties of the catalysts (Figure S12). The impact of protonated pyridinic nitrogen on the reaction was further examined, as depicted in Fig. 5c and 5h. The adsorption energy of the N6H site for HCl is −0.14 eV, and the distance between H and Cl atoms elongates to 1.318 Å (Fig. 5g). Considering the abundant presence of pyridinic nitrogen in the CN-800 catalyst, protonated pyridinic nitrogen (N6H) emerges as a potential active site for the catalytic reaction. In summary, doped pyridinic nitrogen with oxygen (NO), pyridinic nitrogen (N6), and protonated pyridinic nitrogen (N6H) in CN catalysts can serve as active species for the acetylene hydrochlorination reaction. This discovery aligns consistently with the results presented in Fig. 4b. 3.4 Long-term stability test and regeneration of the CN-800 catalyst Under accelerated deactivation conditions, a prolonged test was conducted on the CN-800 catalyst. As depicted in Fig. 6 a, the catalytic performance of the CN-800 catalyst gradually decreased from 74.5 % to 63.1 % in the initial 32 h, followed by an accelerated declining trend. After 50 h, the catalytic performance plummeted to 32 %. Subsequently, the catalyst underwent regeneration treatment after 50 h of reaction. Under a nitrogen atmosphere, the temperature controller was raised to 800 °C and held for 3 h of continuous high-temperature calcination. Later, the temperature was lowered to 220 °C, and the reaction gas was introduced for a second test. Building on the above study, we posit that highly active CN catalysts should possess a suitable specific surface area and higher doping of pyridinic N and pyridinic N + O −. Accordingly, BET and N 1 s XPS tests were conducted on CN-800–50 h and CN-800-Re catalysts. As shown in Fig. 6b, after 50 h of reaction, the catalyst's specific surface area decreased from 534 m2 g −1 to 43 m2 g −1. After high-temperature regeneration, the specific surface area of the catalyst recovered to 317 m2 g −1, and the performance of the CN-800-Re catalyst returned to 64.7 %. The data indicate that carbon deposition on the catalyst surface may be the main cause of catalyst deactivation as the reaction progresses. Figs. 6c, d, and Table S2 present N 1 s XPS data, showing a decrease in the content of pyridinic nitrogen and pyridinic N + O − after the reaction. After regeneration, the content of pyridinic nitrogen and pyridinic N + O − recovered to 37.51 % and 9.2 %, respectively. However, after high-temperature regeneration, the catalyst's graphitization significantly increased, and the nitrogen content doped in the catalyst decreased to 8.91 % (Table S1), which may be the reason for the incomplete recovery of the catalyst's initial activity. 4 Conclusions In summary, we synthesized a layered N-doped carbon catalyst using a dual-template method, demonstrating superior catalytic performance in acetylene hydrochlorination compared to non-metallic catalysts documented in the literature. By integrating experimental and characterization results, we observed a close relationship between the catalyst's performance and its surface area and nitrogen content. Further research suggests that protonated pyridinic nitrogen and pyridinic N + O − may serve as active sites for the catalyst, as they exhibit moderate adsorption strength of reactants. Long-term experiments and regeneration studies on the catalyst underscore its considerable prospects for industrial applications. The findings of this study provide inspiration for designing non-metal-based acetylene hydrochlorination catalysts that align with industrial demands. CRediT authorship contribution statement Saisai Wang: Writing – review & editing, Writing – original draft, Formal analysis, Data curation. Zhixin Liu: Validation, Investigation, Formal analysis, Conceptualization. Da Xu: Visualization, Validation. Siyu Pei: Visualization, Validation, Conceptualization. Jianbo Wu: Data curation. Kaixuan Zhuge: Software. Chunxiao Jin: Software. Haiting Cai: Writing – review & editing, Conceptualization. Renqin Chang: Visualization, Validation. Yuxue Yue: Writing – review & editing, Formal analysis. Jia Zhao: Writing – review & editing, Investigation, Funding acquisition. Xiaonian Li: Writing – review & editing, Funding acquisition. Declaration of competing interest The authors declare that they have no known competing financial interests or personal relationships that could have appeared to influence the work reported in this paper. Acknowledgments Financial support from the National Key Research and Development Program of China (2021YFA1501802), Zhejiang Provincial Key R&D Project (2023C01211) and the Financial support from the National Natural Science Foundation of China (NSFC; grant Nos. 21606199, 21976129) are gratefully acknowledged. Statement of contributions Saisai Wang and Zhixin Liu conceived and synthesized the catalysts and performed most of the reactions and characterizations. Da Xu, Siyu Pei and Jianbo Wu completed the drawing of the figures and tables. The Roman data were obtained by Renqin Chang. The calculations were performed by Kaixuan Zhuge and Chunxiao Jin. All the authors discussed the results and wrote the manuscript. Yuxue Yue and Haiting Cai helped with the manuscript language polished. Jia Zhao and Xiaonian Li designed the study and supervised the project. Supplementary materials Supplementary material associated with this article can be found, in the online version, at doi:10.1016/j.mcat.2024.114240. Appendix Supplementary materials Image, application 1 References [1] B. Nksosi N.J. Coville G.J. Hutchings M.D. Adams J. Friedl F.E. Wagner Hydrochlorination of acetylene using carbon-supported catalysts a study of catalyst deactivation J. Catal. 128 1991 366 377 10.1016/0021-9517(91)90295-f B. Nksosi, N.J. Coville, G.J. Hutchings, M.D. Adams, J. Friedl, F.E. Wagner, Hydrochlorination of acetylene using carbon-supported catalysts a study of catalyst deactivation, J. Catal. 128 (1991) 366–377, https://doi.org/10.1016/0021-9517(91)90295-f. [2] G.J. Hutchings Catalysis by gold Catal. Today 100 2005 55 61 10.1016/j.cattod.2004.12.016 G.J. Hutchings, Catalysis by gold, Catal. Today 100 (2005) 55–61, https://doi.org/10.1016/j.cattod.2004.12.016. [3] M. Conte A. Carley C. Heirene D. Willock P. Johnston A. Herzing C. Kiely G. Hutchings Hydrochlorination of acetylene using a supported gold catalyst: a study of the reaction mechanism J. Catal. 250 2007 231 239 10.1016/j.jcat.2007.06.018 M. Conte, A. Carley, C. Heirene, D. Willock, P. Johnston, A. Herzing, C. Kiely, G. Hutchings, Hydrochlorination of acetylene using a supported gold catalyst: a study of the reaction mechanism, J. Catal. 250 (2007) 231–239, https://doi.org/10.1016/j.jcat.2007.06.018. [4] M. Conte A. Carley G. Attard A. Herzing C. Kiely G. Hutchings Hydrochlorination of acetylene using supported bimetallic Au-based catalysts J. Catal. 257 2008 190 198 10.1016/j.jcat.2008.04.024 M. Conte, A. Carley, G. Attard, A. Herzing, C. Kiely, G. Hutchings, Hydrochlorination of acetylene using supported bimetallic Au-based catalysts, J. Catal. 257 (2008) 190–198, https://doi.org/10.1016/j.jcat.2008.04.024. [5] M. Conte A.F. Carley G.J. Hutchings Reactivation of a carbon-supported gold catalyst for the hydrochlorination of acetylene Catal. Lett. 124 2008 165 167 10.1007/s10562-008-9583-5 M. Conte, A.F. Carley, G.J. Hutchings, Reactivation of a carbon-supported gold catalyst for the hydrochlorination of acetylene, Catal. Lett. 124 (2008) 165–167, https://doi.org/10.1007/s10562-008-9583-5. [6] S. Wang B. Shen Q. Song Kinetics of acetylene hydrochlorination over bimetallic Au–Cu/C catalyst Catal. Lett. 134 2009 102 109 10.1007/s10562-009-0216-4 S. Wang, B. Shen, Q. Song, Kinetics of acetylene hydrochlorination over bimetallic Au–Cu/C catalyst, Catal. Lett. 134 (2009) 102–109, https://doi.org/10.1007/s10562-009-0216-4. [7] G. Malta S.A. Kondrat S.J. Freakley C.J. Davies L. Lu S. Dawson A. Thetford E.K. Gibson D.J. Morgan W. Jones P.P. Wells P. Johnston C.R.A. Catlow C.J. Kiely G.J. Hutchings Identification of single-site gold catalysis in acetylene hydrochlorination Science (1979) 355 2017 1399 1403 10.1126/science.aal3439 G. Malta, S.A. Kondrat, S.J. Freakley, C.J. Davies, L. Lu, S. Dawson, A. Thetford, E.K. Gibson, D.J. Morgan, W. Jones, P.P. Wells, P. Johnston, C.R.A. Catlow, C.J. Kiely, G.J. Hutchings, Identification of single-site gold catalysis in acetylene hydrochlorination, Science (1979) 355 (2017) 1399–1403, https://doi.org/10.1126/science.aal3439. [8] J. Zhao J. Xu J. Xu T. Zhang X. Di J. Ni X. Li Enhancement of Au/AC acetylene hydrochlorination catalyst activity and stability via nitrogen-modified activated carbon support Chem. Eng. J. 262 2015 1152 1160 10.1016/j.cej.2014.10.071 J. Zhao, J. Xu, J. Xu, T. Zhang, X. Di, J. Ni, X. Li, Enhancement of Au/AC acetylene hydrochlorination catalyst activity and stability via nitrogen-modified activated carbon support, Chem. Eng. J. 262 (2015) 1152–1160, https://doi.org/10.1016/j.cej.2014.10.071. [9] J. Zhao S. Wang B. Wang Y. Yue C. Jin J. Lu Z. Fang X. Pang F. Feng L. Guo Z. Pan X. Li Acetylene hydrochlorination over supported ionic liquid phase (SILP) gold-based catalyst: stabilization of cationic Au species via chemical activation of hydrogen chloride and corresponding mechanisms Chin. J. Catal. 42 2021 334 346 10.1016/s1872-2067(20)63617-8 J. Zhao, S. Wang, B. Wang, Y. Yue, C. Jin, J. Lu, Z. Fang, X. Pang, F. Feng, L. Guo, Z. Pan, X. Li, Acetylene hydrochlorination over supported ionic liquid phase (SILP) gold-based catalyst: stabilization of cationic Au species via chemical activation of hydrogen chloride and corresponding mechanisms, Chin. J. Catal. 42 (2021) 334–346, https://doi.org/10.1016/s1872-2067(20)63617-8. [10] K. Zhou J. Jia C. Li H. Xu J. Zhou G. Luo F. Wei A low content Au-based catalyst for hydrochlorination of C2H2and its industrial scale-up for future PVC processes Green Chem. 17 2015 356 364 10.1039/c4gc00795f K. Zhou, J. Jia, C. Li, H. Xu, J. Zhou, G. Luo, F. Wei, A low content Au-based catalyst for hydrochlorination of C2H2and its industrial scale-up for future PVC processes, Green Chem. 17 (2015) 356–364, https://doi.org/10.1039/c4gc00795f. [11] H. Zhang B. Dai X. Wang W. Li Y. Han J. Gu J. Zhang Non-mercury catalytic acetylene hydrochlorination over bimetallic Au–Co(iii)/SAC catalysts for vinyl chloride monomer production Green Chem. 15 2013 829 836 10.1039/c3gc36840h H. Zhang, B. Dai, X. Wang, W. Li, Y. Han, J. Gu, J. Zhang, Non-mercury catalytic acetylene hydrochlorination over bimetallic Au–Co(iii)/SAC catalysts for vinyl chloride monomer production, Green Chem. 15 (2013) 829–836, https://doi.org/10.1039/c3gc36840h. [12] Z. Chen S. Wang J. Zhao R. Lin Advances in single-atom-catalyzed acetylene hydrochlorination ACS. Catal. 14 2024 965 980 10.1021/acscatal.3c04495 Z. Chen, S. Wang, J. Zhao, R. Lin, Advances in single-atom-catalyzed acetylene hydrochlorination, ACS. Catal. 14 (2024) 965–980, https://doi.org/10.1021/acscatal.3c04495. [13] Q.L. Song S.J. Wang B.X. Shen J.G. Zhao Palladium-based catalysts for the hydrochlorination of acetylene: reasons for deactivation and its regeneration Pet. Sci. Technol. 28 2010 1825 1833 10.1080/10916460903160842 Q.L. Song, S.J. Wang, B.X. Shen, J.G. Zhao, Palladium-based catalysts for the hydrochlorination of acetylene: reasons for deactivation and its regeneration, Pet. Sci. Technol. 28 (2010) 1825–1833, https://doi.org/10.1080/10916460903160842. [14] T.V. Krasnyakova I.V. Zhikharev R.S. Mitchenko V.I. Burkhovetski А.M. Korduban T.V. Kryshchuk S.A. Mitchenko Acetylene catalytic hydrochlorination over mechanically pre-activated K2PdCl4 salt: a study of the reaction mechanism J. Catal. 288 2012 33 43 10.1016/j.jcat.2011.12.020 T.V. Krasnyakova, I.V. Zhikharev, R.S. Mitchenko, V.I. Burkhovetski, А.M. Korduban, T.V. Kryshchuk, S.A. Mitchenko, Acetylene catalytic hydrochlorination over mechanically pre-activated K2PdCl4 salt: a study of the reaction mechanism, J. Catal. 288 (2012) 33–43, https://doi.org/10.1016/j.jcat.2011.12.020. [15] L. Wang F. Wang J. Wang X. Tang Y. Zhao D. Yang F. Jia T. Hao Hydrochlorination of acetylene to vinyl chloride over Pd supported on zeolite Y React. Kinet., Mech. Catal. 110 2013 187 194 10.1007/s11144-013-0580-3 L. Wang, F. Wang, J. Wang, X. Tang, Y. Zhao, D. Yang, F. Jia, T. Hao, Hydrochlorination of acetylene to vinyl chloride over Pd supported on zeolite Y, React. Kinet., Mech. Catal. 110 (2013) 187–194, https://doi.org/10.1007/s11144-013-0580-3. [16] J. Zhao Y. Yue G. Sheng B. Wang H. Lai S. Di Y. Zhai L. Guo X. Li Supported ionic liquid-palladium catalyst for the highly effective hydrochlorination of acetylene Chem. Eng. J. 360 2019 38 46 10.1016/j.cej.2018.11.179 J. Zhao, Y. Yue, G. Sheng, B. Wang, H. Lai, S. Di, Y. Zhai, L. Guo, X. Li, Supported ionic liquid-palladium catalyst for the highly effective hydrochlorination of acetylene, Chem. Eng. J. 360 (2019) 38–46, https://doi.org/10.1016/j.cej.2018.11.179. [17] V. Giulimondi A. Ruiz-Ferrando G. Giannakakis I. Surin M. Agrachev G. Jeschke F. Krumeich N. López A.H. Clark J. Pérez-Ramírez Evidence of bifunctionality of carbons and metal atoms in catalyzed acetylene hydrochlorination Nat. Commun. 14 2023 5557 5570 10.1038/s41467-023-41344-0 V. Giulimondi, A. Ruiz-Ferrando, G. Giannakakis, I. Surin, M. Agrachev, G. Jeschke, F. Krumeich, N. López, A.H. Clark, J. Pérez-Ramírez, Evidence of bifunctionality of carbons and metal atoms in catalyzed acetylene hydrochlorination, Nat. Commun. 14 (2023) 5557–5570, https://doi.org/10.1038/s41467-023-41344-0. [18] S.K. Kaiser E. Fako G. Manzocchi F. Krumeich R. Hauert A.H. Clark O.V. Safonova N. López J. Pérez-Ramírez Nanostructuring unlocks high performance of platinum single-atom catalysts for stable vinyl chloride production Nat. Catal. 3 2020 376 385 10.1038/s41929-020-0431-3 S.K. Kaiser, E. Fako, G. Manzocchi, F. Krumeich, R. Hauert, A.H. Clark, O.V. Safonova, N. López, J. Pérez-Ramírez, Nanostructuring unlocks high performance of platinum single-atom catalysts for stable vinyl chloride production, Nat. Catal. 3 (2020) 376–385, https://doi.org/10.1038/s41929-020-0431-3. [19] S.K. Kaiser I. Surin A. Amorós-Pérez S. Büchele F. Krumeich A.H. Clark M.C. Román-Martínez M.A. Lillo-Ródenas J. Pérez-Ramírez Design of carbon supports for metal-catalyzed acetylene hydrochlorination Nat. Commun. 12 2021 4016 4024 10.1038/s41467-021-24330-2 S.K. Kaiser, I. Surin, A. Amorós-Pérez, S. Büchele, F. Krumeich, A.H. Clark, M.C. Román-Martínez, M.A. Lillo-Ródenas, J. Pérez-Ramírez, Design of carbon supports for metal-catalyzed acetylene hydrochlorination, Nat. Commun. 12 (2021) 4016–4024, https://doi.org/10.1038/s41467-021-24330-2. [20] S.K. Kaiser E. Fako I. Surin F. Krumeich V.A. Kondratenko E.V. Kondratenko A.H. Clark N. López J. Pérez-Ramírez Performance descriptors of nanostructured metal catalysts for acetylene hydrochlorination Nat. Nanotechnol. 17 2022 606 612 10.1038/s41565-022-01105-4 S.K. Kaiser, E. Fako, I. Surin, F. Krumeich, V.A. Kondratenko, E.V. Kondratenko, A.H. Clark, N. López, J. Pérez-Ramírez, Performance descriptors of nanostructured metal catalysts for acetylene hydrochlorination, Nat. Nanotechnol. 17 (2022) 606–612, https://doi.org/10.1038/s41565-022-01105-4. [21] Q. Zhang H. Zhang M. Huang Z. Guo L. Yang W. Peng J. Zhang Phthalimide ligand coordination as a critical “key” for constructing chlorine–platinum–nitrogen single-site catalysts for effective acetylene hydrochlorination ACS. Sustain. Chem. Eng. 11 2023 3103 3113 10.1021/acssuschemeng.2c07478 Q. Zhang, H. Zhang, M. Huang, Z. Guo, L. Yang, W. Peng, J. Zhang, Phthalimide ligand coordination as a critical “key” for constructing chlorine–platinum–nitrogen single-site catalysts for effective acetylene hydrochlorination, ACS. Sustain. Chem. Eng. 11 (2023) 3103–3113, https://doi.org/10.1021/acssuschemeng.2c07478. [22] S. Shang W. Zhao Y. Wang X. Li J. Zhang Y. Han W. Li Highly efficient Ru@IL/AC to substitute mercuric catalyst for acetylene hydrochlorination ACS. Catal. 7 2017 3510 3520 10.1021/acscatal.7b00057 S. Shang, W. Zhao, Y. Wang, X. Li, J. Zhang, Y. Han, W. Li, Highly efficient Ru@IL/AC to substitute mercuric catalyst for acetylene hydrochlorination, ACS. Catal. 7 (2017) 3510–3520, https://doi.org/10.1021/acscatal.7b00057. [23] X. Wang G. Lan Z. Cheng W. Han H. Tang H. Liu Y. Li Carbon-supported ruthenium catalysts prepared by a coordination strategy for acetylene hydrochlorination Chin. J. Catal. 41 2020 1683 1691 10.1016/s1872-2067(20)63616-6 X. Wang, G. Lan, Z. Cheng, W. Han, H. Tang, H. Liu, Y. Li, Carbon-supported ruthenium catalysts prepared by a coordination strategy for acetylene hydrochlorination, Chin. J. Catal. 41 (2020) 1683–1691, https://doi.org/10.1016/s1872-2067(20)63616-6. [24] H. Zhang T. Zhang Y. Jia J. Zhang Y. Han Single-atom ruthenium catalytic sites for acetylene hydrochlorination J. Phys. Chem. Lett. 12 2021 7350 7356 10.1021/acs.jpclett.1c01779 H. Zhang, T. Zhang, Y. Jia, J. Zhang, Y. Han, Single-atom ruthenium catalytic sites for acetylene hydrochlorination, J. Phys. Chem. Lett. 12 (2021) 7350–7356, https://doi.org/10.1021/acs.jpclett.1c01779. [25] Y. Yang C. Zhao X. Qiao Q. Guan W. Li Regulating the coordination environment of Ru single-atom catalysts and unravelling the reaction path of acetylene hydrochlorination Green Energy Environ. 8 2023 1141 1153 10.1016/j.gee.2022.01.006 Y. Yang, C. Zhao, X. Qiao, Q. Guan, W. Li, Regulating the coordination environment of Ru single-atom catalysts and unravelling the reaction path of acetylene hydrochlorination, Green Energy Environ. 8 (2023) 1141–1153, https://doi.org/10.1016/j.gee.2022.01.006. [26] S. Wang L. Wan C. Jin T. Wang K. Zhuge Y. Yue H. Cai B. Wang R. Chang J. Zhao X. Li Mechanistic insight into acetylene hydrochlorination with Ru-ligands via dual activation promoted by metal-ligands cooperative catalysis Appl. Catal. A: Gen. 665 2023 119382 119391 10.1016/j.apcata.2023.119382 S. Wang, L. Wan, C. Jin, T. Wang, K. Zhuge, Y. Yue, H. Cai, B. Wang, R. Chang, J. Zhao, X. Li, Mechanistic insight into acetylene hydrochlorination with Ru-ligands via dual activation promoted by metal-ligands cooperative catalysis, Appl. Catal. A: Gen. 665 (2023) 119382–119391, https://doi.org/10.1016/j.apcata.2023.119382. [27] Y. Yue S. Wang Q. Zhou B. Wang C. Jin R. Chang L. Wan Z. Pan Y. Zhu J. Zhao X. Li Tailoring asymmetric Cu-O-P coupling site by carbothermal shock method for efficient vinyl chloride synthesis over carbon supported Cu catalysts ACS. Catal. 13 2023 9777 9791 10.1021/acscatal.3c01527 Y. Yue, S. Wang, Q. Zhou, B. Wang, C. Jin, R. Chang, L. Wan, Z. Pan, Y. Zhu, J. Zhao, X. Li, Tailoring asymmetric Cu-O-P coupling site by carbothermal shock method for efficient vinyl chloride synthesis over carbon supported Cu catalysts, ACS. Catal. 13 (2023) 9777–9791, https://doi.org/10.1021/acscatal.3c01527. [28] B. Wang C. Jin S. Shao Y. Yue Y. Zhang S. Wang R. Chang H. Zhang J. Zhao X. Li Electron-deficient Cu site catalyzed acetylene hydrochlorination Green Energy Environ. 8 2023 1128 1140 10.1016/j.gee.2022.01.005 B. Wang, C. Jin, S. Shao, Y. Yue, Y. Zhang, S. Wang, R. Chang, H. Zhang, J. Zhao, X. Li, Electron-deficient Cu site catalyzed acetylene hydrochlorination, Green Energy Environ. 8 (2023) 1128–1140, https://doi.org/10.1016/j.gee.2022.01.005. [29] Y. Jia T. Zhang M. Liu J. Zhang Y. Han Effect of different heteroatoms anchoring a Cu single-atom catalyst on acetylene hydrochlorination J. Phys. Chem. C 126 2022 20401 20410 10.1021/acs.jpcc.2c06889 Y. Jia, T. Zhang, M. Liu, J. Zhang, Y. Han, Effect of different heteroatoms anchoring a Cu single-atom catalyst on acetylene hydrochlorination, J. Phys. Chem. C 126 (2022) 20401–20410, https://doi.org/10.1021/acs.jpcc.2c06889. [30] D. Faust Akl G. Giannakakis A. Ruiz-Ferrando M. Agrachev J.D. Medrano-García G. Guillén-Gosálbez G. Jeschke A.H. Clark O.V. Safonova S. Mitchell N. López J. Pérez-Ramírez Reaction-induced formation of stable mononuclear Cu(I)Cl species on carbon for low-footprint vinyl chloride production Adv. Mater. 35 2023 2211464 2211476 10.1002/adma.202211464 D. Faust Akl, G. Giannakakis, A. Ruiz-Ferrando, M. Agrachev, J.D. Medrano-García, G. Guillén-Gosálbez, G. Jeschke, A.H. Clark, O.V. Safonova, S. Mitchell, N. López, J. Pérez-Ramírez, Reaction-induced formation of stable mononuclear Cu(I)Cl species on carbon for low-footprint vinyl chloride production, Adv. Mater. 35 (2023) 2211464–2211476, https://doi.org/10.1002/adma.202211464. [31] T. Zhang B. Wang Y. Nian M. Liu Y. Jia J. Zhang Y. Han Excess copper chloride induces active sites over Cu-ligand catalysts for acetylene hydrochlorination ACS. Catal. 13 2023 8307 8316 10.1021/acscatal.3c01905 T. Zhang, B. Wang, Y. Nian, M. Liu, Y. Jia, J. Zhang, Y. Han, Excess copper chloride induces active sites over Cu-ligand catalysts for acetylene hydrochlorination, ACS. Catal. 13 (2023) 8307–8316, https://doi.org/10.1021/acscatal.3c01905. [32] Y. Qiu D. Fan G. Lan S. Wei X. Hu Y. Li Generalized reactivity descriptor of defective carbon catalysts for acetylene hydrochlorination: the ratio of sp2 : sp3 hybridization Chem. Commun. 56 2020 14877 14880 10.1039/d0cc06177h Y. Qiu, D. Fan, G. Lan, S. Wei, X. Hu, Y. Li, Generalized reactivity descriptor of defective carbon catalysts for acetylene hydrochlorination: the ratio of sp2 : sp3 hybridization, Chem. Commun. 56 (2020) 14877–14880, https://doi.org/10.1039/d0cc06177h. [33] S. Chao F. Zou F. Wan X. Dong Y. Wang Y. Wang Q. Guan G. Wang W. Li Nitrogen-doped carbon derived from ZIF-8 as a high-performance metal-free catalyst for acetylene hydrochlorination Sci. Rep. 7 2017 39789 39798 10.1038/srep39789 S. Chao, F. Zou, F. Wan, X. Dong, Y. Wang, Y. Wang, Q. Guan, G. Wang, W. Li, Nitrogen-doped carbon derived from ZIF-8 as a high-performance metal-free catalyst for acetylene hydrochlorination, Sci. Rep. 7 (2017) 39789–39798, https://doi.org/10.1038/srep39789. [34] Y. Qiu S. Ali G. Lan H. Tong J. Fan H. Liu B. Li W. Han H. Tang H. Liu Y. Li Defect-rich activated carbons as active and stable metal-free catalyst for acetylene hydrochlorination Carbon. N. Y. 146 2019 406 412 10.1016/j.carbon.2019.01.102 Y. Qiu, S. Ali, G. Lan, H. Tong, J. Fan, H. Liu, B. Li, W. Han, H. Tang, H. Liu, Y. Li, Defect-rich activated carbons as active and stable metal-free catalyst for acetylene hydrochlorination, Carbon. N. Y. 146 (2019) 406–412, https://doi.org/10.1016/j.carbon.2019.01.102. [35] J. Wang W. Gong M. Zhu B. Dai Effect of carbon defects on the nitrogen-doped carbon catalytic performance for acetylene hydrochlorination Appl. Catal. A: Gen. 564 2018 72 78 10.1016/j.apcata.2018.07.025 J. Wang, W. Gong, M. Zhu, B. Dai, Effect of carbon defects on the nitrogen-doped carbon catalytic performance for acetylene hydrochlorination, Appl. Catal. A: Gen. 564 (2018) 72–78, https://doi.org/10.1016/j.apcata.2018.07.025. [36] X. Li X. Pan L. Yu P. Ren X. Wu L. Sun F. Jiao X. Bao Silicon carbide-derived carbon nanocomposite as a substitute for mercury in the catalytic hydrochlorination of acetylene Nat. Commun. 5 2014 3688 3695 10.1038/ncomms4688 X. Li, X. Pan, L. Yu, P. Ren, X. Wu, L. Sun, F. Jiao, X. Bao, Silicon carbide-derived carbon nanocomposite as a substitute for mercury in the catalytic hydrochlorination of acetylene, Nat. Commun. 5 (2014) 3688–3695, https://doi.org/10.1038/ncomms4688. [37] R. Lin S.K. Kaiser R. Hauert J. Pérez-Ramírez Descriptors for high-performance nitrogen-doped carbon catalysts in acetylene hydrochlorination ACS. Catal. 8 2018 1114 1121 10.1021/acscatal.7b03031 R. Lin, S.K. Kaiser, R. Hauert, J. Pérez-Ramírez, Descriptors for high-performance nitrogen-doped carbon catalysts in acetylene hydrochlorination, ACS. Catal. 8 (2018) 1114–1121, https://doi.org/10.1021/acscatal.7b03031. [38] S. Wu A. Jiang X. Zhou Y. Liu S. Cao Environmentally friendly high-efficient metal-free catalyst for acetylene hydrochlorination derived from walnut shell-based N-doped biochar Mol. Catal. 532 2022 112719 112728 10.1016/j.mcat.2022.112719 S. Wu, A. Jiang, X. Zhou, Y. Liu, S. Cao, Environmentally friendly high-efficient metal-free catalyst for acetylene hydrochlorination derived from walnut shell-based N-doped biochar, Mol. Catal. 532 (2022) 112719–112728, https://doi.org/10.1016/j.mcat.2022.112719. [39] F. Li H. Zhang M. Zhang L. Li L. Yao W. Peng J. Zhang Hollow carbon nanospheres decorated with abundant pyridinic N+O– for efficient acetylene hydrochlorination ACS. Sustain. Chem. Eng. 10 2021 194 203 10.1021/acssuschemeng.1c05661 F. Li, H. Zhang, M. Zhang, L. Li, L. Yao, W. Peng, J. Zhang, Hollow carbon nanospheres decorated with abundant pyridinic N+O– for efficient acetylene hydrochlorination, ACS. Sustain. Chem. Eng. 10 (2021) 194–203, https://doi.org/10.1021/acssuschemeng.1c05661. [40] Y. Yue B. Wang S. Wang C. Jin J. Lu Z. Fang S. Shao Z. Pan J. Ni J. Zhao X. Li Boron-doped carbon nanodots dispersed on graphitic carbon as high-performance catalysts for acetylene hydrochlorination Chem. Commun. 56 2020 5174 5177 10.1039/c9cc09701e Y. Yue, B. Wang, S. Wang, C. Jin, J. Lu, Z. Fang, S. Shao, Z. Pan, J. Ni, J. Zhao, X. Li, Boron-doped carbon nanodots dispersed on graphitic carbon as high-performance catalysts for acetylene hydrochlorination, Chem. Commun. 56 (2020) 5174–5177, https://doi.org/10.1039/c9cc09701e. [41] S. Ali Y. Qiu Z. Lian S. Olanrele G. Lan Y. Li D.S. Su B. Li Screening of active center and reactivity descriptor in acetylene hydrochlorination on metal-free doped carbon catalysts from first principle calculations Appl. Surf. Sci. 478 2019 574 580 10.1016/j.apsusc.2019.02.007 S. Ali, Y. Qiu, Z. Lian, S. Olanrele, G. Lan, Y. Li, D.S. Su, B. Li, Screening of active center and reactivity descriptor in acetylene hydrochlorination on metal-free doped carbon catalysts from first principle calculations, Appl. Surf. Sci. 478 (2019) 574–580, https://doi.org/10.1016/j.apsusc.2019.02.007. [42] J. Zhao B. Wang Y. Yue G. Sheng H. Lai S. Wang L. Yu Q. Zhang F. Feng Z.-T. Hu X. Li Nitrogen- and phosphorus-codoped carbon-based catalyst for acetylene hydrochlorination J. Catal. 373 2019 240 249 10.1016/j.jcat.2019.03.044 J. Zhao, B. Wang, Y. Yue, G. Sheng, H. Lai, S. Wang, L. Yu, Q. Zhang, F. Feng, Z.-T. Hu, X. Li, Nitrogen- and phosphorus-codoped carbon-based catalyst for acetylene hydrochlorination, J. Catal. 373 (2019) 240–249, https://doi.org/10.1016/j.jcat.2019.03.044. [43] X. Qi W. Chen J. Zhang Sulphur-doped activated carbon as a metal-free catalyst for acetylene hydrochlorination RSC. Adv. 10 2020 34612 34620 10.1039/d0ra06256a X. Qi, W. Chen, J. Zhang, Sulphur-doped activated carbon as a metal-free catalyst for acetylene hydrochlorination, RSC. Adv. 10 (2020) 34612–34620, https://doi.org/10.1039/d0ra06256a. [44] G. Panomsuwan N. Saito T. Ishizaki Nitrogen-doped carbon nanoparticle–carbon nanofiber composite as an efficient metal-free cathode catalyst for oxygen reduction reaction ACS. Appl. Mater. Interfaces. 8 2016 6962 6971 10.1021/acsami.5b10493 G. Panomsuwan, N. Saito, T. Ishizaki, Nitrogen-doped carbon nanoparticle–carbon nanofiber composite as an efficient metal-free cathode catalyst for oxygen reduction reaction, ACS. Appl. Mater. Interfaces. 8 (2016) 6962–6971, https://doi.org/10.1021/acsami.5b10493. [45] M. Ayiania M. Smith A.J.R. Hensley L. Scudiero J.-S. McEwen M. Garcia-Perez Deconvoluting the XPS spectra for nitrogen-doped chars: an analysis from first principles Carbon. N. Y. 162 2020 528 544 10.1016/j.carbon.2020.02.065 M. Ayiania, M. Smith, A.J.R. Hensley, L. Scudiero, J.-S. McEwen, M. Garcia-Perez, Deconvoluting the XPS spectra for nitrogen-doped chars: an analysis from first principles, Carbon. N. Y. 162 (2020) 528–544, https://doi.org/10.1016/j.carbon.2020.02.065. [46] N. Hellgren J. Guo Y. Luo C. Såthe A. Agui S. Kashtanov J. Nordgren H. Ågren J.-E. Sundgren Electronic structure of carbon nitride thin films studied by X-ray spectroscopy techniques Thin. Solid. Films. 471 2005 19 34 10.1016/j.tsf.2004.03.027 N. Hellgren, J. Guo, Y. Luo, C. Såthe, A. Agui, S. Kashtanov, J. Nordgren, H. Ågren, J.-E. Sundgren, Electronic structure of carbon nitride thin films studied by X-ray spectroscopy techniques, Thin. Solid. Films. 471 (2005) 19–34, https://doi.org/10.1016/j.tsf.2004.03.027. [47] M.K. Rabchinskii S.D. Saveliev D.Y. Stolyarova M. Brzhezinskaya D.A. Kirilenko M.V. Baidakova S.A. Ryzhkov V.V. Shnitov V.V. Sysoev P.N. Brunkov Modulating nitrogen species via N-doping and post annealing of graphene derivatives: XPS and XAS examination Carbon. N. Y. 182 2021 593 604 10.1016/j.carbon.2021.06.057 M.K. Rabchinskii, S.D. Saveliev, D.Y. Stolyarova, M. Brzhezinskaya, D.A. Kirilenko, M.V. Baidakova, S.A. Ryzhkov, V.V. Shnitov, V.V. Sysoev, P.N. Brunkov, Modulating nitrogen species via N-doping and post annealing of graphene derivatives: XPS and XAS examination, Carbon. N. Y. 182 (2021) 593–604, https://doi.org/10.1016/j.carbon.2021.06.057.",
      "scopus-id": "85194056560",
      "coredata": {
        "eid": "1-s2.0-S2468823124004231",
        "dc:description": "Non-metallic catalysts present significant potential for environmentally friendly industrialization of acetylene hydrochlorination. However, the challenge of low activity in non-metallic catalysts hampers their practical application. In this study, we propose the use of a dual-template method to fabricate a layered N-doped carbon catalyst, subsequently applying it to acetylene hydrochlorination reactions. Experimental results indicate that the catalyst exhibits exceptional catalytic performance in acetylene hydrochlorination. Combined with characterization results, the catalyst's performance is positively correlated with its surface area and nitrogen content. Furthermore, DFT calculations suggest that protonated pyridinic nitrogen and pyridinic N + O − have moderate adsorption on HCl, potentially serving as active sites for the catalyst. This study analyzes the impact of various parameters of N-doped carbon catalysts on catalytic performance, providing direction for developing non-metallic catalysts suitable for industrial applications.",
        "openArchiveArticle": "false",
        "prism:coverDate": "2024-06-15",
        "openaccessUserLicense": null,
        "prism:aggregationType": "Journal",
        "prism:url": "https://api.elsevier.com/content/article/pii/S2468823124004231",
        "dc:creator": [
          {
            "@_fa": "true",
            "$": "Wang, Saisai"
          },
          {
            "@_fa": "true",
            "$": "Liu, Zhixin"
          },
          {
            "@_fa": "true",
            "$": "Xu, Da"
          },
          {
            "@_fa": "true",
            "$": "Pei, Siyu"
          },
          {
            "@_fa": "true",
            "$": "Wu, Jianbo"
          },
          {
            "@_fa": "true",
            "$": "Zhuge, Kaixuan"
          },
          {
            "@_fa": "true",
            "$": "Jin, Chunxiao"
          },
          {
            "@_fa": "true",
            "$": "Cai, Haiting"
          },
          {
            "@_fa": "true",
            "$": "Chang, Renqin"
          },
          {
            "@_fa": "true",
            "$": "Yue, Yuxue"
          },
          {
            "@_fa": "true",
            "$": "Zhao, Jia"
          },
          {
            "@_fa": "true",
            "$": "Li, Xiaonian"
          }
        ],
        "link": [
          {
            "@_fa": "true",
            "@rel": "self",
            "@href": "https://api.elsevier.com/content/article/pii/S2468823124004231"
          },
          {
            "@_fa": "true",
            "@rel": "scidir",
            "@href": "https://www.sciencedirect.com/science/article/pii/S2468823124004231"
          }
        ],
        "dc:format": "application/json",
        "openaccessType": null,
        "pii": "S2468-8231(24)00423-1",
        "prism:volume": "563",
        "articleNumber": "114240",
        "prism:publisher": "Published by Elsevier B.V.",
        "dc:title": "Reaction-driven protonation of pyridine nitrogen as active sites for efficient acetylene hydrochlorination",
        "prism:copyright": "© 2024 Published by Elsevier B.V.",
        "openaccess": "0",
        "prism:issn": "24688231",
        "dcterms:subject": [
          {
            "@_fa": "true",
            "$": "Acetylene hydrochlorination"
          },
          {
            "@_fa": "true",
            "$": "Metal-free catalyst"
          },
          {
            "@_fa": "true",
            "$": "N-doping"
          }
        ],
        "openaccessArticle": "false",
        "prism:publicationName": "Molecular Catalysis",
        "openaccessSponsorType": null,
        "prism:pageRange": "114240",
        "pubType": "fla",
        "prism:coverDisplayDate": "15 June 2024",
        "prism:doi": "10.1016/j.mcat.2024.114240",
        "prism:startingPage": "114240",
        "dc:identifier": "doi:10.1016/j.mcat.2024.114240",
        "openaccessSponsorName": null
      },
      "objects": {
        "object": [
          {
            "@category": "standard",
            "@height": "819",
            "@width": "659",
            "@_fa": "true",
            "$": "https://api.elsevier.com/content/object/eid/1-s2.0-S2468823124004231-gr2.jpg?httpAccept=%2A%2F%2A",
            "@multimediatype": "JPEG image file",
            "@type": "IMAGE-DOWNSAMPLED",
            "@size": "140134",
            "@ref": "gr2",
            "@mimetype": "image/jpeg"
          },
          {
            "@category": "standard",
            "@height": "200",
            "@width": "390",
            "@_fa": "true",
            "$": "https://api.elsevier.com/content/object/eid/1-s2.0-S2468823124004231-ga1.jpg?httpAccept=%2A%2F%2A",
            "@multimediatype": "JPEG image file",
            "@type": "IMAGE-DOWNSAMPLED",
            "@size": "25670",
            "@ref": "ga1",
            "@mimetype": "image/jpeg"
          },
          {
            "@category": "standard",
            "@height": "572",
            "@width": "659",
            "@_fa": "true",
            "$": "https://api.elsevier.com/content/object/eid/1-s2.0-S2468823124004231-gr3.jpg?httpAccept=%2A%2F%2A",
            "@multimediatype": "JPEG image file",
            "@type": "IMAGE-DOWNSAMPLED",
            "@size": "77790",
            "@ref": "gr3",
            "@mimetype": "image/jpeg"
          },
          {
            "@category": "standard",
            "@height": "339",
            "@width": "659",
            "@_fa": "true",
            "$": "https://api.elsevier.com/content/object/eid/1-s2.0-S2468823124004231-gr1.jpg?httpAccept=%2A%2F%2A",
            "@multimediatype": "JPEG image file",
            "@type": "IMAGE-DOWNSAMPLED",
            "@size": "70467",
            "@ref": "gr1",
            "@mimetype": "image/jpeg"
          },
          {
            "@category": "standard",
            "@height": "442",
            "@width": "659",
            "@_fa": "true",
            "$": "https://api.elsevier.com/content/object/eid/1-s2.0-S2468823124004231-gr6.jpg?httpAccept=%2A%2F%2A",
            "@multimediatype": "JPEG image file",
            "@type": "IMAGE-DOWNSAMPLED",
            "@size": "77674",
            "@ref": "gr6",
            "@mimetype": "image/jpeg"
          },
          {
            "@category": "standard",
            "@height": "248",
            "@width": "659",
            "@_fa": "true",
            "$": "https://api.elsevier.com/content/object/eid/1-s2.0-S2468823124004231-gr4.jpg?httpAccept=%2A%2F%2A",
            "@multimediatype": "JPEG image file",
            "@type": "IMAGE-DOWNSAMPLED",
            "@size": "48656",
            "@ref": "gr4",
            "@mimetype": "image/jpeg"
          },
          {
            "@category": "standard",
            "@height": "357",
            "@width": "659",
            "@_fa": "true",
            "$": "https://api.elsevier.com/content/object/eid/1-s2.0-S2468823124004231-gr5.jpg?httpAccept=%2A%2F%2A",
            "@multimediatype": "JPEG image file",
            "@type": "IMAGE-DOWNSAMPLED",
            "@size": "70319",
            "@ref": "gr5",
            "@mimetype": "image/jpeg"
          },
          {
            "@category": "thumbnail",
            "@height": "164",
            "@width": "132",
            "@_fa": "true",
            "$": "https://api.elsevier.com/content/object/eid/1-s2.0-S2468823124004231-gr2.sml?httpAccept=%2A%2F%2A",
            "@multimediatype": "GIF image file",
            "@type": "IMAGE-THUMBNAIL",
            "@size": "11193",
            "@ref": "gr2",
            "@mimetype": "image/gif"
          },
          {
            "@category": "thumbnail",
            "@height": "112",
            "@width": "219",
            "@_fa": "true",
            "$": "https://api.elsevier.com/content/object/eid/1-s2.0-S2468823124004231-ga1.sml?httpAccept=%2A%2F%2A",
            "@multimediatype": "GIF image file",
            "@type": "IMAGE-THUMBNAIL",
            "@size": "12634",
            "@ref": "ga1",
            "@mimetype": "image/gif"
          },
          {
            "@category": "thumbnail",
            "@height": "164",
            "@width": "189",
            "@_fa": "true",
            "$": "https://api.elsevier.com/content/object/eid/1-s2.0-S2468823124004231-gr3.sml?httpAccept=%2A%2F%2A",
            "@multimediatype": "GIF image file",
            "@type": "IMAGE-THUMBNAIL",
            "@size": "13341",
            "@ref": "gr3",
            "@mimetype": "image/gif"
          },
          {
            "@category": "thumbnail",
            "@height": "113",
            "@width": "219",
            "@_fa": "true",
            "$": "https://api.elsevier.com/content/object/eid/1-s2.0-S2468823124004231-gr1.sml?httpAccept=%2A%2F%2A",
            "@multimediatype": "GIF image file",
            "@type": "IMAGE-THUMBNAIL",
            "@size": "17300",
            "@ref": "gr1",
            "@mimetype": "image/gif"
          },
          {
            "@category": "thumbnail",
            "@height": "147",
            "@width": "219",
            "@_fa": "true",
            "$": "https://api.elsevier.com/content/object/eid/1-s2.0-S2468823124004231-gr6.sml?httpAccept=%2A%2F%2A",
            "@multimediatype": "GIF image file",
            "@type": "IMAGE-THUMBNAIL",
            "@size": "14600",
            "@ref": "gr6",
            "@mimetype": "image/gif"
          },
          {
            "@category": "thumbnail",
            "@height": "83",
            "@width": "219",
            "@_fa": "true",
            "$": "https://api.elsevier.com/content/object/eid/1-s2.0-S2468823124004231-gr4.sml?httpAccept=%2A%2F%2A",
            "@multimediatype": "GIF image file",
            "@type": "IMAGE-THUMBNAIL",
            "@size": "9172",
            "@ref": "gr4",
            "@mimetype": "image/gif"
          },
          {
            "@category": "thumbnail",
            "@height": "119",
            "@width": "219",
            "@_fa": "true",
            "$": "https://api.elsevier.com/content/object/eid/1-s2.0-S2468823124004231-gr5.sml?httpAccept=%2A%2F%2A",
            "@multimediatype": "GIF image file",
            "@type": "IMAGE-THUMBNAIL",
            "@size": "11997",
            "@ref": "gr5",
            "@mimetype": "image/gif"
          },
          {
            "@category": "high",
            "@height": "3627",
            "@width": "2917",
            "@_fa": "true",
            "$": "https://api.elsevier.com/content/object/eid/1-s2.0-S2468823124004231-gr2_lrg.jpg?httpAccept=%2A%2F%2A",
            "@multimediatype": "JPEG image file",
            "@type": "IMAGE-HIGH-RES",
            "@size": "1116658",
            "@ref": "gr2",
            "@mimetype": "image/jpeg"
          },
          {
            "@category": "high",
            "@height": "886",
            "@width": "1726",
            "@_fa": "true",
            "$": "https://api.elsevier.com/content/object/eid/1-s2.0-S2468823124004231-ga1_lrg.jpg?httpAccept=%2A%2F%2A",
            "@multimediatype": "JPEG image file",
            "@type": "IMAGE-HIGH-RES",
            "@size": "214436",
            "@ref": "ga1",
            "@mimetype": "image/jpeg"
          },
          {
            "@category": "high",
            "@height": "2534",
            "@width": "2917",
            "@_fa": "true",
            "$": "https://api.elsevier.com/content/object/eid/1-s2.0-S2468823124004231-gr3_lrg.jpg?httpAccept=%2A%2F%2A",
            "@multimediatype": "JPEG image file",
            "@type": "IMAGE-HIGH-RES",
            "@size": "598753",
            "@ref": "gr3",
            "@mimetype": "image/jpeg"
          },
          {
            "@category": "high",
            "@height": "1502",
            "@width": "2917",
            "@_fa": "true",
            "$": "https://api.elsevier.com/content/object/eid/1-s2.0-S2468823124004231-gr1_lrg.jpg?httpAccept=%2A%2F%2A",
            "@multimediatype": "JPEG image file",
            "@type": "IMAGE-HIGH-RES",
            "@size": "611280",
            "@ref": "gr1",
            "@mimetype": "image/jpeg"
          },
          {
            "@category": "high",
            "@height": "1958",
            "@width": "2917",
            "@_fa": "true",
            "$": "https://api.elsevier.com/content/object/eid/1-s2.0-S2468823124004231-gr6_lrg.jpg?httpAccept=%2A%2F%2A",
            "@multimediatype": "JPEG image file",
            "@type": "IMAGE-HIGH-RES",
            "@size": "621178",
            "@ref": "gr6",
            "@mimetype": "image/jpeg"
          },
          {
            "@category": "high",
            "@height": "1099",
            "@width": "2917",
            "@_fa": "true",
            "$": "https://api.elsevier.com/content/object/eid/1-s2.0-S2468823124004231-gr4_lrg.jpg?httpAccept=%2A%2F%2A",
            "@multimediatype": "JPEG image file",
            "@type": "IMAGE-HIGH-RES",
            "@size": "401540",
            "@ref": "gr4",
            "@mimetype": "image/jpeg"
          },
          {
            "@category": "high",
            "@height": "1580",
            "@width": "2917",
            "@_fa": "true",
            "$": "https://api.elsevier.com/content/object/eid/1-s2.0-S2468823124004231-gr5_lrg.jpg?httpAccept=%2A%2F%2A",
            "@multimediatype": "JPEG image file",
            "@type": "IMAGE-HIGH-RES",
            "@size": "546582",
            "@ref": "gr5",
            "@mimetype": "image/jpeg"
          },
          {
            "@category": "standard",
            "@_fa": "true",
            "$": "https://api.elsevier.com/content/object/eid/1-s2.0-S2468823124004231-mmc1.docx?httpAccept=%2A%2F%2A",
            "@multimediatype": "Microsoft Word file",
            "@type": "APPLICATION",
            "@size": "1745949",
            "@ref": "mmc1",
            "@mimetype": "application/word"
          },
          {
            "@category": "thumbnail",
            "@_fa": "true",
            "$": "https://api.elsevier.com/content/object/eid/1-s2.0-S2468823124004231-si1.svg?httpAccept=%2A%2F%2A",
            "@multimediatype": "Scalable Vector Graphics file",
            "@type": "ALTIMG",
            "@size": "16055",
            "@ref": "si1",
            "@mimetype": "image/svg+xml"
          },
          {
            "@category": "thumbnail",
            "@_fa": "true",
            "$": "https://api.elsevier.com/content/object/eid/1-s2.0-S2468823124004231-si2.svg?httpAccept=%2A%2F%2A",
            "@multimediatype": "Scalable Vector Graphics file",
            "@type": "ALTIMG",
            "@size": "16402",
            "@ref": "si2",
            "@mimetype": "image/svg+xml"
          },
          {
            "@category": "thumbnail",
            "@_fa": "true",
            "$": "https://api.elsevier.com/content/object/eid/1-s2.0-S2468823124004231-si3.svg?httpAccept=%2A%2F%2A",
            "@multimediatype": "Scalable Vector Graphics file",
            "@type": "ALTIMG",
            "@size": "12262",
            "@ref": "si3",
            "@mimetype": "image/svg+xml"
          },
          {
            "@category": "standard",
            "@_fa": "true",
            "$": "https://api.elsevier.com/content/object/eid/1-s2.0-S2468823124004231-am.pdf?httpAccept=%2A%2F%2A",
            "@multimediatype": "Acrobat PDF file",
            "@type": "AAM-PDF",
            "@size": "1293260",
            "@ref": "am",
            "@mimetype": "application/pdf"
          }
        ]
      },
      "link": {
        "@rel": "abstract",
        "@href": "https://api.elsevier.com/content/abstract/scopus_id/85194056560"
      }
    }
  }
}