{
  "metadata": {
    "title": "DBU-MIm coupled ionic liquids as reusable catalysts for the Biginelli reaction",
    "authors": "; ; ",
    "journal": "Molecular Catalysis",
    "date": "2023-02-01",
    "doi": "10.1016/j.mcat.2022.112906",
    "abstract": "",
    "uri": "https://api.elsevier.com/content/article/pii/S2468823122007921",
    "pii": "S2468823122007921"
  },
  "fulltext": {
    "full-text-retrieval-response": {
      "scopus-eid": "2-s2.0-85146021301",
      "originalText": "serial JL 315758 291210 291744 291790 291809 31 Molecular Catalysis MOLECULARCATALYSIS 2023-01-04 2023-01-04 2023-01-04 2023-01-04 2023-01-19T19:56:57 1-s2.0-S2468823122007921 S2468-8231(22)00792-1 S2468823122007921 10.1016/j.mcat.2022.112906 S300 S300.1 FULL-TEXT 1-s2.0-S2468823123X00029 2024-06-26T17:47:58.012062Z 0 0 20230201 2023 2023-01-04T17:19:18.061497Z absattachment articleinfo articlenumber articletitlenorm authfirstinitialnorm authfirstsurnamenorm cid cids contenttype copyright crossmark dateloaded dateloadedtxt datesearch datesort dateupdated dco docsubtype doctype doi eid ewtransactionid hubeid indexeddate issn issnnorm itemstage itemtransactionid itemweight openaccess openarchive pg pgfirst pii piinorm pubdatestart pubdatetxt pubyr sectiontitle sortorder srctitle srctitlenorm srctype ssids alllist content subj subheadings suppl tomb volfirst volissue volumelist webpdf webpdfpagecount yearnav figure table e-component body acknowledge affil appendices articletitle auth authfirstini authfull authkeywords authlast highlightsabst orcid primabst ref specialabst 2468-8231 24688231 true 536 536 C Volume 536 5 112906 112906 112906 20230201 1 February 2023 2023-02-01 2023 Regular Papers article fla © 2022 Elsevier B.V. All rights reserved. DBUMIMCOUPLEDIONICLIQUIDSREUSABLECATALYSTSFORBIGINELLIREACTION SHARMA M Introduction Results and discussion Synthesis of the catalyst Catalytic studies of [DBUH]+[Im]− ILs in the synthesis of DHPMs Optimization of reaction conditions for the synthesis of DHPMs Synthesis of DHPMs in different solvent systems Synthesis of cinnamaldehyde based DHPMs and their thione analogs Mechanistic studies Comparative catalytic studies of different ILs in Biginelli reaction Recyclization and reusability of the [DBUH]+[2-MIm]− IL Conclusion Experimental General General procedure for the synthesis of [DBUH]+[2-MIm]− ILs General procedure for the synthesis of DHPMs Characterization data of 3,4-DHPMs/thiones CRediT authorship contribution statement Acknowledgment Appendix Supplementary materials References RAO 2020 49 104 R GREENSUSTAINABLEPROCESSFORCHEMICALENVIRONMENTALENGINEERINGSCIENCE ORGANICSYNTHESISIONICLIQUIDSUPPORTANEWSTRATEGYFORLIQUIDPHASEORGANICSYNTHESISLPOS LOZANO 2018 314 P SUSTAINABLECATALYSISINIONICLIQUIDS KAUR 2020 1853 1875 M MISHRA 2021 359 404 R HANDBOOKGREENERSYNTHESISNANOMATERIALSCOMPOUNDS IONICLIQUIDSALTERNATIVEGREENERSOLVENTSCATALYSTSINORGANICTRANSFORMATIONS HU 2021 775 783 Y PRIEDE 2015 9132 9142 E JIANG 2021 3689 3698 Y ZHU 2019 289 293 A LI 2021 3819 3826 Z YAO 2021 3024 3032 B NGUYEN 2020 25358 25363 H NETO 2022 100608 B AMARASEKARA 2016 6133 6183 A FREITAS 2019 27125 27135 E DING 2021 1814 1822 S JU 2019 8893 8898 M DENNIS 2018 4721 4725 J MUZART 2020 11608 11620 J TEHRI 2019 3964 3970 P SINGH 2020 1271 S LI 2015 12107 L PATIL 2019 105 148 R JANKOVIC 2018 13358 13366 N LLOYD 2010 1436 1439 J IRSHAD 2021 111567 N JADHAV 2019 22313 22324 C DOWARAH 2021 35737 35753 J JANKOVIC 2019 569 582 N RASHID 2021 6060 6098 H LALPARA 2020 J JANKOVIC 2022 110025 N SENAPATHI 2021 116526 J BRAGA 2019 15187 15200 T SANTOS 2020 128653 M YAO 2021 3024 3032 B SHAIKH 2020 1 12 T PATEL 2016 401 405 D GUGLIELMERO 2018 612 L FATEMEH 2021 888 897 R DAVANAGERE 2021 26035 26047 P ZHU 2017 8192 8198 X ZHENG 2021 131452 L KENYOTHA 2020 599 K FANG 2013 10052 X WANG 2013 2733 L LEE 1988 785 C BECKE 1988 2547 A SINGH 2021 130568 A SHARMAX2023X112906 SHARMAX2023X112906XM 2025-01-04T00:00:00.000Z 2025-01-04T00:00:00.000Z http://creativecommons.org/licenses/by-nc-nd/4.0/ © 2022 Elsevier B.V. All rights reserved. 2023-01-13T22:46:15.830Z http://vtw.elsevier.com/data/voc/AddOnTypes/50.7/aggregated-refined Panjab University, Chandigarh CU Chandigarh University http://data.elsevier.com/vocabulary/SciValFunders/100019306 http://sws.geonames.org/1269750/ Punjabi University SGGSWU The authors are grateful to the SGGSWU, Fatehgarh Sahib for providing lab facilities and SAIF lab Panjab University, Chandigarh for spectral analysis. The authors also acknowledge Punjabi University, Patiala, and IIT Ropar for their support. 0 https://doi.org/10.15223/policy-017 https://doi.org/10.15223/policy-037 https://doi.org/10.15223/policy-012 https://doi.org/10.15223/policy-029 https://doi.org/10.15223/policy-004 item S2468-8231(22)00792-1 S2468823122007921 1-s2.0-S2468823122007921 10.1016/j.mcat.2022.112906 315758 2023-01-19T20:22:43.641693Z 2023-02-01 1-s2.0-S2468823122007921-main.pdf https://s3-eu-west-1.amazonaws.com/prod-ucs-content-store-eu-west/content/pii:S2468823122007921/MAIN/application/pdf/d904fcec2d52c45e2e4b6c0a746d26ad/main.pdf main.pdf pdf true 3378194 MAIN 10 1-s2.0-S2468823122007921-main_1.png https://s3-eu-west-1.amazonaws.com/prod-ucs-content-store-eu-west/content/pii:S2468823122007921/PREVIEW/image/png/928ff1cfd049806bb3bd5eb746deb57a/main_1.png main_1.png png 58961 849 656 IMAGE-WEB-PDF 1 1-s2.0-S2468823122007921-gr3.jpg https://s3-eu-west-1.amazonaws.com/prod-ucs-content-store-eu-west/content/pii:S2468823122007921/gr3/DOWNSAMPLED/image/jpeg/01e126edd17b76f612a08d1530e42d09/gr3.jpg gr3 gr3.jpg jpg 57700 571 568 IMAGE-DOWNSAMPLED 1-s2.0-S2468823122007921-gr4.jpg https://s3-eu-west-1.amazonaws.com/prod-ucs-content-store-eu-west/content/pii:S2468823122007921/gr4/DOWNSAMPLED/image/jpeg/c11b843138c5850557d8d50a1e347aa6/gr4.jpg gr4 gr4.jpg jpg 40037 258 715 IMAGE-DOWNSAMPLED 1-s2.0-S2468823122007921-gr1.jpg https://s3-eu-west-1.amazonaws.com/prod-ucs-content-store-eu-west/content/pii:S2468823122007921/gr1/DOWNSAMPLED/image/jpeg/4035a586bd49d7aeed4cec11e6af64a8/gr1.jpg gr1 gr1.jpg jpg 51178 323 376 IMAGE-DOWNSAMPLED 1-s2.0-S2468823122007921-gr2.jpg https://s3-eu-west-1.amazonaws.com/prod-ucs-content-store-eu-west/content/pii:S2468823122007921/gr2/DOWNSAMPLED/image/jpeg/9363d396d0ada6491398a50610a290b0/gr2.jpg gr2 gr2.jpg jpg 34205 426 715 IMAGE-DOWNSAMPLED 1-s2.0-S2468823122007921-ga1.jpg https://s3-eu-west-1.amazonaws.com/prod-ucs-content-store-eu-west/content/pii:S2468823122007921/ga1/DOWNSAMPLED/image/jpeg/3b5783c6493274fcbdfed4cc3e74b6f6/ga1.jpg ga1 true ga1.jpg jpg 26672 201 301 IMAGE-DOWNSAMPLED 1-s2.0-S2468823122007921-sc2.jpg https://s3-eu-west-1.amazonaws.com/prod-ucs-content-store-eu-west/content/pii:S2468823122007921/sc2/DOWNSAMPLED/image/jpeg/ab1226888a20e51e27fc99680d243afe/sc2.jpg sc2 sc2.jpg jpg 15203 199 560 IMAGE-DOWNSAMPLED 1-s2.0-S2468823122007921-sc1.jpg https://s3-eu-west-1.amazonaws.com/prod-ucs-content-store-eu-west/content/pii:S2468823122007921/sc1/DOWNSAMPLED/image/jpeg/957659004a6b863c222df94c41733f82/sc1.jpg sc1 sc1.jpg jpg 31617 277 540 IMAGE-DOWNSAMPLED 1-s2.0-S2468823122007921-fx1.jpg https://s3-eu-west-1.amazonaws.com/prod-ucs-content-store-eu-west/content/pii:S2468823122007921/fx1/DOWNSAMPLED/image/jpeg/6c7d0030d08f3c6837bea2895681f95d/fx1.jpg fx1 fx1.jpg jpg 10199 141 395 IMAGE-DOWNSAMPLED 1-s2.0-S2468823122007921-gr7.jpg https://s3-eu-west-1.amazonaws.com/prod-ucs-content-store-eu-west/content/pii:S2468823122007921/gr7/DOWNSAMPLED/image/jpeg/93cdb4e3557197090690847723dbf110/gr7.jpg gr7 gr7.jpg jpg 42654 317 389 IMAGE-DOWNSAMPLED 1-s2.0-S2468823122007921-gr5.jpg https://s3-eu-west-1.amazonaws.com/prod-ucs-content-store-eu-west/content/pii:S2468823122007921/gr5/DOWNSAMPLED/image/jpeg/866c3b9f0877b1c03ac6ab2403043751/gr5.jpg gr5 gr5.jpg jpg 27574 271 511 IMAGE-DOWNSAMPLED 1-s2.0-S2468823122007921-gr6.jpg https://s3-eu-west-1.amazonaws.com/prod-ucs-content-store-eu-west/content/pii:S2468823122007921/gr6/DOWNSAMPLED/image/jpeg/76450348ab3adc0d8b49407686f236cd/gr6.jpg gr6 gr6.jpg jpg 44755 225 715 IMAGE-DOWNSAMPLED 1-s2.0-S2468823122007921-gr3.sml https://s3-eu-west-1.amazonaws.com/prod-ucs-content-store-eu-west/content/pii:S2468823122007921/gr3/THUMBNAIL/image/gif/7f0881e0f5856197d56bb928aa793327/gr3.sml gr3 gr3.sml sml 5461 164 163 IMAGE-THUMBNAIL 1-s2.0-S2468823122007921-gr4.sml https://s3-eu-west-1.amazonaws.com/prod-ucs-content-store-eu-west/content/pii:S2468823122007921/gr4/THUMBNAIL/image/gif/9cecbc8af497226fd3b6d730088cf21c/gr4.sml gr4 gr4.sml sml 8063 79 219 IMAGE-THUMBNAIL 1-s2.0-S2468823122007921-gr1.sml https://s3-eu-west-1.amazonaws.com/prod-ucs-content-store-eu-west/content/pii:S2468823122007921/gr1/THUMBNAIL/image/gif/0226c682e483f5c140e462ada7aceee7/gr1.sml gr1 gr1.sml sml 10819 164 191 IMAGE-THUMBNAIL 1-s2.0-S2468823122007921-gr2.sml https://s3-eu-west-1.amazonaws.com/prod-ucs-content-store-eu-west/content/pii:S2468823122007921/gr2/THUMBNAIL/image/gif/b4565eb74b95bdc57ac0a1eba5211737/gr2.sml gr2 gr2.sml sml 7358 131 219 IMAGE-THUMBNAIL 1-s2.0-S2468823122007921-ga1.sml https://s3-eu-west-1.amazonaws.com/prod-ucs-content-store-eu-west/content/pii:S2468823122007921/ga1/THUMBNAIL/image/gif/043fc1f43d428f75281cb1f8fc37fc54/ga1.sml ga1 true ga1.sml sml 26565 146 219 IMAGE-THUMBNAIL 1-s2.0-S2468823122007921-sc2.sml https://s3-eu-west-1.amazonaws.com/prod-ucs-content-store-eu-west/content/pii:S2468823122007921/sc2/THUMBNAIL/image/gif/84be9fd3416873ef63c4b10d6183c200/sc2.sml sc2 sc2.sml sml 3049 78 219 IMAGE-THUMBNAIL 1-s2.0-S2468823122007921-sc1.sml https://s3-eu-west-1.amazonaws.com/prod-ucs-content-store-eu-west/content/pii:S2468823122007921/sc1/THUMBNAIL/image/gif/a72e5bb132f7f542d5d87316ea672e5f/sc1.sml sc1 sc1.sml sml 5476 112 219 IMAGE-THUMBNAIL 1-s2.0-S2468823122007921-fx1.sml https://s3-eu-west-1.amazonaws.com/prod-ucs-content-store-eu-west/content/pii:S2468823122007921/fx1/THUMBNAIL/image/gif/5184b390eeb16026e8f3814d71cb52d1/fx1.sml fx1 fx1.sml sml 3105 78 219 IMAGE-THUMBNAIL 1-s2.0-S2468823122007921-gr7.sml https://s3-eu-west-1.amazonaws.com/prod-ucs-content-store-eu-west/content/pii:S2468823122007921/gr7/THUMBNAIL/image/gif/e8bb2c9eac792f22833be4482a3f0350/gr7.sml gr7 gr7.sml sml 9736 164 201 IMAGE-THUMBNAIL 1-s2.0-S2468823122007921-gr5.sml https://s3-eu-west-1.amazonaws.com/prod-ucs-content-store-eu-west/content/pii:S2468823122007921/gr5/THUMBNAIL/image/gif/d2ef43b899d1ed875c76d6db76d7d158/gr5.sml gr5 gr5.sml sml 7690 116 219 IMAGE-THUMBNAIL 1-s2.0-S2468823122007921-gr6.sml https://s3-eu-west-1.amazonaws.com/prod-ucs-content-store-eu-west/content/pii:S2468823122007921/gr6/THUMBNAIL/image/gif/52bff432ef853f98d7f5ad4ae4248c1c/gr6.sml gr6 gr6.sml sml 8332 69 219 IMAGE-THUMBNAIL 1-s2.0-S2468823122007921-gr3_lrg.jpg https://s3-eu-west-1.amazonaws.com/prod-ucs-content-store-eu-west/content/pii:S2468823122007921/HIGHRES/image/jpeg/5fc86b552862966987ef524c969306f1/gr3_lrg.jpg gr3 gr3_lrg.jpg jpg 431364 2529 2517 IMAGE-HIGH-RES 1-s2.0-S2468823122007921-gr4_lrg.jpg https://s3-eu-west-1.amazonaws.com/prod-ucs-content-store-eu-west/content/pii:S2468823122007921/HIGHRES/image/jpeg/9366531af3aa5905bc1748d5748469ca/gr4_lrg.jpg gr4 gr4_lrg.jpg jpg 333867 1144 3167 IMAGE-HIGH-RES 1-s2.0-S2468823122007921-gr1_lrg.jpg https://s3-eu-west-1.amazonaws.com/prod-ucs-content-store-eu-west/content/pii:S2468823122007921/HIGHRES/image/jpeg/a6f2d7ceda4aaae0bda3a9302d894e25/gr1_lrg.jpg gr1 gr1_lrg.jpg jpg 353378 1430 1667 IMAGE-HIGH-RES 1-s2.0-S2468823122007921-gr2_lrg.jpg https://s3-eu-west-1.amazonaws.com/prod-ucs-content-store-eu-west/content/pii:S2468823122007921/HIGHRES/image/jpeg/787c7e16f69f62e22ac1be8060b6072a/gr2_lrg.jpg gr2 gr2_lrg.jpg jpg 416790 1889 3168 IMAGE-HIGH-RES 1-s2.0-S2468823122007921-ga1_lrg.jpg https://s3-eu-west-1.amazonaws.com/prod-ucs-content-store-eu-west/content/pii:S2468823122007921/HIGHRES/image/jpeg/f18be32130aa8943bbe9cd06a485d2b6/ga1_lrg.jpg ga1 true ga1_lrg.jpg jpg 216487 889 1333 IMAGE-HIGH-RES 1-s2.0-S2468823122007921-sc2_lrg.jpg https://s3-eu-west-1.amazonaws.com/prod-ucs-content-store-eu-west/content/pii:S2468823122007921/HIGHRES/image/jpeg/030efe8bf42454b702441cf12b4940e8/sc2_lrg.jpg sc2 sc2_lrg.jpg jpg 117192 882 2480 IMAGE-HIGH-RES 1-s2.0-S2468823122007921-sc1_lrg.jpg https://s3-eu-west-1.amazonaws.com/prod-ucs-content-store-eu-west/content/pii:S2468823122007921/HIGHRES/image/jpeg/759e3d1141918ddb6f03a35cba0c229b/sc1_lrg.jpg sc1 sc1_lrg.jpg jpg 225188 1228 2392 IMAGE-HIGH-RES 1-s2.0-S2468823122007921-fx1_lrg.jpg https://s3-eu-west-1.amazonaws.com/prod-ucs-content-store-eu-west/content/pii:S2468823122007921/HIGHRES/image/jpeg/e13c75ce33893d2518a2df682cc34525/fx1_lrg.jpg fx1 fx1_lrg.jpg jpg 71726 625 1749 IMAGE-HIGH-RES 1-s2.0-S2468823122007921-gr7_lrg.jpg https://s3-eu-west-1.amazonaws.com/prod-ucs-content-store-eu-west/content/pii:S2468823122007921/HIGHRES/image/jpeg/941059af04c724360a3199738f4d7aa2/gr7_lrg.jpg gr7 gr7_lrg.jpg jpg 240748 1406 1725 IMAGE-HIGH-RES 1-s2.0-S2468823122007921-gr5_lrg.jpg https://s3-eu-west-1.amazonaws.com/prod-ucs-content-store-eu-west/content/pii:S2468823122007921/HIGHRES/image/jpeg/268847599daeb65c6369b34a1f4b068b/gr5_lrg.jpg gr5 gr5_lrg.jpg jpg 204689 1199 2262 IMAGE-HIGH-RES 1-s2.0-S2468823122007921-gr6_lrg.jpg https://s3-eu-west-1.amazonaws.com/prod-ucs-content-store-eu-west/content/pii:S2468823122007921/HIGHRES/image/jpeg/7c94d8b32bf8737e9b25a4c3c7a9bc77/gr6_lrg.jpg gr6 gr6_lrg.jpg jpg 313127 998 3167 IMAGE-HIGH-RES 1-s2.0-S2468823122007921-mmc1.docx https://s3-eu-west-1.amazonaws.com/prod-ucs-content-store-eu-west/content/pii:S2468823122007921/mmc1/MAIN/application/vnd.openxmlformats-officedocument.wordprocessingml.document/1895b0118b5eb12dfc257ed1d4c194bf/mmc1.docx mmc1 mmc1.docx docx 994152 APPLICATION 1-s2.0-S2468823122007921-am.pdf https://s3-eu-west-1.amazonaws.com/prod-ucs-content-store-eu-west/content/egi:10XFVQS46G6/MAIN/application/pdf/2bedc2c38db5253b1468d56801133356/am.pdf am am.pdf pdf false 1213507 AAM-PDF MCAT 112906 112906 S2468-8231(22)00792-1 10.1016/j.mcat.2022.112906 Elsevier B.V. Fig. 1 FTIR spectra of (a) DBU; (b) Imidazole; (c) 1-methylimidazole; (d) 2-methylimidazole; (e) [DBUH]+[Im]− IL; (f) [DBUH]+[1-MIm]− IL; (g) [DBUH]+[2-MIm]− IL. Fig. 1 Fig. 2 1H NMR spectra of 2-methylimidazole, DBU and [DBUH]+[2-MIm]−. Fig. 2 Fig. 3 Proposed mechanism for the synthesis of DHPMs using [DBUH]+[2-Mim]− Ils protic ionic liquids. Fig. 3 Fig. 4 (a) Optimized Structure of [DBUH]+[2-MIm]− IL; (b) HOMO for IL showing the availability of electrons on [2-MIm]−; (c) LUMO for IL showing un-occupied orbitals largely concentrated on [DBUH]+. Fig. 4 Fig. 5 (a) DFT studies showing the interaction of cinnamaldehyde and urea with IL; IL acting as a catalyst support for the formation of Schiff base; (b) optimized structure for the final DHPM product. Fig. 5 Fig. 6 Bar graphs showing the (a) change in the catalytic amount of [DBUH]+[2-MIm]− IL and, (b) amount of DHPM product after each run. Fig. 6 Fig. 7 FTIR spectrum of [DBUH]+[2-MIm]− ILs for four consecutive runs. Fig. 7 Scheme 1 Synthesis of DBU-MIm coupled ionic liquids (ILs). Scheme 1 Scheme 2 Biginelli reaction of cinnamaldehyde, urea and acetylacetone in presence of [DBUH]+[Im]− ILs. Scheme 2 Table 1 Synthesis of [DBUH]+[Im]− ILs. Table 1 S. No. Reactants Duration (h) TemperatureIn °C Product Yield (%) Physical state 1 1:1DBU:Im 2 60 [DBUH]+[Im]− (3a) 86 Yellow viscous liquid 2 1:1DBU:1-MIm 2.5 70 [DBUH]+ [1-MIm]− (3b) 87 Pale-yellow viscous liquid 3 1:1DBU:2-MIm 2.5 70 [DBUH]+ [2-MIm]− (3c) 85 Yellow viscous liquid Table 2 Biginelli synthesis of DHPM in the presence of [DBUH]+[Im]− ILs *. Table 2 S. No. Catalyst % Yield of DHPM (7) 1 DBU 59 2 Im 40 3 DBU-Im IL 80 4 2-MIm 47 5 DBU-2MIm IL 91 6 1-MIm 43 7 DBU-1MIm IL 87 * Reaction Conditions: cinnamaldehyde (10 mmol), acetylacetone (10 mmol), urea (12 mmol); 10 mol% catalyst; 90 °C; 45 min. Table 3 Optimization of reaction conditions for the synthesis of DHPMs using [DBUH]+[2-MIm]− ILs. Table 3 S. No. Catalyst Catalyst amount(mol%) Temperature in °C Duration 7 (% Yield) 1 – – r.t. Overnight – 2 [DBUH]+[Im]− 10 r.t. Overnight 12 3 [DBUH]+[1-MIm]− 10 r.t. Overnight 15 4 [DBUH]+[2-MIm]− 10 r.t. Overnight 18 5 [DBUH]+[Im]− 10 60 45 min 25 6 [DBUH]+[1-MIm]− 10 60 45 min 28 7 [DBUH]+[2-MIm]− 10 60 45 min 42 8 [DBUH]+[Im]− 10 90 45 min 74 9 [DBUH]+[1-MIm]− 10 90 45 min 82 10 [DBUH]+[2-MIm]− 10 90 45 min 91 11 [DBUH]+[2-MIm]− 15 90 45 min 91 12 [DBUH]+[2-MIm]− 5 90 45 min 76 13 [DBUH]+[Im]− 10 90 30 min 69 14 [DBUH]+[1-MIm]− 10 90 30 min 76 15 [DBUH]+[2-MIm]− 10 90 30 min 82 16 [DBUH]+[Im]− 10 90 60 min 72 17 [DBUH]+[1-MIm]− 10 90 60 min 81 18 [DBUH]+[2-MIm]− 10 90 60 min 89 19 [DBUH]+[2-MIm]− 10 120 45 min 82 20 [DBUH]+[2-MIm]− 10 120 45 min 91 21 [DBUH]+[2-MIm]− 10 120 45 min 91 Reaction Conditions: cinnamaldehyde (10 mmol), acetylacetone (10 mmol), urea (12 mmol). Table 4 [DBUH]+[2-MIm]− IL catalyzed synthesis of DHPMs in different solvent media. Table 4 S. No. Solvent Time Temp. ( °C) Yield (%) 1 – 45 min 90 °C 91 2 Ethanol 45 min reflux 67 3 Ethanol overnight reflux 79 4 Acetonitrile 45 min reflux 64 5 Acetonitrile overnight reflux 75 6 Water 45 min reflux 22 7 Water overnight reflux 30 8 Toluene 45 min reflux 72 9 Toluene overnight reflux 83 Reaction Conditions: cinnamaldehyde (10 mmol), acetylacetone (10 mmol), urea (12 mmol); 10 mol% IL catalyst; 90 °C. Table 5 [DBUH]+ [2-MIm]− IL catalyzed synthesis of cinnamaldehyde based DHPMs/thiones. Table 5 Image, table 5 S. No. R1 R2 Aromatic aldehyde X Yield (%) Mp (in °C) Identity Found Reported 1 CH3 CH3 C6H5CHCH O 91 227–230 230–232 [32] 7a 2 CH3 CH3 C6H5CHCH S 86 165–167 160–162 [32] 7b 3 OC2H5 CH3 C6H5CHCH O 89 229–231 230–232 [33] 7c 4 OC2H5 CH3 C6H5CHCH S 84 167–169 163–165 [32] 7d 5 OC2H5 CH3 4–OCH3-C6H4CHCH O 82 118–120 – 7e 6 OC2H5 CN C6H5CHCH S 86 100–102 – 7f 7 OCH3 CH3 C6H5CHCH O 90 216–218 – 7g 8 OCH3 CH3 C6H5CHCH S 88 192–193 – 7h 9 OC(CH3)3 CH3 C6H5CHCH O 89 214–216 – 7i 10 OC(CH3)3 CH3 C6H5CHCH S 87 196–198 – 7j Reaction Conditions: cinnamaldehyde (10 mmol), β-ketoester or acetylacetone (10 mmol), urea or thiourea (12 mmol); 10 mol% IL catalyst; 90 °C, 45 min. Table 6 Comparative account of synthesis of DHPMs using different ILs under solvent-free conditions. Table 6 S. No. Ionic liquid Catalyst amount(mol%) Temp. ( °C) Time(min) Yield (%) Refs. 1 [BImBS][Cl] 20 90 10(Microwave) 92 [31a] 2 [BMIm][NbCl6] 8.5 100 30 90 [31b] 3 COF-IM-SO3H 1 90 180 98 [31c] 4 TrEt-C6H5SO3H 10 80 50 93 [31d] 5 [DBU]Ac 3.03 25 5 (Grinding) 93 [31e] 6 [DBUH]+[MIm]− 10 90 45 91 present work DBU-MIm coupled ionic liquids as reusable catalysts for the Biginelli reaction Monika Sharma Investigation Writing – original draft a Khushboo Verma Investigation Writing – original draft a Ajeet Kaushik Writing – review & editing b c Jasminder Singh Conceptualization Investigation Validation Writing – review & editing d ⁎ Avtar Singh Conceptualization Validation Writing – review & editing e f ⁎⁎ Rahul Badru Conceptualization Methodology Investigation Resources Writing – review & editing Supervision Project administration a ⁎ a Department of Chemistry, Sri Guru Granth Sahib World University, Fatehgarh Sahib, Punjab 140406, India Department of Chemistry Sri Guru Granth Sahib World University Fatehgarh Sahib Punjab 140406 India aDepartment of Chemistry, Sri Guru Granth Sahib World University, Fatehgarh Sahib, Punjab 140406, India b NanoBioTech Laboratory, Department of Environmental Engineering, Florida Polytechnic University, Lakeland, Florida 33805, USA NanoBioTech Laboratory, Department of Environmental Engineering Florida Polytechnic University Lakeland Florida 33805 USA bNanoBioTech Laboratory, Department of Environmental Engineering, Florida Polytechnic University, Lakeland, Florida 33805, USA c School of Engineering, University of Petroleum and Energy Studies (UPES), Dehradun, India School of Engineering University of Petroleum and Energy Studies (UPES) Dehradun India cSchool of Engineering, University of Petroleum and Energy Studies (UPES), Dehradun, India d Swami Premanand Mahavidyalaya, Hoshiarpur, Punjab 144211, India Swami Premanand Mahavidyalaya Hoshiarpur Punjab 144211 India dSwami Premanand Mahavidyalaya, Hoshiarpur, Punjab 144211, India e Research and Development, Molekule Inc, 3802 Spectrum BLVD, Tampa, Florida 33612, USA Research and Development Molekule Inc 3802 Spectrum BLVD Tampa Florida 33612 USA eResearch and Development, Molekule Inc, 3802 Spectrum BLVD, Tampa, Florida 33612, USA f Department of Chemistry, Sri Guru Teg Bahadur Khalsa College, Anandpur Sahib, Punjab 140118, India Department of Chemistry Sri Guru Teg Bahadur Khalsa College Anandpur Sahib Punjab 140118 India fDepartment of Chemistry, Sri Guru Teg Bahadur Khalsa College, Anandpur Sahib, Punjab 140118, India ⁎ Corresponding authors. ⁎⁎ Corresponding author at: Research and Development, Molekule Inc, 3802 Spectrum BLVD, Tampa, Florida 33612, USA. Research and Development Molekule Inc 3802 Spectrum BLVD Tampa Florida 33612 USA In present work, the application of a novel set of 1,8-Diazabicyclo[5.4.0]undec-7-ene (DBU) and methylimidazole (MIm) coupled ionic liquids (ILs) in the Biginelli reaction has been investigated. In the modified Biginelli reaction, cinnamaldehyde, urea, and 1,3-diketone condensed in the presence of 10 mol% of the DBU-MIm coupled IL catalyst at 90 °C to afford dihydropyrimidinones in high to excellent yields in 45 min. Additionally, the effect of temperature, catalytic amount, and solvent has also been unfolded. The reaction has been found to the follow iminium ion mechanism and the synergic role played by the [DBUH]+ and [MIm]− moieties has been established by DFT calculations. The easy post-procedure recovery and reusability of the DBU-MIm IL catalysts make the present protocol of Biginelli synthesis simple, benign and reproducible. Graphical abstract Image, graphical abstract Keywords Biginelli Dihydropyrimidines DBU Synergic catalysis Coupled ionic liquids Data availability Data will be made available on request. Introduction The development of more sustainable catalytic processes is critical in modern chemistry. Ionic liquids (ILs) offer a means of achieving this goal to a greater extent as they have been reported to catalyze a number of organic transformations [1–3] under much milder reaction conditions than those described in their absence. The ILs have been claimed to be the best alternative to conventional organic solvents in terms of toxicity, volatility, thermal stability, and environmental concerns [4]. Besides this, the usage of IL catalysts in the organic transformations has resulted in higher percentages of selectivity and yield. Imidazole-derived ILs, for example, have been investigated for their catalytic behavior in numerous organic transformations, including condensation reactions [5,6], cycloadditions [7], coupling reactions [8,9], and multicomponent reactions (MCRs) [10–12]. In all these reactions, the product was achieved in much higher yields, with high selectivity and enantioselectivity. In some cases, the presence of acidic proton in imidazolidinium (Im) moiety flanked by two nitrogen atoms enhanced the electrophilic character of the substrate and thus catalyzed the reactions [13]. Others have reported that Im-derived ILs stimulate product formation by lowering the activation energy barrier by stabilizing polar intermediates via H-bonding interactions or by enhancing the stability of metal catalysts against leaching [14]. The 1,8-Diazabicyclo(5.4.0) undec-7-ene (DBU) is a super base that has been used as an organic catalyst in the Nef reaction [15] and C-N cross-coupling reaction [16]. DBU is acting as a base and deprotonating agent. In addition to this, DBU also acts as a nucleophile and non-nucleophilic base in many organic transformations in recent years [17–20]. Li et al. reported an efficient C-N bond formation of active methylene with α-diazocarbonyls in the presence of DBU [21]. They suggested that DBU as a nucleophile activates the methylene group and N-terminal of α-diazocarbonyls to afford electrophilic intermediate which initiates C-N bond formation. Biginelli reaction is one of the prime MCRs that involves the condensation of aldehydes, dicarbonyl compound, and urea or thiourea in a single step [22], leading to the synthesis of dihydropyrimidinones (DHPMs). The end products of Biginelli reaction, DHPMs, are important biomaterials in pharmaceutical industry and are extensively used as calcium channel blockers [23] and antihypertensive agents [24], and also, they have been reported to possess antibacterial [25], anticancer [26], anti-inflammatory [27] antidiabetic [28], anti-SARS-CoV-2 activity [29] and anti- HIV activity [30]. There are several reports of DHPM synthesis using IL as catalysts in Biginelli reaction under homogenous or heterogeneous conditions [31a–d]. In two separate studies, [MImH]OAc [32] and [BCMIm]Cl [33], ILs have been reported to catalyze the Biginelli reaction with quite high efficiency and selectivity. In the former case, the authors reported that refluxing the reaction mixture in the presence of [MImH]OAc at 100 °C yielded 83% of the DHPMs. In the latter, 96% yield of the DHPM product was isolated in the [BCMIm]Cl catalyzed Biginelli reaction carried out at 80 °C for 15–25 min. Although the methods served well in achieving higher yields of the DHPM products avoiding the use of external solvents, they suffered from drawbacks like the use of corrosive mineral acids in the preparation of the protic [BCMIM][Cl] IL catalysts and longer durations involved in their synthesis. To the best of our knowledge, no reports of Biginelli synthesis in the presence of [DBUH]+[MIm]− protic ILs have been published. We demonstrate herein for the first time the use of [DBUH]+[MIm]− ILs in the Biginelli reaction to synthesize cinnamaldehyde-based dihydropyrimidinone (DHPM) derivatives. The DBU-MIm coupled ILs have been synthesized by the abstraction of N-H proton of imidazolium moiety by DBU base as described by Zhu et al. [34]. The as-prepared ILs have been employed in the Biginelli reaction. The present work presents an environment-benign synthetic procedure for DHPMs with advantages like high product yields, a simple-to-recover and reusable catalyst, and the absence of toxic solvents. Results and discussion Synthesis of the catalyst Initially, the catalyst to be used in the Biginelli reaction i.e. [DBUH]+[Im]− ILs were obtained by neutralization reaction between the superbase DBU (1) and imidazole or methyl-substituted imidazole (2) at 60–70 °C [34] as per Scheme 1. The superbase DBU abstracts the proton of the imidazole moiety to form the corresponding protic [DBUH]+[Im]− ILs 3a-c. The formation of the ILs 3a-c was preliminarily indicated by a change of solution color from transparent to yellow. Furthermore, comparative FTIR and 1H NMR analyses of imidazole, DBU, and the IL have validated their formation (Figs. 1 and 2 ). Fig. 1 depicts the FTIR spectrum for imidazoles, DBU, and all synthesized ILs. The multiple peaks beyond 3000 cm−1 corresponding to the H-bonded amine group present in the FTIR spectrum of imidazole ( Fig. 1b) vanished in the FTIR spectrum of resulting IL 3a (Fig. 1e), whereas all of the peaks corresponding to DBU IR stretching were retained (Fig. 1a). Similar peak shifting was observed in the FTIR spectrum of the 1-MIm and 2-MIm coupled ILs (Fig. 1f and g) in comparison to their parent compounds (Fig. 1c and d). The shifting of the signal at δ 12.9, corresponding to N-H proton of the pure imidazole to δ 5.8 in the 1H NMR spectrum of [DBUH]+[2-MIm]− (Fig. 2), confirms the proton exchange between the DBU and Im moieties. The other DBU and Im protons appear at their usual positions in the 1H NMR spectrum. However, no noteworthy difference was observed in the 13C NMR spectra of the two compounds (Figs. S3 and S6). On a similar note, the signal due to exchanged N-H proton i.e. proton of [DBU-H]+ moiety appeared at δ 4.7 and δ 3.9 in the 1H NMR spectrum of IL-3a (Fig. S2) and IL-3b (Fig. S5), respectively. All the ILs could be obtained in an interval of 2–2.5 h upon refluxing the contents at a mild temperature of 60–70 °C (Table 1 ). The IR and NMR spectra of the synthesized ILs 3a-c is provided in Figs. S1–S9. Catalytic studies of [DBUH]+[Im]− ILs in the synthesis of DHPMs The catalytic behavior of [DBUH]+[Im]− ILs was assessed in the Biginelli reaction for the synthesis of DHPMs. As Im and DBU-based ILs have already been reported to catalyze Biginelli reaction in an efficient manner [20,35], a model Biginelli reaction of cinnamaldehyde, acetylacetone, and urea was carried out separately in the presence of the 10 mol% each of DBU, MIm and the [DBUH]+[2-MIm]− IL as per Scheme 2 and the results are summarized in Table 2 . It has been found that when 10 mol% of DBU alone was used as a catalyst, a moderate yield of 59% of DHPMs was obtained in 45 min upon refluxing at 90 °C (Table 2, entry 1). And only 47% of the product (Table 2, entry 2) could be isolated in the presence of 10 mol% of imidazole as a catalyst under similar conditions. But the use of [DBUH]+[Im]− IL in the same model reaction resulted in an excellent yield of DHPM (80%) of the target product in an interval of 45 min (Table 2, entry 3, 5,7). The other two ILs i.e. 1-MIm and 2-MIm coupled DBU ILs afforded respectively, 87% and 91% of the DHPM product under similar reaction conditions. These findings suggested that the DBU-Im combination catalyzed the Biginelli reaction in a synergic manner. The 2-MIm coupled DBU IL provided the best catalytic results among the various ILs used. The synergic role of the [DBUH]+[2-MIm]− IL has been established using DFT studies and explained under the heading mechanistic studies. Optimization of reaction conditions for the synthesis of DHPMs The conditions were optimized by running the model reaction at various temperatures and with different amounts of catalyst. Only a trace amount of DHPMs could be obtained at room temperature in the presence of 10 mol% of [DBUH]+[Im]− IL catalyst (Table 3 , entries 2–4). Increased reaction temperature resulted in higher yields of DHPM (Table 3, entries 8–10). However, increasing the catalytic dosage didn't result in a significant increase in product yield (Table 3, entries 10 and 11). The Biginelli reaction was found to be best catalyzed by the [DBUH]+[2-MIm]− IL, with a maximum of 91 percent of DHPM product isolated at 90 °C with 10 mol% of the catalyst in 45 min (Table 3, entry 10). The observed catalytic activity among imidazole ILs was found to be in the order 2-MIm>1-MIm>Im (Table 3, entries 8–10), which may be attributed to the nucleophilic strength of the anionic part of the DBU-Im coupled ILs. In comparison to the non-substituted imidazolide anion, the methyl-substituted imidazolide anions are stronger nucleophiles. Thus, 10 mol% of [DBUH]+[2-MIm]− catalytic dosage, a temperature of 90 °C, and a duration of 45 min were chosen for further experimentation. Synthesis of DHPMs in different solvent systems Further, to evaluate the influence of polar solvents, the same model reaction was carried out in the presence of ethanol, acetonitrile, water, dichloromethane, and toluene and the results are summed up in Table 4 . It was found that with 10 mol% of catalyst, a maximum of 59%, 45%, and 30% (Table 4, Entries 3,5,7) of DHPM product was yielded in ethanol, acetonitrile, and water, respectively, under refluxing conditions when the reaction continued overnight. The poor yields obtained in presence of polar solvents may be attributed to the solvation of the cationic and anionic parts of the IL catalyst which impairs their catalytic behavior. However, the use of non-polar solvents had little or no effect on the yields of the DHPM products in the DBU-Im catalyzed Biginelli reaction (Table 4, Entries 8–11). Notably, the yield of the DHPM under solvent-less conditions was also found to be as high as 91% in 45 min (Table 4, entry 1). Thus, solvent-less conditions were chosen for further synthesis of DHPM derivatives reacting cinnamaldehyde with a variety of aldehydic substrates and urea or thiourea. Synthesis of cinnamaldehyde based DHPMs and their thione analogs The study is now extended to the synthesis of a series of cinnamaldehyde-based DHPMs. Under the optimized reaction conditions and with 10 mol% of the [DBUH]+[2-MIm]− catalyst, cinnamaldehyde condensed with urea/thiourea and acetylacetone/ethyl acetoacetate to give rise to the corresponding products in high to excellent yields (Table 5 ). The reaction of cinnamaldehyde and urea with acetylacetone and ethyl acetoacetate afforded 89% (Table 5, Entry 1) and 84% (Table 5, Entry 3) of the DHPM product. The yield of the thione analogs was also found to be high (Table 5, Entry 2 and 4). Melting points observed for the synthesized DHPMs and thiones matched with that reported in the literature. Further, the formation of products 7a-i has been validated by their 1H NMR and 13C NMR spectral analysis (Figs. S10–S39). Mechanistic studies As the Biginelli reaction involves a polar intermediate, the [DBUH]+[Im]− protic ILs have been found to catalyze the same. The IL catalyst lowers the activation barrier and leads to the easy formation of the DHPM product [36]. The proposed mechanism is shown in Fig. 3 . In one of the mechanisms reported for the Biginelli reaction, the aldehyde and urea condense initially to provide the iminium ion intermediate which further combines with a ketone and cyclizes to afford the final DHPM product. By H-bonding interactions, the [DBUH]+ counterpart of the IL catalyst used in the current methodology appears to boost the nucleophilicity of the carbonyl carbon, whereas the [2-MIm]− anion aids in increasing the negative charge density on the nitrogen of urea by abstracting its proton. On a similar note, imidazole anion [MIm]− abstracts hydrogen from the CH2 group of acetylacetone and assisted its attack onto the imine bond resulting in the formation of cyclized DHPM product as shown in Fig. 3. The neutralized DBU and MIm species interacted meanwhile to regenerate the IL catalyst. The proposed mechanism was also put to test using DFT studies. It was observed that the proposed mechanism holds good with DFT studies. The optimized structure of [DBUH]+[2-MIm]− is shown in Fig. 4 a. The energies for the DBU and 2-MIm components decreased considerably from −462 Hartree and −266 Hartree to −728 Hartree during the formation of [DBUH]+[2-MIm]− coupled IL. The energy results also authenticated the hydrogen-bonding interactions between the two components of IL moiety. Availability of HOMO on [2-MIm]− and LUMO on [DBUH]+ (Fig. 4b and c) also indicates the transfer of charge between the two. DFT studies have further helped in strengthening the idea that ionic liquid formed is acting as a catalyst in bringing the two components of the complex together to form a Schiff base (Fig. 5 a), with considerable lowering in energy to approximately −1376 Hartree. The ionic liquid comes in perfect sync to incorporate the final piece of the complex to the Schiff base formed earlier with final optimized energy of −841 Hartree approx. (Fig. 5b). Comparative catalytic studies of different ILs in Biginelli reaction Finally, the results of the present protocol were compared with those reported in the presence of other ILs. The new method produced good to exceptional yields of cinnamaldehyde DHPMs that were comparable to those achieved with previously published ILs (Table 6 ). With 10 mol% of DBU-2MIm coupled IL catalyst, a maximum of 82–91% of product yields were achieved in 45 min at 90 °C. The procedure avoids the use of solvents and the requirement of specialized reaction conditions like in a few cases (Table 6, Entries 1 and 5). Thus, the present protocol for Biginelli synthesis of DHPMs is simple, efficient, and reproducible. Recyclization and reusability of the [DBUH]+[2-MIm]− IL The [DBUH]+[2-MIm]− IL catalyst recovered after extraction of the DHPM product in ethyl acetate layer was vacuum dried prior to its use for the next run. The recovered IL catalyst was employed for 4 consecutive runs, in the Biginelli reaction of cinnamaldehyde with urea and acetylacetone, to explore its reusability. The DHPM product yield was found to decrease slightly (Fig. 6 a) owing to a little loss in the amount of recovered catalyst after each run (Fig. 6b). However, the retention of all the peaks from the fresh IL catalyst in the FTIR spectra of the recycled catalyst (Fig. 7 ) confirms the stability of the DBU-MIm IL catalyst during the reaction course and established it as a reusable material. The stability of the IL catalyst has also been established on the basis of TGA analysis (Fig. S10). Conclusion In summary, a new class of DBU-Im coupled ionic liquids have been developed as an efficient and reusable catalyst in the Biginelli reaction. The catalysts have been found to generate the dihydropyrimidinone product under much milder conditions. Among the various DBU-Im coupled ILs, the [DBUH]+[2-MIm]− IL showed the best catalytic performance which was attributed to its greater nucleophilicity. DFT studies reveal the synergic role of the cationic and anionic parts of the [DBUH]+[MIm]− ILs under study. The IL assists in the easy formation of the Schiff base and further its cyclization with 1,3-diketone to give DHPM as the final product. The DBU-Im coupled ILs could be easily recovered and reused. Our findings establish the DBU-Im coupled ILs catalyzed Biginelli reaction to be efficient, solvent-less, and greener routes to produce DHPMs. Experimental General Chemicals used in the synthesis were purchased from Sigma Aldrich, Spectrochem, and CDH. Monitoring of the chemical reactions was done using thin-layer chromatography (TLC). TLC plates were developed by coating glass plates with silica gel in chloroform. Marking of the spot was done using capillary tubes. The spot was detected using an iodine chamber. A 3:2 mixture of hexane and ethyl acetate was used to elute the compounds. Melting points were determined using the open capillary method. Final identification of the products was done using FTIR, 1H NMR, and 13C NMR spectral techniques. The 1H NMR and 13C NMR spectra were recorded on Bruker Avance Neo 500 MHz spectrometer using CDCl3 and DMSO-d6 as solvents, and TMS as an internal standard. Chemical shifts are reported in δ values. The FTIR spectra of the compounds were recorded using a Bruker Alpha FTIR spectrophotometer. Theoretical studies were performed using the DMol3 package with GGA-DFT, using double numerical plus polarization (DNP) as a basic set [37a-b]. All electrons of the system were treated with B3LYP [38a–c] local functions for the exchange-correlation potential. General procedure for the synthesis of [DBUH]+[2-MIm]− ILs The synthesis of DBU-Im coupled ILs has been carried out by a neutralization reaction between superbase DBU and the imidazole derivatives [34]. In a typical reaction, equimolar amounts of DBU and imidazole were mixed in a 100 ml round bottom flask (RBF) and stirred for 2–3 h at 60–70 °C using a magnetic stirrer. Meanwhile, the color of the solution turned yellow. Then, the excess ethyl acetate was evaporated to obtain the desired ionic liquid. Ionic liquid yield was calculated by following the solvent extraction method was used for recovery and yield of ionic liquid [31f]. Silver nitrate tests were performed to ensure complete removal of metal halide salts. The remaining water content in ILs was detected by Karl Fischer method [31f]. (3a) [DBUH] + [Im] − ionic liquid (Figs. S1–S3): Yellow viscous liquid; 1H NMR (500 MHz, CDCl3): δ 7.5 (s, 1H, Im), 7.0 (s, 2H, Im), 4.7 (s, 1H, NH), 3.2–3.3 (m, 8H, DBUH), 2.4–2.6 (m, 5H, DBUH), 1.7–1.8 (m, 4H, DBUH); 13C NMR (125 MHz, CDCl3): δ 175.92, 163.50, 135.20, 121.57, 53.21, 49.35, 45.62, 34.50, 31.17, 28.34, 24.86, 23.26; FTIR spectrum (ν cm–1): 3360 (N-H), 3111, 2924, 2854, 1622, 1437, 1364, 1315. (3b) [DBUH]+[1-MIm]− ionic liquid (Figs. S4–S6): Pale-yellow viscous liquid; 1H NMR (500 MHz, CDCl3): δ 7.2 (s, 1H, Im), 6.9 (s, 2H, Im), 6.4 (s, 1H, NH, Im), 3.9 (bs, N-H), 3.3 (s, 3H, CH3), 2.8 (m, 8H, DBUH), 2.5–2.4 (m, 6H, DBUH), 2.2–1.9 (m, 3H, DBUH), 1.4–1.1 (m, 7H, DBUH); 13C NMR (125 MHz, CDCl3): δ 175.50, 164.75, 137.42, 119.85, 53.33, 49.02, 48.88, 45.40, 36.66, 30.71, 28.08, 26.60, 23.99; FTIR spectrum (ν cm–1): 3374 (N-H), 3100, 2932, 1611, 1447, 1315. (3c) [DBUH]+[2-MIm]− ionic liquid (Figs. S7–S9): Yellow viscous liquid; 1H NMR (500 MHz, CDCl3): δ 7.2 (s, 1H, NH, Im), 6.3 (s, 2H, Im), 5.8 (s, 1H, NH), 2.9–2.7 (m, 8H, DBUH), 2.1 (m, 2H, DBUH), 2.0 (s, 3H, CH3), 1.3–1.1 (m, 7H, DBUH); 13C NMR (125 MHz, CDCl3): δ 175.85, 163.61, 144.18, 120.74, 56.35, 52.80, 49.17, 45.40, 36.53, 30.65, 28.49, 24.66; FTIR spectrum (ν cm–1): 3226 (N-H), 3092, 2929, 2861, 1615, 1485, 1369, 1313. General procedure for the synthesis of DHPMs All the reactions were conducted in a single-necked 100 mL RBF equipped with a magnetic stirrer. In a typical reaction, aldehyde (10 mmol), acetylacetone (10 mmol), and urea (12 mmol) were taken in an oven-dried 100 ml RBF. To this mixture 10 mol% of the DBU-Im coupled IL catalyst was added and the contents of the RBF were refluxed at 90 °C for 45 min using a magnetic stirrer. After the completion of the reaction as judged by TLC, the reaction mixture was allowed to cool to room temperature. The contents were then poured into a beaker containing 100 mL ice-cold water. A yellow solid got precipitated out, which was filtered through suction. The IL was recovered from the aqueous filtrate by solvent extraction with chloroform. The yellow precipitates of the DHPM product were recrystallized out of hot ethanol. Characterization data of 3,4-DHPMs/thiones (7a) (5-acetyl-6-methyl-2-oxo-4-styryl-1,2,3,4-tetrahydropyrimidine-5-yl)-ethan-1-one (Figs. S10–S12): white solid (mp 227–230 °C); 1H NMR (500 MHz, DMSO-d6): δ 9.1 (s, 1H, NH), 7.6 (s, 1H, NH), 7.4–7.2 (m, 5H, Ar-H), 6.4 (d, 1H, CH-Ph), 6.1 (d, 1H, CH-Ph), 4.8 (t, 1H), 2.2 (s, 6H, CH3); 13C NMR (125 MHz, DMSO-d6): δ 193.93, 152.62, 147.90, 136.12, 129.88, 128.53, 127.48, 126.25, 108.38, 51.74, 30.11, 18.84; FTIR spectrum (ν cm–1): 3743, 3279, 2896, 1689, 1613, 1530, 1230, 971, 755. (7b) 1-(6-methyl-4-styryl-2-thioxo-1,2,3,4-tetrahydropyrimidin-5-yl)ethan-1-one (Figs. S13–S15): light yellow solid (mp 165–167 °C); 1H NMR (500 MHz, DMSO-d6): δ 10.2 (s, 1H, NH), 9.5 (d, 1H, NH), 7.4–7.2 (m, 5H, Ar-H), 6.4 (d, 1H, CH-Ph), 6.1 (d, 1H, CH-Ph), 4.6 (t, 1H), 2.2 (s, 6H, CH3); 13C NMR (125 MHz, DMSO-d6): δ 194.60, 174.92, 144.47, 135.84, 129.35, 128.64, 127.80, 126.41, 109.33, 51.98, 30.21, 18.22; FTIR spectrum (ν cm–1): 3745, 3271, 3161, 2976, 1744, 1698, 1612, 1562, 1448, 1177, 775. (7c) Ethyl-6-methyl-2-oxo-4-styryl-1,2,3,4-tetrahydropyrimidine-5-carboxylate (Figs. S16–S18): light yellow solid (mp 229–231 °C); 1H NMR (500 MHz, DMSO-d6): δ 9.1 (d, 1H, NH), 7.5 (s, 1H, NH), 7.4–7.2 (m, 5H, Ar-H), 6.4 (d, 1H, CH-pH), 6.2 (d, 1H, CH-pH), 4.7 (t, 1H), 4.3 (q, 2H, CH2CH3), 2.2 (s, 3H, CH3), 1.2 (t, 3H, CH2CH3); 13C NMR (125 MHz, DMSO d6): δ 165.09, 152.51, 148.43, 136.14, 129.87, 128.55, 127.46, 126.22, 97.70, 59.11, 51.79, 17.65, 14.15; FTIR spectrum (ν cm–1): 3741, 3249, 3081, 2956, 1700, 1648, 1520, 1220, 1088, 775. (7d) Ethyl-6-methyl-4-styryl-2-thioxo-1,2,3,4-tetrahydropyrimidine-5-carboxylate (Figs. S19–S21): white solid (mp 167–169 °C); 1H NMR (500 MHz, CDCl3): δ 8.0 (s, 1H, NH), 7.3 (s,1H, NH), 7.2 (m, 5H, Ar-H), 6.5 (d, 1H, CH-Ph), 6.1 (d, 1H, CH-Ph), 4.3 (q, 2H, CH2CH3), 5.0 (m, 1H), 4.2 (q, 2H, CH2CH3), 2.3 (s, 1H, CH3), 1.2 (t, 3H, CH2CH3); 13C NMR (125 MHz, DMSO-d6): δ 175.64, 165.16, 143.27, 135.93, 131.20, 128.62, 128.14, 127.26, 126.71, 101.74, 60.53, 53.87, 18.37, 14.32; FTIR spectrum (ν cm–1): 3743, 3174, 2979, 2888, 1656, 1557, 1280, 1170, 971, 748. (7e) Ethyl-4-(4-methoxystyryl)-6-methyl-2-oxo-1,2,3,4-tetrahydropyrimidine-5-carboxylate (Figs. S22–S24): Light brown (mp 118–120 °C); 1H NMR (500 MHz, DMSO-d6): δ 9.0 (s, 1H, NH), 7.4 (s, 1H, NH), 7.3 (m, 4H, Ar-H), 6.8 (d, 1H, CH-Ph), 6.3 (d, 1H, CH-Ph), 4.6 (q, 1H), 4.1 (q, 2H, CH2CH3), 3.3 (s, 3H, OCH3), 2.1 (s, 1H, CH3), 1.1 (t, 3H, CH2CH3); 13C NMR (125 MHz, DMSO-d6): δ 165.12, 152.53, 148.43, 136.15, 129.97, 128.57, 128.02, 127.48, 126.22, 97.72, 59.12, 51.78, 17.67, 14.16; FTIR spectrum (ν cm–1): 3743, 3236, 3112, 2898, 1703, 1650, 1512, 1459, 1237, 1093, 786. (7f) 6-amino-5-propionyl-4-styryl-3,4-dihydropyrimidin-2(1H)-one (Figs. S25–S27): yellow solid (mp 100–102 °C); 1H NMR (500 MHz, CDCl3): δ 8.0 (d, 1H, NH), 7.9 (d, 1H, NH), 7.5–7.4 (m, 5H, Ar-H), 7.2 (d, 4H, CH-Ph), 4.3 (q, 2H, CH2CH3), 1.2 (t, 3H, CH2CH3); 13C NMR (125 MHz, DMSO-d6): δ 162.32, 155.39, 148.83, 134.70, 131.19, 129.16, 128.52, 123.09, 114.56, 104.56, 62.35, 14.18; FTIR spectrum (ν cm–1): 3744, 3223, 3009, 2882, 1702, 1653, 1519, 1242, 1074, 747. (7g) Methyl-6-methyl-2-oxo-4-styryl-1,2,3,4-tetrahydropyrimidine-5-carboxylate (Figs. S28–S30): white solid (mp 216–218 °C); 1H NMR (500 MHz, DMSO-d6): δ 9.1 (d, 1H, NH), 7.5 (d, 1H, NH), 7.4 (m, 5H, Ar-H), 6.3 (d, 1H, CH-Ph), 6.2 (d, 1H, CH-Ph), 4.7 (t, 1H), 3.3 (s, 3H, CH3), 2.2 (s, 3H, CH3); 13C NMR (125 MHz, DMSO-d6): δ 165.62, 152.61, 148.64, 136.16, 129.96, 128.54, 127.91, 126.27, 97.63, 57.62, 50.78, 17.73; FTIR spectrum (ν cm–1): 3746, 3227, 3088, 2948, 1706, 1645, 1433, 1240, 1091, 758. (7h) Methyl-6-methyl-4-styryl-2-thioxo-1,2,3,4-tetrahydropyrimidine-5-carboxylate (Figs. S31–S33): pale yellow solid (mp 192–193 °C); 1H NMR (500 MHz, DMSO-d6): δ 10.2 (s, 1H, NH), 9.4 (d, 1H, NH), 7.3 (m, 5H, Ar-H), 6.3 (d, 1H, CH-Ph), 6.1 (d, 1H, CH-Ph), 4.7 (t, 1H), 3.3 (s, 3H, CH3), 2.2 (s, 3H, CH3); 13C NMR (125 MHz, DMSO-d6): δ 175.00, 165.36, 145.33, 135.82, 129.14, 128.47, 127.66, 126.32, 99.19, 51.83, 51.02, 17.10; FTIR spectrum (ν cm–1): 3743, 3104, 2992, 2884, 1669, 1567, 1520, 1188, 979, 767. (7i) Tert-butyl-6-methyl-2-oxo-4-styryl-1,2,3,4-tetrahydropyrimidine-5-carboxylate (Figs. S34–S36): white solid (mp 214–216 °C); 1H NMR (500 MHz, DMSO-d6): δ 9.0 (s, 1H, NH), 7.4 (d, 1H, NH), 7.3 (m, 5H, Ar-H), 6.3 (d, 1H, CH-Ph), 6.1 (d, 1H, CH-Ph), 4.6 (s, 1H), 2.1 (s, 3H, CH3), 1.4 (s, 9H, t-Bu); 13C NMR (125 MHz, DMSO-d6): δ 164.57, 152.52, 147.42, 136.15, 129.93, 128.57, 128.29, 127.99, 127.44, 126.36, 126.16, 98.98, 79.03, 52.19, 27.90, 17.58; FTIR spectrum (ν cm–1): 3743(N-H), 3225, 3089, 2975, 2884, 2317, 1695, 1648, 1522, 1236, 1076, 756. (7j) Tert-butyl-6-methyl-4-styryl-2-thioxo-1,2,3,4-tetrahydropyrimidine-5-carboxylate (Figs. S37–S39): white solid (mp 196–198 °C); 1H NMR (500 MHz, DMSO-d6): δ 10.1 (s, 1H, NH), 9.3 (d,1H, NH), 7.4 (m, 5H, Ar-H), 6.3 (d, 1H, CH-Ph), 6.1 (d, 1H, CH-Ph), 4.7 (q, 1H), 2.2 (s, 3H, CH3), 1.4 (s, 9H, CH3); 13C NMR (125 MHz, DMSO-d6): δ 174.80, 164.26, 144.28, 135.80, 129.28, 128.60, 128.47, 127.71, 126.28, 100.57, 79.65, 52.45, 27.80, 16.97; FTIR spectrum (ν cm–1): 3742 (N-H), 3144, 2980, 1698, 1648, 1587, 1472, 1260, 1160, 1101, 967, 754. CRediT authorship contribution statement Monika Sharma: Investigation, Writing – original draft. Khushboo Verma: Investigation, Writing – original draft. Ajeet Kaushik: Writing – review & editing. Jasminder Singh: Conceptualization, Investigation, Validation, Writing – review & editing. Avtar Singh: Conceptualization, Validation, Writing – review & editing. Rahul Badru: Conceptualization, Methodology, Investigation, Resources, Writing – review & editing, Supervision, Project administration. Declaration of Competing Interest The authors declare that they have no known competing financial interests or personal relationships that could have appeared to influence the work reported in this paper. Acknowledgment The authors are grateful to the SGGSWU, Fatehgarh Sahib for providing lab facilities and SAIF lab Panjab University, Chandigarh for spectral analysis. The authors also acknowledge Punjabi University, Patiala, and IIT Ropar for their support. Supplementary materials Supplementary material associated with this article can be found, in the online version, at doi:10.1016/j.mcat.2022.112906. Appendix Supplementary materials Image, application 1 References [1] R.N. Rao B. Maiti K. Chanda Organic synthesis on ionic liquid support: a new strategy for the liquid-phase organic synthesis(LPOS) A.M.A. Inamuddin S. Kanchi Green Sustainable Process For Chemical and Environmental Engineering and Science Eds. 2020 Elsevier 49 104 R.N. Rao, B. Maiti, and K. Chanda, Organic synthesis on ionic liquid support: a new strategy for the liquid-phase organic synthesis(LPOS), Inamuddin, A. M.A. and S. Kanchi (Eds.), In Green Sustainable Process For Chemical and Environmental Engineering and Science, Elsevier, 2020, 49–104. [2] P. Lozano Sustainable Catalysis in Ionic Liquids (Ed.) 1st ed. 2018 CRC Press 314 P. Lozano, (Ed.) Sustainable Catalysis in Ionic Liquids (1st ed.), CRC Press, 2018, 314. [3] M. Kaur O. Kaur R. Badru S. Kaushal P. Singh Ionic liquid assisted C-C bond formation Curr. Org. Chem. 24 2020 1853 1875 M. Kaur, O. Kaur, R. Badru, S. Kaushal, P. Singh, Ionic liquid assisted C-C bond formation, Curr. Org. Chem., 2022, 24, 1853–1875. [4] R.S. Mishra S.A. Chaubey Y.B. Barot Ionic liquids as alternative greener solvents and catalysts in organic transformations B. Kharisov O. Kharissova Handbook of Greener Synthesis of Nanomaterials and Compounds Eds. 2021 Elsevier 359 404 R.S., Mishra, S.A. Chaubey and Y.B. Barot, Ionic liquids as alternative greener solvents and catalysts in organic transformations, B. Kharisov and O. Kharissova (Eds.), In. Handbook of Greener Synthesis of Nanomaterials and Compounds, Elsevier, 2021, 359–404. [5] Y. Hu M. Ren M. Kazemnejadi Metal- and solvent-Free transesterification and Aldol condensation reactions by a homogenous recyclable basic Ionic liquid based on the 1,3,5-triazine framework ChemistryOpen 10 2021 775 783 Y. Hu, M. Ren, M. Kazemnejadi, Metal- and solvent-Free transesterification and Aldol condensation reactions by a homogenous recyclable basic Ionic liquid based on the 1,3,5-triazine framework, ChemistryOpen, 2021, 10, 775–783. [6] E. Priede S. Brica E. Bakis N. Udris A. Zicmanis Ionic liquids as solvents for the Knoevenagel condensation: understanding the role of solvent–solute interactions New J. Chem. 39 2015 9132 9142 E. Priede, S. Brica, E. Bakis, N. Udris, A. Zicmanis, Ionic liquids as solvents for the Knoevenagel condensation: understanding the role of solvent–solute interactions, New J. Chem., 2015, 39, 9132–9142. [7] Y. Jiang Z. Wang P. Xu J. Sun Dicationic Ionic liquid @MIL-101 for the cycloaddition of CO2 and epoxides under cocatalyst-free conditions Cryst. Growth Des. 21 7 2021 3689 3698 Y. Jiang, Z. Wang, P. Xu and J. Sun, Dicationic Ionic liquid @MIL-101 for the cycloaddition of CO2 and epoxides under cocatalyst-free conditions, Cryst. Growth Des., 2021, 21, 7, 3689–3698. [8] A. Zhu C. Du Y. Zhang L. Li Ionic liquid assisted silver-catalyzed one-pot A3-coupling reactions for the synthesis of propargylamines J. Mol. Liq. 279 2019 289 293 A. Zhu, C. Du, Y. Zhang and L. Li, Ionic liquid assisted silver-catalyzed one-pot A3-coupling reactions for the synthesis of propargylamines, J. Mol. Liq., 2019, 279, 289–293. [9] Z. Li Y. Wen N. Wang F. Han Y. Li H. Zhuang C. Miao Ionic liquids with multi-active sites synergistically catalyzed metal-free transformation of alcohols using dimethyl carbonate as an environmental solvent Eur. J. Org. Chem. 27 2021 3819 3826 Z. Li, Y. Wen, N. Wang, F. Han, Y. Li, H. Zhuang and C. Miao, Ionic liquids with multi-active sites synergistically catalyzed metal-free transformation of alcohols using dimethyl carbonate as an environmental solvent, Eur. J. Org. Chem., 2021, 27, 3819–3826. [10] B.J. Yao W.X. Wu L.G. Ding Y.B. Dong Sulfonic acid and ionic liquid functionalized covalent organic framework for efficient catalysis of the Biginelli Reaction J. Org. Chem. 86 2021 3024 3032 B.J. Yao, W.X. Wu, L.G. Ding, and Y.B. Dong, Sulfonic acid and ionic liquid functionalized covalent organic framework for efficient catalysis of the Biginelli Reaction, J. Org. Chem., 2021, 86, 3024–3032 [11] H.T. Nguyen V.A. Truong P.H. Tran Synthesis of polyhydroquinolines and propargylamines through one-pot multicomponent reactions using an acidic ionic liquid immobilized onto magnetic Fe3O4 as an efficient heterogeneous catalyst under solvent-free sonication RSC Adv. 10 2020 25358 25363 H.T. Nguyen, V.A. Truong and P.H. Tran, Synthesis of polyhydroquinolines and propargylamines through one-pot multicomponent reactions using an acidic ionic liquid immobilized onto magnetic Fe3O4 as an efficient heterogeneous catalyst under solvent-free sonication, RSC Adv., 2020, 10, 25358–25363. [12] B.A. Neto R.O. Rocha A.A. Lapis What do we know about the ionic liquid effect in catalyzed multicomponent reactions? A critical review Curr. Opin. Green Sustain. Chem. 35 2022 100608 B.A. Neto, R.O. Rocha and A.A. Lapis, What do we know about the ionic liquid effect in catalyzed multicomponent reactions? A critical review, Curr. Opin. Green Sustain. Chem., 2022, 35, 100608. [13] A.S. Amarasekara Acidic ionic liquids Chem. Rev. 116 2016 6133 6183 A.S. Amarasekara, Acidic ionic liquids, Chem. Rev., 2016, 116, 6133–6183. [14] [a) E.F. Freitas R.Y. Souza S.T. Passos J.A. Dias S.C. Dias B.A. Neto Tuning the Biginelli reaction mechanism by the ionic liquid effect: the combined role of supported heteropolyacid derivatives and acidic strength RSC Adv. 9 2019 27125 27135 [a)E.F. Freitas, R.Y. Souza, S.T. Passos, J.A. Dias, S.C. Dias and B.A. Neto, Tuning the Biginelli reaction mechanism by the ionic liquid effect: the combined role of supported heteropolyacid derivatives and acidic strength, RSC Adv., 2019, 9, 27125–27135. [b) S. Ding M.J. Hulsey H. An Q. He H. Asakura M. Gao J. Hasegawa T. Tanaka N. Yan Ionic liquid-stabilized single-atom Rh catalyst against leaching CCS Chem. 3 2021 1814 1822 [b)S. Ding, M.J. Hulsey, H. An, Q. He, H. Asakura, M. Gao, J. Hasegawa, T. Tanaka and N. Yan, Ionic liquid-stabilized single-atom Rh catalyst against leaching, CCS Chem., 2021, 3, 1814–1822. [15] M. Ju W. Guan J.M. Schomaker K.C. Harper Sequential reduction of nitroalkanes mediated by CS2 and amidine/guanidine bases: a controllable Nef reaction Org. Lett. 21 2019 8893 8898 M. Ju, W. Guan, J.M. Schomaker and K.C. Harper, Sequential reduction of nitroalkanes mediated by CS2 and amidine/guanidine bases: a controllable Nef reaction, Org. Lett., 2019, 21, 8893–8898. [16] J.M. Dennis N.A. White R.Y. Liu S.L. Buchwald Breaking the base barrier: an electron-deficient palladium catalyst enables the use of a common soluble base in C-N coupling J. Am. Chem. Soc. 140 2018 4721 4725 J.M. Dennis, N.A. White, R.Y. Liu, S.L. Buchwald, Breaking the base barrier: an electron-deficient palladium catalyst enables the use of a common soluble base in C-N coupling, J. Am. Chem. Soc. 2018, 140, 4721–4725. [17] J. Muzart DBU: a reaction product component ChemistrySelect, 5 2020 11608 11620 J. Muzart, DBU: a reaction product component, ChemistrySelect, 2020, 5, 11608–11620. [18] P. Tehri R.K. Peddinti DBU-catalyzed [3+2] cycloaddition and Michael addition reactions of 3-benzylidene succinimides with 3-ylidene oxindoles and chalcones Org. Biomol. Chem. 17 2019 3964 3970 P. Tehri and R.K. Peddinti, DBU-catalyzed [3+2] cycloaddition and Michael addition reactions of 3-benzylidene succinimides with 3-ylidene oxindoles and chalcones, Org. Biomol. Chem., 2019, 17, 3964–3970. [19] H. Yang, D. Liu, Q. Yu, S. Xia, D. Yu, M. Zhang, B. Sun, F.L. Zhang, DBU-promoted intramolecular crossed aldol reaction: a facile access to indane-fused pyrrolidine, Eur. J. Org. Chem. 2019 (2019) 852–856. H. Yang, D. Liu, Q. Yu, S. Xia, D. Yu, M. Zhang, B. Sun and F.L. Zhang, DBU-promoted intramolecular crossed aldol reaction: a facile access to indane-fused pyrrolidine, Eur. J. Org. Chem., 2019, 852–856. [20] S. Singh J. Lal DBU catalysis in micellar medium: an environmentally benign synthetic approach for triheterocyclic 4Hpyrimido [2, 1b] benzothiazole derivatives SN Appl. Sci. 2 2020 1271 S. Singh and J. Lal, DBU catalysis in micellar medium: an environmentally benign synthetic approach for triheterocyclic 4Hpyrimido [2, 1b] benzothiazole derivatives, SN Appl. Sci., 2020, 2, 1271. [21] L. Li J.J. Chen Y.J. Li X.B. Bu Q. Liu Y.L. Zhao Activation of α-Diazocarbonyls by organic catalysts: Diazo group acting as a strong N-terminal electrophile Angew. Chem. Int. Ed. 54 2015 12107 L. Li, J.J. Chen, Y.J. Li, X.B. Bu, Q. Liu and Y.L. Zhao, Activation of α-Diazocarbonyls by organic catalysts: Diazo group acting as a strong N-terminal electrophile, Angew. Chem. Int. Ed., 2015, 54, 12107. [22] (a) R.V. Patil J.U. Chavan D.S. Dalal V.S. Shinde A.G. Beldar Biginelli reaction: polymer supported catalytic approaches ACS Comb. Sci. 21 2019 105 148 (a)R.V. Patil, J.U. Chavan, D.S. Dalal, V.S. Shinde and A.G. Beldar, Biginelli reaction: polymer supported catalytic approaches, ACS Comb. Sci., 2019, 21, 105–148; (b) N. Jankovic S. Stefanovic J. Petronijevic N. Joksimovic S.B. Novakovic G.A. Bogdanovic J. Muskinja M. Vranes Z. Ratkovic Z. Bugarcic Water-tuned tautomer-selective tandem synthesis of the 5,6-Dihydropyrimidin-4(3H)-ones, driven under the umbrella of Sustainable Chemistry ACS Sustain. Chem. Eng. 6 2018 13358 13366 (b)N. Jankovic, S. Stefanovic, J. Petronijevic, N. Joksimovic, S.B. Novakovic, G.A. Bogdanovic, J. Muskinja, M. Vranes, Z. Ratkovic and Z. Bugarcic, Water-tuned tautomer-selective tandem synthesis of the 5,6-Dihydropyrimidin-4(3H)-ones, driven under the umbrella of Sustainable Chemistry, ACS Sustain. Chem. Eng., 2018, 6, 13358–13366. [23] J. Lloyd H.J. Finlay W. Vacarro T. Hyunh A. Kover R. Bhandaru L. Yan K. Atwal M.L. Conder T. Jenkins-West H. Shi C. Huang D. Li H. Sun P. Levesque Pyrrolidine amides of pyrazolodihydropyrimidines as potent and selective KV1.5 blockers Bioorg. Med. Chem. Lett. 20 2010 1436 1439 J. Lloyd, H.J. Finlay, W. Vacarro, T. Hyunh, A. Kover, R. Bhandaru, L. Yan, K. Atwal, M.L. Conder, T. Jenkins-West, H. Shi, C. Huang, D. Li, H. Sun and P. Levesque, Pyrrolidine amides of pyrazolodihydropyrimidines as potent and selective KV1.5 blockers, Bioorg. Med. Chem. Lett., 2010, 20, 1436–1439. [24] N. Irshad A.U. Khan M.S. Iqbal Antihypertensive potential of selected pyrimidine derivatives: explanation of underlying mechanistic pathways Biomed. Pharmacother. 139 2021 111567 N. Irshad, A.U. Khan and M.S. Iqbal. Antihypertensive potential of selected pyrimidine derivatives: explanation of underlying mechanistic pathways. Biomed. Pharmacother., 2021, 139, 111567. [25] C.K. Jadhav A.S. Nipate A.V. Chate V.D. Songire A.P. Patil And C.H. Gill Efficient rapid access to Biginelli for the multicomponent synthesis of 1,2,3,4-tetrahydropyrimidines in room-temperature diisopropyl ethyl ammonium acetate ACS Omega 27 2019 22313 22324 C.K. Jadhav, A.S. Nipate, A.V. Chate, V.D. Songire, A.P. Patil And C.H. Gill, Efficient rapid access to Biginelli for the multicomponent synthesis of 1,2,3,4-tetrahydropyrimidines in room-temperature diisopropyl ethyl ammonium acetate, ACS Omega, 2019, 27, 22313–22324. [26] (a) J. Dowarah D. Patel B.N. Marak U.C.S. Yadav P.K. Shah P.K. Shukla V.P. Singh Green synthesis, structural analysis and anticancer activity of dihydropyrimidinone derivatives RSC Adv. 11 2021 35737 35753 (a)J. Dowarah, D. Patel, B.N. Marak, U.C.S. Yadav, P.K. Shah, P.K. Shukla and V.P. Singh, Green synthesis, structural analysis and anticancer activity of dihydropyrimidinone derivatives, RSC Adv., 2021, 11, 35737–35753; (b) N. Jankovic J.T. Ristovski M. Vranes A. Tot J. Petronijevic N. Joksimovic T. Stanojkovic M.D. Crnogorac N. Petrovic I. Boljevic I.Z. Matic G.A. Bogdanovic M. Mikov Z. Bugarcic Discovery of the Biginelli hybrids as novel caspase-9 activators in apoptotic machines: lipophilicity, molecular docking study, influence on angiogenesis gene and miR-21 expression levels Bioorg. Chem. 86 2019 569 582 (b)N. Jankovic, J.T. Ristovski, M. Vranes, A. Tot, J. Petronijevic, N. Joksimovic, T. Stanojkovic, M.D. Crnogorac, N. Petrovic, I. Boljevic, I.Z. Matic, G.A. Bogdanovic, M. Mikov and Z. Bugarcic, Discovery of the Biginelli hybrids as novel caspase-9 activators in apoptotic machines: lipophilicity, molecular docking study, influence on angiogenesis gene and miR-21 expression levels, Bioorg. Chem., 2019, 86, 569–582. [27] H.R. Rashid M.A.U. Martines A.P. Duarte J. Jorge S. Rasool R. Muhammad N. Ahmad M.N. Umar Research developments in the syntheses, anti-inflammatory activities and structure-activity relationships of pyrimidines RSC Adv. 11 2021 6060 6098 H.R. Rashid, M.A.U. Martines, A.P. Duarte, J. Jorge, S. Rasool, R. Muhammad, N. Ahmad and M.N. Umar, Research developments in the syntheses, anti-inflammatory activities and structure-activity relationships of pyrimidines, RSC Adv., 2021, 11, 6060–6098. [28] J.N. Lalpara S.D. Hadiyal A.J. Radia J.M. Dhalani G.G. Dubal Design and rapid microwave irradiated one-pot synthesis of tetrahydropyrimidine derivatives and their screening invitro antidiabetic activity Polycycl. Aromat. Compd. 2020 10.1080/10406638.2020.1852586 J.N. Lalpara, S.D. Hadiyal, A.J. Radia, J.M. Dhalani and G.G. Dubal, Design and rapid microwave irradiated one-pot synthesis of tetrahydropyrimidine derivatives and their screening invitro antidiabetic activity, Polycycl. Aromat. Compd., 2020, DOI: 10.1080/10406638.2020.1852586. [29] N. Jankovic E. Milovic J.D. Jovanovic Z. Markovic M. Vranes T. Stanojkovic I. Matic M.D. Crnogorac O. Klisuric M. Cvetinov S.N.A. Bukhari A new class of half-sandwich ruthenium complexes containing Biginelli hybrids: anticancer and anti-SARS-CoV-2 activities Chem.-Biol. Interact. 363 2022 110025 N. Jankovic, E. Milovic, J.D. Jovanovic, Z. Markovic, M. Vranes, T. Stanojkovic, I. Matic, M.D. Crnogorac, O. Klisuric, M. Cvetinov and S.N.A. Bukhari, A new class of half-sandwich ruthenium complexes containing Biginelli hybrids: anticancer and anti-SARS-CoV-2 activities, Chem.-Biol. Interact., 2022, 363,110025. [30] J. Senapathi A. Bommakanti V. Kusuma S. Vangara A.K. Kondapi Design, synthesis, and antiviral activity of 1, 2, 3, 4-Tetrahydropyrimidine derivatives acting as novel entry inhibitors to target at “Phe43 cavity” of HIV-1 gp120 Bioorg. Med. Chem. 52 2021 116526 J. Senapathi, A. Bommakanti, V. Kusuma, S. Vangara, and A.K. Kondapi, Design, synthesis, and antiviral activity of 1, 2, 3, 4-Tetrahydropyrimidine derivatives acting as novel entry inhibitors to target at “Phe43 cavity” of HIV-1 gp120, 2021, Bioorg. Med. Chem., 52, 116526. [31] (a) T.C. Braga T.F. Silva T.M.S. Maciel E.C.D. Da Silva E.F. Da Silva-Junior L.V. Modolo I. Figueiredo J. Carinhanha T.M. De Aquino A. De Fatima Ionic liquid-assisted synthesis of dihydropyrimidin(thi)one Biginelli adducts and investigation of their mechanism of urease inhibition New J. Chem. 43 2019 15187 15200 (a)T.C. Braga, T.F. Silva, T.M.S. Maciel, E.C.D. Da Silva, E.F. Da Silva-Junior, L.V. Modolo, I. Figueiredo, J. Carinhanha, T.M. De Aquino and A. De Fatima, Ionic liquid-assisted synthesis of dihydropyrimidin(thi)one Biginelli adducts and investigation of their mechanism of urease inhibition, New J. Chem., 2019, 43, 15187–15200.; (b) M.C. Santos M. Uemi N.S. Goncalves M.A. Bizeto F.F. Camilo Niobium chloride in 1-n-butyl-3-methylimidazolium chloride ionic liquid as a catalyst for Biginelli reaction J. Mol. Struct. 1220 2020 128653 (b)M.C. Santos, M. Uemi, N.S. Goncalves, M.A. Bizeto and F.F. Camilo, Niobium chloride in 1-n-butyl-3-methylimidazolium chloride ionic liquid as a catalyst for Biginelli reaction, J. Mol. Struct., 2020, 1220, 128653; (c) B.J. Yao W.X. Wu L.G. Ding Y.B. Dong Sulfonic acid and ionic liquid functionalized covalent organic framework for efficient catalysis of the Biginelli reaction J. Org. Chem. 86 2021 3024 3032 (c)B.J. Yao, W.X. Wu, L.G. Ding and Y.B. Dong, Sulfonic acid and ionic liquid functionalized covalent organic framework for efficient catalysis of the Biginelli reaction, J. Org. Chem., 2021, 86, 3024–3032; (d) T.M. Shaikh S. Nagarajan E. Kandasamy One pot multicomponent Biginelli reaction employing ionic liquids as an organocatalyst Curr. Organocatal. 7 2020 1 12 (d)T.M. Shaikh, S. Nagarajan and E. Kandasamy, One pot multicomponent Biginelli reaction employing ionic liquids as an organocatalyst, Curr. Organocatal., 2020, 7, 1–12; (e) D.S. Patel J.R. Avalani D.K. Raval One-pot solvent-free rapid and green synthesis of 3,4-dihydropyrano[c]chromenes using grindstone chemistry J. Saudi Chem. Soc. 20 2016 401 405 (e)D.S. Patel, J.R. Avalani and D.K. Raval, One-pot solvent-free rapid and green synthesis of 3,4-dihydropyrano[c]chromenes using grindstone chemistry, J. Saudi Chem. Soc., 2016, 20, 401–405; (f) L. Guglielmero A. Mezzetta L. Guazzelli C.S. Pomelli F. D'Andrea C. Chiappe Systematic synthesis and properties evaluation of dicationic ionic liquids, and a glance into a potential new field Front. Chem. 6 2018 612 10.3389/fchem.2018.00612 2018 (f)L. Guglielmero, A. Mezzetta, L. Guazzelli, C.S. Pomelli, F. D'Andrea and C. Chiappe, (2018) Systematic synthesis and properties evaluation of dicationic ionic liquids, and a glance into a potential new field, Front. Chem., 2018, 6, 612. doi: 10.3389/fchem.2018.00612 [32] R.G. Fatemeh F. Soghra A. Hamid Facile and rapid synthesis of 3, 4-dihydropyrimidin-2-(1H)-ones and thione derivatives through the Biginelli protocol using N-methylimidazolium acetate Iran. J. Chem. Chem. Eng. 40 2021 888 897 R.G. Fatemeh, F. Soghra and A. Hamid, Facile and rapid synthesis of 3, 4-dihydropyrimidin-2-(1H)-ones and thione derivatives through the Biginelli protocol using N-methylimidazolium acetate, Iran. J. Chem. Chem. Eng., 2021, 40, 888–897. [33] P.M. Davanagere B. Maiti 1,3 Bis(carboxymethyl)imidazolium chloride as a sustainable, recyclable, and metal-free ionic catalyst for the Biginelli multicomponent reaction in neat condition ACS Omega 6 2021 26035 26047 P.M. Davanagere and B. Maiti, 1,3 Bis(carboxymethyl)imidazolium chloride as a sustainable, recyclable, and metal-free ionic catalyst for the Biginelli multicomponent reaction in neat condition, ACS Omega, 2021, 6, 26035–26047 [34] X. Zhu M. Song Y. Xu DBU-based protic ionic liquids for CO2 capture ACS Sustain. Chem. Eng. 5 2017 8192 8198 X. Zhu, M. Song, and Y. Xu, DBU- based protic ionic liquids for CO2 capture, ACS Sustain. Chem. Eng., 2017, 5, 8192–8198. [35] L. Zheng G. Yang J. Liu X. Hu Z. Zhang Metal free catalysis for the one-pot synthesis of organic carbamates from amines, CO2, and alcohol at mild conditions Chem. Eng. J. 425 2021 131452 L. Zheng, G. Yang, J. Liu, X. Hu, Z. Zhang, Metal free catalysis for the one-pot synthesis of organic carbamates from amines, CO2, and alcohol at mild conditions, Chem. Eng. J., 425, 2021, 131452. [36] K. Kenyotha K.C. Chanapattharapol S. McCloskey P. Jantaharn Water based synthesis of ZIF-8 assisted by hydrogen bond acceptors and enhancement of CO2 uptake by solvent assisted ligand exchange Crystals 10 2020 599 K. Kenyotha, K.C. Chanapattharapol, S. McCloskey and P. Jantaharn, Water based synthesis of ZIF-8 assisted by hydrogen bond acceptors and enhancement of CO2 uptake by solvent assisted ligand exchange, Crystals, 2020, 10, 599. [37] (a) X.M. Fang Y.P. Huo Z.G. Wei G.Z. Yuan B.H. Huang S.Z. Zhu Impact of substituents on the luminescent properties and thermostability of Zn(II) 8-hydroxyquinolinates: insight from experimental and theoretical approach Tetrahedron 69 2013 10052 (a)X.M. Fang, Y.P. Huo, Z.G. Wei, G.Z. Yuan, B.H. Huang, S.Z. Zhu, Impact of substituents on the luminescent properties and thermostability of Zn(II) 8-hydroxyquinolinates: insight from experimental and theoretical approach, Tetrahedron, 2013, 69, 10052; (b) L. Wang S. Jiao W. Zhang Y. Liu G. Yu Synthesis, structure, optoelectronic properties of novel zinc Schiff-base complexes Chin. Sci. Bull. 58 2013 2733 (b)L. Wang, S. Jiao, W. Zhang, Y. Liu, G. Yu, Synthesis, structure, optoelectronic properties of novel zinc Schiff-base complexes, Chin. Sci. Bull., 2013, 58, 2733. [38] (a) C. Lee W. Yang R.G. Parr Development of the Colle-Salvetti correlation-energy formula into a functional of the electron density Phys. Rev. B Condens. Matter Mater. Phys. 37 1988 785 (a)C. Lee, W. Yang, R.G. Parr, Development of the Colle-Salvetti correlation-energy formula into a functional of the electron density, Phys. Rev. B Condens. Matter Mater. Phys. 1988, 37, 785; (b) A.D.J. Becke A multicenter numerical integration scheme for poly atomic molecules Chem. Phys. 88 1988 2547 (b)A.D.J. Becke, A multicenter numerical integration scheme for poly atomic molecules, Chem. Phys. 1988, 88, 2547; (c) A. Singh S.N. Maximoff P. Brandão J.S. Dhau Crystal structures of bis(2-methoxy-3-pyridyl) diselenide and bis(2-methoxy-3-pyridyl) ditelluride: an investigation by X-ray crystallography and DFT calculations J. Mol. Struct. 1240 2021 130568 [c)A. Singh, S.N. Maximoff, P. Brandão, J.S. Dhau, Crystal structures of bis(2-methoxy-3-pyridyl) diselenide and bis(2-methoxy-3-pyridyl) ditelluride: an investigation by X-ray crystallography and DFT calculations, J. Mol. Struct. 2021, 1240, 130568.",
      "scopus-id": "85146021301",
      "coredata": {
        "eid": "1-s2.0-S2468823122007921",
        "dc:description": "In present work, the application of a novel set of 1,8-Diazabicyclo[5.4.0]undec-7-ene (DBU) and methylimidazole (MIm) coupled ionic liquids (ILs) in the Biginelli reaction has been investigated. In the modified Biginelli reaction, cinnamaldehyde, urea, and 1,3-diketone condensed in the presence of 10 mol% of the DBU-MIm coupled IL catalyst at 90 °C to afford dihydropyrimidinones in high to excellent yields in 45 min. Additionally, the effect of temperature, catalytic amount, and solvent has also been unfolded. The reaction has been found to the follow iminium ion mechanism and the synergic role played by the [DBUH]+ and [MIm]− moieties has been established by DFT calculations. The easy post-procedure recovery and reusability of the DBU-MIm IL catalysts make the present protocol of Biginelli synthesis simple, benign and reproducible.",
        "openArchiveArticle": "false",
        "prism:coverDate": "2023-02-01",
        "openaccessUserLicense": null,
        "prism:aggregationType": "Journal",
        "prism:url": "https://api.elsevier.com/content/article/pii/S2468823122007921",
        "dc:creator": [
          {
            "@_fa": "true",
            "$": "Sharma, Monika"
          },
          {
            "@_fa": "true",
            "$": "Verma, Khushboo"
          },
          {
            "@_fa": "true",
            "$": "Kaushik, Ajeet"
          },
          {
            "@_fa": "true",
            "$": "Singh, Jasminder"
          },
          {
            "@_fa": "true",
            "$": "Singh, Avtar"
          },
          {
            "@_fa": "true",
            "$": "Badru, Rahul"
          }
        ],
        "link": [
          {
            "@_fa": "true",
            "@rel": "self",
            "@href": "https://api.elsevier.com/content/article/pii/S2468823122007921"
          },
          {
            "@_fa": "true",
            "@rel": "scidir",
            "@href": "https://www.sciencedirect.com/science/article/pii/S2468823122007921"
          }
        ],
        "dc:format": "application/json",
        "openaccessType": null,
        "pii": "S2468-8231(22)00792-1",
        "prism:volume": "536",
        "articleNumber": "112906",
        "prism:publisher": "Elsevier B.V.",
        "dc:title": "DBU-MIm coupled ionic liquids as reusable catalysts for the Biginelli reaction",
        "prism:copyright": "© 2022 Elsevier B.V. All rights reserved.",
        "openaccess": "0",
        "prism:issn": "24688231",
        "dcterms:subject": [
          {
            "@_fa": "true",
            "$": "Biginelli"
          },
          {
            "@_fa": "true",
            "$": "Dihydropyrimidines"
          },
          {
            "@_fa": "true",
            "$": "DBU"
          },
          {
            "@_fa": "true",
            "$": "Synergic catalysis"
          },
          {
            "@_fa": "true",
            "$": "Coupled ionic liquids"
          }
        ],
        "openaccessArticle": "false",
        "prism:publicationName": "Molecular Catalysis",
        "openaccessSponsorType": null,
        "prism:pageRange": "112906",
        "pubType": "fla",
        "prism:coverDisplayDate": "1 February 2023",
        "prism:doi": "10.1016/j.mcat.2022.112906",
        "prism:startingPage": "112906",
        "dc:identifier": "doi:10.1016/j.mcat.2022.112906",
        "openaccessSponsorName": null
      },
      "objects": {
        "object": [
          {
            "@category": "standard",
            "@height": "571",
            "@width": "568",
            "@_fa": "true",
            "$": "https://api.elsevier.com/content/object/eid/1-s2.0-S2468823122007921-gr3.jpg?httpAccept=%2A%2F%2A",
            "@multimediatype": "JPEG image file",
            "@type": "IMAGE-DOWNSAMPLED",
            "@size": "57700",
            "@ref": "gr3",
            "@mimetype": "image/jpeg"
          },
          {
            "@category": "standard",
            "@height": "258",
            "@width": "715",
            "@_fa": "true",
            "$": "https://api.elsevier.com/content/object/eid/1-s2.0-S2468823122007921-gr4.jpg?httpAccept=%2A%2F%2A",
            "@multimediatype": "JPEG image file",
            "@type": "IMAGE-DOWNSAMPLED",
            "@size": "40037",
            "@ref": "gr4",
            "@mimetype": "image/jpeg"
          },
          {
            "@category": "standard",
            "@height": "323",
            "@width": "376",
            "@_fa": "true",
            "$": "https://api.elsevier.com/content/object/eid/1-s2.0-S2468823122007921-gr1.jpg?httpAccept=%2A%2F%2A",
            "@multimediatype": "JPEG image file",
            "@type": "IMAGE-DOWNSAMPLED",
            "@size": "51178",
            "@ref": "gr1",
            "@mimetype": "image/jpeg"
          },
          {
            "@category": "standard",
            "@height": "426",
            "@width": "715",
            "@_fa": "true",
            "$": "https://api.elsevier.com/content/object/eid/1-s2.0-S2468823122007921-gr2.jpg?httpAccept=%2A%2F%2A",
            "@multimediatype": "JPEG image file",
            "@type": "IMAGE-DOWNSAMPLED",
            "@size": "34205",
            "@ref": "gr2",
            "@mimetype": "image/jpeg"
          },
          {
            "@category": "standard",
            "@height": "201",
            "@width": "301",
            "@_fa": "true",
            "$": "https://api.elsevier.com/content/object/eid/1-s2.0-S2468823122007921-ga1.jpg?httpAccept=%2A%2F%2A",
            "@multimediatype": "JPEG image file",
            "@type": "IMAGE-DOWNSAMPLED",
            "@size": "26672",
            "@ref": "ga1",
            "@mimetype": "image/jpeg"
          },
          {
            "@category": "standard",
            "@height": "199",
            "@width": "560",
            "@_fa": "true",
            "$": "https://api.elsevier.com/content/object/eid/1-s2.0-S2468823122007921-sc2.jpg?httpAccept=%2A%2F%2A",
            "@multimediatype": "JPEG image file",
            "@type": "IMAGE-DOWNSAMPLED",
            "@size": "15203",
            "@ref": "sc2",
            "@mimetype": "image/jpeg"
          },
          {
            "@category": "standard",
            "@height": "277",
            "@width": "540",
            "@_fa": "true",
            "$": "https://api.elsevier.com/content/object/eid/1-s2.0-S2468823122007921-sc1.jpg?httpAccept=%2A%2F%2A",
            "@multimediatype": "JPEG image file",
            "@type": "IMAGE-DOWNSAMPLED",
            "@size": "31617",
            "@ref": "sc1",
            "@mimetype": "image/jpeg"
          },
          {
            "@category": "standard",
            "@height": "141",
            "@width": "395",
            "@_fa": "true",
            "$": "https://api.elsevier.com/content/object/eid/1-s2.0-S2468823122007921-fx1.jpg?httpAccept=%2A%2F%2A",
            "@multimediatype": "JPEG image file",
            "@type": "IMAGE-DOWNSAMPLED",
            "@size": "10199",
            "@ref": "fx1",
            "@mimetype": "image/jpeg"
          },
          {
            "@category": "standard",
            "@height": "317",
            "@width": "389",
            "@_fa": "true",
            "$": "https://api.elsevier.com/content/object/eid/1-s2.0-S2468823122007921-gr7.jpg?httpAccept=%2A%2F%2A",
            "@multimediatype": "JPEG image file",
            "@type": "IMAGE-DOWNSAMPLED",
            "@size": "42654",
            "@ref": "gr7",
            "@mimetype": "image/jpeg"
          },
          {
            "@category": "standard",
            "@height": "271",
            "@width": "511",
            "@_fa": "true",
            "$": "https://api.elsevier.com/content/object/eid/1-s2.0-S2468823122007921-gr5.jpg?httpAccept=%2A%2F%2A",
            "@multimediatype": "JPEG image file",
            "@type": "IMAGE-DOWNSAMPLED",
            "@size": "27574",
            "@ref": "gr5",
            "@mimetype": "image/jpeg"
          },
          {
            "@category": "standard",
            "@height": "225",
            "@width": "715",
            "@_fa": "true",
            "$": "https://api.elsevier.com/content/object/eid/1-s2.0-S2468823122007921-gr6.jpg?httpAccept=%2A%2F%2A",
            "@multimediatype": "JPEG image file",
            "@type": "IMAGE-DOWNSAMPLED",
            "@size": "44755",
            "@ref": "gr6",
            "@mimetype": "image/jpeg"
          },
          {
            "@category": "thumbnail",
            "@height": "164",
            "@width": "163",
            "@_fa": "true",
            "$": "https://api.elsevier.com/content/object/eid/1-s2.0-S2468823122007921-gr3.sml?httpAccept=%2A%2F%2A",
            "@multimediatype": "GIF image file",
            "@type": "IMAGE-THUMBNAIL",
            "@size": "5461",
            "@ref": "gr3",
            "@mimetype": "image/gif"
          },
          {
            "@category": "thumbnail",
            "@height": "79",
            "@width": "219",
            "@_fa": "true",
            "$": "https://api.elsevier.com/content/object/eid/1-s2.0-S2468823122007921-gr4.sml?httpAccept=%2A%2F%2A",
            "@multimediatype": "GIF image file",
            "@type": "IMAGE-THUMBNAIL",
            "@size": "8063",
            "@ref": "gr4",
            "@mimetype": "image/gif"
          },
          {
            "@category": "thumbnail",
            "@height": "164",
            "@width": "191",
            "@_fa": "true",
            "$": "https://api.elsevier.com/content/object/eid/1-s2.0-S2468823122007921-gr1.sml?httpAccept=%2A%2F%2A",
            "@multimediatype": "GIF image file",
            "@type": "IMAGE-THUMBNAIL",
            "@size": "10819",
            "@ref": "gr1",
            "@mimetype": "image/gif"
          },
          {
            "@category": "thumbnail",
            "@height": "131",
            "@width": "219",
            "@_fa": "true",
            "$": "https://api.elsevier.com/content/object/eid/1-s2.0-S2468823122007921-gr2.sml?httpAccept=%2A%2F%2A",
            "@multimediatype": "GIF image file",
            "@type": "IMAGE-THUMBNAIL",
            "@size": "7358",
            "@ref": "gr2",
            "@mimetype": "image/gif"
          },
          {
            "@category": "thumbnail",
            "@height": "146",
            "@width": "219",
            "@_fa": "true",
            "$": "https://api.elsevier.com/content/object/eid/1-s2.0-S2468823122007921-ga1.sml?httpAccept=%2A%2F%2A",
            "@multimediatype": "GIF image file",
            "@type": "IMAGE-THUMBNAIL",
            "@size": "26565",
            "@ref": "ga1",
            "@mimetype": "image/gif"
          },
          {
            "@category": "thumbnail",
            "@height": "78",
            "@width": "219",
            "@_fa": "true",
            "$": "https://api.elsevier.com/content/object/eid/1-s2.0-S2468823122007921-sc2.sml?httpAccept=%2A%2F%2A",
            "@multimediatype": "GIF image file",
            "@type": "IMAGE-THUMBNAIL",
            "@size": "3049",
            "@ref": "sc2",
            "@mimetype": "image/gif"
          },
          {
            "@category": "thumbnail",
            "@height": "112",
            "@width": "219",
            "@_fa": "true",
            "$": "https://api.elsevier.com/content/object/eid/1-s2.0-S2468823122007921-sc1.sml?httpAccept=%2A%2F%2A",
            "@multimediatype": "GIF image file",
            "@type": "IMAGE-THUMBNAIL",
            "@size": "5476",
            "@ref": "sc1",
            "@mimetype": "image/gif"
          },
          {
            "@category": "thumbnail",
            "@height": "78",
            "@width": "219",
            "@_fa": "true",
            "$": "https://api.elsevier.com/content/object/eid/1-s2.0-S2468823122007921-fx1.sml?httpAccept=%2A%2F%2A",
            "@multimediatype": "GIF image file",
            "@type": "IMAGE-THUMBNAIL",
            "@size": "3105",
            "@ref": "fx1",
            "@mimetype": "image/gif"
          },
          {
            "@category": "thumbnail",
            "@height": "164",
            "@width": "201",
            "@_fa": "true",
            "$": "https://api.elsevier.com/content/object/eid/1-s2.0-S2468823122007921-gr7.sml?httpAccept=%2A%2F%2A",
            "@multimediatype": "GIF image file",
            "@type": "IMAGE-THUMBNAIL",
            "@size": "9736",
            "@ref": "gr7",
            "@mimetype": "image/gif"
          },
          {
            "@category": "thumbnail",
            "@height": "116",
            "@width": "219",
            "@_fa": "true",
            "$": "https://api.elsevier.com/content/object/eid/1-s2.0-S2468823122007921-gr5.sml?httpAccept=%2A%2F%2A",
            "@multimediatype": "GIF image file",
            "@type": "IMAGE-THUMBNAIL",
            "@size": "7690",
            "@ref": "gr5",
            "@mimetype": "image/gif"
          },
          {
            "@category": "thumbnail",
            "@height": "69",
            "@width": "219",
            "@_fa": "true",
            "$": "https://api.elsevier.com/content/object/eid/1-s2.0-S2468823122007921-gr6.sml?httpAccept=%2A%2F%2A",
            "@multimediatype": "GIF image file",
            "@type": "IMAGE-THUMBNAIL",
            "@size": "8332",
            "@ref": "gr6",
            "@mimetype": "image/gif"
          },
          {
            "@category": "high",
            "@height": "2529",
            "@width": "2517",
            "@_fa": "true",
            "$": "https://api.elsevier.com/content/object/eid/1-s2.0-S2468823122007921-gr3_lrg.jpg?httpAccept=%2A%2F%2A",
            "@multimediatype": "JPEG image file",
            "@type": "IMAGE-HIGH-RES",
            "@size": "431364",
            "@ref": "gr3",
            "@mimetype": "image/jpeg"
          },
          {
            "@category": "high",
            "@height": "1144",
            "@width": "3167",
            "@_fa": "true",
            "$": "https://api.elsevier.com/content/object/eid/1-s2.0-S2468823122007921-gr4_lrg.jpg?httpAccept=%2A%2F%2A",
            "@multimediatype": "JPEG image file",
            "@type": "IMAGE-HIGH-RES",
            "@size": "333867",
            "@ref": "gr4",
            "@mimetype": "image/jpeg"
          },
          {
            "@category": "high",
            "@height": "1430",
            "@width": "1667",
            "@_fa": "true",
            "$": "https://api.elsevier.com/content/object/eid/1-s2.0-S2468823122007921-gr1_lrg.jpg?httpAccept=%2A%2F%2A",
            "@multimediatype": "JPEG image file",
            "@type": "IMAGE-HIGH-RES",
            "@size": "353378",
            "@ref": "gr1",
            "@mimetype": "image/jpeg"
          },
          {
            "@category": "high",
            "@height": "1889",
            "@width": "3168",
            "@_fa": "true",
            "$": "https://api.elsevier.com/content/object/eid/1-s2.0-S2468823122007921-gr2_lrg.jpg?httpAccept=%2A%2F%2A",
            "@multimediatype": "JPEG image file",
            "@type": "IMAGE-HIGH-RES",
            "@size": "416790",
            "@ref": "gr2",
            "@mimetype": "image/jpeg"
          },
          {
            "@category": "high",
            "@height": "889",
            "@width": "1333",
            "@_fa": "true",
            "$": "https://api.elsevier.com/content/object/eid/1-s2.0-S2468823122007921-ga1_lrg.jpg?httpAccept=%2A%2F%2A",
            "@multimediatype": "JPEG image file",
            "@type": "IMAGE-HIGH-RES",
            "@size": "216487",
            "@ref": "ga1",
            "@mimetype": "image/jpeg"
          },
          {
            "@category": "high",
            "@height": "882",
            "@width": "2480",
            "@_fa": "true",
            "$": "https://api.elsevier.com/content/object/eid/1-s2.0-S2468823122007921-sc2_lrg.jpg?httpAccept=%2A%2F%2A",
            "@multimediatype": "JPEG image file",
            "@type": "IMAGE-HIGH-RES",
            "@size": "117192",
            "@ref": "sc2",
            "@mimetype": "image/jpeg"
          },
          {
            "@category": "high",
            "@height": "1228",
            "@width": "2392",
            "@_fa": "true",
            "$": "https://api.elsevier.com/content/object/eid/1-s2.0-S2468823122007921-sc1_lrg.jpg?httpAccept=%2A%2F%2A",
            "@multimediatype": "JPEG image file",
            "@type": "IMAGE-HIGH-RES",
            "@size": "225188",
            "@ref": "sc1",
            "@mimetype": "image/jpeg"
          },
          {
            "@category": "high",
            "@height": "625",
            "@width": "1749",
            "@_fa": "true",
            "$": "https://api.elsevier.com/content/object/eid/1-s2.0-S2468823122007921-fx1_lrg.jpg?httpAccept=%2A%2F%2A",
            "@multimediatype": "JPEG image file",
            "@type": "IMAGE-HIGH-RES",
            "@size": "71726",
            "@ref": "fx1",
            "@mimetype": "image/jpeg"
          },
          {
            "@category": "high",
            "@height": "1406",
            "@width": "1725",
            "@_fa": "true",
            "$": "https://api.elsevier.com/content/object/eid/1-s2.0-S2468823122007921-gr7_lrg.jpg?httpAccept=%2A%2F%2A",
            "@multimediatype": "JPEG image file",
            "@type": "IMAGE-HIGH-RES",
            "@size": "240748",
            "@ref": "gr7",
            "@mimetype": "image/jpeg"
          },
          {
            "@category": "high",
            "@height": "1199",
            "@width": "2262",
            "@_fa": "true",
            "$": "https://api.elsevier.com/content/object/eid/1-s2.0-S2468823122007921-gr5_lrg.jpg?httpAccept=%2A%2F%2A",
            "@multimediatype": "JPEG image file",
            "@type": "IMAGE-HIGH-RES",
            "@size": "204689",
            "@ref": "gr5",
            "@mimetype": "image/jpeg"
          },
          {
            "@category": "high",
            "@height": "998",
            "@width": "3167",
            "@_fa": "true",
            "$": "https://api.elsevier.com/content/object/eid/1-s2.0-S2468823122007921-gr6_lrg.jpg?httpAccept=%2A%2F%2A",
            "@multimediatype": "JPEG image file",
            "@type": "IMAGE-HIGH-RES",
            "@size": "313127",
            "@ref": "gr6",
            "@mimetype": "image/jpeg"
          },
          {
            "@category": "standard",
            "@_fa": "true",
            "$": "https://api.elsevier.com/content/object/eid/1-s2.0-S2468823122007921-mmc1.docx?httpAccept=%2A%2F%2A",
            "@multimediatype": "Microsoft Word file",
            "@type": "APPLICATION",
            "@size": "994152",
            "@ref": "mmc1",
            "@mimetype": "application/word"
          },
          {
            "@category": "standard",
            "@_fa": "true",
            "$": "https://api.elsevier.com/content/object/eid/1-s2.0-S2468823122007921-am.pdf?httpAccept=%2A%2F%2A",
            "@multimediatype": "Acrobat PDF file",
            "@type": "AAM-PDF",
            "@size": "1213507",
            "@ref": "am",
            "@mimetype": "application/pdf"
          }
        ]
      },
      "link": {
        "@rel": "abstract",
        "@href": "https://api.elsevier.com/content/abstract/scopus_id/85146021301"
      }
    }
  }
}