{
  "metadata": {
    "title": "Electron transfer stabilizing highly active species Mn<ce:sup loc=post>4+</ce:sup> to enhance low-temperature NH<ce:inf loc=post>3</ce:inf>-SCR performance of MnCr composite oxide catalyst",
    "authors": "; ; ",
    "journal": "Molecular Catalysis",
    "date": "2025-02-01",
    "doi": "10.1016/j.mcat.2024.114790",
    "abstract": "",
    "uri": "https://api.elsevier.com/content/article/pii/S2468823124009726",
    "pii": "S2468823124009726"
  },
  "fulltext": {
    "full-text-retrieval-response": {
      "scopus-eid": "2-s2.0-85212587226",
      "originalText": "serial JL 315758 291210 291744 291790 291809 31 Molecular Catalysis MOLECULARCATALYSIS 2024-12-23 2024-12-23 2024-12-23 2024-12-23 2025-01-10T19:57:26 1-s2.0-S2468823124009726 S2468-8231(24)00972-6 S2468823124009726 10.1016/j.mcat.2024.114790 S300 S300.1 FULL-TEXT 1-s2.0-S2468823124X00188 2025-01-10T21:49:12.241742Z 0 0 20250201 2025 2024-12-23T15:07:28.465602Z absattachment articleinfo articlenumber articletitlenorm authfirstinitialnorm authfirstsurnamenorm cid cids contenttype copyright crossmark dateloaded dateloadedtxt datesearch datesort dateupdated dco docsubtype doctype doi eid ewtransactionid hubeid indexeddate issn issnnorm itemstage itemtransactionid itemweight openaccess openarchive pg pgfirst pii piinorm pubdatestart pubdatetxt pubyr sectiontitle sortorder srctitle srctitlenorm srctype ssids alllist content subj subheadings suppl tomb volfirst volissue volumelist webpdf webpdfpagecount yearnav figure e-component body acknowledge affil appendices articletitle auth authfirstini authfull authkeywords authlast grantnumber grantsponsor grantsponsorid highlightsabst primabst ref specialabst 2468-8231 24688231 true 572 572 C Volume 572 52 114790 114790 114790 20250201 1 February 2025 2025-02-01 2025 Regular Papers article fla © 2024 Published by Elsevier B.V. ELECTRONTRANSFERSTABILIZINGHIGHLYACTIVESPECIESMN4ENHANCELOWTEMPERATURENH3SCRPERFORMANCEMNCRCOMPOSITEOXIDECATALYST HAN X 1 Introduction 2 Experimental section 2.1 Catalyst preparation 2.1.1 Preparation of the MnCr-1 catalyst 2.1.2 Preparation of the MnCr-2 catalyst 2.1.3 Preparation of the MnCr-3 catalyst 3 Results and discussion 3.1 Evaluation of catalyst denitrification performance and tolerance performance 3.1.1 Catalytic activity test 3.1.2 The resistance of H2O and SO2 test 3.2 Structure of catalysts 3.3 Surface chemical state 3.4 Morphology of catalysts 3.5 Redox properties of catalysts 3.6 Acidity properties of catalysts 3.7 In-situ DRIFT experiments 3.7.1 NH3 adsorption-desorption experiment 3.7.2 NO+O2 adsorption-desorption experiment 3.7.3 NH3+NO+O2 adsorption-desorption experiment 3.7.4 Transient reactions of adsorbed species on the surface of the MnCr-3 catalyst 3.8 Proposed reaction mechanism 4 Conclusions CRediT authorship contribution statement Acknowledgments Appendix Supplementary materials References DING 2022 1199 1210 J DENG 2016 5807 5815 S QIN 2022 B HAN 2019 10916 10976 L ZHU 2017 15624 15627 M ZHOU 2021 2981 2998 J XU 2019 42 50 Y XU 2018 7064 7071 L PENG 2016 692 698 Y KWON 2019 1167 1177 D HUSNAIN 2019 239 264 N LIU 2016 54 69 C TANG 2016 1248 1264 C CUI 2020 W MENG 2018 652 663 D WANG 2019 R KAPTEIJN 1994 173 189 F LI 2018 82 87 G JIANG 2009 1249 1254 B QIU 2015 2568 2577 M GAO 2020 145 155 F JIA 2019 139 143 J GUO 2021 413 M SHI 2021 X LI 2012 169 173 P JIN 2010 84 89 R GONG 2017 1925 1934 P QIU 2015 103 111 M LIU 2020 271 Y GAO 2019 411 424 F CHEN 2010 56 65 Z XIE 2019 897 905 A WEI 2023 N MO 2024 349 D FENG 2024 X WAN 2014 114 122 Y TANG 2015 12 17 X KANG 2006 236 241 M YANG 2013 568 578 Y XIE 2015 3005 3014 Y FANG 2007 8952 8961 J SUN 2018 479 488 P ZHOU 2017 1074 1085 X ZUO 2018 276 283 H ZHU 2023 535 J XIE 2020 515 S TANG 2020 398 X WANG 2020 9034 9045 B LIN 2023 639 C SHU 2012 25319 25327 Y WANG 2018 299 309 P HANX2025X114790 HANX2025X114790XX 2026-12-23T00:00:00.000Z 2026-12-23T00:00:00.000Z http://creativecommons.org/licenses/by-nc-nd/4.0/ © 2024 Published by Elsevier B.V. 2024-12-25T04:14:48.740Z http://vtw.elsevier.com/data/voc/AddOnTypes/50.7/aggregated-refined Guangxi Science and Technology Program AD23026107 National Natural Science Foundation of China 22265002 22062002 NSFC National Natural Science Foundation of China http://data.elsevier.com/vocabulary/SciValFunders/501100001809 http://sws.geonames.org/1814991/ This work is supported by National Natural Science Foundation of China (No. 22265002, 22062002); The Guangxi Science and Technology Program (No. Guike AD23026107). https://doi.org/10.15223/policy-017 https://doi.org/10.15223/policy-037 https://doi.org/10.15223/policy-012 https://doi.org/10.15223/policy-029 https://doi.org/10.15223/policy-004 item S2468-8231(24)00972-6 S2468823124009726 1-s2.0-S2468823124009726 10.1016/j.mcat.2024.114790 315758 2025-01-10T21:49:12.241742Z 2025-02-01 1-s2.0-S2468823124009726-main.pdf https://s3-eu-west-1.amazonaws.com/prod-ucs-content-store-eu-west/content/pii:S2468823124009726/MAIN/application/pdf/7f60ff0c77ed5217280e1c79cdfb4a70/main.pdf main.pdf pdf true 4383108 MAIN 12 1-s2.0-S2468823124009726-main_1.png https://s3-eu-west-1.amazonaws.com/prod-ucs-content-store-eu-west/content/pii:S2468823124009726/PREVIEW/image/png/86a80f3597c37c66d0dd725f8dfe2932/main_1.png main_1.png png 57918 849 656 IMAGE-WEB-PDF 1 1-s2.0-S2468823124009726-gr7.jpg https://s3-eu-west-1.amazonaws.com/prod-ucs-content-store-eu-west/content/pii:S2468823124009726/gr7/DOWNSAMPLED/image/jpeg/f719dee1ee64aef743521dbdb5737d73/gr7.jpg gr7 gr7.jpg jpg 27613 316 376 IMAGE-DOWNSAMPLED 1-s2.0-S2468823124009726-gr6.jpg https://s3-eu-west-1.amazonaws.com/prod-ucs-content-store-eu-west/content/pii:S2468823124009726/gr6/DOWNSAMPLED/image/jpeg/926e89c002da992b2802d730de6b9773/gr6.jpg gr6 gr6.jpg jpg 39215 368 397 IMAGE-DOWNSAMPLED 1-s2.0-S2468823124009726-gr9.jpg https://s3-eu-west-1.amazonaws.com/prod-ucs-content-store-eu-west/content/pii:S2468823124009726/gr9/DOWNSAMPLED/image/jpeg/30dd23a4b0fa57aecd4e2dc06619f217/gr9.jpg gr9 gr9.jpg jpg 110947 604 791 IMAGE-DOWNSAMPLED 1-s2.0-S2468823124009726-gr8.jpg https://s3-eu-west-1.amazonaws.com/prod-ucs-content-store-eu-west/content/pii:S2468823124009726/gr8/DOWNSAMPLED/image/jpeg/2c83134e4c43d54eaae2e52e8bb3bf1e/gr8.jpg gr8 gr8.jpg jpg 36503 322 376 IMAGE-DOWNSAMPLED 1-s2.0-S2468823124009726-gr3.jpg https://s3-eu-west-1.amazonaws.com/prod-ucs-content-store-eu-west/content/pii:S2468823124009726/gr3/DOWNSAMPLED/image/jpeg/0ba245cef5ccb1c8f726eaf494722f7d/gr3.jpg gr3 gr3.jpg jpg 41805 295 376 IMAGE-DOWNSAMPLED 1-s2.0-S2468823124009726-gr2.jpg https://s3-eu-west-1.amazonaws.com/prod-ucs-content-store-eu-west/content/pii:S2468823124009726/gr2/DOWNSAMPLED/image/jpeg/1498fd22f418d51b6cae8b01c5a6dc9e/gr2.jpg gr2 gr2.jpg jpg 31489 304 376 IMAGE-DOWNSAMPLED 1-s2.0-S2468823124009726-gr5.jpg https://s3-eu-west-1.amazonaws.com/prod-ucs-content-store-eu-west/content/pii:S2468823124009726/gr5/DOWNSAMPLED/image/jpeg/a2c1e0fb50e67c3a089a464a44f08c45/gr5.jpg gr5 gr5.jpg jpg 22936 141 508 IMAGE-DOWNSAMPLED 1-s2.0-S2468823124009726-gr4.jpg https://s3-eu-west-1.amazonaws.com/prod-ucs-content-store-eu-west/content/pii:S2468823124009726/gr4/DOWNSAMPLED/image/jpeg/a1d9d80ed540623c6b4ed4367df98171/gr4.jpg gr4 gr4.jpg jpg 108490 705 791 IMAGE-DOWNSAMPLED 1-s2.0-S2468823124009726-gr1.jpg https://s3-eu-west-1.amazonaws.com/prod-ucs-content-store-eu-west/content/pii:S2468823124009726/gr1/DOWNSAMPLED/image/jpeg/ad40b4d0d4b2d309d02065dfa773319e/gr1.jpg gr1 gr1.jpg jpg 27575 312 376 IMAGE-DOWNSAMPLED 1-s2.0-S2468823124009726-gr14.jpg https://s3-eu-west-1.amazonaws.com/prod-ucs-content-store-eu-west/content/pii:S2468823124009726/gr14/DOWNSAMPLED/image/jpeg/508883a89d416bfb301e4feaacf441e0/gr14.jpg gr14 gr14.jpg jpg 31410 181 376 IMAGE-DOWNSAMPLED 1-s2.0-S2468823124009726-gr13.jpg https://s3-eu-west-1.amazonaws.com/prod-ucs-content-store-eu-west/content/pii:S2468823124009726/gr13/DOWNSAMPLED/image/jpeg/b64821e382838b88e736fce2e484262c/gr13.jpg gr13 gr13.jpg jpg 19689 208 376 IMAGE-DOWNSAMPLED 1-s2.0-S2468823124009726-gr12.jpg https://s3-eu-west-1.amazonaws.com/prod-ucs-content-store-eu-west/content/pii:S2468823124009726/gr12/DOWNSAMPLED/image/jpeg/c7b053756d82e372011fe866a1482eec/gr12.jpg gr12 gr12.jpg jpg 74060 250 659 IMAGE-DOWNSAMPLED 1-s2.0-S2468823124009726-gr11.jpg https://s3-eu-west-1.amazonaws.com/prod-ucs-content-store-eu-west/content/pii:S2468823124009726/gr11/DOWNSAMPLED/image/jpeg/6f7515f12c17c63e2eec7841b844afeb/gr11.jpg gr11 gr11.jpg jpg 98916 537 659 IMAGE-DOWNSAMPLED 1-s2.0-S2468823124009726-ga1.jpg https://s3-eu-west-1.amazonaws.com/prod-ucs-content-store-eu-west/content/pii:S2468823124009726/ga1/DOWNSAMPLED/image/jpeg/65178457b852279ddf87104a65e2f0f9/ga1.jpg ga1 true ga1.jpg jpg 35584 200 415 IMAGE-DOWNSAMPLED 1-s2.0-S2468823124009726-gr10.jpg https://s3-eu-west-1.amazonaws.com/prod-ucs-content-store-eu-west/content/pii:S2468823124009726/gr10/DOWNSAMPLED/image/jpeg/901f8ddc5e38feddd97a5cdcf459d3b5/gr10.jpg gr10 gr10.jpg jpg 107919 592 791 IMAGE-DOWNSAMPLED 1-s2.0-S2468823124009726-gr7.sml https://s3-eu-west-1.amazonaws.com/prod-ucs-content-store-eu-west/content/pii:S2468823124009726/gr7/THUMBNAIL/image/gif/bf0e7947a1992fa3126c258dc945f88e/gr7.sml gr7 gr7.sml sml 8314 164 195 IMAGE-THUMBNAIL 1-s2.0-S2468823124009726-gr6.sml https://s3-eu-west-1.amazonaws.com/prod-ucs-content-store-eu-west/content/pii:S2468823124009726/gr6/THUMBNAIL/image/gif/9e55c778412c2a5900f7aa1b7ef85caf/gr6.sml gr6 gr6.sml sml 9518 164 177 IMAGE-THUMBNAIL 1-s2.0-S2468823124009726-gr9.sml https://s3-eu-west-1.amazonaws.com/prod-ucs-content-store-eu-west/content/pii:S2468823124009726/gr9/THUMBNAIL/image/gif/56a7b24d325193e4156cdcef9a62b7fa/gr9.sml gr9 gr9.sml sml 10999 164 215 IMAGE-THUMBNAIL 1-s2.0-S2468823124009726-gr8.sml https://s3-eu-west-1.amazonaws.com/prod-ucs-content-store-eu-west/content/pii:S2468823124009726/gr8/THUMBNAIL/image/gif/53b1c03898d510d8f1b4bec17522129d/gr8.sml gr8 gr8.sml sml 9389 164 191 IMAGE-THUMBNAIL 1-s2.0-S2468823124009726-gr3.sml https://s3-eu-west-1.amazonaws.com/prod-ucs-content-store-eu-west/content/pii:S2468823124009726/gr3/THUMBNAIL/image/gif/ad40975f91daaecb315ad05570715fbe/gr3.sml gr3 gr3.sml sml 11808 164 209 IMAGE-THUMBNAIL 1-s2.0-S2468823124009726-gr2.sml https://s3-eu-west-1.amazonaws.com/prod-ucs-content-store-eu-west/content/pii:S2468823124009726/gr2/THUMBNAIL/image/gif/0415a964f59a4303373b7d5a73923132/gr2.sml gr2 gr2.sml sml 9403 164 203 IMAGE-THUMBNAIL 1-s2.0-S2468823124009726-gr5.sml https://s3-eu-west-1.amazonaws.com/prod-ucs-content-store-eu-west/content/pii:S2468823124009726/gr5/THUMBNAIL/image/gif/1df905e66dfd6ce704b051ebfb2099d2/gr5.sml gr5 gr5.sml sml 9212 61 219 IMAGE-THUMBNAIL 1-s2.0-S2468823124009726-gr4.sml https://s3-eu-west-1.amazonaws.com/prod-ucs-content-store-eu-west/content/pii:S2468823124009726/gr4/THUMBNAIL/image/gif/3029a05a60c51b3dedd9a01e9ac09ac2/gr4.sml gr4 gr4.sml sml 9728 164 184 IMAGE-THUMBNAIL 1-s2.0-S2468823124009726-gr1.sml https://s3-eu-west-1.amazonaws.com/prod-ucs-content-store-eu-west/content/pii:S2468823124009726/gr1/THUMBNAIL/image/gif/54fc4a14c9708ca286e6b44ed39ccbfb/gr1.sml gr1 gr1.sml sml 8261 164 197 IMAGE-THUMBNAIL 1-s2.0-S2468823124009726-gr14.sml https://s3-eu-west-1.amazonaws.com/prod-ucs-content-store-eu-west/content/pii:S2468823124009726/gr14/THUMBNAIL/image/gif/1b46846dad4c5c231df21e104c17ea0d/gr14.sml gr14 gr14.sml sml 10712 106 219 IMAGE-THUMBNAIL 1-s2.0-S2468823124009726-gr13.sml https://s3-eu-west-1.amazonaws.com/prod-ucs-content-store-eu-west/content/pii:S2468823124009726/gr13/THUMBNAIL/image/gif/42a1c52a74c7b1121f39e45d78577962/gr13.sml gr13 gr13.sml sml 5662 121 219 IMAGE-THUMBNAIL 1-s2.0-S2468823124009726-gr12.sml https://s3-eu-west-1.amazonaws.com/prod-ucs-content-store-eu-west/content/pii:S2468823124009726/gr12/THUMBNAIL/image/gif/b457b51c65d6cca802d9fdab6841faaf/gr12.sml gr12 gr12.sml sml 10142 83 219 IMAGE-THUMBNAIL 1-s2.0-S2468823124009726-gr11.sml https://s3-eu-west-1.amazonaws.com/prod-ucs-content-store-eu-west/content/pii:S2468823124009726/gr11/THUMBNAIL/image/gif/116e1c1c6bbbe52ca7790ff923891703/gr11.sml gr11 gr11.sml sml 11973 164 201 IMAGE-THUMBNAIL 1-s2.0-S2468823124009726-ga1.sml https://s3-eu-west-1.amazonaws.com/prod-ucs-content-store-eu-west/content/pii:S2468823124009726/ga1/THUMBNAIL/image/gif/22aa002082d3f0cf5bb799dc57ddf524/ga1.sml ga1 true ga1.sml sml 10705 106 219 IMAGE-THUMBNAIL 1-s2.0-S2468823124009726-gr10.sml https://s3-eu-west-1.amazonaws.com/prod-ucs-content-store-eu-west/content/pii:S2468823124009726/gr10/THUMBNAIL/image/gif/a91b6139f02fa84b5afb7fb14cb93bab/gr10.sml gr10 gr10.sml sml 11561 164 219 IMAGE-THUMBNAIL 1-s2.0-S2468823124009726-gr7_lrg.jpg https://s3-eu-west-1.amazonaws.com/prod-ucs-content-store-eu-west/content/pii:S2468823124009726/HIGHRES/image/jpeg/bc344406f4094583cf576008ee269bc3/gr7_lrg.jpg gr7 gr7_lrg.jpg jpg 177005 1401 1667 IMAGE-HIGH-RES 1-s2.0-S2468823124009726-gr6_lrg.jpg https://s3-eu-west-1.amazonaws.com/prod-ucs-content-store-eu-west/content/pii:S2468823124009726/HIGHRES/image/jpeg/5268c017ac6bad36ae5b52d48da52d04/gr6_lrg.jpg gr6 gr6_lrg.jpg jpg 322061 1629 1759 IMAGE-HIGH-RES 1-s2.0-S2468823124009726-gr9_lrg.jpg https://s3-eu-west-1.amazonaws.com/prod-ucs-content-store-eu-west/content/pii:S2468823124009726/HIGHRES/image/jpeg/e54234bbd50110ebec8e9094413059d0/gr9_lrg.jpg gr9 gr9_lrg.jpg jpg 732894 2671 3500 IMAGE-HIGH-RES 1-s2.0-S2468823124009726-gr8_lrg.jpg https://s3-eu-west-1.amazonaws.com/prod-ucs-content-store-eu-west/content/pii:S2468823124009726/HIGHRES/image/jpeg/bd2f2b72f776911039bb83bfec1dad9a/gr8_lrg.jpg gr8 gr8_lrg.jpg jpg 225122 1429 1667 IMAGE-HIGH-RES 1-s2.0-S2468823124009726-gr3_lrg.jpg https://s3-eu-west-1.amazonaws.com/prod-ucs-content-store-eu-west/content/pii:S2468823124009726/HIGHRES/image/jpeg/c1fa72b7858e369d25918ea284f4284f/gr3_lrg.jpg gr3 gr3_lrg.jpg jpg 301061 1307 1667 IMAGE-HIGH-RES 1-s2.0-S2468823124009726-gr2_lrg.jpg https://s3-eu-west-1.amazonaws.com/prod-ucs-content-store-eu-west/content/pii:S2468823124009726/HIGHRES/image/jpeg/752d650cedcd6a2ebcf380f9653bc168/gr2_lrg.jpg gr2 gr2_lrg.jpg jpg 197541 1348 1667 IMAGE-HIGH-RES 1-s2.0-S2468823124009726-gr5_lrg.jpg https://s3-eu-west-1.amazonaws.com/prod-ucs-content-store-eu-west/content/pii:S2468823124009726/HIGHRES/image/jpeg/3aea7bd54ba51aa3e855216dcb85761b/gr5_lrg.jpg gr5 gr5_lrg.jpg jpg 219291 625 2250 IMAGE-HIGH-RES 1-s2.0-S2468823124009726-gr4_lrg.jpg https://s3-eu-west-1.amazonaws.com/prod-ucs-content-store-eu-west/content/pii:S2468823124009726/HIGHRES/image/jpeg/c1200bdf675f55bdac1c2d92c89f508e/gr4_lrg.jpg gr4 gr4_lrg.jpg jpg 803032 3118 3500 IMAGE-HIGH-RES 1-s2.0-S2468823124009726-gr1_lrg.jpg https://s3-eu-west-1.amazonaws.com/prod-ucs-content-store-eu-west/content/pii:S2468823124009726/HIGHRES/image/jpeg/0935f1df84b8411736da96f331262f3d/gr1_lrg.jpg gr1 gr1_lrg.jpg jpg 167364 1385 1667 IMAGE-HIGH-RES 1-s2.0-S2468823124009726-gr14_lrg.jpg https://s3-eu-west-1.amazonaws.com/prod-ucs-content-store-eu-west/content/pii:S2468823124009726/HIGHRES/image/jpeg/52b29a0a9b03f0b154a98d40c5ebb69e/gr14_lrg.jpg gr14 gr14_lrg.jpg jpg 220376 804 1667 IMAGE-HIGH-RES 1-s2.0-S2468823124009726-gr13_lrg.jpg https://s3-eu-west-1.amazonaws.com/prod-ucs-content-store-eu-west/content/pii:S2468823124009726/HIGHRES/image/jpeg/f86e8b7bdd4d131428df43b7163157cc/gr13_lrg.jpg gr13 gr13_lrg.jpg jpg 161793 920 1667 IMAGE-HIGH-RES 1-s2.0-S2468823124009726-gr12_lrg.jpg https://s3-eu-west-1.amazonaws.com/prod-ucs-content-store-eu-west/content/pii:S2468823124009726/HIGHRES/image/jpeg/38bced31e9aaa3917ef462aab3af6582/gr12_lrg.jpg gr12 gr12_lrg.jpg jpg 519508 1108 2917 IMAGE-HIGH-RES 1-s2.0-S2468823124009726-gr11_lrg.jpg https://s3-eu-west-1.amazonaws.com/prod-ucs-content-store-eu-west/content/pii:S2468823124009726/HIGHRES/image/jpeg/190b2e3958f3aa45e8d11e4c8a4eac7a/gr11_lrg.jpg gr11 gr11_lrg.jpg jpg 629314 2377 2917 IMAGE-HIGH-RES 1-s2.0-S2468823124009726-ga1_lrg.jpg https://s3-eu-west-1.amazonaws.com/prod-ucs-content-store-eu-west/content/pii:S2468823124009726/HIGHRES/image/jpeg/bbd7f8538c8c3d5f7101adf43139f22c/ga1_lrg.jpg ga1 true ga1_lrg.jpg jpg 228439 886 1839 IMAGE-HIGH-RES 1-s2.0-S2468823124009726-gr10_lrg.jpg https://s3-eu-west-1.amazonaws.com/prod-ucs-content-store-eu-west/content/pii:S2468823124009726/HIGHRES/image/jpeg/1c4d7758020750aeb0dad5c9e018219b/gr10_lrg.jpg gr10 gr10_lrg.jpg jpg 736962 2618 3500 IMAGE-HIGH-RES 1-s2.0-S2468823124009726-mmc1.docx https://s3-eu-west-1.amazonaws.com/prod-ucs-content-store-eu-west/content/pii:S2468823124009726/mmc1/MAIN/application/vnd.openxmlformats-officedocument.wordprocessingml.document/654884129dbec689d389fc4f12946076/mmc1.docx mmc1 mmc1.docx docx 2422569 APPLICATION MCAT 114790 114790 S2468-8231(24)00972-6 10.1016/j.mcat.2024.114790 Fig. 1 NH3-SCR denitrification performance with different catalysts. (Reaction conditions: NO = NH3 = 500 ppm, O2 = 5 vol%, N2 as equilibrium gas, gas flow rate of 100 mL min−1, 100 mg catalyst, GHSV = 60,000 h −1). Fig 1 Fig. 2 Water and sulfur resistance of different catalysts at 225 °C. (Reaction conditions: NO = NH3 = 500 ppm, O2 = 5 vol%, SO2 = 25 ppm, H2O = 5 vol%, N2 as equilibrium gas, gas flow rate of 100 mL min−1, 100 mg catalyst, GHSV = 60,000 h −1). Fig 2 Fig. 3 XRD patterns of the catalysts. Fig 3 Fig. 4 XPS spectra of the MnCr-3 catalyst and SCR used MnCr-3 catalyst. Fig 4 Fig. 5 SEM images of the catalysts: (a) MnCr-1, (b) MnCr-2, (c) MnCr-3. Fig 5 Fig. 6 H2-TPR curves of the catalysts. Fig 6 Fig. 7 O2-TPD curves of the catalysts. Fig 7 Fig. 8 NH3-TPD curves of the catalysts. Fig 8 Fig. 9 In situ DRIFTS spectra of NH3 adsorption (a) MnCr-1, (b) MnCr-2, (c) MnCr-3. Fig 9 Fig. 10 In situ DRIFTS spectra of NO+O2 adsorption (a) MnCr-1, (b) MnCr-2, (c) MnCr-3. Fig 10 Fig. 11 In situ DRIFTS spectra of NH3+NO+O2 adsorption (a) MnCr-1, (b) MnCr-2, (c) MnCr-3. Fig 11 Fig. 12 In situ DRIFTS spectra of the transient reactions of NH3 with pre-adsorbed NO + O2 (a) and NO + O2 with pre-adsorbed NH3 (b) over the MnCr-3 catalyst at 125 °C. Fig 12 Fig. 13 Adsorption and conversion processes of reactive gases on the MnCr-3 catalyst. Fig 13 Fig. 14 Reaction mechanism diagram of the MnCr-3 catalyst. Fig 14 Electron transfer stabilizing highly active species Mn4+ to enhance low-temperature NH3-SCR performance of MnCr composite oxide catalyst Xiaorong Han Writing – original draft Methodology Investigation Formal analysis Data curation Conceptualization a b c Qin Li Visualization Validation Resources Formal analysis a b c Shifei Gu Visualization Validation Software Formal analysis a b c Chengheng Huang Visualization Resources a b c Qiuju Qin Validation Formal analysis a b c Donghai Mo Software Formal analysis a b c Lihui Dong Supervision Funding acquisition a b c ⁎ Zhengjun Chen Investigation Funding acquisition a b c Bin Li Supervision Project administration Funding acquisition a b c ⁎ a State Key Laboratory of Featured Metal Materials and Life-cycle Safety for Composite Structures, Guangxi University, Nanning 530004, PR China State Key Laboratory of Featured Metal Materials and Life-cycle Safety for Composite Structures Guangxi University Nanning 530004 PR China aState Key Laboratory of Featured Metal Materials and Life-cycle Safety for Composite Structures, Guangxi University, Nanning 530004, PR China b Guangxi Colleges and Universities Key Laboratory of Applied Chemistry Technology and Resource Development, School of Chemistry and Chemical Engineering, Guangxi University, Nanning 530004, PR China Guangxi Colleges and Universities Key Laboratory of Applied Chemistry Technology and Resource Development School of Chemistry and Chemical Engineering Guangxi University Nanning 530004 PR China bGuangxi Colleges and Universities Key Laboratory of Applied Chemistry Technology and Resource Development, School of Chemistry and Chemical Engineering, Guangxi University, Nanning 530004, PR China c Guangxi Key Laboratory of Electrochemical Energy Materials, School of Chemistry and Chemical Engineering, Guangxi University, Nanning 530004, PR China Guangxi Key Laboratory of Electrochemical Energy Materials School of Chemistry and Chemical Engineering Guangxi University Nanning 530004 PR China cGuangxi Key Laboratory of Electrochemical Energy Materials, School of Chemistry and Chemical Engineering, Guangxi University, Nanning 530004, PR China ⁎ Corresponding authors. Mn4+ shows great potential in low-temperature SCR process due to its excellent redox properties, but Mn4+ is not easy to recover after participating in the SCR reaction, and realizing valence cycling of Mn ions to stabilize the content of high valence Mn4+ is still an urgent problem to be solved. In this work, a high valence Mn4+ catalyst was prepared and Cr was introduced to utilize the electron transfer between Mn and Cr to effectively realize the regeneration and content stabilization of Mn4+. The experimental results showed that the MnCr-3 catalyst with abundant Mn4+ exhibited excellent low-temperature denitrification performance and water and sulfur resistance, and the XPS study demonstrated that the regeneration of Mn4+ was achieved by the presence of electron transfer between Mn and Cr in the SCR reaction of the MnCr-3 catalyst. And a series of characterizations showed that the MnCr-3 catalyst with abundant high-valent Mn4+ exhibited excellent redox properties and acidity. Finally, in situ DRIFTS experiments explored the NH3-SCR reaction mechanism and water and sulfur resistance mechanism of the catalysts. Graphical abstract In this work, high valence manganese-chromium composite oxide catalytic system was prepared by hydrothermal oxidation. It was found that the electron transfer between Mn and Cr in the MnCr-3 catalyst could achieve the regeneration of highly active species Mn4+ and stabilize its content. The abundant high-valent Mn4+ in the MnCr-3 catalyst enabled the catalyst to exhibit excellent redox performance, promoted the oxidation of NO to NO2, and significantly enhanced the low-temperature SCR performance through the “fast SCR” reaction. In situ DRIFTS studies showed that the MnCr-3 catalyst follows the l-H mechanism during the whole reaction process. Image, graphical abstract Keywords NH3-SCR High valence state Mn4+ Low-temperature Water and sulfur resistance In situ DRIFTS Data availability Data will be made available on request. 1 Introduction Nitrogen oxides (NOx), blamed for deteriorating air conditions, largely originate from motor vehicle exhaust and the combustion of fossil fuels. The extensive emission of NOx has triggered various severe environmental issues, for instance, photochemical smog, acid rain, ozone layer destruction, etc., which have drawn extensive attention from all walks of life in the world [1,2]. To cope with the many harmful effects of nitrogen oxides on human beings, NOx emissions need to be strictly controlled, and various attempts have been made to this end. In particular, NH3 selective catalytic reduction (NH3-SCR) strategy has already been extensively employed for many years and has become the most established and dependable approach to removing NOx [3,4]. Currently, the V2O5-WO3(MoO3)/TiO2 catalysts exhibit superior catalytic properties in the medium and high temperature ranges and are widely applied for efficient NO removal [5,6]. To maximize the catalytic performance of vanadium-based catalysts, the NH3-SCR denitrification systems must be installed in front of the dust collector and the desulfurization unit, but in this case, the catalyst is prone to be deactivated by the toxicity of substances in the flue gas such as dust and SO2 [7,8]. Low-temperature (LT) catalysts can be utilized for efficient denitrification at low temperatures, making it possible to install the denitrification device following the dust catcher and desulfurization systems. Hence, studying and developing low-temperature and high-activity NH3-SCR denitrification catalysts is of far-reaching value. In recent years, many transition metal oxide catalysts have been extensively investigated for their LT denitrification performance, such as V2O5/TiO2 [9], V/Mo-Ti [10], FeOx [11], MnOx [12], MnOx–CeO2 [13]. One of them, Mn-based catalysts, because of their multivalent states and superior redox characteristics, have performed outstandingly in LT denitrification reactions, and have been widely noticed and researched in the field of denitrification in recent years [14–16]. Since the NO conversion of MnOx catalysts is governed by factors such as Mnn+ valence state, crystal type, morphology, and exposure surface, for this reason, researchers have carried out a large number of studies around these factors. Mn ions have many different valence states, and MnOx catalysts with different oxidation states exhibit different NH3-SCR performances. Kapteijn et al. [17] prepared pure MnOx catalysts of different oxidation states for low-temperature SCR tests and found that Mn oxides with higher valence states exhibit higher SCR reactivity. Different oxidation states of MnOx exhibited the following order of reactivity in the NH3-SCR reaction: MnO2 > Mn5O8 > Mn2O3 > Mn3O4 > MnO. Among the various Mn oxides, MnO2 with high-valent state, shows the strongest oxidizing ability. According to the literature, the high valence Mn4+ can promote the oxidation of NO to NO2, induce the “fast SCR” reaction, and enhance the low-temperature denitrification performance of the catalyst [18]. Numerous experiments have confirmed that high-valent Mn4+ ions perform most actively in the NH3-SCR. It has been found that the valence states of the active components of catalysts are affected by the preparation method, and thus catalysts obtained by different preparation methods tend to exhibit different catalytic abilities [19]. Therefore, the valence of metal ions and the content of each valence in the catalytic materials may differ from the prepared method. Although the SCR performance of high valence Mn4+ in pure MnOx catalysts is promising, it is unstable and can be easily reduced to Mn3+ with the catalytic reaction and cannot be recovered, thus limiting the application of pure MnOx catalysts in denitrification field. In order to solve the above problem, researchers have focused on the construction of composite oxide catalytic systems. Many research works have introduced other active metal oxides (MOx) like FeOx, CoOx, NiOx and CeOx as co-catalysts toward Mn-based catalysts for modification, which effectively enhance the SCR performance of the catalytic system through the electron transfer between Mnn+ and Mn+ [20–22]. Cr has been extensively studied in denitrification reactions because of its great redox capacity and SO2 tolerance [23]. Based on this, this paper considers the preparation of a bimetallic catalyst system by doping Cr oxides into Mn-based catalysts. Attempts were made to regenerate and stabilize the content of the active species Mn4+ through the strong contacts between the two metal ions and the electron transfer process, so as to achieve a better low-temperature denitrification performance. What needs to be emphasized is that, in general, the catalyst's Mn4+concentration, specific surface area, redox capacity, surface acidity and acid strength, and surface chemisorbed oxygen all significantly affect how well it performs in NOx removal. For example, in the LT NH3-SCR process, the magnitude of Mn4+ concentration is crucial for the conversion of NO, and its decreased concentration contributes to the catalyst's inactivity at low temperatures. Hence, the design of a catalytic system containing high content of high valence Mn4+ is significant to achieve good low-temperature denitrification performance and water and sulfur resistant properties. In this work, a high valence state manganese-chromium catalytic system was designed for low temperature NH3-SCR reaction. Two additional low valence state samples were made available for comparison in order to highlight the significant impact that high valence state Mn4+ and its concentration had on the sample's SCR performance. The experimental findings revealed that the MnCr-3 catalyst outperformed in the LT denitrification reaction and exhibited superior tolerance to sulfur and water. Subsequent studies showed that the MnCr-3 samples with more content of high valence state Mn4+ exhibited superior oxidation performance, promoted oxidation of NO to NO2, and accelerated the SCR reaction course, which was well verified in H2-TPR and O2-TPD datas. Additionally, more abundant high-valent Mn4+ provided richer acidic sites, contributing to NH3 and NOx adsorption, thus accelerating the denitrification process at low temperatures. And the effective electron transfer between Cr6+ and Mn3+can rapidly oxidize Mn3+ to produce more Mn4+ and encourage the regeneration of the highly active species of Mn4+, which makes the MnCr-3 catalyst perform more outstandingly in the LT SCR process. 2 Experimental section 2.1 Catalyst preparation 2.1.1 Preparation of the MnCr-1 catalyst First, a particular amount of deionized water was used to prepare a mixed solution consisting 4.9513 g of Mn(CH3COO)2•4H2O and 8.0838 g of Cr(NO3)3•9H2O at ambient temperature. Next, 10 mL of deionized citric acid monohydrate solution (the molar ratio of citric acid monohydrate to total metal ions was set at 1:1) was slowly added dropwise to the previous mixed solution while vigorous agitating, maintaining agitation up to 2 h to get a homogeneous mixed solution. Subsequently, the mixed solution dissolved with desired amount of polyethylene glycol (PEG-2000) was heated and stirred at 80 °C for 4 h to prepare well-stabilized gel, which dried in a blast oven at 100 °C overnight. At last, the powdered dried material was heated to 450 °C for 4 h in muffle furnace to get the sample (the sample was denoted as MnCr-1). 2.1.2 Preparation of the MnCr-2 catalyst 4.9513 g of Mn(CH3COO)2•4H2O and 8.0838 g of Cr(NO3)3•9H2O were mixed and milled for 30 min. Subsequently, the mixed material was dried and set aside. At the end, the sample was prepared by calcining the dried mixture ground into a fine powder in muffle furnace at 450 °C for 4 h (the sample was denoted as MnCr-2). 2.1.3 Preparation of the MnCr-3 catalyst Firstly, 3.1607 g of KMnO4 and 8.0838 g of Cr(NO3)3•9H2O were dissolved in an appropriate volume of deionized water, respectively, then stirred for 30 min until complete dissolution, to produce solution A and solution B, respectively. Secondly, solution B was gradually incorporated into solution A drop by drop with agitation, and a homogenized solution was obtained by continuously stirring for 1 h Thirdly, the above solution reacted at 80 ℃ for 4 h, cooled, and filtered to obtain solid material. Lastly, the raw material that was gained from washing and drying was ground into powder form and transferred to a muffle furnace for calcination at 450 °C for 4 h to yield the sample (the sample was denoted as MnCr-3). And all details of characterization are listed in the Supporting Information. 3 Results and discussion 3.1 Evaluation of catalyst denitrification performance and tolerance performance 3.1.1 Catalytic activity test Fig. 1 presented the results of the NO elimination in the SCR process for the samples within 75–300 °C. Apparently, the denitrification activities of the three catalysts exhibited similar temperature dependency within the whole reaction process, and all of them first increased to the peak levels as the temperature rose and subsequently reduced. It indicates that in the higher temperature range, the interactions between the active components as well as the motions and collisions of the reactant molecules are enhanced by the energy provided by the temperature increase, which contributes to the conversion of nitrogen oxides and enhanced denitrification abilities. Throughout the complete tested temperature interval, the denitrification activities of the three MnCr catalysts is as follows: MnCr-3 > MnCr-1 > MnCr-2. It can be noticed that the NO conversion of the MnCr-2 catalyst is no <60 % at 75–150 ℃, and the highest NO conversion of it only achieves 93 % at 200 ℃. In addition, the MnCr-1 catalyst shows <70 % NO conversion during the 75–125 °C temperature interval, but reaches 100 % activity at 175 °C. In contrast, the MnCr-3 catalyst exhibits the best LT denitrification activity, displaying approximately 90 % NO conversion at 100 °C, and always maintains over 90 % NO conversion within 100–225 °C. When the reaction temperature exceeded 200 °C, three MnCr samples' activity began to decline. On the one hand, such a phenomenon can be explained by the weakened adsorption of NH3 to acidic sites as well as by ammonia side reactions under high temperatures, causing a reduction of reductant NH3 [24]. On the other hand, it may be explained by the fact that there are thermally-stable nitrates aggregated on the surface of the catalysts, which cannot be decomposed in time to release the active sites, so that the reactive gases fail to react with the catalyst. According to the aforementioned analysis, in the NH3-SCR process, the MnCr-3 catalyst demonstrates better low-temperature denitrification activity. This may be related to the higher content of high-valent Mn4+ in the catalytic system, which facilitates the oxidation of NO to NO2 and promotes the \"fast SCR reaction\" under low temperatures. This conclusion will be further verified in the subsequent characterization. 3.1.2 The resistance of H2O and SO2 test In practical applications, water and sulfur dioxide toxic impacts are unavoidable, so the water and sulfur resistant properties of three MnCr catalysts were investigated. A measure of the sample's H2O and SO2 resistance is based on the percentage reduction in NO conversion before and after the H2O and SO2 tolerance test of each catalyst. As displayed in Fig. 2 , the NO conversion of three MnCr samples slightly increased within 3 h when exposed to 5 vol% H2O at 225 °C. The result indicates that these catalysts can more efficiently reduce NOx by NH3 with the existence of water vapor, which can be crucial for practical applications. However, with 5 % H2O and 25 ppm SO2 injected at the same time, the MnCr-2 catalyst performance was significantly suppressed, with the NO conversion dropped from 90 % to 21 % within 5 h Similarly, the MnCr-1 catalyst suffered from SO2 poisoning, and the NO conversion marginally declined from 97 % to 86 % within the same time. Compared with MnCr-1, the NO conversion of the MnCr-2 catalyst was drastically reduced after the simultaneous introduction of water and sulfur, probably due to its weaker acidity and deactivation caused by a large amount of SO2 adsorption. On the contrary, the MnCr-3 catalyst catalytic activity changed in a completely different trend. Exposed to 25 ppm SO2, the MnCr-3 catalyst was not deactivated, on the contrary, the NO conversion was slightly enhanced within 5 h This improvement may be because the generated sulfate species increased the catalyst's acidity. This means that MnCr-3 shows excellent durability against sulfur and water compared with the previous two catalysts. Besides, after turning off H2O and SO2, the NO conversion of both MnCr-1 and MnCr-2 catalysts failed to recover to their initial values, suggesting that the coexistence of H2O and SO2 resulted in irreversible activity reduction in both catalysts. One of the reasons, such irreversible deactivation may be explained by the generation of species like (NH4)2SO4 and NH4HSO4 from the reaction of SO2 with NH3 and H2O at low temperatures. These viscous sulfates (especially NH4HSO4) are difficult to decompose at low temperatures ((NH4)2SO4 and NH4HSO4 decompose at 230 °C and 350 °C, respectively), and they can deposit on catalyst surface, block the pores and cover the active ingredients, thus hindering the reactive gases to contact the active components and leading to catalyst deactivation [25]. The reason for this may also account for the over-sulfurization of the surface metal ions to form stable and difficult-to-decompose metal sulfates at this test temperature [26]. To further demonstrate the effect of sulfate formation on catalyst performance, FT-IR tests were performed on fresh samples and samples after water and sulfur resistance tests (Fig. S1). It can be seen that the water and sulfur poisoned MnCr-1 and MnCr-2 catalyst samples showed a more apparent characteristic peak associated with SO4 2− at 1122 cm−1 compared to the fresh samples. This further demonstrates that after the water and sulfur resistance tests, sulfate formation and deposition on the surface of the MnCr-1 and MnCr-2 catalysts covered the active sites, which resulted in a decrease in catalytic activity. In contrast, under the same test conditions, no characteristic peaks associated with sulfate were detected on the surface of the MnCr-3 sample, thus exhibiting better water and sulfur resistance. To investigate the effect of SO2 on the NH3-SCR reaction over the MnCr-3 and the MnCr-2 catalysts, the in situ DRIFTS spectra of NH3+NO+O2 for both catalysts in the presence and absence of SO2 at 200 °C were recorded, and the results are shown in Fig. S2. The experimental results showed that the introduction of SO2 led to the formation of more sulfate species on the surface of the MnCr-2 catalyst, and SO2 also inhibited the NO adsorption as well as the formation of the NH3-SCR reactive nitrogen oxides intermediates to a certain extent due to the competitive relationship between SO2 and NO Meanwhile, the surface sulfate species formed on the catalyst surface by the introduction of SO2 would occupy the active sites of the catalyst, leading to catalyst deactivation, which is consistent with the results of the previous water and sulfur resistance tests of the catalysts. 3.2 Structure of catalysts To determine the phase components of each catalyst, XRD analysis of MnCr-1, MnCr-2, and MnCr-3 was conducted and datas are presented in Fig. 3 . First, discussing the MnCr-1 sample, characteristic peaks of 2θ = 18.12°, 29.89°, 35.11°, 42.86°, 53.22°, 56.67°, and 62.09° can be observed on the XRD patterns. These characteristic peaks matched with the diffraction peaks of Mn1.5Cr1.5O4 (JCPDS card NO 33–0892), which means that this catalyst mainly contains the material phase of Mn1.5Cr1.5O4. As for the MnCr-2 catalyst, the diffraction peaks corresponding to the Mn1.5Cr1.5O4 phase also existed, while the diffraction peaks of 2θ = 18.12°, 24.47°, 33.52°, 35.95°, and 54.80° were attributed to Cr2O3 (JCPDS card NO 38–1479), which implied that this catalyst is mainly composed of Mn1.5Cr1.5O4 and Cr2O3. For the MnCr-3 catalyst, the same stronger peak signals were observed on its XRD pattern, but with different peak positions. The diffraction of 2θ = 12.8°, 18.2°, 41.9°, 49.9°, 60.3°, and 69.6° were attributed to α-MnO2 (JCPDS card NO 44–0141) [27], while the diffraction of 2θ = 28.51°, 37.09°, and 56.23° were assigned to MnCrO4 (JCPDS card NO 33–0893) [28], demonstrating that the catalyst mainly contains MnCrO4 and α-MnO2 phases. Combined with the above phase analysis results, it can be preliminarily determined that among the three catalyst samples, the MnCr-3 catalyst is dominated by the high valence state of Mn4+, while the other two samples are dominated by the lower valence state of Mn3+/Mn2+, which is in line with the expected results of the experimental program set up by us. According to previous studies, Mn4+ is crucial for the LT NH3-SCR process. Specifically, Mn4+ can accelerate the oxidation of NO to NO2 and induce a “fast SCR reaction” at low temperatures to improve catalytic performance [18]. Based on this, plentiful high valence Mn4+ in the MnCr-3 catalyst well explains its best low-temperature denitrification activity among the three samples. 3.3 Surface chemical state As shown in Fig. 4 , XPS test was conducted on MnCr-3 sample in order to further demonstrate the presence of high valence Mn4+ in this sample. Fig. 4(a) demonstrates the XPS spectra of Mn 2p for the MnCr-3 sample, from which two characteristic peaks corresponding to the spin orbitals of Mn 2p3/2 (peak at 642.1 eV) and Mn 2p1/2 (peak at 654.2 eV), respectively, can be identified. And the spectra of Mn 2p can be further deconvoluted into three small peaks, Mn2+ (641.1 eV), Mn3+ (642.4 eV), and Mn4+(643.8 eV), respectively [29,30]. From the Mn 2p spectra deconvolution results, it can be found that Mn species in the MnCr-3 catalyst are majorly dominated by the high valence Mn4+, coinciding with the findings of the XRD tests. According to the previous work, it was reported that Mn4+ could promote oxidation of NO to NO2 to induce an accelerated NH3-SCR process, significantly contributing to the low-temperature denitrification performance [18]. Thus, abundant Mn4+ in the MnCr-3 catalyst well explains the excellent low-temperature SCR performance. Fig. 4(b) demonstrates the XPS spectra of Cr 2p for the MnCr-3 sample, in which the two characteristic peaks near 586 and 576 eV relate to Cr 2p1/2 and Cr 2p3/2, respectively. Here the peaks around 575.5 eV, 576.7 eV, and 579.1 eV are assigned to Cr2+, Cr3+, and Cr6+, respectively [29,31,32]. According to the literature, the variable metal Cr, with the electron transfer between its high valence state Cr5+/Cr6+ ions and Mn3+, favors redox cycling, and thus Cr as an additive is conducive to the optimization of the denitrification performance of manganese-containing catalysts [30,31,33]. XPS spectra associated with O 1 s are demonstrated in Fig. 4(c), where the peak near 529.8 eV is attributed to lattice oxygen (denoted as Oα), while the other peak in the vicinity of the higher binding energy of 531.1 eV is assigned to chemisorbed oxygen (denoted as Oβ) [29,34]. The deconvolution results of O 1 s spectra indicate that the MnCr-3 catalyst is rich in both surface chemisorbed and active lattice oxygens. This will be further demonstrated subsequently by O2-TPD characterization. Further XPS tests were performed on the MnCr-3 catalyst sample after participating in the SCR reaction (labeled as SCR uesd MnCr-3 in Fig. 4). Table S1 summarizes the percentage content of different elemental valence states in the MnCr-3 catalyst before and after the SCR reaction. As can be seen from Fig. 4 and Table S1, the percentage content of Mn3+ on the surface of SCR used MnCr-3 decreased from 38.9 % to 36.9 %, the percentage content of Cr6+ decreased from 17.2 % to 13.9 %. While the percentage content of Mn4+ on the surface of SCR used MnCr-3 increased from 54.4 % to 57.7 %, the percentage content of Cr3+ increased from 47.6 % to 49.8 %, as compared to that of MnCr-3 before the SCR reaction. This demonstrates that there exists an electron transfer process of Cr6+ + Mn3+ ↔ Cr3+ + Mn4+ in the NH3-SCR reaction of the MnCr-3 catalyst, and such electron transfer may be an important reason for the catalyst to exhibit excellent low-temperature NH3-SCR performance. 3.4 Morphology of catalysts SEM tests were applied to analyze the catalyst's morphological characteristics. Fig. 5 presented the SEM graphics of MnCr-1, MnCr-2, and MnCr-3 catalysts, respectively. As shown in Fig. 5(a), the MnCr-1 catalyst presented a sheet-like stacked structure with a smooth surface; Fig. 5(b) exhibited the morphology of the MnCr-2 catalyst, compared with the MnCr-1 catalyst, the MnCr-2 catalyst showed a compact layer stacked structure with irregular nanoparticles attached to the surface. As for the morphology of the MnCr-3 catalyst, something could be noted from Fig. 5(c). Completely different from the other two samples, this catalyst exhibited an urchin-like structure, which consists of spherical cores decorated with evenly scattered nanorods on its surface. Such an urchin-like structure can distribute more active sites, which facilitates full interaction of the reaction gases with catalyst, so greatly improving the NOx removal capability. The conclusions are consistent with the activity test data and well-supported by the NH3-TPD and DRIFTS datas. 3.5 Redox properties of catalysts In general, a catalyst's low-temperature NO removal ability tends to be governed by its redox capacity. To evaluate the redox performance of each MnCr composite oxide catalyst, they were subjected to H2-TPR experiments and datas are presented as curves in Fig. 6 . Firstly, it can be noticed that the MnCr-1 sample demonstrates several distinct peaks around 285 °C, 399 °C, and 459 °C. According to previous literature reports, these peaks represent the sequential reduction process of MnO2 → Mn2O3 → Mn3O4 → MnO, whereas the peak around 350 °C could be interpreted as Cr2O3 being reduced to CrO [29,33,35]. The three reduction peaks of the MnCr-2 sample within 280–438 °C represent a series of MnO2 → MnO reductions with intermediate products Mn2O3 and Mn3O4, while the peak about 351 °C is an overlap of Mn2O3 → Mn3O4 and Cr2O3 → CrO here [29,33,35]. For the MnCr-3 sample, four reduction peaks were observed on its TPR curve, of which the three peaks around 277 °C, 329 °C, and 370 °C represent the multistage reduction process of Mn [32]. In addition, in combination with the previous work, the second peak around 303 °C could be characterized as a reduction of Cr2O3 → CrO [31]. From the TPR spectra, the corresponding H2 consumption of each catalyst is in the order of MnCr-3 > MnCr-1 > MnCr-2, indicating that the MnCr-3 catalyst exposed the largest number of reducible species. The reduction temperature is considered to be a measure of the strength of the catalyst's redox ability, the lower the reduction temperature, the stronger the redox potential. It can be observed that MnCr-3 (277 °C) reduction temperature is slightly lower than that of MnCr-1 (285 °C) and MnCr-2 (280 °C), which indicates that the MnCr-3 catalyst is more easily reduced and exhibits better redox performance. The H2-TPR findings also mean that the higher the Mn ion's valence is, the easier it can be reduced to show good oxidation performance, while the higher content of high valence Mn ions corresponds to better SCR activity. The established papers noted that electron transfer between valence-multivariable metals enhances the catalyst's redox capacity and then improves denitrification activity [36–38]. And the previous XPS analysis results before and after the SCR reaction of the MnCr-3 sample well confirmed the existence of electron transfer interaction between MnOx and CrOx in the MnCr-3 sample, which stabilized the content of high valence state Mn4+ by oxidizing Mn3+ to Mn4+ through the electron transfer path of Cr6+ + Mn3+ ↔ Cr3+ + Mn4+. The high valence state Mn4+ has good redox properties, and the MnCr-3 sample contains abundant high valence state Mn4+, which coincides with the H2-TPR results in which the MnCr-3 sample exhibits excellent redox properties. The electron transfer between Mn and Cr in the MnCr-3 sample promotes the regeneration of the highly active species Mn4+ after the SCR reaction, which facilitates the oxidation of NO to NO2, inducing a “fast SCR” reaction and thus enhancing the low-temperature SCR performance. This may be an important reason for the most prominent ability of this catalyst to remove NOx at low temperatures. Oxygen desorption over each catalyst was studied using O2-TPD and curves are illustrated in Fig. 7 . Generally the lower desorption peaks below 400 ℃ can be attributed to surface chemisorbed oxygen release, the desorption peaks within 400–650 °C can be explained by surface lattice oxygen release, and the peaks over 650 °C can be due to the evolvement of bulk phase lattice oxygen [39,40]. From the O2-TPD curves of all catalysts, it is clearly seen that both MnCr-1 and MnCr-3 catalysts exhibit more obvious desorption peaks of surface chemisorbed oxygen species compared to MnCr-2 catalyst. Commonly, surface chemisorbed oxygen, with better mobility, behaves more actively than other oxygens in the denitrification process. Compared with the MnCr-1 catalyst, the MnCr-3 sample's surface chemisorbed oxygen concentration does not occupy an absolute advantage, indicating that the surface chemisorbed oxygen isn't the major influence on the MnCr-3 catalytic system SCR performance. Similarly, Fang et al. [41] showed that sample's surface chemisorbed oxygen can accelerate catalytic reaction process, but only affects the redox reaction, and cannot completely determine the catalyst denitrification activity separately. Compared with the remaining two catalysts, the MnCr-3 catalyst showed the largest desorption peak area in the range of 400–650 °C, and the peak was obviously shifted to low temperature. This indicates that the MnCr-3 catalyst contains more abundant loosely bound active lattice oxygen. Similarly, it also implies that the MnCr-3 catalyst loses oxygen more easily and exhibits good performance, which in turn suggests that the catalyst has more abundant content of high valence Mn4+. This conclusion is consistent with the previous results of XRD, XPS, and H2-TPR analysis. Combined with the results of the activity tests, it suggests that lattice oxygen may be a key factor influencing the catalytic process of the MnCr-3 catalyst. 3.6 Acidity properties of catalysts Based on the NH3-SCR reaction mechanism, the sample surface acidity strength directly affects the adsorption of reactant NH3, which indirectly impacts the realization of efficient denitrification reaction [42]. Therefore, it is very necessary to discuss the acidic strength of each catalyst here, and in this study, the acid quantity and strength of samples were explored with the NH3-TPD technique. NH3-TPD test results for each sample are displayed in Fig. 8 . Owing to the differences in the adsorption strength and adsorption stability of different reactants NH3 on sample, the NH3-TPD curves of these samples within 100–750 °C can be divided into two parts (with 350 °C as the cut-off point). According to published studies, the desorption peaks in the 100–350 ℃ and 350–750 °C ranges correspond to NH3 desorption on weak and strong acid sites, respectively [43]. Commonly, reactant NH3 adsorbed at weak acids with weak adsorption strength can be smoothly desorbed and take part in catalytic process in the low-temperature stage, whereas, accordingly, reactant NH3 adsorbed at strong acids is more stably adsorbed and mainly participates in denitrification reaction during high-temperature phase. In addition, the peak area on NH3-TPD curve can reveal the acid amount. The magnitude of the total acid amount for the three catalysts is summarized in Table S2. The order of magnitude of the total acid content is: MnCr-3 > MnCr-1 > MnCr-2. The MnCr-3 sample showed obvious desorption peaks at 206 °C, 545 °C and 707 °C, respectively, suggesting that this catalyst has abundant weaker and stronger acid sites, which benefits NH3 adsorption and activation and promotes the denitrification reaction. reaction. Thus, the sample showed superior low-temperature denitrification activity over a broad temperature operating range. Referring to some existing research reports, it can be hypothesized that the presence of more abundant high-valent Mn4+ on MnCr-3 catalyst can offer richer acid sites, which promotes NH3 adsorption, and thus the denitrification performance of this catalyst is more prominent [44]. In contrast, the MnCr-1 catalyst with relatively few weak and strong acid sites showed a significant decrease in activity at temperatures below 150 °C. As for the MnCr-2 catalyst, its fewer surface acidic sites, together with its poor redox properties discussed earlier, explain why its denitrification capability is the lowest throughout the tested temperature interval. In summary, the amount and intensity of acidity on the surface of the three samples are in agreement with their denitrification properties, suggesting that abundant acid sites have a significant effect on the efficient removal of NOx. 3.7 In-situ DRIFT experiments The clarification of the surface species of catalysts and the intermediates that are generated along with the catalytic reaction, as well as the interconversions among these intermediates, are important guidance for studying catalyst reaction mechanisms. Therefore, in situ DRIFTS characterization of all samples was conducted to explore and propose possible reaction mechanisms. 3.7.1 NH3 adsorption-desorption experiment What is well-established and widely acknowledged is that Bronsted acid sites are essential for achieving superior low-temperature denitrification performance. To distinguish the Lewis (L) acid sites from the Brønsted (B) acid sites, NH3 adsorption-desorption experiments were performed. Before introducing the reaction gas NH3 for adsorption, all samples were required to be purified at 300 °C for 30 min under nitrogen atmosphere to exclude interference from impurities. As illustrated in Fig. 9 , when the samples were saturated with adsorbed NH3, some bands were detected. According to previous works, the bands at 1199, 1205, 1232, 1240, 1267, 1508, and 1515 cm−1 can be attributed to NH3 adsorbed on L acid sites, and the bands of 1427, and 1440 cm−1 can correspond to the coordination of NH4 + to B acid sites. The bands of 1355, 1360, and 1592 cm−1 probably relate to the adsorbed NH3 species oxidation [35,45,46]. From Fig. 9(a)-(c), the following conclusions can be obtained: 1) Abundant B and L acids were detected on both MnCr-1 and MnCr-3, but a smaller variety of acidic sites were detected on MnCr-2, which reconfirms the previous NH3-TPD characterization findings. Combined with the activity results demonstrated in Fig. 1, it can be found that MnCr-2 sample catalytic performance is inferior to that of another two catalysts over the whole temperature interval. This experimental fact well confirms that the catalyst's acid strength affects the denitrification performance of the catalyst to some extent. 2) During the programmed temperature increase, it can be noticed that the intensity of the absorption peaks of some L acids (1199, 1205, 1232, and 1240 cm−1) decreased continuously, while the intensity of the absorption peaks of some other L acids (1267, 1508, 1515, and 1592 cm−1) gradually increased, indicating that there are differences in the thermal stability of diverse L acids on sample surface, and they may be involved in different temperatures of the SCR reaction. In addition, some B acids (1427, 1440 cm−1) can be gradually converted to L acids with the increase in temperature. From the above findings, a conclusion can be drawn that the B acid sites mainly function in low-temperature phase, but the L acid sites make significant contributions over the whole temperature range. 3) Relatively abundant L acidic sites were detected on the MnCr-3 catalyst. Considering the findings of H2-TPR and O2-TPD characterization, it can be inferred that abundant high valence Mn4+ on the MnCr-3 catalysts provided more L acidic sites, which improved the NH3 adsorption as well as the catalytic reaction. 4) A large number of past research works have proved that more B acid sites can prevent SO2 adsorption and sulfate deposition, indicating that the B acid sites can significantly enhance the catalyst's tolerance to SO2 [47], which may be a major factor in the excellent sulfur resistance of the MnCr-3 sample. 3.7.2 NO+O2 adsorption-desorption experiment To further analyze the NOx intermediate species of each catalyst during the reaction process, all catalysts were employed in the in-situ DRIFTS test under a mixed NO+O2 atmosphere to obtain more relevant information. Before conducting NO+O2 co-adsorption experiments, purification at 110 °C for 30 min under N2 atmosphere is required. As depicted in Fig. 10 , when the three catalysts are saturated with the adsorption of these two reacting gases (NO+O2), the bands could be observed for monodentate nitrate (1282, 1283, 1286, and 1328 cm−1), bidentate nitrate (1458, 1461, 1513, and 1515 cm−1), bridged nitrate (1695 and 1697 cm−1), the O = N O structure resulted in adsorption of NO+O2 induced asymmetric stretching vibrations (1648 cm−1), gaseous NO2 (1614 cm−1), and free NO3 − (1376 cm−1) [29,45,48–50]. From Fig. 10(a)-(c), the infrared test results of the three catalysts exhibit the following characteristics: 1) with increasing temperature, the infrared signals of monodentate nitrate (1282–1286, 1328 cm−1) progressively weakened and completely disappeared around 200 ℃. Meanwhile, this change process was also coupled with the emergence of bridged nitrate and the production of bidentate nitrate. On the one hand, this may be due to the decomposition of monodentate nitrate, which is not thermally stable, with the increase of temperature; on the other hand, it may be explained by the gradual transformation of monodentate nitrate into more stable bidentate nitrate and bridge nitrate with the increasing temperature. This means that monodentate nitrate may be involved in the denitrification reaction in the temperature range tested. 2) The signal corresponding to NO2 (1614 cm−1) was noticed on MnCr-3 compared to MnCr-1 and MnCr-2 catalysts. According to the literature, the process of NO oxidation accompanied by the generation of gaseous NO2 is essential for LT denitrification because NO2 can evoke a fast SCR reaction, suggesting that MnCr-3 catalyst may be capable of faster and more efficient removal of nitrogen oxides in practical applications and that a “fast SCR reaction” may be taking place on this catalyst [51]. The MnCr-3 catalyst exhibits better redox properties with more Mn4+ in the high valence state, which promotes the formation of NO2 during the oxidation process. 3) Generally, as catalytic denitrification proceeds, if the formed bidentate nitrate species cannot engage in the catalytic process in time because they are overstable, their aggregation and deposition on sample surface can cause active sites with catalytic properties to be covered. This may be an important cause of the SCR performance decrease in higher temperatures for each sample. 3.7.3 NH3+NO+O2 adsorption-desorption experiment For investigating the evolution of sample surface active species as well as intermediates and other substances after the co-adsorption of the three reactive gases on all the samples with increasing temperature and proposing a potential reaction mechanism, all the samples were utilized for in-situ DRIFTS tests of NH3+NO+O2 co-adsorption and spectra were collected, and infrared spectra are presented in Fig. 11 . Before testing, all samples were subjected to catalyst purification using the same method as in the previous in-situ DRIFTS with the NH3 atmosphere alone. As depicted in Fig. 11(a), after saturation of the MnCr-1 sample by adsorbing NH3+NO+O2 at room temperature, the following species were observed: L acid (1246, 1592 cm−1), B acid (1428 cm−1), Oxidized species of adsorbed NH3 (1368 cm−1), monodentate nitrate (1328 cm−1), bidentate nitrate (1468, 1519 cm−1), and bridged nitrate (1692 cm−1) [45,48,50]. A variety of adsorbed NH3 and NOx species can be detected aggregating on MnCr-1 sample. With increasing temperature, bridged nitrate, monodentate nitrate, and NH4 + species decreased, indicating that they are the predominantly reactive species for denitrification, whereas bidentate nitrate is less active and shows better thermal stability. For the MnCr-2 catalyst, displayed in Fig. 11(b), the surface adsorption of the three reactive gases on its surface behaves similarly to that of MnCr-1. However, the corresponding adsorbed NH3 and adsorbed NOx species on MnCr-2 sample after exposure to three reactive gases were relatively reduced compared with those when it adsorbed NH3 alone and co-adsorbed NO+O2. Furthermore, the infrared absorption bands corresponding to bidentate nitrate gradually enhanced as the temperature increased. it can be inferred that the bidentate nitrate might have been progressively deposited to cover the reactive sites of the samples as the temperature continued to rise and the SCR reaction continued to proceed, and the above factors might have affected the catalytic activity of MnCr-2 to some extent. Both MnCr-1 and MnCr-2 catalysts exhibited riched species related to NH3 and NO+O2 adsorption throughout the catalytic process, suggesting that they predominantly follow the Langmuir–Hinshelwood(L-H) mechanism for NOx catalytic elimination. As demonstrated in Fig. 11(c), the following phenomena can be viewed on MnCr-3 catalyst spectra: 1) L acids (1225, 1272 cm−1), B acids (1445, 1655 cm−1), overlapping peaks of NH3 oxide species and free NO3 − (1365 cm−1), bidentate nitrate (1460, 1515 cm−1), gaseous NO2 (1616 cm−1), and bridged nitrate (1697 cm−1) [29,46,49,50]. 2) MnCr-3 surface adsorbed abundant B acid (NH4 +) and NOx species. Among them, bridged nitrate (1697 cm−1), B acids (1445, 1655 cm−1), and gaseous NO2 (1616 cm−1) progressively declined as the temperature increased, implying that they were fully involved in NOx elimination as the primary highly efficient active substances during the SCR process. On the contrary, the band of bidentate nitrate strengthened progressively as temperature increased, suggesting that bidentate nitrates are stable inactive species that gradually aggregate on sample surface with the catalytic denitrification reaction occurs. 3) The bands of bridged nitrate (1697 cm−1), NO2 (1616 cm−1), and NH4 + (1445, 1655 cm−1) dropped significantly when temperature rises from 50 to 100 °C. Combined with activity result of the MnCr-3 catalyst in Fig. 1, it can be noted that the increase in NO conversion at this time is more obvious, which means that the fast SCR reaction can be carried out on the MnCr-3 catalyst at low temperatures. The MnCr-3 catalyst contains more high-valence Mn4+ with excellent redox properties and abundant surface acidic sites, resulting in better low-temperature catalytic properties. 4) NH3 and NO+O2 adsorption behaviors were observed throughout the reaction temperature range revealing that the MnCr-3 mainly obeys the l-H mechanism during the SCR reaction process. 3.7.4 Transient reactions of adsorbed species on the surface of the MnCr-3 catalyst To further confirm the reaction mechanism of the MnCr-3 catalyst, an in situ DRIFT transient reaction was employed to deeply investigate the intermediates of this catalyst in the low-temperature NH3-SCR reaction. First, after the MnCr-3 catalyst was pre-adsorbed with NO+O2 at 125 °C, NH3 was introduced to react with NOx species adsorbed on the catalyst surface. As shown in Fig. 12 (a), after the MnCr-3 catalyst pre-adsorbed NO+O2 at 125 °C, absorption peaks associated with NO+O2 were observed on the catalyst surface: monodentate nitrate (1297 cm−1), bidentate nitrate (1460, 1516 cm−1), and gaseous NO2 (1616 cm−1). As the adsorption time of the fluent NH3 was gradually extended, the following phenomena could be observed: 1) the intensity of the peak of monodentate nitrate (1297 cm−1) gradually weakened until it disappeared. On the one hand, this might be due to the poor thermal stability of monodentate nitrate, which was transformed or decomposed during the reaction. On the other hand, it is likely that the monodentate nitrate is an active species, which might be consumed by the reaction with NH3 adsorbed on the catalyst surface. 2) At 3 min, absorption peaks related to NH3 adsorption began to appear, L acid (1274 cm−1), ammonia oxide species (1365 cm−1), and B acid (1440 cm−1), and these newly appeared absorption peaks gradually enhanced. 3) The intensity of the bidentate nitrate absorption peaks didn't decrease but rather increased throughout the transient reaction, indicating that bidentate nitrate didn't participate in the catalytic reaction. The in situ DRIFT transient spectra between NH3 and pre-adsorbed NO+O2 at 125 °C showed that the catalytic reaction occurring on the surface of the MnCr-3 catalyst follows the l-H mechanism, which is consistent with the reaction mechanism proposed earlier. A similar experimental approach was used to further study the transformation between different adsorbed NH3 species and their reactions with adsorbed NOx species, the in situ DRIFT transient reaction between pre-adsorbed NH3 and NO+O2 was also carried out, and the results are shown in Fig. 12(b). After pre-adsorption of NH3 on the MnCr-3 catalyst at 125 °C, the absorption peaks associated with NH3 were observed on the catalyst surface: the L acid (1199, 1240, and 1592 cm−1), the B acid (1445 cm−1), and the ammonia oxide species (1360 cm−1). With the gradual increase of the adsorption time of the passed NO+O2, the following phenomena can be observed: 1) the intensity of the absorption peaks of B acid (1445 cm−1) and some L acids (1199, 1592 cm−1) gradually weakened until disappeared, while L acid (1240 cm−1) existed throughout the whole reaction process, which indicates that B acid is mainly involved in the catalytic reaction in the low-temperature stage, while L acid plays an important role in both the low-temperature and high-temperature segments of the reaction. 2) The intensity of the absorption peak of the ammonia oxide species (1360 cm−1) was continuously decreasing but always present throughout the transient reaction. 3) At 3 min, the absorption peaks related to NO+O2 adsorption began to appear with monodentate nitrate (1285 cm−1) and bidentate nitrate (1460, 1515 cm−1). It can be seen that the intensity of the absorption peaks of bidentate nitrate increased more significantly. On the one hand, this might be due to the continuous transformation of monodentate nitrate, and on the other hand, it might be attributed to the better stability of bidentate nitrate itself. In summary, the catalytic reaction between the pre-adsorbed NH3 and adsorbed NO+O2 on the MnCr-3 catalyst followed the l-H mechanism, which is consistent with the previously hypothesized reaction mechanism. 3.8 Proposed reaction mechanism Based on the in situ DRIFTS analysis, a possible l-H reaction mechanism for the MnCr-3 catalyst was proposed, as shown in Fig. 13 and Fig. 14 . 4 Conclusions Mn4+ with excellent redox properties is a key active species for low-temperature NH3-SCR reactions. In this work, Cr was introduced to prepare a MnCr bimetallic composite oxide catalytic system, aiming at the regeneration of Mn4+ through the electron transfer pathway between Mn and Cr as a way to stabilize its content. To further highlight the influence of the high valence state Mn4+ and its content on the SCR performance of the catalysts, samples of two other low valence states were prepared for comparison. The experimental results showed that the MnCr-3 sample exhibited good LT denitrification activity (over 90 % NO conversion could be maintained within 100–225 °C) and superior endurance of SO2 and H2O (activity was almost unaffected for 5 h at 225 °C). The XPS results of the MnCr-3 sample before and after the SCR reaction proved the existence of electron transfer between Mn and Cr during the SCR reaction, which was favorable for the valence state recovery of Mn4+ after its participation in the SCR reaction, and realized the low-temperature rapid redox catalytic cycle. And the characterization of XRD, H2-TPR, O2-TPD and NH3-TPD showed that the MnCr-3 catalyst containing abundant Mn4+ exhibited excellent redox properties and acidity. The MnCr-3 catalytic mechanism was deduced and analyzed based on the results of in situ DRIFTS tests. The DRIFTS analysis showed that the MnCr-3 catalyst adsorbed a large amount of NH4 + and NOx species, and followed the l-H mechanism throughout the temperature interval where the denitrification reaction continued. In addition, FT-IR and in situ DRIFTS experiments were performed to analyze the water and sulfur resistance mechanism of the catalysts, and the formation and deposition of sulfate, which covers the active sites, is an important reason for the decrease in activity. CRediT authorship contribution statement Xiaorong Han: Writing – original draft, Methodology, Investigation, Formal analysis, Data curation, Conceptualization. Qin Li: Visualization, Validation, Resources, Formal analysis. Shifei Gu: Visualization, Validation, Software, Formal analysis. Chengheng Huang: Visualization, Resources. Qiuju Qin: Validation, Formal analysis. Donghai Mo: Software, Formal analysis. Lihui Dong: Supervision, Funding acquisition. Zhengjun Chen: Investigation, Funding acquisition. Bin Li: Supervision, Project administration, Funding acquisition. Declaration of competing interest The authors declare that they have no known competing financial interests or personal relationships that could have appeared to influence the work reported in this paper. Acknowledgments This work is supported by National Natural Science Foundation of China (No. 22265002, 22062002); The Guangxi Science and Technology Program (No. Guike AD23026107). Supplementary materials Supplementary material associated with this article can be found, in the online version, at doi:10.1016/j.mcat.2024.114790. Appendix Supplementary materials Image, application 1 References [1] J. Ding X. Yang A. Wang C. Yang Y. Guo Y. Guo L. Wang W. Zhan Sm-MnOx catalysts for low-temperature selective catalytic reduction of NO with NH3: effect of precipitation agent J. Rare Earths 40 2022 1199 1210 J. Ding, X. Yang, A. Wang, C. Yang, Y. Guo, Y. Guo, L. Wang, W. Zhan, Sm-MnOx catalysts for low-temperature selective catalytic reduction of NO with NH3: effect of precipitation agent, J. Rare Earths 40 (2022) 1199–1210. [2] S. Deng T. Meng B. Xu F. Gao Y. Ding L. Yu Y. Fan Advanced MnOx/TiO2 catalyst with preferentially exposed anatase {001} facet for low-temperature SCR of NO ACS. Catal. 6 2016 5807 5815 S. Deng, T. Meng, B. Xu, F. Gao, Y. Ding, L. Yu, Y. Fan, Advanced MnOx/TiO2 catalyst with preferentially exposed anatase {001} facet for low-temperature SCR of NO, ACS. Catal.. 6 (2016) 5807–5815. [3] B. Qin R. Guo L. Wei X. Yin T. Yin J. Zhou Z. Qiu A highly effective NbMnCeOx catalyst for NH3-SCR and in situ DRIFTS for investigating the reaction mechanism J. Environ. Chem. Eng. 10 2022 B. Qin, R. Guo, L. Wei, X. Yin, T. Yin, J. Zhou, Z. Qiu, A highly effective NbMnCeOx catalyst for NH3-SCR and in situ DRIFTS for investigating the reaction mechanism, J. Environ. Chem. Eng. 10 (2022). [4] L. Han S. Cai M. Gao J. Hasegawa P. Wang J. Zhang L. Shi D. Zhang Selective catalytic reduction of NOx with NH3 by using novel catalysts: state of the art and future prospects Chem. Rev. 119 2019 10916 10976 L. Han, S. Cai, M. Gao, J. Hasegawa, P. Wang, J. Zhang, L. Shi, D. Zhang, Selective catalytic reduction of NOx with NH3 by using novel catalysts: state of the art and future prospects, Chem. Rev. 119 (2019) 10916–10976. [5] M. Zhu J. Lai U. Tumuluri Z. Wu I. Wachs Nature of active sites and surface intermediates during SCR of NO with NH3 by supported V2O5–WO3/TiO2 catalysts J. Am. Chem. Soc. 139 2017 15624 15627 M. Zhu, J. Lai, U. Tumuluri, Z. Wu, I. Wachs, Nature of active sites and surface intermediates during SCR of NO with NH3 by supported V2O5–WO3/TiO2 catalysts, J. Am. Chem. Soc. 139 (2017) 15624–15627. [6] J. Zhou R. Guo X. Zhang Y. Liu C. Duan G. Wu W. Pan Cerium Oxide-Based Catalysts for Low-Temperature Selective Catalytic Reduction of NOx with NH3: a Review Energy Fuels. 35 2021 2981 2998 J. Zhou, R. Guo, X. Zhang, Y. Liu, C. Duan, G. Wu, W. Pan, Cerium Oxide-Based Catalysts for Low-Temperature Selective Catalytic Reduction of NOx with NH3: a Review, Energy Fuels. 35 (2021) 2981–2998. [7] Y. Xu X. Wu Q. Lin J. Hu R. Ran D. Weng SO2 promoted V2O5-MoO3/TiO2 catalyst for NH3-SCR of NO at low temperatures Appl. Catal. A Gen. 570 2019 42 50 Y. Xu, X. Wu, Q. Lin, J. Hu, R. Ran, D. Weng, SO2 promoted V2O5-MoO3/TiO2 catalyst for NH3-SCR of NO at low temperatures, Appl. Catal. A Gen. 570 (2019) 42–50. [8] L. Xu C. Wang H. Chang Q. Wu T. Zhang J. Li New insight into SO2 poisoning and regeneration of CeO2–WO3/TiO2 and V2O5–WO3/TiO2 catalysts for low-temperature NH3–SCR Environ. Sci. Technol. 52 2018 7064 7071 L. Xu, C. Wang, H. Chang, Q. Wu, T. Zhang, J. Li, New insight into SO2 poisoning and regeneration of CeO2–WO3/TiO2 and V2O5–WO3/TiO2 catalysts for low-temperature NH3–SCR, Environ. Sci. Technol. 52 (2018) 7064–7071. [9] Y. Peng W. Si X. Li J. Luo J. Li J. Crittenden J. Hao Comparison of MoO3 and WO3 on arsenic poisoning V2O5/TiO2 catalyst: DRIFTS and DFT study Appl. Catal. B Environ. 181 2016 692 698 Y. Peng, W. Si, X. Li, J. Luo, J. Li, J. Crittenden, J. Hao, Comparison of MoO3 and WO3 on arsenic poisoning V2O5/TiO2 catalyst: DRIFTS and DFT study, Appl. Catal. B Environ. 181 (2016) 692–698. [10] D. Kwon K. Park H. Ha S. Hong The role of molybdenum on the enhanced performance and SO2 resistance of V/Mo-Ti catalysts for NH3-SCR Appl. Surf. Sci. 481 2019 1167 1177 D. Kwon, K. Park, H. Ha, S. Hong, The role of molybdenum on the enhanced performance and SO2 resistance of V/Mo-Ti catalysts for NH3-SCR, Appl. Surf. Sci. 481 (2019) 1167–1177. [11] N. Husnain E. Wang K. Li M. Anwar A. Mehmood M. Gul D. Li J. Mao Iron oxide-based catalysts for low-temperature selective catalytic reduction of NOx with NH3 Rev. Chem. Eng. 35 2019 239 264 N. Husnain, E. Wang, K. Li, M. Anwar, A. Mehmood, M. Gul, D. Li, J. Mao, Iron oxide-based catalysts for low-temperature selective catalytic reduction of NOx with NH3, Rev. Chem. Eng. 35 (2019) 239–264. [12] C. Liu J. Shi C. Gao C. Niu Manganese oxide-based catalysts for low-temperature selective catalytic reduction of NOx with NH3: a review Appl. Catal. A Gen. 522 2016 54 69 C. Liu, J. Shi, C. Gao, C. Niu, Manganese oxide-based catalysts for low-temperature selective catalytic reduction of NOx with NH3: a review, Appl. Catal. A Gen. 522 (2016) 54–69. [13] C. Tang H. Zhang L. Dong Ceria-based catalysts for low-temperature selective catalytic reduction of NO with NH3 Catal. Sci. Technol. 6 2016 1248 1264 C. Tang, H. Zhang, L. Dong, Ceria-based catalysts for low-temperature selective catalytic reduction of NO with NH3, Catal. Sci. Technol. 6 (2016) 1248–1264. [14] W. Cui Y. Li H. Zhang Z. Wei B. Gao J. Dai T. Hu In situ encapsulated Co/MnOx nanoparticles inside quasi-MOF-74 for the higher alcohols synthesis from syngas Appl. Catal. B Environ. 278 2020 W. Cui, Y. Li, H. Zhang, Z. Wei, B. Gao, J. Dai, T. Hu, In situ encapsulated Co/MnOx nanoparticles inside quasi-MOF-74 for the higher alcohols synthesis from syngas, Appl. Catal. B Environ. 278 (2020). [15] D. Meng Q. Xu Y. Jiao Y. Guo Y. Guo L. Wang G. Lu W. Zhan Spinel structured CoaMnbOx mixed oxide catalyst for the selective catalytic reduction of NOx with NH3 Appl. Catal. B Environ. 221 2018 652 663 D. Meng, Q. Xu, Y. Jiao, Y. Guo, Y. Guo, L. Wang, G. Lu, W. Zhan, Spinel structured CoaMnbOx mixed oxide catalyst for the selective catalytic reduction of NOx with NH3, Appl. Catal. B Environ. 221 (2018) 652–663. [16] R. Wang Z. Hao Y. Li G. Liu H. Zhang H. Wang Y. Xia S. Zhan Relationship between structure and performance of a novel highly dispersed MnOx on Co-Al layered double oxide for low temperature NH3-SCR Appl. Catal. B Environ. 258 2019 R. Wang, Z. Hao, Y. Li, G. Liu, H. Zhang, H. Wang, Y. Xia, S. Zhan, Relationship between structure and performance of a novel highly dispersed MnOx on Co-Al layered double oxide for low temperature NH3-SCR, Appl. Catal. B Environ. 258 (2019). [17] F. Kapteijn L. Singoredjo A. Andreini J. Moulijn Activity and selectivity of pure manganese oxides in the selective catalytic reduction of nitric oxide with ammonia Appl. Catal. B Environ. 3 1994 173 189 F. Kapteijn, L. Singoredjo, A. Andreini, J. Moulijn, Activity and selectivity of pure manganese oxides in the selective catalytic reduction of nitric oxide with ammonia, Appl. Catal. B Environ. 3 (1994) 173–189. [18] G. Li B. Wang H. Wang J. Ma W.Q. Xu Y. Li Y. Han Q. Sun Fe and/or Mn oxides supported on fly ash-derived SBA-15 for low-temperature NH3-SCR Catal. Commun. 108 2018 82 87 G. Li, B. Wang, H. Wang, J. Ma, W.Q. Xu, Y. Li, Y. Han, Q. Sun, Fe and/or Mn oxides supported on fly ash-derived SBA-15 for low-temperature NH3-SCR, Catal. Commun. 108 (2018) 82–87. [19] B. Jiang Y. Liu Z. Wu Low-temperature selective catalytic reduction of NO on MnOx/TiO2 prepared by different methods J. Hazard. Mater. 162 2009 1249 1254 B. Jiang, Y. Liu, Z. Wu, Low-temperature selective catalytic reduction of NO on MnOx/TiO2 prepared by different methods, J. Hazard. Mater. 162 (2009) 1249–1254. [20] M. Qiu S. Zhan H. Yu D. Zhu S. Wang Facile preparation of ordered mesoporous MnCo2O4 for low-temperature selective catalytic reduction of NO with NH3 Nanoscale 7 2015 2568 2577 M. Qiu, S. Zhan, H. Yu, D. Zhu, S. Wang, Facile preparation of ordered mesoporous MnCo2O4 for low-temperature selective catalytic reduction of NO with NH3, Nanoscale 7 (2015) 2568–2577. [21] F. Gao X. Tang H. Yi S. Zhao W. Zhu Y. Shi Mn2NiO4 spinel catalyst for high-efficiency selective catalytic reduction of nitrogen oxides with good resistance to H2O and SO2 at low temperature J. Environ. Sci. 89 2020 145 155 F. Gao, X. Tang, H. Yi, S. Zhao, W. Zhu, Y. Shi, Mn2NiO4 spinel catalyst for high-efficiency selective catalytic reduction of nitrogen oxides with good resistance to H2O and SO2 at low temperature, J. Environ. Sci. 89 (2020) 145–155. [22] J. Jia R. Ran X. Guo X. Wu W. Chen D. Weng Enhanced low-temperature NO oxidation by iron-modified MnO2 catalysts Catal. Commun. 119 2019 139 143 J. Jia, R. Ran, X. Guo, X. Wu, W. Chen, D. Weng, Enhanced low-temperature NO oxidation by iron-modified MnO2 catalysts, Catal. Commun. 119 (2019) 139–143. [23] M. Guo Q. Liu C. Liu X. Wang Y. Bi B. Fan D. Ma X. Liang Z. Li Rational design of novel CrZrOx catalysts for efficient low temperature SCR of NO Chem. Eng. J. 2021 413 M. Guo, Q. Liu, C. Liu, X. Wang, Y. Bi, B. Fan, D. Ma, X. Liang, Z. Li, Rational design of novel CrZrOx catalysts for efficient low temperature SCR of NO, Chem. Eng. J. 413 (2021). [24] X. Shi J. Guo T. Shen A. Fan S. Yuan J. Li Enhancement of Ce doped La–Mn oxides for the selective catalytic reduction of NOx with NH3 and SO2 and/or H2O resistance Chem. Eng. J. 421 2021 X. Shi, J. Guo, T. Shen, A. Fan, S. Yuan, J. Li, Enhancement of Ce doped La–Mn oxides for the selective catalytic reduction of NOx with NH3 and SO2 and/or H2O resistance, Chem. Eng. J. 421 (2021). [25] P. Li Q. Liu Z. Liu Behaviors of NH4HSO4 in SCR of NO by NH3 over different cokes Chem. Eng. J. 181-182 2012 169 173 P. Li, Q. Liu, Z. Liu, Behaviors of NH4HSO4 in SCR of NO by NH3 over different cokes, Chem. Eng. J. 181-182 (2012) 169–173. [26] R. Jin Y. Liu Z. Wu H. Wang T. Gu Relationship between SO2 poisoning effects and reaction temperature for selective catalytic reduction of NO over Mn–Ce/TiO2 catalyst Catal. Today 153 2010 84 89 R. Jin, Y. Liu, Z. Wu, H. Wang, T. Gu, Relationship between SO2 poisoning effects and reaction temperature for selective catalytic reduction of NO over Mn–Ce/TiO2 catalyst, Catal. Today 153 (2010) 84–89. [27] P. Gong J. Xie D. Fang D. Han F. He F. Li K. Qi Effects of surface physicochemical properties on NH3-SCR activity of MnO2 catalysts with different crystal structures Chin. J. Catal. 38 2017 1925 1934 P. Gong, J. Xie, D. Fang, D. Han, F. He, F. Li, K. Qi, Effects of surface physicochemical properties on NH3-SCR activity of MnO2 catalysts with different crystal structures, Chin. J. Catal. 38 (2017) 1925–1934. [28] M. Qiu S. Zhan D. Zhu H. Yu Q. Shi NH3-SCR performance improvement of mesoporous Sn modified Cr-MnOx catalysts at low temperatures Catal. Today 258 2015 103 111 M. Qiu, S. Zhan, D. Zhu, H. Yu, Q. Shi, NH3-SCR performance improvement of mesoporous Sn modified Cr-MnOx catalysts at low temperatures, Catal. Today 258 (2015) 103–111. [29] Y. Liu R. Guo C. Duan G. Wu Y. Miao J. Gu W. Pan A highly effective urchin-like MnCrOx catalyst for the selective catalytic reduction of NOx with NH3 Fuel 2020 271 Y. Liu, R. Guo, C. Duan, G. Wu, Y. Miao, J. Gu, W. Pan, A highly effective urchin-like MnCrOx catalyst for the selective catalytic reduction of NOx with NH3, Fuel 271 (2020). [30] F. Gao X. Tang H. Yi S. Zhao J. Wang T. Gu Improvement of activity, selectivity and H2O&SO2-tolerance of micro-mesoporous CrMn2O4 spinel catalyst for low-temperature NH3-SCR of NOx Appl. Surf. Sci. 466 2019 411 424 F. Gao, X. Tang, H. Yi, S. Zhao, J. Wang, T. Gu, Improvement of activity, selectivity and H2O&SO2-tolerance of micro-mesoporous CrMn2O4 spinel catalyst for low-temperature NH3-SCR of NOx, Appl. Surf. Sci. 466 (2019) 411–424. [31] Z. Chen Q. Yang H. Li X. Li L. Wang S.Chi Tsang Cr–MnOx mixed-oxide catalysts for selective catalytic reduction of NO with NH3 at low temperature J. Catal. 276 2010 56 65 Z. Chen, Q. Yang, H. Li, X. Li, L. Wang, S.Chi Tsang, Cr–MnOx mixed-oxide catalysts for selective catalytic reduction of NO with NH3 at low temperature, J. Catal. 276 (2010) 56–65. [32] A. Xie Y. Tang X. Huang X. Jin P. Gu S. Luo C. Yao X. Li Three-dimensional nanoflower MnCrOx/Sepiolite catalyst with increased SO2 resistance for NH3-SCR at low temperature Chem. Eng. J. 370 2019 897 905 A. Xie, Y. Tang, X. Huang, X. Jin, P. Gu, S. Luo, C. Yao, X. Li, Three-dimensional nanoflower MnCrOx/Sepiolite catalyst with increased SO2 resistance for NH3-SCR at low temperature, Chem. Eng. J. 370 (2019) 897–905. [33] N. Wei X. Hu C. Zhao Z. Tong J. Yun X. Jiang K. Wang Y. Zou Z. Chen Unveiling alkali metal poisoning of CrMn catalyst for selective catalytic reduction of NO with NH3: an experimental and theoretical study Sci. Total Environ. 873 2023 N. Wei, X. Hu, C. Zhao, Z. Tong, J. Yun, X. Jiang, K. Wang, Y. Zou, Z. Chen, Unveiling alkali metal poisoning of CrMn catalyst for selective catalytic reduction of NO with NH3: an experimental and theoretical study, Sci. Total Environ. 873 (2023). [34] D. Mo Q. Qin C. Huang L. Tao C. Li J. Qiu J. Wang X. Han S. Gu Z. Chen B. Li L. Dong Regulating the distribution of iron active sites on γ-Fe2O3 via Mn-modified α-Fe2O3 for NH3-SCR Appl. Catal. B Environ. 2024 349 D. Mo, Q. Qin, C. Huang, L. Tao, C. Li, J. Qiu, J. Wang, X. Han, S. Gu, Z. Chen, B. Li, L. Dong, Regulating the distribution of iron active sites on γ-Fe2O3 via Mn-modified α-Fe2O3 for NH3-SCR, Appl. Catal. B Environ. 349 (2024). [35] X. Feng J. Zhu K. Song J. Zeng X. Zhou X. Guo K. Lin C. Zhang C. Xie J. Shi Insight into the reasons for enhanced NH3-SCR activity and SO2 tolerance of Mn-Co layered oxides Sep. Purif. Technol. 336 2024 X. Feng, J. Zhu, K. Song, J. Zeng, X. Zhou, X. Guo, K. Lin, C. Zhang, C. Xie, J. Shi, Insight into the reasons for enhanced NH3-SCR activity and SO2 tolerance of Mn-Co layered oxides, Sep. Purif. Technol. 336 (2024). [36] Y. Wan W. Zhao Y. Tang L. Li H. Wang Y. Cui J. Gu Y. Li J. Shi Ni-Mn bi-metal oxide catalysts for the low temperature SCR removal of NO with NH3 Appl. Catal. B Environ. 148-149 2014 114 122 Y. Wan, W. Zhao, Y. Tang, L. Li, H. Wang, Y. Cui, J. Gu, Y. Li, J. Shi, Ni-Mn bi-metal oxide catalysts for the low temperature SCR removal of NO with NH3, Appl. Catal. B Environ. 148-149 (2014) 114–122. [37] X. Tang F. Gao Y. Xiang H. Yi S. Zhao Low temperature catalytic oxidation of nitric oxide over the Mn–CoOx catalyst modified by nonthermal plasma Catal. Commun. 64 2015 12 17 X. Tang, F. Gao, Y. Xiang, H. Yi, S. Zhao, Low temperature catalytic oxidation of nitric oxide over the Mn–CoOx catalyst modified by nonthermal plasma, Catal. Commun. 64 (2015) 12–17. [38] M. Kang E.D. Park J.M. Kim J.E. Yie Cu–Mn mixed oxides for low temperature NO reduction with NH3 Catal. Today 111 2006 236 241 M. Kang, E.D. Park, J.M. Kim, J.E. Yie, Cu–Mn mixed oxides for low temperature NO reduction with NH3, Catal. Today 111 (2006) 236–241. [39] Y. Yang J. Huang S. Wang S. Deng B. Wang G. Yu Catalytic removal of gaseous unintentional POPs on manganese oxide octahedral molecular sieves Appl. Catal. B Environ. 142-143 2013 568 578 Y. Yang, J. Huang, S. Wang, S. Deng, B. Wang, G. Yu, Catalytic removal of gaseous unintentional POPs on manganese oxide octahedral molecular sieves, Appl. Catal. B Environ. 142-143 (2013) 568–578. [40] Y. Xie Y. Yu X. Gong Y. Guo Y. Guo Y. Wang G. Lu Effect of the crystal plane figure on the catalytic performance of MnO2 for the total oxidation of propane CrystEngComm. 17 2015 3005 3014 Y. Xie, Y. Yu, X. Gong, Y. Guo, Y. Guo, Y. Wang, G. Lu, Effect of the crystal plane figure on the catalytic performance of MnO2 for the total oxidation of propane, CrystEngComm. 17 (2015) 3005–3014. [41] J. Fang X. Bi D. Si Z. Jiang W. Huang Spectroscopic studies of interfacial structures of CeO2–TiO2 mixed oxides Appl. Surf. Sci. 253 2007 8952 8961 J. Fang, X. Bi, D. Si, Z. Jiang, W. Huang, Spectroscopic studies of interfacial structures of CeO2–TiO2 mixed oxides, Appl. Surf. Sci. 253 (2007) 8952–8961. [42] P. Sun S. Huang R. Guo M. Li S. Liu W. Pan Z. Fu S. Liu X. Sun J. Liu The enhanced SCR performance and SO2 resistance of Mn/TiO2 catalyst by the modification with Nb: a mechanistic study Appl. Surf. Sci. 447 2018 479 488 P. Sun, S. Huang, R. Guo, M. Li, S. Liu, W. Pan, Z. Fu, S. Liu, X. Sun, J. Liu, The enhanced SCR performance and SO2 resistance of Mn/TiO2 catalyst by the modification with Nb: a mechanistic study, Appl. Surf. Sci. 447 (2018) 479–488. [43] X. Zhou X. Huang A. Xie S. Luo C. Yao X. Li S. Zuo V2O5-decorated Mn-Fe/attapulgite catalyst with high SO2 tolerance for SCR of NOx with NH3 at low temperature Chem. Eng. J. 326 2017 1074 1085 X. Zhou, X. Huang, A. Xie, S. Luo, C. Yao, X. Li, S. Zuo, V2O5-decorated Mn-Fe/attapulgite catalyst with high SO2 tolerance for SCR of NOx with NH3 at low temperature, Chem. Eng. J. 326 (2017) 1074–1085. [44] H. Zuo D. Xu W. Liu H. Dan X. Liu S. Lin P. Hou Heat-treated dolomite-palygorskite clay supported MnOx catalysts prepared by various methods for low temperature selective catalytic reduction (SCR) with NH3 Appl. Clay Sci. 152 2018 276 283 H. Zuo, D. Xu, W. Liu, H. Dan, X. Liu, S. Lin, P. Hou, Heat-treated dolomite-palygorskite clay supported MnOx catalysts prepared by various methods for low temperature selective catalytic reduction (SCR) with NH3, Appl. Clay Sci. 152 (2018) 276–283. [45] J. Zhu J. Li B. Chu S. Liu S. Fu Q. Qin L. Dong B. Li Excitation of catalytic performance on MOFs derivative carrier by residual carbon for low-temperature NH3-SCR reaction Mol. Catal. 2023 535 J. Zhu, J. Li, B. Chu, S. Liu, S. Fu, Q. Qin, L. Dong, B. Li, Excitation of catalytic performance on MOFs derivative carrier by residual carbon for low-temperature NH3-SCR reaction, Mol. Catal. 535 (2023). [46] S. Xie L. Li L. Jin Y. Wu H. Liu Q. Qin X. Wei J. Liu L. Dong B. Li Low temperature high activity of M (M = Ce, Fe, Co, Ni) doped M-Mn/TiO2 catalysts for NH3-SCR and in situ DRIFTS for investigating the reaction mechanism Appl. Surf. Sci. 2020 515 S. Xie, L. Li, L. Jin, Y. Wu, H. Liu, Q. Qin, X. Wei, J. Liu, L. Dong, B. Li, Low temperature high activity of M (M = Ce, Fe, Co, Ni) doped M-Mn/TiO2 catalysts for NH3-SCR and in situ DRIFTS for investigating the reaction mechanism, Appl. Surf. Sci. 515 (2020). [47] X. Tang Y. Shi F. Gao S. Zhao H. Yi Z. Xie Promotional role of Mo on Ce0.3FeOx catalyst towards enhanced NH3-SCR catalytic performance and SO2 resistance Chem. Eng. J. 2020 398 X. Tang, Y. Shi, F. Gao, S. Zhao, H. Yi, Z. Xie, Promotional role of Mo on Ce0.3FeOx catalyst towards enhanced NH3-SCR catalytic performance and SO2 resistance, Chem. Eng. J. 398 (2020). [48] B. Wang M. Wang L. Han Y. Hou W. Bao C. Zhang G. Feng L. Chang Z. Huang J. Wang Improved activity and SO2 Resistance by Sm-modulated redox of MnCeSmTiOx mesoporous amorphous oxides for low-temperature NH3-SCR of NO ACS. Catal. 10 2020 9034 9045 B. Wang, M. Wang, L. Han, Y. Hou, W. Bao, C. Zhang, G. Feng, L. Chang, Z. Huang, J. Wang, Improved activity and SO2 Resistance by Sm-modulated redox of MnCeSmTiOx mesoporous amorphous oxides for low-temperature NH3-SCR of NO, ACS. Catal.. 10 (2020) 9034–9045. [49] C. Lin Z. Lian W. Shan H. He V2O5 supported on NbTiOx: a novel NH3-SCR catalyst with high performance induced by V-Nb-Ti interaction Appl. Surf. Sci. 2023 639 C. Lin, Z. Lian, W. Shan, H. He, V2O5 supported on NbTiOx: a novel NH3-SCR catalyst with high performance induced by V-Nb-Ti interaction, Appl. Surf. Sci. 639 (2023). [50] Y. Shu H. Sun X. Quan S. Chen Enhancement of Catalytic Activity Over the Iron-Modified Ce/TiO2 Catalyst for Selective Catalytic Reduction of NOx with Ammonia J. Phys. Chem. C 116 2012 25319 25327 Y. Shu, H. Sun, X. Quan, S. Chen, Enhancement of Catalytic Activity Over the Iron-Modified Ce/TiO2 Catalyst for Selective Catalytic Reduction of NOx with Ammonia, J. Phys. Chem. C 116 (2012) 25319–25327. [51] P. Wang S. Chen S. Gao J. Zhang H. Wang Z. Wu Niobium oxide confined by ceria nanotubes as a novel SCR catalyst with excellent resistance to potassium, phosphorus, and lead Appl. Catal. B Environ. 231 2018 299 309 P. Wang, S. Chen, S. Gao, J. Zhang, H. Wang, Z. Wu, Niobium oxide confined by ceria nanotubes as a novel SCR catalyst with excellent resistance to potassium, phosphorus, and lead, Appl. Catal. B Environ. 231 (2018) 299–309.",
      "scopus-id": "85212587226",
      "coredata": {
        "eid": "1-s2.0-S2468823124009726",
        "dc:description": "Mn4+ shows great potential in low-temperature SCR process due to its excellent redox properties, but Mn4+ is not easy to recover after participating in the SCR reaction, and realizing valence cycling of Mn ions to stabilize the content of high valence Mn4+ is still an urgent problem to be solved. In this work, a high valence Mn4+ catalyst was prepared and Cr was introduced to utilize the electron transfer between Mn and Cr to effectively realize the regeneration and content stabilization of Mn4+. The experimental results showed that the MnCr-3 catalyst with abundant Mn4+ exhibited excellent low-temperature denitrification performance and water and sulfur resistance, and the XPS study demonstrated that the regeneration of Mn4+ was achieved by the presence of electron transfer between Mn and Cr in the SCR reaction of the MnCr-3 catalyst. And a series of characterizations showed that the MnCr-3 catalyst with abundant high-valent Mn4+ exhibited excellent redox properties and acidity. Finally, in situ DRIFTS experiments explored the NH3-SCR reaction mechanism and water and sulfur resistance mechanism of the catalysts.",
        "openArchiveArticle": "false",
        "prism:coverDate": "2025-02-01",
        "openaccessUserLicense": null,
        "prism:aggregationType": "Journal",
        "prism:url": "https://api.elsevier.com/content/article/pii/S2468823124009726",
        "dc:creator": [
          {
            "@_fa": "true",
            "$": "Han, Xiaorong"
          },
          {
            "@_fa": "true",
            "$": "Li, Qin"
          },
          {
            "@_fa": "true",
            "$": "Gu, Shifei"
          },
          {
            "@_fa": "true",
            "$": "Huang, Chengheng"
          },
          {
            "@_fa": "true",
            "$": "Qin, Qiuju"
          },
          {
            "@_fa": "true",
            "$": "Mo, Donghai"
          },
          {
            "@_fa": "true",
            "$": "Dong, Lihui"
          },
          {
            "@_fa": "true",
            "$": "Chen, Zhengjun"
          },
          {
            "@_fa": "true",
            "$": "Li, Bin"
          }
        ],
        "link": [
          {
            "@_fa": "true",
            "@rel": "self",
            "@href": "https://api.elsevier.com/content/article/pii/S2468823124009726"
          },
          {
            "@_fa": "true",
            "@rel": "scidir",
            "@href": "https://www.sciencedirect.com/science/article/pii/S2468823124009726"
          }
        ],
        "dc:format": "application/json",
        "openaccessType": null,
        "pii": "S2468-8231(24)00972-6",
        "prism:volume": "572",
        "articleNumber": "114790",
        "prism:publisher": "Published by Elsevier B.V.",
        "dc:title": "Electron transfer stabilizing highly active species Mn4+ to enhance low-temperature NH3-SCR performance of MnCr composite oxide catalyst",
        "prism:copyright": "© 2024 Published by Elsevier B.V.",
        "openaccess": "0",
        "prism:issn": "24688231",
        "dcterms:subject": [
          {
            "@_fa": "true",
            "$": "NH3-SCR"
          },
          {
            "@_fa": "true",
            "$": "High valence state Mn4+"
          },
          {
            "@_fa": "true",
            "$": "Low-temperature"
          },
          {
            "@_fa": "true",
            "$": "Water and sulfur resistance"
          },
          {
            "@_fa": "true",
            "$": "In situ DRIFTS"
          }
        ],
        "openaccessArticle": "false",
        "prism:publicationName": "Molecular Catalysis",
        "openaccessSponsorType": null,
        "prism:pageRange": "114790",
        "pubType": "fla",
        "prism:coverDisplayDate": "1 February 2025",
        "prism:doi": "10.1016/j.mcat.2024.114790",
        "prism:startingPage": "114790",
        "dc:identifier": "doi:10.1016/j.mcat.2024.114790",
        "openaccessSponsorName": null
      },
      "objects": {
        "object": [
          {
            "@category": "standard",
            "@height": "316",
            "@width": "376",
            "@_fa": "true",
            "$": "https://api.elsevier.com/content/object/eid/1-s2.0-S2468823124009726-gr7.jpg?httpAccept=%2A%2F%2A",
            "@multimediatype": "JPEG image file",
            "@type": "IMAGE-DOWNSAMPLED",
            "@size": "27613",
            "@ref": "gr7",
            "@mimetype": "image/jpeg"
          },
          {
            "@category": "standard",
            "@height": "368",
            "@width": "397",
            "@_fa": "true",
            "$": "https://api.elsevier.com/content/object/eid/1-s2.0-S2468823124009726-gr6.jpg?httpAccept=%2A%2F%2A",
            "@multimediatype": "JPEG image file",
            "@type": "IMAGE-DOWNSAMPLED",
            "@size": "39215",
            "@ref": "gr6",
            "@mimetype": "image/jpeg"
          },
          {
            "@category": "standard",
            "@height": "604",
            "@width": "791",
            "@_fa": "true",
            "$": "https://api.elsevier.com/content/object/eid/1-s2.0-S2468823124009726-gr9.jpg?httpAccept=%2A%2F%2A",
            "@multimediatype": "JPEG image file",
            "@type": "IMAGE-DOWNSAMPLED",
            "@size": "110947",
            "@ref": "gr9",
            "@mimetype": "image/jpeg"
          },
          {
            "@category": "standard",
            "@height": "322",
            "@width": "376",
            "@_fa": "true",
            "$": "https://api.elsevier.com/content/object/eid/1-s2.0-S2468823124009726-gr8.jpg?httpAccept=%2A%2F%2A",
            "@multimediatype": "JPEG image file",
            "@type": "IMAGE-DOWNSAMPLED",
            "@size": "36503",
            "@ref": "gr8",
            "@mimetype": "image/jpeg"
          },
          {
            "@category": "standard",
            "@height": "295",
            "@width": "376",
            "@_fa": "true",
            "$": "https://api.elsevier.com/content/object/eid/1-s2.0-S2468823124009726-gr3.jpg?httpAccept=%2A%2F%2A",
            "@multimediatype": "JPEG image file",
            "@type": "IMAGE-DOWNSAMPLED",
            "@size": "41805",
            "@ref": "gr3",
            "@mimetype": "image/jpeg"
          },
          {
            "@category": "standard",
            "@height": "304",
            "@width": "376",
            "@_fa": "true",
            "$": "https://api.elsevier.com/content/object/eid/1-s2.0-S2468823124009726-gr2.jpg?httpAccept=%2A%2F%2A",
            "@multimediatype": "JPEG image file",
            "@type": "IMAGE-DOWNSAMPLED",
            "@size": "31489",
            "@ref": "gr2",
            "@mimetype": "image/jpeg"
          },
          {
            "@category": "standard",
            "@height": "141",
            "@width": "508",
            "@_fa": "true",
            "$": "https://api.elsevier.com/content/object/eid/1-s2.0-S2468823124009726-gr5.jpg?httpAccept=%2A%2F%2A",
            "@multimediatype": "JPEG image file",
            "@type": "IMAGE-DOWNSAMPLED",
            "@size": "22936",
            "@ref": "gr5",
            "@mimetype": "image/jpeg"
          },
          {
            "@category": "standard",
            "@height": "705",
            "@width": "791",
            "@_fa": "true",
            "$": "https://api.elsevier.com/content/object/eid/1-s2.0-S2468823124009726-gr4.jpg?httpAccept=%2A%2F%2A",
            "@multimediatype": "JPEG image file",
            "@type": "IMAGE-DOWNSAMPLED",
            "@size": "108490",
            "@ref": "gr4",
            "@mimetype": "image/jpeg"
          },
          {
            "@category": "standard",
            "@height": "312",
            "@width": "376",
            "@_fa": "true",
            "$": "https://api.elsevier.com/content/object/eid/1-s2.0-S2468823124009726-gr1.jpg?httpAccept=%2A%2F%2A",
            "@multimediatype": "JPEG image file",
            "@type": "IMAGE-DOWNSAMPLED",
            "@size": "27575",
            "@ref": "gr1",
            "@mimetype": "image/jpeg"
          },
          {
            "@category": "standard",
            "@height": "181",
            "@width": "376",
            "@_fa": "true",
            "$": "https://api.elsevier.com/content/object/eid/1-s2.0-S2468823124009726-gr14.jpg?httpAccept=%2A%2F%2A",
            "@multimediatype": "JPEG image file",
            "@type": "IMAGE-DOWNSAMPLED",
            "@size": "31410",
            "@ref": "gr14",
            "@mimetype": "image/jpeg"
          },
          {
            "@category": "standard",
            "@height": "208",
            "@width": "376",
            "@_fa": "true",
            "$": "https://api.elsevier.com/content/object/eid/1-s2.0-S2468823124009726-gr13.jpg?httpAccept=%2A%2F%2A",
            "@multimediatype": "JPEG image file",
            "@type": "IMAGE-DOWNSAMPLED",
            "@size": "19689",
            "@ref": "gr13",
            "@mimetype": "image/jpeg"
          },
          {
            "@category": "standard",
            "@height": "250",
            "@width": "659",
            "@_fa": "true",
            "$": "https://api.elsevier.com/content/object/eid/1-s2.0-S2468823124009726-gr12.jpg?httpAccept=%2A%2F%2A",
            "@multimediatype": "JPEG image file",
            "@type": "IMAGE-DOWNSAMPLED",
            "@size": "74060",
            "@ref": "gr12",
            "@mimetype": "image/jpeg"
          },
          {
            "@category": "standard",
            "@height": "537",
            "@width": "659",
            "@_fa": "true",
            "$": "https://api.elsevier.com/content/object/eid/1-s2.0-S2468823124009726-gr11.jpg?httpAccept=%2A%2F%2A",
            "@multimediatype": "JPEG image file",
            "@type": "IMAGE-DOWNSAMPLED",
            "@size": "98916",
            "@ref": "gr11",
            "@mimetype": "image/jpeg"
          },
          {
            "@category": "standard",
            "@height": "200",
            "@width": "415",
            "@_fa": "true",
            "$": "https://api.elsevier.com/content/object/eid/1-s2.0-S2468823124009726-ga1.jpg?httpAccept=%2A%2F%2A",
            "@multimediatype": "JPEG image file",
            "@type": "IMAGE-DOWNSAMPLED",
            "@size": "35584",
            "@ref": "ga1",
            "@mimetype": "image/jpeg"
          },
          {
            "@category": "standard",
            "@height": "592",
            "@width": "791",
            "@_fa": "true",
            "$": "https://api.elsevier.com/content/object/eid/1-s2.0-S2468823124009726-gr10.jpg?httpAccept=%2A%2F%2A",
            "@multimediatype": "JPEG image file",
            "@type": "IMAGE-DOWNSAMPLED",
            "@size": "107919",
            "@ref": "gr10",
            "@mimetype": "image/jpeg"
          },
          {
            "@category": "thumbnail",
            "@height": "164",
            "@width": "195",
            "@_fa": "true",
            "$": "https://api.elsevier.com/content/object/eid/1-s2.0-S2468823124009726-gr7.sml?httpAccept=%2A%2F%2A",
            "@multimediatype": "GIF image file",
            "@type": "IMAGE-THUMBNAIL",
            "@size": "8314",
            "@ref": "gr7",
            "@mimetype": "image/gif"
          },
          {
            "@category": "thumbnail",
            "@height": "164",
            "@width": "177",
            "@_fa": "true",
            "$": "https://api.elsevier.com/content/object/eid/1-s2.0-S2468823124009726-gr6.sml?httpAccept=%2A%2F%2A",
            "@multimediatype": "GIF image file",
            "@type": "IMAGE-THUMBNAIL",
            "@size": "9518",
            "@ref": "gr6",
            "@mimetype": "image/gif"
          },
          {
            "@category": "thumbnail",
            "@height": "164",
            "@width": "215",
            "@_fa": "true",
            "$": "https://api.elsevier.com/content/object/eid/1-s2.0-S2468823124009726-gr9.sml?httpAccept=%2A%2F%2A",
            "@multimediatype": "GIF image file",
            "@type": "IMAGE-THUMBNAIL",
            "@size": "10999",
            "@ref": "gr9",
            "@mimetype": "image/gif"
          },
          {
            "@category": "thumbnail",
            "@height": "164",
            "@width": "191",
            "@_fa": "true",
            "$": "https://api.elsevier.com/content/object/eid/1-s2.0-S2468823124009726-gr8.sml?httpAccept=%2A%2F%2A",
            "@multimediatype": "GIF image file",
            "@type": "IMAGE-THUMBNAIL",
            "@size": "9389",
            "@ref": "gr8",
            "@mimetype": "image/gif"
          },
          {
            "@category": "thumbnail",
            "@height": "164",
            "@width": "209",
            "@_fa": "true",
            "$": "https://api.elsevier.com/content/object/eid/1-s2.0-S2468823124009726-gr3.sml?httpAccept=%2A%2F%2A",
            "@multimediatype": "GIF image file",
            "@type": "IMAGE-THUMBNAIL",
            "@size": "11808",
            "@ref": "gr3",
            "@mimetype": "image/gif"
          },
          {
            "@category": "thumbnail",
            "@height": "164",
            "@width": "203",
            "@_fa": "true",
            "$": "https://api.elsevier.com/content/object/eid/1-s2.0-S2468823124009726-gr2.sml?httpAccept=%2A%2F%2A",
            "@multimediatype": "GIF image file",
            "@type": "IMAGE-THUMBNAIL",
            "@size": "9403",
            "@ref": "gr2",
            "@mimetype": "image/gif"
          },
          {
            "@category": "thumbnail",
            "@height": "61",
            "@width": "219",
            "@_fa": "true",
            "$": "https://api.elsevier.com/content/object/eid/1-s2.0-S2468823124009726-gr5.sml?httpAccept=%2A%2F%2A",
            "@multimediatype": "GIF image file",
            "@type": "IMAGE-THUMBNAIL",
            "@size": "9212",
            "@ref": "gr5",
            "@mimetype": "image/gif"
          },
          {
            "@category": "thumbnail",
            "@height": "164",
            "@width": "184",
            "@_fa": "true",
            "$": "https://api.elsevier.com/content/object/eid/1-s2.0-S2468823124009726-gr4.sml?httpAccept=%2A%2F%2A",
            "@multimediatype": "GIF image file",
            "@type": "IMAGE-THUMBNAIL",
            "@size": "9728",
            "@ref": "gr4",
            "@mimetype": "image/gif"
          },
          {
            "@category": "thumbnail",
            "@height": "164",
            "@width": "197",
            "@_fa": "true",
            "$": "https://api.elsevier.com/content/object/eid/1-s2.0-S2468823124009726-gr1.sml?httpAccept=%2A%2F%2A",
            "@multimediatype": "GIF image file",
            "@type": "IMAGE-THUMBNAIL",
            "@size": "8261",
            "@ref": "gr1",
            "@mimetype": "image/gif"
          },
          {
            "@category": "thumbnail",
            "@height": "106",
            "@width": "219",
            "@_fa": "true",
            "$": "https://api.elsevier.com/content/object/eid/1-s2.0-S2468823124009726-gr14.sml?httpAccept=%2A%2F%2A",
            "@multimediatype": "GIF image file",
            "@type": "IMAGE-THUMBNAIL",
            "@size": "10712",
            "@ref": "gr14",
            "@mimetype": "image/gif"
          },
          {
            "@category": "thumbnail",
            "@height": "121",
            "@width": "219",
            "@_fa": "true",
            "$": "https://api.elsevier.com/content/object/eid/1-s2.0-S2468823124009726-gr13.sml?httpAccept=%2A%2F%2A",
            "@multimediatype": "GIF image file",
            "@type": "IMAGE-THUMBNAIL",
            "@size": "5662",
            "@ref": "gr13",
            "@mimetype": "image/gif"
          },
          {
            "@category": "thumbnail",
            "@height": "83",
            "@width": "219",
            "@_fa": "true",
            "$": "https://api.elsevier.com/content/object/eid/1-s2.0-S2468823124009726-gr12.sml?httpAccept=%2A%2F%2A",
            "@multimediatype": "GIF image file",
            "@type": "IMAGE-THUMBNAIL",
            "@size": "10142",
            "@ref": "gr12",
            "@mimetype": "image/gif"
          },
          {
            "@category": "thumbnail",
            "@height": "164",
            "@width": "201",
            "@_fa": "true",
            "$": "https://api.elsevier.com/content/object/eid/1-s2.0-S2468823124009726-gr11.sml?httpAccept=%2A%2F%2A",
            "@multimediatype": "GIF image file",
            "@type": "IMAGE-THUMBNAIL",
            "@size": "11973",
            "@ref": "gr11",
            "@mimetype": "image/gif"
          },
          {
            "@category": "thumbnail",
            "@height": "106",
            "@width": "219",
            "@_fa": "true",
            "$": "https://api.elsevier.com/content/object/eid/1-s2.0-S2468823124009726-ga1.sml?httpAccept=%2A%2F%2A",
            "@multimediatype": "GIF image file",
            "@type": "IMAGE-THUMBNAIL",
            "@size": "10705",
            "@ref": "ga1",
            "@mimetype": "image/gif"
          },
          {
            "@category": "thumbnail",
            "@height": "164",
            "@width": "219",
            "@_fa": "true",
            "$": "https://api.elsevier.com/content/object/eid/1-s2.0-S2468823124009726-gr10.sml?httpAccept=%2A%2F%2A",
            "@multimediatype": "GIF image file",
            "@type": "IMAGE-THUMBNAIL",
            "@size": "11561",
            "@ref": "gr10",
            "@mimetype": "image/gif"
          },
          {
            "@category": "high",
            "@height": "1401",
            "@width": "1667",
            "@_fa": "true",
            "$": "https://api.elsevier.com/content/object/eid/1-s2.0-S2468823124009726-gr7_lrg.jpg?httpAccept=%2A%2F%2A",
            "@multimediatype": "JPEG image file",
            "@type": "IMAGE-HIGH-RES",
            "@size": "177005",
            "@ref": "gr7",
            "@mimetype": "image/jpeg"
          },
          {
            "@category": "high",
            "@height": "1629",
            "@width": "1759",
            "@_fa": "true",
            "$": "https://api.elsevier.com/content/object/eid/1-s2.0-S2468823124009726-gr6_lrg.jpg?httpAccept=%2A%2F%2A",
            "@multimediatype": "JPEG image file",
            "@type": "IMAGE-HIGH-RES",
            "@size": "322061",
            "@ref": "gr6",
            "@mimetype": "image/jpeg"
          },
          {
            "@category": "high",
            "@height": "2671",
            "@width": "3500",
            "@_fa": "true",
            "$": "https://api.elsevier.com/content/object/eid/1-s2.0-S2468823124009726-gr9_lrg.jpg?httpAccept=%2A%2F%2A",
            "@multimediatype": "JPEG image file",
            "@type": "IMAGE-HIGH-RES",
            "@size": "732894",
            "@ref": "gr9",
            "@mimetype": "image/jpeg"
          },
          {
            "@category": "high",
            "@height": "1429",
            "@width": "1667",
            "@_fa": "true",
            "$": "https://api.elsevier.com/content/object/eid/1-s2.0-S2468823124009726-gr8_lrg.jpg?httpAccept=%2A%2F%2A",
            "@multimediatype": "JPEG image file",
            "@type": "IMAGE-HIGH-RES",
            "@size": "225122",
            "@ref": "gr8",
            "@mimetype": "image/jpeg"
          },
          {
            "@category": "high",
            "@height": "1307",
            "@width": "1667",
            "@_fa": "true",
            "$": "https://api.elsevier.com/content/object/eid/1-s2.0-S2468823124009726-gr3_lrg.jpg?httpAccept=%2A%2F%2A",
            "@multimediatype": "JPEG image file",
            "@type": "IMAGE-HIGH-RES",
            "@size": "301061",
            "@ref": "gr3",
            "@mimetype": "image/jpeg"
          },
          {
            "@category": "high",
            "@height": "1348",
            "@width": "1667",
            "@_fa": "true",
            "$": "https://api.elsevier.com/content/object/eid/1-s2.0-S2468823124009726-gr2_lrg.jpg?httpAccept=%2A%2F%2A",
            "@multimediatype": "JPEG image file",
            "@type": "IMAGE-HIGH-RES",
            "@size": "197541",
            "@ref": "gr2",
            "@mimetype": "image/jpeg"
          },
          {
            "@category": "high",
            "@height": "625",
            "@width": "2250",
            "@_fa": "true",
            "$": "https://api.elsevier.com/content/object/eid/1-s2.0-S2468823124009726-gr5_lrg.jpg?httpAccept=%2A%2F%2A",
            "@multimediatype": "JPEG image file",
            "@type": "IMAGE-HIGH-RES",
            "@size": "219291",
            "@ref": "gr5",
            "@mimetype": "image/jpeg"
          },
          {
            "@category": "high",
            "@height": "3118",
            "@width": "3500",
            "@_fa": "true",
            "$": "https://api.elsevier.com/content/object/eid/1-s2.0-S2468823124009726-gr4_lrg.jpg?httpAccept=%2A%2F%2A",
            "@multimediatype": "JPEG image file",
            "@type": "IMAGE-HIGH-RES",
            "@size": "803032",
            "@ref": "gr4",
            "@mimetype": "image/jpeg"
          },
          {
            "@category": "high",
            "@height": "1385",
            "@width": "1667",
            "@_fa": "true",
            "$": "https://api.elsevier.com/content/object/eid/1-s2.0-S2468823124009726-gr1_lrg.jpg?httpAccept=%2A%2F%2A",
            "@multimediatype": "JPEG image file",
            "@type": "IMAGE-HIGH-RES",
            "@size": "167364",
            "@ref": "gr1",
            "@mimetype": "image/jpeg"
          },
          {
            "@category": "high",
            "@height": "804",
            "@width": "1667",
            "@_fa": "true",
            "$": "https://api.elsevier.com/content/object/eid/1-s2.0-S2468823124009726-gr14_lrg.jpg?httpAccept=%2A%2F%2A",
            "@multimediatype": "JPEG image file",
            "@type": "IMAGE-HIGH-RES",
            "@size": "220376",
            "@ref": "gr14",
            "@mimetype": "image/jpeg"
          },
          {
            "@category": "high",
            "@height": "920",
            "@width": "1667",
            "@_fa": "true",
            "$": "https://api.elsevier.com/content/object/eid/1-s2.0-S2468823124009726-gr13_lrg.jpg?httpAccept=%2A%2F%2A",
            "@multimediatype": "JPEG image file",
            "@type": "IMAGE-HIGH-RES",
            "@size": "161793",
            "@ref": "gr13",
            "@mimetype": "image/jpeg"
          },
          {
            "@category": "high",
            "@height": "1108",
            "@width": "2917",
            "@_fa": "true",
            "$": "https://api.elsevier.com/content/object/eid/1-s2.0-S2468823124009726-gr12_lrg.jpg?httpAccept=%2A%2F%2A",
            "@multimediatype": "JPEG image file",
            "@type": "IMAGE-HIGH-RES",
            "@size": "519508",
            "@ref": "gr12",
            "@mimetype": "image/jpeg"
          },
          {
            "@category": "high",
            "@height": "2377",
            "@width": "2917",
            "@_fa": "true",
            "$": "https://api.elsevier.com/content/object/eid/1-s2.0-S2468823124009726-gr11_lrg.jpg?httpAccept=%2A%2F%2A",
            "@multimediatype": "JPEG image file",
            "@type": "IMAGE-HIGH-RES",
            "@size": "629314",
            "@ref": "gr11",
            "@mimetype": "image/jpeg"
          },
          {
            "@category": "high",
            "@height": "886",
            "@width": "1839",
            "@_fa": "true",
            "$": "https://api.elsevier.com/content/object/eid/1-s2.0-S2468823124009726-ga1_lrg.jpg?httpAccept=%2A%2F%2A",
            "@multimediatype": "JPEG image file",
            "@type": "IMAGE-HIGH-RES",
            "@size": "228439",
            "@ref": "ga1",
            "@mimetype": "image/jpeg"
          },
          {
            "@category": "high",
            "@height": "2618",
            "@width": "3500",
            "@_fa": "true",
            "$": "https://api.elsevier.com/content/object/eid/1-s2.0-S2468823124009726-gr10_lrg.jpg?httpAccept=%2A%2F%2A",
            "@multimediatype": "JPEG image file",
            "@type": "IMAGE-HIGH-RES",
            "@size": "736962",
            "@ref": "gr10",
            "@mimetype": "image/jpeg"
          },
          {
            "@category": "standard",
            "@_fa": "true",
            "$": "https://api.elsevier.com/content/object/eid/1-s2.0-S2468823124009726-mmc1.docx?httpAccept=%2A%2F%2A",
            "@multimediatype": "Microsoft Word file",
            "@type": "APPLICATION",
            "@size": "2422569",
            "@ref": "mmc1",
            "@mimetype": "application/word"
          }
        ]
      },
      "link": {
        "@rel": "abstract",
        "@href": "https://api.elsevier.com/content/abstract/scopus_id/85212587226"
      }
    }
  }
}