{
  "metadata": {
    "title": "A synergistic catalyst based on a multivalence monodisperse-porous microspheres with oxygen vacancies for benzyl alcohol oxidation",
    "authors": "; ; ",
    "journal": "Molecular Catalysis",
    "date": "2020-12-31",
    "doi": "10.1016/j.mcat.2020.111227",
    "abstract": "",
    "uri": "https://api.elsevier.com/content/article/pii/S2468823120304909",
    "pii": "S2468823120304909"
  },
  "fulltext": {
    "full-text-retrieval-response": {
      "scopus-eid": "2-s2.0-85091641971",
      "originalText": "serial JL 315758 291210 291744 291790 291809 31 Molecular Catalysis MOLECULARCATALYSIS 2020-09-30 2020-09-30 2020-09-30 2020-09-30 2020-10-26T15:55:19 1-s2.0-S2468823120304909 S2468-8231(20)30490-9 S2468823120304909 10.1016/j.mcat.2020.111227 S300 S300.1 FULL-TEXT 1-s2.0-S2468823120X00162 2022-06-13T11:04:35.694117Z 0 0 20201201 20201231 2020 2020-09-30T13:44:47.464451Z absattachment articleinfo articlenumber articletitlenorm authfirstinitialnorm authfirstsurnamenorm cid cids contenttype copyright crossmark dateloaded dateloadedtxt datesearch datesort dateupdated dco docsubtype doctype doi eid ewtransactionid hubeid indexeddate issn issnnorm itemstage itemtransactionid itemweight openaccess openarchive pg pgfirst pii piinorm pubdateend pubdatestart pubdatetxt pubyr sectiontitle sortorder srctitle srctitlenorm srctype ssids alllist content subj subheadings suppl tomb volfirst volissue volumelist webpdf webpdfpagecount yearnav figure table e-component body mmlmath acknowledge affil appendices articletitle auth authfirstini authfull authkeywords authlast footnotes highlightsabst primabst ref specialabst 2468-8231 24688231 true 497 497 C Volume 497 19 111227 111227 111227 202012 December 2020 2020-12-01 2020-12-31 2020 Regular Papers article fla © 2020 Elsevier B.V. All rights reserved. ASYNERGISTICCATALYSTBASEDAMULTIVALENCEMONODISPERSEPOROUSMICROSPHERESOXYGENVACANCIESFORBENZYLALCOHOLOXIDATION TOSUN R 1 Introduction 2 Experimental 2.1 Synthesis of monodisperse-porous MnOx microspheres 2.2 Synthesis of monodisperse-porous SiO2 and TiO2 microspheres 2.3 Derivatization of monodisperse-porous MnOx microspheres 2.4 Decoration of Pd NPs onto amino functionalized-MnOx microspheres 2.5 Benzyl alcohol oxidation 3 Results and discussion 3.1 Characterization of catalysts 3.2 Catalytic performance of Pd@MnOx microspheres in BzOH oxidation 4 Conclusion CRediT authorship contribution statement Acknowledgement Appendix A Supplementary data References DIMITRATOS 2012 20 44 N KUMAR 2012 379 394 R CHOUDHARY 2010 252 257 V JI 2016 70424 70432 R MAHDAVI 2008 2201 2204 V LIU 2010 65 69 G ZOU 2015 375 382 M CHEN 2018 126 131 L NIU 2017 25885 25890 S HU 2019 852 861 Z MORGAN 2015 3430 3445 K ABAD 2005 4066 4069 A HACKETT 2007 8593 8596 S SUN 2017 1 9 J ARENA 2015 260 267 F HU 2016 26 33 Z TAN 2012 166 174 H ASSAL 2018 35 54 M ALSHAMMARI 2017 561 566 H ALHUMAIMESS 2014 1701 1710 M YANG 2020 60 69 J WEI 2019 9620 9628 Q DONG 2020 105843 Y WILDE 2019 271 282 C BORNSTEIN 2019 4360 4367 M KHAWAJI 2019 122 130 M JIN 2020 9617 9627 L LI 2020 144473 X KHAWAJI 2018 2529 2539 M OLMOS 2019 44 55 C MEHER 2019 2494 2503 S KETKAEW 2019 36027 36033 M MALEKI 2016 195 199 A MALEKI 2018 460 464 A MALEKI 2018 2929 2934 A KARA 2020 122991 123003 G ESMAEILI 2020 111037 111047 M HAJIZADEH 2018 87 93 Z SHAABANI 2008 79 81 A MALEKI 2015 809 814 A AZIZI 2017 62 65 M AZIZI 2017 2173 2177 M RAHIMI 2020 105850 105856 J TOSUN 2019 18505 18516 R KIP 2019 333 342 C GOKCAL 2020 121 B KIP 2019 100 106 C HAMALOGLU 2017 60 65 K BRUN 1999 55 60 M KHAN 2018 13909 13919 A AGHAZADEH 2016 055013 M SAID 2017 635 643 M LI 2019 1 9 X LUO 2008 3198 3207 J ROSSMEDGAARDEN 2009 680 687 E SCHUTH 2001 3184 3195 F YU 2003 191 197 C SUIB 2008 479 487 S SON 2001 4280 4283 Y GAO 2010 922 928 T OSWALD 1967 2023 2034 H TIAN 1997 926 930 Z PARK 2006 893 900 Y KERESSZEGI 2005 958 967 C SAVARA 2014 3464 3473 A CHANTHAW 2018 431 452 C GALVANIN 2018 196 210 F HAKANOGLU 2011 11575 11585 C REDDY 2019 1 5 V AMPAWA 2019 5238 5250 S TOSUNX2020X111227 TOSUNX2020X111227XR 2022-09-30T00:00:00.000Z 2022-09-30T00:00:00.000Z http://creativecommons.org/licenses/by-nc-nd/4.0/ © 2020 Elsevier B.V. All rights reserved. 2022-06-07T18:07:56.249Z http://vtw.elsevier.com/data/voc/AddOnTypes/50.7/aggregated-refined TÜBA Turkish Academy of Sciences Türkiye Bilimler Akademisi http://data.elsevier.com/vocabulary/SciValFunders/501100004412 http://sws.geonames.org/298795/ The authors gratefully acknowledge Assoc. Prof. Alper Uzun and Samira Fatma Kurtoğlu from Chemical and Biological Engineering Department at Koç University for their assistance with CO chemisorption experiments and for their noble contributions to related discussions. All authors sincerely thank Turkish Academy of Sciences (TÜBA) for providing research support to Prof. Ali Tuncel as a full-member. item S2468-8231(20)30490-9 S2468823120304909 1-s2.0-S2468823120304909 10.1016/j.mcat.2020.111227 315758 2020-10-28T12:23:12.949366Z 2020-12-01 2020-12-31 1-s2.0-S2468823120304909-main.pdf https://s3-eu-west-1.amazonaws.com/prod-ucs-content-store-eu-west/content/pii:S2468823120304909/MAIN/application/pdf/b9b3fb9ba8adff042d1be2ce1cfe3131/main.pdf main.pdf pdf true 6617557 MAIN 13 1-s2.0-S2468823120304909-main_1.png https://s3-eu-west-1.amazonaws.com/prod-ucs-content-store-eu-west/content/pii:S2468823120304909/PREVIEW/image/png/2c315dfb225fbf9fcf75e805310ec711/main_1.png main_1.png png 56435 849 656 IMAGE-WEB-PDF 1 1-s2.0-S2468823120304909-gr1.jpg https://s3-eu-west-1.amazonaws.com/prod-ucs-content-store-eu-west/content/pii:S2468823120304909/gr1/DOWNSAMPLED/image/jpeg/72abb7ae1377b3766caa286ee48fc2d4/gr1.jpg gr1 gr1.jpg jpg 41992 539 340 IMAGE-DOWNSAMPLED 1-s2.0-S2468823120304909-gr2.jpg https://s3-eu-west-1.amazonaws.com/prod-ucs-content-store-eu-west/content/pii:S2468823120304909/gr2/DOWNSAMPLED/image/jpeg/46d7cd23390fe6b8bbe79f902e85cf7a/gr2.jpg gr2 gr2.jpg jpg 25632 252 491 IMAGE-DOWNSAMPLED 1-s2.0-S2468823120304909-gr3.jpg https://s3-eu-west-1.amazonaws.com/prod-ucs-content-store-eu-west/content/pii:S2468823120304909/gr3/DOWNSAMPLED/image/jpeg/0dda8810f4ce41c1f3dcdde385992d47/gr3.jpg gr3 gr3.jpg jpg 43999 281 566 IMAGE-DOWNSAMPLED 1-s2.0-S2468823120304909-gr4.jpg https://s3-eu-west-1.amazonaws.com/prod-ucs-content-store-eu-west/content/pii:S2468823120304909/gr4/DOWNSAMPLED/image/jpeg/0fc74bff3f89fb6a359872b26021460e/gr4.jpg gr4 gr4.jpg jpg 75980 315 717 IMAGE-DOWNSAMPLED 1-s2.0-S2468823120304909-gr5.jpg https://s3-eu-west-1.amazonaws.com/prod-ucs-content-store-eu-west/content/pii:S2468823120304909/gr5/DOWNSAMPLED/image/jpeg/0d834eb993ce7a4b9ad1f8e92e0d05af/gr5.jpg gr5 gr5.jpg jpg 105164 307 717 IMAGE-DOWNSAMPLED 1-s2.0-S2468823120304909-gr6.jpg https://s3-eu-west-1.amazonaws.com/prod-ucs-content-store-eu-west/content/pii:S2468823120304909/gr6/DOWNSAMPLED/image/jpeg/34a33bc839a6da205e8c2c8acf432630/gr6.jpg gr6 gr6.jpg jpg 21662 223 340 IMAGE-DOWNSAMPLED 1-s2.0-S2468823120304909-gr7.jpg https://s3-eu-west-1.amazonaws.com/prod-ucs-content-store-eu-west/content/pii:S2468823120304909/gr7/DOWNSAMPLED/image/jpeg/bad351d9c66a8a5b287a2d57185c2bdc/gr7.jpg gr7 gr7.jpg jpg 72361 570 566 IMAGE-DOWNSAMPLED 1-s2.0-S2468823120304909-gr8.jpg https://s3-eu-west-1.amazonaws.com/prod-ucs-content-store-eu-west/content/pii:S2468823120304909/gr8/DOWNSAMPLED/image/jpeg/cd4ecb622d66c87253946e4353f6c0b1/gr8.jpg gr8 gr8.jpg jpg 15793 172 340 IMAGE-DOWNSAMPLED 1-s2.0-S2468823120304909-gr9.jpg https://s3-eu-west-1.amazonaws.com/prod-ucs-content-store-eu-west/content/pii:S2468823120304909/gr9/DOWNSAMPLED/image/jpeg/796d35125d6851f698de8b591578a098/gr9.jpg gr9 gr9.jpg jpg 60941 310 566 IMAGE-DOWNSAMPLED 1-s2.0-S2468823120304909-ga1.jpg https://s3-eu-west-1.amazonaws.com/prod-ucs-content-store-eu-west/content/pii:S2468823120304909/ga1/DOWNSAMPLED/image/jpeg/8a4e74ff699f7ed6a30f61a113f13602/ga1.jpg ga1 true ga1.jpg jpg 31408 173 500 IMAGE-DOWNSAMPLED 1-s2.0-S2468823120304909-gr12.jpg https://s3-eu-west-1.amazonaws.com/prod-ucs-content-store-eu-west/content/pii:S2468823120304909/gr12/DOWNSAMPLED/image/jpeg/37dbec9f39205d37f1571bb10a718883/gr12.jpg gr12 gr12.jpg jpg 18898 213 340 IMAGE-DOWNSAMPLED 1-s2.0-S2468823120304909-gr11.jpg https://s3-eu-west-1.amazonaws.com/prod-ucs-content-store-eu-west/content/pii:S2468823120304909/gr11/DOWNSAMPLED/image/jpeg/99e6420eff2ec0389891fb2de2fbaf48/gr11.jpg gr11 gr11.jpg jpg 60627 430 566 IMAGE-DOWNSAMPLED 1-s2.0-S2468823120304909-gr10.jpg https://s3-eu-west-1.amazonaws.com/prod-ucs-content-store-eu-west/content/pii:S2468823120304909/gr10/DOWNSAMPLED/image/jpeg/cac6934602cddc2988fb2a30a7db3ad2/gr10.jpg gr10 gr10.jpg jpg 27529 261 491 IMAGE-DOWNSAMPLED 1-s2.0-S2468823120304909-gr1.sml https://s3-eu-west-1.amazonaws.com/prod-ucs-content-store-eu-west/content/pii:S2468823120304909/gr1/THUMBNAIL/image/gif/f2b48a64b1f17800fe787013e839144a/gr1.sml gr1 gr1.sml sml 6091 163 103 IMAGE-THUMBNAIL 1-s2.0-S2468823120304909-gr2.sml https://s3-eu-west-1.amazonaws.com/prod-ucs-content-store-eu-west/content/pii:S2468823120304909/gr2/THUMBNAIL/image/gif/9cce16c5c5a144ac009d2d56df3b93ad/gr2.sml gr2 gr2.sml sml 7012 112 219 IMAGE-THUMBNAIL 1-s2.0-S2468823120304909-gr3.sml https://s3-eu-west-1.amazonaws.com/prod-ucs-content-store-eu-west/content/pii:S2468823120304909/gr3/THUMBNAIL/image/gif/300641a7fe9ae7de878e4fa854301baa/gr3.sml gr3 gr3.sml sml 7350 109 219 IMAGE-THUMBNAIL 1-s2.0-S2468823120304909-gr4.sml https://s3-eu-west-1.amazonaws.com/prod-ucs-content-store-eu-west/content/pii:S2468823120304909/gr4/THUMBNAIL/image/gif/bd800c0897de2e5ad9fac804325792d0/gr4.sml gr4 gr4.sml sml 13548 96 219 IMAGE-THUMBNAIL 1-s2.0-S2468823120304909-gr5.sml https://s3-eu-west-1.amazonaws.com/prod-ucs-content-store-eu-west/content/pii:S2468823120304909/gr5/THUMBNAIL/image/gif/e8494547f985240c5f47d7deec6211a0/gr5.sml gr5 gr5.sml sml 16667 94 219 IMAGE-THUMBNAIL 1-s2.0-S2468823120304909-gr6.sml https://s3-eu-west-1.amazonaws.com/prod-ucs-content-store-eu-west/content/pii:S2468823120304909/gr6/THUMBNAIL/image/gif/db13894997c7edddf38b0d6c6f93b8a7/gr6.sml gr6 gr6.sml sml 7917 144 219 IMAGE-THUMBNAIL 1-s2.0-S2468823120304909-gr7.sml https://s3-eu-west-1.amazonaws.com/prod-ucs-content-store-eu-west/content/pii:S2468823120304909/gr7/THUMBNAIL/image/gif/251e42fdb4658a2c4331056c5184ae58/gr7.sml gr7 gr7.sml sml 7418 164 163 IMAGE-THUMBNAIL 1-s2.0-S2468823120304909-gr8.sml https://s3-eu-west-1.amazonaws.com/prod-ucs-content-store-eu-west/content/pii:S2468823120304909/gr8/THUMBNAIL/image/gif/7cc9b34b3ab60e8f967580a54c806dfd/gr8.sml gr8 gr8.sml sml 6338 111 219 IMAGE-THUMBNAIL 1-s2.0-S2468823120304909-gr9.sml https://s3-eu-west-1.amazonaws.com/prod-ucs-content-store-eu-west/content/pii:S2468823120304909/gr9/THUMBNAIL/image/gif/fe86232e34db6e9cac40ba5fa48eaa35/gr9.sml gr9 gr9.sml sml 10681 120 219 IMAGE-THUMBNAIL 1-s2.0-S2468823120304909-ga1.sml https://s3-eu-west-1.amazonaws.com/prod-ucs-content-store-eu-west/content/pii:S2468823120304909/ga1/THUMBNAIL/image/gif/7721e74b745fc068153fb6914cef7b28/ga1.sml ga1 true ga1.sml sml 7801 76 219 IMAGE-THUMBNAIL 1-s2.0-S2468823120304909-gr12.sml https://s3-eu-west-1.amazonaws.com/prod-ucs-content-store-eu-west/content/pii:S2468823120304909/gr12/THUMBNAIL/image/gif/041b3826e8480db7b6c91faf31466325/gr12.sml gr12 gr12.sml sml 7542 137 219 IMAGE-THUMBNAIL 1-s2.0-S2468823120304909-gr11.sml https://s3-eu-west-1.amazonaws.com/prod-ucs-content-store-eu-west/content/pii:S2468823120304909/gr11/THUMBNAIL/image/gif/a66b75ba95c59581d9ec1b61de77fbca/gr11.sml gr11 gr11.sml sml 11297 164 216 IMAGE-THUMBNAIL 1-s2.0-S2468823120304909-gr10.sml https://s3-eu-west-1.amazonaws.com/prod-ucs-content-store-eu-west/content/pii:S2468823120304909/gr10/THUMBNAIL/image/gif/caeebc63a85ab5a442d1c31bebf782a0/gr10.sml gr10 gr10.sml sml 7910 116 219 IMAGE-THUMBNAIL 1-s2.0-S2468823120304909-mmc1.docx https://s3-eu-west-1.amazonaws.com/prod-ucs-content-store-eu-west/content/pii:S2468823120304909/mmc1/MAIN/application/vnd.openxmlformats-officedocument.wordprocessingml.document/105cc9635ed4bb185d0848092a739725/mmc1.docx mmc1 mmc1.docx docx 664736 APPLICATION 1-s2.0-S2468823120304909-si1.svg https://s3-eu-west-1.amazonaws.com/prod-ucs-content-store-eu-west/content/pii:S2468823120304909/STRIPIN/image/svg+xml/b6d35f32451dec47fa71bc920b14f21c/si1.svg si1 si1.svg svg 27368 ALTIMG 1-s2.0-S2468823120304909-si2.svg https://s3-eu-west-1.amazonaws.com/prod-ucs-content-store-eu-west/content/pii:S2468823120304909/STRIPIN/image/svg+xml/45df4c4821d26b84ddd7151015420c20/si2.svg si2 si2.svg svg 30391 ALTIMG 1-s2.0-S2468823120304909-am.pdf am am.pdf pdf 8626624 AAM-PDF https://s3-eu-west-1.amazonaws.com/prod-ucs-content-store-eu-west/content/egi:1083K4W4170/MAIN/application/pdf/9f0d6aa3707054ce66dd00b5bafba9c2/am.pdf MCAT 111227 111227 S2468-8231(20)30490-9 10.1016/j.mcat.2020.111227 Elsevier B.V. Fig. 1 X-ray diffraction patterns of Pd@MnOx microspheres obtained using MnOx microspheres calcined at (A) 410 °C and (B) 500 °C. Fig. 1 Fig. 2 The chemical route followed for the synthesis of monodisperse-porous Pd@MnOx microspheres. Fig. 2 Fig. 3 TEM photograph showing the size distribution of Pd NPs at (A) 50 nm scale and (B) 20 nm scale. (C) The variation of zeta potential of Pd NPs with pH. Fig. 3 Fig. 4 SEM photographs showing the size distribution and surface morphology of Pd@Mn5O8microspheres. Magnification: (A) X2.500, (B) X25.000, (C) X45.000, (D) X100.000. TEM-EDS mapping photographs of Pd@Mn5O8 microspheres showing (E) carbon, palladium, manganese and oxygen, (F) palladium, (G) mangenese, (H) oxygen. Fig. 4 Fig. 5 SEM photographs showing the size distribution and surface morphology of (A) Pd@SiO2 and (B) Pd@TiO2 microspheres. Magnification: (A-1) X2.500, (A-2) X25.000, (A-3) X38.000, (A-4) X100.000, (B-1) X2.500, (B-2) X25.000, (B-3) X45.000, (B-4) X100 .000. Fig. 5 Fig. 6 The pore size distribution curves of Pd@SiO2, Pd@TiO2 and Pd@MnOx microspheres obtained by nitrogen adsorption and desorption method. Fig. 6 Fig. 7 Survey XPS spectra of (A) MnO2, (B) Mn5O8, (C) APTES@Mn5O8, (D) Pd@Mn5O8 microspheres and (E) Core level spectrum for Pd3d scan of Pd@Mn5O8 microspheres. Fig. 7 Fig. 8 BzOH conversion, BzCHO selectivity and BzCHO formation yield obtained with Pd@SiO2, Pd@TiO2, plain Mn5O8 and Pd@MnOx microspheres as the catalyst in BzOH oxidation. Conditions: Initial BzOH concentration: 100 mM, TBHP concentration: 150 mM, Catalyst concentration: 8 mg/mL, Volume: 10 mL, Temperature: 80 °C, Time: 4 h, Stirring rate: 400 rpm. Fig. 8 Fig. 9 Core-level XPS spectra of Mn2p scan for (A) MnO2, (B) Mn5O8, (C) APTES@Mn5O8, (D) Pd@Mn5O8 microspheres. Fig. 9 Fig. 10 The mechanism proposed for the synergistic catalytic activity obtained with Pd@MnOx microspheres in BzOH oxidation. Fig. 10 Fig. 11 The effect of (A) initial BzOH concentration, (B) catalyst amount, (C) Pd NP loading, and (D) TBHP concentration on BzOH conversion, BzCHO selectivity and BzCHO formation yield obtained by Pd@Mn5O8 microspheres. Common conditions: TBHP concentration: 150 mM, Catalyst concentration: 8 mg/mL, Pd loading: 2.5 % w/w, Volume: 10 mL, Temperature: 80 °C, Time: 4 h, Stirring rate: 400 rpm. Except for the variable condition, the other conditions are identical with those given above unless otherwise stated in each case. Fig. 11 Fig. 12 BzOH conversion, BzCHO selectivity and BzCHO formation yield values obtained in the repeated use of Pd@Mn5O8 microspheres in BzOH oxidation. Conditions: Initial BzOH concentration: 100 mM, TBHP concentration: 150 mM, Catalyst concentration: 8 mg/mL, Volume: 10 mL, Temperature: 80 °C, Time: 6 h, Stirring rate: 400 rpm. Fig. 12 Table 1 The size and porous properties of Pd NPs immobilized metal oxide microspheres used as catalysts in the oxidation of BzOH. Table 1 Microspheres Mean size (μm) CV (%) Pore volume (cm3 g−1) Median pore size (nm) SSA (m2 g−1) Pd@MnO2 3.8 6.8 0.04 36.9 6.1 Pd@Mn5O8 3.9 5.9 0.22 40.6 31.7 Pd@TiO2 3.7 6.5 0.41 40.3 93.0 Pd@SiO2 5.0 5.9 0.66 23.3 115.5 Table 2 Surface atomic compositions determined by survey XPS spectra and the analysis of core level spectra for Mn2p scan with MnO2, Mn5O8, APTES@Mn5O8 and Pd@Mn5O8 microspheres. Table 2 Sample Surface percentages (%) Mn 2p (Total) Mn 2p (Mn(II)) Mn 2p (Mn(III)) Mn 2p (Mn(IV)) O 1s C 1s N 1s Si 2p Pd 3d MnO2 26.09 1.90 20.69 3.50 52.22 21.68 Mn5O8 26.80 2.92 19.89 3.99 50.24 22.96 APTES@Mn5O8 20.02 2.44 15.08 2.50 42.75 32.12 2.48 2.63 Pd@Mn5O8 19.33 3.03 14.38 1.91 49.05 27.00 – 1.33 3.30 Table 3 TON and TOF values obtained with Pd NPs immobilized-monodisperse-porous metal oxide microspheres. Table 3 Microspheres TON TOF(h−1) Pd@Mn5O8 77.2 19.3 (49.1) Pd@MnO2 71.1 17.8 (35.8) Pd@TiO2 40.5 10.1 (36.9) Pd@SiO2 14.4 3.6 (5.1) TOF and TOF values were calculated at a reaction period of 4 h. TOF values at a reaction period of 1 h were also given in the paranthesis. Table 4 TON and TOF values obtained with Pd@Mn5O8 microspheres under different oxidation conditions. Table 4 TON (mol BzOH/mol Pd) TOF (h−1) BzOH concentration (mM) 50 41.1 10.3 (24.1) 100 77.2 19.3 (49.1) 200 116.7 29.2 (36.6) Catalyst weight (mg) 40 132.8 33.2 (64.8) 80 77.2 19.3 (49.1) 160 41.6 10.4 (34.4) Pd NPs loading (% w/w) 1.25 103.4 25.9 (76.6) 2.50 77.2 19.3 (49.1) 5.0 63.8 16.0 (23.2) TBHP concentration (mM) 75 81.1 20.3 (34.8) 150 77.2 19.3 (49.1) 300 78.1 19.5 (34.1) TOF and TOF values were calculated at a reaction period of 4 h. TOF values at a reaction period of 1 h were also given in the paranthesis. Table 5 BzOH conversions, BzCHO selectivities and BzCHO formation yields obtained with different heterogeneous catalysts. Table 5 Catalyst/Conditions Reaction time (h) Overall conversion (%) Selectivity for BzCHO (%) BzCHO formation yield (%) Ref. Ce prompoted MnOx 2 90 90 81 [15] 10 mM BzOH, 450 mg catalyst O2 flow(60 mL/min), 70 °C MnO2 NPs@GO 2 83 100 83 [16] 100 mM BzOH, 200 mg catalyst air flow (200 mL/min), 110 °C Pd/2.5MnOx/CNT 1 15 100 15 [17] 50 mM BzOH, 5 mg catalyst, O2 flow(20 mL/min), 160 °C Au/MnO2 2 6 100 6 [20] 2 g BzOH, 20 mg catalyst, O2 1 barg, 120 °C Pd/NRGO 3 72.2 94.5 68 [21] BzOH/metal = 5100 O2 flow rate: 20 mL min−1 Au-CeO2/CNTDP 3 77.9 99 77 [22] 50 mM BzOH, 10 mg catalyst air flow (40 mL/min), 40 °C Rh/RAC1 24 52 58 30 [23] 200 mM BzOH, 200 mg catalyst,100 °C Au/MnO2 28 – – – [24] 3 g BzOH, 65 mg catalyst, 75 °C Au-Pd/Ti-NTGO 1 70 82.6 58 [25] 2.5 g BzOH, 18 mg catalyst 4 bar with O2, 120 °C Au@mTiO2 4 8.5 94 8 [26] 260 mM BzOH, 10 mg catalyst, O2 flow rate: 100 mL min−1 Visible light irradiation, 25 °C Au-Pd/CeO2 3 78 88 69 [27] 15 mL BzOH, 50 mg catalyst 0.3 MPa O2, 120 °C Au–Pd/Ce-NR 2 75 85 64 [28] BzOH/metal = 5100 2 bar O2, 120 °C 0.8AuPdCZO250 2 92 95 87 [29] BzOH/metal = 3000 200 kPa O2, 80 °C Pd–PdO@rGO 2 70 90 63 [30] 0.1 mol BzOH, 20 mg catalyst 1 atm O2, 70 °C 1 Pt/20CeO2-ZSM5(Si/Al = 100)-HIE 24 98 76 73 [31] 50 mM BzOH, 80 mg catalyst 1 atm O2, 80 °C MWCNTs/TiO2, CH3CN, 0.25 – – 100 [33]. 1 mmol BzOH, 30 mg catalyst, Ultrasonic: 40 kHz, 250 W Fe3O4@SiO2@PPh3@Cr2O7 0.33 100 – – [34] 5 mmol BzOH, 50 mg catalyst H2O2 (30 %, 0.6 mL), room temperature, ultrasonic irradiation FSTNPd nanocomposite 0.75 99 99 – [35] 1 mmol BzOH, 50 mg catalyst, O2 (1 atm) flow UV irradiation (365 nm light, 200 W Hg lamp) at 80 °C perlite/V2O5 NC structure 0.08 – – 90 [36] 1 mmol BzOH and 20.0 mg catalyst 1 mmol H2O2, Refluxed at 82 °C Fe3O4@raffinose-Cu2O NPs 4 94 99 – [37] 1 mmol BzOH, 6 mg catalyst, 1 mmolTBHP under refluxing conditions Au-Pd/TiO2 3 65 75 49 [53] 15 mL BzOH, 50 mg catalyst, 0.3 MPa with O2,120 °C Co3O4/MnO2 12 93 99 92 [69] 100 Mm BzOH, 25 mg catalyst O2 flow(20 mL/min), 100 °C Pd/SiO2‐btm 24 98 98 96 [70] 100 mM BzOH, 60 °C Pd@Mn5O8 2 85 98 83 This work 80 mg catalyst work 100 mM BzOH, 80 °C 4 92 96 89 This work 8 95 92 87 This work A synergistic catalyst based on a multivalence monodisperse-porous microspheres with oxygen vacancies for benzyl alcohol oxidation Rukiye Babacan Tosun Visualization Formal analysis a 1 Kadriye Özlem Hamaloğlu Visualization Formal analysis Investigation Methodology Writing - review & editing b 1 Pınar Akkaş Kavaklı Formal analysis c Cengiz Kavaklı Formal analysis c Ali Tuncel Conceptualization Supervision Methodology Writing - review & editing a b * a Hacettepe University, Division of Nanotechnology and Nanomedicine, Ankara, Turkey Hacettepe University Division of Nanotechnology and Nanomedicine Ankara Turkey Hacettepe University, Division of Nanotechnology and Nanomedicine, Ankara, Turkey b Hacettepe University, Chemical Engineering Department, Ankara, 06800, Turkey Hacettepe University Chemical Engineering Department Ankara 06800 Turkey Hacettepe University, Chemical Engineering Department, Ankara, 06800, Turkey c Hacettepe University, Chemistry Department, Ankara, 06800, Turkey Hacettepe University Chemistry Department Ankara 06800 Turkey Hacettepe University, Chemistry Department, Ankara, 06800, Turkey ⁎ Corresponding author at: Hacettepe University, Chemical Engineering Department, Ankara, Turkey. Hacettepe University Chemical Engineering Department Ankara Turkey 1 These authors have equally contributed to the article. Graphical abstract A heterogeneous catalyst for selective oxidation of benzyl alcohol (BzOH) was synthesized by immobilization of Pd nanoparticles (Pd NPs, 3 nm) on monodisperse-porous manganese oxide (MnOx, 4 μm) microspheres obtained by “staged shape templating protocol”. MnOx microspheres containing Mn5O8 (97 %) and MnO2 (78 %) phases were evaluated as supports. The catalysts carrying immobilized Pd NPs were also synthesized, using monodisperse-porous SiO2 and TiO2 microspheres with similar size and porous properties (i.e. Pd@SiO2 and Pd@TiO2). Pd NP decorated-Mn5O8 (Pd@Mn5O8) microspheres provided the highest catalytic activity with BzOH conversion of 92.2 % and benzaldehyde (BzCHO) selectivity of 96.3 %. Higher catalytic activity of Pd@Mn5O8 was explained by mixed valence nature of Mn5O8 microspheres assisting the formation of abundant oxygen vacancies. Mn (II), Mn(III) and Mn(IV) oxidation states were shown by deconvoluted x-ray photoelectron spectra. A synergistic catalytic activity was reported for the first time, by combination of Pd NPs with Mn5O8 microspheres. Pd@Mn5O8 microspheres could be reused up to 5 times without remarkable loss in the activity and selectivity towards BzCHO. A methodology for comparison of catalytic activity and synergistic interaction between active site and support was also exemplified by choosing a nanoparticle type and a monodisperse-porous microsphere type. Keywords Manganese oxide Silica Titania Porous microspheres Oxygen spillover 1 Introduction There is a great effort to carry out oxidation of benzyl alcohol (BzOH) in the aqueous phase by using molecular oxygen [1], hydrogen peroxide [2] or t-butyl hydroperoxide (TBHP) [3] as the oxidant [4,5]. Noble metal nanoparticles (NPs) such as Pt, Pd, Au were used as efficient catalysts due to the quantum size effect and high ratio of surface area to volume in alcohol oxidation reactions [6,7]. Among these noble metal catalysts, Pd shows relatively high activity and selectivity in BzOH oxidation [8–10]. However, the reusability of noble metal nanoparticles is not possible due to their low stability and low catalytic activity because of aggregation [10,11]. Therefore to overcome such problems, the metal nanoparticles are immobilized on various transition metal oxide based supports such as cerium dioxide [10,12], aluminum oxide [8,13], and titanium dioxide [14]. On the other hand, manganese oxide (MnOx) nanostructures immobilized on different supports and MnOx based supports have been used due to their unique properties such as high activity, low cost and nontoxicity in alcohol oxidation with high catalytic activity and selectivity [15–21]. Tan et al. synthesized Pd NP supported manganese oxide–carbon nanotube hybrid nanomaterials (MnOx-CNT) by facile depositing method and examined the catalytic activity of nanocatalyst by the oxidation of BzOH using molecular oxygen [17]. Assal et al. established a method for the synthesis of MnO2 nanocomposites decorated with Ag NPs and used them in the oxidation of alcohols in the presence of oxygen [18]. Alshammari et al. synthesized Au-Pd supported MnO2 nanoalloy catalysts and investigated their catalytic activity by the oxidation of BzOH [19]. Hutchings et al. hydrothermally synthesized MnO2 microspheres containing nanowires and used as supports for immobilization of Au NPs. Furthermore, they investigated the catalytic activity of MnO2 nanowire microspheres decorated with Au NPs for the solvent-free oxidation of BzOH [20]. Chen et al. synthesized MnOx/Pd catalysts by atomic layer deposition of MnOx on Pd/Al2O3 catalysts formed by wet impregnation and used MnOx/Pd catalysts in the benzyl alcohol oxidation [21]. In recent years, heterogenous catalysts containing metal nanoparticles immobilized on various supports like graphene [22], carbon [23,24], SiO2 [25], TiO2 [26,27], CeO2 [28] and others [29–32] have been tried in BzOH oxidation since it is known that the interaction between the support material and metal NPs determines the catalytic activity. In the literature, some similar hybrid nanostructures containing metal nanoparticles have also been synthesized and used as oxidation catalysts in selective oxidation of benzyl alcohol [33–37] and organic molecule synthesis [38–43]. Recently, a staged shape templating protocol based on the hydrothermal decomposition of KMnO4 on polymethacrylate microspheres was developed for the synthesis of monodisperse-porous MnOx microspheres [44]. The crystalline properties of synthesized microspheres were changed by adjusting the calcination temperature. In this study, the catalysts for selective oxidation of BzOH to BzCHO under atmospheric pressure were synthesized by the immobilization of Pd NPs onto MnOx microspheres containing predominantly MnO2 or Mn5O8 phases. Similar catalysts were also obtained by the immobilization of Pd NPs onto monodisperse-porous SiO2 and TiO2 microspheres with similar size and porous properties. The catalytic performances of MnOx based catalysts were comparatively investigated using SiO2 and TiO2 microsphere based catalysts as the references. 2 Experimental 2.1 Synthesis of monodisperse-porous MnOx microspheres Poly(methacrylic acid-co-ethylene dimethacrylate), poly(MAA-co-EDMA) microspheres 5.3 μm in size were obtained by multi-step microsuspension polymerization using poly(glycidyl methacrylate) latex as the seed 1.8 μm in size [44]. The monodisperse-porous MnOx microspheres were synthesized by “staged shape templating protocol” using poly(MAA-co-EDMA) microspheres as the template [44]. The detailed synthesis protocol was given in the previous study [44]. Briefly, poly(MAA-co-EDMA) microspheres (4 mg mL−1) were dispersed in distilled-dionized water (DDI, 25 mL) and pH was adjusted to 8.0 with 0.5 M NH4OH. KMnO4 was added into the aqueous dispersion at a final concentration of 20 mg mL−1 and the final pH was checked. The mixture was stirred at 350 rpm for 24 h at room temperature for the adsorption of MnOx nanoparticles onto the poly(MAA-co-EDMA) microspheres. HNO3 solution (3.5 mL 20 % w/w) was added dropwise to the aqueous dispersion within 1 min and the final dispersion was stirred for 24 h. The composite microspheres were washed several times with 1 % w/w aqueous sodium dodecyl sulphate (SDS) solution and DDI water to remove sub-micron MnOx particles from the aqueous dispersion containing MnOx/polymethacrylate microspheres ca. 4.0 μm in size. The microspheres were isolated by centrifugation at 4000 rpm for 5 min and dried at 85 °C under vacuum for 24 h. To obtain monodisperse-porous MnOx microspheres, the polymethacrylate template was removed by the calcination of composite microspheres at 410 or 500 °C for 4 h, under air atmosphere, with a heating rate of 1 °C min-1. 2.2 Synthesis of monodisperse-porous SiO2 and TiO2 microspheres SiO2 and TiO2 microspheres in the monodisperse-porous form were also synthesized via corresponding staged shape templating sol-gel protocols by starting with poly(MAA-co-EDMA) and poly(3-chloro-2-hydroxypropyl methacrylate-co-ethylene dimethacrylate) (poly(HPMA-Cl-co-EDMA) microspheres 5.3 μm and 5.4 μm, respectively, in size as the templates. These protocols were described in our previous publications in detail [45–48]. These protocols were given briefly in Sections 2.1 and 2.2 of the Supporting Information. 2.3 Derivatization of monodisperse-porous MnOx microspheres Prior to decoration with Pd NPs, monodisperse-porous MnOx microspheres were derivatized with amino groups. For this purpose, dry MnOx microspheres were dispersed in a solution containing isopropanol (Iso-PrOH, 10 mL), 3-aminopropyltriethoxysilane (APTES, 1 mL) and triethylamine (TEA, 0.15 mL) by vortexing in a sealed glass reactor. The reactor was placed in a shaking water bath at 80 °C for 24 h. Amino functionalized-MnOx microspheres were extensively washed with Iso-PrOH and DDI water for several times. The same protocol was also applied for monodisperse-porous SiO2 and TiO2 microspheres for obtaining Pd@SiO2 and Pd@TiO2 catalysts. 2.4 Decoration of Pd NPs onto amino functionalized-MnOx microspheres For attachment of Pd NPs onto amino functionalized-MnOx microspheres, Pd NPs were synthesized according to the method given in the literature [29]. PVA solution (10 mg mL−1, 0.3 mL) was added to Pd(NO3)2·2H2O solution (3 mg in 10 mL) and the mixture was stirred at room temperature for 15 min. Then, freshly prepared 0.1 M NaBH4 solution (1.2 mL) was added rapidly to the above solution and the stirring was continued for 1 h at room temperature. Amino functionalized-MnOx microspheres (0.1 g) were added into the previous mixture and pH was adjusted to 3.0 with H2SO4, and the mixture was stirred for another 1 h. Pd NPs decorated monodisperse-porous MnOx microspheres (Pd@MnOx) were washed with DDI water for 3 times by centrifugation-decantation. The same protocol was also followed for the attachment of Pd NPs onto amino functionalized forms of monodisperse-porous SiO2 and TiO2 microspheres. 2.5 Benzyl alcohol oxidation The catalytic activity of Pd NPs decorated monodisperse-porous manganese oxide microspheres (Pd@MnOx) were investigated by oxidation of BzOH. In these runs, Pd@SiO2 and Pd@TiO2 catalysts were also used. Typically, the catalyst (Pd@MnOx microspheres or other catalysts, 80 mg) was dispersed in diethyleneglycol dimethylether (DEGDME, 10 mL) containing BzOH (0.1 mL) and TBHP (0.15 mL) in a two-necked flask (50 mL). The flask was immersed in an oil bath and heated to 80 °C under magnetic stirring for a certain period. A small volume of sample (100 μL) was withdrawn from flask at appropriate intervals and analyzed using a High-Pressure Liquid Chromatography (HPLC, Shimadzu, Japan) equipped with UV detector (SPD-10AV, Shimadzu, Japan) and a Phenomenex SphereClone 5 μm Silica (250 × 4.60 mm 5 μm) column. BzOH conversion and BzCHO selectivity were calculated as follows: (1) BzOH conversion % = C o − C B z O H C o × 100 (2) BzCHO selectivity % = C B z H C o − C B z O H × 100 C0 is the initial concentration of BzOH. CBzOH and CBzCHO are the concentrations of BzOH and BzCHO at a certain reaction time, respectively. The turnover number (TON) and turnover frequency (TOF) of catalysts were calculated according to the procedure given in Section 4 of the Supporting Information. 3 Results and discussion 3.1 Characterization of catalysts In our previous work, it was demonstrated that the crystal structure of MnOx microspheres produced by “staged shape templating protocol” had different chemical compositions depending on calcination temperature [44]. By considering this property, two different MnOx based catalysts were prepared, using MnOx microspheres calcined at 410 and 500 °C as the support. X-ray diffraction spectra (XRD) of Pd@MnOx microspheres synthesized using plain MnOx microspheres calcined at 410 °C and 500 °C are given in Fig. 1 . Pd@MnOx microspheres synthesized using MnOx calcined at 410 °C contained monoclinic Mn5O8 (97 %) and Mn98O2 (3 %) phases (space group 12: C12/m1, unique-b, cell-1, JCPDS Card No. 39-1218) (Fig. 1A). On the other hand, tetragonal α-MnO2 (71 %) and Mn2O3 (bixbyite, 29 %) phases were observed in the other catalyst obtained using MnOx calcined at 500 °C (space group I4/m, JCPDS data file 00-044-0141) (Fig. 1B) [44]. By considering the predominant crystalline phase in the support, the catalysts prepared with MnOx microspheres calcined at 410 and 500 °C were named as Pd@Mn5O8 and Pd@MnO2 microspheres, respectively. XRD data of the used Pd@Mn5O8 microspheres after BzOH oxidation is also included in Fig. 1C for comparison. XRD pattern of the used catalyst showed that no significant change occurred in the crystalline structure after oxidation reaction. This finding might be evaluated as an indication for the stability of Pd@Mn5O8 catalyst in BzOH oxidation reaction. The chemical route followed for the synthesis of monodisperse-porous Pd@MnOx microspheres is given in Fig. 2 . The surface hydroxyl groups of monodisperse-porous MnOx microspheres coming from manganese hydroxide residues were reacted with APTES in Iso-PrOH using TEA as the catalyst. Pd NPs were obtained by the reaction of Pd(NO3)2·2H2O with NaBH4 in the existence of PVA as the stabilizer. The TEM photograph of free Pd NPs obtained in the absence of MnOx microspheres, given in Fig. 3 showed that Pd NPs were obtained in the range of 2−4 nm, with an average size of 2.6 nm, by the applied synthetic protocol. The variation of zeta potential of Pd NPs with pH is also given in Fig. 3. The minimum negative charge on Pd NPs was obtained at pH 3.0. The attachment of Pd NPs onto Mn5O8 microspheres functionalized with amino groups was investigated by changing the pH of attachment medium between 3–7 and the highest catalytic activity in BzOH oxidation was obtained with Pd@Mn5O8 microspheres obtained at pH 3.0. For this reason, the attachment of Pd NPs onto amino functionalized-MnOx (i.e. MnO2 or Mn5O8) microspheres was performed at pH 3.0. Note that, Pd@SiO2 and Pd@TiO2 microspheres were also obtained by the same route given in Fig. 2, using amino functionalized forms of corresponding metal oxide microspheres. The SEM photographs showing size distribution and surface morphology of Pd@Mn5O8 microspheres and TEM-EDS mapping photographs showing the composition of Pd@Mn5O8 microspheres are exemplified in Fig. 4 . As seen in Fig. 4A, the particles were obtained in spherical and almost monodisperse form. The mean size and the coefficient of variation (CV) for size distribution were calculated as 3.85 μm and 5.87 %, respectively, based on the SEM photo given in Fig. 4A (Table 1 ). A rough surface was observed on the microspheres likely due to their porous structure (Fig. 4B–D). The mean size and CV values of MnO2 microspheres obtained with the calcination at 500 °C are also given in Table 1. Palladium (purple), manganese (green), oxygen (blue) and carbon (red) can be clearly seen in TEM-EDS photograph of Pd@Mn5O8 microsphere in Fig. 4E. Also as seen Fig. 4F, Pd NPs were homogeneously distributed on Mn5O8 microspheres. The TEM-EDS photographs showing manganese (green) and oxygen (blue) are also given in Fig. 4G and H, respectively. The SEM photographs of Pd@SiO2 and Pd@TiO2 microspheres obtained by the same synthesis route are given in Fig. 5 . These microspheres were also obtained in the monodisperse form, with the surface morphologies similar to Pd@MnOx microspheres. As seen in Table 1, the mean size and the CV values obtained for Pd@SiO2 and Pd@TiO2 microspheres are close to those of Pd@MnOx microspheres. The pore-size distribution curves of Pd@MnOx, Pd@SiO2 and Pd@TiO2 microspheres obtained by nitrogen adsorption-desorption method are given in Fig. 6 . The pore-size distributions of all catalysts are in the range of 3−140 nm. The porous characteristics of Pd@MnOx, Pd@SiO2 and Pd@TiO2 microspheres are presented in Table 1. Pd@SiO2 and Pd@TiO2 microspheres had relatively higher specific surface area and higher pore volume with respect to MnOx based catalysts. Nitrogen physisorption isotherms of all catalysts are given in Fig. S1 of the Supporting Information. All isotherms exhibited a hysteresis loop with type IV isotherm behavior showing the presence of dominantly mesoporous structure for all catalysts. However, all catalysts also included macroporous volume as shown in their pore-size distributions (Fig. 6). The highest surface area was obtained with Pd@SiO2 catalysts with the lowest mean pore size and the highest pore volume. The mean pore size values of MnO2, Mn5O8 and TiO2 based catalysts were close to 40 nm (Table 1). The lower surface areas of MnO2 and Mn5O8 based catalysts can be explained by their lower pore volumes (i.e. lower porosities) with respect to TiO2 based catalyst (Table 1). Pd atom contents of Pd@SiO2, Pd@TiO2, and Pd@Mn5O8 microspheres were determined as 2.5, 2.5 and 1.6 % w/w respectively, by ICP-MS. Hence, all catalysts synthesized using different metal oxide microspheres had close Pd NP contents. Also the Pd atom content of Pd@Mn5O8 microspheres after the oxidation reaction was determined as 1.65 %. This means that Pd content of Pd@Mn5O8 microspheres did not change after the catalytic reaction. The results obtained from the characterization part indicated that Pd@SiO2 and Pd@TiO2 microspheres could be used for comparison to evaluate the catalytic performance of Pd@MnOx microspheres in oxidation of BzOH due to their similar size and porous properties and close Pd NP contents. The survey XPS spectra of MnO2, Mn5O8, APTES attached Mn5O8 (APTES@Mn5O8) and Pd@Mn5O8 microspheres are given in Fig. 7 . Mn2p, O1s and C1s peaks were obtained at 642, 529 and 284.5 eV, respectively, in the survey XPS spectra of MnO2 and Mn5O8 microspheres given in Fig. 7A and B, respectively. The surface atomic compositions of MnO2, Mn5O8, APTES@Mn5O8 and Pd@Mn5O8 microspheres determined by XPS analysis are presented in Table 2 . Si2p and N1s peaks were observed at the binding energies of 101 and 401 eV, respectively, in the survey XPS spectrum of APTES@Mn5O8 microspheres due to the bound APTES (Fig. 7C). In addition to these peaks, a clear Pd3d peak at 337.1 eV was obtained for Pd NPs on the surface of Pd@Mn5O8 microspheres (Fig. 7D). The presence of APTES on the surface was more clearly shown in the core level spectrum of N1s scan for APTES@Mn5O8 microspheres (Fig. S2A of the Supporting Information). A N1s peak with lower intensity was also obtained in the corresponding core-level spectrum of Pd@Mn5O8 microspheres (Fig. S2B of the Supporting Information). Based on the survey XPS spectrum of APTES@Mn5O8 microspheres, the surface N and Si atom contents were determined as 2.48 and 2.63 %, respectively (Table 2). The characteristic peaks at 337.1 and 342.4 eV were obtained in the core level, Pd3d scan with Pd@Mn5O8 microspheres (Fig. 7E). Pd atom content of Pd@Mn5O8 microspheres was determined as 3.30 % according to the survey XPS spectra given in Fig. 7. Metallic Pd usually provides a peak at the binding energy of 335.4 eV [49]. Small shifts up to 0.9 eV may occur in the binding energy of metallic Pd by the variation of its electronegativity due to the binding onto a metal oxide support [49]. However in our case, the main peak belonging to Pd was observed at 337 eV. The relatively higher shift may be attributted to the partial oxidation of Pd NPs bound onto Mn5O8 based support (Table 2). The deconvoluted peak at 337.15 cm−1 in the core-level spectrum of Pd3d scan can be evaluated as another evidence showing the partial oxidation of Pd NPs on Mn5O8 microspheres (Fig. 7E). The core level spectra for O1s scan of MnO2, Mn5O8, APTES@Mn5O8 and Pd@Mn5O8 microspheres are given in Fig. S3 of the Supporting Information. Sharp O1s peaks at 529.5 eV belonging to lattice oxygen were obtained in the O1s spectra of MnO2 and Mn5O8 microspheres (Fig. S3A and S3B). An apparent deconvoluted peak was observed at 531.6 eV near the sharp peak belonging to lattice oxygen in the O1s spectrum of APTES@Mn5O8 microspheres due to surface bound oxygen atoms coming from APTES (Fig. S3C). The same peak was stronger in the O1s spectrum of Pd@Mn5O8 microspheres due to additional contribution coming from the oxygen atoms found in the partially oxidized Pd NPs attached onto the surface (Fig. S3D). The small deconvoluted peak at 533.5 eV [i.e. O(III)] was associated with adsorbed water [50]. FTIR-ATR spectra of Mn5O8, APTES@Mn5O8 and Pd@Mn5O8 microspheres are given in Fig. S4 of the Supporting Information. The strong band at 3680 cm−1 in the FTIR-ATR spectrum of Mn5O8 microspheres was assigned to OH stretching originated from manganese hydroxide residues (Fig. S4A). The presence of APTES on Mn5O8 microspheres was confirmed by the bands at at 3300, 1580, 1380 and 1020 cm−1 assigned to NH stretching, NH bending, CH bending and CN stretching, respectively (Fig. S4B). The relative intentities of these bands considerably decreased by the attachment of Pd NPs onto the surface of Mn5O8 microspheres (Fig. S4C). The thermal stability and the phase transformation of Pd@Mn5O8 microspheres were investigated in the temperature range of 0−800 °C with a ramp of 10 °C /min. Thermogravimetric analysis (TGA) curve is given in Fig. S5 of the Supporting Information. The first weight-loss which can be attributed to the release of bound water molecules was observed up to 300 °C [51]. The weight-loss after 600 °C was due to the reduction of Mn5O8 to Mn3O4 by releasing oxygen. This means that Mn5O8 structure is stable up to 600 °C [52]. The exposed surface area of active sites and active particle diameter was measured by carbon monoxide (CO) chemisorption analysis as 105.4 m²/g metal and 4.7 nm, respectively. CO chemisorption analyses were performed for both plain Mn5O8 and Pd@Mn5O8 microspheres. The comparison of mean size values of free and immobilized Pd NPs demonstrated that no significant aggregation for Pd NPs occurred on Mn5O8 microspheres during immobilization (i.e. 2.6 nm, Fig. 3). Helium-temperature programmed desorption (He-TPD) profiles were obtained to analyze the desorption of CO from the surfaces of the tried catalysts (Fig. S6 of the Supporting Information). It is clear that the desorption peak positions and the TCD signal intensity obtained on Mn5O8 microspheres are significantly lower than on Pd@Mn5O8 microspheres, showing that most probably CO was physisorbed on Mn5O8 microspheres, while it was chemisorbed on Pd@Mn5O8 microspheres, as expected. The strong desorption peak at 296 °C in Fig. S6B could not be observed for Mn5O8 microspheres in Fig. S6A, which was most probably associated with the desorption of chemisorbed CO from Pd@Mn5O8 microspheres. 3.2 Catalytic performance of Pd@MnOx microspheres in BzOH oxidation The conversion of BzOH, the selectivity and the formation yield of BzCHO obtained with Pd@SiO2, Pd@TiO2 and Pd@MnOx microspheres are comparatively given in Fig. 8 . In these runs, Pd NPs immobilized forms of monodisperse-porous SiO2 and TiO2 microspheres calcined at 410 °C were used for comparison. BzOH conversions lower than 15 % were obtained when plain Mn5O8 and plain MnO2 microspheres were used as the catalyst. Considerably higher BzOH conversions and BzCHO formation yields were obtained with Pd@MnO2 and Pd@Mn5O8 microspheres (i.e. MnOx based catalysts) with respect to those of Pd@SiO2 and Pd@TiO2 microspheres (Fig. 8). Here, it should be noted that the surface areas and the pore volumes of Pd@SiO2 and Pd@TiO2 microspheres were considerably higher with respect to MnOx based catalysts (Table 1). On the other hand, overall BzOH conversion and BzCHO formation yield obtained with Pd@Mn5O8 microspheres were higher with respect to those of Pd@MnO2 microspheres. To sum up, the highest catalytic activity was obtained with Pd@Mn5O8 microspheres although its surface area and pore volume were considerably lower among the tried catalysts (Table 1 and Fig. 8). Based on these results, it is hypothesized that the interaction between microspheres as support and nanoparticles as catalytic active center should remarkably influence the resulting catalytic activity, in addition to the morphological properties of microspheres. The synergistic interaction between catalytic active center and support is likely the reason of higher catalytic activity particularly when reducible metal oxides such as MnOx and TiO2 with higher oxygen spillover capability, creating more reactive sites that are rich in oxygen are used as the support [29,53]. On the other hand, the higher synergistic catalytic activity obtained with MnOx based catalysts with respect to TiO2 based one may be related to the difference between the crystalline structures of MnOx and TiO2 microspheres [54,55]. The higher BzCHO formation yield obtained with Pd@TiO2 with respect to Pd@SiO2 may be also explained by the formation of a synergistic effect between Pd NPs and TiO2 microspheres. Although SiO2 microspheres have a large (i.e. the highest) surface area that may also reduce the risk of agglomeration of immobilized Pd NPs on the microspheres, the lowest BZCHO formation yield is obtained with Pd@SiO2 likely due to no synergistic effect occurs between Pd NPs and amorphous SiO2 microspheres. In order to demonstrate the mixed valence nature of MnOx based catalysts, the core level spectra for Mn2p scan of MnO2, Mn5O8, APTES@ Mn5O8 and Pd@Mn5O8 microspheres are comparatively given in Fig. 9 . The surface percentages of Mn(II), Mn(III) and Mn(IV) determined by deconvoluted core-level spectra for Mn2p scan with MnO2, Mn5O8, APTES@Mn5O8 and Pd@Mn5O8 microspheres are given in Table 2. The analysis of XPS spectra clearly showed the presence of multiple oxidation states of manganese on both Mn5O8 and MnO2 microspheres, capable of generating oxidative oxygen species in the presence of O2. The oxygen vacancies on MnOx microspheres potentially create a suitable platform for obtaining a synergistic interaction between the support and the active center for the activity of synthesized catalyst in BzOH oxidation [50]. The transfer of oxidative oxygen species from MnOx (i.e. support) to Pd NPs (i.e. active center) increases the catalytic activity. The sum of Mn(II) and Mn(III) percentages was determined as 22.59 and 22.81 for MnO2 and Mn5O8 microspheres, respectively. Hence, higher catalytic activities observed with Pd@MnO2 and Pd@Mn5O8 microspheres with respect to Pd@TiO2 and Pd@SiO2 can be explained by the mixed valence nature of MnOx based supports suitable for the formation of abundant oxygen vacancies ( Fig. 8 ). On the other hand, the total intensity of the deconvoluted peaks at 641.2 and 652.9 eV belonging to Mn(II), located under the Mn2p3/2 and Mn2p1/2 peaks in the core-level Mn2p spectrum of MnO2 microspheres was slightly lower with respect to that obtained in the core level spectra for Mn2p scan of Mn5O8 based microspheres (Fig. 9A and B). For this reason, the Mn(II) percentages were determined as 1.90 and 2.92 for MnO2 and Mn5O8 microspheres, respectively (Table 2). Depending upon this property, a higher Mn(II) percentage was also obtained for Pd@Mn5O8 microspheres (Table 2). Hence, the higher catalytic activity of Pd@Mn5O8 with respect to Pd@MnO2 can be explained by the stronger synergistic interaction between Mn5O8 based support and Pd NPs due to the higher Mn(II) content of Mn5O8 microspheres which is more prone to creating oxygen vacancies on the support. On the other hand, the higher surface area and pore volume of Pd@Mn5O8 with respect to those of Pd@MnO2 should be also evaluated as another factor positively contributing to the higher catalytic activity of Pd@Mn5O8 (Table 1). Based on the above discussion, the catalytic activity based on the synergistic effect between active center and support can be ordered with respect to the catalyst type as Pd@Mn5O8>Pd@MnO2>Pd@TiO2, by considering the BzCHO formation yields in Fig. 8. Mesoporous transition metal oxides have been used in a wide range of oxidation reactions due to multiple oxidation states which are very important in electron transfer during redox catalytic reactions [56,57]. Among the transition metal oxides, manganese oxides deserve a special interest due to its easily replaceable multiple oxidation states, thermal stability, and dioxygen reduction ability [58]. The mobility of lattice oxygen make the manganese oxide materials effective catalysts in oxidation reactions [59]. The schematic representation of the mechanism proposed for the synergistic catalytic activity obtained with Pd@MnOx microspheres in BzOH oxidation is given in Fig. 10 . Mn5O8 based catalysts are the promising ones for oxidation reactions due to the mixed valence nature of Mn5O8 [60]. Moreover, the interlayer and/or intralayer defects of Mn5O8 crystalline structure may facilitate the ion transport between support and active center [60–63]. Hence, the strongest synergistic effect between Pd NPs and MnOx microspheres is potentially expected in the presence of Mn5O8. Moreover, the immobilization of Pd NPs on Mn5O8 microspheres probably assists the formation of abundant oxygen vacancies and increases the mobility of surface lattice oxygen in the BzOH oxidation. In the proposed mechanism, BzOH is adsorbed onto Pd NPs and converted to metal–alkoxide intermediate. BzCHO is formed from this intermediate and palladium hyride is formed. Hence, Pd NPs are covered by hydrogens. Oxidative oxygen species are formed by the conversion of oxygen adsorbed onto the oxygen vacancies. This formation is induced by the transformation of Mn(II) and Mn(III) to Mn(IV) in the structure of Mn5O8. Finally, the oxidative oxygen species are reacted with palladium hydride to regenerate Pd NPs. The variation of overall BzOH conversion and BzCHO formation yield with the time in the presence of Pd@MnOx, Pd@TiO2 and Pd@SiO2 microspheres is exemplified in Fig. S7A and S7B of the Supporting Information, respectively. As seen in both figures, the plateau values for BzOH conversion and BzCHO formation yield were obtained within ca. 2 h using MnOx and TiO2 based catalysts. The lowest BzOH consumption rate and the lowest BzCHO formation rate with respect to the others were obtained by using Pd@SiO2 microspheres having the highest surface area among the tried catalysts. The highest turnover number (TON) and turnover frequency (TOF) values were obtained with Pd@Mn5O8 catalyst for the reaction period of 4 h (Table 3 ). On the other hand, TOF values were also included for 1 h to have an idea about the kinetic behaviour. According to the commonly accepted mechanism of BzOH oxidation, different pathways leading to formation of different products are observed [64–67]. In two of them, BzCHO is obtained by the dehydrogenation and disproportionation via alkoxy compounds and hydrogenolysis of BzOH [67]. By considering this mechanism, the effects of oxidation conditions on overall BzOH conversion and the selectivity and formation yield of BzCHO were investigated. The effect of initial BzOH concentration on overall BzOH conversion, BzCHO selectivity and BzCHO formation yield using Pd@Mn5O8 microspheres is given in Fig. 11 A. TON and TOF values obtained with different BzOH concentrations are given in Table 4 . The overall conversion decreased with the increasing BzOH concentration. The formation possibility of carbonyl oxy/dioxy compounds decreases with the increasing concentration of BzOH concentration which results in lower final conversion of BzOH [65,68]. The highest values for BzCHO selectivity and BzCHO formation yield were obtained with the initial BzOH concentration of 100 mM. With the highest BzOH concentration, the selectivity of toluene was obtained as 16.7 % which was the highest value among the toluene selectivities in this set. The presence of more surface hydrogen was previously given as the reason of this result [65,66]. The effect of catalyst concentration on BzOH conversion and BzCHO formation yield using Pd@Mn5O8 microspheres is shown in Fig. 11B. The overall conversion increased, however, the BzCHO selectivity decreased with the increasing catalyst concentration likely due to the change occurred in reaction pathway [67]. As expected, TON and TOF values decreased with increasing amount of Pd@Mn5O8 microspheres (Table 4). The effect of Pd NPs loading onto Mn5O8 microspheres on overall BzOH conversion and BzCHO formation yield is given in Fig. 11C. Pd NPs loading of 2.5 % (w/w) with respect to Mn5O8 based microspheres was the most appropriate value providing the highest overall conversion and the highest selectivity for BzCHO. The decrease in the BzCHO formation yield with the Pd NPs loading of 5.0 % (w/w) should be likely related to the formation aggregates of Pd NPs immobilized on the surface of MnOx microspheres with the increasing concentration of Pd NPs in the attachment medium. Among the tried conditions, the highest TON and TOF values were obtained as 103.4 and 25.9 h−1 for a reaction period of 4 h with the Pd@Mn5O8 catalyst prepared with the Pd NPs loading of 1.25 % w/w ( Table 4 ). The highest TOF for this catalyst was found as 76.6 h−1 based on the reaction period of 1 h. The effect of TBHP concentration on overall BzOH conversion and BzCHO formation yield using Pd@Mn5O8 microspheres is shown in Fig. 11D. The results indicated that TBHP concentration of 150 mM was the most appropriate one for obtaining a satisfactory BzOH conversion (92.2 %) with the highest selectivity (96.3 %). The use of TBHP at lower or higher concentration resulted in an appreciable decrease in the selectivity of BzCHO. This behaviour can be explained by the variation of reaction pathway leading to different final products such as toluene and benzyl benzoate [64,66]. No signifcant change was observed both in TON and TOF within the studied range of TBHP concentration (Table 4). To compare the catalytic performance of TBHP, molecular oxygen and H2O2, the effect of oxidant type on overall BzOH conversion and BzCHO formation yield using Pd@Mn5O8 microspheres is given in Fig. S8 of the Supporting Information. The highest overall BzOH conversion and the highest BzCHO formation yield were obtained with TBHP. Both overall BzOH conversion and BzCHO formation yield markedly decreased by using molecular oxygen or H2O2 instead of TBHP. The recycling behaviour of Pd@MnOx microspheres is given in Fig. 12 . BzOH conversion and BzCHO selectivity decreased 26.2 and 11.2 %, respectively over five consecutive runs. After the first run, the decrease in the BzCHO formation yield is quite small. Based on this behaviour the reusability of Pd@MnOx microspheres in the consecutive BzOH oxidation runs may be termed as satisfactory. The comparison of Pd@Mn5O8 catalyst exhibiting the best catalytic activity among the catalysts tried in our study with the similar heterogeneous catalysts used for BzOH oxidation in different studies showed that satisfactorily high overall BzOH conversion and BzCHO selectivity were obtained with Pd@Mn5O8 microspheres (Table 5 ). 4 Conclusion The heterogeneous catalysts for the oxidation of BzOH were prepared by the immobilization of Pd NPs on monodisperse-porous metal oxide microspheres. Considerably higher catalytic activities documented with overall BzOH conversion and BzCHO formation yield were obtained with Pd@MnO2 and Pd@Mn5O8 microspheres among the tried catalysts. This behaviour was explained by the synergistic effect between Pd NPs and MnOx based support, depending upon the reducible metal oxide character of MnOx due to its mixed valence nature assisting the formation of abundant oxygen vacancies and increasing the mobility of surface lattice oxygen in the BzOH oxidation. For this purpose, deconvoluted XPS spectra were used as an effective tool for demonstrating the presence of multiple oxidation states of manganese in the synthesized catalysts. Thus, the enhacement in BzOH oxidation rate was explained by the transfer of oxidative oxygen species formed via multiple oxidation states of Mn from Mn5O8 based support to the immobilized Pd NPs as the active centers. In this study, a methodology for the synthesis of a heterogeneous catalysts with controlled size and porous properties was also exemplified. In this methodology, monodisperse-porous microspheres were synthesized as the support, by a staged shape templating protocol by choosing an appropriate couple containing a polymethacrylate template and a precursor for obtaining the desired metal oxide in the form of monodisperse-porous microspheres. The size and porous properties of resulting metal oxide microspheres can be adjusted by changing size and morphological properties of polymeric template. This methodology allows the comparison of catalytic performances of heterogeneous catalysts and the investigation of synergistic interaction between active center and support by changing either the nanoparticle or the support type and by protecting morphological properties of resulting catalysts. Monodisperse Mn5O8 microspheres with multivalence character and having a considerable surface area originated from their porous character were selected as a support for the synthesis of oxidation catalyst. The combination of selected support (i.e. Mn5O8) with an active center in the form Pd NPs provided higher catalytic activity with respect to the similar catalysts synthesized using SiO2 and TiO2 microspheres with similar mean size values, but better porous properties. As demonstrated by CO chemisorption study, the satisfactory surface area of porous Mn5O8 microspheres allowed the immobilization of Pd NPs on the selected support without occuring any significant nanoparticle aggregation. In addition to this property, the synergistic interaction between Mn5O8 based support and Pd NPs, originated from the multivalence character of the selected support, resulted in higher catalytic activity with the Pd@Mn5O8 catalyst. CRediT authorship contribution statement Rukiye Babacan Tosun: Visualization, Formal analysis. Kadriye Özlem Hamaloğlu: Visualization, Formal analysis, Investigation, Methodology, Writing - review & editing. Pınar Akkaş Kavaklı: Formal analysis. Cengiz Kavaklı: Formal analysis. Ali Tuncel: Conceptualization, Supervision, Methodology, Writing - review & editing. Declaration of Competing Interest The authors report no declarations of interest. Acknowledgement The authors gratefully acknowledge Assoc. Prof. Alper Uzun and Samira Fatma Kurtoğlu from Chemical and Biological Engineering Department at Koç University for their assistance with CO chemisorption experiments and for their noble contributions to related discussions. All authors sincerely thank Turkish Academy of Sciences (TÜBA) for providing research support to Prof. Ali Tuncel as a full-member. Appendix A Supplementary data Supplementary material related to this article can be found, in the online version, at doi:https://doi.org/10.1016/j.mcat.2020.111227. Appendix A Supplementary data The following is Supplementary data to this article: References [1] N. Dimitratos J.A. Lopez-Sanchez G.J. Hutchings Selective liquid phase oxidation with supported metal nanoparticles Chem. Sci. 3 2012 20 44 10.1039/C1SC00524C N. Dimitratos, J. A. Lopez-Sanchez, G. J. Hutchings, Selective liquid phase oxidation with supported metal nanoparticles, Chem. Sci. 3 (2012) 20-44. https://doi.org/10.1039/C1SC00524C. [2] R.T. Kumar N.C.S. Selvam T. Adinaveen L.J. Kennedy J.J. Vijaya Strontium (II)-added CoAl2O4 nanocatalysts for the selective oxidation of alcohols React. Kinet. Mech. Catal. 106 2012 379 394 10.1007/s11144-012-0428-2 R. T. Kumar, N. C. S. Selvam, T. Adinaveen, L. J. Kennedy, J. J. Vijaya, Strontium (II)-added CoAl2O4 nanocatalysts for the selective oxidation of alcohols, React. Kinet. Mech. Catal. 106 (2012) 379-394. https://doi.org/10.1007/s11144-012-0428-2. [3] V.R. Choudhary D.K. Dumbre Solvent-free selective oxidation of benzyl alcohol to benzaldehyde by tert-butyl hydroperoxide over U3O8-supported nano-gold catalysts Appl. Catal. A Gen. 375 2010 252 257 10.1016/j.apcata.2010.01.007 V. R. Choudhary, D. K. Dumbre, Solvent-free selective oxidation of benzyl alcohol to benzaldehyde by tert-butyl hydroperoxide over U3O8-supported nano-gold catalysts, Appl. Catal. A Gen. 375 (2010) 252-257. https://doi.org/10.1016/j.apcata.2010.01.007. [4] R. Ji S. Zhai W. Zheng Z. Xiao Q. An F. Zhang Enhanced metal–support interactions between Pd NPs and ZrSBA-15 for efficient aerobic benzyl alcohol oxidation RSC Adv. 6 2016 70424 70432 10.1039/C6RA17272E R. Ji, S. Zhai, W. Zheng, Z. Xiao, Q. An, F. Zhang, Enhanced metal–support interactions between Pd NPs and ZrSBA-15 for efficient aerobic benzyl alcohol oxidation, RSC Adv. 6 (2016) 70424-70432. https://doi.org/10.1039/C6RA17272E. [5] V. Mahdavi M. Mardani M. Malekhosseini Oxidation of alcohols with tert-butylhydroperoxide catalyzed by Mn (II) complexes immobilized in the pore channels of mesoporous hexagonal molecular sieves (HMS) Catal. Commun. 9 2008 2201 2204 10.1016/j.catcom.2008.05.008 V. Mahdavi, M. Mardani, M. Malekhosseini, Oxidation of alcohols with tert-butylhydroperoxide catalyzed by Mn (II) complexes immobilized in the pore channels of mesoporous hexagonal molecular sieves (HMS), Catal. Commun. 9 (2008) 2201-2204. https://doi.org/10.1016/j.catcom.2008.05.008. [6] G. Liu M. Hou J. Song T. Jiang H. Fan Z. Zhang B. Han Immobilization of Pd nanoparticles with functional ionic liquid grafted onto cross-linked polymer for solvent-free Heck reaction Green Chem. 12 2010 65 69 10.1039/B913182E G. Liu, M. Hou, J. Song, T. Jiang, H. Fan, Z. Zhang, B. Han, Immobilization of Pd nanoparticles with functional ionic liquid grafted onto cross-linked polymer for solvent-free Heck reaction, Green Chem. 12 (2010) 65-69. https://doi.org/10.1039/B913182E. [7] M. Zou M. Du M. Zhang T. Yang H. Zhu P. Wang S. Bao Synthesis and deposition of ultrafine noble metallic nanoparticles on amino-functionalized halloysite nanotubes and their catalytic application Mat. Res. Bull. 61 2015 375 382 10.1016/j.materresbull.2014.10.053 M. Zou, M. Du, M. Zhang, T. Yang, H. Zhu, P. Wang, S. Bao, Synthesis and deposition of ultrafine noble metallic nanoparticles on amino-functionalized halloysite nanotubes and their catalytic application, Mat. Res. Bull. 61 (2015) 375-382. https://doi.org/10.1016/j.materresbull.2014.10.053. [8] L. Chen J. Yan Z. Tong S. Yu J. Tang B. Ou L. Yu L. Tian Nanofiber-like mesoporous alumina supported palladium nanoparticles as a highly active catalyst for base-free oxidation of benzyl alcohol Microporous Mesoporous Mater. 266 2018 126 131 10.1016/j.micromeso.2018.02.037 L. Chen, J. Yan, Z. Tong, S. Yu, J. Tang, B. Ou, L. Yu, L. Tian, Nanofiber-like mesoporous alumina supported palladium nanoparticles as a highly active catalyst for base-free oxidation of benzyl alcohol, Micropor. Mesopor. Mat. 266 (2018) 126-131. https://doi.org/10.1016/j.micromeso.2018.02.037. [9] S. Niu W. Guo T.W. Lin W. Yu Y. Wu X. Ji L. Shao Nanoscale Pd supported on 3D porous carbon for enhanced selective oxidation of benzyl alcohol RSC Adv. 7 2017 25885 25890 10.1039/C7RA03665E S. Niu, W. Guo, T. W. Lin, W. Yu, Y. Wu, X. Ji, L. Shao, Nanoscale Pd supported on 3D porous carbon for enhanced selective oxidation of benzyl alcohol, RSC Adv. 7 (2017) 25885-25890. https://doi.org/10.1039/C7RA03665E. [10] Z. Hu G. Zhou L. Xu J. Yang B. Zhang X. Xiang Preparation of ternary Pd/CeO2-nitrogen doped graphene composites as recyclable catalysts for solvent-free aerobic oxidation of benzyl alcohol Appl. Surf. Sci. 471 2019 852 861 10.1016/j.apsusc.2018.12.067 Z. Hu, G. Zhou, L. Xu, J. Yang, B. Zhang, X. Xiang, Preparation of ternary Pd/CeO2-nitrogen doped graphene composites as recyclable catalysts for solvent-free aerobic oxidation of benzyl alcohol, Appl. Surf. Sci. 471 (2019) 852-861. https://doi.org/10.1016/j.apsusc.2018.12.067. [11] K. Morgan A. Goguet C. Hardacre Metal redispersion strategies for recycling of supported metal catalysts: a perspective ACS Catal. 5 2015 3430 3445 10.1021/acscatal.5b00535 K. Morgan, A. Goguet, C. Hardacre, Metal redispersion strategies for recycling of supported metal catalysts: a perspective, ACS Catal. 5 (2015) 3430-3445. https://doi.org/10.1021/acscatal.5b00535. [12] A. Abad P. Concepción A. Corma H. García A collaborative effect between gold and a support induces the selective oxidation of alcohols Angew. Chem. Int. Ed. 44 2005 4066 4069 10.1002/anie.200500382 A. Abad, P. Concepción, A. Corma, H. García, A collaborative effect between gold and a support induces the selective oxidation of alcohols, Angew. Chem. Int. Ed. 44 (2005) 4066-4069. https://doi.org/10.1002/anie.200500382. [13] S.F. Hackett R.M. Brydson M.H. Gass I. Harvey A.D. Newman K. Wilson A.F. Lee High‐activity, single‐site mesoporous Pd/Al2O3 catalysts for selective aerobic oxidation of allylic alcohols Angew. Chem. Int. Ed. 46 2007 8593 8596 10.1002/ange.200702534 S. F. Hackett, R. M. Brydson, M. H. Gass, I. Harvey, A. D. Newman, K. Wilson, A. F. Lee, High‐Activity, Single‐Site Mesoporous Pd/Al2O3 Catalysts for Selective Aerobic Oxidation of Allylic Alcohols, Angew. Chem. Int. Ed. 46 (2007) 8593-8596. https://doi.org/10.1002/ange.200702534. [14] J. Sun Y. Han H. Fu X. Qu Z. Xu S. Zheng Au@ Pd/TiO2 with atomically dispersed Pd as highly active catalyst for solvent-free aerobic oxidation of benzyl alcohol Chem. Eng. J. 313 2017 1 9 10.1016/j.cej.2016.12.024 J. Sun, Y. Han, H. Fu, X. Qu, Z. Xu, S. Zheng, Au@ Pd/TiO2 with atomically dispersed Pd as highly active catalyst for solvent-free aerobic oxidation of benzyl alcohol, Chem. Eng. J. 313 (2017) 1-9. https://doi.org/10.1016/j.cej.2016.12.024. [15] F. Arena B. Gumina A.F. Lombardo C. Espro A. Patti L. Spadaro L. Spiccia Nanostructured MnOx catalysts in the liquid phase selective oxidation of benzyl alcohol with oxygen: part I. Effects of Ce and Fe addition on structure and reactivity Appl. Catal. B-Environ. 162 2015 260 267 10.1016/j.apcatb.2014.06.054 F. Arena, B. Gumina, A. F. Lombardo, C. Espro, A. Patti, L. Spadaro, L. Spiccia, Nanostructured MnOx catalysts in the liquid phase selective oxidation of benzyl alcohol with oxygen: Part I. Effects of Ce and Fe addition on structure and reactivity, Appl. Catal. B-Environ. 162 (2015) 260-267. https://doi.org/10.1016/j.apcatb.2014.06.054. [16] Z. Hu Y. Zhao J. Liu J. Wang B. Zhang X. Xiang Ultrafine MnO2 nanoparticles decorated on graphene oxide as a highly efficient and recyclable catalyst for aerobic oxidation of benzyl alcohol J. Coll. Inter. Sci. 483 2016 26 33 10.1016/j.jcis.2016.08.010 Z. Hu, Y. Zhao, J. Liu, J. Wang, B. Zhang, X. Xiang, Ultrafine MnO2 nanoparticles decorated on graphene oxide as a highly efficient and recyclable catalyst for aerobic oxidation of benzyl alcohol, J. Coll. Inter. Sci. 483 (2016) 26-33. https://doi.org/10.1016/j.jcis.2016.08.010. [17] H.T. Tan Y. Chen C. Zhou X. Jia J. Zhu J. Chen X. Rui Q. Yan Y. Yang Palladium nanoparticles supported on manganese oxide–CNT composites for solvent-free aerobic oxidation of alcohols: tuning the properties of Pd active sites using MnOx Appl. Catal. B-Environ. 119 2012 166 174 10.1016/j.apcatb.2012.02.024 H. T. Tan, Y. Chen, C. Zhou, X. Jia, J. Zhu, J. Chen, X. Rui, Q. Yan, Y. Yang, Palladium nanoparticles supported on manganese oxide–CNT composites for solvent-free aerobic oxidation of alcohols: Tuning the properties of Pd active sites using MnOx, Appl. Catal. B-Environ. 119 (2012) 166-174. https://doi.org/10.1016/j.apcatb.2012.02.024. [18] M.E. Assal M.R. Shaik M. Kuniyil M. Khan J.V. Kumar A.Y. Alzahrani A. Al-Warthan A.S. Al-Tamrah M.R.H. Siddiqui S.A. Hashmi S.F. Adil Silver-doped manganese based nanocomposites for aerial oxidation of alcohols Mater. Express 8 2018 35 54 10.1166/mex.2018.1409 M. E. Assal, M. R. Shaik, M. Kuniyil, M. Khan, J. V. Kumar, A. Y. Alzahrani, A. Al-Warthan, A. S. Al-Tamrah, M. R. H. Siddiqui, S. A. Hashmi, S. F. Adil, Silver-doped manganese based nanocomposites for aerial oxidation of alcohols, Mater. Express 8 (2018) 35-54. https://doi.org/10.1166/mex.2018.1409. [19] H. Alshammari M. Alhumaimess M.H. Alotaibi A.S. Alshammari Catalytic activity of bimetallic AuPd alloys supported MgO and MnO2 nanostructures and their role in selective aerobic oxidation of alcohols J. King Saud Univ. Sci. 29 2017 561 566 10.1016/j.jksus.2017.03.003 H. Alshammari, M. Alhumaimess, M. H. Alotaibi, A. S. Alshammari, Catalytic activity of bimetallic AuPd alloys supported MgO and MnO2 nanostructures and their role in selective aerobic oxidation of alcohols, J. King Saud Univ. Sci. 29 (2017) 561-566. https://doi.org/10.1016/j.jksus.2017.03.003. [20] M. Alhumaimess Z. Lin Q. He L. Lu N. Dimitratos N.F. Dummer M. Conte S.H. Taylor J.K. Bartley C.K. Kiely G.J. Hutchings Oxidation of benzyl alcohol and carbon monoxide using gold nanoparticles supported on MnO2 nanowire microspheres Chem-Eur J. 20 2014 1701 1710 10.1002/chem.201303355 M. Alhumaimess, Z. Lin, Q. He, L. Lu, N. Dimitratos, N. F. Dummer, M. Conte, S. H. Taylor, J. K. Bartley, C. K. Kiely, G. J. Hutchings, Oxidation of benzyl alcohol and carbon monoxide using gold nanoparticles supported on MnO2 nanowire microspheres, Chem-Eur J. 20 (2014) 1701-1710. https://doi.org/10.1002/chem.201303355. [21] J. Yang K. Cao M. Gong B. Shan R. Chen Atomically decorating of MnOx on palladium nanoparticles towards selective oxidation of benzyl alcohol with high yield J. Catal. 386 2020 60 69 10.1016/j.jcat.2020.03.029 J. Yang, K. Cao, M. Gong, B. Shan, R. Chen, Atomically decorating of MnOx on palladium nanoparticles towards selective oxidation of benzyl alcohol with high yield, J. Catal. 386 (2020) 60–69. https://doi.org/10.1016/j.jcat.2020.03.029. [22] Q. Wei T. Liu Y. Wang L. Dai Three-dimensional N-doped graphene aerogel-supported Pd nanoparticles as efficient catalysts for solvent-free oxidation of benzyl alcohol RSC Adv. 9 2019 9620 9628 10.1039/C9RA00230H Q. Wei, T. Liu, Y. Wang, L. Dai, Three-dimensional N-doped graphene aerogel-supported Pd nanoparticles as efficient catalysts for solvent-free oxidation of benzyl alcohol, RSC Adv. 9 (2019) 9620-9628. https://doi.org/10.1039/C9RA00230H. [23] Y. Dong J. Luo S. Li C. Liang CeO2 decorated Au/CNT catalyst with constructed Au-CeO2 interfaces for benzyl alcohol oxidation Catal. Commun. 133 2020 105843 10.1016/j.catcom.2019.105843 Y. Dong, J. Luo, S. Li, C. Liang, CeO2 decorated Au/CNT catalyst with constructed Au-CeO2 interfaces for benzyl alcohol oxidation, Catal. Commun. 133 (2020) 105843. https://doi.org/10.1016/j.catcom.2019.105843. [24] C.A. Wilde Y. Ryabenkova I.M. Firth L. Pratt J. Railton M. Bravo-Sanchez N. Sano P.J. Cumpson P.D. Coates X. Liu M. Conte Novel rhodium on carbon catalysts for the oxidation of benzyl alcohol to benzaldehyde: a study of the modification of metal/support interactions by acid pre-treatments Appl. Catal. A Gen. 570 2019 271 282 10.1016/j.apcata.2018.11.006 C. A. Wilde, Y. Ryabenkova, I. M. Firth, L. Pratt, J. Railton, M. Bravo-Sanchez, N. Sano, P. J. Cumpson, P. D. Coates, X. Liu, M. Conte, Novel rhodium on carbon catalysts for the oxidation of benzyl alcohol to benzaldehyde: A study of the modification of metal/support interactions by acid pre-treatments, Appl. Catal. A Gen. 570 (2019) 271-282. https://doi.org/10.1016/j.apcata.2018.11.006. [25] M. Bornstein D.M. Parker A.D. Quast J.S. Shumaker‐Parry I. Zharov Reaction conditions‐dependent formation of catalytically active palladium complexes or palladium nanoparticles on a silica support ChemCatChem 11 2019 4360 4367 10.1002/cctc.201900943 M. Bornstein, D. M. Parker, A. D. Quast, J. S. Shumaker‐Parry, I. Zharov, Reaction Conditions‐Dependent Formation of Catalytically Active Palladium Complexes or Palladium Nanoparticles on a Silica Support, ChemCatChem 11 (2019) 4360-4367. https://doi.org/10.1002/cctc.201900943. [26] M. Khawaji D. Chadwick Selective catalytic oxidation over Au-Pd/titanate nanotubes and the influence of the catalyst preparation method on the activity Catal. Today 334 2019 122 130 10.1016/j.cattod.2018.11.080 M. Khawaji, D. Chadwick, Selective catalytic oxidation over Au-Pd/titanate nanotubes and the influence of the catalyst preparation method on the activity, Catal. Today 334 (2019) 122-130. https://doi.org/10.1016/j.cattod.2018.11.080. [27] L. Jin B. Liu M.E. Louis G. Li J. He Highly crystalline mesoporous titania loaded with monodispersed gold nanoparticles: controllable metal–support interaction in porous materials ACS Appl. Mater. Interfaces 12 2020 9617 9627 10.1021/acsami.9b20231 L. Jin, B. Liu, M. E. Louis, G. Li, J. He, Highly Crystalline Mesoporous Titania Loaded with Monodispersed Gold Nanoparticles: Controllable Metal–Support Interaction in Porous Materials, ACS Appl. Mater. Interfaces 12 (2020) 9617-9627. https://doi.org/10.1021/acsami.9b20231. [28] X. Li J. Feng M. Perdjon R. Oh W. Zhao X. Huang S. Liu Investigations of supported Au-Pd nanoparticles on synthesized CeO2 with different morphologies and application in solvent-free benzyl alcohol oxidation Appl. Surf. Sci. 505 2020 144473 10.1016/j.apsusc.2019.144473 X. Li, J. Feng, M. Perdjon, R. Oh, W. Zhao, X. Huang, S. Liu, Investigations of supported Au-Pd nanoparticles on synthesized CeO2 with different morphologies and application in solvent-free benzyl alcohol oxidation, Appl. Surf. Sci. 505 (2020) 144473. https://doi.org/10.1016/j.apsusc.2019.144473. [29] M. Khawaji D. Chadwick Au–Pd NPs immobilised on nanostructured ceria and titania: impact of support morphology on the catalytic activity for selective oxidation Catal. Sci. Technol. 8 2018 2529 2539 10.1039/C7CY02329D M. Khawaji, D. Chadwick, Au–Pd NPs immobilised on nanostructured ceria and titania: impact of support morphology on the catalytic activity for selective oxidation, Catal. Sci. Technol. 8 (2018) 2529-2539. https://doi.org/10.1039/C7CY02329D. [30] C.M. Olmos L.E. Chinchilla A. Villa J.J. Delgado A.B. Hungría G. Blanco L. Prati J.J. Calvino X. Chen Size, nanostructure, and composition dependence of bimetallic Au–Pd supported on ceria–zirconia mixed oxide catalysts for selective oxidation of benzyl alcohol J. Catal. 375 2019 44 55 10.1016/j.jcat.2019.05.002 C. M. Olmos, L. E. Chinchilla, A. Villa, J. J. Delgado, A. B. Hungría, G. Blanco, L. Prati, J. J. Calvino, X. Chen, Size, nanostructure, and composition dependence of bimetallic Au–Pd supported on ceria–zirconia mixed oxide catalysts for selective oxidation of benzyl alcohol, J. Catal. 375 (2019) 44-55. https://doi.org/10.1016/j.jcat.2019.05.002. [31] S. Meher R.K. Rana A rational design of a Pd-based catalyst with a metal–metal oxide interface influencing molecular oxygen in the aerobic oxidation of alcohols Green Chem. 21 2019 2494 2503 10.1039/C9GC00116F S. Meher, R. K. Rana, A rational design of a Pd-based catalyst with a metal–metal oxide interface influencing molecular oxygen in the aerobic oxidation of alcohols, Green Chem. 21 (2019) 2494-2503. https://doi.org/10.1039/C9GC00116F. [32] M. Ketkaew D. Suttipat P. Kidkhunthod T. Witoon C. Wattanakit Nanoceria-modified platinum supported on hierarchical zeolites for selective alcohol oxidation RSC Adv. 9 2019 36027 36033 10.1039/C9RA07793F M. Ketkaew, D. Suttipat, P. Kidkhunthod, T. Witoon, C. Wattanakit, Nanoceria-modified platinum supported on hierarchical zeolites for selective alcohol oxidation, RSC Adv. 9 (2019) 36027-36033. https://doi.org/10.1039/C9RA07793F. [33] A. Maleki R. Rahimi S. Maleki Efficient oxidation and epoxidation using a chromium(VI)-based magnetic nanocomposite Environ. Chem. Lett. 14 2016 195 199 10.1007/s10311-016-0558-2 A. Maleki, R. Rahimi, S. Maleki, Efficient oxidation and epoxidation using a chromium(VI)-based magnetic nanocomposite, Environ. Chem. Lett. 14 (2016) 195–199. https://doi.org/10.1007/s10311-016-0558-2 [34] A. Maleki Green oxidation protocol: selective conversions of alcohols and alkenes to aldehydes, ketones and epoxides by using a new multiwall carbon nanotubebased hybrid nanocatalyst via ultrasound irradiation Ultrason. Sonochem. 40 2018 460 464 10.1016/j.ultsonch.2017.07.020 A. Maleki, Green oxidation protocol: Selective conversions of alcohols and alkenes to aldehydes, ketones and epoxides by using a new multiwall carbon nanotubebased hybrid nanocatalyst via ultrasound irradiation, Ultrason. Sonochem. 40 (2018) 460–464. https://doi.org/10.1016/j.ultsonch.2017.07.020 [35] A. Maleki T. Kari Novel leaking-free, green, double core/shell, palladium-loaded magnetic heterogeneous nanocatalyst for selective aerobic oxidation Catal. Lett. 148 2018 2929 2934 10.1007/s10562-018-2492-3 A. Maleki, T. Kari, Novel Leaking-Free, Green, Double Core/Shell, Palladium-Loaded Magnetic Heterogeneous Nanocatalyst for Selective Aerobic Oxidation, Catal. Lett. 148 (2018) 2929–2934. https://doi.org/10.1007/s10562-018-2492-3 [36] G.K. Kara J. Rahimi M. Niksefat R. Taheri-Ledari M. Rabbani A. Maleki Preparation and characterization of perlite/V2O5nano-spheres via a novel green method: Applied for oxidation of benzyl alcohol derivatives Mater. Chem. Phys. 250 2020 122991 123003 10.1016/j.matchemphys.2020.122991 G. K. Kara, J. Rahimi, M. Niksefat, R. Taheri-Ledari, M. Rabbani, A. Maleki, Preparation and characterization of perlite/V2O5 nano-spheres via a novel green method: Applied for oxidation of benzyl alcohol derivatives, Mater. Chem. Phys. 250 (2020) 122991-123003. https://doi.org/10.1016/j.matchemphys.2020.122991 [37] M.S. Esmaeili Z. Varzi R. Eivazzadeh-Keihan A. Maleki H. Ghafuri Design and development of natural and biocompatible raffinose-Cu2O magnetic nanoparticles as a heterogeneous nanocatalyst for the selective oxidation of alcohols Mol. Catal. 492 2020 111037 111047 10.1016/j.mcat.2020.111037 M. S. Esmaeili, Z. Varzi, R. Eivazzadeh-Keihan, A. Maleki, H. Ghafuri, Design and development of natural and biocompatible raffinose-Cu2O magnetic nanoparticles as a heterogeneous nanocatalyst for the selective oxidation of alcohols, Mol. Catal. 492 (2020) 111037-111047. https://doi.org/10.1016/j.mcat.2020.111037 [38] Z. Hajizadeh A. Maleki Poly(ethylene imine)-modified magnetic halloysite nanotubes: a novel, efficient and recyclable catalyst for the synthesis of dihydropyrano[2,3-c] pyrazole derivatives Mol. Catal. 460 2018 87 93 10.1016/j.mcat.2018.09.018 Z. Hajizadeh, A. Maleki, Poly(ethylene imine)-modified magnetic halloysite nanotubes: A novel, efficient and recyclable catalyst for the synthesis of dihydropyrano[2,3-c] pyrazole derivatives, Mol. Catal. 460 (2018) 87–93. https://doi.org/10.1016/j.mcat.2018.09.018 [39] A. Shaabani A. Maleki Green and efficient synthesis of quinoxaline derivatives via ceric ammonium nitrate promoted and in situ aerobic oxidation of a-hydroxy ketones and a-keto oximes in aqueous media Chem. Pharm. Bull. 56 2008 79 81 10.1248/cpb.56.79 A. Shaabani, A. Maleki, Green and Efficient Synthesis of Quinoxaline Derivatives via Ceric Ammonium Nitrate Promoted and in Situ Aerobic Oxidation of a-Hydroxy Ketones and a-Keto Oximes in Aqueous Media, Chem. Pharm. Bull. 56 (2008) 79-81. https://doi.org/10.1248/cpb.56.79 [40] A. Maleki M. Rabbani S. Shahrokh Preparation and characterization of a silicabased magnetic nanocomposite and its application as a recoverable catalyst for the one-pot multicomponent synthesis of quinazolinone derivatives Appl. Organometal. Chem. 29 2015 809 814 10.1002/aoc.3373 A. Maleki, M. Rabbani, S. Shahrokh, Preparation and characterization of a silicabased magnetic nanocomposite and its application as a recoverable catalyst for the one-pot multicomponent synthesis of quinazolinone derivatives, Appl. Organometal. Chem. 29 (2015) 809–814. https://doi.org/10.1002/aoc.3373 [41] M. Azizi A. Maleki F. Hakimpoor Solvent, metal and halogen-free synthesis of sulfoxides by using a recoverable heterogeneous urea-hydrogen peroxide silica-based oxidative catalytic system Catal. Commun. 100 2017 62 65 10.1016/j.catcom.2017.06.014 M. Azizi, A. Maleki, F. Hakimpoor, Solvent, metal and halogen-free synthesis of sulfoxides by using a recoverable heterogeneous urea-hydrogen peroxide silica-based oxidative catalytic system, Catal. Commun. 100 (2017) 62–65. https://doi.org/10.1016/j.catcom.2017.06.014 [42] M. Azizi A. Maleki F. Hakimpoor R. Ghalavand A. Garavand A. Mild Efficient and highly selective oxidation of sulfides to sulfoxides catalyzed by Lewis acid–urea–hydrogen peroxide complex at room temperature Catal. Lett. 147 2017 2173 2177 10.1007/s10562-017-2126-1 M. Azizi, A. Maleki, F. Hakimpoor, R. Ghalavand, A. Garavand, A Mild, Efficient and Highly Selective Oxidation of Sulfides to Sulfoxides Catalyzed by Lewis Acid–Urea–Hydrogen Peroxide Complex at Room Temperature, Catal. Lett. 147 (2017) 2173–2177. https://doi.org/10.1007/s10562-017-2126-1 [43] J. Rahimi R. Taheri-Ledari M. Niksefat A. Maleki Enhanced reduction of nitrobenzene derivatives: effective strategy executed by Fe3O4/PVA-10%Ag as a versatile hybrid nanocatalyst Catal. Commun. 134 2020 105850 105856 10.1016/j.catcom.2019.105850 J. Rahimi, R. Taheri-Ledari, M. Niksefat, A. Maleki, Enhanced reduction of nitrobenzene derivatives: Effective strategy executed by Fe3O4/PVA-10%Ag as a versatile hybrid nanocatalyst, Catal. Commun. 134 (2020) 105850-105856. https://doi.org/10.1016/j.catcom.2019.105850 [44] R.B. Tosun Ç. Kip A. Tuncel Polymeric template assisted synthesis of monodisperse-porous manganese oxide microspheres: a new nanozyme with oxidase-like activity allowing biomolecule determination via bimodal sensing New J. Chem. 43 2019 18505 18516 10.1039/C9NJ03527C R. B. Tosun, Ç. Kip, A. Tuncel, Polymeric template assisted synthesis of monodisperse-porous manganese oxide microspheres: a new nanozyme with oxidase-like activity allowing biomolecule determination via bimodal sensing, New J. Chem. 43 (2019) 18505-18516. https://doi.org/10.1039/C9NJ03527C. [45] Ç. Kip H. Gülüşür E. Çelik D.D. Usta A. Tuncel Isolation of RNA and beta-NAD by phenylboronic acid functionalized, monodisperse-porous silica microspheres as sorbent in batch and microfluidic boronate affinity systems Colloids Surf. B Biointerfaces 174 2019 333 342 10.1016/j.colsurfb.2018.11.012 Ç. Kip, H. Gülüşür, E. Çelik, D. D. Usta, A. Tuncel, Isolation of RNA and beta-NAD by phenylboronic acid functionalized, monodisperse-porous silica microspheres as sorbent in batch and microfluidic boronate affinity systems, Colloids Surf B Biointerfaces 174 (2019) 333-342. https://doi.org/10.1016/j.colsurfb.2018.11.012. [46] B. Gokcal C. Kip D. Sahinbas E. Celik A. Tuncel Silica microspheres functionalized with the iminodiacetic acid/copper(II) complex as a peroxidase mimic for use in metal affinity chromatography-based colorimetric determination of histidine-tagged proteins Microchim. Acta 187 2020 121 10.1007/s00604-019-4087-0 B. Gokcal, C. Kip, D. Sahinbas, E. Celik, A. Tuncel, Silica microspheres functionalized with the iminodiacetic acid/copper(II) complex as a peroxidase mimic for use in metal affinity chromatography-based colorimetric determination of histidine-tagged proteins, Microchim. Acta 187 (2020) 121. https://doi.org/10.1007/s00604-019-4087-0. [47] C. Kip R.B. Tosun S. Alpaslan I. Kocer E. Celik A. Tuncel Ni(II)-decorated porous titania microspheres as a stationary phase for column chromatography applications: Highly selective purification of hemoglobin from human blood Talanta 200 2019 100 106 10.1016/j.talanta.2019.03.045 C. Kip, R.B. Tosun, S. Alpaslan, I. Kocer, E. Celik, A. Tuncel, Ni(II)-decorated porous titania microspheres as a stationary phase for column chromatography applications: Highly selective purification of hemoglobin from human blood, Talanta 200 (2019) 100-106. https://doi.org/10.1016/j.talanta.2019.03.045. [48] K.Ö. Hamaloglu E. Sag A. Tuncel Bare, gold and silver nanoparticle decorated, monodisperse-porous titania microbeads for photocatalytic dye degradation in a newly constructed microfluidic, photocatalytic packed-bed reactor J. Photochem. Photobiol. A-Chem. 332 2017 60 65 10.1016/j.jphotochem.2016.08.015 K. Ö. Hamaloglu, E. Sag, A. Tuncel, Bare, gold and silver nanoparticle decorated, monodisperse-porous titania microbeads for photocatalytic dye degradation in a newly constructed microfluidic, photocatalytic packed-bed reactor, J. Photochem. Photobiol. A-Chem. 332 (2017) 60-65. https://doi.org/10.1016/j.jphotochem.2016.08.015. [49] M. Brun A. Berthet J.C. Bertolini XPS, AES, and Auger parameter of Pd and PdO J. Electron Spectros. Relat. Phenomena 104 1999 55 60 10.1016/S0368-2048(98)00312-0 M. Brun, A. Berthet, J. C. Bertolini, XPS, AES, and Auger parameter of Pd and PdO, J. Electron Spectrosc. 104 (1999) 55-60. https://doi.org/10.1016/S0368-2048(98)00312-0. [50] A. Khan S. Zou T. Wang J. Ifthikar A. Jawad Z. Liao A. Shahzad A. Ngambia Z. Chen Facile synthesis of yolk shell Mn 2 O 3@ Mn 5 O 8 as an effective catalyst for peroxymonosulfate activation Phys. Chem. Chem. Phys. 20 2018 13909 13919 10.1039/C8CP02080A A. Khan, S. Zou, T. Wang, J. Ifthikar, A. Jawad, Z. Liao, A. Shahzad, A. Ngambia, Z. Chen, Facile synthesis of yolk shell Mn 2 O 3@ Mn 5 O 8 as an effective catalyst for peroxymonosulfate activation, Phys. Chem. Chem. Phys. 20 (2018) 13909-13919. https://doi.org/10.1039/C8CP02080A. [51] M. Aghazadeh M.R. Ganjali P. Norouzi Preparation of Mn5O8 and Mn3O4 nano-rods through cathodic electrochemical deposition-heat treatment (CED-HT) Mater. Res. Express 3 2016 055013 10.1088/2053-1591/3/5/055013 M. Aghazadeh, M.R. Ganjali, P. Norouzi, Preparation of Mn5O8 and Mn3O4 nano-rods through cathodic electrochemical deposition-heat treatment (CED-HT), Mater. Res. Express 3 (2016) 055013. https://doi.org/10.1088/2053-1591/3/5/055013 [52] M.I. Said B. Harbrecht Controlled synthesis of Mn5O8 and β-MnO2nanorods via thermal decomposition of γ-MnOOH precursor: characterization and magnetic properties of Mn5O8 J. Alloy. Comp. 710 2017 635 643 10.1016/j.jallcom.2017.03.138 M.I. Said, B. Harbrecht, Controlled synthesis of Mn5O8 and β-MnO2 nanorods via thermal decomposition of γ-MnOOH precursor: Characterization and magnetic properties of Mn5O8, J. Alloy. Comp. 710 (2017) 635-643. https://doi.org/10.1016/j.jallcom.2017.03.138. [53] X. Li J. Feng J. Sun Z. Wang W. Zhao Solvent-Free Catalytic Oxidation of Benzyl Alcohol over Au-Pd Bimetal Deposited on TiO2: Comparison of Rutile, Brookite, and Anatase Nanoscale Res. Lett. 14 2019 1 9 10.1186/s11671-019-3211-8 X. Li, J. Feng, J. Sun, Z. Wang, W. Zhao, Solvent-Free Catalytic Oxidation of Benzyl Alcohol over Au-Pd Bimetal Deposited on TiO2: Comparison of Rutile, Brookite, and Anatase, Nanoscale Res. Lett. 14 (2019) 1-9. https://doi.org/10.1186/s11671-019-3211-8. [54] J. Luo Q. Zhang J. Garcia-Martinez S.L. Suib Adsorptive and acidic properties, reversible lattice oxygen evolution, and catalytic mechanism of cryptomelane-type manganese oxides as oxidation catalysts J. Am. Chem. Soc. 130 2008 3198 3207 10.1021/ja077706e J. Luo, Q. Zhang, J. Garcia-Martinez, S. L. Suib, Adsorptive and acidic properties, reversible lattice oxygen evolution, and catalytic mechanism of cryptomelane-type manganese oxides as oxidation catalysts, J. Am. Chem. Soc. 130 (2008) 3198-3207. https://doi.org/10.1021/ja077706e. [55] E.I. Ross-Medgaarden I.E. Wachs W.V. Knowles A. Burrows C.J. Kiely M.S. Wong Tuning the electronic and molecular structures of catalytic active sites with titania nanoligands J. Am. Chem. Soc. 131 2009 680 687 10.1021/ja711456c E. I. Ross-Medgaarden, I. E. Wachs, W. V. Knowles, A. Burrows, C. J. Kiely, M. S. Wong, Tuning the electronic and molecular structures of catalytic active sites with titania nanoligands, J. Am. Chem. Soc. 131 (2009) 680-687. https://doi.org/10.1021/ja711456c. [56] F. Schüth Non-siliceous mesostructured and mesoporous materials Chem. Mater. 13 2001 3184 3195 10.1021/cm011030j F. Schüth, Non-siliceous mesostructured and mesoporous materials, Chem. Mater. 13 (2001) 3184-3195. https://doi.org/10.1021/cm011030j. [57] C. Yu B. Tian D. Zhao Recent advances in the synthesis of non-siliceous mesoporous materials Curr. Opin. Solid State Mater. Sci. 7 2003 191 197 10.1016/j.cossms.2003.10.004 C. Yu, B. Tian, D. Zhao, Recent advances in the synthesis of non-siliceous mesoporous materials, Curr Opin Solid State Mater Sci 7 (2003) 191-197. https://doi.org/10.1016/j.cossms.2003.10.004. [58] S.L. Suib Porous manganese oxide octahedral molecular sieves and octahedral layered materials Acc. Chem. Res. 41 2008 479 487 10.1021/ar7001667 S. L. Suib, Porous manganese oxide octahedral molecular sieves and octahedral layered materials, Acc. Chem. Res. 41 (2008) 479-487. https://doi.org/10.1021/ar7001667. [59] Y.C. Son V.D. Makwana A.R. Howell S.L. Suib Efficient, catalytic, aerobic oxidation of alcohols with octahedral molecular sieves Angew. Chem. Int. Ed. 40 2001 4280 4283 10.1002/1521-3773(20011119)40:22%3C4280::AID-ANIE4280%3E3.0.CO;2-L Y. C. Son, V. D. Makwana, A. R. Howell, S. L. Suib, Efficient, catalytic, aerobic oxidation of alcohols with octahedral molecular sieves, Angew. Chem. Int. Ed. 40 (2001) 4280-4283.https://doi.org/10.1002/1521-3773(20011119)40:22%3C4280::AID-ANIE4280%3E3.0.CO;2-L. [60] T. Gao P. Norby F. Krumeich H. Okamoto R. Nesper H. Fjellvåg Synthesis and properties of layered-structured Mn5O8 nanorods J. Phys. Chem. C 114 2010 922 928 10.1021/jp9097606 T. Gao, P. Norby, F. Krumeich, H. Okamoto, R. Nesper, H. Fjellvåg, Synthesis and properties of layered-structured Mn5O8 nanorods, J. Phys. Chem. C 114 (2010) 922-928. https://doi.org/10.1021/jp9097606. [61] H.R. Oswald M.J. Wampetich Die Kristallstrukturen von Mn5O8 und Cd2Mn3O8 Helv. Chim. Acta 50 1967 2023 2034 10.1002/hlca.19670500736 H. R. Oswald, M. J. Wampetich, Die Kristallstrukturen von Mn5O8 und Cd2Mn3O8, Helv. Chim. Acta. 50 (1967) 2023-2034. https://doi.org/10.1002/hlca.19670500736. [62] Z.R. Tian W. Tong J.Y. Wang N.G. Duan V.V. Krishnan S.L. Suib Manganese oxide mesoporous structures: mixed-valent semiconducting catalysts Science 276 1997 926 930 10.1126/science.276.5314.926 Z. R. Tian, W. Tong, J. Y. Wang, N. G. Duan, V. V. Krishnan, S. L. Suib, Manganese oxide mesoporous structures: mixed-valent semiconducting catalysts, Science 276 (1997) 926-930. https://doi.org/10.1126/science.276.5314.926. [63] Y.J. Park M.M. Doeff Synthesis and electrochemical characterization of M2Mn3O8 (M= Ca, Cu) compounds and derivatives Solid State Ion. 177 2006 893 900 10.1016/j.ssi.2006.02.001 Y. J. Park, M. M. Doeff, Synthesis and electrochemical characterization of M2Mn3O8 (M= Ca, Cu) compounds and derivatives, Solid State Ion. 177 (2006) 893-900. https://doi.org/10.1016/j.ssi.2006.02.001. [64] C. Keresszegi D. Ferri T. Mallat A. Baiker Unraveling the surface reactions during liquid-phase oxidation of benzyl alcohol on Pd/Al2O3: an in situ ATR− IR study J. Phys. Chem. B 109 2005 958 967 10.1021/jp0459864 C. Keresszegi, D. Ferri, T. Mallat, A. Baiker, Unraveling the surface reactions during liquid-phase oxidation of benzyl alcohol on Pd/Al2O3: an in situ ATR– IR study, J. Phys. Chem. B 109 (2005) 958-967. https://doi.org/10.1021/jp0459864. [65] A. Savara C.E. Chan‐Thaw I. Rossetti A. Villa L. Prati Benzyl alcohol oxidation on carbon‐supported Pd nanoparticles: elucidating the reaction mechanism ChemCatChem 6 2014 3464 3473 10.1002/cctc.201402552 A. Savara, C. E. Chan‐Thaw, I. Rossetti, A. Villa, L. Prati, Benzyl Alcohol Oxidation on Carbon‐Supported Pd Nanoparticles: Elucidating the Reaction Mechanism, ChemCatChem 6 (2014) 3464-3473. https://doi.org/10.1002/cctc.201402552. [66] C.E. Chan-Thaw A. Savara A. Villa Selective benzyl alcohol oxidation over Pd catalysts Catalysts 8 2018 431 452 10.3390/catal8100431 C. E. Chan-Thaw, A. Savara, A. Villa, Selective benzyl alcohol oxidation over Pd catalysts, Catalysts 8 (2018) 431-452. https://doi.org/10.3390/catal8100431. [67] F. Galvanin M. Sankar S. Cattaneo D. Bethell V. Dua G.J. Hutchings A. Gavriilidis On the development of kinetic models for solvent-free benzyl alcohol oxidation over a gold-palladium catalyst Chem. Eng. J. 342 2018 196 210 10.1016/j.cej.2017.11.165 F. Galvanin, M. Sankar, S. Cattaneo, D. Bethell, V. Dua, G. J. Hutchings, A. Gavriilidis, On the development of kinetic models for solvent-free benzyl alcohol oxidation over a gold-palladium catalyst, Chem. Eng. J. 342 (2018) 196-210. https://doi.org/10.1016/j.cej.2017.11.165. [68] C. Hakanoglu J.A. Hinojosa Jr. J.F. Weaver Oxidation of methanol on a PdO(101) thin film J. Phys. Chem. C 115 2011 11575 11585 10.1021/jp201623a C. Hakanoglu, J. A. Hinojosa Jr, J. F. Weaver, Oxidation of methanol on a PdO(101) thin film, J. Phys. Chem. C 115 (2011) 11575-11585. https://doi.org/10.1021/jp201623a. [69] V.G. Reddy D. Jampaiah A. Chalkidis Y.M. Sabri E.L. Mayes S.K. Bhargava Highly dispersed cobalt oxide nanoparticles on manganese oxide nanotubes for aerobic oxidation of benzyl alcohol Catal. Commun. 130 2019 1 5 10.1016/j.catcom.2019.105763 V. G. Reddy, D. Jampaiah, A. Chalkidis, Y. M. Sabri, E. L. Mayes, S. K. Bhargava, Highly dispersed cobalt oxide nanoparticles on manganese oxide nanotubes for aerobic oxidation of benzyl alcohol, Catal. Commun. 130 (2019) 1-5. https://doi.org/10.1016/j.catcom.2019.105763. [70] S. Ampawa N. Krittametaporn T. Ungpittagul K. Phomphrai P. Sangtrirutnugul Triazole‐based ligands functionalized silica: effects of ligand denticity and donors on catalytic oxidation activity of Pd nanoparticles Appl. Organomet. Chem. 33 2019 5238 5250 10.1002/aoc.5238 S. Ampawa, N. Krittametaporn, T. Ungpittagul, K. Phomphrai, P. Sangtrirutnugul, Triazole‐based ligands functionalized silica: Effects of ligand denticity and donors on catalytic oxidation activity of Pd nanoparticles, Appl. Organomet. Chem. 33 (2019) 5238-5250. https://doi.org/10.1002/aoc.5238.",
      "scopus-id": "85091641971",
      "coredata": {
        "eid": "1-s2.0-S2468823120304909",
        "dc:description": "A heterogeneous catalyst for selective oxidation of benzyl alcohol (BzOH) was synthesized by immobilization of Pd nanoparticles (Pd NPs, 3 nm) on monodisperse-porous manganese oxide (MnOx, 4 μm) microspheres obtained by “staged shape templating protocol”. MnOx microspheres containing Mn5O8 (97 %) and MnO2 (78 %) phases were evaluated as supports. The catalysts carrying immobilized Pd NPs were also synthesized, using monodisperse-porous SiO2 and TiO2 microspheres with similar size and porous properties (i.e. Pd@SiO2 and Pd@TiO2). Pd NP decorated-Mn5O8 (Pd@Mn5O8) microspheres provided the highest catalytic activity with BzOH conversion of 92.2 % and benzaldehyde (BzCHO) selectivity of 96.3 %. Higher catalytic activity of Pd@Mn5O8 was explained by mixed valence nature of Mn5O8 microspheres assisting the formation of abundant oxygen vacancies. Mn (II), Mn(III) and Mn(IV) oxidation states were shown by deconvoluted x-ray photoelectron spectra. A synergistic catalytic activity was reported for the first time, by combination of Pd NPs with Mn5O8 microspheres. Pd@Mn5O8 microspheres could be reused up to 5 times without remarkable loss in the activity and selectivity towards BzCHO. A methodology for comparison of catalytic activity and synergistic interaction between active site and support was also exemplified by choosing a nanoparticle type and a monodisperse-porous microsphere type.",
        "openArchiveArticle": "false",
        "prism:coverDate": "2020-12-31",
        "openaccessUserLicense": null,
        "prism:aggregationType": "Journal",
        "prism:url": "https://api.elsevier.com/content/article/pii/S2468823120304909",
        "dc:creator": [
          {
            "@_fa": "true",
            "$": "Tosun, Rukiye Babacan"
          },
          {
            "@_fa": "true",
            "$": "Hamaloğlu, Kadriye Özlem"
          },
          {
            "@_fa": "true",
            "$": "Kavaklı, Pınar Akkaş"
          },
          {
            "@_fa": "true",
            "$": "Kavaklı, Cengiz"
          },
          {
            "@_fa": "true",
            "$": "Tuncel, Ali"
          }
        ],
        "link": [
          {
            "@_fa": "true",
            "@rel": "self",
            "@href": "https://api.elsevier.com/content/article/pii/S2468823120304909"
          },
          {
            "@_fa": "true",
            "@rel": "scidir",
            "@href": "https://www.sciencedirect.com/science/article/pii/S2468823120304909"
          }
        ],
        "dc:format": "application/json",
        "openaccessType": null,
        "pii": "S2468-8231(20)30490-9",
        "prism:volume": "497",
        "articleNumber": "111227",
        "prism:publisher": "Elsevier B.V.",
        "dc:title": "A synergistic catalyst based on a multivalence monodisperse-porous microspheres with oxygen vacancies for benzyl alcohol oxidation",
        "prism:copyright": "© 2020 Elsevier B.V. All rights reserved.",
        "openaccess": "0",
        "prism:issn": "24688231",
        "dcterms:subject": [
          {
            "@_fa": "true",
            "$": "Manganese oxide"
          },
          {
            "@_fa": "true",
            "$": "Silica"
          },
          {
            "@_fa": "true",
            "$": "Titania"
          },
          {
            "@_fa": "true",
            "$": "Porous microspheres"
          },
          {
            "@_fa": "true",
            "$": "Oxygen spillover"
          }
        ],
        "openaccessArticle": "false",
        "prism:publicationName": "Molecular Catalysis",
        "openaccessSponsorType": null,
        "prism:pageRange": "111227",
        "pubType": "fla",
        "prism:coverDisplayDate": "December 2020",
        "prism:doi": "10.1016/j.mcat.2020.111227",
        "prism:startingPage": "111227",
        "dc:identifier": "doi:10.1016/j.mcat.2020.111227",
        "openaccessSponsorName": null
      },
      "objects": {
        "object": [
          {
            "@category": "standard",
            "@height": "539",
            "@width": "340",
            "@_fa": "true",
            "$": "https://api.elsevier.com/content/object/eid/1-s2.0-S2468823120304909-gr1.jpg?httpAccept=%2A%2F%2A",
            "@multimediatype": "JPEG image file",
            "@type": "IMAGE-DOWNSAMPLED",
            "@size": "41992",
            "@ref": "gr1",
            "@mimetype": "image/jpeg"
          },
          {
            "@category": "standard",
            "@height": "252",
            "@width": "491",
            "@_fa": "true",
            "$": "https://api.elsevier.com/content/object/eid/1-s2.0-S2468823120304909-gr2.jpg?httpAccept=%2A%2F%2A",
            "@multimediatype": "JPEG image file",
            "@type": "IMAGE-DOWNSAMPLED",
            "@size": "25632",
            "@ref": "gr2",
            "@mimetype": "image/jpeg"
          },
          {
            "@category": "standard",
            "@height": "281",
            "@width": "566",
            "@_fa": "true",
            "$": "https://api.elsevier.com/content/object/eid/1-s2.0-S2468823120304909-gr3.jpg?httpAccept=%2A%2F%2A",
            "@multimediatype": "JPEG image file",
            "@type": "IMAGE-DOWNSAMPLED",
            "@size": "43999",
            "@ref": "gr3",
            "@mimetype": "image/jpeg"
          },
          {
            "@category": "standard",
            "@height": "315",
            "@width": "717",
            "@_fa": "true",
            "$": "https://api.elsevier.com/content/object/eid/1-s2.0-S2468823120304909-gr4.jpg?httpAccept=%2A%2F%2A",
            "@multimediatype": "JPEG image file",
            "@type": "IMAGE-DOWNSAMPLED",
            "@size": "75980",
            "@ref": "gr4",
            "@mimetype": "image/jpeg"
          },
          {
            "@category": "standard",
            "@height": "307",
            "@width": "717",
            "@_fa": "true",
            "$": "https://api.elsevier.com/content/object/eid/1-s2.0-S2468823120304909-gr5.jpg?httpAccept=%2A%2F%2A",
            "@multimediatype": "JPEG image file",
            "@type": "IMAGE-DOWNSAMPLED",
            "@size": "105164",
            "@ref": "gr5",
            "@mimetype": "image/jpeg"
          },
          {
            "@category": "standard",
            "@height": "223",
            "@width": "340",
            "@_fa": "true",
            "$": "https://api.elsevier.com/content/object/eid/1-s2.0-S2468823120304909-gr6.jpg?httpAccept=%2A%2F%2A",
            "@multimediatype": "JPEG image file",
            "@type": "IMAGE-DOWNSAMPLED",
            "@size": "21662",
            "@ref": "gr6",
            "@mimetype": "image/jpeg"
          },
          {
            "@category": "standard",
            "@height": "570",
            "@width": "566",
            "@_fa": "true",
            "$": "https://api.elsevier.com/content/object/eid/1-s2.0-S2468823120304909-gr7.jpg?httpAccept=%2A%2F%2A",
            "@multimediatype": "JPEG image file",
            "@type": "IMAGE-DOWNSAMPLED",
            "@size": "72361",
            "@ref": "gr7",
            "@mimetype": "image/jpeg"
          },
          {
            "@category": "standard",
            "@height": "172",
            "@width": "340",
            "@_fa": "true",
            "$": "https://api.elsevier.com/content/object/eid/1-s2.0-S2468823120304909-gr8.jpg?httpAccept=%2A%2F%2A",
            "@multimediatype": "JPEG image file",
            "@type": "IMAGE-DOWNSAMPLED",
            "@size": "15793",
            "@ref": "gr8",
            "@mimetype": "image/jpeg"
          },
          {
            "@category": "standard",
            "@height": "310",
            "@width": "566",
            "@_fa": "true",
            "$": "https://api.elsevier.com/content/object/eid/1-s2.0-S2468823120304909-gr9.jpg?httpAccept=%2A%2F%2A",
            "@multimediatype": "JPEG image file",
            "@type": "IMAGE-DOWNSAMPLED",
            "@size": "60941",
            "@ref": "gr9",
            "@mimetype": "image/jpeg"
          },
          {
            "@category": "standard",
            "@height": "173",
            "@width": "500",
            "@_fa": "true",
            "$": "https://api.elsevier.com/content/object/eid/1-s2.0-S2468823120304909-ga1.jpg?httpAccept=%2A%2F%2A",
            "@multimediatype": "JPEG image file",
            "@type": "IMAGE-DOWNSAMPLED",
            "@size": "31408",
            "@ref": "ga1",
            "@mimetype": "image/jpeg"
          },
          {
            "@category": "standard",
            "@height": "213",
            "@width": "340",
            "@_fa": "true",
            "$": "https://api.elsevier.com/content/object/eid/1-s2.0-S2468823120304909-gr12.jpg?httpAccept=%2A%2F%2A",
            "@multimediatype": "JPEG image file",
            "@type": "IMAGE-DOWNSAMPLED",
            "@size": "18898",
            "@ref": "gr12",
            "@mimetype": "image/jpeg"
          },
          {
            "@category": "standard",
            "@height": "430",
            "@width": "566",
            "@_fa": "true",
            "$": "https://api.elsevier.com/content/object/eid/1-s2.0-S2468823120304909-gr11.jpg?httpAccept=%2A%2F%2A",
            "@multimediatype": "JPEG image file",
            "@type": "IMAGE-DOWNSAMPLED",
            "@size": "60627",
            "@ref": "gr11",
            "@mimetype": "image/jpeg"
          },
          {
            "@category": "standard",
            "@height": "261",
            "@width": "491",
            "@_fa": "true",
            "$": "https://api.elsevier.com/content/object/eid/1-s2.0-S2468823120304909-gr10.jpg?httpAccept=%2A%2F%2A",
            "@multimediatype": "JPEG image file",
            "@type": "IMAGE-DOWNSAMPLED",
            "@size": "27529",
            "@ref": "gr10",
            "@mimetype": "image/jpeg"
          },
          {
            "@category": "thumbnail",
            "@height": "163",
            "@width": "103",
            "@_fa": "true",
            "$": "https://api.elsevier.com/content/object/eid/1-s2.0-S2468823120304909-gr1.sml?httpAccept=%2A%2F%2A",
            "@multimediatype": "GIF image file",
            "@type": "IMAGE-THUMBNAIL",
            "@size": "6091",
            "@ref": "gr1",
            "@mimetype": "image/gif"
          },
          {
            "@category": "thumbnail",
            "@height": "112",
            "@width": "219",
            "@_fa": "true",
            "$": "https://api.elsevier.com/content/object/eid/1-s2.0-S2468823120304909-gr2.sml?httpAccept=%2A%2F%2A",
            "@multimediatype": "GIF image file",
            "@type": "IMAGE-THUMBNAIL",
            "@size": "7012",
            "@ref": "gr2",
            "@mimetype": "image/gif"
          },
          {
            "@category": "thumbnail",
            "@height": "109",
            "@width": "219",
            "@_fa": "true",
            "$": "https://api.elsevier.com/content/object/eid/1-s2.0-S2468823120304909-gr3.sml?httpAccept=%2A%2F%2A",
            "@multimediatype": "GIF image file",
            "@type": "IMAGE-THUMBNAIL",
            "@size": "7350",
            "@ref": "gr3",
            "@mimetype": "image/gif"
          },
          {
            "@category": "thumbnail",
            "@height": "96",
            "@width": "219",
            "@_fa": "true",
            "$": "https://api.elsevier.com/content/object/eid/1-s2.0-S2468823120304909-gr4.sml?httpAccept=%2A%2F%2A",
            "@multimediatype": "GIF image file",
            "@type": "IMAGE-THUMBNAIL",
            "@size": "13548",
            "@ref": "gr4",
            "@mimetype": "image/gif"
          },
          {
            "@category": "thumbnail",
            "@height": "94",
            "@width": "219",
            "@_fa": "true",
            "$": "https://api.elsevier.com/content/object/eid/1-s2.0-S2468823120304909-gr5.sml?httpAccept=%2A%2F%2A",
            "@multimediatype": "GIF image file",
            "@type": "IMAGE-THUMBNAIL",
            "@size": "16667",
            "@ref": "gr5",
            "@mimetype": "image/gif"
          },
          {
            "@category": "thumbnail",
            "@height": "144",
            "@width": "219",
            "@_fa": "true",
            "$": "https://api.elsevier.com/content/object/eid/1-s2.0-S2468823120304909-gr6.sml?httpAccept=%2A%2F%2A",
            "@multimediatype": "GIF image file",
            "@type": "IMAGE-THUMBNAIL",
            "@size": "7917",
            "@ref": "gr6",
            "@mimetype": "image/gif"
          },
          {
            "@category": "thumbnail",
            "@height": "164",
            "@width": "163",
            "@_fa": "true",
            "$": "https://api.elsevier.com/content/object/eid/1-s2.0-S2468823120304909-gr7.sml?httpAccept=%2A%2F%2A",
            "@multimediatype": "GIF image file",
            "@type": "IMAGE-THUMBNAIL",
            "@size": "7418",
            "@ref": "gr7",
            "@mimetype": "image/gif"
          },
          {
            "@category": "thumbnail",
            "@height": "111",
            "@width": "219",
            "@_fa": "true",
            "$": "https://api.elsevier.com/content/object/eid/1-s2.0-S2468823120304909-gr8.sml?httpAccept=%2A%2F%2A",
            "@multimediatype": "GIF image file",
            "@type": "IMAGE-THUMBNAIL",
            "@size": "6338",
            "@ref": "gr8",
            "@mimetype": "image/gif"
          },
          {
            "@category": "thumbnail",
            "@height": "120",
            "@width": "219",
            "@_fa": "true",
            "$": "https://api.elsevier.com/content/object/eid/1-s2.0-S2468823120304909-gr9.sml?httpAccept=%2A%2F%2A",
            "@multimediatype": "GIF image file",
            "@type": "IMAGE-THUMBNAIL",
            "@size": "10681",
            "@ref": "gr9",
            "@mimetype": "image/gif"
          },
          {
            "@category": "thumbnail",
            "@height": "76",
            "@width": "219",
            "@_fa": "true",
            "$": "https://api.elsevier.com/content/object/eid/1-s2.0-S2468823120304909-ga1.sml?httpAccept=%2A%2F%2A",
            "@multimediatype": "GIF image file",
            "@type": "IMAGE-THUMBNAIL",
            "@size": "7801",
            "@ref": "ga1",
            "@mimetype": "image/gif"
          },
          {
            "@category": "thumbnail",
            "@height": "137",
            "@width": "219",
            "@_fa": "true",
            "$": "https://api.elsevier.com/content/object/eid/1-s2.0-S2468823120304909-gr12.sml?httpAccept=%2A%2F%2A",
            "@multimediatype": "GIF image file",
            "@type": "IMAGE-THUMBNAIL",
            "@size": "7542",
            "@ref": "gr12",
            "@mimetype": "image/gif"
          },
          {
            "@category": "thumbnail",
            "@height": "164",
            "@width": "216",
            "@_fa": "true",
            "$": "https://api.elsevier.com/content/object/eid/1-s2.0-S2468823120304909-gr11.sml?httpAccept=%2A%2F%2A",
            "@multimediatype": "GIF image file",
            "@type": "IMAGE-THUMBNAIL",
            "@size": "11297",
            "@ref": "gr11",
            "@mimetype": "image/gif"
          },
          {
            "@category": "thumbnail",
            "@height": "116",
            "@width": "219",
            "@_fa": "true",
            "$": "https://api.elsevier.com/content/object/eid/1-s2.0-S2468823120304909-gr10.sml?httpAccept=%2A%2F%2A",
            "@multimediatype": "GIF image file",
            "@type": "IMAGE-THUMBNAIL",
            "@size": "7910",
            "@ref": "gr10",
            "@mimetype": "image/gif"
          },
          {
            "@category": "standard",
            "@_fa": "true",
            "$": "https://api.elsevier.com/content/object/eid/1-s2.0-S2468823120304909-mmc1.docx?httpAccept=%2A%2F%2A",
            "@multimediatype": "Microsoft Word file",
            "@type": "APPLICATION",
            "@size": "664736",
            "@ref": "mmc1",
            "@mimetype": "application/word"
          },
          {
            "@category": "thumbnail",
            "@_fa": "true",
            "$": "https://api.elsevier.com/content/object/eid/1-s2.0-S2468823120304909-si1.svg?httpAccept=%2A%2F%2A",
            "@multimediatype": "Scalable Vector Graphics file",
            "@type": "ALTIMG",
            "@size": "27368",
            "@ref": "si1",
            "@mimetype": "image/svg+xml"
          },
          {
            "@category": "thumbnail",
            "@_fa": "true",
            "$": "https://api.elsevier.com/content/object/eid/1-s2.0-S2468823120304909-si2.svg?httpAccept=%2A%2F%2A",
            "@multimediatype": "Scalable Vector Graphics file",
            "@type": "ALTIMG",
            "@size": "30391",
            "@ref": "si2",
            "@mimetype": "image/svg+xml"
          },
          {
            "@category": "standard",
            "@_fa": "true",
            "$": "https://api.elsevier.com/content/object/eid/1-s2.0-S2468823120304909-am.pdf?httpAccept=%2A%2F%2A",
            "@multimediatype": "Acrobat PDF file",
            "@type": "AAM-PDF",
            "@size": "8626624",
            "@ref": "am",
            "@mimetype": "application/pdf"
          }
        ]
      },
      "link": {
        "@rel": "abstract",
        "@href": "https://api.elsevier.com/content/abstract/scopus_id/85091641971"
      }
    }
  }
}