{
  "metadata": {
    "title": "Promotional effect of surface fluorine species on CeO<ce:inf loc=post>2</ce:inf> catalyst for toluene oxidation",
    "authors": "; ; ",
    "journal": "Molecular Catalysis",
    "date": "2021-08-31",
    "doi": "10.1016/j.mcat.2021.111771",
    "abstract": "",
    "uri": "https://api.elsevier.com/content/article/pii/S2468823121003886",
    "pii": "S2468823121003886"
  },
  "fulltext": {
    "full-text-retrieval-response": {
      "scopus-eid": "2-s2.0-85111309526",
      "originalText": "serial JL 315758 291210 291744 291790 291809 31 Molecular Catalysis MOLECULARCATALYSIS 2021-07-29 2021-07-29 2021-07-29 2021-07-29 2021-08-16T15:55:31 1-s2.0-S2468823121003886 S2468-8231(21)00388-6 S2468823121003886 10.1016/j.mcat.2021.111771 S300 S300.1 FULL-TEXT 1-s2.0-S2468823121X00120 2022-12-12T23:36:21.627889Z 0 0 20210801 20210831 2021 2021-07-29T17:21:22.491116Z absattachment articleinfo articlenumber articletitlenorm authfirstinitialnorm authfirstsurnamenorm cid cids contenttype copyright crossmark dateloaded dateloadedtxt datesearch datesort dateupdated dco docsubtype doctype doi eid ewtransactionid hubeid indexeddate issn issnnorm itemstage itemtransactionid itemweight openaccess openarchive pg pgfirst pii piinorm pubdateend pubdatestart pubdatetxt pubyr sectiontitle sortorder srctitle srctitlenorm srctype ssids alllist content subj subheadings suppl tomb volfirst volissue volumelist webpdf webpdfpagecount yearnav figure table e-component body acknowledge affil appendices articletitle auth authfirstini authfull authkeywords authlast footnotes grantnumber grantsponsor grantsponsorid highlightsabst primabst ref specialabst 2468-8231 24688231 true 512 512 C Volume 512 10 111771 111771 111771 202108 August 2021 2021-08-01 2021-08-31 2021 Regular Papers article fla © 2021 Elsevier B.V. All rights reserved. PROMOTIONALEFFECTSURFACEFLUORINESPECIESCEO2CATALYSTFORTOLUENEOXIDATION YANG B 1 Introduction 2 Experimental 2.1 Preparation of catalysts 2.2 Characterization, catalyst evaluation and DFT calculation 3 Results and discussion 3.1 Catalytic performance 3.2 Structural analysis 3.3 Surface properties analysis 3.4 Stability and water effect on F3-Ce 3.5 Possible promotional mechanism analysis 4 Conclusion CRediT authorship contribution statement Acknowledgements Appendix Supplementary materials References LIOTTA 2010 403 412 L BARI 2018 627 640 M LI 2014 5158 5164 X WU 2016 332 337 C ZHU 2017 97 105 X SANTOS 2009 550 556 V CHEN 2014 101 112 X BAOJUAN 2016 53852 53859 D ZHOU 2018 162 172 Y ALVAREZGALVAN 2003 223 228 M SCIRE 2003 43 49 S MADRONICH 2014 395 397 S KIM 2002 285 299 S LYU 2020 116610 Y SCIRE 2010 109 117 S KONSOLAKIS 2013 512 521 M KIM 2010 180 185 S SOLSONA 2011 271 278 B MAI 2005 24380 24385 H ZHOU 2005 206 212 K LIU 2016 188 198 S TSONCHEVA 2010 523 530 T PENG 2016 1234 1246 R WANG 2017 12845 L FENG 2018 145 153 X LIOTTA 2008 81 88 L SOLSONA 2017 B VENKATASWAMY 2014 1 10 P TANG 2006 265 273 X YOU 2018 47 54 Y HWANG 2011 9685 9693 K WANG 2020 Q DENG 2016 120 128 Z LI 2020 505 X WANG 2020 492 P LI 2021 549 Z ZHANG 2021 125266 M WU 2010 16595 16606 Z WANG 2017 679 692 B LI 2005 579 584 D WU 2011 368 373 Y ZHANG 2016 7151 7162 Z BECHE 2008 264 267 E DUTTA 2006 5144 5146 P LIN 2018 91 102 X CHEN 2018 469 479 X LIAO 2013 220 228 Y ZENG 2021 124088 Y OZORIO 2020 14099 14108 M TANG 2009 084204 W HU 2018 425 434 F ZENG 2020 49 55 Y HUANG 2014 96 105 H YU 2011 111 119 L HUANG 2020 2473 2483 F ZENG 2020 135635 Y LYU 2020 262 Y HU 2019 329 336 F YANGX2021X111771 YANGX2021X111771XB 2023-07-29T00:00:00.000Z 2023-07-29T00:00:00.000Z http://creativecommons.org/licenses/by-nc-nd/4.0/ © 2021 Elsevier B.V. All rights reserved. 2021-08-01T15:19:28.549Z http://vtw.elsevier.com/data/voc/AddOnTypes/50.7/aggregated-refined China-Finland Industrial R&D Program BZ2018015 Key Project of Jiangsu Province Programs for Research and Development BE2019115 Top-notch Academic Programs Project of Jiangsu Higher Education Institutions ChangZhou University CZU Changzhou University http://data.elsevier.com/vocabulary/SciValFunders/501100006711 http://sws.geonames.org/1814991/ Fundamental Research Funds for the Central Universities 30919011220 Fundamental Research Funds for the Central Universities http://data.elsevier.com/vocabulary/SciValFunders/501100012226 http://sws.geonames.org/1814991/ ChangZhou Science and Technology Support Program CE20195022 Advanced Catalysis and Green manufacturing Collaborative Innovation Center Advanced Catalysis and Green Manufacturing Collaborative Innovation Center, Changzhou University http://data.elsevier.com/vocabulary/SciValFunders/501100018922 http://sws.geonames.org/1814991/ This work was financially supported by the Key Project of Jiangsu Province Programs for Research and Development ( BE2019115 ), the Fundamental Research Funds for the Central Universities ( 30919011220 ), Top-notch Academic Programs Project of Jiangsu Higher Education Institutions , China-Finland Industrial R&D Program (No. BZ2018015 ), China-Finland Industrial R&D Program (No. BZ2018015 ), ChangZhou Science and Technology Support Program ( CE20195022 ) and Advanced Catalysis and Green manufacturing Collaborative Innovation Center, ChangZhou University. https://doi.org/10.15223/policy-017 https://doi.org/10.15223/policy-037 https://doi.org/10.15223/policy-012 https://doi.org/10.15223/policy-029 https://doi.org/10.15223/policy-004 item S2468-8231(21)00388-6 S2468823121003886 1-s2.0-S2468823121003886 10.1016/j.mcat.2021.111771 315758 2021-08-16T15:19:23.50958Z 2021-08-01 2021-08-31 1-s2.0-S2468823121003886-main.pdf https://s3-eu-west-1.amazonaws.com/prod-ucs-content-store-eu-west/content/pii:S2468823121003886/MAIN/application/pdf/209ff94bf466bf8d7e2136c14d7d4b00/main.pdf main.pdf pdf true 4731270 MAIN 8 1-s2.0-S2468823121003886-main_1.png https://s3-eu-west-1.amazonaws.com/prod-ucs-content-store-eu-west/content/pii:S2468823121003886/PREVIEW/image/png/42c6b782ee3f90eb32e8188c73610d34/main_1.png main_1.png png 58589 849 656 IMAGE-WEB-PDF 1 1-s2.0-S2468823121003886-gr3.jpg https://s3-eu-west-1.amazonaws.com/prod-ucs-content-store-eu-west/content/pii:S2468823121003886/gr3/DOWNSAMPLED/image/jpeg/751df601e588f9df84fe5d23d5d9962c/gr3.jpg gr3 gr3.jpg jpg 28142 269 339 IMAGE-DOWNSAMPLED 1-s2.0-S2468823121003886-gr2.jpg https://s3-eu-west-1.amazonaws.com/prod-ucs-content-store-eu-west/content/pii:S2468823121003886/gr2/DOWNSAMPLED/image/jpeg/3a722a8f259dfc053b714c5437828a2a/gr2.jpg gr2 gr2.jpg jpg 26562 269 339 IMAGE-DOWNSAMPLED 1-s2.0-S2468823121003886-gr1.jpg https://s3-eu-west-1.amazonaws.com/prod-ucs-content-store-eu-west/content/pii:S2468823121003886/gr1/DOWNSAMPLED/image/jpeg/c719520c51d3191bc38a3828369386bc/gr1.jpg gr1 gr1.jpg jpg 27987 270 339 IMAGE-DOWNSAMPLED 1-s2.0-S2468823121003886-gr11.jpg https://s3-eu-west-1.amazonaws.com/prod-ucs-content-store-eu-west/content/pii:S2468823121003886/gr11/DOWNSAMPLED/image/jpeg/f14532dd983292f4bbede7a987cfefb9/gr11.jpg gr11 gr11.jpg jpg 26694 224 565 IMAGE-DOWNSAMPLED 1-s2.0-S2468823121003886-gr12.jpg https://s3-eu-west-1.amazonaws.com/prod-ucs-content-store-eu-west/content/pii:S2468823121003886/gr12/DOWNSAMPLED/image/jpeg/8a105a1273ee0f5f5e2cc55e161da3d4/gr12.jpg gr12 gr12.jpg jpg 21877 137 339 IMAGE-DOWNSAMPLED 1-s2.0-S2468823121003886-gr10.jpg https://s3-eu-west-1.amazonaws.com/prod-ucs-content-store-eu-west/content/pii:S2468823121003886/gr10/DOWNSAMPLED/image/jpeg/967d57f72345e72046ac0bebefa9c085/gr10.jpg gr10 gr10.jpg jpg 34552 269 339 IMAGE-DOWNSAMPLED 1-s2.0-S2468823121003886-gr9.jpg https://s3-eu-west-1.amazonaws.com/prod-ucs-content-store-eu-west/content/pii:S2468823121003886/gr9/DOWNSAMPLED/image/jpeg/3dc18a2fd8e88c835d182dda78c8bcb9/gr9.jpg gr9 gr9.jpg jpg 59785 229 565 IMAGE-DOWNSAMPLED 1-s2.0-S2468823121003886-gr8.jpg https://s3-eu-west-1.amazonaws.com/prod-ucs-content-store-eu-west/content/pii:S2468823121003886/gr8/DOWNSAMPLED/image/jpeg/31d848275c0e2de50540e56a7b0c04a2/gr8.jpg gr8 gr8.jpg jpg 28135 270 339 IMAGE-DOWNSAMPLED 1-s2.0-S2468823121003886-gr7.jpg https://s3-eu-west-1.amazonaws.com/prod-ucs-content-store-eu-west/content/pii:S2468823121003886/gr7/DOWNSAMPLED/image/jpeg/e2a03acc6bf1ffdcb09f5e8d272644d6/gr7.jpg gr7 gr7.jpg jpg 33411 270 339 IMAGE-DOWNSAMPLED 1-s2.0-S2468823121003886-gr6.jpg https://s3-eu-west-1.amazonaws.com/prod-ucs-content-store-eu-west/content/pii:S2468823121003886/gr6/DOWNSAMPLED/image/jpeg/09f3ce81a27ba4e7e7f84c1733db2c9b/gr6.jpg gr6 gr6.jpg jpg 108617 271 565 IMAGE-DOWNSAMPLED 1-s2.0-S2468823121003886-gr5.jpg https://s3-eu-west-1.amazonaws.com/prod-ucs-content-store-eu-west/content/pii:S2468823121003886/gr5/DOWNSAMPLED/image/jpeg/796e77795dbdf3db3de95be798901c58/gr5.jpg gr5 gr5.jpg jpg 22660 260 339 IMAGE-DOWNSAMPLED 1-s2.0-S2468823121003886-gr4.jpg https://s3-eu-west-1.amazonaws.com/prod-ucs-content-store-eu-west/content/pii:S2468823121003886/gr4/DOWNSAMPLED/image/jpeg/65fa2ec846026d1acbfcc83038b7e874/gr4.jpg gr4 gr4.jpg jpg 73579 469 565 IMAGE-DOWNSAMPLED 1-s2.0-S2468823121003886-ga1.jpg https://s3-eu-west-1.amazonaws.com/prod-ucs-content-store-eu-west/content/pii:S2468823121003886/ga1/DOWNSAMPLED/image/jpeg/b0a11236dca1317adafc0cdb4e1f69c4/ga1.jpg ga1 true ga1.jpg jpg 34721 171 301 IMAGE-DOWNSAMPLED 1-s2.0-S2468823121003886-gr3.sml https://s3-eu-west-1.amazonaws.com/prod-ucs-content-store-eu-west/content/pii:S2468823121003886/gr3/THUMBNAIL/image/gif/26dea738affaf3ae0db35860596c9203/gr3.sml gr3 gr3.sml sml 11199 164 206 IMAGE-THUMBNAIL 1-s2.0-S2468823121003886-gr2.sml https://s3-eu-west-1.amazonaws.com/prod-ucs-content-store-eu-west/content/pii:S2468823121003886/gr2/THUMBNAIL/image/gif/59ff43626fa5423301e85b07de32d18c/gr2.sml gr2 gr2.sml sml 10144 164 206 IMAGE-THUMBNAIL 1-s2.0-S2468823121003886-gr1.sml https://s3-eu-west-1.amazonaws.com/prod-ucs-content-store-eu-west/content/pii:S2468823121003886/gr1/THUMBNAIL/image/gif/76c177f12816f85e0a1edf81c3a9d7b6/gr1.sml gr1 gr1.sml sml 10732 164 206 IMAGE-THUMBNAIL 1-s2.0-S2468823121003886-gr11.sml https://s3-eu-west-1.amazonaws.com/prod-ucs-content-store-eu-west/content/pii:S2468823121003886/gr11/THUMBNAIL/image/gif/c1cb0f45f05081c7b35c4ab35cbddce5/gr11.sml gr11 gr11.sml sml 6613 87 219 IMAGE-THUMBNAIL 1-s2.0-S2468823121003886-gr12.sml https://s3-eu-west-1.amazonaws.com/prod-ucs-content-store-eu-west/content/pii:S2468823121003886/gr12/THUMBNAIL/image/gif/40ebce77740206261779ede1040cc571/gr12.sml gr12 gr12.sml sml 11202 88 219 IMAGE-THUMBNAIL 1-s2.0-S2468823121003886-gr10.sml https://s3-eu-west-1.amazonaws.com/prod-ucs-content-store-eu-west/content/pii:S2468823121003886/gr10/THUMBNAIL/image/gif/0029f92accc6902c77baea9736b10460/gr10.sml gr10 gr10.sml sml 11209 164 206 IMAGE-THUMBNAIL 1-s2.0-S2468823121003886-gr9.sml https://s3-eu-west-1.amazonaws.com/prod-ucs-content-store-eu-west/content/pii:S2468823121003886/gr9/THUMBNAIL/image/gif/baf4b1c305ebe37e669be5a70fcc6c03/gr9.sml gr9 gr9.sml sml 9739 89 219 IMAGE-THUMBNAIL 1-s2.0-S2468823121003886-gr8.sml https://s3-eu-west-1.amazonaws.com/prod-ucs-content-store-eu-west/content/pii:S2468823121003886/gr8/THUMBNAIL/image/gif/f23de73bcf2cb592d71f4421177d9345/gr8.sml gr8 gr8.sml sml 10898 164 206 IMAGE-THUMBNAIL 1-s2.0-S2468823121003886-gr7.sml https://s3-eu-west-1.amazonaws.com/prod-ucs-content-store-eu-west/content/pii:S2468823121003886/gr7/THUMBNAIL/image/gif/849af32d1b677043e920a18ff80b69f8/gr7.sml gr7 gr7.sml sml 12455 164 206 IMAGE-THUMBNAIL 1-s2.0-S2468823121003886-gr6.sml https://s3-eu-west-1.amazonaws.com/prod-ucs-content-store-eu-west/content/pii:S2468823121003886/gr6/THUMBNAIL/image/gif/ad7b5906c125545fb92e7ea3e85a6c9f/gr6.sml gr6 gr6.sml sml 21303 105 219 IMAGE-THUMBNAIL 1-s2.0-S2468823121003886-gr5.sml https://s3-eu-west-1.amazonaws.com/prod-ucs-content-store-eu-west/content/pii:S2468823121003886/gr5/THUMBNAIL/image/gif/39406d6a12a59b5f1640f7a1c583c7e5/gr5.sml gr5 gr5.sml sml 9902 164 214 IMAGE-THUMBNAIL 1-s2.0-S2468823121003886-gr4.sml https://s3-eu-west-1.amazonaws.com/prod-ucs-content-store-eu-west/content/pii:S2468823121003886/gr4/THUMBNAIL/image/gif/b26e3b8b27d4c70be927aac9bc38ee38/gr4.sml gr4 gr4.sml sml 12726 164 197 IMAGE-THUMBNAIL 1-s2.0-S2468823121003886-ga1.sml https://s3-eu-west-1.amazonaws.com/prod-ucs-content-store-eu-west/content/pii:S2468823121003886/ga1/THUMBNAIL/image/gif/8c453a67f2af8984688e625349891fec/ga1.sml ga1 true ga1.sml sml 13446 124 219 IMAGE-THUMBNAIL 1-s2.0-S2468823121003886-gr3_lrg.jpg https://s3-eu-west-1.amazonaws.com/prod-ucs-content-store-eu-west/content/pii:S2468823121003886/gr3/HIGHRES/image/jpeg/81f2b7417bb5011e4732334594881eab/gr3_lrg.jpg gr3 gr3_lrg.jpg jpg 195778 1192 1500 IMAGE-HIGH-RES 1-s2.0-S2468823121003886-gr2_lrg.jpg https://s3-eu-west-1.amazonaws.com/prod-ucs-content-store-eu-west/content/pii:S2468823121003886/gr2/HIGHRES/image/jpeg/d45b70cbe81e02f894b542c0ad1535b7/gr2_lrg.jpg gr2 gr2_lrg.jpg jpg 174355 1192 1500 IMAGE-HIGH-RES 1-s2.0-S2468823121003886-gr1_lrg.jpg https://s3-eu-west-1.amazonaws.com/prod-ucs-content-store-eu-west/content/pii:S2468823121003886/gr1/HIGHRES/image/jpeg/293813120affbd6a0e665886240f4b08/gr1_lrg.jpg gr1 gr1_lrg.jpg jpg 185316 1193 1500 IMAGE-HIGH-RES 1-s2.0-S2468823121003886-gr11_lrg.jpg https://s3-eu-west-1.amazonaws.com/prod-ucs-content-store-eu-west/content/pii:S2468823121003886/gr11/HIGHRES/image/jpeg/09df7aef2371c9fc87d78cbae29298eb/gr11_lrg.jpg gr11 gr11_lrg.jpg jpg 197742 993 2500 IMAGE-HIGH-RES 1-s2.0-S2468823121003886-gr12_lrg.jpg https://s3-eu-west-1.amazonaws.com/prod-ucs-content-store-eu-west/content/pii:S2468823121003886/gr12/HIGHRES/image/jpeg/f4eb2e650dbc7b6f865df036dc8544ce/gr12_lrg.jpg gr12 gr12_lrg.jpg jpg 152493 604 1500 IMAGE-HIGH-RES 1-s2.0-S2468823121003886-gr10_lrg.jpg https://s3-eu-west-1.amazonaws.com/prod-ucs-content-store-eu-west/content/pii:S2468823121003886/gr10/HIGHRES/image/jpeg/cd0ae3da9734851800bd4aad03a3873f/gr10_lrg.jpg gr10 gr10_lrg.jpg jpg 218763 1192 1500 IMAGE-HIGH-RES 1-s2.0-S2468823121003886-gr9_lrg.jpg https://s3-eu-west-1.amazonaws.com/prod-ucs-content-store-eu-west/content/pii:S2468823121003886/gr9/HIGHRES/image/jpeg/e935cd79540c5caceb898d34c4587dd1/gr9_lrg.jpg gr9 gr9_lrg.jpg jpg 762955 1014 2500 IMAGE-HIGH-RES 1-s2.0-S2468823121003886-gr8_lrg.jpg https://s3-eu-west-1.amazonaws.com/prod-ucs-content-store-eu-west/content/pii:S2468823121003886/gr8/HIGHRES/image/jpeg/3c1c5f6df88027a5bf3e09489cbc96d8/gr8_lrg.jpg gr8 gr8_lrg.jpg jpg 181838 1193 1500 IMAGE-HIGH-RES 1-s2.0-S2468823121003886-gr7_lrg.jpg https://s3-eu-west-1.amazonaws.com/prod-ucs-content-store-eu-west/content/pii:S2468823121003886/gr7/HIGHRES/image/jpeg/929cf6a022f9814195882a11979e7123/gr7_lrg.jpg gr7 gr7_lrg.jpg jpg 226490 1193 1500 IMAGE-HIGH-RES 1-s2.0-S2468823121003886-gr6_lrg.jpg https://s3-eu-west-1.amazonaws.com/prod-ucs-content-store-eu-west/content/pii:S2468823121003886/gr6/HIGHRES/image/jpeg/8dfb693da94af445490932a63102d736/gr6_lrg.jpg gr6 gr6_lrg.jpg jpg 786791 1201 2500 IMAGE-HIGH-RES 1-s2.0-S2468823121003886-gr5_lrg.jpg https://s3-eu-west-1.amazonaws.com/prod-ucs-content-store-eu-west/content/pii:S2468823121003886/gr5/HIGHRES/image/jpeg/be66b2beaa9436bf41c7a3c1c47465c0/gr5_lrg.jpg gr5 gr5_lrg.jpg jpg 146696 1149 1500 IMAGE-HIGH-RES 1-s2.0-S2468823121003886-gr4_lrg.jpg https://s3-eu-west-1.amazonaws.com/prod-ucs-content-store-eu-west/content/pii:S2468823121003886/gr4/HIGHRES/image/jpeg/a698b4af50d4033223eef3201c7056c0/gr4_lrg.jpg gr4 gr4_lrg.jpg jpg 554478 2075 2500 IMAGE-HIGH-RES 1-s2.0-S2468823121003886-ga1_lrg.jpg https://s3-eu-west-1.amazonaws.com/prod-ucs-content-store-eu-west/content/pii:S2468823121003886/ga1/HIGHRES/image/jpeg/b06fd011faa270fb92e81f8526564892/ga1_lrg.jpg ga1 true ga1_lrg.jpg jpg 210174 757 1333 IMAGE-HIGH-RES 1-s2.0-S2468823121003886-mmc1.docx https://s3-eu-west-1.amazonaws.com/prod-ucs-content-store-eu-west/content/pii:S2468823121003886/mmc1/MAIN/application/vnd.openxmlformats-officedocument.wordprocessingml.document/5190cb2223b4cc8f103d16ab488930d6/mmc1.docx mmc1 mmc1.docx docx 3640852 APPLICATION 1-s2.0-S2468823121003886-am.pdf https://s3-eu-west-1.amazonaws.com/prod-ucs-content-store-eu-west/content/egi:104KDNQT919/MAIN/application/pdf/96525e50ae1996eeab61877928a49db7/am.pdf am am.pdf pdf false 3847649 AAM-PDF MCAT 111771 111771 S2468-8231(21)00388-6 10.1016/j.mcat.2021.111771 Fig. 1 Toluene conversion on CeO2 and Fx-Ce. Fig 1 Fig. 2 XRD patterns of CeO2 and Fx-Ce. Fig 2 Fig. 3 Raman spectra of all catalysts. Fig 3 Fig. 4 XPS spectra (a: F 1s, b: Ce 3d, c: O 1s) for CeO2, F3-Ce and F3-Ce-u (obtained by stability test of F3-Ce at 340 °C for 50 h). Fig 4 Fig. 5 XRD patterns of F3-Ce and F3-Ce-u (obtained by stability test of F3-Ce at 340 °C for 50 h). Fig 5 Fig. 6 The surface of CeO2 (111) (a), surface-F-CeO2 (111) (b), lattice-F-CeO2 (111) (c), CeO2 (111) with an oxygen vacancy (d), surface-F-CeO2 (111) with an oxygen vacancy (e) and lattice-F-CeO2 (111) with an oxygen vacancy (f). Fig 6 Fig. 7 The bader charge difference of surface-F-CeO2 (111) and CeO2 (111) (a), lattice-F-CeO2 (111) and CeO2 (111) (b). Fig 7 Fig. 8 H2-TPR profiles of CeO2 and Fx-Ce. Fig 8 Fig. 9 O2-TPD profiles (a) and O2-TPD peak area (b) of CeO2 and Fx-Ce. Fig 9 Fig. 10 Toluene-TPD profiles of CeO2 and Fx-Ce. Fig 10 Fig. 11 The long period stability testing of F3-Ce (a) and effect of water (5%) on F3-Ce (b) with toluene = 1000 ppm and WHSV = 75,000 mL/(g h). Fig 11 Fig. 12 Possible promotional mechanism of toluene on F3-Ce. Fig 12 Table 1 Raman analyses, pore structures and H2-TPR peak area of all catalysts. Table 1 Catalysts ID/IF2g (‰) BET (m2/g) V (cm3/g) D (nm) H2-TPR peak area CeO2 24.41 50 0.11 8.88 0.53 F1-Ce 26.28 52 0.10 8.05 0.58 F3-Ce 29.79 56 0.13 9.27 0.70 F5-Ce 23.70 38 0.10 9.31 0.50 Table 2 XPS data of the CeO2, F3-Ce and F3-Ce-u catalysts. Table 2 Catalysts Ce (%) O (%) F (%) Ce3+/Ce3++Ce4+ (%) Oα/Oα+Oβ (%) CeO2 15.58 84.42 - 24.35 27.83 F3-Ce 17.21 81.48 1.31 27.71 33.81 F3-Ce-u 15.76 82.80 1.44 25.83 30.53 Promotional effect of surface fluorine species on CeO2 catalyst for toluene oxidation Bin Yang Conceptualization Data curation Methodology Validation Writing – original draft a 1 Mingjia Zhang Conceptualization Data curation Methodology Validation Writing – original draft a 1 Yiqing Zeng Conceptualization Methodology Writing – review & editing a Fanyu Meng Conceptualization Methodology Writing – review & editing a Jiangquan Ma Methodology Writing – review & editing b Shule Zhang Funding acquisition Project administration Resources Supervision a ⁎ Qin Zhong Funding acquisition Project administration Resources Supervision a ⁎ a School of Chemistry and Chemical Engineering, Nanjing University of Science and Technology, Nanjing 210094, PR China School of Chemistry and Chemical Engineering Nanjing University of Science and Technology Nanjing 210094 PR China aSchool of Chemistry and Chemical Engineering, Nanjing University of Science and Technology, Nanjing 210094, PR China b Jiangsu Province Advanced Catalysis and Green Manufacturing Collaborative Innovation Ceter, Changzhou University, Changzhou, Jiangsu Province 213164, PR China Jiangsu Province Advanced Catalysis and Green Manufacturing Collaborative Innovation Ceter Changzhou University Changzhou Jiangsu Province 213164 PR China bJiangsu Province Advanced Catalysis and Green Manufacturing Collaborative Innovation Ceter, Changzhou University, Changzhou, Jiangsu Province 213164, PR China ⁎ Corresponding authors. 1 These authors contributed equally to this work. In this study, fluorine (F) modified cerium oxide (Fx-Ce) catalysts were prepared by co-precipitation method to investigate the impact of fluorine species on CeO2 catalyst for toluene oxidation. Compared to bared CeO2, the catalysis activity of Fx-Ce was further improved. The temperature of toluene conversion (T90% and T50%) for F3-Ce decreased by ΔT90% = 30°C and ΔT50% = 15°C, respectively. The characterizations of H2-TPR, O2-TPD, Raman, XPS certified that there was more chemisorbed oxygen, oxygen vacancies and Ce3+ ions on the F3-Ce than bared CeO2. DFT calculations demonstrated that the formation energy of oxygen vacancy on F3-Ce is reduced by surface-florine, which promotes the formation of oxygen vacancy. Meanwhile, Toluene-TPD indicated that fluorine-doping increased the adsorption capacity of toluene on CeO2. According to the above-mentioned results, F3-Ce has higher oxygen vacancy concentration, more active oxygen, and larger toluene adsorption capacity. Thus it has the optimal catalytic activity for toluene oxidation. Graphical abstract Image, graphical abstract Keywords Fluorine modified Surface fluorine Formation energy Toluene oxidation 1 Introduction Volatile organic compounds (VOCs) have posed an enormous threat to both the environment and human health [1,2]. Over the years, many techniques have been developed to eliminate VOCs, including catalytic oxidation, plasma decomposition, adsorption, incineration, absorption, etc. [3–5]. Among these techniques, catalytic oxidation is an energy-efficient and well-established technique that can reduce VOCs emissions without secondary pollution [6–9]. Noble metal (such as Pt, Pd, Ag) based catalysts have been widely used during the past decades and have an excellent low temperature activity for VOCs oxidation [10–12]. However, the disadvantages of this technology such as high cost, low stability, and the catalysts were easily poisoned by chlorine and sulfur limit the potential of broader application [13]. Due to the low cost, high stability and activity for VOCs oxidation, transition metal oxide catalysts are considered as the most potential catalysts [14]. More recently, various transition metal oxides were designed for VOCs oxidation, such as cerium-based [15], copper-based [16], manganese-based [17], and nickel-based catalysts [18]. Among them, CeO2 has always exhibited excellent performance for VOCs oxidation since its high oxygen mobility, excellent redox potential of the Ce4+/Ce3+ couple and electron-hole exchange interaction [19–21]. However, since the limitations of self-structure and physicochemical properties, bared CeO2 exhibits unsatisfactory performance in medium-low temperature range for the degradation of toluene [22–24]. The methods of metallic element modification [25] or developing novel preparation methods (co-precipitation method [26], impregnation method [27], and so on) are used to further improve the catalytic activity of CeO2. Reddy et al. [28] reported that Ce0.7Mn0.3O2–δ catalysts had higher concentration of oxygen defects and active oxygen than CeO2, which is a primary factor of better catalytic performance. Shen et al. [29] found that MnOx–CeO2 catalyst synthesized by the modified co-precipitation method had more active oxygen and Mn4+ species than the catalysts obtained by sol-gel method, leading to a better catalytic performance for formaldehyde oxidation. Meanwhile, non-metal modification has also used to enhance the catalytic performance and has made considerable progress. You et al. [30] obtained Ce10Px/Ti catalysts by impregnation method. The result revealed that phosphorus-doping enhances the concentration of Ce3+ and chemisorbed oxygen, which promotes the transfer of surface oxygen and the regeneration of active sites. Hwang et al. [31] synthesized Si-modified CeO2 by co-precipitation method and claimed that SiCe catalyst was mainly attributed to the larger specific surface area, increase of oxygen vacancy and chemisorbed oxygen for the more Ce3+, which was improved by the addition of silicon. As is known to all, fluorine can facilitate electronic and structural properties of catalysts due to its strong electronegativity. For example, Wang et al. [32] prepared F-doped TiO2 catalysts by sol-gel method. They found both surface and lattice fluorine exist on the catalyst. The surface fluorine adsorbed on the surface of TiO2 in the form of Ti–F can generate more •OH radicals. The lattice fluorine replace the oxygen atoms of TiO2 to generate oxygen vacancies and Ti3+ by the charge compensation effect ((1-x)TiO2 + xF− → Ti3+ xTi4+ 1-xO2− 2-xF− x + x/2O2−). Deng et al. [33] obtained CeTiF catalysts by co-precipitation method. The result revealed that fluorine atom replaces the O in Ce–O–Ti or Ti–O–Ti bonds to produce more oxygen vacancies, and improve the specific surface area and redox property. Based on the above research, we are curious about the effect of fluoride on CeO2 for the oxidation of VOCs, and there are few reports on this aspect. Hence, we aim at developing a novel catalyst for VOCs oxidation, and further study the underlying mechanism of F on CeO2. In this study, fluorine (F) modified cerium oxide (Fx-Ce) catalysts with different amount of F were synthesized by co-precipitation method, and employed for toluene oxidation. The characterizations of XRD, BET, SEM, Raman, XPS, H2-TPR, O2-TPD, Toluene-TPD and DFT calculation were utilized to analyze the catalysts. Meanwhile, the stability tests were conducted on the best Fx-Ce catalyst to evaluate its feasibility for VOCs oxidation. This paper aims to study the effect of fluorine on the structure and catalytic performance of Fx-Ce. We expect this study could provide some inspiration in the design of Ce-based catalysts. 2 Experimental 2.1 Preparation of catalysts Bared CeO2 and F-modified CeO2 catalysts are prepared by co-precipitation method. Specifically, 0.01 mol Ce(NO3)3•6H2O and a certain amount of NH4F (molar ratio of F/Ce = 0.01, 0.03 and 0.05) were dissolved into 100 ml deionized water. Subsequently, NH3•H2O was dropped into the mixture until pH = 10 and stirred for 2 h. Then, the solution was filtrated and washed for three times with deionized water. Finally, the Fx-Ce (x = 0.01, 0.03 and 0.05) catalysts were obtained by drying under vacuum at 110°C and calcining at 400°C for 4 h. As a comparison, pure CeO2 is obtained using the same method in the absence of NH4F. F3-Ce-u catalyst was obtained by stability test of F3-Ce at 340 °C for 50 h. 2.2 Characterization, catalyst evaluation and DFT calculation The details of this section were provided in supporting information. 3 Results and discussion 3.1 Catalytic performance The catalysts were tested for toluene oxidation in the temperature range of 160–380 °C, and the results are shown in Fig. 1 . It was observed that the fluorine-doping has a positive impact on toluene oxidation. The activity of catalysts followed an order of F5-Ce < CeO2 < F1-Ce < F3-Ce. The temperature of F3-Ce catalyst achieving 50% (T50) and 90% (T90) conversion was 218 °C and 306 °C (Table S1), respectively, which is far below that of CeO2. Meanwhile, F3-Ce also exhibits better catalytic performance at medium-low temperature than Ce-based catalysts in other literature (Table S2). These results indicated that a certain amount of fluorine doping could increase the oxidation efficiency of toluene over CeO2. 3.2 Structural analysis The XRD patterns of CeO2 and Fx-Ce catalysts are displayed in Fig. 2 . The diffraction peaks at 28°, 33°, 47°, 59°, 69°, 77° and 79° correspond to (111), (200), (220), (311), (222), (400), (331) and (420) planes of the cubic phase CeO2 [34]. The main peaks of Fx-Ce catalysts are well consistent with the cubic phase CeO2 and there was no significant shift in the location of peaks. Moreover, no new characteristic reflections for fluorine or fluorine-containing phases are found in XRD patterns of Fx-Ce (Fig. S1), meaning that fluorine does not change the crystalline phase of CeO2. The SEM diagram (Fig. S2) also shows that F-doping has no effect on the morphology of CeO2. The specific surface area, pore volume and pore diameter of all catalysts have been characterized by the BET-BJH models. The results were summarized in Fig. S3 and Table 1 . It could be clearly seen that all catalysts show the type-IV isotherms with similar mesoporous architecture, which can also be confirmed by the pore parameters (Fig. S3b) [35]. In Table 1, it could be seen that the addition of F (<3%) has little effect on the specific surface area. However, it can be found that the specific surface area will be decreased by the addition of excessive fluorine (F5-Ce), which may result from the collapse of pore structure by the addition of excessive fluorine [35,36]. Meanwhile, one can see that the average pore size increases with the increase of the content of F-doping for Fx-Ce catalysts, and the pore volume of F5-Ce is the smallest. Combined with the pore size distributions (Fig. S3b), there are fewer small pores below 5 nm for F5-Ce and the pore size is mainly concentrated around 10 nm. The phenomenon may be caused by the collapse of the pore structure due to the presence of excessive fluorine, resulting in the larger average pore size and the decrease of pore volume [37]. It is known that Raman spectra is widely used to investigate the phase composition of catalysts. As presented in Fig. 3 , the peak at 465 cm−1 is regarded as F2g of ceria fluorite-type structure. The second peak at 600 cm−1 is attributed to defect-induced (ID) mode associated with the oxygen vacancies due to the presence of Ce3+ [38]. As reported, the relative ratio of ID/IF2g is positively correlated with the oxygen vacancy concentration on Ce-based catalysts [39]. As listed in Table 1, the oxygen vacancy concentration follows the order of F3-Ce > F1-Ce > CeO2 > F5-Ce, indicating that the addition of fluorine is conducive to the generation of surface oxygen vacancy on CeO2. Generally, higher oxygen vacancy concentration is more conducive to toluene oxidation, that is why F3-Ce possesses the best catalytic performance. Surface element information over the CeO2 and F3-Ce are studied by XPS (Fig. 4 ) and the related results are listed in Table 2 . The F 1s spectra (Fig. 4a) for F3-Ce catalyst contains two peaks. One located at 684.4 eV is assigned to F− ions adsorbed on CeO2 surface (named as surface F), and another at 688.2 eV is attributed to the F− ions incorporated into CeO2 lattice (named as lattice F) [40,41]. These results indicate that F species exist in two states on Fx-Ce, and the surface F is dominant species on the CeO2. For the Ce 3d spectra (Fig. 4b), eight peaks can be observed [42]. Two peaks at 884.6 and 903.1 eV are ascribed to the Ce3+ ions (named as v2 and u2). The other peaks at 882.6, 889.3, 898.6, 901.1, 907.7 and 916.9 eV correspond to the Ce4+ ions (named as v1, v3, v4, u1, u3 and u4). The percentage of Ce3+ ions on different catalysts are calculated by the peaks area of Ce 3d spectra (Table 2). The percentage of Ce3+ species in F3-Ce is 27.71%, which is more than that of CeO2 (24.35%). This indicates that the addition of a low content of fluorine is beneficial to the generation of Ce3+. As reported, the formation of one oxygen vacancy corresponds to the generation of double Ce3+, indicating the amount of Ce3+ is positively related to the concentration of oxygen vacancy on CeO2 surface [43]. Additionally, Fig. 4c displays the O 1s spectra, which has two apparent peaks. The peak at 531.0 eV corresponds to chemisorbed oxygen (masked as Oα). The second peak at 529.1 eV is assigned to lattice oxygen (labelled as Oβ) [44]. The amount of Oα species is positively correlated with the oxygen vacancy concentration, which is mainly adsorbed at oxygen vacancy [45,46]. The ratio of Oα/(Oα+Oβ) is used to represent the concentration of active oxygen (Table 2). The calculation results demonstrate that the Oα on F3-Ce (33.8%) is higher than that on the CeO2 (27.8%). Liao et al. [47] discussed the role of oxygen species for toluene oxidation, and they believed that Oα species played a key role in the reaction. Thus, the F3-Ce catalyst, which contains more Oα specices, is more active for toluene oxidation. The F3-Ce catalyst after 50 h long-term stability test (340 °C) were characterized by XPS (Fig. 4) and XRD (Fig. 5 ). The relevant results are shown in Table 2. Compared with the F3-Ce catalyst, the relative content of Ce3+ and Oα of F3-Ce-u (obtained by stability test of F3-Ce at 340 °C for 50 h) is slightly decreased, which implies that F3-Ce-u may lose some surface oxygen and oxygen vacancies [25]. Meanwhile, it could be seen the atomic ratio of F remains unchanged, which also means that F can stably exist on CeO2 after the 50 h long-term stability test (340 °C). In Fig. 5, the diffraction peaks of F3-Ce and F3-Ce-u have no noticeable change, indicating that the stability test does not affect the phase and particle size of catalysts [48]. In order to confirm the results of Raman and XPS above, DFT calculations were performed to access the underlying source of the difference in the formation energy of oxygen vacancy. Based on the careful analysis of the experiment results, an underlying relation may exist between catalytic performance and oxygen vacancy. From the above XPS data, it could be seen that fluorine in F3-Ce exists in the form of surface fluorine and lattice fluorine, so our theoretical calculations will be carried out around them. In order to understand the effect of fluorine on CeO2, three kinds of slab models have been established, including CeO2 (111), lattice-F-CeO2 (111), and surface-F-CeO2 (111) model [49], as shown in Fig. 6 . According to the results, the doping sites of F have a significant influence on the formation of oxygen vacancy. For CeO2, the formation energy of oxygen vacancy (Eov) is 2.2 eV. When F is doped into the crystal lattice of CeO2, the Eov on the surface of the catalyst is basically unchanged. It is worth noting that when F is doped on the surface of CeO2, the oxygen vacancy formation energy is reduced to 0.9 eV, which means that it is easier to form oxygen vacancies on F-CeO2 (111) surface. Meanwhile, we have performed bader charge analysis to confirm the charge difference between these models [50]. As shown in Fig. 7 and Fig. S4, for lattice-F-CeO2 (111), it could be seen that the lattice F only interacts with the Ce who connected to fluorine directly and has little effect on the surrounding Ce and O. It will not destroy the charge balance of CeO2 system, which also corresponds to the similar oxygen vacancy formation energy on CeO2 and lattice-F-CeO2 (111). In addition, compared with the lattice F, surface F destroys the charge balance of the CeO2 system. There is a strong interaction between surface F and the Ce who connected to it directly, which leads to the charge imbalance on the adjacent Ce and O and weakens the Ce-O bond (2.368 Å→2.456 Å). According to the above results, we infer that the interaction (the charge imbalance) between surface F and the Ce atom brings about a stretch to the neighboring Ce-O bond. Moreover, it makes oxygen vacancy form easier because of the weakening effect on the Ce-O bond strength. However, the fluorine in the lattice has no obvious effect on the formation of oxygen vacancy; thus fluorine on the surface may play a key role in F3-Ce. Given the central role of oxygen vacancy in catalyst, F3-Ce is expected to achieve better performance than CeO2, which fits well with the toluene oxidation results. 3.3 Surface properties analysis The reducibility of all catalysts was studied by H2-TPR. As shown in Fig. 8 , the reduction peaks over the catalysts are fitted into three temperature ranges, corresponding to the reduction of surface (100–400 °C), subsurface (400–600 °C) and bulk (>600 °C) oxygen species, respectively [35]. The area of the reduction peak is positively related to the the consumption of hydrogen [51,52]. Generally, the surface and subsurface oxygen is more active than bulk oxygen [46], thus we integrated the reduction peak area (< 600°C). The relevant data is listed in Table 1. The reduction peak area of all catalysts follows the order of F5-Ce < CeO2 < F1-Ce < F3-Ce, indicating that a proper amount of F-doping can increase the amount of reducible species (surface/subsurface oxygen). Meanwhile, F3-Ce has the lowest original reduction temperature among all catalysts, which means it has the strongest redox property. O2-TPD profiles and peak area of all catalysts are illustrated in Fig. 9 . The desorption peaks are divided into three categories, namely α (<200 °C), β (200–400 °C) and γ (>400 °C) groups, which could be ascribed to the desorption of the physisorbed oxygen, chemisorbed oxygen and lattice oxygen [53,54]. As depicted in Fig. 9b, among the four catalysts, F3-Ce possesses far larger amount of both the physisorbed oxygen (α) and chemisorbed oxygen (β), which fits with the results of H2-TPR and XPS. Moreover, the desorption temperature of chemisorbed oxygen of F3-Ce catalyst is lower than that of other catalysts, revealing that the addition of fluorine enhances the activation ability of oxygen species and the reactivity of chemisorbed oxygen on F3-Ce is higher than that on other catalysts [48,55]. Compared with surface active oxygen species (α, β), the lattice oxygen also participates in the reaction, but its activity is lower than that of surface active oxygen due to its high stability [47]. It has been reported that toluene oxidation on Ce-based catalysts processed by L–H mechanism at low temperature (<300 °C) and MVK mechanism at high temperature. When the temperature is higher than 300 °C, the reaction follows the MVK mechanism. It may be that the lattice oxygen plays a major role in the reaction at high temperature. Meanwhile, from Fig. 9a, the surface adsorbed oxygen species has been removed after 330 °C, which also means that lattice oxygen will also be one of th factors affecting the catalyst activity [47]. However, the activity of lattice oxygen is lower than that of surface active oxygen species, which may result in a slower conversion rate. This also corresponds to the increasingly smaller activity gap between CeO2 and F3-Ce in Fig. 1. In summary, higher concentration of active oxygen (α, β) and excellent oxygen adsorption and activation ability are conducive to toluene oxidation, thus F3-Ce has the best low-temperature oxidation activity. The previous studies have demonstrated that the adsorption performances of toluene play a key role in toluene oxidation. Herein Toluene-TPD was performed to study the adsorption performances of all catalysts. As presented in Fig. 10 , the desorption peaks at 100–200 °C and 200–500 °C are attributed to weak adsorbed and strong adsorbed toluene, respectively [56]. The desorption peak area can indirectly correspond to the adsorption capacity of toluene. The desorption area of toluene between 100 °C and 200 °C can be ranked as follows: F5-Ce < CeO2 < F1-Ce < F3-Ce. Meanwhile, it also follows this rule from 200 °C to 500 °C. F3-Ce has the largest desorption peak area, which indicates that a small amount of F-doping is beneficial to the adsorption of toluene on CeO2. Caiting Li [57] reported that toluene is adsorbed on the active oxygen of oxygen vacancies, which fits well with the results of H2-TPR and Raman above. F3-Ce has the most active oxygen species and oxygen vacancies, providing more adsorption sites for toluene. 3.4 Stability and water effect on F3-Ce In industrial application, catalytic stability is one of the key indicators to evaluate the catalytic performance. In the experiment, the stability of F3-Ce at different temperatures was tested. As presented in Fig. 11 a, it could be seen that F3-Ce has excellent catalytic stability for toluene oxidation. The conversion remained unchanged at 240 °C (80%) and 340 °C (95%) for 50 h. Therefore, F3-Ce has a good prospect for practical application. Water is a factor that must be considered in the treatment of VOCs, thereby the effect of water on toluene oxidation over the F3-Ce catalyst is tested. As presented in Fig. 11b, the F3-Ce catalyst is tested at 340 °C with 5 vol% H2O. One can see that the toluene conversion decreases rapidly from 94% to 88% when 5 vol% H2O is introduced, and remains unchanged at 88% for 24 h. When 5 vol% H2O is removed from the reaction, the toluene conversion is restored to the original level. Meanwhile, the slight decrease in activity is mainly due to the competitive adsorption of water molecules and toluene on the surface of catalyst [51,58]. In summary, the slight decrease in activity and its recoverability indicates that the F3-Ce catalyst has good water resistance and reversible effect. 3.5 Possible promotional mechanism analysis According to the results obtained above and literatures, the possible promotional mechanism of toluene oxidation on F3-Ce is proposed in Fig. 12 . The surface F on CeO2 makes the bond length of neighbouring Ce-O longer and weak the Ce-O bond, making it easier for the formation of oxygen vacancy. This leads to more oxygen vacancies on F3-Ce. Meanwhile, F-doping is beneficial to the adsorption of toluene. The reaction of toluene oxidation occurs by the combined actions of the above two aspects. As shown in F 1s XPS and theoretical calculation, two types of fluorine species existed on F3-Ce, and the surface fluorine is dominant species, which results in large amounts of surface oxygen vacancies for the adsorption-activation of oxygen molecule (O 1s XPS, Raman) and improves the oxygen mobility. Toluene-TPD shows that F3-Ce has a higher toluene capacity than CeO2. Therefore, the improvements in oxygen adsorption-activation and toluene capacity both contribute to the superior catalytic performance in toluene oxidation. 4 Conclusion In summary, CeO2 and F-modified CeO2 catalysts are synthesized by co-precipitation method for toluene oxidation. The characterizations prove that F3-Ce catalyst has higher low-temperature reducibility, higher toluene capacity, more active oxygen species and oxygen vacancies due to the more Ce3+ ions induced by the strong interaction between F and Ce. As a result, F3-Ce has the optimum performance for toluene oxidation with conversions of 50% and 90% at 218 °C and 306 °C, respectively. Moreover, the F3-Ce catalyst also exhibited excellent water resistance and stability in the 50 h stability test, meaning that it is a potential catalyst for toluene oxidation in industrial application. CRediT authorship contribution statement Bin Yang: Conceptualization, Data curation, Methodology, Validation, Writing – original draft. Mingjia Zhang: Conceptualization, Data curation, Methodology, Validation, Writing – original draft. Yiqing Zeng: Conceptualization, Methodology, Writing – review & editing. Fanyu Meng: Conceptualization, Methodology, Writing – review & editing. Jiangquan Ma: Methodology, Writing – review & editing. Shule Zhang: Funding acquisition, Project administration, Resources, Supervision. Qin Zhong: Funding acquisition, Project administration, Resources, Supervision. Declaration of Competing Interest The authors declare that they have no known competing financial interests or personal relationships that could have appeared to influence the work reported in this paper. Acknowledgements This work was financially supported by the Key Project of Jiangsu Province Programs for Research and Development (BE2019115), the Fundamental Research Funds for the Central Universities (30919011220), Top-notch Academic Programs Project of Jiangsu Higher Education Institutions, China-Finland Industrial R&D Program (No. BZ2018015), China-Finland Industrial R&D Program (No. BZ2018015), ChangZhou Science and Technology Support Program (CE20195022) and Advanced Catalysis and Green manufacturing Collaborative Innovation Center, ChangZhou University. Supplementary materials Supplementary material associated with this article can be found, in the online version, at doi:10.1016/j.mcat.2021.111771. Appendix Supplementary materials Image, application 1 References [1] L.F. Liotta Catalytic oxidation of volatile organic compounds on supported noble metals Appl. Catal. B 100 2010 403 412 L.F. Liotta, Catalytic oxidation of volatile organic compounds on supported noble metals, Appl. Catal. B100 (2010) 403–412. [2] M.A. Bari W.B. Kindzierski Ambient volatile organic compounds (VOCs) in Calgary, Alberta: sources and screening health risk assessment Sci. Total Environ. 631–632 2018 627 640 M.A. Bari, W.B. Kindzierski, Ambient volatile organic compounds (VOCs) in Calgary, Alberta: sources and screening health risk assessment, Sci. Total Environ.631–632 (2018) 627–640. [3] X. Li J. Li L. Wu Vacuum membrane distillation to remove ethyl acetate from aqueous solutions Desalin. Water Treat. 52 25–27 2014 5158 5164 X. Li, J. Li, L. Wu, Vacuum membrane distillation to remove ethyl acetate from aqueous solutions, Desalin. Water Treat.52(25–27) (2014) 5158–5164. [4] C.H. Wu C.W. Lin Electricity generation and kinetic aspects of a biotrickling filter-microbial fuel cell for the biofiltration of ethyl acetate vapor from waste gas J. Taiwan Inst. Chem. Eng. 68 2016 332 337 C.H. Wu, C.W. Lin, Electricity generation and kinetic aspects of a biotrickling filter-microbial fuel cell for the biofiltration of ethyl acetate vapor from waste gas, J. Taiwan Inst. Chem. Eng.68 (2016) 332–337. [5] X. Zhu S. Zhang Y. Yang C. Zheng J. Zhou X. Gao X. Tu Enhanced performance for plasma-catalytic oxidation of ethyl acetate over La1-xCexCoO3+δ catalysts Appl. Catal. B 213 2017 97 105 X. Zhu, S. Zhang, Y. Yang, C. Zheng, J. Zhou, X. Gao, X. Tu, Enhanced performance for plasma-catalytic oxidation of ethyl acetate over La1-xCexCoO3+δ catalysts, Appl. Catal. B213 (2017) 97–105. [6] V.P. Santos M.F.R. Pereira J.J.M. Órfão J.L. Figueiredo Catalytic oxidation of ethyl acetate over a cesium modified cryptomelane catalyst Appl. Catal. B 88 3–4 2009 550 556 V.P. Santos, M.F.R. Pereira, J.J.M. Órfão, J.L. Figueiredo, Catalytic oxidation of ethyl acetate over a cesium modified cryptomelane catalyst, Appl. Catal. B88(3–4) (2009) 550–556. [7] X. Chen S.A.C. Carabineiro S.S.T. Bastos P.B. Tavares J.J.M. Órfão M.F.R. Pereira J.L. Figueiredo Catalytic oxidation of ethyl acetate on cerium-containing mixed oxides Appl. Catal. A Gen. 472 2014 101 112 X. Chen, S.A.C. Carabineiro, S.S.T. Bastos, P.B. Tavares, J.J.M. Órfão, M.F.R. Pereira, J.L. Figueiredo, Catalytic oxidation of ethyl acetate on cerium-containing mixed oxides, Appl. Catal. A Gen.472 (2014) 101–112. [8] D. Baojuan L. Shumin L. Deliang Z. Ruozhu L. Jingge H. Qinglan B. Feng Catalytic oxidation of ethyl acetate and toluene over Cu-Ce-Zr supported ZSM-5/TiO2 catalysts RSC Adv. 6 59 2016 53852 53859 D. Baojuan, L. Shumin, L. Deliang, Z. Ruozhu, L. Jingge, H. Qinglan, B. Feng, Catalytic oxidation of ethyl acetate and toluene over Cu-Ce-Zr supported ZSM-5/TiO2 catalysts, RSC Adv.. 6(59) (2016) 53852–53859. [9] Y. Zhou H. Zhang Y. Yan Catalytic oxidation of ethyl acetate over CuO/ZSM-5 catalysts: effect of preparation method J. Taiwan Inst. Chem. Eng. 84 2018 162 172 Y. Zhou, H. Zhang, Y. Yan, Catalytic oxidation of ethyl acetate over CuO/ZSM-5 catalysts: effect of preparation method, J. Taiwan Inst. Chem. Eng.84 (2018) 162–172. [10] M.C. Álvarez-Galván V.A. de la Peña O'Shea J.L.G. Fierro P.L. Arias Alumina-supported manganese-and manganese-palladium oxide catalysts for VOCs combustion Catal. Commun. 4 5 2003 223 228 M.C. Álvarez-Galván, V.A. de la Peña O'Shea, J.L.G. Fierro, P.L. Arias, Alumina-supported manganese-and manganese-palladium oxide catalysts for VOCs combustion, Catal. Commun.4(5) (2003) 223–228. [11] S. Scirè S. Minicò C. Crisafulli C. Satriano A. Pistone Catalytic combustion of volatile organic compounds on gold/cerium oxide catalysts Appl. Catal. B 40 1 2003 43 49 S. Scirè, S. Minicò, C. Crisafulli, C. Satriano, A. Pistone, Catalytic combustion of volatile organic compounds on gold/cerium oxide catalysts, Appl. Catal. B40(1) (2003) 43–49. [12] S. Madronich Ethanol and ozone Nat. Geosci. 7 6 2014 395 397 S. Madronich, Ethanol and ozone, Nat. Geosci.7(6) (2014) 395–397. [13] S.C. Kim The catalytic oxidation of aromatic hydrocarbons over supported metal oxide J. Hazard. Mater. 91 1 2002 285 299 S.C. Kim, The catalytic oxidation of aromatic hydrocarbons over supported metal oxide, J. Hazard. Mater.91(1) (2002) 285–299. [14] Y. Lyu C. Li X. Du Y. Zhu Y. Zhang S. Li Catalytic oxidation of toluene over MnO2 catalysts with different Mn (II) precursors and the study of reaction pathway Fuel 262 2020 116610 Y. Lyu, C. Li, X. Du, Y. Zhu, Y. Zhang, S. Li, Catalytic oxidation of toluene over MnO2 catalysts with different Mn (II) precursors and the study of reaction pathway, Fuel262 (2020) 116610. [15] S. Scirè P.M. Riccobene C. Crisafulli Ceria supported group IB metal catalysts for the combustion of volatile organic compounds and the preferential oxidation of CO Appl. Catal. B 101 1 2010 109 117 S. Scirè, P.M. Riccobene, C. Crisafulli, Ceria supported group IB metal catalysts for the combustion of volatile organic compounds and the preferential oxidation of CO, Appl. Catal. B101(1) (2010) 109–117. [16] M. Konsolakis S.A.C. Carabineiro P.B. Tavares J.L. Figueiredo Redox properties and VOC oxidation activity of Cu catalysts supported on Ce1−xSmxOδ mixed oxides J. Hazard. Mater. 261 2013 512 521 M. Konsolakis, S.A.C. Carabineiro, P.B. Tavares, J.L. Figueiredo, Redox properties and VOC oxidation activity of Cu catalysts supported on Ce1−xSmxOδ mixed oxides, J. Hazard. Mater.261 (2013) 512–521. [17] S.C. Kim W.G. Shim Catalytic combustion of VOCs over a series of manganese oxide catalysts Appl. Catal. B 98 3 2010 180 185 S.C. Kim, W.G. Shim, Catalytic combustion of VOCs over a series of manganese oxide catalysts, Appl. Catal. B98(3) (2010) 180–185. [18] B. Solsona T. Garcia E. Aylón A.M. Dejoz I. Vázquez S. Agouram T.E. Davies S.H. Taylor Promoting the activity and selectivity of high surface area Ni-Ce-O mixed oxides by gold deposition for VOC catalytic combustion Chem. Eng. J. 175 2011 271 278 B. Solsona, T. Garcia, E. Aylón, A.M. Dejoz, I. Vázquez, S. Agouram, T.E. Davies, S.H. Taylor, Promoting the activity and selectivity of high surface area Ni-Ce-O mixed oxides by gold deposition for VOC catalytic combustion, Chem. Eng. J.175 (2011) 271–278. [19] H.-X. Mai L.-D. Sun Y.-W. Zhang R. Si W. Feng H.-P. Zhang H.-C. Liu C.-H. Yan Shape-selective synthesis and oxygen storage behavior of ceria nanopolyhedra, nanorods, and nanocubes J. Phys. Chem. B 109 51 2005 24380 24385 H.-X. Mai, L.-D. Sun, Y.-W. Zhang, R. Si, W. Feng, H.-P. Zhang, H.-C. Liu, C.-H. Yan, Shape-selective synthesis and oxygen storage behavior of ceria nanopolyhedra, nanorods, and nanocubes, J. Phys. Chem. B109(51) (2005) 24380–24385. [20] K. Zhou X. Wang X. Sun Q. Peng Y. Li Enhanced catalytic activity of ceria nanorods from well-defined reactive crystal planes J. Catal. 229 1 2005 206 212 K. Zhou, X. Wang, X. Sun, Q. Peng, Y. Li, Enhanced catalytic activity of ceria nanorods from well-defined reactive crystal planes, J. Catal.229(1) (2005) 206–212. [21] S. Liu X. Wu W. Liu W. Chen R. Ran M. Li D. Weng Soot oxidation over CeO2 and Ag/CeO2: Factors determining the catalyst activity and stability during reaction J. Catal. 337 2016 188 198 S. Liu, X. Wu, W. Liu, W. Chen, R. Ran, M. Li, D. Weng, Soot oxidation over CeO2 and Ag/CeO2: Factors determining the catalyst activity and stability during reaction, J. Catal.337 (2016) 188–198. [22] T. Tsoncheva J. Roggenbuck D. Paneva M. Dimitrov I. Mitov M. Fröba Nanosized iron and chromium oxides supported on mesoporous CeO2 and SBA-15 silica: physicochemical and catalytic study Appl. Surf. Sci. 257 2 2010 523 530 T. Tsoncheva, J. Roggenbuck, D. Paneva, M. Dimitrov, I. Mitov, M. Fröba, Nanosized iron and chromium oxides supported on mesoporous CeO2 and SBA-15 silica: physicochemical and catalytic study, Appl. Surf. Sci.257(2) (2010) 523–530. [23] R. Peng X. Sun S. Li L. Chen M. Fu J. Wu D. Ye Shape effect of Pt/CeO2 catalysts on the catalytic oxidation of toluene Chem. Eng. J. 306 2016 1234 1246 R. Peng, X. Sun, S. Li, L. Chen, M. Fu, J. Wu, D. Ye, Shape effect of Pt/CeO2 catalysts on the catalytic oxidation of toluene, Chem. Eng. J.306 (2016) 1234–1246. [24] L. Wang Y. Yu H. He Y. Zhang X. Qin B. Wang Oxygen vacancy clusters essential for the catalytic activity of CeO2 nanocubes for o-xylene oxidation Sci. Rep. 7 1 2017 12845 L. Wang, Y. Yu, H. He, Y. Zhang, X. Qin, B. Wang, Oxygen vacancy clusters essential for the catalytic activity of CeO2 nanocubes for o-xylene oxidation, Sci. Rep.7(1) (2017) 12845. [25] X. Feng J. Guo X. Wen M. Xu Y. Chu S. Yuan Enhancing performance of Co/CeO2 catalyst by Sr doping for catalytic combustion of toluene Appl. Surf. Sci. 445 2018 145 153 X. Feng, J. Guo, X. Wen, M. Xu, Y. Chu, S. Yuan, Enhancing performance of Co/CeO2 catalyst by Sr doping for catalytic combustion of toluene, Appl. Surf. Sci.445 (2018) 145–153. [26] L.F. Liotta M. Ousmane G. Di Carlo G. Pantaleo G. Deganello G. Marcì L. Retailleau A. Giroir-Fendler Total oxidation of propene at low temperature over Co3O4-CeO2 mixed oxides: role of surface oxygen vacancies and bulk oxygen mobility in the catalytic activity Appl. Catal. A Gen. 347 1 2008 81 88 L.F. Liotta, M. Ousmane, G. Di Carlo, G. Pantaleo, G. Deganello, G. Marcì, L. Retailleau, A. Giroir-Fendler, Total oxidation of propene at low temperature over Co3O4-CeO2 mixed oxides: role of surface oxygen vacancies and bulk oxygen mobility in the catalytic activity, Appl. Catal. A Gen.347(1) (2008) 81–88. [27] B. Solsona R. Sanchis A.M. Dejoz T. García L. Ruiz-Rodríguez J.M. López Nieto J.A. Cecilia E. Rodríguez-Castellón Total oxidation of propane using CeO2 and CuO-CeO2 catalysts prepared using templates of different nature Catalysts 7 4 2017 B. Solsona, R. Sanchis, A.M. Dejoz, T. García, L. Ruiz-Rodríguez, J.M. López Nieto, J.A. Cecilia, E. Rodríguez-Castellón, Total oxidation of propane using CeO2 and CuO-CeO2 catalysts prepared using templates of different nature, Catalysts7(4) (2017). [28] P. Venkataswamy D. Jampaiah K.N. Rao B.M. Reddy Nanostructured Ce0.7Mn0.3O2−δ and Ce0.7Fe0.3O2−δ solid solutions for diesel soot oxidation Appl. Catal. A Gen 488 2014 1 10 P. Venkataswamy, D. Jampaiah, K.N. Rao, B.M. Reddy, Nanostructured Ce0.7Mn0.3O2−δ and Ce0.7Fe0.3O2−δ solid solutions for diesel soot oxidation, Appl. Catal. A Gen. 488 (2014) 1–10. [29] X. Tang Y. Li X. Huang Y. Xu H. Zhu J. Wang W. Shen MnOx-CeO2 mixed oxide catalysts for complete oxidation of formaldehyde: Effect of preparation method and calcination temperature Appl. Catal. B 62 3 2006 265 273 X. Tang, Y. Li, X. Huang, Y. Xu, H. Zhu, J. Wang, W. Shen, MnOx-CeO2 mixed oxide catalysts for complete oxidation of formaldehyde: Effect of preparation method and calcination temperature, Appl. Catal. B62(3) (2006) 265–273. [30] Y. You C. Shi H. Chang L. Guo L. Xu J. Li The promoting effects of amorphous CePO4 species on phosphorus-doped CeO2 /TiO2 catalysts for selective catalytic reduction of NOx by NH3 Mol. Catal. 453 2018 47 54 Y. You, C. Shi, H. Chang, L. Guo, L. Xu, J. Li, The promoting effects of amorphous CePO4 species on phosphorus-doped CeO2 /TiO2 catalysts for selective catalytic reduction of NOx by NH3, Mol. Catal.453 (2018) 47–54. [31] K.-R. Hwang J.-S. Park S.-K. Ihm Si-modified Pt/CeO2 catalyst for a single-stage water-gas shift reaction Int. J. Hydrog. Energy 36 16 2011 9685 9693 K.-R. Hwang, J.-S. Park, S.-K. Ihm, Si-modified Pt/CeO2 catalyst for a single-stage water-gas shift reaction, Int. J. Hydrog. Energy36(16) (2011) 9685–9693. [32] Q. Wang B. Rhimi H. Wang C. Wang Efficient photocatalytic degradation of gaseous toluene over F-doped TiO2/exfoliated bentonite Appl. Surf. Sci. 530 2020 Q. Wang, B. Rhimi, H. Wang, C. Wang, Efficient photocatalytic degradation of gaseous toluene over F-doped TiO2/exfoliated bentonite, Appl. Surf. Sci.530 (2020). [33] Z. Deng Q. Zhong J. Ding L. Guo W. Zhao S. Zhang Effect of fluorine additives on the performance of amorphous Ce-Ti catalyst and its promotional progress on ozone for NOX (x = 1, 2) removal at low temperature J. Fluorine Chem. 191 2016 120 128 Z. Deng, Q. Zhong, J. Ding, L. Guo, W. Zhao, S. Zhang, Effect of fluorine additives on the performance of amorphous Ce-Ti catalyst and its promotional progress on ozone for NOX (x = 1, 2) removal at low temperature, J. Fluorine Chem.191 (2016) 120–128. [34] X. Li J. Feng M. Perdjon R. Oh W. Zhao X. Huang S. Liu Investigations of supported Au-Pd nanoparticles on synthesized CeO2 with different morphologies and application in solvent-free benzyl alcohol oxidation Appl. Surf. Sci. 2020 505 X. Li, J. Feng, M. Perdjon, R. Oh, W. Zhao, X. Huang, S. Liu, Investigations of supported Au-Pd nanoparticles on synthesized CeO2 with different morphologies and application in solvent-free benzyl alcohol oxidation, Appl. Surf. Sci.505 (2020). [35] P. Wang J. Wang J. Shi X. Du X. Hao B. Tang A. Abudula G. Guan Low content of samarium doped CeO2 oxide catalysts derived from metal organic framework precursor for toluene oxidation Mol. Catal. 2020 492 P. Wang, J. Wang, J. Shi, X. Du, X. Hao, B. Tang, A. Abudula, G. Guan, Low content of samarium doped CeO2 oxide catalysts derived from metal organic framework precursor for toluene oxidation, Mol. Catal.492 (2020). [36] Z. Li W. Yang L. Xie Y. Li Y. Liu Y. Sun Y. Bu X. Mi S. Zhan W. Hu Prominent role of oxygen vacancy for superoxide radical and hydroxyl radical formation to promote electro-Fenton like reaction by W-doped CeO2 composites Appl. Surf. Sci. 2021 549 Z. Li, W. Yang, L. Xie, Y. Li, Y. Liu, Y. Sun, Y. Bu, X. Mi, S. Zhan, W. Hu, Prominent role of oxygen vacancy for superoxide radical and hydroxyl radical formation to promote electro-Fenton like reaction by W-doped CeO2 composites, Appl. Surf. Sci.549 (2021). [37] M. Zhang S. Cai J. Li E.A. Elimian J. Chen H. Jia Ternary multifunctional catalysts of polymeric carbon nitride coupled with Pt-embedded transition metal oxide to enhance light-driven photothermal catalytic degradation of VOCs J. Hazard. Mater. 412 2021 125266 M. Zhang, S. Cai, J. Li, E.A. Elimian, J. Chen, H. Jia, Ternary multifunctional catalysts of polymeric carbon nitride coupled with Pt-embedded transition metal oxide to enhance light-driven photothermal catalytic degradation of VOCs, J. Hazard. Mater.412 (2021) 125266. [38] Z. Wu M. Li J. Howe H.M. Meyer S.H. Overbury Probing defect sites on CeO2 nanocrystals with well-defined surface planes by raman spectroscopy and O2 adsorption Langmuir 26 21 2010 16595 16606 Z. Wu, M. Li, J. Howe, H.M. Meyer, S.H. Overbury, Probing defect sites on CeO2 nanocrystals with well-defined surface planes by raman spectroscopy and O2 adsorption, Langmuir26(21) (2010) 16595–16606. [39] B. Wang C. Chi M. Xu C. Wang D. Meng Plasma-catalytic removal of toluene over CeO2-MnOx catalysts in an atmosphere dielectric barrier discharge Chem. Eng. J. 322 2017 679 692 B. Wang, C. Chi, M. Xu, C. Wang, D. Meng, Plasma-catalytic removal of toluene over CeO2-MnOx catalysts in an atmosphere dielectric barrier discharge, Chem. Eng. J.322 (2017) 679–692. [40] D. Li H. Haneda N.K. Labhsetwar S. Hishita N. Ohashi Visible-light-driven photocatalysis on fluorine-doped TiO2 powders by the creation of surface oxygen vacancies Chem. Phys. Letters 401 4 2005 579 584 D. Li, H. Haneda, N.K. Labhsetwar, S. Hishita, N. Ohashi, Visible-light-driven photocatalysis on fluorine-doped TiO2 powders by the creation of surface oxygen vacancies, Chem. Phys. Letters401(4) (2005) 579–584. [41] Y. Wu M. Xing J. Zhang Gel-hydrothermal synthesis of carbon and boron co-doped TiO2 and evaluating its photocatalytic activity J. Hazard. Mater. 192 1 2011 368 373 Y. Wu, M. Xing, J. Zhang, Gel-hydrothermal synthesis of carbon and boron co-doped TiO2 and evaluating its photocatalytic activity, J. Hazard. Mater.192(1) (2011) 368–373. [42] Z. Zhang L. Chen Z. Li P. Li F. Yuan X. Niu Y. Zhu Activity and SO2 resistance of amorphous CeaTiOx catalysts for the selective catalytic reduction of NO with NH3: in situ DRIFT studies Catal. Sci. Technol. 6 19 2016 7151 7162 Z. Zhang, L. Chen, Z. Li, P. Li, F. Yuan, X. Niu, Y. Zhu, Activity and SO2 resistance of amorphous CeaTiOx catalysts for the selective catalytic reduction of NO with NH3: in situ DRIFT studies, Catal. Sci. Technol.6(19) (2016) 7151–7162. [43] E. Bêche P. Charvin D. Perarnau S. Abanades G. Flamant Ce 3d XPS investigation of cerium oxides and mixed cerium oxide (CexTiyOz) Surf. Interface Anal. 40 3–4 2008 264 267 E. Bêche, P. Charvin, D. Perarnau, S. Abanades, G. Flamant, Ce 3d XPS investigation of cerium oxides and mixed cerium oxide (CexTiyOz), Surf. Interface Anal.40(3–4) (2008) 264–267. [44] P. Dutta S. Pal M.S. Seehra Y. Shi E.M. Eyring R.D. Ernst Concentration of Ce3+ and oxygen vacancies in cerium oxide nanoparticles Chem. Mater. 18 21 2006 5144 5146 P. Dutta, S. Pal, M.S. Seehra, Y. Shi, E.M. Eyring, R.D. Ernst, Concentration of Ce3+ and oxygen vacancies in cerium oxide nanoparticles, Chem. Mater.18(21) (2006) 5144–5146. [45] X. Lin S. Li H. He Z. Wu J. Wu L. Chen D. Ye M. Fu Evolution of oxygen vacancies in MnOx-CeO2 mixed oxides for soot oxidation Appl. Catal. B 223 2018 91 102 X. Lin, S. Li, H. He, Z. Wu, J. Wu, L. Chen, D. Ye, M. Fu, Evolution of oxygen vacancies in MnOx-CeO2 mixed oxides for soot oxidation, Appl. Catal. B223 (2018) 91–102. [46] X. Chen X. Chen E. Yu S. Cai H. Jia J. Chen P. Liang In situ pyrolysis of Ce-MOF to prepare CeO2 catalyst with obviously improved catalytic performance for toluene combustion Chem. Eng. J. 344 2018 469 479 X. Chen, X. Chen, E. Yu, S. Cai, H. Jia, J. Chen, P. Liang, In situ pyrolysis of Ce-MOF to prepare CeO2 catalyst with obviously improved catalytic performance for toluene combustion, Chem. Eng. J.344 (2018) 469–479. [47] Y. Liao M. Fu L. Chen J. Wu B. Huang D. Ye Catalytic oxidation of toluene over nanorod-structured Mn-Ce mixed oxides Catal. Today 216 2013 220 228 Y. Liao, M. Fu, L. Chen, J. Wu, B. Huang, D. Ye, Catalytic oxidation of toluene over nanorod-structured Mn-Ce mixed oxides, Catal. Today216 (2013) 220–228. [48] Y. Zeng K.G. Haw Z. Wang Y. Wang S. Zhang P. Hongmanorom Q. Zhong S. Kawi Double redox process to synthesize CuO-CeO2 catalysts with strong Cu-Ce interaction for efficient toluene oxidation J. Hazard. Mater. 404 2021 124088 Y. Zeng, K.G. Haw, Z. Wang, Y. Wang, S. Zhang, P. Hongmanorom, Q. Zhong, S. Kawi, Double redox process to synthesize CuO-CeO2 catalysts with strong Cu-Ce interaction for efficient toluene oxidation, J. Hazard. Mater.404 (2021) 124088. [49] M.S. Ozorio K.F. Andriani J.L.F. Da Silva A hybrid-DFT investigation of the Ce oxidation state upon adsorption of F, Na, Ni, Pd and Pt on the (CeO2)6 cluster Phys. Chem. Chem. Phys. 22 25 2020 14099 14108 M.S. Ozorio, K.F. Andriani, J.L.F. Da Silva, A hybrid-DFT investigation of the Ce oxidation state upon adsorption of F, Na, Ni, Pd and Pt on the (CeO2)6 cluster, Phys. Chem. Chem. Phys.22(25) (2020) 14099–14108. [50] W. Tang E. Sanville G. Henkelman A grid-based Bader analysis algorithm without lattice bias J. Phys. Condens. Matter 21 8 2009 084204 W. Tang, E. Sanville, G. Henkelman, A grid-based Bader analysis algorithm without lattice bias, J. Phys. Condens. Matter21(8) (2009) 084204. [51] F. Hu J. Chen Y. Peng H. Song K. Li J. Li Novel nanowire self-assembled hierarchical CeO2 microspheres for low temperature toluene catalytic combustion Chem. Eng. J. 331 2018 425 434 F. Hu, J. Chen, Y. Peng, H. Song, K. Li, J. Li, Novel nanowire self-assembled hierarchical CeO2 microspheres for low temperature toluene catalytic combustion, Chem. Eng. J.331 (2018) 425–434. [52] Y. Zeng Y. Wang S. Zhang Q. Zhong Partial substitution of magnesium in lanthanum manganite perovskite for nitric oxide oxidation: the effect of substitution sites J. Colloid Interface Sci. 580 2020 49 55 Y. Zeng, Y. Wang, S. Zhang, Q. Zhong, Partial substitution of magnesium in lanthanum manganite perovskite for nitric oxide oxidation: the effect of substitution sites, J. Colloid Interface Sci.580 (2020) 49–55. [53] H. Huang Q. Dai X. Wang Morphology effect of Ru/CeO2 catalysts for the catalytic combustion of chlorobenzene Appl. Catal. B 158–159 2014 96 105 H. Huang, Q. Dai, X. Wang, Morphology effect of Ru/CeO2 catalysts for the catalytic combustion of chlorobenzene, Appl. Catal. B158–159 (2014) 96–105. [54] L. Yu G. Diao F. Ye M. Sun J. Zhou Y. Li Y. Liu Promoting effect of Ce in Ce/OMS-2 catalyst for catalytic combustion of dimethyl ether Catal. Lett. 141 1 2011 111 119 L. Yu, G. Diao, F. Ye, M. Sun, J. Zhou, Y. Li, Y. Liu, Promoting effect of Ce in Ce/OMS-2 catalyst for catalytic combustion of dimethyl ether, Catal. Lett.141(1) (2011) 111–119. [55] F. Huang D. Ye X. Guo W. Zhan Y. Guo L. Wang Y. Wang Y. Guo Effect of ceria morphology on the performance of MnOx/CeO2 catalysts in catalytic combustion of N,N-dimethylformamide Catal. Sci. Technol. 10 8 2020 2473 2483 F. Huang, D. Ye, X. Guo, W. Zhan, Y. Guo, L. Wang, Y. Wang, Y. Guo, Effect of ceria morphology on the performance of MnOx/CeO2 catalysts in catalytic combustion of N,N-dimethylformamide, Catal. Sci. Technol.10(8) (2020) 2473–2483. [56] Y. Zeng Y. Wang F. Song S. Zhang Q. Zhong The effect of CuO loading on different method prepared CeO2 catalyst for toluene oxidation Sci. Total Environ. 712 2020 135635 Y. Zeng, Y. Wang, F. Song, S. Zhang, Q. Zhong, The effect of CuO loading on different method prepared CeO2 catalyst for toluene oxidation, Sci. Total Environ.712 (2020) 135635. [57] Y. Lyu C. Li X. Du Y. Zhu Y. Zhang S. Li Catalytic oxidation of toluene over MnO2 catalysts with different Mn (II) precursors and the study of reaction pathway Fuel 2020 262 Y. Lyu, C. Li, X. Du, Y. Zhu, Y. Zhang, S. Li, Catalytic oxidation of toluene over MnO2 catalysts with different Mn (II) precursors and the study of reaction pathway, Fuel262 (2020). [58] F. Hu Y. Peng S.Liu J.Chen H. Song J. Li Low content of CoOx supported on nanocrystalline CeO2 for toluene combustion: the importance of interfaces between active sites and supports Appl. Catal. B 240 2019 329 336 F. Hu, Y. Peng, J.Chen, S. Liu, H. Song, J. Li, Low content of CoOx supported on nanocrystalline CeO2 for toluene combustion: the importance of interfaces between active sites and supports, Appl. Catal. B240 (2019) 329–336.",
      "scopus-id": "85111309526",
      "coredata": {
        "eid": "1-s2.0-S2468823121003886",
        "dc:description": "In this study, fluorine (F) modified cerium oxide (Fx-Ce) catalysts were prepared by co-precipitation method to investigate the impact of fluorine species on CeO2 catalyst for toluene oxidation. Compared to bared CeO2, the catalysis activity of Fx-Ce was further improved. The temperature of toluene conversion (T90% and T50%) for F3-Ce decreased by ΔT90% = 30°C and ΔT50% = 15°C, respectively. The characterizations of H2-TPR, O2-TPD, Raman, XPS certified that there was more chemisorbed oxygen, oxygen vacancies and Ce3+ ions on the F3-Ce than bared CeO2. DFT calculations demonstrated that the formation energy of oxygen vacancy on F3-Ce is reduced by surface-florine, which promotes the formation of oxygen vacancy. Meanwhile, Toluene-TPD indicated that fluorine-doping increased the adsorption capacity of toluene on CeO2. According to the above-mentioned results, F3-Ce has higher oxygen vacancy concentration, more active oxygen, and larger toluene adsorption capacity. Thus it has the optimal catalytic activity for toluene oxidation.",
        "openArchiveArticle": "false",
        "prism:coverDate": "2021-08-31",
        "openaccessUserLicense": null,
        "prism:aggregationType": "Journal",
        "prism:url": "https://api.elsevier.com/content/article/pii/S2468823121003886",
        "dc:creator": [
          {
            "@_fa": "true",
            "$": "Yang, Bin"
          },
          {
            "@_fa": "true",
            "$": "Zhang, Mingjia"
          },
          {
            "@_fa": "true",
            "$": "Zeng, Yiqing"
          },
          {
            "@_fa": "true",
            "$": "Meng, Fanyu"
          },
          {
            "@_fa": "true",
            "$": "Ma, Jiangquan"
          },
          {
            "@_fa": "true",
            "$": "Zhang, Shule"
          },
          {
            "@_fa": "true",
            "$": "Zhong, Qin"
          }
        ],
        "link": [
          {
            "@_fa": "true",
            "@rel": "self",
            "@href": "https://api.elsevier.com/content/article/pii/S2468823121003886"
          },
          {
            "@_fa": "true",
            "@rel": "scidir",
            "@href": "https://www.sciencedirect.com/science/article/pii/S2468823121003886"
          }
        ],
        "dc:format": "application/json",
        "openaccessType": null,
        "pii": "S2468-8231(21)00388-6",
        "prism:volume": "512",
        "articleNumber": "111771",
        "prism:publisher": "Elsevier B.V.",
        "dc:title": "Promotional effect of surface fluorine species on CeO2 catalyst for toluene oxidation",
        "prism:copyright": "© 2021 Elsevier B.V. All rights reserved.",
        "openaccess": "0",
        "prism:issn": "24688231",
        "dcterms:subject": [
          {
            "@_fa": "true",
            "$": "Fluorine modified"
          },
          {
            "@_fa": "true",
            "$": "Surface fluorine"
          },
          {
            "@_fa": "true",
            "$": "Formation energy"
          },
          {
            "@_fa": "true",
            "$": "Toluene oxidation"
          }
        ],
        "openaccessArticle": "false",
        "prism:publicationName": "Molecular Catalysis",
        "openaccessSponsorType": null,
        "prism:pageRange": "111771",
        "pubType": "fla",
        "prism:coverDisplayDate": "August 2021",
        "prism:doi": "10.1016/j.mcat.2021.111771",
        "prism:startingPage": "111771",
        "dc:identifier": "doi:10.1016/j.mcat.2021.111771",
        "openaccessSponsorName": null
      },
      "objects": {
        "object": [
          {
            "@category": "standard",
            "@height": "269",
            "@width": "339",
            "@_fa": "true",
            "$": "https://api.elsevier.com/content/object/eid/1-s2.0-S2468823121003886-gr3.jpg?httpAccept=%2A%2F%2A",
            "@multimediatype": "JPEG image file",
            "@type": "IMAGE-DOWNSAMPLED",
            "@size": "28142",
            "@ref": "gr3",
            "@mimetype": "image/jpeg"
          },
          {
            "@category": "standard",
            "@height": "269",
            "@width": "339",
            "@_fa": "true",
            "$": "https://api.elsevier.com/content/object/eid/1-s2.0-S2468823121003886-gr2.jpg?httpAccept=%2A%2F%2A",
            "@multimediatype": "JPEG image file",
            "@type": "IMAGE-DOWNSAMPLED",
            "@size": "26562",
            "@ref": "gr2",
            "@mimetype": "image/jpeg"
          },
          {
            "@category": "standard",
            "@height": "270",
            "@width": "339",
            "@_fa": "true",
            "$": "https://api.elsevier.com/content/object/eid/1-s2.0-S2468823121003886-gr1.jpg?httpAccept=%2A%2F%2A",
            "@multimediatype": "JPEG image file",
            "@type": "IMAGE-DOWNSAMPLED",
            "@size": "27987",
            "@ref": "gr1",
            "@mimetype": "image/jpeg"
          },
          {
            "@category": "standard",
            "@height": "224",
            "@width": "565",
            "@_fa": "true",
            "$": "https://api.elsevier.com/content/object/eid/1-s2.0-S2468823121003886-gr11.jpg?httpAccept=%2A%2F%2A",
            "@multimediatype": "JPEG image file",
            "@type": "IMAGE-DOWNSAMPLED",
            "@size": "26694",
            "@ref": "gr11",
            "@mimetype": "image/jpeg"
          },
          {
            "@category": "standard",
            "@height": "137",
            "@width": "339",
            "@_fa": "true",
            "$": "https://api.elsevier.com/content/object/eid/1-s2.0-S2468823121003886-gr12.jpg?httpAccept=%2A%2F%2A",
            "@multimediatype": "JPEG image file",
            "@type": "IMAGE-DOWNSAMPLED",
            "@size": "21877",
            "@ref": "gr12",
            "@mimetype": "image/jpeg"
          },
          {
            "@category": "standard",
            "@height": "269",
            "@width": "339",
            "@_fa": "true",
            "$": "https://api.elsevier.com/content/object/eid/1-s2.0-S2468823121003886-gr10.jpg?httpAccept=%2A%2F%2A",
            "@multimediatype": "JPEG image file",
            "@type": "IMAGE-DOWNSAMPLED",
            "@size": "34552",
            "@ref": "gr10",
            "@mimetype": "image/jpeg"
          },
          {
            "@category": "standard",
            "@height": "229",
            "@width": "565",
            "@_fa": "true",
            "$": "https://api.elsevier.com/content/object/eid/1-s2.0-S2468823121003886-gr9.jpg?httpAccept=%2A%2F%2A",
            "@multimediatype": "JPEG image file",
            "@type": "IMAGE-DOWNSAMPLED",
            "@size": "59785",
            "@ref": "gr9",
            "@mimetype": "image/jpeg"
          },
          {
            "@category": "standard",
            "@height": "270",
            "@width": "339",
            "@_fa": "true",
            "$": "https://api.elsevier.com/content/object/eid/1-s2.0-S2468823121003886-gr8.jpg?httpAccept=%2A%2F%2A",
            "@multimediatype": "JPEG image file",
            "@type": "IMAGE-DOWNSAMPLED",
            "@size": "28135",
            "@ref": "gr8",
            "@mimetype": "image/jpeg"
          },
          {
            "@category": "standard",
            "@height": "270",
            "@width": "339",
            "@_fa": "true",
            "$": "https://api.elsevier.com/content/object/eid/1-s2.0-S2468823121003886-gr7.jpg?httpAccept=%2A%2F%2A",
            "@multimediatype": "JPEG image file",
            "@type": "IMAGE-DOWNSAMPLED",
            "@size": "33411",
            "@ref": "gr7",
            "@mimetype": "image/jpeg"
          },
          {
            "@category": "standard",
            "@height": "271",
            "@width": "565",
            "@_fa": "true",
            "$": "https://api.elsevier.com/content/object/eid/1-s2.0-S2468823121003886-gr6.jpg?httpAccept=%2A%2F%2A",
            "@multimediatype": "JPEG image file",
            "@type": "IMAGE-DOWNSAMPLED",
            "@size": "108617",
            "@ref": "gr6",
            "@mimetype": "image/jpeg"
          },
          {
            "@category": "standard",
            "@height": "260",
            "@width": "339",
            "@_fa": "true",
            "$": "https://api.elsevier.com/content/object/eid/1-s2.0-S2468823121003886-gr5.jpg?httpAccept=%2A%2F%2A",
            "@multimediatype": "JPEG image file",
            "@type": "IMAGE-DOWNSAMPLED",
            "@size": "22660",
            "@ref": "gr5",
            "@mimetype": "image/jpeg"
          },
          {
            "@category": "standard",
            "@height": "469",
            "@width": "565",
            "@_fa": "true",
            "$": "https://api.elsevier.com/content/object/eid/1-s2.0-S2468823121003886-gr4.jpg?httpAccept=%2A%2F%2A",
            "@multimediatype": "JPEG image file",
            "@type": "IMAGE-DOWNSAMPLED",
            "@size": "73579",
            "@ref": "gr4",
            "@mimetype": "image/jpeg"
          },
          {
            "@category": "standard",
            "@height": "171",
            "@width": "301",
            "@_fa": "true",
            "$": "https://api.elsevier.com/content/object/eid/1-s2.0-S2468823121003886-ga1.jpg?httpAccept=%2A%2F%2A",
            "@multimediatype": "JPEG image file",
            "@type": "IMAGE-DOWNSAMPLED",
            "@size": "34721",
            "@ref": "ga1",
            "@mimetype": "image/jpeg"
          },
          {
            "@category": "thumbnail",
            "@height": "164",
            "@width": "206",
            "@_fa": "true",
            "$": "https://api.elsevier.com/content/object/eid/1-s2.0-S2468823121003886-gr3.sml?httpAccept=%2A%2F%2A",
            "@multimediatype": "GIF image file",
            "@type": "IMAGE-THUMBNAIL",
            "@size": "11199",
            "@ref": "gr3",
            "@mimetype": "image/gif"
          },
          {
            "@category": "thumbnail",
            "@height": "164",
            "@width": "206",
            "@_fa": "true",
            "$": "https://api.elsevier.com/content/object/eid/1-s2.0-S2468823121003886-gr2.sml?httpAccept=%2A%2F%2A",
            "@multimediatype": "GIF image file",
            "@type": "IMAGE-THUMBNAIL",
            "@size": "10144",
            "@ref": "gr2",
            "@mimetype": "image/gif"
          },
          {
            "@category": "thumbnail",
            "@height": "164",
            "@width": "206",
            "@_fa": "true",
            "$": "https://api.elsevier.com/content/object/eid/1-s2.0-S2468823121003886-gr1.sml?httpAccept=%2A%2F%2A",
            "@multimediatype": "GIF image file",
            "@type": "IMAGE-THUMBNAIL",
            "@size": "10732",
            "@ref": "gr1",
            "@mimetype": "image/gif"
          },
          {
            "@category": "thumbnail",
            "@height": "87",
            "@width": "219",
            "@_fa": "true",
            "$": "https://api.elsevier.com/content/object/eid/1-s2.0-S2468823121003886-gr11.sml?httpAccept=%2A%2F%2A",
            "@multimediatype": "GIF image file",
            "@type": "IMAGE-THUMBNAIL",
            "@size": "6613",
            "@ref": "gr11",
            "@mimetype": "image/gif"
          },
          {
            "@category": "thumbnail",
            "@height": "88",
            "@width": "219",
            "@_fa": "true",
            "$": "https://api.elsevier.com/content/object/eid/1-s2.0-S2468823121003886-gr12.sml?httpAccept=%2A%2F%2A",
            "@multimediatype": "GIF image file",
            "@type": "IMAGE-THUMBNAIL",
            "@size": "11202",
            "@ref": "gr12",
            "@mimetype": "image/gif"
          },
          {
            "@category": "thumbnail",
            "@height": "164",
            "@width": "206",
            "@_fa": "true",
            "$": "https://api.elsevier.com/content/object/eid/1-s2.0-S2468823121003886-gr10.sml?httpAccept=%2A%2F%2A",
            "@multimediatype": "GIF image file",
            "@type": "IMAGE-THUMBNAIL",
            "@size": "11209",
            "@ref": "gr10",
            "@mimetype": "image/gif"
          },
          {
            "@category": "thumbnail",
            "@height": "89",
            "@width": "219",
            "@_fa": "true",
            "$": "https://api.elsevier.com/content/object/eid/1-s2.0-S2468823121003886-gr9.sml?httpAccept=%2A%2F%2A",
            "@multimediatype": "GIF image file",
            "@type": "IMAGE-THUMBNAIL",
            "@size": "9739",
            "@ref": "gr9",
            "@mimetype": "image/gif"
          },
          {
            "@category": "thumbnail",
            "@height": "164",
            "@width": "206",
            "@_fa": "true",
            "$": "https://api.elsevier.com/content/object/eid/1-s2.0-S2468823121003886-gr8.sml?httpAccept=%2A%2F%2A",
            "@multimediatype": "GIF image file",
            "@type": "IMAGE-THUMBNAIL",
            "@size": "10898",
            "@ref": "gr8",
            "@mimetype": "image/gif"
          },
          {
            "@category": "thumbnail",
            "@height": "164",
            "@width": "206",
            "@_fa": "true",
            "$": "https://api.elsevier.com/content/object/eid/1-s2.0-S2468823121003886-gr7.sml?httpAccept=%2A%2F%2A",
            "@multimediatype": "GIF image file",
            "@type": "IMAGE-THUMBNAIL",
            "@size": "12455",
            "@ref": "gr7",
            "@mimetype": "image/gif"
          },
          {
            "@category": "thumbnail",
            "@height": "105",
            "@width": "219",
            "@_fa": "true",
            "$": "https://api.elsevier.com/content/object/eid/1-s2.0-S2468823121003886-gr6.sml?httpAccept=%2A%2F%2A",
            "@multimediatype": "GIF image file",
            "@type": "IMAGE-THUMBNAIL",
            "@size": "21303",
            "@ref": "gr6",
            "@mimetype": "image/gif"
          },
          {
            "@category": "thumbnail",
            "@height": "164",
            "@width": "214",
            "@_fa": "true",
            "$": "https://api.elsevier.com/content/object/eid/1-s2.0-S2468823121003886-gr5.sml?httpAccept=%2A%2F%2A",
            "@multimediatype": "GIF image file",
            "@type": "IMAGE-THUMBNAIL",
            "@size": "9902",
            "@ref": "gr5",
            "@mimetype": "image/gif"
          },
          {
            "@category": "thumbnail",
            "@height": "164",
            "@width": "197",
            "@_fa": "true",
            "$": "https://api.elsevier.com/content/object/eid/1-s2.0-S2468823121003886-gr4.sml?httpAccept=%2A%2F%2A",
            "@multimediatype": "GIF image file",
            "@type": "IMAGE-THUMBNAIL",
            "@size": "12726",
            "@ref": "gr4",
            "@mimetype": "image/gif"
          },
          {
            "@category": "thumbnail",
            "@height": "124",
            "@width": "219",
            "@_fa": "true",
            "$": "https://api.elsevier.com/content/object/eid/1-s2.0-S2468823121003886-ga1.sml?httpAccept=%2A%2F%2A",
            "@multimediatype": "GIF image file",
            "@type": "IMAGE-THUMBNAIL",
            "@size": "13446",
            "@ref": "ga1",
            "@mimetype": "image/gif"
          },
          {
            "@category": "high",
            "@height": "1192",
            "@width": "1500",
            "@_fa": "true",
            "$": "https://api.elsevier.com/content/object/eid/1-s2.0-S2468823121003886-gr3_lrg.jpg?httpAccept=%2A%2F%2A",
            "@multimediatype": "JPEG image file",
            "@type": "IMAGE-HIGH-RES",
            "@size": "195778",
            "@ref": "gr3",
            "@mimetype": "image/jpeg"
          },
          {
            "@category": "high",
            "@height": "1192",
            "@width": "1500",
            "@_fa": "true",
            "$": "https://api.elsevier.com/content/object/eid/1-s2.0-S2468823121003886-gr2_lrg.jpg?httpAccept=%2A%2F%2A",
            "@multimediatype": "JPEG image file",
            "@type": "IMAGE-HIGH-RES",
            "@size": "174355",
            "@ref": "gr2",
            "@mimetype": "image/jpeg"
          },
          {
            "@category": "high",
            "@height": "1193",
            "@width": "1500",
            "@_fa": "true",
            "$": "https://api.elsevier.com/content/object/eid/1-s2.0-S2468823121003886-gr1_lrg.jpg?httpAccept=%2A%2F%2A",
            "@multimediatype": "JPEG image file",
            "@type": "IMAGE-HIGH-RES",
            "@size": "185316",
            "@ref": "gr1",
            "@mimetype": "image/jpeg"
          },
          {
            "@category": "high",
            "@height": "993",
            "@width": "2500",
            "@_fa": "true",
            "$": "https://api.elsevier.com/content/object/eid/1-s2.0-S2468823121003886-gr11_lrg.jpg?httpAccept=%2A%2F%2A",
            "@multimediatype": "JPEG image file",
            "@type": "IMAGE-HIGH-RES",
            "@size": "197742",
            "@ref": "gr11",
            "@mimetype": "image/jpeg"
          },
          {
            "@category": "high",
            "@height": "604",
            "@width": "1500",
            "@_fa": "true",
            "$": "https://api.elsevier.com/content/object/eid/1-s2.0-S2468823121003886-gr12_lrg.jpg?httpAccept=%2A%2F%2A",
            "@multimediatype": "JPEG image file",
            "@type": "IMAGE-HIGH-RES",
            "@size": "152493",
            "@ref": "gr12",
            "@mimetype": "image/jpeg"
          },
          {
            "@category": "high",
            "@height": "1192",
            "@width": "1500",
            "@_fa": "true",
            "$": "https://api.elsevier.com/content/object/eid/1-s2.0-S2468823121003886-gr10_lrg.jpg?httpAccept=%2A%2F%2A",
            "@multimediatype": "JPEG image file",
            "@type": "IMAGE-HIGH-RES",
            "@size": "218763",
            "@ref": "gr10",
            "@mimetype": "image/jpeg"
          },
          {
            "@category": "high",
            "@height": "1014",
            "@width": "2500",
            "@_fa": "true",
            "$": "https://api.elsevier.com/content/object/eid/1-s2.0-S2468823121003886-gr9_lrg.jpg?httpAccept=%2A%2F%2A",
            "@multimediatype": "JPEG image file",
            "@type": "IMAGE-HIGH-RES",
            "@size": "762955",
            "@ref": "gr9",
            "@mimetype": "image/jpeg"
          },
          {
            "@category": "high",
            "@height": "1193",
            "@width": "1500",
            "@_fa": "true",
            "$": "https://api.elsevier.com/content/object/eid/1-s2.0-S2468823121003886-gr8_lrg.jpg?httpAccept=%2A%2F%2A",
            "@multimediatype": "JPEG image file",
            "@type": "IMAGE-HIGH-RES",
            "@size": "181838",
            "@ref": "gr8",
            "@mimetype": "image/jpeg"
          },
          {
            "@category": "high",
            "@height": "1193",
            "@width": "1500",
            "@_fa": "true",
            "$": "https://api.elsevier.com/content/object/eid/1-s2.0-S2468823121003886-gr7_lrg.jpg?httpAccept=%2A%2F%2A",
            "@multimediatype": "JPEG image file",
            "@type": "IMAGE-HIGH-RES",
            "@size": "226490",
            "@ref": "gr7",
            "@mimetype": "image/jpeg"
          },
          {
            "@category": "high",
            "@height": "1201",
            "@width": "2500",
            "@_fa": "true",
            "$": "https://api.elsevier.com/content/object/eid/1-s2.0-S2468823121003886-gr6_lrg.jpg?httpAccept=%2A%2F%2A",
            "@multimediatype": "JPEG image file",
            "@type": "IMAGE-HIGH-RES",
            "@size": "786791",
            "@ref": "gr6",
            "@mimetype": "image/jpeg"
          },
          {
            "@category": "high",
            "@height": "1149",
            "@width": "1500",
            "@_fa": "true",
            "$": "https://api.elsevier.com/content/object/eid/1-s2.0-S2468823121003886-gr5_lrg.jpg?httpAccept=%2A%2F%2A",
            "@multimediatype": "JPEG image file",
            "@type": "IMAGE-HIGH-RES",
            "@size": "146696",
            "@ref": "gr5",
            "@mimetype": "image/jpeg"
          },
          {
            "@category": "high",
            "@height": "2075",
            "@width": "2500",
            "@_fa": "true",
            "$": "https://api.elsevier.com/content/object/eid/1-s2.0-S2468823121003886-gr4_lrg.jpg?httpAccept=%2A%2F%2A",
            "@multimediatype": "JPEG image file",
            "@type": "IMAGE-HIGH-RES",
            "@size": "554478",
            "@ref": "gr4",
            "@mimetype": "image/jpeg"
          },
          {
            "@category": "high",
            "@height": "757",
            "@width": "1333",
            "@_fa": "true",
            "$": "https://api.elsevier.com/content/object/eid/1-s2.0-S2468823121003886-ga1_lrg.jpg?httpAccept=%2A%2F%2A",
            "@multimediatype": "JPEG image file",
            "@type": "IMAGE-HIGH-RES",
            "@size": "210174",
            "@ref": "ga1",
            "@mimetype": "image/jpeg"
          },
          {
            "@category": "standard",
            "@_fa": "true",
            "$": "https://api.elsevier.com/content/object/eid/1-s2.0-S2468823121003886-mmc1.docx?httpAccept=%2A%2F%2A",
            "@multimediatype": "Microsoft Word file",
            "@type": "APPLICATION",
            "@size": "3640852",
            "@ref": "mmc1",
            "@mimetype": "application/word"
          },
          {
            "@category": "standard",
            "@_fa": "true",
            "$": "https://api.elsevier.com/content/object/eid/1-s2.0-S2468823121003886-am.pdf?httpAccept=%2A%2F%2A",
            "@multimediatype": "Acrobat PDF file",
            "@type": "AAM-PDF",
            "@size": "3847649",
            "@ref": "am",
            "@mimetype": "application/pdf"
          }
        ]
      },
      "link": {
        "@rel": "abstract",
        "@href": "https://api.elsevier.com/content/abstract/scopus_id/85111309526"
      }
    }
  }
}