{
  "metadata": {
    "title": "Computational screening of transition metal atom doped C<ce:inf loc=post>3</ce:inf>N as electrocatalysts for nitrogen fixation",
    "authors": "; ; ",
    "journal": "Molecular Catalysis",
    "date": "2023-01-15",
    "doi": "10.1016/j.mcat.2022.112888",
    "abstract": "",
    "uri": "https://api.elsevier.com/content/article/pii/S246882312200774X",
    "pii": "S246882312200774X"
  },
  "fulltext": {
    "full-text-retrieval-response": {
      "scopus-eid": "2-s2.0-85144851960",
      "originalText": "serial JL 315758 291210 291744 291790 291809 31 Molecular Catalysis MOLECULARCATALYSIS 2022-12-23 2022-12-23 2022-12-23 2022-12-23 2023-01-07T15:56:45 1-s2.0-S246882312200774X S2468-8231(22)00774-X S246882312200774X 10.1016/j.mcat.2022.112888 S300 S300.1 FULL-TEXT 1-s2.0-S2468823122X00187 2024-06-26T17:47:58.012062Z 0 0 20230115 2023 2022-12-24T00:23:04.333356Z absattachment articleinfo articlenumber articletitlenorm authfirstinitialnorm authfirstsurnamenorm cid cids contenttype copyright crossmark dateloaded dateloadedtxt datesearch datesort dateupdated dco docsubtype doctype doi eid ewtransactionid hubeid indexeddate issn issnnorm itemstage itemtransactionid itemweight openaccess openarchive pg pgfirst pii piinorm pubdatestart pubdatetxt pubyr sectiontitle sortorder srctitle srctitlenorm srctype ssids alllist content subj subheadings suppl tomb volfirst volissue volumelist webpdf webpdfpagecount yearnav figure table e-component body mmlmath acknowledge affil appendices articletitle auth authfirstini authfull authkeywords authlast highlightsabst orcid primabst ref specialabst 2468-8231 24688231 true 535 535 C Volume 535 65 112888 112888 112888 20230115 15 January 2023 2023-01-15 2023 Regular Papers article fla © 2022 Elsevier B.V. All rights reserved. COMPUTATIONALSCREENINGTRANSITIONMETALATOMDOPEDC3NELECTROCATALYSTSFORNITROGENFIXATION SONG W 1 Introduction 2 Computational methods 3 Results and discussion 3.1 Structure and stability of TM@C3N 3.2 Screening TM@C3N as NRR electrocatalysts 3.3 NRR mechanism on Fe-C@C3N 3.4 Origin of the catalytic activity of Fe@C3N 4 Conclusions Credit author statement Acknowledgments Appendix Supplementary materials References WU 2021 100310 T ZHAO 2022 100609 C WANG 2021 19247 19254 R WANG 2022 4623 4627 J QING 2020 5437 5516 G CHEN 2019 23416 23431 A SMITH 2020 331 344 C LI 2021 100431 Y FU 2021 159907 L ZHANG 2022 28900 28910 Z XU 2022 14472 14478 W YAO 2022 117735 D QIAO 2011 634 641 B YANG 2013 1740 1748 X CHEN 2017 7041 7045 Y LI 2019 1902031 X LANG 2020 11986 12043 R LV 2022 25317 25325 S HU 2022 27861 27872 X LI 2022 13384 13398 R YANG 2020 1 8 T ZHANG 2022 129072 L SONG 2021 1712 1721 W SONG 2021 116516 W SONG 2021 10418 10428 W SONG 2021 066503 W SONG 2021 2100044 W HE 2019 1546 1551 T WANG 2021 151109 G FENG 2020 9216 9224 Z HOU 2022 153880 P CHEN 2022 5292 5306 Y SONG 2022 132746 W MAHMOOD 2016 7414 7419 J YANG 2017 1605625 S ZENG 2022 152474 Y HE 2018 20312 20322 B QIN 2018 2788 2795 G BHAURIYAL 2018 2481 2489 P XU 2017 1702007 J WANG 2021 2100003 J HE 2022 1051 1057 C SONG 2021 3137 3142 W KRESSE 1993 558 561 G KRESSE 1996 11169 11186 G BLOCHL 1994 17953 17979 P PERDEW 1996 3865 3868 J GRIMME 2006 1787 1799 S PETERSON 2010 1311 1315 A NORSKOV 2004 17886 17892 J ROSSMEISL 2005 178 184 J ZHOU 2017 2993 3001 X MAKAREMI 2017 18575 18583 M SHU 2021 1360 1365 W SONG 2022 13946 13957 W LIU 2019 9664 9672 X PEI 2020 105049 W SONG 2022 104318 W SONGX2023X112888 SONGX2023X112888XW 2024-12-23T00:00:00.000Z 2024-12-23T00:00:00.000Z http://creativecommons.org/licenses/by-nc-nd/4.0/ © 2022 Elsevier B.V. All rights reserved. 2022-12-31T04:59:30.637Z http://vtw.elsevier.com/data/voc/AddOnTypes/50.7/aggregated-refined National Natural Science Foundation of China 11904081 21603109 NSFC National Natural Science Foundation of China http://data.elsevier.com/vocabulary/SciValFunders/501100001809 http://sws.geonames.org/1814991/ Henan Institute of Technology KQ2006 HIT Harbin Institute of Technology http://data.elsevier.com/vocabulary/SciValFunders/501100003472 http://sws.geonames.org/1814991/ 22A150009 22B430013 Education Department of Henan Province http://data.elsevier.com/vocabulary/SciValFunders/501100009101 http://sws.geonames.org/1814991 Education Department of Jilin Province and Science and Technology Plan JJKH20211042KJ Science and Technology Innovation Talents Project of Henan Province 21HASTIT021 Henan Province Science and Technology Innovation Talent Program http://data.elsevier.com/vocabulary/SciValFunders/501100018607 http://sws.geonames.org/1814991/ Natural Science Foundation of Henan Department of Education Major Science and Technology Project of Xinxiang City 21ZD009 The authors thank the National Natural Science Foundation of China for financial support (Nos. 21603109 and 11904081). This research is also supported by Natural Science Foundation of Henan Department of Education (Nos. 22A150009 and 22B430013), the Doctor Initial Research Program of Henan Institute of Technology (No. KQ2006), the Science and Technology Innovation Talents Project of Henan Province (No. 21HASTIT021), the Major Science and Technology Project of Xinxiang City (No. 21ZD009) and the Education Department of Jilin Province and Science and Technology Plan (No. JJKH20211042KJ). 0 https://doi.org/10.15223/policy-017 https://doi.org/10.15223/policy-037 https://doi.org/10.15223/policy-012 https://doi.org/10.15223/policy-029 https://doi.org/10.15223/policy-004 item S2468-8231(22)00774-X S246882312200774X 1-s2.0-S246882312200774X 10.1016/j.mcat.2022.112888 315758 2023-01-07T16:15:48.585611Z 2023-01-15 1-s2.0-S246882312200774X-main.pdf https://s3-eu-west-1.amazonaws.com/prod-ucs-content-store-eu-west/content/pii:S246882312200774X/MAIN/application/pdf/5f980bc187c48e12f4f77d5a05c28400/main.pdf main.pdf pdf true 6112244 MAIN 8 1-s2.0-S246882312200774X-main_1.png https://s3-eu-west-1.amazonaws.com/prod-ucs-content-store-eu-west/content/pii:S246882312200774X/PREVIEW/image/png/56984b5708da03ddbd8bc5ede8a5bc30/main_1.png main_1.png png 57911 849 656 IMAGE-WEB-PDF 1 1-s2.0-S246882312200774X-gr1.jpg https://s3-eu-west-1.amazonaws.com/prod-ucs-content-store-eu-west/content/pii:S246882312200774X/gr1/DOWNSAMPLED/image/jpeg/cc1c7ef4dc05fa0073de8dbd3429961d/gr1.jpg gr1 gr1.jpg jpg 78683 385 376 IMAGE-DOWNSAMPLED 1-s2.0-S246882312200774X-gr5.jpg https://s3-eu-west-1.amazonaws.com/prod-ucs-content-store-eu-west/content/pii:S246882312200774X/gr5/DOWNSAMPLED/image/jpeg/d9345987fb11c114045d5bff7fee8a52/gr5.jpg gr5 gr5.jpg jpg 121781 614 565 IMAGE-DOWNSAMPLED 1-s2.0-S246882312200774X-gr4.jpg https://s3-eu-west-1.amazonaws.com/prod-ucs-content-store-eu-west/content/pii:S246882312200774X/gr4/DOWNSAMPLED/image/jpeg/1e8b51a5a4efea73185326b970e1b1f8/gr4.jpg gr4 gr4.jpg jpg 59132 265 753 IMAGE-DOWNSAMPLED 1-s2.0-S246882312200774X-gr3.jpg https://s3-eu-west-1.amazonaws.com/prod-ucs-content-store-eu-west/content/pii:S246882312200774X/gr3/DOWNSAMPLED/image/jpeg/a517f0aa2293fd947d530aefa1743cb4/gr3.jpg gr3 gr3.jpg jpg 25860 198 376 IMAGE-DOWNSAMPLED 1-s2.0-S246882312200774X-gr10.jpg https://s3-eu-west-1.amazonaws.com/prod-ucs-content-store-eu-west/content/pii:S246882312200774X/gr10/DOWNSAMPLED/image/jpeg/4d29fce7e6e94777474b72ed747fd276/gr10.jpg gr10 gr10.jpg jpg 87424 260 753 IMAGE-DOWNSAMPLED 1-s2.0-S246882312200774X-gr2.jpg https://s3-eu-west-1.amazonaws.com/prod-ucs-content-store-eu-west/content/pii:S246882312200774X/gr2/DOWNSAMPLED/image/jpeg/da30c5a64a80787a22193acd0c33f8b2/gr2.jpg gr2 gr2.jpg jpg 40386 233 753 IMAGE-DOWNSAMPLED 1-s2.0-S246882312200774X-ga1.jpg https://s3-eu-west-1.amazonaws.com/prod-ucs-content-store-eu-west/content/pii:S246882312200774X/ga1/DOWNSAMPLED/image/jpeg/82d8551596cac30b4f7681f15ca73ffa/ga1.jpg ga1 true ga1.jpg jpg 16878 88 301 IMAGE-DOWNSAMPLED 1-s2.0-S246882312200774X-gr9.jpg https://s3-eu-west-1.amazonaws.com/prod-ucs-content-store-eu-west/content/pii:S246882312200774X/gr9/DOWNSAMPLED/image/jpeg/568ba6b787dd0496d9e46f92aa557657/gr9.jpg gr9 gr9.jpg jpg 51203 285 753 IMAGE-DOWNSAMPLED 1-s2.0-S246882312200774X-gr8.jpg https://s3-eu-west-1.amazonaws.com/prod-ucs-content-store-eu-west/content/pii:S246882312200774X/gr8/DOWNSAMPLED/image/jpeg/611f0775dca1e8172e95687841cbb584/gr8.jpg gr8 gr8.jpg jpg 102212 383 565 IMAGE-DOWNSAMPLED 1-s2.0-S246882312200774X-gr7.jpg https://s3-eu-west-1.amazonaws.com/prod-ucs-content-store-eu-west/content/pii:S246882312200774X/gr7/DOWNSAMPLED/image/jpeg/ce6ea6cb3317d1809e8d0cea90b847ab/gr7.jpg gr7 gr7.jpg jpg 52726 279 753 IMAGE-DOWNSAMPLED 1-s2.0-S246882312200774X-gr6.jpg https://s3-eu-west-1.amazonaws.com/prod-ucs-content-store-eu-west/content/pii:S246882312200774X/gr6/DOWNSAMPLED/image/jpeg/2ffb8cd0b64859c52666ca351e42f591/gr6.jpg gr6 gr6.jpg jpg 69988 238 753 IMAGE-DOWNSAMPLED 1-s2.0-S246882312200774X-gr1.sml https://s3-eu-west-1.amazonaws.com/prod-ucs-content-store-eu-west/content/pii:S246882312200774X/gr1/THUMBNAIL/image/gif/82e4e42bd0cacd40ec8dfd70cb41eff4/gr1.sml gr1 gr1.sml sml 17974 164 160 IMAGE-THUMBNAIL 1-s2.0-S246882312200774X-gr5.sml https://s3-eu-west-1.amazonaws.com/prod-ucs-content-store-eu-west/content/pii:S246882312200774X/gr5/THUMBNAIL/image/gif/54ecfce379ba84ad4acdcf9ae8da134b/gr5.sml gr5 gr5.sml sml 15297 164 151 IMAGE-THUMBNAIL 1-s2.0-S246882312200774X-gr4.sml https://s3-eu-west-1.amazonaws.com/prod-ucs-content-store-eu-west/content/pii:S246882312200774X/gr4/THUMBNAIL/image/gif/b9f182a79030cc647381fa46025777d8/gr4.sml gr4 gr4.sml sml 8425 77 219 IMAGE-THUMBNAIL 1-s2.0-S246882312200774X-gr3.sml https://s3-eu-west-1.amazonaws.com/prod-ucs-content-store-eu-west/content/pii:S246882312200774X/gr3/THUMBNAIL/image/gif/cb91296436dd5de3d94a891c42d2f207/gr3.sml gr3 gr3.sml sml 9110 115 219 IMAGE-THUMBNAIL 1-s2.0-S246882312200774X-gr10.sml https://s3-eu-west-1.amazonaws.com/prod-ucs-content-store-eu-west/content/pii:S246882312200774X/gr10/THUMBNAIL/image/gif/33199420be6f3a737c1e235ae28cbd0c/gr10.sml gr10 gr10.sml sml 10302 75 219 IMAGE-THUMBNAIL 1-s2.0-S246882312200774X-gr2.sml https://s3-eu-west-1.amazonaws.com/prod-ucs-content-store-eu-west/content/pii:S246882312200774X/gr2/THUMBNAIL/image/gif/03e79ffcfe36f4c28ef161b1ea76c965/gr2.sml gr2 gr2.sml sml 6618 68 219 IMAGE-THUMBNAIL 1-s2.0-S246882312200774X-ga1.sml https://s3-eu-west-1.amazonaws.com/prod-ucs-content-store-eu-west/content/pii:S246882312200774X/ga1/THUMBNAIL/image/gif/f8ecc404cf5bda6b5cb9b8cddc957ab7/ga1.sml ga1 true ga1.sml sml 8343 64 219 IMAGE-THUMBNAIL 1-s2.0-S246882312200774X-gr9.sml https://s3-eu-west-1.amazonaws.com/prod-ucs-content-store-eu-west/content/pii:S246882312200774X/gr9/THUMBNAIL/image/gif/fbd62d749e2bb456421d25d1e1d55e2d/gr9.sml gr9 gr9.sml sml 7484 83 219 IMAGE-THUMBNAIL 1-s2.0-S246882312200774X-gr8.sml https://s3-eu-west-1.amazonaws.com/prod-ucs-content-store-eu-west/content/pii:S246882312200774X/gr8/THUMBNAIL/image/gif/f81a22a2e5c96a6094d109aac0b783e8/gr8.sml gr8 gr8.sml sml 20125 148 219 IMAGE-THUMBNAIL 1-s2.0-S246882312200774X-gr7.sml https://s3-eu-west-1.amazonaws.com/prod-ucs-content-store-eu-west/content/pii:S246882312200774X/gr7/THUMBNAIL/image/gif/6b94263f53818df531502961d3f870cf/gr7.sml gr7 gr7.sml sml 7504 81 219 IMAGE-THUMBNAIL 1-s2.0-S246882312200774X-gr6.sml https://s3-eu-west-1.amazonaws.com/prod-ucs-content-store-eu-west/content/pii:S246882312200774X/gr6/THUMBNAIL/image/gif/85bb1e65919ecb1f0ffcecbc9b7b3e57/gr6.sml gr6 gr6.sml sml 8299 69 219 IMAGE-THUMBNAIL 1-s2.0-S246882312200774X-gr1_lrg.jpg https://s3-eu-west-1.amazonaws.com/prod-ucs-content-store-eu-west/content/pii:S246882312200774X/HIGHRES/image/jpeg/29b3564b6d7530ee3c45dfee8083b5a4/gr1_lrg.jpg gr1 gr1_lrg.jpg jpg 521607 1707 1667 IMAGE-HIGH-RES 1-s2.0-S246882312200774X-gr5_lrg.jpg https://s3-eu-west-1.amazonaws.com/prod-ucs-content-store-eu-west/content/pii:S246882312200774X/HIGHRES/image/jpeg/b50a39ad5885f1241ccd8914b847f52b/gr5_lrg.jpg gr5 gr5_lrg.jpg jpg 836934 2717 2500 IMAGE-HIGH-RES 1-s2.0-S246882312200774X-gr4_lrg.jpg https://s3-eu-west-1.amazonaws.com/prod-ucs-content-store-eu-west/content/pii:S246882312200774X/HIGHRES/image/jpeg/05b8d34b5e38f1aa3f723975a7d4b144/gr4_lrg.jpg gr4 gr4_lrg.jpg jpg 393951 1172 3333 IMAGE-HIGH-RES 1-s2.0-S246882312200774X-gr3_lrg.jpg https://s3-eu-west-1.amazonaws.com/prod-ucs-content-store-eu-west/content/pii:S246882312200774X/HIGHRES/image/jpeg/b30a3ff9144b2e2ac3c2ef51b845aa64/gr3_lrg.jpg gr3 gr3_lrg.jpg jpg 164228 876 1667 IMAGE-HIGH-RES 1-s2.0-S246882312200774X-gr10_lrg.jpg https://s3-eu-west-1.amazonaws.com/prod-ucs-content-store-eu-west/content/pii:S246882312200774X/HIGHRES/image/jpeg/bc09f2c4246292b4abd8e55996c2cc21/gr10_lrg.jpg gr10 gr10_lrg.jpg jpg 633782 1149 3333 IMAGE-HIGH-RES 1-s2.0-S246882312200774X-gr2_lrg.jpg https://s3-eu-west-1.amazonaws.com/prod-ucs-content-store-eu-west/content/pii:S246882312200774X/HIGHRES/image/jpeg/9b6727c84d89735e5ff2e060acb55867/gr2_lrg.jpg gr2 gr2_lrg.jpg jpg 258878 1031 3333 IMAGE-HIGH-RES 1-s2.0-S246882312200774X-ga1_lrg.jpg https://s3-eu-west-1.amazonaws.com/prod-ucs-content-store-eu-west/content/pii:S246882312200774X/HIGHRES/image/jpeg/94ce0ac2e827d5d3642cd272ade95a41/ga1_lrg.jpg ga1 true ga1_lrg.jpg jpg 111410 389 1333 IMAGE-HIGH-RES 1-s2.0-S246882312200774X-gr9_lrg.jpg https://s3-eu-west-1.amazonaws.com/prod-ucs-content-store-eu-west/content/pii:S246882312200774X/HIGHRES/image/jpeg/6c7e03fc1f196ee714d09592884fc9a7/gr9_lrg.jpg gr9 gr9_lrg.jpg jpg 326615 1263 3333 IMAGE-HIGH-RES 1-s2.0-S246882312200774X-gr8_lrg.jpg https://s3-eu-west-1.amazonaws.com/prod-ucs-content-store-eu-west/content/pii:S246882312200774X/HIGHRES/image/jpeg/c9237d075eaf30d5d98e2345ed65a590/gr8_lrg.jpg gr8 gr8_lrg.jpg jpg 733619 1693 2500 IMAGE-HIGH-RES 1-s2.0-S246882312200774X-gr7_lrg.jpg https://s3-eu-west-1.amazonaws.com/prod-ucs-content-store-eu-west/content/pii:S246882312200774X/HIGHRES/image/jpeg/79416619c1c5890a87ee47ab97470862/gr7_lrg.jpg gr7 gr7_lrg.jpg jpg 347186 1233 3333 IMAGE-HIGH-RES 1-s2.0-S246882312200774X-gr6_lrg.jpg https://s3-eu-west-1.amazonaws.com/prod-ucs-content-store-eu-west/content/pii:S246882312200774X/HIGHRES/image/jpeg/347f8827a6574b809cab553c201124bf/gr6_lrg.jpg gr6 gr6_lrg.jpg jpg 441376 1055 3333 IMAGE-HIGH-RES 1-s2.0-S246882312200774X-mmc1.doc https://s3-eu-west-1.amazonaws.com/prod-ucs-content-store-eu-west/content/pii:S246882312200774X/mmc1/MAIN/application/msword/45a1bda26521f58b7ecde7c530d48238/mmc1.doc mmc1 mmc1.doc doc 3953152 APPLICATION 1-s2.0-S246882312200774X-si1.svg https://s3-eu-west-1.amazonaws.com/prod-ucs-content-store-eu-west/content/pii:S246882312200774X/image/svg+xml/2f8663d929e31a96db365aa72c9f6f80/si1.svg si1 si1.svg svg 8547 ALTIMG 1-s2.0-S246882312200774X-si2.svg https://s3-eu-west-1.amazonaws.com/prod-ucs-content-store-eu-west/content/pii:S246882312200774X/image/svg+xml/a5ad502d2e92c6bb4b0a5f4d86f4861a/si2.svg si2 si2.svg svg 15389 ALTIMG 1-s2.0-S246882312200774X-si3.svg https://s3-eu-west-1.amazonaws.com/prod-ucs-content-store-eu-west/content/pii:S246882312200774X/image/svg+xml/fc7b5fc0b324b0fac6fdf9c8491c43e6/si3.svg si3 si3.svg svg 9139 ALTIMG 1-s2.0-S246882312200774X-am.pdf https://s3-eu-west-1.amazonaws.com/prod-ucs-content-store-eu-west/content/egi:10HMS3DGZ7Q/MAIN/application/pdf/25228aeb1f06f8904b70d1f3f916b02c/am.pdf am am.pdf pdf false 18952674 AAM-PDF MCAT 112888 112888 S2468-8231(22)00774-X 10.1016/j.mcat.2022.112888 Fig. 1 (a) The (3 × 3) supercell structures of C3N surface; The TM atom doped C and N sites of C3N for (b) TM-C@C3N and (c) TM-N@C3N (TM= Cr, Mn, Fe, Co), respectively. Fig 1 Fig. 2 (a) Adsorption energy (E ads) of N2 on TM@C3N; (b) Screening results of TM@C3N for the NRR based on the free energy of *N2H formation (ΔG(*N2→*N2H)). Fig 2 Fig. 3 N–N bond length (d N N) vs. Bader charge (Q) transfer from TM@C3N to N2. Fig 3 Fig. 4 (a) Free energy diagram for the HER (ΔG H) on TM@C3N; (b) Adsorption energy (E ads(*H)) and adsorption energy difference of *H and *N2 on TM@C3N (ΔE = E ads(*N2) – E ads(*H)). Fig 4 Fig. 5 Optimized geometric structures of various intermediates adsorbed on Fe-C@C3N, respectively. Fig 5 Fig. 6 (a) Free energy diagrams of the NRR process at zero (blue lines) and applied potential (red lines) of various reaction intermediates adsorbed on Fe-C@C3N via the enzymatic pathway; (b) Fe–N bond length (d Fe-N), adsorption energy (E ads) and magnetic moment (M) of NxHy (x = 1, 2; y = 0 to 4) on Fe-C@C3N, respectively. Fig 6 Fig. 7 (a) Schematic structures of three moieties for N2H adsorbed on Fe-C@C3N; (b) Bader charge variations (Q) of three moieties along the enzymatic pathway. Moieties 1, 2, and 3 represent C3N surface, Fe atom with neighboring two C atoms and one N atom, as well as *NxHy species, respectively. Fig 7 Fig. 8 Charge density difference maps of the optimized structures for *NxHy adsorbed on Fe-C@C3N, where the isosurface value is set to be 0.005 e/Å3 and the yellow and cyan color represent the charge accumulation and depletion, respectively. Fig 8 Fig. 9 Crystal orbital Hamilton population (COHP) between N–N bond for (a)*N–*N; (b) *N–*NH; (c) *NH–*NH; and (d) *NH–*NH2 adsorbed on Fe-C@C3N, respectively. Fig 9 Fig. 10 (a) Density of states (DOS) of C3N and Fe-C@C3N, the Fermi level is set to zero in the dotted line. (b) Temperature and energy fluctuations of Fe-C@C3N, the insets illustrate the top and side view of Fe-C@C3N after 10 ps AIMD simulation at T = 500 K. Fig 10 Table 1 Formation energy (E f) of TM (TM= Cr, Mn, Fe, Co) atoms doped C3N surface. Table 1 Cr-C@C3N Mn-C@C3N Fe-C@C3N Co-C@C3N E f (in eV) –4.32 –3.77 –3.18 –1.92 Cr-N@C3N Mn-N@C3N Fe-N@C3N Co-N@C3N E f (in eV) –3.90 –3.40 –3.02 –2.33 Computational screening of transition metal atom doped C3N as electrocatalysts for nitrogen fixation Wei Song a Chensi Li a Pengfei Ma b Xiao Liu a Yongliang Guo a Meng Jia c Wei Zhang d ⁎ Chaozheng He e f ⁎ a School of Science, Henan Institute of Technology, Xinxiang 453003, PR China School of Science, Henan Institute of Technology Xinxiang 453003 PR China aSchool of Science, Henan Institute of Technology, Xinxiang 453003, PR China b School of 3D Printing, Xinxiang University, Xinxiang 453003, PR China School of 3D Printing, Xinxiang University Xinxiang 453003 PR China bSchool of 3D Printing, Xinxiang University, Xinxiang 453003, PR China c School of Mechnical and Electrical Engineering, Xinxiang University, Xinxiang 453003, PR China School of Mechnical and Electrical Engineering, Xinxiang University Xinxiang 453003 PR China cSchool of Mechnical and Electrical Engineering, Xinxiang University, Xinxiang 453003, PR China d International Center of Computational Method and Software, College of Physics, Jilin University, Changchun 130012, PR China International Center of Computational Method and Software College of Physics, Jilin University Changchun 130012 PR China dInternational Center of Computational Method and Software, College of Physics, Jilin University, Changchun 130012, PR China e School of Materials Science and Chemical Engineering, Xi'an Technological University, Xi'an 710021, PR China School of Materials Science and Chemical Engineering, Xi'an Technological University Xi'an 710021 PR China eSchool of Materials Science and Chemical Engineering, Xi'an Technological University, Xi'an 710021, PR China f Institute of Environmental and Energy Catalysis, School of Materials Science and Chemical Engineering, Xi'an Technological University, Xi'an 710021, PR China Institute of Environmental and Energy Catalysis, School of Materials Science and Chemical Engineering, Xi'an Technological University Xi'an 710021 PR China cInstitute of Environmental and Energy Catalysis, School of Materials Science and Chemical Engineering, Xi'an Technological University, Xi'an 710021, PR China ⁎ Corresponding authors. NH3 is the main product of nitrogen reduction and is not only an indispensable fertilizer component but also a promising clean energy carrier. The electrocatalytic nitrogen reduction reaction (NRR) can reduce N2 to NH3 under ambient conditions and is one of the most promising technologies to replace the traditional Haber–Bosch process. The careful choice and design of electrocatalysts are both key to achieving an efficient electrocatalytic reaction. In this study, using density functional theory calculations, the catalytic performance of a series of 3d transition metal (TM = Cr, Mn, Fe, Co) single-atom catalysts supported on C3N (TM@C3N) was systematically investigated. The best NRR performance was achieved for the Fe-C@C3N catalyst, and the reaction follows the enzymatic mechanism. Crucially, at a limiting potential of –0.49 V, the competitive hydrogen evolution reaction was effectively inhibited. Furthermore, the electronic properties of the reaction intermediates and Fe-C@C3N were analyzed to reveal the reasons for its high activity. The results of this study will help us understand the catalytic performance of TM-atom-doped C3N and aid the design of more active C3N-based NRR catalysts. Graphical abstract Fig. (a) N–N bond length (dNN) vs. Bader charge (Q) transfer from TM@C3N to N2; (b) Adsorption energy (Eads(*H)) and adsorption energy difference of *H and *N2 on TM@C3N (ΔE = Eads(*N2) – Eads(*H)). Image, graphical abstract Keywords Nitrogen reduction reaction Electrocatalysts DFT calculations Dope C3N surface Data availability Data will be made available on request. 1 Introduction Ammonia (NH3) is an important raw material for the production of fertilizer, medicines, and other products and, thus, plays an important role in human agriculture and society. However, the traditional industrial method for producing NH3 (the Haber–Bosch reaction) consumes a large amount of non-renewable energy resources. This will accelerate the emission of greenhouse gasses that are causing global heating, glacial melting, and other problems that serious threaten human society. Therefore, it is crucial to develop sustainable, economical, and environmentally friendly methods for NH3 synthesis to solve the global energy shortage while not contributing to the greenhouse effect. The electrocatalytic nitrogen reduction reaction (NRR) using water as a hydrogen source can be powered by renewable energy and carried out under ambient conditions. As a result, the NRR represents a promising route for green, sustainable, and cost-effective NH3 production. Compared to the Haber–Bosch process, the electrocatalytic NRR has lower energy input and simplified reaction steps and is more environmentally friendly [1–12]. However, the process still requires effective catalysts to break the strong NN bond. Therefore, new designs for efficient electrocatalysts for N2 fixation are urgently required. In recent years, single-atom catalysts (SACs) have taken a leading position in the search for novel electrocatalysts [13–17]. The reduction of catalyst nanoparticles to a single atom can maximize catalyst utilization, and the distribution of single atoms on the support provides uniform active sites with high activity for the catalytic reaction. Nevertheless, the activity of SACs is highly influenced by the support [18–22]. Therefore, to design NRR electrocatalysts with high catalytic performance, it is urgent to screen the suitable supports. Good supports not only have a large specific surface area to disperse the isolated atoms but also a strong interaction with the SACs, thus preventing aggregation. Two-dimensional materials have been widely applied as supports for the electrocatalytic NRR because of their large surface areas, excellent electrical conductivities, high chemical stabilities, and adjustable electronic structures, as well as their useful morphological characteristics. Commonly used two-dimensional material supports include graphene [23, 24], graphyne (GY) [25–28], graphdiyne (GDY) [29, 30], graphite-like carbon nitride (g-C3N4) [31], polyaniline (C3N) [32], and molybdenum disulfide (MoS2) [33]. These surfaces are regarded as good supports for SACs because of their ability to enhance catalytic performance. For example, our research group has reported the catalytic performance of 3d and 4d TM single atoms supported on defective graphene (MVG and DVG) [23] and GY [25] as NRR catalysts. The highly active V@MVG and Mn@GY catalysts, which have free energy barriers for the NRR of 0.63 and 0.36 eV, were identified using density functional theory (DFT) calculations for catalyst activity and selectivity screening. Furthermore, by including the effects of S defect and stress, the catalytic activity of MoS2 as an NRR electrocatalyst was also investigated [33]. The results revealed that the S vacancy is the active site, and the application of tensile stress can enhance the catalytic activity and significantly inhibit the competitive hydrogen evolution reaction (HER). Hou et. al. investigated potential electrocatalysts for the NRR with TM single atoms anchored on g-t-C3N4. After a six-step screening process, Fe@g-t-C3N4 and Os@g-t-C3N4 were identified as SACs having good structural stability and high selectivity and activity [31]. Moreover, analysis of their thermodynamic and kinetic stability revealed their potential for real-world synthesis. Wang et. al. reported the catalytic performance of N-doped GDY for the electrochemical NRR, and electronic property analysis indicated that N-doping greatly promoted N2 adsorption and activation. In addition, the graphitic-C vacancies efficiently reduced N2 at a low limiting potential of –0.41 V in the Mars–van Krevelen (MvK) pathway [29]. There are many available two-dimensional supports, and C3N, a novel monolayer graphene-based nanomaterial, is particularly promising. C3N can be synthesized by the direct pyrolysis of hexaaminobenzene trihydrochloride single crystals [34] or by the polymerization of 2,3-diaminophenazine [35]. Because of its hexagonal honeycomb graphene-like structure, the mechanical properties and stability of C3N are even better those of graphene. Therefore, C3N has been widely studied and has shown outstanding performance in several research fields, including electrocatalysis [32, 36, 37], CO2 storage [38], and Na-, K- [39], and Li-ion batteries [40]. Chen et. al. used first principles calculations to investigate and screen the potential of TM single atoms anchored on defective C3N monolayers (TM-VCC) as candidate catalysts for N2 fixation. Their results showed that the Mn-VCC catalyst significantly inhibited the HER and exhibited excellent NRR activity, having the favorable limiting potential of −0.75 V through the distal pathway [32]. Zeng et. al. also chose monolayer C3N as an ideal theoretical model and designed Be-doped and Cr-doped C3N catalysts. The results exhibited rather low theoretical overpotentials of these catalysts with 0.476 and 0.216 eV, respectively, for the alkaline HER. He et. al. studied B-doped C3N monolayers in an acidic environment for the oxygen reduction reaction [37]. In addition to high catalytic activity, high selectivity is also essential for electrocatalyst design. Because the cleavage of the NN bond requires a large reduction potential, and the H atom has a large affinity for metals, the HER occurs easily, resulting in a decrease in the efficiency and selectivity of NH3 production. Therefore, it is necessary to suppress the HER by improving catalyst selectivity. Crucially, DFT calculations can be used to explain the reaction mechanism [41–43], thus allowing rational design and the development of new materials having properties that exceed those of current commercial catalysts. In this work, we systematically investigated the NRR performance of a series of 3d TM (TM = Cr, Mn, Fe, Co) single atom doped C3N as candidate electrocatalysts using DFT calculations. The results showed that Fe-C@C3N exhibited excellent activity with a low limiting potential of −0.49 V. Furthermore, the activity of the competitive HER was effectively suppressed, suggesting its promising selectivity for the NRR. 2 Computational methods All spin-polarized DFT calculations were performed using the Vienna Ab Initio Simulation Package (VASP). The interactions between the nuclei and valence electrons were described using the projected augmented wave (PAW) method. The exchange correlation effects were described using Perdew–Burke–Ernzerhof (PBE) functional for the generalized gradient approximation (GGA) [44–47]. To describe the van der Waals interactions, the empirical DFT-D3 method was used [48]. The plane-wave cutoff energy was set to 400 eV, the energy convergence precision was 10−5 eV, and the atomic relaxation convergence accuracy was less than 0.01 eV/Å per atom in force. For structural optimization and electronic property calculations, the k-points grids in the Brillouin zone were set to 3 × 3 × 1 and 7 × 7 × 1, respectively. The atoms in all structural optimizations were completely relaxed. The computational model for C3N was a 3 × 3 supercell containing 54 C atoms and 18 N atoms, and a 15 Å vacuum layer in the z-axis direction was used to avoid the interactions between adjacent periodic repeating units (Fig. 1 (a)). To demonstrate the kinetic stability of the catalyst, molecular dynamics simulations were performed in the NVT canonical ensemble. The thermodynamic stability of the TM-atom-doped C3N (TM@C3N) catalysts can be determined by calculating the formation energy (E f), as given by Eq. (1). (1) E f = E TM @ C 3 N + E C / N − E C 3 N − E TM Here, ETM@ C3N is the total energy of the TM-atom-dopd C3N surface, EC 3N is the energy of the pristine C3N surface, EC/N is the energy of atomic C and N in graphene and N2 molecule, and ETM is the energy of a TM single atom in metal bulk, respectively. Many nitrogen-containing intermediates are involved in the NRR electrocatalytic process. The adsorption strength of the intermediates on the active sites of the catalyst surface largely determines the catalytic effect. The adsorption strength can be expressed by the adsorption energy (E ads). A more negative E ads value indicates that the intermediates are adsorbed on the catalyst surface more strongly and the adsorption structure is more stable. These values can be calculated using Eq. (2). (2) E ads = E TM @ C 3 N − adso rbate − E TM @ C 3 N − E adso rbate Here, ETM@C3N-adsorbate, ETM@C3N , and Eadsorbate represent the total energy of the intermediates adsorbed on TM@C3N, the pure TM@C3N, and the energy of the intermediates, respectively. To evaluate the NRR catalytic performance of various systems, the computational hydrogen electrode (CHE) model was adopted to calculate the Gibbs free energy (ΔG) of the reaction intermediates [49–51]. The relationship between free energy and electrode potential can be obtained using this theoretical model. Using the CHE model, the trend in the ΔG of each intermediate at a given potential during the electrocatalytic reaction can be obtained. Then the potential-determining step (PDS) of the reaction can be determined, which can be used to screen for the best catalytic materials. The ΔG of each reaction step in the NRR can be calculated using Eq. (3). (3) Δ G = Δ E + Δ E Z P E − T Δ S + Δ G U + Δ G p H Here, ΔE is the total energy obtained from the DFT calculation, ΔE ZPE is the zero-point energy correction, T is the temperature (T = 298.15 K), and ΔS is the entropy change. ΔG U = –neU, where n is the number of transferred electrons and U is the electrode potential. In addition, ΔG pH = k B T × ln10 × pH, which is the ΔG value corrected for the H + concentration, and k B is the Boltzmann constant. In this study, chemical reactions under strongly acidic conditions were considered, so the pH was set to zero. Furthermore, the reaction H + + e− → 1/2H2 can reach equilibrium on a reversible hydrogen electrode without an applied voltage. Therefore, the total energy of one H ++ e− pair was equal to half the ΔG value of H2. The limiting potential (U L) is defined as U L = –ΔG max/e, in which ΔG max is the ΔG value of the PDS. 3 Results and discussion 3.1 Structure and stability of TM@C3N The primitive unit cell of C3N used in this study consisted of six C and two N atoms, and the optimized lattice parameter was 4.92 Å, which is consistent with the value reported previously [40, 52, 53]. A TM atom replaces one C or N atom in C3N to form two doped structures: TM-C@C3N and TM-N@C3N, as shown in Fig. 1(b) and 1(c), respectively. The interaction between the TM single atom and the support is very important for evaluating the stability and regulating the electronic properties to obtain high reactivity and selectivity. Therefore, the stability of TM-C@C3N and TM-N@C3N by calculating their formation energies (E f) were first determined. As shown in Table 1 , the E f values of all doped systems are negative, which indicates that the formation of TM-atom-doped C3N is favorable thermodynamically. Crucially, the TM-C@C3N and TM-N@C3N catalysts have high thermodynamic stability, suggesting that their synthesis might be experimentally favorable. 3.2 Screening TM@C3N as NRR electrocatalysts The adsorption and activation of N2 is a prerequisite for the entire NRR process to proceed smoothly. Therefore, the N2 adsorption on the different TM@C3N surfaces was first studied. The adsorption of N2 usually occurs in two configurations: in one, one of the N atoms at the end of N2 is connected to the TM atom active site; this is end-on adsorption. In the other, both N atoms are connected to the TM atom; this is side-on adsorption. The results are shown in Fig. 2 (a); compared to the side-on configuration, the end-on configuration of N2 is favored for TM@C3N. In particular, N2 was not adsorbed on Co@C3N in the side-on configuration. According to the Sabatier principle [54], the ideal NRR catalyst should have a moderately strong interaction with N2. This is because if the interaction between the catalyst and N2 is too weak, N2 cannot be fully activated, which will lead to a high activation barrier for the surface reaction. In contrast, if the interaction is too strong, NH3 desorption is disfavored, resulting in catalyst deactivation. The lavender colored region in Fig. 2(a) is the most favorable adsorption interval, having E ads ranging from –1.0 to –0.6 eV. Next, the NRR catalytic activities of the electrocatalysts were evaluated based on the ∆G value of the PDS. A smaller ∆G value indicates that the limiting potential and overpotential are lower. Thus, the energy input is also lower and the catalytic activity is higher. According to previous reports [25, 26, 55, 56], *N2H formation and *NH3 desorption are the key steps in the NRR, and the first (*N2→*N2H) and last (*NH2→*NH3) hydrogenation reactions are usually the PDS in the entire NRR. Therefore, to save computational resources, the ∆G values for *N2H formation were first calculated for screening, and the results are shown in Fig. 2(b). Among all candidate TM@C3N catalysts, only N2 adsorbed Fe-C@C3N in the side-on configuration, and this catalyst had a ∆G value of less than 0.6 eV. To determine the catalytic activities of the TM@C3N catalysts, we compared the N–N bond lengths (d N–N) and Bader charges of N2 adsorbed on the different TM@C3N surfaces. As shown in Fig. 3 (a), N2 adsorption in a side-on configuration was more conducive to weakening the N–N bond, and the d N–N values are larger, reaching more than 1.17 Å. In contrast, for N2 adsorption in the end-on configuration, the d N–N is only approximately 1.15 Å. In addition, we calculated the charge transfer between N2 and TM@C3N because a greater degree of charge transfer can activate N2 more efficiently, thus ensuring the subsequent hydrogenation step. Our calculations revealed that there was more charge transfer between N2 and TM@C3N, which resulted in an elongated N–N bond, thus activating N2 (Fig. 3(a)). Further, as shown in Fig. S1, the degree of stretching (d N–N) is positively correlated with the electron-withdrawing ability of N2, with an excellent linear correlation coefficient of R2 = 0.96 (end-on) and R2 = 0.87 (side-on), respectively. Thus, the adsorption of N2 in the side-on configuration is more conducive to the subsequent NRR steps. At the NRR reduction potential, the HER is the main competitive reaction [57, 58]. Therefore, an ideal NRR catalyst not only requires high NRR activity but must also be able to inhibit the HER effectively. The competition between HER and NRR can usually be evaluated in two ways: one is to calculate the adsorption free energy for atomic hydrogen (ΔG(*H)) and the other is to compare between E ads(*H) and E ads (*N2). Firstly, the absolute value of ΔG(*H) can used as a standard to judge the HER activity, as ΔG(*H) approaches zero, the catalytic activity for the HER increases. As shown in Fig. 4 (a), the absolute values of ΔG(*H) for the TM-N@C3N catalysts are small: 0.17, 0.19, and 0.20 eV for Fe-N@C3N, Mn-N@C3N, and Cr-N@C3N, respectively. This suggests that high HER activity on these surfaces could hinder NRR progress. In contrast, the absolute value of ΔG(*H) for TM-C@C3N is relatively large, so the NRR is more likely to occur over these catalysts than the HER. In addition, the competition between HER and NRR is also evaluated by the comparison between E ads(*N2) and E ads(*H). For this, the following relationship was used: ΔE = E ads(*N2) – E ads(*H). The adsorption of N2 is more favorable for ΔE < 0, which is benefit for the NRR process, while HER is more favorable for ΔE > 0. As shown in Fig. 4(b), except for Co-N@C3N, the E ads (*H) values are all negative (< –0.4 eV), indicating that H can be adsorbed stably on TM@C3N. Further calculation of the ΔE values revealed that all TM@C3N surfaces except Mn-N@C3N have high NRR selectivity. Based on the above analysis, Fe-C@C3N has a moderate strength of N2 adsorption, low energy barrier for the first hydrogenation step, and good NRR selectivity. Therefore, in the subsequent calculations, the entire NRR process was simulated using the Fe-C@C3N model. 3.3 NRR mechanism on Fe-C@C3N Based on the above screening, N2 adsorbed on Fe-C@C3N in the side-on configuration is most conducive to the subsequent NRR, and the reaction process should follow the enzymatic and consecutive pathways (Fig. S2). From Fig. 6(a) and S3, the PDS of both pathways is the first hydrogenation step (*N–*N → *N–*NH). It's worth noting that the enzymatic pathway is the more common pathway, therefore, the free energy and origin of the catalytic activity of Fe-C@C3N is studied by taking the enzymatic pathway as the representative. Next, the ΔG values of the entire enzymatic pathway were analyzed in detail. As shown in Figs. 5 and 6(a), the first hydrogenation step to generate *N–*NH requires an external energy supply of 0.49 eV. In the second hydrogenation step, the H + + e− pairs attack the other N atom connected to the Fe atom (*N–*NH → *NH–*NH), and this step has a ΔG value of 0.12 eV. Subsequently, the H + + e− pairs continue to attack the two N atoms alternately in processes having ΔG values of –0.66 and –0.88 eV, respectively. During the above hydrogenation process, the N–N bond is gradually weakened by the attack by H + + e− pairs, and the corresponding d N–N are 1.17, 1.26, 1.38, and 1.43 Å for *N–*N, *N–*NH, *NH–*NH, and *NH–*NH2, respectively. The N–N bond breaks completely after generating *NH2–*NH2. The distal N atom is then hydrogenated to release one molecule of NH3 and produce *NH2, releasing an energy of 0.62 eV. In the final hydrogenation step, *NH2 is hydrogenated to *NH3 with a ΔG value of 0.31 eV. Thus, the first hydrogenation (*N–*N → *N–*NH) step is the PDS, and the corresponding ΔG barrier is 0.49 eV. 3.4 Origin of the catalytic activity of Fe@C3N Further, the adsorption energies, magnetic moments, and Fe–N bond lengths of various intermediates (*N x H y (x = 1, 2; y = 0 to 4)) adsorbed on the Fe-C@C3N catalyst were calculated, as shown in Fig. 6 (b). The changes in E ads show that *N–*NH, *NH–*NH, *NH–*NH2, *NH2–*NH2, and *NH2 interact strongly with Fe-C@C3N, and their E ads values are all below –2.5 eV. As the hydrogenation process progressed, the E ads values decreased gradually, and the corresponding d Fe–N also decreased. Notably, after *NH–*NH2 adsorption, one of the Fe–N bond was significantly elongated, which should promote the complete breakage of the N–N bond in the *NH2–*NH2 structure. Meanwhile, as shown in Fig. 6(a), the ΔG values of these hydrogenation steps are also negative, indicating that these processes are exothermic reactions. In comparison, the adsorption of *N2 and *NH3 is obviously weaker, and the corresponding Fe–N bonds are longer. Therefore, the *N2H formation and *NH3 desorption reactions are endothermic and require additional energy input, which is also consistent with the previously calculated ΔG values. The electronic configuration of Fe is 3d64s2, and there are four unpaired electrons in the d orbital, which can generate the electron spin magnetic moment. Moreover, the distance between adjacent Fe atoms and the radius of the unfilled inner electron shell is relatively large, so Fe has strong magnetic properties. Magnetic materials play a pivotal role in production, life, national defense science and technology, and have also been widely used in new technologies of information, energy, biology and space. Therefore, we studied the changes in the magnetic moment. As shown in Fig. 6(b), there was an odd and even oscillation in the magnetic moment during the *N x H y adsorption process. In particular, after *N2 and *NH3 adsorption, the magnetic moment value is zero. To reveal the catalytic activity of Fe-C@C3N, the Bader charges were calculated, and the charge transfer between *N x H y species and Fe-C@C3N was analyzed. The Fe-C@C3N catalyst model with *N x H y can be divided into three moieties (Fig. 7 (a)): the C3N support (moiety 1), Fe atom with two neighboring C atoms and one N atom (moiety 2), and *N x H y species (moiety 3). As shown in Fig. 7(b), moiety 2 acts is the active part and is responsible for charge transfer between moiety 1 and moiety 3. Considering the direction and degree of charge transfer, moiety 1 is the main electron donor, except for during NH3 adsorption, and the change in the amount of charge is relatively stable. Further, the adsorption of N2 causes the charge lost by moiety 1 to be transferred to N2 and moiety 2. In contrast, *N–*NH and *NH–*NH obtain electrons from moiety 2 and moiety 3 simultaneously, although moiety 3 provides more electrons. As the hydrogenation reaction proceeds, the ability of the *N x H y species to withdraw electrons is weakened, whereas their ability to lose electrons is enhanced. Thus a large number of electrons are transferred to moiety 2. Notably, moiety 2 gradually changes from an electron donor to an electron acceptor, and the charge accumulation further activates the N–N bond, with *NH2–*NH2 having the largest charge transfer (0.96 e). The N–N bond is completely dissociated at this point. Next, charge density difference maps were plotted to reveal the origin of the interaction between *N x H y and Fe-C@C3N. As shown in Fig. 8 , there is bidirectional charge transfer between *N x H y and Fe-C@C3N. The empty orbital of the Fe atom accepts σ electrons from *N x H y and contributes electrons to the antibonding orbital of *N x H y . Significant charge accumulation and depletion occur simultaneously between the anchored Fe atom and *N x H y , and the N–N bond can be fully activated by an \"acceptance–donation\" process. In terms of the degree of charge transfer, there is an obvious bidirectional charge transfer between *NH2–*NH2 and Fe-C@C3N, which is also consistent with the calculated amounts of charge transfer. Furthermore, the binding strength of between N–N bond can be measured by the crystal orbital Hamilton population (COHP) obtained. The COHP curves of the N–N bond for the *N–*N, *N–*NH, *NH–*NH, and *NH–*NH2 adsorbed on Fe-C@C3N are plotted, respectively. From Fig. 9 , the synergistic effect of bonding and antibonding can promote the Fe-C@C3N to provide more electrons to the intermediates in order to further activate and elongate the N–N bond. As another typical descriptor, the integrated COHP (ICOHP) value is used to quantitatively evaluate the binding strength. And the more negative the ICOHP value indicates the higher the bonding degree. The ICOHP values of the N–N bond for *N–*N, *N–*NH, *NH–*NH, and *NH–*NH2 adsorbed on Fe-C@C3N are −20.30, −15.46, −11.99, and −10.51 eV, respectively. The corresponding d N–N are 1.17, 1.26, 1.38, and 1.43 Å (Fig. 5). It can be shown that with the process of hydrogenation, N–N bond is gradually activated, and the bond energy and bond length also monotonically decrease and increase, eventually leading to the destruction of N–N bond. Catalyst stability is also a key factor ensuring the smooth progress of catalytic reactions. Therefore, the influence of the Fe atom doped on the C3N surface on stability was analyzed. The projected density of states (PDOS) of the d orbitals of the Fe atom and p orbitals of the C and N atoms were plotted (Fig. 10 (a)). The results show that the Fe-3d, C-2p, and N-2p orbitals are obviously coupled below the Fermi level. This indicates the formation of stable bonds between Fe and the surrounding coordination atoms, suggesting the high chemical stability of Fe-C@C3N during the reaction. Finally, ab initio molecular dynamics (AIMD) simulation of the Fe-C@C3N catalyst was performed to determine its thermodynamic stability. From Fig. 10(b), it can be observed that the Fe-C@C3N structure is slightly deformed but retains its structural integrity after relaxation at 500 K for 10 ps, indicating that strong chemical bonds are formed between the Fe atom and C3N surface. Meanwhile, the energy of the system was constant during the entire simulation period, further indicating the good stability of the Fe-C@C3N system. 4 Conclusions In this study, the electronic structure of a two-dimensional C3N support was changed by TM atom doping, and TM-C2N and TM-C3 catalysts were designed as active sites for the electrocatalytic NRR. The best catalyst, Fe-C@C3N, was identified using DFT calculations of the energetics of N2 adsorption and activation, N2H formation, and HER inhibition, thus providing a theoretical basis for the preparation of new catalysts. Subsequently, the entire NRR catalytic process on the Fe-C@C3N surface was simulated. The results showed that the lowest limiting potential of –0.49 V was obtained through the enzymatic mechanism. The reason for the high catalytic activity of Fe-C@C3N was further clarified by analyzing the electronic characteristics. In particular, the large amount of charge transfer between the intermediates and Fe-C@C3N, as well as the strong hybridization between Fe-3d and C-2p and N-2p orbitals, enhanced the stability of the catalyst and ensured the smooth progress of the NRR. Therefore, the low limiting potential, good inhibition of HER, and high catalyst stability indicate that Fe-C@C3N is an NRR catalyst with high activity, selectivity, and stability. These findings provide suggestions for the development of catalysts for the sustainable production of NH3. Credit author statement Wei Song: Conceptualization, Data curation, Writing-Original draft preparation. Chensi Li: Data curation, Investigation. Pengfei Ma: Data curation, Formal analysis. Xiao Liu: Investigation, Formal analysis. Yongliang Guo: Methodology, Software, Validation. Meng Jia: Formal analysis, Visualization. Wei Zhang: Conceptualization, Writing-Reviewing and Editing. Chaozheng He: Conceptualization, Writing-Original draft preparation. Declaration of Competing Interest The authors declare that they have no known competing financial interests or personal relationships that could have appeared to influence the work reported in this paper. Acknowledgments The authors thank the National Natural Science Foundation of China for financial support (Nos. 21603109 and 11904081). This research is also supported by Natural Science Foundation of Henan Department of Education (Nos. 22A150009 and 22B430013), the Doctor Initial Research Program of Henan Institute of Technology (No. KQ2006), the Science and Technology Innovation Talents Project of Henan Province (No. 21HASTIT021), the Major Science and Technology Project of Xinxiang City (No. 21ZD009) and the Education Department of Jilin Province and Science and Technology Plan (No. JJKH20211042KJ). Supplementary materials Supplementary material associated with this article can be found, in the online version, at doi:10.1016/j.mcat.2022.112888. Appendix Supplementary materials Image, application 1 References [1] T. Wu W. Fan Y. Zhang F. Zhang Mater. Today. Phys. 16 2021 100310 T. Wu, W. Fan, Y. Zhang, F. Zhang, Mater. Today. Phys. 16 (2021) 100310. [2] C. Zhao M. Xi J. Huo C. He L. Fu Mater. Today. Phys. 22 2022 100609 C. Zhao, M. Xi, J. Huo, C. He, L. Fu, Mater. Today. Phys. 22 (2022) 100609. [3] R. Wang C. He W. Chen L. Fu C. Zhao J. Huo C. Sun Nanoscale 13 2021 19247 19254 R. Wang, C. He, W. Chen, L. Fu, C. Zhao, J. Huo, C. Sun, Nanoscale 13 (2021) 19247–19254. [4] J. Wang M. Shi G. Yi L. Wang S. Lei K. Xu S. Li J. Mu Chin. Chem. Lett. 33 2022 4623 4627 J. Wang, M. Shi, G. Yi, L. Wang, S. Lei, K. Xu, S. Li, J. Mu, Chin. Chem. Lett. 33 (2022) 4623–4627. [5] G. Qing R. Ghazfar S.T. Jackowski F. Habibzadeh M.M. Ashtiani C.P. Chen M.R. Smith T.W. Hamann Chem. Rev. 120 2020 5437 5516 G. Qing, R. Ghazfar, S.T. Jackowski, F. Habibzadeh, M.M. Ashtiani, C.P. Chen, M.R. Smith, T.W. Hamann, Chem. Rev. 120 (2020) 5437–5516. [6] A. Chen B. Xia J. Mater. Chem. A 7 2019 23416 23431 A. Chen, B. Xia, J. Mater. Chem. A 7 (2019) 23416–23431. [7] C. Smith A.K. Hill L. Torrente-Murciano Energ. Environ. Sci. 13 2020 331 344 C. Smith, A.K. Hill, L. Torrente-Murciano, Energ. Environ. Sci. 13 (2020) 331–344. [8] Y. Li S. Xiao X. Li C. Chang M. Xie J. Xu Z. Yang, Mater. Today. Phys. 19 2021 100431 Y. Li, S. Xiao, X. Li, C. Chang, M. Xie, J. Xu, Z. Yang, Mater. Today. Phys. 19 (2021) 100431. [9] L. Fu L. Yan L. Lin K. Xie L. Zhu C. He Z. Zhang J. Alloy. Compd. 875 2021 159907 L. Fu, L. Yan, L. Lin, K. Xie, L. Zhu, C. He, Z. Zhang, J. Alloy. Compd. 875 (2021) 159907. [10] Z. Zhang X. Xu ACS Appl. Mater. Interfaces 14 2022 28900 28910 Z. Zhang, X. Xu, ACS Appl. Mater. Interfaces 14 (2022) 28900–28910. [11] W. Xu X. Kang X. Duan Phys. Chem. Chem. Phys. 24 2022 14472 14478 W. Xu, X. Kang, X. Duan, Phys. Chem. Chem. Phys. 24 (2022) 14472–14478. [12] D. Yao C. Tang P. Wang H. Cheng H. Jin L. Ding S. Qiao Chem. Eng. Sci. 257 2022 117735 D. Yao, C. Tang, P. Wang, H. Cheng, H. Jin, L. Ding, S. Qiao, Chem. Eng. Sci. 257 (2022) 117735. [13] B. Qiao A. Wang X. Yang L.F. Allard Z. Jiang Y. Cui J. Liu J. Li T. Zhang Nat. Chem. 3 2011 634 641 B. Qiao, A. Wang, X. Yang, L.F. Allard, Z. Jiang, Y. Cui, J. Liu, J. Li, T. Zhang, Nat. Chem. 3 (2011) 634–641. [14] X. Yang A. Wang B. Qiao J. Li J. Liu T. Zhang Acc. Chem. Res. 46 2013 1740 1748 X. Yang, A. Wang, B. Qiao, J. Li, J. Liu, T. Zhang, Acc. Chem. Res. 46 (2013) 1740–1748. [15] Y. Chen S. Ji Y. Wang J. Dong W. Chen Z. Li R. Shen L. Zheng Z. Zhuang D. Wang Y. Li Angew. Chem. 129 2017 7041 7045 Y. Chen, S. Ji, Y. Wang, J. Dong, W. Chen, Z. Li, R. Shen, L. Zheng, Z. Zhuang, D. Wang, Y. Li, Angew. Chem. 129 (2017) 7041–7045. [16] X. Li X. Yang Y. Huang T. Zhang B. Liu Adv. Mater. 31 2019 1902031 X. Li, X. Yang, Y. Huang, T. Zhang, B. Liu, Adv. Mater. 31 (2019) 1902031. [17] R. Lang X. Du Y. Huang X. Jiang Q. Zhang Y. Guo K. Liu B. Qiao A. Wang T. Zhang Chem. Rev. 120 2020 11986 12043 R. Lang, X. Du, Y. Huang, X. Jiang, Q. Zhang, Y. Guo, K. Liu, B. Qiao, A. Wang, T. Zhang, Chem. Rev. 120 (2020) 11986–12043 [18] S. Lv G. Li L. Yang ACS Appl. Mater. Interfaces 14 2022 25317 25325 S. Lv, G. Li, L. Yang, ACS Appl. Mater. Interfaces 14 (2022) 25317–25325. [19] X. Hu L. Xiong W. Fang N.Q. Su ACS Appl. Mater. Interfaces 14 2022 27861 27872 X. Hu, L. Xiong, W. Fang, N.Q. Su, ACS Appl. Mater. Interfaces 14 (2022) 27861–27872. [20] R. Li W. Guo Phys. Chem. Chem. Phys. 24 2022 13384 13398 R. Li, W. Guo, Phys. Chem. Chem. Phys. 24 (2022) 13384–13398. [21] T. Yang T.T. Song S. Wang D. Chi L. Shen M. Yang Y.P. Feng Nano Energy 104304 2020 1 8 T. Yang, T.T. Song, S. Wang, D. Chi, L. Shen, M. Yang, Y.P. Feng, Nano Energy 104304 (2020) 1–8. [22] L. Zhang Y. Meng A. Koso Y. Yao H. Tang S. Xia Colloid. Surfaces. A 647 2022 129072 L. Zhang, Y. Meng, A. Koso, Y. Yao, H. Tang, S. Xia, Colloid. Surfaces. A 647 (2022) 129072. [23] W. Song K. Xie Y. Guo L. Fu C. He ChemPhysChem 22 2021 1712 1721 W. Song, K. Xie, Y. Guo, L. Fu, C. He, ChemPhysChem 22 (2021) 1712–1721. [24] W. Song R. Wang X. Liu Y. Guo L. Fu C. He J. Electrochem. Soc. 168 2021 116516 W. Song, R. Wang, X. Liu, Y. Guo, L. Fu, C. He, J. Electrochem. Soc. 168 (2021) 116516. [25] W. Song K. Xie J. Wang Y. Guo C. He L. Fu Phys. Chem. Chem. Phys. 23 2021 10418 10428 W. Song, K. Xie, J. Wang, Y. Guo, C. He, L. Fu, Phys. Chem. Chem. Phys. 23 (2021) 10418–10428. [26] W. Song Z. Fu L. Fu C. He J. Electrochem. Soc. 168 2021 066503 W. Song, Z. Fu, L. Fu, C. He, J. Electrochem. Soc. 168 (2021) 066503. [27] W. Song L. Fu C. He K. Xie Adv. Theory. Simul. 4 2021 2100044 W. Song, L. Fu, C. He, K. Xie, Adv. Theory. Simul. 4 (2021) 2100044. [28] T. He S.K. Matta A. Du Phys. Chem. Chem. Phys. 21 2019 1546 1551 T. He, S.K. Matta, A. Du, Phys. Chem. Chem. Phys. 21 (2019) 1546–1551. [29] G. Wang W. Cai T. Fan Y. Ji Appl. Surf. Sci. 570 2021 151109 G. Wang, W. Cai, T. Fan, Y. Ji, Appl. Surf. Sci. 570 (2021) 151109. [30] Z. Feng Y. Tang W. Chen Y. Li R. Li Y. Ma X. Dai Phys. Chem. Chem. Phys. 22 2020 9216 9224 Z. Feng, Y. Tang, W. Chen, Y. Li, R. Li, Y. Ma, X. Dai, Phys. Chem. Chem. Phys. 22 (2020) 9216–9224. [31] P. Hou Y. Huang F. Ma G. Zhu J. Zhang X. Wei P. Du J. Liu Appl. Surf. Sci. 599 2022 153880 P. Hou, Y. Huang, F. Ma, G. Zhu, J. Zhang, X. Wei, P. Du, J. Liu, Appl. Surf. Sci. 599 (2022) 153880. [32] Y. Chen X. Zhang J. Qin R. Liu Int. J. Hydrogen Energ. 47 2022 5292 5306 Y. Chen, X. Zhang, J. Qin, R. Liu, Int. J. Hydrogen Energ. 47 (2022) 5292–5306. [33] W. Song L. Fu P. Ma X. Liu Y. Guo C. He J. Mol. Struct. 1259 2022 132746 W. Song, L. Fu, P. Ma, X. Liu, Y. Guo, C. He, J. Mol. Struct. 1259 (2022) 132746. [34] J. Mahmood E.K. Lee M. Jung D. Shin H.J. Choi J.M. Seo S.M. Jung D. Kim F. Li M.S. Lah Proc. Natl. Acad Sci 113 2016 7414 7419 J. Mahmood, E.K. Lee, M. Jung, D. Shin, H.J. Choi, J.M. Seo, S.M. Jung, D. Kim, F. Li, M.S. Lah, Proc. Natl. Acad. Sci. 113 (2016) 7414–7419. [35] S. Yang W. Li C. Ye G. Wang H. Tian C. Zhu P. He G. Ding X. Xie Y. Liu Y. Lifshitz S.T. Lee Z. Kang M. Jiang Adv. Mater. 29 2017 1605625 S. Yang, W. Li, C. Ye, G. Wang, H. Tian, C. Zhu, P. He, G. Ding, X. Xie, Y. Liu, Y. Lifshitz, S.T. Lee, Z. Kang, M. Jiang, Adv. Mater. 29 (2017) 1605625. [36] Y. Zeng X. Zhang C. Ai C. Wang Y. Liu S. Lin Appl. Surf. Sci. 582 2022 152474 Y. Zeng, X. Zhang, C. Ai, C. Wang, Y. Liu, S. Lin, Appl. Surf. Sci. 582 (2022) 152474. [37] B. He J. Shen D. Ma Z. Lu Z. Yang J. Phys. Chem. C 122 2018 20312 20322 B. He, J. Shen, D. Ma, Z. Lu, Z. Yang, J. Phys. Chem. C 122 (2018) 20312–20322. [38] G. Qin Q. Cui W. Wang P. Li A. Du Q. Sun ChemPhysChem 19 2018 2788 2795 G. Qin, Q. Cui, W. Wang, P. Li, A. Du, Q. Sun, ChemPhysChem 19 (2018) 2788–2795. [39] P. Bhauriyal A. Mahata B. Pathak J. Phys. Chem. C 122 2018 2481 2489 P. Bhauriyal, A. Mahata, B. Pathak, J. Phys. Chem. C 122 (2018) 2481–2489. [40] J. Xu J. Mahmood Y. Dou S. Dou F. Li L. Dai J.B. Baek Adv. Mater. 29 2017 1702007 J. Xu, J. Mahmood, Y. Dou, S. Dou, F. Li, L. Dai, J.B. Baek, Adv. Mater. 29 (2017) 1702007. [41] J. Wang C. He J. Huo L. Fu C. Zhao Adv. Theory. Simul. 4 2021 2100003 J. Wang, C. He, J. Huo, L. Fu, C. Zhao, Adv. Theory. Simul. 4 (2021) 2100003. [42] C. He J. Wang L. Fu C. Zhao J. Huo Chin. Chem. Lett. 33 2022 1051 1057 C. He, J. Wang, L. Fu, C. Zhao, J. Huo, Chin. Chem. Lett. 33 (2022) 1051–1057. [43] W. Song J. Wang L. Fu C. He C. Zhao Y. Guo J. Huo G. Dong Chin. Chem. Lett. 32 2021 3137 3142 W. Song, J. Wang, L. Fu, C. He, C. Zhao, Y. Guo, J. Huo, G. Dong, Chin. Chem. Lett. 32 (2021) 3137–3142. [44] G. Kresse J. Hafner Phys. Rev. B 47 1993 558 561 G. Kresse, J. Hafner, Phys. Rev. B 47 (1993) 558–561. [45] G. Kresse J. Furthmuller Phys. Rev. B 54 1996 11169 11186 G. Kresse, J. Furthmuller, Phys. Rev. B 54 (1996) 11169–11186. [46] P.E. Blochl Phys. Rev. B 50 1994 17953 17979 P.E. Blochl, Phys. Rev. B 50 (1994) 17953–17979. [47] J.P. Perdew K. Burke M. Ernzerhof Phys. Rev. Lett. 77 1996 3865 3868 J.P. Perdew, K. Burke, M. Ernzerhof, Phys. Rev. Lett. 77 (1996) 3865–3868. [48] S. Grimme J. Comput. Chem. 27 2006 1787 1799 S. Grimme, J. Comput. Chem. 27 (2006) 1787–1799. [49] A.A. Peterson F. Abild-Pedersen F. Studt J.R. osmiumsl J.K. Nørskov Energ. Environ. Sci. 3 2010 1311 1315 A.A. Peterson, F. Abild-Pedersen, F. Studt, J.R. osmiumsl, J.K. Nørskov, Energ. Environ. Sci. 3 (2010) 1311–1315. [50] J.K. Nørskov J. Rossmeisl A. Logadottir L. Lindqvist J.R. Kitchin T. Bligaard H. Jónsson J. Phys. Chem. B 108 2004 17886 17892 J.K. Nørskov, J. Rossmeisl, A. Logadottir, L. Lindqvist, J.R. Kitchin, T. Bligaard, H. Jónsson, J. Phys. Chem. B 108 (2004) 17886–17892. [51] J. Rossmeisl A. Logadottir J.K. Nørskov Chem. Phys. 319 2005 178 184 J. Rossmeisl, A. Logadottir, J.K. Nørskov, Chem. Phys. 319 (2005) 178–184. [52] X. Zhou W. Feng S. Guan B. Fu W. Su Y. Yao J. Mater. Res. 32 2017 2993 3001 X. Zhou, W. Feng, S. Guan, B. Fu, W. Su, Y. Yao, J. Mater. Res. 32 (2017) 2993–3001. [53] M. Makaremi B. Mortazavi C.V. Singh J. Phys. Chem. C 121 2017 18575 18583 M. Makaremi, B. Mortazavi, C.V. Singh, J. Phys. Chem. C 121 (2017) 18575–18583. [54] W.Li S.Hu Science 374 2021 1360 1365 S.Hu, W.Li, Science 374 (2021) 1360–1365. [55] W. Song Z. Fu X. Liu Y. Guo C. He L. Fu J. Mater. Chem. A 10 2022 13946 13957 W. Song, Z. Fu, X. Liu, Y. Guo, C. He, L. Fu, J. Mater. Chem. A 10 (2022) 13946–13957. [56] X. Liu Y. Jiao Y. Zheng M. Jaroniec S. Qiao J. Am. Chem. Soc. 141 2019 9664 9672 X. Liu, Y. Jiao, Y. Zheng, M. Jaroniec, S. Qiao, J. Am. Chem. Soc. 141 (2019) 9664–9672. [57] W. Pei S. Zhou J. Zhao X. Xu Y. Du S. Dou Nano Energy 76 2020 105049 W. Pei, S. Zhou, J. Zhao, X. Xu, Y. Du, S. Dou, Nano Energy 76 (2020) 105049. [58] W. Song M. Wang X. Liu Y. Guo L. Fu W. Zhang C. He, Mater. Today. Commun. 33 2022 104318 W. Song, M. Wang, X. Liu, Y. Guo, L. Fu, W. Zhang, C. He, Mater. Today. Commun. 33 (2022) 104318.",
      "scopus-id": "85144851960",
      "coredata": {
        "eid": "1-s2.0-S246882312200774X",
        "dc:description": "NH3 is the main product of nitrogen reduction and is not only an indispensable fertilizer component but also a promising clean energy carrier. The electrocatalytic nitrogen reduction reaction (NRR) can reduce N2 to NH3 under ambient conditions and is one of the most promising technologies to replace the traditional Haber–Bosch process. The careful choice and design of electrocatalysts are both key to achieving an efficient electrocatalytic reaction. In this study, using density functional theory calculations, the catalytic performance of a series of 3d transition metal (TM = Cr, Mn, Fe, Co) single-atom catalysts supported on C3N (TM@C3N) was systematically investigated. The best NRR performance was achieved for the Fe-C@C3N catalyst, and the reaction follows the enzymatic mechanism. Crucially, at a limiting potential of –0.49 V, the competitive hydrogen evolution reaction was effectively inhibited. Furthermore, the electronic properties of the reaction intermediates and Fe-C@C3N were analyzed to reveal the reasons for its high activity. The results of this study will help us understand the catalytic performance of TM-atom-doped C3N and aid the design of more active C3N-based NRR catalysts.",
        "openArchiveArticle": "false",
        "prism:coverDate": "2023-01-15",
        "openaccessUserLicense": null,
        "prism:aggregationType": "Journal",
        "prism:url": "https://api.elsevier.com/content/article/pii/S246882312200774X",
        "dc:creator": [
          {
            "@_fa": "true",
            "$": "Song, Wei"
          },
          {
            "@_fa": "true",
            "$": "Li, Chensi"
          },
          {
            "@_fa": "true",
            "$": "Ma, Pengfei"
          },
          {
            "@_fa": "true",
            "$": "Liu, Xiao"
          },
          {
            "@_fa": "true",
            "$": "Guo, Yongliang"
          },
          {
            "@_fa": "true",
            "$": "Jia, Meng"
          },
          {
            "@_fa": "true",
            "$": "Zhang, Wei"
          },
          {
            "@_fa": "true",
            "$": "He, Chaozheng"
          }
        ],
        "link": [
          {
            "@_fa": "true",
            "@rel": "self",
            "@href": "https://api.elsevier.com/content/article/pii/S246882312200774X"
          },
          {
            "@_fa": "true",
            "@rel": "scidir",
            "@href": "https://www.sciencedirect.com/science/article/pii/S246882312200774X"
          }
        ],
        "dc:format": "application/json",
        "openaccessType": null,
        "pii": "S2468-8231(22)00774-X",
        "prism:volume": "535",
        "articleNumber": "112888",
        "prism:publisher": "Elsevier B.V.",
        "dc:title": "Computational screening of transition metal atom doped C3N as electrocatalysts for nitrogen fixation",
        "prism:copyright": "© 2022 Elsevier B.V. All rights reserved.",
        "openaccess": "0",
        "prism:issn": "24688231",
        "dcterms:subject": [
          {
            "@_fa": "true",
            "$": "Nitrogen reduction reaction"
          },
          {
            "@_fa": "true",
            "$": "Electrocatalysts"
          },
          {
            "@_fa": "true",
            "$": "DFT calculations"
          },
          {
            "@_fa": "true",
            "$": "Dope"
          },
          {
            "@_fa": "true",
            "$": "C3N surface"
          }
        ],
        "openaccessArticle": "false",
        "prism:publicationName": "Molecular Catalysis",
        "openaccessSponsorType": null,
        "prism:pageRange": "112888",
        "pubType": "fla",
        "prism:coverDisplayDate": "15 January 2023",
        "prism:doi": "10.1016/j.mcat.2022.112888",
        "prism:startingPage": "112888",
        "dc:identifier": "doi:10.1016/j.mcat.2022.112888",
        "openaccessSponsorName": null
      },
      "objects": {
        "object": [
          {
            "@category": "standard",
            "@height": "385",
            "@width": "376",
            "@_fa": "true",
            "$": "https://api.elsevier.com/content/object/eid/1-s2.0-S246882312200774X-gr1.jpg?httpAccept=%2A%2F%2A",
            "@multimediatype": "JPEG image file",
            "@type": "IMAGE-DOWNSAMPLED",
            "@size": "78683",
            "@ref": "gr1",
            "@mimetype": "image/jpeg"
          },
          {
            "@category": "standard",
            "@height": "614",
            "@width": "565",
            "@_fa": "true",
            "$": "https://api.elsevier.com/content/object/eid/1-s2.0-S246882312200774X-gr5.jpg?httpAccept=%2A%2F%2A",
            "@multimediatype": "JPEG image file",
            "@type": "IMAGE-DOWNSAMPLED",
            "@size": "121781",
            "@ref": "gr5",
            "@mimetype": "image/jpeg"
          },
          {
            "@category": "standard",
            "@height": "265",
            "@width": "753",
            "@_fa": "true",
            "$": "https://api.elsevier.com/content/object/eid/1-s2.0-S246882312200774X-gr4.jpg?httpAccept=%2A%2F%2A",
            "@multimediatype": "JPEG image file",
            "@type": "IMAGE-DOWNSAMPLED",
            "@size": "59132",
            "@ref": "gr4",
            "@mimetype": "image/jpeg"
          },
          {
            "@category": "standard",
            "@height": "198",
            "@width": "376",
            "@_fa": "true",
            "$": "https://api.elsevier.com/content/object/eid/1-s2.0-S246882312200774X-gr3.jpg?httpAccept=%2A%2F%2A",
            "@multimediatype": "JPEG image file",
            "@type": "IMAGE-DOWNSAMPLED",
            "@size": "25860",
            "@ref": "gr3",
            "@mimetype": "image/jpeg"
          },
          {
            "@category": "standard",
            "@height": "260",
            "@width": "753",
            "@_fa": "true",
            "$": "https://api.elsevier.com/content/object/eid/1-s2.0-S246882312200774X-gr10.jpg?httpAccept=%2A%2F%2A",
            "@multimediatype": "JPEG image file",
            "@type": "IMAGE-DOWNSAMPLED",
            "@size": "87424",
            "@ref": "gr10",
            "@mimetype": "image/jpeg"
          },
          {
            "@category": "standard",
            "@height": "233",
            "@width": "753",
            "@_fa": "true",
            "$": "https://api.elsevier.com/content/object/eid/1-s2.0-S246882312200774X-gr2.jpg?httpAccept=%2A%2F%2A",
            "@multimediatype": "JPEG image file",
            "@type": "IMAGE-DOWNSAMPLED",
            "@size": "40386",
            "@ref": "gr2",
            "@mimetype": "image/jpeg"
          },
          {
            "@category": "standard",
            "@height": "88",
            "@width": "301",
            "@_fa": "true",
            "$": "https://api.elsevier.com/content/object/eid/1-s2.0-S246882312200774X-ga1.jpg?httpAccept=%2A%2F%2A",
            "@multimediatype": "JPEG image file",
            "@type": "IMAGE-DOWNSAMPLED",
            "@size": "16878",
            "@ref": "ga1",
            "@mimetype": "image/jpeg"
          },
          {
            "@category": "standard",
            "@height": "285",
            "@width": "753",
            "@_fa": "true",
            "$": "https://api.elsevier.com/content/object/eid/1-s2.0-S246882312200774X-gr9.jpg?httpAccept=%2A%2F%2A",
            "@multimediatype": "JPEG image file",
            "@type": "IMAGE-DOWNSAMPLED",
            "@size": "51203",
            "@ref": "gr9",
            "@mimetype": "image/jpeg"
          },
          {
            "@category": "standard",
            "@height": "383",
            "@width": "565",
            "@_fa": "true",
            "$": "https://api.elsevier.com/content/object/eid/1-s2.0-S246882312200774X-gr8.jpg?httpAccept=%2A%2F%2A",
            "@multimediatype": "JPEG image file",
            "@type": "IMAGE-DOWNSAMPLED",
            "@size": "102212",
            "@ref": "gr8",
            "@mimetype": "image/jpeg"
          },
          {
            "@category": "standard",
            "@height": "279",
            "@width": "753",
            "@_fa": "true",
            "$": "https://api.elsevier.com/content/object/eid/1-s2.0-S246882312200774X-gr7.jpg?httpAccept=%2A%2F%2A",
            "@multimediatype": "JPEG image file",
            "@type": "IMAGE-DOWNSAMPLED",
            "@size": "52726",
            "@ref": "gr7",
            "@mimetype": "image/jpeg"
          },
          {
            "@category": "standard",
            "@height": "238",
            "@width": "753",
            "@_fa": "true",
            "$": "https://api.elsevier.com/content/object/eid/1-s2.0-S246882312200774X-gr6.jpg?httpAccept=%2A%2F%2A",
            "@multimediatype": "JPEG image file",
            "@type": "IMAGE-DOWNSAMPLED",
            "@size": "69988",
            "@ref": "gr6",
            "@mimetype": "image/jpeg"
          },
          {
            "@category": "thumbnail",
            "@height": "164",
            "@width": "160",
            "@_fa": "true",
            "$": "https://api.elsevier.com/content/object/eid/1-s2.0-S246882312200774X-gr1.sml?httpAccept=%2A%2F%2A",
            "@multimediatype": "GIF image file",
            "@type": "IMAGE-THUMBNAIL",
            "@size": "17974",
            "@ref": "gr1",
            "@mimetype": "image/gif"
          },
          {
            "@category": "thumbnail",
            "@height": "164",
            "@width": "151",
            "@_fa": "true",
            "$": "https://api.elsevier.com/content/object/eid/1-s2.0-S246882312200774X-gr5.sml?httpAccept=%2A%2F%2A",
            "@multimediatype": "GIF image file",
            "@type": "IMAGE-THUMBNAIL",
            "@size": "15297",
            "@ref": "gr5",
            "@mimetype": "image/gif"
          },
          {
            "@category": "thumbnail",
            "@height": "77",
            "@width": "219",
            "@_fa": "true",
            "$": "https://api.elsevier.com/content/object/eid/1-s2.0-S246882312200774X-gr4.sml?httpAccept=%2A%2F%2A",
            "@multimediatype": "GIF image file",
            "@type": "IMAGE-THUMBNAIL",
            "@size": "8425",
            "@ref": "gr4",
            "@mimetype": "image/gif"
          },
          {
            "@category": "thumbnail",
            "@height": "115",
            "@width": "219",
            "@_fa": "true",
            "$": "https://api.elsevier.com/content/object/eid/1-s2.0-S246882312200774X-gr3.sml?httpAccept=%2A%2F%2A",
            "@multimediatype": "GIF image file",
            "@type": "IMAGE-THUMBNAIL",
            "@size": "9110",
            "@ref": "gr3",
            "@mimetype": "image/gif"
          },
          {
            "@category": "thumbnail",
            "@height": "75",
            "@width": "219",
            "@_fa": "true",
            "$": "https://api.elsevier.com/content/object/eid/1-s2.0-S246882312200774X-gr10.sml?httpAccept=%2A%2F%2A",
            "@multimediatype": "GIF image file",
            "@type": "IMAGE-THUMBNAIL",
            "@size": "10302",
            "@ref": "gr10",
            "@mimetype": "image/gif"
          },
          {
            "@category": "thumbnail",
            "@height": "68",
            "@width": "219",
            "@_fa": "true",
            "$": "https://api.elsevier.com/content/object/eid/1-s2.0-S246882312200774X-gr2.sml?httpAccept=%2A%2F%2A",
            "@multimediatype": "GIF image file",
            "@type": "IMAGE-THUMBNAIL",
            "@size": "6618",
            "@ref": "gr2",
            "@mimetype": "image/gif"
          },
          {
            "@category": "thumbnail",
            "@height": "64",
            "@width": "219",
            "@_fa": "true",
            "$": "https://api.elsevier.com/content/object/eid/1-s2.0-S246882312200774X-ga1.sml?httpAccept=%2A%2F%2A",
            "@multimediatype": "GIF image file",
            "@type": "IMAGE-THUMBNAIL",
            "@size": "8343",
            "@ref": "ga1",
            "@mimetype": "image/gif"
          },
          {
            "@category": "thumbnail",
            "@height": "83",
            "@width": "219",
            "@_fa": "true",
            "$": "https://api.elsevier.com/content/object/eid/1-s2.0-S246882312200774X-gr9.sml?httpAccept=%2A%2F%2A",
            "@multimediatype": "GIF image file",
            "@type": "IMAGE-THUMBNAIL",
            "@size": "7484",
            "@ref": "gr9",
            "@mimetype": "image/gif"
          },
          {
            "@category": "thumbnail",
            "@height": "148",
            "@width": "219",
            "@_fa": "true",
            "$": "https://api.elsevier.com/content/object/eid/1-s2.0-S246882312200774X-gr8.sml?httpAccept=%2A%2F%2A",
            "@multimediatype": "GIF image file",
            "@type": "IMAGE-THUMBNAIL",
            "@size": "20125",
            "@ref": "gr8",
            "@mimetype": "image/gif"
          },
          {
            "@category": "thumbnail",
            "@height": "81",
            "@width": "219",
            "@_fa": "true",
            "$": "https://api.elsevier.com/content/object/eid/1-s2.0-S246882312200774X-gr7.sml?httpAccept=%2A%2F%2A",
            "@multimediatype": "GIF image file",
            "@type": "IMAGE-THUMBNAIL",
            "@size": "7504",
            "@ref": "gr7",
            "@mimetype": "image/gif"
          },
          {
            "@category": "thumbnail",
            "@height": "69",
            "@width": "219",
            "@_fa": "true",
            "$": "https://api.elsevier.com/content/object/eid/1-s2.0-S246882312200774X-gr6.sml?httpAccept=%2A%2F%2A",
            "@multimediatype": "GIF image file",
            "@type": "IMAGE-THUMBNAIL",
            "@size": "8299",
            "@ref": "gr6",
            "@mimetype": "image/gif"
          },
          {
            "@category": "high",
            "@height": "1707",
            "@width": "1667",
            "@_fa": "true",
            "$": "https://api.elsevier.com/content/object/eid/1-s2.0-S246882312200774X-gr1_lrg.jpg?httpAccept=%2A%2F%2A",
            "@multimediatype": "JPEG image file",
            "@type": "IMAGE-HIGH-RES",
            "@size": "521607",
            "@ref": "gr1",
            "@mimetype": "image/jpeg"
          },
          {
            "@category": "high",
            "@height": "2717",
            "@width": "2500",
            "@_fa": "true",
            "$": "https://api.elsevier.com/content/object/eid/1-s2.0-S246882312200774X-gr5_lrg.jpg?httpAccept=%2A%2F%2A",
            "@multimediatype": "JPEG image file",
            "@type": "IMAGE-HIGH-RES",
            "@size": "836934",
            "@ref": "gr5",
            "@mimetype": "image/jpeg"
          },
          {
            "@category": "high",
            "@height": "1172",
            "@width": "3333",
            "@_fa": "true",
            "$": "https://api.elsevier.com/content/object/eid/1-s2.0-S246882312200774X-gr4_lrg.jpg?httpAccept=%2A%2F%2A",
            "@multimediatype": "JPEG image file",
            "@type": "IMAGE-HIGH-RES",
            "@size": "393951",
            "@ref": "gr4",
            "@mimetype": "image/jpeg"
          },
          {
            "@category": "high",
            "@height": "876",
            "@width": "1667",
            "@_fa": "true",
            "$": "https://api.elsevier.com/content/object/eid/1-s2.0-S246882312200774X-gr3_lrg.jpg?httpAccept=%2A%2F%2A",
            "@multimediatype": "JPEG image file",
            "@type": "IMAGE-HIGH-RES",
            "@size": "164228",
            "@ref": "gr3",
            "@mimetype": "image/jpeg"
          },
          {
            "@category": "high",
            "@height": "1149",
            "@width": "3333",
            "@_fa": "true",
            "$": "https://api.elsevier.com/content/object/eid/1-s2.0-S246882312200774X-gr10_lrg.jpg?httpAccept=%2A%2F%2A",
            "@multimediatype": "JPEG image file",
            "@type": "IMAGE-HIGH-RES",
            "@size": "633782",
            "@ref": "gr10",
            "@mimetype": "image/jpeg"
          },
          {
            "@category": "high",
            "@height": "1031",
            "@width": "3333",
            "@_fa": "true",
            "$": "https://api.elsevier.com/content/object/eid/1-s2.0-S246882312200774X-gr2_lrg.jpg?httpAccept=%2A%2F%2A",
            "@multimediatype": "JPEG image file",
            "@type": "IMAGE-HIGH-RES",
            "@size": "258878",
            "@ref": "gr2",
            "@mimetype": "image/jpeg"
          },
          {
            "@category": "high",
            "@height": "389",
            "@width": "1333",
            "@_fa": "true",
            "$": "https://api.elsevier.com/content/object/eid/1-s2.0-S246882312200774X-ga1_lrg.jpg?httpAccept=%2A%2F%2A",
            "@multimediatype": "JPEG image file",
            "@type": "IMAGE-HIGH-RES",
            "@size": "111410",
            "@ref": "ga1",
            "@mimetype": "image/jpeg"
          },
          {
            "@category": "high",
            "@height": "1263",
            "@width": "3333",
            "@_fa": "true",
            "$": "https://api.elsevier.com/content/object/eid/1-s2.0-S246882312200774X-gr9_lrg.jpg?httpAccept=%2A%2F%2A",
            "@multimediatype": "JPEG image file",
            "@type": "IMAGE-HIGH-RES",
            "@size": "326615",
            "@ref": "gr9",
            "@mimetype": "image/jpeg"
          },
          {
            "@category": "high",
            "@height": "1693",
            "@width": "2500",
            "@_fa": "true",
            "$": "https://api.elsevier.com/content/object/eid/1-s2.0-S246882312200774X-gr8_lrg.jpg?httpAccept=%2A%2F%2A",
            "@multimediatype": "JPEG image file",
            "@type": "IMAGE-HIGH-RES",
            "@size": "733619",
            "@ref": "gr8",
            "@mimetype": "image/jpeg"
          },
          {
            "@category": "high",
            "@height": "1233",
            "@width": "3333",
            "@_fa": "true",
            "$": "https://api.elsevier.com/content/object/eid/1-s2.0-S246882312200774X-gr7_lrg.jpg?httpAccept=%2A%2F%2A",
            "@multimediatype": "JPEG image file",
            "@type": "IMAGE-HIGH-RES",
            "@size": "347186",
            "@ref": "gr7",
            "@mimetype": "image/jpeg"
          },
          {
            "@category": "high",
            "@height": "1055",
            "@width": "3333",
            "@_fa": "true",
            "$": "https://api.elsevier.com/content/object/eid/1-s2.0-S246882312200774X-gr6_lrg.jpg?httpAccept=%2A%2F%2A",
            "@multimediatype": "JPEG image file",
            "@type": "IMAGE-HIGH-RES",
            "@size": "441376",
            "@ref": "gr6",
            "@mimetype": "image/jpeg"
          },
          {
            "@category": "standard",
            "@_fa": "true",
            "$": "https://api.elsevier.com/content/object/eid/1-s2.0-S246882312200774X-mmc1.doc?httpAccept=%2A%2F%2A",
            "@multimediatype": "Microsoft Word file",
            "@type": "APPLICATION",
            "@size": "3953152",
            "@ref": "mmc1",
            "@mimetype": "application/word"
          },
          {
            "@category": "thumbnail",
            "@_fa": "true",
            "$": "https://api.elsevier.com/content/object/eid/1-s2.0-S246882312200774X-si1.svg?httpAccept=%2A%2F%2A",
            "@multimediatype": "Scalable Vector Graphics file",
            "@type": "ALTIMG",
            "@size": "8547",
            "@ref": "si1",
            "@mimetype": "image/svg+xml"
          },
          {
            "@category": "thumbnail",
            "@_fa": "true",
            "$": "https://api.elsevier.com/content/object/eid/1-s2.0-S246882312200774X-si2.svg?httpAccept=%2A%2F%2A",
            "@multimediatype": "Scalable Vector Graphics file",
            "@type": "ALTIMG",
            "@size": "15389",
            "@ref": "si2",
            "@mimetype": "image/svg+xml"
          },
          {
            "@category": "thumbnail",
            "@_fa": "true",
            "$": "https://api.elsevier.com/content/object/eid/1-s2.0-S246882312200774X-si3.svg?httpAccept=%2A%2F%2A",
            "@multimediatype": "Scalable Vector Graphics file",
            "@type": "ALTIMG",
            "@size": "9139",
            "@ref": "si3",
            "@mimetype": "image/svg+xml"
          },
          {
            "@category": "standard",
            "@_fa": "true",
            "$": "https://api.elsevier.com/content/object/eid/1-s2.0-S246882312200774X-am.pdf?httpAccept=%2A%2F%2A",
            "@multimediatype": "Acrobat PDF file",
            "@type": "AAM-PDF",
            "@size": "18952674",
            "@ref": "am",
            "@mimetype": "application/pdf"
          }
        ]
      },
      "link": {
        "@rel": "abstract",
        "@href": "https://api.elsevier.com/content/abstract/scopus_id/85144851960"
      }
    }
  }
}