{
  "metadata": {
    "title": "Aluminum‐based metal‐organic framework support metal(II)-hydride as catalyst for the hydrogenation of carbon dioxide to formic acid: A computational study",
    "authors": "; ; ",
    "journal": "Molecular Catalysis",
    "date": "2023-04-15",
    "doi": "10.1016/j.mcat.2023.113116",
    "abstract": "",
    "uri": "https://api.elsevier.com/content/article/pii/S246882312300202X",
    "pii": "S246882312300202X"
  },
  "fulltext": {
    "full-text-retrieval-response": {
      "scopus-eid": "2-s2.0-85151289597",
      "originalText": "serial JL 315758 291210 291744 291790 291809 31 Molecular Catalysis MOLECULARCATALYSIS 2023-03-29 2023-03-29 2023-03-29 2023-03-29 2023-04-14T11:57:02 1-s2.0-S246882312300202X S2468-8231(23)00202-X S246882312300202X 10.1016/j.mcat.2023.113116 S300 S300.1 FULL-TEXT 1-s2.0-S2468823123X00078 2024-06-26T17:47:58.02126Z 0 0 20230415 2023 2023-03-29T23:23:05.973631Z absattachment articleinfo articlenumber articletitlenorm authfirstinitialnorm authfirstsurnamenorm cid cids contenttype copyright crossmark dateloaded dateloadedtxt datesearch datesort dateupdated dco docsubtype doctype doi eid ewtransactionid hubeid indexeddate issn issnnorm itemstage itemtransactionid itemweight openaccess openarchive pg pgfirst pii piinorm pubdatestart pubdatetxt pubyr sectiontitle sortorder srctitle srctitlenorm srctype ssids alllist content subj subheadings suppl tomb volfirst volissue volumelist webpdf webpdfpagecount yearnav figure table e-component body mmlmath acknowledge affil appendices articletitle auth authfirstini authfull authkeywords authlast highlightsabst primabst ref specialabst 2468-8231 24688231 true 541 541 C Volume 541 36 113116 113116 113116 20230415 15 April 2023 2023-04-15 2023 Regular Papers article fla © 2023 Elsevier B.V. All rights reserved. ALUMINUMBASEDMETALORGANICFRAMEWORKSUPPORTMETALIIHYDRIDECATALYSTFORHYDROGENATIONCARBONDIOXIDEFORMICACIDACOMPUTATIONALSTUDY NILWANNA K 1 Introduction 2 Computational details 3 Results and discussion 3.1 Structures and reaction mechanisms of CO2 hydrogenation to formic acid 3.2 Effect of supported DUT-5 node 3.3 Effect of the metal active site 4 Conclusions CRediT authorship contribution statement Acknowledgments Appendix Supplementary materials References KORTLEVER 2015 4073 4082 R FEASTER 2017 4822 4827 J DELUNA 2019 eaav3506 P FAN 2020 3633 L YANG 2020 2001709 J LIU 2018 15494 15502 J LIU 2019 11944 11952 J LIU 2019 27710 27719 J JESSOP 1996 344 355 P WANG 2011 3703 3727 W SUN 2021 1247 1285 R GRAF 1992 623 624 E GASSNER 1993 1465 1466 F JESSOP 1994 231 233 P HIMEDA 2007 702 712 Y TANAKA 2009 14168 14169 R KANEGA 2020 1519 1531 R YAGHI 2003 705 714 CHO 2006 2563 2565 S LIU 2008 9854 9860 B LEE 2009 1450 1459 J SHULTZ 2009 4204 4205 A FANG 2015 7234 7254 Z CORMA 2010 4606 4655 A NATHANIEL 2003 1127 1129 L PAN 2004 1308 1309 L MILLWARD 2005 17998 17999 A JESSE 2005 1350 1354 L ZHANG 2020 18533 18540 H ZHANG 2020 24614 24623 H ZHANG 2021 2656 2662 H MURRAY 2009 1294 1314 L MANNA 2014 13182 13185 K MCGUIRK 2015 919 925 C ZHANG 2016 3241 3249 T NEWAR 2020 10473 10481 R GASCON 2014 361 378 J MA 2010 838 846 L GENNA 2013 10586 10589 D VINU 2019 1165 1171 M ANTIL 2021 3943 3957 N ANTIL 2021 9029 9039 N GETMAN 2011 2066 2075 R MAIHOM 2016 3416 3422 T LEE 2014 698 704 K MENDONCA 2020 1310 1323 M SITTIWONG 2021 4860 4868 J XUE 2021 17097 17108 W YANG 2013 4217 4228 L YANG 2014 2532 2541 L YANG 2016 32319 32330 L ZHAO 2008 157 167 Y FRISCH 2016 M GAUSSIAN16REVISIONB01 ZHAO 2008 6860 6868 Y KETRAT 2017 14005 14012 S MAIHOM 2018 6726 6734 T MAIHOM 2019 2783 2789 T SITTIWONG 2021 111471 J LAWRENCE 2022 112042 A DOLG 1993 5852 5859 M GRIMME 2010 154104 154118 S REED 1988 899 926 A NEESE 2012 73 78 F MAIHOM 2013 17650 17658 T THONGNUAM 2018 25179 25185 W PENG 2012 3001 3006 G SOTIROPOULOS 2000 52 60 A FUJITANI 2000 1235 1240 T GAO 2016 6292 6297 G SIRIJARAENSRE 2016 241 248 J HOMLAMAI 2020 143928 K YODSIN 2020 1941 1949 N YANG 2021 58723 58736 K SHAO 2019 693 705 X NILWANNAX2023X113116 NILWANNAX2023X113116XK 2025-03-29T00:00:00.000Z 2025-03-29T00:00:00.000Z http://creativecommons.org/licenses/by-nc-nd/4.0/ © 2023 Elsevier B.V. All rights reserved. 2023-04-04T23:59:33.160Z http://vtw.elsevier.com/data/voc/AddOnTypes/50.7/aggregated-refined Kasetsart University KU Kasetsart University http://data.elsevier.com/vocabulary/SciValFunders/501100004539 http://sws.geonames.org/1605651/ Office of the Permanent Secretary Ministry of Higher Education, Science, Research and Innovation RGNS 63–038 MHESRI Ministry of Higher Education, Science, Research and Innovation, Thailand http://data.elsevier.com/vocabulary/SciValFunders/501100016204 http://sws.geonames.org/1605651/ The Graduate School Graduate School, University of Connecticut http://data.elsevier.com/vocabulary/SciValFunders/100012877 http://sws.geonames.org/6252001/ Office of the Ministry of Higher Education, Science, Research and Innovation Vidyasirimedhi Institute of Science and Technology VISTEC Vidyasirimedhi Institute of Science and Technology http://data.elsevier.com/vocabulary/SciValFunders/100012914 http://sws.geonames.org/1605651/ This research was supported by grants from the Office of the Ministry of Higher Education, Science, Research and Innovation through the Kasetsart University “Reinventing University Program 2022” to J.S. and T.M., the Postdoctoral Fellowship from the Vidyasirimedhi Institute of Science and Technology (VISTEC) and the Office of the Permanent Secretary, Ministry of Higher Education, Science, Research and Innovation (Grant no. RGNS 63–038) to T.M. and as well as the Graduate Program Scholarship from The Graduate School, Kasetsart University to K.N. https://doi.org/10.15223/policy-017 https://doi.org/10.15223/policy-037 https://doi.org/10.15223/policy-012 https://doi.org/10.15223/policy-029 https://doi.org/10.15223/policy-004 item S2468-8231(23)00202-X S246882312300202X 1-s2.0-S246882312300202X 10.1016/j.mcat.2023.113116 315758 2023-04-14T11:15:23.192555Z 2023-04-15 1-s2.0-S246882312300202X-main.pdf https://s3-eu-west-1.amazonaws.com/prod-ucs-content-store-eu-west/content/pii:S246882312300202X/MAIN/application/pdf/4c4e27dd02e5f7afaab33b456f993d35/main.pdf main.pdf pdf true 2520847 MAIN 7 1-s2.0-S246882312300202X-main_1.png https://s3-eu-west-1.amazonaws.com/prod-ucs-content-store-eu-west/content/pii:S246882312300202X/PREVIEW/image/png/e729c068614507a41539fce0d33e1580/main_1.png main_1.png png 56177 849 656 IMAGE-WEB-PDF 1 1-s2.0-S246882312300202X-gr5.jpg https://s3-eu-west-1.amazonaws.com/prod-ucs-content-store-eu-west/content/pii:S246882312300202X/gr5/DOWNSAMPLED/image/jpeg/c57298c699c37303520e586834aa04ae/gr5.jpg gr5 gr5.jpg jpg 28550 247 458 IMAGE-DOWNSAMPLED 1-s2.0-S246882312300202X-gr2.jpg https://s3-eu-west-1.amazonaws.com/prod-ucs-content-store-eu-west/content/pii:S246882312300202X/gr2/DOWNSAMPLED/image/jpeg/0951f38d293de31f7d4d92d218b034bd/gr2.jpg gr2 gr2.jpg jpg 41739 438 458 IMAGE-DOWNSAMPLED 1-s2.0-S246882312300202X-ga1.jpg https://s3-eu-west-1.amazonaws.com/prod-ucs-content-store-eu-west/content/pii:S246882312300202X/ga1/DOWNSAMPLED/image/jpeg/fd8a01ae30192d02be7f81b749a82464/ga1.jpg ga1 true ga1.jpg jpg 26287 200 445 IMAGE-DOWNSAMPLED 1-s2.0-S246882312300202X-gr1.jpg https://s3-eu-west-1.amazonaws.com/prod-ucs-content-store-eu-west/content/pii:S246882312300202X/gr1/DOWNSAMPLED/image/jpeg/a1b90fb407c4c103891b012c875aa1f6/gr1.jpg gr1 gr1.jpg jpg 40841 275 609 IMAGE-DOWNSAMPLED 1-s2.0-S246882312300202X-gr4.jpg https://s3-eu-west-1.amazonaws.com/prod-ucs-content-store-eu-west/content/pii:S246882312300202X/gr4/DOWNSAMPLED/image/jpeg/38e59d5ad97898c0882eba2cb00811da/gr4.jpg gr4 gr4.jpg jpg 38069 369 604 IMAGE-DOWNSAMPLED 1-s2.0-S246882312300202X-gr3.jpg https://s3-eu-west-1.amazonaws.com/prod-ucs-content-store-eu-west/content/pii:S246882312300202X/gr3/DOWNSAMPLED/image/jpeg/f74a1f65ed5d46f9c50fc7678c80a600/gr3.jpg gr3 gr3.jpg jpg 81038 455 642 IMAGE-DOWNSAMPLED 1-s2.0-S246882312300202X-gr5.sml https://s3-eu-west-1.amazonaws.com/prod-ucs-content-store-eu-west/content/pii:S246882312300202X/gr5/THUMBNAIL/image/gif/ee44ac7d660c437c8f22d6057f16e78c/gr5.sml gr5 gr5.sml sml 10498 118 219 IMAGE-THUMBNAIL 1-s2.0-S246882312300202X-gr2.sml https://s3-eu-west-1.amazonaws.com/prod-ucs-content-store-eu-west/content/pii:S246882312300202X/gr2/THUMBNAIL/image/gif/3f03b83dce8942d627b342ef5fbb01fc/gr2.sml gr2 gr2.sml sml 6865 163 171 IMAGE-THUMBNAIL 1-s2.0-S246882312300202X-ga1.sml https://s3-eu-west-1.amazonaws.com/prod-ucs-content-store-eu-west/content/pii:S246882312300202X/ga1/THUMBNAIL/image/gif/c4af2869269912fff4818b4b7ed400b8/ga1.sml ga1 true ga1.sml sml 8362 98 219 IMAGE-THUMBNAIL 1-s2.0-S246882312300202X-gr1.sml https://s3-eu-west-1.amazonaws.com/prod-ucs-content-store-eu-west/content/pii:S246882312300202X/gr1/THUMBNAIL/image/gif/dfa1810b1c6de83017586c8961d2518a/gr1.sml gr1 gr1.sml sml 8440 99 219 IMAGE-THUMBNAIL 1-s2.0-S246882312300202X-gr4.sml https://s3-eu-west-1.amazonaws.com/prod-ucs-content-store-eu-west/content/pii:S246882312300202X/gr4/THUMBNAIL/image/gif/fd4d86032e178a2e40754ab8c506e6aa/gr4.sml gr4 gr4.sml sml 8210 134 219 IMAGE-THUMBNAIL 1-s2.0-S246882312300202X-gr3.sml https://s3-eu-west-1.amazonaws.com/prod-ucs-content-store-eu-west/content/pii:S246882312300202X/gr3/THUMBNAIL/image/gif/fa899162e9cfd2f66c97a7e189854a6b/gr3.sml gr3 gr3.sml sml 12509 155 219 IMAGE-THUMBNAIL 1-s2.0-S246882312300202X-gr5_lrg.jpg https://s3-eu-west-1.amazonaws.com/prod-ucs-content-store-eu-west/content/pii:S246882312300202X/HIGHRES/image/jpeg/87b6e029b291b9fab4360a5d81fa35be/gr5_lrg.jpg gr5 gr5_lrg.jpg jpg 197891 1095 2027 IMAGE-HIGH-RES 1-s2.0-S246882312300202X-gr2_lrg.jpg https://s3-eu-west-1.amazonaws.com/prod-ucs-content-store-eu-west/content/pii:S246882312300202X/HIGHRES/image/jpeg/5772d5ddc131cc568fe46a6c223df38a/gr2_lrg.jpg gr2 gr2_lrg.jpg jpg 286536 1937 2027 IMAGE-HIGH-RES 1-s2.0-S246882312300202X-ga1_lrg.jpg https://s3-eu-west-1.amazonaws.com/prod-ucs-content-store-eu-west/content/pii:S246882312300202X/HIGHRES/image/jpeg/7997b57bc2995a898aad2c7ba0c866c5/ga1_lrg.jpg ga1 true ga1_lrg.jpg jpg 156584 886 1970 IMAGE-HIGH-RES 1-s2.0-S246882312300202X-gr1_lrg.jpg https://s3-eu-west-1.amazonaws.com/prod-ucs-content-store-eu-west/content/pii:S246882312300202X/HIGHRES/image/jpeg/139c29cc741d0014a8b2b53fdfccb535/gr1_lrg.jpg gr1 gr1_lrg.jpg jpg 299115 1217 2697 IMAGE-HIGH-RES 1-s2.0-S246882312300202X-gr4_lrg.jpg https://s3-eu-west-1.amazonaws.com/prod-ucs-content-store-eu-west/content/pii:S246882312300202X/HIGHRES/image/jpeg/0ab2c9a45a135fa2c433f97211ec04cd/gr4_lrg.jpg gr4 gr4_lrg.jpg jpg 294341 1633 2673 IMAGE-HIGH-RES 1-s2.0-S246882312300202X-gr3_lrg.jpg https://s3-eu-west-1.amazonaws.com/prod-ucs-content-store-eu-west/content/pii:S246882312300202X/HIGHRES/image/jpeg/308be3ab71fd3f5b87aa68c8ff70afb0/gr3_lrg.jpg gr3 gr3_lrg.jpg jpg 639010 2016 2842 IMAGE-HIGH-RES 1-s2.0-S246882312300202X-mmc1.docx https://s3-eu-west-1.amazonaws.com/prod-ucs-content-store-eu-west/content/pii:S246882312300202X/mmc1/MAIN/application/vnd.openxmlformats-officedocument.wordprocessingml.document/c46fc79d25831ac779eb88776727b117/mmc1.docx mmc1 mmc1.docx docx 2281079 APPLICATION 1-s2.0-S246882312300202X-si1.svg https://s3-eu-west-1.amazonaws.com/prod-ucs-content-store-eu-west/content/pii:S246882312300202X/image/svg+xml/10a2f90e3db889a975a430626beeaaaf/si1.svg si1 si1.svg svg 8722 ALTIMG 1-s2.0-S246882312300202X-si2.svg https://s3-eu-west-1.amazonaws.com/prod-ucs-content-store-eu-west/content/pii:S246882312300202X/image/svg+xml/1a62ed76b8f6c9b5a35e96e6b5b512d5/si2.svg si2 si2.svg svg 12288 ALTIMG 1-s2.0-S246882312300202X-si3.svg https://s3-eu-west-1.amazonaws.com/prod-ucs-content-store-eu-west/content/pii:S246882312300202X/image/svg+xml/b53c06340c90de66fa258ae680b699e5/si3.svg si3 si3.svg svg 11160 ALTIMG 1-s2.0-S246882312300202X-si4.svg https://s3-eu-west-1.amazonaws.com/prod-ucs-content-store-eu-west/content/pii:S246882312300202X/image/svg+xml/fc4cf041d5932ec835aef6e99084cca8/si4.svg si4 si4.svg svg 10756 ALTIMG 1-s2.0-S246882312300202X-am.pdf https://s3-eu-west-1.amazonaws.com/prod-ucs-content-store-eu-west/content/egi:10MLW8WXRW4/MAIN/application/pdf/c5cfe37ab756aa1be230427fcbee2450/am.pdf am am.pdf pdf false 732449 AAM-PDF MCAT 113116 113116 S2468-8231(23)00202-X 10.1016/j.mcat.2023.113116 Elsevier B.V. Fig. 1 Cluster model of metal-supported DUT-5 (M = Mn, Fe, Co, Ni, and Cu). Al, O, C, and H atoms are represented in pink, red, gray and white, respectively. Fig 1 Fig. 2 Possible reaction pathways proposed for CO2 hydrogenation to formic acid on NiH-DUT-5 (black and blue lines for ER and LH, respectively). Fig 2 Fig. 3 Gibbs free energy profile of the hydrogenation of CO2 to formic acid over NiH-DUT-5 via the ER and LH mechanisms. Fig 3 Fig. 4 Comparison of the Gibbs free energy profiles of the hydrogenation of CO2 to formic acid over NiH-DUT-5 and NiH-OH catalysts. Fig 4 Fig. 5 Activation energies for the formation of the formate intermediate (Ea1) and the formation of the formic acid product (Ea2). Fig 5 Table 1 Relative Gibbs free energies for the hydrogenation CO2 to formic acid on MH-DUT-5 (M = Mn, Fe, Co, Ni, and Cu). Table 1 Species Relative Gibbs free energy (kcal/mol) Mn Fe Co Ni Cu Ads −0.8 1.4 0.9 −1.1 0.7 TS1 9.8 (Ea1=10.6) 13.0 (Ea1=11.6) 17.7 (Ea1=16.8) 7.4 (Ea1=8.5) 16.5 (Ea1=15.8) Int_1 −23.0 −18.3 −17.6 −19.4 −5.6 Int_2 −17.8 −11.6 −12.7 −14.2 −4.0 TS2 2.7 (Ea2=20.5) 7.7 (Ea2=19.3) 13.1 (Ea2=25.8) 0.9 (Ea2=15.1) 17.5 (Ea2=21.5) Prod −3.3 −2.0 −3.3 −6.7 2.5 Table 2 Rate constants for the rate-determining step of the reaction. Table 2 MH-DUT-5 k (s− 1) MnH-DUT-5 5.82 × 10−3 FeH-DUT-5 5.89 × 10−2 CoH-DUT-5 7.58 × 10−7 NiH-DUT-5 5.29 × 101 CuH-DUT-5 1.08 × 10−3 Aluminum‐based metal‐organic framework support metal(II)-hydride as catalyst for the hydrogenation of carbon dioxide to formic acid: A computational study Krongkwan Nilwanna Investigation a Jarinya Sittiwong Investigation Writing – original draft a Bundet Boekfa Formal analysis a Piti Treesukol Formal analysis a Sasiwadee Boonya-udtayan Formal analysis a Michael Probst Supervision b c Thana Maihom Conceptualization Data curation Writing – review & editing a b ⁎ Jumras Limtrakul Supervision b a Division of Chemistry, Department of Physical and Material Sciences, Faculty of Liberal Arts and Science, Kasetsart University, Kamphaeng Saen Campus, Nakhon Pathom, 73140, Thailand Division of Chemistry Department of Physical and Material Sciences Faculty of Liberal Arts and Science Kasetsart University Kamphaeng Saen Campus Nakhon Pathom 73140 Thailand aDepartment of Chemistry, Faculty of Liberal Arts and Science, Kasetsart University, Kamphaeng Saen Campus, Nakhon Pathom, 73140, Thailand b Department of Materials Science and Engineering, School of Molecular Science and Engineering, Vidyasirimedhi Institute of Science and Technology, Rayong, 21201, Thailand Department of Materials Science and Engineering School of Molecular Science and Engineering Vidyasirimedhi Institute of Science and Technology Rayong 21201 Thailand bDepartment of Materials Science and Engineering, School of Molecular Science and Engineering, Vidyasirimedhi Institute of Science and Technology, Rayong, 21201, Thailand c University of Innsbruck, Institute of Ion Physics and Applied Physics, 6020, Innsbruck, Austria University of Innsbruck Institute of Ion Physics and Applied Physics Innsbruck 6020 Austria cUniversity of Innsbruck, Institute of Ion Physics and Applied Physics, 6020, Innsbruck, Austria ⁎ Corresponding author. Conversion of carbon dioxide (CO2) to value-added chemicals is achieving increased attention from an environmental and industrial perspective because it could reduce the dependency on petroleum as raw material and also its net emission into the atmosphere. We present mechanisms for the CO2 hydrogenation on the aluminum-based metal-organic framework DUT-5 support transition metal(II)-hydride in a detailed using density functional (DFT) calculations. Two different pathways, namely, Eley-Rideal (ER) and Langmuir-Hinshelwood (LH) mechanisms are described. The ER mechanism requires activation barriers of 8.5 and 15.1 kcal/mol for the formation of formate and of formic acid steps, respectively. The first barrier is three times lower than in the LH mechanism (27.4 kcal/mol), thus favouring the ER mechanism. Supported DUT-5 MOFs are also found to have a stabilizing effect on the intermediates and transition states formed along the reaction coordinate. Finally, we screen the catalytic activities of different metals substituted into MH-DUT-5 (M = Mn, Fe, Co, Ni, and Cu) MOFs for the hydrogenation of CO2 to formic acid. It is found that NiH-DUT-5 exhibits the highest catalytic activity, based on its barriers. Graphical abstract Image, graphical abstract Keywords Carbon dioxide hydrogenation Mechanisms Metal-organic framework Metal hydride Density functional theory Data availability No data was used for the research described in the article. 1 Introduction Carbon dioxide (CO2) is the primary greenhouse gas. It can stay in the atmosphere for hundreds of years. Carbon dioxide emissions mainly come from the decomposition of organic materials and from burning coal, oil, gas, wood, and solid waste. Transforming CO2 into value-added substances has fascinated chemists ever so. The challenge of CO2 conversion are related to both its kinetic and thermodynamic stability and the utilization of effective catalysts has been proposed to overcome at least the first challenge. Among the possible target products, formic acid (HCOOH) is one of the most interesting because of its numerous applications in food and textile industry and others. Several methods have been developed for transforming CO2 into formic acid such as electrocatalytic reduction [1–8] and hydrogenation [9,10]. The latter is an attractive venue and amongst various catalysts, particularly transition-metal complexes [10–17] facilitate the hydrogenation of CO2 to form formic acid. Metal−organic frameworks (MOFs) [18] are a class of compounds consisting of metal ions or clusters coordinated to organic ligands to form one-, two-, or three-dimensional structures. Their high surface area, tuneable porosity and the diversity of both metal and functional groups make them attractive both as catalysts [19–24] and to store and capture gasses such as CO2 and H2 [25–31]. MOFs provide thermally and chemically robust solid platforms to host site-isolated catalytically active species [32–36]. MOF-supported single-atom catalysts can combine the advantages of homogeneous catalysts such as homogeneity of the active sites, reproducibility, and selectivity and those of heterogeneous counter parts such as excellent robustness and easy recycling of the catalysts [37–39]. An aluminum-based Metal-Organic Framework (Al-MOF) has been reported to be simple and economical to synthesize while possessing high thermal stability and large pore size [40,41]. It also provides highly electrophilic sites to support the metals at secondary building units (SBUs). Recently, one of these Al-MOFs called DUT-5 (Al(OH)(BPDC); BPDC = Biphenyl-4,4′-dicarboxylate) has been considered for CO2 uptake [40]. With incorporated metal hydrides such as Ni(II) hydride and Co(II) hydride on its framework, it can serve as efficient catalysts especially for the deoxygenation of aromatic and aliphatic ketones, aldehydes, and secondary alcohols under mind condition [42]. It would, therefore, not be unexpected that the metal hydride-containing DUT-5 MOFs is also able to activate the carbonyl group of CO2 and catalyze the hydrogenation reaction. To the best of our knowledge, this has not yet been investigated, however. In this work, we investigate the hydrogenation of CO2 to formic acid on Al-MOF DUT-5 node support transition metals hydride (MH-DUT-5; M = Mn, Fe, Co, Ni, and Cu) by means of computational methods. The methods, especially density functional theory (DFT) calculations are regarded as a powerful tool to provide insight into the properties of MOFs and also into the molecular details of the reaction mechanism of MOF catalysts [43–51]. We use the M06-L density functional to investigate the structures of adsorption complexes, transition states and products, as well as reaction mechanisms, energy profiles and barrier heights. 2 Computational details Fig. 1 shows the cluster model of DUT-5 employed in this work. It consists of four aluminum oxide units in which linkers are replaced by nine formic groups. The metal(II) hydrides are exchanged on the Brønsted site of DUT-5 to yield MH-DUT-5 (M = Mn, Fe, Co, Ni, and Cu). Previous works indicated that this model is well-suited to cover the major aspects of the MOF and also can mimic the active site of the DUT-5 MOF [41]. The structures of all species along the reaction coordinates, including reactants, intermediates, products, and transition states, were optimized with the M06-L density functional [52] as implemented in Gaussian 16 [53]. This functional is recommended for transition metals and inorganic and organometallic systems [54] and previous studies confirm its usability for investigating interactions and reaction mechanisms on metals-organic framework materials [42–48,55–57,46,58,59]. Mn, Fe, Co, Ni, and Cu atoms are described by the Stuttgart-Dresden pseudopotential with a double-ζ basis set [60], while for the other elements, the def2-SVP basis set was used. To include van der Waals interactions, we performed single point calculations with the D3 version of Grimme's correction [61]. Partial charges and orbital energies were determined by the natural bond orbital (NBO) method [62]. Frequency calculations were performed at the same level of theory to identify the nature of all the stationary points and to obtain thermodynamic properties of the system. Temperature effects are added to the total electronic energy according to Eq. (1), ending up with the Gibbs free energy (G): (1) G = E 0 + E tot + k B T − T S tot E0 is the total electronic energy, Etot is the internal thermal energy, kB is Boltzmann's constant, T is the temperature and Stot is internal thermal entropy. The free energy change of adsorption on the catalysts is defined according to Eq. (2). (2) Δ G = G total − G reactant − G DUT − 5 where G total is the total Gibbs free energy of the adsorbed adsorbates on MH-DUT-5, G reactant is the Gibbs free energy of the isolated adsorbate, and G DUT-5 is the Gibbs free energy of the isolated MH-DUT-5 catalyst. The Gibbs free energy barrier (∆G# ) of a reaction on MH-DUT-5 is given as the difference (3). (3) Δ G # = G transition state − G intermediate where G transition state is the Gibbs free energy of the transition state and G intermed i a te is the Gibbs free energy of the adsorption or intermediate states. CCSD(T) single-point calculations on M06-L optimized geometries were performed with the def2-QZVPP basis set as implemented in the ORCA [63] suite of programs using the DLPNO scheme. The adsorption energies without thermal corrections calculated with both methods are very close to each other (−11.8 vs −11.2 kcal/mol for M06-L and DLPNO-CCSD(T), respectively), giving credentials for using the M06-L functional in the present study. 3 Results and discussion 3.1 Structures and reaction mechanisms of CO2 hydrogenation to formic acid We first discuss the mechanisms of the CO2 hydrogenation to formic acid on NiH-DUT-5. The NiH-DUT-5 is chosen because it is known to be an efficient catalysts for several of the reactions mentioned above. We investigate two possible mechanisms, Eley-Rideal (ER) and Langmuir-Hinshelwood (LH), using the model described above. The reaction pathways of both mechanisms is proposed to proceed in two steps. In both of them CO2 is hydrogenated, leading to a formate intermediate. Further hydrogenation results in formation of the formic acid product. The ER mechanism starts with CO2 adsorption while co-adsorption CO2 and H2 molecules is the initial step of the LH mechanism as shown in Fig. 2 . Gibbs free energy profile of the CO2 hydrogenation to formic acid on NiH-DUT-5 is shown in Fig. 3 . In the ER mechanism the reaction proceeds by hydrogenation of CO2 to the formation of the formate intermediate which then is further hydrogenated to formic acid. CO2 binds on the Ni site by its O lone pair electron (Ads) with the O⋯Ni of 2.34 Å. The CO2 linear structure is distorted from its isolate molecule by reducing the angle of O1-C-O2 to be 174.2° due to the induction of such lone pair interaction. The O1-C bond is lengthened to be 1.17 Å, while the C-O2 bond length decreases from 1.17 to 1.16 Å. The stretching mode of the adsorbed CO2 is slight red-shifted to 2504.5 cm−1 while the bending mode is blue-shifted to 658.1 cm−1 The corresponding frequencies for gas phase CO2 are 2498.7 cm−1 for stretching and 659.4 cm−1 for bending. The changes of structural parameters and vibrations are comparable with previous computational studies of CO2 adsorption on various porous materials like MOFs and zeolites [64,65]. The NPA charge analysis shows some transfer electron of electron density from CO2 to the MOF (0.052e). In line with these small geometrical and vibrational effects, the adsorption free energy of CO2 is −1.1 kcal/mol. The adsorbed CO2 is first hydrogenated at its carbon atom via the transition state (TS1) in which the hydrogen atom on the Ni site transfers to the C1 carbon atom of CO2 to form a formate (HCOO–) intermediate where the Ni-H bond distance is lengthened to 1.61 Å, while the C⋅⋅⋅H distance is shortened to 1.86 Å, indicating bond formation. The normal mode analysis shows a single imaginary frequency of 451.4i cm−1 which is associated with the breaking of the Ni–H bond and the movement of H to the C atom. The activation energy for this step is 8.5 kcal/mol (cf. Fig. 2). The transition state then proceeds to the formate intermediate (Int_1) on the Ni site. It is adsorbed a bi-dentate structure with two oxygen atoms bound to the Ni center with a complexation energy of −19.4 kcal/mol. The O1–Ni and O2–Ni distances are 2.09 and 2.05 Å. This formate intermediate is a key species in the CO2 conversion reaction on various catalysts such as MOFs, zeolites and metals [64–66]. It was also observed as a bi-dentate species on Cu(111) [67,68]. By diffusion, a H2 molecule adsorbs adjacent to the formate intermediate, enabling the formation of the CO2-formate complex (Int_2) with the complexation energy of −14.2 kcal/mol. The formate is hydrogenated to form the formic acid via the hydrogenation transition state (TS2). The H1-H2 bond breaks and H1 and H2 are transferred to the O1 oxygen of formate and the Ni atom respectively. The H1-H2 bond is lengthened from 0.76 to 1.23 Å while the H1⋯Ni distance is shortened to 1.64 Å. The single imaginary frequency of transition state at 540.8i cm−1 corresponds to the simultaneous H1-H2 bond breaking and the formation of the H1–O1 and H2–Ni bonds. The activation energy for this step is 15.1 kcal/mol. Finally, the formic acid product (Prod) is produced and adsorbed on the active site of NiH-DUT-5 with an adsorption energy of −6.7 kcal/mol. It can desorb to regenerate the active site of catalysts with the desorption energy of 21.5 kcal/mol. We now compare the reaction coordinate of the LH mechanism with the ER mechanism discussed above. The LH mechanism begins with the co-adsorption of CO2 and H2 on the NiH active site. The corresponding O⋯Ni and C1⋯H1 distances are 2.34 and 3.44 Å, respectively and the co-adsorption energy is 3.5 kcal/mol, with respect to the isolate molecules. The co-adsorbed molecules react via a transition state in which the H-H bond of H2 is broken and H1 and H2 are simultaneously transferred to the C of CO2 and the H of NiH, respectively, as shown in Fig. 3. The H1-H2 bond lengths increases from 0.76 Å to 0.89 Å, while the H2⋅⋅⋅H distance and the C⋅⋅⋅H1 decrease, the imaginary frequency in this transition state is 638.8i cm−1 and its energy is 27.4 kcal/mol. The formate intermediate is then formed by adsorbing on the NiH site close to the generated H2 molecule with a bi-dentate structure with a complexation energy is of −14.2 kcal/mol. In the second half of the process, the formate hydrogenated in the same manner as in the ER mechanism. As shown in Fig. 3, the activation barrier for the formate formation via the LH mechanism is more than three times higher than via the ER mechanism and the latter is clearly preferred. We also performed the ER reaction calculations on an extended NiH-DUT-5 cluster model in which four organic linkers are included as shown in Fig. S1 to study size effects of the NiH-DUT-5 framework beyond our standard cluster model. The relative energies involved in the reaction are summarized in Table S1. It was found that the activation free energies are almost unaffected by the confinement in the NiH-DUT-5 framework. Therefore, we regard the DUT-5 cluster model used in this work to be sufficient to analyze the adsorption hydrogenation reaction. 3.2 Effect of supported DUT-5 node To reveal the influence of the support material, the ER mechanism without the DUT-5 node is investigated. We use Ni-H with a hydroxide group to keep the Ni charge state as shown in Fig. S2. Fig. 4 shows the relative energies along the reaction coordinate. All adsorbed intermediates and transition states are less stable than with the DUT-5 framework. The first CO2 hydrogenation step requires an activation energy of 14.4 kcal/mol, which is higher than the one with the DUT-5 support (8.5 kcal/mol). The reason is that support increases the electron density on the NiH site, leading to its increased nucleophilicity, thus better activating of CO2 for the hydrogenation step. However, the barrier for the second step, the formation of formic acid, is 14.4 kcal/mol without the DUT-5 framework while with it 15.1 kcal/mol were calculated. It is due to more stability of the formate intermediate in the MOFs system. Thus, DUT-5 acts as a reservoir of electron density and not only as a geometrical means to keep the metal sites in place. 3.3 Effect of the metal active site We study the hydrogenation of CO2 while varying the metal M = Mn, Fe, Co, and Cu, in addition to the Ni which has been discussed above. Because the hydrogenation of CO2 has been found to proceed via the ER mechanism, we stay with this mechanism for the reactions on the MH-DUT-5 MOFs. The relative energies are tabulated in Table 1 and the corresponding optimized structures with the key bond lengths for the reaction on MH-DUT-5 are presented in Figs. S3-S6 of the supporting information. All adsorption and transition states are found to be similar than for NiH-DUT-5 which has been discussed above. The free energies of activation for the formate intermediate formation step, relative to the energies of the isolated molecules, increase as follows: NiH-DUT-5 (8.5 kcal/mol) < MnH-DUT-5 (10.6 kcal/mol) < FeH-DUT-5 (11.6 kcal/mol) < CuH-DUT-5 (15.8 kcal/mol) < CoH-DUT-5 (16.8 kcal/mol), as shown in Table 1. These energies are lower than those obtained for the formate formation on Lewis acidic zeolites [65] and are in the range of the ones found for metal surfaces and metal supported carbon materials [66,69–73]. For NiH-DUT-5, the barrier is slightly lower than the one for CO2 reduction in the corresponding step on a Ni(111) surface [66]. For CuH-DUT-5, it is slightly higher than the one on UIO-68-supported NHC-Cu(I)-H [73] but still lower than on the one obtained from single Cu atoms supported carbon materials [70,71] and also lower than the one found for alkoxide-functionalized MOF-5 [64]. The formation free energies for the formate intermediate adsorbed on the metal site (relative to isolated molecule) range from −5.6 (CuH-DUT-5) to −23.0 kcal/mol (MnH-DUT-5). This intermediate is observed as a key intermediate because it is the most stable species of all studied here as can be seen from Table 1. For the formic acid formation step in which the co-adsorbed H2 molecule reacts with the formate on the active site of the MH-DUT-5, NiH-DUT-5 still shows the lowest Gibbs free energy of activation (15.1 kcal/mol), while CoH-DUT-5 shows the highest one (25.8 kcal/mol). The barriers are in the order of NiH-DUT-5 < FeH-DUT-5 < MnH-DUT-5 < CuH-DUT-5 < CoH-DUT-5. The energies of adsorption of formic acid on the active sites are in range of 2.5 to −6.7 kcal/mol. In Fig. 5 the activation energies for the formation of the intermediate and the ones for formation of the product are compared for all systems. One sees that the rate-determining step of the reaction is always the latter, the hydrogenation of formate to formic acid that involve H2 dissociation. This order was also previously found for the hydrogenation of CO2 to formic acid on UIO-68-supported NHC-Cu(I)-H [73] and for Ir single-atom catalyst supported on porous organic polymer [74]. One also sees that NiH-DUT-5 requires the smallest activation free energy (15.1 kcal/mol) compared to the other metals. Rate constants for the rate-determining step can be calculated by classical TST according to Eq. (4): (4) k = k B T h e x p ( − Δ G # R T ) where k is the rate constant, kB is Boltzmann's constant, h is Planck's constant, T is the temperature, R is the universal gas constant, and ΔG # is the rate-determining step free energy barrier. The rate constants were derived for a reaction temperature of 298.15 K and are shown in Table 2 . Their order is obviously reverse to the order of the activation energies, NiH-DUT-5 > FeH-DUT-5 > MnH-DUT-5 > CuH-DUT-5 > CoH-DUT-5. One can summarize that amongst the five metals, NiH-DUT-5 holds most promise as a catalysts for CO2 hydrogenation. 4 Conclusions We studied the reaction mechanism of the hydrogenation of CO2 to formic acid on aluminum‐based metal‐organic framework support metal(II)-hydride in detail using DFT calculations. The reaction is found to proceed via an ER mechanism involving two steps, the first one leading to a formate intermediate which in turn is hydrogenated to formic acid. NiH-DUT-5 is found to have the lowest barriers for the first and second step (8.5 and 15.1 kcal/mol, respectively). The hydrogenation of CO2 to formate via the LH mechanism would require 27.4 kcal/mol, three times more than with the ER mechanism. The supported DUT-5 stabilizes almost all species formed along the reaction coordinates, but especially the transition states. All five metals hydride supported DUT-5 on the reaction were investigated. In all systems the rate determining steps is the hydrogenation of formate to formic acid. The free energies of activation for the rate determining steps increase as follows: NiH-DUT-5 (15.1 kcal/mol) < FeH-DUT-5 (19.3 kcal/mol) < MnH-DUT-5 (20.5 kcal/mol) < CuH-DUT-5 (21.5 kcal/mol) < CoH-DUT-5 (25.8 kcal/mol). Corresponding rate constants have also been calculated. The catalyst NiH-DUT-5 is predicted to be the most active one. CRediT authorship contribution statement Krongkwan Nilwanna: Investigation. Jarinya Sittiwong: Investigation, Writing – original draft. Bundet Boekfa: Formal analysis. Piti Treesukol: Formal analysis. Sasiwadee Boonya-udtayan: Formal analysis. Michael Probst: Supervision. Thana Maihom: Conceptualization, Data curation, Writing – review & editing. Jumras Limtrakul: Supervision. Declaration of Competing Interest The authors declare that they have no known competing financial interests or personal relationships that could have appeared to influence the work reported in this paper. Acknowledgments This research was supported by grants from the Office of the Ministry of Higher Education, Science, Research and Innovation through the Kasetsart University “Reinventing University Program 2022” to J.S. and T.M., the Postdoctoral Fellowship from the Vidyasirimedhi Institute of Science and Technology (VISTEC) and the Office of the Permanent Secretary, Ministry of Higher Education, Science, Research and Innovation (Grant no. RGNS 63–038) to T.M. and as well as the Graduate Program Scholarship from The Graduate School, Kasetsart University to K.N. Supplementary materials Supplementary material associated with this article can be found, in the online version, at doi:10.1016/j.mcat.2023.113116. Appendix Supplementary materials Image, application 1 References [1] R. Kortlever J. Shen K.J.P. Schouten F. Calle-Vallejo M.T.M. Koper Catalysts and reaction pathways for the electrochemical reduction of carbon dioxide J. Phys. Chem. Lett. 6 2015 4073 4082 R. Kortlever, J. Shen, K.J.P. Schouten, F. Calle-Vallejo, M.T.M. Koper, Catalysts and reaction pathways for the electrochemical reduction of carbon dioxide, J. Phys. Chem. Lett. 6 (2015) 4073–4082. [2] J.T. Feaster C. Shi E.R. Cave T. Hatsukade D.N. Abram K.P. Kuhl C. Hahn J.K. Nørskov T.F. Jaramillo Understanding selectivity for the electrochemical reduction of carbon dioxide to formic acid and carbon monoxide on metal electrodes ACS Catal. 7 2017 4822 4827 J.T. Feaster, C. Shi, E.R. Cave, T. Hatsukade, D.N. Abram, K.P. Kuhl, C. Hahn, J.K. Nørskov, T.F. Jaramillo, Understanding selectivity for the electrochemical reduction of carbon dioxide to formic acid and carbon monoxide on metal electrodes, ACS Catal. 7 (2017), 4822–4827. [3] P. De Luna C. Hahn D. Higgins S.A. Jaffer T.F. Jaramillo E.H. Sargent What would it take for renewably powered electrosynthesis to displace petrochemical processes? Science 364 2019 eaav3506 P. De Luna, C. Hahn, D. Higgins, S.A. Jaffer, T.F. Jaramillo, E.H. Sargent, What would it take for renewably powered electrosynthesis to displace petrochemical processes?, Science 364 (2019) eaav3506. [4] L. Fan C. Xia P. Zhu Y. Lu H. Wang Electrochemical CO2 reduction to high-concentration pure formic acid solutions in an all-solid-state reactor Nat. Commun. 11 2020 3633 L. Fan, C. Xia, P. Zhu, Y. Lu, H. Wang, Electrochemical CO2 reduction to high-concentration pure formic acid solutions in an all-solid-state reactor. Nat. Commun. 11 (2020) 3633. [5] J. Yang X. Wang Y. Qu X. Wang H. Huo Q. Fan J. Wang L.-.M. Yang Y. Wu Bi-based metal-organic framework derived leafy bismuth nanosheets for carbon dioxide electroreduction Adv. Energy Mater. 10 2020 2001709 J. Yang, X. Wang, Y. Qu, X. Wang, H. Huo, Q. Fan, J. Wang, L.-.M. Yang, Y. Wu, Bi-based metal-organic framework derived leafy bismuth nanosheets for carbon dioxide electroreduction, Adv. Energy Mater. 10 (2020) 2001709. [6] J.-H. Liu L.-M. Yang E. Ganz Efficient and Selective Electroreduction of CO2 by single-atom catalyst two-dimensional TM–Pc monolayers ACS Sustain. Chem. Eng. 6 2018 15494 15502 J.-H. Liu, L.-M. Yang, E. Ganz, Efficient and Selective Electroreduction of CO2 by single-atom catalyst two-dimensional TM–Pc monolayers, ACS Sustain. Chem. Eng. 6 (2018) 15494–15502. [7] J.-.H. Liu L.-.M. Yang E. Ganz Electrocatalytic reduction of CO2 by two-dimensional transition metal porphyrin sheets J. Mater. Chem. A 7 2019 11944 11952 J.-.H. Liu, L.-.M. Yang, E. Ganz, Electrocatalytic reduction of CO2 by two-dimensional transition metal porphyrin sheets, J. Mater. Chem. A, 7 (2019) 11944–11952. [8] J.-.H. Liu L.-.M. Yang E. Ganz Efficient electrocatalytic reduction of carbon dioxide by metal-doped β12-borophene monolayers RSC Adv. 9 2019 27710 27719 J.-.H. Liu, L.-.M. Yang, E. Ganz, Efficient electrocatalytic reduction of carbon dioxide by metal-doped β12-borophene monolayers, RSC Adv. 9 (2019) 27710–27719. [9] P.G. Jessop Y. Hsiao T. Ikariya R. Noyori Homogeneous catalysis in supercritical fluids: hydrogenation of supercritical carbon dioxide to formic acid, alkyl formates and formamides J. Am. Chem. Soc. 118 1996 344 355 P.G. Jessop, Y. Hsiao, T. Ikariya, R. Noyori, Homogeneous catalysis in supercritical fluids: hydrogenation of supercritical carbon dioxide to formic acid, alkyl formates and formamides, J. Am. Chem. Soc. 118 (1996) 344–355. [10] W. Wang S. Wang X. Ma J. Gong Recent advances in catalytic hydrogenation of carbon dioxide Chem. Soc. Rev. 40 2011 3703 3727 W. Wang, S. Wang, X. Ma, J. Gong, Recent advances in catalytic hydrogenation of carbon dioxide. Chem. Soc. Rev. 40 (2011) 3703–3727. [11] R. Sun Y. Liao S.-.T. Bai M. Zheng C. Zhou T. Zhang B.F. Sels Heterogeneous catalysts for CO2 hydrogenation to formic acid/Formate: from nanoscale to single atom energy Environ. Sci. 14 2021 1247 1285 R. Sun, Y. Liao, S.-.T. Bai, M. Zheng, C. Zhou, T. Zhang, B.F. Sels, Heterogeneous catalysts for CO2 hydrogenation to formic acid/Formate: from nanoscale to single atom energy Environ. Sci., 14 (2021) 1247–1285. [12] E. Graf W. Leitner Direct formation of formic acid from carbon dioxide and dihydrogen using the [{Rh(cod)Cl}2]–Ph2P(CH2)4PPh2 catalyst system J. Chem. Soc., Chem. Commun. 8 1992 623 624 E. Graf, W. Leitner, Direct formation of formic acid from carbon dioxide and dihydrogen using the [{Rh(cod)Cl}2]–Ph2P(CH2)4PPh2 catalyst system, J. Chem. Soc., Chem. Commun. 8 (1992) 623–624. [13] F. Gassner W. Leitner Hydrogenation of carbon dioxide to formic acid using water-soluble rhodium catalyststs J. Chem. Soc., Chem. Commun. 19 1993 1465 1466 F. Gassner, W. Leitner, Hydrogenation of carbon dioxide to formic acid using water-soluble rhodium catalyststs, J. Chem. Soc., Chem. Commun. 19 (1993) 1465–1466. [14] P.G. Jessop T. Ikariya R. Noyori Homogeneous catalytic hydrogenation of supercritical carbon dioxide Nature 368 1994 231 233 P.G. Jessop, T. Ikariya, R. Noyori, Homogeneous catalytic hydrogenation of supercritical carbon dioxide, Nature 368 (1994) 231–233. [15] Y. Himeda N. Onozawa-Komatsuzaki H. Sugihara K. Kasuga Simultaneous tuning of activity and water solubility of complex catalysts by aci-base equilibrium of ligands for conversion of carbon dioxide Organometallics 26 2007 702 712 Y. Himeda, N. Onozawa-Komatsuzaki, H. Sugihara, K. Kasuga, Simultaneous tuning of activity and water solubility of complex catalysts by aci-base equilibrium of ligands for conversion of carbon dioxide, Organometallics 26 (2007) 702–712. [16] R. Tanaka M. Yamashita K. Nozaki Catalytic hydrogenation of carbon dioxide using Ir(III)−pincer complexes J. Am. Chem. Soc. 131 2009 14168 14169 R. Tanaka, M. Yamashita, K. Nozaki, Catalytic hydrogenation of carbon dioxide using Ir(III)−pincer complexes, J. Am. Chem. Soc. 131 (2009) 14168–14169. [17] R. Kanega M.Z. Ertem N. Onishi D.J. Szalda E. Fujita Y. Himeda CO2 hydrogenation and formic acid dehydrogenation using Ir catalysts with amide-based ligands Organometallics 39 2020 1519 1531 R. Kanega, M.Z. Ertem, N. Onishi, D.J. Szalda, E. Fujita, Y. Himeda, CO2 hydrogenation and formic acid dehydrogenation using Ir catalysts with amide-based ligands Organometallics 39 (2020) 1519–1531. [18] Yaghi O.M. O'Keeffe M. Ockwig N.W. Chae H.K. Eddaoudi M.J. Kim Reticular synthesis and the design of new materials Nature 423 2003 705 714 Yaghi, O.M. O'Keeffe, M. Ockwig, N.W. Chae, H.K. Eddaoudi, M.J. Kim, Reticular synthesis and the design of new materials. Nature 423 (2003) 705–714. [19] S.-.H. Cho B. Ma S.T. Nguyen J.T. Hupp T.E. Albrecht-Schmitt A metal–organic framework material that functions as an enantioselective catalyst for olefin epoxidation Chem. Commun. 24 2006 2563 2565 S.-.H. Cho, B. Ma, S.T. Nguyen, J.T. Hupp, T.E. Albrecht-Schmitt, A metal–organic framework material that functions as an enantioselective catalyst for olefin epoxidation, Chem. Commun. 24 (2006) 2563–2565. [20] B. Liu Q. Yang C. Xue C. Zhong B. Chen B. Smit Enhanced adsorption selectivity of hydrogen/methane mixtures in metal−organic frameworks with interpenetration: a molecular simulation study J. Phys. Chem. C 112 2008 9854 9860 B. Liu, Q. Yang, C. Xue, C. Zhong, B. Chen, B. Smit, Enhanced adsorption selectivity of hydrogen/methane mixtures in metal−organic frameworks with interpenetration: a molecular simulation study, J. Phys. Chem. C 112 (2008) 9854–9860. [21] J. Lee O.K. Farha J. Roberts K.A. Scheidt S.T. Nguyen J.T. Hupp Metal–organic framework materials as catalysts Chem. Soc. Rev. 38 2009 1450 1459 J. Lee, O.K. Farha, J. Roberts, K.A. Scheidt, S.T. Nguyen, J.T. Hupp, Metal–organic framework materials as catalysts, Chem. Soc. Rev. 38 (2009) 1450–1459. [22] A.M. Shultz O.K. Farha J.T. Hupp S.T. Nguyen A catalytically active, permanently microporous MOF with metalloporphyrin struts J. Am. Chem. Soc. 131 2009 4204 4205 A.M. Shultz, O.K. Farha, J.T. Hupp, S.T. Nguyen, A catalytically active, permanently microporous MOF with metalloporphyrin struts, J. Am. Chem. Soc. 131 (2009) 4204–4205. [23] Z. Fang B. Bueken D.E. De Vos R.A. Fischer Defect-engineered metal–organic frameworks Angew. Chem. Int. Ed. 54 2015 7234 7254 Z. Fang, B. Bueken, D.E. De Vos, R.A. Fischer, Defect-engineered metal–organic frameworks. Angew. Chem. Int. Ed., 54 (2015) 7234–7254. [24] A. Corma H. Garcia F. Xamena Engineering metal organic frameworks for heterogeneous catalysis Chem. Rev. 110 2010 4606 4655 A. Corma, H. Garcia, F. Xamena, Engineering metal organic frameworks for heterogeneous catalysis, Chem. Rev. 110 (2010) 4606–4655. [25] L.R. Nathaniel J. Eckert M. Eddaoudi T.V. David J. Kim M. O'Keeffe M. Yaghi Omar Hydrogen storage in microporous metal-organic frameworks Science 300 2003 1127 1129 L.R. Nathaniel, J. Eckert, M. Eddaoudi, T.V. David, J. Kim, M. O'Keeffe, M. Yaghi Omar, Hydrogen storage in microporous metal-organic frameworks, Science 300 (2003) 1127–1129. [26] L. Pan M.B. Sander X. Huang J. Li M. Smith E. Bittner B. Bockrath J.K. Johnson Microporous metal organic materials: promising candidates as sorbents for hydrogen storage J. Am. Chem. Soc. 126 2004 1308 1309 L. Pan, M.B. Sander, X. Huang, J. Li, M. Smith, E. Bittner, B. Bockrath, J.K. Johnson, Microporous metal organic materials: promising candidates as sorbents for hydrogen storage, J. Am. Chem. Soc. 126 (2004) 1308–1309. [27] A.R. Millward O.M. Yaghi Metal−organic frameworks with exceptionally high capacity for storage of carbon dioxide at room temperature J. Am. Chem. Soc. 127 2005 17998 17999 A.R. Millward, O.M. Yaghi, Metal−organic frameworks with exceptionally high capacity for storage of carbon dioxide at room temperature, J. Am. Chem. Soc. 127 (2005) 17998–17999. [28] L.C.R. Jesse C.S. Elinor J. Eckert A.K.H. Judith M.Y. Omar Gas adsorption sites in a large-pore metal-organic framework Science 309 2005 1350 1354 L.C.R. Jesse, C.S. Elinor, J. Eckert, A.K.H. Judith, M.Y. Omar, Gas adsorption sites in a large-pore metal-organic framework, Science 309 (2005) 1350–1354. [29] H. Zhang L.-.M. Yang E. Ganz Adsorption properties and microscopic mechanism of CO2 capture in 1,1-dimethyl-1,2-ethylenediamine-grafted metal–organic frameworks ACS Appl. Mater. Interface. 12 2020 18533 18540 H. Zhang, L.-.M. Yang, E. Ganz, Adsorption properties and microscopic mechanism of CO2 capture in 1,1-dimethyl-1,2-ethylenediamine-grafted metal–organic frameworks ACS Appl. Mater. Interface. 12 (2020) 18533–18540. [30] Hui Zhang Li-Ming Yang Hui Pan Eric Ganz Disclosing the microscopic mechanism and adsorption properties of CO2 capture in N-isopropylethylenediamine appended M2(dobpdc) series Phys. Chem. Chem. Phys. 22 2020 24614 24623 Hui Zhang, Li-Ming Yang, Hui Pan, Eric Ganz, Disclosing the microscopic mechanism and adsorption properties of CO2 capture in N-isopropylethylenediamine appended M2(dobpdc) series, Phys. Chem. Chem. Phys. 22 (2020) 24614–24623. [31] H. Zhang X. Zheng L.-.M. Yang E. Ganz Properties and detailed adsorption of CO2 by M2(dobpdc) with N,N-dimethylethylenediamine functionalization Inorg. Chem. 60 2021 2656 2662 H. Zhang, X. Zheng, L.-.M. Yang, E. Ganz Properties and detailed adsorption of CO2 by M2(dobpdc) with N,N-dimethylethylenediamine functionalization, Inorg. Chem. 60 (2021) 2656–2662. [32] L.J. Murray M. Dincă J.R. Long Hydrogen storage in metal–organic frameworks Chem. Soc. Rev. 38 2009 1294 1314 L.J. Murray, M. Dincă, J.R. Long, Hydrogen storage in metal–organic frameworks, Chem. Soc. Rev. 38 (2009) 1294–1314. [33] K. Manna T. Zhang M. Carboni C.W. Abney W. Lin Salicylaldimine-based metal–organic framework enabling highly active olefin hydrogenation with iron and cobalt catalysts J. Am. Chem. Soc. 136 2014 13182 13185 K. Manna, T. Zhang, M. Carboni, C.W. Abney, W. Lin, Salicylaldimine-based metal–organic framework enabling highly active olefin hydrogenation with iron and cobalt catalysts, J. Am. Chem. Soc. 136 (2014) 13182–13185. [34] C.M. McGuirk M.J. Katz C.L. Stern A.A. Sarjeant J.T. Hupp O.K. Farha C.A. Mirkin Turning On catalysis: incorporation of a hydrogen-bond-donating squaramide moiety into a Zr metal–organic framework J. Am. Chem. Soc. 137 2015 919 925 C.M. McGuirk, M.J. Katz, C.L. Stern, A.A. Sarjeant, J.T. Hupp, O.K. Farha, C.A. Mirkin, Turning On catalysis: incorporation of a hydrogen-bond-donating squaramide moiety into a Zr metal–organic framework, J. Am. Chem. Soc. 137 (2015) 919–925. [35] T. Zhang K. Manna W. Lin Metal–organic frameworks stabilize solution-inaccessible cobalt catalysts for highly efficient broad-scope organic transformations J. Am. Chem. Soc. 138 2016 3241 3249 T. Zhang, K. Manna, W. Lin, Metal–organic frameworks stabilize solution-inaccessible cobalt catalysts for highly efficient broad-scope organic transformations, J. Am. Chem. Soc. 138 (2016) 3241–3249. [36] R. Newar W. Begum N. Antil S. Shukla A. Kumar N. Akhtar S. Balendra K. Manna Single-site cobalt-catalyst ligated with pyridylimine-functionalized metal–organic frameworks for arene and benzylic borylation Inorg. Chem. 59 2020 10473 10481 R. Newar, W. Begum, N. Antil, S. Shukla, A. Kumar, N. Akhtar, S. Balendra, K. Manna, Single-site cobalt-catalyst ligated with pyridylimine-functionalized metal–organic frameworks for arene and benzylic borylation, Inorg. Chem. 59 (2020) 10473–10481. [37] J. Gascon A. Corma F. Kapteijn F.X. Llabrés i Xamena Metal organic framework catalysis: quo vadis? ACS Catal. 4 2014 361 378 J. Gascon, A. Corma, F. Kapteijn, F.X. Llabrés i Xamena, Metal organic framework catalysis: quo vadis?, ACS Catal. 4 (2014) 361–378. [38] L. Ma J.M. Falkowski C. Abney W. Lin A series of isoreticular chiral metal–organic frameworks as a tunable platform for asymmetric catalysis Nat. Chem. 2 2010 838 846 L. Ma, J.M. Falkowski, C. Abney, W. Lin, A series of isoreticular chiral metal–organic frameworks as a tunable platform for asymmetric catalysis, Nat. Chem. 2 (2010) 838–846. [39] D.T. Genna A.G. Wong-Foy A.J. Matzger M.S. Sanford Heterogenization of homogeneous catalysts in metal–organic frameworks via cation exchange J. Am. Chem. Soc. 135 2013 10586 10589 D.T. Genna, A.G. Wong-Foy, A.J. Matzger, M.S. Sanford, Heterogenization of homogeneous catalysts in metal–organic frameworks via cation exchange, J. Am. Chem. Soc. 135 (2013) 10586–10589. [40] M. Vinu S. Pal J.-.D. Chen Y.-.F. Lin Y.-.L. Lai C.-.S. Lee C.-.H. Lin Microporous 3D aluminum MOF doped into chitosan-based mixed matrix membranes for ethanol/water separation J. Chin. Chem. Soc. 66 2019 1165 1171 M. Vinu, S. Pal, J.-.D. Chen, Y.-.F. Lin, Y.-.L. Lai, C.-.S. Lee, C.-.H. Lin, Microporous 3D aluminum MOF doped into chitosan-based mixed matrix membranes for ethanol/water separation, J. Chin. Chem. Soc. 66 (2019) 1165–1171. [41] N. Antil A. Kumar N. Akhtar R. Newar W. Begum A. Dwivedi K. Manna Aluminum metal–organic framework-ligated single-site nickel(II)-hydride for heterogeneous chemoselective catalysis ACS Catal. 11 2021 3943 3957 N. Antil, A. Kumar, N. Akhtar, R. Newar, W. Begum, A. Dwivedi, K. Manna, Aluminum metal–organic framework-ligated single-site nickel(II)-hydride for heterogeneous chemoselective catalysis, ACS Catal. 11 (2021) 3943–3957. [42] N. Antil A. Kumar N. Akhtar R. Newar W. Begum K. Manna Metal–organic framework-confined single-site base-metal catalyst for chemoselective hydrodeoxygenation of carbonyls and alcohols Inorg. Chem. 60 12 2021 9029 9039 N. Antil, A. Kumar, N. Akhtar, R. Newar, W. Begum, K. Manna, Metal–organic framework-confined single-site base-metal catalyst for chemoselective hydrodeoxygenation of carbonyls and alcohols, Inorg. Chem. 60 (12) (2021) 9029–9039. [43] R.B. Getman J.H. Miller K. Wang R.Q. Snurr Metal alkoxide functionalization in metal-organic frameworks for enhanced ambient-temperature hydrogen storage J. Phys. Chem. C 115 2011 2066 2075 R.B. Getman, J.H. Miller, K. Wang, R.Q. Snurr, Metal alkoxide functionalization in metal-organic frameworks for enhanced ambient-temperature hydrogen storage, J. Phys. Chem. C 115 (2011) 2066–2075. [44] T. Maihom S. Choomwattana S. Wannakao M. Probst J. Limtrakul Ethylene epoxidation with nitrous oxide over Fe–BTC metal–organic frameworks: a DFT study ChemPhysChem 17 2016 3416 3422 T. Maihom, S. Choomwattana, S. Wannakao, M. Probst, J. Limtrakul, Ethylene epoxidation with nitrous oxide over Fe–BTC metal–organic frameworks: a DFT study, ChemPhysChem 17 (2016) 3416–3422. [45] K. Lee W.C. Isley A.L. Dzubak P. Verma S.J. Stoneburner L.-.C. Lin J.D. Howe E.D. Bloch D.A. Reed M.R. Hudson C.M. Brown J.R. Long J.B. Neaton B. Smit C.J. Cramer D.G. Truhlar L. Gagliardi Design of a metal-organic framework with enhanced back bonding for separation of N2 and CH4 J. Am. Chem. Soc. 136 2014 698 704 K. Lee, W.C. Isley, A.L. Dzubak, P. Verma, S.J. Stoneburner, L.-.C. Lin, J.D. Howe, E.D. Bloch, D.A. Reed, M.R. Hudson, C.M. Brown, J.R. Long, J.B. Neaton, B. Smit, C.J. Cramer, D.G. Truhlar, L. Gagliardi, Design of a metal-organic framework with enhanced back bonding for separation of N2 and CH4, J. Am. Chem. Soc. 136 (2014) 698–704. [46] M.L. Mendonca R.Q. Snurr Computational screening of metal–organic framework-supported single-atom transition-metal catalysts for the gas-phase hydrolysis of nerve agents ACS Catal. 10 2020 1310 1323 M.L. Mendonca, R.Q. Snurr, Computational screening of metal–organic framework-supported single-atom transition-metal catalysts for the gas-phase hydrolysis of nerve agents, ACS Catal. 10 (2020) 1310–1323. [47] J. Sittiwong S. Boonmark W. Nunthakitgoson T. Maihom C. Wattanakit J. Limtrakul Density functional investigation of the conversion of furfural to furfuryl alcohol by reaction with i-propanol over UiO-66 metal–organic framework Inorg. Chem. 60 2021 4860 4868 J. Sittiwong, S. Boonmark, W. Nunthakitgoson, T. Maihom, C. Wattanakit, J. Limtrakul, Density functional investigation of the conversion of furfural to furfuryl alcohol by reaction with i-propanol over UiO-66 metal–organic framework, Inorg. Chem. 60 (2021) 4860–4868. [48] W. Xue X. Song D. Mei Theoretical insights into CO oxidation over MOF-808 encapsulated single-atom metal catalysts J. Phys. Chem. C 125 2021 17097 17108 W. Xue, X. Song, D. Mei Theoretical insights into CO oxidation over MOF-808 encapsulated single-atom metal catalysts J. Phys. Chem. C 2021, 125, 17097–17108. [49] L.-.M. Yang P. Ravindran M. Tilset Solid-state structure and calculated electronic structure, formation energy, chemical bonding, and optical properties of Zn4O(FMA)3 and its heavier congener Cd4O(FMA)3 Inorg. Chem. 52 2013 4217 4228 L.-.M. Yang, P. Ravindran, M. Tilset, Solid-state structure and calculated electronic structure, formation energy, chemical bonding, and optical properties of Zn4O(FMA)3 and its heavier congener Cd4O(FMA)3, Inorg. Chem. 52 (2013) 4217–4228. [50] L.-.M. Yang G.-.Y. Fang J. Ma E. Ganz S.S. Han Band gap engineering of paradigm MOF-5 Cryst. Grow. Des. 14 2014 2532 2541 L.-.M. Yang, G.-.Y. Fang, J. Ma, E. Ganz, S.S. Han, Band gap engineering of paradigm MOF-5, Cryst. Grow. Des. 14 (2014) 2532–2541. [51] L.-.M. Yang G.-.Y. Fang J. Ma R. Pushpa E. Ganz Halogenated MOF-5 variants show new configuration, tunable band gaps and enhanced optical response in the visible and near infrared Phys. Chem. Chem. Phys. 18 2016 32319 32330 L.-.M. Yang, G.-.Y. Fang, J. Ma, R. Pushpa, E. Ganz, Halogenated MOF-5 variants show new configuration, tunable band gaps and enhanced optical response in the visible and near infrared, Phys. Chem. Chem. Phys. 18 (2016) 32319–32330. [52] Y. Zhao D.G. Truhlar Density functionals with broad applicability in chemistry Acc. Chem. Res. 4 2008 157 167 Y. Zhao, D.G. Truhlar, Density functionals with broad applicability in chemistry, Acc. Chem. Res. 4 (2008) 157–167. [53] M.J. Frisch G.W. Trucks H.B. Schlegel G.E. Scuseria M.A. Robb J.R. Cheeseman G. Scalmani V. Barone G.A. Petersson H. Nakatsuji X. Li M. Caricato A.V. Marenich J. Bloino B.G. Janesko R. Gomperts B. Mennucci H.P. Hratchian J.V. Ortiz A.F. Izmaylov J.L. Sonnenberg D. Williams-Young F. Ding F. Lipparini F. Egidi J. Goings B. Peng A. Petrone T. Henderson D. Ranasinghe V.G. Zakrzewski J. Gao N. Rega G. Zheng W. Liang M. Hada M. Ehara K. Toyota R. Fukuda J. Hasegawa M. Ishida T. Nakajima Y. Honda O. Kitao H. Nakai T. Vreven K. Throssell J.A.Montgomery Jr J.E. Peralta F. Ogliaro M.J. Bearpark J.J. Heyd E.N. Brothers K.N. Kudin V.N. Staroverov T.A. Keith R. Kobayashi J. Normand K. Raghavachari A.P. Rendell J.C. Burant S.S. Iyengar J. Tomasi M. Cossi J.M. Millam M. Klene C. Adamo R. Cammi J.W. Ochterski R.L. Martin K. Morokuma O. Farkas J.B. Foresman D.J. Fox Gaussian 16 (Revision B.01) 2016 Gaussian Inc. Wallingford, CT M.J. Frisch, G.W. Trucks, H.B. Schlegel, G.E. Scuseria, M.A. Robb, J.R. Cheeseman, G. Scalmani, V. Barone, G.A. Petersson, H. Nakatsuji, X. Li, M. Caricato, A.V. Marenich, J. Bloino, B.G. Janesko, R. Gomperts, B. Mennucci, H.P. Hratchian, J.V. Ortiz, A.F. Izmaylov, J.L. Sonnenberg, D. Williams-Young, F. Ding, F. Lipparini, F. Egidi, J. Goings, B. Peng, A. Petrone, T. Henderson, D. Ranasinghe, V.G. Zakrzewski, J. Gao, N. Rega, G. Zheng, W. Liang, M. Hada, M. Ehara, K. Toyota, R. Fukuda, J. Hasegawa, M. Ishida, T. Nakajima, Y. Honda, O. Kitao, H. Nakai, T. Vreven, K. Throssell, J.A.Montgomery Jr., J.E. Peralta, F. Ogliaro, M.J. Bearpark, J.J. Heyd, E.N. Brothers, K.N. Kudin, V.N. Staroverov, T.A. Keith, R. Kobayashi, J. Normand, K. Raghavachari, A.P. Rendell, J.C. Burant, S.S. Iyengar, J. Tomasi, M. Cossi, J.M. Millam, M. Klene, C. Adamo, R. Cammi, J.W. Ochterski, R.L. Martin, K. Morokuma, O. Farkas, J.B. Foresman, D.J. Fox, Gaussian 16 (Revision B.01), Gaussian Inc., Wallingford, CT, 2016. [54] Y. Zhao D.G. Truhlar Benchmark data for interactions in zeolite model complexes and their use for assessment and validation of electronic structure methods J. Phys. Chem. C 112 2008 6860 6868 Y. Zhao, D.G. Truhlar, Benchmark data for interactions in zeolite model complexes and their use for assessment and validation of electronic structure methods, J. Phys. Chem. C 112 (2008) 6860–6868. [55] S. Ketrat T. Maihom S. Wannakao M. Probst S. Nokbin J. Limtrakul Coordinatively unsaturated metal-organic frameworks M3(btc)2 (M = Cr, Fe, Co, Ni, Cu, and Zn) catalyzing the oxidation of CO by N2O: insight from DFT calculations Inorg. Chem. 56 2017 14005 14012 S. Ketrat, T. Maihom, S. Wannakao, M. Probst, S. Nokbin, J. Limtrakul, Coordinatively unsaturated metal-organic frameworks M3(btc)2 (M = Cr, Fe, Co, Ni, Cu, and Zn) catalyzing the oxidation of CO by N2O: insight from DFT calculations, Inorg. Chem. 56 (2017) 14005–14012. [56] T. Maihom M. Sawangphruk M. Probst J. Limtrakul A computational study of the catalytic aerobic epoxidation of propylene over the coordinatively unsaturated metal–organic framework Fe3(btc)2: formation of propylene oxide and competing reactions Phys. Chem. Chem. Phys. 20 2018 6726 6734 T. Maihom, M. Sawangphruk, M. Probst, J. Limtrakul, A computational study of the catalytic aerobic epoxidation of propylene over the coordinatively unsaturated metal–organic framework Fe3(btc)2: formation of propylene oxide and competing reactions, Phys. Chem. Chem. Phys. 20 (2018) 6726–6734. [57] T. Maihom M. Probst J. Limtrakul Computational study of the carbonyl–ene reaction between formaldehyde and propylene encapsulated in coordinatively unsaturated metal–organic frameworks M3(btc)2 (M = Fe, Co, Ni, Cu and Zn) Phys. Chem. Chem. Phys. 21 2019 2783 2789 T. Maihom, M. Probst, J. Limtrakul, Computational study of the carbonyl–ene reaction between formaldehyde and propylene encapsulated in coordinatively unsaturated metal–organic frameworks M3(btc)2 (M = Fe, Co, Ni, Cu and Zn), Phys. Chem. Chem. Phys. 21 (2019) 2783–2789. [58] J. Sittiwong A. Prasertsab S. Boonmark W. Nunthakitgoson P. Srifa T. Maihom J. Limtrakul Theoretical insights into furfural reduction to furfuryl alcohol via the catalytic hydrogen transfer reaction catalyzed by cations exchanged zirconium-containing zeolites Mol. Catal. 504 2021 111471 J. Sittiwong, A. Prasertsab, S. Boonmark, W. Nunthakitgoson, P. Srifa, T. Maihom, J. Limtrakul, Theoretical insights into furfural reduction to furfuryl alcohol via the catalytic hydrogen transfer reaction catalyzed by cations exchanged zirconium-containing zeolites, Mol. Catal. 504 (2021) 111471. [59] A.S. Lawrence B. Sivakumar A. Dhakshinamoorthy Detecting Lewis acid sites in metal-organic frameworks by density functional theory Molecul. Cataly. 517 2022 112042 A.S. Lawrence, B. Sivakumar, A. Dhakshinamoorthy, Detecting Lewis acid sites in metal-organic frameworks by density functional theory, Molecul. Cataly., 517 (2022) 112042. [60] M. Dolg H. Stoll H. Preuss R.M. Pitzer Relativistic and correlation effects for element 105 (hahnium, Ha): a comparative study of M and MO (M = Nb, Ta, Ha) using energy-adjusted ab initio pseudopotentials J. Phys. Chem. 97 1993 5852 5859 M. Dolg, H. Stoll, H. Preuss, R.M. Pitzer, Relativistic and correlation effects for element 105 (hahnium, Ha): a comparative study of M and MO (M = Nb, Ta, Ha) using energy-adjusted ab initio pseudopotentials, J. Phys. Chem. 97 (1993) 5852–5859. [61] S. Grimme J. Antony S. Ehrlich H. Krieg A consistent and accurate Ab initio parametrization of density functional dispersion correction (DFT-D) for the 94 elements H-Pu J. Chem. Phys. 132 2010 154104 154118 S. Grimme, J. Antony, S. Ehrlich, H. Krieg, A consistent and accurate Ab initio parametrization of density functional dispersion correction (DFT-D) for the 94 elements H-Pu, J. Chem. Phys. 132 (2010) 154104–154118. [62] A.E. Reed L.A. Curtiss F. Weinhold Intermolecular interactions from a natural bond orbital, donor-acceptor viewpoint Chem. Rev. 88 1988 899 926 A.E. Reed, L.A. Curtiss, F. Weinhold, Intermolecular interactions from a natural bond orbital, donor-acceptor viewpoint, Chem. Rev. 88 (1988) 899–926. [63] F. Neese The ORCA program system Wiley Interdiscip. Rev.: Comput. Mol. Sci. 2 2012 73 78 Neese, F. The ORCA program system. Wiley Interdiscip. Rev.: Comput. Mol. Sci. 2 (2012) 73–78. [64] T. Maihom S. Wannakao B. Boekfa J. Limtrakul Production of formic acid via hydrogenation of CO2 over a copper-alkoxide-functionalized MOF: a mechanistic study J. Phys. Chem. C 117 2013 17650 17658 T. Maihom, S. Wannakao, B. Boekfa, J. Limtrakul, Production of formic acid via hydrogenation of CO2 over a copper-alkoxide-functionalized MOF: a mechanistic study, J. Phys. Chem. C 117 (2013) 17650–17658. [65] W. Thongnuam T. Maihom S. Choomwattana Y. Injongkol B. Boekfa P. Treesukol J. Limtrakul Theoretical study of CO2 hydrogenation into formic acid on Lewis acid zeolites Phys. Chem. Chem. Phys. 20 2018 25179 25185 W. Thongnuam, T. Maihom, S. Choomwattana, Y. Injongkol, B. Boekfa, P. Treesukol, J. Limtrakul, Theoretical study of CO2 hydrogenation into formic acid on Lewis acid zeolites, Phys. Chem. Chem. Phys. 20 (2018) 25179–25185. [66] G. Peng S.J. Sibener G.C. Schatz S.T. Ceyer M. Mavrikakis CO2 hydrogenation to formic acid on Ni(111) J. Phys. Chem. C 116 2012 3001 3006 G. Peng, S.J. Sibener, G.C. Schatz, S.T. Ceyer, M. Mavrikakis, CO2 hydrogenation to formic acid on Ni(111), J. Phys. Chem. C 116 (2012) 3001–3006. [67] A. Sotiropoulos P.K. Milligan B.C.C. Cowie M. Kadodwala A structural study of formate on Cu(111) Surf. Sci. 444 2000 52 60 A. Sotiropoulos, P.K. Milligan, B.C.C. Cowie, M. Kadodwala, A structural study of formate on Cu(111), Surf. Sci. 444 (2000) 52–60. [68] T. Fujitani Y. Choi M. Sano Y. Kushida J. Nakamura Scanning tunneling microscopy study of formate species synthesized from CO2 hydrogenation and prepared by adsorption of formic acid over Cu(111) J. Phys. Chem. B 104 2000 1235 1240 T. Fujitani, Y. Choi, M. Sano, Y. Kushida, J. Nakamura, Scanning tunneling microscopy study of formate species synthesized from CO2 hydrogenation and prepared by adsorption of formic acid over Cu(111), J. Phys. Chem. B 104 (2000) 1235–1240. [69] G. Gao Y. Jiao E.R. Waclawik A. Du Single atom (Pd/Pt) supported on graphitic carbon nitride as an efficient photocatalyst for visible-light reduction of carbon dioxide J. Am. Chem. Soc. 138 2016 6292 6297 G. Gao, Y. Jiao, E.R. Waclawik, A. Du, Single atom (Pd/Pt) supported on graphitic carbon nitride as an efficient photocatalyst for visible-light reduction of carbon dioxide, J. Am. Chem. Soc. 138 (2016) 6292–6297. [70] J. Sirijaraensre J. Limtrakul Hydrogenation of CO2 to formic acid over a Cu-embedded graphene: a DFT study App. Surf. Sci. 364 2016 241 248 J. Sirijaraensre, J. Limtrakul, Hydrogenation of CO2 to formic acid over a Cu-embedded graphene: a DFT study, App. Surf. Sci. 364 (2016) 241–248. [71] K. Homlamai T. Maihom S. Choomwattana M. Sawangphruk J. Limtrakul Single-atoms supported (Fe, Co, Ni, Cu) on graphitic carbon nitride for CO2 adsorption and hydrogenation to formic acid: first-principles insights Appl. Surf. Sci. 499 2020 143928 K. Homlamai, T. Maihom, S. Choomwattana, M. Sawangphruk, J. Limtrakul, Single-atoms supported (Fe, Co, Ni, Cu) on graphitic carbon nitride for CO2 adsorption and hydrogenation to formic acid: first-principles insights, Appl. Surf. Sci. 499 (2020) 143928. [72] N. Yodsin C. Rungnim S. Tungkamani V. Promarak S. Namuangruk S. Jungsuttiwong DFT study of catalytic CO2 hydrogenation over Pt-decorated carbon nanocones: H2 dissociation combined with the spillover mechanism J. Phys. Chem. C 124 2020 1941 1949 N. Yodsin, C. Rungnim, S. Tungkamani, V. Promarak, S. Namuangruk, S. Jungsuttiwong, DFT study of catalytic CO2 hydrogenation over Pt-decorated carbon nanocones: H2 dissociation combined with the spillover mechanism, J. Phys. Chem. C 124 (2020) 1941–1949. [73] K. Yang J. Jiang Transforming CO2 into methanol with N-heterocyclic carbene-stabilized coinage metal hydrides immobilized in a metal–organic framework UiO-68 ACS Appl. Mater. Interface. 13 2021 58723 58736 K. Yang, J. Jiang, Transforming CO2 into methanol with N-heterocyclic carbene-stabilized coinage metal hydrides immobilized in a metal–organic framework UiO-68, ACS Appl. Mater. Interface. 13 (2021) 58723–58736. [74] X. Shao X. Yang J. Xu S. Liu S. Miao X. Liu X. Su H. Duan Y. Huang T. Zhang Iridium single-atom catalyst performing a Quasi-homogeneous hydrogenation transformation of CO2 to formate Chem 5 2019 693 705 X. Shao, X. Yang, J. Xu, S. Liu, S. Miao, X. Liu, X. Su, H. Duan, Y. Huang, T. Zhang, Iridium single-atom catalyst performing a Quasi-homogeneous hydrogenation transformation of CO2 to formate. Chem 5 (2019) 693–705.",
      "scopus-id": "85151289597",
      "coredata": {
        "eid": "1-s2.0-S246882312300202X",
        "dc:description": "Conversion of carbon dioxide (CO2) to value-added chemicals is achieving increased attention from an environmental and industrial perspective because it could reduce the dependency on petroleum as raw material and also its net emission into the atmosphere. We present mechanisms for the CO2 hydrogenation on the aluminum-based metal-organic framework DUT-5 support transition metal(II)-hydride in a detailed using density functional (DFT) calculations. Two different pathways, namely, Eley-Rideal (ER) and Langmuir-Hinshelwood (LH) mechanisms are described. The ER mechanism requires activation barriers of 8.5 and 15.1 kcal/mol for the formation of formate and of formic acid steps, respectively. The first barrier is three times lower than in the LH mechanism (27.4 kcal/mol), thus favouring the ER mechanism. Supported DUT-5 MOFs are also found to have a stabilizing effect on the intermediates and transition states formed along the reaction coordinate. Finally, we screen the catalytic activities of different metals substituted into MH-DUT-5 (M = Mn, Fe, Co, Ni, and Cu) MOFs for the hydrogenation of CO2 to formic acid. It is found that NiH-DUT-5 exhibits the highest catalytic activity, based on its barriers.",
        "openArchiveArticle": "false",
        "prism:coverDate": "2023-04-15",
        "openaccessUserLicense": null,
        "prism:aggregationType": "Journal",
        "prism:url": "https://api.elsevier.com/content/article/pii/S246882312300202X",
        "dc:creator": [
          {
            "@_fa": "true",
            "$": "Nilwanna, Krongkwan"
          },
          {
            "@_fa": "true",
            "$": "Sittiwong, Jarinya"
          },
          {
            "@_fa": "true",
            "$": "Boekfa, Bundet"
          },
          {
            "@_fa": "true",
            "$": "Treesukol, Piti"
          },
          {
            "@_fa": "true",
            "$": "Boonya-udtayan, Sasiwadee"
          },
          {
            "@_fa": "true",
            "$": "Probst, Michael"
          },
          {
            "@_fa": "true",
            "$": "Maihom, Thana"
          },
          {
            "@_fa": "true",
            "$": "Limtrakul, Jumras"
          }
        ],
        "link": [
          {
            "@_fa": "true",
            "@rel": "self",
            "@href": "https://api.elsevier.com/content/article/pii/S246882312300202X"
          },
          {
            "@_fa": "true",
            "@rel": "scidir",
            "@href": "https://www.sciencedirect.com/science/article/pii/S246882312300202X"
          }
        ],
        "dc:format": "application/json",
        "openaccessType": null,
        "pii": "S2468-8231(23)00202-X",
        "prism:volume": "541",
        "articleNumber": "113116",
        "prism:publisher": "Elsevier B.V.",
        "dc:title": "Aluminum‐based metal‐organic framework support metal(II)-hydride as catalyst for the hydrogenation of carbon dioxide to formic acid: A computational study",
        "prism:copyright": "© 2023 Elsevier B.V. All rights reserved.",
        "openaccess": "0",
        "prism:issn": "24688231",
        "dcterms:subject": [
          {
            "@_fa": "true",
            "$": "Carbon dioxide hydrogenation"
          },
          {
            "@_fa": "true",
            "$": "Mechanisms"
          },
          {
            "@_fa": "true",
            "$": "Metal-organic framework"
          },
          {
            "@_fa": "true",
            "$": "Metal hydride"
          },
          {
            "@_fa": "true",
            "$": "Density functional theory"
          }
        ],
        "openaccessArticle": "false",
        "prism:publicationName": "Molecular Catalysis",
        "openaccessSponsorType": null,
        "prism:pageRange": "113116",
        "pubType": "fla",
        "prism:coverDisplayDate": "15 April 2023",
        "prism:doi": "10.1016/j.mcat.2023.113116",
        "prism:startingPage": "113116",
        "dc:identifier": "doi:10.1016/j.mcat.2023.113116",
        "openaccessSponsorName": null
      },
      "objects": {
        "object": [
          {
            "@category": "standard",
            "@height": "247",
            "@width": "458",
            "@_fa": "true",
            "$": "https://api.elsevier.com/content/object/eid/1-s2.0-S246882312300202X-gr5.jpg?httpAccept=%2A%2F%2A",
            "@multimediatype": "JPEG image file",
            "@type": "IMAGE-DOWNSAMPLED",
            "@size": "28550",
            "@ref": "gr5",
            "@mimetype": "image/jpeg"
          },
          {
            "@category": "standard",
            "@height": "438",
            "@width": "458",
            "@_fa": "true",
            "$": "https://api.elsevier.com/content/object/eid/1-s2.0-S246882312300202X-gr2.jpg?httpAccept=%2A%2F%2A",
            "@multimediatype": "JPEG image file",
            "@type": "IMAGE-DOWNSAMPLED",
            "@size": "41739",
            "@ref": "gr2",
            "@mimetype": "image/jpeg"
          },
          {
            "@category": "standard",
            "@height": "200",
            "@width": "445",
            "@_fa": "true",
            "$": "https://api.elsevier.com/content/object/eid/1-s2.0-S246882312300202X-ga1.jpg?httpAccept=%2A%2F%2A",
            "@multimediatype": "JPEG image file",
            "@type": "IMAGE-DOWNSAMPLED",
            "@size": "26287",
            "@ref": "ga1",
            "@mimetype": "image/jpeg"
          },
          {
            "@category": "standard",
            "@height": "275",
            "@width": "609",
            "@_fa": "true",
            "$": "https://api.elsevier.com/content/object/eid/1-s2.0-S246882312300202X-gr1.jpg?httpAccept=%2A%2F%2A",
            "@multimediatype": "JPEG image file",
            "@type": "IMAGE-DOWNSAMPLED",
            "@size": "40841",
            "@ref": "gr1",
            "@mimetype": "image/jpeg"
          },
          {
            "@category": "standard",
            "@height": "369",
            "@width": "604",
            "@_fa": "true",
            "$": "https://api.elsevier.com/content/object/eid/1-s2.0-S246882312300202X-gr4.jpg?httpAccept=%2A%2F%2A",
            "@multimediatype": "JPEG image file",
            "@type": "IMAGE-DOWNSAMPLED",
            "@size": "38069",
            "@ref": "gr4",
            "@mimetype": "image/jpeg"
          },
          {
            "@category": "standard",
            "@height": "455",
            "@width": "642",
            "@_fa": "true",
            "$": "https://api.elsevier.com/content/object/eid/1-s2.0-S246882312300202X-gr3.jpg?httpAccept=%2A%2F%2A",
            "@multimediatype": "JPEG image file",
            "@type": "IMAGE-DOWNSAMPLED",
            "@size": "81038",
            "@ref": "gr3",
            "@mimetype": "image/jpeg"
          },
          {
            "@category": "thumbnail",
            "@height": "118",
            "@width": "219",
            "@_fa": "true",
            "$": "https://api.elsevier.com/content/object/eid/1-s2.0-S246882312300202X-gr5.sml?httpAccept=%2A%2F%2A",
            "@multimediatype": "GIF image file",
            "@type": "IMAGE-THUMBNAIL",
            "@size": "10498",
            "@ref": "gr5",
            "@mimetype": "image/gif"
          },
          {
            "@category": "thumbnail",
            "@height": "163",
            "@width": "171",
            "@_fa": "true",
            "$": "https://api.elsevier.com/content/object/eid/1-s2.0-S246882312300202X-gr2.sml?httpAccept=%2A%2F%2A",
            "@multimediatype": "GIF image file",
            "@type": "IMAGE-THUMBNAIL",
            "@size": "6865",
            "@ref": "gr2",
            "@mimetype": "image/gif"
          },
          {
            "@category": "thumbnail",
            "@height": "98",
            "@width": "219",
            "@_fa": "true",
            "$": "https://api.elsevier.com/content/object/eid/1-s2.0-S246882312300202X-ga1.sml?httpAccept=%2A%2F%2A",
            "@multimediatype": "GIF image file",
            "@type": "IMAGE-THUMBNAIL",
            "@size": "8362",
            "@ref": "ga1",
            "@mimetype": "image/gif"
          },
          {
            "@category": "thumbnail",
            "@height": "99",
            "@width": "219",
            "@_fa": "true",
            "$": "https://api.elsevier.com/content/object/eid/1-s2.0-S246882312300202X-gr1.sml?httpAccept=%2A%2F%2A",
            "@multimediatype": "GIF image file",
            "@type": "IMAGE-THUMBNAIL",
            "@size": "8440",
            "@ref": "gr1",
            "@mimetype": "image/gif"
          },
          {
            "@category": "thumbnail",
            "@height": "134",
            "@width": "219",
            "@_fa": "true",
            "$": "https://api.elsevier.com/content/object/eid/1-s2.0-S246882312300202X-gr4.sml?httpAccept=%2A%2F%2A",
            "@multimediatype": "GIF image file",
            "@type": "IMAGE-THUMBNAIL",
            "@size": "8210",
            "@ref": "gr4",
            "@mimetype": "image/gif"
          },
          {
            "@category": "thumbnail",
            "@height": "155",
            "@width": "219",
            "@_fa": "true",
            "$": "https://api.elsevier.com/content/object/eid/1-s2.0-S246882312300202X-gr3.sml?httpAccept=%2A%2F%2A",
            "@multimediatype": "GIF image file",
            "@type": "IMAGE-THUMBNAIL",
            "@size": "12509",
            "@ref": "gr3",
            "@mimetype": "image/gif"
          },
          {
            "@category": "high",
            "@height": "1095",
            "@width": "2027",
            "@_fa": "true",
            "$": "https://api.elsevier.com/content/object/eid/1-s2.0-S246882312300202X-gr5_lrg.jpg?httpAccept=%2A%2F%2A",
            "@multimediatype": "JPEG image file",
            "@type": "IMAGE-HIGH-RES",
            "@size": "197891",
            "@ref": "gr5",
            "@mimetype": "image/jpeg"
          },
          {
            "@category": "high",
            "@height": "1937",
            "@width": "2027",
            "@_fa": "true",
            "$": "https://api.elsevier.com/content/object/eid/1-s2.0-S246882312300202X-gr2_lrg.jpg?httpAccept=%2A%2F%2A",
            "@multimediatype": "JPEG image file",
            "@type": "IMAGE-HIGH-RES",
            "@size": "286536",
            "@ref": "gr2",
            "@mimetype": "image/jpeg"
          },
          {
            "@category": "high",
            "@height": "886",
            "@width": "1970",
            "@_fa": "true",
            "$": "https://api.elsevier.com/content/object/eid/1-s2.0-S246882312300202X-ga1_lrg.jpg?httpAccept=%2A%2F%2A",
            "@multimediatype": "JPEG image file",
            "@type": "IMAGE-HIGH-RES",
            "@size": "156584",
            "@ref": "ga1",
            "@mimetype": "image/jpeg"
          },
          {
            "@category": "high",
            "@height": "1217",
            "@width": "2697",
            "@_fa": "true",
            "$": "https://api.elsevier.com/content/object/eid/1-s2.0-S246882312300202X-gr1_lrg.jpg?httpAccept=%2A%2F%2A",
            "@multimediatype": "JPEG image file",
            "@type": "IMAGE-HIGH-RES",
            "@size": "299115",
            "@ref": "gr1",
            "@mimetype": "image/jpeg"
          },
          {
            "@category": "high",
            "@height": "1633",
            "@width": "2673",
            "@_fa": "true",
            "$": "https://api.elsevier.com/content/object/eid/1-s2.0-S246882312300202X-gr4_lrg.jpg?httpAccept=%2A%2F%2A",
            "@multimediatype": "JPEG image file",
            "@type": "IMAGE-HIGH-RES",
            "@size": "294341",
            "@ref": "gr4",
            "@mimetype": "image/jpeg"
          },
          {
            "@category": "high",
            "@height": "2016",
            "@width": "2842",
            "@_fa": "true",
            "$": "https://api.elsevier.com/content/object/eid/1-s2.0-S246882312300202X-gr3_lrg.jpg?httpAccept=%2A%2F%2A",
            "@multimediatype": "JPEG image file",
            "@type": "IMAGE-HIGH-RES",
            "@size": "639010",
            "@ref": "gr3",
            "@mimetype": "image/jpeg"
          },
          {
            "@category": "standard",
            "@_fa": "true",
            "$": "https://api.elsevier.com/content/object/eid/1-s2.0-S246882312300202X-mmc1.docx?httpAccept=%2A%2F%2A",
            "@multimediatype": "Microsoft Word file",
            "@type": "APPLICATION",
            "@size": "2281079",
            "@ref": "mmc1",
            "@mimetype": "application/word"
          },
          {
            "@category": "thumbnail",
            "@_fa": "true",
            "$": "https://api.elsevier.com/content/object/eid/1-s2.0-S246882312300202X-si1.svg?httpAccept=%2A%2F%2A",
            "@multimediatype": "Scalable Vector Graphics file",
            "@type": "ALTIMG",
            "@size": "8722",
            "@ref": "si1",
            "@mimetype": "image/svg+xml"
          },
          {
            "@category": "thumbnail",
            "@_fa": "true",
            "$": "https://api.elsevier.com/content/object/eid/1-s2.0-S246882312300202X-si2.svg?httpAccept=%2A%2F%2A",
            "@multimediatype": "Scalable Vector Graphics file",
            "@type": "ALTIMG",
            "@size": "12288",
            "@ref": "si2",
            "@mimetype": "image/svg+xml"
          },
          {
            "@category": "thumbnail",
            "@_fa": "true",
            "$": "https://api.elsevier.com/content/object/eid/1-s2.0-S246882312300202X-si3.svg?httpAccept=%2A%2F%2A",
            "@multimediatype": "Scalable Vector Graphics file",
            "@type": "ALTIMG",
            "@size": "11160",
            "@ref": "si3",
            "@mimetype": "image/svg+xml"
          },
          {
            "@category": "thumbnail",
            "@_fa": "true",
            "$": "https://api.elsevier.com/content/object/eid/1-s2.0-S246882312300202X-si4.svg?httpAccept=%2A%2F%2A",
            "@multimediatype": "Scalable Vector Graphics file",
            "@type": "ALTIMG",
            "@size": "10756",
            "@ref": "si4",
            "@mimetype": "image/svg+xml"
          },
          {
            "@category": "standard",
            "@_fa": "true",
            "$": "https://api.elsevier.com/content/object/eid/1-s2.0-S246882312300202X-am.pdf?httpAccept=%2A%2F%2A",
            "@multimediatype": "Acrobat PDF file",
            "@type": "AAM-PDF",
            "@size": "732449",
            "@ref": "am",
            "@mimetype": "application/pdf"
          }
        ]
      },
      "link": {
        "@rel": "abstract",
        "@href": "https://api.elsevier.com/content/abstract/scopus_id/85151289597"
      }
    }
  }
}