{
  "metadata": {
    "title": "Simultaneous catalytic oxidation of nitric oxide and elemental mercury by single-atom Pd/g-C<ce:inf loc=post>3</ce:inf>N<ce:inf loc=post>4</ce:inf> catalyst: A DFT study",
    "authors": "; ; ",
    "journal": "Molecular Catalysis",
    "date": "2020-06-30",
    "doi": "10.1016/j.mcat.2020.110901",
    "abstract": "",
    "uri": "https://api.elsevier.com/content/article/pii/S2468823120301553",
    "pii": "S2468823120301553"
  },
  "fulltext": {
    "full-text-retrieval-response": {
      "scopus-eid": "2-s2.0-85083013687",
      "originalText": "serial JL 315758 291210 291744 291790 291809 31 Molecular Catalysis MOLECULARCATALYSIS 2020-04-11 2020-04-11 2020-04-11 2020-04-11 2020-05-23T15:56:08 1-s2.0-S2468823120301553 S2468-8231(20)30155-3 S2468823120301553 10.1016/j.mcat.2020.110901 S300 S300.2 FULL-TEXT 1-s2.0-S2468823120X00071 2020-06-13T00:07:37.576961Z 0 0 20200601 20200630 2020 2020-04-11T05:16:18.728487Z absattachment articleinfo articlenumber articletitlenorm authfirstinitialnorm authfirstsurnamenorm cid cids contenttype copyright crossmark dateloaded dateloadedtxt datesearch datesort dateupdated dco docsubtype doctype doi eid ewtransactionid hubeid indexeddate issn issnnorm itemstage itemtransactionid itemweight openaccess openarchive pg pgfirst pii piinorm pubdateend pubdatestart pubdatetxt pubyr sectiontitle sortorder srctitle srctitlenorm srctype ssids alllist content subj subheadings suppl tomb volfirst volissue volumelist webpdf webpdfpagecount yearnav figure table e-component body mmlmath acknowledge affil appendices articletitle auth authfirstini authfull authkeywords authlast grantnumber grantsponsor grantsponsorid highlightsabst orcid primabst ref specialabst 2468-8231 24688231 true 488 488 C Volume 488 11 110901 110901 110901 202006 June 2020 2020-06-01 2020-06-30 2020 Regular Papers article fla © 2020 Elsevier B.V. All rights reserved. SIMULTANEOUSCATALYTICOXIDATIONNITRICOXIDEELEMENTALMERCURYBYSINGLEATOMPDGC3N4CATALYSTADFTSTUDY LIU X 1 Introduction 2 Computational methods 3 Results and discussions 3.1 The model of Pdsac/g-C3N4 catalyst 3.2 Adsorption characteristic of reaction gases 3.3 Reaction paths of NO oxidation on Pdsac/g-C3N4 catalyst 3.3.1 E-R reaction mechanism of NO oxidation 3.3.2 L-H reaction mechanism of NO oxidation 3.3.3 TER reaction mechanism of NO oxidation 3.3.4 Residual oxygen atom reaction mechanism 3.4 Reaction paths of Hg0 oxidation on Pd/g-C3N4 catalyst 3.5 Thermodynamics analysis 3.6 Kinetic analysis 4 Conclusions CRediT authorship contribution statement Acknowledgement Appendix A Supplementary data References LIU 2019 576 584 D ZHAO 2019 26 64 S CHEN 2019 537 547 C TANG 2020 121679 H YANG 2019 304 313 W LIU 2019 X LIU 2018 11769 11777 J LIU 2019 439 446 C ZHAO 2016 420 430 L ZHONG 2016 851 860 L SHEN 2018 409 415 F QU 2016 704 708 W CUI 2019 10078 10089 S LIU 2018 431 441 Y DUAN 2019 830 840 X MAQBOOL 2014 28 37 M HONG 2017 3440 3452 Z YK 2012 1359 1365 Y LIU 2012 6182 6189 C YANG 2019 660 670 Y YANG 2019 110633 B WANG 2019 H LING 2018 91 95 Y GUAN 2019 110579 Y LIU 2019 771 Z WANG 2019 2967 2975 Z PROCEEDINGSCOMBUSTIONINSTITUTE HETEROGENEOUSREACTIONMECHANISMELEMENTALMERCURYOXIDATIONBYOXYGENSPECIESOVERMNO2CATALYST CUI 2019 365 374 S CHEN 2018 790 799 Y PRESTO 2006 5601 5609 A WANG 2016 5398 5404 Z WEN 2018 29 36 Z GAO 2015 160 Z GAO 2010 5876 5882 X LIU 2011 108 113 J GAO 2019 Z WANG 2019 257 264 H KAMATA 2009 947 951 H YANG 2019 990 1002 B GAO 2019 56 66 Z ZHAO 2015 3459 3472 L HOU 2014 9909 9914 W XU 2017 35 42 G WANG 2019 1806 1854 Y LIANG 2015 2559 2567 S DENG 2016 218 230 D PHALINYOT 2019 2135 2149 S VOROBYEVA 2017 16393 16403 E RAO 2019 25743 25748 Y GAO 2016 6292 6297 G HE 2017 619 627 F PAYNE 1992 1045 M FENG 2020 110705 Z ZHANG 2019 26371 26377 R GAO 2018 351 359 Z BECKE 2005 154104 A GRIMME 2010 154104 S LIU 2019 S LI 2017 4405 4410 P LIU 2019 1260 1267 Z GAO 2019 110547 Z GAO 2019 e5079 Z LI 2019 84 H HENKELMAN 2000 9978 9985 G HENKELMAN 2000 9901 9904 G HEYDEN 2005 224101 A YANG 2018 4159 4168 W YANG 2019 262 270 W RIPLINGER 2015 9311 9323 C HE 2012 8853 8860 P HE 2015 289 297 P GAO 2019 110126 Z KOREVAAR 2012 492 P LING 2017 5133 5139 C BRAVOPEREZ 2002 4645 4650 G LI 2018 735 744 H LI 2017 30069 30077 S MEDFORD 2015 36 42 A YANG 2020 145035 W CHEN 2018 7025 7034 C ZHANG 2017 141 150 S WEI 2019 170 177 Z GAO 2017 27963 27975 Y CHEN 2018 309 316 Y ZHANG 2015 471 485 J WANG 2013 3303 3307 C YW 2019 369 378 W GAO 2017 28 36 Z LIUX2020X110901 LIUX2020X110901XX 2022-04-11T00:00:00.000Z 2022-04-11T00:00:00.000Z http://creativecommons.org/licenses/by-nc-nd/4.0/ © 2020 Elsevier B.V. All rights reserved. 2020-03-25T02:50:29.877Z http://vtw.elsevier.com/data/voc/AddOnTypes/50.7/eoas Natural Science Foundation of Hebei Province http://data.elsevier.com/vocabulary/SciValFunders/501100003787 http://sws.geonames.org/1814991 NSFC National Natural Science Foundation of China http://data.elsevier.com/vocabulary/SciValFunders/501100001809 http://sws.geonames.org/1814991 Natural Science Foundation of Beijing Municipality http://data.elsevier.com/vocabulary/SciValFunders/501100004826 http://sws.geonames.org/1814991 Fundamental Research Funds for the Central Universities http://data.elsevier.com/vocabulary/SciValFunders/501100012226 http://sws.geonames.org/1814991 item S2468-8231(20)30155-3 S2468823120301553 1-s2.0-S2468823120301553 10.1016/j.mcat.2020.110901 315758 2020-06-13T00:07:37.576961Z 2020-06-01 2020-06-30 1-s2.0-S2468823120301553-main.pdf https://s3-eu-west-1.amazonaws.com/prod-ucs-content-store-eu-west/content/pii:S2468823120301553/MAIN/application/pdf/1f0c74a3a1ffb887d6c0253e4e93e292/main.pdf main.pdf pdf true 3199226 MAIN 11 1-s2.0-S2468823120301553-main_1.png https://s3-eu-west-1.amazonaws.com/prod-ucs-content-store-eu-west/content/pii:S2468823120301553/PREVIEW/image/png/61f9f83d629b600bec2d91d9459d7448/main_1.png main_1.png png 55954 849 656 IMAGE-WEB-PDF 1 1-s2.0-S2468823120301553-ga1.jpg https://s3-eu-west-1.amazonaws.com/prod-ucs-content-store-eu-west/content/pii:S2468823120301553/ga1/DOWNSAMPLED/image/jpeg/d1bf7289d6107395b3d4cf31124e42bd/ga1.jpg ga1 true ga1.jpg jpg 20269 200 322 IMAGE-DOWNSAMPLED 1-s2.0-S2468823120301553-ga1.sml https://s3-eu-west-1.amazonaws.com/prod-ucs-content-store-eu-west/content/pii:S2468823120301553/ga1/THUMBNAIL/image/gif/1263200e9c4cebb849a48da670a85303/ga1.sml ga1 true ga1.sml sml 20708 136 219 IMAGE-THUMBNAIL 1-s2.0-S2468823120301553-gr1.jpg https://s3-eu-west-1.amazonaws.com/prod-ucs-content-store-eu-west/content/pii:S2468823120301553/gr1/DOWNSAMPLED/image/jpeg/5c6b3f3201d0681cc068b413e02add1c/gr1.jpg gr1 gr1.jpg jpg 65295 470 566 IMAGE-DOWNSAMPLED 1-s2.0-S2468823120301553-gr1.sml https://s3-eu-west-1.amazonaws.com/prod-ucs-content-store-eu-west/content/pii:S2468823120301553/gr1/THUMBNAIL/image/gif/dfaed57f8e4764a5d55c218dd60a23a7/gr1.sml gr1 gr1.sml sml 10685 164 197 IMAGE-THUMBNAIL 1-s2.0-S2468823120301553-gr10.jpg https://s3-eu-west-1.amazonaws.com/prod-ucs-content-store-eu-west/content/pii:S2468823120301553/gr10/DOWNSAMPLED/image/jpeg/67e61328cb3ef6ff2d5830056f6d7e65/gr10.jpg gr10 gr10.jpg jpg 19409 274 340 IMAGE-DOWNSAMPLED 1-s2.0-S2468823120301553-gr10.sml https://s3-eu-west-1.amazonaws.com/prod-ucs-content-store-eu-west/content/pii:S2468823120301553/gr10/THUMBNAIL/image/gif/78da64234f97dc8b8f80e1de40b08924/gr10.sml gr10 gr10.sml sml 6686 164 204 IMAGE-THUMBNAIL 1-s2.0-S2468823120301553-gr11.jpg https://s3-eu-west-1.amazonaws.com/prod-ucs-content-store-eu-west/content/pii:S2468823120301553/gr11/DOWNSAMPLED/image/jpeg/9c5f5955124ee6fbcd90f864aa9f3155/gr11.jpg gr11 gr11.jpg jpg 25403 306 378 IMAGE-DOWNSAMPLED 1-s2.0-S2468823120301553-gr11.sml https://s3-eu-west-1.amazonaws.com/prod-ucs-content-store-eu-west/content/pii:S2468823120301553/gr11/THUMBNAIL/image/gif/af7a03cae11a38f7f4bcb1f0c2a2c9ef/gr11.sml gr11 gr11.sml sml 6790 164 202 IMAGE-THUMBNAIL 1-s2.0-S2468823120301553-gr12.jpg https://s3-eu-west-1.amazonaws.com/prod-ucs-content-store-eu-west/content/pii:S2468823120301553/gr12/DOWNSAMPLED/image/jpeg/87243f17f606d810bb6ae5bad28b18fc/gr12.jpg gr12 gr12.jpg jpg 23776 293 378 IMAGE-DOWNSAMPLED 1-s2.0-S2468823120301553-gr12.sml https://s3-eu-west-1.amazonaws.com/prod-ucs-content-store-eu-west/content/pii:S2468823120301553/gr12/THUMBNAIL/image/gif/bd951dfb158cd788d9331aa7c3e7b551/gr12.sml gr12 gr12.sml sml 6507 164 211 IMAGE-THUMBNAIL 1-s2.0-S2468823120301553-gr2.jpg https://s3-eu-west-1.amazonaws.com/prod-ucs-content-store-eu-west/content/pii:S2468823120301553/gr2/DOWNSAMPLED/image/jpeg/7c6e89215bb09ebd30a497769533f2e3/gr2.jpg gr2 gr2.jpg jpg 102814 662 566 IMAGE-DOWNSAMPLED 1-s2.0-S2468823120301553-gr2.sml https://s3-eu-west-1.amazonaws.com/prod-ucs-content-store-eu-west/content/pii:S2468823120301553/gr2/THUMBNAIL/image/gif/7fb591383ac28aa6745f51f1979e08c0/gr2.sml gr2 gr2.sml sml 10399 164 140 IMAGE-THUMBNAIL 1-s2.0-S2468823120301553-gr3.jpg https://s3-eu-west-1.amazonaws.com/prod-ucs-content-store-eu-west/content/pii:S2468823120301553/gr3/DOWNSAMPLED/image/jpeg/b41282b0554338aaa1bc3ef5f93b3cf0/gr3.jpg gr3 gr3.jpg jpg 48917 318 566 IMAGE-DOWNSAMPLED 1-s2.0-S2468823120301553-gr3.sml https://s3-eu-west-1.amazonaws.com/prod-ucs-content-store-eu-west/content/pii:S2468823120301553/gr3/THUMBNAIL/image/gif/62fa5f2902defef8f65977aa1d41d3f6/gr3.sml gr3 gr3.sml sml 9405 123 219 IMAGE-THUMBNAIL 1-s2.0-S2468823120301553-gr4.jpg https://s3-eu-west-1.amazonaws.com/prod-ucs-content-store-eu-west/content/pii:S2468823120301553/gr4/DOWNSAMPLED/image/jpeg/e78c6e1f1ee1f88f427265410ae73893/gr4.jpg gr4 gr4.jpg jpg 50014 334 566 IMAGE-DOWNSAMPLED 1-s2.0-S2468823120301553-gr4.sml https://s3-eu-west-1.amazonaws.com/prod-ucs-content-store-eu-west/content/pii:S2468823120301553/gr4/THUMBNAIL/image/gif/a4dc57a1b3eb2c99c37e8d85f389eb7b/gr4.sml gr4 gr4.sml sml 10047 129 219 IMAGE-THUMBNAIL 1-s2.0-S2468823120301553-gr5.jpg https://s3-eu-west-1.amazonaws.com/prod-ucs-content-store-eu-west/content/pii:S2468823120301553/gr5/DOWNSAMPLED/image/jpeg/b8567030827b6b5c16246138220650f5/gr5.jpg gr5 gr5.jpg jpg 50889 348 566 IMAGE-DOWNSAMPLED 1-s2.0-S2468823120301553-gr5.sml https://s3-eu-west-1.amazonaws.com/prod-ucs-content-store-eu-west/content/pii:S2468823120301553/gr5/THUMBNAIL/image/gif/bffeb8c225ec35109dddeabe4160b135/gr5.sml gr5 gr5.sml sml 11344 134 219 IMAGE-THUMBNAIL 1-s2.0-S2468823120301553-gr6.jpg https://s3-eu-west-1.amazonaws.com/prod-ucs-content-store-eu-west/content/pii:S2468823120301553/gr6/DOWNSAMPLED/image/jpeg/eea0d44d7be9614c359faf59f9a193e5/gr6.jpg gr6 gr6.jpg jpg 49489 318 566 IMAGE-DOWNSAMPLED 1-s2.0-S2468823120301553-gr6.sml https://s3-eu-west-1.amazonaws.com/prod-ucs-content-store-eu-west/content/pii:S2468823120301553/gr6/THUMBNAIL/image/gif/c47f56908989da019f8b12cd62300ac2/gr6.sml gr6 gr6.sml sml 9890 123 219 IMAGE-THUMBNAIL 1-s2.0-S2468823120301553-gr7.jpg https://s3-eu-west-1.amazonaws.com/prod-ucs-content-store-eu-west/content/pii:S2468823120301553/gr7/DOWNSAMPLED/image/jpeg/f7aa38d88ab94bff2accc4a7c70e5cd4/gr7.jpg gr7 gr7.jpg jpg 48831 319 566 IMAGE-DOWNSAMPLED 1-s2.0-S2468823120301553-gr7.sml https://s3-eu-west-1.amazonaws.com/prod-ucs-content-store-eu-west/content/pii:S2468823120301553/gr7/THUMBNAIL/image/gif/7f00f5df7d2802e88167e572fc280d95/gr7.sml gr7 gr7.sml sml 10507 123 219 IMAGE-THUMBNAIL 1-s2.0-S2468823120301553-gr8.jpg https://s3-eu-west-1.amazonaws.com/prod-ucs-content-store-eu-west/content/pii:S2468823120301553/gr8/DOWNSAMPLED/image/jpeg/a7e2d80abbca4694c397ec7de0abda35/gr8.jpg gr8 gr8.jpg jpg 49483 319 566 IMAGE-DOWNSAMPLED 1-s2.0-S2468823120301553-gr8.sml https://s3-eu-west-1.amazonaws.com/prod-ucs-content-store-eu-west/content/pii:S2468823120301553/gr8/THUMBNAIL/image/gif/16f238eb5d740f2303137fd3fcf197c1/gr8.sml gr8 gr8.sml sml 11208 123 219 IMAGE-THUMBNAIL 1-s2.0-S2468823120301553-gr9.jpg https://s3-eu-west-1.amazonaws.com/prod-ucs-content-store-eu-west/content/pii:S2468823120301553/gr9/DOWNSAMPLED/image/jpeg/8ecc4ae5679cec7043b88d4c06bf1fb2/gr9.jpg gr9 gr9.jpg jpg 59090 549 679 IMAGE-DOWNSAMPLED 1-s2.0-S2468823120301553-gr9.sml https://s3-eu-west-1.amazonaws.com/prod-ucs-content-store-eu-west/content/pii:S2468823120301553/gr9/THUMBNAIL/image/gif/d7776d56d3081b87a9d7b2acb7443e79/gr9.sml gr9 gr9.sml sml 9119 164 203 IMAGE-THUMBNAIL 1-s2.0-S2468823120301553-mmc1.docx https://s3-eu-west-1.amazonaws.com/prod-ucs-content-store-eu-west/content/pii:S2468823120301553/mmc1/MAIN/application/vnd.openxmlformats-officedocument.wordprocessingml.document/028ed584b9c166ba3534731228e0df68/mmc1.docx mmc1 mmc1.docx docx 2989567 APPLICATION 1-s2.0-S2468823120301553-si1.svg https://s3-eu-west-1.amazonaws.com/prod-ucs-content-store-eu-west/content/pii:S2468823120301553/STRIPIN/image/svg+xml/fbca8f637c2c135d9945b4885990228e/si1.svg si1 si1.svg svg 6261 ALTIMG 1-s2.0-S2468823120301553-si2.svg https://s3-eu-west-1.amazonaws.com/prod-ucs-content-store-eu-west/content/pii:S2468823120301553/STRIPIN/image/svg+xml/f375fa9bab1e8f97619b9d61bd3ed616/si2.svg si2 si2.svg svg 4096 ALTIMG 1-s2.0-S2468823120301553-si3.svg https://s3-eu-west-1.amazonaws.com/prod-ucs-content-store-eu-west/content/pii:S2468823120301553/STRIPIN/image/svg+xml/c5aec2c0ba51ba32372d0ef64d746e6a/si3.svg si3 si3.svg svg 5170 ALTIMG 1-s2.0-S2468823120301553-si4.svg https://s3-eu-west-1.amazonaws.com/prod-ucs-content-store-eu-west/content/pii:S2468823120301553/STRIPIN/image/svg+xml/2d5d6bdb36c72447f54c7a4cc67356a3/si4.svg si4 si4.svg svg 6150 ALTIMG 1-s2.0-S2468823120301553-si5.svg https://s3-eu-west-1.amazonaws.com/prod-ucs-content-store-eu-west/content/pii:S2468823120301553/STRIPIN/image/svg+xml/4dc7ee7f8c0b1f051d7dbc603f881eca/si5.svg si5 si5.svg svg 6052 ALTIMG 1-s2.0-S2468823120301553-si6.svg https://s3-eu-west-1.amazonaws.com/prod-ucs-content-store-eu-west/content/pii:S2468823120301553/STRIPIN/image/svg+xml/c15378f1fa2ea584f8af2f3326de7fbd/si6.svg si6 si6.svg svg 9140 ALTIMG 1-s2.0-S2468823120301553-si7.svg https://s3-eu-west-1.amazonaws.com/prod-ucs-content-store-eu-west/content/pii:S2468823120301553/STRIPIN/image/svg+xml/3bdf0d679565ba15957088514ff4773b/si7.svg si7 si7.svg svg 3771 ALTIMG 1-s2.0-S2468823120301553-am.pdf am am.pdf pdf 1307826 AAM-PDF https://s3-eu-west-1.amazonaws.com/prod-ucs-content-store-eu-west/content/egi:101LG7NTMZ8/MAIN/application/pdf/dbbb84fce3864cf26d8df37d647ccd25/am.pdf MCAT 110901 110901 S2468-8231(20)30155-3 10.1016/j.mcat.2020.110901 Elsevier B.V. Fig. 1 Structural characteristics of Pdsac/g-C3N4 (a) optimized structure of g-C3N4 support (b) optimized structure of Pdsac/g-C3N4 catalyst (c) electronic density difference (EDD) of catalyst, yellow area represents gaining electrons and cyan-blue area means losing electrons (d) projected density of states (PDOS) of catalyst. (For interpretation of the references to colour in this figure legend, the reader is referred to the web version of this article). Fig. 1 Fig. 2 Adsorption configurations of corresponding reaction gases on Pdsac/g-C3N4 catalyst. Fig. 2 Fig. 3 Top and side views of NO oxidation reaction configurations in E-R mechanism (Path1). Fig. 3 Fig. 4 Top and side views of NO oxidation reaction configurations in E-R mechanism (Path2). Fig. 4 Fig. 5 Top and side views of NO oxidation reaction configurations in L-H mechanism (Path3). Fig. 5 Fig. 6 Top and side views of NO oxidation reaction configurations in TER mechanism (Path4). Fig. 6 Fig. 7 Top and side views of NO oxidation reaction configurations by residual oxygen (Path5). Fig. 7 Fig. 8 Top and side views of Hg0 oxidation reaction configurations in E-R mechanism (Path6). Fig. 8 Fig. 9 Different desorption modes of oxides of mercury from FS6 in path6 (a)Directly desorption of HgO molecule from FS6 (b)Formation of Hg2O2 cluster and desorption of Hg2O from FS6 (c)Directly desorption of HgO2 molecule from FS6 (d)Formation and desorption of Hg2O2 cluster from FS6. Fig. 9 Fig. 10 Gibbs free energy variations of different reaction paths with different temperatures. Fig. 10 Fig. 11 Natural logarithm of equilibrium constants (K) with different temperatures. Fig. 11 Fig. 12 Natural logarithm of reaction rate constants (K TST) of oxidation reaction step with different temperatures. Fig. 12 Table 1 Key parameters of Pdsac/g-C3N4 catalyst, including the average bond length of Pd and N (d, Å), Charge transfer on Pd atom (q,e), and the binding energy of Pd atom on Pdsac/g-C3N4 catalyst (Eb ,eV). Table 1 Pd/g-C3N4 d Pd-N(Å) q Pd(e) Eb (eV) Calculated data 2.49 −0.43 −1.43 Literature data 2.49 [76] −0.50 [77] −1.42 [76] Table 2 Bader charge transfer (Δq,e) and adsorption energy (E ads, eV) of reaction gases in adsorption system. Table 2 Gas Δq Pd(e) Δq g-C3N4(e) Δq gas(e) E ads(eV) O −0.64 0.07 0.57 −3.06(−3.56 [50]) O2 −0.61 0.25 0.36(0.48 [48]) −0.78(−0.69 [48]) NO −0.65 0.47 0.18 −1.32 NO2 −0.61 0.18 0.43 −1.14 NO + O2 −0.59 0.02 0.57 −1.82 Hg0 −0.40 0.41 −0.01 −0.30 Hg0+O2 −0.69 0.07 0.62 −0.79 HgO −0.75 0.18 0.57 −1.99 Table 3 kinetic parameters for different reaction paths. Table 3 Paths E a/eV A Path1-NO oxidation 0.93 8.09 × 1011/s−1(mol/m3)−1 Path2-NO oxidation 1.52 1.73 × 1012/s−1 Path3-NO oxidation 0.95 2.15 × 1014/s−1 Path5-NO oxidation 0.46 2.39 × 1011/s−1 Path6-Hg0 oxidation 1.81 1.26 × 1014/s−1(mol/m3)−1 Simultaneous catalytic oxidation of nitric oxide and elemental mercury by single-atom Pd/g-C3N4 catalyst: A DFT study Xiaoshuo Liu Conceptualization Methodology Formal analysis Writing - original draft a b Zhengyang Gao Resources Supervision Project administration Funding acquisition a * Hanyu Huang Data curation Investigation a Ge Yan Visualization a Tianfang Huang Validation b Cong Chen Software b Weijie Yang Writing - review & editing Funding acquisition a Xun-Lei Ding Writing - review & editing Funding acquisition c * a School of Energy and Power Engineering, North China Electric Power University, Baoding, 071003, China School of Energy and Power Engineering North China Electric Power University Baoding 071003 China School of Energy and Power Engineering, North China Electric Power University, Baoding 071003, China b Key Laboratory of Energy Thermal Conversion and Control of Ministry of Education, School of Energy and Environment, Southeast University, Nanjing, 210096, China Key Laboratory of Energy Thermal Conversion and Control of Ministry of Education School of Energy and Environment Southeast University Nanjing 210096 China Key Laboratory of Energy Thermal Conversion and Control of Ministry of Education, School of Energy and Environment, Southeast University, Nanjing, 210096, China c School of Mathematics and Physics, North China Electric Power University, Beijing, 102206, China School of Mathematics and Physics North China Electric Power University Beijing 102206 China School of Mathematics and Physics, North China Electric Power University, Beijing 102206, China ⁎ Corresponding authors. Graphical abstract Simultaneous catalytic oxidation of NO and Hg0 by Pdsac/g-C3N4 catalyst. To realize simultaneous removal of pollutants released from coal-fired power plants, we carried out a theoretical study on catalytic oxidation of NO and Hg0 on the surface of single-atom Pd/g-C3N4 catalyst (Pdsac/g-C3N4), because after NO and Hg0 are converted to NO2 and Hg2+, products can be well absorbed in WFGD by using higher water solubility. Detailed reaction patterns in the mechanisms of Eley-Rideal (E-R), Langmuir-Hinshelwood (L-H), and termolecular Eley-Rideal (TER) were involved in this calculation. We revealed characteristics of catalytic reactions in thermodynamics and kinetics, and it was found most reactions were favorable in thermodynamics, and part reaction paths can take place spontaneously and irreversibly. Kinetics analysis evidenced the chemical reaction rates were all very fast because of short half-lives of reactants and large reaction rate constants. Fitted Arrhenius formula suggested the lowest activation energies of NO and Hg0 oxidation were just 0.46 eV and 1.81 eV, and therefore we speculated that Pdsac/g-C3N4 catalyst should be a potential catalyst for catalytic oxidation of NO and Hg0. Keywords Single-atom palladium catalyst Graphitic carbon nitride Hg0oxidation NO oxidation Thermodynamic and kinetic analysis 1 Introduction Nitrogen oxides (NOx), and mercury species (Hg) have been considered to be important compositions of air pollution, and drawn global concern due to their considerable contribution to depletion of ozone, formation of acid rain, occurrence of photochemical smog, and persistent damages to human’s health [1,2], therefore demonstrating huge urgency on their abatement. Coal-fired power plants are observed as one of the primary anthropogenic emission sources of these pollutions [3,4], and even with the equipment of air pollution control devices for coal-fired power plants, the total amounts of Hg, NOx, and SO2 released from power industry in China of 2017 year were still up to 468.87 ton [5], 1.14 million ton [6], and 1.20 million ton [6], respectively. To control pollution emission, coal-burning power stations tend to equip with complex air pollution control devices including selective catalytic reduction device via ammonia injection (SCR-NH3) to de-NOx [7–9], activated carbon injection method (ACI) to de-Hg° [10–12] and wet flue gas desulfurization (WFGD) device to de-SO2 [13,14]. Although these technologies have been widely utilized in coal-fired power plants, it remains many serious and ineligible disadvantages. In detail, for ACI method to de-Hg°, the main issue is the high cost of carbonaceous sorbents [15]; for SCR-NH3 equipment to de-NOx, disadvantages mainly include catalyst poisoning [16], poor catalytic rate at low temperature [17], and catalyst massive attrited consumption at high temperature [17]. More seriously, NH3 used in SCR-NH3 method is a kind of hazardous gas, and leakage of NH3 can not only hurt human’s vision, skins, and respiratory systems, but also can generate ammonium salt which may block the heat exchange tubes, bringing about security risks [3]. In addition, traditional SCR catalyst such as V2O5-MoO3/TiO2 and WO3/TiO2 are poisonous materials, and after several years of application, these catalysts would become chemical waste causing secondary pollution for environment [18,19]. Therefore, it is very valuable and imperative to explore new technology to control NOx and Hg° emission from coal-fired power plants. Simultaneous catalytic oxidation of NO and Hg° has been seen as a potential substitute for traditional ways [20–25], and as a kind of clean gas, oxygen [26,27] instead of toxic chlorine [28,29], hydrogen chloride [20], hydrogen bromide [30], and ozone [31,32], could be seen as a no-pollution oxidant for catalytic oxidation of NO and Hg°. After NO and Hg° molecules are converted to NO2 and HgO molecules by O2, the generated NO2 and HgO can be conveniently removed through wet flue gas desulfurization (WFGD) device owing to good water solubility of NO2 and Hg2+ [33]. Besides, catalytic oxidation of Hg° can also improve removal capacity of unburned char for mercury species due to increased adsorption energy, from −0.3 eV [34] (Hg°) to −3.21 eV [35] (HgO). However, it is extremely tough for elemental mercury (Hg°) and NO molecules to be oxidized to Hg2+ and NO2 in flue gas. It is widely known that the homogeneous oxidation efficiency of Hg° with O2 in flue gas tends to be low (nearly zero) [36], and even if parts of SCR catalysts such as MnOx-CeO2/TiO2 [37,38] have good performance on Hg° catalytic oxidation, SCR catalysts can barely achieve simultaneous removal of NOx without injection of hazardous NH3. In addition, NO molecules can hardly be oxidized in boilers as manifested by NO still takes up the main proportion of NOx in flue gas [39]. Therefore, to realize wide application of NO catalytic oxidation and Hg° catalytic oxidation technology in the future, the key issue is to design and prepare compelling catalyst with low chemical reaction energy barrier for catalysis. Noble metal catalysts were considered as primary choices for catalysis of small gases because of their compelling catalytic activity, and in particular Pd-contained catalysts were considered to be the one of the most attractive options for Hg° oxidation [40]. According to study of Hou et al. [41], the oxidation rate of elemental mercury by the surface of Pd-based catalyst can exceed 90 %, and in the light of report of Xu et al [42], graphene-supported Pd catalyst can also catalyze small gas such as CO molecule very well, with a relative low energy barrier of 0.29 eV, so it is natural for us to select Pd as the candidate for selection of catalyst in the usage of simultaneous oxidation of nitric oxide and elemental mercury. The high cost of Pd metal has been a obvious shortcoming in its commercial application, but single-atom catalysts (SACs) can sharply reduce the usage amount of noble metal in catalysis. With the advantages of high activity, selectivity and atomic utilization rate, SACs have become a hotspot in the fields of catalysis science and chemical engineering [43–46]. Vorobyeva et al. [47] prepared g-C3N4 by calcination of cyanamide at the temperature over 820 K, and then succeed in anchoring single-atom dispersed Pd atoms on the hexagonal cavity of g-C3N4 substance by post-synthetic microwave irradiation assisted deposition, with the metal loading radio of 0.5 wt.% relative to the carriers. Considering the material synthesis method was well developed to simplicity, and single-atom Pd/g-C3N4 catalyst has shown great capacity for series chemical reactions, such as CO oxidation [48], CO2 reduction [49] and O2 activation [50], it is natural for us speculate this catalyst may hold outstanding performance on catalytic oxidation of NO and elemental mercury molecules. In this work, we systematically studied the adsorption characteristics of reaction gas as well as chemical reaction paths in different reaction mechanisms, and performed comprehensive analysis using thermodynamics and reaction kinetics methods to talk about the feasibility of simultaneous catalytic oxidation of nitric oxide and elemental mercury on the surface of Pdsac/g-C3N4 catalyst in flue gas. As we know, it is first time to propose simultaneous removal of Hg0 and NO by multi-catalytic oxidation using SACs, and we hope our work can not only contribute to the further understanding of g-C3N4-based catalysts, but also provide important guidelines for pollution elimination from coal-fired power plants. 2 Computational methods All calculations in this work were carried out using density functional theory (DFT), and the combination of Perdew-Burke-Ernzerhof (PBE) functional and projector augmented wave (PAW) potentials was utilized in the software of Vienna ab initio simulation package (VASP 5.4.1) [51]. It has widely convinced that the method of PBE-PAW is a great way for calculating the interaction between small-size gas molecules and solid surface [52–54]. Taking into consideration of atomic magnetism, the impact of spin polarization was added [55], and considering the effect of weak interaction, van der Waals dispersion correction (Grimme-D3) was involved in our calculations [56]. In the light of researches of others, a 2 × 2 × 1 g-C3N4 supercell was created [49,57], and a 15 Å vacuum layer was set up to avoid the effect of mirror interaction [58]. The cutoff energy of 500 eV was determined for the plane-wave basis set by corresponding test, taking both calculation accuracy and time cost into account, and detailed test data can be acquired in Fig. S1. In accordance with previous reports [59–61], the value of Gaussian smearing is determined as 0.05 eV in metal-carbon-nitrogen atoms systems, and a 3 × 3 × 1 Γ-centered k-point mesh grid is used for the calculation of structure relaxation, which has been proved to be rational and accurate by our test in Fig. S2 and others’ previous study [62]. In detail, the threshold of structure relax was set at the level of 0.05 eV/Å, same as previous literature [62]. To get more accurate energy information, a 7 × 7 × 1 Γ-centered k-point mesh grid was adopted for electronic self-consistent field calculation, and the convergence precision was 1 × 10−5 eV. To located transition states in reaction paths, we adopted a method of joint application of climbing-image nudged elastic band (Cl-NEB) [63,64] and improved dimer (IDM) [65], same as our previous works [66,67]. Cl-NEB method was utilized to roughly locate the geometry structures of transition states, at a 1 × 1×1 Γ-centered k-point mesh grid level and with the force convergence of 0.1 eV/Å, and then based on the rough structure, IDM method was used to acquire accurate structure of transition states at the 3 × 3 × 1 Γ-centered k-point mesh grid level with the force convergence of 0.05 eV/Å. In addition, to check the structure of transition states and to get thermodynamic energy, vibrational frequency calculations were performed, with finite displacement of ±0.02 Å [68]. Adsorption energy (Eads ) was applied to describe the adsorption strength between catalyst surface and corresponding gases, and values of Eads can be calculated by Eq. (1) [69,70]. (1) E a d s = E s y s − E g a s − E c a t a Where Esys , Egas , and Ecata present the energy of total adsorption system, isolated free gases, and pure catalyst, respectively. In detail, if the value of Eads is negative, it means this adsorption process is spontaneous, and when the absolute value of Eads exceeds 0.5 eV, the adsorption would belong to stable chemical adsorption [71]. The oxidation energy barrier (Eoxi ) of each step in reaction paths can be obtained from Eq. (2) [39]. It is worth noting that total energy barrier (Ebar ) consists of oxidation energy barrier (Eoxi ) and desorption energy barrier of products from catalyst (Edsp ), thus Ebar should be the largest value between Eoxi and Edsp . (2) E o x i = E T S − E I S Where EIS and ETS mean the energy of adsorption initial states and transition states, respectively. Thermodynamics analysis was carried out to explore the reaction equilibrium constants (K), and it was can be calculated from the Eq. (3) [72]. (3) Δ G = G F S - G I S = − R T × L n K Where GFS and GIS are the Gibbs free energy of finial state and initial state of each reaction path, respectively. In addition, the Gibbs free energy of gas and solid catalyst can be obtained via the Eqs. (4) and (5), respectively [73]. (4) G g a s ( T ) = E e l e + Z P E + R T − T S (5) G s o l i d ( T ) = E e l e + Z P E − T S Where Eele is the electron energy of chemicals in ground-state; ZPE is the zero-point energy; R means the universal gas constant, 8.62 × 10−5 eV·mol−1·k−1; T is the Kelvin temperature; S is the entropy, and values of entropies were calculated by vibrational frequency analysis. Kinetic analysis was carried out based on conventional transition state theory depends on Eq. (6) [74], and the half-life of reactant (t 0.5) of unimolecular reaction was calculated by Eq. (7) [75]. (6) K T S T = K B T h × ( R T P 0 ) Δ n exp ( − Δ G b K B T ) (7) t 0.5 = ln 2 / ( K T S T ) Where KB is the Boltzmann constant, 8.61 × 10−5 eV·k-1；T is the Kelvin temperature, K; h is the Planck constant, 6.58 × 10−5 eV·s; ΔGb is the energy barriers based on Gibbs free energy, eV; Δn = 0 (unimolecular reaction) or 1 (bimolecular reaction); P 0 represents standard atmosphere pressure (atm), 0.1 MPa. 3 Results and discussions 3.1 The model of Pdsac/g-C3N4 catalyst The optimized structures of g-C3N4 support and single-atom palladium catalyst have been provided in the Fig. 1 , and some key parameters including average bond length between Pd and N (d, Å), charge transfer on Pd atom (q, e), and binding energy of Pd atom on single-atom catalyst (E b, eV) were summarized in Table 1 , noted that the calculated data in this work kept great consistence with others’ research, evidencing our calculation was credible. Stability is a key issue for SACs. He et al. [50] investigated different sites on g-C3N4 support, and they found hexagon cavity surrounded by graphitic nitrogen atoms should be the most suitable site to anchor Pd atoms because of the largest binding energy. Li et al. [76] further pointed out single-atom Pd had a high migration energy barrier in this structure. Therefore we constructed model as Fig. 1(b) to simulate Pdsac/g-C3N4 in this research. From Fig. 1(c) and Table 1, it was observed that the electrons were running off the metal atom catalyst, so there existed ionic bond effect between metal atom and carbon nitride substrate. In addition, from PDOS plot shown in Fig. 1(d), we discovered a obvious hybrid peak between 4d orbit of Pd atom and g-C3N4 carrier, demonstrating strong Pd-N covalent bond formed in catalyst structure. Accordingly, the Pd atom should be anchored stably in the hole of g-C3N4 sheet, and the large binding energy of single atom palladium on the surface of g-C3N4 might contribute to the combination effect of ionic bond and covalent bond. 3.2 Adsorption characteristic of reaction gases Adsorption is the origin step of chemical reactions. Moreover, adsorption analysis can offer important guidelines for searching initial and finial structures of reaction paths, so the adsorption characteristics of corresponding gases including a single oxygen atom, oxygen molecule, nitric oxide, nitrogen dioxide, co-adsorption of oxygen with nitric oxide, elemental mercury, and mercuric oxide on the surface of Pdsac/g-C3N4 catalyst were studied systematically. Herein, we constructed different adsorption configurations of gases, and selected the most stable adsorption constructions of individual gas molecule, as well as co-adsorption of different reaction gases as research objects as pictured in Fig. 2 , with less stable configurations accessible in Fig. S3. In addition, adsorption energy and the bader charge transfer (Δq,e) of substance, Pd atom and adsorbed gases were offered in Table 2 . Apparently, adsorbed gas is always being enriched in negative charge (except Hg°), and atomic charge on palladium atom arises from 0.43 e on pure g-C3N4 to 0.64 e (O), 0.61 e (O2), 0.65 e (NO), 0.61 e (NO2), 0.59 e (NO + O2), 0.40 e (Hg°, decreasing), 0.69 e (Hg°+O2), and 0.75 e (HgO), respectively. Considering the electronegativity order of involved elements in reaction system is O > N>C > Pd>Hg, it is reasonable for Pd atom always transferring electrons to g-C3N4 substance as shown in Table 2. Besides, it is because Hg element owns weaker electronegativity than Pd atom, charge transfer of Hg is negative value during adsorption process, which is opposite to other reaction gases. According to Sabatier principle [78], ideal catalysts should interact with atoms or molecules within a mild strength: interaction between reactants and catalyst should not too weak in order to adsorb the reaction gases, and it also should not too active that may block desorption of products. Oxygen adsorption is the key step of catalytic oxidation and from Table 2, it is found that adsorption energy of oxygen is -0.78 eV, demonstrating this adsorption belongs to chemical adsorption, therefore single-atom Pd catalyst might well has enough activity for catalytic oxidation reactions. In addition, the adsorption energies of NO2 and HgO are -1.14 eV and -1.99 eV, and these values are obvious lower than reported graphene-supported single-atom iron catalysts with corresponding data of 2.06 eV [66] and 2.34 eV [79], indicating the activity of Pdsac/g-C3N4 is within a reasonable interval. Therefore, it is natural and reasonable for us to speculate single-atom Pd catalyst anchoring in g-C3N4 carrier may hold potentials on catalytic oxidation of NO and Hg0. 3.3 Reaction paths of NO oxidation on Pdsac/g-C3N4 catalyst 3.3.1 E-R reaction mechanism of NO oxidation There are two different reaction paths through E-R mechanism in the light of different adsorption configurations of NO molecule attacking adsorbed-state oxygen molecule, and corresponding configurations in reaction steps have been shown in Fig. 3 and Fig. 4 . Herein, IS, TS, and FS represent initial state, transition state, and finial state respectively, and virtual frequency values of TS structures were marked in figures as well. For path1 of E-R mechanism labeled in Fig. 3, the NO molecule firstly adsorbed over the oxygen on the surface of catalyst, and then attacked O2 atom going through 0.77 eV energy barrier to form NO2 molecule. Given large amounts of literatures have reported that desorption of NO2 molecule owing high activity tend to be a huge obstacle for recycling of catalysis, it is necessary to take desorption process into consideration when we estimated difficulty of NO catalytic oxidation. In path1 of E-R mechanism, desorption barrier of NO2 from catalyst surface was 1.27 eV, notice that this value was calculated by subtracting the energy of NO2 and residual chemical on solid surface (as shown in Fig. 2 (a)) from energy of FS1. Obviously, in this path, the rate-determining step of NO catalytic oxidation is desorption process of product, rather than oxidation generation of NO2. Furthermore, we provided a vertical position for NO molecule to interact with adsorbed-state oxygen on catalyst, and the second reaction path was labeled in Fig. 4. Firstly, NO molecule adsorbed over adsorbed-state oxygen with 0.67 eV exothermic heat. Then, the effect of oxygen activation was obvious and played a pivotal role because the bond length of O1-O2 was intensely enlarged from 1.39 Å (IS2) to 1.94 Å (TS2), and then 3.87 Å (FS2) in reaction process. The whole reaction process includes only one transition state, and the oxidation and desorption energy barrier are 1.02 eV and 0.02 eV, respectively. Different from path1 we mentioned above, the rate-determining step of path2 is the oxidation reaction of NO molecule instead of NO2 desorption. In actual, the reason why NO2 molecule is hard to escape from catalyst in path1 may well contribute to the existence of an unpaired electron on nitrogen atom according to NO2 electronic structure, thus making NO2 molecule more active than some other gases such as CO2. However, in path2 after formation of adsorption configuration IS2, the oxidation mechanism of NO is the stretching process of O1-O2 bond, and the generated NO2 molecule would be move away from the active center of catalyst, causing weak desorption energy barrier of NO2 molecule, so these two reaction paths in E-R mechanism showed different rate-determining steps. Besides two reaction paths we talked above, it is possible that oxygen dissociates with a low activation energy, and then combines with NO in E-R mechanism, however, this reaction mechanism share the same finial state as FS1, demonstrating its rate-determination step is desorption of products. In the view of the whole catalysis reaction process, it is restricted by the same kinetic condition as path1, so we ignore this mechanism in this work. 3.3.2 L-H reaction mechanism of NO oxidation The reaction path of NO oxidation in L-H mechanism was studied and detailed reaction configurations have been shown in Fig. 5 . First of all, NO and O2 bonded on the surface of single-atom catalyst, and in the meanwhile 1.82 eV heat amount was released. The exothermic energy is far more than adsorption energy of oxygen molecule on Pdsac/g-C3N4, so in the view of stability of system, the co-adsorption of NO and O2 in the starting of L-H mechanism would be much more stable compared with single O2 adsorption in E-R mechanism. After co-adsorption of reactants on catalyst, the O2 atom not directly connected to metal atom gradually took leave from O1 atom, and after getting over the oxidation barrier, O2 atom linked with NO molecule to generate NO2 molecule. In path3, the oxidation energy barrier from IS3 to FS3 was 0.79 eV, indicating this reaction can happen with ease even at low temperature. In this stage, apparent oxygen activation took place as manifested by bond of lengths of O1-O2 increasing from 1.30 Å (IS3), 1.71 Å(TS3) to 3.32 Å (FS3), so oxygen activation can be seen as one of key indicators in NO oxidation. The desorption energy of NO2 from FS3 was 1.27 eV, so the chemical reaction rate of NO oxidation in L-H path was determined by desorption process of NO2, which was very similar to path1 in E-R mechanism. 3.3.3 TER reaction mechanism of NO oxidation In actual chemical reaction, it is likely that two NO molecules attack oxygen molecule at the same time, and therefore we systematically investigated NO catalytic oxidation by the surface of Pdsac/g-C3N4 through TER mechanism, and detailed reaction configurations were plotted in Fig. 6 . From IS4 in Fig. 6, we watched that oxygen molecule has been in activated-state, and two NO molecules were attacking oxygen atoms simultaneously above the adsorbed oxidant, and after overcoming a energy barrier of 0.69 eV, the configuration of IS4 was transformed to TS4, and then converted to FS4 where two NO2 were produced eventually. The oxidation energy barrier through TER mechanism is just 0.69 eV, and this is the lowest value among all reaction paths, indicating NO oxidation can take place with ease by the surface of Pdsac/C3N4. It is also implied that even though co-desorption energy barrier of generated two NO2 reach 1.57 eV, which is the largest desorption barrier among all provided paths, considering symmetry of FS in geometry, if the products escape from the surface of Pdsac/g-C3N4 catalyst step by step, the desorption barrier of a single NO2 molecule should be about 0.79 eV, therefore we speculated the desorption process in TER mechanism would not inhibit catalysis very seriously. 3.3.4 Residual oxygen atom reaction mechanism Besides TER mechanism, all NO oxidation reactions in E-R mechanism and L-H mechanism consist of two reaction stages. The first stage is NO molecule react with first oxygen atom of oxygen molecule, which has been comprehensively talked about in path1 to path3. The second reaction stage is the removal of residual oxygen atom bonded on the surface of catalyst, whose configuration can be seen in Fig. 2(a), and this stage determines the capacity of catalyst to work continuously. The removal of residual oxygen is directly related to feasibility of catalysis cycle, because if the energy barrier of removing this oxygen atom is too high, it would seriously hinder the following catalysis reaction. From Table 2, we found the desorption of one oxygen atom need to endothermic 3.06 eV, but the desorption of one NO2 adsorbed on catalyst just need to take in heat of 1.14 eV, therefore NO catalytic oxidation using residual one oxygen might promote the whole reaction process extremely. Herein, the catalytic oxidation of NO molecule by residual oxygen atom has been provided in Fig. 7 , and both energy barrier of NO oxidation and NO2 desorption were less than 1 eV, suggesting this reaction can take place easily. 3.4 Reaction paths of Hg0 oxidation on Pd/g-C3N4 catalyst To investigate the feasibility of NOx and Hg° simultaneous removal by single-atom Pd/g-C3N4 catalyst, we furthermore explored Hg° catalytic oxidation. Due to the considerable low volume fraction of mercury species (about 72 μg/L [80]) compared with oxygen (about 4%∼6% [81,82]) and NOx (about 400 ppm [81]) in flue gas, and in the light of the extremely inert of Hg° molecule, we assume it is relatively hard for elemental mercury to compete active sites or co-adsorbed on metal atom catalyst with oxygen molecule. Therefore, L-H and TER mechanism should not be the main reaction mechanism and herein we just talk about possible reaction paths in E-R mechanism. Reaction configurations of Hg° oxidation in E-R mechanism have been plotted in Fig. 8 , and after getting over a energy barrier of 2.09 eV, there exists a structure of O-Hg-O on the surface of catalyst. Even though the oxidation energy barrier of 2.09 eV is relative higher, this mainly results from the selection of weak oxidant (O2) and the natural inertia caused by full-occupied valence atomic orbit of Hg° as [Ar]5d 106s 2. In fact, compared with energy barrier on metal-modified carbonaceous materials (4.27 eV [6]) and V2O5/TiO2 catalyst(more than 5 eV [83]), Pdsac/g-C3N4 catalyst owns more outstanding performance on mercury oxidation in the view of catalytic reaction energy barrier. Chen et al. [84] studied Hg0 oxidation by HCl gas on the surface of α-Fe2O3, and found the energy barrier was 1.44 eV by DFT calculation, but they ignored the desorption process of generated HgCl2 molecule. In this work, the desorption of newly generated HgO molecule from catalyst surface is a endothermic process with 2.39 eV heat supplement, however in actual, it is just one possibility, because the structure of O-Hg-O is also likely to promote formations of Hg2O molecule [85], HgO2 molecule, and Hg2O2 cluster [86] in complex flue gas. The generation of HgO2 is the public stage for four products. In addition, the forming of Hg2O2 was considered as Hg0 adsorption process on FS6, and it was spontaneous, so main products should be determined by desorption barriers. In order to guarantee the comprehensivity of this work, the relative energy variations with different products were talked about and detailed energy changes have been provided in Fig. 9 . Given different products and desorption processes, we found the desorption barriers of possible products were 2.39 eV (HgO), 2.17 eV (Hg2O), 1.84 eV (HgO2), and 1.81 eV (Hg2O2), respectively. Though catalytic oxidation of Hg0 to different products can take place at the same time, their reaction speeds are varied largely. According to Arenius formula (kTST = Ae−Ea/RT), the formation of Hg2O2 cluster would exponentially faster than the generation of HgO due to the lowest desorption energy barrier among all possible desorption products. Therefore it will be the dominant mechanism and largely facilitate Hg0 oxidation. Moreover, if the elemental mercury molecules react with oxygen to yield Hg2O2, the issue of residual oxygen atom blocking catalysis cycling would be overcome as well. Thus, the formation of Hg2O2 cluster structure would promote the simultaneous removal of nitric oxide and mercury species pollutions using catalytic oxidation method. 3.5 Thermodynamics analysis We carried out thermodynamic analysis to explore the thermodynamic spontaneity of catalysis reaction. Gibbs free energy variations (ΔG) and the equilibrium constant (K) of different paths were calculated according to Eq. (3). As shown in Fig. 10 , most reaction paths of NO oxidation was spontaneous because of ΔG<0 but reaction pattern regarding to Hg° oxidation could be seen as non-spontaneous process due to ΔG＞0. In detail, the increasing of temperature would strengthen thermodynamics spontaneity in first step of NO oxidation in E-R and L-H mechanisms (path1-path3), but for mechanism of residual oxygen oxidizing NO (path5), the rise of temperature would have an inhibit effect in thermodynamics. From the variations of natural logarithm of equilibrium constants (K) with temperatures exhibited in Fig. 11 , we further proved the NO catalytic oxidation by the surface of Pdsac/g-C3N4 via path1, path4, and path5 was spontaneous, and this conclusion kept agreement with above analysis about ΔG. Moreover, when temperature was under 650 K, equilibrium constants was more than 105, evidencing the conversion rate of forward direction of NO oxidation will be far deeper than that of reverse direction and those reaction steps can take place completely and irreversibly. Besides, the values of ΔG<0 and K in path3 was smaller than 105, suggesting NO oxidation by L-H mechanism was spontaneous, but the chemical reaction depth was not very well, so the reactants can hardly be converted to NO2 completely. As for path2, it was observed that both path1 and path2 belonged to E-R reaction mechanism, but different from path1, path2 was a non-spontaneous reaction, however, considering the fact that IS1 was more stable than IS2 owing to higher adsorption energy, we can conclude the occurrence possibility of path1 was far more than that of path2 in E-R mechanism, so path2 would not the main NO catalytic oxidation path in E-R mechanism. In the light of the fact that ΔG>0 and LnK<0, Hg° oxidation on the surface of Pdsac/g-C3N4 was always non-spontaneous reaction. Some studied Hg° oxidation on the surface of RuO2/TiO2 [20] and V2O5/TiO2 catalysts [87] respectively, and they found FS structures in reaction paths tended to have higher relative energy than IS or other stable intermediates, indicating catalytic oxidation of Hg° always need continuous endothermic devotion, which kept great consistence with the conclusion in this work. 3.6 Kinetic analysis In flue gas, the possibility of trimolecular reactions is far less than that of unimolecular reactions and bimolecular reactions. In addition, the contents of Hg and NO is just about 0.72 μg/L and 400 ppm in flue gas, leading to it is very hard for two Hg or NO molecules attacking adsorbed-state oxygen at the same time, so the TER mechanism of catalytic oxidation was ignored in kinetic analysis. For IS1 in path1 as well as IS6 in path6, we can consider oxygen and catalyst as a whole due to stable chemical adsorption of oxygen on Pdsac/g-C3N4. Then we calculate the adsorption energy of NO molecule and Hg° over the adsorption system (O2+catalyst) is 0.41 eV and 0.02 eV, respectively, both not belonging to chemical adsorption. Moreover, from Fig. 3, we can also observe NO molecule do not bind on adsorbed oxygen strongly, further suggesting NO molecule interact with adsorbed oxygen weakly. Therefore the small interactions between NO and catalyst containing oxygen suggest IS1 and IS6 are unstable and reactants can hardly form stable intermediate complexes, and the reaction modes of path1 and path6 are bimolecular reactions. In contrast, for the IS2, IS3 and IS5, all reactants have been connected on Pdsac/C3N4 inseparable in geometry, and the adsorption energy of all reactants on Pdsac/C3N4 catalyst are up to -1.10 eV, -1.82 eV and -3.07 eV, so we consider path2, path3 and path6 should belong to unimolecular reactions. Natural logarithms of reaction rate constants (K TST) of oxidation reaction step have been plotted in Fig. 12 , and we observe high temperature can greatly promote the chemical reaction rate. To intuitively reveal chemical reaction speed, we further provided half-life of reactants (t 0.5) for unimolecular reaction in Table S2, and it has been found that the conversion of reactants is very spanking even at low temperature, for example the t 0.5 of NO oxidation by L-H mechanism (path3) is less than 0.007 hour at room temperature (298.15 K, 1 atm). Moreover, we find the t 0.5 of reactants in residual oxygen removal process (path5) is only 4.87 × 10−8 hour at low temperature (298.15 K, 1 atm), indicating Pdsac/g-C3N4 barely suffer from the issue of residual oxygen atom poisoning which seriously block catalytic activity of some other carbonaceous catalysts [66,88]. According to Arrhenius formula, we fit out the prefactor (A) and activation energy (E a) in Table 3 , and the result demonstrates that catalytic oxidation of NO and Hg° by the surface of Pdsac/g-C3N4 catalyst can take place easily, and the activation energy are 0.46 eV and 1.81 eV, respectively. The desorption barriers of NO2 are 0.02 eV∼1.57 eV in this work and these values are far less than that of single vacancy graphene-based single-atom iron catalyst (2.06 eV [66]) we reported previously. In the meanwhile, Hg2+ desorption would not a serious issue because compared activation energy of Hg0, the desorption energy of Hg2O2 (1.81 eV) is not very large. In the light of large oxidation rate by kinetic analysis and the relative desorption energy barriers of products, we confirmed that Pdsac/g-C3N4 can be a potential catalyst for oxidation removal of NO and Hg0. 4 Conclusions In this work, we systematically study the adsorption mechanism and catalytic oxidation patterns of NO and Hg° on the surface of g-C3N4-based single-atom palladium catalyst. The detailed reaction modes in L-H, E-R and TER mechanism are researched. In addition, corresponding thermodynamic and kinetic analysis have been carried out to obtain the temperature effect on the equilibrium constant and reaction rate. It is found that most of reaction paths are spontaneous, and for NO catalytic oxidation, almost all equilibrium constants exceed 105, suggesting reactions of NO oxidation are irreversible. Kinetic analysis reveals that half-life of reactants is very short, and the lowest activation energies of NO and Hg° oxidation are just 0.46 eV and 1.81 eV, respectively. Considering the advantages of outstanding activity, high utilization rate of metal atoms, and avoiding usage of toxic oxidant, we conclude that Pdsac/g-C3N4 catalyst can be a potential material for catalytic oxidation removal of NO and Hg°. CRediT authorship contribution statement Xiaoshuo Liu: Conceptualization, Methodology, Formal analysis, Writing - original draft. Zhengyang Gao: Resources, Supervision, Project administration, Funding acquisition. Hanyu Huang: Data curation, Investigation. Ge Yan: Visualization. Tianfang Huang: Validation. Cong Chen: Software. Weijie Yang: Writing - review & editing, Funding acquisition. Xun-Lei Ding: Writing - review & editing, Funding acquisition. Declaration of Competing Interest There are no conflicts to declare. Acknowledgement This work was supported by National Natural Science Foundation of China (No. 91545122), Beijing Natural Science Foundation (2182066), Natural Science Foundation of Hebei Province of China (B2018502067), and the Fundamental Research Funds for the Central Universities (JB2015RCY03 and 2017XS121). That all computational results depend on Tian-He2 super computer at Lvliang should be acknowledged. Appendix A Supplementary data Supplementary material related to this article can be found, in the online version, at doi:https://doi.org/10.1016/j.mcat.2020.110901. Appendix A Supplementary data The following is Supplementary data to this article: References [1] D. Liu D. Chen N. Li Q. Xu H. Li J. He Integration of 3D macroscopic graphene aerogel with 0D-2D AgVO3-g-C3N4 heterojunction for highly efficient photocatalytic oxidation of nitric oxide Appl. Catal. B 243 2019 576 584 Liu D, Chen D, Li N, Xu Q, Li H, He J, et al. Integration of 3D macroscopic graphene aerogel with 0D-2D AgVO3-g-C3N4 heterojunction for highly efficient photocatalytic oxidation of nitric oxide. Applied Catalysis B: Environmental 2019;243:576-84. [2] S. Zhao D. Pudasainee Y. Duan R. Gupta M. Liu J. Lu A review on mercury in coal combustion process: Content and occurrence forms in coal, transformation, sampling methods, emission and control technologies Prog. Energy Combust. Sci. 73 2019 26 64 Zhao S, Pudasainee D, Duan Y, Gupta R, Liu M, Lu J. A review on mercury in coal combustion process: Content and occurrence forms in coal, transformation, sampling methods, emission and control technologies. Progress in Energy and Combustion Science 2019;73:26-64. [3] C. Chen Y. Cao S. Liu J. Chen W. Jia The catalytic properties of Cu modified attapulgite in NH3–SCO and NH3–SCR reactions Appl. Surf. Sci. 480 2019 537 547 Chen C, Cao Y, Liu S, Chen J, Jia W. The catalytic properties of Cu modified attapulgite in NH3–SCO and NH3–SCR reactions. Applied Surface Science 2019;480:537-47. [4] H. Tang W. You Z. Wang C. Li C. Zhu L. Cai Detrimental effects of SO2 on gaseous mercury(II) adsorption and retention by CaO-based sorbent traps: competition and heterogeneous reduction J. Hazard. Mater. 387 2020 121679 Tang H, You W, Wang Z, Li C, Zhu C, Cai L, et al. Detrimental effects of SO2 on gaseous mercury(II) adsorption and retention by CaO-based sorbent traps: Competition and heterogeneous reduction. J Hazard Mater 2020;387:121679. [5] W. Yang Z. Gao X. Liu X. Ding W. Yan The adsorption characteristics of As2O3, Pb°, PbO and PbCl2 on single atom iron adsorbent with graphene-based substrates Chem. Eng. J. 361 2019 304 313 Yang W, Gao Z, Liu X, Ding X, Yan W. The adsorption characteristics of As2O3, Pb°, PbO and PbCl2 on single atom iron adsorbent with graphene-based substrates. Chemical Engineering Journal 2019;361:304-13. [6] X. Liu Z. Gao C. Wang M. Zhao X. Ding W. Yang Hg0 oxidation and SO3, Pb0, PbO, PbCl2 and As2O3 adsorption by graphene-based bimetallic catalyst ((Fe,Co)@N-GN): a DFT study Appl. Surf. Sci. 496 2019 Liu X, Gao Z, Wang C, Zhao M, Ding X, Yang W, et al. Hg0 oxidation and SO3, Pb0, PbO, PbCl2 and As2O3 adsorption by graphene-based bimetallic catalyst ((Fe,Co)@N-GN): A DFT study. Applied Surface Science 2019;496. [7] J. Liu X. Shi Y. Shan Z. Yan W. Shan Y. Yu Hydrothermal stability of CeO2–WO3–ZrO2 mixed oxides for selective catalytic reduction of NOx by NH3 Environ. Sci. Technol. 52 20 2018 11769 11777 Liu J, Shi X, Shan Y, Yan Z, Shan W, Yu Y, et al. Hydrothermal Stability of CeO2–WO3–ZrO2 Mixed Oxides for Selective Catalytic Reduction of NOx by NH3. Environmental science & technology 2018;52(20):11769-77. [8] C. Liu F. Li J. Wu X. Hou W. Huang Y. Zhang A comparative study of MOx (M = Mn, Co and Cu) modifications over CePO4 catalysts for selective catalytic reduction of NO with NH3 J. Hazard. Mater. 363 2019 439 446 Liu C, Li F, Wu J, Hou X, Huang W, Zhang Y, et al. A comparative study of MOx (M = Mn, Co and Cu) modifications over CePO4 catalysts for selective catalytic reduction of NO with NH3. J Hazard Mater 2019;363:439-46. [9] L. Zhao C. Li S. Li Y. Wang J. Zhang T. Wang Simultaneous removal of elemental mercury and NO in simulated flue gas over V2O5/ZrO2-CeO2 catalyst Appl. Catal. B 198 2016 420 430 Zhao L, Li C, Li S, Wang Y, Zhang J, Wang T, et al. Simultaneous removal of elemental mercury and NO in simulated flue gas over V2O5/ZrO2-CeO2 catalyst. Applied Catalysis B: Environmental 2016;198:420-30. [10] L. Zhong Y. Zhang Y. Ji P. Norris W.-P. Pan Calorimetry. Synthesis of activated carbon from coal pitch for mercury removal in coal-fired power plants J. Therm. Anal. 123 1 2016 851 860 Zhong L, Zhang Y, Ji Y, Norris P, Pan W-P, Calorimetry. Synthesis of activated carbon from coal pitch for mercury removal in coal-fired power plants. Journal of Thermal Analysis 2016;123(1):851-60. [11] F. Shen J. Liu Y. Dong D. Wu Mercury removal by biomass-derived porous carbon: experimental and theoretical insights into the effect of H2S Chem. Eng. J. 348 2018 409 415 Shen F, Liu J, Dong Y, Wu D. Mercury removal by biomass-derived porous carbon: Experimental and theoretical insights into the effect of H2S. Chemical Engineering Journal 2018;348:409-15. [12] W. Qu J. Liu F. Shen P. Wei Y. Lei Mechanism of mercury-iodine species binding on carbonaceous surface: insight from density functional theory study Chem. Eng. J. 306 2016 704 708 Qu W, Liu J, Shen F, Wei P, Lei Y. Mechanism of mercury-iodine species binding on carbonaceous surface: Insight from density functional theory study. Chemical Engineering Journal 2016;306:704-8. [13] S. Cui Z. Zhong Y. Liao L. Qi D. Fu Simultaneous removal of NO and SO2 via an integrated system of nonthermal plasma combined with catalytic oxidation and wet electrostatic precipitator Energy Fuels 33 10 2019 10078 10089 Cui S, Zhong Z, Liao Y, Qi L, Fu D. Simultaneous Removal of NO and SO2 via an Integrated System of Nonthermal Plasma Combined with Catalytic Oxidation and Wet Electrostatic Precipitator. Energy & Fuels 2019;33(10):10078-89. [14] Y. Liu Y. Wang Q. Wang J. Pan J. Zhang Simultaneous removal of NO and SO2 using vacuum ultraviolet light (VUV)/heat/peroxymonosulfate (PMS) Chemosphere 190 2018 431 441 Liu Y, Wang Y, Wang Q, Pan J, Zhang J. Simultaneous removal of NO and SO2 using vacuum ultraviolet light (VUV)/heat/peroxymonosulfate (PMS). Chemosphere 2018;190:431-41. [15] X.-L. Duan C.-G. Yuan T.-T. Jing X.-D. Yuan Removal of elemental mercury using large surface area micro-porous corn cob activated carbon by zinc chloride activation Fuel 239 2019 830 840 Duan X-L, Yuan C-G, Jing T-T, Yuan X-D. Removal of elemental mercury using large surface area micro-porous corn cob activated carbon by zinc chloride activation. Fuel 2019;239:830-40. [16] M.S. Maqbool A.K. Pullur H.P. Ha Novel sulfation effect on low-temperature activity enhancement of CeO2-added Sb-V2O5/TiO2 catalyst for NH3-SCR Appl. Catal. B 152 2014 28 37 Maqbool MS, Pullur AK, Ha HP. Novel sulfation effect on low-temperature activity enhancement of CeO2-added Sb-V2O5/TiO2 catalyst for NH3-SCR. Applied Catalysis B: Environmental 2014;152:28-37. [17] Z. Hong Z. Wang X. Li Catalytic oxidation of nitric oxide (NO) over different catalysts: an overview Catal. Sci. Technol. 7 16 2017 3440 3452 Hong Z, Wang Z, Li X. Catalytic oxidation of nitric oxide (NO) over different catalysts: an overview. Catalysis Science & Technology 2017;7(16):3440-52. [18] Yu Y-k C. He Chen J-s X.-r. Meng Deactivation mechanism of de-NOx catalyst (V2O5-WO3/TiO2) used in coal fired power plant J. Fuel Chem. Technol. 40 11 2012 1359 1365 Yu Y-k, He C, Chen J-s, Meng X-r. Deactivation mechanism of de-NOx catalyst (V2O5-WO3/TiO2) used in coal fired power plant. Journal of Fuel Chemistry and Technology 2012;40(11):1359-65. [19] C. Liu L. Chen J. Li L. Ma H. Arandiyan Y. Du Enhancement of activity and sulfur resistance of CeO2 supported on TiO2–SiO2 for the selective catalytic reduction of NO by NH3 Environ. Sci. Technol. 46 11 2012 6182 6189 Liu C, Chen L, Li J, Ma L, Arandiyan H, Du Y, et al. Enhancement of activity and sulfur resistance of CeO2 supported on TiO2–SiO2 for the selective catalytic reduction of NO by NH3. Environmental science & technology 2012;46(11):6182-9. [20] Y. Yang J. Liu Z. Wang S. Miao J. Ding Y. Yu A complete catalytic reaction scheme for Hg(0) oxidation by HCl over RuO2/TiO2 catalyst J. Hazard. Mater. 373 2019 660 670 Yang Y, Liu J, Wang Z, Miao S, Ding J, Yu Y, et al. A complete catalytic reaction scheme for Hg(0) oxidation by HCl over RuO2/TiO2 catalyst. J Hazard Mater 2019;373:660-70. [21] B. Yang A. Peng X. Wang Q. Huang M. Chen Y. Shen Simultaneous catalytic oxidation of CO and Hg° over Au/TiO2 catalysts: structure and mechanism study Mol. Catal. 479 2019 110633 Yang B, Peng A, Wang X, Huang Q, Chen M, Shen Y, et al. Simultaneous catalytic oxidation of CO and Hg° over Au/TiO2 catalysts: Structure and mechanism study. Molecular Catalysis 2019;479:110633. [22] H. Wang B. Yuan R. Hao Y. Zhao X. Wang A critical review on the method of simultaneous removal of multi-air-pollutant in flue gas Chem. Eng. J. 378 2019 Wang H, Yuan B, Hao R, Zhao Y, Wang X. A critical review on the method of simultaneous removal of multi-air-pollutant in flue gas. Chemical Engineering Journal 2019;378. [23] Y. Ling C. Zhang J. Wu W. Xu Y. Qi P. He Enhanced photocatalytic activity of TiO2 by micrometer-scale flower-like morphology for gaseous elemental mercury removal Catal. Commun. 116 2018 91 95 Ling Y, Zhang C, Wu J, Xu W, Qi Y, He P, et al. Enhanced photocatalytic activity of TiO2 by micrometer-scale flower-like morphology for gaseous elemental mercury removal. Catalysis Communications 2018;116:91-5. [24] Y. Guan J. Wu Q. Liu M. Gu Y. Lin Y. Qi Fabrication of BiOI/MoS2 heterojunction photocatalyst with different treatment methods for enhancing photocatalytic performance under visible-light Mater. Res. Bull. 120 2019 110579 Guan Y, Wu J, Liu Q, Gu M, Lin Y, Qi Y, et al. Fabrication of BiOI/MoS2 heterojunction photocatalyst with different treatment methods for enhancing photocatalytic performance under visible-light. Materials Research Bulletin 2019;120:110579. [25] Z. Liu F. Yu C. Ma J. Dan J. Luo B. Dai A critical review of recent progress and perspective in practical denitration application Catalysts 9 9 2019 771 Liu Z, Yu F, Ma C, Dan J, Luo J, Dai B. A critical review of recent progress and perspective in practical denitration application. Catalysts 2019;9(9):771. [26] Z. Wang J. Liu Y. Yang F. Liu J. Ding Heterogeneous reaction mechanism of elemental mercury oxidation by oxygen species over MnO2 catalyst Proceedings of the Combustion Institute 37 2019 2967 2975 3 Wang Z, Liu J, Yang Y, Liu F, Ding J. Heterogeneous reaction mechanism of elemental mercury oxidation by oxygen species over MnO2 catalyst. Proceedings of the Combustion Institute 2019;37(3):2967-75. [27] S. Cui R. Hao D. Fu Integrated method of non-thermal plasma combined with catalytical oxidation for simultaneous removal of SO2 and NO Fuel 246 2019 365 374 Cui S, Hao R, Fu D. Integrated method of non-thermal plasma combined with catalytical oxidation for simultaneous removal of SO2 and NO. Fuel 2019;246:365-74. [28] Y. Chen X. Guo F. Wu Y. Huang Z. Yin Experimental and theoretical studies for the mechanism of mercury oxidation over chlorine and cupric impregnated activated carbon Appl. Surf. Sci. 458 2018 790 799 Chen Y, Guo X, Wu F, Huang Y, Yin Z. Experimental and theoretical studies for the mechanism of mercury oxidation over chlorine and cupric impregnated activated carbon. Applied Surface Science 2018;458:790-9. [29] A.A. Presto E.J. Granite Survey of catalysts for oxidation of mercury in flue gas Environ. Sci. Technol. 40 18 2006 5601 5609 Presto AA, Granite EJ. Survey of catalysts for oxidation of mercury in flue gas. Environmental science technology 2006;40(18):5601-9. [30] Z. Wang J. Liu B. Zhang Y. Yang Z. Zhang S. Miao Mechanism of heterogeneous mercury oxidation by HBr over V2O5/TiO2 catalyst Environ. Sci. Technol. 50 10 2016 5398 5404 Wang Z, Liu J, Zhang B, Yang Y, Zhang Z, Miao S. Mechanism of Heterogeneous Mercury Oxidation by HBr over V2O5/TiO2 Catalyst. Environ Sci Technol 2016;50(10):5398-404. [31] Z. Wen Z. Wang Y. Li K. Cen Mechanism and kinetic study on elemental mercury oxidation in flue gas by ozone injection Ozone Sci. Eng. 40 1 2018 29 36 Wen Z, Wang Z, Li Y, Cen K. Mechanism and Kinetic Study on Elemental Mercury Oxidation in Flue Gas by Ozone Injection. Ozone: Science Engineering 2018;40(1):29-36. [32] Z. Gao S. Lv W. Yang P. Yang S. Ji X. Meng Quantum chemistry investigation on the reaction mechanism of the elemental mercury, chlorine, bromine and ozone system J. Mol. Model. 21 6 2015 160 Gao Z, Lv S, Yang W, Yang P, Ji S, Meng X. Quantum chemistry investigation on the reaction mechanism of the elemental mercury, chlorine, bromine and ozone system. J Mol Model 2015;21(6):160. [33] X. Gao Z. Du Ding H-l Wu Z-l H. Lu Luo Z-y Kinetics of NOx absorption into (NH4)2SO3 solution in an ammonia-based wet flue gas desulfurization process Energy Fuels 24 11 2010 5876 5882 Gao X, Du Z, Ding H-l, Wu Z-l, Lu H, Luo Z-y, et al. Kinetics of NOx Absorption into (NH4)2SO3 Solution in an Ammonia-Based Wet Flue Gas Desulfurization Process. Energy & Fuels 2010;24(11):5876-82. [34] J. Liu M.A. Cheney F. Wu M. Li Effects of chemical functional groups on elemental mercury adsorption on carbonaceous surfaces J. Hazard. Mater. 186 1 2011 108 113 Liu J, Cheney MA, Wu F, Li M. Effects of chemical functional groups on elemental mercury adsorption on carbonaceous surfaces. J Hazard Mater 2011;186(1):108-13. [35] Z. Gao X. Liu A. Li C. Ma X. Li X. Ding Adsorption behavior of mercuric oxide clusters on activated carbon and the effect of SO2 on this adsorption: a theoretical investigation J. Mol. Model. 25 5 2019 Gao Z, Liu X, Li A, Ma C, Li X, Ding X, et al. Adsorption behavior of mercuric oxide clusters on activated carbon and the effect of SO2 on this adsorption: a theoretical investigation. Journal of Molecular Modeling 2019;25(5). [36] H. Wang S. Wang Y. Duan Li Y-n Z. Ying Experimental study of homogeneous Hg oxidation in air and oxy-simulated flue gas J. Energy Inst. 92 2 2019 257 264 Wang H, Wang S, Duan Y, Li Y-n, Ying Z. Experimental study of homogeneous Hg oxidation in air and oxy-simulated flue gas. Journal of the Energy Institute 2019;92(2):257-64. [37] H. Kamata Ueno S-i N. Sato T. Naito Mercury oxidation by hydrochloric acid over TiO2 supported metal oxide catalysts in coal combustion flue gas Fuel Process. Technol. 90 7–8 2009 947 951 Kamata H, Ueno S-i, Sato N, Naito T. Mercury oxidation by hydrochloric acid over TiO2 supported metal oxide catalysts in coal combustion flue gas. Fuel Processing Technology 2009;90(7-8):947-51. [38] B. Yang Z. Li Q. Huang M. Chen L. Xu Y. Shen Synergetic removal of elemental mercury and NO over TiCe0.25Sn0.25Ox catalysts from flue gas: performance and mechanism study Chem. Eng. J. 360 2019 990 1002 Yang B, Li Z, Huang Q, Chen M, Xu L, Shen Y, et al. Synergetic removal of elemental mercury and NO over TiCe0.25Sn0.25Ox catalysts from flue gas: Performance and mechanism study. Chemical Engineering Journal 2019;360:990-1002. [39] Z. Gao X. Liu A. Li X. Li X. Ding W. Yang Bimetallic sites supported on N-doped graphene ((Fe, Co)/N-GN) as a new catalyst for NO oxidation: a theoretical investigation Mol. Catal. 470 2019 56 66 Gao Z, Liu X, Li A, Li X, Ding X, Yang W. Bimetallic sites supported on N-doped graphene ((Fe, Co)/N-GN) as a new catalyst for NO oxidation: A theoretical investigation. Molecular Catalysis 2019;470:56-66. [40] L. Zhao C. Li X. Zhang G. Zeng J. Zhang Y. Xie A review on oxidation of elemental mercury from coal-fired flue gas with selective catalytic reduction catalysts Catal. Sci. Technol. 5 7 2015 3459 3472 Zhao L, Li C, Zhang X, Zeng G, Zhang J, Xie Y. A review on oxidation of elemental mercury from coal-fired flue gas with selective catalytic reduction catalysts. Catalysis Science & Technology 2015;5(7):3459-72. [41] W. Hou J. Zhou C. Yu S. You X. Gao Z. Luo Pd/Al2O3 sorbents for elemental mercury capture at high temperatures in syngas Ind. Eng. Chem. Res. 53 23 2014 9909 9914 Hou W, Zhou J, Yu C, You S, Gao X, Luo Z, et al. Pd/Al2O3 sorbents for elemental mercury capture at high temperatures in syngas. Industrial Engineering Chemistry Research 2014;53(23):9909-14. [42] G. Xu R. Wang F. Yang D. Ma Z. Yang Z. Lu CO oxidation on single Pd atom embedded defect-graphene via a new termolecular Eley-Rideal mechanism Carbon 118 2017 35 42 Xu G, Wang R, Yang F, Ma D, Yang Z, Lu Z. CO oxidation on single Pd atom embedded defect-graphene via a new termolecular Eley-Rideal mechanism. Carbon 2017;118:35-42. [43] Y. Wang J. Mao X. Meng L. Yu D. Deng X. Bao Catalysis with two-dimensional materials confining single atoms: concept, design, and applications Chem. Rev. 119 3 2019 1806 1854 Wang Y, Mao J, Meng X, Yu L, Deng D, Bao X. Catalysis with Two-Dimensional Materials Confining Single Atoms: Concept, Design, and Applications. Chem Rev 2019;119(3):1806-54. [44] S. Liang C. Hao Y. Shi The power of single-atom catalysis ChemCatChem 7 17 2015 2559 2567 Liang S, Hao C, Shi Y. The Power of Single-Atom Catalysis. ChemCatChem 2015;7(17):2559-67. [45] D. Deng K.S. Novoselov Q. Fu N. Zheng Z. Tian X. Bao Catalysis with two-dimensional materials and their heterostructures Nat. Nanotechnol. 11 3 2016 218 230 Deng D, Novoselov KS, Fu Q, Zheng N, Tian Z, Bao X. Catalysis with two-dimensional materials and their heterostructures. Nat Nanotechnol 2016;11(3):218-30. [46] S. Phalinyot C. Tabtimsai B. Wanno Nitrogen monoxide storage and sensing applications of transition metal–doped boron nitride nanotubes: a DFT investigation Struct. Chem. 30 6 2019 2135 2149 Phalinyot S, Tabtimsai C, Wanno B. Nitrogen monoxide storage and sensing applications of transition metal–doped boron nitride nanotubes: a DFT investigation. Structural Chemistry 2019;30(6):2135–49. [47] E. Vorobyeva Z. Chen S. Mitchell R.K. Leary P. Midgley J.M. Thomas Tailoring the framework composition of carbon nitride to improve the catalytic efficiency of the stabilised palladium atoms J. Mater. Chem. A 5 31 2017 16393 16403 Vorobyeva E, Chen Z, Mitchell S, Leary RK, Midgley P, Thomas JM, et al. Tailoring the framework composition of carbon nitride to improve the catalytic efficiency of the stabilised palladium atoms. Journal of Materials Chemistry A 2017;5(31):16393-403. [48] Y. Rao X. Duan Pd/Pt embedded CN monolayers as efficient catalysts for CO oxidation J. Chem. Soc. Faraday Trans. 21 46 2019 25743 25748 Rao Y, Duan X. Pd/Pt embedded CN monolayers as efficient catalysts for CO oxidation. Physical Chemistry Chemical Physics 2019;21(46):25743-8. [49] G. Gao Y. Jiao E.R. Waclawik A. Du Single atom (Pd/Pt) supported on graphitic carbon nitride as an efficient photocatalyst for visible-light reduction of carbon dioxide J. Am. Chem. Soc. 138 19 2016 6292 6297 Gao G, Jiao Y, Waclawik ER, Du A. Single Atom (Pd/Pt) Supported on Graphitic Carbon Nitride as an Efficient Photocatalyst for Visible-Light Reduction of Carbon Dioxide. J Am Chem Soc 2016;138(19):6292-7. [50] F. He K. Li C. Yin Y. Wang H. Tang Z. Wu Single Pd atoms supported by graphitic carbon nitride, a potential oxygen reduction reaction catalyst from theoretical perspective Carbon 114 2017 619 627 He F, Li K, Yin C, Wang Y, Tang H, Wu Z. Single Pd atoms supported by graphitic carbon nitride, a potential oxygen reduction reaction catalyst from theoretical perspective. Carbon 2017;114:619-27. [51] M.C. Payne M.P. Teter D.C. Allan T. Arias a J. Joannopoulos Iterative minimization techniques for ab initio total-energy calculations: molecular dynamics and conjugate gradients Rev. Mod. Phys. 64 4 1992 1045 Payne MC, Teter MP, Allan DC, Arias T, Joannopoulos aJ. Iterative minimization techniques for ab initio total-energy calculations: molecular dynamics and conjugate gradients. Reviews of modern physics 1992;64(4):1045. [52] Z. Feng Y. Tang W. Chen D. Wei Y. Ma X. Dai O-doped graphdiyne as metal-free catalysts for nitrogen reduction reaction Mol. Catal. 483 2020 110705 Feng Z, Tang Y, Chen W, Wei D, Ma Y, Dai X. O-doped graphdiyne as metal-free catalysts for nitrogen reduction reaction. Molecular Catalysis 2020;483: 110705. [53] R. Zhang L. Jiao W. Yang G. Wan H.-L. Jiang Single-atom catalysts templated by metal–organic frameworks for electrochemical nitrogen reduction J. Mater. Chem. A 46 7 2019 26371 26377 Zhang R, Jiao L, Yang W, Wan G, Jiang H-L. Single-atom catalysts templated by metal–organic frameworks for electrochemical nitrogen reduction. Journal of Materials Chemistry A 2019;46(7):26371-7 [54] Z. Gao Y. Sun M. Li W. Yang X. Ding Adsorption sensitivity of Fe decorated different graphene supports toward toxic gas molecules (CO and NO) Appl. Surf. Sci. 456 2018 351 359 Gao Z, Sun Y, Li M, Yang W, Ding X. Adsorption sensitivity of Fe decorated different graphene supports toward toxic gas molecules (CO and NO). Applied Surface Science 2018;456:351-9. [55] A.D. Becke E.R. Johnson Exchange-hole dipole moment and the dispersion interaction J. Chem. Phys. 122 15 2005 154104 Becke AD, Johnson ER. Exchange-hole dipole moment and the dispersion interaction. The Journal of chemical physics 2005;122(15):154104. [56] S. Grimme J. Antony S. Ehrlich H. Krieg A consistent and accurate ab initio parametrization of density functional dispersion correction (DFT-D) for the 94 elements H-Pu J. Chem. Phys. 132 15 2010 154104 Grimme S, Antony J, Ehrlich S, Krieg H. A consistent and accurate ab initio parametrization of density functional dispersion correction (DFT-D) for the 94 elements H-Pu. The Journal of chemical physics 2010;132(15):154104. [57] S. Liu L. Chen X. Mu M. Xu J. Yu G. Yang Development of Pdn/g-C3N4 adsorbent for Hg° removal – DFT study of influences of the support and Pd cluster size Fuel 254 2019 Liu S, Chen L, Mu X, Xu M, Yu J, Yang G, et al. Development of Pdn/g-C3N4 adsorbent for Hg° removal – DFT study of influences of the support and Pd cluster size. Fuel 2019;254. [58] P. Li F. Wang S. Wei X. Li Y. Zhou Mechanistic insights into CO2 reduction on Cu/Mo-loaded two-dimensional g-C3N4(001) Phys. Chem. Chem. Phys. 19 6 2017 4405 4410 Li P, Wang F, Wei S, Li X, Zhou Y. Mechanistic insights into CO2 reduction on Cu/Mo-loaded two-dimensional g-C3N4(001). Phys Chem Chem Phys 2017;19(6):4405-10. [59] Z. Liu D. Zhang T. Wei L. Wang X. Li B. Liu Adsorption characteristics of formaldehyde on nitrogen doped graphene-based single atom adsorbents: a DFT study Appl. Surf. Sci. 493 2019 1260 1267 Liu Z, Zhang D, Wei T, Wang L, Li X, Liu B. Adsorption characteristics of formaldehyde on nitrogen doped graphene-based single atom adsorbents: A DFT study. Applied Surface Science 2019;493:1260-7. [60] Z. Gao A. Li X. Li X. Liu C. Ma J. Yang The adsorption and activation of oxygen molecule on nickel clusters doped graphene-based support by DFT Mol. Catal. 477 2019 110547 Gao Z, Li A, Li X, Liu X, Ma C, Yang J, et al. The adsorption and activation of oxygen molecule on nickel clusters doped graphene-based support by DFT. Molecular Catalysis 2019;477: 110547. [61] Z. Gao X. Li A. Li C. Ma X. Liu J. Yang Adsorption behavior of Pt embedded on N‐doped graphene sheets toward NO and NH3 molecules Appl. Organomet. Chem. 33 9 2019 e5079 Gao Z, Li X, Li A, Ma C, Liu X, Yang J, et al. Adsorption behavior of Pt embedded on N‐doped graphene sheets toward NO and NH3 molecules. Applied Organometallic Chemistry 2019;33(9) : e5079. [62] H. Li Z. Zhang Z. Liu Non-monotonic trends of hydrogen adsorption on single atom doped g-C3N4 Catalysts 9 1 2019 84 Li H, Zhang Z, Liu Z. Non-Monotonic Trends of Hydrogen Adsorption on Single Atom Doped g-C3N4. Catalysts 2019;9(1):84. [63] G. Henkelman H. Jónsson Improved tangent estimate in the nudged elastic band method for finding minimum energy paths and saddle points J. Chem. Phys. 113 22 2000 9978 9985 Henkelman G, Jónsson H. Improved tangent estimate in the nudged elastic band method for finding minimum energy paths and saddle points. The Journal of chemical physics 2000;113(22):9978-85. [64] G. Henkelman B.P. Uberuaga H. Jónsson A climbing image nudged elastic band method for finding saddle points and minimum energy paths J. Chem. Phys. 113 22 2000 9901 9904 Henkelman G, Uberuaga BP, Jónsson H. A climbing image nudged elastic band method for finding saddle points and minimum energy paths. The Journal of chemical physics 2000;113(22):9901-4. [65] A. Heyden A.T. Bell F.J. Keil Efficient methods for finding transition states in chemical reactions: comparison of improved dimer method and partitioned rational function optimization method J. Chem. Phys. 123 22 2005 224101 Heyden A, Bell AT, Keil FJ. Efficient methods for finding transition states in chemical reactions: Comparison of improved dimer method and partitioned rational function optimization method. The Journal of chemical physics 2005;123(22):224101. [66] W. Yang Z. Gao X. Liu X. Li X. Ding W. Yan Single-atom iron catalyst with single-vacancy graphene-based substrate as a novel catalyst for NO oxidation: a theoretical study Catal. Sci. Technol. 8 16 2018 4159 4168 Yang W, Gao Z, Liu X, Li X, Ding X, Yan W. Single-atom iron catalyst with single-vacancy graphene-based substrate as a novel catalyst for NO oxidation: a theoretical study. Catalysis Science & Technology 2018;8(16):4159-68. [67] W. Yang Z. Gao X. Liu C. Ma X. Ding W. Yan Directly catalytic reduction of NO without NH3 by single atom iron catalyst: a DFT calculation Fuel 243 2019 262 270 Yang W, Gao Z, Liu X, Ma C, Ding X, Yan W. Directly catalytic reduction of NO without NH3 by single atom iron catalyst: A DFT calculation. Fuel 2019;243:262-70. [68] C. Riplinger E.A. Carter Cooperative effects in water binding to cuprous oxide surfaces J. Phys. Chem. C 119 17 2015 9311 9323 Riplinger C, Carter EA. Cooperative effects in water binding to cuprous oxide surfaces. The Journal of Physical Chemistry C 2015;119(17):9311-23. [69] P. He J. Wu X. Jiang W. Pan J. Ren Effect of SO3 on elemental mercury adsorption on a carbonaceous surface Appl. Surf. Sci. 258 22 2012 8853 8860 He P, Wu J, Jiang X, Pan W, Ren J. Effect of SO3 on elemental mercury adsorption on a carbonaceous surface. Applied Surface Science 2012;258(22):8853-60. [70] P. He X. Zhang X. Peng X. Jiang J. Wu N. Chen Interaction of elemental mercury with defective carbonaceous cluster J. Hazard. Mater. 300 2015 289 297 He P, Zhang X, Peng X, Jiang X, Wu J, Chen N. Interaction of elemental mercury with defective carbonaceous cluster. J Hazard Mater 2015;300:289-97. [71] Z. Gao G. Yan M. Zhao S. Xu L. Li H. Huang Theoretical insights into the stability of perovskite clusters by studying water adsorption on (CH3NH3)4SnI6 Sol. Energy Mater. Sol. Cells 202 2019 110126 Gao Z, Yan G, Zhao M, Xu S, Li L, Huang H, et al. Theoretical insights into the stability of perovskite clusters by studying water adsorption on (CH3NH3)4SnI6. Solar Energy Materials and Solar Cells 2019, 202: 110126. [72] P.A. Korevaar S.J. George A.J. Markvoort M.M. Smulders P.A. Hilbers A.P. Schenning Pathway complexity in supramolecular polymerization Nature 481 7382 2012 492 Korevaar PA, George SJ, Markvoort AJ, Smulders MM, Hilbers PA, Schenning AP, et al. Pathway complexity in supramolecular polymerization. Nature 2012;481(7382):492. [73] C. Ling L. Shi Y. Ouyang X.C. Zeng J. Wang Nanosheet supported single-metal atom bifunctional catalyst for overall water splitting Nano Lett. 17 8 2017 5133 5139 Ling C, Shi L, Ouyang Y, Zeng XC, Wang J. Nanosheet supported single-metal atom bifunctional catalyst for overall water splitting. Nano letters 2017;17(8):5133-9. [74] G. Bravo-Pérez J.R. Alvarez-Idaboy A. Cruz-Torres M.E. Ruíz Quantum chemical and conventional transition-state theory calculations of rate constants for the NO3+ alkane reaction J. Phys. Chem. A 106 18 2002 4645 4650 Bravo-Pérez G, Alvarez-Idaboy JR, Cruz-Torres A, Ruíz ME. Quantum chemical and conventional transition-state theory calculations of rate constants for the NO3+ alkane reaction. The Journal of Physical Chemistry A 2002;106(18):4645-50. [75] <https://chem.libretexts.org/Bookshelves/Physical_and_Theoretical_Chemistry_Textbook_Maps/Supplemental_Modules_(Physical_and_Theoretical_Chemistry)/Kinetics/Reaction_Rates/Half-lives_and_Pharmacokinetics>. [76] H. Li Y. Wu L. Li Y. Gong L. Niu X. Liu Adjustable photocatalytic ability of monolayer g-C3N4 utilizing single–metal atom: density functional theory Appl. Surf. Sci. 457 2018 735 744 Li H, Wu Y, Li L, Gong Y, Niu L, Liu X, et al. Adjustable photocatalytic ability of monolayer g-C3N4 utilizing single–metal atom: Density functional theory. Applied Surface Science 2018;457:735-44. [77] S.L. Li H. Yin X. Kan L.Y. Gan U. Schwingenschlogl Y. Zhao Potential of transition metal atoms embedded in buckled monolayer g-C3N4 as single-atom catalysts Phys. Chem. Chem. Phys. 19 44 2017 30069 30077 Li SL, Yin H, Kan X, Gan LY, Schwingenschlogl U, Zhao Y. Potential of transition metal atoms embedded in buckled monolayer g-C3N4 as single-atom catalysts. Phys Chem Chem Phys 2017;19(44):30069-77. [78] A.J. Medford A. Vojvodic J.S. Hummelshøj J. Voss F. Abild-Pedersen F. Studt From the Sabatier principle to a predictive theory of transition-metal heterogeneous catalysis J. Catal. 328 2015 36 42 Medford AJ, Vojvodic A, Hummelshøj JS, Voss J, Abild-Pedersen F, Studt F, et al. From the Sabatier principle to a predictive theory of transition-metal heterogeneous catalysis. Journal of Catalysis 2015;328:36-42. [79] W. Yang L. Linlin M. Zhao H. Huang X. Ding C. Wu Theoretical prediction of graphene-based single-atom iron as a novel catalyst for catalytic oxidation of Hg° by O2 Appl. Surf. Sci. 508 2020 145035 Yang W, Linlin L, Zhao M, Huang H, Ding X, Wu C, et al. Theoretical prediction of graphene-based single-atom iron as a novel catalyst for catalytic oxidation of Hg° by O2. Applied Surface Science 2020;508:145035. [80] C. Chen W. Jia S. Liu Y. Cao Simultaneous NO removal and Hg° oxidation over CuO doped V2O5-WO3/TiO2 catalysts in simulated coal-fired flue gas Energy Fuels 32 6 2018 7025 7034 Chen C, Jia W, Liu S, Cao Y. Simultaneous NO Removal and Hg° Oxidation over CuO Doped V2O5-WO3/TiO2 Catalysts in Simulated Coal-Fired Flue Gas. Energy fuels 2018;32(6):7025-34. [81] S. Zhang Y. Zhao Z. Wang J. Zhang L. Wang C. Zheng Integrated removal of NO and mercury from coal combustion flue gas using manganese oxides supported on TiO2 J. Environ. Sci. (China) 53 2017 141 150 Zhang S, Zhao Y, Wang Z, Zhang J, Wang L, Zheng C. Integrated removal of NO and mercury from coal combustion flue gas using manganese oxides supported on TiO2. J Environ Sci (China) 2017;53:141-50. [82] Z. Wei S. Yu Z. Huang X. Xiao M. Tang B. Li Simultaneous removal of elemental mercury and NO by mercury induced thermophilic community in membrane biofilm reactor Ecotoxicol. Environ. Saf. 176 2019 170 177 Wei Z, Yu S, Huang Z, Xiao X, Tang M, Li B, et al. Simultaneous removal of elemental mercury and NO by mercury induced thermophilic community in membrane biofilm reactor. Ecotoxicol Environ Saf 2019;176:170-7. [83] Y. Gao Z. Li Y. Hao Effect of M-Doped (M = Cr, Fe, Co, and Nb) V2O5/TiO2(001) on mercury oxidation: the insights from DFT calculation J. Phys. Chem. C 121 50 2017 27963 27975 Gao Y, Li Z, Hao Y. Effect of M-Doped (M = Cr, Fe, Co, and Nb) V2O5/TiO2(001) on Mercury Oxidation: The Insights from DFT Calculation. The Journal of Physical Chemistry C 2017;121(50):27963-75. [84] Y. Chen X. Guo F. Wu Y. Huang Z. Yin Mechanisms of mercury transformation over α-Fe2O3 (0 0 1) in the presence of HCl and/or H2S Fuel 233 2018 309 316 Chen Y, Guo X, Wu F, Huang Y, Yin Z. Mechanisms of mercury transformation over α-Fe2O3 (0 0 1) in the presence of HCl and/or H2S. Fuel 2018;233:309-16. [85] J. Zhang Y. Duan W. Zhao C. Zhu Q. Zhou M. She Removal of elemental mercury from simulated flue gas by combining non-thermal plasma with calcium oxide Plasma Chem. Plasma Process. 36 2 2015 471 485 Zhang J, Duan Y, Zhao W, Zhu C, Zhou Q, She M. Removal of Elemental Mercury from Simulated Flue Gas by Combining Non-thermal Plasma with Calcium Oxide. Plasma Chemistry and Plasma Processing 2015;36(2):471-85. [86] C. Wang S. Xu Y. Cui Optical and bonding characters of Hg type clusters New J. Chem. 37 10 2013 3303 3307 Wang C, Xu S, Cui Y. Optical and bonding characters of Hg type clusters. New Journal of Chemistry 2013;37(10):3303-7. [87] Wu Y-w Z. Ali Q. Lu J. Liu Xu M-x L. Zhao Effect of WO3 doping on the mechanism of mercury oxidation by HCl over V2O5/TiO2 (001) surface: periodic density functional theory study Appl. Surf. Sci. 487 2019 369 378 Wu Y-w, Ali Z, Lu Q, Liu J, Xu M-x, Zhao L, et al. Effect of WO3 doping on the mechanism of mercury oxidation by HCl over V2O5/TiO2 (001) surface: Periodic density functional theory study. Applied Surface Science 2019;487:369-78. [88] Z. Gao W. Yang X. Ding Y. Ding W. Yan Theoretical research on heterogeneous reduction of N2O by char Appl. Therm. Eng. 126 2017 28 36 Gao Z, Yang W, Ding X, Ding Y, Yan W. Theoretical research on heterogeneous reduction of N2O by char. Applied Thermal Engineering 2017;126:28-36.",
      "scopus-id": "85083013687",
      "coredata": {
        "eid": "1-s2.0-S2468823120301553",
        "dc:description": "To realize simultaneous removal of pollutants released from coal-fired power plants, we carried out a theoretical study on catalytic oxidation of NO and Hg0 on the surface of single-atom Pd/g-C3N4 catalyst (Pdsac/g-C3N4), because after NO and Hg0 are converted to NO2 and Hg2+, products can be well absorbed in WFGD by using higher water solubility. Detailed reaction patterns in the mechanisms of Eley-Rideal (E-R), Langmuir-Hinshelwood (L-H), and termolecular Eley-Rideal (TER) were involved in this calculation. We revealed characteristics of catalytic reactions in thermodynamics and kinetics, and it was found most reactions were favorable in thermodynamics, and part reaction paths can take place spontaneously and irreversibly. Kinetics analysis evidenced the chemical reaction rates were all very fast because of short half-lives of reactants and large reaction rate constants. Fitted Arrhenius formula suggested the lowest activation energies of NO and Hg0 oxidation were just 0.46 eV and 1.81 eV, and therefore we speculated that Pdsac/g-C3N4 catalyst should be a potential catalyst for catalytic oxidation of NO and Hg0.",
        "openArchiveArticle": "false",
        "prism:coverDate": "2020-06-30",
        "openaccessUserLicense": null,
        "prism:aggregationType": "Journal",
        "prism:url": "https://api.elsevier.com/content/article/pii/S2468823120301553",
        "dc:creator": [
          {
            "@_fa": "true",
            "$": "Liu, Xiaoshuo"
          },
          {
            "@_fa": "true",
            "$": "Gao, Zhengyang"
          },
          {
            "@_fa": "true",
            "$": "Huang, Hanyu"
          },
          {
            "@_fa": "true",
            "$": "Yan, Ge"
          },
          {
            "@_fa": "true",
            "$": "Huang, Tianfang"
          },
          {
            "@_fa": "true",
            "$": "Chen, Cong"
          },
          {
            "@_fa": "true",
            "$": "Yang, Weijie"
          },
          {
            "@_fa": "true",
            "$": "Ding, Xun-Lei"
          }
        ],
        "link": [
          {
            "@_fa": "true",
            "@rel": "self",
            "@href": "https://api.elsevier.com/content/article/pii/S2468823120301553"
          },
          {
            "@_fa": "true",
            "@rel": "scidir",
            "@href": "https://www.sciencedirect.com/science/article/pii/S2468823120301553"
          }
        ],
        "dc:format": "application/json",
        "openaccessType": null,
        "pii": "S2468-8231(20)30155-3",
        "prism:volume": "488",
        "articleNumber": "110901",
        "prism:publisher": "Elsevier B.V.",
        "dc:title": "Simultaneous catalytic oxidation of nitric oxide and elemental mercury by single-atom Pd/g-C3N4 catalyst: A DFT study",
        "prism:copyright": "© 2020 Elsevier B.V. All rights reserved.",
        "openaccess": "0",
        "prism:issn": "24688231",
        "dcterms:subject": [
          {
            "@_fa": "true",
            "$": "Single-atom palladium catalyst"
          },
          {
            "@_fa": "true",
            "$": "Graphitic carbon nitride"
          },
          {
            "@_fa": "true",
            "$": "Hg0oxidation"
          },
          {
            "@_fa": "true",
            "$": "NO oxidation"
          },
          {
            "@_fa": "true",
            "$": "Thermodynamic and kinetic analysis"
          }
        ],
        "openaccessArticle": "false",
        "prism:publicationName": "Molecular Catalysis",
        "openaccessSponsorType": null,
        "prism:pageRange": "110901",
        "pubType": "fla",
        "prism:coverDisplayDate": "June 2020",
        "prism:doi": "10.1016/j.mcat.2020.110901",
        "prism:startingPage": "110901",
        "dc:identifier": "doi:10.1016/j.mcat.2020.110901",
        "openaccessSponsorName": null
      },
      "objects": {
        "object": [
          {
            "@category": "standard",
            "@height": "200",
            "@width": "322",
            "@_fa": "true",
            "$": "https://api.elsevier.com/content/object/eid/1-s2.0-S2468823120301553-ga1.jpg?httpAccept=%2A%2F%2A",
            "@multimediatype": "JPEG image file",
            "@type": "IMAGE-DOWNSAMPLED",
            "@size": "20269",
            "@ref": "ga1",
            "@mimetype": "image/jpeg"
          },
          {
            "@category": "thumbnail",
            "@height": "136",
            "@width": "219",
            "@_fa": "true",
            "$": "https://api.elsevier.com/content/object/eid/1-s2.0-S2468823120301553-ga1.sml?httpAccept=%2A%2F%2A",
            "@multimediatype": "GIF image file",
            "@type": "IMAGE-THUMBNAIL",
            "@size": "20708",
            "@ref": "ga1",
            "@mimetype": "image/gif"
          },
          {
            "@category": "standard",
            "@height": "470",
            "@width": "566",
            "@_fa": "true",
            "$": "https://api.elsevier.com/content/object/eid/1-s2.0-S2468823120301553-gr1.jpg?httpAccept=%2A%2F%2A",
            "@multimediatype": "JPEG image file",
            "@type": "IMAGE-DOWNSAMPLED",
            "@size": "65295",
            "@ref": "gr1",
            "@mimetype": "image/jpeg"
          },
          {
            "@category": "thumbnail",
            "@height": "164",
            "@width": "197",
            "@_fa": "true",
            "$": "https://api.elsevier.com/content/object/eid/1-s2.0-S2468823120301553-gr1.sml?httpAccept=%2A%2F%2A",
            "@multimediatype": "GIF image file",
            "@type": "IMAGE-THUMBNAIL",
            "@size": "10685",
            "@ref": "gr1",
            "@mimetype": "image/gif"
          },
          {
            "@category": "standard",
            "@height": "274",
            "@width": "340",
            "@_fa": "true",
            "$": "https://api.elsevier.com/content/object/eid/1-s2.0-S2468823120301553-gr10.jpg?httpAccept=%2A%2F%2A",
            "@multimediatype": "JPEG image file",
            "@type": "IMAGE-DOWNSAMPLED",
            "@size": "19409",
            "@ref": "gr10",
            "@mimetype": "image/jpeg"
          },
          {
            "@category": "thumbnail",
            "@height": "164",
            "@width": "204",
            "@_fa": "true",
            "$": "https://api.elsevier.com/content/object/eid/1-s2.0-S2468823120301553-gr10.sml?httpAccept=%2A%2F%2A",
            "@multimediatype": "GIF image file",
            "@type": "IMAGE-THUMBNAIL",
            "@size": "6686",
            "@ref": "gr10",
            "@mimetype": "image/gif"
          },
          {
            "@category": "standard",
            "@height": "306",
            "@width": "378",
            "@_fa": "true",
            "$": "https://api.elsevier.com/content/object/eid/1-s2.0-S2468823120301553-gr11.jpg?httpAccept=%2A%2F%2A",
            "@multimediatype": "JPEG image file",
            "@type": "IMAGE-DOWNSAMPLED",
            "@size": "25403",
            "@ref": "gr11",
            "@mimetype": "image/jpeg"
          },
          {
            "@category": "thumbnail",
            "@height": "164",
            "@width": "202",
            "@_fa": "true",
            "$": "https://api.elsevier.com/content/object/eid/1-s2.0-S2468823120301553-gr11.sml?httpAccept=%2A%2F%2A",
            "@multimediatype": "GIF image file",
            "@type": "IMAGE-THUMBNAIL",
            "@size": "6790",
            "@ref": "gr11",
            "@mimetype": "image/gif"
          },
          {
            "@category": "standard",
            "@height": "293",
            "@width": "378",
            "@_fa": "true",
            "$": "https://api.elsevier.com/content/object/eid/1-s2.0-S2468823120301553-gr12.jpg?httpAccept=%2A%2F%2A",
            "@multimediatype": "JPEG image file",
            "@type": "IMAGE-DOWNSAMPLED",
            "@size": "23776",
            "@ref": "gr12",
            "@mimetype": "image/jpeg"
          },
          {
            "@category": "thumbnail",
            "@height": "164",
            "@width": "211",
            "@_fa": "true",
            "$": "https://api.elsevier.com/content/object/eid/1-s2.0-S2468823120301553-gr12.sml?httpAccept=%2A%2F%2A",
            "@multimediatype": "GIF image file",
            "@type": "IMAGE-THUMBNAIL",
            "@size": "6507",
            "@ref": "gr12",
            "@mimetype": "image/gif"
          },
          {
            "@category": "standard",
            "@height": "662",
            "@width": "566",
            "@_fa": "true",
            "$": "https://api.elsevier.com/content/object/eid/1-s2.0-S2468823120301553-gr2.jpg?httpAccept=%2A%2F%2A",
            "@multimediatype": "JPEG image file",
            "@type": "IMAGE-DOWNSAMPLED",
            "@size": "102814",
            "@ref": "gr2",
            "@mimetype": "image/jpeg"
          },
          {
            "@category": "thumbnail",
            "@height": "164",
            "@width": "140",
            "@_fa": "true",
            "$": "https://api.elsevier.com/content/object/eid/1-s2.0-S2468823120301553-gr2.sml?httpAccept=%2A%2F%2A",
            "@multimediatype": "GIF image file",
            "@type": "IMAGE-THUMBNAIL",
            "@size": "10399",
            "@ref": "gr2",
            "@mimetype": "image/gif"
          },
          {
            "@category": "standard",
            "@height": "318",
            "@width": "566",
            "@_fa": "true",
            "$": "https://api.elsevier.com/content/object/eid/1-s2.0-S2468823120301553-gr3.jpg?httpAccept=%2A%2F%2A",
            "@multimediatype": "JPEG image file",
            "@type": "IMAGE-DOWNSAMPLED",
            "@size": "48917",
            "@ref": "gr3",
            "@mimetype": "image/jpeg"
          },
          {
            "@category": "thumbnail",
            "@height": "123",
            "@width": "219",
            "@_fa": "true",
            "$": "https://api.elsevier.com/content/object/eid/1-s2.0-S2468823120301553-gr3.sml?httpAccept=%2A%2F%2A",
            "@multimediatype": "GIF image file",
            "@type": "IMAGE-THUMBNAIL",
            "@size": "9405",
            "@ref": "gr3",
            "@mimetype": "image/gif"
          },
          {
            "@category": "standard",
            "@height": "334",
            "@width": "566",
            "@_fa": "true",
            "$": "https://api.elsevier.com/content/object/eid/1-s2.0-S2468823120301553-gr4.jpg?httpAccept=%2A%2F%2A",
            "@multimediatype": "JPEG image file",
            "@type": "IMAGE-DOWNSAMPLED",
            "@size": "50014",
            "@ref": "gr4",
            "@mimetype": "image/jpeg"
          },
          {
            "@category": "thumbnail",
            "@height": "129",
            "@width": "219",
            "@_fa": "true",
            "$": "https://api.elsevier.com/content/object/eid/1-s2.0-S2468823120301553-gr4.sml?httpAccept=%2A%2F%2A",
            "@multimediatype": "GIF image file",
            "@type": "IMAGE-THUMBNAIL",
            "@size": "10047",
            "@ref": "gr4",
            "@mimetype": "image/gif"
          },
          {
            "@category": "standard",
            "@height": "348",
            "@width": "566",
            "@_fa": "true",
            "$": "https://api.elsevier.com/content/object/eid/1-s2.0-S2468823120301553-gr5.jpg?httpAccept=%2A%2F%2A",
            "@multimediatype": "JPEG image file",
            "@type": "IMAGE-DOWNSAMPLED",
            "@size": "50889",
            "@ref": "gr5",
            "@mimetype": "image/jpeg"
          },
          {
            "@category": "thumbnail",
            "@height": "134",
            "@width": "219",
            "@_fa": "true",
            "$": "https://api.elsevier.com/content/object/eid/1-s2.0-S2468823120301553-gr5.sml?httpAccept=%2A%2F%2A",
            "@multimediatype": "GIF image file",
            "@type": "IMAGE-THUMBNAIL",
            "@size": "11344",
            "@ref": "gr5",
            "@mimetype": "image/gif"
          },
          {
            "@category": "standard",
            "@height": "318",
            "@width": "566",
            "@_fa": "true",
            "$": "https://api.elsevier.com/content/object/eid/1-s2.0-S2468823120301553-gr6.jpg?httpAccept=%2A%2F%2A",
            "@multimediatype": "JPEG image file",
            "@type": "IMAGE-DOWNSAMPLED",
            "@size": "49489",
            "@ref": "gr6",
            "@mimetype": "image/jpeg"
          },
          {
            "@category": "thumbnail",
            "@height": "123",
            "@width": "219",
            "@_fa": "true",
            "$": "https://api.elsevier.com/content/object/eid/1-s2.0-S2468823120301553-gr6.sml?httpAccept=%2A%2F%2A",
            "@multimediatype": "GIF image file",
            "@type": "IMAGE-THUMBNAIL",
            "@size": "9890",
            "@ref": "gr6",
            "@mimetype": "image/gif"
          },
          {
            "@category": "standard",
            "@height": "319",
            "@width": "566",
            "@_fa": "true",
            "$": "https://api.elsevier.com/content/object/eid/1-s2.0-S2468823120301553-gr7.jpg?httpAccept=%2A%2F%2A",
            "@multimediatype": "JPEG image file",
            "@type": "IMAGE-DOWNSAMPLED",
            "@size": "48831",
            "@ref": "gr7",
            "@mimetype": "image/jpeg"
          },
          {
            "@category": "thumbnail",
            "@height": "123",
            "@width": "219",
            "@_fa": "true",
            "$": "https://api.elsevier.com/content/object/eid/1-s2.0-S2468823120301553-gr7.sml?httpAccept=%2A%2F%2A",
            "@multimediatype": "GIF image file",
            "@type": "IMAGE-THUMBNAIL",
            "@size": "10507",
            "@ref": "gr7",
            "@mimetype": "image/gif"
          },
          {
            "@category": "standard",
            "@height": "319",
            "@width": "566",
            "@_fa": "true",
            "$": "https://api.elsevier.com/content/object/eid/1-s2.0-S2468823120301553-gr8.jpg?httpAccept=%2A%2F%2A",
            "@multimediatype": "JPEG image file",
            "@type": "IMAGE-DOWNSAMPLED",
            "@size": "49483",
            "@ref": "gr8",
            "@mimetype": "image/jpeg"
          },
          {
            "@category": "thumbnail",
            "@height": "123",
            "@width": "219",
            "@_fa": "true",
            "$": "https://api.elsevier.com/content/object/eid/1-s2.0-S2468823120301553-gr8.sml?httpAccept=%2A%2F%2A",
            "@multimediatype": "GIF image file",
            "@type": "IMAGE-THUMBNAIL",
            "@size": "11208",
            "@ref": "gr8",
            "@mimetype": "image/gif"
          },
          {
            "@category": "standard",
            "@height": "549",
            "@width": "679",
            "@_fa": "true",
            "$": "https://api.elsevier.com/content/object/eid/1-s2.0-S2468823120301553-gr9.jpg?httpAccept=%2A%2F%2A",
            "@multimediatype": "JPEG image file",
            "@type": "IMAGE-DOWNSAMPLED",
            "@size": "59090",
            "@ref": "gr9",
            "@mimetype": "image/jpeg"
          },
          {
            "@category": "thumbnail",
            "@height": "164",
            "@width": "203",
            "@_fa": "true",
            "$": "https://api.elsevier.com/content/object/eid/1-s2.0-S2468823120301553-gr9.sml?httpAccept=%2A%2F%2A",
            "@multimediatype": "GIF image file",
            "@type": "IMAGE-THUMBNAIL",
            "@size": "9119",
            "@ref": "gr9",
            "@mimetype": "image/gif"
          },
          {
            "@category": "standard",
            "@_fa": "true",
            "$": "https://api.elsevier.com/content/object/eid/1-s2.0-S2468823120301553-mmc1.docx?httpAccept=%2A%2F%2A",
            "@multimediatype": "Microsoft Word file",
            "@type": "APPLICATION",
            "@size": "2989567",
            "@ref": "mmc1",
            "@mimetype": "application/word"
          },
          {
            "@category": "thumbnail",
            "@_fa": "true",
            "$": "https://api.elsevier.com/content/object/eid/1-s2.0-S2468823120301553-si1.svg?httpAccept=%2A%2F%2A",
            "@multimediatype": "Scalable Vector Graphics file",
            "@type": "ALTIMG",
            "@size": "6261",
            "@ref": "si1",
            "@mimetype": "image/svg+xml"
          },
          {
            "@category": "thumbnail",
            "@_fa": "true",
            "$": "https://api.elsevier.com/content/object/eid/1-s2.0-S2468823120301553-si2.svg?httpAccept=%2A%2F%2A",
            "@multimediatype": "Scalable Vector Graphics file",
            "@type": "ALTIMG",
            "@size": "4096",
            "@ref": "si2",
            "@mimetype": "image/svg+xml"
          },
          {
            "@category": "thumbnail",
            "@_fa": "true",
            "$": "https://api.elsevier.com/content/object/eid/1-s2.0-S2468823120301553-si3.svg?httpAccept=%2A%2F%2A",
            "@multimediatype": "Scalable Vector Graphics file",
            "@type": "ALTIMG",
            "@size": "5170",
            "@ref": "si3",
            "@mimetype": "image/svg+xml"
          },
          {
            "@category": "thumbnail",
            "@_fa": "true",
            "$": "https://api.elsevier.com/content/object/eid/1-s2.0-S2468823120301553-si4.svg?httpAccept=%2A%2F%2A",
            "@multimediatype": "Scalable Vector Graphics file",
            "@type": "ALTIMG",
            "@size": "6150",
            "@ref": "si4",
            "@mimetype": "image/svg+xml"
          },
          {
            "@category": "thumbnail",
            "@_fa": "true",
            "$": "https://api.elsevier.com/content/object/eid/1-s2.0-S2468823120301553-si5.svg?httpAccept=%2A%2F%2A",
            "@multimediatype": "Scalable Vector Graphics file",
            "@type": "ALTIMG",
            "@size": "6052",
            "@ref": "si5",
            "@mimetype": "image/svg+xml"
          },
          {
            "@category": "thumbnail",
            "@_fa": "true",
            "$": "https://api.elsevier.com/content/object/eid/1-s2.0-S2468823120301553-si6.svg?httpAccept=%2A%2F%2A",
            "@multimediatype": "Scalable Vector Graphics file",
            "@type": "ALTIMG",
            "@size": "9140",
            "@ref": "si6",
            "@mimetype": "image/svg+xml"
          },
          {
            "@category": "thumbnail",
            "@_fa": "true",
            "$": "https://api.elsevier.com/content/object/eid/1-s2.0-S2468823120301553-si7.svg?httpAccept=%2A%2F%2A",
            "@multimediatype": "Scalable Vector Graphics file",
            "@type": "ALTIMG",
            "@size": "3771",
            "@ref": "si7",
            "@mimetype": "image/svg+xml"
          },
          {
            "@category": "standard",
            "@_fa": "true",
            "$": "https://api.elsevier.com/content/object/eid/1-s2.0-S2468823120301553-am.pdf?httpAccept=%2A%2F%2A",
            "@multimediatype": "Acrobat PDF file",
            "@type": "AAM-PDF",
            "@size": "1307826",
            "@ref": "am",
            "@mimetype": "application/pdf"
          }
        ]
      },
      "link": {
        "@rel": "abstract",
        "@href": "https://api.elsevier.com/content/abstract/scopus_id/85083013687"
      }
    }
  }
}