{
  "metadata": {
    "title": "Enhanced catalytic activity for CO oxidation by Fe-Adsorbing on BN under mild condition: A promising single-atom catalyst",
    "authors": "; ; ",
    "journal": "Molecular Catalysis",
    "date": "2020-11-30",
    "doi": "10.1016/j.mcat.2020.111165",
    "abstract": "",
    "uri": "https://api.elsevier.com/content/article/pii/S2468823120304284",
    "pii": "S2468823120304284"
  },
  "fulltext": {
    "full-text-retrieval-response": {
      "scopus-eid": "2-s2.0-85089486059",
      "originalText": "serial JL 315758 291210 291744 291790 291809 31 Molecular Catalysis MOLECULARCATALYSIS 2020-08-20 2020-08-20 2020-08-20 2020-08-20 2020-09-16T15:55:48 1-s2.0-S2468823120304284 S2468-8231(20)30428-4 S2468823120304284 10.1016/j.mcat.2020.111165 S300 S300.1 FULL-TEXT 1-s2.0-S2468823120X00149 2020-10-09T08:08:29.558692Z 0 0 20201101 20201130 2020 2020-08-20T23:57:06.284379Z absattachment articleinfo articlenumber articletitlenorm authfirstinitialnorm authfirstsurnamenorm cid cids contenttype copyright crossmark dateloaded dateloadedtxt datesearch datesort dateupdated dco docsubtype doctype doi eid ewtransactionid hubeid indexeddate issn issnnorm itemstage itemtransactionid itemweight openaccess openarchive pg pgfirst pii piinorm pubdateend pubdatestart pubdatetxt pubyr sectiontitle sortorder srctitle srctitlenorm srctype ssids alllist content subj subheadings suppl tomb volfirst volissue volumelist webpdf webpdfpagecount yearnav figure table e-component body acknowledge affil appendices articletitle auth authfirstini authfull authkeywords authlast grantnumber grantsponsor grantsponsorid highlightsabst orcid primabst ref specialabst 2468-8231 24688231 true 495 495 C Volume 495 21 111165 111165 111165 202011 November 2020 2020-11-01 2020-11-30 2020 Regular Papers article fla © 2020 Elsevier B.V. All rights reserved. ENHANCEDCATALYTICACTIVITYFORCOOXIDATIONBYFEADSORBINGBNUNDERMILDCONDITIONAPROMISINGSINGLEATOMCATALYST MA C Introduction Computational Methods Results and discussion The Geometry and Stability of V N-Fe and V B-Fe Adsorption of O2 and CO molecules on V N-Fe and V B-Fe Mechanisms for CO Oxidation CO Oxidation on V N-Fe CO Oxidation on V B-Fe Conclusions Declaration of Competing Interest CRediT authorship contribution statement Acknowledgements Appendix A Supplementary data References ROYER 2011 24 65 S FU 2010 1141 1144 Q PETERSON 2014 4885 E ESRAFILI 2018 808 814 M BI 2018 13353 13361 W LEI 2017 2635 2642 X CERA 1987 6494 6502 E CERA 1989 2631 E LU 2016 21865 21870 Z QIAO 2011 634 641 B FARIAS 2017 3434 3445 M BEGUM 2017 8847 8855 P LU 2017 16795 16805 Z ZENG 2018 7061 7064 R ZHOU 2018 554 557 X XU 2018 23481 23492 G ALMEIDA 2019 6592 6598 K ZHANG 2019 7290 7298 L YU 2018 20661 20668 M LI 2019 9257 9267 X JIA 2019 9629 9640 C LIN 2016 1805 1813 J LIANG 2017 566 1573 J QIAO 2016 1580 1586 B LOU 2020 6094 6101 Y KONOPATSKY 2018 217 227 A TRANTHUY 2017 4304 4312 T SUN 2017 1403 1412 M ZHAO 2011 159 162 P JIANG 2014 20290 20296 Q LI 2012 2507 2514 F LOU 2014 4143 4152 Y LOU 2014 43 49 Y LOU 2014 6835 6838 Y LOU 2011 610 614 Y YU 2009 121 128 Y XIE 2009 746 749 X WANNAKAO 2012 16992 16998 S MANDAPAKA 2017 8465 8473 R LIU 2016 34 59 J WANG 2018 65 81 A YANG 2013 1740 1748 X LOU 2019 19289 19295 Y LOU 2020 Y POSTOLE 2007 227 236 G DEAN 2010 722 726 C WATANABE 2004 404 409 K PAN 2008 095707 H ZHI 2009 2889 2893 C WU 2005 179 185 J LIN 2012 1110 1117 Y GRAD 2003 085404 G HUANG 2013 5 10 C LIN 2015 22097 22105 S LIN 2013 17319 17326 S FRISCH 2009 M GAUSSIAN09REVISIOND01GAUSSIAN09INCWALLINGFORDCT GONZALEZ 1989 2154 2161 C GLENDENING 2012 1 42 E CHEESEMAN 1996 5497 5509 J WOLINSKI 1990 8251 8260 K LIU 2019 223 231 B LIU 2003 266102 Z GHOSH 2013 1811 1821 T OKUMURA 2005 37 44 M LIN 2015 888 895 S MA 2019 1202 1208 C GUTSEV 2000 11961 11971 G ZHANG 2015 20006 20013 X LIU 2014 1 11 X LIU 2015 10452 10459 X LIU 2015 1658 1667 X MAX2020X111165 MAX2020X111165XC 2022-08-20T00:00:00.000Z 2022-08-20T00:00:00.000Z http://creativecommons.org/licenses/by-nc-nd/4.0/ © 2020 Elsevier B.V. All rights reserved. 2020-08-06T12:52:49.668Z http://vtw.elsevier.com/data/voc/AddOnTypes/50.7/eoas Natural Science Foundation of Shandong Province http://data.elsevier.com/vocabulary/SciValFunders/501100007129 http://sws.geonames.org/1814991 QAU Qingdao Agricultural University http://data.elsevier.com/vocabulary/SciValFunders/100012900 http://sws.geonames.org/1814991 NSFC National Natural Science Foundation of China http://data.elsevier.com/vocabulary/SciValFunders/501100001809 http://sws.geonames.org/1814991 item S2468-8231(20)30428-4 S2468823120304284 1-s2.0-S2468823120304284 10.1016/j.mcat.2020.111165 315758 2020-10-09T08:08:29.558692Z 2020-11-01 2020-11-30 1-s2.0-S2468823120304284-main.pdf https://s3-eu-west-1.amazonaws.com/prod-ucs-content-store-eu-west/content/pii:S2468823120304284/MAIN/application/pdf/ae629e486807ec42838a153e3fefe9c9/main.pdf main.pdf pdf true 3407310 MAIN 9 1-s2.0-S2468823120304284-main_1.png https://s3-eu-west-1.amazonaws.com/prod-ucs-content-store-eu-west/content/pii:S2468823120304284/PREVIEW/image/png/79c4356397c2815c5a04d10688611fce/main_1.png main_1.png png 56893 849 656 IMAGE-WEB-PDF 1 1-s2.0-S2468823120304284-gr4.jpg https://s3-eu-west-1.amazonaws.com/prod-ucs-content-store-eu-west/content/pii:S2468823120304284/gr4/DOWNSAMPLED/image/jpeg/85cc43348f2dd7c98578b9072c832741/gr4.jpg gr4 gr4.jpg jpg 62412 581 376 IMAGE-DOWNSAMPLED 1-s2.0-S2468823120304284-gr3.jpg https://s3-eu-west-1.amazonaws.com/prod-ucs-content-store-eu-west/content/pii:S2468823120304284/gr3/DOWNSAMPLED/image/jpeg/119a618d20af3cf2f8b597ab1f6873f3/gr3.jpg gr3 gr3.jpg jpg 18117 191 376 IMAGE-DOWNSAMPLED 1-s2.0-S2468823120304284-gr2.jpg https://s3-eu-west-1.amazonaws.com/prod-ucs-content-store-eu-west/content/pii:S2468823120304284/gr2/DOWNSAMPLED/image/jpeg/d3ad4f84e0b8f598d2cd5286829b44c0/gr2.jpg gr2 gr2.jpg jpg 44292 328 470 IMAGE-DOWNSAMPLED 1-s2.0-S2468823120304284-ga1.jpg https://s3-eu-west-1.amazonaws.com/prod-ucs-content-store-eu-west/content/pii:S2468823120304284/ga1/DOWNSAMPLED/image/jpeg/f336d503a504f9779dd6aab87f4cc77f/ga1.jpg ga1 true ga1.jpg jpg 24269 200 353 IMAGE-DOWNSAMPLED 1-s2.0-S2468823120304284-gr1.jpg https://s3-eu-west-1.amazonaws.com/prod-ucs-content-store-eu-west/content/pii:S2468823120304284/gr1/DOWNSAMPLED/image/jpeg/7f188223b5874b40d6b403a44b63b672/gr1.jpg gr1 gr1.jpg jpg 42740 206 565 IMAGE-DOWNSAMPLED 1-s2.0-S2468823120304284-gr7.jpg https://s3-eu-west-1.amazonaws.com/prod-ucs-content-store-eu-west/content/pii:S2468823120304284/gr7/DOWNSAMPLED/image/jpeg/c5019eeafb2f6504f5a7df1336ceb20f/gr7.jpg gr7 gr7.jpg jpg 62209 601 378 IMAGE-DOWNSAMPLED 1-s2.0-S2468823120304284-gr6.jpg https://s3-eu-west-1.amazonaws.com/prod-ucs-content-store-eu-west/content/pii:S2468823120304284/gr6/DOWNSAMPLED/image/jpeg/e54e3d1979b0a1dd0315e62b11b09712/gr6.jpg gr6 gr6.jpg jpg 31807 222 470 IMAGE-DOWNSAMPLED 1-s2.0-S2468823120304284-gr5.jpg https://s3-eu-west-1.amazonaws.com/prod-ucs-content-store-eu-west/content/pii:S2468823120304284/gr5/DOWNSAMPLED/image/jpeg/69f6362614cfcb6c7959a0eb8a72a6d8/gr5.jpg gr5 gr5.jpg jpg 52641 341 470 IMAGE-DOWNSAMPLED 1-s2.0-S2468823120304284-gr4.sml https://s3-eu-west-1.amazonaws.com/prod-ucs-content-store-eu-west/content/pii:S2468823120304284/gr4/THUMBNAIL/image/gif/557d5e8d9b68e7fb08f39fbf38cce87d/gr4.sml gr4 gr4.sml sml 6815 164 106 IMAGE-THUMBNAIL 1-s2.0-S2468823120304284-gr3.sml https://s3-eu-west-1.amazonaws.com/prod-ucs-content-store-eu-west/content/pii:S2468823120304284/gr3/THUMBNAIL/image/gif/96a80b2f153e678ff120f74d3ded8d5a/gr3.sml gr3 gr3.sml sml 7466 112 219 IMAGE-THUMBNAIL 1-s2.0-S2468823120304284-gr2.sml https://s3-eu-west-1.amazonaws.com/prod-ucs-content-store-eu-west/content/pii:S2468823120304284/gr2/THUMBNAIL/image/gif/1f321cbeb724495647b684601f34d53f/gr2.sml gr2 gr2.sml sml 11058 153 219 IMAGE-THUMBNAIL 1-s2.0-S2468823120304284-ga1.sml https://s3-eu-west-1.amazonaws.com/prod-ucs-content-store-eu-west/content/pii:S2468823120304284/ga1/THUMBNAIL/image/gif/9258c63d3cca264cd3692b8be467df2b/ga1.sml ga1 true ga1.sml sml 9115 124 219 IMAGE-THUMBNAIL 1-s2.0-S2468823120304284-gr1.sml https://s3-eu-west-1.amazonaws.com/prod-ucs-content-store-eu-west/content/pii:S2468823120304284/gr1/THUMBNAIL/image/gif/d97cc0a03307ac1b3b38f89b2825c4e2/gr1.sml gr1 gr1.sml sml 8068 80 219 IMAGE-THUMBNAIL 1-s2.0-S2468823120304284-gr7.sml https://s3-eu-west-1.amazonaws.com/prod-ucs-content-store-eu-west/content/pii:S2468823120304284/gr7/THUMBNAIL/image/gif/2af35a0e321f8e81b4bfc42006db38f8/gr7.sml gr7 gr7.sml sml 6404 164 103 IMAGE-THUMBNAIL 1-s2.0-S2468823120304284-gr6.sml https://s3-eu-west-1.amazonaws.com/prod-ucs-content-store-eu-west/content/pii:S2468823120304284/gr6/THUMBNAIL/image/gif/170b8326b3dd4c01479d849ea7592d30/gr6.sml gr6 gr6.sml sml 7458 103 219 IMAGE-THUMBNAIL 1-s2.0-S2468823120304284-gr5.sml https://s3-eu-west-1.amazonaws.com/prod-ucs-content-store-eu-west/content/pii:S2468823120304284/gr5/THUMBNAIL/image/gif/5566d2aae7def052db14267886f22ed0/gr5.sml gr5 gr5.sml sml 10226 159 219 IMAGE-THUMBNAIL 1-s2.0-S2468823120304284-mmc1.docx https://s3-eu-west-1.amazonaws.com/prod-ucs-content-store-eu-west/content/pii:S2468823120304284/mmc1/MAIN/application/vnd.openxmlformats-officedocument.wordprocessingml.document/b6e84dcc6b89ce204276f13c1487c35a/mmc1.docx mmc1 mmc1.docx docx 2940118 APPLICATION 1-s2.0-S2468823120304284-am.pdf am am.pdf pdf 1455517 AAM-PDF https://s3-eu-west-1.amazonaws.com/prod-ucs-content-store-eu-west/content/egi:10XZ9PD4CX5/MAIN/application/pdf/8f0b4eefef2107da7516d6f302200c3c/am.pdf MCAT 111165 111165 S2468-8231(20)30428-4 10.1016/j.mcat.2020.111165 Elsevier B.V. Fig. 1 Geometrical structures of (a) h-BN, (b) V N-Fe, and (c) V B-Fe (V N-Fe: Fe adsorbed on nitrogen vacancy; V B-Fe: Fe adsorbed on boron vacancy) (color code: blue, N; white, H; Pink, B; purple, Fe). Fig. 1 Fig. 2 (a) The substitution energy (E sub) of Fe for four different spin states V N-Fe and the NBO charge on Fe. (b) The E sub of Fe for four different spin states V B-Fe and the NBO charge on Fe. (c) The energy difference between LUMO and HOMO orbitals (E L–H). (d) The binding energy of CO and O2 with the pristine h-BN, V N-Fe, and V B-Fe. Fig. 2 Fig. 3 (a) Geometrical structure of V N-Fe with CO adsorbed. (b) Geometrical structure of V B-Fe with CO adsorbed. (c) Geometrical structure of V N-Fe with O2 adsorbed. (d) Geometrical structure of V B-Fe with O2 adsorbed (color code: blue, N; white, H; Pink, B; purple, Fe; red, O; gray, C). Fig. 3 Fig. 4 (a) The mechanism of CO oxidation catalyzed by V N-Fe in path 1. (b) The mechanism of CO oxidation catalyzed by V N-Fe in path 2. Fig. 4 Fig. 5 (a) Primary NBO charge variations along with CO oxidation on V N-Fe in path 1. (b) Primary NBO charge variations along with CO oxidation on V N-Fe in path 2. (c) Primary NBO charge variations along with CO oxidation on V B-Fe in path 1. (d) Primary NBO charge variations along with CO oxidation on V B-Fe in path 2. (D in plots presents the total NBO charge of Fe-adsorbed h-BN). Fig. 5 Fig. 6 (a) The potential energy curves of quartet N-v and doublet N-vi. (b) The potential energy curves of quartet B-ii and doublet B-iii. (c) The potential energy curves of doublet B-v and sextet B-vi. (d) Structures of transition state between N-v and N-vi. (e) Structures of transition state between B-ii and B-iii. (f) Structures of transition state between B-v and B-vi. Fig. 6 Fig. 7 (a) The mechanism of CO oxidation catalyzed by V B-Fe in path 1. (b) The mechanism of CO oxidation catalyzed by V B-Fe in path 2. Fig. 7 Table 1 Bond length of geometry structure variation along with the CO oxidation (V N-Fe). Table 1 Fe-B1 Fe-B2 Fe-B3 OA-OB Fe-OA Fe-OB C1-OB C2-OA V N-Fe 1.914 1.915 1.915 N-i 2.021 1.999 2.018 1.434 1.804 1.852 N-ii 2.037 2.028 2.086 1.350 1.931 1.950 2.905 N-iii 2.016 2.01 2.01 3.061 1.662 1.173 N-iv 2.010 2.008 2.008 1.615 N-v 2.011 2.009 2.011 1.618 3.105 N-vi 1.923 1.924 2.015 1.899 1.273 N-vii 1.909 1.910 1.908 2.029 1.179 2N-iv 2.012 2.010 2.0132 1.624 3.474 1.173 3.103 2N-v 1.963 2.048 1.945 1.919 2.469 1.179 1.292 2N-vi 1.909 1.908 1.907 4.225 3.652 1.172 1.160 Table 2 C-O stretching vibrational IR spectra signals variation along with the CO oxidation (V N-Fe). Table 2 N-ii N-iii N-v N-vi N-vii 2N-iv 2N-v 2N-vi C-O/cm-1 2096.9 2428.2 2210.8 1958.2 2441.3 2206.4 1800.8 2441.2 Table 3 NMR magnetic shielding tensor variation along with the CO oxidation in Path 1. Table 3 V N-Fe N-i N-ii N-iii N-iv N-v N-vi N-vii B1 29.3 64.6 52.2 55.9 55.4 55.6 33.7 20.2 B2 29.6 39.9 45.3 55.9 55.1 55.2 32.9 27.1 B3 29.5 64.1 55.3 55.9 55.1 56.4 53.6 20.9 Fe −11215.1 −7244.1 −5948.7 −7236.3 −7225.4 −7242.9 −8195.9 −10889.9 OA −745.8 −720.0 −1156.0 −1226.9 −1208.0 165.1 220.5 OB −724.6 −714.2 221.3 Table 4 NMR coupling constants (J) along with the CO oxidation in Path 1. Table 4 V N-Fe N-i N-ii N-iii N-iv N-v N-vi N-vii B1-Fe 32.5 16.8 11.5 17.3 17.3 173.3 9.9 70.2 B2-Fe 26.4 13.9 18.8 17.9 17.9 17.8 10.5 58.1 B3-Fe 26.5 17.6 15.3 17.9 17.9 17.7 20.2 65.3 OA-Fe 8.7 4.4 5.2 5.7 5.5 0.1 −17.2 OB-Fe 9.1 4.1 0.1 OA-OB −27.4 −60.3 0.8 C1-OB 5.2 1.1 C2-OA −2.7 30.1 5.3 Table 5 Bond length of geometry structure variation along with the CO oxidation (V B-Fe). Table 5 Fe-N1 Fe-N2 Fe-N3 OA-OB Fe-OA Fe-OB C1-OA C2-OB V B-Fe 1.837 1.835 1.835 B-i 1.817 1.816 1.802 1.332 1.921 1.922 B-ii 1.805 1.815 1.816 1.333 1.927 1.921 4.522 B-iii 1.777 1.786 1.775 3.768 1.561 1.171 1.168 B-iv 1.779 1.786 1.777 1.557 B-v 1.777 1.785 1.777 1.559 3.174 B-vi 1.854 1.849 1.849 2.287 1.178 2B-iv 1.777 1.786 1.774 3.766 1.562 1.171 3.246 2B-v 1.776 1.769 1.767 4.097 1.816 1.169 1.301 2B-vi 1.853 1.853 1.852 5.572 2.266 1.166 1.178 Table 6 C-O stretching vibrational IR spectra signals variation along with the CO oxidation (V B-Fe). Table 6 B-ii B-iii B-v B-vi 2B-iv 2B-v 2B-vi C-O/cm-1 2211.0 2432.0 2214.3 2444.4 2212.0 1881.4 2448.4 Enhanced catalytic activity for CO oxidation by Fe-Adsorbing on BN under mild condition: A promising single-atom catalyst Chaoqun Ma Formal analysis Writing - original draft Bingping Liu Investigation Formal analysis * Shihai Yan Conceptualization Supervision Formal analysis * College of Chemistry and Pharmaceutical Sciences, Qingdao Agricultural University, Qingdao, 266109, China College of Chemistry and Pharmaceutical Sciences Qingdao Agricultural University Qingdao 266109 China College of Chemistry and Pharmaceutical Sciences, Qingdao Agricultural University, Qingdao, 266109, China ⁎ Corresponding authors. Graphical abstract The catalytic CO oxidation on Fe-adsorbed h-BN includes O2 adsorption, electron transfer, CO adsorption, oxygen transfer, and CO2 desorption. The rate determining step is the first oxygen transfer, with a barrier of 1.18 eV on V N-Fe (Fe atom is adsorbed on N vacancy). Conversion of CO into CO2 is a prototypical reaction in heterogeneous catalysis and is extensively studied to explore the underlying mechanisms of related reaction. A detailed mechanism exploration was carried out for CO oxidation catalyzed by single Fe atom adsorbed hexagonal boron nitride (h-BN) at room temperature. DFT calculations demonstrate the enhancement of catalytic activity of h-BN for CO oxidation upon Fe-adsorbing. The substitution of iron significantly decreases the energy difference between the HOMO and LUMO in h-BN. The positively charged Fe atom in dopant favors the capture of O2 molecule and serves as the catalytic active site for CO oxidation reaction. Energetically, the adsorbed Fe atom prefers to reside in N vacancy (V N-Fe) rather than B vacancy, with the energy barriers for the generation of two CO2 molecules are 1.18 eV and 0.76 eV, respectively. The rate determining step is the first oxygen transfer, as attributes to the significant charge transfer from Fe-adsorbed h-BN to O2. The enhanced catalytic activity implies that Fe-adsorbed h-BN has potential application for the development of low-cost, non-toxic monoatomic catalysts. Keywords h-BN Fe-adsorbing Single atom catalyst CO Oxidation Density Functional Theory Introduction CO oxidation reaction plays an important role in controlling the increasingly serious environmental pollution caused by CO emission from automobiles and fossil fuels combustion [1–6]. CO combines easily with hemoglobin in human blood to form carboxyhemoglobin, which makes hemoglobin lose the ability to transport oxygen, causing tissue suffocation and death in severe cases [7,8]. CO oxidation has become one of the most studied reactions in past few decades. The most critical issue is to find an efficient catalyst [9], which is usually doped with noble metals (such as Au, Ag, Pt, Rh, Ru, Pd, and Ir) [10–25]. In experiments, noble metals are also used to enhance the performance of catalytic CO oxidation [26–28]. But several problems, such as limited natural resources, high cost, and high reaction temperature, hampers their large-scale application in industrial production. Non-noble metal-based catalysts have attracted considerable research interest in recent years due to their low-cost and highly activity [29–37]. The low-cost Fe-anchored graphene and graphene oxide can be served as a promising green catalyst for low-temperature CO oxidation [31,38,39]. Such catalysts are defined as single-atom catalysts (SACs) [40–44], which maximizes the metal atom efficiency. SACs have become a hot topic owing to their significant advantages of maximized atomic utilization, uniform active sites with excellent stability and selectivity, as well as distinctly improved catalytic activity over conventional metal nanoparticles. Although h-BN has similar geometrical structure to graphene, its unique physical and chemical properties are the focus of research [45–50]. In particular, h-BN has high chemical stability, and it maintains the integrity of the material itself even up to 1000 K [51,52]. The doped h-BN by single metal atom (such as Co, Ru, Cu) [9,53,54] has exhibited highly activity in the CO oxidation reaction. Totally, three possible mechanisms for CO oxidation were designed, including the Eley-Rideal (ER) mechanism, the Langmuir-Hinshelwood (LH) mechanism, and the Termolecular Eley–Rideal (TER) mechanism [9]. The Co-doped h-BN catalyzes the CO oxidation via activating the O-O bond under the ER mechanism, with the reaction energy barrier of 0.53 eV [55]. The catalysis for CO oxidation on B-vacancy of Fe-doped h-BN is divided into two steps (CO + O2 → CO2 + O*, CO + O* → CO2) based on the Eley-Rideal (ER) mechanism. The corresponding energy barriers for CO2 generation in two different steps are 0.56 eV and 0.61 eV, respectively [29]. These works provide valuable information about the structure-activity relationship of h-BN dopant and demonstrate the potential application of doped h-BN SACs as the efficient CO oxidation catalyst. Based on the above findings, Fe-adsorbed h-BN SAC is expected to be effective for CO oxidation. The aim of this study is to explore the detailed mechanism of CO oxidation for both N-vacancy (V N-Fe) and B-vacancy (V B-Fe) dopant. Although Fe-adsorbed h-BN is a low-cost and high activity catalyst, there are still four questions to be solved: 1) Does the spin multiplicity of Fe affect the stability and the efficiency of the structure? 2) Which vacancy is better, V N or V B for CO oxidation? 3) Which molecule prefers to be adsorbed on the dopant at first, O2 or CO? 4) Which one corresponds to the rate-determining step? The computational methods are given in Section 2. The results and discussion are collected in Section 3. Finally, a brief conclusion is summarized in Section 4. Computational Methods The density functional theory (DFT) calculations were carried out employing the hybrid Becke, three-parameter, Lee-Yang-Parr exchange correlation functional (B3LYP) with the 6-31 G (d) basis set using the Gaussian 09 program [56]. The IR spectra are employed to determine whether the optimized stationary points correspond to the local minima or the transition states on the potential energy surfaces (PES). In addition, the relationship between the transition states and the reactants/products is established by using intrinsic reaction coordinate (IRC) [57] analyses. The charge transfer, electron population, and the bonding characteristics along with the CO oxidation are discussed with the natural bond orbital (NBO) analyses [58]. The nuclear magnetic resonance (NMR) data are obtained using the gauge independent atomic orbital (GIAO) [59,60] method. The magnetic shielding tensor (σ) of the primary atoms and the NMR spin-spin coupling constant (n J (A, B): n refers to the number of bonds connecting nuclei A and B) are determined. The substitution energy (E sub) is calculated according to E sub = − [E BN-Fe + E N/B − E BN − E Fe]. Where, E BN-Fe denotes the total energy of Fe-adsorbed h-BN; E N/B refers to the energy of N/B atom; E BN is the energy of h-BN; E Fe presents the energy of Fe atom. The binding energy (E b) is defined as E b= − [E BNFe-M − E BNFe − E M]. In this definition, E BNFe-M refers to the total energy of the system when the small gas molecule (O2 or CO) is adsorbed on Fe-adsorbed h-BN; E BNFe denotes the energy of Fe-adsorbed h-BN; E M is the energy of small gas molecules. A larger E b represents an energetically more favorable process. All the energies are corrected by the zero-point vibrational energy (ZPE), which is offered along with the IR spectra. Results and discussion The Geometry and Stability of V N-Fe and V B-Fe Fig. 1 presents the primary geometrical parameters of h-BN, V N-Fe, and V B-Fe. For N-vacancy dopant, the Fe-B bond length is 1.915 Å, distinctly longer as compared to the N-B distance (1.448 Å) in h-BN; the B2FeB3 angle is 85.4°, less than the B2N3B3 angle (120.0°) in h-BN. Strong steric repulsion between Fe and three around B atoms contributes to these variations. In case of B-vacancy dopant, V B-Fe, the Fe-N bond length (1.835 Å) is longer than the B-N bond in h-BN and shorter than the Fe-B distance in V N-Fe. The N2FeN3 angle is 104.9°, locates between the B2N3B3 angle in h-BN and the B2FeB3 angle in V N-Fe. Therefore, the Fe atom locates out of the h-BN plane in both dopants. The difference of atomic radius between Fe and vacancy contributes predominantly to the structural variation upon Fe-adsorbing. Fig. 2 (a) presents the substitution energy (E sub) of Fe to form doublet, quartet, sextet, and octet V N-Fe dopant as well as the NBO charges on Fe atom. The calculated minimum E sub is 12.35 eV in doublet V N-Fe as well as the maximum NBO charge of Fe in octet V N-Fe is 0.598. This E sub is larger than those of Ru and S [53,61], indicating a stronger interaction between the adsorbed Fe and the N-vacancy. The E sub of Fe to generate doublet, quartet, sextet, and octet V B-Fe as well as NBO charge of Fe atom are shown in Fig. (2 b). It is found that the minimum E sub is 7.53 eV and the maximum NBO charge of Fe atom is 1.534 in sextet V B-Fe. Generally, the energy difference between the lowest unoccupied molecular orbital (LUMO) and the highest occupied molecular orbital (HOMO) (E L-H) is an index for the stability of the material. E L-H value reflects the probability of electron transfer, the bonding characteristics, and the chemical activity. It has been reported that large positive charges populated on metal atom favors the subsequent O2 activation [62–64]. Fig. (2 c) shows that E L-H decreases distinctly from 6.58 eV in h-BN to 3.88/3.59 eV in V N-Fe/ V B-Fe, indicating the enhancement of the activity upon Fe adsorbing. The catalytic activity of h-BN is greatly enhanced upon Fe adsorbing for both N and B vacancies. Therefore, the sextet dopants are selected as the potential candidates for CO oxidation. Adsorption of O2 and CO molecules on V N-Fe and V B-Fe CO oxidation includes the reactant adsorption (CO and O2) and the product desorption (CO2) on V N-Fe/ V B-Fe. The small binding energy (E b) of h-BN with CO/O2 (0.02/0.10 eV) indicates the low activity of h-BN to further catalyze CO oxidation. This is consistent with the previous explorations [61,65,66]. The E b of O2 with V N-Fe/ V B-Fe is 2.69/1.03 eV, which is increased distinctly as compared to that of CO (Fig. 2d). The above results indicate that O2 combines tightly with V N-Fe/ V B-Fe than CO. The adsorption of O2 should be followed by CO. Fig. 3 shows the optimized geometrical structures, with the bond lengths of O-O/C-O labeled. The length of the combined C-O bond is 1.159/1.136 Å, which is almost equal to that of gaseous CO (1.138 Å). However, the O-O bond length extends by over 0.1 Å upon adsorption than gaseous O2 (1.215 Å), which should attribute to the charge transfer (0.49 e-/0.41 e-) from dopant to O2. This is a typical peroxide state [67]. Mechanisms for CO Oxidation The CO oxidation mechanism mainly includes O2 adsorption, electron reorganization, CO adsorption, oxygen transfer, and CO2 desorption. The detailed process is discussed below. CO Oxidation on V N-Fe The triplet O2 is adsorbed on the V N-Fe template, generating the quartet N-i, initiating the entire catalytic CO oxidation reaction (Fig. 4 ). Geometrically, the distances of two O atoms with Fe atom in N-i are 1.804 and 1.852 Å (Table 1 ), respectively. The bond lengths of Fe-B1, Fe-B2, and Fe-B3 increase by ∼ 0.1 Å (from 1.914, 1.915, and 1.915 Å to 2.021, 1.999, and 2.018 Å, respectively), indicating the strong interaction between dopant and O2. About 0.76 NBO electrons are transferred from V N-Fe to O2, and the transferred electrons mainly derive from the Fe atom in V N-Fe (Fig. 5 a). The O2 adsorption is an exothermic reaction with the energy decline by 2.69 eV (Fig. 4a). The adsorption of CO generates N-ii, with the distance between CO and O2 of 2.905 Å and the bond lengths of Fe-OA/Fe-OB extended by ∼ 0.10 Å (Table 1). However, the effect on the geometrical parameters of the dopant is slight. CO adsorption is an exothermic process by 0.54 eV (Fig. 4a). There are about 0.34 NBO electrons transferred between the dopant and the adsorbed CO/O2 molecules, and the transferred electrons mainly derives from the Fe atom (NBO charge of Fe from 0.77 to 0.43) in V N-Fe (Fig. 5a). The OB transfers to CO with N-iii formation and generating the first CO2. The process occurs exothermically by -2.44 eV with an activation energy barrier of 1.18 eV (Fig. 4a). The barrier is not high and the previous steps are all exothermic reactions with reaction heat of -3.23 eV. This barrier is lower compared to Pt/4N-graphene (1.81 eV) [68] and Cu-BN (1.91 eV) [69]. Low activation energy barrier and high exothermicity are beneficial to accelerate reaction rate, which indicates that V N-Fe is an efficient catalyst for CO oxidation. For N-iii, the distance between the generated CO2 and the remaining O atom (OA) is 3.061 Å, indicating the weak interaction between CO2 and dopant (Table 1). The distance between OA and Fe atom is shortened by 0.269 Å, indicating the strengthening between OA and Fe atom (Table 1). There are –0.55 NBO electrons located on OA in N-iii (Fig. 5a). The C-O stretching signal is blue-shifted from 2096.9 to 2428.2 cm-1 in N-iii (Table 2 ). The negatively charged OA favors the approaching of the second CO molecule and further oxidation. The subsequent reaction mechanism is discussed in the following two paths: (1) the generated CO2 desorption occurs before the second CO adsorption; (2) the second CO adsorption is followed by the generated CO2 desorption. In path 1, the first CO2 desorption is an endothermic reaction with reaction energy of 0.17 eV (Fig. 4a). No distinct change is observed for the geometric parameters (Table 1) and the NMR parameters (Tabs 3 & 4) before and after CO2 desorption. The C-O stretching vibrational IR spectra signal disappears at 2428.2 cm-1 due to CO2 desorption (Table 2). The second CO adsorbs on dopant with the distance between CO and OA of 3.105 Å. (Table 1). This process is an exothermic reaction with reaction heat of 0.10 eV (Fig. 4a). Geometrically, the bond lengths of Fe-B1 and Fe-B2 increase from 1.862 and 1.856 Å to 2.011 and 2.009 Å, respectively. While the Fe-B3 and Fe-OA bond lengths decrease from 2.443 and 1.735 Å to 2.011 and 1.618 Å, respectively (Table 1). However, the bond length and the IR spectra signal of CO (1.137 Å/2210.8 cm-1) in N-v are equal to that of gaseous CO molecules (1.138 Å/2210.7 cm-1), which are typical features of physical adsorption. CO adsorption leads to significant enhancement for σB1, σB2, σOA, J (Fe, B1), as well as notable decreasing for the σB3 and σFe (Tables 3 & 4 ). The approaching of the second CO to the dopant is accompanied by the departure of OA. The electron reorganization occurs with the conversion from quartet N-v to doublet N-vi. This is an exothermic process with the reaction heat of -1.56 eV (Fig. 4a). This conversion is verified by scanning the potential energy surfaces (PES) of both quartet N-v and doublet N-vi along with the Fe…C2 distance (Fig. 6 a). Along with the decreasing of Fe…C2 distance, the energy of N-v decreases first then increases distinctly until 2.263 Å (A point in Fig. 6a), where the energy of quartet N-v equals to that of doublet N-vi. Following the reduction of Fe…C2 distance, the PES of quartet N-v increases and the PES of doublet N-vi decreases. Therefore, the system changes from quartet to doublet when the Fe…C2 distance is shorter than 2.263 Å. Furthermore, this is an exothermic process with low energy barrier (0.03 eV) and the corresponding transition state structure is shown in Fig. (6 d). The contact distance of Fe…C2 decreases from 3.686 to 1.960 Å, and the bond length of Fe-OA increases from 1.618 to 1.899 Å, indicating the CO chemisorption nature. Accompanied with 0.2 NBO electron transfer from N-v to CO (Fig. 5a), the IR spectra signal of the C-O stretching vibration is red-shifted from 2210.8 cm-1 in N-v to 1958.2 cm-1 in N-vi (Table 2). The second CO2 molecule comes into being with the formation of new C2–OA bond, with a barrier of 0.76 eV. It is small enough to be overcome considering that the previous steps are all exothermic reaction with total reaction heat of -6.40 eV (Fig. 4a). This barrier is lower as compared to Pt1/FeOx (0.77 eV) [10], Pt-BN (1.31 eV) [70], and Pt/3N-graphene (1.41 eV) [71]. Geometrically, the distance of the generated CO2 with V N-Fe is 2.029 Å (Table 1), indicating their weak interaction. The C-O stretching mode is blue-shifted from 1958.2 cm-1 in N-vi to 2441.3 cm-1 in N-vii. Tabs 3 & 4 manifest outstanding increasing for σFe and J (Fe, OA), as well as notable decreasing for σOA and J (C2, OA). Finally, CO2 desorption recovers the catalyst with the reaction heat of 0.59 eV (Fig. 4a). The C-O stretching signal disappears owing to CO2 desorption (Table 2). In path 2, the second CO adsorbs on N-iii with the contact distance between CO and OA of 3.103 Å. Geometrically, the bond length of CO (1.138 Å) in 2N-iv is equal to that of gaseous CO molecules (1.138 Å), which is a feature of physical adsorption. The CO adsorption is an exothermic process with the reaction heat of -0.10 eV (Fig. 4b). As shown in Table 2, the C-O stretching signal locates at 2206.4 cm-1. The subsequent approaching of the second CO to V N-Fe is accompanied by the departure of OA. This is an exothermic process with the reaction heat of -0.69 eV (Fig. 4b). The C-O stretching vibration IR spectra signal is red-shifted from 2206.4 cm-1 in 2N-iv to 1800.8 cm-1 in 2N-v (Table 2). The transfer of OA to CO generates doublet 2N-vi with the reaction heat of -0.14 eV (Fig. 4b). Geometrically, the contact distance between the generated CO2 and Fe atom is 2.029 Å (Table 1). The broken of Fe-OA leads to the electron transfer from generated CO2 back to V N-Fe (Fig. 5b). Two generated CO2 molecules depart one by one from 2N-vi with the reaction heat of 0.15 and 0.59 eV, respectively (Fig. 4b). Tabs S1 & S2 show prominent increase for σB1, σB2, σB3, σFe, as well as notable decrease for J (Fe, B1), J (Fe, B2), and J (Fe, B3). CO Oxidation on V B-Fe The triplet O2 is adsorbed on the sextet V B-Fe template to form quartet B-i, initiating the entire CO oxidation reaction (Fig. 7 a). The O2 adsorption is an exothermic process by -1.03 eV (inset in Fig. 7a). Geometrically, the bond lengths of Fe-N is shortened by 0.26 ± 0.07 Å, and the lengths of the novel Fe-OA, Fe-OB, and OA-OB bonds are 1.921, 1.922, and 1.332 Å, respectively (Table 5 ), indicating the strong bound between Fe and h-BN. About 0.4 NBO electrons are transferred from the V B-Fe to O2 (Fig. 5c), and the negatively charged OA and OB atoms favor the subsequent CO adsorption. The O2 adsorption causes distinct enhancement of σN1, σN2, σN3, σFe, and J (Fe, N) (Tabs S3 & S4). The subsequent adsorption of CO generates B-ii with the distance between CO and O2 of 4.522 Å (Table 5). The effect on the geometrical parameters of B-i is slight. CO adsorption is weak, characterized by the small reaction heat (- 0.05 eV) (Fig. 7a) and slight NBO charge variation of CO (Fig. 5c). CO adsorption can be proved with the C-O stretching signal appeared at 2211.0 cm-1 (Table 6 ). The following OA transfers to CO and generates the doublet B-iii. The approaching of the CO to the dopant is accompanied by the departure of OA. The electron reorganization occurs with the conversion from quartet B-ii to doublet B-iii. The distribution of HOMO orbital during OA transfer indicates that electrons are transferred from O2 back to V B-Fe (Fig. S1a & S1b). This is a significant exothermic process with the reaction heat of 3.47 eV (Fig. 7a). This conversion is verified by scanning the PES of both quartet B-ii and doublet B-iii along with the Fe…OA distance (Fig. 6b). Along with the increasing of Fe…OA distance, the energy of B-ii increases distinctly until 2.567 Å (B point in Fig. 7b), where the energy of quartet B-ii equals to that of doublet B-iii. Therefore, the system changes from quartet to doublet when the Fe…OA distance is 2.567 Å. Furthermore, this process needs to overcome an activation energy barrier of 1.88 eV (Fig. 7a), indicating that the first oxygen transfer is difficult for V B-Fe and the corresponding transition state structure is shown in Fig. (6 e). The contact distance of Fe…OA increases from 1.92 to 3.77 Å and C1…OA distance decreases from 4.522 to 1.171 Å, indicating the chemisorption nature. There are about 0.54 electrons transferred to OA atom from the adsorbed CO molecule (Fig. 5c), implying their strong interaction. The IR spectrum of C-O stretching is blue-shifted by 221 cm-1 from 2211.0 cm-1 in B-ii to 2432.0 cm-1 in B-iii (Table 6). The negatively charged OB is beneficial for the approaching of the second CO molecule and succeeded oxidation reaction. Two possible mechanisms are discussed for the following steps: In path 1, the first CO2 desorption is an endothermic reaction with reaction heat of 0.10 eV (Fig. 5a). No significant change is observed for the geometrical and NMR parameters upon CO2 desorption. The C-O stretching vibrational signal disappears at 2432.0 cm-1 owing to CO2 desorption (Table 6). The subsequent second CO adsorbs on B-iv to form B-v with the reaction energy of -0.08 eV (Fig. 7a). Geometrically, the large contact distance between CO and OB is 3.174 Å (Table 5). However, the bond length of CO (1.137 Å) in B-v is equal to that of gaseous CO molecules (1.138 Å), which is a feature of physical adsorption. The IR spectra signal of C-O stretching vibrational appears at 2214.3 cm-1 in B-v (Table 6), which is equal to that of gaseous CO molecules (2210.7 cm-1). The approaching of the second CO to the dopant is accompanied by the departure of OB. The electron reorganization occurs with the conversion from doublet B-v to sextet B-vi. Distributions of their HOMO orbitals are shown in Fig. S1c & S1d. This is a significant exothermic process with the reaction heat of -1.72 eV (Fig. 7a). This conversion is verified by scanning the PES of both doublet B-v and sextet B-vi along with the C2…OB distance (Fig. 6c). Along with the decreasing of C2…OB distance, the energy of B-v increases distinctly until 1.906 Å (C point in Fig. 6c), where the energy of doublet B-v equals to that of sextet B-vi. Following the reduction of C2…OB distance, the PES of doublet B-v increases and the PES of sextet B-vi drops. Therefore, the system changes from doublet to sextet when the C2…OB distance is 1.906 Å. Furthermore, the previous steps are all extremely exothermic reactions with reaction heat of -4.53 eV and a moderate barrier of 0.76 eV for OB transfer is easily to be overcome (Fig. 7a). The corresponding transition state structure is shown in Fig. (6 f). The contact distance of C2…OB decreases from 3.174 to 1.178 Å, and the bond length of Fe-OB increases from 1.559 to 2.287 Å, indicating the CO chemisorption nature. Along with OB transfer, 0.17 electrons are transferred to OB from V B-Fe (Fig. 5c). Tab S3 shows significantly decrease for the σ of N1, N2, N3, Fe, and OB. The IR spectrum of C-O stretching mode is blue-shifted by 230 cm-1 from 2214.3 cm-1 in B-v to 2444.4 cm-1 in B-vi (Table 6). Finally, CO2 desorption from B-vi back to V B-Fe is an endothermic reaction of 0.39 eV (Fig. 7a). This desorption influences slightly to the geometrical and NMR parameters. There are 0.4 NBO electrons transferred from OB back to V B-Fe (Fig. 5c). The C-O stretching signal disappears at 2444.4 cm-1 (Table 6) owing to CO2 desorption. In path 2, the second CO is adsorbed on B-iii by interaction with OB (Fig. 5b) before desorption of generated CO2. The physisorption characteristics of this CO is described by small reaction heat (-0.08 eV) (Fig. 7b) and large contact distance (3.246 Å) between CO with OB (Table 5). The subsequent approaching of the second CO to V B-Fe is accompanied by the departure of OB. The bond length of C2-OB prominently decreases from 3.246 to 1.301 Å (Table 5), indicating the chemisorption feature on B-iv. This is an endothermic process with the reaction heat of 0.05 eV (Fig. 7b). There are 0.42 NBO electrons transferring from OB to CO, leading to significant increase of C2 NBO charge. The C-O stretching mode is red-shifted from 2212.0 cm-1 in 2B-iv to 1881.4 cm-1 in 2B-v (Table 6). Tabs S5 & S6 show slightly decrease for σN1, σN2, σN3, and notable increasing for J (Fe, N1), J (Fe, N2), and J (Fe, N3) owing to the formation of OCO. The following OB is transferred to CO to generate sextet 2B-vi with the reaction heat of -1.81 eV (Fig. 7b). Finally, two CO2 desorption from 2B-vi to V B-Fe are endothermic reactions by 0.14 and 0.40 eV, respectively (Fig. 7b). Furthermore, the effect on the NMR and geometrical parameters is slight. The IR spectra signal of C-O stretching vibrational at 2448.4 cm-1 disappears due to CO2 desorption (Table 6). Conclusions In summary, Fe-adsorbed hexagonal boron nitride (h-BN) SACs are investigated for the catalytic CO oxidation by DFT approach. The CO oxidation process mainly includes O2 adsorption, electron reorganization, CO adsorption, oxygen transfer, and CO2 desorption. Due to the stability of h-BN, the enhanced catalytic activity of Fe-adsorbed h-BN is mainly attributed to the strong hybridization between the electronic states of O2 and adsorbed single Fe atom. The first step for CO oxidation should be O2 adsorption, instead of CO, and the rate-limiting step is the first oxygen transfer to generate CO2. In addition, V N-Fe and V B-Fe SACs exhibit extremely high stability and activity during CO oxidation. The weak interaction between generated CO2 and V N-Fe/ V B-Fe can effectively prompt the CO2 desorption, allowing the Fe active site for next catalytic cycle. The energy barrier of V N-Fe for CO oxidation is lower than that of V B-Fe under mild condition, indicating that V N-Fe SAC is a potential efficient catalyst for CO oxidation. Declaration of Competing Interest The authors declare that they have no conflict of interest. CRediT authorship contribution statement Chaoqun Ma: Writing - original draft. Bingping Liu: Investigation. Shihai Yan: Conceptualization, Supervision. Declaration of Competing Interest The authors report no declarations of interest. Acknowledgements This work was supported by the National Natural Science Foundation of China (Grant No.21203227), Natural Science Foundation of Shandong Province (Grant No. ZR2016BM33), and the Research Foundation for Talented Scholars of Qingdao Agricultural University (No. 6631113335). The numerical calculations in this paper were performed on the supercomputing system in the Supercomputing Center of the University of Science and Technology of China. Appendix A Supplementary data Supplementary material related to this article can be found, in the online version, at doi:https://doi.org/10.1016/j.mcat.2020.111165. Appendix A Supplementary data The following is Supplementary data to this article: References [1] S. Royer D. Duprez Catalytic Oxidation of Carbon Monoxide over Transition Metal Oxides ChemCatChem 3 2011 24 65 10.1002/cctc.201000378 S. Royer, D. Duprez, Catalytic Oxidation of Carbon Monoxide over Transition Metal Oxides, ChemCatChem 3 (2011) 24-65, https://doi: 10.1002/cctc.201000378. [2] Q. Fu W.X. Li Y.X. Yao H.Y. Liu H.Y. Su D. Ma X.K. Gu L.M. Chen Z. Wang H. Zhang B. Wang X.H. Bao Interface-confined ferrous centers for catalytic oxidation Science 328 2010 1141 1144 10.1126/science.1188267 Q. Fu, W.X. Li, Y.X. Yao, H.Y. Liu, H.Y. Su, D. Ma, X.K. Gu, L.M. Chen, Z. Wang, H. Zhang, B. Wang, X.H. Bao, Interface-confined ferrous centers for catalytic oxidation, Science 328 (2010) 1141-1144, https://doi: 10.1126/science.1188267. [3] E.J. Peterson A.T. DeLaRiva S. Lin R.S. Johnson H. Guo J.T. Miller J.H. Kwak C.H.F. Peden B. Kiefer L.F. Allard F.H. Ribeiro A.K. Datye Low-temperature carbon monoxide oxidation catalysed by regenerable atomically dispersed palladium on alumina Nat. Commun 5 2014 4885 10.1038/ncomms5885 E.J. Peterson, A.T. DeLaRiva, S. Lin, R.S. Johnson, H. Guo, J.T. Miller, J.H. Kwak, C. H.F. Peden, B. Kiefer, L.F. Allard, F.H. Ribeiro, A.K. Datye, Low-temperature carbon monoxide oxidation catalysed by regenerable atomically dispersed palladium on alumina, Nat. Commun. 5 (2014) 4885, https://doi: 10.1038/ncomms5885. [4] M.D. Esrafili P. Mousavian Boosting graphene reactivity with co-boron and nitrogen atoms: CO oxidation by O2 molecule Applied Surface Science 455 2018 808 814 10.1016/j.apsusc.2018.06.053 M.D. Esrafili, P. Mousavian, Boosting graphene reactivity with co-boron and nitrogen atoms: CO oxidation by O2 molecule, Applied Surface Science 455 (2018) 808-814, https://doi: org/10.1016/j.apsusc.2018.06.053. [5] W. Bi Y.J. Hu W. Li H. Jiang C.Z. Li Construction of Nanoreactors Combining Two-Dimensional Hexagonal Boron Nitride (h-BN) Coating with Pt/Al2O3 Catalyst toward Efficient Catalysis for CO Oxidation Industrial Engineering Chemistry Research 57 2018 13353 13361 10.1021/acs.iecr.8b02547 W. Bi, Y. J. Hu, W. Li, H. Jiang, C.Z. Li, Construction of Nanoreactors Combining Two-Dimensional Hexagonal Boron Nitride (h-BN) Coating with Pt/Al2O3 Catalyst toward Efficient Catalysis for CO Oxidation, Industrial Engineering Chemistry Research 57 (2018) 13353-13361. https://doi: 10.1021/acs.iecr.8b02547. [6] X.L. Lei G. Mbamalu C.Y. Qin CO Oxidation by Molecular and Atomic Oxygen on Ag (100): A Density Functional Theory Study Journal of Physical Chemistry C 121 2017 2635 2642 10.1021/acs.jpcc.6b09105 X.L. Lei, G. Mbamalu, C.Y. Qin, CO Oxidation by Molecular and Atomic Oxygen on Ag (100): A Density Functional Theory Study, Journal of Physical Chemistry C 121 (2017) 2635-2642, https://doi: 10.1021/acs.jpcc.6b09105. [7] E.D. Cera M.L. Doyle P.R. Connelly S.J Carbon monoxide binding to human hemoglobin A0 Biochemistry 26 1987 6494 6502 https://doi:0006-2960/87/0426-6494 E.D. Cera, M.L. Doyle, P.R. Connelly, S.J, Carbon monoxide binding to human hemoglobin A0, Biochemistry 26 (1987) 6494-6502, https://doi: 0006-2960/87/0426-6494. [8] E.D. Cera M.L. Doyle M.S. Morgan R.D. Cristofaro R. Landolfi B. Bizzi M. Castagnola S.J. Gill Carbon monoxide and oxygen binding to human hemoglobin F0 Biochemistry 28 1989 2631 https://doi:0006-2960/89/0428-2631 E.D. Cera, M.L. Doyle, M.S. Morgan, R.D. Cristofaro, R. Landolfi, B. Bizzi, M. Castagnola, S.J. Gill, Carbon monoxide and oxygen binding to human hemoglobin F0, Biochemistry 28 (1989) 2631, https://doi: 0006-2960/89/0428-2631. [9] Z.S. Lu P. Lv Y.L. Liang D.W. Ma Y. Zhang W.J. Zhang X.W. Yang Z.X. Yang CO oxidation catalyzed by the single Co atom embedded hexagonal boron nitride nanosheet: a DFT-D study Phys Chem Chem Phys 18 2016 21865 21870 10.1039/c6cp02221a Z.S. Lu, P. Lv, Y.L. Liang, D.W. Ma, Y. Zhang, W.J. Zhang, X.W. Yang, Z.X. Yang, CO oxidation catalyzed by the single Co atom embedded hexagonal boron nitride nanosheet: a DFT-D study, Phys Chem Chem Phys 18 (2016) 21865-21870, https://doi: 10.1039/c6cp02221a. [10] B.T. Qiao A.Q. Wang X.F. Yang L.F. Allard Z. Jiang Y.T. Cui J.Y. Liu J. Li T. Zhang Single-atom catalysis of CO oxidation using Pt1/FeOx Nat Chem 3 2011 634 641 10.1038/NCHEM.1095 B.T. Qiao, A.Q. Wang, X.F. Yang, L.F. Allard, Z. Jiang, Y.T. Cui, J.Y. Liu, J. Li, T. Zhang, Single-atom catalysis of CO oxidation using Pt1/FeOx, Nat Chem 3 (2011) 634-641, https://doi: 10.1038/NCHEM.1095. [11] M.J.S. Farias W. Cheuquepan A.A. Tanaka J.M. Feliu Nonuniform Synergistic Effect of Sn and Ru in Site-Specific Catalytic Activity of Pt at Bimetallic Surfaces toward CO Electro-oxidation ACS Catalysis 7 2017 3434 3445 10.1021/acscatal.7b00257 M.J.S. Farias, W. Cheuquepan, A.A. Tanaka, J.M. Feliu, Nonuniform Synergistic Effect of Sn and Ru in Site-Specific Catalytic Activity of Pt at Bimetallic Surfaces toward CO Electro-oxidation, ACS Catalysis 7 (2017) 3434-3445, https://doi: 10.1021/acscatal.7b00257. [12] P. Begum R.C. Deka Effect of Charge on the Catalytic Activity of CO Oxidation by zeolite Supported Single Site Palladium: A Density Functional Study ChemistrySelect 2 2017 8847 8855 10.1002/slct.201701578 P. Begum, R.C. Deka, Effect of Charge on the Catalytic Activity of CO Oxidation by zeolite Supported Single Site Palladium: A Density Functional Study, ChemistrySelect 2 (2017) 8847-8855, https://doi: 10.1002/slct.201701578. [13] Z.S. Lu P. Lv Z.X. Yang S. Li D.W. Ma R.Q. Wu A promising single atom catalyst for CO oxidation: Ag on boron vacancies of h-BN sheets Phys Chem Chem Phys 19 2017 16795 16805 10.1039/c7cp02430d Z.S. Lu, P. Lv, Z.X. Yang, S. Li, D.W. Ma, R.Q. Wu, A promising single atom catalyst for CO oxidation: Ag on boron vacancies of h-BN sheets, Phys Chem Chem Phys 19 (2017) 16795-16805, https://doi: 10.1039/c7cp02430d. [14] R. Zeng M. Feller Y.D. Posner L.J.W. Shimon Y.B. David D. Milstein CO Oxidation by N2O Homogeneously Catalyzed by Ruthenium Hydride Pincer Complexes Indicating a New Mechanism J Am Chem Soc 140 2018 7061 7064 10.1021/jacs.8b03927 R. Zeng, M. Feller, Y.D. Posner, L.J. W. Shimon, Y.B. David, D. Milstein, CO Oxidation by N2O Homogeneously Catalyzed by Ruthenium Hydride Pincer Complexes Indicating a New Mechanism, J Am Chem Soc 140 (2018) 7061-7064, https://doi: 10.1021/jacs.8b03927. [15] X. Zhou Q. Shen K.D. Yuan W.S. Yang Q.W. Chen Z.H. Geng J.L. Zhang X. Shao W. Chen G.Q. Xu X.M. Yang K. Wu Unraveling Charge State of Supported Au Single-Atoms during CO Oxidation J Am Chem Soc 140 2018 554 557 10.1021/jacs.7b10394 X. Zhou, Q. Shen, K.D. Yuan, W.S. Yang, Q.W. Chen, Z.H. Geng, J.L. Zhang, X. Shao, W. Chen, G.Q. Xu, X.M. Yang, K. Wu, Unraveling Charge State of Supported Au Single-Atoms during CO Oxidation, J Am Chem Soc 140 (2018) 554-557, https://doi: 10.1021/jacs.7b10394. [16] G.L. Xu R. Wang Y.C. Ding Z.S. Lu D.W. Ma Z.X. Yang First-Principles Study on the Single Ir Atom Embedded Graphdiyne: An Efficient Catalyst for CO Oxidation The Journal of Physical Chemistry C 122 2018 23481 23492 10.1021/acs.jpcc.8b06739 G.L. Xu, R. Wang, Y.C. Ding, Z.S. Lu, D.W. Ma, Z.X. Yang, First-Principles Study on the Single Ir Atom Embedded Graphdiyne: An Efficient Catalyst for CO Oxidation, The Journal of Physical Chemistry C 122 (2018) 23481-23492, https://doi: 10.1021/acs.jpcc.8b06739. [17] K. Almeida P. Pena T.B. Rawal W.C. Coley A.A. Akhavi M. Wurch K. Yamaguchi D. Le T.S. Rahman L. Bartels A Single Layer of MoS2 Activates Gold for Room Temperature CO Oxidation on an Inert Silica Substrate The Journal of Physical Chemistry C 123 2019 6592 6598 10.1021/acs.jpcc.8b12325 K. Almeida, P. Pena, T.B. Rawal, W.C. Coley, A.A. Akhavi, M. Wurch, K. Yamaguchi, D. Le, T.S. Rahman, L. Bartels, A Single Layer of MoS2 Activates Gold for Room Temperature CO Oxidation on an Inert Silica Substrate, The Journal of Physical Chemistry C 123 (2019) 6592-6598, https://doi: 10.1021/acs.jpcc.8b12325. [18] L. Zhang I.A.W. Filot Y.Q. Su J.X. Liu E.J.M. Hensen Understanding the Impact of Defects on Catalytic CO Oxidation of LaFeO3‑Supported Rh, Pd, and Pt Single-Atom Catalysts The Journal of Physical Chemistry C. 123 2019 7290 7298 10.1021/acs.jpcc.9b01520 L. Zhang, I.A.W. Filot, Y.Q. Su, J.X. Liu, E.J.M. Hensen, Understanding the Impact of Defects on Catalytic CO Oxidation of LaFeO3‑Supported Rh, Pd, and Pt Single-Atom Catalysts, The Journal of Physical Chemistry C. 123 (2019) 7290-7298, https://doi:10.1021/acs.jpcc.9b01520. [19] M.A. Yu Y.X. Feng L.Y. Gao S. Lin Phosphomolybdic acid supported single-metal-atom catalysis in CO oxidation: first-principles calculations Phys Chem Chem Phys 20 2018 20661 20668 10.1039/c8cp03916j M.A. Yu, Y.X. Feng, L.Y. Gao, S. Lin, Phosphomolybdic acid supported single-metal-atom catalysis in CO oxidation: first-principles calculations, Phys Chem Chem Phys 20 (2018) 20661-20668, https://doi: 10.1039/c8cp03916j. [20] X.N. Li L.N. Wang L.H. Mou S.G. He Catalytic CO Oxidation by Gas-Phase Metal Oxide Clusters The Journal of Physical Chemistry A 123 2019 9257 9267 10.1021/acs.jpca.9b05185 X.N. Li, L.N. Wang, L. H. Mou, S.G. He, Catalytic CO Oxidation by Gas-Phase Metal Oxide Clusters, The Journal of Physical Chemistry A 123 (2019) 9257-9267, https://doi: 10.1021/acs.jpca.9b05185. [21] C.Y. Jia X.J. Wang W.H. Zhong Z.Z. Wang O.V. Prezhdo Y. Luo J. Jiang Catalytic Chemistry Predicted by a Charge Polarization Descriptor: Synergistic O2 Activation and CO Oxidation by Au–Cu Bimetallic Clusters on TiO2(101) ACS Applied Materials & Interfaces 11 2019 9629 9640 10.1021/acsami.9b00925 C.Y. Jia, X.J. Wang, W.H. Zhong, Z.Z. Wang, O.V. Prezhdo, Y. Luo, J. Jiang, Catalytic Chemistry Predicted by a Charge Polarization Descriptor: Synergistic O2 Activation and CO Oxidation by Au–Cu Bimetallic Clusters on TiO2(101), ACS Applied Materials & Interfaces 11 (2019) 9629-9640, https://doi: 10.1021/acsami.9b00925. [22] J. Lin X.D. Wang T. Zhang Recent progress in CO oxidation over Pt-group-metal catalysts at low temperatures Chinese Journal of Catalysis 37 2016 1805 1813 10.1016/S1872-2067(16)62513-5 J. Lin, X.D. Wang, T. Zhang, Recent progress in CO oxidation over Pt-group-metal catalysts at low temperatures, Chinese Journal of Catalysis 37 (2016) 1805-1813, https://doi: 10.1016/S1872‐2067(16)62513-5. [23] J.X. Liang X.F. Yang C.Q. Xu T. Zhang J. Li Catalytic ativities of single-atom catalysts for CO oxidation: Pt1/FeOx vs. Fe1/FeOx Chinese Journal of Catalysis 38 2017 566 1573 10.1016/S1872-2067(17)62879-1 J.X. Liang, X.F. Yang, C.Q. Xu, T. Zhang, J. Li, Catalytic ativities of single-atom catalysts for CO oxidation: Pt1/FeOx vs. Fe1/FeOx, Chinese Journal of Catalysis 38 (2017) 566-1573, https://doi: 10.1016/S1872‐2067(17)62879-1. [24] B.T. Qiao J.X. Liang A.Q. Wang J.Y. Liu T. Zhang Single atom gold catalysts for low-temperature CO oxidation Chinese Journal of Catalysis 37 2016 1580 1586 10.1016/S1872-2067(16)62529-9 B.T. Qiao, J.X. Liang, A.Q. Wang, J.Y. Liu, T. Zhang, Single atom gold catalysts for low-temperature CO oxidation, Chinese Journal of Catalysis 37 (2016) 1580-1586, https://doi: 10.1016/S1872‐2067(16)62529-9. [25] Y. Lou Y. Cai W. Hu L. Wang Q. Dai W. Zhan Y. Guo P. Hu X.M. Cao J. Liu Y. Guo Identification of Active Area as Active Center for CO Oxidation over Single Au Atom Catalyst ACS Catalysis 10 2020 6094 6101 10.1021/acscatal.0c01303 Y. Lou, Y. Cai, W. Hu, L. Wang, Q. Dai, W. Zhan, Y. Guo, P. Hu, X.M. Cao, J. Liu, Y. Guo, Identification of Active Area as Active Center for CO Oxidation over Single Au Atom Catalyst, ACS Catalysis 10 (2020) 6094-6101, https://dx.doi.org/10.1021/acscatal.0c01303. [26] A.S. Konopatsky D.V. Leybo K.L. Firestein Z.I. Popov A.V. Bondarev A.M. Manakhov E.S. Permyakova D.V. Shtansky D.V. Golberg Synthetic routes, structure and catalytic activity of Ag/BN nanoparticle hybrids toward CO oxidation reaction Journal of Catalysis 368 2018 217 227 10.1016/j.jcat.2018.10.016 A.S. Konopatsky, D.V. Leybo, K.L. Firestein, Z.I. Popov, A.V. Bondarev, A. M. Manakhov, E.S. Permyakova, D.V Shtansky, D.V. Golberg, Synthetic routes, structure and catalytic activity of Ag/BN nanoparticle hybrids toward CO oxidation reaction, Journal of Catalysis 368 (2018) 217-227, https://doi.org/10.1016/j.jcat.2018.10.016. [27] T.M. Tran-Thuy C.C. Chen S.D. Lin Spectroscopic Studies of How Moisture Enhances CO Oxidation over Au/BN at Ambient Temperature ACS Catalysis 7 2017 4304 4312 10.1021/acscatal.7b01374 T.M. Tran-Thuy, C.C. Chen, S.D. Lin, Spectroscopic Studies of How Moisture Enhances CO Oxidation over Au/BN at Ambient Temperature, ACS Catalysis 7 (2017) 4304-4312, https://doi: 10.1021/acscatal.7b01374. [28] M. Sun Q. Fu L. Gao Y. Zheng Y. Li M. Chen X. Bao Catalysis under shell: Improved CO oxidation reaction confined in Pt@h-BN core–shell nanoreactors Nano Research 10 2017 1403 1412 10.1007/s12274-017-1512-8 M. Sun, Q Fu, L. Gao, Y. Zheng, Y. Li, M. Chen, X. Bao, Catalysis under shell: Improved CO oxidation reaction confined in Pt@h-BN core–shell nanoreactors, Nano Research 10 (2017) 1403-1412, https://doi: 10.1007/s12274-017-1512-8. [29] P. Zhao Y. Su Y. Zhang S.J. Li G. Chen CO catalytic oxidation on iron-embedded hexagonal boron nitride sheet Chemical Physics Letters 515 2011 159 162 10.1016/j.cplett.2011.09.034 P. Zhao, Y. Su, Y. Zhang, S.J. Li, G. Chen, CO catalytic oxidation on iron-embedded hexagonal boron nitride sheet, Chemical Physics Letters 515 (2011) 159-162, https://doi: 10.1016/j.cplett.2011.09.034. [30] Q.G. Jiang Z.M. Ao S. Li Z. Wen Density functional theory calculations on the CO catalytic oxidation on Al-embedded grapheme RSC Advances 4 2014 20290 20296 10.1039/C4RA01908C Q.G. Jiang, Z.M. Ao, S. Li, Z. Wen, Density functional theory calculations on the CO catalytic oxidation on Al-embedded grapheme, RSC Advances. 4 (2014) 20290-20296, https://doi: 10.1039/C4RA01908C. [31] F.Y. Li J.J. Zhao Z.F. Chen Fe-Anchored Graphene Oxide: A Low-Cost and Easily Accessible Catalyst for Low-Temperature CO Oxidation The Journal of Physical Chemistry C 116 2012 2507 2514 10.1021/jp209572d F.Y. Li, J.J. Zhao, Z.F. Chen, Fe-Anchored Graphene Oxide: A Low-Cost and Easily Accessible Catalyst for Low-Temperature CO Oxidation, The Journal of Physical Chemistry C 116 (2012) 2507-2514, https://doi: org/10.1021/jp209572d. [32] Y. Lou J. Ma X. Cao L. Wang Q. Dai Z. Zhao Y. Cai W. Zhan Y. Guo P. Hu G. Lu Y. Guo Promoting Effects of In2O3 on Co3O4 for CO Oxidation: Tuning O2 Activation and CO Adsorption Strength Simultaneously ACS Catalysis 4 2014 4143 4152 10.1021/cs501049r Y. Lou, J. Ma, X. Cao, L. Wang, Q. Dai, Z. Zhao, Y. Cai, W. Zhan, Y. Guo, P. Hu, G. Lu, Y. Guo, Promoting Effects of In2O3 on Co3O4 for CO Oxidation: Tuning O2 Activation and CO Adsorption Strength Simultaneously, ACS Catalysis 4 (2014) 4143-4152, https://dx.doi.org/10.1021/cs501049r. [33] Y. Lou L. Wang Z. Zhao Y. Zhang Z. Zhang G. Lu Y. Guo Y. Guo Low-temperature CO oxidation over Co3O4-based catalysts: Significant promoting effect of Bi2O3 on Co3O4 catalyst Applied Catalysis B: Environmental 146 2014 43 49 10.1016/j.apcatb.2013.06.007 Y. Lou, L. Wang, Z. Zhao, Y. Zhang, Z. Zhang, G. Lu, Y. Guo, Y. Guo, Low-temperature CO oxidation over Co3O4-based catalysts: Significant promoting effect of Bi2O3 on Co3O4 catalyst, Applied Catalysis B: Environmental 146 (2014) 43-49, https://doi.org/10.1016/j.apcatb.2013.06.007. [34] Y. Lou X.M. Cao J.G. Lan L. Wang Q. Dai Y. Guo J. Ma Z. Zhao Y. Guo P. Hu G.Z. Lu Ultralow-temperature CO oxidation on an In2O3-Co3O4 catalyst: a strategy to tune CO adsorption strength and oxygen activation simultaneously Chem Commun (Camb) 50 2014 6835 6838 10.1039/c4cc00036f Y. Lou, X.M. Cao, J.G. Lan, L. Wang, Q. Dai, Y. Guo, J. Ma, Z. Zhao, Y. Guo, P. Hu, G.Z. Lu, Ultralow-temperature CO oxidation on an In2O3-Co3O4 catalyst: a strategy to tune CO adsorption strength and oxygen activation simultaneously, Chem Commun (Camb) 50 (2014) 6835-6838, https://doi: 10.1039/c4cc00036f. [35] Y. Lou L. Wang Y. Zhang Z. Zhao Z. Zhang G. Lu Y. Guo The effects of Bi2O3 on the CO oxidation over Co3O4 Catalysis Today 175 2011 610 614 10.1016/j.cattod.2011.03.064 Y. Lou, L. Wang, Y. Zhang, Z. Zhao, Z. Zhang, G. Lu, Y. Guo, The effects of Bi2O3 on the CO oxidation over Co3O4, Catalysis Today 175 (2011) 610-614, https://doi:10.1016/j.cattod.2011.03.064. [36] Y. Yu T. Takei H. Ohashi H. He X. Zhang M. Haruta Pretreatments of Co3O4 at moderate temperature for CO oxidation at −80°C Journal of Catalysis 267 2009 121 128 10.1016/j.jcat.2009.08.003 Y. Yu, T. Takei, H. Ohashi, H. He, X. Zhang, M. Haruta, Pretreatments of Co3O4 at moderate temperature for CO oxidation at −80°C, Journal of Catalysis 267 (2009) 121-128, https://doi:10.1016/j.jcat.2009.08.003. [37] X. Xie Y. Li Z.Q. Liu M. Haruta W. Shen Low-temperature oxidation of CO catalysed by Co3O4 nanorods Nature 458 2009 746 749 10.1038/nature07877 X. Xie, Y. Li, Z.Q. Liu, M. Haruta, W. Shen, Low-temperature oxidation of CO catalysed by Co(3)O(4) nanorods, Nature 458 (2009) 746-749, https://doi: 10.1038/nature07877. [38] S. Wannakao T. Nongnual P. Khongpracha T. Maihom J. Limtrakul Reaction Mechanisms for CO Catalytic Oxidation by N2O on Fe-Embedded Graphene The Journal of Physical Chemistry C 116 2012 16992 16998 10.1021/jp3035192 S. Wannakao, T. Nongnual, P.Khongpracha, T. Maihom, J. Limtrakul, Reaction Mechanisms for CO Catalytic Oxidation by N2O on Fe-Embedded Graphene, The Journal of Physical Chemistry C 116 (2012) 16992-16998, https://doi: org/10.1021/jp3035192. [39] R. Mandapaka S. Bachu C. Srivastava G. Madras Microkinetic Modeling of CO Oxidation over FePt-Decorated Graphene Oxide Industrial & Engineering Chemistry Research 56 2017 8465 8473 10.1021/acs.iecr.7b01935 R. Mandapaka, S. Bachu, C. Srivastava, G. Madras, Microkinetic Modeling of CO Oxidation over FePt-Decorated Graphene Oxide, Industrial & Engineering Chemistry Research 56 (2017) 8465-8473, https://doi: 10.1021/acs.iecr.7b01935. [40] J. Liu Catalysis by Supported Single Metal Atoms ACS Catalysis 7 2016 34 59 10.1021/acscatal.6b01534 J. Liu, Catalysis by Supported Single Metal Atoms, ACS Catalysis 7 (2016) 34-59, https://doi: 10.1021/acscatal.6b01534. [41] A. Wang J. Li T. Zhang Heterogeneous single-atom catalysis Nature Reviews Chemistry 2 2018 65 81 10.1038/s41570-018-0010-1 A. Wang, J. Li, T Zhang, Heterogeneous single-atom catalysis, Nature Reviews Chemistry 2 (2018) 65-81, https://doi.org/10.1038/s41570-018-0010-1. [42] X.F. Yang A. Wang B. Qiao J. Li J. Liu T. Zhang Single-Atom Catalysts: A New Frontier in Heterogeneous Catalysis Accounts of Chemical Research 46 2013 1740 1748 10.1021/ar300361m X.F. Yang, A. Wang, B. Qiao, J. Li, J. Liu, Zhang, T, Single-Atom Catalysts: A New Frontier in Heterogeneous Catalysis, Accounts of Chemical Research 46 (2013) 1740-1748, https://doi: 10.1021/ar300361m. [43] Y. Lou Y.P. Zheng X. Li N. Ta J. Xu Y.F. Nie K. Cho J.Y. Liu Pocketlike Active Site of Rh1/MoS2 Single-Atom Catalyst for Selective Crotonaldehyde Hydrogenation Journal of the American Chemical Society 141 2019 19289 19295 10.1021/jacs.9b06628 Y. Lou, Y.P. Zheng, X. Li, N. Ta, J. Xu, Y.F. Nie, K. Cho, J.Y. Liu, Pocketlike Active Site of Rh1/MoS2 Single-Atom Catalyst for Selective Crotonaldehyde Hydrogenation, Journal of the American Chemical Society 141 (2019) 19289-19295, https://doi: 10.1021/jacs.9b06628. [44] Y. Lou J. Xu Y. Zhang C. Pan Y. Dong Y. Zhu Metal-Support Interaction for Heterogeneous Catalysis: from Nanoparticles to Single Atoms Materials Today Nano 2020 10.1016/j.mtnano.2020.100093 Y. Lou, J. Xu, Y. Zhang, C. Pan, Y. Dong, Y. Zhu, Metal-Support Interaction for Heterogeneous Catalysis: from Nanoparticles to Single Atoms, Materials Today Nano: (2020) https://doi: 10.1016/j.mtnano.2020.100093 [45] G. Postole A. Gervasini M. Caldararu B. Bonnetot A. Auroux Is BN an appropriate support for metal oxide catalysts? Applied Catalysis A General 325 2007 227 236 10.1016/j.apcata.2007.03.025 G. Postole, A. Gervasini, M. Caldararu, B. Bonnetot, A. Auroux, Is BN an appropriate support for metal oxide catalysts? Applied Catalysis A General 325 (2007) 227-236, https://doi: 10.1016/j.apcata.2007.03.025. [46] C.R. Dean A.F. Young I. Meric C. Lee L. Wang S. Sorgenfrei K. Watanabe T. Taniguchi P. Kim K.L. Shepard J. Hone Boron nitride substrates for high-quality graphene electronics Nat Nanotechnol 5 2010 722 726 10.1038/NNANO.2010.172 C.R. Dean, A.F. Young, I. Meric, C. Lee, L. Wang, S. Sorgenfrei, K. Watanabe, T.Taniguchi, P. Kim, K.L. Shepard, J. Hone, Boron nitride substrates for high-quality graphene electronics, Nat Nanotechnol 5 (2010) 722-726, https://doi: 10.1038/NNANO.2010.172. [47] K. Watanabe T. Taniguchi H. Kanda Direct-bandgap properties and evidence for ultraviolet lasing of hexagonal boron nitride single crystal Nat Mater 3 2004 404 409 10.1038/nmat1134 K. Watanabe, T. Taniguchi, H. Kanda, Direct-bandgap properties and evidence for ultraviolet lasing of hexagonal boron nitride single crystal, Nat Mater 3 (2004) 404-409, https://doi: 10.1038/nmat1134. [48] H. Pan Y.P. Feng J.Y. Lin Boron nitride and carbon double-wall hetero-nanotubes: first-principles calculation of electronic properties Nanotechnology 19 2008 095707 10.1088/09574484/19/9/095707 H. Pan, Y.P. Feng, J.Y. Lin, Boron nitride and carbon double-wall hetero-nanotubes: first-principles calculation of electronic properties, Nanotechnology 19 (2008) 095707. https://doi: 10.1088/09574484/19/9/095707. [49] C. Zhi Y. Bando C.C. Tang H. Kuwahara D. Golberg Large-Scale Fabrication of Boron Nitride Nanosheets and Their Utilization in Polymeric Composites with Improved Thermal and Mechanical Properties Advanced Materials 21 2009 2889 2893 10.1002/adma.200900323 C. Zhi, Y. Bando, C.C. Tang, H. Kuwahara, D. Golberg, Large-Scale Fabrication of Boron Nitride Nanosheets and Their Utilization in Polymeric Composites with Improved Thermal and Mechanical Properties, Advanced Materials 21 (2009) 2889-2893, https://doi: 10.1002/adma.200900323. [50] J.C.S. Wu W.C. Chen A novel BN supported bi-metal catalyst for selective hydrogenation of crotonaldehyde Applied Catalysis A General 289 2005 179 185 10.1016/j.apcata.2005.04.044 J.C.S. Wu, W.C. Chen, A novel BN supported bi-metal catalyst for selective hydrogenation of crotonaldehyde, Applied Catalysis A General 289 (2005) 179-185, https://doi: 10.1016/j.apcata.2005.04.044. [51] Y. Lin C.E. Bunker K.A.S. Femando J.W. Connell Aqueously dispersed silver nanoparticle-decorated boron nitride nanosheets for reusable, thermal oxidation-resistant surface enhanced Raman spectroscopy (SERS) devices ACS Appl Mater Interfaces 4 2012 1110 1117 10.1021/am201747d Y. Lin, C.E. Bunker, K.A.S. Femando, J.W. Connell, Aqueously dispersed silver nanoparticle-decorated boron nitride nanosheets for reusable, thermal oxidation-resistant surface enhanced Raman spectroscopy (SERS) devices, ACS Appl Mater Interfaces 4 (2012) 1110-1117, https://doi: org/10.1021/am201747d. [52] G.B. Grad P. Blaha K. Schwarz Density functional theory investigation of the geometric and spintronic structure of h-BN/Ni (111) in view of photoemission and STM experiments Physical Review B 68 2003 085404 10.1103/PhysRevB.68.085404 G.B. Grad, P. Blaha, K. Schwarz, Density functional theory investigation of the geometric and spintronic structure of h-BN/Ni (111) in view of photoemission and STM experiments, Physical Review B 68 (2003) 085404, https://doi: 10.1103/PhysRevB.68.085404. [53] C.J. Huang X.X. Ye C. Chen S. Lin D.Q. Xie A computational investigation of CO oxidation on ruthenium-embedded hexagonal boron nitride nanosheet Computational and Theoretical Chemistry 1011 2013 5 10 10.1016/j.comptc.2013.02.004 C.J. Huang, X.X. Ye, C. Chen, S. Lin, D.Q. Xie, A computational investigation of CO oxidation on ruthenium-embedded hexagonal boron nitride nanosheet, Computational and Theoretical Chemistry 1011 (2013) 5-10, https://doi: org/10.1016/j.comptc.2013.02.004. [54] S. Lin J. Huang X.M. Gao A. Cu (111) supported h-BN nanosheet: a potential low-cost and high-performance catalyst for CO oxidation Phys Chem Chem Phys 17 2015 22097 22105 10.1039/C5CP03027G S. Lin, J. Huang, X. M. Gao, A Cu (111) supported h-BN nanosheet: a potential low-cost and high-performance catalyst for CO oxidation, Phys Chem Chem Phys 17 (2015) 22097-22105, https://doi: 10.1039/C5CP03027G. [55] S. Lin X.X. Ye R.S. Johnson H. Guo First-Principles Investigations of Metal (Cu, Ag, Au, Pt, Rh, Pd, Fe, Co, and Ir) Doped Hexagonal Boron Nitride Nanosheets: Stability and Catalysis of CO Oxidation The Journal of Physical Chemistry C 117 2013 17319 17326 10.1021/jp4055445 S. Lin, X.X. Ye, R.S. Johnson, H.Guo, First-Principles Investigations of Metal (Cu, Ag, Au, Pt, Rh, Pd, Fe, Co, and Ir) Doped Hexagonal Boron Nitride Nanosheets: Stability and Catalysis of CO Oxidation, The Journal of Physical Chemistry C 117 (2013) 17319-17326, https://doi: org/10.1021/jp4055445. [56] M.J. Frisch G.W. Trucks H.B. Schlegel G.E. Scuseria M.A. Robb J.R. Cheeseman G. Scalmani V. Barone B. Mennucci G.A. Petersson Gaussian 09., Revision D. 01, Gaussian09. Inc Wallingford CT 2009 M.J. Frisch, G.W. Trucks, H.B. Schlegel, G.E. Scuseria, M.A. Robb, J.R. Cheeseman, G. Scalmani, V. Barone, B. Mennucci, G.A. Petersson, Gaussian 09, Revision D. 01, Gaussian. Inc Wallingford CT (2009). [57] C. Gonzalez H.B. Schlegel An improved algorithm for reaction path following The Journal of Chemical Physics 90 1989 2154 2161 10.1063/1.456010 C. Gonzalez, H.B. Schlegel, An improved algorithm for reaction path following, The Journal of Chemical Physics 90 (1989) 2154-2161, https://doi: org/10.1063/1.456010. [58] E.D. Glendening C.R. Landis F. Weinhold Natural bond orbital methods, Wiley Interdisciplinary Reviews Computational Molecular Science 2 2012 1 42 10.1002/wcms.51 E.D. Glendening, C.R. Landis, F. Weinhold, Natural bond orbital methods, Wiley Interdisciplinary Reviews Computational Molecular Science 2 (2012) 1-42, https://doi: 10.1002/wcms.51. [59] J.R. Cheeseman G.W. Trucks T.A. Keith M.J. Frisch A comparison of models for calculating nuclear magnetic resonance shielding tensors The Journal of Chemical Physics 104 1996 5497 5509 10.1063/1.471789 J.R. Cheeseman, G.W. Trucks, T.A. Keith, M.J. Frisch, A comparison of models for calculating nuclear magnetic resonance shielding tensors, The Journal of Chemical Physics 104 (1996) 5497-5509, https://doi: org/10.1063/1.471789. [60] K. Wolinski J.F. Hinton P. Pulay Efficient implementation of the gauge-independent atomic orbital method for NMR chemical shift calculations J Am Chem Soc 12 1990 8251 8260 https://doi:0002-78631901I512-825ISOZ.SO/O K. Wolinski, J.F. Hinton, P. Pulay, Efficient implementation of the gauge-independent atomic orbital method for NMR chemical shift calculations, J Am Chem Soc 12 (1990) 8251-8260, https://doi: 0002-78631901 I5 12-825 I SOZ.SO/O. [61] B. Liu J.Y. Lee S.H. Yan Enhanced Catalytic Oxidation of CO on Sulfur-Doped Boron Nitride ChemNanoMat 6 2019 223 231 10.1002/cnma.201900516 B. Liu, J.Y. Lee, S.H. Yan, Enhanced Catalytic Oxidation of CO on Sulfur-Doped Boron Nitride, ChemNanoMat 6 (2019) 223-231, https://doi: 10.1002/cnma.201900516. [62] Z.P. Liu X.Q. Gong J. Kohanoff C. Sanchez P. Hu Catalytic role of metal oxides in gold-based catalysts: a first principles study of CO oxidation on TiO2 supported Au Phys Rev Lett 91 2003 266102 10.1103/PhysRevLett.91.266102 Z.P. Liu, X.Q. Gong, J. Kohanoff, C. Sanchez, P. Hu, Catalytic role of metal oxides in gold-based catalysts: a first principles study of CO oxidation on TiO2 supported Au, Phys Rev Lett 91 (2003) 266102, https://doi: 10.1103/PhysRevLett.91.266102. [63] T.K. Ghosh N.N. Nair Rh1/γ-Al2O3Single-Atom Catalysis of O2Activation and CO Oxidation: Mechanism, Effects of Hydration, Oxidation State, and Cluster Size ChemCatChem 5 2013 1811 1821 10.1002/cctc.201200799 T.K. Ghosh, N.N. Nair, Rh1/γ-Al2O3Single-Atom Catalysis of O2Activation and CO Oxidation: Mechanism, Effects of Hydration, Oxidation State, and Cluster Size, ChemCatChem 5 (2013) 1811-1821, https://doi: 10.1002/cctc.201200799. [64] M. Okumura Y. Kitagawa M. Haruta K. Yamaguchi The interaction of neutral and charged Au clusters with O2, CO and H2 Applied Catalysis A General 291 2005 37 44 10.1016/j.apcata.2005.02.042 M. Okumura, Y. Kitagawa, M. Haruta, K. Yamaguchi, The interaction of neutral and charged Au clusters with O2, CO and H2, Applied Catalysis A General 291 (2005) 37-44, https://doi: 10.1016/j.apcata.2005.02.042. [65] S. Lin X.X. Ye J. Huang Can metal-free silicon-doped hexagonal boron nitride nanosheets and nanotubes exhibit activity toward CO oxidation? Phys Chem Chem Phys 17 2015 888 895 10.1039/c4cp05007j S. Lin, X.X. Ye, J. Huang, Can metal-free silicon-doped hexagonal boron nitride nanosheets and nanotubes exhibit activity toward CO oxidation? Phys Chem Chem Phys 17 (2015) 888-895, https://doi: 10.1039/c4cp05007j. [66] C.Q. Ma B.P. Liu H. Wang S.H. Yan Catalytic Mechanism of CO Oxidation on Three-Silicon-Doped Hexagonal Boron Nitride ChemNanoMat 5 2019 1202 1208 10.1002/cnma.201900274 C.Q. Ma, B.P. Liu, H. Wang, S.H. Yan, Catalytic Mechanism of CO Oxidation on Three-Silicon-Doped Hexagonal Boron Nitride, ChemNanoMat 5 (2019) 1202-1208, https://doi: 10.1002/cnma.201900274. [67] G.L. Gutsev B.K. Rao P. Jena Systematic study of oxo, peroxo, and superoxo isomers of 3d-metal dioxides and their anions The Journal of Physical Chemistry A 104 2000 11961 11971 10.1021/jp002252s CCC G.L. Gutsev, B.K. Rao, P. Jena, Systematic study of oxo, peroxo, and superoxo isomers of 3d-metal dioxides and their anions, The Journal of Physical Chemistry A 104 (2000) 11961-11971, https://doi: 10.1021/jp002252s CCC. [68] X.L. Zhang Z.S. Lu G.L. Xu T.X. Wang D.W. Ma Z.X. Yang L. Yang Single Pt atom stabilized on nitrogen doped graphene: CO oxidation readily occurs via the tri-molecular Eley-Rideal mechanism Phys Chem Chem Phys 17 2015 20006 20013 10.1039/c5cp01922b X.L. Zhang, Z.S. Lu, G.L. Xu, T.X. Wang, D.W. Ma, Z.X. Yang, L. Yang, Single Pt atom stabilized on nitrogen doped graphene: CO oxidation readily occurs via the tri-molecular Eley-Rideal mechanism, Phys Chem Chem Phys 17 (2015) 20006-20013, https://doi: 10.1039/c5cp01922b. [69] X. Liu T. Duan Y.H. Sui C.G. Meng Y. Han Copper atoms embedded in hexagonal boron nitride as potential catalysts for CO oxidation: a first-principles investigation Rsc Advances 00 2014 1 11 10.1039/C4RA06436D X. Liu, T. Duan, Y.H. Sui, C.G. Meng, Y. Han, Copper atoms embedded in hexagonal boron nitride as potential catalysts for CO oxidation: a first-principles investigation, Rsc Advances 00 (2014) 1-11, https://doi: 10.1039/C4RA06436D. [70] X. Liu T. Duan C.G. Meng Y. Han Pt atoms stabilized on hexagonal boron nitride as efficient single-atom catalysts for CO oxidation: a first-principles investigation Rsc Advances 5 2015 10452 10459 10.1039/c4ra14482a X. Liu, T. Duan, C.G. Meng, Y. Han, Pt atoms stabilized on hexagonal boron nitride as efficient single-atom catalysts for CO oxidation: a first-principles investigation, Rsc Advances 5 (2015) 10452-10459, https://doi: 10.1039/c4ra14482a. [71] X. Liu Y.H. Sui T. Duan C.G. Meng Y. Han Monodisperse Pt atoms anchored on N-doped graphene as efficient catalysts for CO oxidation: a first-principles investigation Catalysis Science & Technology 5 2015 1658 1667 10.1039/C4CY01327A X. Liu, Y.H. Sui, T. Duan, C.G. Meng, Y. Han, Monodisperse Pt atoms anchored on N-doped graphene as efficient catalysts for CO oxidation: a first-principles investigation, Catalysis Science & Technology 5 (2015) 1658-1667, https://doi: 10.1039/C4CY01327A.",
      "scopus-id": "85089486059",
      "coredata": {
        "eid": "1-s2.0-S2468823120304284",
        "dc:description": "Conversion of CO into CO2 is a prototypical reaction in heterogeneous catalysis and is extensively studied to explore the underlying mechanisms of related reaction. A detailed mechanism exploration was carried out for CO oxidation catalyzed by single Fe atom adsorbed hexagonal boron nitride (h-BN) at room temperature. DFT calculations demonstrate the enhancement of catalytic activity of h-BN for CO oxidation upon Fe-adsorbing. The substitution of iron significantly decreases the energy difference between the HOMO and LUMO in h-BN. The positively charged Fe atom in dopant favors the capture of O2 molecule and serves as the catalytic active site for CO oxidation reaction. Energetically, the adsorbed Fe atom prefers to reside in N vacancy (V N-Fe) rather than B vacancy, with the energy barriers for the generation of two CO2 molecules are 1.18 eV and 0.76 eV, respectively. The rate determining step is the first oxygen transfer, as attributes to the significant charge transfer from Fe-adsorbed h-BN to O2. The enhanced catalytic activity implies that Fe-adsorbed h-BN has potential application for the development of low-cost, non-toxic monoatomic catalysts.",
        "openArchiveArticle": "false",
        "prism:coverDate": "2020-11-30",
        "openaccessUserLicense": null,
        "prism:aggregationType": "Journal",
        "prism:url": "https://api.elsevier.com/content/article/pii/S2468823120304284",
        "dc:creator": [
          {
            "@_fa": "true",
            "$": "Ma, Chaoqun"
          },
          {
            "@_fa": "true",
            "$": "Liu, Bingping"
          },
          {
            "@_fa": "true",
            "$": "Yan, Shihai"
          }
        ],
        "link": [
          {
            "@_fa": "true",
            "@rel": "self",
            "@href": "https://api.elsevier.com/content/article/pii/S2468823120304284"
          },
          {
            "@_fa": "true",
            "@rel": "scidir",
            "@href": "https://www.sciencedirect.com/science/article/pii/S2468823120304284"
          }
        ],
        "dc:format": "application/json",
        "openaccessType": null,
        "pii": "S2468-8231(20)30428-4",
        "prism:volume": "495",
        "articleNumber": "111165",
        "prism:publisher": "Elsevier B.V.",
        "dc:title": "Enhanced catalytic activity for CO oxidation by Fe-Adsorbing on BN under mild condition: A promising single-atom catalyst",
        "prism:copyright": "© 2020 Elsevier B.V. All rights reserved.",
        "openaccess": "0",
        "prism:issn": "24688231",
        "dcterms:subject": [
          {
            "@_fa": "true",
            "$": "h-BN"
          },
          {
            "@_fa": "true",
            "$": "Fe-adsorbing"
          },
          {
            "@_fa": "true",
            "$": "Single atom catalyst"
          },
          {
            "@_fa": "true",
            "$": "CO Oxidation"
          },
          {
            "@_fa": "true",
            "$": "Density Functional Theory"
          }
        ],
        "openaccessArticle": "false",
        "prism:publicationName": "Molecular Catalysis",
        "openaccessSponsorType": null,
        "prism:pageRange": "111165",
        "pubType": "fla",
        "prism:coverDisplayDate": "November 2020",
        "prism:doi": "10.1016/j.mcat.2020.111165",
        "prism:startingPage": "111165",
        "dc:identifier": "doi:10.1016/j.mcat.2020.111165",
        "openaccessSponsorName": null
      },
      "objects": {
        "object": [
          {
            "@category": "standard",
            "@height": "581",
            "@width": "376",
            "@_fa": "true",
            "$": "https://api.elsevier.com/content/object/eid/1-s2.0-S2468823120304284-gr4.jpg?httpAccept=%2A%2F%2A",
            "@multimediatype": "JPEG image file",
            "@type": "IMAGE-DOWNSAMPLED",
            "@size": "62412",
            "@ref": "gr4",
            "@mimetype": "image/jpeg"
          },
          {
            "@category": "standard",
            "@height": "191",
            "@width": "376",
            "@_fa": "true",
            "$": "https://api.elsevier.com/content/object/eid/1-s2.0-S2468823120304284-gr3.jpg?httpAccept=%2A%2F%2A",
            "@multimediatype": "JPEG image file",
            "@type": "IMAGE-DOWNSAMPLED",
            "@size": "18117",
            "@ref": "gr3",
            "@mimetype": "image/jpeg"
          },
          {
            "@category": "standard",
            "@height": "328",
            "@width": "470",
            "@_fa": "true",
            "$": "https://api.elsevier.com/content/object/eid/1-s2.0-S2468823120304284-gr2.jpg?httpAccept=%2A%2F%2A",
            "@multimediatype": "JPEG image file",
            "@type": "IMAGE-DOWNSAMPLED",
            "@size": "44292",
            "@ref": "gr2",
            "@mimetype": "image/jpeg"
          },
          {
            "@category": "standard",
            "@height": "200",
            "@width": "353",
            "@_fa": "true",
            "$": "https://api.elsevier.com/content/object/eid/1-s2.0-S2468823120304284-ga1.jpg?httpAccept=%2A%2F%2A",
            "@multimediatype": "JPEG image file",
            "@type": "IMAGE-DOWNSAMPLED",
            "@size": "24269",
            "@ref": "ga1",
            "@mimetype": "image/jpeg"
          },
          {
            "@category": "standard",
            "@height": "206",
            "@width": "565",
            "@_fa": "true",
            "$": "https://api.elsevier.com/content/object/eid/1-s2.0-S2468823120304284-gr1.jpg?httpAccept=%2A%2F%2A",
            "@multimediatype": "JPEG image file",
            "@type": "IMAGE-DOWNSAMPLED",
            "@size": "42740",
            "@ref": "gr1",
            "@mimetype": "image/jpeg"
          },
          {
            "@category": "standard",
            "@height": "601",
            "@width": "378",
            "@_fa": "true",
            "$": "https://api.elsevier.com/content/object/eid/1-s2.0-S2468823120304284-gr7.jpg?httpAccept=%2A%2F%2A",
            "@multimediatype": "JPEG image file",
            "@type": "IMAGE-DOWNSAMPLED",
            "@size": "62209",
            "@ref": "gr7",
            "@mimetype": "image/jpeg"
          },
          {
            "@category": "standard",
            "@height": "222",
            "@width": "470",
            "@_fa": "true",
            "$": "https://api.elsevier.com/content/object/eid/1-s2.0-S2468823120304284-gr6.jpg?httpAccept=%2A%2F%2A",
            "@multimediatype": "JPEG image file",
            "@type": "IMAGE-DOWNSAMPLED",
            "@size": "31807",
            "@ref": "gr6",
            "@mimetype": "image/jpeg"
          },
          {
            "@category": "standard",
            "@height": "341",
            "@width": "470",
            "@_fa": "true",
            "$": "https://api.elsevier.com/content/object/eid/1-s2.0-S2468823120304284-gr5.jpg?httpAccept=%2A%2F%2A",
            "@multimediatype": "JPEG image file",
            "@type": "IMAGE-DOWNSAMPLED",
            "@size": "52641",
            "@ref": "gr5",
            "@mimetype": "image/jpeg"
          },
          {
            "@category": "thumbnail",
            "@height": "164",
            "@width": "106",
            "@_fa": "true",
            "$": "https://api.elsevier.com/content/object/eid/1-s2.0-S2468823120304284-gr4.sml?httpAccept=%2A%2F%2A",
            "@multimediatype": "GIF image file",
            "@type": "IMAGE-THUMBNAIL",
            "@size": "6815",
            "@ref": "gr4",
            "@mimetype": "image/gif"
          },
          {
            "@category": "thumbnail",
            "@height": "112",
            "@width": "219",
            "@_fa": "true",
            "$": "https://api.elsevier.com/content/object/eid/1-s2.0-S2468823120304284-gr3.sml?httpAccept=%2A%2F%2A",
            "@multimediatype": "GIF image file",
            "@type": "IMAGE-THUMBNAIL",
            "@size": "7466",
            "@ref": "gr3",
            "@mimetype": "image/gif"
          },
          {
            "@category": "thumbnail",
            "@height": "153",
            "@width": "219",
            "@_fa": "true",
            "$": "https://api.elsevier.com/content/object/eid/1-s2.0-S2468823120304284-gr2.sml?httpAccept=%2A%2F%2A",
            "@multimediatype": "GIF image file",
            "@type": "IMAGE-THUMBNAIL",
            "@size": "11058",
            "@ref": "gr2",
            "@mimetype": "image/gif"
          },
          {
            "@category": "thumbnail",
            "@height": "124",
            "@width": "219",
            "@_fa": "true",
            "$": "https://api.elsevier.com/content/object/eid/1-s2.0-S2468823120304284-ga1.sml?httpAccept=%2A%2F%2A",
            "@multimediatype": "GIF image file",
            "@type": "IMAGE-THUMBNAIL",
            "@size": "9115",
            "@ref": "ga1",
            "@mimetype": "image/gif"
          },
          {
            "@category": "thumbnail",
            "@height": "80",
            "@width": "219",
            "@_fa": "true",
            "$": "https://api.elsevier.com/content/object/eid/1-s2.0-S2468823120304284-gr1.sml?httpAccept=%2A%2F%2A",
            "@multimediatype": "GIF image file",
            "@type": "IMAGE-THUMBNAIL",
            "@size": "8068",
            "@ref": "gr1",
            "@mimetype": "image/gif"
          },
          {
            "@category": "thumbnail",
            "@height": "164",
            "@width": "103",
            "@_fa": "true",
            "$": "https://api.elsevier.com/content/object/eid/1-s2.0-S2468823120304284-gr7.sml?httpAccept=%2A%2F%2A",
            "@multimediatype": "GIF image file",
            "@type": "IMAGE-THUMBNAIL",
            "@size": "6404",
            "@ref": "gr7",
            "@mimetype": "image/gif"
          },
          {
            "@category": "thumbnail",
            "@height": "103",
            "@width": "219",
            "@_fa": "true",
            "$": "https://api.elsevier.com/content/object/eid/1-s2.0-S2468823120304284-gr6.sml?httpAccept=%2A%2F%2A",
            "@multimediatype": "GIF image file",
            "@type": "IMAGE-THUMBNAIL",
            "@size": "7458",
            "@ref": "gr6",
            "@mimetype": "image/gif"
          },
          {
            "@category": "thumbnail",
            "@height": "159",
            "@width": "219",
            "@_fa": "true",
            "$": "https://api.elsevier.com/content/object/eid/1-s2.0-S2468823120304284-gr5.sml?httpAccept=%2A%2F%2A",
            "@multimediatype": "GIF image file",
            "@type": "IMAGE-THUMBNAIL",
            "@size": "10226",
            "@ref": "gr5",
            "@mimetype": "image/gif"
          },
          {
            "@category": "standard",
            "@_fa": "true",
            "$": "https://api.elsevier.com/content/object/eid/1-s2.0-S2468823120304284-mmc1.docx?httpAccept=%2A%2F%2A",
            "@multimediatype": "Microsoft Word file",
            "@type": "APPLICATION",
            "@size": "2940118",
            "@ref": "mmc1",
            "@mimetype": "application/word"
          },
          {
            "@category": "standard",
            "@_fa": "true",
            "$": "https://api.elsevier.com/content/object/eid/1-s2.0-S2468823120304284-am.pdf?httpAccept=%2A%2F%2A",
            "@multimediatype": "Acrobat PDF file",
            "@type": "AAM-PDF",
            "@size": "1455517",
            "@ref": "am",
            "@mimetype": "application/pdf"
          }
        ]
      },
      "link": {
        "@rel": "abstract",
        "@href": "https://api.elsevier.com/content/abstract/scopus_id/85089486059"
      }
    }
  }
}