{
  "metadata": {
    "title": "Tuning the basicity of Cu-based mixed oxide catalysts towards the efficient conversion of glycerol to glycerol carbonate",
    "authors": "; ; ",
    "journal": "Molecular Catalysis",
    "date": "2018-12-31",
    "doi": "10.1016/j.mcat.2018.09.002",
    "abstract": "",
    "uri": "https://api.elsevier.com/content/article/pii/S2468823118303894",
    "pii": "S2468823118303894"
  },
  "fulltext": {
    "full-text-retrieval-response": {
      "scopus-eid": "2-s2.0-85053457769",
      "originalText": "serial JL 315758 291210 291744 291790 291809 31 Molecular Catalysis MOLECULARCATALYSIS 2018-09-19 2018-09-19 2018-09-19 2018-09-19 2018-10-25T12:53:25 1-s2.0-S2468823118303894 S2468-8231(18)30389-4 S2468823118303894 10.1016/j.mcat.2018.09.002 S300 S300.1 FULL-TEXT 1-s2.0-S2468823118X00169 2018-12-11T05:58:05.550106Z 0 0 20181201 20181231 2018 2018-09-19T01:01:58.25405Z absattachment articleinfo articletitlenorm authfirstinitialnorm authfirstsurnamenorm cid cids contenttype copyright crossmark dateloaded dateloadedtxt datesearch datesort dateupdated dco docsubtype doctype doi eid ewtransactionid hubeid indexeddate issn issnnorm itemstage itemtransactionid itemweight openaccess openarchive pg pgfirst pglast pii piinorm pubdateend pubdatestart pubdatetxt pubyr sectiontitle sortorder srctitle srctitlenorm srctype ssids alllist content subj subheadings suppl tomb volfirst volissue volumelist webpdf webpdfpagecount yearnav figure table e-component body acknowledge affil appendices articletitle auth authfirstini authfull authkeywords authlast grantsponsor highlightsabst primabst ref specialabst 2468-8231 24688231 true 460 460 C Volume 460 9 53 62 53 62 201812 December 2018 2018-12-01 2018-12-31 2018 Regular Papers article fla © 2018 Elsevier B.V. All rights reserved. TUNINGBASICITYCUBASEDMIXEDOXIDECATALYSTSTOWARDSEFFICIENTCONVERSIONGLYCEROLGLYCEROLCARBONATE MARIMUTHU M 1 Introduction 2 Experimental section 2.1 Synthesis of Cu-based mixed oxide catalysts 2.2 Characterization techniques 2.3 Catalytic activity test 3 Results and discussion 3.1 X-ray diffraction 3.2 Textural properties 3.3 Scanning electron microscopy 3.4 Transmission electron microscopy 3.5 CO2-TPD analysis 3.6 X-ray photoelectron spectroscopy 4 Catalytic activity for the transesterification of glycerol with DMC 4.1 Cu loading 4.2 Reaction temperature 4.3 Glycerol to DMC mole ratio 4.4 Catalyst loading 4.5 Catalyst recyclability 4.6 Plausible reaction mechanism 5 Conclusion Acknowledgments Appendix A Supplementary data References HUBER 2006 4044 4098 G MALYAADRI 2011 153 157 M PAGLIARO 2007 4434 4440 M ZHOU 2008 527 549 C BEHR 2008 13 30 A SONNATI 2013 283 306 M SHAIKH 1996 951 976 A ROKICKI 2005 529 539 G ARESTA 2006 149 153 M GEORGE 2009 1 7 J ZHANG 2015 1077 1085 J LARI 2017 16200 16211 G OCHOAGOMEZ 2009 315 324 J BAI 2011 777 781 R PARAMESWARAM 2013 3242 3249 G SONG 2017 77 85 X CLIMENT 2010 140 149 M BASAG 2016 122 130 S KUMAR 2015 12543 12552 P SINGH 2014 18786 18795 D DU 2012 1069 1077 M SANTHANALAKSHMI 1996 69 80 J LIU 2014 135 143 P CAVANI 1991 173 301 F MANIKANDAN 2016 153 162 M NISHIMURA 2013 2026 2042 S BORGES 2012 2839 2849 M ZHANG 2017 5982 5993 J RAO 1998 115 121 K SALOMAO 2011 3063 3070 R CORMA 2005 340 347 A TAKAGAKI 2010 578 581 A FERREIRA 2009 58 63 K LI 2010 6699 6708 M DEBECKER 2009 3920 3935 D NAGPURE 2015 1463 1472 A BRAVOSUAREZ 2012 18207 18221 J VELU 2000 373 S ZHANG 2013 102404 J AKHAVAN 2011 12935 12940 O DAMODARA 2014 189 198 D AKHAVAN 2011 9634 9640 O ADDARI 2011 816 822 D GERPEN 2005 1097 1107 J SREE 2009 152 157 R HAMMOND 2011 3927 C LIU 2014 152 160 Z MARIMUTHUX2018X53 MARIMUTHUX2018X53X62 MARIMUTHUX2018X53XM MARIMUTHUX2018X53X62XM 2020-09-19T00:00:00.000Z 2020-09-19T00:00:00.000Z http://creativecommons.org/licenses/by-nc-nd/4.0/ © 2018 Elsevier B.V. All rights reserved. item S2468-8231(18)30389-4 S2468823118303894 1-s2.0-S2468823118303894 10.1016/j.mcat.2018.09.002 315758 2018-12-11T05:58:05.550106Z 2018-12-01 2018-12-31 1-s2.0-S2468823118303894-main.pdf https://s3-eu-west-1.amazonaws.com/prod-ucs-content-store-eu-west/content/pii:S2468823118303894/MAIN/application/pdf/1f0a594190ed0671566a613eeeaf9f96/main.pdf https://s3.amazonaws.com/prod-ucs-content-store-us-east/content/pii:S2468823118303894/MAIN/application/pdf/1f0a594190ed0671566a613eeeaf9f96/main.pdf main.pdf pdf true 4665773 MAIN 10 1-s2.0-S2468823118303894-main_1.png https://s3-eu-west-1.amazonaws.com/prod-ucs-content-store-eu-west/content/pii:S2468823118303894/PREVIEW/image/png/38ae44eb0d5c8341fd31a3d239124e8a/main_1.png https://s3.amazonaws.com/prod-ucs-content-store-us-east/content/pii:S2468823118303894/PREVIEW/image/png/38ae44eb0d5c8341fd31a3d239124e8a/main_1.png main_1.png png 54073 849 656 IMAGE-WEB-PDF 1 1-s2.0-S2468823118303894-ga1.sml https://s3-eu-west-1.amazonaws.com/prod-ucs-content-store-eu-west/content/pii:S2468823118303894/ga1/THUMBNAIL/image/gif/8b10ca8c47d5c92f1400220ab6a4e6bc/ga1.sml https://s3.amazonaws.com/prod-ucs-content-store-us-east/content/pii:S2468823118303894/ga1/THUMBNAIL/image/gif/8b10ca8c47d5c92f1400220ab6a4e6bc/ga1.sml ga1 true ga1.sml sml 10151 144 219 IMAGE-THUMBNAIL 1-s2.0-S2468823118303894-gr1.sml https://s3-eu-west-1.amazonaws.com/prod-ucs-content-store-eu-west/content/pii:S2468823118303894/gr1/THUMBNAIL/image/gif/24e4457d7043e553f472bdc9b4bb835d/gr1.sml https://s3.amazonaws.com/prod-ucs-content-store-us-east/content/pii:S2468823118303894/gr1/THUMBNAIL/image/gif/24e4457d7043e553f472bdc9b4bb835d/gr1.sml gr1 gr1.sml sml 8836 164 190 IMAGE-THUMBNAIL 1-s2.0-S2468823118303894-gr10.sml https://s3-eu-west-1.amazonaws.com/prod-ucs-content-store-eu-west/content/pii:S2468823118303894/gr10/THUMBNAIL/image/gif/42688677680a6540d462b9649fabea14/gr10.sml https://s3.amazonaws.com/prod-ucs-content-store-us-east/content/pii:S2468823118303894/gr10/THUMBNAIL/image/gif/42688677680a6540d462b9649fabea14/gr10.sml gr10 gr10.sml sml 8276 164 212 IMAGE-THUMBNAIL 1-s2.0-S2468823118303894-gr11.sml https://s3-eu-west-1.amazonaws.com/prod-ucs-content-store-eu-west/content/pii:S2468823118303894/gr11/THUMBNAIL/image/gif/5c64a3d38e264f10ba18bfcca67d5ce4/gr11.sml https://s3.amazonaws.com/prod-ucs-content-store-us-east/content/pii:S2468823118303894/gr11/THUMBNAIL/image/gif/5c64a3d38e264f10ba18bfcca67d5ce4/gr11.sml gr11 gr11.sml sml 6249 164 198 IMAGE-THUMBNAIL 1-s2.0-S2468823118303894-gr2.sml https://s3-eu-west-1.amazonaws.com/prod-ucs-content-store-eu-west/content/pii:S2468823118303894/gr2/THUMBNAIL/image/gif/a7d1ae3142dadf36aaa457bc7210a9ad/gr2.sml https://s3.amazonaws.com/prod-ucs-content-store-us-east/content/pii:S2468823118303894/gr2/THUMBNAIL/image/gif/a7d1ae3142dadf36aaa457bc7210a9ad/gr2.sml gr2 gr2.sml sml 11537 164 192 IMAGE-THUMBNAIL 1-s2.0-S2468823118303894-gr3.sml https://s3-eu-west-1.amazonaws.com/prod-ucs-content-store-eu-west/content/pii:S2468823118303894/gr3/THUMBNAIL/image/gif/4ee25815469639f2f6afad660052f60b/gr3.sml https://s3.amazonaws.com/prod-ucs-content-store-us-east/content/pii:S2468823118303894/gr3/THUMBNAIL/image/gif/4ee25815469639f2f6afad660052f60b/gr3.sml gr3 gr3.sml sml 9179 138 219 IMAGE-THUMBNAIL 1-s2.0-S2468823118303894-gr4.sml https://s3-eu-west-1.amazonaws.com/prod-ucs-content-store-eu-west/content/pii:S2468823118303894/gr4/THUMBNAIL/image/gif/7f13920430b971365a1ab172fd8b008a/gr4.sml https://s3.amazonaws.com/prod-ucs-content-store-us-east/content/pii:S2468823118303894/gr4/THUMBNAIL/image/gif/7f13920430b971365a1ab172fd8b008a/gr4.sml gr4 gr4.sml sml 23846 164 215 IMAGE-THUMBNAIL 1-s2.0-S2468823118303894-gr5.sml https://s3-eu-west-1.amazonaws.com/prod-ucs-content-store-eu-west/content/pii:S2468823118303894/gr5/THUMBNAIL/image/gif/c41a7cc30ccde1ac2c86a29f5bac69c6/gr5.sml https://s3.amazonaws.com/prod-ucs-content-store-us-east/content/pii:S2468823118303894/gr5/THUMBNAIL/image/gif/c41a7cc30ccde1ac2c86a29f5bac69c6/gr5.sml gr5 gr5.sml sml 17427 164 165 IMAGE-THUMBNAIL 1-s2.0-S2468823118303894-gr6.sml https://s3-eu-west-1.amazonaws.com/prod-ucs-content-store-eu-west/content/pii:S2468823118303894/gr6/THUMBNAIL/image/gif/f4457bc6a03f662cd9aae03d1288e39f/gr6.sml https://s3.amazonaws.com/prod-ucs-content-store-us-east/content/pii:S2468823118303894/gr6/THUMBNAIL/image/gif/f4457bc6a03f662cd9aae03d1288e39f/gr6.sml gr6 gr6.sml sml 9109 164 205 IMAGE-THUMBNAIL 1-s2.0-S2468823118303894-gr7.sml https://s3-eu-west-1.amazonaws.com/prod-ucs-content-store-eu-west/content/pii:S2468823118303894/gr7/THUMBNAIL/image/gif/34fa769ca33e8ede76a0c3922d00d042/gr7.sml https://s3.amazonaws.com/prod-ucs-content-store-us-east/content/pii:S2468823118303894/gr7/THUMBNAIL/image/gif/34fa769ca33e8ede76a0c3922d00d042/gr7.sml gr7 gr7.sml sml 7403 164 189 IMAGE-THUMBNAIL 1-s2.0-S2468823118303894-gr8.sml https://s3-eu-west-1.amazonaws.com/prod-ucs-content-store-eu-west/content/pii:S2468823118303894/gr8/THUMBNAIL/image/gif/b0a464e5dab0b032efc7dc8167d760b3/gr8.sml https://s3.amazonaws.com/prod-ucs-content-store-us-east/content/pii:S2468823118303894/gr8/THUMBNAIL/image/gif/b0a464e5dab0b032efc7dc8167d760b3/gr8.sml gr8 gr8.sml sml 13037 164 219 IMAGE-THUMBNAIL 1-s2.0-S2468823118303894-gr9.sml https://s3-eu-west-1.amazonaws.com/prod-ucs-content-store-eu-west/content/pii:S2468823118303894/gr9/THUMBNAIL/image/gif/e32266abb3232ee9cbef6b9256c09dfb/gr9.sml https://s3.amazonaws.com/prod-ucs-content-store-us-east/content/pii:S2468823118303894/gr9/THUMBNAIL/image/gif/e32266abb3232ee9cbef6b9256c09dfb/gr9.sml gr9 gr9.sml sml 5627 163 219 IMAGE-THUMBNAIL 1-s2.0-S2468823118303894-sc1.sml https://s3-eu-west-1.amazonaws.com/prod-ucs-content-store-eu-west/content/pii:S2468823118303894/sc1/THUMBNAIL/image/gif/c190af0ffcaad9733e3edb11714096a8/sc1.sml https://s3.amazonaws.com/prod-ucs-content-store-us-east/content/pii:S2468823118303894/sc1/THUMBNAIL/image/gif/c190af0ffcaad9733e3edb11714096a8/sc1.sml sc1 sc1.sml sml 2611 39 219 IMAGE-THUMBNAIL 1-s2.0-S2468823118303894-sc2.sml https://s3-eu-west-1.amazonaws.com/prod-ucs-content-store-eu-west/content/pii:S2468823118303894/sc2/THUMBNAIL/image/gif/733e78c787efdd3e2c2fdcd4fd606c5f/sc2.sml https://s3.amazonaws.com/prod-ucs-content-store-us-east/content/pii:S2468823118303894/sc2/THUMBNAIL/image/gif/733e78c787efdd3e2c2fdcd4fd606c5f/sc2.sml sc2 sc2.sml sml 7903 127 219 IMAGE-THUMBNAIL 1-s2.0-S2468823118303894-ga1.jpg https://s3-eu-west-1.amazonaws.com/prod-ucs-content-store-eu-west/content/pii:S2468823118303894/ga1/DOWNSAMPLED/image/jpeg/1c5c95da678a81b7baf0562c357aefc5/ga1.jpg https://s3.amazonaws.com/prod-ucs-content-store-us-east/content/pii:S2468823118303894/ga1/DOWNSAMPLED/image/jpeg/1c5c95da678a81b7baf0562c357aefc5/ga1.jpg ga1 true ga1.jpg jpg 19513 200 303 IMAGE-DOWNSAMPLED 1-s2.0-S2468823118303894-gr1.jpg https://s3-eu-west-1.amazonaws.com/prod-ucs-content-store-eu-west/content/pii:S2468823118303894/gr1/DOWNSAMPLED/image/jpeg/204f5f393774dbb966652cec5907aa02/gr1.jpg https://s3.amazonaws.com/prod-ucs-content-store-us-east/content/pii:S2468823118303894/gr1/DOWNSAMPLED/image/jpeg/204f5f393774dbb966652cec5907aa02/gr1.jpg gr1 gr1.jpg jpg 29679 295 341 IMAGE-DOWNSAMPLED 1-s2.0-S2468823118303894-gr10.jpg https://s3-eu-west-1.amazonaws.com/prod-ucs-content-store-eu-west/content/pii:S2468823118303894/gr10/DOWNSAMPLED/image/jpeg/94938bb460cd6c9d8ddb047699b9b9f2/gr10.jpg https://s3.amazonaws.com/prod-ucs-content-store-us-east/content/pii:S2468823118303894/gr10/DOWNSAMPLED/image/jpeg/94938bb460cd6c9d8ddb047699b9b9f2/gr10.jpg gr10 gr10.jpg jpg 38302 380 492 IMAGE-DOWNSAMPLED 1-s2.0-S2468823118303894-gr11.jpg https://s3-eu-west-1.amazonaws.com/prod-ucs-content-store-eu-west/content/pii:S2468823118303894/gr11/DOWNSAMPLED/image/jpeg/4a4f6384bc298aa36b6d444882436717/gr11.jpg https://s3.amazonaws.com/prod-ucs-content-store-us-east/content/pii:S2468823118303894/gr11/DOWNSAMPLED/image/jpeg/4a4f6384bc298aa36b6d444882436717/gr11.jpg gr11 gr11.jpg jpg 19653 282 341 IMAGE-DOWNSAMPLED 1-s2.0-S2468823118303894-gr2.jpg https://s3-eu-west-1.amazonaws.com/prod-ucs-content-store-eu-west/content/pii:S2468823118303894/gr2/DOWNSAMPLED/image/jpeg/d32988214668d7aa4a610fdb3fa4944c/gr2.jpg https://s3.amazonaws.com/prod-ucs-content-store-us-east/content/pii:S2468823118303894/gr2/DOWNSAMPLED/image/jpeg/d32988214668d7aa4a610fdb3fa4944c/gr2.jpg gr2 gr2.jpg jpg 34245 291 341 IMAGE-DOWNSAMPLED 1-s2.0-S2468823118303894-gr3.jpg https://s3-eu-west-1.amazonaws.com/prod-ucs-content-store-eu-west/content/pii:S2468823118303894/gr3/DOWNSAMPLED/image/jpeg/5bdcc8cc9ba83f54b7cf63b22e040fbe/gr3.jpg https://s3.amazonaws.com/prod-ucs-content-store-us-east/content/pii:S2468823118303894/gr3/DOWNSAMPLED/image/jpeg/5bdcc8cc9ba83f54b7cf63b22e040fbe/gr3.jpg gr3 gr3.jpg jpg 55673 356 567 IMAGE-DOWNSAMPLED 1-s2.0-S2468823118303894-gr4.jpg https://s3-eu-west-1.amazonaws.com/prod-ucs-content-store-eu-west/content/pii:S2468823118303894/gr4/DOWNSAMPLED/image/jpeg/c67c4d0058030c28d09814959858f15e/gr4.jpg https://s3.amazonaws.com/prod-ucs-content-store-us-east/content/pii:S2468823118303894/gr4/DOWNSAMPLED/image/jpeg/c67c4d0058030c28d09814959858f15e/gr4.jpg gr4 gr4.jpg jpg 138390 519 680 IMAGE-DOWNSAMPLED 1-s2.0-S2468823118303894-gr5.jpg https://s3-eu-west-1.amazonaws.com/prod-ucs-content-store-eu-west/content/pii:S2468823118303894/gr5/DOWNSAMPLED/image/jpeg/3f32c7af18d0133adb1624bea3a1b07b/gr5.jpg https://s3.amazonaws.com/prod-ucs-content-store-us-east/content/pii:S2468823118303894/gr5/DOWNSAMPLED/image/jpeg/3f32c7af18d0133adb1624bea3a1b07b/gr5.jpg gr5 gr5.jpg jpg 81578 563 567 IMAGE-DOWNSAMPLED 1-s2.0-S2468823118303894-gr6.jpg https://s3-eu-west-1.amazonaws.com/prod-ucs-content-store-eu-west/content/pii:S2468823118303894/gr6/DOWNSAMPLED/image/jpeg/68ad1fd3674689817403a548efd89404/gr6.jpg https://s3.amazonaws.com/prod-ucs-content-store-us-east/content/pii:S2468823118303894/gr6/DOWNSAMPLED/image/jpeg/68ad1fd3674689817403a548efd89404/gr6.jpg gr6 gr6.jpg jpg 27289 272 341 IMAGE-DOWNSAMPLED 1-s2.0-S2468823118303894-gr7.jpg https://s3-eu-west-1.amazonaws.com/prod-ucs-content-store-eu-west/content/pii:S2468823118303894/gr7/DOWNSAMPLED/image/jpeg/b35fdca9bbdc2919072913a92fefaa5b/gr7.jpg https://s3.amazonaws.com/prod-ucs-content-store-us-east/content/pii:S2468823118303894/gr7/DOWNSAMPLED/image/jpeg/b35fdca9bbdc2919072913a92fefaa5b/gr7.jpg gr7 gr7.jpg jpg 44013 492 567 IMAGE-DOWNSAMPLED 1-s2.0-S2468823118303894-gr8.jpg https://s3-eu-west-1.amazonaws.com/prod-ucs-content-store-eu-west/content/pii:S2468823118303894/gr8/DOWNSAMPLED/image/jpeg/faeb42dd1516326eaadda5ceb02a4bfd/gr8.jpg https://s3.amazonaws.com/prod-ucs-content-store-us-east/content/pii:S2468823118303894/gr8/DOWNSAMPLED/image/jpeg/faeb42dd1516326eaadda5ceb02a4bfd/gr8.jpg gr8 gr8.jpg jpg 32705 255 341 IMAGE-DOWNSAMPLED 1-s2.0-S2468823118303894-gr9.jpg https://s3-eu-west-1.amazonaws.com/prod-ucs-content-store-eu-west/content/pii:S2468823118303894/gr9/DOWNSAMPLED/image/jpeg/a48b6d2db3daf402f69de0f265afbe30/gr9.jpg https://s3.amazonaws.com/prod-ucs-content-store-us-east/content/pii:S2468823118303894/gr9/DOWNSAMPLED/image/jpeg/a48b6d2db3daf402f69de0f265afbe30/gr9.jpg gr9 gr9.jpg jpg 17645 254 341 IMAGE-DOWNSAMPLED 1-s2.0-S2468823118303894-sc1.jpg https://s3-eu-west-1.amazonaws.com/prod-ucs-content-store-eu-west/content/pii:S2468823118303894/sc1/DOWNSAMPLED/image/jpeg/060b2acfcf67ceb7a673bc2b6c857f8f/sc1.jpg https://s3.amazonaws.com/prod-ucs-content-store-us-east/content/pii:S2468823118303894/sc1/DOWNSAMPLED/image/jpeg/060b2acfcf67ceb7a673bc2b6c857f8f/sc1.jpg sc1 sc1.jpg jpg 10950 88 492 IMAGE-DOWNSAMPLED 1-s2.0-S2468823118303894-sc2.jpg https://s3-eu-west-1.amazonaws.com/prod-ucs-content-store-eu-west/content/pii:S2468823118303894/sc2/DOWNSAMPLED/image/jpeg/035f2eaa2bc67f7dece30c62896be91e/sc2.jpg https://s3.amazonaws.com/prod-ucs-content-store-us-east/content/pii:S2468823118303894/sc2/DOWNSAMPLED/image/jpeg/035f2eaa2bc67f7dece30c62896be91e/sc2.jpg sc2 sc2.jpg jpg 34068 285 492 IMAGE-DOWNSAMPLED 1-s2.0-S2468823118303894-mmc1.docx https://s3-eu-west-1.amazonaws.com/prod-ucs-content-store-eu-west/content/pii:S2468823118303894/mmc1/MAIN/application/vnd.openxmlformats-officedocument.wordprocessingml.document/623a43dbefc4240a3ecd8067db2dbffd/mmc1.docx https://s3.amazonaws.com/prod-ucs-content-store-us-east/content/pii:S2468823118303894/mmc1/MAIN/application/vnd.openxmlformats-officedocument.wordprocessingml.document/623a43dbefc4240a3ecd8067db2dbffd/mmc1.docx mmc1 mmc1.docx docx 394500 APPLICATION 1-s2.0-S2468823118303894-am.pdf am am.pdf pdf 2130961 AAM-PDF https://s3-eu-west-1.amazonaws.com/prod-ucs-content-store-eu-west/content/egi:108W1TBQZPS/MAIN/application/pdf/dd77e11aa46b287f1a2e3615e23ddff5/am.pdf https://s3.amazonaws.com/prod-ucs-content-store-us-east/content/egi:108W1TBQZPS/MAIN/application/pdf/dd77e11aa46b287f1a2e3615e23ddff5/am.pdf MCAT 10185 S2468-8231(18)30389-4 10.1016/j.mcat.2018.09.002 Elsevier B.V. Fig. 1 XRD patterns of a) MgAl (O) b) MAC-0.2 c) MAC-0.4 d) MAC-0.6 and e) MAC-0.8 as-synthesized mixed oxides. Fig. 1 Fig. 2 XRD patterns of a) MgAl (O) b) MAC-0.2 c) MAC-0.4 d) MAC-0.6 and e) MAC-0.8 calcined mixed oxides. Fig. 2 Fig. 3 N2 adsorption- desorption isotherm plots (left) and pore size distribution (right) of a) MgAl (O) b) MAC-0.2 c) MAC-0.4 d) MAC-0.6 and e) MAC-0.8 calcined mixed oxides. Fig. 3 Fig. 4 a–d) SEM micrographs, e–h) SEM elemental mapping and i) EDAX of calcined MAC-0.6 mixed oxide. Fig. 4 Fig. 5 (a–c) TEM micrographs and (d) SAED pattern of the calcined MAC-0.6 mixed oxide. Fig. 5 Fig. 6 CO2-TPD profiles of a) MgAl (O) b) MAC-0.2 c) MAC-0.4 d) MAC-0.6 and e) MAC-0.8 calcined mixed oxides. Fig. 6 Fig. 7 XPS spectra recorded for a) Mg 1s b) Cu 2p and c) O 1s core levels of MAC-0.6 calcined mixed oxide. Fig. 7 Fig. 8 Comparison of catalytic activity of different Cu molar ratios and basic site density in the synthesis of GC. Reaction conditions: glycerol: 2 g (21.73 mmol), DMC: 9.78 g (108.5 mmol), catalyst: 0.3 g, temperature: 90 °C and time: 90 min. Fig. 8 Fig. 9 Effect of reaction temperature on glycerol transesterification using MAC-0.6 catalyst. Reaction conditions: glycerol: 2 g (21.73 mmol), DMC: 9.78 g (108.5 mmol), catalyst: 0.3 g and reaction time: 90 min. Fig. 9 Fig. 10 Effect of glycerol to DMC ratio (left) and reaction catalyst loading (right) on glycerol transesterification using a MAC-0.6 catalyst. Reaction conditions: temperature: 90 °C and reaction time: 90 min. Fig. 10 Fig. 11 Reusability of the MAC-0.6 catalyst for transesterification of glycerol. Reaction conditions: glycerol: 2 g (21.73 mmol), DMC: 9.78 g (108.5 mmol), catalyst: 0.3 g, temperature: 90 °C and time: 90 min. Fig. 11 Scheme 1 Schematic representation of the glycerol transesterification with DMC over Cu-based mixed oxides. Scheme 1 Scheme 2 Schematic illustration of plausible reaction pathway of glycerol transesterification over Cu-based mixed oxide catalysts. Scheme 2 Table 1 Physicochemical properties of the Cu-based mixed oxides. Table 1 S. No Catalyst Amount ofCopper (wt%)[a] SurfaceArea(m2/g)[b] Averagepore diameter(nm)[c] Total pore volume (cc/g)[c] Basic sites(mmol g−1)[d] TOF (mmol/gcat·h)[e] Total SB sites 1 MgAl(O) – 147.6 3.9 0.15 0.34 0.28 26.1 2 MAC-0.2 5.2 148.3 4.0 0.17 0.40 0.34 31.2 3 MAC-0.4 10.1 157.1 4.2 0.13 0.63 0.44 37.8 4 MAC-0.6 14.8 165.2 4.3 0.16 0.98 0.82 44.1 5 MAC-0.8 20.4 150.1 3.8 0.10 0.81 0.62 39.9 6 15wt%-Cu/MgAl(O) 15.4 118.6 2.6 0.05 0.48 0.37 32.5 [a]Amount of copper was obtained from ICP-OES analysis. [b] Obtained by BET surface area analysis. [c] Obtained from BJH method. [d] Obtained from CO2-TPD experiments, where SB sites referred strong basic sites. [e] calculated based on the moles of glycerol converted per gram catalyst per hour. Tuning the basicity of Cu-based mixed oxide catalysts towards the efficient conversion of glycerol to glycerol carbonate Marimuthu Manikandan a Marimuthu Prabu b S.K. Ashok Kumar a Palanivelu Sangeetha a ⁎ Rajagopalan Vijayaraghavan a a Department of Chemistry, School of Advanced Sciences, VIT, Vellore, 632014, India Department of Chemistry School of Advanced Sciences VIT Vellore 632014 India b Catalysis & Inorganic Chemistry Division, CSIR-National Chemical Laboratory, Dr. Homi Bhabha Road, Pune, 411 008, India Catalysis & Inorganic Chemistry Division CSIR-National Chemical Laboratory Dr. Homi Bhabha Road Pune 411 008 India ⁎ Corresponding author. Graphical abstract A series of efficient and robust Cu based mixed oxides were synthesized by a simple co-precipitation method and utilized for the production of glycerol carbonate (GC) via transesterification of glycerol with dimethyl carbonate (DMC). The synthesized materials were characterized using XRD, UV–vis spectroscopy, SEM, TEM, N2 sorption, CO2-TPD, and XPS. The addition of Cu on Mg/Al mixed oxides exhibits significant changes in its physicochemical properties and catalytic activity. The obtained mixed oxides showed remarkably high transesterification activity towards the efficient conversion of glycerol to GC under economical reaction conditions without using any solvent. Among all the catalysts employed, highest catalytic activity was observed over MAC-0.6 catalyst with glycerol conversion of 96.4% and GC yield of 91.2%. The improved catalytic performance was observed mainly due to the optimized catalyst molar ratio and strong surface basicity. The strong surface basic sites were greatly attributed to the incorporation of Cu2+ cations in the MgAl (O) periclase that efficiently catalyzed the transesterification of glycerol with DMC. Furthermore, the reported catalyst was robust and could be recycled for more than five times without any significant loss in its catalytic activity. Keywords Copper Mixed oxides Transesterification Glycerol Glycerol carbonate 1 Introduction The utilization of renewable sources for the fine chemical synthesis became revolutionary research area in the perspective of both industry and academia [1]. Owing to the increasing day-by-day demand for renewable biofuels, biodiesel production has received significant attention, as it is a viable alternative to non-renewable fossil fuels as well as other sustainable biofuels [2]. Glycerol, a globally traded commodity chemical which is generated as an undesired side product during the production of biodiesel. Also, the available literatures conferred, 10% of waste glycerol is assigned during every ton of biodiesel production by transesterification of oils with methanol [2]. The utilization of surplus waste glycerol as a low-cost platform molecule stands for a promising substrate to procure value-added chemicals from renewable raw materials [3–5]. Recent research has been mainly centered on the development of modern chemical pathways for the efficient conversion of glycerol to value-added chemicals. Glycerol carbonate (GC) is one of the crucial glycerol derivatives that attract major scientific and industrial interest owing to its distinct physical, chemical properties and uses [6]. Moreover, GC has diverse applications such as a solvent, chemical intermediate, polycarbonates synthesis, glycidol-based polymers, and surfactants etc., [6,7]. Diverse synthesis methodologies have been developed to upgrade a large amount of waste glycerol into GC over the past few decades. Traditionally, GC has been synthesized via the carbonylation of glycerol with carbon monoxide or phosgene [7], but this route has been deserted due to their toxicity and unsafe reactants. Besides, the GC production from glycerol with CO and CO2 also demonstrated, however, these routes suffer from low GC yield and exorbitant operation cost [8–10]. Additionally, the carbonylation synthesis route has severe environmental concerns due to the use of CO, CO2 and the intrinsic crisis to handle it securely both at the laboratory and industrial scale. The production of GC from glycerol and urea also another method for the synthesis of GC, however, the high GC yield can be achieved only the continuous removal of the produced ammonia gas while the reaction progress [11]. Importantly, the transcarbonation with various carbonates process provides a facile approach for GC synthesis owing to the ease of operation and mild reaction conditions [12–16]. Climent et al. reported basic oxides and mixed oxides catalyzed transesterification of ethylene carbonate with glycerol and achieved 98% of GC yield [17]. Among the employed catalytic pathways, the transesterification of glycerol with dimethyl carbonate (DMC) is the most promising route for the production of GC as it is much safer and greener over other methods [15]. Despite various catalyst systems have been explored towards GC synthesis, the requirement for an efficient, single step, economic and environmentally benign catalyst for sustainable GC production still remains. The extensive literature studies proved that the strong surface basic sites rather than the moderate and weak basic sites can efficiently catalyze the transesterification of glycerol with DMC [12]. In recent years, several reports on the synthesis of GC from glycerol using various heterogeneous base catalysts, such as KF-hydroxyapatite composites [13], CaO [18], CaO-La2O3 [19], ZnO/La2O3 [20] and K2CO3-MgO [21], have been accounted. However, in the future perspective of sustainable heterogeneous catalysts, there are still some issues required to be addressed, such as poor GC yield, solvent-free conditions, low reaction temperature and economical operating cost. Hence, the immense attention to a modern approach needs to be developed with the aim of achieving excellent GC production with robust catalyst stability at mild reaction conditions. Transition metal incorporated Mg/Al mixed oxides in the form of layered double hydroxide (LDH) type materials has attracted growing attention in the area of heterogeneous catalysis. The layered Mg/Al-based mixed oxides has many applications in various research fields owing to their atomic level distribution of transition metal cations in the brucite layered structure and the capability to intercalate various interlayer anions [22–25]. Furthermore, LDH derived mixed oxides displays a great potential as a precursor and support to develop a promising catalytic material as it assists high dispersion and firm thermal stability to afford eminent catalytic performance and reusability [24]. One of the most pertinent properties of layered mixed oxides is that they behave as an excellent solid base material. Due to its distinct basic nature, Mg/Al mixed oxide type materials have been extensively explored as heterogeneous solid base catalysts for different organic transformations, such as hydrogenation, transesterification, alkylation and Aldol condensation [25–29]. Salomão et al. reported that the origin of the basic properties of these materials is directly associated with their chemical composition, nature of intercalated ions, structure and thermal activation conditions [30]. The basic sites can be mainly attributed due to the presence of interlayer OH− groups and surface O2− species, which can be assigned as Brønsted and Lewis type basic sites, respectively [17,31]. Additionally, presence of the surface hydroxyl groups favors as charge compensation anions and strongly improve the accessibility of the Brønsted-type basic sites [17,31], whereas, the presence of surface O2- species upon calcination leads to the formation of surface Lewis basic sites [17,23]. Being basic in nature, mixed oxide based materials has been extensively utilized for the GC synthesis in recent years. Malyaadri et al. achieved an appreciable yield of GC over Mg/Al/Zr oxides [2]. Parameswaram et al. showed the Mg/Zr/Sr based mixed oxides are highly active for the production of GC through the transesterification of glycerol with DMC [14]. Takagaki et al. accomplished tunable basic site density of calcined LDHs by altering the Mg/Al ratio and calcination temperature and found that the transesterification activity primarily correlated with surface basic site density [32]. Recently, Liu et al. demonstrated the basicity of Mg/Al mixed oxides can be tuned by the addition of transition metal ions and emphasized that the strong surface basicity has high influence on GC yield [23]. However, an extensive study on the influence of individual metal incorporation on Mg/Al based mixed oxides in favour of glycerol conversion is seldom reported and we considered it is worth investigating. Based on the exhaustive analysis of the reported literature and patents, efforts were made towards achieving a single step conversion of glycerol to GC employing a room temperature synthesized Cu-based mixed oxides as an efficient heterogeneous base catalyst. Herein, the synergistic influence of combining Cu loading on the physicochemical properties and catalytic performance of Mg/Al mixed oxide has been systematically investigated. Moreover, the diverse reaction parameters were optimized and correlated to the GC yield. The appreciable GC yield for more than 91% can be achieved through the fine-tuned surface basicity and optimized reaction conditions. The obtained results clearly indicate the basicity optimized Cu-based mixed oxides have been found to be a promising catalyst towards the highly efficient conversion of glycerol to GC under affordable reaction conditions with robust performance. 2 Experimental section 2.1 Synthesis of Cu-based mixed oxide catalysts The Cu-based mixed oxide catalysts were synthesized by conventional co-precipitation method at room temperature. All chemicals purchased from S D Fine-Chem Limited were directly used without further purification. In a typical synthesis, a 0.25 M of metal precursor solution A was prepared by dissolving Mg (NO3)2. 6H2O, Al (NO3)3. 9H2O and Cu (NO3)2. 3H2O in 100 ml of double distilled water. Precipitating base solution B was prepared by dissolving a 0.5 M of NaOH and 0.25 M of Na2CO3 in 100 ml of double distilled water. The co-precipitation has been done by dropwise addition of metal precursor solution A and base solution B simultaneously into a beaker with gentle stirring. The pH was maintained at 9.5 ± 0.2 and the solution was further stirred for an hour, subsequently, the slurry was allowed for aging at room temperature for 12 h. The obtained precipitate was washed thoroughly with double distilled water to remove the surplus base. Then, the sample was dried in a hot air oven for 12 h at 110 °C. Finally, the obtained sample was calcined at 450 °C for 6 h with a heating rate of 2 °C min−1. For the systematic study, a series of Cu-based mixed oxides Mg3-xAl1Cux (with the ratio of Mg2+:Al3+ cations is 3:1) was prepared with a various molar ratio of Cu (x = 0.2, 0.4, 0.6, 0.8) and denoted as MAC-0.2, MAC-0.4, MAC-0.6 and MAC-0.8, where MAC stands for magnesium, aluminium and copper, respectively. A Cu-free catalyst was synthesized by using the same procedure without adding copper precursor and the obtained sample is denoted as MgAl (O). In addition, 5–20 wt% of Cu loaded on MgAl (O) were synthesized by impregnation method and the calcined sample denoted as x-wt% Cu/MgAl(O), where x stands for the Cu loading in wt%. 2.2 Characterization techniques X-ray diffraction (XRD) data of synthesized powder samples were collected from D8 advance BRUKER (Germany) in the 2θ range between 05°-90°. The Bragg equation is applied to determine the interlayer distance (d) nλ = 2d sin θ, where λ = 0.154 nm. UV–vis spectra of the samples were recorded using JASCO-V670 spectrophotometer. The morphology of the sample was observed using Scanning electron microscopy (SEM) with energy dispersive x-ray analyzer (SEM-EDX) from FEI Nova Nano SEM 450 FE-SEM. Transmission electron microscope (TEM) micrographs of all the materials were recorded by a FEI TECNAI F20 electron microscope operating at 200 kV. The TEM sample was prepared using 2-propanol as a solvent with standard procedure. The copper wt% present in the calcined samples was quantified by Inductively Coupled Plasma-Optical Emission Spectrometry (ICP-OES, Spectro Arcos, FHS-12) analysis. CO2-Temperature Programmed Desorption (CO2-TPD) studies were carried out in Micrometrics 2920 instrument. Nearly 50 mg of powder sample was loaded in “U” shaped quartz tube for CO2-TPD analysis. The sample was pre-treated from room temperature to 450 °C (5 °C/min ramping) using Helium as a carrier gas. For analysis, 10% CO2 in Helium gas mixture was allowed to adsorb on the sample surface and allowed to desorb in a temperature range from room temperature to 900 °C (10 °C /min ramping). The surface area and pore characteristics of the calcined materials were determined by N2 sorption analysis at −196 °C using Quantachrome Instruments version 5.0. The Brunauer–Emmett–Teller (BET) equation was applied to calculate the surface area of the calcined samples from the adsorption branch. Pore size and pore volume measurements are collected from Barret, Joyner, and Halenda (BJH) pore size distribution analysis. Magnesium, copper and oxygen core levels were analyzed with X-Ray Photo Spectrometer from Thermo Fisher Scientific Instruments UK using Al Kα anode (1486.6 eV). 2.3 Catalytic activity test Transesterification of glycerol to GC was carried out in the liquid phase reaction under atmospheric pressure. In a typical batch experiment, 2 g of glycerol, 9.78 g of DMC and 300 mg of catalyst were placed in a 100 ml round bottom flask equipped with a condenser and kept at constant stirring using magnetic stirrer. Subsequently, the desired reaction temperature was achieved by heating the system. The reaction progress was monitored by collecting the samples at regular intervals, cooled and analyzed using High-Pressure Liquid Chromatography (HPLC) by separating the products on an Organic acid H+ (8%) column with 0.005 M sulphuric acid as the mobile phase. The products were identified by the GC–MS analysis. The glycerol conversion, GC selectivity and yield were quantified by using the following equations: 3 Results and discussion 3.1 X-ray diffraction X-ray diffraction patterns of the as-synthesized samples are shown in Fig. 1 . All samples exhibit symmetrical reflections at 11.5°, 23.2°, 60.5° and 61.8° assigned to the (0 0 3), (0 0 6) and (0 0 9) planes, whereas asymmetric reflections at 34.6°, 38.9° and 46.3° assigned to the (0 1 5) (0 1 8), (1 1 0) and (0 1 3) planes. From the diffractogram of the as-synthesized Cu-based mixed oxides, the resemblance in the diffraction pattern consistent with the characteristic patterns for LDH structure (JCPDS no. 41-1428) demonstrating the brucite-like layered mixed oxides were successfully fabricated [33]. The interlayer distance measured from the reflection at 2θ = 11.4° (d003) is 0.76 nm, which is similar to the value reported by Li et al., consistent with the well-known spacing for the interlayer CO3 2− anions [34]. The XRD patterns suggest no peak attributable to CuO is present, which is evidenced that the CuO is highly dispersed in the layered structure. The absence of CuO phases also adverts that the Mg2+ cations are isomorphically substituted by Cu2+ cations in the brucite layers. In Fig. 2 , XRD pattern of the calcined Cu-based samples are shown. The patterns clearly show the disintegration of the layered structure and the formation of mixed oxides due to the heat treatment. After the thermal treatment at 450 °C, the layered structure is completely disappeared and a diffuse diffraction pattern of MgAl (O) periclase (JCPDS no. 4-829), with peaks (2θ = 43.2° and 62.3°) predominantly appeared [25]. Furthermore, the absence of the distinct diffractions for copper oxides in the entire pattern suggests the presence of small CuO nanoparticles or amorphous CuO species. However, at the highest molar ratio of copper (MAC-0.8) upon calcination, a weak reflection and a slight peak broadening at 2θ = 35.5° indicate that the formation of CuO. This suggests that the dispersion of copper is mainly relies on the Cu loadings and the good dispersion can be observed up to MAC-0.6. Further copper loading (MAC-0.8) lead to the agglomeration of Cu species on the layered structure, thus it shows the corresponding CuO peaks in the XRD patterns. The XRD pattern of as-synthesised and a calcined sample of 5–20 wt% of Cu/MgAl (O) is given in the Electronic Supplementary information (ESI) Fig. S1 for the comparison. The XRD pattern of the as-synthesised impregnated samples does not show similar reflection after 10 wt% of Cu loading that inconsistent to the co-precipitated sample, suggests that the layered structure is altered due to impregnation. On the other hand, calcined samples show increase in intensity of reflections with increasing Cu loading (2θ = 35.6°, 38.8° and 48.8°) that corresponds to the CuO which further leads to the formation of large crystallites after thermal treatment. 3.2 Textural properties The textural properties of Cu-based mixed oxides were examined by N2 sorption studies and the corresponding results are given in Table 1 . The BET surface area of pristine MgAl (O) mixed oxide is 147.6 m2/g and the samples consist of the various Cu molar ratio show considerable variation in the surface area. Notably, the sample MAC-0.6 shows a substantial increment in the surface area is about 165.2 m2/g as well as large pore size (4.3 nm). An increase in the surface area by addition of copper loadings might be attributable to the new surface adsorption sites generation originated from the high Cu dispersion along with the enhancement of pore characteristics. Furthermore, a small decrease in the surface area for the MAC-0.8 sample can be ascribed to the agglomeration of CuO on the mixed oxide structure and also higher copper loadings prone to pore blockage as evidenced from the reported literatures [35]. N2 adsorption–desorption isotherms and pore size distribution for calcined samples are shown in Fig. 3 . All Cu-based mixed oxides were presented typical plots that are corresponding to type IV isotherm with H3 hysteresis loops [25]. The pore size distribution of the calcined samples demonstrates that the pores are uniformly ranged from 1 to15 nm. From the N2 sorption studies, it can be concluded that the MAC-0.6 sample shows distinct behavior with highest textural properties among all the prepared materials ascribed to the appropriate Cu molar ratio in the periclase structure. Furthermore, the Cu-based mixed oxides synthesized by impregnated method exhibited considerably low surface area and pore characteristics (Table. S1) as compared to co-precipitation method. The diminishing in textural properties resulting from the impregnation method might be due to the lack of uniform distribution of active species on the support surface. This confirms that the co-precipitation method provides good textural properties over the impregnated catalyst which might be due to the atomic level dispersion of Cu species on layered structure. 3.3 Scanning electron microscopy The surface morphology of Cu based mixed oxides were observed by SEM and the corresponding images are shown in Fig. 4 . The micrographs demonstrate a flower-like morphology of parent layered structure as reported in the literature [36], no change in morphology was observed even after Cu incorporation up to MAC-0.6 sample. The micrographs also demonstrate the uniform dispersion of CuO species on periclase structure, which is consistent with the XRD analysis. Moreover, no agglomeration was observed for MAC-0.6 sample evidenced that the successful incorporation of CuO particles on periclase with strong surface synergism. The elemental mapping (Fig. 4f–h) of the sample surface displayed a very uniform distribution of Mg, Al, Cu and O species. The analyzed EDAX (Fig. 4i) shows the presence of Mg, Al, Cu and O species and the obtained Cu content is 15.2%, which is very close to the ICP-OES results and the stoichiometric amount of precursors taken for the synthesis. The presence of Cu species in the as-synthesized catalysts is further confirmed by UV–vis spectroscopy (ESI, Fig. S2), the UV–vis absorbance increases as the relative quantity of copper increases in the sample, which corroborates that the absorbance behavior of copper oxides with increasing copper content even in the layered structure [37,38]. 3.4 Transmission electron microscopy Fig. 5 depicts the TEM micrographs of the calcined MAC-0.6 sample. The micrographs (Fig. 5a–b) clearly demonstrate assemblies of thin plate-like nanoparticles which are derived from the nucleation at the initial crystallization stage of the layered structure [32]. No hexagonal dimension was observed in the whole sample substantiated the layered structure was converted to mixed oxides after calcination treatment [25]. Moreover, the high magnification micrograph (Fig. 5c) shows the uniform plate-like morphology in the complete system. Notably, no discrete Cu species were observed the entire analysis, emphasized that the highly dispersed nature of copper oxides. The selected area electron diffraction (SAED) pattern (Fig. 5d) with clearly defined electron diffraction spots substantiates the semi-crystalline nature of mixed oxides. The XRD patterns also corroborated that the synthesized mixed oxides exhibited layered structure and had low crystallinity as consistent with the TEM results. 3.5 CO2-TPD analysis The CO2-TPD analysis was carried out to measure the surface basic strength distribution of the Cu-based mixed oxides. Fig. 6 shows representative profiles of CO2 desorption for all mixed oxide samples. As shown in the figure, the pristine MgAl (O) sample shows a broad desorption peak centered at 498 °C, whereas MAC-0.2 and MAC-0.4 samples exhibit two CO2 desorption peaks, including adsorption at weak basic sites located at around 200 °C and strong basic sites located around 450–650 °C. Interestingly, a high-temperature desorption peak appeared for MAC-0.6 and MAC-0.8 samples are attributed to the generation of very strong basic sites. Notably, the appearance of sharp desorption at 600 °C for MAC-0.4 sample specifies the generation of strong basic sites. The origin of weak and strong basic sites in Mg/Al based mixed oxides are mainly attributable to the adsorption of CO2 at the surface Brönsted and Lewis basic sites, which are originated to the presence of OH− groups and O2− ions, respectively [17,23]. Apparently, the basic strength distribution was calculated for all samples and listed in Table 1. Both total and strong basic sites of the samples were monotonously increased with the increment of the Cu content up to MAC-0.6 and show a slight decrease for the MAC-0.8 sample. Among all, MAC-0.6 sample exhibited the highest amount of total basic sites (0.98 mmol g−1) and strong basic sites (0.82 mmol g−1) as well. Furthermore, the strong basicity might be ascribed to the presence of an optimum amount of Cu species on MgAl (O) surface that renders strong Lewis basic sites in great amount. The similar trend was also observed form BET surface area results, which emphasizes that the enhancement in both surface area and strong basic strength was observed for samples up to MAC-0.6 might be due to the appreciable dispersion of copper oxides on periclase structure. Moreover, the impregnated 5–20 wt% of Cu/MgAl (O) samples demonstrates relatively lower basic site density (ESI, Table. S1) compared to the co-precipitated samples attributable to the formation of aggregated Cu species caused by impregnation method. 3.6 X-ray photoelectron spectroscopy The more insights into the surface chemical nature of Cu species have been investigated by XPS analysis and the recorded core levels of Mg 1 s, Cu 2p and O 1 s are shown in Fig. 7 after deconvolution. Fig. 7a depicts the Mg 1 s peak located at 1302.2 eV, two major peaks observed after deconvoluted at 1302 eV and 1303 eV can be assigned Mg(OH)2 and MgO, respectively [39]. Fig. 7b shows the predominant spin-orbit peak for Cu 2p3/2 core level bind energy values at 932.9 eV and its corresponding shake-up satellite peak at 941.6 eV, which are in accordance with the literature reports [40–42]. The deconvoluted spectra clearly conferred that the presence of the predominant Cu2+ state in the sample. The observation of strong satellite peaks in Cu 2p3/2 region further confirms the presence of the Cu2+ chemical state. Furthermore, the recorded O 1 s core levels (Fig. 7c) shows two peaks at 530.6 eV and 529.1 eV corresponds to the surface OH− and O2-, respectively [43]. The deconvoluted profiles of both Mg 1 s and O 1 s core levels clearly demonstrate that the availability of OH− and O2- species, which are responsible for the surface basicity. These results strongly underpin the observations made from the CO2-TPD analysis for Brönsted and Lewis basic sites. 4 Catalytic activity for the transesterification of glycerol with DMC The following parameters have been optimized and the catalytic activity has been correlated well with the catalyst and its characterization techniques data. 4.1 Cu loading The correlation of basic site density and catalytic activity of Cu-based mixed oxide catalysts were studied towards the transesterification activity of glycerol with DMC and the obtained results are depicted in Fig. 8 . The transesterification of glycerol over Cu-based catalysts predominantly resulted in the yield of GC and a small amount of Glycidol (GD) as a side product, as shown in Scheme 1 . The formation of GC from transesterification of glycerol in the absence of any catalyst is negligible. The transesterification activity of MgAl (O) and Cu-based mixed oxides are shown in the Fig. 8 for the sake of comparison. All the Cu-based catalysts showed excellent activity towards transesterification of glycerol compared to bare MgAl (O) periclase. The MgAl (O) catalyst showed relatively less yield of GC (54%) as compared to Cu-based mixed oxide catalysts. The yield of GC increased with increasing Cu loading up to MAC-0.6 catalyst then the slight decrease in the activity was observed for the MAC-0.8 catalyst. Among the catalysts evaluated, the highest activity and TOF was observed for MAC-0.6 with 91.2% of GC yield. All catalysts render GD as a by-product owing to the decarbonylation of GC. The origin of transesterification activity observed for the Cu-based mixed oxide catalysts could be speculated from the observed physicochemical characteristics. From the rational evaluation of the characterization results, MAC-0.6 catalyst shows distinct behavior as compared with other catalysts. It can be clearly seen that MAC-0.6 has highest values of both surface area and strong basic site density (0.82 mmol g−1). The reported literature emphasized that the transesterification reaction is facilitated by surface basic sites and availability of strong Lewis basicity is responsible for the enhanced transesterification activity [44,45]. However, all Cu- based catalysts exhibit a reasonable GC yield due to the presence of an optimum amount of Lewis basic sites. The present results underpin that the strong Lewis basic sites of the Cu-based catalyst play a significant role in acquiring a high yield of GC. Furthermore, the catalytic evaluation of 5–20 wt% of Cu loaded on MgAl (O) were also studied and the results are presented in Table. S1. The catalytic performance of all impregnated catalysts are remarkably lower than that of co-precipitated catalysts. Because impregnation method caused agglomerated Cu species and restrained amount of active site deposition on the support surface while co-precipitation method render homogeneous distribution of Cu species, as evidenced from the textural evaluation results. 4.2 Reaction temperature The obtained results from the screening of various Cu-based catalysts, the MAC-0.6 catalyst is chosen for the further optimization studies, as it exhibited the excellent catalytic performance. The effect of the reaction temperature on transesterification of glycerol was investigated and the obtained results are shown in Fig. 9 . The transesterification reaction was carried out with the temperature range from 50 °C to 130 °C. As depicted in the figure, the glycerol conversion increased monotonously with the increasing reaction temperature from 50 °C to 130 °C. A glycerol conversion of 96.4% was achieved when the reaction temperature was at 90 °C and almost complete conversion noticed at 130 °C, proposed that the rise in reaction temperature led to the enhancement of the glycerol conversion. Furthermore, a gradual decrease in the GC selectivity was observed with the reaction temperature increased from 50 °C to 130 °C. A drastic decrease in the GC selectivity with increasing reaction temperature can be attributed to the consequent increase of GD selectivity. The GD formation is speculated to the decarbonylation of GC and it is more feasible at higher reaction temperatures [14]. Based on the observed results, the optimum reaction temperature is chosen at 90 °C and used for the further studies. 4.3 Glycerol to DMC mole ratio The influence of mole ratios of the reactants was evaluated and the crucial results are shown in Fig. 10 . A less glycerol conversion is observed at a lower glycerol to DMC mole ratio (1:3). A gradual increase in the conversion with an increasing mole ratio was observed and reached a maximum conversion of 96.4% at a mole ratio of 1:5 and show a slight decrease in conversion for 1:10 ratio. On the other hand, the increase in the GC yield observed up to 1:5 M ratios and a substantial decrease in the GC yield was noticed at 1:10 M ratio. This result emphasizes that the GC yield is significantly influenced by the mole ratio of the reactants. A notable observation was found in this study, the yield of GC elevated as the glycerol to DMC ratio increased, consequently the yield GD suppressed gradually. This result also indicates the high DMC concentration favored the transesterification of glycerol to yield GC instead of the GD formation through the decarbonylation of GC. Furthermore, the concentrations of DMC molecules are astringent at low glycerol to DMC ratio, proceeds towards decarbonylation of GC on catalyst surface resulting in high GD yield. 4.4 Catalyst loading The influence of catalyst concentration on the glycerol transesterification was explored and the results are shown in Fig. 10. For this study, the catalyst mass was varied from 100 to 500 mg whereas other parameters were kept constant. The conversion of glycerol was increased with an increment of catalyst concentration. Consequently, the yield of GC enhanced initially with an increase in the catalyst content. A slight decline in both conversion and GC yield was observed at a high catalyst concentration in the reaction mixture might be ascribed to the inadequate catalyst dispersion in the reaction medium. However, the gradual increment of GD selectivity with an increase in the catalyst amount was observed, corroborates that the availability of strong surface basic sites facilitates the decarbonylation after the peak of highest glycerol conversion. These results demonstrate that the yield of GC and GD is in accompanying with the high catalyst concentration performs the transesterification and decarbonylation, respectively. 4.5 Catalyst recyclability The stability of the most active MAC-0.6 catalyst is evaluated by recyclability experiments for five consecutive batch reactions under optimized reaction conditions. For the recyclability study, the catalyst was washed with distilled water and methanol after each run. From the Fig. 11 , the glycerol conversion and GC yield were decreased slightly as the increasing catalytic cycles and 88.6% of GC yield was obtained even at the 5th catalytic cycle. On the other hand, the yield of GD shows a gradual increase in as the increased catalyst cycles conferred that the favor of decarbonylation. The reported catalyst system did not show a drastic decline in its activity conferred the robustness of the Cu-based mixed oxides. To underpin the catalyst sustainability, the spent catalyst was examined by XRD and no differentiable phase change in the XRD pattern (Fig. S3, ESI) suggested that the catalyst is extremely stable even after five catalytic runs. 4.6 Plausible reaction mechanism Based on the results from our studies, a plausible mechanism can be drawn on basis of the basic site distribution over Cu-based mixed metal oxide catalysts. As illustrated in the Scheme 2 , the initial reaction proceeds through the abstraction of acidic proton from primary hydroxyl group of a glycerol molecule by the basic sites of the catalyst to produce corresponding glyceroxide anion and the conjugate acid of the base [46,47]. In the next step, the reaction between glyceroxide anion and DMC leads the methoxide anion and methyl glyceryl carbonate intermediate, consequently the reaction between the formed methoxide anion and conjugate acid from the previous step yielding methanol [19,47]. In the last step, the unstable methyl glyceryl carbonate intermediate undergoes cyclization reaction through nucleophilic attack of the oxygen from the secondary hydroxyl group on the carbonyl carbon eventually converted to GC and methanol. In general, the conventional homogeneous catalyst consists of close contact and facile proton adsorption active sites, the mass transport phenomena is nullified since the reaction proceed via a single phase. On the other hand, for the heterogeneous catalyst, transesterification reaction proceeds via biphasic system so solid base catalyst must overcome the mass transfer limitation. In this context, the glycerol molecule must diffuse from the bulk solution to the catalyst surface, so adequate base strength is imperative to the proton abstraction from the primary hydroxyl group of a glycerol molecule. Moreover, the strong surface basic strength paves more negatively charged glyceroxide anion (C3H7O3 −) and consequently, the free energy of the reaction gets lower [19]. As discussed in the CO2-TPD studies, all the samples show very good basic sites up to 1 mmol density. The in-depth analysis and correlation of the basic site density and catalytic activity imply that the catalyst containing highest strong basic sites can easily adsorb the proton from the glycerol molecule to initiate the reaction. Also, the reported mixed oxides have the appreciable surface area and pore size to overcome the diffusion and mass transport limitation. Finally, the conclusion can be drawn that the Cu-based mixed oxide catalyst with high enough strong basic sites can efficiently do the transesterification of glycerol to produce an appreciable yield of GC. 5 Conclusion In the present study, Cu-containing Mg/Al based mixed oxides were synthesized by a facile co-precipitation method with varying Cu molar ratio. The synthesized mixed oxides were found to be highly efficient for the synthesis of GC via the transesterification of glycerol with DMC. The foregoing catalyst characterization results demonstrate that the Cu incorporated MgAl mixed oxides yield good surface area, pore volume and surface basicity benefiting from the fine-tuned Cu molar ratio. Moreover, the incorporation of Cu showed synergistic influence on the surface basic strength distribution, thus potentially affected the catalytic performance of the MgAl (O) mixed oxide. The catalytic performance of the Cu-based mixed oxides in the solvent-free transesterification of glycerol with DMC strongly depends on the amount of strong surface basic density of the catalysts. The MAC-0.6 catalyst exhibited the highest density of strong Lewis basic sites among all synthesised catalysts, consequently, granted the maximum GC yield (91.2%). According to the results procured in this work, a plausible reaction mechanism for the glycerol transesterification over Cu-based mixed oxide catalysts was proposed. Furthermore, the reported mixed oxide catalysts were quite stable in this reaction system and could be efficiently reused for several times without any significant loss in its catalytic activity. Acknowledgments PS and MM thank DST (SERB, YSS/2015/002090) for the fundings and we would like to thank VIT Vellore for their support. We are grateful to Dr. T.Raja, CSIR-NCL, Pune for his valuable suggestions and timely help. Appendix A Supplementary data Supplementary material related to this article can be found, in the online version, at doi:https://doi.org/10.1016/j.mcat.2018.09.002. Appendix A Supplementary data The following is Supplementary data to this article: References [1] G.W. Huber S. Iborra A. Corma Synthesis of transportation fuels from biomass: chemistry, catalysts, and engineering Chem. Rev. 106 2006 4044 4098 [2] M. Malyaadri K. Jagadeeswaraiah P.S. Sai Prasad N. Lingaiah Synthesis of glycerol carbonate by transesterification of glycerol with dimethyl carbonate over Mg/Al/Zr catalysts Appl. Catal. A Gen. 401 2011 153 157 [3] M. Pagliaro R. Ciriminna H. Kimura M. Rossi C.D. Pina From glycerol to value-added products Angew. Chem. Int. Ed. 46 2007 4434 4440 [4] C.H. Zhou J.N. Beltramini Y.-X. Fan G.Q. Lu Chemoselective catalytic conversion of glycerol as a biorenewable source to valuable commodity chemicals Chem. Soc. Rev. 37 2008 527 549 [5] A. Behr J. Eilting K. Irawadi J. Leschinski F. Lindner Improved utilisation of renewable resources: new important derivatives of glycerol Green Chem. 10 2008 13 30 [6] (a) M.O. Sonnati S. Amigoni E.P.T. de Givenchy T. Darmanin O. Choulet F. Guittard Glycerol carbonate as a versatile building block for tomorrow: synthesis, reactivity, properties and applications Green Chem. 15 2013 283 306 (b) A.G. Shaikh S. Sivaram Chem. Rev. 96 1996 951 976 [7] G. Rokicki P. Rakoczy P. Parzuchowski M. Sobiecki Hyperbranched aliphatic polyethers obtained from environmentally benign monomer: glycerol carbonate Green Chem. 7 2005 529 539 [8] US Pat., 5, 359 094, 1994. [9] M. Aresta A. Dibenedetto F. Nocito C. Pastore A study on the carboxylation of glycerol to glycerol carbonate with carbon dioxide: the role of the catalyst, solvent and reaction conditions J. Mol. Catal. A Chem. 257 2006 149 153 [10] J. George Y. Patel S.M. Pillai P. Munshi Methanol assisted selective formation of 1,2-glycerol carbonate from glycerol and carbon dioxide using nBu2SnO as a catalyst J. Mol. Catal. A Chem. 304 2009 1 7 [11] J. Zhang D. He Synthesis of glycerol carbonate and monoacetin from glycerol and carbon dioxide over Cu catalysts: the role of supports J. Chem. Technol. Biotechnol. 90 2015 1077 1085 [12] G.M. Lari A.B.L. de Moura L. Weimann S. Mitchell C. Mondelli J. P´erez-Ram´ırez Design of a technical Mg–Al mixed oxide catalyst for the continuous manufacture of glycerol carbonate J. Mater. Chem. A. 5 2017 16200 16211 [13] J.R. Ochoa-Go´mez O. Go´mez-Jime´nez-Aberasturi B. Maestro-Madurga A. Pesquera-Rodrı´gue C. Ramı´rez-Lo´pez L. Lorenzo-Ibarreta J. Torrecilla-Soria M.C. Villara´ n-Velasco Synthesis of glycerol carbonate from glycerol and dimethyl carbonate by transesterification: catalyst screening and reaction optimization Appl. Catal. A Gen. 366 2009 315 324 [14] R. Bai S. Wang F. Mei T. Li G. Li Synthesis of glycerol carbonate from glycerol and dimethyl carbonate catalyzed by KF modified hydroxyapatite J. Ind. Eng. Chem. 17 2011 777 781 [15] G. Parameswaram M. Srinivas B. Hari Babu P.S. Sai Prasad N. Lingaiah Transesterification of glycerol with dimethyl carbonate for the synthesis of glycerol carbonate over Mg/Zr/Sr mixed oxide base catalysts Catal. Sci. Technol. 3 2013 3242 3249 [16] X. Song Y. Wu F. Cai D. Pan G. Xiao High-efficiency and low-cost Li/ZnO catalysts for synthesis of glycerol carbonate from glycerol transesterification: the role of Li and ZnO interaction App. Catal. A: Gen. 532 2017 77 85 [17] M.J. Climent A. Corma P.D. Frutos S. Iborra M. Noy A. Velty P. Concepción Chemicals from biomass: synthesis of glycerol carbonate by transesterification and carbonylation with urea with hydrotalcite catalysts The role of acid–base pairs J. Catal. 269 2010 140 149 [18] S. Basąg Z. Piwowarska A. Kowalczyk A. Węgrzyn R. Baran B. Gil M. Michalik L. Chmielarz Cu-Mg-Al hydrotalcite-like materials as precursors of effective catalysts for selective oxidation of ammonia to dinitrogen - the influence of Mg/Al ratio and calcination temperature Appl. Clay Sci. 129 2016 122 130 [19] P. Kumar P. With V.C. Srivastava R. Gläser I.M. Mishra Glycerol carbonate synthesis by hierarchically structured catalysts: catalytic activity and characterization Ind. Eng. Chem. Res. 54 2015 12543 12552 [20] D. Singh B. Reddy A. Ganesh S. Mahajani Zinc/lanthanum mixed-oxide catalyst for the synthesis of glycerol carbonate by transesterification of glycerol Ind. Eng. Chem. Res. 53 2014 18786 18795 [21] M. Du Q. Li W. Dong T. Geng Y. Jiang Synthesis of glycerol carbonate from glycerol and dimethyl carbonate catalyzed by K2CO3/MgO Res. Chem. Intermed. 38 2012 1069 1077 [22] J. Santhanalakshmi T. Raja Selective N-methylation of aniline by calcined MgII-AlIII layered double hydroxides Appl. Catal. A Gen. 147 1996 69 80 [23] P. Liu M. Derchi E.J.M. Hensen Promotional effect of transition metal doping on the basicity and activity of calcined hydrotalcite catalysts for glycerol carbonate synthesis Appl. Catal. B: Environ. 144 2014 135 143 [24] F. Cavani F. Trifiro A. Vaccari Hydrotalcite-type anionic clays: preparation, properties and applications Catal. Today 11 1991 173 301 [25] M. Manikandan A. Venugopal K. Prabu R.K. Jha R. Thirumalaiswamy Role of surface synergistic effect on the performance of Ni-based hydrotalcite catalyst for highly efficient hydrogenation of furfural J. Mol. Catal. A Chem. 417 2016 153 162 [26] S. Nishimura A. Takagaki K. Ebitani Characterization, synthesis and catalysis of hydrotalcite-related materials for highly efficient materials transformations Green Chem. 15 2013 2026 2042 [27] M.E. Borges L. Díaz Recent developments on heterogeneous catalysts for biodiesel production by oil esterification and transesterification reactions: a review Renew. Sustain. Energy Rev. 16 2012 2839 2849 [28] J. Zhang J. Chen Selective transfer hydrogenation of biomass-based furfural and 5-Hydroxymethylfurfural over hydrotalcite-derived copper catalysts using methanol as a hydrogen donor ACS Sustain. Chem. Eng. 5 7 2017 5982 5993 [29] K.K. Rao M. Gravelle J.S. Valente F. Figueras Activation of Mg–Al hydrotalcite catalysts for aldol condensation reactions J. Catal. 173 1998 115 121 [30] R. Salomão L.M. Milena M.H. Wakamatsu V.C. Pandolfelli Hydrotalcite synthesis via co-precipitation reactions using MgO and Al(OH)3 precursors Ceram. Int. 37 2011 3063 3070 [31] A. Corma S.B.A. Hamid S. Iborra A. Velty Lewis and Brönsted basic active sites on solid catalysts and their role in the synthesis of monoglycerides J. Catal. 234 2005 340 347 [32] A. Takagaki K. Iwatani S. Nishimura K. Ebitani Synthesis of glycerol carbonate from glycerol and dialkyl carbonates using hydrotalcite as a reusable heterogeneous base catalyst Green Chem. 12 2010 578 581 [33] K.A. Ferreira N.F.P. Ribeiro M.M.V.M. Souza M. Schmal Structural transformation of Cu–Mg–Al mixed oxide catalysts derived from hydrotalcites during shift reaction Catal. Lett. 132 2009 58 63 [34] M. Li X. Wanga S. Li S. Wanga X. Maa Hydrogen production from ethanol steam reforming over nickel based catalyst derived from Ni/Mg/Al hydrotalcite-like compounds Int. J. Hydrogen Energy 35 2010 6699 6708 [35] D.P. Debecker Eric M. Gaigneaux Guido Busca Exploring, tuning, and exploiting the basicity of hydrotalcites for applications in heterogeneous catalysis Chem. Eur. J. 15 2009 3920 3935 [36] A.S. Nagpure A.K. Venugopal N. Lucas M. Manikandan R. Thirumalaiswamy S. Chilukuri Renewable fuels from biomass-derived compounds: Ru-containing hydrotalcites as catalysts for conversion of HMF to 2,5-dimethylfuran Catal. Sci. Technol. 5 2015 1463 1472 [37] J.J. Bravo-Suárez B. Subramaniam R.V. Chaudhari Ultraviolet–visible spectroscopy and temperature-programmed techniques as tools for structural characterization of Cu in CuMgAlOx mixed metal oxides J. Phys. Chem. C 116 9 2012 18207 18221 [38] S. Velu K. Suzuki M. Okazaki M. Kapoor T. Osaki F. Ohashi Oxidative steam reforming of methanol over CuZnAl(Zr)-Oxide catalysts for the selective production of hydrogen for fuel cells: catalyst characterization and performance evaluation J. Catal. 194 2000 373 [39] J.Y. Zhang Z.L. Wu S.G. Wang C.J. Zhao G. Yang S.L. Zhang Y. Liu S. Liu J. Teng G.H. Yu Effect of interfacial structures on anomalous Hall behavior in perpendicular Co/Pt multilayers Appl. Phys. Lett. 102 2013 102404 [40] O. Akhavan E. Ghaderi Copper oxide nanoflakes as highly sensitive and fast response self-sterilizing biosensors J. Mater. Chem. 21 2011 12935 12940 [41] D. Damodara R. Arundhathi P.R. Likhar An efficient catalyst for acceptor‐ and oxidant‐free dehydrogenation of amines and alcohols Adv. Synth. Catal. 356 2014 189 198 [42] O. Akhavan R. Azimirad S. Safad E. Hasani CuO/ Cu(OH)2 hierarchical nanostructures as bactericidal photocatalysts J. Mater. Chem. 21 2011 9634 9640 [43] D. Addari A. Mignani E. Scavetta D. Tonelli A. Rossi An XPS investigation on glucose oxidase and Ni/Al hydrotalcite interaction Surf. Interface Anal. 43 2011 816 822 [44] J.V. Gerpen Biodiesel processing and production Fuel Process. Technol. 86 2005 1097 1107 [45] R. Sree N. Seshu Babu P.S. Sai Prasad N. Lingaiah Transesterification of edible and non-edible oils over basic solid Mg/Zr catalysts Fuel Process. Technol. 90 2009 152 157 [46] C. Hammond J.A. Lopez-Sanchez M.H. Ab Rahim N. Dimitratos R.L. Jenkins A.F. Carley Q. He C.J. Kiely D.W. Knighta G.J. Hutchings Synthesis of glycerol carbonate from glycerol and urea with gold-based catalysts Dalton Trans. 40 2011 3927 [47] Z. Liu J. Wang M. Kang N. Yin X. Wang Y. Tanb Y. Zhub Synthesis of glycerol carbonate by transesterification of glycerol and dimethyl carbonate over KF/γ-Al2O3 catalyst J. Braz. Chem. Soc. 25 2014 152 160",
      "scopus-id": "85053457769",
      "coredata": {
        "eid": "1-s2.0-S2468823118303894",
        "dc:description": "A series of efficient and robust Cu based mixed oxides were synthesized by a simple co-precipitation method and utilized for the production of glycerol carbonate (GC) via transesterification of glycerol with dimethyl carbonate (DMC). The synthesized materials were characterized using XRD, UV–vis spectroscopy, SEM, TEM, N2 sorption, CO2-TPD, and XPS. The addition of Cu on Mg/Al mixed oxides exhibits significant changes in its physicochemical properties and catalytic activity. The obtained mixed oxides showed remarkably high transesterification activity towards the efficient conversion of glycerol to GC under economical reaction conditions without using any solvent. Among all the catalysts employed, highest catalytic activity was observed over MAC-0.6 catalyst with glycerol conversion of 96.4% and GC yield of 91.2%. The improved catalytic performance was observed mainly due to the optimized catalyst molar ratio and strong surface basicity. The strong surface basic sites were greatly attributed to the incorporation of Cu2+ cations in the MgAl (O) periclase that efficiently catalyzed the transesterification of glycerol with DMC. Furthermore, the reported catalyst was robust and could be recycled for more than five times without any significant loss in its catalytic activity.",
        "openArchiveArticle": "false",
        "prism:coverDate": "2018-12-31",
        "openaccessUserLicense": null,
        "prism:aggregationType": "Journal",
        "prism:url": "https://api.elsevier.com/content/article/pii/S2468823118303894",
        "dc:creator": [
          {
            "@_fa": "true",
            "$": "Marimuthu, Manikandan"
          },
          {
            "@_fa": "true",
            "$": "Marimuthu, Prabu"
          },
          {
            "@_fa": "true",
            "$": "S.K., Ashok Kumar"
          },
          {
            "@_fa": "true",
            "$": "Palanivelu, Sangeetha"
          },
          {
            "@_fa": "true",
            "$": "Rajagopalan, Vijayaraghavan"
          }
        ],
        "link": [
          {
            "@_fa": "true",
            "@rel": "self",
            "@href": "https://api.elsevier.com/content/article/pii/S2468823118303894"
          },
          {
            "@_fa": "true",
            "@rel": "scidir",
            "@href": "https://www.sciencedirect.com/science/article/pii/S2468823118303894"
          }
        ],
        "dc:format": "application/json",
        "openaccessType": null,
        "pii": "S2468-8231(18)30389-4",
        "prism:volume": "460",
        "prism:publisher": "Elsevier B.V.",
        "dc:title": "Tuning the basicity of Cu-based mixed oxide catalysts towards the efficient conversion of glycerol to glycerol carbonate",
        "prism:copyright": "© 2018 Elsevier B.V. All rights reserved.",
        "openaccess": "0",
        "prism:issn": "24688231",
        "dcterms:subject": [
          {
            "@_fa": "true",
            "$": "Copper"
          },
          {
            "@_fa": "true",
            "$": "Mixed oxides"
          },
          {
            "@_fa": "true",
            "$": "Transesterification"
          },
          {
            "@_fa": "true",
            "$": "Glycerol"
          },
          {
            "@_fa": "true",
            "$": "Glycerol carbonate"
          }
        ],
        "openaccessArticle": "false",
        "prism:publicationName": "Molecular Catalysis",
        "openaccessSponsorType": null,
        "prism:pageRange": "53-62",
        "prism:endingPage": "62",
        "pubType": "fla",
        "prism:coverDisplayDate": "December 2018",
        "prism:doi": "10.1016/j.mcat.2018.09.002",
        "prism:startingPage": "53",
        "dc:identifier": "doi:10.1016/j.mcat.2018.09.002",
        "openaccessSponsorName": null
      },
      "objects": {
        "object": [
          {
            "@category": "thumbnail",
            "@height": "144",
            "@width": "219",
            "@_fa": "true",
            "$": "https://api.elsevier.com/content/object/eid/1-s2.0-S2468823118303894-ga1.sml?httpAccept=%2A%2F%2A",
            "@multimediatype": "GIF image file",
            "@type": "IMAGE-THUMBNAIL",
            "@size": "10151",
            "@ref": "ga1",
            "@mimetype": "image/gif"
          },
          {
            "@category": "thumbnail",
            "@height": "164",
            "@width": "190",
            "@_fa": "true",
            "$": "https://api.elsevier.com/content/object/eid/1-s2.0-S2468823118303894-gr1.sml?httpAccept=%2A%2F%2A",
            "@multimediatype": "GIF image file",
            "@type": "IMAGE-THUMBNAIL",
            "@size": "8836",
            "@ref": "gr1",
            "@mimetype": "image/gif"
          },
          {
            "@category": "thumbnail",
            "@height": "164",
            "@width": "212",
            "@_fa": "true",
            "$": "https://api.elsevier.com/content/object/eid/1-s2.0-S2468823118303894-gr10.sml?httpAccept=%2A%2F%2A",
            "@multimediatype": "GIF image file",
            "@type": "IMAGE-THUMBNAIL",
            "@size": "8276",
            "@ref": "gr10",
            "@mimetype": "image/gif"
          },
          {
            "@category": "thumbnail",
            "@height": "164",
            "@width": "198",
            "@_fa": "true",
            "$": "https://api.elsevier.com/content/object/eid/1-s2.0-S2468823118303894-gr11.sml?httpAccept=%2A%2F%2A",
            "@multimediatype": "GIF image file",
            "@type": "IMAGE-THUMBNAIL",
            "@size": "6249",
            "@ref": "gr11",
            "@mimetype": "image/gif"
          },
          {
            "@category": "thumbnail",
            "@height": "164",
            "@width": "192",
            "@_fa": "true",
            "$": "https://api.elsevier.com/content/object/eid/1-s2.0-S2468823118303894-gr2.sml?httpAccept=%2A%2F%2A",
            "@multimediatype": "GIF image file",
            "@type": "IMAGE-THUMBNAIL",
            "@size": "11537",
            "@ref": "gr2",
            "@mimetype": "image/gif"
          },
          {
            "@category": "thumbnail",
            "@height": "138",
            "@width": "219",
            "@_fa": "true",
            "$": "https://api.elsevier.com/content/object/eid/1-s2.0-S2468823118303894-gr3.sml?httpAccept=%2A%2F%2A",
            "@multimediatype": "GIF image file",
            "@type": "IMAGE-THUMBNAIL",
            "@size": "9179",
            "@ref": "gr3",
            "@mimetype": "image/gif"
          },
          {
            "@category": "thumbnail",
            "@height": "164",
            "@width": "215",
            "@_fa": "true",
            "$": "https://api.elsevier.com/content/object/eid/1-s2.0-S2468823118303894-gr4.sml?httpAccept=%2A%2F%2A",
            "@multimediatype": "GIF image file",
            "@type": "IMAGE-THUMBNAIL",
            "@size": "23846",
            "@ref": "gr4",
            "@mimetype": "image/gif"
          },
          {
            "@category": "thumbnail",
            "@height": "164",
            "@width": "165",
            "@_fa": "true",
            "$": "https://api.elsevier.com/content/object/eid/1-s2.0-S2468823118303894-gr5.sml?httpAccept=%2A%2F%2A",
            "@multimediatype": "GIF image file",
            "@type": "IMAGE-THUMBNAIL",
            "@size": "17427",
            "@ref": "gr5",
            "@mimetype": "image/gif"
          },
          {
            "@category": "thumbnail",
            "@height": "164",
            "@width": "205",
            "@_fa": "true",
            "$": "https://api.elsevier.com/content/object/eid/1-s2.0-S2468823118303894-gr6.sml?httpAccept=%2A%2F%2A",
            "@multimediatype": "GIF image file",
            "@type": "IMAGE-THUMBNAIL",
            "@size": "9109",
            "@ref": "gr6",
            "@mimetype": "image/gif"
          },
          {
            "@category": "thumbnail",
            "@height": "164",
            "@width": "189",
            "@_fa": "true",
            "$": "https://api.elsevier.com/content/object/eid/1-s2.0-S2468823118303894-gr7.sml?httpAccept=%2A%2F%2A",
            "@multimediatype": "GIF image file",
            "@type": "IMAGE-THUMBNAIL",
            "@size": "7403",
            "@ref": "gr7",
            "@mimetype": "image/gif"
          },
          {
            "@category": "thumbnail",
            "@height": "164",
            "@width": "219",
            "@_fa": "true",
            "$": "https://api.elsevier.com/content/object/eid/1-s2.0-S2468823118303894-gr8.sml?httpAccept=%2A%2F%2A",
            "@multimediatype": "GIF image file",
            "@type": "IMAGE-THUMBNAIL",
            "@size": "13037",
            "@ref": "gr8",
            "@mimetype": "image/gif"
          },
          {
            "@category": "thumbnail",
            "@height": "163",
            "@width": "219",
            "@_fa": "true",
            "$": "https://api.elsevier.com/content/object/eid/1-s2.0-S2468823118303894-gr9.sml?httpAccept=%2A%2F%2A",
            "@multimediatype": "GIF image file",
            "@type": "IMAGE-THUMBNAIL",
            "@size": "5627",
            "@ref": "gr9",
            "@mimetype": "image/gif"
          },
          {
            "@category": "thumbnail",
            "@height": "39",
            "@width": "219",
            "@_fa": "true",
            "$": "https://api.elsevier.com/content/object/eid/1-s2.0-S2468823118303894-sc1.sml?httpAccept=%2A%2F%2A",
            "@multimediatype": "GIF image file",
            "@type": "IMAGE-THUMBNAIL",
            "@size": "2611",
            "@ref": "sc1",
            "@mimetype": "image/gif"
          },
          {
            "@category": "thumbnail",
            "@height": "127",
            "@width": "219",
            "@_fa": "true",
            "$": "https://api.elsevier.com/content/object/eid/1-s2.0-S2468823118303894-sc2.sml?httpAccept=%2A%2F%2A",
            "@multimediatype": "GIF image file",
            "@type": "IMAGE-THUMBNAIL",
            "@size": "7903",
            "@ref": "sc2",
            "@mimetype": "image/gif"
          },
          {
            "@category": "standard",
            "@height": "200",
            "@width": "303",
            "@_fa": "true",
            "$": "https://api.elsevier.com/content/object/eid/1-s2.0-S2468823118303894-ga1.jpg?httpAccept=%2A%2F%2A",
            "@multimediatype": "JPEG image file",
            "@type": "IMAGE-DOWNSAMPLED",
            "@size": "19513",
            "@ref": "ga1",
            "@mimetype": "image/jpeg"
          },
          {
            "@category": "standard",
            "@height": "295",
            "@width": "341",
            "@_fa": "true",
            "$": "https://api.elsevier.com/content/object/eid/1-s2.0-S2468823118303894-gr1.jpg?httpAccept=%2A%2F%2A",
            "@multimediatype": "JPEG image file",
            "@type": "IMAGE-DOWNSAMPLED",
            "@size": "29679",
            "@ref": "gr1",
            "@mimetype": "image/jpeg"
          },
          {
            "@category": "standard",
            "@height": "380",
            "@width": "492",
            "@_fa": "true",
            "$": "https://api.elsevier.com/content/object/eid/1-s2.0-S2468823118303894-gr10.jpg?httpAccept=%2A%2F%2A",
            "@multimediatype": "JPEG image file",
            "@type": "IMAGE-DOWNSAMPLED",
            "@size": "38302",
            "@ref": "gr10",
            "@mimetype": "image/jpeg"
          },
          {
            "@category": "standard",
            "@height": "282",
            "@width": "341",
            "@_fa": "true",
            "$": "https://api.elsevier.com/content/object/eid/1-s2.0-S2468823118303894-gr11.jpg?httpAccept=%2A%2F%2A",
            "@multimediatype": "JPEG image file",
            "@type": "IMAGE-DOWNSAMPLED",
            "@size": "19653",
            "@ref": "gr11",
            "@mimetype": "image/jpeg"
          },
          {
            "@category": "standard",
            "@height": "291",
            "@width": "341",
            "@_fa": "true",
            "$": "https://api.elsevier.com/content/object/eid/1-s2.0-S2468823118303894-gr2.jpg?httpAccept=%2A%2F%2A",
            "@multimediatype": "JPEG image file",
            "@type": "IMAGE-DOWNSAMPLED",
            "@size": "34245",
            "@ref": "gr2",
            "@mimetype": "image/jpeg"
          },
          {
            "@category": "standard",
            "@height": "356",
            "@width": "567",
            "@_fa": "true",
            "$": "https://api.elsevier.com/content/object/eid/1-s2.0-S2468823118303894-gr3.jpg?httpAccept=%2A%2F%2A",
            "@multimediatype": "JPEG image file",
            "@type": "IMAGE-DOWNSAMPLED",
            "@size": "55673",
            "@ref": "gr3",
            "@mimetype": "image/jpeg"
          },
          {
            "@category": "standard",
            "@height": "519",
            "@width": "680",
            "@_fa": "true",
            "$": "https://api.elsevier.com/content/object/eid/1-s2.0-S2468823118303894-gr4.jpg?httpAccept=%2A%2F%2A",
            "@multimediatype": "JPEG image file",
            "@type": "IMAGE-DOWNSAMPLED",
            "@size": "138390",
            "@ref": "gr4",
            "@mimetype": "image/jpeg"
          },
          {
            "@category": "standard",
            "@height": "563",
            "@width": "567",
            "@_fa": "true",
            "$": "https://api.elsevier.com/content/object/eid/1-s2.0-S2468823118303894-gr5.jpg?httpAccept=%2A%2F%2A",
            "@multimediatype": "JPEG image file",
            "@type": "IMAGE-DOWNSAMPLED",
            "@size": "81578",
            "@ref": "gr5",
            "@mimetype": "image/jpeg"
          },
          {
            "@category": "standard",
            "@height": "272",
            "@width": "341",
            "@_fa": "true",
            "$": "https://api.elsevier.com/content/object/eid/1-s2.0-S2468823118303894-gr6.jpg?httpAccept=%2A%2F%2A",
            "@multimediatype": "JPEG image file",
            "@type": "IMAGE-DOWNSAMPLED",
            "@size": "27289",
            "@ref": "gr6",
            "@mimetype": "image/jpeg"
          },
          {
            "@category": "standard",
            "@height": "492",
            "@width": "567",
            "@_fa": "true",
            "$": "https://api.elsevier.com/content/object/eid/1-s2.0-S2468823118303894-gr7.jpg?httpAccept=%2A%2F%2A",
            "@multimediatype": "JPEG image file",
            "@type": "IMAGE-DOWNSAMPLED",
            "@size": "44013",
            "@ref": "gr7",
            "@mimetype": "image/jpeg"
          },
          {
            "@category": "standard",
            "@height": "255",
            "@width": "341",
            "@_fa": "true",
            "$": "https://api.elsevier.com/content/object/eid/1-s2.0-S2468823118303894-gr8.jpg?httpAccept=%2A%2F%2A",
            "@multimediatype": "JPEG image file",
            "@type": "IMAGE-DOWNSAMPLED",
            "@size": "32705",
            "@ref": "gr8",
            "@mimetype": "image/jpeg"
          },
          {
            "@category": "standard",
            "@height": "254",
            "@width": "341",
            "@_fa": "true",
            "$": "https://api.elsevier.com/content/object/eid/1-s2.0-S2468823118303894-gr9.jpg?httpAccept=%2A%2F%2A",
            "@multimediatype": "JPEG image file",
            "@type": "IMAGE-DOWNSAMPLED",
            "@size": "17645",
            "@ref": "gr9",
            "@mimetype": "image/jpeg"
          },
          {
            "@category": "standard",
            "@height": "88",
            "@width": "492",
            "@_fa": "true",
            "$": "https://api.elsevier.com/content/object/eid/1-s2.0-S2468823118303894-sc1.jpg?httpAccept=%2A%2F%2A",
            "@multimediatype": "JPEG image file",
            "@type": "IMAGE-DOWNSAMPLED",
            "@size": "10950",
            "@ref": "sc1",
            "@mimetype": "image/jpeg"
          },
          {
            "@category": "standard",
            "@height": "285",
            "@width": "492",
            "@_fa": "true",
            "$": "https://api.elsevier.com/content/object/eid/1-s2.0-S2468823118303894-sc2.jpg?httpAccept=%2A%2F%2A",
            "@multimediatype": "JPEG image file",
            "@type": "IMAGE-DOWNSAMPLED",
            "@size": "34068",
            "@ref": "sc2",
            "@mimetype": "image/jpeg"
          },
          {
            "@category": "standard",
            "@_fa": "true",
            "$": "https://api.elsevier.com/content/object/eid/1-s2.0-S2468823118303894-mmc1.docx?httpAccept=%2A%2F%2A",
            "@multimediatype": "Microsoft Word file",
            "@type": "APPLICATION",
            "@size": "394500",
            "@ref": "mmc1",
            "@mimetype": "application/word"
          },
          {
            "@category": "standard",
            "@_fa": "true",
            "$": "https://api.elsevier.com/content/object/eid/1-s2.0-S2468823118303894-am.pdf?httpAccept=%2A%2F%2A",
            "@multimediatype": "Acrobat PDF file",
            "@type": "AAM-PDF",
            "@size": "2130961",
            "@ref": "am",
            "@mimetype": "application/pdf"
          }
        ]
      },
      "link": {
        "@rel": "abstract",
        "@href": "https://api.elsevier.com/content/abstract/scopus_id/85053457769"
      }
    }
  }
}