{
  "metadata": {
    "title": "New insight into the synergistic promotion effect of phosphorus and molybdenum on the ceria-titanium catalysts for superior SCR performance",
    "authors": "; ; ",
    "journal": "Molecular Catalysis",
    "date": "2019-11-30",
    "doi": "10.1016/j.mcat.2019.110562",
    "abstract": "",
    "uri": "https://api.elsevier.com/content/article/pii/S2468823119304080",
    "pii": "S2468823119304080"
  },
  "fulltext": {
    "full-text-retrieval-response": {
      "scopus-eid": "2-s2.0-85071320128",
      "originalText": "serial JL 315758 291210 291744 291790 291809 31 Molecular Catalysis MOLECULARCATALYSIS 2019-08-28 2019-08-28 2019-08-28 2019-08-28 2019-09-13T07:55:49 1-s2.0-S2468823119304080 S2468-8231(19)30408-0 S2468823119304080 10.1016/j.mcat.2019.110562 S300 S300.1 FULL-TEXT 1-s2.0-S2468823119X00140 2020-01-11T04:02:21.285869Z 0 0 20191101 20191130 2019 2019-08-28T23:12:53.795833Z absattachment articleinfo articlenumber articletitlenorm authfirstinitialnorm authfirstsurnamenorm cid cids contenttype copyright crossmark dateloaded dateloadedtxt datesearch datesort dateupdated dco docsubtype doctype doi eid ewtransactionid hubeid indexeddate issn issnnorm itemstage itemtransactionid itemweight openaccess openarchive pg pgfirst pii piinorm pubdateend pubdatestart pubdatetxt pubyr sectiontitle sortorder srctitle srctitlenorm srctype ssids alllist content subj subheadings suppl tomb volfirst volissue volumelist webpdf webpdfpagecount yearnav figure table e-component body mmlmath acknowledge affil appendices articletitle auth authfirstini authfull authkeywords authlast grantnumber grantsponsor grantsponsorid highlightsabst orcid primabst ref specialabst 2468-8231 24688231 true 478 478 C Volume 478 9 110562 110562 110562 201911 November 2019 2019-11-01 2019-11-30 2019 Regular Papers article fla © 2019 Elsevier B.V. All rights reserved. NEWINSIGHTSYNERGISTICPROMOTIONEFFECTPHOSPHORUSMOLYBDENUMCERIATITANIUMCATALYSTSFORSUPERIORSCRPERFORMANCE ZHANG G 1 Introduction 2 Experimental 2.1 Catalyst preparation 2.2 Analytical instrumentation 2.3 Catalytic activity measurements 3 Results and discussion 3.1 Catalytic performance 3.2 H2O and SO2 resistant properties 3.3 Activity, H2O and SO2 resistant properties at high GHSV 3.4 Structure of the catalyst 3.5 Catalysts reducibility 3.6 Surface acidities (NH3-TPD) 3.7 The relative TOF and activation energy calculation results 3.8 Surface component and chemical states after enduring SO2 test 3.9 The influence mechanism of phosphorus and molybdenum element on SCR 4 Conclusions Acknowledgments Appendix A Supplementary data References CHOUNG 2006 42 J ZHANG 2016 48 T XIN 2018 81 Y DUMESIC 1996 409 J AMIRIDIS 1996 247 256 M SHWAN 2014 2932 S XIN 2018 4937 Y CHOUNG 2006 242 J ZONG 2018 500 L HAN 2013 299 W CHOUNG 2006 165 J ZHANG 2012 14455 D LIU 2014 160 161 Y MICHALOWMAUKE 2015 5657 K LIU 2014 90 Z TERAMURA 2003 1209 K JIANG 2018 96 Y LI 2010 1416 F YAO 2016 221 W YAO 2018 156 W CHANG 2013 11692 H YOU 2017 15 Y LI 2018 173 X ZHANG 2016 76556 G ZHANG 2018 117 G YUAN 2017 3036 E ZHANG 2013 1127 D LIU 2014 90 Z JIANG 2018 96 Y FENG 2018 196 X GAO 2015 31862 Y FANG 2013 803 C LIU 2009 3140 W SUN 2015 26 Y WANG 2018 226 W XU 2010 1887 J HURUM 2006 155 D JIN 2016 1111 Q SORIA 1999 67 J ZHANG 2018 251 X XUE 2013 56 J ZHANG 2015 589 L WANG 2015 10 J BHAUMIK 2001 691 A LIU 2012 6182 C YAN 2017 502 L GAO 2010 465 X SHYU 1988 4964 J BAIDYA 2009 4059 T GENG 2017 16951 Y DAMYANOVA 2002 271 S MURUGAN 2008 20429 B YI 2016 300 T BROW 1996 267 R JIANG 2013 44 H HUANG 2018 5604 X SHAO 2009 61 G SHAN 2012 160 W CHEN 2018 1399 X CHOI 1996 597 E PENG 2016 692 Y LI 2016 18005 X QU 2016 102436 R YE 2018 310 D WU 2013 16698 Y JIRSAK 1999 319 T HUANG 2019 66 X WANG 2015 10 J FU 2007 6077 H HU 2017 449 W ZHANGX2019X110562 ZHANGX2019X110562XG 2021-08-28T00:00:00.000Z 2021-08-28T00:00:00.000Z http://creativecommons.org/licenses/by-nc-nd/4.0/ © 2019 Elsevier B.V. All rights reserved. 2019-08-13T03:23:05.732Z http://vtw.elsevier.com/data/voc/AddOnTypes/50.7/eoas Natural Science Foundation of Gansu Province http://data.elsevier.com/vocabulary/SciValFunders/501100004775 http://sws.geonames.org/1814991 NSFC National Natural Science Foundation of China http://data.elsevier.com/vocabulary/SciValFunders/501100001809 http://sws.geonames.org/1814991 item S2468-8231(19)30408-0 S2468823119304080 1-s2.0-S2468823119304080 10.1016/j.mcat.2019.110562 315758 2020-01-11T04:02:21.285869Z 2019-11-01 2019-11-30 1-s2.0-S2468823119304080-main.pdf https://s3.amazonaws.com/prod-ucs-content-store-us-east/content/pii:S2468823119304080/MAIN/application/pdf/48989376fc3b97ac2420d350632d27b0/main.pdf main.pdf pdf true 9489695 MAIN 12 1-s2.0-S2468823119304080-main_1.png https://s3.amazonaws.com/prod-ucs-content-store-us-east/content/pii:S2468823119304080/PREVIEW/image/png/33aad672079f8967b5812ff8755262c3/main_1.png main_1.png png 54228 849 656 IMAGE-WEB-PDF 1 1-s2.0-S2468823119304080-ga1.sml https://s3.amazonaws.com/prod-ucs-content-store-us-east/content/pii:S2468823119304080/ga1/THUMBNAIL/image/gif/ee39ae4e6aed548611f9eccacac616df/ga1.sml ga1 true ga1.sml sml 17100 148 219 IMAGE-THUMBNAIL 1-s2.0-S2468823119304080-gr1.sml https://s3.amazonaws.com/prod-ucs-content-store-us-east/content/pii:S2468823119304080/gr1/THUMBNAIL/image/gif/3856f20359d3193edf562433ee90fca3/gr1.sml gr1 gr1.sml sml 16890 131 219 IMAGE-THUMBNAIL 1-s2.0-S2468823119304080-gr10.sml https://s3.amazonaws.com/prod-ucs-content-store-us-east/content/pii:S2468823119304080/gr10/THUMBNAIL/image/gif/1c6d54cd903d198ef3e1325e54737c8d/gr10.sml gr10 gr10.sml sml 6937 81 219 IMAGE-THUMBNAIL 1-s2.0-S2468823119304080-gr11.sml https://s3.amazonaws.com/prod-ucs-content-store-us-east/content/pii:S2468823119304080/gr11/THUMBNAIL/image/gif/6897efcfc46a0567d8ca2a64b0b68fab/gr11.sml gr11 gr11.sml sml 9378 164 102 IMAGE-THUMBNAIL 1-s2.0-S2468823119304080-gr12.sml https://s3.amazonaws.com/prod-ucs-content-store-us-east/content/pii:S2468823119304080/gr12/THUMBNAIL/image/gif/d3aac2a7db2a993a6a5f7f7d50167fd3/gr12.sml gr12 gr12.sml sml 17146 152 219 IMAGE-THUMBNAIL 1-s2.0-S2468823119304080-gr2.sml https://s3.amazonaws.com/prod-ucs-content-store-us-east/content/pii:S2468823119304080/gr2/THUMBNAIL/image/gif/94b8bab117ed39a8e7fdf54fbd535c4b/gr2.sml gr2 gr2.sml sml 13476 164 209 IMAGE-THUMBNAIL 1-s2.0-S2468823119304080-gr3.sml https://s3.amazonaws.com/prod-ucs-content-store-us-east/content/pii:S2468823119304080/gr3/THUMBNAIL/image/gif/65e2d8b248925dd5e916af060de238ef/gr3.sml gr3 gr3.sml sml 14203 164 219 IMAGE-THUMBNAIL 1-s2.0-S2468823119304080-gr4.sml https://s3.amazonaws.com/prod-ucs-content-store-us-east/content/pii:S2468823119304080/gr4/THUMBNAIL/image/gif/9d5ce54808a48ddc83838ab3db35e1f8/gr4.sml gr4 gr4.sml sml 8550 96 219 IMAGE-THUMBNAIL 1-s2.0-S2468823119304080-gr5.sml https://s3.amazonaws.com/prod-ucs-content-store-us-east/content/pii:S2468823119304080/gr5/THUMBNAIL/image/gif/81061ee3d675e8036daa98ee4c48802c/gr5.sml gr5 gr5.sml sml 8856 164 182 IMAGE-THUMBNAIL 1-s2.0-S2468823119304080-gr6.sml https://s3.amazonaws.com/prod-ucs-content-store-us-east/content/pii:S2468823119304080/gr6/THUMBNAIL/image/gif/3861871c737afc4484c5d0f45589cd85/gr6.sml gr6 gr6.sml sml 8922 164 200 IMAGE-THUMBNAIL 1-s2.0-S2468823119304080-gr7.sml https://s3.amazonaws.com/prod-ucs-content-store-us-east/content/pii:S2468823119304080/gr7/THUMBNAIL/image/gif/94c3b3720aca9e7ab4f02763022baa7c/gr7.sml gr7 gr7.sml sml 6778 88 219 IMAGE-THUMBNAIL 1-s2.0-S2468823119304080-gr8.sml https://s3.amazonaws.com/prod-ucs-content-store-us-east/content/pii:S2468823119304080/gr8/THUMBNAIL/image/gif/bed06cda10554933564daa8b1c1356a3/gr8.sml gr8 gr8.sml sml 10869 163 128 IMAGE-THUMBNAIL 1-s2.0-S2468823119304080-gr9.sml https://s3.amazonaws.com/prod-ucs-content-store-us-east/content/pii:S2468823119304080/gr9/THUMBNAIL/image/gif/402e4628fb2c90581b0b279637843931/gr9.sml gr9 gr9.sml sml 10862 164 185 IMAGE-THUMBNAIL 1-s2.0-S2468823119304080-ga1.jpg https://s3.amazonaws.com/prod-ucs-content-store-us-east/content/pii:S2468823119304080/ga1/DOWNSAMPLED/image/jpeg/4a08d83e815d89ef95d59f01783c1379/ga1.jpg ga1 true ga1.jpg jpg 24145 200 296 IMAGE-DOWNSAMPLED 1-s2.0-S2468823119304080-gr1.jpg https://s3.amazonaws.com/prod-ucs-content-store-us-east/content/pii:S2468823119304080/gr1/DOWNSAMPLED/image/jpeg/b953243ce847faa17965a7b89caa6d4a/gr1.jpg gr1 gr1.jpg jpg 66619 340 567 IMAGE-DOWNSAMPLED 1-s2.0-S2468823119304080-gr10.jpg https://s3.amazonaws.com/prod-ucs-content-store-us-east/content/pii:S2468823119304080/gr10/DOWNSAMPLED/image/jpeg/9ed65107ac3d732f6a9ca8a3fce27742/gr10.jpg gr10 gr10.jpg jpg 36936 209 567 IMAGE-DOWNSAMPLED 1-s2.0-S2468823119304080-gr11.jpg https://s3.amazonaws.com/prod-ucs-content-store-us-east/content/pii:S2468823119304080/gr11/DOWNSAMPLED/image/jpeg/ead39bae771724a9462d2766fc44f8de/gr11.jpg gr11 gr11.jpg jpg 157725 914 568 IMAGE-DOWNSAMPLED 1-s2.0-S2468823119304080-gr12.jpg https://s3.amazonaws.com/prod-ucs-content-store-us-east/content/pii:S2468823119304080/gr12/DOWNSAMPLED/image/jpeg/a497be13bf43b51391998725538fc984/gr12.jpg gr12 gr12.jpg jpg 63736 393 567 IMAGE-DOWNSAMPLED 1-s2.0-S2468823119304080-gr2.jpg https://s3.amazonaws.com/prod-ucs-content-store-us-east/content/pii:S2468823119304080/gr2/DOWNSAMPLED/image/jpeg/98434626bb08d294025bbcc07211055e/gr2.jpg gr2 gr2.jpg jpg 83682 444 567 IMAGE-DOWNSAMPLED 1-s2.0-S2468823119304080-gr3.jpg https://s3.amazonaws.com/prod-ucs-content-store-us-east/content/pii:S2468823119304080/gr3/DOWNSAMPLED/image/jpeg/3d98e7999c0a012c5d811ff05c721f35/gr3.jpg gr3 gr3.jpg jpg 84197 425 567 IMAGE-DOWNSAMPLED 1-s2.0-S2468823119304080-gr4.jpg https://s3.amazonaws.com/prod-ucs-content-store-us-east/content/pii:S2468823119304080/gr4/DOWNSAMPLED/image/jpeg/d033ca6975c334e2a15bbb92b400f29a/gr4.jpg gr4 gr4.jpg jpg 48944 248 567 IMAGE-DOWNSAMPLED 1-s2.0-S2468823119304080-gr5.jpg https://s3.amazonaws.com/prod-ucs-content-store-us-east/content/pii:S2468823119304080/gr5/DOWNSAMPLED/image/jpeg/43347dafcdf91084305ef507dc3c7003/gr5.jpg gr5 gr5.jpg jpg 30965 307 341 IMAGE-DOWNSAMPLED 1-s2.0-S2468823119304080-gr6.jpg https://s3.amazonaws.com/prod-ucs-content-store-us-east/content/pii:S2468823119304080/gr6/DOWNSAMPLED/image/jpeg/f26f1417bf26bee53105d64691affc48/gr6.jpg gr6 gr6.jpg jpg 28387 280 341 IMAGE-DOWNSAMPLED 1-s2.0-S2468823119304080-gr7.jpg https://s3.amazonaws.com/prod-ucs-content-store-us-east/content/pii:S2468823119304080/gr7/DOWNSAMPLED/image/jpeg/83441d239839b39071b90aed1ea19209/gr7.jpg gr7 gr7.jpg jpg 38711 227 567 IMAGE-DOWNSAMPLED 1-s2.0-S2468823119304080-gr8.jpg https://s3.amazonaws.com/prod-ucs-content-store-us-east/content/pii:S2468823119304080/gr8/DOWNSAMPLED/image/jpeg/f41debc1b183f23148cd3a39fcd3b718/gr8.jpg gr8 gr8.jpg jpg 132211 724 567 IMAGE-DOWNSAMPLED 1-s2.0-S2468823119304080-gr9.jpg https://s3.amazonaws.com/prod-ucs-content-store-us-east/content/pii:S2468823119304080/gr9/DOWNSAMPLED/image/jpeg/a29c72d9e22be1ae926ce927e5bc50f7/gr9.jpg gr9 gr9.jpg jpg 37489 302 341 IMAGE-DOWNSAMPLED 1-s2.0-S2468823119304080-mmc1.doc https://s3.amazonaws.com/prod-ucs-content-store-us-east/content/pii:S2468823119304080/mmc1/MAIN/application/msword/4c18bce4f059e9989def7390328202b4/mmc1.doc mmc1 mmc1.doc doc 5921280 APPLICATION 1-s2.0-S2468823119304080-si1.svg https://s3.amazonaws.com/prod-ucs-content-store-us-east/content/pii:S2468823119304080/STRIPIN/image/svg+xml/1ed73b820bd77b872773b956eb29e8c5/si1.svg si1 si1.svg svg 24000 ALTIMG 1-s2.0-S2468823119304080-si2.svg https://s3.amazonaws.com/prod-ucs-content-store-us-east/content/pii:S2468823119304080/STRIPIN/image/svg+xml/7c2340a1d3692394d2f0da47366c2d1c/si2.svg si2 si2.svg svg 19108 ALTIMG 1-s2.0-S2468823119304080-si3.svg https://s3.amazonaws.com/prod-ucs-content-store-us-east/content/pii:S2468823119304080/STRIPIN/image/svg+xml/df9e514dcefe2893995bf1e8cdbc668f/si3.svg si3 si3.svg svg 2327 ALTIMG 1-s2.0-S2468823119304080-si4.svg https://s3.amazonaws.com/prod-ucs-content-store-us-east/content/pii:S2468823119304080/STRIPIN/image/svg+xml/8c950f1ca0728702a5d2d0eca0d8bc05/si4.svg si4 si4.svg svg 3496 ALTIMG 1-s2.0-S2468823119304080-si5.svg https://s3.amazonaws.com/prod-ucs-content-store-us-east/content/pii:S2468823119304080/STRIPIN/image/svg+xml/05639c66b74f30dacd6fdeb728fcc0de/si5.svg si5 si5.svg svg 1478 ALTIMG 1-s2.0-S2468823119304080-si6.svg https://s3.amazonaws.com/prod-ucs-content-store-us-east/content/pii:S2468823119304080/STRIPIN/image/svg+xml/2d090d6ee180c0da949bc4e7225d5af1/si6.svg si6 si6.svg svg 33037 ALTIMG 1-s2.0-S2468823119304080-si7.svg https://s3.amazonaws.com/prod-ucs-content-store-us-east/content/pii:S2468823119304080/STRIPIN/image/svg+xml/fa82d0030b21964609a8a55743bc9d26/si7.svg si7 si7.svg svg 5114 ALTIMG 1-s2.0-S2468823119304080-si8.svg https://s3.amazonaws.com/prod-ucs-content-store-us-east/content/pii:S2468823119304080/STRIPIN/image/svg+xml/def27085a3a90d8f95e7dc493b095fd6/si8.svg si8 si8.svg svg 13473 ALTIMG 1-s2.0-S2468823119304080-si9.svg https://s3.amazonaws.com/prod-ucs-content-store-us-east/content/pii:S2468823119304080/STRIPIN/image/svg+xml/5e5eb2a78824f0999edc75efd77ba8ba/si9.svg si9 si9.svg svg 25774 ALTIMG 1-s2.0-S2468823119304080-am.pdf am am.pdf pdf 6944358 AAM-PDF https://s3-eu-west-1.amazonaws.com/prod-ucs-content-store-eu-west/content/egi:10LZPGK54V9/MAIN/application/pdf/354309b258f26f0dff9b099a6dc25484/am.pdf https://s3.amazonaws.com/prod-ucs-content-store-us-east/content/egi:10LZPGK54V9/MAIN/application/pdf/354309b258f26f0dff9b099a6dc25484/am.pdf MCAT 110562 110562 S2468-8231(19)30408-0 10.1016/j.mcat.2019.110562 Elsevier B.V. Fig. 1 Schematic diagram of preparation and microstructure. Fig. 1 Fig. 2 NO conversion of the catalysts during the NH3-SCR reaction over the CeTiOx, CePTiOx, CeMoTiOx and CePMoTiOx catalysts (a), CePyMoTiOx (b), H2O tolerance test at 260 °C (c), SO2 tolerance test at 300 °C (d), 5% O2, GHSV = 30, 000 h−1. Fig. 2 Fig. 3 Activity at high GHSV = 100, 000 h−1(a), NO conversion of H2O tolerance test at 300 °C, 3 vol. % H2O (b), 10 vol. % H2O (c), NO conversion of SO2 tolerance test at 300 °C (d), over the CeTiOx, CePTiOx, CeMoTiOx and CePMoTiOx catalysts, 5% O2, GHSV = 100, 000 h−1. Fig. 3 Fig. 4 XRD patterns of the CeTiOx, CePTiOx, CeMoTiOx and CePMoTiOx catalysts (a) and Raman spectroscopy (b). Fig. 4 Fig. 5 EPR patterns of the CeTiOx, CePTiOx, CeMoTiOx and CePMoTiOx catalysts. Fig. 5 Fig. 6 FTIR results of the CeTiOx, CePTiOx, CeMoTiOx and CePMoTiOx catalysts. Fig. 6 Fig. 7 N2 adsorption-desorption isotherms of the all catalysts detectd at 77.3 K (a) and pore size distribution (b). Fig. 7 Fig. 8 H2-TPR curves (a) and Ce 3d (b), O 1s (c), P 2p (d), Mo 3d (e), Ti 2p (f) the peak-fitting XPS spectra of the catalysts: the CePTiOx (a), CeMoTiOx (b) and CePMoTiOx (c) catalysts. Fig. 8 Fig. 9 the peak-fitting NH3-TPD profiles of the catalysts. Fig. 9 Fig. 10 The relative TOF profiles and Arrhenius plots as a function of temperature over the catalysts. Fig. 10 Fig. 11 Ce 3d (a), O 1s (b), P 2p (c), Mo 3d (d), Ti 2p (e) and P 3p (f) XPS spectra of the CePMoTiOx catalyst fresh (a) and after enduring SO2 test at 240 °C (b) and 300 °C (c), FTIR results of the CePMoTiOx catalyst fresh and after enduring SO2 test at 260 °C and 300 °C (g). Fig. 11 Fig. 12 The significance of molybdenum and phosphorus modified and optimized on the ceria- titanium catalysts for NH3- SCR. Fig. 12 Table 1 The specific surface area and pore properties of the CeTiOx, CePTiOx, CeMoTiOx and CePMoTiOx catalysts. Table 1 Catalyst BET surface are (m2 g−1) Pore volume (cm3 g−1) Pore size(nm) CeTiOx 87.79 0.081 3.71 CePTiOx 139.91 0.097 2.79 CeMoTiOx 181.28 0.132 2.92 CePMoTiOx 185.17 0.130 2.81 Table 2 The H2 consumed of the H2-TPR test over the CeTiOx, CePTiOx, CeMoTiOx and CePMoTiOx catalysts. Table 2 sample Peak Total T a S b T S T S T S S CePTiOx – – 535.1 13.9 626.2 28.4 689.2 24.3 66.6 CeMoTiOx 460.7 4.6 516.3 8.6 584.2 24.8 666.3 34.4 72.4 CePMoTiOx 417.0 2.1 523.8 17.5 613.4 22.3 – – 41.9 a The peak at temperature (°C). b Sum area (umol g−1). Table 3 The surface atomic content and the peak-fitting results of Ce 3d, O1 s, P 2p, Mo 3d and Ti 2p spectra of the CePTiOx, CeMoTiOx and CePMoTiOx catalysts. Table 3 Catalyst Surface composition (at. %) Oα/(Oα+Oβ) × 100% Ce3+/(Ce3++Ce4+) × 100% Ce O P Mo Ti CePTiOx 4.43 70.49 11.88 – 13.21 35.34 41.85 CeMoTiOx 4.79 72.69 – 2.83 19.68 20.66 49.57 CePMoTiOx 4.26 70.33 9.67 0.23 15.50 55.92 41.95 Table 4 The amount of surface acids of NH3-TPD measured over the the CePTiOx, CeMoTiOx and CePMoTiOx catalysts. Table 4 sample Weak Weak Strong Strong Total T a S b T S T S T S S CePTiOx 171.1 2344.8 206.0 6539.1 266.1 5164.9 328.8 6352.5 20401.3 CeMoTiOx 181.7 6062.8 235.0 12038.1 319.1 8086.6 376.9 7120.0 33307.5 CePMoTiOx 175.6 6120.6 231.7 12544.0 331.2 11523.5 – – 30188.1 a The peak at temperature (°C). b Sum area (umol g−1). Table 5 The surface atomic content and the peak-fitting results of the CePMoTiOx catalyst after enduring SO2 test at 260 and 300 °C. Table 5 Catalyst Surface composition (at. %) Oα/ (Oα+Oβ) × 100% Ce3+/ (Ce3++Ce4+) × 100% Ce O P Mo Ti S Fresh 4.26 70.33 9.67 0.23 15.50 – 55.92 41.95 260 °C 4.36 68.71 5.51 0.98 17.56 2.88 45.27 50.36 300 °C 5.08 67.27 6.18 1.02 18.65 1.80 54.73 50.22 New insight into the synergistic promotion effect of phosphorus and molybdenum on the ceria-titanium catalysts for superior SCR performance Guodong Zhang a Xiaosheng Huang a b Zhicheng Tang a ⁎ a State Key Laboratory for Oxo Synthesis and Selective Oxidation, and National Engineering Research Center for Fine Petrochemical Intermediates, Lanzhou Institute of Chemical Physics, Chinese Academy of Sciences, Lanzhou, 730000, PR China State Key Laboratory for Oxo Synthesis and Selective Oxidation and National Engineering Research Center for Fine Petrochemical Intermediates Lanzhou Institute of Chemical Physics Chinese Academy of Sciences Lanzhou 730000 PR China (a. State Key Laboratory for Oxo Synthesis and Selective Oxidation, and National Engineering Research Center for Fine Petrochemical Intermediates, Lanzhou Institute of Chemical Physics, Chinese Academy of Sciences, Lanzhou, 730000, China b University of Chinese Academy of Sciences, Beijing, 100039, PR China University of Chinese Academy of Sciences Beijing 100039 PR China b. University of Chinese Academy of Sciences, Beijing 100039, PR China) ⁎ Corresponding author. Graphical abstract In this paper, the CePMoTiOx catalysts synthesized by via solvothermal synthesis method, the advantages of phosphorus and molybdenum were obviously represented in the performance of catalyst SCR. The arrangement of each component was more reasonable and the synergistic interaction between the components was promoted. The CePTiOx, CeMoTiOx and CePMoTiOx catalysts were synthesized via a solvothermal method and phosphorous or molybdenum was effectively doped into the cerium- titanium catalyst system. Although each component of the catalysts presented a high dispersion, which was clarified by crystal structure analysis, the performance of selective catalytic reduction (SCR) was dramatically individual. Three kinds of catalysts were systematically analyzed, which confirmed significant difference in microstructure and chemical characteristics. Notably, the CePMoTiOx catalyst exhibited a superior SCR reactivity, not only the NO conversion more than 80% ranging from 260 to 440 °C, but also displayed satisfactory H2O/SO2 durability and the airspeed resistance. It was verified that the trapping sites, oxygen vacancies, Brønsted acid sites and the specific surface areas were definitely promoted, pore channel was optimized, synergistic interaction among the components and reducibility were enhanced, which benefited from a suitable amount of phosphorus and molybdenum simultaneously doping into cerium-titanium catalyst. It was obvious that the advantages of phosphorus and molybdenum were combined for CePMoTiOx by a facile way. Meanwhile, it confirmed that the Mo species were apt to associate with SO2, which preserved high SCR activity during the SO2 resistance. These detailed studies could establish basic theory and provide some significant concepts for the construction of subsequent high performance catalysts. Keywords Solvothermal synthesis Selective catalytic reduction Trapping sites and oxygen vacancies Microstructure and reducibility 1 Introduction Human health and social sustainable development have been plagued by environmental pollution, especially the problem of atmospheric pollution and climate warming is particularly fraught, and the emission of nitrogen oxides is considered as one of the major atmospheric pollution [1–3]. The SCR has been applied to control and relief NOx emissions from power plants, V2O5–WO3 (MoO3)/ TiO2 commercial catalysts have been studied and applied for decades [4–8]. Nevertheless, vanadium catalysts are less and less utilized because of the innate disadvantages such as biological toxicity and narrow temperature range. The rare earth (cerium based) catalysts have been regarded as one of the most promising alternative to vanadium- based catalyst, attributing to eco-friendly, inexpensive and abundant reserves [9–12]. Ce-based catalysts have been more and more researched for the SCR due to the remarkable oxygen storage capacity [13,14]. However, there are many challenges in the practical application of Ce-based catalysts, such as poor thermal stability, weak resistance to water and sulfur, etc. Therefore, it is prospective and necessary to improve the performance of cerium catalyst by taking reasonable measures. Cerium dioxide, which was uniformly loaded or dispersed on surface and tunnel structures of titanium dioxide by the impregnation or coprecipitation method, can not only improve the dispersion but also promote the adsorption capacity of the reactants by using the surface acidity of titanium dioxide [9,15–17] and benefiting from the abundant acid sites existing on the surface of titanium dioxide. In addition, the SCR performance can be significantly improved by doping transition metal elements, such as molybdenum or tungsten, ascribe to increase defects and oxygen vacancies and improve the synergistic interaction among catalyst components. More importantly, it is reported that some inorganic elements (such as phosphorus) can improve the surface acidity of cerium catalysts and increase the activity at low temperature [18]. Some researchers report that adding phosphorus could not only increase the acidic sites on the surface of the Ce-based catalyst [18–20]. On the contrary, a series of studies reported that the addition of a few of phosphorus have a significant deactivation effect on SCR reaction for the CeO2-MoO3/TiO2 catalyst [21,22]. On the one hand, the structure was destroyed and more deactivated compounds were formed, such as CePO4. On the other, redox properties and the synergistic effect between components declined seriously [21–23]. Therefore, it is necessary to use an ideal synthesis to improve the activity of catalyst by effectively doping phosphorus. Herein, some positive and effective strategies are studied in this work, phosphorus and molybdenum were doped in ceria-titanium metal oxides via a solvothermal synthesis, and the CePMoTiOx catalyst exhibited superior performance on SCR reaction. More importantly, the CePTiOx, CeMoTiOx and CePMoTiOx catalysts were prepared through the same process, while showing significant differences in activity. Moreover, these catalysts are characterized and analyzed in detail, through comprehensive study catalyst crystal structure, pore structure, redox properties of SCR activity, exploring structure-activity relationship between catalysts internal, as to provide theoretical basis for study of high-performance catalyst. 2 Experimental 2.1 Catalyst preparation All catalysts were synthesized via a solvothermal method, which had been reported minutely in our previous works [24,25], different structure of the catalysts were prepared in accordance with the above methods, and as showed in Fig. 1 . In the present study, CePMoTiOx, 2.4 g of urea, 0.5 mL of hydrochloric acid and 1.16 g of Pluronic P123 were mixed in ethanol (20.0 mL) under stirring intensely, which was labeled A solution. 0.5 mL of hydrochloric acid and 5.32 g of tetrabutyl titanate were mingled in ethanol (20.0 mL) with violent stirring, 1.34 g of Ce(NO3)3·6H2O, 0.312 g of ammonium phosphate and 0.27 g of hexaammonium molybdate were added respectively into the ethanol solution, in brief, Ce: Mo: P: Ti = 2: 1: 1: 10 in molar proportions, which was viewed as B ingredient. Then, the A and B ingredients were mixed into a 100 mL PTFE autoclave and maintained at 80 °C for 48 h, and rose to 120 °C for 5 h. Eventually, the samples were assembled by filtration and washed by alcohol three times, dried at 100 °C for 12 h and annealed in air at 400 °C for 3 h (2 °C min−1). As a contrast, CeTiOx, CePTiOx and CeMoTiOx were prepared through the same process. In addition, the effect of different contents was also studied for the phosphorus, for instance, CeP0.05MoTiOx and CeP0.2MoTiOx. 2.2 Analytical instrumentation XRD patterns were characterized by X′ Pert PRO, PANalytical with Cu Kα radiation (40 kV, 55 mA). Transmission electron microscopy (TEM) was observed by JEOL JEM-2010. Laser Raman spectroscopy (LRS) was determined by a RM 2000 microscope (514 nm). The electron paramagnetic resonance (EPR) was measured at room temperature using a Bruker A300-9.5/ 12-type spectrometer. N2 adsorption- desorption isotherms were determined by a ASAP 2020 Micromeritics. Fourier Transform infrared spectroscopy (FTIR) was determined by a NEXUS 870 Thermo. X-ray photoelectron spectroscopy (XPS) were investigated by ESCALAB 250Xi, ThermoFisher Scientific. The hydrogen temperature programmed reduction (H2-TPR) was measured by DAS-7000 (5 vol. % H2, 95 vol. % N2 and 40 mL min−1). The tests conditions of ammonia gas temperature programmed desorption (NH3-TPD) and H2-TPR are the same. 2.3 Catalytic activity measurements The SCR performance was measured in a static bed miniature evaluation device using 0.4 or 0.12 g of the catalysts, when employing 0.4 g (0.12 g), the gas hourly space velocity (GHSV) value was calculated as 30, 000 h−1(100, 000 h−1). The reaction system was performed as expected ranging of 100–480 °C. Meanwhile, the feed gas mixture was consisted of 500 ppm NO, 5 vol% O2, 500 ppm NH3, 100 ppm SO2, 3 or 10 vol% H2O, N2 was used as a balance gas. The concentrations of NO and SO2 were continuously detected by a KM9106. The NO percent conversion was calculated according to the following expression [25,26]: (1) NO conversion ( % ) = NO i n l e t − NO o u t l e t NO i n l e t × 100 % A relative turnover frequency (TOF) value was employed to match the SCR velocity under a GHSV of 100, 000 h−1. Which was evaluated draw on the equation [25–28]: (2) TOF = ( P F 0 / RT ) α m c a t β C e / M C e Where P is 101 kPa, F 0 is the flow velocity of reaction (0.1 mL min−1), R is 8.314 J mol−1 K−1, α is the NO transformation (%), mcat is 0.12 g of the sample, β C e is Ce content (%) and MCe is 140.1 g mol−1. T is 393, 413, 433 and 453 K test temperature point. The reaction rate ( r ) and activation energy was assessed in accordance with the expression [2,4,5]: (3) r = F 0 m c a t × [ − ln ( 1 − α ) ] (4) r = k C 0 (5) k = A • exp − Ea RT (6) ln r = − Ea RT + B Where k (s−1) and B are considered constant, and the other parameters are the same as Eq. (2). 3 Results and discussion 3.1 Catalytic performance The CeTiOx, CePTiOx, CeMoTiOx and CePMoTiOx catalysts were used in the NH3-SCR ranging from 100 to 480 °C, as exhibited in Fig. 2 (a). The NO conversion of the CeTiOx catalyst was 90% ranging of 260–380 °C under a GHSV of 30, 000 h−1, while the CePTiOx catalyst presented much lower conversion than that of the CeTiOx catalyst, which illustrated that phosphorus might play a toxic role in cerium- titanium NH3-SCR catalyst [17–19]. Especially, the activity was significantly decreased below 360 °C, suggesting that adsorption property of reactants might be reduced. The CeMoTiOx catalyst showed exceed 80% of NOx conversion ranging of 240–420 °C under the same GHSV, which elucidated that molybdenum species modifying CeMoTiOx catalyst exhibited superior low-temperature NH3-SCR activity. Not only could the acid sites be enhanced, but also the synergistic interaction between metal oxides was strengthened [13,28,29]. Distinctly, the CePMoTiOx catalyst presented an ascendant reactivity ranging from 200 to 400 °C, comparing with the others. It illuminated that the phosphorous and molybdenum were introduced simultaneously into the cerium- titanium catalyst system in a reasonable method, which could greatly improve the SCR reaction activity. On one hand, they could enhance the acidity of the catalyst, on the other, intrinsic defects and oxygen vacancies are increased directionally. It showed that the advantages of inorganic and transition metal elements were utilized reasonably and effectively, which has seldom been reported in the field of NH3-SCR to the best of our knowledge. In addition, the catalysts with different phosphorous contents were tested, as showed in Fig. 2(b). The catalyst CePMoTiOx exhibited better NH3-SCR activity in the temperature range of operation (200–440 °C). The appropriate phosphorous was doped into CeO2-MoO3-TiO2 catalyst system, which was advantageous to low-temperature NH3-SCR and the performance of catalysts was followed the order: CePMoTiOx＞CeP0.05MoTiO x ＞CeP0.2MoTiOx. This result illuminated that a suitable amount of phosphorus and molybdenum doped into cerium titanium catalyst, which could effectively improve the catalytic activity [30]. 3.2 H2O and SO2 resistant properties As is well-known, H2O resistance is essential to the application of catalysts. The water resistance of all the catalysts was measured with 3% vol. H2O as a function of time at 260 °C (Fig. 2c). Obviously, the CePMoTiOx catalyst preformed higher reactivity than that of others. Interestingly, The NO conversion over the CeMoTiOx catalyst declined from 98% to 90%, while that of the CePTiOx and CePMoTiOx catalysts had little effect during the whole H2O tolerance test. Analogously, some certain of SO2 existed exhaust gas and owned a serious inactivation on the NH3-SCR (Fig. 2d). NO conversion of the CeTiOx catalyst decreased from 95% to 70% as soon as SO2 entering mixed gases, and that of the CeMoTiOx and CePMoTiOx catalysts remained above 80%, suggested that the sulfur resistance of the catalysts could be improved via proper doping of molybdenum. 3.3 Activity, H2O and SO2 resistant properties at high GHSV Remarkably, in order to further investigate catalyst performance, all of the catalysts was evaluated under a high GHSV of 100 000 h−1 (Fig. 3a). The NO conversion more than 80% of the CePMoTiOx catalyst ranging from 260 to 440 °C and the performance was superior to other catalysts. It was obvious that the CePMoTiOx catalyst had a satisfactory resistance of the airspeed, which benefits from the addition of phosphorus and molybdenum into the catalyst system to improve the oxidation-reduction ability. Moreover, all of the catalysts were investigated at 260 °C (Fig. 1S†) and 300 °C (Fig. 3b) under the same GHSV with 3% vol. H2O. The NO conversion of all the CeTiOx and CeMoTiOx catalysts was significantly declined when 3 vol. % H2O vapour was turning into the reaction system at 260 °C, while that of the CePTiOx and CePMoTiOx catalysts had a slight decreased and the activity recovered after removing the water, which implicated that water and reactants were competing adsorption on the surface of catalysts during the tolerance of H2O test. The results were also demonstrated by 3 vol. % water resistance tests at 300 °C. Moreover, many industrial flue gases contained large amounts of water, such as ceramic furnaces. The catalysts were evaluated in more rigorous environments (100 000 h−1 GHSV, 10 vol. % H2O, Fig. 3c). The NO conversion of the CePTiOx and CePMoTiOx catalysts was better than that of others, which meant that the surface of the catalysts might be modified and owned water-resistant properties by doped phosphorus. The CeTiOx, CePTiOx, CeMoTiOx and CePMoTiOx catalysts were examined at 260 °C (Fig. 2S†) and 300 °C (Fig. 3d) under a GHSV of 100, 000 h−1 with 100 ppm concentration of SO2. The NO conversion of the CeTiOx and CePTiOx catalyst was linear dropping from 80% to almost no any activity at 260 °C as soon as adding into 100 ppm SO2, while the activity of CeMoTiOx and CePMoTiOx also decreased sharply and did not distinctly recover after the SO2 gas was cutting off. However, when the temperature increased to 300 °C, The NO conversion of the CePMoTiOx catalyst was declined from 92% to 80% under the same conditions as well as recovered 82% after turning off SO2, and that of the others exhibited identical phenomena. These results illustrated that the reactants combined with SO2 and generated undecomposed compounds and covered the active sites, such as ABS (ammonium bisulfate sulfate), so that the SCR performance of the catalyst decreased obviously, which would be also confirmed by subsequent works.. Generally, there was no doubt that the NH3-SCR performance of the CePMoTiOx catalyst was improved when the phosphorous and molybdenum were doping simultaneously into the cerium- titanium catalysis system by a solvothermal method, which might be profiting from the optimization of catalyst oxidation-reduction property, increasing trapping sites, oxygen vacancies and surface chemical groups, promoting synergistic interaction between metal oxides. 3.4 Structure of the catalyst The XRD peaks of the CeTiOx, CePTiOx, CeMoTiOx and CePMoTiOx catalysts are exhibited in Fig.4 (a). The CeTiOx catalyst was consisted of typical anatase and fluorite of CeO2 [9,24,25]. Astonishingly, the CePTiOx, CeMoTiOx and CePMoTiOx catalysts did not display any characteristic peaks, indicating that the crystallinity of any species was weak by doping a few of phosphorus or molybdenum. Moreover, the dispersion of CePMoTiOx catalyst was superior to that of other catalysts by HRTEM (Fig. S3- 5†), which could be promoted synergistic effect of different components [15,25,28,29]. In order to distinguish some subtle differences of catalyst structure, all of the catalysts were detected by the Raman spectroscopy (Fig. 4b). Compared with CeTiOx catalyst, except for a weak peak of the CeMoTiOx catalyst located at around 462 cm−1 were identified the features of F2g (CeO2), the representative peaks of TiO2, MoO3 and CeO2 had almost not been detected. While, the signally bands of the three catalysts around 255 and 596 cm−1 were attribute to oxygen vacancies, which could accelerate the conversion frequency between chemical adsorption oxygen (Oα) and lattice oxygen (Oβ) in the transformation process of Ce3+ and Ce4+ [31–33]. The characteristic peak of the CePTiOx catalyst centered at 950 cm−1 was defined as Q0, which was attributable to the existence of non-bridging oxygen (PO) [34]. It elucidated that the defects and oxygen vacancies in the CePTiOx and CePMoTiOx catalyst were caused by the doping of phosphorus. For the sake of obtaining more accurate information about defects and oxygen vacancies, the catalysts were characterized the EPR (Fig. 5 ). The CePTiOx catalyst showed the strongest signal peaks, indicating that the unpaired electron occured in the the homogeneous phase and the titanium and phosphorus existed in high energy state. A broad resonance linewidth at g = 2.10 was identified as surface superoxide species (Ce-O2 −) [35,36]. The signal centered at g = 1.978 had been attributed to interface Ti3+, illustrating that there existed distinct classes of anatase surface trapping sites for the CePTiOx and CePMoTiOx catalysts [37,38]. The relatively higher signal (g = 1.96) of the CeTiOx catalyst was ascribed to Ce3+ presenting in the CeO2 bulk, which corresponded with the result of XRD [35,39]. The obviously strongest signal peak (g = 1.93) was belonged to Ce3+ emerging on the CeO2 surface [35,39]. It is obviously plentiful trapping sites and oxygen vacancies existed in the CePTiOx catalyst, while the CePMoTiOx catalyst also possessed more crystal defects and oxygen vacancies than that of the CeTiOx and CeMoTiOx catalyst (Fig. S5–9†), which was consisted with the conclusion of Raman, indicating that internal microcosmic structure of the catalyst were totally different attributing to the dopant of phosphorus or molybdenum into the CeTiOx catalyst. More oxygen vacancies might promote NO oxidation, which was tested (Fig. S10†). The rule was consistent with the above conclusion: CePTiOx＞ CePMoTiOx＞ CeMoTiOx≈ CeTiOx. In addition, the different functional groups on the surface of the catalysts were also analyzed by FTIR (Fig. 6 ). The IR bands around at 2960 and 1380 cm−1 were identified as trace of P123 templates', which illuminated that the template agents had been substantially removed from all catalysts [40]. The peaks at 1625 cm−1 corresponded to the asymmetrical change angle vibration of NH4 + species and the wave number at 1280 cm−1 were defined as nitrate species, suggesting that a handful of nitrates had not been decomposed [41–43]. The absorption peaks ranging from 3310 cm−1 to 3460 cm−1 were ascribed to the HO stretching vibration. Interestingly, In spite of the typical characteristic peaks above, the band at 1150 cm−1 were defined as stretching vibration of PH and a broad peak at around 1040 cm−1 were verified to Ti-O-P framework vibrations [44]. It indicated that a little of phosphorus was effectively doped into the titanium dioxide structure of the CePMoTiOx catalyst, under the same synthetic method, more phosphorus combined with titanium dioxide and formed more complex compounds for the CePTiOx catalyst. Therefore, the catalyst exhibited distinct difference of catalytic activity in NH3-SCR reaction, which could be explained rationally. Ammonia was firstly combined with PH or PO on the surface of the CePTiOx catalyst and uncomfortable to adsorb or activate by titanium dioxide, thereby, the “fast SCR” was obstructed at low temperature ranges, by contrast, the CePMoTiOx catalyst possessed a superior performance under a high GHSV of 100 000 h−1, profiting from a suitable amount of PO groups promoting the adsorption of ammonia. Besides, the CePTiOx catalyst showed a better activity that that of others during the whole H2O tolerance test under a higher GHSV, because the combination of PH and PO with H2O on the surface, so as to avoid competing with ammonia. Except for the defects and oxygen vacancies increased, the channel structure of the catalysts was obviously optimized after doped phosphorus and molybdenum. The porosity of the catalysts was measured by the nitrogen adsorption and desorption isotherms (Fig. 7 a) and the results were listed in Table 1 . The CeTiOx and CePTiOx catalysts represented a H1 isotherm of type IV, which is the cause of the accumulation of flaky particles. The CeMoTiOx and CePMoTiOx catalysts exhibited a H3 isotherm of type IV and a clear closed loop was constituted in the relative pressure ranging from 0.4 to 0.5, which was a typical homogeneous particle accumulation. The channel size of the CeMoTiOx and CePMoTiOx catalyst were more concentrated, which was also obtained the same conclusion from the pore diameter distribution curves (Fig. 7b). The pore channel of the CePMoTiOx catalyst was more concentrated ranging from 2 to 5 nm than that of others, implying that uniform pore channels were facilitate to SCR [32,45,46]. On the side, the specific surface area of the catalysts was increased in the regulation: CeTiOx (87.79 m2 g−1) ＜CePTiOx (139.91 m2 g−1)＜CeMoTiOx (181.28 m2 g−1) ＜CePMoTiOx (185.17 m2 g−1). Finally, the CePMoTiOx catalyst possessed higher pore volumes (0.130 cm3 g−1), implying that the pore structure of the catalyst might be improved via the appropriate mixture of phosphorus and molybdenum. 3.5 Catalysts reducibility The reducibility of the catalysts has the key effect to the NH3-SCR, which was verified by H2- TPR. All the reductive peaks were integrated via mapping for the optimum unity, as depicted in Fig. 8 (a) and the results were disposed in Table 2 . For the CePMoTiOx catalyst, the peak ranging from 350 to 450 °C was related to Oα of cerium dioxide or type Ce4+-O-Ce4+ [47–49], while that of CeMoTiOx moved about 50 °C to the high temperature region and that of CePTiOx had not been detected. It indicated that chemical adsorption oxygen of the CePMoTiOx catalyst exhibited higher activity than that of others, which was favorable to“fast-SCR” reaction. The peak of the CeMoTiOx catalyst ranging of 450–580 °C was belonged to the reductive unformed Mo species [50], that of the CePMoTiOx catalyst was not almost surveyed, suggesting that surface Mo species have better dispersion or combination with others species. The peak around 530 °C was assigned to non-stoichiometric ceria of type Ce3+-O-Ce4+ [51,52], and the temperature conformed to the following rules: CeMoTiOx (584.2 °C) ＞CePTiOx(535.1 °C) ＞CePMoTiOx (523.8 °C). Finally, the peak at 630 °C was ascribe to lattice oxygen or stoichiometric ceria of type Ce3+-O-Ce4+, that of the CePMoTiOx catalyst located at the lower temperature, which implicated that the reducibility of the catalyst has greatly been enhanced and attributed to the interoperable effect among the components via the doping of phosphorus and molybdenum. Except as the macroscopically reduction of the catalysts by H2-TPR, the more detailed information of each element was researched via XPS. The every element peak of the CePTiOx, CeMoTiOx and CePMoTiOx catalysts was resolved by exploring for the optimum combination (Fig. 8b–f), and the surface atomic concentration was summarized in Table 3 . The labeled v′ and u′ of the Ce 3d peaks are defined as the 3d104f1 initial electronic state attributing to Ce3+ species. Generally speaking, when the Ce3+/ (Ce4+ + Ce3+) ratio would be higher, the transformation between Ce4+ and Ce3+ could be more frequently and the Oα was more often produced. Nevertheless, for the CePMoTiOx catalyst, Ce3+/ (Ce4++ Ce3+) ratios arranged in the middle of the three samples, while Oα/ (Oα + Oβ) ratio was the highest of all (Fig. 8c). It indicated that more the active surface oxygen was generated by defects and oxygen vacancies, ascribing to the dopant of proper phosphorus and molybdenum. It should be pointed out that the oxygen binding energy barrier has a great difference in the three catalysts (Fig. 8c). There were four species that combined with oxygen to produce different binding energies. The peak located at the highest energy state (533.0 eV) belonging to non-bridging oxygen (PO), the peak centered at 531.5 eV was defined as bridging oxygen (POP) [53,54]. For the CePTiOx catalyst, the peak of around 532.4 eV was consisted of PO and PO and the peak at 530.7 eV were relatively higher than lattice oxygen (Oβ, 530.2 eV), attributing to phosphorus forming a stable bond on the surface of titanium. In addition, the transformation of these structures could also be perceived by analyzing the XPS spectra of P 2p (Fig. 8d) and Ti 2p (Fig. 8f). The P 2p binding energy at lower energy than that of P2O5 (135.2 eV) and the bond strength located at higher energies state than that of TiO2. It was obvious that the phosphorus doping into TiO2 structure to form a stable chemical bond. Hence, it was difficult that titanium dioxide formed to crystallize, attributing to the existence of these bonds. It was possible that the titanium surface combined with plentiful phosphorus to form the P-O-Ti structure [23,55–57]. Although the acid sites of the CePTiOx catalyst were strengthened, ammonia was more likely to combine with the phosphorus species. Therefore, the CePTiOx catalyst was weaker than that of others catalyst. The peak around 531.7 eV was assigned to Oα. Regard to the CeMoTiOx catalyst, the binding energies of Oα had not been affected, suggesting that Mo species were well dispersed within metal oxides by solvothermal synthesis, and prevented the formation of bulk TiO2 or CeO2, which could be beneficial to synergy among the metal oxides, according with W. Shan’s report [50,58,59]. Observably, the Oα binging energies of the CePMoTiOx catalyst was much lower than that of the CePTiOx catalyst and it had higher Oα/ (Oα + Oβ) ratio than that of others, which implicated that the ability of oxidation and reduction was notably enhanced due to the uniformly doping of molybdenum and phosphorus. It demonstrated that the CePMoTiOx catalyst had higher SCR activity attribute to higher the active surface oxygen content, which was facilitated to the oxidation of NO oxidation and promoted the “fast SCR’’ reaction. Astoundingly, the XPS spectra of Mo 3d had been not examined any signal value (Fig. 8e). It might be low in content, but more likely that the molybdenum species were introduced into interior structure of the CePMoTiOx catalyst via solvent thermal synthesis, which could be confirmed by succeeding studies. Different structures of cerium titanium catalysts were synthesized through the same way. Only via adjusting the different doping elements, three different structures and chemical states had been established. There is a significative relationship between catalyst crystal and pore structure, chemical and catalytic performance. 3.6 Surface acidities (NH3-TPD) In addition to improving the oxidation-reduction performance of the catalyst, enhancing the surface acidity is considered to one of available approach, which can promote the adsorption of ammonia [60]. All the NH3- TPD curves had been matched (Fig. 9 ) and the data had been listed in Table 4 . The Brønsted or weak acid sites of the CePTiOx catalyst was obviously strengthened, which was consistent with Z. Wu’s report [19,20]. However, compared with the CeMoTiOx catalyst, it has relatively few strong or Lewis acid sites. The CePMoTiOx catalyst combined the advantages of the CePTiOx and CeMoTiOx catalysts, not only had more Brønsted acid sites, but also had more Lewis acid sites. It illustrated that the catalyst could efficiently absorb NH3 at a wide temperature range, which was favorable to SCR reaction. 3.7 The relative TOF and activation energy calculation results Except as detailed comparing the catalytic velocity of the three samples under a high GHSV (100, 000 h−1) at low temperature, The TOF value was evaluated [32,41], and as a operation of temperature were displayed in Fig. 10 (a). In the range of 120–180 °C, the CeMoTiOx catalyst had weak NH3-SCR performance under a high GHSV, as well as its TOF value was relatively low. On the contrary, the CePMoTiOx catalyst exhibited better NH3-SCR activity in the same temperature range and the TOF value was also higher, indicating that the doping of phosphorus was more likely to combine with the reactants under a high GHSV. For the CePTiOx catalyst, the TOF value increased rapidly in the process of temperature rising, elucidating that the suitable doping of phosphorus could promote the airspeed performance. The value of activation energy was evaluated to the Eqs. (3–6) and the data fitted in Fig. 10(b). The catalyst possessed a lower activation energy (26.70 ± 1.87 kJ mol−1) than that of others catalyst. In addition, the relationship between the Oα/Ototal and kinetic parameters presented linear (Table S1 and Fig. S11†), it illustrated that the activity of SCR was improved due to the doping of phosphorus and molybdenum into cerium- titanium catalyst, which could be increased defects, oxygen vacancies and synergistic interaction among components. 3.8 Surface component and chemical states after enduring SO2 test In order to explore more about the catalytic relationship between structure and performance, the CePMoTiOx catalyst after resistance SO2 test at 260 °C and 300 °C was additionally detected by XPS and the relevant results were represented in Fig. 11 and Table 5 . It was noteworthy that the surface atomic concentration of Mo and S were accelerated rapidly, as well as that of Ti was increased, implying SO2 might be preferential combined with Mo and Ti species to depress the activity of the catalyst during the resistance SO2 test. Meanwhile, that of P was reduced by nearly half and that of O was decreased. Although the change of Ce content was not significant, the proportion of Ce3+/ (Ce4+ + Ce3+) had been markedly changed and followed the order: fresh ＜300 °C ＜260 °C (Fig. 11a). It illuminated that the transformation between Ce4+ and Ce3+ during NH3-SCR reaction, according to the equation: 4Ce4+ + O2−↔ 4Ce4+ + 2 e− + 0.5O2 ↔ 2Ce4+ + 2Ce3+ + 0.5O2. The NO conversion was dramatically declined during SO2 test at 260 °C because the conversion process in Ce3+→ Ce4+ was hindered in the process, which was confirmed by our previous research [9,25]. Identically, after the resistance SO2 test, the binding energies of O had been also influenced and Oα/ (Oα + Oβ) performed an opposite regular : 260 °C＜ 300 °C＜ fresh, which illustrated reduction of Ce4+ was benificial to operating and the progress of oxidation of Ce3+ was inhibited. Furthermore, the percentage of Oα/ (Oα + Oβ) was obviously decreased, which suggested that the microstructure of the CePMoTiOx catalyst had been changed after the resistance SO2 test at 260 °C. It was confirmed that partial the defects and oxygen vacancies had been destroyed as well as the synergistic effect of the components had been weakened. The P 2p and Ti 2p binding located at lower energies than that of fresh, remarkably, the content of molybdenum on catalyst was significantly accelerated. It indicated that the Mo species were preferentially combined with SO2 on surface of the CePMoTiOx catalyst and the structure had been irreversible damaged, which was similar to the anti-arsenic properties of Mo in commercial catalysts [61,62]. The passivated sulfur species were also analyzed in detail via XPS. The surface S atomic content at 260 °C was much higher than that at 300 °C, suggested that the CePMoTiOx catalyst was toxic attributing to deposition of the abundant sulfur compounds. The obvious peaks located at higher binding energy (169.98 eV and 168.72 eV) were assigned to the S 2p1/2 and 2p3/2 transitions of SO4 2−, which was higher that ABS- TiO2 [63,64], deduced that the SO4 2− was not only associated with titanium dioxide, but also combined with others, such as Mo and Ce species. The weak peak at 166.69 eV was related to SO3 2− species [65], illustrating that a few of SO2 was adsorbed by TiO2. The sulfate species were more closely united with Mo species [66] to protect the active site during the resistance SO2 test at 300 °C. Binding energies of S4+ centered at 166.13 eV was lower than that at 260 °C, demonstrating that SO2 were priori associated with Mo species and possess a higher electron could density [63,64,66]. Therefore, the process of sulfur dioxide combined and decomposed on the surface molybdenum species and protected the activity sites of the CePMoTiOx catalyst above 300 °C. In order to further research the transformation about functional groups of the CePMoTiOx catalyst surface after the SO2 resistance test, the samples were examined by FTIR (Fig. 11g). Obviously, for the CePMoTiOx catalyst after enduring SO2 test at 260 °C, a broad peak at aroud 3170 cm−1 was identified as antisymmetric stretching vibration of NH4 +. Moreover, the vibration of symmetric angle (NH4 +, 1720 cm−1), asymmetric angle (NH3 +, 1620 cm−1) and antisymmetric stretching vibration of bridging nitrate species (1280 cm−1) had been stronger and wider, and a sharp and intense peak located at 1400 cm−1 was ascribed to stretching vibration peak of SO [67–71]. According to the analysis results of XPS, there are a mass of sulfates, nitrates and ammonium salts on the surface of the catalyst. It suggested that these intermediate products could not be decomposed but were combined with the titanium dioxide or other components to weaken the synergistic effect of the metal oxides at low temperature, which is the key function for the inactivation of the catalyst. 3.9 The influence mechanism of phosphorus and molybdenum element on SCR The SCR reaction activity of the cerium- titanium catalyst was designedly improved via solvothermal method with the appropriate doping of phosphorus and molybdenum simultaneously. Not only pore channel was optimized and the components were more uniformly dispersed, but also the advantages of inorganic phosphorus and transition metal molybdenum elements were obviously developed in the performance of NH3-SCR (Fig. 12 ). The arrangement of each component was more reasonable and the synergistic interaction between the components was promoted. The trapping sites and oxygen vacancies were definitely improved, as well as the adsorption of the reactants was enhanced with phosphorus groups (PH and PO) by the suitable introduction of phosphorus, which was favorable to NO conversion in the presence of water vapor and a high GHSV. The molybdenum species were effectively dispersed in the whole phase structure, which could migrate to the surface of the catalyst and protect the active centers when SO2 was contacting with the CePMoTiOx catalyst. It was seldom reported that comprehensive utilization of transition metal element and inorganic element improved the SCR performance of catalysts, which could afford professionally the speculation for design and preparation of excellent catalyst. 4 Conclusions The CeTiOx, CePTiOx, CeMoTiOx and CePMoTiOx catalysts with individual microstructure and chemical properties were synthesized by solvothermal method, and their SCR performance was significantly different. For the CePTiOx catalyst, a plenty of phosphorus was doped efficiently into the structure of anatase titanium dioxide, decreased the crystallinity of components and formed a stable chemical bond, such PH and P-O-Ti. Although there are abundant Brønsted acid sites, trapping sites and oxygen vacancies, ammonia was liable to combine with the phosphorus species, difficult to contact with active centers at low temperature range, and the “fast SCR” reaction was hindered. Therefore, the low- temperature SCR activity of the CePTiOx catalyst was weaker than that of other catalysts, while the catalyst showed better resistance to water because the functional groups on its surface were more likely to combine the PH or PO with H2O rather than NH3. The CeMoTiOx catalyst exhibited preferable SCR performance, because the metal oxides kept a highly dispersed state. It can promote synergy between the components and enhance reducibility for NH3-SCR, while the airspeed resistance was expected to improve. Finally, the CePMoTiOx catalyst not only presented better 90% conversion of NO ranging from 240 °C to 420 °C, but also obtained satisfactory H2O/SO2 durability and the airspeed resistance, attributed to the propre doping of phosphorus and molybdenum into the mesoporous ceria-titanium catalyst. It is confirmed that phosphorus species highly dispersed on the surface of the catalyst, while a little of phosphorus combined with titanium dioxide and generated sufficient Brønsted acid sites, which was facilitate to the adsorption process of ammonia species. It was further worth that the molybdenum species were effectively dispersed in the whole phase structure, which not only increased the Lewis acid sites, but also promoted defects and oxygen vacancies. The H2O/SO2 resistance of the CePMoTiOx catalyst was optimized because the Mo species were liable to associated with SO2 as well as water vapour was more easily combined with phosphorus groups, and migrated to the surface of the catalyst and protected the active centers. The microstructure, redox performance and SCR characteristics of the three catalysts were analyzed in detail, which could afford professionally the speculation for design and preparation of excellent catalyst. Acknowledgments The authors acknowledge the financially support of the National Natural Science Foundation of China (No: 51808529, 21707145) and Province Natural Science Foundation of GanSu (17JR5RA317, 18JR3RA383), Science and Technology Program of Lanzhou City (2018-RC-65). Appendix A Supplementary data Supplementary material related to this article can be found, in the online version, at doi:https://doi.org/10.1016/j.mcat.2019.110562. Appendix A Supplementary data The following is Supplementary data to this article: References [1] J.W. Choung I.S. Nam Characteristics of copper ion exchanged mordenite catalyst deactivated by HCl for the reduction of NOx with NH3 Appl. Catal. B: Environ. 64 2006 42 Choung J. W., Nam I. S., Characteristics of copper ion exchanged mordenite catalyst deactivated by HCl for the reduction of NOx with NH3, Appl. Catal. B: Environ., 2006, 64, 42. [2] T. Zhang F. Qiu J. Li Design and synthesis of core-shell structured meso-Cu-SSZ-13@mesoporous aluminosilicate catalyst for SCR of NOx with NH3: Enhancement of activity, hydrothermal stability and propene poisoning resistance Appl. Catal. B: Environ. 195 2016 48 Zhang T., Qiu F., Li J., Design and synthesis of core-shell structured meso-Cu-SSZ-13@mesoporous aluminosilicate catalyst for SCR of NOx with NH3: Enhancement of activity, hydrothermal stability and propene poisoning resistance, Appl. Catal. B: Environ., 2016, 195, 48. [3] Y. Xin N. Zhang Q. Lia Z. Zhang X. Cao L. Zheng Y. Zeng J.A. Anderson Selective catalytic reduction of NOx with NH3 over short-range ordered WOFe structures with high thermal stability Appl. Catal. B: Environ. 229 2018 81 Xin Y., Zhang N., Lia Q., Zhang Z., Cao X., Zheng L., Zeng Y., Anderson J. A., Selective catalytic reduction of NOx with NH3 over short-range ordered WOFe structures with high thermal stability, Appl. Catal. B: Environ., 2018, 229, 81. [4] J.A. Dumesic N.Y. Topsøe H. Topsøe Y. Chen T. Slabiak Kinetics of selective catalytic reduction of nitric oxide by ammonia over vanadia/ titania J. Catal. 163 1996 409 Dumesic J. A., Topsøe N. Y., Topsøe H., Chen Y., Slabiak T., Kinetics of selective catalytic reduction of nitric oxide by ammonia over vanadia/ titania, J. Catal., 1996, 163, 409. [5] M.D. Amiridis I. Wachs E.G. Deo J.M. Jehng D.S. Kim Reactivity of V2O5 catalysts for the selective catalytic reduction of NO by NH3: influence of vanadia loading, H2O, and SO2 J. Catal. 161 1996 247 256 Amiridis M. D., Wachs I. Deo E., G., Jehng J. M., Kim D. S., Reactivity of V2O5 catalysts for the selective catalytic reduction of NO by NH3: influence of vanadia loading, H2O, and SO2, J. Catal., 161 (1996) 247–256. [6] S. Shwan J. Jansson L. Olssona M. Skoglundh Effect of post- synthesis hydrogen- treatment on the nature of iron species in Fe-BEA as NH3- SCR catalyst Catal. Sci. Technol. 4 2014 2932 Shwan S., Jansson J., Olssona L., Skoglundh M., Effect of post- synthesis hydrogen- treatment on the nature of iron species in Fe-BEA as NH3- SCR catalyst, Catal. Sci. Technol., 2014, 4, 2932. [7] Y. Xin H. Li N. Zhang Q. Li Z. Zhang X. Cao P. Hu L. Zheng J.A. Anderson Molecular- level insight into selective catalytic reduction of NOx with NH3 to N2 over a highly efficient bifunctional Va- MnOx catalyst at low temperature ACS Catal. 8 2018 4937 Xin Y., Li H., Zhang N., Li Q., Zhang Z., Cao X., Hu P., Zheng L., Anderson J. A., Molecular- level insight into selective catalytic reduction of NOx with NH3 to N2 over a highly efficient bifunctional Va- MnOx catalyst at low temperature, ACS Catal., 2018, 8, 4937. [8] J.W. Choung I.S. Nam S.W. Ham Effect of promoters including tungsten and barium on the thermal stability of V2O5/ sulfated TiO2 catalyst for NO reduction by NH3 Catal. Today 111 2006 242 Choung J. W., Nam I. S., Ham S. W., Effect of promoters including tungsten and barium on the thermal stability of V2O5/ sulfated TiO2 catalyst for NO reduction by NH3, Catal. Today, 2006, 111, 242. [9] L. Zong G. Zhang J. Zhao F. Dong J. Zhang Z. Tang Morphology- controlled synthesis of 3D flower- like TiO2 and the superior performance for selective catalytic reduction of NOx with NH3 Chem. Eng. J. 343 2018 500 Zong L., Zhang G., Zhao J., Dong F., Zhang J., Tang Z., Morphology- controlled synthesis of 3D flower- like TiO2 and the superior performance for selective catalytic reduction of NOx with NH3, Chem. Eng. J., 2018, 343, 500. [10] W. Han P. Zhang X. Pan Z. Tang G. Lu Influence of promoter on the catalytic activity of high performance Pd/ PATP catalysts J. Hazard. Mater. 263 2013 299 Han W., Zhang P., Pan X., Tang Z., Lu G., Influence of promoter on the catalytic activity of high performance Pd/ PATP catalysts, J. Hazard. Mater., 2013, 263, 299. [11] J. Choung W.I.S. Nam Role of cerium in promoting the stability of CuHM catalyst against HCl to reduce NO with NH3 Appl. Catal. A Gen. 312 2006 165 Choung J. Nam W., I. S., Role of cerium in promoting the stability of CuHM catalyst against HCl to reduce NO with NH3, Appl. Catal. A: Gen., 2006, 312, 165. [12] D. Zhang X. Du L. Shi R. Gao Shape- controlled synthesis and catalytic application of ceria nanomaterials Dalton Trans. 4 2012 14455 Zhang D., Du X., Shi L., Gao R., Shape- controlled synthesis and catalytic application of ceria nanomaterials, Dalton Trans., 2012, 4, 14455. [13] Y. Liu W. Yao X. Cao X. Weng Y. Wang H. Wang Z. Wu Supercritical water syntheses of CexTiO2 nano- catalysts with a strong metal- support interaction for selective catalytic reduction of NO with NH3 Appl. Catal. B: Environ. 2014 160 161 684 Liu Y., Yao W., Cao X., Weng X., Wang Y., Wang H., Wu Z., Supercritical water syntheses of CexTiO2 nano- catalysts with a strong metal- support interaction for selective catalytic reduction of NO with NH3, Appl. Catal. B: Environ., 2014, 160–161, 684. [14] K.A. Michalow-Mauke Y. Lu K. Kowalski T. Graule M. Nachtegaal K. O D. Ferri Flame- made WO3/ CeOx- TiO2 catalysts for selective catalytic reduction of NOx by NH3 ACS Catal. 5 2015 5657 Michalow-Mauke K. A., Lu Y., Kowalski K., Graule T., Nachtegaal M., O., Kröcher D. Ferri, flame- Made WO3/ CeOx- TiO2 catalysts for selective catalytic reduction of NOx by NH3, ACS Catal., 5 (2015) 5657. [15] Z. Liu S. Zhang J. Li L. Ma Promoting effect of MoO3 on the NOx reduction by NH3 over CeO2/ TiO2 catalyst studied with in situ DRIFTS Appl. Catal. B: Environ. 144 2014 90 Liu Z., Zhang S., Li J., Ma L., Promoting effect of MoO3 on the NOx reduction by NH3 over CeO2/ TiO2 catalyst studied with in situ DRIFTS, Appl. Catal. B: Environ., 2014, 144, 90. [16] K. Teramura T. Tanaka T. Funabiki Photoassisted selective catalytic reduction of NO with ammonia in the presence of oxygen over TiO2 Langmuir 19 2003 1209 Teramura K., Tanaka T., Funabiki T., Photoassisted selective catalytic reduction of NO with ammonia in the presence of oxygen over TiO2, Langmuir, 2003, 19, 1209. [17] Y. Jiang C. Bao Q. Liu G. Liang M. Lu S. Ma A novel CeO2- MoO3- WO3/ TiO2 catalyst for selective catalytic reduction of NO with NH3 Catal. Commun. 103 2018 96 Jiang Y., Bao C., Liu Q., Liang G., Lu M., Ma S., A novel CeO2- MoO3- WO3/ TiO2 catalyst for selective catalytic reduction of NO with NH3, Catal. Commun., 2018, 103, 96. [18] F. Li Y. Zhang D. Xiao D. Wang X. Pan X. Yang Hydrothermal method prepared Ce- P- O catalyst for the selective catalytic reduction of NO with NH3 in a broad temperature range ChemCatChem 2 2010 1416 Li F., Zhang Y., Xiao D., Wang D., Pan X., Yang X., Hydrothermal method prepared Ce- P- O catalyst for the selective catalytic reduction of NO with NH3 in a broad temperature range, ChemCatChem, 2010, 2, 1416. [19] W. Yao Y. Liu X. Wang X. Weng H. Wang Z. Wu The superior performance of sol- gel made Ce- P- O catalyst for selective catalytic reduction of NO with NH3 J. Phys. Chem. C 120 2016 221 Yao W., Liu Y., Wang X., Weng X., Wang H., Wu Z., The superior performance of sol- gel made Ce- P- O catalyst for selective catalytic reduction of NO with NH3, J. Phys. Chem. C, 2016, 120, 221. [20] W. Yao Y. Liu Z. Wu The promoting effect of CeO2@ Ce- OP multi- core@ shell structure on SO2 tolerance for selective catalytic reduction of NO with NH3 at low temperature Appl. Surf. Sci. 442 2018 156 Yao W., Liu Y., Wu Z., The promoting effect of CeO2@ Ce- OP multi- core@ shell structure on SO2 tolerance for selective catalytic reduction of NO with NH3 at low temperature, Appl. Surf. Sci., 2018, 442, 156. [21] H. Chang M.T. Jong Wang C. Wang R. Qu Y. Du J. Li J. Hao Design strategies for P- containing fuels adaptable CeO2- MoO3 catalysts for deNOx: significance of phosphorus resistance and N2 selectivity Environ. Sci. Technol. 47 2013 11692 Chang H., Jong M. T., Wang C. Wang, Qu R., Du Y., Li J., Hao J., Design strategies for P- containing fuels adaptable CeO2- MoO3 catalysts for deNOx: significance of phosphorus resistance and N2 selectivity, Environ. Sci. Technol., 2013, 47, 11692. [22] Y. You H. Chang T. Zhu T. Zhang X. Li J. Li The poisoning effects of phosphorus on CeO2- MoO3/ TiO2 deNOx catalysts: NH3- SCR activity and the formation of N2O Mol. Catal. 439 2017 15 You Y., Chang H., Zhu T., Zhang T., Li X., Li J., The poisoning effects of phosphorus on CeO2- MoO3/ TiO2 deNOx catalysts: NH3- SCR activity and the formation of N2O, Mol. Catal., 2017, 439, 15. [23] X. Li K. Li Y. Peng X. Li Y. Zhang D. Wang J. Chen J. Li Interaction of phosphorus with a FeTiOx catalyst for selective catalytic reduction of NOx with NH3: influence on surface acidity and SCR mechanism Chem. Eng. J. 347 2018 173 Li X., Li K., Peng Y., Li X., Zhang Y., Wang D., Chen J., Li J., Interaction of phosphorus with a FeTiOx catalyst for selective catalytic reduction of NOx with NH3: Influence on surface acidity and SCR mechanism, Chem. Eng. J., 2018, 347, 173. [24] G. Zhang W. Han F. Dong L. Zong G. Lu Z. Tang One pot synthesis of a highly efficient mesoporous ceria- titanium catalyst for selective catalytic reduction of NO RSC Adv. 6 2016 76556 Zhang G., Han W., Dong F., Zong L., Lu G., Tang Z., One pot synthesis of a highly efficient mesoporous ceria- titanium catalyst for selective catalytic reduction of NO, RSC Adv., 2016, 6, 76556. [25] G. Zhang W. Han H. Zhao L. Zong Z. Tang Solvothermal synthesis of well- designed ceria- tin- titanium catalysts with enhanced catalytic performance for wide temperature NH3- SCR reaction Appl. Catal. B: Environ. 226 2018 117 Zhang G., Han W., Zhao H., Zong L., Tang Z., Solvothermal synthesis of well- designed ceria- tin- titanium catalysts with enhanced catalytic performance for wide temperature NH3- SCR reaction, Appl. Catal. B: Environ., 2018, 226, 117. [26] E. Yuan G. Wu W. Dai N. Guan L. Li One- pot construction of Fe/ ZSM-5 zeolites for the selective catalytic reduction of nitrogen oxides by ammonia Catal. Sci. Technol. 7 2017 3036 Yuan E., Wu G., Dai W., Guan N., Li L., One- pot construction of Fe/ ZSM-5 zeolites for the selective catalytic reduction of nitrogen oxides by ammonia, Catal. Sci. Technol., 2017, 7, 3036. [27] D. Zhang L. Zhang L. Shi C. Fang H. Li R. Gao L. Huang J. Zhang In situ supported MnOx- CeOx on carbon nanotubes for the low- temperature selective catalytic reduction of NO with NH3 Nanoscale 5 2013 1127 Zhang D., Zhang L., Shi L., Fang C., Li H., Gao R., Huang L., Zhang J., In situ supported MnOx- CeOx on carbon nanotubes for the low- temperature selective catalytic reduction of NO with NH3, Nanoscale, 2013, 5, 1127. [28] Z. Liu J. Zhu S. Zhang L. Ma S.I. Woo Selective catalytic reduction of NOx by NH3 over MoO3- promoted CeO2/ TiO2 catalyst Catal. Commun. 46 2014 90 Liu Z., Zhu J., Zhang S., Ma L., Woo S. I., Selective catalytic reduction of NOx by NH3 over MoO3- promoted CeO2/ TiO2 catalyst, Catal. Commun., 2014, 46, 90. [29] Y. Jiang C. Bao Q. Liu G. Liang M. Lu S. Ma A novel CeO2- MoO3- WO3/ TiO2 catalyst for selective catalytic reduction of NO with NH3 Catal. Commun. 103 2018 96 Jiang Y., Bao C., Liu Q., Liang G., Lu M., Ma S., A novel CeO2- MoO3- WO3/ TiO2 catalyst for selective catalytic reduction of NO with NH3, Catal. Commun., 2018, 103, 96. [30] X. Feng P. Wang J. Hou J. Qian Y. Ao C. Wang Significantly enhanced visible light photocatalytic efficiency of phosphorus doped TiO2 with surface oxygen vacancies for ciprofloxacin degradation: synergistic effect and intermediates analysis J. Hazard. Mater. 351 2018 196 Feng X., Wang P., Hou J., Qian J., Ao Y., Wang C., Significantly enhanced visible light photocatalytic efficiency of phosphorus doped TiO2 with surface oxygen vacancies for ciprofloxacin degradation: Synergistic effect and intermediates analysis, J. Hazard. Mater., 2018, 351, 196. [31] Y. Gao R. Li S. Chen L. Luo T. Cao W. Huang Morphology- dependent interplay of reduction behaviors, oxygen vacancies and hydroxyl reactivity of CeO2 nanocrystals Phys. Chem. Chem. Phys. 17 2015 31862 Gao Y., Li R., Chen S., Luo L., Cao T., Huang W., Morphology- dependent interplay of reduction behaviors, oxygen vacancies and hydroxyl reactivity of CeO2 nanocrystals, Phys. Chem. Chem. Phys., 2015, 17, 31862. [32] C. Fang D. Zhang L. Shi R. Gao H. Li L. Ye J. Zhang Highly dispersed CeO2 on carbon nanotubes for selective catalytic reduction of NO with NH3 Catal. Sci. Technol. 3 2013 803 Fang C., Zhang D., Shi L., Gao R., Li H., Ye L., Zhang J., Highly dispersed CeO2 on carbon nanotubes for selective catalytic reduction of NO with NH3, Catal. Sci. Technol., 2013, 3, 803. [33] W. Liu B. Zhou L. Wang Y. Wang D. Li Oxygen vacancy vlusters promoting reducibility and activity of ceria nanorods J. Am. Chem. Soc. 131 2009 3140 Liu W., Zhou B., Wang L., Wang Y., Li D., Oxygen vacancy vlusters promoting reducibility and activity of ceria nanorods, J. Am. Chem. Soc., 2009, 131, 3140. [34] Y. Sun Z. Zhang L. Liu X. Wang FTIR, Raman and NMR investigation of CaO- SiO2- P2O5 and CaO- SiO2- TiO2- P2O5 glasses J. Non-Cryst. Solids 420 2015 26 Sun Y., Zhang Z., Liu L., Wang X., FTIR, Raman and NMR investigation of CaO- SiO2- P2O5 and CaO- SiO2- TiO2- P2O5 glasses, J. Non-Cryst. Solids, 2015, 420, 26. [35] W. Wang Q. Zhu F. Qin Q. Dai X. Wang Fe doped CeO2 nanosheets as Fenton- like heterogeneous catalysts for degradation of salicylic acid J. Chem. Eng. 333 2018 226 Wang W., Zhu Q., Qin F., Dai Q., Wang X., Fe doped CeO2 nanosheets as Fenton- like heterogeneous catalysts for degradation of salicylic acid, J. Chem. Eng., 2018, 333, 226. [36] J. Xu J. Harmer G. Li T. Chapman P. Collier S. Longworth S.C. Tsang Size dependent oxygen buffering capacity of ceria nanocrystals Chem. Commun. (Camb.) 46 2010 1887 Xu J., Harmer J., Li G., Chapman T., Collier P., Longworth S., Tsang S. C., Size dependent oxygen buffering capacity of ceria nanocrystals, Chem. Commun., 2010, 46, 1887. [37] D.C. Hurum A.G. Agrios S.E. Crist K. Gray A.T. Rajh M.C. Thurnauer Probing reaction mechanisms in mixed phase TiO2 by EPR J. Electron. Spectrosc. Relat. Phenom. 150 2006 155 Hurum D. C., Agrios A. G., Crist S. E., Gray K. Rajh A., T., Thurnauer M. C., Probing reaction mechanisms in mixed phase TiO2 by EPR, J. Electron. Spectrosc. Relat. Phenom., 2006, 150, 155. [38] Q. Jin Y. Shen S. Zhu Q. Liu X. Li W. Yan Effect of praseodymium additive on CeO2 (ZrO2)/ TiO2 for selective catalytic reduction of NO by NH3 J. rare earth. 34 2016 1111 Jin Q., Shen Y., Zhu S., Liu Q., Li X., Yan W., Effect of praseodymium additive on CeO2 (ZrO2)/ TiO2 for selective catalytic reduction of NO by NH3, J. rare earth., 2016, 34, 1111. [39] J. Soria J.C. Conesa Characterization of surface defects in CeO2 modified by incorporation of precious metals from chloride salts precursors: an EPR study using oxygen as probe molecule Colloids Surf. A Physicochem. Eng. Asp. 158 1999 67 Soria J., Conesa J. C., Characterization of surface defects in CeO2 modified by incorporation of precious metals from chloride salts precursors: an EPR study using oxygen as probe molecule, Colloid. Surface. A, 1999, 158, 67. [40] X. Zhang Y. Huang Y. Guo X. Yuan F. Jiao Catalytic performance of surface- silylated and phenyl- bridged Ti- containing mesoporous silica for epoxidation of propylene Microporous Mesoporous Mater. 262 2018 251 Zhang X., Huang Y., Guo Y., Yuan X., Jiao F., Catalytic performance of surface- silylated and phenyl- bridged Ti- containing mesoporous silica for epoxidation of propylene, Micropor. Mesopor. Mat., 2018, 262, 251. [41] J. Xue X. Wang G. Qi J. Wang M. Shen W. Li Characterization of copper species over Cu/ SAPO-34 in selective catalytic reduction of NOx with ammonia: relationships between active Cu sites and de-NOx performance at low temperature J. Catal. 297 2013 56 Xue J., Wang X., Qi G., Wang J., Shen M., Li W., Characterization of copper species over Cu/ SAPO-34 in selective catalytic reduction of NOx with ammonia: Relationships between active Cu sites and de-NOx performance at low temperature, J. Catal., 2013, 297, 56. [42] L. Zhang L. Li Y. Cao X. Yao C. Ge F. Gao Y. Deng C. Tang L. Dong Getting insight into the influence of SO2 on TiO2/ CeO2 for the selective catalytic reduction of NO by NH3 Appl. Catal. B: Environ. 165 2015 589 Zhang L., Li L., Cao Y., Yao X., Ge C., Gao F., Deng Y., Tang C., Dong L., Getting insight into the influence of SO2 on TiO2/ CeO2 for the selective catalytic reduction of NO by NH3, Appl. Catal. B: Environ., 2015, 165, 589. [43] J. Wang X. Dong Y. Wang Y. Li Effect of the calcination temperature on the performance of a CeMoOx catalyst in the selective catalytic reduction of NOx with ammonia Catal. Today 245 2015 10 Wang J., Dong X., Wang Y., Li Y., Effect of the calcination temperature on the performance of a CeMoOx catalyst in the selective catalytic reduction of NOx with ammonia, Catal. Today, 2015, 245, 10. [44] A. Bhaumik Inagaki S., mesoporous titanium phosphate molecular sieves with ion- exchange capacity J. Am. Chem. Soc. 123 2001 691 Bhaumik A., Inagaki S., mesoporous titanium phosphate molecular sieves with ion- exchange capacity, J. Am. Chem. Soc., 2001, 123, 691. [45] C. Liu L. Chen J. Li L. Ma H. Arandiyan Y. Du J. Xu J. Hao Enhancement of activity and sulfur resistance of CeO2 supported on TiO2- SiO2 for the selective catalytic reduction of NO by NH3 Environ. Sci. Technol. 46 2012 6182 Liu C., Chen L., Li J., Ma L., Arandiyan H., Du Y., Xu J., Hao J., Enhancement of Activity and Sulfur Resistance of CeO2 Supported on TiO2- SiO2 for the selective catalytic reduction of NO by NH3, Environ. Sci. Technol., 2012, 46, 6182. [46] L. Yan Y. Liu K. Zha H. Li L. Shi D. Zhang Deep insight into the structure- activity relationship of Nb modified SnO2- CeO2 catalysts for low- temperature selective catalytic reduction of NO by NH3 Catal. Sci. Technol. 7 2017 502 Yan L., Liu Y., Zha K., Li H., Shi L., Zhang D., Deep insight into the structure- activity relationship of Nb modified SnO2- CeO2 catalysts for low- temperature selective catalytic reduction of NO by NH3, Catal. Sci. Technol., 2017, 7, 502. [47] X. Gao Y. Jiang Y. Fu Y. Zhong Z. Luo K. Cen Preparation and characterization of CeO2/ TiO2 catalysts for selective catalytic reduction of NO with NH3 Catal. Commun. 11 2010 465 Gao X., Jiang Y., Fu Y., Zhong Y., Luo Z., Cen K., Preparation and characterization of CeO2/ TiO2 catalysts for selective catalytic reduction of NO with NH3, Catal. Commun., 2010, 11, 465. [48] J.Z. Shyu W.H. Weber H.S. Gandhi Surface characterization of alumina- supported ceria J. Phys. Chem. 92 1988 4964 Shyu J. Z., Weber W. H., Gandhi H. S., Surface characterization of alumina- supported ceria, J. Phys. Chem., 1988, 92, 4964. [49] T. Baidya A. Gupta P.A. Deshpandey G. Madras M.S. Hegde High oxygen storage capacity and high rates of CO oxidation and NO reduction catalytic properties of Ce1-xSnxO2 and Ce0.78Sn0.2Pd0.02O2- δ J. Phys. Chem. C 113 2009 4059 Baidya T., Gupta A., Deshpandey P. A., Madras G., Hegde M. S., High oxygen storage capacity and high rates of CO oxidation and NO reduction catalytic properties of Ce1-xSnxO2 and Ce0.78Sn0.2Pd0.02O2-δ, J. Phys. Chem. C, 2009, 113, 4059. [50] Y. Geng X. Chen S. Yang F. Liu W. Shan Promotional effects of Ti on a CeO2- MoO3 catalyst for the selective catalytic reduction of NOx with NH3 ACS Appl. Mater. Interfaces 9 2017 16951 Geng Y., Chen X., Yang S., Liu F., Shan W., Promotional effects of Ti on a CeO2- MoO3 catalyst for the selective catalytic reduction of NOx with NH3, ACS Appl. Mater. Interfaces, 2017, 9, 16951. [51] S. Damyanova C.A. Perez M. Schmal J.M.C. Bueno Characterization of ceria- coated alumina carrier Appl. Catal. A Gen. 234 2002 271 Damyanova S., Perez C.A., Schmal M., Bueno J. M. C., Characterization of ceria- coated alumina carrier, Appl. Catal. A: Gen., 2002, 234, 271. [52] B. Murugan A.V. Ramaswamy Chemical states and redox properties of Mn/ CeO2- TiO2 nanocomposites prepared by solution combustion route J. Phys. Chem. C 112 2008 20429 Murugan B., Ramaswamy A.V., Chemical states and redox properties of Mn/ CeO2- TiO2 nanocomposites prepared by solution combustion route, J. Phys. Chem. C, 2008, 112, 20429. [53] T. Yi Y. Zhang J. Li X. Yang Promotional effect of H3PO4 on ceria catalyst for selective catalytic reduction of NO by NH3 Chin. J. Catal. 37 2016 300 Yi T., Zhang Y., Li J., Yang X., Promotional effect of H3PO4 on ceria catalyst for selective catalytic reduction of NO by NH3, Chin. J. Catal., 2016, 37, 300. [54] R.K. Brow An XPS study of oxygen bonding in zinc phosphate and zinc borophosphate glasses J. Non. Solids 194 1996 267 Brow R. K., An XPS study of oxygen bonding in zinc phosphate and zinc borophosphate glasses, J. Non- Cryst. Solids, 1996, 194, 267. [55] H. Jiang Q. Wang S. Zang J. Li Q. Wang Enhanced photoactivity of Sm, N, P-tridoped anatase- TiO2 nano- photocatalyst for 4- chlorophenol degradation under sunlight irradiation J. Hazard. Mater. 261 2013 44 Jiang H., Wang Q., Zang S., Li J., Wang Q., Enhanced photoactivity of Sm, N, P-tridoped anatase- TiO2 nano- photocatalyst for 4- chlorophenol degradation under sunlight irradiation, J. Hazard. Mater. 2013, 261, 44. [56] X. Huang G. Zhang F. Dong Z. Tang The remarkable promotional effect of Sn on CeVO4 catalyst for wide temperature NH3- SCR process by citric acid-assisted solvothermal synthesis and post-hydrothermal treatment Catal. Sci. Technol. 8 2018 5604 Huang X., Zhang G., Dong F., Tang Z., The remarkable promotional effect of Sn on CeVO4 catalyst for wide temperature NH3- SCR process by citric acid-assisted solvothermal synthesis and post-hydrothermal treatment, Catal. Sci. Technol., 2018, 8, 5604. [57] G. Shao F. Wang T. Ren Y. Liu Z. Yuan Hierarchical mesoporous phosphorus and nitrogen doped titania materials: synthesis, characterization and visible- light photocatalytic activity Appl. Catal. B: Environ. 92 2009 61 Shao G., Wang F., Ren T., Liu Y., Yuan Z., Hierarchical mesoporous phosphorus and nitrogen doped titania materials: synthesis, characterization and visible- light photocatalytic activity, Appl. Catal. B: Environ., 2009, 92, 61. [58] W. Shan F. Liu H. He X. Shi C. Zhang An environmentally- benign CeO2- TiO2 catalyst for the selective catalytic reduction of NOx with NH3 in simulated diesel exhaust Catal. Today 184 2012 160 Shan W., Liu F., He H., Shi X., Zhang C., An environmentally- benign CeO2- TiO2 catalyst for the selective catalytic reduction of NOx with NH3 in simulated diesel exhaust, Catal. Today, 2012, 184, 160. [59] X. Chen Y. Geng W. Shan F. Liu Deactivation effects of potassium on a CeMoTiOx catalyst for the selective catalytic reduction of NOx with NH3 Ind. Eng. Chem. Res. 57 2018 1399 Chen X., Geng Y., Shan W., Liu F., Deactivation effects of potassium on a CeMoTiOx catalyst for the selective catalytic reduction of NOx with NH3, Ind. Eng. Chem. Res., 2018, 57, 1399. [60] E.Y. Choi I.S. Nam Y.G. Kim TPD study of mordenite- type zeolites for selective catalytic reduction of NO by NH3 J. Catal. 161 1996 597 Choi E. Y., Nam I. S., Kim Y. G., TPD study of mordenite- type zeolites for selective catalytic reduction of NO by NH3, J. Catal., 1996, 161, 597. [61] Y. Peng W. Si X. Li J. Luo J. Li J. Crittenden J. Hao Comparison of MoO3 and WO3 on arsenic poisoning V2O5/ TiO2 catalyst: DRIFTS and DFT study Appl. Catal. B: Environ. 181 2016 692 Peng Y., Si W., Li X., Luo J., Li J., Crittenden J., Hao J., Comparison of MoO3 and WO3 on arsenic poisoning V2O5/ TiO2 catalyst: DRIFTS and DFT study, Appl. Catal. B: Environ., 2016, 181, 692. [62] X. Li J. Li Y. Peng X. Li K. Li J. Hao Comparison of the structures and mechanism of arsenic deactivation of CeO2- MoO3 and CeO2- WO3 SCR catalysts J. Phys. Chem. C 120 2016 18005 Li X., Li J., Peng Y., Li X., Li K., Hao J., comparison of the structures and mechanism of arsenic deactivation of CeO2- MoO3 and CeO2- WO3 SCR catalysts, J. Phys. Chem. C, 2016, 120, 18005. [63] R. Qu D. Ye C. Zheng X. Gao Z. Luo M. Ni K. Cen Exploring the role of V2O5 in the reactivity of NH4HSO4 with NO on V2O5/ TiO2 SCR catalysts RSC Adv. 6 2016 102436 Qu R., Ye D., Zheng C., Gao X., Luo Z., Ni M., Cen K., Exploring the role of V2O5 in the reactivity of NH4HSO4 with NO on V2O5/ TiO2 SCR catalysts, RSC Adv., 2016, 6, 102436. [64] D. Ye R. Qu C. Zheng K. Cen X. Gao Mechanistic investigation of enhanced reactivity of NH4HSO4 and NO on Nb-and Sb-doped VW/Ti SCR catalysts Appl. Catal. A Gen. 549 2018 310 Ye D., Qu R., Zheng C., Cen K., Gao X., Mechanistic investigation of enhanced reactivity of NH4HSO4 and NO on Nb-and Sb-doped VW/Ti SCR catalysts, Appl. Catal. A: Gen., 2018, 549, 310. [65] Y. Wu L. Qin G. Zhang L. Chen X. Guo M. Liu Porous solid superacid SO4 2−/ Fe2-xZrxO3 fenton catalyst for highly effective oxidation of X-3B under visible light Ind. Eng. Chem. Res. 52 2013 16698 Wu Y., Qin L., Zhang G., Chen L., Guo X., Liu M., Porous solid superacid SO42-/ Fe2-xZrxO3 fenton catalyst for highly effective oxidation of X-3B under visible light, Ind. Eng. Chem. Res., 2013, 52, 16698. [66] T. Jirsak J.A. Rodriguez J. Hrbek Chemistry of SO2 on Mo (110), MoO2/ Mo (110) and Cs/ Mo (110) surfaces: effects of O and Cs on the formation of SO3 and SO4 species Surf. Sci. 426 1999 319 Jirsak T., Rodriguez J. A., Hrbek J., Chemistry of SO2 on Mo (110), MoO2/ Mo (110) and Cs/ Mo (110) surfaces: effects of O and Cs on the formation of SO3 and SO4 species, Surf. Sci., 1999, 426, 319. [67] X. Huang G. Zhang F. Dong Z. Tang An environmentally friendly wide temperature CeWTiOx catalyst with superior performance for the selective catalytic reduction NOx with NH3 J. Ind. Eng. Chem. 69 2019 66 Huang X., Zhang G., Dong F., Tang Z., An environmentally friendly wide temperature CeWTiOx catalyst with superior performance for the selective catalytic reduction NOx with NH3, J. Ind. Eng. Chem., 2019, 69, 66. [68] J. Wang X. Dong Y. Wang Y. Li Effect of the calcination temperature on the performance of a CeMoOx catalyst in the selective catalytic reduction of NOx with ammonia Catal. Today 245 2015 10 Wang J., Dong X., Wang Y., Li Y., Effect of the calcination temperature on the performance of a CeMoOx catalyst in the selective catalytic reduction of NOx with ammonia, Catal. Today, 2015, 245, 10. [69] H. Fu X. Wang H. Wu Y. Yin J. Chen Heterogeneous uptake and oxidation of SO2 on iron oxides J. Phys. Chem. C 111 2007 6077 Fu H., Wang X., Wu H., Yin Y., Chen J., Heterogeneous uptake and oxidation of SO2 on iron oxides, J. Phys. Chem. C, 2007, 111, 6077. [70] W. Hu Y. Zhang S. Liu C. Zheng X. Gao I. Nova E. Tronconi Improvement in activity and alkali resistance of a novel V-Ce (SO4)2/ Ti catalyst for selective catalytic reduction of NO with NH3 Appl. Catal. B: Environ. 206 2017 449 Hu W., Zhang Y., Liu S., Zheng C., Gao X., Nova I., Tronconi E., Improvement in activity and alkali resistance of a novel V-Ce (SO4)2/ Ti catalyst for selective catalytic reduction of NO with NH3, Appl. Catal. B: Environ., 2017, 206, 449. [71] Chubar N., Gerda V., Banerjee D., Yablokova G., Effect of Fe(II)/ Ce(III) dosage ratio on the structure and anion adsorptive removal of hydrothermally precipitated composites: Insights from EXAFS/ XANES, XRD and FTIR, J. Colloid Interf. Sci., 42017, 87, 388.",
      "scopus-id": "85071320128",
      "coredata": {
        "eid": "1-s2.0-S2468823119304080",
        "dc:description": "The CePTiOx, CeMoTiOx and CePMoTiOx catalysts were synthesized via a solvothermal method and phosphorous or molybdenum was effectively doped into the cerium- titanium catalyst system. Although each component of the catalysts presented a high dispersion, which was clarified by crystal structure analysis, the performance of selective catalytic reduction (SCR) was dramatically individual. Three kinds of catalysts were systematically analyzed, which confirmed significant difference in microstructure and chemical characteristics. Notably, the CePMoTiOx catalyst exhibited a superior SCR reactivity, not only the NO conversion more than 80% ranging from 260 to 440 °C, but also displayed satisfactory H2O/SO2 durability and the airspeed resistance. It was verified that the trapping sites, oxygen vacancies, Brønsted acid sites and the specific surface areas were definitely promoted, pore channel was optimized, synergistic interaction among the components and reducibility were enhanced, which benefited from a suitable amount of phosphorus and molybdenum simultaneously doping into cerium-titanium catalyst. It was obvious that the advantages of phosphorus and molybdenum were combined for CePMoTiOx by a facile way. Meanwhile, it confirmed that the Mo species were apt to associate with SO2, which preserved high SCR activity during the SO2 resistance. These detailed studies could establish basic theory and provide some significant concepts for the construction of subsequent high performance catalysts.",
        "openArchiveArticle": "false",
        "prism:coverDate": "2019-11-30",
        "openaccessUserLicense": null,
        "prism:aggregationType": "Journal",
        "prism:url": "https://api.elsevier.com/content/article/pii/S2468823119304080",
        "dc:creator": [
          {
            "@_fa": "true",
            "$": "Zhang, Guodong"
          },
          {
            "@_fa": "true",
            "$": "Huang, Xiaosheng"
          },
          {
            "@_fa": "true",
            "$": "Tang, Zhicheng"
          }
        ],
        "link": [
          {
            "@_fa": "true",
            "@rel": "self",
            "@href": "https://api.elsevier.com/content/article/pii/S2468823119304080"
          },
          {
            "@_fa": "true",
            "@rel": "scidir",
            "@href": "https://www.sciencedirect.com/science/article/pii/S2468823119304080"
          }
        ],
        "dc:format": "application/json",
        "openaccessType": null,
        "pii": "S2468-8231(19)30408-0",
        "prism:volume": "478",
        "articleNumber": "110562",
        "prism:publisher": "Elsevier B.V.",
        "dc:title": "New insight into the synergistic promotion effect of phosphorus and molybdenum on the ceria-titanium catalysts for superior SCR performance",
        "prism:copyright": "© 2019 Elsevier B.V. All rights reserved.",
        "openaccess": "0",
        "prism:issn": "24688231",
        "dcterms:subject": [
          {
            "@_fa": "true",
            "$": "Solvothermal synthesis"
          },
          {
            "@_fa": "true",
            "$": "Selective catalytic reduction"
          },
          {
            "@_fa": "true",
            "$": "Trapping sites and oxygen vacancies"
          },
          {
            "@_fa": "true",
            "$": "Microstructure and reducibility"
          }
        ],
        "openaccessArticle": "false",
        "prism:publicationName": "Molecular Catalysis",
        "openaccessSponsorType": null,
        "prism:pageRange": "110562",
        "pubType": "fla",
        "prism:coverDisplayDate": "November 2019",
        "prism:doi": "10.1016/j.mcat.2019.110562",
        "prism:startingPage": "110562",
        "dc:identifier": "doi:10.1016/j.mcat.2019.110562",
        "openaccessSponsorName": null
      },
      "objects": {
        "object": [
          {
            "@category": "thumbnail",
            "@height": "148",
            "@width": "219",
            "@_fa": "true",
            "$": "https://api.elsevier.com/content/object/eid/1-s2.0-S2468823119304080-ga1.sml?httpAccept=%2A%2F%2A",
            "@multimediatype": "GIF image file",
            "@type": "IMAGE-THUMBNAIL",
            "@size": "17100",
            "@ref": "ga1",
            "@mimetype": "image/gif"
          },
          {
            "@category": "thumbnail",
            "@height": "131",
            "@width": "219",
            "@_fa": "true",
            "$": "https://api.elsevier.com/content/object/eid/1-s2.0-S2468823119304080-gr1.sml?httpAccept=%2A%2F%2A",
            "@multimediatype": "GIF image file",
            "@type": "IMAGE-THUMBNAIL",
            "@size": "16890",
            "@ref": "gr1",
            "@mimetype": "image/gif"
          },
          {
            "@category": "thumbnail",
            "@height": "81",
            "@width": "219",
            "@_fa": "true",
            "$": "https://api.elsevier.com/content/object/eid/1-s2.0-S2468823119304080-gr10.sml?httpAccept=%2A%2F%2A",
            "@multimediatype": "GIF image file",
            "@type": "IMAGE-THUMBNAIL",
            "@size": "6937",
            "@ref": "gr10",
            "@mimetype": "image/gif"
          },
          {
            "@category": "thumbnail",
            "@height": "164",
            "@width": "102",
            "@_fa": "true",
            "$": "https://api.elsevier.com/content/object/eid/1-s2.0-S2468823119304080-gr11.sml?httpAccept=%2A%2F%2A",
            "@multimediatype": "GIF image file",
            "@type": "IMAGE-THUMBNAIL",
            "@size": "9378",
            "@ref": "gr11",
            "@mimetype": "image/gif"
          },
          {
            "@category": "thumbnail",
            "@height": "152",
            "@width": "219",
            "@_fa": "true",
            "$": "https://api.elsevier.com/content/object/eid/1-s2.0-S2468823119304080-gr12.sml?httpAccept=%2A%2F%2A",
            "@multimediatype": "GIF image file",
            "@type": "IMAGE-THUMBNAIL",
            "@size": "17146",
            "@ref": "gr12",
            "@mimetype": "image/gif"
          },
          {
            "@category": "thumbnail",
            "@height": "164",
            "@width": "209",
            "@_fa": "true",
            "$": "https://api.elsevier.com/content/object/eid/1-s2.0-S2468823119304080-gr2.sml?httpAccept=%2A%2F%2A",
            "@multimediatype": "GIF image file",
            "@type": "IMAGE-THUMBNAIL",
            "@size": "13476",
            "@ref": "gr2",
            "@mimetype": "image/gif"
          },
          {
            "@category": "thumbnail",
            "@height": "164",
            "@width": "219",
            "@_fa": "true",
            "$": "https://api.elsevier.com/content/object/eid/1-s2.0-S2468823119304080-gr3.sml?httpAccept=%2A%2F%2A",
            "@multimediatype": "GIF image file",
            "@type": "IMAGE-THUMBNAIL",
            "@size": "14203",
            "@ref": "gr3",
            "@mimetype": "image/gif"
          },
          {
            "@category": "thumbnail",
            "@height": "96",
            "@width": "219",
            "@_fa": "true",
            "$": "https://api.elsevier.com/content/object/eid/1-s2.0-S2468823119304080-gr4.sml?httpAccept=%2A%2F%2A",
            "@multimediatype": "GIF image file",
            "@type": "IMAGE-THUMBNAIL",
            "@size": "8550",
            "@ref": "gr4",
            "@mimetype": "image/gif"
          },
          {
            "@category": "thumbnail",
            "@height": "164",
            "@width": "182",
            "@_fa": "true",
            "$": "https://api.elsevier.com/content/object/eid/1-s2.0-S2468823119304080-gr5.sml?httpAccept=%2A%2F%2A",
            "@multimediatype": "GIF image file",
            "@type": "IMAGE-THUMBNAIL",
            "@size": "8856",
            "@ref": "gr5",
            "@mimetype": "image/gif"
          },
          {
            "@category": "thumbnail",
            "@height": "164",
            "@width": "200",
            "@_fa": "true",
            "$": "https://api.elsevier.com/content/object/eid/1-s2.0-S2468823119304080-gr6.sml?httpAccept=%2A%2F%2A",
            "@multimediatype": "GIF image file",
            "@type": "IMAGE-THUMBNAIL",
            "@size": "8922",
            "@ref": "gr6",
            "@mimetype": "image/gif"
          },
          {
            "@category": "thumbnail",
            "@height": "88",
            "@width": "219",
            "@_fa": "true",
            "$": "https://api.elsevier.com/content/object/eid/1-s2.0-S2468823119304080-gr7.sml?httpAccept=%2A%2F%2A",
            "@multimediatype": "GIF image file",
            "@type": "IMAGE-THUMBNAIL",
            "@size": "6778",
            "@ref": "gr7",
            "@mimetype": "image/gif"
          },
          {
            "@category": "thumbnail",
            "@height": "163",
            "@width": "128",
            "@_fa": "true",
            "$": "https://api.elsevier.com/content/object/eid/1-s2.0-S2468823119304080-gr8.sml?httpAccept=%2A%2F%2A",
            "@multimediatype": "GIF image file",
            "@type": "IMAGE-THUMBNAIL",
            "@size": "10869",
            "@ref": "gr8",
            "@mimetype": "image/gif"
          },
          {
            "@category": "thumbnail",
            "@height": "164",
            "@width": "185",
            "@_fa": "true",
            "$": "https://api.elsevier.com/content/object/eid/1-s2.0-S2468823119304080-gr9.sml?httpAccept=%2A%2F%2A",
            "@multimediatype": "GIF image file",
            "@type": "IMAGE-THUMBNAIL",
            "@size": "10862",
            "@ref": "gr9",
            "@mimetype": "image/gif"
          },
          {
            "@category": "standard",
            "@height": "200",
            "@width": "296",
            "@_fa": "true",
            "$": "https://api.elsevier.com/content/object/eid/1-s2.0-S2468823119304080-ga1.jpg?httpAccept=%2A%2F%2A",
            "@multimediatype": "JPEG image file",
            "@type": "IMAGE-DOWNSAMPLED",
            "@size": "24145",
            "@ref": "ga1",
            "@mimetype": "image/jpeg"
          },
          {
            "@category": "standard",
            "@height": "340",
            "@width": "567",
            "@_fa": "true",
            "$": "https://api.elsevier.com/content/object/eid/1-s2.0-S2468823119304080-gr1.jpg?httpAccept=%2A%2F%2A",
            "@multimediatype": "JPEG image file",
            "@type": "IMAGE-DOWNSAMPLED",
            "@size": "66619",
            "@ref": "gr1",
            "@mimetype": "image/jpeg"
          },
          {
            "@category": "standard",
            "@height": "209",
            "@width": "567",
            "@_fa": "true",
            "$": "https://api.elsevier.com/content/object/eid/1-s2.0-S2468823119304080-gr10.jpg?httpAccept=%2A%2F%2A",
            "@multimediatype": "JPEG image file",
            "@type": "IMAGE-DOWNSAMPLED",
            "@size": "36936",
            "@ref": "gr10",
            "@mimetype": "image/jpeg"
          },
          {
            "@category": "standard",
            "@height": "914",
            "@width": "568",
            "@_fa": "true",
            "$": "https://api.elsevier.com/content/object/eid/1-s2.0-S2468823119304080-gr11.jpg?httpAccept=%2A%2F%2A",
            "@multimediatype": "JPEG image file",
            "@type": "IMAGE-DOWNSAMPLED",
            "@size": "157725",
            "@ref": "gr11",
            "@mimetype": "image/jpeg"
          },
          {
            "@category": "standard",
            "@height": "393",
            "@width": "567",
            "@_fa": "true",
            "$": "https://api.elsevier.com/content/object/eid/1-s2.0-S2468823119304080-gr12.jpg?httpAccept=%2A%2F%2A",
            "@multimediatype": "JPEG image file",
            "@type": "IMAGE-DOWNSAMPLED",
            "@size": "63736",
            "@ref": "gr12",
            "@mimetype": "image/jpeg"
          },
          {
            "@category": "standard",
            "@height": "444",
            "@width": "567",
            "@_fa": "true",
            "$": "https://api.elsevier.com/content/object/eid/1-s2.0-S2468823119304080-gr2.jpg?httpAccept=%2A%2F%2A",
            "@multimediatype": "JPEG image file",
            "@type": "IMAGE-DOWNSAMPLED",
            "@size": "83682",
            "@ref": "gr2",
            "@mimetype": "image/jpeg"
          },
          {
            "@category": "standard",
            "@height": "425",
            "@width": "567",
            "@_fa": "true",
            "$": "https://api.elsevier.com/content/object/eid/1-s2.0-S2468823119304080-gr3.jpg?httpAccept=%2A%2F%2A",
            "@multimediatype": "JPEG image file",
            "@type": "IMAGE-DOWNSAMPLED",
            "@size": "84197",
            "@ref": "gr3",
            "@mimetype": "image/jpeg"
          },
          {
            "@category": "standard",
            "@height": "248",
            "@width": "567",
            "@_fa": "true",
            "$": "https://api.elsevier.com/content/object/eid/1-s2.0-S2468823119304080-gr4.jpg?httpAccept=%2A%2F%2A",
            "@multimediatype": "JPEG image file",
            "@type": "IMAGE-DOWNSAMPLED",
            "@size": "48944",
            "@ref": "gr4",
            "@mimetype": "image/jpeg"
          },
          {
            "@category": "standard",
            "@height": "307",
            "@width": "341",
            "@_fa": "true",
            "$": "https://api.elsevier.com/content/object/eid/1-s2.0-S2468823119304080-gr5.jpg?httpAccept=%2A%2F%2A",
            "@multimediatype": "JPEG image file",
            "@type": "IMAGE-DOWNSAMPLED",
            "@size": "30965",
            "@ref": "gr5",
            "@mimetype": "image/jpeg"
          },
          {
            "@category": "standard",
            "@height": "280",
            "@width": "341",
            "@_fa": "true",
            "$": "https://api.elsevier.com/content/object/eid/1-s2.0-S2468823119304080-gr6.jpg?httpAccept=%2A%2F%2A",
            "@multimediatype": "JPEG image file",
            "@type": "IMAGE-DOWNSAMPLED",
            "@size": "28387",
            "@ref": "gr6",
            "@mimetype": "image/jpeg"
          },
          {
            "@category": "standard",
            "@height": "227",
            "@width": "567",
            "@_fa": "true",
            "$": "https://api.elsevier.com/content/object/eid/1-s2.0-S2468823119304080-gr7.jpg?httpAccept=%2A%2F%2A",
            "@multimediatype": "JPEG image file",
            "@type": "IMAGE-DOWNSAMPLED",
            "@size": "38711",
            "@ref": "gr7",
            "@mimetype": "image/jpeg"
          },
          {
            "@category": "standard",
            "@height": "724",
            "@width": "567",
            "@_fa": "true",
            "$": "https://api.elsevier.com/content/object/eid/1-s2.0-S2468823119304080-gr8.jpg?httpAccept=%2A%2F%2A",
            "@multimediatype": "JPEG image file",
            "@type": "IMAGE-DOWNSAMPLED",
            "@size": "132211",
            "@ref": "gr8",
            "@mimetype": "image/jpeg"
          },
          {
            "@category": "standard",
            "@height": "302",
            "@width": "341",
            "@_fa": "true",
            "$": "https://api.elsevier.com/content/object/eid/1-s2.0-S2468823119304080-gr9.jpg?httpAccept=%2A%2F%2A",
            "@multimediatype": "JPEG image file",
            "@type": "IMAGE-DOWNSAMPLED",
            "@size": "37489",
            "@ref": "gr9",
            "@mimetype": "image/jpeg"
          },
          {
            "@category": "standard",
            "@_fa": "true",
            "$": "https://api.elsevier.com/content/object/eid/1-s2.0-S2468823119304080-mmc1.doc?httpAccept=%2A%2F%2A",
            "@multimediatype": "Microsoft Word file",
            "@type": "APPLICATION",
            "@size": "5921280",
            "@ref": "mmc1",
            "@mimetype": "application/word"
          },
          {
            "@category": "thumbnail",
            "@_fa": "true",
            "$": "https://api.elsevier.com/content/object/eid/1-s2.0-S2468823119304080-si1.svg?httpAccept=%2A%2F%2A",
            "@multimediatype": "Scalable Vector Graphics file",
            "@type": "ALTIMG",
            "@size": "24000",
            "@ref": "si1",
            "@mimetype": "image/svg+xml"
          },
          {
            "@category": "thumbnail",
            "@_fa": "true",
            "$": "https://api.elsevier.com/content/object/eid/1-s2.0-S2468823119304080-si2.svg?httpAccept=%2A%2F%2A",
            "@multimediatype": "Scalable Vector Graphics file",
            "@type": "ALTIMG",
            "@size": "19108",
            "@ref": "si2",
            "@mimetype": "image/svg+xml"
          },
          {
            "@category": "thumbnail",
            "@_fa": "true",
            "$": "https://api.elsevier.com/content/object/eid/1-s2.0-S2468823119304080-si3.svg?httpAccept=%2A%2F%2A",
            "@multimediatype": "Scalable Vector Graphics file",
            "@type": "ALTIMG",
            "@size": "2327",
            "@ref": "si3",
            "@mimetype": "image/svg+xml"
          },
          {
            "@category": "thumbnail",
            "@_fa": "true",
            "$": "https://api.elsevier.com/content/object/eid/1-s2.0-S2468823119304080-si4.svg?httpAccept=%2A%2F%2A",
            "@multimediatype": "Scalable Vector Graphics file",
            "@type": "ALTIMG",
            "@size": "3496",
            "@ref": "si4",
            "@mimetype": "image/svg+xml"
          },
          {
            "@category": "thumbnail",
            "@_fa": "true",
            "$": "https://api.elsevier.com/content/object/eid/1-s2.0-S2468823119304080-si5.svg?httpAccept=%2A%2F%2A",
            "@multimediatype": "Scalable Vector Graphics file",
            "@type": "ALTIMG",
            "@size": "1478",
            "@ref": "si5",
            "@mimetype": "image/svg+xml"
          },
          {
            "@category": "thumbnail",
            "@_fa": "true",
            "$": "https://api.elsevier.com/content/object/eid/1-s2.0-S2468823119304080-si6.svg?httpAccept=%2A%2F%2A",
            "@multimediatype": "Scalable Vector Graphics file",
            "@type": "ALTIMG",
            "@size": "33037",
            "@ref": "si6",
            "@mimetype": "image/svg+xml"
          },
          {
            "@category": "thumbnail",
            "@_fa": "true",
            "$": "https://api.elsevier.com/content/object/eid/1-s2.0-S2468823119304080-si7.svg?httpAccept=%2A%2F%2A",
            "@multimediatype": "Scalable Vector Graphics file",
            "@type": "ALTIMG",
            "@size": "5114",
            "@ref": "si7",
            "@mimetype": "image/svg+xml"
          },
          {
            "@category": "thumbnail",
            "@_fa": "true",
            "$": "https://api.elsevier.com/content/object/eid/1-s2.0-S2468823119304080-si8.svg?httpAccept=%2A%2F%2A",
            "@multimediatype": "Scalable Vector Graphics file",
            "@type": "ALTIMG",
            "@size": "13473",
            "@ref": "si8",
            "@mimetype": "image/svg+xml"
          },
          {
            "@category": "thumbnail",
            "@_fa": "true",
            "$": "https://api.elsevier.com/content/object/eid/1-s2.0-S2468823119304080-si9.svg?httpAccept=%2A%2F%2A",
            "@multimediatype": "Scalable Vector Graphics file",
            "@type": "ALTIMG",
            "@size": "25774",
            "@ref": "si9",
            "@mimetype": "image/svg+xml"
          },
          {
            "@category": "standard",
            "@_fa": "true",
            "$": "https://api.elsevier.com/content/object/eid/1-s2.0-S2468823119304080-am.pdf?httpAccept=%2A%2F%2A",
            "@multimediatype": "Acrobat PDF file",
            "@type": "AAM-PDF",
            "@size": "6944358",
            "@ref": "am",
            "@mimetype": "application/pdf"
          }
        ]
      },
      "link": {
        "@rel": "abstract",
        "@href": "https://api.elsevier.com/content/abstract/scopus_id/85071320128"
      }
    }
  }
}