{
  "metadata": {
    "title": "Molecular catalysts design: Intramolecular supporting site assisting to metal center for efficient CO<ce:inf loc=post>2</ce:inf> photo- and electroreduction",
    "authors": "; ",
    "journal": "Molecular Catalysis",
    "date": "2023-01-15",
    "doi": "10.1016/j.mcat.2022.112884",
    "abstract": "",
    "uri": "https://api.elsevier.com/content/article/pii/S2468823122007702",
    "pii": "S2468823122007702"
  },
  "fulltext": {
    "full-text-retrieval-response": {
      "scopus-eid": "2-s2.0-85144462058",
      "originalText": "serial JL 315758 291210 291744 291790 291809 31 Molecular Catalysis MOLECULARCATALYSIS 2022-12-19 2022-12-19 2022-12-19 2022-12-19 2023-01-07T15:56:45 1-s2.0-S2468823122007702 S2468-8231(22)00770-2 S2468823122007702 10.1016/j.mcat.2022.112884 S300 S300.1 FULL-TEXT 1-s2.0-S2468823122X00187 2024-06-26T17:47:58.012062Z 0 0 20230115 2023 2022-12-19T12:04:18.915892Z absattachment articleinfo articlenumber articletitlenorm authfirstinitialnorm authfirstsurnamenorm cid cids contenttype copyright crossmark dateloaded dateloadedtxt datesearch datesort dateupdated dco docsubtype doctype doi eid ewtransactionid hubeid indexeddate issn issnnorm itemstage itemtransactionid itemweight openaccess openarchive pg pgfirst pii piinorm pubdatestart pubdatetxt pubyr sectiontitle sortorder srctitle srctitlenorm srctype ssids alllist content subj subheadings suppl tomb volfirst volissue volumelist webpdf webpdfpagecount yearnav figure table body acknowledge affil articletitle auth authfirstini authfull authkeywords authlast grantnumber grantsponsor grantsponsorid highlightsabst primabst pubtype ref specialabst vitae 2468-8231 24688231 true 535 535 C Volume 535 46 112884 112884 112884 20230115 15 January 2023 2023-01-15 2023 Regular Papers article rev © 2022 Elsevier B.V. All rights reserved. MOLECULARCATALYSTSDESIGNINTRAMOLECULARSUPPORTINGSITEASSISTINGMETALCENTERFOREFFICIENTCO2PHOTOELECTROREDUCTION XIA W 1 Introduction 2 Binuclear catalysts 3 H-bond donor group bearing catalysts 4 Cis-complex catalysts 5 Outlook Acknowledgment References APPEL 2013 6621 6658 A NOCERA 2017 616 619 D YAN 2022 907 909 N ELOUARZAKI 2019 1900090 K GRICE 2017 78 95 K BERARDI 2014 7501 7519 S ZHANG 2019 2216 2264 B DELUNA 2019 364 P BUSHUYEV 2018 825 832 O NIELSEN 2018 244 254 D TAKEDA 2017 70 88 H WANG 2019 237 261 J JIANG 2019 9454 9468 C LIU 2021 19346 19368 J DALLE 2019 2752 2875 K WANG 2018 225 236 J BONIN 2017 184 198 J WANG 2017 4393 4402 F HU 2019 10475 10482 J ELGRISHI 2017 761 796 N KHALIL 2019 109246 M FUKUZUMI 2018 6017 6034 S GOTICO 2020 2381 2396 P GRILLS 2018 173 217 D FRANCKE 2018 4631 4701 R OUYANG 2017 738 743 T OUYANG 2018 16480 16485 T GUO 2019 801 808 Z HELM 2011 863 866 M WANG 2012 407 416 F ZHENG 2014 16817 16823 D KAEFFER 2015 1286 1295 N QUEYRIAUX 2015 3 19 N AI 2019 2876 2953 W HU 2019 14490 14493 J KOHLER 2019 1697 1709 L NICHOLS 2019 397 A ENSIGN 1995 5372 5378 S FREY 2002 153 160 M JEOUNG 2007 1461 1464 J HANSEN 2013 388 392 H LUBITZ 2014 4081 4148 W HILLE 2015 243 251 R REGINALD 2019 1635 1640 S VINYARD 2019 18917 18922 D ALONSOCOTCHICO 2020 896 905 L SEEFELDT 2020 5082 5106 L FLORIANI 1974 615 616 C FACHINETTI 1978 7405 7407 G FACHINETTI 1979 3469 3475 G FUJITA 1988 4870 4871 E GAMBAROTTA 1982 5082 5092 S KAFAFI 1984 177 183 Z PEARCE 1986 317 330 D SCHMIDT 1990 3420 3426 M HAMMOUCHE 1991 8455 8466 M ISSE 1991 197 208 A BHUGUN 1996 19981 19985 I SAMPSON 2016 1386 1393 M ZHANAIDAROVA 2017 12413 12416 A SATO 2018 4452 4458 S HONG 2019 20309 20317 D PYE 2017 1705 1718 D BI 2018 11815 11821 Q FABRY 2020 1511 1518 D HUANG 2020 6700 6703 N MAKAROV 2020 5653 5656 S ABDINEJAD 2020 979 984 M LIU 2021 9273 9281 D GUO 2016 9413 9416 Z POLYANSKY 2022 1706 1717 D MOHAMED 2015 16900 16903 E ZAHRAN 2016 24533 Z MOHAMED 2017 7140 7150 E COLLIN 1988 1986 1990 J MOCHIZUKI 1996 5132 5136 K CAO 2018 798 803 L PRAT 2020 14251 14262 J ZHANG 2020 17464 17472 L XIA 2022 426 W BELEY 1986 7461 7467 M FUJITA 1993 2657 2662 E COSTENTIN 2012 90 94 C FROEHLICH 2012 3932 3934 J COSTENTIN 2014 11821 11829 C SONG 2014 7500 7507 J COSTENTIN 2015 6882 6886 C CHAPOVETSKY 2016 5765 5768 A ROY 2017 3685 3696 S CHAPOVETSKY 2018 397 404 A HAVIV 2018 12451 12456 E MARGARIT 2018 1219 1223 C NICHOLS 2018 1213 1218 E NICHOLS 2018 2952 2960 E GOTICO 2019 4504 4509 P GUO 2019 17875 17883 Y LIAO 2019 4867 4878 Q MATSUBARA 2019 1999 2004 Y WALSH 2019 123 140 A MATSUBARA 2020 315 317 Y TALUKDAR 2020 6087 6099 K WILLIAMS 2020 3412 3417 C ZEE 2020 5206 5217 D WANG 2016 7408 7420 F ZHU 2018 13142 13150 C ZHU 2018 175 179 C TO 2015 5891 5903 W RUDSHTEYN 2018 7952 7960 B YANG 2018 9564 9575 W MALLAH 2020 286 294 J WANG 2020 2821 2829 H FENG 2021 26573 26580 Y SAHM 2021 9078 9087 C WU 2022 29945 29955 J XIA 2022 20220192 W SUN 2020 20183 20191 Q XIAX2023X112884 XIAX2023X112884XW 2024-12-19T00:00:00.000Z 2024-12-19T00:00:00.000Z http://creativecommons.org/licenses/by-nc-nd/4.0/ © 2022 Elsevier B.V. All rights reserved. 2022-12-25T09:14:31.284Z http://vtw.elsevier.com/data/voc/AddOnTypes/50.7/aggregated-refined National Natural Science Foundation of China 21871102 22171096 NSFC National Natural Science Foundation of China http://data.elsevier.com/vocabulary/SciValFunders/501100001809 http://sws.geonames.org/1814991/ We are grateful for financial support from the National Natural Science Foundation of China ( 21871102, 22171096 ). 0 https://doi.org/10.15223/policy-017 https://doi.org/10.15223/policy-037 https://doi.org/10.15223/policy-012 https://doi.org/10.15223/policy-029 https://doi.org/10.15223/policy-004 item S2468-8231(22)00770-2 S2468823122007702 1-s2.0-S2468823122007702 10.1016/j.mcat.2022.112884 315758 2023-04-05T04:12:53.364017Z 2023-01-15 1-s2.0-S2468823122007702-main.pdf https://s3-eu-west-1.amazonaws.com/prod-ucs-content-store-eu-west/content/pii:S2468823122007702/MAIN/application/pdf/0ebc3f22fb9c1f10db73dd569956af39/main.pdf main.pdf pdf true 4607138 MAIN 12 1-s2.0-S2468823122007702-main_1.png https://s3-eu-west-1.amazonaws.com/prod-ucs-content-store-eu-west/content/pii:S2468823122007702/PREVIEW/image/png/f6a24518b6ba155e58a764050db02c7e/main_1.png main_1.png png 48614 849 656 IMAGE-WEB-PDF 1 1-s2.0-S2468823122007702-sc2.jpg https://s3-eu-west-1.amazonaws.com/prod-ucs-content-store-eu-west/content/pii:S2468823122007702/sc2/DOWNSAMPLED/image/jpeg/c271b7a87723b8415e58044cb37f1eae/sc2.jpg sc2 sc2.jpg jpg 54242 274 661 IMAGE-DOWNSAMPLED 1-s2.0-S2468823122007702-sc1.jpg https://s3-eu-west-1.amazonaws.com/prod-ucs-content-store-eu-west/content/pii:S2468823122007702/sc1/DOWNSAMPLED/image/jpeg/c2b28dba53128c49add19c2aa6d303e4/sc1.jpg sc1 sc1.jpg jpg 44853 419 668 IMAGE-DOWNSAMPLED 1-s2.0-S2468823122007702-sc4.jpg https://s3-eu-west-1.amazonaws.com/prod-ucs-content-store-eu-west/content/pii:S2468823122007702/sc4/DOWNSAMPLED/image/jpeg/80a18eb3e502e82a28d8b5212aa55dfe/sc4.jpg sc4 sc4.jpg jpg 44502 333 764 IMAGE-DOWNSAMPLED 1-s2.0-S2468823122007702-sc18.jpg https://s3-eu-west-1.amazonaws.com/prod-ucs-content-store-eu-west/content/pii:S2468823122007702/sc18/DOWNSAMPLED/image/jpeg/ea8a01c0dc96416c975d95c6315b9192/sc18.jpg sc18 sc18.jpg jpg 80389 528 772 IMAGE-DOWNSAMPLED 1-s2.0-S2468823122007702-sc3.jpg https://s3-eu-west-1.amazonaws.com/prod-ucs-content-store-eu-west/content/pii:S2468823122007702/sc3/DOWNSAMPLED/image/jpeg/b2f9cfd9dd43d2ff48284eb8a84589e8/sc3.jpg sc3 sc3.jpg jpg 15325 94 382 IMAGE-DOWNSAMPLED 1-s2.0-S2468823122007702-sc6.jpg https://s3-eu-west-1.amazonaws.com/prod-ucs-content-store-eu-west/content/pii:S2468823122007702/sc6/DOWNSAMPLED/image/jpeg/bac6fedf1d1572dd77cddb1f3fd5596d/sc6.jpg sc6 sc6.jpg jpg 19041 126 626 IMAGE-DOWNSAMPLED 1-s2.0-S2468823122007702-sc5.jpg https://s3-eu-west-1.amazonaws.com/prod-ucs-content-store-eu-west/content/pii:S2468823122007702/sc5/DOWNSAMPLED/image/jpeg/614950d4650a3ffccbc8ac00867bf2af/sc5.jpg sc5 sc5.jpg jpg 24986 371 386 IMAGE-DOWNSAMPLED 1-s2.0-S2468823122007702-sc8.jpg https://s3-eu-west-1.amazonaws.com/prod-ucs-content-store-eu-west/content/pii:S2468823122007702/sc8/DOWNSAMPLED/image/jpeg/b2e811b5d4da2d6e8f263c54765d9444/sc8.jpg sc8 sc8.jpg jpg 18030 133 376 IMAGE-DOWNSAMPLED 1-s2.0-S2468823122007702-sc7.jpg https://s3-eu-west-1.amazonaws.com/prod-ucs-content-store-eu-west/content/pii:S2468823122007702/sc7/DOWNSAMPLED/image/jpeg/11ca0bcfe66d4aa290bc29391faca179/sc7.jpg sc7 sc7.jpg jpg 33139 529 325 IMAGE-DOWNSAMPLED 1-s2.0-S2468823122007702-fx2.jpg https://s3-eu-west-1.amazonaws.com/prod-ucs-content-store-eu-west/content/pii:S2468823122007702/fx2/DOWNSAMPLED/image/jpeg/d19c5433d790a3a6db36371e68127248/fx2.jpg fx2 fx2.jpg jpg 8975 151 113 IMAGE-DOWNSAMPLED 1-s2.0-S2468823122007702-fx1.jpg https://s3-eu-west-1.amazonaws.com/prod-ucs-content-store-eu-west/content/pii:S2468823122007702/fx1/DOWNSAMPLED/image/jpeg/e1afb6a9de1136f0b62efea58f321702/fx1.jpg fx1 fx1.jpg jpg 9812 151 113 IMAGE-DOWNSAMPLED 1-s2.0-S2468823122007702-ga1.jpg https://s3-eu-west-1.amazonaws.com/prod-ucs-content-store-eu-west/content/pii:S2468823122007702/ga1/DOWNSAMPLED/image/jpeg/4bb25a4667fd1439c8a13c91b94621b6/ga1.jpg ga1 true ga1.jpg jpg 26581 125 301 IMAGE-DOWNSAMPLED 1-s2.0-S2468823122007702-sc12.jpg https://s3-eu-west-1.amazonaws.com/prod-ucs-content-store-eu-west/content/pii:S2468823122007702/sc12/DOWNSAMPLED/image/jpeg/63a95bedc36fc3306c1d0718d8071a8a/sc12.jpg sc12 sc12.jpg jpg 18485 106 528 IMAGE-DOWNSAMPLED 1-s2.0-S2468823122007702-sc9.jpg https://s3-eu-west-1.amazonaws.com/prod-ucs-content-store-eu-west/content/pii:S2468823122007702/sc9/DOWNSAMPLED/image/jpeg/647f789152fa53756d0115bcc27d5aa0/sc9.jpg sc9 sc9.jpg jpg 32212 176 795 IMAGE-DOWNSAMPLED 1-s2.0-S2468823122007702-sc13.jpg https://s3-eu-west-1.amazonaws.com/prod-ucs-content-store-eu-west/content/pii:S2468823122007702/sc13/DOWNSAMPLED/image/jpeg/230104c83232d2ec08222eb41217cbd0/sc13.jpg sc13 sc13.jpg jpg 19964 237 332 IMAGE-DOWNSAMPLED 1-s2.0-S2468823122007702-sc10.jpg https://s3-eu-west-1.amazonaws.com/prod-ucs-content-store-eu-west/content/pii:S2468823122007702/sc10/DOWNSAMPLED/image/jpeg/d65aa27febba33d4f2eddbf25a3544d1/sc10.jpg sc10 sc10.jpg jpg 27631 253 513 IMAGE-DOWNSAMPLED 1-s2.0-S2468823122007702-sc11.jpg https://s3-eu-west-1.amazonaws.com/prod-ucs-content-store-eu-west/content/pii:S2468823122007702/sc11/DOWNSAMPLED/image/jpeg/e9669cc1768463fbc673a8e0b1de497a/sc11.jpg sc11 sc11.jpg jpg 19282 301 330 IMAGE-DOWNSAMPLED 1-s2.0-S2468823122007702-sc16.jpg https://s3-eu-west-1.amazonaws.com/prod-ucs-content-store-eu-west/content/pii:S2468823122007702/sc16/DOWNSAMPLED/image/jpeg/27ac0aca6d261f662eebc6b32363b414/sc16.jpg sc16 sc16.jpg jpg 70334 522 386 IMAGE-DOWNSAMPLED 1-s2.0-S2468823122007702-sc17.jpg https://s3-eu-west-1.amazonaws.com/prod-ucs-content-store-eu-west/content/pii:S2468823122007702/sc17/DOWNSAMPLED/image/jpeg/c180e6f28ce4d12a30188b7cd7b4d470/sc17.jpg sc17 sc17.jpg jpg 7918 131 215 IMAGE-DOWNSAMPLED 1-s2.0-S2468823122007702-sc14.jpg https://s3-eu-west-1.amazonaws.com/prod-ucs-content-store-eu-west/content/pii:S2468823122007702/sc14/DOWNSAMPLED/image/jpeg/01815f0d276320ac0e1f1d894a4e2fe7/sc14.jpg sc14 sc14.jpg jpg 80000 615 680 IMAGE-DOWNSAMPLED 1-s2.0-S2468823122007702-sc15.jpg https://s3-eu-west-1.amazonaws.com/prod-ucs-content-store-eu-west/content/pii:S2468823122007702/sc15/DOWNSAMPLED/image/jpeg/140e22f91e0d50173d3cf7d24875e056/sc15.jpg sc15 sc15.jpg jpg 22119 207 410 IMAGE-DOWNSAMPLED 1-s2.0-S2468823122007702-sc2.sml https://s3-eu-west-1.amazonaws.com/prod-ucs-content-store-eu-west/content/pii:S2468823122007702/sc2/THUMBNAIL/image/gif/46f1b5a8c269294ee238d82a331bae96/sc2.sml sc2 sc2.sml sml 9420 91 219 IMAGE-THUMBNAIL 1-s2.0-S2468823122007702-sc1.sml https://s3-eu-west-1.amazonaws.com/prod-ucs-content-store-eu-west/content/pii:S2468823122007702/sc1/THUMBNAIL/image/gif/cf5874a368309981a943250c5e209275/sc1.sml sc1 sc1.sml sml 8521 137 219 IMAGE-THUMBNAIL 1-s2.0-S2468823122007702-sc4.sml https://s3-eu-west-1.amazonaws.com/prod-ucs-content-store-eu-west/content/pii:S2468823122007702/sc4/THUMBNAIL/image/gif/178717124e829c0588671ad5202d4d96/sc4.sml sc4 sc4.sml sml 4335 95 219 IMAGE-THUMBNAIL 1-s2.0-S2468823122007702-sc18.sml https://s3-eu-west-1.amazonaws.com/prod-ucs-content-store-eu-west/content/pii:S2468823122007702/sc18/THUMBNAIL/image/gif/b90487456ad9a52d87b5bfd9b90049bf/sc18.sml sc18 sc18.sml sml 9047 150 219 IMAGE-THUMBNAIL 1-s2.0-S2468823122007702-sc3.sml https://s3-eu-west-1.amazonaws.com/prod-ucs-content-store-eu-west/content/pii:S2468823122007702/sc3/THUMBNAIL/image/gif/59e9463eb5ad6eb3b137edd18c0fea48/sc3.sml sc3 sc3.sml sml 6162 54 219 IMAGE-THUMBNAIL 1-s2.0-S2468823122007702-sc6.sml https://s3-eu-west-1.amazonaws.com/prod-ucs-content-store-eu-west/content/pii:S2468823122007702/sc6/THUMBNAIL/image/gif/3387bb3fd6974eb6859a8b7ef90a0e31/sc6.sml sc6 sc6.sml sml 2880 44 219 IMAGE-THUMBNAIL 1-s2.0-S2468823122007702-sc5.sml https://s3-eu-west-1.amazonaws.com/prod-ucs-content-store-eu-west/content/pii:S2468823122007702/sc5/THUMBNAIL/image/gif/b601e4d7e7ba4685d11487dbfab23ade/sc5.sml sc5 sc5.sml sml 8118 163 170 IMAGE-THUMBNAIL 1-s2.0-S2468823122007702-sc8.sml https://s3-eu-west-1.amazonaws.com/prod-ucs-content-store-eu-west/content/pii:S2468823122007702/sc8/THUMBNAIL/image/gif/7a3904c2fda72708a1f468d3cc533226/sc8.sml sc8 sc8.sml sml 6992 77 219 IMAGE-THUMBNAIL 1-s2.0-S2468823122007702-sc7.sml https://s3-eu-west-1.amazonaws.com/prod-ucs-content-store-eu-west/content/pii:S2468823122007702/sc7/THUMBNAIL/image/gif/dd26780bbe595e01248fcba2c6b09ec5/sc7.sml sc7 sc7.sml sml 5374 163 100 IMAGE-THUMBNAIL 1-s2.0-S2468823122007702-fx2.sml https://s3-eu-west-1.amazonaws.com/prod-ucs-content-store-eu-west/content/pii:S2468823122007702/fx2/THUMBNAIL/image/gif/801d5d68515297e91bb7ac8e86bff08e/fx2.sml fx2 fx2.sml sml 17356 164 123 IMAGE-THUMBNAIL 1-s2.0-S2468823122007702-fx1.sml https://s3-eu-west-1.amazonaws.com/prod-ucs-content-store-eu-west/content/pii:S2468823122007702/fx1/THUMBNAIL/image/gif/bbb8b06333b8468bdbdc5414add424eb/fx1.sml fx1 fx1.sml sml 18282 164 123 IMAGE-THUMBNAIL 1-s2.0-S2468823122007702-ga1.sml https://s3-eu-west-1.amazonaws.com/prod-ucs-content-store-eu-west/content/pii:S2468823122007702/ga1/THUMBNAIL/image/gif/f0a4f0f2c0648abf4124ddb14d19c55c/ga1.sml ga1 true ga1.sml sml 20591 91 219 IMAGE-THUMBNAIL 1-s2.0-S2468823122007702-sc12.sml https://s3-eu-west-1.amazonaws.com/prod-ucs-content-store-eu-west/content/pii:S2468823122007702/sc12/THUMBNAIL/image/gif/ef72432aaf37e7b8b80af37efd19278b/sc12.sml sc12 sc12.sml sml 5865 44 219 IMAGE-THUMBNAIL 1-s2.0-S2468823122007702-sc9.sml https://s3-eu-west-1.amazonaws.com/prod-ucs-content-store-eu-west/content/pii:S2468823122007702/sc9/THUMBNAIL/image/gif/fc9c270e155ae5c6c6b9997fe60d8352/sc9.sml sc9 sc9.sml sml 3352 49 219 IMAGE-THUMBNAIL 1-s2.0-S2468823122007702-sc13.sml https://s3-eu-west-1.amazonaws.com/prod-ucs-content-store-eu-west/content/pii:S2468823122007702/sc13/THUMBNAIL/image/gif/65edd9043ea321d6fddc04d30ebef163/sc13.sml sc13 sc13.sml sml 8346 156 219 IMAGE-THUMBNAIL 1-s2.0-S2468823122007702-sc10.sml https://s3-eu-west-1.amazonaws.com/prod-ucs-content-store-eu-west/content/pii:S2468823122007702/sc10/THUMBNAIL/image/gif/f9f8100130822c985fb339322c1a802c/sc10.sml sc10 sc10.sml sml 4950 108 219 IMAGE-THUMBNAIL 1-s2.0-S2468823122007702-sc11.sml https://s3-eu-west-1.amazonaws.com/prod-ucs-content-store-eu-west/content/pii:S2468823122007702/sc11/THUMBNAIL/image/gif/53a8aeb35ef4cda739e527b0babb3f3f/sc11.sml sc11 sc11.sml sml 7323 163 179 IMAGE-THUMBNAIL 1-s2.0-S2468823122007702-sc16.sml https://s3-eu-west-1.amazonaws.com/prod-ucs-content-store-eu-west/content/pii:S2468823122007702/sc16/THUMBNAIL/image/gif/5e5d5e418f73a7a02080e61ec93c36f8/sc16.sml sc16 sc16.sml sml 9862 164 121 IMAGE-THUMBNAIL 1-s2.0-S2468823122007702-sc17.sml https://s3-eu-west-1.amazonaws.com/prod-ucs-content-store-eu-west/content/pii:S2468823122007702/sc17/THUMBNAIL/image/gif/677343391e969ea9b8f2859fae844f49/sc17.sml sc17 sc17.sml sml 5241 133 219 IMAGE-THUMBNAIL 1-s2.0-S2468823122007702-sc14.sml https://s3-eu-west-1.amazonaws.com/prod-ucs-content-store-eu-west/content/pii:S2468823122007702/sc14/THUMBNAIL/image/gif/902a1e3d450dbcbc5d1ef39e45dfb4ea/sc14.sml sc14 sc14.sml sml 8731 164 181 IMAGE-THUMBNAIL 1-s2.0-S2468823122007702-sc15.sml https://s3-eu-west-1.amazonaws.com/prod-ucs-content-store-eu-west/content/pii:S2468823122007702/sc15/THUMBNAIL/image/gif/b60dab282109d3573f0135fe53775370/sc15.sml sc15 sc15.sml sml 7220 111 219 IMAGE-THUMBNAIL 1-s2.0-S2468823122007702-sc2_lrg.jpg https://s3-eu-west-1.amazonaws.com/prod-ucs-content-store-eu-west/content/pii:S2468823122007702/HIGHRES/image/jpeg/a0dc7e19509722a6ce00e1f4ad3a4f9b/sc2_lrg.jpg sc2 sc2_lrg.jpg jpg 400826 1214 2926 IMAGE-HIGH-RES 1-s2.0-S2468823122007702-sc1_lrg.jpg https://s3-eu-west-1.amazonaws.com/prod-ucs-content-store-eu-west/content/pii:S2468823122007702/HIGHRES/image/jpeg/fac9ea3041faf716a2d7875e7704f13d/sc1_lrg.jpg sc1 sc1_lrg.jpg jpg 371910 1854 2956 IMAGE-HIGH-RES 1-s2.0-S2468823122007702-sc4_lrg.jpg https://s3-eu-west-1.amazonaws.com/prod-ucs-content-store-eu-west/content/pii:S2468823122007702/HIGHRES/image/jpeg/20abbefadf4ee932428cebd03999134d/sc4_lrg.jpg sc4 sc4_lrg.jpg jpg 349002 1474 3383 IMAGE-HIGH-RES 1-s2.0-S2468823122007702-sc18_lrg.jpg https://s3-eu-west-1.amazonaws.com/prod-ucs-content-store-eu-west/content/pii:S2468823122007702/HIGHRES/image/jpeg/4921c50f7255f780404116a11de22dff/sc18_lrg.jpg sc18 sc18_lrg.jpg jpg 500503 2336 3417 IMAGE-HIGH-RES 1-s2.0-S2468823122007702-sc3_lrg.jpg https://s3-eu-west-1.amazonaws.com/prod-ucs-content-store-eu-west/content/pii:S2468823122007702/HIGHRES/image/jpeg/a0e3acc3050684fc84a55c81fc3b9275/sc3_lrg.jpg sc3 sc3_lrg.jpg jpg 96212 417 1692 IMAGE-HIGH-RES 1-s2.0-S2468823122007702-sc6_lrg.jpg https://s3-eu-west-1.amazonaws.com/prod-ucs-content-store-eu-west/content/pii:S2468823122007702/HIGHRES/image/jpeg/84f3bb7c84a1cf47d4682c6a37a5ea7d/sc6_lrg.jpg sc6 sc6_lrg.jpg jpg 144644 556 2770 IMAGE-HIGH-RES 1-s2.0-S2468823122007702-sc5_lrg.jpg https://s3-eu-west-1.amazonaws.com/prod-ucs-content-store-eu-west/content/pii:S2468823122007702/HIGHRES/image/jpeg/8a64f05976c5f41cc86cea4fcbfd47a3/sc5_lrg.jpg sc5 sc5_lrg.jpg jpg 182213 1641 1708 IMAGE-HIGH-RES 1-s2.0-S2468823122007702-sc8_lrg.jpg https://s3-eu-west-1.amazonaws.com/prod-ucs-content-store-eu-west/content/pii:S2468823122007702/HIGHRES/image/jpeg/d80d28f3d2f868b5feb8df8abc4cfc17/sc8_lrg.jpg sc8 sc8_lrg.jpg jpg 111651 589 1668 IMAGE-HIGH-RES 1-s2.0-S2468823122007702-sc7_lrg.jpg https://s3-eu-west-1.amazonaws.com/prod-ucs-content-store-eu-west/content/pii:S2468823122007702/HIGHRES/image/jpeg/698e0591167272128d016fd5b5560487/sc7_lrg.jpg sc7 sc7_lrg.jpg jpg 230780 2346 1441 IMAGE-HIGH-RES 1-s2.0-S2468823122007702-fx2_lrg.jpg https://s3-eu-west-1.amazonaws.com/prod-ucs-content-store-eu-west/content/pii:S2468823122007702/HIGHRES/image/jpeg/3228a4aadb8849f3c5d452fb49a1bd50/fx2_lrg.jpg fx2 fx2_lrg.jpg jpg 67479 667 500 IMAGE-HIGH-RES 1-s2.0-S2468823122007702-fx1_lrg.jpg https://s3-eu-west-1.amazonaws.com/prod-ucs-content-store-eu-west/content/pii:S2468823122007702/HIGHRES/image/jpeg/dc0fe46dbf1da8e80dddf8109277cb73/fx1_lrg.jpg fx1 fx1_lrg.jpg jpg 73654 667 500 IMAGE-HIGH-RES 1-s2.0-S2468823122007702-ga1_lrg.jpg https://s3-eu-west-1.amazonaws.com/prod-ucs-content-store-eu-west/content/pii:S2468823122007702/HIGHRES/image/jpeg/5499919f3d482c79e94522eabfe4a808/ga1_lrg.jpg ga1 true ga1_lrg.jpg jpg 222909 553 1333 IMAGE-HIGH-RES 1-s2.0-S2468823122007702-sc12_lrg.jpg https://s3-eu-west-1.amazonaws.com/prod-ucs-content-store-eu-west/content/pii:S2468823122007702/HIGHRES/image/jpeg/53b8649eaa5bbb9f2392d9c6f1f2d4b3/sc12_lrg.jpg sc12 sc12_lrg.jpg jpg 122322 468 2338 IMAGE-HIGH-RES 1-s2.0-S2468823122007702-sc9_lrg.jpg https://s3-eu-west-1.amazonaws.com/prod-ucs-content-store-eu-west/content/pii:S2468823122007702/HIGHRES/image/jpeg/840347e148a36c6170e6d1f54cb4da37/sc9_lrg.jpg sc9 sc9_lrg.jpg jpg 252192 780 3521 IMAGE-HIGH-RES 1-s2.0-S2468823122007702-sc13_lrg.jpg https://s3-eu-west-1.amazonaws.com/prod-ucs-content-store-eu-west/content/pii:S2468823122007702/HIGHRES/image/jpeg/aeb42f432a78b3d2416cb767bc52d7ac/sc13_lrg.jpg sc13 sc13_lrg.jpg jpg 141102 1051 1473 IMAGE-HIGH-RES 1-s2.0-S2468823122007702-sc10_lrg.jpg https://s3-eu-west-1.amazonaws.com/prod-ucs-content-store-eu-west/content/pii:S2468823122007702/HIGHRES/image/jpeg/2e229b84456e6d41e94f664be1d7ef25/sc10_lrg.jpg sc10 sc10_lrg.jpg jpg 198904 1123 2274 IMAGE-HIGH-RES 1-s2.0-S2468823122007702-sc11_lrg.jpg https://s3-eu-west-1.amazonaws.com/prod-ucs-content-store-eu-west/content/pii:S2468823122007702/HIGHRES/image/jpeg/79225acd6b8bf44aebc35a322e832923/sc11_lrg.jpg sc11 sc11_lrg.jpg jpg 143490 1334 1461 IMAGE-HIGH-RES 1-s2.0-S2468823122007702-sc16_lrg.jpg https://s3-eu-west-1.amazonaws.com/prod-ucs-content-store-eu-west/content/pii:S2468823122007702/HIGHRES/image/jpeg/4cd7680e38816ea0304874f972ca688d/sc16_lrg.jpg sc16 sc16_lrg.jpg jpg 519884 2311 1709 IMAGE-HIGH-RES 1-s2.0-S2468823122007702-sc17_lrg.jpg https://s3-eu-west-1.amazonaws.com/prod-ucs-content-store-eu-west/content/pii:S2468823122007702/HIGHRES/image/jpeg/1b7c80a1681780485e8dbbbf2b3ce566/sc17_lrg.jpg sc17 sc17_lrg.jpg jpg 57019 581 954 IMAGE-HIGH-RES 1-s2.0-S2468823122007702-sc14_lrg.jpg https://s3-eu-west-1.amazonaws.com/prod-ucs-content-store-eu-west/content/pii:S2468823122007702/HIGHRES/image/jpeg/ac33529ce2e49b543015651271dd3ca0/sc14_lrg.jpg sc14 sc14_lrg.jpg jpg 643410 2724 3010 IMAGE-HIGH-RES 1-s2.0-S2468823122007702-sc15_lrg.jpg https://s3-eu-west-1.amazonaws.com/prod-ucs-content-store-eu-west/content/pii:S2468823122007702/HIGHRES/image/jpeg/8a8d0d4eaa2c24b07d2b807e5cf32290/sc15_lrg.jpg sc15 sc15_lrg.jpg jpg 149375 919 1818 IMAGE-HIGH-RES 1-s2.0-S2468823122007702-am.pdf am am.pdf pdf 1971360 AAM-PDF https://s3-eu-west-1.amazonaws.com/prod-ucs-content-store-eu-west/content/egi:103LWQDKNRR/MAIN/application/pdf/31290de21c28a6b1077f761856de40be/am.pdf MCAT 112884 112884 S2468-8231(22)00770-2 10.1016/j.mcat.2022.112884 Elsevier B.V. Scheme 1 The photocatalytic/electrocatalytic mechanism of CO2 reduction and the activation modes of CO2 by metal complex catalyst. Scheme 1 Scheme 2 Illustration of an intramolecular supporting site for the synergistic stabilization of M-CO2 adducts with metal centers. Scheme 2 Scheme 3 The chemical structure of RC1 and RC1a. Scheme 3 Scheme 4 The chemical structure of binuclear and corresponding mononuclear complex based on cobalt metal of RC2-RC10. Scheme 4 Scheme 5 The CO2 reduction at RC2 and the structure of TS1-1 and TS2-1 based on DFT calculations. Reproduced with permission from 26, Copyright 2017, Wiley‐VCH Verlag GmbH & Co. KGaA, Weinheim. Scheme 5 Scheme 6 The chemical structures of photosensitizers PS1-PS4 used in photocatalytic CO2 reduction systems. Scheme 6 Scheme 7 The mechanism of CO2 reduction at RC7 based on DFT calculations. Reproduced with permission from 28, Copyright 2019, Springer Nature Limited. Scheme 7 Scheme 8 The structure of RC11 and the intermediate RC11a and RC11b. Scheme 8 Scheme 9 The chemical structure of binuclear iron complex of RC12-RC19. Scheme 9 Scheme 10 The chemical structure of binuclear and corresponding mononuclear complex based on nickel metal of RC20-RC25. Scheme 10 Scheme 11 The mechanism of CO2 reduction at RC22 based on DFT calculations. Reproduced with permission from 77, Copyright 2018, Royal Society of Chemistry. Scheme 11 Scheme 12 The chemical structures of RC34-RC37. Scheme 12 Scheme 13 The mechanism of CO2 reduction at RC37. Reproduced with permission from 88, Copyright 2016, American Chemical Society. Scheme 13 Scheme 14 The chemical structures of RC38-RC45 and the proposed intermediates RC41a and RC44a. Scheme 14 Scheme 15 The chemical structures of RC46, the structure of RC46d based on DFT calculations, and the CO2 reduction mechanism at RC46. Reproduced with permission from 104, Copyright 2016, Royal Society of Chemistry. Scheme 15 Scheme 16 Free energy surface for CO2 binding and protonation at RC46 based on DFT. (a) with Cl. (b) in the absence of the Cl ligand. Reproduced with permission from 104, Copyright 2016, Royal Society of Chemistry. Scheme 16 Scheme 17 The chemical structures of RC47-RC49. Scheme 17 Scheme 18 The chemical structure of RC49 and the CO2 reduction mechanism at RC49. Reproduced with permission from 105, Copyright 2018, Royal Society of Chemistry. Scheme 18 Table 1 Results of the reviewed electrocatalytic CO2 reduction systems. Table 1 Catalyst Reduction potential[a] Electrolysis potential Workingelectrode Electrolyte Solvent Main product TON[d] TOF[d](s−1) FE/% Ref. RC12 -1.48/-1.46 (FeIFeI/FeIFe0) −1.35 GC[c] nBu4PF6 DMF/H2O CO 1.54 × 108[e] 4300[e] 95 72 RC12 -1.40/-1.48 (FeIFeI/Fe0Fe0) −1.40 GC nBu4PF6 DMF/H2O CO n. a. 10000 n. a. 73 RC13 -1.25 (FeIFeI/Fe°Fe0) −1.25 GC nBu4PF6 DMF/H2O CO n. a. 6309 n. a. 73 RC14 -1.34/-1.44 (FeIFeI/Fe0Fe0) −1.34 GC nBu4PF6 DMF/H2O CO n. a. 6309 n. a. 73 RC15 -1.35 (FeIFeI/Fe°Fe0) −1.35 GC nBu4PF6 DMF/H2O CO n. a. 2512 n. a. 73 RC16 -1.60 (FeIFeI/Fe0Fe0) −1.60 GC nBu4PF6 DMF/H2O CO n. a. 630957 n. a. 73 RC17 -1.35/-1.54 (FeIFeI/Fe°Fe0) −1.35 GC nBu4PF6 DMF/H2O CO n. a. 50119 n. a. 73 RC19/CNT n. a. −0.80 GC nBu4PF6 DMF CO 36994 10.2 89 68 RC20 -1.20 (NiIINiII/NiINiI) −1.36 Hg NaClO4 DMF CO 15.4 n. a. 65 75 RC22 RC23 -1.00 (NiIINiII/NiINiI) in CO2 -1.08 (NiIINiII/NiINiI) in CO2 −1.16−1.16 GCGC nBu4PF6 nBu4PF6 CH3CN/H2OCH3CN/H2O COCO 4.1 × 106[e] 9.2 × 104[e] 190.0[e] 4.2[e] 9525 7777 RC24 -1.10 (NiIINiII/NiINiI) in CO2 −1.16 GC nBu4PF6 CH3CN/H2O CO 1.1 × 105[e] 5.0[e] 52 77 RC34 -1.05 (NiII/NiI) −1.05 Hg KNO3 H2O CO 126 32 96 81 RC34 RC35 n. a.n. a. −1.21−1.63 GCGC nBu4PF6 nBu4PF6 CH3CN/H2OCH3CN/H2O COH2 4n. a. 3.5n. a. 9080 8484 RC37 -1.64 (CoII/CoI) −1.64 GC nBu4PF6 DMF CO 6.2 170[e] 98 88 RC38 -1.33 (FeI/Fe0) −1.41 Carbon crucible nBu4PF6 DMF/H2O CO n.a. 1.6 × 106[f] n. a. 83 RC40 RC41 RC42 RC43 -1.40 (FeI/Fe0)-1.46 (FeI/Fe0)-1.43 (FeI/Fe0)-1.44 (FeI/Fe0) −1.40−1.46−1.43−1.44 SUSSUSSUSSUS nBu4PF6 nBu4PF6 nBu4PF6 nBu4PF6 DMFDMFDMFDMF COCOCOCO n.a.n.a.n.a.n.a. 2.24 × 104[f] 5.50 × 106[f] 1.70 × 102[f] 6.76 × 103[f] 83927479 94949494 RC44 -1.118 (FeI/Fe0) −1.07 GC nBu4PF6 DMF/H2O CO 3.28 × 106[e] 455[e] 91 95 RC46 -1.37 (CoII/CoI) −1.46 Carbon rod nBu4PF6 CH3CN CO n. a. n. a. 96 104 [a]. The potential of reference electrode(E) versus NHE: E Fc+/Fc = 0.69 V(in CH3CN), 0.72 V(in DMF), 0.40 V(in H2O), E SCE = 0.24 V, E Ag/AgCl = 0.20 V [b]. SUS: Stainless steel [c]. GC: Glassy carbon [d]. TON and TOF were calculated based on the actual amount of catalyst. [e]. TON and TOF were calculated based on the catalyst in the diffusion layer reported in ref.72. [f]. TOF was calculated based on Foot-of-the-Wave analysis reported in ref.83 [g]. n. a.: no data available Table 2 Results of the reviewed photocatalytic CO2 reduction systems. Table 2 Catalyst Solvent Photosensitizer Sacrificial donor Main product TON TOF (s−1) Selectivity/% Refer. RC2 CH3CN/H2O [Ru(phen)3](PF6)2 TEOA[b] CO 16896 0.47 98 26 RC3 CH3CN/H2O [Ru(phen)3](PF6)2 TEOA CO 1500 0.04 85 26, 27 RC4 CH3CN/H2O [Ru(phen)3](PF6)2 TEOA CO 65000 1.8 98 27 RC5 CH3CN/H2O [Ru(phen)3](PF6)2 TEOA CO 3400 0.093 71 27 RC6 CH3CN/H2O [Ru(phen)3](PF6)2 TEOA CO 6680 0.19 98 69 RC7 CH3CN [Ru(phen)3]Cl2 TEA[c] HCOOH (basic solution)CO (acidic solution) 821829 n.a.n.a. 75.996 28 RC8 CH3CN [Ru(phen)3]Cl2 BIH/TEOA CO 2260 n.a. 98 28 RC8 CH3CN [Ru(phen)3]Cl2 BIH/TEOA HCOOHCO 171166 n.a.n.a. 4241 70 RC21 H2O [Ru(bpy)3]Cl2 Ascorbic acid CO 4.4 n.a. 1.3 76 RC46 DMF Ir(ppy)3 TEA CO 368 n.a. 95 104 RC47 RC48 DMFDMF Ir(ppy)3 Ir(ppy)3 TEATEA COCO 470403 n.a.n.a. 8789 106106 RC49 CH3CN Ir(ppy)3 TEA CO 91.2 n.a. 80 105 RC49 CH3CN/H2O Ir(ppy)3 TEA H2 184.9 n.a. 70.6 105 [a]. BIH: 1,3-dimethyl-2-phenylbenzimidazoline [b]. TEOA: Triethanolamine [c]. TEA: Triethylamine [d]. n. a.: no data available Review Molecular catalysts design: Intramolecular supporting site assisting to metal center for efficient CO2 photo- and electroreduction Wu Xia a b Feng Wang ⁎ a a Key Laboratory of Materials Chemistry for Energy Conversion and Storage (Huazhong University of Science and Technology) of Ministry of Education, Hubei Key Laboratory of Material Chemistry and Service Failure, School of Chemistry and Chemical Engineering, Huazhong University of Science and Technology, Wuhan, 430074, P R China Key Laboratory of Materials Chemistry for Energy Conversion and Storage (Huazhong University of Science and Technology) of Ministry of Education, Hubei Key Laboratory of Material Chemistry and Service Failure, School of Chemistry and Chemical Engineering Huazhong University of Science and Technology Wuhan 430074 P R China aKey Laboratory of Materials Chemistry for Energy Conversion and Storage (Huazhong University of Science and Technology) of Ministry of Education, Hubei Key Laboratory of Material Chemistry and Service Failure, School of Chemistry and Chemical Engineering, Huazhong University of Science and Technology, Wuhan, 430074, P R China b College of Chemistry and Chemical Engineering, Jishou University, Jishou 416000, P R China College of Chemistry and Chemical Engineering Jishou University Jishou 416000 P R China bCollege of Chemistry and Chemical Engineering, Jishou University, Jishou 416000, P R China ⁎ Corresponding author. Carbon dioxide (CO2) transformation is a hot topic in both fundamental research and industrial application. Transition metal complexes of tunable and definite structure exhibit unique advantage in the study of CO2 reduction. Catalytic transformation of CO2 at metal complex catalyst is a multi-electron and multi-atom involved process. In this regard, the local chemical environment around the metal center (M) is critical to the catalytic activity. Intramolecularly inducing a supporting site/group into the metal complex catalyst enables to synergistically stabilize M-CO2 or M-COOH adducts with the metal center, which always lowers the energy barrier and/or alters transformation route. Some typical strategies had been applied to design such metal complex catalysts for photo- and/or electrocatalytic CO2 reduction. In this review, we are going to review such representative molecular catalysts (based on earth-abundant metals) that contain an intramolecular supporting site to assist the metal center for efficient photo- and/or electrocatalytic CO2 reduction. According to the structural and functional features of the catalysts, three types of catalyst containing an intramolecular supporting site are summarized. In the first type, one of metal atoms in binuclear complex acts as an intramolecular supporting site to synergistically work with another metal atom for catalytic CO2 reduction. In the second type, hydrogen bond (HD) donor group (such as amide or phenol groups) at secondary coordination sphere acts as an intramolecular supporting site to stabilize M-CO2 adduct via an intramolecular hydrogen bond. In the third type, cis-coordination atoms in several cis-cobalt-complexes function as an intramolecular supporting site in photocatalytic CO2 reduction. The structural characteristics, catalytic performances, and mechanisms of the typical examples in these three types are reviewed. Graphical abstract Image, graphical abstract Keywords CO2 reduction Molecular catalyst Intramolecular supporting site Synergistic effect Data availability No data was used for the research described in the article. Abbreviations BIH 1,3-dimethyl-2-phenylbenzimidazoline D electron donor DMC 1,8-dimethyl-1,4,8,11-tetraazacyclotetradecane DMF N, N-dimethylformamide GC glassy carbon HD hydrogen donor M metal center n. a. no data available NHE normal hydrogen electrode PET photoinduced electron transfer PS photosensitizer SUS stainless steel TEA triethylamine TEOA triethanolamine THF tetrahydrofuran TOF turnover frequency TON turnover number TPP tetraphenylporphyrin 1 Introduction Carbon dioxide (CO2) is an ideal feedstock for C1-chemical production. Utilization of CO2 in a green and sustainable way can resolve some of the environmental issues caused by CO2 emissions [1–10]. Since chemical inertness of carbon dioxide, the catalytic transformation of CO2 is a challenging task. In addition, CO2 can be reduced to various products (CO, HCOOH, CH3OH, CH4, etc.) via different catalytic pathways. In the most of cases, protons reduction (H2 production) is an accompanying competing reaction in CO2 reduction systems. Therefore, the development of CO2 reduction catalysts with high activity and selectivity is always a hot issue in both fundamental research and industrial practices [11–20]. Transition metal complexes of tunable and definite chemical structure have been extensively studied as CO2 reduction catalysts in photo- and/or electrocatalytic systems [1,6,11,21-25]. The findings helped chemists to fundamentally understand CO2 catalytic transformation at metal center. In this endeavor, numerous transition metals (FeII/III, CoII, NiII, MnII, ReI, RuII, IrIII, etc.) supported by various organic ligands, such as porphyrin, salen (N,N’-ethylenebis(salicylideneiminato), cyclam (1,4,8,11-tetraazacyclotetradecane), polypyridines and their derivatives, etc., have been synthesized and successfully applied in CO2 reduction systems [11–20]. Based on these model complexes, chemists understand more and deeper on CO2 catalytic transformation at metal centers. More and more efficient molecular CO2 reduction catalysts have been rationally designed and reported [1,6,11,26-28]. CO2 reduction by metal complex catalysts is realized by two different methods, photocatalysis and electrocatalysis. No matter which methods applied, the generation of active catalytic species, usually the reduced metal center of the catalyst, is the key step for the next catalysis (Scheme 1 ). The major difference between the photocatalysis and electrocatalysis is the way of the generation of reduced catalyst. Different from electrocatalysis that the catalyst direct obtaining electron from electrode, the catalyst in photocatalysis undergoes the first reduction via photoinduced electron transfer (PET) from the excited photosensitizer (PS*). In a typical homogeneous photocatalytic CO2 reduction system, at least three components, a photosensitizer (PS), a catalyst, and an electron donor, should be contained [14]. The homogeneous photocatalysis undergoes three steps. First, the PS is excited by visible light to generate excited electrons of high potential. A PET from PS* to the catalyst occurs in the next step. This is a one-electron transfer process, an oxidized PS+• and a reduced catalyst (this reduction mainly occurs at the metal center) M−• generate. Next, the PS+• recovers to PS via receiving an electron from the electron donor. Therefore, whether the redox potentials between catalyst, PS, and electron donor is matched is a key consideration in photocatalysis. The CO2 reduction by metal complex catalysts occurs at the metal center (M). The reduced metal center M (via an electrochemical or photochemical process discussed above) in the molecular catalyst exhibits nucleophilicity to activate and fixate neutral CO2 molecules (Scheme 1) [1,6,11]. The processes of CO2 reduction involve multi-bond cleavage and formation, and are more complicated than the competing proton reduction reaction (2H+→H2) [29–36]. In most cases, CO or formate, two-electron (2e−) reduction products, are the main products in homogeneous CO2 reduction systems. Typically, three activation modes are proposed [13]. The M at its low-valent state direct binds i) C atom, ii) O atom, or iii) break C=O bond of CO2, and forms two kinds of adduct, M-COO or M-OCO. The M-COO) or M-OCO adduct tends to produce CO or formate, respectively. In the most of reported homogeneous systems, CO is the most common reduction production in either photocatalysis or electrocatalysis. In this case, the M-COO adduct is protonated to form M-COOH species. The M-COOH reacts with another proton to release CO and H2O, and the catalyst finally recovers to its initial state. In this cycle, the nucleophilic metal center attacks the C atom in CO2 to form a M-CO2 adduct, which makes one of the oxygen atoms bind to CO2 basic (O−). It is better to stabilize this basic O atom by an acidic atom or site. In homogeneous systems, the metal center in another catalyst or an additional metal cation is proposed to act as a Lewis acid to support this basic O atom (Scheme 1) [16, 37]. Local chemical environment nearby catalytic center always plays a critical role on catalysis. This is well established in either natural enzymes or artificial synthetic catalysts [37–47]. For example, carbon monoxide dehydrogenase (CODH) ([MoCu]-CODH, [NiFe]-CODH) for reversible CO oxidation and hydrogenases ([FeFe]-hydrogenase and [NiFe]-hydrogenase) for reversible protons reduction bear a binuclear structure in their active centers [38–44]. The two metals synergistically work in catalysis. For example, CODH activate CO2 through a “push-pull’ mechanism between two metal atoms in CODH, where one metal center coordinates to CO2 at the carbon atom as a Lewis base, and another metal center binds to CO2 at the oxygen atom as a Lewis acid. The synergistic effect between two metal atoms boosts the catalytic activity of CODH. These are inspiration of synthetic binuclear catalysts. The metal atom activates and binds CO2 is referred to the catalytic center, while another metal atom in binuclear catalyst functions as an intramolecular assistant to stabilize M-COO* species, which is referred to an intramolecular supporting site. Recently, several excellent Reviews focusing on molecular catalysts containing particular metals or particular types of the molecular catalysts for catalytic CO2 reduction [11–18]. The catalysts structures, performances, and mechanisms, as well as development history are well-reviewed in these Reviews. However, there is still no a specific Review focusing on the molecular CO2 reduction catalysts those contain an intramolecular supporting site. This site plays positive role during CO2 catalytic transformation at metal center. Based on a survey of the studies on this topic in the past decade, we summarized three types of such molecular catalysts according to structural and functional features (Scheme 2 ). The first type is molecular binuclear catalyst. The second metal atom in such catalyst function as an intramolecular supporting site to synergistically work with the first metal atom for CO2 catalytic transformation. The second type is molecular catalyst containing H-bond donor groups at its secondary coordination sphere. These groups as an intramolecular supporting site stabilize M-CO2 or M-COOH adducts with the metal center during CO2 transformation. The third type is molecular metal complex of cis-coordination structure. The cis-atom as an intramolecular supporting site participates CO2 transformation at metal center. In this review, we pay attention to the molecular Co, Fe, Ni catalysts containing an intramolecular supporting site, the structural characteristics, catalytic performances, and mechanisms of these three typical models are reviewed and discussed. 2 Binuclear catalysts Early in the 1970s, C. Floriani et al. found alkali and alkaline earth metal cations, such as Na+, K+ and Li+, can act as a Lewis acid to enhance CO2 fixation and transformation at metal complexes [48–50]. They found molecular CO2 can be fixated by a bimetallic [Co(salen)M] (salen = N,N’-ethylenebis(salicylideneiminato) ligand, M = Na+, K+, Li+) complex. In 1978, they reported the definite structure of the [Co(salen)CO2M] adduct by revealing a X-ray single crystal obtained from the reaction of the [Co(pr-salen)K] (RC1) complex with CO2 in a THF solution [49]. The X-ray crystal structure of the [Co(pr-salen)K(CO2)2(THF)] adduct (RC1a, Scheme 3 ) shows that CO2 bonds as a bent molecule to cobalt through a Co-C σ bond, while the two oxygen atoms in CO2 are held by potassium ions; both metals, Co and K, participate to stabilize CO2 (Scheme 3). Interestingly, it was found that the binding of CO2 by the [Co(salen)Na] bimetallic complex was partially prevented in the presence of dicyclohexano-18-crown-6 in a THF solution, due to its high affinity for alkali cations. This finding indicates that the bimetallic [Co(salen)M] type complex works not only in the solid state but also in solution. In 1988, Fujita and coworkers reported a crystal structure of two Co-macrocycle complexes stabilizing a COOH moiety obtained from the reaction of CoIL (L = [14]diene) species (one-electron reduced RC11, Scheme 8) with CO2 in CH3CN or DMF solution [51]. The two cobalt atoms bind to the carbon and oxygen atoms of CO2 to form a Co-C(OH)-O-Co bridge between the two RC11 moieties (RC11a in Scheme 8). This structure shows the synergism of the two cobalt centers to fixate CO2; however, this was achieved by two separated cobalt complexes. Similar results were also confirmed by J.-M. Savéant et al. and T. Kojima et al. using different complexes [52–62]. Inspired by these pioneering studies, recently, molecular binuclear catalysts have been synthesized for CO2 reduction. By designing suitable ligands and regulating the distance between two metals, several classical models of binuclear cobalt, iron, and nickel complexes were reported by Lu, Robert, Naruta and other groups [26-28,51,63-68]. The two metal centers in binuclear catalysts function in tandem as a nucleophilic site to attack the C atom and an electrophilic site to bind the basic O atom of CO2. The two metals can be identical or different. These model complexes exhibited obvious enhancements to the CO2 reduction rate in comparison to its mononuclear analogue under photocatalytic conditions. In 2017, T.-B. Lu's group reported a novel binuclear cobalt complex, RC2, as a molecular catalyst for highly efficient photocatalytic CO2-to-CO conversion [26]. Two Co ions in RC2 are supported by a bi-N4 ligand, and one of the Co binds a -OH (Scheme 4 ). The RC2 is capable of fast absorption and fixation of CO2 within its cavity. This may account for the high selectivity (98%) of CO production even in an aqueous solution (Table 2). The photocatalytic system is composed of CO2-saturated CH3CN/H2O solution by using RC2 as a catalyst, [Ru(phen)3](PF6)2 as a PS (PS1, Scheme 6), and triethanolamine (TEOA) as a sacrificial electron donor. The system produced CO with a turnover number of 16896 and a selectivity of 98%. In contrast, the monomer RC3 system under the same conditions produced CO with a TON of only 1600 and a selectivity of 85%, which are far less than those of the binuclear system. Mechanism studies based on DFT calculations revealed that the two cobalts in RC2 work synergistically for CO2 transformation. As shown in Scheme 5 , RC2 first fixes a CO2 to form a carbonate-bridged complex [CoIICoII(CO3 2−)]2+ (RC2a). RC2a undergoes a PCET process to make [CoIICoI(CO3H−)]2+ (RC2b). Next, RC2b is protonated and loses a H2O to make [CoIICoI(CO2)]3+ (RC2c). RC2c undergoes an intramolecular two-electron reduction to give RC2d via a transition state TS1-1 in which two cobalts synergistically bind a CO2 moiety. After the second PCET process, RC2d is reduced to form [CoIICoII(COOH)]3+ (RC2e). Finally, two cobalt centers synergistically cleave the C-OH bond via a transition state TS2-1, namely, one Co binds to CO and another Co binds to OH. The as-generated [CoII(OH)CoII(CO)]3+ (RC2f) releases CO to regenerate RC2. The energy barriers of CO2 reduction and C-OH cleavage by RC2 are much lower than those by monomer RC3, demonstrating the advantage of two cobalt synergy. Lu et al. further synthesized a heterometallic binuclear complex RC4 (Scheme 4) by replacing one cobalt in RC2 with a zinc atom [27]. This [CoZn] catalyst, RC4, achieved a TON up to 65000 and TOF of 1.8 s−1 of CO production under the same photocatalytic conditions (Table 2). These were 4, 19, and 45-fold higher than the values of corresponding [CoCo] (RC2), [ZnZn] (RC5) and monomer RC3 complexes, respectively. DFT calculations demonstrated that the heterometallic RC4 has a much lower energy barrier for CO2 reduction and C-OH cleavage in comparison to RC2. Another heterometallic [CoZn] complex RC6 (Scheme 4) reported by Z. Chen et al in 2021 [69]. Two metal atoms of RC6 were coordinated with the ligand Hbpbp (2,6-Bis{[bis(2-pyridylmethyl)amino]methyl}-4-tert-butylphenol), in which two moieties are linked a phenolic hydroxyl group. At the optimal condition, TONCO and selectivity reached 6680 and 98%, respectively (Table 2). Photocatalytic experiments and DFT calculation indicated CO2 coordination is more likely to be the rate-limiting step instead of C-O cleavage. Synergistic effect between two heteronuclear also account for the robust photocatalytic efficiency. Robert and Lau et al. reported several CoII-polypyridine complexes as catalysts for photocatalytic CO2 reduction [28]. These cobalt complexes showed high activity and selectivity of CO production. For example, the CoII-quaterpyridine (RC8) achieved CO production of 2660 turnovers and 98% selectivity in a homogeneous CH3CN/TEOA solution containing Ru(bpy)3 2+ (PS1) as a PS and BIH (1,3-dimethyl-2-phenyl-2,3-dihydro-1H-benzo[d]imidazole) as a sacrificial electron donor (Table 2) [70]. Recently, they covalently linked two CoII-quaterpyridine moieties by a dimethylxanthene bridge to synthesize abinuclear cobalt complex RC7 for photocatalytic CO2 reduction (Scheme 4). Interestingly, the main reduction products, CO or formate, can be controlled. Formate with up to 97% selectivity and 821 turnovers can be obtained in a basic CH3CN solution (Table 2). In contrast, CO with 99% selectivity and 829 turnovers can be obtained in the system containing phenol (Table 2). This indicates there are two different catalytic pathways. As shown in Scheme 7 , both pathways begin with the same CO2 adduct RC7b consisting of CO2 sandwiched between two cobalt atoms. The two Co atoms synergistically bind C and the basic O atom of CO2. In acidic conditions, the O atom is stabilized by one Co, which is effectively protonated (RC7d) and subsequently cleaves the C-O bond to release CO as a product. In basic conditions, however, the isomerization adduct RC7e of the two O atoms binding to two Co atoms is protonated at the basic C atom to release formate. In 2022, D. E. Polyansky et al. introduced the parent complex of RC11 (Scheme 8 ) into a photocatalytic CO2 reduction system as photocatalyst [71]. Two RC11 molecules are bridged by a CO2 molecule to form the bimetallic intermediate (RC11b) confirmed by X-ray crystal structure, which is different from the structure proposed by Fujita et al [51]. In this photocatalytic system, the bimetallic pathway can lower energy barriers compared to the mononuclear pathway, resulting in the conversion of CO2-to-CO more feasible in kinetically. The result reveals the further process of RC11 for CO2 reduction through binuclear mechanism without pre-linked between two molecular catalysts. Y. Naruta et al. synthesized a series of binuclear Fe-complexes, RC12-RC19 (Scheme 9 ), based on the Fe-porphyrin monomer for electrocatalytic CO2 reduction [72–74]. They found that the distances between the Fe-Fe core and the substituents on the porphyrin rings significantly affected the catalytic activity. The model complex RC12 of two [FeTPP] (TPP = tetraphenylporphyrin and derivatives) moieties at the ortho-position demonstrated a high CO2-to-CO conversion activity in comparison to the RC18 complex of two [FeTPP] moieties at the meta-position and monomer [FeTPP]. In such binuclear structures, the synergy of two Fe atoms operates via a “Push-Pull” mechanism to stabilize and cleave CO2, namely, one Fe0 acts as a Lewis base to push an electron pair to the bound CO2 and another Fe atom acts as a Lewis acid to pull C-O bond cleavage to afford CO. The distance between the two metal centers is therefore an important parameter for synergistic catalysis. The distance between the two Fe atoms in RC12 was estimated in the range 3.4-4.0 Å, which is suitable to support the linear CO2 molecule of 2.32 Å length. However, the Fe-Fe distance of ca. 10.9 Å in RC18 is too large to synergistically stabilize the CO2 molecule. The overpotential η for CO2 reduction of these binuclear complexes can be tuned by inducing different substituents on the porphyrin ring; inducing electron-withdrawing groups leads to a lower η value. Very recently, a binuclear Fe-complex RC19 (Scheme 9) formed by linking two Fe-porphyrin using urea was immobilized onto carbon nanotubes for electrocatalytic CO2 reduction in an aqueous solution. The RC19 system gave an exceptional turnover frequency (10 s−1) and a high Faraday efficiency (90%) for CO production (Table 1 ), which are higher than those of TOF 2.7 s−1 and FE 35% obtained from the analogue monomer system, further demonstrating the advantage of the binuclear catalyst in heterogenous electrocatalysis. In 1988, J.-P. Collin et al. first reported a binuclear Ni-complex (RC20, Scheme 10 ) for electrocatalytic CO2 reduction [75]. RC20 is composed of two Ni(cyclam)2+ moieties linked by a rigid C-C bond. However, this binuclear complex did not show better performance on CO2 transformation in comparison to its monomer Ni(cyclam)2+ complex. K. Mochizuki reported another analogue binuclear Ni-cyclam complex RC21 of four methyl groups near linkage [76]. This complex exhibited high activity and selectivity of CO2 reduction in a photocatalytic system. The amount of CO production (1230 μL) from the RC21 system was significantly higher than that from the monomer system (195 μL). The author proposed that four axial methyl groups in RC21 prevent the axial coordination of water to the nickel atom, which improves the selectivity of CO2 reduction. However, the existing synergy between the two Ni atoms of RC21 for CO2 transformation was unexplored. Furthermore, T.-B. Lu et al. linked two Ni(cyclam)2+ moieties by a flexible diethylbenzene linkage to make RC22 and RC23 (Scheme 10) [77]. The RC22 of two Ni(cyclam)2+ in face-to-face position showed excellent activity for electrocatalytic reduction of CO2 to CO. A Faraday efficiency of 95% and TOF of 190 s−1 were achieved (Table 1), which were significantly higher than those of RC23 (FE = 25%, TOF = 4.2 s−1) and the monomer RC24 (FE = 62%, TOF = 5.0 s−1). In electrocatalysis (Scheme 11 ), the [NiIINiII] core of RC22 is reduced to NiINiI (RC22a) and subsequently binds with a CO2 to yield a [NiINiI(CO2)]2+ adduct (RC22b). The CO2 in RC22b undergoes intramolecular 2e− reduction to produce [NiIIINiI(COO2−)]2+ (RC22c) via a transition state (TS1-1), stabilizing COO between two Ni atoms using through-space interactions. RC22c is protonated and then cleaves the C-OH bond with the assistance of H3O+ to give [NiIINiII(CO)]4+ (RC22e). The CO is released from RC22e to regenerate RC22. The calculated energy barrier of the rate-determining step in the catalytic cycle of RC22 (8.6 kcal mol−1) is lower than that of the monomer RC24 (11.7 kcal mol−1) due to synergistic stabilizing of CO2 between two Ni atoms. Different from the “Push-Pull” mechanism between two metal atoms for CO2 reduction, the iron atom of RC25 can adjust the charge density of nickel atom to enhance the catalytic activity of CO2 reduction [78]. While, it is not the case for all binuclear metal complexes with synergistic effect between two metal atoms. Two cobalt centers in RC9 (Scheme 4)work independently, without synergistic effect.[79] Although the separation of two centers is 5.7651(2) Å, the flexible structure of RC9 makes two cobalt centers rotate arbitrarily, resulting in inappropriate positions and directions. Our group reported a photocatalytic system composing RC10 (Scheme 4) as a catalyst [80]. At the optimal experiment condition, the photocatalytic efficiency of RC10 was 721 turnover number based on molecular concentration. While the activity of RC10 and its mononuclear analogue present negligible difference. Because of the rigid structure of RC10, the separation of Co-Co (14.77 Å) is too large to produce synergistic effect for CO2 reduction. 3 H-bond donor group bearing catalysts The introduction of H-bond donor groups, such as amide and hydroxyl groups, in the second-coordination sphere is another strategy to position an intramolecular supporting site in a molecular catalyst [81–103]. Different from afore-mentioned strategies of using metal atoms as an intramolecular supporting site, in these kinds of catalysts, the H atom in H-bond donor groups prepositioned in the ligand synergistically stabilizes bound CO2 with a metal center by forming an intramolecular H-bond. [NiII(cyclam)]2+ complex RC34 (Scheme 12 ) is an active catalyst of CO2 reduction in both photo- and electrocatalytic systems [81,84,86]. The one-electron reduced [NiI(cyclam)]+ is the active species to bind CO2 and form a [Ni(cyclam)(CO2)]+ adduct. The amine protons in the cyclam ligand stabilize the CO2 adduct by forming a H-bond with an O atom of CO2, which was proposed by J.-P Sauvage et al. first and recently studied by C. P. Kubiak and S. Ye. Kubiak found that partial or complete substitution of four amine protons in [Ni(cyclam)]2+ with methyl groups (RC35, RC36) leads to a dramatic decrease or loss of the electrocatalytic activity of CO2 reduction [84,86]. DFT calculations revealed that [NiI(cyclam)]+ has a more favorable CO2 binding energy than [NiI(DMC)]+ (a one-electron reduced species of RC35, DMC = 1,8-Dimethyl-1,4,8,11-tetraazacyclotetradecane). The CO2 adduct of [NiI(TMC)]+ (a one-electron reduced species of RC36, TMC = 1,4,8,11-Tetramethyl-1,4,8,11-tetraazacyclotetradecane) cannot form. The trans I isomer of Ni(cyclam) gives more favorable CO2 binding energy than the trans III isomer (Scheme 12) due to more protons being available in the trans I isomer for H-bond formation. The same function of amine protons was also found in cobalt macrocycle complexes. E. Fujita investigated the CO2 adduct of cobalt macrocycle RC11 by FT-IR at different temperatures. They confirmed the existence of intramolecular hydrogen bonds between amine protons and nucleophilic O atoms of bound CO2 at the Co center in RC11 at low temperatures [71]. Recently, S. C. Marinescu et al. reported a cobalt macrocycle complex RC37 of a cyclic aminopyridine ligand electrocatalysis of CO2 to CO with high Faraday efficiency (Scheme 13 ) [88]. The chemical environment formed by pendant amines is important to the activity of RC37. By substituting protons in pendant amines with methyl or allyl groups, the electrocatalytic activity of CO2 reduction decreases by at least 2 orders of magnitude. A mechanism involving an intermediate of two amine protons synergistically stabilizing bound CO2 at cobalt center via a CoI-C bond and two O-H intramolecular H-bonds was proposed (Scheme 13). By introducing phenolic hydroxyl groups in an Fe(TPP) catalyst, J.-M. Savéant et al. found that this phenolic hydroxyl-functionalized RC38 exhibited higher activity and lower overpotential in CO2-to-CO electrocatalysis in comparison to Fe(TPP) and analogue methoxyphenyl functionalized RC39 (Scheme 14 ) [83,85,87,92,94]. The electrochemical reduced Fe0-species of RC38 is the active catalyst that binds CO2 and forms an [Fe0(CO2)] adduct. The phenol groups nearby the Fe atom in RC38 play roles of not only supporting the [Fe0(CO2)] adduct via an intramolecular H-bond between the H atom of phenol group and the O atom of bound CO2 but also improving the local proton concentration, which facilities the protonation step of [FeI(CO2 −)] to [FeI(COOH)]. C. J. Chang et al. further investigated the position effect of the H-donor group on the CO2 catalytic activity of an Fe(TPP) electrocatalyst. They incorporated an amide as a H-donor group into Fe(TPP) and precisely positioned it at various distances and orientations to the Fe atom (RC40-RC43, Scheme 14) [94]. Electrocatalysis studies revealed that the catalysts RC40 and RC41 with an amide located at the ortho-position of the porphyrin showed more activity for CO2 reduction; RC41, with a distally located amide group, was more effective for CO2 reduction than RC40 due to enhanced H-bond stabilization of the [Fe0(CO2)] adduct (RC41a). Recently, Z. Halime and A. Aukauloo reported two Fe(TPP) derivatives, RC44 and RC45, containing multi-NH-donor groups in the second coordination sphere (Scheme 14) [95]. In comparison to Fe(TPP), RC44 with four urea groups showed lower overpotential and higher activity for electrocatalytic CO2; however, no enhancement was observed by RC45 with four amide groups. Mechanistic studies revealed that the CO2 binding rate constant of RC44 is an order of magnitude higher than that of RC45 and Fe(TPP). DFT calculation results demonstrated that both RC44 and RC45 form intramolecular hydrogen bonds between NH and the bound CO2 in the Fe(CO2) intermediate. However, RC44 gives stronger N(H)-O hydrogen bonds with a shorter bond distance in the range of 2.738-2.832 Å (RC44a). This is comparable to those observed in the active site of CODH. 4 Cis-complex catalysts As discussed above, catalysts with a planer structure, such as Fe(TPP) and Ni(cyclam), bind CO2 at one of the trans-coordination positions. The H-bond donor groups located at the organic ligands function as an intramolecular supporting site to synergistically stabilize the M-CO2 adduct. Additionally, metal complex catalysts of cis-coordination geometry have been utilized in small organic molecule catalysis, where two cis-coordination sites participate to stabilize the substate molecule [104–106]. Recently, several cis-CoN4 type catalysts RC46-RC49 (Scheme15 ) exhibited high activity and selectivity of CO2-to-CO conversion in photocatalytic systems by using PS3 as a PS and triethylamine (TEA) as a sacrificial electron donor (Table 2 ) [107–110]. The halogen atoms (Cl or Br) at the cis-coordination site were proposed to play an important role in the course of CO2 transformation. Che et al. pointed out that the Cl atom at one of cis-coordination sites in RC46 acts as an intramolecular supporting site [104]. According to the mechanism based on DFT calculations (Scheme 15), the one-electron reduced [CoILCl] (RC46b) as the active species binds CO2 to form [CoI(CO2)LCl] (RC46c). The protonation process from RC46c to RC46d ([Co(COOH)LCl]+) is exothermic (−2.9 kcal mol−1). However, this process is endothermic (+24.1 kcal mol−1) in the absence of a neighboring cis-Cl atom (Scheme 16 ). A favorable hydrogen bond between cis-Cl and H in COOH in RC46d is proposed. Further utilization of RC47 and RC48 (Scheme 17 ) with the same main structure and different cis-coordination atoms (Cl or Br) as catalysts showed different CO production rates at the same photocatalytic conditions, indicating the participation of cis-halogen atoms in the CO2 catalytic transformation [106]. By introduction of an oxygen atom at cis-coordination sites, our group synthesized another cis-CoN4 type catalyst RC49 (Scheme 17) [105]. This catalyst catalyzed CO2 to not only CO but also formate in a photocatalytic system. The presence of water in the system was able to improve formate selectivity. DFT calculations (Scheme 18 ) revealed that the protonated cis-oxygen functions as an intramolecular supporting site to synergistically work with the cobalt center by relaying a proton to [Co(COOH)] to facilitate C-O bond cleavage in CO production (Scheme 18) or delivering a proton to oxygen in [Co(HCOO−)] and finally releasing formic acid. 5 Outlook Catalytic transformation of CO2 at metal center is highly affected by the local chemical environment nearby the metal center. Recently, the importance of the local chemical environment was also confirmed by several nanosemiconductor-based photocatalytic CO2 reduction systems [111–116]. The interfacial chemical environment of II-VI semiconductor quantum dots (QDs) were tuned via ligand modification or self-assembling, the activity and selectivity of CO2 photoreduction by these QD photocatalysts had been obviously improved. Based on this understanding, chemists tried to design and tune the local chemical environment at the metal center and thus pursue higher activity of CO2 reduction by metal complex catalysts. The success on catalysts/systems design and the resulted CO2 reduction enhancement demonstrates the importance of the local chemical environment of the metal center for CO2 reduction. At a molecular point view, inducing an intramolecular site or group as a functional site is one of promising strategies. In the past decade, three types of CO2 reduction molecular catalysts, binuclear catalysts, catalysts containing functional groups at the second coordination sphere, and catalyst of cis-coordination geometry, had been developed for CO2 photo- and/or electrocatalysis. One of common feature of these catalysts is that they have an intramolecular an intramolecular supporting site nearby the metal center, which facilitates CO2 transformation. Although successes on improving CO2 reduction rate/efficiency by these catalysts have been witnessed, challenges still exist. For the binuclear type catalysts, the appropriate distance between two metal atoms is critical to the synergic catalysis between two metals. This needs rational ligand design. Furthermore, binuclear catalyst is the most promising molecular catalysts to realize multi-carbon reduction products, such as ethylene and ethane, generation. For the last two types of catalysts, catalysts containing H-donor group and cis-catalysts, what they both have in common is the presence of a functional group/atom near the metal center. Chemists should consider to explore more types of functional group/atom, and locates them at suitable positions of the ligand. Employing intramolecular interaction between the functional group/atom and M-CO2 adduct, deep reduction products, such as methanol and methane, is expected to realize by homogeneous molecular system. Additionally, more strategies to alter local chemical environment of more efficient CO2 reduction catalysts/systems are encouraged to explore. The relationship between the local chemical environment and catalytic performances are encouraged to clarified not only via calculations but also based on experimental results. Declaration of Competing Interest The authors declare that they have no known competing financial interests or personal relationships that could have appeared to influence the work reported in this paper. Acknowledgment We are grateful for financial support from the National Natural Science Foundation of China (21871102, 22171096). References [1] A.M. Appel J.E. Bercaw A.B. Bocarsly H. Dobbek D.L. DuBois M. Dupuis J.G. Ferry E. Fujita R. Hille P.J. Kenis C.A. Kerfeld R.H. Morris C.H. Peden A.R. Portis S.W. Ragsdale T.B. Rauchfuss J.N. Reek L.C. Seefeldt R.K. Thauer G.L. Waldrop Chem. Rev. 113 2013 6621 6658 A. M. Appel, J. E. Bercaw, A. B. Bocarsly, H. Dobbek, D. L. DuBois, M. Dupuis, J. G. Ferry, E. Fujita, R. Hille, P. J. Kenis, C. A. Kerfeld, R. H. Morris, C. H. Peden, A. R. Portis, S. W. Ragsdale, T. B. Rauchfuss, J. N. Reek, L. C. Seefeldt, R. K. Thauer and G. L. Waldrop, Chem. Rev., 2013, 113, 6621-6658. [2] D.G. Nocera Acc. Chem. Res. 50 2017 616 619 D. G. Nocera, Acc. Chem. Res., 2017, 50, 616-619. [3] N. Yan K. Zhou Y.W. Tong D.T. Leong M.P. Dickieson Nat. Sustain. 5 2022 907 909 N. Yan, K. Zhou, Y. W. Tong, D. T. Leong, M. P. Dickieson, Nat. Sustain. 2022, 5, 907-909. [4] K. Elouarzaki V. Kannan V. Jose H.S. Sabharwal J.-M. Lee Adv. Energy Mater. 9 2019 1900090 K. Elouarzaki, V. Kannan, V. Jose, H. S. Sabharwal and J.-M. Lee, Adv. Energy Mater., 2019, 9, 1900090. [5] K.A. Grice Coord. Chem. Rev. 336 2017 78 95 K. A. Grice, Coord. Chem. Rev., 2017, 336, 78-95. [6] S. Berardi S. Drouet L. Francas C. Gimbert-Surinach M. Guttentag C. Richmond T. Stoll A. Llobet Chem. Soc. Rev. 43 2014 7501 7519 S. Berardi, S. Drouet, L. Francas, C. Gimbert-Surinach, M. Guttentag, C. Richmond, T. Stoll and A. Llobet, Chem. Soc. Rev., 2014, 43, 7501-7519. [7] B. Zhang L. Sun Chem. Soc. Rev. 48 2019 2216 2264 B. Zhang and L. Sun, Chem. Soc. Rev., 2019, 48, 2216-2264. [8] P. De Luna C. Hahn D. Higgins S.A. Jaffer T.F. Jaramillo E.H. Sargent Science 2019 364 P. De Luna, C. Hahn, D. Higgins, S. A. Jaffer, T. F. Jaramillo and E. H. Sargent, Science, 2019, 364. [9] O.S. Bushuyev P. De Luna C.T. Dinh L. Tao G. Saur J. van de Lagemaat S.O. Kelley E.H. Sargent Joule 2 2018 825 832 O. S. Bushuyev, P. De Luna, C. T. Dinh, L. Tao, G. Saur, J. van de Lagemaat, S. O. Kelley and E. H. Sargent, Joule, 2018, 2, 825-832. [10] D.U. Nielsen X.-M. Hu K. Daasbjerg T. Skrydstrup Nat. Catal. 1 2018 244 254 D. U. Nielsen, X.-M. Hu, K. Daasbjerg and T. Skrydstrup, Nat. Catal., 2018, 1, 244-254. [11] H. Takeda C. Cometto O. Ishitani M. Robert ACS Catal., 7 2017 70 88 H. Takeda, C. Cometto, O. Ishitani and M. Robert, ACS Catal., 2017, 7, 70-88. [12] J.-W. Wang W.-J. Liu D.-C. Zhong T.-B. Lu Coord. Chem. Rev. 378 2019 237 261 J.-W. Wang, W.-J. Liu, D.-C. Zhong and T.-B. Lu, Coord. Chem. Rev., 2019, 378, 237-261. [13] C. Jiang A.W. Nichols C.W. Machan Dalton Trans. 48 2019 9454 9468 C. Jiang, A. W. Nichols and C. W. Machan, Dalton Trans., 2019, 48, 9454-9468. [14] J. Liu Y.-Y. Ren J. Wu W. Xia B.-Y. Deng F. Wang J. Mater. Chem. A 9 2021 19346 19368 J. Liu, Y.-Y. Ren, J. Wu, W. Xia, B.-Y. Deng, F. Wang, J. Mater. Chem. A, 2021, 9, 19346-19368. [15] K.E. Dalle J. Warnan J.J. Leung B. Reuillard I.S. Karmel E. Reisner Chem. Rev. 119 2019 2752 2875 K. E. Dalle, J. Warnan, J. J. Leung, B. Reuillard, I. S. Karmel and E. Reisner, Chem. Rev., 2019, 119, 2752-2875. [16] J.-W. Wang D.-C. Zhong T.-B. Lu Coord. Chem. Rev. 377 2018 225 236 J.-W. Wang, D.-C. Zhong and T.-B. Lu, Coord. Chem. Rev., 2018, 377, 225-236. [17] J. Bonin A. Maurin M. Robert Coord. Chem. Rev. 334 2017 184 198 J. Bonin, A. Maurin and M. Robert, Coord. Chem. Rev., 2017, 334, 184-198. [18] F. Wang ChemSusChem, 10 2017 4393 4402 F. Wang, ChemSusChem, 2017, 10, 4393-4402. [19] J.-C. Hu M.-X. Gui W. Xia J. Wu Y.-N. Zhou N. Feng J. Xiao H. Liu C.-H. Tung L.-Z. Wu F. Wang J. Mater. Chem. A 7 2019 10475 10482 J.-C. Hu, M.-X. Gui, W. Xia, J. Wu, Y.-N. Zhou, N. Feng, J. Xiao, H. Liu, C.-H. Tung, L.-Z. Wu and F. Wang, J. Mater. Chem. A, 2019, 7, 10475-10482. [20] N. Elgrishi M.B. Chambers X. Wang M. Fontecave Chem. Soc. Rev. 46 2017 761 796 N. Elgrishi, M. B. Chambers, X. Wang and M. Fontecave, Chem. Soc. Rev., 2017, 46, 761-796. [21] M. Khalil J. Gunlazuardi T.A. Ivandini A. Umar Renew. Sust. Energ. Rev. 113 2019 109246 M. Khalil, J. Gunlazuardi, T. A. Ivandini and A. Umar, Renew. Sust. Energ. Rev., 2019, 113, 109246. [22] S. Fukuzumi Y.M. Lee H.S. Ahn W. Nam Chem. Sci. 9 2018 6017 6034 S. Fukuzumi, Y. M. Lee, H. S. Ahn and W. Nam, Chem. Sci., 2018, 9, 6017-6034. [23] P. Gotico Z. Halime A. Aukauloo Dalton Trans. 49 2020 2381 2396 P. Gotico, Z. Halime and A. Aukauloo, Dalton Trans., 2020, 49, 2381-2396. [24] D.C. Grills M.Z. Ertem M. McKinnon K.T. Ngo J. Rochford Coord. Chem. Rev. 374 2018 173 217 D. C. Grills, M. Z. Ertem, M. McKinnon, K. T. Ngo and J. Rochford, Coord. Chem. Rev., 2018, 374, 173-217. [25] R. Francke B. Schille M. Roemelt Chem. Rev. 118 2018 4631 4701 R. Francke, B. Schille and M. Roemelt, Chem. Rev., 2018, 118, 4631-4701. [26] T. Ouyang H.-H. Huang J.-W. Wang D.-C. Zhong T.-B. Lu Angew. Chem. Int. Ed. 56 2017 738 743 T. Ouyang, H.-H. Huang, J.-W. Wang, D.-C. Zhong and T.-B. Lu, Angew. Chem. Int. Ed., 2017, 56, 738-743. [27] T. Ouyang H.-J. Wang H.-H. Huang J.-W. Wang S. Guo W.-J. Liu D.-C. Zhong T.-B. Lu Angew. Chem. Int. Ed. 57 2018 16480 16485 T. Ouyang, H.-J. Wang, H.-H. Huang, J.-W. Wang, S. Guo, W.-J. Liu, D.-C. Zhong and T.-B. Lu, Angew. Chem. Int. Ed., 2018, 57, 16480-16485. [28] Z. Guo G. Chen C. Cometto B. Ma H. Zhao T. Groizard L. Chen H. Fan W.-L. Man S.-M. Yiu K.-C. Lau T.-C. Lau M. Robert Nat. Catal. 2 2019 801 808 Z. Guo, G. Chen, C. Cometto, B. Ma, H. Zhao, T. Groizard, L. Chen, H. Fan, W.-L. Man, S.-M. Yiu, K.-C. Lau, T.-C. Lau and M. Robert, Nat. Catal., 2019, 2, 801-808. [29] M.L. Helm M.P. Stewart R.M. Bullock M.R. DuBois D.L. DuBois Science 333 2011 863 866 M. L. Helm, M. P. Stewart, R. M. Bullock, M. R. DuBois and D. L. DuBois, Science, 2011, 333, 863-866. [30] F. Wang W.-G. Wang H.-Y. Wang G. Si C.-H. Tung L.-Z. Wu ACS Catal 2 2012 407 416 F. Wang, W.-G. Wang, H.-Y. Wang, G. Si, C.-H. Tung and L.-Z. Wu, ACS Catal., 2012, 2, 407-416. [31] D. Zheng N. Wang M. Wang S. Ding C. Ma M.Y. Darensbourg M.B. Hall L. Sun J. Am. Chem. Soc. 136 2014 16817 16823 D. Zheng, N. Wang, M. Wang, S. Ding, C. Ma, M. Y. Darensbourg, M. B. Hall and L. Sun, J. Am. Chem. Soc., 2014, 136, 16817-16823. [32] N. Kaeffer M. Chavarot-Kerlidou V. Artero Acc. Chem. Res. 48 2015 1286 1295 N. Kaeffer, M. Chavarot-Kerlidou and V. Artero, Acc. Chem. Res., 2015, 48, 1286-1295. [33] N. Queyriaux R.T. Jane J. Massin V. Artero M. Chavarot-Kerlidou Coord. Chem. Rev. 304-305 2015 3 19 N. Queyriaux, R. T. Jane, J. Massin, V. Artero and M. Chavarot-Kerlidou, Coord. Chem. Rev., 2015, 304-305, 3-19. [34] W. Ai R. Zhong X. Liu Q. Liu Chem. Rev. 119 2019 2876 2953 W. Ai, R. Zhong, X. Liu and Q. Liu, Chem. Rev., 2019, 119, 2876-2953. [35] J.C. Hu S. Sun M.D. Li W. Xia J. Wu H. Liu F. Wang Chem. Commun. 55 2019 14490 14493 J. C. Hu, S. Sun, M. D. Li, W. Xia, J. Wu, H. Liu and F. Wang, Chem. Commun., 2019, 55, 14490-14493. [36] L. Kohler J. Niklas R.C. Johnson M. Zeller O.G. Poluektov K.L. Mulfort Inorg. Chem. 58 2019 1697 1709 L. Kohler, J. Niklas, R. C. Johnson, M. Zeller, O. G. Poluektov and K. L. Mulfort, Inorg. Chem., 2019, 58, 1697-1709. [37] A.W. Nichols C.W. Machan Front. Chem. 7 2019 397 A. W. Nichols and C. W. Machan, Front. Chem., 2019, 7, 397. [38] S.A. Ensign Biochemistry 34 1995 5372 5378 S. A. Ensign, Biochemistry, 1995, 34, 5372-5378. [39] M. Frey ChemBioChem 3 2002 153 160 M. Frey, ChemBioChem, 2002, 3, 153-160. [40] J.-H. Jeoung H. Dobbek Science 318 2007 1461 1464 J.-H. Jeoung and H. Dobbek, Science, 2007, 318, 1461-1464. [41] H.A. Hansen J.B. Varley A.A. Peterson J.K. Nørskov J. Phys. Chem. Lett. 4 2013 388 392 H. A. Hansen, J. B. Varley, A. A. Peterson and J. K. Nørskov, J. Phys. Chem. Lett., 2013, 4, 388-392. [42] W. Lubitz H. Ogata O. Rudiger E. Reijerse Chem. Rev. 114 2014 4081 4148 W. Lubitz, H. Ogata, O. Rudiger and E. Reijerse, Chem. Rev., 2014, 114, 4081-4148. [43] R. Hille S. Dingwall J. Wilcoxen J. Biol. Inorg. Chem. 20 2015 243 251 R. Hille, S. Dingwall and J. Wilcoxen, J. Biol. Inorg. Chem., 2015, 20, 243-251. [44] S.S. Reginald Y.S. Lee H. Lee N. Jang I.S. Chang Electroanalysis 31 2019 1635 1640 S. S. Reginald, Y. S. Lee, H. Lee, N. Jang and I. S. Chang, Electroanalysis, 2019, 31, 1635-1640. [45] D.J. Vinyard S.L. Badshah M.R. Riggio D. Kaur A.R. Fanguy M.R. Gunner Proc. Natl. Acad. Sci. U. S. A. 116 2019 18917 18922 D. J. Vinyard, S. L. Badshah, M. R. Riggio, D. Kaur, A. R. Fanguy and M. R. Gunner, Proc. Natl. Acad. Sci. U. S. A., 2019, 116, 18917-18922. [46] L. Alonso-Cotchico J. Rodri Guez-Guerra A. Lledos J.D. Marechal Acc. Chem. Res. 53 2020 896 905 L. Alonso-Cotchico, J. Rodri Guez-Guerra, A. Lledos and J. D. Marechal, Acc. Chem. Res., 2020, 53, 896-905. [47] L.C. Seefeldt Z.Y. Yang D.A. Lukoyanov D.F. Harris D.R. Dean S. Raugei B.M. Hoffman Chem. Rev. 120 2020 5082 5106 L. C. Seefeldt, Z. Y. Yang, D. A. Lukoyanov, D. F. Harris, D. R. Dean, S. Raugei and B. M. Hoffman, Chem. Rev., 2020, 120, 5082-5106. [48] C. Floriani G. Fachinetti J. Chem. Soc., Chem. Commun. 1974 615 616 C. Floriani and G. Fachinetti, J. Chem. Soc., Chem. Commun., 1974, 615-616. [49] G. Fachinetti C. Floriani P.F. Zanazzi J. Am. Chem. Soc. 100 1978 7405 7407 G. Fachinetti, C. Floriani and P. F. Zanazzi, J. Am. Chem. Soc., 1978, 100, 7405-7407. [50] G. Fachinetti C. Floriani P.F. Zanazzi A.R. Zanzari Inorg. Chem. 18 1979 3469 3475 G. Fachinetti, C. Floriani, P. F. Zanazzi and A. R. Zanzari, Inorg. Chem., 1979, 18, 3469-3475. [51] E. Fujita D.J. Szalda C. Creutz N. Sutin J. Am. Chem. Soc. 110 1988 4870 4871 E. Fujita, D. J. Szalda, C. Creutz and N. Sutin, J. Am. Chem. Soc., 1988, 110, 4870-4871. [52] S. Gambarotta F. Arena C. Floriani P.F. Zanazzi J. Am. Chem. Soc. 104 1982 5082 5092 S. Gambarotta, F. Arena, C. Floriani and P. F. Zanazzi, J. Am. Chem. Soc., 1982, 104, 5082-5092. [53] Z.H. Kafafi R.H. Hauge W.E. Billups J.L. Margrave Inorg. Chem. 23 1984 177 183 Z. H. Kafafi, R. H. Hauge, W. E. Billups and J. L. Margrave, Inorg. Chem., 1984, 23, 177-183. [54] D.J. Pearce D. Pletcher J. Electroanal. Chem. Inter. Electrochem. 197 1986 317 330 D. J. Pearce and D. Pletcher, J. Electroanal. Chem. Inter. Electrochem., 1986, 197, 317-330. [55] M.H. Schmidt G.M. Miskelly N.S. Lewis J. Am. Chem. Soc. 12 1990 3420 3426 M. H. Schmidt, G. M. Miskelly and N. S. Lewis, J. Am. Chem. Soc., 1990, 12, 3420-3426. [56] M. Hammouche D. Lexa M. Momenteau J.-M. Savéant J. Am. Chem. Soc. 113 1991 8455 8466 M. Hammouche, D. Lexa, M. Momenteau and J.-M. Savéant, J. Am. Chem. Soc., 1991, 113, 8455-8466. [57] A.A. Isse A. Gennaro E. Vianello C. Floriani J. Mol. Catal. 70 1991 197 208 A. A. Isse, A. Gennaro, E. Vianello and C. Floriani, J. Mol. Catal., 1991, 70, 197-208. [58] I. Bhugun D. Lexa J.-M. Savéant J. Phys. Chem. 100 1996 19981 19985 I. Bhugun, D. Lexa and J.-M. Savéant, J. Phys. Chem., 1996, 100, 19981-19985. [59] M.D. Sampson C.P. Kubiak J. Am. Chem. Soc. 138 2016 1386 1393 M. D. Sampson and C. P. Kubiak, J. Am. Chem. Soc., 2016, 138, 1386-1393. [60] A. Zhanaidarova H. Steger M.H. Reineke C.P. Kubiak Dalton Trans., 46 2017 12413 12416 A. Zhanaidarova, H. Steger, M. H. Reineke and C. P. Kubiak, Dalton Trans., 2017, 46, 12413-12416. [61] S. Sato K. Saita K. Sekizawa S. Maeda T. Morikawa ACS Catal 8 2018 4452 4458 S. Sato, K. Saita, K. Sekizawa, S. Maeda and T. Morikawa, ACS Catal., 2018, 8, 4452-4458. [62] D. Hong T. Kawanishi Y. Tsukakoshi H. Kotani T. Ishizuka T. Kojima J. Am. Chem. Soc. 141 2019 20309 20317 D. Hong, T. Kawanishi, Y. Tsukakoshi, H. Kotani, T. Ishizuka and T. Kojima, J. Am. Chem. Soc., 2019, 141, 20309-20317. [63] D.R. Pye N.P. Mankad Chem. Sci. 8 2017 1705 1718 D. R. Pye and N. P. Mankad, Chem. Sci., 2017, 8, 1705-1718. [64] Q.-Q. Bi J.-W. Wang J.-X. Lv J. Wang W. Zhang T.-B. Lu ACS Catal 8 2018 11815 11821 Q.-Q. Bi, J.-W. Wang, J.-X. Lv, J. Wang, W. Zhang and T.-B. Lu, ACS Catal., 2018, 8, 11815-11821. [65] D.C. Fabry H. Koizumi D. Ghosh Y. Yamazaki H. Takeda Y. Tamaki O. Ishitani Organometallics 39 2020 1511 1518 D. C. Fabry, H. Koizumi, D. Ghosh, Y. Yamazaki, H. Takeda, Y. Tamaki and O. Ishitani, Organometallics, 2020, 39, 1511-1518. [66] N.Y. Huang H. He H. Li P.Q. Liao X.M. Chen Chem. Commun. 56 2020 6700 6703 N. Y. Huang, H. He, H. Li, P. Q. Liao and X. M. Chen, Chem. Commun., 2020, 56, 6700-6703. [67] S.G. Makarov S.Y. Ketkov D. Wöhrle Chem. Commun. 56 2020 5653 5656 S. G. Makarov, S. Y. Ketkov and D. Wöhrle, Chem. Commun., 2020, 56, 5653-5656. [68] M. Abdinejad C. Dao B. Deng M.E. Sweeney F. Dielmann X.A. Zhang H.B. Kraatz ChemistrySelect, 5 2020 979 984 M. Abdinejad, C. Dao, B. Deng, M. E. Sweeney, F. Dielmann, X. A. Zhang and H. B. Kraatz, ChemistrySelect, 2020, 5, 979-984. [69] D. Liu M. Zhang H.-H. Huang Q. Feng C. Su A. Mo J.-W. Wang Z. Qi X. Zhang L. Jiang Z. Chen ACS Sustain. Chem. Eng. 9 2021 9273 9281 D. Liu, M. Zhang, H.-H. Huang, Q. Feng, C. Su, A. Mo, J.-W. Wang, Z. Qi, X. Zhang, L. Jiang and Z. Chen, ACS Sustain. Chem. Eng., 2021, 9, 9273-9281. [70] Z. Guo S. Cheng C. Cometto E. Anxolabéhère-Mallart S.-M. Ng C.-C. Ko G. Liu L. Chen M. Robert T.-C. Lau J. Am. Chem. Soc. 138 2016 9413 9416 Z. Guo, S. Cheng, C. Cometto, E. Anxolabéhère-Mallart, S.-M. Ng, C.-C. Ko, G. Liu, L. Chen, M. Robert and T.-C. Lau, J. Am. Chem. Soc., 2016, 138, 9413-9416. [71] D.E. Polyansky D.C. Grills M.Z. Ertem K.T. Ngo E. Fujita ACS Catal 12 2022 1706 1717 D. E. Polyansky, D. C. Grills, M. Z. Ertem, K. T. Ngo and E. Fujita, ACS Catal., 2022, 12, 1706-1717. [72] E.A. Mohamed Z.N. Zahran Y. Naruta Chem. Commun. 51 2015 16900 16903 E. A. Mohamed, Z. N. Zahran and Y. Naruta, Chem. Commun., 2015, 51, 16900-16903. [73] Z.N. Zahran E.A. Mohamed Y. Naruta Sci. Rep. 6 2016 24533 Z. N. Zahran, E. A. Mohamed and Y. Naruta, Sci. Rep., 2016, 6, 24533. [74] E.A. Mohamed Z.N. Zahran Y. Naruta Chem. Mater. 29 2017 7140 7150 E. A. Mohamed, Z. N. Zahran and Y. Naruta, Chem. Mater., 2017, 29, 7140-7150. [75] J.P. Collin A. Jouaiti J.-P. Sauvage Inorg. Chem. 27 1988 1986 1990 J. P. Collin, A. Jouaiti and J.-P. Sauvage, Inorg. Chem., 1988, 27, 1986-1990. [76] K. Mochizuki S. Manaka I. Takeda T. Kondo Inorg. Chem. 35 1996 5132 5136 K. Mochizuki, S. Manaka, I. Takeda and T. Kondo, Inorg. Chem., 1996, 35, 5132-5136. [77] L.-M. Cao H.-H. Huang J.-W. Wang D.-C. Zhong T.-B. Lu Green Chem 20 2018 798 803 L.-M. Cao, H.-H. Huang, J.-W. Wang, D.-C. Zhong and T.-B. Lu, Green Chem., 2018, 20, 798-803. [78] J.R. Prat C.A. Gaggioli R.C. Cammarota E. Bill L. Gagliardi C.C. Lu Inorg. Chem. 59 2020 14251 14262 J. R. Prat, C. A. Gaggioli, R. C. Cammarota, E. Bill, L. Gagliardi and C. C. Lu, Inorg. Chem., 2020, 59, 14251-14262. [79] L. Zhang S. Li H. Liu Y.S. Cheng X.W. Wei X. Chai G. Yuan Inorg. Chem. 59 2020 17464 17472 L. Zhang, S. Li, H. Liu, Y. S. Cheng, X. W. Wei, X. Chai and G. Yuan, Inorg. Chem., 2020, 59, 17464-17472. [80] W. Xia Y.-Y. Ren J. Liu B.-Y. Deng F. Wang J. Photochem. Photobio. A Chem. 2022 426 W. Xia, Y.-Y. Ren, J. Liu, B.-Y. Deng and F. Wang, J. Photochem. Photobio. A Chem., 2022, 426. [81] M. Beley J.P. Collin R. Ruppert J.-P. Sauvage J. Am. Chem. Soc. 108 1986 7461 7467 M. Beley, J. P. Collin, R. Ruppert and J.-P. Sauvage, J. Am. Chem. Soc., 1986, 108, 7461-7467. [82] E. Fujita C. Creutz N. Sutin B.S. Brunschwig Inorg. Chem. 32 1993 2657 2662 E. Fujita, C. Creutz, N. Sutin and B. S. Brunschwig, Inorg. Chem., 1993, 32, 2657-2662. [83] C. Costentin S. Drouet M. Robert J.-M. Savéant Science 338 2012 90 94 C. Costentin, S. Drouet, M. Robert and J.-M. Savéant, Science, 2012, 338, 90-94. [84] J.D. Froehlich C.P. Kubiak Inorg. Chem. 51 2012 3932 3934 J. D. Froehlich and C. P. Kubiak, Inorg. Chem., 2012, 51, 3932-3934. [85] C. Costentin G. Passard M. Robert J.M. Saveant J. Am. Chem. Soc. 136 2014 11821 11829 C. Costentin, G. Passard, M. Robert and J. M. Saveant, J. Am. Chem. Soc., 2014, 136, 11821-11829. [86] J. Song E.L. Klein F. Neese S. Ye Inorg. Chem. 53 2014 7500 7507 J. Song, E. L. Klein, F. Neese and S. Ye, Inorg. Chem., 2014, 53, 7500-7507. [87] C. Costentin M. Robert J.M. Saveant A. Tatin Proc. Natl. Acad. Sci. U. S. A. 112 2015 6882 6886 C. Costentin, M. Robert, J. M. Saveant and A. Tatin, Proc. Natl. Acad. Sci. U. S. A., 2015, 112, 6882-6886. [88] A. Chapovetsky T.H. Do R. Haiges M.K. Takase S.C. Marinescu J. Am. Chem. Soc. 138 2016 5765 5768 A. Chapovetsky, T. H. Do, R. Haiges, M. K. Takase and S. C. Marinescu, J. Am. Chem. Soc., 2016, 138, 5765-5768. [89] S. Roy B. Sharma J. Pecaut P. Simon M. Fontecave P.D. Tran E. Derat V. Artero J. Am. Chem. Soc. 139 2017 3685 3696 S. Roy, B. Sharma, J. Pecaut, P. Simon, M. Fontecave, P. D. Tran, E. Derat and V. Artero, J. Am. Chem. Soc., 2017, 139, 3685-3696. [90] A. Chapovetsky M. Welborn J.M. Luna R. Haiges T.F. Miller 3rd S.C. Marinescu ACS Central Sci 4 2018 397 404 A. Chapovetsky, M. Welborn, J. M. Luna, R. Haiges, T. F. Miller, 3rd and S. C. Marinescu, ACS Central Sci., 2018, 4, 397-404. [91] E. Haviv D. Azaiza-Dabbah R. Carmieli L. Avram J.M.L. Martin R. Neumann J. Am. Chem. Soc. 140 2018 12451 12456 E. Haviv, D. Azaiza-Dabbah, R. Carmieli, L. Avram, J. M. L. Martin and R. Neumann, J. Am. Chem. Soc., 2018, 140, 12451-12456. [92] C.G. Margarit C. Schnedermann N.G. Asimow D.G. Nocera Organometallics 38 2018 1219 1223 C. G. Margarit, C. Schnedermann, N. G. Asimow and D. G. Nocera, Organometallics, 2018, 38, 1219-1223. [93] E.M. Nichols C.J. Chang Organometallics 38 2018 1213 1218 E. M. Nichols and C. J. Chang, Organometallics, 2018, 38, 1213-1218. [94] E.M. Nichols J.S. Derrick S.K. Nistanaki P.T. Smith C.J. Chang Chem. Sci. 9 2018 2952 2960 E. M. Nichols, J. S. Derrick, S. K. Nistanaki, P. T. Smith and C. J. Chang, Chem. Sci., 2018, 9, 2952-2960. [95] P. Gotico B. Boitrel R. Guillot M. Sircoglou A. Quaranta Z. Halime W. Leibl A. Aukauloo Angew. Chem. Int. Ed. 58 2019 4504 4509 P. Gotico, B. Boitrel, R. Guillot, M. Sircoglou, A. Quaranta, Z. Halime, W. Leibl and A. Aukauloo, Angew. Chem. Int. Ed., 2019, 58, 4504-4509. [96] Y. Guo W. Shi H. Yang Q. He Z. Zeng J.Y. Ye X. He R. Huang C. Wang W. Lin J. Am. Chem. Soc. 141 2019 17875 17883 Y. Guo, W. Shi, H. Yang, Q. He, Z. Zeng, J. Y. Ye, X. He, R. Huang, C. Wang and W. Lin, J. Am. Chem. Soc., 2019, 141, 17875-17883. [97] Q. Liao T. Liu S.I. Johnson C.M. Klug E.S. Wiedner R.Morris Bullock D.L. DuBois Dalton Trans 48 2019 4867 4878 Q. Liao, T. Liu, S. I. Johnson, C. M. Klug, E. S. Wiedner, R. Morris Bullock and D. L. DuBois, Dalton Trans., 2019, 48, 4867-4878. [98] Y. Matsubara ACS Energy Lett. 4 2019 1999 2004 Y. Matsubara, ACS Energy Lett., 2019, 4, 1999-2004. [99] A.P. Walsh J.A. Laureanti S. Katipamula G.M. Chambers N. Priyadarshani S. Lense J.T. Bays J.C. Linehan W.J. Shaw Faraday Discuss 215 2019 123 140 A. P. Walsh, J. A. Laureanti, S. Katipamula, G. M. Chambers, N. Priyadarshani, S. Lense, J. T. Bays, J. C. Linehan and W. J. Shaw, Faraday Discuss., 2019, 215, 123-140. [100] Y. Matsubara M. Shimojima S. Takagi Chem. Lett. 49 2020 315 317 Y. Matsubara, M. Shimojima and S. Takagi, Chem. Lett., 2020, 49, 315-317. [101] K. Talukdar S. Sinha Roy E. Amatya E.A. Sleeper P.Le Magueres J.W. Jurss Inorg. Chem. 59 2020 6087 6099 K. Talukdar, S. Sinha Roy, E. Amatya, E. A. Sleeper, P. Le Magueres and J. W. Jurss, Inorg. Chem., 2020, 59, 6087-6099. [102] C.K. Williams A. Lashgari J. Chai J.J. Jiang ChemSusChem 13 2020 3412 3417 C. K. Williams, A. Lashgari, J. Chai and J. J. Jiang, ChemSusChem, 2020, 13, 3412-3417. [103] D.Z. Zee M. Nippe A.E. King C.J. Chang J.R. Long Inorg. Chem. 59 2020 5206 5217 D. Z. Zee, M. Nippe, A. E. King, C. J. Chang and J. R. Long, Inorg. Chem., 2020, 59, 5206-5217. [104] F. Wang B. Cao W.-P. To C.-W. Tse K. Li X.-Y. Chang C. Zang S.L.-F. Chan C.-M. Che Catal. Sci. Technol. 6 2016 7408 7420 F. Wang, B. Cao, W.-P. To, C.-W. Tse, K. Li, X.-Y. Chang, C. Zang, S. L.-F. Chan and C.-M. Che, Catal. Sci. Technol., 2016, 6, 7408-7420. [105] C.Y. Zhu Y.Q. Zhang R.Z. Liao W. Xia J.C. Hu J. Wu H. Liu F. Wang Dalton Trans 47 2018 13142 13150 C. Y. Zhu, Y. Q. Zhang, R. Z. Liao, W. Xia, J. C. Hu, J. Wu, H. Liu and F. Wang, Dalton Trans., 2018, 47, 13142-13150. [106] C.-Y. Zhu Y.-C. Huang J.-C. Hu Q.-K. Li H. Tan M.-X. Gui S.-F. Deng F. Wang J. Photochem. Photobio. A Chem. 355 2018 175 179 C.-Y. Zhu, Y.-C. Huang, J.-C. Hu, Q.-K. Li, H. Tan, M.-X. Gui, S.-F. Deng and F. Wang, J. Photochem. Photobio. A Chem., 2018, 355, 175-179. [107] W.-P. To T.W.-S. Chow C.-W. Tse X. Guan J.-S. Huang C.-M. Che Chem. Sci. 6 2015 5891 5903 W.-P. To, T. W.-S. Chow, C.-W. Tse, X. Guan, J.-S. Huang and C.-M. Che, Chem. Sci., 2015, 6, 5891-5903. [108] B. Rudshteyn K.J. Fisher H.M.C. Lant K.R. Yang B.Q. Mercado G.W. Brudvig R.H. Crabtree V.S. Batista ACS Catal 8 2018 7952 7960 B. Rudshteyn, K. J. Fisher, H. M. C. Lant, K. R. Yang, B. Q. Mercado, G. W. Brudvig, R. H. Crabtree and V. S. Batista, ACS Catal., 2018, 8, 7952-7960. [109] W. Yang S.S. Roy W.C. Pitts R.L. Nelson F.R. Fronczek J.W. Jurss Inorg. Chem. 57 2018 9564 9575 W. Yang, S. S. Roy, W. C. Pitts, R. L. Nelson, F. R. Fronczek and J. W. Jurss, Inorg. Chem., 2018, 57, 9564-9575. [110] J. Mallah M. Ataya F. Hasanayn Organometallics 39 2020 286 294 J. Mallah, M. Ataya and F. Hasanayn, Organometallics, 2020, 39, 286-294. [111] H.-Y. Wang R. Hu Y.-J. Lei Z.-Y. Jia G.-L. Hu C.-B. Li Q. Gu Catal. Sci. Technol. 10 2020 2821 2829 H.-Y. Wang, R. Hu, Y.-J. Lei, Z.-Y. Jia, G.-L. Hu, C.-B. Li and Q. Gu, Catal. Sci. Technol., 2020, 10, 2821-2829. [112] Y.-X. Feng H.-J. Wang J.-W. Wang W. Zhang M. Zhang T.-B. Lu ACS Appl. Mater. Interfaces 13 2021 26573 26580 Y.-X. Feng, H.-J. Wang, J.-W. Wang, W. Zhang, M. Zhang and T.-B. Lu, ACS Appl. Mater. Interfaces, 2021, 13, 26573-26580. [113] C. Sahm E. Mates-Torres N. Eliasson K. Sokolowski A. Wagner K. Dalle Z. Huang O.A. Scherman L. Hammarström M. Garcia-Melchor E. Reisner Chem. Sci. 12 2021 9078 9087 C. Sahm, E. Mates-Torres, N. Eliasson, K. Sokolowski, A. Wagner, K. Dalle, Z. Huang, O. A. Scherman, L. Hammarström, M. Garcia-Melchor and E. Reisner, Chem. Sci., 2021, 12, 9078-9087. [114] J. Wu B.Y. Deng J. Liu S.R. Yang M.D. Li J. Li F. Wang ACS Appl. Mater. Interfaces 14 2022 29945 29955 J. Wu, B. Y. Deng, J. Liu, S. R. Yang, M. D. Li, J. Li and F. Wang, ACS Appl. Mater. Interfaces, 2022, 14, 29945-29955. [115] W. Xia Y.-Y. Ren J. Liu F. Wang Chem. J. Chin. Univ. 43 2022 20220192 W. Xia, Y.-Y. Ren, J. Liu and F. Wang, Chem. J. Chin. Univ., 2022, 43, 20220192. [116] Q. Sun B.W.J. Chen N. Wang Q. He A. Chang C.-M. Yang H. Asakura T. Tanaka M.J. Hülsey C.-H. Wang J. Yu N. Yan Angew. Chem. Int. Ed. 59 2020 20183 20191 Q. Sun, B. W. J. Chen, N. Wang, Q. He, A. Chang, C.-M. Yang, H. Asakura, T. Tanaka, M. J. Hülsey, C.-H. Wang, J. Yu, N. Yan, Angew. Chem. Int. Ed., 2020, 59, 20183-20191. Wu Xia received his B.S. degree in Chemistry from Hubei Engineering University, M.S. degree in Organic Chemistry from Hubei University, and PhD degree in Organic Chemistry under the supervision of Professor Feng Wang from Huazhong University of Science and Technology. Currently, he works in Jishou University as a Lecturer. His research interests focus on photocatalytic CO2 reduction. Dr Feng Wang is currently a full professor at Huazhong University of Science and Technology (HUST). He received his B.S. degree in applied chemistry from HUST in 2005 and his Ph.D. from the Technical Institute of Physics and Chemistry, the Chinese Academy of Sciences, under the supervision of Professor Li-Zhu Wu and Professor Chen-Ho Tung in 2013. He worked as a postdoc in Professor Chi-Ming Che's group at the University of Hong Kong in 2013-2016. He has been working on the research on artificial photosynthesis. He has developed a variety of self-assembly systems for photosynthetic H2 production and/or CO2 reduction based on molecular catalysts and quantum dots photocatalysts. He is currently working on the development of novel photofunctional materials and exploring their applications in sensor, self-assembly, photocatalysis, and so on.",
      "scopus-id": "85144462058",
      "coredata": {
        "eid": "1-s2.0-S2468823122007702",
        "dc:description": "Carbon dioxide (CO2) transformation is a hot topic in both fundamental research and industrial application. Transition metal complexes of tunable and definite structure exhibit unique advantage in the study of CO2 reduction. Catalytic transformation of CO2 at metal complex catalyst is a multi-electron and multi-atom involved process. In this regard, the local chemical environment around the metal center (M) is critical to the catalytic activity. Intramolecularly inducing a supporting site/group into the metal complex catalyst enables to synergistically stabilize M-CO2 or M-COOH adducts with the metal center, which always lowers the energy barrier and/or alters transformation route. Some typical strategies had been applied to design such metal complex catalysts for photo- and/or electrocatalytic CO2 reduction. In this review, we are going to review such representative molecular catalysts (based on earth-abundant metals) that contain an intramolecular supporting site to assist the metal center for efficient photo- and/or electrocatalytic CO2 reduction. According to the structural and functional features of the catalysts, three types of catalyst containing an intramolecular supporting site are summarized. In the first type, one of metal atoms in binuclear complex acts as an intramolecular supporting site to synergistically work with another metal atom for catalytic CO2 reduction. In the second type, hydrogen bond (HD) donor group (such as amide or phenol groups) at secondary coordination sphere acts as an intramolecular supporting site to stabilize M-CO2 adduct via an intramolecular hydrogen bond. In the third type, cis-coordination atoms in several cis-cobalt-complexes function as an intramolecular supporting site in photocatalytic CO2 reduction. The structural characteristics, catalytic performances, and mechanisms of the typical examples in these three types are reviewed.",
        "openArchiveArticle": "false",
        "prism:coverDate": "2023-01-15",
        "openaccessUserLicense": null,
        "prism:aggregationType": "Journal",
        "prism:url": "https://api.elsevier.com/content/article/pii/S2468823122007702",
        "dc:creator": [
          {
            "@_fa": "true",
            "$": "Xia, Wu"
          },
          {
            "@_fa": "true",
            "$": "Wang, Feng"
          }
        ],
        "link": [
          {
            "@_fa": "true",
            "@rel": "self",
            "@href": "https://api.elsevier.com/content/article/pii/S2468823122007702"
          },
          {
            "@_fa": "true",
            "@rel": "scidir",
            "@href": "https://www.sciencedirect.com/science/article/pii/S2468823122007702"
          }
        ],
        "dc:format": "application/json",
        "openaccessType": null,
        "pii": "S2468-8231(22)00770-2",
        "prism:volume": "535",
        "articleNumber": "112884",
        "prism:publisher": "Elsevier B.V.",
        "dc:title": "Molecular catalysts design: Intramolecular supporting site assisting to metal center for efficient CO2 photo- and electroreduction",
        "prism:copyright": "© 2022 Elsevier B.V. All rights reserved.",
        "openaccess": "0",
        "prism:issn": "24688231",
        "dcterms:subject": [
          {
            "@_fa": "true",
            "$": "CO2 reduction"
          },
          {
            "@_fa": "true",
            "$": "Molecular catalyst"
          },
          {
            "@_fa": "true",
            "$": "Intramolecular supporting site"
          },
          {
            "@_fa": "true",
            "$": "Synergistic effect"
          }
        ],
        "openaccessArticle": "false",
        "prism:publicationName": "Molecular Catalysis",
        "openaccessSponsorType": null,
        "prism:pageRange": "112884",
        "pubType": "rev",
        "prism:coverDisplayDate": "15 January 2023",
        "prism:doi": "10.1016/j.mcat.2022.112884",
        "prism:startingPage": "112884",
        "dc:identifier": "doi:10.1016/j.mcat.2022.112884",
        "openaccessSponsorName": null
      },
      "objects": {
        "object": [
          {
            "@category": "standard",
            "@height": "274",
            "@width": "661",
            "@_fa": "true",
            "$": "https://api.elsevier.com/content/object/eid/1-s2.0-S2468823122007702-sc2.jpg?httpAccept=%2A%2F%2A",
            "@multimediatype": "JPEG image file",
            "@type": "IMAGE-DOWNSAMPLED",
            "@size": "54242",
            "@ref": "sc2",
            "@mimetype": "image/jpeg"
          },
          {
            "@category": "standard",
            "@height": "419",
            "@width": "668",
            "@_fa": "true",
            "$": "https://api.elsevier.com/content/object/eid/1-s2.0-S2468823122007702-sc1.jpg?httpAccept=%2A%2F%2A",
            "@multimediatype": "JPEG image file",
            "@type": "IMAGE-DOWNSAMPLED",
            "@size": "44853",
            "@ref": "sc1",
            "@mimetype": "image/jpeg"
          },
          {
            "@category": "standard",
            "@height": "333",
            "@width": "764",
            "@_fa": "true",
            "$": "https://api.elsevier.com/content/object/eid/1-s2.0-S2468823122007702-sc4.jpg?httpAccept=%2A%2F%2A",
            "@multimediatype": "JPEG image file",
            "@type": "IMAGE-DOWNSAMPLED",
            "@size": "44502",
            "@ref": "sc4",
            "@mimetype": "image/jpeg"
          },
          {
            "@category": "standard",
            "@height": "528",
            "@width": "772",
            "@_fa": "true",
            "$": "https://api.elsevier.com/content/object/eid/1-s2.0-S2468823122007702-sc18.jpg?httpAccept=%2A%2F%2A",
            "@multimediatype": "JPEG image file",
            "@type": "IMAGE-DOWNSAMPLED",
            "@size": "80389",
            "@ref": "sc18",
            "@mimetype": "image/jpeg"
          },
          {
            "@category": "standard",
            "@height": "94",
            "@width": "382",
            "@_fa": "true",
            "$": "https://api.elsevier.com/content/object/eid/1-s2.0-S2468823122007702-sc3.jpg?httpAccept=%2A%2F%2A",
            "@multimediatype": "JPEG image file",
            "@type": "IMAGE-DOWNSAMPLED",
            "@size": "15325",
            "@ref": "sc3",
            "@mimetype": "image/jpeg"
          },
          {
            "@category": "standard",
            "@height": "126",
            "@width": "626",
            "@_fa": "true",
            "$": "https://api.elsevier.com/content/object/eid/1-s2.0-S2468823122007702-sc6.jpg?httpAccept=%2A%2F%2A",
            "@multimediatype": "JPEG image file",
            "@type": "IMAGE-DOWNSAMPLED",
            "@size": "19041",
            "@ref": "sc6",
            "@mimetype": "image/jpeg"
          },
          {
            "@category": "standard",
            "@height": "371",
            "@width": "386",
            "@_fa": "true",
            "$": "https://api.elsevier.com/content/object/eid/1-s2.0-S2468823122007702-sc5.jpg?httpAccept=%2A%2F%2A",
            "@multimediatype": "JPEG image file",
            "@type": "IMAGE-DOWNSAMPLED",
            "@size": "24986",
            "@ref": "sc5",
            "@mimetype": "image/jpeg"
          },
          {
            "@category": "standard",
            "@height": "133",
            "@width": "376",
            "@_fa": "true",
            "$": "https://api.elsevier.com/content/object/eid/1-s2.0-S2468823122007702-sc8.jpg?httpAccept=%2A%2F%2A",
            "@multimediatype": "JPEG image file",
            "@type": "IMAGE-DOWNSAMPLED",
            "@size": "18030",
            "@ref": "sc8",
            "@mimetype": "image/jpeg"
          },
          {
            "@category": "standard",
            "@height": "529",
            "@width": "325",
            "@_fa": "true",
            "$": "https://api.elsevier.com/content/object/eid/1-s2.0-S2468823122007702-sc7.jpg?httpAccept=%2A%2F%2A",
            "@multimediatype": "JPEG image file",
            "@type": "IMAGE-DOWNSAMPLED",
            "@size": "33139",
            "@ref": "sc7",
            "@mimetype": "image/jpeg"
          },
          {
            "@category": "standard",
            "@height": "151",
            "@width": "113",
            "@_fa": "true",
            "$": "https://api.elsevier.com/content/object/eid/1-s2.0-S2468823122007702-fx2.jpg?httpAccept=%2A%2F%2A",
            "@multimediatype": "JPEG image file",
            "@type": "IMAGE-DOWNSAMPLED",
            "@size": "8975",
            "@ref": "fx2",
            "@mimetype": "image/jpeg"
          },
          {
            "@category": "standard",
            "@height": "151",
            "@width": "113",
            "@_fa": "true",
            "$": "https://api.elsevier.com/content/object/eid/1-s2.0-S2468823122007702-fx1.jpg?httpAccept=%2A%2F%2A",
            "@multimediatype": "JPEG image file",
            "@type": "IMAGE-DOWNSAMPLED",
            "@size": "9812",
            "@ref": "fx1",
            "@mimetype": "image/jpeg"
          },
          {
            "@category": "standard",
            "@height": "125",
            "@width": "301",
            "@_fa": "true",
            "$": "https://api.elsevier.com/content/object/eid/1-s2.0-S2468823122007702-ga1.jpg?httpAccept=%2A%2F%2A",
            "@multimediatype": "JPEG image file",
            "@type": "IMAGE-DOWNSAMPLED",
            "@size": "26581",
            "@ref": "ga1",
            "@mimetype": "image/jpeg"
          },
          {
            "@category": "standard",
            "@height": "106",
            "@width": "528",
            "@_fa": "true",
            "$": "https://api.elsevier.com/content/object/eid/1-s2.0-S2468823122007702-sc12.jpg?httpAccept=%2A%2F%2A",
            "@multimediatype": "JPEG image file",
            "@type": "IMAGE-DOWNSAMPLED",
            "@size": "18485",
            "@ref": "sc12",
            "@mimetype": "image/jpeg"
          },
          {
            "@category": "standard",
            "@height": "176",
            "@width": "795",
            "@_fa": "true",
            "$": "https://api.elsevier.com/content/object/eid/1-s2.0-S2468823122007702-sc9.jpg?httpAccept=%2A%2F%2A",
            "@multimediatype": "JPEG image file",
            "@type": "IMAGE-DOWNSAMPLED",
            "@size": "32212",
            "@ref": "sc9",
            "@mimetype": "image/jpeg"
          },
          {
            "@category": "standard",
            "@height": "237",
            "@width": "332",
            "@_fa": "true",
            "$": "https://api.elsevier.com/content/object/eid/1-s2.0-S2468823122007702-sc13.jpg?httpAccept=%2A%2F%2A",
            "@multimediatype": "JPEG image file",
            "@type": "IMAGE-DOWNSAMPLED",
            "@size": "19964",
            "@ref": "sc13",
            "@mimetype": "image/jpeg"
          },
          {
            "@category": "standard",
            "@height": "253",
            "@width": "513",
            "@_fa": "true",
            "$": "https://api.elsevier.com/content/object/eid/1-s2.0-S2468823122007702-sc10.jpg?httpAccept=%2A%2F%2A",
            "@multimediatype": "JPEG image file",
            "@type": "IMAGE-DOWNSAMPLED",
            "@size": "27631",
            "@ref": "sc10",
            "@mimetype": "image/jpeg"
          },
          {
            "@category": "standard",
            "@height": "301",
            "@width": "330",
            "@_fa": "true",
            "$": "https://api.elsevier.com/content/object/eid/1-s2.0-S2468823122007702-sc11.jpg?httpAccept=%2A%2F%2A",
            "@multimediatype": "JPEG image file",
            "@type": "IMAGE-DOWNSAMPLED",
            "@size": "19282",
            "@ref": "sc11",
            "@mimetype": "image/jpeg"
          },
          {
            "@category": "standard",
            "@height": "522",
            "@width": "386",
            "@_fa": "true",
            "$": "https://api.elsevier.com/content/object/eid/1-s2.0-S2468823122007702-sc16.jpg?httpAccept=%2A%2F%2A",
            "@multimediatype": "JPEG image file",
            "@type": "IMAGE-DOWNSAMPLED",
            "@size": "70334",
            "@ref": "sc16",
            "@mimetype": "image/jpeg"
          },
          {
            "@category": "standard",
            "@height": "131",
            "@width": "215",
            "@_fa": "true",
            "$": "https://api.elsevier.com/content/object/eid/1-s2.0-S2468823122007702-sc17.jpg?httpAccept=%2A%2F%2A",
            "@multimediatype": "JPEG image file",
            "@type": "IMAGE-DOWNSAMPLED",
            "@size": "7918",
            "@ref": "sc17",
            "@mimetype": "image/jpeg"
          },
          {
            "@category": "standard",
            "@height": "615",
            "@width": "680",
            "@_fa": "true",
            "$": "https://api.elsevier.com/content/object/eid/1-s2.0-S2468823122007702-sc14.jpg?httpAccept=%2A%2F%2A",
            "@multimediatype": "JPEG image file",
            "@type": "IMAGE-DOWNSAMPLED",
            "@size": "80000",
            "@ref": "sc14",
            "@mimetype": "image/jpeg"
          },
          {
            "@category": "standard",
            "@height": "207",
            "@width": "410",
            "@_fa": "true",
            "$": "https://api.elsevier.com/content/object/eid/1-s2.0-S2468823122007702-sc15.jpg?httpAccept=%2A%2F%2A",
            "@multimediatype": "JPEG image file",
            "@type": "IMAGE-DOWNSAMPLED",
            "@size": "22119",
            "@ref": "sc15",
            "@mimetype": "image/jpeg"
          },
          {
            "@category": "thumbnail",
            "@height": "91",
            "@width": "219",
            "@_fa": "true",
            "$": "https://api.elsevier.com/content/object/eid/1-s2.0-S2468823122007702-sc2.sml?httpAccept=%2A%2F%2A",
            "@multimediatype": "GIF image file",
            "@type": "IMAGE-THUMBNAIL",
            "@size": "9420",
            "@ref": "sc2",
            "@mimetype": "image/gif"
          },
          {
            "@category": "thumbnail",
            "@height": "137",
            "@width": "219",
            "@_fa": "true",
            "$": "https://api.elsevier.com/content/object/eid/1-s2.0-S2468823122007702-sc1.sml?httpAccept=%2A%2F%2A",
            "@multimediatype": "GIF image file",
            "@type": "IMAGE-THUMBNAIL",
            "@size": "8521",
            "@ref": "sc1",
            "@mimetype": "image/gif"
          },
          {
            "@category": "thumbnail",
            "@height": "95",
            "@width": "219",
            "@_fa": "true",
            "$": "https://api.elsevier.com/content/object/eid/1-s2.0-S2468823122007702-sc4.sml?httpAccept=%2A%2F%2A",
            "@multimediatype": "GIF image file",
            "@type": "IMAGE-THUMBNAIL",
            "@size": "4335",
            "@ref": "sc4",
            "@mimetype": "image/gif"
          },
          {
            "@category": "thumbnail",
            "@height": "150",
            "@width": "219",
            "@_fa": "true",
            "$": "https://api.elsevier.com/content/object/eid/1-s2.0-S2468823122007702-sc18.sml?httpAccept=%2A%2F%2A",
            "@multimediatype": "GIF image file",
            "@type": "IMAGE-THUMBNAIL",
            "@size": "9047",
            "@ref": "sc18",
            "@mimetype": "image/gif"
          },
          {
            "@category": "thumbnail",
            "@height": "54",
            "@width": "219",
            "@_fa": "true",
            "$": "https://api.elsevier.com/content/object/eid/1-s2.0-S2468823122007702-sc3.sml?httpAccept=%2A%2F%2A",
            "@multimediatype": "GIF image file",
            "@type": "IMAGE-THUMBNAIL",
            "@size": "6162",
            "@ref": "sc3",
            "@mimetype": "image/gif"
          },
          {
            "@category": "thumbnail",
            "@height": "44",
            "@width": "219",
            "@_fa": "true",
            "$": "https://api.elsevier.com/content/object/eid/1-s2.0-S2468823122007702-sc6.sml?httpAccept=%2A%2F%2A",
            "@multimediatype": "GIF image file",
            "@type": "IMAGE-THUMBNAIL",
            "@size": "2880",
            "@ref": "sc6",
            "@mimetype": "image/gif"
          },
          {
            "@category": "thumbnail",
            "@height": "163",
            "@width": "170",
            "@_fa": "true",
            "$": "https://api.elsevier.com/content/object/eid/1-s2.0-S2468823122007702-sc5.sml?httpAccept=%2A%2F%2A",
            "@multimediatype": "GIF image file",
            "@type": "IMAGE-THUMBNAIL",
            "@size": "8118",
            "@ref": "sc5",
            "@mimetype": "image/gif"
          },
          {
            "@category": "thumbnail",
            "@height": "77",
            "@width": "219",
            "@_fa": "true",
            "$": "https://api.elsevier.com/content/object/eid/1-s2.0-S2468823122007702-sc8.sml?httpAccept=%2A%2F%2A",
            "@multimediatype": "GIF image file",
            "@type": "IMAGE-THUMBNAIL",
            "@size": "6992",
            "@ref": "sc8",
            "@mimetype": "image/gif"
          },
          {
            "@category": "thumbnail",
            "@height": "163",
            "@width": "100",
            "@_fa": "true",
            "$": "https://api.elsevier.com/content/object/eid/1-s2.0-S2468823122007702-sc7.sml?httpAccept=%2A%2F%2A",
            "@multimediatype": "GIF image file",
            "@type": "IMAGE-THUMBNAIL",
            "@size": "5374",
            "@ref": "sc7",
            "@mimetype": "image/gif"
          },
          {
            "@category": "thumbnail",
            "@height": "164",
            "@width": "123",
            "@_fa": "true",
            "$": "https://api.elsevier.com/content/object/eid/1-s2.0-S2468823122007702-fx2.sml?httpAccept=%2A%2F%2A",
            "@multimediatype": "GIF image file",
            "@type": "IMAGE-THUMBNAIL",
            "@size": "17356",
            "@ref": "fx2",
            "@mimetype": "image/gif"
          },
          {
            "@category": "thumbnail",
            "@height": "164",
            "@width": "123",
            "@_fa": "true",
            "$": "https://api.elsevier.com/content/object/eid/1-s2.0-S2468823122007702-fx1.sml?httpAccept=%2A%2F%2A",
            "@multimediatype": "GIF image file",
            "@type": "IMAGE-THUMBNAIL",
            "@size": "18282",
            "@ref": "fx1",
            "@mimetype": "image/gif"
          },
          {
            "@category": "thumbnail",
            "@height": "91",
            "@width": "219",
            "@_fa": "true",
            "$": "https://api.elsevier.com/content/object/eid/1-s2.0-S2468823122007702-ga1.sml?httpAccept=%2A%2F%2A",
            "@multimediatype": "GIF image file",
            "@type": "IMAGE-THUMBNAIL",
            "@size": "20591",
            "@ref": "ga1",
            "@mimetype": "image/gif"
          },
          {
            "@category": "thumbnail",
            "@height": "44",
            "@width": "219",
            "@_fa": "true",
            "$": "https://api.elsevier.com/content/object/eid/1-s2.0-S2468823122007702-sc12.sml?httpAccept=%2A%2F%2A",
            "@multimediatype": "GIF image file",
            "@type": "IMAGE-THUMBNAIL",
            "@size": "5865",
            "@ref": "sc12",
            "@mimetype": "image/gif"
          },
          {
            "@category": "thumbnail",
            "@height": "49",
            "@width": "219",
            "@_fa": "true",
            "$": "https://api.elsevier.com/content/object/eid/1-s2.0-S2468823122007702-sc9.sml?httpAccept=%2A%2F%2A",
            "@multimediatype": "GIF image file",
            "@type": "IMAGE-THUMBNAIL",
            "@size": "3352",
            "@ref": "sc9",
            "@mimetype": "image/gif"
          },
          {
            "@category": "thumbnail",
            "@height": "156",
            "@width": "219",
            "@_fa": "true",
            "$": "https://api.elsevier.com/content/object/eid/1-s2.0-S2468823122007702-sc13.sml?httpAccept=%2A%2F%2A",
            "@multimediatype": "GIF image file",
            "@type": "IMAGE-THUMBNAIL",
            "@size": "8346",
            "@ref": "sc13",
            "@mimetype": "image/gif"
          },
          {
            "@category": "thumbnail",
            "@height": "108",
            "@width": "219",
            "@_fa": "true",
            "$": "https://api.elsevier.com/content/object/eid/1-s2.0-S2468823122007702-sc10.sml?httpAccept=%2A%2F%2A",
            "@multimediatype": "GIF image file",
            "@type": "IMAGE-THUMBNAIL",
            "@size": "4950",
            "@ref": "sc10",
            "@mimetype": "image/gif"
          },
          {
            "@category": "thumbnail",
            "@height": "163",
            "@width": "179",
            "@_fa": "true",
            "$": "https://api.elsevier.com/content/object/eid/1-s2.0-S2468823122007702-sc11.sml?httpAccept=%2A%2F%2A",
            "@multimediatype": "GIF image file",
            "@type": "IMAGE-THUMBNAIL",
            "@size": "7323",
            "@ref": "sc11",
            "@mimetype": "image/gif"
          },
          {
            "@category": "thumbnail",
            "@height": "164",
            "@width": "121",
            "@_fa": "true",
            "$": "https://api.elsevier.com/content/object/eid/1-s2.0-S2468823122007702-sc16.sml?httpAccept=%2A%2F%2A",
            "@multimediatype": "GIF image file",
            "@type": "IMAGE-THUMBNAIL",
            "@size": "9862",
            "@ref": "sc16",
            "@mimetype": "image/gif"
          },
          {
            "@category": "thumbnail",
            "@height": "133",
            "@width": "219",
            "@_fa": "true",
            "$": "https://api.elsevier.com/content/object/eid/1-s2.0-S2468823122007702-sc17.sml?httpAccept=%2A%2F%2A",
            "@multimediatype": "GIF image file",
            "@type": "IMAGE-THUMBNAIL",
            "@size": "5241",
            "@ref": "sc17",
            "@mimetype": "image/gif"
          },
          {
            "@category": "thumbnail",
            "@height": "164",
            "@width": "181",
            "@_fa": "true",
            "$": "https://api.elsevier.com/content/object/eid/1-s2.0-S2468823122007702-sc14.sml?httpAccept=%2A%2F%2A",
            "@multimediatype": "GIF image file",
            "@type": "IMAGE-THUMBNAIL",
            "@size": "8731",
            "@ref": "sc14",
            "@mimetype": "image/gif"
          },
          {
            "@category": "thumbnail",
            "@height": "111",
            "@width": "219",
            "@_fa": "true",
            "$": "https://api.elsevier.com/content/object/eid/1-s2.0-S2468823122007702-sc15.sml?httpAccept=%2A%2F%2A",
            "@multimediatype": "GIF image file",
            "@type": "IMAGE-THUMBNAIL",
            "@size": "7220",
            "@ref": "sc15",
            "@mimetype": "image/gif"
          },
          {
            "@category": "high",
            "@height": "1214",
            "@width": "2926",
            "@_fa": "true",
            "$": "https://api.elsevier.com/content/object/eid/1-s2.0-S2468823122007702-sc2_lrg.jpg?httpAccept=%2A%2F%2A",
            "@multimediatype": "JPEG image file",
            "@type": "IMAGE-HIGH-RES",
            "@size": "400826",
            "@ref": "sc2",
            "@mimetype": "image/jpeg"
          },
          {
            "@category": "high",
            "@height": "1854",
            "@width": "2956",
            "@_fa": "true",
            "$": "https://api.elsevier.com/content/object/eid/1-s2.0-S2468823122007702-sc1_lrg.jpg?httpAccept=%2A%2F%2A",
            "@multimediatype": "JPEG image file",
            "@type": "IMAGE-HIGH-RES",
            "@size": "371910",
            "@ref": "sc1",
            "@mimetype": "image/jpeg"
          },
          {
            "@category": "high",
            "@height": "1474",
            "@width": "3383",
            "@_fa": "true",
            "$": "https://api.elsevier.com/content/object/eid/1-s2.0-S2468823122007702-sc4_lrg.jpg?httpAccept=%2A%2F%2A",
            "@multimediatype": "JPEG image file",
            "@type": "IMAGE-HIGH-RES",
            "@size": "349002",
            "@ref": "sc4",
            "@mimetype": "image/jpeg"
          },
          {
            "@category": "high",
            "@height": "2336",
            "@width": "3417",
            "@_fa": "true",
            "$": "https://api.elsevier.com/content/object/eid/1-s2.0-S2468823122007702-sc18_lrg.jpg?httpAccept=%2A%2F%2A",
            "@multimediatype": "JPEG image file",
            "@type": "IMAGE-HIGH-RES",
            "@size": "500503",
            "@ref": "sc18",
            "@mimetype": "image/jpeg"
          },
          {
            "@category": "high",
            "@height": "417",
            "@width": "1692",
            "@_fa": "true",
            "$": "https://api.elsevier.com/content/object/eid/1-s2.0-S2468823122007702-sc3_lrg.jpg?httpAccept=%2A%2F%2A",
            "@multimediatype": "JPEG image file",
            "@type": "IMAGE-HIGH-RES",
            "@size": "96212",
            "@ref": "sc3",
            "@mimetype": "image/jpeg"
          },
          {
            "@category": "high",
            "@height": "556",
            "@width": "2770",
            "@_fa": "true",
            "$": "https://api.elsevier.com/content/object/eid/1-s2.0-S2468823122007702-sc6_lrg.jpg?httpAccept=%2A%2F%2A",
            "@multimediatype": "JPEG image file",
            "@type": "IMAGE-HIGH-RES",
            "@size": "144644",
            "@ref": "sc6",
            "@mimetype": "image/jpeg"
          },
          {
            "@category": "high",
            "@height": "1641",
            "@width": "1708",
            "@_fa": "true",
            "$": "https://api.elsevier.com/content/object/eid/1-s2.0-S2468823122007702-sc5_lrg.jpg?httpAccept=%2A%2F%2A",
            "@multimediatype": "JPEG image file",
            "@type": "IMAGE-HIGH-RES",
            "@size": "182213",
            "@ref": "sc5",
            "@mimetype": "image/jpeg"
          },
          {
            "@category": "high",
            "@height": "589",
            "@width": "1668",
            "@_fa": "true",
            "$": "https://api.elsevier.com/content/object/eid/1-s2.0-S2468823122007702-sc8_lrg.jpg?httpAccept=%2A%2F%2A",
            "@multimediatype": "JPEG image file",
            "@type": "IMAGE-HIGH-RES",
            "@size": "111651",
            "@ref": "sc8",
            "@mimetype": "image/jpeg"
          },
          {
            "@category": "high",
            "@height": "2346",
            "@width": "1441",
            "@_fa": "true",
            "$": "https://api.elsevier.com/content/object/eid/1-s2.0-S2468823122007702-sc7_lrg.jpg?httpAccept=%2A%2F%2A",
            "@multimediatype": "JPEG image file",
            "@type": "IMAGE-HIGH-RES",
            "@size": "230780",
            "@ref": "sc7",
            "@mimetype": "image/jpeg"
          },
          {
            "@category": "high",
            "@height": "667",
            "@width": "500",
            "@_fa": "true",
            "$": "https://api.elsevier.com/content/object/eid/1-s2.0-S2468823122007702-fx2_lrg.jpg?httpAccept=%2A%2F%2A",
            "@multimediatype": "JPEG image file",
            "@type": "IMAGE-HIGH-RES",
            "@size": "67479",
            "@ref": "fx2",
            "@mimetype": "image/jpeg"
          },
          {
            "@category": "high",
            "@height": "667",
            "@width": "500",
            "@_fa": "true",
            "$": "https://api.elsevier.com/content/object/eid/1-s2.0-S2468823122007702-fx1_lrg.jpg?httpAccept=%2A%2F%2A",
            "@multimediatype": "JPEG image file",
            "@type": "IMAGE-HIGH-RES",
            "@size": "73654",
            "@ref": "fx1",
            "@mimetype": "image/jpeg"
          },
          {
            "@category": "high",
            "@height": "553",
            "@width": "1333",
            "@_fa": "true",
            "$": "https://api.elsevier.com/content/object/eid/1-s2.0-S2468823122007702-ga1_lrg.jpg?httpAccept=%2A%2F%2A",
            "@multimediatype": "JPEG image file",
            "@type": "IMAGE-HIGH-RES",
            "@size": "222909",
            "@ref": "ga1",
            "@mimetype": "image/jpeg"
          },
          {
            "@category": "high",
            "@height": "468",
            "@width": "2338",
            "@_fa": "true",
            "$": "https://api.elsevier.com/content/object/eid/1-s2.0-S2468823122007702-sc12_lrg.jpg?httpAccept=%2A%2F%2A",
            "@multimediatype": "JPEG image file",
            "@type": "IMAGE-HIGH-RES",
            "@size": "122322",
            "@ref": "sc12",
            "@mimetype": "image/jpeg"
          },
          {
            "@category": "high",
            "@height": "780",
            "@width": "3521",
            "@_fa": "true",
            "$": "https://api.elsevier.com/content/object/eid/1-s2.0-S2468823122007702-sc9_lrg.jpg?httpAccept=%2A%2F%2A",
            "@multimediatype": "JPEG image file",
            "@type": "IMAGE-HIGH-RES",
            "@size": "252192",
            "@ref": "sc9",
            "@mimetype": "image/jpeg"
          },
          {
            "@category": "high",
            "@height": "1051",
            "@width": "1473",
            "@_fa": "true",
            "$": "https://api.elsevier.com/content/object/eid/1-s2.0-S2468823122007702-sc13_lrg.jpg?httpAccept=%2A%2F%2A",
            "@multimediatype": "JPEG image file",
            "@type": "IMAGE-HIGH-RES",
            "@size": "141102",
            "@ref": "sc13",
            "@mimetype": "image/jpeg"
          },
          {
            "@category": "high",
            "@height": "1123",
            "@width": "2274",
            "@_fa": "true",
            "$": "https://api.elsevier.com/content/object/eid/1-s2.0-S2468823122007702-sc10_lrg.jpg?httpAccept=%2A%2F%2A",
            "@multimediatype": "JPEG image file",
            "@type": "IMAGE-HIGH-RES",
            "@size": "198904",
            "@ref": "sc10",
            "@mimetype": "image/jpeg"
          },
          {
            "@category": "high",
            "@height": "1334",
            "@width": "1461",
            "@_fa": "true",
            "$": "https://api.elsevier.com/content/object/eid/1-s2.0-S2468823122007702-sc11_lrg.jpg?httpAccept=%2A%2F%2A",
            "@multimediatype": "JPEG image file",
            "@type": "IMAGE-HIGH-RES",
            "@size": "143490",
            "@ref": "sc11",
            "@mimetype": "image/jpeg"
          },
          {
            "@category": "high",
            "@height": "2311",
            "@width": "1709",
            "@_fa": "true",
            "$": "https://api.elsevier.com/content/object/eid/1-s2.0-S2468823122007702-sc16_lrg.jpg?httpAccept=%2A%2F%2A",
            "@multimediatype": "JPEG image file",
            "@type": "IMAGE-HIGH-RES",
            "@size": "519884",
            "@ref": "sc16",
            "@mimetype": "image/jpeg"
          },
          {
            "@category": "high",
            "@height": "581",
            "@width": "954",
            "@_fa": "true",
            "$": "https://api.elsevier.com/content/object/eid/1-s2.0-S2468823122007702-sc17_lrg.jpg?httpAccept=%2A%2F%2A",
            "@multimediatype": "JPEG image file",
            "@type": "IMAGE-HIGH-RES",
            "@size": "57019",
            "@ref": "sc17",
            "@mimetype": "image/jpeg"
          },
          {
            "@category": "high",
            "@height": "2724",
            "@width": "3010",
            "@_fa": "true",
            "$": "https://api.elsevier.com/content/object/eid/1-s2.0-S2468823122007702-sc14_lrg.jpg?httpAccept=%2A%2F%2A",
            "@multimediatype": "JPEG image file",
            "@type": "IMAGE-HIGH-RES",
            "@size": "643410",
            "@ref": "sc14",
            "@mimetype": "image/jpeg"
          },
          {
            "@category": "high",
            "@height": "919",
            "@width": "1818",
            "@_fa": "true",
            "$": "https://api.elsevier.com/content/object/eid/1-s2.0-S2468823122007702-sc15_lrg.jpg?httpAccept=%2A%2F%2A",
            "@multimediatype": "JPEG image file",
            "@type": "IMAGE-HIGH-RES",
            "@size": "149375",
            "@ref": "sc15",
            "@mimetype": "image/jpeg"
          },
          {
            "@category": "standard",
            "@_fa": "true",
            "$": "https://api.elsevier.com/content/object/eid/1-s2.0-S2468823122007702-am.pdf?httpAccept=%2A%2F%2A",
            "@multimediatype": "Acrobat PDF file",
            "@type": "AAM-PDF",
            "@size": "1971360",
            "@ref": "am",
            "@mimetype": "application/pdf"
          }
        ]
      },
      "link": {
        "@rel": "abstract",
        "@href": "https://api.elsevier.com/content/abstract/scopus_id/85144462058"
      }
    }
  }
}