{
  "metadata": {
    "title": "Enhanced hydrothermal stability by a semi-embedded structure: An efficient Ru catalyst for levulinic acid conversion in the aqueous phase",
    "authors": "; ; ",
    "journal": "Molecular Catalysis",
    "date": "2024-12-31",
    "doi": "10.1016/j.mcat.2024.114547",
    "abstract": "",
    "uri": "https://api.elsevier.com/content/article/pii/S2468823124007296",
    "pii": "S2468823124007296"
  },
  "fulltext": {
    "full-text-retrieval-response": {
      "scopus-eid": "2-s2.0-85204607409",
      "originalText": "serial JL 315758 291210 291744 291790 291809 31 Molecular Catalysis MOLECULARCATALYSIS 2024-09-24 2024-09-24 2024-09-24 2024-09-24 2024-11-15T16:17:10 1-s2.0-S2468823124007296 S2468-8231(24)00729-6 S2468823124007296 10.1016/j.mcat.2024.114547 S300 S300.1 FULL-TEXT 1-s2.0-S2468823124X00152 2024-11-15T17:47:59.052827Z 0 0 20241201 20241231 2024 2024-09-24T17:06:55.213139Z absattachment articleinfo articlenumber articletitlenorm authfirstinitialnorm authfirstsurnamenorm cid cids contenttype copyright crossmark dateloaded dateloadedtxt datesearch datesort dateupdated dco docsubtype doctype doi eid ewtransactionid hubeid indexeddate issn issnnorm itemstage itemtransactionid itemweight openaccess openarchive pg pgfirst pii piinorm pubdateend pubdatestart pubdatetxt pubyr sectiontitle sortorder srctitle srctitlenorm srctype ssids alllist content subj subheadings suppl tomb volfirst volissue volumelist webpdf webpdfpagecount yearnav figure table e-component body acknowledge affil appendices articletitle auth authfirstini authfull authkeywords authlast grantnumber grantsponsor grantsponsorid highlightsabst primabst pubtype ref specialabst 2468-8231 24688231 true 569 569 C Volume 569 38 114547 114547 114547 202412 December 2024 2024-12-01 2024-12-31 2024 Regular Papers article fla © 2024 Elsevier B.V. All rights are reserved, including those for text and data mining, AI training, and similar technologies. ENHANCEDHYDROTHERMALSTABILITYBYASEMIEMBEDDEDSTRUCTUREEFFICIENTRUCATALYSTFORLEVULINICACIDCONVERSIONINAQUEOUSPHASE CAO Y 1 Introduction 2 Results and discussion 3 Conclusion CRediT authorship contribution statement Acknowledgment Appendix Supplementary materials References DEVRIES 2012 2009 J FECHETE 2012 2 27 I SHELDON 1998 485 493 R HUO 2021 5248 5270 J LIU 2021 694 709 X VOGT 2023 e202300319 E ARGYLE 2015 145 269 M CAO 2010 13499 13510 A XIONG 2021 e2004319 H QU 2023 1103 1165 R ZHANG 2022 25439 25447 X LIU 2022 867 H GONG 2023 126245 G PHAM 2015 4546 4555 H HENGNE 2012 1064 1072 A SADABA 2015 4133 4145 I PHAM 2012 13163 13167 H TAGHAVI 2022 41 53 S VAN 2018 3619 3625 C HARTH 2022 101191 F LEE 2014 1657 1660 J GAO 2017 2309 2316 Z HAO 2011 183 188 Y HUO 2018 1151 1160 J XIONG 2014 4627 4643 H GAO 2017 4927 4935 G CAO 2017 9894 9902 Y CAO 2019 12858 12866 Y CAO 2018 7077 7085 Y LU 2023 8084 8109 K LIU 2021 2101271 X LIU 2020 75 82 X LU 2007 1038 1040 A LI 2012 29 35 Y WEI 2017 1720 1732 Z RIO 2020 343 356 S DUAN 2023 109295 H LIU 2022 20489 Y PAN 2022 80 90 J PATEL 2013 125 132 N WANG 2022 112159 Y LU 2020 111097 Y ZHANG 2023 9134 9137 R LU 2022 120746 Y ZHANG 2024 6261 6288 Q WANG 2013 98 107 N BESSON 2003 547 559 M FULAJTAROVA 2015 78 85 K CAOX2024X114547 CAOX2024X114547XY 2026-09-24T00:00:00.000Z 2026-09-24T00:00:00.000Z http://creativecommons.org/licenses/by-nc-nd/4.0/ © 2024 Elsevier B.V. All rights are reserved, including those for text and data mining, AI training, and similar technologies. 2024-10-11T00:42:33.223Z http://vtw.elsevier.com/data/voc/AddOnTypes/50.7/aggregated-refined Key Research and Development Program of Shaanxi 2023-YBGY-322 Key Research and Development Projects of Shaanxi Province http://data.elsevier.com/vocabulary/SciValFunders/501100015401 http://sws.geonames.org/1814991/ Natural Science Foundation of Chongqing cstc2020jcyj-msxmX0750 Natural Science Foundation of Chongqing Municipality http://data.elsevier.com/vocabulary/SciValFunders/501100005230 http://sws.geonames.org/1814991/ http://sws.geonames.org/1814991 http://sws.geonames.org/1814991 National Natural Science Foundation of China 22002120 NSFC National Natural Science Foundation of China http://data.elsevier.com/vocabulary/SciValFunders/501100001809 http://sws.geonames.org/1814991 We acknowledge financial support from the National Natural Science Foundation of China (No. 22002120), the Key Research and Development Program of Shaanxi (No. 2023-YBGY-322), and the Natural Science Foundation of Chongqing, China (No. cstc2020jcyj-msxmX0750). https://doi.org/10.15223/policy-017 https://doi.org/10.15223/policy-037 https://doi.org/10.15223/policy-012 https://doi.org/10.15223/policy-029 https://doi.org/10.15223/policy-004 item S2468-8231(24)00729-6 S2468823124007296 1-s2.0-S2468823124007296 10.1016/j.mcat.2024.114547 315758 2024-11-15T17:47:59.052827Z 2024-12-01 2024-12-31 1-s2.0-S2468823124007296-main.pdf https://s3-eu-west-1.amazonaws.com/prod-ucs-content-store-eu-west/content/pii:S2468823124007296/MAIN/application/pdf/f19009c3c1b9d9923becfb39317ab699/main.pdf main.pdf pdf true 10844538 MAIN 9 1-s2.0-S2468823124007296-main_1.png https://s3-eu-west-1.amazonaws.com/prod-ucs-content-store-eu-west/content/pii:S2468823124007296/PREVIEW/image/png/8c93b64ba2af5c92958df808674c8af6/main_1.png main_1.png png 60992 849 656 IMAGE-WEB-PDF 1 1-s2.0-S2468823124007296-gr8.jpg https://s3-eu-west-1.amazonaws.com/prod-ucs-content-store-eu-west/content/pii:S2468823124007296/gr8/DOWNSAMPLED/image/jpeg/d04e675188479c57af7d18bd352604a6/gr8.jpg gr8 gr8.jpg jpg 58802 582 553 IMAGE-DOWNSAMPLED 1-s2.0-S2468823124007296-gr5.jpg https://s3-eu-west-1.amazonaws.com/prod-ucs-content-store-eu-west/content/pii:S2468823124007296/gr5/DOWNSAMPLED/image/jpeg/025c24734c2d3f4427129afb6c6493a3/gr5.jpg gr5 gr5.jpg jpg 93765 525 659 IMAGE-DOWNSAMPLED 1-s2.0-S2468823124007296-gr4.jpg https://s3-eu-west-1.amazonaws.com/prod-ucs-content-store-eu-west/content/pii:S2468823124007296/gr4/DOWNSAMPLED/image/jpeg/0ceac2ef3e64a0a354839bb64b99945a/gr4.jpg gr4 gr4.jpg jpg 44527 263 659 IMAGE-DOWNSAMPLED 1-s2.0-S2468823124007296-gr7.jpg https://s3-eu-west-1.amazonaws.com/prod-ucs-content-store-eu-west/content/pii:S2468823124007296/gr7/DOWNSAMPLED/image/jpeg/5666308cab729fe9512e05f24cbf45ee/gr7.jpg gr7 gr7.jpg jpg 44595 259 659 IMAGE-DOWNSAMPLED 1-s2.0-S2468823124007296-gr6.jpg https://s3-eu-west-1.amazonaws.com/prod-ucs-content-store-eu-west/content/pii:S2468823124007296/gr6/DOWNSAMPLED/image/jpeg/379ae8f965e47372f02cb393ee80d96a/gr6.jpg gr6 gr6.jpg jpg 140994 487 791 IMAGE-DOWNSAMPLED 1-s2.0-S2468823124007296-gr1.jpg https://s3-eu-west-1.amazonaws.com/prod-ucs-content-store-eu-west/content/pii:S2468823124007296/gr1/DOWNSAMPLED/image/jpeg/5399a34d05f3a0b5afd1e9d0159e92a9/gr1.jpg gr1 gr1.jpg jpg 55690 266 659 IMAGE-DOWNSAMPLED 1-s2.0-S2468823124007296-gr3.jpg https://s3-eu-west-1.amazonaws.com/prod-ucs-content-store-eu-west/content/pii:S2468823124007296/gr3/DOWNSAMPLED/image/jpeg/160dc1ffc08a01506bc98619d4c28d2b/gr3.jpg gr3 gr3.jpg jpg 162059 443 659 IMAGE-DOWNSAMPLED 1-s2.0-S2468823124007296-gr2.jpg https://s3-eu-west-1.amazonaws.com/prod-ucs-content-store-eu-west/content/pii:S2468823124007296/gr2/DOWNSAMPLED/image/jpeg/855caa051a67e8651f3553b6ada8c064/gr2.jpg gr2 gr2.jpg jpg 156916 647 659 IMAGE-DOWNSAMPLED 1-s2.0-S2468823124007296-ga1.jpg https://s3-eu-west-1.amazonaws.com/prod-ucs-content-store-eu-west/content/pii:S2468823124007296/ga1/DOWNSAMPLED/image/jpeg/50ab591ce48ac3587278136f35737049/ga1.jpg ga1 true ga1.jpg jpg 27087 200 283 IMAGE-DOWNSAMPLED 1-s2.0-S2468823124007296-sc1.jpg https://s3-eu-west-1.amazonaws.com/prod-ucs-content-store-eu-west/content/pii:S2468823124007296/sc1/DOWNSAMPLED/image/jpeg/59c8c24e185e6cc79dbfca46f3668f73/sc1.jpg sc1 sc1.jpg jpg 74338 327 791 IMAGE-DOWNSAMPLED 1-s2.0-S2468823124007296-gr8.sml https://s3-eu-west-1.amazonaws.com/prod-ucs-content-store-eu-west/content/pii:S2468823124007296/gr8/THUMBNAIL/image/gif/6ef3947159336715b75be0e3fdc534bb/gr8.sml gr8 gr8.sml sml 8663 164 156 IMAGE-THUMBNAIL 1-s2.0-S2468823124007296-gr5.sml https://s3-eu-west-1.amazonaws.com/prod-ucs-content-store-eu-west/content/pii:S2468823124007296/gr5/THUMBNAIL/image/gif/fa8089c378910c303c89b0ed50eed258/gr5.sml gr5 gr5.sml sml 14914 164 206 IMAGE-THUMBNAIL 1-s2.0-S2468823124007296-gr4.sml https://s3-eu-west-1.amazonaws.com/prod-ucs-content-store-eu-west/content/pii:S2468823124007296/gr4/THUMBNAIL/image/gif/88dfdbc659dc3b1bf0b98a1cf7eb7dbe/gr4.sml gr4 gr4.sml sml 7810 87 219 IMAGE-THUMBNAIL 1-s2.0-S2468823124007296-gr7.sml https://s3-eu-west-1.amazonaws.com/prod-ucs-content-store-eu-west/content/pii:S2468823124007296/gr7/THUMBNAIL/image/gif/a15fd7f665c08e6802e2c5df89a5072b/gr7.sml gr7 gr7.sml sml 13922 86 219 IMAGE-THUMBNAIL 1-s2.0-S2468823124007296-gr6.sml https://s3-eu-west-1.amazonaws.com/prod-ucs-content-store-eu-west/content/pii:S2468823124007296/gr6/THUMBNAIL/image/gif/a676684bd89befa791e9f469fff95df3/gr6.sml gr6 gr6.sml sml 19146 135 219 IMAGE-THUMBNAIL 1-s2.0-S2468823124007296-gr1.sml https://s3-eu-west-1.amazonaws.com/prod-ucs-content-store-eu-west/content/pii:S2468823124007296/gr1/THUMBNAIL/image/gif/8e8a839a01dfff2492960c7309b0c3bb/gr1.sml gr1 gr1.sml sml 9504 89 219 IMAGE-THUMBNAIL 1-s2.0-S2468823124007296-gr3.sml https://s3-eu-west-1.amazonaws.com/prod-ucs-content-store-eu-west/content/pii:S2468823124007296/gr3/THUMBNAIL/image/gif/59dee9fcaa08d697c04b62bf27b8e3b6/gr3.sml gr3 gr3.sml sml 19649 147 219 IMAGE-THUMBNAIL 1-s2.0-S2468823124007296-gr2.sml https://s3-eu-west-1.amazonaws.com/prod-ucs-content-store-eu-west/content/pii:S2468823124007296/gr2/THUMBNAIL/image/gif/fe28633b681304b22882bc37af574c58/gr2.sml gr2 gr2.sml sml 16652 164 167 IMAGE-THUMBNAIL 1-s2.0-S2468823124007296-ga1.sml https://s3-eu-west-1.amazonaws.com/prod-ucs-content-store-eu-west/content/pii:S2468823124007296/ga1/THUMBNAIL/image/gif/1870418c3cf291bae8445098b9db8662/ga1.sml ga1 true ga1.sml sml 19956 154 219 IMAGE-THUMBNAIL 1-s2.0-S2468823124007296-sc1.sml https://s3-eu-west-1.amazonaws.com/prod-ucs-content-store-eu-west/content/pii:S2045232217008690/sc1/THUMBNAIL/image/gif/9aced513d28fe1cd98e0cc214f6fa080/sc1.sml sc1 sc1.sml sml 11109 91 219 IMAGE-THUMBNAIL 1-s2.0-S2468823124007296-gr8_lrg.jpg https://s3-eu-west-1.amazonaws.com/prod-ucs-content-store-eu-west/content/pii:S2468823124007296/HIGHRES/image/jpeg/f910777176f7fd024be339663774b771/gr8_lrg.jpg gr8 gr8_lrg.jpg jpg 322143 2576 2448 IMAGE-HIGH-RES 1-s2.0-S2468823124007296-gr5_lrg.jpg https://s3-eu-west-1.amazonaws.com/prod-ucs-content-store-eu-west/content/pii:S2468823124007296/HIGHRES/image/jpeg/4a0baee90836f5928477c9a93e9c2fc7/gr5_lrg.jpg gr5 gr5_lrg.jpg jpg 656333 2324 2917 IMAGE-HIGH-RES 1-s2.0-S2468823124007296-gr4_lrg.jpg https://s3-eu-west-1.amazonaws.com/prod-ucs-content-store-eu-west/content/pii:S2468823124007296/HIGHRES/image/jpeg/fa447eea066d9ddbe7e1524c7c499514/gr4_lrg.jpg gr4 gr4_lrg.jpg jpg 278560 1164 2917 IMAGE-HIGH-RES 1-s2.0-S2468823124007296-gr7_lrg.jpg https://s3-eu-west-1.amazonaws.com/prod-ucs-content-store-eu-west/content/pii:S2468823124007296/HIGHRES/image/jpeg/b24b32662e90f487bf7a54dc4b2d54be/gr7_lrg.jpg gr7 gr7_lrg.jpg jpg 338238 1148 2917 IMAGE-HIGH-RES 1-s2.0-S2468823124007296-gr6_lrg.jpg https://s3-eu-west-1.amazonaws.com/prod-ucs-content-store-eu-west/content/pii:S2468823124007296/HIGHRES/image/jpeg/d765007bfaf804df47a58ccd58dcc917/gr6_lrg.jpg gr6 gr6_lrg.jpg jpg 1619958 2155 3500 IMAGE-HIGH-RES 1-s2.0-S2468823124007296-gr1_lrg.jpg https://s3-eu-west-1.amazonaws.com/prod-ucs-content-store-eu-west/content/pii:S2468823124007296/HIGHRES/image/jpeg/8b6c63bb4cf4a2c2e0636847a05b3546/gr1_lrg.jpg gr1 gr1_lrg.jpg jpg 377097 1179 2917 IMAGE-HIGH-RES 1-s2.0-S2468823124007296-gr3_lrg.jpg https://s3-eu-west-1.amazonaws.com/prod-ucs-content-store-eu-west/content/pii:S2468823124007296/HIGHRES/image/jpeg/073856214415c3c8fa9f7f14bd969f2e/gr3_lrg.jpg gr3 gr3_lrg.jpg jpg 1156209 1963 2917 IMAGE-HIGH-RES 1-s2.0-S2468823124007296-gr2_lrg.jpg https://s3-eu-west-1.amazonaws.com/prod-ucs-content-store-eu-west/content/pii:S2468823124007296/HIGHRES/image/jpeg/c475ce05c30d4b14a80066b4bff4ccca/gr2_lrg.jpg gr2 gr2_lrg.jpg jpg 1474333 2866 2917 IMAGE-HIGH-RES 1-s2.0-S2468823124007296-ga1_lrg.jpg https://s3-eu-west-1.amazonaws.com/prod-ucs-content-store-eu-west/content/pii:S2468823124007296/HIGHRES/image/jpeg/c699b4a653d511a4241fbae6d28a4ae7/ga1_lrg.jpg ga1 true ga1_lrg.jpg jpg 200437 886 1256 IMAGE-HIGH-RES 1-s2.0-S2468823124007296-sc1_lrg.jpg https://s3-eu-west-1.amazonaws.com/prod-ucs-content-store-eu-west/content/pii:S2045232217004151/HIGHRES/image/jpeg/bfabd3434a06224e50bf7132e418a09a/sc1_lrg.jpg sc1 sc1_lrg.jpg jpg 574825 1449 3500 IMAGE-HIGH-RES 1-s2.0-S2468823124007296-mmc1.docx https://s3-eu-west-1.amazonaws.com/prod-ucs-content-store-eu-west/content/pii:S2468823124007296/mmc1/MAIN/application/vnd.openxmlformats-officedocument.wordprocessingml.document/04f356567236b7770f1519dfd0272e84/mmc1.docx mmc1 mmc1.docx docx 907457 APPLICATION MCAT 114547 114547 S2468-8231(24)00729-6 10.1016/j.mcat.2024.114547 Fig. 1 N2 sorption isotherms (a) and XRD patterns (b) of various Ru catalysts. Fig 1 Fig. 2 HRTEM images (a and c), SAED pattern of Ru (b), and corresponding Ru particle size distribution (d) in Ru-Al2O3@CN catalyst. Fig 2 Fig. 3 HAADF-STEM image and EDS mapping of Ru-Al2O3@CN catalyst. Fig 3 Fig. 4 H2-TPR-MS patterns of various Ru catalysts: TCD signal (a) and CH4 signal (b). Fig 4 Fig. 5 Comparison of the TOF for various reported Ru-based catalysts (a), recycling results of the Ru/Al2O3 (b) and Ru-Al2O3@CN (c) catalysts (Reaction conditions: catalyst 20 mg, LA 1.0 g, H2O 5 mL, 100 °C and 2 MPa H2, 1 h.), recycling results of the Ru-Al2O3@CN (d) catalysts (Reaction conditions: catalyst 20 mg, LA 2.0 g, H2O 4 mL, 120 °C and 2 MPa H2, 1 h.). Fig 5 Fig. 6 XRD patterns of spent Ru/Al2O3 and catalysts (Reaction conditions: catalyst 20 mg, LA 1.0 g, H2O 5 mL, 100 °C and 2 MPa H2, 1 h) (a); HRTEM images and particle size distribution of spent Ru/Al2O3 (b) and Ru-Al2O3@CN (c) catalysts; Ru and Al contents in various Ru catalysts (d); HRTEM images of Ru/Al2O3 before (e) and after reaction (f). Fig 6 Fig. 7 The images of reaction solution after stability test for Ru/Al2O3 (a: 1st, b: 2nd, and c: 3rd) and Ru-Al2O3@CN (d: 1st, e: 2nd, and f: 3rd); the XRD patterns of precipitation obtain from the reaction solution after stability test for Ru/Al2O3. Fig 7 Fig. 8 Possible stability mechanism of the Ru/Al2O3 and Ru-Al2O3@CN catalysts for the conversion of levulinic acid to γ-valerolactone in the aqueous phase. Fig 8 Scheme 1 Schematic illustration for the synthesis procedure of various Ru catalysts. Scheme 1 Table 1 Physicochemical properties of various Ru catalysts. Table 1 Catalyst S BET (m2/g) V t (cm3/g) a D (nm) b Ru/Al2O3 122.8 0.73 23.7 Ru/(Al2O3@CN) 150.8 0.73 19.3 (Ru/Al2O3)@CN 156.6 0.70 17.8 Ru-Al2O3@CN 152.8 0.73 20.3 a V t: total pore volume. b Average pore diameter calculated based on 4 V/A by BET. Table 2 Levulinic acid hydrogenation over various catalysts a . Table 2 Entry Catalyst Conversion (%) Selectivity (%) b TOF (h−1) c 1 Al2O3 15 – – 2 Al2O3@CN 6 – – 3 Ru/Al2O3 60 26 771 4 Ru/(Al2O3@CN) 46 65 1313 5 (Ru/Al2O3)@CN 16 23 199 6 Ru-Al2O3@CN 61 79 2525 7 Ru-Al2O3@CN d 54 87 4923 a Reaction conditions: LA 1.0 g, catalyst 20 mg, H2O 5 mL, 100 °C, 2.0 MPa H2, 60 min. b Selectivity for γ-valerolactone. c TOF was calculated based on the total amount of Ru and the yield of γ-valerolactone. d Reaction conditions: LA 2.0 g, H2O 4 mL, 120 °C. Research Paper Enhanced hydrothermal stability by a semi-embedded structure: An efficient Ru catalyst for levulinic acid conversion in the aqueous phase Yueling Cao Writing – review & editing Writing – original draft Resources Conceptualization a b ⁎ Haoyang Li Methodology Investigation Formal analysis Data curation a Fubin Ma Methodology Data curation a Hao Wen Methodology Data curation a Jinhui Wang Software a Hepeng Zhang Supervision Resources a ⁎ a Xi'an Key Laboratory of Functional Organic Porous Materials, School of Chemistry and Chemical Engineering, Northwestern Polytechnical University, Xi'an 710129, PR China Xi'an Key Laboratory of Functional Organic Porous Materials School of Chemistry and Chemical Engineering Northwestern Polytechnical University Xi'an 710129 PR China aXi'an Key Laboratory of Functional Organic Porous Materials, School of Chemistry and Chemical Engineering, Northwestern Polytechnical University, Xi'an 710129, PR China b Chongqing Science and Technology Innovation Center of Northwestern Polytechnical University, Chongqing 401135, PR China Chongqing Science and Technology Innovation Center of Northwestern Polytechnical University Chongqing 401135 PR China bChongqing Science and Technology Innovation Center of Northwestern Polytechnical University, Chongqing 401135, PR China ⁎ Corresponding authors at: Xi'an Key Laboratory of Functional Organic Porous Materials, School of Chemistry and Chemical Engineering, Northwestern Polytechnical University, Xi'an 710129, PR China. Xi'an Key Laboratory of Functional Organic Porous Materials School of Chemistry and Chemical Engineering Northwestern Polytechnical University Xi'an 710129 PR China Catalyst stability is believed to be one of the greatest challenges faced for the supported metal catalysts in the catalytic conversion of biomass and its derivatives because many biomass transformations are conducted in the aqueous phase. In this work, we report a simple yet efficient coating-impregnation-pyrolysis (CIP) strategy to fabricate Al2O3 supported Ru catalyst (Ru-Al2O3@CN) with Ru NPs (nanoparticles) semi-embedded into N-doped carbon (CN) layer for the efficient hydrogenation of levulinic acid (LA) to γ-valerolactone in the aqueous phase. Benefit from the special structure of Ru-Al2O3@CN catalyst, it possesses both high catalytic activity and stability, giving a TOF of 28,099 h-1 for LA hydrogenation at 120 °C and 2 MPa H2, which is superior to the most of reported Ru-based catalysts. More importantly, compared with conventional impregnated Ru/Al2O3 catalyst, the Ru-Al2O3@CN catalyst exhibits a remarkably improved hydrothermal stability. Based on series of catalyst characterizations and control experiments, it was found that the presence of CN can weak the interaction between Ru and Al2O3, as well as protect the Al2O3 and Ru NPs from hydrolysis and aggregation, respectively. We anticipate that such a novel strategy may provide some valuable insights into the synthesis of oxides-supported metal catalyst with high hydrothermal stability. Graphical abstract Image, graphical abstract Keywords Biomass Catalyst stability Levulinic acid Coating-impregnation-pyrolysis strategy Embedded structure Data availability Data will be made available on request. 1 Introduction Heterogeneous catalyst constitutes a vital part in the modern chemical industry, from refinery to pharmaceuticals [1,2]. From the viewpoint of industrial application, activity, selectivity, and stability are the three most important indexes of heterogeneous catalysts [3]. Nowadays, the activity and selectivity of a heterogeneous catalyst are frequently served as the screening criteria to drive catalyst development. There is no doubt that for a heterogeneous catalyst, the starting activity and selectivity is of great significance. However, it's also worth noting that the activity and selectivity must be coupled with adequate catalyst stability from the viewpoint of practical application in the future [4,5]. For example, the costs used for catalyst replacement and process shutdown reach up to total billions of dollars every year due to the deactivation of heterogeneous catalysts [6,7]. Catalyst stability, therefore, is a problem of great and continuing concern in the practice of industrial catalytic processes. Currently, for supported metal catalysts, their stability often suffers from three challenges in the condensed phase. Firstly, supported metal nanoparticles will agglomerate to larger particles at high temperature because of their high surface free energy [8–10]. In fact, the metal aggregation is common in gas-phase reactions at high temperature, such as methane dry reforming [11], reverse water gas shift (RWGS) [12], and hydrocarbon cracking [13]. Furthermore, the growth of metal nanoparticles can also exist in some aqueous-phase reactions [14]. Secondly, in some cases, the metal leaching may occur because of the following reasons. The supported metal can directly dissolve into an acidic reaction solution. Additionally, some chemical transformations such as hydrolysis and formation of a complex between the metal and reaction species or solvent may happen in condensed-phase reactions, which also can lead to the leaching of supported metal [15,16]. Last but not least, the hydrolysis or collapse of oxide support usually happens under hydrothermal conditions. For conventional oxides, such as γ-Al2O3 and mesoporous silica (SBA-15), hydrolysis or collapse of ordered structure during the aqueous-phase reaction process have been widely reported [17–19]. Moreover, it should be noted that the support hydrolysis or collapse could also cause the sintering and/or leaching of supported metal nanoparticles, which would exacerbate the catalyst deactivation [20]. Based on the above discussion, it can be found that the development of oxide supported metal catalysts with high hydrothermal stability is extremely challenging. To solve the above discussed issues, many efforts have been made. Firstly, fabricating the catalyst with strong metal-support interaction is widely used to improve the catalyst resistance against sintering and/or leaching. For example, Huber et al. reported that no detectable loss and aggregation of cobalt were found for the TiOy-overcoated cobalt catalysts after 105 h time-on-stream test at 140 °C [21]. However, once the reaction temperature reaches above 200 °C, the TiO2 support also undergo hydrolysis, causing the decrease of catalytic activity. The second strategy is to coat the oxide support or oxide supported metal catalyst by carbon layer [13,16,22–25]. Carbon coating on alumina and silica has been proved to be an effective way to improve their hydrothermal stability [16]. However, for the catalyst with metal/oxide@C structure, the surface carbon layer in oxide@C exhibits much higher chemical inertness in comparison with pristine oxide support, which leads to a weaker metal-support interaction, thus making the supported metal prone to sintering and/or loss during the catalyst preparation and/or reaction process [13]. For the catalyst with (metal/oxide)@C structure, both oxide support hydrolysis and metal particle sintering, leaching could be effectively suppressed, while the presence of carbon layer may block part of active sites sometimes, and thus leading to a decreased activity. For example, Li et al. reported that the carbon shells with an appropriate thickness for the CNFx@Ni@CNTs catalyst is a crucial point to obtain the best catalytic performance [26]. Last but not least, embedding metal nanoparticles into the support has also been found to be an effective way to stabilize metal nanoparticles [4,27–32]. This structure endows the catalyst with both high catalytic activity and sintering resistance of metal NPs. Unfortunately, this strategy can also hardly solve the hydrothermal stability of oxide support. Therefore, the development of a facile strategy to fabricate the oxide supported metal catalyst with both high catalytic activity and hydrothermal stability is highly desirable but still a significant challenge. In this work, a simple yet efficient coating-impregnation-pyrolysis strategy was developed to fabricate supported Ru catalysts (Ru-Al2O3@CN) with Ru NPs semi-embedded into N-doped carbon layer. The fresh Ru-Al2O3@CN catalyst exhibits high catalytic activity for LA hydrogenation in aqueous phase at 120 °C and 2 MPa H2, giving a TOF of 28,099 h−1. To the best of our knowledge, this is superior to most of the reported Ru-based catalysts under similar reaction conditions (Table S1). More importantly, compared with traditional impregnated Ru/Al2O3 catalyst, the presence of semi-embedded Ru particles in N-doped carbon layer structure can improve significantly the hydrothermal stability of Ru-Al2O3@CN catalyst prepared by CIP strategy. 2 Results and discussion Compared with conventional hard-template method for the fabrication of semi-embedded metal catalysts [33–36], the key point of CIP strategy is the presence of polydopamine (PDA) on the surface of Al2O3. During pyrolysis process, the PDA will be transformed into porous N-doped carbon layer, which can weaken the attack of H2O molecule in the aqueous-phase reaction, and thus improving the hydrothermal stability of support. More importantly, the PDA layer exhibits a small volume shrinkage during pyrolysis process in compared with small molecules [37–39]. Thus, after the impregnation of RuCl3 into the pore of PDA, the core-shell structure with Ru NPs completely encapsulated by carbon layer can be effectively inhibited. The synthesis procedure was illustrated in Scheme 1 . Typically, the self-polymerization of dopamine hydrochloride (DA·HCl) catalyzed by tris (hydroxymethyl) aminomethane (Tris) was first coated on the surface of Al2O3 for 12 h to obtained Al2O3@PDA composites. Subsequently, RuCl3 was impregnated into Al2O3@PDA to get RuCl3-Al2O3@PDA precursor. Finally, the RuCl3-Al2O3@PDA precursor was pyrolyzed at 800 °C in nitrogen atmosphere to obtain Ru-Al2O3@CN catalyst. For comparison, the traditional impregnated Ru/Al2O3 and Ru/(Al2O3@CN) catalysts, and (Ru/Al2O3)@CN catalyst with (metal/oxide)@C structure were also prepared through similar procedure (as shown in Scheme 1). The N2 sorption experiments were first conducted to investigate the influence of different preparation methods on the physicochemical properties of various Ru catalysts. All of the Ru catalysts exhibit a very similar type-IV isotherm (Fig. 1a ), indicating that they may have almost the same pore volume with the presence of mesoporous structure. To be exact, the BET surface area (Table 1 ) increase in the following order: (Ru/Al2O3)@CN (156.6 m2/g) ≈ Ru-Al2O3@CN (152.8 m2/g) ≈ Ru/(Al2O3@CN) (150.8 m2/g) > Ru/Al2O3 (122.8 m2/g). This result implies that the introduction of CN is beneficial to improve the surface area of catalyst, which is in line with TEM results (Fig. 2 ) that the N-doped carbon layer on the Al2O3 surface is porous and defective. Moreover, various Ru catalysts also possess almost the same pore volume (Table 1). It should be noted that the high pore volume and average pore size may mainly result from the gaps between the alumina particles because the Al2O3 used in this work is nano-sized (as shown in Figs. 2a and S1) [40]. The above discussion shows that the catalyst surface area and pore volume might be not the main reason for the different catalytic performance of various Ru catalysts for the LA hydrogenation. Subsequently, the XRD analysis was performed to study the Ru dispersion of various Ru catalysts. As shown in Fig. 1b, no peak corresponding to metallic Ru could be detected for all samples, which might be ascribed to the high Ru dispersion and/or the low Ru content. TEM analysis (Figs. 2a and S1) confirms that all samples possess excellent Ru dispersion with similar mean size. ICP-OES analysis (Table S2) indicates that various Ru catalysts also have similar Ru content from 0.81 to 0.99 wt%. The structure of the Ru-Al2O3@CN catalyst was further investigated by HRTEM and STEM-EDS analysis. All Ru particles are homogeneously distributed on the surface with a mean size of 1.78 nm (Fig. 2a and 2d). The different planes of Ru in Ru-Al2O3@CN, which are the bright spots as shown in Fig. 2b, could be found in the corresponding selected area electron diffraction (SAED) patterns by using a comparative d spacings method. More importantly, further HRTEM analysis shows that the Al2O3 support is encapsulated by defective carbon layer with a thickness of around 1.3 nm, indicating that the N-doped carbon layer (CN) is successfully introduced on the Al2O3 surface (Fig. 2c). Additionally, STEM-EDS demonstrates that Ru, C, and N atoms are homogeneously distributed in the whole sample, further confirming the successful fabrication of Ru-Al2O3@CN catalyst with Ru particles semi-embedded into N-doped carbon layer structure (Fig. 3 ). More information through the shifting of reduction temperature could be obtained by H2-TPR-MS to elucidate the interaction between metal and support. As can be seen from Fig. 4a , the Ru/Al2O3 catalyst shows a broad peak around 670 °C, which might be attributed to the reduction of partial Ru species with strong interaction with Al2O3. For the Ru/(Al2O3@CN) catalyst, the peak (110 °C) belonging to the reduction of Run+ to Ru0 is far lower than that of Ru/Al2O3 catalyst because of the low interaction between Ru species and Al2O3@CN, indicating that the presence of N-doped carbon layer can weaken considerably the interaction of Ru species with Al2O3. Additionally, the difference in metal-support interaction can be confirmed by the mass signal (Fig. 4b). It has been widely reported that Ru can easily catalyze the methanation of carbon at high temperature [28,29]. Among various Ru catalysts, the (Ru/Al2O3)@CN exhibits the lowest initial methanation temperature (about 300 °C), which is resulted from the intimate contact of Ru NPs with N-doped carbon layer. For the Ru/(Al2O3@CN) catalyst, the initial methanation temperature is about 450 °C due to the weak interaction between Ru and CN. As expected, the Ru-Al2O3@CN catalyst with Ru NPs semi-embedded into N-doped carbon structure presents a moderate initial methanation temperature (380 °C) because its moderate interaction in comparison with Ru/(Al2O3@CN) and (Ru/Al2O3)@CN catalysts. To make a further study of the interaction between metal and support for various Ru catalysts, XPS analysis was then carried out and the binding energies was calibrated with the reference C 1 s (284.6 eV) spectral line. As shown in Figs. S2a, the Ru 3p signal intensity decreases in the following order: Ru/(Al2O3@CN) > Ru-Al2O3@CN > Ru/Al2O3 > (Ru/Al2O3)@CN. For the (Ru/Al2O3)@CN catalyst, the lowest Ru 3p signal intensity might be mainly resulted from part of Ru species covered by N-doped carbon layer because of its (metal/oxide)@C structure. Interestingly, although the Ru nanoparticles are highly dispersed on the support surface for both conventional impregnated Ru/(Al2O3@CN) and Ru/Al2O3 catalysts, the Ru/(Al2O3@CN) catalyst possesses much higher Ru 3p signal intensity in comparison with that of the Ru/Al2O3 catalyst. This might be attributed to the different interaction strength between Ru and support, which is in line with the H2-TPR-MS results. Furthermore, this conclusion can be confirmed by the proportion of Ru0 species in various Ru catalysts. To be exact, the proportion of Ru0 for the Ru/Al2O3 and (Ru/Al2O3)@CN catalysts is 57.3 % and 58.3 %, respectively. The low Ru0 proportion is mainly ascribed to the high Ru-Al2O3 interaction, which making ruthenium oxide difficult to reduce during pyrolysis process. As expected, for the Ru/(Al2O3@CN) and Ru-Al2O3@CN catalysts with low Ru-Al2O3 interaction, the proportion of Ru0 is 60.9 % and 64.7 %, respectively, which are higher than that of Ru/Al2O3 and (Ru/Al2O3)@CN catalysts. The Ru-CN interaction can be investigated by N 1 s spectra (Fig. S2b). Compared with Ru/(Al2O3@CN) and Ru-Al2O3@CN catalysts, the binding energy of N 1 s of (Ru/Al2O3)@CN catalyst positively shift because of the higher Ru-CN interaction, which is consistent with H2-TPR-MS results. It can be, therefore, further confirmed that the presence of CN can weaken the interaction between Ru and Al2O3, which is beneficial to the formation of metallic Ru. Levulinic acid, as a promising, sustainable platform molecule, can be produced easily and economically from lignocellulosic biomass via a simple and robust hydrolysis process [41–45]. Thus, the catalytic performance of various Ru catalysts was initially investigated at 100 °C and 2 MPa H2 using the hydrogenation of levulinic acid in aqueous solution (Table 2 ). Notably, 15 % LA conversion could be achieved over pure Al2O3 (Table 2, entry 1), which might result from the LA in aqueous phase reacts with Al2O3, producing some unknown products. This also confirms that the Al2O3 support is very unstable under this reaction conditions. However, the LA conversion resulted from the reaction of LA and Al2O3 over Al2O3@CN decreases to 6 % (Table 2, entry 2), far lower than that of pure Al2O3, indicating the protective effect of N-doped carbon layer. Additionally, the above results also confirm that the Ru species in various Ru catalysts are the active sites for the transformation of LA into γ-valerolactone. Among various Ru catalysts, the (Ru/Al2O3)@CN catalyst exhibits the lowest LA conversion, giving a TOF (turnover frequency) of 199 h−1. Considering the fact that most of Ru NPs in (Ru/Al2O3)@CN might be covered by the N-doped carbon layer derived from PDA, it's reasonable that it shows the lowest catalytic activity. Interestingly, the Ru-Al2O3@CN catalyst with Ru NPs semi-embedded into N-doped carbon layer structure displays higher TOF (2525 h−1) than that of traditional impregnated Ru/Al2O3 and Ru/(Al2O3@CN) catalysts. More importantly, it should be noted that although the impregnated Ru/Al2O3 catalyst shows a high LA conversion, the selectivity for γ-valerolactone is only 26 %, which is due to the transformation of LA is mainly ascribed to the reaction between LA and Al2O3 in Ru/Al2O3 catalyst. For the Ru-Al2O3@CN catalyst, the γ-valerolactone selectivity is up to 79 %, implying that the presence of N-doped carbon could remarkably improve the hydrothermal stability of Al2O3 in Ru-Al2O3@CN catalyst. It can be, therefore, concluded that the Ru-Al2O3@CN catalyst prepared by CIP strategy is the best among various Ru catalysts for the LA hydrogenation in the aqueous phase. When the reaction temperature increases to 120 °C, the TOF for the Ru-Al2O3@CN catalyst could reach 4923 h−1 (Table 2, entry 7). To measure the intrinsic activity of the Ru-Al2O3@CN catalyst, the TOF was also calculated based on the number of active sites determined by CO chemisorption and at low γ-valerolactone yield (<10 %). Notably, the TOF could reach up to 28,099 h−1 at 120 °C, which, to the best of our knowledge, outperforms other reported Ru-based catalysts for the same reaction under similar reaction conditions (Fig. 5a and Table S1). Next, The stability of Ru-Al2O3@CN and Ru/Al2O3 catalysts was firstly examined under mild reaction conditions: LA 1.0 g, H2O 5 mL, 100 °C and 2 MPa H2. As shown in Fig. 5b, for Ru/Al2O3 catalyst, it shows an obvious decrease in catalytic activity even after first cycle, with a steady decline in LA conversion from 60 % to 31 %, and then dropping to 17 % in the third cycle. As expected, the Ru-Al2O3@CN catalyst exhibits a significant enhanced stability and can be reused at least 6 times (Fig. 5c). Interestingly, after 3 cycles, the LA conversion increases from 61 % to 72 %. Subsequently, the LA conversion presents a slow increase trend as the number of cycles increased. Next, the recycle test of Ru-Al2O3@CN catalyst was then operated under harsh reaction conditions (LA 2.0 g, H2O 4 mL, 120 °C and 2 MPa H2). As shown in Fig. 5d, for the Ru-Al2O3@CN catalyst, it still shows a high stability and can be reused at least 5 times even at high LA concentration and reaction temperature. It should be noted that the catalytic activity of Ru-Al2O3@CN catalyst also displays a gradual increase tendency with increasing number of catalytic cycles, which is similar with its stability test at 100 °C and 2 MPa H2. Based on above results, it can be found that the Ru-Al2O3@CN catalyst seems to have a slow release effect, which will be clarified in the following part. To understand the discrepancy in catalyst stability performance between the Ru/Al2O3 and Ru-Al2O3@CN, series of catalyst characterizations and control experiments were performed. It can be seen from Fig. 6a that the XRD patterns of spent Ru/Al2O3 and Ru-Al2O3@CN catalysts are almost same as corresponding fresh samples. In other words, there seems no change of support structure observed after stability testing, which is in contradiction of the fact that part of Al2O3 could react with LA during the reaction for both the Ru/Al2O3 and Ru-Al2O3@CN catalysts. This might be mainly resulted from the fact that the hydrolyzed or reacted Al2O3 is in situ dissolved into the reaction solution, and thus the remaining parts in spent Ru/Al2O3 and Ru-Al2O3@CN catalysts are not hydrolyzed Al2O3. Based on the TEM analysis (Fig. 6b), it was found that the mean size of Ru particles for the Ru/Al2O3 catalyst after 3 cycles increases to 2.32 nm with a wide size distribution, which is much larger than that of fresh Ru/Al2O3 catalyst (1.77 nm, as shown in Fig. S1). In contrast, the mean Ru size for spent Ru-Al2O3@CN catalyst is almost the same as the fresh one (Fig. 6c), implying the high hydrothermal stability of Ru particles semi-embedded into N-doped carbon layer. The aggregation of Ru NPs in spent Ru/Al2O3 catalyst might be mainly attributed to the support (Al2O3) hydrolysis and collapse. Liu et al. also reported that the collapsed mesoporous structure for LaNiO3/MCM-41 could cause metal aggregation to certain extent [46]. After that, the lattice spacings of Al2O3 in Ru/Al2O3 catalyst before and after reaction were measured by high-resolution TEM (HR-TEM) to further confirm the change of Al2O3 crystal phase structure. As shown in Fig. 6e, for the fresh Ru/Al2O3 catalyst, the distance between two lattice fringes was calculated to be 0.247 and 0.204 nm, which is assigned to (311) and (400) planes for γ-Al2O3 respectively. However, after 3 recycling runs, most of the lattice spacings observed in spent Ru/Al2O3–3 catalyst are belonged to (200) planes of AlO(OH) and (013) planes of Al(OH)3 (Fig. 6f), which further confirms that the Al2O3 in Ru/Al2O3 catalyst undergoes severe hydrolysis during the stability test process. To investigate the anti-leaching ability of Ru/Al2O3 and Ru-Al2O3@CN catalysts, the Ru and Al contents of spent catalysts after stability testing at 100 °C and 2 MPa H2 were investigated by ICP-OES (Fig. 6d). For the spent Ru/Al2O3 catalyst, both the Ru and Al contents decrease in compared with fresh Ru/Al2O3 catalyst, which might be mainly attributed to the serious hydrolysis and then dissolution of Al2O3. Gallezot et al. also reported that in some liquid phase reactions, the loss of active component from catalysts is mainly resulted from support leaching [47]. Surprisingly, the Ru content for the spent Ru-Al2O3@CN catalyst after 6 recycling tests increases from 0.83 to 1.06 wt%, while the Al content exhibits an opposite trend. The obvious increase in Ru content might be ascribed to the Ru NPs embedded into N-doped carbon layer (CN) are stable and do not leach even though part of Al2O3 support dissolves into the reaction solution. In view of the fact that the loss of patrial Al2O3 might liberate some Ru sites covered by Al2O3, the CO chemisorption of Ru-Al2O3@CN catalyst before and after reaction was performed (Table S3). Compared with the fresh Ru-Al2O3@CN catalyst, both the CO uptake and metal area notably increase for the spent Ru-Al2O3@CN catalyst, indicating the enhanced Ru exposure. Meanwhile, it's worth to noting that the improved catalytic activity during stability testing for Ru-Al2O3@CN catalyst might be attributed to the increased Ru content and Ru exposure. To further study the metal leaching of Ru/Al2O3 and Ru-Al2O3@CN catalysts, the reaction solution after each cycle was collected (Fig. 7 ). It should be noted that the catalyst usage is 100 mg during the first cycle in order to make the phenomenon more obvious. As shown in Table S4, both Al leaching was observed for Ru/Al2O3 and Ru-Al2O3@CN catalysts, but the loss of Al in Ru/Al2O3 is more serious, which is consistent with the reaction results of Al2O3 and Al2O3@CN (Table 2, entries 1 and 2). The reaction solution is clear and transparent before reaction, but it becomes turbid with light grey after undergoing 1st cycle for the Ru/Al2O3 catalyst (Fig. 7a), demonstrating that part of the hydrolysate dissolves in reaction solution. Similar phenomenon has also been reported previously for the MgO supported PdCu catalyst [48]. Moreover, as shown in Fig. 7b, the color of the reaction solution becomes much darker for the 2nd recycling run, implying that the spent Ru/Al2O3 catalyst with the structure of patrial Al2O3 changed to AlO(OH) and Al(OH)3 is more prone to dissolve into reaction solution. In contrast, for the Ru-Al2O3@CN catalyst, the reaction solution is still clear and colorless even after 3 recycling runs, indicating that no Ru leaching happens during the reaction process. This conclusion can be confirmed by the fact that there is no Ru detected in reaction solution for the Ru-Al2O3@CN catalyst, as shown in Table S4. Additionally, after the removal of solvent in the reaction solution derived from the 2nd cycle, grey precipitation (denoted as Ru/Al2O3–2-P) was obtained. Subsequently, the precipitate (Ru/Al2O3–2-P) was analyzed by XRD (Fig. 7 g). It was found that the peaks belonging to γ-Al2O3 becomes very weak, implying that the precipitate is mainly the product of complete hydrolysis of Al2O3. Based on above discussion, it can be, therefore, concluded that the Al2O3 support in Ru-Al2O3@CN catalyst not only possesses high acid-resistance, the Ru particles but also has both anti-sintering and anti-leaching properties. From the above discussion, a mechanism for the stability of Ru/Al2O3 and Ru-Al2O3@CN catalysts was proposed (Fig. 8 ). For the Ru/Al2O3 catalyst, the Al2O3 support may suffer from serious hydrolysis first during the reaction process in aqueous phase, and then partial hydrolyzed Al2O3 is dissolved into the reaction solution. Meanwhile, the Ru NPs on the Al2O3 surface will be also leached into the reaction solution, leading to the low hydrothermal stability of Ru/Al2O3 catalyst. Interestingly, for the Ru-Al2O3@CN catalyst with Ru particles semi-embedded into N-doped carbon layer structure, the hydrolysis of Al2O3 during the reaction process can be suppressed remarkable because of the physical protection of N-doped carbon layer. More importantly, due to the special semi-embedded structure, Ru particles are stable during stability test and not leached into the reaction solution. Furthermore, more Ru species will be accessible to the reactants because the slight loss of Al2O3 during the reaction process can liberate in situ some active sites covered by Al2O3 support, which seems to be a slow release process. Therefore, the Ru-Al2O3@CN catalyst exhibits high hydrothermal stability for the LA conversion in aqueous phase. 3 Conclusion In conclusion, we have reported a facile strategy to fabricate Al2O3 supported Ru catalyst (Ru-Al2O3@CN) with Ru particles semi-embedded into N-doped carbon layer structure for the efficient hydrogenation of levulinic acid to γ-valerolactone in the aqueous phase. Compared with impregnated Ru/Al2O3 and Ru/(Al2O3@CN), and overcoated (Ru/Al2O3)@CN catalysts, the Ru-Al2O3@CN catalyst exhibits higher catalytic activity, giving a TOF of 28,099 h−1 for LA hydrogenation at 120 °C and 2 MPa H2. More importantly, the Ru-Al2O3@CN catalyst shows much higher hydrothermal stability at 100 °C and 2 MPa H2 in comparison with Ru/Al2O3 catalyst. Additionally, a slow improvement in catalytic activity after recycling test was observed. Based on control experiments and characterizations, a possible mechanism of slow release of Ru sites by alumina leaching during stability test was proposed, demonstrating that the presence of N-doped carbon layer with strong Ru-C interaction is the main reason for the excellent hydrothermal stability. This facile strategy for the fabrication of oxide-metal-carbon catalysts may provide a new choice to design and synthesize oxides-supported metal catalysts with high hydrothermal stability for other reactions. CRediT authorship contribution statement Yueling Cao: Writing – review & editing, Writing – original draft, Resources, Conceptualization. Haoyang Li: Methodology, Investigation, Formal analysis, Data curation. Fubin Ma: Methodology, Data curation. Hao Wen: Methodology, Data curation. Jinhui Wang: Software. Hepeng Zhang: Supervision, Resources. Declaration of competing interest The authors declare no competing financial interest. Acknowledgment We acknowledge financial support from the National Natural Science Foundation of China (No. 22002120), the Key Research and Development Program of Shaanxi (No. 2023-YBGY-322), and the Natural Science Foundation of Chongqing, China (No. cstc2020jcyj-msxmX0750). Supplementary materials Supplementary material associated with this article can be found, in the online version, at doi:10.1016/j.mcat.2024.114547. Appendix Supplementary materials Image, application 1 References [1] J.G. de Vries S.D. Jackson Homogeneous and heterogeneous catalysis in industry Catal. Sci. Technol. 2 2012 2009 J.G. de Vries, S.D. Jackson, Homogeneous and heterogeneous catalysis in industry, Catal. Sci. Technol. 2 (2012) 2009. [2] I. Fechete Y. Wang J.C. Védrine The past, present and future of heterogeneous catalysis Catal. Today 189 2012 2 27 I. Fechete, Y. Wang, J.C. Védrine, The past, present and future of heterogeneous catalysis, Catal. Today. 189 (2012) 2–27. [3] R.A. Sheldon M. Wallau I.W.C.E. Arends U. Schuchardt Heterogeneous catalysts for liquid-phase oxidations: philosophers' stones or trojan horses? Acc. Chem. Res. 31 1998 485 493 R.A. Sheldon, M. Wallau, I.W.C.E. Arends, U. Schuchardt, Heterogeneous catalysts for liquid-phase oxidations: philosophers' stones or trojan horses?. Acc. Chem. Res. 31 (1998) 485–493. [4] J. Huo J.P. Tessonnier B.H. Shanks Improving hydrothermal stability of supported metal catalysts for biomass conversions: a review ACS Catal. 11 2021 5248 5270 J. Huo, J.P. Tessonnier, B.H. Shanks, Improving hydrothermal stability of supported metal catalysts for biomass conversions: a review, ACS Catal. 11 (2021) 5248–5270. [5] X. Liu G. Lan Z. Li Stabilization of heterogeneous hydrogenation catalysts for the aqueous-phase reactions of renewable feedstocks Chin. J. Catal. 42 2021 694 709 X. Liu, G. Lan, Z. Li, Stabilization of heterogeneous hydrogenation catalysts for the aqueous-phase reactions of renewable feedstocks, Chin. J. Catal.. 42 (2021) 694–709. [6] E.T.C. Vogt D. Fu B.M. Weckhuysen Carbon deposit analysis in catalyst deactivation, regeneration, and rejuvenation Angew. Chem. Int. Ed. Engl. 62 2023 e202300319 E.T.C. Vogt, D. Fu, B.M. Weckhuysen, Carbon deposit analysis in catalyst deactivation, regeneration, and rejuvenation, Angew. Chem. Int. Ed. Engl. 62 (2023) e202300319. [7] M.D. Argyle C.H. Bartholomew Heterogeneous catalyst deactivation and regeneration: a review Catalysts 5 2015 145 269 M.D. Argyle, C.H. Bartholomew, Heterogeneous catalyst deactivation and regeneration: a review, Catalysts. 5 (2015) 145–269. [8] A. Cao R. Lu G. Veser Stabilizing metal nanoparticles for heterogeneous catalysis Phys. Chem. Chem. Phys. 12 2010 13499 13510 A. Cao, R. Lu, G. Veser, Stabilizing metal nanoparticles for heterogeneous catalysis, Phys. Chem. Chem. Phys. 12 (2010) 13499–13510. [9] H. Xiong A.K. Datye Y. Wang Thermally stable single-atom heterogeneous catalysts Adv. Mater. 33 2021 e2004319 H. Xiong, A.K. Datye, Y. Wang, Thermally stable single-atom heterogeneous catalysts, Adv. Mater. 33 (2021) e2004319. [10] R. Qu K. Junge M. Beller Hydrogenation of carboxylic acids, esters, and related compounds over heterogeneous catalysts: a step toward sustainable and carbon-neutral processes Chem. Rev. 123 2023 1103 1165 R. Qu, K. Junge, M. Beller, Hydrogenation of carboxylic acids, esters, and related compounds over heterogeneous catalysts: a step toward sustainable and carbon-neutral processes, Chem. Rev. 123 (2023) 1103–1165. [11] X. Zhang J. Deng T. Lan Y. Shen W. Qu Q. Zhong D. Zhang Coking-and sintering-resistant Ni nanocatalysts confined by active BN edges for methane dry reforming ACS Appl. Mater. Interfaces 14 2022 25439 25447 X. Zhang, J. Deng, T. Lan, Y. Shen, W. Qu, Q. Zhong, D. Zhang, Coking-and sintering-resistant Ni nanocatalysts confined by active BN edges for methane dry reforming, ACS Appl. Mater. Interfaces. 14 (2022) 25439–25447. [12] H.X. Liu S.Q. Li W.W. Wang W.Z. Yu W.J. Zhang C. Ma C.J. Jia Partially sintered copper‒ceria as excellent catalyst for the high-temperature reverse water gas shift reaction Nat. Commun. 13 2022 867 H.X. Liu, S.Q. Li, W.W. Wang, W.Z. Yu, W.J. Zhang, C. Ma, C.J. Jia, Partially sintered copper‒ceria as excellent catalyst for the high-temperature reverse water gas shift reaction, Nat. Commun. 13 (2022) 867. [13] G. Gong J. Luo S. Sun J. Lin R. Ma J. Sun Dual function intensified cracking of waste engine oil to produce alkane-rich oil: study on the synergistic effect of Fe-Co/MCM41 catalyst and microwave Fuel 332 2023 126245 G. Gong, J. Luo, S. Sun, J. Lin, R. Ma, J. Sun, Dual function intensified cracking of waste engine oil to produce alkane-rich oil: study on the synergistic effect of Fe-Co/MCM41 catalyst and microwave, Fuel. 332 (2023) 126245. [14] H.N. Pham A.E. Anderson R.L. Johnson T.J. Schwartz B.J. O'Neill P. Duan K. Schmidt-Rohr J.A. Dumesic A.K. Datye Carbon overcoating of supported metal catalysts for improved hydrothermal stability ACS Catal. 5 2015 4546 4555 H.N. Pham, A.E. Anderson, R.L. Johnson, T.J. Schwartz, B.J. O'Neill, P. Duan, K. Schmidt-Rohr, J.A. Dumesic, A.K. Datye, Carbon overcoating of supported metal catalysts for improved hydrothermal stability, ACS Catal. 5 (2015) 4546–4555. [15] A.M. Hengne C.V. Rode Cu–ZrO2 nanocomposite catalyst for selective hydrogenation of levulinic acid and its ester to γ-valerolactone Green Chem. 14 2012 1064 1072 A.M. Hengne, C.V. Rode, Cu–ZrO2 nanocomposite catalyst for selective hydrogenation of levulinic acid and its ester to γ-valerolactone, Green Chem. 14 (2012) 1064–1072. [16] I. Sádaba M.L. Granados A. Riisager E. Taarning Deactivation of solid catalysts in liquid media: the case of leaching of active sites in biomass conversion reactions Green Chem. 17 2015 4133 4145 I. Sádaba, M.L. Granados, A. Riisager, E. Taarning, Deactivation of solid catalysts in liquid media: the case of leaching of active sites in biomass conversion reactions, Green Chem. 2015 (17) 4133–4145. [17] H.N. Pham A.E. Anderson R.L. Johnson K. Schmidt-Rohr A.K. Datye Improved hydrothermal stability of mesoporous oxides for reactions in the aqueous phase Angew. Chem. Int. Ed. Engl. 51 2012 13163 13167 H.N. Pham, A.E. Anderson, R.L. Johnson, K. Schmidt-Rohr, A.K. Datye, Improved hydrothermal stability of mesoporous oxides for reactions in the aqueous phase, Angew. Chem. Int. Ed. Engl. 51 (2012) 13163–13167. [18] S. Taghavi C. Pizzolitto E. Ghedini F. Menegazzo G. Cruciani M. Peurla K. Eränen I. Heinmaa A. Aho N. Kumar D.Y. Murzin T. Salmi M. Signoretto Levulinic acid production: comparative assessment of Al-rich ordered mesoporous silica and microporous zeolite Catal. Lett. 153 2022 41 53 S. Taghavi, C. Pizzolitto, E. Ghedini, F. Menegazzo, G. Cruciani, M. Peurla, K. Eränen, I. Heinmaa, A. Aho, N. Kumar, D.Y. Murzin, T. Salmi, M. Signoretto, Levulinic acid production: comparative assessment of Al-rich ordered mesoporous silica and microporous zeolite, Catal. Lett. 153 (2022) 41–53. [19] C.T. Van D. Underhill M.V. Rodrigues C. Sievers J.W. Medlin Enhanced hydrothermal stability of γ-Al2O3 catalyst supports with alkyl phosphonate coatings Langmuir 34 2018 3619 3625 C.T. Van, D. Underhill, M.V. Rodrigues, C. Sievers, J.W. Medlin, Enhanced hydrothermal stability of γ-Al2O3 catalyst supports with alkyl phosphonate coatings, Langmuir. 34 (2018) 3619–3625. [20] F.M. Harth B. Likozar M. Grilc Stability of solid rhenium catalysts for liquid-phase biomass valorization–various facets of catalyst deactivation and rhenium leaching Mater. Today Chem. 26 2022 101191 F.M. Harth, B. Likozar, M. Grilc, Stability of solid rhenium catalysts for liquid-phase biomass valorization–various facets of catalyst deactivation and rhenium leaching, Mater. Today Chem. 26 (2022) 101191. [21] J. Lee D.H.K. Jackson T. Li R.E. Winans J.A. Dumesic T.F. Kuech G.W. Huber Enhanced stability of cobalt catalysts by atomic layer deposition for aqueous-phase reactions Energy Environ. Sci. 7 2014 1657 1660 J. Lee, D.H.K. Jackson, T. Li, R.E. Winans, J.A. Dumesic, T.F. Kuech, G.W. Huber, Enhanced stability of cobalt catalysts by atomic layer deposition for aqueous-phase reactions, Energy Environ. Sci. 7 (2014) 1657–1660. [22] Z. Gao Y. Qin Design and properties of confined nanocatalysts by atomic layer deposition Acc. Chem. Res. 50 2017 2309 2316 Z. Gao, Y. Qin, Design and properties of confined nanocatalysts by atomic layer deposition, Acc. Chem. Res. 50 (2017) 2309–2316. [23] Y. Hao R. Liu X. Meng H. Cheng F. Zhao Deactivation of Au/TiO2 catalyst in the hydrogenation of o-chloronitrobenzene in the presence of CO2 J. Mol. Catal. A Chem. 335 2011 183 188 Y. Hao, R. Liu, X. Meng, H. Cheng, F. Zhao, Deactivation of Au/TiO2 catalyst in the hydrogenation of o-chloronitrobenzene in the presence of CO2, J. Mol. Catal. A Chem. 335 (2011) 183–188. [24] J. Huo R.L. Johnson P. Duan H.N. Pham D. Mendivelso-Perez E.A. Smith A.K. Datye K. Schmidt-Rohr B.H. Shanks Stability of Pd nanoparticles on carbon-coated supports under hydrothermal conditions Catal. Sci. Technol. 8 2018 1151 1160 J. Huo, R.L. Johnson, P. Duan, H.N. Pham, D. Mendivelso-Perez, E.A. Smith, A.K. Datye, K. Schmidt-Rohr, B.H. Shanks, Stability of Pd nanoparticles on carbon-coated supports under hydrothermal conditions, Catal. Sci. Technol. 8 (2018) 1151–1160. [25] H. Xiong H.N. Pham A.K. Datye Hydrothermally stable heterogeneous catalysts for conversion of biorenewables Green Chem. 16 2014 4627 4643 H. Xiong, H.N. Pham, A.K. Datye, Hydrothermally stable heterogeneous catalysts for conversion of biorenewables, Green Chem. 16 (2014) 4627–4643. [26] G. Gao P. Sun Y. Li F. Wang Z. Zhao Y. Qin F. Li Highly stable porous-carbon-coated Ni catalysts for the reductive amination of levulinic acid via an unconventional pathway ACS Catal. 7 2017 4927 4935 G. Gao, P. Sun, Y. Li, F. Wang, Z. Zhao, Y. Qin, F. Li, Highly stable porous-carbon-coated Ni catalysts for the reductive amination of levulinic acid via an unconventional pathway, ACS Catal. 7 (2017) 4927–4935. [27] Y. Cao M. Tang M. Li J. Deng F. Xu L. Xie Y. Wang In situ synthesis of chitin-derived Rh/N–C cataylsts: efficient hydrogenation of benzoic acid and derivatives ACS Sustain. Chem. Eng. 5 2017 9894 9902 Y. Cao, M. Tang, M. Li, J. Deng, F. Xu, L. Xie, Y. Wang, In situ synthesis of chitin-derived Rh/N–C cataylsts: efficient hydrogenation of benzoic acid and derivatives, ACS Sustain. Chem. Eng. 5 (2017) 9894–9902. [28] Y. Cao H. Zhang K. Liu Q. Zhang K.J. Chen Biowaste-derived bimetallic Ru–MoOx catalyst for the direct hydrogenation of furfural to tetrahydrofurfuryl alcohol ACS Sustain. Chem. Eng. 7 2019 12858 12866 Y. Cao, H. Zhang, K. Liu, Q. Zhang, K.J. Chen, Biowaste-derived bimetallic Ru–MoOx catalyst for the direct hydrogenation of furfural to tetrahydrofurfuryl alcohol, ACS Sustain. Chem. Eng. 7 (2019) 12858–12866. [29] Y. Cao B. Zhao X. Bao Y. Wang Fabricating Metal@N-doped carbon catalysts via a thermal method ACS Catal. 8 2018 7077 7085 Y. Cao, B. Zhao, X. Bao, Y. Wang, Fabricating Metal@N-doped carbon catalysts via a thermal method, ACS Catal. 8 (2018) 7077–7085. [30] K. Lu X. Kong J. Cai S. Yu X. Zhang Review on supported metal catalysts with partial/porous overlayers for stabilization Nanoscale 15 2023 8084 8109 K. Lu, X. Kong, J. Cai, S. Yu, X. Zhang, Review on supported metal catalysts with partial/porous overlayers for stabilization, Nanoscale. 15 (2023) 8084–8109. [31] X. Liu S. Ye G. Lan Atomic pyridinic nitrogen sites promoting levulinic acid hydrogenations over double-shelled hollow Ru/C nanoreactors Small 17 2021 2101271 X. Liu, S. Ye, G. Lan, Atomic pyridinic nitrogen sites promoting levulinic acid hydrogenations over double-shelled hollow Ru/C nanoreactors, Small. 17 (2021) 2101271. [32] X. Liu G. Lan P. Su Highly stable Ru nanoparticles incorporated in mesoporous carbon catalysts for production of γ-valerolactone Catal. Today 351 2020 75 82 X. Liu, G. Lan, P. Su, Highly stable Ru nanoparticles incorporated in mesoporous carbon catalysts for production of γ-valerolactone, Catal. Today. 351 (2020) 75–82. [33] A.H. Lu W.C. Li Z. Hou Molecular level dispersed Pd clusters in the carbon walls of ordered mesoporous carbon as a highly selective alcohol oxidation catalyst Chem. Commun. 2007 1038 1040 A.H. Lu, W.C. Li, Z. Hou, Molecular level dispersed Pd clusters in the carbon walls of ordered mesoporous carbon as a highly selective alcohol oxidation catalyst, Chem. Commun. (2007) 1038–1040. [34] Y. Li G. Lan H. Wang Controlled synthesis of highly dispersed semi-embedded ruthenium nanoparticles in porous carbon framework with more exposed active sites Catal. Commun. 20 2012 29 35 Y. Li, G. Lan, H. Wang, Controlled synthesis of highly dispersed semi-embedded ruthenium nanoparticles in porous carbon framework with more exposed active sites, Catal. Commun. 20 (2012) 29–35. [35] Z. Wei J. Lou C. Su An efficient and reusable embedded Ru catalyst for the hydrogenolysis of levulinic acid to γ-valerolactone ChemSusChem 10 2017 1720 1732 Z. Wei, J. Lou, C. Su, An efficient and reusable embedded Ru catalyst for the hydrogenolysis of levulinic acid to γ-valerolactone, ChemSusChem. 10 (2017) 1720–1732. [36] S. Rio G. Peru B. Leger Supported ruthenium nanoparticles on ordered mesoporous carbons using a cyclodextrin-assisted hard-template approach and their applications as hydrogenation catalysts J. Catal. 383 2020 343 356 S. Rio, G. Peru, B. Leger, Supported ruthenium nanoparticles on ordered mesoporous carbons using a cyclodextrin-assisted hard-template approach and their applications as hydrogenation catalysts, J. Catal. 383 (2020) 343–356. [37] H. Duan M. Wang Z. Zhang Biomass-derived photothermal carbon aerogel for efficient solar-driven seawater desalination J. Environ. Chem. Eng. 11 2023 109295 H. Duan, M. Wang, Z. Zhang, Biomass-derived photothermal carbon aerogel for efficient solar-driven seawater desalination, J. Environ. Chem. Eng. 11 (2023) 109295. [38] Y. Liu C. Su Y. Zu Ultrafast deposition of polydopamine for high-performance fiber-reinforced high-temperature ceramic composites Sci. Rep. 12 2022 20489 Y. Liu, C. Su, Y. Zu, Ultrafast deposition of polydopamine for high-performance fiber-reinforced high-temperature ceramic composites, Sci. Rep. 12 (2022) 20489. [39] J. Pan Y. Sun Y. Wu Yolk-double shells hierarchical N-doped carbon nanosphere as an electrochemical nanoreactor for high performance lithium-sulfur batteries Carbon 198 2022 80 90 J. Pan, Y. Sun, Y. Wu, Yolk-double shells hierarchical N-doped carbon nanosphere as an electrochemical nanoreactor for high performance lithium-sulfur batteries, Carbon. 198 (2022) 80–90. [40] N. Patel R. Fernandes S. Gupta Co-B catalyst supported over mesoporous silica for hydrogen production by catalytic hydrolysis of Ammonia Borane: a study on influence of pore structure Appl. Catal. B Environ. 140 2013 125 132 N. Patel, R. Fernandes, S. Gupta, Co-B catalyst supported over mesoporous silica for hydrogen production by catalytic hydrolysis of Ammonia Borane: a study on influence of pore structure, Appl. Catal. B Environ. 140 (2013) 125–132. [41] Y. Wang Y. Dou H. Zhang B. Gu C. Oldani Q. Tang F. Jing Q. Cao W. Fang Direct conversion of fructose to levulinic acid in water medium catalyzed by a reusable perfluorosulfonic acid Aquivion® resin Mol. Catal. 520 2022 112159 Y. Wang, Y. Dou, H. Zhang, B. Gu, C. Oldani, Q. Tang, F. Jing, Q. Cao, W. Fang, Direct conversion of fructose to levulinic acid in water medium catalyzed by a reusable perfluorosulfonic acid Aquivion® resin, Mol. Catal. 520 (2022) 112159. [42] Y. Lu Y. Wang Y. Wang Q. Cao X. Xie W. Fang Hydrogenation of levulinic acid to γ-valerolactone over bifunctional Ru/(AlO)(ZrO)n catalyst: effective control of Lewis acidity and surface synergy Mol. Catal. 493 2020 111097 Y. Lu, Y. Wang, Y. Wang, Q. Cao, X. Xie, W. Fang, Hydrogenation of levulinic acid to γ-valerolactone over bifunctional Ru/(AlO)(ZrO)n catalyst: effective control of Lewis acidity and surface synergy, Mol. Catal. 493 (2020) 111097. [43] R. Zhang Y. Wang W. Zhang Y. Lu Q. Tang Q. Cao B. Gu W. Fang Hydrogenation of levulinic acid to γ-valerolactone over single-atom Pt confined in Sn-modified MIL-101(Fe) Chem. Commun. 59 2023 9134 9137 R. Zhang, Y. Wang, W. Zhang, Y. Lu, Q. Tang, Q. Cao, B. Gu, W. Fang, Hydrogenation of levulinic acid to γ-valerolactone over single-atom Pt confined in Sn-modified MIL-101(Fe), Chem. Commun. 59 (2023) 9134–9137. [44] Y. Lu Y. Wang Q. Tang Q. Cao W. Fang Synergy in Sn-Mn oxide boosting the hydrogenation catalysis of supported Pt nanoparticles for selective conversion of levulinic acid Appl. Catal. B Environ. 300 2022 120746 Y. Lu, Y. Wang, Q. Tang, Q. Cao, W. Fang, Synergy in Sn-Mn oxide boosting the hydrogenation catalysis of supported Pt nanoparticles for selective conversion of levulinic acid, Appl. Catal. B Environ. 300 (2022) 120746. [45] Q. Zhang B. Gu W. Fang Sunlight-driven photocatalytic conversion of furfural and its derivatives Green Chem. 26 2024 6261 6288 Q. Zhang, B. Gu, W. Fang, Sunlight-driven photocatalytic conversion of furfural and its derivatives, Green Chem. 26 (2024) 6261–6288. [46] N. Wang X. Yu Y. Wang W. Chu M.B. Liu A comparison study on methane dry reforming with carbon dioxide over LaNiO3 perovskite catalysts supported on mesoporous SBA-15, MCM-41 and silica carrier Catal. Today 212 2013 98 107 N. Wang, X. Yu, Y. Wang, W. Chu, Liu M.B., A comparison study on methane dry reforming with carbon dioxide over LaNiO3 perovskite catalysts supported on mesoporous SBA-15, MCM-41 and silica carrier, Catal. Today. 212 (2013) 98–107. [47] M. Besson P. Gallezot Deactivation of metal catalysts in liquid phase organic reactions Catal. Today 81 2003 547 559 M. Besson, P. Gallezot, Deactivation of metal catalysts in liquid phase organic reactions, Catal. Today. 81 (2003) 547–559. [48] K. Fulajtárova T. Soták M. Hronec I. Vávra E. Dobročka M. Omastová Aqueous phase hydrogenation of furfural to furfuryl alcohol over Pd–Cu catalysts Appl. Catal. A 502 2015 78 85 K. Fulajtárova, T. Soták, M. Hronec, I. Vávra, E. Dobročka, M. Omastová, Aqueous phase hydrogenation of furfural to furfuryl alcohol over Pd–Cu catalysts, Appl. Catal. A. 502 (2015) 78–85.",
      "scopus-id": "85204607409",
      "coredata": {
        "eid": "1-s2.0-S2468823124007296",
        "dc:description": "Catalyst stability is believed to be one of the greatest challenges faced for the supported metal catalysts in the catalytic conversion of biomass and its derivatives because many biomass transformations are conducted in the aqueous phase. In this work, we report a simple yet efficient coating-impregnation-pyrolysis (CIP) strategy to fabricate Al2O3 supported Ru catalyst (Ru-Al2O3@CN) with Ru NPs (nanoparticles) semi-embedded into N-doped carbon (CN) layer for the efficient hydrogenation of levulinic acid (LA) to γ-valerolactone in the aqueous phase. Benefit from the special structure of Ru-Al2O3@CN catalyst, it possesses both high catalytic activity and stability, giving a TOF of 28,099 h-1 for LA hydrogenation at 120 °C and 2 MPa H2, which is superior to the most of reported Ru-based catalysts. More importantly, compared with conventional impregnated Ru/Al2O3 catalyst, the Ru-Al2O3@CN catalyst exhibits a remarkably improved hydrothermal stability. Based on series of catalyst characterizations and control experiments, it was found that the presence of CN can weak the interaction between Ru and Al2O3, as well as protect the Al2O3 and Ru NPs from hydrolysis and aggregation, respectively. We anticipate that such a novel strategy may provide some valuable insights into the synthesis of oxides-supported metal catalyst with high hydrothermal stability.",
        "openArchiveArticle": "false",
        "prism:coverDate": "2024-12-31",
        "openaccessUserLicense": null,
        "prism:aggregationType": "Journal",
        "prism:url": "https://api.elsevier.com/content/article/pii/S2468823124007296",
        "dc:creator": [
          {
            "@_fa": "true",
            "$": "Cao, Yueling"
          },
          {
            "@_fa": "true",
            "$": "Li, Haoyang"
          },
          {
            "@_fa": "true",
            "$": "Ma, Fubin"
          },
          {
            "@_fa": "true",
            "$": "Wen, Hao"
          },
          {
            "@_fa": "true",
            "$": "Wang, Jinhui"
          },
          {
            "@_fa": "true",
            "$": "Zhang, Hepeng"
          }
        ],
        "link": [
          {
            "@_fa": "true",
            "@rel": "self",
            "@href": "https://api.elsevier.com/content/article/pii/S2468823124007296"
          },
          {
            "@_fa": "true",
            "@rel": "scidir",
            "@href": "https://www.sciencedirect.com/science/article/pii/S2468823124007296"
          }
        ],
        "dc:format": "application/json",
        "openaccessType": null,
        "pii": "S2468-8231(24)00729-6",
        "prism:volume": "569",
        "articleNumber": "114547",
        "prism:publisher": "Elsevier B.V. All rights are reserved, including those for text and data mining, AI training, and similar technologies.",
        "dc:title": "Enhanced hydrothermal stability by a semi-embedded structure: An efficient Ru catalyst for levulinic acid conversion in the aqueous phase",
        "prism:copyright": "© 2024 Elsevier B.V. All rights are reserved, including those for text and data mining, AI training, and similar technologies.",
        "openaccess": "0",
        "prism:issn": "24688231",
        "dcterms:subject": [
          {
            "@_fa": "true",
            "$": "Biomass"
          },
          {
            "@_fa": "true",
            "$": "Catalyst stability"
          },
          {
            "@_fa": "true",
            "$": "Levulinic acid"
          },
          {
            "@_fa": "true",
            "$": "Coating-impregnation-pyrolysis strategy"
          },
          {
            "@_fa": "true",
            "$": "Embedded structure"
          }
        ],
        "openaccessArticle": "false",
        "prism:publicationName": "Molecular Catalysis",
        "openaccessSponsorType": null,
        "prism:pageRange": "114547",
        "pubType": "fla",
        "prism:coverDisplayDate": "December 2024",
        "prism:doi": "10.1016/j.mcat.2024.114547",
        "prism:startingPage": "114547",
        "dc:identifier": "doi:10.1016/j.mcat.2024.114547",
        "openaccessSponsorName": null
      },
      "objects": {
        "object": [
          {
            "@category": "standard",
            "@height": "582",
            "@width": "553",
            "@_fa": "true",
            "$": "https://api.elsevier.com/content/object/eid/1-s2.0-S2468823124007296-gr8.jpg?httpAccept=%2A%2F%2A",
            "@multimediatype": "JPEG image file",
            "@type": "IMAGE-DOWNSAMPLED",
            "@size": "58802",
            "@ref": "gr8",
            "@mimetype": "image/jpeg"
          },
          {
            "@category": "standard",
            "@height": "525",
            "@width": "659",
            "@_fa": "true",
            "$": "https://api.elsevier.com/content/object/eid/1-s2.0-S2468823124007296-gr5.jpg?httpAccept=%2A%2F%2A",
            "@multimediatype": "JPEG image file",
            "@type": "IMAGE-DOWNSAMPLED",
            "@size": "93765",
            "@ref": "gr5",
            "@mimetype": "image/jpeg"
          },
          {
            "@category": "standard",
            "@height": "263",
            "@width": "659",
            "@_fa": "true",
            "$": "https://api.elsevier.com/content/object/eid/1-s2.0-S2468823124007296-gr4.jpg?httpAccept=%2A%2F%2A",
            "@multimediatype": "JPEG image file",
            "@type": "IMAGE-DOWNSAMPLED",
            "@size": "44527",
            "@ref": "gr4",
            "@mimetype": "image/jpeg"
          },
          {
            "@category": "standard",
            "@height": "259",
            "@width": "659",
            "@_fa": "true",
            "$": "https://api.elsevier.com/content/object/eid/1-s2.0-S2468823124007296-gr7.jpg?httpAccept=%2A%2F%2A",
            "@multimediatype": "JPEG image file",
            "@type": "IMAGE-DOWNSAMPLED",
            "@size": "44595",
            "@ref": "gr7",
            "@mimetype": "image/jpeg"
          },
          {
            "@category": "standard",
            "@height": "487",
            "@width": "791",
            "@_fa": "true",
            "$": "https://api.elsevier.com/content/object/eid/1-s2.0-S2468823124007296-gr6.jpg?httpAccept=%2A%2F%2A",
            "@multimediatype": "JPEG image file",
            "@type": "IMAGE-DOWNSAMPLED",
            "@size": "140994",
            "@ref": "gr6",
            "@mimetype": "image/jpeg"
          },
          {
            "@category": "standard",
            "@height": "266",
            "@width": "659",
            "@_fa": "true",
            "$": "https://api.elsevier.com/content/object/eid/1-s2.0-S2468823124007296-gr1.jpg?httpAccept=%2A%2F%2A",
            "@multimediatype": "JPEG image file",
            "@type": "IMAGE-DOWNSAMPLED",
            "@size": "55690",
            "@ref": "gr1",
            "@mimetype": "image/jpeg"
          },
          {
            "@category": "standard",
            "@height": "443",
            "@width": "659",
            "@_fa": "true",
            "$": "https://api.elsevier.com/content/object/eid/1-s2.0-S2468823124007296-gr3.jpg?httpAccept=%2A%2F%2A",
            "@multimediatype": "JPEG image file",
            "@type": "IMAGE-DOWNSAMPLED",
            "@size": "162059",
            "@ref": "gr3",
            "@mimetype": "image/jpeg"
          },
          {
            "@category": "standard",
            "@height": "647",
            "@width": "659",
            "@_fa": "true",
            "$": "https://api.elsevier.com/content/object/eid/1-s2.0-S2468823124007296-gr2.jpg?httpAccept=%2A%2F%2A",
            "@multimediatype": "JPEG image file",
            "@type": "IMAGE-DOWNSAMPLED",
            "@size": "156916",
            "@ref": "gr2",
            "@mimetype": "image/jpeg"
          },
          {
            "@category": "standard",
            "@height": "200",
            "@width": "283",
            "@_fa": "true",
            "$": "https://api.elsevier.com/content/object/eid/1-s2.0-S2468823124007296-ga1.jpg?httpAccept=%2A%2F%2A",
            "@multimediatype": "JPEG image file",
            "@type": "IMAGE-DOWNSAMPLED",
            "@size": "27087",
            "@ref": "ga1",
            "@mimetype": "image/jpeg"
          },
          {
            "@category": "standard",
            "@height": "327",
            "@width": "791",
            "@_fa": "true",
            "$": "https://api.elsevier.com/content/object/eid/1-s2.0-S2468823124007296-sc1.jpg?httpAccept=%2A%2F%2A",
            "@multimediatype": "JPEG image file",
            "@type": "IMAGE-DOWNSAMPLED",
            "@size": "74338",
            "@ref": "sc1",
            "@mimetype": "image/jpeg"
          },
          {
            "@category": "thumbnail",
            "@height": "164",
            "@width": "156",
            "@_fa": "true",
            "$": "https://api.elsevier.com/content/object/eid/1-s2.0-S2468823124007296-gr8.sml?httpAccept=%2A%2F%2A",
            "@multimediatype": "GIF image file",
            "@type": "IMAGE-THUMBNAIL",
            "@size": "8663",
            "@ref": "gr8",
            "@mimetype": "image/gif"
          },
          {
            "@category": "thumbnail",
            "@height": "164",
            "@width": "206",
            "@_fa": "true",
            "$": "https://api.elsevier.com/content/object/eid/1-s2.0-S2468823124007296-gr5.sml?httpAccept=%2A%2F%2A",
            "@multimediatype": "GIF image file",
            "@type": "IMAGE-THUMBNAIL",
            "@size": "14914",
            "@ref": "gr5",
            "@mimetype": "image/gif"
          },
          {
            "@category": "thumbnail",
            "@height": "87",
            "@width": "219",
            "@_fa": "true",
            "$": "https://api.elsevier.com/content/object/eid/1-s2.0-S2468823124007296-gr4.sml?httpAccept=%2A%2F%2A",
            "@multimediatype": "GIF image file",
            "@type": "IMAGE-THUMBNAIL",
            "@size": "7810",
            "@ref": "gr4",
            "@mimetype": "image/gif"
          },
          {
            "@category": "thumbnail",
            "@height": "86",
            "@width": "219",
            "@_fa": "true",
            "$": "https://api.elsevier.com/content/object/eid/1-s2.0-S2468823124007296-gr7.sml?httpAccept=%2A%2F%2A",
            "@multimediatype": "GIF image file",
            "@type": "IMAGE-THUMBNAIL",
            "@size": "13922",
            "@ref": "gr7",
            "@mimetype": "image/gif"
          },
          {
            "@category": "thumbnail",
            "@height": "135",
            "@width": "219",
            "@_fa": "true",
            "$": "https://api.elsevier.com/content/object/eid/1-s2.0-S2468823124007296-gr6.sml?httpAccept=%2A%2F%2A",
            "@multimediatype": "GIF image file",
            "@type": "IMAGE-THUMBNAIL",
            "@size": "19146",
            "@ref": "gr6",
            "@mimetype": "image/gif"
          },
          {
            "@category": "thumbnail",
            "@height": "89",
            "@width": "219",
            "@_fa": "true",
            "$": "https://api.elsevier.com/content/object/eid/1-s2.0-S2468823124007296-gr1.sml?httpAccept=%2A%2F%2A",
            "@multimediatype": "GIF image file",
            "@type": "IMAGE-THUMBNAIL",
            "@size": "9504",
            "@ref": "gr1",
            "@mimetype": "image/gif"
          },
          {
            "@category": "thumbnail",
            "@height": "147",
            "@width": "219",
            "@_fa": "true",
            "$": "https://api.elsevier.com/content/object/eid/1-s2.0-S2468823124007296-gr3.sml?httpAccept=%2A%2F%2A",
            "@multimediatype": "GIF image file",
            "@type": "IMAGE-THUMBNAIL",
            "@size": "19649",
            "@ref": "gr3",
            "@mimetype": "image/gif"
          },
          {
            "@category": "thumbnail",
            "@height": "164",
            "@width": "167",
            "@_fa": "true",
            "$": "https://api.elsevier.com/content/object/eid/1-s2.0-S2468823124007296-gr2.sml?httpAccept=%2A%2F%2A",
            "@multimediatype": "GIF image file",
            "@type": "IMAGE-THUMBNAIL",
            "@size": "16652",
            "@ref": "gr2",
            "@mimetype": "image/gif"
          },
          {
            "@category": "thumbnail",
            "@height": "154",
            "@width": "219",
            "@_fa": "true",
            "$": "https://api.elsevier.com/content/object/eid/1-s2.0-S2468823124007296-ga1.sml?httpAccept=%2A%2F%2A",
            "@multimediatype": "GIF image file",
            "@type": "IMAGE-THUMBNAIL",
            "@size": "19956",
            "@ref": "ga1",
            "@mimetype": "image/gif"
          },
          {
            "@category": "thumbnail",
            "@height": "91",
            "@width": "219",
            "@_fa": "true",
            "$": "https://api.elsevier.com/content/object/eid/1-s2.0-S2468823124007296-sc1.sml?httpAccept=%2A%2F%2A",
            "@multimediatype": "GIF image file",
            "@type": "IMAGE-THUMBNAIL",
            "@size": "11109",
            "@ref": "sc1",
            "@mimetype": "image/gif"
          },
          {
            "@category": "high",
            "@height": "2576",
            "@width": "2448",
            "@_fa": "true",
            "$": "https://api.elsevier.com/content/object/eid/1-s2.0-S2468823124007296-gr8_lrg.jpg?httpAccept=%2A%2F%2A",
            "@multimediatype": "JPEG image file",
            "@type": "IMAGE-HIGH-RES",
            "@size": "322143",
            "@ref": "gr8",
            "@mimetype": "image/jpeg"
          },
          {
            "@category": "high",
            "@height": "2324",
            "@width": "2917",
            "@_fa": "true",
            "$": "https://api.elsevier.com/content/object/eid/1-s2.0-S2468823124007296-gr5_lrg.jpg?httpAccept=%2A%2F%2A",
            "@multimediatype": "JPEG image file",
            "@type": "IMAGE-HIGH-RES",
            "@size": "656333",
            "@ref": "gr5",
            "@mimetype": "image/jpeg"
          },
          {
            "@category": "high",
            "@height": "1164",
            "@width": "2917",
            "@_fa": "true",
            "$": "https://api.elsevier.com/content/object/eid/1-s2.0-S2468823124007296-gr4_lrg.jpg?httpAccept=%2A%2F%2A",
            "@multimediatype": "JPEG image file",
            "@type": "IMAGE-HIGH-RES",
            "@size": "278560",
            "@ref": "gr4",
            "@mimetype": "image/jpeg"
          },
          {
            "@category": "high",
            "@height": "1148",
            "@width": "2917",
            "@_fa": "true",
            "$": "https://api.elsevier.com/content/object/eid/1-s2.0-S2468823124007296-gr7_lrg.jpg?httpAccept=%2A%2F%2A",
            "@multimediatype": "JPEG image file",
            "@type": "IMAGE-HIGH-RES",
            "@size": "338238",
            "@ref": "gr7",
            "@mimetype": "image/jpeg"
          },
          {
            "@category": "high",
            "@height": "2155",
            "@width": "3500",
            "@_fa": "true",
            "$": "https://api.elsevier.com/content/object/eid/1-s2.0-S2468823124007296-gr6_lrg.jpg?httpAccept=%2A%2F%2A",
            "@multimediatype": "JPEG image file",
            "@type": "IMAGE-HIGH-RES",
            "@size": "1619958",
            "@ref": "gr6",
            "@mimetype": "image/jpeg"
          },
          {
            "@category": "high",
            "@height": "1179",
            "@width": "2917",
            "@_fa": "true",
            "$": "https://api.elsevier.com/content/object/eid/1-s2.0-S2468823124007296-gr1_lrg.jpg?httpAccept=%2A%2F%2A",
            "@multimediatype": "JPEG image file",
            "@type": "IMAGE-HIGH-RES",
            "@size": "377097",
            "@ref": "gr1",
            "@mimetype": "image/jpeg"
          },
          {
            "@category": "high",
            "@height": "1963",
            "@width": "2917",
            "@_fa": "true",
            "$": "https://api.elsevier.com/content/object/eid/1-s2.0-S2468823124007296-gr3_lrg.jpg?httpAccept=%2A%2F%2A",
            "@multimediatype": "JPEG image file",
            "@type": "IMAGE-HIGH-RES",
            "@size": "1156209",
            "@ref": "gr3",
            "@mimetype": "image/jpeg"
          },
          {
            "@category": "high",
            "@height": "2866",
            "@width": "2917",
            "@_fa": "true",
            "$": "https://api.elsevier.com/content/object/eid/1-s2.0-S2468823124007296-gr2_lrg.jpg?httpAccept=%2A%2F%2A",
            "@multimediatype": "JPEG image file",
            "@type": "IMAGE-HIGH-RES",
            "@size": "1474333",
            "@ref": "gr2",
            "@mimetype": "image/jpeg"
          },
          {
            "@category": "high",
            "@height": "886",
            "@width": "1256",
            "@_fa": "true",
            "$": "https://api.elsevier.com/content/object/eid/1-s2.0-S2468823124007296-ga1_lrg.jpg?httpAccept=%2A%2F%2A",
            "@multimediatype": "JPEG image file",
            "@type": "IMAGE-HIGH-RES",
            "@size": "200437",
            "@ref": "ga1",
            "@mimetype": "image/jpeg"
          },
          {
            "@category": "high",
            "@height": "1449",
            "@width": "3500",
            "@_fa": "true",
            "$": "https://api.elsevier.com/content/object/eid/1-s2.0-S2468823124007296-sc1_lrg.jpg?httpAccept=%2A%2F%2A",
            "@multimediatype": "JPEG image file",
            "@type": "IMAGE-HIGH-RES",
            "@size": "574825",
            "@ref": "sc1",
            "@mimetype": "image/jpeg"
          },
          {
            "@category": "standard",
            "@_fa": "true",
            "$": "https://api.elsevier.com/content/object/eid/1-s2.0-S2468823124007296-mmc1.docx?httpAccept=%2A%2F%2A",
            "@multimediatype": "Microsoft Word file",
            "@type": "APPLICATION",
            "@size": "907457",
            "@ref": "mmc1",
            "@mimetype": "application/word"
          }
        ]
      },
      "link": {
        "@rel": "abstract",
        "@href": "https://api.elsevier.com/content/abstract/scopus_id/85204607409"
      }
    }
  }
}