{
  "metadata": {
    "title": "MOF derived non-noble metal catalysts to control the distribution of furfural selective hydrogenation products",
    "authors": "; ; ",
    "journal": "Molecular Catalysis",
    "date": "2021-08-31",
    "doi": "10.1016/j.mcat.2021.111824",
    "abstract": "",
    "uri": "https://api.elsevier.com/content/article/pii/S2468823121004417",
    "pii": "S2468823121004417"
  },
  "fulltext": {
    "full-text-retrieval-response": {
      "scopus-eid": "2-s2.0-85112515217",
      "originalText": "serial JL 315758 291210 291744 291790 291809 31 Molecular Catalysis MOLECULARCATALYSIS 2021-08-14 2021-08-14 2021-08-14 2021-08-14 2022-04-22T11:57:53 1-s2.0-S2468823121004417 S2468-8231(21)00441-7 S2468823121004417 10.1016/j.mcat.2021.111824 S300 S300.1 FULL-TEXT 1-s2.0-S2468823121X00132 2022-12-12T23:36:21.627889Z 0 0 20210801 20210831 2021 2021-08-14T17:26:43.065835Z absattachment articleinfo articlenumber articletitlenorm authfirstinitialnorm authfirstsurnamenorm cid cids contenttype copyright crossmark dateloaded dateloadedtxt datesearch datesort dateupdated dco docsubtype doctype doi eid ewtransactionid hubeid indexeddate issn issnnorm itemstage itemtransactionid itemweight openaccess openarchive pg pgfirst pii piinorm pubdateend pubdatestart pubdatetxt pubyr sectiontitle sortorder srctitle srctitlenorm srctype ssids alllist content subj subheadings suppl tomb volfirst volissue volumelist webpdf webpdfpagecount yearnav figure e-component body mmlmath acknowledge affil appendices articletitle auth authfirstini authfull authkeywords authlast grantnumber grantsponsor highlightsabst orcid primabst ref specialabst 2468-8231 24688231 true 513 513 C Volume 513 29 111824 111824 111824 202108 August 2021 2021-08-01 2021-08-31 2021 Regular Papers article fla © 2021 Elsevier B.V. All rights reserved. MOFDERIVEDNONNOBLEMETALCATALYSTSCONTROLDISTRIBUTIONFURFURALSELECTIVEHYDROGENATIONPRODUCTS LI Z Introduction Experimental Synthesis of ZnCo-ZIF-US Preparation of ZnCo-US@NC-T Preparation of comparative samples Catalytic performance evaluation Results and discussion Material characterization Catalytic performance evaluation and optimization Recycle Experiment CONCLUSION CRediT author statement Acknowledgements Appendix Supplementary materials Reference BHAT 2021 111484 N WANG 2020 19377 19383 S LI 2021 111538 W LEE 2020 302 312 J KUNKES 2008 417 421 E WU 2020 6198 6223 X HUO 2020 14514 14523 J DU 2020 327 338 Z LI 2020 14665 14672 Y SILVA 2021 111496 W DELBECQ 2018 146 F LEE 2021 291 300 H KALONG 2021 106721 M MENG 2020 69 79 X ISHIKAWA 2021 750 757 H SITTIWONG 2021 111471 J ZHAO 2019 431 436 Z CHUSEANG 2021 1379 1393 J DENG 2018 14481 14489 Y DU 2020 117598 H WANG 2021 111599 Z GARCIAOLMO 2017 5599 5604 A WANG 2018 9831 9844 Y WANG 2018 3459 3468 Y WANG 2019 796 828 Y FAN 2021 1110 1118 Y MA 2020 117709 M GONG 2017 2172 2180 W BIRADAR 2014 272 281 N WANG 2018 2121 2128 H GONG 2017 51 59 W LEE 2020 71 79 J ROGERS 2017 2266 2274 S GOH 2019 23254 23260 T BAGNATO 2018 4955 4965 G LIU 2020 119569 W HUANG 2016 14104 14108 S NANDI 2018 24480 24490 S KHEMTHONG 2021 106033 P ZHOU 2017 522 532 P LONG 2018 8506 8512 Y JI 2019 4271 4275 S YE 2020 57847 57858 H CHENG 2018 1801257 N XUE 2020 4432 4442 Y CAI 2019 1804903 Z WU 2021 10855 10869 C ZURRER 2020 2007624 T WANG 2021 2006351 Y DAI 2017 11568 11571 X LIU 2021 127569 X YANG 2016 16057 16063 F ZHU 2020 1811 1821 J FAN 2020 18296 18304 Y CHEN 2021 9885 9896 Y WANG 2018 1705048 T XU 2021 1451 1457 L LI 2021 8507 8517 S SEOANE 2012 3103 3107 B LIX2021X111824 LIX2021X111824XZ 2023-08-14T00:00:00.000Z 2023-08-14T00:00:00.000Z http://creativecommons.org/licenses/by-nc-nd/4.0/ © 2021 Elsevier B.V. All rights reserved. 0 https://doi.org/10.15223/policy-017 https://doi.org/10.15223/policy-037 https://doi.org/10.15223/policy-012 https://doi.org/10.15223/policy-029 https://doi.org/10.15223/policy-004 item S2468-8231(21)00441-7 S2468823121004417 1-s2.0-S2468823121004417 10.1016/j.mcat.2021.111824 315758 2022-07-28T23:58:30.634853Z 2021-08-01 2021-08-31 1-s2.0-S2468823121004417-main.pdf https://s3-eu-west-1.amazonaws.com/prod-ucs-content-store-eu-west/content/pii:S2468823121004417/MAIN/application/pdf/5680da5788ca42ba3a916e6d674ab5c6/main.pdf main.pdf pdf true 9984534 MAIN 10 1-s2.0-S2468823121004417-main_1.png https://s3-eu-west-1.amazonaws.com/prod-ucs-content-store-eu-west/content/pii:S2468823121004417/PREVIEW/image/png/e8a8e28269c05950dbc8e6a228965ab5/main_1.png main_1.png png 59495 849 656 IMAGE-WEB-PDF 1 1-s2.0-S2468823121004417-gr9.jpg https://s3-eu-west-1.amazonaws.com/prod-ucs-content-store-eu-west/content/pii:S2468823121004417/gr9/DOWNSAMPLED/image/jpeg/b370c3dcaf36cdf29adc2a8d4d3c806f/gr9.jpg gr9 gr9.jpg jpg 86941 481 678 IMAGE-DOWNSAMPLED 1-s2.0-S2468823121004417-gr6.jpg https://s3-eu-west-1.amazonaws.com/prod-ucs-content-store-eu-west/content/pii:S2468823121004417/gr6/DOWNSAMPLED/image/jpeg/9c5b6d616164d870f852829d92eb0e74/gr6.jpg gr6 gr6.jpg jpg 76838 489 659 IMAGE-DOWNSAMPLED 1-s2.0-S2468823121004417-gr5.jpg https://s3-eu-west-1.amazonaws.com/prod-ucs-content-store-eu-west/content/pii:S2468823121004417/gr5/DOWNSAMPLED/image/jpeg/b3c32d33eb49884b0cec61383f8e5b03/gr5.jpg gr5 gr5.jpg jpg 77697 563 565 IMAGE-DOWNSAMPLED 1-s2.0-S2468823121004417-gr8.jpg https://s3-eu-west-1.amazonaws.com/prod-ucs-content-store-eu-west/content/pii:S2468823121004417/gr8/DOWNSAMPLED/image/jpeg/395b870e62f2fb76176a8f7d0442986d/gr8.jpg gr8 gr8.jpg jpg 36964 398 527 IMAGE-DOWNSAMPLED 1-s2.0-S2468823121004417-gr7.jpg https://s3-eu-west-1.amazonaws.com/prod-ucs-content-store-eu-west/content/pii:S2468823121004417/gr7/DOWNSAMPLED/image/jpeg/8ef3f2719cd6aa77bb0889eee6c2cdff/gr7.jpg gr7 gr7.jpg jpg 44304 248 659 IMAGE-DOWNSAMPLED 1-s2.0-S2468823121004417-gr2.jpg https://s3-eu-west-1.amazonaws.com/prod-ucs-content-store-eu-west/content/pii:S2468823121004417/gr2/DOWNSAMPLED/image/jpeg/7b5250f451a61a16938d40e2f05b0a60/gr2.jpg gr2 gr2.jpg jpg 61589 339 678 IMAGE-DOWNSAMPLED 1-s2.0-S2468823121004417-ga1.jpg https://s3-eu-west-1.amazonaws.com/prod-ucs-content-store-eu-west/content/pii:S2468823121004417/ga1/DOWNSAMPLED/image/jpeg/039472c6ecde2d01e969d22f80458644/ga1.jpg ga1 true ga1.jpg jpg 21821 200 229 IMAGE-DOWNSAMPLED 1-s2.0-S2468823121004417-gr1.jpg https://s3-eu-west-1.amazonaws.com/prod-ucs-content-store-eu-west/content/pii:S2468823121004417/gr1/DOWNSAMPLED/image/jpeg/4205d9f94e8074f1aeab69d6e88f7610/gr1.jpg gr1 gr1.jpg jpg 71414 405 659 IMAGE-DOWNSAMPLED 1-s2.0-S2468823121004417-gr4.jpg https://s3-eu-west-1.amazonaws.com/prod-ucs-content-store-eu-west/content/pii:S2468823121004417/gr4/DOWNSAMPLED/image/jpeg/2b3263a30009a8561e90a3ed9dd5feae/gr4.jpg gr4 gr4.jpg jpg 88251 562 659 IMAGE-DOWNSAMPLED 1-s2.0-S2468823121004417-gr3.jpg https://s3-eu-west-1.amazonaws.com/prod-ucs-content-store-eu-west/content/pii:S2468823121004417/gr3/DOWNSAMPLED/image/jpeg/5d42f93ab541382e418f27f2442f596f/gr3.jpg gr3 gr3.jpg jpg 159656 651 659 IMAGE-DOWNSAMPLED 1-s2.0-S2468823121004417-gr9.sml https://s3-eu-west-1.amazonaws.com/prod-ucs-content-store-eu-west/content/pii:S2468823121004417/gr9/THUMBNAIL/image/gif/73ec3b04b8c3cdd31f4c1d5c5ddc6ddb/gr9.sml gr9 gr9.sml sml 16408 155 219 IMAGE-THUMBNAIL 1-s2.0-S2468823121004417-gr6.sml https://s3-eu-west-1.amazonaws.com/prod-ucs-content-store-eu-west/content/pii:S2468823121004417/gr6/THUMBNAIL/image/gif/9b795c48a855d905cab35e583c3b9d92/gr6.sml gr6 gr6.sml sml 10856 162 219 IMAGE-THUMBNAIL 1-s2.0-S2468823121004417-gr5.sml https://s3-eu-west-1.amazonaws.com/prod-ucs-content-store-eu-west/content/pii:S2468823121004417/gr5/THUMBNAIL/image/gif/8959f428196fc94859e3d70129929689/gr5.sml gr5 gr5.sml sml 14885 163 164 IMAGE-THUMBNAIL 1-s2.0-S2468823121004417-gr8.sml https://s3-eu-west-1.amazonaws.com/prod-ucs-content-store-eu-west/content/pii:S2468823121004417/gr8/THUMBNAIL/image/gif/5f482e9db9d43a0cc176eeeed2e7e641/gr8.sml gr8 gr8.sml sml 11563 164 217 IMAGE-THUMBNAIL 1-s2.0-S2468823121004417-gr7.sml https://s3-eu-west-1.amazonaws.com/prod-ucs-content-store-eu-west/content/pii:S2468823121004417/gr7/THUMBNAIL/image/gif/754dbe38e26fc76792d10e5b33aaa1a1/gr7.sml gr7 gr7.sml sml 7669 82 219 IMAGE-THUMBNAIL 1-s2.0-S2468823121004417-gr2.sml https://s3-eu-west-1.amazonaws.com/prod-ucs-content-store-eu-west/content/pii:S2468823121004417/gr2/THUMBNAIL/image/gif/2274fe4e8f1a0728f9b41fef874058c6/gr2.sml gr2 gr2.sml sml 16016 110 219 IMAGE-THUMBNAIL 1-s2.0-S2468823121004417-ga1.sml https://s3-eu-west-1.amazonaws.com/prod-ucs-content-store-eu-west/content/pii:S2468823121004417/ga1/THUMBNAIL/image/gif/50eef6920012bafa6413a01a4f1c5993/ga1.sml ga1 true ga1.sml sml 16374 164 188 IMAGE-THUMBNAIL 1-s2.0-S2468823121004417-gr1.sml https://s3-eu-west-1.amazonaws.com/prod-ucs-content-store-eu-west/content/pii:S2468823121004417/gr1/THUMBNAIL/image/gif/1d7d927a459db0a121057e3622a8f96a/gr1.sml gr1 gr1.sml sml 10538 135 219 IMAGE-THUMBNAIL 1-s2.0-S2468823121004417-gr4.sml https://s3-eu-west-1.amazonaws.com/prod-ucs-content-store-eu-west/content/pii:S2468823121004417/gr4/THUMBNAIL/image/gif/f2daa6728ab433f6a456343a6890f691/gr4.sml gr4 gr4.sml sml 14567 164 192 IMAGE-THUMBNAIL 1-s2.0-S2468823121004417-gr3.sml https://s3-eu-west-1.amazonaws.com/prod-ucs-content-store-eu-west/content/pii:S2468823121004417/gr3/THUMBNAIL/image/gif/6a429cefc433831ee5af9f1133dc133a/gr3.sml gr3 gr3.sml sml 23790 164 166 IMAGE-THUMBNAIL 1-s2.0-S2468823121004417-gr9_lrg.jpg https://s3-eu-west-1.amazonaws.com/prod-ucs-content-store-eu-west/content/pii:S2468823121004417/gr9/HIGHRES/image/jpeg/8b28fdd6e21be70497b47a4c12d7bbd8/gr9_lrg.jpg gr9 gr9_lrg.jpg jpg 766829 2127 3000 IMAGE-HIGH-RES 1-s2.0-S2468823121004417-gr6_lrg.jpg https://s3-eu-west-1.amazonaws.com/prod-ucs-content-store-eu-west/content/pii:S2468823121004417/gr6/HIGHRES/image/jpeg/a53512424b7109c64c2a5719b8e66f39/gr6_lrg.jpg gr6 gr6_lrg.jpg jpg 543330 2163 2916 IMAGE-HIGH-RES 1-s2.0-S2468823121004417-gr5_lrg.jpg https://s3-eu-west-1.amazonaws.com/prod-ucs-content-store-eu-west/content/pii:S2468823121004417/gr5/HIGHRES/image/jpeg/543e72fa998e08068187edec2f21b51e/gr5_lrg.jpg gr5 gr5_lrg.jpg jpg 695441 2489 2500 IMAGE-HIGH-RES 1-s2.0-S2468823121004417-gr8_lrg.jpg https://s3-eu-west-1.amazonaws.com/prod-ucs-content-store-eu-west/content/pii:S2468823121004417/gr8/HIGHRES/image/jpeg/d782b0f3e2222f6671f8e628d764bb81/gr8_lrg.jpg gr8 gr8_lrg.jpg jpg 341486 1764 2333 IMAGE-HIGH-RES 1-s2.0-S2468823121004417-gr7_lrg.jpg https://s3-eu-west-1.amazonaws.com/prod-ucs-content-store-eu-west/content/pii:S2468823121004417/gr7/HIGHRES/image/jpeg/4926edcc219c471a91d0707a80ec9bb6/gr7_lrg.jpg gr7 gr7_lrg.jpg jpg 321404 1096 2917 IMAGE-HIGH-RES 1-s2.0-S2468823121004417-gr2_lrg.jpg https://s3-eu-west-1.amazonaws.com/prod-ucs-content-store-eu-west/content/pii:S2468823121004417/gr2/HIGHRES/image/jpeg/d962c8e5c5e0e782b8d76c6d9860d71f/gr2_lrg.jpg gr2 gr2_lrg.jpg jpg 581631 1501 3000 IMAGE-HIGH-RES 1-s2.0-S2468823121004417-ga1_lrg.jpg https://s3-eu-west-1.amazonaws.com/prod-ucs-content-store-eu-west/content/pii:S2468823121004417/ga1/HIGHRES/image/jpeg/a4472f7fc95f77d22559722899a97e2a/ga1_lrg.jpg ga1 true ga1_lrg.jpg jpg 147242 886 1017 IMAGE-HIGH-RES 1-s2.0-S2468823121004417-gr1_lrg.jpg https://s3-eu-west-1.amazonaws.com/prod-ucs-content-store-eu-west/content/pii:S2468823121004417/gr1/HIGHRES/image/jpeg/9a2cd6427105c5c4974b8b34d41aff7e/gr1_lrg.jpg gr1 gr1_lrg.jpg jpg 489486 1791 2916 IMAGE-HIGH-RES 1-s2.0-S2468823121004417-gr4_lrg.jpg https://s3-eu-west-1.amazonaws.com/prod-ucs-content-store-eu-west/content/pii:S2468823121004417/gr4/HIGHRES/image/jpeg/fcb2b7d1883da821970d4270d779906c/gr4_lrg.jpg gr4 gr4_lrg.jpg jpg 743133 2489 2917 IMAGE-HIGH-RES 1-s2.0-S2468823121004417-gr3_lrg.jpg https://s3-eu-west-1.amazonaws.com/prod-ucs-content-store-eu-west/content/pii:S2468823121004417/gr3/HIGHRES/image/jpeg/825230285da0dc69680e6cd3edd54d66/gr3_lrg.jpg gr3 gr3_lrg.jpg jpg 1531498 2883 2917 IMAGE-HIGH-RES 1-s2.0-S2468823121004417-mmc1.docx https://s3-eu-west-1.amazonaws.com/prod-ucs-content-store-eu-west/content/pii:S2468823121004417/mmc1/MAIN/application/vnd.openxmlformats-officedocument.wordprocessingml.document/36ed3790dbe45d33d762a7a9d866060d/mmc1.docx mmc1 mmc1.docx docx 2112289 APPLICATION 1-s2.0-S2468823121004417-si1.svg https://s3-eu-west-1.amazonaws.com/prod-ucs-content-store-eu-west/content/pii:S2468823121004417/STRIPIN/image/svg+xml/596c85f1e22f50d17b7afb387503f6f9/si1.svg si1 si1.svg svg 8259 ALTIMG 1-s2.0-S2468823121004417-si2.svg https://s3-eu-west-1.amazonaws.com/prod-ucs-content-store-eu-west/content/pii:S2468823121004417/STRIPIN/image/svg+xml/92b3bc09eb0717e9782787c1cbe26d18/si2.svg si2 si2.svg svg 9714 ALTIMG 1-s2.0-S2468823121004417-si3.svg https://s3-eu-west-1.amazonaws.com/prod-ucs-content-store-eu-west/content/pii:S2468823121004417/STRIPIN/image/svg+xml/4c09f4e8424b9f618f26262df0063fa4/si3.svg si3 si3.svg svg 11155 ALTIMG 1-s2.0-S2468823121004417-am.pdf am am.pdf pdf 2456009 AAM-PDF https://s3-eu-west-1.amazonaws.com/prod-ucs-content-store-eu-west/content/egi:108M0NDV2L4/MAIN/application/pdf/d86e6f4fc28b07098e8b6f1cd22d13c6/am.pdf MCAT 111824 111824 S2468-8231(21)00441-7 10.1016/j.mcat.2021.111824 Fig. 1 PXRD patterns of (a) simulated ZIF-67, synthesized ZnCo-ZIF-US, ZnCo-ZIF, ZnCo-US@NC-500 and (b) ZnCo@NC-700, ZnCo-US@NC-700 and ZnCo-US@NC-900. Fig 1 Fig. 2 SEM pictures of (a) ZnCo-ZIF-US, (b) ZnCo-ZIF, (c) ZnCo-US@NC-500, (d)ZnCo-US@NC-700, (e) ZnCo@NC-700 and (f) ZnCo-US@NC-900. Fig 2 Fig. 3 TEM images of (a) ZnCo-ZIF-US and (b) ZnCo-US@NC-700, (c) EDX mapping of ZnCo-US@NC-700; TEM images of (d) ZnCo-ZIF and (e) ZnCo@NC-700, (f) and (g) are the enlarged part of (b) and (j), (h) HR-TEM image of ZnCo-US@NC-700, (i) ZnCo-US@NC-500, (j) ZnCo-US@NC-900. Fig 3 Fig. 4 (a) TEM image and (b) corresponding size distribution of ZnCo-US@NC-700, (c) TEM image and (d) corresponding size distribution of ZnCo@NC-700. Fig 4 Fig. 5 TEM pictures of (a) Zn-ZIF-67, (b) Co-ZIF-67, (c) Zn@NC-700, and (d) Co@NC-700. Fig 5 Fig. 6 (a) N2 adsorption/desorption curves and (b) pore size distribution of ZnCo-US@NC-700, ZnCo@NC-700, (c) N2 adsorption/desorption curve and pore size distribution (insert) of ZnCo-US@NC-500, (d) N2 adsorption/desorption curve and pore size distribution (insert) of ZnCo-US@NC-900. Fig 6 Fig. 7 XPS spectra of (a) Co 2p and (b) N 1s of ZnCo-US@NC-700. Fig 7 Fig. 8 ZnCo-ZIF-US and ZnCo-US@NC-T performance evaluation in FFL hydrogenation to FAL. Fig 8 Fig. 9 (a) Comparison of the catalytic performance of the catalysts, (b) Cycle experiment (Reaction conditions: 0.5 mmol FFL, 100 mg ZnCo-US@NC-700, 10 mL EtOH, 120 °C, 4h), (c) PXRD, (d) TEM and (e) SEM characterization pictures of the recovered ZnCo-US@NC-700. Fig 9 MOF derived non-noble metal catalysts to control the distribution of furfural selective hydrogenation products Zhuo-Fei Li a Yan Shen a Wen-Gang Cui a Qiang Zhang a Tong-Liang Hu a b ⁎ a School of Materials Science and Engineering, National Institute for Advanced Materials, Nankai University, Tianjin 300350, China School of Materials Science and Engineering National Institute for Advanced Materials Nankai University Tianjin 300350 China aSchool of Materials Science and Engineering, National Institute for Advanced Materials, Nankai University, Tianjin 300350, China b State Key Laboratory of Coordination Chemistry, Nanjing University, Nanjing 210023, China State Key Laboratory of Coordination Chemistry Nanjing University Nanjing 210023 China bState Key Laboratory of Coordination Chemistry, Nanjing University, Nanjing 210023, China ⁎ Corresponding author. Furfural, as one of the most important and attractive platform molecules, could produce high-value chemicals through selective hydrogenation, which had attracted wide attention in recent years. Hereon, a ZnCo bimetal ZIF (ZnCo-ZIF-US) was quickly and efficiently prepared by an ultrasonic-assisted method, and a series of nitrogen-doped carbon-coated bimetallic composites (ZnCo-US@NC-T, T refers to the calcination temperature) were prepared by a one-step calcination technique from ZnCo-ZIF-US and their structures were characterized in detail by PXRD, SEM, TEM, and XPS etc. The obtained ZnCo-US@NC-700 showed higher catalytic performance in the selective hydrogenation of furfural to furfuryl alcohol than the derivatives of ZnCo bimetal ZIF prepared without ultrasonic-assisted. Surprisingly, the results showed the presence or absence of Zn in the catalysts could regulate the hydrogenation products of furfural to produce furfuryl alcohol or tetrahydrofurfuryl alcohol. In addition, the catalyst could be recycled with almost no significant change in catalytic performance and its microstructure was still well maintained. This work provides an ingenious strategy for the selective regulation of biomass products. Graphical abstract Image, graphical abstract Keywords Biomass MOF derived catalyst Selective hydrogenation Furfural Introduction As a galore sustainable resource, biomass can be converted into chemicals or liquid fuels to replace fossil resources under the background of rapid consumption of fossil fuels and air pollution, which has caught everyone's attention [1-9]. Furfural (FFL), mainly obtained through the hydrolysis of hemicellulose, is one of the representative biomass-derived molecular compounds, and is also the link between biomass resources and high-value chemicals [10-13]. And it is widely used in organic synthesis, pesticides, and other fields [14-16]. Hydrogenation, as one of the most important high-value conversion means of FFL, has drawn great attention from researchers [17, 18]. However, due to the complexity of the hydrogenation reaction of FFL (aldehyde/furan ring hydrogenation), multiple competitive reactions may be involved, which leads to different hydrogenation products from FFL, such as furfuryl alcohol (FAL), tetrahydrofurfuryl alcohol (THFAL), 2-methylfuran, furan, etc [19-25]. Among them, FAL as an important intermediate is widely used in the preparation of phenolic resins, glass fibers, lysine, dispersants and adhesives [20, 26-28]. THFAL, as an another product of the selective hydrogenation of FFL, not only serves as a green solvent, but also has a wide range of applications in the fields of pesticides and other fields [29-31]. Therefore, the presence of a highly efficient catalyst in the reaction is particularly important in order to obtain a single hydrogenation product with high selectivity, and controlling the distribution of FFL hydrogenation products by adjusting the catalyst is also a hotspot in biomass research [32]. At present, the catalysts designed and prepared for selective hydrogenation of FFL can be roughly divided into two categories. One is the noble metal catalysts led by Pd, Pt and Ru [33-35]. Although they have achieved good catalytic effect, there is still a deficiency in the high price, cost and rarity of precious metals. The other type is non-precious metal catalysts based on Cu and Ni, although the cost is reasonable, but the harsh reaction conditions and complex preparation methods etc. have prevented them from being developed and utilized on a large scale [28, 36-38]. Therefore, it is still a challenge to rationally design and develop non-precious metal catalysts for the highly selective hydrogenation of FFL [39]. Although metal Co also has hydrogenation activity, it is commonly used as a co-catalyst, and there are relatively few in-depth studies on it [40]. As an important branch of metal-organic frameworks (MOFs), ZIFs are similar to traditional aluminosilicate zeolite in structure, and they have the advantages of MOFs, namely large specific surface area, abundant and orderly pore structure, easy regulation and customizable chemical and physical properties [41-45]. They are widely used in gas adsorption/separation, chemical sensing, catalysis and other fields [46-49]. The traditional synthesis method of ZIFs adopts a solvothermal method or stirring aging method. Due to the higher energy consumption or longer reaction time, or a combination of expensive instruments and technologies to shorten the preparation time of the catalyst, it is not suitable for large-scale industrial applications. Therefore, it is urgent to design and develop a convenient and time-saving method to synthesize MOF derivative materials as an efficient catalyst for the selective hydrogenation of FFL. Inspired by methods reported in the literatures [50], in this work, we intended to develop a short-term and efficient method for synthesizing bimetallic ZnCo-ZIF with the assistance of ultrasound, and the obtained ZnCo-ZIF-US was further carbonized in an inert atmosphere to prepare the catalyst, denoted as ZnCo-US@NC-T. The advantages of ultrasound-assisted synthesis were highlighted by comparing with the effect of the catalyst prepared without ultrasound assistance. Besides, the effect of pyrolysis temperature on the catalytic performance was elaborately explored. Last but not least, under the same catalytic system, the presence of Zn in the ZnCo-ZIF-US precursor played a pivotal role with controllable selectivity toward FAL/THFAL in the hydrogenation of FFL. Experimental Synthesis of ZnCo-ZIF-US The ZnCo-ZIF-US was synthesized with the aid of ultrasound. Specifically, Zn(NO3)2 ⋅6H2O (0.2975 g, 1 mmol) and Co(NO3)2 ⋅6H2O (0.2910 g, 1 mmol) were dissolved in 15 mL methanol, which was subsequently mixed with a 15 mL methanol solution containing 2-methylimidazole (0.9852 g, 12 mmol) and kept for 20 minutes under ultrasonic condition. The sample was collected by centrifugation, washed with alcohol and vacuum drying at 60 °C for 12 h to obtain ZnCo-ZIF-US. Preparation of ZnCo-US@NC-T A certain amount of prepared ZnCo-ZIF-US was put in a porcelain boat, heated at 5 °C⋅min−1 to target temperature (500, 700 and 900 °C, respectively) in N2, and then maintained for 4 h. The resulting materials were expressed as ZnCo-US@NC-T (T refers to the calcination temperature). Preparation of comparative samples For comparison, bimetal ZnCo-ZIF was prepared using the same method, but without assistance of ultrasound, denoted as ZnCo-ZIF. Zn-ZIF-67 and Co-ZIF-67 had been synthesized as noted except for the difference in metal molar amount (without addition of Co2+/Zn2+). The obtained swatch was placed into a porcelain boat for pyrolysis at 700 °C in the same way as the synthesis of ZnCo-US@NC-T. The as-prepared products were designated as ZnCo@NC-700, Zn@NC-700 and Co@NC-700. Catalytic performance evaluation The selective hydrogenation of furfural was carried out in a 100 mL autoclave reactor which was furnished with a magnetic and temperature controller. The catalyst (∼100 mg) and FFL (0.5 mmol) were dispersed in 10 mL ethanol by ultrasonic and therewith transferred to the reactor, after purged with H2 to replace the air in the reactor 3 times, filled it with 2 MPa H2. Whereafter, the autoclave was heated to 120 °C and held for 4 h with magnetic stirring at 500 rpm. The pressure was slowly released after the reactor was cooled to room temperature with a water bath. The catalyst was recovered by centrifugal separation. The supernatant after centrifugation was filtered through a 0.22 μm syringe filter and analyzed by gas chromatography (Shimadzu GC-2014C). The concentration of FFL, FAL and THFAL was determined by the standard curve method, and the conversion of FFL and the selectivity of FAL/THFAL were determined by the following formulas. Conversion of FFL (%): C ( F F L , % ) = A − B A × 100 % The yield of FAL/THFAL (%): Y ( F A L / T H F A L , % ) = P A × 100 % The selectivity of FAL/THFAL (%): S ( F A L / T H F A L , % ) = P A − B × 100 % where A is added moles of FFL, B is remained after reaction moles of FFL, P is moles of products FAL/THFAL. Results and discussion Material characterization In this work, the effect of changes in the preparation technology of ZnCo-US@NC-T (such as preparation method and calcination temperature) on the phase composition, structure and morphology of obtained materials was studied in detail through PXRD, TEM, SEM and other characterization. PXRD test was conducted for purpose of confirmation the successful synthesis of the ZnCo-ZIF-US, comparative catalysts and their derivatives. As shown in Fig. 1 a, the PXRD patterns of both ZnCo-ZIF-US and ZnCo-ZIF were highly identical with the simulated pattern from single crystal data of ZIF-67, which proved that they have extremely similar crystal structures. Similarly, it could be seen from PXRD that Zn-ZIF-67 and Co-ZIF-67 for comparison had also been successfully synthesized (Fig. S1a). To our astonishment, the diffraction peaks of ZnCo-US@NC-500 were almost completely similar to the synthesized ZnCo-ZIF-US, indicated that the structure of ZnCo-ZIF-US precursor was still maintained at the calcination temperature of 500 °C, which could also be proved by the thermogravimetric curve (TG) that the complete collapse temperature of ZnCo-ZIF-US was around 520 °C (Fig. S2). Nevertheless, all the characteristic peaks of the ZIF framework were disappeared for the ZnCo-US@NC-700 and replaced by the three peaks located at 44.26°, 51.54° and 75.80°, which corresponded to the (111), (200) and (220) faces of metal cobalt (JCPDS no.15-0806). The broad peak at about 25.99° was matched well with the graphitic carbon (JCPDS no. 65-6212) that derived from the carbonization of organic ligands. Compared with ZnCo-US@NC-700, although the peaks of ZnCo-US@NC-900 were the same as the former, the peak width was significantly narrower and the peak diffraction was pronounced stronger, indicating that the degree of crystallinity and particle size of the Co particles may be both increased (Fig. 1b). Likewise, three peaks of Co nanoparticles at 44.26, 51.54 and 75.80° could also be observed in Co@NC-700 and ZnCo@NC-700, while Zn@NC-700 only contained the peak of disordered carbon (002) (Figs. 1b and S1b). It clearly seen from SEM images that both ZnCo-ZIF-US and ZnCo-ZIF were the typical polyhedral morphology of ZIF-67, but the difference was that the particle size produced by ultrasound-assisted synthesis (ZnCo-ZIF-US) was more uniform than ZnCo-ZIF (Fig. 2 a, b). After calcination, the surface of the ZnCo-US@NC-T had changed, masses of the polyhedral edges of ZnCo-US@NC-500 almost disappear and became more rounded than those of ZnCo-ZIF-US, that was also proved by TEM (Figs. 2c and 3 i). Interestingly, the pyrolysis provoked the occurrence of carbon nanotubes on the surface of ZnCo-US@NC-700 particles, which was the result of the surface catalysis of Co nanoparticles, and its surface significantly shrank, similar to that of ZnCo@NC-700. It was worth mentioning that, unlike most other ZIF-derived carbon nanotubes, we obtained it by one-step pyrolysis in a non-reducing atmosphere and no additional carbon source [51]. Compared with ZnCo-US@NC-700, white bright spots appeared on the surface of ZnCo-US@NC-900, which were proved to be Co nanoparticles (Fig. 3g). The surface of ZnCo-US@NC-T was transformed what with the disintegration of the carbon skeleton in the calcination process. All the obtained materials (ZnCo-ZIF-US, ZnCo-ZIF and other comparative catalysts) were further characterized by TEM and were found that they all inherited the polyhedral morphology of ZIF-67 (Figs. 3 and 5). The difference was that in ZnCo-US@NC-700, in addition to the obvious appearance of cobalt nanoparticles, the periphery of the material shrank significantly and was surrounded by carbon nanotubes (Fig. 3b). It was not negligible that the end of the nanotube was also encapsulated with cobalt nanoparticles which could be proved by EDS-Mapping (Fig. 3f). The EDS mapping image of ZnCo-US@NC-700 showed homogeneous dispersion of C, N, Zn, and Co (Fig. 3c). Similar results could be observed for ZnCo@NC-700 catalyst, except that the particle size was not uniform (Figs. 3d, e, 4 and S3). Uniformity in size may be very beneficial for exposed catalytically active sites, so ZnCo-US@NC-700 had higher catalytic performance. As shown by HRTEM (Fig. 3h), its lattice fringe was 0.205 nm, which corresponded to the (111) crystal plane of cobalt. Compared with ZnCo-US@NC-700 (∼6.96 nm) (Fig. 4 ), the sharp increase of Co nanoparticles in ZnCo-US@NC-900 (∼8.65 nm) was attributed to the influence of the calcination temperature, that was, the particles were prone to agglomeration with the high temperature (Fig. 3j), which also further explained the reason why the aforementioned XRD peak intensity of the material had become stronger (Fig. 1b). About the comparative catalysts Zn@NC-700 and Co@NC-700, the morphological analysis indicated that the surface of Zn@NC-700 particles had a partially agglomerated structure and the edges became smooth (Figs. 5 c and S4c). Although the Co@NC-700 maintained a polyhedral morphology, the edges showed obvious shrinkage and a small number of particles agglomerated, which could be observed more intuitively by TEM (Figs. 5d and S4d). Nitrogen adsorption/desorption experiments were carried out in the cause of having an in-depth understanding of the specific surface area (SA) and pore volume (PV) of the materials at different calcination temperatures. As shown in Fig. 6 , the isotherm of ZnCo-US@NC-700 showed a sharp increase at the low-pressure area adsorption, demonstrating the existence of micropores, while the obvious hysteresis loop in the high-pressure area proved the existence of mesopores, which was also proved by the pore size distribution diagram. Additionally, the SA and PV of ZnCo-US@NC-T could be respectively calculated in the light of the BET and total pore volume model calculation method, which changed enormously with the increase of pyrolysis temperature (Table S1). For ZnCo-US@NC-500, which still remained ZnCo-ZIF-US framework, the SA and PV have comparatively little change. Comparing as-obtained materials (ZnCo-US@NC-700, ZnCo-US@NC-900, Zn@NC-700, Co@NC-700 and ZnCo@NC-700), it could be found that the ZnCo-US@NC-700 had the largest SA (381.13 m2 g−1) of all the samples, and the PV had an alike tendency. Therefore, ZnCo-US@NC-700 was more adequate as the first-rank materials than others, because the presence of large SA and mesopores could expand the contact area between the reactants and provided more catalytically active sites, which would help improve the catalytic performance of the material. The electronic state of ZnCo-US@NC-700 composite was investigated by XPS. It can be seen from the survey of XPS that C, N, Zn and Co were present in the material (Fig. S6). The existence valence of Co was investigated by high resolution XPS spectra of Co 2p (Fig. 7 a), where the binding energy at 778.5 eV and 793.7 eV peaks belonged to the 2p3/2 and 2p1/2 regions of zero-valent Co, respectively [52]. The peaks at 779.5 eV/795.9 eV indicate the existence Co3+, and the peaks at 782.5 eV/797.7 eV indicate the presence of Co2+. This may be caused by oxidation of the material surface exposed to air [53-55]. In addition, it could be known from the N 1s spectrum that the material was composed of pyridine nitrogen with a binding energy of 398.8 eV, pyrrole nitrogen with 400.8 eV and graphitic nitrogen with 401.2 eV, among which the content of pyridine nitrogen was the highest in the material (Fig. 7b) [56, 57]. This results confirmed the successful synthesis of nitrogen-doped carbon materials [58]. Catalytic performance evaluation and optimization Through a series of characterization above, it could be determined that the pyrolysis process had an influence on the materials, so the effect of the pyrolysis process on the catalytic performance was discussed here. The catalytic performance of the materials prepared above in FFL hydrogenation reaction was studied. As shown in Fig. 8 , the FFL hydrogenation was carried out in ethanol at 120°C under 2 MPa H2 for 4 h with ZnCo-ZIF-US catalyst, about 5.13% FFL conversion with 9.16% selectivity of FAL was obtained. ZnCo-US@NC-500 showed 5.75% conversion of the reaction which almost no obvious changed compared with ZnCo-ZIF-US but the selectivity of FAL increased sharply to 94.71%. While, it was found that the FFL conversion could reach 100% and 91.54% selectivity of the FAL when used the ZnCo-US@NC-700 as the catalyst. ZnCo-US@NC-900 gave the 100% FFL conversion the same as ZnCo-US@NC-700, but the selectivity of FAL was only 86.85% (Fig. 8). There were two main reasons for this result, one was that Co nanoparticles had agglomerated under this high temperature treatment (Fig. 2e). The other was due to the evaporation of Zn at 900 °C, which leaded to a decrease in the Zn content in the catalyst, resulted in a decrease in the selectivity of the reaction. This result could be further proved by the ICP test (Table S2). Then, in order to prove the synergistic effect between Zn and Co, the catalytic performance of Zn@NC-700 and Co@NC-700 was evaluated, respectively. It could be found that Zn@NC-700 only gave 8.32% FAL conversion with 92.62% FAL selectivity. The conversion of FFL could reach 100% with Co@NC-700 catalyst, while the selectivity of FAL was only 0.45% (Fig. 9 a), but it was worth noting that the selectivity of THFAL could reach 90.00% at this time. Whereas Zn@NC-700 had no catalytic effect on FFL hydrogenation conversion to THFAL. ZnCo-US@NC-700 afforded 4.96% conversion of THFAL (Fig. S8). Therefore, the synergistic effect of bimetallic ZnCo was conducive to the highly selective preparation of FAL, and doped of Zn could achieve the purpose of regulating selective hydrogenation of FFL to FAL/THFAL. Finally, in order to prove the importance of ultrasound assistance, with the utilization of ZnCo@NC-700 catalyst, substantial decrease in FFL conversion (87.83%) and FAL selectivity (61.93%) was observed (Fig. 9a). The results showed that ultrasound assistance was indispensable in the process of synthesizing MOF precursors. Based on this result and combined with literature research, we speculated the reason that the acoustic cavitation effect will be generated in the ultrasonic process, which can cause local high temperature and high pressure, resulting in extremely fast heating and cooling rate, which may change the motion rate of molecules and thus increase the binding ability between substances [59]. Recycle Experiment The recycling of the catalyst will reduce the cost in line with the concept of energy saving and emission reduction. Therefore, we selected ZnCo-US@NC-700 as a catalyst to conduct a recycling experiment to evaluate its performance. After the reaction, the catalyst was washed for three times with absolute ethanol and dried before being used in the next catalytic cycle. The recyclability of the catalyst still maintained 100% FFL conversion and the FAL selectivity remained above 90% after four cycles of recycling (Fig. 9b). We also conducted a reusability experiment of Co@NC-700, as shown in Fig. S9, the conversion of FFL was 100% and the selectivity of THFAL was nearly unchanged after four cycles. In order to confirm whether the structure of recycled ZnCo-US@NC-700 catalyst was similar to the fresh one, to begin with, the PXRD test was performed on it. As shown in Fig. 9c, the PXRD pattern of ZnCo-US@NC-700 was exhibiting almost identical diffraction peaks before and after the reaction, indicating that the structure of the ZnCo-US@NC-700 catalyst hardly changed after the cycle. Consistent with the results of SEM and TEM characterization (Figs. 9d, e), compared with the newly prepared catalyst, the microstructure of the recovered catalyst was still well maintained and there was no significant agglomeration of Co nanoparticles. CONCLUSION In summary, a simple, fast and energy-saving method was proposed for the synthesis of bimetallic ZIF materials and a simple one-step pyrolysis method to obtain MOF-derived nanomaterials. The experimental results in the FFL hydrogenation reaction showed that even if using cheap transition metals as catalysts, the synergy between Zn and Co in ZnCo-US@NC-700 still provided excellent catalytic performance in the selective reduction of FFL to FAL. This material had a high degree of controllability in the FFL hydrogenation reaction and could be doped with Zn to achieve the purpose of regulating the product distribution. FAL could be obtained with high selectivity through the synergistic effect of Zn and Co bimetal. THFAL with a furfural conversion of 100% and a selectivity of 90% was obtained when only cobalt was present in the material. In addition, the catalyst still maintained excellent catalytic activity after being recycled. This study may provide an idea for the design and preparation of non-noble metal doping catalysts that selectively regulate the distribution of furfural hydrogenation products. CRediT author statement Zhuo-Fei Li: Conceptualization, Methodology, Visualization, Investigation, Writing- Original draft preparation. Yan Shen: Revising the manuscript. Wen-Gang Cui: Revising the manuscript. Qiang Zhang: Investigation. Tong-Liang Hu: Supervision, Writing- Reviewing and Editing, Conceptualization, Project administration, Funding acquisition. Declaration of Competing Interest The authors declare no conflict of interests. Acknowledgements This work was financially supported by the Natural Science Foundation of Tianjin (20JCYBJC01330), the National Natural Science Foundation of China (21673120) and the Fundamental Research Funds for the Central Universities, Nankai University (63211040). Supplementary materials Supplementary material associated with this article can be found, in the online version, at doi:10.1016/j.mcat.2021.111824. Appendix Supplementary materials Image, application 1 Reference [1] N.S. Bhat S.S. Mal S. Dutta Recent advances in the preparation of levulinic esters from biomass-derived furanic and levulinic chemical platforms using heteropoly acid (HPA) catalysts Mol. Catal. 505 2021 111484 N.S. Bhat, S.S. Mal, S. Dutta, Recent advances in the preparation of levulinic esters from biomass-derived furanic and levulinic chemical platforms using heteropoly acid (HPA) catalysts, Mol. Catal.505 (2021) 111484. [2] S. Wang Y. Lu C.-L. Dong Y.-C. Huang Y. Zou Z. Liu Y. Liu Y. Li N. He J. Shi Identifying the geometric site dependence of spinel oxides for the electrooxidation of 5-hydroxymethylfurfural Angew. Chem. Int. Ed. 132 2020 19377 19383 S. Wang, Y. Lu, C.-L. Dong, Y.-C. Huang, Y. Zou, Z. Liu, Y. Liu, Y. Li, N. He, J. Shi, Identifying the geometric site dependence of spinel oxides for the electrooxidation of 5-hydroxymethylfurfural, Angew. Chem. Int. Ed.132 (2020) 19377-19383. [3] W. Li M. Li H. Liu W. Jia X. Yu S. Wang X. Zeng Y. Sun J. Wei X. Tang L. Lin Domino transformation of furfural to γ-valerolactone over SAPO-34 zeolite supported zirconium phosphate catalysts with tunable lewis and brønsted acid sites Mol. Catal. 506 2021 111538 W. Li, M. Li, H. Liu, W. Jia, X. Yu, S. Wang, X. Zeng, Y. Sun, J. Wei, X. Tang, L. Lin, Domino transformation of furfural to γ-valerolactone over SAPO-34 zeolite supported zirconium phosphate catalysts with tunable lewis and brønsted acid sites, Mol. Catal.506 (2021) 111538. [4] J.G. Lee S. Yoon E. Yang J.H. Lee K. Song H.R. Moon K. An Structural evolution of ZIF-67-derived catalysts for furfural hydrogenation J. Catal. 392 2020 302 312 J.G. Lee, S. Yoon, E. Yang, J.H. Lee, K. Song, H.R. Moon, K. An, Structural evolution of ZIF-67-derived catalysts for furfural hydrogenation, J. Catal.392 (2020) 302-312. [5] E.L. Kunkes D.A. Simonetti R.M. West J.C. Serrano-Ruiz C.A. Gärtner J.A. Dumesic Catalytic conversion of biomass to monofunctional hydrocarbons and targeted liquid-fuel classes Science 322 2008 417 421 E.L. Kunkes, D.A. Simonetti, R.M. West, J.C. Serrano-Ruiz, C.A. Gärtner, J.A. Dumesic, Catalytic conversion of biomass to monofunctional hydrocarbons and targeted liquid-fuel classes, Science322 (2008) 417-421. [6] X. Wu N. Luo S. Xie H. Zhang Q. Zhang F. Wang Y. Wang Photocatalytic transformations of lignocellulosic biomass into chemicals Chem. Soc. Rev. 49 2020 6198 6223 X. Wu, N. Luo, S. Xie, H. Zhang, Q. Zhang, F. Wang, Y. Wang, Photocatalytic transformations of lignocellulosic biomass into chemicals, Chem. Soc. Rev.49 (2020) 6198-6223. [7] J. Huo Y. Wang L. Yan Y. Xue S. Li M. Hu Y. Jiang Q.-G. Zhai In situ semi-transformation from heterometallic MOFs to Fe-Ni LDH/MOF hierarchical architectures for boosted oxygen evolution reaction Nanoscale 12 2020 14514 14523 J. Huo, Y. Wang, L. Yan, Y. Xue, S. Li, M. Hu, Y. Jiang, Q.-G. Zhai, In situ semi-transformation from heterometallic MOFs to Fe-Ni LDH/MOF hierarchical architectures for boosted oxygen evolution reaction, Nanoscale12 (2020) 14514-14523. [8] Z. Du P. Yu L. Wang C. Tian X. Liu G. Zhang H. Fu Cubic imidazolate frameworks-derived CoFe alloy nanoparticles-embedded N-doped graphitic carbon for discharging reaction of Zn-air battery Sci. China Mater. 63 2020 327 338 Z. Du, P. Yu, L. Wang, C. Tian, X. Liu, G. Zhang, H. Fu, Cubic imidazolate frameworks-derived CoFe alloy nanoparticles-embedded N-doped graphitic carbon for discharging reaction of Zn-air battery, Sci. China Mater.63 (2020) 327-338. [9] Y. Li L. Wang Y. Xiao G. Tian C. Tian H. Fu In situ intercalation and exploitation of Co3O4 nanoparticles grown on carbon nitride nanosheets for highly efficient degradation of methylene blue Dalton Trans. 49 2020 14665 14672 Y. Li, L. Wang, Y. Xiao, G. Tian, C. Tian, H. Fu, In situ intercalation and exploitation of Co3O4 nanoparticles grown on carbon nitride nanosheets for highly efficient degradation of methylene blue, Dalton Trans. 49 (2020) 14665-14672. [10] W.R. Silva E.Y. Matsubara J.M. Rosolen P.M. Donate R. Gunnella Pd catalysts supported on different hydrophilic or hydrophobic carbonaceous substrate for furfural and 5-(hydroxymethyl)-furfural hydrogenation in water Mol. Catal. 504 2021 111496 W.R. Silva, E.Y. Matsubara, J.M. Rosolen, P.M. Donate, R. Gunnella, Pd catalysts supported on different hydrophilic or hydrophobic carbonaceous substrate for furfural and 5-(hydroxymethyl)-furfural hydrogenation in water, Mol. Catal.504 (2021) 111496. [11] F. Delbecq Y. Wang A. Muralidhara K. El Ouardi G. Marlair C. Len Hydrolysis of hemicellulose and aerivatives-a review of recent advances in the production of furfural Front. Chem. 6 2018 146 F. Delbecq, Y. Wang, A. Muralidhara, K. El Ouardi, G. Marlair, C. Len, Hydrolysis of hemicellulose and aerivatives-a review of recent advances in the production of furfural, Front. Chem.6 (2018) 146. [12] H. Lee C. Nguyen-Huy E. Jeong Jang J. Lee E. Yang M.S. Lee J.H. Kwak K. An Interfacial effect of Pd supported on mesoporous oxide for catalytic furfural hydrogenation Catal. Today 365 2021 291 300 H. Lee, C. Nguyen-Huy, E. Jeong Jang, J. Lee, E. Yang, M.S. Lee, J.H. Kwak, K. An, Interfacial effect of Pd supported on mesoporous oxide for catalytic furfural hydrogenation, Catal. Today365 (2021) 291-300. [13] M. Kalong P. Hongmanorom S. Ratchahat W. Koo-amornpattana K. Faungnawakij S. Assabumrungrat A. Srifa S. Kawi Hydrogen-free hydrogenation of furfural to furfuryl alcohol and 2-methylfuran over Ni and Co-promoted Cu/γ-Al2O3 catalysts Fuel Process. Technol. 214 2021 106721 M. Kalong, P. Hongmanorom, S. Ratchahat, W. Koo-amornpattana, K. Faungnawakij, S. Assabumrungrat, A. Srifa, S. Kawi, Hydrogen-free hydrogenation of furfural to furfuryl alcohol and 2-methylfuran over Ni and Co-promoted Cu/γ-Al2O3 catalysts, Fuel Process. Technol.214 (2021) 106721. [14] X. Meng L. Wang L. Chen M. Xu N. Liu J. Zhang Y. Yang M. Wei Charge-separated metal-couple-site in NiZn alloy catalysts towards furfural hydrodeoxygenation reaction J. Catal. 392 2020 69 79 X. Meng, L. Wang, L. Chen, M. Xu, N. Liu, J. Zhang, Y. Yang, M. Wei, Charge-separated metal-couple-site in NiZn alloy catalysts towards furfural hydrodeoxygenation reaction, J. Catal.392 (2020) 69-79. [15] H. Ishikawa M. Sheng A. Nakata K. Nakajima S. Yamazoe J. Yamasaki S. Yamaguchi T. Mizugaki T. Mitsudome Air-stable and reusable cobalt phosphide nanoalloy catalyst for selective hydrogenation of furfural derivatives ACS Catal. 11 2021 750 757 H. Ishikawa, M. Sheng, A. Nakata, K. Nakajima, S. Yamazoe, J. Yamasaki, S. Yamaguchi, T. Mizugaki, T. Mitsudome, Air-stable and reusable cobalt phosphide nanoalloy catalyst for selective hydrogenation of furfural derivatives, ACS Catal.. 11 (2021) 750-757. [16] J. Sittiwong A. Prasertsab S. Boonmark W. Nunthakitgoson P. Srifa T. Maihom J. Limtrakul Theoretical insights into furfural reduction to furfuryl alcohol via the catalytic hydrogen transfer reaction catalyzed by cations exchanged zirconium-containing zeolites Mol. Catal. 504 2021 111471 J. Sittiwong, A. Prasertsab, S. Boonmark, W. Nunthakitgoson, P. Srifa, T. Maihom, J. Limtrakul, Theoretical insights into furfural reduction to furfuryl alcohol via the catalytic hydrogen transfer reaction catalyzed by cations exchanged zirconium-containing zeolites, Mol. Catal.504 (2021) 111471. [17] Z. Zhao R. Bababrik W. Xue Y. Li N.M. Briggs D.-T. Nguyen U. Nguyen S.P. Crossley S. Wang B. Wang D.E. Resasco Solvent-mediated charge separation drives alternative hydrogenation path of furanics in liquid water Nat. Catal. 2 2019 431 436 Z. Zhao, R. Bababrik, W. Xue, Y. Li, N.M. Briggs, D.-T. Nguyen, U. Nguyen, S.P. Crossley, S. Wang, B. Wang, D.E. Resasco, Solvent-mediated charge separation drives alternative hydrogenation path of furanics in liquid water, Nat. Catal.2 (2019) 431-436. [18] J. Chuseang R. Nakwachara M. Kalong S. Ratchahat W. Koo-amornpattana W. Klysubun P. Khemthong K. Faungnawakij S. Assabumrungrat V. Itthibenchapong A. Srifa Selective hydrogenolysis of furfural into fuel-additive 2-methylfuran over a rhenium-promoted copper catalyst Sustain. Energ. Fuels 5 2021 1379 1393 J. Chuseang, R. Nakwachara, M. Kalong, S. Ratchahat, W. Koo-amornpattana, W. Klysubun, P. Khemthong, K. Faungnawakij, S. Assabumrungrat, V. Itthibenchapong, A. Srifa, Selective hydrogenolysis of furfural into fuel-additive 2-methylfuran over a rhenium-promoted copper catalyst, Sustain. Energ. Fuels5 (2021) 1379-1393. [19] Y. Deng R. Gao L. Lin T. Liu X.-D. Wen S. Wang D. Ma Solvent tunes the selectivity of hydrogenation reaction over α-MoC catalyst J. Am. Chem. Soc. 140 2018 14481 14489 Y. Deng, R. Gao, L. Lin, T. Liu, X.-D. Wen, S. Wang, D. Ma, Solvent tunes the selectivity of hydrogenation reaction over α-MoC catalyst, J. Am. Chem. Soc.140 (2018) 14481-14489. [20] H. Du X. Ma M. Jiang P. Yan Z.Conrad Zhang Highly efficient Cu/SiO2 catalyst derived from ethanolamine modification for furfural hydrogenation Appl. Catal. A 598 2020 117598 H. Du, X. Ma, M. Jiang, P. Yan, Z. Conrad Zhang, Highly efficient Cu/SiO2 catalyst derived from ethanolamine modification for furfural hydrogenation, Appl. Catal. A598 (2020) 117598. [21] Z. Wang X. Wang C. Zhang M. Arai L. Zhou F. Zhao Selective hydrogenation of furfural to furfuryl alcohol over Pd/TiH2 catalyst Mol. Catal. 508 2021 111599 Z. Wang, X. Wang, C. Zhang, M. Arai, L. Zhou, F. Zhao, Selective hydrogenation of furfural to furfuryl alcohol over Pd/TiH2 catalyst, Mol. Catal.508 (2021) 111599. [22] A.J. Garcia-Olmo A. Yepez A.M. Balu P. Prinsen A. Garcia A. Maziere C. Len R. Luque Activity of continuous flow synthesized Pd-based nanocatalysts in the flow hydroconversion of furfural Tetrahedron 73 2017 5599 5604 A.J. Garcia-Olmo, A. Yepez, A.M. Balu, P. Prinsen, A. Garcia, A. Maziere, C. Len, R. Luque, Activity of continuous flow synthesized Pd-based nanocatalysts in the flow hydroconversion of furfural, Tetrahedron73 (2017) 5599-5604. [23] Y. Wang P. Prinsen K.S. Triantafyllidis S.A. Karakoulia P.N. Trikalitis A. Yepez C. Len R. Luque Comparative study of supported monometallic catalysts in the liquid-phase hydrogenation of furfural: batch versus continuous flow ACS Sustain. Chem. Eng. 6 2018 9831 9844 Y. Wang, P. Prinsen, K.S. Triantafyllidis, S.A. Karakoulia, P.N. Trikalitis, A. Yepez, C. Len, R. Luque, Comparative study of supported monometallic catalysts in the liquid-phase hydrogenation of furfural: batch versus continuous flow, ACS Sustain. Chem. Eng.6 (2018) 9831-9844. [24] Y. Wang P. Prinsen K.S. Triantafyllidis S.A. Karakoulia A. Yepez C. Len R. Luque Batch versus continuous flow performance of supported mono- and bimetallic nickel catalysts for catalytic transfer hydrogenation of furfural in isopropanol ChemCatChem 10 2018 3459 3468 Y. Wang, P. Prinsen, K.S. Triantafyllidis, S.A. Karakoulia, A. Yepez, C. Len, R. Luque, Batch versus continuous flow performance of supported mono- and bimetallic nickel catalysts for catalytic transfer hydrogenation of furfural in isopropanol, ChemCatChem10 (2018) 3459-3468. [25] Y. Wang D. Zhao D. Rodríguez-Padrón C. Len Recent advances in catalytic hydrogenation of furfural Catalysts 9 2019 796 828 Y. Wang, D. Zhao, D. Rodríguez-Padrón, C. Len, Recent advances in catalytic hydrogenation of furfural, Catalysts9 (2019) 796-828. [26] Y. Fan C. Zhuang S. Li Y. Wang X. Zou X. Liu W. Huang G. Zhu Efficient single-atom Ni for catalytic transfer hydrogenation of furfural to furfuryl alcohol J. Mater. Chem. A 9 2021 1110 1118 Y. Fan, C. Zhuang, S. Li, Y. Wang, X. Zou, X. Liu, W. Huang, G. Zhu, Efficient single-atom Ni for catalytic transfer hydrogenation of furfural to furfuryl alcohol, J. Mater. Chem. A9 (2021) 1110-1118. [27] M. Ma P. Hou P. Zhang J. Cao H. Liu H. Yue G. Tian S. Feng Magnetic Fe3O4 nanoparticles as easily separable catalysts for efficient catalytic transfer hydrogenation of biomass-derived furfural to furfuryl alcohol Appl. Catal. A 602 2020 117709 M. Ma, P. Hou, P. Zhang, J. Cao, H. Liu, H. Yue, G. Tian, S. Feng, Magnetic Fe3O4 nanoparticles as easily separable catalysts for efficient catalytic transfer hydrogenation of biomass-derived furfural to furfuryl alcohol, Appl. Catal. A602 (2020) 117709. [28] W. Gong C. Chen Y. Zhang H. Zhou H. Wang H. Zhang Y. Zhang G. Wang H. Zhao Efficient synthesis of furfuryl alcohol from H2-hydrogenation/transfer hydrogenation of furfural using sulfonate group modified Cu catalyst ACS Sustain. Chem. Eng. 5 2017 2172 2180 W. Gong, C. Chen, Y. Zhang, H. Zhou, H. Wang, H. Zhang, Y. Zhang, G. Wang, H. Zhao, Efficient synthesis of furfuryl alcohol from H2-hydrogenation/transfer hydrogenation of furfural using sulfonate group modified Cu catalyst, ACS Sustain. Chem. Eng.5 (2017) 2172-2180. [29] N.S. Biradar A.M. Hengne S.N. Birajdar P.S. Niphadkar P.N. Joshi C.V. Rode Single-Pot Formation of THFAL via catalytic hydrogenation of FFR over Pd/MFI catalyst ACS Sustain. Chem. Eng. 2 2014 272 281 N.S. Biradar, A.M. Hengne, S.N. Birajdar, P.S. Niphadkar, P.N. Joshi, C.V. Rode, Single-Pot Formation of THFAL via catalytic hydrogenation of FFR over Pd/MFI catalyst, ACS Sustain. Chem. Eng.2 (2014) 272-281. [30] H. Wang X. Li X. Lan T. Wang Supported ultrafine NiCo bimetallic alloy nanoparticles derived from bimetal-organic frameworks: a highly active catalyst for furfuryl alcohol hydrogenation ACS Catal. 8 2018 2121 2128 H. Wang, X. Li, X. Lan, T. Wang, Supported ultrafine NiCo bimetallic alloy nanoparticles derived from bimetal-organic frameworks: a highly active catalyst for furfuryl alcohol hydrogenation, ACS Catal. 8 (2018) 2121-2128. [31] W. Gong C. Chen H. Zhang Y. Zhang Y. Zhang G. Wang H. Zhao Highly selective liquid-phase hydrogenation of furfural over N-doped carbon supported metallic nickel catalyst under mild conditions Mol. Catal. 429 2017 51 59 W. Gong, C. Chen, H. Zhang, Y. Zhang, Y. Zhang, G. Wang, H. Zhao, Highly selective liquid-phase hydrogenation of furfural over N-doped carbon supported metallic nickel catalyst under mild conditions, Mol. Catal.429 (2017) 51-59. [32] J. Lee J. Woo C. Nguyen-Huy M.S. Lee S.H. Joo K. An Highly dispersed Pd catalysts supported on various carbons for furfural hydrogenation Catal. Today 350 2020 71 79 J. Lee, J. Woo, C. Nguyen-Huy, M.S. Lee, S.H. Joo, K. An, Highly dispersed Pd catalysts supported on various carbons for furfural hydrogenation, Catal. Today350 (2020) 71-79. [33] S.M. Rogers C.R.A. Catlow C.E. Chan-Thaw A. Chutia N. Jian R.E. Palmer M. Perdjon A. Thetford N. Dimitratos A. Villa P.P. Wells Tandem site- and size-controlled Pd nanoparticles for the directed hydrogenation of furfural ACS Catal. 7 2017 2266 2274 S.M. Rogers, C.R.A. Catlow, C.E. Chan-Thaw, A. Chutia, N. Jian, R.E. Palmer, M. Perdjon, A. Thetford, N. Dimitratos, A. Villa, P.P. Wells, Tandem site- and size-controlled Pd nanoparticles for the directed hydrogenation of furfural, ACS Catal. 7 (2017) 2266-2274. [34] T.W. Goh C.-K. Tsung W. Huang Spectroscopy identification of the bimetallic surface of metal-organic framework-confined Pt-Sn nanoclusters with enhanced chemoselectivity in furfural hydrogenation ACS Appl. Mater. Interfaces 11 2019 23254 23260 T.W. Goh, C.-K. Tsung, W. Huang, Spectroscopy identification of the bimetallic surface of metal-organic framework-confined Pt-Sn nanoclusters with enhanced chemoselectivity in furfural hydrogenation, ACS Appl. Mater. Interfaces11 (2019) 23254-23260. [35] G. Bagnato A. Figoli C. Ursino F. Galiano A. Sanna A novel Ru-polyethersulfone (PES) catalytic membrane for highly efficient and selective hydrogenation of furfural to furfuryl alcohol J. Mater. Chem. A 6 2018 4955 4965 G. Bagnato, A. Figoli, C. Ursino, F. Galiano, A. Sanna, A novel Ru-polyethersulfone (PES) catalytic membrane for highly efficient and selective hydrogenation of furfural to furfuryl alcohol, J. Mater. Chem. A6 (2018) 4955-4965. [36] W. Liu Y. Yang L. Chen E. Xu J. Xu S. Hong X. Zhang M. Wei Atomically-ordered active sites in NiMo intermetallic compound toward low-pressure hydrodeoxygenation of furfural Appl. Catal. B 2020 119569 W. Liu, Y. Yang, L. Chen, E. Xu, J. Xu, S. Hong, X. Zhang, M. Wei, Atomically-ordered active sites in NiMo intermetallic compound toward low-pressure hydrodeoxygenation of furfural, Appl. Catal. B (2020) 119569. [37] S. Huang N. Yang S. Wang Y. Sun Y. Zhu Tuning the synthesis of platinum-copper nanoparticles with a hollow core and porous shell for the selective hydrogenation of furfural to furfuryl alcohol Nanoscale 8 2016 14104 14108 S. Huang, N. Yang, S. Wang, Y. Sun, Y. Zhu, Tuning the synthesis of platinum-copper nanoparticles with a hollow core and porous shell for the selective hydrogenation of furfural to furfuryl alcohol, Nanoscale8 (2016) 14104-14108. [38] S. Nandi A. Saha P. Patel N.U.H. Khan R.I. Kureshy A.B. Panda Hydrogenation of furfural with nickel nanoparticles stabilized on nitrogen-rich carbon core-shell and its transformations for the synthesis of γ-valerolactone in aqueous conditions ACS Appl. Mater. Interfaces 10 2018 24480 24490 S. Nandi, A. Saha, P. Patel, N. U. H. Khan, R.I. Kureshy, A.B. Panda, Hydrogenation of furfural with nickel nanoparticles stabilized on nitrogen-rich carbon core-shell and its transformations for the synthesis of γ-valerolactone in aqueous conditions, ACS Appl. Mater. Interfaces10 (2018) 24480-24490. [39] P. Khemthong C. Yimsukanan T. Narkkun A. Srifa T. Witoon S. Pongchaiphol S. Kiatphuengporn K. Faungnawakij Advances in catalytic production of value-added biochemicals and biofuels via furfural platform derived lignocellulosic biomass Biomass Bioenerg. 148 2021 106033 P. Khemthong, C. Yimsukanan, T. Narkkun, A. Srifa, T. Witoon, S. Pongchaiphol, S. Kiatphuengporn, K. Faungnawakij, Advances in catalytic production of value-added biochemicals and biofuels via furfural platform derived lignocellulosic biomass, Biomass Bioenerg. 148 (2021) 106033. [40] P. Zhou Z. Zhang L. Jiang C. Yu K. Lv J. Sun S. Wang A versatile cobalt catalyst for the reductive amination of carbonyl compounds with nitro compounds by transfer hydrogenation Appl. Catal. B 210 2017 522 532 P. Zhou, Z. Zhang, L. Jiang, C. Yu, K. Lv, J. Sun, S. Wang, A versatile cobalt catalyst for the reductive amination of carbonyl compounds with nitro compounds by transfer hydrogenation, Appl. Catal. B210 (2017) 522-532. [41] Y. Long S. Song J. Li L. Wu Q. Wang Y. Liu R. Jin H. Zhang Pt/CeO2@MOF core@shell nanoreactor for selective hydrogenation of furfural via the channel screening effect ACS Catal. 8 2018 8506 8512 Y. Long, S. Song, J. Li, L. Wu, Q. Wang, Y. Liu, R. Jin, H. Zhang, Pt/CeO2@MOF core@shell nanoreactor for selective hydrogenation of furfural via the channel screening effect, ACS Catal. 8 (2018) 8506-8512. [42] S. Ji Y. Chen S. Zhao W. Chen L. Shi Y. Wang J. Dong Z. Li F. Li C. Chen Q. Peng J. Li D. Wang Y. Li Atomically dispersed ruthenium species inside metal-organic frameworks: combining the high activity of atomic sites and the molecular sieving effect of MOFs Angew. Chem. Int. Ed. 58 2019 4271 4275 S. Ji, Y. Chen, S. Zhao, W. Chen, L. Shi, Y. Wang, J. Dong, Z. Li, F. Li, C. Chen, Q. Peng, J. Li, D. Wang, Y. Li, Atomically dispersed ruthenium species inside metal-organic frameworks: combining the high activity of atomic sites and the molecular sieving effect of MOFs, Angew. Chem. Int. Ed.58 (2019) 4271-4275. [43] H. Ye L. Li D. Liu Q. Fu F. Zhang P. Dai X. Gu X. Zhao Sustained-release method for the directed synthesis of ZIF-derived ultrafine Co-N-C ORR catalysts with embedded Co quantum dots ACS Appl. Mater. Interfaces 12 2020 57847 57858 H. Ye, L. Li, D. Liu, Q. Fu, F. Zhang, P. Dai, X. Gu, X. Zhao, Sustained-release method for the directed synthesis of ZIF-derived ultrafine Co-N-C ORR catalysts with embedded Co quantum dots, ACS Appl. Mater. Interfaces12 (2020) 57847-57858. [44] N. Cheng L. Ren X. Xu Y. Du S.X. Dou Recent development of zeolitic imidazolate frameworks (ZIFs) derived porous carbon based materials as electrocatalysts Adv. Energy Mater. 8 2018 1801257 N. Cheng, L. Ren, X. Xu, Y. Du, S.X. Dou, Recent development of zeolitic imidazolate frameworks (ZIFs) derived porous carbon based materials as electrocatalysts, Adv. Energy Mater.8 (2018) 1801257. [45] Y.-Y. Xue J.-W. Zhang Y.-P. Li H.-P. Li Y. Wang S.-N. Li Y.-C. Jiang M.-C. Hu Q.-G. Zhai Mimic of ferroalloy to develop a bifunctional Fe-organic framework platform for enhanced gas sorption and efficient oxygen evolution electrocatalysis ACS Appl. Mater. Interfaces 12 2020 4432 4442 Y.-Y. Xue, J.-W. Zhang, Y.-P. Li, H.-P. Li, Y. Wang, S.-N. Li, Y.-C. Jiang, M.-C. Hu, Q.-G. Zhai, Mimic of ferroalloy to develop a bifunctional Fe-organic framework platform for enhanced gas sorption and efficient oxygen evolution electrocatalysis, ACS Appl. Mater. Interfaces12 (2020) 4432-4442. [46] Z.-X. Cai Z.-L. Wang J. Kim Y. Yamauchi Hollow functional materials derived from metal-organic frameworks: synthetic strategies, conversion mechanisms, and electrochemical applications Adv. Mater. 31 2019 1804903 Z.-X. Cai, Z.-L. Wang, J. Kim, Y. Yamauchi, Hollow functional materials derived from metal-organic frameworks: synthetic strategies, conversion mechanisms, and electrochemical applications, Adv. Mater.31 (2019) 1804903. [47] C. Wu X. Chen L. Tang Q. Wei X. Wei J. Liang L. Wang Rationally constructing a nano MOF-derived Ni and CQD embedded N-doped carbon nanosphere for the hydrogenation of petroleum resin at low temperature ACS Appl. Mater. Interfaces 13 2021 10855 10869 C. Wu, X. Chen, L. Tang, Q. Wei, X. Wei, J. Liang, L. Wang, Rationally constructing a nano MOF-derived Ni and CQD embedded N-doped carbon nanosphere for the hydrogenation of petroleum resin at low temperature, ACS Appl. Mater. Interfaces13 (2021) 10855-10869. [48] T. Zurrer K. Wong J. Horlyck E.C. Lovell J. Wright N.M. Bedford Z. Han K. Liang J. Scott R. Amal Mixed-metal MOF-74 templated catalysts for efficient carbon dioxide capture and methanation Adv. Funct. Mater. 31 2020 2007624 T. Zurrer, K. Wong, J. Horlyck, E.C. Lovell, J. Wright, N.M. Bedford, Z. Han, K. Liang, J. Scott, R. Amal, Mixed-metal MOF-74 templated catalysts for efficient carbon dioxide capture and methanation, Adv. Funct. Mater.31 (2020) 2007624. [49] Y. Wang L. Yan K. Dastafkan C. Zhao X. Zhao Y. Xue J. Huo S. Li Q. Zhai Lattice matching growth of conductive hierarchical porous MOF/LDH heteronanotube arrays for highly efficient water oxidation Adv. Mater. 33 2021 2006351 Y. Wang, L. Yan, K. Dastafkan, C. Zhao, X. Zhao, Y. Xue, J. Huo, S. Li, Q. Zhai, Lattice matching growth of conductive hierarchical porous MOF/LDH heteronanotube arrays for highly efficient water oxidation, Adv. Mater.33 (2021) 2006351. [50] X. Dai Z. Chen T. Yao L. Zheng Y. Lin W. Liu H. Ju J. Zhu X. Hong S. Wei Y. Wu Y. Li Single Ni sites distributed on N-doped carbon for selective hydrogenation of acetylene Chem. Commun. 53 2017 11568 11571 X. Dai, Z. Chen, T. Yao, L. Zheng, Y. Lin, W. Liu, H. Ju, J. Zhu, X. Hong, S. Wei, Y. Wu, Y. Li, Single Ni sites distributed on N-doped carbon for selective hydrogenation of acetylene, Chem. Commun.53 (2017) 11568-11571. [51] X. Liu L. Wang G. Zhang F. Sun G. Xing C. Tian H. Fu Zinc assisted epitaxial growth of N-doped CNTs-based zeolitic imidazole frameworks derivative for high efficient oxygen reduction reaction in Zn-air battery Chem. Eng. J. 414 2021 127569 X. Liu, L. Wang, G. Zhang, F. Sun, G. Xing, C. Tian, H. Fu, Zinc assisted epitaxial growth of N-doped CNTs-based zeolitic imidazole frameworks derivative for high efficient oxygen reduction reaction in Zn-air battery, Chem. Eng. J.414 (2021) 127569. [52] F. Yang P. Zhao X. Hua W. Luo G. Cheng W. Xing S. Chen A cobalt-based hybrid electrocatalyst derived from a carbon nanotube inserted metal-organic framework for efficient water-splitting J. Mater. Chem. A 4 2016 16057 16063 F. Yang, P. Zhao, X. Hua, W. Luo, G. Cheng, W. Xing, S. Chen, A cobalt-based hybrid electrocatalyst derived from a carbon nanotube inserted metal-organic framework for efficient water-splitting, J. Mater. Chem. A4 (2016) 16057-16063. [53] J. Zhu T. Qu F. Su Y. Wu Y. Kang K. Chen Y. Yao W. Ma B. Yang Y. Dai F. Liang D. Xue Highly dispersed Co nanoparticles decorated on a N-doped defective carbon nano-framework for a hybrid Na-air battery Dalton Trans. 49 2020 1811 1821 J. Zhu, T. Qu, F. Su, Y. Wu, Y. Kang, K. Chen, Y. Yao, W. Ma, B. Yang, Y. Dai, F. Liang, D. Xue, Highly dispersed Co nanoparticles decorated on a N-doped defective carbon nano-framework for a hybrid Na-air battery, Dalton Trans. 49 (2020) 1811-1821. [54] Y. Fan S. Li Y. Wang C. Zhuang X. Liu G. Zhu X. Zou Tuning the synthesis of polymetallic-doped ZIF derived materials for efficient hydrogenation of furfural to furfuryl alcohol Nanoscale 12 2020 18296 18304 Y. Fan, S. Li, Y. Wang, C. Zhuang, X. Liu, G. Zhu, X. Zou, Tuning the synthesis of polymetallic-doped ZIF derived materials for efficient hydrogenation of furfural to furfuryl alcohol, Nanoscale12 (2020) 18296-18304. [55] Y. Chen X. Li J. Zhang L. Dai N. Zhao C. Liu S. Lyu Z. Li Insight into the influence of the graphite layer and cobalt crystalline on a ZIF-67-derived catalyst for Fischer-Tropsch synthesis ACS Appl. Mater. Interfaces 13 2021 9885 9896 Y. Chen, X. Li, J. Zhang, L. Dai, N. Zhao, C. Liu, S. Lyu, Z. Li, Insight into the influence of the graphite layer and cobalt crystalline on a ZIF-67-derived catalyst for Fischer-Tropsch synthesis, ACS Appl. Mater. Interfaces13 (2021) 9885-9896. [56] T. Wang Z. Kou S. Mu J. Liu D. He I.S. Amiinu W. Meng K. Zhou Z. Luo S. Chaemchuen F. Verpoort 2D Dual-metal zeolitic-imidazolate-framework-(ZIF)-derived bifunctional air electrodes with ultrahigh electrochemical properties for rechargeable zinc-air batteries Adv. Funct. Mater. 28 2018 1705048 T. Wang, Z. Kou, S. Mu, J. Liu, D. He, I.S. Amiinu, W. Meng, K. Zhou, Z. Luo, S. Chaemchuen, F. Verpoort, 2D Dual-metal zeolitic-imidazolate-framework-(ZIF)-derived bifunctional air electrodes with ultrahigh electrochemical properties for rechargeable zinc-air batteries, Adv. Funct. Mater.28 (2018) 1705048. [57] L. Xu R. Nie X. Chen Y. Li Y. Jiang X. Lu Formic acid enabled selectivity boosting in transfer hydrogenation of 5-hydroxymethylfurfural to 2,5-furandimethanol on highly dispersed Co-Nx sites Catal. Sci. Technol. 11 2021 1451 1457 L. Xu, R. Nie, X. Chen, Y. Li, Y. Jiang, X. Lu, Formic acid enabled selectivity boosting in transfer hydrogenation of 5-hydroxymethylfurfural to 2,5-furandimethanol on highly dispersed Co-Nx sites, Catal. Sci. Technol.11 (2021) 1451-1457. [58] S. Li Y. Fan C. Wu C. Zhuang Y. Wang X. Li J. Zhao Z. Zheng Selective hydrogenation of furfural over the Co-based catalyst: a subtle synergy with Ni and Zn dopants ACS Appl. Mater. Interfaces 13 2021 8507 8517 S. Li, Y. Fan, C. Wu, C. Zhuang, Y. Wang, X. Li, J. Zhao, Z. Zheng, Selective hydrogenation of furfural over the Co-based catalyst: a subtle synergy with Ni and Zn dopants, ACS Appl. Mater. Interfaces13 (2021) 8507-8517. [59] B. Seoane J.M. Zamaro C. Tellez J. Coronas Sonocrystallization of zeolitic imidazolate frameworks (ZIF-7, ZIF-8, ZIF-11 and ZIF-20) CrystEngComm 14 2012 3103 3107 B. Seoane, J.M. Zamaro, C. Tellez, J. Coronas, Sonocrystallization of zeolitic imidazolate frameworks (ZIF-7, ZIF-8, ZIF-11 and ZIF-20), CrystEngComm14 (2012) 3103-3107.",
      "scopus-id": "85112515217",
      "coredata": {
        "eid": "1-s2.0-S2468823121004417",
        "dc:description": "Furfural, as one of the most important and attractive platform molecules, could produce high-value chemicals through selective hydrogenation, which had attracted wide attention in recent years. Hereon, a ZnCo bimetal ZIF (ZnCo-ZIF-US) was quickly and efficiently prepared by an ultrasonic-assisted method, and a series of nitrogen-doped carbon-coated bimetallic composites (ZnCo-US@NC-T, T refers to the calcination temperature) were prepared by a one-step calcination technique from ZnCo-ZIF-US and their structures were characterized in detail by PXRD, SEM, TEM, and XPS etc. The obtained ZnCo-US@NC-700 showed higher catalytic performance in the selective hydrogenation of furfural to furfuryl alcohol than the derivatives of ZnCo bimetal ZIF prepared without ultrasonic-assisted. Surprisingly, the results showed the presence or absence of Zn in the catalysts could regulate the hydrogenation products of furfural to produce furfuryl alcohol or tetrahydrofurfuryl alcohol. In addition, the catalyst could be recycled with almost no significant change in catalytic performance and its microstructure was still well maintained. This work provides an ingenious strategy for the selective regulation of biomass products.",
        "openArchiveArticle": "false",
        "prism:coverDate": "2021-08-31",
        "openaccessUserLicense": null,
        "prism:aggregationType": "Journal",
        "prism:url": "https://api.elsevier.com/content/article/pii/S2468823121004417",
        "dc:creator": [
          {
            "@_fa": "true",
            "$": "Li, Zhuo-Fei"
          },
          {
            "@_fa": "true",
            "$": "Shen, Yan"
          },
          {
            "@_fa": "true",
            "$": "Cui, Wen-Gang"
          },
          {
            "@_fa": "true",
            "$": "Zhang, Qiang"
          },
          {
            "@_fa": "true",
            "$": "Hu, Tong-Liang"
          }
        ],
        "link": [
          {
            "@_fa": "true",
            "@rel": "self",
            "@href": "https://api.elsevier.com/content/article/pii/S2468823121004417"
          },
          {
            "@_fa": "true",
            "@rel": "scidir",
            "@href": "https://www.sciencedirect.com/science/article/pii/S2468823121004417"
          }
        ],
        "dc:format": "application/json",
        "openaccessType": null,
        "pii": "S2468-8231(21)00441-7",
        "prism:volume": "513",
        "articleNumber": "111824",
        "prism:publisher": "Elsevier B.V.",
        "dc:title": "MOF derived non-noble metal catalysts to control the distribution of furfural selective hydrogenation products",
        "prism:copyright": "© 2021 Elsevier B.V. All rights reserved.",
        "openaccess": "0",
        "prism:issn": "24688231",
        "dcterms:subject": [
          {
            "@_fa": "true",
            "$": "Biomass"
          },
          {
            "@_fa": "true",
            "$": "MOF derived catalyst"
          },
          {
            "@_fa": "true",
            "$": "Selective hydrogenation"
          },
          {
            "@_fa": "true",
            "$": "Furfural"
          }
        ],
        "openaccessArticle": "false",
        "prism:publicationName": "Molecular Catalysis",
        "openaccessSponsorType": null,
        "prism:pageRange": "111824",
        "pubType": "fla",
        "prism:coverDisplayDate": "August 2021",
        "prism:doi": "10.1016/j.mcat.2021.111824",
        "prism:startingPage": "111824",
        "dc:identifier": "doi:10.1016/j.mcat.2021.111824",
        "openaccessSponsorName": null
      },
      "objects": {
        "object": [
          {
            "@category": "standard",
            "@height": "481",
            "@width": "678",
            "@_fa": "true",
            "$": "https://api.elsevier.com/content/object/eid/1-s2.0-S2468823121004417-gr9.jpg?httpAccept=%2A%2F%2A",
            "@multimediatype": "JPEG image file",
            "@type": "IMAGE-DOWNSAMPLED",
            "@size": "86941",
            "@ref": "gr9",
            "@mimetype": "image/jpeg"
          },
          {
            "@category": "standard",
            "@height": "489",
            "@width": "659",
            "@_fa": "true",
            "$": "https://api.elsevier.com/content/object/eid/1-s2.0-S2468823121004417-gr6.jpg?httpAccept=%2A%2F%2A",
            "@multimediatype": "JPEG image file",
            "@type": "IMAGE-DOWNSAMPLED",
            "@size": "76838",
            "@ref": "gr6",
            "@mimetype": "image/jpeg"
          },
          {
            "@category": "standard",
            "@height": "563",
            "@width": "565",
            "@_fa": "true",
            "$": "https://api.elsevier.com/content/object/eid/1-s2.0-S2468823121004417-gr5.jpg?httpAccept=%2A%2F%2A",
            "@multimediatype": "JPEG image file",
            "@type": "IMAGE-DOWNSAMPLED",
            "@size": "77697",
            "@ref": "gr5",
            "@mimetype": "image/jpeg"
          },
          {
            "@category": "standard",
            "@height": "398",
            "@width": "527",
            "@_fa": "true",
            "$": "https://api.elsevier.com/content/object/eid/1-s2.0-S2468823121004417-gr8.jpg?httpAccept=%2A%2F%2A",
            "@multimediatype": "JPEG image file",
            "@type": "IMAGE-DOWNSAMPLED",
            "@size": "36964",
            "@ref": "gr8",
            "@mimetype": "image/jpeg"
          },
          {
            "@category": "standard",
            "@height": "248",
            "@width": "659",
            "@_fa": "true",
            "$": "https://api.elsevier.com/content/object/eid/1-s2.0-S2468823121004417-gr7.jpg?httpAccept=%2A%2F%2A",
            "@multimediatype": "JPEG image file",
            "@type": "IMAGE-DOWNSAMPLED",
            "@size": "44304",
            "@ref": "gr7",
            "@mimetype": "image/jpeg"
          },
          {
            "@category": "standard",
            "@height": "339",
            "@width": "678",
            "@_fa": "true",
            "$": "https://api.elsevier.com/content/object/eid/1-s2.0-S2468823121004417-gr2.jpg?httpAccept=%2A%2F%2A",
            "@multimediatype": "JPEG image file",
            "@type": "IMAGE-DOWNSAMPLED",
            "@size": "61589",
            "@ref": "gr2",
            "@mimetype": "image/jpeg"
          },
          {
            "@category": "standard",
            "@height": "200",
            "@width": "229",
            "@_fa": "true",
            "$": "https://api.elsevier.com/content/object/eid/1-s2.0-S2468823121004417-ga1.jpg?httpAccept=%2A%2F%2A",
            "@multimediatype": "JPEG image file",
            "@type": "IMAGE-DOWNSAMPLED",
            "@size": "21821",
            "@ref": "ga1",
            "@mimetype": "image/jpeg"
          },
          {
            "@category": "standard",
            "@height": "405",
            "@width": "659",
            "@_fa": "true",
            "$": "https://api.elsevier.com/content/object/eid/1-s2.0-S2468823121004417-gr1.jpg?httpAccept=%2A%2F%2A",
            "@multimediatype": "JPEG image file",
            "@type": "IMAGE-DOWNSAMPLED",
            "@size": "71414",
            "@ref": "gr1",
            "@mimetype": "image/jpeg"
          },
          {
            "@category": "standard",
            "@height": "562",
            "@width": "659",
            "@_fa": "true",
            "$": "https://api.elsevier.com/content/object/eid/1-s2.0-S2468823121004417-gr4.jpg?httpAccept=%2A%2F%2A",
            "@multimediatype": "JPEG image file",
            "@type": "IMAGE-DOWNSAMPLED",
            "@size": "88251",
            "@ref": "gr4",
            "@mimetype": "image/jpeg"
          },
          {
            "@category": "standard",
            "@height": "651",
            "@width": "659",
            "@_fa": "true",
            "$": "https://api.elsevier.com/content/object/eid/1-s2.0-S2468823121004417-gr3.jpg?httpAccept=%2A%2F%2A",
            "@multimediatype": "JPEG image file",
            "@type": "IMAGE-DOWNSAMPLED",
            "@size": "159656",
            "@ref": "gr3",
            "@mimetype": "image/jpeg"
          },
          {
            "@category": "thumbnail",
            "@height": "155",
            "@width": "219",
            "@_fa": "true",
            "$": "https://api.elsevier.com/content/object/eid/1-s2.0-S2468823121004417-gr9.sml?httpAccept=%2A%2F%2A",
            "@multimediatype": "GIF image file",
            "@type": "IMAGE-THUMBNAIL",
            "@size": "16408",
            "@ref": "gr9",
            "@mimetype": "image/gif"
          },
          {
            "@category": "thumbnail",
            "@height": "162",
            "@width": "219",
            "@_fa": "true",
            "$": "https://api.elsevier.com/content/object/eid/1-s2.0-S2468823121004417-gr6.sml?httpAccept=%2A%2F%2A",
            "@multimediatype": "GIF image file",
            "@type": "IMAGE-THUMBNAIL",
            "@size": "10856",
            "@ref": "gr6",
            "@mimetype": "image/gif"
          },
          {
            "@category": "thumbnail",
            "@height": "163",
            "@width": "164",
            "@_fa": "true",
            "$": "https://api.elsevier.com/content/object/eid/1-s2.0-S2468823121004417-gr5.sml?httpAccept=%2A%2F%2A",
            "@multimediatype": "GIF image file",
            "@type": "IMAGE-THUMBNAIL",
            "@size": "14885",
            "@ref": "gr5",
            "@mimetype": "image/gif"
          },
          {
            "@category": "thumbnail",
            "@height": "164",
            "@width": "217",
            "@_fa": "true",
            "$": "https://api.elsevier.com/content/object/eid/1-s2.0-S2468823121004417-gr8.sml?httpAccept=%2A%2F%2A",
            "@multimediatype": "GIF image file",
            "@type": "IMAGE-THUMBNAIL",
            "@size": "11563",
            "@ref": "gr8",
            "@mimetype": "image/gif"
          },
          {
            "@category": "thumbnail",
            "@height": "82",
            "@width": "219",
            "@_fa": "true",
            "$": "https://api.elsevier.com/content/object/eid/1-s2.0-S2468823121004417-gr7.sml?httpAccept=%2A%2F%2A",
            "@multimediatype": "GIF image file",
            "@type": "IMAGE-THUMBNAIL",
            "@size": "7669",
            "@ref": "gr7",
            "@mimetype": "image/gif"
          },
          {
            "@category": "thumbnail",
            "@height": "110",
            "@width": "219",
            "@_fa": "true",
            "$": "https://api.elsevier.com/content/object/eid/1-s2.0-S2468823121004417-gr2.sml?httpAccept=%2A%2F%2A",
            "@multimediatype": "GIF image file",
            "@type": "IMAGE-THUMBNAIL",
            "@size": "16016",
            "@ref": "gr2",
            "@mimetype": "image/gif"
          },
          {
            "@category": "thumbnail",
            "@height": "164",
            "@width": "188",
            "@_fa": "true",
            "$": "https://api.elsevier.com/content/object/eid/1-s2.0-S2468823121004417-ga1.sml?httpAccept=%2A%2F%2A",
            "@multimediatype": "GIF image file",
            "@type": "IMAGE-THUMBNAIL",
            "@size": "16374",
            "@ref": "ga1",
            "@mimetype": "image/gif"
          },
          {
            "@category": "thumbnail",
            "@height": "135",
            "@width": "219",
            "@_fa": "true",
            "$": "https://api.elsevier.com/content/object/eid/1-s2.0-S2468823121004417-gr1.sml?httpAccept=%2A%2F%2A",
            "@multimediatype": "GIF image file",
            "@type": "IMAGE-THUMBNAIL",
            "@size": "10538",
            "@ref": "gr1",
            "@mimetype": "image/gif"
          },
          {
            "@category": "thumbnail",
            "@height": "164",
            "@width": "192",
            "@_fa": "true",
            "$": "https://api.elsevier.com/content/object/eid/1-s2.0-S2468823121004417-gr4.sml?httpAccept=%2A%2F%2A",
            "@multimediatype": "GIF image file",
            "@type": "IMAGE-THUMBNAIL",
            "@size": "14567",
            "@ref": "gr4",
            "@mimetype": "image/gif"
          },
          {
            "@category": "thumbnail",
            "@height": "164",
            "@width": "166",
            "@_fa": "true",
            "$": "https://api.elsevier.com/content/object/eid/1-s2.0-S2468823121004417-gr3.sml?httpAccept=%2A%2F%2A",
            "@multimediatype": "GIF image file",
            "@type": "IMAGE-THUMBNAIL",
            "@size": "23790",
            "@ref": "gr3",
            "@mimetype": "image/gif"
          },
          {
            "@category": "high",
            "@height": "2127",
            "@width": "3000",
            "@_fa": "true",
            "$": "https://api.elsevier.com/content/object/eid/1-s2.0-S2468823121004417-gr9_lrg.jpg?httpAccept=%2A%2F%2A",
            "@multimediatype": "JPEG image file",
            "@type": "IMAGE-HIGH-RES",
            "@size": "766829",
            "@ref": "gr9",
            "@mimetype": "image/jpeg"
          },
          {
            "@category": "high",
            "@height": "2163",
            "@width": "2916",
            "@_fa": "true",
            "$": "https://api.elsevier.com/content/object/eid/1-s2.0-S2468823121004417-gr6_lrg.jpg?httpAccept=%2A%2F%2A",
            "@multimediatype": "JPEG image file",
            "@type": "IMAGE-HIGH-RES",
            "@size": "543330",
            "@ref": "gr6",
            "@mimetype": "image/jpeg"
          },
          {
            "@category": "high",
            "@height": "2489",
            "@width": "2500",
            "@_fa": "true",
            "$": "https://api.elsevier.com/content/object/eid/1-s2.0-S2468823121004417-gr5_lrg.jpg?httpAccept=%2A%2F%2A",
            "@multimediatype": "JPEG image file",
            "@type": "IMAGE-HIGH-RES",
            "@size": "695441",
            "@ref": "gr5",
            "@mimetype": "image/jpeg"
          },
          {
            "@category": "high",
            "@height": "1764",
            "@width": "2333",
            "@_fa": "true",
            "$": "https://api.elsevier.com/content/object/eid/1-s2.0-S2468823121004417-gr8_lrg.jpg?httpAccept=%2A%2F%2A",
            "@multimediatype": "JPEG image file",
            "@type": "IMAGE-HIGH-RES",
            "@size": "341486",
            "@ref": "gr8",
            "@mimetype": "image/jpeg"
          },
          {
            "@category": "high",
            "@height": "1096",
            "@width": "2917",
            "@_fa": "true",
            "$": "https://api.elsevier.com/content/object/eid/1-s2.0-S2468823121004417-gr7_lrg.jpg?httpAccept=%2A%2F%2A",
            "@multimediatype": "JPEG image file",
            "@type": "IMAGE-HIGH-RES",
            "@size": "321404",
            "@ref": "gr7",
            "@mimetype": "image/jpeg"
          },
          {
            "@category": "high",
            "@height": "1501",
            "@width": "3000",
            "@_fa": "true",
            "$": "https://api.elsevier.com/content/object/eid/1-s2.0-S2468823121004417-gr2_lrg.jpg?httpAccept=%2A%2F%2A",
            "@multimediatype": "JPEG image file",
            "@type": "IMAGE-HIGH-RES",
            "@size": "581631",
            "@ref": "gr2",
            "@mimetype": "image/jpeg"
          },
          {
            "@category": "high",
            "@height": "886",
            "@width": "1017",
            "@_fa": "true",
            "$": "https://api.elsevier.com/content/object/eid/1-s2.0-S2468823121004417-ga1_lrg.jpg?httpAccept=%2A%2F%2A",
            "@multimediatype": "JPEG image file",
            "@type": "IMAGE-HIGH-RES",
            "@size": "147242",
            "@ref": "ga1",
            "@mimetype": "image/jpeg"
          },
          {
            "@category": "high",
            "@height": "1791",
            "@width": "2916",
            "@_fa": "true",
            "$": "https://api.elsevier.com/content/object/eid/1-s2.0-S2468823121004417-gr1_lrg.jpg?httpAccept=%2A%2F%2A",
            "@multimediatype": "JPEG image file",
            "@type": "IMAGE-HIGH-RES",
            "@size": "489486",
            "@ref": "gr1",
            "@mimetype": "image/jpeg"
          },
          {
            "@category": "high",
            "@height": "2489",
            "@width": "2917",
            "@_fa": "true",
            "$": "https://api.elsevier.com/content/object/eid/1-s2.0-S2468823121004417-gr4_lrg.jpg?httpAccept=%2A%2F%2A",
            "@multimediatype": "JPEG image file",
            "@type": "IMAGE-HIGH-RES",
            "@size": "743133",
            "@ref": "gr4",
            "@mimetype": "image/jpeg"
          },
          {
            "@category": "high",
            "@height": "2883",
            "@width": "2917",
            "@_fa": "true",
            "$": "https://api.elsevier.com/content/object/eid/1-s2.0-S2468823121004417-gr3_lrg.jpg?httpAccept=%2A%2F%2A",
            "@multimediatype": "JPEG image file",
            "@type": "IMAGE-HIGH-RES",
            "@size": "1531498",
            "@ref": "gr3",
            "@mimetype": "image/jpeg"
          },
          {
            "@category": "standard",
            "@_fa": "true",
            "$": "https://api.elsevier.com/content/object/eid/1-s2.0-S2468823121004417-mmc1.docx?httpAccept=%2A%2F%2A",
            "@multimediatype": "Microsoft Word file",
            "@type": "APPLICATION",
            "@size": "2112289",
            "@ref": "mmc1",
            "@mimetype": "application/word"
          },
          {
            "@category": "thumbnail",
            "@_fa": "true",
            "$": "https://api.elsevier.com/content/object/eid/1-s2.0-S2468823121004417-si1.svg?httpAccept=%2A%2F%2A",
            "@multimediatype": "Scalable Vector Graphics file",
            "@type": "ALTIMG",
            "@size": "8259",
            "@ref": "si1",
            "@mimetype": "image/svg+xml"
          },
          {
            "@category": "thumbnail",
            "@_fa": "true",
            "$": "https://api.elsevier.com/content/object/eid/1-s2.0-S2468823121004417-si2.svg?httpAccept=%2A%2F%2A",
            "@multimediatype": "Scalable Vector Graphics file",
            "@type": "ALTIMG",
            "@size": "9714",
            "@ref": "si2",
            "@mimetype": "image/svg+xml"
          },
          {
            "@category": "thumbnail",
            "@_fa": "true",
            "$": "https://api.elsevier.com/content/object/eid/1-s2.0-S2468823121004417-si3.svg?httpAccept=%2A%2F%2A",
            "@multimediatype": "Scalable Vector Graphics file",
            "@type": "ALTIMG",
            "@size": "11155",
            "@ref": "si3",
            "@mimetype": "image/svg+xml"
          },
          {
            "@category": "standard",
            "@_fa": "true",
            "$": "https://api.elsevier.com/content/object/eid/1-s2.0-S2468823121004417-am.pdf?httpAccept=%2A%2F%2A",
            "@multimediatype": "Acrobat PDF file",
            "@type": "AAM-PDF",
            "@size": "2456009",
            "@ref": "am",
            "@mimetype": "application/pdf"
          }
        ]
      },
      "link": {
        "@rel": "abstract",
        "@href": "https://api.elsevier.com/content/abstract/scopus_id/85112515217"
      }
    }
  }
}