{
  "metadata": {
    "title": "Enhanced activity and selectivity of supported europium oxychloride catalysts for ethylene oxychlorination with HCl",
    "authors": "; ; ",
    "journal": "Molecular Catalysis",
    "date": "2021-11-30",
    "doi": "10.1016/j.mcat.2021.111977",
    "abstract": "",
    "uri": "https://api.elsevier.com/content/article/pii/S2468823121005940",
    "pii": "S2468823121005940"
  },
  "fulltext": {
    "full-text-retrieval-response": {
      "scopus-eid": "2-s2.0-85118480580",
      "originalText": "serial JL 315758 291210 291744 291790 291809 31 Molecular Catalysis MOLECULARCATALYSIS 2021-11-02 2021-11-02 2021-11-02 2021-11-02 2021-12-01T15:55:50 1-s2.0-S2468823121005940 S2468-8231(21)00594-0 S2468823121005940 10.1016/j.mcat.2021.111977 S300 S300.1 FULL-TEXT 1-s2.0-S2468823121X00168 2022-12-12T23:36:31.133437Z 0 0 20211101 20211130 2021 2021-11-02T18:26:25.618899Z absattachment articleinfo articlenumber articletitlenorm authfirstinitialnorm authfirstsurnamenorm cid cids contenttype copyright crossmark dateloaded dateloadedtxt datesearch datesort dateupdated dco docsubtype doctype doi eid ewtransactionid hubeid indexeddate issn issnnorm itemstage itemtransactionid itemweight openaccess openarchive pg pgfirst pii piinorm pubdateend pubdatestart pubdatetxt pubyr sectiontitle sortorder srctitle srctitlenorm srctype ssids alllist content subj subheadings suppl tomb volfirst volissue volumelist webpdf webpdfpagecount yearnav figure table e-component body mmlmath acknowledge affil appendices articletitle auth authfirstini authfull authkeywords authlast footnotes highlightsabst primabst ref specialabst 2468-8231 24688231 true 516 516 C Volume 516 31 111977 111977 111977 202111 November 2021 2021-11-01 2021-11-30 2021 Regular Papers article fla © 2021 Elsevier B.V. All rights reserved. ENHANCEDACTIVITYSELECTIVITYSUPPORTEDEUROPIUMOXYCHLORIDECATALYSTSFORETHYLENEOXYCHLORINATIONHCL RO Y 1 Introduction 2 Experimental 2.1 Preparation of catalysts 2.2 Catalyst characterization 2.3 Catalytic tests 3 Results and discussion 3.1 Physicochemical properties of bulk and supported EuOCl catalysts 3.2 Catalytic performance of EuOCl catalysts in ethylene oxychlorination 3.3 Analyses of catalytic properties affecting ethylene oxychlorination 3.3.1 Redox property and oxidation state of europium species 3.3.2 . Acidic property of catalysts 3.3.3 Additional reaction of VCM generating DCE 4 Conclusions CRediT authorship contribution statement Acknowledgments Appendix Supplementary materials References COWFER 2000 6 14 J KIRKOTHMERENCYCLOPEDIACHEMICALTECHNOLOGY VINYLCHLORIDE SCHILDKNECHT 1952 3878 C VINYLRELATEDPOLYMERSPREPARATIONSPROPERTIESAPPLICATIONSINRUBBERSPLASTICSINMEDICALINDUSTRIALARTS MAGISTRO 1986 1056 A GELPERIN 1996 38 50 E ZICHITTELLA 2017 13670 13674 G CARRUBBA 1970 414 419 R MUDDADA 2010 8437 8449 N MARSELLA 2000 1823 1828 A SAIPRASAD 1997 1479 1482 P VAJGLOVA 2018 334 344 Z VALLE 1981 1040 1046 J HALL 1983 343 361 P KORAI 2003 308 314 Y MARSHALL 2000 1 29 K KIRKOTHMERENCYCLOPEDIACHEMICALTECHNOLOGY CHLOROCARBONSCHLOROHYDROCARBONS QI 2020 146310 Y MA 2021 227 234 H BAIDOO 2018 164 171 M OHASHI 2020 117205 T ROUT 2016 7030 7039 K SHI 2016 588 595 D HIGHAM 2017 171 180 M SCHARFE 2016 3120 3124 M SCHARFE 2016 524 534 M VAJGLOVA 2018 41 51 Z TERLINGEN 2021 10574 10588 B SCHARFE 2018 2651 2663 M KANG 2014 158 165 J KIM 2019 1737 1749 D SCHARFE 2020 560 575 M KIM 2018 2185 2190 J ROX2021X111977 ROX2021X111977XY 2023-11-02T00:00:00.000Z 2023-11-02T00:00:00.000Z http://creativecommons.org/licenses/by-nc-nd/4.0/ © 2021 Elsevier B.V. All rights reserved. 2021-11-09T23:38:18.554Z http://vtw.elsevier.com/data/voc/AddOnTypes/50.7/aggregated-refined Hanwha Solution Research & Development Institute Seoul National University SNU Seoul National University http://data.elsevier.com/vocabulary/SciValFunders/501100002551 http://sws.geonames.org/1835841/ This research was supported by the Hanwha Solution Research & Development Institute. The Institute of Engineering Research at Seoul National University provided the research facility for this work. This research was supported by the Hanwha Solution Research & Development Institute. The Institute of Engineering Research at Seoul National University provided the research facility for this work. 0 https://doi.org/10.15223/policy-017 https://doi.org/10.15223/policy-037 https://doi.org/10.15223/policy-012 https://doi.org/10.15223/policy-029 https://doi.org/10.15223/policy-004 item S2468-8231(21)00594-0 S2468823121005940 1-s2.0-S2468823121005940 10.1016/j.mcat.2021.111977 315758 2022-01-20T04:49:04.624231Z 2021-11-01 2021-11-30 1-s2.0-S2468823121005940-main.pdf https://s3-eu-west-1.amazonaws.com/prod-ucs-content-store-eu-west/content/pii:S2468823121005940/MAIN/application/pdf/d06ee672d857a80e9b97abf15d237b42/main.pdf main.pdf pdf true 2224469 MAIN 11 1-s2.0-S2468823121005940-main_1.png https://s3-eu-west-1.amazonaws.com/prod-ucs-content-store-eu-west/content/pii:S2468823121005940/PREVIEW/image/png/94b09f5a35b9734231b9e0b990b73acd/main_1.png main_1.png png 60419 849 656 IMAGE-WEB-PDF 1 1-s2.0-S2468823121005940-gr12.jpg https://s3-eu-west-1.amazonaws.com/prod-ucs-content-store-eu-west/content/pii:S2468823121005940/gr12/DOWNSAMPLED/image/jpeg/9b3667955838b9be3fd70b157223ce00/gr12.jpg gr12 gr12.jpg jpg 23744 443 411 IMAGE-DOWNSAMPLED 1-s2.0-S2468823121005940-gr7.jpg https://s3-eu-west-1.amazonaws.com/prod-ucs-content-store-eu-west/content/pii:S2468823121005940/gr7/DOWNSAMPLED/image/jpeg/44f8b42f993462f1d852646fb753491e/gr7.jpg gr7 gr7.jpg jpg 41345 424 458 IMAGE-DOWNSAMPLED 1-s2.0-S2468823121005940-gr8.jpg https://s3-eu-west-1.amazonaws.com/prod-ucs-content-store-eu-west/content/pii:S2468823121005940/gr8/DOWNSAMPLED/image/jpeg/e6af79303c3f5fd405137bf5dbe96606/gr8.jpg gr8 gr8.jpg jpg 25262 447 414 IMAGE-DOWNSAMPLED 1-s2.0-S2468823121005940-gr9.jpg https://s3-eu-west-1.amazonaws.com/prod-ucs-content-store-eu-west/content/pii:S2468823121005940/gr9/DOWNSAMPLED/image/jpeg/5685231484cd7aeee3961fb75c39794d/gr9.jpg gr9 gr9.jpg jpg 41071 393 436 IMAGE-DOWNSAMPLED 1-s2.0-S2468823121005940-gr10.jpg https://s3-eu-west-1.amazonaws.com/prod-ucs-content-store-eu-west/content/pii:S2468823121005940/gr10/DOWNSAMPLED/image/jpeg/1ef900eefa3e9701db9ba20db79c9c4e/gr10.jpg gr10 gr10.jpg jpg 24455 416 298 IMAGE-DOWNSAMPLED 1-s2.0-S2468823121005940-gr11.jpg https://s3-eu-west-1.amazonaws.com/prod-ucs-content-store-eu-west/content/pii:S2468823121005940/gr11/DOWNSAMPLED/image/jpeg/062a187dc882de683bf29c8d1dfeb5a2/gr11.jpg gr11 gr11.jpg jpg 52389 398 465 IMAGE-DOWNSAMPLED 1-s2.0-S2468823121005940-ga1.jpg https://s3-eu-west-1.amazonaws.com/prod-ucs-content-store-eu-west/content/pii:S2468823121005940/ga1/DOWNSAMPLED/image/jpeg/32f468c616984c9e23ffecf7b192f7ab/ga1.jpg ga1 true ga1.jpg jpg 19066 135 301 IMAGE-DOWNSAMPLED 1-s2.0-S2468823121005940-gr3.jpg https://s3-eu-west-1.amazonaws.com/prod-ucs-content-store-eu-west/content/pii:S2468823121005940/gr3/DOWNSAMPLED/image/jpeg/c4bfe84103d2312fef5783ff46b507a4/gr3.jpg gr3 gr3.jpg jpg 74556 277 666 IMAGE-DOWNSAMPLED 1-s2.0-S2468823121005940-gr4.jpg https://s3-eu-west-1.amazonaws.com/prod-ucs-content-store-eu-west/content/pii:S2468823121005940/gr4/DOWNSAMPLED/image/jpeg/6d92802aa2ea773c5262b6d949283056/gr4.jpg gr4 gr4.jpg jpg 23727 368 371 IMAGE-DOWNSAMPLED 1-s2.0-S2468823121005940-gr5.jpg https://s3-eu-west-1.amazonaws.com/prod-ucs-content-store-eu-west/content/pii:S2468823121005940/gr5/DOWNSAMPLED/image/jpeg/0204fa0693c7562f5663e0bc8f1f3421/gr5.jpg gr5 gr5.jpg jpg 38162 283 640 IMAGE-DOWNSAMPLED 1-s2.0-S2468823121005940-gr6.jpg https://s3-eu-west-1.amazonaws.com/prod-ucs-content-store-eu-west/content/pii:S2468823121005940/gr6/DOWNSAMPLED/image/jpeg/8e29ae3de7e19fa3b138eb79ea3709a0/gr6.jpg gr6 gr6.jpg jpg 30210 459 451 IMAGE-DOWNSAMPLED 1-s2.0-S2468823121005940-gr1.jpg https://s3-eu-west-1.amazonaws.com/prod-ucs-content-store-eu-west/content/pii:S2468823121005940/gr1/DOWNSAMPLED/image/jpeg/16e5bf874e19077da343128108634fad/gr1.jpg gr1 gr1.jpg jpg 45621 455 484 IMAGE-DOWNSAMPLED 1-s2.0-S2468823121005940-gr2.jpg https://s3-eu-west-1.amazonaws.com/prod-ucs-content-store-eu-west/content/pii:S2468823121005940/gr2/DOWNSAMPLED/image/jpeg/1b0aa95fd2bc08a2069b45d6b221c750/gr2.jpg gr2 gr2.jpg jpg 38800 445 483 IMAGE-DOWNSAMPLED 1-s2.0-S2468823121005940-gr12.sml https://s3-eu-west-1.amazonaws.com/prod-ucs-content-store-eu-west/content/pii:S2468823121005940/gr12/THUMBNAIL/image/gif/e243419a26c9200ca043af6f1346f0d6/gr12.sml gr12 gr12.sml sml 3911 164 152 IMAGE-THUMBNAIL 1-s2.0-S2468823121005940-gr7.sml https://s3-eu-west-1.amazonaws.com/prod-ucs-content-store-eu-west/content/pii:S2468823121005940/gr7/THUMBNAIL/image/gif/dec29695dc2369f2dea17c198137792e/gr7.sml gr7 gr7.sml sml 6018 164 177 IMAGE-THUMBNAIL 1-s2.0-S2468823121005940-gr8.sml https://s3-eu-west-1.amazonaws.com/prod-ucs-content-store-eu-west/content/pii:S2468823121005940/gr8/THUMBNAIL/image/gif/e3728809634e7832bd3000a04f52ce58/gr8.sml gr8 gr8.sml sml 4163 164 152 IMAGE-THUMBNAIL 1-s2.0-S2468823121005940-gr9.sml https://s3-eu-west-1.amazonaws.com/prod-ucs-content-store-eu-west/content/pii:S2468823121005940/gr9/THUMBNAIL/image/gif/b4e3ba91d66fe51860112f0667498158/gr9.sml gr9 gr9.sml sml 8082 164 182 IMAGE-THUMBNAIL 1-s2.0-S2468823121005940-gr10.sml https://s3-eu-west-1.amazonaws.com/prod-ucs-content-store-eu-west/content/pii:S2468823121005940/gr10/THUMBNAIL/image/gif/6efc169cfd940abbeaf5c93f821aa337/gr10.sml gr10 gr10.sml sml 6067 163 117 IMAGE-THUMBNAIL 1-s2.0-S2468823121005940-gr11.sml https://s3-eu-west-1.amazonaws.com/prod-ucs-content-store-eu-west/content/pii:S2468823121005940/gr11/THUMBNAIL/image/gif/1e4e833a066cea40bf5fc70b6b3a0ed4/gr11.sml gr11 gr11.sml sml 9926 164 192 IMAGE-THUMBNAIL 1-s2.0-S2468823121005940-ga1.sml https://s3-eu-west-1.amazonaws.com/prod-ucs-content-store-eu-west/content/pii:S2468823121005940/ga1/THUMBNAIL/image/gif/1bc2660e499fd40364f826a59a48e0ba/ga1.sml ga1 true ga1.sml sml 9278 98 219 IMAGE-THUMBNAIL 1-s2.0-S2468823121005940-gr3.sml https://s3-eu-west-1.amazonaws.com/prod-ucs-content-store-eu-west/content/pii:S2468823121005940/gr3/THUMBNAIL/image/gif/2b08c8ef39b3689e23c1efd875035092/gr3.sml gr3 gr3.sml sml 9194 91 219 IMAGE-THUMBNAIL 1-s2.0-S2468823121005940-gr4.sml https://s3-eu-west-1.amazonaws.com/prod-ucs-content-store-eu-west/content/pii:S2468823121005940/gr4/THUMBNAIL/image/gif/edcd1d65be3c71ad9307c50d662a715f/gr4.sml gr4 gr4.sml sml 6003 164 165 IMAGE-THUMBNAIL 1-s2.0-S2468823121005940-gr5.sml https://s3-eu-west-1.amazonaws.com/prod-ucs-content-store-eu-west/content/pii:S2468823121005940/gr5/THUMBNAIL/image/gif/c1b27deeaf72d649015e62c680314312/gr5.sml gr5 gr5.sml sml 6669 97 219 IMAGE-THUMBNAIL 1-s2.0-S2468823121005940-gr6.sml https://s3-eu-west-1.amazonaws.com/prod-ucs-content-store-eu-west/content/pii:S2468823121005940/gr6/THUMBNAIL/image/gif/d449942d84995c77e8c1d4ae00f6cd07/gr6.sml gr6 gr6.sml sml 4343 164 161 IMAGE-THUMBNAIL 1-s2.0-S2468823121005940-gr1.sml https://s3-eu-west-1.amazonaws.com/prod-ucs-content-store-eu-west/content/pii:S2468823121005940/gr1/THUMBNAIL/image/gif/d95f8ccf4bcbfd3f3754aebddab745cf/gr1.sml gr1 gr1.sml sml 6420 164 174 IMAGE-THUMBNAIL 1-s2.0-S2468823121005940-gr2.sml https://s3-eu-west-1.amazonaws.com/prod-ucs-content-store-eu-west/content/pii:S2468823121005940/gr2/THUMBNAIL/image/gif/78174a96b2d4143e4cdfe19af7d8a599/gr2.sml gr2 gr2.sml sml 5241 164 178 IMAGE-THUMBNAIL 1-s2.0-S2468823121005940-gr12_lrg.jpg https://s3-eu-west-1.amazonaws.com/prod-ucs-content-store-eu-west/content/pii:S2468823121005940/gr12/HIGHRES/image/jpeg/da0e0fb0877d4772c77de821186753fd/gr12_lrg.jpg gr12 gr12_lrg.jpg jpg 191785 1960 1819 IMAGE-HIGH-RES 1-s2.0-S2468823121005940-gr7_lrg.jpg https://s3-eu-west-1.amazonaws.com/prod-ucs-content-store-eu-west/content/pii:S2468823121005940/gr7/HIGHRES/image/jpeg/e857934ef74ce16078ef6eebb553bb6a/gr7_lrg.jpg gr7 gr7_lrg.jpg jpg 315033 1878 2028 IMAGE-HIGH-RES 1-s2.0-S2468823121005940-gr8_lrg.jpg https://s3-eu-west-1.amazonaws.com/prod-ucs-content-store-eu-west/content/pii:S2468823121005940/gr8/HIGHRES/image/jpeg/18fbd4620d4c3d6df16a4a33a258aa53/gr8_lrg.jpg gr8 gr8_lrg.jpg jpg 206272 1976 1832 IMAGE-HIGH-RES 1-s2.0-S2468823121005940-gr9_lrg.jpg https://s3-eu-west-1.amazonaws.com/prod-ucs-content-store-eu-west/content/pii:S2468823121005940/gr9/HIGHRES/image/jpeg/9c38b830ff0c6e0e6138c9cc15473b51/gr9_lrg.jpg gr9 gr9_lrg.jpg jpg 330289 1739 1930 IMAGE-HIGH-RES 1-s2.0-S2468823121005940-gr10_lrg.jpg https://s3-eu-west-1.amazonaws.com/prod-ucs-content-store-eu-west/content/pii:S2468823121005940/gr10/HIGHRES/image/jpeg/d601e3ff36efe961d7dd433bf8a8498a/gr10_lrg.jpg gr10 gr10_lrg.jpg jpg 163664 1846 1322 IMAGE-HIGH-RES 1-s2.0-S2468823121005940-gr11_lrg.jpg https://s3-eu-west-1.amazonaws.com/prod-ucs-content-store-eu-west/content/pii:S2468823121005940/gr11/HIGHRES/image/jpeg/1b08bc603c516b007bdfaa5d338a768c/gr11_lrg.jpg gr11 gr11_lrg.jpg jpg 361517 1761 2060 IMAGE-HIGH-RES 1-s2.0-S2468823121005940-ga1_lrg.jpg https://s3-eu-west-1.amazonaws.com/prod-ucs-content-store-eu-west/content/pii:S2468823121005940/ga1/HIGHRES/image/jpeg/5eb99680e33f3ab97b250fa654cbd1fc/ga1_lrg.jpg ga1 true ga1_lrg.jpg jpg 153671 599 1333 IMAGE-HIGH-RES 1-s2.0-S2468823121005940-gr3_lrg.jpg https://s3-eu-west-1.amazonaws.com/prod-ucs-content-store-eu-west/content/pii:S2468823121005940/gr3/HIGHRES/image/jpeg/41625a72394405146bdd8a4cb62719db/gr3_lrg.jpg gr3 gr3_lrg.jpg jpg 486544 1225 2950 IMAGE-HIGH-RES 1-s2.0-S2468823121005940-gr4_lrg.jpg https://s3-eu-west-1.amazonaws.com/prod-ucs-content-store-eu-west/content/pii:S2468823121005940/gr4/HIGHRES/image/jpeg/351321ad754406aab26cb55a29d81843/gr4_lrg.jpg gr4 gr4_lrg.jpg jpg 164218 1630 1643 IMAGE-HIGH-RES 1-s2.0-S2468823121005940-gr5_lrg.jpg https://s3-eu-west-1.amazonaws.com/prod-ucs-content-store-eu-west/content/pii:S2468823121005940/gr5/HIGHRES/image/jpeg/788ee2c531f32a24c5c01014fdf504a9/gr5_lrg.jpg gr5 gr5_lrg.jpg jpg 278006 1252 2834 IMAGE-HIGH-RES 1-s2.0-S2468823121005940-gr6_lrg.jpg https://s3-eu-west-1.amazonaws.com/prod-ucs-content-store-eu-west/content/pii:S2468823121005940/gr6/HIGHRES/image/jpeg/f9162d54b83e67e35aa5b44886f0dea0/gr6_lrg.jpg gr6 gr6_lrg.jpg jpg 243849 2033 1998 IMAGE-HIGH-RES 1-s2.0-S2468823121005940-gr1_lrg.jpg https://s3-eu-west-1.amazonaws.com/prod-ucs-content-store-eu-west/content/pii:S2468823121005940/gr1/HIGHRES/image/jpeg/5f6a620b8d3c7d76bb65c6c811466e68/gr1_lrg.jpg gr1 gr1_lrg.jpg jpg 408528 2016 2145 IMAGE-HIGH-RES 1-s2.0-S2468823121005940-gr2_lrg.jpg https://s3-eu-west-1.amazonaws.com/prod-ucs-content-store-eu-west/content/pii:S2468823121005940/gr2/HIGHRES/image/jpeg/7631d97cd5f9f7b5819d8dc4f827c6fb/gr2_lrg.jpg gr2 gr2_lrg.jpg jpg 286659 1973 2141 IMAGE-HIGH-RES 1-s2.0-S2468823121005940-mmc1.docx https://s3-eu-west-1.amazonaws.com/prod-ucs-content-store-eu-west/content/pii:S2468823121005940/mmc1/MAIN/application/vnd.openxmlformats-officedocument.wordprocessingml.document/7cac977cc855d0df1f4f1c94bae36440/mmc1.docx mmc1 mmc1.docx docx 1667340 APPLICATION 1-s2.0-S2468823121005940-si1.svg https://s3-eu-west-1.amazonaws.com/prod-ucs-content-store-eu-west/content/pii:S2468823121005940/STRIPIN/image/svg+xml/feac8ae71578cd59bb6a52ed8496975d/si1.svg si1 si1.svg svg 9606 ALTIMG 1-s2.0-S2468823121005940-si2.svg https://s3-eu-west-1.amazonaws.com/prod-ucs-content-store-eu-west/content/pii:S2468823121005940/STRIPIN/image/svg+xml/083420c9af91bf0b45f3be9e609b3321/si2.svg si2 si2.svg svg 11645 ALTIMG 1-s2.0-S2468823121005940-si3.svg https://s3-eu-west-1.amazonaws.com/prod-ucs-content-store-eu-west/content/pii:S2468823121005940/STRIPIN/image/svg+xml/c939159984ecb2b9d901c13eda8d8992/si3.svg si3 si3.svg svg 7423 ALTIMG 1-s2.0-S2468823121005940-si4.svg https://s3-eu-west-1.amazonaws.com/prod-ucs-content-store-eu-west/content/pii:S2468823121005940/STRIPIN/image/svg+xml/14449a8fb416d50f5b33dba6f7c18951/si4.svg si4 si4.svg svg 13956 ALTIMG 1-s2.0-S2468823121005940-si5.svg https://s3-eu-west-1.amazonaws.com/prod-ucs-content-store-eu-west/content/pii:S2468823121005940/STRIPIN/image/svg+xml/05a72c80e06b918ddadb742ec1441b0d/si5.svg si5 si5.svg svg 12990 ALTIMG 1-s2.0-S2468823121005940-am.pdf am am.pdf pdf 1285369 AAM-PDF https://s3-eu-west-1.amazonaws.com/prod-ucs-content-store-eu-west/content/egi:10C7SGMGMVP/MAIN/application/pdf/1c2eb49a14d1fad8ec9af1e5b8f37da2/am.pdf MCAT 111977 111977 S2468-8231(21)00594-0 10.1016/j.mcat.2021.111977 Fig. 1 XRD patterns of bulk and supported EuOCl catalysts. Fig 1 Fig. 2 Eu 4d XPS spectra of Eu2O3, EuOCl and supported EuOCl catalysts. Fig 2 Fig. 3 (a) Ethylene conversion, (b) Selectivity of VCM with time on stream in oxychlorination of ethylene over bulk and supported EuOCl catalysts. Fig 3 Fig. 4 Reaction scheme of ethylene oxychlorination leading to EDC and VCM, and side reactions leading to EC or DCE. Fig 4 Fig. 5 (a) Rate of ethylene consumption as a function of the rate of HCl consumption in HCl oxidation at 400 °C and (b) VCM selectivity in ethylene oxychlorination as a function of the temperature of 50% conversion in EDC dehydrochlorination. Fig 5 Fig. 6 H2-TPR profiles of bulk and supported EuOCl catalysts. Fig 6 Fig. 7 XPS spectra and Eu3+ fraction of bulk and supported EuOCl catalysts. Fig 7 Fig. 8 C2H4-TPD profiles of bulk and supported EuOCl catalysts. Fig 8 Fig. 9 NH3-TPD profiles of bulk and supported EuOCl. Fig 9 Fig. 10 (a) Selectivity of VCM, and (b) Carbon content characterized by CHNS analyses after oxychlorination reaction for 24 h as a function of total acidity. Fig 10 Fig. 11 EDC dehydrochlorination over bulk and supported EuOCl as a function of reaction temperature. Fig 11 Fig. 12 VCM-TPD profiles of bulk and supported EuOCl. Fig 12 Table 1 Reaction conditions of ethylene oxychlorination, HCl oxidation and EDC dehydrochlorination. Table 1 Reaction Concentration (vol%), FT = 100 ml/min C2H4 EDC VCM HCl O2 Ne C2H4 oxychlorination 3 – – 4.8 3 3 HCl oxidation – – – 4.8 3 3 EDC dehydrochlorination – 3 – – 3 3 Table 2 Textural properties of the bulk and supported EuOCl catalysts. Table 2 Catalyst EuOCl (wt%) a Cl/Eu ratio a Specific surface area (m2/g) b Pore volume (cm3/g) c Support Fresh Support Fresh EuOCl – 1.08 (± 0.03) – 23 – 0.13 EuOCl/SiO2 18.9 1.32 (± 0.05) 368 303 0.68 0.42 EuOCl/ZrO2 19.6 1.24 (± 0.06) 74 51 0.45 0.20 EuOCl/TiO2 21.6 1.41 (± 0.10) 55 41 0.47 0.21 EuOCl/Al2O3 22.2 1.65 (± 0.07) 197 139 0.92 0.64 EuOCl/Y 21.4 1.62 (± 0.09) 839 641 0.72 0.53 a Determined by EDX analyses. b Determined by BET equation. c Total pore volume at P/P0 = 0.99. Table 3 Comparison of results of ethylene oxychlorination at 400 °C after reaction for 4 h (Conversion, Yield, Selectivity in %). Table 3 Catalyst C2H4 conversion (%) EDC yield (%) VCM yield (%) EDC selectivity (%) VCM selectivity (%) C2H5Cl selectivity (%) C2H2Cl2 selectivity (%) EuOCl 6 1.4 4.5 23 75 2 – EuOCl/SiO2 8 1.1 5.8 18 72 10 – EuOCl/ZrO2 9 2.1 6.3 23 70 7 – EuOCl/TiO2 13 2.2 10.3 17 79 4 – EuOCl/Al2O3 15 2.0 12.2 15 81 2 2 EuOCl/Y 18 0.3 16.2 2 90 2 6 Table 4 Adsorption amount of C2H4 and VCM. Table 4 Catalyst Adsorbed C2H4 (μmol/g) a Adsorbed VCM (μmol/g) b EuOCl 8 13 EuOCl/SiO2 12 15 EuOCl/ZrO2 11 13 EuOCl/TiO2 20 18 EuOCl/Al2O3 23 24 EuOCl/Y 28 69 a Calculated by integration of Fig. 6. b Calculated by integration of Fig. 10. Table 5 Acidic properties of catalysts before and after impregnation of EuOCl. Table 5 Catalyst Total acidity (μmol/g) EuOCl 124 SiO2 11 EuOCl/SiO2 216 ZrO2 20 EuOCl/ZrO2 194 TiO2 85 EuOCl/TiO2 295 Al2O3 64 EuOCl/Al2O3 343 Zeolite Y 431 EuOCl/Y 524 Enhanced activity and selectivity of supported europium oxychloride catalysts for ethylene oxychlorination with HCl Youngsoo Ro Conceptualization Investigation Writing – original draft Writing – review & editing a 1 Seungwon Park Investigation Writing – original draft Writing – review & editing b 1 Young-Jin Cho Funding acquisition Writing – review & editing b Do Heui Kim Supervision Conceptualization Funding acquisition Writing – review & editing a ⁎ a School of Chemical and Biological Engineering, Institute of Chemical Processes, Seoul National University, 1 Gwanak-ro, Gwanak-gu, Seoul 08826, Republic of Korea School of Chemical and Biological Engineering Institute of Chemical Processes Seoul National University 1 Gwanak-ro, Gwanak-gu Seoul 08826 Republic of Korea aSchool of Chemical and Biological Engineering, Institute of Chemical Processes, Seoul National University, 1 Gwanak-ro, Gwanak-gu, Seoul 08826, Republic of Korea b Hanhwa Solutions Research and Development Institute, 305 Pangyo-ro, Bundang-gu, Seongnam-si, Gyeonggi-do 13488, Republic of Korea Hanhwa Solutions Research and Development Institute 305 Pangyo-ro, Bundang-gu Seongnam-si Gyeonggi-do 13488 Republic of Korea bHanhwa Solutions Research and Development Institute, 305 Pangyo-ro, Bundang-gu, Seongnam-si, Gyeonggi-do 13488, Republic of Korea ⁎ Corresponding author. 1 These authors contributed equally to this work. A series of supported EuOCl catalysts, and bulk EuOCl catalyst were selected for ethylene oxychlorination with HCl to produce a VCM. The supported EuOCl catalysts showed higher ethylene conversion and VCM yield than those of bulk EuOCl despite the low Eu content. The EuOCl/Y catalysts demonstrated the highest ethylene conversion and VCM selectivity followed by EuOCl/Al2O3. The catalysts were characterized in terms of redox properties, acidic properties, and adsorption behavior of the reactant and product. The reduction temperature of europium species decreased when EuOCl was loaded on various supports. The activity of HCl oxidation is strongly related to the improved redox properties, resulting in better activation of the reactant. We demonstrated that the number of acidic sites was proportional to the dehydrochlorination activity of EDC. Investigation of the adsorption behavior of C2H4 showed that the number of oxygen vacancies increased on the supported EuOCl catalysts. EuOCl/Y and EuOCl/Al2O3 catalysts, showed good catalytic performance, exhibited better redox and acidic properties, and had higher amounts of oxygen vacancies than the other catalysts. However, EuOCl/Y with excessively high acidity showed deactivation with time-on-stream owing to carbon deposition. Therefore, EuOCl/Al2O3 was found to be the most suitable supported catalyst for the oxychlorination of ethylene. Graphical abstract Image, graphical abstract Keywords Ethylene oxychlorination Direct production of VCM from ethylene Europium oxychloride Support effect 1 Introduction Polyvinyl chloride (PVC) is one of the most important polymeric materials used in various industries. PVC has excellent flame retardancy, durability, oil resistance, and chemical resistance. Moreover, because it is comprised of 60% chlorine from industrial salts, it is an energy-saving plastic which conserves oil resources [1–3]. PVC is produced by the polymerization of the vinyl chloride monomer (VCM). Currently, the commercial process for producing VCM can be classified into two types: acetylene hydrochlorination and a balanced process involving oxychlorination of ethylene and chlorination of ethylene [2–5]. Except for regions such as China, where acetylene can be supplied cheaply from coal, most of the processes producing VCM use ethylene as a feedstock. The process of producing VCM from ethylene consists of two steps. The first step is the ethylene oxychlorination process, where ethylene reacts with oxygen and HCl over promoted CuCl2/Al2O3, producing 1, 2-dichloroethane (EDC) [6–12]. The second step is the non-catalytic thermal cracking of EDC forming VCM above 500 °C [8–10,13,14]. Although these processes produce high yields of VCM, there are some disadvantages that lead to a reduction in the efficiency of the process. Volatilization and particle agglomeration of cupric chloride species are the main limitations of this process. Although the cupric chloride species have high activity transferring Cl to ethylene, gradual loss of the active phase of the catalysts occurs as the reaction proceeds because of its volatility and low melting point [6–12]. The instability of cupric chloride can be suppressed by adding promoters such as alkali metals (Na, K) and alkaline earth metals (Mg, Ca), however, the effect of promoters is insufficient to prevent CuCl2 loss [15–20]. To overcome the limitation of instability of CuCl2 based catalysts, various attempts have been made to discover new active phases with a stable structures and high activity [21]. Recently, it was reported that bulk CeO2 and EuOCl-based catalysts exhibited good activity in ethylene oxychlorination while maintaining a stable structure [22,23]. Additionally, it was discovered that bulk CeO2 and EuOCl catalysts directly produce VCM with high selectivity via oxychlorination of ethylene with HCl and O2. These unique features of the catalysts are considered an opportunity to develop an efficient process to produce VCM from ethylene by removing the EDC thermal cracking process, which is the most energy-intensive part of the entire process. In particular, bulk EuOCl catalysts are less active but highly selective toward VCM compared to bulk CeO2 catalysts. They also display a low selectivity toward carbon oxides (COx) originating from overoxidation [23]. However, the higher cost of europium compared to that of ceria limits the chances of its potential commercial success. In previous studies, bulk EuOCl catalysts were synthesized by the precipitation method, which showed a low yield of catalysts compared to the amount of europium precursor used [23]. These drawbacks make it difficult to apply europium catalysts to ethylene oxychlorination. In the case of CuCl2-based catalyst, there have been many studies on the support effect to improve the stability and performance of the catalyst [7,8,10,18]. Vajglová et al. reported that the characteristic of the support has a significant effect on catalytic performance of CuCl2-based catalyst [24]. Therefore, this study aims to develop highly selective supported EuOCl catalysts for the direct production of VCM from ethylene oxychlorination. First, EuOCl was impregnated on various supports such as γ-Al2O3, TiO2, ZrO2, SiO2 and Y zeolite, to achieve a high Eu atom economy. In addition, the physicochemical properties and elementary reactions such as HCl oxidation and EDC dehydrochlorination of the supported catalyst were investigated to elucidate the role of the catalytic function in the reaction pathway. 2 Experimental 2.1 Preparation of catalysts Supports such as Al2O3 (SBA-200, Sasol), TiO2 (P25, Degussa), SiO2 (Sigma-Aldrich), ZrO2 (Sigma-Aldrich), and zeolite Y (CBV 760, Zeolyst, SiO2/Al2O3 = 60) were calcined at 550 °C prior to impregnation. For comparison, bulk EuOCl was synthesized using the precipitation method, following the process reported in the literature [23]. Briefly, europium nitrate (Eu(NO3)3∙6H2O (Sigma-Aldrich, 99.9%)) was dissolved in deionized water under stirring and the precipitation was achieved by dropwise addition of aqueous NH4OH (Samchun, 30%) until a pH of 10.5 was reached. The slurry was stirred for 4 h and washed with deionized water. After filtration, the precipitate was dried at 120 °C for 12 h and calcined in flowing air at a heating rate of 5 °C/min followed by an isothermal step at 550 °C for 5 h. Wet impregnation was used as a standard method to synthesize europium-supported catalysts. An appropriate amount of Eu(NO3)3∙6H2O (Sigma-Aldrich, 99.9%) was dissolved in 25 ml of ethanol and added to the supports. All catalysts were synthesized with 23 wt% europium content. The materials were periodically sonicated at 40 °C until the solvent was dried. The resulting material was dried at 120 °C for 12 h and calcined at 550 °C in flowing air at a heating rate of 5 °C/min and an isothermal step for 5 h. The catalysts were pretreated before characterization and reaction for 1 h in a flow of HCl to convert Eu2O3 into EuOCl. The pretreated catalysts were named EuOCl/S, where S denotes the support. 2.2 Catalyst characterization Nitrogen adsorption-desorption isotherms were acquired using a BELSORP-mini II (BEL Japan) apparatus. The samples were outgassed at 200 °C for 2 h before each measurement. The surface areas of the catalysts were calculated using the Brunauer-Emmet-Teller (BET) method. The total pore volumes of the catalysts were calculated as P/P0 = 0.99. The crystal structures of the catalysts were investigated using X-ray powder diffraction (XRD) measurements conducted in a D -Max2500-PC (Rigaku) instrument using Cu–Kα radiation (λ = 1.541 Å, 50 kV, 100 mA). The XRD patterns of the catalysts were recorded in the range of 20.0 ˚−80.0 ˚. The europium and chlorine contents were investigated using energy dispersive X-ray microanalysis (SEM-EDX). Temperature-programmed reduction of hydrogen (H2-TPR) analysis was performed using a BELCAT-II unit equipped with a thermal conductivity detector. The catalysts (50 mg) were pretreated under a flow of nitrogen (20 mL/min) at 200 °C for 1 h in a U-shaped quartz reactor. After the pretreatment process, the furnace temperature was cooled to room temperature and increased to 900 °C at a ramping rate of 10 °C/min under a mixed flow of nitrogen (20 mL/min) and hydrogen (2 mL/min). Hydrogen consumption was measured using a thermal conductivity detector (TCD). X-ray photoelectron spectroscopy (XPS) analysis was conducted using a VG Multilab 2000 spectrometer (Thermo Electron Corporation) with an Al Kα X-ray source (1486.6 eV). Temperature-programmed desorption of ethylene (C2H4-TPD) and vinyl chloride (VCM-TPD) analyses was performed using mass chromatography (5975 MSD Series, Agilent). In the case of C2H4-TPD, the catalysts (50 mg) were pretreated with nitrogen (20 mL/min) at 200 °C for 1 h in a U-shaped quartz reactor. After the pretreatment process, C2H4 adsorption proceeded under a flow of ethylene (5 mL/min, 5 vol%) for 1 h, and then the catalysts were treated under a flow of nitrogen (10 mL/min) at 100 °C for 1 h. Finally, the furnace temperature was increased to 500 °C at a ramping rate of 10 °C/min under a flow of nitrogen (20 mL/min). Ethylene desorption was detected using a mass detector (m/z = 27). VCM-TPD underwent the same process as C2H4-TPD and VCM desorption was detected with a mass detector (m/z = 62). Temperature-programmed desorption of ammonia (NH3-TPD) analysis was performed using mass chromatography (5975 MSD Series, Agilent). The catalysts (50 mg) were loaded into a U-shaped quartz reactor, pretreated in He (20 mL/min) at 200 °C for 1 h, and cooled to 50 °C in He. Ammonia was adsorbed at 50 °C with 5 vol% NH3/He for 1 h followed by pretreatment at 100 °C for 1 h to remove physisorbed NH3. Desorption of chemisorbed NH3 was monitored in the range of 50–800 °C at a heating rate of 10 °C/min under a He flow of 20 mL/min. Ammonia desorption was detected using a mass detector (m/z = 17). Element analysis (EA-CHNS) was conducted using TruSpec Micro CHNS. 2.3 Catalytic tests The oxychlorination reaction of ethylene was performed at ambient pressure in a continuous-flow fixed-bed reactor. The gas reaction system consisted of mass flow controllers (Bronkhorst) to introduce C2H4, O2, HCl, N2 as a carrier gas, Ne as an internal standard at a 100 mL/min total volumetric flow (FT), and an electronic syringe pump to inject liquid EDC (Sigma-Aldrich, 99.8%). To neutralize the acidic component, the effluent gas was passed through an NaOH solution. The catalysts (Wcat = 0.5 g) were loaded into the reactor and heated to 400 °C in N2 at a heating rate of 10 °C/min. The loaded catalysts were examined after exposure to the designated feed composition (Table 1 ) for an hour. Ethylene and chlorinated compounds in the effluent gas (C2H4, C2H3Cl, C2H4Cl2, and C2H2Cl2) were quantified using a flame-ionized detector in an on-line gas chromatograph, equipped with a DB-VRX column. Other compounds in the effluent gas, such as Ne, O2, N2, CO, and CO2, were quantified using a TCD equipped with Molecular Sieve 13X and Porapak N columns. The conversion of reactant, yield and selectivity of products was calculated using the following equations, where Xi, Si, Yi, ni and NC,j represent the conversion, selectivity, yield, stoichiometric factor and the number of carbon atoms in the compound for carbon-containing products, respectively. (1) X i = n i inlet − n i outlet n i inlet × 100 % (2) S j = n j outlet × N C , j ∑ n j outlet × N C , j × 100 % (3) Y j = X i × S j 100 % The oxidation of HCl was performed according to the conditions listed in Table 1. The conversion of HCl was quantified by iodometric titration of Cl2. The outlet gas was bubbled through a 0.25 M aqueous KI solution (Samchun, 99.5%), and then titrated with 0.05 N sodium thiosulfate solution (Supelco) using starch solution as the indicator. The conversion of HCl was calculated using the following equation. (4) X HCl = 2 n C l 2 outlet n H C l inlet × 100 % The dehydrochlorination of EDC was conducted under the conditions listed in Table 1. At such a relatively low reaction temperature, there is almost no CO or CO2 production resulting from overoxidation. Therefore, the molar flow of the injected EDC was calculated as the sum of the EDC and VCM molar flow of the outlet gas. (5) X E D C = n V C M outlet n E D C outlet + n V C M outlet × 100 % 3 Results and discussion 3.1 Physicochemical properties of bulk and supported EuOCl catalysts The specific surface areas of the supports and the fresh EuOCl supported catalysts were analyzed. As summarized in Table 2 , the bulk and supported catalysts except EuOCl/Y showed IV-type isotherms which indicates mesoporous structure. The isotherm of EuOCl/Y exhibited I-type hysteresis which indicates the well-developed microporous structure. For the case of supported catalysts, the surface areas and pore volume decreased due to the pore blockage by europium species. SEM-EDX analysis was carried out to calculate the EuOCl content of the catalysts (Fig. S1). Table 2 shows the EuOCl content in wt.%. Compared to the nominal content (23 wt.%), the results indicated that europium species were successfully introduced to various supports by the impregnation method. Catalysts using Al2O3, TiO2, and zeolite Y as the support showed slightly lower EuOCl content than the nominal content, while, EuOCl/SiO2 showed the lowest EuOCl (18.9 wt.%). Cl/Eu ratio was also calculated to confirm the generation of EuOCl species from Eu2O3. The supported catalysts showed slightly higher Cl to Eu ratios than EuOCl because of the additional Cl adsorption on the support material. XRD analysis was performed to investigate the crystal structures of bulk EuOCl and supported catalysts. Fig. 1 shows the XRD patterns of bulk EuOCl, EuOCl/Al2O3, EuOCl/TiO2, EuOCl/SiO2, EuOCl/ZrO2, and EuOCl/Y. Bulk EuOCl showed main diffraction peaks at 26.9 ˚, 32.2 ˚, 35.0 ˚, 45.4 ˚, 53.8 ˚, and 59.3 ˚, corresponding to the cubic EuOCl structure (ICDD PDF 73–7281). Interestingly, despite the high Eu content of 23 wt%, the diffraction peaks of EuOCl were not observed in the XRD patterns of the supported catalysts regardless of the type of support, indicating that europium exists in a highly dispersed state. XPS analysis was conducted to confirm the state of the Eu species. Fig. 2 shows the Eu 4d5/2 and Eu 4d3/2 peaks of bulk and supported EuOCl catalysts pretreated with HCl and fresh Eu2O3. Both Eu 4d peaks of the catalysts pretreated with HCl were shifted to a high binding energy of 2 eV, which is assigned to the formation of EuOCl because chlorine is a highly electronegative element [23]. Hence, it was confirmed that Eu2O3 was converted to EuOCl in the supported and bulk catalysts after HCl pretreatment [25]. 3.2 Catalytic performance of EuOCl catalysts in ethylene oxychlorination The catalytic performance of the bulk and supported EuOCl catalysts was evaluated in ethylene oxychlorination. Fig. 3 (a) shows the ethylene conversion, while Fig. 3(b) shows the VCM selectivity at 400 °C with time on stream. The detailed results of the catalytic performance in ethylene oxychlorination are summarized in Table 3 . All catalysts except EuOCl/Y retained stable catalytic activity during the reaction for 24 h. EuOCl/Y showed a gradual decrease in ethylene conversion and VCM selectivity after reaction for 12 h, indicating that the catalyst supported on Y undergoes deactivation with time-on-stream. Therefore, the catalytic performance of the EuOCl catalysts changed depending on the type of support. In the case of ethylene conversion, although the content of europium was 23% compared to bulk EuOCl, all supported EuOCl catalysts showed higher conversion than bulk EuOCl, indicating improved catalytic efficiency of the Eu atom. EuOCl/SiO2 and EuOCl/ZrO2 exhibited slightly higher ethylene conversions than bulk EuOCl, while the VCM selectivity was lower because of the high C2H5Cl (EC) selectivity of 7−10%. The EuOCl/Al2O3, EuOCl/TiO2 and EuOCl/Y catalysts showed significant enhancements in ethylene conversion and VCM selectivity compared to the bulk EuOCl catalyst. Some highly reactive catalysts produced overchlorinated products such as C2H2Cl2 (DCE). EuOCl/Y showed the highest ethylene conversion and VCM selectivity where 6% of DCE was produced, and 2% of DCE was produced over EuOCl/Al2O3. Production of COx was not observed in any of the EuOCl catalysts, because europium species have redox properties that activate ethylene and HCl but do not cause overoxidation of products such as COx [23]. As previously discussed, the process of directly producing VCM from ethylene on EuOCl-based catalysts is a stepwise reaction consisting of consecutive elementary reactions and undesirable side reactions, as shown in Fig. 4 [26]. The reaction starts with the oxychlorination of ethylene to EDC (Step 1), and sequential dehydrochlorination of EDC to yield VCM (Step 2). EC is generated by the chlorination of ethylene (Step 3), and DCE is produced by additional oxychlorination of VCM (Step 4) or oxidation of EDC (Step 5). To observe the activity of the catalysts in each elementary reaction, two elementary reactions were performed (Table 1). Firstly, the HCl oxidation reaction was conducted to check the activation ability to cleave the HCl bond because both HCl oxidation and ethylene oxychlorination reactions require HCl activation under similar reaction conditions (Fig. S2). Fig. 5 a shows the rate of ethylene consumption in oxychlorination as a function of the rate of HCl oxidation at 400 °C over bulk and supported EuOCl catalysts. A positive correlation between the two reaction rates was observed, indicating that the ability to activate HCl was proportional to the activity of the catalyst in ethylene oxychlorination. Therefore, the activity of a catalyst in ethylene oxychlorination is influenced by its ability to activate both ethylene and HCl. Secondly, the EDC dehydrochlorination reaction was conducted on bulk and supported EuOCl catalysts as the reaction temperature increased from 240 °C to 420 °C. Fig. 5b shows the selectivity of VCM as a function of the temperature at which 50% conversion is achieved in EDC dehydrochlorination (T50). We confirmed that the catalysts promoting the dehydrochlorinaiton of EDC at lower temperatures have higher VCM selectivity in ethylene oxychlorination. Therefore, the negative correlation between T50 of EDC dehydrochlorination and VCM selectivity in ethylene oxychlorination indicates that the catalyst with high VCM selectivity in ethylene oxychlorination also has superior activity for EDC dehydrochlorination. 3.3 Analyses of catalytic properties affecting ethylene oxychlorination 3.3.1 Redox property and oxidation state of europium species Previous research has indicated that the redox property of the catalyst plays an important role in the production of EDC by oxychlorination of ethylene [15–23]. During the oxychlorination reaction, the active metal is reduced during the transfer of chlorine to ethylene [6,24]. After the reduced active metal returns to its original state through a series of oxidation processes, it participates in the reaction [6, 24]. Therefore, catalysts with high redox properties tend to show high activity in the oxychlorination of ethylene. To measure the redox properties of the bulk and supported EuOCl catalysts, H2-TPR measurements were performed. The H2-TPR profile of bulk EuOCl (Fig. 6 ) displayed hydrogen consumption peaks at 601 °C and 834 °C. Each peak corresponds to the reduction of the near-surface oxygen species and bulk oxygen species, respectively [27]. The H2-TPR profiles of all EuOCl supported catalysts showed a low intensity of peaks originating from the reduction of bulk oxygen species. These results indicate that most of the EuOCl particles exist in a highly dispersed state, which corresponds well with the XRD results. It was also observed that the H2 consumption peak of surface oxygen species shifted depending on the type of support. The H2 consumption temperature decreased in the order of bulk EuOCl (601 °C) > EuOCl/ZrO2 (599 °C) > EuOCl/SiO2 (597 °C) > EuOCl/TiO2 (587 °C) > EuOCl/Al2O3 (584 °C) > EuOCl/Y (576 °C). As expected, it was confirmed that the reducibility of europium species was improved on the supported catalysts. Moreover, the catalysts reduced at low temperatures showed a high conversion of ethylene. XPS analysis was conducted to investigate the detailed oxidation state of the europium species. Investigation of Eu 3d5/2 spectra revealed that the oxidation state of europium species varies depending on the presence or type of support [28,29]. EuOCl/Y exhibited the lowest Eu3+ fraction, followed by EuOCl/ Al2O3, EuOCl/TiO2, EuOCl/ZrO2, EuOCl/SiO2 and bulk EuOCl (Fig. 7 ). This order of decreasing Eu3+ fraction and increasing Eu2+ fraction agrees well with the ethylene conversion. These results are related to the oxygen vacancies that act as adsorption sites for ethylene. As the active metal is in a more reduced state, the number of oxygen vacancies increases [29,30]. Therefore, the catalyst that exhibits a higher Eu2+ fraction has more oxygen vacancies and activates ethylene and HCl more easily (Fig. 5a). In addition to the redox property, the adsorption behavior of ethylene also affects the ethylene oxychlorination step. It has been reported that the adsorption energies of ethylene and chlorinated products such as EDC, VCM, EC, and DCE depend on the surface environment of the catalyst, and such changes in adsorption energy affect the reaction activity of the catalysts in each reaction step [26]. Because ethylene generally has the weakest adsorption energy among all reactants and products, the change in the adsorption behavior of ethylene is one of the factors affecting the activity of the oxychlorination reaction. For ethylene to adsorb well, the presence of oxygen vacancies or chlorinated vacancies is required [26]. To elucidate the adsorption properties of ethylene, C2H4-TPD analysis was conducted. As shown in Table 4 , the catalysts supported over Y, Al2O3, and TiO2 exhibited relatively larger amounts of adsorbed ethylene than the rest of the catalysts. This tendency is also consistent with the results of XPS analysis, as the europium species is in a reductive state, and the number of oxygen vacancies that function as adsorption sites for ethylene increases. It was also observed that supported EuOCl catalysts adsorb ethylene more strongly than bulk EuOCl. EuOCl/Y was found to absorb ethylene with the strongest bond. The adsorbed ethylene desorbed at 183 °C, which is higher than the desorption temperature of bulk EuOCl (162 °C) by 21 °C. EuOCl/Al2O3 (178 °C) and EuOCl/TiO2 (175 °C) exhibited slight differences. EuOCl/SiO2 (168 °C) and EuOCl/ZrO2 (164 °C) exhibited similar adsorption intensities to bulk EuOCl (Fig. 8 ). These results suggest that the presence and type of support changes not only the number of vacancies but also the properties of vacancies, which determine the adsorption strength of ethylene. 3.3.2 . Acidic property of catalysts The acidic properties of the catalysts play an important role in the dehydrochlorination of EDC to produce the desired product, VCM [21–23]. The catalyst with large number of acid sites exhibited high catalytic activity in the EDC dehydrochlorination reaction at low temperatures [29]. However, it has been shown that if acidity is excessive, coke formation by additional chlorination or oligomerization is promoted, which adversely affects the long-term activity of the catalysts [29]. To examine the acidic properties of the bulk and supported EuOCl catalysts, NH3-TPD analysis was performed. The supports and supported catalysts were analyzed to determine the changes in the acidic properties caused by the loading of EuOCl. The europium-supported catalysts showed substantial increases in total acidity as summarized in Table 5 . The NH3-TPD profiles of the supported catalysts showed that the trend of increasing acid sites differed on the support (Fig. 9 ). EuOCl/Al2O3, EuOCl/TiO2, and EuOCl/Y exhibited higher NH3 desorption amounts over 400 °C than the other catalysts. EuOCl/Al2O3 showed the highest number of acid sites over 400 °C, whereas EuOCl/Y exhibited the highest total acidity. The supported catalysts showed higher total acidity than bulk EuOCl because of the high dispersion of europium and the influence of the support. Fig. 10 shows the VCM selectivity and carbon deposition amount after 24 h of reaction as a function of the amount of total acidity. Both VCM selectivity and carbon deposition amount were positively correlated with the total acidity. It was revealed that the amount of carbon deposited on EuOCl/Y was extremely high compared to other supported EuOCl catalysts. This carbon deposition is responsible for the deactivation of EuOCl/Y after 12 h of reaction. To confirm the effect of the acid properties of the catalyst on the catalytic dehydrochlorination of EDC, EDC dehydrochlorination was performed at temperatures between 240 and 420 °C (Fig. 11 ). Bulk EuOCl started to show reactivity at 285 °C and showed 100% conversion of EDC at 410 °C. The supported EuOCl catalysts showed higher reactivity than bulk EuOCl which achieved 100% conversion of EDC at lower temperatures. The catalytic activity of the catalysts decreased in the order EuOCl/Y (320 °C) > EuOCl/Al2O3 (335 °C) > EuOCl/TiO2 (365 °C) > EuOCl/SiO2 (380 °C) > EuOCl/ZrO2 (395 °C) > EuOCl (410 °C). Catalytic activity of EDC dehydrochlorination is inversely proportional to T50 and consistent with the VCM selectivity. This shows that the acidic properties of the catalysts are strongly correlated with the conversion of EDC to VCM (Fig. 5b). 3.3.3 Additional reaction of VCM generating DCE Among the supported EuOCl catalysts, the EuOCl/Al2O3 and EuOCl/Y catalysts exhibited high selectivity for DCE. Although several mechanisms by which DCE is produced are known, the main pathway is Cl uptake by the additional reaction of VCM [26]. This mechanism is related to the adsorption behavior of VCMs. On the surface where oxygen vacancies or chlorinated vacancies exist, the adsorption strength of VCM is lower than that of other products such as EDC, EC, and DCE. Therefore, the intermediate product does not desorb well until VCM is formed, after which it is easily desorbed and does not undergo an additional reaction, resulting in high VCM selectivity [26]. VCM-TPD analysis was performed to investigate the adsorption energy of VCM on bulk and supported EuOCl catalysts. As shown in Fig. 12 , EuOCl/Y and EuOCl/Al2O3 which produced DCE more abundantly, exhibited higher desorption temperatures. The EuOCl/Y catalyst showed the highest VCM desorption temperature (221 °C) and adsorption amount compared to the other catalysts, which explains the high DCE selectivity of 6%. (Table 4) In addition, since the reaction producing DCE is also a reaction in which Cl is transferred from activated HCl, it is affected by the redox properties of the catalysts. EuOCl/Y and EuOCl/Al2O3 having higher redox properties demonstrated the higher HCl consumption rate than other catalysts as shown in Fig. 5a. Therefore, to inhibit the generation of DCE, the redox properties should be optimized to an appropriate level. These results confirm that the main generation pathway of DCE is Cl uptake by the additional reaction of VCM, meaning that rapid desorption of VCM is an important step in inhibiting additional DCE production. 4 Conclusions In this study, the effect of introducing support into the EuOCl catalyst was investigated for the direct production of VCM from ethylene. All support materials were modified with 23 wt% Eu, using the same evaporation impregnation procedure without any promoter. The physicochemical properties of the catalysts changed by impregnation of EuOCl on various supports improved the catalytic activity (at 400 °C, 6−18% ethylene conversion, 70−90% VCM, selectivity). The redox properties of the bulk and supported EuOCl catalysts were investigated to determine the activity of the oxychlorination step. The results of H2-TPR and XPS analyses demonstrated that as more europium species were in a reductive state, the activation of reactants was more likely. As the rate-determining step, this leads to a high conversion rate of ethylene and HCl. The adsorption energy of ethylene was also explained the reactivity of the catalysts. Through the C2H4-TPD analysis, we confirmed that the amount or property of vacancies changed according to the type of support, because oxygen vacancies were affected by the oxidation state of the active metal. The acidic properties of the catalysts were studied to elucidate the dehydrochlorination of EDC in the VCM step. The acidity of the catalysts was enhanced by the impregnation of europium, and it was found that medium or strong acid sites promoted EDC dehydrochlorination. VCM-TPD analysis was performed to explain the generation of DCE, an overchlorinated product, in some catalysts. EuOCl/Y and EuOCl/Al2O3, which produced DCE, exhibited a high desorption energy of VCM, which increased the frequency of the additional reaction to DCE. Through various analyses, factors affecting each reaction step of VCM production from ethylene and the effect of introducing the support were revealed. In particular, the EuOCl/Al2O3 catalyst, which has excellent redox properties, adsorption behavior, and appropriate acidity showed excellent catalytic performance in ethylene oxychlorination. CRediT authorship contribution statement Youngsoo Ro: Conceptualization, Investigation, Writing – original draft, Writing – review & editing. Seungwon Park: Investigation, Writing – original draft, Writing – review & editing. Young-Jin Cho: Funding acquisition, Writing – review & editing. Do Heui Kim: Supervision, Conceptualization, Funding acquisition, Writing – review & editing. Declaration of Competing Interest The authors declare that they have no known competing financial interests or personal relationships that could have appeared to influence the work reported in this paper. Acknowledgments This research was supported by the Hanwha Solution Research & Development Institute. The Institute of Engineering Research at Seoul National University provided the research facility for this work. Supplementary materials Supplementary material associated with this article can be found, in the online version, at doi:10.1016/j.mcat.2021.111977. Appendix Supplementary materials Image, application 1 References [1] J.A. Cowfer M.B. Gorensek Vinyl chloride Kirk-Othmer Encyclopedia of Chemical Technology 2000 Wiley 6 14 Cowfer, J.A., Gorensek, M.B. (2000). Vinyl chloride. Kirk-Othmer Encyclopedia of Chemical Technology, 6–14. [2] C.E. Schildknecht Vinyl and Related Polymers; their Preparations, Properties and Applications in Rubbers, Plastics and in Medical and Industrial Arts 1952 Wiley 3878 Schildknecht, C.E. (1952). Vinyl and Related Polymers; their Preparations, Properties and Applications in Rubbers, Plastics and in Medical and Industrial Arts. Wiley, 3878. [3] A.J. Magistro J.A. Cowfer Oxychlorination of ethylene J. Chem. Educ. 63 12 1986 1056 Magistro, A.J., & Cowfer, J.A. (1986). Oxychlorination of ethylene. J. Chem. Educ., 63(12), 1056. [4] E.I. Gelperin Y.M. Bakshi A.G. Zyskin Y.S. Snagovsky A.K. Avetisov Kinetics and mechanism of ethylene oxychlorination Russ. Chem. Ind. 28 6 1996 38 50 Gelperin, E.I., Bakshi, Y.M., Zyskin, A.G., Snagovsky, Y.S., & Avetisov, A.K. (1996). Kinetics and mechanism of ethylene oxychlorination. Russ. Chem. Ind., 28(6), 38–50. [5] G. Zichittella N. Aellen V. Paunović A.P. Amrute J. Pérez-Ramírez Olefins from natural gas by oxychlorination Angew. Chem. 56 44 2017 13670 13674 Zichittella, G., Aellen, N., Paunović, V., Amrute, A.P., & Pérez-Ramírez, J. (2017). Olefins from natural gas by oxychlorination. Angew. Chem., 56(44), 13670–13674. [6] R.V. Carrubba J.L. Spencer Kinetics of the oxychlorination of ethylene Ind. Eng. Chem. Process Des. Dev. 9 3 1970 414 419 Carrubba, R.V., & Spencer, J.L. (1970). Kinetics of the oxychlorination of ethylene. Ind. Eng. Chem. Process Des. Dev., 9(3), 414–419. [7] N.B. Muddada U. Olsbye G. Leofanti D. Gianolio F. Bonino S. Bordiga C. Lamberti Quantification of copper phases, their reducibility and dispersion in doped-CuCl2/Al2O3 catalysts for ethylene oxychlorination Dalton Trans. 39 36 2010 8437 8449 Muddada, N.B., Olsbye, U., Leofanti, G., Gianolio, D., Bonino, F., Bordiga, S., Lamberti, C. (2010). Quantification of copper phases, their reducibility and dispersion in doped-CuCl2/Al2O3 catalysts for ethylene oxychlorination. Dalton Trans., 39(36), 8437–8449. [8] A. Marsella D. Carmello B. Finocchio B. Cremaschi G. Leofanti M. Padovan G. Busca A study of the main path and of side-reactions upon ethylene oxychlorination over CuCl2-Al2O3 based catalysts Stud. Surf. Sci. Catal. 130 2000 1823 1828 Marsella, A., Carmello, D., Finocchio, B., Cremaschi, B., Leofanti, G., Padovan, M., & Busca, G. (2000). A study of the main path and of side-reactions upon ethylene oxychlorination over CuCl2-Al2O3 based catalysts. In Stud. Surf. Sci. Catal., 130, 1823–1828. [9] P.S. Sai Prasad K.B.S. Prasad P. Kanta Rao V.K. Kaushik Redistribution of copper in KCl-promoted CuCl2/γ-Al2O3 catalyst during oxychlorination of ethylene J. Mater. Sci. 32 6 1997 1479 1482 P.S. Sai Prasad, Prasad, K.B.S., Kanta Rao, P., & Kaushik, V.K.. (1997). Redistribution of copper in KCl-promoted CuCl2/γ-Al2O3 catalyst during oxychlorination of ethylene. J. Mater. Sci., 32(6), 1479–1482. [10] Z. Vajglová N. Kumar K. Eränen M. Peurla D.Y. Murzin T. Salmi Ethene oxychlorination over CuCl2/γ-Al2O3 catalyst in micro-and millistructured reactors J. Catal. 364 2018 334 344 Vajglová, Z., Kumar, N., Eränen, K., Peurla, M., Murzin, D.Y., & Salmi, T. (2018). Ethene oxychlorination over CuCl2/γ-Al2O3 catalyst in micro-and millistructured reactors. J. Catal., 364, 334–344. [11] J. Valle A. Vargas J.M. Ferreira A. Flores O. Novaro The nature of the active-site of oxychlorination catalysts (CuCl2/Al2O3) through experimental studies Stud. Surf. Sci. Catal. 7 1981 1040 1046 Valle, J., Vargas, A., Ferreira, J.M., Flores, A., & Novaro, O. (1981). The nature of the active-site of oxychlorination catalysts (CuCl2/Al2O3) through experimental studies. In Stud. Surf. Sci. Catal., 7, 1040–1046. [12] P.G. Hall M. Parsley D.R. Rosseinsky R.A. Hann K.C. Waugh Oxychlorination catalysis. Ethylene adsorption and conductivity studies on copper chlorides J. Chem. Soc. Faraday Trans. Phys. Chem. Condens. Phases 79 2 1983 343 361 Hall, P.G., Parsley, M., Rosseinsky, D.R., Hann, R.A., & Waugh, K.C. (1983). Oxychlorination catalysis. Ethylene adsorption and conductivity studies on copper chlorides. J. Chem. Soc. Faraday Trans. Phys. Chem. Condens. Phases, 79(2), 343–361. [13] Y. Korai M. Ishibashi K. Yamamoto I. Mochida K. Higuchi Mechanism of carbonaceous deposition in the ethylene dichloride pyrolytic process J. Jpn. Pet. Inst. 46 5 2003 308 314 Korai, Y., Ishibashi, M., Yamamoto, K., Mochida, I., & Higuchi, K. (2003). Mechanism of carbonaceous deposition in the ethylene dichloride pyrolytic process. J. Jpn. Pet. Inst., 46(5), 308–314. [14] K.A. Marshall L.H. Pottenger Chlorocarbons and chlorohydrocarbons Kirk-Othmer Encyclopedia of Chemical Technology 2000 Wiley 1 29 Marshall, K.A., & Pottenger, L.H. (2000). Chlorocarbons and chlorohydrocarbons. Kirk-Othmer Encyclopedia of Chemical Technology, 1–29. [15] Y. Qi E. Fenes H. Ma Y. Wang K.R. Rout T. Fuglerud D. Chen Origin of potassium promotion effects on CuCl2/γ-Al2O3 catalyzed ethylene oxychlorination Appl. Surf. Sci. 521 2020 146310 Qi, Y., Fenes, E., Ma, H., Wang, Y., Rout, K.R., Fuglerud, T., Chen, D. (2020). Origin of potassium promotion effects on CuCl2/γ-Al2O3 catalyzed ethylene oxychlorination. Appl. Surf. Sci., 521, 146310. [16] H. Ma E. Fenes Y. Qi Y. Wang K.R. Rout T. Fuglerud D. Chen Understanding of K and Mg co-promoter effect in ethylene oxychlorination by operando UV-vis-NIR spectroscopy Catal. Today 369 2021 227 234 Ma, H., Fenes, E., Qi, Y., Wang, Y., Rout, K.R., Fuglerud, T., & Chen, D. (2021). Understanding of K and Mg co-promoter effect in ethylene oxychlorination by operando UV-vis-NIR spectroscopy. Catal. Today, 369, 227–234. [17] M.F. Baidoo E. Fenes K.R. Rout T. Fuglerud D. Chen On the effects of K and La co-promotion on CuCl2/γ-Al2O3 catalysts for the oxychlorination of ethylene Catal. Today 299 2018 164 171 Baidoo, M.F., Fenes, E., Rout, K.R., Fuglerud, T., & Chen, D. (2018). On the effects of K and La co-promotion on CuCl2/γ-Al2O3 catalysts for the oxychlorination of ethylene. Catal. Today, 299, 164–171. [18] T. Ohashi S. Someya Y. Mori T. Asakawa M. Hanaya M. Oguri C. Fukuhara Deactivation factor of CuCl2-KCl/Al2O3 catalyst for ethylene oxychlorination in a commercial-scale plant Appl. Catal. A Gen. 589 2020 117205 Ohashi, T., Someya, S., Mori, Y., Asakawa, T., Hanaya, M., Oguri, M., Fukuhara, C. (2020). Deactivation factor of CuCl2-KCl/Al2O3 catalyst for ethylene oxychlorination in a commercial-scale plant. Appl. Catal. A Gen., 589, 117205. [19] K.R. Rout E. Fenes M.F. Baidoo R. Abdollahi T. Fuglerud D. Chen Highly active and stable CeO2-promoted CuCl2/Al2O3 oxychlorination catalysts developed by rational design using a rate diagram of the catalytic cycle ACS Catal. 6 10 2016 7030 7039 Rout, K.R., Fenes, E., Baidoo, M.F., Abdollahi, R., Fuglerud, T., & Chen, D. (2016). Highly active and stable CeO2-promoted CuCl2/Al2O3 oxychlorination catalysts developed by rational design using a rate diagram of the catalytic cycle. ACS Catal., 6(10), 7030–7039. [20] D. Shi R. Hu Q. Zhou L. Yang Catalytic activities of supported perovskite promoter catalysts La2NiMnO6–CuCl2/γ-Al2O3 and La1.7K0.3NiMnO6–CuCl2/γ-Al2O3 for ethane oxychlorination Chem. Eng. J. 288 2016 588 595 Shi, D., Hu, R., Zhou, Q., & Yang, L. (2016). Catalytic activities of supported perovskite promoter catalysts La2NiMnO6–CuCl2/γ-Al2O3 and La1.7K0.3NiMnO6–CuCl2/γ-Al2O3 for ethane oxychlorination. Chem. Eng. J., 288, 588–595. [21] M.D. Higham M. Scharfe M. Capdevila-Cortada J. Pérez-Ramírez N. López Mechanism of ethylene oxychlorination over ruthenium oxide J. Catal. 353 2017 171 180 Higham, M.D., Scharfe, M., Capdevila-Cortada, M., Pérez-Ramírez, J., & López, N. (2017). Mechanism of ethylene oxychlorination over ruthenium oxide. J. Catal., 353, 171–180. [22] M. Scharfe P.A. Lira-Parada V. Paunović M. Moser A.P. Amrute J. Pérez-Ramírez Oxychlorination-dehydrochlorination chemistry on bifunctional ceria catalysts for intensified vinyl chloride production Angew. Chem. 128 9 2016 3120 3124 Scharfe, M., Lira-Parada, P.A., Paunović, V., Moser, M., Amrute, A.P., & Pérez-Ramírez, J. (2016). Oxychlorination-dehydrochlorination chemistry on bifunctional ceria catalysts for intensified vinyl chloride production. Angew. Chem., 128(9), 3120–3124. [23] M. Scharfe P.A. Lira-Parada A.P. Amrute S. Mitchell J. Pérez-Ramírez Lanthanide compounds as catalysts for the one-step synthesis of vinyl chloride from ethylene J. Catal. 344 2016 524 534 Scharfe, M., Lira-Parada, P.A., Amrute, A.P., Mitchell, S., & Pérez-Ramírez, J. (2016). Lanthanide compounds as catalysts for the one-step synthesis of vinyl chloride from ethylene. J. Catal., 344, 524–534. [24] Z. Vajglová N. Kumar K. Eränen A. Tokarev M. Peurla J. Peltonen D.Y. Murzin T. Salmi Influence of the support of copper catalysts on activity and 1, 2-dichloroethane selectivity in ethylene oxychlorination Appl. Catal. A Gen. 556 2018 41 51 Vajglová, Z., Kumar, N., Eränen, K., Tokarev, A., Peurla, M., Peltonen, J., Murzin, D.Y., & Salmi, T. (2018). Influence of the support of copper catalysts on activity and 1, 2-dichloroethane selectivity in ethylene oxychlorination. Appl. Catal. A Gen., 556, 41–51. [25] B. Terlingen R. Oord M. Ahr E. Hutter C. van Lare B.M. Weckhuysen Mechanistic insights into the lanthanide-catalyzed oxychlorination of methane as revealed by operando spectroscopy ACS Catal. 11 16 2021 10574 10588 Terlingen, B., Oord, R., Ahr, M., Hutter, E., van Lare, C., & Weckhuysen, B.M. (2021). Mechanistic insights into the lanthanide-catalyzed oxychlorination of methane as revealed by operando spectroscopy. ACS Catal., 11(16), 10574–10588. [26] M. Scharfe M. Capdevila-Cortada V.A. Kondratenko E.V. Kondratenko S. Colussi A. Trovarelli J. Pérez-Ramírez Mechanism of ethylene oxychlorination on ceria ACS Catal. 8 4 2018 2651 2663 Scharfe, M., Capdevila-Cortada, M., Kondratenko, V.A., Kondratenko, E.V., Colussi, S., Trovarelli, A., Pérez-Ramírez, J. (2018). Mechanism of ethylene oxychlorination on ceria. ACS Catal., 8(4), 2651–2663. [27] J.G. Kang Y. Jung B.K. Min Y. Sohn Full characterization of Eu(OH)3 and Eu2O3 nanorods Appl. Surf. Sci. 314 2014 158 165 Kang, J.G., Jung, Y., Min, B.K., & Sohn, Y. (2014). Full characterization of Eu(OH)3 and Eu2O3 nanorods. Appl. Surf. Sci., 314, 158–165. [28] D. Kim J.R. Jeong Y. Jang J.S. Bae I. Chung R. Liang D.K. Seo S.J. Kim J.C. Park Self-emitting blue and red EuOX (X= F, Cl, Br, I) materials: band structure, charge transfer energy, and emission energy Phys. Chem. Chem. Phys. 21 4 2019 1737 1749 Kim, D., Jeong, J.R., Jang, Y., Bae, J.S., Chung, I., Liang, R., Seo, D.K., Kim, S.J., & Park, J.C. (2019). Self-emitting blue and red EuOX (X= F, Cl, Br, I) materials: band structure, charge transfer energy, and emission energy. Phys. Chem. Chem. Phys., 21(4), 1737–1749. [29] M. Scharfe V. Paunović S. Mitchell R. Hauert S. Xi A. Borgna J. Pérez-Ramírez Dual catalyst system for selective vinyl chloride production via ethene oxychlorination Catal. Sci. Technol. 10 2 2020 560 575 Scharfe, M., Paunović, V., Mitchell, S., Hauert, R., Xi, S., Borgna, A., & Pérez-Ramírez, J. (2020). Dual catalyst system for selective vinyl chloride production via ethene oxychlorination. Catal. Sci. Technol., 10(2), 560–575. [30] J. Kim Y. Ryou G. Hwang J. Bang J. Jung Y. Bang D.H. Kim Oxychlorination of methane over FeOx/CeO2 catalysts Korean J. Chem. Eng. 35 11 2018 2185 2190 Kim, J., Ryou, Y., Hwang, G., Bang, J., Jung, J., Bang, Y., & Kim, D.H. (2018). Oxychlorination of methane over FeOx/CeO2 catalysts. Korean J. Chem. Eng., 35(11), 2185–2190.",
      "scopus-id": "85118480580",
      "coredata": {
        "eid": "1-s2.0-S2468823121005940",
        "dc:description": "A series of supported EuOCl catalysts, and bulk EuOCl catalyst were selected for ethylene oxychlorination with HCl to produce a VCM. The supported EuOCl catalysts showed higher ethylene conversion and VCM yield than those of bulk EuOCl despite the low Eu content. The EuOCl/Y catalysts demonstrated the highest ethylene conversion and VCM selectivity followed by EuOCl/Al2O3. The catalysts were characterized in terms of redox properties, acidic properties, and adsorption behavior of the reactant and product. The reduction temperature of europium species decreased when EuOCl was loaded on various supports. The activity of HCl oxidation is strongly related to the improved redox properties, resulting in better activation of the reactant. We demonstrated that the number of acidic sites was proportional to the dehydrochlorination activity of EDC. Investigation of the adsorption behavior of C2H4 showed that the number of oxygen vacancies increased on the supported EuOCl catalysts. EuOCl/Y and EuOCl/Al2O3 catalysts, showed good catalytic performance, exhibited better redox and acidic properties, and had higher amounts of oxygen vacancies than the other catalysts. However, EuOCl/Y with excessively high acidity showed deactivation with time-on-stream owing to carbon deposition. Therefore, EuOCl/Al2O3 was found to be the most suitable supported catalyst for the oxychlorination of ethylene.",
        "openArchiveArticle": "false",
        "prism:coverDate": "2021-11-30",
        "openaccessUserLicense": null,
        "prism:aggregationType": "Journal",
        "prism:url": "https://api.elsevier.com/content/article/pii/S2468823121005940",
        "dc:creator": [
          {
            "@_fa": "true",
            "$": "Ro, Youngsoo"
          },
          {
            "@_fa": "true",
            "$": "Park, Seungwon"
          },
          {
            "@_fa": "true",
            "$": "Cho, Young-Jin"
          },
          {
            "@_fa": "true",
            "$": "Kim, Do Heui"
          }
        ],
        "link": [
          {
            "@_fa": "true",
            "@rel": "self",
            "@href": "https://api.elsevier.com/content/article/pii/S2468823121005940"
          },
          {
            "@_fa": "true",
            "@rel": "scidir",
            "@href": "https://www.sciencedirect.com/science/article/pii/S2468823121005940"
          }
        ],
        "dc:format": "application/json",
        "openaccessType": null,
        "pii": "S2468-8231(21)00594-0",
        "prism:volume": "516",
        "articleNumber": "111977",
        "prism:publisher": "Elsevier B.V.",
        "dc:title": "Enhanced activity and selectivity of supported europium oxychloride catalysts for ethylene oxychlorination with HCl",
        "prism:copyright": "© 2021 Elsevier B.V. All rights reserved.",
        "openaccess": "0",
        "prism:issn": "24688231",
        "dcterms:subject": [
          {
            "@_fa": "true",
            "$": "Ethylene oxychlorination"
          },
          {
            "@_fa": "true",
            "$": "Direct production of VCM from ethylene"
          },
          {
            "@_fa": "true",
            "$": "Europium oxychloride"
          },
          {
            "@_fa": "true",
            "$": "Support effect"
          }
        ],
        "openaccessArticle": "false",
        "prism:publicationName": "Molecular Catalysis",
        "openaccessSponsorType": null,
        "prism:pageRange": "111977",
        "pubType": "fla",
        "prism:coverDisplayDate": "November 2021",
        "prism:doi": "10.1016/j.mcat.2021.111977",
        "prism:startingPage": "111977",
        "dc:identifier": "doi:10.1016/j.mcat.2021.111977",
        "openaccessSponsorName": null
      },
      "objects": {
        "object": [
          {
            "@category": "standard",
            "@height": "443",
            "@width": "411",
            "@_fa": "true",
            "$": "https://api.elsevier.com/content/object/eid/1-s2.0-S2468823121005940-gr12.jpg?httpAccept=%2A%2F%2A",
            "@multimediatype": "JPEG image file",
            "@type": "IMAGE-DOWNSAMPLED",
            "@size": "23744",
            "@ref": "gr12",
            "@mimetype": "image/jpeg"
          },
          {
            "@category": "standard",
            "@height": "424",
            "@width": "458",
            "@_fa": "true",
            "$": "https://api.elsevier.com/content/object/eid/1-s2.0-S2468823121005940-gr7.jpg?httpAccept=%2A%2F%2A",
            "@multimediatype": "JPEG image file",
            "@type": "IMAGE-DOWNSAMPLED",
            "@size": "41345",
            "@ref": "gr7",
            "@mimetype": "image/jpeg"
          },
          {
            "@category": "standard",
            "@height": "447",
            "@width": "414",
            "@_fa": "true",
            "$": "https://api.elsevier.com/content/object/eid/1-s2.0-S2468823121005940-gr8.jpg?httpAccept=%2A%2F%2A",
            "@multimediatype": "JPEG image file",
            "@type": "IMAGE-DOWNSAMPLED",
            "@size": "25262",
            "@ref": "gr8",
            "@mimetype": "image/jpeg"
          },
          {
            "@category": "standard",
            "@height": "393",
            "@width": "436",
            "@_fa": "true",
            "$": "https://api.elsevier.com/content/object/eid/1-s2.0-S2468823121005940-gr9.jpg?httpAccept=%2A%2F%2A",
            "@multimediatype": "JPEG image file",
            "@type": "IMAGE-DOWNSAMPLED",
            "@size": "41071",
            "@ref": "gr9",
            "@mimetype": "image/jpeg"
          },
          {
            "@category": "standard",
            "@height": "416",
            "@width": "298",
            "@_fa": "true",
            "$": "https://api.elsevier.com/content/object/eid/1-s2.0-S2468823121005940-gr10.jpg?httpAccept=%2A%2F%2A",
            "@multimediatype": "JPEG image file",
            "@type": "IMAGE-DOWNSAMPLED",
            "@size": "24455",
            "@ref": "gr10",
            "@mimetype": "image/jpeg"
          },
          {
            "@category": "standard",
            "@height": "398",
            "@width": "465",
            "@_fa": "true",
            "$": "https://api.elsevier.com/content/object/eid/1-s2.0-S2468823121005940-gr11.jpg?httpAccept=%2A%2F%2A",
            "@multimediatype": "JPEG image file",
            "@type": "IMAGE-DOWNSAMPLED",
            "@size": "52389",
            "@ref": "gr11",
            "@mimetype": "image/jpeg"
          },
          {
            "@category": "standard",
            "@height": "135",
            "@width": "301",
            "@_fa": "true",
            "$": "https://api.elsevier.com/content/object/eid/1-s2.0-S2468823121005940-ga1.jpg?httpAccept=%2A%2F%2A",
            "@multimediatype": "JPEG image file",
            "@type": "IMAGE-DOWNSAMPLED",
            "@size": "19066",
            "@ref": "ga1",
            "@mimetype": "image/jpeg"
          },
          {
            "@category": "standard",
            "@height": "277",
            "@width": "666",
            "@_fa": "true",
            "$": "https://api.elsevier.com/content/object/eid/1-s2.0-S2468823121005940-gr3.jpg?httpAccept=%2A%2F%2A",
            "@multimediatype": "JPEG image file",
            "@type": "IMAGE-DOWNSAMPLED",
            "@size": "74556",
            "@ref": "gr3",
            "@mimetype": "image/jpeg"
          },
          {
            "@category": "standard",
            "@height": "368",
            "@width": "371",
            "@_fa": "true",
            "$": "https://api.elsevier.com/content/object/eid/1-s2.0-S2468823121005940-gr4.jpg?httpAccept=%2A%2F%2A",
            "@multimediatype": "JPEG image file",
            "@type": "IMAGE-DOWNSAMPLED",
            "@size": "23727",
            "@ref": "gr4",
            "@mimetype": "image/jpeg"
          },
          {
            "@category": "standard",
            "@height": "283",
            "@width": "640",
            "@_fa": "true",
            "$": "https://api.elsevier.com/content/object/eid/1-s2.0-S2468823121005940-gr5.jpg?httpAccept=%2A%2F%2A",
            "@multimediatype": "JPEG image file",
            "@type": "IMAGE-DOWNSAMPLED",
            "@size": "38162",
            "@ref": "gr5",
            "@mimetype": "image/jpeg"
          },
          {
            "@category": "standard",
            "@height": "459",
            "@width": "451",
            "@_fa": "true",
            "$": "https://api.elsevier.com/content/object/eid/1-s2.0-S2468823121005940-gr6.jpg?httpAccept=%2A%2F%2A",
            "@multimediatype": "JPEG image file",
            "@type": "IMAGE-DOWNSAMPLED",
            "@size": "30210",
            "@ref": "gr6",
            "@mimetype": "image/jpeg"
          },
          {
            "@category": "standard",
            "@height": "455",
            "@width": "484",
            "@_fa": "true",
            "$": "https://api.elsevier.com/content/object/eid/1-s2.0-S2468823121005940-gr1.jpg?httpAccept=%2A%2F%2A",
            "@multimediatype": "JPEG image file",
            "@type": "IMAGE-DOWNSAMPLED",
            "@size": "45621",
            "@ref": "gr1",
            "@mimetype": "image/jpeg"
          },
          {
            "@category": "standard",
            "@height": "445",
            "@width": "483",
            "@_fa": "true",
            "$": "https://api.elsevier.com/content/object/eid/1-s2.0-S2468823121005940-gr2.jpg?httpAccept=%2A%2F%2A",
            "@multimediatype": "JPEG image file",
            "@type": "IMAGE-DOWNSAMPLED",
            "@size": "38800",
            "@ref": "gr2",
            "@mimetype": "image/jpeg"
          },
          {
            "@category": "thumbnail",
            "@height": "164",
            "@width": "152",
            "@_fa": "true",
            "$": "https://api.elsevier.com/content/object/eid/1-s2.0-S2468823121005940-gr12.sml?httpAccept=%2A%2F%2A",
            "@multimediatype": "GIF image file",
            "@type": "IMAGE-THUMBNAIL",
            "@size": "3911",
            "@ref": "gr12",
            "@mimetype": "image/gif"
          },
          {
            "@category": "thumbnail",
            "@height": "164",
            "@width": "177",
            "@_fa": "true",
            "$": "https://api.elsevier.com/content/object/eid/1-s2.0-S2468823121005940-gr7.sml?httpAccept=%2A%2F%2A",
            "@multimediatype": "GIF image file",
            "@type": "IMAGE-THUMBNAIL",
            "@size": "6018",
            "@ref": "gr7",
            "@mimetype": "image/gif"
          },
          {
            "@category": "thumbnail",
            "@height": "164",
            "@width": "152",
            "@_fa": "true",
            "$": "https://api.elsevier.com/content/object/eid/1-s2.0-S2468823121005940-gr8.sml?httpAccept=%2A%2F%2A",
            "@multimediatype": "GIF image file",
            "@type": "IMAGE-THUMBNAIL",
            "@size": "4163",
            "@ref": "gr8",
            "@mimetype": "image/gif"
          },
          {
            "@category": "thumbnail",
            "@height": "164",
            "@width": "182",
            "@_fa": "true",
            "$": "https://api.elsevier.com/content/object/eid/1-s2.0-S2468823121005940-gr9.sml?httpAccept=%2A%2F%2A",
            "@multimediatype": "GIF image file",
            "@type": "IMAGE-THUMBNAIL",
            "@size": "8082",
            "@ref": "gr9",
            "@mimetype": "image/gif"
          },
          {
            "@category": "thumbnail",
            "@height": "163",
            "@width": "117",
            "@_fa": "true",
            "$": "https://api.elsevier.com/content/object/eid/1-s2.0-S2468823121005940-gr10.sml?httpAccept=%2A%2F%2A",
            "@multimediatype": "GIF image file",
            "@type": "IMAGE-THUMBNAIL",
            "@size": "6067",
            "@ref": "gr10",
            "@mimetype": "image/gif"
          },
          {
            "@category": "thumbnail",
            "@height": "164",
            "@width": "192",
            "@_fa": "true",
            "$": "https://api.elsevier.com/content/object/eid/1-s2.0-S2468823121005940-gr11.sml?httpAccept=%2A%2F%2A",
            "@multimediatype": "GIF image file",
            "@type": "IMAGE-THUMBNAIL",
            "@size": "9926",
            "@ref": "gr11",
            "@mimetype": "image/gif"
          },
          {
            "@category": "thumbnail",
            "@height": "98",
            "@width": "219",
            "@_fa": "true",
            "$": "https://api.elsevier.com/content/object/eid/1-s2.0-S2468823121005940-ga1.sml?httpAccept=%2A%2F%2A",
            "@multimediatype": "GIF image file",
            "@type": "IMAGE-THUMBNAIL",
            "@size": "9278",
            "@ref": "ga1",
            "@mimetype": "image/gif"
          },
          {
            "@category": "thumbnail",
            "@height": "91",
            "@width": "219",
            "@_fa": "true",
            "$": "https://api.elsevier.com/content/object/eid/1-s2.0-S2468823121005940-gr3.sml?httpAccept=%2A%2F%2A",
            "@multimediatype": "GIF image file",
            "@type": "IMAGE-THUMBNAIL",
            "@size": "9194",
            "@ref": "gr3",
            "@mimetype": "image/gif"
          },
          {
            "@category": "thumbnail",
            "@height": "164",
            "@width": "165",
            "@_fa": "true",
            "$": "https://api.elsevier.com/content/object/eid/1-s2.0-S2468823121005940-gr4.sml?httpAccept=%2A%2F%2A",
            "@multimediatype": "GIF image file",
            "@type": "IMAGE-THUMBNAIL",
            "@size": "6003",
            "@ref": "gr4",
            "@mimetype": "image/gif"
          },
          {
            "@category": "thumbnail",
            "@height": "97",
            "@width": "219",
            "@_fa": "true",
            "$": "https://api.elsevier.com/content/object/eid/1-s2.0-S2468823121005940-gr5.sml?httpAccept=%2A%2F%2A",
            "@multimediatype": "GIF image file",
            "@type": "IMAGE-THUMBNAIL",
            "@size": "6669",
            "@ref": "gr5",
            "@mimetype": "image/gif"
          },
          {
            "@category": "thumbnail",
            "@height": "164",
            "@width": "161",
            "@_fa": "true",
            "$": "https://api.elsevier.com/content/object/eid/1-s2.0-S2468823121005940-gr6.sml?httpAccept=%2A%2F%2A",
            "@multimediatype": "GIF image file",
            "@type": "IMAGE-THUMBNAIL",
            "@size": "4343",
            "@ref": "gr6",
            "@mimetype": "image/gif"
          },
          {
            "@category": "thumbnail",
            "@height": "164",
            "@width": "174",
            "@_fa": "true",
            "$": "https://api.elsevier.com/content/object/eid/1-s2.0-S2468823121005940-gr1.sml?httpAccept=%2A%2F%2A",
            "@multimediatype": "GIF image file",
            "@type": "IMAGE-THUMBNAIL",
            "@size": "6420",
            "@ref": "gr1",
            "@mimetype": "image/gif"
          },
          {
            "@category": "thumbnail",
            "@height": "164",
            "@width": "178",
            "@_fa": "true",
            "$": "https://api.elsevier.com/content/object/eid/1-s2.0-S2468823121005940-gr2.sml?httpAccept=%2A%2F%2A",
            "@multimediatype": "GIF image file",
            "@type": "IMAGE-THUMBNAIL",
            "@size": "5241",
            "@ref": "gr2",
            "@mimetype": "image/gif"
          },
          {
            "@category": "high",
            "@height": "1960",
            "@width": "1819",
            "@_fa": "true",
            "$": "https://api.elsevier.com/content/object/eid/1-s2.0-S2468823121005940-gr12_lrg.jpg?httpAccept=%2A%2F%2A",
            "@multimediatype": "JPEG image file",
            "@type": "IMAGE-HIGH-RES",
            "@size": "191785",
            "@ref": "gr12",
            "@mimetype": "image/jpeg"
          },
          {
            "@category": "high",
            "@height": "1878",
            "@width": "2028",
            "@_fa": "true",
            "$": "https://api.elsevier.com/content/object/eid/1-s2.0-S2468823121005940-gr7_lrg.jpg?httpAccept=%2A%2F%2A",
            "@multimediatype": "JPEG image file",
            "@type": "IMAGE-HIGH-RES",
            "@size": "315033",
            "@ref": "gr7",
            "@mimetype": "image/jpeg"
          },
          {
            "@category": "high",
            "@height": "1976",
            "@width": "1832",
            "@_fa": "true",
            "$": "https://api.elsevier.com/content/object/eid/1-s2.0-S2468823121005940-gr8_lrg.jpg?httpAccept=%2A%2F%2A",
            "@multimediatype": "JPEG image file",
            "@type": "IMAGE-HIGH-RES",
            "@size": "206272",
            "@ref": "gr8",
            "@mimetype": "image/jpeg"
          },
          {
            "@category": "high",
            "@height": "1739",
            "@width": "1930",
            "@_fa": "true",
            "$": "https://api.elsevier.com/content/object/eid/1-s2.0-S2468823121005940-gr9_lrg.jpg?httpAccept=%2A%2F%2A",
            "@multimediatype": "JPEG image file",
            "@type": "IMAGE-HIGH-RES",
            "@size": "330289",
            "@ref": "gr9",
            "@mimetype": "image/jpeg"
          },
          {
            "@category": "high",
            "@height": "1846",
            "@width": "1322",
            "@_fa": "true",
            "$": "https://api.elsevier.com/content/object/eid/1-s2.0-S2468823121005940-gr10_lrg.jpg?httpAccept=%2A%2F%2A",
            "@multimediatype": "JPEG image file",
            "@type": "IMAGE-HIGH-RES",
            "@size": "163664",
            "@ref": "gr10",
            "@mimetype": "image/jpeg"
          },
          {
            "@category": "high",
            "@height": "1761",
            "@width": "2060",
            "@_fa": "true",
            "$": "https://api.elsevier.com/content/object/eid/1-s2.0-S2468823121005940-gr11_lrg.jpg?httpAccept=%2A%2F%2A",
            "@multimediatype": "JPEG image file",
            "@type": "IMAGE-HIGH-RES",
            "@size": "361517",
            "@ref": "gr11",
            "@mimetype": "image/jpeg"
          },
          {
            "@category": "high",
            "@height": "599",
            "@width": "1333",
            "@_fa": "true",
            "$": "https://api.elsevier.com/content/object/eid/1-s2.0-S2468823121005940-ga1_lrg.jpg?httpAccept=%2A%2F%2A",
            "@multimediatype": "JPEG image file",
            "@type": "IMAGE-HIGH-RES",
            "@size": "153671",
            "@ref": "ga1",
            "@mimetype": "image/jpeg"
          },
          {
            "@category": "high",
            "@height": "1225",
            "@width": "2950",
            "@_fa": "true",
            "$": "https://api.elsevier.com/content/object/eid/1-s2.0-S2468823121005940-gr3_lrg.jpg?httpAccept=%2A%2F%2A",
            "@multimediatype": "JPEG image file",
            "@type": "IMAGE-HIGH-RES",
            "@size": "486544",
            "@ref": "gr3",
            "@mimetype": "image/jpeg"
          },
          {
            "@category": "high",
            "@height": "1630",
            "@width": "1643",
            "@_fa": "true",
            "$": "https://api.elsevier.com/content/object/eid/1-s2.0-S2468823121005940-gr4_lrg.jpg?httpAccept=%2A%2F%2A",
            "@multimediatype": "JPEG image file",
            "@type": "IMAGE-HIGH-RES",
            "@size": "164218",
            "@ref": "gr4",
            "@mimetype": "image/jpeg"
          },
          {
            "@category": "high",
            "@height": "1252",
            "@width": "2834",
            "@_fa": "true",
            "$": "https://api.elsevier.com/content/object/eid/1-s2.0-S2468823121005940-gr5_lrg.jpg?httpAccept=%2A%2F%2A",
            "@multimediatype": "JPEG image file",
            "@type": "IMAGE-HIGH-RES",
            "@size": "278006",
            "@ref": "gr5",
            "@mimetype": "image/jpeg"
          },
          {
            "@category": "high",
            "@height": "2033",
            "@width": "1998",
            "@_fa": "true",
            "$": "https://api.elsevier.com/content/object/eid/1-s2.0-S2468823121005940-gr6_lrg.jpg?httpAccept=%2A%2F%2A",
            "@multimediatype": "JPEG image file",
            "@type": "IMAGE-HIGH-RES",
            "@size": "243849",
            "@ref": "gr6",
            "@mimetype": "image/jpeg"
          },
          {
            "@category": "high",
            "@height": "2016",
            "@width": "2145",
            "@_fa": "true",
            "$": "https://api.elsevier.com/content/object/eid/1-s2.0-S2468823121005940-gr1_lrg.jpg?httpAccept=%2A%2F%2A",
            "@multimediatype": "JPEG image file",
            "@type": "IMAGE-HIGH-RES",
            "@size": "408528",
            "@ref": "gr1",
            "@mimetype": "image/jpeg"
          },
          {
            "@category": "high",
            "@height": "1973",
            "@width": "2141",
            "@_fa": "true",
            "$": "https://api.elsevier.com/content/object/eid/1-s2.0-S2468823121005940-gr2_lrg.jpg?httpAccept=%2A%2F%2A",
            "@multimediatype": "JPEG image file",
            "@type": "IMAGE-HIGH-RES",
            "@size": "286659",
            "@ref": "gr2",
            "@mimetype": "image/jpeg"
          },
          {
            "@category": "standard",
            "@_fa": "true",
            "$": "https://api.elsevier.com/content/object/eid/1-s2.0-S2468823121005940-mmc1.docx?httpAccept=%2A%2F%2A",
            "@multimediatype": "Microsoft Word file",
            "@type": "APPLICATION",
            "@size": "1667340",
            "@ref": "mmc1",
            "@mimetype": "application/word"
          },
          {
            "@category": "thumbnail",
            "@_fa": "true",
            "$": "https://api.elsevier.com/content/object/eid/1-s2.0-S2468823121005940-si1.svg?httpAccept=%2A%2F%2A",
            "@multimediatype": "Scalable Vector Graphics file",
            "@type": "ALTIMG",
            "@size": "9606",
            "@ref": "si1",
            "@mimetype": "image/svg+xml"
          },
          {
            "@category": "thumbnail",
            "@_fa": "true",
            "$": "https://api.elsevier.com/content/object/eid/1-s2.0-S2468823121005940-si2.svg?httpAccept=%2A%2F%2A",
            "@multimediatype": "Scalable Vector Graphics file",
            "@type": "ALTIMG",
            "@size": "11645",
            "@ref": "si2",
            "@mimetype": "image/svg+xml"
          },
          {
            "@category": "thumbnail",
            "@_fa": "true",
            "$": "https://api.elsevier.com/content/object/eid/1-s2.0-S2468823121005940-si3.svg?httpAccept=%2A%2F%2A",
            "@multimediatype": "Scalable Vector Graphics file",
            "@type": "ALTIMG",
            "@size": "7423",
            "@ref": "si3",
            "@mimetype": "image/svg+xml"
          },
          {
            "@category": "thumbnail",
            "@_fa": "true",
            "$": "https://api.elsevier.com/content/object/eid/1-s2.0-S2468823121005940-si4.svg?httpAccept=%2A%2F%2A",
            "@multimediatype": "Scalable Vector Graphics file",
            "@type": "ALTIMG",
            "@size": "13956",
            "@ref": "si4",
            "@mimetype": "image/svg+xml"
          },
          {
            "@category": "thumbnail",
            "@_fa": "true",
            "$": "https://api.elsevier.com/content/object/eid/1-s2.0-S2468823121005940-si5.svg?httpAccept=%2A%2F%2A",
            "@multimediatype": "Scalable Vector Graphics file",
            "@type": "ALTIMG",
            "@size": "12990",
            "@ref": "si5",
            "@mimetype": "image/svg+xml"
          },
          {
            "@category": "standard",
            "@_fa": "true",
            "$": "https://api.elsevier.com/content/object/eid/1-s2.0-S2468823121005940-am.pdf?httpAccept=%2A%2F%2A",
            "@multimediatype": "Acrobat PDF file",
            "@type": "AAM-PDF",
            "@size": "1285369",
            "@ref": "am",
            "@mimetype": "application/pdf"
          }
        ]
      },
      "link": {
        "@rel": "abstract",
        "@href": "https://api.elsevier.com/content/abstract/scopus_id/85118480580"
      }
    }
  }
}