{
  "metadata": {
    "title": "Room temperature selective reduction of nitroarenes to azoxy compounds over Ni-TiO<ce:inf loc=post>2</ce:inf> catalyst",
    "authors": "; ; ",
    "journal": "Molecular Catalysis",
    "date": "2020-07-31",
    "doi": "10.1016/j.mcat.2020.110943",
    "abstract": "",
    "uri": "https://api.elsevier.com/content/article/pii/S246882312030198X",
    "pii": "S246882312030198X"
  },
  "fulltext": {
    "full-text-retrieval-response": {
      "scopus-eid": "2-s2.0-85083880108",
      "originalText": "serial JL 315758 291210 291744 291790 291809 31 Molecular Catalysis MOLECULARCATALYSIS 2020-05-01 2020-05-01 2020-05-01 2020-05-01 2020-06-16T07:56:10 1-s2.0-S246882312030198X S2468-8231(20)30198-X S246882312030198X 10.1016/j.mcat.2020.110943 S300 S300.1 FULL-TEXT 1-s2.0-S2468823120X00095 2020-07-01T14:02:51.335338Z 0 0 20200701 20200731 2020 2020-05-01T10:47:58.392689Z absattachment articleinfo articlenumber articletitlenorm authfirstinitialnorm authfirstsurnamenorm cid cids contenttype copyright crossmark dateloaded dateloadedtxt datesearch datesort dateupdated dco docsubtype doctype doi eid ewtransactionid hubeid indexeddate issn issnnorm itemstage itemtransactionid itemweight openaccess openarchive pg pgfirst pii piinorm pubdateend pubdatestart pubdatetxt pubyr sectiontitle sortorder srctitle srctitlenorm srctype ssids alllist content subj subheadings suppl tomb volfirst volissue volumelist webpdf webpdfpagecount yearnav figure table e-component body acknowledge affil appendices articletitle auth authfirstini authfull authkeywords authlast grantsponsor grantsponsorid highlightsabst orcid primabst ref specialabst 2468-8231 24688231 true 490 490 C Volume 490 8 110943 110943 110943 202007 July 2020 2020-07-01 2020-07-31 2020 Regular Papers article fla © 2020 Elsevier B.V. All rights reserved. ROOMTEMPERATURESELECTIVEREDUCTIONNITROARENESAZOXYCOMPOUNDSOVERNITIO2CATALYST SHUKLA A Introduction Experimental Catalyst synthesis Synthesis of 2.6 % Ni-TiO2 EG−W catalyst Catalytic activity measurement Selective reduction of nitroarenes Results and discussion Catalyst characterization N2-physisorption and X-ray diffraction analysis Transmission electron microscopy X-ray photoelectron spectroscopy (XPS) and temperature programmed reduction (TPR) analysis RAMAN spectroscopy UV–vis DR spectroscopy Catalytic performance Conclusions Declaration of Competing interests CRediT authorship contribution statement Acknowledgements Appendix A Supplementary data References CORMA 2008 8748 8753 A FIGUERAS 2001 223 230 F MOTOYAMA 2011 1578 1581 Y PIETROWSKI 2019 298 311 M ZHANG 2016 8319 8323 B TORRES 2018 21 27 C SUN 2019 18570 18576 Q ROMANAZZI 2018 31 38 G SHUKLA 2016 22812 22820 A GHOSH 2015 1867 1876 S XIAO 2017 69 79 Q PAHALAGEDARA 2016 41 48 M SHI 2007 1877 1881 Q FORMENTI 2019 2611 2680 D SONG 2018 386 408 J LIU 2016 817 825 Z FERLIN 2019 614 626 F DOHERTY 2019 4777 4791 S ZHANG 2016 15744 15752 Z LIN 2019 46 51 S HOU 2017 107 115 T LIU 2019 312 323 L SHUKLA 2015 785 790 A SHUKLA 2018 1129 1141 A JIANG 2015 4814 4818 C SINGHA 2017 131 143 R SINGHA 2019 9788 9798 R SINGHA 2017 4720 4735 R SINGHA 2017 15688 15699 R LIN 2011 12668 12674 C YAMAMOTO 2019 966 973 Y DOLAT 2015 310 318 D DONOHUE 1998 137 152 M AN 2008 237 243 T SING 1985 603 619 K TIWARI 2008 241 246 V SINGHA 2016 165 178 R SINGHA 2017 473 488 R LI 2016 3108 3116 G WILEY 2005 454 463 B HAI 2017 176 182 C SHAMBHARKAR 2016 10513 10519 B SINGHA 2016 3075 3085 R BIESINGER 2011 2717 2730 M WANG 2017 577 583 J YU 2012 639 644 Q HERNANDEZARRIAGA 2017 064302 H ARAMENDIA 2008 88 97 M SONG 2009 1925 1930 Y BRATAN 2017 166 173 V DESHMANE 2015 202 213 V ZHU 2004 267 277 H ZHANG 2007 300 310 J ZABILSKIY 2015 5357 5365 M OHSAKA 1978 321 324 T LEJON 2011 2026 2035 C WANG 2011 1578 1582 X HINOJOSAREYES 2014 4308 4316 M ZHANG 2015 107150 107157 H MELENDRES 1989 1246 1250 C WANG 2002 119 122 W SONG 2013 8731 8736 L VENKATACHALAM 2007 454 459 N MOGHIMINIA 2014 512 523 S SHIMURA 2012 2983 2985 K LAWRENCE 2016 9470 9477 R ADITYA 2015 9410 9431 T HABER 1898 506 514 F XIAO 2016 1744 1753 Q NOSCHESE 2016 30 40 A COMBITA 2014 339 349 D SHUKLAX2020X110943 SHUKLAX2020X110943XA 2022-05-01T00:00:00.000Z 2022-05-01T00:00:00.000Z http://creativecommons.org/licenses/by-nc-nd/4.0/ © 2020 Elsevier B.V. All rights reserved. item S2468-8231(20)30198-X S246882312030198X 1-s2.0-S246882312030198X 10.1016/j.mcat.2020.110943 315758 2020-07-01T14:02:51.335338Z 2020-07-01 2020-07-31 1-s2.0-S246882312030198X-main.pdf https://s3-eu-west-1.amazonaws.com/prod-ucs-content-store-eu-west/content/pii:S246882312030198X/MAIN/application/pdf/e3bcf476c9166251ca3c0dfc10037c32/main.pdf main.pdf pdf true 5123353 MAIN 11 1-s2.0-S246882312030198X-main_1.png https://s3-eu-west-1.amazonaws.com/prod-ucs-content-store-eu-west/content/pii:S246882312030198X/PREVIEW/image/png/05c9f9fbd06e751ed69ae88575019dc7/main_1.png main_1.png png 54733 849 656 IMAGE-WEB-PDF 1 1-s2.0-S246882312030198X-ga1.jpg https://s3-eu-west-1.amazonaws.com/prod-ucs-content-store-eu-west/content/pii:S246882312030198X/ga1/DOWNSAMPLED/image/jpeg/d332713d5a22011e41e5fd8ee807d657/ga1.jpg ga1 true ga1.jpg jpg 19130 200 316 IMAGE-DOWNSAMPLED 1-s2.0-S246882312030198X-gr1.jpg https://s3-eu-west-1.amazonaws.com/prod-ucs-content-store-eu-west/content/pii:S246882312030198X/gr1/DOWNSAMPLED/image/jpeg/224abb2566a7e5844eeccaab028ebc29/gr1.jpg gr1 gr1.jpg jpg 47113 323 649 IMAGE-DOWNSAMPLED 1-s2.0-S246882312030198X-gr2.jpg https://s3-eu-west-1.amazonaws.com/prod-ucs-content-store-eu-west/content/pii:S246882312030198X/gr2/DOWNSAMPLED/image/jpeg/f09879b16005c82e1bee5e8256f9f6f2/gr2.jpg gr2 gr2.jpg jpg 111348 473 715 IMAGE-DOWNSAMPLED 1-s2.0-S246882312030198X-gr3.jpg https://s3-eu-west-1.amazonaws.com/prod-ucs-content-store-eu-west/content/pii:S246882312030198X/gr3/DOWNSAMPLED/image/jpeg/d3495d8a8f195974d9f07410721ca1b4/gr3.jpg gr3 gr3.jpg jpg 30729 189 715 IMAGE-DOWNSAMPLED 1-s2.0-S246882312030198X-gr4.jpg https://s3-eu-west-1.amazonaws.com/prod-ucs-content-store-eu-west/content/pii:S246882312030198X/gr4/DOWNSAMPLED/image/jpeg/ff07d5636fd26ea4f574832321f16865/gr4.jpg gr4 gr4.jpg jpg 92788 656 565 IMAGE-DOWNSAMPLED 1-s2.0-S246882312030198X-gr5.jpg https://s3-eu-west-1.amazonaws.com/prod-ucs-content-store-eu-west/content/pii:S246882312030198X/gr5/DOWNSAMPLED/image/jpeg/46e131f24bcbe7da1734953fd100e01b/gr5.jpg gr5 gr5.jpg jpg 45836 326 565 IMAGE-DOWNSAMPLED 1-s2.0-S246882312030198X-gr6.jpg https://s3-eu-west-1.amazonaws.com/prod-ucs-content-store-eu-west/content/pii:S246882312030198X/gr6/DOWNSAMPLED/image/jpeg/498949bef0c694479035333b1ec951cf/gr6.jpg gr6 gr6.jpg jpg 19389 274 357 IMAGE-DOWNSAMPLED 1-s2.0-S246882312030198X-gr7.jpg https://s3-eu-west-1.amazonaws.com/prod-ucs-content-store-eu-west/content/pii:S246882312030198X/gr7/DOWNSAMPLED/image/jpeg/ebde34f2cfab37651b5a5e654be80b2f/gr7.jpg gr7 gr7.jpg jpg 33950 300 659 IMAGE-DOWNSAMPLED 1-s2.0-S246882312030198X-gr8.jpg https://s3-eu-west-1.amazonaws.com/prod-ucs-content-store-eu-west/content/pii:S246882312030198X/gr8/DOWNSAMPLED/image/jpeg/07b5bb87a88a2bf0123b2ad5bd24cef0/gr8.jpg gr8 gr8.jpg jpg 43183 298 661 IMAGE-DOWNSAMPLED 1-s2.0-S246882312030198X-gr9.jpg https://s3-eu-west-1.amazonaws.com/prod-ucs-content-store-eu-west/content/pii:S246882312030198X/gr9/DOWNSAMPLED/image/jpeg/c6ca18c59a689be4aa389ec0fc535322/gr9.jpg gr9 gr9.jpg jpg 11791 222 263 IMAGE-DOWNSAMPLED 1-s2.0-S246882312030198X-sc1.jpg https://s3-eu-west-1.amazonaws.com/prod-ucs-content-store-eu-west/content/pii:S246882312030198X/sc1/DOWNSAMPLED/image/jpeg/320f923ff3e408fe245e078d67bc2e03/sc1.jpg sc1 sc1.jpg jpg 18789 165 565 IMAGE-DOWNSAMPLED 1-s2.0-S246882312030198X-sc2.jpg https://s3-eu-west-1.amazonaws.com/prod-ucs-content-store-eu-west/content/pii:S246882312030198X/sc2/DOWNSAMPLED/image/jpeg/4a2291719f58f60270957749affb3250/sc2.jpg sc2 sc2.jpg jpg 16288 129 661 IMAGE-DOWNSAMPLED 1-s2.0-S246882312030198X-ga1.sml https://s3-eu-west-1.amazonaws.com/prod-ucs-content-store-eu-west/content/pii:S246882312030198X/ga1/THUMBNAIL/image/gif/5b433cff071f82994fd6129c42daed9c/ga1.sml ga1 true ga1.sml sml 9252 139 219 IMAGE-THUMBNAIL 1-s2.0-S246882312030198X-gr1.sml https://s3-eu-west-1.amazonaws.com/prod-ucs-content-store-eu-west/content/pii:S246882312030198X/gr1/THUMBNAIL/image/gif/84bf274ac026e4c08f94b23081f3ac5e/gr1.sml gr1 gr1.sml sml 7417 109 219 IMAGE-THUMBNAIL 1-s2.0-S246882312030198X-gr2.sml https://s3-eu-west-1.amazonaws.com/prod-ucs-content-store-eu-west/content/pii:S246882312030198X/gr2/THUMBNAIL/image/gif/ee94b2edddbf45262b0733d060b169ae/gr2.sml gr2 gr2.sml sml 18763 145 219 IMAGE-THUMBNAIL 1-s2.0-S246882312030198X-gr3.sml https://s3-eu-west-1.amazonaws.com/prod-ucs-content-store-eu-west/content/pii:S246882312030198X/gr3/THUMBNAIL/image/gif/bc000d7c3186b2274e9077ad15d55049/gr3.sml gr3 gr3.sml sml 5232 58 219 IMAGE-THUMBNAIL 1-s2.0-S246882312030198X-gr4.sml https://s3-eu-west-1.amazonaws.com/prod-ucs-content-store-eu-west/content/pii:S246882312030198X/gr4/THUMBNAIL/image/gif/1faeb726286636bc15d7dc3177b838b9/gr4.sml gr4 gr4.sml sml 9437 164 141 IMAGE-THUMBNAIL 1-s2.0-S246882312030198X-gr5.sml https://s3-eu-west-1.amazonaws.com/prod-ucs-content-store-eu-west/content/pii:S246882312030198X/gr5/THUMBNAIL/image/gif/70c92c8a7558b71fbfeb4c32bdde7e01/gr5.sml gr5 gr5.sml sml 9116 126 219 IMAGE-THUMBNAIL 1-s2.0-S246882312030198X-gr6.sml https://s3-eu-west-1.amazonaws.com/prod-ucs-content-store-eu-west/content/pii:S246882312030198X/gr6/THUMBNAIL/image/gif/91f297f280f51cd3e1258abed863d0a3/gr6.sml gr6 gr6.sml sml 6554 164 213 IMAGE-THUMBNAIL 1-s2.0-S246882312030198X-gr7.sml https://s3-eu-west-1.amazonaws.com/prod-ucs-content-store-eu-west/content/pii:S246882312030198X/gr7/THUMBNAIL/image/gif/f48e4d9f454284d9bb323e17649a931c/gr7.sml gr7 gr7.sml sml 4829 100 219 IMAGE-THUMBNAIL 1-s2.0-S246882312030198X-gr8.sml https://s3-eu-west-1.amazonaws.com/prod-ucs-content-store-eu-west/content/pii:S246882312030198X/gr8/THUMBNAIL/image/gif/1864ffebad1ce70e8e6d389220138f1e/gr8.sml gr8 gr8.sml sml 8066 99 219 IMAGE-THUMBNAIL 1-s2.0-S246882312030198X-gr9.sml https://s3-eu-west-1.amazonaws.com/prod-ucs-content-store-eu-west/content/pii:S246882312030198X/gr9/THUMBNAIL/image/gif/596a0de9d3f2963a27b6ebecd6f44a1b/gr9.sml gr9 gr9.sml sml 5118 164 194 IMAGE-THUMBNAIL 1-s2.0-S246882312030198X-sc1.sml https://s3-eu-west-1.amazonaws.com/prod-ucs-content-store-eu-west/content/pii:S246882312030198X/sc1/THUMBNAIL/image/gif/36bb9e371a6169126342fa9b9060cd36/sc1.sml sc1 sc1.sml sml 3587 64 219 IMAGE-THUMBNAIL 1-s2.0-S246882312030198X-sc2.sml https://s3-eu-west-1.amazonaws.com/prod-ucs-content-store-eu-west/content/pii:S246882312030198X/sc2/THUMBNAIL/image/gif/746d4c2eb0431beafb8326f265c9b085/sc2.sml sc2 sc2.sml sml 2746 43 219 IMAGE-THUMBNAIL 1-s2.0-S246882312030198X-mmc1.docx https://s3-eu-west-1.amazonaws.com/prod-ucs-content-store-eu-west/content/pii:S246882312030198X/mmc1/MAIN/application/vnd.openxmlformats-officedocument.wordprocessingml.document/b6b619635a62602dd825786a4d256ca5/mmc1.docx mmc1 mmc1.docx docx 6176252 APPLICATION 1-s2.0-S246882312030198X-am.pdf am am.pdf pdf 1607908 AAM-PDF https://s3-eu-west-1.amazonaws.com/prod-ucs-content-store-eu-west/content/egi:10Z07ZQGH0H/MAIN/application/pdf/898cd78c64fcca2386983be8ad8abf38/am.pdf MCAT 110943 110943 S2468-8231(20)30198-X 10.1016/j.mcat.2020.110943 Elsevier B.V. Fig. 1 A] BET adsorption-desorption isotherms and corresponding pore size distribution (inset) of 2.6 % Ni-TiO2 EG−W catalyst; B] XRD patterns of a] NiOCom.; b] TiO2 Com.; c] 2.6 % Ni-TiO2 EG−W; d] 2.6 % Ni-TiO2 EG-W-H; e] 2.6 % Ni-TiO2 EG-W-S catalysts. Fig. 1 Fig. 2 TEM images of 2.6 % Ni-TiO2 EG−W (a and b), 2.6 % Ni-TiO2 EG-W-H (c), 2.6 % Ni-TiO2 EG-W-S (d and e) catalysts and corresponding SAED patterns (inset). Fig. 2 Fig. 3 Elemental mapping of 2.6 % Ni-TiO2 EG−W [a-d] catalyst. Fig. 3 Fig. 4 A] Ni-2p; B] Ti-2p; C] O-1 s XP spectra of a] 2.6 % Ni-TiO2 EG−W catalyst; b] 2.6 % Ni-TiO2 EG-W-H catalyst; c] 2.6 % Ni-TiO2 EG-W-S catalyst; D] TPR profiles of a] TiO2 P; b] 2.6 % Ni-TiO2 EG-W catalyst. Fig. 4 Fig. 5 A] Raman spectra; B] Raman shifts of Eg mode of a] TiO2 P; b] 2.6 % Ni-TiO2 EG−W; c] 2.6 % Ni-TiO2 EG-W-H; d] 2.6 % Ni-TiO2 EG-W-S catalysts. Fig. 5 Fig. 6 UV–vis DR spectra of TiO2 P and 2.6 % Ni-TiO2 EG−W catalyst. Fig. 6 Fig. 7 A] Effect of run time over 2.6 % Ni-TiO2 EG−W−H catalyst [Reaction condition: Nitrobenzene =1 g; solvent (water) =10 mL; catalyst used =10 wt. % w.r.t. reactant; 25 °C; time =16 h; Nitrobenzene : N2H4.H2O = 1:1.5 (mole ratio)]; B] Effect of temperature over 2.6% Ni-TiO2 EG−W−H catalyst [Reaction condition: Nitrobenzene = 1 g; solvent (water) = 10 mL; catalyst used = 10 wt. % w.r.t. reactant; variable reaction temp. (25 ºC, 40 ºC, 60 ºC, 80 ºC); time = 12 h; Nitrobenzene:N2H4.H2O = 1:1.5 (mole ratio)]. Fig. 7 Fig. 8 A] Effect of nitrobenzene:hydrazine hydrate mole ratio over 2.6 % Ni-TiO2 EG−W−H catalyst [Reaction condition: Nitrobenzene =1 g; solvent (water) =10 mL; catalyst used =10 wt. % w.r.t. reactant; 25 °C; time =12 h; variable Nitrobenzene to N2H4.H2O mole ratio (1:0.5, 1:1.5, 1:2.5); B] Effect of Ni loading (wt. %) over X% (X=1.3, 2.6, 5.3) Ni-TiO2 EG-W-Hcatalysts [Reaction condition: Nitrobenzene = 1 g; solvent (water) = 10 mL; catalysts used = 10 wt. % w.r.t. reactant; 25 ºC; time = 12 h; Nitrobenzene:N2H4.H2O = 1:1.5 (mole ratio)]. Fig. 8 Fig. 9 Plot of ln k vs. 1000/T (K−1) for 2.6 % Ni-TiO2 EG-W-H catalyst. Fig. 9 Scheme 1 Selective reduction of nitroarenes to azoxy compounds. Scheme 1 Scheme 2 Selective reduction of nitrobenzene to azoxybenzene. Scheme 2 Table 1 Physicochemical properties of 2.6 % Ni-TiO2 EG−W catalyst. Table 1 Catalyst S A (m2 g−1) Particle size (by TEM)$ Crystallite size (by XRD)* MD Active metal (nm) TiO2 (nm) Active metal (nm) TiO2 (nm) NiO NiO 2.6 % Ni-TiO2 EG−W 67 6.8 16 ND 15.8 14.9 *- Crystallite size by using Scherrer equation; SA - surface area; ND - not determined; $ - average particle size; MD- metal dispersion (%). Table 2 Activities of Ni-TiO2 nanocrystals for reduction of nitrobenzene. Table 2 S. No. Catalysts@ Hydrogen source Solvent CNB (%) SP (%) TON Azo (1) Azoxy (2) Aniline (3) 1 NiOCom. N2H4.H2O H2O – – – – – 2 TiO2 Com.# N2H4.H2O H2O – – – – – 3 2.6 % Ni-TiO2 EG−W−H N2H4.H2O H2O 89 4 92 4 1008 4 2.6 % Ni-TiO2 EG−W−H N2H4.H2O DMF, EtOH ∼87 4 ∼91 5 ∼975 5 2.6 % Ni-TiO2 EG−W−H N2H4.H2O TOL ∼12 14 76 10 ∼112 6 2.6 % Ni-TiO2 EG−W−H* H2 H2O 90 – 1 99 11 7 2.6 % Ni-TiO2 EG−W−R N2H4.H2O H2O 88 4 91 5 986 Reaction conditions: Nitrobenzene =1 g; solvent =10 mL; catalyst used =10 wt. % w.r.t. reactant; 25 °C; time =12 h; Nitrobenzene : N2H4.H2O = 1:1.5 (mole ratio); CNB(%): Conversion of nitrobenzene; SP(%): Selectivity of different products; TOL = toluene; @ = H2-pretreated catalysts were used; # = without H2-pretreatment; * = reaction performed in high pressure Parr reactor using 1.0 MPa H2; R = catalyst after four recycle; TON (Turnover number) = [moles of desired product (azoxybenzene) formed]/[moles of nickel used]. Room temperature selective reduction of nitroarenes to azoxy compounds over Ni-TiO2 catalyst Astha Shukla Investigation Formal analysis Validation Writing - original draft a b Rajib Kumar Singha Visualization Writing - review & editing a Takehiko Sasaki Formal analysis Writing - review & editing c Shubhadeep Adak Formal analysis a b Sonu Bhandari Validation a b V.V.D.N. Prasad Writing - review & editing a Ankur Bordoloi Writing - review & editing a Rajaram Bal Conceptualization Writing - review & editing Supervision a * a Nanocatalysis Area, Light Stock Processing Division, CSIR-Indian Institute of Petroleum, Dehradun 248005, Uttarakhand, India Nanocatalysis Area Light Stock Processing Division CSIR-Indian Institute of Petroleum Dehradun Uttarakhand 248005 India b Academy of Scientific and Innovative Research (AcSIR), Ghaziabad 201002, India Academy of Scientific and Innovative Research (AcSIR) Ghaziabad 201002 India c Department of Complexity Science and Engineering, Graduate School of Frontier Sciences, The University of Tokyo, Kashiwanoha, Kashiwa-Shi, Chiba 277-8561, Japan Department of Complexity Science and Engineering Graduate School of Frontier Sciences The University of Tokyo Kashiwanoha Kashiwa-Shi Chiba 277-8561 Japan ⁎ Corresponding author. Graphical abstract Surface tuned Ni-TiO2 catalyst was prepared by hydro-solvothermal method using poly(diallyldimethylammonium chloride) (or PDADMAC) as a surfactant and hydrazine hydrate as a capping agent. Activity of catalyst was investigated for selective reduction of nitrobenzene to azoxybenzene in aqueous medium at room temperature, using hydrazine hydrate as the reducing agent for catalysis. It was observed that the catalyst prepared by hydro-solvothermal method (2.6 % Ni-TiO2 EG−W−H) showed 92 % selectivity of azoxybenzene with 89 % conversion of nitrobenzene, under mild reaction conditions, which is quite higher as compared to reported non-noble metal catalysts. Prepared catalysts were thoroughly characterized by various analytical techniques to find out the physicochemical characteristic features of the materials. 2.6 % Ni-TiO2 EG-W catalyst exhibited highly dispersed nickel nanoparticles (∼6.8 nm) over TiO2 surface and strong metal-support interaction due to smaller size of Ni-particles, which significantly enhanced the catalytic efficiency towards selective reduction of nitroarenes to azoxy compounds. Effect of solvents on catalyst synthesis process was also investigated and reported for establishing the superiority of 2.6 % Ni-TiO2 EG-W catalyst. The heterogeneous nature of highly dispersed catalyst (2.6 % Ni-TiO2 EG-W) was confirmed by the recyclability tests and found that the catalyst particles can be easily recovered and recycled up to four successive runs without any significant loss in its catalytic performance. Keywords Azoxy-compounds Ni-nanoparticles Nitroarenes reduction Metal-support interaction Nanocrystalline Ni-TiO2 Introduction Nitroarenes are the organic pollutants of industrial and agricultural waste water and their transformation into industrially important products has significant importance in chemical industries [1,2]. Reduction of nitroarenes produces different products such as azo, azoxy, anilines etc. [2] and their formation often depends up on properties of catalytic materials used for catalysis as well as operating reaction conditions [2,3]. Therefore, selective production of any of these products is the real challenge for researchers. So far, significant research work has been done toward selective production of substituted anilines from nitroarenes using Pt, Pd, Ru, Rh, Au, Ag, Cu, Ni, Co etc. based nanomaterials [4–8], but very few reports are available in literature for selective production of azoxy compounds from nitroarenes. Notably, azoxy compounds can be produced from oxidation of aniline [9,10] or reduction of nitro compounds as well [11]. Azoxy compounds having conjugated system with polar functionality is a condensation product of nitroso and hydroxylamine intermediates [12]. It is also a precursor of Wallach rearrangement, which has been particularly used in coloration of soap, resin, lacquer as well as liquid crystals in electronic display and therapeutic medicines [9,10]. Noticeably, noble metal based catalytic systems are often used for selective production of azoxy compounds, but due to their limited availability and expensiveness, development of economically viable catalyst is highly desirable. Additionally, unlike other conventional processes and as a safety viewpoint, catalytic transfer hydrogenation protocol is easy to perform without any elaborated reaction assembly or high pressure reactors [13]. For this purpose, different hydrogen donor species such as NaBH4, HCOONH4, CO+H2O, HCOOH, C3H7OH, N2H4.H2O etc. [14,15] has been constantly used for in-situ hydrogen generation for hydrogenation reaction, but most of them are hazardous, produces non-greener side products and their non-stoichiometric usage causes tedious separation process to recover the desired product. Among different hydrogen donor species, hydrazine hydrate and molecular hydrogen are considered as greener reducing agents as they do not produces harmful by-products. Moreover, pure hydrazine (100 %) is a hazardous chemical and unsafe to handle while performing a reaction, until it is used in hydrous form [14]. In this aspect, utilization of stoichiometric amount of hydrazine hydrate (it produces water and N2) along with the non-noble metal based catalytic system is an economic and environmentally benign approach for hydrogenation processes. Liu et al. synthesized Ag-Cu alloy nanoparticles (NPs) for selective transformation of nitrobenzene to azoxybenzene under visible light irradiation at 60 °C within 16 h, using KOH as an additional base [16]. Gold nanoparticles (Au-NPs) supported on hydrotalcite (HT) was investigated for selective reduction of nitro to azoxy compounds in an argon atmosphere at 40 °C using isopropyl alcohol (IPA) and KOH [11]. Recently, Ferlin et al. developed Au@Zirconium-Phosphonate NPs for selective production of azoxy compounds using NaBH4 as reductant in ethanolic medium at 30 °C [17]. Recently, Doherty et al. reported quite interesting results toward partial (i.e. formation of N-phenylhydroxylamine and azoxybenzene) and complete reduction (i.e. aniline) of nitroarenes using a single Au NPs supported catalyst with exceptionally high activity just by changing the reaction conditions [18]. Similarly, Ir, Rh and Ir-Rh nanosheets [19] were also reported for azoxybenzene formation, in which Ir nanosheets showed higher TOF toward azoxybenzene formation. Besides, a homogeneous diruthenium complex was investigated by Lin et al. [20] for the discussed reaction using hydrazine hydrate as reductant at 80 ᵒC, but the reaction product was aniline derivatives. Unfortunately, utilization of noble metal catalysts limits their practical application due to their higher cost and limited availability. Moreover, Suib and co-worker fabricated sea urchin-like Ni/Graphene nanocomposites for the synthesis of azoxy compounds from nitro compound, using hydrazine hydrate as reducing agent in ethanolic medium [12]. Furthermore, Hou et al. thoroughly investigated the formation of metastable reaction intermediate (i.e. azoxy intermediate) over Ni-Niδ+ clusters stabilized ceria catalyst at 80 °C in ethanolic medium and argon atmosphere [21]. In a recent study, Corma and co-workers investigated a bifunctional catalyst system (Ni@C-CeO2) for selective formation of azoxybenzene from nitrobenzene under base-free reaction conditions [22]. They also explored the possibility of formation of other products like azobenzene and aniline by using bifunctional catalyst. We previously reported Pt-CeO2 [23] and Ni-ZrO2 [24] catalyst for selective reduction of nitroarenes to corresponding anilines in aqueous medium, where molecular hydrogen was used as reductant for catalysis. Due to low cost and high abundance, synthesis of non-noble metal based heterogeneous systems with unique physico-chemical properties, tuned structural geometry and improved catalytic performance has great importance in both fundamental studies as well as industrial applications. So far, significant research work has been introduced for the synthesis of supported non-transition metal oxide catalysts [25], but synthesis of smaller metal NPs over transition metal oxides support is quite challenging because lower surface area of transition metal oxides leads to agglomeration of metal NPs and consequently decreases catalytic efficiency. However, several other factors, such as active metal particle size, accessibility of metal-metal oxide (as a support) interfacial sites, synergy between active metals-metal oxides, metal-support interactions etc. are also responsible for altering the catalytic efficiency [26]. All these properties are strongly influenced by catalyst synthesis procedures [24,26a]. Hence, by varying the synthesis procedure one can easily alter the physicochemical characteristics of prepared nanomaterials. Again, problem associated with most of the synthesis procedures are utilization of excessive energy, special equipments, expensive metal precursors along with the complicated synthesis procedure and also some of them have inability [26a] to synthesize smaller nanoparticles, which is desirable for catalysis. From last decade, TiO2 has been considered to be one of the most promising support material for the synthesis of various noble and non-noble metal based nanomaterials, which exhibited outstanding performance toward several catalytic processes (especially in photocatalysis) [27]. Even bare TiO2 was also reported for photocatalytic reduction of nitroarenes [28]. Variety of synthetic protocols [29] have been reported for Ni/TiO2 catalysts but in most of the cases, post-synthesis methods [29] were applied where nickel was incorporated after preparing the TiO2 support (or commercial TiO2). Hence, controlled synthesis of smaller NPs by using single-step synthesis procedure still remains a challenge for scientific community. Therefore, we aimed to develop a simplified, efficient, highly selective and cost-effective single-step preparation method for synthesis of supported transition metal oxide catalyst. In present work, we prepared Ni-TiO2 catalyst (2.6 % Ni-TiO2 EG−W) by single-step hydro-solvothermal (mixture of ethylene glycol and water) method using poly(diallyldimethylammonium chloride) (or PDADMAC) as a surfactant and hydrazine hydrate as a capping agent. The role of hydrazine hydrate as a capping agent is reported in our previously published articles [26a,c]. Performance of the catalyst was examined for selective reduction of nitrobenzene to azoxybenzene and it was observed that the catalyst prepared by hydro-solvothermal method (2.6 % Ni-TiO2 EG-W-H) was highly efficient for room temperature selective production of azoxy derivatives in aqueous medium, using stoichiometric amount of hydrazine hydrate as reductant (Scheme 1 ). 2.6 % Ni-TiO2 EG-W-H catalyst showed higher TON than other reported non-noble metal-based systems and our catalyst maintained its heterogeneous nature throughout the reaction. To further explore the superiority of our (2.6 % Ni-TiO2 EG−W) system, we have investigated the solvent effects for catalyst synthesis process and also prepared another Ni-TiO2 catalyst by wetness impregnation method and their activity was compared for the reduction processes. Experimental Materials used for catalyst synthesis, catalyst synthesis procedures and catalyst characterization equipments/techniques are mentioned/described in detail in the Electronic Supplementary Information (ESI) of this manuscript. Catalyst synthesis Ni-TiO2 catalyst was synthesized by hydro-solvothermal method using ethylene glycol and water as mixture of solvents. Synthesis methods for other Ni-TiO2 catalysts prepared for the study can be found in the ESI of this manuscript. Synthesis of 2.6 % Ni-TiO2 EG−W catalyst Initially, 5 mL PDADMAC [poly (diallyldimethylammonium chloride)]; Mw = 100,000–200,000] was added to mixture of ethylene glycol (100 mL) and distilled water (100 mL) and dissolved well by stirring. After 15 min., required amount of titanium (IV) isopropoxide (17.8 g) and nickel chloride hexahydrate (0.61 g i.e. ∼3 wt. %) was added. The solution was allowed to stir for 15 min. and hydrazine hydrate (0.52 g) was added to above solution keeping the Ni:N2H4.H2O mole ratio was 1:1. The whole solution was vigorously stirred for 2 h. The pH of solution was maintained ∼10 using ammonium hydroxide (25 %) and again the solution was stirred for 3 h. The resulting mixture was transferred into Teflon lined stainless steel autoclave for 90 h at 150 °C. After cooling the autoclave at room temperature, the formed precipitate was thoroughly centrifuged and washed with excess of distilled water. The centrifuged cake was then dried at 80 °C for 12 h. Obtained material was calcined at 550 °C for 6 h in air. Prepared powdered material was designated as 2.6 % Ni-TiO2 EG−W catalyst, where 2.6 % is the wt.% of nickel (as determined by ICP-AES). Catalysts of lower and higher loading were also prepared, designated as 1.3 % Ni-TiO2 EG-W and 5.3 % Ni-TiO2 EG-W catalysts (as determined by ICP-AES). Fresh or the catalysts without H2-pretreatment were designated as X% Ni-TiO2 EG−W, H2-pretreated catalysts were designated as Y% Ni-TiO2 EG-W-H and the spent catalyst or the catalyst after catalysis, was designated as Z% Ni-TiO2 EG-W-S catalyst, where X, Y and Z are the wt. % of Ni in the catalyst. We have followed the similar designations for all the respective catalysts also. Pure TiO2 was prepared by opting the above mentioned synthesis procedure (i.e. similar to 2.6 % Ni-TiO2 EG−W catalyst), eliminating the nickel addition step, which was designated as TiO2 P. For comparison, we have also prepared catalysts using water and ethylene glycol as solvents i.e. 2.7 % Ni-TiO2 W (water as solvent) and 2.8 % Ni-TiO2 EG (ethylene glycol as solvent). We have also synthesized a catalyst (2.6 % Ni-TiO2 Imp.Com.) by conventional wetness impregnation method using commercial TiO2. The details can be found in the ESI. Catalytic activity measurement Selective reduction of nitroarenes Catalytic reduction experiments were conducted in closed vessel using magnetic stirrer bar. All the reduction experiments were carried out at room temperature in aqueous medium. H2-pretreated catalysts (450 °C for 2 h, using 10 % H2 balanced He) were used for catalysis. In a typical reduction experiments, 1 g of reactant dissolved in 10 mL H2O (in case of water insoluble reactants, 2 mL ethanol was added with 8 mL of water) and then, 0.10 g of catalyst (10 wt. % w.r.t reactant amount) was added to it. Hydrazine hydrate were used as hydrogen donor species for catalysis and used reactant:hydrazine hydrate mole ratio was 1:1.5. During ongoing reaction, aliquots were withdrawn from reaction mixture periodically for analysis and progress of reaction was monitored by Gas chromatography (Agilent 7890) having HP-5 (length 30 m, id.0.28 mm, 0.25 μm film thickness) column equipped with FID (flame ionization detector). At the end of reaction, solid catalysts were centrifuged and washed with acetone to remove the surface adsorbed organic molecules. The catalyst particles were dried at 80 °C for 6 h and reused for next catalytic cycle. The obtained reaction products were further confirmed by GC–MS. Results and discussion Catalyst characterization Our best catalyst (2.6 % Ni-TiO2 EG−W) was characterized (with and without H2-pretreatment and after catalysis) thoroughly and all other characterizations for other catalysts (synthesized by changing solvents as well as by different synthesis procedure) were also performed to compare with the properties of the best one. The characterization details of other catalysts are described in ESI. N2-physisorption and X-ray diffraction analysis N2 adsorption-desorption isotherm and respective pore size distribution of 2.6 % Ni-TiO2 EG−W catalyst are represented in Fig. 1 A. Brunauer-Emmett-Teller (BET) surface area of 2.6 % Ni-TiO2 EG−W was found to be 67 m2 g-1. Results obtained from N2 physisorption studies revealed that the catalyst (2.6 % Ni-TiO2 EG−W) prepared using mixture of solvents (water and ethylene glycol) have higher surface area than other synthesized catalysts including catalysts prepared by only ethylene glycol (2.8 % Ni-TiO2 EG) and water (2.7 % Ni-TiO2 W) as solvents (Fig. S1, Table S1). According to IUPAC classification of gas-solid adsorption isotherms, N2-adsorption desorption isotherm of 2.6 % Ni-TiO2 EG−W catalyst showed typical Type IV isotherm with a noticeable hysteresis loop (H1 type) [30], which is a characteristic of mesoporous material [31]. We have observed that Ni loading affected the surface area of catalysts. On increasing the Ni loading of catalyst [X% Ni-TiO2 EG−W (X = 1.3, 2.6, 5.3)], increasing trend of BET surface area (61 m2 g-1, 67 m2 g-1, 71 m2 g-1) of respective catalysts were observed, as it is reported in various literature reports [32–34]. Furthermore, 2.6 % Ni-TiO2 EG-W catalyst showed higher metal dispersion than the other prepared catalysts as shown in Table 1 and Table S1. Fig. 1B shows XRD pattern of NiOCom. (commercial NiO) (Fig. 1Ba), TiO2 Com. (commercial TiO2) (Fig. 1Bb), 2.6 % Ni-TiO2 EG−W (Fig. 1Bc), 2.6 % Ni-TiO2 EG-W-H (Fig. 1Bd) and 2.6 % Ni-TiO2 EG-W-S (spent) (Fig. 1Be) catalysts. Typically, TiO2 can be present in form of three different phases i.e. anatase, rutile and brookite. The distinct anatase phase of TiO2 was observed in all the XRD pattern of prepared materials (Fig. 1B and Fig. S2). Broadness in XRD peaks of TiO2 for synthesized catalyst as compared to commercial TiO2 Com. indicated that the crystallite size of TiO2 for respective catalysts was smaller than commercial TiO2, which was further confirmed by calculating the crystallite size using Scherrer equation (Table 1 and Table S1). XRD pattern of 2.6 % Ni-TiO2 EG-W catalyst showed peaks at 2θ values 25.51°, 38.07°, 48.15°, 54.19°, 55.27°, 62.91° and 75.24°, which are the characteristic peaks of anatase phase of TiO2 (JCPDS Card no.-84-1286) (Fig. 1Bc). The most exposed plane of anatase TiO2 was (101), which was observed in all the prepared samples. 2.6 % Ni-TiO2 EG-W catalyst also showed a peak at 2θ value 43.56° corresponding to (200) plane of NiO (JCPDS Card no.-78-0643). Presence of NiO peak in 2.6 % Ni-TiO2 EG-W catalyst confirmed the existence of NiO crystals larger than 5 nm [34]. Meanwhile, XRD analysis of reduced (2.6 % Ni-TiO2 EG−W−H) catalyst was also performed to examine the changes after H2-pretreatment and before catalysis (Fig. 1Bd). We observed that 2θ values of 2.6 % Ni-TiO2 EG-W-H catalyst belongs to anatase phase of TiO2 as that of fresh 2.6 % Ni-TiO2 EG-W catalyst, while NiO was reduced to Ni° (metallic) as depicted in the XRD pattern with the peaks at 2θ values of 44.50° and 51.84° for (111) and (200) crystal faces (JCPDS Card No- 04-0850). Spent catalyst (2.6 % Ni-TiO2 EG-W-S) showed the characteristic peaks of anatase TiO2 along with Ni° (metallic nickel) peaks in the corresponding XRD pattern (Fig. 1Be). Since, H2-pretreated catalyst was used for catalysis, it might be the possible reason for presence of metallic nickel in spent catalyst and/or utilization of hydrazine hydrate during catalysis, could be another possibility. Furthermore, recyclability of 2.6 % Ni-TiO2 EG-W catalyst substantiated the absence of leaching phenomenon, which was further confirmed by ICP-AES analysis. The crystallite size of TiO2 in 2.6 % Ni-TiO2 EG-W, 2.6 % Ni-TiO2 EG-W-H and 2.6 % Ni-TiO2 EG-W-S catalysts were calculated by using Scherrer equation and found to be 15.8 nm, 15.8 nm and 16 nm, respectively. Transmission electron microscopy In the TEM images of 2.6 % Ni-TiO2 EG−W catalyst (Fig. 2 ), irregular shaped catalyst particles was observed with the size of around 16 nm–60 nm and the d-spacing values of 0.21 nm and 0.35 nm belongs to (200) plane of NiO and (101) plane of anatase TiO2 (Fig. 2b), respectively. SAED pattern further confirmed the polycrystalline [35] nature of 2.6 % Ni-TiO2 EG−W catalyst (Fig. 2b-inset). TEM-elemental mapping of 2.6 % Ni-TiO2 EG−W catalyst showed the uniform distribution of Ni over the TiO2 support, i.e. no agglomeration was observed (Fig. 3 ). The average particle size of NiO in the 2.6 % Ni-TiO2 EG−W catalyst was found to be 6.8 nm. Use of ethylene glycol (50 %) during synthesis, might have played a significant role in controlling the size [36] of active metal (i.e. nickel) in case of 2.6 % Ni-TiO2 EG−W catalyst. However, TEM images of H2-pretreated (2.6 % Ni-TiO2 EG-W-H) and spent (2.6 % Ni-TiO2 EG-W-S) catalysts confirmed the presence of metallic Ni in the respective catalysts as shown in Fig. 2 c - Fig. 2e. We have also performed morphological analysis by scanning electron microscopy (SEM) for 2.6 % Ni-TiO2 EG−W, 2.7 % Ni-TiO2 W and 2.8 % Ni-TiO2 EG catalysts (Fig. S3) and TEM analysis for 2.7 % Ni-TiO2 W and 2.8 % Ni-TiO2 EG catalysts, which can be found in ESI (Figs. S4 and S5). X-ray photoelectron spectroscopy (XPS) and temperature programmed reduction (TPR) analysis XPS is a surface analysis technique and Ni 2p core level spectra of fresh and spent catalysts showed the presence of different nickel species over the catalyst’s surface (Fig. 4 A). Ni 2p XP spectra characterized by two spin-orbit components (i.e. Ni 2p3/2 and Ni 2p1/2), which are separated by 17.4 eV–18.4 eV. Ni 2p XP spectra of fresh (2.6 % Ni-TiO2 EG−W), reduced (i.e. 2.6 % Ni-TiO2 EG-W-H) as well as spent (2.6 % Ni-TiO2 EG-W-S) catalysts showed well defined Ni 2p3/2 peaks with their respective satellite peaks. In the fresh 2.6 % Ni-TiO2 EG−W catalyst, Ni 2p3/2 peak consists three component peaks with binding energy values at 854.6 eV, 856.1 eV and 857.5 eV, which can be assigned for NiO, Ni2O3 and Ni(OH)2 (Fig. 4Aa), respectively [24,33,37–39]. Meanwhile, Ni 2p XP spectra of reduced (i.e. 2.6 % Ni-TiO2 EG-W-H) catalyst was also recorded and Ni2p3/2 binding energy values centred at 852.5 eV and 855.4 eV were assigned for Ni0 and NiO, respectively (Fig. 4Ab) [24,38]. Presence of oxide form of nickel was due to re-oxidation of surface Ni0 (metallic) before XPS analysis [24,38] or due to the interaction of surface metallic Ni atoms with the surface oxygen of TiO2. Spent (2.6 % Ni-TiO2 EG-W-S) catalyst exhibited three component binding energy values of Ni2p3/2, centred at 852.6 eV, 854.5 eV and 856.2 eV with the corresponding satellite peaks (Fig. 4Ac). In the spent catalyst, binding energy values at 852.6 eV and 854.5 eV can be assigned for Ni0 and NiO, respectively. While the binding energy value at 856.2 eV could be assigned for Ni2O3 as reported in literature [24]. From TEM analysis, it can be easily seen that the active Ni-species was present at the catalyst surface, interacting with TiO2. Now, if we look at the XPS analysis, our target was not the quantification of Ni but the investigation of the Ni-species present at the catalyst surface. From XPS analysis of 2.6 % Ni-TiO2 EG-W catalyst and analysing the intensity and area under the peaks, we can say that a good amount of Ni-species was present at the surface. Also, from metal dispersion analysis we have found that the Ni-species size was smallest for 2.6 % Ni-TiO2 EG-W catalyst. In this case, Ni-atom of the Ni-species interacts with the surface O-atom of TiO2 and the electron transfers between Ni-atom and O-atom of TiO2 creates metal-support interaction. As the size of the Ni-species decreases, the interfacial surface ratio of Ni-species to TiO2 increases and the interaction between Ni-species and TiO2 becomes stronger, which is actually the case for 2.6 % Ni-TiO2 EG-W catalyst. In the fresh 2.6 % Ni-TiO2 EG−W catalyst, Ti 2p3/2 represented binding energy values centred at 457.4 eV and 459.5 eV (Fig. 4Ba). First peak could be assigned for Ti+3 species which is close to reported literature [40]. The second peak at 459.5 eV was assigned for Ti+4 which is also consistent with the reported literature [41]. Similarly, 2.6 % Ni-TiO2 EG-W-H catalyst did not show any change in Ti-2p spectra (Fig. 4Bb) and confirmed the presence of Ti+3 and Ti+4, after H2-pretreatment. While 2.6 % Ni-TiO2 EG-W-S catalyst exhibited binding energy value at 458.3 eV indicating the presence of Ti+4 in the spent catalyst (Fig. 4Bc) [42]. O 1s spectra of fresh (2.6 % Ni-TiO2 EG−W) catalyst exhibited binding energy values which were located at 529.4 eV and 530.9 eV (Fig. 4Ca). O 1s spectra of 2.6 % Ni-TiO2 EG-W-H catalyst showed binding energy values at 528.1 eV, 529.8 eV and 531.5 eV (Fig. 4Cb). After deconvolution, spent (2.6 % Ni-TiO2 EG-W-S) catalyst displayed binding energy values at 529.4 eV, 531.1 eV and 532.8 eV (Fig. 4Cc). The binding energy values at 529.4 eV, 529.8 eV and 529.4 eV for fresh, reduced and spent catalysts were assigned for lattice oxygen of metal oxides (NiOx and TiO2) [9,24]. Binding energy values at 530.9 eV, 531.5 eV and 531.1 eV for fresh, reduced and spent catalysts were assigned for adsorbed surface oxygen or hydroxyl species [9,24]. For reduced and spent catalysts, binding energy values at 528.1 eV and 532.8 eV can be assigned for O atoms present at top layer of the surface metal oxide and O atoms of adsorbed water molecule [38], respectively. Reducibility behaviour of particular system is directly influenced by the size of metal nanoparticles and catalyst synthesis procedure [26a,43]. In addition, interaction between active metal and support of a supported catalyst can be also determined by its respective TPR profile. H2-TPR profiles of TiO2 P and 2.6 % Ni-TiO2 EG−W catalyst are shown in Fig. 4D. Literature reports revealed that pure TiO2 p exhibited a broad low intensity H2-consumption peak at ∼570 °C (Fig. 4 Da), which was likely due to reduction of surface Ti+4 to Ti+3 [44–46]. From the TPR profile of 2.6 % Ni-TiO2 EG−W catalyst, different interaction pattern between Ni-oxide and TiO2 nanoparticles can be clearly observed. TPR profile of 2.6 % Ni-TiO2 EG−W catalyst exhibited three H2-consumption peaks which were centred at 252 °C, 327 °C and 406 °C, indicating three different sized NiOx species interacting with the support in different manner i.e. different metal-support interaction (Fig. 4Db). As reported in literature [26a,47], the surface particles are easily reduced than bulk structures because of their accessibility for reduction. Moreover, core species are not readily exposed for reduction during the diffusion of molecular hydrogen over the surface of active species and hence, it requires higher temperature to reduce completely [26a]. In our case, first smaller H2-consumption peak at 252 °C was ascribed for smaller easily reducible surface NiOx particles [24] and second peak located at 327 °C was due to a little bit bigger NiOx particles, while the third one H2-consumption peak located at 406 °C can be ascribed for larger NiOx particles and/or may be due to two step reduction [24] of Ni2O3 species (Ni2O3→NiO→Ni°) which matched well with the XPS results of fresh (2.6 % Ni-TiO2 EG−W) catalyst. Hence, different metal-support interactions due to different sized Ni-oxide particles are evidenced from the TPR profile. In the TPR profile of 2.6 % Ni-TiO2 EG−W catalyst, a smaller hump at higher temperature region (without clear Tmax. value) was also observed which was probably due to reducible surface Ti4+ species [45]. TPR profiles of 2.7 % Ni-TiO2 W and 2.8 % Ni-TiO2 EG catalysts were also recorded and described in the ESI (Fig. S6A). RAMAN spectroscopy Raman spectra of TiO2 P, 2.6 % Ni-TiO2 EG−W, 2.6 % Ni-TiO2 EG-W-H and 2.6 % Ni-TiO2 EG-W-S catalysts are represented in Fig. 5 A and Fig. 5B. In the Raman spectra of TiO2 P, bands centred at 144.9 cm-1, 198.1 cm-1, 396.7 cm-1, 515.2 cm-1, 518 cm-1 (superimposed on 515.2 cm-1), 638.9 cm-1 were attributed to Eg, Eg, B1g, A1g, B1g, Eg vibrational modes of anatase TiO2 (Fig. 5Aa) [48,49]. Literature report revealed that characteristic Raman band for anatase TiO2 (∼144.9 cm-1) has tenfold greater intensity than any other phonons of this phase [50]. 2.6 % Ni-TiO2 EG−W catalyst showed shifts in bands position which were centred at 151.7 cm-1, 201.7 cm-1, 396.3 cm-1, 512.3 cm-1, 518.6 cm-1 (superimposed on 512.3 cm-1), 632.2 cm-1 (Figs. 5Ab, 5Bb), which is due to phonon confinement and surface stress [48b]. After H2-pretreatment, slight change in band position was observed in the 2.6 % Ni-TiO2 EG−W−H catalyst (Fig. 5Ac). Such spectra of 2.6 % Ni-TiO2 EG−W−H catalyst indicated that no other phase of TiO2 (i.e. rutile, brookite) was observed i.e. only anatase phase was predominating phase before catalysis (after H2-pretreatment) [49a]. Raman spectra of spent (2.6 % Ni-TiO2 EG-W-S) catalyst exhibited all the six Raman active bands for anatase TiO2 except very minute shifting in band position toward higher wavenumber (i.e. 152, 204, 399, 515.5, 519.2 and 634.3 cm-1) from the fresh one (2.6 % Ni-TiO2 EG-W catalyst), indicating stability of the catalyst after catalysis (Fig. 5Ad). As reported in literature [24,51], NiO exhibits four Raman active bands centred at around 420 cm−1, 500 cm−1, 708 cm−1 and 1075 cm−1 for NiO vibration mode, in which band at ∼420 cm−1 and ∼500 cm−1 (intense bands) were assigned to first order transverse optical (TO) and longitudinal optical (LO) phonon modes of NiO. The other two Raman active bands at ∼708 cm−1 and ∼1075 cm−1 were assigned for combination of 2TO and 2LO, respectively [51]. In our case, the bands corresponding to NiO vibration mode, were not separately distinguishable in 2.6 % Ni-TiO2 EG−W, 2.6 % Ni-TiO2 EG-W-H and 2.6 % Ni-TiO2 EG-W-S catalysts. The possible reason behind this might be due to very low Ni loading (2.6 %) in the catalysts or there might be overlapping of NiO (weak) bands with A1g + B1g band of TiO2 which is indicated by broadness in A1g + B1g band of TiO2 in the synthesized catalysts as compared to pure TiO2 P [Fig. 5A (b, c, d)]. For comparison purpose, Raman spectra of 2.7 % Ni-TiO2 W and 2.8 % Ni-TiO2 EG catalysts were also recorded and it is provided in the ESI (Figs. S6B & S6C). UV–vis DR spectroscopy To demonstrate the optical properties of prepared catalyst, UV–vis DR spectra were recorded for TiO2 P and 2.6 % Ni-TiO2 EG−W catalyst and depicted in Fig. 6 . Pure TiO2 P exhibited strong absorption band at 312 nm, which corresponds to O2− → Ti4+ charge transfer interaction [52]. On the other hand, Ni loaded catalyst such as 2.6 % Ni-TiO2 EG−W showed an absorption band at 300 nm. Noticeable shift in absorption edge toward higher wavelength was observed in case of 2.6 % Ni-TiO2 EG−W catalyst than pure TiO2 P, which might be due to charge transfer interaction between NiO and TiO2 particles. In the visible region, band from 600−800 nm is the characteristic of coloured species present in the sample [53]. Therefore, 2.6 % Ni-TiO2 EG-W catalyst also exhibited a weak broad absorption band (∼720 nm) in visible region which is responsible for coloured species (i.e. NiO). UV–vis-DR spectra of 2.7 % Ni-TiO2 W and 2.8 % Ni-TiO2 EG catalysts were also recorded and described in the ESI (Fig. S6D). The k3-weighted Fourier transform of Ni k-edge EXAFS spectra of 2.6 % Ni-TiO2 EG−W and 2.6 % Ni-TiO2 EG-W-S catalysts are shown in Fig. S7 and Table S2. For comparison and to know about more characteristic differences, we have performed the EXAFS analysis of 2.7 % Ni-TiO2 W and 2.8 % Ni-TiO2 EG catalysts also and it is provided in the ESI (Fig. S7 and Table S2). Catalytic performance Catalytic performance of different Ni-TiO2 catalysts was examined for selective reduction of nitrobenzene to azoxybenzene at room temperature in aqueous medium and at atmospheric pressure. Generally, metallic nickel is more reactive than its oxide form for hydrogenation reactions [54]. Therefore, H2-pretreated catalysts were used for catalysis. Number of experiments were conducted to find the most efficient system after examining the reactivity of different synthesized Ni-TiO2 catalysts as a function of reaction time, reactant:reducing agent mole ratio, temperature, solvents, and active metal loading etc. (Tables 2 and S3, Figs. 7, 8 , S8–S10). Hydrazine hydrate was used as transfer hydrogenating agent for reduction of nitro-compounds, where in-situ generated active hydrogen species reduced the nitro-compounds and produced water and N2 as by-products, after catalysis. Nitrobenzene was considered as a reference compound for optimization and comparison (Scheme 2 ). Catalytic activities of synthesized catalysts were thoroughly investigated and compared (see ESI) to establish the most efficient catalyst system (2.6 % Ni-TiO2 EG−W) for selective reduction of nitrobenzene to azoxybenzene. Initially, the reaction was carried out in presence of commercial NiO and commercial TiO2, but these metal oxides did not initiate the reaction as depicted in Table 2, entries 1 and 2. At room temperature, 2.6 % Ni-TiO2 EG−W−H (H2-pretreated) catalyst exhibited 89 % nitrobenzene conversion with 92 % azoxybenzene selectivity at room temperature within 12 h, using 1:1.5 nitrobenzene to hydrazine hydrate mole ratio (Table 2, entry 3). Furthermore, we extended the time of ongoing reaction up to 16 h to observe the changes in reactivity of synthesized catalyst. No specific change in reactivity of 2.6 % Ni-TiO2 EG−W−H catalyst was observed up to 16 h of reaction time (Fig. 7A). Effect of temperature studies for 2.6 % Ni-TiO2 EG−W−H catalyst revealed that the rate of reaction was increased with increasing temperature (Fig. 7B). On increasing the temperature from RT to 80 °C, decrease in product selectivity was observed at higher temperature over 2.6 % Ni-TiO2 EG-W-H catalyst. At 80 °C, 2.6 % Ni-TiO2 EG-W-H catalyst showed ∼96 % conversion of nitrobenzene with 82 % selectivity of azoxybenzene. Higher selectivity of azoxybenzene (92 %) was observed at room temperature for 2.6 % Ni-TiO2 EG−W−H catalyst (Fig. 7B). Reaction data of synthesized 2.7 % Ni-TiO2 W-H and 2.8 % Ni-TiO2 EG-H catalysts is also provided in the ESI (Figs. S8–S10 and Table S3). After that, we altered the nitrobenzene:hydrazine hydrate mole ratio (1:0.5, 1:1.5 and 1:2.5) without changing the other reaction parameters such as temperature (RT), time (12 h) and solvent (water) (Fig. 8A). On increasing nitrobenzene to hydrazine hydrate mole ratio, the conversion of nitrobenzene was increased to some extent but the selectivity of azoxybenzene was dropped for 2.6 % Ni-TiO2 EG−W−H catalyst. When we used nitrobenzene to hydrazine hydrate mole ratio 1:2.5, conversion of nitrobenzene was found to be ∼90 % with 75 % azoxybenzene selectivity for 2.6 % Ni-TiO2 EG−W−H system. Higher selectivity of azoxybenzene was observed using nitrobenzene to hydrazine hydrate mole ratio 1:1.5 for 2.6 % Ni-TiO2 EG−W−H catalyst. It was observed that formation of aniline was taking place in case of 2.6 % Ni-TiO2 EG-W-H while using 1:2.5 nitrobenzene to hydrazine hydrate mole ratio (Fig. 8A). In this study, 2.6 % Ni-TiO2 EG−W catalyst showed metal (Ni) dispersion of 14.9 % which is highest among other synthesized catalysts. Metal dispersion analysis showed the percentage of surface Ni particles of the respective catalysts, which also indicated that with decreasing metal dispersion, size of Ni particles increases [26a,33,34]. TPR patterns of the other synthesized catalysts (by changing solvents during synthesis) also showed that with decreasing Ni-dispersion, reducibility of the Ni-oxide particles decreased, which showed higher temperature reduction peaks [26a,33,34]. Among the synthesized catalysts, 2.6 % Ni-TiO2 EG−W catalyst showed most easily reducible Ni-oxide particles [47b] and these particles are the smallest compared to other synthesized catalysts, according to metal dispersion analysis. Smaller surface Ni-species generated higher metal-support interfacial surface area, making the interaction very strong which effected on the catalyst’s activity [26a,33,34]. Our characterization results suggested that 2.6 % Ni-TiO2 EG−W catalyst having smallest Ni-species among the synthesized catalysts with stronger metal-support interactions and the catalyst showed superior catalytic activity as compared to others. We have also thoroughly examined the activity results by changing reaction time, reactant to reductant mole ratio and temperature for other two synthesized catalysts (i.e. by changing solvents) (Figs. S8–S9). Additionally, activity result of catalyst synthesized by conventional wetness impregnation method (2.6 % Ni-TiO2 Imp.Com.) is also shown in ESI (Table S3, entry 1). 2.6 % Ni-TiO2 Imp.Com. catalyst showed very low reactivity with 5% nitrobenzene conversion. During study, we have found that 2.6 % Ni-TiO2 EG−W−H catalyst showed higher activity among different synthesized catalysts at room temperature in 10 mL of solvent (water) within 12 h of reaction time, using 1:1.5 reactant to reductant mole ratio (Table 2, entry 3). Therefore, we targeted the most efficient 2.6 % Ni-TiO2 EG−W−H catalyst to further optimize the other parameters such as solvent effect and active metal loading (Ni wt.%) etc. To check the effect of solvent over 2.6 % Ni-TiO2 EG−W−H catalyst, we used variety of polar and non-polar solvents (Table 2, entries 4 and 5) and found that polar solvents such as ethanol, DMF, etc. showed higher yield of desired product whereas, non-polar solvent such as toluene showed moderate yield of corresponding product. Thereafter, effect of active metal loading studies revealed that on increasing the active metal (Ni) content (wt.%), conversion of nitrobenzene was increased as the number of available active sites was increased for catalysis, but the selectivity of desired product was decreased (Fig. 8B). 1.3 % Ni-TiO2 EG−W−H catalyst showed ∼43 % conversion of nitrobenzene with 64 % azoxybenzene selectivity, probably due to presence of lesser number of active site for catalysis (Table S3, entry 2). Higher loading of catalyst (5.3 % Ni-TiO2 EG−W−H) showed higher conversion (98 %) but the selectivity of azoxybenzene was decreased (35 %) which is the drawback of system (Table S3, entry 3). Although, 5.3 % Ni-TiO2 EG-W catalyst have higher surface area with more Ni contents but it showed comparatively lower selectivity of azoxybenzene than 2.6 % Ni-TiO2 EG−W−H catalyst which might be due to presence of bigger, agglomerated NiOx crystals (as reflected in respective XRD pattern, Fig. S2e) and lower metal dispersion. Hence, from the effect of active metal loading studies, 2.6 % (wt. %) Ni loading was found to be optimum loading to get maximum yield of desired product (i.e. azoxybenzene). Performance of 2.6 % Ni-TiO2 EG−W−H catalyst was also tested under 1.0 MPa H2 pressure, which produced aniline selectively (Table 2, entry 6). This showed that under H2 pressure azoxybenzene could further reduce to aniline. Therefore, it can be concluded from the experiment that operating reaction conditions is also responsible to move the path of reaction. To compare the catalytic activities of other catalysts with 2.6 % Ni-TiO2 EG-W-H catalyst, please see the Table S3 in the ESI. Furthermore, we did the kinetic calculations for selective reduction of nitrobenzene to azoxybenzene over 2.6 % Ni-TiO2 EG−W−H catalyst. As reported in literature [12,55], selective reduction of nitrobenzene follows the pseudo-first order kinetics. We calculated rate constant values for selective reduction processes and plotted ln (Ct/C0) verses time for 2.6 % Ni-TiO2 EG-W-H catalyst (Fig. S11A). We calculated activation energy by using Arrhenius equation, which was found to be around 6.2 kJ mol-1 for 2.6 % Ni-TiO2 EG-W-H catalyst (Fig. 9 ) and it is much lower than the other synthesized catalysts (Fig. S12), indicating the superiority of 2.6 % Ni-TiO2 EG−W−H system. For catalyst recyclability, repeated use of 2.6 % Ni-TiO2 EG−W−H catalyst was carried out under optimized reaction conditions (Fig. S13). Recycling experiments were also conducted up to four successive cycles for other two catalysts (Fig. S13). It was found that 2.6 % Ni-TiO2 EG-W-H catalyst showed negligible loss in reactivity (Table 2 entry 7, Fig. S13) than others, which is an indication of its heterogeneous nature. Catalytic activities of the synthesized catalysts were found to be dependent on surface area, metal dispersion, active metal species size and formation of solid solution phase of the catalysts (see ESI, Figs. S2–S4, S6, Table S1 & S3). According to Haber’s mechanism [56], nitro group containing compounds are reduced to anilines in stepwise manner by forming nitroso and hydroxylamine intermediates. Meanwhile, when these intermediates undergo condensation step, then formation of azoxy and azo compounds takes place [12,56–58]. From last few years, Corma and co-workers [59] continuously working on selective reduction of nitroarenes over various catalytic systems (mainly gold as active metal) and emphasized the role of support for selective reduction processes. During their studies, they investigated the effect of support by using Au/CeO2 and Au/TiO2 (with same Au particle size) catalysts and found that support does not act as a simple carrier but also intervene in the reaction during catalysis. Previously, we reported Pt-CeO2 [23] and Ni-ZrO2 [24] catalyst for the selective reduction of nitroarenes to corresponding amines using molecular hydrogen and found that reaction was proceeding via direct route. But in present case, the reaction proceeded through condensation route, where nitroso intermediate condensed with hydroxylamine intermediate to form azoxy compound selectively. The azobenzene and aniline were formed in very less amount. To investigate the reaction pathway, we subjected the reaction intermediates (nitrosobenzene, phenylhydroxylamine, nitrosobenzene + phenylhydroxylamine, azoxybenzene, azobenzene) as reactants, under optimized reaction condition (Table S4). During the study, it was found that when we introduced nitrosobenzene as a reactant then good yield of azoxybenzene was formed within 8 h of reaction time. Moreover, when mixture of nitrosobenzene and phenylhydroxylamine was subjected then higher yield of azoxybenzene was obtained within 5 h of reaction time. While phenylhydroxylamine, azoxybenzene and azobenzene reduced to aniline with a poor yield i.e. only trace amount of aniline was detected, which indicated that further reduction of azoxybenzene to azobenzene and azobenzene to aniline was not favourable with 2.6 % Ni-TiO2 EG−W−H catalyst. In our case, strong metal-support interaction (SMSI) favoured the rapid dissociation of hydrazine hydrate at the metal support interfaces and the formation of active hydrogen species take place. After that, nitrobenzene gets physisorbed over the active surface of the catalyst and the subsequent conversion of nitrosobenzene to phenylhydroxylamine occurs. As soon as phenylhydroxylamine form, it immediately reacts with nitrosobenzene to form dihydroxy intermediate [11], which get dehydrated to form azoxybenzene. Further reduction of azoxybenezene to azobenzene and azobenzene to aniline does not proceed under optimized reaction conditions, which might be due to much higher hydrogenation barrier of these steps than previous steps (up to azoxybenzene formation) [11]. Therefore, we can conclude that the reduction of nitrobenzene followed the condensation route over 2.6 % Ni-TiO2 EG-W-H catalyst. Turnover number (TON) is an important factor to measure the efficiency of catalytic system. The higher TON of 2.6 % Ni-TiO2 EG−W−H catalyst again confirmed the superiority of system than other prepared catalysts (Tables 2 & S3) and reported non-noble metal based catalyst systems (Table S5). It was found that with increasing metal dispersion and decreasing Ni-species size of the catalyst, catalytic activity increased. So, it is obvious and also supported by different literature reports that active Ni-species sites at the catalyst’s surface are the active centres for the reaction. Here, strong metal-support interaction at the catalyst surface is generated by electron transfer between metal (Ni) and support (TiO2) but not due to solid solution and/ or encapsulation phenomena. To further elucidate the applicability of 2.6 % Ni-TiO2 EG−W−H catalyst, the reaction was extended to different nitroarenes, under optimized reaction condition. It was noted that 2.6 % Ni-TiO2 EG−W−H catalyst showed excellent yield of azoxy compounds with para-substituted (electron withdrawing or electron donating) nitro compounds. 2.6 % Ni-TiO2 EG-W-H catalyst showed 78 %–89 % conversion of different nitro compounds with the 84 %–92 % selectivity of corresponding azoxy compounds (Table S6). Conclusions We have developed a facile, cost-effective, selective and efficient Ni-TiO2 catalyst system for the removal of organic pollutants. The catalyst (2.6 % Ni-TiO2 EG−W) synthesized by hydro-solvothermal method using poly (diallyldimethylammonium chloride) and hydrazine hydrate was highly active for hydrogenation process. It was observed that 2.6 % Ni-TiO2 EG-W-H catalyst exhibited very high activity (high TON and low activation energy) for room temperature selective reduction of nitrobenzene to azoxybenzene, in aqueous medium using hydrazine hydrate as a reductant and conversion of nitrobenzene was found to be 89 % with 92 % selectivity of azoxybenzene. In addition, 2.6 % Ni-TiO2 EG-W-H catalyst also showed good yield of azoxy compounds with different substituted nitroarenes, under optimized reaction conditions. Probable reason for excellent activity of 2.6 % Ni-TiO2 EG-W-H catalyst was due to presence of highly dispersed (∼6.8 nm) Ni nanoparticles over TiO2 nanocrystals, providing large number of active sites for catalysis and strong metal-support interaction at the catalyst surface, which prevented the leaching of active species during catalysis. Hence, 2.6 % Ni-TiO2 EG-W-H catalyst maintained heterogeneity throughout the reaction and recycled up to several successive runs without significant loss in reactivity. Performing number of experiments, we concluded that the reduction of nitrobenzene to azoxybenzene occurs via condensation route instead of direct route. During the study, it was also found that the catalyst preparation methods and solvents used during catalyst synthesis significantly altered the physicochemical characteristics as well as reactivity of respective catalyst system. Declaration of Competing interests The authors declare that they have no known competing financial interests or personal relationships that could have appeared to influence the work reported in this paper. CRediT authorship contribution statement Astha Shukla: Investigation, Formal analysis, Validation, Writing - original draft. Rajib Kumar Singha: Visualization, Writing - review & editing. Takehiko Sasaki: Formal analysis, Writing - review & editing. Shubhadeep Adak: Formal analysis. Sonu Bhandari: Validation. V.V.D.N. Prasad: Writing - review & editing. Ankur Bordoloi: Writing - review & editing. Rajaram Bal: Conceptualization, Writing - review & editing, Supervision. Acknowledgements AS and SB thank to CSIR and UGC, New Delhi, India for their respective fellowships. Director, CSIR-IIP is acknowledged for his help and support. Analytical Science Division, CSIR-IIP is acknowledged for providing analytical facilities. The XAFS measurements were performed at KEK-IMSS-PF with the approval of the Photon Factory Advisory Committee (project 2017G190). Appendix A Supplementary data Supplementary material related to this article can be found, in the online version, at doi:https://doi.org/10.1016/j.mcat.2020.110943. Appendix A Supplementary data The following is Supplementary data to this article: References [1] A. Corma P. Serna P. Concepcion J.J. Calvino J. Am. Chem. Soc. 130 2008 8748 8753 [2] F. Figueras B. Coq J. Mol. Catal. A: Chem. 173 2001 223 230 [3] Y. Motoyama Y. Lee K. Tsuji S.-H. Yoon I. Mochida H. Nagashima ChemCatChem 3 2011 1578 1581 [4] M. Pietrowski M. Zielinski E. Alwin I. Gulaczyk R.E. Przekop M. Wojciechowska J. Catal. 378 2019 298 311 [5] B. Zhang H. Asakura J. Zhang J. Zhang S. De N. Yan Angew. Chem. Int. Ed. 55 2016 8319 8323 [6] C.C. Torres V.A. Jiménez C.H. Campos J.B. Alderete R. Dinamarca T.M. Bustamente B. Pawelec Mol. Catal. 447 2018 21 27 [7] Q. Sun N. Wang T. Zhang R. Bai A. Mayoral P. Zhang Q. Zhang O. Terasaki J. Yu Angew. Chem. Int. Ed. 58 2019 18570 18576 [8] G. Romanazzi A.M. Fiore M. Mali A. Rizzuti C. Leonelli A. Nacci P. Mastrorilli M.M. Dell’Anna Mol. Catal. 446 2018 31 38 [9] A. Shukla R.K. Singha L.N.S. Konathala T. Sasaki R. Bal RSC Adv. 6 2016 22812 22820 [10] S. Ghosh S.S. Acharyya T. Sasaki R. Bal Green Chem. 17 2015 1867 1876 [11] Q. Xiao Z. Liu F. Wang S. Sarina H. Zhu Appl. Catal. B: Environ. 209 2017 69 79 [12] M.N. Pahalagedara L.R. Pahalagedara J. He R. Miao B. Gottlieb D. Rathnayake S.L. Suib J. Catal. 336 2016 41 48 [13] Q. Shi R. Lu L. Lu X. Fu D. Zhao Adv. Synth. Catal. 349 2007 1877 1881 [14] D. Formenti F. Ferretti F.K. Scharnagl M. Beller Chem. Rev. 119 2019 2611 2680 [15] J. Song Z.-F. Huang L. Pan K. Li X. Zhang L. Wang J.-J. Zou Appl. Catal. B: Environ. 227 2018 386 408 [16] Z. Liu Y. Huang Q. Xiao H. Zhu Green Chem. 18 2016 817 825 [17] F. Ferlin M. Cappelletti R. Vivani M. Pica O. Piermatti L. Vaccaro Green Chem. 21 2019 614 626 [18] S. Doherty J.G. Knight T. Backhouse R.J. Summers E. Abood W. Simpson W. Paget R.A. Bourne T.W. Chamberlain R. Stones K.R.J. Lovelock J.M. Seymour M.A. Isaacs C. Hardacre H. Daly N.H. Rees ACS Catal. 9 2019 4777 4791 [19] Z.-P. Zhang X.-Y. Wang K. Yuan W. Zhu T. Zhang Y.-H. Wang J. Ke X.-Y. Zheng C.-H. Yan Y.-W. Zhang Nanoscale 8 2016 15744 15752 [20] S.-C.A. Lin Y.-H. Liu S.-M. Peng S.-T. Liu Mol. Catal. 466 2019 46 51 [21] T. Hou Y. Wang J. Zhang M. Li J. Lu M. Heggen C. Sievers F. Wang J. Catal. 353 2017 107 115 [22] L. Liu P. Concepción A. Corma J. Catal. 369 2019 312 323 [23] A. Shukla R.K. Singha T. Sasaki R. Bal Green Chem. 17 2015 785 790 [24] A. Shukla R.K. Singha M. Sengupta T. Sasaki C. Pendem R. Bal ChemistrySelect 3 2018 1129 1141 [25] C. Jiang Z. Shang X. Liang ACS Catal. 5 2015 4814 4818 [26] (a) R.K. Singha A. Shukla A. Yadav S. Sain C. Pendem L.N.S.K. Konathala R. Bal Mol. Catal. 432 2017 131 143 (b) R.K. Singha Y. Tsuji M.H. Mahyuddin K. Yoshizawa J. Phys. Chem. C 123 2019 9788 9798 (c) R.K. Singha A. Shukla A. Yadav T. Sasaki A. Sandupatla G. Deo R. Bal Catal. Sci. Technol. 7 2017 4720 4735 (d) R.K. Singha A. Shukla A. Sandupatla G. Deo R. Bal J. Mater. Chem. A 5 2017 15688 15699 [27] C.-C. Lin T.-Y. Wei K.-T. Lee S.-Y. Lu J. Mater. Chem. 21 2011 12668 12674 [28] Y. Yamamoto M. Fukui A. Tanaka K. Hashimoto H. Kominami Catal. Sci. Technol. 9 2019 966 973 [29] D. Dolat S. Mozia R.J. Wróbel D. Moszynski B. Ohtani N. Guskos A.W. Morawski Appl. Catal. B: Environ. 162 2015 310 318 [30] (a) M.D. Donohue G.L. Aranovich Adv. Colloid Interface Sci. 76–77 1998 137 152 (b) T. An J. Liu G. Li S. Zhang H. Zhao X. Zeng G. Sheng J. Fu Appl. Catal. A: Gen. 350 2008 237 243 [31] K.S.W. Sing D.H. Everett R.A.W. Haul L. Moscou R.A. Peirotti J. Rouquerol IUPAC commission on colloid and surface chemistry including catalysis Pure Appl. Chem. 57 1985 603 619 [32] V. Tiwari J. Jiang V. Sethi P. Biswas Appl. Catal. A: Gen. 345 2008 241 246 [33] R.K. Singha A. Yadav A. Agrawal A. Shukla S. Adak T. Sasaki R. Bal Appl. Catal. B: Environ. 191 2016 165 178 [34] R.K. Singha A. Shukla A. Yadav L.N.S. Konathala R. Bal Appl. Catal. B: Environ. 202 2017 473 488 [35] G. Li G. Li J. Li G. Jiang Catal. Sci. Technol. 6 2016 3108 3116 [36] (a) B. Wiley Y. Sun B. Mayers Y. Xia Chem. Eur. J. 11 2005 454 463 (b) C. Hai S. Li Y. Zhou J. Zeng X. Ren X. Li J. Am. Ceram. Soc. 5 2017 176 182 (c) B.H. Shambharkar A.P. Chowdhury RSC Adv. 6 2016 10513 10519 [37] R.K. Singha A. Yadav A. Shukla Z. Iqbal C. Pendem K. Sivakumar R. Bal ChemistrySelect 1 2016 3075 3085 [38] M.C. Biesinger B.P. Payne A.P. Grosvenor L.W.M. Lau A.R. Gerson R. St. C. Smart Appl. Surf. Sci. 257 2011 2717 2730 [39] J. Wang Z. Wang Z. Zhu Appl. Catal. B: Environ. 204 2017 577 583 [40] Q. Yu D. Liu R. Wang Z. Feng Z. Zuo S. Qin H. Liu X. Xu Mater. Sci. Eng. B 177 2012 639 644 [41] H. Hernández-Arriaga E. López-Luna E. Martínez‐Guerra M.M. Turrubiartes A.G. Rodríguez M.A. Vidal J. Appl. Phys. 121 2017 064302 [42] M.A. Aramendia V. Borau J.C. Colmenares A. Marinas J.M. Marinas J.A. Navio F.J. Urbano Appl. Catal. B: Environ. 80 2008 88 97 [43] Y. Song H. Liu S. Liu D. He Energy Fuels 23 2009 1925 1930 [44] V. Bratan C. Munteanu C. Hornoiu A. Vasile F. Papa R. State S. Preda D. Culita N.I. Ionescu Appl. Catal. B: Environ. 207 2017 166 173 [45] V.G. Deshmane S.L. Owen R.Y. Abrokwah D. Kuila J. Mol. Catal. A: Chem. 408 2015 202 213 [46] H. Zhu Z. Qin W. Shan W. Shen J. Wang J. Catal. 225 2004 267 277 [47] (a) J. Zhang H. Wang A.K. Dalai J. Catal. 249 2007 300 310 (b) M. Zabilskiy P. Djinović E. Tchernychova O.P. Tkachenko L.M. Kustov A. Pintar ACS Catal. 5 2015 5357 5365 [48] (a) T. Ohsaka F. Izumi Y. Fujiki J. Raman Spectrosc. 7 1978 321 324 (b) C. Lejon L. Osterlund J. Raman Spectrosc. 42 2011 2026 2035 [49] (a) X. Wang J. Shen Q. Pan J. Raman Spectrosc. 42 2011 1578 1582 (b) M. Hinojosa-Reyes V. Rodriguez-Gonzalez R. Zanella RSC Adv. 4 2014 4308 4316 (c) H. Zhang Z. Xing Y. Zhang Z. Li X. Wu C. Liu Q. Zhu W. Zhou RSC Adv. 5 2015 107150 107157 [50] C.A. Melendres A. Narayanasamy V.A. Maroni R.W. Siegel J. Mater. Res. 4 1989 1246 1250 [51] (a) W. Wang Y. Liu C. Xu C. Zheng G. Wang Chem. Phys. Lett. 362 2002 119 122 (b) L.X. Song Z.K. Yang Y. Teng J. Xia P. Du J. Mater. Chem. A 1 2013 8731 8736 [52] N. Venkatachalam M. Palanichamy V. Murugesan Mater. Chem. Phys. 104 2007 454 459 [53] S. Moghiminia H. Farsi H. Raissi Electrochim. Acta 132 2014 512 523 [54] K. Shimura K. Shimizu Green Chem. 14 2012 2983 2985 [55] (a) R.L. Lawrence B. Scola Y. Li C.-K. Lim Y. Liu P.N. Prasad M.T. Swihart M.R. Knecht ACS Nano 10 2016 9470 9477 (b) T. Aditya A. Pal T. Pal Chem. Commun. (Camb.) 51 2015 9410 9431 [56] F. Haber Zeitschrift Elektrochem. Angew. Phys. Chem. 4 1898 506 514 [57] Q. Xiao S. Sarina E.R. Waclawik J. Jia J. Chang J.D. Riches H. Wu Z. Zheng H. Zhu ACS Catal. 6 2016 1744 1753 [58] A. Noschese A. Buonerba P. Canton S. Milione C. Capacchione A. Grassi J. Catal. 340 2016 30 40 [59] D. Combita P. Concepción A. Corma J. Catal. 311 2014 339 349",
      "scopus-id": "85083880108",
      "coredata": {
        "eid": "1-s2.0-S246882312030198X",
        "dc:description": "Surface tuned Ni-TiO2 catalyst was prepared by hydro-solvothermal method using poly(diallyldimethylammonium chloride) (or PDADMAC) as a surfactant and hydrazine hydrate as a capping agent. Activity of catalyst was investigated for selective reduction of nitrobenzene to azoxybenzene in aqueous medium at room temperature, using hydrazine hydrate as the reducing agent for catalysis. It was observed that the catalyst prepared by hydro-solvothermal method (2.6 % Ni-TiO2 EG−W−H) showed 92 % selectivity of azoxybenzene with 89 % conversion of nitrobenzene, under mild reaction conditions, which is quite higher as compared to reported non-noble metal catalysts. Prepared catalysts were thoroughly characterized by various analytical techniques to find out the physicochemical characteristic features of the materials. 2.6 % Ni-TiO2 EG-W catalyst exhibited highly dispersed nickel nanoparticles (∼6.8 nm) over TiO2 surface and strong metal-support interaction due to smaller size of Ni-particles, which significantly enhanced the catalytic efficiency towards selective reduction of nitroarenes to azoxy compounds. Effect of solvents on catalyst synthesis process was also investigated and reported for establishing the superiority of 2.6 % Ni-TiO2 EG-W catalyst. The heterogeneous nature of highly dispersed catalyst (2.6 % Ni-TiO2 EG-W) was confirmed by the recyclability tests and found that the catalyst particles can be easily recovered and recycled up to four successive runs without any significant loss in its catalytic performance.",
        "openArchiveArticle": "false",
        "prism:coverDate": "2020-07-31",
        "openaccessUserLicense": null,
        "prism:aggregationType": "Journal",
        "prism:url": "https://api.elsevier.com/content/article/pii/S246882312030198X",
        "dc:creator": [
          {
            "@_fa": "true",
            "$": "Shukla, Astha"
          },
          {
            "@_fa": "true",
            "$": "Singha, Rajib Kumar"
          },
          {
            "@_fa": "true",
            "$": "Sasaki, Takehiko"
          },
          {
            "@_fa": "true",
            "$": "Adak, Shubhadeep"
          },
          {
            "@_fa": "true",
            "$": "Bhandari, Sonu"
          },
          {
            "@_fa": "true",
            "$": "Prasad, V.V.D.N."
          },
          {
            "@_fa": "true",
            "$": "Bordoloi, Ankur"
          },
          {
            "@_fa": "true",
            "$": "Bal, Rajaram"
          }
        ],
        "link": [
          {
            "@_fa": "true",
            "@rel": "self",
            "@href": "https://api.elsevier.com/content/article/pii/S246882312030198X"
          },
          {
            "@_fa": "true",
            "@rel": "scidir",
            "@href": "https://www.sciencedirect.com/science/article/pii/S246882312030198X"
          }
        ],
        "dc:format": "application/json",
        "openaccessType": null,
        "pii": "S2468-8231(20)30198-X",
        "prism:volume": "490",
        "articleNumber": "110943",
        "prism:publisher": "Elsevier B.V.",
        "dc:title": "Room temperature selective reduction of nitroarenes to azoxy compounds over Ni-TiO2 catalyst",
        "prism:copyright": "© 2020 Elsevier B.V. All rights reserved.",
        "openaccess": "0",
        "prism:issn": "24688231",
        "dcterms:subject": [
          {
            "@_fa": "true",
            "$": "Azoxy-compounds"
          },
          {
            "@_fa": "true",
            "$": "Ni-nanoparticles"
          },
          {
            "@_fa": "true",
            "$": "Nitroarenes reduction"
          },
          {
            "@_fa": "true",
            "$": "Metal-support interaction"
          },
          {
            "@_fa": "true",
            "$": "Nanocrystalline Ni-TiO2"
          }
        ],
        "openaccessArticle": "false",
        "prism:publicationName": "Molecular Catalysis",
        "openaccessSponsorType": null,
        "prism:pageRange": "110943",
        "pubType": "fla",
        "prism:coverDisplayDate": "July 2020",
        "prism:doi": "10.1016/j.mcat.2020.110943",
        "prism:startingPage": "110943",
        "dc:identifier": "doi:10.1016/j.mcat.2020.110943",
        "openaccessSponsorName": null
      },
      "objects": {
        "object": [
          {
            "@category": "standard",
            "@height": "200",
            "@width": "316",
            "@_fa": "true",
            "$": "https://api.elsevier.com/content/object/eid/1-s2.0-S246882312030198X-ga1.jpg?httpAccept=%2A%2F%2A",
            "@multimediatype": "JPEG image file",
            "@type": "IMAGE-DOWNSAMPLED",
            "@size": "19130",
            "@ref": "ga1",
            "@mimetype": "image/jpeg"
          },
          {
            "@category": "standard",
            "@height": "323",
            "@width": "649",
            "@_fa": "true",
            "$": "https://api.elsevier.com/content/object/eid/1-s2.0-S246882312030198X-gr1.jpg?httpAccept=%2A%2F%2A",
            "@multimediatype": "JPEG image file",
            "@type": "IMAGE-DOWNSAMPLED",
            "@size": "47113",
            "@ref": "gr1",
            "@mimetype": "image/jpeg"
          },
          {
            "@category": "standard",
            "@height": "473",
            "@width": "715",
            "@_fa": "true",
            "$": "https://api.elsevier.com/content/object/eid/1-s2.0-S246882312030198X-gr2.jpg?httpAccept=%2A%2F%2A",
            "@multimediatype": "JPEG image file",
            "@type": "IMAGE-DOWNSAMPLED",
            "@size": "111348",
            "@ref": "gr2",
            "@mimetype": "image/jpeg"
          },
          {
            "@category": "standard",
            "@height": "189",
            "@width": "715",
            "@_fa": "true",
            "$": "https://api.elsevier.com/content/object/eid/1-s2.0-S246882312030198X-gr3.jpg?httpAccept=%2A%2F%2A",
            "@multimediatype": "JPEG image file",
            "@type": "IMAGE-DOWNSAMPLED",
            "@size": "30729",
            "@ref": "gr3",
            "@mimetype": "image/jpeg"
          },
          {
            "@category": "standard",
            "@height": "656",
            "@width": "565",
            "@_fa": "true",
            "$": "https://api.elsevier.com/content/object/eid/1-s2.0-S246882312030198X-gr4.jpg?httpAccept=%2A%2F%2A",
            "@multimediatype": "JPEG image file",
            "@type": "IMAGE-DOWNSAMPLED",
            "@size": "92788",
            "@ref": "gr4",
            "@mimetype": "image/jpeg"
          },
          {
            "@category": "standard",
            "@height": "326",
            "@width": "565",
            "@_fa": "true",
            "$": "https://api.elsevier.com/content/object/eid/1-s2.0-S246882312030198X-gr5.jpg?httpAccept=%2A%2F%2A",
            "@multimediatype": "JPEG image file",
            "@type": "IMAGE-DOWNSAMPLED",
            "@size": "45836",
            "@ref": "gr5",
            "@mimetype": "image/jpeg"
          },
          {
            "@category": "standard",
            "@height": "274",
            "@width": "357",
            "@_fa": "true",
            "$": "https://api.elsevier.com/content/object/eid/1-s2.0-S246882312030198X-gr6.jpg?httpAccept=%2A%2F%2A",
            "@multimediatype": "JPEG image file",
            "@type": "IMAGE-DOWNSAMPLED",
            "@size": "19389",
            "@ref": "gr6",
            "@mimetype": "image/jpeg"
          },
          {
            "@category": "standard",
            "@height": "300",
            "@width": "659",
            "@_fa": "true",
            "$": "https://api.elsevier.com/content/object/eid/1-s2.0-S246882312030198X-gr7.jpg?httpAccept=%2A%2F%2A",
            "@multimediatype": "JPEG image file",
            "@type": "IMAGE-DOWNSAMPLED",
            "@size": "33950",
            "@ref": "gr7",
            "@mimetype": "image/jpeg"
          },
          {
            "@category": "standard",
            "@height": "298",
            "@width": "661",
            "@_fa": "true",
            "$": "https://api.elsevier.com/content/object/eid/1-s2.0-S246882312030198X-gr8.jpg?httpAccept=%2A%2F%2A",
            "@multimediatype": "JPEG image file",
            "@type": "IMAGE-DOWNSAMPLED",
            "@size": "43183",
            "@ref": "gr8",
            "@mimetype": "image/jpeg"
          },
          {
            "@category": "standard",
            "@height": "222",
            "@width": "263",
            "@_fa": "true",
            "$": "https://api.elsevier.com/content/object/eid/1-s2.0-S246882312030198X-gr9.jpg?httpAccept=%2A%2F%2A",
            "@multimediatype": "JPEG image file",
            "@type": "IMAGE-DOWNSAMPLED",
            "@size": "11791",
            "@ref": "gr9",
            "@mimetype": "image/jpeg"
          },
          {
            "@category": "standard",
            "@height": "165",
            "@width": "565",
            "@_fa": "true",
            "$": "https://api.elsevier.com/content/object/eid/1-s2.0-S246882312030198X-sc1.jpg?httpAccept=%2A%2F%2A",
            "@multimediatype": "JPEG image file",
            "@type": "IMAGE-DOWNSAMPLED",
            "@size": "18789",
            "@ref": "sc1",
            "@mimetype": "image/jpeg"
          },
          {
            "@category": "standard",
            "@height": "129",
            "@width": "661",
            "@_fa": "true",
            "$": "https://api.elsevier.com/content/object/eid/1-s2.0-S246882312030198X-sc2.jpg?httpAccept=%2A%2F%2A",
            "@multimediatype": "JPEG image file",
            "@type": "IMAGE-DOWNSAMPLED",
            "@size": "16288",
            "@ref": "sc2",
            "@mimetype": "image/jpeg"
          },
          {
            "@category": "thumbnail",
            "@height": "139",
            "@width": "219",
            "@_fa": "true",
            "$": "https://api.elsevier.com/content/object/eid/1-s2.0-S246882312030198X-ga1.sml?httpAccept=%2A%2F%2A",
            "@multimediatype": "GIF image file",
            "@type": "IMAGE-THUMBNAIL",
            "@size": "9252",
            "@ref": "ga1",
            "@mimetype": "image/gif"
          },
          {
            "@category": "thumbnail",
            "@height": "109",
            "@width": "219",
            "@_fa": "true",
            "$": "https://api.elsevier.com/content/object/eid/1-s2.0-S246882312030198X-gr1.sml?httpAccept=%2A%2F%2A",
            "@multimediatype": "GIF image file",
            "@type": "IMAGE-THUMBNAIL",
            "@size": "7417",
            "@ref": "gr1",
            "@mimetype": "image/gif"
          },
          {
            "@category": "thumbnail",
            "@height": "145",
            "@width": "219",
            "@_fa": "true",
            "$": "https://api.elsevier.com/content/object/eid/1-s2.0-S246882312030198X-gr2.sml?httpAccept=%2A%2F%2A",
            "@multimediatype": "GIF image file",
            "@type": "IMAGE-THUMBNAIL",
            "@size": "18763",
            "@ref": "gr2",
            "@mimetype": "image/gif"
          },
          {
            "@category": "thumbnail",
            "@height": "58",
            "@width": "219",
            "@_fa": "true",
            "$": "https://api.elsevier.com/content/object/eid/1-s2.0-S246882312030198X-gr3.sml?httpAccept=%2A%2F%2A",
            "@multimediatype": "GIF image file",
            "@type": "IMAGE-THUMBNAIL",
            "@size": "5232",
            "@ref": "gr3",
            "@mimetype": "image/gif"
          },
          {
            "@category": "thumbnail",
            "@height": "164",
            "@width": "141",
            "@_fa": "true",
            "$": "https://api.elsevier.com/content/object/eid/1-s2.0-S246882312030198X-gr4.sml?httpAccept=%2A%2F%2A",
            "@multimediatype": "GIF image file",
            "@type": "IMAGE-THUMBNAIL",
            "@size": "9437",
            "@ref": "gr4",
            "@mimetype": "image/gif"
          },
          {
            "@category": "thumbnail",
            "@height": "126",
            "@width": "219",
            "@_fa": "true",
            "$": "https://api.elsevier.com/content/object/eid/1-s2.0-S246882312030198X-gr5.sml?httpAccept=%2A%2F%2A",
            "@multimediatype": "GIF image file",
            "@type": "IMAGE-THUMBNAIL",
            "@size": "9116",
            "@ref": "gr5",
            "@mimetype": "image/gif"
          },
          {
            "@category": "thumbnail",
            "@height": "164",
            "@width": "213",
            "@_fa": "true",
            "$": "https://api.elsevier.com/content/object/eid/1-s2.0-S246882312030198X-gr6.sml?httpAccept=%2A%2F%2A",
            "@multimediatype": "GIF image file",
            "@type": "IMAGE-THUMBNAIL",
            "@size": "6554",
            "@ref": "gr6",
            "@mimetype": "image/gif"
          },
          {
            "@category": "thumbnail",
            "@height": "100",
            "@width": "219",
            "@_fa": "true",
            "$": "https://api.elsevier.com/content/object/eid/1-s2.0-S246882312030198X-gr7.sml?httpAccept=%2A%2F%2A",
            "@multimediatype": "GIF image file",
            "@type": "IMAGE-THUMBNAIL",
            "@size": "4829",
            "@ref": "gr7",
            "@mimetype": "image/gif"
          },
          {
            "@category": "thumbnail",
            "@height": "99",
            "@width": "219",
            "@_fa": "true",
            "$": "https://api.elsevier.com/content/object/eid/1-s2.0-S246882312030198X-gr8.sml?httpAccept=%2A%2F%2A",
            "@multimediatype": "GIF image file",
            "@type": "IMAGE-THUMBNAIL",
            "@size": "8066",
            "@ref": "gr8",
            "@mimetype": "image/gif"
          },
          {
            "@category": "thumbnail",
            "@height": "164",
            "@width": "194",
            "@_fa": "true",
            "$": "https://api.elsevier.com/content/object/eid/1-s2.0-S246882312030198X-gr9.sml?httpAccept=%2A%2F%2A",
            "@multimediatype": "GIF image file",
            "@type": "IMAGE-THUMBNAIL",
            "@size": "5118",
            "@ref": "gr9",
            "@mimetype": "image/gif"
          },
          {
            "@category": "thumbnail",
            "@height": "64",
            "@width": "219",
            "@_fa": "true",
            "$": "https://api.elsevier.com/content/object/eid/1-s2.0-S246882312030198X-sc1.sml?httpAccept=%2A%2F%2A",
            "@multimediatype": "GIF image file",
            "@type": "IMAGE-THUMBNAIL",
            "@size": "3587",
            "@ref": "sc1",
            "@mimetype": "image/gif"
          },
          {
            "@category": "thumbnail",
            "@height": "43",
            "@width": "219",
            "@_fa": "true",
            "$": "https://api.elsevier.com/content/object/eid/1-s2.0-S246882312030198X-sc2.sml?httpAccept=%2A%2F%2A",
            "@multimediatype": "GIF image file",
            "@type": "IMAGE-THUMBNAIL",
            "@size": "2746",
            "@ref": "sc2",
            "@mimetype": "image/gif"
          },
          {
            "@category": "standard",
            "@_fa": "true",
            "$": "https://api.elsevier.com/content/object/eid/1-s2.0-S246882312030198X-mmc1.docx?httpAccept=%2A%2F%2A",
            "@multimediatype": "Microsoft Word file",
            "@type": "APPLICATION",
            "@size": "6176252",
            "@ref": "mmc1",
            "@mimetype": "application/word"
          },
          {
            "@category": "standard",
            "@_fa": "true",
            "$": "https://api.elsevier.com/content/object/eid/1-s2.0-S246882312030198X-am.pdf?httpAccept=%2A%2F%2A",
            "@multimediatype": "Acrobat PDF file",
            "@type": "AAM-PDF",
            "@size": "1607908",
            "@ref": "am",
            "@mimetype": "application/pdf"
          }
        ]
      },
      "link": {
        "@rel": "abstract",
        "@href": "https://api.elsevier.com/content/abstract/scopus_id/85083880108"
      }
    }
  }
}