{
  "metadata": {
    "title": "Mesoporous tin phosphate as an effective catalyst for fast cyclodehydration of bio-based citral into <ce:italic>p</ce:italic>-cymene",
    "authors": "; ; ",
    "journal": "Molecular Catalysis",
    "date": "2021-10-31",
    "doi": "10.1016/j.mcat.2021.111887",
    "abstract": "",
    "uri": "https://api.elsevier.com/content/article/pii/S2468823121005046",
    "pii": "S2468823121005046"
  },
  "fulltext": {
    "full-text-retrieval-response": {
      "scopus-eid": "2-s2.0-85115788689",
      "originalText": "serial JL 315758 291210 291744 291790 291809 31 Molecular Catalysis MOLECULARCATALYSIS 2021-09-23 2021-09-23 2021-09-23 2021-09-23 2021-12-01T07:56:01 1-s2.0-S2468823121005046 S2468-8231(21)00504-6 S2468823121005046 10.1016/j.mcat.2021.111887 S300 S300.1 FULL-TEXT 1-s2.0-S2468823121X00156 2022-12-12T23:36:21.627889Z 0 0 20211001 20211031 2021 2021-09-23T09:51:55.901103Z absattachment articleinfo articlenumber articletitlenorm authfirstinitialnorm authfirstsurnamenorm cid cids contenttype copyright crossmark dateloaded dateloadedtxt datesearch datesort dateupdated dco docsubtype doctype doi eid ewtransactionid hubeid indexeddate issn issnnorm itemstage itemtransactionid itemweight openaccess openarchive pg pgfirst pii piinorm pubdateend pubdatestart pubdatetxt pubyr sectiontitle sortorder srctitle srctitlenorm srctype ssids alllist content subj subheadings suppl tomb volfirst volissue volumelist webpdf webpdfpagecount yearnav figure table e-component body acknowledge affil appendices articletitle auth authfirstini authfull authkeywords authlast authsuff grantnumber grantsponsor highlightsabst orcid primabst ref specialabst 2468-8231 24688231 true 515 515 C Volume 515 17 111887 111887 111887 202110 October 2021 2021-10-01 2021-10-31 2021 Regular Papers article fla © 2021 Elsevier B.V. All rights reserved. MESOPOROUSTINPHOSPHATEEFFECTIVECATALYSTFORFASTCYCLODEHYDRATIONBIOBASEDCITRALPCYMENE HE J 1 Introduction 2 Experimental 2.1 Materials 2.2 Preparation of catalytic materials 2.3 Characterization of catalyst 2.4 Catalytic evaluations and product analysis 3 Results and discussions 3.1 Catalyst characterization 3.2 Cyclodehydration of citral to p-cymene over different catalysts 3.3 Reaction conditions optimization 3.4 Reusability and stability of the catalyst 3.5 Plausible reaction pathway 4 Conclusions CRediT authorship contribution statement Acknowledgments Appendix Supplementary materials References DAI 2018 1808 1812 T SHI 2021 111517 X SCODELLER 2021 313 323 I YAN 2021 45 62 K DEISCHTER 2019 1710 1717 J SALAVATIFARD 2019 701 715 T YEH 2021 634 639 J BHAT 2021 111484 N HE 2020 6714 6747 J MARGARIT 2020 5123 5131 V HE 2021 111584 L OUYANG 2019 13764 13773 X LIAO 2020 8713 8722 Y CARLSON 2010 110 124 T FOSTER 2012 154 161 A KOSTYNIUK 2019 7690 7705 A YE 2017 10711 10716 L PACHECO 2014 8363 8367 J MESA 2020 7398 7405 J JIA 2020 640 646 W MATUSZEK 2016 8129 8137 K LUO 2021 4510 4515 X GENUINO 2019 3802 3806 H CORMA 2007 2411 2502 A WU 2016 32 58 L BRUNEAU 2018 3989 4004 C DAY 2019 1441 1445 A DI 2019 807 823 X ZHOU 2018 11288 11298 F DIAS 2019 97 104 A VOLANTI 2019 885 896 M TRANDAFIR 2020 6248 6258 M TIBBETTS 2021 597 610 J BAINES 1970 4901 4913 D CLARK 1977 2187 2191 B BARTON 1989 3353 3361 D QUEK 2010 1264 1267 X CORMA 2004 550 551 A ZHU 2005 404 413 Y SHCHERBAN 2018 236 247 N LI 2016 7722 7727 H LI 2017 67 77 F ORDOMSKY 2013 37 46 V HOU 2018 183 193 Q DUTTA 2014 925 933 A HE 2019 1289 1300 J ISAACS 2019 11814 11825 M HE 2013 42 45 Q RAJENDRAN 2015 246 249 V YUAN 2021 99 108 H SZIRTES 2009 239 243 L JIN 2019 139 146 Y LIU 2017 371 378 T WANG 2018 240 247 C CYCHOSZ 2017 389 414 K MENG 2019 5518 5528 Q LI 2014 56 65 L HEX2021X111887 HEX2021X111887XJ 2023-09-23T00:00:00.000Z 2023-09-23T00:00:00.000Z http://creativecommons.org/licenses/by-nc-nd/4.0/ © 2021 Elsevier B.V. All rights reserved. 2021-09-29T00:56:00.984Z http://vtw.elsevier.com/data/voc/AddOnTypes/50.7/aggregated-refined Hunan Provincial Natural Science Foundation of China 2021JJ40436 Natural Science Foundation of Hunan Province http://data.elsevier.com/vocabulary/SciValFunders/501100004735 http://sws.geonames.org/1814991/ Fok Ying-Tong Education Foundation 161030 Fok Ying Tong Education Foundation http://data.elsevier.com/vocabulary/SciValFunders/501100004806 http://sws.geonames.org/1814991/ Program of Introducing Talents of Discipline to Universities of China Project 211 http://data.elsevier.com/vocabulary/SciValFunders/501100012176 http://sws.geonames.org/1814991/ Guizhou Frontiers Science Center for Asymmetric Synthesis and Medicinal Molecules [2020]004 111 Program D20023 Higher Education Discipline Innovation Project http://data.elsevier.com/vocabulary/SciValFunders/501100013314 http://sws.geonames.org/1814991/ National Natural Science Foundation of China 21576059 21666008 21908033 NSFC National Natural Science Foundation of China http://data.elsevier.com/vocabulary/SciValFunders/501100001809 http://sws.geonames.org/1814991/ Outstanding Youth Project of Hunan Provincial Education Department 19B470 Financial supports from the National Natural Science Foundation of China ( 21908033, 21576059, 21666008 ), Fok Ying-Tong Education Foundation ( 161030 ), Outstanding Youth Project of Hunan Provincial Education Department ( 19B470 ), Hunan Provincial Natural Science Foundation of China (No. 2021JJ40436 ), Program of Introducing Talents of Discipline to Universities of China (111 Program, D20023 ), and Guizhou Frontiers Science Center for Asymmetric Synthesis and Medicinal Molecules ( [2020]004 ) are gratefully acknowledged. 0 https://doi.org/10.15223/policy-017 https://doi.org/10.15223/policy-037 https://doi.org/10.15223/policy-012 https://doi.org/10.15223/policy-029 https://doi.org/10.15223/policy-004 item S2468-8231(21)00504-6 S2468823121005046 1-s2.0-S2468823121005046 10.1016/j.mcat.2021.111887 315758 2021-12-01T08:33:46.17067Z 2021-10-01 2021-10-31 1-s2.0-S2468823121005046-main.pdf https://s3-eu-west-1.amazonaws.com/prod-ucs-content-store-eu-west/content/pii:S2468823121005046/MAIN/application/pdf/c31b2c48b686a0b8db22ce3a097a29b0/main.pdf main.pdf pdf true 6967734 MAIN 11 1-s2.0-S2468823121005046-main_1.png https://s3-eu-west-1.amazonaws.com/prod-ucs-content-store-eu-west/content/pii:S2468823121005046/PREVIEW/image/png/22aeea65f82b61df3973e58916aac22b/main_1.png main_1.png png 59319 849 656 IMAGE-WEB-PDF 1 1-s2.0-S2468823121005046-ga1.jpg https://s3-eu-west-1.amazonaws.com/prod-ucs-content-store-eu-west/content/pii:S2468823121005046/ga1/DOWNSAMPLED/image/jpeg/238ad7c88edc18a494b1e7c690e6dfd7/ga1.jpg ga1 true ga1.jpg jpg 33815 181 301 IMAGE-DOWNSAMPLED 1-s2.0-S2468823121005046-sc1.jpg https://s3-eu-west-1.amazonaws.com/prod-ucs-content-store-eu-west/content/pii:S2468823121005046/sc1/DOWNSAMPLED/image/jpeg/8677d5e9241fb4a9b83f8ca8983a9053/sc1.jpg sc1 sc1.jpg jpg 52796 381 593 IMAGE-DOWNSAMPLED 1-s2.0-S2468823121005046-fx3.jpg https://s3-eu-west-1.amazonaws.com/prod-ucs-content-store-eu-west/content/pii:S2468823121005046/fx3/DOWNSAMPLED/image/jpeg/2c46d9d27bcaed9fea4289397e96aa44/fx3.jpg fx3 fx3.jpg jpg 1200 62 44 IMAGE-DOWNSAMPLED 1-s2.0-S2468823121005046-sc2.jpg https://s3-eu-west-1.amazonaws.com/prod-ucs-content-store-eu-west/content/pii:S2468823121005046/sc2/DOWNSAMPLED/image/jpeg/75672af71d231a6cc8d98c3574a68115/sc2.jpg sc2 sc2.jpg jpg 59061 332 640 IMAGE-DOWNSAMPLED 1-s2.0-S2468823121005046-fx4.jpg https://s3-eu-west-1.amazonaws.com/prod-ucs-content-store-eu-west/content/pii:S2468823121005046/fx4/DOWNSAMPLED/image/jpeg/e790f149f73aa70ba438ebd484d47699/fx4.jpg fx4 fx4.jpg jpg 1128 71 27 IMAGE-DOWNSAMPLED 1-s2.0-S2468823121005046-fx1.jpg https://s3-eu-west-1.amazonaws.com/prod-ucs-content-store-eu-west/content/pii:S2468823121005046/fx1/DOWNSAMPLED/image/jpeg/98c80299026c08ea7d2fd8aff292381c/fx1.jpg fx1 fx1.jpg jpg 1059 65 26 IMAGE-DOWNSAMPLED 1-s2.0-S2468823121005046-fx2.jpg https://s3-eu-west-1.amazonaws.com/prod-ucs-content-store-eu-west/content/pii:S2468823121005046/fx2/DOWNSAMPLED/image/jpeg/d145df6debef5b117c3e4dbf98226ad2/fx2.jpg fx2 fx2.jpg jpg 1146 67 26 IMAGE-DOWNSAMPLED 1-s2.0-S2468823121005046-gr1.jpg https://s3-eu-west-1.amazonaws.com/prod-ucs-content-store-eu-west/content/pii:S2468823121005046/gr1/DOWNSAMPLED/image/jpeg/142ea5ad63779de8bafde67dcee3cbf8/gr1.jpg gr1 gr1.jpg jpg 36303 240 565 IMAGE-DOWNSAMPLED 1-s2.0-S2468823121005046-sc3.jpg https://s3-eu-west-1.amazonaws.com/prod-ucs-content-store-eu-west/content/pii:S2468823121005046/sc3/DOWNSAMPLED/image/jpeg/6760f6c03eba46a10fea5cad8faea7ff/sc3.jpg sc3 sc3.jpg jpg 34342 404 546 IMAGE-DOWNSAMPLED 1-s2.0-S2468823121005046-gr4.jpg https://s3-eu-west-1.amazonaws.com/prod-ucs-content-store-eu-west/content/pii:S2468823121005046/gr4/DOWNSAMPLED/image/jpeg/7ddb084d8bd147817502cfe0efc3b92c/gr4.jpg gr4 gr4.jpg jpg 41677 244 639 IMAGE-DOWNSAMPLED 1-s2.0-S2468823121005046-gr5.jpg https://s3-eu-west-1.amazonaws.com/prod-ucs-content-store-eu-west/content/pii:S2468823121005046/gr5/DOWNSAMPLED/image/jpeg/f6d72b7f29ee0a7e467cf5fa5663040c/gr5.jpg gr5 gr5.jpg jpg 65771 526 642 IMAGE-DOWNSAMPLED 1-s2.0-S2468823121005046-gr2.jpg https://s3-eu-west-1.amazonaws.com/prod-ucs-content-store-eu-west/content/pii:S2468823121005046/gr2/DOWNSAMPLED/image/jpeg/43af1bd8c0611c1a858ca473d706afa3/gr2.jpg gr2 gr2.jpg jpg 66599 565 649 IMAGE-DOWNSAMPLED 1-s2.0-S2468823121005046-gr3.jpg https://s3-eu-west-1.amazonaws.com/prod-ucs-content-store-eu-west/content/pii:S2468823121005046/gr3/DOWNSAMPLED/image/jpeg/49bd77612c8b4bc2e2f4a7e62cc4bfdc/gr3.jpg gr3 gr3.jpg jpg 161991 552 649 IMAGE-DOWNSAMPLED 1-s2.0-S2468823121005046-gr6.jpg https://s3-eu-west-1.amazonaws.com/prod-ucs-content-store-eu-west/content/pii:S2468823121005046/gr6/DOWNSAMPLED/image/jpeg/847c15e5dec4be240d0d18c94664852d/gr6.jpg gr6 gr6.jpg jpg 35948 248 648 IMAGE-DOWNSAMPLED 1-s2.0-S2468823121005046-gr7.jpg https://s3-eu-west-1.amazonaws.com/prod-ucs-content-store-eu-west/content/pii:S2468823121005046/gr7/DOWNSAMPLED/image/jpeg/82e23df9a18217db17f6be8c01728be2/gr7.jpg gr7 gr7.jpg jpg 76782 517 647 IMAGE-DOWNSAMPLED 1-s2.0-S2468823121005046-ga1.sml https://s3-eu-west-1.amazonaws.com/prod-ucs-content-store-eu-west/content/pii:S2468823121005046/ga1/THUMBNAIL/image/gif/3b8094e4b78f343c7e92edc4aec3aaea/ga1.sml ga1 true ga1.sml sml 17046 132 219 IMAGE-THUMBNAIL 1-s2.0-S2468823121005046-sc1.sml https://s3-eu-west-1.amazonaws.com/prod-ucs-content-store-eu-west/content/pii:S2468823121005046/sc1/THUMBNAIL/image/gif/9884599f2c4e5af6a4e3932d44be4c43/sc1.sml sc1 sc1.sml sml 7486 141 219 IMAGE-THUMBNAIL 1-s2.0-S2468823121005046-fx3.sml https://s3-eu-west-1.amazonaws.com/prod-ucs-content-store-eu-west/content/pii:S2468823121005046/fx3/THUMBNAIL/image/gif/79221fb3ecd9343394e7caa567debb11/fx3.sml fx3 fx3.sml sml 5709 274 196 IMAGE-THUMBNAIL 1-s2.0-S2468823121005046-sc2.sml https://s3-eu-west-1.amazonaws.com/prod-ucs-content-store-eu-west/content/pii:S2468823121005046/sc2/THUMBNAIL/image/gif/07d56f810dfdf7d95492410ff160182a/sc2.sml sc2 sc2.sml sml 9731 114 219 IMAGE-THUMBNAIL 1-s2.0-S2468823121005046-fx4.sml https://s3-eu-west-1.amazonaws.com/prod-ucs-content-store-eu-west/content/pii:S2468823121005046/fx4/THUMBNAIL/image/gif/34a35aaef038e9e6bc3cbeb0f400600e/fx4.sml fx4 fx4.sml sml 5245 316 121 IMAGE-THUMBNAIL 1-s2.0-S2468823121005046-fx1.sml https://s3-eu-west-1.amazonaws.com/prod-ucs-content-store-eu-west/content/pii:S2468823121005046/fx1/THUMBNAIL/image/gif/76d80e0d1c9b642950fb9996fd510b9c/fx1.sml fx1 fx1.sml sml 4783 289 116 IMAGE-THUMBNAIL 1-s2.0-S2468823121005046-fx2.sml https://s3-eu-west-1.amazonaws.com/prod-ucs-content-store-eu-west/content/pii:S2468823121005046/fx2/THUMBNAIL/image/gif/4d81ddaf954aada47da18d53d3104692/fx2.sml fx2 fx2.sml sml 5209 300 116 IMAGE-THUMBNAIL 1-s2.0-S2468823121005046-gr1.sml https://s3-eu-west-1.amazonaws.com/prod-ucs-content-store-eu-west/content/pii:S2468823121005046/gr1/THUMBNAIL/image/gif/ae84aec1bc9be45c649f3dfb1a28651b/gr1.sml gr1 gr1.sml sml 9231 93 219 IMAGE-THUMBNAIL 1-s2.0-S2468823121005046-sc3.sml https://s3-eu-west-1.amazonaws.com/prod-ucs-content-store-eu-west/content/pii:S2468823121005046/sc3/THUMBNAIL/image/gif/c0bb77d02a24bfbc51bfda383a470fba/sc3.sml sc3 sc3.sml sml 6522 162 219 IMAGE-THUMBNAIL 1-s2.0-S2468823121005046-gr4.sml https://s3-eu-west-1.amazonaws.com/prod-ucs-content-store-eu-west/content/pii:S2468823121005046/gr4/THUMBNAIL/image/gif/a9934f0652a2bdb82f8b5bd1df73484e/gr4.sml gr4 gr4.sml sml 7967 83 219 IMAGE-THUMBNAIL 1-s2.0-S2468823121005046-gr5.sml https://s3-eu-west-1.amazonaws.com/prod-ucs-content-store-eu-west/content/pii:S2468823121005046/gr5/THUMBNAIL/image/gif/ed8094d5a47fa68f9b1f8175f553c0ba/gr5.sml gr5 gr5.sml sml 11003 164 200 IMAGE-THUMBNAIL 1-s2.0-S2468823121005046-gr2.sml https://s3-eu-west-1.amazonaws.com/prod-ucs-content-store-eu-west/content/pii:S2468823121005046/gr2/THUMBNAIL/image/gif/78d9b105fef1d33603c1cfa1cc80437b/gr2.sml gr2 gr2.sml sml 10302 164 188 IMAGE-THUMBNAIL 1-s2.0-S2468823121005046-gr3.sml https://s3-eu-west-1.amazonaws.com/prod-ucs-content-store-eu-west/content/pii:S2468823121005046/gr3/THUMBNAIL/image/gif/a50522cce5af37b64ef559ded65d11df/gr3.sml gr3 gr3.sml sml 24348 164 193 IMAGE-THUMBNAIL 1-s2.0-S2468823121005046-gr6.sml https://s3-eu-west-1.amazonaws.com/prod-ucs-content-store-eu-west/content/pii:S2468823121005046/gr6/THUMBNAIL/image/gif/96328837b5ad90410f4a8b101ebc5d6e/gr6.sml gr6 gr6.sml sml 7873 84 219 IMAGE-THUMBNAIL 1-s2.0-S2468823121005046-gr7.sml https://s3-eu-west-1.amazonaws.com/prod-ucs-content-store-eu-west/content/pii:S2468823121005046/gr7/THUMBNAIL/image/gif/c59d38c422159d776c198021deeb655c/gr7.sml gr7 gr7.sml sml 12348 164 205 IMAGE-THUMBNAIL 1-s2.0-S2468823121005046-ga1_lrg.jpg https://s3-eu-west-1.amazonaws.com/prod-ucs-content-store-eu-west/content/pii:S2468823121005046/ga1/HIGHRES/image/jpeg/739268e61b25fc1127c3326e2b0c3ff8/ga1_lrg.jpg ga1 true ga1_lrg.jpg jpg 256541 801 1333 IMAGE-HIGH-RES 1-s2.0-S2468823121005046-sc1_lrg.jpg https://s3-eu-west-1.amazonaws.com/prod-ucs-content-store-eu-west/content/pii:S2468823121005046/sc1/HIGHRES/image/jpeg/1c39c83d472b20424eb605adbad24acd/sc1_lrg.jpg sc1 sc1_lrg.jpg jpg 385548 1686 2626 IMAGE-HIGH-RES 1-s2.0-S2468823121005046-fx3_lrg.jpg https://s3-eu-west-1.amazonaws.com/prod-ucs-content-store-eu-west/content/pii:S2468823121005046/fx3/HIGHRES/image/jpeg/6d819877f9a64cfc0a3c44d5bda00233/fx3_lrg.jpg fx3 fx3_lrg.jpg jpg 7421 274 196 IMAGE-HIGH-RES 1-s2.0-S2468823121005046-sc2_lrg.jpg https://s3-eu-west-1.amazonaws.com/prod-ucs-content-store-eu-west/content/pii:S2468823121005046/sc2/HIGHRES/image/jpeg/9cded4f27e208b2b287558319432cdf7/sc2_lrg.jpg sc2 sc2_lrg.jpg jpg 441503 1471 2833 IMAGE-HIGH-RES 1-s2.0-S2468823121005046-fx4_lrg.jpg https://s3-eu-west-1.amazonaws.com/prod-ucs-content-store-eu-west/content/pii:S2468823121005046/fx4/HIGHRES/image/jpeg/843b491cd53cb09131f180186a5f35aa/fx4_lrg.jpg fx4 fx4_lrg.jpg jpg 6972 316 121 IMAGE-HIGH-RES 1-s2.0-S2468823121005046-fx1_lrg.jpg https://s3-eu-west-1.amazonaws.com/prod-ucs-content-store-eu-west/content/pii:S2468823121005046/fx1/HIGHRES/image/jpeg/4394a8ecd47f50dcbe724e5c012c45df/fx1_lrg.jpg fx1 fx1_lrg.jpg jpg 5984 289 116 IMAGE-HIGH-RES 1-s2.0-S2468823121005046-fx2_lrg.jpg https://s3-eu-west-1.amazonaws.com/prod-ucs-content-store-eu-west/content/pii:S2468823121005046/fx2/HIGHRES/image/jpeg/010b1685d67d9ebd5c6cdb5c7ab657f4/fx2_lrg.jpg fx2 fx2_lrg.jpg jpg 6957 300 116 IMAGE-HIGH-RES 1-s2.0-S2468823121005046-gr1_lrg.jpg https://s3-eu-west-1.amazonaws.com/prod-ucs-content-store-eu-west/content/pii:S2468823121005046/gr1/HIGHRES/image/jpeg/c217c116db87fdfcd85457e3acb2b37a/gr1_lrg.jpg gr1 gr1_lrg.jpg jpg 286546 1060 2500 IMAGE-HIGH-RES 1-s2.0-S2468823121005046-sc3_lrg.jpg https://s3-eu-west-1.amazonaws.com/prod-ucs-content-store-eu-west/content/pii:S2468823121005046/sc3/HIGHRES/image/jpeg/98b55fbab09ac605c766b6367a3ce616/sc3_lrg.jpg sc3 sc3_lrg.jpg jpg 253611 1790 2417 IMAGE-HIGH-RES 1-s2.0-S2468823121005046-gr4_lrg.jpg https://s3-eu-west-1.amazonaws.com/prod-ucs-content-store-eu-west/content/pii:S2468823121005046/gr4/HIGHRES/image/jpeg/9a34639a255a2a8ca6c9937a5bb90271/gr4_lrg.jpg gr4 gr4_lrg.jpg jpg 296933 1079 2831 IMAGE-HIGH-RES 1-s2.0-S2468823121005046-gr5_lrg.jpg https://s3-eu-west-1.amazonaws.com/prod-ucs-content-store-eu-west/content/pii:S2468823121005046/gr5/HIGHRES/image/jpeg/57f8a87074c0f31a53e7eee0cce3a725/gr5_lrg.jpg gr5 gr5_lrg.jpg jpg 497971 2328 2842 IMAGE-HIGH-RES 1-s2.0-S2468823121005046-gr2_lrg.jpg https://s3-eu-west-1.amazonaws.com/prod-ucs-content-store-eu-west/content/pii:S2468823121005046/gr2/HIGHRES/image/jpeg/7e66731129fa6a5d8382f8060bfd7f9e/gr2_lrg.jpg gr2 gr2_lrg.jpg jpg 508141 2505 2876 IMAGE-HIGH-RES 1-s2.0-S2468823121005046-gr3_lrg.jpg https://s3-eu-west-1.amazonaws.com/prod-ucs-content-store-eu-west/content/pii:S2468823121005046/gr3/HIGHRES/image/jpeg/da17284fd2c02a16d4420d06c18852b5/gr3_lrg.jpg gr3 gr3_lrg.jpg jpg 1540332 2443 2872 IMAGE-HIGH-RES 1-s2.0-S2468823121005046-gr6_lrg.jpg https://s3-eu-west-1.amazonaws.com/prod-ucs-content-store-eu-west/content/pii:S2468823121005046/gr6/HIGHRES/image/jpeg/b50467c957171fb5d7b139fc84cfdf33/gr6_lrg.jpg gr6 gr6_lrg.jpg jpg 218035 1096 2868 IMAGE-HIGH-RES 1-s2.0-S2468823121005046-gr7_lrg.jpg https://s3-eu-west-1.amazonaws.com/prod-ucs-content-store-eu-west/content/pii:S2468823121005046/gr7/HIGHRES/image/jpeg/2c42ca086f1d975653dda497d2b37f6e/gr7_lrg.jpg gr7 gr7_lrg.jpg jpg 574258 2292 2866 IMAGE-HIGH-RES 1-s2.0-S2468823121005046-mmc1.doc https://s3-eu-west-1.amazonaws.com/prod-ucs-content-store-eu-west/content/pii:S2468823121005046/mmc1/MAIN/application/msword/41ad54eb85eebd39e607b4aa511b77e0/mmc1.doc mmc1 mmc1.doc doc 22936064 APPLICATION 1-s2.0-S2468823121005046-am.pdf https://s3-eu-west-1.amazonaws.com/prod-ucs-content-store-eu-west/content/egi:10X71PXVZTB/MAIN/application/pdf/a6e02f5e85fcd6f982aeeb8c6b22b07b/am.pdf am am.pdf pdf false 2791956 AAM-PDF MCAT 111887 111887 S2468-8231(21)00504-6 10.1016/j.mcat.2021.111887 Fig. 1 Illustration of reaction routes to the production and application of p-cymene. Fig. 1 Fig. 2 XRD patterns (a), N2 adsorption-desorption isotherms (b), and pore size distributions (c) of M-SnPO, C-SnPO, and SnO2. Fig. 2 Fig. 3 SEM (a, b) and TEM (c, d) images of M-SnPO sample. Fig. 3 Fig. 4 (a) NH3-TPD profiles of SnO2, C-SnPO, and M-SnPO catalysts, (b) pyridine-IR spectrum of M-SnPO catalyst. Fig. 4 Fig. 5 Synthesis of p-cymene from citral cyclodehydration over M-SnPO at (a) 140 °C, (b) 160 °C, (c) 180 °C and (d) 200 °C from 0.5 to 3.0 h. Reaction conditions: 1 mmol citral, 0.010 g M-SnPO catalyst, 10 mL heptane. Fig. 5 Fig. 6 (a) Results of cyclodehydration of citral into p-cymene over different M-SnPO catalyst dosage (reaction conditions: 1 mmol citral, 10 mL heptane, 180 °C, 0.5 h), (b) the results for cyclodehydration of citral into p-cymene with M-SnPO in different solvents (reaction conditions: 1 mmol citral, 0.02 g M-SnPO, 10 mL solvent, 180 °C, 0.5 h). Fig. 6 Fig. 7 (a) Results of five successive runs of M-SnPO catalyst in the cyclodehydration of citral to yield p-cymene (reaction conditions: 1 mmol citral, 0.02 g M-SnPO, 10 mL heptane, 180 °C, 0.5 h), (b) XRD patterns, (c) N2 adsorption-desorption isotherms and (d) NH3-TPD profiles of fresh and regenerated M-SnPO catalysts. Fig. 7 Scheme 1 Schematic diagram for the synthesis of p-cymene from cyclodehydration of bio-based citral. Scheme 1 Scheme 2 Schematic illustration of the preparation of mesoporous tin phosphate catalyst (M-SnPO). Scheme 2 Scheme 3 Plausible reaction pathway for the cyclodehydration of citral into p-cymene. Scheme 3 Table 1 The performance of different catalysts on the cyclodehydration of citral a . Table 1 Entry Catalyst Conv.(%) Yield (%) Image, table 1 Image, table 1 Image, table 1 Image, table 1 1 None 25.3 < 1.0 1.1 < 1.0 1.8 2 SnO2 37.6 2.0 1.2 0.5 1.7 3 C-SnPO 53.7 20.6 3.0 0.6 5.9 4 M-SnPO 99.7 72.7 5.9 1.0 1.0 5 H3PO4 99.8 17.5 5.6 2.1 0.8 6 SnCl4•5H2O 84.0 14.0 10.9 1.1 6.5 a Reaction conditions: 1 mmol citral, 10 mL heptane, 0.01 g catalyst, 180 °C, 1 h. Table 2 Comparison of the catalytic behavior of M-SnPO catalyst with other reported catalysts in the cyclodehydration of citral into p-cymene. Table 2 Entry Catalyst Cat. amount (wt%) a C(citral)initial (mol/L) b Reaction conditions Conv. (%) Yield (%) TOF (h −1) c Ref. 1 Acidic aqueous solution – 0.62 pH=1.8, 70 °C, 22 h, 1 atm N2 100 81 – 34 2 Hydrochloric acid solution – 0.44 pH=2.5, 25 °C, 35 d, 1 atm N2 100 1.1 – 35 3 p-Toluenesulfonic acid monohydrate 50 2.5 1atm Ar, 35 °C 100 25 1.25 36 4 Rh-PF6 He – 0.067 70 °C, 6 h, 20 mLmin−1 He 84 39.5 3.5 37 5 M-SnPO 13.2 0.1 180 °C, 0.5 h >99 78.5 34.3 This work a m(catalyst)/m(citral). b Initial concentration of citral (mol/L). c Turnover frequency (TOF) was calculated as (mole of p-cymene)/(mole of active sites × reaction time). Mesoporous tin phosphate as an effective catalyst for fast cyclodehydration of bio-based citral into p-cymene Jian He Investigation Methodology Formal analysis Writing – original draft a b c Zhaozhuo Yu Visualization Validation a Hongguo Wu Validation a Hu Li Prof. PhD Conceptualization Funding acquisition Writing – review & editing a ⁎ Song Yang Prof. PhD Supervision Funding acquisition Resources a ⁎ a State Key Laboratory Breeding Base of Green Pesticide & Agricultural Bioengineering, Key Laboratory of Green Pesticide & Agricultural Bioengineering, Ministry of Education, State-Local Joint Laboratory for Comprehensive Utilization of Biomass, Center for Research & Development of Fine Chemicals, Guizhou University, Guiyang 550025, China State Key Laboratory Breeding Base of Green Pesticide & Agricultural Bioengineering Key Laboratory of Green Pesticide & Agricultural Bioengineering Ministry of Education State-Local Joint Laboratory for Comprehensive Utilization of Biomass Center for Research & Development of Fine Chemicals Guizhou University Guiyang 550025 China aState Key Laboratory Breeding Base of Green Pesticide & Agricultural Bioengineering, Key Laboratory of Green Pesticide & Agricultural Bioengineering, Ministry of Education, State-Local Joint Laboratory for Comprehensive Utilization of Biomass, Center for Research & Development of Fine Chemicals, Guizhou University, Guiyang 550025, PR ChinaChina b Key Laboratory of Hunan Forest Products and Chemical Industry Engineering, Jishou University, Zhangjiajie, 427000, China Key Laboratory of Hunan Forest Products and Chemical Industry Engineering, Jishou University Zhangjiajie 427000 China bKey Laboratory of Hunan Forest Products and Chemical Industry Engineering, Jishou University, Zhangjiajie, 427000, PR ChinaChina c College of Chemistry and Chemical Engineering, Jishou University, Jishou, Hunan, 416000, China College of Chemistry and Chemical Engineering, Jishou University Jishou Hunan 416000 China cCollege of Chemistry and Chemical Engineering, Jishou University, Jishou, Hunan, 416000, PR ChinaChina ⁎ Corresponding authors. Graphical abstract Mesoporous tin phosphate (M-SnPO) with Lewis-Brønsted dual acidity was developed as a novel heterogeneous catalyst for fast and effective cascade conversion of bio-based citral to p-cymene. Image, graphical abstract Effective synthesis of aromatic compounds from renewable biomass is highly important yet challenging. p-Cymene is an attractive aromatic compound with various promising applications in the manufacture of fine chemicals. In this study, a novel and effective catalytic system based on mesoporous tin phosphate (M-SnPO) with Lewis-Brønsted dual acidity was developed for the fast synthesis of p-cymene from the cyclodehydration of bio-based citral. Up to 78.5% yield of p-cymene was achieved from the cyclodehydration of citral at 180 °C within only 0.5 h, superior to the results reported for benchmark homogeneous acid catalysts. Characterization of as-prepared M-SnPO catalyst via various techniques indicates that the synergic effect of Lewis and Brønsted acidic sites, large pore-sized structure, and high surface area are responsible for its remarkable catalytic performance. In addition, the effectiveness of the M-SnPO catalyst could be almost sustained over multiple cycles without significant loss. The work herein is the first example of developing a Lewis-Brønsted dual acidic heterogeneous catalyst for the fast synthesis of p-cymene from the cyclodehydration of citral. Keywords P-Cymene Cyclodehydration Citral Heterogeneous catalysis Biomass conversion 1 Introduction Aromatic compounds are a pivotal class of feedstocks for the chemical industry in the manufacture of various commodity chemicals, such as pharmaceuticals, polymers, plastics, and agrochemicals [1-3]. And the demand for aromatic compounds is increasingly growing with the development of society [4]. The majority of aromatic compounds are currently accessible from nonrenewable fossil-based resources via catalytic cracking and reforming procedures [5]. To meet the requirements of socially sustainable development in conjunction with alleviating excessive dependence on fossil-based resources, alternative routes towards the production of aromatic compounds from renewable biomass have been exploited thanks to biomass featured with renewable, abundant, easily available, and carbon-rich properties [6-11]. Several elegant methods to aromatic compounds synthesis from biomass over the years have been developed, mainly including (i) depolymerization of lignin [12,13], (ii) catalytic fast pyrolysis of biomass [14,15], (iii) aromatization of biomass derivatives (e.g., gasification products and γ-valerolactone) [16,17], and (iv) sequential Diels-Alder reaction and dehydration of biomass-derived furan compounds with an alkene or its derivatives [18-21]. Despite the tremendous progress, particular interest is being placed on exploiting novel methodologies for the synthesis of aromatic compounds from biomass, attempting to improve the efficiency of biomass utilization, and synchronously accelerating the industrialization process for aromatic compounds synthesis from biomass [22,23]. Citral, as an important biomass-derived aldehyde, is abundant in bio-oils (e.g., lemongrass oil and Litsea cubeba oil) originated from biomass pyrolysis or accessible from biomass-derived terpenes and terpenoids [24-26]. Citral is an unsaturated aliphatic aldehyde with two kinds of unsaturated bonds (i.e., C = C and C = O) making it attractive as a building block for the production of fragrance, flavor, biofuels, pharmaceuticals, and agrochemicals [27-29]. Amongst, p-cymene is a representative derivative of citral via cyclodehydration, which possesses various applications such as the use as a solvent for the organic reaction [30], synthesis of terephthalic acid [31], as a versatile raw material for the manufacture of pharmaceuticals, herbicides, p-cresol and musk perfumes (Fig. 1 ) [32,33]. Although the synthesis of p-cymene from citral cyclodehydration is early reported, only a few reports are available on this transformation due to its challenges, whilst research interest for this reaction is mainly concentrated on adopting homogeneous acid catalysts (e.g., hydrochloric acid and p-benzenesulfonic acid) (Scheme 1) [34-36]. As far as we know, only one heterogeneous catalyst comprising Rh nanoparticles immobilized by 1-n‑butyl‑3-methylimidazolium hexafluorophosphate (Rh-PF6) and the imidazolium-based ionic liquid was to date reported for the cyclodehydration of citral into p-cymene, giving rise to 39.5% yield under a helium flow (20 mL/min) [37]. The corrosive of homogeneous acid catalysts and moderate activity of expensive Rh-PF6 catalyst limit their large-scale application. Undoubtedly, the development of a novel catalytic system based on an effective heterogeneous catalyst for the cyclodehydration of citral into p-cymene is highly necessary. Previous findings indicate that the cyclodehydration of citral into p-cymene is a tandem reaction that possibly proceeds to comply with a cyclization-dehydration-isomerization sequence in the presence of Brønsted acidic sites, as illustrated in Scheme 1 [34-36]. Knowledge from literature manifests that the cyclization of unsaturated aliphatic aldehyde [38,39] and the isomerization of alkene [26,40] are preferably facilitated by Lewis acidic sites. Spurred by the observations, one single heterogeneous catalyst embracing Lewis-Brønsted dual acidic sites is envisioned to enable the cyclodehydration of citral into p-cymene to proceed successfully. Metal phosphates have been received considerable attention in the field of catalysis owing to the characteristics of Lewis-Brønsted dual acidity, well tunability in properties and structure as well as low cost [41-44]. In light of Sn4+ showing strong Lewis acidity [45] together with the hierarchically porous structure endowing facile active-site accessibility [46,47], mesoporous tin phosphate (containing both micropores and mesopores) with Lewis-Brønsted dual acidity was herein prepared and developed successfully for the cyclodehydration of citral into p-cymene with giving a 78.5% yield of p-cymene. To the best of our knowledge, the approach of employing a heterogeneous catalyst with Lewis-Brønsted dual acidity to facilitate the fast synthesis of p-cymene from citral cyclodehydration has not been reported so far. This work is thus expected to provide more directions for the sustainable synthesis of aromatic compounds from biomass. 2 Experimental 2.1 Materials SnCl4•5H2O (99.0%), hexadecyl trimethyl ammonium bromide (CTAB, 99%), naphthalene (99%), p-α-dimethylstyrene (>95.0%) were purchased from Shanghai Aladdin Industrial Inc. p-Cymene (≥99.5%) was procured from Sigma-Aldrich. Citral (mixture of cis and trans, 95%) was provided by Alfa Aesar. H3PO4 (≥85%), n-heptane (≥98.5%), toluene (≥99.5%), acetonitrile (≥99.2%), 1,4-dioxane (99.5%), ethyl acetate (≥99.5%), and other reagents with analytically pure were bought from Chongqing Chuandong Chemical Reagent Company. 2.2 Preparation of catalytic materials Mesoporous tin phosphate was synthesized by a hydrothermal procedure associated with a template approach. Typically, 1.0 g of CTAB was dissolved in 25 mL deionized water with magnetic stirring (500 rpm) at 50 °C. 1.15 g (10 mmol) of H3PO4 was then introduced into the aqueous solution and the resultant mixture was allowed to stir for another 0.5 h at 50 °C. After cooling to room temperature, 10 mL of an aqueous solution containing 2.88 g (8 mmol) of SnCl4•5H2O was slowly added. Following stirring for 3 h at room temperature, the mixture was transferred into a 100 mL stainless steel autoclave with Teflon lined and oven-heated at 100 °C for 3 days. Afterward, solid samples were collected by filtration, and then subjected to drying at 80 °C for 12 h followed by calcination in air at 550 °C for 6 h. The calcined material was denoted as M-SnPO. For comparison, common tin phosphate was fabricated with the above procedure but in the absence of CTAB, and the resulting material was designated C-SnPO. Besides, the bulk stannic oxide sample was also prepared by precipitation method using ammonium hydroxide as precipitating agent. 2.3 Characterization of catalyst Powder X-ray diffraction (XRD) patterns of as-prepared catalysts with a 2θ angle located between 5° and 90° were acquired on a D/max-TTR III diffractometer via using a Ni-filtered Cu Kα radiation. The Brunauer-Emmett-Teller (BET) surface area and Barrett-Joyner-Halenda (BJH) pore size distribution of as-synthesized catalysts were determined based on N2 physisorption measurements, which were performed on a Micromeritics ASAP 2460 instrument at −196 °C. Prior to the adsorption analysis, solid samples were evacuated at 200 °C for 4 h. Morphological and textural information of as-fabricated catalysts were collected by a field emission scanning electron microscopy (Nova NanoSEM 450 FEI microscope) and a Transmission electron microscopy (Tecnai G20 electron microscope). Aim at evaluating the acid amount of as-prepared catalysts, an AutoChem 2920 chemisorption analyzer with a thermal conductivity detector (TCD) was employed to acquire the NH3-TPD profiles of catalysts. Before the tests, the solid samples were preheated at 300 °C for 1 h in a helium flow (25 mL/min). After cooling down to 50 °C, the pure He gas was replaced by a mixture gas of NH3/He (v/v = 1/9), and the samples were subjected to the gas flow (25 mL/min) of NH3/He for 1 h. After removal of redundant and physically adsorbed NH3 gas by purging with pure He (25 mL/min, 1 h) and stabilization of the baseline, the temperature was raised to 700 °C with a rate of 10 °C/min and the amount of NH3 desorption was monitored by TCD. The nature of Brønsted and Lewis acidity was evaluated with IR spectroscopy of adsorbed pyridine, which was performed on a NICOLET iS50 (ThermoFisher Scientific) spectrometer equipped with a vacuum system and an MCT (mercury cadmium telluride) detector. The concentrations of Sn and P species in reaction filtrate after removing catalyst were evaluated by inductively coupled plasma optical emission spectroscopy (ICP-OES, Agilent 720). 2.4 Catalytic evaluations and product analysis The catalytic tests of citral cyclodehydration were performed under autogenous pressure in a 25 mL stainless steel batch autoclave with magnetic stirring (500 rpm). Typically, the autoclave reactor was loaded with 0.152 g (1 mmol) of citral, 10 mL of n-heptane, 0.01 g of catalyst, and 0.04 g of naphthalene as an internal standard. After sealing, the autoclave was heated to a designed temperature (140, 160, 180, and 200 °C) to trigger the reaction. Zero time of the reaction was established once the autoclave temperature attained the set temperature occurring at 140, 160, 180, and 200 °C after 20, 24, 35, and 40 min, respectively. After the given reaction time (0.5–3.0 h), the autoclave was quickly immersed in a cooling water bath. Afterward, aliquots of reaction mixtures were sampled, filtered through a PTFE membrane (0.22 μm), and analyzed by GC–MS (Agilent 6890–5973) with an HP-5MS column (30 m × 0.25 mm × 0.25 μm) and GC-FID (Agilent 7890B) with an HP-5 column (30 m × 0.320 mm × 0.25 μm). The reusability of M-SnPO was investigated by performing five catalytic consecutive runs under the reaction conditions of 180 °C and 0.5 h. The spent catalyst was collected via centrifugation after each run, washed with ethanol two times, and subsequently dried at 80 °C for 5 h. Prior to being reused for the subsequent successive run, the spent catalyst was regenerated by calcination at 550 °C for 2 h in air. 3 Results and discussions 3.1 Catalyst characterization As illustrated in Scheme 2, M-SnPO was fabricated through the hydrothermal method using CTAB as a template. The diffractograms of M-SnPO, C-SnPO, and SnO2 are exhibited in Fig. 2 a along with a representation of the tetragonal rutile SnO2 standard card (PDF#41–1445). A series of sharp diffraction peaks with high intensity at around 26.7°, 33.9°, and 51.9° were clearly observed for as-prepared SnO2, which well corresponded to (110), (101), and (211) planes of tetragonal rutile SnO2 [48, 49], respectively. In contrast, one broad diffraction peak with low intensity at 2θ ≈ 21° was found in the XRD pattern of M-SnPO, demonstrating the amorphous nature of the as-prepared M-SnPO, which also matched well with the previously reported results [43, 44]. Noteworthy, the diffraction peaks with low intensity indexed to (110), (101), and (211) planes of tetragonal rutile SnO2 were also visible in the XRD pattern of C-SnPO, implying the existence of a small amount of bulk stannic oxide in the as-prepared C-SnPO material. In addition, many other diffraction peaks were also clearly observed in the XRD pattern of C-SnPO, which were probably ascribed to lattice planes of cubic tin phosphate [50] and/or Sn(HPO4)2 [51]. Therefore, the results clearly implied the addition of CTAB during the preparation procedure could not only prevent the formation of the bulk stannic oxide but also ensure the generation of amorphous tin phosphate. The N2 physisorption isotherms and corresponding pore size distributions of as-prepared M-SnPO, C-SnPO, and SnO2 are presented in Fig. 2b and 2c, respectively. The physisorption isotherm of SnO2 falls within type-IV character showing a typical H5 hysteresis loop, indicating the presence of irregular mesopores derived from interparticle voids [52]. And the size of mesopores in SnO2 concentrated at around 7.2 nm, as shown in Fig. 2c. In the case of C-SnPO sample, a representative type-IV isotherm with a classical type-H3 hysteresis loop is presented, indicating the formation of slit-shaped mesopores due to the aggregation of C-SnPO particles [53]. The serious aggregation of particles can be finely validated by the SEM image of C-SnPO as shown in Figure S1. Besides, a broad pore size distribution is observed for C-SnPO (Fig. 2c), indicating the irregular nature of the formed slit-shaped mesopores. Nevertheless, the isotherm of M-SnPO shown in Fig. 2b is of type IV and the corresponding hysteresis loop is classified as type H4, which is characteristic of materials containing both microporosity and mesoporosity [54]. Moreover, a sharp capillary condensation step occurs at high relative pressures of 0.85–0.97 in the region of hysteresis, which is describable to the existence of large pore-sized mesoporous structure in M-SnPO sample [55]. Also, the presence of large pore-sized mesopores in M-SnPO can be further corroborated by its pore size distribution (Fig. 2c), wherein the pore sizes mainly concentrated at ∼1.6 and ∼23.8 nm. The large pore-sized mesopores within M-SnPO catalyst can improve the mass diffusion of substrates during the reaction and improve the exposure of active sites, which is favorable to improving its catalytic performance. As expected, the BET surface area of M-SnPO (323.3 m2/g) is larger than that of C-SnPO (21.0 m2/g) and SnO2 (28.0 m2/g). The SEM and TEM images of M-SnPO sample are depicted in Fig. 3 , and it can be found that the material is constituted of abundant small particles of 25–60 nm in diameter with irregular boundaries. The diameter of M-SnPO particles is smaller than that of C-SnPO particles and no obvious agglomeration of adjacent nanoparticles within M-SnPO is discovered compared to C-SnPO material (Figure S1), indicating the addition of CTAB during the synthesis process prevented the formation of large particles and agglomeration of adjacent nanoparticles. Moreover, the as-prepared M-SnPO material appears fluffy in appearance and abundant internal void space stemmed from the accumulation of nanoparticles is clearly observed in the SEM and TEM images (Fig. 3b and 3c), the results are consistent with the analysis of physisorption. In addition, the high-resolution TEM image of M-SnPO in Fig. 3d demonstrates that no lattice fringe is observed, which supports the amorphous nature of M-SnPO, also well agreeing with the results of XRD analysis. The NH3-TPD curves of SnO2, C-SnPO, and M-SnPO in Fig. 4 a show that a large desorption peak located in the range of 50 to 300 °C associating with weak acidity and a small desorption peak appeared in the range of 300–600 °C belonging to moderate acidity are observed for C-SnPO and M-SnPO, which is indicative of the presence of both weak and moderate acidic sites within the samples. In contrast, a small desorption peak occurred in the range of 50–300 °C and 300–600 °C is observed for SnO2, respectively, indicating the small amount of acid sites within SnO2. As expected, the largest amount of acidic sites among those as-prepared catalysts is observed for M-SnPO material (i.e., 2.29 mmol/g), resulting in M-SnPO material appearing as a promising acidic catalyst. The larger amount of acidic sites of M-SnPO material is mainly beneficial from its large pore-sized mesoporous structure along with large BET surface area, which permits M-SnPO material to afford more accessible active sites. Moreover, the identification of acidic properties for M-SnPO material was achieved by the pyridine-IR technique and the result is presented in Fig. 4b. The vibrations with strong intensity at 1455.7 and 1618.8 cm−1 assignable to Lewis acidity whilst the vibrations with low intensity at 1542.0 and 1637.5 cm−1 attributable to Brønsted acidity are clearly observed [56]. Furthermore, the vibration at 1490.8 cm−1 corresponding to the overlap of Brønsted and Lewis acidity is also appeared [57]. The above observations explicitly confirm the dual Lewis-Brønsted acidic nature of M-SnPO material, which contains a large amount of Lewis acidic sites along with a small amount of Brønsted acidic sites. Likewise, the C-SnPO catalyst also possessed dual Lewis-Brønsted acidic species, as evidenced by the pyridine-IR (Figure S2), in which the vibration at 1454.0 cm−1 is assigned to Lewis acid sites and the vibration at 1540.6 cm−1 belongs to Brønsted acid sites. 3.2 Cyclodehydration of citral to p-cymene over different catalysts Studies were commenced by scrutinizing the catalytic activity of as-prepared catalysts for the cyclodehydration of citral to p-cymene, attempting to identify an efficient catalyst that enables the fast synthesis of p-cymene from citral. Initial tests were performed under the conditions of 180 °C and 1 h in 10 mL of n-heptane using a catalyst loading of 0.01 g, and the results are compiled in Table 1 . Auto-cyclodehydration of citral in the absence of any catalyst almost afforded no p-cymene yield (entry 1, Table 1), underscoring the necessity of catalysts to facilitate the transformation. A low p-cymene yield of 2.0% with an inferior citral conversion of 37.6% was observed over SnO2 catalyst (entry 2, Table 1). It is speculated that the failure of the SnO2 catalyst is ascribed to the lack of Brønsted acidity. In contrast, the C-SnPO catalyst succeeded in facilitating the fast formation of p-cymene from citral under otherwise identical conditions due to its dual Lewis-Brønsted acidity (Figure S2), giving an appreciable p-cymene yield of 20.6% (entry 3, Table 1). The above results underscore the crucial role of dual Lewis-Brønsted acidity in the facile citral-to-p-cymene conversion. To our delight, M-SnPO catalyst exhibited a remarkable promotion for the fast synthesis of p-cymene from citral cyclodehydration. With the as-prepared M-SnPO catalyst, an as high as 72.7% yield of p-cymene at 99.7% citral conversion was achieved within only 1 h at 180 °C. The excellent catalytic performance of M-SnPO was ascribed to a coalescence of its dual Lewis-Brønsted acidity and the large pore-sized mesoporous structure of catalyst along with large BET surface area which contributed to providing more accessible active sites and improving mass diffusion. On the other hand, the large pore-sized mesopores within M-SnPO catalyst can allow intermediate molecules to accommodate inside the pores, which further contributes to the excellent catalytic activity of M-SnPO catalyst. Comparison experiments were also performed by subjecting the precursors (i.e., SnCl4•5H2O and H3PO4) of SnPO material to catalyze the cyclodehydration of citral under otherwise identical conditions. Both SnCl4•5H2O and H3PO4, however, were found to be not enough efficient for the synthesis of p-cymene from citral cyclodehydration, in spite of attaining high conversion of citral (entries 5 and 6, Table 1). The inferior catalytic behavior of SnCl4•5H2O and H3PO4 was attributed to the lack of Lewis acidity or enough Lewis acidic sites relative to M-SnPO catalyst, strongly underscoring the critical role of Lewis-Brønsted dual acidity for the cyclodehydration of citral to yield p-cymene. Noteworthy, piperitenol and p-menthatriene as intermediates with minor amounts and p-α-dimethylstyrene as a co-product with a yield of 1–11% were also detected throughout all the studies (Table 1 & Figure S3). Besides, those liquid chemicals in the reaction mixtures including target product, intermediates, and co-product were confirmed by GC–MS analysis as shown in Figure S4. Additionally, about 2∼4% yields of other unidentifiable by-products were observed during the reactions (Table 1). Clearly, evident carbon balance loss was observed in those reactions (Table 1), which was proposed to be a consequence of the formation of insoluble organic chemicals or carbon residue during the reactions. Building upon the above findings regarding the remarkable catalytic capability of M-SnPO catalyst for the fast cyclodehydration of citral into p-cymene, M-SnPO catalyst was thus chosen for optimizing various reaction parameters attempting to achieve the optimum yield of p-cymene. 3.3 Reaction conditions optimization Effects of reaction temperature, reaction time, catalyst dosage and reaction solvent on the synthesis of p-cymene from citral cyclodehydration over the M-SnPO catalyst were carefully scrutinized to determine the optimum reaction conditions. Firstly, the influences of reaction temperature and time on the catalytic performance of M-SnPO were investigated and the results are presented in Fig. 5 . It was found that complete conversion of citral were readily attained at reaction temperatures in the range of 140–200 °C with reaction times in the range of 0.5–3 h. Varying reaction temperatures was found to exert a profound effect on the yield of p-cymene, which was exemplified by the yield of p-cymene went up from 44.9% at 140 °C to 73.1% at 180 °C with a reaction time of 0.5 h (Fig. 5a & 5c). Whereas, the yield of p-cymene declined to 67.6% dramatically with the reaction temperature further rising to 200 °C (Fig. 5d), implying that higher temperature (i.e., 200 °C) went against the formation of p-cymene. An endeavor to enhance the yield of p-cymene by altering the reaction time at different reaction temperatures was proven to be unsuccessful (Fig. 5). In contrast, a slight decline was observed in p-cymene yield when the reaction time prolonged from 0.5 to 3.0 h in the range of 140–200 °C, suggesting that the M-SnPO catalyst succeeded in facilitating the fast synthesis of p-cymene from citral cyclodehydration and long reaction time played a negative role in stabilizing the yield of p-cymene. Actually, a relatively high p-cymene yield was obtained after 10 min in the temperature range of 140–200 °C (Table S1), implying that the reaction had already started in the heating process. Then, the yield of p-cymene slowly increased with prolonging reaction time from 10 min to 30 min at different reaction temperatures (Table S1). Particularly, the p-cymene yields after 20 min at 180 and 200 °C were very close to that obtained at 30 min, further demonstrating that the synthesis of p-cymene from citral cyclodehyration over M-SnPO catalyst was quite fast. In addition, reaction intermediates such as piperitenol and p-menthatriene were clearly detected as revealed by the GC–MS spectrum of the reaction mixture obtained at 140 °C (Figure S4). Especially, a minor amount (∼1.0% yield) of piperitenol in the reaction mixture was detected throughout the investigations, while considerable (7.0–20.0% yield) or trace amount (∼1.0% yield) of p-menthatriene was generated at low (e.g., 140 and 160 °C) or high (e.g., 180 & 200 °C) reaction temperatures, respectively. Besides, the amount of p-menthatriene in reaction mixtures decreased with the extension of reaction time, which could account for the p-menthatriene as an intermediate for p-cymene synthesis. Additionally, the formation of p-α-dimethylstyrene, as a co-product in the reaction, seemed to be insensitive to the reaction temperature, with yields varying in the range of 4.1–10.8% (Fig. 5). Hence, in terms of p-cymene yield, 180 °C and 0.5 h were screened to be optimum reaction temperature and time in the established catalytic system, respectively. Spurred by the above observations, the effect of M-SnPO catalyst dosage on the cyclodehydration of citral was studied to improve the p-cymene yield. The results in Fig. 6 a exhibited the yield of p-cymene presented an uptrend with the increment of catalyst dosage. The yield of p-cymene was only 35.2% with 0.005 g of M-SnPO catalyst, and enhanced sharply to 73.1% as the M-SnPO catalyst increased to 0.01 g, then escalated up to 78.5% gradually for 0.02 g of M-SnPO catalyst. The positive effect of M-SnPO catalyst dosage on the promotion of fast citral cyclodehydration was mainly beneficial from more exposed active sites together with higher exposure rates between active sites and substrate during the reaction originated from more amount of catalyst. Further increment of catalyst loading to 0.03 g, the promotion in raising p-cymene yield proved ineffective. In contrast, too much amount (i.e., 0.03 g) of M-SnPO catalyst was found deleterious for the formation of p-cymene with resulting in a slight drop in the p-cymene yield (Fig. 6a), which was probably caused by the excess catalyst incurring more side reactions during the reaction or strong catalyst adsorption effect towards organic chemicals. Nevertheless, the generation of p-α-dimethylstyrene was independent of catalyst loadings, with 3.5 to 7.1% yields in the reaction mixtures were observed. With an attempt to further improve the p-cymene yield, replacement of heptane with other organic solvents such as toluene, acetonitrile, 1,4-dioxane, and ethyl acetate for the cyclodehydration of citral into p-cymene over M-SnPO were investigated under otherwise identical conditions. As depicted in Fig. 6b, high p-cymene yields (78.5% & 77.0%) were achieved in the solvents with low polarity (e.g., heptane and toluene), whereas moderate p-cymene yield (55.6%) corresponded to the solvent with moderate polarity (e.g., ethyl acetate) and low p-cymene yields (8.0% & 11.1%) were obtained in the solvents with high polarity (e.g., acetonitrile and 1,4-dioxane), firmly demonstrating that the solvent with high polarity was adverse to the synthesis of p-cymene from citral cyclodehydration. Those results in Fig. 6b pointed to a prominent influence of solvent on the p-cymene synthesis and decisively proved n-heptane as a promising solvent for the cyclodehydration of citral. 3.4 Reusability and stability of the catalyst Except for catalytic activity, for heterogeneous catalysts, reusability and stability are critical parameters for their prospective uses in industrial applications. The catalytic performance of M-SnPO for p-cymene synthesis in five consecutive runs under the optimum reaction conditions was herein surveyed in detail. Prior to re-use experiments, the spent M-SnPO catalyst was regenerated by calcination at 550 °C for subsequent each run, because of severe deactivation occurring if without heat treatment which resulted from the deposition of insoluble organic chemicals or carbon residue within the spent catalyst. The results in Fig. 7 a exhibited that the p-cymene yield decreased gradually in the five consecutive runs, but still preserved about 77.7% of its pristine catalytic performance at the fifth run in terms of p-cymene yield (61.0% yield), unequivocally demonstrating that M-SnPO catalyst was capable of re-utilizing and afforded acceptance catalytic performance in reuse experiments. Also, the above findings synchronously pointed out that the regeneration of the spent M-SnPO catalyst by calcination could not completely recover its pristine performance. In addition, both the concentrations of Sn and P species in the filtrate (after removal of the catalyst via filtration) were lower than 2 ppm as determined by ICP-OES analysis, clearly demonstrating that the leaching of active sites was negligible during the reaction. Thereupon regenerated catalyst was characterized by XRD, physisorptions, SEM, and NH3-TPD to determine the reason for slight deactivation. No crystallographic change is intuitively discovered by XRD analysis for regenerated catalyst compared to fresh one as described in Fig. 7b. Moreover, both micropores and mesopores were well-remained in the regenerated catalyst as revealed from the regenerated catalyst presenting the same type-IV isotherm and type-H4 hysteresis loop as fresh one (Fig. 7c). However, the BET surface area of the regenerated M-SnPO catalyst decreased by ∼29% (to 228.9 m2/g). The deposition of insoluble organic chemicals or carbon residue on the surface of regenerated catalyst resulting in the decreased surface area could be excluded due to the regenerated catalyst calcination at 550 °C in air, and thereby the declined BET surface area is possible ascribed to the aggregation of catalyst particles. Besides, the aggregation of particles within regenerated M-SnPO catalyst was further intuitively corroborated by SEM analysis (Figure S5), strongly confirming the declined surface area resulted from particle aggregation. Concomitantly, the acid amount of regenerated M-SnPO catalyst was dropped (to 1.93 mmol/g) in comparison with fresh catalyst (2.29 mmol/g) (Fig. 7d), which was caused by the decreased surface area. Retrospectively, the characterization studies clearly point out that the partial deactivation of regenerated catalyst originates from reduced accessibility of active sites owing to the decrease of surface area. In any case, the reusability investigations along with inspections of regenerated catalyst strongly demonstrate that the M-SnPO catalyst can be reutilized, and hence can serve as a potential candidate for the facile cyclodehydration of citral to p-cymene in industrial applications. 3.5 Plausible reaction pathway Previously studies gave some descriptions for the possible reaction pathway of the acid-catalyzed cyclodehydration of citral into p-cymene [34-37]. It is hypothesized that the pathway of citral-to-p-cymene conversion catalyzed by Lewis-Brønsted dual acidic M-SnPO is analogous to that proposed for reported homogeneous acid catalysts. Based upon the above catalytic test along with knowledge from the literature [34-37, 38-40], a plausible reaction pathway for the cyclodehydration of citral into p-cymene over Lewis-Brønsted dual acidic M-SnPO was proposed as illustrated in Scheme 3 . The reaction was initiated by the cyclization of citral over Lewis acidic sites to give piperitenol. The resulting piperitenol then underwent the dehydration in the presence of Brønsted acidic sites to afford p-menthatriene, which in turn underwent the isomerization promoted by Lewis acidic sites to yield p-cymene. In addition, the yield of p-menthatriene in reaction mixtures decreased with the extension of reaction time as shown in Fig. 5, substantiating the p-menthatriene to be an intermediate for the p-cymene synthesis, thus reinforcing the proposed tandem reaction pathway. Concurrently, the formed piperitenol originated from citral cyclodehydration could undergo hydration (water stemmed from the above-mentioned dehydration) to generate compound I (marked in Scheme 3) followed by the dehydration to produce compound II (marked in Scheme 3). Subsequently, the generated compound II went through allylic oxidation and/or disproportionation to furnish compound III (marked in Scheme 3), and then to p-α-dimethylstyrene through successive dehydration. Of note is that the reaction pathway involving hydration-dehydration-allylic oxidation/disproportionation for piperitenol was not dominant due to only a trace amount of water in the reaction mixture. Coincidently, minor yields of p-α-dimethylstyrene were always detected throughout the investigations, which corresponded well to the proposed inference, further confirming the proposed plausible reaction pathway. Particularly, compared with previous efforts depending on the usage of homogeneous acid catalysts (e.g., hydrochloric acid and p-toluenesulfonic acid monohydrate) for the cyclodehydration of citral into p-cymene, the performance of M-SnPO catalyst with Lewis-Brønsted dual acidity described herein surpasses previously reported results, or at least is comparable to that of benchmark homogeneous acid catalyst (pH=1.8) (Table 2 ). Moreover, M-SnPO catalyst provided the highest TOF value for the p-cymene synthesis from citral cyclodehydration, clearly demonstrating its superiority in catalytic performance. Furthermore, the M-SnPO catalyst developed herein however featured easy-handling and non-corrosive properties with ready recyclability and reusability, highlighting the superiority of the established catalytic system and exhibiting great potential for large-scale applications. To the best of our knowledge, the work presented herein is the first reported example of the cyclodehydration of citral into p-cymene with heterogeneous Lewis-Brønsted dual acidic catalyst and concurrently shows the best performance ever reported catalysts for citral-to-p-cymene transformation. 4 Conclusions In summary, a highly effective strategy for the tandem synthesis of p-cymene from biomass-derived citral through sequential cyclization, dehydration, and isomerization was successfully realized by large pore-sized mesoporous tin phosphate catalyst with Lewis-Brønsted dual acidity. Up to 78.5% yield of p-cymene was attained in heptane over M-SnPO catalyst at 180 °C with only 0.5 h, superior to the results reported for homogeneous acid catalysts (e.g., HCl). Characterization results in conjunction with analytic data finely demonstrated that the excellent catalytic performance of M-SnPO mainly stemmed from the synergistic effect of Lewis and Brønsted acidic sites as well as facile active-site accessibility and improved mass diffusion due to its large surface area and large pore-sized mesoporous structure. In addition, M-SnPO catalyst could be reused multiple cycles and preserved about 78% of the original catalytic activity of the fresh catalyst. Slight deactivation of catalyst was mainly associated with the aggregation of particles within used M-SnPO catalyst, resulting in reduced surface area and acid amount. Furthermore, a plausible reaction pathway for the cyclodehydration of citral into p-cymene over M-SnPO was proposed, and the as-prepared M-SnPO catalyst could serve as an attractive catalyst candidate for the practical synthesis of p-cymene from bio-based citral. The methodology described in this work offers a fast and sustainable route for the production of p-cymene, and also provides important clues for the sustainable synthesis of aromatic compounds from biomass. CRediT authorship contribution statement Jian He: Investigation, Methodology, Formal analysis, Writing – original draft. Zhaozhuo Yu: Visualization, Validation. Hongguo Wu: Validation. Hu Li: Conceptualization, Funding acquisition, Writing – review & editing. Song Yang: Supervision, Funding acquisition, Resources. Declaration of Competing Interest The authors declare that they have no known competing financial interests or personal relationships that could have appeared to influence the work reported in this paper. Acknowledgments Financial supports from the National Natural Science Foundation of China (21908033, 21576059, 21666008), Fok Ying-Tong Education Foundation (161030), Outstanding Youth Project of Hunan Provincial Education Department (19B470), Hunan Provincial Natural Science Foundation of China (No. 2021JJ40436), Program of Introducing Talents of Discipline to Universities of China (111 Program, D20023), and Guizhou Frontiers Science Center for Asymmetric Synthesis and Medicinal Molecules ([2020]004) are gratefully acknowledged. Supplementary materials Supplementary material associated with this article can be found, in the online version, at doi:10.1016/j.mcat.2021.111887. Appendix Supplementary materials Image, application 1 References [1] T. Dai C. Li L. Li Z.K. Zhao B. Zhang Y. Cong A. Wang Selective production of renewable para-xylene by tungsten carbide catalyzed atom-economic cascade reactions Angew. Chem. Int. Ed. 57 2018 1808 1812 T. Dai, C. Li, L. Li, Z.K. Zhao, B. Zhang, Y. Cong, A. Wang, Selective production of renewable para-xylene by tungsten carbide catalyzed atom-economic cascade reactions. Angew. Chem. Int. Ed.57 (2018) 1808–1812. [2] X. Shi X. Ye H. Zhong T. Wang F. Jin Sustainable nitrogen-containing chemicals and materials from natural marine resources chitin and microalgae Mol. Catal. 505 2021 111517 X. Shi, X. Ye, H. Zhong, T. Wang, F. Jin, Sustainable nitrogen-containing chemicals and materials from natural marine resources chitin and microalgae. Mol. Catal.505 (2021) 111517. [3] I. Scodeller K.D.O. Vigier E. Muller C. Ma F. Guégan R. Wischert F. Jérôme A combined experimental-theoretical study on Diels-Alder reaction with bio-based furfural: towards renewable aromatics ChemSusChem 14 2021 313 323 I. Scodeller, K.D.O. Vigier, E. Muller, C. Ma, F. Guégan, R. Wischert, F. Jérôme, A combined experimental-theoretical study on Diels-Alder reaction with bio-based furfural: towards renewable aromatics. ChemSusChem 14 (2021) 313–323. [4] K. Yan H. Li State of the art and perspectives in catalytic conversion mechanism of biomass to bio-aromatics Energy Fuels 35 2021 45 62 K. Yan, H. Li, State of the art and perspectives in catalytic conversion mechanism of biomass to bio-aromatics. Energy Fuels35 (2021) 45–62. [5] J. Deischter K. Schute D.S. Neves B.E. Ebert L.M. Blank R. Palkovits Aromatisation of bio-derivable isobutyraldehyde over HZSM-5 zeolite catalysts Green Chem 21 2019 1710 1717 J. Deischter, K. Schute, D.S. Neves, B.E. Ebert, L.M. Blank, R. Palkovits, Aromatisation of bio-derivable isobutyraldehyde over HZSM-5 zeolite catalysts. Green Chem. 21 (2019) 1710–1717. [6] T. Salavati-fard E.S. Vasiliadou G.R. Jenness R.F. Lobo S. Caratzoulas D.J. Doren Lewis acid site and hydrogen-bond-mediated polarization synergy in the catalysis of Diels-Alder cycloaddition by band-gap transition metal oxides ACS Catal 9 2019 701 715 T. Salavati-fard, E.S. Vasiliadou, G.R. Jenness, R.F. Lobo, S. Caratzoulas, D.J. Doren, Lewis acid site and hydrogen-bond-mediated polarization synergy in the catalysis of Diels-Alder cycloaddition by band-gap transition metal oxides. ACS Catal. 9 (2019) 701–715. [7] J. Yeh S.S. Chen S. Li C.H. Chen T. Shishido D.C.W. Tsang Y. Yamauch Y. Li K.C.W. Wu Diels-Alder conversion of acrylic acid and 2,5-dimethylfuran to para-xylene over heterogeneous Bi-BTC metal-organic framework (MOF) catalysts under mild conditions Angew. Chem. Int. Ed. 133 2021 634 639 J. Yeh, S.S. Chen, S. Li, C.H. Chen, T. Shishido, D.C.W. Tsang, Y. Yamauch, Y. Li, K.C.W. Wu, Diels-Alder conversion of acrylic acid and 2,5-dimethylfuran to para-xylene over heterogeneous Bi-BTC metal-organic framework (MOF) catalysts under mild conditions. Angew. Chem. Int. Ed.133 (2021) 634–639. [8] N.S. Bhat S.S. Mal S. Dutta Recent advances in the preparation of levulinic esters from biomass-derived furanic and levulinic chemical platforms using heteropoly acid (HPA) catalysts Mol. Catal. 505 2021 111484 N.S. Bhat, S.S. Mal, S. Dutta, Recent advances in the preparation of levulinic esters from biomass-derived furanic and levulinic chemical platforms using heteropoly acid (HPA) catalysts. Mol. Catal.505 (2021) 111484. [9] J. He L. Chen S. Liu K. Song S. Yang A. Riisager Sustainable access to renewable N-containing chemicals from reductive amination of biomass-derived platform compounds Green Chem 22 2020 6714 6747 J. He, L. Chen, S. Liu, K. Song, S. Yang, A. Riisager, Sustainable access to renewable N-containing chemicals from reductive amination of biomass-derived platform compounds. Green Chem. 22 (2020) 6714–6747. [10] V.C. Margarit E.M. Gallego C. Paris M. Boronat M. Moliner A. Corma Production of aromatics from biomass by computer-aided selection of the zeolite catalyst Green Chem 22 2020 5123 5131 V.C. Margarit, E.M. Gallego, C. Paris, M. Boronat, M. Moliner, A. Corma, Production of aromatics from biomass by computer-aided selection of the zeolite catalyst. Green Chem. 22 (2020) 5123–5131. [11] L. He L. Liu Y. Huang X. Miao C. Len Y. Wang W. Yang One-pot synthesis of dimethyl succinate from d-fructose using Amberlyst-70 catalyst Mol. Catal. 508 2021 111584 L. He, L. Liu, Y. Huang, X. Miao, C. Len, Y. Wang, W. Yang, One-pot synthesis of dimethyl succinate from d-fructose using Amberlyst-70 catalyst. Mol. Catal.508 (2021) 111584. [12] X. Ouyang X. Huang J. Zhu M.D. Boot E.J.M. Hensen Catalytic conversion of lignin in woody biomass into phenolic monomers in methanol/water mixtures without external hydrogen ACS Sustain. Chem. Eng. 7 2019 13764 13773 X. Ouyang, X. Huang, J. Zhu, M.D. Boot, E.J.M. Hensen, Catalytic conversion of lignin in woody biomass into phenolic monomers in methanol/water mixtures without external hydrogen. ACS Sustain. Chem. Eng.7 (2019) 13764–13773. [13] Y. Liao R. Zhong M. d'Halluin D. Verboekend B.F. Sels Aromatics production from lignocellulosic biomass: shape selective dealkylation of lignin-derived phenolics over hierarchical ZSM5 ACS Sustain. Chem. Eng. 8 2020 8713 8722 Y. Liao, R. Zhong, M. d'Halluin, D. Verboekend, B.F. Sels, Aromatics production from lignocellulosic biomass: shape selective dealkylation of lignin-derived phenolics over hierarchical ZSM5. ACS Sustain. Chem. Eng.8 (2020) 8713–8722. [14] T.R. Carlson J. Jae Y. Lin G.A. Tompsett G.W. Huber Catalytic fast pyrolysis of glucose with HZSM-5: the combined homogeneous and heterogeneous reactions J. Catal. 270 2010 110 124 T.R. Carlson, J. Jae, Y. Lin, G.A. Tompsett, G.W. Huber, Catalytic fast pyrolysis of glucose with HZSM-5: the combined homogeneous and heterogeneous reactions. J. Catal.270 (2010) 110–124. [15] A.J. Foster J. Jae Y. Cheng G.W. Huber R.F. Lobo Optimizing the aromatic yield and distribution from catalytic fast pyrolysis of biomass over ZSM-5 Appl. Catal. A: Gen. 423-424 2012 154 161 A.J. Foster, J. Jae, Y. Cheng, G.W. Huber, R.F. Lobo, Optimizing the aromatic yield and distribution from catalytic fast pyrolysis of biomass over ZSM-5. Appl. Catal. A: Gen.423-424 (2012) 154–161. [16] A. Kostyniuk M. Grilc B. Likozar Catalytic cracking of biomass-derived hydrocarbon tars or model compounds to form biobased benzene, toluene, and xylene isomer mixtures Ind. Eng. Chem. Res. 58 2019 7690 7705 A. Kostyniuk, M. Grilc, B. Likozar, Catalytic cracking of biomass-derived hydrocarbon tars or model compounds to form biobased benzene, toluene, and xylene isomer mixtures. Ind. Eng. Chem. Res.58 (2019) 7690–7705. [17] L. Ye Q. Song B.T.W. Lo J. Zheng D. Kong C.A. Murray C.C. Tang S.C.E. Tsang A new route for de-carboxylation of lactones over Zn/ZSM-5: elucidation of structure and molecular interactions Angew. Chem. Int. Ed. 56 2017 10711 10716 L. Ye, Q. Song, B.T.W. Lo, J. Zheng, D. Kong, C.A. Murray, C.C. Tang, S.C.E. Tsang, A new route for de-carboxylation of lactones over Zn/ZSM-5: elucidation of structure and molecular interactions. Angew. Chem. Int. Ed.56 (2017) 10711–10716. [18] J.J. Pacheco M.E. Davis Synthesis of terephthalic acid via Diels-Alder reactions with ethylene and oxidized variants of 5-hydroxymethylfurfural Proc. Natl. Acad. Sci. 111 2014 8363 8367 J.J. Pacheco, M.E. Davis, Synthesis of terephthalic acid via Diels-Alder reactions with ethylene and oxidized variants of 5-hydroxymethylfurfural. Proc. Natl. Acad. Sci.111 (2014) 8363–8367. [19] J.A.M. Mesa F. Brandi I. Shekova M. Antonietti M. Al-Naji p-Xylene from 2,5-dimethylfuran and acrylic acid using zeolite in continuous flow system Green Chem 22 2020 7398 7405 J.A.M. Mesa, F. Brandi, I. Shekova, M. Antonietti, M. Al-Naji, p-Xylene from 2,5-dimethylfuran and acrylic acid using zeolite in continuous flow system. Green Chem. 22 (2020) 7398–7405. [20] W. Jia Y. Sun M. Zuo Y. Feng X. Tang X. Zeng L. Lin One pot synthesis of renewable phthalic anhydride from 5-hydroxymethfurfural using MoO3/Cu(NO3)2 as catalyst ChemSusChem 13 2020 640 646 W. Jia, Y. Sun, M. Zuo, Y. Feng, X. Tang, X. Zeng, L. Lin, One pot synthesis of renewable phthalic anhydride from 5-hydroxymethfurfural using MoO3/Cu(NO3)2 as catalyst. ChemSusChem 13 (2020) 640–646. [21] K. Matuszek A. Chrobok P. Latos M. Markiton K. Szymańska A. Jarzębski M. Swadźba-Kwaśny Silica-supported chlorometallate(III) ionic liquids as recyclable catalysts for Diels-Alder reaction under solventless conditions Catal. Sci. Technol. 6 2016 8129 8137 K. Matuszek, A. Chrobok, P. Latos, M. Markiton, K. Szymańska, A. Jarzębski, M. Swadźba-Kwaśny, Silica-supported chlorometallate(III) ionic liquids as recyclable catalysts for Diels-Alder reaction under solventless conditions. Catal. Sci. Technol.6 (2016) 8129–8137. [22] X. Luo R. Lu H. Jiang X. Si J. Xu F. Lu Catalytic conversion of sugar-derived polyhydroxy acid to trimellitate Ind. Eng. Chem. Res. 60 2021 4510 4515 X. Luo, R. Lu, H. Jiang, X. Si, J. Xu, F. Lu, Catalytic conversion of sugar-derived polyhydroxy acid to trimellitate. Ind. Eng. Chem. Res.60 (2021) 4510–4515. [23] H.C. Genuino I. Muizebelt A. Heeres N.J. Schenk J.G.M. Winkelman H.J. Heeres An improved catalytic pyrolysis concept for renewable aromatics from biomass involving a recycling strategy for co-produced polycyclic aromatic hydrocarbons Green Chem 21 2019 3802 3806 H.C. Genuino, I. Muizebelt, A. Heeres, N.J. Schenk, J.G.M. Winkelman, H.J. Heeres, An improved catalytic pyrolysis concept for renewable aromatics from biomass involving a recycling strategy for co-produced polycyclic aromatic hydrocarbons. Green Chem. 21 (2019) 3802–3806. [24] A. Corma S. Iborra A. Velty Chemical routes for the transformation of biomass into chemicals Chem. Rev. 107 2007 2411 2502 A. Corma, S. Iborra, A. Velty, Chemical routes for the transformation of biomass into chemicals. Chem. Rev.107 (2007) 2411–2502. [25] L. Wu T. Moteki A.A. Gokhale D.W. Flaherty F.D. Toste Production of fuels and chemicals from biomass: condensation reactions and beyond Chem 1 2016 32 58 L. Wu, T. Moteki, A.A. Gokhale, D.W. Flaherty, F.D. Toste, Production of fuels and chemicals from biomass: condensation reactions and beyond. Chem1 (2016) 32–58. [26] C. Bruneau C. Fischmeister D. Mandelli W.A. Carvalho E.N. dos Santos P.H. Dixneuf L.S. Fernandes Transformations of terpenes and terpenoids via carbon-carbon double bond metathesis Catal. Sci. Technol. 8 2018 3989 4004 C. Bruneau, C. Fischmeister, D. Mandelli, W.A. Carvalho, E.N. dos Santos, P.H. Dixneuf, L.S. Fernandes, Transformations of terpenes and terpenoids via carbon-carbon double bond metathesis. Catal. Sci. Technol.8 (2018) 3989–4004. [27] A.J. Day J.H.Z. Lee Q.D. Phan H.C. Lam A. Ametovski C.J. Sumby S.G. Bell J.H. George Biomimetic and biocatalytic synthesis of bruceol Angew. Chem. Int. Ed. 131 2019 1441 1445 A.J. Day, J.H.Z. Lee, Q.D. Phan, H.C. Lam, A. Ametovski, C.J. Sumby, S.G. Bell, J.H. George, Biomimetic and biocatalytic synthesis of bruceol. Angew. Chem. Int. Ed.131 (2019) 1441–1445. [28] X. Di G. Lafaye C. Especel F. Epron J. Qi C. Li C. Liang Supported Co-Re bimetallic catalysts with different structures as efficient catalysts for hydrogenation of citral ChemSusChem 12 2019 807 823 X. Di, G. Lafaye, C. Especel, F. Epron, J. Qi, C. Li, C. Liang, Supported Co-Re bimetallic catalysts with different structures as efficient catalysts for hydrogenation of citral. ChemSusChem 12 (2019) 807–823. [29] F. Zhou H. Liu Z. Wen B. Zhang G. Chen Toward the efficient synthesis of pseudoionone from citral in a continuous-flow microreactor Ind. Eng. Chem. Res. 57 2018 11288 11298 F. Zhou, H. Liu, Z. Wen, B. Zhang, G. Chen, Toward the efficient synthesis of pseudoionone from citral in a continuous-flow microreactor. Ind. Eng. Chem. Res.57 (2018) 11288–11298. [30] A.O. Dias M.G.P. Gutiérrez J.A.A. Villarreal R.L.L. Carmo K.C.B. Oliveira A.G. Santos E.N. dos Santos E.V. Gusevskaya Sustainable route to biomass-based amines: rhodium catalyzed hydroaminomethylation in green solvents Appl. Catal. A, Gen. 574 2019 97 104 A.O. Dias, M.G.P. Gutiérrez, J.A.A. Villarreal, R.L.L. Carmo, K.C.B. Oliveira, A.G. Santos, E.N. dos Santos, E.V. Gusevskaya, Sustainable route to biomass-based amines: rhodium catalyzed hydroaminomethylation in green solvents. Appl. Catal. A, Gen.574 (2019) 97–104. [31] M. Volanti D. Cespi F. Passarini E. Neri F. Cavani P. Mizsey D. Fozer Terephthalic acid from renewable sources: early-stage sustainability analysis of a bio-PET precursor Green Chem 21 2019 885 896 M. Volanti, D. Cespi, F. Passarini, E. Neri, F. Cavani, P. Mizsey, D. Fozer, Terephthalic acid from renewable sources: early-stage sustainability analysis of a bio-PET precursor. Green Chem. 21 (2019) 885–896. [32] M. Trandafir S. Neațu A. Bocîrnea J. Counsell F. Cavani M. Florea F. Neațu The role of acidity in terephthalic acid synthesis from renewable carbon source ChemCatChem 12 2020 6248 6258 M. Trandafir, S. Neațu, A. Bocîrnea, J. Counsell, F. Cavani, M. Florea, F. Neațu, The role of acidity in terephthalic acid synthesis from renewable carbon source. ChemCatChem 12 (2020) 6248–6258. [33] J.D. Tibbetts S.D. Bull Dimethyl sulfide facilitates acid catalysed ring opening of the bicyclic monoterpenes in crude sulfate turpentine to afford p-menthadienes in good yield Green Chem 23 2021 597 610 J.D. Tibbetts, S.D. Bull, Dimethyl sulfide facilitates acid catalysed ring opening of the bicyclic monoterpenes in crude sulfate turpentine to afford p-menthadienes in good yield. Green Chem. 23 (2021) 597–610. [34] D.A. Baines R.A. Jones T.C. Webb I.H. Campion-Smith The chemistry of terpenes-I: the effect of hydrogen ion concentration and oxygen upon the acid catalysed cyclization of citral Tetrahedron 26 1970 4901 4913 D.A. Baines, R.A. Jones, T.C. Webb, I.H. Campion-Smith, The chemistry of terpenes-I: the effect of hydrogen ion concentration and oxygen upon the acid catalysed cyclization of citral. Tetrahedron 26 (1970) 4901–4913. [35] B.C. Clark Jr. C.C. Powell T. Radford The acid catalyzed cyclization of citral Tetrahedron 33 1977 2187 2191 B.C. Clark Jr., C.C. Powell, T. Radford, The acid catalyzed cyclization of citral. Tetrahedron 33 (1977) 2187–2191. [36] D.H.R. Barton S.I. Parekh A short and efficient method for the preparation of α, p-dimethylstyrene from citral (1) Synthetic Commun 19 1989 3353 3361 D.H.R. Barton, S.I. Parekh, A short and efficient method for the preparation of α, p-dimethylstyrene from citral (1). Synthetic Commun. 19 (1989) 3353–3361. [37] X. Quek Y. Guan R.A. van Santen E.J.M. Hensen Ionic-liquid-stabilized rhodium nanoparticles for citral cyclodehydration ChemSusChem 3 2010 1264 1267 X. Quek, Y. Guan, R.A. van Santen, E.J.M. Hensen, Ionic-liquid-stabilized rhodium nanoparticles for citral cyclodehydration. ChemSusChem 3 (2010) 1264–1267. [38] A. Corma M. Renz Sn-Beta zeolite as diastereoselective water-resistant heterogeneous Lewis-acid catalyst for carbon-carbon bond formation in the intramolecular carbonyl-ene reaction Chem. Commun. 2004 550 551 A. Corma, M. Renz, Sn-Beta zeolite as diastereoselective water-resistant heterogeneous Lewis-acid catalyst for carbon-carbon bond formation in the intramolecular carbonyl-ene reaction. Chem. Commun. (2004) 550–551. [39] Y. Zhu Y. Nie S. Jaenicke G. Chuah Cyclisation of citronellal over zirconium zeolite beta–a highly diastereoselective catalyst to (±)-isopulegol J. Catal. 229 2005 404 413 Y. Zhu, Y. Nie, S. Jaenicke, G. Chuah, Cyclisation of citronellal over zirconium zeolite beta–a highly diastereoselective catalyst to (±)-isopulegol. J. Catal.229 (2005) 404–413. [40] N.D. Shcherban R.Y. Barakov P. Mäki-Arvela S.A. Sergiienko I. Bezverkhyy K. Eränen D.Y. Murzin Isomerization of α-pinene oxide over ZSM-5 based micro-mesoporous materials Appl. Catal. A, Gen. 560 2018 236 247 N.D. Shcherban, R.Y. Barakov, P. Mäki-Arvela, S.A. Sergiienko, I. Bezverkhyy, K. Eränen, D.Y. Murzin, Isomerization of α-pinene oxide over ZSM-5 based micro-mesoporous materials. Appl. Catal. A, Gen.560 (2018) 236–247. [41] H. Li J. He A. Riisager S. Saravanamurugan B. Song S. Yang Acid-base bifunctional zirconium Nalkyltriphosphate nanohybrid for hydrogen transfer of biomass-derived carboxides ACS Catal 6 2016 7722 7727 H. Li, J. He, A. Riisager, S. Saravanamurugan, B. Song, S. Yang, Acid-base bifunctional zirconium Nalkyltriphosphate nanohybrid for hydrogen transfer of biomass-derived carboxides. ACS Catal. 6 (2016) 7722–7727. [42] F. Li L.J. France Z. Cai Y. Li S. Liu H. Lou J. Long X. Li Catalytic transfer hydrogenation of butyl levulinate to γ-valerolactone over zirconium phosphates with adjustable Lewis and Brønsted acid sites Appl. Catal. B: Environ. 214 2017 67 77 F. Li, L.J. France, Z. Cai, Y. Li, S. Liu, H. Lou, J. Long, X. Li, Catalytic transfer hydrogenation of butyl levulinate to γ-valerolactone over zirconium phosphates with adjustable Lewis and Brønsted acid sites. Appl. Catal. B: Environ.214 (2017) 67–77. [43] V.V. Ordomsky V.L. Sushkevich J.C. Schouten J. van der Schaaf T.A. Nijhuis Glucose dehydration to 5-hydroxymethylfurfural over phosphate catalysts J. Catal. 300 2013 37 46 V.V. Ordomsky, V.L. Sushkevich, J.C. Schouten, J. van der Schaaf, T.A. Nijhuis, Glucose dehydration to 5-hydroxymethylfurfural over phosphate catalysts. J. Catal.300 (2013) 37–46. [44] Q. Hou M. Zhen L. Liu Y. Chen F. Huang S. Zhang W. Li M. Ju Tin phosphate as a heterogeneous catalyst for efficient dehydration of glucose into 5-hydroxymethylfurfural in ionic liquid Appl. Catal. B: Environ. 224 2018 183 193 Q. Hou, M. Zhen, L. Liu, Y. Chen, F. Huang, S. Zhang, W. Li, M. Ju, Tin phosphate as a heterogeneous catalyst for efficient dehydration of glucose into 5-hydroxymethylfurfural in ionic liquid. Appl. Catal. B: Environ.224 (2018) 183–193. [45] A. Dutta D. Gupta A.K. Patra B. Saha A. Bhaumik Synthesis of 5-hydroxymethylfurural from carbohydrates using large-pore mesoporous tin phosphate ChemSusChem 7 2014 925 933 A. Dutta, D. Gupta, A.K. Patra, B. Saha, A. Bhaumik, Synthesis of 5-hydroxymethylfurural from carbohydrates using large-pore mesoporous tin phosphate. ChemSusChem 7 (2014) 925–933. [46] J. He M.R. Nielsen T.W. Nielsen S. Yang A. Riisager Hierarchically constructed NiO with improved performance for catalytic transfer hydrogenation of biomass-derived aldehydes Catal. Sci. Technol. 9 2019 1289 1300 J. He, M.R. Nielsen, T.W. Nielsen, S. Yang, A. Riisager, Hierarchically constructed NiO with improved performance for catalytic transfer hydrogenation of biomass-derived aldehydes. Catal. Sci. Technol.9 (2019) 1289–1300. [47] M.A. Isaacs N. Robinson B. Barbero L.J. Durndell J.C. Manayil C.M.A. Parlett C. D'Agostino K. Wilson A.F. Lee Unravelling mass transport in hierarchically porous catalysts J. Mater. Chem. A 7 2019 11814 11825 M.A. Isaacs, N. Robinson, B. Barbero, L.J. Durndell, J.C. Manayil, C.M.A. Parlett, C. D'Agostino, K. Wilson, A.F. Lee, Unravelling mass transport in hierarchically porous catalysts. J. Mater. Chem. A7 (2019) 11814–11825. [48] Q. He W. Zeng Y. Wang B. Miao H. Long Z. Miao Z. Zhang Y. Wang Large scale synthesis of flower-like SnO2 nanostructures via a facile hydrothermal route Mater. Lett. 113 2013 42 45 Q. He, W. Zeng, Y. Wang, B. Miao, H. Long, Z. Miao, Z. Zhang, Y. Wang, Large scale synthesis of flower-like SnO2 nanostructures via a facile hydrothermal route. Mater. Lett.113 (2013) 42–45. [49] V. Rajendran J. Gajendiran Study of blueshift of optical band gap in stannic oxide nanosheets by an uncharged surfactant mediated alcohothermal process Mater. Sci. Semicon. Proc. 34 2015 246 249 V. Rajendran, J. Gajendiran, Study of blueshift of optical band gap in stannic oxide nanosheets by an uncharged surfactant mediated alcohothermal process. Mater. Sci. Semicon. Proc.34 (2015) 246–249. [50] H. Yuan N. Zhang L. Tian L. Xu Q. Shao S.D.A. Zaidi J. Xiao J. Chen Incorporation of layered tin (IV) phosphate in graphene framework for high performance lithium-sulfur batteries J. Energy Chem. 53 2021 99 108 H. Yuan, N. Zhang, L. Tian, L. Xu, Q. Shao, S.D.A. Zaidi, J. Xiao, J. Chen, Incorporation of layered tin (IV) phosphate in graphene framework for high performance lithium-sulfur batteries. J. Energy Chem.53 (2021) 99–108. [51] L. Szirtes Z. Révai J. Megyeri E. Kuzmann Investigations of tin (II/IV) phosphates prepared by various methods, Mössbauer study and X-ray diffraction characterization Radiat. Phys. Chem. 78 2009 239 243 L. Szirtes, Z. Révai, J. Megyeri, E. Kuzmann, Investigations of tin (II/IV) phosphates prepared by various methods, Mössbauer study and X-ray diffraction characterization. Radiat. Phys. Chem.78 (2009) 239–243. [52] Y. Jin G. Xiao Y. Xiao F. Sun D. Zhang Y. Zhang J. Li J. Hong Products selectivity and reaction stability of cobalt-based Fischer-Tropsch catalysts affected by glow discharge plasma treatment and silica structure Catal. Today 337 2019 139 146 Y. Jin, G. Xiao, Y. Xiao, F. Sun, D. Zhang, Y. Zhang, J. Li, J. Hong, Products selectivity and reaction stability of cobalt-based Fischer-Tropsch catalysts affected by glow discharge plasma treatment and silica structure. Catal. Today337 (2019) 139–146. [53] T. Liu C. Jiang B. Cheng W. You J. Yu Hierarchical flower-like C/NiO composite hollow microspheres and its excellent supercapacitor performance J. Power Sources 359 2017 371 378 T. Liu, C. Jiang, B. Cheng, W. You, J. Yu, Hierarchical flower-like C/NiO composite hollow microspheres and its excellent supercapacitor performance. J. Power Sources359 (2017) 371–378. [54] C. Wang Q. Lai K. Feng P. Xu X. Li H. Zhang From zeolite-type metal organic framework to porous nano-sheet carbon: high activity positive electrode material for bromine-based flow batteries Nano Energy 44 2018 240 247 C. Wang, Q. Lai, K. Feng, P. Xu, X. Li, H. Zhang, From zeolite-type metal organic framework to porous nano-sheet carbon: high activity positive electrode material for bromine-based flow batteries. Nano Energy44 (2018) 240–247. [55] K.A. Cychosz R. Guillet-Nicolas J. García-Martínez M. Thommes Recent advances in the textural characterization of hierarchically structured nanoporous materials Chem. Soc. Rev. 46 2017 389 414 K.A. Cychosz, R. Guillet-Nicolas, J. García-Martínez, M. Thommes, Recent advances in the textural characterization of hierarchically structured nanoporous materials. Chem. Soc. Rev.46 (2017) 389–414. [56] Q. Meng A. Duan K. Chi Z. Zhao J. Liu P. Zheng B. Wang C. Liu D. Hu Y. Jia Synthesis of titanium modified three-dimensional KIT5 mesoporous support and its application of the quinoline hydrodenitrogenation Energy Fuels 33 2019 5518 5528 Q. Meng, A. Duan, K. Chi, Z. Zhao, J. Liu, P. Zheng, B. Wang, C. Liu, D. Hu, Y. Jia, Synthesis of titanium modified three-dimensional KIT5 mesoporous support and its application of the quinoline hydrodenitrogenation. Energy Fuels33 (2019) 5518–5528. [57] L. Li X. Collard A. Bertrand B.F. Sels P.P. Pescarmona C. Aprile Extra-small porous Sn-silicate nanoparticles as catalysts for the synthesis of lactates J. Catal. 314 2014 56 65 L. Li, X. Collard, A. Bertrand, B.F. Sels, P.P. Pescarmona, C. Aprile, Extra-small porous Sn-silicate nanoparticles as catalysts for the synthesis of lactates. J. Catal.314 (2014) 56–65.",
      "scopus-id": "85115788689",
      "coredata": {
        "eid": "1-s2.0-S2468823121005046",
        "dc:description": "Effective synthesis of aromatic compounds from renewable biomass is highly important yet challenging. p-Cymene is an attractive aromatic compound with various promising applications in the manufacture of fine chemicals. In this study, a novel and effective catalytic system based on mesoporous tin phosphate (M-SnPO) with Lewis-Brønsted dual acidity was developed for the fast synthesis of p-cymene from the cyclodehydration of bio-based citral. Up to 78.5% yield of p-cymene was achieved from the cyclodehydration of citral at 180 °C within only 0.5 h, superior to the results reported for benchmark homogeneous acid catalysts. Characterization of as-prepared M-SnPO catalyst via various techniques indicates that the synergic effect of Lewis and Brønsted acidic sites, large pore-sized structure, and high surface area are responsible for its remarkable catalytic performance. In addition, the effectiveness of the M-SnPO catalyst could be almost sustained over multiple cycles without significant loss. The work herein is the first example of developing a Lewis-Brønsted dual acidic heterogeneous catalyst for the fast synthesis of p-cymene from the cyclodehydration of citral.",
        "openArchiveArticle": "false",
        "prism:coverDate": "2021-10-31",
        "openaccessUserLicense": null,
        "prism:aggregationType": "Journal",
        "prism:url": "https://api.elsevier.com/content/article/pii/S2468823121005046",
        "dc:creator": [
          {
            "@_fa": "true",
            "$": "He, Jian"
          },
          {
            "@_fa": "true",
            "$": "Yu, Zhaozhuo"
          },
          {
            "@_fa": "true",
            "$": "Wu, Hongguo"
          },
          {
            "@_fa": "true",
            "$": "Li, Hu"
          },
          {
            "@_fa": "true",
            "$": "Yang, Song"
          }
        ],
        "link": [
          {
            "@_fa": "true",
            "@rel": "self",
            "@href": "https://api.elsevier.com/content/article/pii/S2468823121005046"
          },
          {
            "@_fa": "true",
            "@rel": "scidir",
            "@href": "https://www.sciencedirect.com/science/article/pii/S2468823121005046"
          }
        ],
        "dc:format": "application/json",
        "openaccessType": null,
        "pii": "S2468-8231(21)00504-6",
        "prism:volume": "515",
        "articleNumber": "111887",
        "prism:publisher": "Elsevier B.V.",
        "dc:title": "Mesoporous tin phosphate as an effective catalyst for fast cyclodehydration of bio-based citral into p-cymene",
        "prism:copyright": "© 2021 Elsevier B.V. All rights reserved.",
        "openaccess": "0",
        "prism:issn": "24688231",
        "dcterms:subject": [
          {
            "@_fa": "true",
            "$": "P-Cymene"
          },
          {
            "@_fa": "true",
            "$": "Cyclodehydration"
          },
          {
            "@_fa": "true",
            "$": "Citral"
          },
          {
            "@_fa": "true",
            "$": "Heterogeneous catalysis"
          },
          {
            "@_fa": "true",
            "$": "Biomass conversion"
          }
        ],
        "openaccessArticle": "false",
        "prism:publicationName": "Molecular Catalysis",
        "openaccessSponsorType": null,
        "prism:pageRange": "111887",
        "pubType": "fla",
        "prism:coverDisplayDate": "October 2021",
        "prism:doi": "10.1016/j.mcat.2021.111887",
        "prism:startingPage": "111887",
        "dc:identifier": "doi:10.1016/j.mcat.2021.111887",
        "openaccessSponsorName": null
      },
      "objects": {
        "object": [
          {
            "@category": "standard",
            "@height": "181",
            "@width": "301",
            "@_fa": "true",
            "$": "https://api.elsevier.com/content/object/eid/1-s2.0-S2468823121005046-ga1.jpg?httpAccept=%2A%2F%2A",
            "@multimediatype": "JPEG image file",
            "@type": "IMAGE-DOWNSAMPLED",
            "@size": "33815",
            "@ref": "ga1",
            "@mimetype": "image/jpeg"
          },
          {
            "@category": "standard",
            "@height": "381",
            "@width": "593",
            "@_fa": "true",
            "$": "https://api.elsevier.com/content/object/eid/1-s2.0-S2468823121005046-sc1.jpg?httpAccept=%2A%2F%2A",
            "@multimediatype": "JPEG image file",
            "@type": "IMAGE-DOWNSAMPLED",
            "@size": "52796",
            "@ref": "sc1",
            "@mimetype": "image/jpeg"
          },
          {
            "@category": "standard",
            "@height": "62",
            "@width": "44",
            "@_fa": "true",
            "$": "https://api.elsevier.com/content/object/eid/1-s2.0-S2468823121005046-fx3.jpg?httpAccept=%2A%2F%2A",
            "@multimediatype": "JPEG image file",
            "@type": "IMAGE-DOWNSAMPLED",
            "@size": "1200",
            "@ref": "fx3",
            "@mimetype": "image/jpeg"
          },
          {
            "@category": "standard",
            "@height": "332",
            "@width": "640",
            "@_fa": "true",
            "$": "https://api.elsevier.com/content/object/eid/1-s2.0-S2468823121005046-sc2.jpg?httpAccept=%2A%2F%2A",
            "@multimediatype": "JPEG image file",
            "@type": "IMAGE-DOWNSAMPLED",
            "@size": "59061",
            "@ref": "sc2",
            "@mimetype": "image/jpeg"
          },
          {
            "@category": "standard",
            "@height": "71",
            "@width": "27",
            "@_fa": "true",
            "$": "https://api.elsevier.com/content/object/eid/1-s2.0-S2468823121005046-fx4.jpg?httpAccept=%2A%2F%2A",
            "@multimediatype": "JPEG image file",
            "@type": "IMAGE-DOWNSAMPLED",
            "@size": "1128",
            "@ref": "fx4",
            "@mimetype": "image/jpeg"
          },
          {
            "@category": "standard",
            "@height": "65",
            "@width": "26",
            "@_fa": "true",
            "$": "https://api.elsevier.com/content/object/eid/1-s2.0-S2468823121005046-fx1.jpg?httpAccept=%2A%2F%2A",
            "@multimediatype": "JPEG image file",
            "@type": "IMAGE-DOWNSAMPLED",
            "@size": "1059",
            "@ref": "fx1",
            "@mimetype": "image/jpeg"
          },
          {
            "@category": "standard",
            "@height": "67",
            "@width": "26",
            "@_fa": "true",
            "$": "https://api.elsevier.com/content/object/eid/1-s2.0-S2468823121005046-fx2.jpg?httpAccept=%2A%2F%2A",
            "@multimediatype": "JPEG image file",
            "@type": "IMAGE-DOWNSAMPLED",
            "@size": "1146",
            "@ref": "fx2",
            "@mimetype": "image/jpeg"
          },
          {
            "@category": "standard",
            "@height": "240",
            "@width": "565",
            "@_fa": "true",
            "$": "https://api.elsevier.com/content/object/eid/1-s2.0-S2468823121005046-gr1.jpg?httpAccept=%2A%2F%2A",
            "@multimediatype": "JPEG image file",
            "@type": "IMAGE-DOWNSAMPLED",
            "@size": "36303",
            "@ref": "gr1",
            "@mimetype": "image/jpeg"
          },
          {
            "@category": "standard",
            "@height": "404",
            "@width": "546",
            "@_fa": "true",
            "$": "https://api.elsevier.com/content/object/eid/1-s2.0-S2468823121005046-sc3.jpg?httpAccept=%2A%2F%2A",
            "@multimediatype": "JPEG image file",
            "@type": "IMAGE-DOWNSAMPLED",
            "@size": "34342",
            "@ref": "sc3",
            "@mimetype": "image/jpeg"
          },
          {
            "@category": "standard",
            "@height": "244",
            "@width": "639",
            "@_fa": "true",
            "$": "https://api.elsevier.com/content/object/eid/1-s2.0-S2468823121005046-gr4.jpg?httpAccept=%2A%2F%2A",
            "@multimediatype": "JPEG image file",
            "@type": "IMAGE-DOWNSAMPLED",
            "@size": "41677",
            "@ref": "gr4",
            "@mimetype": "image/jpeg"
          },
          {
            "@category": "standard",
            "@height": "526",
            "@width": "642",
            "@_fa": "true",
            "$": "https://api.elsevier.com/content/object/eid/1-s2.0-S2468823121005046-gr5.jpg?httpAccept=%2A%2F%2A",
            "@multimediatype": "JPEG image file",
            "@type": "IMAGE-DOWNSAMPLED",
            "@size": "65771",
            "@ref": "gr5",
            "@mimetype": "image/jpeg"
          },
          {
            "@category": "standard",
            "@height": "565",
            "@width": "649",
            "@_fa": "true",
            "$": "https://api.elsevier.com/content/object/eid/1-s2.0-S2468823121005046-gr2.jpg?httpAccept=%2A%2F%2A",
            "@multimediatype": "JPEG image file",
            "@type": "IMAGE-DOWNSAMPLED",
            "@size": "66599",
            "@ref": "gr2",
            "@mimetype": "image/jpeg"
          },
          {
            "@category": "standard",
            "@height": "552",
            "@width": "649",
            "@_fa": "true",
            "$": "https://api.elsevier.com/content/object/eid/1-s2.0-S2468823121005046-gr3.jpg?httpAccept=%2A%2F%2A",
            "@multimediatype": "JPEG image file",
            "@type": "IMAGE-DOWNSAMPLED",
            "@size": "161991",
            "@ref": "gr3",
            "@mimetype": "image/jpeg"
          },
          {
            "@category": "standard",
            "@height": "248",
            "@width": "648",
            "@_fa": "true",
            "$": "https://api.elsevier.com/content/object/eid/1-s2.0-S2468823121005046-gr6.jpg?httpAccept=%2A%2F%2A",
            "@multimediatype": "JPEG image file",
            "@type": "IMAGE-DOWNSAMPLED",
            "@size": "35948",
            "@ref": "gr6",
            "@mimetype": "image/jpeg"
          },
          {
            "@category": "standard",
            "@height": "517",
            "@width": "647",
            "@_fa": "true",
            "$": "https://api.elsevier.com/content/object/eid/1-s2.0-S2468823121005046-gr7.jpg?httpAccept=%2A%2F%2A",
            "@multimediatype": "JPEG image file",
            "@type": "IMAGE-DOWNSAMPLED",
            "@size": "76782",
            "@ref": "gr7",
            "@mimetype": "image/jpeg"
          },
          {
            "@category": "thumbnail",
            "@height": "132",
            "@width": "219",
            "@_fa": "true",
            "$": "https://api.elsevier.com/content/object/eid/1-s2.0-S2468823121005046-ga1.sml?httpAccept=%2A%2F%2A",
            "@multimediatype": "GIF image file",
            "@type": "IMAGE-THUMBNAIL",
            "@size": "17046",
            "@ref": "ga1",
            "@mimetype": "image/gif"
          },
          {
            "@category": "thumbnail",
            "@height": "141",
            "@width": "219",
            "@_fa": "true",
            "$": "https://api.elsevier.com/content/object/eid/1-s2.0-S2468823121005046-sc1.sml?httpAccept=%2A%2F%2A",
            "@multimediatype": "GIF image file",
            "@type": "IMAGE-THUMBNAIL",
            "@size": "7486",
            "@ref": "sc1",
            "@mimetype": "image/gif"
          },
          {
            "@category": "thumbnail",
            "@height": "274",
            "@width": "196",
            "@_fa": "true",
            "$": "https://api.elsevier.com/content/object/eid/1-s2.0-S2468823121005046-fx3.sml?httpAccept=%2A%2F%2A",
            "@multimediatype": "GIF image file",
            "@type": "IMAGE-THUMBNAIL",
            "@size": "5709",
            "@ref": "fx3",
            "@mimetype": "image/gif"
          },
          {
            "@category": "thumbnail",
            "@height": "114",
            "@width": "219",
            "@_fa": "true",
            "$": "https://api.elsevier.com/content/object/eid/1-s2.0-S2468823121005046-sc2.sml?httpAccept=%2A%2F%2A",
            "@multimediatype": "GIF image file",
            "@type": "IMAGE-THUMBNAIL",
            "@size": "9731",
            "@ref": "sc2",
            "@mimetype": "image/gif"
          },
          {
            "@category": "thumbnail",
            "@height": "316",
            "@width": "121",
            "@_fa": "true",
            "$": "https://api.elsevier.com/content/object/eid/1-s2.0-S2468823121005046-fx4.sml?httpAccept=%2A%2F%2A",
            "@multimediatype": "GIF image file",
            "@type": "IMAGE-THUMBNAIL",
            "@size": "5245",
            "@ref": "fx4",
            "@mimetype": "image/gif"
          },
          {
            "@category": "thumbnail",
            "@height": "289",
            "@width": "116",
            "@_fa": "true",
            "$": "https://api.elsevier.com/content/object/eid/1-s2.0-S2468823121005046-fx1.sml?httpAccept=%2A%2F%2A",
            "@multimediatype": "GIF image file",
            "@type": "IMAGE-THUMBNAIL",
            "@size": "4783",
            "@ref": "fx1",
            "@mimetype": "image/gif"
          },
          {
            "@category": "thumbnail",
            "@height": "300",
            "@width": "116",
            "@_fa": "true",
            "$": "https://api.elsevier.com/content/object/eid/1-s2.0-S2468823121005046-fx2.sml?httpAccept=%2A%2F%2A",
            "@multimediatype": "GIF image file",
            "@type": "IMAGE-THUMBNAIL",
            "@size": "5209",
            "@ref": "fx2",
            "@mimetype": "image/gif"
          },
          {
            "@category": "thumbnail",
            "@height": "93",
            "@width": "219",
            "@_fa": "true",
            "$": "https://api.elsevier.com/content/object/eid/1-s2.0-S2468823121005046-gr1.sml?httpAccept=%2A%2F%2A",
            "@multimediatype": "GIF image file",
            "@type": "IMAGE-THUMBNAIL",
            "@size": "9231",
            "@ref": "gr1",
            "@mimetype": "image/gif"
          },
          {
            "@category": "thumbnail",
            "@height": "162",
            "@width": "219",
            "@_fa": "true",
            "$": "https://api.elsevier.com/content/object/eid/1-s2.0-S2468823121005046-sc3.sml?httpAccept=%2A%2F%2A",
            "@multimediatype": "GIF image file",
            "@type": "IMAGE-THUMBNAIL",
            "@size": "6522",
            "@ref": "sc3",
            "@mimetype": "image/gif"
          },
          {
            "@category": "thumbnail",
            "@height": "83",
            "@width": "219",
            "@_fa": "true",
            "$": "https://api.elsevier.com/content/object/eid/1-s2.0-S2468823121005046-gr4.sml?httpAccept=%2A%2F%2A",
            "@multimediatype": "GIF image file",
            "@type": "IMAGE-THUMBNAIL",
            "@size": "7967",
            "@ref": "gr4",
            "@mimetype": "image/gif"
          },
          {
            "@category": "thumbnail",
            "@height": "164",
            "@width": "200",
            "@_fa": "true",
            "$": "https://api.elsevier.com/content/object/eid/1-s2.0-S2468823121005046-gr5.sml?httpAccept=%2A%2F%2A",
            "@multimediatype": "GIF image file",
            "@type": "IMAGE-THUMBNAIL",
            "@size": "11003",
            "@ref": "gr5",
            "@mimetype": "image/gif"
          },
          {
            "@category": "thumbnail",
            "@height": "164",
            "@width": "188",
            "@_fa": "true",
            "$": "https://api.elsevier.com/content/object/eid/1-s2.0-S2468823121005046-gr2.sml?httpAccept=%2A%2F%2A",
            "@multimediatype": "GIF image file",
            "@type": "IMAGE-THUMBNAIL",
            "@size": "10302",
            "@ref": "gr2",
            "@mimetype": "image/gif"
          },
          {
            "@category": "thumbnail",
            "@height": "164",
            "@width": "193",
            "@_fa": "true",
            "$": "https://api.elsevier.com/content/object/eid/1-s2.0-S2468823121005046-gr3.sml?httpAccept=%2A%2F%2A",
            "@multimediatype": "GIF image file",
            "@type": "IMAGE-THUMBNAIL",
            "@size": "24348",
            "@ref": "gr3",
            "@mimetype": "image/gif"
          },
          {
            "@category": "thumbnail",
            "@height": "84",
            "@width": "219",
            "@_fa": "true",
            "$": "https://api.elsevier.com/content/object/eid/1-s2.0-S2468823121005046-gr6.sml?httpAccept=%2A%2F%2A",
            "@multimediatype": "GIF image file",
            "@type": "IMAGE-THUMBNAIL",
            "@size": "7873",
            "@ref": "gr6",
            "@mimetype": "image/gif"
          },
          {
            "@category": "thumbnail",
            "@height": "164",
            "@width": "205",
            "@_fa": "true",
            "$": "https://api.elsevier.com/content/object/eid/1-s2.0-S2468823121005046-gr7.sml?httpAccept=%2A%2F%2A",
            "@multimediatype": "GIF image file",
            "@type": "IMAGE-THUMBNAIL",
            "@size": "12348",
            "@ref": "gr7",
            "@mimetype": "image/gif"
          },
          {
            "@category": "high",
            "@height": "801",
            "@width": "1333",
            "@_fa": "true",
            "$": "https://api.elsevier.com/content/object/eid/1-s2.0-S2468823121005046-ga1_lrg.jpg?httpAccept=%2A%2F%2A",
            "@multimediatype": "JPEG image file",
            "@type": "IMAGE-HIGH-RES",
            "@size": "256541",
            "@ref": "ga1",
            "@mimetype": "image/jpeg"
          },
          {
            "@category": "high",
            "@height": "1686",
            "@width": "2626",
            "@_fa": "true",
            "$": "https://api.elsevier.com/content/object/eid/1-s2.0-S2468823121005046-sc1_lrg.jpg?httpAccept=%2A%2F%2A",
            "@multimediatype": "JPEG image file",
            "@type": "IMAGE-HIGH-RES",
            "@size": "385548",
            "@ref": "sc1",
            "@mimetype": "image/jpeg"
          },
          {
            "@category": "high",
            "@height": "274",
            "@width": "196",
            "@_fa": "true",
            "$": "https://api.elsevier.com/content/object/eid/1-s2.0-S2468823121005046-fx3_lrg.jpg?httpAccept=%2A%2F%2A",
            "@multimediatype": "JPEG image file",
            "@type": "IMAGE-HIGH-RES",
            "@size": "7421",
            "@ref": "fx3",
            "@mimetype": "image/jpeg"
          },
          {
            "@category": "high",
            "@height": "1471",
            "@width": "2833",
            "@_fa": "true",
            "$": "https://api.elsevier.com/content/object/eid/1-s2.0-S2468823121005046-sc2_lrg.jpg?httpAccept=%2A%2F%2A",
            "@multimediatype": "JPEG image file",
            "@type": "IMAGE-HIGH-RES",
            "@size": "441503",
            "@ref": "sc2",
            "@mimetype": "image/jpeg"
          },
          {
            "@category": "high",
            "@height": "316",
            "@width": "121",
            "@_fa": "true",
            "$": "https://api.elsevier.com/content/object/eid/1-s2.0-S2468823121005046-fx4_lrg.jpg?httpAccept=%2A%2F%2A",
            "@multimediatype": "JPEG image file",
            "@type": "IMAGE-HIGH-RES",
            "@size": "6972",
            "@ref": "fx4",
            "@mimetype": "image/jpeg"
          },
          {
            "@category": "high",
            "@height": "289",
            "@width": "116",
            "@_fa": "true",
            "$": "https://api.elsevier.com/content/object/eid/1-s2.0-S2468823121005046-fx1_lrg.jpg?httpAccept=%2A%2F%2A",
            "@multimediatype": "JPEG image file",
            "@type": "IMAGE-HIGH-RES",
            "@size": "5984",
            "@ref": "fx1",
            "@mimetype": "image/jpeg"
          },
          {
            "@category": "high",
            "@height": "300",
            "@width": "116",
            "@_fa": "true",
            "$": "https://api.elsevier.com/content/object/eid/1-s2.0-S2468823121005046-fx2_lrg.jpg?httpAccept=%2A%2F%2A",
            "@multimediatype": "JPEG image file",
            "@type": "IMAGE-HIGH-RES",
            "@size": "6957",
            "@ref": "fx2",
            "@mimetype": "image/jpeg"
          },
          {
            "@category": "high",
            "@height": "1060",
            "@width": "2500",
            "@_fa": "true",
            "$": "https://api.elsevier.com/content/object/eid/1-s2.0-S2468823121005046-gr1_lrg.jpg?httpAccept=%2A%2F%2A",
            "@multimediatype": "JPEG image file",
            "@type": "IMAGE-HIGH-RES",
            "@size": "286546",
            "@ref": "gr1",
            "@mimetype": "image/jpeg"
          },
          {
            "@category": "high",
            "@height": "1790",
            "@width": "2417",
            "@_fa": "true",
            "$": "https://api.elsevier.com/content/object/eid/1-s2.0-S2468823121005046-sc3_lrg.jpg?httpAccept=%2A%2F%2A",
            "@multimediatype": "JPEG image file",
            "@type": "IMAGE-HIGH-RES",
            "@size": "253611",
            "@ref": "sc3",
            "@mimetype": "image/jpeg"
          },
          {
            "@category": "high",
            "@height": "1079",
            "@width": "2831",
            "@_fa": "true",
            "$": "https://api.elsevier.com/content/object/eid/1-s2.0-S2468823121005046-gr4_lrg.jpg?httpAccept=%2A%2F%2A",
            "@multimediatype": "JPEG image file",
            "@type": "IMAGE-HIGH-RES",
            "@size": "296933",
            "@ref": "gr4",
            "@mimetype": "image/jpeg"
          },
          {
            "@category": "high",
            "@height": "2328",
            "@width": "2842",
            "@_fa": "true",
            "$": "https://api.elsevier.com/content/object/eid/1-s2.0-S2468823121005046-gr5_lrg.jpg?httpAccept=%2A%2F%2A",
            "@multimediatype": "JPEG image file",
            "@type": "IMAGE-HIGH-RES",
            "@size": "497971",
            "@ref": "gr5",
            "@mimetype": "image/jpeg"
          },
          {
            "@category": "high",
            "@height": "2505",
            "@width": "2876",
            "@_fa": "true",
            "$": "https://api.elsevier.com/content/object/eid/1-s2.0-S2468823121005046-gr2_lrg.jpg?httpAccept=%2A%2F%2A",
            "@multimediatype": "JPEG image file",
            "@type": "IMAGE-HIGH-RES",
            "@size": "508141",
            "@ref": "gr2",
            "@mimetype": "image/jpeg"
          },
          {
            "@category": "high",
            "@height": "2443",
            "@width": "2872",
            "@_fa": "true",
            "$": "https://api.elsevier.com/content/object/eid/1-s2.0-S2468823121005046-gr3_lrg.jpg?httpAccept=%2A%2F%2A",
            "@multimediatype": "JPEG image file",
            "@type": "IMAGE-HIGH-RES",
            "@size": "1540332",
            "@ref": "gr3",
            "@mimetype": "image/jpeg"
          },
          {
            "@category": "high",
            "@height": "1096",
            "@width": "2868",
            "@_fa": "true",
            "$": "https://api.elsevier.com/content/object/eid/1-s2.0-S2468823121005046-gr6_lrg.jpg?httpAccept=%2A%2F%2A",
            "@multimediatype": "JPEG image file",
            "@type": "IMAGE-HIGH-RES",
            "@size": "218035",
            "@ref": "gr6",
            "@mimetype": "image/jpeg"
          },
          {
            "@category": "high",
            "@height": "2292",
            "@width": "2866",
            "@_fa": "true",
            "$": "https://api.elsevier.com/content/object/eid/1-s2.0-S2468823121005046-gr7_lrg.jpg?httpAccept=%2A%2F%2A",
            "@multimediatype": "JPEG image file",
            "@type": "IMAGE-HIGH-RES",
            "@size": "574258",
            "@ref": "gr7",
            "@mimetype": "image/jpeg"
          },
          {
            "@category": "standard",
            "@_fa": "true",
            "$": "https://api.elsevier.com/content/object/eid/1-s2.0-S2468823121005046-mmc1.doc?httpAccept=%2A%2F%2A",
            "@multimediatype": "Microsoft Word file",
            "@type": "APPLICATION",
            "@size": "22936064",
            "@ref": "mmc1",
            "@mimetype": "application/word"
          },
          {
            "@category": "standard",
            "@_fa": "true",
            "$": "https://api.elsevier.com/content/object/eid/1-s2.0-S2468823121005046-am.pdf?httpAccept=%2A%2F%2A",
            "@multimediatype": "Acrobat PDF file",
            "@type": "AAM-PDF",
            "@size": "2791956",
            "@ref": "am",
            "@mimetype": "application/pdf"
          }
        ]
      },
      "link": {
        "@rel": "abstract",
        "@href": "https://api.elsevier.com/content/abstract/scopus_id/85115788689"
      }
    }
  }
}