{
  "metadata": {
    "title": "Efficient oxidation and stable removal of toluene over controlled metal-organic framework derived MnFeO<ce:inf loc=post>x</ce:inf> catalysts",
    "authors": "; ; ",
    "journal": "Molecular Catalysis",
    "date": "2024-01-15",
    "doi": "10.1016/j.mcat.2023.113792",
    "abstract": "",
    "uri": "https://api.elsevier.com/content/article/pii/S2468823123008805",
    "pii": "S2468823123008805"
  },
  "fulltext": {
    "full-text-retrieval-response": {
      "scopus-eid": "2-s2.0-85181054024",
      "originalText": "serial JL 315758 291210 291744 291790 291809 31 Molecular Catalysis MOLECULARCATALYSIS 2023-12-28 2023-12-28 2023-12-28 2023-12-28 2024-01-14T03:56:07 1-s2.0-S2468823123008805 S2468-8231(23)00880-5 S2468823123008805 10.1016/j.mcat.2023.113792 S300 S300.1 FULL-TEXT 1-s2.0-S2468823123X00194 2024-02-01T23:57:24.378679Z 0 0 20240115 2024 2023-12-28T17:15:44.756775Z absattachment articleinfo articlenumber articletitlenorm authfirstinitialnorm authfirstsurnamenorm cid cids contenttype copyright crossmark dateloaded dateloadedtxt datesearch datesort dateupdated dco docsubtype doctype doi eid ewtransactionid hubeid indexeddate issn issnnorm itemstage itemtransactionid itemweight openaccess openarchive pg pgfirst pii piinorm pubdatestart pubdatetxt pubyr sectiontitle sortorder srctitle srctitlenorm srctype ssids alllist content subj subheadings suppl tomb volfirst volissue volumelist webpdf webpdfpagecount yearnav figure body mmlmath acknowledge affil articletitle auth authfirstini authfull authkeywords authlast grantnumber grantsponsor grantsponsorid highlightsabst primabst pubtype ref specialabst 2468-8231 24688231 true 553 553 C Volume 553 77 113792 113792 113792 20240115 15 January 2024 2024-01-15 2024 Regular Papers article fla © 2023 Elsevier B.V. All rights reserved. EFFICIENTOXIDATIONSTABLEREMOVALTOLUENEOVERCONTROLLEDMETALORGANICFRAMEWORKDERIVEDMNFEOXCATALYSTS WANG Y 1 Introduction 2 Experimental section 2.1 Chemical materials 2.2 Sample preparation 2.3 Material characterization 2.4 Catalytic activity evaluation 3 Results and discussion 3.1 Structure and morphology of catalysts 3.2 Catalytic elimination of toluene 3.3 Stability and water resistance of catalysts 3.4 Catalytic mechanism and reaction pathway of VOCs degradation 4 Conclusions CRediT authorship contribution statement Acknowledgments References GU 2021 758 762 B QU 2021 139 158 M WEN 2022 112149 M WANG 2021 111922 Y LI 2020 110766 Z CAMPOSECO 2022 112738 R XIANG 2020 111112 N BRUMMER 2022 132112 V WANG 2023 447 458 X YANG 2022 121224 L CANON 2020 111080 J HASANZADEH 2020 405 414 M LIU 2022 775 Y GU 2021 121803 X ZHANG 2022 112068 Y XIANG 2022 112519 N LI 2023 112857 Z XIE 2020 48476 48485 S WANG 2022 3941 3951 A ZHANG 2020 110701 X LI 2023 112952 Y SHAN 2022 10381 10390 C ZHANG 2023 113468 X HU 2018 3999 4007 C SHI 2012 18 22 C YAO 2020 2357 2366 H CHEN 2020 110919 Z ZHANG 2022 112226 X ZHAO 2016 3433 3441 S LI 2020 118827 Z WANG 2020 122753 Z MING 2020 122287 S LUO 2018 119 127 Y WU 2022 121387 S ZHANG 2021 120393 X ZHAO 2022 124185 F XIN 2021 119386 S ZHANG 2022 10916 10924 Z LI 2018 4913 4926 X QU 2020 10581 10587 J YU 2021 310 324 X ZHANG 2019 105706 T LI 2018 82 87 G WEN 2022 42 58 M WANG 2021 119560 P MO 2019 16197 16210 S WANG 2021 119873 Y YU 2020 121800 E JIANG 2021 124203 B DONG 2021 102 112 C CHEN 2019 312 324 X QI 2023 107437 M MO 2020 118464 S SU 2020 12684 12692 Z YANG 2020 118150 W WANGX2024X113792 WANGX2024X113792XY 2025-12-28T00:00:00.000Z 2025-12-28T00:00:00.000Z http://creativecommons.org/licenses/by-nc-nd/4.0/ © 2023 Elsevier B.V. All rights reserved. 2024-01-04T07:21:46.450Z http://vtw.elsevier.com/data/voc/AddOnTypes/50.7/aggregated-refined Qingdao Agricultural University QAU Qingdao Agricultural University http://data.elsevier.com/vocabulary/SciValFunders/100012900 http://sws.geonames.org/1814991/ National Natural Science Foundation of China 52070107 52100126 NSFC National Natural Science Foundation of China http://data.elsevier.com/vocabulary/SciValFunders/501100001809 http://sws.geonames.org/1814991/ Natural Science Foundation of Shandong Province ZR2020QE241 Natural Science Foundation of Shandong Province http://data.elsevier.com/vocabulary/SciValFunders/501100007129 http://sws.geonames.org/1814991/ Research Foundation for Talented Scholars of Qingdao Agricultural University 6651120024 This work was supported by the Natural Science Foundation of Shandong Province (No. ZR2020QE241 ), National Natural Science Foundation of China (No. 52100126 , 52070107 ), and Research Foundation for Talented Scholars of Qingdao Agricultural University (No. 6651120024 ). In addition, this work thanks to the support of Qingdao Agricultural University Analysis and Testing Center. This work was supported by the Natural Science Foundation of Shandong Province (No. ZR2020QE241), National Natural Science Foundation of China (No. 52100126, 52070107), and Research Foundation for Talented Scholars of Qingdao Agricultural University (No. 6651120024). In addition, this work thanks to the support of Qingdao Agricultural University Analysis and Testing Center. https://doi.org/10.15223/policy-017 https://doi.org/10.15223/policy-037 https://doi.org/10.15223/policy-012 https://doi.org/10.15223/policy-029 https://doi.org/10.15223/policy-004 item S2468-8231(23)00880-5 S2468823123008805 1-s2.0-S2468823123008805 10.1016/j.mcat.2023.113792 315758 2024-02-01T23:57:24.378679Z 2024-01-15 1-s2.0-S2468823123008805-main.pdf https://s3-eu-west-1.amazonaws.com/prod-ucs-content-store-eu-west/content/pii:S2468823123008805/MAIN/application/pdf/e1fbb142e543c9a119d4c584327d9c7f/main.pdf main.pdf pdf true 10365753 MAIN 12 1-s2.0-S2468823123008805-main_1.png https://s3-eu-west-1.amazonaws.com/prod-ucs-content-store-eu-west/content/pii:S2468823123008805/PREVIEW/image/png/421aea2e70ffa8e88b2e26840eef4907/main_1.png main_1.png png 58683 849 656 IMAGE-WEB-PDF 1 1-s2.0-S2468823123008805-gr10.jpg https://s3-eu-west-1.amazonaws.com/prod-ucs-content-store-eu-west/content/pii:S2468823123008805/gr10/DOWNSAMPLED/image/jpeg/0a61d8a5b6315ed8035c83f5e09372ef/gr10.jpg gr10 gr10.jpg jpg 93209 394 678 IMAGE-DOWNSAMPLED 1-s2.0-S2468823123008805-gr9.jpg https://s3-eu-west-1.amazonaws.com/prod-ucs-content-store-eu-west/content/pii:S2468823123008805/gr9/DOWNSAMPLED/image/jpeg/0c6af232dd70c358dd154ec2f561c4c4/gr9.jpg gr9 gr9.jpg jpg 149722 548 715 IMAGE-DOWNSAMPLED 1-s2.0-S2468823123008805-gr8.jpg https://s3-eu-west-1.amazonaws.com/prod-ucs-content-store-eu-west/content/pii:S2468823123008805/gr8/DOWNSAMPLED/image/jpeg/7cb8ea88649b16f83ea6696fa2c54ca6/gr8.jpg gr8 gr8.jpg jpg 66442 281 715 IMAGE-DOWNSAMPLED 1-s2.0-S2468823123008805-gr4.jpg https://s3-eu-west-1.amazonaws.com/prod-ucs-content-store-eu-west/content/pii:S2468823123008805/gr4/DOWNSAMPLED/image/jpeg/d43cea8de844335d28dd9b6b99395fd9/gr4.jpg gr4 gr4.jpg jpg 80790 553 678 IMAGE-DOWNSAMPLED 1-s2.0-S2468823123008805-gr7.jpg https://s3-eu-west-1.amazonaws.com/prod-ucs-content-store-eu-west/content/pii:S2468823123008805/gr7/DOWNSAMPLED/image/jpeg/d7f04f2c0817183d7e2d122134f04f52/gr7.jpg gr7 gr7.jpg jpg 40807 274 681 IMAGE-DOWNSAMPLED 1-s2.0-S2468823123008805-gr6.jpg https://s3-eu-west-1.amazonaws.com/prod-ucs-content-store-eu-west/content/pii:S2468823123008805/gr6/DOWNSAMPLED/image/jpeg/e9b9203676402ff8461cc8713909e00c/gr6.jpg gr6 gr6.jpg jpg 139267 864 602 IMAGE-DOWNSAMPLED 1-s2.0-S2468823123008805-ga1.jpg https://s3-eu-west-1.amazonaws.com/prod-ucs-content-store-eu-west/content/pii:S2468823123008805/ga1/DOWNSAMPLED/image/jpeg/e83c0e004b36584a329ede271044de12/ga1.jpg ga1 true ga1.jpg jpg 38867 200 343 IMAGE-DOWNSAMPLED 1-s2.0-S2468823123008805-gr5.jpg https://s3-eu-west-1.amazonaws.com/prod-ucs-content-store-eu-west/content/pii:S2468823123008805/gr5/DOWNSAMPLED/image/jpeg/363b5d7b28dbffb3dc30629b3d84d22c/gr5.jpg gr5 gr5.jpg jpg 84691 539 678 IMAGE-DOWNSAMPLED 1-s2.0-S2468823123008805-gr1.jpg https://s3-eu-west-1.amazonaws.com/prod-ucs-content-store-eu-west/content/pii:S2468823123008805/gr1/DOWNSAMPLED/image/jpeg/22101c7d13ff4866173d5450b1c5cbda/gr1.jpg gr1 gr1.jpg jpg 142908 620 678 IMAGE-DOWNSAMPLED 1-s2.0-S2468823123008805-gr3.jpg https://s3-eu-west-1.amazonaws.com/prod-ucs-content-store-eu-west/content/pii:S2468823123008805/gr3/DOWNSAMPLED/image/jpeg/2fe11cab2e8c800634c8966b81823d15/gr3.jpg gr3 gr3.jpg jpg 151531 713 489 IMAGE-DOWNSAMPLED 1-s2.0-S2468823123008805-gr2.jpg https://s3-eu-west-1.amazonaws.com/prod-ucs-content-store-eu-west/content/pii:S2468823123008805/gr2/DOWNSAMPLED/image/jpeg/50adfae3d54b8c72e8478b8808d15c05/gr2.jpg gr2 gr2.jpg jpg 54236 260 678 IMAGE-DOWNSAMPLED 1-s2.0-S2468823123008805-gr10.sml https://s3-eu-west-1.amazonaws.com/prod-ucs-content-store-eu-west/content/pii:S2468823123008805/gr10/THUMBNAIL/image/gif/9422666e19d69b5acc69880f1f7ada35/gr10.sml gr10 gr10.sml sml 14981 127 219 IMAGE-THUMBNAIL 1-s2.0-S2468823123008805-gr9.sml https://s3-eu-west-1.amazonaws.com/prod-ucs-content-store-eu-west/content/pii:S2468823123008805/gr9/THUMBNAIL/image/gif/2ebcf9856cf7f3b1057b26dd97172056/gr9.sml gr9 gr9.sml sml 20135 164 214 IMAGE-THUMBNAIL 1-s2.0-S2468823123008805-gr8.sml https://s3-eu-west-1.amazonaws.com/prod-ucs-content-store-eu-west/content/pii:S2468823123008805/gr8/THUMBNAIL/image/gif/420cf14db2d2ee8e9e19ede36b4bc8bd/gr8.sml gr8 gr8.sml sml 10429 86 219 IMAGE-THUMBNAIL 1-s2.0-S2468823123008805-gr4.sml https://s3-eu-west-1.amazonaws.com/prod-ucs-content-store-eu-west/content/pii:S2468823123008805/gr4/THUMBNAIL/image/gif/de4d8bd2db0e293632f8ba09305dc477/gr4.sml gr4 gr4.sml sml 11221 164 201 IMAGE-THUMBNAIL 1-s2.0-S2468823123008805-gr7.sml https://s3-eu-west-1.amazonaws.com/prod-ucs-content-store-eu-west/content/pii:S2468823123008805/gr7/THUMBNAIL/image/gif/d96f78f781ccb6608a94192e33bd6063/gr7.sml gr7 gr7.sml sml 6792 88 219 IMAGE-THUMBNAIL 1-s2.0-S2468823123008805-gr6.sml https://s3-eu-west-1.amazonaws.com/prod-ucs-content-store-eu-west/content/pii:S2468823123008805/gr6/THUMBNAIL/image/gif/c0ccb1f614147c36331ddf0dd3cae940/gr6.sml gr6 gr6.sml sml 10732 164 114 IMAGE-THUMBNAIL 1-s2.0-S2468823123008805-ga1.sml https://s3-eu-west-1.amazonaws.com/prod-ucs-content-store-eu-west/content/pii:S2468823123008805/ga1/THUMBNAIL/image/gif/9682c8bfb100049138bcad1871daf8c2/ga1.sml ga1 true ga1.sml sml 15495 128 219 IMAGE-THUMBNAIL 1-s2.0-S2468823123008805-gr5.sml https://s3-eu-west-1.amazonaws.com/prod-ucs-content-store-eu-west/content/pii:S2468823123008805/gr5/THUMBNAIL/image/gif/0c0134f65f3527600b683271dd50f1e9/gr5.sml gr5 gr5.sml sml 12169 164 206 IMAGE-THUMBNAIL 1-s2.0-S2468823123008805-gr1.sml https://s3-eu-west-1.amazonaws.com/prod-ucs-content-store-eu-west/content/pii:S2468823123008805/gr1/THUMBNAIL/image/gif/56d2671005a03f9fe8f0ac89f4d002b3/gr1.sml gr1 gr1.sml sml 13540 164 179 IMAGE-THUMBNAIL 1-s2.0-S2468823123008805-gr3.sml https://s3-eu-west-1.amazonaws.com/prod-ucs-content-store-eu-west/content/pii:S2468823123008805/gr3/THUMBNAIL/image/gif/de0a8fc791ce2c430fd4f5465baeee21/gr3.sml gr3 gr3.sml sml 16089 163 112 IMAGE-THUMBNAIL 1-s2.0-S2468823123008805-gr2.sml https://s3-eu-west-1.amazonaws.com/prod-ucs-content-store-eu-west/content/pii:S2468823123008805/gr2/THUMBNAIL/image/gif/8791fba546654ef6c84c11dc0cb420df/gr2.sml gr2 gr2.sml sml 8365 84 219 IMAGE-THUMBNAIL 1-s2.0-S2468823123008805-gr10_lrg.jpg https://s3-eu-west-1.amazonaws.com/prod-ucs-content-store-eu-west/content/pii:S2468823123008805/HIGHRES/image/jpeg/cbf6bba361080d0e5b29c4d5b14a8c99/gr10_lrg.jpg gr10 gr10_lrg.jpg jpg 732492 1745 3000 IMAGE-HIGH-RES 1-s2.0-S2468823123008805-gr9_lrg.jpg https://s3-eu-west-1.amazonaws.com/prod-ucs-content-store-eu-west/content/pii:S2468823123008805/HIGHRES/image/jpeg/4ecc899c9dee4f25a81242b8d1159303/gr9_lrg.jpg gr9 gr9_lrg.jpg jpg 1119509 2429 3167 IMAGE-HIGH-RES 1-s2.0-S2468823123008805-gr8_lrg.jpg https://s3-eu-west-1.amazonaws.com/prod-ucs-content-store-eu-west/content/pii:S2468823123008805/HIGHRES/image/jpeg/e07c62274d45c9a8da55d4f8752c14cd/gr8_lrg.jpg gr8 gr8_lrg.jpg jpg 445102 1245 3167 IMAGE-HIGH-RES 1-s2.0-S2468823123008805-gr4_lrg.jpg https://s3-eu-west-1.amazonaws.com/prod-ucs-content-store-eu-west/content/pii:S2468823123008805/HIGHRES/image/jpeg/24ffb0df0f4dda61284c5a6af9c12f0b/gr4_lrg.jpg gr4 gr4_lrg.jpg jpg 550513 2449 3000 IMAGE-HIGH-RES 1-s2.0-S2468823123008805-gr7_lrg.jpg https://s3-eu-west-1.amazonaws.com/prod-ucs-content-store-eu-west/content/pii:S2468823123008805/HIGHRES/image/jpeg/95180826f8a5404969aa66a6b7ebaed8/gr7_lrg.jpg gr7 gr7_lrg.jpg jpg 266703 1215 3017 IMAGE-HIGH-RES 1-s2.0-S2468823123008805-gr6_lrg.jpg https://s3-eu-west-1.amazonaws.com/prod-ucs-content-store-eu-west/content/pii:S2468823123008805/HIGHRES/image/jpeg/54de095287fb4920e1a21c3e245be1c5/gr6_lrg.jpg gr6 gr6_lrg.jpg jpg 989674 3828 2667 IMAGE-HIGH-RES 1-s2.0-S2468823123008805-ga1_lrg.jpg https://s3-eu-west-1.amazonaws.com/prod-ucs-content-store-eu-west/content/pii:S2468823123008805/HIGHRES/image/jpeg/39c8c50deb98fe57bb963e6ba8f1f514/ga1_lrg.jpg ga1 true ga1_lrg.jpg jpg 304640 886 1521 IMAGE-HIGH-RES 1-s2.0-S2468823123008805-gr5_lrg.jpg https://s3-eu-west-1.amazonaws.com/prod-ucs-content-store-eu-west/content/pii:S2468823123008805/HIGHRES/image/jpeg/28bb99b57b6023768f6bda3bebd2d436/gr5_lrg.jpg gr5 gr5_lrg.jpg jpg 541703 2383 3000 IMAGE-HIGH-RES 1-s2.0-S2468823123008805-gr1_lrg.jpg https://s3-eu-west-1.amazonaws.com/prod-ucs-content-store-eu-west/content/pii:S2468823123008805/HIGHRES/image/jpeg/7942a1a9510686a3eb6d6eaaf4d2445d/gr1_lrg.jpg gr1 gr1_lrg.jpg jpg 990158 2744 3000 IMAGE-HIGH-RES 1-s2.0-S2468823123008805-gr3_lrg.jpg https://s3-eu-west-1.amazonaws.com/prod-ucs-content-store-eu-west/content/pii:S2468823123008805/HIGHRES/image/jpeg/e9eb5d39d18451d4816eb26636aab6a9/gr3_lrg.jpg gr3 gr3_lrg.jpg jpg 1477716 3161 2167 IMAGE-HIGH-RES 1-s2.0-S2468823123008805-gr2_lrg.jpg https://s3-eu-west-1.amazonaws.com/prod-ucs-content-store-eu-west/content/pii:S2468823123008805/HIGHRES/image/jpeg/29caa1f57ed27a619d729f4af56c26e2/gr2_lrg.jpg gr2 gr2_lrg.jpg jpg 357891 1150 3000 IMAGE-HIGH-RES 1-s2.0-S2468823123008805-si1.svg https://s3-eu-west-1.amazonaws.com/prod-ucs-content-store-eu-west/content/pii:S2468823123008805/image/svg+xml/90546b34e1775fd000ced9fa1e30f7ac/si1.svg si1 si1.svg svg 16305 ALTIMG 1-s2.0-S2468823123008805-am.pdf am am.pdf pdf 2379276 AAM-PDF https://s3-eu-west-1.amazonaws.com/prod-ucs-content-store-eu-west/content/egi:109VW0HKCTZ/MAIN/application/pdf/8d19aebdaaeb26e8e1b1a48a88b86a30/am.pdf MCAT 113792 113792 S2468-8231(23)00880-5 10.1016/j.mcat.2023.113792 Elsevier B.V. Fig. 1 (a) Illustration of the preparation process of MnFeOx. XRD patterns of (b) Mn-MOF-74, Fe-MOF-74 and MnFe-MOF-74, (c) MnOx-500, FeOx-500 and MnFeOx-500. Fig 1 Fig. 2 FTIR of (a) Fe-MOF-74, Mn-MOF-74 and Mn2Fe3-MOF-74, (b) FeOx-500, MnOx-500 and Mn2Fe3Ox-500 catalysts. Fig 2 Fig. 3 SEM image of (a) Mn-MOF-74, (b) MnOx-500, (c) Mn2Fe3-MOF-74, (d) Mn2Fe3Ox-500 and its SEM-EDS mapping in the inset. For Mn2Fe3Ox-500: (e) TEM (f) HRTEM and (g-j) STEM-EDS elemental mapping. Fig 3 Fig. 4 (a) Conversion of toluene over MnFeOx with different Mn and Fe proportions (3:1, 3:2, 1:1, 2:3 and 1:3), (b) different calcination temperatures (300, 400, 500, 600 °C), (c) different WHSV (30,000, 40,000, 60,000, 120,000 mL/(g h). Fig 4 Fig. 5 (a) Catalytic stability and (b) performance reproducibility of catalyst at 220 °C (WHSV = 40,000 mL/(g h). (c) Effect of water vapor on the toluene conversion over catalyst at 220 °C. (d) FTIR of Mn2Fe3Ox-500 after water vapor testing and stability testing. Fig 5 Fig. 6 XPS spectra of FeOx-500, MnOx-500 and Mn2Fe3Ox-500 catalysts in (a) all spectra, (b) O 1s, (c) Mn 2p, (d) Fe 2p and (e) C 1s. Fig 6 Fig. 7 (a) H2-TPR and (b) O2-TPD profiles for FeOx-500, MnOx-500 and Mn2Fe3Ox-500 catalysts. Fig 7 Fig. 8 (a, b) In-situ DRIFTS of toluene over Mn2Fe3Ox-500 catalyst at 50 °C Fig 8 Fig. 9 In-situ DRIFTS of (a and b) toluene + N2 and (c, d) toluene + O2 over Mn2Fe3Ox-500 catalyst at different temperatures. Fig 9 Fig. 10 Proposed mechanism for toluene degradation on Mn2Fe3Ox-500. Fig 10 Research Paper Efficient oxidation and stable removal of toluene over controlled metal-organic framework derived MnFeOx catalysts Yuxin Wang Resources Investigation Writing – original draft a Zhenyu Chen Visualization Data curation a Shixu Lu Formal analysis Validation a Shuaishuai Xin Supervision Project administration a Guocheng Liu Validation Supervision a Chengzhi Zhou Project administration a Yanjun Xin Resources Writing – review & editing Funding acquisition a Qiang Wang Resources Supervision b Qianwen Wang Investigation Supervision a Yuxia Wang Software Supervision a Tianshan Xue Resources Writing – review & editing c ⁎ Qinghua Yan Conceptualization Writing – review & editing Funding acquisition a ⁎ a Qingdao Engineering Research Center for Rural Environment, College of Resources and Environment, Qingdao Agricultural University, Qingdao 266109, PR China Qingdao Engineering Research Center for Rural Environment College of Resources and Environment Qingdao Agricultural University Qingdao 266109 PR China aQingdao Engineering Research Center for Rural Environment, College of Resources and Environment, Qingdao Agricultural University, Qingdao 266109, PR China b College of Environmental Science and Engineering, Beijing Forestry University, 35 Qinghua East Road, Haidian District, Beijing 100083, PR China College of Environmental Science and Engineering Beijing Forestry University 35 Qinghua East Road, Haidian District Beijing 100083 PR China bCollege of Environmental Science and Engineering, Beijing Forestry University, 35 Qinghua East Road, Haidian District, Beijing 100083, PR China c Institute of Atmospheric Environment, Chinese Research Academy of Environmental Sciences, Beijing 100012, PR China Institute of Atmospheric Environment Chinese Research Academy of Environmental Sciences Beijing 100012 PR China cInstitute of Atmospheric Environment, Chinese Research Academy of Environmental Sciences, Beijing 100012, PR China ⁎ Corresponding authors. For VOCs oxidation technology, significant room for enhancement still exists in terms of catalytic performance of commonly used transition metal oxide-based catalysts. In this work, we designed MnFeOx oxides catalysts by using in situ pyrolysis of MnFe bimetallic MOF-74 as efficient and stable catalysts for toluene oxidation and this bimetallic framework was synthesized by metal doping. The preferred Mn2Fe3Ox-500 (Mn/Fe molar ratio of 2:3, calcination T=500 °C) catalyst exhibited excellent catalytic activity and stability towards toluene which was significantly superior the control MnOx-500 catalyst. Under simulated industrial real-exhaust conditions, the Mn2Fe3Ox-500 catalyst maintained better resistance at higher air velocities, in addition to exhibiting excellent stability and good water resistance. The superior toluene oxidation activity of Mn2Fe3Ox-500 catalyst can be associated with its high reducibility of metal active species, abundance of oxygen species, and the well dispersion of Fe2O3 and MnOx species. In addition, suggested potential degradation pathways for toluene over the Mn2Fe3Ox-500 catalyst. For the exhaust gas purification industry, this work will be beneficial in exploring the mechanistic level of MOF materials in the field of VOCs removal. Graphical abstract Image, graphical abstract Keywords Metal-organic frameworks MnFeOx toluene oxidation stability water resistance Data availability Data will be made available on request. 1 Introduction Haze pollution is increasingly become a major threat to the global environment [1]. Hazy weather has a significant correlation with PM2.5 (aerosol particles with diameter <2.5 μm) and ozone concentrations, while volatile organic compounds (VOCs) are important contributors to the increase in atmospheric concentrations of pollutants such as ozone, as well as their conversion to secondary organic particulate matter, and ultimately the formation of PM2.5. Namely, VOCs, ozone and PM2.5 are interrelated [2]. In addition, VOCs have direct toxic effects on humans through the respiratory, dermal, and digestive tracts, and can also cause acute or chronic poisoning. The emission of VOCs poses a huge menace and nonreversible harm to the global environment [3]. Among them, toluene, as a widely used organic chemical material, is often present in industrial activities such as chemicals, paints, transportation and paper making. At present, large quantities of toluene generated by human activities are volatilized directly into the atmosphere, causing negative impacts on both the environment and human body [4]. Therefore, efficient removal technologies for VOCs have received considerable attention in recent years. Multiple technical methods currently applied to control the emission of VOCs, such as photocatalytic degradation, biological methods, low-temperature plasma treatment, and catalytic oxidation [5]. Among the many feasible technologies, catalytic oxidation is highly expected not only for its high removal efficiency and energy efficiency, but also for its low operating temperature and product toxicity [6]. The efficient catalyst is an urgent need for catalytic oxidation technology. In general, noble metals and metal oxides are commonly selected for the catalytic oxidation of VOCs [7]. But the expensive cost, high temperature deactivation and low resistance to water limit their large-scale industrial application [8]. Metal oxide catalysts (Cu-based, Mn-based, Ce-based, Co-based, etc.) have been recognized as a promising alternative due to the availability, higher thermal stability and toxicity resistance [9]. Although much work has been done in the development of metal oxide catalysts, their catalytic activity and stability remain challenges in effectively removing VOCs. In the study of noble metal catalysts, the metal particle size is related to the activity of the catalyst for VOCs, which has been widely confirmed [10]. Cañón et al. [11] synthesized CoMnMgAl-Ox catalysts for toluene oxidation, in which the prevalence of small particle size Co (III) species enabled the catalysts with better performance. Wang et al. [4] employed different methods to synthesize Ag-loaded MOF-derived CeO2 for toluene oxidation, different synthesis methods affected the particle size of Ce, which in turn affected the specific surface area, chemical composition, and catalytic performance of the catalysts. Small particle size and high dispersibility of the active component contribute to catalytic activity, thus reducing the catalyst cost. Metal oxides can be alternative catalysts to precious metals due to their low price and good low temperature activity. Unfortunately, metal oxide catalysts prepared by traditional loading methods inevitably obtained by calcination of precursor, which makes catalyst particles aggregate into larger blocks. Insufficient exposure of the active site of large particles leads to decreased activity. Therefore, the development of small and stable metal oxide catalysts to effectively remove VOCs is still an important strategy. Metal-organic frameworks (MOFs) are constructed of inorganic nodes connected with organic ligands by coordination bonds (or other intermolecular forces), which have the advantages of diversified structure, high chemical stability and large specific surface area, now they have been successfully applied in heterogeneous catalysis of wastewater, gas adsorption and separation, energy storage, substance detection and adsorption and electrochemistry etc. [12]. Liu et al. [13] used MOF-BTC as a carrier to prepare Pt/MOF-BTC catalyst with abundant platinum atoms and oxygen vacancies, which promoted toluene degradation. Gu et al. [14] prepared core-shell Co-MOF-74@Mn-MOF-74 catalysts for toluene oxidation which exhibited high benzaldehyde selectivity (98.1 %) and toluene conversion (22.4 %). However, with appropriate pyrolysis conditions, MOFs derived metal oxides can better retain some of the properties of MOFs precursor [15]. Moreover, the mixed oxides prepared by using MOFs as precursor can be modified with heteroatoms at the molecular level to facilitate catalytic reactions [16,17]. Herein, MnFe-MOF-74 precursors were prepared by targeted anchoring of Fe species on the basis of Mn-MOF, and the performance of their derived catalysts was evaluated for the removal of toluene. The bimetallic MnFe-MOF-74 derived catalysts exhibited high catalytic degradation of toluene under simulated exhaust conditions. A series of physicochemical characterization methods were used to analyze the structural property changes, determine the optimal preparation conditions, investigate the key factors affecting the efficient degradation of toluene pollutants, and probe the degradation mechanism on the catalyst surface. This work illustrated that appropriate Fe doping was conducive to the catalytic degradation of VOCs by MnFe-MOF-74 derived catalysts. 2 Experimental section 2.1 Chemical materials Manganese chloride (MnCl2·4H2O), ferrous chloride (FeCl2·4H2O), N, N-Dimethylformamide (C3H7NO), ethanol absolute (C2H6O) and methanol (CH4O) belong to Sinopharm Chemical Reagent Co., Ltd. 2, 5-Dihydroxyterephthalic acid (C8H6O6) was bought from Macklin. 2.2 Sample preparation In this experiment, MnFe-MOF-74 were prepared by solvothermal method (Fig. 1 a). Taking Mn2Fe3-MOF-74 as an example: 0.26 g MnCl2·4H2O, 0.392 g FeCl2·4H2O and 0.15 g 2, 5-dihydroxyterephthalic acid (DHTP) were dissolve in 50 mL mixed solution of N, N-Dimethylformamide (DMF): ethanol = 15:1 (volume ratio). Then, the well-mixed solution was quickly transferred to an autoclave and reacted in an oven at 150 °C for 12 h. Typically, the reactor was cooled to room temperature, and the separated solid samples were washed with methanol at least three times. Finally, Mn2Fe3-MOF-74 was obtained by drying in an oven at 60 °C for 12 h. The ratio of MnFe-MOF-74 was also optimized with Mn/Fe molar ratios of 3:1, 3:2, 1:1, 2:3 and 1:3, the total amount of Mn and Fe was kept at 4.3 mol. The corresponding metal oxides obtained from high temperature pyrolysis of MnFe-MOF-74 with different Mn/Fe molar ratios were named as Mn3Fe1Ox, Mn3Fe2Ox, Mn1Fe1Ox, Mn2Fe3Ox and Mn1Fe3Ox. Mn2Fe3-MOF-74 calcined at 300 °C was named Mn2Fe3Ox-300, and materials obtained at other temperatures were named according to the same principle. The synthesis of Fe-MOF-74 and Mn-MOF-74 was similar to that described above, with the difference being the addition of FeCl2 only or MnCl2 only (molar ratio of FeCl2/MnCl2:C8H6O6= 4.3:1). The metal oxides obtained by pyrolysis of Fe-MOF-74 and Mn-MOF-74 at 500 °C were named FeOx-500 and MnOx-500, respectively. 2.3 Material characterization The X-ray diffraction (XRD) analysis were performed in a Bruker D8 Advance with CuKα radiation (λ = 0.154 nm) and the XRD spectrum was recorded within 5–80o (2θ). The morphologies and elements distribution were recorded on a scanning electron microscopy (SEM, ZEISS Gemini 300) with energy-dispersive X-ray spectroscopy (EDS, Smartedx, OXFORD XPLORE30). To acquire the information of microstructures and the particle size distribution, high-resolution transmission electron microscopy (HRTEM, JEOL JEM2100F) was carried out. The Fourier transform infrared spectrometer (FT-IR, TRTracer-100) equipped with a liquid N2-cooled MCT detector was employed to obtain the FT-IR spectra. X-ray photoelectron spectroscopy (XPS, Thermo Scientific K-Alpha) was used for valence states of element analysis. Temperature-programmed reduction in hydrogen (H2-TPR), and Temperature-programmed desorption of oxygen (O2-TPD) were conducted on Builder PCA-1200 equipment. Bruker INVENIO S equipment was used to conduct in-situ diffuse reflectance infrared Fourier transform spectroscopy (in-situ DRIFTS) experiments. 2.4 Catalytic activity evaluation The catalytic activity of catalysts was evaluated using gas chromatography (GC) analysis. Load 0.15 g sample into a fixed reaction bed with an inner diameter of 6 mm. Gas composition: 1000 ppm toluene, 20 vol.% O2 and N2 (total 100 ml). Weight hourly space velocity (WHSV): 40,000 mL/(g h). The entire test regime was always conducted under environmental pressure. Toluene concentrations were monitored by GC9790II (Fuli, Zhejiang), which was equipped with a flame ionization detector. The degradation rate of toluene was calculated according to Eq. (1). (1) Tolu ene conv ersi on ( % ) = 1 − C Tolu ene ( out ) / C Tolu ene ( in ) × 100 % 3 Results and discussion 3.1 Structure and morphology of catalysts The XRD spectrum of Fe-MOF-74, Mn-MOF-74 and MnFe-MOF-74 were similar to the standard spectra, with two strong diffraction peaks at 2θ = 6.924o and 11.956o, corresponding to (210) and (300) crystal planes of MOF-74, respectively [18]. It indicated that the crystal structure of MOF-74 was well maintained after Fe doping (Fig. 1b). After calcination at 500 °C, the characteristic diffraction peaks of MOF-74 completely disappeared, indicating that the structure of MOF-74 collapsed at high temperature (Fig. 1c). For Mn-MOF-74 derived samples, there were obvious diffraction peaks at 2θ = 32.9o, 23.1o, 55.1o, 65.7o, 49.3o, 38.2o and 45.1o, corresponding to the (222), (211), (440), (622), (431), (400) and (332) crystal planes of Mn2O3 (JCPDS No. 41-1442). While for FeOx-500 and MnFeOx-500, the characteristic peaks at 2θ = 24.1o, 33.2o, 40.9o, 49.5o, 54.1o, 62.5o and 64.0o, corresponding to the (012), (104), (113), (024), (116) crystal planes of Fe2O3 (JCPDS No. 33-0664). Notably, no obvious diffraction peaks attributed to Mn species appeared in the XRD pattern of Mn2Fe3Ox-500, which may indicate that Mn species existed in the form of amorphous and highly dispersed, or Mn atom into the lattice of the iron oxide to form solid solutions, which agreed very well with the results of HRTEM and the relevant literature [19]. Based on the XRD patterns, it can be judged that the structure of MOF-74 was not changed after Fe doping, but changed the active species and dispersion of its derivatives. FTIR analysis was used to analyze the chemical structure (Fig. 2 ). The positions of the absorption peaks of Fe-MOF-74, Mn-MOF-74 and Mn2Fe3-MOF-74 could almost completely overlap (Fig. 2a). At ∼ 1653 cm−1, the absorption peak was the stretching vibration of carboxylate (–COO) from organic ligand DHTP. The band at ∼ 1629 cm−1 was caused by the stretching vibration of C=O from solvent DMF. The absorption peaks at ∼ 1552 and 1399 cm−1 were the telescopic vibrations of mononuclear aromatic C=C, which belong to the skeletal vibrations of benzene ring, indicating the involvement of organic ligand DHTP in the synthesis of MOF-74. The absorption peak produced by the vibrational of C–N bond in solvent DMF appeared at ∼ 1237 cm−1, indicating that solvent DMF was adsorbed on the catalyst surface or inside the pore channel. At ∼ 1198 cm−1, the absorption peak belong to the stretching vibrational of the C–O single bond. In the benzene ring of the organic ligand, the absorption peaks at ∼ 881 and 810 cm−1 represent the in-plane and out-of-plane vibrations of C–H, respectively. The adsorption peaks at ∼ 574 and 461 cm−1 were the vibrational of M–O bonds. FTIR results demonstrated that MnFe-MOF-74 has been successfully synthesized, and the doping of Fe did not change the crystal structure of the MOF-74. Fig. 2b showed the FTIR spectra of FeOx-500, MnOx-500 and Mn2Fe3Ox-500. The absorption peaks at 470–680 cm−1 in the catalyst were the stretching and bending vibrations of the M–O bond or the M–O–M bond [20]. Both peaks at ∼ 1123 and 1140 cm−1 belong to the M–O bend, and the peak at this position becomes slightly weaker with the doping of Fe. The desorption of surface lattice oxygen (Olatt) arises from the breaking of unsaturated metal-oxygen bonds [21]. Weakened M-O bond can cause an increase in surface lattice oxygen activity and redox properties, all of which are inextricably linked to the enhancement of the performance of the catalyst [22]. FTIR results confirmed that Mn2Fe3Ox-500 had a weaker M-O bond, which in turn confirms that the Fe doping gives the catalyst better catalytic oxidation performance. To specifically reveal the microscopic morphology, the samples were analyzed by SEM, EDS and HRTEM. As shown in Fig. 3 a, Mn-MOF had a typical rod-like structure with a flat surface and a length of about 9–13 μm. After calcination at 500 °C, MnOx-500 showed a small volume shrinkage, the rod-like form fractured and the material surface became rough and porous (Fig. 3b). After Fe doping, the Mn2Fe3-MOF-74 still retained its rod-like morphology, the surface became rough, and the overall stacking distribution was significantly reduced in volume, with a length of about 0.1–0.65 μm (Fig. 3c). The morphology of Mn2Fe3Ox-500 prepared by Mn2Fe3-MOF-74 calcination changed considerably and consisted of irregular nanoparticle stacks. In addition, a large number of nanopores were formed in the process of MOF calcination (Fig. 3d), which was conducive to the mass transfer of the reaction gas on Mn2Fe3Ox-500. SEM-EDS mapping of Mn2Fe3Ox-500 confirmed the presence of Mn, Fe, O, and C, indicating that Fe was indeed successfully doped into MnFe-MOF-74 and the generated composite metal oxides through calcination. It also verifies the conjecture that the non-detection of manganese oxides in XRD was attributed to the solid solution formation of Mn in the crystals. Fig. 3e,f showed the TEM images of Mn2Fe3Ox-500. In addition, it was worth noting that the HRTEM image of Mn2Fe3Ox-500 showed two distinct lattice fringes (spacing =0.25 and 0.36 nm), which was attributed to lattice spacing of (110) plane and (012) plane of Fe2O3, respectively [23]. Interestingly, no lattice fringe belonging to Mn oxides was found. According to the relevant literature, Mn may be present in an amorphous form or entered into the lattice of Fe2O3 as a solid solution [24]. To reveal the dispersion of Mn and Fe in Mn2Fe3Ox-500, we used TEM to apply EDS to map the presence of different metals, which observed that Mn and Fe are well dispersed. In addition, TEM-EDS analysis also confirmed that Mn and Fe species existed in Mn2Fe3Ox-500, which were in a highly dispersed state (Fig. 3(g–j)). Introducing another metal element would result in an increase in the dispersion of Mn species, and similar arguments have been made in studies by other scholars [25,26]. 3.2 Catalytic elimination of toluene In practical applications, the catalytic activity of the VOCs catalysts needs to maintain superior at low temperature, which is an extremely important. In this work, the typical pollutant toluene as the main target, and the catalytic activity of the sample was studied under the different conditions. The temperatures for toluene conversions of 10 %, 50 % and 90 % are denoted as T 10, T 50 and T 90. In Fig. 4 a, when the reaction temperature was below 200 °C, there was no significant difference in the conversion of toluene by various catalysts, and the conversion of toluene was below 10 %. With the increase of temperature, the difference of toluene conversion for different ratios of catalysts became progressively more apparent. Overall, the catalytic oxidation activity of monometallic MOF-derived FeOx-500 and MnOx-500 catalysts for toluene was poor, the T 90 for FeOx-500 and MnOx-500 catalysts were 321 °C and 256°C, respectively. The doping amount of Fe species in MnFeOx catalyst affected its performance. When the molar ratio of Mn: Fe was 2:3, the Mn2Fe3Ox-500 performed best with T 50, T 90 of 216 and 220 °C, respectively, which were 34 and 36 °C lower than the corresponding temperatures of MnOx-500. It was noteworthy that even at a low load with a molar ratio of Mn: Fe = 3: 1, Fe doping can still contribute significantly to the catalytic performance of MnFeOx. After determining the optimal metal composition, the different calcination temperatures (300–600 °C), a major factor affecting the catalyst performance, are also worth exploring (Fig. 4b). Mn2Fe3Ox-300, Mn2Fe3Ox-400 and Mn2Fe3Ox-500 catalysts showed higher conversion of toluene with increasing reaction temperature. Among them, Mn2Fe3Ox-500 exhibited best, the conversion rate of 1000 ppm toluene attained 90 % at 220 °C. The catalytic activity of Mn2Fe3Ox-300 and Mn2Fe3Ox-400 had little difference, both reaching 90 % toluene conversion at 250 °C, while the toluene conversion of Mn2Fe3Ox-600 at 246 °C was only 10 %. Therefore, the calcination temperature of 500 °C was chosen for the preparation of Mn2Fe3Ox-500 catalyst. In view of practical applications, the effect of different WHSV on the performance of Mn2Fe3Ox-500 catalyst for toluene was investigated. In Fig. 4c, when WHSV = 40,000 mL/(g h), the performance of T 50 and T 90 was 216 and 220 °C, respectively, which was similar to that of WHSV = 60,000 mL/(g h) (T 50= 209 °C, T 90= 219 °C). When the WHSV was reduced to 30,000 mL/(g h), T 90 was 19 °C lower than the corresponding temperature of 40,000 mL/(g h). However, when the WHSV was increased 4 times, the T 90 changed from 201 to 251 °C. The lower the WHSV value, the longer the residence time of toluene on the catalyst surface and the more thorough the contact with the activated species, which was the reason for the catalytic enhancement. 3.3 Stability and water resistance of catalysts The stability and reusability of the catalyst require further investigation. In Fig. 5 a, the toluene conversion of MnOx-500 at 250°C remained constant over 36 h. Mn2Fe3Ox-500 could maintain the conversion rate of 90 % at its optimum reaction temperature (220 °C) for 36 h in a continuous reaction, indicating that the MOF derived catalytic materials had excellent stability, which was conducive to practical application. Mn2Fe3Ox-500 showed good reproducibility in three consecutive degradations of toluene with similar conversion rates (Fig. 5b). In practical industrial applications, catalysts are forced to consider the negative impact that water vapor can have on catalyst performance. When feed gas contained water vapor, the catalytic activity and stability were reduced, mainly due to competitive negative effects [27]. Here, Fig. 5c showed the catalytic oxidation performance of MnOx-500 and Mn2Fe3Ox-500 on toluene in the absence/presence of 5 and 10 vol.% H2O. The toluene conversion of MnOx-500 was at 80 % at 250 °C after water vapor was cut off, then in the presence of 5 and 10 vol.% H2O, the performance dropped to 65 % and 55 % respectively. After stopping H2O injection, the toluene conversion could gradually return to 75 % after a certain period of time, indicating that the effect of water vapor was irreversible. Surprisingly, under high humidity conditions (10 vol.% H2O vapor), the toluene conversion of Mn2Fe3Ox-500 at 220°C remained almost unaffected at over 90 %. After water vapor testing and stability testing, there was no significant change in the functional groups on the surface of the Mn2Fe3Ox-500 catalyst (Fig. 5d). In all, Mn2Fe3Ox-500 performed well in terms of catalytic activity, stability, and water resistance. 3.4 Catalytic mechanism and reaction pathway of VOCs degradation FeOx-500, MnOx-500 and Mn2Fe3Ox-500 catalysts were studied by XPS analysis to analyze the surface element valence and species (Fig. 6 ). In the complete XPS spectrum (Fig. 6a), Fe, O and C existed simultaneously on the surface of FeOx-500, and the content of each element were 23.87 %, 48.19 % and 27.94 %, respectively. Elemental contents of Mn, O and C in MnOx-500 were 22.62 %, 51.47 % and 25.91 %, respectively. While on the surface of Mn2Fe3Ox-500, the contents of Mn, Fe, O and C were 10.21 %, 11.87 %, 53.35 % and 24.58 %, respectively. In the O 1s XPS spectrum of MnOx-500, FeOx-500 and Mn2Fe3Ox-500, the lattice oxygen (Olatt) and surface physics/chemisorption of oxygen (Oads) were appeared at ∼ 529.7 and 531.2 eV, respectively (Fig. 6b). Oads are usually more migratory than Olatt, favoring the catalytic oxidation of VOCs [28]. Rapidly consumed lattice oxygen was continuously supplemented by a large amount of adsorbed oxygen [29]. Adsorbed oxygen actively participates in the catalytic reaction process, which improved the activity of the catalyst. Also, the Oads can roughly represent oxygen vacancies [30]. The higher ratio of Oads/Olatt (0.88) on Mn2Fe3Ox-500 made it contain more chemisorbed oxygen and higher oxygen migration capacity, which facilitated the catalytic reaction of Mn2Fe3Ox-500 for toluene. Fig. 6c showed the Mn 2p XPS spectrum. The asymmetrical Mn 2p3/2 peak of the MnOx-500 featured at the binding energies of ∼644.9, 642.3 and 640.9 eV were assigned to Mn4+, Mn3+ and Mn2+ species. After fitting the Mn 2p3/2 peak of Mn2Fe3Ox-500, the subpeaks at binding energies of ∼ 645.1, 642.1 and 640.9 eV correspond to Mn4+, Mn3+ and Mn2+, respectively [31,32]. The binding energies of Mn4+ and Mn3+ changed after the introduction of Fe into the MnOx-500 catalyst, suggesting possible electron transfer between Mn4+, Mn3+, Fe3+ and Fe2+. The ratio Mn3+/ Mn4+ in MnOx-500 and Mn2Fe3Ox-500 were calculated to be 2.2 and 2.8 respectively. Apparently, the higher content of Mn3+ in the Mn2Fe3-MOF-74 derived Mn2Fe3Ox-500 catalyst indicated that the presence of interactions between Fe and Mn, which are consistence with the H2-TPR results [33]. It had been proved that high concentration of Mn3+ was conducive to the formation of oxygen vacancy and promoted the overall catalytic performance of toluene [20,34,35]. The curves of Fe 2p XPS spectrum were also shown in Fig. 6d. There were two distinct peaks at ∼ 710.0 and 723.8 eV belonging to Fe 2p3/2 and Fe 2p1/2, respectively. There are two weak peaks at ∼ 731.2 and 718.0 eV in the spectrum corresponding to the companion peaks of the Fe 2p1/2 and Fe 2p3/2 orbital. The Fe 2p3/2 peak of the Mn2Fe3Ox-500 catalyst was divided into two peaks, the peak at ∼ 709.8 eV corresponded to the Fe2+, and the peak at ∼ 711.7 eV corresponded to the Fe3+. The ratio Fe3+/ Fe2+ in Mn2Fe3Ox-500, and FeOx-500 were calculated to be 1.6 and 1.7 respectively, indicating that the Fe species existed mainly in the Fe3+ form. In all, Mn2Fe3Ox-500 catalyst exhibited excellent catalytic performance with abundant Fe3+, Mn3+, and Oads species on the surface. It can be speculated that the promotion of toluene oxidation by Mn2Fe3Ox-500 was due to the synergistic effect between MnOx and FeOx species, which was caused by the interaction of their electronic structures [36]. The C 1s XPS spectrum can be split into three peaks corresponding to the three signals C=C/C-C (284.8 eV), C-OH (286.2 eV) and HO-C=O (288.5 eV) (Fig. 6e). As can be observed from the C 1s peak of the Mn2Fe3Ox-500 catalyst, the spectrum of Mn2Fe3Ox-500 showed an increase in the relative content of C-OH ratio to 32.2 % as compared to FeOx-500, MnOx-500 catalyst, while the relative contents of C=O/C-C and HO-C=O decrease to 56.1 and 11.6 %, demonstrating that the Mn2Fe3Ox-500 catalyst was rich in oxygen-containing functional groups [37]. A large number of oxygen-containing functional groups can play a synergistic role in anchoring the metal atoms, which will directly affect the catalytic effect [38–41]. The redox properties of a catalyst affect its catalytic performance. The redox performance of FeOx-500, MnOx-500 and Mn2Fe3Ox-500 catalysts was investigated using the H2-TPR analysis (Fig. 7 a). The reduction peak of FeOx-500 catalyst appeared at ∼ 436 °C. For MnOx-500 catalyst, only one reduction peak could be observed at ∼ 612 °C, which was probably the result of the reduction of Mn3O4 to MnO [20]. After Fe doping, two reduction peaks could be observed at ∼ 447 and 644 °C. The peak at ∼ 447 °C was the result of the simultaneous reduction of Mn2O3→Mn3O4, Fe2O3→FeO [26]. At ∼ 644 °C, it was assigned to the reduction of Mn3O4 to MnO and FeO to Fe [42,43]. Compared to FeOx-500 and MnOx-500, Mn2Fe3Ox-500 had a lower temperature reduction peak and the redox properties of Mn2Fe3Ox-500 were better, which was more favorable for the catalytic reactions to take place. It was confirmed by H2-TPR that Fe species could enhance the redox ability of MOF derived metal oxide catalysts. The results corresponded to the catalytic performance of Mn2Fe3Ox-500. The better low-temperature reduction of Mn2Fe3Ox-500 was closely related to its enhanced catalytic activity. For O2-TPD analysis, different oxygen species on FeOx-500, MnOx-500 and Mn2Fe3Ox-500 catalysts were studied (Fig. 7b). Generally, there were two main temperature regions for O2 desorption: below 150 °C and above 150 °C. The low- and high- temperature regions can be related to the type of oxygen [35]. Compared with the O2-TPD spectrum of FeOx-500 and MnOx-500 sample, one Oads peak could be observed at ∼ 130 °C in Mn2Fe3Ox-500, more surface adsorbed oxygen existed in Mn2Fe3Ox-500, which facilitated performance. Additionally, the desorption peak area of Olatt was significantly increased in Mn2Fe3Ox-500, indicating the presence of more abundant oxygen species in Mn2Fe3Ox-500. O2-TPD results confirmed that the active surface lattice oxygen increased with Fe doping. Moreover, more abundant surface oxygen species played a positive role in promoting the degradation of toluene on the Mn2Fe3Ox-500 surface. The intermediates and degradation pathways of the catalytic oxidation reaction of toluene were investigated using in-situ DRIFTS to explore possible mechanisms. First, the adsorption of toluene on Mn2Fe3Ox-500 catalyst was observed at 50 °C (Fig. 8 ). In the 1000-3500 cm−1 range, the characteristic peaks of toluene and CO2 appeared. The typical skeleton ν (C-H) stretching vibration peak (∼ 3036 cm−1) of toluene and the stretching vibration peak (∼ 2365 cm−1) of CO2 appeared [44]. Few intermediates and end products were detected at low temperature, suggesting that the Mn2Fe3Ox-500 was relatively stable at low temperature, and difficult to oxidize. Typically, the reaction mechanism of VOCs oxidation included Langmuir-Hinshelwood (L-H) mechanism, Eley-Rideal (E-R) mechanism and Mars-van Krevelen (MvK) mechanism. The current research generally believes that it is possible to explain the degradation of VOCs over metal oxide catalysts by the MvK mechanism [45]. Olatt reacted with the molecules of VOCs on the catalyst surface, and the subsequent oxygen vacancies created were replenished by gaseous oxygen, thus continuing the cycle allowing the catalytic oxidation reaction to continue [30]. By in-situ DRIFTS experiments, it revealed the mechanism of toluene degradation over Mn2Fe3Ox-500 catalyst. The in-situ DRIFTS of Mn2Fe3Ox-500 catalyst to toluene/N2 and toluene/N2/O2 was carried out at different temperatures. After toluene/N2 adsorption on the catalyst surface, some characteristic peaks were observed (Fig. 9 (a and b)). The peaks observed at ∼ 1594 and 1486 cm−1 were C=C stretching vibration. The peak at ∼ 3069 was the stretching vibration of phenylic C-H, and the peaks at ∼ 3031 cm−1 was the vibration of asymmetric methyl group. The peak at ∼ 1233 cm−1 was thought to be the C-O bonding vibrational peak of the phenolic species on the catalyst surface, indicating that phenol was formed from toluene during the oxidation reaction. It was obvious that with the passage of time, the gradual adsorption of toluene on the catalyst surface increased the peak strength of toluene [46–48]. In addition, all online DRIFTS displayed the end product CO2 appear around ∼ 2360 and 2338 cm−1, which was probably produced by the lattice oxygen reaction of toluene and catalyst [49]. The spectral peak at ∼ 1025 cm−1 started to appear at 200 °C and was a characteristic peak for alcohols. Toluene could interact with active oxygen to form benzyl species. At ∼ 1669 cm−1, the peak was considered to be the (C=O) stretching vibration peak of the alkoxide species, indicating that benzaldehyde was an important class of intermediate product. The peak at ∼ 1406 cm−1 was to the C-O stretching vibration peak of benzoic acid, and benzoic acid was the intermediate of toluene degradation on Mn2Fe3Ox-500 catalyst [50]. The (C-C) stretching vibrational peaks of the formic acid species (-COO) were observed at ∼ 1180 and 1451 cm−1, indicating that the benzene ring had been completely disrupted. The characteristic peak of maleic anhydride appeared at ∼ 1316 cm−1. The results indicated that key intermediates, such as benzyl alcohol, phenol, maleic anhydride, benzaldehyde, benzoic acid, were still detected in the absence of O2. Moreover, it was shown that the Olatt was involved in the degradation of intermediates such as benzoic acid during the degradation of adsorbed toluene [51]. With the introduction of 20 vol.% O2, all peaks increased in intensity, indicating O2 promoted the oxidative degradation reaction of toluene (Fig. 9a). The characteristic peaks of toluene from ∼ 3036 and 3074 cm−1 become progressively weaker with increasing temperature, indicating that toluene was slowly and oxidized to H2O and CO2. A weak vibrational peak (∼ 1156 cm−1) related to stretching vibration of the C-O was observed, indicating the formation of benzoyl oxides (C6H5-CH2-O) on the catalyst surface. The ∼ 1509 cm−1 peak occurred as the temperature rose to 200 °C, representing the maleic anhydride substance, indicating that the benzene ring of toluene had started to break [52–54]. The peak attributed to maleic anhydride became stronger as the temperature increased. And the (C-C) stretching vibration peak of the formic acid species (-COO) was observed at ∼ 1547 cm−1, indicating that the benzene ring had been completely disrupted [55]. Therefore, the pathway of toluene degradation on Mn2Fe3Ox-500 was proposed as shown in Fig. 10 . 4 Conclusions In this work, the bimetallic MnFe-MOF-74 was successfully converted to MnFeOx catalyst by in-situ pyrolysis for the removal of toluene. The Mn2Fe3Ox-500 catalyst with exceptional performance was obtained by adjusting the preparation parameters such as the molar ratio of Mn/Fe, calcination conditions. Mn2Fe3Ox-500 also performed outstanding catalytic durability at high water vapor content and over 36 h of continuous reaction. Superior catalytic performance and durability of the Mn2Fe3Ox-500 catalyst in toluene removal is inextricably linked to its good low-temperature reducibility, abundant Oads species, high concentration of Mn3+/ Mn4+ and strong interaction between Mn and Fe species. Besides, the in-situ DRIFTS results indicated both Oads and Olatt can be involved in the catalytic oxidation of toluene. During the degradation process, maleic anhydride, benzaldehyde, benzyl alcohol, and benzoic acid were produced, and finally converted to H2O and CO2. In all, this work showed that the use of MOFs-derived bimetallic oxide catalysts could effectively eliminate toluene pollutants through catalytic oxidation technology, which provided theoretical and experimental basis for air pollution control in the actual environment. CRediT authorship contribution statement Yuxin Wang: Resources, Investigation, Writing – original draft. Zhenyu Chen: Visualization, Data curation. Shixu Lu: Formal analysis, Validation. Shuaishuai Xin: Supervision, Project administration. Guocheng Liu: Validation, Supervision. Chengzhi Zhou: Project administration. Yanjun Xin: Resources, Writing – review & editing, Funding acquisition. Qiang Wang: Resources, Supervision. Qianwen Wang: Investigation, Supervision. Yuxia Wang: Software, Supervision. Tianshan Xue: Resources, Writing – review & editing. Qinghua Yan: Conceptualization, Writing – review & editing, Funding acquisition. Declaration of Competing Interest The authors declare that they have no known competing financial interests or personal relationships that could have appeared to influence the work reported in this paper. Acknowledgments This work was supported by the Natural Science Foundation of Shandong Province (No. ZR2020QE241), National Natural Science Foundation of China (No. 52100126, 52070107), and Research Foundation for Talented Scholars of Qingdao Agricultural University (No. 6651120024). In addition, this work thanks to the support of Qingdao Agricultural University Analysis and Testing Center. References [1] B. Gu L. Zhang R. Van Dingenen M. Vieno H.J. Van Grinsven X. Zhang S. Zhang Y. Chen S. Wang C. Ren S. Rao M. Holland W. Winiwarter D. Chen J. Xu M.A. Sutton Abating ammonia is more cost-effective than nitrogen oxides for mitigating PM2.5 air pollution Science 374 2021 758 762 10.1126/science.abf8623 B. Gu, L. Zhang, R. Van Dingenen, M. Vieno, H.J. Van Grinsven, X. Zhang, S. Zhang, Y. Chen, S. Wang, C. Ren, S. Rao, M. Holland, W. Winiwarter, D. Chen, J. Xu, M.A. Sutton, Abating ammonia is more cost-effective than nitrogen oxides for mitigating PM2.5 air pollution, Science. 374 (2021) 758–762. 10.1126/science.abf8623. [2] M. Qu Z. Cheng Z. Sun D. Chen J. Yu J. Chen Non-thermal plasma coupled with catalysis for VOCs abatement: A review Process Saf. Environ. Prot. 153 2021 139 158 10.1016/j.psep.2021.06.028 M. Qu, Z. Cheng, Z. Sun, D. Chen, J. Yu, J. Chen, Non-thermal plasma coupled with catalysis for VOCs abatement: a review, Process Saf. Environ. Prot. 153 (2021) 139–158. 10.1016/j.psep.2021.06.028. [3] M. Wen F. Dong Z. Tang J. Zhang Engineering order mesoporous CeCoOx catalyst via in-situ confined encapsulation strategy for VOCs catalytic combustion Mol. Catal. 519 2022 112149 10.1016/j.mcat.2022.112149 M. Wen, F. Dong, Z. Tang, J. Zhang, Engineering order mesoporous CeCoOx catalyst via in-situ confined encapsulation strategy for VOCs catalytic combustion, Mol. Catal. 519 (2022) 112149. 10.1016/j.mcat.2022.112149. [4] Y. Wang F. Bi Y. Wang M. Jia X. Tao Y. Jin X. Zhang MOF-derived CeO2 supported Ag catalysts for toluene oxidation: the effect of synthesis method Mol. Catal. 515 2021 111922 10.1016/j.mcat.2021.111922 Y. Wang, F. Bi, Y. Wang, M. Jia, X. Tao, Y. Jin, X. Zhang, MOF-derived CeO2 supported Ag catalysts for toluene oxidation: the effect of synthesis method, Mol. Catal. 515 (2021) 111922. 10.1016/j.mcat.2021.111922. [5] Z. Li D.P. Yang Y. Chen Z. Du Y. Guo J. Huang Q. Li Waste eggshells to valuable Co3O4/CaCO3 materials as efficient catalysts for VOCs oxidation Mol. Catal. 483 2020 110766 10.1016/j.mcat.2020.110766 Z. Li, D.P. Yang, Y. Chen, Z. Du, Y. Guo, J. Huang, Q. Li, Waste eggshells to valuable Co3O4/CaCO3 materials as efficient catalysts for VOCs oxidation, Mol. Catal. 483 (2020) 110766. 10.1016/j.mcat.2020.110766. [6] R. Camposeco A.E. Torres R. Zanella Catalytic oxidation of propane over Pt-Pd bimetallic nanoparticles supported on TiO2 Mol. Catal. 532 2022 112738 10.1016/j.mcat.2022.112738 R. Camposeco, A.E. Torres, R. Zanella, Catalytic oxidation of propane over Pt-Pd bimetallic nanoparticles supported on TiO2, Mol. Catal. 532 (2022) 112738. 10.1016/j.mcat.2022.112738. [7] N. Xiang X. Han Y. Bai Q. Li J. Zheng Y. Li Y. Hou Z. Huang Size effect of γ-Al2O3 supports on the catalytic performance of Pd/γ-Al2O3 catalysts for HCHO oxidation Mol. Catal. 494 2020 111112 10.1016/j.mcat.2020.111112 N. Xiang, X. Han, Y. Bai, Q. Li, J. Zheng, Y. Li, Y. Hou, Z. Huang, Size effect of γ-Al2O3 supports on the catalytic performance of Pd/γ-Al2O3 catalysts for HCHO oxidation, Mol. Catal. 494 (2020) 111112. 10.1016/j.mcat.2020.111112. [8] V. Brummer S.Y. Teng D. Jecha P. Skryja V. Vavrcikova P. Stehlik Contribution to cleaner production from the point of view of VOC emissions abatement: a review J. Clean. Prod. 361 2022 132112 10.1016/j.jclepro.2022.132112 V. Brummer, S.Y. Teng, D. Jecha, P. Skryja, V. Vavrcikova, P. Stehlik, Contribution to cleaner production from the point of view of VOC emissions abatement: a review, J. Clean. Prod. 361 (2022) 132112. 10.1016/j.jclepro.2022.132112. [9] X. Wang T. Wei Y. Wen C. Yang D. Ye S. Li W. Li Catalytic ozonation of toluene and dichloromethane mixture at low temperatures over modified MnOx-based catalyst Process Saf. Environ. Prot. 171 2023 447 458 10.1016/j.psep.2023.01.015 X. Wang, T. Wei, Y. Wen, C. Yang, D. Ye, S. Li, W. Li, Catalytic ozonation of toluene and dichloromethane mixture at low temperatures over modified MnOx-based catalyst, Process Saf. Environ. Prot. 171 (2023) 447–458. 10.1016/j.psep.2023.01.015. [10] L. Yang Q. Liu R. Han K. Fu Y. Su Y. Zheng X. Wu C. Song N. Ji X. Lu D. Ma Confinement and synergy effect of bimetallic Pt-Mn nanoparticles encapsulated in ZSM-5 zeolite with superior performance for acetone catalytic oxidation Appl. Catal. B: Environ. 309 2022 121224 10.1016/j.apcatb.2022.121224 L. Yang, Q. Liu, R. Han, K. Fu, Y. Su, Y. Zheng, X. Wu, C. Song, N. Ji, X. Lu, D. Ma, Confinement and synergy effect of bimetallic Pt-Mn nanoparticles encapsulated in ZSM-5 zeolite with superior performance for acetone catalytic oxidation, Appl. Catal. B Environ. 309 (2022) 121224. 10.1016/j.apcatb.2022.121224. [11] J. Cañón M. Velasquez R. Molina S. Moreno CoMnMgAl mixed oxides prepared by a microwave assisted self-combustion synthesis for toluene total oxidation Mol. Catal. 493 2020 111080 10.1016/j.mcat.2020.111080 J. Cañón, M. Velasquez, R. Molina, S. Moreno, CoMnMgAl mixed oxides prepared by a microwave assisted self-combustion synthesis for toluene total oxidation, Mol. Catal. 493 (2020) 111080. 10.1016/j.mcat.2020.111080. [12] M. Hasanzadeh A. Simchi H. Shahriyari Far Nanoporous composites of activated carbon-metal organic frameworks for organic dye adsorption: synthesis, adsorption mechanism and kinetics studies J. Ind. Eng. Chem. 81 2020 405 414 10.1016/j.jiec.2019.09.031 M. Hasanzadeh, A. Simchi, H. Shahriyari Far, Nanoporous composites of activated carbon-metal organic frameworks for organic dye adsorption: synthesis, adsorption mechanism and kinetics studies, J. Ind. Eng. Chem. 81 (2020) 405–414. 10.1016/j.jiec.2019.09.031. [13] Y. Liu G. Chen J. Chen H. Niu Excellent catalytic performance of Ce–MOF with abundant oxygen vacancies supported noble metal Pt in the oxidation of toluene Catalysts 12 2022 775 10.3390/catal12070775 Y. Liu, G. Chen, J. Chen, H. Niu, Excellent catalytic performance of Ce–MOF with abundant oxygen vacancies supported noble metal Pt in the oxidation of toluene, Catalysts. 12 (2022) 775. 10.3390/catal12070775. [14] X. Gu C. Huang Z. Xu H. Wu R. Dong R. Liu J. Chen H. Zhu Core-shell Co-MOF-74@Mn-MOF-74 catalysts with controllable shell thickness and their enhanced catalytic activity for toluene oxidation J. Solid State Chem. 294 2021 121803 10.1016/j.jssc.2020.121803 X. Gu, C. Huang, Z. Xu, H. Wu, R. Dong, R. Liu, J. Chen, H. Zhu, Core-shell Co-MOF-74@Mn-MOF-74 catalysts with controllable shell thickness and their enhanced catalytic activity for toluene oxidation, J. Solid State Chem. 294 (2021) 121803. 10.1016/j.jssc.2020.121803. [15] Y.Y. Zhang M.L. Zhou Y.S. Bao M. Yang Y.H. Cui D.L. Liu Q. Wu L. Liu Z.B. Han Palladium nanoparticles encapsuled in MOF: an efficient dual-functional catalyst to produce benzylmalononitrile derivatives by one-pot reaction Mol. Catal. 518 2022 112068 10.1016/j.mcat.2021.112068 Y.Y. Zhang, M.L. Zhou, Y.S. Bao, M. Yang, Y.H. Cui, D.L. Liu, Q. Wu, L. Liu, Z.B. Han, Palladium nanoparticles encapsuled in MOF: an efficient dual-functional catalyst to produce benzylmalononitrile derivatives by one-pot reaction, Mol. Catal. 518 (2022) 112068. 10.1016/j.mcat.2021.112068. [16] N. Xiang Y. Bai Q. Li X. Han J. Zheng Q. Zhao Y. Hou Z. Huang ZIF-67-derived hierarchical hollow Co3O4@CoMn2O4 nanocages for efficient catalytic oxidation of formaldehyde at low temperature Mol. Catal. 528 2022 112519 10.1016/j.mcat.2022.112519 N. Xiang, Y. Bai, Q. Li, X. Han, J. Zheng, Q. Zhao, Y. Hou, Z. Huang, ZIF-67-derived hierarchical hollow Co3O4@CoMn2O4 nanocages for efficient catalytic oxidation of formaldehyde at low temperature, Mol. Catal. 528 (2022) 112519. 10.1016/j.mcat.2022.112519. [17] Z. Li C. Ma M. Qi Y. Li Y. Qu Y. Zhang L. Zhou J. Yun CeO2 from pyrolysis of MOFs for efficient catalytic combustion of VOCs Mol. Catal. 535 2023 112857 10.1016/j.mcat.2022.112857 Z. Li, C. Ma, M. Qi, Y. Li, Y. Qu, Y. Zhang, L. Zhou, J. Yun, CeO2 from pyrolysis of MOFs for efficient catalytic combustion of VOCs, Mol. Catal. 535 (2023) 112857. 10.1016/j.mcat.2022.112857. [18] S. Xie Q. Qin H. Liu L. Jin X. Wei J. Liu X. Liu Y. Yao L. Dong B. Li MOF-74‑M (M = Mn, Co, Ni, Zn, MnCo, MnNi, and MnZn) for low temperature NH3‑SCR and in situ DRIFTS study reaction mechanism ACS Appl. Mater. Interfaces 12 2020 48476 48485 10.1021/acsami.0c11035 S. Xie, Q. Qin, H. Liu, L. Jin, X. Wei, J. Liu, X. Liu, Y. Yao, L. Dong, B. Li, MOF-74‑M (M = Mn, Co, Ni, Zn, MnCo, MnNi, and MnZn) for low temperature NH3‑SCR and in situ DRIFTS study reaction mechanism, ACS Appl. Mater. Interfaces 12 (2020) 48476–48485. 10.1021/acsami.0c11035. [19] A. Wang M. Luo B. Lü Y. Song Z. Yang M. Li B. Shi I. Khan MOF-derived porous carbon-supported bimetallic fischer–tropsch synthesis catalysts Ind. Eng. Chem. Res. 61 2022 3941 3951 10.1021/acs.iecr.1c03810 A. Wang, M. Luo, B. Lü, Y. Song, Z. Yang, M. Li, B. Shi, I. Khan, MOF-derived porous carbon-supported bimetallic fischer–tropsch synthesis catalysts, Ind. Eng. Chem. Res. 61 (2022) 3941–3951. 10.1021/acs.iecr.1c03810. [20] X. Zhang X. Lv F. Bi G. Lu Y. Wang Highly efficient Mn2O3 catalysts derived from Mn-MOFs for toluene oxidation: the influence of MOFs precursors Mol. Catal. 482 2020 110701 10.1016/j.mcat.2019.110701 X. Zhang, X. Lv, F. Bi, G. Lu, Y. Wang, Highly efficient Mn2O3 catalysts derived from Mn-MOFs for toluene oxidation: the influence of MOFs precursors, Mol. Catal. 482 (2020) 110701. 10.1016/j.mcat.2019.110701. [21] Y.Y. Li W.P. Zhang J. Zhao K. Wu H. Xiao J.R. Li Highly efficient acetone oxidation over homogeneous Mn-Al oxides with enhanced OMS-2 active phase Mol. Catal. 537 2023 112952 10.1016/j.mcat.2023.112952 Y.Y. Li, W.P. Zhang, J. Zhao, K. Wu, H. Xiao, J.R. Li, Highly efficient acetone oxidation over homogeneous Mn-Al oxides with enhanced OMS-2 active phase, Mol. Catal. 537 (2023) 112952. 10.1016/j.mcat.2023.112952. [22] C. Shan Y. Zhang Q. Zhao K. Fu Y. Zheng R. Han C. Liu N. Ji W. Wang Q. Liu Acid etching-induced in situ growth of λ-MnO2 over CoMn spinel for low-temperature volatile organic compound oxidation Environ. Sci. Technol. 56 2022 10381 10390 10.1021/acs.est.2c02483 C. Shan, Y. Zhang, Q. Zhao, K. Fu, Y. Zheng, R. Han, C. Liu, N. Ji, W. Wang, Q. Liu, Acid etching-induced in situ growth of λ-MnO2 over CoMn spinel for low-temperature volatile organic compound oxidation, Environ. Sci. Technol. (2022) acs.est.2c02483. 10.1021/acs.est.2c02483. [23] X. Zhang L. Ren L. Sun Z. Huo B. Tan N. Feng H. Wan G. Guan Fe-doped MnO2 as an efficient catalyst for low temperature propane oxidation Mol. Catal. 549 2023 113468 10.1016/j.mcat.2023.113468 X. Zhang, L. Ren, L. Sun, Z. Huo, B. Tan, N. Feng, H. Wan, G. Guan, Fe-doped MnO2 as an efficient catalyst for low temperature propane oxidation, Mol. Catal. 549 (2023) 113468. 10.1016/j.mcat.2023.113468. [24] C. Hu T.R. Su T.J. Lin C.W. Chang K.L. Tung Yellowish and blue luminescent graphene oxide quantum dots prepared via a microwave-assisted hydrothermal route using H2O2 and KMnO4 as oxidizing agents New J. Chem. 42 2018 3999 4007 10.1039/C7NJ03337K C. Hu, T.R. Su, T.J. Lin, C.W. Chang, K.L. Tung, Yellowish and blue luminescent graphene oxide quantum dots prepared via a microwave-assisted hydrothermal route using H2O2 and KMnO4 as oxidizing agents, New J. Chem. 42 (2018) 3999–4007. 10.1039/C7NJ03337K. [25] C. Shi Y. Wang A. Zhu B. Chen C. Au MnxCo3−xO4 solid solution as high-efficient catalysts for low-temperature oxidation of formaldehyde Catal. Commun. 28 2012 18 22 10.1016/j.catcom.2012.08.003 C. Shi, Y. Wang, A. Zhu, B. Chen, C. Au, MnxCo3−xO4 solid solution as high-efficient catalysts for low-temperature oxidation of formaldehyde, Catal. Commun. 28 (2012) 18–22. 10.1016/j.catcom.2012.08.003. [26] H. Yao S. Cai B. Yang L. Han P. Wang In-situ decorated MOFs-derived Mn-Fe oxides on Fe mesh as novel monolith catalysts for NOx reduction New J. Chem. 44 2020 2357 2366 10.1039/C9NJ05960A H. Yao, S. Cai, B. Yang, L. Han, P. Wang, In-situ decorated MOFs-derived Mn-Fe oxides on Fe mesh as novel monolith catalysts for NOx reduction, New J. Chem. 44 (2020) 2357–2366. 10.1039/C9NJ05960A (accessed March 27, 2022). [27] Z. Chen H. Ge P. Wang J. Sun M. Abbas J. Chen Insight into the deactivation mechanism of water on active Cu species for ester hydrogenation: experimental and theoretical study Mol. Catal. 488 2020 110919 10.1016/j.mcat.2020.110919 Z. Chen, H. Ge, P. Wang, J. Sun, M. Abbas, J. Chen, Insight into the deactivation mechanism of water on active Cu species for ester hydrogenation: experimental and theoretical study, Mol. Catal. 488 (2020) 110919. 10.1016/j.mcat.2020.110919. [28] X. Zhang S. Xiang Q. Du F. Bi K. Xie L. Wang Effect of calcination temperature on the structure and performance of rod-like MnCeOx derived from MOFs catalysts Mol. Catal. 522 2022 112226 10.1016/j.mcat.2022.112226 X. Zhang, S. Xiang, Q. Du, F. Bi, K. Xie, L. Wang, Effect of calcination temperature on the structure and performance of rod-like MnCeOx derived from MOFs catalysts, Mol. Catal. 522 (2022) 112226. 10.1016/j.mcat.2022.112226. [29] S. Zhao F. Hu J. Li Hierarchical core–shell Al2O3@Pd-CoAlO microspheres for low-temperature toluene combustion ACS Catal. 6 2016 3433 3441 10.1021/acscatal.6b00144 S. Zhao, F. Hu, J. Li, Hierarchical core–shell Al2O3@Pd-CoAlO microspheres for low-temperature toluene combustion, ACS Catal.. 6 (2016) 3433–3441. 10.1021/acscatal.6b00144. [30] Z. Li Q. Yan Q. Jiang Y. Gao T. Xue R. Li Y. Liu Q. Wang Oxygen vacancy mediated CuyCo3-yFe1Ox mixed oxide as highly active and stable toluene oxidation catalyst by multiple phase interfaces formation and metal doping effect Appl. Catal. B: Environ. 269 2020 118827 10.1016/j.apcatb.2020.118827 Z. Li, Q. Yan, Q. Jiang, Y. Gao, T. Xue, R. Li, Y. Liu, Q. Wang, Oxygen vacancy mediated CuyCo3-yFe1Ox mixed oxide as highly active and stable toluene oxidation catalyst by multiple phase interfaces formation and metal doping effect, Appl. Catal. B Environ. 269 (2020) 118827. 10.1016/j.apcatb.2020.118827. [31] Z. Wang R. Guo X. Shi X. Liu H. Qin Y. Liu C. Duan D. Guo W. Pan The superior performance of CoMnOx catalyst with ball-flowerlike structure for low-temperature selective catalytic reduction of NOx by NH3 Chem. Eng. J. 381 2020 122753 10.1016/j.cej.2019.122753 Z. Wang, R. Guo, X. Shi, X. Liu, H. Qin, Y. Liu, C. Duan, D. Guo, W. Pan, The superior performance of CoMnOx catalyst with ball-flowerlike structure for low-temperature selective catalytic reduction of NOx by NH3, Chem. Eng. J. 381 (2020) 122753. 10.1016/j.cej.2019.122753. [32] S. Ming P. Wang P. Liu J. Duan F. Mei L. Pang Z. Chen T. Li Promotional effect of metal cations doping on OMS-2 catalysts for NH3-SCR reaction Chem. Eng. J. 379 2020 122287 10.1016/j.cej.2019.122287 S. Ming, P. Wang, P. Liu, J. Duan, F. Mei, L. Pang, Z. Chen, T. Li, Promotional effect of metal cations doping on OMS-2 catalysts for NH3-SCR reaction, Chem. Eng. J. 379 (2020) 122287. 10.1016/j.cej.2019.122287. [33] Y. Luo Y. Zheng J. Zuo X. Feng X. Wang T. Zhang K. Zhang L. Jiang Insights into the high performance of Mn-Co oxides derived from metal-organic frameworks for total toluene oxidation J. Hazard. Mater. 349 2018 119 127 10.1016/j.jhazmat.2018.01.053 Y. Luo, Y. Zheng, J. Zuo, X. Feng, X. Wang, T. Zhang, K. Zhang, L. Jiang, Insights into the high performance of Mn-Co oxides derived from metal-organic frameworks for total toluene oxidation, J. Hazard. Mater. 349 (2018) 119–127. 10.1016/j.jhazmat.2018.01.053. [34] S. Wu H. Liu Z. Huang H. Xu W. Shen O-vacancy-rich porous MnO2 nanosheets as highly efficient catalysts for propane catalytic oxidation Appl. Catal. B: Environ. 312 2022 121387 10.1016/j.apcatb.2022.121387 S. Wu, H. Liu, Z. Huang, H. Xu, W. Shen, O-vacancy-rich porous MnO2 nanosheets as highly efficient catalysts for propane catalytic oxidation, Appl. Catal. B Environ. 312 (2022) 121387. 10.1016/j.apcatb.2022.121387. [35] X. Zhang F. Bi Z. Zhu Y. Yang S. Zhao J. Chen X. Lv Y. Wang J. Xu N. Liu The promoting effect of H2O on rod-like MnCeOx derived from MOFs for toluene oxidation: a combined experimental and theoretical investigation Appl. Catal. B: Environ. 297 2021 120393 10.1016/j.apcatb.2021.120393 X. Zhang, F. Bi, Z. Zhu, Y. Yang, S. Zhao, J. Chen, X. Lv, Y. Wang, J. Xu, N. Liu, The promoting effect of H2O on rod-like MnCeOx derived from MOFs for toluene oxidation: a combined experimental and theoretical investigation, Appl. Catal. B Environ. 297 (2021) 120393. 10.1016/j.apcatb.2021.120393. [36] F. Zhao G. Zhang Z. Tang F. Zha Construction of fluffy MnFe nanoparticles and their synergistic catalysis for selective catalytic reduction reaction at low temperature Fuel 322 2022 124185 10.1016/j.fuel.2022.124185 F. Zhao, G. Zhang, Z. Tang, F. Zha, Construction of fluffy MnFe nanoparticles and their synergistic catalysis for selective catalytic reduction reaction at low temperature, Fuel. 322 (2022) 124185. 10.1016/j.fuel.2022.124185. [37] S. Xin G. Liu X. Ma J. Gong B. Ma Q. Yan Q. Chen D. Ma G. Zhang M. Gao Y. Xin High efficiency heterogeneous Fenton-like catalyst biochar modified CuFeO2 for the degradation of tetracycline: economical synthesis, catalytic performance and mechanism Appl. Catal. B: Environ. 280 2021 119386 10.1016/j.apcatb.2020.119386 S. Xin, G. Liu, X. Ma, J. Gong, B. Ma, Q. Yan, Q. Chen, D. Ma, G. Zhang, M. Gao, Y. Xin, High efficiency heterogeneous Fenton-like catalyst biochar modified CuFeO2 for the degradation of tetracycline: economical synthesis, catalytic performance and mechanism, Appl. Catal. B Environ. 280 (2021) 119386. 10.1016/j.apcatb.2020.119386. [38] Z. Zhang G. He Y. Li C. Zhang J. Ma H. He Effect of hydroxyl groups on metal anchoring and formaldehyde oxidation performance of Pt/Al2O3 Environ. Sci. Technol. 56 2022 10916 10924 10.1021/acs.est.2c01278 Z. Zhang, G. He, Y. Li, C. Zhang, J. Ma, H. He, Effect of hydroxyl groups on metal anchoring and formaldehyde oxidation performance of Pt/Al2O3, Environ. Sci. Technol. 56 (2022) 10916–10924. 10.1021/acs.est.2c01278. [39] X. Li J. Zhang Y. Han M. Zhu S. Shang W. Li MOF-derived various morphologies of N-doped carbon composites for acetylene hydrochlorination J. Mater. Sci. 53 2018 4913 4926 10.1007/s10853-017-1951-3 X. Li, J. Zhang, Y. Han, M. Zhu, S. Shang, W. Li, MOF-derived various morphologies of N-doped carbon composites for acetylene hydrochlorination, J. Mater. Sci. 53 (2018) 4913–4926. 10.1007/s10853-017-1951-3. [40] J. Qu D. Chen N. Li Q. Xu H. Li J. He J. Lu Construction of Pd-modified NiCoOx hollow nanospheres with surface hydroxyls and oxygen vacancies for highly enhanced catalytic toluene oxidation activity ACS Sustain. Chem. Eng. 8 2020 10581 10587 10.1021/acssuschemeng.0c03755 J. Qu, D. Chen, N. Li, Q. Xu, H. Li, J. He, J. Lu, Construction of Pd-modified NiCoOx hollow nanospheres with surface hydroxyls and oxygen vacancies for highly enhanced catalytic toluene oxidation activity, ACS Sustain. Chem. Eng. 8 (2020) 10581–10587. 10.1021/acssuschemeng.0c03755. [41] X. Yu L. Dai J. Deng Y. Liu L. Jing X. Zhang X. Jiang Z. Hou J. Wang H. Dai Catalytic performance and intermediates identification of trichloroethylene deep oxidation over Ru/3DOM SnO2 catalysts J. Catal. 400 2021 310 324 10.1016/j.jcat.2021.06.010 X. Yu, L. Dai, J. Deng, Y. Liu, L. Jing, X. Zhang, X. Jiang, Z. Hou, J. Wang, H. Dai, Catalytic performance and intermediates identification of trichloroethylene deep oxidation over Ru/3DOM SnO2 catalysts, J. Catal. 400 (2021) 310–324. 10.1016/j.jcat.2021.06.010. [42] T. Zhang X. Qin Y. Peng C. Wang H. Chang J. Chen J. Li Effect of Fe precursors on the catalytic activity of Fe/SAPO-34 catalysts for N2O decomposition Catal. Commun. 128 2019 105706 10.1016/j.catcom.2019.05.013 T. Zhang, X. Qin, Y. Peng, C. Wang, H. Chang, J. Chen, J. Li, Effect of Fe precursors on the catalytic activity of Fe/SAPO-34 catalysts for N2O decomposition, Catal. Commun. 128 (2019) 105706. 10.1016/j.catcom.2019.05.013. [43] G. Li B. Wang H. Wang J. Ma W.Q. Xu Y. Li Y. Han Q. Sun Fe and/or Mn oxides supported on fly ash-derived SBA-15 for low-temperature NH3-SCR Catal. Commun. 108 2018 82 87 10.1016/j.catcom.2018.01.035 G. Li, B. Wang, H. Wang, J. Ma, W.Q. Xu, Y. Li, Y. Han, Q. Sun, Fe and/or Mn oxides supported on fly ash-derived SBA-15 for low-temperature NH3-SCR, Catal. Commun. 108 (2018) 82–87. 10.1016/j.catcom.2018.01.035. [44] M. Wen F. Dong J. Yao Z. Tang J. Zhang Pt nanoparticles confined in the ordered mesoporous CeO2 as a highly efficient catalyst for the elimination of VOCs J. Catal. 412 2022 42 58 10.1016/j.jcat.2022.05.022 M. Wen, F. Dong, J. Yao, Z. Tang, J. Zhang, Pt nanoparticles confined in the ordered mesoporous CeO2 as a highly efficient catalyst for the elimination of VOCs, J. Catal. 412 (2022) 42–58. 10.1016/j.jcat.2022.05.022. [45] P. Wang J. Wang X. An J. Shi W. Shangguan X. Hao G. Xu B. Tang A. Abudula G. Guan Generation of abundant defects in Mn-Co mixed oxides by a facile agar-gel method for highly efficient catalysis of total toluene oxidation Appl. Catal. B: Environ. 282 2021 119560 10.1016/j.apcatb.2020.119560 P. Wang, J. Wang, X. An, J. Shi, W. Shangguan, X. Hao, G. Xu, B. Tang, A. Abudula, G. Guan, Generation of abundant defects in Mn-Co mixed oxides by a facile agar-gel method for highly efficient catalysis of total toluene oxidation, Appl. Catal. B Environ. 282 (2021) 119560. 10.1016/j.apcatb.2020.119560. [46] S. Mo Q. Zhang Y. Sun M. Zhang J. Li Q. Ren M. Fu J. Wu L. Chen D. Ye Gaseous CO and toluene co-oxidation over monolithic core–shell Co3O4-based hetero-structured catalysts J. Mater. Chem. A 7 2019 16197 16210 10.1039/C9TA03750K S. Mo, Q. Zhang, Y. Sun, M. Zhang, J. Li, Q. Ren, M. Fu, J. Wu, L. Chen, D. Ye, Gaseous CO and toluene co-oxidation over monolithic core–shell Co3O4-based hetero-structured catalysts, J. Mater. Chem. A 7 (2019) 16197–16210. 10.1039/C9TA03750K. [47] Y. Wang J. Wu G. Wang D. Yang T. Ishihara L. Guo Oxygen vacancy engineering in Fe doped akhtenskite-type MnO2 for low-temperature toluene oxidation Appl. Catal. B: Environ. 285 2021 119873 10.1016/j.apcatb.2020.119873 Y. Wang, J. Wu, G. Wang, D. Yang, T. Ishihara, L. Guo, Oxygen vacancy engineering in Fe doped akhtenskite-type MnO2 for low-temperature toluene oxidation, Appl. Catal. B Environ. 285 (2021) 119873. 10.1016/j.apcatb.2020.119873. [48] E. Yu J. Li J. Chen J. Chen Z. Hong H. Jia Enhanced photothermal catalytic degradation of toluene by loading Pt nanoparticles on manganese oxide: photoactivation of lattice oxygen J. Hazard. Mater. 388 2020 121800 10.1016/j.jhazmat.2019.121800 E. Yu, J. Li, J. Chen, J. Chen, Z. Hong, H. Jia, Enhanced photothermal catalytic degradation of toluene by loading Pt nanoparticles on manganese oxide: photoactivation of lattice oxygen, J. Hazard. Mater. 388 (2020) 121800. 10.1016/j.jhazmat.2019.121800. [49] B. Jiang K. Xu J. Li H. Lu X. Fei X. Yao S. Yao Z. Wu Effect of supports on plasma catalytic decomposition of toluene using in situ plasma DRIFTS J. Hazard. Mater. 405 2021 124203 10.1016/j.jhazmat.2020.124203 B. Jiang, K. Xu, J. Li, H. Lu, X. Fei, X. Yao, S. Yao, Z. Wu, Effect of supports on plasma catalytic decomposition of toluene using in situ plasma DRIFTS, J. Hazard. Mater. 405 (2021) 124203. 10.1016/j.jhazmat.2020.124203. [50] C. Dong H. Wang Y. Ren Z. Qu Effect of alkaline earth metal promoter on catalytic activity of MnO2 for the complete oxidation of toluene J. Environ. Sci. 104 2021 102 112 10.1016/j.jes.2020.11.003 C. Dong, H. Wang, Y. Ren, Z. Qu, Effect of alkaline earth metal promoter on catalytic activity of MnO2 for the complete oxidation of toluene, J. Environ. Sci. 104 (2021) 102–112. 10.1016/j.jes.2020.11.003. [51] X. Chen X. Chen S. Cai E. Yu J. Chen H. Jia MnOx/Cr2O3 composites prepared by pyrolysis of Cr-MOF precursors containing in situ assembly of MnOx as high stable catalyst for toluene oxidation Appl. Surf. Sci. 475 2019 312 324 10.1016/j.apsusc.2018.12.277 X. Chen, X. Chen, S. Cai, E. Yu, J. Chen, H. Jia, MnOx/Cr2O3 composites prepared by pyrolysis of Cr-MOF precursors containing in situ assembly of MnOx as high stable catalyst for toluene oxidation, Appl. Surf. Sci. 475 (2019) 312–324. 10.1016/j.apsusc.2018.12.277. [52] M. Qi Z. Li Z. Zhang Y. Gao Q. Wang Controllable synthesis of MnO2/iron mesh monolithic catalyst and its significant enhancement for toluene oxidation Chin. Chem. Lett. 34 2023 107437 10.1016/j.cclet.2022.04.035 M. Qi, Z. Li, Z. Zhang, Y. Gao, Q. Wang, Controllable synthesis of MnO2/iron mesh monolithic catalyst and its significant enhancement for toluene oxidation, Chin. Chem. Lett. 34 (2023) 107437. 10.1016/j.cclet.2022.04.035. [53] S. Mo Q. Zhang J. Li Y. Sun Q. Ren S. Zou Q. Zhang J. Lu M. Fu D. Mo J. Wu H. Huang D. Ye Highly efficient mesoporous MnO2 catalysts for the total toluene oxidation: oxygen-vacancy defect engineering and involved intermediates using in situ DRIFTS Appl. Catal. B: Environ. 264 2020 118464 10.1016/j.apcatb.2019.118464 S. Mo, Q. Zhang, J. Li, Y. Sun, Q. Ren, S. Zou, Q. Zhang, J. Lu, M. Fu, D. Mo, J. Wu, H. Huang, D. Ye, Highly efficient mesoporous MnO2 catalysts for the total toluene oxidation: oxygen-vacancy defect engineering and involved intermediates using in situ DRIFTS, Appl. Catal. B Environ. 264 (2020) 118464. 10.1016/j.apcatb.2019.118464. [54] Z. Su W. Yang C. Wang S. Xiong X. Cao Y. Peng W. Si Y. Weng M. Xue J. Li Roles of Oxygen Vacancies in the Bulk and Surface of CeO2 for Toluene Catalytic Combustion Environ. Sci. Technol. 54 2020 12684 12692 10.1021/acs.est.0c03981 Z. Su, W. Yang, C. Wang, S. Xiong, X. Cao, Y. Peng, W. Si, Y. Weng, M. Xue, J. Li, Roles of Oxygen Vacancies in the Bulk and Surface of CeO2 for Toluene Catalytic Combustion, Environ. Sci. Technol. 54 (2020) 12684–12692. 10.1021/acs.est.0c03981. [55] W. Yang Z. Su Z. Xu W. Yang Y. Peng J. Li Comparative study of α-, β-, γ- and δ-MnO2 on toluene oxidation: oxygen vacancies and reaction intermediates Appl. Catal. B: Environ. 260 2020 118150 10.1016/j.apcatb.2019.118150 W. Yang, Z. Su, Z. Xu, W. Yang, Y. Peng, J. Li, Comparative study of α-, β-, γ- and δ-MnO2 on toluene oxidation: oxygen vacancies and reaction intermediates, Appl. Catal. B Environ. 260 (2020) 118150. 10.1016/j.apcatb.2019.118150.",
      "scopus-id": "85181054024",
      "coredata": {
        "eid": "1-s2.0-S2468823123008805",
        "dc:description": "For VOCs oxidation technology, significant room for enhancement still exists in terms of catalytic performance of commonly used transition metal oxide-based catalysts. In this work, we designed MnFeOx oxides catalysts by using in situ pyrolysis of MnFe bimetallic MOF-74 as efficient and stable catalysts for toluene oxidation and this bimetallic framework was synthesized by metal doping. The preferred Mn2Fe3Ox-500 (Mn/Fe molar ratio of 2:3, calcination T=500 °C) catalyst exhibited excellent catalytic activity and stability towards toluene which was significantly superior the control MnOx-500 catalyst. Under simulated industrial real-exhaust conditions, the Mn2Fe3Ox-500 catalyst maintained better resistance at higher air velocities, in addition to exhibiting excellent stability and good water resistance. The superior toluene oxidation activity of Mn2Fe3Ox-500 catalyst can be associated with its high reducibility of metal active species, abundance of oxygen species, and the well dispersion of Fe2O3 and MnOx species. In addition, suggested potential degradation pathways for toluene over the Mn2Fe3Ox-500 catalyst. For the exhaust gas purification industry, this work will be beneficial in exploring the mechanistic level of MOF materials in the field of VOCs removal.",
        "openArchiveArticle": "false",
        "prism:coverDate": "2024-01-15",
        "openaccessUserLicense": null,
        "prism:aggregationType": "Journal",
        "prism:url": "https://api.elsevier.com/content/article/pii/S2468823123008805",
        "dc:creator": [
          {
            "@_fa": "true",
            "$": "Wang, Yuxin"
          },
          {
            "@_fa": "true",
            "$": "Chen, Zhenyu"
          },
          {
            "@_fa": "true",
            "$": "Lu, Shixu"
          },
          {
            "@_fa": "true",
            "$": "Xin, Shuaishuai"
          },
          {
            "@_fa": "true",
            "$": "Liu, Guocheng"
          },
          {
            "@_fa": "true",
            "$": "Zhou, Chengzhi"
          },
          {
            "@_fa": "true",
            "$": "Xin, Yanjun"
          },
          {
            "@_fa": "true",
            "$": "Wang, Qiang"
          },
          {
            "@_fa": "true",
            "$": "Wang, Qianwen"
          },
          {
            "@_fa": "true",
            "$": "Wang, Yuxia"
          },
          {
            "@_fa": "true",
            "$": "Xue, Tianshan"
          },
          {
            "@_fa": "true",
            "$": "Yan, Qinghua"
          }
        ],
        "link": [
          {
            "@_fa": "true",
            "@rel": "self",
            "@href": "https://api.elsevier.com/content/article/pii/S2468823123008805"
          },
          {
            "@_fa": "true",
            "@rel": "scidir",
            "@href": "https://www.sciencedirect.com/science/article/pii/S2468823123008805"
          }
        ],
        "dc:format": "application/json",
        "openaccessType": null,
        "pii": "S2468-8231(23)00880-5",
        "prism:volume": "553",
        "articleNumber": "113792",
        "prism:publisher": "Elsevier B.V.",
        "dc:title": "Efficient oxidation and stable removal of toluene over controlled metal-organic framework derived MnFeOx catalysts",
        "prism:copyright": "© 2023 Elsevier B.V. All rights reserved.",
        "openaccess": "0",
        "prism:issn": "24688231",
        "dcterms:subject": [
          {
            "@_fa": "true",
            "$": "Metal-organic frameworks"
          },
          {
            "@_fa": "true",
            "$": "MnFeOx"
          },
          {
            "@_fa": "true",
            "$": "toluene oxidation"
          },
          {
            "@_fa": "true",
            "$": "stability"
          },
          {
            "@_fa": "true",
            "$": "water resistance"
          }
        ],
        "openaccessArticle": "false",
        "prism:publicationName": "Molecular Catalysis",
        "openaccessSponsorType": null,
        "prism:pageRange": "113792",
        "pubType": "fla",
        "prism:coverDisplayDate": "15 January 2024",
        "prism:doi": "10.1016/j.mcat.2023.113792",
        "prism:startingPage": "113792",
        "dc:identifier": "doi:10.1016/j.mcat.2023.113792",
        "openaccessSponsorName": null
      },
      "objects": {
        "object": [
          {
            "@category": "standard",
            "@height": "394",
            "@width": "678",
            "@_fa": "true",
            "$": "https://api.elsevier.com/content/object/eid/1-s2.0-S2468823123008805-gr10.jpg?httpAccept=%2A%2F%2A",
            "@multimediatype": "JPEG image file",
            "@type": "IMAGE-DOWNSAMPLED",
            "@size": "93209",
            "@ref": "gr10",
            "@mimetype": "image/jpeg"
          },
          {
            "@category": "standard",
            "@height": "548",
            "@width": "715",
            "@_fa": "true",
            "$": "https://api.elsevier.com/content/object/eid/1-s2.0-S2468823123008805-gr9.jpg?httpAccept=%2A%2F%2A",
            "@multimediatype": "JPEG image file",
            "@type": "IMAGE-DOWNSAMPLED",
            "@size": "149722",
            "@ref": "gr9",
            "@mimetype": "image/jpeg"
          },
          {
            "@category": "standard",
            "@height": "281",
            "@width": "715",
            "@_fa": "true",
            "$": "https://api.elsevier.com/content/object/eid/1-s2.0-S2468823123008805-gr8.jpg?httpAccept=%2A%2F%2A",
            "@multimediatype": "JPEG image file",
            "@type": "IMAGE-DOWNSAMPLED",
            "@size": "66442",
            "@ref": "gr8",
            "@mimetype": "image/jpeg"
          },
          {
            "@category": "standard",
            "@height": "553",
            "@width": "678",
            "@_fa": "true",
            "$": "https://api.elsevier.com/content/object/eid/1-s2.0-S2468823123008805-gr4.jpg?httpAccept=%2A%2F%2A",
            "@multimediatype": "JPEG image file",
            "@type": "IMAGE-DOWNSAMPLED",
            "@size": "80790",
            "@ref": "gr4",
            "@mimetype": "image/jpeg"
          },
          {
            "@category": "standard",
            "@height": "274",
            "@width": "681",
            "@_fa": "true",
            "$": "https://api.elsevier.com/content/object/eid/1-s2.0-S2468823123008805-gr7.jpg?httpAccept=%2A%2F%2A",
            "@multimediatype": "JPEG image file",
            "@type": "IMAGE-DOWNSAMPLED",
            "@size": "40807",
            "@ref": "gr7",
            "@mimetype": "image/jpeg"
          },
          {
            "@category": "standard",
            "@height": "864",
            "@width": "602",
            "@_fa": "true",
            "$": "https://api.elsevier.com/content/object/eid/1-s2.0-S2468823123008805-gr6.jpg?httpAccept=%2A%2F%2A",
            "@multimediatype": "JPEG image file",
            "@type": "IMAGE-DOWNSAMPLED",
            "@size": "139267",
            "@ref": "gr6",
            "@mimetype": "image/jpeg"
          },
          {
            "@category": "standard",
            "@height": "200",
            "@width": "343",
            "@_fa": "true",
            "$": "https://api.elsevier.com/content/object/eid/1-s2.0-S2468823123008805-ga1.jpg?httpAccept=%2A%2F%2A",
            "@multimediatype": "JPEG image file",
            "@type": "IMAGE-DOWNSAMPLED",
            "@size": "38867",
            "@ref": "ga1",
            "@mimetype": "image/jpeg"
          },
          {
            "@category": "standard",
            "@height": "539",
            "@width": "678",
            "@_fa": "true",
            "$": "https://api.elsevier.com/content/object/eid/1-s2.0-S2468823123008805-gr5.jpg?httpAccept=%2A%2F%2A",
            "@multimediatype": "JPEG image file",
            "@type": "IMAGE-DOWNSAMPLED",
            "@size": "84691",
            "@ref": "gr5",
            "@mimetype": "image/jpeg"
          },
          {
            "@category": "standard",
            "@height": "620",
            "@width": "678",
            "@_fa": "true",
            "$": "https://api.elsevier.com/content/object/eid/1-s2.0-S2468823123008805-gr1.jpg?httpAccept=%2A%2F%2A",
            "@multimediatype": "JPEG image file",
            "@type": "IMAGE-DOWNSAMPLED",
            "@size": "142908",
            "@ref": "gr1",
            "@mimetype": "image/jpeg"
          },
          {
            "@category": "standard",
            "@height": "713",
            "@width": "489",
            "@_fa": "true",
            "$": "https://api.elsevier.com/content/object/eid/1-s2.0-S2468823123008805-gr3.jpg?httpAccept=%2A%2F%2A",
            "@multimediatype": "JPEG image file",
            "@type": "IMAGE-DOWNSAMPLED",
            "@size": "151531",
            "@ref": "gr3",
            "@mimetype": "image/jpeg"
          },
          {
            "@category": "standard",
            "@height": "260",
            "@width": "678",
            "@_fa": "true",
            "$": "https://api.elsevier.com/content/object/eid/1-s2.0-S2468823123008805-gr2.jpg?httpAccept=%2A%2F%2A",
            "@multimediatype": "JPEG image file",
            "@type": "IMAGE-DOWNSAMPLED",
            "@size": "54236",
            "@ref": "gr2",
            "@mimetype": "image/jpeg"
          },
          {
            "@category": "thumbnail",
            "@height": "127",
            "@width": "219",
            "@_fa": "true",
            "$": "https://api.elsevier.com/content/object/eid/1-s2.0-S2468823123008805-gr10.sml?httpAccept=%2A%2F%2A",
            "@multimediatype": "GIF image file",
            "@type": "IMAGE-THUMBNAIL",
            "@size": "14981",
            "@ref": "gr10",
            "@mimetype": "image/gif"
          },
          {
            "@category": "thumbnail",
            "@height": "164",
            "@width": "214",
            "@_fa": "true",
            "$": "https://api.elsevier.com/content/object/eid/1-s2.0-S2468823123008805-gr9.sml?httpAccept=%2A%2F%2A",
            "@multimediatype": "GIF image file",
            "@type": "IMAGE-THUMBNAIL",
            "@size": "20135",
            "@ref": "gr9",
            "@mimetype": "image/gif"
          },
          {
            "@category": "thumbnail",
            "@height": "86",
            "@width": "219",
            "@_fa": "true",
            "$": "https://api.elsevier.com/content/object/eid/1-s2.0-S2468823123008805-gr8.sml?httpAccept=%2A%2F%2A",
            "@multimediatype": "GIF image file",
            "@type": "IMAGE-THUMBNAIL",
            "@size": "10429",
            "@ref": "gr8",
            "@mimetype": "image/gif"
          },
          {
            "@category": "thumbnail",
            "@height": "164",
            "@width": "201",
            "@_fa": "true",
            "$": "https://api.elsevier.com/content/object/eid/1-s2.0-S2468823123008805-gr4.sml?httpAccept=%2A%2F%2A",
            "@multimediatype": "GIF image file",
            "@type": "IMAGE-THUMBNAIL",
            "@size": "11221",
            "@ref": "gr4",
            "@mimetype": "image/gif"
          },
          {
            "@category": "thumbnail",
            "@height": "88",
            "@width": "219",
            "@_fa": "true",
            "$": "https://api.elsevier.com/content/object/eid/1-s2.0-S2468823123008805-gr7.sml?httpAccept=%2A%2F%2A",
            "@multimediatype": "GIF image file",
            "@type": "IMAGE-THUMBNAIL",
            "@size": "6792",
            "@ref": "gr7",
            "@mimetype": "image/gif"
          },
          {
            "@category": "thumbnail",
            "@height": "164",
            "@width": "114",
            "@_fa": "true",
            "$": "https://api.elsevier.com/content/object/eid/1-s2.0-S2468823123008805-gr6.sml?httpAccept=%2A%2F%2A",
            "@multimediatype": "GIF image file",
            "@type": "IMAGE-THUMBNAIL",
            "@size": "10732",
            "@ref": "gr6",
            "@mimetype": "image/gif"
          },
          {
            "@category": "thumbnail",
            "@height": "128",
            "@width": "219",
            "@_fa": "true",
            "$": "https://api.elsevier.com/content/object/eid/1-s2.0-S2468823123008805-ga1.sml?httpAccept=%2A%2F%2A",
            "@multimediatype": "GIF image file",
            "@type": "IMAGE-THUMBNAIL",
            "@size": "15495",
            "@ref": "ga1",
            "@mimetype": "image/gif"
          },
          {
            "@category": "thumbnail",
            "@height": "164",
            "@width": "206",
            "@_fa": "true",
            "$": "https://api.elsevier.com/content/object/eid/1-s2.0-S2468823123008805-gr5.sml?httpAccept=%2A%2F%2A",
            "@multimediatype": "GIF image file",
            "@type": "IMAGE-THUMBNAIL",
            "@size": "12169",
            "@ref": "gr5",
            "@mimetype": "image/gif"
          },
          {
            "@category": "thumbnail",
            "@height": "164",
            "@width": "179",
            "@_fa": "true",
            "$": "https://api.elsevier.com/content/object/eid/1-s2.0-S2468823123008805-gr1.sml?httpAccept=%2A%2F%2A",
            "@multimediatype": "GIF image file",
            "@type": "IMAGE-THUMBNAIL",
            "@size": "13540",
            "@ref": "gr1",
            "@mimetype": "image/gif"
          },
          {
            "@category": "thumbnail",
            "@height": "163",
            "@width": "112",
            "@_fa": "true",
            "$": "https://api.elsevier.com/content/object/eid/1-s2.0-S2468823123008805-gr3.sml?httpAccept=%2A%2F%2A",
            "@multimediatype": "GIF image file",
            "@type": "IMAGE-THUMBNAIL",
            "@size": "16089",
            "@ref": "gr3",
            "@mimetype": "image/gif"
          },
          {
            "@category": "thumbnail",
            "@height": "84",
            "@width": "219",
            "@_fa": "true",
            "$": "https://api.elsevier.com/content/object/eid/1-s2.0-S2468823123008805-gr2.sml?httpAccept=%2A%2F%2A",
            "@multimediatype": "GIF image file",
            "@type": "IMAGE-THUMBNAIL",
            "@size": "8365",
            "@ref": "gr2",
            "@mimetype": "image/gif"
          },
          {
            "@category": "high",
            "@height": "1745",
            "@width": "3000",
            "@_fa": "true",
            "$": "https://api.elsevier.com/content/object/eid/1-s2.0-S2468823123008805-gr10_lrg.jpg?httpAccept=%2A%2F%2A",
            "@multimediatype": "JPEG image file",
            "@type": "IMAGE-HIGH-RES",
            "@size": "732492",
            "@ref": "gr10",
            "@mimetype": "image/jpeg"
          },
          {
            "@category": "high",
            "@height": "2429",
            "@width": "3167",
            "@_fa": "true",
            "$": "https://api.elsevier.com/content/object/eid/1-s2.0-S2468823123008805-gr9_lrg.jpg?httpAccept=%2A%2F%2A",
            "@multimediatype": "JPEG image file",
            "@type": "IMAGE-HIGH-RES",
            "@size": "1119509",
            "@ref": "gr9",
            "@mimetype": "image/jpeg"
          },
          {
            "@category": "high",
            "@height": "1245",
            "@width": "3167",
            "@_fa": "true",
            "$": "https://api.elsevier.com/content/object/eid/1-s2.0-S2468823123008805-gr8_lrg.jpg?httpAccept=%2A%2F%2A",
            "@multimediatype": "JPEG image file",
            "@type": "IMAGE-HIGH-RES",
            "@size": "445102",
            "@ref": "gr8",
            "@mimetype": "image/jpeg"
          },
          {
            "@category": "high",
            "@height": "2449",
            "@width": "3000",
            "@_fa": "true",
            "$": "https://api.elsevier.com/content/object/eid/1-s2.0-S2468823123008805-gr4_lrg.jpg?httpAccept=%2A%2F%2A",
            "@multimediatype": "JPEG image file",
            "@type": "IMAGE-HIGH-RES",
            "@size": "550513",
            "@ref": "gr4",
            "@mimetype": "image/jpeg"
          },
          {
            "@category": "high",
            "@height": "1215",
            "@width": "3017",
            "@_fa": "true",
            "$": "https://api.elsevier.com/content/object/eid/1-s2.0-S2468823123008805-gr7_lrg.jpg?httpAccept=%2A%2F%2A",
            "@multimediatype": "JPEG image file",
            "@type": "IMAGE-HIGH-RES",
            "@size": "266703",
            "@ref": "gr7",
            "@mimetype": "image/jpeg"
          },
          {
            "@category": "high",
            "@height": "3828",
            "@width": "2667",
            "@_fa": "true",
            "$": "https://api.elsevier.com/content/object/eid/1-s2.0-S2468823123008805-gr6_lrg.jpg?httpAccept=%2A%2F%2A",
            "@multimediatype": "JPEG image file",
            "@type": "IMAGE-HIGH-RES",
            "@size": "989674",
            "@ref": "gr6",
            "@mimetype": "image/jpeg"
          },
          {
            "@category": "high",
            "@height": "886",
            "@width": "1521",
            "@_fa": "true",
            "$": "https://api.elsevier.com/content/object/eid/1-s2.0-S2468823123008805-ga1_lrg.jpg?httpAccept=%2A%2F%2A",
            "@multimediatype": "JPEG image file",
            "@type": "IMAGE-HIGH-RES",
            "@size": "304640",
            "@ref": "ga1",
            "@mimetype": "image/jpeg"
          },
          {
            "@category": "high",
            "@height": "2383",
            "@width": "3000",
            "@_fa": "true",
            "$": "https://api.elsevier.com/content/object/eid/1-s2.0-S2468823123008805-gr5_lrg.jpg?httpAccept=%2A%2F%2A",
            "@multimediatype": "JPEG image file",
            "@type": "IMAGE-HIGH-RES",
            "@size": "541703",
            "@ref": "gr5",
            "@mimetype": "image/jpeg"
          },
          {
            "@category": "high",
            "@height": "2744",
            "@width": "3000",
            "@_fa": "true",
            "$": "https://api.elsevier.com/content/object/eid/1-s2.0-S2468823123008805-gr1_lrg.jpg?httpAccept=%2A%2F%2A",
            "@multimediatype": "JPEG image file",
            "@type": "IMAGE-HIGH-RES",
            "@size": "990158",
            "@ref": "gr1",
            "@mimetype": "image/jpeg"
          },
          {
            "@category": "high",
            "@height": "3161",
            "@width": "2167",
            "@_fa": "true",
            "$": "https://api.elsevier.com/content/object/eid/1-s2.0-S2468823123008805-gr3_lrg.jpg?httpAccept=%2A%2F%2A",
            "@multimediatype": "JPEG image file",
            "@type": "IMAGE-HIGH-RES",
            "@size": "1477716",
            "@ref": "gr3",
            "@mimetype": "image/jpeg"
          },
          {
            "@category": "high",
            "@height": "1150",
            "@width": "3000",
            "@_fa": "true",
            "$": "https://api.elsevier.com/content/object/eid/1-s2.0-S2468823123008805-gr2_lrg.jpg?httpAccept=%2A%2F%2A",
            "@multimediatype": "JPEG image file",
            "@type": "IMAGE-HIGH-RES",
            "@size": "357891",
            "@ref": "gr2",
            "@mimetype": "image/jpeg"
          },
          {
            "@category": "thumbnail",
            "@_fa": "true",
            "$": "https://api.elsevier.com/content/object/eid/1-s2.0-S2468823123008805-si1.svg?httpAccept=%2A%2F%2A",
            "@multimediatype": "Scalable Vector Graphics file",
            "@type": "ALTIMG",
            "@size": "16305",
            "@ref": "si1",
            "@mimetype": "image/svg+xml"
          },
          {
            "@category": "standard",
            "@_fa": "true",
            "$": "https://api.elsevier.com/content/object/eid/1-s2.0-S2468823123008805-am.pdf?httpAccept=%2A%2F%2A",
            "@multimediatype": "Acrobat PDF file",
            "@type": "AAM-PDF",
            "@size": "2379276",
            "@ref": "am",
            "@mimetype": "application/pdf"
          }
        ]
      },
      "link": {
        "@rel": "abstract",
        "@href": "https://api.elsevier.com/content/abstract/scopus_id/85181054024"
      }
    }
  }
}