{
  "metadata": {
    "title": "Polyoxometalate-embedded copper-organic network as dual-site synergetic catalyst for the selective oxidation of benzylic C−H bond",
    "authors": "; ; ",
    "journal": "Molecular Catalysis",
    "date": "2024-12-31",
    "doi": "10.1016/j.mcat.2024.114579",
    "abstract": "",
    "uri": "https://api.elsevier.com/content/article/pii/S2468823124007612",
    "pii": "S2468823124007612"
  },
  "fulltext": {
    "full-text-retrieval-response": {
      "scopus-eid": "2-s2.0-85205294842",
      "originalText": "serial JL 315758 291210 291744 291790 291809 31 Molecular Catalysis MOLECULARCATALYSIS 2024-10-02 2024-10-02 2024-10-02 2024-10-02 2024-11-15T16:17:10 1-s2.0-S2468823124007612 S2468-8231(24)00761-2 S2468823124007612 10.1016/j.mcat.2024.114579 S300 S300.1 FULL-TEXT 1-s2.0-S2468823124X00152 2024-11-15T17:47:59.095344Z 0 0 20241201 20241231 2024 2024-10-02T04:28:28.844031Z absattachment articleinfo articlenumber articletitlenorm authfirstinitialnorm authfirstsurnamenorm cid cids contenttype copyright crossmark dateloaded dateloadedtxt datesearch datesort dateupdated dco docsubtype doctype doi eid ewtransactionid hubeid indexeddate issn issnnorm itemstage itemtransactionid itemweight openaccess openarchive pg pgfirst pii piinorm pubdateend pubdatestart pubdatetxt pubyr sectiontitle sortorder srctitle srctitlenorm srctype ssids alllist content subj subheadings suppl tomb volfirst volissue volumelist webpdf webpdfpagecount yearnav figure table e-component body acknowledge affil appendices articletitle auth authfirstini authfull authkeywords authlast grantnumber grantsponsor grantsponsorid highlightsabst orcid primabst ref specialabst 2468-8231 24688231 true 569 569 C Volume 569 59 114579 114579 114579 202412 December 2024 2024-12-01 2024-12-31 2024 Regular Papers article fla © 2024 Elsevier B.V. All rights are reserved, including those for text and data mining, AI training, and similar technologies. POLYOXOMETALATEEMBEDDEDCOPPERORGANICNETWORKDUALSITESYNERGETICCATALYSTFORSELECTIVEOXIDATIONBENZYLICCHBOND WANG Y 1 Introduction 2 Results and discussion 2.1 Synthesis of compounds 1–4 2.2 Structure of compounds 1–4 2.3 Physical characterizations of compounds 1–4 2.4 Peroxide activation activity of compounds 1–4 2.5 Catalytic oxidation of benzylic C–H bond 3 Conclusion CRediT authorship contribution statement Acknowledgements Appendix Supplementary materials References CIANO 2018 L ZHAO 2022 J SUR 2022 A GUPTA 2022 N YAN 2024 J HARUNA 2023 A TANG 2023 W DU 2022 J HULSEY 2019 M ZHANG 2019 B DONG 2023 Y RU 2024 S LIU 2023 G NI 2023 L GU 2021 Y HUANG 2023 X YU 2023 F WU 2024 Z ZHANG 2018 M WU 2020 Z CHEN 2022 Z LI 2023 Y ZHU 2023 D MA 2022 Y SUN 2024 J LI 2023 J LIU 2023 H LIU 2023 Y AN 2022 W ZHANG 2022 X WANG 2023 C TANG 2024 M TANG 2019 L XIA 2024 Y YANG 2022 G CUI 2022 9421 9432 W LI 2022 K LI 2024 J LIU 2020 J QIN 2023 K JIANG 2022 J WANG 2015 Y BARATSDAMATOV 2014 D SONG 2023 J CAO 2022 S HUANG 2023 H SAHIN 2023 R SHEN 2023 Q FENG 2021 X KIMBERLEY 2021 L LI 2022 F WANG 2021 Q ZHAO 2021 X XU 2021 B LI 2019 D CHANG 2021 S WANG 2015 S HU 2017 J WANG 2022 Y FARZANEH 2015 F AZEEZ 2023 M WANGX2024X114579 WANGX2024X114579XY 2026-10-02T00:00:00.000Z 2026-10-02T00:00:00.000Z http://creativecommons.org/licenses/by-nc-nd/4.0/ © 2024 Elsevier B.V. All rights are reserved, including those for text and data mining, AI training, and similar technologies. 2024-10-22T16:21:36.622Z http://vtw.elsevier.com/data/voc/AddOnTypes/50.7/aggregated-refined National Natural Science Foundation of China 22301058 21901060 2 2371065 21871076 22471056 NSFC National Natural Science Foundation of China http://data.elsevier.com/vocabulary/SciValFunders/501100001809 http://sws.geonames.org/1814991/ B2022205005 Hebei Province Outstanding Youth Fund http://data.elsevier.com/vocabulary/SciValFunders/501100017697 http://sws.geonames.org/1814991 Project of Science and Technology Department of Hebei Province 22567622H Department of Science and Technology of Hubei Province http://data.elsevier.com/vocabulary/SciValFunders/501100018806 http://sws.geonames.org/1814991/ College Student Innovation and Entrepreneurship Training Program Project of Hebei Normal University S202310094008 China Postdoctoral Science Foundation 2021TQ0095 China Postdoctoral Science Foundation http://data.elsevier.com/vocabulary/SciValFunders/501100002858 http://sws.geonames.org/1814991/ Hebei Normal University Hebei Normal University http://data.elsevier.com/vocabulary/SciValFunders/501100003481 http://sws.geonames.org/1814991/ Natural Science Foundation of Hebei Province B2024205007 B2024205033 Hebei Provincial Natural Science Foundation http://data.elsevier.com/vocabulary/SciValFunders/501100003787 http://sws.geonames.org/1814991 Science and Technology Project of Hebei Education Department QN2023049 This work was supported by National Natural Science Foundation of China (Grants 22471056, 22301058, 22371065, 21901060, 21871076), Natural Science Foundation of Hebei Province (Grants B2024205007, B2024205033, and B2022205005), Science and Technology Project of Hebei Education Department (Grant QN2023049), the China Postdoctoral Science Foundation funded project (No. 2021TQ0095), Project of Science and Technology Department of Hebei Province (22567622H), College Student Innovation and Entrepreneurship Training Program Project of Hebei Normal University (S202310094008) and Chemistry Postdoctoral Research Station at Hebei Normal University. https://doi.org/10.15223/policy-017 https://doi.org/10.15223/policy-037 https://doi.org/10.15223/policy-012 https://doi.org/10.15223/policy-029 https://doi.org/10.15223/policy-004 item S2468-8231(24)00761-2 S2468823124007612 1-s2.0-S2468823124007612 10.1016/j.mcat.2024.114579 315758 2024-11-15T17:47:59.095344Z 2024-12-01 2024-12-31 1-s2.0-S2468823124007612-main.pdf https://s3-eu-west-1.amazonaws.com/prod-ucs-content-store-eu-west/content/pii:S2468823124007612/MAIN/application/pdf/68ec7af55c094e4805c3746f617eb19c/main.pdf main.pdf pdf true 10587228 MAIN 10 1-s2.0-S2468823124007612-main_1.png https://s3-eu-west-1.amazonaws.com/prod-ucs-content-store-eu-west/content/pii:S2468823124007612/PREVIEW/image/png/8a035718713140bcc283c24f3a00de6b/main_1.png main_1.png png 61258 849 656 IMAGE-WEB-PDF 1 1-s2.0-S2468823124007612-fx11.jpg https://s3-eu-west-1.amazonaws.com/prod-ucs-content-store-eu-west/content/pii:S2468823124007612/fx11/DOWNSAMPLED/image/jpeg/e4e2308d101a3f47b4e13c373013ff16/fx11.jpg fx11 fx11.jpg jpg 4461 59 65 IMAGE-DOWNSAMPLED 1-s2.0-S2468823124007612-fx10.jpg https://s3-eu-west-1.amazonaws.com/prod-ucs-content-store-eu-west/content/pii:S2468823124007612/fx10/DOWNSAMPLED/image/jpeg/6fc93ffc207d967b57bc853063366fb5/fx10.jpg fx10 fx10.jpg jpg 1583 39 66 IMAGE-DOWNSAMPLED 1-s2.0-S2468823124007612-fx15.jpg https://s3-eu-west-1.amazonaws.com/prod-ucs-content-store-eu-west/content/pii:S2468823124007612/fx15/DOWNSAMPLED/image/jpeg/f173ea10a0ab2aaf96f6878029946e77/fx15.jpg fx15 fx15.jpg jpg 4372 51 61 IMAGE-DOWNSAMPLED 1-s2.0-S2468823124007612-fx14.jpg https://s3-eu-west-1.amazonaws.com/prod-ucs-content-store-eu-west/content/pii:S2468823124007612/fx14/DOWNSAMPLED/image/jpeg/6b4e2889d8a86d238c22cc7121280d6a/fx14.jpg fx14 fx14.jpg jpg 4185 38 64 IMAGE-DOWNSAMPLED 1-s2.0-S2468823124007612-fx13.jpg https://s3-eu-west-1.amazonaws.com/prod-ucs-content-store-eu-west/content/pii:S2468823124007612/fx13/DOWNSAMPLED/image/jpeg/1b4763fd5c81e151e25222b1ed08baf9/fx13.jpg fx13 fx13.jpg jpg 4414 51 72 IMAGE-DOWNSAMPLED 1-s2.0-S2468823124007612-fx12.jpg https://s3-eu-west-1.amazonaws.com/prod-ucs-content-store-eu-west/content/pii:S2468823124007612/fx12/DOWNSAMPLED/image/jpeg/585f32ee98ed34431099e4d270d9a9ed/fx12.jpg fx12 fx12.jpg jpg 1976 41 86 IMAGE-DOWNSAMPLED 1-s2.0-S2468823124007612-ga1.jpg https://s3-eu-west-1.amazonaws.com/prod-ucs-content-store-eu-west/content/pii:S2468823124007612/ga1/DOWNSAMPLED/image/jpeg/0e6860ea651eb5aa9e03dd5eb0bdb922/ga1.jpg ga1 true ga1.jpg jpg 36377 200 265 IMAGE-DOWNSAMPLED 1-s2.0-S2468823124007612-fx7.jpg https://s3-eu-west-1.amazonaws.com/prod-ucs-content-store-eu-west/content/pii:S2468823124007612/fx7/DOWNSAMPLED/image/jpeg/26d6b3b5b6c1b59e604560ca70cf5a15/fx7.jpg fx7 fx7.jpg jpg 4262 58 78 IMAGE-DOWNSAMPLED 1-s2.0-S2468823124007612-gr1.jpg https://s3-eu-west-1.amazonaws.com/prod-ucs-content-store-eu-west/content/pii:S2468823124007612/gr1/DOWNSAMPLED/image/jpeg/9916fc3b480bd5a1add204c983fe44a4/gr1.jpg gr1 gr1.jpg jpg 89609 429 444 IMAGE-DOWNSAMPLED 1-s2.0-S2468823124007612-fx8.jpg https://s3-eu-west-1.amazonaws.com/prod-ucs-content-store-eu-west/content/pii:S2468823124007612/fx8/DOWNSAMPLED/image/jpeg/7623257c4583146771774b947a2038d4/fx8.jpg fx8 fx8.jpg jpg 1616 41 65 IMAGE-DOWNSAMPLED 1-s2.0-S2468823124007612-gr2.jpg https://s3-eu-west-1.amazonaws.com/prod-ucs-content-store-eu-west/content/pii:S2468823124007612/gr2/DOWNSAMPLED/image/jpeg/2be4744cf4d60ecde7e9733f7a27d8b9/gr2.jpg gr2 gr2.jpg jpg 102837 360 484 IMAGE-DOWNSAMPLED 1-s2.0-S2468823124007612-fx9.jpg https://s3-eu-west-1.amazonaws.com/prod-ucs-content-store-eu-west/content/pii:S2468823124007612/fx9/DOWNSAMPLED/image/jpeg/d15cc33b93d942b64084d6741e73f495/fx9.jpg fx9 fx9.jpg jpg 4383 55 62 IMAGE-DOWNSAMPLED 1-s2.0-S2468823124007612-gr3.jpg https://s3-eu-west-1.amazonaws.com/prod-ucs-content-store-eu-west/content/pii:S2468823124007612/gr3/DOWNSAMPLED/image/jpeg/1b6b9f89dd3aac02e85fa781f9bb5a30/gr3.jpg gr3 gr3.jpg jpg 88661 508 419 IMAGE-DOWNSAMPLED 1-s2.0-S2468823124007612-fx3.jpg https://s3-eu-west-1.amazonaws.com/prod-ucs-content-store-eu-west/content/pii:S2468823124007612/fx3/DOWNSAMPLED/image/jpeg/e3ed585cf67071658ae7bb363b4a1a24/fx3.jpg fx3 fx3.jpg jpg 3957 50 55 IMAGE-DOWNSAMPLED 1-s2.0-S2468823124007612-fx4.jpg https://s3-eu-west-1.amazonaws.com/prod-ucs-content-store-eu-west/content/pii:S2468823124007612/fx4/DOWNSAMPLED/image/jpeg/b38e034c4fa7ea1661a9673e2444d2c9/fx4.jpg fx4 fx4.jpg jpg 1449 40 85 IMAGE-DOWNSAMPLED 1-s2.0-S2468823124007612-fx5.jpg https://s3-eu-west-1.amazonaws.com/prod-ucs-content-store-eu-west/content/pii:S2468823124007612/fx5/DOWNSAMPLED/image/jpeg/eed25dd237240cfc16440a853f7c99f8/fx5.jpg fx5 fx5.jpg jpg 4403 58 87 IMAGE-DOWNSAMPLED 1-s2.0-S2468823124007612-fx6.jpg https://s3-eu-west-1.amazonaws.com/prod-ucs-content-store-eu-west/content/pii:S2468823124007612/fx6/DOWNSAMPLED/image/jpeg/107b6bebd3cc60b97f53fcd2e28703ee/fx6.jpg fx6 fx6.jpg jpg 1395 39 80 IMAGE-DOWNSAMPLED 1-s2.0-S2468823124007612-fx1.jpg https://s3-eu-west-1.amazonaws.com/prod-ucs-content-store-eu-west/content/pii:S2468823124007612/fx1/DOWNSAMPLED/image/jpeg/ed1de93780e35eec326aedd804b60786/fx1.jpg fx1 fx1.jpg jpg 7544 51 282 IMAGE-DOWNSAMPLED 1-s2.0-S2468823124007612-fx2.jpg https://s3-eu-west-1.amazonaws.com/prod-ucs-content-store-eu-west/content/pii:S2468823124007612/fx2/DOWNSAMPLED/image/jpeg/d232fc0f663a6f994bf99f67e5877603/fx2.jpg fx2 fx2.jpg jpg 1144 36 61 IMAGE-DOWNSAMPLED 1-s2.0-S2468823124007612-gr4.jpg https://s3-eu-west-1.amazonaws.com/prod-ucs-content-store-eu-west/content/pii:S2468823124007612/gr4/DOWNSAMPLED/image/jpeg/d13f86c9f2b2d0c82876b6cb8966ce98/gr4.jpg gr4 gr4.jpg jpg 104400 429 534 IMAGE-DOWNSAMPLED 1-s2.0-S2468823124007612-gr5.jpg https://s3-eu-west-1.amazonaws.com/prod-ucs-content-store-eu-west/content/pii:S2468823124007612/gr5/DOWNSAMPLED/image/jpeg/2eb0a5ea7dd7f7f2491754aed1a7c201/gr5.jpg gr5 gr5.jpg jpg 88118 415 528 IMAGE-DOWNSAMPLED 1-s2.0-S2468823124007612-gr6.jpg https://s3-eu-west-1.amazonaws.com/prod-ucs-content-store-eu-west/content/pii:S2468823124007612/gr6/DOWNSAMPLED/image/jpeg/44b1a70bd8236f09af449b312cbca034/gr6.jpg gr6 gr6.jpg jpg 123384 667 534 IMAGE-DOWNSAMPLED 1-s2.0-S2468823124007612-gr7.jpg https://s3-eu-west-1.amazonaws.com/prod-ucs-content-store-eu-west/content/pii:S2468823124007612/gr7/DOWNSAMPLED/image/jpeg/46bae317b8311d71848639414ccc2e37/gr7.jpg gr7 gr7.jpg jpg 98025 497 609 IMAGE-DOWNSAMPLED 1-s2.0-S2468823124007612-fx11.sml https://s3-eu-west-1.amazonaws.com/prod-ucs-content-store-eu-west/content/pii:S2468823124007612/fx11/THUMBNAIL/image/gif/3d9747e7011d4f8b1443aa5e94ee0090/fx11.sml fx11 fx11.sml sml 7374 164 180 IMAGE-THUMBNAIL 1-s2.0-S2468823124007612-fx10.sml https://s3-eu-west-1.amazonaws.com/prod-ucs-content-store-eu-west/content/pii:S2468823124007612/fx10/THUMBNAIL/image/gif/219499692268a867e6301e146a5f3408/fx10.sml fx10 fx10.sml sml 6142 129 219 IMAGE-THUMBNAIL 1-s2.0-S2468823124007612-fx15.sml https://s3-eu-west-1.amazonaws.com/prod-ucs-content-store-eu-west/content/pii:S2468823124007612/fx15/THUMBNAIL/image/gif/dfa756c291d9675172731fa4a9c38797/fx15.sml fx15 fx15.sml sml 10049 164 195 IMAGE-THUMBNAIL 1-s2.0-S2468823124007612-fx14.sml https://s3-eu-west-1.amazonaws.com/prod-ucs-content-store-eu-west/content/pii:S2468823124007612/fx14/THUMBNAIL/image/gif/664f0f09ae554c4594e09b85c27bd967/fx14.sml fx14 fx14.sml sml 9360 131 219 IMAGE-THUMBNAIL 1-s2.0-S2468823124007612-fx13.sml https://s3-eu-west-1.amazonaws.com/prod-ucs-content-store-eu-west/content/pii:S2468823124007612/fx13/THUMBNAIL/image/gif/aa2afba9472ac28ef9d3c37dcb29f6ee/fx13.sml fx13 fx13.sml sml 9251 155 219 IMAGE-THUMBNAIL 1-s2.0-S2468823124007612-fx12.sml https://s3-eu-west-1.amazonaws.com/prod-ucs-content-store-eu-west/content/pii:S2468823124007612/fx12/THUMBNAIL/image/gif/cc83bf4bbd9b0cb945b37869976c2b08/fx12.sml fx12 fx12.sml sml 6865 105 219 IMAGE-THUMBNAIL 1-s2.0-S2468823124007612-ga1.sml https://s3-eu-west-1.amazonaws.com/prod-ucs-content-store-eu-west/content/pii:S2468823124007612/ga1/THUMBNAIL/image/gif/dec0d0e8ab4b897bd23a63ebf67ca6ca/ga1.sml ga1 true ga1.sml sml 26879 164 218 IMAGE-THUMBNAIL 1-s2.0-S2468823124007612-fx7.sml https://s3-eu-west-1.amazonaws.com/prod-ucs-content-store-eu-west/content/pii:S2468823124007612/fx7/THUMBNAIL/image/gif/b26afb8404116fad1086cad0bf4c6c19/fx7.sml fx7 fx7.sml sml 7236 164 219 IMAGE-THUMBNAIL 1-s2.0-S2468823124007612-gr1.sml https://s3-eu-west-1.amazonaws.com/prod-ucs-content-store-eu-west/content/pii:S2468823124007612/gr1/THUMBNAIL/image/gif/2baedd597c5ee5a62bcb7fbaad4f681f/gr1.sml gr1 gr1.sml sml 18074 163 169 IMAGE-THUMBNAIL 1-s2.0-S2468823124007612-fx8.sml https://s3-eu-west-1.amazonaws.com/prod-ucs-content-store-eu-west/content/pii:S2468823124007612/fx8/THUMBNAIL/image/gif/811e39d615c1aa401ef74452621a8856/fx8.sml fx8 fx8.sml sml 6918 137 219 IMAGE-THUMBNAIL 1-s2.0-S2468823124007612-gr2.sml https://s3-eu-west-1.amazonaws.com/prod-ucs-content-store-eu-west/content/pii:S2468823124007612/gr2/THUMBNAIL/image/gif/cc4a7f02abdb32ed1d8f8ee037190e81/gr2.sml gr2 gr2.sml sml 23302 163 219 IMAGE-THUMBNAIL 1-s2.0-S2468823124007612-fx9.sml https://s3-eu-west-1.amazonaws.com/prod-ucs-content-store-eu-west/content/pii:S2468823124007612/fx9/THUMBNAIL/image/gif/eb79833ddfc1ad29e5beae358aca3a07/fx9.sml fx9 fx9.sml sml 8356 164 184 IMAGE-THUMBNAIL 1-s2.0-S2468823124007612-gr3.sml https://s3-eu-west-1.amazonaws.com/prod-ucs-content-store-eu-west/content/pii:S2468823124007612/gr3/THUMBNAIL/image/gif/7cb74ad4ff9c4d6259ed0cfcad710dda/gr3.sml gr3 gr3.sml sml 14938 164 135 IMAGE-THUMBNAIL 1-s2.0-S2468823124007612-fx3.sml https://s3-eu-west-1.amazonaws.com/prod-ucs-content-store-eu-west/content/pii:S2468823124007612/fx3/THUMBNAIL/image/gif/bb74427b834dfcd5ea7fcec88971faac/fx3.sml fx3 fx3.sml sml 7218 164 180 IMAGE-THUMBNAIL 1-s2.0-S2468823124007612-fx4.sml https://s3-eu-west-1.amazonaws.com/prod-ucs-content-store-eu-west/content/pii:S2468823124007612/fx4/THUMBNAIL/image/gif/3f16fa8fa65cdf6a9151f2a7d0df8d55/fx4.sml fx4 fx4.sml sml 4675 103 219 IMAGE-THUMBNAIL 1-s2.0-S2468823124007612-fx5.sml https://s3-eu-west-1.amazonaws.com/prod-ucs-content-store-eu-west/content/pii:S2468823124007612/fx5/THUMBNAIL/image/gif/a227e3aa6aba65a9c7291521b83dc430/fx5.sml fx5 fx5.sml sml 6856 147 219 IMAGE-THUMBNAIL 1-s2.0-S2468823124007612-fx6.sml https://s3-eu-west-1.amazonaws.com/prod-ucs-content-store-eu-west/content/pii:S2468823124007612/fx6/THUMBNAIL/image/gif/2df07f3b072acc3c782910a6e8635d3d/fx6.sml fx6 fx6.sml sml 4877 108 219 IMAGE-THUMBNAIL 1-s2.0-S2468823124007612-fx1.sml https://s3-eu-west-1.amazonaws.com/prod-ucs-content-store-eu-west/content/pii:S2468823124007612/fx1/THUMBNAIL/image/gif/7b469818366b25cbb5f28db377bb8752/fx1.sml fx1 fx1.sml sml 4821 40 219 IMAGE-THUMBNAIL 1-s2.0-S2468823124007612-fx2.sml https://s3-eu-west-1.amazonaws.com/prod-ucs-content-store-eu-west/content/pii:S2468823124007612/fx2/THUMBNAIL/image/gif/572067ada3c99bf8cec90e41d3a222d9/fx2.sml fx2 fx2.sml sml 5985 130 219 IMAGE-THUMBNAIL 1-s2.0-S2468823124007612-gr4.sml https://s3-eu-west-1.amazonaws.com/prod-ucs-content-store-eu-west/content/pii:S2468823124007612/gr4/THUMBNAIL/image/gif/15da82598c2170b67d6b6e88fe5b25fa/gr4.sml gr4 gr4.sml sml 19769 164 204 IMAGE-THUMBNAIL 1-s2.0-S2468823124007612-gr5.sml https://s3-eu-west-1.amazonaws.com/prod-ucs-content-store-eu-west/content/pii:S2468823124007612/gr5/THUMBNAIL/image/gif/581f8e5e0a88068edb0fdd88a6006e48/gr5.sml gr5 gr5.sml sml 19005 164 208 IMAGE-THUMBNAIL 1-s2.0-S2468823124007612-gr6.sml https://s3-eu-west-1.amazonaws.com/prod-ucs-content-store-eu-west/content/pii:S2045232219161809/gr6/THUMBNAIL/image/gif/68037ee733e649f8f94adc02da8152fa/gr6.sml gr6 gr6.sml sml 14188 164 131 IMAGE-THUMBNAIL 1-s2.0-S2468823124007612-gr7.sml https://s3-eu-west-1.amazonaws.com/prod-ucs-content-store-eu-west/content/pii:S2045232217019769/gr7/THUMBNAIL/image/gif/62cb82033d47a5e792ef0e6788d15457/gr7.sml gr7 gr7.sml sml 18282 164 201 IMAGE-THUMBNAIL 1-s2.0-S2468823124007612-fx11_lrg.jpg https://s3-eu-west-1.amazonaws.com/prod-ucs-content-store-eu-west/content/pii:S2468823124007612/HIGHRES/image/jpeg/c5d6b3932f67905bbe61d2026e0bf968/fx11_lrg.jpg fx11 fx11_lrg.jpg jpg 14214 264 290 IMAGE-HIGH-RES 1-s2.0-S2468823124007612-fx10_lrg.jpg https://s3-eu-west-1.amazonaws.com/prod-ucs-content-store-eu-west/content/pii:S2468823124007612/HIGHRES/image/jpeg/3e60794e8475d0c75ed5ce5b6fdbc79d/fx10_lrg.jpg fx10 fx10_lrg.jpg jpg 9333 175 296 IMAGE-HIGH-RES 1-s2.0-S2468823124007612-fx15_lrg.jpg https://s3-eu-west-1.amazonaws.com/prod-ucs-content-store-eu-west/content/pii:S2468823124007612/HIGHRES/image/jpeg/d8a9da0471c5b718933c22616c8fc344/fx15_lrg.jpg fx15 fx15_lrg.jpg jpg 13611 230 274 IMAGE-HIGH-RES 1-s2.0-S2468823124007612-fx14_lrg.jpg https://s3-eu-west-1.amazonaws.com/prod-ucs-content-store-eu-west/content/pii:S2468823124007612/HIGHRES/image/jpeg/00bfc957822e1be4a0bf7a527b312e99/fx14_lrg.jpg fx14 fx14_lrg.jpg jpg 12402 171 285 IMAGE-HIGH-RES 1-s2.0-S2468823124007612-fx13_lrg.jpg https://s3-eu-west-1.amazonaws.com/prod-ucs-content-store-eu-west/content/pii:S2468823124007612/HIGHRES/image/jpeg/aae017961f8da1d0242b1b231fce2572/fx13_lrg.jpg fx13 fx13_lrg.jpg jpg 14136 226 320 IMAGE-HIGH-RES 1-s2.0-S2468823124007612-fx12_lrg.jpg https://s3-eu-west-1.amazonaws.com/prod-ucs-content-store-eu-west/content/pii:S2468823124007612/HIGHRES/image/jpeg/c04758ff2d9eb63b9d39d573cf28a028/fx12_lrg.jpg fx12 fx12_lrg.jpg jpg 13138 183 381 IMAGE-HIGH-RES 1-s2.0-S2468823124007612-ga1_lrg.jpg https://s3-eu-west-1.amazonaws.com/prod-ucs-content-store-eu-west/content/pii:S2468823124007612/HIGHRES/image/jpeg/06249f60dd973cd9401003ca41db728d/ga1_lrg.jpg ga1 true ga1_lrg.jpg jpg 298582 886 1176 IMAGE-HIGH-RES 1-s2.0-S2468823124007612-fx7_lrg.jpg https://s3-eu-west-1.amazonaws.com/prod-ucs-content-store-eu-west/content/pii:S2468823124007612/HIGHRES/image/jpeg/946f0450bb8532d216f8a85feeded454/fx7_lrg.jpg fx7 fx7_lrg.jpg jpg 13178 261 349 IMAGE-HIGH-RES 1-s2.0-S2468823124007612-gr1_lrg.jpg https://s3-eu-west-1.amazonaws.com/prod-ucs-content-store-eu-west/content/pii:S2468823124007612/HIGHRES/image/jpeg/15b3d73b900a552b2ee2f1135ec556c1/gr1_lrg.jpg gr1 gr1_lrg.jpg jpg 716326 1903 1969 IMAGE-HIGH-RES 1-s2.0-S2468823124007612-fx8_lrg.jpg https://s3-eu-west-1.amazonaws.com/prod-ucs-content-store-eu-west/content/pii:S2468823124007612/HIGHRES/image/jpeg/e685257e4e250249d2c3b2744c8d7dfd/fx8_lrg.jpg fx8 fx8_lrg.jpg jpg 9309 182 291 IMAGE-HIGH-RES 1-s2.0-S2468823124007612-gr2_lrg.jpg https://s3-eu-west-1.amazonaws.com/prod-ucs-content-store-eu-west/content/pii:S2468823124007612/HIGHRES/image/jpeg/473792506027c53455d846a5bb63b0e3/gr2_lrg.jpg gr2 gr2_lrg.jpg jpg 740931 1595 2145 IMAGE-HIGH-RES 1-s2.0-S2468823124007612-fx9_lrg.jpg https://s3-eu-west-1.amazonaws.com/prod-ucs-content-store-eu-west/content/pii:S2468823124007612/HIGHRES/image/jpeg/004e09cb5db3c72ddc3ae01e884307e1/fx9_lrg.jpg fx9 fx9_lrg.jpg jpg 13975 245 275 IMAGE-HIGH-RES 1-s2.0-S2468823124007612-gr3_lrg.jpg https://s3-eu-west-1.amazonaws.com/prod-ucs-content-store-eu-west/content/pii:S2468823124007612/HIGHRES/image/jpeg/d97d32197bdccf946810a550a8627d08/gr3_lrg.jpg gr3 gr3_lrg.jpg jpg 735359 2251 1857 IMAGE-HIGH-RES 1-s2.0-S2468823124007612-fx3_lrg.jpg https://s3-eu-west-1.amazonaws.com/prod-ucs-content-store-eu-west/content/pii:S2468823124007612/HIGHRES/image/jpeg/750391e7699c3e82ee1c084abd7de289/fx3_lrg.jpg fx3 fx3_lrg.jpg jpg 10104 222 244 IMAGE-HIGH-RES 1-s2.0-S2468823124007612-fx4_lrg.jpg https://s3-eu-west-1.amazonaws.com/prod-ucs-content-store-eu-west/content/pii:S2468823124007612/HIGHRES/image/jpeg/9b99c792bc6d6ef9fc41302b26bfb543/fx4_lrg.jpg fx4 fx4_lrg.jpg jpg 8750 177 378 IMAGE-HIGH-RES 1-s2.0-S2468823124007612-fx5_lrg.jpg https://s3-eu-west-1.amazonaws.com/prod-ucs-content-store-eu-west/content/pii:S2468823124007612/HIGHRES/image/jpeg/69fed8cd31587f26e1f89d4f2d3652fa/fx5_lrg.jpg fx5 fx5_lrg.jpg jpg 13410 258 385 IMAGE-HIGH-RES 1-s2.0-S2468823124007612-fx6_lrg.jpg https://s3-eu-west-1.amazonaws.com/prod-ucs-content-store-eu-west/content/pii:S2468823124007612/HIGHRES/image/jpeg/98a1bdd0555a9c57d51c6a4faf247be8/fx6_lrg.jpg fx6 fx6_lrg.jpg jpg 8564 174 354 IMAGE-HIGH-RES 1-s2.0-S2468823124007612-fx1_lrg.jpg https://s3-eu-west-1.amazonaws.com/prod-ucs-content-store-eu-west/content/pii:S2468823124007612/HIGHRES/image/jpeg/63cbec17258b847116bcd6816a75f516/fx1_lrg.jpg fx1 fx1_lrg.jpg jpg 32180 228 1250 IMAGE-HIGH-RES 1-s2.0-S2468823124007612-fx2_lrg.jpg https://s3-eu-west-1.amazonaws.com/prod-ucs-content-store-eu-west/content/pii:S2468823124007612/HIGHRES/image/jpeg/f63e05c7c563694f621b7bd64f44e833/fx2_lrg.jpg fx2 fx2_lrg.jpg jpg 6989 162 273 IMAGE-HIGH-RES 1-s2.0-S2468823124007612-gr4_lrg.jpg https://s3-eu-west-1.amazonaws.com/prod-ucs-content-store-eu-west/content/pii:S2045232219161809/HIGHRES/image/jpeg/3edd3381de67db61b856793527bfc7f1/gr4_lrg.jpg gr4 gr4_lrg.jpg jpg 843839 1900 2364 IMAGE-HIGH-RES 1-s2.0-S2468823124007612-gr5_lrg.jpg https://s3-eu-west-1.amazonaws.com/prod-ucs-content-store-eu-west/content/pii:S2045232219161809/HIGHRES/image/jpeg/7a38901d975af12da5007e81bc1a8130/gr5_lrg.jpg gr5 gr5_lrg.jpg jpg 706286 1840 2340 IMAGE-HIGH-RES 1-s2.0-S2468823124007612-gr6_lrg.jpg https://s3-eu-west-1.amazonaws.com/prod-ucs-content-store-eu-west/content/pii:S2045232217019769/HIGHRES/image/jpeg/79e909cc2bd2b030f384aeeaf1a3330e/gr6_lrg.jpg gr6 gr6_lrg.jpg jpg 961394 2951 2364 IMAGE-HIGH-RES 1-s2.0-S2468823124007612-gr7_lrg.jpg https://s3-eu-west-1.amazonaws.com/prod-ucs-content-store-eu-west/content/pii:S2045232219184039/HIGHRES/image/jpeg/82095b51d818e722e672ec00577b1fba/gr7_lrg.jpg gr7 gr7_lrg.jpg jpg 800319 2199 2697 IMAGE-HIGH-RES 1-s2.0-S2468823124007612-mmc4.pdf https://s3-eu-west-1.amazonaws.com/prod-ucs-content-store-eu-west/content/pii:S2468823124007612/mmc4/MAIN/application/pdf/442dcd70f3aa745abce2b353b2e02d8b/mmc4.pdf mmc4 mmc4.pdf pdf false 119520 APPLICATION 1-s2.0-S2468823124007612-mmc5.pdf https://s3-eu-west-1.amazonaws.com/prod-ucs-content-store-eu-west/content/pii:S2468823124007612/mmc5/MAIN/application/pdf/7e455b649e48b9fab9f4dd704d76b95a/mmc5.pdf mmc5 mmc5.pdf pdf false 135147 APPLICATION 1-s2.0-S2468823124007612-mmc2.pdf https://s3-eu-west-1.amazonaws.com/prod-ucs-content-store-eu-west/content/pii:S2468823124007612/mmc2/MAIN/application/pdf/2ffda27c33fb074a886e312514514c50/mmc2.pdf mmc2 mmc2.pdf pdf false 102419 APPLICATION 1-s2.0-S2468823124007612-mmc3.pdf https://s3-eu-west-1.amazonaws.com/prod-ucs-content-store-eu-west/content/pii:S2468823124007612/mmc3/MAIN/application/pdf/083e065aa4daa75d0b41d9f247a21013/mmc3.pdf mmc3 mmc3.pdf pdf false 138174 APPLICATION 1-s2.0-S2468823124007612-mmc8.zip https://s3-eu-west-1.amazonaws.com/prod-ucs-content-store-eu-west/content/pii:S2468823124007612/mmc8/MAIN/application/zip/c7e01b6332f4bdd512edf2233f2dfb7f/mmc8.zip mmc8 mmc8.zip zip 149272 APPLICATION 1-s2.0-S2468823124007612-mmc9.zip https://s3-eu-west-1.amazonaws.com/prod-ucs-content-store-eu-west/content/pii:S2468823124007612/mmc9/MAIN/application/zip/c1f830b4f798fd279f5d3cde1cbb80cd/mmc9.zip mmc9 mmc9.zip zip 212988 APPLICATION 1-s2.0-S2468823124007612-mmc6.zip https://s3-eu-west-1.amazonaws.com/prod-ucs-content-store-eu-west/content/pii:S2468823124007612/mmc6/MAIN/application/zip/d9f810a61dbf93a59ad47e885b419004/mmc6.zip mmc6 mmc6.zip zip 155068 APPLICATION 1-s2.0-S2468823124007612-mmc7.zip https://s3-eu-west-1.amazonaws.com/prod-ucs-content-store-eu-west/content/pii:S2468823124007612/mmc7/MAIN/application/zip/91e454d258ec905fa1bfa9c2b38bda97/mmc7.zip mmc7 mmc7.zip zip 209769 APPLICATION 1-s2.0-S2468823124007612-mmc1.doc https://s3-eu-west-1.amazonaws.com/prod-ucs-content-store-eu-west/content/pii:S2468823124007612/mmc1/MAIN/application/msword/7dc67d444ffb6f50282a986d9d331f3b/mmc1.doc mmc1 mmc1.doc doc 6110208 APPLICATION MCAT 114579 114579 S2468-8231(24)00761-2 10.1016/j.mcat.2024.114579 Elsevier B.V. Fig. 1 (a) Binuclear {Cu2(μ 2-Cl)(N–N)2} subunit and DTAB ligand in compound 1; (b) 2-D cationic metal-organic host framework in 1; (c) Cu-organic window and hydrogen bonding interactions around [PMo12O40]3− polyoxoanion in compound 1; (d) 3-D supramolecular framework structure of 1. Fig 1 Fig. 2 (a) Binuclear {Cu2(μ 2-OH)(N–N)2} cluster in 3; (b) 1-D Cu–O–Cu chain in 3; (c) 2-D metal-organic layer in 3; (d) Hydrogen bonding interactions among [H3PMo11CuO40]4− cluster and adjacent layers; (e) 3-D POM-based host-guest supramolecular structure of 3. Fig 2 Fig. 3 UV/Vis spectra of (a) TMB+H2O2 and (b) TMB+TBHP systems with compounds 1–4 as catalysts; (c) Absorption at 654 nm in TMB+TBHP systems with compounds 1–4 or raw materials as catalysts; (d) UV/Vis spectra and (e) Absorption at 654 nm of TMB oxidation catalyzed by adding IPA, HQ and AA for scavenging of ∙OH, ∙O2 −, and all types of ROS. Fig 3 Fig. 4 (a) Reaction equation of the catalytic oxidation of DPM. (b-d) The influences of reaction conditions on the catalytic oxidations of DPM to BP: (b) Solvent. (c) TBHP amount. (d) Temperature. (e) The amount of catalyst. Reaction conditions: DPM 0.3 mmol, TBHP 0.3–2.4 mmol, catalyst 10–30 mg, 60–80 ℃, and solvent 1.5 mL. The product yields were determined by GC. The dot line diagrams and histograms represent the conversion and selectivity, respectively. Fig 4 Fig. 5 (a) Conversion curves of DPM catalyzed by compounds 1–4; (b) Corresponding kinetic fitting curves of compounds 1–4; (c) Conversion of DPM and selectivity of the BP product obtained by various catalysts in 12 h reaction. Fig 5 Fig. 6 (a) Quenching experiments using different scavengers in catalytic DPM oxidation; (b) EPR spectra of catalytic DPM oxidation; (c) EPR spectra of the PBN spin trap agent; (d) Catalytic conversion of substrates with different bond disassociation energy by compound 1 in 12 h; (e) The possible reaction mechanism of DPM oxidation catalyzed by compounds. Fig 6 Fig. 7 (a) Hot filtration experiment of compound 1 for selective oxidation of DPM; (b) Recycling tests with compound 1 as catalyst; (c) IR spectra and (d) XRD patterns of the compound 1 before and after catalytic reactions. Fig 7 Table 1 C−H bond oxidation reaction of DPM catalyzed by various catalysts a . Table 1 Image, table 1 Entry Catalyst Time (h) Con. b (%) Sel. b (%) 1 Compound 1 12 79 ± 2 98 ± 2 2 Compound 2 12 78 ± 2 97 ± 1 3 Compound 3 12 88 ± 1 97 ± 1 4 Compound 4 12 86 ± 1 98 ± 1 5 no catalyst 12 3 ± 2 85 ± 2 6 CsxH3-xPMo12O40 c 12 42 ± 1 89 ± 1 7 CsxH3-xPW12O40 c 12 41 ± 2 85 ± 2 8 CuCl2·2H2O c 12 29 ± 1 84 ± 1 9 DTAB c 12 5 ± 2 97 ± 1 10 PMo12/CuCl2 c 12 47 ± 1 92 ± 2 11 PW12/CuCl2 c 12 45 ± 1 93 ± 1 12 Compound 1 24 96 98 13 CuO/MoO3 d 24 69 94 14 CuO/WO3 d 24 65 92 a Reaction conditions: DPM (0.3 mmol), TBHP (2.4 mmol), catalyst (20 mg), 80 °C, and acetonitrile (1.5 mL), 12 h. b Product BP was identified by GC-MS and GC analysis. Conversion for DPM and selectivity for BP measured on the basis of naphthylene as the internal standard. c All POMs and DTAB are 0.007 mmol, CuCl2·2H2O is 0.1 mmol. d The materials were prepared by annealing compounds 1–2 in an air atmosphere to ensure that the mole ratio of Cu/Mo or Cu/W is consistent with the composition of compounds. Table 2 Catalytic oxidation of benzylic C–H compounds to the corresponding ketone using compound 1 as a heterogeneous catalyst. a Table 2 Entry Substrate Product Con. b (%) Sel. b (%) 1 Image, table 2 Image, table 2 86 ± 1 97 ± 1 2 Image, table 2 Image, table 2 68 ± 2 99 ± 1 3 Image, table 2 Image, table 2 87 ± 1 88 ± 1 4 Image, table 2 Image, table 2 99 ± 1 55 ± 1 5 Image, table 2 Image, table 2 98 ± 1 99 ± 1 6 Image, table 2 Image, table 2 99 ± 1 98 ± 1 7 Image, table 2 Image, table 2 99 ± 1 65 ± 1 a Reaction conditions: substrate (0.3 mmol), TBHP (2.4 mmol), compound 1 (0.007 mmol), acetonitrile (1.5 mL), 80 °C, 24 h. b The conversion and selectivity for target products were measured on the basis of naphthalene as the internal standard. All of the products were identified by GC–MS and GC analysis. Polyoxometalate-embedded copper-organic network as dual-site synergetic catalyst for the selective oxidation of benzylic C−H bond Yue Wang Writing – original draft Validation Investigation Data curation Qian Liu Writing – original draft Validation Investigation Data curation Yuan-Yuan Ma Writing – review & editing Writing – original draft Supervision Funding acquisition Conceptualization ⁎ Ze-Xuan Liu Writing – original draft Validation Investigation Data curation Ya-Nan Zhang Writing – review & editing Validation Investigation Data curation Yu-Shuo Wang Writing – review & editing Validation Investigation Data curation Jing Du Writing – review & editing Writing – original draft Supervision Funding acquisition Conceptualization ⁎ Zhan-Gang Han Writing – review & editing Supervision Project administration Funding acquisition Conceptualization ⁎ Hebei Technology Innovation Center for Energy Conversion Materials and Devices, National Demonstration Center for Experimental Chemistry Education, Testing and Analysis Center, College of Chemistry and Materials Science, Hebei Normal University, Shijiazhuang, Hebei 050024, PR China Hebei Technology Innovation Center for Energy Conversion Materials and Devices National Demonstration Center for Experimental Chemistry Education Testing and Analysis Center College of Chemistry and Materials Science Hebei Normal University Shijiazhuang Hebei 050024 PR China Hebei Technology Innovation Center for Energy Conversion Materials and Devices, National Demonstration Center for Experimental Chemistry Education, Testing and Analysis Center, College of Chemistry and Materials Science, Hebei Normal University, Shijiazhuang, Hebei 050024, PR China ⁎ Corresponding authors. Selective activation and oxidization of inert C−H bonds into value-added chemicals affords attractively economic and ecological benefits, as well as central challenge in modern synthetic chemistry. Herein, by integrating the redox polyoxometalate (POM) centers and multinuclear copper sites in one system, four compounds were constructed with formulas of [Cu2(μ 2-Cl)(H2O)2L3][PM12O40]·4H2O (M = Mo for 1, W for 2), and [Cu4(μ 2-OH)4L2] [H3PM11CuO40]·12H2O (M = Mo for 3, W for 4, L = 1,4-di[4H-1,2,4-triazol-4-yl]-benzene). Both compounds 1–2 exhibited 3-D POM-embedded supramolecular networks constructed by discrete [PM12O40]3− clusters and binuclear {Cu2(μ 2-Cl)(N–N)2} unit-based metal-organic sheets. While compounds 3–4 displayed 3-D POM-supported supramolecular networks composed of monosubstituted Keggin-type anions [H3PM11CuO40]4− and {Cu2(μ 2-OH)(N–N)2} chain-based metal-organic layers. Four crystalline structures with distinct dual-active site distribution showed significant peroxidase-like activities owing to the collaborative catalysis of multinuclear copper units and polyanionic clusters, which can smoothly catalyze the C−H bond oxidation of diphenylmethane to benzophenone with ca. 97 % conversion and >98 % selectivity within 24 h. Notably, the monosubstituted [H3PM11CuO40]4−-based compounds 3−4 showed higher catalytic activities than [PM12O40]3−-based compounds 1−2 (88 % conversion and >97 % selectivity within 12 h). This kind of crystalline structures also showed good recoverability. The synergetic reaction mechanism was also explored. This work provides a new strategy to design robust heterogeneous POM-based synergetic catalysts for C−H bond functionalization. Graphical abstract Image, graphical abstract Keywords Polyoxometalate Metal-organic network C−H bond oxidation Heterogeneous catalysis Synergetic catalyst Data availability Data will be made available on request. 1 Introduction The activation and selective oxidation of inert C−H bonds represents one of the most fundamental chemical transformations in modern organic synthesis for value-added oxidized products [1-3]. The selective oxidation of C–H bond to form ketone is one of the key research areas. Ketones are a kind of important intermediates in the synthesis of pharmaceuticals, natural products, agrochemicals, dyes, and other fine chemicals [4,5]. Most of traditional methods for C–H bond oxidation to ketone derivatives need stoichiometric amount of strong oxidants, such as potassium permanganate, chromium reagents, etc. However, there are multiple problems with the use of these oxidants for reactions, such as by-products, troublesome post-treatment, and significant environmental pollution [5]. Therefore, the exploration of efficient catalyst system for the selective oxidation of C–H bond to form ketone is highly desired. Polyoxometalates (POMs) have been recognized as promising green functional materials in various fields of catalysis [6-24], sensing [25,26], energy [27], medicines and tumor therapy [28,29], owing to their attractive merits of adjustable acid/base, redox property, and excellent stability [30-36]. Especially, POMs possess specific peroxidase-mimicking activity, which can effectively activate and convert the peroxides to reactive oxygen species for selective oxidation of organic substrates via multistep electron-transfer process [35,37]. For example, Mizuno and co-workers reported a divanadium- substituted phosphotungstate [γ-H2PV2W10O40]3− to realize specific, regioselective, H2O2-based hydroxylation of secondary C–H bonds [38]. Neumann et al. isolated a dicobalt(IV)-μ-oxo phosphotungstate [(α 2-P2W17O61Co)2O]14−, which was the reactive species for selective oxidation of alcohols by C–H bond activation [39]. Han et al. reported a kind of bio-based POM hybrids via the assembly of the natural phytic acid with MoO3, which achieved the efficient aerobic oxidation of benzylic C(sp3)–H bonds to corresponding carbonyl compounds [40]. Recently, copper-based compounds as artificial metalloenzyme systems have high activities to cleave inert specific C−H bonds for further oxidation [41-44]. Lin et al. integrated an binuclear copper monooxygenase with Ti-MOF that could cooperatively stabilize the Cu-O2 adduct for O−O bond cleavage, displaying catalytic performance toward various C−H bond oxidation processes [45]. Schrӧder reported a paddlewheel-like [Cu2 II(O2CR)4] node-based MOF, in which can activate tert‑butyl hydrogen peroxide (TBHP) via the partial reduction of itself into [CuICuII(O2CR)4] species to oxidize the C–H bonds in benzylic compounds [46]. Considering the advantages of POMs and copper sites in activating peroxide for C–H bond oxidation, incorporating POM clusters into the active copper-organic networks, would provide a potential efficient strategy to achieve the synergistic promotion of catalytic performance. POMs possess abundant surface-active oxygen species and high negative charge that can be easily assemble into copper-organic network to construct multiple active sites for target reactions [47-49]. For instance, Liu's group demonstrated a copper(II)/{PMo12} homogeneous catalytic system that can effectively induce the production of tert‑butanol radical intermediate for the selective oxidation of benzylic C–H bonds to ketones with good functional group tolerance and high chemical selectivity [50]. The experimental results revealed that the catalytic synergy of copper(II)/{PMo12} could improve the selectivity for benzylic C–H bond oxidation, and both copper(II) and {PMo12} could promote the decomposition of TBHP to form tert‑butanol radicals for accelerating the conversion of ethylbenzene to acetophenone. Wang and co-workers reported a kind of Cu/POM complexes for catalytic diphenylmethane with >92 % conversion and 100 % selectivity towards benzophenone [51]. Chang et al. demonstrated Cu/POM coordination polymers could selectively catalyze the oxidation of substituted phenols to p-benzoquinones with H2O2 [52]. These significant advances corroborate the advantages of integrating POMs and copper sites in enhancing catalytic performance [53-55]. However, the copper sites in these currently reported compounds are mainly distributed in metal-organic fragments. Exploring the influence of the relative position of copper sites in POM-based copper-organic compounds (copper-organic network or POM cluster self) on the catalytic performance, will provide another pathway for developing efficient dual-site synergetic catalysts. Based on above mentioned analysis, four POM-embedded copper-organic networks were synthesized and used as dual-site synergetic catalysts for benzylic C−H oxidation. The formulas are [Cu2(μ 2-Cl)(H2O)2L3][PM12O40]·4H2O (M = Mo for 1, W for 2), and [Cu4(μ 2-OH)4L2] [H3PM11CuO40]·12H2O (M = Mo for 3, W for 4) (L = 1,4-di[4H-1,2,4-triazol-4-yl]-benzene, denoted as DTAB). Compounds 1 and 2 possess similar structures and exhibit three-dimensional (3-D) POM-embedded networks constructed by binuclear {Cu2(μ 2-Cl)(N–N)2} unit-based 2-D networks and [PM12O40]3− clusters. Compounds 3 and 4 possess similar 2-D copper-organic cationic layers containing unique {Cu2(μ 2-OH)(N–N)2} chains, that were further intercalated by monosubstituted [H3PM11CuO40]4− clusters into 3-D supramolecular structures. Four compounds provide distinct structural models to explore the influence of copper site positions on catalytic performance. Experiments showed that compounds 1–4 can efficiently activate H2O2 and TBHP to decompose into strong oxidizing groups to oxidize 3,3′,5,5′-tetramethylbenzidine (TMB) solution to blue. Taking the C−H bond oxidation of diphenylmethane (DPM) as a model reaction, four compounds displayed excellent heterogeneous catalytic activity and high product selectivity. The monosubstituted [H3PM11CuO40]4−-based compounds 3−4 showed higher catalytic activities with 88 % conversion of DPM and >97 % selectivity to benzophenone within 12 h than that of [PM12O40]3−-based compounds 1−2. Moreover, these compounds as heterogeneous catalysts demonstrated high stability and excellent recoverability. 2 Results and discussion 2.1 Synthesis of compounds 1–4 Compounds 1–4 were synthesized by hydrothermal methods using CuCl2·H2O, H3PM12O40·xH2O (M = W, Mo), DTAB as raw materials, and acetonitrile was added to the reaction system to adjust the solubility of the ligand. During the synthetic process, the reaction temperature and pH condition played key roles in the formation of four compounds. The optimized parameters were as follows: compounds 1–2 were synthesized under lower reaction temperature (120 °C) and pH environments (1.5 for 1 and 4.8 for 2), while compounds 3–4 were isolated under higher reaction temperatures (160 and 180 °C) and pH conditions (2.6 for 3 and 5.1 for 4). Under such high reaction temperature and pH condition, the monosubstituted Keggin-type [H3PM11CuO40]4− anions were in-situ synthesized via a dissociation-reassembly process in compounds 3–4. DTAB ligand provides four potential coordination sites to bond with Cu2+ ions for the generation of cationic copper-organic network, which could interact with POM polyoxoanions for facilitating the formation of synergetic catalytic systems. 2.2 Structure of compounds 1–4 Single crystal X-ray analyses revealed that compounds 1 and 2 possess similar structures and adopt a POM-embedded 3-D supramolecular network (Table S1 and Figures S1–S2). Taking compound 1 as an example, there are two crystallographically independent Cu centers (Cu1 and Cu2), which are six-coordinated by four nitrogen donors from four DTAB ligands, one μ 2-Cl atom and one coordinated water molecule to form a distorted octahedral configuration (Figure S1). The Cu–N bond length ranges from 1.986(6) Å to 2.031(6) Å, and the N–Cu–N angle varies from 85.6(3)° to 175.7(3)°. The distance of Cu–Cl bond is 2.598(2) Å, and the bond angle of N–Cu–Cl is in the range of 86.16(18)°–96.51(19)° (Tables S2–S3). In compound 1, the DTAB ligands display three kinds of coordination modes, which can be divided into three groups: ‘pyrazole-like’ four-connection ligand (4c-L), two-connection ligand with trans-configuration (trans-2c-L) and two-connection ligand with cis-configuration (cis-2c-L) (Figure S3). Cu1 and Cu2 centers are bridged by one μ 2-Cl atom and two N–N fragments from two 4c-L to compose a unique di-nuclear {Cu2 (μ 2-Cl)(N–N)2} unit (Fig. 1a ). The binuclear {Cu2(μ 2-Cl)(N–N)2} units serve as a four-connected node and further connect with two trans-2c-L and two cis-2c-L to form a 2-D metal-organic layer on the bc plane (Fig. 1b). The 2-D layers possess rhombic shaped windows with size of 13.02 × 13.05 Å (Fig. 1c) and present a sql-type 4-c topological net with point symbol of {44.62}. The large quadrilateral pore size and abundant aromatic rings provide a confined environment to stabilize non-coordinated [PMo12O40]3− clusters via plentiful C–H…O and O–H…O hydrogen bonding interactions, which would accelerate the energy transport and electron transfer between the two active sites during oxidation catalysis (Fig. 1c and Tables S4–S5). The 2-D layers are parallelly stacked along a axis with [PMo12O40]3− clusters in ‘egg-in-box’ fashion to extend into 3-D supramolecular framework structure (Fig. 1d). Compounds 3 and 4 are also isostructural and belong to the monoclinic P21/c space group (Table S1 and Figure S4–S5). Exemplifying compound 3 as an example, the asymmetric structural unit of compound 3 consists of half mono-substituted Keggin-type [H3PMo11CuO40]4− polyanion, two CuII cations (Cu1 and Cu2), two μ 2-O atoms and two DTAB ligands (Figure S4a). In compound 3, both Cu1 and Cu2 centers adopt nearly planar quadrilateral configurations and are four-coordinated by two μ 2-O atoms and two nitrogen donors from two DTAB (4c-L) ligands, with Cu–N/O bond lengths of 1.890(10) Å–2.007(9) Å and N/O–Cu–N/O angle ranges of 87.0(4)°–178.1(4)° (Figure S4b and Tables S6-S7). The adjacent Cu centers are bridged by μ 2-O donors to form a one-dimensional (1-D) Cu–O–Cu chain with bi-nuclear {Cu2(μ 2-OH)(N–N)2} units (Fig. 2a –2b), which are further supported by DTAB ligands (4c-L) via ‘pyrazole-like’ connection mode to extend out to 2-D wavy layers along c axis (Fig. 2c). These 2-D sheets feature uninodal 4-c kgm/Shubnikov plane nets with {32.62.72} topology (Figure S6). The abundant aromatic rings on 2-D sheets induce strong non-covalent intermolecular interactions with [H3PMo11CuO40]4− clusters via plentiful C–H…O and O–H…O hydrogen bonds (Tables S8–S9), which could enlarge the synergistic effect between two active sites for C–H bond oxidation (Fig. 2d). Finally, [H3PMo11CuO40]4− clusters as guests are distributed between the parallel-stacked 2-D layers to construct the 3-D supramolecular network (Fig. 2e). Notably, in 3-D network the {Cu2(μ 2-OH)(N–N)2} sites are not blocked by POM clusters, which are accessible in catalytic reaction. Generally, four compounds displayed 3-D POM-embedded copper-organic networks based on Keggin-type polyoxoanions and {Cu-DTAB} 2-D cationic sheets. Integrating the dual sites of copper ion and POM clusters provides promising synergetic catalysts for benzylic C–H bond oxidation. Moreover, this kind of structures provide different distribution of copper sites (metal-organic sheet or POM cluster) and clear catalytic model for studying structure-performance relationships. 2.3 Physical characterizations of compounds 1–4 In order to verify the structures and compositions of compounds 1–4, infrared spectroscopy (IR), powder X-ray diffraction (XRD) and thermogravimetric analysis (TG) were carried out. As shown in Figure S7, the characteristic absorption peaks of Keggin-type polyoxoanions (1060–802 cm−1) and organic DTAB ligands (1640–1538 cm−1) could be observed in IR spectra [6,8,41]. XRD test results showed that the experimental diffraction patterns of compounds 1–4 were basically consistent with the theoretical simulation, suggesting the good crystallinity of them (Figure S8). Bond valence sums calculations demonstrated that Cu ions are in +2 oxidation state and Mo/W atoms are in +6 oxidation state (Tables S10–S13). TG analysis revealed that the main structures of compounds 1–4 can be maintained about 280 °C, implying their good thermal stability (Figure S9). 2.4 Peroxide activation activity of compounds 1–4 Given that H2O2 or TBHP are common peroxide oxidants in benzylic C–H bond oxidation, the peroxide activation activities of compounds 1–4 were examined. By tracking the UV–Vis absorbance at a wavelength of 654 nm, which corresponds to the oxidation product of 3,3′,5,5′-tetramethylbenzidine (TMB) substrate in the presence of H2O2 or TBHP, can indicate the reactive oxygen species (ROS) generated by the activation of H2O2 or TBHP over these compounds. As shown in Fig. 3a , when compounds 1–4 presented in TMB+H2O2 system, the distinct absorption peaks corresponding to the oxidized TMB (oxTMB) appeared at 654 nm along with the solution color changes to blue. This result suggested that compounds 1–4 can activate H2O2 decomposition to produce active oxygen species for TMB oxidation (Fig. 3a). Similarly, TMB oxidation reactions were also conducted over compounds 1–4 in presence of TBHP. As shown in Fig. 3b, the color of TMB-TBHP systems rapidly changed from colorless to blue after the addition of compounds 1–4, demonstrating their high TBHP activation capacity. Notably, the absorbance intensity of oxTMB in TMB-TBHP systems is obviously higher than that in TMB-H2O2 system. The enhanced affinity of compounds 1–4 for TBHP molecule may be caused by the abundant aromatic groups in hybrid structures. Furthermore, a series of control experiments were conducted to explore the origin of the catalytic peroxide activation activity of compounds 1–4. As shown in Fig. 3c, the absorbance of the solution is negligible in the absence of peroxides or catalysts. When the cesium salt of [PM12O40]3− and CuO were presented in the TMB-TBHP system, the absorbance at 654 nm was distinctly enhanced, indicating that both POM anions and copper sites play key roles in activating TBHP molecules. Compared to the raw materials, compounds 1–4 exhibit stronger absorbance intensity, suggesting that there is synergistic catalytic effect between POM clusters and copper-organic networks. It should also be pointed out that the [H3PM11CuO40]4−-based compounds 3–4 show higher catalytic activities than [PM12O40]3−-based compounds 1–2, which indicated that the advantage of monosubstituted POM for peroxide activation. In addition, to disclose the reactive oxygen species in TMB-TBHP system, the radical quenchers (isopropanol (IPA) for ·OH, hydroquinone (HQ) for ·O2 − and ascor bic acid (AA) for all types of ROS) were introduced to the reaction system. After adding IPA, HQ and AA, the intensities of oxTMB are severely weakened (Fig. 3d and 3e). These results demonstrated that the ∙O2 − and ∙OH are major ROS in TBHP activation process, which are beneficial for the following C–H bond oxidation reaction. 2.5 Catalytic oxidation of benzylic C–H bond Given the high TBHP activation activity of compounds 1–4, the benzylic C–H bond oxidation performance was evaluated using diphenylmethane (DPM) as model substrate and TBHP as the oxidant. Before the catalytic reaction, the particle sizes of four crystalline compounds were measured by scanning electron microscope (SEM). As shown in Figure S10, compounds 1–4 show similar particle size distributions with the average size of 0.3 μm, excluding the influence of particle size on catalytic performance. Then, the reaction conditions such as solvent, TBHP dosage, reaction temperature and catalyst dosage were optimized by using compound 1 as representative catalyst. Fig. 4a showed the catalytic oxidation results of DPM at 75 °C in four organic solvents: ethyl acetate, methanol, ethanol and acetonitrile. The conversions of DPM oxidation in ethyl acetate, methanol and ethanol were only 20 %, 21 % and 38 %, and the selectivity of the target product benzophenone (BP) was only 84 %, 60 % and 77 %, respectively, with diphenylmethanol as by-product. When acetonitrile is used as the reaction solvent, the conversion of DPM can reach 84 % and the selectivity of BP can reach 97 %. Compared with other reaction solvents, the catalyst in acetonitrile has the highest conversion of the substrate and the best selectivity of the target product. Therefore, acetonitrile solvent was selected as the best reaction solvent for catalyzing DPM conversion. Subsequently, the effect of the amount of TBHP oxidant on the catalytic performance was investigated using acetonitrile as the reaction solvent. Fig. 4b showed the relationship between the conversion and selectivity and the amount of TBHP in the range of 0.3–3.2 mmol. With the TBHP usage of 0.3 mmol, the conversion of DPM reaches ca. 47 %, which was close to the stoichiometric value, suggesting the production of active oxygen species limits the catalytic performance. With the increase of TBHP dosage from 0.8 mmol to 3.2 mmol, the conversion of DPM increased from 61 % to 85 %. This result indicates that with the increase of TBHP content, more t BuO· and ·OH will be generated during the catalytic reaction to oxidize DPM. Although the conversion rate of TBHP at 2.4 mmol was 84 % lower than that at 3.2 mmol, it had the best BP selectivity (97 %) at 2.4 mmol. Therefore, the optimal dosage of TBHP was determined to be 2.4 mmol. For the DPM oxidation system catalyzed by TBHP as oxidant, it is also very important to explore the effect of reaction temperature on the catalytic performance. As shown in Fig. 4c, the conversion of DPM increased from 55 % to 96 % in the range of 60–80 °C and the selectivity increased from 79 % to 98 %. Therefore, the optimum reaction temperature is 80 °C. The effect of the catalyst amount on the catalytic performance was also studied. With the increase of catalyst dosage from 10 mg to 20 mg, the conversion of DPM increased from 81 % to 96 %, and the selectivity of BP increased from 93 % to 99 %. However, when the amount of catalyst further increased to 30 mg, the conversion of DPM only increased to 99 % (Fig. 4d). Considering the economy of the catalytic reaction, 20 mg was selected as the optimal dosage of the catalyst. In summary, the optimized reaction conditions are obtained with acetonitrile as solvent, TBHP (2.4 mmol), reaction temperature of 80 °C and the catalyst loading of 20 mg. Under the optimal reaction conditions, four compounds displayed excellent catalytic activities for the oxidation of benzylic C–H bond that smoothly converted DPM to BP product with high selectivity and fast kinetics (Figs. 5a and 5b). The conversions of DPM within 24 h were 96 % for 1, 96 % for 2, 97 % for 3–4, and the selectivity of BP were 98 %, 97 %, 97 % and 98 %, respectively (Table 1 , entries 1–4). The reaction rates (k) for four compounds are 0.13 h −1 for 1, 0.13 h −1 for 2, 0.14 h −1 for 3, 0.15 h −1 for 4, respectively. Notably, there are variations in catalytic performance for compounds 1–4. [PM12O40]3−-based compounds 1–2 showed ca. 79 % and 78 % conversion of DPM in 12 h, while [H3PM11CuO40]4−-based compounds 3–4 affords DPM conversions of ca. 88 % for 3 and 86 % for 4 within 12 h. These results revealed that the secondary Cu2+ ion in monosubstituted [H3PM11CuO40]4− cluster and accessible Cu-DTAB sites may assist in the adsorption and activation of substrate molecules and active oxygen species, thus improving the catalytic performance [56–59]. The blank reaction only gave ca. 3 % conversion rate of DPM in the absence of any catalyst (Table 1, entry 5), verifying the high catalytic performance of four compounds for the oxidation of benzylic C–H bonds. To explore the activity origin of four compounds, a series of control samples including POM salts, copper salt and DTAB ligand were selected to evaluate the catalytic performance of each component. CsxH3-xPMo12O40 and CsxH3-xPW12O40 as heterogeneous catalysts afforded moderate DPM conversions of 42 % and 41 % with high selectivity >85 % (Table 1, entries 6–7) in 12 h. Copper salt (CuCl2·2H2O) employed as homogeneous catalyst caused a 29 % conversion of DPM with the selectivity of 84 % (Table 1, entry 8). The DTAB ligand only achieved 5 % conversion of DPM and 97 % selectivity, which is similar to the blank experiment (Table 1, entry 9). Moreover, the mechanical mixtures of PMo12/CuCl2 and PW12/CuCl2 with same equivalent only showed ca. 47 % and 45 % conversions of DPM with >92 % BP selectivity, which were slightly higher than the single POM or copper salt, but far inferior to compounds 1–4 (Fig. 5c; Table 1, entry 10–11). The above results demonstrated that both copper sites and POM clusters are active for the conversion of DPM oxidation to BP. The formation of hybrid structures in compounds 1–4 induce significant synergistic effect for the performance promotion. Furthermore, to specify the advantages of POM supported copper species over other oxides supported copper species, two kinds of CuO/MoO3 and CuO/WO3 composite materials were synthesized and evaluated the catalytic performance toward the oxidation of DPM. As shown in Table 1, entries 13–14, CuO/MoO3 and CuO/WO3 showed ca. 69 % and 65 % conversions of DPM with the corresponding selectivity of 94 % and 92 % for BP. Compared to these materials, compounds 1–4 exhibited better catalytic activities, which imply that the molecular scale distribution of copper species on POM-based support is helpful to enhance the catalytic performance of materials (Table S14). To clarify the reactive intermediate species involved in DPM oxidation process over these compounds, a series of radical trapping experiments were performed by employing active compound 1 as catalyst. First, 1,4-benzoquinone (p-BQ) and IPA as ∙O2 − and ∙OH scavengers were introduced to the reaction system. It can be found that when p-BQ was added, a distinct decrease in DPM conversion (21 %) was observed, and the addition of IPA caused a decrease of DPM conversion to 37 % (Fig. 6a ). These results disclosed that ∙O2 − and ∙OH play important role in the DPM oxidation process (Fig. 6b). Moreover, the electron paramagnetic resonance (EPR) measurements in Fig. 6b also captured the ∙O2 − and ∙OH free radicals. These results further proved the oxidation reaction undergoes a radical mechanism [60]. To further determine the origin of these oxygen radicals, N‑tert-Butyl-α-phenylnitrone (PBN) was added in the reaction system. In absence of catalyst, the introduction of PBN in DPM-TBHP system produced a weak radical signal that could be ascribed to the characteristic of PBN/ t BuOO∙ adduct (Fig. 6c). With the presence of compound 1, the signal intensity has greatly improved, further verifying the high activation activity of dual-site synergetic catalysts for TBHP. In addition, the substrates with different bond disassociated energy (85.9 Kcal/mol for indane, 83.6 Kcal/mol for tetraline, 82.5 Kcal/mol for phthalan) were selected to understand the oxidation reaction mechanism of C(sp3)–H bonds. As shown in Fig. 6d, the yields of the products exhibited a linear relationship with the BDE of the substrate. It indicated the C(sp3)–H bond activation is a rate-determining step, and the hydrogen atom transfer dominates the C(sp3)–H bond oxidization. Based on the above results, the possible mechanism for DPM oxidation catalyzed by compound 1 was proposed (Fig. 6e). In compounds 1–4, both copper site and POM cluster serve as synergetic active centers to activate and convert TBHP into the t BuOO∙, t BuO∙ and ∙OH radical for catalyzing DPM oxidation. Concretely, the POM site were first activated by oxidants to form the active species peroxo-Mo/W, and then the nucleophilic carbon atom in DPM was attacked by peroxo-Mo/W to form an unstable intermediate, which was easily transformed into another unstable intermediate through intramolecular electron transfer. The intermediate can be quickly released to generate BP. In this process, POMs returned to their original form and completed the catalytic cycle. The Cu site first interacts with DPM to form an electron-deficient DPM intermediate, and Cu(II) is reduced to Cu(I). Subsequently, TBHP obtains an electron from Cu(I) to generate tert‑butanol and ·OH, and Cu(I) is oxidized to Cu(II) (Fig. 6e) [23,46,61]. The ∙OH radical with high bond disassociation energy (BDE) can abstract a hydrogen atom from C–H bond of DPM to form an acyl radical. The carbon-center radical could react with TBHP molecules to form t BuOO∙-substrate adduct or peroxy radical, which release a t BuOH molecule to produce benzylic ketones. The scope of substrates in this reaction system was also examined under standard conditions. As shown in Table 2 , the conversion and selectivity of ethylbenzene reaction for 24 h were 86 % and 97 %, respectively. The conversion of ethylbenzene derivatives with electron-withdrawing nitro group was 68 %. The conversion and product selectivity of ethylbenzene derivatives with electron-donating (-CH3) group over compound 1 reached 87 % and 88 % within 24 h. The fluorene with greater steric hindrance gave a conversion of 99 % with the fluorenone selectivity of 98 %. These results implied that compound 1 as a dual-site synergetic catalyst performs well for benzylic C–H oxidation. To assess the heterogeneity of these materials, the thermal filtration experiment was carried out by choosing compound 1 as a representative. As shown in Fig. 7a , the catalyst was thermally filtered from the reaction system after 4 h of reaction, and the obtained mixed solution continued to react for 20 h. The conversion of DPM was increased by only 5 % in the following 20 h, indicating that compound 1 has good heterogeneous catalytic properties. Compound 1 could also be effectively reused for seven times with no distinctly decrease, revealing its good recyclability (Fig. 7b). The structure of catalyst after oxidation reaction was also investigated. The IR and XRD spectra of compound 1 before and after catalysis matched well, verifying the potential practicality of these dual-site synergetic catalysts for C−H oxidation reaction (Figs. 7c-d). 3 Conclusion In summary, a kind of POM-embedded copper-organic networks as dual-site synergetic catalysts were constructed, which present 3-D POM-embedded supramolecular network constructed by discrete Keggin-type [PM12O40]3− or [H3PM11CuO40]4− clusters and copper-organic sheets. Their well-defined structure features provide distinct model for exploring the influence of the relative position of copper sites on the catalytic performance. In compounds 1−4, the copper-organic units and POM clusters synergistically activated the H2O2 and TBHP oxidants to produce active reactive oxygen species, which displayed excellent catalytic performance for the oxidation of benzylic C−H bonds. This kind of dual-site synergetic catalyst systems showed >97 % conversion of DPM and BP selectivity (>98 %) as well as good recyclability and stability. The monosubstituted [H3PM11CuO40]4−-based compounds 3−4 showed higher catalytic activities than [PM12O40]3−-based compounds 1−2. This work provides a promising strategy for the development of efficient POM-based synergetic catalysts for C−H bond oxidation. CRediT authorship contribution statement Yue Wang: Writing – original draft, Validation, Investigation, Data curation. Qian Liu: Writing – original draft, Validation, Investigation, Data curation. Yuan-Yuan Ma: Writing – review & editing, Writing – original draft, Supervision, Funding acquisition, Conceptualization. Ze-Xuan Liu: Writing – original draft, Validation, Investigation, Data curation. Ya-Nan Zhang: Writing – review & editing, Validation, Investigation, Data curation. Yu-Shuo Wang: Writing – review & editing, Validation, Investigation, Data curation. Jing Du: Writing – review & editing, Writing – original draft, Supervision, Funding acquisition, Conceptualization. Zhan-Gang Han: Writing – review & editing, Supervision, Project administration, Funding acquisition, Conceptualization. Declaration of competing interest The authors declare that they have no known competing financial interests or personal relationships that could have appeared to influence the work reported in this paper. Acknowledgements This work was supported by National Natural Science Foundation of China (Grants 22471056, 22301058, 22 371 065, 21901060, 21871076), Natural Science Foundation of Hebei Province (Grants B2024205007, B2024205033, and B2022205005), Science and Technology Project of Hebei Education Department (Grant QN2023049), the China Postdoctoral Science Foundation funded project (No. 2021TQ0095), Project of Science and Technology Department of Hebei Province (22567622H), College Student Innovation and Entrepreneurship Training Program Project of Hebei Normal University (S202310094008) and Chemistry Postdoctoral Research Station at Hebei Normal University. Supplementary materials Supplementary experimental section, FT-IR spectra, XRD patterns, thermogravimetric analysis curves, cyclic voltammetric curves, tables of crystallographic data, bond lengths and angles. The following files are available free of charge. Supplementary material associated with this article can be found, in the online version, at doi:10.1016/j.mcat.2024.114579. Appendix Supplementary materials Image, application 1 Image, application 2 Image, application 3 Image, application 4 Image, application 5 Image, application 6 Image, application 7 Image, application 8 Image, application 9 References [1] L. Ciano G.J. Davies W.B. Tolman P.H. Walton Bracing copper for the catalytic oxidation of C–H bonds Nat. Catal. 1 2018 10.1038/s41929-018-0110-9 L. Ciano, G.J. Davies, W.B. Tolman, P.H. Walton, Bracing copper for the catalytic oxidation of C–H bonds, Nat. Catal. 1 (2018), https://doi.org/10.1038/s41929-018-0110-9. [2] J.N. Zhao H.N. Sun Y. Lu J.L. Li Z.Y. Yu H.F. Zhu C.F. Ma Q.W. Meng X.J. Peng A divergent photocatalysis strategy for selective aerobic oxidation of C(sp3)–H bonds promoted by disulfides Green Chem 24 2022 10.1039/D2GC02755K J.N. Zhao, H.N. Sun, Y. Lu, J.L. Li, Z.Y. Yu, H.F. Zhu, C.F. Ma, Q.W. Meng, X.J. Peng, A divergent photocatalysis strategy for selective aerobic oxidation of C(sp3)–H bonds promoted by disulfides, Green Chem. 24 (2022), https://doi.org/10.1039/D2GC02755K. [3] A. Sur N.B. Jernigan D.C. Powers Kinetic probes of the origin of activity in MOF-based C–H oxidation catalysis ACS Catal 12 2022 10.1021/acscatal.1c05415 A. Sur, N.B. Jernigan, D.C. Powers, Kinetic probes of the origin of activity in MOF-based C–H oxidation catalysis, ACS Catal. 12 (2022), https://doi.org/10.1021/acscatal.1c05415. [4] N. Gupta B.A. Baraiya P.K. Jha H.P. Soni Differentiating the {100} surfaces of Cu2O nanocrystals from {111} and {110} for benzylic Csp 3-H bond oxidation: oxidations of diphenyl methane to benzophenone and cumene to cumene hydroperoxide under mild conditions Mol. Catal. 528 2022 10.1016/j.mcat.2022.112490 N. Gupta, B.A. Baraiya, P.K. Jha, H.P. Soni, Differentiating the {100} surfaces of Cu2O nanocrystals from {111} and {110} for benzylic Csp3-H bond oxidation: oxidations of diphenyl methane to benzophenone and cumene to cumene hydroperoxide under mild conditions, Mol. Catal. 528 (2022), https://doi.org/10.1016/j.mcat.2022.112490. [5] J.Q. Yan Z. Tian A.W. Wang X. Wang J.Y. Huang W.Y. Zhou J.F. Qian J. Cui M.Y. He Conveniently constructing Cu+ sites and oxygen vacancies in layered double hydroxides for the efficient aerobic oxidation of alkylarenes via hydrogen atom transfer process Mol. Catal. 565 2024 10.1016/j.mcat.2024.114353 J.Q. Yan, Z. Tian, A.W. Wang, X. Wang, J.Y. Huang, W.Y. Zhou, J.F. Qian, J. Cui, M.Y. He, Conveniently constructing Cu+ sites and oxygen vacancies in layered double hydroxides for the efficient aerobic oxidation of alkylarenes via hydrogen atom transfer process, Mol. Catal. 565 (2024), https://doi.org/10.1016/j.mcat.2024.114353. [6] A. Haruna Z.M.A. Merican S.G. Musa Remarkable stability and catalytic performance of PW11M@MOF-808 (M=Mn and Cu) nanocomposites for oxidative desulfurization of fuel oil Mol. Catal. 541 2023 10.1016/j.mcat.2023.113079 A. Haruna, Z.M.A. Merican, S.G. Musa, Remarkable stability and catalytic performance of PW11M@MOF-808 (M=Mn and Cu) nanocomposites for oxidative desulfurization of fuel oil, Mol. Catal. 541 (2023), https://doi.org/10.1016/j.mcat.2023.113079. [7] W.S. Tang L.N. Zhang T.Y. Qiu H.Q. Tan Y.H. Wang W. Liu Y.G. Li Efficient conversion of biomass to formic acid coupled with low energy consumption hydrogen production from water electrolysis Angew. Chem. Int. Ed. 62 2023 10.1002/anie.202305843 W.S. Tang, L.N. Zhang, T.Y. Qiu, H.Q. Tan, Y.H. Wang, W. Liu, Y.G. Li, Efficient conversion of biomass to formic acid coupled with low energy consumption hydrogen production from water electrolysis, Angew. Chem. Int. Ed. 62 (2023), https://doi.org/10.1002/anie.202305843. [8] J. Du Y.Y. Ma W.J. Cui S.M. Zhang Z.G. Han R.H. Li X.Q. Han W. Guan Y.H. Wang Y.Q. Li Y. Liu F.Y. Yu K.Q. Wei H.Q. Tan Z.H. Kang Y.G. Li Unraveling photocatalytic electron transfer mechanism in polyoxometalate-encapsulated metal-organic frameworks for high-efficient CO2 reduction reaction Appl. Catal., B 318 2022 10.1016/j.apcatb.2022.121812 J. Du, Y.Y. Ma, W.J. Cui, S.M. Zhang, Z.G. Han, R.H. Li, X.Q. Han, W. Guan, Y.H. Wang, Y.Q. Li, Y. Liu, F.Y. Yu, K.Q. Wei, H.Q. Tan, Z.H. Kang, Y.G. Li, Unraveling photocatalytic electron transfer mechanism in polyoxometalate-encapsulated metal-organic frameworks for high-efficient CO2 reduction reaction, Appl. Catal., B 318 (2022), https://doi.org/10.1016/j.apcatb.2022.121812. [9] M.J. Hülsey B. Zhang Z. Ma H. Asakura D.A. Do W. Chen T. Tanaka P. Zhang Z. Wu N. Yan In situ spectroscopy-guided engineering of rhodium single-atom catalysts for CO oxidation Nat. Commun. 10 2019 10.1038/s41467-019-09188-9 M.J. Hülsey, B. Zhang, Z. Ma, H. Asakura, D.A. Do, W. Chen, T. Tanaka, P. Zhang, Z. Wu, N. Yan, In situ spectroscopy-guided engineering of rhodium single-atom catalysts for CO oxidation, Nat. Commun. 10 (2019), https://doi.org/10.1038/s41467-019-09188-9. [10] B. Zhang G. Sun S.P. Ding H. Asakura J. Zhang P. Sautet N. Yan Atomically dispersed Pt1–polyoxometalate catalysts: how does metal–support interaction affect stability and hydrogenation activity? J. Am. Chem. Soc. 141 2019 10.1021/jacs.9b00486 B. Zhang, G. Sun, S.P. Ding, H. Asakura, J. Zhang, P. Sautet, N. Yan, Atomically dispersed Pt1–polyoxometalate catalysts: how does metal–support interaction affect stability and hydrogenation activity? J. Am. Chem. Soc. 141 (2019), https://doi.org/10.1021/jacs.9b00486. [11] Y.Y. Dong Y.Q. Feng Z. Li H. Zhou H.J. Lv G.Y. Yang CsPbBr3/Polyoxometalate composites for selective photocatalytic oxidation of benzyl alcohol ACS Catal 13 2023 10.1021/acscatal.3c03977 Y.Y. Dong, Y.Q. Feng, Z. Li, H. Zhou, H.J. Lv, G.Y. Yang, CsPbBr3/Polyoxometalate composites for selective photocatalytic oxidation of benzyl alcohol, ACS Catal. 13 (2023), https://doi.org/10.1021/acscatal.3c03977. [12] S. Ru C.C. Zhao Z.K. Wu L.K. Yan D.J. Zang Y.Z. Wei Molecular photocatalysts based on quinolinium-grafted polyoxometalates for efficient one-step aerobic oxidation of benzyl alcohols to benzoic acids ACS Sustainable Chem. Eng. 12 2024 10.1021/acssuschemeng.3c05573 S. Ru, C.C. Zhao, Z.K. Wu, L.K. Yan, D.J. Zang, Y.Z. Wei, Molecular photocatalysts based on quinolinium-grafted polyoxometalates for efficient one-step aerobic oxidation of benzyl alcohols to benzoic acids, ACS Sustainable Chem. Eng. 12 (2024), https://doi.org/10.1021/acssuschemeng.3c05573. [13] G. Liu Y.F. Chen Y.L. Chen Y.Q. Shi M.Y. Zhang G.D. Shen P.F. Qi J.K. Li D.L. Ma F. Yu X.Q. Huang Indirect electrocatalysis S–N/S–S bond construction by robust polyoxometalate based foams Adv. Mater. 35 2023 10.1002/adma.202304716 G. Liu, Y.F. Chen, Y.L. Chen, Y.Q. Shi, M.Y. Zhang, G.D. Shen, P.F. Qi, J.K. Li, D.L. Ma, F. Yu, X.Q. Huang, Indirect electrocatalysis S–N/S–S bond construction by robust polyoxometalate based foams, Adv. Mater. 35 (2023), https://doi.org/10.1002/adma.202304716. [14] L.B. Ni J. Gu X.Y. Jiang H.J. Xu Z. Wu Y.C. Wu Y. Liu J. Xie Y.G. Wei G.W. Diao Polyoxometalate-cyclodextrin-based cluster-organic supramolecular framework for polysulfide conversion and guest–host recognition in lithium-sulfur batteries Angew. Chem. Int. Ed. 62 2023 10.1002/anie.202306528 L.B. Ni, J. Gu, X.Y. Jiang, H.J. Xu, Z. Wu, Y.C. Wu, Y. Liu, J. Xie, Y.G. Wei, G.W. Diao, Polyoxometalate-cyclodextrin-based cluster-organic supramolecular framework for polysulfide conversion and guest–host recognition in lithium-sulfur batteries, Angew. Chem. Int. Ed. 62 (2023), https://doi.org/10.1002/anie.202306528. [15] Y.Q. Gu Q. Li D.J. Zang Y.C. Huang H. Yu Y.G. Wei Light-Induced efficient hydroxylation of benzene to phenol by quinolinium and polyoxovanadate-based supramolecular catalysts Angew. Chem. Int. Ed. 60 2021 10.1002/anie.202011164 Y.Q. Gu, Q. Li, D.J. Zang, Y.C. Huang, H. Yu, Y.G. Wei, Light-Induced efficient hydroxylation of benzene to phenol by quinolinium and polyoxovanadate-based supramolecular catalysts, Angew. Chem. Int. Ed. 60 (2021), https://doi.org/10.1002/anie.202011164. [16] X.Q. Huang S. Liu G. Liu Y.W. Tao C.R. Wang Y.L. Zhang Z. Li H.W. Wang Z. Zhou G.D. Shen Z.C. Xue D. Sun An unprecedented 2-fold interpenetrated lvt open framework built from Zn6 ring seamed trivacant polyoxotungstates used for photocatalytic synthesis of pyridine derivatives Appl. Catal., B 323 2023 10.1016/j.apcatb.2022.122134 X.Q. Huang, S. Liu, G. Liu, Y.W. Tao, C.R. Wang, Y.L. Zhang, Z. Li, H.W. Wang, Z. Zhou, G.D. Shen, Z.C. Xue, D. Sun, An unprecedented 2-fold interpenetrated lvt open framework built from Zn6 ring seamed trivacant polyoxotungstates used for photocatalytic synthesis of pyridine derivatives, Appl. Catal., B 323 (2023), https://doi.org/10.1016/j.apcatb.2022.122134. [17] F.L. Yu M.X. Liu B. Yuan C.X. Xie S.T. Yu Selective oxidation of primary alcohols to carboxylic acids using lacunary polyoxometalates catalysts and hydrogen peroxide Catal. Lett. 153 2023 10.1007/s10562-022-04105-0 F.L. Yu, M.X. Liu, B. Yuan, C.X. Xie, S.T. Yu, Selective oxidation of primary alcohols to carboxylic acids using lacunary polyoxometalates catalysts and hydrogen peroxide, Catal. Lett. 153 (2023), https://doi.org/10.1007/s10562-022-04105-0. [18] Z.K. Wu G. Dai Q.Y. Li Z.Y. Wei S. Ru J.D. Li H.L. Jia D. Zang M. Čolović Y.G. Wei POV-based molecular catalysts for highly efficient esterification of alcohols with aldehydes as acylating agents Chin. Chem. Lett. 35 2024 10.1016/j.cclet.2023.109061 Z.K. Wu, G. Dai, Q.Y. Li, Z.Y. Wei, S. Ru, J.D. Li, H.L. Jia, D. Zang, M. Čolović, Y.G. Wei, POV-based molecular catalysts for highly efficient esterification of alcohols with aldehydes as acylating agents, Chin. Chem. Lett. 35 (2024), https://doi.org/10.1016/j.cclet.2023.109061. [19] M.Q. Zhang Y.Y. Zhai S. Ru D.J. Zang S. Han H. Yu Y.G. Wei Highly practical and efficient preparation of aldehydes and ketones from aerobic oxidation of alcohols with an inorganic-ligand supported iodine catalyst Chem. Commun. 54 2018 10.1039/C8CC03722A M.Q. Zhang, Y.Y. Zhai, S. Ru, D.J. Zang, S. Han, H. Yu, Y.G. Wei, Highly practical and efficient preparation of aldehydes and ketones from aerobic oxidation of alcohols with an inorganic-ligand supported iodine catalyst, Chem. Commun. 54 (2018), https://doi.org/10.1039/C8CC03722A. [20] Z.K. Wu Y.Y. Zhai W.S. Zhao Z.Y. Wei H. Yu S. Han Y.G. Wei An efficient way for the N-formylation of amines by inorganic-ligand supported iron catalysis Green Chem 22 2020 10.1039/C9GC03564H Z.K. Wu, Y.Y. Zhai, W.S. Zhao, Z.Y. Wei, H. Yu, S. Han, Y.G. Wei, An efficient way for the N-formylation of amines by inorganic-ligand supported iron catalysis, Green Chem. 22 (2020), https://doi.org/10.1039/C9GC03564H. [21] Z. Chen M.X. Zou G.Q. Li X.L. Liu Y. Zhou J. Wang Enhancing efficiency of solvent-free oxidation of aromatic alcohols with atmospheric oxygen by POSS-based cationic polymer backbone paired heteropolyanions Mol. Catal. 532 2022 10.1016/j.mcat.2022.112735 Z. Chen, M.X. Zou, G.Q. Li, X.L. Liu, Y. Zhou, J. Wang, Enhancing efficiency of solvent-free oxidation of aromatic alcohols with atmospheric oxygen by POSS-based cationic polymer backbone paired heteropolyanions, Mol. Catal. 532 (2022), https://doi.org/10.1016/j.mcat.2022.112735. [22] Y.Y. Li X.H. Li N. Xu Z.X. An Y. Chu X.L. Wang A new metal−organic complex with coordination unsaturated Co(II) as high-efficiency heterogeneous catalyst for selective oxidation of alkylbenzenes Mol. Catal. 548 2023 10.1016/j.mcat.2023.113428 Y.Y. Li, X.H. Li, N. Xu, Z.X. An, Y. Chu, X.L. Wang, A new metal−organic complex with coordination unsaturated Co(II) as high-efficiency heterogeneous catalyst for selective oxidation of alkylbenzenes, Mol. Catal. 548 (2023), https://doi.org/10.1016/j.mcat.2023.113428. [23] D. Zhu J.Q. Hai L.Y. Wang X.L. Long A study on the oxidation of toluene to benzaldehyde by air catalyzed by polyoxometalate loaded on activated carbon Mol. Catal. 551 2023 10.1016/j.mcat.2023.113626 D. Zhu, J.Q. Hai, L.Y. Wang, X.L. Long, A study on the oxidation of toluene to benzaldehyde by air catalyzed by polyoxometalate loaded on activated carbon, Mol. Catal. 551 (2023), https://doi.org/10.1016/j.mcat.2023.113626. [24] Y.B. Ma F. Gao W.R. Xiao N. Li S.J. Li B. Yu X.N. Chen Two transition-metal-modified Nb/W mixed-addendum polyoxometalates for visible-light-mediated aerobic benzylic C–H oxidations Chin. Chem. Lett. 33 2022 10.1016/j.cclet.2021.12.023 Y.B. Ma, F. Gao, W.R. Xiao, N. Li, S.J. Li, B. Yu, X.N. Chen, Two transition-metal-modified Nb/W mixed-addendum polyoxometalates for visible-light-mediated aerobic benzylic C–H oxidations, Chin. Chem. Lett. 33 (2022), https://doi.org/10.1016/j.cclet.2021.12.023. [25] J.Y. Sun Z.L. Wang Z. Zhang G.C. Liu X.L. Wang Hydrothermal synthesis, structure, and catalytic properties of a (4,6)-connected framework constructed from Keggin-type polyoxometalate units and tetranuclear copper complexes Polyoxometalates 3 2024 10.26599/POM.2023.9140039 J.Y. Sun, Z.L. Wang, Z. Zhang, G.C. Liu, X.L. Wang, Hydrothermal synthesis, structure, and catalytic properties of a (4,6)-connected framework constructed from Keggin-type polyoxometalate units and tetranuclear copper complexes, Polyoxometalates 3 (2024), 10.26599/POM.2023.9140039. [26] J. Li Z. Li J. Dong R.B. Fang Y.N. Chi C.W. Hu Hexaniobate as a recyclable solid base catalyst to activate C–H bonds in lignin linkage boosting the production of aromatic monomers ACS Catal 13 2023 10.1021/acscatal.2c06206 J. Li, Z. Li, J. Dong, R.B. Fang, Y.N. Chi, C.W. Hu, Hexaniobate as a recyclable solid base catalyst to activate C–H bonds in lignin linkage boosting the production of aromatic monomers, ACS Catal. 13 (2023), https://doi.org/10.1021/acscatal.2c06206. [27] H.F. Liu X.R. Sun J. Dong C.P. Liu W. Lu Z.M. Xu N. Zhen D. Zhang Y.N. Chi C.W. Hu Immobilization of Brønsted basic hexaniobate on the Lewis acidic zirconia using an emulsion assisted self-assembly strategy for synergistic boosting of nerve agent simulant decontamination Inorg. Chem. Front. 10 2023 10.1039/D2QI02484E H.F. Liu, X.R. Sun, J. Dong, C.P. Liu, W. Lu, Z.M. Xu, N. Zhen, D. Zhang, Y.N. Chi, C.W. Hu, Immobilization of Brønsted basic hexaniobate on the Lewis acidic zirconia using an emulsion assisted self-assembly strategy for synergistic boosting of nerve agent simulant decontamination, Inorg. Chem. Front. 10 (2023), https://doi.org/10.1039/D2QI02484E. [28] Y.F. Liu C.W. Hu G.P. Yang Recent advances in polyoxometalates acid-catalyzed organic reactions Chin. Chem. Lett. 34 2023 10.1016/j.cclet.2022.108097 Y.F. Liu, C.W. Hu, G.P. Yang, Recent advances in polyoxometalates acid-catalyzed organic reactions, Chin. Chem. Lett. 34 (2023), https://doi.org/10.1016/j.cclet.2022.108097. [29] W.T. An X.J. Zhang J.Q. Niu Y.Y. Ma Z.G. Han Unusual hexa-nuclear cadmium cluster functionalized phosphomolybdate as effective photoelectrochemical sensor for trace Cr(VI) detection Chin. Chem. Lett. 33 2022 10.1016/j.cclet.2021.12.021 W.T. An, X.J. Zhang, J.Q. Niu, Y.Y. Ma, Z.G. Han, Unusual hexa-nuclear cadmium cluster functionalized phosphomolybdate as effective photoelectrochemical sensor for trace Cr(VI) detection, Chin. Chem. Lett. 33 (2022), https://doi.org/10.1016/j.cclet.2021.12.021. [30] X.J. Zhang Y.Y. Ma H.X. Bi X.Y. Yin H. Song M.H. Liu Z.G. Han Wheel-shaped molybdenum(V) cobalt-phosphate cluster as a highly sensitive bifunctional photoelectrochemical sensor for the trace determination of Cr(VI) and tetracycline Inorg. Chem. Front. 9 2022 10.1039/D2QI01936A X.J. Zhang, Y.Y. Ma, H.X. Bi, X.Y. Yin, H. Song, M.H. Liu, Z.G. Han, Wheel-shaped molybdenum(V) cobalt-phosphate cluster as a highly sensitive bifunctional photoelectrochemical sensor for the trace determination of Cr(VI) and tetracycline, Inorg. Chem. Front. 9 (2022), https://doi.org/10.1039/D2QI01936A. [31] C.J. Wang Y.H. Song W.H. Cong Y.Y. Yan M.L. Wang J.D. Zhou From surface loading to precise confinement of polyoxometalates for electrochemical energy storage Chin. Chem. Lett. 34 2023 10.1016/j.cclet.2023.108194 C.J. Wang, Y.H. Song, W.H. Cong, Y.Y. Yan, M.L. Wang, J.D. Zhou, From surface loading to precise confinement of polyoxometalates for electrochemical energy storage, Chin. Chem. Lett. 34 (2023), https://doi.org/10.1016/j.cclet.2023.108194. [32] M.L. Tang J.T. Ni Z.Y. Yue T.D. Sun C.X. Chen X. Ma L. Wang Polyoxometalate-nanozyme-integrated nanomotors (POMotors) for self-propulsion-promoted synergistic photothermal-catalytic tumor therapy Angew. Chem. Int. Ed. 63 2024 10.1002/anie.202315031 M.L. Tang, J.T. Ni, Z.Y. Yue, T.D. Sun, C.X. Chen, X. Ma, L. Wang, Polyoxometalate-nanozyme-integrated nanomotors (POMotors) for self-propulsion-promoted synergistic photothermal-catalytic tumor therapy, Angew. Chem. Int. Ed. 63 (2024), https://doi.org/10.1002/anie.202315031. [33] L.G. Tang F. Yu B.W. Tang Z. Yang W.P. Fan M.R. Zhang Z.T. Wang O. Jacobson Z.J. Zhou L. Li Y.J. Liu D.O. Kiesewetter W. Tang L.C. He Y. Ma G. Niu X.Z. Zhang X.Y. Chen Tumor microenvironment-activated ultrasensitive nanoprobes for specific detection of intratumoral glutathione by ratiometric photoacoustic imaging ACS Appl. Mater. Interfaces 11 2019 10.1021/acsami.9b08100 L.G. Tang, F. Yu, B.W. Tang, Z. Yang, W.P. Fan, M.R. Zhang, Z.T. Wang, O. Jacobson, Z.J. Zhou, L. Li, Y.J. Liu, D.O. Kiesewetter, W. Tang, L.C. He, Y. Ma, G. Niu, X.Z. Zhang, X.Y. Chen, Tumor microenvironment-activated ultrasensitive nanoprobes for specific detection of intratumoral glutathione by ratiometric photoacoustic imaging, ACS Appl. Mater. Interfaces 11 (2019), https://doi.org/10.1021/acsami.9b08100. [34] Y.S. Xia L. Zhang J.N. Lu X.H. Zhao L.Z. Dong J. Liu Y.Q. Lan A triple tandem reaction for the upcycling of products from poorly selective CO2 photoreduction systems Nat. Synth 3 2024 10.1038/s44160-023-00458-5 Y.S. Xia, L. Zhang, J.N. Lu, X.H. Zhao, L.Z. Dong, J. Liu, Y.Q. Lan, A triple tandem reaction for the upcycling of products from poorly selective CO2 photoreduction systems, Nat. Synth 3 (2024), https://doi.org/10.1038/s44160-023-00458-5. [35] G.P. Yang K. Li C.W. Hu Recent advances in uranium-containing polyoxometalates Inorg. Chem. Front. 9 2022 10.1039/D2QI01834A G.P. Yang, K. Li, C.W. Hu, Recent advances in uranium-containing polyoxometalates, Inorg. Chem. Front. 9 (2022), https://doi.org/10.1039/D2QI01834A. [36] W.J. Cui S.M. Zhang Y.Y. Ma Y. Wang R.X. Miao Z.G. Han Polyoxometalate-incorporated metal-organic network as a heterogeneous catalyst for selective oxidation of aryl alkenes Inorg. Chem. 61 2022 9421 9432 10.1021/acs.inorgchem.2c00036 W.J. Cui, S.M. Zhang, Y.Y. Ma, Y. Wang, R.X. Miao, Z.G. Han, Polyoxometalate-incorporated metal-organic network as a heterogeneous catalyst for selective oxidation of aryl alkenes, Inorg. Chem. 61 (2022), 9421–9432 https://doi.org/10.1021/acs.inorgchem.2c00036. [37] K. Li Y.F. Liu X.L. Lin G.P. Yang Copper-containing polyoxometalate-based metal–organic frameworks as heterogeneous catalysts for the synthesis of N-heterocycles Inorg. Chem. 61 2022 10.1021/acs.inorgchem.2c00287 K. Li, Y.F. Liu, X.L. Lin, G.P. Yang, Copper-containing polyoxometalate-based metal–organic frameworks as heterogeneous catalysts for the synthesis of N-heterocycles, Inorg. Chem. 61 (2022), https://doi.org/10.1021/acs.inorgchem.2c00287. [38] J. Li Y.Q. Feng F.Y. Fu X. Xin G.Y. Yang H.J. Lv Polyoxometalate-organic cage with {Ni4SiW9} node for photocatalytic hydrogen evolution Chin. Chem. Lett. 35 2024 10.1016/j.cclet.2023.108736 J. Li, Y.Q. Feng, F.Y. Fu, X. Xin, G.Y. Yang, H.J. Lv, Polyoxometalate-organic cage with {Ni4SiW9} node for photocatalytic hydrogen evolution, Chin. Chem. Lett. 35 (2024), https://doi.org/10.1016/j.cclet.2023.108736. [39] J.X. Liu X.B. Zhang Y.L. Li S.L. Huang G.Y. Yang Polyoxometalate functionalized architectures Coord. Chem. Rev. 414 2020 10.1016/j.ccr.2020.213260 J.X. Liu, X.B. Zhang, Y.L. Li, S.L. Huang, G.Y. Yang, Polyoxometalate functionalized architectures, Coord. Chem. Rev. 414 (2020), https://doi.org/10.1016/j.ccr.2020.213260. [40] K.J. Qin D.J. Zang Y.G. Wei Polyoxometalates based compounds for green synthesis of aldehydes and ketones Chin. Chem. Lett. 34 2023 10.1016/j.cclet.2022.107999 K.J. Qin, D.J. Zang, Y.G. Wei, Polyoxometalates based compounds for green synthesis of aldehydes and ketones, Chin. Chem. Lett. 34 (2023), https://doi.org/10.1016/j.cclet.2022.107999. [41] J. Jiang Y. Li L. Liu L. Chen J. Zhao C. Streb Y.F. Song First ultrathin pure polyoxometalate 2D material as a peroxidase-mimicking catalyst for detecting oxidative stress biomarkers ACS Appl. Mater. Interfaces 15 2022 10.1021/acsami.2c15579 J. Jiang, Y. Li, L. Liu, L. Chen, J. Zhao, C. Streb, Y.F. Song, First ultrathin pure polyoxometalate 2D material as a peroxidase-mimicking catalyst for detecting oxidative stress biomarkers, ACS Appl. Mater. Interfaces 15 (2022), https://doi.org/10.1021/acsami.2c15579. [42] Y. Wang K. Kamata R. Ishimoto Y. Ogasawara K. Suzuki K. Yamaguchi N. Mizuno Composites of [γ-H2PV2W10O40]3− and [α-SiW12O40]4− supported on Fe2O3 as heterogeneous catalysts for selective oxidation with aqueous hydrogen peroxide Catal. Sci. Technol. 5 2015 10.1039/C4CY01693A Y. Wang, K. Kamata, R. Ishimoto, Y. Ogasawara, K. Suzuki, K. Yamaguchi, N. Mizuno, Composites of [γ-H2PV2W10O40]3− and [α-SiW12O40]4− supported on Fe2O3 as heterogeneous catalysts for selective oxidation with aqueous hydrogen peroxide, Catal. Sci. Technol. 5 (2015), https://doi.org/10.1039/C4CY01693A. [43] D. Barats-Damatov L.J.W. Shimon L. Weiner R.E. Schreiber P. Jiménez-Lozano J.M. Poblet C. de Graaf R. Neumann Dicobalt-μ-oxo polyoxometalate compound, [(α 2-P2W17O61Co)2O]14−: a potent species for water oxidation, C–H bond activation, and oxygen transfer Inorg. Chem. 53 2014 10.1021/ic402962c D. Barats-Damatov, L.J.W. Shimon, L. Weiner, R.E. Schreiber, P. Jiménez-Lozano, J.M. Poblet, C. de Graaf, R. Neumann, Dicobalt-μ-oxo polyoxometalate compound, [(α2-P2W17O61Co)2O]14−: a potent species for water oxidation, C–H bond activation, and oxygen transfer, Inorg. Chem. 53 (2014), https://doi.org/10.1021/ic402962c. [44] J.L. Song M.L. Hua X. Huang J. Ma C. Xie B.X. Han Polyoxometalate hybrid for selective aerobic oxidation of benzylic C(sp3)–H bonds ACS Catal 13 2023 10.1021/acscatal.2c05519 J.L. Song, M.L. Hua, X. Huang, J. Ma, C. Xie, B.X. Han, Polyoxometalate hybrid for selective aerobic oxidation of benzylic C(sp3)–H bonds, ACS Catal. 13 (2023), https://doi.org/10.1021/acscatal.2c05519. [45] S.J. Cao Z.Y. Zhao Y.J. Zheng Z.H. Wu T. Ma B.H. Zhu C.D. Yang X. Xiang L. Ma X.L. Han Y. Wang Q.Y. Guo L. Qiu C. Cheng A library of ROS-catalytic metalloenzyme mimics with atomic metal centers Adv. Mater. 34 2022 10.1002/adma.202200255 S.J. Cao, Z.Y. Zhao, Y.J. Zheng, Z.H. Wu, T. Ma, B.H. Zhu, C.D. Yang, X. Xiang, L. Ma, X.L. Han, Y. Wang, Q.Y. Guo, L. Qiu, C. Cheng, A library of ROS-catalytic metalloenzyme mimics with atomic metal centers, Adv. Mater. 34 (2022), https://doi.org/10.1002/adma.202200255. [46] H.L. Huang X. Jing J.T. Deng C.G. Meng C.Y. Duan Enzyme-inspired coordination polymers for selective oxidization of C(sp3)–H bonds via multiphoton excitation J. Am. Chem. Soc. 145 2023 10.1021/jacs.2c09348 H.L. Huang, X. Jing, J.T. Deng, C.G. Meng, C.Y. Duan, Enzyme-inspired coordination polymers for selective oxidization of C(sp3)–H bonds via multiphoton excitation, J. Am. Chem. Soc. 145 (2023), https://doi.org/10.1021/jacs.2c09348. [47] R. Sahin A. Kejriwal R.K. Das Copper based biomimetic catalysts of catechol oxidase: an overview on recent trends Catalysis in industry 15 2023 10.1134/S2070050423010063 R. Sahin, A. Kejriwal, R.K. Das, Copper based biomimetic catalysts of catechol oxidase: an overview on recent trends, Catalysis in industry 15 (2023), https://doi.org/10.1134/S2070050423010063. [48] Q.B. Shen J.L. Chen X. Jing C.Y. Duan Polyoxometalate-embedded metal–organic framework as an efficient copper-based monooxygenase for C(sp3)–H bond oxidation via multiphoton excitation ACS Catal 13 2023 10.1021/acscatal.3c02220 Q.B. Shen, J.L. Chen, X. Jing, C.Y. Duan, Polyoxometalate-embedded metal–organic framework as an efficient copper-based monooxygenase for C(sp3)–H bond oxidation via multiphoton excitation, ACS Catal. 13 (2023), https://doi.org/10.1021/acscatal.3c02220. [49] X. Feng Y. Song J.S. Chen Z. Xu S.J. Dunn W. Lin Rational construction of an artificial binuclear copper monooxygenase in a metal–organic framework J. Am. Chem. Soc. 143 2021 10.1021/jacs.0c11920 X. Feng, Y. Song, J.S. Chen, Z. Xu, S.J. Dunn, W. Lin, Rational construction of an artificial binuclear copper monooxygenase in a metal–organic framework, J. Am. Chem. Soc. 143 (2021), https://doi.org/10.1021/jacs.0c11920. [50] L. Kimberley A.M. Sheveleva J. Li J.H. Carter X. Kang G.L. Smith X. Han S.J. Day C.C. Tang F. Tuna E.J.L. McInnes S. Yang M. Schröder The origin of catalytic benzylic C−H oxidation over a redox-active metal–organic framework Angew. Chem. Int. Ed. 60 2021 10.1002/anie.202102313 L. Kimberley, A.M. Sheveleva, J. Li, J.H. Carter, X. Kang, G.L. Smith, X. Han, S.J. Day, C.C. Tang, F. Tuna, E.J.L. McInnes, S. Yang, M. Schröder, The origin of catalytic benzylic C−H oxidation over a redox-active metal–organic framework, Angew. Chem. Int. Ed. 60 (2021), https://doi.org/10.1002/anie.202102313. [51] F.R. Li H.R. Liu W.C. Chen Y. Su W.L. Chen J.J. Zhi Y.G. Li Light induced ammonia synthesis by crystalline polyoxometalate-based hybrid frameworks coupled with the Sv-1T MoS2 cocatalyst Inorg. Chem. Front. 9 2022 10.1039/D2QI01003H F.R. Li, H.R. Liu, W.C. Chen, Y. Su, W.L. Chen, J.J. Zhi, Y.G. Li, Light induced ammonia synthesis by crystalline polyoxometalate-based hybrid frameworks coupled with the Sv-1T MoS2 cocatalyst, Inorg. Chem. Front. 9 (2022), https://doi.org/10.1039/D2QI01003H. [52] Q.Z. Wang B.J. Xu Y.Y. Wang H. Wang X. Hu P.T. Ma J.Y. Niu J.P. Wang Polyoxometalate-incorporated framework as a heterogeneous catalyst for selective oxidation of C–H bonds of alkylbenzenes Inorg. Chem. 60 2021 10.1021/acs.inorgchem.1c00135 Q.Z. Wang, B.J. Xu, Y.Y. Wang, H. Wang, X. Hu, P.T. Ma, J.Y. Niu, J.P. Wang, Polyoxometalate-incorporated framework as a heterogeneous catalyst for selective oxidation of C–H bonds of alkylbenzenes, Inorg. Chem. 60 (2021), https://doi.org/10.1021/acs.inorgchem.1c00135. [53] X.Y. Zhao X. Wang Y.N. Zhao H.Y. Sun H.Q. Tan T.Y. Qiu Z. Zhao X. Zhao S.H. Cheng Y.G. Li Polyoxometalates-doped TiO2/Ag hybrid heterojunction: removal of multiple pollutants and mechanism investigation Environ. Sci.: Nano 8 2021 10.1039/D1EN00827G X.Y. Zhao, X. Wang, Y.N. Zhao, H.Y. Sun, H.Q. Tan, T.Y. Qiu, Z. Zhao, X. Zhao, S.H. Cheng, Y.G. Li, Polyoxometalates-doped TiO2/Ag hybrid heterojunction: removal of multiple pollutants and mechanism investigation, Environ. Sci.: Nano, 8 (2021), https://doi.org/10.1039/D1EN00827G. [54] B.J. Xu Q. Xu Q.Z. Wang Z. Liu R.K. Zhao D.D. Li P.T. Ma J. P.Wang J.Y. Niu A copper-containing polyoxometalate-based metal-organic framework as an efficient catalyst for selective catalytic oxidation of alkylbenzenes Inorg. Chem. 60 2021 10.1021/acs.inorgchem.0c03741 B.J. Xu, Q. Xu, Q.Z. Wang, Z. Liu, R.K. Zhao, D.D. Li, P.T. Ma, J. P.Wang, J.Y. Niu, A copper-containing polyoxometalate-based metal-organic framework as an efficient catalyst for selective catalytic oxidation of alkylbenzenes, Inorg. Chem. 60 (2021), https://doi.org/10.1021/acs.inorgchem.0c03741. [55] D.D. Li X.Y. Ma Q.Z. Wang P.T. Ma J.Y. Niu J.P. Wang Copper-containing polyoxometalate-based metal-organic frameworks as highly efficient heterogeneous catalysts toward selective oxidation of alkylbenzenes Inorg. Chem. 58 2019 10.1021/acs.inorgchem.9b02189 D.D. Li, X.Y. Ma, Q.Z. Wang, P.T. Ma, J.Y. Niu, J.P. Wang, Copper-containing polyoxometalate-based metal-organic frameworks as highly efficient heterogeneous catalysts toward selective oxidation of alkylbenzenes, Inorg. Chem. 58 (2019), https://doi.org/10.1021/acs.inorgchem.9b02189. [56] S.Z. Chang Y.H. Chen H.Y. An Q.S. Zhu H.Y. Luo T.Q. Xu Highly efficient synthesis of p-benzoquinones catalyzed by robust two-dimensional POM-based coordination polymers ACS Appl. Mater. Interfaces 13 2021 10.1021/acsami.1c02558 S.Z. Chang, Y.H. Chen, H.Y. An, Q.S. Zhu, H.Y. Luo, T.Q. Xu, Highly efficient synthesis of p-benzoquinones catalyzed by robust two-dimensional POM-based coordination polymers, ACS Appl. Mater. Interfaces 13 (2021), https://doi.org/10.1021/acsami.1c02558. [57] S.S. Wang G.Y. Yang Recent advances in polyoxometalate-catalyzed reactions Chem. Rev. 115 2015 10.1021/cr500390v S.S. Wang, G.Y. Yang, Recent advances in polyoxometalate-catalyzed reactions, Chem. Rev. 115 (2015), https://doi.org/10.1021/cr500390v. [58] J.F. Hu J. Dong X.Q. Huang Y.N. Chi Z.G. Lin J.K. Li S. Yang H.W. Ma C.W. Hu Immobilization of Keggin polyoxovanadoniobate in crystalline solids to produce effective heterogeneous catalysts towards selective oxidation of benzyl-alkanes Dalton Trans 46 2017 10.1039/C7DT01122A J.F. Hu, J. Dong, X.Q. Huang, Y.N. Chi, Z.G. Lin, J.K. Li, S. Yang, H.W. Ma, C.W. Hu, Immobilization of Keggin polyoxovanadoniobate in crystalline solids to produce effective heterogeneous catalysts towards selective oxidation of benzyl-alkanes, Dalton Trans. 46 (2017), https://doi.org/10.1039/C7DT01122A. [59] Y. Wang N. Xu Y. Zhang T. Zhang Z. Zhang X.H. Li X.L. Wang A Keggin-type polyoxometalate-based metal-organic complex as a highly efficient heterogeneous catalyst for the selective oxidation of alkylbenzenes Dalton Trans 51 2022 10.1039/D1DT03823K Y. Wang, N. Xu, Y. Zhang, T. Zhang, Z. Zhang, X.H. Li, X.L. Wang, A Keggin-type polyoxometalate-based metal-organic complex as a highly efficient heterogeneous catalyst for the selective oxidation of alkylbenzenes, Dalton Trans. 51 (2022), https://doi.org/10.1039/D1DT03823K. [60] F. Farzaneh F. Moghzi Investigation of the catalytic behavior of a Cu coordination polymer capped polyoxometalate as an oxidation catalyst Reac Kinet Mech Cat 115 2015 10.1007/s11144-015-0834-3 F. Farzaneh, F. Moghzi, Investigation of the catalytic behavior of a Cu coordination polymer capped polyoxometalate as an oxidation catalyst, Reac Kinet Mech Cat 115 (2015), https://doi.org/10.1007/s11144-015-0834-3. [61] M.O. Azeez S.A. Nafiu T.A. Olarewaju A.B. Olabintan A. Tanimu Y. Gambo A. Aitani Selective catalytic oxidation of ethylbenzene to acetophenone: a review of catalyst systems and reaction mechanisms Ind. Eng. Chem. Res. 62 2023 10.1021/acs.iecr.3c01588 M.O. Azeez, S.A. Nafiu, T.A. Olarewaju, A.B. Olabintan, A. Tanimu, Y.Gambo, A.Aitani, Selective catalytic oxidation of ethylbenzene to acetophenone: a review of catalyst systems and reaction mechanisms, Ind. Eng. Chem. Res. 85 (2020), https://doi.org/10.1021/acs.iecr.3c01588.",
      "scopus-id": "85205294842",
      "coredata": {
        "eid": "1-s2.0-S2468823124007612",
        "dc:description": "Selective activation and oxidization of inert C−H bonds into value-added chemicals affords attractively economic and ecological benefits, as well as central challenge in modern synthetic chemistry. Herein, by integrating the redox polyoxometalate (POM) centers and multinuclear copper sites in one system, four compounds were constructed with formulas of [Cu2(μ 2-Cl)(H2O)2L3][PM12O40]·4H2O (M = Mo for 1, W for 2), and [Cu4(μ 2-OH)4L2] [H3PM11CuO40]·12H2O (M = Mo for 3, W for 4, L = 1,4-di[4H-1,2,4-triazol-4-yl]-benzene). Both compounds 1–2 exhibited 3-D POM-embedded supramolecular networks constructed by discrete [PM12O40]3− clusters and binuclear {Cu2(μ 2-Cl)(N–N)2} unit-based metal-organic sheets. While compounds 3–4 displayed 3-D POM-supported supramolecular networks composed of monosubstituted Keggin-type anions [H3PM11CuO40]4− and {Cu2(μ 2-OH)(N–N)2} chain-based metal-organic layers. Four crystalline structures with distinct dual-active site distribution showed significant peroxidase-like activities owing to the collaborative catalysis of multinuclear copper units and polyanionic clusters, which can smoothly catalyze the C−H bond oxidation of diphenylmethane to benzophenone with ca. 97 % conversion and >98 % selectivity within 24 h. Notably, the monosubstituted [H3PM11CuO40]4−-based compounds 3−4 showed higher catalytic activities than [PM12O40]3−-based compounds 1−2 (88 % conversion and >97 % selectivity within 12 h). This kind of crystalline structures also showed good recoverability. The synergetic reaction mechanism was also explored. This work provides a new strategy to design robust heterogeneous POM-based synergetic catalysts for C−H bond functionalization.",
        "openArchiveArticle": "false",
        "prism:coverDate": "2024-12-31",
        "openaccessUserLicense": null,
        "prism:aggregationType": "Journal",
        "prism:url": "https://api.elsevier.com/content/article/pii/S2468823124007612",
        "dc:creator": [
          {
            "@_fa": "true",
            "$": "Wang, Yue"
          },
          {
            "@_fa": "true",
            "$": "Liu, Qian"
          },
          {
            "@_fa": "true",
            "$": "Ma, Yuan-Yuan"
          },
          {
            "@_fa": "true",
            "$": "Liu, Ze-Xuan"
          },
          {
            "@_fa": "true",
            "$": "Zhang, Ya-Nan"
          },
          {
            "@_fa": "true",
            "$": "Wang, Yu-Shuo"
          },
          {
            "@_fa": "true",
            "$": "Du, Jing"
          },
          {
            "@_fa": "true",
            "$": "Han, Zhan-Gang"
          }
        ],
        "link": [
          {
            "@_fa": "true",
            "@rel": "self",
            "@href": "https://api.elsevier.com/content/article/pii/S2468823124007612"
          },
          {
            "@_fa": "true",
            "@rel": "scidir",
            "@href": "https://www.sciencedirect.com/science/article/pii/S2468823124007612"
          }
        ],
        "dc:format": "application/json",
        "openaccessType": null,
        "pii": "S2468-8231(24)00761-2",
        "prism:volume": "569",
        "articleNumber": "114579",
        "prism:publisher": "Elsevier B.V. All rights are reserved, including those for text and data mining, AI training, and similar technologies.",
        "dc:title": "Polyoxometalate-embedded copper-organic network as dual-site synergetic catalyst for the selective oxidation of benzylic C−H bond",
        "prism:copyright": "© 2024 Elsevier B.V. All rights are reserved, including those for text and data mining, AI training, and similar technologies.",
        "openaccess": "0",
        "prism:issn": "24688231",
        "dcterms:subject": [
          {
            "@_fa": "true",
            "$": "Polyoxometalate"
          },
          {
            "@_fa": "true",
            "$": "Metal-organic network"
          },
          {
            "@_fa": "true",
            "$": "C−H bond oxidation"
          },
          {
            "@_fa": "true",
            "$": "Heterogeneous catalysis"
          },
          {
            "@_fa": "true",
            "$": "Synergetic catalyst"
          }
        ],
        "openaccessArticle": "false",
        "prism:publicationName": "Molecular Catalysis",
        "openaccessSponsorType": null,
        "prism:pageRange": "114579",
        "pubType": "fla",
        "prism:coverDisplayDate": "December 2024",
        "prism:doi": "10.1016/j.mcat.2024.114579",
        "prism:startingPage": "114579",
        "dc:identifier": "doi:10.1016/j.mcat.2024.114579",
        "openaccessSponsorName": null
      },
      "objects": {
        "object": [
          {
            "@category": "standard",
            "@height": "59",
            "@width": "65",
            "@_fa": "true",
            "$": "https://api.elsevier.com/content/object/eid/1-s2.0-S2468823124007612-fx11.jpg?httpAccept=%2A%2F%2A",
            "@multimediatype": "JPEG image file",
            "@type": "IMAGE-DOWNSAMPLED",
            "@size": "4461",
            "@ref": "fx11",
            "@mimetype": "image/jpeg"
          },
          {
            "@category": "standard",
            "@height": "39",
            "@width": "66",
            "@_fa": "true",
            "$": "https://api.elsevier.com/content/object/eid/1-s2.0-S2468823124007612-fx10.jpg?httpAccept=%2A%2F%2A",
            "@multimediatype": "JPEG image file",
            "@type": "IMAGE-DOWNSAMPLED",
            "@size": "1583",
            "@ref": "fx10",
            "@mimetype": "image/jpeg"
          },
          {
            "@category": "standard",
            "@height": "51",
            "@width": "61",
            "@_fa": "true",
            "$": "https://api.elsevier.com/content/object/eid/1-s2.0-S2468823124007612-fx15.jpg?httpAccept=%2A%2F%2A",
            "@multimediatype": "JPEG image file",
            "@type": "IMAGE-DOWNSAMPLED",
            "@size": "4372",
            "@ref": "fx15",
            "@mimetype": "image/jpeg"
          },
          {
            "@category": "standard",
            "@height": "38",
            "@width": "64",
            "@_fa": "true",
            "$": "https://api.elsevier.com/content/object/eid/1-s2.0-S2468823124007612-fx14.jpg?httpAccept=%2A%2F%2A",
            "@multimediatype": "JPEG image file",
            "@type": "IMAGE-DOWNSAMPLED",
            "@size": "4185",
            "@ref": "fx14",
            "@mimetype": "image/jpeg"
          },
          {
            "@category": "standard",
            "@height": "51",
            "@width": "72",
            "@_fa": "true",
            "$": "https://api.elsevier.com/content/object/eid/1-s2.0-S2468823124007612-fx13.jpg?httpAccept=%2A%2F%2A",
            "@multimediatype": "JPEG image file",
            "@type": "IMAGE-DOWNSAMPLED",
            "@size": "4414",
            "@ref": "fx13",
            "@mimetype": "image/jpeg"
          },
          {
            "@category": "standard",
            "@height": "41",
            "@width": "86",
            "@_fa": "true",
            "$": "https://api.elsevier.com/content/object/eid/1-s2.0-S2468823124007612-fx12.jpg?httpAccept=%2A%2F%2A",
            "@multimediatype": "JPEG image file",
            "@type": "IMAGE-DOWNSAMPLED",
            "@size": "1976",
            "@ref": "fx12",
            "@mimetype": "image/jpeg"
          },
          {
            "@category": "standard",
            "@height": "200",
            "@width": "265",
            "@_fa": "true",
            "$": "https://api.elsevier.com/content/object/eid/1-s2.0-S2468823124007612-ga1.jpg?httpAccept=%2A%2F%2A",
            "@multimediatype": "JPEG image file",
            "@type": "IMAGE-DOWNSAMPLED",
            "@size": "36377",
            "@ref": "ga1",
            "@mimetype": "image/jpeg"
          },
          {
            "@category": "standard",
            "@height": "58",
            "@width": "78",
            "@_fa": "true",
            "$": "https://api.elsevier.com/content/object/eid/1-s2.0-S2468823124007612-fx7.jpg?httpAccept=%2A%2F%2A",
            "@multimediatype": "JPEG image file",
            "@type": "IMAGE-DOWNSAMPLED",
            "@size": "4262",
            "@ref": "fx7",
            "@mimetype": "image/jpeg"
          },
          {
            "@category": "standard",
            "@height": "429",
            "@width": "444",
            "@_fa": "true",
            "$": "https://api.elsevier.com/content/object/eid/1-s2.0-S2468823124007612-gr1.jpg?httpAccept=%2A%2F%2A",
            "@multimediatype": "JPEG image file",
            "@type": "IMAGE-DOWNSAMPLED",
            "@size": "89609",
            "@ref": "gr1",
            "@mimetype": "image/jpeg"
          },
          {
            "@category": "standard",
            "@height": "41",
            "@width": "65",
            "@_fa": "true",
            "$": "https://api.elsevier.com/content/object/eid/1-s2.0-S2468823124007612-fx8.jpg?httpAccept=%2A%2F%2A",
            "@multimediatype": "JPEG image file",
            "@type": "IMAGE-DOWNSAMPLED",
            "@size": "1616",
            "@ref": "fx8",
            "@mimetype": "image/jpeg"
          },
          {
            "@category": "standard",
            "@height": "360",
            "@width": "484",
            "@_fa": "true",
            "$": "https://api.elsevier.com/content/object/eid/1-s2.0-S2468823124007612-gr2.jpg?httpAccept=%2A%2F%2A",
            "@multimediatype": "JPEG image file",
            "@type": "IMAGE-DOWNSAMPLED",
            "@size": "102837",
            "@ref": "gr2",
            "@mimetype": "image/jpeg"
          },
          {
            "@category": "standard",
            "@height": "55",
            "@width": "62",
            "@_fa": "true",
            "$": "https://api.elsevier.com/content/object/eid/1-s2.0-S2468823124007612-fx9.jpg?httpAccept=%2A%2F%2A",
            "@multimediatype": "JPEG image file",
            "@type": "IMAGE-DOWNSAMPLED",
            "@size": "4383",
            "@ref": "fx9",
            "@mimetype": "image/jpeg"
          },
          {
            "@category": "standard",
            "@height": "508",
            "@width": "419",
            "@_fa": "true",
            "$": "https://api.elsevier.com/content/object/eid/1-s2.0-S2468823124007612-gr3.jpg?httpAccept=%2A%2F%2A",
            "@multimediatype": "JPEG image file",
            "@type": "IMAGE-DOWNSAMPLED",
            "@size": "88661",
            "@ref": "gr3",
            "@mimetype": "image/jpeg"
          },
          {
            "@category": "standard",
            "@height": "50",
            "@width": "55",
            "@_fa": "true",
            "$": "https://api.elsevier.com/content/object/eid/1-s2.0-S2468823124007612-fx3.jpg?httpAccept=%2A%2F%2A",
            "@multimediatype": "JPEG image file",
            "@type": "IMAGE-DOWNSAMPLED",
            "@size": "3957",
            "@ref": "fx3",
            "@mimetype": "image/jpeg"
          },
          {
            "@category": "standard",
            "@height": "40",
            "@width": "85",
            "@_fa": "true",
            "$": "https://api.elsevier.com/content/object/eid/1-s2.0-S2468823124007612-fx4.jpg?httpAccept=%2A%2F%2A",
            "@multimediatype": "JPEG image file",
            "@type": "IMAGE-DOWNSAMPLED",
            "@size": "1449",
            "@ref": "fx4",
            "@mimetype": "image/jpeg"
          },
          {
            "@category": "standard",
            "@height": "58",
            "@width": "87",
            "@_fa": "true",
            "$": "https://api.elsevier.com/content/object/eid/1-s2.0-S2468823124007612-fx5.jpg?httpAccept=%2A%2F%2A",
            "@multimediatype": "JPEG image file",
            "@type": "IMAGE-DOWNSAMPLED",
            "@size": "4403",
            "@ref": "fx5",
            "@mimetype": "image/jpeg"
          },
          {
            "@category": "standard",
            "@height": "39",
            "@width": "80",
            "@_fa": "true",
            "$": "https://api.elsevier.com/content/object/eid/1-s2.0-S2468823124007612-fx6.jpg?httpAccept=%2A%2F%2A",
            "@multimediatype": "JPEG image file",
            "@type": "IMAGE-DOWNSAMPLED",
            "@size": "1395",
            "@ref": "fx6",
            "@mimetype": "image/jpeg"
          },
          {
            "@category": "standard",
            "@height": "51",
            "@width": "282",
            "@_fa": "true",
            "$": "https://api.elsevier.com/content/object/eid/1-s2.0-S2468823124007612-fx1.jpg?httpAccept=%2A%2F%2A",
            "@multimediatype": "JPEG image file",
            "@type": "IMAGE-DOWNSAMPLED",
            "@size": "7544",
            "@ref": "fx1",
            "@mimetype": "image/jpeg"
          },
          {
            "@category": "standard",
            "@height": "36",
            "@width": "61",
            "@_fa": "true",
            "$": "https://api.elsevier.com/content/object/eid/1-s2.0-S2468823124007612-fx2.jpg?httpAccept=%2A%2F%2A",
            "@multimediatype": "JPEG image file",
            "@type": "IMAGE-DOWNSAMPLED",
            "@size": "1144",
            "@ref": "fx2",
            "@mimetype": "image/jpeg"
          },
          {
            "@category": "standard",
            "@height": "429",
            "@width": "534",
            "@_fa": "true",
            "$": "https://api.elsevier.com/content/object/eid/1-s2.0-S2468823124007612-gr4.jpg?httpAccept=%2A%2F%2A",
            "@multimediatype": "JPEG image file",
            "@type": "IMAGE-DOWNSAMPLED",
            "@size": "104400",
            "@ref": "gr4",
            "@mimetype": "image/jpeg"
          },
          {
            "@category": "standard",
            "@height": "415",
            "@width": "528",
            "@_fa": "true",
            "$": "https://api.elsevier.com/content/object/eid/1-s2.0-S2468823124007612-gr5.jpg?httpAccept=%2A%2F%2A",
            "@multimediatype": "JPEG image file",
            "@type": "IMAGE-DOWNSAMPLED",
            "@size": "88118",
            "@ref": "gr5",
            "@mimetype": "image/jpeg"
          },
          {
            "@category": "standard",
            "@height": "667",
            "@width": "534",
            "@_fa": "true",
            "$": "https://api.elsevier.com/content/object/eid/1-s2.0-S2468823124007612-gr6.jpg?httpAccept=%2A%2F%2A",
            "@multimediatype": "JPEG image file",
            "@type": "IMAGE-DOWNSAMPLED",
            "@size": "123384",
            "@ref": "gr6",
            "@mimetype": "image/jpeg"
          },
          {
            "@category": "standard",
            "@height": "497",
            "@width": "609",
            "@_fa": "true",
            "$": "https://api.elsevier.com/content/object/eid/1-s2.0-S2468823124007612-gr7.jpg?httpAccept=%2A%2F%2A",
            "@multimediatype": "JPEG image file",
            "@type": "IMAGE-DOWNSAMPLED",
            "@size": "98025",
            "@ref": "gr7",
            "@mimetype": "image/jpeg"
          },
          {
            "@category": "thumbnail",
            "@height": "164",
            "@width": "180",
            "@_fa": "true",
            "$": "https://api.elsevier.com/content/object/eid/1-s2.0-S2468823124007612-fx11.sml?httpAccept=%2A%2F%2A",
            "@multimediatype": "GIF image file",
            "@type": "IMAGE-THUMBNAIL",
            "@size": "7374",
            "@ref": "fx11",
            "@mimetype": "image/gif"
          },
          {
            "@category": "thumbnail",
            "@height": "129",
            "@width": "219",
            "@_fa": "true",
            "$": "https://api.elsevier.com/content/object/eid/1-s2.0-S2468823124007612-fx10.sml?httpAccept=%2A%2F%2A",
            "@multimediatype": "GIF image file",
            "@type": "IMAGE-THUMBNAIL",
            "@size": "6142",
            "@ref": "fx10",
            "@mimetype": "image/gif"
          },
          {
            "@category": "thumbnail",
            "@height": "164",
            "@width": "195",
            "@_fa": "true",
            "$": "https://api.elsevier.com/content/object/eid/1-s2.0-S2468823124007612-fx15.sml?httpAccept=%2A%2F%2A",
            "@multimediatype": "GIF image file",
            "@type": "IMAGE-THUMBNAIL",
            "@size": "10049",
            "@ref": "fx15",
            "@mimetype": "image/gif"
          },
          {
            "@category": "thumbnail",
            "@height": "131",
            "@width": "219",
            "@_fa": "true",
            "$": "https://api.elsevier.com/content/object/eid/1-s2.0-S2468823124007612-fx14.sml?httpAccept=%2A%2F%2A",
            "@multimediatype": "GIF image file",
            "@type": "IMAGE-THUMBNAIL",
            "@size": "9360",
            "@ref": "fx14",
            "@mimetype": "image/gif"
          },
          {
            "@category": "thumbnail",
            "@height": "155",
            "@width": "219",
            "@_fa": "true",
            "$": "https://api.elsevier.com/content/object/eid/1-s2.0-S2468823124007612-fx13.sml?httpAccept=%2A%2F%2A",
            "@multimediatype": "GIF image file",
            "@type": "IMAGE-THUMBNAIL",
            "@size": "9251",
            "@ref": "fx13",
            "@mimetype": "image/gif"
          },
          {
            "@category": "thumbnail",
            "@height": "105",
            "@width": "219",
            "@_fa": "true",
            "$": "https://api.elsevier.com/content/object/eid/1-s2.0-S2468823124007612-fx12.sml?httpAccept=%2A%2F%2A",
            "@multimediatype": "GIF image file",
            "@type": "IMAGE-THUMBNAIL",
            "@size": "6865",
            "@ref": "fx12",
            "@mimetype": "image/gif"
          },
          {
            "@category": "thumbnail",
            "@height": "164",
            "@width": "218",
            "@_fa": "true",
            "$": "https://api.elsevier.com/content/object/eid/1-s2.0-S2468823124007612-ga1.sml?httpAccept=%2A%2F%2A",
            "@multimediatype": "GIF image file",
            "@type": "IMAGE-THUMBNAIL",
            "@size": "26879",
            "@ref": "ga1",
            "@mimetype": "image/gif"
          },
          {
            "@category": "thumbnail",
            "@height": "164",
            "@width": "219",
            "@_fa": "true",
            "$": "https://api.elsevier.com/content/object/eid/1-s2.0-S2468823124007612-fx7.sml?httpAccept=%2A%2F%2A",
            "@multimediatype": "GIF image file",
            "@type": "IMAGE-THUMBNAIL",
            "@size": "7236",
            "@ref": "fx7",
            "@mimetype": "image/gif"
          },
          {
            "@category": "thumbnail",
            "@height": "163",
            "@width": "169",
            "@_fa": "true",
            "$": "https://api.elsevier.com/content/object/eid/1-s2.0-S2468823124007612-gr1.sml?httpAccept=%2A%2F%2A",
            "@multimediatype": "GIF image file",
            "@type": "IMAGE-THUMBNAIL",
            "@size": "18074",
            "@ref": "gr1",
            "@mimetype": "image/gif"
          },
          {
            "@category": "thumbnail",
            "@height": "137",
            "@width": "219",
            "@_fa": "true",
            "$": "https://api.elsevier.com/content/object/eid/1-s2.0-S2468823124007612-fx8.sml?httpAccept=%2A%2F%2A",
            "@multimediatype": "GIF image file",
            "@type": "IMAGE-THUMBNAIL",
            "@size": "6918",
            "@ref": "fx8",
            "@mimetype": "image/gif"
          },
          {
            "@category": "thumbnail",
            "@height": "163",
            "@width": "219",
            "@_fa": "true",
            "$": "https://api.elsevier.com/content/object/eid/1-s2.0-S2468823124007612-gr2.sml?httpAccept=%2A%2F%2A",
            "@multimediatype": "GIF image file",
            "@type": "IMAGE-THUMBNAIL",
            "@size": "23302",
            "@ref": "gr2",
            "@mimetype": "image/gif"
          },
          {
            "@category": "thumbnail",
            "@height": "164",
            "@width": "184",
            "@_fa": "true",
            "$": "https://api.elsevier.com/content/object/eid/1-s2.0-S2468823124007612-fx9.sml?httpAccept=%2A%2F%2A",
            "@multimediatype": "GIF image file",
            "@type": "IMAGE-THUMBNAIL",
            "@size": "8356",
            "@ref": "fx9",
            "@mimetype": "image/gif"
          },
          {
            "@category": "thumbnail",
            "@height": "164",
            "@width": "135",
            "@_fa": "true",
            "$": "https://api.elsevier.com/content/object/eid/1-s2.0-S2468823124007612-gr3.sml?httpAccept=%2A%2F%2A",
            "@multimediatype": "GIF image file",
            "@type": "IMAGE-THUMBNAIL",
            "@size": "14938",
            "@ref": "gr3",
            "@mimetype": "image/gif"
          },
          {
            "@category": "thumbnail",
            "@height": "164",
            "@width": "180",
            "@_fa": "true",
            "$": "https://api.elsevier.com/content/object/eid/1-s2.0-S2468823124007612-fx3.sml?httpAccept=%2A%2F%2A",
            "@multimediatype": "GIF image file",
            "@type": "IMAGE-THUMBNAIL",
            "@size": "7218",
            "@ref": "fx3",
            "@mimetype": "image/gif"
          },
          {
            "@category": "thumbnail",
            "@height": "103",
            "@width": "219",
            "@_fa": "true",
            "$": "https://api.elsevier.com/content/object/eid/1-s2.0-S2468823124007612-fx4.sml?httpAccept=%2A%2F%2A",
            "@multimediatype": "GIF image file",
            "@type": "IMAGE-THUMBNAIL",
            "@size": "4675",
            "@ref": "fx4",
            "@mimetype": "image/gif"
          },
          {
            "@category": "thumbnail",
            "@height": "147",
            "@width": "219",
            "@_fa": "true",
            "$": "https://api.elsevier.com/content/object/eid/1-s2.0-S2468823124007612-fx5.sml?httpAccept=%2A%2F%2A",
            "@multimediatype": "GIF image file",
            "@type": "IMAGE-THUMBNAIL",
            "@size": "6856",
            "@ref": "fx5",
            "@mimetype": "image/gif"
          },
          {
            "@category": "thumbnail",
            "@height": "108",
            "@width": "219",
            "@_fa": "true",
            "$": "https://api.elsevier.com/content/object/eid/1-s2.0-S2468823124007612-fx6.sml?httpAccept=%2A%2F%2A",
            "@multimediatype": "GIF image file",
            "@type": "IMAGE-THUMBNAIL",
            "@size": "4877",
            "@ref": "fx6",
            "@mimetype": "image/gif"
          },
          {
            "@category": "thumbnail",
            "@height": "40",
            "@width": "219",
            "@_fa": "true",
            "$": "https://api.elsevier.com/content/object/eid/1-s2.0-S2468823124007612-fx1.sml?httpAccept=%2A%2F%2A",
            "@multimediatype": "GIF image file",
            "@type": "IMAGE-THUMBNAIL",
            "@size": "4821",
            "@ref": "fx1",
            "@mimetype": "image/gif"
          },
          {
            "@category": "thumbnail",
            "@height": "130",
            "@width": "219",
            "@_fa": "true",
            "$": "https://api.elsevier.com/content/object/eid/1-s2.0-S2468823124007612-fx2.sml?httpAccept=%2A%2F%2A",
            "@multimediatype": "GIF image file",
            "@type": "IMAGE-THUMBNAIL",
            "@size": "5985",
            "@ref": "fx2",
            "@mimetype": "image/gif"
          },
          {
            "@category": "thumbnail",
            "@height": "164",
            "@width": "204",
            "@_fa": "true",
            "$": "https://api.elsevier.com/content/object/eid/1-s2.0-S2468823124007612-gr4.sml?httpAccept=%2A%2F%2A",
            "@multimediatype": "GIF image file",
            "@type": "IMAGE-THUMBNAIL",
            "@size": "19769",
            "@ref": "gr4",
            "@mimetype": "image/gif"
          },
          {
            "@category": "thumbnail",
            "@height": "164",
            "@width": "208",
            "@_fa": "true",
            "$": "https://api.elsevier.com/content/object/eid/1-s2.0-S2468823124007612-gr5.sml?httpAccept=%2A%2F%2A",
            "@multimediatype": "GIF image file",
            "@type": "IMAGE-THUMBNAIL",
            "@size": "19005",
            "@ref": "gr5",
            "@mimetype": "image/gif"
          },
          {
            "@category": "thumbnail",
            "@height": "164",
            "@width": "131",
            "@_fa": "true",
            "$": "https://api.elsevier.com/content/object/eid/1-s2.0-S2468823124007612-gr6.sml?httpAccept=%2A%2F%2A",
            "@multimediatype": "GIF image file",
            "@type": "IMAGE-THUMBNAIL",
            "@size": "14188",
            "@ref": "gr6",
            "@mimetype": "image/gif"
          },
          {
            "@category": "thumbnail",
            "@height": "164",
            "@width": "201",
            "@_fa": "true",
            "$": "https://api.elsevier.com/content/object/eid/1-s2.0-S2468823124007612-gr7.sml?httpAccept=%2A%2F%2A",
            "@multimediatype": "GIF image file",
            "@type": "IMAGE-THUMBNAIL",
            "@size": "18282",
            "@ref": "gr7",
            "@mimetype": "image/gif"
          },
          {
            "@category": "high",
            "@height": "264",
            "@width": "290",
            "@_fa": "true",
            "$": "https://api.elsevier.com/content/object/eid/1-s2.0-S2468823124007612-fx11_lrg.jpg?httpAccept=%2A%2F%2A",
            "@multimediatype": "JPEG image file",
            "@type": "IMAGE-HIGH-RES",
            "@size": "14214",
            "@ref": "fx11",
            "@mimetype": "image/jpeg"
          },
          {
            "@category": "high",
            "@height": "175",
            "@width": "296",
            "@_fa": "true",
            "$": "https://api.elsevier.com/content/object/eid/1-s2.0-S2468823124007612-fx10_lrg.jpg?httpAccept=%2A%2F%2A",
            "@multimediatype": "JPEG image file",
            "@type": "IMAGE-HIGH-RES",
            "@size": "9333",
            "@ref": "fx10",
            "@mimetype": "image/jpeg"
          },
          {
            "@category": "high",
            "@height": "230",
            "@width": "274",
            "@_fa": "true",
            "$": "https://api.elsevier.com/content/object/eid/1-s2.0-S2468823124007612-fx15_lrg.jpg?httpAccept=%2A%2F%2A",
            "@multimediatype": "JPEG image file",
            "@type": "IMAGE-HIGH-RES",
            "@size": "13611",
            "@ref": "fx15",
            "@mimetype": "image/jpeg"
          },
          {
            "@category": "high",
            "@height": "171",
            "@width": "285",
            "@_fa": "true",
            "$": "https://api.elsevier.com/content/object/eid/1-s2.0-S2468823124007612-fx14_lrg.jpg?httpAccept=%2A%2F%2A",
            "@multimediatype": "JPEG image file",
            "@type": "IMAGE-HIGH-RES",
            "@size": "12402",
            "@ref": "fx14",
            "@mimetype": "image/jpeg"
          },
          {
            "@category": "high",
            "@height": "226",
            "@width": "320",
            "@_fa": "true",
            "$": "https://api.elsevier.com/content/object/eid/1-s2.0-S2468823124007612-fx13_lrg.jpg?httpAccept=%2A%2F%2A",
            "@multimediatype": "JPEG image file",
            "@type": "IMAGE-HIGH-RES",
            "@size": "14136",
            "@ref": "fx13",
            "@mimetype": "image/jpeg"
          },
          {
            "@category": "high",
            "@height": "183",
            "@width": "381",
            "@_fa": "true",
            "$": "https://api.elsevier.com/content/object/eid/1-s2.0-S2468823124007612-fx12_lrg.jpg?httpAccept=%2A%2F%2A",
            "@multimediatype": "JPEG image file",
            "@type": "IMAGE-HIGH-RES",
            "@size": "13138",
            "@ref": "fx12",
            "@mimetype": "image/jpeg"
          },
          {
            "@category": "high",
            "@height": "886",
            "@width": "1176",
            "@_fa": "true",
            "$": "https://api.elsevier.com/content/object/eid/1-s2.0-S2468823124007612-ga1_lrg.jpg?httpAccept=%2A%2F%2A",
            "@multimediatype": "JPEG image file",
            "@type": "IMAGE-HIGH-RES",
            "@size": "298582",
            "@ref": "ga1",
            "@mimetype": "image/jpeg"
          },
          {
            "@category": "high",
            "@height": "261",
            "@width": "349",
            "@_fa": "true",
            "$": "https://api.elsevier.com/content/object/eid/1-s2.0-S2468823124007612-fx7_lrg.jpg?httpAccept=%2A%2F%2A",
            "@multimediatype": "JPEG image file",
            "@type": "IMAGE-HIGH-RES",
            "@size": "13178",
            "@ref": "fx7",
            "@mimetype": "image/jpeg"
          },
          {
            "@category": "high",
            "@height": "1903",
            "@width": "1969",
            "@_fa": "true",
            "$": "https://api.elsevier.com/content/object/eid/1-s2.0-S2468823124007612-gr1_lrg.jpg?httpAccept=%2A%2F%2A",
            "@multimediatype": "JPEG image file",
            "@type": "IMAGE-HIGH-RES",
            "@size": "716326",
            "@ref": "gr1",
            "@mimetype": "image/jpeg"
          },
          {
            "@category": "high",
            "@height": "182",
            "@width": "291",
            "@_fa": "true",
            "$": "https://api.elsevier.com/content/object/eid/1-s2.0-S2468823124007612-fx8_lrg.jpg?httpAccept=%2A%2F%2A",
            "@multimediatype": "JPEG image file",
            "@type": "IMAGE-HIGH-RES",
            "@size": "9309",
            "@ref": "fx8",
            "@mimetype": "image/jpeg"
          },
          {
            "@category": "high",
            "@height": "1595",
            "@width": "2145",
            "@_fa": "true",
            "$": "https://api.elsevier.com/content/object/eid/1-s2.0-S2468823124007612-gr2_lrg.jpg?httpAccept=%2A%2F%2A",
            "@multimediatype": "JPEG image file",
            "@type": "IMAGE-HIGH-RES",
            "@size": "740931",
            "@ref": "gr2",
            "@mimetype": "image/jpeg"
          },
          {
            "@category": "high",
            "@height": "245",
            "@width": "275",
            "@_fa": "true",
            "$": "https://api.elsevier.com/content/object/eid/1-s2.0-S2468823124007612-fx9_lrg.jpg?httpAccept=%2A%2F%2A",
            "@multimediatype": "JPEG image file",
            "@type": "IMAGE-HIGH-RES",
            "@size": "13975",
            "@ref": "fx9",
            "@mimetype": "image/jpeg"
          },
          {
            "@category": "high",
            "@height": "2251",
            "@width": "1857",
            "@_fa": "true",
            "$": "https://api.elsevier.com/content/object/eid/1-s2.0-S2468823124007612-gr3_lrg.jpg?httpAccept=%2A%2F%2A",
            "@multimediatype": "JPEG image file",
            "@type": "IMAGE-HIGH-RES",
            "@size": "735359",
            "@ref": "gr3",
            "@mimetype": "image/jpeg"
          },
          {
            "@category": "high",
            "@height": "222",
            "@width": "244",
            "@_fa": "true",
            "$": "https://api.elsevier.com/content/object/eid/1-s2.0-S2468823124007612-fx3_lrg.jpg?httpAccept=%2A%2F%2A",
            "@multimediatype": "JPEG image file",
            "@type": "IMAGE-HIGH-RES",
            "@size": "10104",
            "@ref": "fx3",
            "@mimetype": "image/jpeg"
          },
          {
            "@category": "high",
            "@height": "177",
            "@width": "378",
            "@_fa": "true",
            "$": "https://api.elsevier.com/content/object/eid/1-s2.0-S2468823124007612-fx4_lrg.jpg?httpAccept=%2A%2F%2A",
            "@multimediatype": "JPEG image file",
            "@type": "IMAGE-HIGH-RES",
            "@size": "8750",
            "@ref": "fx4",
            "@mimetype": "image/jpeg"
          },
          {
            "@category": "high",
            "@height": "258",
            "@width": "385",
            "@_fa": "true",
            "$": "https://api.elsevier.com/content/object/eid/1-s2.0-S2468823124007612-fx5_lrg.jpg?httpAccept=%2A%2F%2A",
            "@multimediatype": "JPEG image file",
            "@type": "IMAGE-HIGH-RES",
            "@size": "13410",
            "@ref": "fx5",
            "@mimetype": "image/jpeg"
          },
          {
            "@category": "high",
            "@height": "174",
            "@width": "354",
            "@_fa": "true",
            "$": "https://api.elsevier.com/content/object/eid/1-s2.0-S2468823124007612-fx6_lrg.jpg?httpAccept=%2A%2F%2A",
            "@multimediatype": "JPEG image file",
            "@type": "IMAGE-HIGH-RES",
            "@size": "8564",
            "@ref": "fx6",
            "@mimetype": "image/jpeg"
          },
          {
            "@category": "high",
            "@height": "228",
            "@width": "1250",
            "@_fa": "true",
            "$": "https://api.elsevier.com/content/object/eid/1-s2.0-S2468823124007612-fx1_lrg.jpg?httpAccept=%2A%2F%2A",
            "@multimediatype": "JPEG image file",
            "@type": "IMAGE-HIGH-RES",
            "@size": "32180",
            "@ref": "fx1",
            "@mimetype": "image/jpeg"
          },
          {
            "@category": "high",
            "@height": "162",
            "@width": "273",
            "@_fa": "true",
            "$": "https://api.elsevier.com/content/object/eid/1-s2.0-S2468823124007612-fx2_lrg.jpg?httpAccept=%2A%2F%2A",
            "@multimediatype": "JPEG image file",
            "@type": "IMAGE-HIGH-RES",
            "@size": "6989",
            "@ref": "fx2",
            "@mimetype": "image/jpeg"
          },
          {
            "@category": "high",
            "@height": "1900",
            "@width": "2364",
            "@_fa": "true",
            "$": "https://api.elsevier.com/content/object/eid/1-s2.0-S2468823124007612-gr4_lrg.jpg?httpAccept=%2A%2F%2A",
            "@multimediatype": "JPEG image file",
            "@type": "IMAGE-HIGH-RES",
            "@size": "843839",
            "@ref": "gr4",
            "@mimetype": "image/jpeg"
          },
          {
            "@category": "high",
            "@height": "1840",
            "@width": "2340",
            "@_fa": "true",
            "$": "https://api.elsevier.com/content/object/eid/1-s2.0-S2468823124007612-gr5_lrg.jpg?httpAccept=%2A%2F%2A",
            "@multimediatype": "JPEG image file",
            "@type": "IMAGE-HIGH-RES",
            "@size": "706286",
            "@ref": "gr5",
            "@mimetype": "image/jpeg"
          },
          {
            "@category": "high",
            "@height": "2951",
            "@width": "2364",
            "@_fa": "true",
            "$": "https://api.elsevier.com/content/object/eid/1-s2.0-S2468823124007612-gr6_lrg.jpg?httpAccept=%2A%2F%2A",
            "@multimediatype": "JPEG image file",
            "@type": "IMAGE-HIGH-RES",
            "@size": "961394",
            "@ref": "gr6",
            "@mimetype": "image/jpeg"
          },
          {
            "@category": "high",
            "@height": "2199",
            "@width": "2697",
            "@_fa": "true",
            "$": "https://api.elsevier.com/content/object/eid/1-s2.0-S2468823124007612-gr7_lrg.jpg?httpAccept=%2A%2F%2A",
            "@multimediatype": "JPEG image file",
            "@type": "IMAGE-HIGH-RES",
            "@size": "800319",
            "@ref": "gr7",
            "@mimetype": "image/jpeg"
          },
          {
            "@category": "standard",
            "@_fa": "true",
            "$": "https://api.elsevier.com/content/object/eid/1-s2.0-S2468823124007612-mmc4.pdf?httpAccept=%2A%2F%2A",
            "@multimediatype": "Acrobat PDF file",
            "@type": "APPLICATION",
            "@size": "119520",
            "@ref": "mmc4",
            "@mimetype": "application/pdf"
          },
          {
            "@category": "standard",
            "@_fa": "true",
            "$": "https://api.elsevier.com/content/object/eid/1-s2.0-S2468823124007612-mmc5.pdf?httpAccept=%2A%2F%2A",
            "@multimediatype": "Acrobat PDF file",
            "@type": "APPLICATION",
            "@size": "135147",
            "@ref": "mmc5",
            "@mimetype": "application/pdf"
          },
          {
            "@category": "standard",
            "@_fa": "true",
            "$": "https://api.elsevier.com/content/object/eid/1-s2.0-S2468823124007612-mmc2.pdf?httpAccept=%2A%2F%2A",
            "@multimediatype": "Acrobat PDF file",
            "@type": "APPLICATION",
            "@size": "102419",
            "@ref": "mmc2",
            "@mimetype": "application/pdf"
          },
          {
            "@category": "standard",
            "@_fa": "true",
            "$": "https://api.elsevier.com/content/object/eid/1-s2.0-S2468823124007612-mmc3.pdf?httpAccept=%2A%2F%2A",
            "@multimediatype": "Acrobat PDF file",
            "@type": "APPLICATION",
            "@size": "138174",
            "@ref": "mmc3",
            "@mimetype": "application/pdf"
          },
          {
            "@category": "standard",
            "@_fa": "true",
            "$": "https://api.elsevier.com/content/object/eid/1-s2.0-S2468823124007612-mmc8.zip?httpAccept=%2A%2F%2A",
            "@multimediatype": "ZIP file",
            "@type": "APPLICATION",
            "@size": "149272",
            "@ref": "mmc8",
            "@mimetype": "application/zip"
          },
          {
            "@category": "standard",
            "@_fa": "true",
            "$": "https://api.elsevier.com/content/object/eid/1-s2.0-S2468823124007612-mmc9.zip?httpAccept=%2A%2F%2A",
            "@multimediatype": "ZIP file",
            "@type": "APPLICATION",
            "@size": "212988",
            "@ref": "mmc9",
            "@mimetype": "application/zip"
          },
          {
            "@category": "standard",
            "@_fa": "true",
            "$": "https://api.elsevier.com/content/object/eid/1-s2.0-S2468823124007612-mmc6.zip?httpAccept=%2A%2F%2A",
            "@multimediatype": "ZIP file",
            "@type": "APPLICATION",
            "@size": "155068",
            "@ref": "mmc6",
            "@mimetype": "application/zip"
          },
          {
            "@category": "standard",
            "@_fa": "true",
            "$": "https://api.elsevier.com/content/object/eid/1-s2.0-S2468823124007612-mmc7.zip?httpAccept=%2A%2F%2A",
            "@multimediatype": "ZIP file",
            "@type": "APPLICATION",
            "@size": "209769",
            "@ref": "mmc7",
            "@mimetype": "application/zip"
          },
          {
            "@category": "standard",
            "@_fa": "true",
            "$": "https://api.elsevier.com/content/object/eid/1-s2.0-S2468823124007612-mmc1.doc?httpAccept=%2A%2F%2A",
            "@multimediatype": "Microsoft Word file",
            "@type": "APPLICATION",
            "@size": "6110208",
            "@ref": "mmc1",
            "@mimetype": "application/word"
          }
        ]
      },
      "link": {
        "@rel": "abstract",
        "@href": "https://api.elsevier.com/content/abstract/scopus_id/85205294842"
      }
    }
  }
}