{
  "metadata": {
    "title": "Study of the catalytic properties of MgNi(Cu)Al LDH in the one-pot cascade oxidation-Knoevenagel condensation reaction",
    "authors": "; ; ",
    "journal": "Molecular Catalysis",
    "date": "2023-02-15",
    "doi": "10.1016/j.mcat.2023.112968",
    "abstract": "",
    "uri": "https://api.elsevier.com/content/article/pii/S246882312300055X",
    "pii": "S246882312300055X"
  },
  "fulltext": {
    "full-text-retrieval-response": {
      "scopus-eid": "2-s2.0-85147204794",
      "originalText": "serial JL 315758 291210 291744 291790 291809 31 Molecular Catalysis MOLECULARCATALYSIS 2023-01-28 2023-01-28 2023-01-28 2023-01-28 2023-11-20T12:02:07 1-s2.0-S246882312300055X S2468-8231(23)00055-X S246882312300055X 10.1016/j.mcat.2023.112968 S300 S300.1 FULL-TEXT 1-s2.0-S2468823123X00030 2023-11-20T12:45:58.268698Z 0 0 20230215 2023 2023-01-28T04:46:44.931656Z absattachment articleinfo articlenumber articletitlenorm authfirstinitialnorm authfirstsurnamenorm cid cids contenttype copyright crossmark dateloaded dateloadedtxt datesearch datesort dateupdated dco docsubtype doctype doi eid ewtransactionid hubeid indexeddate issn issnnorm itemstage itemtransactionid itemweight openaccess openarchive pg pgfirst pii piinorm pubdatestart pubdatetxt pubyr sectiontitle sortorder srctitle srctitlenorm srctype ssids alllist content subj subheadings suppl tomb volfirst volissue volumelist webpdf webpdfpagecount yearnav figure table e-component body mmlmath acknowledge affil appendices articletitle auth authfirstini authfull authkeywords authlast grantnumber grantsponsor highlightsabst orcid primabst ref specialabst 2468-8231 24688231 true 537 537 C Volume 537 27 112968 112968 112968 20230215 15 February 2023 2023-02-15 2023 Regular Papers article fla © 2023 Elsevier B.V. All rights reserved. STUDYCATALYTICPROPERTIESMGNICUALLDHINONEPOTCASCADEOXIDATIONKNOEVENAGELCONDENSATIONREACTION STAMATE A 1 Introduction 2 Materials and methods 2.1 Materials 2.2 Synthesis of Mg1.2NiaCubAl(OH)6(CO3)0.5 LDH with a + b = 0.8 2.3 Synthesis of Mg0.8NicCudAl(OH)6(CO3)0.5 LDH with c + d = 1.2 2.4 Synthesis of LDH solids containing only one of the divalent transition-metal cations, namely Ni2Al(OH)6(CO3)0.5 and Cu2Al(OH)6(CO3)0.5 3 Materials characterization 4 Catalytic tests 5 Results and discussion 5.1 Catalysts characterization 5.2 Catalytic results 6 Conclusion Data availability statement CRediT authorship contribution statement Acknowledgments Appendix Supplementary materials References FORANO 2013 745 782 C LAYEREDDOUBLEHYDROXIDESLDH DEVELOPMENTSINCLAYSCIENCE ALEJANDRE 2001 195 207 A SOTILES 2021 170 181 A CAVANI 1991 173 301 F LAYRAC 2020 105673 G KAWABATA 2005 206 215 T CHOUDARY 2001 763 766 B VOS 2001 77 88 B RATHOUSKY 1994 41 46 J NEWSOME 1980 275 318 D FUENTES 2011 290 296 E SHOKOUHIMEHR 2019 4183 M ALAMGHOLILOO 2020 5182 5191 H MOASER 2020 113388 A LI 2018 3059 3067 T SHIROTORI 2017 6947 6957 M AHADI 2019 4803 4809 A ALAMGHOLILOO 2021 10548 H CAVANI 2010 8 15 F AESTAMATE 2021 7457 O ZHOU 2017 1536 1541 W CIRIMINNA 2015 1554 1558 R PAULING 1932 3570 3582 L SHANNON 1976 751 767 R SING 1985 603 619 K WANG 2020 377 Z THOMMES 2015 1051 1069 M KLEMKAITE 2011 275 282 K GEVERS 2019 28262 B STEPANOVA 2021 124091 L VAYSSE 2002 1035 1043 C EVANS 2006 1 87 D RIVES 2000 489 495 V WANG 2018 186 J MITTASCH 1950 81 104 A CORMA 1990 237 248 A STAMATEX2023X112968 STAMATEX2023X112968XA 2025-01-28T00:00:00.000Z 2025-01-28T00:00:00.000Z http://creativecommons.org/licenses/by-nc-nd/4.0/ © 2023 Elsevier B.V. All rights reserved. 2023-02-06T23:08:26.298Z http://vtw.elsevier.com/data/voc/AddOnTypes/50.7/aggregated-refined DAAD 57507442 DAAD Deutscher Akademischer Austauschdienst http://data.elsevier.com/vocabulary/SciValFunders/501100001655 http://sws.geonames.org/2921044/ The authors thank the funder, namely the German Academic Exchange Service (DAAD) (funding program No.: 57507442). https://doi.org/10.15223/policy-017 https://doi.org/10.15223/policy-037 https://doi.org/10.15223/policy-012 https://doi.org/10.15223/policy-029 https://doi.org/10.15223/policy-004 item S2468-8231(23)00055-X S246882312300055X 1-s2.0-S246882312300055X 10.1016/j.mcat.2023.112968 315758 2023-11-20T12:45:58.268698Z 2023-02-15 1-s2.0-S246882312300055X-main.pdf https://s3-eu-west-1.amazonaws.com/prod-ucs-content-store-eu-west/content/pii:S246882312300055X/MAIN/application/pdf/f5042b393aa7260a2cae4797769241f7/main.pdf main.pdf pdf true 7140733 MAIN 11 1-s2.0-S246882312300055X-main_1.png https://s3-eu-west-1.amazonaws.com/prod-ucs-content-store-eu-west/content/pii:S246882312300055X/PREVIEW/image/png/65d1c4dd72d710cf3e85e59f54ac5aaf/main_1.png main_1.png png 59344 849 656 IMAGE-WEB-PDF 1 1-s2.0-S246882312300055X-gr1.jpg https://s3-eu-west-1.amazonaws.com/prod-ucs-content-store-eu-west/content/pii:S246882312300055X/gr1/DOWNSAMPLED/image/jpeg/579ad420fccc3a9306c5a8f0be978f73/gr1.jpg gr1 gr1.jpg jpg 157684 1073 688 IMAGE-DOWNSAMPLED 1-s2.0-S246882312300055X-gr2.jpg https://s3-eu-west-1.amazonaws.com/prod-ucs-content-store-eu-west/content/pii:S246882312300055X/gr2/DOWNSAMPLED/image/jpeg/5c5e17d0be451a8228d35029b15324df/gr2.jpg gr2 gr2.jpg jpg 54138 345 376 IMAGE-DOWNSAMPLED 1-s2.0-S246882312300055X-ga1.jpg https://s3-eu-west-1.amazonaws.com/prod-ucs-content-store-eu-west/content/pii:S246882312300055X/ga1/DOWNSAMPLED/image/jpeg/d6b266bb6effc8d4ab578cbd96a460fd/ga1.jpg ga1 true ga1.jpg jpg 27264 200 408 IMAGE-DOWNSAMPLED 1-s2.0-S246882312300055X-gr3.jpg https://s3-eu-west-1.amazonaws.com/prod-ucs-content-store-eu-west/content/pii:S246882312300055X/gr3/DOWNSAMPLED/image/jpeg/1bc0f5f9e836b62bdd2314a41df5746a/gr3.jpg gr3 gr3.jpg jpg 90347 517 376 IMAGE-DOWNSAMPLED 1-s2.0-S246882312300055X-gr4.jpg https://s3-eu-west-1.amazonaws.com/prod-ucs-content-store-eu-west/content/pii:S246882312300055X/gr4/DOWNSAMPLED/image/jpeg/e473ec72480f6ce10bf144cb0aa7530d/gr4.jpg gr4 gr4.jpg jpg 84004 639 376 IMAGE-DOWNSAMPLED 1-s2.0-S246882312300055X-sc1.jpg https://s3-eu-west-1.amazonaws.com/prod-ucs-content-store-eu-west/content/pii:S246882312300055X/sc1/DOWNSAMPLED/image/jpeg/3e0909ce7940352032a204e108d5f0b2/sc1.jpg sc1 sc1.jpg jpg 25599 231 737 IMAGE-DOWNSAMPLED 1-s2.0-S246882312300055X-gr5.jpg https://s3-eu-west-1.amazonaws.com/prod-ucs-content-store-eu-west/content/pii:S246882312300055X/gr5/DOWNSAMPLED/image/jpeg/ee366206bdc2946eaa67f2d9adf989ef/gr5.jpg gr5 gr5.jpg jpg 196506 906 565 IMAGE-DOWNSAMPLED 1-s2.0-S246882312300055X-gr6.jpg https://s3-eu-west-1.amazonaws.com/prod-ucs-content-store-eu-west/content/pii:S246882312300055X/gr6/DOWNSAMPLED/image/jpeg/b925f356a1e170feef19abbdcc7f1440/gr6.jpg gr6 gr6.jpg jpg 44072 651 376 IMAGE-DOWNSAMPLED 1-s2.0-S246882312300055X-gr7.jpg https://s3-eu-west-1.amazonaws.com/prod-ucs-content-store-eu-west/content/pii:S246882312300055X/gr7/DOWNSAMPLED/image/jpeg/716866c8b29e3dd255ba7c505b17559a/gr7.jpg gr7 gr7.jpg jpg 39721 278 565 IMAGE-DOWNSAMPLED 1-s2.0-S246882312300055X-gr8.jpg https://s3-eu-west-1.amazonaws.com/prod-ucs-content-store-eu-west/content/pii:S246882312300055X/gr8/DOWNSAMPLED/image/jpeg/8271f5831b48d6cb0053f00f2e46b97f/gr8.jpg gr8 gr8.jpg jpg 32588 351 376 IMAGE-DOWNSAMPLED 1-s2.0-S246882312300055X-gr1.sml https://s3-eu-west-1.amazonaws.com/prod-ucs-content-store-eu-west/content/pii:S246882312300055X/gr1/THUMBNAIL/image/gif/83ea0039ff6f248de8a3cce3319e0091/gr1.sml gr1 gr1.sml sml 7997 164 105 IMAGE-THUMBNAIL 1-s2.0-S246882312300055X-gr2.sml https://s3-eu-west-1.amazonaws.com/prod-ucs-content-store-eu-west/content/pii:S246882312300055X/gr2/THUMBNAIL/image/gif/d43bb1bc26e808372bbf67c092533ec8/gr2.sml gr2 gr2.sml sml 12193 164 179 IMAGE-THUMBNAIL 1-s2.0-S246882312300055X-ga1.sml https://s3-eu-west-1.amazonaws.com/prod-ucs-content-store-eu-west/content/pii:S246882312300055X/ga1/THUMBNAIL/image/gif/0573ca28e957c0f2f6964bfa6ddae42f/ga1.sml ga1 true ga1.sml sml 9137 107 219 IMAGE-THUMBNAIL 1-s2.0-S246882312300055X-gr3.sml https://s3-eu-west-1.amazonaws.com/prod-ucs-content-store-eu-west/content/pii:S246882312300055X/gr3/THUMBNAIL/image/gif/a6e1eff2ddafe36bbd418c75120fee9b/gr3.sml gr3 gr3.sml sml 11435 164 119 IMAGE-THUMBNAIL 1-s2.0-S246882312300055X-gr4.sml https://s3-eu-west-1.amazonaws.com/prod-ucs-content-store-eu-west/content/pii:S246882312300055X/gr4/THUMBNAIL/image/gif/9a3a1066ad6a8883e5c84974f03945d0/gr4.sml gr4 gr4.sml sml 8599 163 96 IMAGE-THUMBNAIL 1-s2.0-S246882312300055X-sc1.sml https://s3-eu-west-1.amazonaws.com/prod-ucs-content-store-eu-west/content/pii:S246882312300055X/sc1/THUMBNAIL/image/gif/4a44f49e2834ce42a5de4455edb89b97/sc1.sml sc1 sc1.sml sml 5216 69 219 IMAGE-THUMBNAIL 1-s2.0-S246882312300055X-gr5.sml https://s3-eu-west-1.amazonaws.com/prod-ucs-content-store-eu-west/content/pii:S246882312300055X/gr5/THUMBNAIL/image/gif/e4cff71b60b529ef63e417fb49bd99fc/gr5.sml gr5 gr5.sml sml 11504 164 102 IMAGE-THUMBNAIL 1-s2.0-S246882312300055X-gr6.sml https://s3-eu-west-1.amazonaws.com/prod-ucs-content-store-eu-west/content/pii:S246882312300055X/gr6/THUMBNAIL/image/gif/8e8cac852633317759ac0427080bd3f8/gr6.sml gr6 gr6.sml sml 5146 163 94 IMAGE-THUMBNAIL 1-s2.0-S246882312300055X-gr7.sml https://s3-eu-west-1.amazonaws.com/prod-ucs-content-store-eu-west/content/pii:S246882312300055X/gr7/THUMBNAIL/image/gif/6a57df0228432013dfca3b7b83d6b00f/gr7.sml gr7 gr7.sml sml 7482 108 219 IMAGE-THUMBNAIL 1-s2.0-S246882312300055X-gr8.sml https://s3-eu-west-1.amazonaws.com/prod-ucs-content-store-eu-west/content/pii:S246882312300055X/gr8/THUMBNAIL/image/gif/7010571ee00cfaf73847777cb098ddb5/gr8.sml gr8 gr8.sml sml 7681 163 175 IMAGE-THUMBNAIL 1-s2.0-S246882312300055X-gr1_lrg.jpg https://s3-eu-west-1.amazonaws.com/prod-ucs-content-store-eu-west/content/pii:S246882312300055X/HIGHRES/image/jpeg/67b73acbd51d3dc7e6f290f4985ea0ee/gr1_lrg.jpg gr1 gr1_lrg.jpg jpg 970446 4750 3047 IMAGE-HIGH-RES 1-s2.0-S246882312300055X-gr2_lrg.jpg https://s3-eu-west-1.amazonaws.com/prod-ucs-content-store-eu-west/content/pii:S246882312300055X/HIGHRES/image/jpeg/7efbc1ef01eb98d62cb9365af6fd564f/gr2_lrg.jpg gr2 gr2_lrg.jpg jpg 409515 1528 1667 IMAGE-HIGH-RES 1-s2.0-S246882312300055X-ga1_lrg.jpg https://s3-eu-west-1.amazonaws.com/prod-ucs-content-store-eu-west/content/pii:S246882312300055X/HIGHRES/image/jpeg/c1aa29221ea5ba5265a1043f8112a0b5/ga1_lrg.jpg ga1 true ga1_lrg.jpg jpg 256167 886 1807 IMAGE-HIGH-RES 1-s2.0-S246882312300055X-gr3_lrg.jpg https://s3-eu-west-1.amazonaws.com/prod-ucs-content-store-eu-west/content/pii:S246882312300055X/HIGHRES/image/jpeg/98c453bea50894e5248f14a930e12e02/gr3_lrg.jpg gr3 gr3_lrg.jpg jpg 655118 2294 1667 IMAGE-HIGH-RES 1-s2.0-S246882312300055X-gr4_lrg.jpg https://s3-eu-west-1.amazonaws.com/prod-ucs-content-store-eu-west/content/pii:S246882312300055X/HIGHRES/image/jpeg/57581b99edf924ad7b9443645ae1f6b7/gr4_lrg.jpg gr4 gr4_lrg.jpg jpg 640786 2835 1667 IMAGE-HIGH-RES 1-s2.0-S246882312300055X-sc1_lrg.jpg https://s3-eu-west-1.amazonaws.com/prod-ucs-content-store-eu-west/content/pii:S246882312300055X/HIGHRES/image/jpeg/ceff3dba1fcde2225a99703e83b04457/sc1_lrg.jpg sc1 sc1_lrg.jpg jpg 173597 1024 3264 IMAGE-HIGH-RES 1-s2.0-S246882312300055X-gr5_lrg.jpg https://s3-eu-west-1.amazonaws.com/prod-ucs-content-store-eu-west/content/pii:S246882312300055X/HIGHRES/image/jpeg/9f3642bb74a5d53b3916476392d21c38/gr5_lrg.jpg gr5 gr5_lrg.jpg jpg 1550361 4010 2500 IMAGE-HIGH-RES 1-s2.0-S246882312300055X-gr6_lrg.jpg https://s3-eu-west-1.amazonaws.com/prod-ucs-content-store-eu-west/content/pii:S246882312300055X/HIGHRES/image/jpeg/53bb650100667393fdb0d25ad20be52a/gr6_lrg.jpg gr6 gr6_lrg.jpg jpg 235372 2887 1667 IMAGE-HIGH-RES 1-s2.0-S246882312300055X-gr7_lrg.jpg https://s3-eu-west-1.amazonaws.com/prod-ucs-content-store-eu-west/content/pii:S246882312300055X/HIGHRES/image/jpeg/b8878c9928f5791880a722d5281e6c4f/gr7_lrg.jpg gr7 gr7_lrg.jpg jpg 207426 1230 2500 IMAGE-HIGH-RES 1-s2.0-S246882312300055X-gr8_lrg.jpg https://s3-eu-west-1.amazonaws.com/prod-ucs-content-store-eu-west/content/pii:S246882312300055X/HIGHRES/image/jpeg/b29310d24b7621536cd9100f02f1147a/gr8_lrg.jpg gr8 gr8_lrg.jpg jpg 160450 1556 1667 IMAGE-HIGH-RES 1-s2.0-S246882312300055X-mmc1.pdf https://s3-eu-west-1.amazonaws.com/prod-ucs-content-store-eu-west/content/pii:S246882312300055X/mmc1/MAIN/application/pdf/31e0d1525975c7cfa78a8a83607bb772/mmc1.pdf mmc1 mmc1.pdf pdf false 637015 APPLICATION 1-s2.0-S246882312300055X-si1.svg https://s3-eu-west-1.amazonaws.com/prod-ucs-content-store-eu-west/content/pii:S246882312300055X/image/svg+xml/6d5d8c8e3839d160ff5b05db907a9ba4/si1.svg si1 si1.svg svg 10867 ALTIMG 1-s2.0-S246882312300055X-si2.svg https://s3-eu-west-1.amazonaws.com/prod-ucs-content-store-eu-west/content/pii:S246882312300055X/image/svg+xml/7bd5ba8acb5a06b20e3ec62238aba658/si2.svg si2 si2.svg svg 4294 ALTIMG 1-s2.0-S246882312300055X-si3.svg https://s3-eu-west-1.amazonaws.com/prod-ucs-content-store-eu-west/content/pii:S246882312300055X/image/svg+xml/3f8c157a068cc8dc34a70951312bf832/si3.svg si3 si3.svg svg 3795 ALTIMG 1-s2.0-S246882312300055X-si4.svg https://s3-eu-west-1.amazonaws.com/prod-ucs-content-store-eu-west/content/pii:S246882312300055X/image/svg+xml/2afed9bd642c8a26a50ba18193062c19/si4.svg si4 si4.svg svg 15378 ALTIMG 1-s2.0-S246882312300055X-si5.svg https://s3-eu-west-1.amazonaws.com/prod-ucs-content-store-eu-west/content/pii:S246882312300055X/image/svg+xml/97668b63da1777a54f5613a8495f6f56/si5.svg si5 si5.svg svg 3719 ALTIMG 1-s2.0-S246882312300055X-am.pdf https://s3-eu-west-1.amazonaws.com/prod-ucs-content-store-eu-west/content/egi:1077R579TL6/MAIN/application/pdf/0b4e2816add73bdd4bd58211ce93c381/am.pdf am am.pdf pdf false 1554511 AAM-PDF MCAT 112968 112968 S2468-8231(23)00055-X 10.1016/j.mcat.2023.112968 Elsevier B.V. Fig. 1 Nitrogen adsorption-desorption isotherms of the prepared LDH samples. Fig 1 Fig. 2 The XRD spectra of the HT-Mg1.2NiaCubAl, HT-Mg0.8NicCudAl, HT-Ni2Al and HT-Cu2Al materials. Fig 2 Fig. 3 DRIFT spectra of the LDH solids. Fig 3 Fig. 4 DR-UV-VIS spectra of the LDH samples. Fig 4 Fig. 5 SEM images of the hydrotalcite-like compounds. Fig 5 Fig. 6 Alcohol conversion vs Ni/Cu mol ratio in the HT-Mg1.2NiaCubAl (a) and HT-Mg0.8NicCudAl (b) series. Fig 6 Fig. 7 The variation of the conversion of benzyl alcohol and the yields of 2-benzoyl-3-phenylacrylonitrile (BPA) in different solvents vs the Ni/Mg ratio in the MgNiCuAl LDH catalysts. Fig 7 Fig. 8 The variation of the yield to 2-benzoyl-3-phenylacrylonitrile (BPA) in different solvents vs the molar ratio of base/acid sites of the MgNiCuAl LDH catalysts. Fig 8 Scheme 1 Reaction route for one-pot cascade oxidation – Knoevenagel condensation reaction. Scheme 1 Table 1 Elemental composition of the LDH materials determined by XRF. Table 1 LDH material Elemental composition Atomic ratios Mg2+ [wt%] Al3+ [wt%] Ni2+ [wt%] Cu2+ [wt%] Mg/Al Ni/Al Cu/Al HT-Mg1.2Ni0.6Cu0.2Al 7.39 7.64 9.96 4.07 1.09 0.60 0.23 HT-Mg1.2Ni0.4Cu0.4Al 7.26 7.49 5.97 7.62 1.09 0.36 0.43 HT-Mg1.2Ni0.2Cu0.6Al 7.84 7.84 4.01 10.39 1.13 0.23 0.56 HT-Mg0.8Ni0.8Cu0.4Al 5.35 7.64 13.78 7.72 0.79 0.83 0.43 HT-Mg0.8Ni0.6Cu0.6Al 4.32 6.93 9.74 11.24 0.70 0.64 0.69 HT-Mg0.8Ni0.4Cu0.8Al 4.03 7.17 6.03 15.63 0.63 0.39 0.93 HT-Ni2Al - 6.93 33.16 - - 2.20 - HT-Cu2Al - 5.99 - 33.77 - - 2.39 Table 2 Acidity, basicity and textural properties of the hydrotalcite-like samples. Table 2 LDH material Total acidity (mmol Py g−1) Total basicity (mmol acrylic acid g−1) Base sites/acid sites ratio Surface area (m2 g−1) Pore volume (cm3 g−1) Pore size (nm) HT-Mg1.2Ni0.6Cu0.2Al 0.055 2.3 41.8 160 0.41 7.79 HT-Mg1.2Ni0.4Cu0.4Al 0.051 2.6 51.0 163 0.42 6.19 HT-Mg1.2Ni0.2Cu0.6Al 0.049 2.8 57.1 149 0.33 8.72 HT-Mg0.8Ni0.8Cu0.4Al 0.070 0.9 12.9 130 0.18 3.86 HT-Mg0.8Ni0.6Cu0.6Al 0.065 1.9 29.2 169 0.39 7.21 HT-Mg0.8Ni0.4Cu0.8Al 0.060 2.1 35.0 132 0.27 0.86 HT-Ni2Al 0.073 1.9 26.0 144 0.66 0.89 HT-Cu2Al 0.025 7.2 288.0 57 0.19 0.84 Table 3 Structural data of the hydrotalcite-like compounds. Table 3 LDH material r(Me,Al) (Å) a (Å) c (Å) D003 (nm) D110 (nm) FWHM015 (deg) HT-Mg1.2Ni0.6Cu0.2Al 0.651 3.038 22.749 10.0 13.9 3.138 HT-Mg1.2Ni0.4Cu0.4Al 0.654 3.042 22.749 8.5 12.5 3.269 HT-Mg1.2Ni0.2Cu0.6Al 0.657 3.046 22.747 10.4 11.2 3.207 HT-Mg0.8Ni0.8Cu0.4Al 0.653 3.037 22.767 5.5 8.9 4.481 HT-Mg0.8Ni0.6Cu0.6Al 0.651 3.041 22.716 8.6 10.4 3.761 HT-Mg0.8Ni0.4Cu0.8Al 0.657 3.046 22.716 6.4 8.2 4.415 HT-Ni2Al 0.642 3.027 22.734 14.3 16.0 2.415 HT-Cu2Al a 0.673 3.049 22.599 29.0 11.5 0.340 a Also contains a Cu2(CO3)(OH)2-malachite side-phase. Table 4 Catalytic results of the HT-Mg1.2NiaCubAl, HT-Mg0.8NicCudAl, HT-Ni2Al and HT-Cu2Al systems in the aerobic oxidation/condensation tandem reaction. Reaction conditions: i) oxidation step: benzyl alcohol (1 mmol), solvent (10 mL), catalyst (1 g), O2 (1 atm), 80 °C, 6 h; ii) condensation step: benzoyl acetonitrile (1.2 mmol) dissolved in 3 mL solvent, Ar (1 atm), 80°C, 19 h. Table 4 Catalyst Conversion of benzyl alcohol (%) in the following solvents: Yield to BPA a (%) in the following solvents: Toluene Mesitylene Benzene Toluene Mesitylene Benzene HT-Mg1.2Ni0.6Cu0.2Al 58 73 75 34 70 70 HT-Mg1.2Ni0.4Cu0.4Al 54 60 70 32 58 69 HT-Mg1.2Ni0.2Cu0.6Al 52 55 68 25 51 63 HT-Mg0.8Ni0.8Cu0.4Al 84 90 96 67 89 92 HT-Mg0.8Ni0.6Cu0.6Al 83 84 88 46 82 82 HT-Mg0.8Ni0.4Cu0.8Al 70 78 81 41 55 78 HT-Ni2Al 96 98 100 76 97 98 HT-Cu2Al 41 48 57 32 30 33 a 2-benzoyl-3-phenylacrylonitrile Study of the catalytic properties of MgNi(Cu)Al LDH in the one-pot cascade oxidation-Knoevenagel condensation reaction Alexandra-Elisabeta Stamate Conceptualization Investigation Visualization Writing – original draft a b Octavian Dumitru Pavel Investigation Project administration a b Rodica Zăvoianu Conceptualization Investigation Methodology Supervision Writing – review & editing a b Ruxandra Bȋrjega Formal analysis Investigation c Katja Neubauer Investigation d Angela Koeckritz Conceptualization Methodology Methodology Supervision Writing – review & editing d Ioan-Cezar Marcu Conceptualization Methodology Writing – review & editing Supervision a b ⁎ a Department of Inorganic & Organic Chemistry, Biochemistry & Catalysis, Faculty of Chemistry, University of Bucharest, 4-12, Blv. Regina Elisabeta, Bucharest 030018, Romania Department of Inorganic & Organic Chemistry, Biochemistry & Catalysis, Faculty of Chemistry University of Bucharest 4-12, Blv. Regina Elisabeta Bucharest 030018 Romania aDepartment of Inorganic & Organic Chemistry, Biochemistry & Catalysis, Faculty of Chemistry, University of Bucharest, 4-12, Blv. Regina Elisabeta, Bucharest 030018, Romania b Research Center for Catalysts & Catalytic Processes, Faculty of Chemistry, University of Bucharest, 4-12, Blv. Regina Elisabeta, Bucharest 030018, Romania Research Center for Catalysts & Catalytic Processes, Faculty of Chemistry University of Bucharest 4-12, Blv. Regina Elisabeta Bucharest 030018 Romania bResearch Center for Catalysts & Catalytic Processes, Faculty of Chemistry, University of Bucharest, 4-12, Blv. Regina Elisabeta, Bucharest 030018, Romania c National Institute for Lasers, Plasma and Radiation Physics, 409 Atomistilor Street, PO Box MG-16, Măgurele 077125, Romania National Institute for Lasers, Plasma and Radiation Physics 409 Atomistilor Street, PO Box MG-16 Măgurele 077125 Romania cNational Institute for Lasers, Plasma and Radiation Physics, 409 Atomistilor Street, PO Box MG-16, Măgurele 077125, Romania d Leibniz Institute for Catalysis (LIKAT Rostock), Albert-Einstein-Straße 29a, Rostock 18059, Germany Leibniz Institute for Catalysis (LIKAT Rostock) Albert-Einstein-Straße 29a Rostock 18059 Germany dLeibniz Institute for Catalysis (LIKAT Rostock), Albert-Einstein-Straße 29a, Rostock 18059, Germany ⁎ Corresponding author at: Department of Inorganic & Organic Chemistry, Biochemistry & Catalysis, Faculty of Chemistry, University of Bucharest, 4-12, Blv. Regina Elisabeta, Bucharest 030018, Romania. Department of Inorganic & Organic Chemistry, Biochemistry & Catalysis, Faculty of Chemistry University of Bucharest 4-12, Blv. Regina Elisabeta Bucharest 030018 Romania In this work, the structural and bifunctional catalytic properties of MgNi(Cu)Al layered double hydroxides (LDH) with different molar ratios between the cations were studied. The LDH materials were prepared by co-precipitation and were characterized using X-ray fluorescence (XRF), X-Ray diffraction (XRD), diffuse reflectance infrared Fourier-transform spectroscopy (DRIFT), diffuse reflectance ultraviolet-visible spectroscopy (DR-UV-VIS), scanning electron microscopy (SEM), nitrogen adsorption-desorption and acidity-basicity measurements. They were tested in a one-pot cascade oxidation-Knoevenagel condensation reaction used to synthesize 2-Benzoyl-3-phenylprop-2-enenitrile also known as 2-Benzoyl-3-phenylacrylonitrile (BPA). This involved the benzyl alcohol (BnOH) oxidation under an oxygen atmosphere followed by the Knoevenagel condensation of benzaldehyde with 3-oxo-3-phenylpropanenitrile also known as benzoyl acetonitrile (BzACN). Three different non-polar solvents, i.e., toluene, benzene and 1,3,5-trimethylbenzene (mesitylene), were used as reaction media. For the LDH catalysts containing both nickel and copper, the alcohol conversion and BPA yield increased with Ni/Cu molar ratio. The acid-base properties of the solids and the nature of the solvent strongly influence the reaction performance. Graphical abstract Image, graphical abstract Keywords Multicationic layered double hydroxides Tandem reaction Oxidation Knoevenagel condensation Benzyl alcohol Data availability Data will be made available on request. 1 Introduction Layered double hydroxides (LDH), also known as hydrotalcites, present a similar layered structure to the cationic clay materials. Still, due to their anion-exchange properties, they belong to the anionic clay group [1]. The following general formula describes the LDH: [M2+ 1-xM3+ x(OH)2][Am− x/m·nH2O], where M2+ and M3+ are divalent and trivalent metal cations, respectively, connected through hydroxyl groups forming the cationic layers, Am− represents the compensating anions interlayered together with n molecules of water, while x is the charge density or the anionic exchange capacity [1]. Their lamellar structure with versatile interlayer zone, rheological properties, colloidal behavior, variable chemical composition, and layer charge density determined the significant impact of LDH in many fields of applications, but mainly in catalysis [1]. The most recurrent LDH solid consists only of Mg and Al, which can easily be replaced by many metallic cations having the appropriate valence state and ionic radius [2]. Mg can be isomorphically substituted by all the divalent cations with similar ionic radius and prefer an octahedral configuration, besides Cu, which can give LDH-type compounds only when mixed with different divalent cations, such as Co, Mn etc. [2]. According to the literature, the synthesis of CuAl-LDH is problematic due to the following issues: i) at a pH value of ca. 5, isolated hydroxide compounds, such as Cu(OH)2 or Al(OH)3 may be obtained, and ii) the Jahn-Teller effect of the copper cation when hydroxyl anions octahedrally surround it can alter the development of the lamellar structure reducing the electrostatic interaction between the brucite-type layers and the anions present in the interlayer region. The Jahn-Teller effect of the copper cations can also lead to the occurrence of malachite or gerhardtite side-phases [2–5]. However, it is possible to obtain Cu-containing LDH by attenuating the impact of the Jahn-Teller effect of Cu2+ using a second divalent cation, M2+, at a molar ratio Cu2+/M2+ equal to or lower than 1 [4]. When Ni2+ species replace the Mg2+ cations present in the brucite-like layers, they are usually evenly distributed in the layer [6,7]. The Ni/Al molar ratio influences the stability of the LDH catalysts containing Ni and Al cations. A molar ratio between 1.17-2 [8] enables the formation of stable LDH. Neat NiAl-LDH can be synthesized only when 0.2 ≤ x ≤ 0.33, where x is the charge density, which corresponds to a Ni/Al molar ratio between 2 and 4 [9]. When the values of x are out of the above-mentioned range, the LDH will also contain Ni(OH)2 or bayerite [9]. The pH value also plays a significant role in the synthesis of Ni-Al hydrotalcites, influencing their morphology [8]. It has been found that the Ni-containing LDH has higher thermal stability than the Cu-containing LDH, which can only operate in reactions at temperatures up to 250°C [10,11] because at higher temperatures, their activity will dramatically decrease due to copper sintering. Due to their potential economic uses in the synthesis of fine chemicals, fragrant compounds, and in the pharmaceutical sector, both oxidation [12–14] and condensation [15,16] reactions are of great interest. The advanced oxidation reaction is also of interest for the removal of hazardous pollutants from water [17,18]. Nowadays, finding innovative solutions to stop or, at least, to decrease the pollution that occurs in the chemical industry has become a priority. Multistep reactions are among the processes that imply a higher demand for “green” catalytic alternatives. Solving this issue by using tandem or one-pot cascade reactions represents an environmentally friendly solution that can reduce waste production and untangle convoluted synthetic routes [19]. Various catalysts have been used for cascade reactions; however, many of them presented some serious inconsistencies, such as high cost of production or the need to use additives during the multistep processes [20]. Some of these catalysts were discussed in our previous article [20]. In 2017, Zhou and coll. [21] reported a bifunctional NiGa LDH catalyst for the aerobic oxidation-condensation tandem reaction between aromatic alcohols and active methylene compounds in different solvents. Even though NiGa LDH has been a good bifunctional catalyst for this type of reaction, it is not attractive for industrial application since gallium has a low abundance in nature and its price is high. The current work focuses on the synthesis by co-precipitation of cheaper alternative catalysts, such as multicationic MgNi(Cu)Al-layered double hydroxides with different molar ratios between the cations, and their use in the one-pot cascade oxidation-Knoevenagel condensation reaction for obtaining 2-benzoyl-3-phenylacrylonitrile (BPA), an important tyrosinase inhibitor which do not display cytotoxic effects [8] (Scheme 1 ). Thus, the target product was synthesized through the aerobic oxidation of benzyl alcohol, followed by the Knoevenagel condensation of the obtained benzaldehyde with benzoylacetonitrile (BzACN). The reactions were performed in three different solvents: toluene, benzene, and mesitylene. Notably, 2-benzoyl-3-phenylacrylonitrile (BPA) and its derivatives, (E)-2-benzoyl-3-(substituted phenyl) acrylonitriles, which possess a linear β-phenyl-α,β-unsaturated carbonyl scaffold, have been intensively used for anti-tyrosinase activity and melanogenesis [8]. Thus, the current paper aims to open up new perspectives in the rational design of efficient bifunctional catalytic systems for the organic synthesis. On the other hand, the development of a highly efficient catalytic material for the aerobic oxidation of alcohols to their corresponding carbonyl compounds in the absence of any additives is particularly attractive for the synthetic and industrial chemistry [22]. 2 Materials and methods 2.1 Materials Ni(NO3)2∙6H2O, Cu(NO3)2∙3H2O, Mg(NO3)2∙6H2O, Al(NO3)3∙9H2O, NaOH, Na2CO3 (chemical purity grade, purchased from Merck) 2.2 Synthesis of Mg1.2NiaCubAl(OH)6(CO3)0.5 LDH with a + b = 0.8 Three Mg1.2NiaCubAl(OH)6(CO3)0.5 solids with different Ni/Cu mol ratios, a + b = 0.8 and M2+/M3+ = 2, were prepared via the co-precipitation method, which implies the mixing of two different solutions at a constant pH value of 10. The first solution, solution A, contains the precursor metallic salts, namely Ni(NO3)2∙6H2O, Cu(NO3)2∙3H2O, Mg(NO3)2∙6H2O, Al(NO3)3∙9H2O having the total concentration of the cations of 1.5 M, respecting the fixed molar ratios. The second one, solution B, is prepared by dissolving NaOH and Na2CO3 in distilled water at a concentration of 1.2 M NaOH and 0.9 M Na2CO3, respectively. The precipitation reactor placed on a stirring plate was first filled with 100 mL of distilled water. After the pH value was adjusted to 10 using the basic solution (solution B), the two solutions A and B were added dropwise simultaneously under intense stirring at room temperature. Once the two solutions were mixed, the precipitation reactor was transferred to a hotplate stirrer, letting the obtained precipitate age at 75°C for 18 h. The precipitate was then filtered and washed with distilled water until the conductivity of the washing water was below 100 μS/cm. The final step consisted in drying the solids in an oven at 90°C for 24 h. The following three compositions were prepared in this way: Mg1.2Ni0.6Cu0.2Al(OH)6(CO3)0.5, Mg1.2Ni0.4Cu0.4Al(OH)6(CO3)0.5 and Mg1.2Ni0.2Cu0.6Al(OH)6(CO3)0.5. They were denoted as HT-Mg1.2Ni0.6Cu0.2Al, HT-Mg1.2Ni0.4Cu0.4Al and HT-Mg1.2Ni0.2Cu0.6Al, respectively. The exact amounts of the reagents used to prepare each solid are specified in the SI file. 2.3 Synthesis of Mg0.8NicCudAl(OH)6(CO3)0.5 LDH with c + d = 1.2 Three Mg0.8NicCudAl(OH)6(CO3)0.5 solids with different Ni/Cu ratios, but with c + d = 1.2 and M2+/M3+ = 2, were also prepared using the co-precipitation method, which was thoroughly described above. The solutions A and B were mixed, and the obtained precipitate was further washed, filtered and dried as described in the previous case. The following three compositions were prepared: Mg0.8Ni0.8Cu0.4Al(OH)6(CO3)0.5, Mg0.8Ni0.6Cu0.6Al(OH)6(CO3)0.5 and Mg0.8Ni0.4Cu0.8Al(OH)6(CO3)0.5, denoted as HT-Mg0.8Ni0.8Cu0.4Al, HT-Mg0.8Ni0.6Cu0.6Al and HT-Mg0.8Ni0.4Cu0.8Al, respectively. The exact amounts of the reagents used to prepare each solid are specified in the SI file. 2.4 Synthesis of LDH solids containing only one of the divalent transition-metal cations, namely Ni2Al(OH)6(CO3)0.5 and Cu2Al(OH)6(CO3)0.5 To check the existence of a Ni-Cu synergistic effect, two other solids with the same M2+/Al3+ ratio containing only one of the divalent transition-metal cations (Ni or Cu) were synthesized using the above-described co-precipitation method. They were denoted as HT-Ni2Al and HT-Cu2Al. The exact amounts of the reagents used for their preparation are specified in the SI file. 3 Materials characterization The characterization of the LDH solids was performed using a battery of techniques, such as powder X-ray diffraction (XRD), X-ray fluorescence (XRF) spectroscopy, scanning electron microscopy (SEM), nitrogen adsorption at 77 K, basicity and acidity measurements, diffuse reflectance infrared Fourier-transform (DRIFT) and diffuse reflectance UV-Vis (DR-UV-Vis) spectroscopies. The X-ray diffractograms were recorded using a Panalytical X'Pert θ/2θ diffractometer equipped with an Xcelerator detector having automatic divergence slits and CuKα radiation (40 kV, 40 mA, λ = 0.15418 nm). Cu-beta radiation was removed using a nickel filter foil. The measurements were performed at 0.32 °/min. The samples were mounted on silicon zero background holders. The peak profiles were fitted with the Pseudo-Voigt function using the HighScore Plus software package (Panalytical). The phase identification was done by using the PDF-4+ database (2021) of the International Center of Diffraction Data (ICDD). The X-ray fluorescence data have been collected using a Panalytical Epsilon 1 spectrometer operated with an Ag X-ray source. The total number of acid sites was determined by pyridine adsorption using the DRIFT spectra recorded on a FT/IR-4700 Jasco spectrometer (Tokyo, Japan). The procedure was thoroughly described in our previous article [20]. The total number of base sites was quantitatively determined by irreversible adsorption of an organic acid, namely the acrylic acid, having a pKa of 4.2, using a JASCO V650 UV-Vis spectrometer. Approximately 0.05 g of each material were added in cylindrical brown glass vials, then 10 ml of a freshly prepared solution of acrylic acid in cyclohexane (1 M) was added over the solids and the vials were sealed and shaken for 2 h at room temperature. The sorption experiments were carried out at the wavelength of maximum absorption (λmax, nm) of acrylic acid (λmax = 225 nm), in the concentration range where the Beer-Lambert law is valid. DRIFTS spectra of the LDH materials were obtained using a Jasco FT/IR 4700 spectrometer having a PIKE accessory for diffuse reflectance. The spectra were collected in the spectral range 4000–400 cm−1, with a scanning speed of 128 scans min−1 and a resolution of 4 cm−1 using KBr as background. The diffuse reflectance UV-VIS spectra were recorded on a JASCO V650 UV-VIS spectrometer using spectralon as a white reference. The adsorption/desorption isotherms were recorded on an ASAP2020 equipment from Micromeritics, USA, in a nitrogen atmosphere, at 77 K. The samples were outgassed overnight at 22°C before the measurements. The scanning electron microscopy (SEM) analysis was performed using a Hitachi SU8230 microscope (Hitachi, Tokyo, Japan) at an accelerating voltage of 5 kV. Before the analysis, the solids were covered with a 9-nm-thick layer of gold, using the Quorum Q150T ES turbomolecular pumped coater (Quorum Technologies, London, UK). 4 Catalytic tests The catalytic tests were performed according to the method described in our previous paper [20]. Practically, the one-pot cascade oxidation-Knoevenagel condensation reaction (Scheme 1) was carried out in a 100 mL Büchi miniclave (from Buchiglas (Büchi AG) Uster, Switzerland) where 1 mmol of benzyl alcohol (BnOH) was mixed with 10 mL of solvent (toluene, benzene or mesitylene) and 1 g of catalyst (ca. 10 wt. % of the reaction mixture). The mixture was stirred under 1 atm of O2 and heated at 80°C using a glycerin bath. After 6 h of oxidation, 1.2 mmol of benzoylacetonitrile (BzACN) dissolved in 3 mL of solvent (toluene, benzene or mesitylene) was added to the existing mixture to start the condensation step leading to the formation of the final product, i.e., 2-benzoyl-3-phenylacrylonitrile (BPA). The condensation step was continued under stirring and 1 atm of argon at 80°C for 19 h. At the end of the reaction, the catalyst was separated by filtration and washed with acetonitrile. The organic phase was analyzed on a GC-MS (Shimadzu GCMS-QP2010 SE instrument, Shimadzu, Kyoto, Japan) equipped with an HP-5MS capillary column (30 m x 0.25 mm x 0.25 μm) from Agilent. Highly pure He (99.999 %) was used as a carrier gas. The alcohol conversion was calculated using the following formula: C o n v . ( % ) = n B n O H 0 − n B n O H n B n O H 0 × 100 where n B n O H 0 and n B n O H are the initial and final (unreacted) number of moles of benzyl alcohol, respectively. Because, according to the overall reaction, one mol of alcohol leads to one mol of desired product, i.e., 2-benzoyl-3-phenylacrylonitrile (BPA), the yield was calculated as follows: Y i e l d t o B P A ( % ) = n B P A n B n O H 0 × 100 where n B P A is the number of moles of BPA formed in the tandem reaction. 5 Results and discussion 5.1 Catalysts characterization The cationic composition of the LDH solids determined by XRF together with the M/Al atomic ratios (M = Mg, Ni and/or Cu) can be seen in Table 1 . First, these results confirm the chemical modification of the layered double hydroxides with Ni and Cu cations. The obtained values indicate that the Mg/Al ratio is slightly smaller than expected, probably due to the incomplete precipitation of magnesium during the synthesis step. This effect is more discernable for the samples with a smaller amount of Mg and greater amount of Cu, i.e., HT-Mg0.8Ni0.6Cu0.6Al and HT-Mg0.8Ni0.4Cu0.8Al. For the latter and for HT-Cu2Al, the Cu/Al atomic ratios are slightly higher than the theoretical values, while they are close to the calculated values for the other samples. At the same time, the Ni/Al atomic ratios are close to the theoretical values for all the Mg-containing samples, being slightly higher for HT-Ni2Al sample. The results of the acidity and basicity measurements are tabulated in Table 2 . It can be observed that all the samples present both acidic and basic sites, but as expected, the number of acid sites is sensibly lower than that of base sites. In both Mg-containing series, i.e., HT-Mg1.2NiaCubAl and HT-Mg0.8NicCudAl, the total number of base sites increases, while that of acid sites decreases with increasing the Cu content at the expense of Ni. The unexpectedly high basicity of the HT-Cu2Al sample is thought to be caused by the XRD-detected Cu2(CO3)(OH)2-malachite side-phase. Since Ni2+ (1.91) and Cu2+ (1.91) have identical electronegativity values on the Pauling scale [23], the Jahn-Teller effect of copper cations is crucial for the catalytic activity [4]. This leads to distortion of the octahedral coordination structure of the LDH, which raises the surface energy and, as a result, an increase of the catalytic activity is expected. Additionally, the isomorphic substitution in the brucite-like layer octahedral locations, which is influenced by the ionic radius of Cu2+ (0.73 Å), which is close to that of Mg2+ (0.72 Å) and larger than that of Ni2+ (0.69 Å), should be taken into consideration [24]. The specific surface area, the pore volume, and the pore size of the prepared samples are presented in Table 2. Their corresponding adsorption-desorption isotherms and pore size distributions are shown in Fig. 1 and Fig. S1, respectively. According to the IUPAC classification, the solids reveal type IV isotherms specific to mesoporous materials. All the MgNiCuAl-type compounds present an H2b-type hysteresis loop characteristic for narrow slit-like mesopores which can present a fine bottleneck with one side almost closed or double side open [25,26]. Additionally, these samples frequently combine cylinder-shaped pores with parallel plate-shaped pores [26]. This resemblance can be associated to the similar aspect of the SEM images corresponding to the samples with quaternary composition. The HT-Ni2Al exhibits an H1-type hysteresis loop specific to a narrow range of uniform mesopores [25]. The type H1 loop is also associated with materials that agglomerate, forming spheres spread in a uniform array [27]. This information is confirmed by the SEM image (Fig. 5) of the HT-Ni2Al solid. The HT-Cu2Al presents an H3-type loop given by aggregates of plate-like particles, as confirmed by the SEM images (Fig. 5). The XRD patterns of the Mg-containing materials, i.e., HT-Mg1.2NiaCubAl and HT-Mg0.8NicCudAl, (Fig. 2 ) have the characteristics of a typical well crystallized single hydrotalcite-like phase, with sharp, symmetric and intense diffraction lines at low 2θ angular values and less intense, asymmetric lines, at higher 2θ values (ICDD card no. 01-089-5434). HT-Ni2Al pattern matches the Ni,Al-LDH phase (ICDD card no. 04-018-1341), while in the HT-Cu2Al pattern, besides the Cu,Al-LDH phase (ICDD card no. 00-037-0630), lines corresponding to a monoclinic Cu2(CO3)(OH)2-malachite side-phase (ICDD card no. 00-056-0001) can be identified. All the reflections of the layered phase were indexed to a hexagonal lattice with an R3m rhombohedral symmetry. Lattice parameters a (average distance between two cations in the layers, a = 2d110) and c (three times the distance between two layers, c = 3d003) were calculated from their (110) and (003) diffraction lines and were gathered in Table 3 . The sensitivity of parameter a to the nature of layer cations is exposed in Fig. S2. Based on the proportion of the metal components, as revealed by XRF measurements (Table 1), and on their Shannon ionic radii: 0.72, 0.73, 0.69 and 0.535 Å for Mg2+, Cu2+, Ni2+ and Al3+, respectively, an average ionic radius of the layer cations, r(Me,Al), was determined for each solid (Table 3). Indeed, as shown in Fig. S2, the a lattice parameter values are proportional to the cationic composition of the solids, except for the HT-Cu2Al solid, which contains a side-phase (malachite). The correlation of the a-parameter value with the apparent composition of the ternary LDH emphasizes the effective substitution of the Mg2+ by Ni2+ and Cu2+ and is an indication that other non-LDH phases are absent. The c lattice parameter values, determined by the nature and orientation of the interlayer anions, are nearly identical for all materials, except for HT-Cu2Al. This can be explained taking into consideration that, on the one hand, the Me/Al atomic ratios are roughly the same for all the solids and, on the other hand, as the DRIFT spectra indicate (Fig. 3 ), only carbonates, OH groups and water are present in the interlayer spaces. Due to the presence of the malachite impurity phase, the smaller Cu/Al atomic ratio of the Cu,Al-LDH phase in the HT-Cu2Al solid leads to stronger electrostatic interactions of the layers with the interlayer anions and stronger hydrogen bonding with the interlayer water molecules and, hence, to a smaller c parameter value. Crystallite sizes along the normal to the layers, D003, and in the plane of the layers, D110, were calculated with the Scherrer formula using the full width at half maximum (FWHM) of the (003) and (110) diffraction lines, respectively, the values obtained being tabulated in Table 3. As expected, the largest crystalline domain sizes of the brucite-like layer are attained in the solids with only one divalent transition-metal cation, i.e., HT-Ni2Al and HT-Cu2Al, respectively. For the quaternary hydrotalcite-like materials, there is an evident disorder effect due to the isomorphous substitution of Mg2+ by Ni2+ and Cu2+, in particular for the HT-Mg0.8NicCudAl series characterized by a higher degree of substitution [28–30]. The brucite-like sheet disorder induces a smaller long-range order along the c-axis due mainly to the presence of stacking faults, reflected in the D003 values, and to turbostratic distortions, reflected by the large and asymmetric broadness of the (0kl) reflections in the medium 2-theta angular domain. Table 3 shows the values of FWHM of the (015) reflection as a marker of turbostraticity effect. Linear relationships between the crystalline domain sizes, i.e., D003 vs D001, on one hand, and between the turbostraticity (FWHM015) and the crystalline domain size inside the brucite-like layer (D110), on the other hand, can be observed (Figs. S3 and S4). Stacking faults and turbostratic distortion have been associated with a mismatch in the geometries of layers and interlayer anions, which prevents an ideal packing of the layers or local distortions within slabs due to the microstrain arising from the distribution of electrostatic charges [31,32]. This is likely the case of the quaternary hydrotalcite-like solids. These results are to be correlated with the textural properties of the as-prepared materials: relative large surface areas (Table 2), and the proportionality of the D003 values, indicative of the long-range order along the layers stacking direction, with the pore volumes (Fig. S5). Notably, as previously mentioned, the HT-Cu2Al material is apart due to the Jahn-Teller distortion effect of copper, which is responsible for the presence of a side-phase and a different LDH-phase pattern shape with preferred orientation in the c-direction. This is consistent with the acicular forms observed in the SEM image (Fig. 5). On the other hand, it is noteworthy that the presence of some amorphous phase could not be completely ruled out. The intensity of (110) reflection, related only to the brucite-like layer, is an indicative of the amount of LDH crystalline phase, which includes ordered stacked layers as well as delaminated layers. The amount of amorphous material is expected to affect the textural properties by its deposition inside the pores. Indeed, a linear correlation has been found between the intensity of the (110) reflection and the pore volume: the HT-Ni2Al material, which contains the least amorphous phase exhibits the highest pore volume (Fig. S6). To determine the nature and the symmetry of the anions present in the interlayer space and the existence of any impurity phases, the DRIFT spectra shown in Fig. 3 were recorded. All the hydrotalcite-like samples showed an intense broad band between ca. 3800 and 3000 cm−1 attributed to the hydroxyl stretching mode characteristic for the layer OH groups and interlayered water molecules. A weak shoulder around 3000 cm−1 appeared in all the cases ascribed to the OH stretching mode resulting from the interaction through hydrogen bonds between the water molecules and carbonate anions present in the interlayer region [2]. The weak band at around 1600 cm−1 is specific for the bending mode of water molecules. The relatively sharp, intense band at about 1000 cm−1 is attributed to mode ν3 antisymmetric stretching of interlayer carbonate. The results confirm the presence of carbonate and the absence of nitrate in the interlayer space of the hydrotalcite-like samples. At lower wavenumber values, i.e., 1000-400 cm−1, there are bands characteristic to O-Metal-O vibrations overlapping [2]. To obtain information about the oxidation states and the stereochemistry of the metallic cations, the LDH samples were analyzed by DR-UV-VIS spectroscopy (Fig. 4 ). The spectra present bands attributed to O2−-M2+ charge transfer and d-d transitions characteristic to the octahedral geometry of the transition-metal divalent cations, Ni2+ and Cu2+. For the Ni2+ cations, two spin-allowed transitions, namely: 3A2g(F) → 3T1g(F) and 3A2g(F) → 3T1g(P), were observed. The band specific for 3A2g(F) → 3T1g(F) transition splits due to the spin-orbit coupling [32], and it can be found at 750 nm [33], while the band for 3A2g(F) → 3T1g(P) transition is located at 377 nm. Both bands correspond to Ni2+ in octahedral coordination. For all the samples containing Ni cations, some spin-forbidden transitions 3A2g(F) → 1Eg(D) and 3A2g(F) → 1T2g(D) (bands at ca. 642 and 411 nm, respectively) were also recorded [33]. In contrast with the Ni-rich solids, the Cu2+-rich LDH samples show wider UV-VIS bands due to an increased structural disorder in line with the XRD measurements. In the spectrum of HT-Cu2Al sample, only one spin-allowed, Laporte-forbidden transition is observed 2Eg(D) → 2T2g(D), as expected, which indicates the presence of Cu2+ in the octahedral symmetry [34]. The intensity and width of this band, centered at ca. 770 cm−1, are attributed to the distortion of the octahedral coordination of Cu2+ due to the Jahn-Teller effect. The bands noticed in the UV region for the samples containing both Ni and Cu cations are ascribed to O2− → Mn+ charge transfer transitions [34]. The SEM images (Fig. 5 ) indicated that the samples are not entirely homogenous. Moreover, it seems like small particles are formed and distributed among larger ones. The increase of the nickel content enables the formation of round particles uniformly distributed. It appears that the ovoidal aspect of the particles is more pronounced in the HT-Mg1.2NiaCubAl samples compared to the HT-Mg0.8NicCudAl. In the SEM image of HT-Cu2Al sample, one can see hexagonal platelets and some rod-like particles that are not recurrent in the samples containing nickel and copper. 5.2 Catalytic results The LDH catalysts were tested in the aerobic oxidation-condensation tandem reaction using benzene, toluene and mesitylene as solvents. Toluene and mesitylene have shown to be effective solvents in the tandem reactions explored by Zhou et al. [21]. They, together with benzene, served as adequate solvents in our investigation as well. The alcohol conversions and yields to BPA are displayed in Table 4 . First, we noticed that, compared to the Ce-containing MgAl LDH-graphene oxide composite catalysts used in our previous study [20], the current LDH materials have proven to be more efficient. All the prepared LDH samples exhibited a bifunctional catalytic behavior involving both redox sites, represented by the transition metal cations, and acid-base sites, being, thus, able to promote both the alcohol oxidation and the Knoevenagel condensation in a stepwise way. Except for HT-Cu2Al, the catalysts with higher content of transition metal cations presented higher activity for the oxidation step of the tandem reaction. The low activity of HT-Cu2Al could be related to the sensibly lower value of its specific surface area and to the presence of the malachite impurity. It could also be observed that for a given LDH series, i.e., HT-Mg1.2NiaCubAl or HT-Mg0.8NicCudAl, the catalytic performance decreased with increasing the Cu content at the expense of Ni, whatever the solvent used, suggesting a simple additive effect [35]. Indeed, the catalytic activity in terms of alcohol conversion increased linearly, within the limits of the experimental error, with increasing the Ni/Cu mol ratio in the MgNiCuAl LDH catalysts as seen in Fig. 6 . Moreover, the BPA yield followed the same trend (Fig. S7). The decrease of activity with the increase of Cu content in the catalyst is likely due to the fact that this cation is already in its superior oxidation state and, hence, it is less prone to activate the molecular oxygen in the first step of the process. The highest values of alcohol conversion and BPA yield were obtained with the solid containing only one of the divalent cations, namely HT-Ni2Al, probably due to its ability to activate the molecular oxygen, which was chemisorbed on Ni2+ sites yielding a peroxide type structure. Meanwhile, the benzyl alcohol was transformed into an aluminum alkoxide intermediate, which suffered a hydride abstraction by the neighboring peroxide on the nickel cation being further converted to benzaldehyde according to the mechanism described by Choudary et al. [7]. Notably, this solid also showed the tendency to form spherical aggregates, uniformly distributed, as indicated by the SEM results. The results in Table 4 also show that the catalytic performance of the MgNiCuAl LDH systems was higher for the samples containing lower amounts of Mg and Cu and higher amounts of Ni. Since there were only slight differences between their specific surface areas, this property could not explain the evolution of their catalytic performance. However, good correlations between, on the one hand, the conversion of benzyl alcohol and, on the other hand, the yield of BPA, and the Ni/Mg ratio in the MgNiCuAl LDH catalysts were observed (Fig. 7 ): the higher the Ni/Mg ratio, the higher the catalytic performance. On the other hand, the second step of the tandem reaction, i.e., the Knoevenagel condensation, is expected to be more affected by the acid-base properties of the solid catalysts [36]. Indeed, the yield of the target product (BPA) was shown to decrease with increasing the molar ratio of base-to-acid sites for the MgNiCuAl LDH catalysts (Fig. 8 ). The best BPA yield was observed for the HT-Mg0.8Ni0.8Cu0.4Al system which showed the lowest molar ratio of base-to-acid sites. As reported by Corma et al. [36], there is a cooperation between the acidic and the basic sites in the Knoevenagel condensation reactions of carbonyl compounds with active methylene groups via an ion‐pair mechanism, which consists of the deprotonation of the active methylene group by the basic sites of the catalyst, forming a carbanion. Meanwhile, the carbonyl of the benzaldehyde is activated by the acidic sites, a carbocation being generated. When the carbanion attacks the carbocation, the dehydration reaction takes place and the BPA product is formed. 6 Conclusion Multicationic MgNiCuAl LDH materials were successfully prepared by simple coprecipitation. The XRD studies showed that all the LDH samples had increased crystallinity and confirmed that no other impurities were present in the solids, except for that containing only copper and aluminum. DR-UV-VIS spectroscopy clearly indicated the existence of the octahedral geometry of the divalent transition-metal cations, Ni2+ and Cu2+. The SEM images demonstrated that the samples were not entirely homogenous. For the multicationic LDH samples containing both nickel and copper, irrespective to the nature of solvent used, the benzyl alcohol conversion and the BPA yield increased linearly with the nickel loading, which corresponds to a simple additive effect. In line with this, the NiAl-LDH (HT-Ni2Al) was the most active, while the CuAl LDH (HT-Cu2Al) was the least active system. Notably, HT-Ni2Al showed the largest crystalline domain sizes of the brucite-like layer. For the multicationic MgNiCuAl LDH catalysts, whatever solvent was used, the yield of the target product (BPA) decreased with increasing the molar ratio of base-to-acid sites. The best solvent in all catalytic reactions was benzene. Finally, it can unambiguously be sustained that all the studied LDH materials acted as bifunctional catalysts in the aerobic oxidation-condensation tandem reaction. Data availability statement The data presented in this study are available on request from the corresponding authors. CRediT authorship contribution statement Alexandra-Elisabeta Stamate: Conceptualization, Investigation, Visualization, Writing – original draft. Octavian Dumitru Pavel: Investigation, Project administration. Rodica Zăvoianu: Conceptualization, Investigation, Methodology, Supervision, Writing – review & editing. Ruxandra Bȋrjega: Formal analysis, Investigation. Katja Neubauer: Investigation. Angela Koeckritz: Conceptualization, Methodology, Methodology, Supervision, Writing – review & editing. Ioan-Cezar Marcu: Conceptualization, Methodology, Writing – review & editing, Supervision. Declaration of Competing Interest The authors declare that they have no known competing financial interests or personal relationships that could have appeared to influence the work reported in this paper. Acknowledgments The authors thank the funder, namely the German Academic Exchange Service (DAAD) (funding program No.: 57507442). Supplementary materials Supplementary material associated with this article can be found, in the online version, at doi:10.1016/j.mcat.2023.112968. Appendix Supplementary materials Image, application 1 References [1] C. Forano U. Costantino V. Prevota C.T. Gueho Developments in clay science F. Bergaya G. Lagaly Layered Double Hydroxides (LDH) 2013 Elsevier 745 782 10.1016/B978-0-08-098258-8.00025-0 C. Forano, U. Costantino, V. Prevota, C.T. Gueho, Layered Double Hydroxides (LDH), in: F. Bergaya, G. Lagaly (Eds.), Developments in clay science, Elsevier, 2013, pp. 745-782. 10.1016/B978-0-08-098258-8.00025-0 [2] A. Alejandre F. Medina X. Rodriguez P. Salagre Y. Cesteros J.E. Sueiras Cu/Ni/Al layered double hydroxides as precursors of catalysts for the wet air oxidation of phenol aqueous solutions Appl. Catal. B 30 2001 195 207 10.1016/S0926-3373(00)00233-2 A. Alejandre, F. Medina, X. Rodriguez, P. Salagre, Y. Cesteros, J.E. Sueiras, Cu/Ni/Al layered double hydroxides as precursors of catalysts for the wet air oxidation of phenol aqueous solutions, Appl. Catal. B 30 (2001) 195–207. 10.1016/S0926-3373(00)00233-2 [3] A.R. Sotiles M.T. Grassi M.P. Dos Santos F. Wypych Synthesis, characterization, and exchange reactions of layered double hydroxides of copper and aluminum, intercalated with sulfate J. Braz. Chem. Soc. 32 2021 170 181 10.21577/0103-5053.20200166 A.R. Sotiles, M.T. Grassi, M.P. Dos Santos, F. Wypych, Synthesis, characterization, and exchange reactions of layered double hydroxides of copper and aluminum, intercalated with sulfate, J. Braz. Chem. Soc. 32 (2021) 170-181. 10.21577/0103-5053.20200166 [4] F. Cavani F. Trifiro A. Vaccari Hydrotalcite-type anionic clays: Preparation, Properties and applications Catal. Today 11 1991 173 301 10.1016/0920-5861(91)80068-K F. Cavani, F. Trifiro, A. Vaccari, Hydrotalcite-type anionic clays: Preparation, Properties and applications, Catal. Today 11 (1991) 173-301. 10.1016/0920-5861(91)80068-K [5] G. Layrac S. Harrisson M. Destarac C. Gérardin D. Tichit Comprehensive study of the formation of stable colloids of Cu Al layered double hydroxides assisted by double hydrophilic block copolymers Appl. Clay Sci. 193 2020 105673 10.1016/j.clay.2020.105673 G. Layrac, S. Harrisson, M. Destarac, C. Gérardin, D. Tichit, Comprehensive study of the formation of stable colloids of Cu Al layered double hydroxides assisted by double hydrophilic block copolymers, Appl. Clay Sci. 193 (2020) 105673. 10.1016/j.clay.2020.105673 [6] T. Kawabata Y. Shinozuka Y. Ohishi T. Shishido K. Takaki K. Takehira Nickel containing Mg-Al hydrotalcite-type anionic clay catalyst for the oxidation of alcohols with molecular oxygen J. Mol. Catal. A Chem. 236 2005 206 215 10.1016/j.molcata.2005.04.035 T. Kawabata, Y. Shinozuka, Y. Ohishi, T. Shishido, K. Takaki, K. Takehira, Nickel containing Mg-Al hydrotalcite-type anionic clay catalyst for the oxidation of alcohols with molecular oxygen, J. Mol. Catal. A Chem. 236 (2005) 206–215. 10.1016/j.molcata.2005.04.035 [7] B.M. Choudary L.M. Kantam A. Rahman C.V. Reddy K.K. Rao The first example of activation of molecular oxygen by nickel in Ni-Al hydrotalcite: a novel protocol for the selective oxidation of alcohols Angew. Chem. Int. Ed. Engl. 40 2001 763 766 10.1002/1521-3773(20010216)40:4<763::AID-ANIE7630>3.0.CO;2-T B.M. Choudary, L.M. Kantam, A. Rahman, C.V. Reddy, K.K. Rao, The first example of activation of molecular oxygen by nickel in Ni-Al hydrotalcite: a novel protocol for the selective oxidation of alcohols, Angew. Chem. Int. Ed. Engl. 40 (2001) 763-766. 10.1002/1521-3773(20010216)40:4<763::AID-ANIE7630>3.0.CO;2-T [8] B. Vos E. Poels A. Bliek Impact of calcination conditions on the structure of alumina nickel particle J. Catal. 198 2001 77 88 10.1006/jcat.2000.3082 B. Vos, E. Poels, A. Bliek, Impact of calcination conditions on the structure of alumina nickel particle, J. Catal. 198 (2001) 77-88. 10.1006/jcat.2000.3082 [9] J. Rathouský G. Schulz-Ekloff J. Starek A. Zukal Supported nickel catalyst from hydroxycarbonate of nickel and aluminium Chem. Eng. Technol. 17 1994 41 46 10.1002/ceat.270170107 J. Rathouský, G. Schulz-Ekloff, J. Starek, A. Zukal, Supported nickel catalyst from hydroxycarbonate of nickel and aluminium, Chem. Eng. Technol. 17 (1994) 41-46. 10.1002/ceat.270170107 [10] D.S. Newsome The water-gas shift reaction Catal. Rev. Sci. Eng. 21 1980 275 318 10.1080/03602458008067535 D.S. Newsome, The water-gas shift reaction, Catal. Rev. Sci. Eng. 21 (1980) 275–318. 10.1080/03602458008067535 [11] E.M. Fuentes A. Da Costa Faro Júnior T. De Freitas Silva J.M. Assaf M. Do Carmo Rangel A comparison between copper and nickel-based catalysts obtained from hydrotalcite-like precursors for WGSR Catal. Today 171 2011 290 296 10.1016/j.cattod.2011.03.082 E.M. Fuentes, A. Da Costa Faro Júnior, T. De Freitas Silva, J.M. Assaf, M. Do Carmo Rangel, A comparison between copper and nickel-based catalysts obtained from hydrotalcite-like precursors for WGSR, Catal. Today 171 (2011) 290–296. 10.1016/j.cattod.2011.03.082 [12] M. Shokouhimehr S. Mahmoudi-Gom Yek M. Nasrollahzadeh A. Kim R.S. Varma Palladium nanocatalysts on hydroxyapatite: green oxidation of alcohols and reduction of nitroarenes in water Appl. Sci. 9 2019 4183 10.3390/app9194183 M. Shokouhimehr, S. Mahmoudi-Gom Yek, M. Nasrollahzadeh, A. Kim, R.S. Varma, Palladium nanocatalysts on hydroxyapatite: green oxidation of alcohols and reduction of nitroarenes in water, Appl. Sci. 9 (2019) 4183. 10.3390/app9194183 [13] H. Alamgholiloo S. Rostamnia K. Zhang T.H. Lee Y.S. Lee R.S. Varma H.W. Jang M. Shokouhimehr Boosting aerobic oxidation of alcohols via synergistic effect between TEMPO and a composite Fe3O4/Cu-BDC/GO nanocatalyst ACS Omega 5 2020 5182 5191 10.1021/acsomega.9b04209 H. Alamgholiloo, S. Rostamnia, K. Zhang, T. H. Lee, Y. S. Lee, R.S. Varma, H.W. Jang, M. Shokouhimehr, Boosting aerobic oxidation of alcohols via synergistic effect between TEMPO and a composite Fe3O4/Cu-BDC/GO nanocatalyst, ACS Omega 5 (2020) 5182-5191. 10.1021/acsomega.9b04209 [14] A.G. Moaser A. Ahadi S. Rouhani B.B. Mamba T.A.-M. Msagati S. Rostamnia T. Kavetskyy S. Dugheri S. Khaksar A. Hasanzadeh M. Shokouhimehr Curbed of molybdenum oxido-diperoxido complex on ionic liquid body of mesoporous Bipy-PMO-IL as a promising catalyst for selective sulfide oxidation J. Mol. Liq. 312 2020 113388 10.1016/j.molliq.2020.113388 A. G. Moaser, A. Ahadi, S. Rouhani, B.B. Mamba, T. A.-M. Msagati, S. Rostamnia, T. Kavetskyy, S. Dugheri, S. Khaksar, A. Hasanzadeh, M. Shokouhimehr, Curbed of molybdenum oxido-diperoxido complex on ionic liquid body of mesoporous Bipy-PMO-IL as a promising catalyst for selective sulfide oxidation, J. Mol. Liq. 312 (2020) 113388. 10.1016/j.molliq.2020.113388 [15] T. Li W. Zhang W. Chen H.N. Miras Y.-F. Song Layered double hydroxides anchored ionic liquids as amphiphilic heterogeneous catalysts for Knoevenagel condensation reaction Dalton Trans. 47 2018 3059 3067 10.1039/C7DT03665E T. Li, W. Zhang, W. Chen, H.N. Miras, Y.-F. Song, Layered double hydroxides anchored ionic liquids as amphiphilic heterogeneous catalysts for Knoevenagel condensation reaction, Dalton Trans. 47 (2018) 3059-3067. 10.1039/C7DT03665E [16] M. Shirotori S. Nishimura K. Ebitani Fine-crystallized LDHs prepared with SiO2 spheres as highly active solid base catalysts J. Mater. Chem. A 5 2017 6947 6957 10.1039/C7TA00984D M. Shirotori, S. Nishimura, K. Ebitani, Fine-crystallized LDHs prepared with SiO2 spheres as highly active solid base catalysts, J. Mater. Chem. A 5 (2017) 6947-6957. 10.1039/C7TA00984D [17] A. Ahadi H. Alamgholiloo S. Rostamnia X. Liu M. Shokouhimehr D.A. Alonso R. Luque Layer-wise titania growth within dimeric organic functional group viologen periodic mesoporous organosilica as efficient photocatalyst for oxidative formic acid decomposition ChemCatChem 11 2019 4803 4809 10.1002/cctc.201900486 A. Ahadi, H. Alamgholiloo, S. Rostamnia, X. Liu, M. Shokouhimehr, D.A. Alonso, R. Luque, Layer-wise titania growth within dimeric organic functional group viologen periodic mesoporous organosilica as efficient photocatalyst for oxidative formic acid decomposition, ChemCatChem 11 (2019) 4803–4809. 10.1002/cctc.201900486 [18] H. Alamgholiloo N.N. Pesyan R. Mohammadi S. Rostamnia M. Shokouhimehr Synergistic advanced oxidation process for the fast degradation of ciprofloxacin antibiotics using a GO/CuMOF-magnetic ternary nanocomposite J. Environ. Chem. Eng. 9 2021 10548 10.1016/j.jece.2021.105486 H. Alamgholiloo, N.N. Pesyan, R. Mohammadi, S. Rostamnia, M. Shokouhimehr, Synergistic advanced oxidation process for the fast degradation of ciprofloxacin antibiotics using a GO/CuMOF-magnetic ternary nanocomposite, J. Environ. Chem. Eng. 9 (2021) 10548. 10.1016/j.jece.2021.105486 [19] F. Cavani Catalytic selective oxidation: the forefront in the challenge for a more sustainable chemical industry Catal. Today 157 2010 8 15 10.1016/j.cattod.2010.02.072 F. Cavani, Catalytic selective oxidation: the forefront in the challenge for a more sustainable chemical industry. Catal. Today 157 (2010) 8-15. 10.1016/j.cattod.2010.02.072 [20] O.D.Pavel A.-E.Stamate R. Zavoianu I. Brezestean A. Ciorita R. Birjega K. Neubauer A. Koeckritz I.-C. Marcu Ce-containing MgAl-layered double hydroxide-graphene oxide hybrid materials as multifunctional catalysts for organic transformations Materials 14 2021 7457 10.3390/ma14237457 A.-E.Stamate, O.D. Pavel, R. Zavoianu, I. Brezestean, A. Ciorita, R. Birjega, K. Neubauer, A. Koeckritz, I.-C. Marcu, Ce-containing MgAl-layered double hydroxide-graphene oxide hybrid materials as multifunctional catalysts for organic transformations, Materials 14 (2021) 7457. 10.3390/ma14237457 [21] W. Zhou S. Zhai J. Pan A. Cui J. Qian M. He Z. Xu Q. Chen Bifunctional NiGa layered double hydroxide for the aerobic oxidation/condensation tandem reaction between aromatic alcohols and active methylene compounds Asian J. Org. Chem. 6 2017 1536 1541 10.1002/ajoc.201700352 W. Zhou, S. Zhai, J. Pan, A. Cui, J. Qian, M. He, Z. Xu, Q. Chen, Bifunctional NiGa layered double hydroxide for the aerobic oxidation/condensation tandem reaction between aromatic alcohols and active methylene compounds, Asian J. Org. Chem. 6 (2017) 1536–1541. 10.1002/ajoc.201700352 [22] R. Ciriminna V. Pandarus F. Béland Y.J. Xu M. Pagliaro Heterogeneously catalyzed alcohol oxidation for the fine chemical industry Org. Process Res. Dev. 19 2015 1554 1558 10.1021/acs.oprd.5b00204 R. Ciriminna, V. Pandarus, F. Béland, Y.J. Xu, M. Pagliaro, Heterogeneously catalyzed alcohol oxidation for the fine chemical industry, Org. Process Res. Dev. 19 (2015), 1554–1558. 10.1021/acs.oprd.5b00204 [23] L. Pauling The nature of the chemical bond. IV. The energy of single bonds and the relative electronegativity of atoms J. Am. Chem. Soc. 54 1932 3570 3582 10.1021/ja01348a011 L. Pauling, The nature of the chemical bond. IV. The energy of single bonds and the relative electronegativity of atoms, J. Am. Chem. Soc. 54 (1932) 3570–3582. 10.1021/ja01348a011 [24] R.D. Shannon Revised effective ionic radii and systematic studies of interatomic distances in halides and chalcogenides Acta Cryst. A32 1976 751 767 10.1107/S0567739476001551 R.D. Shannon, Revised effective ionic radii and systematic studies of interatomic distances in halides and chalcogenides, Acta Cryst. A32 (1976) 751-767. 10.1107/S0567739476001551 [25] K.S.W. Sing D.H. Everett R.A.W. Haul L. Moscou R.A. Pierotti J. Rouquerol T. Siemieniewska Reporting physisorption data for gas/solid systems with special reference to the determination of surface area and porosity Pure Appl. Chem. 57 1985 603 619 10.1351/pac198557040603 K.S.W. Sing, D.H. Everett, R.A.W. Haul, L. Moscou, R.A. Pierotti, J. Rouquerol, T. Siemieniewska, Reporting physisorption data for gas/solid systems with special reference to the determination of surface area and porosity, Pure Appl. Chem. 57 (1985) 603–619. 10.1351/pac198557040603 [26] Z. Wang X. Jiang M. Pan Y. Shi Nano-scale pore structure and its multi-fractal characteristics of tight sandstone by N2 adsorption/desorption analyses: a case study of shihezi formation from the sulige gas filed, Ordos Basin, China Minerals 10 2020 377 10.3390/min10040377 Z. Wang, X. Jiang, M. Pan, Y. Shi, Nano-scale pore structure and its multi-fractal characteristics of tight sandstone by N2 adsorption/desorption analyses: a case study of shihezi formation from the sulige gas filed, Ordos Basin, China, Minerals 10 (2020) 377. 10.3390/min10040377 [27] M. Thommes K. Kaneko A.V. Neimark J.P. Olivier F. Rodriguez-Reinoso J. Rouquerol K.S.W. Sing Physisorption of gases, with special reference to the evaluation of surface area and pore size distribution (IUPAC Technical Report) Pure Appl. Chem. 87 2015 1051 1069 10.1515/pac-2014-1117 M. Thommes, K. Kaneko, A.V. Neimark, J.P. Olivier, F. Rodriguez-Reinoso, J. Rouquerol, K.S.W. Sing, Physisorption of gases, with special reference to the evaluation of surface area and pore size distribution (IUPAC Technical Report), Pure Appl. Chem. 87 (2015) 1051–1069. 10.1515/pac-2014-1117 [28] K. Klemkaite I. Prosyceva R. Taraskevicius A. Khinsky A. Aivaras Kareiva Synthesis and characterization of layered double hydroxides with different cations (Mg, Co, Ni, Al), decomposition and reformation of mixed metal oxides to layered structures Cent. Eur. J. Chem. 9 2011 275 282 10.2478/s11532-011-0007-9 K. Klemkaite, I. Prosyceva, R. Taraskevicius, A. Khinsky, A. Aivaras Kareiva, Synthesis and characterization of layered double hydroxides with different cations (Mg, Co, Ni, Al), decomposition and reformation of mixed metal oxides to layered structures, Cent. Eur. J. Chem. 9 (2011) 275-282. 10.2478/s11532-011-0007-9 [29] B.R. Gevers S. Naseem A. Leuteritz F.J.W.J. Labuschagne Comparison of nano-structured transition metal modified tri-metal MgMAl–LDHs (M=Fe, Zn, Cu,Ni, Co) prepared using co-precipitation RSC Adv. 9 2019 28262 10.1039/C9RA05452A B.R. Gevers, S. Naseem, A. Leuteritz, F.J.W.J. Labuschagne, Comparison of nano-structured transition metal modified tri-metal MgMAl–LDHs (M=Fe, Zn, Cu,Ni, Co) prepared using co-precipitation, RSC Adv. 9 (2019) 28262. 10.1039/C9RA05452A [30] L.N. Stepanova O.B. Belskaya N.N. Leonteva E.O. Kobzar A.N. Salanov T.I. Gulyaeva M.V. Trenikhin V.A. Likholobov Study of the properties of the catalysts based on Ni(Mg)Al-layered hydroxides for the reaction of furfural hydrogenation Mater. Chem. Phys. 263 2021 124091 10.1016/j.matchemphys.2020.124091 L.N. Stepanova, O.B. Belskaya, N.N. Leonteva, E.O. Kobzar, A.N. Salanov, T.I. Gulyaeva, M.V. Trenikhin, V.A. Likholobov, Study of the properties of the catalysts based on Ni(Mg)Al-layered hydroxides for the reaction of furfural hydrogenation, Mater. Chem. Phys. 263 (2021) 124091. 10.1016/j.matchemphys.2020.124091 [31] C. Vaysse L. Guerlou-Demourgues A. Demourgues F. Lazartigues D. Fertier C. Delmas New (Ni, Co)-based layered double hydroxides with intercalated oxometallate (Mo, W) species, obtained by chimie douce reactions J. Mater. Chem. 12 2002 1035 1043 10.1039/B107791K C. Vaysse, L. Guerlou-Demourgues, A. Demourgues, F. Lazartigues, D. Fertier, C., Delmas, New (Ni, Co)-based layered double hydroxides with intercalated oxometallate (Mo, W) species, obtained by chimie douce reactions, J. Mater. Chem. 12 (2002) 1035-1043. 10.1039/B107791K [32] D.G. Evans R.C.T. Slade Structural aspects of layered double hydroxides Struct. Bond 119 2006 1 87 10.1007/430_005 D.G. Evans, R.C.T. Slade, Structural aspects of layered double hydroxides, Struct. Bond. 119 (2006) 1-87. 10.1007/430_005 [33] V. Rives S. Kannan Layered double hydroxides with the hydrotalcite-type structure containing Cu2+, Ni2+ and Al3+ J. Mater. Chem. 10 2000 489 495 10.1039/A908534C V. Rives, S. Kannan, Layered double hydroxides with the hydrotalcite-type structure containing Cu2+, Ni2+ and Al3+, J. Mater. Chem. 10 (2000) 489-495. 10.1039/A908534C [34] J. Wang T. Zhang K. Li Y. Cao Y. Zeng Dehydrogenation catalysts for synthesis of O-phenylphenol via Cu/Ni/Mg/Al hydrotalcite-like compounds as precursors Catalysts 8 2018 186 10.3390/catal8050186 J. Wang, T. Zhang, K. Li, Y. Cao, Y. Zeng, Dehydrogenation catalysts for synthesis of O-phenylphenol via Cu/Ni/Mg/Al hydrotalcite-like compounds as precursors, Catalysts 8 (2018) 186. 10.3390/catal8050186 [35] A. Mittasch W. Frankenburg Early studies of multicomponent catalysts Adv. Catal. 2 1950 81 104 10.1016/S0360-0564(08)60375-2 A. Mittasch, W. Frankenburg, Early studies of multicomponent catalysts, Adv. Catal. 2 (1950) 81-104. 10.1016/S0360-0564(08)60375-2 [36] A. Corma V. Fornés R.M. Martín-Aranda H. García J. Primo Zeolites as base catalysts: condensation of aldehydes with derivatives of malonic esters Appl. Catal. 59 1990 237 248 10.1016/S0166-9834(00)82201-0 A. Corma, V. Fornés, R. M. Martín-Aranda, H. García, J. Primo, Zeolites as base catalysts: condensation of aldehydes with derivatives of malonic esters, Appl. Catal. 59 (1990) 237-248. 10.1016/S0166-9834(00)82201-0",
      "scopus-id": "85147204794",
      "coredata": {
        "eid": "1-s2.0-S246882312300055X",
        "dc:description": "In this work, the structural and bifunctional catalytic properties of MgNi(Cu)Al layered double hydroxides (LDH) with different molar ratios between the cations were studied. The LDH materials were prepared by co-precipitation and were characterized using X-ray fluorescence (XRF), X-Ray diffraction (XRD), diffuse reflectance infrared Fourier-transform spectroscopy (DRIFT), diffuse reflectance ultraviolet-visible spectroscopy (DR-UV-VIS), scanning electron microscopy (SEM), nitrogen adsorption-desorption and acidity-basicity measurements. They were tested in a one-pot cascade oxidation-Knoevenagel condensation reaction used to synthesize 2-Benzoyl-3-phenylprop-2-enenitrile also known as 2-Benzoyl-3-phenylacrylonitrile (BPA). This involved the benzyl alcohol (BnOH) oxidation under an oxygen atmosphere followed by the Knoevenagel condensation of benzaldehyde with 3-oxo-3-phenylpropanenitrile also known as benzoyl acetonitrile (BzACN). Three different non-polar solvents, i.e., toluene, benzene and 1,3,5-trimethylbenzene (mesitylene), were used as reaction media. For the LDH catalysts containing both nickel and copper, the alcohol conversion and BPA yield increased with Ni/Cu molar ratio. The acid-base properties of the solids and the nature of the solvent strongly influence the reaction performance.",
        "openArchiveArticle": "false",
        "prism:coverDate": "2023-02-15",
        "openaccessUserLicense": null,
        "prism:aggregationType": "Journal",
        "prism:url": "https://api.elsevier.com/content/article/pii/S246882312300055X",
        "dc:creator": [
          {
            "@_fa": "true",
            "$": "Stamate, Alexandra-Elisabeta"
          },
          {
            "@_fa": "true",
            "$": "Pavel, Octavian Dumitru"
          },
          {
            "@_fa": "true",
            "$": "Zăvoianu, Rodica"
          },
          {
            "@_fa": "true",
            "$": "Bȋrjega, Ruxandra"
          },
          {
            "@_fa": "true",
            "$": "Neubauer, Katja"
          },
          {
            "@_fa": "true",
            "$": "Koeckritz, Angela"
          },
          {
            "@_fa": "true",
            "$": "Marcu, Ioan-Cezar"
          }
        ],
        "link": [
          {
            "@_fa": "true",
            "@rel": "self",
            "@href": "https://api.elsevier.com/content/article/pii/S246882312300055X"
          },
          {
            "@_fa": "true",
            "@rel": "scidir",
            "@href": "https://www.sciencedirect.com/science/article/pii/S246882312300055X"
          }
        ],
        "dc:format": "application/json",
        "openaccessType": null,
        "pii": "S2468-8231(23)00055-X",
        "prism:volume": "537",
        "articleNumber": "112968",
        "prism:publisher": "Elsevier B.V.",
        "dc:title": "Study of the catalytic properties of MgNi(Cu)Al LDH in the one-pot cascade oxidation-Knoevenagel condensation reaction",
        "prism:copyright": "© 2023 Elsevier B.V. All rights reserved.",
        "openaccess": "0",
        "prism:issn": "24688231",
        "dcterms:subject": [
          {
            "@_fa": "true",
            "$": "Multicationic layered double hydroxides"
          },
          {
            "@_fa": "true",
            "$": "Tandem reaction"
          },
          {
            "@_fa": "true",
            "$": "Oxidation"
          },
          {
            "@_fa": "true",
            "$": "Knoevenagel condensation"
          },
          {
            "@_fa": "true",
            "$": "Benzyl alcohol"
          }
        ],
        "openaccessArticle": "false",
        "prism:publicationName": "Molecular Catalysis",
        "openaccessSponsorType": null,
        "prism:pageRange": "112968",
        "pubType": "fla",
        "prism:coverDisplayDate": "15 February 2023",
        "prism:doi": "10.1016/j.mcat.2023.112968",
        "prism:startingPage": "112968",
        "dc:identifier": "doi:10.1016/j.mcat.2023.112968",
        "openaccessSponsorName": null
      },
      "objects": {
        "object": [
          {
            "@category": "standard",
            "@height": "1073",
            "@width": "688",
            "@_fa": "true",
            "$": "https://api.elsevier.com/content/object/eid/1-s2.0-S246882312300055X-gr1.jpg?httpAccept=%2A%2F%2A",
            "@multimediatype": "JPEG image file",
            "@type": "IMAGE-DOWNSAMPLED",
            "@size": "157684",
            "@ref": "gr1",
            "@mimetype": "image/jpeg"
          },
          {
            "@category": "standard",
            "@height": "345",
            "@width": "376",
            "@_fa": "true",
            "$": "https://api.elsevier.com/content/object/eid/1-s2.0-S246882312300055X-gr2.jpg?httpAccept=%2A%2F%2A",
            "@multimediatype": "JPEG image file",
            "@type": "IMAGE-DOWNSAMPLED",
            "@size": "54138",
            "@ref": "gr2",
            "@mimetype": "image/jpeg"
          },
          {
            "@category": "standard",
            "@height": "200",
            "@width": "408",
            "@_fa": "true",
            "$": "https://api.elsevier.com/content/object/eid/1-s2.0-S246882312300055X-ga1.jpg?httpAccept=%2A%2F%2A",
            "@multimediatype": "JPEG image file",
            "@type": "IMAGE-DOWNSAMPLED",
            "@size": "27264",
            "@ref": "ga1",
            "@mimetype": "image/jpeg"
          },
          {
            "@category": "standard",
            "@height": "517",
            "@width": "376",
            "@_fa": "true",
            "$": "https://api.elsevier.com/content/object/eid/1-s2.0-S246882312300055X-gr3.jpg?httpAccept=%2A%2F%2A",
            "@multimediatype": "JPEG image file",
            "@type": "IMAGE-DOWNSAMPLED",
            "@size": "90347",
            "@ref": "gr3",
            "@mimetype": "image/jpeg"
          },
          {
            "@category": "standard",
            "@height": "639",
            "@width": "376",
            "@_fa": "true",
            "$": "https://api.elsevier.com/content/object/eid/1-s2.0-S246882312300055X-gr4.jpg?httpAccept=%2A%2F%2A",
            "@multimediatype": "JPEG image file",
            "@type": "IMAGE-DOWNSAMPLED",
            "@size": "84004",
            "@ref": "gr4",
            "@mimetype": "image/jpeg"
          },
          {
            "@category": "standard",
            "@height": "231",
            "@width": "737",
            "@_fa": "true",
            "$": "https://api.elsevier.com/content/object/eid/1-s2.0-S246882312300055X-sc1.jpg?httpAccept=%2A%2F%2A",
            "@multimediatype": "JPEG image file",
            "@type": "IMAGE-DOWNSAMPLED",
            "@size": "25599",
            "@ref": "sc1",
            "@mimetype": "image/jpeg"
          },
          {
            "@category": "standard",
            "@height": "906",
            "@width": "565",
            "@_fa": "true",
            "$": "https://api.elsevier.com/content/object/eid/1-s2.0-S246882312300055X-gr5.jpg?httpAccept=%2A%2F%2A",
            "@multimediatype": "JPEG image file",
            "@type": "IMAGE-DOWNSAMPLED",
            "@size": "196506",
            "@ref": "gr5",
            "@mimetype": "image/jpeg"
          },
          {
            "@category": "standard",
            "@height": "651",
            "@width": "376",
            "@_fa": "true",
            "$": "https://api.elsevier.com/content/object/eid/1-s2.0-S246882312300055X-gr6.jpg?httpAccept=%2A%2F%2A",
            "@multimediatype": "JPEG image file",
            "@type": "IMAGE-DOWNSAMPLED",
            "@size": "44072",
            "@ref": "gr6",
            "@mimetype": "image/jpeg"
          },
          {
            "@category": "standard",
            "@height": "278",
            "@width": "565",
            "@_fa": "true",
            "$": "https://api.elsevier.com/content/object/eid/1-s2.0-S246882312300055X-gr7.jpg?httpAccept=%2A%2F%2A",
            "@multimediatype": "JPEG image file",
            "@type": "IMAGE-DOWNSAMPLED",
            "@size": "39721",
            "@ref": "gr7",
            "@mimetype": "image/jpeg"
          },
          {
            "@category": "standard",
            "@height": "351",
            "@width": "376",
            "@_fa": "true",
            "$": "https://api.elsevier.com/content/object/eid/1-s2.0-S246882312300055X-gr8.jpg?httpAccept=%2A%2F%2A",
            "@multimediatype": "JPEG image file",
            "@type": "IMAGE-DOWNSAMPLED",
            "@size": "32588",
            "@ref": "gr8",
            "@mimetype": "image/jpeg"
          },
          {
            "@category": "thumbnail",
            "@height": "164",
            "@width": "105",
            "@_fa": "true",
            "$": "https://api.elsevier.com/content/object/eid/1-s2.0-S246882312300055X-gr1.sml?httpAccept=%2A%2F%2A",
            "@multimediatype": "GIF image file",
            "@type": "IMAGE-THUMBNAIL",
            "@size": "7997",
            "@ref": "gr1",
            "@mimetype": "image/gif"
          },
          {
            "@category": "thumbnail",
            "@height": "164",
            "@width": "179",
            "@_fa": "true",
            "$": "https://api.elsevier.com/content/object/eid/1-s2.0-S246882312300055X-gr2.sml?httpAccept=%2A%2F%2A",
            "@multimediatype": "GIF image file",
            "@type": "IMAGE-THUMBNAIL",
            "@size": "12193",
            "@ref": "gr2",
            "@mimetype": "image/gif"
          },
          {
            "@category": "thumbnail",
            "@height": "107",
            "@width": "219",
            "@_fa": "true",
            "$": "https://api.elsevier.com/content/object/eid/1-s2.0-S246882312300055X-ga1.sml?httpAccept=%2A%2F%2A",
            "@multimediatype": "GIF image file",
            "@type": "IMAGE-THUMBNAIL",
            "@size": "9137",
            "@ref": "ga1",
            "@mimetype": "image/gif"
          },
          {
            "@category": "thumbnail",
            "@height": "164",
            "@width": "119",
            "@_fa": "true",
            "$": "https://api.elsevier.com/content/object/eid/1-s2.0-S246882312300055X-gr3.sml?httpAccept=%2A%2F%2A",
            "@multimediatype": "GIF image file",
            "@type": "IMAGE-THUMBNAIL",
            "@size": "11435",
            "@ref": "gr3",
            "@mimetype": "image/gif"
          },
          {
            "@category": "thumbnail",
            "@height": "163",
            "@width": "96",
            "@_fa": "true",
            "$": "https://api.elsevier.com/content/object/eid/1-s2.0-S246882312300055X-gr4.sml?httpAccept=%2A%2F%2A",
            "@multimediatype": "GIF image file",
            "@type": "IMAGE-THUMBNAIL",
            "@size": "8599",
            "@ref": "gr4",
            "@mimetype": "image/gif"
          },
          {
            "@category": "thumbnail",
            "@height": "69",
            "@width": "219",
            "@_fa": "true",
            "$": "https://api.elsevier.com/content/object/eid/1-s2.0-S246882312300055X-sc1.sml?httpAccept=%2A%2F%2A",
            "@multimediatype": "GIF image file",
            "@type": "IMAGE-THUMBNAIL",
            "@size": "5216",
            "@ref": "sc1",
            "@mimetype": "image/gif"
          },
          {
            "@category": "thumbnail",
            "@height": "164",
            "@width": "102",
            "@_fa": "true",
            "$": "https://api.elsevier.com/content/object/eid/1-s2.0-S246882312300055X-gr5.sml?httpAccept=%2A%2F%2A",
            "@multimediatype": "GIF image file",
            "@type": "IMAGE-THUMBNAIL",
            "@size": "11504",
            "@ref": "gr5",
            "@mimetype": "image/gif"
          },
          {
            "@category": "thumbnail",
            "@height": "163",
            "@width": "94",
            "@_fa": "true",
            "$": "https://api.elsevier.com/content/object/eid/1-s2.0-S246882312300055X-gr6.sml?httpAccept=%2A%2F%2A",
            "@multimediatype": "GIF image file",
            "@type": "IMAGE-THUMBNAIL",
            "@size": "5146",
            "@ref": "gr6",
            "@mimetype": "image/gif"
          },
          {
            "@category": "thumbnail",
            "@height": "108",
            "@width": "219",
            "@_fa": "true",
            "$": "https://api.elsevier.com/content/object/eid/1-s2.0-S246882312300055X-gr7.sml?httpAccept=%2A%2F%2A",
            "@multimediatype": "GIF image file",
            "@type": "IMAGE-THUMBNAIL",
            "@size": "7482",
            "@ref": "gr7",
            "@mimetype": "image/gif"
          },
          {
            "@category": "thumbnail",
            "@height": "163",
            "@width": "175",
            "@_fa": "true",
            "$": "https://api.elsevier.com/content/object/eid/1-s2.0-S246882312300055X-gr8.sml?httpAccept=%2A%2F%2A",
            "@multimediatype": "GIF image file",
            "@type": "IMAGE-THUMBNAIL",
            "@size": "7681",
            "@ref": "gr8",
            "@mimetype": "image/gif"
          },
          {
            "@category": "high",
            "@height": "4750",
            "@width": "3047",
            "@_fa": "true",
            "$": "https://api.elsevier.com/content/object/eid/1-s2.0-S246882312300055X-gr1_lrg.jpg?httpAccept=%2A%2F%2A",
            "@multimediatype": "JPEG image file",
            "@type": "IMAGE-HIGH-RES",
            "@size": "970446",
            "@ref": "gr1",
            "@mimetype": "image/jpeg"
          },
          {
            "@category": "high",
            "@height": "1528",
            "@width": "1667",
            "@_fa": "true",
            "$": "https://api.elsevier.com/content/object/eid/1-s2.0-S246882312300055X-gr2_lrg.jpg?httpAccept=%2A%2F%2A",
            "@multimediatype": "JPEG image file",
            "@type": "IMAGE-HIGH-RES",
            "@size": "409515",
            "@ref": "gr2",
            "@mimetype": "image/jpeg"
          },
          {
            "@category": "high",
            "@height": "886",
            "@width": "1807",
            "@_fa": "true",
            "$": "https://api.elsevier.com/content/object/eid/1-s2.0-S246882312300055X-ga1_lrg.jpg?httpAccept=%2A%2F%2A",
            "@multimediatype": "JPEG image file",
            "@type": "IMAGE-HIGH-RES",
            "@size": "256167",
            "@ref": "ga1",
            "@mimetype": "image/jpeg"
          },
          {
            "@category": "high",
            "@height": "2294",
            "@width": "1667",
            "@_fa": "true",
            "$": "https://api.elsevier.com/content/object/eid/1-s2.0-S246882312300055X-gr3_lrg.jpg?httpAccept=%2A%2F%2A",
            "@multimediatype": "JPEG image file",
            "@type": "IMAGE-HIGH-RES",
            "@size": "655118",
            "@ref": "gr3",
            "@mimetype": "image/jpeg"
          },
          {
            "@category": "high",
            "@height": "2835",
            "@width": "1667",
            "@_fa": "true",
            "$": "https://api.elsevier.com/content/object/eid/1-s2.0-S246882312300055X-gr4_lrg.jpg?httpAccept=%2A%2F%2A",
            "@multimediatype": "JPEG image file",
            "@type": "IMAGE-HIGH-RES",
            "@size": "640786",
            "@ref": "gr4",
            "@mimetype": "image/jpeg"
          },
          {
            "@category": "high",
            "@height": "1024",
            "@width": "3264",
            "@_fa": "true",
            "$": "https://api.elsevier.com/content/object/eid/1-s2.0-S246882312300055X-sc1_lrg.jpg?httpAccept=%2A%2F%2A",
            "@multimediatype": "JPEG image file",
            "@type": "IMAGE-HIGH-RES",
            "@size": "173597",
            "@ref": "sc1",
            "@mimetype": "image/jpeg"
          },
          {
            "@category": "high",
            "@height": "4010",
            "@width": "2500",
            "@_fa": "true",
            "$": "https://api.elsevier.com/content/object/eid/1-s2.0-S246882312300055X-gr5_lrg.jpg?httpAccept=%2A%2F%2A",
            "@multimediatype": "JPEG image file",
            "@type": "IMAGE-HIGH-RES",
            "@size": "1550361",
            "@ref": "gr5",
            "@mimetype": "image/jpeg"
          },
          {
            "@category": "high",
            "@height": "2887",
            "@width": "1667",
            "@_fa": "true",
            "$": "https://api.elsevier.com/content/object/eid/1-s2.0-S246882312300055X-gr6_lrg.jpg?httpAccept=%2A%2F%2A",
            "@multimediatype": "JPEG image file",
            "@type": "IMAGE-HIGH-RES",
            "@size": "235372",
            "@ref": "gr6",
            "@mimetype": "image/jpeg"
          },
          {
            "@category": "high",
            "@height": "1230",
            "@width": "2500",
            "@_fa": "true",
            "$": "https://api.elsevier.com/content/object/eid/1-s2.0-S246882312300055X-gr7_lrg.jpg?httpAccept=%2A%2F%2A",
            "@multimediatype": "JPEG image file",
            "@type": "IMAGE-HIGH-RES",
            "@size": "207426",
            "@ref": "gr7",
            "@mimetype": "image/jpeg"
          },
          {
            "@category": "high",
            "@height": "1556",
            "@width": "1667",
            "@_fa": "true",
            "$": "https://api.elsevier.com/content/object/eid/1-s2.0-S246882312300055X-gr8_lrg.jpg?httpAccept=%2A%2F%2A",
            "@multimediatype": "JPEG image file",
            "@type": "IMAGE-HIGH-RES",
            "@size": "160450",
            "@ref": "gr8",
            "@mimetype": "image/jpeg"
          },
          {
            "@category": "standard",
            "@_fa": "true",
            "$": "https://api.elsevier.com/content/object/eid/1-s2.0-S246882312300055X-mmc1.pdf?httpAccept=%2A%2F%2A",
            "@multimediatype": "Acrobat PDF file",
            "@type": "APPLICATION",
            "@size": "637015",
            "@ref": "mmc1",
            "@mimetype": "application/pdf"
          },
          {
            "@category": "thumbnail",
            "@_fa": "true",
            "$": "https://api.elsevier.com/content/object/eid/1-s2.0-S246882312300055X-si1.svg?httpAccept=%2A%2F%2A",
            "@multimediatype": "Scalable Vector Graphics file",
            "@type": "ALTIMG",
            "@size": "10867",
            "@ref": "si1",
            "@mimetype": "image/svg+xml"
          },
          {
            "@category": "thumbnail",
            "@_fa": "true",
            "$": "https://api.elsevier.com/content/object/eid/1-s2.0-S246882312300055X-si2.svg?httpAccept=%2A%2F%2A",
            "@multimediatype": "Scalable Vector Graphics file",
            "@type": "ALTIMG",
            "@size": "4294",
            "@ref": "si2",
            "@mimetype": "image/svg+xml"
          },
          {
            "@category": "thumbnail",
            "@_fa": "true",
            "$": "https://api.elsevier.com/content/object/eid/1-s2.0-S246882312300055X-si3.svg?httpAccept=%2A%2F%2A",
            "@multimediatype": "Scalable Vector Graphics file",
            "@type": "ALTIMG",
            "@size": "3795",
            "@ref": "si3",
            "@mimetype": "image/svg+xml"
          },
          {
            "@category": "thumbnail",
            "@_fa": "true",
            "$": "https://api.elsevier.com/content/object/eid/1-s2.0-S246882312300055X-si4.svg?httpAccept=%2A%2F%2A",
            "@multimediatype": "Scalable Vector Graphics file",
            "@type": "ALTIMG",
            "@size": "15378",
            "@ref": "si4",
            "@mimetype": "image/svg+xml"
          },
          {
            "@category": "thumbnail",
            "@_fa": "true",
            "$": "https://api.elsevier.com/content/object/eid/1-s2.0-S246882312300055X-si5.svg?httpAccept=%2A%2F%2A",
            "@multimediatype": "Scalable Vector Graphics file",
            "@type": "ALTIMG",
            "@size": "3719",
            "@ref": "si5",
            "@mimetype": "image/svg+xml"
          },
          {
            "@category": "standard",
            "@_fa": "true",
            "$": "https://api.elsevier.com/content/object/eid/1-s2.0-S246882312300055X-am.pdf?httpAccept=%2A%2F%2A",
            "@multimediatype": "Acrobat PDF file",
            "@type": "AAM-PDF",
            "@size": "1554511",
            "@ref": "am",
            "@mimetype": "application/pdf"
          }
        ]
      },
      "link": {
        "@rel": "abstract",
        "@href": "https://api.elsevier.com/content/abstract/scopus_id/85147204794"
      }
    }
  }
}