{
  "metadata": {
    "title": "Highly dispersed and ultra-small Ru nanoparticles deposited on silica support as highly active and stable catalyst for biphenyl hydrogenation",
    "authors": "; ; ",
    "journal": "Molecular Catalysis",
    "date": "2021-05-31",
    "doi": "10.1016/j.mcat.2021.111577",
    "abstract": "",
    "uri": "https://api.elsevier.com/content/article/pii/S2468823121001942",
    "pii": "S2468823121001942"
  },
  "fulltext": {
    "full-text-retrieval-response": {
      "scopus-eid": "2-s2.0-85104911579",
      "originalText": "serial JL 315758 291210 291744 291790 291809 31 Molecular Catalysis MOLECULARCATALYSIS 2021-04-29 2021-04-29 2021-04-29 2021-04-29 2021-05-24T15:55:04 1-s2.0-S2468823121001942 S2468-8231(21)00194-2 S2468823121001942 10.1016/j.mcat.2021.111577 S300 S300.1 FULL-TEXT 1-s2.0-S2468823121X00089 2022-12-12T23:36:12.42485Z 0 0 20210501 20210531 2021 2021-04-29T10:06:18.750269Z absattachment articleinfo articlenumber articletitlenorm authfirstinitialnorm authfirstsurnamenorm cid cids contenttype copyright crossmark dateloaded dateloadedtxt datesearch datesort dateupdated dco docsubtype doctype doi eid ewtransactionid hubeid indexeddate issn issnnorm itemstage itemtransactionid itemweight openaccess openarchive pg pgfirst pii piinorm pubdateend pubdatestart pubdatetxt pubyr sectiontitle sortorder srctitle srctitlenorm srctype ssids alllist content subj subheadings suppl tomb volfirst volissue volumelist webpdf webpdfpagecount yearnav figure table e-component body mmlmath acknowledge affil appendices articletitle auth authfirstini authfull authkeywords authlast footnotes grantnumber grantsponsor grantsponsorid highlightsabst primabst ref specialabst 2468-8231 24688231 true 508 508 C Volume 508 3 111577 111577 111577 202105 May 2021 2021-05-01 2021-05-31 2021 Regular Papers article fla © 2021 Elsevier B.V. All rights reserved. HIGHLYDISPERSEDULTRASMALLRUNANOPARTICLESDEPOSITEDSILICASUPPORTHIGHLYACTIVESTABLECATALYSTFORBIPHENYLHYDROGENATION SU W 1 Introduction 2 Experimental 2.1 Chemical reagents 2.2 Catalyst preparation 2.2.1 Catalyst synthesis by SEA 2.2.2 Catalyst synthesis by DI 2.3 Catalyst characterization 2.4 Catalyst testing 3 Results and discussion 3.1 Physicochemical properties 3.2 Catalytic performance 3.3 DFT calculations 3.4 Reusability study 4 Conclusions CRediT authorship contribution statement Acknowledgements Appendix Supplementary materials References HAN 2019 113 121 D WANG 2020 2483 2493 C WANG 2019 18744 18752 H GONDA 2014 16339 16346 M NIERMANN 2019 290 307 M MODISHA 2019 2778 2796 P BOURANE 2016 23075 23091 A EYPASCH 2017 320 330 M TCICHMANN 2012 18118 18132 D AAKKOSAKSA 2018 803 823 P HODOSHIMA 2003 1255 1262 S GIANOTTI 2018 4660 4680 E KALENCHUK 2018 6191 6196 A KALENCHUK 2019 652 657 A PING 2016 3253 3259 H XIA 2017 905 912 Z ALHUMAIDAN 2011 4217 4234 F SHUKLA 2012 3350 3357 A SUTTISAWAT 2012 3242 3250 Y QI 2014 1833 1839 S MARKIEWICZ 2015 1035 1045 M JORSCHICK 2017 1652 1659 H HIYOSHI 2005 43 47 N ZHOU 2019 352 362 G ASLAN 2019 18903 18914 M ZHOU 2015 119 126 G PONGTHAWORNSAKUN 2017 1721 1734 B WONG 2017 1427 1430 A BO 2019 214703 Z SUN 2018 32 40 J LIU 2014 26431 26435 Q JIAO 2008 329 341 L JIAO 2008 342 350 L KOSMULSKI 2018 115 138 M SAMAD 2015 3460 3463 J SCHREIER 2004 203 212 M HAO 2003 259 264 X MA 2014 154 160 Y MA 2014 40 44 Y YANG 2020 110992 J ZHOU 2014 393 403 G ZHANG 2020 12967 12975 Y GAUR 2012 1989 1998 S DOU 2018 883 889 Y ABDELMAGEED 2020 118846 A LARICHEV 2008 14776 14780 Y LI 2017 566 577 D CHIN 2006 871 882 S GAJDOS 2004 1141 1164 M WANG 2020 9504 9514 X HIYOSHI 2005 43 47 N GAO 2019 118076 X JIANG 2019 7233 7243 Z ZHANG 2020 3185 Y ZHANG 2020 1 14 S SUX2021X111577 SUX2021X111577XW 2023-04-29T00:00:00.000Z 2023-04-29T00:00:00.000Z http://creativecommons.org/licenses/by-nc-nd/4.0/ © 2021 Elsevier B.V. All rights reserved. 2021-04-21T02:10:51.714Z http://vtw.elsevier.com/data/voc/AddOnTypes/50.7/eoas NSFC National Natural Science Foundation of China http://data.elsevier.com/vocabulary/SciValFunders/501100001809 http://sws.geonames.org/1814991 China Postdoctoral Science Foundation http://data.elsevier.com/vocabulary/SciValFunders/501100002858 http://sws.geonames.org/1814991 https://doi.org/10.15223/policy-017 https://doi.org/10.15223/policy-037 https://doi.org/10.15223/policy-012 https://doi.org/10.15223/policy-029 https://doi.org/10.15223/policy-004 item S2468-8231(21)00194-2 S2468823121001942 1-s2.0-S2468823121001942 10.1016/j.mcat.2021.111577 315758 2021-05-24T15:02:00.33609Z 2021-05-01 2021-05-31 1-s2.0-S2468823121001942-main.pdf https://s3-eu-west-1.amazonaws.com/prod-ucs-content-store-eu-west/content/pii:S2468823121001942/MAIN/application/pdf/36e5b929c33a154717546ff5d62d437b/main.pdf main.pdf pdf true 8645073 MAIN 9 1-s2.0-S2468823121001942-main_1.png https://s3-eu-west-1.amazonaws.com/prod-ucs-content-store-eu-west/content/pii:S2468823121001942/PREVIEW/image/png/2135e302d89b209f2f40826fbe5a114a/main_1.png main_1.png png 59070 849 656 IMAGE-WEB-PDF 1 1-s2.0-S2468823121001942-fx1.jpg https://s3-eu-west-1.amazonaws.com/prod-ucs-content-store-eu-west/content/pii:S2468823121001942/fx1/DOWNSAMPLED/image/jpeg/0436629ee940aab9ccb311b2f4f934e6/fx1.jpg fx1 true fx1.jpg jpg 25243 180 301 IMAGE-DOWNSAMPLED 1-s2.0-S2468823121001942-gr4.jpg https://s3-eu-west-1.amazonaws.com/prod-ucs-content-store-eu-west/content/pii:S2468823121001942/gr4/DOWNSAMPLED/image/jpeg/739b0764393d6c31008a233bf4c1a8c4/gr4.jpg gr4 gr4.jpg jpg 82615 286 602 IMAGE-DOWNSAMPLED 1-s2.0-S2468823121001942-gr3.jpg https://s3-eu-west-1.amazonaws.com/prod-ucs-content-store-eu-west/content/pii:S2468823121001942/gr3/DOWNSAMPLED/image/jpeg/d93b49d3a69f6f8135bde71a20403e90/gr3.jpg gr3 gr3.jpg jpg 111136 610 357 IMAGE-DOWNSAMPLED 1-s2.0-S2468823121001942-gr2.jpg https://s3-eu-west-1.amazonaws.com/prod-ucs-content-store-eu-west/content/pii:S2468823121001942/gr2/DOWNSAMPLED/image/jpeg/0ff8be759d51017b05b5aa90075e2791/gr2.jpg gr2 gr2.jpg jpg 172739 652 652 IMAGE-DOWNSAMPLED 1-s2.0-S2468823121001942-gr1.jpg https://s3-eu-west-1.amazonaws.com/prod-ucs-content-store-eu-west/content/pii:S2468823121001942/gr1/DOWNSAMPLED/image/jpeg/6dd19ef8639ea86ddaebd3d4c10e1e4f/gr1.jpg gr1 gr1.jpg jpg 44826 276 339 IMAGE-DOWNSAMPLED 1-s2.0-S2468823121001942-gr8.jpg https://s3-eu-west-1.amazonaws.com/prod-ucs-content-store-eu-west/content/pii:S2468823121001942/gr8/DOWNSAMPLED/image/jpeg/bef6931ea1e54da38311a9540dc0b344/gr8.jpg gr8 gr8.jpg jpg 32024 257 338 IMAGE-DOWNSAMPLED 1-s2.0-S2468823121001942-gr7.jpg https://s3-eu-west-1.amazonaws.com/prod-ucs-content-store-eu-west/content/pii:S2468823121001942/gr7/DOWNSAMPLED/image/jpeg/c17037950bd9dd5eb5c4df41c7e56b97/gr7.jpg gr7 gr7.jpg jpg 73904 229 602 IMAGE-DOWNSAMPLED 1-s2.0-S2468823121001942-gr6.jpg https://s3-eu-west-1.amazonaws.com/prod-ucs-content-store-eu-west/content/pii:S2468823121001942/gr6/DOWNSAMPLED/image/jpeg/dc2a1316866ac969e69ad11bf7265a7d/gr6.jpg gr6 gr6.jpg jpg 41134 209 602 IMAGE-DOWNSAMPLED 1-s2.0-S2468823121001942-gr5.jpg https://s3-eu-west-1.amazonaws.com/prod-ucs-content-store-eu-west/content/pii:S2468823121001942/gr5/DOWNSAMPLED/image/jpeg/4779ce2e8121afd69d1d8d09f7116d17/gr5.jpg gr5 gr5.jpg jpg 69186 426 602 IMAGE-DOWNSAMPLED 1-s2.0-S2468823121001942-fx1.sml https://s3-eu-west-1.amazonaws.com/prod-ucs-content-store-eu-west/content/pii:S2468823121001942/fx1/THUMBNAIL/image/gif/ee98ada340f28a783435cfaf7c4d70f7/fx1.sml fx1 true fx1.sml sml 18776 131 219 IMAGE-THUMBNAIL 1-s2.0-S2468823121001942-gr4.sml https://s3-eu-west-1.amazonaws.com/prod-ucs-content-store-eu-west/content/pii:S2468823121001942/gr4/THUMBNAIL/image/gif/2899feb8fb4a8747f73ff1c93d5477cc/gr4.sml gr4 gr4.sml sml 13582 104 219 IMAGE-THUMBNAIL 1-s2.0-S2468823121001942-gr3.sml https://s3-eu-west-1.amazonaws.com/prod-ucs-content-store-eu-west/content/pii:S2468823121001942/gr3/THUMBNAIL/image/gif/905fd99b0194120f9ea385bbdbdb641a/gr3.sml gr3 gr3.sml sml 13253 164 96 IMAGE-THUMBNAIL 1-s2.0-S2468823121001942-gr2.sml https://s3-eu-west-1.amazonaws.com/prod-ucs-content-store-eu-west/content/pii:S2468823121001942/gr2/THUMBNAIL/image/gif/41ea7eadf175bffdde18058d1cd356eb/gr2.sml gr2 gr2.sml sml 25964 164 164 IMAGE-THUMBNAIL 1-s2.0-S2468823121001942-gr1.sml https://s3-eu-west-1.amazonaws.com/prod-ucs-content-store-eu-west/content/pii:S2468823121001942/gr1/THUMBNAIL/image/gif/11f64e3783cf832a2e7da27976cc5950/gr1.sml gr1 gr1.sml sml 15062 164 201 IMAGE-THUMBNAIL 1-s2.0-S2468823121001942-gr8.sml https://s3-eu-west-1.amazonaws.com/prod-ucs-content-store-eu-west/content/pii:S2468823121001942/gr8/THUMBNAIL/image/gif/9ac42baf7189f00962c1b4a3ed0568be/gr8.sml gr8 gr8.sml sml 15809 164 215 IMAGE-THUMBNAIL 1-s2.0-S2468823121001942-gr7.sml https://s3-eu-west-1.amazonaws.com/prod-ucs-content-store-eu-west/content/pii:S2468823121001942/gr7/THUMBNAIL/image/gif/93c889b645f520a4ecf4bf4999c47d7f/gr7.sml gr7 gr7.sml sml 13825 83 219 IMAGE-THUMBNAIL 1-s2.0-S2468823121001942-gr6.sml https://s3-eu-west-1.amazonaws.com/prod-ucs-content-store-eu-west/content/pii:S2468823121001942/gr6/THUMBNAIL/image/gif/2bc7ad66be96dba1ca80afcfb32d2640/gr6.sml gr6 gr6.sml sml 8960 76 219 IMAGE-THUMBNAIL 1-s2.0-S2468823121001942-gr5.sml https://s3-eu-west-1.amazonaws.com/prod-ucs-content-store-eu-west/content/pii:S2468823121001942/gr5/THUMBNAIL/image/gif/597c5e19817d81c71127fa142baa2fb4/gr5.sml gr5 gr5.sml sml 10899 155 219 IMAGE-THUMBNAIL 1-s2.0-S2468823121001942-mmc1.docx https://s3-eu-west-1.amazonaws.com/prod-ucs-content-store-eu-west/content/pii:S2468823121001942/mmc1/MAIN/application/vnd.openxmlformats-officedocument.wordprocessingml.document/7b499c55d775e9c4e218da99ca5a699e/mmc1.docx mmc1 mmc1.docx docx 8985721 APPLICATION 1-s2.0-S2468823121001942-si1.svg https://s3-eu-west-1.amazonaws.com/prod-ucs-content-store-eu-west/content/pii:S2468823121001942/STRIPIN/image/svg+xml/4d4813cdff662bbcfcfaccb658c36bbb/si1.svg si1 si1.svg svg 14553 ALTIMG 1-s2.0-S2468823121001942-si2.svg https://s3-eu-west-1.amazonaws.com/prod-ucs-content-store-eu-west/content/pii:S2468823121001942/STRIPIN/image/svg+xml/1d59dd385b85cda0ba812c94b9967fc2/si2.svg si2 si2.svg svg 3041 ALTIMG 1-s2.0-S2468823121001942-si3.svg https://s3-eu-west-1.amazonaws.com/prod-ucs-content-store-eu-west/content/pii:S2468823121001942/STRIPIN/image/svg+xml/1faeb0af7b85bc63edf98c6c42a7deac/si3.svg si3 si3.svg svg 1146 ALTIMG 1-s2.0-S2468823121001942-si4.svg https://s3-eu-west-1.amazonaws.com/prod-ucs-content-store-eu-west/content/pii:S2468823121001942/STRIPIN/image/svg+xml/5f96223d9be015f9f120825dee519345/si4.svg si4 si4.svg svg 1504 ALTIMG 1-s2.0-S2468823121001942-si5.svg https://s3-eu-west-1.amazonaws.com/prod-ucs-content-store-eu-west/content/pii:S2468823121001942/STRIPIN/image/svg+xml/be5513280b60ab9884561b97de266996/si5.svg si5 si5.svg svg 1702 ALTIMG 1-s2.0-S2468823121001942-am.pdf https://s3-eu-west-1.amazonaws.com/prod-ucs-content-store-eu-west/content/egi:10GDS2V57W4/MAIN/application/pdf/7354938907ecdd8f34f02fc2e802780d/am.pdf am am.pdf pdf false 1642982 AAM-PDF MCAT 111577 111577 S2468-8231(21)00194-2 10.1016/j.mcat.2021.111577 Elsevier B.V. Fig. 1 XRD patterns of the silica support and various catalysts. Fig 1 Fig. 2 Representative TEM and HAADF-STEM images and corresponding particle size distributions of (a and b) 0.1 wt.% Ru/SiO2, (c and d) 0.5 wt.% Ru/SiO2, (e and f) 1.0 wt.% Ru/SiO2, (g and h) 1.5 wt.% Ru/SiO2, (i and j) 1.6 wt.% Ru/SiO2, (k and l) 2.4 wt.% Ru/SiO2, (m and n) 1.5 wt.% Ru/SiO2-DI (RuHA), and (o and p) 1.5 wt.% Ru/SiO2-DI (RuCl3) catalysts. Fig 2 Fig. 3 XPS spectra of C 1s and Ru 3d of Ru/SiO2 catalysts synthesized via the SEA and DI methods. Fig 3 Fig. 4 (a) H2-TPR profiles of dried unreduced samples synthesized via the SEA and DI methods; (b) In-situ FTIR spectra of CO adsorption for Ru/SiO2 catalysts synthesized via the SEA and DI methods. Fig 4 Fig. 5 The effects of (a) reaction time (90 °C, 1.0 MPa, n(Ru):n(BP) = 0.0020); (b) temperature (1.0 MPa, 80 min, n(Ru):n(BP) = 0.0020); (c) hydrogen pressure (90 °C, 80 min, n(Ru):n(BP) = 0.0020); (d) n(Ru):n(BP) (90 °C, 1.0 MPa, 80 min) on BP conversion and BCH selectivity over 1.5 wt.% Ru/SiO2 catalyst. Reaction conditions: 45 mL of isopropanol, and stirring rate of 500 rpm. Fig 5 Fig. 6 (a) The results of BP hydrogenation over catalysts synthesized by the SEA method; (b) The results of BP hydrogenation over catalysts synthesized via the DI method and the commercial catalyst. Reaction conditions: 0.13 g of catalyst, 1.54 g of BP, 45 mL of isopropanol, H2 pressure 1.0 MPa, T = 90 °C, t = 80 min, and stirring rate of 500 rpm. Fig 6 Fig. 7 (a) The absolute adsorption energies of BP, CHB and H atoms over the Ru(101), Ru30, and Ru30/SiO2. The models of (b) BP and (c) CHB adsorb on the surface of Ru(101), respectively. The models of (d) BP and (e) CHB adsorb on the Ru30/SiO2, respectively. White, gray, red, yellow, and green spheres correspond to H, C, O, Si, and Ru atoms, respectively. (For interpretation of the references to color in this figure legend, the reader is referred to the web version of this article.) Fig 7 Fig. 8 The recycling tests of 1.5 wt.% Ru/SiO2 catalyst for BP hydrogenation. Reaction conditions: n(Ru):n(BP) = 0.0020, 45 mL of isopropanol, H2 pressure 2.0 MPa, T = 90 °C, t = 80 min, and stirring rate of 500 rpm. Fig 8 Table 1 Compositional and textural properties of the silica support and Ru/SiO2 catalysts synthesized by the SEA and DI methods. Table 1 Entry Sample SBET (m2 g−1) dpore (nm) Vpore (cm3 g−1) 1 SiO2 314.3 ± 3.3 9.57 0.83 2 0.1 wt.% Ru/SiO2 244.7 ± 1.7 19.37 1.27 3 0.5 wt.% Ru/SiO2 227.7 ± 1.7 20.33 1.23 4 1.0 wt.% Ru/SiO2 230.4 ± 1.5 19.40 1.22 5 1.5 wt.% Ru/SiO2 218.3 ± 1.4 19.40 1.15 6 1.6 wt.% Ru/SiO2 254.9 ± 1.6 16.56 1.17 7 2.4 wt.% Ru/SiO2 258.1 ± 1.5 17.28 1.25 8 1.5 wt.% Ru/SiO2-DI (RuHA) 245.0 ± 2.9 18.47 1.30 9 1.5 wt.% Ru/SiO2-DI (RuCl3) 256.4 ± 3.3 17.44 1.25 Table 2 Results of the hydrogenation of biphenyl over the Ru/SiO2 catalysts synthesized by the SEA and DI methods a . Table 2 Entry Sample Dispersion b (%) r0 c TOF (h−1) 1 0.1 wt.% Ru/SiO2 7.9 9.5 202.6 2 0.5 wt.% Ru/SiO2 8.8 9.6 36.8 3 1.0 wt.% Ru/SiO2 10.5 9.3 14.9 4 1.5 wt.% Ru/SiO2 8.8 9.3 11.9 5 1.6 wt.% Ru/SiO2 11.4 9.5 8.8 6 2.4 wt.% Ru/SiO2 13.1 9.6 5.1 7 1.5 wt.% Ru/SiO2-DI (RuHA) 1.1 9.3 94.9 8 1.5 wt.% Ru/SiO2-DI (RuCl3) 1.3 9.1 78.6 a Reaction conditions: 0.13 g of catalyst, 1.54 g of BP, 45 mL of isopropanol, H2 pressure 1.0 MPa, T = 90 °C, and stirring rate of 500 rpm. b Dispersion of Ru determined by CO pulse adsorption. c Initial weight specific activity, unit in mmolC12H10 gcat −1 min−1. Highly dispersed and ultra-small Ru nanoparticles deposited on silica support as highly active and stable catalyst for biphenyl hydrogenation Wenwei Su Conceptualization Methodology Software Investigation Writing – original draft a 1 Jingyi Yang Methodology Investigation Writing – original draft a 1 Meng Zhang Writing – review & editing Supervision Data curtion a Zhipeng Zhao Software Investigation a Jingli Han Validation Formal analysis Visualization Software d Yongpeng Yang Supervision Writing – review & editing b ⁎ Jing-He Yang Supervision Writing – review & editing c ⁎ Zhongyi Liu Supervision Resources a ⁎ a Green Catalytic Center, and College of Chemistry, Zhengzhou University, 100 Science Road, Zhengzhou, 450001, PR China Green Catalytic Center, and College of Chemistry Zhengzhou University 100 Science Road Zhengzhou 450001 PR China aGreen Catalytic Center, and College of Chemistry, Zhengzhou University, 100 Science Road, Zhengzhou, 450001, PR China b Henan Institute of Advanced Technology, Zhengzhou University, 97 Wenhua Road, Zhengzhou, 450001, PR China Henan Institute of Advanced Technology Zhengzhou University 97 Wenhua Road Zhengzhou 450001 PR China bHenan Institute of Advanced Technology, Zhengzhou University, 97 Wenhua Road, Zhengzhou, 450001, PR China c School of Chemical Engineering and Energy, Zhengzhou University, 100 Science Road, Zhengzhou, 450001, PR China School of Chemical Engineering and Energy Zhengzhou University 100 Science Road Zhengzhou 450001 PR China cSchool of Chemical Engineering and Energy, Zhengzhou University, 100 Science Road, Zhengzhou, 450001, PR China d School of Material and Chemical Engineering, Zhengzhou University of Light Industry, Zhengzhou, 450001, PR China School of Material and Chemical Engineering Zhengzhou University of Light Industry Zhengzhou 450001 PR China dSchool of Material and Chemical Engineering, Zhengzhou University of Light Industry, Zhengzhou, 450001, PR China ⁎ Corresponding authors. 1 These authors contributed equally to this work. Liquid organic hydrogen carriers have been recently developed as the promising hydrogen storage materials, which exhibit significant advantages in hydrogen storage and utilization compared with the conventional hydrogen storage systems. Highly active and sable Ru/SiO2 catalysts for biphenyl hydrogenation to form bicyclohexyl were synthesized through the strong electrostatic adsorption (SEA) method, and the conventional dry impregnation (DI) method was also considered as comparison. X-ray diffraction, X-ray photoelectron spectroscopy, transmission electron microscopy, and H2-temperature-programmed reduction characterization techniques were used to investigate the physicochemical properties of the representative catalysts. The results showed that the catalysts synthesized by the SEA method possessed small-sized and well-dispersed Ru nanoparticles (NPs) on the silica support. Especially, 1.5 wt.% Ru/SiO2 catalyst exhibited excellent catalytic activity, stability and reusability, where the initial turnover frequency (TOF) was 11.9 h−1, the conversion of biphenyl was up to 99.9%, and the yield of bicyclohexyl reached 99.9% under the mild conditions (90 °C, 1.0 MPa H2). Further density functional theory (DFT) calculations elucidate that the catalyst with small Ru nanoparticle size exhibits higher catalytic activity for biphenyl hydrogenation. Graphical abstract Ru/SiO2 catalyst synthesized by SEA method exhibited excellent catalytic performance for biphenyl hydrogenation Image, graphical abstract Keywords Ru/SiO2 catalyst Small-sized Ru nanoparticles Biphenyl hydrogenation Bicyclohexyl Hydrogen storage 1 Introduction Presently, clean and sustainable energy sources have been widely sought to alleviate the current problems of energy consumption and environmental pollution [1]. Hydrogen is regarded as an ideal renewable energy source owing to its zero emissions and high energy density [2,3]. However, the difficulties in compression and liquefaction make it extremely challenging to store and transport, along with the huge economic costs and safety issues. Therefore, it is important to develop an economically viable and environmentally friendly hydrogen storage system [4]. Liquid organic hydrogen carriers (LOHCs) have been extensively explored to provide a flexible medium for safe and efficient storage and transportation of hydrogen energy [5–9]. Compared with the conventional hydrogen storage systems, LOHCs have numerous advantages: high hydrogen storage density, reversibility and high selectivity [10]. More important, the promising LOHCs materials are able to fully utilize the existing infrastructure, such as biphenyl (BP), toluene, benzene, naphthalene, diphenylmethane, 2-phenyltoluene, 1-methylnaphthalene, etc. [1,11,12] Among the different liquid chemicals, including cyclic hydrocarbons, formic acid and N-heterocycles, cyclic hydrocarbons are an appropriate candidate considering the cost criteria of hydrogen storage and delivery. Hydrogen is stored in cyclic hydrocarbons and then obtained by catalytic dehydrogenation of the cyclic hydrocarbons. As hydrogen storage materials, cyclic hydrocarbons have the advantages of high boiling point and low toxicity, such as bicyclohexyl (BCH) [13,14], cyclohexane [15,16], methylcyclohexane [17,18], decalin [19,20], perhydro-dibenzyltoluene [21,22]. Particularly, BCH is a very promising candidate for hydrogen storage because of the very low economic cost. It was reported that BCH has the highest catalytic dehydrogenation rate among the cyclic hydrocarbons [23]. Moreover, the generated BP can easily re-absorb hydrogen to from BCH. Therefore, as a hydrogen storage material, BCH is the preferred hydrogenation product with a high gravimetric of 7.3 wt.% and a volumetric hydrogen storage density of 62.8 g L−1. The supported catalysts have attracted the growing attention in the field of catalytic hydrogenation because of its highly metal utilization [24]. Therein, Ru-based catalyst with high activity and selectivity has been proved to be one of the most promising alternatives for the catalytic hydrogenation reactions [25,26]. However, the catalysts prepared by the conventional dry impregnation (DI) method show low catalytic activity and poor stability due to the low atomic utilization and easy aggregation of Ru nanoparticles (NPs) [27]. It has been reported that the strong electrostatic adsorption (SEA) method is greatly beneficial to improve the metal dispersion, which is originated from the support can electrostatically adsorb oppositely charged metal precursor by controlling the final pH value of the solution in the range of the strongest electrostatic interaction [28–31]. According to the dependence of adsorption on the pH value, the adsorption procedure is dominated by the electrostatic interaction rather than chemical reaction or ion exchange [32]. Regalbuto et al. studied the adsorption of a series of metal ammine complexes on the silica support by controlling the pH value with the point of the zero charge (PZC), and reasonably simulated the adsorption process through the revised physical adsorption (RPA) model [33–37]. Therefore, the catalysts synthesized by the SEA method can create highly dispersed metal NPs than those synthesized via the DI method. Besides, the bioreduction method, which was eco-friendly and economic, also has been found to be outstanding for synthesizing well distributed Ru-based catalysts [38,39]. In the present work, we utilized the SEA method to synthesize a series of Ru/SiO2 catalysts with various Ru contents, and compared their catalytic hydrogenation performance with those synthesized by the conventional DI method. According to the detail and systematic characterizations, it was found that the catalysts synthesized by the SEA method exhibited highly dispersed and small-sized Ru NPs over the silica support, while the catalysts synthesized via the DI method possessed larger and unevenly dispersed Ru NPs. Under the same reaction conditions, the catalysts synthesized by the SEA method showed fairly higher catalytic activity for BP hydrogenation than those synthesized via the DI method. After reaction for 80 min, the BCH yield of 1.5 wt.% Ru/SiO2 catalyst reached 99.9%, which is much higher than 1.5 wt.% Ru/SiO2-DI (RuHA) catalyst (43.9%), 1.5 wt.% Ru/SiO2-DI (RuCl3) catalyst (19.8%), and the commercial 5.0 wt.% Ru/C (27.0%). In addition, 1.5 wt.% Ru/SiO2 catalyst showed excellent catalytic hydrogenation activity even after five runs. On the basis of the density functional theory (DFT) calculation results, the higher catalytic activity over the catalysts synthesized by the SEA method can be ascribed to the smaller Ru nanoparticle size, which reduces the adsorption strength of BP and improves the anti-poisoning of catalysts. 2 Experimental 2.1 Chemical reagents Ruthenium(III) hexaammine chloride ([Ru(NH3)6]Cl3, 98%) precursor, designated as RuHA, was purchased from Alfa Aesar. The reserved RuHA solution was made up at 200 ppm and placed in a volumetric flask. Ruthenium(III) chloride hydrate (RuCl3•xH2O) was obtained from Kunming Sino-Platinum Industry Co., Ltd.. The fumed silica (SiO2) with a specific surface area of 314 m2 g−1 was acquired from Aladdin. NH3•H2O aqueous solution (25.0–28.0 wt.%) was obtained from Luoyang Chemical reagent Factory. Commercial 5.0 wt.% Ru/C catalyst was purchased from Macklin. Biphenyl was available from Sinopharm Chemical Reagent Co., Ltd.. All reagents are analytical grade (A.R.) and used directly without any further purification. 2.2 Catalyst preparation 2.2.1 Catalyst synthesis by SEA Ru/SiO2 catalysts with different Ru loadings (0.1, 0.5, 1.0, 1.5, 1.6 and 2.4 wt.%) were synthesized by the SEA method. Based on previous studies, the PZC (4.3) of the silica support has been determined [40]. The pH of the metal precursor solution was adjusted to the optimal value (about 11.5) with NH3•H2O aqueous solution, and then added the silica support for adsorption under vigorous stirring at room temperature for 1 h. Subsequently, the precipitate was collected by centrifugation and washed three times with deionized water. The resulting solid was dried overnight in a vacuum drying oven at 60 °C to remove the moisture. Then the solid powder was calcined in the muffle furnace at 120 °C for 4 h. Finally, the sample was reduced in the tube furnace at 400 °C for 2 h under the flow of 10 vol.% H2/N2. 2.2.2 Catalyst synthesis by DI Ru/SiO2 catalysts with two different metal precursors were synthesized by the DI method. The catalyst with precursor [Ru(NH3)6]Cl3 was labeled as 1.5 wt.% Ru/SiO2-DI (RuHA), and the catalyst with precursor RuCl3•xH2O was simplified as 1.5 wt.% Ru/SiO2-DI (RuCl3). The water absorption capacity of the employed silica support was determined as 2.4 mL g−1. Typically, the stoichiometric metal precursor solution was diluted to 2.4 mL with deionized water. The silica support (1.0 g) was then added into the abovementioned solution under vigorous stirring. The obtained samples were dried, calcined and reduced using the same procedure with the catalysts synthesized by the SEA method. 2.3 Catalyst characterization X-ray diffraction (XRD) patterns of the employed samples were recorded on a Bruker D8 diffractometer operated at 40 kV and 40 mA with Cu Kα radiation source (λ = 0.15418 nm) in the 2θ range of 10–80° at a scanning speed of 0.03 ° s−1. Ru concentrations in the specimens were measured on the inductively coupled plasma-atomic emission spectroscopy (ICP-AES) with ICPE-9820 instrument. The low-temperature N2 adsorption-desorption experiments were collected on a Micromeritics ASAP 2420 instrument. The relative pressure condition for measuring pore volume was 0.99. About 100 mg of the sample was used for adsorption analysis after pretreatment at 150 °C for 3 h under vacuum conditions. X-ray photoelectron spectroscopy (XPS) analysis was performed on a PHI Quantera SXM spectrometer with Al Kα radiation (hν = 1486.6 eV) as the excitation source under ultrahigh vacuum conditions. The pressure criteria were 10−9 Torr. In the deconvolution process, a Shirley background was subtracted before the peak fitting with a symmetric Gauss-Lorentz sum function being performed. In the data fitting process, the Ru 3d doublet separation value was set to 4.2 eV. The Ru 3d5/2 and Ru 3d3/2 doublet had a 3:2 peak area ratio and equal FWHM. The binding energies were referred to the C 1s line at 284.8 eV from the adventitious carbon. All the catalysts were pretreated by reduction in H2/Ar atmosphere. Transmission electron microscopy (TEM) and high-angle annular dark-field scanning transmission electron microscopy (HAADF-STEM) measurements were made on a FEI Tecnai G2 F20 electron microscope operated at 200 kV. Several milligrams of catalysts were dispersed in anhydrous ethanol for 20 min ultrasonic treatment, and then the suspension was dispersed onto a carbon-film-coated copper grid. All metal NPs were assumed to be spherical and the diameters of the metal NPs were measured. Particle size distribution histograms were generated by randomly measuring at least 100 particles. H2 temperature-programmed reduction (H2-TPR) was carried out on the Quantachrome Autosorb-IQ gas adsorption analyzer equipped with a thermal conductivity detector (TCD). About 50 mg of sample was placed at the center of the U-shaped tube, which was treated under an Ar flow (40 mL min−1) at 200 °C for 40 min and cooled down to 40 °C. Subsequently, the mixture flow of 10 vol.% H2/Ar (40 mL min−1) was switched into the tube for 15 min. The curve of H2 consumption was obtained at a temperature ramp of 10 °C min−1 from 40 to 400 °C. The dispersion of metallic Ru was determined by CO pulse chemisorption. About 50 mg of sample was flowed with He for 40 min at 140 °C and then cooled to 50 °C. Pure CO pulses were injected until the eluted peak did not change in intensity. The dispersion of Ru was calculated on the basis of the CO uptake with the assumption of Ru:CO stoichiometry of 2:1 [26,41]. The in-situ Fourier-transformed infrared (FT-IR) spectra of CO adsorption on the samples were measured to research the surface structure of supported metal catalysts. The samples were reduced at 400 °C for 60 min under 10 vol.% H2/N2 and then cooled to 25 °C under evacuation. The background spectrum was collected in the flowing He at 25 °C and the sample was exposed to 1% CO/He flow to make it saturated. The FT-IR spectra were collected at different temperatures to monitor the desorption behavior of the adsorbed CO. 2.4 Catalyst testing The reaction of BP hydrogenation was performed in a 100 mL high pressure reactor system (YZQR-100) equipped with an electronic temperature controller, a mechanical stirrer, and a tube for the sampling of the liquid phase products. In a typical experiment, after introducing 0.13 g of catalyst, 1.54 g of BP, and 45 mL of isopropanol, the autoclave was sealed completely and purged with H2 for three times. The reaction conditions were temperature of 90 °C, H2 pressure of 1.0 MPa, and stirring speed of 500 rpm. After the reaction test was completed for the desired time, the reaction system was cooled to room temperature. The obtained products via centrifugation were analyzed online by a SHIMADZU Gas Chromatograph Mass Spectrometer (GCMS-QP2010 SE) with an Auto Injector (SHIMADZU AOC-20i), which was equipped with an SH-RXI-5SIL MS chromatographic column (30 m, 0.25 mm i.d., stationary phase thickness of 0.25 μm) and a flame ionization detector (FID). The initial temperature of the oven was set at 70 °C and increased to 280 °C at the heating rate of 20 °C min−1. At the same time, the temperatures of the injector and FID were set to 260 °C and 270 °C, respectively. The analysis method of BP hydrogenation was area normalization method based on the single hydrogenation product. In a typical recycling experiment, the mixture was centrifuged at 8000 rpm to get the solid catalyst after one reaction cycle (80 min), which was washed with isopropanol for three times and dried overnight at 60 °C for the next use directly. To compare the intrinsic catalytic activity of BP, the TOF of BP was calculated as: T O F = r 0 × M R u d i s p e r s i o n × W where M R u is the molar mass of Ru, W is the metallic loading of Ru on the catalyst, and the Ru dispersion is determined by CO pulse chemisorption. The weight-specific activity ( r 0 ) is the amount of BP converted per gram minute of the catalyst at zero reaction time ( t 0 ). Specifically, the experimental BP content-reaction time curve is fitted by a polynomial equation with respect to t, which is then differentiated, and the r 0 is acquired by replacing t with zero. 3 Results and discussion 3.1 Physicochemical properties Table 1 lists the compositional and textural properties of the silica support and various Ru/SiO2 catalysts. The actual metal loading of the catalyst was determined by ICP-AES. Notably, the specific surface areas of the SiO2 supported catalysts are lower than that of the silica support, while their pore volumes and pore diameter show the inverse trend. The N2 adsorption-desorption isotherms (Fig. S1) of the representative samples belong to type Ⅳ with H3 hysteresis loop [26], which illustrate their mesoporous structure. It is obviously found that all the different Ru/SiO2 catalysts have similar pore volume and pore diameter. Additionally, the specific surface area of 1.5 wt.% Ru/SiO2 catalyst is 218.3 m2 g−1, which is much lower than that of 1.5 wt.% Ru/SiO2-DI (RuHA) catalyst (245.0 m2 g−1) and 1.5 wt.% Ru/SiO2-DI (RuCl3) catalyst (256.4 m2 g−1) with the same metal loading. This may be due to the higher dispersion of Ru NPs on the surface of 1.5 wt.% Ru/SiO2 catalyst. Fig. 1 shows the XRD patterns of the silica support and various catalysts. The broad peak at 2θ of 22° is attributed to amorphous silica (JCPDS Card No. 89–3433), corresponding to the diffraction of the (111) crystal plane. The characteristic peaks of metallic Ru are not detected, which can be ascribed to the small size of the highly dispersed Ru NPs below the detection limit of the XRD technique [42]. Additionally, after Ru loading, the patterns of the silica support are well retained, showing that the mild preparation conditions do not change the crystallographic phases of the silica support. For the 1.5 wt.% Ru/SiO2-DI (RuHA) catalyst, the broad peak at 2θ of 22.0° belongs to the SiO2(101), and the weak diffraction peak at 2θ of 44.0° is pertain to Ru(101), which indicates that some Ru NPs are aggregated on the surface of the catalyst. For the 1.5 wt.% Ru/SiO2-DI (RuCl3) catalyst, the broad peak at 2θ of 21.5° is attached to the SiO2(111) and the diffraction peak of metallic Ru is also not detected. According to the TEM and HAADF-STEM images in Fig. 2 , the catalysts synthesized by the SEA method exhibit small and homogeneous Ru NPs over the silica support. Furthermore, the statistical analysis shows a very narrow particle size distribution of Ru NPs varied from 0.2 nm to 1.8 nm and the average Ru nanoparticle sizes are only about 0.9 nm. Meanwhile, the particle size distribution histograms of Ru NPs match well to the normal distribution curve. The obtained results confirm that the homogenously dispersed Ru NPs on the silica support, which are consistent with the XRD results. In addition, the images indicate that the average Ru nanoparticle sizes do not change much with increasing metal loading from 0.1 to 2.4 wt.%. The Ru nanoparticle sizes of 1.5 wt.% Ru/SiO2-DI (RuHA) catalyst and 1.5 wt.% Ru/SiO2-DI (RuCl3) catalyst are slightly higher, where the size distributions are 1.0–7.0 nm and 1.0–6.0 nm, and the average particle sizes are 3.21 nm and 3.16 nm, respectively. In addition, no Ru NPs, where the particle sizes are less than 1 nm, are observed in the TEM images. Therefore, the catalysts synthesized by the DI method produce larger and poorly dispersed Ru NPs over the silica support than those synthesized by the SEA method. The Ru 3d5/2 peak is selected to identify the chemical states of Ru species owing to the serious overlapping of C 1s and Ru 3d3/2 peaks. The peak at 284.8 eV is attributed to C 1s of carbonaceous contamination, and employed as a reference for the binging energy correction. Fig. 3 shows that, the C 1s spectra also present two peaks at 286.5 eV and 288.8 eV, which are ascribed to carbonaceous species associated with oxygen and/or hydrogen [43,44]. The square root of reduced x2 of the eight catalysts from top to bottom are 0.49, 0.33, 0.64, 0.99, 0.97, 0.68, 0.49, and 1.43 respectively. For all the catalysts, the Ru 3d5/2 peaks position at 280.7–281.7 eV are attributed to the metallic Ru0 and might be accompanied by partially oxidized Ru species [45]. The binding energies of Ru 3d5/2 peaks of 1.5 wt.% Ru/SiO2-DI (RuHA) catalyst and 1.5 wt.% Ru/SiO2-DI (RuCl3) catalyst are located at 280.7 eV and 280.8 eV. It is noteworthy that the binding energies of Ru 3d5/2 peaks of catalysts synthesized by the SEA method are much higher than those synthesized via the DI method, which are also higher than the bulk Ru (279.6–280.2 eV) in the literature [46]. Such high binding energy might be related to the finely dispersed metallic Ru NPs, which probably also results from the strong metal-support interaction between the Ru NPs and the silica support [47]. Therefore, the XPS results are generally in agreement with the XRD and TEM measurements, confirming the formation of highly dispersed Ru NPs on the silica support. Two distinct H2-TPR peaks at 262–275 °C and 343–367 °C are observed (Fig. 4 a) on the catalysts synthesized by the SEA method, which are ascribed to the reduction of different chemical states of RuOx species over the silica support [42]. The peaks at low temperature correspond to the reduction of RuO2 oxide to metallic Ru0, while the peaks at high temperature are ascribed to the reduction of Ru3+ ions to metallic Ru0. Nevertheless, only one peak appears in the TPR patterns for catalysts synthesized by the DI method, where the H2-TPR peaks of 1.5 wt.% Ru/SiO2-DI (RuHA) catalyst and 1.5 wt.% Ru/SiO2-DI (RuCl3) catalyst are located at 252 and 265 °C, respectively. According to the TPR profiles, a common feature is that the samples synthesized by the DI method always present sharp and narrow H2-TPR peaks, whereas the samples synthesized by the SEA method present much larger reduction peak areas, indicating that the samples synthesized by the SEA method have more Ru oxides or higher extent of oxidation. The samples synthesized by the SEA method have higher reduction temperature, which is due to the existence of strong metal-support interaction between the Ru NPs and the silica support. As illustrated in Fig. 4b, the bands locating at 2082–2001 cm−1 can be assigned to linearly bonded CO on Ru0 atoms, and the bands at 1850–1806 cm−1 can be ascribed to bridge bonded CO on two neighboring Ru atoms [48–50]. The presence of linearly bonded CO might be due to the relatively independent and uniform dispersion of Ru NPs on the surface of the silica support. No CO adsorption peak of 0.1 wt.% Ru/SiO2 catalyst is observed, which may be due to its low metal loading. Compared with the 1.5 wt.% Ru/SiO2-DI (RuHA) catalyst, a red shift of the linear adsorption peak of the catalysts synthesized by the SEA method is clearly observed. Furthermore, the peak area and signal strength of the catalysts synthesized by the SEA method are much higher than that of 1.5 wt.% Ru/SiO2-DI (RuHA) catalyst, which might be because the catalysts synthesized by the SEA method have smaller Ru NPs and stronger metal-support interaction, resulting in the stronger CO adsorption strength. 3.2 Catalytic performance The effects of different reaction conditions on the performance over 1.5 wt.% Ru/SiO2 catalyst for BP hydrogenation reaction are presented in Fig. 5 . The conversion of BP linearly increases from 23.3% to 99.9% with the reaction time increasing from 10 to 80 min (Fig. 5a). Nevertheless, the selectivity of BCH increases slowly from 24.8% at 10 min to 35.3% at 60 min, but increases rapidly to 99.9% at 80 min. In the terms of 1.5 wt.% Ru/SiO2-DI (RuHA) catalyst (Fig. S2), when the reaction time reaches 80 min, the conversion of BP is 99.9%, but the selectivity of BCH is only 45.6%. As seen in Fig. 5b, the BP conversion increases from 73.6% to 99.9% and the BCH selectivity increases from 45.7% to 99.9% accordingly, as the temperature raises from 50 °C to 90 °C. As shown in Fig. 5c, when the hydrogen pressure raises from 0.5 MPa to 1.0 MPa, the BP conversion and the BCH selectivity increase from 70.5% to 99.9% and 28.7% to 99.9%, respectively. The results can be ascribed to the fact that the surface hydrogen content can increase with hydrogen pressure increasing, leading to the higher catalyst activity [51]. From Fig. 5d, when the Ru/BP mole ratio increases from 0.0005 to 0.0020, the conversion of BP increases from 63.7% to 99.9%, and the selectivity of BCH increases from 32.2% to 99.9%. Therefore, the obtained results suggest that the optimal reaction conditions for BP hydrogenation are reaction time of 80 min, reaction temperature of 90 °C, hydrogen pressure of 1.0 MPa, and Ru/BP mole ratio of 0.0020. In addition, for this kind of complete hydrogenation, improving the reaction conditions can improve the catalytic performance of the reaction. Table 2 presents the catalytic activities performance of BP hydrogenation for the catalysts synthesized by the SEA and DI methods. The TOF values of BP over the catalysts are calculated based on the r0 and dispersion data. As can be seen from Fig. 6 , the relation between metal loading and hydrogenation activity is studied. It should be pointed out that the assumption of Ru:CO stoichiometry of 2:1 can result in the deviation for calculating the Ru dispersion, because both of linearly adsorbed and bridge bonded CO molecules exist according to the In-situ FTIR spectra of CO adsorption. On the other hand, the results of estimated Ru dispersion coincide with the trend of TEM results. So, the CO probe is appropriate to semi-quantitatively compare the Ru dispersion. The catalytic activity of the catalysts synthesized by the SEA method increases with the increase of metal loading. The 0.1 wt.% Ru/SiO2 catalyst shows the highest TOF of 202.6 h−1, but the conversion of BP and the selectivity of BCH are only 46.7% and 29.8%, respectively. Among all the catalysts, the TOF value of the 0.1 wt.% Ru/SiO2 catalyst is extremely high. This fact may be ascribed to that some smaller Ru NPs than 0.2 nm maybe not be taken into account, because they are too small to be identified. So, there may be some atomically dispersed Ru species in the 0.1 wt.% Ru/SiO2 catalyst. The 1.5 wt.% Ru/SiO2 catalyst shows higher catalytic activity, where the conversion of BP and the selectivity of BCH are as high as 99.9%, although its TOF decreases to 11.4 h−1. Furthermore, the TOF of 1.6 wt.% Ru/SiO2 catalyst and 2.4 wt.% Ru/SiO2 catalyst significantly decrease to 8.8 h−1 and 5.1 h−1, respectively. Compared with the 1.5 wt.% Ru/SiO2 catalyst, the 1.5 wt.% Ru/SiO2-DI (RuHA) catalyst and the 1.5 wt.% Ru/SiO2-DI (RuCl3) catalyst show lower BCH yield, which are 43.9% and 19.8%, respectively. It should be pointed out that the activity of 1.5 wt.% Ru/SiO2-DI (RuHA) catalyst is higher than of 1.5 wt.% Ru/SiO2-DI (RuCl3) catalyst, although the average Ru NPs size in the former is larger than that in the latter. This fact can be ascribed to the larger amount of smaller Ru NPs in the former. The ratio of Ru NPs in 1.5 wt.% Ru/SiO2-DI (RuHA) catalyst below 3.0 nm is 63.0%, which is larger than that in 1.5 wt.% Ru/SiO2-DI (RuCl3) catalyst (40.4%). The results suggest that the catalytic hydrogenation ability of catalysts with highly dispersed Ru NPs is stronger. The 5.0 wt.% Ru/C-(Commercial) catalyst exhibits the low catalytic activity, where the conversion of BP and the selectivity of BCH are 70.6% and 38.2%, respectively. As a consequence, the catalysts synthesized by the SEA method exhibit significant advantages in catalytic activity and atomic utilization over those synthesized by the DI method. 3.3 DFT calculations The DFT calculations were calculated to further investigate the different performance of the employed Ru/SiO2 catalysts on BP hydrogenation. Due to the much larger size of Ru NPs on Ru/SiO2 (DI) and strong XRD signal of Ru(101), the Ru(101) surface was used. Ru30 nanoparticle (~0.9 nm in diameter) supported on SiO2(111) surface was used as the model of Ru/SiO2 (SEA), and the bare Ru30 nanoparticle was also taken into account to study the effect of SiO2 support. The adsorption energies of BP, cyclohexylbenzene (CHB) and H on Ru(101), Ru30 and Ru30/SiO2(111) surfaces are summarized in Fig. 7 a. It is found that the adsorption energy of BP on Ru(101) is 4.97 eV, which is so strong that it can easily lead to the catalyst poisoning. However, it significantly decreases to 3.20 eV on Ru30 and 2.72 eV on Ru30/SiO2(111), respectively, which is mainly ascribed to the decreased adsorption sites of small Ru NPs in the light of their different adsorption geometric structures (Fig. 7 and Fig. S3). The weakened interaction is beneficial for improving the catalytic activity [52–55]. The adsorption energy of CHB on Ru(101) is 3.39 eV, which is also larger than those on Ru30 (2.17 eV) and Ru30/SiO2(111) (2.29 eV), suggesting CHB is easier to desorb on Ru30 and Ru30/SiO2(111) than that on Ru(101). Compared with Ru30 and Ru30/SiO2(111), the catalytic activity of CHB hydrogenation on Ru(101) is significantly suppressed due to its over high adsorption energy, which coincides with experimental results very well. As shown in Fig. 5a, the conversion of BP linearly increases to 70.6% when the reaction time reaches 60 min, but the selectivity of BCH slowly increases to 35.3%, because the intermediate CHB is desorbed before further hydrogenation due to the higher adsorption energy of BP. When most of BP transforms into CHB, it adsorbs again and further hydrogenates to BCH quickly at the last 20 min. However, the selectivity of BCH slowly increases to 45.6% at the last 20 min for the 1.5 wt.% Ru/SiO2-DI (RuHA) (Fig. S2), although the conversion of BP reaches 99.9%. It is found that the hydrogen adsorption on the Ru30 nanocluster is slightly strengthened by 0.05 eV than that on Ru(101) surface, but it decreases by 0.13 eV after supported on SiO2 due to the strong metal-support interaction, which was also confirmed by the charge transfer from Ru30 nanocluster to SiO2 (Fig. S4). 3.4 Reusability study The recycling ability of 1.5 wt.% Ru/SiO2 catalyst for BP hydrogenation is shown in Fig. 8 . When the reaction conditions of the second cycle reaction are 90 °C, 1.0 MPa, and 80 min (Fig. S5), the conversion of BP is 99.2%, while the selectivity of BCH is only 53.1%. A new diffraction peak at 2θ of 44.1° is observed (Fig. S7), which is attached to the Ru(101). According to the TEM characterization result (Fig. S8), the size of Ru NPs shows the obvious growth after one recycle, where the average particle size increases from 0.91 nm to 1.63 nm. The square root of reduced x2 of the catalyst in Fig. S9 is 0.46. Compared with the fresh 1.5 wt.% Ru/SiO2 catalyst, the Ru 3d5/2 peak of the used catalyst shifts to 280.9 eV in the direction of low binding energy, which might be due to the reduction of partially oxidized Ru species. The results elucidate that the small Ru NPs size has higher hydrogenation activity and particle agglomeration leads to the deactivation of the catalyst. However, the performance of 1.5 wt.% Ru/SiO2 catalyst recovers by increasing the hydrogen pressure to 2.0 MPa, and it shows excellent reusability after five recycles. The conversion of BP and the selectivity of BCH remain almost unchanged. As shown in Fig. S6, the conversion of BP decreases from 98.8% to 53.9% and the selectivity of BCH decreases from 44.5% to 15.2% over 1.5 wt.% Ru/SiO2-DI (RuHA) catalyst after four recycles. Therefore, under the same reaction conditions, the catalysts synthesized by the SEA method have higher stability than those synthesized via the DI method. Combined with the results of DFT calculation, the increase of Ru nanoparticle size can enhance the adsorption of BP and CHB, which accordingly leads to decrease in the catalytic activity of BP hydrogenation. 4 Conclusions In summary, a series of Ru/SiO2 catalysts have been successfully synthesized using the SEA method, and their physicochemical properties and catalytic performance for biphenyl hydrogenation have been investigated in detail. XRD and TEM characterization results indicate that the Ru NPs are well dispersed on the silica support. It is demonstrated that the 1.5 wt.% Ru/SiO2 catalyst shows exceedingly high catalytic performance, which exhibits high activity, selectivity, and stability upon the repetitive recycling. According to the DFT calculations, the adsorption properties of BP and CHB strongly depend on Ru nanoparticle size, and their adsorption strength on smaller Ru nanoparticles is decreased, resulting the enhanced anti-poisoning ability and higher catalytic activity. CRediT authorship contribution statement Wenwei Su: Conceptualization, Methodology, Software, Investigation, Writing – original draft. Jingyi Yang: Methodology, Investigation, Writing – original draft. Meng Zhang: Writing – review & editing, Supervision, Data curtion. Zhipeng Zhao: Software, Investigation. Jingli Han: Validation, Formal analysis, Visualization, Software. Yongpeng Yang: Supervision, Writing – review & editing. Jing-He Yang: Supervision, Writing – review & editing. Zhongyi Liu: Supervision, Resources. Declaration of Competing Interest We declare that we have no financial and personal relationships with other people or organizations that can inappropriately influence our work, there is no professional or other personal interest of any nature or kind in any product, service and/or company that could be construed as influencing the position presented in, or the review of, the manuscript entitled. Acknowledgements This study is supported by the National Natural Science Foundation of China (Grant No. 21403053, 21808213), Central Plains Science and Technology Innovation Leader Project (Nos. 214200510006), China Postdoctoral Science Foundation (2020M672305), and Key Scientific and Technological Project of Henan Province (202102210042). The computational resources in this research were supported by Henan Supercomputer Center. Supplementary materials Supplementary material associated with this article can be found, in the online version, at doi:10.1016/j.mcat.2021.111577. Appendix Supplementary materials Image, application 1 References [1] D.J. Han Y.S. Jo B.S. Shin M. Jang J.W. Kang J.H. Han S.W. Nam C.W. Yoon A novel eutectic mixture of biphenyl and diphenylmethane as a potential liquid organic hydrogen carrier: catalytic hydrogenation Energy Technol. 7 2019 113 121 D.J. Han, Y.S. Jo, B.S. Shin, M. Jang, J.W. Kang, J.H. Han, S.W. Nam, C.W. Yoon, A novel eutectic mixture of biphenyl and diphenylmethane as a potential liquid organic hydrogen carrier: catalytic hydrogenation, Energy Technol. 7 (2019) 113–121. [2] C.L. Wang Q. Wang F.Y. Fu D. Astruc Hydrogen generation upon nanocatalyzed hydrolysis of hydrogen-rich boron derivatives: recent developments Acc. Chem. Res. 53 2020 2483 2493 C.L. Wang, Q. Wang, F.Y. Fu, D. Astruc, Hydrogen generation upon nanocatalyzed hydrolysis of hydrogen-rich boron derivatives: recent developments, Acc. Chem. Res.53 (2020) 2483–2493. [3] H.Y. Wang C.Y. Gao R. Li Z.K. Peng J.-H. Yang J. Gao Y.P. Yang S.H. Li B.J. Li Z.Y. Liu Ruthenium-Cobalt nanoalloy embedded within hollow carbon spheres as a bifunctionally robust catalyst for hydrogen generation from water splitting and ammonia borane hydrolysis ACS Sustain. Chem. Eng. 7 2019 18744 18752 H.Y. Wang, C.Y. Gao, R. Li, Z.K. Peng, J.-.H. Yang, J. Gao, Y.P. Yang, S.H. Li, B.J. Li, Z.Y. Liu, Ruthenium-Cobalt nanoalloy embedded within hollow carbon spheres as a bifunctionally robust catalyst for hydrogen generation from water splitting and ammonia borane hydrolysis, ACS Sustain. Chem. Eng.7 (2019) 18744–18752. [4] M. Gonda M. Ohshima H. Kurokawa H. Miura Toluene hydrogenation over Pd and Pt catalysts as a model hydrogen storage process using low grade hydrogen containing catalyst inhibitors Int. J. Hydrog. Energ. 39 2014 16339 16346 M. Gonda, M. Ohshima, H. Kurokawa, H. Miura, Toluene hydrogenation over Pd and Pt catalysts as a model hydrogen storage process using low grade hydrogen containing catalyst inhibitors, Int. J. Hydrog. Energ.39 (2014) 16339–16346. [5] M. Niermann S. Drünert M. Kaltschmitt K. Bonhoff Liquid organic hydrogen carriers (LOHCs)-techno-economic analysis of LOHCs in a defined process chain Energy Environ. Sci. 12 2019 290 307 M. Niermann, S. Drünert, M. Kaltschmitt, K. Bonhoff, Liquid organic hydrogen carriers (LOHCs)-techno-economic analysis of LOHCs in a defined process chain, Energy Environ. Sci.12 (2019) 290–307. [6] P.M. Modisha C.N.M. Ouma R. Garidzirai P. Wasserscheid D. Bessarabov The prospect of hydrogen storage using liquid organic hydrogen carriers Energ. Fuel. 33 2019 2778 2796 P.M. Modisha, C.N.M. Ouma, R. Garidzirai, P. Wasserscheid, D. Bessarabov, The prospect of hydrogen storage using liquid organic hydrogen carriers, Energ. Fuel.33 (2019) 2778–2796. [7] A. Bourane M. Elanany T.V. Pham S.P. Katikaneni An overview of organic liquid phase hydrogen carriers Int. J. Hydrog. Energ. 41 2016 23075 23091 A. Bourane, M. Elanany, T.V. Pham, S.P. Katikaneni, An overview of organic liquid phase hydrogen carriers, Int. J. Hydrog. Energ.41 (2016) 23075–23091. [8] M. Eypasch M. Schimple A. Kanwar T. Hartmann S. Herzog T. Frank T. Hamacher Model-based techno-economic evaluation of an electricity storage system based on liquid organic hydrogen carriers Appl. Energ. 185 2017 320 330 M. Eypasch, M. Schimple, A. Kanwar, T. Hartmann, S. Herzog, T. Frank, T. Hamacher, Model-based techno-economic evaluation of an electricity storage system based on liquid organic hydrogen carriers, Appl. Energ.185 (2017) 320–330. [9] D. Tcichmann W. Arlt P. Wasserscheid Liquid organic hydrogen carriers as an efficient vector for the transport and storage of renewable energy Int. J. Hydrog. Energ. 37 2012 18118 18132 D. Tcichmann, W. Arlt, P. Wasserscheid, Liquid organic hydrogen carriers as an efficient vector for the transport and storage of renewable energy, Int. J. Hydrog. Energ.37 (2012) 18118–18132. [10] P.T. Aakko-Saksa C. Cook J. Kiviaho T. Repo Liquid organic hydrogen carriers for transportation and storing of renewable energy-review and discussion J. Power Sources 396 2018 803 823 P.T. Aakko-Saksa, C. Cook, J. Kiviaho, T. Repo, Liquid organic hydrogen carriers for transportation and storing of renewable energy-review and discussion, J. Power Sources396 (2018) 803–823. [11] S. Hodoshima H. Arai S. Takaiwa Y. Saito Catalytic decalin dehydrogenation/naphthalene hydrogenation pair as a hydrogen source for fuel-cell vehicle Int. J. Hydrog. Energ. 28 2003 1255 1262 S. Hodoshima, H. Arai, S. Takaiwa, Y. Saito, Catalytic decalin dehydrogenation/naphthalene hydrogenation pair as a hydrogen source for fuel-cell vehicle, Int. J. Hydrog. Energ.28 (2003) 1255–1262. [12] E. Gianotti M. Taillades-Jacquin J. Rozière D.J. Jones High-purity hydrogen generation via dehydrogenation of organic carriers: a review on the catalytic process ACS Catal. 8 2018 4660 4680 E. Gianotti, M. Taillades-Jacquin, J. Rozière, D.J. Jones, High-purity hydrogen generation via dehydrogenation of organic carriers: a review on the catalytic process, ACS Catal.8 (2018) 4660–4680. [13] A.N. Kalenchuk V.I. Bogdan S.F. Dunaev L.M. Kustov Effect of surface hydrophilization on Pt/Sibunit catalytic activity in bicyclohexyl dehydrogenation in hydrogen storage application Int. J. Hydrog. Energ. 43 2018 6191 6196 A.N. Kalenchuk, V.I. Bogdan, S.F. Dunaev, L.M. Kustov, Effect of surface hydrophilization on Pt/Sibunit catalytic activity in bicyclohexyl dehydrogenation in hydrogen storage application, Int. J. Hydrog. Energ.43 (2018) 6191–6196. [14] A.N. Kalenchuk A.V. Leonov V.I. Bogdan L.M. Kustov Dehydrogenataion of bicyclohexyl over Ni/oxidized sibunit catalyst Russ. J. Phys. Chem. A+ 93 2019 652 657 A.N. Kalenchuk, A.V. Leonov, V.I. Bogdan, L.M. Kustov, Dehydrogenataion of bicyclohexyl over Ni/oxidized sibunit catalyst, Russ. J. Phys. Chem. A+93 (2019) 652–657. [15] H.L. Ping Z.N. Kou G.H. Xu S.F. Wu Deactivation and regeneration of Raney-Ni catalyst during multiphase dehydrogenation of cyclohexane J. Environ. Chem. Eng. 4 2016 3253 3259 H.L. Ping, Z.N. Kou, G.H. Xu, S.F. Wu, Deactivation and regeneration of Raney-Ni catalyst during multiphase dehydrogenation of cyclohexane, J. Environ. Chem. Eng.4 (2016) 3253–3259. [16] Z.J. Xia H.Y. Liu H.F. Lu Z.K. Zhang Y.F. Chen Study on catalytic properties and carbon deposition of Ni-Cu/SBA-15 for cyclohexane dehydrogenation Appl. Surf. Sci. 422 2017 905 912 Z.J. Xia, H.Y. Liu, H.F. Lu, Z.K. Zhang, Y.F. Chen, Study on catalytic properties and carbon deposition of Ni-Cu/SBA-15 for cyclohexane dehydrogenation, Appl. Surf. Sci.422 (2017) 905–912. [17] F. Alhumaidan D. Cresswell A. Garforth Hydrogen storage in liquid organic hydride: producing hydrogen catalytically from methylcyclohexane Energ. Fuel. 25 2011 4217 4234 F. Alhumaidan, D. Cresswell, A. Garforth, Hydrogen storage in liquid organic hydride: producing hydrogen catalytically from methylcyclohexane, Energ. Fuel.25 (2011) 4217–4234. [18] A. Shukla J.V. Pande R.B. Biniwale Dehydrogenation of methylcyclohexane over Pt/V2O5 and Pt/Y2O3 for hydrogen delivery applications Int. J. Hydrog. Energ. 37 2012 3350 3357 A. Shukla, J.V. Pande, R.B. Biniwale, Dehydrogenation of methylcyclohexane over Pt/V2O5 and Pt/Y2O3 for hydrogen delivery applications, Int. J. Hydrog. Energ.37 (2012) 3350–3357. [19] Y. Suttisawat H. Sakai M. Abe P. Rangsunvigi S. Horikoshi Microwave effect in the dehydrogenation of tetralin and decalin with a fixed-bed reactor Int. J. Hydrog. Energy 37 2012 3242 3250 Y. Suttisawat, H. Sakai, M. Abe, P. Rangsunvigi, S. Horikoshi, Microwave effect in the dehydrogenation of tetralin and decalin with a fixed-bed reactor, Int. J. Hydrog. Energy37 (2012) 3242–3250. [20] S.T. Qi Y.Y. Li J.Q. Yue H. Chen C.H. Yi B.L. Yang Hydrogen production from decalin dehydrogenation over Pt-Ni/C bimetallic catalysts Chin. J. Catal. 35 2014 1833 1839 S.T. Qi, Y.Y. Li, J.Q. Yue, H. Chen, C.H. Yi, B.L. Yang, Hydrogen production from decalin dehydrogenation over Pt-Ni/C bimetallic catalysts, Chin. J. Catal.35 (2014) 1833–1839. [21] M. Markiewicz Y.Q. Zhang A. Bösmann N. Brückner J. Thöming P. Wasserscheid S. Stolte Environmental and health impact assessment of liquid organic hydrogen carrier (LOHC) systems-challenges and preliminary results Energy Environ. Sci. 8 2015 1035 1045 M. Markiewicz, Y.Q. Zhang, A. Bösmann, N. Brückner, J. Thöming, P. Wasserscheid, S. Stolte, Environmental and health impact assessment of liquid organic hydrogen carrier (LOHC) systems-challenges and preliminary results, Energy Environ. Sci.8 (2015) 1035–1045. [22] H. Jorschick P. Preuster S. Dürr A. Seidel K. Müller A. Bösmann P. Wasserscheid Hydrogen storage using a hot pressure swing reactor Energy Environ. Sci. 10 2017 1652 1659 H. Jorschick, P. Preuster, S. Dürr, A. Seidel, K. Müller, A. Bösmann, P. Wasserscheid, Hydrogen storage using a hot pressure swing reactor, Energy Environ. Sci.10 (2017) 1652–1659. [23] N. Hiyoshi C.V. Rode O. Sato M. Shirai Biphenyl hydrogenation over supported transition metal catalysts under supercritical carbon dioxide solvent Appl. Catal. A-Gen. 288 2005 43 47 N. Hiyoshi, C.V. Rode, O. Sato, M. Shirai, Biphenyl hydrogenation over supported transition metal catalysts under supercritical carbon dioxide solvent, Appl. Catal. A-Gen.288 (2005) 43–47. [24] G.B. Zhou L. Jiang D.P. He Nanoparticulate Ru on TiO2 exposed the {100} facets: support facet effect on selective hydrogenation of benzene to cyclohexene J. Catal. 369 2019 352 362 G.B. Zhou, L. Jiang, D.P. He, Nanoparticulate Ru on TiO2 exposed the {100} facets: support facet effect on selective hydrogenation of benzene to cyclohexene, J. Catal.369 (2019) 352–362. [25] M.Y. Aslan D. Uner Fundamentals of hydrogen storage processes over Ru/SiO2 and Ru/Vulcan Int. J. Hydrog. Energ. 44 2019 18903 18914 M.Y. Aslan, D. Uner, Fundamentals of hydrogen storage processes over Ru/SiO2 and Ru/Vulcan, Int. J. Hydrog. Energ.44 (2019) 18903–18914. [26] G.B. Zhou R.F. Dou H.Z. Bi S.H. Xie Y. Pei K.N. Fan M.H. Qiao B. Sun B.N. Zong Ru nanoparticles on rutile/anatase junction of P25 TiO2: controlled deposition and synergy in partial hydrogenation of benzene to cyclohexene J. Catal. 332 2015 119 126 G.B. Zhou, R.F. Dou, H.Z. Bi, S.H. Xie, Y. Pei, K.N. Fan, M.H. Qiao, B. Sun, B.N. Zong, Ru nanoparticles on rutile/anatase junction of P25 TiO2: controlled deposition and synergy in partial hydrogenation of benzene to cyclohexene, J. Catal.332 (2015) 119–126. [27] B. Pongthawornsakun N. Wimonsupakit J. Panpranot Preparation of TiO2 supported Au-Pd and Cu-Pd by the combined strong electrostatic adsorption and electroless deposition for selective hydrogenation of acetylene J. Chem. Sci. 129 2017 1721 1734 B. Pongthawornsakun, N. Wimonsupakit, J. Panpranot, Preparation of TiO2 supported Au-Pd and Cu-Pd by the combined strong electrostatic adsorption and electroless deposition for selective hydrogenation of acetylene, J. Chem. Sci.129 (2017) 1721–1734. [28] A. Wong Q. Liu S. Griffin A. Nicholls J.R. Regalbuto Synthesis of ultrasmall, homogeneously alloyed, bimetallic nanoparticles on silica supports Science 358 2017 1427 1430 A. Wong, Q. Liu, S. Griffin, A. Nicholls, J.R. Regalbuto, Synthesis of ultrasmall, homogeneously alloyed, bimetallic nanoparticles on silica supports, Science 358 (2017) 1427–1430. [29] Z.Y. Bo L.R. McCullough S. Dull M.A. Ardagh J. Wang J. Notestein Strong electrostatic adsorption of Pt onto SiO2 partially overcoated Al2O3-towards single atom catalysts J. Chem. Phys. 151 2019 214703 Z.Y. Bo, L.R. McCullough, S. Dull, M.A. Ardagh, J. Wang, J. Notestein, Strong electrostatic adsorption of Pt onto SiO2 partially overcoated Al2O3-towards single atom catalysts, J. Chem. Phys.151 (2019) 214703. [30] J.Y. Sun J.R. Zhang H.Y. Fu H.Q. Wan Y.Q. Wan X.L. Qu Z.Y. Xu D.Q. Yin S.R. Zheng Enhanced catalytic hydrogenation reduction of bromate on Pd catalyst supported on CeO2 modified SBA-15 prepared by strong electrostatic adsorption Appl. Catal. B-Environ. 229 2018 32 40 J.Y. Sun, J.R. Zhang, H.Y. Fu, H.Q. Wan, Y.Q. Wan, X.L. Qu, Z.Y. Xu, D.Q. Yin, S.R. Zheng, Enhanced catalytic hydrogenation reduction of bromate on Pd catalyst supported on CeO2 modified SBA-15 prepared by strong electrostatic adsorption, Appl. Catal. B-Environ.229 (2018) 32–40. [31] Q.L. Liu U.A. Joshi K. Über J.R. Regalbuto The control of Pt and Ru nanoparticle size on high surface area supports Phys. Chem. Chem. Phys. 16 2014 26431 26435 Q.L. Liu, U.A. Joshi, K. Über, J.R. Regalbuto, The control of Pt and Ru nanoparticle size on high surface area supports, Phys. Chem. Chem. Phys.16 (2014) 26431–26435. [32] L. Jiao J.R. Regalbuto The synthesis of highly dispersed noble and base metals on silica via strong electrostatic adsorption: I. amorphous silica J. Catal. 260 2008 329 341 L. Jiao, J.R. Regalbuto, The synthesis of highly dispersed noble and base metals on silica via strong electrostatic adsorption: I. amorphous silica, J. Catal.260 (2008) 329–341. [33] L. Jiao J.R. Regalbuto The synthesis of highly dispersed noble and base metals on silica via strong electrostatic adsorption: II. mesoporous silica SBA-15 J. Catal. 260 2008 342 350 L. Jiao, J.R. Regalbuto, The synthesis of highly dispersed noble and base metals on silica via strong electrostatic adsorption: II. mesoporous silica SBA-15, J. Catal.260 (2008) 342–350. [34] M. Kosmulski The pH dependent surface charging and points of zero charge. VII. Update Adv. Colloid Interfac. 251 2018 115 138 M. Kosmulski, The pH dependent surface charging and points of zero charge. VII. Update, Adv. Colloid Interface251 (2018) 115–138. [35] J.E. Samad S. Hoenig J.R. Regalbuto Synthesis of platinum catalysts over thick slurries of oxide supports by strong electrostatic adsorption ChemCatChem 7 2015 3460 3463 J.E. Samad, S. Hoenig, J.R. Regalbuto, Synthesis of platinum catalysts over thick slurries of oxide supports by strong electrostatic adsorption, Chem. Cat. Chem.7 (2015) 3460–3463. [36] M. Schreier J.R. Regalbuto A fundamental study of Pt tetraammine impregnation of silica 1. the electrostatic nature of platinum adsorption J. Catal. 225 2004 203 212 M. Schreier, J.R. Regalbuto, A fundamental study of Pt tetraammine impregnation of silica 1. the electrostatic nature of platinum adsorption, J. Catal.225 (2004) 203–212. [37] X. Hao W.A. Spieker J.R. Regalbuto A further simplification of the revised physical adsorption (RPA) model J. Colloid Interf. Sci. 267 2003 259 264 X. Hao, W.A. Spieker, J.R. Regalbuto, A further simplification of the revised physical adsorption (RPA) model, J. Colloid Interface Sci.267 (2003) 259–264. [38] Y. Ma Y.Q. Huang Y.W. Cheng L.J. Wang X. Li Biosynthesized ruthenium nanoparticles supported on carbon nanotubes as efficient catalysts for hydrogenation of benzene to cyclohexane: an eco-friendly and economical bioreduction method Appl. Catal. A-Gen. 484 2014 154 160 Y. Ma, Y.Q. Huang, Y.W. Cheng, L.J. Wang, X. Li, Biosynthesized ruthenium nanoparticles supported on carbon nanotubes as efficient catalysts for hydrogenation of benzene to cyclohexane: an eco-friendly and economical bioreduction method, Appl. Catal. A-Gen.484 (2014) 154–160. [39] Y. Ma Y.Q. Huang Y.W. Cheng L.J. Wang X. Li Selective liquid-phase hydrogenation of maleic anhydride to succinic anhydride on biosynthesized Ru-based catalysts Catal. Commun. 57 2014 40 44 Y. Ma, Y.Q. Huang, Y.W. Cheng, L.J. Wang, X. Li, Selective liquid-phase hydrogenation of maleic anhydride to succinic anhydride on biosynthesized Ru-based catalysts, Catal. Commun.57 (2014) 40–44. [40] J.Y. Yang Y.P. Fan Z.L. Li Z.K. Peng J.-.H. Yang B.Z. Liu Z.Y. Liu Bimetallic Pd-M (M = Pt, Ni, Cu, Co) nanoparticles catalysts with strong electrostatic metal-support interaction for hydrogenation of toluene and benzene Mol. Catal. 492 2020 110992 J.Y. Yang, Y.P. Fan, Z.L. Li, Z.K. Peng, J.-.H. Yang, B.Z. Liu, Z.Y. Liu, Bimetallic Pd-M (M = Pt, Ni, Cu, Co) nanoparticles catalysts with strong electrostatic metal-support interaction for hydrogenation of toluene and benzene, Mol. Catal.492 (2020) 110992. [41] G.B. Zhou Y. Pei Jiang Z K.N. Fan M.H. Qiao B. Sun B.N. Zong Doping effects of B in ZrO2 on structural and catalytic properties of Ru/B-ZrO2 catalysts for benzene partial hydrogenation J. Catal. 311 2014 393 403 G.B. Zhou, Y. Pei, Z, Jiang, K.N. Fan, M.H. Qiao, B. Sun, B.N. Zong, Doping effects of B in ZrO2 on structural and catalytic properties of Ru/B-ZrO2 catalysts for benzene partial hydrogenation, J. Catal.311 (2014) 393–403. [42] Y.R. Zhang X. Su L. Li H.F. Qi C.Y. Yang W. Liu X.L. Pan X.Y. Liu X.Y. Yang Y.Q. Huang T. Zhang Ru/TiO2 catalysts with size-dependent metal/support interaction for tunable reactivity in Fischer-Tropsch synthesis ACS Catal. 10 2020 12967 12975 Y.R. Zhang, X. Su, L. Li, H.F. Qi, C.Y. Yang, W. Liu, X.L. Pan, X.Y. Liu, X.Y. Yang, Y.Q. Huang, T. Zhang, Ru/TiO2 catalysts with size-dependent metal/support interaction for tunable reactivity in Fischer-Tropsch synthesis, ACS Catal.10 (2020) 12967–12975. [43] S. Gaur D. Pakhare H.Y. Wu D.J. Haynes J.J. Spivey CO2 reforming of CH4 over Ru-substituted pyrochlore catalysts: effects of temperature and reactant feed ratio Energ. Fuel. 26 2012 1989 1998 S. Gaur, D. Pakhare, H.Y. Wu, D.J. Haynes, J.J. Spivey, CO2 reforming of CH4 over Ru-substituted pyrochlore catalysts: effects of temperature and reactant feed ratio, Energ. Fuel.26 (2012) 1989–1998. [44] Y.X. Dou Y.J. Pang L.L. Gu Y.F. Ding W. Jiang X.Z. Feng W.J. Ji C.-.T. Au Core-shell structured Ru-Ni@SiO2: active for partial oxidation of methane with tunable H2/CO ratio J. Energy Chem. 27 2018 883 889 Y.X. Dou, Y.J. Pang, L.L. Gu, Y.F. Ding, W. Jiang, X.Z. Feng, W.J. Ji, C.-.T. Au, Core-shell structured Ru-Ni@SiO2: active for partial oxidation of methane with tunable H2/CO ratio, J. Energy Chem.27 (2018) 883–889. [45] A.M. Abdel-Mageed K. Wiese M. Parlinska-Wojtan J. Rabeah A. Brückner R.J. Behm Encapsulation of Ru nanoparticles: modifying the reactivity toward CO and CO2 methanation on highly active Ru/TiO2 catalysts Appl. Catal. B-Environ. 270 2020 118846 A.M. Abdel-Mageed, K. Wiese, M. Parlinska-Wojtan, J. Rabeah, A. Brückner, R.J. Behm, Encapsulation of Ru nanoparticles: modifying the reactivity toward CO and CO2 methanation on highly active Ru/TiO2 catalysts, Appl. Catal. B-Environ.270 (2020) 118846. [46] Y.V. Larichev Valence state study of supported ruthenium Ru/MgO catalysts J. Phys. Chem. C 112 2008 14776 14780 Y.V. Larichev, Valence state study of supported ruthenium Ru/MgO catalysts, J. Phys. Chem. C112 (2008) 14776–14780. [47] D.L. Li R.L. Li M.M. Lu X.Y. Lin Y.Y. Zhan L.L. Jiang Carbon dioxide reforming of methane over Ru catalysts supported on Mg-Al oxides: a highly dispersed and stable Ru/Mg(Al)O catalyst Appl. Catal. B-Environ. 200 2017 566 577 D.L. Li, R.L. Li, M.M. Lu, X.Y. Lin, Y.Y. Zhan, L.L. Jiang, Carbon dioxide reforming of methane over Ru catalysts supported on Mg-Al oxides: a highly dispersed and stable Ru/Mg(Al)O catalyst, Appl. Catal. B-Environ.200 (2017) 566–577. [48] S.Y. Chin C.T. Williams M.D. Amiridis FTIR studies of CO adsorption on Al2O3- and SiO2-supported Ru catalysts J. Phys. Chem. B 110 2006 871 882 S.Y. Chin, C.T. Williams, M.D. Amiridis, FTIR studies of CO adsorption on Al2O3- and SiO2-supported Ru catalysts, J. Phys. Chem. B110 (2006) 871–882. [49] M. Gajdoš A. Eichler J. Hafner CO adsorption on close-packed transition and noble metal surfaces: trends from ab initio calculations J. Phys.: Condens. Matter 16 2004 1141 1164 M. Gajdoš, A. Eichler, J. Hafner, CO adsorption on close-packed transition and noble metal surfaces: trends from ab initio calculations, J. Phys.16 (2004) 1141–1164. [50] X.Y. Wang L.L. Li Z.P. Fang Y.F. Zhang J. Ni B.Y. Lin L.R. Zheng C.-T. Au L.L. Jiang Atomically dispersed Ru catalyst for low-temperature nitrogen activation to ammonia via an associative mechanism ACS Catal. 10 2020 9504 9514 X.Y. Wang, L.L. Li, Z.P. Fang, Y.F. Zhang, J. Ni, B.Y. Lin, L.R. Zheng, C.-.T. Au, L.L. Jiang, Atomically dispersed Ru catalyst for low-temperature nitrogen activation to ammonia via an associative mechanism, ACS Catal. 10 (2020) 9504–9514. [51] N. Hiyoshi C.V. Rode O. Sato M. Shirai Biphenyl hydrogenation over supported transition metal catalysts under supercritical carbon dioxide solvent Appl. Catal. A-Gen. 288 2005 43 47 N. Hiyoshi, C.V. Rode, O. Sato, M. Shirai, Biphenyl hydrogenation over supported transition metal catalysts under supercritical carbon dioxide solvent, Appl. Catal. A-Gen.288 (2005) 43–47. [52] X.Q. Gao S.H. Zhu M. Dong J.Q. Wang W.B. Fan Ru nanoparticles deposited on ultrathin TiO2 nanosheets as highly active catalyst for levulinic acid hydrogenation to γ-valerolactone Appl. Catal. B-Environ. 259 2019 118076 X.Q. Gao, S.H. Zhu, M. Dong, J.Q. Wang, W.B. Fan, Ru nanoparticles deposited on ultrathin TiO2 nanosheets as highly active catalyst for levulinic acid hydrogenation to γ-valerolactone, Appl. Catal. B-Environ.259 (2019) 118076. [53] Z. Jiang S.Y. Guo T. Fang Enhancing the catalytic activity and selectivity of PdAu/SiO2 bimetallic catalysts for dodecahydro-N-ethylcarbazole dehydrogenation by controlling the particle size and dispersion ACS Appl. Energy Mater. 2 2019 7233 7243 Z. Jiang, S.Y. Guo, T. Fang, Enhancing the catalytic activity and selectivity of PdAu/SiO2 bimetallic catalysts for dodecahydro-N-ethylcarbazole dehydrogenation by controlling the particle size and dispersion, ACS Appl. Energy Mater.2 (2019) 7233–7243. [54] Y.R. Zhang X.L. Yang X.F. Yang H.M. Duan H.F. Qi Y. Su B.L. Liang H.B. Tao B. Liu D. Chen X. Su Y.Q. Huang T. Zhang Tuning reactivity of Fischer-Tropsch synthesis by regulating TiOx overlayer over Ru/TiO2 nanocatalysts Nat. Commun. 11 2020 3185 Y.R. Zhang, X.L. Yang, X.F. Yang, H.M. Duan, H.F. Qi, Y. Su, B.L. Liang, H.B. Tao, B. Liu, D. Chen, X. Su, Y.Q. Huang, T. Zhang, Tuning reactivity of Fischer-Tropsch synthesis by regulating TiOx overlayer over Ru/TiO2 nanocatalysts, Nat. Commun.11 (2020) 3185. [55] S. Zhang J. Gan Z.M. Xia X. Chen Y. Zou X.Z. Duan Y.Q. Qu Dual-active-sites design of Co@C catalysts for ultrahigh selective hydrogenation of N-Heteroarenes Chem 6 2020 1 14 S. Zhang, J. Gan, Z.M. Xia, X. Chen, Y. Zou, X.Z. Duan, Y.Q. Qu, Dual-active-sites design of Co@C catalysts for ultrahigh selective hydrogenation of N-Heteroarenes, Chem6 (2020) 1–14.",
      "scopus-id": "85104911579",
      "coredata": {
        "eid": "1-s2.0-S2468823121001942",
        "dc:description": "Liquid organic hydrogen carriers have been recently developed as the promising hydrogen storage materials, which exhibit significant advantages in hydrogen storage and utilization compared with the conventional hydrogen storage systems. Highly active and sable Ru/SiO2 catalysts for biphenyl hydrogenation to form bicyclohexyl were synthesized through the strong electrostatic adsorption (SEA) method, and the conventional dry impregnation (DI) method was also considered as comparison. X-ray diffraction, X-ray photoelectron spectroscopy, transmission electron microscopy, and H2-temperature-programmed reduction characterization techniques were used to investigate the physicochemical properties of the representative catalysts. The results showed that the catalysts synthesized by the SEA method possessed small-sized and well-dispersed Ru nanoparticles (NPs) on the silica support. Especially, 1.5 wt.% Ru/SiO2 catalyst exhibited excellent catalytic activity, stability and reusability, where the initial turnover frequency (TOF) was 11.9 h−1, the conversion of biphenyl was up to 99.9%, and the yield of bicyclohexyl reached 99.9% under the mild conditions (90 °C, 1.0 MPa H2). Further density functional theory (DFT) calculations elucidate that the catalyst with small Ru nanoparticle size exhibits higher catalytic activity for biphenyl hydrogenation.",
        "openArchiveArticle": "false",
        "prism:coverDate": "2021-05-31",
        "openaccessUserLicense": null,
        "prism:aggregationType": "Journal",
        "prism:url": "https://api.elsevier.com/content/article/pii/S2468823121001942",
        "dc:creator": [
          {
            "@_fa": "true",
            "$": "Su, Wenwei"
          },
          {
            "@_fa": "true",
            "$": "Yang, Jingyi"
          },
          {
            "@_fa": "true",
            "$": "Zhang, Meng"
          },
          {
            "@_fa": "true",
            "$": "Zhao, Zhipeng"
          },
          {
            "@_fa": "true",
            "$": "Han, Jingli"
          },
          {
            "@_fa": "true",
            "$": "Yang, Yongpeng"
          },
          {
            "@_fa": "true",
            "$": "Yang, Jing-He"
          },
          {
            "@_fa": "true",
            "$": "Liu, Zhongyi"
          }
        ],
        "link": [
          {
            "@_fa": "true",
            "@rel": "self",
            "@href": "https://api.elsevier.com/content/article/pii/S2468823121001942"
          },
          {
            "@_fa": "true",
            "@rel": "scidir",
            "@href": "https://www.sciencedirect.com/science/article/pii/S2468823121001942"
          }
        ],
        "dc:format": "application/json",
        "openaccessType": null,
        "pii": "S2468-8231(21)00194-2",
        "prism:volume": "508",
        "articleNumber": "111577",
        "prism:publisher": "Elsevier B.V.",
        "dc:title": "Highly dispersed and ultra-small Ru nanoparticles deposited on silica support as highly active and stable catalyst for biphenyl hydrogenation",
        "prism:copyright": "© 2021 Elsevier B.V. All rights reserved.",
        "openaccess": "0",
        "prism:issn": "24688231",
        "dcterms:subject": [
          {
            "@_fa": "true",
            "$": "Ru/SiO2 catalyst"
          },
          {
            "@_fa": "true",
            "$": "Small-sized Ru nanoparticles"
          },
          {
            "@_fa": "true",
            "$": "Biphenyl hydrogenation"
          },
          {
            "@_fa": "true",
            "$": "Bicyclohexyl"
          },
          {
            "@_fa": "true",
            "$": "Hydrogen storage"
          }
        ],
        "openaccessArticle": "false",
        "prism:publicationName": "Molecular Catalysis",
        "openaccessSponsorType": null,
        "prism:pageRange": "111577",
        "pubType": "fla",
        "prism:coverDisplayDate": "May 2021",
        "prism:doi": "10.1016/j.mcat.2021.111577",
        "prism:startingPage": "111577",
        "dc:identifier": "doi:10.1016/j.mcat.2021.111577",
        "openaccessSponsorName": null
      },
      "objects": {
        "object": [
          {
            "@category": "standard",
            "@height": "180",
            "@width": "301",
            "@_fa": "true",
            "$": "https://api.elsevier.com/content/object/eid/1-s2.0-S2468823121001942-fx1.jpg?httpAccept=%2A%2F%2A",
            "@multimediatype": "JPEG image file",
            "@type": "IMAGE-DOWNSAMPLED",
            "@size": "25243",
            "@ref": "fx1",
            "@mimetype": "image/jpeg"
          },
          {
            "@category": "standard",
            "@height": "286",
            "@width": "602",
            "@_fa": "true",
            "$": "https://api.elsevier.com/content/object/eid/1-s2.0-S2468823121001942-gr4.jpg?httpAccept=%2A%2F%2A",
            "@multimediatype": "JPEG image file",
            "@type": "IMAGE-DOWNSAMPLED",
            "@size": "82615",
            "@ref": "gr4",
            "@mimetype": "image/jpeg"
          },
          {
            "@category": "standard",
            "@height": "610",
            "@width": "357",
            "@_fa": "true",
            "$": "https://api.elsevier.com/content/object/eid/1-s2.0-S2468823121001942-gr3.jpg?httpAccept=%2A%2F%2A",
            "@multimediatype": "JPEG image file",
            "@type": "IMAGE-DOWNSAMPLED",
            "@size": "111136",
            "@ref": "gr3",
            "@mimetype": "image/jpeg"
          },
          {
            "@category": "standard",
            "@height": "652",
            "@width": "652",
            "@_fa": "true",
            "$": "https://api.elsevier.com/content/object/eid/1-s2.0-S2468823121001942-gr2.jpg?httpAccept=%2A%2F%2A",
            "@multimediatype": "JPEG image file",
            "@type": "IMAGE-DOWNSAMPLED",
            "@size": "172739",
            "@ref": "gr2",
            "@mimetype": "image/jpeg"
          },
          {
            "@category": "standard",
            "@height": "276",
            "@width": "339",
            "@_fa": "true",
            "$": "https://api.elsevier.com/content/object/eid/1-s2.0-S2468823121001942-gr1.jpg?httpAccept=%2A%2F%2A",
            "@multimediatype": "JPEG image file",
            "@type": "IMAGE-DOWNSAMPLED",
            "@size": "44826",
            "@ref": "gr1",
            "@mimetype": "image/jpeg"
          },
          {
            "@category": "standard",
            "@height": "257",
            "@width": "338",
            "@_fa": "true",
            "$": "https://api.elsevier.com/content/object/eid/1-s2.0-S2468823121001942-gr8.jpg?httpAccept=%2A%2F%2A",
            "@multimediatype": "JPEG image file",
            "@type": "IMAGE-DOWNSAMPLED",
            "@size": "32024",
            "@ref": "gr8",
            "@mimetype": "image/jpeg"
          },
          {
            "@category": "standard",
            "@height": "229",
            "@width": "602",
            "@_fa": "true",
            "$": "https://api.elsevier.com/content/object/eid/1-s2.0-S2468823121001942-gr7.jpg?httpAccept=%2A%2F%2A",
            "@multimediatype": "JPEG image file",
            "@type": "IMAGE-DOWNSAMPLED",
            "@size": "73904",
            "@ref": "gr7",
            "@mimetype": "image/jpeg"
          },
          {
            "@category": "standard",
            "@height": "209",
            "@width": "602",
            "@_fa": "true",
            "$": "https://api.elsevier.com/content/object/eid/1-s2.0-S2468823121001942-gr6.jpg?httpAccept=%2A%2F%2A",
            "@multimediatype": "JPEG image file",
            "@type": "IMAGE-DOWNSAMPLED",
            "@size": "41134",
            "@ref": "gr6",
            "@mimetype": "image/jpeg"
          },
          {
            "@category": "standard",
            "@height": "426",
            "@width": "602",
            "@_fa": "true",
            "$": "https://api.elsevier.com/content/object/eid/1-s2.0-S2468823121001942-gr5.jpg?httpAccept=%2A%2F%2A",
            "@multimediatype": "JPEG image file",
            "@type": "IMAGE-DOWNSAMPLED",
            "@size": "69186",
            "@ref": "gr5",
            "@mimetype": "image/jpeg"
          },
          {
            "@category": "thumbnail",
            "@height": "131",
            "@width": "219",
            "@_fa": "true",
            "$": "https://api.elsevier.com/content/object/eid/1-s2.0-S2468823121001942-fx1.sml?httpAccept=%2A%2F%2A",
            "@multimediatype": "GIF image file",
            "@type": "IMAGE-THUMBNAIL",
            "@size": "18776",
            "@ref": "fx1",
            "@mimetype": "image/gif"
          },
          {
            "@category": "thumbnail",
            "@height": "104",
            "@width": "219",
            "@_fa": "true",
            "$": "https://api.elsevier.com/content/object/eid/1-s2.0-S2468823121001942-gr4.sml?httpAccept=%2A%2F%2A",
            "@multimediatype": "GIF image file",
            "@type": "IMAGE-THUMBNAIL",
            "@size": "13582",
            "@ref": "gr4",
            "@mimetype": "image/gif"
          },
          {
            "@category": "thumbnail",
            "@height": "164",
            "@width": "96",
            "@_fa": "true",
            "$": "https://api.elsevier.com/content/object/eid/1-s2.0-S2468823121001942-gr3.sml?httpAccept=%2A%2F%2A",
            "@multimediatype": "GIF image file",
            "@type": "IMAGE-THUMBNAIL",
            "@size": "13253",
            "@ref": "gr3",
            "@mimetype": "image/gif"
          },
          {
            "@category": "thumbnail",
            "@height": "164",
            "@width": "164",
            "@_fa": "true",
            "$": "https://api.elsevier.com/content/object/eid/1-s2.0-S2468823121001942-gr2.sml?httpAccept=%2A%2F%2A",
            "@multimediatype": "GIF image file",
            "@type": "IMAGE-THUMBNAIL",
            "@size": "25964",
            "@ref": "gr2",
            "@mimetype": "image/gif"
          },
          {
            "@category": "thumbnail",
            "@height": "164",
            "@width": "201",
            "@_fa": "true",
            "$": "https://api.elsevier.com/content/object/eid/1-s2.0-S2468823121001942-gr1.sml?httpAccept=%2A%2F%2A",
            "@multimediatype": "GIF image file",
            "@type": "IMAGE-THUMBNAIL",
            "@size": "15062",
            "@ref": "gr1",
            "@mimetype": "image/gif"
          },
          {
            "@category": "thumbnail",
            "@height": "164",
            "@width": "215",
            "@_fa": "true",
            "$": "https://api.elsevier.com/content/object/eid/1-s2.0-S2468823121001942-gr8.sml?httpAccept=%2A%2F%2A",
            "@multimediatype": "GIF image file",
            "@type": "IMAGE-THUMBNAIL",
            "@size": "15809",
            "@ref": "gr8",
            "@mimetype": "image/gif"
          },
          {
            "@category": "thumbnail",
            "@height": "83",
            "@width": "219",
            "@_fa": "true",
            "$": "https://api.elsevier.com/content/object/eid/1-s2.0-S2468823121001942-gr7.sml?httpAccept=%2A%2F%2A",
            "@multimediatype": "GIF image file",
            "@type": "IMAGE-THUMBNAIL",
            "@size": "13825",
            "@ref": "gr7",
            "@mimetype": "image/gif"
          },
          {
            "@category": "thumbnail",
            "@height": "76",
            "@width": "219",
            "@_fa": "true",
            "$": "https://api.elsevier.com/content/object/eid/1-s2.0-S2468823121001942-gr6.sml?httpAccept=%2A%2F%2A",
            "@multimediatype": "GIF image file",
            "@type": "IMAGE-THUMBNAIL",
            "@size": "8960",
            "@ref": "gr6",
            "@mimetype": "image/gif"
          },
          {
            "@category": "thumbnail",
            "@height": "155",
            "@width": "219",
            "@_fa": "true",
            "$": "https://api.elsevier.com/content/object/eid/1-s2.0-S2468823121001942-gr5.sml?httpAccept=%2A%2F%2A",
            "@multimediatype": "GIF image file",
            "@type": "IMAGE-THUMBNAIL",
            "@size": "10899",
            "@ref": "gr5",
            "@mimetype": "image/gif"
          },
          {
            "@category": "standard",
            "@_fa": "true",
            "$": "https://api.elsevier.com/content/object/eid/1-s2.0-S2468823121001942-mmc1.docx?httpAccept=%2A%2F%2A",
            "@multimediatype": "Microsoft Word file",
            "@type": "APPLICATION",
            "@size": "8985721",
            "@ref": "mmc1",
            "@mimetype": "application/word"
          },
          {
            "@category": "thumbnail",
            "@_fa": "true",
            "$": "https://api.elsevier.com/content/object/eid/1-s2.0-S2468823121001942-si1.svg?httpAccept=%2A%2F%2A",
            "@multimediatype": "Scalable Vector Graphics file",
            "@type": "ALTIMG",
            "@size": "14553",
            "@ref": "si1",
            "@mimetype": "image/svg+xml"
          },
          {
            "@category": "thumbnail",
            "@_fa": "true",
            "$": "https://api.elsevier.com/content/object/eid/1-s2.0-S2468823121001942-si2.svg?httpAccept=%2A%2F%2A",
            "@multimediatype": "Scalable Vector Graphics file",
            "@type": "ALTIMG",
            "@size": "3041",
            "@ref": "si2",
            "@mimetype": "image/svg+xml"
          },
          {
            "@category": "thumbnail",
            "@_fa": "true",
            "$": "https://api.elsevier.com/content/object/eid/1-s2.0-S2468823121001942-si3.svg?httpAccept=%2A%2F%2A",
            "@multimediatype": "Scalable Vector Graphics file",
            "@type": "ALTIMG",
            "@size": "1146",
            "@ref": "si3",
            "@mimetype": "image/svg+xml"
          },
          {
            "@category": "thumbnail",
            "@_fa": "true",
            "$": "https://api.elsevier.com/content/object/eid/1-s2.0-S2468823121001942-si4.svg?httpAccept=%2A%2F%2A",
            "@multimediatype": "Scalable Vector Graphics file",
            "@type": "ALTIMG",
            "@size": "1504",
            "@ref": "si4",
            "@mimetype": "image/svg+xml"
          },
          {
            "@category": "thumbnail",
            "@_fa": "true",
            "$": "https://api.elsevier.com/content/object/eid/1-s2.0-S2468823121001942-si5.svg?httpAccept=%2A%2F%2A",
            "@multimediatype": "Scalable Vector Graphics file",
            "@type": "ALTIMG",
            "@size": "1702",
            "@ref": "si5",
            "@mimetype": "image/svg+xml"
          },
          {
            "@category": "standard",
            "@_fa": "true",
            "$": "https://api.elsevier.com/content/object/eid/1-s2.0-S2468823121001942-am.pdf?httpAccept=%2A%2F%2A",
            "@multimediatype": "Acrobat PDF file",
            "@type": "AAM-PDF",
            "@size": "1642982",
            "@ref": "am",
            "@mimetype": "application/pdf"
          }
        ]
      },
      "link": {
        "@rel": "abstract",
        "@href": "https://api.elsevier.com/content/abstract/scopus_id/85104911579"
      }
    }
  }
}