{
  "metadata": {
    "title": "Theoretical design of ruthenium single-atom catalysts with different substrates for acetylene hydrochlorination",
    "authors": "; ; ",
    "journal": "Molecular Catalysis",
    "date": "2021-08-31",
    "doi": "10.1016/j.mcat.2021.111826",
    "abstract": "",
    "uri": "https://api.elsevier.com/content/article/pii/S2468823121004430",
    "pii": "S2468823121004430"
  },
  "fulltext": {
    "full-text-retrieval-response": {
      "scopus-eid": "2-s2.0-85113266248",
      "originalText": "serial JL 315758 291210 291744 291790 291809 31 Molecular Catalysis MOLECULARCATALYSIS 2021-08-20 2021-08-20 2021-08-20 2021-08-20 2022-04-22T11:57:53 1-s2.0-S2468823121004430 S2468-8231(21)00443-0 S2468823121004430 10.1016/j.mcat.2021.111826 S300 S300.1 FULL-TEXT 1-s2.0-S2468823121X00132 2022-12-12T23:36:21.627889Z 0 0 20210801 20210831 2021 2021-08-20T04:47:45.152638Z absattachment articleinfo articlenumber articletitlenorm authfirstinitialnorm authfirstsurnamenorm cid cids contenttype copyright crossmark dateloaded dateloadedtxt datesearch datesort dateupdated dco docsubtype doctype doi eid ewtransactionid hubeid indexeddate issn issnnorm itemstage itemtransactionid itemweight openaccess openarchive pg pgfirst pii piinorm pubdateend pubdatestart pubdatetxt pubyr sectiontitle sortorder srctitle srctitlenorm srctype ssids alllist content subj subheadings suppl tomb volfirst volissue volumelist webpdf webpdfpagecount yearnav figure table e-component body mmlmath acknowledge affil appendices articletitle auth authfirstini authfull authkeywords authlast grantnumber grantsponsor grantsponsorid highlightsabst orcid primabst ref specialabst 2468-8231 24688231 true 513 513 C Volume 513 34 111826 111826 111826 202108 August 2021 2021-08-01 2021-08-31 2021 Regular Papers article fla © 2021 Elsevier B.V. All rights reserved. THEORETICALDESIGNRUTHENIUMSINGLEATOMCATALYSTSDIFFERENTSUBSTRATESFORACETYLENEHYDROCHLORINATION JIA Y 1 Introduction 2 Computational methods 3 Results and discussion 3.1 Structural and electronic properties of the six SACs 3.2 Adsorption of reactants and product on different SACs 3.3 Co-adsorption configuration on different SACs 3.4 Catalytic mechanisms of different SACs 3.4.1 Catalytic mechanism over Ru@4 × N6, Ru@4 × N5 and Ru@3 × N5 3.4.2 Catalytic mechanism over Ru@C2N and Ru@CN 3.4.3 Catalytic mechanism over Ru@g-C3N4 3.5 Impact of chlorination of Ru sites 4 Conclusions CRediT authorship contribution statement Acknowledgments Appendix Supplementary materials References SCHOBERT 2014 1743 1760 H LIU 2021 408 P LIN 2017 4182 4247 R NIAN 2019 7635 7644 Y LIU 2020 1093 1101 J TANG 2020 19308 19315 S GAO 2020 111091 Z YANG 2021 2438 2447 Y GONG 2021 3555 3566 L KIM 2021 925 933 H HE 2020 30 Q DAVIES 2016 1600 1607 C CHEN 2020 1865 1870 Z LOU 2020 6094 6101 Y WANG 2020 272 B LIU 2020 110901 X KAISER 2020 376 385 S QIAO 2011 634 641 B YU 2020 1905665 B XIAO 2019 19800 19806 M FAN 2019 10077 10086 M KAISER 2020 11703 11809 S HOU 2020 5502 5510 T VIJAY 2020 7826 7835 S ZHANG 2020 111154 Y MIN 2021 303 Y WU 2019 31043 31049 Q WU 2020 13685 13693 Q TANG 2021 119827 X ZHAO 2020 5773 5777 X ZHANG 2020 17106 17116 M MA 2020 111165 C WANG 2020 10722 10725 B WANG 2020 1683 1691 X SHANG 2017 3510 3520 S LI 2020 10173 10184 J MINGYUAN 2013 120 125 Z KAISER 2019 12297 12304 S MAHMOOD 2017 441 446 J HE 2020 1906972 Q JI 2020 20402 20407 Y TAO 2019 204 214 H SUN 2020 560 567 X YANG 2013 1740 1748 X LIU 2020 1263 K ZHANG 2021 6170 6176 N WANG 2020 6299 6308 H KWEON 2020 1278 D YUAN 2020 26066 26074 M WANG 2019 35228 35237 L ZHOU 2021 355 360 L LI 2020 19319 19327 L ZHAO 2021 4690 4699 Z WU 2019 40 47 C KAISER 2019 359 369 S HAN 2019 104088 G DELLEY 1990 508 517 B DELLEY 2000 7756 7764 B PERDEW 1996 3865 3868 J MONKHORST 1976 5188 5192 H BOERRIGTER 1988 87 113 P GRIMME 2006 1787 1799 S GOVIND 2003 250 258 N LIANG 2020 20453 20462 Z LIANG 2020 54 62 Z JACOBSEN 1987 7423 7442 K LIU 2021 111624 M MEI 2019 118 129 S HAN 2015 7720 7730 Y JIAX2021X111826 JIAX2021X111826XY 2023-08-20T00:00:00.000Z 2023-08-20T00:00:00.000Z http://creativecommons.org/licenses/by-nc-nd/4.0/ © 2021 Elsevier B.V. All rights reserved. 0 https://doi.org/10.15223/policy-017 https://doi.org/10.15223/policy-037 https://doi.org/10.15223/policy-012 https://doi.org/10.15223/policy-029 https://doi.org/10.15223/policy-004 item S2468-8231(21)00443-0 S2468823121004430 1-s2.0-S2468823121004430 10.1016/j.mcat.2021.111826 315758 2022-07-29T00:44:29.774643Z 2021-08-01 2021-08-31 1-s2.0-S2468823121004430-main.pdf https://s3-eu-west-1.amazonaws.com/prod-ucs-content-store-eu-west/content/pii:S2468823121004430/MAIN/application/pdf/720d7bf41b29849884809b43ead5394d/main.pdf main.pdf pdf true 5122475 MAIN 9 1-s2.0-S2468823121004430-main_1.png https://s3-eu-west-1.amazonaws.com/prod-ucs-content-store-eu-west/content/pii:S2468823121004430/PREVIEW/image/png/fe126db2a918fa171fe82ea4a6a7fc6f/main_1.png main_1.png png 59189 849 656 IMAGE-WEB-PDF 1 1-s2.0-S2468823121004430-gr1.jpg https://s3-eu-west-1.amazonaws.com/prod-ucs-content-store-eu-west/content/pii:S2468823121004430/gr1/DOWNSAMPLED/image/jpeg/09df2a3e976f774dbc77c9d98b935c1f/gr1.jpg gr1 gr1.jpg jpg 121183 394 774 IMAGE-DOWNSAMPLED 1-s2.0-S2468823121004430-gr10.jpg https://s3-eu-west-1.amazonaws.com/prod-ucs-content-store-eu-west/content/pii:S2468823121004430/gr10/DOWNSAMPLED/image/jpeg/e3fcd90fc0c901c28eba2c3c39ad175e/gr10.jpg gr10 gr10.jpg jpg 22284 204 339 IMAGE-DOWNSAMPLED 1-s2.0-S2468823121004430-gr6.jpg https://s3-eu-west-1.amazonaws.com/prod-ucs-content-store-eu-west/content/pii:S2468823121004430/gr6/DOWNSAMPLED/image/jpeg/ab5ff8cf6d38ad0fd23580ec7c7bbac1/gr6.jpg gr6 gr6.jpg jpg 31431 210 339 IMAGE-DOWNSAMPLED 1-s2.0-S2468823121004430-gr7.jpg https://s3-eu-west-1.amazonaws.com/prod-ucs-content-store-eu-west/content/pii:S2468823121004430/gr7/DOWNSAMPLED/image/jpeg/22482cc2b8653ac12b2baaef2697d68e/gr7.jpg gr7 gr7.jpg jpg 19592 176 339 IMAGE-DOWNSAMPLED 1-s2.0-S2468823121004430-gr8.jpg https://s3-eu-west-1.amazonaws.com/prod-ucs-content-store-eu-west/content/pii:S2468823121004430/gr8/DOWNSAMPLED/image/jpeg/9c910f9efd2933c7a6ab7f8a7bbe1d55/gr8.jpg gr8 gr8.jpg jpg 21182 190 339 IMAGE-DOWNSAMPLED 1-s2.0-S2468823121004430-gr9.jpg https://s3-eu-west-1.amazonaws.com/prod-ucs-content-store-eu-west/content/pii:S2468823121004430/gr9/DOWNSAMPLED/image/jpeg/f99c5b8a11520b2b5c300055a44502ab/gr9.jpg gr9 gr9.jpg jpg 21553 227 339 IMAGE-DOWNSAMPLED 1-s2.0-S2468823121004430-gr2.jpg https://s3-eu-west-1.amazonaws.com/prod-ucs-content-store-eu-west/content/pii:S2468823121004430/gr2/DOWNSAMPLED/image/jpeg/144d3eb4e5b8d66ccc8d9e43f770094c/gr2.jpg gr2 gr2.jpg jpg 166161 678 527 IMAGE-DOWNSAMPLED 1-s2.0-S2468823121004430-ga1.jpg https://s3-eu-west-1.amazonaws.com/prod-ucs-content-store-eu-west/content/pii:S2468823121004430/ga1/DOWNSAMPLED/image/jpeg/1005ce4846d1d279f25346006b880bd4/ga1.jpg ga1 true ga1.jpg jpg 33514 169 301 IMAGE-DOWNSAMPLED 1-s2.0-S2468823121004430-gr3.jpg https://s3-eu-west-1.amazonaws.com/prod-ucs-content-store-eu-west/content/pii:S2468823121004430/gr3/DOWNSAMPLED/image/jpeg/7242b5c607e1eff2e0e9aba5d69c416a/gr3.jpg gr3 gr3.jpg jpg 87199 176 774 IMAGE-DOWNSAMPLED 1-s2.0-S2468823121004430-gr4.jpg https://s3-eu-west-1.amazonaws.com/prod-ucs-content-store-eu-west/content/pii:S2468823121004430/gr4/DOWNSAMPLED/image/jpeg/b9eb3a6daeeb24d6da6160605f5f9f5a/gr4.jpg gr4 gr4.jpg jpg 61945 274 623 IMAGE-DOWNSAMPLED 1-s2.0-S2468823121004430-gr5.jpg https://s3-eu-west-1.amazonaws.com/prod-ucs-content-store-eu-west/content/pii:S2468823121004430/gr5/DOWNSAMPLED/image/jpeg/29289733e37009600eecba35eb0966c5/gr5.jpg gr5 gr5.jpg jpg 21401 181 339 IMAGE-DOWNSAMPLED 1-s2.0-S2468823121004430-gr1.sml https://s3-eu-west-1.amazonaws.com/prod-ucs-content-store-eu-west/content/pii:S2468823121004430/gr1/THUMBNAIL/image/gif/fdaf82d6a0bd9e2a05a86a2fa6c9d920/gr1.sml gr1 gr1.sml sml 14476 112 219 IMAGE-THUMBNAIL 1-s2.0-S2468823121004430-gr10.sml https://s3-eu-west-1.amazonaws.com/prod-ucs-content-store-eu-west/content/pii:S2468823121004430/gr10/THUMBNAIL/image/gif/2790b2e53779065f7a530c2e7d5631a9/gr10.sml gr10 gr10.sml sml 9689 132 219 IMAGE-THUMBNAIL 1-s2.0-S2468823121004430-gr6.sml https://s3-eu-west-1.amazonaws.com/prod-ucs-content-store-eu-west/content/pii:S2468823121004430/gr6/THUMBNAIL/image/gif/927056e100799e2c04a35d42a6f58d3d/gr6.sml gr6 gr6.sml sml 15142 136 219 IMAGE-THUMBNAIL 1-s2.0-S2468823121004430-gr7.sml https://s3-eu-west-1.amazonaws.com/prod-ucs-content-store-eu-west/content/pii:S2468823121004430/gr7/THUMBNAIL/image/gif/c332d7c208f5176aa46452d46321cd2b/gr7.sml gr7 gr7.sml sml 10689 114 219 IMAGE-THUMBNAIL 1-s2.0-S2468823121004430-gr8.sml https://s3-eu-west-1.amazonaws.com/prod-ucs-content-store-eu-west/content/pii:S2468823121004430/gr8/THUMBNAIL/image/gif/d01b865963c44ae30d7cc399daa963fd/gr8.sml gr8 gr8.sml sml 11200 123 219 IMAGE-THUMBNAIL 1-s2.0-S2468823121004430-gr9.sml https://s3-eu-west-1.amazonaws.com/prod-ucs-content-store-eu-west/content/pii:S2468823121004430/gr9/THUMBNAIL/image/gif/78bdbe9b0e9206c8812672c50ca3f5fc/gr9.sml gr9 gr9.sml sml 8463 146 219 IMAGE-THUMBNAIL 1-s2.0-S2468823121004430-gr2.sml https://s3-eu-west-1.amazonaws.com/prod-ucs-content-store-eu-west/content/pii:S2468823121004430/gr2/THUMBNAIL/image/gif/f70634d5972c1f6ef636b4569e5bd333/gr2.sml gr2 gr2.sml sml 14761 163 127 IMAGE-THUMBNAIL 1-s2.0-S2468823121004430-ga1.sml https://s3-eu-west-1.amazonaws.com/prod-ucs-content-store-eu-west/content/pii:S2468823121004430/ga1/THUMBNAIL/image/gif/1f062666dde0ba9b4d4ac4eb6228ce98/ga1.sml ga1 true ga1.sml sml 17670 123 219 IMAGE-THUMBNAIL 1-s2.0-S2468823121004430-gr3.sml https://s3-eu-west-1.amazonaws.com/prod-ucs-content-store-eu-west/content/pii:S2468823121004430/gr3/THUMBNAIL/image/gif/174adc798df9a7758067e33e84effa43/gr3.sml gr3 gr3.sml sml 10877 50 219 IMAGE-THUMBNAIL 1-s2.0-S2468823121004430-gr4.sml https://s3-eu-west-1.amazonaws.com/prod-ucs-content-store-eu-west/content/pii:S2468823121004430/gr4/THUMBNAIL/image/gif/ccaa7b6afa488e64cbad5fd0f759222a/gr4.sml gr4 gr4.sml sml 10501 96 219 IMAGE-THUMBNAIL 1-s2.0-S2468823121004430-gr5.sml https://s3-eu-west-1.amazonaws.com/prod-ucs-content-store-eu-west/content/pii:S2468823121004430/gr5/THUMBNAIL/image/gif/142ee8b3bb805a708a926ffd72ad516a/gr5.sml gr5 gr5.sml sml 11168 117 219 IMAGE-THUMBNAIL 1-s2.0-S2468823121004430-gr1_lrg.jpg https://s3-eu-west-1.amazonaws.com/prod-ucs-content-store-eu-west/content/pii:S2468823121004430/gr1/HIGHRES/image/jpeg/36bde9976ba5bb13542d6370341ce9f2/gr1_lrg.jpg gr1 gr1_lrg.jpg jpg 998800 1745 3425 IMAGE-HIGH-RES 1-s2.0-S2468823121004430-gr10_lrg.jpg https://s3-eu-west-1.amazonaws.com/prod-ucs-content-store-eu-west/content/pii:S2468823121004430/gr10/HIGHRES/image/jpeg/6bee73f51376bbc3ba28ecbe902e0ada/gr10_lrg.jpg gr10 gr10_lrg.jpg jpg 165356 901 1500 IMAGE-HIGH-RES 1-s2.0-S2468823121004430-gr6_lrg.jpg https://s3-eu-west-1.amazonaws.com/prod-ucs-content-store-eu-west/content/pii:S2468823121004430/gr6/HIGHRES/image/jpeg/2d9a7c06c6397c03a1f27c252fb3eb7b/gr6_lrg.jpg gr6 gr6_lrg.jpg jpg 238569 929 1500 IMAGE-HIGH-RES 1-s2.0-S2468823121004430-gr7_lrg.jpg https://s3-eu-west-1.amazonaws.com/prod-ucs-content-store-eu-west/content/pii:S2468823121004430/gr7/HIGHRES/image/jpeg/977e48d78b35478c33a4e99de9c8c83d/gr7_lrg.jpg gr7 gr7_lrg.jpg jpg 145052 780 1500 IMAGE-HIGH-RES 1-s2.0-S2468823121004430-gr8_lrg.jpg https://s3-eu-west-1.amazonaws.com/prod-ucs-content-store-eu-west/content/pii:S2468823121004430/gr8/HIGHRES/image/jpeg/2b8fcd80de950e785ceefb1b80e7efe0/gr8_lrg.jpg gr8 gr8_lrg.jpg jpg 154624 842 1500 IMAGE-HIGH-RES 1-s2.0-S2468823121004430-gr9_lrg.jpg https://s3-eu-west-1.amazonaws.com/prod-ucs-content-store-eu-west/content/pii:S2468823121004430/gr9/HIGHRES/image/jpeg/56c9302414fb7745582b727797b4a1d7/gr9_lrg.jpg gr9 gr9_lrg.jpg jpg 131916 1003 1500 IMAGE-HIGH-RES 1-s2.0-S2468823121004430-gr2_lrg.jpg https://s3-eu-west-1.amazonaws.com/prod-ucs-content-store-eu-west/content/pii:S2468823121004430/gr2/HIGHRES/image/jpeg/ef64a93fd8280bf97c70f61370116631/gr2_lrg.jpg gr2 gr2_lrg.jpg jpg 1145102 3002 2333 IMAGE-HIGH-RES 1-s2.0-S2468823121004430-ga1_lrg.jpg https://s3-eu-west-1.amazonaws.com/prod-ucs-content-store-eu-west/content/pii:S2468823121004430/ga1/HIGHRES/image/jpeg/fa9ba9480ae8f4e7b147ace3a2c28a44/ga1_lrg.jpg ga1 true ga1_lrg.jpg jpg 266584 750 1333 IMAGE-HIGH-RES 1-s2.0-S2468823121004430-gr3_lrg.jpg https://s3-eu-west-1.amazonaws.com/prod-ucs-content-store-eu-west/content/pii:S2468823121004430/gr3/HIGHRES/image/jpeg/a011d6cca1d69a962752fdaabdd95e67/gr3_lrg.jpg gr3 gr3_lrg.jpg jpg 680038 778 3425 IMAGE-HIGH-RES 1-s2.0-S2468823121004430-gr4_lrg.jpg https://s3-eu-west-1.amazonaws.com/prod-ucs-content-store-eu-west/content/pii:S2468823121004430/gr4/HIGHRES/image/jpeg/81633675d0b06aa3c0afdf03fd69a3b7/gr4_lrg.jpg gr4 gr4_lrg.jpg jpg 487179 1211 2758 IMAGE-HIGH-RES 1-s2.0-S2468823121004430-gr5_lrg.jpg https://s3-eu-west-1.amazonaws.com/prod-ucs-content-store-eu-west/content/pii:S2468823121004430/gr5/HIGHRES/image/jpeg/81e0ef3ca45e3219cfafef262b7d7dce/gr5_lrg.jpg gr5 gr5_lrg.jpg jpg 161580 802 1500 IMAGE-HIGH-RES 1-s2.0-S2468823121004430-mmc1.docx https://s3-eu-west-1.amazonaws.com/prod-ucs-content-store-eu-west/content/pii:S2468823121004430/mmc1/MAIN/application/vnd.openxmlformats-officedocument.wordprocessingml.document/652a3dc9d3cf23ba8094049b638c7004/mmc1.docx mmc1 mmc1.docx docx 113815794 APPLICATION 1-s2.0-S2468823121004430-si1.svg https://s3-eu-west-1.amazonaws.com/prod-ucs-content-store-eu-west/content/pii:S2468823121004430/STRIPIN/image/svg+xml/239a346832c3b5f47b78784c7621e823/si1.svg si1 si1.svg svg 15084 ALTIMG 1-s2.0-S2468823121004430-si2.svg https://s3-eu-west-1.amazonaws.com/prod-ucs-content-store-eu-west/content/pii:S2468823121004430/STRIPIN/image/svg+xml/cc65a85a4664113538660020ee70c694/si2.svg si2 si2.svg svg 9125 ALTIMG 1-s2.0-S2468823121004430-am.pdf am am.pdf pdf 4981897 AAM-PDF https://s3-eu-west-1.amazonaws.com/prod-ucs-content-store-eu-west/content/egi:10RVW4412F5/MAIN/application/pdf/b1699c6cb714f70f4542b9f3d0332211/am.pdf MCAT 111826 111826 S2468-8231(21)00443-0 10.1016/j.mcat.2021.111826 Fig. 1 The optimized structure of (a) Ru atom loaded on different substrates. The gray, blue, dark green and white balls represent C, N, Ru and H atoms, respectively. (b) The electrostatic potential of different catalysts. (Electron density: 0.001) (c) Electron density difference patterns for each catalyst. For the scale bar of -0.15–0.15, the blue region indicates an increase in electrons and the red region indicates a decrease in electrons. Fig 1 Fig. 2 The adsorption configurations of HCl, C2H2 and VCM on (a) Ru@4 × N6, (b) Ru@4 × N5, (c) Ru@3 × N5, (d) Ru@C2N, (e) Ru@CN and (f) Ru@g-C3N4. The gray, blue, dark green, white and light green balls represent C, N, Ru, H and Cl atoms, respectively. Fig 2 Fig. 3 The co-adsorption configurations (top panel) and electron density difference (bottom panel, iso-surface: 0.05) on (a) Ru@4 × N6, (b) Ru@4 × N5, (c) Ru@3 × N5, (d) Ru@C2N, (e) Ru@CN and (f) Ru@g-C3N4. The gray, blue, dark green, white and light green balls represent C, N, Ru, H and Cl atoms, respectively. Fig 3 Fig. 4 PDOS of the co-adsorption configurations on (a) Ru@4 × N5 and (b) Ru@C2N. Fig 4 Fig. 5 The acetylene hydrochlorination reaction pathway over Ru@4 × N6. Relative energies (kcal/mol) were calculated at 453 K. Fig 5 Fig. 6 PDOS of the reaction mechanism over Ru@4 × N6. Fig 6 Fig. 7 The acetylene hydrochlorination reaction pathway over Ru@CN. Relative energies (kcal/mol) were calculated at 453 K. Fig 7 Fig. 8 The acetylene hydrochlorination reaction pathway over Ru@g-C3N4. Relative energies (kcal/mol) were calculated at 453 K. Fig 8 Fig. 9 The acetylene hydrochlorination reaction pathway over all the catalysts studied. Relative energies (kcal/mol) were calculated at 453 K. Fig 9 Fig. 10 The acetylene hydrochlorination reaction pathway over RuCl@4 × N6. Relative energies (kcal/mol) were calculated at 453 K. Fig 10 Table 1 The adsorption energies of HCl, C2H2 and VCM on different catalysts (kcal/mol). Table 1 E ads Ru@4 × N6 Ru@4 × N5 Ru@3 × N5 Ru@C2N Ru@CN Ru@g-C3N4 ads-HCl -10.27 -8.70 -15.57 -47.75 -38.51 -24.16 ads-C2H2 -44.24 -35.17 -38.87 -30.09 -38.82 -33.07 ads-VCM -16.80 -15.33 -18.51 -9.59 -15.68 -15.71 Table 2 The free energy barrier of the rate-limiting step on all the catalysts studied (kcal/mol). Table 2 Catalyst Ru@4 × N6 Ru@4 × N5 Ru@4 × N5 Ru@C2N Ru@CN Ru@g-C3N4 Energy barrier 16.83 22.24 43.87 27.29 24.32 49.06 Table 3 The binding energy of RuClx loaded on different substrates (kcal/mol). Table 3 Catalyst Ru RuCl1 RuCl2 RuCl3 4 × N6 -175.65 -152.89 -116.99 -93.53 3 × N5 -178.71 -167.27 -138.27 -129.63 CN -115.02 -108.46 -71.07 -63.91 Theoretical design of ruthenium single-atom catalysts with different substrates for acetylene hydrochlorination Yiming Jia Conceptualization Methodology Formal analysis Investigation Writing – original draft Visualization Yao Nian Formal analysis Writing – review & editing Visualization Jinli Zhang Resources You Han Data curation Writing – review & editing Project administration Funding acquisition Supervision ⁎ School of Chemical Engineering and Technology, Tianjin University, 92 Weijin Road, Tianjin 300072, China School of Chemical Engineering and Technology Tianjin University 92 Weijin Road Tianjin 300072 China School of Chemical Engineering and Technology, Tianjin University, 92 Weijin Road, Tianjin 300072, China ⁎ Corresponding author. Ruthenium-based catalysts exhibit excellent catalyst activity in the acetylene hydrochlorination reaction and tend to be a good substitute for mercury-based catalysts due to their cheaper price among the precious metal catalysts. In this work, spin-polarized density functional theory (DFT) calculations were carried out to investigate the properties of the ruthenium single-atom catalysts supported on six different substrates (four pyridine nitrogen-doped carbon, four or three pyrrole nitrogen-doped carbon, C2N, CN and g-C3N4), and the reaction mechanisms of acetylene hydrochlorination catalyzed by them at 453 K. According to the results of calculations, it could be found that the reaction had the lowest free energy barrier of 16.83 kcal/mol on the Ru@4 × N6 (pyridine nitrogen-doped carbon), while it had the highest free energy barrier of 49.06 kcal/mol on the Ru@g-C3N4. This work will provide a theoretical support for the design of ruthenium single-atom catalysts for acetylene hydrochlorination reaction. Graphical abstract Image, graphical abstract Keywords Acetylene hydrochlorination Mechanism Density functional theory Ru single-atom catalyst 1 Introduction Vinyl chloride monomer (VCM) is an important chemical material, usually used for the production of polyvinyl chloride (PVC), which is widely used in the field of industry, construction, agriculture as a kind of common engineering plastic. Since China has more coal than oil resource, VCM is generally produced through the route of acetylene hydrochlorination reaction [1,2]. However, the catalyst used in industrial production is mostly mercury-based catalyst, which is harmful to human health and environment [3,4]. Therefore, it is significant to develop mercury-free catalysts which are efficient and environmentally friendly. Recently, single-atom catalysts (SACs) which contain metal atoms dispersed on a substrate at the atomic level have received widespread attention. SACs have shown outstanding performance in several reactions such as nitrogen reduction reaction [5–7], hydrogen evolution reaction [8], CO2 reduction reaction [9–11], etc. Various metals such as the noble metals Au [12–14], Pd [11,15,16], Pt [17,18], Ru [19–22] and non-noble metals Fe [23–25], Co [26], Cu [27–29] and Ni [30–32] have been applied as catalytic sites in single-atom catalysts for catalytic reactions and perform well. Ruthenium, an element of the platinum group metals, has cheaper price among the precious metal. In recent years, there have been more and more studies on ruthenium-based catalysts for acetylene hydrochlorination, and their excellent activity, stability, and price advantage have been affirmed by numerous researches [33–36]. Meanwhile, density functional theory (DFT) calculations were executed by Zhu et al. [37] to explore the energy barriers for acetylene hydrochlorination reaction catalyzed by HgCl2, AuCl3 and RuCl3 as 16.3 kcal/mol, 11.9 kcal/mol and 9.1 kcal/mol, respectively. After comparison, it could be observed that the reaction catalyzed by RuCl3 had the lowest energy barrier, indicating that the Ru-based catalyst was more suitable for the acetylene hydrochlorination reaction. Kaiser et al. [38] synthesized a series of Ru-based catalysts and found that RuOxCly as the active component could achieve the same activity level as Au-based catalysts. Although RuCl3 species as single-atom active sites were reported as inferior catalysts compared to RuOxCly nanoparticles in this work, it is possible to enhance the activity of single-atom catalysts by regulating the coordination environment of Ru through different substrates. Generally, Ru single-atom catalyst has already been investigated in the HER [39,40] and NRR [41,42], however, they have rarely been explored for catalytic hydrochlorination of acetylene [43]. All above studies on single-atom catalysts can prove that, in some cases, SACs have better performance on stability, catalytic activity and selectivity due to their special structure. As the size of the metal bulk decreases, the atomic utilization rate will reach the theoretical maximum value when single atom is loaded, and sometimes exhibits better catalytic performance than NP-based catalysts, however, there is no doubt that the cohesive energy of the metal surface rises sharply in this process [44]. Isolated single metal atoms tend to agglomerate easily, so it is very important to find a suitable substrate to anchor single metal atom stably [45]. Therefore, metal oxides [46,47], carbon nanotubes [48,49], MOF [50,51] and nitrogen doped graphene [52–55] have been investigated to act as substrates. Among them, carbon materials are excellent substrates for dispersing metal atoms because of their large specific surface area, excellent conductivity and superior mechanical strength, while manufacturing defects and N doping can anchor single atoms more stably and prevent their agglomeration [56]. In this study, single-atom Ru was anchored by N atoms on the different nitrogen doped carbon-based supports to form Ru-N structure. DFT was used to investigate the acetylene hydrochlorination reaction mechanism over different catalysts, and the results revealed the reactants adsorption, free energy barrier and reaction mechanism for this reaction. All of the above will provide new insights to design novel Ru single-atom catalysts for acetylene hydrochlorination. 2 Computational methods The spin-polarized DFT calculations were carried out by the DMol3 code in Materials Studio software [57,58]. The unconstrained geometry optimizations were calculated using the Perdew-Burke-Ernzerhof (PBE) [59] exchange-correlation functional in the generalized gradient approximation (GGA) with a double numerical plus polarization (DNP) basis set for all the atoms. 20 Å vacuum slab was added along the z-direction to ensure no potential interactions between each layer, and the k-point was set as a 3 × 3 × 1 mesh with the orbital cutoff of 4.7 Å [60,61]. Grimme method for DFT-D correction [62] was taken into account and all electron relativistic was selected as the core treatment to improve the accuracy of the results. Other parameters were automatically set, which were optimized during the calculation process. The convergence tolerance of energy, maximum force and maximum displacement were 0.00005 Hartree, 0.002 Hartree per Å and 0.005 Å, respectively. In addition, a smearing of 0.005 Hartree was set to accelerate SCF convergence. The adsorption energy (E ads) between the reactants/products and the catalyst could be used to show the interaction between them. E ads was defined as: E ads = E adsorption state − E free molecule − E catalyst where E adsorption state is the total energy of catalyst with adsorbed reactants/products, E free molecule is the energy of the free reactants/products and E catalyst is the energy of the clean catalyst. Complete linear synchronous transit and quadratic synchronous transit (LST/QST) protocol in DMol3 code was used to search transition state [63], and vibrational frequency analysis was applied to confirm the stationary point. The transition state should have only one imaginary eigenvalue whose vibrational mode corresponds to the reaction coordinate. TS confirmation further verifies that current transition state connects to the reactant and product directly. Considering the influence of real reaction conditions of 453 K and 1 atm, the highest Gibbs free energy barrier (ΔG 453) of the entire reaction pathway was chosen as the activation energy. Δ G 453 = G 453 T S − G 453 s t a t e where G 453 TS is the Gibbs free energy of TS under 453 K, G 453 state is the Gibbs free energy of co-ads or IM configuration under 453 K. What's more, Mulliken charge, density of states (DOS) and electron density difference (EDD) patterns were analyzed to better understand the reaction mechanism. 3 Results and discussion 3.1 Structural and electronic properties of the six SACs In this study, six Ru SACs with different substrates (4 × N6, 4 × N5, 3 × N5, C2N, CN, g-C3N4) were selected to investigate the influence on the catalytic activity for acetylene hydrochlorination reaction. The binding energy of metal atom loaded on different substrates were all negative, which meant Ru atom could disperse stably at the atomic level instead of agglomerating [64] (Table S1, ESI†). Among them, 4 × N6, 4 × N5 and 3 × N5 substrates exhibited better capture ability. The stable structures of the six catalysts are shown in Fig. 1 (a), where all the substrates were two-dimensional layered materials. In the Ru@4 × N6 and Ru@3 × N5, Ru tended to be anchored in the center of the cavity by forming Ru-N bonds with the distance of 1.986 and 1.965 Å. The distance of Ru out of the plane layer was 0.697 and 0.911 Å. In the Ru@4 × N5, Ru was also supported in the center of the four-fold cavity with the four Ru-N bonds distances of 2.112 Å. However, Ru was not out of the plane layer probably due to the adequate space of four-fold cavity. In the Ru@C2N and Ru@CN, these two kinds of substrates had similar binding behaviors to metal atom, on which Ru was loaded in the corner of the six-fold cavity rather than the center by two Ru-N bonds with the lengths range of 2.002–2.022 Å. Interestingly, it was found that Ru bound to two pyridine N which not connected to the same C by comparing all the possible binding sites of Ru in the Ru@g-C3N4. The electrostatic potential on different catalysts is shown in Fig. 1 (b). The darker red region represented the more negative charges accumulated, while the darker blue region represented the more positive charges accumulated. According to the patterns of Ru@4 × N6, Ru@4 × N5, the negative charge was enriched where the N atoms were, while on Ru@3 × N5, the positive charge gathered around Ru atom, on the other three catalysts, the positive charge gathered around Ru atom, and the negative charge gathered around the N atoms opposite to Ru site. Therefore, the electrophilic reaction tends to occur on the N site enriched with negative charges, while the nucleophilic reaction tends to occur on the Ru site enriched with positive charges. Combining with the electrostatic potential of reactants (Fig. S1, ESI†), the sites where the reactants interacted with catalyst can be predicted. To further clarify the properties of these catalysts, a series of calculations were carried out. The Mulliken charges of Ru atoms in Ru@4 × N6, Ru@4 × N5, Ru@3 × N5, Ru@C2N, Ru@CN and Ru@ g-C3N4 were 0.591 e, 0.558 e, 0.677, 0.611 e, 0.638 e and 0.531 e (Table S3, ESI†), respectively. The positive Mulliken charges indicated that the Ru atoms donated electrons to the substrates, which were consistent with the EDD pattern of each catalyst. As shown in Fig. 1 (c), the blue region surrounding the Ru atom represented the area where the electrons decreased, while the red region surrounding the N atom represented the area where the electrons increased. The results obtained from EDD patterns were in accordance with those from Mulliken charge analysis, which also confirmed the electrons transfer from Ru atom to the N atom of the substrates. In addition, the intersection of the red and blue regions was nearly in the middle of the two atoms, which indicated that a covalent Ru-N bond was formed. In brief, strong metal-support interaction can not only promote the metal stable distribution, but also tune the electronic structure of catalyst. 3.2 Adsorption of reactants and product on different SACs Catalysts with different structures and electronic structures show different adsorption abilities for reactants and product. The stable adsorption configurations and adsorption energies of the six SACs are shown in Fig. 2 and Table 1 . Since the configuration of Ru@4 × N6 was almost the same as that of Ru@4 × N5, the adsorption configurations of reactants and product on them were also similar. HCl was adsorbed nearly vertically on the catalyst surface through the interaction of H and Ru, with the distances of 2.003–2.087 Å. In addition, the H-Cl bond lengths of the adsorbed HCl were 1.359–1.383 Å, while free HCl was only 1.289 Å. These results indicated that HCl was obviously activated by the active site. In contrast, HCl was adsorbed on Ru@3 × N5 through the interaction of Ru and Cl and the interaction of C and H, where the activated H-Cl bond length was 1.319 Å. However, when HCl adsorbed on the other three SACs (Ru@C2N, Ru@CN and Ru@g-C3N4), the Cl of HCl formed the coordination bonds with Ru atoms of catalysts, with the bond lengths of 2.288–2.395 Å. Meanwhile, the H of HCl was captured by the N atom on the opposite side of the six-fold cavity, with the distances of 1.027–1.047 Å. The H-Cl bonds were stretched to 2.133–3.351 Å owing to the different adsorption sites on catalysts for the two atoms of HCl. These results could be considered that H-Cl bond had been broken, which meant that HCl dissociated and adsorbed on the catalysts. Through calculation, the adsorption energies of HCl on the Ru@4 × N6, Ru@4 × N5, Ru@3 × N5, Ru@C2N, Ru@CN and Ru@g-C3N4 were -10.27 kcal/mol, -8.70 kcal/mol, -15.57 kcal/mol, -47.75 kcal/mol, -38.51 kcal/mol and -24.16 kcal/mol, respectively. Obviously, the adsorption energy of HCl increased as the distance between H and Cl increased, indicating the higher activation degree of HCl, and the stronger interaction with catalysts. Different from the HCl adsorption, the adsorption configurations of C2H2 on the different catalysts were similar. The C of C2H2 bound to Ru, forming two Ru-C bonds, with the lengths of 2.042–2.153 Å when C2H2 adsorbed on the catalysts. The structures of C2H2 also changed after adsorption. Both H atoms of C2H2 shifted away from the catalyst, with the CC bonds were stretched from 1.259 to 1.293 Å, and the C2H2 molecule no longer maintained a linear configuration, which all indicated the activation of C2H2. The adsorption energies of C2H2 on the Ru@4 × N6, Ru@4 × N5, Ru@3 × N5, Ru@C2N, Ru@CN and Ru@g-C3N4 were -44.24 kcal/mol, -35.17 kcal/mol, -38.87 kcal/mol, -30.09 kcal/mol, -38.82 kcal/mol, -33.07 kcal/mol, respectively, which meant strong chemical interactions between C2H2 and all catalysts. The difference in adsorption of C2H2 among different catalysts could be explained by d-band center theory, as for Ru@4 × N6, Ru@3 × N5 and Ru@CN with stronger adsorption of C2H2, the d-band center was closer to the Fermi energy level compared with others [65,66] (Table S4, ESI†). Additionally, d-band center could also explain why Ru@4 × N6 had better activation ability for reactants compared to Au and Pt SACs identified the same site (Fig. S2, Tables S5–S7, ESI†). It is generally believed that the activation of acetylene has an important effect on promoting the hydrochlorination reaction, therefore, ab initio molecular dynamic (AIMD) was carried out to confirm the stability of the configuration with the strongest adsorption of acetylene [67] (Figs. S3 and S4, ESI†). Furthermore, the product VCM was adsorbed due to the interaction between Cl and Ru, with the adsorption energies were -16.80 kcal/mol, -15.33 kcal/mol, -9.59 kcal/mol, -18.51 kcal/mol, -15.68 kcal/mol, -15.71 kcal/mol, respectively. The low adsorption energy indicated that the product was physically adsorbed on the catalyst surface so it was easy to desorb from the catalyst, avoiding the deactivation of the catalyst caused by covering the active sites. The Mulliken charges of reactants were analyzed (Tables S8 and S9, ESI†), it was found that the H atom in HCl lost electrons, while Cl atom got electrons during the adsorption of HCl by all the catalysts. Subsequently, the H-Cl bond activated in different degree with HCl no longer maintained electrical neutrality. HCl obtained 0.112 e, 0.086 e, and 0.073 e over Ru@4 × N6, Ru@4 × N5 and Ru@g-C3N4, respectively, whereas over the other three catalysts Ru@3 × N5, Ru@C2N and Ru@CN, HCl lost 0.145 e, 0.004 e and 0.011 e. These results indicated that catalysts with different substrates played different roles in HCl activation process, acting as electron donors or electron acceptors. Combining with the comparison of adsorption energies, it was obvious that there might be a stronger interaction between HCl and catalyst with larger degree of HCl activation when electrons were transferred from HCl to catalysts, which was in accordance with the ideas of adding alkaline sites [33]. As for the adsorption behaviors of C2H2, the other five catalysts all acted as electron acceptors, except for Ru@g-C3N4. The Mulliken charges of activated C2H2 were 0.100 e, 0.229 e, 0.025 e, 0.156 e, 0.055 e and -0.062 e, respectively. 3.3 Co-adsorption configuration on different SACs Based on the above results of separate adsorption of each reactant, the most stable co-adsorption configurations on these catalysts were investigated (Fig. 3 ). Obviously, the adsorption energies of HCl were much smaller than those of C2H2 on Ru@4 × N6, Ru@4 × N5 and Ru@3 × N5, thus the adsorption of HCl was carried out based on the adsorption of C2H2. It could be observed from the most stable adsorption configuration that on Ru@3 × N5, the Ru single-atom site which adsorbed C2H2 could still interact with Cl atom of HCl. However, it was found that the Ru active sites which had adsorbed C2H2 could not adsorb HCl simultaneously, due to the saturated coordination states of the Ru atoms on Ru@4 × N6 and Ru@4 × N5. Therefore, HCl was adsorbed by the interaction of H with adjacent pyridine N. C2H2 and HCl were adsorbed on the catalyst surface together, and formed a “T-structure”, which was similar to the adsorption structure without catalyst. In the most stable co-adsorption configuration, C2H2 was adsorbed and activated over Ru site, with the CC bond lengths of 1.281 and 1.265 Å. The C-Ru bond lengths were 2.092∼2.112 Å, and the molecule lost its linear configuration. Apparently, HCl was adsorbed and activated by adjacent pyridine N with the H-N distance of 2.835 and 2.677 Å, and the H-Cl bond lengths were stretched to 1.306 and 1.301 Å. There was no doubt that C2H2 was preferentially adsorbed by the catalyst over Ru@CN and Ru@g-C3N4 due to the larger adsorption energies for C2H2 than HCl, however, there were some differences from the above three catalysts. In the co-adsorption configurations, Ru active sites which had already adsorbed C2H2 still donated to the adsorption of HCl and the H-Cl bond lengths were 3.927 and 2.221 Å, respectively, which revealed that HCl was still dissociated and adsorbed. The Cl of HCl interacted with Ru and formed Ru-Cl bonds with the lengths of 2.341 and 2.402 Å, while the H of HCl adsorbed by the pyridine N on the opposite side of the Ru atom and the N-H bonds were 1.030 and 1.045 Å. As for Ru@C2N, HCl was dissociated and adsorbed firstly, where the coordination bond of Ru-Cl was 2.371 Å and the length of N-H bond was 1.027 Å and then C2H2 was captured and activated by Ru site by forming two Ru-C bonds. The EDD patterns of the co-adsorption configurations are shown in the bottom panel of Fig. 3, blue and yellow regions represented electron accumulation between Ru and C atom and electron depletion of Ru atom, respectively. To further understand the bond formation in the co-adsorption configurations over different catalysts, the electronic partial density of states (PDOS) was carried out. Herein, only Ru@4 × N5 and Ru@C2N are selected as representatives for analysis, more details are exhibited in supporting information. Fig. 4 (a) shows the PDOS patterns before and after reactants co-adsorbed on Ru@4 × N5. Through comparison, it was obvious that the electronic states of s and d orbitals of Ru atom were significantly reduced after the co-adsorption, which was same as the charge analysis (Table S10, ESI†), in which the Mulliken charge of Ru in the co-adsorption configuration was reduced compared to the clean catalyst. Furthermore, the bonding orbital and antibonding orbital between the d orbital of Ru in the catalyst and the p orbital of C in the C2H2 formed obviously near the Fermi level, indicating the formation of the Ru-C bond. However, the s orbital of H1 in HCl was not hybridized with the s or d orbital of Ru, which meant that HCl was not adsorbed or activated on Ru sites. This result was consistent with the observed co-adsorption configuration. Fig. 4(b) shows the PDOS patterns before and after reactants co-adsorbed on Ru@C2N. After adsorption, the electronic states of s and d orbitals of Ru atom also decreased dramatically, and the d orbital of Ru in the catalyst and the p orbital of C in the C2H2 were hybridized near the fermi level. The hybridization of orbitals illustrated the interaction between C2H2 and the Ru active site. In addition, the s orbital of H1 in HCl and the p orbital of N which anchored metal atoms on the catalyst were partially hybridized, while the p orbital of Cl in HCl and the d orbital of Ru were also hybridized. These results proved that HCl was dissociated in which Cl atom was adsorbed by Ru site, and H was captured by N atom. In summary, for these six catalysts, Ru atom and N atom acted as dual active sites to adsorb and activate the reactants, the reaction occurred between the adsorbed HCl and adsorbed C2H2 subsequently, therefore, the reaction should follow the Langmuir-Hinshelwood (L-H) mechanism. 3.4 Catalytic mechanisms of different SACs The study of the entire catalytic pathway of acetylene hydrochlorination started with the isolated catalyst and the gas phase reactants whose total energy was regarded as the zero point of free energy. The reaction was initiated by the co-adsorption and activation of the two reactants, after passing several transition states and intermediates, the product VCM was generated and then finally desorbed from the catalyst surface. 3.4.1 Catalytic mechanism over Ru@4 × N6, Ru@4 × N5 and Ru@3 × N5 Herein, Ru@4 × N6 was selected to discuss the catalytic mechanism in detail (Fig. 5 ), since the reaction pathway over Ru@4 × N5 and Ru@3 × N5 were similar. After C2H2 and HCl were adsorbed on the catalyst surface, the H1 atom of HCl moved to C1 of *C2H2, and the Cl atom of HCl moved in the opposite direction. Meanwhile, the distance between C1-H1 was shortened from 2.284 Å in co-adsorption to 1.098 Å in transition state 1 (TS1), and the H1-Cl bond length increased to 4.162 Å during this period. Subsequently, the first intermediate IM1 was formed, H1 atom was added to C1 of *C2H2 to form *C2H3, while Cl was captured by the H3 atom on the other side of *C2H3 with the H3-Cl distance of 2.302 Å. The hydrogenation process was endothermic and would overcome an energy barrier of 12.89 kcal/mol. Because of the unsaturated coordination of Ru after *C2H3 was formed, the Cl which was captured by H3 was finally adsorbed by Ru site, with the Ru-Cl bond length of 2.432 Å of IM2. The energy decreased from IM1 to IM2, however, the energy barrier for this step was 7.06 kcal/mol. Then, the adsorbed Cl atom was added to the *C2H3, during which the Cl gradually attacked the C2 of *C2H3, and generated the ads-VCM vertical to the catalyst surface. Finally, the VCM desorbed from the catalyst surface, exposing the catalytic sites, and entered the next reaction cycle. According to the calculation result, the free energy barrier of the Cl addition process was 16.83 kcal/mol, which made this step the rate-limiting step in the catalytic pathway. To discover the orbital interaction, PDOS of the reaction mechanism was carried out (Fig. 6 ). The s orbital of H1 atom was hybridized with p orbital of C1 atom in IM1 indicated the formation of H1-C1 bond. Bonding states around -2.8 eV between p orbital of C2 and Cl atom were observed gradually from IM1 to ads-VCM. Compared with the above conclusion, the reaction mechanism of acetylene hydrochlorination on Ru@4 × N5 still had some differences (Figs. S6 and S7, ESI†). First of all, the elementary step in which Cl adsorbed by Ru with the free energy barrier of 22.24 kcal/mol was the rate-limiting step in the catalytic pathway. Secondly, the final product ads-VCM tended to be parallelly adsorbed on the surface of the catalyst and then desorbed from the surface easily. Different from the mechanism on Ru@4 × N5, due to the unsaturated coordination of Ru on Ru@3 × N5, Cl atom was directly adsorbed by Ru site after H addition process (Figs. S8 and S9, ESI†). What's more, Cl addition reaction with the energy barrier of 43.88 kcal/mol was the rate-limiting step. 3.4.2 Catalytic mechanism over Ru@C2N and Ru@CN The reaction pathway on Ru@CN was similar with that on Ru@C2N, so, the one with better catalytic performance was chosen as an example to analyze the detailed mechanisms. The reaction pathway over Ru@CN is shown in Fig. 7 . Different with the above two catalysts, the H1 and Cl of dissociatively adsorbed HCl were adsorbed on the opposite side of *C2H2. Afterwards, the H1 adsorbed on N site desorbed to attack the C1 atom of *C2H2 at first, and the H1-N bond was elongated to 1.355 Å, while the distance of H1-C1 reduced to 1.398 Å, which was the structure of TS1. After passing TS1, the distance between H1 and C1 continued to decrease until the H1-C1 bond was formed with a bond length of 1.097 Å, indicating the first intermediate *C2H3 was formed. According to the calculation, the first elementary reaction should overcome the energy barrier of 23.11 kcal/mol, during which H-adding reaction occurred. Moreover, as the result of the lower coordination of the Ru site, the intermediate *C2H3 and Cl atoms were both adsorbed on Ru active site, forming a Ru-Cl bond length of 2.355 Å and two Ru-C bonds with the bond lengths of 1.883 and 2.222 Å, respectively. The Cl adsorbed on the Ru site could directly add to the *C2H3 to form ads-VCM, so the step of the Cl atom migration was omitted compared to the above two catalysts. Before product VCM was generated, there was still another free energy barrier of 24.32 kcal/mol for Cl-adding reaction, where Cl kept approaching C2 atoms of *C2H3 with the distance of Cl-C2 decreasing from 3.164 to 2.188 Å until TS2 was formed. At the same time, the Ru-C1 bond was broken, and the *C2H3 specie bound to Ru site with only one Ru-C2 bond with the length of 2.268 Å. After passing TS2, the distance of Cl-C2 decreased until the product VCM was formed. During this process, the Ru-C2 bond was elongated and eventually broken and VCM was adsorbed on the Ru site parallelly through the Ru-Cl bond of 2.492 Å. At last, the active sites were released by desorption of ads-VCM, and provided adsorption sites for other reactants to promote subsequent reaction. In conclusion, the Cl addition process became the rate-limiting step over the entire reaction pathway. The initial reaction step was that the H1 of HCl attacked and added to the C1 of *C2H2 to form the intermediate *C2H3 over the Ru@C2N, followed by Cl atom which was adsorbed on Ru site approaching the C2 atom of *C2H3 continuously to generate ads-VCM. What's more, the rate-limiting step was also the Cl-adding step with an energy barrier of 27.29 kcal/mol, which was higher than 17.74 kcal/mol required by H-adding step (Figs. S11 and S12, ESI†). 3.4.3 Catalytic mechanism over Ru@g-C3N4 The minimum energy path of chemical reaction with the optimized structures in the illustration is shown in Fig. 8 . The reactants were co-adsorbed on the catalyst surface, where the Cl and H1 of dissociatively adsorbed HCl were located on the same side of *C2H2. As the first step of the reaction, the H1 atom adsorbed on the N site starts to desorb and then constantly approach the C1 atom in *C2H2. During this period, the energy barrier of 24.27 kcal/mol needed to be overcome to form TS1 with only one imaginary frequency which vibrational mode connected to the reactant and product. The H1 continued to move closer to C1, binding to C1 with the bond length of 1.095 Å eventually, resulting in the breakage of Ru-C1 bond, which represented the formation of intermediate *C2H3. The second step was the addition of Cl, where Cl attacked the C2 atom of *C2H3 to form ads-VCM and the energy barrier should be overcome to generate TS2 was 49.06 kcal/mol, which made this step the rate-limiting step of the entire reaction pathway. The product VCM was adsorbed parallelly to the surface of the catalyst through the interaction of Cl and Ru atom. It could be regarded as a physical interaction between the adsorbed product and the catalyst, resulting from the distance of 3.224 Å, which meant the product was easily desorbed from the catalyst surface to release the active site. In order to make a systematic understanding of the above six catalysts, the reaction paths on six catalysts are compared (Fig. 9 ), and the Gibbs free energy barriers of the rate-limiting step for acetylene hydrochlorination reaction on each catalyst are listed in Table 2 . The order of the free energy barrier for each catalyst was Ru@4 × N6 < Ru@4 × N5 < Ru@CN < Ru@C2N < Ru@3 × N5 < Ru@g-C3N4, in other words, the catalytic activity was in the order of Ru@4 × N6 > Ru@4 × N5 > Ru@CN > Ru@C2N > Ru@3 × N5 > Ru@g-C3N4. Compared with the result obtained from previous work, the reaction energy barrier was 38.05 kcal/mol on pure graphene [68], which proves that Ru@3 × N5 and Ru@g-C3N4 have little catalytic activity for acetylene hydrochlorination reaction. In contrast, Ru@4 × N6, Ru@4 × N5, Ru@C2N and Ru@CN all significantly reduce the reaction energy barrier and exhibit excellent activity. The high energy barrier of Ru@g-C3N4 could be explained by the structure change of the catalyst during the reaction process. The other catalysts basically maintained a flat two-dimensional structure in the whole reaction, however, there was an obvious deformation for Ru@g-C3N4 at the beginning of adsorbing the reactants until the product desorption. Whether it is the deformation of the adsorbed reactants or the catalyst, it always indicates the strong interaction between them. As far as we know, the catalyst needs to provide a moderate interaction to the reactants or intermediates, otherwise, it will be not conducive to the subsequent reaction. What's more, previous work also confirmed that low coordinated Ru site would make it difficult to provide Cl to *C2H3 to produce VCM [69], which is in accordance with the phenomenon in this calculation result. 3.5 Impact of chlorination of Ru sites Previous experiment observed that Ru sites were easily chlorinated during the reaction [38,55]. Herein, based on the reaction energy barrier, 4N-coordinated Ru@4 × N6, 3N-coordinated Ru@3 × N5 and 2N-coordinated Ru@CN were selected as representatives to study the effect of chlorination of active sites on catalyst itself and on adsorption capacity of reactants. Compared with isolated Ru atom, the binding energies of Ru species with Cl coordination were reduced, indicating that the bonding strength of substrate to chlorine-containing Ru species was weaker than isolated Ru single atom (Table 3 ). As the coordination number of Ru increased, the adsorption and degree of activation of the reactants was reduced, which might have an adverse effect on the activity of single-atom catalysts (Fig. S14, Table S18, ESI†). In order to further explore the effect of chlorination on activity, the best-performing @4 × N6 was selected as substate to load RuCl specie, and it was found that the reaction energy barrier significantly increased to 39.76 kcal/mol, indicating that chlorination is unfavorable for the activity of Ru single-atom sites (Fig. 10 ). 4 Conclusions In conclusion, the catalytic mechanisms of acetylene hydrochlorination reaction on Ru single-atom catalysts with six different nitrogen-doped carbon-based substrates were investigated via DFT calculation in this study. The result showed that the catalytic performance was in the order of Ru@4 × N6 > Ru@4 × N5 > Ru@CN > Ru@C2N > Ru@3 × N5 > Ru@g-C3N4. The first four catalysts can effectively reduce the energy barrier required by the whole reaction pathway but unfortunately Ru@3 × N5 and Ru@g-C3N4 exhibit poor catalytic performance. In particular, Ru@4 × N6 is the most promising catalyst among all the six catalysts due to its lowest energy barrier of 16.83 kcal/mol compared to others. Furthermore, the adsorption energies of the product VCM are below -18.51 kcal/mol for all the six catalysts, which can be described as physical interaction and indicates that the product VCM easily desorb from the catalysts after it is formed. Only in this way can the active sites be exposed to other reactants and continuously produce products which means that these catalysts will have a satisfactory catalyst lifetime. Therefore, this theoretical research will provide a new sight into the design of stable and efficient Ru single-atom catalysts for acetylene hydrochlorination. CRediT authorship contribution statement Yiming Jia: Conceptualization, Methodology, Formal analysis, Investigation, Writing – original draft, Visualization. Yao Nian: Formal analysis, Writing – review & editing, Visualization. Jinli Zhang: Resources. You Han: Data curation, Writing – review & editing, Project administration, Funding acquisition, Supervision. Declaration of Competing Interest The authors declare that they have no known competing financial interests or personal relationships that could have appeared to influence the work reported in this paper. Acknowledgments This work was supported by the National Natural Science Foundation of China (Grant No. 21978210, U20A20151) and the Tianjin Natural Science Foundation, China (Grant No. 19JCYBJC20000). The Materials Studio 7.0 software was supported by the National Supercomputing Center in Shenzhen. Supplementary materials Supplementary material associated with this article can be found, in the online version, at doi:10.1016/j.mcat.2021.111826. Appendix Supplementary materials Image, application 1 References [1] H. Schobert Production of acetylene and acetylene-based chemicals from coal Chem. Rev. 114 2014 1743 1760 10.1021/cr400276u H. Schobert, Production of acetylene and acetylene-based chemicals from coal, Chem. Rev.114 (2014) 1743–1760. 10.1021/cr400276u. [2] P. Liu C. Liu T. Hu J.J. Shi L.B. Zhang B.G. Liu J.H. Peng Kinetic study of microwave enhanced mercury desorption for the regeneration of spent activated carbon supported mercuric chloride catalysts Chem. Eng. J. 2021 408 10.1016/j.cej.2020.127355 P. Liu, C. Liu, T. Hu, J.J. Shi, L.B. Zhang, B.G. Liu, J.H. Peng, Kinetic study of microwave enhanced mercury desorption for the regeneration of spent activated carbon supported mercuric chloride catalysts, Chem. Eng. J.408 (2021). 10.1016/j.cej.2020.127355. [3] R. Lin A.P. Amrute J. Perez-Ramirez Halogen-mediated conversion of hydrocarbons to commodities Chem. Rev. 117 2017 4182 4247 10.1021/acs.chemrev.6b00551 R. Lin, A.P. Amrute, J. Perez-Ramirez, Halogen-mediated conversion of hydrocarbons to commodities, Chem. Rev.117 (2017) 4182–4247. 10.1021/acs.chemrev.6b00551. [4] Y. Nian J. Zhang X. Li Y. Wang W. Li P.D. Kolubah Y. Han Molecular design of ionic liquids as novel non-metal catalysts for the acetylene hydrochlorination reaction Phys. Chem. Chem. Phys. 21 2019 7635 7644 10.1039/C9CP01151J Y. Nian, J. Zhang, X. Li, Y. Wang, W. Li, P.D. Kolubah, Y. Han, Molecular design of ionic liquids as novel non-metal catalysts for the acetylene hydrochlorination reaction, Phys. Chem. Chem. Phys.21 (2019) 7635–7644. 10.1039/C9CP01151J. [5] J. Liu X. Kong L. Zheng X. Guo X. Liu J. Shui Rare earth single-atom catalysts for nitrogen and carbon dioxide reduction ACS Nano 14 2020 1093 1101 10.1021/acsnano.9b08835 J. Liu, X. Kong, L. Zheng, X. Guo, X. Liu, J. Shui, Rare earth single-atom catalysts for nitrogen and carbon dioxide reduction, ACS Nano14 (2020) 1093–1101. 10.1021/acsnano.9b08835. [6] S. Tang Q. Dang T. Liu S. Zhang Z. Zhou X. Li X. Wang E. Sharman Y. Luo J. Jiang Realizing a not-strong-not-weak polarization electric field in single-atom catalysts sandwiched by boron nitride and graphene sheets for efficient nitrogen fixation J. Am. Chem. Soc. 142 2020 19308 19315 10.1021/jacs.0c09527 S. Tang, Q. Dang, T. Liu, S. Zhang, Z. Zhou, X. Li, X. Wang, E. Sharman, Y. Luo, J. Jiang, Realizing a not-strong-not-weak polarization electric field in single-atom catalysts sandwiched by boron nitride and graphene sheets for efficient nitrogen fixation, J. Am. Chem. Soc.142 (2020) 19308–19315. 10.1021/jacs.0c09527. [7] Z. Gao H. Huang S. Xu L. Li G. Yan M. Zhao W. Yang X. Zhao Regulating the coordination environment through doping N atoms for single-atom Mn electrocatalyst of N2 reduction with high catalytic activity and selectivity: a theoretical study Mol. Catal. 493 2020 111091 10.1016/j.mcat.2020.111091 Z. Gao, H. Huang, S. Xu, L. Li, G. Yan, M. Zhao, W. Yang, X. Zhao, Regulating the coordination environment through doping N atoms for single-atom Mn electrocatalyst of N2 reduction with high catalytic activity and selectivity: a theoretical study, Mol. Catal.493 (2020) 111091. 10.1016/j.mcat.2020.111091. [8] Y. Yang J. Liu F. Liu Z. Wang D. Wu FeS2-anchored transition metal single atoms for highly efficient overall water splitting: a DFT computational screening study J. Mater. Chem. A 9 2021 2438 2447 10.1039/D0TA09903A Y. Yang, J. Liu, F. Liu, Z. Wang, D. Wu, FeS2-anchored transition metal single atoms for highly efficient overall water splitting: a DFT computational screening study, J. Mater. Chem. A9 (2021) 2438–2447. 10.1039/D0TA09903A. [9] L. Gong X. Wang T. Zheng J. Liu J. Wang Y.C. Yang J. Zhang X. Han L. Zhang Z. Xia Catalytic mechanism and design principle of coordinately unsaturated single metal atom-doped covalent triazine frameworks with high activity and selectivity for CO2 electroreduction J. Mater. Chem. A 9 2021 3555 3566 10.1039/D0TA10875H L. Gong, X. Wang, T. Zheng, J. Liu, J. Wang, Y.C. Yang, J. Zhang, X. Han, L. Zhang, Z. Xia, Catalytic mechanism and design principle of coordinately unsaturated single metal atom-doped covalent triazine frameworks with high activity and selectivity for CO2 electroreduction, J. Mater. Chem. A9 (2021) 3555–3566. 10.1039/D0TA10875H. [10] H. Kim D. Shin W. Yang D.H. Won H.S. Oh M.W. Chung D. Jeong S.H. Kim K.H. Chae J.Y. Ryu J. Lee S.J. Cho J. Seo H. Kim C.H. Choi Identification of single-atom Ni site active toward electrochemical CO2 conversion to CO J. Am. Chem. Soc. 143 2021 925 933 10.1021/jacs.0c11008 H. Kim, D. Shin, W. Yang, D.H. Won, H.S. Oh, M.W. Chung, D. Jeong, S.H. Kim, K.H. Chae, J.Y. Ryu, J. Lee, S.J. Cho, J. Seo, H. Kim, C.H. Choi, Identification of single-atom Ni site active toward electrochemical CO2 conversion to CO, J. Am. Chem. Soc.143 (2021) 925–933. 10.1021/jacs.0c11008. [11] Q. He J.H. Lee D. Liu Y. Liu Z. Lin Z. Xie S. Hwang S. Kattel L. Song J.G. Chen Accelerating CO2 electroreduction to CO Over Pd single-atom catalyst Adv. Funct. Mater. 2020 30 10.1002/adfm.202000407 Q. He, J.H. Lee, D. Liu, Y. Liu, Z. Lin, Z. Xie, S. Hwang, S. Kattel, L. Song, J.G. Chen, Accelerating CO2 electroreduction to CO Over Pd single-atom catalyst, Adv. Funct. Mater.30 (2020). 10.1002/adfm.202000407. [12] C.J. Davies P.J. Miedziak G.L. Brett G.J. Hutchings Vinyl chloride monomer production catalysed by gold: a review Chin. J. Catal. 37 2016 1600 1607 10.1016/S1872-2067(16)62482-8 C.J. Davies, P.J. Miedziak, G.L. Brett, G.J. Hutchings, Vinyl chloride monomer production catalysed by gold: a review, Chin. J. Catal.37 (2016) 1600–1607. 10.1016/S1872-2067(16)62482-8. [13] Z. Chen Y.J. Chen S.L. Chao X.B. Dong W.X. Chen J. Luo C.G. Liu D.S. Wang C. Chen W. Li J. Li Y.D. Li Single-atom Au-I-N3 site for acetylene hydrochlorination reaction ACS Catal. 10 2020 1865 1870 10.1021/acscatal.9b05212 Z. Chen, Y.J. Chen, S.L. Chao, X.B. Dong, W.X. Chen, J. Luo, C.G. Liu, D.S. Wang, C. Chen, W. Li, J. Li, Y.D. Li, Single-atom Au-I-N3 site for acetylene hydrochlorination reaction, ACS Catal.10 (2020) 1865–1870. 10.1021/acscatal.9b05212. [14] Y. Lou Y. Cai W. Hu L. Wang Q. Dai W. Zhan Y. Guo P. Hu X.M. Cao J. Liu Y. Guo Identification of active area as active center for CO oxidation over single Au atom catalyst ACS Catal. 10 2020 6094 6101 10.1021/acscatal.0c01303 Y. Lou, Y. Cai, W. Hu, L. Wang, Q. Dai, W. Zhan, Y. Guo, P. Hu, X.M. Cao, J. Liu, Y. Guo, Identification of active area as active center for CO oxidation over single Au atom catalyst, ACS Catal.10 (2020) 6094–6101. 10.1021/acscatal.0c01303. [15] B.L. Wang Y.X. Yue C.X. Jin J.Y. Lu S.S. Wang L. Yu L.L. Guo R.R. Li Z.T. Hu Z.Y. Pan J. Zhao X.N. Li Hydrochlorination of acetylene on single-atom Pd/N-doped carbon catalysts: importance of pyridinic-N synergism Appl. Catal. B Environ. 2020 272 10.1016/j.apcatb.2020.118944 B.L. Wang, Y.X. Yue, C.X. Jin, J.Y. Lu, S.S. Wang, L. Yu, L.L. Guo, R.R. Li, Z.T. Hu, Z.Y. Pan, J. Zhao, X.N. Li, Hydrochlorination of acetylene on single-atom Pd/N-doped carbon catalysts: importance of pyridinic-N synergism, Appl. Catal. B Environ.272 (2020). 10.1016/j.apcatb.2020.118944. [16] X. Liu Z. Gao H. Huang G. Yan T. Huang C. Chen W. Yang X.L. Ding Simultaneous catalytic oxidation of nitric oxide and elemental mercury by single-atom Pd/g-C3N4 catalyst: a DFT study Mol. Catal. 488 2020 110901 10.1016/j.mcat.2020.110901 X. Liu, Z. Gao, H. Huang, G. Yan, T. Huang, C. Chen, W. Yang, X.L. Ding, Simultaneous catalytic oxidation of nitric oxide and elemental mercury by single-atom Pd/g-C3N4 catalyst: a DFT study, Mol. Catal.488 (2020) 110901. 10.1016/j.mcat.2020.110901. [17] S.K. Kaiser E. Fako G. Manzocchi F. Krumeich R. Hauert A.H. Clark O.V. Safonov N. López J. Pérez-Ramírez Nanostructuring unlocks high performance of platinum single-atom catalysts for stable vinyl chloride production Nat. Catal. 3 2020 376 385 10.1038/s41929-020-0431-3 S.K. Kaiser, E. Fako, G. Manzocchi, F. Krumeich, R. Hauert, A.H. Clark, O.V. Safonov, N. López, J. Pérez-Ramírez, Nanostructuring unlocks high performance of platinum single-atom catalysts for stable vinyl chloride production, Nat. Catal.3 (2020) 376–385. 10.1038/s41929-020-0431-3. [18] B. Qiao A. Wang X. Yang L.F. Allard Z. Jiang Y. Cui J. Liu J. Li T. Zhang Single-atom catalysis of CO oxidation using Pt-1/FeOx Nat. Chem. 3 2011 634 641 10.1038/nchem.1095 B. Qiao, A. Wang, X. Yang, L.F. Allard, Z. Jiang, Y. Cui, J. Liu, J. Li, T. Zhang, Single-atom catalysis of CO oxidation using Pt-1/FeOx, Nat. Chem.3 (2011) 634–641. 10.1038/nchem.1095. [19] B. Yu H. Li J. White S. Donne J. Yi S. Xi Y. Fu G. Henkelman H. Yu Z. Chen T. Ma Tuning the catalytic preference of ruthenium catalysts for nitrogen reduction by atomic dispersion Adv. Funct. Mater. 30 2020 1905665 10.1002/adfm.201905665 B. Yu, H. Li, J. White, S. Donne, J. Yi, S. Xi, Y. Fu, G. Henkelman, H. Yu, Z. Chen, T. Ma, Tuning the catalytic preference of ruthenium catalysts for nitrogen reduction by atomic dispersion, Adv. Funct. Mater.30 (2020) 1905665. 10.1002/adfm.201905665. [20] M. Xiao L. Gao Y. Wang X. Wang J. Zhu Z. Jin C. Liu H. Chen G. Li J. Ge Q. He Z. Wu Z. Chen W. Xing Engineering energy level of metal center: Ru single-atom site for efficient and durable oxygen reduction catalysis J. Am. Chem. Soc. 141 2019 19800 19806 10.1021/jacs.9b09234 M. Xiao, L. Gao, Y. Wang, X. Wang, J. Zhu, Z. Jin, C. Liu, H. Chen, G. Li, J. Ge, Q. He, Z. Wu, Z. Chen, W. Xing, Engineering energy level of metal center: Ru single-atom site for efficient and durable oxygen reduction catalysis, J. Am. Chem. Soc.141 (2019) 19800–19806. 10.1021/jacs.9b09234. [21] M. Fan J.D. Jimenez S.N. Shirodkar J. Wu S. Chen L. Song M.M. Royko J. Zhang H. Guo J. Cui K. Zuo W. Wang C. Zhang F. Yuan R. Vajtai J. Qian J. Yang B.I. Yakobson J.M. Tour J. Lauterbach D. Sun P.M. Ajayan Atomic Ru immobilized on porous h-BN through simple vacuum filtration for highly active and selective CO2 methanation ACS Catal. 9 2019 10077 10086 10.1021/acscatal.9b02197 M. Fan, J.D. Jimenez, S.N. Shirodkar, J. Wu, S. Chen, L. Song, M.M. Royko, J. Zhang, H. Guo, J. Cui, K. Zuo, W. Wang, C. Zhang, F. Yuan, R. Vajtai, J. Qian, J. Yang, B.I. Yakobson, J.M. Tour, J. Lauterbach, D. Sun, P.M. Ajayan, Atomic Ru immobilized on porous h-BN through simple vacuum filtration for highly active and selective CO2 methanation, ACS Catal.9 (2019) 10077–10086. 10.1021/acscatal.9b02197. [22] S.K. Kaiser Z. Chen D. Faust Akl S. Mitchell J. Pérez-Ramírez Single-atom catalysts across the periodic table Chem. Rev. 120 2020 11703 11809 10.1021/acs.chemrev.0c00576 S.K. Kaiser, Z. Chen, D. Faust Akl, S. Mitchell, J. Pérez-Ramírez, Single-atom catalysts across the periodic table, Chem. Rev.120 (2020) 11703–11809. 10.1021/acs.chemrev.0c00576. [23] T. Hou H. Peng Y. Xin S. Wang W. Zhu L. Chen Y. Yao W. Zhang S. Liang L. Wang Fe single-atom catalyst for visible-light-driven photofixation of nitrogen sensitized by triphenylphosphine and sodium iodide ACS Catal. 10 2020 5502 5510 10.1021/acscatal.0c00920 T. Hou, H. Peng, Y. Xin, S. Wang, W. Zhu, L. Chen, Y. Yao, W. Zhang, S. Liang, L. Wang, Fe single-atom catalyst for visible-light-driven photofixation of nitrogen sensitized by triphenylphosphine and sodium iodide, ACS Catal.10 (2020) 5502–5510. 10.1021/acscatal.0c00920. [24] S. Vijay J.A. Gauthier H.H. Heenen V.J. Bukas H.H. Kristoffersen K. Chan Dipole-field interactions determine the CO2 reduction activity of 2D Fe–N–C single-atom catalysts ACS Catal. 10 2020 7826 7835 10.1021/acscatal.0c01375 S. Vijay, J.A. Gauthier, H.H. Heenen, V.J. Bukas, H.H. Kristoffersen, K. Chan, Dipole-field interactions determine the CO2 reduction activity of 2D Fe–N–C single-atom catalysts, ACS Catal.10 (2020) 7826–7835. 10.1021/acscatal.0c01375. [25] Y. Zhang X.R. Shi C. Sun S. Huang Z. Duan P. Ma J. Wang CO oxidation on Ni-based single-atom alloys surfaces Mol. Catal. 495 2020 111154 10.1016/j.mcat.2020.111154 Y. Zhang, X.R. Shi, C. Sun, S. Huang, Z. Duan, P. Ma, J. Wang, CO oxidation on Ni-based single-atom alloys surfaces, Mol. Catal.495 (2020) 111154. 10.1016/j.mcat.2020.111154. [26] Y. Min X. Zhou J.J. Chen W. Chen F. Zhou Z. Wang J. Yang C. Xiong Y. Wang F. Li H.Q. Yu Y. Wu Integrating single-cobalt-site and electric field of boron nitride in dechlorination electrocatalysts by bioinspired design Nat. Commun. 12 2021 303 10.1038/s41467-020-20619-w Y. Min, X. Zhou, J.J. Chen, W. Chen, F. Zhou, Z. Wang, J. Yang, C. Xiong, Y. Wang, F. Li, H.Q. Yu, Y. Wu, Integrating single-cobalt-site and electric field of boron nitride in dechlorination electrocatalysts by bioinspired design, Nat. Commun.12 (2021) 303. 10.1038/s41467-020-20619-w. [27] Q. Wu W. Wei X. Lv Y. Wang B. Huang Y. Dai Cu@g-C3N4: an efficient single-atom electrocatalyst for NO electrochemical reduction with suppressed hydrogen evolution J. Phys. Chem. C 123 2019 31043 31049 10.1021/acs.jpcc.9b08827 Q. Wu, W. Wei, X. Lv, Y. Wang, B. Huang, Y. Dai, Cu@g-C3N4: an efficient single-atom electrocatalyst for NO electrochemical reduction with suppressed hydrogen evolution, J. Phys. Chem. C123 (2019) 31043–31049. 10.1021/acs.jpcc.9b08827. [28] Q. Wu J. Wang Z. Wang Y. Xu Z. Xing X. Zhang Y. Guan G. Liao X. Li High-loaded single Cu atoms decorated on N-doped graphene for boosting Fenton-like catalysis under neutral pH J. Mater. Chem. A 8 2020 13685 13693 10.1039/D0TA04943C Q. Wu, J. Wang, Z. Wang, Y. Xu, Z. Xing, X. Zhang, Y. Guan, G. Liao, X. Li, High-loaded single Cu atoms decorated on N-doped graphene for boosting Fenton-like catalysis under neutral pH, J. Mater. Chem. A8 (2020) 13685–13693. 10.1039/D0TA04943C. [29] X. Tang L. Wang B. Yang C. Fei T. Yao W. Liu Y. Lou Q. Dai Y. Cai X.M. Cao W. Zhan Y. Guo X.Q. Gong Y. Guo Direct oxidation of methane to oxygenates on supported single Cu atom catalyst Appl. Catal. B Environ. 285 2021 119827 10.1016/j.apcatb.2020.119827 X. Tang, L. Wang, B. Yang, C. Fei, T. Yao, W. Liu, Y. Lou, Q. Dai, Y. Cai, X.M. Cao, W. Zhan, Y. Guo, X.Q. Gong, Y. Guo, Direct oxidation of methane to oxygenates on supported single Cu atom catalyst, Appl. Catal. B Environ.285 (2021) 119827. 10.1016/j.apcatb.2020.119827. [30] X. Zhao Y. Liu Unveiling the active structure of single nickel atom catalysis: critical roles of charge capacity and hydrogen bonding J. Am. Chem. Soc. 142 2020 5773 5777 10.1021/jacs.9b13872 X. Zhao, Y. Liu, Unveiling the active structure of single nickel atom catalysis: critical roles of charge capacity and hydrogen bonding, J. Am. Chem. Soc.142 (2020) 5773–5777. 10.1021/jacs.9b13872. [31] M. Zhang S. Yin Y. Chen A DFT study for CO2 hydrogenation on W(111) and Ni-doped W(111) surfaces Phys. Chem. Chem. Phys. 22 2020 17106 17116 10.1039/D0CP02285C M. Zhang, S. Yin, Y. Chen, A DFT study for CO2 hydrogenation on W(111) and Ni-doped W(111) surfaces, Phys. Chem. Chem. Phys.22 (2020) 17106–17116. 10.1039/D0CP02285C. [32] C. Ma B. Liu S. Yan Enhanced catalytic activity for CO oxidation by Fe-adsorbing on BN under mild condition: a promising single-atom catalyst Mol. Catal. 495 2020 111165 10.1016/j.mcat.2020.111165 C. Ma, B. Liu, S. Yan, Enhanced catalytic activity for CO oxidation by Fe-adsorbing on BN under mild condition: a promising single-atom catalyst, Mol. Catal.495 (2020) 111165. 10.1016/j.mcat.2020.111165. [33] B. Wang Y. Yue S. Wang Z. Chen L. Yu S. Shao G. Lan Z. Pan J. Zhao X. Li Constructing and controlling ruthenium active phases for acetylene hydrochlorination Chem. Commun. 56 2020 10722 10725 10.1039/D0CC04382F B. Wang, Y. Yue, S. Wang, Z. Chen, L. Yu, S. Shao, G. Lan, Z. Pan, J. Zhao, X. Li, Constructing and controlling ruthenium active phases for acetylene hydrochlorination, Chem. Commun.56 (2020) 10722–10725. 10.1039/D0CC04382F. [34] X. Wang G. Lan Z. Cheng W. Han H. Tang H. Liu Y. Li Carbon-supported ruthenium catalysts prepared by a coordination strategy for acetylene hydrochlorination Chin. J. Catal. 41 2020 1683 1691 10.1016/S1872-2067(20)63616-6 X. Wang, G. Lan, Z. Cheng, W. Han, H. Tang, H. Liu, Y. Li, Carbon-supported ruthenium catalysts prepared by a coordination strategy for acetylene hydrochlorination, Chin. J. Catal.41 (2020) 1683–1691. 10.1016/S1872-2067(20)63616-6. [35] S. Shang W. Zhao Y. Wang X. Li J. Zhang Y. Han W. Li Highly efficient Ru@IL/AC to substitute mercuric catalyst for acetylene hydrochlorination ACS Catal. 7 2017 3510 3520 10.1021/acscatal.7b00057 S. Shang, W. Zhao, Y. Wang, X. Li, J. Zhang, Y. Han, W. Li, Highly efficient Ru@IL/AC to substitute mercuric catalyst for acetylene hydrochlorination, ACS Catal.7 (2017) 3510–3520. 10.1021/acscatal.7b00057. [36] J. Li H. Zhang L. Li M. Cai Y. Li D. Xie J. Zhang Synergistically catalytic hydrochlorination of acetylene over the highly dispersed Ru active species embedded in P-containing ionic liquids ACS Sustain. Chem. Eng. 8 2020 10173 10184 10.1021/acssuschemeng.0c02329 J. Li, H. Zhang, L. Li, M. Cai, Y. Li, D. Xie, J. Zhang, Synergistically catalytic hydrochlorination of acetylene over the highly dispersed Ru active species embedded in P-containing ionic liquids, ACS Sustain. Chem. Eng.8 (2020) 10173–10184. 10.1021/acssuschemeng.0c02329. [37] Z. Mingyuan K. Lihua S. Yan Z. Shanzheng D. Bin MClx (M = Hg, Au, Ru; x = 2, 3) catalyzed hydrochlorination of acetylene — a density functional theory study Can. J. Chem. 91 2013 120 125 10.1139/cjc-2012-0308 Z. Mingyuan, K. Lihua, S. Yan, Z. Shanzheng, D. Bin, MClx (M = Hg, Au, Ru; x = 2, 3) catalyzed hydrochlorination of acetylene — a density functional theory study, Can. J. Chem.91 (2013) 120–125. 10.1139/cjc-2012-0308. [38] S.K. Kaiser R. Lin F. Krumeich O.V. Safonova J. Pérez-Ramírez Preserved in a shell: high-performance graphene-cnfined ruthenium nanoparticles in acetylene hydrochlorination Angew. Chem. Int. Ed. 58 2019 12297 12304 10.1002/anie.201906916 S.K. Kaiser, R. Lin, F. Krumeich, O.V. Safonova, J. Pérez-Ramírez, Preserved in a shell: high-performance graphene-cnfined ruthenium nanoparticles in acetylene hydrochlorination, Angew. Chem. Int. Ed.58 (2019) 12297–12304. 10.1002/anie.201906916. [39] J. Mahmood F. Li S.M. Jung M.S. Okyay I. Ahmad S.J. Kim N. Park H.Y. Jeong J.B. Baek An efficient and pH-universal ruthenium-based catalyst for the hydrogen evolution reaction Nat. Nanotechnol. 12 2017 441 446 10.1038/nnano.2016.304 J. Mahmood, F. Li, S.M. Jung, M.S. Okyay, I. Ahmad, S.J. Kim, N. Park, H.Y. Jeong, J.B. Baek, An efficient and pH-universal ruthenium-based catalyst for the hydrogen evolution reaction, Nat. Nanotechnol.12 (2017) 441–446. 10.1038/nnano.2016.304. [40] Q. He D. Tian H. Jiang D. Cao S. Wei D. Liu P. Song Y. Lin L. Song Achieving efficient alkaline hydrogen evolution reaction over a Ni5P4 catalyst incorporating single-atomic Ru sites Adv. Mater. 32 2020 1906972 10.1002/adma.201906972 Q. He, D. Tian, H. Jiang, D. Cao, S. Wei, D. Liu, P. Song, Y. Lin, L. Song, Achieving efficient alkaline hydrogen evolution reaction over a Ni5P4 catalyst incorporating single-atomic Ru sites, Adv. Mater.32 (2020) 1906972. 10.1002/adma.201906972. [41] Y. Ji Y. Li H. Dong L. Ding Y. Li Ruthenium single-atom catalysis for electrocatalytic nitrogen reduction unveiled by grand canonical density functional theory J. Mater. Chem. A 8 2020 20402 20407 10.1039/D0TA06672A Y. Ji, Y. Li, H. Dong, L. Ding, Y. Li, Ruthenium single-atom catalysis for electrocatalytic nitrogen reduction unveiled by grand canonical density functional theory, J. Mater. Chem. A8 (2020) 20402–20407. 10.1039/D0TA06672A. [42] H. Tao C. Choi L.X. Ding Z. Jiang Z. Han M. Jia Q. Fan Y. Gao H. Wang A.W. Robertson S. Hong Y. Jung S. Liu Z. Sun Nitrogen fixation by Ru single-atom electrocatalytic reduction Chem 5 2019 204 214 10.1016/j.chempr.2018.10.007 H. Tao, C. Choi, L.X. Ding, Z. Jiang, Z. Han, M. Jia, Q. Fan, Y. Gao, H. Wang, A.W. Robertson, S. Hong, Y. Jung, S. Liu, Z. Sun, Nitrogen fixation by Ru single-atom electrocatalytic reduction, Chem5 (2019) 204–214. 10.1016/j.chempr.2018.10.007. [43] X. Sun S.R. Dawson T.E. Parmentier G. Malta T.E. Davies Q. He L. Lu D.J. Morgan N. Carthey P. Johnston S.A. Kondrat S.J. Freakley C.J. Kiely G.J. Hutchings Facile synthesis of precious-metal single-site catalysts using organic solvents Nat. Chem. 12 2020 560 567 10.1038/s41557-020-0446-z X. Sun, S.R. Dawson, T.E. Parmentier, G. Malta, T.E. Davies, Q. He, L. Lu, D.J. Morgan, N. Carthey, P. Johnston, S.A. Kondrat, S.J. Freakley, C.J. Kiely, G.J. Hutchings, Facile synthesis of precious-metal single-site catalysts using organic solvents, Nat. Chem.12 (2020) 560–567. 10.1038/s41557-020-0446-z. [44] X.F. Yang A. Wang B. Qiao J. Li J. Liu T. Zhang Single-atom catalysts: a new frontier in heterogeneous catalysis Acc. Chem. Res. 46 2013 1740 1748 10.1021/ar300361m X.F. Yang, A. Wang, B. Qiao, J. Li, J. Liu, T. Zhang, Single-atom catalysts: a new frontier in heterogeneous catalysis, Acc. Chem. Res.46 (2013) 1740–1748. 10.1021/ar300361m. [45] K. Liu X. Zhao G. Ren T. Yang Y. Ren A.F. Lee Y. Su X. Pan J. Zhang Z. Chen J. Yang X. Liu T. Zhou W. Xi J. Luo C. Zeng H. Matsumoto W. Liu Q. Jiang K. Wilson A. Wang B. Qiao W. Li T. Zhang Strong metal-support interaction promoted scalable production of thermally stable single-atom catalysts Nat. Commun. 11 2020 1263 10.1038/s41467-020-14984-9 K. Liu, X. Zhao, G. Ren, T. Yang, Y. Ren, A.F. Lee, Y. Su, X. Pan, J. Zhang, Z. Chen, J. Yang, X. Liu, T. Zhou, W. Xi, J. Luo, C. Zeng, H. Matsumoto, W. Liu, Q. Jiang, K. Wilson, A. Wang, B. Qiao, W. Li, T. Zhang, Strong metal-support interaction promoted scalable production of thermally stable single-atom catalysts, Nat. Commun.11 (2020) 1263. 10.1038/s41467-020-14984-9. [46] N. Zhang X. Zhang L. Tao P. Jiang C. Ye R. Lin Z. Huang A. Li D. Pang H. Yan Y. Wang P. Xu S. An Q. Zhang L. Liu S. Du X. Han D. Wang Y. Li Silver single-atom catalyst for efficient electrochemical CO2 reduction synthesized from thermal transformation and surface reconstruction Angew. Chem. Int. Ed. 60 2021 6170 6176 10.1002/anie.202014718 N. Zhang, X. Zhang, L. Tao, P. Jiang, C. Ye, R. Lin, Z. Huang, A. Li, D. Pang, H. Yan, Y. Wang, P. Xu, S. An, Q. Zhang, L. Liu, S. Du, X. Han, D. Wang, Y. Li, Silver single-atom catalyst for efficient electrochemical CO2 reduction synthesized from thermal transformation and surface reconstruction, Angew. Chem. Int. Ed.60 (2021) 6170–6176. 10.1002/anie.202014718. [47] H. Wang D. Xu E. Guan L. Wang J. Zhang C. Wang S. Wang H. Xu X. Meng B. Yang B.C. Gates F.S. Xiao Atomically dispersed Ru on manganese oxide catalyst boosts oxidative cyanation ACS Catal. 10 2020 6299 6308 10.1021/acscatal.0c00485 H. Wang, D. Xu, E. Guan, L. Wang, J. Zhang, C. Wang, S. Wang, H. Xu, X. Meng, B. Yang, B.C. Gates, F.S. Xiao, Atomically dispersed Ru on manganese oxide catalyst boosts oxidative cyanation, ACS Catal.10 (2020) 6299–6308. 10.1021/acscatal.0c00485. [48] D.H. Kweon M.S. Okyay S.J. Kim J.P. Jeon H.J. Noh N. Park J. Mahmood J.B. Baek Ruthenium anchored on carbon nanotube electrocatalyst for hydrogen production with enhanced faradaic efficiency Nat. Commun. 11 2020 1278 10.1038/s41467-020-15069-3 D.H. Kweon, M.S. Okyay, S.J. Kim, J.P. Jeon, H.J. Noh, N. Park, J. Mahmood, J.B. Baek, Ruthenium anchored on carbon nanotube electrocatalyst for hydrogen production with enhanced faradaic efficiency, Nat. Commun.11 (2020) 1278. 10.1038/s41467-020-15069-3. [49] M. Yuan Y. Bai J. Zhang T. Zhao S. Li H. He Z. Liu Z. Wang G. Zhang Work function regulation of nitrogen-doped carbon nanotubes triggered by metal nanoparticles for efficient electrocatalytic nitrogen fixation J. Mater. Chem. A 8 2020 26066 26074 10.1039/D0TA08914A M. Yuan, Y. Bai, J. Zhang, T. Zhao, S. Li, H. He, Z. Liu, Z. Wang, G. Zhang, Work function regulation of nitrogen-doped carbon nanotubes triggered by metal nanoparticles for efficient electrocatalytic nitrogen fixation, J. Mater. Chem. A8 (2020) 26066–26074. 10.1039/D0TA08914A. [50] L. Wang X. Qu Y. Zhao Y. Weng G.I.N. Waterhouse H. Yan S. Guan S. Zhou Exploiting single atom iron centers in a porphyrin-like MOF for efficient cancer phototherapy ACS Appl. Mater. Interfaces 11 2019 35228 35237 10.1021/acsami.9b11238 L. Wang, X. Qu, Y. Zhao, Y. Weng, G.I.N. Waterhouse, H. Yan, S. Guan, S. Zhou, Exploiting single atom iron centers in a porphyrin-like MOF for efficient cancer phototherapy, ACS Appl. Mater. Interfaces11 (2019) 35228–35237. 10.1021/acsami.9b11238. [51] L. Zhou P. Zhou Y.L. Zhang B.Y. Liu P. Gao S.J. Guo 3D star-like atypical hybrid MOF derived single-atom catalyst boosts oxygen reduction catalysis J. Energy Chem. 55 2021 355 360 10.1016/j.jechem.2020.06.059 L. Zhou, P. Zhou, Y.L. Zhang, B.Y. Liu, P. Gao, S.J. Guo, 3D star-like atypical hybrid MOF derived single-atom catalyst boosts oxygen reduction catalysis, J. Energy Chem.55 (2021) 355–360. 10.1016/j.jechem.2020.06.059. [52] L. Li R. Huang X. Cao Y. Wen Computational screening of efficient graphene-supported transition metal single atom catalysts toward the oxygen reduction reaction J. Mater. Chem. A 8 2020 19319 19327 10.1039/D0TA06892F L. Li, R. Huang, X. Cao, Y. Wen, Computational screening of efficient graphene-supported transition metal single atom catalysts toward the oxygen reduction reaction, J. Mater. Chem. A8 (2020) 19319–19327. 10.1039/D0TA06892F. [53] Z. Zhao W. Liu Y. Shi H. Zhang X. Song W. Shang C. Hao An insight into the reaction mechanism of CO2 photoreduction catalyzed by atomically dispersed Fe atoms supported on graphitic carbon nitride Phys. Chem. Chem. Phys. 23 2021 4690 4699 10.1039/D0CP05570K Z. Zhao, W. Liu, Y. Shi, H. Zhang, X. Song, W. Shang, C. Hao, An insight into the reaction mechanism of CO2 photoreduction catalyzed by atomically dispersed Fe atoms supported on graphitic carbon nitride, Phys. Chem. Chem. Phys.23 (2021) 4690–4699. 10.1039/D0CP05570K. [54] C. Wu I.D. Gates Methane activation by a single iron atom supported on graphene: impact of substrates Mol. Catal. 469 2019 40 47 10.1016/j.mcat.2019.03.002 C. Wu, I.D. Gates, Methane activation by a single iron atom supported on graphene: impact of substrates, Mol. Catal.469 (2019) 40–47. 10.1016/j.mcat.2019.03.002. [55] S.K. Kaiser R. Lin S. Mitchell E. Fako F. Krumeich R. Hauert O.V. Safonova V.A. Kondratenko E.V. Kondratenko S.M. Collins P.A. Midgley N. López J. Pérez-Ramírez Controlling the speciation and reactivity of carbon-suported gold nanostructures for catalysed acetylene hydrochlorination Chem. Sci. 10 2019 359 369 10.1039/C8SC03186J S.K. Kaiser, R. Lin, S. Mitchell, E. Fako, F. Krumeich, R. Hauert, O.V. Safonova, V.A. Kondratenko, E.V. Kondratenko, S.M. Collins, P.A. Midgley, N. López, J. Pérez-Ramírez, Controlling the speciation and reactivity of carbon-suported gold nanostructures for catalysed acetylene hydrochlorination, Chem. Sci.10 (2019) 359–369. 10.1039/C8SC03186J. [56] G. Han Y. Zheng X. Zhang Z. Wang Y. Gong C. Du M.N. Banis Y.M. Yiu T.K. Sham L. Gu Y. Sun Y. Wang J. Wang Y. Gao G. Yin X. Sun High loading single-atom Cu dispersed on graphene for efficient oxygen reduction reaction Nano Energy 66 2019 104088 10.1016/j.nanoen.2019.104088 G. Han, Y. Zheng, X. Zhang, Z. Wang, Y. Gong, C. Du, M.N. Banis, Y.M. Yiu, T.K. Sham, L. Gu, Y. Sun, Y. Wang, J. Wang, Y. Gao, G. Yin, X. Sun, High loading single-atom Cu dispersed on graphene for efficient oxygen reduction reaction, Nano Energy66 (2019) 104088. 10.1016/j.nanoen.2019.104088. [57] B. Delley An all-electron numerical-method for solving the local density functional for polyatomic-molecules J. Chem. Phys. 92 1990 508 517 10.1063/1.458452 B. Delley, An all-electron numerical-method for solving the local density functional for polyatomic-molecules, J. Chem. Phys.92 (1990) 508–517. 10.1063/1.458452. [58] B. Delley From molecules to solids with the DMol(3) approach J. Chem. Phys. 113 2000 7756 7764 10.1063/1.1316015 B. Delley, From molecules to solids with the DMol(3) approach, J. Chem. Phys.113 (2000) 7756–7764. 10.1063/1.1316015. [59] J.P. Perdew K. Burke M. Ernzerhof Generalized gradient approximation made simple Phys. Rev. Lett. 77 1996 3865 3868 10.1103/PhysRevLett.77.3865 J.P. Perdew, K. Burke, M. Ernzerhof, Generalized gradient approximation made simple, Phys. Rev. Lett.77 (1996) 3865–3868. 10.1103/PhysRevLett.77.3865. [60] H.J. Monkhorst J.D. Pack Special points for Brillouin-zone integrations Phys. Rev. B 13 1976 5188 5192 10.1103/PhysRevB.13.5188 H.J. Monkhorst, J.D. Pack, Special points for Brillouin-zone integrations, Phys. Rev. B13 (1976) 5188–5192. 10.1103/PhysRevB.13.5188. [61] P.M. Boerrigter G. Te Velde J.E. Baerends Three-dimensional numerical integration for electronic structure calculations Int. J. Quantum Chem. 33 1988 87 113 10.1002/qua.560330204 P.M. Boerrigter, G. Te Velde, J.E. Baerends, Three-dimensional numerical integration for electronic structure calculations, Int. J. Quantum Chem.33 (1988) 87–113. 10.1002/qua.560330204. [62] S. Grimme Semiempirical GGA-type density functional constructed with a long-range dispersion correction J. Comput. Chem. 27 2006 1787 1799 10.1002/jcc.20495 S. Grimme, Semiempirical GGA-type density functional constructed with a long-range dispersion correction, J. Comput. Chem.27 (2006) 1787–1799. 10.1002/jcc.20495. [63] N. Govind M. Petersen G. Fitzgerald D. King-Smith J. Andzelm A generalized synchronous transit method for transition state location Comput. Mater. Sci. 28 2003 250 258 10.1016/s0927-0256(03)00111-3 N. Govind, M. Petersen, G. Fitzgerald, D. King-Smith, J. Andzelm, A generalized synchronous transit method for transition state location, Comput. Mater. Sci.28 (2003) 250–258. 10.1016/s0927-0256(03)00111-3. [64] Z. Liang M. Luo M. Chen X. Qi J. Liu C. Liu S.G. Peera T. Liang Exploring the oxygen electrode bi-functional activity of Ni–N–C-doped graphene systems with N, C co-ordination and OH ligand effects J. Mater. Chem. A 8 2020 20453 20462 10.1039/D0TA06335E Z. Liang, M. Luo, M. Chen, X. Qi, J. Liu, C. Liu, S.G. Peera, T. Liang, Exploring the oxygen electrode bi-functional activity of Ni–N–C-doped graphene systems with N, C co-ordination and OH ligand effects, J. Mater. Chem. A8 (2020) 20453–20462. 10.1039/D0TA06335E. [65] Z. Liang M. Luo M. Chen C. Liu S.G. Peera X. Qi J. Liu U.P. Kumar T.L.T. Liang Evaluating the catalytic activity of transition metal dimers for the oxygen reduction reaction J. Colloid Interface Sci. 568 2020 54 62 10.1016/j.jcis.2020.02.034 Z. Liang, M. Luo, M. Chen, C. Liu, S.G. Peera, X. Qi, J. Liu, U.P. Kumar, T.L.T. Liang, Evaluating the catalytic activity of transition metal dimers for the oxygen reduction reaction, J. Colloid Interface Sci.568 (2020) 54–62. 10.1016/j.jcis.2020.02.034. [66] K.W. Jacobsen J.K. Norskov M.J. Puska Interatomic interactions in the effective-medium theory Phys. Rev. B 35 1987 7423 7442 10.1103/PhysRevB.35.7423 K.W. Jacobsen, J.K. Norskov, M.J. Puska, Interatomic interactions in the effective-medium theory, Phys. Rev. B35 (1987) 7423–7442. 10.1103/PhysRevB.35.7423. [67] M. Liu C. Liu M. Luo S.G. Peera T. Liang Theoretical study on iron and nitrogen co-doped graphene catalyzes CO oxidation Mol. Catal. 509 2021 111624 10.1016/j.mcat.2021.111624 M. Liu, C. Liu, M. Luo, S.G. Peera, T. Liang, Theoretical study on iron and nitrogen co-doped graphene catalyzes CO oxidation, Mol. Catal.509 (2021) 111624. 10.1016/j.mcat.2021.111624. [68] S. Mei J. Gu T. Ma X. Li Y. Hu W. Li J. Zhang Y. Han N-doped activated carbon from used dyeing wastewater adsorbent as a metal-free catalyst for acetylene hydrochlorination Chem. Eng. J. 371 2019 118 129 10.1016/j.cej.2019.04.008 S. Mei, J. Gu, T. Ma, X. Li, Y. Hu, W. Li, J. Zhang, Y. Han, N-doped activated carbon from used dyeing wastewater adsorbent as a metal-free catalyst for acetylene hydrochlorination, Chem. Eng. J.371 (2019) 118–129. 10.1016/j.cej.2019.04.008. [69] Y. Han M. Sun W. Li J. Zhang Influence of chlorine coordination number on the catalytic mechanism of ruthenium chloride catalysts in the acetylene hydrochlorination reaction: a DFT study Phys. Chem. Chem. Phys. 17 2015 7720 7730 10.1039/C5CP00231A Y. Han, M. Sun, W. Li, J. Zhang, Influence of chlorine coordination number on the catalytic mechanism of ruthenium chloride catalysts in the acetylene hydrochlorination reaction: a DFT study, Phys. Chem. Chem. Phys.17 (2015) 7720–7730. 10.1039/C5CP00231A.",
      "scopus-id": "85113266248",
      "coredata": {
        "eid": "1-s2.0-S2468823121004430",
        "dc:description": "Ruthenium-based catalysts exhibit excellent catalyst activity in the acetylene hydrochlorination reaction and tend to be a good substitute for mercury-based catalysts due to their cheaper price among the precious metal catalysts. In this work, spin-polarized density functional theory (DFT) calculations were carried out to investigate the properties of the ruthenium single-atom catalysts supported on six different substrates (four pyridine nitrogen-doped carbon, four or three pyrrole nitrogen-doped carbon, C2N, CN and g-C3N4), and the reaction mechanisms of acetylene hydrochlorination catalyzed by them at 453 K. According to the results of calculations, it could be found that the reaction had the lowest free energy barrier of 16.83 kcal/mol on the Ru@4 × N6 (pyridine nitrogen-doped carbon), while it had the highest free energy barrier of 49.06 kcal/mol on the Ru@g-C3N4. This work will provide a theoretical support for the design of ruthenium single-atom catalysts for acetylene hydrochlorination reaction.",
        "openArchiveArticle": "false",
        "prism:coverDate": "2021-08-31",
        "openaccessUserLicense": null,
        "prism:aggregationType": "Journal",
        "prism:url": "https://api.elsevier.com/content/article/pii/S2468823121004430",
        "dc:creator": [
          {
            "@_fa": "true",
            "$": "Jia, Yiming"
          },
          {
            "@_fa": "true",
            "$": "Nian, Yao"
          },
          {
            "@_fa": "true",
            "$": "Zhang, Jinli"
          },
          {
            "@_fa": "true",
            "$": "Han, You"
          }
        ],
        "link": [
          {
            "@_fa": "true",
            "@rel": "self",
            "@href": "https://api.elsevier.com/content/article/pii/S2468823121004430"
          },
          {
            "@_fa": "true",
            "@rel": "scidir",
            "@href": "https://www.sciencedirect.com/science/article/pii/S2468823121004430"
          }
        ],
        "dc:format": "application/json",
        "openaccessType": null,
        "pii": "S2468-8231(21)00443-0",
        "prism:volume": "513",
        "articleNumber": "111826",
        "prism:publisher": "Elsevier B.V.",
        "dc:title": "Theoretical design of ruthenium single-atom catalysts with different substrates for acetylene hydrochlorination",
        "prism:copyright": "© 2021 Elsevier B.V. All rights reserved.",
        "openaccess": "0",
        "prism:issn": "24688231",
        "dcterms:subject": [
          {
            "@_fa": "true",
            "$": "Acetylene hydrochlorination"
          },
          {
            "@_fa": "true",
            "$": "Mechanism"
          },
          {
            "@_fa": "true",
            "$": "Density functional theory"
          },
          {
            "@_fa": "true",
            "$": "Ru single-atom catalyst"
          }
        ],
        "openaccessArticle": "false",
        "prism:publicationName": "Molecular Catalysis",
        "openaccessSponsorType": null,
        "prism:pageRange": "111826",
        "pubType": "fla",
        "prism:coverDisplayDate": "August 2021",
        "prism:doi": "10.1016/j.mcat.2021.111826",
        "prism:startingPage": "111826",
        "dc:identifier": "doi:10.1016/j.mcat.2021.111826",
        "openaccessSponsorName": null
      },
      "objects": {
        "object": [
          {
            "@category": "standard",
            "@height": "394",
            "@width": "774",
            "@_fa": "true",
            "$": "https://api.elsevier.com/content/object/eid/1-s2.0-S2468823121004430-gr1.jpg?httpAccept=%2A%2F%2A",
            "@multimediatype": "JPEG image file",
            "@type": "IMAGE-DOWNSAMPLED",
            "@size": "121183",
            "@ref": "gr1",
            "@mimetype": "image/jpeg"
          },
          {
            "@category": "standard",
            "@height": "204",
            "@width": "339",
            "@_fa": "true",
            "$": "https://api.elsevier.com/content/object/eid/1-s2.0-S2468823121004430-gr10.jpg?httpAccept=%2A%2F%2A",
            "@multimediatype": "JPEG image file",
            "@type": "IMAGE-DOWNSAMPLED",
            "@size": "22284",
            "@ref": "gr10",
            "@mimetype": "image/jpeg"
          },
          {
            "@category": "standard",
            "@height": "210",
            "@width": "339",
            "@_fa": "true",
            "$": "https://api.elsevier.com/content/object/eid/1-s2.0-S2468823121004430-gr6.jpg?httpAccept=%2A%2F%2A",
            "@multimediatype": "JPEG image file",
            "@type": "IMAGE-DOWNSAMPLED",
            "@size": "31431",
            "@ref": "gr6",
            "@mimetype": "image/jpeg"
          },
          {
            "@category": "standard",
            "@height": "176",
            "@width": "339",
            "@_fa": "true",
            "$": "https://api.elsevier.com/content/object/eid/1-s2.0-S2468823121004430-gr7.jpg?httpAccept=%2A%2F%2A",
            "@multimediatype": "JPEG image file",
            "@type": "IMAGE-DOWNSAMPLED",
            "@size": "19592",
            "@ref": "gr7",
            "@mimetype": "image/jpeg"
          },
          {
            "@category": "standard",
            "@height": "190",
            "@width": "339",
            "@_fa": "true",
            "$": "https://api.elsevier.com/content/object/eid/1-s2.0-S2468823121004430-gr8.jpg?httpAccept=%2A%2F%2A",
            "@multimediatype": "JPEG image file",
            "@type": "IMAGE-DOWNSAMPLED",
            "@size": "21182",
            "@ref": "gr8",
            "@mimetype": "image/jpeg"
          },
          {
            "@category": "standard",
            "@height": "227",
            "@width": "339",
            "@_fa": "true",
            "$": "https://api.elsevier.com/content/object/eid/1-s2.0-S2468823121004430-gr9.jpg?httpAccept=%2A%2F%2A",
            "@multimediatype": "JPEG image file",
            "@type": "IMAGE-DOWNSAMPLED",
            "@size": "21553",
            "@ref": "gr9",
            "@mimetype": "image/jpeg"
          },
          {
            "@category": "standard",
            "@height": "678",
            "@width": "527",
            "@_fa": "true",
            "$": "https://api.elsevier.com/content/object/eid/1-s2.0-S2468823121004430-gr2.jpg?httpAccept=%2A%2F%2A",
            "@multimediatype": "JPEG image file",
            "@type": "IMAGE-DOWNSAMPLED",
            "@size": "166161",
            "@ref": "gr2",
            "@mimetype": "image/jpeg"
          },
          {
            "@category": "standard",
            "@height": "169",
            "@width": "301",
            "@_fa": "true",
            "$": "https://api.elsevier.com/content/object/eid/1-s2.0-S2468823121004430-ga1.jpg?httpAccept=%2A%2F%2A",
            "@multimediatype": "JPEG image file",
            "@type": "IMAGE-DOWNSAMPLED",
            "@size": "33514",
            "@ref": "ga1",
            "@mimetype": "image/jpeg"
          },
          {
            "@category": "standard",
            "@height": "176",
            "@width": "774",
            "@_fa": "true",
            "$": "https://api.elsevier.com/content/object/eid/1-s2.0-S2468823121004430-gr3.jpg?httpAccept=%2A%2F%2A",
            "@multimediatype": "JPEG image file",
            "@type": "IMAGE-DOWNSAMPLED",
            "@size": "87199",
            "@ref": "gr3",
            "@mimetype": "image/jpeg"
          },
          {
            "@category": "standard",
            "@height": "274",
            "@width": "623",
            "@_fa": "true",
            "$": "https://api.elsevier.com/content/object/eid/1-s2.0-S2468823121004430-gr4.jpg?httpAccept=%2A%2F%2A",
            "@multimediatype": "JPEG image file",
            "@type": "IMAGE-DOWNSAMPLED",
            "@size": "61945",
            "@ref": "gr4",
            "@mimetype": "image/jpeg"
          },
          {
            "@category": "standard",
            "@height": "181",
            "@width": "339",
            "@_fa": "true",
            "$": "https://api.elsevier.com/content/object/eid/1-s2.0-S2468823121004430-gr5.jpg?httpAccept=%2A%2F%2A",
            "@multimediatype": "JPEG image file",
            "@type": "IMAGE-DOWNSAMPLED",
            "@size": "21401",
            "@ref": "gr5",
            "@mimetype": "image/jpeg"
          },
          {
            "@category": "thumbnail",
            "@height": "112",
            "@width": "219",
            "@_fa": "true",
            "$": "https://api.elsevier.com/content/object/eid/1-s2.0-S2468823121004430-gr1.sml?httpAccept=%2A%2F%2A",
            "@multimediatype": "GIF image file",
            "@type": "IMAGE-THUMBNAIL",
            "@size": "14476",
            "@ref": "gr1",
            "@mimetype": "image/gif"
          },
          {
            "@category": "thumbnail",
            "@height": "132",
            "@width": "219",
            "@_fa": "true",
            "$": "https://api.elsevier.com/content/object/eid/1-s2.0-S2468823121004430-gr10.sml?httpAccept=%2A%2F%2A",
            "@multimediatype": "GIF image file",
            "@type": "IMAGE-THUMBNAIL",
            "@size": "9689",
            "@ref": "gr10",
            "@mimetype": "image/gif"
          },
          {
            "@category": "thumbnail",
            "@height": "136",
            "@width": "219",
            "@_fa": "true",
            "$": "https://api.elsevier.com/content/object/eid/1-s2.0-S2468823121004430-gr6.sml?httpAccept=%2A%2F%2A",
            "@multimediatype": "GIF image file",
            "@type": "IMAGE-THUMBNAIL",
            "@size": "15142",
            "@ref": "gr6",
            "@mimetype": "image/gif"
          },
          {
            "@category": "thumbnail",
            "@height": "114",
            "@width": "219",
            "@_fa": "true",
            "$": "https://api.elsevier.com/content/object/eid/1-s2.0-S2468823121004430-gr7.sml?httpAccept=%2A%2F%2A",
            "@multimediatype": "GIF image file",
            "@type": "IMAGE-THUMBNAIL",
            "@size": "10689",
            "@ref": "gr7",
            "@mimetype": "image/gif"
          },
          {
            "@category": "thumbnail",
            "@height": "123",
            "@width": "219",
            "@_fa": "true",
            "$": "https://api.elsevier.com/content/object/eid/1-s2.0-S2468823121004430-gr8.sml?httpAccept=%2A%2F%2A",
            "@multimediatype": "GIF image file",
            "@type": "IMAGE-THUMBNAIL",
            "@size": "11200",
            "@ref": "gr8",
            "@mimetype": "image/gif"
          },
          {
            "@category": "thumbnail",
            "@height": "146",
            "@width": "219",
            "@_fa": "true",
            "$": "https://api.elsevier.com/content/object/eid/1-s2.0-S2468823121004430-gr9.sml?httpAccept=%2A%2F%2A",
            "@multimediatype": "GIF image file",
            "@type": "IMAGE-THUMBNAIL",
            "@size": "8463",
            "@ref": "gr9",
            "@mimetype": "image/gif"
          },
          {
            "@category": "thumbnail",
            "@height": "163",
            "@width": "127",
            "@_fa": "true",
            "$": "https://api.elsevier.com/content/object/eid/1-s2.0-S2468823121004430-gr2.sml?httpAccept=%2A%2F%2A",
            "@multimediatype": "GIF image file",
            "@type": "IMAGE-THUMBNAIL",
            "@size": "14761",
            "@ref": "gr2",
            "@mimetype": "image/gif"
          },
          {
            "@category": "thumbnail",
            "@height": "123",
            "@width": "219",
            "@_fa": "true",
            "$": "https://api.elsevier.com/content/object/eid/1-s2.0-S2468823121004430-ga1.sml?httpAccept=%2A%2F%2A",
            "@multimediatype": "GIF image file",
            "@type": "IMAGE-THUMBNAIL",
            "@size": "17670",
            "@ref": "ga1",
            "@mimetype": "image/gif"
          },
          {
            "@category": "thumbnail",
            "@height": "50",
            "@width": "219",
            "@_fa": "true",
            "$": "https://api.elsevier.com/content/object/eid/1-s2.0-S2468823121004430-gr3.sml?httpAccept=%2A%2F%2A",
            "@multimediatype": "GIF image file",
            "@type": "IMAGE-THUMBNAIL",
            "@size": "10877",
            "@ref": "gr3",
            "@mimetype": "image/gif"
          },
          {
            "@category": "thumbnail",
            "@height": "96",
            "@width": "219",
            "@_fa": "true",
            "$": "https://api.elsevier.com/content/object/eid/1-s2.0-S2468823121004430-gr4.sml?httpAccept=%2A%2F%2A",
            "@multimediatype": "GIF image file",
            "@type": "IMAGE-THUMBNAIL",
            "@size": "10501",
            "@ref": "gr4",
            "@mimetype": "image/gif"
          },
          {
            "@category": "thumbnail",
            "@height": "117",
            "@width": "219",
            "@_fa": "true",
            "$": "https://api.elsevier.com/content/object/eid/1-s2.0-S2468823121004430-gr5.sml?httpAccept=%2A%2F%2A",
            "@multimediatype": "GIF image file",
            "@type": "IMAGE-THUMBNAIL",
            "@size": "11168",
            "@ref": "gr5",
            "@mimetype": "image/gif"
          },
          {
            "@category": "high",
            "@height": "1745",
            "@width": "3425",
            "@_fa": "true",
            "$": "https://api.elsevier.com/content/object/eid/1-s2.0-S2468823121004430-gr1_lrg.jpg?httpAccept=%2A%2F%2A",
            "@multimediatype": "JPEG image file",
            "@type": "IMAGE-HIGH-RES",
            "@size": "998800",
            "@ref": "gr1",
            "@mimetype": "image/jpeg"
          },
          {
            "@category": "high",
            "@height": "901",
            "@width": "1500",
            "@_fa": "true",
            "$": "https://api.elsevier.com/content/object/eid/1-s2.0-S2468823121004430-gr10_lrg.jpg?httpAccept=%2A%2F%2A",
            "@multimediatype": "JPEG image file",
            "@type": "IMAGE-HIGH-RES",
            "@size": "165356",
            "@ref": "gr10",
            "@mimetype": "image/jpeg"
          },
          {
            "@category": "high",
            "@height": "929",
            "@width": "1500",
            "@_fa": "true",
            "$": "https://api.elsevier.com/content/object/eid/1-s2.0-S2468823121004430-gr6_lrg.jpg?httpAccept=%2A%2F%2A",
            "@multimediatype": "JPEG image file",
            "@type": "IMAGE-HIGH-RES",
            "@size": "238569",
            "@ref": "gr6",
            "@mimetype": "image/jpeg"
          },
          {
            "@category": "high",
            "@height": "780",
            "@width": "1500",
            "@_fa": "true",
            "$": "https://api.elsevier.com/content/object/eid/1-s2.0-S2468823121004430-gr7_lrg.jpg?httpAccept=%2A%2F%2A",
            "@multimediatype": "JPEG image file",
            "@type": "IMAGE-HIGH-RES",
            "@size": "145052",
            "@ref": "gr7",
            "@mimetype": "image/jpeg"
          },
          {
            "@category": "high",
            "@height": "842",
            "@width": "1500",
            "@_fa": "true",
            "$": "https://api.elsevier.com/content/object/eid/1-s2.0-S2468823121004430-gr8_lrg.jpg?httpAccept=%2A%2F%2A",
            "@multimediatype": "JPEG image file",
            "@type": "IMAGE-HIGH-RES",
            "@size": "154624",
            "@ref": "gr8",
            "@mimetype": "image/jpeg"
          },
          {
            "@category": "high",
            "@height": "1003",
            "@width": "1500",
            "@_fa": "true",
            "$": "https://api.elsevier.com/content/object/eid/1-s2.0-S2468823121004430-gr9_lrg.jpg?httpAccept=%2A%2F%2A",
            "@multimediatype": "JPEG image file",
            "@type": "IMAGE-HIGH-RES",
            "@size": "131916",
            "@ref": "gr9",
            "@mimetype": "image/jpeg"
          },
          {
            "@category": "high",
            "@height": "3002",
            "@width": "2333",
            "@_fa": "true",
            "$": "https://api.elsevier.com/content/object/eid/1-s2.0-S2468823121004430-gr2_lrg.jpg?httpAccept=%2A%2F%2A",
            "@multimediatype": "JPEG image file",
            "@type": "IMAGE-HIGH-RES",
            "@size": "1145102",
            "@ref": "gr2",
            "@mimetype": "image/jpeg"
          },
          {
            "@category": "high",
            "@height": "750",
            "@width": "1333",
            "@_fa": "true",
            "$": "https://api.elsevier.com/content/object/eid/1-s2.0-S2468823121004430-ga1_lrg.jpg?httpAccept=%2A%2F%2A",
            "@multimediatype": "JPEG image file",
            "@type": "IMAGE-HIGH-RES",
            "@size": "266584",
            "@ref": "ga1",
            "@mimetype": "image/jpeg"
          },
          {
            "@category": "high",
            "@height": "778",
            "@width": "3425",
            "@_fa": "true",
            "$": "https://api.elsevier.com/content/object/eid/1-s2.0-S2468823121004430-gr3_lrg.jpg?httpAccept=%2A%2F%2A",
            "@multimediatype": "JPEG image file",
            "@type": "IMAGE-HIGH-RES",
            "@size": "680038",
            "@ref": "gr3",
            "@mimetype": "image/jpeg"
          },
          {
            "@category": "high",
            "@height": "1211",
            "@width": "2758",
            "@_fa": "true",
            "$": "https://api.elsevier.com/content/object/eid/1-s2.0-S2468823121004430-gr4_lrg.jpg?httpAccept=%2A%2F%2A",
            "@multimediatype": "JPEG image file",
            "@type": "IMAGE-HIGH-RES",
            "@size": "487179",
            "@ref": "gr4",
            "@mimetype": "image/jpeg"
          },
          {
            "@category": "high",
            "@height": "802",
            "@width": "1500",
            "@_fa": "true",
            "$": "https://api.elsevier.com/content/object/eid/1-s2.0-S2468823121004430-gr5_lrg.jpg?httpAccept=%2A%2F%2A",
            "@multimediatype": "JPEG image file",
            "@type": "IMAGE-HIGH-RES",
            "@size": "161580",
            "@ref": "gr5",
            "@mimetype": "image/jpeg"
          },
          {
            "@category": "standard",
            "@_fa": "true",
            "$": "https://api.elsevier.com/content/object/eid/1-s2.0-S2468823121004430-mmc1.docx?httpAccept=%2A%2F%2A",
            "@multimediatype": "Microsoft Word file",
            "@type": "APPLICATION",
            "@size": "113815794",
            "@ref": "mmc1",
            "@mimetype": "application/word"
          },
          {
            "@category": "thumbnail",
            "@_fa": "true",
            "$": "https://api.elsevier.com/content/object/eid/1-s2.0-S2468823121004430-si1.svg?httpAccept=%2A%2F%2A",
            "@multimediatype": "Scalable Vector Graphics file",
            "@type": "ALTIMG",
            "@size": "15084",
            "@ref": "si1",
            "@mimetype": "image/svg+xml"
          },
          {
            "@category": "thumbnail",
            "@_fa": "true",
            "$": "https://api.elsevier.com/content/object/eid/1-s2.0-S2468823121004430-si2.svg?httpAccept=%2A%2F%2A",
            "@multimediatype": "Scalable Vector Graphics file",
            "@type": "ALTIMG",
            "@size": "9125",
            "@ref": "si2",
            "@mimetype": "image/svg+xml"
          },
          {
            "@category": "standard",
            "@_fa": "true",
            "$": "https://api.elsevier.com/content/object/eid/1-s2.0-S2468823121004430-am.pdf?httpAccept=%2A%2F%2A",
            "@multimediatype": "Acrobat PDF file",
            "@type": "AAM-PDF",
            "@size": "4981897",
            "@ref": "am",
            "@mimetype": "application/pdf"
          }
        ]
      },
      "link": {
        "@rel": "abstract",
        "@href": "https://api.elsevier.com/content/abstract/scopus_id/85113266248"
      }
    }
  }
}