{
  "metadata": {
    "title": "Enhanced catalytic performance of isobutane direct dehydrogenation over Pt-In catalysts: Effect of different fluorides modified hydrotalcite-like derivatives",
    "authors": "; ; ",
    "journal": "Molecular Catalysis",
    "date": "2021-10-31",
    "doi": "10.1016/j.mcat.2021.111944",
    "abstract": "",
    "uri": "https://api.elsevier.com/content/article/pii/S2468823121005617",
    "pii": "S2468823121005617"
  },
  "fulltext": {
    "full-text-retrieval-response": {
      "scopus-eid": "2-s2.0-85116938358",
      "originalText": "serial JL 315758 291210 291744 291790 291809 31 Molecular Catalysis MOLECULARCATALYSIS 2021-10-13 2021-10-13 2021-10-13 2021-10-13 2021-12-01T07:56:01 1-s2.0-S2468823121005617 S2468-8231(21)00561-7 S2468823121005617 10.1016/j.mcat.2021.111944 S300 S300.1 FULL-TEXT 1-s2.0-S2468823121X00156 2022-12-12T23:36:21.627889Z 0 0 20211001 20211031 2021 2021-10-13T23:31:03.859585Z absattachment articleinfo articlenumber articletitlenorm authfirstinitialnorm authfirstsurnamenorm cid cids contenttype copyright crossmark dateloaded dateloadedtxt datesearch datesort dateupdated dco docsubtype doctype doi eid ewtransactionid hubeid indexeddate issn issnnorm itemstage itemtransactionid itemweight openaccess openarchive pg pgfirst pii piinorm pubdateend pubdatestart pubdatetxt pubyr sectiontitle sortorder srctitle srctitlenorm srctype ssids alllist content subj subheadings suppl tomb volfirst volissue volumelist webpdf webpdfpagecount yearnav figure table e-component body mmlmath acknowledge affil appendices articletitle auth authfirstini authfull authkeywords authlast footnotes grantnumber grantsponsor grantsponsorid highlightsabst primabst ref specialabst 2468-8231 24688231 true 515 515 C Volume 515 61 111944 111944 111944 202110 October 2021 2021-10-01 2021-10-31 2021 Regular Papers article fla © 2021 Elsevier B.V. All rights reserved. ENHANCEDCATALYTICPERFORMANCEISOBUTANEDIRECTDEHYDROGENATIONOVERPTINCATALYSTSEFFECTDIFFERENTFLUORIDESMODIFIEDHYDROTALCITELIKEDERIVATIVES SONG Z 1 Introduction 2 Experimental 2.1 Preparation of catalysts 2.1.1 Materials 2.1.2 Synthesis of supports 2.1.3 Synthesis of catalysts 2.2 Catalyst characterization 2.3 Catalytic tests 3 Results and discussion 3.1 Catalytic activity 3.2 Structure, texture and physico-chemical properties of fresh catalysts 3.2.1 XRD 3.2.2 N2 adsorption-desorption isotherms 3.2.3 SEM 3.2.4 TEM 3.2.5 XPS 3.3 Analysis of coke deposition and Pt-sintering in the spent catalysts 3.3.1 TG-DTA and O2-TPO 3.3.2 TEM 4 Conclusion CRediT authorship contribution statement Acknowledgment Appendix Supplementary materials References BAEK 2012 1893 1903 J LI 2019 686 696 J BHASIN 2001 394 419 M XU 2013 76 81 L ZANGENEH 2013 730 735 F SHI 2015 13994 13998 L ZHU 2017 6973 6978 Y LI 2011 18 26 Q XIA 2016 1068 1079 K LI 2019 767 J XIA 2016 104 114 K SUN 2018 4454 G HAN 2014 10000 10008 Z SIDDIQI 2010 200 206 G SILVESTREALBERO 2005 244 251 J ZHANG 2007 1009 1016 Y BALLARINI 2013 235 245 A LIU 2014 183 192 X CHEN 2019 611 621 X XIA 2015 64689 64695 K SONG 2016 94636 94642 Y JI 2020 719 729 Z WU 2010 107 113 G LIU 2010 141 151 Y PAN 2019 855 864 S ZHANG 2017 1181 1196 X SHI 2014 5772 5781 J RASHIDI 2015 239 247 M VAEZIFAR 2011 370 377 S OTROSHCHENKO 2017 4499 4510 T BOCANEGRA 2004 11 22 S LIU 2018 11265 11270 J LUO 2020 109864 Y TOLEK 2018 1624 1632 W SUN 2011 165 174 P SONG 2021 478 Z DEAN 1985 J LANGESHANDBOOKCHEMISTRY NEWMAN 1998 105 115 S WANG 2014 44 51 Q WEGENER 2018 146 153 E DENG 2014 2680 2691 L CHEN 2019 115016 H HAN 2017 6000 6012 W MARTIN 2004 1206 1210 N JIANG 2014 438 447 F SONGX2021X111944 SONGX2021X111944XZ 2023-10-13T00:00:00.000Z 2023-10-13T00:00:00.000Z http://creativecommons.org/licenses/by-nc-nd/4.0/ © 2021 Elsevier B.V. All rights reserved. 2021-10-16T21:33:46.248Z http://vtw.elsevier.com/data/voc/AddOnTypes/50.7/aggregated-refined National Natural Science Foundation of China 21776214 NSFC National Natural Science Foundation of China http://data.elsevier.com/vocabulary/SciValFunders/501100001809 http://sws.geonames.org/1814991/ This work was supported by the National Natural Science Foundation of China ( 21776214 ). 0 https://doi.org/10.15223/policy-017 https://doi.org/10.15223/policy-037 https://doi.org/10.15223/policy-012 https://doi.org/10.15223/policy-029 https://doi.org/10.15223/policy-004 item S2468-8231(21)00561-7 S2468823121005617 1-s2.0-S2468823121005617 10.1016/j.mcat.2021.111944 315758 2022-02-09T09:58:50.896238Z 2021-10-01 2021-10-31 1-s2.0-S2468823121005617-main.pdf https://s3-eu-west-1.amazonaws.com/prod-ucs-content-store-eu-west/content/pii:S2468823121005617/MAIN/application/pdf/874e72ac357795d95de623de2eba9dac/main.pdf main.pdf pdf true 9676601 MAIN 9 1-s2.0-S2468823121005617-main_1.png https://s3-eu-west-1.amazonaws.com/prod-ucs-content-store-eu-west/content/pii:S2468823121005617/PREVIEW/image/png/d3ab4371d05737dc6b267f23a7d527a8/main_1.png main_1.png png 58377 849 656 IMAGE-WEB-PDF 1 1-s2.0-S2468823121005617-gr7.jpg https://s3-eu-west-1.amazonaws.com/prod-ucs-content-store-eu-west/content/pii:S2468823121005617/gr7/DOWNSAMPLED/image/jpeg/b7b655118af7b631817fb279b06d7f98/gr7.jpg gr7 gr7.jpg jpg 184266 586 584 IMAGE-DOWNSAMPLED 1-s2.0-S2468823121005617-gr6.jpg https://s3-eu-west-1.amazonaws.com/prod-ucs-content-store-eu-west/content/pii:S2468823121005617/gr6/DOWNSAMPLED/image/jpeg/6ced44c4ac1b510774f748c2115554ff/gr6.jpg gr6 gr6.jpg jpg 58904 244 637 IMAGE-DOWNSAMPLED 1-s2.0-S2468823121005617-gr5.jpg https://s3-eu-west-1.amazonaws.com/prod-ucs-content-store-eu-west/content/pii:S2468823121005617/gr5/DOWNSAMPLED/image/jpeg/daf03f9495b6bb1e33da4d7d20745b38/gr5.jpg gr5 gr5.jpg jpg 126284 514 656 IMAGE-DOWNSAMPLED 1-s2.0-S2468823121005617-gr4.jpg https://s3-eu-west-1.amazonaws.com/prod-ucs-content-store-eu-west/content/pii:S2468823121005617/gr4/DOWNSAMPLED/image/jpeg/2ec1d75b4ce61be82ae36b237252757a/gr4.jpg gr4 gr4.jpg jpg 154439 694 495 IMAGE-DOWNSAMPLED 1-s2.0-S2468823121005617-gr3.jpg https://s3-eu-west-1.amazonaws.com/prod-ucs-content-store-eu-west/content/pii:S2468823121005617/gr3/DOWNSAMPLED/image/jpeg/24658a990d5d9de06454a5ecd8f6c7c0/gr3.jpg gr3 gr3.jpg jpg 53236 255 639 IMAGE-DOWNSAMPLED 1-s2.0-S2468823121005617-gr2.jpg https://s3-eu-west-1.amazonaws.com/prod-ucs-content-store-eu-west/content/pii:S2468823121005617/gr2/DOWNSAMPLED/image/jpeg/cb13ecc39e016044933f39ca706be521/gr2.jpg gr2 gr2.jpg jpg 73807 424 386 IMAGE-DOWNSAMPLED 1-s2.0-S2468823121005617-ga1.jpg https://s3-eu-west-1.amazonaws.com/prod-ucs-content-store-eu-west/content/pii:S2468823121005617/ga1/DOWNSAMPLED/image/jpeg/1d917361151fa2342ae49b32cf79278e/ga1.jpg ga1 true ga1.jpg jpg 20164 87 301 IMAGE-DOWNSAMPLED 1-s2.0-S2468823121005617-gr1.jpg https://s3-eu-west-1.amazonaws.com/prod-ucs-content-store-eu-west/content/pii:S2468823121005617/gr1/DOWNSAMPLED/image/jpeg/ae2b160f8507376a51501bed65667415/gr1.jpg gr1 gr1.jpg jpg 86744 546 391 IMAGE-DOWNSAMPLED 1-s2.0-S2468823121005617-gr7.sml https://s3-eu-west-1.amazonaws.com/prod-ucs-content-store-eu-west/content/pii:S2468823121005617/gr7/THUMBNAIL/image/gif/cdd0934959b66a8e797dc35906e713d2/gr7.sml gr7 gr7.sml sml 28215 164 163 IMAGE-THUMBNAIL 1-s2.0-S2468823121005617-gr6.sml https://s3-eu-west-1.amazonaws.com/prod-ucs-content-store-eu-west/content/pii:S2468823121005617/gr6/THUMBNAIL/image/gif/7126661d4df41a556107ee0592394cec/gr6.sml gr6 gr6.sml sml 10020 84 219 IMAGE-THUMBNAIL 1-s2.0-S2468823121005617-gr5.sml https://s3-eu-west-1.amazonaws.com/prod-ucs-content-store-eu-west/content/pii:S2468823121005617/gr5/THUMBNAIL/image/gif/8c871860d7150e65c7140493c912e8ae/gr5.sml gr5 gr5.sml sml 14993 164 209 IMAGE-THUMBNAIL 1-s2.0-S2468823121005617-gr4.sml https://s3-eu-west-1.amazonaws.com/prod-ucs-content-store-eu-west/content/pii:S2468823121005617/gr4/THUMBNAIL/image/gif/1dbe65e9ffa6e21e13ff8d772f893e64/gr4.sml gr4 gr4.sml sml 19675 164 117 IMAGE-THUMBNAIL 1-s2.0-S2468823121005617-gr3.sml https://s3-eu-west-1.amazonaws.com/prod-ucs-content-store-eu-west/content/pii:S2468823121005617/gr3/THUMBNAIL/image/gif/d8ddad9cca2ea2ac71d5162a1ab26467/gr3.sml gr3 gr3.sml sml 9184 87 219 IMAGE-THUMBNAIL 1-s2.0-S2468823121005617-gr2.sml https://s3-eu-west-1.amazonaws.com/prod-ucs-content-store-eu-west/content/pii:S2468823121005617/gr2/THUMBNAIL/image/gif/41ad4c4e89e7124a134036ab96705a39/gr2.sml gr2 gr2.sml sml 12714 163 149 IMAGE-THUMBNAIL 1-s2.0-S2468823121005617-ga1.sml https://s3-eu-west-1.amazonaws.com/prod-ucs-content-store-eu-west/content/pii:S2468823121005617/ga1/THUMBNAIL/image/gif/55a6f0fd90e48c8d19b4af65834a3110/ga1.sml ga1 true ga1.sml sml 9664 63 219 IMAGE-THUMBNAIL 1-s2.0-S2468823121005617-gr1.sml https://s3-eu-west-1.amazonaws.com/prod-ucs-content-store-eu-west/content/pii:S2468823121005617/gr1/THUMBNAIL/image/gif/06988192d984941596865c5e4635316b/gr1.sml gr1 gr1.sml sml 9950 163 117 IMAGE-THUMBNAIL 1-s2.0-S2468823121005617-gr7_lrg.jpg https://s3-eu-west-1.amazonaws.com/prod-ucs-content-store-eu-west/content/pii:S2468823121005617/gr7/HIGHRES/image/jpeg/86813a24c415fee386f32359aa08a544/gr7_lrg.jpg gr7 gr7_lrg.jpg jpg 1600538 2599 2588 IMAGE-HIGH-RES 1-s2.0-S2468823121005617-gr6_lrg.jpg https://s3-eu-west-1.amazonaws.com/prod-ucs-content-store-eu-west/content/pii:S2468823121005617/gr6/HIGHRES/image/jpeg/3d03d504b2e3ace7a8f51124aec3f9b8/gr6_lrg.jpg gr6 gr6_lrg.jpg jpg 431423 1082 2823 IMAGE-HIGH-RES 1-s2.0-S2468823121005617-gr5_lrg.jpg https://s3-eu-west-1.amazonaws.com/prod-ucs-content-store-eu-west/content/pii:S2468823121005617/gr5/HIGHRES/image/jpeg/f86aa00a0b144c53930451ce8b4988af/gr5_lrg.jpg gr5 gr5_lrg.jpg jpg 918768 2275 2903 IMAGE-HIGH-RES 1-s2.0-S2468823121005617-gr4_lrg.jpg https://s3-eu-west-1.amazonaws.com/prod-ucs-content-store-eu-west/content/pii:S2468823121005617/gr4/HIGHRES/image/jpeg/1fd76cd9632918564ab858cdfc62ae27/gr4_lrg.jpg gr4 gr4_lrg.jpg jpg 1340576 3074 2194 IMAGE-HIGH-RES 1-s2.0-S2468823121005617-gr3_lrg.jpg https://s3-eu-west-1.amazonaws.com/prod-ucs-content-store-eu-west/content/pii:S2468823121005617/gr3/HIGHRES/image/jpeg/a6efdde8bfaad4ba96e74f1133470595/gr3_lrg.jpg gr3 gr3_lrg.jpg jpg 369395 1128 2831 IMAGE-HIGH-RES 1-s2.0-S2468823121005617-gr2_lrg.jpg https://s3-eu-west-1.amazonaws.com/prod-ucs-content-store-eu-west/content/pii:S2468823121005617/gr2/HIGHRES/image/jpeg/389df20c3b984063e25ece80586b226a/gr2_lrg.jpg gr2 gr2_lrg.jpg jpg 500125 1874 1708 IMAGE-HIGH-RES 1-s2.0-S2468823121005617-ga1_lrg.jpg https://s3-eu-west-1.amazonaws.com/prod-ucs-content-store-eu-west/content/pii:S2468823121005617/ga1/HIGHRES/image/jpeg/c8829e0d2744a65b82ab1603a67dd352/ga1_lrg.jpg ga1 true ga1_lrg.jpg jpg 154053 384 1333 IMAGE-HIGH-RES 1-s2.0-S2468823121005617-gr1_lrg.jpg https://s3-eu-west-1.amazonaws.com/prod-ucs-content-store-eu-west/content/pii:S2468823121005617/gr1/HIGHRES/image/jpeg/254a702629d46f13dbe234c70c3198c9/gr1_lrg.jpg gr1 gr1_lrg.jpg jpg 638829 2419 1733 IMAGE-HIGH-RES 1-s2.0-S2468823121005617-mmc1.docx https://s3-eu-west-1.amazonaws.com/prod-ucs-content-store-eu-west/content/pii:S2468823121005617/mmc1/MAIN/application/vnd.openxmlformats-officedocument.wordprocessingml.document/fff5feae902a15fcb7de35fdbcb69f4e/mmc1.docx mmc1 mmc1.docx docx 935089 APPLICATION 1-s2.0-S2468823121005617-si1.svg https://s3-eu-west-1.amazonaws.com/prod-ucs-content-store-eu-west/content/pii:S2468823121005617/STRIPIN/image/svg+xml/80a6bb5688f1d6f855eff2a1f62f8b70/si1.svg si1 si1.svg svg 15717 ALTIMG 1-s2.0-S2468823121005617-si2.svg https://s3-eu-west-1.amazonaws.com/prod-ucs-content-store-eu-west/content/pii:S2468823121005617/STRIPIN/image/svg+xml/f7d15d28a17121462b15885378953a12/si2.svg si2 si2.svg svg 17768 ALTIMG 1-s2.0-S2468823121005617-si3.svg https://s3-eu-west-1.amazonaws.com/prod-ucs-content-store-eu-west/content/pii:S2468823121005617/STRIPIN/image/svg+xml/832929e7655d70ab148d34693dc04bbe/si3.svg si3 si3.svg svg 19299 ALTIMG 1-s2.0-S2468823121005617-am.pdf am am.pdf pdf 2229939 AAM-PDF https://s3-eu-west-1.amazonaws.com/prod-ucs-content-store-eu-west/content/egi:10GTLL1K6GL/MAIN/application/pdf/45c92352dd304694b2dc3884093fd2a2/am.pdf MCAT 111944 111944 S2468-8231(21)00561-7 10.1016/j.mcat.2021.111944 Elsevier B.V. Fig. 1 (a) Isobutane conversion and isobutene selectivity and (b) isobutene yield and by-product methane selectivity as functions of time for different catalysts (reaction conditions: 600 ℃, 1 atm, H2 : iC4H10= 1:1 (molar ratio), WHSV (iC4H10) = 3 h-1, mcat= 0.5 g). Fig. 1 Fig. 2 XRD patterns of (a) the precursors, (b) the calcined samples and (c) the reduced samples. Fig. 2 Fig. 3 (a) Low temperature N2 adsorption-desorption isotherms and (b) pore size distributions of the catalysts. Fig. 3 Fig. 4 SEM images of the calcined catalysts: (a) PtInHTC-NH4F; (c) PtInHTC-NaF; (e) PtInHTC-KF; and TEM images and particle size distribution inset of reduced catalysts: (b) PtInHTR-NH4F; (d) PtInHTR-NaF, (f) PtInHTR-KF. Fig. 4 Fig. 5 XPS spectra of (A) the whole survey, (B) in 3d, (C) Mg 1s and (D) F 1s for the reduced catalysts. Fig. 5 Fig. 6 (A) TG and (B) O2-TPO curves of the spent catalysts. Fig. 6 Fig. 7 TEM images and particle size distributions of spent catalysts: (a) and (b) PtInHTU-NH4F, (c) PtInHTU-NaF, (d) PtInHTU-KF. Fig. 7 Table 1 Analytical and structural data for as-synthesized samples. Table 1 Sample XRD phase d 003 (nm) a a (nm) c a (nm) Lc b (nm) HT-NH4F HT+MgF2 0.758 0.305 2.274 15.197 HT-NaF HT+MgF2 0.760 0.305 2.280 16.285 HT-KF HT+MgF2 0.756 0.304 2.268 17.947 a Determined by XRD, a = 2d 110, c = d 003 + 2 d 006+3 d 009 for HT phase. b Average crystallite size in c direction calculated from the Scherrer equation using the FWHM (Full Width at Half Maximum) of (003) and (006) reflections. Table 2 Textural data of the catalysts. Table 2 Samples S BET a (m2•g-1) D p b (nm) V p c (cm3•g-1) PtInHTC-NH4F 199 12.3 0.75 PtInHTC-NaF 153 12.4 0.56 PtInHTC-KF 216 4.9, 12.3 0.70 a BET special surface area. b The most probable pore size determined by the BJH method. c Total pore volume. Table 3 XPS results of in 3d, Mg 1s and F 1s regions for the reduced catalysts. Table 3 Binding energy (eV) Samples PtInHTR-NH4F PtInHTR-NaF PtInHTR-KF In 3d5/2 In0 444.5 444.5 444.5 In3+ 445.6 445.6 445.7 In 3d3/2 In0 452.2 452.2 452.2 In3+ 453.2 453.3 453.2 Mg 1s MgI 1304.1 1304.1 1304.1 MgII 1305.2 1305.2 1305.2 F 1s FI 686.3 686.3 686.3 FII 685.4 685.4 685.4 Peak area ratio a In3+/In0 2.19 1.02 0.69 MgII/MgI 0.61 0.45 0.49 FII/FI 0.72 0.69 1.19 a Calculated from the corresponding fitting peak area. Enhanced catalytic performance of isobutane direct dehydrogenation over Pt-In catalysts: Effect of different fluorides modified hydrotalcite-like derivatives Zhen Song Methodology Investigation Writing – original draft Writing – review & editing 1 Jiameng Wang Investigation Writing – review & editing 1 Xiqing Zhang Methodology Investigation Writing – review & editing 1 Fanji Liu Investigation Writing – review & editing Lihong Zhang Conceptualization Supervision Project administration Funding acquisition ⁎ Department of Catalysis Science and Technology and Tianjin Key Laboratory of Applied Catalysis Science & Technology, School of Chemical Engineering and Technology, Tianjin University, Tianjin 300350, PR China Department of Catalysis Science and Technology and Tianjin Key Laboratory of Applied Catalysis Science & Technology, School of Chemical Engineering and Technology Tianjin University Tianjin 300350 PR China Department of Catalysis Science and Technology and Tianjin Key Laboratory of Applied Catalysis Science & Technology, School of Chemical Engineering and Technology, Tianjin University, Tianjin 300350, PR China ⁎ Corresponding author. 1 These authors contributed equally to this work. A series of MgF2-modified hydrotalcite-like (HT) derivatives supported Pt-In catalysts PtInHTR-X (X = NH4F, NaF and KF, R = reduced catalyst) were prepared by combination of hydrothermal method, alkali-etching and impregnation strategy and applied to direct dehydrogenation of isobutane to isobutene. The catalysts and precursors were characterized by XRD, SEM, TEM, XPS, TG, O2-TPO and low temperature N2 adsorption-desorption isotherms. The formation of MgF2 phase as dopant to modify the catalyst can influence the pore structure and even the surface acid properties of catalysts. Especially, compared with the three catalysts, PtInHTR-KF catalyst had better stability of isobutene selectivity of over 95% after 9 h reaction, and PtInHTR-NH4F and PtInHTR-NaF catalysts exhibited more stable isobutane activity of 60%. One of the reasons for this catalytic performance is that small particles of MgF2 and unsaturated MgF2 can provide weak acidic sites which can inhibit coke deposition. And it was found the improved catalytic performance was also related to the appropriate In3+/In0 ratio, well-dispersed Pt species and the excellent anti-sintering ability of catalysts modified MgF2. Graphical abstract Image, graphical abstract Keywords Isobutane dehydrogenation Supported Pt-In catalyst MgF2 phase The acidic sites Anti-sintering 1 Introduction In recent years, global olefin demand has increased rapidly due to the rapid growth in the production of high value-adding downstream products. Among them, isobutene has attracted much attention as a raw material for downstream products such as butyl rubber, plastic and methyl methacrylate [1,2]. The traditional preparation methods of isobutene were steam naphtha cracking and heavy oil catalytic cracking [2], which would lead to high costs and much methane as byproducts [3], therefore, the direct dehydrogenation of isobutane, which is environmentally friendly and economical and efficient, has become a common preparation method at present [4]. In industrial production, the catalysts commonly used for the dehydrogenation of alkanes are mainly Pt- and CrOx-based catalysts. Because CrOx-based catalysts are harmful to the environment, Pt-based catalysts have become the most efficient and commonly used active metals for dehydrogenation of light alkanes [5]. Nevertheless, the monometallic Pt catalysts are easily deactivated due to sintering and coke deposition, which lead to low alkene selectivity and stability. Therefore, some metal promoters, such as Sn [6–8], In [9–11], Cu [12,13], Ga [14], Zn [15], Na [16] or Ge [17], are usually introduced into the Pt-based catalysts to enhance Pt electron density and improve Pt dispersion. Accordingly, the electronic and geometric effects of metal promoters on Pt species are beneficial for suppressing Pt sintering and improving activity and selectivity of dehydrogenation. Among these promoters, a lot of research attention has been given to element Sn. But now, many researchers pay more attention to the Pt-In bimetallic catalyst due to the elimination of large Pt ensembles and stable performance for the dehydrogenation [18,19]. Except Pt-In bimetallic structure, the “sandwich structure” of the Pt-In2O3-support is also proposed [20]. Further, typically non-metallic promoters are selected to adjust the acid sites of the support and promote the dispersion of the surface active centers to a certain extent, involving element B [21,22], F [23,24] and P [25], which can be added during the preparation process or by impregnation method. With regard to F- anion, the outstanding feature is the high electronegativity and small radius [26]. However, there is no any report about the application of F-based promoter over Pt-based catalysts for isobutane dehydrogenation. There are also support materials that can affect the catalytic performance and coke formation due to their specific surface area, acid-base properties and their own thermal stability [27]. In the late years, a lot of researchers have made a lot of attempts and experiments on the support materials, such as Al2O3 [27,28], SiO2 [29], ZrO2 [30], spinel MgAl2O4 [31] (or ZnAl2O4 [32]) and zeolite [33], for isobutene dehydrogenation catalysts. The suitable acidity of catalyst is an important property for direct dehydrogenation because it encourages the isobutane adsorption and the isobutene desorption, whereas a strong acid site can increase CH4 production which is undesirable. It has been found that the Mg-containing catalyst is a material with moderate acidity, which is perhaps suitable for this process. So the focus has now shifted to calcined MgAl hydrotalcite or hydrotalcite-like (HT) materials [9,10,34], because MgO can be well integrated with Al2O3, and they have been used for the direct dehydrogenation of propane, which have good performance compared with other supports. Generally, the HT materials are directly prepared by coprecipitation or hydrothermal method. And the In specie is usually loaded on the supports by impregnation [9] or directly introduced into the supports by direct addition method before Pt impregnation [35]. In this paper, we successfully synthesized the calcined MgF2 modified HT materials via adding different fluorides (NH4F, NaF, KF) supported Pt-In catalysts, which were evaluated in isobutane dehydrogenation at 600 °C under atmospheric pressure and exhibited great catalytic performance. These catalysts were prepared by dispersing Pt-In nanoparticles onto the calcined HT supports modified by fluorines. Our findings show that the catalysts PtInHTR-X (X = NH4F, NaF and KF) can greatly improve the catalytic activity and improvement in different directions, which PtInHTR-NH4F and PtInHTR-NaF catalysts have good enough isobutane conversion, while PtInHTR-KF catalyst has high stable isobutene selectivity. Then we used a large number of characterization techniques to reveal the relationship between the addition of different fluoride precursors leading to different dehydrogenation properties and physicochemical properties of the catalysts. 2 Experimental 2.1 Preparation of catalysts 2.1.1 Materials SiO2 powders (> 98%) were purchased from TANSAIL Advanced Materials Co. Ltd (Nanjing, China). Mg(NO3)2•6H2O, Al(NO3)3•9H2O and urea were purchased from Fuchen Chemical Reagents Factory (Tianjin, China). H2PtCl6•6H2O was purchased from Mascot Chemical Co. Ltd (Tianjin, China). In(NO3)3•xH2O, NH4F, NaF and KF were purchased from Aladdin Industrial corporation (Shanghai, China). 2.1.2 Synthesis of supports The precursor HT-KF was prepared by the combination of hydrothermal method and alkali-etching, and the specific processes and conditions were described in detail in our previous work [36]. Similarly, the precursor HT-NH4F and HT-NaF were also prepared under the same processes and conditions, except that KF is replaced with NaF or NH4F in the initial solution. After calcination at 600 ℃ for 4 h with a heating rate of 2 ℃ min-1, the corresponding supports HTC-X (X = NH4F, NaF or KF) were obtained. 2.1.3 Synthesis of catalysts Referring to earlier work [36], a series of HTC-X supported catalysts PtInHTC-X (X = NH4F, NaF or KF) were acquired by combination of stepwise incipient wetness impregnation method as well as drying and calcination strategy. Firstly, it was impregnated in aqueous solution of In(NO3)3, after being dried above 120 °C for 12 h (InHT-X), the solid was calcined at 550 ℃ for 4 h (InHTC-X). Then the sample was impregnated with H2PtCl6•H2O solution, followed by the next drying step (PtInHT-X) and calcining step (PtInHTC-X).The loading amounts of Pt and In were 0.5 wt% and 1.4 wt%, respectively. Before isobutane dehydrogenation reaction, these calcined catalysts were reduced (5 vol% H2/N2 at 600 °C for 2 h), which were labeled as PtInHTR-X (X=NH4F, NaF or KF). After the 9 h reaction, the spent catalysts were marked as PtInHTU- X (X=NH4F, NaF or KF). For comparison, the catalyst PtInHTR-NS without SiO2, catalyst PtInHTR containing SiO2 with alkali-etching treatment and catalyst PtInHTR-S containing SiO2 without alkali-etching treatment were also synthesized. The specific synthesis method was consistent with the above process. 2.2 Catalyst characterization The XRD patterns of samples were collected on a Bruker D8-Focus X-ray diffractometer (BRUKER AXS GMBH, Karlsruhe, Germany) equipped with a Cu Kα radiation (λ = 0.15418 nm), operating at 40 kV and 40 mA, at a scanning speed of 8 ° min-1 from 5 to 80 ° To obtain the textural properties of samples, Low-temperature N2 adsorption-desorption tests were carried on a TriStar 3000 micromeritics apparatus (Micromeritics, Norcross, GA, USA) at −196 ℃. All samples were out-gassed under vacuum at 300 ℃ for 3 h prior to analysis. And the specific surface areas were calculated based on the BET method, meanwhile, the pore size distributions and the pore volume were derived from the desorption branch of isotherms using the method of BJH. The scanning electron microscopy (SEM) images were carried out using a MAIA3 TESAN at an accelerating voltage of 5.0 kV. The transmission electron microscopy (TEM) images of the reduced and spent catalysts were observed on a JEM-2100F field-emission transmission electron microscope (JEOL, Tokyo, Japan). The samples after reductive treatment at 600 ℃ in a flow of 5 vol% H2/N2 for 2 h were ground into powder, dispersed in ethanol and dropped on carbon-film coated copper grids. Above one hundred individual metal particles were collected for the determination of average particle size of each sample through DigitalMicrograph. The in-situ X-ray photoelectron spectra (XPS) of catalysts were tested on an ESCALAB Xi+ (ThermoFisher Scientific, USA) using Al Kα radiation. The BE was calibrated using the C1s level at 284.8 eV as an internal standard. During the process, all samples were reduced at 600 oC for 2 h under 5 vol% H2/N2 at 30 ml min-1 and cooled down to room temperature, evacuated and transferred to the analysis chamber of the XPS spectrometer Thermogravimetric analysis (TG) was carried on a DTG-50/50H (PerkinElmer, Waltham, MA, USA) to calculate the coke amount over the spent catalysts, which was heated from room temperature to 900 ℃ at a rising rate of 10 ℃ min-1 in air. Temperature-programmed oxidation (TPO) experiments were conducted in a programmable temperature system. Prior to TPO analysis, the spent catalysts were pretreated at room temperature for 1 h under flowing He. Then after steadying the baseline, the reactor was heated in a mixture of 10% O2 in He from room temperature to 800 ℃ at 10 ℃ min-1. Finally, the released CO2 signal was monitored by TCD. 2.3 Catalytic tests The isobutane direct dehydrogenation reactions were tested in a fixed-bed continuous-flow reactor. The calcined fresh catalyst (0.5 g, 40–60 meshes) was set into the reactor and reduced in flowing H2/N2 (5 vol%, 30 mL min-1) at 600 ℃ for 2 h. Then reaction conditions were conducted as follows: the gas including the isobutane and hydrogen (the molar ratio of iC4H10 : H2= 1:1), the weight hourly space velocity (WHSV) of isobutane was 3 h-1, 600 ℃ for reaction temperature, and 0.1 MPa for the reaction pressure. The gas products were analyzed by the online gas chromatograph (GC) equipped with a flame ionization detector (Al2O3 packed column). The isobutene conversion, isobutene selectivity and isobutene yield were calculated as follows: i C 4 H 10 Conversion ( % ) = i C 4 H 10 , in − i C 4 H 10 , out i C 4 H 10 , in * 100 i C 4 H 8 Selectivity ( % ) = i C 4 H 8 , out i C 4 H 10 , in − i C 4 H 10 , out * 100 i C 4 H 8 Yield ( % ) = Conversion * Selectivity * 100 where, iC4H10,in and iC4H10,out stand for the isobutane content in feed and exit gasses, respectively, iC4H8,out stands for the isobutene content in exit gas. 3 Results and discussion 3.1 Catalytic activity As clearly shown in Fig. S1, the dehydrogenation performance of the catalyst PtInHTR-S has been greatly improved compared with PtInHTR-NS without SiO2 template. After alkali-etching of PtInHTR-S, the obtained catalyst PtInHTR can further elevate the isobutane conversion and isobutene yield. Compared with other catalysts, the conversion of catalyst PtInHTR-NH4F is greatly improved to reach nearly 61% after 9 h of reaction. These results suggest that the addition of fluoride affect the dehydrogenation performance of catalysts. To investigate the effect of different fluoride additives in catalysts on the isobutane dehydrogenation, the PtInHTR-X (X = NH4F, NaF and KF) catalysts were evaluated in the isobutane dehydrogenation reaction for 9 h. Fig. 1 represents the catalytic performance over the reduced catalysts, including not only conversion of isobutane, yield and selectivity of isobutene but also the selectivity of by-product methane. Firstly, as shown in Fig. 1a, the isobutane conversion of the catalysts can be almost close to 60% after 9 h of reaction. The conversion of the catalysts PtInHTR-NH4F remains constant at 61% within 8.5 h, and the conversion of the PtInHTR-NaF catalyst is comparable to it. Compared with the PtInHTR-NH4F and PtInHTR-NaF catalysts, although the conversion of the catalyst PtInHTR-KF is relatively poor, only 50% at 30 min, after 9 h of reaction it can reach 58%. And from Fig. 1b, it can be seen that the trend of isobutene yield with reaction time is nearly similar to that of isobutane conversion for all catalysts. The isobutene yield of PtInHTR-NH4F and PtInHTR-NaF can be kept at 57%. And the yield of PtInHTR-KF slightly exceeds that of PtInHTR-NH4F and PtInHTR-NaF after reaction of 6 h and goes up to 57% after 9 h, which can be attributed to the superior selectivity of PtInHTR-KF. Meanwhile, from the comparison of the selectivity of isobutene with by-product methane, the selectivity of isobutene is much higher than the corresponding methane selectivity, indicating that the cracking reaction of the whole reaction process has been inhibited. The PtInHTR-NH4F and PtInHTR-NaF catalysts exhibit the declining isobutene selectivity, but it could be maintained at 90% at 9 h. In contrast, the selectivity to isobutene of catalyst PtInHTR-KF can be stabilized at 95% during the reaction. Furthermore, the selectivity of the by-product methane of the three catalysts is less than 4%, and especially the sample with KF added is only maintained at 1%, which is negligible relative to the isobutene selectivity. Thus, PtInHTR-KF catalyst can be largely suppressed cracking reaction on the catalyst, improve the selectivity and stability of the catalyst, which the isobutene yield could be slightly later than other catalysts. Overall, the excellent performance of Pt-In based catalysts has been evidenced by high selectivity and yield. The results indicate that the addition of different fluorides in the mother liquid has a clearly different influence on the isobutane dehydrogenation performance of the catalysts, which depending on the physic-chemical properties of catalysts. The further details will be displayed as followed. 3.2 Structure, texture and physico-chemical properties of fresh catalysts 3.2.1 XRD Fig. 2 shows the XRD patterns of the precursors and corresponding calcined and reduced catalysts, and the detail evolution processes of PtInHTR-NH4F samples are demonstrated in Fig. S2. Table 1 lists some structural properties of all precursors. As can be seen in Fig. 2a, the characteristic peaks of HT phase (JCPDS file No. 51–1525) are observed in each case. The broad and well-defined diffraction peaks indicate that the obtained HT phase is poorly crystallized and the HT nanosheets tend to be thin. And the addition of different fluorides in the mother liquid can result in the decrease of HT diffraction peak intensity, according to the following order HT-KF > HT-NaF > HT-NH4F. Besides the diffraction peaks of HT phase, the slightly increased characteristic diffraction peaks of MgF2 phase (JCPDS file No. 41–1443) also can be detected in accordance with the order of HT-KF, HT-NaF and HT-NH4F. The formation of MgF2 should be ascribed to the stronger MgF (approximately 110 kJ/mol) bond than MgO (approximately 90 kJ/mol) and MgOH (approximately 56 kJ/mol) bonds [37]. In addition, there is no any shift of (003) and (006) diffraction indicating no change in the basal spacing for all samples. As shown in Table 1, the value of basal spacing (d 003) is about 0.760 nm. These indicate that the planar CO3 2- is the only guest anion in the interlayer of HT phase, and there is no F- anion in the interlayer. It is in line with the fact that the exchange ability of CO3 2- anion is stronger than that of F- anion [38]. As shown in Fig. 2b and c, after calcination and reduction, the HT phase is absolutely transformed into Mg(Al)O phase, corresponding to the transformation of a two-dimensional layered structure to a three-dimensional structure, which the diffraction peaks of the periclase MgO phase (JCPDS file No. 45–0946) appear at 2θ = 36 °, 43 ° and 63 °. And the diffraction peak of the MgF2 phase is still observed, indicating that the MgF2 phase did not disappear. It can be attributed to that the MgF bond strength is stronger than MgO, which makes it not easy to transform. However, the calcination and reduction make the MgF2 diffraction peak of samples adding NaF and KF in the mother liquid slightly enhance. The characteristic diffraction peaks of MgF2 phase become slightly increased in the order of PtInHTC-KF, PtInHTC-NH4F and PtInHTC-NaF. The same tendency can be found in the reduced samples (Fig. 2d). The stronger the diffraction peak intensity, the bigger the particle size of MgF2. This indicates the MgF2 particle size of sample containing KF is slightly smaller relative to that of containing NaF and NH4F. At the same time, the diffraction peaks of Pt and In species cannot be found for all the catalysts, which may be owing to their small particle size and/or low concentration below XRD detection limit. 3.2.2 N2 adsorption-desorption isotherms To evaluate the textural properties of the catalysts, the nitrogen adsorption-desorption isotherms are depicted in Fig. 3 . As shown in Fig. 3a, the three catalysts can be categorized under mesoporous structure and show the type IV curves with the clear H2 hysteresis loops, instead of H3 hysteresis loops of typical slit-shaped pore for HT-based catalysts [10], wherein once again indicating the characteristic of the hierarchical mesoporous structure. Fig. 3b shows the corresponding pore size distributions (PSD) of the catalysts, and it can be seen that the pore distribution is broad and mainly concentrated in the range of 3–30 nm, further confirming the mesoporous feature, which is consistent with the results in Fig. 3a, especially, the hierarchical porous feature for catalyst PtInHTC-KF. The textural properties of the prepared catalysts are clearly summarized in Table 2 . Compared with the textural properties of samples PtInHTC-NaF and PtInHTC-NH4F, PtInHTC-KF sample exhibits the largest BET special surface area and the similar most probable pore size and total pore volume. The big hierarchical pore of PtInHTC-KF is beneficial to provide easily accessible active sites and take full advantage of the pore properties for dehydrogenation reaction [10]. 3.2.3 SEM The SEM images of three calcined catalysts are displayed in Fig. 4 . Overall, the typical mesoporous morphology can be observed for each material. For sample PtInHTC-NH4F in Fig. 4a, the using of NH4F results in the nanosheet arrays crossing each other and leaves a wealth of channels on catalysts. The full replacement of NH4F by NaF or KF, as shown in Fig. 4c and e, makes the nanosheets become bigger and the channels become more uniform. This shows that during the hydrothermal synthesis process, fluoride specie can tune the structure of morphology and pore for the catalyst to a certain extent. One of the reasons for the formation of flake structure on the surface of the three catalysts is that fluorine ion can activate the substrate, which leads to re-crystallization and re-growth in the hydrothermal process [39]. The difference of the size of the lamellar structure of the three catalysts may be related to the properties of the cations. 3.2.4 TEM In order to understand the dispersion and existence form of the metal particles on the reduced catalyst surface, the TEM characterization was carried out, and the TEM images and particle size distribution (PSD) information are shown in the Fig. 4. As we can see, the PSD of the metal particles of the catalyst exhibits a narrow phenomenon, indicating that the metal particles are well dispersed on these catalysts. According to statistical data, the average diameters of metal particles of PtInHTR-NH4F, PtInHTR-NaF and PtInHTR-KF catalysts are 1.0 nm, 1.1 nm and 1.2 nm, respectively. The small active metal size is much important for enhancing catalyst activity because the small active metals are less active for cracking reaction and deep dehydrogenation. In addition, the images of the reduced catalysts present 0.226 nm lattice spacing, which belongs to the metal Pt (111) nanoparticles. However, the lattice spacing of the zero-valent In or Pt-In alloy cannot be recognized in TEM images, due to the more In2O3 species on the surface. 3.2.5 XPS To analyze the surface elemental compositions and chemical states of elements on the surface of reduced catalysts, XPS measurements were carried out, and Fig. 5 presents XPS spectra including the peaks of In 3d, Mg 1s and F 1s, with a summary of the binding energy (BE), peak intensity and ratio of every peak for the samples in Table 3 . The whole survey XPS spectra of the each sample were shown in Fig. 5A, and it can be seen that the catalysts indeed contain F element. According to the results of XRD above, it can be known that fluorine is present on these catalysts in the form of MgF2. To deeply explore the metal-support interaction and the role of MgF2, the XPS spectra are mainly focused on the In 3d, Mg 1s and F 1s regions, except Pt 4f, because the energy region of Pt 4f is overlapped with the strong Al 2p peak. The broad In 3d spectra of the reduced samples as shown in Fig. 5B can be deconvoluted into four Gaussian peaks, including the zero-valent In (In0) at 444.5 eV and 452.2 eV, the oxidation state of surface In species (In3+) at 445.6 eV and 453.2 eV, respectively [10,20,34]. It should be noted that there are almost no differences in the BE values of all In3+ and In0. This indicates that the electron transfer from In to Pt is not influenced by the appearance of MgF2. Meanwhile, the ratio of In3+/In0 follows a decreasing trend in accordance with the order of PtInHTR-NH4F, PtInHTR-NaF and PtInHTR-KF. This indicates MgF2 with different particle sizes can inhibit the reduction of In3+ ions to some different degrees. It is known that an excess of In0 can block the active center of Pt, which is unfavorable to the dehydrogenation reaction, while an appropriate ratio of In3+/In0 on the surface is more conducive to the dehydrogenation reaction [20,34]. Some research suggests that a moderate amount of In0 is beneficial to inhibiting Pt sintering and coke formation and even facilitating desorption of olefins from Pt-based catalysts [40,41], which is consistent with high isobutene selectivity of catalyst PtInHTR-KF. Then Fig. 5C shows the XPS spectra of Mg 1s region for the reduced catalysts, one peaks appearing at 1304.1 eV corresponds to MgO (MgI), and the other one at 1305.2 eV can be attributed to MgF2 (MgII) species, respectively [42]. This further proves the presence of MgF2 in all samples. As shown in Fig. 5D, the spectra of F 1s can be deconvoluted into two peaks, representing two different coordination states of F species. The peak at BE of 686.3 eV is related to F ions (FI) in saturated MgF2 with six F ions coordinated Mg. Another peak at BE of 685.4 eV can be assigned to F ions (FII) bound to under coordinated Mg in unsaturated MgF2 [43]. It is just the under coordinated Mg, that is 4-fold and 5-fold coordinated Mg, results in the formation of abundant amounts of weak Lewis sites in MgF2 [43]. The relative amount of unsaturated MgF2 can be estimated by multipling MgII/MgI ratio by FII/FI ratio in Table 3. The obtained values show that the relative amount of unsaturated MgF2 in PtInHTR-KF sample is higher than that of other F-modified samples. It means that there are more weak Lewis acid sites for PtInHTR-KF sample. It is also pointed out that the small MgF2 particles favors the formation of weak acid sites [43]. Combined with the XRD analysis about MgF2 phase in the reduced samples, it further verifies that the amount of relatively weak acid sites increases in the following order PtInHTR-NaF < PtInHTR-NH4F < PtInHTR-KF, which is consistent with the increasing isobutene selectivity. The highest isobutene selectivity and lowest methane selectivity for catalyst PtInHTR-KF should be attributed to the most amounts of weak acid sites, which is not favorable for coking [43]. Hence, the modification of MgF2 significantly affects the surface acidity of catalysts, thereby affecting the stability of the dehydrogenation performance. By comparing the relative ratio of In3+/In0, MgII/MgI and FII/FI, it can be found that the variation trend of the saturated MgF2 content is nearly opposite to the zero-valent In. It can be further confirmed that the low zero-valent In, that is high In3+/In0 ratio, is mainly arising from the coverage of big MgF2 nanoparticles with abundant coordinated Mg species. It suggests that the amount and size of MgF2 also can be used to adjust the surface chemical state of In species, so as to affect the catalytic activity. 3.3 Analysis of coke deposition and Pt-sintering in the spent catalysts 3.3.1 TG-DTA and O2-TPO During the dehydrogenation process, the coke deposition is one of the reasons for the deactivation of catalysts, so TG of the spent catalysts was applied for coke analysis. First, TG curves of different catalysts after 9 h reaction are shown in Fig. 6 A, and the mass loss of all samples should be related to the removal of deposited coke by combustion. The coke amount on the used F-modified catalysts decreases in the following order PtInHTU-NaF > PtInHTU-NH4F > PtInHTU-KF. This result is consistent with the trend of methane selectivity of the catalyst (see Fig. 1b), which means that the higher the methane selectivity, the more coke deposition on the surface. And it can be seen that PtInHTR-KF can significantly inhibit the coke deposition. And to investigate the location of deposited coke, the O2-TPO profiles for the spent catalysts are shown in Fig. 6B. For the MgF2-modified catalysts PtInHTU-NH4F, PtInHTU-NaF and PtInHTU-KF, the spent catalyst presents three peaks at 401 °C (peak I), 612 °C (peak II) and 700 ℃ (peak III), respectively. According to the literature, the three peaks on the surface of the catalyst can be divided into two kinds of carbon deposition. Firstly, the peak I is related to the coke deposited near the metal-support interface [44]. The peak II and III are less reactive, which appears at higher temperature, corresponding to the coke deposited on the support [45]. In other word, the coke on the MgF2-modified catalysts is mainly located on the metal-support interface and on the support, and there is no coke deposition on the metal active sites. It implied that the deposited coke on the MgF2-modified catalysts can be easily transferred from the metal active sites to support. This behavior is beneficial to fully utilize the metal active sites and thus maintain the good catalytic activity over catalysts. 3.3.2 TEM Fig. 7 shows the TEM images and PSD histograms of the spent catalysts. Compared with the TEM images in Fig. 4, the average diameters of PtInHTU-NH4F, PtInHTU-NaF and PtInHTU-KF have a slight increase from 1.0 to 2.1 nm, 1.1 to 2.1 nm and 1.2 to 2.1 nm, respectively. These also mean that the metal particles have agglomerated in a certain extent after 9 h of reaction. However, the order of the anti-sintering ability of the catalyst is PtInHTR-KF > PtInHTR-NH4F = PtInHTR-NaF, which indicates that the addition of MgF2 can inhibit the sintering of Pt particles to a certain extent. And the catalyst PtInHTR-KF has better sintering resistance. Consistent with the SEM results (see Fig. S3a), there are also coke deposits on the spent catalyst surface from TEM results as shown in Fig. 7b. And from Fig. 7b, the coke deposits can be seen clearly and Pt nanoparticles can still be seen on the spent catalyst surface. 4 Conclusion In summary, we have successfully synthesized a series of the fluorine-doped hydrotalcite-like compounds by adding different fluorides via a simple hydrothermal method. After alkali etching, calcination, Pt-In impregnation and reduction, the excellent catalysts were obtained. Firstly, PtInHTR-KF catalyst has excellent stability of isobutene selectivity of over 95%, and PtInHTR-NH4F and PtInHTR-NaF catalysts exhibit more stable isobutane activity of 60%. In addition, we find the fluorides play the key roles in changing the morphology of PtInHTC-X (X=NH4F, NaF, KF) through SEM measurement, which the flake structure appeared in the morphology of the catalyst and the catalyst with large specific surface area was obtained from BET data. And XPS results prove that the appropriate In3+/In0 ratio of PtInHTR-KF is advantage to the isobutene formation. And from XPS results of Mg 1s and F 1s, we can see the acidity of the catalyst surface change because of the effect of small particles of MgF2 and unsaturated MgF2. In addition, the better resistance to coke deposition can be observed over PtInHTU-X after reaction from TG and O2-TPO results, especially catalyst PtInHTR-KF, which also inhibits the sintering of Pt. It is necessary to point that Pt-In catalysts modified by MgF2 are excellent and promising catalysts for the dehydrogenation reaction. CRediT authorship contribution statement Zhen Song: Methodology, Investigation, Writing – original draft, Writing – review & editing. Jiameng Wang: Investigation, Writing – review & editing. Xiqing Zhang: Methodology, Investigation, Writing – review & editing. Fanji Liu: Investigation, Writing – review & editing. Lihong Zhang: Conceptualization, Supervision, Project administration, Funding acquisition. Declaration of Competing Interest There are no conflicts to declare. Acknowledgment This work was supported by the National Natural Science Foundation of China (21776214). Supplementary materials Supplementary material associated with this article can be found, in the online version, at doi:10.1016/j.mcat.2021.111944. Appendix Supplementary materials Image, application 1 References [1] J. Baek H.J. Yun D. Yun Y. Choi J. Yi Preparation of highly dispersed chromium oxide catalysts supported on mesoporous silica for the oxidative dehydrogenation of propane using CO2: insight into the nature of catalytically active chromium sites ACS Catal. 2 2012 1893 1903 J. Baek, H.J. Yun, D. Yun, Y. Choi, J. Yi, Preparation of highly dispersed chromium oxide catalysts supported on mesoporous silica for the oxidative dehydrogenation of propane using CO2: insight into the nature of catalytically active chromium sites, ACS Catal.2 (2012) 1893–1903. [2] J.C. Li H.S. Zhang X.Y. Zhao J.G. Jian Y.X. Wu Y.L. Lu L.Q. Zhang T. Nishi Development of high damping natural rubber/butyl rubber composites compatibilized by isobutylene-isoprene block copolymer for isolation bearing Express Polym. Lett. 13 2019 686 696 J.C. Li, H.S. Zhang, X.Y. Zhao, J.G. Jian, Y.X. Wu, Y.L. Lu, L.Q. Zhang, T. Nishi, Development of high damping natural rubber/butyl rubber composites compatibilized by isobutylene-isoprene block copolymer for isolation bearing, Express Polym. Lett.13 (2019) 686–696. [3] M.M. Bhasin J.H. McCain B.V. Vora T. Imai P.R. Pujado´ Dehydrogenation and oxydehydrogenation of paraffins to olefins Appl. Catal. A Gen. 221 2001 394 419 M.M. Bhasin, J.H. McCain, B.V. Vora, T. Imai, P.R. Pujado´, Dehydrogenation and oxydehydrogenation of paraffins to olefins, Appl. Catal. A Gen.221 (2001) 394–419. [4] L. Xu Z. Wang H. Song L. Chou Catalytic dehydrogenation of isobutane over ordered mesoporous Cr2O3-Al2O3 composite oxides Catal. Commun. 35 2013 76 81 L. Xu, Z. Wang, H. Song, L. Chou, Catalytic dehydrogenation of isobutane over ordered mesoporous Cr2O3-Al2O3 composite oxides, Catal. Commun.35 (2013) 76–81. [5] F.T. Zangeneh S. Sahebdelfar M. Bahmani Propane dehydrogenation over a commercial Pt-Sn/Al2O3 catalyst for isobutane dehydrogenation: optimization of reaction conditions Chin. J. Chem. Eng. 21 2013 730 735 F.T. Zangeneh, S. Sahebdelfar, M. Bahmani, Propane dehydrogenation over a commercial Pt-Sn/Al2O3 catalyst for isobutane dehydrogenation: optimization of reaction conditions, Chin. J. Chem. Eng.21 (2013) 730–735. [6] L. Shi G. Deng W. Li S. Miao Q. Wang W. Zhang A. Lu Al2O3 nanosheets rich in pentacoordinate Al3+ ions stabilize Pt-Sn clusters for propane dehydrogenation Angew. Chem. Int. Ed. 54 2015 13994 13998 L. Shi, G. Deng, W. Li, S. Miao, Q. Wang, W. Zhang, A. Lu, Al2O3 nanosheets rich in pentacoordinate Al3+ ions stabilize Pt-Sn clusters for propane dehydrogenation, Angew. Chem. Int. Ed.54 (2015) 13994–13998. [7] Y. Zhu Z. An H. Song X. Xiang W. Yan J. He Lattice-confined Sn (IV/II) stabilizing raft-like Pt clusters: high selectivity and durability in propane dehydrogenation ACS Catal. 7 2017 6973 6978 Y. Zhu, Z. An, H. Song, X. Xiang, W. Yan, J. He, Lattice-confined Sn (IV/II) stabilizing raft-like Pt clusters: high selectivity and durability in propane dehydrogenation, ACS Catal.7 (2017) 6973–6978. [8] Q. Li Z.J. Sui X.G. Zhou D. Chen Kinetics of propane dehydrogenation over Pt-Sn/Al2O3 catalyst Appl. Catal. A Gen. 398 2011 18 26 Q. Li, Z.J. Sui, X.G. Zhou, D. Chen, Kinetics of propane dehydrogenation over Pt-Sn/Al2O3 catalyst, Appl. Catal. A Gen.398 (2011) 18–26. [9] K. Xia W. Lang P. Li L. Long X. Yan Y. Guo The influences of Mg/Al molar ratio on the properties of PtIn/Mg(Al)O-x catalysts for propane dehydrogenation reaction Chem. Eng. J. 284 2016 1068 1079 K. Xia, W. Lang, P. Li, L. Long, X. Yan, Y. Guo, The influences of Mg/Al molar ratio on the properties of PtIn/Mg(Al)O-x catalysts for propane dehydrogenation reaction, Chem. Eng. J.284 (2016) 1068–1079. [10] J. Li M. Zhang Z. Song S. Liu J. Wang L. Zhang Hierarchical PtIn/Mg(Al)O derived from reconstructed PtIn-hydrotalcite-like compounds for highly efficient propane dehydrogenation Catalysts 9 2019 767 J. Li, M. Zhang, Z. Song, S. Liu, J. Wang, L. Zhang, Hierarchical PtIn/Mg(Al)O derived from reconstructed PtIn-hydrotalcite-like compounds for highly efficient propane dehydrogenation, Catalysts, 9 (2019) 767. [11] K. Xia W. Lang P. Li X. Yan Y. Guo The properties and catalytic performance of PtIn/Mg(Al)O catalysts for the propane dehydrogenation reaction: effects of pH value in preparing Mg(Al)O supports by the co-precipitation method J. Catal. 338 2016 104 114 K. Xia, W. Lang, P. Li, X. Yan, Y. Guo, The properties and catalytic performance of PtIn/Mg(Al)O catalysts for the propane dehydrogenation reaction: effects of pH value in preparing Mg(Al)O supports by the co-precipitation method, J. Catal.338 (2016) 104–114. [12] G.D. Sun Z.J. Zhao R.T. Mu S.J. Zha L.L. Li S. Chen K.T. Zang J. Luo Z.L. Li S.C. Purdy A.J. Kropf J.T. Miller L. Zeng J.L. Gong Breaking the scaling relationship via thermally stable Pt/Cu single atom alloys for catalytic dehydrogenation Nat. Commun. 9 2018 4454 G.D. Sun, Z.J. Zhao, R.T. Mu, S.J. Zha, L.L. Li, S. Chen, K.T. Zang, J. Luo, Z.L. Li, S.C. Purdy, A.J. Kropf, J.T. Miller, L. Zeng, J.L. Gong, Breaking the scaling relationship via thermally stable Pt/Cu single atom alloys for catalytic dehydrogenation, Nat. Commun.9 (2018) 4454. [13] Z.P. Han S.R. Li F. Jiang T. Wang X.B. Ma J.L. Gong Propane dehydrogenation over Pt-Cu bimetallic catalysts: the nature of coke deposition and the role of copper Nanoscale 6 2014 10000 10008 Z.P. Han, S.R. Li, F. Jiang, T. Wang, X.B. Ma, J.L. Gong, Propane dehydrogenation over Pt-Cu bimetallic catalysts: the nature of coke deposition and the role of copper, Nanoscale, 6 (2014) 10000–10008. [14] G. Siddiqi P. Sun V. Galvita A.T. Bell Catalyst performance of novel Pt/Mg(Ga)(Al)O catalysts for alkane dehydrogenation J. Catal. 274 2010 200 206 G. Siddiqi, P. Sun, V. Galvita, A.T. Bell, Catalyst performance of novel Pt/Mg(Ga)(Al)O catalysts for alkane dehydrogenation, J. Catal.274 (2010) 200–206. [15] J. Silvestre-Albero J.C. Serrano-Ruiz A. Sepulveda-Escribano F. Rodriguez-Reinoso Modification of the catalytic behavior of platinum by zinc in crotonaldehyde hydrogenation and iso-butane dehydrogenation Appl. Catal. A Gen. 292 2005 244 251 J. Silvestre-Albero, J.C. Serrano-Ruiz, A. Sepulveda-Escribano, F. Rodriguez-Reinoso, Modification of the catalytic behavior of platinum by zinc in crotonaldehyde hydrogenation and iso-butane dehydrogenation, Appl. Catal. A Gen.292 (2005) 244–251. [16] Y. Zhang Y. Zhou YianLi Y. Wang Y. Xu P. Wu Effect of calcination temperature on catalytic properties of PtSnNa/ZSM-5 catalyst for propane dehydrogenation Catal. Commun. 8 2007 1009 1016 Y. Zhang, Y. Zhou, YianLi, Y. Wang, Y. Xu, P. Wu, Effect of calcination temperature on catalytic properties of PtSnNa/ZSM-5 catalyst for propane dehydrogenation, Catal. Commun.8 (2007) 1009–1016. [17] A.D. Ballarini S.R. de Miguel A.A. Castro O.A. Scelza n-Decane dehydrogenation on Pt, PtSn and PtGe supported on spinels prepared by different methods of synthesis Appl. Catal. A Gen. 467 2013 235 245 A.D. Ballarini, S.R. de Miguel, A.A. Castro, O.A. Scelza, n-Decane dehydrogenation on Pt, PtSn and PtGe supported on spinels prepared by different methods of synthesis, Appl. Catal. A Gen.467 (2013) 235–245. [18] X. Liu W. Lang L. Long C. Hu L. Chu Y. Guo Improved catalytic performance in propane dehydrogenation of PtSn/γ-Al2O3 catalysts by doping indium Chem. Eng. J. 247 2014 183 192 X. Liu, W. Lang, L. Long, C. Hu, L. Chu, Y. Guo, Improved catalytic performance in propane dehydrogenation of PtSn/γ-Al2O3 catalysts by doping indium, Chem. Eng. J.247 (2014) 183–192. [19] X. Chen M. Ge Y. Li Y. Liu J. Wang L. Zhang Fabrication of highly dispersed Pt-based catalysts on γ-Al2O3 supported perovskite nano islands: high durability and tolerance to coke deposition in propane dehydrogenation Appl. Surf. Sci. 490 2019 611 621 X. Chen, M. Ge, Y. Li, Y. Liu, J. Wang, L. Zhang, Fabrication of highly dispersed Pt-based catalysts on γ-Al2O3 supported perovskite nano islands: high durability and tolerance to coke deposition in propane dehydrogenation, Appl. Surf. Sci.490 (2019) 611–621. [20] K. Xia W. Lang P. Li X. Yan Y. Guo Analysis of the catalytic activity induction and deactivation of PtIn/Mg(Al)O catalysts for propane dehydrogenation reaction RSC Adv. 5 2015 64689 64695 K. Xia, W. Lang, P. Li, X. Yan, Y. Guo, Analysis of the catalytic activity induction and deactivation of PtIn/Mg(Al)O catalysts for propane dehydrogenation reaction, RSC Adv.5 (2015) 64689–64695. [21] Y.J. Song G.S. Liu Z.Y. Yuan N-, P- and B-doped mesoporous carbons for direct dehydrogenation of propane RSC Adv. 6 2016 94636 94642 Y.J. Song, G.S. Liu, Z.Y. Yuan, N-, P- and B-doped mesoporous carbons for direct dehydrogenation of propane, RSC Adv.6 (2016) 94636–94642. [22] Z.H. Ji D.Y. Miao L.J. Gao X.L. Pan X.H. Bao Effect of pH on the catalytic performance of PtSn/B-ZrO2 in propane dehydrogenation Chin. J. Catal. 41 2020 719 729 Z.H. Ji, D.Y. Miao, L.J. Gao, X.L. Pan, X.H. Bao, Effect of pH on the catalytic performance of PtSn/B-ZrO2 in propane dehydrogenation, Chin. J. Catal.41 (2020) 719–729. [23] G. Wu X. Wang W. Wei Y. Sun Fluorine-modified Mg-Al mixed oxides: a solid base with variable basic sites and tunable basicity Appl. Catal. A Gen. 377 2010 107 113 G. Wu, X. Wang, W. Wei, Y. Sun, Fluorine-modified Mg-Al mixed oxides: a solid base with variable basic sites and tunable basicity, Appl. Catal. A Gen.377 (2010) 107–113. [24] Y.F. Liu C.F. Jiang W. Chu W.J. Sun Z.K. Xie Novel F-V2O5/SiO2 catalysts for oxidative dehydrogenation of propane React. Kinet. Mech. Catal. 101 2010 141 151 Y.F. Liu, C.F. Jiang, W. Chu, W.J. Sun, Z.K. Xie, Novel F-V2O5/SiO2 catalysts for oxidative dehydrogenation of propane, React. Kinet. Mech. Catal.101 (2010) 141–151. [25] S.F. Pan J.L. Yin X.L. Zhu X.J. Guo P. Hu X. Yan W.Z. Lang Y.J. Guo P-modified microporous carbon nanospheres for direct propane dehydrogenation reactions Carbon 152 2019 855 864 S.F. Pan, J.L. Yin, X.L. Zhu, X.J. Guo, P. Hu, X. Yan, W.Z. Lang, Y.J. Guo, P-modified microporous carbon nanospheres for direct propane dehydrogenation reactions, Carbon, 152 (2019) 855–864. [26] X. Zhang D. Wang J. Ma W. Wei Fluorinated Mg-Al Hydrotalcites derived basic catalysts for transesterification of glycerol with dimethyl carbonate Catal. Lett. 147 2017 1181 1196 X. Zhang, D. Wang, J. Ma, W. Wei, Fluorinated Mg-Al Hydrotalcites derived basic catalysts for transesterification of glycerol with dimethyl carbonate, Catal. Lett.147 (2017) 1181–1196. [27] J.J. Shi Y.M. Zhou Y.W. Zhang S.J. Zhou Z.W. Zhang J. Kong M.P. Guo Synthesis of magnesium-modified mesoporous Al2O3 with enhanced catalytic performance for propane dehydrogenation J. Mater. Sci. 49 2014 5772 5781 J.J. Shi, Y.M. Zhou, Y.W. Zhang, S.J. Zhou, Z.W. Zhang, J. Kong, M.P. Guo, Synthesis of magnesium-modified mesoporous Al2O3 with enhanced catalytic performance for propane dehydrogenation, J. Mater. Sci.49 (2014) 5772–5781. [28] M. Rashidi M. Nikazar M. Rahmani Z. Mohamadghasemi Kinetic modeling of simultaneous dehydrogenation of propane and isobutane on Pt-Sn-K/Al2O3 catalyst Chem. Eng. Res. Des. 95 2015 239 247 M. Rashidi, M. Nikazar, M. Rahmani, Z. Mohamadghasemi, Kinetic modeling of simultaneous dehydrogenation of propane and isobutane on Pt-Sn-K/Al2O3 catalyst, Chem. Eng. Res. Des.95 (2015) 239–247. [29] S. Vaezifar H. Faghihian M. Kamali Dehydrogenation of isobutane over Sn/Pt/Na-ZSM-5 catalysts: the effect of SiO2/Al2O3 ratio, amount and distribution of Pt nanoparticles on the catalytic behavior Korean J. Chem. Eng. 28 2011 370 377 S. Vaezifar, H. Faghihian, M. Kamali, Dehydrogenation of isobutane over Sn/Pt/Na-ZSM-5 catalysts: the effect of SiO2/Al2O3 ratio, amount and distribution of Pt nanoparticles on the catalytic behavior, Korean J. Chem. Eng.28 (2011) 370–377. [30] T.P. Otroshchenko V.A. Kondratenko U. Rodemerck D. Linke E.V. Kondratenko Non-oxidative dehydrogenation of propane, n-butane, and isobutane over bulk ZrO2-based catalysts: effect of dopant on the active site and pathways of product formation Catal. Sci. Technol. 7 2017 4499 4510 T.P. Otroshchenko, V.A. Kondratenko, U. Rodemerck, D. Linke, E.V. Kondratenko, Non-oxidative dehydrogenation of propane, n-butane, and isobutane over bulk ZrO2-based catalysts: effect of dopant on the active site and pathways of product formation, Catal. Sci. Technol.7 (2017) 4499–4510. [31] S.A. Bocanegra A. Guerrero-Ruiz S.R. de Miguel O.A. Scelza Performance of PtSn catalysts supported on MAl2O4 (M: Mg or Zn) in n-butane dehydrogenation: characterization of the metallic phase Appl. Catal. A Gen. 277 2004 11 22 S.A. Bocanegra, A. Guerrero-Ruiz, S.R. de Miguel, O.A. Scelza, Performance of PtSn catalysts supported on MAl2O4 (M: Mg or Zn) in n-butane dehydrogenation: characterization of the metallic phase, Appl. Catal. A Gen.277 (2004) 11–22. [32] J. Liu W. Zhou D. Jiang W. Wu C. Miao Y. Wang X. Ma Isobutane dehydrogenation over InPtSn/ZnAl2O4 catalysts: effect of indium promoter Ind. Eng. Chem. Res. 57 2018 11265 11270 J. Liu, W. Zhou, D. Jiang, W. Wu, C. Miao, Y. Wang, X. Ma, Isobutane dehydrogenation over InPtSn/ZnAl2O4 catalysts: effect of indium promoter, Ind. Eng. Chem. Res.57 (2018) 11265–11270. [33] Y. Luo C. Miao Y. Yue W. Hua Z. Gao ZnO supported on Silicalite-1 as an efficient catalyst for isobutane dehydrogenation to isobutene assisted by CO2 Microporous Mesoporous Mater. 294 2020 109864 Y. Luo, C. Miao, Y. Yue, W. Hua, Z. Gao, ZnO supported on Silicalite-1 as an efficient catalyst for isobutane dehydrogenation to isobutene assisted by CO2, Microporous Mesoporous Mater.294 (2020) 109864. [34] W. Tolek K. Suriye P. Praserthdam J. Panpranot Enhanced stability and propene yield in propane dehydrogenation on PtIn/Mg(Al)O catalysts with various in loadings Top. Catal. 61 2018 1624 1632 W. Tolek, K. Suriye, P. Praserthdam, J. Panpranot, Enhanced stability and propene yield in propane dehydrogenation on PtIn/Mg(Al)O catalysts with various in loadings, Top. Catal.61 (2018) 1624–1632. [35] P. Sun G. Siddiqi W.C. Vining M. Chi A.T. Bell Novel Pt/Mg(In)(Al)O catalysts for ethane and propane dehydrogenation J. Catal. 282 2011 165 174 P. Sun, G. Siddiqi, W.C. Vining, M. Chi, A.T. Bell, Novel Pt/Mg(In)(Al)O catalysts for ethane and propane dehydrogenation, J. Catal.282 (2011) 165–174. [36] Z. Song J.M. Wang F.J. Liu X.Q. Zhang E. Matusse L.H. Zhang MgF2-Modified hydrotalcite-derived composites supported Pt-In catalysts for isobutane direct dehydrogenation Catalysts 11 2021 478 Z. Song, J.M. Wang, F.J. Liu, X.Q. Zhang, E. Matusse, L.H. Zhang, MgF2-Modified hydrotalcite-derived composites supported Pt-In catalysts for isobutane direct dehydrogenation, Catalysts, 11 (2021) 478. [37] J.A. Dean Lange's Handbook of Chemistry 13th Ed. 1985 McGraw-Hill New York J.A. Dean, Lange's Handbook of Chemistry, 13th Ed., McGraw-Hill, New York, 1985. [38] S.P. Newman W. Jones Synthesis, characterization and applications of layered double hydroxides containing organic guests New J. Chem. 22 1998 105 115 S.P. Newman, W. Jones, Synthesis, characterization and applications of layered double hydroxides containing organic guests, New J. Chem.22 (1998) 105–115. [39] Q. Wang X. Wang J. Xu X. Ouyang X. Hou D. Chen R. Wang G. Shen Flexible coaxial-type fiber supercapacitor based on NiCo2O4 nanosheets electrodes Nano Energy 8 2014 44 51 Q. Wang, X. Wang, J. Xu, X. Ouyang, X. Hou, D. Chen, R. Wang, G. Shen, Flexible coaxial-type fiber supercapacitor based on NiCo2O4 nanosheets electrodes, Nano Energy, 8 (2014) 44–51. [40] E.C. Wegener Z.W. Wu H.T. Tseng J.R. Gallagher Y. Ren R.E. Diaz F.H. Ribeiro J.T. Miller Structure and reactivity of Pt-In intermetallic alloy nanoparticles: highly selective catalysts for ethane dehydrogenation Catal. Today 299 2018 146 153 E.C. Wegener, Z.W. Wu, H.T. Tseng, J.R. Gallagher, Y. Ren, R.E. Diaz, F.H. Ribeiro, J.T. Miller, Structure and reactivity of Pt-In intermetallic alloy nanoparticles: highly selective catalysts for ethane dehydrogenation, Catal. Today, 299 (2018) 146–153. [41] L.D. Deng H. Miura T. Shishido S. Hosokawa K. Teramura T. Tanaka Dehydrogenation of propane over silica-supported platinum-tin catalysts prepared by direct reduction: effects of tin/platinum ratio and reduction temperature ChemCatChem 6 2014 2680 2691 L.D. Deng, H. Miura, T. Shishido, S. Hosokawa, K. Teramura, T. Tanaka, Dehydrogenation of propane over silica-supported platinum-tin catalysts prepared by direct reduction: effects of tin/platinum ratio and reduction temperature, ChemCatChem, 6 (2014) 2680–2691. [42] H. Chen Y. Jie L. Chang X. Chen Reaction behavior of MgF2 powder in hexafluoropropylene/air atmospheres at high temperatures Solid State Ion. 340 2019 115016 H. Chen, Y. Jie, L. Chang, X. Chen, Reaction behavior of MgF2 powder in hexafluoropropylene/air atmospheres at high temperatures, Solid State Ion.340 (2019) 115016. [43] W. Han C. Zhang H. Wang S. Zhou H. Tang L. Yang Z. Wang Sub-nano MgF2 embedded in carbon nanofibers and electrospun MgF2 nanofibers by one-step electrospinning as highly efficient catalysts for 1,1,1-trifluoroethane dehydrofluorination Catal. Sci. Technol. 7 2017 6000 6012 W. Han, C. Zhang, H. Wang, S. Zhou, H. Tang, L. Yang, Z. Wang, Sub-nano MgF2 embedded in carbon nanofibers and electrospun MgF2 nanofibers by one-step electrospinning as highly efficient catalysts for 1,1,1-trifluoroethane dehydrofluorination, Catal. Sci. Technol.7 (2017) 6000–6012. [44] N. Martin M. Viniegra E. Lima G. Espinosa Coke characterization on Pt2O3-beta-zeolite reforming catalysts Ind. Eng. Chem. Res. 43 2004 1206 1210 N. Martin, M. Viniegra, E. Lima, G. Espinosa, Coke characterization on Pt2O3-beta-zeolite reforming catalysts, Ind. Eng. Chem. Res.43 (2004) 1206–1210. [45] F. Jiang L. Zeng S. Li G. Liu S. Wang J. Gong Propane dehydrogenation over Pt/TiO2-Al2O3 catalysts ACS Catal. 5 2014 438 447 F. Jiang, L. Zeng, S. Li, G. Liu, S. Wang, J. Gong, Propane dehydrogenation over Pt/TiO2-Al2O3 catalysts, ACS Catal.5 (2014) 438–447.",
      "scopus-id": "85116938358",
      "coredata": {
        "eid": "1-s2.0-S2468823121005617",
        "dc:description": "A series of MgF2-modified hydrotalcite-like (HT) derivatives supported Pt-In catalysts PtInHTR-X (X = NH4F, NaF and KF, R = reduced catalyst) were prepared by combination of hydrothermal method, alkali-etching and impregnation strategy and applied to direct dehydrogenation of isobutane to isobutene. The catalysts and precursors were characterized by XRD, SEM, TEM, XPS, TG, O2-TPO and low temperature N2 adsorption-desorption isotherms. The formation of MgF2 phase as dopant to modify the catalyst can influence the pore structure and even the surface acid properties of catalysts. Especially, compared with the three catalysts, PtInHTR-KF catalyst had better stability of isobutene selectivity of over 95% after 9 h reaction, and PtInHTR-NH4F and PtInHTR-NaF catalysts exhibited more stable isobutane activity of 60%. One of the reasons for this catalytic performance is that small particles of MgF2 and unsaturated MgF2 can provide weak acidic sites which can inhibit coke deposition. And it was found the improved catalytic performance was also related to the appropriate In3+/In0 ratio, well-dispersed Pt species and the excellent anti-sintering ability of catalysts modified MgF2.",
        "openArchiveArticle": "false",
        "prism:coverDate": "2021-10-31",
        "openaccessUserLicense": null,
        "prism:aggregationType": "Journal",
        "prism:url": "https://api.elsevier.com/content/article/pii/S2468823121005617",
        "dc:creator": [
          {
            "@_fa": "true",
            "$": "Song, Zhen"
          },
          {
            "@_fa": "true",
            "$": "Wang, Jiameng"
          },
          {
            "@_fa": "true",
            "$": "Zhang, Xiqing"
          },
          {
            "@_fa": "true",
            "$": "Liu, Fanji"
          },
          {
            "@_fa": "true",
            "$": "Zhang, Lihong"
          }
        ],
        "link": [
          {
            "@_fa": "true",
            "@rel": "self",
            "@href": "https://api.elsevier.com/content/article/pii/S2468823121005617"
          },
          {
            "@_fa": "true",
            "@rel": "scidir",
            "@href": "https://www.sciencedirect.com/science/article/pii/S2468823121005617"
          }
        ],
        "dc:format": "application/json",
        "openaccessType": null,
        "pii": "S2468-8231(21)00561-7",
        "prism:volume": "515",
        "articleNumber": "111944",
        "prism:publisher": "Elsevier B.V.",
        "dc:title": "Enhanced catalytic performance of isobutane direct dehydrogenation over Pt-In catalysts: Effect of different fluorides modified hydrotalcite-like derivatives",
        "prism:copyright": "© 2021 Elsevier B.V. All rights reserved.",
        "openaccess": "0",
        "prism:issn": "24688231",
        "dcterms:subject": [
          {
            "@_fa": "true",
            "$": "Isobutane dehydrogenation"
          },
          {
            "@_fa": "true",
            "$": "Supported Pt-In catalyst"
          },
          {
            "@_fa": "true",
            "$": "MgF2 phase"
          },
          {
            "@_fa": "true",
            "$": "The acidic sites"
          },
          {
            "@_fa": "true",
            "$": "Anti-sintering"
          }
        ],
        "openaccessArticle": "false",
        "prism:publicationName": "Molecular Catalysis",
        "openaccessSponsorType": null,
        "prism:pageRange": "111944",
        "pubType": "fla",
        "prism:coverDisplayDate": "October 2021",
        "prism:doi": "10.1016/j.mcat.2021.111944",
        "prism:startingPage": "111944",
        "dc:identifier": "doi:10.1016/j.mcat.2021.111944",
        "openaccessSponsorName": null
      },
      "objects": {
        "object": [
          {
            "@category": "standard",
            "@height": "586",
            "@width": "584",
            "@_fa": "true",
            "$": "https://api.elsevier.com/content/object/eid/1-s2.0-S2468823121005617-gr7.jpg?httpAccept=%2A%2F%2A",
            "@multimediatype": "JPEG image file",
            "@type": "IMAGE-DOWNSAMPLED",
            "@size": "184266",
            "@ref": "gr7",
            "@mimetype": "image/jpeg"
          },
          {
            "@category": "standard",
            "@height": "244",
            "@width": "637",
            "@_fa": "true",
            "$": "https://api.elsevier.com/content/object/eid/1-s2.0-S2468823121005617-gr6.jpg?httpAccept=%2A%2F%2A",
            "@multimediatype": "JPEG image file",
            "@type": "IMAGE-DOWNSAMPLED",
            "@size": "58904",
            "@ref": "gr6",
            "@mimetype": "image/jpeg"
          },
          {
            "@category": "standard",
            "@height": "514",
            "@width": "656",
            "@_fa": "true",
            "$": "https://api.elsevier.com/content/object/eid/1-s2.0-S2468823121005617-gr5.jpg?httpAccept=%2A%2F%2A",
            "@multimediatype": "JPEG image file",
            "@type": "IMAGE-DOWNSAMPLED",
            "@size": "126284",
            "@ref": "gr5",
            "@mimetype": "image/jpeg"
          },
          {
            "@category": "standard",
            "@height": "694",
            "@width": "495",
            "@_fa": "true",
            "$": "https://api.elsevier.com/content/object/eid/1-s2.0-S2468823121005617-gr4.jpg?httpAccept=%2A%2F%2A",
            "@multimediatype": "JPEG image file",
            "@type": "IMAGE-DOWNSAMPLED",
            "@size": "154439",
            "@ref": "gr4",
            "@mimetype": "image/jpeg"
          },
          {
            "@category": "standard",
            "@height": "255",
            "@width": "639",
            "@_fa": "true",
            "$": "https://api.elsevier.com/content/object/eid/1-s2.0-S2468823121005617-gr3.jpg?httpAccept=%2A%2F%2A",
            "@multimediatype": "JPEG image file",
            "@type": "IMAGE-DOWNSAMPLED",
            "@size": "53236",
            "@ref": "gr3",
            "@mimetype": "image/jpeg"
          },
          {
            "@category": "standard",
            "@height": "424",
            "@width": "386",
            "@_fa": "true",
            "$": "https://api.elsevier.com/content/object/eid/1-s2.0-S2468823121005617-gr2.jpg?httpAccept=%2A%2F%2A",
            "@multimediatype": "JPEG image file",
            "@type": "IMAGE-DOWNSAMPLED",
            "@size": "73807",
            "@ref": "gr2",
            "@mimetype": "image/jpeg"
          },
          {
            "@category": "standard",
            "@height": "87",
            "@width": "301",
            "@_fa": "true",
            "$": "https://api.elsevier.com/content/object/eid/1-s2.0-S2468823121005617-ga1.jpg?httpAccept=%2A%2F%2A",
            "@multimediatype": "JPEG image file",
            "@type": "IMAGE-DOWNSAMPLED",
            "@size": "20164",
            "@ref": "ga1",
            "@mimetype": "image/jpeg"
          },
          {
            "@category": "standard",
            "@height": "546",
            "@width": "391",
            "@_fa": "true",
            "$": "https://api.elsevier.com/content/object/eid/1-s2.0-S2468823121005617-gr1.jpg?httpAccept=%2A%2F%2A",
            "@multimediatype": "JPEG image file",
            "@type": "IMAGE-DOWNSAMPLED",
            "@size": "86744",
            "@ref": "gr1",
            "@mimetype": "image/jpeg"
          },
          {
            "@category": "thumbnail",
            "@height": "164",
            "@width": "163",
            "@_fa": "true",
            "$": "https://api.elsevier.com/content/object/eid/1-s2.0-S2468823121005617-gr7.sml?httpAccept=%2A%2F%2A",
            "@multimediatype": "GIF image file",
            "@type": "IMAGE-THUMBNAIL",
            "@size": "28215",
            "@ref": "gr7",
            "@mimetype": "image/gif"
          },
          {
            "@category": "thumbnail",
            "@height": "84",
            "@width": "219",
            "@_fa": "true",
            "$": "https://api.elsevier.com/content/object/eid/1-s2.0-S2468823121005617-gr6.sml?httpAccept=%2A%2F%2A",
            "@multimediatype": "GIF image file",
            "@type": "IMAGE-THUMBNAIL",
            "@size": "10020",
            "@ref": "gr6",
            "@mimetype": "image/gif"
          },
          {
            "@category": "thumbnail",
            "@height": "164",
            "@width": "209",
            "@_fa": "true",
            "$": "https://api.elsevier.com/content/object/eid/1-s2.0-S2468823121005617-gr5.sml?httpAccept=%2A%2F%2A",
            "@multimediatype": "GIF image file",
            "@type": "IMAGE-THUMBNAIL",
            "@size": "14993",
            "@ref": "gr5",
            "@mimetype": "image/gif"
          },
          {
            "@category": "thumbnail",
            "@height": "164",
            "@width": "117",
            "@_fa": "true",
            "$": "https://api.elsevier.com/content/object/eid/1-s2.0-S2468823121005617-gr4.sml?httpAccept=%2A%2F%2A",
            "@multimediatype": "GIF image file",
            "@type": "IMAGE-THUMBNAIL",
            "@size": "19675",
            "@ref": "gr4",
            "@mimetype": "image/gif"
          },
          {
            "@category": "thumbnail",
            "@height": "87",
            "@width": "219",
            "@_fa": "true",
            "$": "https://api.elsevier.com/content/object/eid/1-s2.0-S2468823121005617-gr3.sml?httpAccept=%2A%2F%2A",
            "@multimediatype": "GIF image file",
            "@type": "IMAGE-THUMBNAIL",
            "@size": "9184",
            "@ref": "gr3",
            "@mimetype": "image/gif"
          },
          {
            "@category": "thumbnail",
            "@height": "163",
            "@width": "149",
            "@_fa": "true",
            "$": "https://api.elsevier.com/content/object/eid/1-s2.0-S2468823121005617-gr2.sml?httpAccept=%2A%2F%2A",
            "@multimediatype": "GIF image file",
            "@type": "IMAGE-THUMBNAIL",
            "@size": "12714",
            "@ref": "gr2",
            "@mimetype": "image/gif"
          },
          {
            "@category": "thumbnail",
            "@height": "63",
            "@width": "219",
            "@_fa": "true",
            "$": "https://api.elsevier.com/content/object/eid/1-s2.0-S2468823121005617-ga1.sml?httpAccept=%2A%2F%2A",
            "@multimediatype": "GIF image file",
            "@type": "IMAGE-THUMBNAIL",
            "@size": "9664",
            "@ref": "ga1",
            "@mimetype": "image/gif"
          },
          {
            "@category": "thumbnail",
            "@height": "163",
            "@width": "117",
            "@_fa": "true",
            "$": "https://api.elsevier.com/content/object/eid/1-s2.0-S2468823121005617-gr1.sml?httpAccept=%2A%2F%2A",
            "@multimediatype": "GIF image file",
            "@type": "IMAGE-THUMBNAIL",
            "@size": "9950",
            "@ref": "gr1",
            "@mimetype": "image/gif"
          },
          {
            "@category": "high",
            "@height": "2599",
            "@width": "2588",
            "@_fa": "true",
            "$": "https://api.elsevier.com/content/object/eid/1-s2.0-S2468823121005617-gr7_lrg.jpg?httpAccept=%2A%2F%2A",
            "@multimediatype": "JPEG image file",
            "@type": "IMAGE-HIGH-RES",
            "@size": "1600538",
            "@ref": "gr7",
            "@mimetype": "image/jpeg"
          },
          {
            "@category": "high",
            "@height": "1082",
            "@width": "2823",
            "@_fa": "true",
            "$": "https://api.elsevier.com/content/object/eid/1-s2.0-S2468823121005617-gr6_lrg.jpg?httpAccept=%2A%2F%2A",
            "@multimediatype": "JPEG image file",
            "@type": "IMAGE-HIGH-RES",
            "@size": "431423",
            "@ref": "gr6",
            "@mimetype": "image/jpeg"
          },
          {
            "@category": "high",
            "@height": "2275",
            "@width": "2903",
            "@_fa": "true",
            "$": "https://api.elsevier.com/content/object/eid/1-s2.0-S2468823121005617-gr5_lrg.jpg?httpAccept=%2A%2F%2A",
            "@multimediatype": "JPEG image file",
            "@type": "IMAGE-HIGH-RES",
            "@size": "918768",
            "@ref": "gr5",
            "@mimetype": "image/jpeg"
          },
          {
            "@category": "high",
            "@height": "3074",
            "@width": "2194",
            "@_fa": "true",
            "$": "https://api.elsevier.com/content/object/eid/1-s2.0-S2468823121005617-gr4_lrg.jpg?httpAccept=%2A%2F%2A",
            "@multimediatype": "JPEG image file",
            "@type": "IMAGE-HIGH-RES",
            "@size": "1340576",
            "@ref": "gr4",
            "@mimetype": "image/jpeg"
          },
          {
            "@category": "high",
            "@height": "1128",
            "@width": "2831",
            "@_fa": "true",
            "$": "https://api.elsevier.com/content/object/eid/1-s2.0-S2468823121005617-gr3_lrg.jpg?httpAccept=%2A%2F%2A",
            "@multimediatype": "JPEG image file",
            "@type": "IMAGE-HIGH-RES",
            "@size": "369395",
            "@ref": "gr3",
            "@mimetype": "image/jpeg"
          },
          {
            "@category": "high",
            "@height": "1874",
            "@width": "1708",
            "@_fa": "true",
            "$": "https://api.elsevier.com/content/object/eid/1-s2.0-S2468823121005617-gr2_lrg.jpg?httpAccept=%2A%2F%2A",
            "@multimediatype": "JPEG image file",
            "@type": "IMAGE-HIGH-RES",
            "@size": "500125",
            "@ref": "gr2",
            "@mimetype": "image/jpeg"
          },
          {
            "@category": "high",
            "@height": "384",
            "@width": "1333",
            "@_fa": "true",
            "$": "https://api.elsevier.com/content/object/eid/1-s2.0-S2468823121005617-ga1_lrg.jpg?httpAccept=%2A%2F%2A",
            "@multimediatype": "JPEG image file",
            "@type": "IMAGE-HIGH-RES",
            "@size": "154053",
            "@ref": "ga1",
            "@mimetype": "image/jpeg"
          },
          {
            "@category": "high",
            "@height": "2419",
            "@width": "1733",
            "@_fa": "true",
            "$": "https://api.elsevier.com/content/object/eid/1-s2.0-S2468823121005617-gr1_lrg.jpg?httpAccept=%2A%2F%2A",
            "@multimediatype": "JPEG image file",
            "@type": "IMAGE-HIGH-RES",
            "@size": "638829",
            "@ref": "gr1",
            "@mimetype": "image/jpeg"
          },
          {
            "@category": "standard",
            "@_fa": "true",
            "$": "https://api.elsevier.com/content/object/eid/1-s2.0-S2468823121005617-mmc1.docx?httpAccept=%2A%2F%2A",
            "@multimediatype": "Microsoft Word file",
            "@type": "APPLICATION",
            "@size": "935089",
            "@ref": "mmc1",
            "@mimetype": "application/word"
          },
          {
            "@category": "thumbnail",
            "@_fa": "true",
            "$": "https://api.elsevier.com/content/object/eid/1-s2.0-S2468823121005617-si1.svg?httpAccept=%2A%2F%2A",
            "@multimediatype": "Scalable Vector Graphics file",
            "@type": "ALTIMG",
            "@size": "15717",
            "@ref": "si1",
            "@mimetype": "image/svg+xml"
          },
          {
            "@category": "thumbnail",
            "@_fa": "true",
            "$": "https://api.elsevier.com/content/object/eid/1-s2.0-S2468823121005617-si2.svg?httpAccept=%2A%2F%2A",
            "@multimediatype": "Scalable Vector Graphics file",
            "@type": "ALTIMG",
            "@size": "17768",
            "@ref": "si2",
            "@mimetype": "image/svg+xml"
          },
          {
            "@category": "thumbnail",
            "@_fa": "true",
            "$": "https://api.elsevier.com/content/object/eid/1-s2.0-S2468823121005617-si3.svg?httpAccept=%2A%2F%2A",
            "@multimediatype": "Scalable Vector Graphics file",
            "@type": "ALTIMG",
            "@size": "19299",
            "@ref": "si3",
            "@mimetype": "image/svg+xml"
          },
          {
            "@category": "standard",
            "@_fa": "true",
            "$": "https://api.elsevier.com/content/object/eid/1-s2.0-S2468823121005617-am.pdf?httpAccept=%2A%2F%2A",
            "@multimediatype": "Acrobat PDF file",
            "@type": "AAM-PDF",
            "@size": "2229939",
            "@ref": "am",
            "@mimetype": "application/pdf"
          }
        ]
      },
      "link": {
        "@rel": "abstract",
        "@href": "https://api.elsevier.com/content/abstract/scopus_id/85116938358"
      }
    }
  }
}