{
  "metadata": {
    "title": "Mesoporous Pd<ce:italic><ce:inf loc=post>x</ce:inf></ce:italic>Pt alloys: High-performance catalysts for methane combustion",
    "authors": "; ; ",
    "journal": "Molecular Catalysis",
    "date": "2017-12-31",
    "doi": "10.1016/j.mcat.2017.09.002",
    "abstract": "",
    "uri": "https://api.elsevier.com/content/article/pii/S2468823117304807",
    "pii": "S2468823117304807"
  },
  "fulltext": {
    "full-text-retrieval-response": {
      "scopus-eid": "2-s2.0-85031995045",
      "originalText": "serial JL 315758 291210 291744 291790 291809 31 Molecular Catalysis MOLECULARCATALYSIS 2017-10-13 2017-10-13 2017-10-13 2017-10-13 2018-10-31T12:01:59 1-s2.0-S2468823117304807 S2468-8231(17)30480-7 S2468823117304807 10.1016/j.mcat.2017.09.002 S300 S300.2 FULL-TEXT 1-s2.0-S2468823117X00163 2025-07-16T18:54:21.416085Z 0 0 20171201 20171231 2017 2017-10-13T22:26:44.316959Z absattachment articleinfo articletitlenorm authfirstinitialnorm authfirstsurnamenorm cid cids contenttype copyright crossmark dateloaded dateloadedtxt datesearch datesort dateupdated dco docsubtype doctype doi eid ewtransactionid hubeid indexeddate issn issnnorm itemstage itemtransactionid itemweight openaccess openarchive pg pgfirst pglast pii piinorm pubdateend pubdatestart pubdatetxt pubyr sectiontitle sortorder srctitle srctitlenorm srctype ssids alllist content subj subheadings suppl tomb volfirst volissue volumelist webpdf webpdfpagecount yearnav figure table e-component body acknowledge affil appendices articletitle auth authfirstini authfull authkeywords authlast grantnumber grantsponsor highlightsabst primabst pubtype ref specialabst 2468-8231 24688231 true 442 442 C Volume 442 24 191 201 191 201 201712 December 2017 2017-12-01 2017-12-31 2017 Regular Papers article fla © 2017 Elsevier B.V. All rights reserved. MESOPOROUSPDXPTALLOYSHIGHPERFORMANCECATALYSTSFORMETHANECOMBUSTION ZHAO X 1 Introduction 2 Experimental 2.1 Catalyst preparation 2.2 Catalyst characterization 2.3 Catalytic activity evaluation 3 Results and discussion 3.1 Crystal phase composition, pore structure, and surface area 3.2 Surface elemental composition and metal oxidation state 3.3 Reducibility 3.4 Desorption behavior 3.5 Catalytic performance 3.6 Effect of water vapor, CO2, and SO2 on catalytic activity 4 Conclusions Acknowledgments Appendix A Supplementary data References XU 2012 261 269 J GELIN 2002 1 37 P KINNUNEN 2011 54 61 N CARGNELLO 2012 713 717 M SADOKHINA 2017 351 360 N NILSSON 2015 2481 2489 J GAO 2008 2583 2587 D PERSSON 2005 139 150 K BURCH 1994 149 164 R YAMAMOTO 1998 147 151 H NARUI 1999 165 173 K KINNUNEN 2012 20 28 N CASTELLAZZI 2010 303 311 P CORRO 2010 35 42 G STROBEL 2005 9 16 R PERSSON 2006 14 24 K ZHANG 2012 7016 7031 J ZHU 2015 8896 8943 C ZHANG 2015 2050 2056 X WANG 2014 113 126 Y WANG 2011 14526 14529 H XU 2007 243 248 C SARAMAT 2008 253 260 A DUAN 2015 31 37 H KLEITZ 2003 2136 2137 F XU 2014 8875 8880 C ZHU 2016 8779 8783 C YASHNIK 2017 89 106 S PRIOLKAR 2002 2120 2128 K XIE 2015 38 48 S BRUN 1999 55 60 M XIE 2017 2271 2279 S BERA 2000 293 301 P MAO 2016 418 427 M ARANDIYAN 2015 1781 1793 H XU 2012 74 82 J MORLANG 2005 191 199 A MARTIN 2016 28009 28020 N HANEDA 2014 109 115 M LAPISARDI 2006 564 568 G BEDRANE 2005 90 96 S PAREDES 2009 86 93 J BURCH 1999 229 234 R CHEN 2014 3902 3909 C LI 2017 361 370 J KESAVAN 2011 195 199 L SAIMAN 2012 5981 5985 M WHITING 2015 637 644 G BURCH 1995 121 138 R SCHWARTZ 2012 8587 8593 W MAKHLOUF 2013 384350 M ARANDIYAN 2015 1781 1793 H SASAKI 1998 1225 1235 K WANG 2016 6935 6947 Y ERSSON 2003 265 277 A PERSSON 2007 401 414 K LYUBOVSKY 2003 71 84 M OZAWA 2004 1 7 Y SCHWARTZ 2012 8571 8578 W BURCH 1995 173 184 R SCHWARTZ 2012 8587 8593 W WU 2015 13 24 Z ZHAOX2017X191 ZHAOX2017X191X201 ZHAOX2017X191XX ZHAOX2017X191X201XX 2019-10-13T00:00:00Z http://creativecommons.org/licenses/by-nc-nd/4.0/ © 2017 Elsevier B.V. All rights reserved. item S2468-8231(17)30480-7 S2468823117304807 1-s2.0-S2468823117304807 10.1016/j.mcat.2017.09.002 315758 2018-10-31T12:13:44.031095Z 2017-12-01 2017-12-31 1-s2.0-S2468823117304807-main.pdf https://s3-eu-west-1.amazonaws.com/prod-ucs-content-store-eu-west/content/pii:S2468823117304807/MAIN/application/pdf/598ba286df433f907499e998c88776df/main.pdf https://s3.amazonaws.com/prod-ucs-content-store-us-east/content/pii:S2468823117304807/MAIN/application/pdf/598ba286df433f907499e998c88776df/main.pdf main.pdf pdf true 4620185 MAIN 11 1-s2.0-S2468823117304807-main_1.png https://s3-eu-west-1.amazonaws.com/prod-ucs-content-store-eu-west/content/pii:S2468823117304807/PREVIEW/image/png/da53c00f8ea8aa96aeb8ce5f232b6be5/main_1.png https://s3.amazonaws.com/prod-ucs-content-store-us-east/content/pii:S2468823117304807/PREVIEW/image/png/da53c00f8ea8aa96aeb8ce5f232b6be5/main_1.png main_1.png png 57621 849 656 IMAGE-WEB-PDF 1 1-s2.0-S2468823117304807-fx1.sml https://s3-eu-west-1.amazonaws.com/prod-ucs-content-store-eu-west/content/pii:S2468823117304807/fx1/THUMBNAIL/image/gif/08870be4532fe7796140f9bec348e000/fx1.sml https://s3.amazonaws.com/prod-ucs-content-store-us-east/content/pii:S2468823117304807/fx1/THUMBNAIL/image/gif/08870be4532fe7796140f9bec348e000/fx1.sml fx1 true fx1.sml sml 11556 164 201 IMAGE-THUMBNAIL 1-s2.0-S2468823117304807-fx2.sml https://s3-eu-west-1.amazonaws.com/prod-ucs-content-store-eu-west/content/pii:S2468823117304807/fx2/THUMBNAIL/image/gif/cabada2e8535d1f0091b42fdfe1b34da/fx2.sml https://s3.amazonaws.com/prod-ucs-content-store-us-east/content/pii:S2468823117304807/fx2/THUMBNAIL/image/gif/cabada2e8535d1f0091b42fdfe1b34da/fx2.sml fx2 fx2.sml sml 12360 164 201 IMAGE-THUMBNAIL 1-s2.0-S2468823117304807-fx3.sml https://s3-eu-west-1.amazonaws.com/prod-ucs-content-store-eu-west/content/pii:S2468823117304807/fx3/THUMBNAIL/image/gif/996102195dfbf8e658ada005c2ecc583/fx3.sml https://s3.amazonaws.com/prod-ucs-content-store-us-east/content/pii:S2468823117304807/fx3/THUMBNAIL/image/gif/996102195dfbf8e658ada005c2ecc583/fx3.sml fx3 fx3.sml sml 13033 164 201 IMAGE-THUMBNAIL 1-s2.0-S2468823117304807-fx4.sml https://s3-eu-west-1.amazonaws.com/prod-ucs-content-store-eu-west/content/pii:S2468823117304807/fx4/THUMBNAIL/image/gif/fd77bb44417787950edfefd2019a10e4/fx4.sml https://s3.amazonaws.com/prod-ucs-content-store-us-east/content/pii:S2468823117304807/fx4/THUMBNAIL/image/gif/fd77bb44417787950edfefd2019a10e4/fx4.sml fx4 fx4.sml sml 15207 164 201 IMAGE-THUMBNAIL 1-s2.0-S2468823117304807-fx5.sml https://s3-eu-west-1.amazonaws.com/prod-ucs-content-store-eu-west/content/pii:S2468823117304807/fx5/THUMBNAIL/image/gif/1d166461faed023765309ca1a08f9b9a/fx5.sml https://s3.amazonaws.com/prod-ucs-content-store-us-east/content/pii:S2468823117304807/fx5/THUMBNAIL/image/gif/1d166461faed023765309ca1a08f9b9a/fx5.sml fx5 fx5.sml sml 12692 164 201 IMAGE-THUMBNAIL 1-s2.0-S2468823117304807-fx6.sml https://s3-eu-west-1.amazonaws.com/prod-ucs-content-store-eu-west/content/pii:S2468823117304807/fx6/THUMBNAIL/image/gif/c0a485f31124a6ac2f7357a9a1075231/fx6.sml https://s3.amazonaws.com/prod-ucs-content-store-us-east/content/pii:S2468823117304807/fx6/THUMBNAIL/image/gif/c0a485f31124a6ac2f7357a9a1075231/fx6.sml fx6 fx6.sml sml 9517 164 201 IMAGE-THUMBNAIL 1-s2.0-S2468823117304807-fx7.sml https://s3-eu-west-1.amazonaws.com/prod-ucs-content-store-eu-west/content/pii:S2468823117304807/fx7/THUMBNAIL/image/gif/b3adbac0f715d83e4b0d657e894e4ab7/fx7.sml https://s3.amazonaws.com/prod-ucs-content-store-us-east/content/pii:S2468823117304807/fx7/THUMBNAIL/image/gif/b3adbac0f715d83e4b0d657e894e4ab7/fx7.sml fx7 fx7.sml sml 13812 164 201 IMAGE-THUMBNAIL 1-s2.0-S2468823117304807-fx8.sml https://s3-eu-west-1.amazonaws.com/prod-ucs-content-store-eu-west/content/pii:S2468823117304807/fx8/THUMBNAIL/image/gif/c0796f7fe7f90d96151e1f3d83da54d6/fx8.sml https://s3.amazonaws.com/prod-ucs-content-store-us-east/content/pii:S2468823117304807/fx8/THUMBNAIL/image/gif/c0796f7fe7f90d96151e1f3d83da54d6/fx8.sml fx8 fx8.sml sml 11997 164 201 IMAGE-THUMBNAIL 1-s2.0-S2468823117304807-gr1.sml https://s3-eu-west-1.amazonaws.com/prod-ucs-content-store-eu-west/content/pii:S2468823117304807/gr1/THUMBNAIL/image/gif/cbf7685b864073a9416c15047d733932/gr1.sml https://s3.amazonaws.com/prod-ucs-content-store-us-east/content/pii:S2468823117304807/gr1/THUMBNAIL/image/gif/cbf7685b864073a9416c15047d733932/gr1.sml gr1 gr1.sml sml 6383 164 166 IMAGE-THUMBNAIL 1-s2.0-S2468823117304807-gr10.sml https://s3-eu-west-1.amazonaws.com/prod-ucs-content-store-eu-west/content/pii:S2468823117304807/gr10/THUMBNAIL/image/gif/026f5735e996b74d6673c4bfb3e9f1bf/gr10.sml https://s3.amazonaws.com/prod-ucs-content-store-us-east/content/pii:S2468823117304807/gr10/THUMBNAIL/image/gif/026f5735e996b74d6673c4bfb3e9f1bf/gr10.sml gr10 gr10.sml sml 5055 164 182 IMAGE-THUMBNAIL 1-s2.0-S2468823117304807-gr11.sml https://s3-eu-west-1.amazonaws.com/prod-ucs-content-store-eu-west/content/pii:S2468823117304807/gr11/THUMBNAIL/image/gif/e4aa2d278221e77afd3b211d7ff499e0/gr11.sml https://s3.amazonaws.com/prod-ucs-content-store-us-east/content/pii:S2468823117304807/gr11/THUMBNAIL/image/gif/e4aa2d278221e77afd3b211d7ff499e0/gr11.sml gr11 gr11.sml sml 8149 164 185 IMAGE-THUMBNAIL 1-s2.0-S2468823117304807-gr12.sml https://s3-eu-west-1.amazonaws.com/prod-ucs-content-store-eu-west/content/pii:S2468823117304807/gr12/THUMBNAIL/image/gif/7cf09e544b127783982ddceec1db7569/gr12.sml https://s3.amazonaws.com/prod-ucs-content-store-us-east/content/pii:S2468823117304807/gr12/THUMBNAIL/image/gif/7cf09e544b127783982ddceec1db7569/gr12.sml gr12 gr12.sml sml 4946 93 219 IMAGE-THUMBNAIL 1-s2.0-S2468823117304807-gr13.sml https://s3-eu-west-1.amazonaws.com/prod-ucs-content-store-eu-west/content/pii:S2468823117304807/gr13/THUMBNAIL/image/gif/0d0b15acda532615f815a996295b7ac3/gr13.sml https://s3.amazonaws.com/prod-ucs-content-store-us-east/content/pii:S2468823117304807/gr13/THUMBNAIL/image/gif/0d0b15acda532615f815a996295b7ac3/gr13.sml gr13 gr13.sml sml 5018 95 219 IMAGE-THUMBNAIL 1-s2.0-S2468823117304807-gr2.sml https://s3-eu-west-1.amazonaws.com/prod-ucs-content-store-eu-west/content/pii:S2468823117304807/gr2/THUMBNAIL/image/gif/ecf239c8580b08e41f5281df0156a7c8/gr2.sml https://s3.amazonaws.com/prod-ucs-content-store-us-east/content/pii:S2468823117304807/gr2/THUMBNAIL/image/gif/ecf239c8580b08e41f5281df0156a7c8/gr2.sml gr2 gr2.sml sml 24162 146 219 IMAGE-THUMBNAIL 1-s2.0-S2468823117304807-gr3.sml https://s3-eu-west-1.amazonaws.com/prod-ucs-content-store-eu-west/content/pii:S2468823117304807/gr3/THUMBNAIL/image/gif/0a50aec5ddb90aebd925a6b31a4e6bd1/gr3.sml https://s3.amazonaws.com/prod-ucs-content-store-us-east/content/pii:S2468823117304807/gr3/THUMBNAIL/image/gif/0a50aec5ddb90aebd925a6b31a4e6bd1/gr3.sml gr3 gr3.sml sml 18463 111 219 IMAGE-THUMBNAIL 1-s2.0-S2468823117304807-gr4.sml https://s3-eu-west-1.amazonaws.com/prod-ucs-content-store-eu-west/content/pii:S2468823117304807/gr4/THUMBNAIL/image/gif/33dc2132bfb2129bac2b7eb6d39e2d99/gr4.sml https://s3.amazonaws.com/prod-ucs-content-store-us-east/content/pii:S2468823117304807/gr4/THUMBNAIL/image/gif/33dc2132bfb2129bac2b7eb6d39e2d99/gr4.sml gr4 gr4.sml sml 8149 116 219 IMAGE-THUMBNAIL 1-s2.0-S2468823117304807-gr5.sml https://s3-eu-west-1.amazonaws.com/prod-ucs-content-store-eu-west/content/pii:S2468823117304807/gr5/THUMBNAIL/image/gif/2f2c569474e2e0a0d1decaf7ca9b2483/gr5.sml https://s3.amazonaws.com/prod-ucs-content-store-us-east/content/pii:S2468823117304807/gr5/THUMBNAIL/image/gif/2f2c569474e2e0a0d1decaf7ca9b2483/gr5.sml gr5 gr5.sml sml 9028 114 219 IMAGE-THUMBNAIL 1-s2.0-S2468823117304807-gr6.sml https://s3-eu-west-1.amazonaws.com/prod-ucs-content-store-eu-west/content/pii:S2468823117304807/gr6/THUMBNAIL/image/gif/fc098b65d3e700f0c55e8e6a4f90d1b6/gr6.sml https://s3.amazonaws.com/prod-ucs-content-store-us-east/content/pii:S2468823117304807/gr6/THUMBNAIL/image/gif/fc098b65d3e700f0c55e8e6a4f90d1b6/gr6.sml gr6 gr6.sml sml 5090 164 125 IMAGE-THUMBNAIL 1-s2.0-S2468823117304807-gr7.sml https://s3-eu-west-1.amazonaws.com/prod-ucs-content-store-eu-west/content/pii:S2468823117304807/gr7/THUMBNAIL/image/gif/5bfc13dddc4db7d4540b2672d1cad54f/gr7.sml https://s3.amazonaws.com/prod-ucs-content-store-us-east/content/pii:S2468823117304807/gr7/THUMBNAIL/image/gif/5bfc13dddc4db7d4540b2672d1cad54f/gr7.sml gr7 gr7.sml sml 5079 164 147 IMAGE-THUMBNAIL 1-s2.0-S2468823117304807-gr8.sml https://s3-eu-west-1.amazonaws.com/prod-ucs-content-store-eu-west/content/pii:S2468823117304807/gr8/THUMBNAIL/image/gif/50103e9d501c014cc573abc7e64fe1f5/gr8.sml https://s3.amazonaws.com/prod-ucs-content-store-us-east/content/pii:S2468823117304807/gr8/THUMBNAIL/image/gif/50103e9d501c014cc573abc7e64fe1f5/gr8.sml gr8 gr8.sml sml 6097 164 153 IMAGE-THUMBNAIL 1-s2.0-S2468823117304807-gr9.sml https://s3-eu-west-1.amazonaws.com/prod-ucs-content-store-eu-west/content/pii:S2468823117304807/gr9/THUMBNAIL/image/gif/2b39cefb90e38201c80781cbad73b9dd/gr9.sml https://s3.amazonaws.com/prod-ucs-content-store-us-east/content/pii:S2468823117304807/gr9/THUMBNAIL/image/gif/2b39cefb90e38201c80781cbad73b9dd/gr9.sml gr9 gr9.sml sml 6500 99 219 IMAGE-THUMBNAIL 1-s2.0-S2468823117304807-fx1.jpg https://s3-eu-west-1.amazonaws.com/prod-ucs-content-store-eu-west/content/pii:S2468823117304807/fx1/DOWNSAMPLED/image/jpeg/4d593b5f0944a00d9d8f6ff5ca2a99a6/fx1.jpg https://s3.amazonaws.com/prod-ucs-content-store-us-east/content/pii:S2468823117304807/fx1/DOWNSAMPLED/image/jpeg/4d593b5f0944a00d9d8f6ff5ca2a99a6/fx1.jpg fx1 true fx1.jpg jpg 28228 245 301 IMAGE-DOWNSAMPLED 1-s2.0-S2468823117304807-fx2.jpg https://s3-eu-west-1.amazonaws.com/prod-ucs-content-store-eu-west/content/pii:S2468823117304807/fx2/DOWNSAMPLED/image/jpeg/9efacad472d9edd4a3ccebc5d05d5c14/fx2.jpg https://s3.amazonaws.com/prod-ucs-content-store-us-east/content/pii:S2468823117304807/fx2/DOWNSAMPLED/image/jpeg/9efacad472d9edd4a3ccebc5d05d5c14/fx2.jpg fx2 fx2.jpg jpg 9062 245 301 IMAGE-DOWNSAMPLED 1-s2.0-S2468823117304807-fx3.jpg https://s3-eu-west-1.amazonaws.com/prod-ucs-content-store-eu-west/content/pii:S2468823117304807/fx3/DOWNSAMPLED/image/jpeg/ccedd6fe721da32140fb78ac70ebca8b/fx3.jpg https://s3.amazonaws.com/prod-ucs-content-store-us-east/content/pii:S2468823117304807/fx3/DOWNSAMPLED/image/jpeg/ccedd6fe721da32140fb78ac70ebca8b/fx3.jpg fx3 fx3.jpg jpg 7883 245 301 IMAGE-DOWNSAMPLED 1-s2.0-S2468823117304807-fx4.jpg https://s3-eu-west-1.amazonaws.com/prod-ucs-content-store-eu-west/content/pii:S2468823117304807/fx4/DOWNSAMPLED/image/jpeg/0cbed5b19a912474f6a55c98bce4c81d/fx4.jpg https://s3.amazonaws.com/prod-ucs-content-store-us-east/content/pii:S2468823117304807/fx4/DOWNSAMPLED/image/jpeg/0cbed5b19a912474f6a55c98bce4c81d/fx4.jpg fx4 fx4.jpg jpg 9260 245 301 IMAGE-DOWNSAMPLED 1-s2.0-S2468823117304807-fx5.jpg https://s3-eu-west-1.amazonaws.com/prod-ucs-content-store-eu-west/content/pii:S2468823117304807/fx5/DOWNSAMPLED/image/jpeg/191aa4c13eb1888dc5108d65c6f1d75c/fx5.jpg https://s3.amazonaws.com/prod-ucs-content-store-us-east/content/pii:S2468823117304807/fx5/DOWNSAMPLED/image/jpeg/191aa4c13eb1888dc5108d65c6f1d75c/fx5.jpg fx5 fx5.jpg jpg 9158 245 301 IMAGE-DOWNSAMPLED 1-s2.0-S2468823117304807-fx6.jpg https://s3-eu-west-1.amazonaws.com/prod-ucs-content-store-eu-west/content/pii:S2468823117304807/fx6/DOWNSAMPLED/image/jpeg/e32e555ee9aa9e21f8b11237c79905e2/fx6.jpg https://s3.amazonaws.com/prod-ucs-content-store-us-east/content/pii:S2468823117304807/fx6/DOWNSAMPLED/image/jpeg/e32e555ee9aa9e21f8b11237c79905e2/fx6.jpg fx6 fx6.jpg jpg 6658 245 301 IMAGE-DOWNSAMPLED 1-s2.0-S2468823117304807-fx7.jpg https://s3-eu-west-1.amazonaws.com/prod-ucs-content-store-eu-west/content/pii:S2468823117304807/fx7/DOWNSAMPLED/image/jpeg/347d12d3119410186093d00ae3ed571c/fx7.jpg https://s3.amazonaws.com/prod-ucs-content-store-us-east/content/pii:S2468823117304807/fx7/DOWNSAMPLED/image/jpeg/347d12d3119410186093d00ae3ed571c/fx7.jpg fx7 fx7.jpg jpg 9087 245 301 IMAGE-DOWNSAMPLED 1-s2.0-S2468823117304807-fx8.jpg https://s3-eu-west-1.amazonaws.com/prod-ucs-content-store-eu-west/content/pii:S2468823117304807/fx8/DOWNSAMPLED/image/jpeg/9cb627255c65a0d770010d0b6e697908/fx8.jpg https://s3.amazonaws.com/prod-ucs-content-store-us-east/content/pii:S2468823117304807/fx8/DOWNSAMPLED/image/jpeg/9cb627255c65a0d770010d0b6e697908/fx8.jpg fx8 fx8.jpg jpg 9777 245 301 IMAGE-DOWNSAMPLED 1-s2.0-S2468823117304807-gr1.jpg https://s3-eu-west-1.amazonaws.com/prod-ucs-content-store-eu-west/content/pii:S2468823117304807/gr1/DOWNSAMPLED/image/jpeg/b840a2fae43a56a6f7ba01337039785a/gr1.jpg https://s3.amazonaws.com/prod-ucs-content-store-us-east/content/pii:S2468823117304807/gr1/DOWNSAMPLED/image/jpeg/b840a2fae43a56a6f7ba01337039785a/gr1.jpg gr1 gr1.jpg jpg 31509 371 376 IMAGE-DOWNSAMPLED 1-s2.0-S2468823117304807-gr10.jpg https://s3-eu-west-1.amazonaws.com/prod-ucs-content-store-eu-west/content/pii:S2468823117304807/gr10/DOWNSAMPLED/image/jpeg/18bac80406c675e2671098e8b4e3b1ab/gr10.jpg https://s3.amazonaws.com/prod-ucs-content-store-us-east/content/pii:S2468823117304807/gr10/DOWNSAMPLED/image/jpeg/18bac80406c675e2671098e8b4e3b1ab/gr10.jpg gr10 gr10.jpg jpg 22815 339 376 IMAGE-DOWNSAMPLED 1-s2.0-S2468823117304807-gr11.jpg https://s3-eu-west-1.amazonaws.com/prod-ucs-content-store-eu-west/content/pii:S2468823117304807/gr11/DOWNSAMPLED/image/jpeg/eb6a015b9c78910bb054d8d6a201ebb9/gr11.jpg https://s3.amazonaws.com/prod-ucs-content-store-us-east/content/pii:S2468823117304807/gr11/DOWNSAMPLED/image/jpeg/eb6a015b9c78910bb054d8d6a201ebb9/gr11.jpg gr11 gr11.jpg jpg 37786 334 376 IMAGE-DOWNSAMPLED 1-s2.0-S2468823117304807-gr12.jpg https://s3-eu-west-1.amazonaws.com/prod-ucs-content-store-eu-west/content/pii:S2468823117304807/gr12/DOWNSAMPLED/image/jpeg/8679c7a0e70e00bce3998ed85e3db495/gr12.jpg https://s3.amazonaws.com/prod-ucs-content-store-us-east/content/pii:S2468823117304807/gr12/DOWNSAMPLED/image/jpeg/8679c7a0e70e00bce3998ed85e3db495/gr12.jpg gr12 gr12.jpg jpg 35474 256 602 IMAGE-DOWNSAMPLED 1-s2.0-S2468823117304807-gr13.jpg https://s3-eu-west-1.amazonaws.com/prod-ucs-content-store-eu-west/content/pii:S2468823117304807/gr13/DOWNSAMPLED/image/jpeg/5463a819bb0bb09e209a09c08c7c3f02/gr13.jpg https://s3.amazonaws.com/prod-ucs-content-store-us-east/content/pii:S2468823117304807/gr13/DOWNSAMPLED/image/jpeg/5463a819bb0bb09e209a09c08c7c3f02/gr13.jpg gr13 gr13.jpg jpg 35798 262 602 IMAGE-DOWNSAMPLED 1-s2.0-S2468823117304807-gr2.jpg https://s3-eu-west-1.amazonaws.com/prod-ucs-content-store-eu-west/content/pii:S2468823117304807/gr2/DOWNSAMPLED/image/jpeg/9cab2e36acb97c63270f17695b32d8f4/gr2.jpg https://s3.amazonaws.com/prod-ucs-content-store-us-east/content/pii:S2468823117304807/gr2/DOWNSAMPLED/image/jpeg/9cab2e36acb97c63270f17695b32d8f4/gr2.jpg gr2 gr2.jpg jpg 111673 439 659 IMAGE-DOWNSAMPLED 1-s2.0-S2468823117304807-gr3.jpg https://s3-eu-west-1.amazonaws.com/prod-ucs-content-store-eu-west/content/pii:S2468823117304807/gr3/DOWNSAMPLED/image/jpeg/670cd0c3d4f8dec0b8fbaa5ed38bb030/gr3.jpg https://s3.amazonaws.com/prod-ucs-content-store-us-east/content/pii:S2468823117304807/gr3/DOWNSAMPLED/image/jpeg/670cd0c3d4f8dec0b8fbaa5ed38bb030/gr3.jpg gr3 gr3.jpg jpg 104310 361 715 IMAGE-DOWNSAMPLED 1-s2.0-S2468823117304807-gr4.jpg https://s3-eu-west-1.amazonaws.com/prod-ucs-content-store-eu-west/content/pii:S2468823117304807/gr4/DOWNSAMPLED/image/jpeg/a382a1456f40b5ffb3c8b35cc9e4c0c7/gr4.jpg https://s3.amazonaws.com/prod-ucs-content-store-us-east/content/pii:S2468823117304807/gr4/DOWNSAMPLED/image/jpeg/a382a1456f40b5ffb3c8b35cc9e4c0c7/gr4.jpg gr4 gr4.jpg jpg 58397 320 602 IMAGE-DOWNSAMPLED 1-s2.0-S2468823117304807-gr5.jpg https://s3-eu-west-1.amazonaws.com/prod-ucs-content-store-eu-west/content/pii:S2468823117304807/gr5/DOWNSAMPLED/image/jpeg/e6bb465e673d1a34fbefe018f680f1ec/gr5.jpg https://s3.amazonaws.com/prod-ucs-content-store-us-east/content/pii:S2468823117304807/gr5/DOWNSAMPLED/image/jpeg/e6bb465e673d1a34fbefe018f680f1ec/gr5.jpg gr5 gr5.jpg jpg 59298 314 602 IMAGE-DOWNSAMPLED 1-s2.0-S2468823117304807-gr6.jpg https://s3-eu-west-1.amazonaws.com/prod-ucs-content-store-eu-west/content/pii:S2468823117304807/gr6/DOWNSAMPLED/image/jpeg/21f00382845b2b04c9a82bcc564d56e8/gr6.jpg https://s3.amazonaws.com/prod-ucs-content-store-us-east/content/pii:S2468823117304807/gr6/DOWNSAMPLED/image/jpeg/21f00382845b2b04c9a82bcc564d56e8/gr6.jpg gr6 gr6.jpg jpg 36827 492 376 IMAGE-DOWNSAMPLED 1-s2.0-S2468823117304807-gr7.jpg https://s3-eu-west-1.amazonaws.com/prod-ucs-content-store-eu-west/content/pii:S2468823117304807/gr7/DOWNSAMPLED/image/jpeg/cde54dc25f0911309e27c488e29b76c2/gr7.jpg https://s3.amazonaws.com/prod-ucs-content-store-us-east/content/pii:S2468823117304807/gr7/DOWNSAMPLED/image/jpeg/cde54dc25f0911309e27c488e29b76c2/gr7.jpg gr7 gr7.jpg jpg 31349 419 376 IMAGE-DOWNSAMPLED 1-s2.0-S2468823117304807-gr8.jpg https://s3-eu-west-1.amazonaws.com/prod-ucs-content-store-eu-west/content/pii:S2468823117304807/gr8/DOWNSAMPLED/image/jpeg/77c69b16dddde41b0b0dd2c14be14c80/gr8.jpg https://s3.amazonaws.com/prod-ucs-content-store-us-east/content/pii:S2468823117304807/gr8/DOWNSAMPLED/image/jpeg/77c69b16dddde41b0b0dd2c14be14c80/gr8.jpg gr8 gr8.jpg jpg 36203 404 376 IMAGE-DOWNSAMPLED 1-s2.0-S2468823117304807-gr9.jpg https://s3-eu-west-1.amazonaws.com/prod-ucs-content-store-eu-west/content/pii:S2468823117304807/gr9/DOWNSAMPLED/image/jpeg/1402b4cf78528b401d965c189c4585ba/gr9.jpg https://s3.amazonaws.com/prod-ucs-content-store-us-east/content/pii:S2468823117304807/gr9/DOWNSAMPLED/image/jpeg/1402b4cf78528b401d965c189c4585ba/gr9.jpg gr9 gr9.jpg jpg 40432 271 602 IMAGE-DOWNSAMPLED 1-s2.0-S2468823117304807-mmc1.doc https://s3-eu-west-1.amazonaws.com/prod-ucs-content-store-eu-west/content/pii:S2468823117304807/mmc1/MAIN/application/msword/a3ba369eebde1fadbd6029073be336ca/mmc1.doc https://s3.amazonaws.com/prod-ucs-content-store-us-east/content/pii:S2468823117304807/mmc1/MAIN/application/msword/a3ba369eebde1fadbd6029073be336ca/mmc1.doc mmc1 mmc1.doc doc 2298368 APPLICATION MCAT 294 S2468-8231(17)30480-7 10.1016/j.mcat.2017.09.002 Elsevier B.V. Fig. 1 XRD patterns of (a) Pd, (b) Pd8.52Pt, (c) Pd2.41Pt, (d) Pd0.99Pt, (e) Pd0.43Pt, and (f) Pt. Fig. 1 Fig. 2 TEM images of (a) Pd, (b) Pd8.52Pt, (c) Pd2.41Pt, (d) Pd0.99Pt, (e) Pd0.43Pt, and (f) Pt. Fig. 2 Fig. 3 (a and e) HAADF-STEM images and (b–d, f–h) elemental mapping of the Pd2.41Pt sample in different regions. Fig. 3 Fig. 4 (A) Nitrogen adsorption–desorption isotherms and (B) pore-size distributions of (a) Pd, (b) Pd8.52Pt, (c) Pd2.41Pt, (d) Pd0.99Pt, (e) Pd0.43Pt, and (f) Pt. Fig. 4 Fig. 5 (A) Pd 3d and (B) Pt 4f XPS spectra of (a) Pd, (b) Pd8.52Pt, (c) Pd2.41Pt, (d) Pd0.99Pt, (e) Pd0.43Pt, (f) Pt, and (g) used Pd2.41Pt. Fig. 5 Fig. 6 CO–TPR profiles of (a) Pd, (b) Pd8.52Pt, (c) Pd2.41Pt, (d) Pd0.99Pt, (e) Pd0.43Pt, and (f) Pt. Fig. 6 Fig. 7 O2–TPD profiles of (a) Pd, (b) Pd8.52Pt, (c) Pd2.41Pt, (d) Pd0.99Pt, (e) Pd0.43Pt, and (f) Pt. Fig. 7 Fig. 8 CH4–TPD profiles of (a) Pd, (b) Pd8.52Pt, (c) Pd2.41Pt, (d) Pd0.99Pt, (e) Pd0.43Pt, and (f) Pt. Fig. 8 Fig. 9 (A) Methane conversion as a function of temperature over ( ) Pd, ( ) Pd8.52Pt, ( ) Pd2.41Pt, ( ) Pd0.99Pt, ( ) Pd0.43Pt, and (■) Pt; (B) methane conversion versus temperature over the Pd2.41Pt sample when the temperature (a) rose, (b) dropped, and (c) rose again at SV=100,000mL/(gh). Fig. 9 Fig. 10 Methane conversion versus temperature over the ( ) oxidized and ( ) reduced Pd2.41Pt samples at SV=100,000mL/(g and h). Fig. 10 Fig. 11 Methane conversion versus on-stream reaction time over the Pd, Pd2.41Pt, and Pt samples at 350°C. Fig. 11 Fig. 12 Effects of (A) water vapor and (B) CO2 on methane conversion over the Pd2.41Pt sample at 310°C and SV=100,000mL/(gh). Fig. 12 Fig. 13 (A) Effect of 100ppm SO2 on methane conversion over the Pd2.41Pt sample at 310°C and SV=100,000mL/(gh), and (B) in situ DRIFT spectra of the Pd2.41Pt sample after (a) 4h of methane combustion at 310°C, (b) 10h of methane combustion at 310°C when 100ppm SO2 was introduced, and (c) 9h of methane combustion at 310°C when 100ppm SO2 was cut off. Fig. 13 Table 1 BET surface areas, average pore sizes, pore volumes, average noble metal particle sizes (D), real Pd or Pt contents, and real Pd/Pt molar ratios of the samples. Table 1 Nominal sample Real sample BET surface area (m2/g) Average pore size (nm) Pore volume (cm3/g) XRD result ICP–AES result Crystal phase D a (nm) Real Pd content b (wt%) Real Pt content b (wt%) Real Pd/Pt molar ratio b (mol/mol) Pd Pd 30.2 19.8 0.137 Cubic 9.4 100 – – Pd9Pt1 Pd8.52Pt 25.5 18.1 0.131 Cubic 7.9 82.3 17.7 8.52 Pd7Pt3 Pd2.41Pt 31.9 15.6 0.142 Cubic 7.1 56.8 43.2 2.41 Pd5Pt5 Pd0.99Pt 29.2 14.9 0.149 Cubic 7.2 35.1 64.9 0.99 Pd3Pt7 Pd0.43Pt 29.6 14.4 0.147 Cubic 7.4 18.9 81.1 0.43 Pt Pt 31.1 13.7 0.123 Cubic 6.8 – 100 – a Data were calculated according to the Scherrer equation using the FWHM of the (111) line of cubic Pd or Pt. b Data were determined by the ICP−AES technique. Table 2 Surface element compositions, catalytic activities, TOFs, and specific reaction rates at 280°C and SV=100,000mL/(gh) of the samples. Table 2 Sample Surface element composition Catalytic activity Methane combustion at 280°C Pd2+/Pd0 molar ratio Pt4+/Pt0 molar ratio Pd/Ptmolar ratio T 10% (°C) T 50% (°C) T 90% (°C) TOFPd b (×10−3 s−1) TOFPt b (×10−3 s−1) TOFPd+Pt b (×10−3 s−1) Specific reaction rate(μmol/(gcat s)) Pd 12.75 – – 313 350 368 0.11 – – 1.06 Pd8.52Pt 11.10 2.78 12.66 297 338 351 0.21 1.92 0.19 1.67 Pd2.41Pt 7.57 2.12 2.82 272 303 322 0.85 1.98 0.59 4.46 Pd0.99Pt 1.86 0.90 0.90 292 322 338 0.45 0.45 0.22 1.49 Pd0.43Pt 1.03 0.48 0.46 292 328 348 0.95 0.41 0.28 1.69 Pt – 0.58 – 282 372 506 – 0.53 – 2.70 Used Pd2.41Pt a 40.69 2.93 2.78 254 283 306 – – – – a Used sample after the drop and rise in reaction temperature. b TOFPd, TOFPt, and TOFPd+Pt were calculated according to TOFM = XC 0/n M (n M is the molar amount of Pd, Pt or Pd+Pt in the samples, respectively). Editor’s choice paper Mesoporous Pd x Pt alloys: High-performance catalysts for methane combustion Xingtian Zhao Yuxi Liu ⁎ Jiguang Deng ⁎ Peng Xu Jun Yang Kunfeng Zhang Zhuo Han Hongxing Dai ⁎ Beijing Key Laboratory for Green Catalysis and Separation, Key Laboratory of Beijing on Regional Air Pollution Control, Laboratory of Catalysis Chemistry and Nanoscience, Department of Chemistry and Chemical Engineering, College of Environmental and Energy Engineering, Beijing University of Technology, Beijing 100124, China Beijing Key Laboratory for Green Catalysis and Separation Key Laboratory of Beijing on Regional Air Pollution Control Laboratory of Catalysis Chemistry and Nanoscience Department of Chemistry and Chemical Engineering College of Environmental and Energy Engineering Beijing University of Technology Beijing 100124 China ⁎ Corresponding authors. Graphical abstract Mesoporous Pd x Pt (x =0.43–8.52) alloys are synthesized via a KIT-6-templating route. The excellent catalytic performance of the Pd2.41Pt sample is associated with its mesoporous structure, Pd–Pt alloy and PdO–PtO2 coexistence, and good methane and oxygen activation ability. Mesoporous cubic Pd x Pt (x =0.43–8.52) alloys with surface areas of 26–32m2/g were synthesized using the KIT-6-templating method. Physicochemical properties of the materials were characterized by means of various techniques, and their catalytic activities were evaluated for methane combustion. It is found that the Pd and Pt were uniformly distributed in the Pd x Pt alloys. The addition of Pt to Pd exerted a significant effect on the redox property of Pd. The Pd x Pt alloys possessed a higher methane activation ability than the monometallic Pd. The oxidized Pd–Pt (i.e., PdO–PtO2) were more active than the metallic Pd0–Pt0. The Pd2.41Pt sample performed the best for methane combustion (T 10%, T 50%, and T 90% were 272, 303, and 322°C at SV=100,000mL/(gh); TOFPd, TOFPt, TOFPd+Pt, and specific reaction rate at 280°C were 0.85×10−3 s−1, 1.98×10−3 s−1, 0.59×10−3 s−1, and 4.46μmol/(gcat s), respectively). The deactivation of the Pd2.41Pt sample induced by 2.5–5.0vol% CO2 or H2O addition was reversible, but its deactivation due to 100ppm SO2 introduction was irreversible. It is concluded that the excellent catalytic performance of the Pd2.41Pt sample was associated with its good mesoporous structure, Pd–Pt alloy and PdO–PtO2 coexistence, and good methane and oxygen activation ability. Keywords Mesoporous Pd–Pt alloy PdO–PtO2 active site Redox property Methane combustion Methane activation ability 1 Introduction Methane is widely used in industrial and transportation activities as it is the main component of natural gas. Due to its tough combustion, however, unburned methane at low temperatures always exists in the exhaust. It is generally accepted that methane induces a strong greenhouse effect with a global warming potential 20 times higher than that of CO2 [1]. Therefore, much attention has been paid on reducing the emission of methane. Flame combustion of methane at high temperatures often results in the emissions of nitrogen oxides (NO x ) and CO that are harmful to the environment. Compared to the conventional flame combustion, catalytic combustion of methane is regarded as an efficient and green pathway, in which the key issue is the availability of high-performance catalysts at low temperatures. Therefore, it is highly desirable to design and prepare novel catalysts with excellent low-temperature activity and stability. In the past years, the Pd-based catalysts have been investigated intensively and extensively due to their good catalytic performance for methane combustion [2–5]. For example, PdO or Pd–PdO mixture were recognized as the active phase of the supported Pd catalysts at low temperatures, but the metallic Pd0 was the active phase at high temperatures [1–3,6,7]. The performance of the Pd-based catalysts for methane lean-burn combustion at low temperatures could be improved if the Pd was alloyed with other metals (e.g., Pt [8]). The Pt was found to be more active under the rich-burn conditions (O2/CH4 molar ratio <2) [9]. Although monometallic Pt catalysts were less active than the monometallic Pd catalysts under lean-burn conditions [9], some researchers [10–14] have pointed out that substituting Pt for Pd could generate a catalyst that showed enhanced catalytic activity and stability. The influence of Pt on catalytic activity of a bimetallic catalyst, however, is still a debated issue. For instance, Strobel et al. [15] investigated the combustion of methane over the supported Pd–Pt catalysts with different amounts of Pt and Pd, and observed a positive effect on catalytic performance over the supported Pd–Pt catalysts with smaller Pt amounts, but a negative effect on catalytic activity was observed over the supported Pd–Pt catalysts with higher Pt loadings. Such a phenomenon was also reported by Persson et al. [16], who claimed that the Pt could act either as a promoter or as an inhibitor for methane combustion. Castellazzi et al. [13] attributed this result to the extent of PdO formation, the strength of the metal–support interaction, and the stabilization of metallic Pd0. Recently, the materials consisting of mesoporous networks have been found to be highly active for some reactions. These porous materials possess large specific surface areas, high structural stability, and good catalytic durability due to their nanoscale skeletons and inter-connected hollow channels that are favorable for easy mass transfer and high electron conductivity [17,18]. In the past years, porous noble metal nanostructures have gained enormous attention [19–24]. For example, the 3D porous architecture could not only maximize the availability of electron transfer within nanosized surface but also provide better mass transfer of reactants to the catalyst [18]. Xu and coworkers [22,24] conducted a systematic investigation on the catalytic properties of nanoporous gold, and found that the porous Au catalysts performed well in the oxidation of CO. It has been generally accepted that the metal–support interaction plays an important role in improving the catalytic activity of a supported noble metal catalyst. In order to leave out the effect of the metal-support interaction, only noble metals can be used as catalyst to investigate their catalytic performance and hence clarify the active sites. Up to now, however, there have been no reports on the preparation and catalytic applications of mesoporous Pd x Pt alloys for methane combustion. In the present work, we used the mesoporous silica (KIT-6) as hard template to fabricate the mesoporous Pd, Pt and Pd x Pt alloys, characterized their physicochemical properties, and evaluated their catalytic performance for methane combustion. It is found that the Pd x Pt alloys showed much better catalytic activity than the monometallic Pd or Pt. 2 Experimental 2.1 Catalyst preparation Ordered mesoporous silica (KIT-6) was synthesized under the hydrothermal conditions at 100°C for 24h according to the procedure of the previous literature [25]. As confirmed by the small-angle X-ray diffraction pattern (Fig. S1) and transmission electron microscopic image (Fig. S2), the as-synthesized KIT-6 template possessed an ordered mesoporous architecture with an average pore size of 6.8nm. The mesoporous bimetallic Pd x Pt alloys were prepared using the nanocasting method with KIT-6 as hard template. The typical preparation procedures are as follows: 1.00g of KIT-6 was added to 40mL of hexane at room temperature (RT). After being vigorously stirred for 30min and sonication for another 30min, a mixture of H2PdCl4 (0.56mol/L) and H2PtCl6 (0.56mol/L) aqueous solution was then added dropwise under stirring. The ratio of the volume of precursor aqueous solution to the pore volume of silica was 1.0. The hexane solution was sonicated for 1h. After removing the excessive solution, the obtained brown composite was dried at 120°C for 24h. Such an impregnation process was repeated several times to gain a high noble metal incorporation (30–45wt%) into the mesopores of the KIT-6. After being dried at 120°C for 24h, the resulting powders were placed into a three-neck flask at the ambient temperature for 30min under the protection of N2. Then, a NaBH4 aqueous solution (0.30mol/L) was added to reduce the H2PdCl4 and H2PtCl6 precursors (NaBH4/nobel metal molar ratio=10.00:1.00). Until no H2 was released, the black powders were centrifuged and the KIT-6 template was removed using a hydrofluoric acid aqueous solution (10wt%). After being washed five times with 250mL of deionized water (50mL for each time), the sample was dried at 120°C overnight, and calcined in air at a ramp of 1°C/min from RT to 400°C and kept at this temperature for 2h. By adjusting the molar ratios of H2PdCl4 and H2PtCl6, the Pd x Pt samples with different Pd/Pt molar ratios (x) were obtained. For comparison proposes, single metal Pd or Pt was also fabricated using the above method. The nominal x value was 9.00, 2.33, 1.00, and 0.43, respectively. The real noble metal contents of the samples were determined by the inductively coupled plasma atomic emission spectroscopic (ICP–AES) technique. 2.2 Catalyst characterization Physicochemical Properties of the Pd, Pd x Pt, and Pt samples were characterized by means of techniques, such as ICP–AES, X-ray diffraction (XRD), transmission electron microscopy (TEM), high-angle annular dark-field-scanning transmission electron microscopic (HAADF–STEM) and element mapping, N2 adsorption-desorption (BET), X-ray photoelectron spectroscopy, CO temperature-programmed reduction (CO-TPR), O2 temperature-programmed desorption (O2-TPD), CH4 temperature-programmed desorption (CH4-TPD), and Fourier transform infrared (FT–IR) spectroscopy. The detailed characterization procedures can be seen in the Supplementary material. 2.3 Catalytic activity evaluation Catalytic activities of the samples for methane combustion were evaluated in a continuous flow fixed-bed quartz tube microreactor. The reactant mixture was composed of 2.5vol% CH4 +20vol% O2 +77.5vol% N2 (balance), and the space velocity (SV) was ca. 100,000mL/(gh). All of the activity data were collected when the combustion of methane reached a steady state at a given temperature. Catalytic activities of the samples were evaluated using the temperatures (T 10%, T 50%, and T 90%) required for achieving methane conversions of 10, 50, and 90%, respectively. The detailed activity evaluation procedures are put in the Supplementary material. 3 Results and discussion 3.1 Crystal phase composition, pore structure, and surface area The results (Table 1 ) of ICP–AES investigations reveal that the real Pd/Pt molar ratios (x) in the Pd x Pt samples were 8.52, 2.41, 0.99, and 0.43, respectively, corresponding to the nominal Pd/Pt molar ratios of 9.00, 2.33, 1.00, and 0.43. Obviously, the real and nominal Pd/Pt molar ratios in the Pd x Pt samples were rather close, indicating that the preparation method was quite effective. Fig. 1 shows the XRD patterns of the Pd, Pt, and Pd x Pt samples. Compared to the XRD patterns of the standard Pd (JCPDS PDF# 46-1043) and Pt (JCPDS PDF# 04-0802) samples, one can realize that the diffraction peaks 2θ =40°, 46°, 68°, 82°, and 86° were assigned to the (111), (200), (220), (311) and (222) crystal planes, and could be indexed to the face-centered cubic crystal structure. It can be also observed that the diffraction peak due to the (111) crystal plane gradually shifted to a lower 2θ with increasing the Pt content in the Pd x Pt samples, and it located at the 2θ between those of the Pd(111) and Pt(111) crystal planes, indicating that an alloy was formed in the Pd x Pt samples. Since the Pd and Pt samples were of a face-centered cubic structure, the diffraction patterns of the Pd x Pt alloys were similar to those of the pure Pd or Pt sample [26]. The average grain sizes (Table 1) could be estimated according to the Scherrer equation (D =0.89λ/(βcos θ), where λ is the X-ray wavelength, β is the full width at half maximum (FWHM) of the (111) plane of the sample, and θ is the corresponding diffraction angle). It is seen that the calculated grain sizes of the Pd, Pt, and Pd x Pt samples were in the range of 6.8–9.4nm. Fig. 2 shows the TEM images of the as-obtained noble metal samples. The distinct color contrast between the dark skeletons and bright background region suggests the formation of a three-dimensional continuous network structure with interconnected hollow voids in each of the noble metal sample. In other words, a mesoporous architecture was generated in these samples. From the SAED patterns (insets of Fig. 2) of the samples, one can see several bright diffraction rings, which was indicative of formation of polycrystalline noble metals. The wall thickness of the mesopores in the samples was 7–10nm. Furthermore, the HAADF–STEM and element analysis images (Fig. 3 ) of the typical Pd2.41Pt sample clearly show that the distributions of Pd and Pt in the Pd2.41Pt sample throughout the entire domain were highly uniform. That is to say, the Pd and Pt was present in the form of an alloy in the Pd2.41Pt sample, in good agreement with the XRD results. Fig. 4 shows the N2 adsorption–desorption isotherms and pore-size distributions of the mesoporous Pd, Pt, and Pd x Pt samples, and their BET surface areas, average pore sizes, and pore volumes are summarized in Table 1. It is observed from Fig. 4A that each sample displayed a type II isotherm with a H2 hysteresis loop in the relative pressure (p/p 0) of 0.8–1.0. The H2 hysteresis loop (which showed a large uptake) was related to the distortion of mesopores [27]. The formation of mesopores in these noble metal samples is also confirmed by their pore-size distributions (Fig. 4B). The pore sizes were in the range of 5–30nm, with the average pore sizes being 13.7–19.8nm (Table 1). The BET surface areas and pore volumes of the noble metal samples were in the ranges of 25.5–31.9m2/g and 0.123–0.149cm3/g, respectively. 3.2 Surface elemental composition and metal oxidation state XPS is an effective technique to determine the surface elemental compositions and metal states of a catalyst. The Pd 3d XPS spectrum is composed of the Pd 3d5/2–Pd 3d3/2 spin-orbit doublets, and the binding energy (BE) of the spin-orbital splitting is 5.26eV. For PdO, the BE of Pd 3d5/2 was 336.6–337.7eV [28]. Fig. 5 illustrates the Pd 3d and Pt 4f XPS spectra of the samples and their surface element compositions are summarized in Table 2 . Compared to the bulk element compositions obtained from the ICP–AES technique, the surface Pd/Pt molar ratios (Table 2) of the Pd x Pt samples were higher (except for the Pd0.99Pt sample). By using the curve-fitting approach, each Pd 3d spectrum could be decomposed into four components at BE=335.5, 337.3, 340.7, and 342.6eV (Fig. 5A): the components at BE=335.5 and 340.7eV were attributed to the surface Pd0 species, whereas the ones at BE=337.3 and 342.6eV were assigned to the surface Pd2+ species [28–32]. It can be clearly observed that with increasing the Pt content in the Pd x Pt samples, the surface Pd2+ content decreased but the surface Pd0 content increased, indicating that the partial amount of surface PdO was reduced by the Pt. That is to say, the surface Pd2+ concentration could be modified by the doping of Pt. Similarly, the Pt 4f XPS spectrum of each sample could also be decomposed into four components (Fig. 5B): the components at BE=71.3 and 74.5eV were ascribed to the surface metallic Pt (Pt0) species, while the ones at BE=72.4 and 75.6eV were due to the surface oxidized Pt (Pt4+) species [33–35]. The surface Pt4+/Pt0 molar ratio decreased with increasing the Pt content in the Pd x Pt samples, but that on the Pd0.43Pt surface was slightly lower than that on the monometallic Pd surface. Since Pt is higher than Pd in electronegativity (the Pauling electronegativity of Pt and Pd is 2.28 and 2.20, respectively) [36], a charge transfer would occur from Pd to Pt in the bimetallic catalysts via Pt0 +Pd2+ →Pt4+ +Pd0. That is to say, Pt addition can enhance the Pd0 concentration due to the strong electronic interaction between Pd and Pt. The XPS results reveal that the surface Pd2+ concentration decreased but the surface Pd0 concentration increased, which are in good agreement with the fact that Pt possesses higher electron affinity than Pd. Therefore, the doping of Pt could reduce the ability of Pd to form the PdO phase. The formation of PtPd/PdO core-shell structures has been proposed by some researchers [16,37,38]. According to the XPS results, we deduce that Pd and Pt might be oxidized on the surface after calcination of the Pd, Pt or Pd x Pt sample, forming PdO x , PtO x or even Pd–O–Pt bonds due to their similar electronic properties; whereas Pd–Pt metallic alloy might be generated in the bulk of Pd x Pt. It should be pointed out that slight shifts in BE were seen in the Pd 3d and Pt 4f XPS spectra of the Pd x Pt samples, but their BE values were also similar to those reported in the literature [16,28]. The Pd2.41Pt sample after the drop and rise in reaction temperature was characterized by the XPS technique in order to investigate the changes in chemical state of noble metals (Fig. 5g). Obviously, the surface oxidized Pd and Pt concentrations increased after a recycle of methane combustion when the reaction temperature dropped and rose again. Such a result suggests that a higher surface PdO–PtO2 species concentration would be favorable for methane combustion. 3.3 Reducibility The reducibility of the Pd, Pt, and Pd x Pt samples was measured by the CO-TPR technique. Fig. 6 illustrates the CO-TPR profiles of the samples. The Pd sample showed the highest amount of CO2 formed at 132°C. For the Pt sample, there were three peaks of CO2 formation at 83, 280, and 345°C, respectively. However, the Pd x Pt samples displayed different reduction behaviors, depending upon their Pd/Pt molar ratios. Each of the Pt-containing bimetallic samples showed one small peak at 60–70°C and one broad peak at 90–300°C, confirming the formation of a Pd–Pt alloy. The adsorbed CO could reduce the oxidized Pd and/or Pt at elevated temperatures. Haneda et al. [39] studied the reducibility of the PdPt/Al2O3 samples by the CO-TPR technique, and observed a new reduction peak above 200°C (which was ascribed to the reduction of alloyed Pd–Pt NPs) in addition to the broader reduction peaks at 100–200°C. However, the catalytic activity cannot be fully correlated with the result of the CO-TPR study. Castellazzi et al. [13] reported strong evidence against a direct correlation between activity and PdO reducibility in the Pt-containing catalysts. Such a lack in correlation between reducibility and activity implies that the other factors rather than the surface PdO reduction could partially control the methane combustion rate over the bimetallic samples. Yashnik et al. [28] observed that a rise in the Pt share resulted in a drop in PdO amount of the PdPt/MnLaAl11O19 catalyst due to formation of the Pd–Pt alloy, and the formed Pd–Pt alloy implicitly influenced the redox and catalytic performance; when the Pt content increased, the redox properties of the bimetallic catalysts was worsen due to the rise in the share of PtO2 particles. Such a mismatch between reducibility and activity suggests the contributions of the other factors for methane combustion. Therefore, we conducted the O2-TPD and CH4-TPD experiments to gain more clear insights to the other factors influencing the combustion of methane over the Pd x Pt samples. 3.4 Desorption behavior To gain a more clear insight into the effect of Pt on the redox behavior of the Pd x Pt samples, we carried out the O2-TPD experiments and their profiles are illustrated in Figs. 7 and S3. For all of the samples, the O2 desorption peaks centered at low temperatures (300–480°C) were due to desorption of adsorbed oxygen species (e.g., O2 −, O2 2− or O−), whereas the ones at high temperatures 500–700°C) were due to desorption of lattice oxygen in the oxidized Pd and/or Pt (i.e., PdO and/or PtO2). As shown in Fig. 7, the O2-TPD profile was strongly modified by the addition of Pt to the Pd sample, and the Pd-like behavior slowly changed to the Pt-like behavior. Such observations were in good agreement with those reported in the literature [5,13,16,40]. Two main phenomena should be noticed: (i) the concentration of the adsorbed oxygen species on the samples decreased with the rise in Pt content; and (ii) when the Pt content increased, the O2 desorption peaks of the samples became lower in intensity and shifted to lower temperatures, suggesting that the presence of Pt weakened the Pd–O bond strength [13,40]. The results of XPS, TPR, and O2-TPD studies demonstrate formation of the PdO x and/or PtO x species, which were mainly distributed on the particle surface of each sample. We also measured the O2 desorption amounts of the samples, and they decreased in the sequence of Pd (8.46mmol/g)>Pd8.52Pt (6.84mmol/g)>Pd2.41Pt (4.30mmol/g)>Pd0.99Pt (2.94mmol/g)>Pt (2.00mmol/g)>Pd0.43Pt (1.21mmol/g), a result due to the drop in PdO content of the samples. The decreasing PdO (i.e., increasing Pt) content was in line with the results of XPS and CO-TPR investigations. However, desorbed amounts of the adsorbed oxygen species decreased in the sequence of Pd (2.32mmol/g)>Pt (1.42mmol/g)>Pd8.52Pt (1.15mmol/g)>Pd0.43Pt (1.02mmol/g)>Pd0.99Pt (0.90mmol/g)>Pd2.41Pt (0.64mmol/g). Although the Pd2.41Pt sample exhibited a less amount of adsorbed oxygen desorption, methane combustion activity over it was higher than those over the other samples (see below). Lapisardi et al. [40] also reported the same observations, and pointed out that the doping of PdO with Pt (even in a small Pt content) could induce the Pd–Pt interactions which led to the improved catalytic activity of the Pt-doped PdO sample for methane combustion. Persson et al. [16] claimed that the metallic noble metal phase could be maintained even in an oxidizing atmosphere due to the formation of a Pd–Pt alloy in the catalysts, resulting in a better activity as compared with the monometallic Pd catalyst. Another possible reason for the higher catalytic activity might be that a more amount of O2 molecules could be dissociatively adsorbed over the Pd–Pt alloys than over the PdO phase, so that the alloy provided the PdO with oxygen after reduction. The metals were much more active than the metal oxides in dissociating oxygen and the Pt metal was better than the Pd metal [41]. Hence, the superior property for O2 activation of the Pd–Pt alloys might be the reason why the sample containing a lower PdO content could perform better. It is commonly known that adsorption of reactants is a key step in heterogeneous catalysis. For methane combustion, the methane adsorption ability is possibly the key factor influencing the activity of a catalyst. CH4-TPD experiments were conducted to gain insights into the activation ability of the noble metal samples. However, it should be mentioned that desorption of methane from the Pd x Pt samples could be regarded as the temperature-programmed oxidation (TPO) of carbon species originated from methane [42]. As detected by the mass spectrometer, there was carbon dioxide (m/z =44) signal but almost no methane (m/z =15) signal from the surface of the samples. The results indicate that CH4 on the catalyst surface mainly existed in chemical adsorption form and then reacted with the oxygen species, eventually desorbing as CO2. As shown in the CH4-TPD profiles (Fig. 8 ) of the samples, there were three CO2 desorption peaks centered at 382, 452, and 602°C for the monometallic Pd sample, respectively. Compared to the Pt-containing samples, the addition of Pt induced a significant effect on CO2 desorption, in which CO2 formation occurred at lower temperatures. That is to say, the Pt-containing samples exhibited a stronger methane activation ability than the monometallic Pd sample. This result demonstrates that Pt was beneficial for methane activation. It is generally accepted that the Pd-based catalysts perform better for methane combustion, whereas the Pt-based ones are more suitable for the oxidation of higher hydrocarbons. Burch and coworkers [43] proposed that Pt could activate the almost non-polar C–H bonds of methane via a hemolytic mechanism (dissociative adsorption of CH4 at noble metal sites). Castellazzi et al. [13] also reported the dissociative adsorption of CH4 on the Pt surface. According to the results of CO-TPR, O2-TPD, and CH4-TPD studies, the Pt sample showed lower O2 and CO2 desorption temperatures as compared with other samples at the low-temperature region, which might be a result possibly due to the strong dissociation ability of methane and O2 molecules on the Pt surface. Therefore, the Pt sample was more active than the bimetallic samples at lower temperatures. The CO2 desorption amounts of the samples reveal important information related to the adsorption of CH4. However, the decreased CO2 quantity with the rise in Pt content of the Pd x Pt samples were mainly due to the decreased concentration of the oxygen species. It is noticeable that for the Pd2.41Pt sample, the peak centered at 381°C was nearly the same intensity as compared with that for the Pd sample, but the peak centered at 556°C reduced dramatically in intensity. Such results confirm that the methane molecules adsorbed on the Pd2.41Pt surface could easily be activated and react with the adsorbed oxygen species to produce CO2 and H2O, a result possibly due to the strong dissociation ability of methane molecules on the Pd–Pt alloys. The results of CO-TPR, O2-TPD, and CH4-TPD investigations reveal that the doping of Pt to Pd gave rise to the bimetallic Pd x Pt catalysts with decreased amounts of PdO species and stronger ability to active O2 or CH4, as compared with the pure Pd sample. Such a phenomenon might be due to the interaction between Pd and Pt, leading to the formation of a Pd–Pt alloy in Pd x Pt and PdO x and PtO x species on the surface of the Pd x Pt samples. Persson et al. [16] reported that the PdO amount in the sample did not influence the onset temperature of PdO decomposition, but only changed its peak intensity. Hence, the shift in temperature of CO reduction or O2 desorption observed over the Pd x Pt samples in the CO-TPR and O2-TPD profiles was attributed to the promotion effect of Pt doping to Pd, rather than due to the lower PdO amount. 3.5 Catalytic performance Fig. 9 A shows the methane conversion versus temperature over the as-prepared samples at a SV of 100,000mL/(gh). It is convenient to compare the catalytic activities of the samples using the reaction temperatures (T 50% and T 90%) requiring for achieving methane conversions of 50 and 90% (Fig. 9A and Table 2), respectively. Among all of the samples, the Pd2.41Pt sample showed the best catalytic activity: T 50% =303°C and T 90% =322°C, which were much lower than those over the monometallic Pd (T 50% =350°C and T 90% =368°C) and Pt (T 50% =372°C and T 90% =506°C) samples. Therefore, the catalytic activity decreased in the sequence of Pd2.41Pt>Pd0.99Pt>Pd0.43Pt>Pd8.52Pt>Pd>Pt. It should be noted that all of the Pd x Pt alloy samples outperformed the monometallic Pd or Pt sample, which was not in consistency with the results reported in the literature [15,16]. The excellent catalytic performance of the Pd x Pt alloy samples might be associated with the co-existence of Pd–Pt alloy and PdO–PtO2. We measured the methane conversions over the Pd2.41Pt sample when the temperature rose, dropped, and rose again (Fig. 9B), respectively. Methane conversions at 180–360°C during the temperature-dropping process were higher than those during the temperature-rising process. When the temperature rose again, however, methane conversions were rather similar to those during the temperature-dropping process. Comparing to the T 10%, T 50%, and T 90% (272, 303, and 322°C) over the Pd2.41Pt sample during the first temperature-rising process, the T 10%, T 50%, and T 90% decreased to 254, 283, and 306°C during the second temperature-rising process, respectively. Similar phenomena for methane combustion during the temperature-dropping and rising processes have been reported in the literature [4,32,44]. It is generally believed that Pd is easily oxidized into the PdO species at a certain temperature (<600°C). Therefore, the enhancement in catalytic activity of the Pd2.41Pt sample might be due to generation of a more amount of the PdO species during the reaction process, which was supported by the results (much higher surface Pd2+/Pd0 and Pt4+/Pt0 molar ratios were detected on the used Pd2.41Pt sample (Table 2)) of the XPS investigation. It is more accurate to use the turnover frequencies (TOFs) and specific reaction rates for evaluating the inherent catalytic activities of the samples. The TOFM (TOFM = XC 0/n M, where X is the conversion at a certain temperature, C 0 (mol/(g s)) is the initial methane concentration per gram per second, and n M (mol) is the molar amount of Pd, Pt or Pd+Pt) and specific reaction rates can be calculated according to the activity data and amounts of Pd and Pt in the Pd, Pt, and Pd x Pt samples, as summarized in Table 2. It is clearly observed that the Pd2.41Pt sample exhibited a relatively high TOFPd (0.85×10−3 s−1), the highest TOFPt (1.98×10−3 s−1), the highest TOFPd+Pt (0.59×10−3 s−1), and the highest specific reaction rate (4.46μmol/(gcat s)) in the combustion of methane at 280°C, a result possibly due to the interaction between Pd and Pt. Usually, it is more accurate to calculate the TOFs based on the surface atoms. However, it is well known that the surface element composition of a sample is not the same as its bulk element composition. Since the Pd/Pt molar ratios on the surface of the samples were not the same as those determined by the ICP–AES technique, it is hard to obtain the exact numbers of surface Pd and Pt atoms, which makes the calculation of the TOF values difficult. Actually, some researchers also used the total amount of the noble metal to calculate the TOF value. For example, Li et al. [45] calculated the TOFs of the PtSn/TS-1 catalysts for propane dehydrogenation according to the molar amount of Pt in the samples; Hutchings and coworkers also estimated the TOFs on the basis of the total metal loading [46–48]. Therefore, the TOFs calculated according to the molar amounts of noble metals could reflect the inherent catalytic performance of the noble metal samples. Fig. 10 shows the catalytic activities over the oxidized and reduced Pd2.41Pt samples for methane combustion. Obviously, methane combustion activity significantly decreased after the Pd2.41Pt sample was reduced in 10vol% H2–90vol% N2 (30mL/min) at 300°C, with the T 10%, T 50%, and T 90% increasing by 43, 42, and 46°C, respectively. The result demonstrates that the oxidized Pd2.41Pt (PdO–PtO2) sample in air (30mL/min) at 400°C was more active than the reduced Pd2.41Pt (metallic Pd0–Pt0) sample. Similar results have been reported by other researchers [2,49]. In addition, we measured the catalytic activities over the oxidized and reduced Pd2.41Pt samples after the “temperature rise-drop-rise” cycle, as shown in Fig. S4. The oxidized sample after the “temperature rise-drop-rise” cycle exhibited better activity than the fresh sample, but there was almost no change in activity over the reduced sample. This phenomenon could be explained by their XPS results. It is observed that the Pd/Pt molar ratio on the used Pd2.41Pt sample was close to that on the fresh Pd2.41Pt sample (Table 2), indicating no significant changes in Pd/Pt molar ratio on the surface of the fresh and used Pd2.41Pt samples. The concentrations of PdO and PtO2, however, increased after the “temperature rise-drop-rise” cycle, resulting in an increase in methane combustion activity. In the past decades, a number of works on methane combustion have been reported in the literature, and their catalytic activities (T 50% and T 90%) over the catalysts reported in the literature and the Pd2.41Pt catalyst reported in the present work are summarized in Table S1. Apparently, our Pd2.41Pt catalyst outperformed the 1.0wt% Pd/Al2O3 [50], 1.92wt% Pd/Co3O4 [51], 1.1wt% Pt/3DOM Ce0.6Zr0.3Y0.1O2 [52], 3.0wt% AuPd/3DOM La0.6Sr0.4MnO3 [53], 3.1wt% Pd–2.9wt% Pt/LaMnAl11O19 [54], 5wt% PdCo/Al2O3 [16], and 1.0wt% Co–1.0wt% Pd/Al2O3 [8] catalysts. 3.6 Effect of water vapor, CO2, and SO2 on catalytic activity Although the Pd-based catalysts are the most active materials for methane combustion [1,2,8,55], their activity stability is not good enough [11,16,55,56]. It has been reported that the supported monometallic Pt catalysts were less active than the supported monometallic Pd catalysts for methane combustion [57]. The partial substitution of Pd with Pt, however, could generate a catalyst that improve its catalytic stability for methane combustion [2,58]. Fig. 11 shows the catalytic activities versus on-stream methane combustion at 350°C over the Pd and Pt samples at SV=100,000mL/(gh) and over the Pd2.41Pt catalyst at SV=120,000mL/(gh). Apparently, the Pd2.41Pt sample exhibited the highest activity and no significant loss in activity during 40h of on-stream reaction, indicating that the Pd2.41Pt sample possessed good catalytic stability. The Pt sample displayed a stability similar to that of the Pd2.41Pt sample, the catalytic activity was much lower over the former than that over the latter. Methane conversion over the Pd sample, however, gradually decreased from 78 to 70% within 40h of on-stream methane combustion. We also recorded the TEM image of the used Pd2.41Pt sample after 40h of on-stream methane combustion, as shown in Fig. S5. Obviously, there were no significant changes in mesostructure of the fresh and used Pd2.41Pt samples. Therefore, the alloying of Pd with Pt could increase the catalytic activity and stability. The good stability of the Pd2.41Pt sample might be associated with the fact that Pt could improve the anti-sintering ability of Pd NPs [11,15]. H2O and CO2 are the products of methane combustion. It is necessary to examine the effects of H2O and CO2 on catalytic activity of the typical sample. We introduced 2.5 or 5.0vol% water vapor to the reaction system and monitored the methane conversions over the Pd2.41Pt sample at 310°C and SV=100,000mL/(gh). As shown in Fig. 12 A, methane conversion was not altered within 4h of methane combustion in the absence of H2O. In the presence of 2.5vol% water vapor, however, methane conversion first decreased slightly (ca. 5% loss in activity) and then recovered to its original value in the absence of H2O. By switching to 5.0vol% water vapor, the catalytic activity maintained almost unchanged. After cutting off the 5.0vol% water vapor, the catalytic activity was totally restored to that in the absence of water vapor. The results indicate that the Pd2.41Pt sample was catalytically stable in the presence of water vapor in a certain concentration below 5.0vol%. As the main active phase, PdO is readily to form the Pd(OH)2 species through the reaction of PdO+H2O→Pd(OH)2 in the presence of water vapor, where the Pd(OH)2 was usually regarded as an inactive phase [59]. The deactivation due to water of the Pd-based catalysts was related to the reaction temperature. Burch and coworkers [49,60] pointed out that the PdO/Al2O3 catalysts were irreversibly deactivated due to hydroxylation of PdO to inactive Pd(OH)2 particles in the presence of water at a lower temperature (e.g., 300°C), but their deactivation induced by water was insignificant at a higher temperature (e.g., 450°C). Therefore, the stability of the Pd2.41Pt sample for methane combustion under the wet conditions might be related to the interaction between Pd and Pt, which not only improved the catalytic activity, but also inhibited the formation of Pd(OH)2 [10–12,40]. In the case of 2.5 or 5.0vol% CO2 introduction to the reaction system over the Pd2.41Pt sample at 310°C and SV=100,000mL/(gh), one can clearly see that the catalytic activity was durable after 20h of methane combustion in the presence of 2.5 or 5.0vol% CO2 (Fig. 12B). Hence, CO2 had no significant negative effect on catalytic activity of the Pd2.41Pt sample for methane combustion. Similar results have been reported in the literature [60]. To examine the effect of SO2 on catalytic activity, we conducted methane combustion over the Pd2.41Pt sample at 310°C and SV=100,000mL/(gh). As shown in Fig. 13 A, methane conversion decreased from 90.0 to 31.1% after 10h of 100ppm SO2 introduction. When the SO2 was cut off, however, methane conversion slowly increased to 72.4%. This result indicates that deactivation of the Pd2.41Pt sample induced SO2 was partially reversible. To elucidate the reason for such a deactivation of the Pd2.41Pt sample, we carried out the in situ DRIFT experiments, and their spectra are shown in Fig. 13B. According to the literature [32,61,62], the absorption bands of the H2O, CO2, and SO3 2− or SO4 2− species were at 1640cm−1, at 2341 and 2360cm−1, and at 1159 and 1045cm−1, respectively. It can be clearly seen from Fig. 13B that in addition to the absorption bands due to H2O and CO2, there were no absorption bands assignable to the SO3 2− or SO4 2− species on the sample within 4h of methane combustion in the absence of SO2, but the absorption bands at 1159 and 1045cm−1 (assignable to the SO3 2− or SO4 2− species) were detected and their intensity was much higher after 10h of SO2 introduction than that after cutting off the SO2. This result reasonably explains the partially reversible deactivation of the Pd2.41Pt sample induced by SO2. The negative effect of SO2 addition on methane combustion might be due to the attack of SO2 on the PdO component in the oxidized Pd2.41Pt sample, which made highly active PdO transform into inactive PdSO3 or PdSO4. The SO2, however, would have little influence on the Pd–Pt alloy, thus the partially deactivated sample still showed a methane conversion of 31.1%. After cutting off the SO2, methane conversion was partially recovered (72.4%), a result possibly due to the decomposition of the weakly adsorbed SO2 species. Furthermore, we activated the 100ppm SO2-treated Pd2.41Pt sample in a N2 flow of 30mL/min at 500°C for 1h, and measured its catalytic activity for methane combustion. As shown in Fig. S6, methane conversions at 310°C over the activated Pd2.41Pt sample were almost recovered to the original values over the fresh Pd2.41Pt sample, and the catalytic activity was stable within 8h of methane combustion. 4 Conclusions The mesoporous Pd, Pt, and Pd x Pt alloys could be prepared via the KIT-6-templating route. The mesoporous samples displayed a surface area of 25.5–31.9m2/g and an average pore size of 13.7–19.8nm. An Pd–Pt alloy was formed in each of the Pd x Pt samples. The addition of Pt to Pd exerted a significant effect on the redox property of the Pd sample. The PdO–PtO2 were more active than the Pd0–Pt0. Among all of the samples, the Pd2.41Pt sample showed the highest catalytic performance for methane combustion (at SV=100,000mL/(gh), T 10% =272°C, T 50% =303°C, and T 90% =322°C; at 280°C, TOFPd =0.85×10−3 s−1, TOFPt =1.98×10−3 s−1, TOFPd+Pt =0.59×10−3 s−1, and specific reaction rate=4.46μmol/(gcat s)). The deactivation of the Pd2.41Pt sample induced by 2.5–5.0vol% CO2 or H2O addition was reversible, but its deactivation due to 100ppm SO2 introduction was irreversible. It is concluded that the good mesoporous structure, Pd–Pt alloy and PdO–PtO2 coexistence, and good methane and oxygen activation ability were responsible for the excellent catalytic performance of the Pd2.41Pt sample. Acknowledgments This work was supported by the NSF of China (21377008 and 21677004) and National High Technology Research and Development Program (“863” Program) of China (2015AA034603). Appendix A Supplementary data Supplementary data associated with this article can be found, in the online version, at http://dx.doi.org/10.1016/j.mcat.2017.09.002. Appendix A Supplementary data The following are Supplementary data to this article: References [1] J. Xu L. Ouyang W. Mao X.J. Yang X.C. Xu J.J. Su T.Z. Zhuang H. Li Y.F. Han ACS Catal. 2 2012 261 269 [2] P. Gélin M. Primet Appl. Catal. B 39 2002 1 37 [3] N.M. Kinnunen J.T. Hirvi T. Venäläinen M. Suvanto T.A. Pakkanen Appl. Catal. A 397 2011 54 61 [4] M. Cargnello J.J. Delgado Jaén J.C. Hernández Garrido K. Bakhmutsky T. Montini J.J. Calvino Gámez R.J. Gorte P. Fornasiero Science 337 2012 713 717 [5] N. Sadokhina G. Smedler U. Nylén M. Olofsson L. Olsson Appl. Catal. B 200 2017 351 360 [6] J. Nilsson P. Carlsson S. Fouladvand N.M. Martin J. Gustafson M.A. Newton E. Lundgren H. Gronbeck M. Sköglundh ACS Catal. 5 2015 2481 2489 [7] D.N. Gao C.X. Zhang S. Wang Z.S. Yuan S.D. Wang Catal. Commun. 9 2008 2583 2587 [8] K. Persson A. Ersson K. Jansson N. Iverlund S.G. Järås J. Catal. 231 2005 139 150 [9] R. Burch P.K. Loader Appl. Catal. B 1–2 1994 149 164 [10] H. Yamamoto H. Uchida Catal. Today 45 1998 147 151 [11] K. Narui H. Yata K. Furuta A. Nishida Y. Kohtoku T. Matsuzaki Appl. Catal. A 179 1999 165 173 [12] N.M. Kinnunen J.T. Hirvi M. Suvanto T.A. Pakkanen J. Mol. Catal. A 356 2012 20 28 [13] P. Castellazzi G. Groppi P. Forzatti Appl. Catal. B 95 2010 303 311 [14] G. Corro C. Cano J.L.G. Fierro J. Mol. Catal. A 315 2010 35 42 [15] R. Strobel J. Grunwaldt A. Camenzind S.E. Pratsinis A. Baiker Catal. Lett. 104 2005 9 16 [16] K. Persson A. Ersson K. Jansson J.L.G. Fierro S.G. Järås J. Catal. 243 2006 14 24 [17] J.T. Zhang C.M. Li Chem. Soc. Rev. 41 2012 7016 7031 [18] C.Z. Zhu D. Du A. Eychmüller Y.H. Lin Chem. Rev. 115 2015 8896 8943 [19] X.F. Zhang P.F. Guan L. Malic M. Trudeau F. Rosei T. Veres J. Mater. Chem. A 3 2015 2050 2056 [20] Y. Wang N. Su L. Ye Y.H. Ren X.Y. Chen Y.J. Du Z.H. Li B. Yue S.C.E. Tsang Q. Chen H.Y. He J. Catal. 313 2014 113 126 [21] H.J. Wang H.Y. Jeong M. Imura L. Wang L. Radhakrishnan N. Fujita T. Castle O. Terasaki Y. Yamauchi J. Am. Chem. Soc. 133 2011 14526 14529 [22] C.X. Xu X.H. Xu J.X. Su Y. Ding J. Catal. 252 2007 243 248 [23] A. Saramat P. Thormählen M. Skoglundh G.S. Attard A.E.C. Palmqvist J. Catal. 253 2008 253 260 [24] H.M. Duan C.X. Xu J. Catal. 332 2015 31 37 [25] F. Kleitz S.H. Choi R. Ryoo Chem. Commun. 2003 2136 2137 [26] C.X. Xu Q. Hao H.M. Duan J. Mater. Chem. A 2 2014 8875 8880 [27] C.Z. Zhu Q.R. Shi S.F. Fu J.H. Song H.B. Xia D. Du Y.H. Lin Adv. Mater. 28 2016 8779 8783 [28] S.A. Yashnik Y.A. Chesalov A.V. Ishchenko V.V. Kaichev Z.R. Ismagilov Appl. Catal. B 204 2017 89 106 [29] K.R. Priolkar P. Bera P.R. Sarode M.S. Hegde S. Emura R. Kumashiro N.P. Lalla Chem. Mater. 14 2002 2120 2128 [30] S.H. Xie J.G. Deng S.M. Zang H.G. Yang G.S. Guo H. Arandiyan H.X. Dai J. Catal. 322 2015 38 48 [31] M. Brun A. Berthet J.C. Bertolini J. Electron Spectrosc. 104 1999 55 60 [32] S.H. Xie J.G. Deng S.M. Zang Z.H. Zhang H. Arandiyan H.X. Dai Environ. Sci. Technol. 51 2017 2271 2279 [33] P. Bera K.C. Patil V. Jayaram G.N. Subbanna M.S. Hegde J. Catal. 196 2000 293 301 [34] M.Y. Mao H.Q. Lv Y.Z. Li Y. Yang M. Zeng N. Li X.J. Zhao ACS Catal. 6 2016 418 427 [35] H. Arandiyan H.X. Dai K.M. Ji H.Y. Sun J.H. Li ACS Catal. 5 2015 1781 1793 [36] J. Xu L. Ouyang G.J. Da Q.Q. Song X.J. Yang Y.F. Han J. Catal. 285 2012 74 82 [37] A. Morlang U. Neuhausen K.V. Klementiev Appl. Catal. B 60 2005 191 199 [38] N.M. Martin J. Nilsson M. Skoglundh E.C. Adams X. Wang P. Velin G. Smedler A. Raj D. Thompsett H.H. Brongersma T. Grehl G. Agostini O. Mathon S. Carlson K. Nore F.J. Martinezcasado Z. Matej O. Balmes P. Carlsson J. Phys. Chem. C 120 2016 28009 28020 [39] M. Haneda K. Suzuki M. Sasaki H. Hamada M. Ozawa Appl. Catal. A 475 2014 109 115 [40] G. Lapisardi L. Urfels P. Gélin M. Primet A. Kaddouri E. Garbowski S. Toppi E. Tena Catal. Today 117 2006 564 568 [41] S. Bedrane C. Descorme D. Duprez Appl. Catal. A 289 2005 90 96 [42] J.R. Paredes E. Díaz F.V. Díez S. Ordóñez Energy Fuel 23 2009 86 93 [43] R. Burch D.J. Crittle M.J. Hayes Catal. Today 47 1999 229 234 [44] C. Chen Y.H. Yeh M. Cargnello C.B. Murray P. Fornasiero R.J. Gorte ACS Catal. 4 2014 3902 3909 [45] J.C. Li J.M. Li Z. Zhao X.Q. Fan J. Liu Y.C. Wei A.J. Duan Z.A. Xie Q.L. Liu J. Catal. 352 2017 361 370 [46] L. Kesavan R. Tiruvalam M.H.A. Rahim M.I.B. Saiman D.I. Enache R.L. Jenkins N. Dimitratos J.A. Lopez-Sanchez S.H. Taylor D.W. Knight C.J. Kiely G.J. Hutchings Science 331 2011 195 199 [47] M.I.B. Saiman G.L. Brett R. Tiruvalam M.M. Forde K. Sharples A. Thetford R.L. Jenkins N. Dimitratos J.A. Lopez-Sanchez D.M. Murphy D. Bethell D.J. Willock S.H. Taylor D.W. Knight C.J. Kiely G.J. Hutchings Angew. Chem. Int. Ed. 51 2012 5981 5985 [48] G.T. Whiting S.A. Kondrat C. Hammond N. Dimitratos Q. He D.J. Morgan N.F. Dummer J.K. Bartley C.J. Kiely S.H. Taylor G.J. Hutchings ACS Catal. 5 2015 637 644 [49] R. Burch F.J. Urbano Appl. Catal. A 124 1995 121 138 [50] W.R. Schwartz D. Ciuparu L.D. Pfefferle J. Phys. Chem. C 116 2012 8587 8593 [51] M.T. Makhlouf B.M. Abu-Zied T.H. Mansoure J. Nanopart. 2013 2013 384350 [52] H. Arandiyan H.X. Dai K.M. Ji H.Y. Sun J.H. Li ACS Catal. 5 2015 1781 1793 [53] K. Sasaki O. Tanaike H. Konno Can Miner. 36 1998 1225 1235 [54] Y. Wang H. Arandiyan J. Scott M. Akia H.X. Dai J.G. Deng K. Aguey-Zinsou R. Amal ACS Catal. 6 2016 6935 6947 [55] A. Ersson H. Kušar R. Carroni T. Griffin S. Järås Catal. Today 83 2003 265 277 [56] K. Persson K. Jansson S.G. Järås J. Catal. 245 2007 401 414 [57] M. Lyubovsky L.L. Smith M. Castaldi H. Karim B. Nentwick S. Etemad R. LaPierre W.C. Pfefferle Catal. Today 83 2003 71 84 [58] Y. Ozawa Y. Tochihara A. Watanabe M. Nagai S. Omi Appl. Catal. A 259 2004 1 7 [59] W.R. Schwartz L.D. Pfefferle J. Phys. Chem. C 116 2012 8571 8578 [60] R. Burch F.J. Urbano P.K. Loader Appl. Catal. A 123 1995 173 184 [61] W.R. Schwartz D. Ciuparu L.D. Pfefferle J. Phys. Chem. C 116 2012 8587 8593 [62] Z.X. Wu J.G. Deng Y.X. Liu S.H. Xie Y. Jiang X.T. Zhao J. Yang H. Arandiyan G.S. Guo H.X. Dai J. Catal. 332 2015 13 24",
      "scopus-id": "85031995045",
      "coredata": {
        "eid": "1-s2.0-S2468823117304807",
        "dc:description": "Mesoporous cubic Pd x Pt (x =0.43–8.52) alloys with surface areas of 26–32m2/g were synthesized using the KIT-6-templating method. Physicochemical properties of the materials were characterized by means of various techniques, and their catalytic activities were evaluated for methane combustion. It is found that the Pd and Pt were uniformly distributed in the Pd x Pt alloys. The addition of Pt to Pd exerted a significant effect on the redox property of Pd. The Pd x Pt alloys possessed a higher methane activation ability than the monometallic Pd. The oxidized Pd–Pt (i.e., PdO–PtO2) were more active than the metallic Pd0–Pt0. The Pd2.41Pt sample performed the best for methane combustion (T 10%, T 50%, and T 90% were 272, 303, and 322°C at SV=100,000mL/(gh); TOFPd, TOFPt, TOFPd+Pt, and specific reaction rate at 280°C were 0.85×10−3 s−1, 1.98×10−3 s−1, 0.59×10−3 s−1, and 4.46μmol/(gcat s), respectively). The deactivation of the Pd2.41Pt sample induced by 2.5–5.0vol% CO2 or H2O addition was reversible, but its deactivation due to 100ppm SO2 introduction was irreversible. It is concluded that the excellent catalytic performance of the Pd2.41Pt sample was associated with its good mesoporous structure, Pd–Pt alloy and PdO–PtO2 coexistence, and good methane and oxygen activation ability.",
        "openArchiveArticle": "false",
        "prism:coverDate": "2017-12-31",
        "openaccessUserLicense": null,
        "prism:aggregationType": "Journal",
        "prism:url": "https://api.elsevier.com/content/article/pii/S2468823117304807",
        "dc:creator": [
          {
            "@_fa": "true",
            "$": "Zhao, Xingtian"
          },
          {
            "@_fa": "true",
            "$": "Liu, Yuxi"
          },
          {
            "@_fa": "true",
            "$": "Deng, Jiguang"
          },
          {
            "@_fa": "true",
            "$": "Xu, Peng"
          },
          {
            "@_fa": "true",
            "$": "Yang, Jun"
          },
          {
            "@_fa": "true",
            "$": "Zhang, Kunfeng"
          },
          {
            "@_fa": "true",
            "$": "Han, Zhuo"
          },
          {
            "@_fa": "true",
            "$": "Dai, Hongxing"
          }
        ],
        "link": [
          {
            "@_fa": "true",
            "@rel": "self",
            "@href": "https://api.elsevier.com/content/article/pii/S2468823117304807"
          },
          {
            "@_fa": "true",
            "@rel": "scidir",
            "@href": "https://www.sciencedirect.com/science/article/pii/S2468823117304807"
          }
        ],
        "dc:format": "application/json",
        "openaccessType": null,
        "pii": "S2468-8231(17)30480-7",
        "prism:volume": "442",
        "prism:publisher": "Elsevier B.V.",
        "dc:title": "Mesoporous Pd x Pt alloys: High-performance catalysts for methane combustion",
        "prism:copyright": "© 2017 Elsevier B.V. All rights reserved.",
        "openaccess": "0",
        "prism:issn": "24688231",
        "dcterms:subject": [
          {
            "@_fa": "true",
            "$": "Mesoporous Pd–Pt alloy"
          },
          {
            "@_fa": "true",
            "$": "PdO–PtO2 active site"
          },
          {
            "@_fa": "true",
            "$": "Redox property"
          },
          {
            "@_fa": "true",
            "$": "Methane combustion"
          },
          {
            "@_fa": "true",
            "$": "Methane activation ability"
          }
        ],
        "openaccessArticle": "false",
        "prism:publicationName": "Molecular Catalysis",
        "openaccessSponsorType": null,
        "prism:pageRange": "191-201",
        "prism:endingPage": "201",
        "pubType": "fla",
        "prism:coverDisplayDate": "December 2017",
        "prism:doi": "10.1016/j.mcat.2017.09.002",
        "prism:startingPage": "191",
        "dc:identifier": "doi:10.1016/j.mcat.2017.09.002",
        "openaccessSponsorName": null
      },
      "objects": {
        "object": [
          {
            "@category": "thumbnail",
            "@height": "164",
            "@width": "201",
            "@_fa": "true",
            "$": "https://api.elsevier.com/content/object/eid/1-s2.0-S2468823117304807-fx1.sml?httpAccept=%2A%2F%2A",
            "@multimediatype": "GIF image file",
            "@type": "IMAGE-THUMBNAIL",
            "@size": "11556",
            "@ref": "fx1",
            "@mimetype": "image/gif"
          },
          {
            "@category": "thumbnail",
            "@height": "164",
            "@width": "201",
            "@_fa": "true",
            "$": "https://api.elsevier.com/content/object/eid/1-s2.0-S2468823117304807-fx2.sml?httpAccept=%2A%2F%2A",
            "@multimediatype": "GIF image file",
            "@type": "IMAGE-THUMBNAIL",
            "@size": "12360",
            "@ref": "fx2",
            "@mimetype": "image/gif"
          },
          {
            "@category": "thumbnail",
            "@height": "164",
            "@width": "201",
            "@_fa": "true",
            "$": "https://api.elsevier.com/content/object/eid/1-s2.0-S2468823117304807-fx3.sml?httpAccept=%2A%2F%2A",
            "@multimediatype": "GIF image file",
            "@type": "IMAGE-THUMBNAIL",
            "@size": "13033",
            "@ref": "fx3",
            "@mimetype": "image/gif"
          },
          {
            "@category": "thumbnail",
            "@height": "164",
            "@width": "201",
            "@_fa": "true",
            "$": "https://api.elsevier.com/content/object/eid/1-s2.0-S2468823117304807-fx4.sml?httpAccept=%2A%2F%2A",
            "@multimediatype": "GIF image file",
            "@type": "IMAGE-THUMBNAIL",
            "@size": "15207",
            "@ref": "fx4",
            "@mimetype": "image/gif"
          },
          {
            "@category": "thumbnail",
            "@height": "164",
            "@width": "201",
            "@_fa": "true",
            "$": "https://api.elsevier.com/content/object/eid/1-s2.0-S2468823117304807-fx5.sml?httpAccept=%2A%2F%2A",
            "@multimediatype": "GIF image file",
            "@type": "IMAGE-THUMBNAIL",
            "@size": "12692",
            "@ref": "fx5",
            "@mimetype": "image/gif"
          },
          {
            "@category": "thumbnail",
            "@height": "164",
            "@width": "201",
            "@_fa": "true",
            "$": "https://api.elsevier.com/content/object/eid/1-s2.0-S2468823117304807-fx6.sml?httpAccept=%2A%2F%2A",
            "@multimediatype": "GIF image file",
            "@type": "IMAGE-THUMBNAIL",
            "@size": "9517",
            "@ref": "fx6",
            "@mimetype": "image/gif"
          },
          {
            "@category": "thumbnail",
            "@height": "164",
            "@width": "201",
            "@_fa": "true",
            "$": "https://api.elsevier.com/content/object/eid/1-s2.0-S2468823117304807-fx7.sml?httpAccept=%2A%2F%2A",
            "@multimediatype": "GIF image file",
            "@type": "IMAGE-THUMBNAIL",
            "@size": "13812",
            "@ref": "fx7",
            "@mimetype": "image/gif"
          },
          {
            "@category": "thumbnail",
            "@height": "164",
            "@width": "201",
            "@_fa": "true",
            "$": "https://api.elsevier.com/content/object/eid/1-s2.0-S2468823117304807-fx8.sml?httpAccept=%2A%2F%2A",
            "@multimediatype": "GIF image file",
            "@type": "IMAGE-THUMBNAIL",
            "@size": "11997",
            "@ref": "fx8",
            "@mimetype": "image/gif"
          },
          {
            "@category": "thumbnail",
            "@height": "164",
            "@width": "166",
            "@_fa": "true",
            "$": "https://api.elsevier.com/content/object/eid/1-s2.0-S2468823117304807-gr1.sml?httpAccept=%2A%2F%2A",
            "@multimediatype": "GIF image file",
            "@type": "IMAGE-THUMBNAIL",
            "@size": "6383",
            "@ref": "gr1",
            "@mimetype": "image/gif"
          },
          {
            "@category": "thumbnail",
            "@height": "164",
            "@width": "182",
            "@_fa": "true",
            "$": "https://api.elsevier.com/content/object/eid/1-s2.0-S2468823117304807-gr10.sml?httpAccept=%2A%2F%2A",
            "@multimediatype": "GIF image file",
            "@type": "IMAGE-THUMBNAIL",
            "@size": "5055",
            "@ref": "gr10",
            "@mimetype": "image/gif"
          },
          {
            "@category": "thumbnail",
            "@height": "164",
            "@width": "185",
            "@_fa": "true",
            "$": "https://api.elsevier.com/content/object/eid/1-s2.0-S2468823117304807-gr11.sml?httpAccept=%2A%2F%2A",
            "@multimediatype": "GIF image file",
            "@type": "IMAGE-THUMBNAIL",
            "@size": "8149",
            "@ref": "gr11",
            "@mimetype": "image/gif"
          },
          {
            "@category": "thumbnail",
            "@height": "93",
            "@width": "219",
            "@_fa": "true",
            "$": "https://api.elsevier.com/content/object/eid/1-s2.0-S2468823117304807-gr12.sml?httpAccept=%2A%2F%2A",
            "@multimediatype": "GIF image file",
            "@type": "IMAGE-THUMBNAIL",
            "@size": "4946",
            "@ref": "gr12",
            "@mimetype": "image/gif"
          },
          {
            "@category": "thumbnail",
            "@height": "95",
            "@width": "219",
            "@_fa": "true",
            "$": "https://api.elsevier.com/content/object/eid/1-s2.0-S2468823117304807-gr13.sml?httpAccept=%2A%2F%2A",
            "@multimediatype": "GIF image file",
            "@type": "IMAGE-THUMBNAIL",
            "@size": "5018",
            "@ref": "gr13",
            "@mimetype": "image/gif"
          },
          {
            "@category": "thumbnail",
            "@height": "146",
            "@width": "219",
            "@_fa": "true",
            "$": "https://api.elsevier.com/content/object/eid/1-s2.0-S2468823117304807-gr2.sml?httpAccept=%2A%2F%2A",
            "@multimediatype": "GIF image file",
            "@type": "IMAGE-THUMBNAIL",
            "@size": "24162",
            "@ref": "gr2",
            "@mimetype": "image/gif"
          },
          {
            "@category": "thumbnail",
            "@height": "111",
            "@width": "219",
            "@_fa": "true",
            "$": "https://api.elsevier.com/content/object/eid/1-s2.0-S2468823117304807-gr3.sml?httpAccept=%2A%2F%2A",
            "@multimediatype": "GIF image file",
            "@type": "IMAGE-THUMBNAIL",
            "@size": "18463",
            "@ref": "gr3",
            "@mimetype": "image/gif"
          },
          {
            "@category": "thumbnail",
            "@height": "116",
            "@width": "219",
            "@_fa": "true",
            "$": "https://api.elsevier.com/content/object/eid/1-s2.0-S2468823117304807-gr4.sml?httpAccept=%2A%2F%2A",
            "@multimediatype": "GIF image file",
            "@type": "IMAGE-THUMBNAIL",
            "@size": "8149",
            "@ref": "gr4",
            "@mimetype": "image/gif"
          },
          {
            "@category": "thumbnail",
            "@height": "114",
            "@width": "219",
            "@_fa": "true",
            "$": "https://api.elsevier.com/content/object/eid/1-s2.0-S2468823117304807-gr5.sml?httpAccept=%2A%2F%2A",
            "@multimediatype": "GIF image file",
            "@type": "IMAGE-THUMBNAIL",
            "@size": "9028",
            "@ref": "gr5",
            "@mimetype": "image/gif"
          },
          {
            "@category": "thumbnail",
            "@height": "164",
            "@width": "125",
            "@_fa": "true",
            "$": "https://api.elsevier.com/content/object/eid/1-s2.0-S2468823117304807-gr6.sml?httpAccept=%2A%2F%2A",
            "@multimediatype": "GIF image file",
            "@type": "IMAGE-THUMBNAIL",
            "@size": "5090",
            "@ref": "gr6",
            "@mimetype": "image/gif"
          },
          {
            "@category": "thumbnail",
            "@height": "164",
            "@width": "147",
            "@_fa": "true",
            "$": "https://api.elsevier.com/content/object/eid/1-s2.0-S2468823117304807-gr7.sml?httpAccept=%2A%2F%2A",
            "@multimediatype": "GIF image file",
            "@type": "IMAGE-THUMBNAIL",
            "@size": "5079",
            "@ref": "gr7",
            "@mimetype": "image/gif"
          },
          {
            "@category": "thumbnail",
            "@height": "164",
            "@width": "153",
            "@_fa": "true",
            "$": "https://api.elsevier.com/content/object/eid/1-s2.0-S2468823117304807-gr8.sml?httpAccept=%2A%2F%2A",
            "@multimediatype": "GIF image file",
            "@type": "IMAGE-THUMBNAIL",
            "@size": "6097",
            "@ref": "gr8",
            "@mimetype": "image/gif"
          },
          {
            "@category": "thumbnail",
            "@height": "99",
            "@width": "219",
            "@_fa": "true",
            "$": "https://api.elsevier.com/content/object/eid/1-s2.0-S2468823117304807-gr9.sml?httpAccept=%2A%2F%2A",
            "@multimediatype": "GIF image file",
            "@type": "IMAGE-THUMBNAIL",
            "@size": "6500",
            "@ref": "gr9",
            "@mimetype": "image/gif"
          },
          {
            "@category": "standard",
            "@height": "245",
            "@width": "301",
            "@_fa": "true",
            "$": "https://api.elsevier.com/content/object/eid/1-s2.0-S2468823117304807-fx1.jpg?httpAccept=%2A%2F%2A",
            "@multimediatype": "JPEG image file",
            "@type": "IMAGE-DOWNSAMPLED",
            "@size": "28228",
            "@ref": "fx1",
            "@mimetype": "image/jpeg"
          },
          {
            "@category": "standard",
            "@height": "245",
            "@width": "301",
            "@_fa": "true",
            "$": "https://api.elsevier.com/content/object/eid/1-s2.0-S2468823117304807-fx2.jpg?httpAccept=%2A%2F%2A",
            "@multimediatype": "JPEG image file",
            "@type": "IMAGE-DOWNSAMPLED",
            "@size": "9062",
            "@ref": "fx2",
            "@mimetype": "image/jpeg"
          },
          {
            "@category": "standard",
            "@height": "245",
            "@width": "301",
            "@_fa": "true",
            "$": "https://api.elsevier.com/content/object/eid/1-s2.0-S2468823117304807-fx3.jpg?httpAccept=%2A%2F%2A",
            "@multimediatype": "JPEG image file",
            "@type": "IMAGE-DOWNSAMPLED",
            "@size": "7883",
            "@ref": "fx3",
            "@mimetype": "image/jpeg"
          },
          {
            "@category": "standard",
            "@height": "245",
            "@width": "301",
            "@_fa": "true",
            "$": "https://api.elsevier.com/content/object/eid/1-s2.0-S2468823117304807-fx4.jpg?httpAccept=%2A%2F%2A",
            "@multimediatype": "JPEG image file",
            "@type": "IMAGE-DOWNSAMPLED",
            "@size": "9260",
            "@ref": "fx4",
            "@mimetype": "image/jpeg"
          },
          {
            "@category": "standard",
            "@height": "245",
            "@width": "301",
            "@_fa": "true",
            "$": "https://api.elsevier.com/content/object/eid/1-s2.0-S2468823117304807-fx5.jpg?httpAccept=%2A%2F%2A",
            "@multimediatype": "JPEG image file",
            "@type": "IMAGE-DOWNSAMPLED",
            "@size": "9158",
            "@ref": "fx5",
            "@mimetype": "image/jpeg"
          },
          {
            "@category": "standard",
            "@height": "245",
            "@width": "301",
            "@_fa": "true",
            "$": "https://api.elsevier.com/content/object/eid/1-s2.0-S2468823117304807-fx6.jpg?httpAccept=%2A%2F%2A",
            "@multimediatype": "JPEG image file",
            "@type": "IMAGE-DOWNSAMPLED",
            "@size": "6658",
            "@ref": "fx6",
            "@mimetype": "image/jpeg"
          },
          {
            "@category": "standard",
            "@height": "245",
            "@width": "301",
            "@_fa": "true",
            "$": "https://api.elsevier.com/content/object/eid/1-s2.0-S2468823117304807-fx7.jpg?httpAccept=%2A%2F%2A",
            "@multimediatype": "JPEG image file",
            "@type": "IMAGE-DOWNSAMPLED",
            "@size": "9087",
            "@ref": "fx7",
            "@mimetype": "image/jpeg"
          },
          {
            "@category": "standard",
            "@height": "245",
            "@width": "301",
            "@_fa": "true",
            "$": "https://api.elsevier.com/content/object/eid/1-s2.0-S2468823117304807-fx8.jpg?httpAccept=%2A%2F%2A",
            "@multimediatype": "JPEG image file",
            "@type": "IMAGE-DOWNSAMPLED",
            "@size": "9777",
            "@ref": "fx8",
            "@mimetype": "image/jpeg"
          },
          {
            "@category": "standard",
            "@height": "371",
            "@width": "376",
            "@_fa": "true",
            "$": "https://api.elsevier.com/content/object/eid/1-s2.0-S2468823117304807-gr1.jpg?httpAccept=%2A%2F%2A",
            "@multimediatype": "JPEG image file",
            "@type": "IMAGE-DOWNSAMPLED",
            "@size": "31509",
            "@ref": "gr1",
            "@mimetype": "image/jpeg"
          },
          {
            "@category": "standard",
            "@height": "339",
            "@width": "376",
            "@_fa": "true",
            "$": "https://api.elsevier.com/content/object/eid/1-s2.0-S2468823117304807-gr10.jpg?httpAccept=%2A%2F%2A",
            "@multimediatype": "JPEG image file",
            "@type": "IMAGE-DOWNSAMPLED",
            "@size": "22815",
            "@ref": "gr10",
            "@mimetype": "image/jpeg"
          },
          {
            "@category": "standard",
            "@height": "334",
            "@width": "376",
            "@_fa": "true",
            "$": "https://api.elsevier.com/content/object/eid/1-s2.0-S2468823117304807-gr11.jpg?httpAccept=%2A%2F%2A",
            "@multimediatype": "JPEG image file",
            "@type": "IMAGE-DOWNSAMPLED",
            "@size": "37786",
            "@ref": "gr11",
            "@mimetype": "image/jpeg"
          },
          {
            "@category": "standard",
            "@height": "256",
            "@width": "602",
            "@_fa": "true",
            "$": "https://api.elsevier.com/content/object/eid/1-s2.0-S2468823117304807-gr12.jpg?httpAccept=%2A%2F%2A",
            "@multimediatype": "JPEG image file",
            "@type": "IMAGE-DOWNSAMPLED",
            "@size": "35474",
            "@ref": "gr12",
            "@mimetype": "image/jpeg"
          },
          {
            "@category": "standard",
            "@height": "262",
            "@width": "602",
            "@_fa": "true",
            "$": "https://api.elsevier.com/content/object/eid/1-s2.0-S2468823117304807-gr13.jpg?httpAccept=%2A%2F%2A",
            "@multimediatype": "JPEG image file",
            "@type": "IMAGE-DOWNSAMPLED",
            "@size": "35798",
            "@ref": "gr13",
            "@mimetype": "image/jpeg"
          },
          {
            "@category": "standard",
            "@height": "439",
            "@width": "659",
            "@_fa": "true",
            "$": "https://api.elsevier.com/content/object/eid/1-s2.0-S2468823117304807-gr2.jpg?httpAccept=%2A%2F%2A",
            "@multimediatype": "JPEG image file",
            "@type": "IMAGE-DOWNSAMPLED",
            "@size": "111673",
            "@ref": "gr2",
            "@mimetype": "image/jpeg"
          },
          {
            "@category": "standard",
            "@height": "361",
            "@width": "715",
            "@_fa": "true",
            "$": "https://api.elsevier.com/content/object/eid/1-s2.0-S2468823117304807-gr3.jpg?httpAccept=%2A%2F%2A",
            "@multimediatype": "JPEG image file",
            "@type": "IMAGE-DOWNSAMPLED",
            "@size": "104310",
            "@ref": "gr3",
            "@mimetype": "image/jpeg"
          },
          {
            "@category": "standard",
            "@height": "320",
            "@width": "602",
            "@_fa": "true",
            "$": "https://api.elsevier.com/content/object/eid/1-s2.0-S2468823117304807-gr4.jpg?httpAccept=%2A%2F%2A",
            "@multimediatype": "JPEG image file",
            "@type": "IMAGE-DOWNSAMPLED",
            "@size": "58397",
            "@ref": "gr4",
            "@mimetype": "image/jpeg"
          },
          {
            "@category": "standard",
            "@height": "314",
            "@width": "602",
            "@_fa": "true",
            "$": "https://api.elsevier.com/content/object/eid/1-s2.0-S2468823117304807-gr5.jpg?httpAccept=%2A%2F%2A",
            "@multimediatype": "JPEG image file",
            "@type": "IMAGE-DOWNSAMPLED",
            "@size": "59298",
            "@ref": "gr5",
            "@mimetype": "image/jpeg"
          },
          {
            "@category": "standard",
            "@height": "492",
            "@width": "376",
            "@_fa": "true",
            "$": "https://api.elsevier.com/content/object/eid/1-s2.0-S2468823117304807-gr6.jpg?httpAccept=%2A%2F%2A",
            "@multimediatype": "JPEG image file",
            "@type": "IMAGE-DOWNSAMPLED",
            "@size": "36827",
            "@ref": "gr6",
            "@mimetype": "image/jpeg"
          },
          {
            "@category": "standard",
            "@height": "419",
            "@width": "376",
            "@_fa": "true",
            "$": "https://api.elsevier.com/content/object/eid/1-s2.0-S2468823117304807-gr7.jpg?httpAccept=%2A%2F%2A",
            "@multimediatype": "JPEG image file",
            "@type": "IMAGE-DOWNSAMPLED",
            "@size": "31349",
            "@ref": "gr7",
            "@mimetype": "image/jpeg"
          },
          {
            "@category": "standard",
            "@height": "404",
            "@width": "376",
            "@_fa": "true",
            "$": "https://api.elsevier.com/content/object/eid/1-s2.0-S2468823117304807-gr8.jpg?httpAccept=%2A%2F%2A",
            "@multimediatype": "JPEG image file",
            "@type": "IMAGE-DOWNSAMPLED",
            "@size": "36203",
            "@ref": "gr8",
            "@mimetype": "image/jpeg"
          },
          {
            "@category": "standard",
            "@height": "271",
            "@width": "602",
            "@_fa": "true",
            "$": "https://api.elsevier.com/content/object/eid/1-s2.0-S2468823117304807-gr9.jpg?httpAccept=%2A%2F%2A",
            "@multimediatype": "JPEG image file",
            "@type": "IMAGE-DOWNSAMPLED",
            "@size": "40432",
            "@ref": "gr9",
            "@mimetype": "image/jpeg"
          },
          {
            "@category": "standard",
            "@_fa": "true",
            "$": "https://api.elsevier.com/content/object/eid/1-s2.0-S2468823117304807-mmc1.doc?httpAccept=%2A%2F%2A",
            "@multimediatype": "Microsoft Word file",
            "@type": "APPLICATION",
            "@size": "2298368",
            "@ref": "mmc1",
            "@mimetype": "application/word"
          }
        ]
      },
      "link": {
        "@rel": "abstract",
        "@href": "https://api.elsevier.com/content/abstract/scopus_id/85031995045"
      }
    }
  }
}