{
  "metadata": {
    "title": "TiO<ce:inf loc=post>2</ce:inf> supported siderite catalyst integrated with catalytic ceramic filter tube for selective catalytic reduction of NO<ce:inf loc=post>x</ce:inf> with NH<ce:inf loc=post>3</ce:inf>",
    "authors": "; ; ",
    "journal": "Molecular Catalysis",
    "date": "2025-02-15",
    "doi": "10.1016/j.mcat.2025.114817",
    "abstract": "",
    "uri": "https://api.elsevier.com/content/article/pii/S2468823125000033",
    "pii": "S2468823125000033"
  },
  "fulltext": {
    "full-text-retrieval-response": {
      "scopus-eid": "2-s2.0-85214023984",
      "originalText": "serial JL 315758 291210 291744 291790 291809 31 Molecular Catalysis MOLECULARCATALYSIS 2025-01-06 2025-01-06 2025-01-06 2025-01-06 2025-01-25T11:56:29 1-s2.0-S2468823125000033 S2468-8231(25)00003-3 S2468823125000033 10.1016/j.mcat.2025.114817 S300 S300.1 FULL-TEXT 1-s2.0-S2468823124X0019X 2025-02-23T23:28:17.584625Z 0 0 20250215 2025 2025-01-06T20:52:34.528529Z absattachment articleinfo articlenumber articletitlenorm authfirstinitialnorm authfirstsurnamenorm cid cids contenttype copyright crossmark dateloaded dateloadedtxt datesearch datesort dateupdated dco docsubtype doctype doi eid ewtransactionid hubeid indexeddate issn issnnorm itemstage itemtransactionid itemweight openaccess openarchive pg pgfirst pii piinorm pubdatestart pubdatetxt pubyr sectiontitle sortorder srctitle srctitlenorm srctype ssids alllist content subj subheadings suppl tomb volfirst volissue volumelist webpdf webpdfpagecount yearnav figure table body mmlmath acknowledge affil articletitle auth authfirstini authfull authkeywords authlast grantnumber grantsponsor highlightsabst orcid primabst pubtype ref specialabst 2468-8231 24688231 true 573 573 C Volume 573 11 114817 114817 114817 20250215 15 February 2025 2025-02-15 2025 Regular Papers article fla © 2025 Elsevier B.V. All rights are reserved, including those for text and data mining, AI training, and similar technologies. TIO2SUPPORTEDSIDERITECATALYSTINTEGRATEDCATALYTICCERAMICFILTERTUBEFORSELECTIVECATALYTICREDUCTIONNOXNH3 QIN K 1 Introduction 2 Experimental methods 2.1 Materials and preprocessing 2.2 Sample preparation 2.2.1 Catalyst preparation 2.2.2 Preparation of ST-CFT 2.2.3 Preparation of alkaline poisoning catalytic filter tube and powder catalyst 2.3 Catalyst activity testing 2.4 Catalyst characterization 3 Results and discussion 3.1 Optimal preparation conditions of Sid (X)/TiO2 (Y) and N2 selectivity 3.2 Optimal preparation conditions of ST (M)-CFT (N) 3.3 Characterization 3.3.1 XRD 3.3.2 SEM and TEM 3.3.3 BET 3.3.4 XPS 3.3.5 H2-TPR 3.3.6 NH3-TPD 3.3.7 Py-FTIR 3.3.8 Mechanism discussion 3.4 Industrial applications and toxicity testing 3.4.1 Impact of FV 3.4.2 Alkaline resistance testing 3.4.3 Impact of H2O and SO2 on ST (4)-CFT (7.5) 3.4.4 Stability operation testing 4 Conclusion CRediT authorship contribution statement Acknowledgments References WU 2023 159712 Y JIA 2021 125258 Y ZHAO 2021 76 83 W TAN 2020 4173 4182 Z SONG 2022 3715 3726 Y CHEN 2019 1391 1402 J MIAO 2021 119549 L KIM 2018 282 290 J PAN 2020 118366 B SHAN 2023 141466 L DUAN 2024 334 342 X HAN 2019 10916 10976 L INOMATA 2019 9327 9331 Y CHEN 2023 4 9 J MOU 2012 2989 2993 X LIU 2013 697 704 C YANG 2012 184 188 X ZHANG 2022 1445 1456 Y DU 2023 e202203767 Y GAO 2021 10967 10974 M LI 2017 2482 2489 Q SUN 2019 393 F WEI 2019 1495 1503 Y YAO 2022 126 139 G CHEN 2022 123630 J XU 2023 113657 J QU 2020 1532 W MA 2019 226 238 S PUTLURU 2015 628 635 S YANG 2011 71 80 S LIU 2021 48 57 C YUAN 2023 113113 L GAO 2018 11 39 C SHU 2020 12376 12385 D ZHOU 2022 84421 84433 H CHENG 2022 36294 36310 T ZHAO 2020 125502 L BONINGARI 2013 289 298 T RAMLI 2015 487 498 N XIANG 2019 79 86 Y LIU 2013 115 121 H YANG 2022 112284 Y XING 2016 1207 1212 B MAO 2024 125879 Y MU 2023 140181 Y WU 2024 113960 X CHANG 2024 697 708 C DONG 2022 108481 S HU 2015 6069 6077 H GAO 2017 20 31 F XING 2021 125756 Y FANG 2020 125798 X YANG 2012 73 80 S WEI 2015 66141 66146 X LIU 2010 408 420 F SONG 2019 e16684 L LIU 2016 54 69 C LI 2020 117726 C LIU 2011 18 25 F XIE 2024 e202415203 J DONG 2022 102411 S FANG 2019 319 331 D DU 2017 162 168 X CHEN 2011 531 537 L LI 2020 68 73 J YU 2021 119544 Y QINX2025X114817 QINX2025X114817XK 2027-01-06T00:00:00.000Z 2027-01-06T00:00:00.000Z http://creativecommons.org/licenses/by-nc-nd/4.0/ © 2025 Elsevier B.V. All rights are reserved, including those for text and data mining, AI training, and similar technologies. 2025-02-23T03:51:30.364Z http://vtw.elsevier.com/data/voc/AddOnTypes/50.7/aggregated-refined Anhui provincial environmental protection research project 2023hb0005 http://sws.geonames.org/1814991 This work was financially supported by Anhui provincial environmental protection research project (2023hb0005). https://doi.org/10.15223/policy-017 https://doi.org/10.15223/policy-037 https://doi.org/10.15223/policy-012 https://doi.org/10.15223/policy-029 https://doi.org/10.15223/policy-004 item S2468-8231(25)00003-3 S2468823125000033 1-s2.0-S2468823125000033 10.1016/j.mcat.2025.114817 315758 2025-01-25T12:10:06.211868Z 2025-02-15 1-s2.0-S2468823125000033-main.pdf https://s3-eu-west-1.amazonaws.com/prod-ucs-content-store-eu-west/content/pii:S2468823125000033/MAIN/application/pdf/77ad3fc75fe3563218a5c165f1dd397c/main.pdf main.pdf pdf true 8614253 MAIN 13 1-s2.0-S2468823125000033-main_1.png https://s3-eu-west-1.amazonaws.com/prod-ucs-content-store-eu-west/content/pii:S2468823125000033/PREVIEW/image/png/0b5392ed947c09dfb516a7d8a2101cb8/main_1.png main_1.png png 59428 849 656 IMAGE-WEB-PDF 1 1-s2.0-S2468823125000033-gr11.jpg https://s3-eu-west-1.amazonaws.com/prod-ucs-content-store-eu-west/content/pii:S2468823125000033/gr11/DOWNSAMPLED/image/jpeg/7e3de37a9e937f5606b781f7a2fa2f5a/gr11.jpg gr11 gr11.jpg jpg 31609 272 340 IMAGE-DOWNSAMPLED 1-s2.0-S2468823125000033-gr10.jpg https://s3-eu-west-1.amazonaws.com/prod-ucs-content-store-eu-west/content/pii:S2468823125000033/gr10/DOWNSAMPLED/image/jpeg/05136533bb2565c44db8813fc8912fd8/gr10.jpg gr10 gr10.jpg jpg 91145 511 717 IMAGE-DOWNSAMPLED 1-s2.0-S2468823125000033-gr2.jpg https://s3-eu-west-1.amazonaws.com/prod-ucs-content-store-eu-west/content/pii:S2468823125000033/gr2/DOWNSAMPLED/image/jpeg/6ac21ce66925ca8855b736ccc7d8b664/gr2.jpg gr2 gr2.jpg jpg 118709 444 792 IMAGE-DOWNSAMPLED 1-s2.0-S2468823125000033-ga1.jpg https://s3-eu-west-1.amazonaws.com/prod-ucs-content-store-eu-west/content/pii:S2468823125000033/ga1/DOWNSAMPLED/image/jpeg/37b7614c36ac39f3337facaed6446586/ga1.jpg ga1 true ga1.jpg jpg 48224 200 385 IMAGE-DOWNSAMPLED 1-s2.0-S2468823125000033-gr1.jpg https://s3-eu-west-1.amazonaws.com/prod-ucs-content-store-eu-west/content/pii:S2468823125000033/gr1/DOWNSAMPLED/image/jpeg/e69972df3a7ef076ac8a0858aa91f2ac/gr1.jpg gr1 gr1.jpg jpg 47835 325 508 IMAGE-DOWNSAMPLED 1-s2.0-S2468823125000033-gr6.jpg https://s3-eu-west-1.amazonaws.com/prod-ucs-content-store-eu-west/content/pii:S2468823125000033/gr6/DOWNSAMPLED/image/jpeg/bf06038b274373ba645d37d21268cb2d/gr6.jpg gr6 gr6.jpg jpg 110725 654 717 IMAGE-DOWNSAMPLED 1-s2.0-S2468823125000033-gr5.jpg https://s3-eu-west-1.amazonaws.com/prod-ucs-content-store-eu-west/content/pii:S2468823125000033/gr5/DOWNSAMPLED/image/jpeg/5da8b1303f4f9c05a9f06d11384bb1af/gr5.jpg gr5 gr5.jpg jpg 68148 276 661 IMAGE-DOWNSAMPLED 1-s2.0-S2468823125000033-gr4.jpg https://s3-eu-west-1.amazonaws.com/prod-ucs-content-store-eu-west/content/pii:S2468823125000033/gr4/DOWNSAMPLED/image/jpeg/f38b265a7a41488c7767049bc32ba5f6/gr4.jpg gr4 gr4.jpg jpg 133227 463 565 IMAGE-DOWNSAMPLED 1-s2.0-S2468823125000033-gr3.jpg https://s3-eu-west-1.amazonaws.com/prod-ucs-content-store-eu-west/content/pii:S2468823125000033/gr3/DOWNSAMPLED/image/jpeg/906999267651e03e5fd382af09556891/gr3.jpg gr3 gr3.jpg jpg 177012 673 792 IMAGE-DOWNSAMPLED 1-s2.0-S2468823125000033-gr9.jpg https://s3-eu-west-1.amazonaws.com/prod-ucs-content-store-eu-west/content/pii:S2468823125000033/gr9/DOWNSAMPLED/image/jpeg/5bcba1e9d46505cb75c9fb6fabcbd6a0/gr9.jpg gr9 gr9.jpg jpg 67743 270 661 IMAGE-DOWNSAMPLED 1-s2.0-S2468823125000033-gr8.jpg https://s3-eu-west-1.amazonaws.com/prod-ucs-content-store-eu-west/content/pii:S2468823125000033/gr8/DOWNSAMPLED/image/jpeg/9192009edcdb7549343a6a43b23efad5/gr8.jpg gr8 gr8.jpg jpg 176312 961 791 IMAGE-DOWNSAMPLED 1-s2.0-S2468823125000033-gr7.jpg https://s3-eu-west-1.amazonaws.com/prod-ucs-content-store-eu-west/content/pii:S2468823125000033/gr7/DOWNSAMPLED/image/jpeg/4403c7d6de906f7487e50f4a99879a6c/gr7.jpg gr7 gr7.jpg jpg 43085 272 661 IMAGE-DOWNSAMPLED 1-s2.0-S2468823125000033-gr11.sml https://s3-eu-west-1.amazonaws.com/prod-ucs-content-store-eu-west/content/pii:S2468823125000033/gr11/THUMBNAIL/image/gif/0398983893b80cec8e01d9b48ca6a28d/gr11.sml gr11 gr11.sml sml 10659 164 205 IMAGE-THUMBNAIL 1-s2.0-S2468823125000033-gr10.sml https://s3-eu-west-1.amazonaws.com/prod-ucs-content-store-eu-west/content/pii:S2468823125000033/gr10/THUMBNAIL/image/gif/d17e41b5c5d5b84118b2576ad4442cb7/gr10.sml gr10 gr10.sml sml 11377 156 219 IMAGE-THUMBNAIL 1-s2.0-S2468823125000033-gr2.sml https://s3-eu-west-1.amazonaws.com/prod-ucs-content-store-eu-west/content/pii:S2468823125000033/gr2/THUMBNAIL/image/gif/777e74b8bf53d2e18d556a6b05756a4c/gr2.sml gr2 gr2.sml sml 12220 123 219 IMAGE-THUMBNAIL 1-s2.0-S2468823125000033-ga1.sml https://s3-eu-west-1.amazonaws.com/prod-ucs-content-store-eu-west/content/pii:S2468823125000033/ga1/THUMBNAIL/image/gif/35cfb77adac75b78e91e3d3d4fe33473/ga1.sml ga1 true ga1.sml sml 15013 114 219 IMAGE-THUMBNAIL 1-s2.0-S2468823125000033-gr1.sml https://s3-eu-west-1.amazonaws.com/prod-ucs-content-store-eu-west/content/pii:S2468823125000033/gr1/THUMBNAIL/image/gif/0d845d28e13fc7aede63b54ce26b47ca/gr1.sml gr1 gr1.sml sml 15771 140 219 IMAGE-THUMBNAIL 1-s2.0-S2468823125000033-gr6.sml https://s3-eu-west-1.amazonaws.com/prod-ucs-content-store-eu-west/content/pii:S2468823125000033/gr6/THUMBNAIL/image/gif/3a4663b5dc58e580a8c046cc88368ba6/gr6.sml gr6 gr6.sml sml 11428 164 180 IMAGE-THUMBNAIL 1-s2.0-S2468823125000033-gr5.sml https://s3-eu-west-1.amazonaws.com/prod-ucs-content-store-eu-west/content/pii:S2468823125000033/gr5/THUMBNAIL/image/gif/2dd17a380c50892ed98bc45e403b0b99/gr5.sml gr5 gr5.sml sml 9731 92 219 IMAGE-THUMBNAIL 1-s2.0-S2468823125000033-gr4.sml https://s3-eu-west-1.amazonaws.com/prod-ucs-content-store-eu-west/content/pii:S2468823125000033/gr4/THUMBNAIL/image/gif/155adc6b24d7f3275d027fd4da9ea769/gr4.sml gr4 gr4.sml sml 26937 164 200 IMAGE-THUMBNAIL 1-s2.0-S2468823125000033-gr3.sml https://s3-eu-west-1.amazonaws.com/prod-ucs-content-store-eu-west/content/pii:S2468823125000033/gr3/THUMBNAIL/image/gif/63da6aae36f46513daa5037cde62ed74/gr3.sml gr3 gr3.sml sml 13775 164 193 IMAGE-THUMBNAIL 1-s2.0-S2468823125000033-gr9.sml https://s3-eu-west-1.amazonaws.com/prod-ucs-content-store-eu-west/content/pii:S2468823125000033/gr9/THUMBNAIL/image/gif/644ab58e5927866b1b0fdafad5e58c15/gr9.sml gr9 gr9.sml sml 11039 89 219 IMAGE-THUMBNAIL 1-s2.0-S2468823125000033-gr8.sml https://s3-eu-west-1.amazonaws.com/prod-ucs-content-store-eu-west/content/pii:S2468823125000331/gr8/THUMBNAIL/image/gif/73aede912a7e7ec285c328cf232de55c/gr8.sml gr8 gr8.sml sml 11509 164 135 IMAGE-THUMBNAIL 1-s2.0-S2468823125000033-gr7.sml https://s3-eu-west-1.amazonaws.com/prod-ucs-content-store-eu-west/content/pii:S2468823125000033/gr7/THUMBNAIL/image/gif/6197bc84a58b6ddeafb76f0fc6099f3a/gr7.sml gr7 gr7.sml sml 7475 90 219 IMAGE-THUMBNAIL 1-s2.0-S2468823125000033-gr11_lrg.jpg https://s3-eu-west-1.amazonaws.com/prod-ucs-content-store-eu-west/content/pii:S2468823125000033/HIGHRES/image/jpeg/94995dcdf954c8f3adf6d6e666446a8f/gr11_lrg.jpg gr11 gr11_lrg.jpg jpg 268018 1206 1508 IMAGE-HIGH-RES 1-s2.0-S2468823125000033-gr10_lrg.jpg https://s3-eu-west-1.amazonaws.com/prod-ucs-content-store-eu-west/content/pii:S2468823125000033/HIGHRES/image/jpeg/8d5f789636b52d294b3f34a6ebe875c3/gr10_lrg.jpg gr10 gr10_lrg.jpg jpg 676663 2265 3175 IMAGE-HIGH-RES 1-s2.0-S2468823125000033-gr2_lrg.jpg https://s3-eu-west-1.amazonaws.com/prod-ucs-content-store-eu-west/content/pii:S2468823125000033/HIGHRES/image/jpeg/d870e0d6b9d91a8cd57ae1435495eb7c/gr2_lrg.jpg gr2 gr2_lrg.jpg jpg 959913 1965 3508 IMAGE-HIGH-RES 1-s2.0-S2468823125000033-ga1_lrg.jpg https://s3-eu-west-1.amazonaws.com/prod-ucs-content-store-eu-west/content/pii:S2468823125000033/HIGHRES/image/jpeg/9bb6509454b72c01a055533e5da00533/ga1_lrg.jpg ga1 true ga1_lrg.jpg jpg 338451 886 1707 IMAGE-HIGH-RES 1-s2.0-S2468823125000033-gr1_lrg.jpg https://s3-eu-west-1.amazonaws.com/prod-ucs-content-store-eu-west/content/pii:S2468823125000033/HIGHRES/image/jpeg/7f2d8b1875522da128f137266d00f351/gr1_lrg.jpg gr1 gr1_lrg.jpg jpg 410490 1438 2250 IMAGE-HIGH-RES 1-s2.0-S2468823125000033-gr6_lrg.jpg https://s3-eu-west-1.amazonaws.com/prod-ucs-content-store-eu-west/content/pii:S2468823125000033/HIGHRES/image/jpeg/03b20a993f136a36e0c014cf47446e9e/gr6_lrg.jpg gr6 gr6_lrg.jpg jpg 932196 2897 3175 IMAGE-HIGH-RES 1-s2.0-S2468823125000033-gr5_lrg.jpg https://s3-eu-west-1.amazonaws.com/prod-ucs-content-store-eu-west/content/pii:S2468823125000033/HIGHRES/image/jpeg/38f93ae579bf3a75c388c42d2dab276c/gr5_lrg.jpg gr5 gr5_lrg.jpg jpg 503120 1223 2925 IMAGE-HIGH-RES 1-s2.0-S2468823125000033-gr4_lrg.jpg https://s3-eu-west-1.amazonaws.com/prod-ucs-content-store-eu-west/content/pii:S2468823125000033/HIGHRES/image/jpeg/fbb77bcc1bf5aaca3cabf5be31f8c4b6/gr4_lrg.jpg gr4 gr4_lrg.jpg jpg 1679538 2047 2500 IMAGE-HIGH-RES 1-s2.0-S2468823125000033-gr3_lrg.jpg https://s3-eu-west-1.amazonaws.com/prod-ucs-content-store-eu-west/content/pii:S2468823125000331/HIGHRES/image/jpeg/da8dffacc1ec617e7aec1618984f3830/gr3_lrg.jpg gr3 gr3_lrg.jpg jpg 1366120 2983 3508 IMAGE-HIGH-RES 1-s2.0-S2468823125000033-gr9_lrg.jpg https://s3-eu-west-1.amazonaws.com/prod-ucs-content-store-eu-west/content/pii:S2468823125000033/HIGHRES/image/jpeg/9b71f651e82fe4fe0c128f61b54b005b/gr9_lrg.jpg gr9 gr9_lrg.jpg jpg 480200 1193 2925 IMAGE-HIGH-RES 1-s2.0-S2468823125000033-gr8_lrg.jpg https://s3-eu-west-1.amazonaws.com/prod-ucs-content-store-eu-west/content/pii:S2468823125000331/HIGHRES/image/jpeg/3e78ecae78ac0b66d7248686db39bece/gr8_lrg.jpg gr8 gr8_lrg.jpg jpg 1339896 4258 3504 IMAGE-HIGH-RES 1-s2.0-S2468823125000033-gr7_lrg.jpg https://s3-eu-west-1.amazonaws.com/prod-ucs-content-store-eu-west/content/pii:S2468823125000331/HIGHRES/image/jpeg/1679d5614a35b197277d76683cb6182f/gr7_lrg.jpg gr7 gr7_lrg.jpg jpg 323941 1203 2925 IMAGE-HIGH-RES 1-s2.0-S2468823125000033-si1.svg https://s3-eu-west-1.amazonaws.com/prod-ucs-content-store-eu-west/content/pii:S2468823125000033/image/svg+xml/9ea5e54b9f67572c83ef49464f16fda3/si1.svg si1 si1.svg svg 5576 ALTIMG 1-s2.0-S2468823125000033-si2.svg https://s3-eu-west-1.amazonaws.com/prod-ucs-content-store-eu-west/content/pii:S2468823125000033/image/svg+xml/70f0758d57ade937194bd670cdaa7c93/si2.svg si2 si2.svg svg 15679 ALTIMG 1-s2.0-S2468823125000033-si3.svg https://s3-eu-west-1.amazonaws.com/prod-ucs-content-store-eu-west/content/pii:S2468823125000033/image/svg+xml/0b78b8bea92d0fc58e2617ff823c54a6/si3.svg si3 si3.svg svg 19333 ALTIMG MCAT 114817 114817 S2468-8231(25)00003-3 10.1016/j.mcat.2025.114817 Fig. 1 Schematic diagram of catalytic material performance evaluation device. Fig 1 Fig. 2 NOx conversion efficiency of (a) Siderite (450), TiO2 (450), Fe2O3 (0.3)/TiO2 (450), and Sid (X)/TiO2 (450); (b) Sid (0.3)/ TiO2 (Y); (c) N2 selectivity; (d) CFT and ST (M)-CFT; (e) ST (4)-CFT (N); and (f) pressure drop of ST (M)-CFT (N). Fig 2 Fig. 3 XRD patterns of (a) Raw Siderite, Siderite (450), TiO2 (450), Fe2O3 (0.3)/TiO2 (450), and (b) Sid (X)/TiO2 (Y) catalysts, (c) ST (M)-CFT (N) catalytic filter tubes. Fig 3 Fig. 4 TEM image of (a) Raw Siderite, (b) Siderite (450), (c) Sid (0.3)/TiO2 (450), dark field TEM image and element mapping of Sid (0.3)/TiO2 (450) (d∼d-3), SEM image and element mapping of CFT (e∼e-3), SEM image and element mapping of ST (4)-CFT (7.5) (f∼f-5). Fig 4 Fig. 5 N2 absorption and desorption curves (a) and pore size distribution (b) of Raw Siderite, Siderite (450), Sid (0.3)/TiO2 (450), and TiO2 (450). Fig 5 Fig. 6 XPS spectra of different catalysts, (a) Fe2p, (b) O1s, (c) Ti2p. Fig 6 Fig. 7 (a) H2-TPR, (b) NH3-TPD of Siderite (450) and Sid (0.3)/TiO2 (450). Fig 7 Fig. 8 Siderite (450), TiO2(450), and Sid (0.3)/TiO2 (450) at 100 °C, 180 °C, 350 °C Py-IR spectra (a), (c)&(e), and acid content (b), (d)&(f). Fig 8 Fig. 9 (a) The effect of FV on NOx conversion and pressure drop of ST (4)-CFT (7.5), and (b) the effect of alkali metals on NOx conversion of ST (4)-CFT (7.5) and Sid (0.3)/TiO2 (450). Fig 9 Fig. 10 Tolerance of ST (4)-CFT (7.5) to H2O and SO2 (a), XRD pattern of ST (4)-CFT (7.5) after H2O and SO2 resistance test (b) and XPS atomic concentration analysis of N, S elements (c). Fig 10 Fig. 11 Stability test of ST (4)-CFT (7.5). Fig 11 Table 1 Chemical composition of Siderite and CFT. Table 1 Sample Element Content (wt%) Sample Element Content (wt%) Siderite Fe 30.32 CFT O 49.55 Si 27.28 Al 26.64 O 25.75 Si 22.38 Al 7.66 Ni 0.35 K 4.84 Fe 0.31 Mg 1.05 Cr 0.24 Mn 0.79 / / Table 2 Preparation conditions of each ST (M)-CFT (N) and the effect of milling time on the median particle size of catalyst. Table 2 Sample Ball millingTime (h) Medianparticle size(d50) (μm) Catalyst slurry concentration(wt%) Loading rate (wt%) ST (2)-CFT 2 14.1 / 20.6 ST (4)-CFT 4 5.3 / 20.3 ST (6)-CFT 6 2.5 / 19.8 ST (4)-CFT (5) 4 5.3 5 14.5 ST (4)-CFT (7.5) 4 5.3 7.5 21.6 ST (4)-CFT (10) 4 5.3 10 30.2 Table 3 SCR properties of siderite catalysts and CFs in reference literature. Table 3 Catalytic material Reaction condition Temperature range a / Max NOx conversion b Ref. NO&NH3, O2 GHCV/FV Siderite catalyst Sid (0.3)/TiO2 (450) 500 ppm, 3 % 36,000 h−1 300–350 °C/100 % This work Siderite (H500) 500 ppm, 3 % 17000 h−1 300 °C/90 % [34] 3Mn-5W-1.5Sb-siderite 500 ppm, 5 % 30,000 h−1 300 °C/97 % [24] CF ST (4)-CFT (7.5) 500 ppm, 3 % 1.5 m/min 275–375 °C/100 % This work VWTi-PFC3 600 ppm, 5 % 1.0 m/min 275–325 °C/100 % [7] V2O5-WO3/TiO2-SiC 700 ppm, 7 % 1.2 m/min 280–320 °C/100 % [8] FeWOX/SSFF 500 ppm, 10 % 0.5 m/min 350 °C/95 % [10] a Temperature range at the highest conversion of NOx. b Maximum NOx conversion of catalytic materials. Table 4 Specific Surface Area, Pore Volume, and Average Pore Size of Siderite (450), Sid (0.3)/TiO2 (450) and TiO2 (450). Table 4 Sample Specific Surface Area(m2/g) Pore Volume(cm3/g) Average Pore Size(nm) Raw Siderite 13.9 0.04 3.3 Siderite (450) 68.3 0.07 8.8 Sid (0.3)/TiO2 (450) 59.6 0.15 5.2 TiO2 (450) 84.6 0.26 5.9 Table 5 Surface atomic composition and species proportion of catalyst. Table 5 Sample Fe(at.%) Fe3+/Fe(at.%) O(at.%) Oα/O(at.%) Ti(at.%) Siderite (450) 8.17 34.47 62.12 78.81 / TiO2 (450) / / 71.34 34.22 28.66 Sid (0.3)/TiO2 (450) 2.82 38.50 67.68 43.94 18.50 Research Paper TiO2 supported siderite catalyst integrated with catalytic ceramic filter tube for selective catalytic reduction of NOx with NH3 Kai Qin Writing – original draft Visualization Methodology Investigation Formal analysis Data curation Conceptualization a b c Yuting Hu Validation Methodology Investigation Formal analysis a b c Taotao Liu Validation Methodology Funding acquisition a b c Henjian Zhang Visualization Funding acquisition d Bin Wang Resources e Liming Qian Resources d Chengzhu Zhu Writing – review & editing Validation Supervision Resources Project administration Methodology Funding acquisition Conceptualization a b c f ⁎ a School of Resource and Environmental Engineering, Hefei University of Technology, Hefei 230009, PR China School of Resource and Environmental Engineering Hefei University of Technology Hefei 230009 PR China aSchool of Resource and Environmental Engineering, Hefei University of Technology, Hefei 230009, PR China b Institute of Atmospheric Environment & Pollution Control, Hefei University of Technology, Hefei 230009, PR China Institute of Atmospheric Environment & Pollution Control Hefei University of Technology Hefei 230009 PR China bInstitute of Atmospheric Environment & Pollution Control, Hefei University of Technology, Hefei 230009, PR China c Key Laboratory of Nanominerals and Pollution Control of Anhui Higher Education Institutes, Hefei University of Technology, Hefei 230009, PR China Key Laboratory of Nanominerals and Pollution Control of Anhui Higher Education Institutes Hefei University of Technology Hefei 230009 PR China cKey Laboratory of Nanominerals and Pollution Control of Anhui Higher Education Institutes, Hefei University of Technology, Hefei 230009, PR China d CAS Newworld Environmental Protection Technology Co., Ltd, Hefei 230088, PR China CAS Newworld Environmental Protection Technology Co., Ltd Hefei 230088 PR China dCAS Newworld Environmental Protection Technology Co., Ltd, Hefei 230088, PR China e CNBM Environmental Protection Research Institute (Jiangsu)Co., Ltd., Yancheng 224051, China CNBM Environmental Protection Research Institute (Jiangsu)Co., Ltd Yancheng 224051 China eCNBM Environmental Protection Research Institute (Jiangsu)Co., Ltd., Yancheng 224051, China f Low-Temperature Denitration Engineering Research Center of Anhui Province, Hefei 230001, PR China Low-Temperature Denitration Engineering Research Center of Anhui Province Hefei 230001 PR China fLow-Temperature Denitration Engineering Research Center of Anhui Province, Hefei 230001, PR China ⁎ Corresponding author at: School of Resource and Environmental Engineering, Hefei University of Technology, Hefei 230009, PR China. School of Resource and Environmental Engineering Hefei University of Technology Hefei 230009 PR China Natural siderite modified TiO2 (Sid/TiO2) catalyst was prepared by coprecipitation method, and the Sid/TiO2 prepared under optimized conditions was loaded on ceramic filter tube (ST-CFT) through impregnating method. The results showed Sid (0.3)/TiO2 (450) catalyst had the best denitrification effect when the mass ratio of siderite was 0.3 and the calcination temperature was 450 °C. The NOx conversion efficiency reached more than 95 % at reaction temperature was 275–350 °C when NO initial concentration of 500 ppm, and gas hourly space velocity (GHCV) for 36,000 h−1. While the catalyst's median particle size (d50) was 5.3 μm, the slurry concentration was 7.5 wt%, and the face velocity (FV) was 1.5 m/min, NOx conversion efficiency of the ST (4)-CFT (7.5) reached 100 % at reaction temperatures ranging from 275 to 375 °C. It also revealed excellent water, sulfur, and alkali resistance. Compared with pure siderite catalyst, the crystallinity of active component α-Fe2O3 was decreased by introducing Ti carrier, and the utilization efficiency and dispersibility of the active center were improved. The synergistic effect of Fe and Ti improved the acid center density and Brønsted acid content of the catalyst, which promoted low-temperature SCR performance. Graphical abstract Image, graphical abstract Keywords Nitric oxide Siderite-derived catalyst TiO2 Catalyst filter tube NH3-SCR Data availability The data that has been used is confidential. 1 Introduction Glass, cement, and other non-electric kiln flue gas temperature fluctuation ranges were large (150–400 °C), with high content of dust (rich in alkali metals), nitrogen oxides (NOx), and sulfur dioxide (SO2). Caused serious environmental problems such as acid rain, photochemical haze, and threatens human health [1–3]. Traditionally, series dust collectors, desulfurization equipment, and selective catalytic reduction (SCR) units were used to purify flue gas. It increased the floor area and operation energy consumption of the system, and more equipment reduced the stability of the system operation [4,5]. The catalytic filter (CF) combined dust removal and SCR, which had obvious advantages in the collaborative removal of various pollutants, gradually became a hot spot of integrated removal technology [6]. Miao et al. [7] and Kim et al. [8] achieved NOx conversion efficiency exceeding 90 % at 250∼350 °C, using V-W/Ti filters prepared by microwave drying and ball milling spin coating methods, respectively. Pan et al. [9] used TiO2 aerogel-modified MnOX/SiC ceramic membrane to achieve over 80 % NOx conversion efficiency within 120–180 °C. Shan et al. [10] performed in-situ deposition of Fe-WOx heterogeneous catalysts on SSFF (stainless steel fiber filter), demonstrated >85 % NOx conversion rate, excellent selectivity, and tolerance towards H2O and SO2 at temperatures of 275–350 °C. Practice had been proven that the combination of dry flue gas desulfurization and CF could effectively remove SO2, NOx, and hydrogen chloride in flue gas, and more than 99 % of dust [11]. The fibrous support layer and dense membrane layer effectively protected the catalyst inside the CF from poisoning by SO2 and alkali metals, and the developed pore structure provided sufficient attachment points for catalyst loading [9]. Existing CFs mainly utilized commercial V-W/Ti catalysts [12,13]. The limitations of V/Ti catalysts such as high and narrow temperature windows [12] became increasingly prominent, and its susceptibility to poisoning by alkali metals/H2O/SO2 [13], and biotoxicity [14]. Therefore, the research on Mn, Ce, Fe, Ni, Cu, and other vanadium-free catalysts gradually became a hot topic [9]. In recent years, FeOx catalysts had been extensively studied from micro-morphology [15], crystal structure [16,17], and preparation method [18]. It was proved that the FeOx catalyst was environmentally friendly, low-cost, and had excellent medium to high temperatures SCR activity, and N2 selectivity [19,20]. Siderite was widely distributed in China, and its main components were FeCO3 and SiO2 [21,22]. Due to the decomposition of FeCO3 after heat treatment of siderite, mesoporous materials with α-Fe2O3 as the main crystalline phase will be formed. With strong adsorption capacity and certain SCR activity, it had been proven to have the potential to treat waste gas [21]. Therefore, siderite was an ideal precursor material for FeOx catalysts. Currently, research on SCR catalysts based on siderite mainly focused on performance enhancement through heat treatment [22] or impregnation of Mn, Ce, Zr, W, and other metallic elements [23,24] to enhance SCR properties. However, it still had some defects such as poor reduction, low-temperature activity, and coexistence poisoning of H2O and SO2, which required further modification research [25,26]. Transition/rare earth elements (Ce [27], Mn [28], Cu [29], and W [30]) and other elements were often used as active components or additives of SCR catalysts. Among them, Ti was widely used as a carrier for SCR catalysts to improve the active ingredients' dispersion, surface acidity, and sulfur resistance [31,32]. In addition, the synergistic effect between Ti-Fe could promote the improvement of NH3-SCR performance [9,33]. In present study, the optimum preparation conditions of TiO2 supported nature siderite and Sid/TiO2 loaded on blank ceramic filter tube (CFT) through impregnating method were systematically discussed. The effects of filtration velocity (FV), H2O, SO2, and alkali metals (Na, K, and Ca) on the NH3-SCR performance of ST-CFT (Sid/TiO2-CFT) were discussed. The physicochemical properties of Sid/TiO2 and ST-CFT were analyzed using XRF, XRD, SEM&TEM, XPS, BET, and H2-TPR&NH3-TPD techniques. The study was expected to give a reference for research a new catalytic filter tube with simultaneous dust removal and denitrification. 2 Experimental methods 2.1 Materials and preprocessing Ti(SO4)2, NH3·H2O, FeCl3·6H2O, Na2SiO3, NH4Cl, NaCl, KCl, and CaCl2 used in the experiment were all analytical reagents. Natural siderite was obtained from Daxigou of Shanxi, China, which was mechanically crushed and sieved (200 mesh) for reserve use. The CFT was produced by Jiangsu Saitu New Material Technology Co., Ltd. To facilitate the test, the CFT was cut into L (20 mm) × D (16 mm) cylinders, washed with alcohol, dried at 105 °C, and weighed for use. The XRF chemical composition analysis of Siderite and CFT were shown in Table 1 . The Siderite used in the experiment had low iron content and contained mainly Fe, Si, O, Al, K, and a small amount of Mg and Mn elements. The CFT was mainly composed of Al, Si, and O elements. 2.2 Sample preparation 2.2.1 Catalyst preparation 2.1911 g of Ti(SO4)2 was dissolved in deionized water, and a certain quality of siderite powder were added and mixed thoroughly. Then added NH3·H2O and stirred vigorously until the pH >9. Continued the reaction for 0.5 h and let the precipitate aged for 2 h. After filtration, the precipitates were dried at 105 °C and calcined at different temperatures for 4 h. After cooling, the catalyst was pressed into 40∼60 mesh, and named Sid (X)/TiO2 (Y), the X and Y respectively represented the mass proportion of siderite in the catalyst, and the calcination temperature (°C). 2.2.2 Preparation of ST-CFT The optimum catalyst with different particle sizes was prepared by wet ball milling. Then configured into different solid contents of the catalyst slurry, and mixed for 0.5 h. The pre-treated CFT was placed into the slurry for ultrasonic impregnation for 10 mins and finally weighed after drying at 105 °C. Each catalytic filter was loaded through the impregnating method twice. Finally, calcined at the set temperature for 4 h, cooled for use, named ST (M)-CFT (N), where M and N respectively represented the milling time (h) and the slurry concentration (wt%). 2.2.3 Preparation of alkaline poisoning catalytic filter tube and powder catalyst The alkali-poisoned ST-CFT was prepared by the impregnation method, and a certain mass of NaCl, KCl, and CaCl2 (2 wt% of the catalyst, measured by alkali metal) was dissolved in deionized water. The alkali solution was uniformly dripped onto the optimal ST-CFT surface and then dried in the oven. Finally, it calcined at the set temperature for 4 h, cooled, and reserved, recorded as 2Na-CFT, 2K-CFT, and 2Ca-CFT, respectively. The alkali-poisoning powder catalysts were prepared by the same method and were denoted as 2Na-ST, 2K-ST, and 2Ca-ST respectively. 2.3 Catalyst activity testing The calculation method for the loading rate of the catalyst was as follows: (1) ω = W 1 − W 0 W 0 × 100 % Where, W0 was the weight of CFT (g) and W1 was the weight of ST-CFT (g). The activity of the Sid (X)/TiO2 (Y) and ST (M)-CFT (N) samples were tested in the fixed-bed reactor system (Fig. 1 ). The simulated gas composition consisted of 500 ppm NO and NH3, 3 vol.% O2, 100 ppm SO2 (during use), 10 vol.% H2O (during use), and was balanced with Ar gas. The total gas flow rate was 300 mL/min, and the reaction temperature ranged from 50 to 400 °C. The gas flow rates for each component were adjusted using mass flow controllers (Beijing Qixing D07) and mixed thoroughly in a mixing tank. Then it was introduced into quartz catalytic reaction tube containing the Sid (X)/TiO2 (Y) or ST (M)-CFT (N) sample for the reaction. Real-time monitoring of NO concentration was measured using a flue gas analyzer (MADUR, GA-12Plus, Austria). N2, NH3, and N2O concentrations at the outlet were analyzed using Thermo Trace 1300 GC. The NOx conversion efficiency and N2 selectivity were calculated respectively as the following formula: (2) N O x conversion ( % ) = ( 1 − [ N O x ] out [ N O x ] in ) × 100 % (3) N 2 selectivity ( % ) = ( 1 − 2 × [ N 2 O ] out [ N O x ] in − [ N O x ] out + [ N H 3 ] in − [ N H 3 ] out ) × 100 Where, [NOx]=[NO]+[NO2], [NO]in and [NO]out represented the inlet and outlet concentrations of NO, respectively, ppm. [NO2]in and [NO2]out represented the inlet and outlet concentrations of NO2, respectively, ppm. [NH3]in and [NH3]out represented the inlet and outlet concentrations of NH3, respectively, ppm. [N2O]out represented the outlet concentrations of N2O, ppm. 2.4 Catalyst characterization The chemical composition of Siderite and CFT was analyzed by X-ray fluorescence spectrometer (XRF, Shimadzu XRF-1800, Japan). Transmission electron microscopy (TEM, JEM Talos F200X G2, China) and scanning electron microscopy (SEM, Hitachi Regulus 8230, Japan) were used to analyze sample morphology and elemental distribution coupled with an energy-dispersive X-ray spectrometer (EDS). The laser diffraction particle size analyzer (LDPSA, Mastersizer 2000, UK) was used to determine the particle size distribution of the powder catalysts. The crystal structure of the catalysts was analyzed through powder X-ray diffraction (XRD, Dandong DX-2700, China) using Cu-Kα radiation. The specific surface area, pore volume, and pore size of the catalysts were analyzed by a liquid nitrogen physisorption analyzer (BET, Quantach-Autosorb-IQ3, USA). Atomic valence states and binding energies of the samples were analyzed using X-ray photoelectron spectroscopy (XPS, Thermo Scientific ESCALAB-250 Xi, USA) with Al-Kα radiation, with the standard binding energy of C1s set at 284.8 eV. The reducibility of the catalysts was analyzed using a hydrogen temperature-programmed reduction analyzer (H2-TPR, VDSorb91 x). The surface acidity of the catalysts was determined using a temperature-programmed desorption analyzer (NH3-TPD, Auto Chem II-2920). Pyridine Fourier quantitatively determined the acidity and acid content of the catalyst transform infrared spectrometer (Py-FTIR, Bruker tensor 27, Vertex 80 V). 3 Results and discussion 3.1 Optimal preparation conditions of Sid (X)/TiO2 (Y) and N2 selectivity Fig. 2 (a) showed the NOx conversion efficiency of the catalysts with different components. It was observed that the max NOx conversion efficiency of pure siderite (450) and pure TiO2 (450) catalysts were only 77.6 % and 14.0 % over the 50–400 °C. Introducing TiO2 could significantly improve the NOx conversion efficiency of the catalyst, when the mass proportion of siderite was 0.3, the catalytic efficiency reached the optimum condition. The NOx conversion efficiency of Sid (0.3)/TiO2 (450) catalyst reached more than 95% in the range of 275∼350 °C. In addition, the Fe2O3 (0.3)/TiO2 (450) control group was synthesized by precipitation method. It was found that the two catalysts have similar denitrification performance at high temperatures above 275 °C. In the low temperatures, Sid (0.3)/TiO2 (450) was superior to the effect of Fe2O3 (0.3)/TiO2 (450). The results indicated that siderite had good potential and application prospects as Fe source to prepare industrial denitrification catalysts. Fig. 2(b) showed the effect of NOx conversion efficiency on different calcination temperatures of Sid (0.3)/TiO2 (Y) catalysts. When the calcination temperature was 350 °C and 550 °C, the denitrification efficiency decreased. The reason was that when calcined at 350 °C, FeCO3 could not be completely transformed into active components to participate in the reaction [34,35]. Calcination at 550 °C increased the active component's crystallinity, decreasing the specific surface area and SCR activity [23,36]. In addition, the NOx conversion efficiency of Sid (0.3)/SiO2 (450) catalyst with SiO2 as the carrier was lower than that of Sid (0.3)/TiO2 (450) in almost the whole test range. This indicated that there could be synergistic effect between Fe-Ti. Therefore, we determined the Sid (0.3)/TiO2 (450) catalyst was the optimal powder catalyst. Fig. 2(c) depicted the N2 selectivity outcomes of three catalysts. From 50 to 400 °C, Sid (0.3)/TiO2 (450) demonstrated significantly higher N2 selectivity than Siderite (450), and at 400 °C, it could remain above 90 %. The results indicated that introducing TiO2 enhanced the catalyst's NH3-SCR activity and N2 selectivity. 3.2 Optimal preparation conditions of ST (M)-CFT (N) The preparation conditions of each ST (M)-CFT and the effect of milling time on the median particle size of the catalyst were shown in Table 2 . It could be observed that the particle size of the catalyst decreased with the increase of milling time. Fig. 2(d) showed the NOx conversion efficiency of CFT and ST (M)-CFT (M = 2, 4, 6) (loading rates were all around 20 wt%). The NOx conversion efficiency of CFT was only 20–30 %. With the decrease in catalyst particle size, the NOx conversion efficiency of the ST (M)-CFT increased gradually. Among them, the NOx conversion efficiency of ST (4)-CFT reached 100 % in the range of 275–375 °C. This indicated that wet ball milling effectively reduced the particle size of the catalyst, promoted the dispersion of catalyst particles in the CFT, and was conducted to the improvement of SCR activity [37]. However, the NOx conversion efficiency of ST (6)-CFT with the smallest particle size was slightly improved. The result showed that when the particle size of the catalyst was lower than 5.3 μm, the decrease in particle size had no obvious effect on the denitrification performance of the ST-CFT. To explore the effect of catalyst load rate on the performance of the ST (4)-CFT (N), the concentration of catalyst slurry was changed, and the results were shown in Table 2 and Fig. 2(e). The findings indicated that as the slurry concentration increased, both the load rate and NOx conversion efficiency of the ST (4)-CFT (N) demonstrated a corresponding increase. It was also observed that ST (4)-CFT (7.5) at a load rate of 21.6 wt% exhibited a similar NOx conversion efficiency to ST (4)-CFT (10) at a load rate of 30.2 wt%. It showed that a higher catalyst loading rate could not effectively improve the denitrification performance of the ST-CFT. Fig. 2(f) described the influence of catalyst particle size and load rate on the pressure drop of the ST (M)-CFT (N). The results showed that the pressure drop of ST (M)-CFT (N) increased with the catalyst's particle size and loading rate. At 400 °C, the pressure drop of CFT was 0.75 kPa, and ST (4)-CFT (7.5) and ST (4)-CFT (10) with basically the same denitrification performance was 1.76 kPa and 1.87 kPa, respectively. Uphold economic efficient environmental protection concepts, and compared with the existing siderite catalysts and CFTs (Table 3 ), ST (4)-CFT (7.5) was chosen for further investigation. 3.3 Characterization 3.3.1 XRD Fig. 3 (a) showed the XRD patterns of Raw Siderite, Siderite (450), TiO2 (450), and Fe2O3 (0.3)/TiO2 (450). The main components of Raw Siderite were FeCO3 and SiO2 [35]. After calcination, the FeCO3 phase was transformed into the highly active component α-Fe2O3 (2θ=35.6°, 54.1° and 64.1°) [16]. The diffraction peaks of TiO2 (450) prepared by precipitation were all anatase-TiO2 diffraction peaks (2θ=25.3°, 38.0°, 48.0°, 55.0°) [8]. The control group Fe2O3 (0.3)/TiO2 (450) showed obvious anatases-TiO2 and α-Fe2O3 diffraction peaks. In Fig. 3(b), all Sid (X)/TiO2 (Y) samples showed obvious anatase-TiO2 diffraction peaks and weak α-Fe2O3 diffraction peaks. It indicated that α-Fe2O3 was dispersed on the TiO2 surface with a lower crystallinity, which was conducted to electron transfer and enhanced the catalyst's oxidation performance [38–40]. As the calcination temperature increased, the diffraction peak of FeCO3 gradually weakened and completely vanished at 450 °C. Meanwhile, the crystal phase of α-Fe2O3 remains unchanged and the diffraction peak gradually strengthened. Studies had shown that increasing temperature could promote the growth of α-Fe2O3 crystals [27], reducing the catalyst activity [35,41]. Fig. 3(c) showed that the main diffraction peaks of CFT were α-Al2O3, SiO2, and AlSiOx generated by the reaction of CFT during the production firing process [42]. The characteristic peaks of TiO2 and α-Fe2O3 could be observed in all ST (M)-CFT (N) samples, indicating the catalysts were successfully loaded onto the CFT. 3.3.2 SEM and TEM The morphologies of Raw Siderite, Siderite (450), and Sid (0.3)/TiO2 (450) were observed by TEM. According to Fig. 4 (a), raw siderite had an irregular layered structure with a glassy appearance. Following calculations (Fig. 4(b)), the surface of Siderite became porous and developed nanoscale molten-grain-like structures. These structures created multiple nanochannels that increased the specific surface area of Siderite. As a result, gas diffusion and adsorption were facilitated, leading to an improved utilization rate of active components and SCR reaction rate [43,44]. The formation of micropores was related to FeCO3 decomposition and CO2 escape, as indicated by XRD results. In Fig. 4(c), the TEM image displayed spherical TiO2 nanoparticles prepared through precipitation. EDS element mapping analysis (Fig. 4(d∼ d-3)) showed that O, Ti, and Fe elements in Sid (0.3)/TiO2 (450) were highly coincident, indicating the active component α-Fe2O3 was highly dispersed on the TiO2 support. The CFT in Fig. 4(e) was composed of ceramic fibers stacked in an intertwined manner, exhibiting high porosity and pore size. The fiber diameter predominantly ranged between 1∼5 μm, with a rough surface that facilitated catalyst loading. EDS elemental analysis (Fig. 4(e-1∼e-3)) corroborated the composition of ceramic fibers primarily as O, Al, and Si elements, consistent with XRF and XRD results. Fig. 4(f) demonstrated the well-dispersed catalyst loading on the surface of ST (4)-CFT (7.5) fibers, without any visible agglomeration or pore blocking. EDS elemental mapping (Fig. 4(f-1∼f-5)) revealed a uniform distribution of TiO2 carrier and α-Fe2O3 active components on the fiber surface and pores, resulting in a high exposure rate of active sites and ensuring excellent catalytic activity. 3.3.3 BET The pore structure parameters, N2 adsorption-desorption isotherm and pore size distribution of raw siderite, siderite (450), Sid (0.3)/TiO2 (450) and TiO2 (450) were shown in Table 4 and Fig. 5 . All samples exhibited type IV N2 adsorption-desorption isotherms and H4 hysteresis loops (Fig. 5(a)), indicated the presence of mesoporous properties [44,45]. Table 4 easily observed the specific surface area, pore size and pore volume of Siderite (450) (68.3 m2/g, 8.8 nm, 0.07 cm3/g) were much larger than Raw Siderite (13.9 m2/g, 3.3 nm, 0.04 cm3/g). Combined with TEM analysis, it was easily concluded that this change was mainly due to the decomposition of siderite after calcination, causing many cracks. This resulted in a larger specific surface area, pore size, and pore volume, facilitating active site dispersion and gas reactant adsorption and activation [25,31]. With TiO2 doping, the specific surface area of Sid (0.3)/TiO2 (450) (59.6 m2/g) decreased compared with Siderite (450) (68.3 m2/g) and TiO2 (450) (84.6 m2/g) (Table 4), which could be related to the coating of the porous structure by TiO2 [46]. However, it was worth noting that the denitrification performance of Sid (0.3)/TiO2 (450) was better than Siderite (450) and TiO2 (450), indicating that the denitrification performance of the catalyst was not solely dependent on the specific surface area [25,47]. 3.3.4 XPS The elemental composition and valence distribution of the catalyst were analyzed using XPS, and the XPS spectra for each sample were shown in Fig. 6 . In Fig. 6(a), Fe2p3/2 and Fe2p1/2 peaks were observed for Siderite (450) and Sid (0.3)/TiO2 (450) at 711.0 eV and 724.5 eV. Two peaks were fitted respectively, attributed to Fe2+ and Fe3+ [18,34]. It was noteworthy that the Fe2p3/2 binding energy of Sid (0.3)/TiO2 (450) was higher than that of Siderite (450). This indicated that the introduction of Ti changed the chemical environment of Fe species in Sid (0.3)/TiO2 (450) [28,36]. As can be seen from the atomic concentration calculation results in Table 5 , Fe3+/Fe in Sid (0.3)/TiO2 (450) (38.50 %) was higher than that in Siderite (450) (34.47 %). This showed an interaction between Fe-Ti, which could increase the Fe3+ content on the catalyst surface, and the surface acidity was improved, thus improving the denitrification effect of the catalyst [28,48]. In Fig. 6(b), the O1s spectra of all samples displayed two peaks, corresponding to surface adsorbed oxygen (Oα, 532 eV) and lattice oxygen (Oβ, 530 eV) [49]. It was commonly believed that Oα exhibited better migration and reactivity than Oβ, oxidized NO to NO2, and facilitated the rapid NH3-SCR reaction [50,51]. As shown in Table 5, it was found that Oα/O in Siderite (450) (78.81 %) was higher than that in Sid (0.3)/TiO2 (450) (43.94 %), but it showed a poor denitrification effect. This phenomenon could be because a high Oα content meant excessive oxidation ability, which caused rapid consumption of reducing agents and thus hindered the normal progress of the SCR reaction [49,52]. Fig. 6(c) showed that TiO2 (450) and Sid (0.3)/TiO2 (450) had two peaks observed at 465 eV and 459 eV, corresponding to Ti4+2p1/2 and Ti4+2p3/2, respectively [53]. 3.3.5 H2-TPR The oxidation–reduction property of the catalyst played a key role in the NH3-SCR reaction. Fig. 7 (a) showed the H2-TPR characterization results of Siderite (450) and Sid (0.3)/TiO2 (450). Combined with XRD and XPS analysis, all the reduction peaks in the samples were FeOx reduction peaks. The reduction peaks of Siderite (450) at 297 °C and 489 °C correspond to the reduction process of α-Fe2O3→Fe3O4→FeO [54]. Compared with Siderite (450), Sid (0.3)/TiO2 (450) showed significantly different continuous overlapping reduction peaks in the range of 280–560 °C. The interaction between Fe3+ and Ti4+ species caused the Sid (0.3)/TiO2 (450) catalyst to exhibit different reducibility than Siderite (450) [55,56]. It was because part of the Fe species in Sid (0.3)/TiO2 (450) coated by TiO2, H2 diffusion was difficult, and oxidation capacity was reduced [55]. 3.3.6 NH3-TPD In the E-R or l-H mechanism of the NH3-SCR reaction, the adsorption of NH3 at the acidic site was an important step [57]. The surface acid properties of the sample were analyzed with NH3-TPD (Fig. 7). According to the position of the NH3 desorption peak, the corresponding acid sites were divided into weak acid (Brønsted (B) acid, below 150 °C), medium-strong acid (150–300 °C), and strong acid (Lewis (L) acid, above 300 °C) [58]. Notably, the number of Brønsted and medium-strong acid sites of Sid (0.3)/TiO2 (450) increased significantly compared to Siderite (450) (Fig. 7(c)). This showed that the doping of TiO2 enhanced the overall acidity of the catalyst, led to the generation of more B acids and medium-strong acids, facilitated the adsorption and activation of reactants, and enabled the SCR reaction to occur at lower temperatures [27,56,59]. 3.3.7 Py-FTIR The Py-FTIR spectra of Siderite (450), TiO2 (450), and Sid (0.3)/TiO2 (450) were shown in Fig. 8 (a), (c) and (e). Bands near 1449 and 1611 cm−1 were adsorption of pyridine to L acid centers. 1540 and 1637 cm−1 were the adsorption bands of B acid centers, and 1489 cm−1 was the binding band of L acid and B acid centers [36,39,60]. Sid (0.3)/TiO2 (450) was easily observed to have similar Py-FTIR bands to Siderite (450) but with larger peak intensities and the presence of a new adsorption band of B acid center at 1637 cm−1. This change indicated that the introduction of TiO2 increased the total acid content of the catalyst and provided more B acid sites for the catalyst [28]. This was consistent with the acid content calculation results in Fig. 8(b), (d), (f) (TiO2 (450)>Sid (0.3)/TiO2 (450)> Siderite (450)). Higher total acid content and B/L value (B acid center number: L acid center number) tend to facilitate NH3 adsorption and activation and NH3-SCR reaction of catalysts at low temperatures [25,39,47]. 3.3.8 Mechanism discussion Based on the above results and analysis. The TEM-EDS spectra (Fig. 4(d)) indicated that the elements of O, Fe, and Ti were uniformly distributed on the surface of the Sid (0.3)/TiO2 (450) catalyst. Its large specific surface area and small pore size (Table 4) facilitated the interaction between the active site and the reactive gas molecules. XPS analysis demonstrated that the introduction of Ti had an impact on the point charge balance in the catalyst, resulting in a high ratio of Fe3+ and Oα in the Sid (0.3)/TiO2 (450) catalyst (Table 5), which contributed to the formation of oxygen vacancies and the \"fast SCR\" reaction. Due to the addition of Ti, the chemisorption capacity of the acid site on the catalyst surface was significantly enhanced (primarily from the enhancement of B acid), and more NH3 was adsorbed and activated, promoting the NH3-SCR reaction. 3.4 Industrial applications and toxicity testing 3.4.1 Impact of FV Fig. 9 (a) depicted the effect of FV on the NOx conversion efficiency and system pressure drop of ST (4)-CFT (7.5). As the FV decreased (1.5→0.6 m/min), the residence time of flue gas in the system was prolonged, and the optimal activity temperature of ST (4)-CFT (7.5) was expanded from 275∼375 °C to 250∼375 °C. Therefore, ST (4)-CFT (7.5) showed excellent denitrification performance at all FVs. In addition, in terms of pressure drop, the system's pressure drop increased with the FV at the same temperature. When FV was 1.5 m/min, the pressure drop of ST (4)-CFT (7.5) at 400 °C was 1.76 kpa, and when FV was reduced to 0.6 m/min, the pressure drop was 1.07 kPa. 3.4.2 Alkaline resistance testing Research showed that alkali metal deposition on the catalyst surface, combined with surface acid sites, decreased adsorption capacity, and significantly reduced the catalyst's activity [61]. Fig. 9(b) illustrated the impact of Na, K, and Ca on the denitrification activity of ST (4)-CFT (7.5) (Fig. 9(b-1)) and Sid (0.3)/TiO2 (450) (Fig. 9(b-2)). The results showed that the three alkali metals inhibited the activity of the catalyst in varying degrees, with a toxicity order of K > Na > Ca, which was consistent with the findings of Fang et al. [62] and Du et al. [63]. Within the optimal temperature range of 200∼400 °C, the average NOx conversion efficiency decreased by 4.84 %, 8.32 %, and 14.52 % for 2Ca-CFT, 2Na-CFT, and 2K-CFT, respectively. Among them, 2K-CFT exhibited the highest deactivation level due to its stronger alkalinity, resulting in more severe catalyst poisoning and the greatest reduction in catalytic activity [64]. In addition, it was easy to notice that the deactivation degree of the powder catalysts was higher after alkali metals toxicity. The average NOx conversion decreases by 17.84 %, 32.32 %, and 42.92 %, respectively, at 200∼400 °C. This change was mainly attributed to the unique fibrous structure of the CFT (Fig. 4(e)), which could effectively filter fly ash containing alkali metals [61,64]. The direct contact between harmful substances and the internal catalyst was prevented, which weakened the toxic effect [65]. 3.4.3 Impact of H2O and SO2 on ST (4)-CFT (7.5) The tolerance of ST (4)-CFT (7.5) to H2O (g) (10 vol.%) and SO2 (100 ppm) was investigated at 275 °C (Fig. 10 (a)). When H2O (g) or SO2 was added alone, the NOx conversion efficiency decreased rapidly and stabilized at 93.2 % and 92.2 %, respectively. When H2O (g) (or SO2) was turned off, the NOx conversion efficiency quickly recovered to 100 % and 98.5 %. In addition, in the presence of both H2O (g) and SO2, ST (4)-CFT (7.5) could still show a NOx conversion efficiency of more than 85 %. When it stopped the water and sulfur poisoning, the NO conversion returned to 91.8 %. These results demonstrated the excellent water and sulfur tolerance of ST (4)-CFT (7.5). Considering the XRD spectra before and after the water resistance test (Fig. 10(b)), no significant changes were observed, indicating that high-temperature water vapor did not cause irreversible damage to the compositional structure of ST (4)-CFT (7.5). The decrease in conversion efficiency could be attributed to the competitive adsorption effect of H2O (g), which led to a reduction in NH3 participating in the SCR reaction, and decreased the catalyst activity [36]. XPS was used to analyze the surface atomic concentration of ST (4)-CFT (7.5) before and after the sulfur resistance test (Fig. 10(c)). After the sulfur resistance test, the atomic concentration of N and S on the surface of the filter tube increased by 0.57 % and 0.59 %, respectively. This indicated that the reaction of SO2 and NH3 generated amorphous ammonium sulfate and deposited it on the surface of the catalyst, causing partial pore diameter blockage of the catalyst and reducing the denitrification effect [44,66]. After closing SO2, the ammonium sulfate was decomposed gradually at 275 °C, and the denitrification efficiency gradually recovered. When water and sulfur coexisted, the competitive adsorption effect of H2O (g) promoted the formation of ammonium sulfate salts. This conclusion was verified by the further increase of the surface N (0.83 %) and S (0.77 %) element concentrations of ST (4)-CFT (7.5) (H2O+SO2) in Fig. 10(c), and the NOx conversion efficiency was further reduced. 3.4.4 Stability operation testing Based on the previous experimental tests, ST (4)-CFT (7.5) exhibited excellent catalytic activity and a wide temperature window. However, stability operation testing was conducted to assess its value for industrial applications. Fig. 11 depicted the stability of ST (4)-CFT (7.5) at NOx conversion rates of 100 % (T100: 275 °C), 80 % (T80: 215 °C), and 60 % (T60: 185 °C). Under T100, the NOx conversion rate of ST (4)-CFT (7.5) started to decline after 7 h of stable operation, and eventually stabilized at over 90 %, meeting the requirements for industrial applications. This indicated that ST (4)-CFT (7.5) had considerable industrial application value and stability. It was also noted that the stability of ST (4)-CFT (7.5) improved as the NOx conversion decreased. At T80, the NOx conversion rate began to decline slowly after 21 h of stable operation of ST (4)-CFT (7.5). In contrast, T60 demonstrated greater stability, with only a slight decrease throughout the test interval. 4 Conclusion (1) When the mass ratio of Siderite was 0.3, and the calcination temperature was 450 °C, the Sid (0.3)/TiO2 (450) catalyst represented more than 95 % NOx conversion efficiency and more than 90 % N2 selectivity at reaction temperature ranging from 275 to 350 °C. (2) Under the conditions of a catalyst particle size (d50) of 5.3 μm, loading rate of 21.6 wt%, and FV of 1.5 m/min, ST(4)-CFT(7.5) achieved 100 % NOx conversion efficiency at reaction temperature ranging from 275 to 375 °C. Furthermore, it exhibited exceptional resistance to water, sulfur, and alkali as well as stability. (3) TiO2 facilitated the dispersion of the active component α-Fe2O3, and enhanced the SCR activity of the catalyst. The synergistic effect between Fe and Ti species modified the reducibility of the catalyst, increased the total acid content, and improved the proportion of Brønsted acid, thereby benefiting low-temperature catalytic activity. CRediT authorship contribution statement Kai Qin: Writing – original draft, Visualization, Methodology, Investigation, Formal analysis, Data curation, Conceptualization. Yuting Hu: Validation, Methodology, Investigation, Formal analysis. Taotao Liu: Validation, Methodology, Funding acquisition. Henjian Zhang: Visualization, Funding acquisition. Bin Wang: Resources. Liming Qian: Resources. Chengzhu Zhu: Writing – review & editing, Validation, Supervision, Resources, Project administration, Methodology, Funding acquisition, Conceptualization. Declaration of competing interest The authors declare that, they have no known competing financial interests or personal relationships that could have appeared to influence the work reported in this paper. Acknowledgments This work was financially supported by Anhui provincial environmental protection research project (2023hb0005). References [1] Y. Wu X. Zhou J. Zhou A comprehensive review of the heavy metal issues regarding commercial vanadium/titanium-based SCR catalyst Sci. Total Environ. 857 2023 159712 10.1016/j.scitotenv. 2022.159712 Wu Y., Zhou X., Zhou J., et al. A comprehensive review of the heavy metal issues regarding commercial vanadium/titanium-based SCR catalyst. Sci. Total Environ. 857 (2023) 159712, https://doi.org/10.1016/j.scitotenv. 2022.159712. [2] Y. Jia J. Jiang R. Zheng Insight into the reaction mechanism over PMoA for low-temperature NH3-SCR: a combined In-situ DRIFTs and DFT transition state calculations J. Hazard. Mater. 412 2021 125258 10.1016/j.jhazmat.2021.125258 Jia Y., Jiang J., Zheng R., et al. Insight into the reaction mechanism over PMoA for low-temperature NH3-SCR: a combined In-situ DRIFTs and DFT transition state calculations. J. Hazard. Mater. 412 (2021) 125258, https://doi.org/10.1016/j.jhazmat.2021.125258. [3] W. Zhao K. Zhang L. Wu Ti3+ doped V2O5/TiO2 catalyst for efficient selective catalytic reduction of NOx with NH3 J. Colloid Interface Sci. 581 2021 76 83 10.1016/j.jcis.2020.07.131 Zhao W., Zhang K., Wu L., et al. Ti3+ doped V2O5/TiO2 catalyst for efficient selective catalytic reduction of NOx with NH3. J. Colloid Interface Sci. 581 (2021) 76–83, https://doi.org/10.1016/j.jcis.2020.07.131. [4] Z. Tan G. Niu Q. Qi Ultralow emission of Dust, SOx, HCl, and NOx using a ceramic catalytic filter tube Energy Fuels 34 2020 4173 4182 10.1021/acs.energyfuels.9b04480 Tan Z., Niu G., Qi Q., et al. Ultralow emission of Dust, SOx, HCl, and NOx using a ceramic catalytic filter tube. Energy Fuels 34 (2020) 4173–4182, https://doi.org/10.1021/acs.energyfuels.9b04480. [5] Y. Song Y. Zhang Q. Wu Experimental study on the desulfurization, denitration, and dust removal characteristics of ceramic fiber filter tubes Energy Fuels 36 2022 3715 3726 10.1021/acs.energyfuels.1c04342 Song Y., Zhang Y., Wu Q., et al. Experimental study on the desulfurization, denitration, and dust removal characteristics of ceramic fiber filter tubes. Energy Fuels 36 (2022) 3715–3726, https://doi.org/10.1021/acs.energyfuels.1c04342. [6] J. Chen Z. Zhong Y. Xia Recent developments on catalytic membranes for gas cleaning Chin. J. Chem. Eng. 27 2019 1391 1402 10.1016/j.cjche.2019.02.001 Chen J., Zhong Z., Xia Y., et al. Recent developments on catalytic membranes for gas cleaning. Chin. J. Chem. Eng. 27 (2019) 1391–1402, https://doi.org/10.1016/j.cjche.2019.02.001. [7] L. Miao X. Wu Z. Ji Microwave-assisted preparation of porous fibrous ceramic-based catalytic filter elements for the simultaneous removal of NO and dust from high-temperature gases Sep. Purif. Technol. 278 2021 119549 10.1016/j.seppur.2021.119549 Miao L., Wu X., Ji Z., et al. Microwave-assisted preparation of porous fibrous ceramic-based catalytic filter elements for the simultaneous removal of NO and dust from high-temperature gases. Sep. Purif. Technol. 278 (2021) 119549, https://doi.org/10.1016/j.seppur.2021.119549. [8] J.H. Kim J.H. Choi A.D. Phule Development of high-performance catalytic filter of V2O5-WO3/TiO2 supported-SiC for NOx reduction Powder Technol. 327 2018 282 290 10.1016/j.powtec.2017.12.081 Kim J.H., Choi J.H., Phule A.D., et al. Development of high-performance catalytic filter of V2O5-WO3/TiO2 supported-SiC for NOx reduction. Powder Technol. 327 (2018) 282–290, https://doi.org/10.1016/j.powtec.2017.12.081. [9] B. Pan J. Chen F. Zhang Porous TiO2 aerogel-modified SiC ceramic membrane supported MnOx catalyst for simultaneous removal of NO and dust J. Memb. Sci. 611 2020 118366 10.1016/j.memsci.2020.118366 Pan B., Chen J., Zhang F., et al. Porous TiO2 aerogel-modified SiC ceramic membrane supported MnOx catalyst for simultaneous removal of NO and dust. J. Memb. Sci. 611 (2020) 118366, https://doi.org/10.1016/j.memsci.2020.118366. [10] L. Shan R. Yin J. Xiao Simultaneous removal of NOx and dust with integrated catalytic filter: interactions between NH3-SCR and filtration processes Chem. Eng. J. 458 2023 141466 10.1016/j.cej.2023 141466 Shan L., Yin R., Xiao J., et al. Simultaneous removal of NOx and dust with integrated catalytic filter: interactions between NH3-SCR and filtration processes. Chem. Eng. J. 458 (2023) 141466, https://doi.org/10.1016/j.cej.2023. 141466. [11] X. Duan Y. Lv J. Hong A multifunctional tube reactor for catalytic oxidization of dioxins and its pilot-scale application Process Saf. Environ. Prot. 181 2024 334 342 10.1016/j.psep 2023.11.039 Duan X., Lv Y., Hong J., et al. A multifunctional tube reactor for catalytic oxidization of dioxins and its pilot-scale application. Process Saf. Environ. Prot. 181 (2024) 334–342, https://doi.org/10.1016/j.psep. 2023.11.039. [12] L. Han S. Cai M. Gao Selective catalytic reduction of NOx with NH3 by using novel catalysts: state of the art and future prospects Chem. Rev. 119 2019 10916 10976 10.1021/acs.chemrev.9b00202 Han L., Cai S., Gao M., et al. Selective catalytic reduction of NOx with NH3 by using novel catalysts: state of the art and future prospects. Chem. Rev. 119 (2019) 10916–10976, https://doi.org/10.1021/acs.chemrev.9b00202. [13] Y. Inomata S. Hata M. Mino Bulk vanadium oxide versus conventional V2O5/TiO2: NH3-SCR catalysts working at a low temperature below 150 °C ACS Catal. 9 2019 9327 9331 10.1021/acscatal.9b02695 Inomata Y., Hata S., Mino M., et al. Bulk vanadium oxide versus conventional V2O5/TiO2: NH3-SCR catalysts working at a low temperature below 150 °C. ACS Catal. 9 (2019) 9327–9331, https://doi.org/10.1021/acscatal.9b02695. [14] J. Chen R. Yin G. Chen Selective capture of TiO2 from flue gas with formation of p-n junction on V2O5-WO3/TiO2 catalyst under working conditions Green Energy Environ. 8 2023 4 9 10.1016/j.gee. 2021.12.001 Chen J., Yin R., Chen G., et al. Selective capture of TiO2 from flue gas with formation of p-n junction on V2O5-WO3/TiO2 catalyst under working conditions. Green Energy Environ. 8 (2023) 4–9, https://doi.org/10.1016/j.gee. 2021.12.001. [15] X. Mou B. Zhang Y. Li Rod-shaped Fe2O3 as an efficient catalyst for the selective reduction of nitrogen oxide by ammonia Angew. Chem. Int. Ed. 51 2012 2989 2993 10.1002/anie. 2011.07.113 Mou X., Zhang B., Li Y., et al. Rod-shaped Fe2O3 as an efficient catalyst for the selective reduction of nitrogen oxide by ammonia. Angew. Chem. Int. Ed. 51 (2012) 2989–2993, https://doi.org/10.1002/anie. 2011.07.113. [16] C. Liu S. Yang L. Ma Comparison on the performance of α-Fe2O3 and γ-Fe2O3 for selective catalytic reduction of nitrogen oxides with ammonia Catal. Lett. 143 2013 697 704 10.1007/s10562-013-1017-3 Liu C., Yang S., Ma L., et al. Comparison on the performance of α-Fe2O3 and γ-Fe2O3 for selective catalytic reduction of nitrogen oxides with ammonia. Catal. Lett. 143 (2013) 697–704, https://doi.org/10.1007/s10562-013-1017-3. [17] X. Yang B. Li L. Sun Effect of surface structure of α-Fe2O3 on the selective catalytic reduction of NO by NH3 Acta Phys. Chim. Sin. 28 2012 184 188 10.3866/pku.whxb.2011.11.162 Yang X., Li B., Sun L., et al. Effect of surface structure of α-Fe2O3 on the selective catalytic reduction of NO by NH3. Acta Phys. Chim. Sin. 28 (2012) 184–188, https://doi.org/10.3866/pku.whxb.2011.11.162. [18] Y. Zhang S. Yang X. Zhu Effects of sulfation on hematite for selective catalytic reduction of nitrogen oxides with ammonia J. Colloid Interface Sci. 606 2022 1445 1456 10.1016/j.jcis. 2021.08.088 Zhang Y., Yang S., Zhu X., et al. Effects of sulfation on hematite for selective catalytic reduction of nitrogen oxides with ammonia. J. Colloid Interface Sci. 606 (2022) 1445–1456, https://doi.org/10.1016/j.jcis. 2021.08.088. [19] Y. Du X. Wu L. Liu Low-temperature NH3 selective catalytic reduction performance enhancement of Fe-based oxides by employing carbon nanotubes to decorate the MgFe-LDH Chem. Sel. 8 2023 e202203767 10.1002/slct.202203767 Du Y., Wu X., Liu L., et al. Low-temperature NH3 selective catalytic reduction performance enhancement of Fe-based oxides by employing carbon nanotubes to decorate the MgFe-LDH. Chem. Sel. 8 (2023) e202203767, https://doi.org/10.1002/slct.202203767. [20] M. Gao G. He W. Zhang Reaction pathways of the selective catalytic reduction of NO with NH3 on the alpha-Fe2O3(012) surface: a combined experimental and DFT study Environ. Sci. Technol. 55 2021 10967 10974 10.1021/acs.est.1c01628 Gao M., He G., Zhang W., et al. Reaction pathways of the selective catalytic reduction of NO with NH3 on the alpha-Fe2O3(012) surface: a combined experimental and DFT study. Environ. Sci. Technol. 55 (2021) 10967–10974, https://doi.org/10.1021/acs.est.1c01628. [21] Q. Li H. Liu T. Chen NH3-SCR performance of nano-α-Fe2O3 derived from thermally treated Siderite Acta Sci. Circumst. 37 2017 2482 2489 10.13671/j.hjkxxb.2017.0083 Li Q., Liu H., Chen T., et al. NH3-SCR performance of nano-α-Fe2O3 derived from thermally treated Siderite.Acta Sci. Circumst. 37 (2017) 2482–2489, https://doi.org/10.13671/j.hjkxxb.2017.0083. [22] F. Sun H. Liu D. Shu The characterization and SCR performance of Mn-Containing α-Fe2O3 derived from the decomposition of Siderite Minerals 9 2019 393 10.3390/min.9070393 Sun F., Liu H., Shu D., et al. The characterization and SCR performance of Mn-Containing α-Fe2O3 derived from the decomposition of Siderite. Minerals 9 (2019) 393, https://doi.org/10.3390/min.9070393. [23] Y. Wei K. Gui X. Liu Performance of Mn-Ce co-doped Siderite catalysts in the selective catalytic reduction of NO by NH3 J. Fuel Chem. Technol. 47 2019 1495 1503 10.1016/s1872-5813(19)30061-1 Wei Y., Gui K., Liu X., et al. Performance of Mn-Ce co-doped Siderite catalysts in the selective catalytic reduction of NO by NH3. J. Fuel Chem. Technol. 47 (2019) 1495–1503, https://doi.org/10.1016/s1872-5813(19)30061-1. [24] G. Yao Y. Wei K. Gui Catalytic performance and reaction mechanisms of NO removal with NH3 at low and medium temperatures on Mn-W-Sb modified Siderite catalysts J. Environ. Sci. 115 2022 126 139 10.1016/j.jes.2021.06.029 Yao G., Wei Y., Gui K., et al. Catalytic performance and reaction mechanisms of NO removal with NH3 at low and medium temperatures on Mn-W-Sb modified Siderite catalysts. J. Environ. Sci. 115 (2022) 126–139, https://doi.org/10.1016/j.jes.2021.06.029. [25] J. Chen B. Zhu W. Song Catalytic performance of calcined Fe2O3/CA catalyst for NH3-SCR reaction: role of activation temperature J. Solid State Chem. 316 2022 123630 10.1016/j.jssc.2022.123630 Chen J., Zhu B., Song W., et al. Catalytic performance of calcined Fe2O3/CA catalyst for NH3-SCR reaction: role of activation temperature. J. Solid State Chem. 316 (2022) 123630, https://doi.org/10.1016/j.jssc.2022.123630. [26] J. Xu H. Shen X. Zhou Enhancement low-temperature NH3-SCR activity of the Fe-Mn-Mo/TiO2 catalyst and its DFT calculations and kinetics Mol. Catal. 551 2023 113657 10.1016/j.mcat.2023.113657 Xu J., Shen H., Zhou X., et al. Enhancement low-temperature NH3-SCR activity of the Fe-Mn-Mo/TiO2 catalyst and its DFT calculations and kinetics. Mol. Catal. 551 (2023) 113657, https://doi.org/10.1016/j.mcat.2023.113657. [27] W. Qu X. Liu J. Chen Single-atom catalysts reveal the dinuclear characteristic of active sites in NO selective reduction with NH3 Nat. Commun. 11 2020 1532 10.1038/s41467-020-15261-5 Qu W., Liu X., Chen J., et al. Single-atom catalysts reveal the dinuclear characteristic of active sites in NO selective reduction with NH3. Nat. Commun. 11 (2020) 1532, https://doi.org/10.1038/s41467-020-15261-5. [28] S. Ma X. Zhao Y. Li Effect of W on the acidity and redox performance of the Cu0.02Fe0.2WTiOx (a=0.01, 0.02, 0.03) catalysts for NH3-SCR of NO Appl. Catal. B: Environ. 248 2019 226 238 10.1016/j.apcatb. 2019.02.015 Ma S., Zhao X., Li Y., et al. Effect of W on the acidity and redox performance of the Cu0.02Fe0.2WTiOx (a=0.01, 0.02, 0.03) catalysts for NH3-SCR of NO. Appl. Catal. B: Environ. 248 (2019) 226–238, https://doi.org/10.1016/j.apcatb. 2019.02.015. [29] S.S.R. Putluru L. Schill A.D. Jensen Mn/TiO2 and Mn-Fe/TiO2 catalysts synthesized by deposition precipitation-promising for selective catalytic reduction of NO with NH3 at low temperatures Appl. Catal. B: Environ. 165 2015 628 635 10.1016/j.apcatb. 2014.10.060 Putluru S.S.R., Schill L., Jensen A.D., et al. Mn/TiO2 and Mn-Fe/TiO2 catalysts synthesized by deposition precipitation-promising for selective catalytic reduction of NO with NH3 at low temperatures. Appl. Catal. B: Environ. 165 (2015) 628–635, https://doi.org/10.1016/j.apcatb. 2014.10.060. [30] S. Yang C. Wang J. Li Low temperature selective catalytic reduction of NO with NH3 over Mn-Fe spinel: performance, mechanism and kinetic study Appl. Catal. B: Environ. 110 2011 71 80 10.1016/j.apcatb.2011.08.027 Yang S., Wang C., Li J., et al. Low temperature selective catalytic reduction of NO with NH3 over Mn-Fe spinel: performance, mechanism and kinetic study. Appl. Catal. B: Environ. 110 (2011) 71–80, https://doi.org/10.1016/j.apcatb.2011.08.027. [31] C. Liu Y. Bi H. Wang Promotional effects on NH3-SCR performance of CeO2-SnO2 catalysts doped by TiO2: a mechanism study Catal. Surv. Asia 25 2021 48 57 10.1007/s10563-020-09318-0 Liu C., Bi Y., Wang H., et al. Promotional effects on NH3-SCR performance of CeO2-SnO2 catalysts doped by TiO2: a mechanism study. Catal. Surv. Asia 25 (2021) 48–57, https://doi.org/10.1007/s10563-020-09318-0. [32] L. Yuan P. Hu B. Hu Metallic and non-metallic components and morphology of iron-based catalytic effects for selective catalytic reduction performance: a systematic review Mol. Catal. 541 2023 113113 10.1016/j.mcat.2023.113113 Yuan L., Hu P., Hu B., et al. Metallic and non-metallic components and morphology of iron-based catalytic effects for selective catalytic reduction performance: a systematic review. Mol. Catal. 541 (2023) 113113, https://doi.org/10.1016/j.mcat.2023.113113. [33] C. Gao J. Shi Z. Fan Sulfur and water resistance of mn-based catalysts for low-temperature selective catalytic reduction of NOx: a review Catalysts 8 2018 11 39 10.3390/catal8010011 Gao C., Shi J., Fan Z., et al. Sulfur and water resistance of mn-based catalysts for low-temperature selective catalytic reduction of NOx: a review. Catalysts. 8 (2018) 11–39, https://doi.org/10.3390/catal8010011. [34] D. Shu H. Liu T. Chen The positive effect of siderite-derived α-Fe2O3 during coaling on the NO behavior in the presence of NH3 Environ. Sci. Pollut. Res. 27 2020 12376 12385 10.1007/s11356-020-07829-x Shu D., Liu H., Chen T., et al. The positive effect of siderite-derived α-Fe2O3 during coaling on the NO behavior in the presence of NH3. Environ. Sci. Pollut. Res. 27 (2020) 12376–12385, https://doi.org/10.1007/s11356-020-07829-x. [35] H. Zhou T. Cheng B. Du Ce(SO4)2/α-Fe2O3 selective catalytic reduction of NOx with NH3: preparation, characterization, and performance Environ. Sci. Pollut. Res. 29 2022 84421 84433 10.1007/s11356-022-21748-z Zhou H., Cheng T., Du B., et al. Ce(SO4)2/α-Fe2O3 selective catalytic reduction of NOx with NH3: preparation, characterization, and performance. Environ. Sci. Pollut. Res. 29 (2022) 84421–84433, https://doi.org/10.1007/s11356-022-21748-z. [36] T. Cheng B. Du H. Zhou Tungsten modified natural limonite catalyst for efficient low-temperature selective catalytic reduction of NO removal with NH3: preparation and characterization Environ. Sci. Pollut. Res. 30 2022 36294 36310 10.1007/s11356-022-24755-2 Cheng T., Du B., Zhou H., et al. Tungsten modified natural limonite catalyst for efficient low-temperature selective catalytic reduction of NO removal with NH3: preparation and characterization. Environ. Sci. Pollut. Res. 30 (2022) 36294–36310, https://doi.org/10.1007/s11356-022-24755-2. [37] L. Zhao K. Li R. Wu Catalytic filter for the removal of dust and NOx at low temperatures Mater. Res. Express. 7 2020 125502 10.1088/2053-1591/abc71e Zhao L., Li K., Wu R., et al. Catalytic filter for the removal of dust and NOx at low temperatures. Mater. Res. Express. 7 (2020) 125502, https://doi.org/10.1088/2053-1591/abc71e. [38] T. Boningari R. Koirala P.G. Smirniotis Low-temperature catalytic reduction of NO by NH3 over vanadia-based nanoparticles prepared by flame-assisted spray pyrolysis: influence of various supports Appl. Catal. B: Environ. 140-141 2013 289 298 10.1016/j.apcatb.2013.04.033 Boningari T., Koirala R., Smirniotis P.G., et al. Low-temperature catalytic reduction of NO by NH3 over vanadia-based nanoparticles prepared by flame-assisted spray pyrolysis: influence of various supports. Appl. Catal. B: Environ. 140-141 (2013) 289–298, https://doi.org/10.1016/j.apcatb.2013.04.033. [39] N.A.S. Ramli N.A.S. Amin Fe/HY zeolite as an effective catalyst for levulinic acid production from glucose: characterization and catalytic performance Appl. Catal. B: Environ. 163 2015 487 498 10.1016/j.apcatb.2014.08.031 Ramli N.A.S., Amin N.A.S. Fe/HY zeolite as an effective catalyst for levulinic acid production from glucose: characterization and catalytic performance. Appl. Catal. B: Environ. 163 (2015) 487–498, https://doi.org/10.1016/j.apcatb.2014.08.031. [40] Y. Xiang Y. Zhu J. Lu Co3O4/α-Fe2O3 catalyzed oxidative degradation of gaseous benzene: preparation, characterization and its catalytic properties Solid State Sci. 93 2019 79 86 10.1016/j.solidstatesciences. 2019.05.008 Xiang Y., Zhu Y., Lu J., et al. Co3O4/α-Fe2O3 catalyzed oxidative degradation of gaseous benzene: preparation, characterization and its catalytic properties. Solid State Sci. 93 (2019) 79–86, https://doi.org/10.1016/j.solidstatesciences. 2019.05.008. [41] H. Liu T. Chen X. Zou Thermal treatment of natural goethite: thermal transformation and physical properties Thermo Chim. Acta 568 2013 115 121 10.1016/j.tca.2013.06.027 Liu H., Chen T., Zou X., et al. Thermal treatment of natural goethite: thermal transformation and physical properties. Thermo Chim. Acta 568 (2013) 115–121, https://doi.org/10.1016/j.tca.2013.06.027. [42] Y. Yang X. Liu Z. Sui Support effects on the dispersion and interaction of Ce and W species for NH3-SCR Mol. Catal. 524 2022 112284 10.1016/j.mcat.2022.112284 Yang Y., Liu X., Sui Z., et al. Support effects on the dispersion and interaction of Ce and W species for NH3-SCR. Mol. Catal. 524 (2022) 112284, https://doi.org/10.1016/j.mcat.2022.112284. [43] B. Xing T. Chen C. Qing Structural characteristic of natural Siderite during thermal treatment J. Chin. Ceram. Soc. 44 2016 1207 1212 10.14062/j.issn.0454-5648.2016.08.18 Xing B., Chen T., Qing C., et al. Structural characteristic of natural Siderite during thermal treatment. J. Chin. Ceram. Soc. 44 (2016) 1207–1212, https://doi.org/10.14062/j.issn.0454-5648.2016.08.18. [44] Y. Mao S. Xu H. Wang Ordered mesoporous phosphotungstate nanostructure loading dispersed iron oxide as a promising NH3-SCR catalyst: synergistic effect of redox sites and acid centers Sep. Purif. Technol. 333 2024 125879 10.1016/j.seppur.2023.125879 Mao Y., Xu S., Wang H., et al. Ordered mesoporous phosphotungstate nanostructure loading dispersed iron oxide as a promising NH3-SCR catalyst: synergistic effect of redox sites and acid centers. Sep. Purif. Technol. 333 (2024) 125879, https://doi.org/10.1016/j.seppur.2023.125879. [45] Y. Mu X. Huang Z. Tang Ordered mesoporous TiO2 framework confined CeSn catalyst exhibiting excellent high activity for selective catalytic reduction of NO with NH3 at low temperature Chem. Eng. J. 454 2023 140181 10.1016/j.cej.2022.140181 Mu Y., Huang X., Tang Z., et al. Ordered mesoporous TiO2 framework confined CeSn catalyst exhibiting excellent high activity for selective catalytic reduction of NO with NH3 at low temperature. Chem. Eng. J. 454 (2023) 140181, https://doi.org/10.1016/j.cej.2022.140181. [46] X. Wu C. Yu G. Dai Significant enhanced SO2 resistance of Ce-doped OMS-2 catalyst by building the CeO2 shell for the low-temperature SCR of NO with NH3 Mol. Catal. 557 2024 113960 10.1016/j.mcat. 2024.113960 Wu X., Yu C., Dai G., et al. Significant enhanced SO2 resistance of Ce-doped OMS-2 catalyst by building the CeO2 shell for the low-temperature SCR of NO with NH3. Mol. Catal. 557 (2024) 113960, https://doi.org/10.1016/j.mcat. 2024.113960. [47] C. Chang Z. Yan C. Zhang Design of Ca-type todorokite catalysts with highly active for the selective reduction of NOx by NH3 at low temperatures J. Environ. Sci. 138 2024 697 708 10.1016/j.jes.2023.04.025 Chang C., Yan Z., Zhang C., et al. Design of Ca-type todorokite catalysts with highly active for the selective reduction of NOx by NH3 at low temperatures. J. Environ. Sci. 138 (2024) 697–708, https://doi.org/10.1016/j.jes.2023.04.025. [48] S. Dong H. Wang T. Zhu High-performance Fe-Cu composite oxide for selective catalytic reduction of NOx with NH3: driving of Cu on α-Fe2O3 J. Environ. Chem. Eng. 10 2022 108481 10.1016/j.jece.2022.108481 Dong S., Wang H., Zhu T., et al. High-performance Fe-Cu composite oxide for selective catalytic reduction of NOx with NH3: driving of Cu on α-Fe2O3. J. Environ. Chem. Eng. 10 (2022) 108481, https://doi.org/10.1016/j.jece.2022.108481. [49] H. Hu S. Cai H. Li Mechanistic aspects of deNOx processing over TiO2 supported Co-Mn oxide catalysts: structure-activity relationships and in situ DRIFTs analysis ACS Catal. 5 2015 6069 6077 10.1021/acscatal.5b01039 Hu H., Cai S., Li H., et al. Mechanistic aspects of deNOx processing over TiO2 supported Co-Mn oxide catalysts: structure-activity relationships and in situ DRIFTs analysis. ACS Catal. 5 (2015) 6069–6077, https://doi.org/10.1021/acscatal.5b01039. [50] F. Gao X. Tang H. Yi Promotional mechanisms of activity and SO2 tolerance of Co- or Ni-doped MnOx-CeO2 catalysts for SCR of NOx with NH3 at low temperature Chem. Eng. J. 317 2017 20 31 10.1016/j.cej.2017.02.042 Gao F., Tang X., Yi H., et al. Promotional mechanisms of activity and SO2 tolerance of Co- or Ni-doped MnOx-CeO2 catalysts for SCR of NOx with NH3 at low temperature. Chem. Eng. J. 317 (2017) 20–31, https://doi.org/10.1016/j.cej.2017.02.042. [51] Y. Xing H. Zhang W. Su Mineral-derived catalysts optimized for selective catalytic reduction of NOx with NH3 J. Clean. Prod. 289 2021 125756 10.1016/j.jclepro.2020.125756 Xing Y., Zhang H., Su W., et al. Mineral-derived catalysts optimized for selective catalytic reduction of NOx with NH3. J. Clean. Prod. 289 (2021) 125756, https://doi.org/10.1016/j.jclepro.2020.125756. [52] X. Fang Y. Liu L. Chen Influence of surface active groups on SO2 resistance of birnessite for low-temperature NH3-SCR Chem. Eng. J. 399 2020 125798 10.1016/j.cej.2020.125798 Fang X., Liu Y., Chen L., et al. Influence of surface active groups on SO2 resistance of birnessite for low-temperature NH3-SCR. Chem. Eng. J. 399 (2020) 125798, https://doi.org/10.1016/j.cej.2020.125798. [53] s Yang J. Li C. Wang Fe-Ti spinel for the selective catalytic reduction of NO with NH3: mechanism and structure-activity relationship Appl. Catal. B: Environ. 117-118 2012 73 80 10.1016/j.apcatb. 2012.01. 001 Yang s, Li J., Wang C., et al. Fe-Ti spinel for the selective catalytic reduction of NO with NH3: mechanism and structure-activity relationship. Appl. Catal. B: Environ. 117-118 (2012) 73–80, https://doi.org/10.1016/j.apcatb. 2012.01. 001. [54] X. Wei Y. Zhou Y. Li Polymorphous transformation of rod-shaped iron oxides and their catalytic properties in selective reduction of NO by NH3 RSC Adv. 5 2015 66141 66146 10.1039/c5ra08254d Wei X., Zhou Y., Li Y., et al. Polymorphous transformation of rod-shaped iron oxides and their catalytic properties in selective reduction of NO by NH3. RSC Adv. 5 (2015) 66141–66146, https://doi.org/10.1039/c5ra08254d. [55] F. Liu H. He C. Zhang Selective catalytic reduction of NO with NH3 over iron titanate catalyst: catalytic performance and characterization Appl. Catal. B: Environ. 96 2010 408 420 10.1016/j.apcatb. 2010.02.038 Liu F., He H., Zhang C., et al. Selective catalytic reduction of NO with NH3 over iron titanate catalyst: catalytic performance and characterization. Appl. Catal. B: Environ. 96 (2010) 408–420, https://doi.org/10.1016/j.apcatb. 2010.02.038. [56] L. Song K. Ma W. Tian An environmentally friendly FeTiSOx catalyst with a broad operation-temperature window for the NH3-SCR of NOx AIChE J. 65 2019 e16684 10.1002/aic.16684 Song L., Ma K., Tian W., et al. An environmentally friendly FeTiSOx catalyst with a broad operation-temperature window for the NH3-SCR of NOx. AIChE J. 65 (2019) e16684, https://doi.org/10.1002/aic.16684. [57] C. Liu J. Shi C. Gao Manganese oxide-based catalysts for low-temperature selective catalytic reduction of NOx with NH3: a review Appl. Catal. A: Gen. 522 2016 54 69 10.1016/j.apcata.2016.04.023 Liu C., Shi J., Gao C., et al. Manganese oxide-based catalysts for low-temperature selective catalytic reduction of NOx with NH3: a review. Appl. Catal. A: Gen. 522 (2016) 54–69, https://doi.org/10.1016/j.apcata.2016.04.023. [58] C. Li Z. Xiong J. He Influence of ignition atmosphere on the structural properties of magnetic iron oxides synthesized via solution combustion and the NH3-SCR activity of W/Fe2O3 catalyst Appl. Catal. A: Gen. 602 2020 117726 10.1016/j.apcata.2020.117726 Li C., Xiong Z., He J., et al. Influence of ignition atmosphere on the structural properties of magnetic iron oxides synthesized via solution combustion and the NH3-SCR activity of W/Fe2O3 catalyst. Appl. Catal. A: Gen. 602 (2020) 117726, https://doi.org/10.1016/j.apcata.2020.117726. [59] F. Liu H. He C. Zhang Mechanism of the selective catalytic reduction of NOx with NH3 over environmental-friendly iron titanate catalyst Catal. Today 175 2011 18 25 10.1016/j.cattod.2011.02.049 Liu F., He H., Zhang C., et al. Mechanism of the selective catalytic reduction of NOx with NH3 over environmental-friendly iron titanate catalyst. Catal. Today 175 (2011) 18–25, https://doi.org/10.1016/j.cattod.2011.02.049. [60] J. Xie J. Cheng J. Peng A tandem catalysis for isoindolinone synthesis over single-atom Pd/TiO2 catalyst Angew. Chem. 2024 e202415203 10.1002/anie.202415203 Xie J., Cheng J., Peng J., et al. A tandem catalysis for isoindolinone synthesis over single-atom Pd/TiO2 catalyst. Angew. Chem. (2024), e202415203, https://doi.org/10.1002/anie.202415203. [61] S. Dong H. Wang L. Gong Poisoning mechanism of alkali metal on Cu-Fe2O3 catalyst for selective catalytic reduction of NO with NH3 Surf. Interfaces 35 2022 102411 10.1016/j.surfin.2022.102411 Dong S., Wang H., Gong L., et al. Poisoning mechanism of alkali metal on Cu-Fe2O3 catalyst for selective catalytic reduction of NO with NH3. Surf. Interfaces. 35 (2022) 102411, https://doi.org/10.1016/j.surfin.2022.102411. [62] D. Fang F. He J. Xie Characterization and performance of common alkali metals and alkaline earth metals loaded Mn/TiO2 catalysts for NOx removal with NH3 J. Energy Inst. 92 2019 319 331 10.1016/j.joei.2018.01.004 Fang D., He F., Xie J., et al. Characterization and performance of common alkali metals and alkaline earth metals loaded Mn/TiO2 catalysts for NOx removal with NH3. J. Energy Inst. 92 (2019) 319–331, https://doi.org/10.1016/j.joei.2018.01.004. [63] X. Du G. Yang Y. Chen The different poisoning behaviors of various alkali metal-containing compounds on SCR catalyst Appl. Surf. Sci. 392 2017 162 168 10.1016/j.apsusc.2016.09.036 Du X., Yang G., Chen Y., et al. The different poisoning behaviors of various alkali metal-containing compounds on SCR catalyst. Appl. Surf. Sci. 392 (2017) 162–168, https://doi.org/10.1016/j.apsusc.2016.09.036. [64] L. Chen J. Li M. Ge The poisoning effect of alkali metals doping over nano V2O5-WO3/TiO2 catalysts on selective catalytic reduction of NOx by NH3 Chem. Eng. J. 170 2011 531 537 10.1016/j.cej.2010.11.020 Chen L., Li J., Ge M., et al. The poisoning effect of alkali metals doping over nano V2O5-WO3/TiO2 catalysts on selective catalytic reduction of NOx by NH3. Chem. Eng. J. 170 (2011) 531–537, https://doi.org/10.1016/j.cej.2010.11.020. [65] J. Li J. Li Optimization analysis and application of flue gas purification system for hazardous waste incineration Eng. Constr. 52 2020 68 73 10.13402/j.gcjs.2020.01.013 Li J., Li J. Optimization analysis and application of flue gas purification system for hazardous waste incineration. Eng. Constr. 52 (2020) 68–73, https://doi.org/10.13402/j.gcjs.2020.01.013. [66] Y. Yu W. Tan D. An Insight into the SO2 resistance mechanism on γ-Fe2O3 catalyst in NH3-SCR reaction: a collaborated experimental and DFT study Appl. Catal. B: Environ. 281 2021 119544 10.1016/j.apcatb.2020.119544 Yu Y., Tan W., An D., et al. Insight into the SO2 resistance mechanism on γ-Fe2O3 catalyst in NH3-SCR reaction: a collaborated experimental and DFT study. Appl. Catal. B: Environ. 281 (2021) 119544, https://doi.org/10.1016/j.apcatb.2020.119544.",
      "scopus-id": "85214023984",
      "coredata": {
        "eid": "1-s2.0-S2468823125000033",
        "dc:description": "Natural siderite modified TiO2 (Sid/TiO2) catalyst was prepared by coprecipitation method, and the Sid/TiO2 prepared under optimized conditions was loaded on ceramic filter tube (ST-CFT) through impregnating method. The results showed Sid (0.3)/TiO2 (450) catalyst had the best denitrification effect when the mass ratio of siderite was 0.3 and the calcination temperature was 450 °C. The NOx conversion efficiency reached more than 95 % at reaction temperature was 275–350 °C when NO initial concentration of 500 ppm, and gas hourly space velocity (GHCV) for 36,000 h−1. While the catalyst's median particle size (d50) was 5.3 μm, the slurry concentration was 7.5 wt%, and the face velocity (FV) was 1.5 m/min, NOx conversion efficiency of the ST (4)-CFT (7.5) reached 100 % at reaction temperatures ranging from 275 to 375 °C. It also revealed excellent water, sulfur, and alkali resistance. Compared with pure siderite catalyst, the crystallinity of active component α-Fe2O3 was decreased by introducing Ti carrier, and the utilization efficiency and dispersibility of the active center were improved. The synergistic effect of Fe and Ti improved the acid center density and Brønsted acid content of the catalyst, which promoted low-temperature SCR performance.",
        "openArchiveArticle": "false",
        "prism:coverDate": "2025-02-15",
        "openaccessUserLicense": null,
        "prism:aggregationType": "Journal",
        "prism:url": "https://api.elsevier.com/content/article/pii/S2468823125000033",
        "dc:creator": [
          {
            "@_fa": "true",
            "$": "Qin, Kai"
          },
          {
            "@_fa": "true",
            "$": "Hu, Yuting"
          },
          {
            "@_fa": "true",
            "$": "Liu, Taotao"
          },
          {
            "@_fa": "true",
            "$": "Zhang, Henjian"
          },
          {
            "@_fa": "true",
            "$": "Wang, Bin"
          },
          {
            "@_fa": "true",
            "$": "Qian, Liming"
          },
          {
            "@_fa": "true",
            "$": "Zhu, Chengzhu"
          }
        ],
        "link": [
          {
            "@_fa": "true",
            "@rel": "self",
            "@href": "https://api.elsevier.com/content/article/pii/S2468823125000033"
          },
          {
            "@_fa": "true",
            "@rel": "scidir",
            "@href": "https://www.sciencedirect.com/science/article/pii/S2468823125000033"
          }
        ],
        "dc:format": "application/json",
        "openaccessType": null,
        "pii": "S2468-8231(25)00003-3",
        "prism:volume": "573",
        "articleNumber": "114817",
        "prism:publisher": "Elsevier B.V. All rights are reserved, including those for text and data mining, AI training, and similar technologies.",
        "dc:title": "TiO2 supported siderite catalyst integrated with catalytic ceramic filter tube for selective catalytic reduction of NOx with NH3",
        "prism:copyright": "© 2025 Elsevier B.V. All rights are reserved, including those for text and data mining, AI training, and similar technologies.",
        "openaccess": "0",
        "prism:issn": "24688231",
        "dcterms:subject": [
          {
            "@_fa": "true",
            "$": "Nitric oxide"
          },
          {
            "@_fa": "true",
            "$": "Siderite-derived catalyst"
          },
          {
            "@_fa": "true",
            "$": "TiO2"
          },
          {
            "@_fa": "true",
            "$": "Catalyst filter tube"
          },
          {
            "@_fa": "true",
            "$": "NH3-SCR"
          }
        ],
        "openaccessArticle": "false",
        "prism:publicationName": "Molecular Catalysis",
        "openaccessSponsorType": null,
        "prism:pageRange": "114817",
        "pubType": "fla",
        "prism:coverDisplayDate": "15 February 2025",
        "prism:doi": "10.1016/j.mcat.2025.114817",
        "prism:startingPage": "114817",
        "dc:identifier": "doi:10.1016/j.mcat.2025.114817",
        "openaccessSponsorName": null
      },
      "objects": {
        "object": [
          {
            "@category": "standard",
            "@height": "272",
            "@width": "340",
            "@_fa": "true",
            "$": "https://api.elsevier.com/content/object/eid/1-s2.0-S2468823125000033-gr11.jpg?httpAccept=%2A%2F%2A",
            "@multimediatype": "JPEG image file",
            "@type": "IMAGE-DOWNSAMPLED",
            "@size": "31609",
            "@ref": "gr11",
            "@mimetype": "image/jpeg"
          },
          {
            "@category": "standard",
            "@height": "511",
            "@width": "717",
            "@_fa": "true",
            "$": "https://api.elsevier.com/content/object/eid/1-s2.0-S2468823125000033-gr10.jpg?httpAccept=%2A%2F%2A",
            "@multimediatype": "JPEG image file",
            "@type": "IMAGE-DOWNSAMPLED",
            "@size": "91145",
            "@ref": "gr10",
            "@mimetype": "image/jpeg"
          },
          {
            "@category": "standard",
            "@height": "444",
            "@width": "792",
            "@_fa": "true",
            "$": "https://api.elsevier.com/content/object/eid/1-s2.0-S2468823125000033-gr2.jpg?httpAccept=%2A%2F%2A",
            "@multimediatype": "JPEG image file",
            "@type": "IMAGE-DOWNSAMPLED",
            "@size": "118709",
            "@ref": "gr2",
            "@mimetype": "image/jpeg"
          },
          {
            "@category": "standard",
            "@height": "200",
            "@width": "385",
            "@_fa": "true",
            "$": "https://api.elsevier.com/content/object/eid/1-s2.0-S2468823125000033-ga1.jpg?httpAccept=%2A%2F%2A",
            "@multimediatype": "JPEG image file",
            "@type": "IMAGE-DOWNSAMPLED",
            "@size": "48224",
            "@ref": "ga1",
            "@mimetype": "image/jpeg"
          },
          {
            "@category": "standard",
            "@height": "325",
            "@width": "508",
            "@_fa": "true",
            "$": "https://api.elsevier.com/content/object/eid/1-s2.0-S2468823125000033-gr1.jpg?httpAccept=%2A%2F%2A",
            "@multimediatype": "JPEG image file",
            "@type": "IMAGE-DOWNSAMPLED",
            "@size": "47835",
            "@ref": "gr1",
            "@mimetype": "image/jpeg"
          },
          {
            "@category": "standard",
            "@height": "654",
            "@width": "717",
            "@_fa": "true",
            "$": "https://api.elsevier.com/content/object/eid/1-s2.0-S2468823125000033-gr6.jpg?httpAccept=%2A%2F%2A",
            "@multimediatype": "JPEG image file",
            "@type": "IMAGE-DOWNSAMPLED",
            "@size": "110725",
            "@ref": "gr6",
            "@mimetype": "image/jpeg"
          },
          {
            "@category": "standard",
            "@height": "276",
            "@width": "661",
            "@_fa": "true",
            "$": "https://api.elsevier.com/content/object/eid/1-s2.0-S2468823125000033-gr5.jpg?httpAccept=%2A%2F%2A",
            "@multimediatype": "JPEG image file",
            "@type": "IMAGE-DOWNSAMPLED",
            "@size": "68148",
            "@ref": "gr5",
            "@mimetype": "image/jpeg"
          },
          {
            "@category": "standard",
            "@height": "463",
            "@width": "565",
            "@_fa": "true",
            "$": "https://api.elsevier.com/content/object/eid/1-s2.0-S2468823125000033-gr4.jpg?httpAccept=%2A%2F%2A",
            "@multimediatype": "JPEG image file",
            "@type": "IMAGE-DOWNSAMPLED",
            "@size": "133227",
            "@ref": "gr4",
            "@mimetype": "image/jpeg"
          },
          {
            "@category": "standard",
            "@height": "673",
            "@width": "792",
            "@_fa": "true",
            "$": "https://api.elsevier.com/content/object/eid/1-s2.0-S2468823125000033-gr3.jpg?httpAccept=%2A%2F%2A",
            "@multimediatype": "JPEG image file",
            "@type": "IMAGE-DOWNSAMPLED",
            "@size": "177012",
            "@ref": "gr3",
            "@mimetype": "image/jpeg"
          },
          {
            "@category": "standard",
            "@height": "270",
            "@width": "661",
            "@_fa": "true",
            "$": "https://api.elsevier.com/content/object/eid/1-s2.0-S2468823125000033-gr9.jpg?httpAccept=%2A%2F%2A",
            "@multimediatype": "JPEG image file",
            "@type": "IMAGE-DOWNSAMPLED",
            "@size": "67743",
            "@ref": "gr9",
            "@mimetype": "image/jpeg"
          },
          {
            "@category": "standard",
            "@height": "961",
            "@width": "791",
            "@_fa": "true",
            "$": "https://api.elsevier.com/content/object/eid/1-s2.0-S2468823125000033-gr8.jpg?httpAccept=%2A%2F%2A",
            "@multimediatype": "JPEG image file",
            "@type": "IMAGE-DOWNSAMPLED",
            "@size": "176312",
            "@ref": "gr8",
            "@mimetype": "image/jpeg"
          },
          {
            "@category": "standard",
            "@height": "272",
            "@width": "661",
            "@_fa": "true",
            "$": "https://api.elsevier.com/content/object/eid/1-s2.0-S2468823125000033-gr7.jpg?httpAccept=%2A%2F%2A",
            "@multimediatype": "JPEG image file",
            "@type": "IMAGE-DOWNSAMPLED",
            "@size": "43085",
            "@ref": "gr7",
            "@mimetype": "image/jpeg"
          },
          {
            "@category": "thumbnail",
            "@height": "164",
            "@width": "205",
            "@_fa": "true",
            "$": "https://api.elsevier.com/content/object/eid/1-s2.0-S2468823125000033-gr11.sml?httpAccept=%2A%2F%2A",
            "@multimediatype": "GIF image file",
            "@type": "IMAGE-THUMBNAIL",
            "@size": "10659",
            "@ref": "gr11",
            "@mimetype": "image/gif"
          },
          {
            "@category": "thumbnail",
            "@height": "156",
            "@width": "219",
            "@_fa": "true",
            "$": "https://api.elsevier.com/content/object/eid/1-s2.0-S2468823125000033-gr10.sml?httpAccept=%2A%2F%2A",
            "@multimediatype": "GIF image file",
            "@type": "IMAGE-THUMBNAIL",
            "@size": "11377",
            "@ref": "gr10",
            "@mimetype": "image/gif"
          },
          {
            "@category": "thumbnail",
            "@height": "123",
            "@width": "219",
            "@_fa": "true",
            "$": "https://api.elsevier.com/content/object/eid/1-s2.0-S2468823125000033-gr2.sml?httpAccept=%2A%2F%2A",
            "@multimediatype": "GIF image file",
            "@type": "IMAGE-THUMBNAIL",
            "@size": "12220",
            "@ref": "gr2",
            "@mimetype": "image/gif"
          },
          {
            "@category": "thumbnail",
            "@height": "114",
            "@width": "219",
            "@_fa": "true",
            "$": "https://api.elsevier.com/content/object/eid/1-s2.0-S2468823125000033-ga1.sml?httpAccept=%2A%2F%2A",
            "@multimediatype": "GIF image file",
            "@type": "IMAGE-THUMBNAIL",
            "@size": "15013",
            "@ref": "ga1",
            "@mimetype": "image/gif"
          },
          {
            "@category": "thumbnail",
            "@height": "140",
            "@width": "219",
            "@_fa": "true",
            "$": "https://api.elsevier.com/content/object/eid/1-s2.0-S2468823125000033-gr1.sml?httpAccept=%2A%2F%2A",
            "@multimediatype": "GIF image file",
            "@type": "IMAGE-THUMBNAIL",
            "@size": "15771",
            "@ref": "gr1",
            "@mimetype": "image/gif"
          },
          {
            "@category": "thumbnail",
            "@height": "164",
            "@width": "180",
            "@_fa": "true",
            "$": "https://api.elsevier.com/content/object/eid/1-s2.0-S2468823125000033-gr6.sml?httpAccept=%2A%2F%2A",
            "@multimediatype": "GIF image file",
            "@type": "IMAGE-THUMBNAIL",
            "@size": "11428",
            "@ref": "gr6",
            "@mimetype": "image/gif"
          },
          {
            "@category": "thumbnail",
            "@height": "92",
            "@width": "219",
            "@_fa": "true",
            "$": "https://api.elsevier.com/content/object/eid/1-s2.0-S2468823125000033-gr5.sml?httpAccept=%2A%2F%2A",
            "@multimediatype": "GIF image file",
            "@type": "IMAGE-THUMBNAIL",
            "@size": "9731",
            "@ref": "gr5",
            "@mimetype": "image/gif"
          },
          {
            "@category": "thumbnail",
            "@height": "164",
            "@width": "200",
            "@_fa": "true",
            "$": "https://api.elsevier.com/content/object/eid/1-s2.0-S2468823125000033-gr4.sml?httpAccept=%2A%2F%2A",
            "@multimediatype": "GIF image file",
            "@type": "IMAGE-THUMBNAIL",
            "@size": "26937",
            "@ref": "gr4",
            "@mimetype": "image/gif"
          },
          {
            "@category": "thumbnail",
            "@height": "164",
            "@width": "193",
            "@_fa": "true",
            "$": "https://api.elsevier.com/content/object/eid/1-s2.0-S2468823125000033-gr3.sml?httpAccept=%2A%2F%2A",
            "@multimediatype": "GIF image file",
            "@type": "IMAGE-THUMBNAIL",
            "@size": "13775",
            "@ref": "gr3",
            "@mimetype": "image/gif"
          },
          {
            "@category": "thumbnail",
            "@height": "89",
            "@width": "219",
            "@_fa": "true",
            "$": "https://api.elsevier.com/content/object/eid/1-s2.0-S2468823125000033-gr9.sml?httpAccept=%2A%2F%2A",
            "@multimediatype": "GIF image file",
            "@type": "IMAGE-THUMBNAIL",
            "@size": "11039",
            "@ref": "gr9",
            "@mimetype": "image/gif"
          },
          {
            "@category": "thumbnail",
            "@height": "164",
            "@width": "135",
            "@_fa": "true",
            "$": "https://api.elsevier.com/content/object/eid/1-s2.0-S2468823125000033-gr8.sml?httpAccept=%2A%2F%2A",
            "@multimediatype": "GIF image file",
            "@type": "IMAGE-THUMBNAIL",
            "@size": "11509",
            "@ref": "gr8",
            "@mimetype": "image/gif"
          },
          {
            "@category": "thumbnail",
            "@height": "90",
            "@width": "219",
            "@_fa": "true",
            "$": "https://api.elsevier.com/content/object/eid/1-s2.0-S2468823125000033-gr7.sml?httpAccept=%2A%2F%2A",
            "@multimediatype": "GIF image file",
            "@type": "IMAGE-THUMBNAIL",
            "@size": "7475",
            "@ref": "gr7",
            "@mimetype": "image/gif"
          },
          {
            "@category": "high",
            "@height": "1206",
            "@width": "1508",
            "@_fa": "true",
            "$": "https://api.elsevier.com/content/object/eid/1-s2.0-S2468823125000033-gr11_lrg.jpg?httpAccept=%2A%2F%2A",
            "@multimediatype": "JPEG image file",
            "@type": "IMAGE-HIGH-RES",
            "@size": "268018",
            "@ref": "gr11",
            "@mimetype": "image/jpeg"
          },
          {
            "@category": "high",
            "@height": "2265",
            "@width": "3175",
            "@_fa": "true",
            "$": "https://api.elsevier.com/content/object/eid/1-s2.0-S2468823125000033-gr10_lrg.jpg?httpAccept=%2A%2F%2A",
            "@multimediatype": "JPEG image file",
            "@type": "IMAGE-HIGH-RES",
            "@size": "676663",
            "@ref": "gr10",
            "@mimetype": "image/jpeg"
          },
          {
            "@category": "high",
            "@height": "1965",
            "@width": "3508",
            "@_fa": "true",
            "$": "https://api.elsevier.com/content/object/eid/1-s2.0-S2468823125000033-gr2_lrg.jpg?httpAccept=%2A%2F%2A",
            "@multimediatype": "JPEG image file",
            "@type": "IMAGE-HIGH-RES",
            "@size": "959913",
            "@ref": "gr2",
            "@mimetype": "image/jpeg"
          },
          {
            "@category": "high",
            "@height": "886",
            "@width": "1707",
            "@_fa": "true",
            "$": "https://api.elsevier.com/content/object/eid/1-s2.0-S2468823125000033-ga1_lrg.jpg?httpAccept=%2A%2F%2A",
            "@multimediatype": "JPEG image file",
            "@type": "IMAGE-HIGH-RES",
            "@size": "338451",
            "@ref": "ga1",
            "@mimetype": "image/jpeg"
          },
          {
            "@category": "high",
            "@height": "1438",
            "@width": "2250",
            "@_fa": "true",
            "$": "https://api.elsevier.com/content/object/eid/1-s2.0-S2468823125000033-gr1_lrg.jpg?httpAccept=%2A%2F%2A",
            "@multimediatype": "JPEG image file",
            "@type": "IMAGE-HIGH-RES",
            "@size": "410490",
            "@ref": "gr1",
            "@mimetype": "image/jpeg"
          },
          {
            "@category": "high",
            "@height": "2897",
            "@width": "3175",
            "@_fa": "true",
            "$": "https://api.elsevier.com/content/object/eid/1-s2.0-S2468823125000033-gr6_lrg.jpg?httpAccept=%2A%2F%2A",
            "@multimediatype": "JPEG image file",
            "@type": "IMAGE-HIGH-RES",
            "@size": "932196",
            "@ref": "gr6",
            "@mimetype": "image/jpeg"
          },
          {
            "@category": "high",
            "@height": "1223",
            "@width": "2925",
            "@_fa": "true",
            "$": "https://api.elsevier.com/content/object/eid/1-s2.0-S2468823125000033-gr5_lrg.jpg?httpAccept=%2A%2F%2A",
            "@multimediatype": "JPEG image file",
            "@type": "IMAGE-HIGH-RES",
            "@size": "503120",
            "@ref": "gr5",
            "@mimetype": "image/jpeg"
          },
          {
            "@category": "high",
            "@height": "2047",
            "@width": "2500",
            "@_fa": "true",
            "$": "https://api.elsevier.com/content/object/eid/1-s2.0-S2468823125000033-gr4_lrg.jpg?httpAccept=%2A%2F%2A",
            "@multimediatype": "JPEG image file",
            "@type": "IMAGE-HIGH-RES",
            "@size": "1679538",
            "@ref": "gr4",
            "@mimetype": "image/jpeg"
          },
          {
            "@category": "high",
            "@height": "2983",
            "@width": "3508",
            "@_fa": "true",
            "$": "https://api.elsevier.com/content/object/eid/1-s2.0-S2468823125000033-gr3_lrg.jpg?httpAccept=%2A%2F%2A",
            "@multimediatype": "JPEG image file",
            "@type": "IMAGE-HIGH-RES",
            "@size": "1366120",
            "@ref": "gr3",
            "@mimetype": "image/jpeg"
          },
          {
            "@category": "high",
            "@height": "1193",
            "@width": "2925",
            "@_fa": "true",
            "$": "https://api.elsevier.com/content/object/eid/1-s2.0-S2468823125000033-gr9_lrg.jpg?httpAccept=%2A%2F%2A",
            "@multimediatype": "JPEG image file",
            "@type": "IMAGE-HIGH-RES",
            "@size": "480200",
            "@ref": "gr9",
            "@mimetype": "image/jpeg"
          },
          {
            "@category": "high",
            "@height": "4258",
            "@width": "3504",
            "@_fa": "true",
            "$": "https://api.elsevier.com/content/object/eid/1-s2.0-S2468823125000033-gr8_lrg.jpg?httpAccept=%2A%2F%2A",
            "@multimediatype": "JPEG image file",
            "@type": "IMAGE-HIGH-RES",
            "@size": "1339896",
            "@ref": "gr8",
            "@mimetype": "image/jpeg"
          },
          {
            "@category": "high",
            "@height": "1203",
            "@width": "2925",
            "@_fa": "true",
            "$": "https://api.elsevier.com/content/object/eid/1-s2.0-S2468823125000033-gr7_lrg.jpg?httpAccept=%2A%2F%2A",
            "@multimediatype": "JPEG image file",
            "@type": "IMAGE-HIGH-RES",
            "@size": "323941",
            "@ref": "gr7",
            "@mimetype": "image/jpeg"
          },
          {
            "@category": "thumbnail",
            "@_fa": "true",
            "$": "https://api.elsevier.com/content/object/eid/1-s2.0-S2468823125000033-si1.svg?httpAccept=%2A%2F%2A",
            "@multimediatype": "Scalable Vector Graphics file",
            "@type": "ALTIMG",
            "@size": "5576",
            "@ref": "si1",
            "@mimetype": "image/svg+xml"
          },
          {
            "@category": "thumbnail",
            "@_fa": "true",
            "$": "https://api.elsevier.com/content/object/eid/1-s2.0-S2468823125000033-si2.svg?httpAccept=%2A%2F%2A",
            "@multimediatype": "Scalable Vector Graphics file",
            "@type": "ALTIMG",
            "@size": "15679",
            "@ref": "si2",
            "@mimetype": "image/svg+xml"
          },
          {
            "@category": "thumbnail",
            "@_fa": "true",
            "$": "https://api.elsevier.com/content/object/eid/1-s2.0-S2468823125000033-si3.svg?httpAccept=%2A%2F%2A",
            "@multimediatype": "Scalable Vector Graphics file",
            "@type": "ALTIMG",
            "@size": "19333",
            "@ref": "si3",
            "@mimetype": "image/svg+xml"
          }
        ]
      },
      "link": {
        "@rel": "abstract",
        "@href": "https://api.elsevier.com/content/abstract/scopus_id/85214023984"
      }
    }
  }
}