{
  "metadata": {
    "title": "Contents continued",
    "authors": "",
    "journal": "Molecular Catalysis",
    "date": "2023-08-31",
    "doi": "10.1016/j.mcat.2023.113444",
    "abstract": "",
    "uri": "https://api.elsevier.com/content/article/pii/S2468823123005278",
    "pii": "S2468823123005278"
  },
  "fulltext": {
    "full-text-retrieval-response": {
      "originalText": "serial JL 315758 291210 291744 291790 291809 31 Molecular Catalysis MOLECULARCATALYSIS 2023-08-03 2023-08-03 2023-08-03 2023-08-03 2023-11-16T15:56:12 1-s2.0-S2468823123005278 S2468-8231(23)00527-8 S2468823123005278 10.1016/j.mcat.2023.113444 S300 S300.1 CONTENTS-ENTRY-ONLY 1-s2.0-S2468823123X00133 2023-11-16T16:10:46.838047Z 0 0 20230801 20230831 2023 2023-08-03T20:43:17.189903Z rawtext articleinfo articlenumber articletitlenorm cid cids contenttype copyright crossmark dateloaded dateloadedtxt datesearch datesort dateupdated dco docsubtype doctype doi eid ewtransactionid hubeid indexeddate issn issnnorm itemstage itemtransactionid itemweight openaccess openarchive pg pgfirst pii piinorm pubdateend pubdatestart pubdatetxt pubyr sortorder srctitle srctitlenorm srctype ssids alllist content subj suppl tomb volfirst volissue volumelist webpdf webpdfpagecount yearnav articletitle 2468-8231 24688231 false 547 547 C Volume 547 130 113444 113444 113444 202308 August 2023 2023-08-01 2023-08-31 2023 simple-article con CONTENTSCONTINUED 2025-08-03T00:00:00.000Z 2025-08-03T00:00:00.000Z http://creativecommons.org/licenses/by-nc-nd/4.0/ item S2468-8231(23)00527-8 S2468823123005278 1-s2.0-S2468823123005278 10.1016/j.mcat.2023.113444 315758 2023-11-16T16:10:46.838047Z 2023-08-01 2023-08-31 1-s2.0-S2468823123005278-main.pdf https://s3-eu-west-1.amazonaws.com/prod-ucs-content-store-eu-west/content/pii:S2468823123005278/MAIN/application/pdf/ac651e43bd38e8527e1c8ee51ce357c9/main.pdf main.pdf pdf true 8450205 MAIN 31 1-s2.0-S2468823123005278-main_1.png https://s3-eu-west-1.amazonaws.com/prod-ucs-content-store-eu-west/content/pii:S2468823123005278/PREVIEW/image/png/d8d2931fd809d85ec07f0d72343c45ae/main_1.png main_1.png png 30722 849 656 IMAGE-WEB-PDF 1 (Contents continued from inside back cover) 113281 (Ph3P)AuCl-catalyzed homocoupling of arylboronic acids under benchtop conditions: Synthesis of biphenyls SilviaÂ Roscales, FranciscoÂ SÃ¡nchez-Sancho and AurelioÂ G.Â CsÃ¡ky 113285 Visible light-assisted H4[PW11VO40] catalysed synthesis of bis(indolyl)methanes GopikaÂ Jagannivasan, GopikaÂ NÂ Nair and SujaÂ Haridas 113288 Tuning the content of S vacancies in MoS2 by Cu doping for enhancing catalytic hydrogenation of CO2 to methanol YueÂ Zhou, FeiÂ Liu, ShuoÂ Geng, MengqinÂ Yao, JunÂ Ma and JianxinÂ Cao 113287 In-situ constructed ultrathin hydrotalcite derivative supported PtIn catalyst for isobutane direct dehydrogenation XiqingÂ Zhang, YantingÂ Wang, YanhongÂ Xu, Ã‰nioÂ Matusse, ShulingÂ Chang, TingtingÂ Sun, YirenÂ Lu and LihongÂ Zhang Contents 113279 In operando simultaneous ATR-IR/Raman spectroscopic investigation of the catalytic activity of supported Pt, Ru, and Pd catalysts in H/D exchange reactions between H2 and D2O IsalineÂ Bonnin, RaphaÃ«lÂ Mereau, KarineÂ DeÂ OliveiraÂ Vigier and ThierryÂ Tassaing 113269 Application of nano size ZSM-48 zeolite framework for toluene methylation to p-xylene LalitÂ Kumar, PranitÂ Samanta, KomalÂ Tripathi, BharatÂ LaxmanÂ Newalkar and KamalÂ KishoreÂ Pant 113291 Air-tolerant, ligand-free nickel-catalyzed, manganese-assisted reductive Heck reaction of alkyl/aryl halides with electron-deficient olefins MinlingÂ XÃ¼, LijiaÂ Qian and GangÂ Zou 113268 Redispersion of PdCu/AC sintered catalyst under CO-O2 atmosphere and mechanism study WujianÂ Zhang, WeijianÂ Ge, YipingÂ Jin, MingmingÂ Dang, PanpanÂ Zhang, WenfengÂ Han, YingÂ Li, ZongjianÂ Liu and HaodongÂ Tang Contents 113295 Enhanced photocatalytic Cr(VI) reduction over the Z-scheme ZnO/ZnIn2S4 composite under visible light MengÂ Wu, XuÂ Zhang, JianhuaÂ Yang, BoÂ Chen, JianjunÂ Lian, RuyiÂ Wang and YongÂ Jia 113292 Steering the Auâˆ’FexCo1Oy interface for efficient imine synthesis at low temperature via oxidative coupling reaction ShipengÂ Wu, RongÂ Shang, HaoÂ Zhang, QinghuÂ Tang, QiueÂ Cao, BangÂ Gu and WenhaoÂ Fang Magnetically recoverable Au/FexCo1Oy catalyst enables imine synthesis at 30 Â°C from oxidative coupling of primary alcohols and amines, thanks to the synergism at the Au0âˆ’VÃ¶âˆ’Co3+ interface. 113304 Mechanism determination on [LCu-Fp] heterobimetallic-catalyzed C-H borylation of benzene and regioselectivity regulation: A DFT investigation YuanyuanÂ Sun, YanliÂ Zeng, LingpengÂ Meng and XiaoyanÂ Li The detailed mechanism of UV-induced decarbonylation of [LCu-Fp] in B-H activation process in C-H Borylation was investigated by DFT calculations and compared with the thermal-induced B-H activation process. Both of the two cases can occur under UV light irradiation at room temperature. The strong election-withdrawing substituent of benzene would increase the yield of para-product, whereas the election-donating substituent has little influence on the regioselectivity. 113293 Methylene blue as an additive for acid-acid-catalyzed tandem reactions targeting on the synthesis of nitrogen-containing heterocycles FanÂ Huang, LuxiaÂ Guo, ShaominÂ Chen, SaeedeÂ Saki, MonaÂ Hosseini-Sarvari, MinghaoÂ Li, RuifengÂ Wang, RongxianÂ Bai and YanlongÂ Gu Contents 113311 Ultra-high surface area fibrous silica-zirconia support for renewable energy production by CO2 methanation A.H.Â Hatta, A.A.Â Jalil, N.S.Â Hassan, M.Y.S.Â Hamid, M.N.Â Haron, W.Â Nabgan, M.B.Â Bahari, M.Â Asmadi and H.D.Â Setiabudi 113302 Heteropoly acid-catalyzed b-caryophyllene chemical transformations: Synthesis route of value-added commercial products from components found in biorenewable resources MarcellyÂ M. B.Â Silva, CamilaÂ G.Â Vieira and KellyÂ A.Â da Silva Rocha 113316 Highly selective oxidation of styrene into benzaldehyde over nano CeWOx composite confined in N-doped carbon under solvent-free conditions BinxiongÂ Guang, WeijiaÂ Pu, YiweiÂ Zhang, WeiÂ Zhang, YahuiÂ Xiao and YongÂ Liu 113309 In-doped Sn3O4 flower-like nanosheets for efficient visible-light photocatalytic hydrogen production HeleÂ Liu, PengfeiÂ Tan, LuÂ Yang, MingyuanÂ Zhang, JiaoyangÂ Chen, RuifengÂ Ren, HuanhuanÂ Zhai, TianguiÂ Qi and JunÂ Pan In-doped Sn3O4 nanosheets were prepared for efficient photocatalytic hydrogen evolution under visible light irradiation. Contents 113321 Surfactant-assisted hydrothermal synthesis of core-shell ZSM-5@SSZ-13 zeolite for methanol to olefins reaction QiangÂ Li, ZhenhaoÂ Wen, ZhenbaoÂ Zhang, PifengÂ Wei, XiaoboÂ Wang and ChaoÂ Yang The presence of surfactant solved the problems of chemical compatibility and charge matching between zeolites with different topological structures. 113320 Mesoporous LaNi1-xMnxO3 perovskite with enhanced catalytic performance and coke resistance synthesized via glycine-assisted spray pyrolysis for methane dry reforming AmirhosseinÂ Shahnazi and SadeghÂ Firoozi 113315 One pot cascade conversion of furfural to alkyl levulinate over Lu(OTf)3 without external H2 FukunÂ Li, RongheÂ Yang, ZitingÂ Du, JinhangÂ Dai, XingminÂ Wang, NingÂ Li, XianmingÂ Zhang, YunqiÂ Liu, HaifengÂ Gong, ZhenpingÂ Cai and JunjunÂ Shi Lu(OTf)3 is an efficient one-arrow-two-hawks catalyst for one pot cascade conversion of furfural to isopropyl levulinate in 2-propanol media. 113290 Spatial distribution and proximity effect-dependent multi-enzyme cascades catalysis operating in dendritic mesoporous silica nanoparticles HongxiaÂ Yang, XuefangÂ Zhu, KaiÂ Hua, FengzhongÂ Yuan, JingÂ Zhang and YuchengÂ Jiang Contents 113317 Fusion glycosyltransferase design for enhanced conversion of rebaudioside A into rebaudioside M in cascade XiaoqiangÂ Wang, JiqiangÂ Li, LinaÂ Li, LipengÂ Zhu and FangÂ Huang 113318 Effect of III B metals (Sc, Y, La and Ce) on active components regulation of VPO catalyst in n-butane selective oxidation WenjiaoÂ Li, ShupengÂ Guo, HeqinÂ Guo, YongÂ Xiao, LitaoÂ Jia and DebaoÂ Li 113314 Comprehensive study on selective dehydrochlorination of 2-chloro-3,3,3- trifluoropropene over carbon-based catalysts and catalyst deactivation TongyunÂ Zhang, ChengpingÂ Zhang, XiaoxunÂ Ma and HengdaoÂ Quan Synopsis: 2-chloro-3,3,3-trifluoropropene (HCFO-1233xf) can be highly selectively dehydrochlorinated over CsF/AC-F to generate 3,3,3-trifluoropropyne, however, the rapid deactivation of which resulting from the fluorine-chlorine exchange of HCFO-1233xf with CsF should be the most important issues need to be addressed in the future study. 113307 Syngas production through dry reforming of ethanol over Co@SiO2 catalysts: Effect of SiO2 shell thickness TingÂ Li, FeifeiÂ Li, JessicaÂ Nginyo, WeijieÂ Cai and BoÂ Yu Contents 113325 Application of the all-in-one electrode for in situ H2O2 generation in hydroxylation catalyzed by unspecific peroxygenase from Agrocybe aegerita GiovanniÂ V.Â Sayoga, VictoriaÂ S.Â Bueschler, HubertÂ Beisch, DirkÂ Holtmann, An-PingÂ Zeng, BodoÂ Fiedler, DanielÂ Ohde and AndreasÂ Liese 113326 Triazine-based covalent organic polymer as a high aerobic oxidative desulfurization performance catalyst under mild reaction conditions JuanÂ Li, DexinÂ Liu, XiaoleiÂ Jiang, MingyuanÂ Zhu and BinÂ Dai 113308 Effect of the Fe2O3@TiO2 core-shell structure on CO catalytic oxidation and SO2 poisoning resistance QiÂ Gao, ChangqingÂ Dong, XiaoyingÂ Hu, JunjiaoÂ Zhang, JunjieÂ Xue, YingÂ Zhao and XiaoqiangÂ Wang 113294 Kinetics study of the selective hydrogenation of furfural to furfuryl alcohol over CuAl2O4 spinel catalyst TanasanÂ Intana, SutaratÂ Thongratkaew, JeerananÂ Nonkumwong, WaleepornÂ Donphai, ThongthaiÂ Witoon, MettaÂ Chareonpanich, NoriakiÂ Sano, KajornsakÂ Faungnawakij and SirapassornÂ Kiatphuengporn Contents 113324 Charge polarization induced site preferences phenomena of ethylene hydrogenation via electronic metal support interactions YuhaoÂ Chen, BoÂ Han, XiaoluÂ Su, QiangÂ Gao and ChenggangÂ Zhou 113323 Enantioselective trifluoromethylthiolation of 4-substituted pyrazolones catalyzed by amide-based phase transfer catalysts YakunÂ Wang, ShuaifeiÂ Wang, YingyingÂ Wang, YufengÂ Wu, JieÂ Liu, KediÂ Zhou, QichenÂ Sun, LizhenÂ Fang and TaoÂ Zhang Enantioselective trifluoromethylthiolation of 4-substituted pyrazolones has been developed by amide- based phase transfer catalysts 113305 Selective synthesis of quinazolinones by using fluorescein catalyst under mild conditions LiangÂ Jin, XuehuaÂ Chen, ShengÂ Huang, AixinÂ Wang, ZhongshengÂ Chen, ZhanggaoÂ Le and ZongboÂ Xie 113319 (ODA)2CuBr4: A stable lead-free perovskite as efficient photocatalyst for dehydrogenative coupling of quinoxalin-2(1H)-ones with amines Shuai-ZhengÂ Zhang, Yi-FanÂ Gao, Wen-JingÂ Li, Wen-XinÂ Xiao, JingÂ Huang, Li-PingÂ Mo and Zhan-HuiÂ Zhang A lead-free copper halide perovskite has been prepared and identified as an efficient photocatalyst for dehydrogenation coupling of quinoxalin-2(1H)-ones with amines in air under visible-light irradiation at room temperature. Contents 113332 An environmentally benign approach for the synthesis of low molar mass polybutenes from mixed C4 monomers using AlCl3/ionic-liquid initiating systems ZahraÂ IzadiÂ Kahkeshi, NaeimehÂ Bahri-Laleh, SamaheÂ Sadjadi and MehdiÂ NekoomaneshÂ Haghighi 113310 Combining silver, polyaniline and polyvinylpyrrolidone for efficient electrocatalysis of borohydride oxidation reaction JadrankaÂ MilikicÌ�, UnaÂ StamenovicÌ�, VesnaÂ Vodnik, MojcaÂ OtonicÌŒar, SrecÌŒoÂ Å kapin and BiljanaÂ Å ljukicÌ� 113289 Improved copper-based catalysts for alcohol-assisted CO2 hydrogenation: A comparative study between novel nano-stabilized and deposition-precipitation method LinlinÂ Ye, PennyÂ Xiao, PeterÂ Scales, PaulÂ Webley, RanjeetÂ Singh and GangÂ KevinÂ Li 113312 Natural kaolinite modified black titanium dioxide for efficient visible light assisted photocatalysis PeiweiÂ Hu, YanÂ Zhang and GangliÂ Cheng Contents 113313 One-step annealing synthesis of Co core-PdZn intermetallic shell composite as a bifunctional oxygen electrocatalyst for zinc-air batteries JihongÂ Jiang, YongqiangÂ Fang, YimingÂ Zhao, LianhuaÂ Zhao and BiyaoÂ Jin 113334 Selective hydrogenolysis of C-O bonds in lignin model compounds and Kraft lignin over highly efficient NixCoyAl catalysts Zong-PinÂ Fu, Yun-PengÂ Zhao, Fa-PengÂ Wu, Jin-XuanÂ Xie, Le-LeÂ Qiu, JianÂ Xiao, JingÂ Liang, Yong-HuiÂ Bai, Fang-JingÂ Liu and Jing-PeiÂ Cao 113327 Construction of wool-shaped heterostructure structure CoNi/NF-P electrocatalyst for efficient hydrogen evolution reaction HonglinÂ Yan, XinÂ Xiao, ChenyaoÂ Hu, XiaohengÂ Liu and YeÂ Song The wool-shaped CoNi/NF-P integrate catalyst effectively optimizes the electronic structure and enhances HER performances via NF as the self-assembly platform. 113344 Cellulose nanofibers (CNF) supported (Salen)Cr(III) composite as an efficient heterogeneous catalyst for CO2 cycloaddition YiÂ Liu, ShuangjiangÂ Li, XiaojianÂ Yu, YingÂ Chen, XiaoningÂ Tang, TiandingÂ Hu, LanÂ Shi, ManojÂ Pudukudy, ShaoyunÂ Shan and YunfeiÂ Zhi Cellulose nanofibers (CNF) supported (Salen)Cr(III) composite as a novel heterogeneous catalyst (CNF- (Salen)Cr(III), which has good catalytic activity for CO2 cycloaddition, and DFT calculation further revealed the reaction mechanism. Contents 113329 Electron-modulating effects of intercalating molecules in functionalized graphene oxide: Optimizing the coordination microenvironment of Ag nanoparticles for efficient catalytic A3 coupling reactions YajuanÂ Chang, GangÂ Wang, QiupingÂ Zhang, LongchaoÂ Sun, ZhiqiangÂ Wu, HaijuanÂ Zhan and WanyiÂ Liu 113340 The first-principles calculation to predict electroreduction of CO2 to ethanol over Al/ Cu(111) bimetallic catalyst DanÂ Wang, Rui-ChengÂ Qin, Yong-QingÂ Qiu and Chun-GuangÂ Liu 113330 Strain engineering of electronic properties, quantum capacitance, and photocatalytic properties of Zr2CO2 MXene HaoÂ Zhang, Xiao-HongÂ Li, Rui-ZhouÂ Zhang and Hong-LingÂ Cui The electronic, optical, photocatalytic properties and quantum capacitance of Zr2CO2 MXene under biaxial strain are investigated by hybrid HSE functional. Zr2CO2 under +8% strain undergoes the indirect-direct semiconductor transition. Tensile strain can effectively improve the solar energy utilization of Zr2CO2 MXene. Zr2CO2 under strains are all potential cathode materials in whole potential. Tensile strain can improve the CO2 photocatalysts and enrich the photocatalytic CO2 reduction products. Zr2CO2 without strain can spontaneously perform HER with Î”G of 0.98 eV and OER with the overpotential of 1.16 eV. 113333 Surface modification of Fe5C2 by binding silica-based ligand: A theoretical explanation of enhanced C2 oxygenate selectivity JunqingÂ Yin, ShuyuanÂ Wang, DanÂ Xu, YongÂ You, XingchenÂ Liu and QingÂ Peng This DFT work disclosed the reason(s) why the selectivity of C2 oxygenates is enhanced on Fe5C2 after silica modification, that both the carbide route and the Câ€“O bond cleavage are suppressed but the COÂ +Â C coupling to form C2 oxygenate is facilitated. Contents 113303 Mechanistic insight into epoxide methoxycarbonylation catalyzed by Co complexes WenyanÂ Jia, MaoshuaiÂ Li, MingchanÂ Chen, JingÂ Lv, Mei-YanÂ Wang, XiaojunÂ Bao and XinbinÂ Ma 113341 A novel catalyst based on nickel phyllosilicate for the selective hydrogenation of unsaturated compounds AnastasiyaÂ A.Â Shesterkina, KseniiaÂ V.Â Vikanova, VictoriaÂ S.Â Zhuravleva, AlexanderÂ L.Â Kustov, NikolayÂ A.Â Davshan, IgorÂ V.Â Mishin, AnnaÂ A.Â Strekalova and LeonidÂ M.Â Kustov 113350 The catalytic performance of FexMn1-xWO4 as novel wolframite-type nanocatalysts for the selective dehydration of methanol into dimethyl ether MohamedÂ NadyÂ Goda, MohamedÂ AbdÂ El-Aal, EsraaÂ Magdy and AbdÂ El-AzizÂ A.Â Said 113335 CO2 reduction performance of Cu/Er supported on N-doped graphene: A first principles study YaningÂ Zhang, WenhaiÂ Xu, AnujÂ Kumar, HaoÂ Sun, AiqingÂ Cao, ZhuangÂ Zhang, ZhehengÂ Jiang, ZuoyinÂ Yang, JuncaiÂ Dong and YapingÂ Li Contents 113345 Environment-friendly epoxidation of limonene using tungsten-based polyoxometalate catalyst AnaÂ MarÃ­aÂ LÃ³pezÂ FernÃ¡ndez, AbdulÂ Rehman, FaisalÂ Saleem, MohamadÂ FaizÂ MukhtarÂ GunamÂ Resul, AumberÂ Abbas, SajjadÂ Ahmad, ValentineÂ C.Â Eze and AdamÂ P.Â Harvey Highly Selective and Environmentally Benign Epoxidation of Limonene Using Tungsten-Based Polyoxometalates Catalysts and Hydrogen Peroxide 113339 Ni-based nanocatalyst protected by ultrathin mesoporous nitrogen-doped carbon layer with hollow structure for the efficient transfer hydrogenation of halogenated nitrobenzenes LiqiÂ Dong, ZilongÂ Liu, YingnaÂ Wang, YuanpeiÂ Lan, ChaoyiÂ Chen and WeiÂ Zhang The hollow SiO2 shell derived from Ni3Si2O5(OH)4 and the N-doped carbon protective layer make the catalyst exhibit the optimal activity, selectivity, mechanical strength, and stability for the selective transfer hydrogenation of halogenated nitrobenzenes. 113322 The isopropylation of naphthalene over ordered mesoporous aluminosilicate AlSBA-1: The formation of diisopropylnaphthalene and triisopropylnaphthalene isomers AhmadÂ Tabish, SujanyaÂ MariaÂ Ruban, StalinÂ Joseph, SathishÂ ClastinrusselrajÂ Indirathankam, MercyÂ Bezingar, KavithaÂ Ramadass, Jae-HunÂ Yang, NarothÂ P.Â Nimisha, SakthivelÂ Ayyamperumal, YoshihiroÂ Sugi and AjayanÂ Vinu 113349 Boosting the alkaline hydrogen evolution reaction of Ni/Co9S8@FP heterostructures via interfacial synergistic effects ShuweiÂ Deng, JinxianÂ Feng, YouchaoÂ Kong, XiaoshuangÂ Li, AlainÂ RafaelÂ PuenteÂ Santiago and TianweiÂ He Contents 113355 Modulating the electronic structure of CoFeCNO 2D nanosheets via Ni incorporation for efficient electrochemical oxygen evolution ZhideÂ Chen, WeiÂ Deng, XiangÂ Li, JingjingÂ Zhang, DewuÂ Long, ShanlinÂ Qiao and FeiÂ Jiang 113353 Electrochemical mechanisms of the reduction of N2 to NH3 catalyzed by TM anchored on Nvs-g-C3N4/graphene van der Waals heterostructure: Insights from a first-principles study De-QingÂ Li, Jin-aiÂ Gao, Ming-TianÂ Hao, BaerlikeÂ Wujieti, Xiao-yuÂ Li and Bo-ZhenÂ Chen 113338 Chlorophyll b-modified TiO2 nanoparticles for visible-light-induced photocatalytic synthesis of new tetrahydroquinoline derivatives AidaÂ Heidari, KazemÂ D.Â Safa and RezaÂ Teimuri-Mofrad 113331 ZnO/Co-doped polyhistidine as an efficient bioelctrocatalyst for hydroxyl radical generation: Fabrication, characterization and application for microbial inactivation NastaranÂ Rahimdad, MahdiÂ Hashemi, NozarÂ Moradi and MojtabaÂ Shamsipur Contents 113348 Role of Pt in Pt/SO4 2âˆ’-ZrO2 catalyzed n-butane isomerization reaction: Hydrogen spillover rather than bifunctional â€œmetal-acidâ€� catalysis PengzhaoÂ Wang, TuchengÂ Zeng, WenjunÂ Yao, YaoweiÂ Wang, DemingÂ Zhao, MinxiuÂ Zhang, ChunyiÂ Li, TinghaiÂ Wang and XiaojunÂ Bao 113346 H2 production through glycerol photoreforming using one-pot prepared TiO2-rGO-Au photocatalysts StefanoÂ AndreaÂ Balsamo, RobertoÂ Fiorenza, MariaÂ TeresaÂ ArmeliÂ Iapichino, FranciscoÂ JavierÂ Lopez-Tenllado, FranciscoÂ JosÃ©Â Urbano and SalvatoreÂ ScirÃ© 113363 Direct covalent immobilizaion of chiral phosphine oxide: Hollow mesoporous polystyrene nanospheres as a platform for efficient heterogeneous enantioselective reductive aldol reaction ZuyunÂ Yin, JieÂ Liu, JianingÂ Zhang and XuebingÂ Ma 113358 Waste eggshell to valuable Co3O4/eggshell material as an efficient catalyst for catalytic decomposition of N2O under simulated real tail gases XiaoboÂ Hu, LinyanÂ Feng, RuifangÂ Wu, YongzhaoÂ Wang and YongxiangÂ Zhao Contents 113361 Exploring the key components of Au catalyst during CO oxidation using TG-MS and operando DRIFTS-MS TiantianÂ Zhang, JiachengÂ Xu, YanÂ Sun, ShiyuÂ Fang, ZuliangÂ Wu, ErhaoÂ Gao, JialiÂ Zhu, WeiÂ Wang, LianxinÂ Dai, WeihuaÂ Liu, BuheÂ Zhang, JunweiÂ Zhang, ShuiliangÂ Yao and JingÂ Li 113357 Mononuclear Cu-complex embedded ordered nano-porous silica based hybrid catalyst for oxidation of benzyl alcohol ParikshitÂ Paredi, MadhuÂ Pandey, NaoÂ Tsunoji, RohitÂ Prajapati, SouravÂ Das and MahuyaÂ Bandyopadhyay Novel Cu (II) complex was prepared, characterized, and immobilized in sulfonic acid functionalized MCM- 41 and SBA-15 to test its effectiveness as an oxidation catalyst for the selective solvent-free oxidation of benzyl alcohol to benzaldehyde and excellent selectivity was achieved by Copper complex modified MCM-41. 113364 Highly efficient synthesis of chiral lactams by using a w-transaminase from Bacillus megaterium and its mutant enzymes NanÂ Jiang, XiaotongÂ Du and LiangyuÂ Zheng 113336 A new method for activation of multicomponent nickel catalysts for alkenes hydrogenation YuliyaÂ Yu.Â Titova, SergeyÂ V.Â Zinchenko and FedorÂ K.Â Schmidt Contents 113351 Structure optimization and support effect of metal-organic frameworks on Pd-Ir bimetallic nanoclusters Tian-EÂ Fan, Yan-RuÂ Zhang and WeiÂ Jiang The stable structures of Pd32Ir6, Pd19Ir19 and Pd6Ir32 loaded in UiO-66. 113365 CO2/CO methanation over Ru and Ni supported g-Al2O3: A study on the effect of the stoichiometry of reactant gases GaneshÂ Jabotra, PradeepÂ KumarÂ Yadav, SiddharthÂ Kumar and SudhanshuÂ Sharma 113360 Cation-Ï€-interaction-facilitated, self-photocatalyzed and regioselective perfluoroalkylation of 3-aza-1,5-dienes RuihanÂ Yang, DannaÂ Chen, ShiyiÂ Lin, XuegeÂ Yang, XiÂ Hu, ShulinÂ Gao, LouÂ Shi and DeqiangÂ Liang 113352 Theoretical insight into the acceptorless dehydrogenation catalyzed by the transition metal bifunctional catalysts: Mechanism and metal effect ChenÂ Wang, QingÂ Fan, GuixiaÂ Wang and QipingÂ Zhu Contents 113372 An unconventional direct path for the chemoselective hydrogenation of nitroarenes over a metal-free catalyst ZongyanÂ Ma, JingÂ Chen, MingÂ Chen, LinkunÂ Dong, WeiwenÂ Mao, YuÂ Long and JiantaiÂ Ma 113359 Catalytic amination of diethylene glycol with tert-butylamine to tertiarybutylaminoethoxyethanol over NiCu/Al2O3 catalysts: Facilitation of NiCu alloy XiaozhongÂ Wang, JialiÂ Hu, CaiÂ Xu, YingqiÂ Chen and LiyanÂ Dai 113368 Construction of b-cyclodextrin modified Fe3O4 composites with enhanced peroxymonosulfate activation towards efficient degradation of norfloxacin YuxiÂ Qin, AdeelÂ Ahmed, ShahidÂ Iqbal and MuhammadÂ Usman 113376 Design of yolk-shell structured PdSn@Pd@HCS nanocatalysts for efficient direct synthesis of H2O2 WeiÂ Tian, YonggangÂ Dong, HongÂ Qin, ZimingÂ Luo, QianÂ Lin, ZhengÂ Chen, HongyanÂ Pan, YongyongÂ Shi and KeliangÂ Wang We successfully prepared a novel bimetallic yolk-shell catalyst PdSn@Pd@HCS, the addition of Sn atom can optimize the geometric and electronic structure of Pd surface, H2O2 selectivity and conversion reach 98% and 4899Â mmol/gPdÂ·hÂ âˆ’Â 1, respectively. Contents 113369 The d band center dependent catalytic activity of n-doped carbon nanospheres with wrinkled cages supported PdPt alloy catalysts in transfer hydrogenation of bicarbonate with glycerol XiaojinÂ Dong, XuechengÂ Li, HuaÂ Tan, JiapingÂ Zhu, GangÂ Wang, SuhuaÂ Wang, WenyuÂ Xie, TongÂ Zhan and VivekÂ Polshettiwar 113383 IrO2/Co3O4 supported mesoporous SBA-16: An efficient electro-catalyst for oxygen evolution reaction SudhakarÂ Pichaikaran, ShanmugamÂ Kotteswaran, MathewÂ KÂ Francis, P.Â BalajiÂ Bhargav, WangÂ Bo, NafisÂ Ahmed and BalajiÂ C 113381 In-situ hydrothermal synthesis of Al-rich Cu@ZSM-5 catalyst for furfuryl alcohol upgrading to pentanediols DengfengÂ Dai, YuÂ Zhang, TingÂ Zhao, DandanÂ Liu, ChaoÂ Feng and YunqiÂ Liu Al-rich Cu@MFI catalyst encapsulating copper nanoparticles exhibits significant pentanediols selectivity and high anti-sintering performance in boosting furfuryl alcohol upgrading to pentanediols. 113378 Enhanced direct methanation of CO2 using Ni-based catalysts supported on ZrO2, CeO2- ZrO2, and La2O3-ZrO2: The effect of support material on the reducible NiO-interacted species and catalytic activity RadwaÂ A.Â El-Salamony, KenitÂ Acharya, AhmedÂ S.Â Al-Fatesh, AhmedÂ I.Â Osman, SalwaÂ B.Â Alreshaidan, NadavalaÂ SivaÂ Kumar, HamidÂ Ahmed and RaweshÂ Kumar Contents 113347 Surface-silanised and alkoxylated micro-mesoporous Ni/hierarchical nanozeolites for oleic acid hydrodeoxygenation MahashanonÂ Arumugam, AminÂ Osatiashtiani, Ka-LunÂ Wong, KhairulÂ BasyarÂ Baharudin, SinÂ YuanÂ Lai, M.Â Safa-Gamal, HweiÂ VoonÂ Lee, ChawÂ JiangÂ Lim, DavidÂ KubicÌŒka and YunÂ HinÂ Taufiq-Yap 113367 Incorporation of palladium complexes into silsesquioxaneâˆ’imine frameworks for the methoxycarbonylation of olefins Peng-XinÂ Guan, Yi-RanÂ Du, Lin-JieÂ He, Xing-MeiÂ Lu and Bao-HuaÂ Xu The formation of palladium-diphosphine complex while in-situ construction of imine-linked silsesquioxane- imine frameworks leading to [Pd-L]@PSIF hybrids was accessed. They were examined as catalysts for the methoxycarbonylation of olefins without any additives. Mechanistic studies demonstrated that both the activity and the durability are highly correlated to the position of active [Pd-L] loaded at the support. 113366 Machine-learning-guided prediction of Cu-based electrocatalysts towards ethylene production in CO2 reduction QingÂ Zhang, KaiÂ Zhu, YuhongÂ Luo, ZhengyuÂ Bai, ZishengÂ Zhang and JingdeÂ Li 113337 Oxygen effect on the synthesis of vinyl acetate on Pd (100) and Pd/Au (100) surfaces: A periodic DFT study ZhiqiangÂ Liu, PengyuanÂ Qiu, HaoyangÂ Sun, LiÂ Sun, ZuoxiangÂ Zeng and ZhenÂ Liu Contents 113370 Insights into CO2 activation and charge transfer in photocatalytic reduction of CO2 on pure and metal single atom modified TiO2 surfaces JiaÂ Xiong, AnjiaÂ Yang, QiangÂ Sun, HongxiaÂ Gao, HaiyanÂ Zhang, YuÂ Mao and ZhiwuÂ Liang 113380 Sintering resistance of Pt-based oxidation catalyst via constructing Pt/MnOx interface YanliÂ Liang, JianliÂ Wang, MingÂ Zhao and YaoqiangÂ Chen In comparing to impregnation method (IM), overlayer deposition method (OD) creates more Pt/MnOx interface, arresting the aggregation of platinum nanoparticles and enhancing the oxidation catalytic performance. 113386 Alkali metal and alkaline earth metal perovskites for oxidative coupling of methane and oxidative dehydrogenation of ethane JunweiÂ Xu, RumengÂ Ouyang, XushengÂ Zhong, XiuzhongÂ Fang, XianglanÂ Xu and XiangÂ Wang 113374 Oscillatory behavior of Ni/TiO2 catalyst during partial oxidation of methane: Understanding the role of strong metal-support interaction HuaÂ Yang, ZeminÂ An, YuanjieÂ Xu, LizhiÂ Wu, LiÂ Tan and YuÂ Tang Contents 113385 In silico study on the catalytic activity of lipase from Fusarium oxysporum f. sp. tracheiphilum in the bioconversion of Annonalide and its acylated derivatives JonatasÂ M.Â Negreiro, AkenatonÂ O.C.V.Â Gomes, RicardoÂ A.Â Marques, DavilaÂ Zampieri, FÃ¡timaÂ M.Â Nunes, FranciscoÂ G.Â Barbosa, JairÂ Mafezoli, MarcosÂ C.Â Mattos, CristianoÂ S.Â Lima, FranciscoÂ L.S.Â Oliveira, GeancarloÂ Zanatta and MariaÂ C.F.Â Oliveira 113390 Immobilization of ZIF-67 on C3N4 loaded with Fe3O4 as a novel efficient nanocatalyst for Biginelli reaction FatemehÂ AfzalÂ Aghaee and ZahraÂ Rafiee 113388 Effects of Pd doped Cu surface on CO2 and H2O formation in methane total oxidation JuntianÂ Niu, ZiweiÂ Jin, JiadongÂ Zhang, HaiyuÂ Liu, YanÂ Jin and JingyuÂ Ran 113384 A novel amphiphilic phase transfer catalyst for the green epoxidation of soybean oil with hydrogen peroxide FengyanÂ Zhang, YongluÂ Dong, ShudongÂ Lin, XuefengÂ Gui and JiwenÂ Hu Contents 113389 Peroxygenase-catalysed selective and scalable synthesis of 25-hydroxy-grundmann's ketone and its derivatives YalanÂ Zhang, XiaoyingÂ Zhou, JiandongÂ Cui, YawenÂ Huang, XiaoxiaoÂ Liu, YunhanÂ Zhang, BishuangÂ Chen and WuyuanÂ Zhang 113354 Single-site modification of the P450-BM3 substrate-entrance facilitates the synthesis of optically pure pharmaceutically useful methyl trans-3-phenylglycidates WeiÂ Tong, QipengÂ Yan, ShaixiaoÂ Tian, RuihaiÂ Tang, BoÂ Chen and Jian-boÂ Wang Identification of a new engineering site locates at the entrance of substrate has enabled highly efficient access to optically pure methyl trans-3-phenylglycidates through the rational design of P450-BM3. 113400 2-Arylbenzo[d]xazolyl based iridium(III) complexes as highly efficient photoredox catalysts XiÂ Hong, BingÂ Zhan, Xue-JuanÂ Chen and Xiu-FengÂ Hou 113393 Reactivity of niobium(V) pentaalkoxide complexes: Ring-opening metathesis polymerization of norbornene TatsukiÂ Nagata, ShunsukeÂ Aratani, MoegiÂ Nomura, MaitoÂ Fuji, TaichiÂ Sotani, HiromitsuÂ Sogawa, FumioÂ Sanda, TatsuoÂ Yajima and YasushiÂ Obora Contents 113396 Biosynthesis of cyclic ketones by a H2O2 self-sufficient cascade reaction BinÂ Wu, XiangyunÂ Wang, BoÂ Yang, YunjianÂ Ma, FrankÂ Hollmann and YonghuaÂ Wang 113392 The formation mechanism of N2O and NH3 on PtRh three-way catalyst of natural gas vehicles YaliuÂ Zhang, BingchengÂ Wu, YangÂ Xu, YangÂ Wu, WenhuÂ Yang, ChengsongÂ Huang, XingmeiÂ Wang, LinÂ Zhong, JianliÂ Wang and YaoqiangÂ Chen 113404 Efficient bio-catalytic production of enentiopure (S)-(4-chlorophenyl)(phenyl)methanol as a drug precursor by using a novel rotatable composite design-based optimization strategy NesrullahÂ Tozlu, AliÂ SavaÅŸÂ BÃ¼lbÃ¼l, AkÄ±nÂ Ã–zdemir and EnginÂ Åžahin 113399 Influence of precursor compounds on the structural and catalytic properties of CoNiMo/ SBA-15 catalysts used in the hydrodesulfurization of dibenzothiophene J.A.Â Medina Cervantes, J.N.Â DÃ­az de LeÃ³n, S.Â Fuentes Moyado and G.Â Alonso-NÃºÃ±ez Contents 113377 Anchoring CuO nanoparticle on nitrogen-doped reduced graphene oxide as nanocatalyst for the synthesis of 5-substituted-1H-tetrazole and 1,2,3- triazole derivatives AlkaÂ Singh and AlkaÂ Agarwal 113405 Crystal facet effect of g-Al2O3 on catalytic property of CuO/g-Al2O3 for CO oxidation JiangangÂ Lv, ChongÂ Chen, XuefengÂ Guo, WeipingÂ Ding and WeiminÂ Yang The catalytic activity of CuO species supported on Î³-Al2O3 for CO oxidation are obviously crystal facet- dependent. The Î³-Al2O3 with {111}-exposed plane is helpful for dispersing and activating CuO species at lower temperature, and thus leading to better catalytic performance comparing to the Î³-Al2O3 with {110}-exposed facet. 113391 Theoretical insights into the mechanism of nitrogen-to-ammonia electroreduction on TM/g-C9N10 MinÂ Wang, YuhongÂ Huang, FeiÂ Ma, GangqiangÂ Zhu, JianminÂ Zhang, XiumeiÂ Wei, PengfeiÂ Hou, RuhaiÂ Du and JingÂ Liu Through a series of screening processes, Mn/g-C9N10 is picked out from 10 TM/g-C9N10 SACs as a potential NRR candidate with great stability, NRR selectivity and activity with the competitive overpotential of 0.125Â V through the distal pathway. Multiple descriptors are adopted to illustrate the origin of high NRR activity. 113395 Highly efficient Ni-catalyzed C-N coupling in alkane solvents XiaolinÂ Jiang, HaiyanÂ Hu, ShizhenÂ Zhao, QinÂ Shi, MeiÂ Wang, ZengyanÂ Zhu and YuehuiÂ Li In this work, it was found that the use of alkane solvents allows for highly efficient Ni-catalyzed C-N coupling of aryl pseudohalides with different types of amines in the presence of NHC ligands. Contents 113414 Facile construction of novel Z-scheme Bi4O5I2/CuFe2O4 heterojunctions for NO2- inhibited and robust photocatalytic removal of NO under visible light FeiÂ Chang, ZhongyuanÂ Zhao, WenlongÂ Bao, JiyuanÂ Wang and JiaojiaoÂ Zheng 113413 Sol-gel synthesis of photoactive PtO/Bi2WO6 nanocomposites for improved photoreduction of Hg (II) ions under visible illumination AmalÂ S.Â Basaleh and SolimanÂ I.Â El-Hout 113371 Construct CeO2-ZrO2-Al2O3 support with relative CeO2-ZrO2-rich surface by peptization method to tame the thermal stability of Pd species in three-way catalysts WeiÂ Wang, YiÂ Zhao, XinyiÂ Yin, LinmeiÂ Wang, JunÂ Fan, ShanshanÂ Li, JianliÂ Wang and YaoqiangÂ Chen 113394 Polymetallic oxygen cluster intercalated expanded graphite for selective oxidation of methacrolein to methacrylic acid XiangjieÂ Zeng, YandongÂ Chong, LilongÂ Zhou, ZhengjieÂ Li, PengÂ Yin, YongqiÂ Hu and JimmyÂ Yun Contents 113409 Regioselective direct thiocyanation of anilines and phenols using novel hybrid nanocatalyst (MgONPs@VCA) under visible light induced photoredox catalysis DanaÂ A.Â Kader and SroodÂ OmerÂ Rashid 113397 Unraveling the role of active site Rh aggregation form in tuning the catalytic performance of ethane direct dehydrogenation BingÂ Han and RiguangÂ Zhang 113407 Effective Synergistic Hafnium-Aluminum Bimetallic Oxides catalysts for the Synthesis of 5-Hydroxymethylfurfural from Glucose and Fructose CongcongÂ Zhao, NiuniuÂ Zhu, GuoÂ Qiu, ManyuÂ Zhang and HongyuÂ Tian 113406 Constructing 2D channel catalysts with accessible open transport channels for boosting epoxidation of methyl oleate ChengliangÂ Zhou, FengÂ Li, ChunÂ Wang, RuiÂ Cao, YongÂ Liu, YatingÂ Yin, HaibaoÂ Chen, ZhenyuÂ Wan, YanchenÂ Zhu and WanliangÂ Yang 2D channel catalyst was designed to promote the epoxidation of methyl oleate due to its accessible open transport channels that facilitate molecular diffusion. Contents 113416 3D homogeneous porous copper-ceria catalyst for solar light driven photothermal CO- PROX in H2-rich gas: Enhanced light absorption and abundant oxygen vacancy XiaolinÂ Guo, SiyiÂ Zhong, WangxiangÂ Ye, AngÂ Zhou, Zi'angÂ Chen, DingfengÂ Jin, QiaolingÂ Kang, MeiqiangÂ Fan and TingliÂ Ma 113419 In-situ generation of ZnS nanoparticles in quasi-MOFs for efficient eNRR ZijingÂ Liu, YanweiÂ Xing, PengÂ Wang, ShuangÂ Wang and JinpingÂ Li ZnS/ZIF-8-l-350 electrocatalyst was prepared by controlling the pyrolysis vulcanization temperature, the Zn nodes of ZIF-8-L reacted with BDS to create ZnS nanoparticles to afford abundant catalytic active sites, the ligands were carbonized to form the N-doped carbon support to effectively inhibit HER while partial framework of ZIF-8-L were remained to provide a wide reaction space. The obtained ZnS/ZIF- 8-l-350 exhibited a remarkable NH3 yield of 53.44 Î¼gÂ·hâˆ’1Â·mgâˆ’1, FE of 15.75% and catalytic stability in electrocatalytic Nitrogen Reduction Reaction (eNRR). 113403 Ionic liquids as modifier for the oligomerization of a-olefins to reactive poly (a-olefins) via traditional AlCl3 catalyst MiadÂ Mashayekhi, LeilaÂ Moballegh, NaeimehÂ Bahri-Laleh, SamaheÂ Sadjadi and AlbertÂ Poater 113375 Realization of molecular models as heterogeneous electrocatalysts for activation of dioxygen KwadwoÂ Mensah-Darkwa, DanielÂ NframahÂ Ampong, EmmanuelÂ AcheampongÂ Tsiwah, AnujÂ Kumar, MartinsonÂ AddoÂ Nartey, PatrickÂ Aggrey, FrankÂ OforiÂ Agyemang and RamÂ K.Â Gupta Contents 113362 Recent developments in solid acid catalysts for biodiesel production YingyingÂ Guo, SeyedÂ AliÂ Delbari, AbbasÂ Sabahi Namini, QuyetÂ VanÂ Le, JooÂ YoungÂ Park, DokyoonÂ Kim, RajenderÂ S.Â Varma, HoÂ WonÂ Jang, AliÂ T-Raissi, MohammadrezaÂ Shokouhimehr and ChengÂ Li 113398 Recent advances in Ni-based stable catalysts for methane dry reforming: Stable catalystsâ€™ preparation review SebeteÂ S.Â Mabaleha, FarshadÂ Gholizadeh and PranjalÂ Kalita 113343 Elucidating the alloying effect of PdAg/CNT catalysts on formic acid dehydrogenation with kinetic isotope effect YongwooÂ Kim and DoÂ HeuiÂ Kim 113342 Green synthesis of CaO nanocatalyst using watermelon peels for biodiesel production SubhasmitaÂ Sahu, KankanaÂ Saikia, BaskarÂ Gurunathan, AmarajothiÂ Dhakshinamoorthy and SamuelÂ LalthazualaÂ Rokhum Contents 113382 Transformation of levoglucosan into liquid fuel via catalytic upgrading over Ni-CeO2 catalysts Ala-H.Â Hamid, LabeebÂ Ali, ToyinÂ Shittu, MohamedÂ ShafiÂ Kuttiyathil, OlaÂ Ismail, AbbasÂ Khaleel and MohammednoorÂ Altarawneh 113373 MXene-supported transition metal single-atom catalysts for nitrogen dissociation JosÃ©Â D.Â Gouveia, HenriqueÂ Rocha and JosÃ©Â R.B.Â Gomes 113401 Unveiling the in-situ formation of single-atomically dispersed Pd-Fe bimetallic catalytic sites during anisole hydrodeoxygenation ShuyaÂ Zhang, XiaochenÂ Liu, HongqiaoÂ Lin, RongÂ Chen, YuÂ Chen, YuanjieÂ Xu, KaiyangÂ Xu, HuiboÂ Zhao, LiÂ Tan, LizhiÂ Wu and YuÂ Tang 113356 Corrigendum to â€˜Ultra-high surface area fibrous silica-zirconia support for renewable energy production by CO2 methanationâ€™ [Molecular Catalysis 547 (2023) 113311] A.H.Â Hatta, A.A.Â Jalil, N.S.Â Hassan, M.Y.S.Â Hamid, M.N.Â Haron, W.Â Nabgan, M.B.Â Bahari, M.Â Asmadi and H.D.Â Setiabudi Contents 113328 Corrigendum to â€˜Promoting effect of Ce doping on catalytic performance and water resistance ability for toluene catalytic combustion over the cheap and efficient Mn8Ni2CeaOx catalystsâ€™ [Molecular Catalysis Volume 540, 2023, 113019] YuanyuanÂ Zhou, JieÂ Wan, XiaoliÂ Wang, LinÂ Deng, YanjunÂ Liu, JianfeiÂ Kan, XiankunÂ Yu, XiaojunÂ Yang and GongdeÂ Wu gÂ Zhou, FengÂ Li, ChunÂ Wang, RuiÂ Cao, YongÂ Liu, YatingÂ Yin, HaibaoÂ Chen, ZhenyuÂ Wan, YanchenÂ Zhu and WanliangÂ Yang 2D channel catalyst was designed to promote the epoxidation of methyl oleate due to its accessible open transport channels that facilitate molecular diffusion. Contents 113416 3D homogeneous porous copper-ceria catalyst for solar light driven photothermal CO- PROX in H2-rich gas: Enhanced light absorption and abundant oxygen vacancy XiaolinÂ Guo, SiyiÂ Zhong, WangxiangÂ Ye, AngÂ Zhou, Zi'angÂ Chen, DingfengÂ Jin, QiaolingÂ Kang, MeiqiangÂ Fan and TingliÂ Ma 113419 In-situ generation of ZnS nanoparticles in quasi-MOFs for efficient eNRR ZijingÂ Liu, YanweiÂ Xing, PengÂ Wang, ShuangÂ Wang and JinpingÂ Li ZnS/ZIF-8-l-350 electrocatalyst was prepared by controlling the pyrolysis vulcanization temperature, the Zn nodes of ZIF-8-L reacted with BDS to create ZnS nanoparticles to afford abundant catalytic active sites, the ligands were carbonized to form the N-doped carbon support to effectively inhibit HER while partial framework of ZIF-8-L were remained to provide a wide reaction space. The obtained ZnS/ZIF- 8-l-350 exhibited a remarkable NH3 yield of 53.44 Î¼gÂ·hâˆ’1Â·mgâˆ’1, FE of 15.75% and catalytic stability in electrocatalytic Nitrogen Reduction Reaction (eNRR). 1134 MCAT 113444 113444 S2468-8231(23)00527-8 10.1016/j.mcat.2023.113444 Contents continued",
      "coredata": {
        "eid": "1-s2.0-S2468823123005278",
        "dc:description": null,
        "openArchiveArticle": "false",
        "prism:coverDate": "2023-08-31",
        "openaccessUserLicense": null,
        "prism:aggregationType": "Journal",
        "prism:url": "https://api.elsevier.com/content/article/pii/S2468823123005278",
        "link": [
          {
            "@_fa": "true",
            "@rel": "self",
            "@href": "https://api.elsevier.com/content/article/pii/S2468823123005278"
          },
          {
            "@_fa": "true",
            "@rel": "scidir",
            "@href": "https://www.sciencedirect.com/science/article/pii/S2468823123005278"
          }
        ],
        "dc:format": "application/json",
        "openaccessType": null,
        "pii": "S2468-8231(23)00527-8",
        "prism:volume": "547",
        "articleNumber": "113444",
        "dc:title": "Contents continued",
        "prism:copyright": null,
        "openaccess": "0",
        "prism:issn": "24688231",
        "openaccessArticle": "false",
        "prism:publicationName": "Molecular Catalysis",
        "openaccessSponsorType": null,
        "prism:pageRange": "113444",
        "pubType": "con",
        "prism:coverDisplayDate": "August 2023",
        "prism:doi": "10.1016/j.mcat.2023.113444",
        "prism:startingPage": "113444",
        "dc:identifier": "doi:10.1016/j.mcat.2023.113444",
        "openaccessSponsorName": null
      }
    }
  }
}