{
  "metadata": {
    "title": "Green and efficient oxidative desulfurization of refractory S-compounds from liquid fuels catalyzed by chromium-based MIL-101 stabilized MoO<ce:inf loc=post>x</ce:inf> catalyst",
    "authors": "; ; ",
    "journal": "Molecular Catalysis",
    "date": "2022-04-30",
    "doi": "10.1016/j.mcat.2022.112249",
    "abstract": "",
    "uri": "https://api.elsevier.com/content/article/pii/S2468823122001377",
    "pii": "S2468823122001377"
  },
  "fulltext": {
    "full-text-retrieval-response": {
      "scopus-eid": "2-s2.0-85126944310",
      "originalText": "serial JL 315758 291210 291744 291790 291809 31 Molecular Catalysis MOLECULARCATALYSIS 2022-03-25 2022-03-25 2022-03-25 2022-03-25 2022-04-04T07:58:16 1-s2.0-S2468823122001377 S2468-8231(22)00137-7 S2468823122001377 10.1016/j.mcat.2022.112249 S300 S300.1 FULL-TEXT 1-s2.0-S2468823122X00059 2022-12-12T23:36:40.707959Z 0 0 20220401 20220430 2022 2022-03-25T13:04:34.953773Z absattachment articleinfo articlenumber articletitlenorm authfirstinitialnorm authfirstsurnamenorm cid cids contenttype copyright crossmark dateloaded dateloadedtxt datesearch datesort dateupdated dco docsubtype doctype doi eid ewtransactionid hubeid indexeddate issn issnnorm itemstage itemtransactionid itemweight openaccess openarchive pg pgfirst pii piinorm pubdateend pubdatestart pubdatetxt pubyr sectiontitle sortorder srctitle srctitlenorm srctype ssids alllist content subj subheadings suppl tomb volfirst volissue volumelist webpdf webpdfpagecount yearnav figure table e-component body acknowledge affil appendices articletitle auth authfirstini authfull authkeywords authlast highlightsabst orcid primabst ref specialabst 2468-8231 24688231 true 522 522 C Volume 522 32 112249 112249 112249 202204 April 2022 2022-04-01 2022-04-30 2022 Regular Papers article fla © 2022 Elsevier B.V. All rights reserved. GREENEFFICIENTOXIDATIVEDESULFURIZATIONREFRACTORYSCOMPOUNDSLIQUIDFUELSCATALYZEDBYCHROMIUMBASEDMIL101STABILIZEDMOOXCATALYST GUMUS I 1 Introduction 2 Experimental 2.1 Materials 2.2 Synthesis of MIL-101(Cr) and MIL-101(Cr) supported MoOX catalyst 2.3 Instrumentation 2.4 Oxidative desulfurization procedure 3 Result and discussion 3.1 Characterization 3.2 ODS activity of the catalyst 3.3 Analysis of the oxidation products and the proposed mechanism Conclusion CRediT authorship contribution statement Acknowledgments Appendix Supplementary materials References CHOW 2003 1528 1531 J BHADRA 2019 118021 B RAJENDRAN 2020 2246 2285 A PAWELEC 2013 3376 B YE 2020 2384 2394 G ZHANG 2020 118936 M LIAQUAT 2010 3869 3877 A COLVILE 2001 1537 1565 R ASI 2011 963 970 O VEDACHALAM 2022 122243 S TANIMU 2019 2810 2838 A HUANG 2018 42 56 T WANG 2020 2093 2103 J PENG 2017 4319 4326 L LI 2020 4837 4848 S SHEN 2016 771 781 C BAGHERI 2017 6949 6956 M ABAZARI 2021 119582 R PISCOPO 2020 4721 4731 C SIKARWAR 2018 1736 1744 P ZOU 2021 2100442 J LIU 2019 245 252 Y MOKHTARI 2019 7276 7286 B HE 2019 36666 36675 J ZHANG 2021 1085 1093 M HE 2021 129022 J WANG 2020 38140 38152 H XIANBINLIM 2021 588 633 X LIU 2020 127512 M LIU 2020 6488 6496 Y YE 2020 2819 2824 J SHI 2016 5273 5279 Y GUMUS 2021 111363 I GUMUS 2020 4990 4999 I ABAZARI 2019 14759 14773 R KALAJ 2020 1046 1057 M DHAKSHINAMOORTHY 2012 5262 5284 A DHAKSHINAMOORTHY 2020 454 466 A DHAKSHINAMOORTHY 2011 856 867 A DHAKSHINAMOORTHY 2021 95 A LU 2021 110694 Y MENON 2018 8319 8324 S ZHANG 2017 417 423 X ZHENG 2019 6983 6992 H LI 2020 117671 S YANG 2019 1779 1798 D HAO 2020 6351 6356 L LOW 2009 15834 15842 J BURTCH 2014 10575 10612 N HOWARTH 2016 15018 A FEREY 2005 2040 2042 G HUANG 2012 111 117 Y BERNT 2011 2838 2840 S WANG 2014 11950 11958 X GOMEZPARICIO 2016 508 515 A BROMBERG 2012 1664 1675 L ERTAS 2015 209 220 I ERTAS 2016 94 103 I CHEN 2021 4302 4310 Y LIU 2019 245 252 Y STORCK 1998 137 146 S XIAO 2016 8184 8191 S CAO 2020 117308 Y CHEN 2021 110921 L KAMPOURAKI 2019 6685 6698 Z LI 2020 119224 S WANG 2017 971 979 X BHADRA 2021 129485 B TIAN 2015 618 625 Y MONDOL 2021 119988 M YANG 2018 92 102 G DU 2020 124056 Y YANG 2020 122654 G CHANG 2010 122 126 J ZHANG 2019 117804 X LI 2019 15755 15761 C CHEN 2018 263 273 K YAO 2019 863 871 X XIAO 2020 10149 10155 S BHADRA 2021 119842 B ZOU 2021 118434 J GUMUSX2022X112249 GUMUSX2022X112249XI 2024-03-25T00:00:00.000Z 2024-03-25T00:00:00.000Z http://creativecommons.org/licenses/by-nc-nd/4.0/ © 2022 Elsevier B.V. All rights reserved. 0 https://doi.org/10.15223/policy-017 https://doi.org/10.15223/policy-037 https://doi.org/10.15223/policy-012 https://doi.org/10.15223/policy-029 https://doi.org/10.15223/policy-004 item S2468-8231(22)00137-7 S2468823122001377 1-s2.0-S2468823122001377 10.1016/j.mcat.2022.112249 315758 2022-07-19T10:07:07.350482Z 2022-04-01 2022-04-30 1-s2.0-S2468823122001377-main.pdf https://s3-eu-west-1.amazonaws.com/prod-ucs-content-store-eu-west/content/pii:S2468823122001377/MAIN/application/pdf/8d32ca2504e7fb630a95b169aa85a10f/main.pdf main.pdf pdf true 13531296 MAIN 12 1-s2.0-S2468823122001377-main_1.png https://s3-eu-west-1.amazonaws.com/prod-ucs-content-store-eu-west/content/pii:S2468823122001377/PREVIEW/image/png/e7bef3b8ef5a4b97b1044b75a3e40610/main_1.png main_1.png png 56006 849 656 IMAGE-WEB-PDF 1 1-s2.0-S2468823122001377-gr8.jpg https://s3-eu-west-1.amazonaws.com/prod-ucs-content-store-eu-west/content/pii:S2468823122001377/gr8/DOWNSAMPLED/image/jpeg/d06954b7e10e698d46ae01c0fa233792/gr8.jpg gr8 gr8.jpg jpg 37172 254 636 IMAGE-DOWNSAMPLED 1-s2.0-S2468823122001377-gr1.jpg https://s3-eu-west-1.amazonaws.com/prod-ucs-content-store-eu-west/content/pii:S2468823122001377/gr1/DOWNSAMPLED/image/jpeg/ceafea48ce0a747cdd274ae8a7ec4cee/gr1.jpg gr1 gr1.jpg jpg 55429 725 485 IMAGE-DOWNSAMPLED 1-s2.0-S2468823122001377-gr9.jpg https://s3-eu-west-1.amazonaws.com/prod-ucs-content-store-eu-west/content/pii:S2468823122001377/gr9/DOWNSAMPLED/image/jpeg/148c95a1e6c9ce141769488b23ccf0fb/gr9.jpg gr9 gr9.jpg jpg 39256 245 330 IMAGE-DOWNSAMPLED 1-s2.0-S2468823122001377-gr10.jpg https://s3-eu-west-1.amazonaws.com/prod-ucs-content-store-eu-west/content/pii:S2468823122001377/gr10/DOWNSAMPLED/image/jpeg/6d08245be55bae194cd98ac97aaa1197/gr10.jpg gr10 gr10.jpg jpg 87331 609 597 IMAGE-DOWNSAMPLED 1-s2.0-S2468823122001377-gr6.jpg https://s3-eu-west-1.amazonaws.com/prod-ucs-content-store-eu-west/content/pii:S2468823122001377/gr6/DOWNSAMPLED/image/jpeg/6cdf1b4f2d059ff9717799e1252be827/gr6.jpg gr6 gr6.jpg jpg 62701 287 689 IMAGE-DOWNSAMPLED 1-s2.0-S2468823122001377-gr7.jpg https://s3-eu-west-1.amazonaws.com/prod-ucs-content-store-eu-west/content/pii:S2468823122001377/gr7/DOWNSAMPLED/image/jpeg/9584a69f421090271e193f123c36c0c1/gr7.jpg gr7 gr7.jpg jpg 43432 307 681 IMAGE-DOWNSAMPLED 1-s2.0-S2468823122001377-gr4.jpg https://s3-eu-west-1.amazonaws.com/prod-ucs-content-store-eu-west/content/pii:S2468823122001377/gr4/DOWNSAMPLED/image/jpeg/ef62741b4df135b98ce054753a352b28/gr4.jpg gr4 gr4.jpg jpg 332347 882 648 IMAGE-DOWNSAMPLED 1-s2.0-S2468823122001377-gr5.jpg https://s3-eu-west-1.amazonaws.com/prod-ucs-content-store-eu-west/content/pii:S2468823122001377/gr5/DOWNSAMPLED/image/jpeg/52195bce4b7be6fdde79ec4d2b5e04d2/gr5.jpg gr5 gr5.jpg jpg 83798 789 491 IMAGE-DOWNSAMPLED 1-s2.0-S2468823122001377-gr2.jpg https://s3-eu-west-1.amazonaws.com/prod-ucs-content-store-eu-west/content/pii:S2468823122001377/gr2/DOWNSAMPLED/image/jpeg/6340242fc8a6f8f3c9df4512622467ed/gr2.jpg gr2 gr2.jpg jpg 74932 722 474 IMAGE-DOWNSAMPLED 1-s2.0-S2468823122001377-ga1.jpg https://s3-eu-west-1.amazonaws.com/prod-ucs-content-store-eu-west/content/pii:S2468823122001377/ga1/DOWNSAMPLED/image/jpeg/172c8d189f8fd33de953e2b20f31189d/ga1.jpg ga1 true ga1.jpg jpg 23763 245 240 IMAGE-DOWNSAMPLED 1-s2.0-S2468823122001377-gr3.jpg https://s3-eu-west-1.amazonaws.com/prod-ucs-content-store-eu-west/content/pii:S2468823122001377/gr3/DOWNSAMPLED/image/jpeg/ea5a54d73bea9b3da853985442223185/gr3.jpg gr3 gr3.jpg jpg 84133 769 503 IMAGE-DOWNSAMPLED 1-s2.0-S2468823122001377-gr8.sml https://s3-eu-west-1.amazonaws.com/prod-ucs-content-store-eu-west/content/pii:S2468823122001377/gr8/THUMBNAIL/image/gif/635324c6bd223ea2a24401913b88614f/gr8.sml gr8 gr8.sml sml 7277 88 219 IMAGE-THUMBNAIL 1-s2.0-S2468823122001377-gr1.sml https://s3-eu-west-1.amazonaws.com/prod-ucs-content-store-eu-west/content/pii:S2468823122001377/gr1/THUMBNAIL/image/gif/51793f229d8fa60a06654fcb934f760a/gr1.sml gr1 gr1.sml sml 6695 163 109 IMAGE-THUMBNAIL 1-s2.0-S2468823122001377-gr9.sml https://s3-eu-west-1.amazonaws.com/prod-ucs-content-store-eu-west/content/pii:S2468823122001377/gr9/THUMBNAIL/image/gif/7e9655841994e7d95e80e96de4e302d9/gr9.sml gr9 gr9.sml sml 14778 163 219 IMAGE-THUMBNAIL 1-s2.0-S2468823122001377-gr10.sml https://s3-eu-west-1.amazonaws.com/prod-ucs-content-store-eu-west/content/pii:S2468823122001377/gr10/THUMBNAIL/image/gif/582a053b235bdd8a81500befa650902a/gr10.sml gr10 gr10.sml sml 8424 163 160 IMAGE-THUMBNAIL 1-s2.0-S2468823122001377-gr6.sml https://s3-eu-west-1.amazonaws.com/prod-ucs-content-store-eu-west/content/pii:S2468823122001377/gr6/THUMBNAIL/image/gif/07c677c4a9f8ea11798214c23113310a/gr6.sml gr6 gr6.sml sml 8117 91 219 IMAGE-THUMBNAIL 1-s2.0-S2468823122001377-gr7.sml https://s3-eu-west-1.amazonaws.com/prod-ucs-content-store-eu-west/content/pii:S2468823122001377/gr7/THUMBNAIL/image/gif/230e63ad1054bfb46ecf3a370ebd37d7/gr7.sml gr7 gr7.sml sml 7442 99 219 IMAGE-THUMBNAIL 1-s2.0-S2468823122001377-gr4.sml https://s3-eu-west-1.amazonaws.com/prod-ucs-content-store-eu-west/content/pii:S2468823122001377/gr4/THUMBNAIL/image/gif/8c92190204306bdba182d911edfcb9e7/gr4.sml gr4 gr4.sml sml 19101 163 120 IMAGE-THUMBNAIL 1-s2.0-S2468823122001377-gr5.sml https://s3-eu-west-1.amazonaws.com/prod-ucs-content-store-eu-west/content/pii:S2468823122001377/gr5/THUMBNAIL/image/gif/77b8d110ade1ae749260826264ebf4da/gr5.sml gr5 gr5.sml sml 8582 164 102 IMAGE-THUMBNAIL 1-s2.0-S2468823122001377-gr2.sml https://s3-eu-west-1.amazonaws.com/prod-ucs-content-store-eu-west/content/pii:S2468823122001377/gr2/THUMBNAIL/image/gif/50c2ab52925df45e604fe8831ba7fb11/gr2.sml gr2 gr2.sml sml 8217 163 107 IMAGE-THUMBNAIL 1-s2.0-S2468823122001377-ga1.sml https://s3-eu-west-1.amazonaws.com/prod-ucs-content-store-eu-west/content/pii:S2468823122001377/ga1/THUMBNAIL/image/gif/2a8d72b63f8c690a05320da86ad7fccc/ga1.sml ga1 true ga1.sml sml 9110 163 160 IMAGE-THUMBNAIL 1-s2.0-S2468823122001377-gr3.sml https://s3-eu-west-1.amazonaws.com/prod-ucs-content-store-eu-west/content/pii:S2468823122001377/gr3/THUMBNAIL/image/gif/aa383114eeaab6ad9af3d2af4d00a43b/gr3.sml gr3 gr3.sml sml 8296 164 107 IMAGE-THUMBNAIL 1-s2.0-S2468823122001377-gr8_lrg.jpg https://s3-eu-west-1.amazonaws.com/prod-ucs-content-store-eu-west/content/pii:S2468823122001377/gr8/HIGHRES/image/jpeg/a102e85f58a4138c202858fcdd90500a/gr8_lrg.jpg gr8 gr8_lrg.jpg jpg 282249 1126 2816 IMAGE-HIGH-RES 1-s2.0-S2468823122001377-gr1_lrg.jpg https://s3-eu-west-1.amazonaws.com/prod-ucs-content-store-eu-west/content/pii:S2468823122001377/gr1/HIGHRES/image/jpeg/a522c4954214f372ccfeb444ca728295/gr1_lrg.jpg gr1 gr1_lrg.jpg jpg 478204 3211 2149 IMAGE-HIGH-RES 1-s2.0-S2468823122001377-gr9_lrg.jpg https://s3-eu-west-1.amazonaws.com/prod-ucs-content-store-eu-west/content/pii:S2468823122001377/gr9/HIGHRES/image/jpeg/052bd8a3d73cb91ebe61f6bf7ac3804e/gr9_lrg.jpg gr9 gr9_lrg.jpg jpg 538964 1087 1463 IMAGE-HIGH-RES 1-s2.0-S2468823122001377-gr10_lrg.jpg https://s3-eu-west-1.amazonaws.com/prod-ucs-content-store-eu-west/content/pii:S2468823122001377/gr10/HIGHRES/image/jpeg/1da77f69737ce57128b398d321df5a82/gr10_lrg.jpg gr10 gr10_lrg.jpg jpg 714634 2696 2642 IMAGE-HIGH-RES 1-s2.0-S2468823122001377-gr6_lrg.jpg https://s3-eu-west-1.amazonaws.com/prod-ucs-content-store-eu-west/content/pii:S2468823122001377/gr6/HIGHRES/image/jpeg/b9b92b231487f5ea3f3e7db3f2685cf9/gr6_lrg.jpg gr6 gr6_lrg.jpg jpg 716316 1269 3049 IMAGE-HIGH-RES 1-s2.0-S2468823122001377-gr7_lrg.jpg https://s3-eu-west-1.amazonaws.com/prod-ucs-content-store-eu-west/content/pii:S2468823122001377/gr7/HIGHRES/image/jpeg/c5f79182d11dc119e6d720836c58faaf/gr7_lrg.jpg gr7 gr7_lrg.jpg jpg 420908 1361 3016 IMAGE-HIGH-RES 1-s2.0-S2468823122001377-gr4_lrg.jpg https://s3-eu-west-1.amazonaws.com/prod-ucs-content-store-eu-west/content/pii:S2468823122001377/gr4/HIGHRES/image/jpeg/0d82253e1c76b2516178beed11056810/gr4_lrg.jpg gr4 gr4_lrg.jpg jpg 4698316 3907 2871 IMAGE-HIGH-RES 1-s2.0-S2468823122001377-gr5_lrg.jpg https://s3-eu-west-1.amazonaws.com/prod-ucs-content-store-eu-west/content/pii:S2468823122001377/gr5/HIGHRES/image/jpeg/06d0c19e9538cef31e25874230ee73af/gr5_lrg.jpg gr5 gr5_lrg.jpg jpg 755493 3493 2173 IMAGE-HIGH-RES 1-s2.0-S2468823122001377-gr2_lrg.jpg https://s3-eu-west-1.amazonaws.com/prod-ucs-content-store-eu-west/content/pii:S2468823122001377/gr2/HIGHRES/image/jpeg/c66469771ec9041744bc023256965703/gr2_lrg.jpg gr2 gr2_lrg.jpg jpg 651993 3199 2101 IMAGE-HIGH-RES 1-s2.0-S2468823122001377-ga1_lrg.jpg https://s3-eu-west-1.amazonaws.com/prod-ucs-content-store-eu-west/content/pii:S2468823122001377/ga1/HIGHRES/image/jpeg/172805e74474d5d7cd6e34434e367542/ga1_lrg.jpg ga1 true ga1_lrg.jpg jpg 161852 1085 1062 IMAGE-HIGH-RES 1-s2.0-S2468823122001377-gr3_lrg.jpg https://s3-eu-west-1.amazonaws.com/prod-ucs-content-store-eu-west/content/pii:S2468823122001377/gr3/HIGHRES/image/jpeg/a8d8cdcfafc24672702c9bd2d4a6474b/gr3_lrg.jpg gr3 gr3_lrg.jpg jpg 739346 3411 2230 IMAGE-HIGH-RES 1-s2.0-S2468823122001377-mmc1.doc https://s3-eu-west-1.amazonaws.com/prod-ucs-content-store-eu-west/content/pii:S2468823122001377/mmc1/MAIN/application/msword/3260efd26b77254c79fca2df209495b2/mmc1.doc mmc1 mmc1.doc doc 7138304 APPLICATION 1-s2.0-S2468823122001377-am.pdf am am.pdf pdf 2131003 AAM-PDF https://s3-eu-west-1.amazonaws.com/prod-ucs-content-store-eu-west/content/egi:10JH6SGTQ7J/MAIN/application/pdf/872d7ce2a8cc25f5f14ca93754c8bb1e/am.pdf MCAT 112249 112249 S2468-8231(22)00137-7 10.1016/j.mcat.2022.112249 Fig. 1 P-XRD patterns of the MIL-101(Cr) (magenta line) and MoOx/MIL-101(Cr) catalyst (red line). Fig. 1 Fig. 2 FT-IR spectra of the MIL-101(Cr) (blue line) and MoOx/MIL-101(Cr) catalyst (black line). Fig. 2 Fig. 3 N2 adsorption-desorption isotherms recorded at 77 K for the MIL-101(Cr) and MoOx/MIL-101(Cr) catalyst. Fig. 3 Fig. 4 SEM images shown at different scales (a–c), and the corresponding elemental mapping C (e), O (f), Cr (g) and Mo (h) in the MoOx/MIL-101(Cr) catalyst that was obtained from the scanning electron microscope. Fig. 4 Fig. 5 (a) Survey XPS spectrum of the MoOx/MIL-101(Cr) catalyst and (b) high-resolution XPS spectrum of Mo 3d core level. Fig. 5 Fig. 6 Effects of (a) temperature, and (b) O/S ratio to DBT oxidation over 3%-MoOx/MIL-101(Cr) catalyst. Fig. 6 Fig. 7 (a) Effects of different Mo-loading amount on the removal of DBT, (b) time dependent removal of DBT. Fig. 7 Fig. 8 ODS of selected RSCs over MoOx/MIL-101(Cr) under optimal reaction conditions. Fig. 8 Fig. 9 Recycling experiments of 3%-MoOx/MIL-101(Cr) catalyst in the removal of DBT under optimal reaction conditions. Fig. 9 Fig. 10 Plausible reaction mechanism of H2O2 decomposition and DBT oxidation over MoOx/MIL-101(Cr) catalyst. Fig. 10 Table 1 Comparison of oxidative desulfurization efficiency of DBT with different Mo-based catalyst systems. Table 1 Entry Catalyst Oxidant S0 Timemin S-removal (%) Temp. (◦C) TOF(h−1) Refs. 1 16 wt% Mo/γ-Al2O3 H2O2 320 ppmw 60 99.6 60 7 [69] 2 Mo2N@C-3 H2O2 1000 ppm 20 100 60 30 [70] 3 α-MoO3/C2-S-11-10 H2O2 500 ppm 240 100 30 1.45 [71] 4 Mo/TiO2 H2O2 500 ppm 100 100 60 – [72] 5 a MoO3/SiO2 H2O2 500 ppm 20 (60) 33.5 (100) 70 56.6 (18.86) [73] 6 15%-wt MoO3/Ca-SiO2 CHP 1000 ppm 82 70 – [74] 7 PMo12@UiO-67 TBHP 500 ppm 30 99 50 – [18] 8 PMA/UiO-66 TBHP 500 ppm 60 100 80 [75] 9 MoOx/MS-600 Air 200 ppm 240 98 120 – [76] 10 MoO2/g-C3N4 TBHP 500 ppm 60 100 80 – [77] 11 VO-MoO2@NC CHP 500 ppm 40 100 70 – [21] 12 MoOx/MIL-101(Cr) H2O2 1000 ppm 90 99 60 44.36b This Study a TOF was defined as a mole of S converted per mole of Mo per hour at 20 min reaction. b TOF was defined as mole of S converted per mole of Mo per hour as the active site at 90 min of reaction. Green and efficient oxidative desulfurization of refractory S-compounds from liquid fuels catalyzed by chromium-based MIL-101 stabilized MoOx catalyst Ilkay Gumus Conceptualization Formal analysis Writing – original draft Writing – review & editing a b ⁎⁎ Yasar Karatas Formal analysis Writing – original draft Writing – review & editing c Mehmet Gülcan Conceptualization Formal analysis Writing – original draft Writing – review & editing c ⁎ a Advanced Technology Applied and Research Center, Mersin University, Mersin 33343, Turkey Advanced Technology Applied and Research Center Mersin University Mersin 33343 Turkey aAdvanced Technology Applied and Research Center, Mersin University, Mersin 33343, Turkey b Department of Basic Sciences, Faculty of Maritime, Mersin University, Mersin 33343, Turkey Department of Basic Sciences Faculty of Maritime Mersin University Mersin 33343 Turkey bDepartment of Basic Sciences, Faculty of Maritime, Mersin University, Mersin 33343, Turkey c Department of Chemistry, Faculty of Science, Van Yüzüncü Yıl University, Van 65080, Turkey Department of Chemistry Faculty of Science Van Yüzüncü Yıl University Van 65080 Turkey cDepartment of Chemistry, Faculty of Science, Van Yüzüncü Yıl University, Van 65080, Turkey ⁎ Corresponding author. ⁎⁎ Corresponding author at: Advanced Technology Applied and Research Center, Mersin University, Mersin 33343, Turkey. Advanced Technology Applied and Research Center Mersin University Mersin 33343 Turkey In this work, MoOx/MIL-101(Cr) a new composite material, involving the collaboration of MoOx and MIL-101(Cr) to remove the refractory S-compounds (RSCs) from fuels via oxidative desulfurization (ODS) process were successfully synthesized. The prepared catalyst was characterized by scanning electron microscopy (SEM), energy-dispersive spectroscopy (EDX), powder X-ray diffraction (P-XRD), inductively coupled plasma optical emission spectroscopy (ICP-OES), fourier transform infrared spectroscopy (FT-IR), N2 sorption measurement (BET) and X-ray photoelectron spectroscopy (XPS). The prepared MoOx/MIL-101(Cr) was applied for the ODS of model fuel oil and showed the remarkably catalytic activity for the removal of RSCs from model fuel oil via oxidation. In addition, the effect of Mo-loading amount, H2O2/sulfur (O/S) molar ratio, and reaction temperature on the ODS reactivity were investigated. To explore the specific reaction mechanism of ODS over the MoOx/MIL-101(Cr), the effect of radical scavengers on ODS activity was examined. The radical scavengers experiments showed that the present oxidation reaction occurred through a radical mechanism involving the formation of •OH and •O2 ͞ species. In addition, it was found that the ODS efficiency is majorly related to the Mo5+ species forming with electron transfer to Mo6+ ion from Lewis acid sites of MIL-101(Cr). Furthermore, the MoOx/MIL-101(Cr) catalyst possesses recycling performance and remarkable stability, and even after five recycles, the removal of DBT was >94.8%. Hence, it could be confirmed that MoOx/MIL-101(Cr) is very useful in the ODS to remove RSCs from fuels in the presence of H2O2. Graphical abstract Image, graphical abstract Keywords Catalyst MIL-101(Cr) MOFs Molybdenum Oxidative desulfurization 1 Introduction In spite of the enhancement popularity of new energy applications, nearly 90% of the world-wide energy resources are still provided from fossil fuels [1,2]. However, raw fossil fuels contain many contaminants such as inherently occurring S-containing organic compounds [3–6]. The combustion of sulfur compounds produces toxic SOx species and, in addition to their noxious effects on living organisms, causes serious health/environmental problems such as ecological instability, air and water pollution, and acid rains [7,8]. In addition to these problems, S-compounds in fuels are known to inactivate catalysts, causing damage and corrosion of metal refinery equipment such as pipelines and pumps [9]. Thus, in many countries, sulfur contents in fuel oils have been restricted to ultra-low levels (< 10 ppm) due to strict environmental regulations [2,10], and removal of those contaminants from the fuels before use has become one of the biggest concerns in recent years. Nowadays, hydrodesulfurization (HDS) is a popular process used in the petroleum refining industry [11]. This methodology is effective in the removal of various S-containing compounds (disulfides, sulfides, thiol, etc.). However, HDS requires hard reaction conditions (p > 2500 kPa; T > 250 °C and high H2 consumption) to remove RSCs due to their electron density as well as the steric factor that exists around the sulfur atom [11,12]. Recently, alternative fuel desulfurization processes have also been intensively investigated to overcome the drawbacks of HDS [13–15]. In particular, the oxidative desulfurization (ODS) process has been attracting researchers’ attention as a new technique owing to its benefits such as moderate operating procedure (atmospheric pressure in the absence of H2, etc.) as well as the prominent activity in removing RSCs [16–19]. Generally, ODS is a two-step process: (i) oxidation of S-containing compounds to their respective sulfoxides and/or sulfones with an oxidizing agent (such as t‑butyl hydroperoxide (TBHP), cyclohexanone peroxide (CYHPO), cumene hydroperoxide (CHP), ozone, hydrogen peroxide (H2O2), t‑butyl hypochlorite (t-BuOCl)) (ii) removal of oxidized end products from the oil using adsorbents or polar extractive solvent [20–23]. Among oxidants used, H2O2 is a favorite as an oxidant for ODS due to its low cost, high oxidation capacity, and environment-friendly. However, it should be noted that using a catalyst to activate H2O2 effectively during the oxidative process is still a challenge. The performance of ODS is always related to the nature of the catalyst. Thus, a key scientific issue to realize this technology is the development of high-performance catalysts. Up to now, many species of economical metal oxides (Ti(IV), W(VI), Mo(VI), and V(V) oxides, etc.) have been widely researched for the ODS purification process of fuels because of the distinctive chemical properties such as the adjustable charge states and stable structures [24–28]. Among them, MoO3, with outstanding catalytic activity, superior Lewis acidity, structural versatility, as well as cost-effective, has been widely used in recent years. What is more, the switchable oxidation states of MoO3 (Mo6+/Mo5+/Mo4+) make MoOx an excellent promoter for free radical reactions that can facilitate electron transfer between the substrate and support [29]. The MoOx with oxygen vacancies/defects can remarkably increase the oxidation of RSCs, activating hydrogen peroxide [30,31]. This is considered to be the driving force for the oxidation of RSCs. In addition, bulk MoO3 may exhibit poor catalytic performance in case of limited access to its active sites and severe aggregation [32]. To expose more active sites, immobilization of MoO3 on a proper carrier with a high specific surface can promote activity by increasing accessibility to active species. Recently, a class of porous hybrid materials, that are known as metal−organic frameworks (MOFs) have been of great interest for several applications thanks to the highly specific nature of their surface areas, tunable pore structure, unsaturated coordinative sites, and ready modification/functionalization [33–38]. The pores of MOFs can be used as an appropriate host to place and immobilize catalytically active species in their cavities [19,39,40]. The presence of coordinatively unsaturated Lewis acid regions/sites in the MOFs can also provide opportunities as anchoring points for the immobilization of active species via a post-synthetic modification [41]. On the other hand, it is known that the coordinatively unsaturated Lewis acid sites in frameworks can catalyze the decomposition of hydrogen peroxide, generating the reactive oxygen species (hydroxyl and/or superoxide radicals) [19,42–44]. The generated radicals can be stabilized on the surface of MOFs and act as the main oxygen source for S-compounds. Thus far, the various structures of MOF have been employed as porous and flexible supports for the fuel purification process [Error! Bookmark not defined. [19,45]. The limited thermo-chemical durability of several MOFs can lead to drawbacks that hinder their activities. Besides, most MOFs with the microporous structure can restrict the rate of mass transfer as well as the admittance of substrates into their centers, which are catalytically active [46,47]. Therefore, producing robust MOFs structures having larger pore sizes is extremely significant for the effective removal of S-compounds via ODS. One of the highest hydrolytic stability among MOFs is chromium-based MIL-101 owing to the kinetic inertness of metal center (Cr3+) regarding ligand exchange [48–50]. Compared to an average MOF, it possesses a high surface area, with a SBET that is up to 4000 m2 g−1, large pore size, thermal and chemical resistance towards water, and various solvents. MIL-101(Cr) has also two different kinds of mesoporous cages (29 and 34 Å) that can be accessed via microporous windows (12 and 16 Å) [51–54]. Such features make MIL-101(Cr) ideal candidates for fast diffusion of bulky ODS substrates (particularly DBT and its derivatives) into the active sites. The pristine MIL-101(Cr) was applied as a catalyst for oxidative desulfurization of DBT and its derivatives [55]. However, it suffers from some drawbacks, such as the long induction period (6 h), the low initial S concentration (200 ppm), a long reaction time (24 h), and high temperature (120 °C) [55]. Considering the above facts, in the current research, we combined the large surface area of the MIL-101(Cr) support with the unique features of the molybdenum oxide and designed a new composite material, MoOx/MIL-101(Cr). To the best of our knowledge, there are no reports describing the use of MoOx/MIL-101(Cr) catalyst in ODS processes. The ODS performance of MoOx/MIL-101(Cr) was investigated towards various RSCs (benzothiophene, dibenzothiophene 4,6-dimethyldibenzothiophene), using H2O2, in a biphasic system. MoOx/MIL-101(Cr) displayed a remarkable performance in the conversion of S-compounds. Also, it was found that the ODS reactivity is majorly related to the existence of the active sites on the MoOx/MIL-101(Cr) (Mo5+ and Cr3+) as well as the structure of the RSCs. What is more, the catalyst also has a very stable recycling ability, displaying a perfect expectation for application in the industry in the future. 2 Experimental 2.1 Materials Chromium trinitrate nonahydrate (Cr(NO3)3•9H2O, 99%), MoO2(acac)2 (Bis(acetylacetonato)dioxomolybdenum(VI)), benzene-1,4-dicarboxylic acid (C6H4-1,4-(CO2H)2, 98%), benzothiophene (C8H6S, BT, 98%), dibenzothiophene (C12H8S, DBT, 98%), 4,6-dimethyldibenzothiophene (C14H12S, 4,6-DMDBT, 97%), H2O2 (34.5-36.5 wt%), acetonitrile (CH3CN, 99.8%), methanol (CH3OH, 99%), acetone (CH3COCH3, 99.5%), n-decane (CH3(CH2)8CH3, 99%) and hydrochloric acid (HCl, 37%) were procured from commercial providers and were used without further modification. 2.2 Synthesis of MIL-101(Cr) and MIL-101(Cr) supported MoOX catalyst The hydrothermal method, well known in the literature, was used to synthesize the MIL-101(Cr) host matrix [56–58]. To prepare of MIL-101(Cr) supported MoOx catalyst; as the metal precursor, MoO2(acac)2 was used to synthesize the MIL-101(Cr) supported catalyst by using an builded SIM (solvothermal deposition in MOFs) method [59]. MIL-101(Cr) (150 mg), MoO2(acac)2 (15.29 mg, 0.48 mmol), and methanol (3 mL) were added to a vial. To completely dissolve the Mo precursor, the mixture was ultrasonicated for 15 min. After, to control the Mo-loading amount on MIL-101(Cr) it was stirred at 60 °C for 24 h. Subsequently, the obtained product was first collected and was then washed using methanol (3 × 20 mL) and acetone (3 × 20 mL), respectively. Finally, the product was thermally activated under a high vacuum for 8 h at 100 °C. The amount of Mo-loading was found to be 0.90 ± 0.01% (w/w) Mo on MIL-101(Cr). 2.3 Instrumentation The structures of the MIL-101(Cr) host material and MoOx/MIL-101(Cr) catalyst were characterized by P-XRD, ICP-OES, SEM, SEM-Elemental mapping, FT-IR, N2 sorption measurement (BET), and XPS techniques (see details in the Supporting Information). 2.4 Oxidative desulfurization procedure First, the model oil, which has an S-content of approximately 1000 ppm, was prepared via the use of a specific amount of S-compounds in n-decane (50 mL). In a typical ODS process, 5 mL of model oil and 5 mL of acetonitrile (as an extracting solvent) was placed in a reaction tube and stirred for 10 min to get extraction equilibrium. Then, 25 mg of MoOx/MIL-101(Cr) and 34.5–36.5% H2O2 (molar ratio of O/S=10) were added. The reaction was heated to the desired temperature was performed while stirring it at a constant speed. Samples from the acetonitrile and/or model oil phase for the quantification of the sulfur content were analyzed via the use of gas chromatography (GC). 3 Result and discussion 3.1 Characterization P-XRD, ICP-OES, SEM, SEM-Elemental Mapping, FT-IR, XPS and BET techniques were used to reveal structural and morphological features of MIL-101(Cr) host material and MoOx/MIL-101(Cr) catalyst. First, ICP-OES analysis was performed to determine the amount of Mo supported on MIL-101(Cr), and the Mo content of prepared MoOx/MIL-101(Cr) catalyst was found to be 0.90 ± 0.01 wt% (theoretical loading 3.0 wt% Mo). MoOx/MIL-101(Cr) catalyst was synthesized by using MoO2(acac)2 precursor by depositing on MIL-101(Cr) surface with an easy, low-cost, and reproducible method. Fig. 1 presents the P-XRD patterns of bare MIL-101(Cr) and MoOx/MIL-101(Cr) showing similar main diffraction peaks. In other words, the addition of MoO2(acac)2 to the synthetic medium of MIL-101(Cr) did not change the crystal structure of MIL-101(Cr). This means that the crystal structure of MIL-101(Cr) was well preserved following the addition of the MoO2(acac)2 [18,33,34]. The nonappearance of any diffraction ascribed to molibdenum can be explained by low loading wt% of Mo onto host material (containing 0.90 wt% Mo as determined by ICP-OES). In addition, Fig. S1 shows the P-XRD patterns of MoOx/MIL-101(Cr) samples containing different amounts (0.5, 1.0, 2.0, and 3.0 wt% Mo) of molybdenum (0.32, 0.43, 0.72 and 0.90 wt% Mo loading) found in ICP-OES analysis. Evaluation of the P-XRD patterns clearly showed that the crystallinities of MoOx/MIL-101(Cr) samples at different Mo loadings were very close to each other and new phases did not emerge. The FT-IR spectra of both MIL-101(Cr) and MoOx/MIL-101(Cr) confirm the bands that were attributed to the solid support vibrations (Fig. 2 ). In Fig. 2, the peaks are seen at 1619 cm−1 which is compatible with the C=O stretching vibrations of the carboxyl group from terephthalic acid. Besides, the O-C-O symmetric stretching vibrations of the terephthalic acid were seen at 1405 cm−1. Furthermore, the aromatic C=C stretching vibrations were shown at 1508 cm−1 as a weak peak. When comparing the FT-IR spectrum of MoOx/MIL-101(Cr) catalyst with MIL-101(Cr) spectrum; both of them have the peaks that were similar in the same region. Moreover, results such as these are considered as a sign that the chemical structure of MIL-101(Cr) has not been changed in the throughout the synthesis of the MoOx/MIL-101(Cr) [33,34,50,56]. Also, two weak characterization vibrations were seen in the spectrum of MoOx/MIL-101(Cr) at 941 cm−1 and 886 cm−1, which can be assigned to symmetrical and asymmetrical vibrations of O-Mo-O [60]. Furthermore, Fig. S2 depicts the FT-IR spectra of MoOx/MIL-101(Cr) samples containing different amounts of molybdenum (0.5, 1.0, 2.0, and 3.0 wt% Mo). The results revealed that low Mo loading did not significantly change the spectra, as expected (containing 0.32, 0.43, 0.72 and 0.90 wt% Mo as determined by ICP-OES, respectively). The N2 adsorption-desorption isotherms of MIL-101(Cr) and MoOx/MIL-101(Cr) catalyst are presented in Fig. 3 to identify the presence of MoOx in the micropores (type I shape) of MIL-101(Cr) [61]. Table S1 presents a list of the textural features related to the MIL-101(Cr) and MoOx/MIL-101(Cr) samples, which have BET surface areas and maximum micro-pore volumes (Vμ), the pore sizes. During the proper incorporation of MoOx into MIL-101(Cr), partial decrease in both surface area (from 2442 m2 g−1 to 2432 m2 g−1) and total pore volume of MIL-101(Cr) (from 1.31 cm3 g−1 to 1.27 cm3 g−1) were observed. This should be associated with pore blockage of the MIL-101(Cr) by MoOx species or their accumulation on the cage windows of MIL-101(Cr) host material. Further, in the N2 adsorption-desorption isotherm (Fig. 3) of MoOx/MIL-101(Cr), hysteresis loop did not observed that of MIL-101(Cr) framework. This showed that the procedure that was followed to ensure the synthesis of MoOx/MIL-101(Cr) did not result in the production of any mesopores in MIL-101(Cr) framework [57,58]. SEM analysis and corresponding elemental mapping of the MoOx/MIL-101(Cr) catalyst in Fig. 4 (a–h) shows the existence of Mo, Cr, C, and O in MoOx/MIL-101(Cr) catalyst, further verifying the incorporation of MoOx into MIL-101(Cr). XPS technique was used to investigate its the chemical composition as well as the valence states of active components in the MoOx/MIL-101(Cr). Fig. 5 demonstrates that C, O, Cr, and Mo elements are identified in the MoOx/MIL-101(Cr) catalyst. Meantime, the deconvolution Mo 3d peak showed that two types of Mo element valences were present in the MoOx (Fig. 5(b)). The doublets observed at 231.11 and 234.18 eV the Mo 3d5/2 and Mo 3d3/2 regions of the spectrum were ascribed to the Mo5+, whereas those observed at 231.91 and 234.91 eV are characteristic for Mo6+ valance state [29,62]. The presence of Mo5+ in the catalyst is caused by the formation of oxygen vacancies which are resulted from the metal-support interaction [21,63]. 3.2 ODS activity of the catalyst In this study, we purposed to evaluate the ODS performance of a new molybdenum based composite material anchored on the MIL-101(Cr) and chosen various RSCs (4,6-dimethyldibenzothiophene (4,6-DMBT)), dibenzothiophene (DBT), and benzothiophene (BT)) based on the commonly founded species in fuel feedstocks. At first, with the objective of optimizing the ODS conditions, the influence of some experimental parameters (amount of Mo loading, H2O2/sulfur molar ratio (O/S), reaction temperature/time) on the oxidation of RSCs was screened and the conversion of DBT as a model S-compound within an acetonitrile/decane biphasic system was selected to be the benchmark reaction. The first reaction for the conversion of DBT was conducted, carried out in the presence of 3%-MoOx/MIL-101(Cr) catalyst with a H2O2/Sulfur (O/S) ratio of 8 at 30 °C and after 90 min, the conversion of DBT was only 33%. It is well known that the oxidation of DBT increases at high temperatures owing to the formation of active metallic peroxides increases at high temperatures [64]. Therefore, the oxidation of DBT at higher temperatures (i.e. 45, 60, and 75 °C) was performed to determine the optimum reaction temperature (Fig. 6 (a)). The results showed that with an increase in the reaction temperature from 30 to 60 °C, the DBT conversion rate gradually increased from 33% to 86% within a reaction time of 90 min, as given in Fig. 6(a). This can be attributed to the activation of acidic surface groups (catalytically active species), and the increase in the system thermodynamic, which resulted in an increased mass transfer, resulting in diffusion inside of the pores in the direction of the active centers [65]. In contrast, when the temperature was enhanced to 75 °C, the ODS rate of DBT did not considerably change which can likely be based on the increased decomposition of H2O2 at a higher temperature. By the way, no oxidation of DBT was observed in the presence of H2O2 without the use of catalyst at 60 °C, indicating that MoOx/MIL-101(Cr) acts as a catalyst in the reaction. In the ODS, another key parameter that can be used in the evaluation of the desulfurization performance of the catalyst is the O/S ratio (Fig. 6(b)). Theoretically, the oxidation of DBT to DBT sulfone (DBTO2) requires 2 equivalents of H2O2. However, most ODS processes to get effective removal of S-compounds need a high O/S ratio as a result of side reactions, which contain the thermal decomposition of the H2O2. In order to gain more understanding, the ODS performance of 3%-MoOx/MIL-101(Cr) was also evaluated under reaction conditions with different H2O2/DBT molar ratios (i.e. 2, 4, 6, 8, 10 and 12). Fig. 6(b) shows the effect of the O/S molar ratio on the removal of DBT from the model oil. The results indicated that in the O/S ratio, an increment from 2 to 10 affected the oxidation of DBT, increasing dramatically from 12 to 92%. However, with a further increase of the O/S (i.e. 12), the desulfurization activity was observed to decrease slightly (90%). Even though the desulfurization activity increases with the increase of H2O2, the water produced from the decomposition of excess H2O2 can reduce the reaction rate as it blocks the catalytically active sites [62]. The results obtained showed that the amount of H2O2 has a significant effect on ODS reactions and must be balanced to be able to effectively remove the S-compounds. The performances of the ODS catalysts depend significantly on the amount of metal loading since they form catalytically active metallic peroxide species during the ODS process. Therefore, the effect that of Mo loading as the active metal on the catalytic performance was investigated. In this regard, 0.5, 1.0, 2.0, and 3.0 wt% Mo contents were prepared and evaluated for conversion reactions of DBT using the O/S ratio of 10 at 60 °C. It was found that the conversion of DBT increased from 36 to 99% gradually when the amount of Mo loading was raised from 0.5 to 3.0 wt% as a result of more active metallic peroxide intermediate species being present (Fig. 7 (a)). As a result, the 3 wt%-MoOx/MIL-101(Cr) was chosen as a favorable catalyst and used for further optimization studies. Meanwhile, in the ODS reaction, pristine MIL-101 achieved 28% removal of DBT, which was significantly lower than catalysts with Mo-containing components. This indicated that Mo species act as key active sites during ODS reactions. Once the optimum catalyst has been determined, the time-dependent ODS reaction of DBT was monitored to determine the optimum reaction time. As presented in Fig. 7(b), the removal of DBT via MoOx/MIL-101(Cr) proceeded for 90 min. The DBT conversion was about 48% within 15 min, and the conversion reached 99% within 90 min. Thus, 90 min was considered to be an optimal reaction time (Fig. 7(b). It is well known that besides DBT, various RSCs are also available in real fuel oils [2,3,66]. For this reason, it was necessary to investigate the ODS process over the prepared catalyst for the various RSCs. BT and 4,6-DMDBT widely existed in diesel were chosen as the additional substrates to discuss. Under the determined reaction conditions, oxidative removal of the S-compounds showed a decrease in the following order: DBT > 4,6-DMDBT > BT with 99%, 92%, and 52%, respectively, which is consistent some reported porous catalysts (Fig. 8 ) [43,67]. In the ODS process, the conversion/removal of RSCs depends on the electron density around the S-atom, and reactivity is often increased via an increase in the electron density on the S-atom. The electron density onto the S-atom of DBT, 4,6-DMDBT and BT is 5.760, 5.793, and 5.739, respectively [68]. Thereby, the order of activity observed (DBT > BT; except 4,6-DMDBT) can be associated with the electron density on the S-atom. On the other hand, the lower activity of 4,6-DMDBT with a higher electron density on the S-atom when compared to the DBT may have been due to the large steric effect caused by the two -CH3 groups on the aromatic rings [44]. In order to evaluate the relative performance of the prepared MoOx/MIL-101(Cr) in the present ODS reaction, previous studies based on Mo-based catalysts were compared, as can be seen in Table 1 . It was observed that most of the catalysts were effective in ODS reactions at ≥60 °C. Among the Mo-based catalysts, when comparing by taking into consideration performances, including the initial concentration of DBT, conversion of DBT, TOF, oxidant type, and reaction temperature, the designed MoOx/MIL-101(Cr) might be considered as one of the most active catalysts. Because, MoOx/MIL-101(Cr) possess the highest TOF (44.36 h−1), compared to reported Mo-based catalysts for ODS with H2O2 under mild reaction conditions. On the other hand, although some Mo-based catalysts performed well in ODS, the reactions have mainly been done with strong oxidizers such as TBHP and CHP. The reusability of 3 wt%-MoOx/MIL-101(Cr) was examined for the removal of DBT as the representative S-compound. After each of the ODS reactions, the catalyst was washed using acetonitrile to remove of sulfone product and reused in the next run. Fig. 9 illustrates the performance of the 3wt%- MoOx/MIL-101(Cr) for five repeated cycles after the regeneration of the catalyst. Following five reuse cycles, MoOx/MIL-101(Cr) still indicated remarkable catalytic activity with yields of 94.8%. MoOx/MIL-101(Cr) catalyst that was harvested from catalytic run 5 was analyzed by SEM. From the results, it was shown that no obvious changes existed in the morphology of the MoOx/MIL-101(Cr) catalyst (Fig. S3). P-XRD pattern was used in determining the stability of the MoOx/MIL-101(Cr) composite material. The XRD patterns from both the fresh and regenerated catalysts that were obtained at the end of catalytic cycle 5 were compared (Fig. S4). The results confirmed that the crystallinity of the MoOx/MIL-101(Cr) remained unchanged after recycling. The results were an indication that the MoOx/MIL-101(Cr) catalyst exhibited stability with regard to the current removal of the DBT and it is possible for it to be reused for use in multiple runs of the removal of DBT as the representative S-compound. 3.3 Analysis of the oxidation products and the proposed mechanism To understand the mechanism of desulfurization, the oxidation products of the studied RSCs after reaction were analyzed. For this, the oil phase and the solid catalyst were separated by centrifugation and tested by GC–MS (Fig. S5). The GC-MS results indicated that the oxidation products of DBT, 4,6-DMDBT and BT after oxidation were DBTO2 (m/z = 216.0), 4,6-DMDBTO2 (m/z = 244.1) (Fig. S6), and BTO2 (m/z = 166.0), respectively. No additional peaks for RSCs final products were seen in both phases, illustrating that S-compounds had been completely oxidized into the related sulfones as only products and completely retained within the catalyst phase. In the ODS, mechanistic routes are related to the active metal species within the catalyst as well as the oxidant type. It is well known that peroxides-mediated ODS reactions can generally proceed with two possible reaction pathways: the heterolytic (formation of metal-peroxo or two-electron process) or homolytic (formation of free radicals i.e. ·O2 ͞ or ·OH or one-electron process) cleavage of the O–O bond of the peroxide [17,50,73,78]. Mo-based catalysts usually prone to the formation of Mo-peroxo species by the heterolytic process. In the case of the formation of metal-peroxo species, S-compounds are oxidized to related sulfoxides and/or sulfone via electrophilic attack of active peroxo-species to S-atom. But in some cases, the switchable oxidation states (Mo6+/Mo5+/Mo4+) of Mo let MoOx to be an excellent promoter for free radical reactions [67]. In other words, MoOx catalyzes the decomposition of H2O2 to generate a large number of radicals, leading to S-compounds oxidizing subsequently [79]. At the same time, the Lewis acid sites of MIL-101(Cr) can also catalyze the decomposition of H2O2, generating reactive oxygen radicals (·O2 ͞ or/and ·OH). Such radicals with free electrons are able to oxidize S-compounds via nucleophilic attack to the related sulfoxides and/or sulfones. To suggest a plausible mechanism and the key reactive species over the MoOx/MIL-101(Cr), radical quenching experiments were performed with dimethylsulfoxide (DMSO) and p-benzoquinone (p-BQ) as the ·OH and ·O2 ͞ radical scavengers, respectively (H2O2:scavenger = 1:2). Compared with the scavenger-free experiment, the desulfurization activity by the addition of p-BQ leads to a noticeable decrease from 99 to 54%. Thereby, ·O2 ͞ was present in the ODS system as a significant reactive species during ODS reaction and involved in the oxidation of DBT. Besides, when DMSO was used as the scavenger for ·OH, the desulfurization activity stopped completely. From the results obtained, it was concluded that the ·OH and the ·O2 ͞ species played a major role in DBT oxidation in this catalytic ODS process, and the ·OH radical is dominant (Fig. S7). However, the blank MIL-101(Cr) experiment showed considerable desulfurization performance (26%) which could be ascribed to the existence of additional active sites (or, another route) in the MIL-101(Cr). Therefore, radical quenching experiments were also carried out using pure MIL-101 as a catalyst. Similar to the above results, the addition of DMSO and BQ negatively affected the conversion of DBT, indicating that pure MIL-101 also promotes the formation of ·OH and ·O2 ͞ radicals during the reaction (Fig. S7). Based on the surface electronic structure of MoOx/MIL-101(Cr) and radical scavenger experiments, the possible mechanism of ODS has been proposed as in Fig. 10 . Here, generation of reactive oxygen species from active centers in the MoOx/MIL-101(Cr) can be based on the former observations supporting the formation of OH and ·O2 ͞ species via decomposition of peroxo-metallic species forming in the presence of H2O2 [74,80]. In the current ODS process, the presence of Mo5+ species and oxygen vacancies on MoOx/MIL-101(Cr) behaves as the primary active species. Hence, the ODS process starts with the chemical adsorption of the peroxy oxygen atom of oxidant to the oxygen vacancy on the metal oxide, formating a coordinated 5-member ring [74,81]. The high electron density, forming Mo5+ active sites due to the electron transfer from MIL-101(Cr) to MoO3 transfers to the peroxy O atom, causing OO and/or OH bond cleavages. These OO and OH bond cleavages result in the formation of •O2 ͞ and ·OH radicals, respectively. A similar route runs via Lewis acid sites (coordinatively unsaturated Cr3+sites forming by removing the terminal water molecules) in MIL-101(Cr). During the ODS, the unsaturated Cr3+ sites acting as Lewis acid react with H2O2 to generate peroxo-metallic Cr-O-OH species.43 The O−O bond cleavage in CrOOH results in the formation of ·OH radicals via heating conditions. Additionally, the further reaction of Cr-O· and H2O2 leads to the formation of ·O2 ͞ radicals. At last, due to the strong relationship between the S-atom and the oxygen, the DBT is then be oxidized via the ·O2 ͞ and ·OH radicals generated from the activation of H2O2 on the surface of the catalyst to the DBT sulfoxide (DBTO). The DBTO, which is thermodynamically unstable, reacts with the other active oxygen species to provide sulfone (DBTO2), which is the final product. Conclusion In summary, a novel MoOx/MIL-101(Cr) catalyst was fabricated by a simple, low-cost and reproducible method for the ODS of model oil. The prepared MoOx/MIL-101(Cr) showed a good catalytic performance for the ODS reaction (the removing of DBT and 4,6-DMDBT resulted in 99% (TOF = 44.36 h−1) and 92% (TOF = 41.22 h−1) within a 90 min, respectively). On the contrary, the removal efficiency for BT (52%) was not as good as that of DBT and 4,6-DMDBT possibly due to the reduction in the electron density on the S-atom of the BT. The results showed that high electron density on the S-atom of the S-compounds is very significant, suggesting the importance of the electrophilic addition of oxygen atoms via S-atom onto the S-compounds. The prepared catalyst could be reused five times to remove DBT without a significant reduction in the catalytic activity. In addition, radical quenching experiments were carried out to detect the main reactive species during the ODS process. The radical scavenger experiments showed that mostly ·OH species were responsible for the excellent catalytic activity. Finally, based on the radical quenching experiments, the mechanism of the oxidation process was proposed. CRediT authorship contribution statement Ilkay Gumus: Conceptualization, Formal analysis, Writing – original draft, Writing – review & editing. Yasar Karatas: Formal analysis, Writing – original draft, Writing – review & editing. Mehmet Gülcan: Conceptualization, Formal analysis, Writing – original draft, Writing – review & editing. Declaration of Competing Interest The authors declare that they have no known competing financial interests or personal relationships that could have appeared to influence the work reported in this paper. Acknowledgments This work received support by the Scientific Research Projects Coordination Unit of Van Yüzüncü Yıl University (FBA-2020-9125). Supplementary materials Supplementary material associated with this article can be found, in the online version, at doi:10.1016/j.mcat.2022.112249. Appendix Supplementary materials Image, application 1 References [1] J. Chow R.J. Kopp P.R. Portney Energy resources and global development Science 302 2003 1528 1531 J. Chow, R.J. Kopp, P.R. Portney, Energy resources and global development, Science302 (2003) 1528–1531. [2] B.N. Bhadra S.H. Jhung Oxidative desulfurization and denitrogenation of fuels using metal-organic framework-based/-derived catalysts Appl. Catal. B 259 2019 118021 B.N. Bhadra, S.H. Jhung, Oxidative desulfurization and denitrogenation of fuels using metal-organic framework-based/-derived catalysts. Appl. Catal. B259 (2019) 118021. [3] A. Rajendran T.Y. Cui H.X. Fan Z.F. Yang J. Feng W.Y. Wen-ying Li A comprehensive review on oxidative desulfurization catalysts targeting clean energy and environment J. Mater. Chem. A 8 2020 2246 2285 A. Rajendran, T.Y. Cui, H.X. Fan, Z.F. Yang, J. Feng, W.Y. Wen-ying Li, A comprehensive review on oxidative desulfurization catalysts targeting clean energy and environment. J. Mater. Chem. A8 (2020) 2246–2285. [4] B. Pawelec R.M. Navarro J.M. Campos-Martin J.L.G. Fierro Towards near zero-sulfur liquid fuels: a perspective review Catal. Sci. Technol. 3 2013 3376 3376 B. Pawelec, R.M. Navarro, J.M. Campos-Martin, J.L.G. Fierro, Towards near zero-sulfur liquid fuels: a perspective review. Catal. Sci. Technol.3 (2013) 3376-3376. [5] G. Ye Y. Gu W. Zhou W. Xu Y. Sun Synthesis of defect-rich titanium terephthalate with the assistance of acetic acid for room-temperature oxidative desulfurization of fuel oil ACS Catal. 10 2020 2384 2394 G. Ye, Y. Gu, W. Zhou, W. Xu, Y. Sun, Synthesis of defect-rich titanium terephthalate with the assistance of acetic acid for room-temperature oxidative desulfurization of fuel oil. ACS Catal.. 10 (2020) 2384–2394. [6] M. Zhang J. Liu H. Li Y. Wei Y. Fu W. Liao L. Zhu G. Chen W. Zhu H. Li Tuning the electrophilicity of vanadium-substituted polyoxometalate based ionic liquids for high-efficiency aerobic oxidative desulfurization Appl. Catal. B 271 2020 118936 M. Zhang, J. Liu, H. Li, Y. Wei, Y. Fu, W. Liao, L. Zhu, G. Chen, W. Zhu, H. Li, Tuning the electrophilicity of vanadium-substituted polyoxometalate based ionic liquids for high-efficiency aerobic oxidative desulfurization. Appl. Catal. B271 (2020) 118936. [7] A.M. Liaquat M.A. Kalam H.H. Masjuki M.H. Jayed Potential emissions reduction in road transport sector using biofuel in developing countries Atmos. Environ. 44 2010 3869 3877 A.M. Liaquat, M.A. Kalam, H.H. Masjuki, M.H. Jayed, Potential emissions reduction in road transport sector using biofuel in developing countries. Atmos. Environ.44 (2010) 3869–3877. [8] R.N. Colvile E.J. Hutchinson J.S. Mindell R.F. Warren The transport sector as a source of air pollution Atmos. Environ. 35 2001 1537 1565 R.N. Colvile, E.J. Hutchinson, J.S. Mindell, R.F. Warren, The transport sector as a source of air pollution. Atmos. Environ.35 (2001) 1537–1565. [9] O. Asi Failure of a stud bolt in a ring spinning frame textile machine Eng. Fail. Anal. 18 3 2011 963 970 O. Asi, Failure of a stud bolt in a ring spinning frame textile machine. Eng. Fail. Anal.. 18 (3) (2011) 963–970. [10] S. Vedachalam N. Baquerizo A.K. Dalai Review on impacts of low sulfur regulations on marine fuels and compliance options Fuel 310 2022 122243 S. Vedachalam, N. Baquerizo, A.K. Dalai, Review on impacts of low sulfur regulations on marine fuels and compliance options, Fuel310 (2022) 122243. [11] A. Tanimu H. Alhooshani Advanced hydrodesulfurization catalysts: a review of design and synthesis Energy Fuels 33 2019 2810 2838 A. Tanimu, H. Alhooshani, Advanced hydrodesulfurization catalysts: a review of design and synthesis. Energy Fuels33 (2019) 2810–2838. [12] T. Huang J. Xu Y. Fan Effects of concentration and microstructure of active phases on the selective hydrodesulfurization performance of sulfided CoMo/Al2O3 catalysts Appl. Catal. B 220 2018 42 56 T. Huang, J. Xu, Y. Fan, Effects of concentration and microstructure of active phases on the selective hydrodesulfurization performance of sulfided CoMo/Al2O3 catalysts. Appl. Catal. B220 (2018) 42–56. [13] J. Wang Z. Song X. Li H. Cheng L. Chen Z. Qi Toward rational functionalization of ionic liquids for enhanced extractive desulfurization: computer-aided solvent design and molecular dynamics simulation Ind. Eng. Chem. Res. 59 2020 2093 2103 J. Wang, Z. Song, X. Li, H. Cheng, L. Chen, Z. Qi, Toward rational functionalization of ionic liquids for enhanced extractive desulfurization: computer-aided solvent design and molecular dynamics simulation. Ind. Eng. Chem. Res.59 (2020) 2093–2103. [14] L. Peng F. Guo C. Zhang J. Xu S. Xu C. Peng J. Hu H. Liu Maximizing the density of active groups in porous poly(ionic liquids) for efficient adsorptive desulfurization Ind. Eng. Chem. Res. 56 2017 4319 4326 L. Peng, F. Guo, C. Zhang, J. Xu, S. Xu, C. Peng, J. Hu, H. Liu, Maximizing the density of active groups in porous poly(ionic liquids) for efficient adsorptive desulfurization. Ind. Eng. Chem. Res.56 (2017) 4319–4326. [15] S.W. Li W. Wang J.S. Zhao Effective and reusable oxidative desulfurization of dibenzothiophene via magnetic amino-MIL-101 supported H3PMo6W6O40 components: comparison influence on various types of MIL-101 Energy Fuels 34 2020 4837 4848 S.W. Li, W. Wang, J.S. Zhao, Effective and reusable oxidative desulfurization of dibenzothiophene via magnetic amino-MIL-101 supported H3PMo6W6O40 components: comparison influence on various types of MIL-101. Energy Fuels34 (2020) 4837–4848. [16] C. Shen Y.J. Wang J.H. Xub G.S. Luo Oxidative desulfurization of DBT with H2O2 catalysed by TiO2/porous glass Green Chem. 18 2016 771 781 C. Shen, Y.J. Wang, J.H. Xub, G.S. Luo, Oxidative desulfurization of DBT with H2O2 catalysed by TiO2/porous glass. Green Chem.18 (2016) 771–781. [17] M. Bagheri M.Y. Masoomi A.A. Morsali MoO3–metal–organic framework composite as a simultaneous photocatalyst and catalyst in the PODS process of light oil ACS Catal. 7 2017 6949 6956 M. Bagheri, M.Y. Masoomi, A.A. Morsali, MoO3–metal–organic framework composite as a simultaneous photocatalyst and catalyst in the PODS process of light oil. ACS Catal.7 (2017) 6949–6956. [18] R. Abazari L. Esrafili A. Morsali Y. Wu J. Gao PMo12@UiO-67 nanocomposite as a novel non-leaching catalyst with enhanced performance durability for sulfur removal from liquid fuels with exceptionally diluted oxidant Appl. Catal. B 283 2021 119582 R. Abazari, L. Esrafili, A. Morsali, Y. Wu, J. Gao, PMo12@UiO-67 nanocomposite as a novel non-leaching catalyst with enhanced performance durability for sulfur removal from liquid fuels with exceptionally diluted oxidant. Appl. Catal. B283 (2021) 119582. [19] C.G. Piscopo C.M. Granadeiro S.S. Balula D. Bošković Metal-organic framework-based catalysts for oxidative desulfurization ChemCatChem 12 2020 4721 4731 C.G. Piscopo, C.M. Granadeiro, S.S. Balula, D. Bošković, Metal-organic framework-based catalysts for oxidative desulfurization. ChemCatChem12 (2020) 4721–4731. [20] P. Sikarwar U.K.A. Kumar V. Gosu V. Subbaramaiah Catalytic oxidative desulfurization of DBT using green catalyst (Mo/MCM-41) derived from coal fly ash J. Environ. Chem. Eng. 6 2018 1736 1744 P. Sikarwar, U.K.A. Kumar, V. Gosu, V. Subbaramaiah, Catalytic oxidative desulfurization of DBT using green catalyst (Mo/MCM-41) derived from coal fly ash. J. Environ. Chem. Eng.6 (2018) 1736–1744. [21] J. Zou Y. Lin S. Wu Y. Zhong C. Yang Molybdenum dioxide nanoparticles anchored on nitrogen-doped carbon nanotubes as oxidative desulfurization catalysts: role of electron transfer in activity and reusability Adv. Funct. Mater. 31 2021 2100442 J. Zou, Y. Lin, S. Wu, Y. Zhong, C. Yang, Molybdenum dioxide nanoparticles anchored on nitrogen-doped carbon nanotubes as oxidative desulfurization catalysts: role of electron transfer in activity and reusability. Adv. Funct. Mater.31 (2021) 2100442. [22] Y.Y. Liu K. Leus Z. Sun X. Li H. Depauw A. Wang J. Zhang P.V.D. Voort Catalytic oxidative desulfurization of model and real diesel over a molybdenum anchored metal-organic framework Microporous Mesoporous Mater. 277 2019 245 252 Y.Y. Liu, K. Leus, Z. Sun, X. Li, H. Depauw, A. Wang, J. Zhang, P.V.D. Voort, Catalytic oxidative desulfurization of model and real diesel over a molybdenum anchored metal-organic framework. Microporous Mesoporous Mater.277 (2019) 245–252. [23] B. Mokhtari A. Akbari M. Omidkhah Superior deep desulfurization of real diesel over MoO3/silica gel as an efficient catalyst for oxidation of refractory compounds Energy Fuels 33 2019 7276 7286 B. Mokhtari, A. Akbari, M. Omidkhah, Superior deep desulfurization of real diesel over MoO3/silica gel as an efficient catalyst for oxidation of refractory compounds. Energy Fuels33 (2019) 7276–7286. [24] J. He P. Wu L. Lu H. Li H. Ji M. He Q. Jia M. Hua W. Zhu H. Li Lattice-refined transition-metal oxides via ball milling for boosted catalytic oxidation performance ACS Appl. Mater. Interfaces 11 2019 36666 36675 J. He, P. Wu, L. Lu, H. Li, H. Ji, M. He, Q. Jia, M. Hua, W. Zhu, H. Li, Lattice-refined transition-metal oxides via ball milling for boosted catalytic oxidation performance. ACS Appl. Mater. Interfaces11 (2019) 36666–36675. [25] M. Zhang W. Liao Y. Wei C. Wang Y. Fu Y. Gao L. Zhu W. Zhu H. Li Aerobic oxidative desulfurization by nanoporous tungsten oxide with oxygen defects ACS Appl. Nano Mater. 4 2 2021 1085 1093 M. Zhang, W. Liao, Y. Wei, C. Wang, Y. Fu, Y. Gao, L. Zhu, W. Zhu, H. Li, Aerobic oxidative desulfurization by nanoporous tungsten oxide with oxygen defects. ACS Appl. Nano Mater.4 (2) (2021) 1085–1093. [26] J. He P. PeiwenWu L. Chen H. Li M. Hua L. Lu Y. Wei Y. Chao S. Zhou W. Zhu H. Li Dynamically-generated TiO2 active site on MXene Ti3C2: boosting reactive desulfurization Chem. Eng. J. 416 2021 129022 J. He, P. PeiwenWu, L. Chen, H. Li, M. Hua, L. Lu, Y. Wei, Y. Chao, S. Zhou, W. Zhu, H. Li, Dynamically-generated TiO2 active site on MXene Ti3C2: boosting reactive desulfurization. Chem. Eng. J.416 (2021) 129022. [27] H. Wang M. Tang F. Shi R. Ding L. Wang J. Wu X. Li Z. Liu B. Lv Amorphous Cr2WO6-modified WO3 nanowires with a large specific surface area and rich Lewis acid sites: a highly efficient catalyst for oxidative desulfurization ACS Appl. Mater. Interfaces 12 2020 38140 38152 H. Wang, M. Tang, F. Shi, R. Ding, L. Wang, J. Wu, X. Li, Z. Liu, B. Lv, Amorphous Cr2WO6-modified WO3 nanowires with a large specific surface area and rich Lewis acid sites: a highly efficient catalyst for oxidative desulfurization. ACS Appl. Mater. Interfaces12 (2020) 38140–38152. [28] X.B. Xian Bin Lim W.J. Ong A current overview of the oxidative desulfurization of fuels utilizing heat and solar light: from materials design to catalysis for clean energy Nanoscale Horiz. 6 2021 588 633 X.B. Xian Bin Lim, W.J. Ong, A current overview of the oxidative desulfurization of fuels utilizing heat and solar light: from materials design to catalysis for clean energy. Nanoscale Horiz.6 (2021) 588–633. [29] M.M. Liu S.H. Li D.D. Huang Z.W. Xu Y.W. Wu Y. Lei A.L. Liu MoOx quantum dots with peroxidase-like activity on microfluidic paper-based analytical device for rapid colorimetric detection of H2O2 released from PC12 cells Sens. Actuators B Chem. 305 2020 127512 M.M. Liu, S.H. Li, D.D. Huang, Z.W. Xu, Y.W. Wu, Y. Lei, A.L. Liu, MoOx quantum dots with peroxidase-like activity on microfluidic paper-based analytical device for rapid colorimetric detection of H2O2 released from PC12 cells. Sens. Actuators B Chem.305 (2020) 127512. [30] Y. Liu L. Han J. Zhang R. Yao H. Zhan H. Yang L. Bai L. Yang D. Wei W. Wang H. Chen Morphology-controlled construction and aerobic oxidative desulfurization of hierarchical hollow Co–Ni–Mo–O mixed metal-oxide nanotubes Ind. Eng. Chem. Res. 59 2020 6488 6496 Y. Liu, L. Han, J. Zhang, R. Yao, H. Zhan, H. Yang, L. Bai, L. Yang, D. Wei, W. Wang, H. Chen, Morphology-controlled construction and aerobic oxidative desulfurization of hierarchical hollow Co–Ni–Mo–O mixed metal-oxide nanotubes. Ind. Eng. Chem. Res.59 (2020) 6488–6496. [31] J. Ye J. Wen D. Zhao P.A. Peilun Zhang L. Zhang H. Zhang M. Wu Macroporous 3D carbon-nitrogen (CN) confined MoOx catalyst for enhanced oxidative desulfurization of dibenzothiophene Chin. Chem. Lett. 31 2020 2819 2824 J. Ye, J. Wen, D. Zhao, P.A. Peilun Zhang, L. Zhang, H. Zhang, M. Wu, Macroporous 3D carbon-nitrogen (CN) confined MoOx catalyst for enhanced oxidative desulfurization of dibenzothiophene. Chin. Chem. Lett.31 (2020) 2819–2824. [32] Y. Shi G. Liu B. Zhang X. Zhang Oxidation of refractory sulfur compounds with molecular oxygen over a Ce–Mo–O catalyst Green Chem. 18 2016 5273 5279 Y. Shi, G. Liu, B. Zhang, X. Zhang, Oxidation of refractory sulfur compounds with molecular oxygen over a Ce–Mo–O catalyst. Green Chem.18 (2016) 5273–5279. [33] I. Gumus A. Ruzgar Y. Karatas M. Gülcan Highly efficient and selective one-pot tandem imine synthesis via amine-alcohol cross-coupling reaction catalysed by chromium-based MIL-101 supported Au nanoparticles Mol. Catal. 501 2021 111363 I. Gumus, A. Ruzgar, Y. Karatas, M. Gülcan, Highly efficient and selective one-pot tandem imine synthesis via amine-alcohol cross-coupling reaction catalysed by chromium-based MIL-101 supported Au nanoparticles. Mol. Catal.501 (2021) 111363. [34] I. Gumus Y. Karatas M. Gülcan Silver nanoparticles stabilized by a metal–organic framework (MIL-101(Cr)) as an efficient catalyst for imine production from the dehydrogenative coupling of alcohols and amines Catal. Sci. Technol. 10 2020 4990 4999 I. Gumus, Y. Karatas, M. Gülcan, Silver nanoparticles stabilized by a metal–organic framework (MIL-101(Cr)) as an efficient catalyst for imine production from the dehydrogenative coupling of alcohols and amines. Catal. Sci. Technol.10 (2020) 4990–4999. [35] R. Abazari S. Sanati A. Morsali A. Slawin C.L. Carpenter-Warren Dual-purpose 3D pillared metal–organic framework with excellent properties for catalysis of oxidative desulfurization and energy storage in asymmetric supercapacitor ACS Appl. Mater. Interfaces 11 2019 14759 14773 R. Abazari, S. Sanati, A. Morsali, A. Slawin, C.L. Carpenter-Warren, Dual-purpose 3D pillared metal–organic framework with excellent properties for catalysis of oxidative desulfurization and energy storage in asymmetric supercapacitor. ACS Appl. Mater. Interfaces11 (2019) 14759–14773. [36] M. Kalaj S.M. Cohen Postsynthetic modification: an enabling technology for the advancement of metal–organic frameworks ACS Cent. Sci. 6 2020 1046 1057 M. Kalaj, S.M. Cohen, Postsynthetic modification: an enabling technology for the advancement of metal–organic frameworks. ACS Cent. Sci.6 (2020) 1046–1057. [37] A. Dhakshinamoorthy H. Garcia Catalysis by metal nanoparticles embedded on metal–organic frameworks Chem. Soc. Rev. 41 2012 5262 5284 A. Dhakshinamoorthy, H. Garcia, Catalysis by metal nanoparticles embedded on metal–organic frameworks. Chem. Soc. Rev.41 (2012) 5262–5284. [38] A. Dhakshinamoorthy A.M. Asiri H. García Metal–organic frameworks as multifunctional solid catalysts Trends Chem. 2 2020 454 466 A. Dhakshinamoorthy, A.M. Asiri, H. García, Metal–organic frameworks as multifunctional solid catalysts. Trends Chem.. 2 (2020) 454–466. [39] A. Dhakshinamoorthy M. Alvaro H. Garcia Metal–organic frameworks as heterogeneous catalysts for oxidation reactions Catal. Sci. Technol. 1 2011 856 867 A. Dhakshinamoorthy, M. Alvaro, H. GarciaMetal–organic frameworks as heterogeneous catalysts for oxidation reactions. Catal. Sci. Technol.1 (2011) 856–867. [40] A. Dhakshinamoorthy E.M. Lanzuela S. Navalon H. Garcia Cobalt-based metal organic frameworks as solids catalysts for oxidation reactions Catalysts 11 2021 95 A. Dhakshinamoorthy, E.M. Lanzuela, S. Navalon, H. Garcia, Cobalt-based metal organic frameworks as solids catalysts for oxidation reactions. Catalysts11 (2021) 95. [41] Y. Lu C. Yue B. Liu M. Zhang Y. Li W. Yang Y. Lin Y. Pan D. Sun Y. Liu The encapsulation of POM clusters into MIL-101(Cr) at molecular level: Law10o36@MIL-101(Cr), an efficient catalyst for oxidative desulfurization Microporous Mesoporous Mater. 311 2021 110694 Y. Lu, C. Yue, B. Liu, M. Zhang, Y. Li, W. Yang, Y. Lin, Y. Pan, D. Sun, Y. Liu, The encapsulation of POM clusters into MIL-101(Cr) at molecular level: Law10o36@MIL-101(Cr), an efficient catalyst for oxidative desulfurization. Microporous Mesoporous Mater.311 (2021) 110694. [42] S.S. Menon S.V. Chandran A. Koyappayil S. Berchmans Copper- based metal-organic frameworks as peroxidase mimics leading to sensitive H2O2 and glucose detection ChemSelect 3 2018 8319 8324 S.S. Menon, S.V. Chandran, A. Koyappayil, S. Berchmans, Copper- based metal-organic frameworks as peroxidase mimics leading to sensitive H2O2 and glucose detection. ChemSelect3 (2018) 8319–8324. [43] X. Zhang P. Huang A. Liu M. Zhu A metal–organic framework for oxidative desulfurization: Uio-66(Zr) as a catalyst Fuel 209 2017 417 423 X. Zhang, P. Huang, A. Liu, M. Zhu, A metal–organic framework for oxidative desulfurization: Uio-66(Zr) as a catalyst. Fuel, 209 (2017) 417–423. [44] H.Q. Zheng Y.N. Zeng J. Chen R.G. Lin W.E. Zhuang R. Cao Z.J. Lin Zr-based metal–organic frameworks with intrinsic peroxidase-like activity for ultradeep oxidative desulfurization: mechanism of H2O2 decomposition Inorg. Chem. 58 2019 6983 6992 H.Q. Zheng, Y.N. Zeng, J. Chen, R.G. Lin, W.E. Zhuang, R. Cao, Z.J. Lin, Zr-based metal–organic frameworks with intrinsic peroxidase-like activity for ultradeep oxidative desulfurization: mechanism of H2O2 decomposition. Inorg. Chem.58 (2019) 6983–6992. [45] S.W. Li W. Wang J.S. Zhao Catalytic oxidation of DBT for ultra-deep desulfurization under MoO3 modified magnetic catalyst: the comparison influence on various morphologies of MoO3 Appl. Catal. A 602 2020 117671 S.W. Li, W. Wang, J.S. Zhao, Catalytic oxidation of DBT for ultra-deep desulfurization under MoO3 modified magnetic catalyst: the comparison influence on various morphologies of MoO3. Appl. Catal. A602 (2020) 117671. [46] D. Yang B.C. Gates Catalysis by metal organic frameworks: perspective and suggestions for future research ACS Catal. 9 2019 1779 1798 D. Yang, B.C. Gates, Catalysis by metal organic frameworks: perspective and suggestions for future research. ACS Catal.9 (2019) 1779–1798. [47] L. Hao S.A. Stoian L.R. Weddle Q. Zhang Zr-based MOFs for oxidative desulfurization: what matters? Green Chem. 22 2020 6351 6356 L. Hao, S.A. Stoian, L.R. Weddle, Q. Zhang, Zr-based MOFs for oxidative desulfurization: what matters?Green Chem.22 (2020) 6351–6356. [48] J.J. Low A.I. Benin P. Jakubczak J.F. Abrahamian S.A. Faheem R.R. Willis Virtual high throughput screening confirmed experimentally: porous coordination polymer hydration J. Am. Chem. Soc. 131 2009 15834 15842 J.J. Low, A.I. Benin, P. Jakubczak, J.F. Abrahamian, S.A. Faheem, R.R. Willis, Virtual high throughput screening confirmed experimentally: porous coordination polymer hydration. J. Am. Chem. Soc.131 (2009) 15834–15842. [49] N.C. Burtch H. Jasuja K.S. Walton Water stability and adsorption in metal–organic frameworks Chem. Rev. 114 2014 10575 10612 N.C. Burtch, H. Jasuja, K.S. Walton, Water stability and adsorption in metal–organic frameworks. Chem. Rev.114 (2014) 10575–10612. [50] A.J. Howarth Y. Liu P. Li Z. Li T.C. Wang J.T. Hupp O.K. Farha Chemical, thermal and mechanical stabilities of metal–organic frameworks Nat. Rev. Mater. 1 2016 15018 A.J. Howarth, Y. Liu, P. Li, Z. Li, T.C. Wang, J.T. Hupp, O.K. Farha, Chemical, thermal and mechanical stabilities of metal–organic frameworks. Nat. Rev. Mater.1 (2016) 15018. [51] G. Férey C. Mellot-Draznieks C. Serre F. Millange J. Dutour S. Surblé I.A. Margioaki A chromium terephthalate-based solid with unusually large pore volumes and surface area Science 309 2005 2040 2042 G. Férey, C. Mellot-Draznieks, C. Serre, F. Millange, J. Dutour, S. Surblé, I.A. Margioaki, A chromium terephthalate-based solid with unusually large pore volumes and surface area. Science309 (2005) 2040–2042. [52] Y. Huang S. Liu Z. Lin W. Li X. Li R. Cao Facile synthesis of palladium nanoparticles encapsulated in amine-functionalized mesoporous metal–organic frameworks and catalytic for dehalogenation of aryl chlorides J. Catal. 292 2012 111 117 Y. Huang, S. Liu, Z. Lin, W. Li, X. Li, R. Cao, Facile synthesis of palladium nanoparticles encapsulated in amine-functionalized mesoporous metal–organic frameworks and catalytic for dehalogenation of aryl chlorides. J. Catal.292 (2012) 111–117. [53] S. Bernt V. Guillerm C. Serreb N. Stock Direct covalent post-synthetic chemical modification of Cr-MIL-101 using nitrating acid Chem. Commun. 47 2011 2838 2840 S. Bernt, V. Guillerm, C. Serreb, N. Stock, Direct covalent post-synthetic chemical modification of Cr-MIL-101 using nitrating acid. Chem. Commun.47 (2011) 2838–2840. [54] X.S. Wang Y.B. Huang Z.J. Lin R. Cao Phosphotungstic acid encapsulated in the mesocages of amine-functionalized metal–organic frameworks for catalytic oxidative desulfurization Dalton Trans. 43 2014 11950 11958 X.S. Wang, Y.B. Huang, Z.J. Lin, R. Cao, Phosphotungstic acid encapsulated in the mesocages of amine-functionalized metal–organic frameworks for catalytic oxidative desulfurization. Dalton Trans.43 (2014) 11950–11958. [55] A. Gómez-Paricio A. Santiago-Portillo S. Navalón P. Concepción M. Alvaro H. Garcia MIL-101 promotes the efficient aerobic oxidative desulfurization of dibenzothiophenes Green Chem. 18 2016 508 515 A. Gómez-Paricio, A. Santiago-Portillo, S. Navalón, P. Concepción, M. Alvaro, H. Garcia, MIL-101 promotes the efficient aerobic oxidative desulfurization of dibenzothiophenes. Green Chem.. 18 (2016) 508–515. [56] L. Bromberg Y. Diao H. Wu S.A. Speakman T.A. Hatton Chromium(III) terephthalate metal organic framework (MIL-101): Hf-free synthesis, structure, polyoxometalate composites, and catalytic properties Chem. Mater. 24 2012 1664 1675 L. Bromberg, Y. Diao, H. Wu, S.A. Speakman, T.A. Hatton, Chromium(III) terephthalate metal organic framework (MIL-101): Hf-free synthesis, structure, polyoxometalate composites, and catalytic properties. Chem. Mater.24 (2012) 1664–1675. [57] I.E. Ertas M. Gulcan A. Bulut M. Yurderi M. Zahmakiran Rhodium nanoparticles stabilized by sulfonic acid functionalizedmetal-organic framework for the selective hydrogenation of phenol to cyclohexanon J. Mol. Catal. A Chem. 410 2015 209 220 I.E. Ertas, M. Gulcan, A. Bulut, M. Yurderi, M. Zahmakiran, Rhodium nanoparticles stabilized by sulfonic acid functionalizedmetal-organic framework for the selective hydrogenation of phenol to cyclohexanon. J. Mol. Catal. A Chem.410 (2015) 209–220. [58] I.E. Ertas M. Gulcan A. Bulut M. Yurderi M. Zahmakiran Metal-organic framework (MIL-101) stabilized ruthenium nanoparticles: highly efficient catalytic material in the phenol hydrogenation Microporous Mesoporous Mater. 226 2016 94 103 I.E. Ertas, M. Gulcan, A. Bulut, M. Yurderi, M. Zahmakiran, Metal-organic framework (MIL-101) stabilized ruthenium nanoparticles: highly efficient catalytic material in the phenol hydrogenation. Microporous Mesoporous Mater.226 (2016) 94–103. [59] Y. Chen X. Zhang X. Wang R.J. Drout M.R. Mian R. Cao K. Ma Q. Xia Z. Li O.K. Farha Insights into the structure–activity relationship in aerobic alcohol oxidation over a metal–organic-framework-supported molybdenum(VI) catalyst J. Am. Chem. Soc. 143 2021 4302 4310 Y. Chen, X. Zhang, X. Wang, R.J. Drout, M.R. Mian, R. Cao, K. Ma, Q. Xia, Z. Li, O.K. Farha, Insights into the structure–activity relationship in aerobic alcohol oxidation over a metal–organic-framework-supported molybdenum(VI) catalyst. J. Am. Chem. Soc.143 (2021) 4302–4310. [60] Y.Y. Liu K. Leus Z. Sun X. Li H. Depauw A. Wang J. Zhang P.V.D. Voort Catalytic oxidative desulfurization of model and real diesel over a molybdenum anchored metal-organic framework Microporous Mesoporous Mater. 277 2019 245 252 Y.Y. Liu, K. Leus, Z. Sun, X. Li, H. Depauw, A. Wang, J. Zhang, P.V.D. Voort, Catalytic oxidative desulfurization of model and real diesel over a molybdenum anchored metal-organic framework. Microporous Mesoporous Mater.277 (2019) 245–252. [61] S. Storck H. Bretinger W.F. Maier Characterization of micro- and mesoporous solids by physisorption methods and pore-size analysis Appl. Catal. A 174 1998 137 146 S. Storck, H. Bretinger, W.F. Maier, Characterization of micro- and mesoporous solids by physisorption methods and pore-size analysis. Appl. Catal. A174 (1998) 137–146. [62] S.J. Xiao X.J. Zhao P.P. Hu Z.J. Chu C.Z. Huang L. Zhang Highly photoluminescent molybdenum oxide quantum dots: one-pot synthesis and application in 2,4,6-trinitrotoluene determination ACS Appl. Mater. Interfaces 8 2016 8184 8191 S.J. Xiao, X.J. Zhao, P.P. Hu, Z.J. Chu, C.Z. Huang, L. Zhang, Highly photoluminescent molybdenum oxide quantum dots: one-pot synthesis and application in 2,4,6-trinitrotoluene determination. ACS Appl. Mater. Interfaces8 (2016) 8184–8191. [63] Y. Cao H. Wang R. Ding L. Wang Z. Liu B. Lv Highly efficient oxidative desulfurization of dibenzothiophene using Ni modified MoO3 catalyst Appl. Catal. A 589 2020 117308 Y. Cao, H. Wang, R. Ding, L. Wang, Z. Liu, B. Lv, Highly efficient oxidative desulfurization of dibenzothiophene using Ni modified MoO3 catalyst. Appl. Catal. A589 (2020) 117308. [64] L. Chen Z.P. Hua J.T. Ren Z. Wang Z.Y. Yuan Efficient oxidative desulfurization over highly dispersed molybdenum oxides supported on mesoporous titanium phosphonates Microporous Mesoporous Mater. 315 2021 110921 L. Chen, Z.P. Hua, J.T. Ren, Z. Wang, Z.Y. Yuan, Efficient oxidative desulfurization over highly dispersed molybdenum oxides supported on mesoporous titanium phosphonates. Microporous Mesoporous Mater.315 (2021) 110921. [65] Z.C. Kampouraki D.A. Giannakoudakis K.S. Triantafyllidis E.A. Deliyanni Catalytic oxidative desulfurization of a 4,6-DMDBT containing model fuel by metal-free activated carbons: the key role of surface chemistry Green Chem. 21 2019 6685 6698 Z.C. Kampouraki, D.A. Giannakoudakis, K.S. Triantafyllidis, E.A. Deliyanni, Catalytic oxidative desulfurization of a 4,6-DMDBT containing model fuel by metal-free activated carbons: the key role of surface chemistry. Green Chem.21 (2019) 6685–6698. [66] S.W. Li W. Wang J.S. Zhao Highly effective oxidative desulfurization with magnetic MOF supported W-MoO3 catalyst under oxygen as oxidant Appl. Catal. B 277 2020 119224 S.W. Li, W. Wang, J.S. Zhao, Highly effective oxidative desulfurization with magnetic MOF supported W-MoO3 catalyst under oxygen as oxidant. Appl. Catal. B277 (2020) 119224. [67] X.S. Wang L. Li J. Liang Y.B. Huang R. Cao Boosting oxidative desulfurization of model and real gasoline over phosphotungstic acid encapsulated in metal–organic frameworks: the window size matters ChemCatChem 9 2017 971 979 X.S. Wang, L. Li, J. Liang, Y.B. Huang, R. Cao, Boosting oxidative desulfurization of model and real gasoline over phosphotungstic acid encapsulated in metal–organic frameworks: the window size matters. ChemCatChem9 (2017) 971–979. [68] B.N. Bhadra S.H. Jhung Oxidative desulfurization of liquid fuel with tungsten-nitride@porous carbon, derived from MAF-6(Zn) loaded with phosphotungstic acid and melamine Chem. Eng. J. 419 2021 129485 B.N. Bhadra, S.H. Jhung, Oxidative desulfurization of liquid fuel with tungsten-nitride@porous carbon, derived from MAF-6(Zn) loaded with phosphotungstic acid and melamine. Chem. Eng. J.419 (2021) 129485. [69] Y. Tian Y. Yao Y. Zhi Y. Yan S. Lu Combined extraction–oxidation system for oxidative desulfurization (ODS) of a model fuel Energy Fuels 29 2015 618 625 Y. Tian, Y. Yao, Y. Zhi, Y. Yan, S. Lu, Combined extraction–oxidation system for oxidative desulfurization (ODS) of a model fuel. Energy Fuels29 (2015) 618–625. [70] M.H. Mondol B.N. Bhadra S.H. Jhung Molybdenum nitride@porous carbon, derived from phosphomolybdic acid loaded metal-azolate framework-6: a highly effective catalyst for oxidative desulfurization Appl. Catal. B 288 2021 119988 M.H. Mondol, B.N. Bhadra, S.H. Jhung, Molybdenum nitride@porous carbon, derived from phosphomolybdic acid loaded metal-azolate framework-6: a highly effective catalyst for oxidative desulfurization. Appl. Catal. B288 (2021) 119988. [71] G. Yang X. Zhang H. Yang Y. Long J. Ma Sucrose facilitated synthesis of mesoporous silicoaluminophosphate SAPO-11 with different crystalline phases of MoO3 for highly-efficient oxidative desulfurization J. Colloid Interface Sci. 532 2018 92 102 G. Yang, X. Zhang, H. Yang, Y. Long, J. Ma, Sucrose facilitated synthesis of mesoporous silicoaluminophosphate SAPO-11 with different crystalline phases of MoO3 for highly-efficient oxidative desulfurization. J. Colloid Interface Sci.532 (2018) 92–102. [72] Y. Du L. Zhou Z. Liu Z. Guo X. Wang J. Lei Designed formation of mesoscopical order of ionic liquid-based meso/macroporous Mo/TiO2 materials for high-performance oxidative desulfurization Chem. Eng. J. 387 2020 124056 Y. Du, L. Zhou, Z. Liu, Z. Guo, X. Wang, J. Lei, Designed formation of mesoscopical order of ionic liquid-based meso/macroporous Mo/TiO2 materials for high-performance oxidative desulfurization. Chem. Eng. J.387 (2020) 124056. [73] G. Yang H. Yang X. Zhang K. lqbal F. Feng J. Ma J. Qin F. Yuan Y. Cai J. Ma Surfactant-free self-assembly to the synthesis of MoO3 nanoparticles on mesoporous SiO2 to form MoO3/SiO2 nanosphere networks with excellent oxidative desulfurization catalytic performance J. Hazard. Mater. 397 2020 122654 G. Yang, H. Yang, X. Zhang, K. lqbal, F. Feng, J. Ma, J. Qin, F. Yuan, Y. Cai, J. Ma, Surfactant-free self-assembly to the synthesis of MoO3 nanoparticles on mesoporous SiO2 to form MoO3/SiO2 nanosphere networks with excellent oxidative desulfurization catalytic performance. J. Hazard. Mater.397 (2020) 122654. [74] J. Chang A. Wang J. Liu X. Li Y. Hu Oxidation of dibenzothiophene with cumene hydroperoxide on MoO3/SiO2 modified with alkaline earth metals Catal. Today 149 2010 122 126 J. Chang, A. Wang, J. Liu, X. Li, Y. Hu, Oxidation of dibenzothiophene with cumene hydroperoxide on MoO3/SiO2 modified with alkaline earth metals. Catal. Today149 (2010) 122–126. [75] X.M. Zhang Z. Zhang B. Zhang X. Yang X. Chang Z. Zhou D.H. Wang M.H. Zhang X.H. Bu Synergistic effect of Zr-MOF on phosphomolybdic acid promotes efficient oxidative desulfurization Appl. Catal. B 256 2019 117804 X.M. Zhang, Z. Zhang, B. Zhang, X. Yang, X. Chang, Z. Zhou, D.H. Wang, M.H. Zhang, X.H. Bu, Synergistic effect of Zr-MOF on phosphomolybdic acid promotes efficient oxidative desulfurization. Appl. Catal. B256 (2019) 117804. [76] C. Li Y. Xu S. Liu S. Yin H. Yu Z. Wang X. Li L. Wang H. Wang Polyoxometalate-based poly(ionic liquid) as a precursor for superhydrophobic magnetic carbon composite catalysts toward aerobic oxidative desulfurization ACS Sustain. Chem. Eng. 7 2019 15755 15761 C. Li, Y. Xu, S. Liu, S. Yin, H. Yu, Z. Wang, X. Li, L. Wang, H. Wang, Polyoxometalate-based poly(ionic liquid) as a precursor for superhydrophobic magnetic carbon composite catalysts toward aerobic oxidative desulfurization. ACS Sustain. Chem. Eng.7 (2019) 15755–15761. [77] K. Chen X.M. Zhang X.F. Yang M.G. Jiao Z. Zhou M.H. Zhang D.H. Wang X.H. Bu Electronic structure of heterojunction MoO2/g-C3N4 catalyst for oxidative desulfurization Appl. Catal. B 238 2018 263 273 K. Chen, X.M. Zhang, X.F. Yang, M.G. Jiao, Z. Zhou, M.H. Zhang, D.H. Wang, X.H. Bu, Electronic structure of heterojunction MoO2/g-C3N4 catalyst for oxidative desulfurization. Appl. Catal. B238 (2018) 263–273. [78] X. Yao C. Wang H. Liu H. Li P. Wu L. Fan H. Li W. Zhu Immobilizing highly catalytically molybdenum oxide nanoparticles on graphene-analogous BN: stable heterogeneous catalysts with enhanced aerobic oxidative desulfurization performance Ind. Eng. Chem. Res. 58 2019 863 871 X. Yao, C. Wang, H. Liu, H. Li, P. Wu, L. Fan, H. Li, W. Zhu, Immobilizing highly catalytically molybdenum oxide nanoparticles on graphene-analogous BN: stable heterogeneous catalysts with enhanced aerobic oxidative desulfurization performance. Ind. Eng. Chem. Res.58 (2019) 863–871. [79] S.J. Xiao L.Z. Wang M.Y. Yuan X.H. Huang J.H. Ding L. Zhang Peroxidase-mimetic and fenton-like activities of molybdenum oxide quantum dots ChemSelect 5 2020 10149 10155 S.J. Xiao, L.Z. Wang, M.Y. Yuan, X.H. Huang, J.H. Ding, L. Zhang, Peroxidase-mimetic and fenton-like activities of molybdenum oxide quantum dots. ChemSelect5 (2020) 10149–10155. [80] B.N. Bhadra Y.S. Baek S. Kim C.H. Choi S.H. Jhung Oxidative denitrogenation of liquid fuel over W2N@carbon catalyst derived from a phosphotungstinic acid encapsulated metal–azolate framework Appl. Catal. B 285 2021 119842 B.N. Bhadra, Y.S. Baek, S. Kim, C.H. Choi, S.H. Jhung, Oxidative denitrogenation of liquid fuel over W2N@carbon catalyst derived from a phosphotungstinic acid encapsulated metal–azolate framework. Appl. Catal. B285 (2021) 119842. [81] J. Zou Y. Lin S. Wu M. Wu C. Yang Construction of bifunctional 3-D ordered mesoporous catalyst for oxidative desulfurization Sep. Purif. Technol. 264 2021 118434 J. Zou, Y. Lin, S. Wu, M. Wu, C. Yang, Construction of bifunctional 3-D ordered mesoporous catalyst for oxidative desulfurization. Sep. Purif. Technol.264 (2021) 118434.",
      "scopus-id": "85126944310",
      "coredata": {
        "eid": "1-s2.0-S2468823122001377",
        "dc:description": "In this work, MoOx/MIL-101(Cr) a new composite material, involving the collaboration of MoOx and MIL-101(Cr) to remove the refractory S-compounds (RSCs) from fuels via oxidative desulfurization (ODS) process were successfully synthesized. The prepared catalyst was characterized by scanning electron microscopy (SEM), energy-dispersive spectroscopy (EDX), powder X-ray diffraction (P-XRD), inductively coupled plasma optical emission spectroscopy (ICP-OES), fourier transform infrared spectroscopy (FT-IR), N2 sorption measurement (BET) and X-ray photoelectron spectroscopy (XPS). The prepared MoOx/MIL-101(Cr) was applied for the ODS of model fuel oil and showed the remarkably catalytic activity for the removal of RSCs from model fuel oil via oxidation. In addition, the effect of Mo-loading amount, H2O2/sulfur (O/S) molar ratio, and reaction temperature on the ODS reactivity were investigated. To explore the specific reaction mechanism of ODS over the MoOx/MIL-101(Cr), the effect of radical scavengers on ODS activity was examined. The radical scavengers experiments showed that the present oxidation reaction occurred through a radical mechanism involving the formation of •OH and •O2 ͞ species. In addition, it was found that the ODS efficiency is majorly related to the Mo5+ species forming with electron transfer to Mo6+ ion from Lewis acid sites of MIL-101(Cr). Furthermore, the MoOx/MIL-101(Cr) catalyst possesses recycling performance and remarkable stability, and even after five recycles, the removal of DBT was >94.8%. Hence, it could be confirmed that MoOx/MIL-101(Cr) is very useful in the ODS to remove RSCs from fuels in the presence of H2O2.",
        "openArchiveArticle": "false",
        "prism:coverDate": "2022-04-30",
        "openaccessUserLicense": null,
        "prism:aggregationType": "Journal",
        "prism:url": "https://api.elsevier.com/content/article/pii/S2468823122001377",
        "dc:creator": [
          {
            "@_fa": "true",
            "$": "Gumus, Ilkay"
          },
          {
            "@_fa": "true",
            "$": "Karatas, Yasar"
          },
          {
            "@_fa": "true",
            "$": "Gülcan, Mehmet"
          }
        ],
        "link": [
          {
            "@_fa": "true",
            "@rel": "self",
            "@href": "https://api.elsevier.com/content/article/pii/S2468823122001377"
          },
          {
            "@_fa": "true",
            "@rel": "scidir",
            "@href": "https://www.sciencedirect.com/science/article/pii/S2468823122001377"
          }
        ],
        "dc:format": "application/json",
        "openaccessType": null,
        "pii": "S2468-8231(22)00137-7",
        "prism:volume": "522",
        "articleNumber": "112249",
        "prism:publisher": "Elsevier B.V.",
        "dc:title": "Green and efficient oxidative desulfurization of refractory S-compounds from liquid fuels catalyzed by chromium-based MIL-101 stabilized MoOx catalyst",
        "prism:copyright": "© 2022 Elsevier B.V. All rights reserved.",
        "openaccess": "0",
        "prism:issn": "24688231",
        "dcterms:subject": [
          {
            "@_fa": "true",
            "$": "Catalyst"
          },
          {
            "@_fa": "true",
            "$": "MIL-101(Cr)"
          },
          {
            "@_fa": "true",
            "$": "MOFs"
          },
          {
            "@_fa": "true",
            "$": "Molybdenum"
          },
          {
            "@_fa": "true",
            "$": "Oxidative desulfurization"
          }
        ],
        "openaccessArticle": "false",
        "prism:publicationName": "Molecular Catalysis",
        "openaccessSponsorType": null,
        "prism:pageRange": "112249",
        "pubType": "fla",
        "prism:coverDisplayDate": "April 2022",
        "prism:doi": "10.1016/j.mcat.2022.112249",
        "prism:startingPage": "112249",
        "dc:identifier": "doi:10.1016/j.mcat.2022.112249",
        "openaccessSponsorName": null
      },
      "objects": {
        "object": [
          {
            "@category": "standard",
            "@height": "254",
            "@width": "636",
            "@_fa": "true",
            "$": "https://api.elsevier.com/content/object/eid/1-s2.0-S2468823122001377-gr8.jpg?httpAccept=%2A%2F%2A",
            "@multimediatype": "JPEG image file",
            "@type": "IMAGE-DOWNSAMPLED",
            "@size": "37172",
            "@ref": "gr8",
            "@mimetype": "image/jpeg"
          },
          {
            "@category": "standard",
            "@height": "725",
            "@width": "485",
            "@_fa": "true",
            "$": "https://api.elsevier.com/content/object/eid/1-s2.0-S2468823122001377-gr1.jpg?httpAccept=%2A%2F%2A",
            "@multimediatype": "JPEG image file",
            "@type": "IMAGE-DOWNSAMPLED",
            "@size": "55429",
            "@ref": "gr1",
            "@mimetype": "image/jpeg"
          },
          {
            "@category": "standard",
            "@height": "245",
            "@width": "330",
            "@_fa": "true",
            "$": "https://api.elsevier.com/content/object/eid/1-s2.0-S2468823122001377-gr9.jpg?httpAccept=%2A%2F%2A",
            "@multimediatype": "JPEG image file",
            "@type": "IMAGE-DOWNSAMPLED",
            "@size": "39256",
            "@ref": "gr9",
            "@mimetype": "image/jpeg"
          },
          {
            "@category": "standard",
            "@height": "609",
            "@width": "597",
            "@_fa": "true",
            "$": "https://api.elsevier.com/content/object/eid/1-s2.0-S2468823122001377-gr10.jpg?httpAccept=%2A%2F%2A",
            "@multimediatype": "JPEG image file",
            "@type": "IMAGE-DOWNSAMPLED",
            "@size": "87331",
            "@ref": "gr10",
            "@mimetype": "image/jpeg"
          },
          {
            "@category": "standard",
            "@height": "287",
            "@width": "689",
            "@_fa": "true",
            "$": "https://api.elsevier.com/content/object/eid/1-s2.0-S2468823122001377-gr6.jpg?httpAccept=%2A%2F%2A",
            "@multimediatype": "JPEG image file",
            "@type": "IMAGE-DOWNSAMPLED",
            "@size": "62701",
            "@ref": "gr6",
            "@mimetype": "image/jpeg"
          },
          {
            "@category": "standard",
            "@height": "307",
            "@width": "681",
            "@_fa": "true",
            "$": "https://api.elsevier.com/content/object/eid/1-s2.0-S2468823122001377-gr7.jpg?httpAccept=%2A%2F%2A",
            "@multimediatype": "JPEG image file",
            "@type": "IMAGE-DOWNSAMPLED",
            "@size": "43432",
            "@ref": "gr7",
            "@mimetype": "image/jpeg"
          },
          {
            "@category": "standard",
            "@height": "882",
            "@width": "648",
            "@_fa": "true",
            "$": "https://api.elsevier.com/content/object/eid/1-s2.0-S2468823122001377-gr4.jpg?httpAccept=%2A%2F%2A",
            "@multimediatype": "JPEG image file",
            "@type": "IMAGE-DOWNSAMPLED",
            "@size": "332347",
            "@ref": "gr4",
            "@mimetype": "image/jpeg"
          },
          {
            "@category": "standard",
            "@height": "789",
            "@width": "491",
            "@_fa": "true",
            "$": "https://api.elsevier.com/content/object/eid/1-s2.0-S2468823122001377-gr5.jpg?httpAccept=%2A%2F%2A",
            "@multimediatype": "JPEG image file",
            "@type": "IMAGE-DOWNSAMPLED",
            "@size": "83798",
            "@ref": "gr5",
            "@mimetype": "image/jpeg"
          },
          {
            "@category": "standard",
            "@height": "722",
            "@width": "474",
            "@_fa": "true",
            "$": "https://api.elsevier.com/content/object/eid/1-s2.0-S2468823122001377-gr2.jpg?httpAccept=%2A%2F%2A",
            "@multimediatype": "JPEG image file",
            "@type": "IMAGE-DOWNSAMPLED",
            "@size": "74932",
            "@ref": "gr2",
            "@mimetype": "image/jpeg"
          },
          {
            "@category": "standard",
            "@height": "245",
            "@width": "240",
            "@_fa": "true",
            "$": "https://api.elsevier.com/content/object/eid/1-s2.0-S2468823122001377-ga1.jpg?httpAccept=%2A%2F%2A",
            "@multimediatype": "JPEG image file",
            "@type": "IMAGE-DOWNSAMPLED",
            "@size": "23763",
            "@ref": "ga1",
            "@mimetype": "image/jpeg"
          },
          {
            "@category": "standard",
            "@height": "769",
            "@width": "503",
            "@_fa": "true",
            "$": "https://api.elsevier.com/content/object/eid/1-s2.0-S2468823122001377-gr3.jpg?httpAccept=%2A%2F%2A",
            "@multimediatype": "JPEG image file",
            "@type": "IMAGE-DOWNSAMPLED",
            "@size": "84133",
            "@ref": "gr3",
            "@mimetype": "image/jpeg"
          },
          {
            "@category": "thumbnail",
            "@height": "88",
            "@width": "219",
            "@_fa": "true",
            "$": "https://api.elsevier.com/content/object/eid/1-s2.0-S2468823122001377-gr8.sml?httpAccept=%2A%2F%2A",
            "@multimediatype": "GIF image file",
            "@type": "IMAGE-THUMBNAIL",
            "@size": "7277",
            "@ref": "gr8",
            "@mimetype": "image/gif"
          },
          {
            "@category": "thumbnail",
            "@height": "163",
            "@width": "109",
            "@_fa": "true",
            "$": "https://api.elsevier.com/content/object/eid/1-s2.0-S2468823122001377-gr1.sml?httpAccept=%2A%2F%2A",
            "@multimediatype": "GIF image file",
            "@type": "IMAGE-THUMBNAIL",
            "@size": "6695",
            "@ref": "gr1",
            "@mimetype": "image/gif"
          },
          {
            "@category": "thumbnail",
            "@height": "163",
            "@width": "219",
            "@_fa": "true",
            "$": "https://api.elsevier.com/content/object/eid/1-s2.0-S2468823122001377-gr9.sml?httpAccept=%2A%2F%2A",
            "@multimediatype": "GIF image file",
            "@type": "IMAGE-THUMBNAIL",
            "@size": "14778",
            "@ref": "gr9",
            "@mimetype": "image/gif"
          },
          {
            "@category": "thumbnail",
            "@height": "163",
            "@width": "160",
            "@_fa": "true",
            "$": "https://api.elsevier.com/content/object/eid/1-s2.0-S2468823122001377-gr10.sml?httpAccept=%2A%2F%2A",
            "@multimediatype": "GIF image file",
            "@type": "IMAGE-THUMBNAIL",
            "@size": "8424",
            "@ref": "gr10",
            "@mimetype": "image/gif"
          },
          {
            "@category": "thumbnail",
            "@height": "91",
            "@width": "219",
            "@_fa": "true",
            "$": "https://api.elsevier.com/content/object/eid/1-s2.0-S2468823122001377-gr6.sml?httpAccept=%2A%2F%2A",
            "@multimediatype": "GIF image file",
            "@type": "IMAGE-THUMBNAIL",
            "@size": "8117",
            "@ref": "gr6",
            "@mimetype": "image/gif"
          },
          {
            "@category": "thumbnail",
            "@height": "99",
            "@width": "219",
            "@_fa": "true",
            "$": "https://api.elsevier.com/content/object/eid/1-s2.0-S2468823122001377-gr7.sml?httpAccept=%2A%2F%2A",
            "@multimediatype": "GIF image file",
            "@type": "IMAGE-THUMBNAIL",
            "@size": "7442",
            "@ref": "gr7",
            "@mimetype": "image/gif"
          },
          {
            "@category": "thumbnail",
            "@height": "163",
            "@width": "120",
            "@_fa": "true",
            "$": "https://api.elsevier.com/content/object/eid/1-s2.0-S2468823122001377-gr4.sml?httpAccept=%2A%2F%2A",
            "@multimediatype": "GIF image file",
            "@type": "IMAGE-THUMBNAIL",
            "@size": "19101",
            "@ref": "gr4",
            "@mimetype": "image/gif"
          },
          {
            "@category": "thumbnail",
            "@height": "164",
            "@width": "102",
            "@_fa": "true",
            "$": "https://api.elsevier.com/content/object/eid/1-s2.0-S2468823122001377-gr5.sml?httpAccept=%2A%2F%2A",
            "@multimediatype": "GIF image file",
            "@type": "IMAGE-THUMBNAIL",
            "@size": "8582",
            "@ref": "gr5",
            "@mimetype": "image/gif"
          },
          {
            "@category": "thumbnail",
            "@height": "163",
            "@width": "107",
            "@_fa": "true",
            "$": "https://api.elsevier.com/content/object/eid/1-s2.0-S2468823122001377-gr2.sml?httpAccept=%2A%2F%2A",
            "@multimediatype": "GIF image file",
            "@type": "IMAGE-THUMBNAIL",
            "@size": "8217",
            "@ref": "gr2",
            "@mimetype": "image/gif"
          },
          {
            "@category": "thumbnail",
            "@height": "163",
            "@width": "160",
            "@_fa": "true",
            "$": "https://api.elsevier.com/content/object/eid/1-s2.0-S2468823122001377-ga1.sml?httpAccept=%2A%2F%2A",
            "@multimediatype": "GIF image file",
            "@type": "IMAGE-THUMBNAIL",
            "@size": "9110",
            "@ref": "ga1",
            "@mimetype": "image/gif"
          },
          {
            "@category": "thumbnail",
            "@height": "164",
            "@width": "107",
            "@_fa": "true",
            "$": "https://api.elsevier.com/content/object/eid/1-s2.0-S2468823122001377-gr3.sml?httpAccept=%2A%2F%2A",
            "@multimediatype": "GIF image file",
            "@type": "IMAGE-THUMBNAIL",
            "@size": "8296",
            "@ref": "gr3",
            "@mimetype": "image/gif"
          },
          {
            "@category": "high",
            "@height": "1126",
            "@width": "2816",
            "@_fa": "true",
            "$": "https://api.elsevier.com/content/object/eid/1-s2.0-S2468823122001377-gr8_lrg.jpg?httpAccept=%2A%2F%2A",
            "@multimediatype": "JPEG image file",
            "@type": "IMAGE-HIGH-RES",
            "@size": "282249",
            "@ref": "gr8",
            "@mimetype": "image/jpeg"
          },
          {
            "@category": "high",
            "@height": "3211",
            "@width": "2149",
            "@_fa": "true",
            "$": "https://api.elsevier.com/content/object/eid/1-s2.0-S2468823122001377-gr1_lrg.jpg?httpAccept=%2A%2F%2A",
            "@multimediatype": "JPEG image file",
            "@type": "IMAGE-HIGH-RES",
            "@size": "478204",
            "@ref": "gr1",
            "@mimetype": "image/jpeg"
          },
          {
            "@category": "high",
            "@height": "1087",
            "@width": "1463",
            "@_fa": "true",
            "$": "https://api.elsevier.com/content/object/eid/1-s2.0-S2468823122001377-gr9_lrg.jpg?httpAccept=%2A%2F%2A",
            "@multimediatype": "JPEG image file",
            "@type": "IMAGE-HIGH-RES",
            "@size": "538964",
            "@ref": "gr9",
            "@mimetype": "image/jpeg"
          },
          {
            "@category": "high",
            "@height": "2696",
            "@width": "2642",
            "@_fa": "true",
            "$": "https://api.elsevier.com/content/object/eid/1-s2.0-S2468823122001377-gr10_lrg.jpg?httpAccept=%2A%2F%2A",
            "@multimediatype": "JPEG image file",
            "@type": "IMAGE-HIGH-RES",
            "@size": "714634",
            "@ref": "gr10",
            "@mimetype": "image/jpeg"
          },
          {
            "@category": "high",
            "@height": "1269",
            "@width": "3049",
            "@_fa": "true",
            "$": "https://api.elsevier.com/content/object/eid/1-s2.0-S2468823122001377-gr6_lrg.jpg?httpAccept=%2A%2F%2A",
            "@multimediatype": "JPEG image file",
            "@type": "IMAGE-HIGH-RES",
            "@size": "716316",
            "@ref": "gr6",
            "@mimetype": "image/jpeg"
          },
          {
            "@category": "high",
            "@height": "1361",
            "@width": "3016",
            "@_fa": "true",
            "$": "https://api.elsevier.com/content/object/eid/1-s2.0-S2468823122001377-gr7_lrg.jpg?httpAccept=%2A%2F%2A",
            "@multimediatype": "JPEG image file",
            "@type": "IMAGE-HIGH-RES",
            "@size": "420908",
            "@ref": "gr7",
            "@mimetype": "image/jpeg"
          },
          {
            "@category": "high",
            "@height": "3907",
            "@width": "2871",
            "@_fa": "true",
            "$": "https://api.elsevier.com/content/object/eid/1-s2.0-S2468823122001377-gr4_lrg.jpg?httpAccept=%2A%2F%2A",
            "@multimediatype": "JPEG image file",
            "@type": "IMAGE-HIGH-RES",
            "@size": "4698316",
            "@ref": "gr4",
            "@mimetype": "image/jpeg"
          },
          {
            "@category": "high",
            "@height": "3493",
            "@width": "2173",
            "@_fa": "true",
            "$": "https://api.elsevier.com/content/object/eid/1-s2.0-S2468823122001377-gr5_lrg.jpg?httpAccept=%2A%2F%2A",
            "@multimediatype": "JPEG image file",
            "@type": "IMAGE-HIGH-RES",
            "@size": "755493",
            "@ref": "gr5",
            "@mimetype": "image/jpeg"
          },
          {
            "@category": "high",
            "@height": "3199",
            "@width": "2101",
            "@_fa": "true",
            "$": "https://api.elsevier.com/content/object/eid/1-s2.0-S2468823122001377-gr2_lrg.jpg?httpAccept=%2A%2F%2A",
            "@multimediatype": "JPEG image file",
            "@type": "IMAGE-HIGH-RES",
            "@size": "651993",
            "@ref": "gr2",
            "@mimetype": "image/jpeg"
          },
          {
            "@category": "high",
            "@height": "1085",
            "@width": "1062",
            "@_fa": "true",
            "$": "https://api.elsevier.com/content/object/eid/1-s2.0-S2468823122001377-ga1_lrg.jpg?httpAccept=%2A%2F%2A",
            "@multimediatype": "JPEG image file",
            "@type": "IMAGE-HIGH-RES",
            "@size": "161852",
            "@ref": "ga1",
            "@mimetype": "image/jpeg"
          },
          {
            "@category": "high",
            "@height": "3411",
            "@width": "2230",
            "@_fa": "true",
            "$": "https://api.elsevier.com/content/object/eid/1-s2.0-S2468823122001377-gr3_lrg.jpg?httpAccept=%2A%2F%2A",
            "@multimediatype": "JPEG image file",
            "@type": "IMAGE-HIGH-RES",
            "@size": "739346",
            "@ref": "gr3",
            "@mimetype": "image/jpeg"
          },
          {
            "@category": "standard",
            "@_fa": "true",
            "$": "https://api.elsevier.com/content/object/eid/1-s2.0-S2468823122001377-mmc1.doc?httpAccept=%2A%2F%2A",
            "@multimediatype": "Microsoft Word file",
            "@type": "APPLICATION",
            "@size": "7138304",
            "@ref": "mmc1",
            "@mimetype": "application/word"
          },
          {
            "@category": "standard",
            "@_fa": "true",
            "$": "https://api.elsevier.com/content/object/eid/1-s2.0-S2468823122001377-am.pdf?httpAccept=%2A%2F%2A",
            "@multimediatype": "Acrobat PDF file",
            "@type": "AAM-PDF",
            "@size": "2131003",
            "@ref": "am",
            "@mimetype": "application/pdf"
          }
        ]
      },
      "link": {
        "@rel": "abstract",
        "@href": "https://api.elsevier.com/content/abstract/scopus_id/85126944310"
      }
    }
  }
}