{
  "metadata": {
    "title": "Recent advances of Mo-based catalysts for synthesizing higher alcohols from Syngas",
    "authors": "; ; ",
    "journal": "Molecular Catalysis",
    "date": "2024-11-30",
    "doi": "10.1016/j.mcat.2024.114508",
    "abstract": "",
    "uri": "https://api.elsevier.com/content/article/pii/S2468823124006904",
    "pii": "S2468823124006904"
  },
  "fulltext": {
    "full-text-retrieval-response": {
      "scopus-eid": "2-s2.0-85203011495",
      "originalText": "serial JL 315758 291210 291744 291790 291809 31 Molecular Catalysis MOLECULARCATALYSIS 2024-09-04 2024-09-04 2024-09-04 2024-09-04 2024-09-10T23:58:43 1-s2.0-S2468823124006904 S2468-8231(24)00690-4 S2468823124006904 10.1016/j.mcat.2024.114508 S300 S300.1 FULL-TEXT 1-s2.0-S2468823124X00140 2024-10-24T08:27:34.400549Z 0 0 20241101 20241130 2024 2024-09-04T09:43:52.967547Z absattachment articleinfo articlenumber articletitlenorm authfirstinitialnorm authfirstsurnamenorm cid cids contenttype copyright crossmark dateloaded dateloadedtxt datesearch datesort dateupdated dco docsubtype doctype doi eid ewtransactionid hubeid indexeddate issn issnnorm itemstage itemtransactionid itemweight openaccess openarchive pg pgfirst pii piinorm pubdateend pubdatestart pubdatetxt pubyr sectiontitle sortorder srctitle srctitlenorm srctype ssids alllist content subj subheadings suppl tomb volfirst volissue volumelist webpdf webpdfpagecount yearnav figure table body acknowledge affil articletitle auth authfirstini authfull authkeywords authlast grantnumber grantsponsor grantsponsorid highlightsabst primabst pubtype ref specialabst 2468-8231 24688231 true 568 568 C Volume 568 31 114508 114508 114508 202411 November 2024 2024-11-01 2024-11-30 2024 Review Paper article rev © 2024 Elsevier B.V. All rights are reserved, including those for text and data mining, AI training, and similar technologies. RECENTADVANCESMOBASEDCATALYSTSFORSYNTHESIZINGHIGHERALCOHOLSSYNGAS YANGBIN R 1 Introduction 2 Mo-based catalysts 2.1 MoS2-based catalysts 2.1.1 Effect of promoters on Mo2S-based catalysts 2.1.1.1 Effect of alkali promoters on MoS2-based catalysts 2.1.1.2 Effect of transition metal promoters on MoS2-based catalysts 2.1.2 Active phase of MoS2 catalysts 2.1.3 Effect of supports on MoS2-based catalysts 2.1.4 Preparation methods of MoS2 catalysts 2.1.5 Catalytic mechanisms of MoS2-based catalysts 2.2 Mo2C-based catalysts 2.2.1 Effect of promoters on Mo2C-based catalysts 2.2.1.1 Effect of alkali promoters on Mo2C-based catalysts 2.2.1.2 Effect of transition metal promoters on Mo2C-based catalysts 2.2.2 Active phase of Mo2C-based catalysts 2.2.3 Effect of supports on Mo2C-based catalysts 2.2.4 Preparation methods of Mo2C-based catalysts 2.2.5 Catalytic mechanisms of Mo2C-based catalysts 2.3 Other Mo-based catalysts 2.3.1 Effect of promoters on other Mo-based catalysts 2.3.1.1 Effect of alkali promoters on other Mo-based catalysts 2.3.1.2 Effect of transition metal promoters on other Mo-based catalysts 2.3.2 Active phases of other Mo-based catalysts 2.3.3 Effect of supports on other Mo-based catalysts 2.3.4 Preparation methods of other Mo-based catalysts 2.4.5 Catalytic mechanisms of other Mo-based catalysts 3 Conclusion and future perspectives CRediT authorship contribution statement Acknowledgments References DORIAN 2006 1984 1991 J KWEKU 2018 1 9 D HAN 2021 119549 Y REYHANI 2016 141 164 H AASBERGPETERSEN 2011 423 459 K PENG 2017 270 273 W ZHAN 2009 3089 3096 Z CHU 2018 7869 7877 S SANTOS 2013 1634 1637 V LIU 2020 22469 22479 J LI 2020 61 Y HUANG 2022 120739 C AO 2020 26 34 M HAIDER 2009 9 16 M LI 2020 122525 Z MENG 2024 148751 S ASUNDI 2019 19655 19668 A ZAMAN 2012 41 132 S OSMAN 2022 21346 21356 M WANG 2017 57 61 N ZENG 2019 232 241 F PERMYAKOV 2018 19 27 E DOROKHOV 2016 841 853 V SURISETTY 2009 243 251 V TOYODA 2013 3769 3777 T MORRILL 2013 1665 1675 M LI 2019 57 62 H FERRARI 2013 302 309 D SURISETTY 2012 77 84 V YONG 2017 4206 4215 J XI 2020 118950 X ZHANG 2020 1413 1421 X QI 2003 339 342 H YANG 2009 448 455 Y LI 2004 605 609 D SURISETTY 2010 153 162 V ZHENG 2018 52 64 X WANG 2018 177 184 N HENSLEY 2014 199 208 J REN 2021 121321 Z REN 2022 135831 Z REN 2024 130915 Z TOYODA 2014 86 93 T WANG 2013 44 51 J LI 2001 155 161 Z OSMAN 2021 1321 M TABORGACLAURE 2015 88 97 M QIN 2020 151 N KONAROVA 2014 2394 2402 M SUAREZPARIS 2015 294 303 R LI 2005 674 678 D CHEN 2021 148301 J ZHAO 2020 17 25 L BAO 2008 151 157 J LEE 1995 127 140 J CHAI 2013 141 149 S XIANG 2007 1298 1303 M FARKAS 2008 1475 1485 A CHIANG 2012 918 925 S WU 2013 162 168 Q KIAI 2015 278 284 R WANG 2022 1697 1708 C SHOU 2011 83 93 H SHOU 2012 1408 1416 H CHRISTENSEN 2012 4161 4172 J LIU 2014 567 573 C XIANG 2007 503 507 M ASUNDI 2020 446 458 A ZHAO 2010 490 495 L XIANG 2008 599 603 M HAO 2021 230 Z AOKI 2013 169 175 Y WANG 2010 241 245 N XIANG 2011 520 524 M LI 2021 108608 F WANG 2010 9 13 N LIAKAKOU 2016 1106 1119 E MARQUART 2018 3806 3817 W LIU 2014 20948 20954 C HE 2024 113941 S ZHANG 2019 21022 21030 R DANG 2021 117945 Y LUO 2022 M XIANG 2008 489 495 M ASLAM 2020 117803 W ZAMAN 2010 59 68 S ZAMAN 2009 468 471 S XU 2014 63 67 R TENHAVE 2019 1801102 I VALLE 2022 5575 5583 E ZAMAN 2017 133 145 S ZAMAN 2018 1770 1779 S QU 2020 118760 H WU 2008 87 97 X ZAMAN 2011 266 274 S XIE 2016 671 680 W ZHANG 2020 365 374 L BIAN 1998 255 268 G KANG 2020 105945 B ZHANG 2018 4219 4228 F MA 2010 245 253 C LV 2015 2925 2934 M LIAKAKOU 2015 296 305 E TAVASOLI 2014 674 681 A LI 2019 63 71 J ANON 1992 1334 1340 SCHAIDLE 2015 325 334 J YANGBINX2024X114508 YANGBINX2024X114508XR 2026-09-04T00:00:00.000Z 2026-09-04T00:00:00.000Z http://creativecommons.org/licenses/by-nc-nd/4.0/ © 2024 Elsevier B.V. All rights are reserved, including those for text and data mining, AI training, and similar technologies. 2024-09-12T16:34:05.120Z http://vtw.elsevier.com/data/voc/AddOnTypes/50.7/aggregated-refined Key Scientific Research Projects of Colleges and Universities in Henan Province 24B530003 Key Scientific Research Project of Colleges and Universities in Henan Province http://data.elsevier.com/vocabulary/SciValFunders/501100013066 http://sws.geonames.org/1814991 Fundamental Research Funds for the Universities of Henan Province NSFRF240504 National Natural Science Foundation of China Youth Fund 22208085 Henan Province Natural Science Foundation GZS2020012 Henan Province Natural Science Foundation http://data.elsevier.com/vocabulary/SciValFunders/501100006407 http://sws.geonames.org/1814991 This work was supported by grants from National Natural Science Foundation of China Youth Fund ( 22208085 ), Henan Province Natural Science Foundation ( GZS2020012 ), Key Scientific Research Projects of Colleges and Universities in Henan Province ( 24B530003 ); the Fundamental Research Funds for the Universities of Henan Province ( NSFRF240504 ). https://doi.org/10.15223/policy-017 https://doi.org/10.15223/policy-037 https://doi.org/10.15223/policy-012 https://doi.org/10.15223/policy-029 https://doi.org/10.15223/policy-004 item S2468-8231(24)00690-4 S2468823124006904 1-s2.0-S2468823124006904 10.1016/j.mcat.2024.114508 315758 2024-10-24T08:27:34.400549Z 2024-11-01 2024-11-30 1-s2.0-S2468823124006904-main.pdf https://s3-eu-west-1.amazonaws.com/prod-ucs-content-store-eu-west/content/pii:S2468823124006904/MAIN/application/pdf/3f21a644fc656c4cb6589b41f80aef62/main.pdf main.pdf pdf true 15087806 MAIN 19 1-s2.0-S2468823124006904-main_1.png https://s3-eu-west-1.amazonaws.com/prod-ucs-content-store-eu-west/content/pii:S2468823124006904/PREVIEW/image/png/b80cce749f98e57702c3336c08a42619/main_1.png main_1.png png 58229 849 656 IMAGE-WEB-PDF 1 1-s2.0-S2468823124006904-gr8.jpg https://s3-eu-west-1.amazonaws.com/prod-ucs-content-store-eu-west/content/pii:S2468823124006904/gr8/DOWNSAMPLED/image/jpeg/77296e232d68d6355691722e211827c9/gr8.jpg gr8 gr8.jpg jpg 108942 593 678 IMAGE-DOWNSAMPLED 1-s2.0-S2468823124006904-gr7.jpg https://s3-eu-west-1.amazonaws.com/prod-ucs-content-store-eu-west/content/pii:S2468823124006904/gr7/DOWNSAMPLED/image/jpeg/d5c834eb93c244a747e4733e6cb931d9/gr7.jpg gr7 gr7.jpg jpg 61952 265 527 IMAGE-DOWNSAMPLED 1-s2.0-S2468823124006904-gr6.jpg https://s3-eu-west-1.amazonaws.com/prod-ucs-content-store-eu-west/content/pii:S2468823124006904/gr6/DOWNSAMPLED/image/jpeg/64ffc611f7e555884720097a3c46d08a/gr6.jpg gr6 gr6.jpg jpg 55743 224 781 IMAGE-DOWNSAMPLED 1-s2.0-S2468823124006904-gr5.jpg https://s3-eu-west-1.amazonaws.com/prod-ucs-content-store-eu-west/content/pii:S2468823124006904/gr5/DOWNSAMPLED/image/jpeg/defc0ec2e4ca5039e4c9941fdf6e2c1c/gr5.jpg gr5 gr5.jpg jpg 46427 414 565 IMAGE-DOWNSAMPLED 1-s2.0-S2468823124006904-gr11.jpg https://s3-eu-west-1.amazonaws.com/prod-ucs-content-store-eu-west/content/pii:S2468823124006904/gr11/DOWNSAMPLED/image/jpeg/49c953a367d01fc7af8ed8949d5559f9/gr11.jpg gr11 gr11.jpg jpg 65855 265 527 IMAGE-DOWNSAMPLED 1-s2.0-S2468823124006904-gr10.jpg https://s3-eu-west-1.amazonaws.com/prod-ucs-content-store-eu-west/content/pii:S2468823124006904/gr10/DOWNSAMPLED/image/jpeg/4483a7b9ae0dca1958940fd8373f8d72/gr10.jpg gr10 gr10.jpg jpg 40749 220 715 IMAGE-DOWNSAMPLED 1-s2.0-S2468823124006904-gr9.jpg https://s3-eu-west-1.amazonaws.com/prod-ucs-content-store-eu-west/content/pii:S2468823124006904/gr9/DOWNSAMPLED/image/jpeg/564baaf2aa86295685f6803a00ffd127/gr9.jpg gr9 gr9.jpg jpg 113138 527 781 IMAGE-DOWNSAMPLED 1-s2.0-S2468823124006904-gr12.jpg https://s3-eu-west-1.amazonaws.com/prod-ucs-content-store-eu-west/content/pii:S2468823124006904/gr12/DOWNSAMPLED/image/jpeg/a9debf0d54833b801ff2d66bab782f68/gr12.jpg gr12 gr12.jpg jpg 35970 436 565 IMAGE-DOWNSAMPLED 1-s2.0-S2468823124006904-gr4.jpg https://s3-eu-west-1.amazonaws.com/prod-ucs-content-store-eu-west/content/pii:S2468823124006904/gr4/DOWNSAMPLED/image/jpeg/438081d0a41be383272e83a2b8e40f1c/gr4.jpg gr4 gr4.jpg jpg 96808 345 602 IMAGE-DOWNSAMPLED 1-s2.0-S2468823124006904-gr3.jpg https://s3-eu-west-1.amazonaws.com/prod-ucs-content-store-eu-west/content/pii:S2468823124006904/gr3/DOWNSAMPLED/image/jpeg/99d40b4dba77c3c7bfd592b612524546/gr3.jpg gr3 gr3.jpg jpg 71811 453 640 IMAGE-DOWNSAMPLED 1-s2.0-S2468823124006904-gr2.jpg https://s3-eu-west-1.amazonaws.com/prod-ucs-content-store-eu-west/content/pii:S2468823124006904/gr2/DOWNSAMPLED/image/jpeg/bd52b766ef34c75a4013752aaf07c192/gr2.jpg gr2 gr2.jpg jpg 133812 561 781 IMAGE-DOWNSAMPLED 1-s2.0-S2468823124006904-gr1.jpg https://s3-eu-west-1.amazonaws.com/prod-ucs-content-store-eu-west/content/pii:S2468823124006904/gr1/DOWNSAMPLED/image/jpeg/1cd4e526310a896c1b85467bf97aed6c/gr1.jpg gr1 gr1.jpg jpg 88013 329 678 IMAGE-DOWNSAMPLED 1-s2.0-S2468823124006904-ga1.jpg https://s3-eu-west-1.amazonaws.com/prod-ucs-content-store-eu-west/content/pii:S2468823124006904/ga1/DOWNSAMPLED/image/jpeg/dddbfba3a82e8fc22780093552fcb2ff/ga1.jpg ga1 true ga1.jpg jpg 34626 200 428 IMAGE-DOWNSAMPLED 1-s2.0-S2468823124006904-gr8.sml https://s3-eu-west-1.amazonaws.com/prod-ucs-content-store-eu-west/content/pii:S2468823124006904/gr8/THUMBNAIL/image/gif/3e56e11426820ef79e07404ce7157e77/gr8.sml gr8 gr8.sml sml 18874 164 187 IMAGE-THUMBNAIL 1-s2.0-S2468823124006904-gr7.sml https://s3-eu-west-1.amazonaws.com/prod-ucs-content-store-eu-west/content/pii:S2468823124006904/gr7/THUMBNAIL/image/gif/7f5e23af65d2ca019fef8c4d2dc86f49/gr7.sml gr7 gr7.sml sml 17829 110 219 IMAGE-THUMBNAIL 1-s2.0-S2468823124006904-gr6.sml https://s3-eu-west-1.amazonaws.com/prod-ucs-content-store-eu-west/content/pii:S2468823124006904/gr6/THUMBNAIL/image/gif/a1130d1b8de8484d281699ef5a4c8816/gr6.sml gr6 gr6.sml sml 8310 63 219 IMAGE-THUMBNAIL 1-s2.0-S2468823124006904-gr5.sml https://s3-eu-west-1.amazonaws.com/prod-ucs-content-store-eu-west/content/pii:S2468823124006904/gr5/THUMBNAIL/image/gif/7502b236d2722a89352862f42b03fc78/gr5.sml gr5 gr5.sml sml 11360 161 219 IMAGE-THUMBNAIL 1-s2.0-S2468823124006904-gr11.sml https://s3-eu-west-1.amazonaws.com/prod-ucs-content-store-eu-west/content/pii:S2468823124006904/gr11/THUMBNAIL/image/gif/6d199a90e32065ebfcdfbd7d3ab98bbf/gr11.sml gr11 gr11.sml sml 20466 110 219 IMAGE-THUMBNAIL 1-s2.0-S2468823124006904-gr10.sml https://s3-eu-west-1.amazonaws.com/prod-ucs-content-store-eu-west/content/pii:S2468823124006904/gr10/THUMBNAIL/image/gif/f17b9466c5725b9e991aa6d961347cb9/gr10.sml gr10 gr10.sml sml 7451 67 219 IMAGE-THUMBNAIL 1-s2.0-S2468823124006904-gr9.sml https://s3-eu-west-1.amazonaws.com/prod-ucs-content-store-eu-west/content/pii:S2468823124006904/gr9/THUMBNAIL/image/gif/0e18cabe293d6988e10dc78078f9be1f/gr9.sml gr9 gr9.sml sml 14546 148 219 IMAGE-THUMBNAIL 1-s2.0-S2468823124006904-gr12.sml https://s3-eu-west-1.amazonaws.com/prod-ucs-content-store-eu-west/content/pii:S2468823124006904/gr12/THUMBNAIL/image/gif/dd988ffa95b21cb29e24b6cd0bf965f2/gr12.sml gr12 gr12.sml sml 5570 163 212 IMAGE-THUMBNAIL 1-s2.0-S2468823124006904-gr4.sml https://s3-eu-west-1.amazonaws.com/prod-ucs-content-store-eu-west/content/pii:S2468823124006904/gr4/THUMBNAIL/image/gif/9c949c09ab2de2eb179d22dcdf173abe/gr4.sml gr4 gr4.sml sml 17775 126 219 IMAGE-THUMBNAIL 1-s2.0-S2468823124006904-gr3.sml https://s3-eu-west-1.amazonaws.com/prod-ucs-content-store-eu-west/content/pii:S2468823124006904/gr3/THUMBNAIL/image/gif/6b2a4a2a061c1caba0c74eba5288e9f0/gr3.sml gr3 gr3.sml sml 10688 155 219 IMAGE-THUMBNAIL 1-s2.0-S2468823124006904-gr2.sml https://s3-eu-west-1.amazonaws.com/prod-ucs-content-store-eu-west/content/pii:S2468823124006904/gr2/THUMBNAIL/image/gif/ddffb4f2aaf408faf6c6a6f206b3ff69/gr2.sml gr2 gr2.sml sml 19479 157 219 IMAGE-THUMBNAIL 1-s2.0-S2468823124006904-gr1.sml https://s3-eu-west-1.amazonaws.com/prod-ucs-content-store-eu-west/content/pii:S2468823124006904/gr1/THUMBNAIL/image/gif/3d98bc40cf63a1e4bdb5af7d24907a02/gr1.sml gr1 gr1.sml sml 15551 106 219 IMAGE-THUMBNAIL 1-s2.0-S2468823124006904-ga1.sml https://s3-eu-west-1.amazonaws.com/prod-ucs-content-store-eu-west/content/pii:S2468823124006904/ga1/THUMBNAIL/image/gif/717764022a5f5dfcb6844b67cac2b4ae/ga1.sml ga1 true ga1.sml sml 10395 102 219 IMAGE-THUMBNAIL 1-s2.0-S2468823124006904-gr8_lrg.jpg https://s3-eu-west-1.amazonaws.com/prod-ucs-content-store-eu-west/content/pii:S2468823124006904/HIGHRES/image/jpeg/5272a6aea672b63df29b1b9c696b4445/gr8_lrg.jpg gr8 gr8_lrg.jpg jpg 973525 2623 3000 IMAGE-HIGH-RES 1-s2.0-S2468823124006904-gr7_lrg.jpg https://s3-eu-west-1.amazonaws.com/prod-ucs-content-store-eu-west/content/pii:S2468823124006904/HIGHRES/image/jpeg/11e0d2d8426e74c9e1fe3068f3d9eee0/gr7_lrg.jpg gr7 gr7_lrg.jpg jpg 699550 1174 2333 IMAGE-HIGH-RES 1-s2.0-S2468823124006904-gr6_lrg.jpg https://s3-eu-west-1.amazonaws.com/prod-ucs-content-store-eu-west/content/pii:S2468823124006904/HIGHRES/image/jpeg/49c006836b9a68f2b1dcae716540ee4d/gr6_lrg.jpg gr6 gr6_lrg.jpg jpg 391104 991 3458 IMAGE-HIGH-RES 1-s2.0-S2468823124006904-gr5_lrg.jpg https://s3-eu-west-1.amazonaws.com/prod-ucs-content-store-eu-west/content/pii:S2468823124006904/HIGHRES/image/jpeg/daec297346da363ec70fecd15991d45f/gr5_lrg.jpg gr5 gr5_lrg.jpg jpg 363214 1834 2500 IMAGE-HIGH-RES 1-s2.0-S2468823124006904-gr11_lrg.jpg https://s3-eu-west-1.amazonaws.com/prod-ucs-content-store-eu-west/content/pii:S2468823124006904/HIGHRES/image/jpeg/d48d2fff25dadf05da7b2bccf68b1595/gr11_lrg.jpg gr11 gr11_lrg.jpg jpg 797460 1172 2333 IMAGE-HIGH-RES 1-s2.0-S2468823124006904-gr10_lrg.jpg https://s3-eu-west-1.amazonaws.com/prod-ucs-content-store-eu-west/content/pii:S2468823124006904/HIGHRES/image/jpeg/842915101b337054da82e3fff75ada40/gr10_lrg.jpg gr10 gr10_lrg.jpg jpg 317692 976 3167 IMAGE-HIGH-RES 1-s2.0-S2468823124006904-gr9_lrg.jpg https://s3-eu-west-1.amazonaws.com/prod-ucs-content-store-eu-west/content/pii:S2468823124006904/HIGHRES/image/jpeg/f374ee1d6442cb9680cd6bd6eb4b1229/gr9_lrg.jpg gr9 gr9_lrg.jpg jpg 968580 2335 3458 IMAGE-HIGH-RES 1-s2.0-S2468823124006904-gr12_lrg.jpg https://s3-eu-west-1.amazonaws.com/prod-ucs-content-store-eu-west/content/pii:S2468823124006904/HIGHRES/image/jpeg/b57df7cd75b0eb3f9072691d5ae242db/gr12_lrg.jpg gr12 gr12_lrg.jpg jpg 254023 1928 2500 IMAGE-HIGH-RES 1-s2.0-S2468823124006904-gr4_lrg.jpg https://s3-eu-west-1.amazonaws.com/prod-ucs-content-store-eu-west/content/pii:S2468823124006904/HIGHRES/image/jpeg/9be34e351783bcb2af77d8b4f64007b8/gr4_lrg.jpg gr4 gr4_lrg.jpg jpg 851771 1529 2667 IMAGE-HIGH-RES 1-s2.0-S2468823124006904-gr3_lrg.jpg https://s3-eu-west-1.amazonaws.com/prod-ucs-content-store-eu-west/content/pii:S2468823124006904/HIGHRES/image/jpeg/9e3db91c541e430e563558959bb36983/gr3_lrg.jpg gr3 gr3_lrg.jpg jpg 494078 2005 2833 IMAGE-HIGH-RES 1-s2.0-S2468823124006904-gr2_lrg.jpg https://s3-eu-west-1.amazonaws.com/prod-ucs-content-store-eu-west/content/pii:S2041488924005666/HIGHRES/image/jpeg/60508a7c6051663fb48d094b3903e894/gr2_lrg.jpg gr2 gr2_lrg.jpg jpg 1100208 2483 3458 IMAGE-HIGH-RES 1-s2.0-S2468823124006904-gr1_lrg.jpg https://s3-eu-west-1.amazonaws.com/prod-ucs-content-store-eu-west/content/pii:S2468823124006904/HIGHRES/image/jpeg/f3ae1b6e61f9c6eafb9cb852862533f1/gr1_lrg.jpg gr1 gr1_lrg.jpg jpg 741458 1457 3000 IMAGE-HIGH-RES 1-s2.0-S2468823124006904-ga1_lrg.jpg https://s3-eu-west-1.amazonaws.com/prod-ucs-content-store-eu-west/content/pii:S2041488924005666/HIGHRES/image/jpeg/17bd4072932b38c8d1d2876296e87ec4/ga1_lrg.jpg ga1 true ga1_lrg.jpg jpg 216813 886 1897 IMAGE-HIGH-RES 1-s2.0-S2468823124006904-am.pdf am am.pdf pdf 1743500 AAM-PDF https://s3-eu-west-1.amazonaws.com/prod-ucs-content-store-eu-west/content/egi:10CX9RNMHNV/MAIN/application/pdf/cf065a9ad3cd72bf8efd377a167e1c55/am.pdf MCAT 114508 114508 S2468-8231(24)00690-4 10.1016/j.mcat.2024.114508 Elsevier B.V. Fig. 1 Design diagram of Mo-based catalyst for converting syngas to higher alcohols. Fig 1 Fig. 2 The representative SEM images of (A) ZnCrAl-O, (B) KNiMo|ZnCrAl-O(E); N2 adsorption–desorption isotherms and pore distribution of oxidic ZnCrAl(C), and oxidic KNiMo/ZnCrAl(D) [41] . Fig 2 Fig. 3 Reaction network of CO conversion on the KCoMoS catalyst active site [23]. Fig 3 Fig. 4 Proposed syngas conversion network over K-Co-MoSx catalyst [31] . Fig 4 Fig. 5 The possible reaction pathways of syngas conversion on the Cu4/MoS2(001) surface [52]. Fig 5 Fig. 6 Possible reaction pathway on hierarchical KNiMoS|ZnCrAlS-based multifunctional catalysts [41]. Fig 6 Fig. 7 TEM images of (a) MoC, (b) an enlarged image of a β-Mo2C particle, and (c) Ni0.5MoC catalyst[69]. Fig 7 Fig. 8 A Schematic illustration of the synthesis of the carbon supported Co/Co6Mo6C catalyst via pyrolysis of phosphomolybdic acid encapsulated ZIF (A); and SEM images, TEM images, HRTEM images of fresh catalysts Co4.7Mo@C (B1-B3) [75] . Fig 8 Fig. 9 Potential energy diagram of CO initial activation and the formation of CH (A), CH3OH (B), the related reactions of (a)CH, (b) CH2, and (c) CH3 species (C); Differential charge density of the Cu/β-Mo2C(001) surface (D) [81] . Fig 9 Fig. 10 Reaction pathways considered for syngas conversion on the Mo2C (001) surface [82]. Fig 10 Fig. 11 TEM and HRTEM images of (a, b) MoO2-Pla [106]. Fig 11 Fig. 12 Plausible CO hydrogenation reaction pathways on Mo2N and K-Mo2N catalysts [91]. Fig 12 Table 1 Direct HAS conversion over MoS2-based catalysts. Table 1 Sample T(K) P(MPa) GHSV(h −1) H2/C Conv.(CO%) Selectivity(C-atom%) Distribution(C-atom%) STYmg/gcat/h Ref. RCH ROH MeOH C2+OH KNiMoS|ZnCrAlS-O(E) 603 5.0 3000 1 20.2 36.2 63.8 31.5 68.5 116.4 [41] K-MoSx 633 8.7 4500 1 25.6 36.4 59.8 19.3 80.7 — [31] K-Co-MoSx-0.13 633 8.7 4500 1 18.7 28.2 66.8 11.3 88.7 — [31] MoS2-DN 633 5.0 5000 2 27.3 31.4 68.6 40.7 59.3 115 [53] K-NiMo3Sx 603 10.0 3000 a 1 41.41 16.76 83.24 — — 497 [38] K-Mo3Sx-NiAc 603 10.0 3000 a 1 46.14 34.07 65.93 — — 440 [20] K02Co0610MoCe 533 5.0 5000 1 3.2 23.5 76.5 24.2 75.8 — [43] Ni0.5Mo1K0.5–15CNTs 593 5.0 3000 1 26.8 32.7 67.3 b 22.3 77.7 90.3 b [44] La0.2MoCo0.1K0.6 603 3.0 2225 2 17.2 24.8 75.4 39.3 60.7 96 C [34] SKCM01 583 10.0 1200 1 61.3 26.8 73.2 32.4 67.6 146.8 [54] US-Ni/K/MoS2 573 8.0 2500 1 25.82 15.28 84.76 12.2 87.8 210 c [51] La/Ni/ADM 593 8.0 2500 1 33.52 33.95 66.05 11.42 88.58 170 c [35] CO2-free, [a] WHSV, [b] Total oxy, [c] mg/mL/h. Table 2 Activity and selectivity of various potassium-promoted Mo2C in COH2 reaction [55]. Table 2 Promoter none K2CO3 KOH CH3COOK KCl K2SO4 CO conv. (%) 60.3 10.6 8.3 10.4 25.0 28.3 CO2 select. (%) 36.7 54.6 54.7 52.8 48.3 47.6 selectivity (CO2-free basis, C-atom%) n-paraffin (∑) 90.8 30.8 31.9 29.8 83.4 83.9 1-olefin (∑) 3.9 29.1 28.1 31.4 10.3 7.8 l-alcohol (∑) 0 33.1 34.7 31.3 1.4 2.1) others (∑) 5.3 7.0 5.3 7.6 5.0 6.2 Table 3 Direct HAS conversion over Mo2C-based catalysts. Table 3 Sample T(K) P(MPa) GHSV(h −1) H2/C Conv.(CO%) Selectivity(C-atom%) Distribution(C-atom%) STYROH mg/gcat/h Ref RCH ROH MeOH C2+OH 25 %β-Mo2C/γ-Al2O3 573 3.1 3600 2 19.0 32.7 67.3 — — 74.5 [83] RhK/Mo2C 563 3.0 1200 1 20.2 48.6 51.4 29.0 71.0 — [62] MCNi-1.5 453 5.0 1200 2 7.4 38.0 62.0 57.7 42.3 25 [71] K/Mo2C 553 6.0 0.63 f 2 5.8 30.5 69.5 34.1 65.9 45.2 b [77] Ni/K/Mo2C 553 6.0 0.63 f 2 23.2 39.6 60.4 17.3 82.7 147.4 b [77] K-Co-Mo/CNTs 603 3.3 336 d 2 47.2 57.8 42.2 37.9 62.1 — [61] Ca/Mo2C 613 7.0 4000 2 76.33 94.77 5.23 92.62 7.38 — [66] Mg/Mo2C 613 7.0 4000 2 90.53 93.88 6.12 85.14 14.86 — [66] Mo-Ar 553 7.0 4000 2 12.19 72.94 27.06 72.24 27.76 26 c [79] Fe/K/β-Mo2C 593 7.0 4000 2 50.24 54.9 45.1 28.71 71.29 140 c [76] Ni0.5MoC 513 7.0 4000 2 40.29 53.99 e 46.01 e — — 115 c [69] K/Ni/β-Mo2C (1/8) 573 8.0 2000 1 73.0 52.7 47.3 25.8 74.2 324.2 c [84] K/Co/β-Mo2C 573 8.0 2000 1 40.76 57.41 42.59 29.85 70.15 156.4 c [67] Ni/K/Mo2C@LC 633 7.0 7000 1 26.8 49.6 50.4 23.3 76.7 455 [16] CO2-free, [a] WHSV, [b] Total oxy, [c] mg/mL/h, [d] m3(STP)/(kgcat∙h), [e] wt%, [f] W/F ratio of 0.63 g∙s∙cm−3. Table 4 Direct HAS conversion over other Mo-based catalysts. Table 4 Sample T(K) P(MPa) GHSV(h −1) H2/C Conv.(CO%) Selectivity(C-atom%) Distribution(C-atom%) STYROH mg/gcat/h Ref. RCH ROH MeOH C2+OH Mn-K-Co-Mo 593 5.0 6000 2 23.9 35.7 64.3 15.7 84.3 148.3 [96] Co1Mo1K0.05–12 % 563 5.0 8000 2 32.5 14.6 85.0 — — 331.1 [94] K/MoP@C 573 8.0 3000 1 35.5 41.5 58.5 38.6 61.4 152.6 [99] K1Co0.75MoP 548 5.0 3600 1 14.4 52.5 47.5 9.1 90.9 — [88] K1.00 −MoSe2 595 10.0 3000 1 7.2 27.2 72.8 25.4 74.6 103.2 [93] CO2-free. Review Paper Recent advances of Mo-based catalysts for synthesizing higher alcohols from Syngas Ren Yangbin Writing – review & editing Writing – original draft Software Project administration Methodology Investigation Formal analysis Conceptualization a b Weng Yujing Funding acquisition Formal analysis Conceptualization a b Zhang Yiqing Investigation Formal analysis a b Huang Chao Writing – review & editing Funding acquisition Formal analysis Conceptualization a b ⁎ Zhang Yulong Writing – review & editing Supervision Resources Project administration Funding acquisition Formal analysis Conceptualization a b ⁎ Sun Qi Supervision Resources Project administration Methodology Conceptualization a b ⁎ a Henan Key Laboratory of Coal Green Conversion, and International Joint Laboratory of Coal Clean Utilization, Jiaozuo, Henan Province, China Henan Key Laboratory of Coal Green Conversion and International Joint Laboratory of Coal Clean Utilization Jiaozuo Henan Province China aHenan Key Laboratory of Coal Green Conversion, and International Joint Laboratory of Coal Clean Utilization b College of Chemistry and Chemical Engineering, Henan Polytechnic University, Jiaozuo Henan 454000, China College of Chemistry and Chemical Engineering Henan Polytechnic University Jiaozuo Henan 454000 China bCollege of Chemistry and Chemical Engineering, Henan Polytechnic University, Jiaozuo Henan 454000, China ⁎ Corresponding authors. The energy and environmental crises are becoming increasingly severe. Syngas, derived from coal, oil, biomass and other materials as an important platform for the conversion of matter and energy, can converted to the higher alcohols. Higher alcohols are important industrial raw materials and transportation fuels. Therefore, the synthesis of higher alcohols from syngas can effectively alleviate the energy and environmental crises. Despite decades of research, it is regrettable that the syngas to higher alcohols is still in the experimental research stage and has not yet been industrialized. This review comprehensively introduces the current status and progress of Mo-based catalysts for the syngas to higher alcohols. It is divided into three parts: MoS2, Mo2C and other Mo-based catalysts (MoOx, MoP, Mo2N and MoSe2) applied in the syngas to higher alcohols. Each part includes the promoters (alkaline promoters and transition metal promoters), active phase of catalysts, support, the preparation method and catalytic mechanism. The structure-activity relationship of catalysts, catalyst preparation and catalytic mechanism are emphasized to highlight the recent progress and challenges of Mo-based catalysts. The purpose of this review is to provide a comprehensive summary of Mo-based catalysts for the syngas to higher alcohols to provide a reference for the design, development and future perspective of Mo-based catalysts. Graphical abstract Image, graphical abstract Keywords Syngas Higher alcohols MoS2 Mo2C Mo-based catalysts Data availability The authors are unable or have chosen not to specify which data has been used. 1 Introduction Direct synthesis of higher alcohols from syngas (HAS) can help alleviate the energy crisis [1] and greenhouse effect [2]. Syngas, typically a mixture of CO and H₂, is an excellent platform for material conversion and can be derived from a wide range of sources, including coal [3], heavy oil [4], natural gas [5], biomass [6], and CO₂ [7,8]. Converting CO₂ and green hydrogen into syngas in specific ratios can efficiently utilize CO₂ and mitigate the greenhouse effect. Higher alcohols (alcohols with two or more carbon atoms) can be used as transportation fuels and fundamental industrial raw materials, which can effectively address the energy crisis. Therefore, the HAS have garnered significant attention from researchers. HAS usually involves the dissociation and non-dissociation adsorption processes of CO, as shown in Fig. 1 . Dissociation adsorbed CO is mainly used to form alkyl intermediate substances, while non-dissociation adsorbed CO is mainly used for CO insertion into the above-mentioned alkyl substances to form higher alcohols [9]. Due to the existence of these processes, designing high-performance catalysts is extremely challenging. First, the catalyst must have at least two active sites acting as dissociation and non-dissociation adsorption of CO. Second, the ability of CO to dissociation and non-dissociation adsorb must reach a better balance in order to promote efficient conversion of syngas into higher alcohols. Third, how to improve efficiency while matching these two abilities. After decades of research, researchers have developed a variety of catalysts used for HAS. These catalysts can be mainly classified into four categories: modified methanol catalysts such as CuZn-based [10] catalysts; modified Fischer-Tropsch catalysts such as CuFe [11], CuCo [12], and CuNi-based [13] catalysts; noble metal catalysts such as Rh [14]; and Mo-based catalysts such as MoS2 [15], Mo2C [16], and MoOx [17]. Among them, modified methanol catalysts have poor carbon chain growth ability and high selectivity for methanol. Modified Fischer-Tropsch catalysts have wide product distribution and poor stability. Rh-based catalysts have excellent performance but low economic efficiency, making it difficult to achieve industrial application. Mo-based catalysts have adjustable valence state, sulfur resistance, and carbon deposition resistance, which are a highly promising class of catalyst for the synthesis of higher alcohols from syngas. Most of the review articles on the HAS that have been published so far are large-scale reviews covering almost all types of catalysts. However, the discussion on Mo-based catalysts is generally brief and not comprehensive or in-depth. Only Zaman et al. [18] has published a review on Mo-based catalysts since 11 years ago, and at that time the research on Mo-based catalysts was not in-depth and there were few literature sources. With the development of research on Mo-based catalysts applied in HAS, many excellent Mo-based catalyst literature have emerged in recent years. Therefore, it is necessary to make a more comprehensive review of Mo-based catalysts in HAS. This review aims to clarify the characteristics of various Mo-based catalysts by summarizing diverse preparation methods, the role of promoters (alkaline promoters, transition metal promoters) and support, different active phases of catalysts, and catalytic mechanisms to provide a reference for the design and preparation of high-performance Mo-based catalysts. This review is mainly divided into three parts: MoS2, Mo2C and other Mo-based (MoOx, Mo2N, MoP and MoSe2) catalysts, as shown in Fig. 1. Each part includes a summary of different promoters (alkaline promoters and transition metal promoters), active phases of catalysts, support, preparation methods and catalytic mechanisms. The focus of this review is on elucidating the multiple roles of promoters, clarifying the active phases of catalysts, the influence of supports and catalytic mechanisms. 2 Mo-based catalysts Research on the preparation of higher alcohols from syngas began in the 1930s and Mo-based catalysts are a typical type of catalyst for the preparation of higher alcohols from syngas. In the 1980s, Dow Chemical Company and Union Carbide Corporation discovered that Mo-containing Fe-based catalysts could catalyze CO hydrogenation to produce alcohols after impregnation with alkali metals [19]. Since then, Mo-based catalysts used for the synthesis of higher alcohols via syngas have received great attention and developed well. Currently, Mo-based catalysts mainly include MoS2, Mo2C, MoOx, MoP, Mo2N and MoSe2, which the first two have been studied earlier and have more literature sources. We will discuss them separately while discussing the latter four together. 2.1 MoS2-based catalysts MoS2-based catalysts are the most commonly used Mo-based catalysts for the synthesis of higher alcohols from syngas. MoS2-based catalysts have strong sulfur resistance due to their inherent sulfur content and also have high tolerance to carbon dioxide. This indicates that MoS2-based catalysts have strong adaptability to syngas and do not require strict control of the content of H2S and CO2 in the syngas. MoS2 catalysts also have strong anti-carbon deposition properties and can be used for syngas with low H2/CO, Table 1 lists the performance of MoS2-based catalysts in the HAS. 2.1.1 Effect of promoters on Mo2S-based catalysts Promoters are crucial for MoS2 catalysts in CO hydrogenation to produce higher alcohols, especially alkaline and transition metal promoters. The MoS2 catalysts without promoters displayed almost all short-chain hydrocarbons in CO hydrogenation. After the addition of alkali metal promoters, the MoS2-based catalysts inhibited the formation of hydrocarbons and significantly improved the selectivity of alcohols. Also, transition metal promoters can enhance the carbon chain growth ability of products. 2.1.1.1 Effect of alkali promoters on MoS2-based catalysts The introduction of alkali promoters into MoS2-based catalysts is extremely important for CO hydrogenation to the formation of higher alcohols. The effect of alkali promoters on the performance of MoS2-based catalysts is very complex. Alkali promoters could participate in the formation of the active phase of MoS2-based catalysts and also affect the dispersion, spatial structure and electronic properties of the MoS2 phase as well as regulating the acid-base sites of the catalyst. Potassium (K) is the most commonly used and currently the most effective alkali metal promoter. Alkali promoters have significant impact on the active phase of MoS2-based catalysts. Wang et al. [20] synthesized three K-Mo3Sx catalysts using an in-situ decomposition method and exhibited the different catalytic performance, which was caused by the formation of a new active phase K-Mo-S. Zeng et al. [21] designed a multi-layer K-MoS2 catalyst with well-contacted dual-site MoS2 and KMoS2 phases. The effect of alkali promoters on the electronic properties of MoS2-based catalysts. Permyakov et al. [22] used function density theory (DFT) to study the electronic properties of K on catalysts, indicating that K modification was found to hinder the σ-bonding of adsorbed molecules and stabilize hydride adsorption. After the adding of K, the promoted active site model on the M-edge slightly promotes the formation of hydride species and reduces CO adsorption energy on double vacancies. Therefore, K can act as a promoter for most active site models, but KFeMoS is an exception where K acts as a strong poison. Dorokhov et al. [23] demonstrated the effect of K on CoMoS phase active sites through DFT calculations. The transfer of electron density from K atoms to transition metal atoms (mainly to Co) and the reduction of electron deficiency in Co atoms leads to a decrease of Lewis acidity and CO and H2 adsorption energies in catalyst. Santos et al. [9] studied the of K-MoS2 catalysts by using a combination of in-situ infrared spectroscopy and kinetic studies. The presence of K not only changed the electronic properties of the catalyst but also stabilized alkoxide species, facilitating the formation of higher alcohols through increasing the probability of CO insertion and to some extent through base-catalyzed aldol condensation. Alkali promoters can enhance the dispersion of Mo metal on the support. Surisetty et al. [24] has reported that the K and Mo precursors were co-impregnated onto multi-walled carbon nanotubes using an equal volume impregnation method. By increasing the content of K from 3 wt% to 9 wt%, the interaction between K-Mo-O in the precursor was increased. In addition, the dispersion percentage of metallic Mo was increased from 20.2 % to 30.9 %. Most metal particles (80 %) were evenly distributed inside the tubes, with the remainder distributed on the outer surface of MWCNT. Dorokhov et al. [23] found that the presence of K is beneficial for increasing the stacking number and slab length of MoS2. An increase in potassium content to 15 wt.% leads to lateral adhesion of MoS2 slabs, resulting in MoS2 crystals with long edges and a corresponding decrease in corner site ratio, thereby improving alcohol selectivity. In general, the type, amount and method of introducing alkali promoters have an impact on MoS2-based catalysts. Toyoda et al. [25] found that the alcohol selectivity and chain growth probability of catalysts using K2CO3 were higher than those using nitrates. Morrill et al. [26] pointed out that when the K content in the catalyst is low, there will be more residual acidic sites on the catalyst, leading to dehydration and hydrogenation of ethanol and acquired an optimal K/Mo molar ratio of 1. Toyoda et al. [25] considered that the selectivity of higher alcohols was increased with the increase of K/Mo molar ratio. When the K/Mo molar ratio reached 0.6 from 0, the highest selectivity of higher alcohols was achieved. Li et al. [27] synthesized a Co-MoS2 catalyst with a K2CO3 promoter with an optimal K/Mo molar ratio of 0.5. The K/Mo molar ratio has a significant impact on MoS2-based catalysts, and different MoS2-based catalysts may have different optimal K/Mo molar ratios. When the K/Mo molar ratio is low, the promotion effect is not good and alcohol selectivity is low. As the K/Mo molar ratio is high, the K promoter can block or cover active sites on the surface of the catalyst, resulting in a decline of catalytic performance. Santos et al. [9] found that the alkali-promoting effect largely depends on the way the alkali is added. The distribution of K on fresh K-MoS2 catalysts is uneven and K redispersion occurs when exposed to reaction conditions. Two methods of adding K were used by Ferrari et al. [28] to promote the synthesis of higher alcohols from syngas using MoS2 catalyst: physical mixing and equal volume impregnation. Compared with K2CO3 and MoS2 catalysts prepared by physical mixing, that of catalysts prepared by equal volume impregnation showed poorer performance. From thermogravimetric analysis of the physical mixing method, it showed that sulfur was lost at temperatures above 330 °C, and showed randomly oriented small MoS2 microcrystals from transmission electron microscopy images, while longer MoS2 microcrystals were obtained by equal volume impregnation. Although the introduction method of K promoters has a great impact on the performance of MoS2 catalysts, there is no consensus on which method is best. 2.1.1.2 Effect of transition metal promoters on MoS2-based catalysts Typically, MoS2 catalysts promoted only by alkali metals produce a significant amount of methanol as the CO hydrogenation product. It is necessary to introduce transition metal promoters to improve the carbon chain growth ability and thus increase the formation of higher alcohols. Common transition metal promoters are Fischer-Tropsch elements, usually Fe, Co and Ni elements. There are also MoS2-based catalysts modified with other transition metal elements. The literature describes the use of transition metals in the construction of active phases in MoS2-based catalysts. Surisetty et al. [29] have reported that the K-MoS2 catalysts modified with transition metals Ni, Co, and Rh were prepared and applied in HAS. It was found that those transition metals reduced the reduction temperature of Mo+6. And, the MoS2 was the active phase in Rh-promoted catalysts, while Ni-Mo-S and Co-Mo-S phases are formed in Ni- and Co-promoted catalysts, respectively. In addition, the Ni-Mo-K/Al2O3 catalyst display higher hydrocarbons selectivity, but the above catalyst modified by Co can increase the alcohol activity and suppress hydrocarbon formation. The activity of Rh-promoted catalysts for higher alcohol synthesis is much higher than that obtained on rhodium-free catalysts. Yong et al. [30] synthesized a catalyst in which Ni participated in forming NiSx and NiMoSx phases. The high dispersion of NiSx and NiKMoSx and a large increase in the number of dual active sites in contact significantly enhanced the synergy between Ni and Mo, thereby enhancing CO hydrogenation activity and selectivity for higher alcohols. Li et al. [27] reported on a catalyst involving Co in constructing an active phase where fresh catalyst had highly dispersed Co-Mo-S active phase without detecting any Co9S8 phase. This was attributed to using pure H2 to activate the catalyst effectively suppressing formation of Co9S8 phase resulting in higher selectivity for higher alcohols. Xi et al. [31] reported that introducing Co into K-MoSx catalyst led to an increase in CH4 content indicating stronger hydrogenation ability possibly due to high content of CoS2 leading to formation of CoMoO4 phase resulting lower selectivity for higher alcohols. Formation of Co9S8 adjacent to K-promoted MoSx phase is an effective active phase for higher alcohol synthesis where dissociative adsorption occurs mainly on CO. Permyakov et al. [22] reported on the bimetallic (Me)MoS2 (Me = Nb, Fe, Co, Ni) sulfide system. The CO adsorption energy increases in the order of Ni<Co<Fe on the M-edge (the edge where molybdenum is located). The calculation results were confirmed by syngas conversion experiments. The promotion of Fe, Co or Ni at the S-edge (the edge where sulfur is located) of the catalyst causes catalyst deactivation and inhibits hydrogenation reactions. On the FeMoS2 and CoMoS2 catalysts, syngas conversion mainly occurs at the M-edge promotion sites. On the M-edge, transition metal promotion activity decreases in the order of FeMoS > CoMoS > > NiMoS. Zhang et al. [32] reported a Zn-modified MgAl mixed oxide-supported KNiMoS-based catalyst. The introduction of Zn can reduce the concentration of strong acid sites on the catalyst and weaken metal-support interactions to regulate MoS2 slab reducibility, sulfidation degree, length/stacking degree and dispersion to expose more active sites. NiSx and K-Ni have high synergistic effects in carbon chain growth and non-dissociative CO insertion processes to achieve higher total alcohol selectivity (56.5 %) and higher alcohol selectivity (82.2 %). Qi et al. [33] reported a Mn- and Ni-co-modified K/MoS2 catalyst with synergistic effects between Mn and Ni to promote increased selectivity for higher alcohols. Yang et al. [34] reported a La-promoted Mo-Co-K catalyst with significantly improved performance upon introduction of La under identical reaction conditions. Li et al. [35] found strong interactions between La and Ni that inhibited Ni aggregation to enhance surface dispersion while also facilitating close interactions between Ni and MoS2 for improved formation of higher alcohols. 2.1.2 Active phase of MoS2 catalysts Identifying the active phase of a catalyst is key to the catalyst research and has great significance for studying catalytic mechanisms and guiding the synthesis of catalysts. In recent years, people have used various methods to prepare MoS2-based catalysts with different active phases for the production of higher alcohols through CO hydrogenation. Surisetty et al. [29] reported that when Rh was used as a promoter, the observed active sites of Mo-MoS2. When Ni and Co were used as promoters, the active phase was Ni-Mo-S and Co-Mo-S phases, respectively. At the same time, diffraction peaks representing characteristic K-Mo-S phases in X-ray diffraction patterns of Mo-K/MWCNT catalysts promoted by cobalt sulfide were observed [36]. According to the edge model, the hydrogenation reaction mainly occurs at the edge of MoS2. The increase in particle size can enhance the active sites at the edge of MoS2 plates. The increase in stacking number of MoS2 crystals and partial increase in K active sites at edges lead to formation of alcohols and suppression of alkane [23]. Li et al. [27] reported a nanoplate-structured K-Co-MoS2 catalyst with highly dispersed Co-Mo-S active phase and no Co9S8 phase detected in fresh catalysts. During catalytic reaction, the formation of SH species stabilized Co-Mo-S phase. Xi et al. [31] believed that the higher Co content could promote the formation of CoS2 and CoMoO4 phases, resulting in the poor selectivity for higher alcohols. When Co is moderate, a Co9S8 phase will form between two K-promoted MoSx phases loaded with it. The authors speculated that Co9S8 phase is responsible for producing CHx*, which can produce branched-chain alcohol when transferred to K-MoSx phase. Yong et al. believe that by adjusting the interaction between metal and support to balance the dispersion and stacking of MoS2 plates, the abundant Mo edges are provided for dispersed Ni species to construct more active sites. The significant increase of highly dispersed and contacted dual active sites of NiSx and NiNKMoSx will endow them with efficient synergistic effects and enhance catalytic performance [30]. Wang et al. [20] believe that the significantly higher selectivity for higher alcohols of K-Mo3Sx-Ni(Ac) than K-Mo3Sx and K-Mo3Sx-Ni(L) is due to the formation of a new active phase K-Mo-S in K-Mo3Sx-Ni(Ac), while Ni only plays a role in further improving catalytic performance. Zheng et al. [37] reported that single-atom Ni loaded on Mo6S8 (Ni-SA/Mo6S8) increased the stability of reaction intermediates, which was conducive to CC bond formation, and Ni atoms directly participated in ethanol synthesis reaction. Wang et al. [38] believe that the key to improving MoS2 catalytic performance is to generate a large number of unsaturated sites and form abundant Ni-Mo-S phases on unsaturated sites. They synthesized a catalyst with Ni and Mo interactions, producing an active phase NiMo3Sx, which improved catalytic performance. Hensley et al. [39] reported on the study of catalyst deactivation using K-CoMoSx catalysts with equipment operating times ranging from 118 to 3969 h. In the absence of H2S co-feed, the alcohol selectivity decreased after several hundred hours of operation while the hydrocarbon selectivity increased. Desulfurization not only led to surface oxidation of the catalyst, but also increased surface acidity and caused alcohol dehydration. Surface coking blocked active sites and reduced catalyst performance. When continuous sulfidation with H2S co-feed was used, it was possible to reverse surface non-coking oxidation of the catalyst and maintain constant catalyst selectivity for thousands of hours. 2.1.3 Effect of supports on MoS2-based catalysts The support plays an important role in the component of catalyst. It generally has an excellent pore structure that can enhance the dispersibility of active component, and improve the diffusion efficiency of raw materials and products. it can interact with the active component to enhance catalytic performance and inhibit its agglomeration. In addition, it can also provide a moderate acidic or alkaline environment for the catalyst, which is benefit to the formation of target product. In terms of the support applied in MoS2-based catalyst, it generally divided into oxide supports and carbon material support. Common oxide supports have relatively strong acidic sites, and there is strong interaction between the support and active component, which may be not suitable for direct use as a support for synthesizing higher alcohols from syngas. Carbon support generally have a large surface area, porosity, good tolerance to acidic or alkaline environments, fewer acidic sites, less interaction with active phases, and good electronic conductivity, these advantages are beneficial for the synthesis of alcohols. Oxide supports are one of the most commonly used supports in MoS2-based catalysts. Toyoda et al. [25] prepared several molybdenum-based catalysts supported on Al2O3 by impregnation method. They found that when Al2O3 was prepared by using high-temperature calcination from 600 to 1000 °C, the selectivity of hydrocarbons decreased from 46 % to 21 %, but the CO conversion also decreased. This was attributed to a decrease in acid amount and acidic sites on Al2O3 with increasing calcination temperature. The strong acidic sites may be beneficial for hydrocarbon generation. Yong et al. [30] used MgAl bimetallic oxide as a support to achieve the best effect between the dispersion and stacking of MoS2 flakes by adjusting the interaction between metal and support. This provided rich Mo edges for Ni species and produced more active phase NiNKMoSx. Zhang et al. [32] used Zn-modified MgAl oxide as a support. The introduction of Zn reduced the concentration of strong acid sites on the catalyst and weakened the metal-support interaction, thereby regulating the reducibility, sulfidation degree, length/stacking degree and dispersion degree of MoS2 flakes. This exposed more active sites and improved the selectivity of higher alcohols. Ren et al. [40] synthesized an ordered mesoporous NiMg mixed metal oxide support that can restrict the growth of MoS2. The ordered mesopores restricted and regulated Mo-Ni interactions, significantly increasing the specific surface area and dispersion degree of MoS2 flakes with low stacking, appropriate size and dominant double-layer MoS2 stacking. Those improved CO conversion rate and selectivity for higher alcohols. Ren et al. [41] reported a KNiMoS/ZnCrAlS catalyst that showed obvious mesopores and macropores structure through Fig. 2 A and B with uniform periodic 3D ordered macropores with an average diameter of about 200 nm. These pores originated from hierarchical frameworks of KNiMo and ZnCrAl-O(E). Fig. 2C and D show that both support and catalyst have multi-level pore structures which increased their specific surface area while providing transport channels for reactants and products to improve CO conversion rate and selectivity for higher alcohols. Additionally, ZnCr has strong CO activation ability which is conducive to CO adsorption. Weaker metal-support interactions in layered structures can promote dominant double-layer stacked MoS2 flakes to expose more active sites. Additionally, Ren et al. [42] synthesized Mg-modified mesoporous SiO2 supports with tunable morphology and pore size using an improved Stöber method. The results indicated that the mesoporous Mg-modified SiO2 support achieved tunable MoS2 nanosheet structures through a confinement effect, thereby enhancing the dispersion of the NiMoS2 active phase. This enhancement led to improved selectivity and distribution of higher alcohols, with KNiMoS/Mg-MS-20 exhibiting the highest alcohol selectivity of 66.3 % and a C2+OH distribution of 80.5 %. Toyoda and colleagues[43] studied the effect of CeO2, SiO2 and Al2O3 as support on the catalytic performance of sulfide catalysts. In terms of CeO2 as support, the CO2 selectivity was significant decreased, and the higher alcohols selectivity was corresponding increased. This is attributed to CeO2’s ability to store large amounts of O* produced by dissociative adsorption of CO, converting it to Ce2O3 and then reducing it back to CeO2 with H*, thus avoiding the oxidation of CO* by O* to produce CO2. Carbons are used as excellent support for MoS2-based catalysts for catalyzing syngas production of higher alcohols. Wang et al. [44] reported an efficient Ni-Mo-K doped carbon nanotube sulfide catalyst. The authors believe that carbon nanotubes can adsorb and activate H2, creating a surface microenvironment with high concentrations of H adsorbates on the catalyst surface. This results in a sharp increase in the percentage of Mo4+/Mo5+ species on the catalyst surface relative to total Mo. In addition, active H species adsorbed on carbon nanotubes can easily be transferred to Ni-Mo-K active sites via hydrogen spillover assisted by carbon nanotubes. Osman et al. [19] studied CoMoS supported on powdered carbon materials (DAC and OBC-1) and carbon fiber materials (woven activated adsorption (TCA) and non-woven activated material (AHM)). The performance of powdered activated carbon catalysts confirmed a correlation between porosity and catalytic activity, with microporous Cat-DAC with smaller mesopores performing better than Cat-OBC-1 with higher mesopores. Cat-AHM has short and thin layers that increase the angle, substrate and side surfaces of the catalyst, forming active MoS2 microcrystals that improve catalytic performance. The lowest catalytic activity of Cat-TCA is due to long linear plate structures formed on the axial strip surfaces of commercial TCA activated carbon that limit exposure of active sites. Comparing the effect of metal oxide and carbon support on catalytic performance, the latter have significant advantages in the preparation of higher alcohols from syngas. Li et al. [45] prepared K-MoS2 catalysts using activated carbon and Al2O3 as support. Compared with Al2O3 support catalysts, the former have higher catalytic performance, which may be related to the interaction between the active phase and the support. Surisetty et al. [29] also compared the performance of Al2O3 and activated carbon support catalysts. Those selectivity and space-time yield were significantly higher than those of alumina support catalysts. Dorokhov et al. [23] found that compared to the pure Al2O3 support, the adding C to Al2O3 promoted ethanol synthesis and increased CO conversion rate. Osman et al. [46] synthesized K-Co-MoS2 catalysts using four supports: γ-Al2O3, carbon-coated γ-Al2O3 (CCA), activated carbon AG-3, and activated carbon BAW. Compared with pure γ-Al2O3 support catalysts, carbon-coated γ-Al2O3 support catalysts showed higher selectivity for alcohol, but activated carbon-loaded catalysts showed optimal catalytic performance, especially at higher temperatures where the CO conversion rate of activated carbon-loaded catalysts was higher than that of γ-Al2O3-based catalysts. The catalytic activity increased in the order of Al2O3 < CCA < AG-3 < BAW; it was inversely proportional to the logarithm of the number of acid sites on the catalyst; an increase in acidity would lead to a decrease in alcohol selectivity. Activated carbon support catalyst provided highest ethanol yield at highest CO conversion rate; this seems due to increased accumulation of KCoMoS2 as well as presence of micropores and a small amount of mesopores in the support. Claure et al. [47] reported a K-MoS2 catalyst supported on a mixed support of mesoporous activated carbon (C) and MgAl oxide, referred to as MMOC. The catalyst showed high selectivity for higher alcohols when using MMOC as the support. This is mainly due to the strong Mo-MMO interaction in the double layer of MoK/MMO and MoK/MMOC, which restricts the growth of MoS2 stacking layers. The authors found that during the reaction process, Mo species migrate from mesoporous carbon supports to MgAl oxide support, indicating that the interaction between C support and MoS2 is weak while that between MgAl oxide and MoS2 is strong. 2.1.4 Preparation methods of MoS2 catalysts The classical methods for preparing MoS2 include co-precipitation, thermal decomposition and hydrothermal methods. However, these methods usually result in severe stacking of synthesized MoS2 with low catalytic performance. In recent years, various methods have been developed to adjust the morphology, size and specific surface area of MoS2-based catalysts. Based on the edge model of molybdenum sulfide, researchers hope to obtain a smaller number of stacked layers and more edge defects in MoS2-based catalysts by improving synthesis methods so as to expose more active sites and improve catalytic performance. Qin et al. [48] synthesized KCoMoS2 catalysts with different structures using hydrothermal, co-precipitation and reverse microemulsion method, which the particle diameters and the specific surface areas of the catalysts were 33.39 nm&11.00 m2/g, 18.24 nm & 32.7 m2/g and 14.7 nm & 37.26 m2/g, respectively. The catalyst synthesized by reverse microemulsion method had the smallest size, the largest specific surface area. and fewer layers with smaller lateral dimensions than those prepared by other two methods which contained more stacked MoS2 layers. This method had the best selectivity for higher alcohols due to its shorter and thinner MoS2 layer structure which exposed more active sites. Konarova et al. [49] studied NiMoS2 catalysts prepared by microemulsion and hydrothermal methods, which was applied in the synthesis of alcohols; As shown in TEM images, it showed that highly ordered molybdenum sulfide plates containing up to seven layers were produced in the catalyst prepared by hydrothermal method with a specific surface area of 250 m2/g and an alcohol selectivity of only 15 %. In contrast, disordered sulfide layers were found in the catalyst prepared by microemulsion method with a high specific surface area of up to 300 m2/g, which exposed more active sites resulting in an alcohol selectivity of up to 61 %. However, characterization of used catalyst surfaces using X-ray photoelectron spectroscopy and inductively coupled plasma mass spectrometry elemental analysis detected significant sulfur loss in the microemulsion catalyst while only minor sulfur loss was observed in the hydrothermal catalyst. Paris et al. [50] synthesized K-Ni-MoS2 catalysts using a co-precipitation method in aqueous solution or microemulsion. The new microemulsion co-precipitation catalyst has higher catalytic performance than the traditional aqueous solution co-precipitation catalyst, which is mainly attributed to the enrichment of the promoter on the surface of the catalyst by the microemulsion method, which increases the concentration of the promoter on the surface of the catalyst. At the same time, the crystallinity of the surface of the catalyst prepared by microemulsion method is lower and more conducive to generating more active sites. Li et al. [51] prepared highly uniformly dispersed Ni/K/MoS2 catalysts under non-aqueous conditions using an ultrasound-assisted method. Compared with catalysts prepared by co-precipitation methods, ultrasound-assisted prepared catalysts showed better alcohol yield and lower olefin selectivity due to separated NiSx crystal particles formation related to hydrocarbon formation. Zeng et al. [21] used a wet chemical method to prepare K-MoS2 catalysts by mixing ammonium molybdate and sodium sulfide solutions and adding hydroxylamine hydrochloride under reflux conditions to obtain amorphous MoS2. This method can obtain multi-layered K-MoS2 catalysts with good contact between MoS2-KMoS2 dual sites. It is worth noting that higher alcohol formation deviates from Anderson-Schulz-Flory distribution in catalytic results. 2.1.5 Catalytic mechanisms of MoS2-based catalysts Santos et al. [9] used a combination of in situ infrared spectroscopy and kinetic studies to elucidate the mechanism of CO conversion on K-MoS2 catalysts. On the unpromoted MoS2 surface, non-dissociative adsorption of CO favors the H-assisted adsorption pathway via formyl species CHO, which easily leads to the formation of C and CHx species on sulfide surfaces. The K-promoted catalyst activate CO and partially hydrogenate it into hydrogenated intermediates, i.e., more easily generating RO-K The proximity of K to adsorbed methyl will favor CO insertion and stabilize acyl intermediates, further hydrogenating into C2H5O-K and finally into ethanol. At the same time, the authors conducted co-feed kinetic experiments with syngas and ethanol. In the case of unpromoted MoS2 catalysts, only hydrocarbons such as ethane were produced in the product stream. In the case of K-MoS2 catalysts, adding ethanol to syngas feed promoted the production of higher alcohols, mainly 1-propanol and 1-butanol. The authors stated that higher alcohol formation can occur not only through CO insertion but also through aldol condensation of short-chain alcohols. Dorokhov et al. [23] synthesized a KCoMoS/C/Al2O3 catalyst for the preparation of higher alcohols by CO hydrogenation. Based on experimental data and DFT calculation results, as shown in Fig. 3 , the authors proposed a catalytic reaction mechanism. CO is more easily adsorbed on active sites than H2, which means that after CO adsorption, the next step is to insert CO into the metal-hydrogen bond and then reduce it to form an adsorbed aldehyde. The adsorbed aldehyde is hydrogenated to form an alcohol without breaking the CO bond or forming a CC bond. If the hydrogenation reaction was not occurred, the CO bond was broken. Alkyl intermediates may participate in the formation of hydrocarbons or chain growth. The hydrolysis of CO intermediates proceeds through a transition state affected by steric hindrance and nucleophilic hydrolysis induced by high polarity of CO bonds. Methane and ethane dominate in syngas conversion products. K suppresses nucleophilic hydrolysis of CO bonds by reducing Lewis acidity, i.e., stabilizing alkoxide intermediates; selectivity for alcohol formation is determined by hydrolysis of CO bonds in aldehyde intermediates. Xi et al. [31] prepared K-Co-MoSx catalysts with different Co contents. The authors proposed that the formation of the C9S8 and MoSx phase adjacent to the K promoter enhanced the catalytic performance of K-MoSx. As shown in Fig. 4 , the Co9S8 phase mainly was used as the active phase of hydrocarbons formation. There are a large number of adsorbed CnHx* on the surface of C9S8. The authors hypothesized that such substances were effectively transferred from the Co9S8 phase to CH3CH2CH2O* adsorbed on K-MoSx to produce branched alcohols, completing the addition mechanism of CnHx*. In addition, the authors believed that straight-chain alcohols were formed by transferring CH3CH2CH2* adsorbed on Co9S8 to CO adsorbed on K-MoSx. Chen et al. [52] explored the catalytic mechanism of syngas to ethanol on a Cu4 cluster-modified MoS2(001) surface based on density functional theory. As shown in Fig. 5 , the authors believed that CO was hydrogenated on Cu4/MoS2 to form formyl (CHO). That was hydrolyzed to CH2, which is the most favorable CHx monomer. The formation of CC bonds was achieved by inserting CHO into CH2 to form C2 oxygen-containing compounds CH2CHO and then continuously hydrogenating to produce C2H5OH. Microstructural analysis showed that the Cu4 cluster provided non-dissociated CO and CHO species, while the interface between CH4 and MoS2 promoted the dissociation of CH2O to form CH2 monomers and promoted the formation of CC bonds in ethanol. Ren et al. [39] reported a multi-functional KNiMoS/ZnCrAlS catalyst with a multi-level pore structure and its catalytic mechanism for the synthesis of higher alcohols by CO hydrogenation. As shown in Fig. 6 , CO can be activated on both ZnCrAlS and KNiMoS. CO* adsorbed on ZnCrAlS mainly undergoes one-step hydrogenation to CHxO*, while KNiMoS can also generate CHxO*. CHxO* species can be further hydrogenated to produce methanol or transferred to KNiMoS for chain growth. CO* or CHxO* can be inserted into alkyl intermediates on KNiMoS to obtain chain-growth oxygen-containing intermediates. These oxygen-containing intermediates are further hydrogenated to produce higher alcohols. The dual-site synergy between ZnCrAlS and KNiMoS plays a key role in the generation of higher alcohols. The insertion of CO* or alkoxide species into alkyl species is the rate-determining step in the generation of higher alcohols. 2.2 Mo2C-based catalysts Mo2C is a catalyst that has been extensively studied in recent years due to its unique electronic structure. Similar to MoS2-based catalysts, the product of an unpromoted Mo2C catalyst is mainly hydrocarbons. Alkali promoters can significantly enhance the total alcohol selectivity of Mo2C-based catalysts. Transition metal promoters can enhance the carbon chain growth ability of Mo2C-based catalysts and thus enhance the selectivity for higher alcohols, Table 3 lists the performance of Mo2C-based catalysts in the HAS. 2.2.1 Effect of promoters on Mo2C-based catalysts 2.2.1.1 Effect of alkali promoters on Mo2C-based catalysts Lee et al. [55] used different potassium salts as promoters for Mo2C catalysts. As shown in Table 2 , K2SO4 and KCl only caused a slight increase in olefin selectivity and negligible alcohol yield. When K2CO3, KOH and CH3COOK were added to Mo2C, they promoted high selectivity for alcohols and light olefins. They believed that alkali promoters had an electronic effect by changing the surface electron density to promote the generation of alcohols and a geometric effect by blocking surface sites for reactant adsorption to reduce the conversion rate of CO. Chai et al. [56] and Xiang et al. [57] also agreed with this view that K reduced the hydrogenation activity of β-Mo2C, inhibited the direct hydrogenation of C1 intermediates to CH4 and CH3OH, thereby promoting the selective enhancement of higher alcohols. Xiang et al. also stated that K promoter enhanced the chain growth ability of β-Mo2C. Farkas et al. [58] studied the adsorption of methanol and ethanol on Mo2C surfaces and observed very stable CH3O-K and C2H5O-K species on K-promoted Mo2C surfaces. The stability of these oxygen-containing intermediates may be part of the reason why alkali-promoted carbides have increased alcohol selectivity. The K/Mo molar ratio is very important for Mo2C-based catalysts. An appropriate K/Mo ratio can have a good promoting effect, while an excessively high K/Mo ratio can cause blockage of active sites and reduce the catalytic activity. Chai et al. [56] reported that the optimal K/Mo molar ratio for K2CO3-promoted Mo2C-based catalysts is 0.1. Xiang et al. [57] studied K-promoted Mo2C catalysts and obtained the maximum alcohol yield when the K/Mo molar ratio was 0.2. Chiang et al. [59] studied K- and V-modified β-Mo2C catalysts and found that when the K/Mo molar ratio was 1.28, the K had the optimal promoting effect. Wu et al. [60] reported that when the K/Mo molar ratio was 0.21, an activated carbon-supported catalyst showed optimal selectivity. Kiai et al. [61]. introduced K into Co-Mo by impregnation method with an optimal K/Mo ratio of 0.6; increasing alkali metal loading improved dispersion of active metal Mo. Wang et al. [62]. used KOH as a precursor to promote Rh-Mo2C catalysts with an optimal K/Mo molar ratio of 0.2; they believed that it promoted Rh-Mo2C interface sites effectively improving catalytic performance while also promoting dispersion of transition metal Rh to inhibit further hydrogenation of olefins. Researchers have also reported other types of alkali promoters. Shou et al. studied Rb2CO3-promoted Mo2C/MgO catalysts [63] and Mo2C/α-Al2O3 catalysts [64]. Unpromoted Mo2C is an effective Fischer-Tropsch synthesis catalyst that produces only trace amounts of alcohols. When Rb2CO3 was used as a promoter, the alcohol selectivity of 5 wt.%Mo2C/MgO reached 61 %, and XANES characterization revealed structural changes in the Rb2CO3 promoter during the reaction. Compared to pure Mo2C, Rb-Mo2C greatly reduced the sensitivity of the catalyst to 1 % O2 passivation. Christensen et al. [65] investigated the promotion effect of Li, K and Cs on Mo2C catalysts. Cs2CO3 and K2CO3 were similar in their promotion properties, but K-promoted catalysts had higher activity and selectivity under the same conditions, while Li-promoted catalysts were more prone to produce hydrocarbons. The optimal M/Mo molar ratio was 0.164. Liu et al. [66] reported K, Mg and Ca-modified nanowire Mo2C. The K2CO3, Mg(OH)2·4MgCO3·6H2O and CaCO3 with Mo2C separately using an M/Mo molar ratio of 0.2 were physically mixed to the new catalyst. The order of promotion effect was: K>Mg>Ca. However, the CO conversion was decreased by adding K and Mg to the catalyst. In addition, promoters showed different effects on the ability of carbon chain growth. Potassium mainly enhanced carbon chain growth ability for alcohol products with higher selectivity but had little effect on alkanes. In terms of magnesium and calcium, they mainly improved alkane chain growth ability while inhibiting CH4 formation but increasing C2 H selectivity. 2.2.1.2 Effect of transition metal promoters on Mo2C-based catalysts Transition metal promoters can participate in the construction of the active phase of Mo2C-based catalysts. Xiang et al. [67] reported that Co participated in the generation of the active phase, forming new phases Co3Mo3C and Co2C in the Co-promoted K/β-Mo2C catalyst. The Co species has a strong promoting effect on ability of carbon chain growth, especially enhancing the promotion of methanol to ethanol. The synergy influence between Co and Mo is strong and depends on the Co/Mo molar ratio; when the Co/Mo molar ratio is 1/8–1/6, the promoting effect of Co on the synthesis of higher alcohol is best. Kiai et al. [61] found that K-Mo-C and Co3Mo3C sites involving Co participation exist on the surface of the catalyst. And the authors believe that the latter is also benefit for the alcohol synthesis. In addition, when the Co/Mo molar ratio was 0.6, the alcohol selectivity of the catalyst was highest. It was found that cobalt as promoter was identified as an adsorption site for active species in the molybdenum-cobalt carbide catalyst. Moreover, Arun et al. [68] proposed increasing oxygenate yield does not depend on formation of specific mixed metal/carbide phases but rather due to presence of closely contacted sites between Mo and Co reaction on surface of catalyst. Only when Mo and cobalt carbides are in close contact will it improve performance of catalyst. In addition to Co as the promoter in Mo-based catalysts, Zhao et al. [69] reviewed that the catalytic activity of Ni-promoted Mo2C catalyst was significantly higher than that of unpromoted Mo2C, and Ni content had a significant impact on product distribution. Besides, alcohol yield increased with increasing Ni content and reached a maximum when Ni/Mo molar ratio was 0.5. Xiang and colleagues[70] found that the K/β-Mo2C catalysts modified by F-T element (Ni, Co and Fe) displayed the key role in the product distribution. Ni and Co led to a decrease in the apparent activation energy of C1 C4 alcohols, while Fe led to a slight increase in the apparent activation energy of methanol and a decrease in the apparent activation energy of C2 C4 alcohols. The promoting effect of F-T elements followed the order: Ni > Co > Fe. Hao et al. [71] mentioned that Ni doping could promote the dispersion of Mo2C particles, and inhibit the formation of surface carbon on the catalyst, which increased its active surface area. Additionally, the interaction effect between Ni and Mo increased the electron cloud density of Mo species, promoting non-dissociative adsorption and insertion of CO. It is worth noting that as the Ni content increased, the number of carbon atoms on the surface lattice of the catalyst showed a volcano-type distribution. Aoki et al. [72] reported that in terms of pure Mo2C catalyst, the water-gas shift reaction was more intense, producing large amounts of CO2 while only small amounts were produced on CoMo carbide catalysts. The authors believe that the introducing Co into Mo2C can suppress water-gas shift reaction. A K/β-Mo2C catalyst promoted by iron carbide by Wang et al. [73]., was demonstrated that the introduction of Fe improved the selectivity of higher alcohols and iron carbide mainly promoted chain growth from methanol to ethanol. When the Fe/Mo molar ratio was 1/6, the catalyst achieved optimal alcohol selectivity. Xiang et al. [74]. studied an Fe-promoted β-Mo2C catalyst and found through XPS analysis of the surface elemental composition of the catalyst that both Fe and Mo were enriched on the surface of the catalyst, with surface contents far higher than theoretical contents. the addition of Fe increased the production of alcohols, especially the C2+OH (alcohols with 2 or more carbon atoms). Meanwhile, considerable amounts of C5+ hydrocarbons were formed, whereas methane selectivity greatly decreased. Chiang et al. [59]. reported that in terms of vanadium-modified Mo2C and K-Mo2C catalysts, the catalytic performance of the catalyst was optimal when the V/Mo weight ratio was 0.049. Co-modification of β-Mo2C with V and K showed a synergistic effect between them, especially improving the ethanol selectivity. It is worth noting that in the V-K-Mo2C system, adding H2O to trigger water gas shift reaction can improve C3 and C4 alcohol selectivity while maintaining high ethanol selectivity. Wang et al. [62] reported that from Rh-promoted K-Mo2C catalyst, where Rhδ+ species increased concentration of undissociated CO* intermediates on surface and significantly enhanced coupling ability between CO and alkyl species to form alcohol. 2.2.2 Active phase of Mo2C-based catalysts The active phase is important element of catalyst research. A clear understanding of the active phase helps in the study of catalyst mechanisms and the design of high-performance catalysts. Xiang et al. [67]. proposed that the new phases “Co3Mo2C and Co2C” were formed with the participation of Co promoter in the synthesized a K/Co/β-Mo2C catalyst. There is a strong synergistic effect between Co and Mo, which is key to improving catalytic performance. Kiai et al. [61] thought that K-Mo-C sites and Co3Mo3C phases exist in KCoMo2C catalysis, thereby increasing the selectivity for higher alcohols. Li et al. [75] found that the balance between Co0 and Co6Mo6C was crucial for catalyst performance, where CO dissociative adsorption and carbon chain elongation mainly occurred on Co0 sites, while non-dissociative adsorption of CO and CO insertion mainly occurred on Co6Mo6C phase. Zhao et al. [69] reported a Ni-Mo bimetallic carbide catalyst characterized by XRD to contain Ni metal, β-Mo2C and Ni6Mo6C phases; XPS characterization showed that when the Ni/Mo molar ratio was 0.5, it had the strongest synergistic effect; Ni6Mo6C may be the synthesis site for alcohol. Wang et al. [76] claimed that when Fe promoter was added, in the Mo2C-based catalyst product chain growth ability was enhanced due to “Fe3Mo3C and Fe3C” phases generated by Fe promoting K/β-Mo2C catalyst. Asundi and colleagues[68] reported that by the in situ X-ray absorption spectroscopy, the prepared catalyst is composed of carbide and bimetallic components. And it is found that the active phases are MoC1-x and Co2C. Through in situ infrared characterization, the Mo and Co atoms on the surface of the catalyst were determined to be the adsorption sites for active substances. Liakakoua et al. [77] put forword an effective method to demonstrate the formation of NiMo carbides. The authors hypothesized that NiMo carbides are active centers for non-dissociative adsorption of CO, which combines with dissociative adsorption of CO on Mo2C sites to result in the formation of higher alcohols. A stability test over 400 h showed significant deactivation of the catalyst with a decrease in activity by about 48 %. The decrease in catalyst performance was due to separation of NiMo carbide phase, formation of hydrated nickel oxide and K2Mo2O7 phase. Wang et al. [73] suggested that iron carbide and K/β-Mo2C may have a synergistic effect, forming a “K-Fe-Mo-C” species favorable for alcohol synthesis. Xiang et al. [74] found through XPS analysis at working temperature that both Mo and Fe were enriched on the surface of the Fe-modified K/Mo2C catalysts. Intermediate valence states such as Mo4+ may be responsible for alcohol generation while low valence states such as Mo0 and Mo2+ may be responsible for high activity and selectivity towards hydrocarbons. 2.2.3 Effect of supports on Mo2C-based catalysts Supports are also important for the catalytic performance of Mo2C. Usually, there are two types of support: oxide supports and carbon supports. Shou et al. [63] reported on a Rb-Mo2C catalyst with MgO as the support. The study showed that Mo2C was highly dispersed on magnesium oxide with an average particle diameter of only 2–3 nm, and enhanced the dispersibility of Mo2C. X-ray absorption spectroscopy characterization found that passivated Mo2C/MgO was more easily oxidized than Mo2C and after 4 h under reaction conditions, the passivated part was partially reduced and there was an oxidized state of Mo during the catalytic reaction. Wu et al. [60] designed some effective supported K/Mo2C catalysts using activated carbon, carbon nanotubes and titanium dioxide as support. Compared to bulk Mo2C, supported Mo2C had significantly higher activity and selectivity for total alcohols. Among them, the conversion rate of CO reached a maximum value when 20 wt%Mo2C was loaded on activated carbon. As the loading amount of Mo2C on activated carbon increased, the selectivity for higher alcohols increased and reached a maximum value on bulk catalysts while the selectivity for methanol followed an opposite trend. The titanium dioxide support catalyst had better higher alcohols selectivity but its thermal stability limited its use as a support for Mo2C due to its high carburizing temperature (750 °C). The effect of carbon nanotube support was between activated carbon and titanium dioxide, but due to the high cost, the latter were less attractive than activated carbon. Chai et al. [56]. reported in situ synthesis of β-Mo2C nanoparticles using graphite mesoporous carbon (GMC), commercial activated carbon, and carbon black as supports. By comparing the catalytic performance of carbon-supported Mo2C with bulk Mo2C it was shown that CO conversion rate increased with decreasing size of Mo2C particles regardless of support. Compared to activated carbon and carbon black GMC showed a significant improvement in catalytic activity due to its ability to form smaller Mo2C particles Meng et al. [16] synthesized a porous nano-catalyst, Ni/K/Mo2C@LC, using a carbon support derived from bamboo lignin. The authors suggested that the open mesoporous lignin carbon provided larger metal particles, which enhanced the hydrogenation capability. This configuration better balanced the no-dissociative and dissociative adsorption sites for CO during the higher alcohol synthesis reaction, thereby improving the catalytic performance. Under optimal reaction conditions, the catalyst achieved a space-time yield as high as 0.455 g/gcat/h. 2.2.4 Preparation methods of Mo2C-based catalysts Molybdenum carbide catalysts are generally prepared using the classical temperature-programmed reduction method. Depending on the carbon source used, it can be divided into gas-phase carbon source carburization and solid-phase carbon source carburization. The gas-phase carbon source is a mixture of a carbon-containing gas and hydrogen, such as CH4/H2 and C2H2/H2. The solid-phase carbon source is generally a carbon-containing organic compound such as glucose or hexamethylenetetramine, and the commonly used molybdenum source is ammonium heptamolybdate. Marquart et al. [78] reported the effect of synthesis methods on the surface properties of molybdenum carbide. Generally speaking, the final carburizing temperature is between 630 and 1000 °C, with a heating rate of 1–10 °C/min and held at the final carburizing temperature for 2–5 h. When the final carburizing temperature exceeds 760 °C, graphitic deposited carbon may occur on the catalyst. After carburizing is completed and cooled to room temperature, it can be passivated with 1 % O2/N2 for 1–12 h to obtain β-Mo2C. From the results of In-situ XRD, it confirmed that MoO3 undergoes phase transition to β-Mo2C at 650 °C. If fresh β-Mo2C is not passivated, it will partially oxidize to MoO2 after exposure to air. However, even after passivation Raman spectra of MoO3 can still be observed after β-Mo2C is exposed to air. Passivated β-Mo2C and in-situ β-Mo2C have similar CO conversion rates but passivated β-Mo2C shows higher oxygenate and total organic product yields which are attributed to the influence of MoO3 on the catalyst surface. Zhao et al. [69] prepared NiMo bimetallic carbide catalysts using the sol-gel method. Ethylene glycol and citric acid were used to complex nickel nitrate and ammonium heptamolybdate, and then a dry gel was obtained. The gel was calcined at 973 K for 5 h under the Ar flow and gradually passivated under a 2.0 vol% O2/Ar atmosphere. After the decomposition of the organic gel, a loose porous structure can be constructed inside the catalyst, as shown in Fig. 7 . The catalyst prepared by the sol-gel method has a large specific surface area, small and uniform molybdenum carbide nanoparticles with a particle size of 3–4 nm, which is conducive to exposing more active sites and improving catalytic performance. Liu et al. [79] reported a one-pot hydrothermal co-hydrolysis-carbonization method using C6H12O6 and ammonium heptamolybdate as starting materials to prepare carbonaceous spheres embedded with highly dispersed Mo2C nanoparticles. The catalyst prepared by this method has a large specific surface area and rich mesoporous structure due to the influence of MoO3 and d-C6H12O6 molecules on the structure of the catalyst during hydrothermal treatment. The authors also investigated the effect of different carburizing atmospheres on the catalysts. Under an Ar atmosphere, carbonized samples seemed to only have surface carbonization, while samples carbonized under H2 atmosphere had uniform carbonization on both surface and interior. Li et al. [75] reported a CoMo bimetallic carbide with MOF-assisted strategy. As shown in Fig. 8 , this method is based on the confinement effect of ZIF-67 and in-situ carbonization, allowing Co and Mo to be in close contact. After pyrolysis under N2 atmosphere, metal particles are simultaneously embedded in N-doped C matrixes. This method enables close contact between Co and Mo, enhancing their synergistic effect between Co and Mo effectively improving selectivity for higher alcohols. At the same time thanks to confinement protection from N-doped C scaffold, the catalyst showed excellent stability; no deactivation was observed during 100 h long-term stability test. He et al. [80] employed a hard template method to prepare a series of Mo2C catalysts with a hierarchical porous structure. Compared to bulk catalysts, the CO conversion rate increased from 5.1 % to 17.6 %, while the distribution of higher alcohols improved from 60.4 % to 70.5 %. The authors attributed the enhanced catalytic performance to the increased number of active sites and the synergistic effects between the multivalent Mo species. 2.2.5 Catalytic mechanisms of Mo2C-based catalysts The reaction of Mo2C based catalysts catalyzing the conversion of CO to higher alcohols is also very complex, including some elementary reactions. But the important steps are still the dissociation and adsorption of CO to generate CHx, the generation of CC bonds, and the insertion of CO. Zhang et al. [81] used density functional theory to study the mechanism of synthesis gas conversion to C2+ oxygen-containing compounds on the Cu/β-Mo2C catalyst interface. The calculation results are shown in Fig. 9 A, B, and CO first dissociatively adsorbs at the catalyst interface on the Cu/β-Mo2C (001) surface to form C*, which is then hydrogenated to form CH* and then CHx species. Compared with the formation of CH3OH, Cu/β-Mo2C (001) showed better selectivity for CH formation. For the formation of C2 oxygen-containing compounds, CHO insertion into CH to form CHCHO is the optimal pathway. As shown in Fig. 9-D, electronic and structural property analysis (blue and yellow shaded areas represent charge loss and gain respectively) indicates that strong charge transfer occurs between Cu and Mo2C forming a synergistic effect with a rich charge area formed at the interface between Cu and Mo2C where CH formation and CHO insertion occur followed by the generation of CHCHO. Dang et al. [82] systematically studied the mechanism of synthesis gas conversion to C2 oxygen-containing compounds on the Mo2C (001) surface using density functional theory calculations. The Mo-Mo bridge site on the Mo2C surface is the active center for CO hydrogenation. Due to the high energy barrier of CO, direct dissociation of CO on the Mo2C (001) surface is difficult, while H-assisted CO dissociation easily occurs. The reaction pathway is shown in Fig. 10 . CO and H2 transition from gas phase to adsorbed state with H2 undergoing dissociative adsorption to produce H*. Non-dissociatively adsorbed CO* generates CHO* under the action of H*, some CHO* undergoes CO bond cleavage and deoxygenation to form CH3* species while other CHO* inserts into CH3* species forming CH3CHO species which eventually hydrogenates to form CH3CH2OH with K promoter enhancing the activity of CH3 and CHO coupling. CHO* species can also undergo deep hydrogenation to produce CH3OH. 2.3 Other Mo-based catalysts In recent years, as the Mo-based catalysts have been intensively studied, MoOx, MoP, Mo2N and MoSe2 catalysts have also accumulated some literature reports, Table 4 lists the performance of other Mo-based catalysts in the HAS. 2.3.1 Effect of promoters on other Mo-based catalysts 2.3.1.1 Effect of alkali promoters on other Mo-based catalysts Aslam et al. [85] reported the synthesis of CoMo bimetallic carbon spheres through glucose-mediated in situ hydrothermal reduction. The authors introduced K promoter in three ways: in situ hydrothermal growth, wet impregnation and alkali (KOH) surface reaction. The first two methods used KNO3 as the K precursor with a K/Mo molar ratio of 0.14 while the alkali surface reaction method used KOH as the K precursor. In situ doping of K by hydrothermal method did not reduce the surface area and pore volume of the catalyst while impregnation and alkali surface reaction methods significantly decreased the catalyst surface area and pore volume. The selectivity for higher alcohols increased from 16 % to 28 % using hydrothermal reduction method which was attributed to close contact between K and MoCo metal nanoparticles due to in situ doping of K and increased concentration of MoO2. Catalyst prepared by impregnation of K showed poor selectivity for higher alcohols. Results indicate that only when present in appropriate proportions and close to active metals can K enhance alcohol selectivity. Zaman et al. [86]. reported on the study of CO hydrogenation performance of MoP-SiO2 catalyst. On the un-promoted MoP catalyst, the selectivity of CH4 was as high as 40 %. The introduction of K significantly inhibited the selectivity of CH4. The selectivity of C2+ oxides increased with the increase of K/Mo molar ratio and reached a maximum value of 76.6 % when the K/Mo molar ratio was 3.2. In addition to ethanol-containing oxygen compounds, there were also acetaldehyde and acetone. Zaman et al. [87] analyzed that K-promoted MoP-SiO2 did not have enough hydrogenation ability to reduce acetaldehyde and acetone to ethanol and isopropanol. Xu et al. [88] believed that K could enhance the alkalinity of CoMoP catalysts, enhance the interaction between MoP and CoMoP, promote the rearrangement of electron density in Mo species, form a large number of Mo4+ species, leading to an increase in C2+ oxygen-containing compound selectivity. However, a higher alkali content would also reduce the surface area of the catalyst and block active sites. The authors believed that an appropriate K/Mo molar ratio was 1.0. Ten Have et al. [89] used KNO3 as a precursor for K and believed that K could promote the formation of MoP phases while acting as an alkaline site in catalysts and stabilizing formyl intermediates during catalysis. Valle et al. [90] through in-situ XRD analysis, believed that under working conditions, the presence of potassium pyrophosphate might be responsible for significant differences in performance between promoted and un-promoted samples but how potassium pyrophosphate specifically participates in reactions remains to be determined. Zaman et al. [91] also investigated the promotion of K on Mo2N catalysts. Unpromoted Mo2N has higher hydrocarbon selectivity, while K-promoted Mo2N enhances the selectivity of oxygen-containing compounds. The introduction of K leads to the formation of K-Mo+ species, thereby improving CO insertion. At higher K loadings, the formation of K2MoO4 reduces the distribution of K in Mo2N, thereby weakening CO insertion. Zaman [92] also compared the promotion of Li and Cs on Mo2N for CO hydrogenation. The introduction of Li into Mo2N mainly generated Li2MoO4 and δ-MoN phases. This catalyst showed higher selectivity for olefins and non-alcoholic liquid oxygen-containing compounds. On Cs-Mo-N, methanol and ethanol were mainly produced, which was attributed to Cs being more easily transferred electrons to Mo than Li, thereby stabilizing Moδ+ sites and promoting CO insertion into CxHy to produce alcohols. Qu et al. [93] reported a new type of MoSe2-based catalyst in which the K promoter promoted the formation of a K-Mo-Se active phase. When the K/Mo molar ratio was 1.0, the total alcohol selectivity on K-MoSe2 reached 58.7 %. With increasing amounts of K promoter, the contents of Mo4+ and Mo5+ gradually decreased while that of Mo6+ species gradually increased. The authors believe that the introduction of K is conducive to the formation of Mo6+ species which are active sites for dissociative adsorption of CO and can promote alcohol chain growth. However, this interpretation differs significantly from other explanations regarding different valence states in other Mo-based catalysts. 2.3.1.2 Effect of transition metal promoters on other Mo-based catalysts Wu et al. [94]. added a small amount of Co-modified multi-walled carbon nanotubes to the Co-Mo-K oxide-based catalyst, which promoted the increase in the concentration of catalytically active species Mo+4 and CoO/Co3O4 on the catalyst surface, thereby enhancing the selectivity of higher alcohols. Xu et al. [88] reported that the Co transformed the phosphide from MoP to CoMoP phase, improving the dispersion of active components and exposing more active sites. Zaman et al. [95] reported a Rh-promoted K-MoP/SiO2 catalyst. Rh enhanced the selectivity of the catalyst for hydrocarbons, especially methane, while only slightly increasing its selectivity for ethanol, indicating that oxygen-containing compounds were produced on the K-MoP surface. Xie and et al. [96] studied Mn-doped K-Co-Mo catalysts. Mn doping significantly enhanced the selectivity of higher alcohols in these catalysts. The distribution of alcohol products deviated from ASF law and methanol selectivity was significantly suppressed. This was mainly attributed to Mn enhancing interactions between Co and Mo promoting formation of a Co-Mo-O active phase. At same time introduction of Mn significantly reduced number strong acid sites promoting formation weak acid sites. Addition Mn enhanced adsorption linear bridge CO which facilitated carbon chain growth formation higher alcohols. These effects all contributed to enhanced selectivity higher alcohols in these catalysts. Zhang et al. [97] prepared MoO3/SiO2 catalysts promoted by transition metals (Ni, Co, Cu and Ru) using atomic layer deposition. The addition of transition metals to MoO3 increased the activity of the catalyst by an order of magnitude. H2-D2 exchange rate measurements showed that the introduction of transition metal promoters increased the efficiency of H2 dissociation and H could spill over from the transition metal to Mo species. Chemical adsorption measurements of CO showed that the transition metal promoted catalysts had similar numbers of strong and weak adsorption sites. The authors believe that strong adsorption sites come from transition metals and weak adsorption sites may come from molybdenum oxide. Have et al. [89] studied K-MoP/SiO2 catalysts promoted by transition metals Co, Ni and Pd. After introducing Co and Ni, the conversion rate of the catalyst decreased from 2 % to 0.2 % and 0.02 %, respectively. Co and Ni seemed to act as poisons rather than promoters, which is very different from other molybdenum-based catalysts studies. The Pd promoter increased the conversion rate of CO but produced alcohols with shorter C chain lengths. 2.3.2 Active phases of other Mo-based catalysts Bian et al. [98] prepared MoO3-based catalysts with Al2O3 as the support. As the Mo loading increased, the catalysts formed the same K-Mo-O species, but the dispersion of K-Mo species decreased. The authors believed that the dispersion state of Mo species and the content of reduced Mo species affected CO total conversion rate, and the acidity of catalysts controlled mixed alcohol selectivity. Aslam et al. [85] reported a bimetallic MoCo oxide carbon sphere produced by glucose-mediated in situ hydrothermal reduction. The authors believed that the active site of this catalyst was very close MoO2 and Co sites on spatial positions within carbon scaffold. Kang et al. [99] and Valle et al. [90] indicated that active phase of MoP-based catalysts was MoP phase. Zaman et al. [92] investigated Li and Cs-promoted Mo2N-based catalysts. Unpromoted catalyst showed mainly γ-Mo2N phase. While Li-promoted molybdenum nitride catalyst showed δ-MoN phase, a small amount of γ-Mo2N phase and Li2MoO4, authors attributed enhanced oxygenate selectivity of this catalyst to formation of Li2MoO4 phase. And Cs-promoted molybdenum nitride mainly produced γ-Mo2N phase, with increasing Cs loading δ-MoN phase would appear. Compared with Li-promoted molybdenum nitride, Cs-Mo2N had higher oxygenate selectivity. Qu et al. [93] reported a novel MoSe2-based catalyst, authors attributed high selectivity for ethanol to formation of K-Mo-Se active phase, as well as synergistic effect of multivalent states (Mo4+, Mo5+ and Mo6+) in active phase. 2.3.3 Effect of supports on other Mo-based catalysts Bian et al. [98] synthesized K-MoO3 catalysts using Al2O3 as a support. As the Mo loading increased, K-Mo-O species were formed, but the dispersion of these K-Mo species decreased. The acidity of the catalyst decreased significantly with increasing Mo loading, and the activity of ethanol dehydration changed in parallel with acidity. The dispersion state of Mo species and the content of unreduced Mo species affected the total conversion rate of CO, while the acidity of the catalyst controlled the selectivity to mixed alcohols. Zhang et al. [100] synthesized K-promoted catalysts derived from Ni-Mo silicates by ammonia steaming method. The layered structure of silicate provided strong metal-support interaction, improved Mo metal dispersion and showed adjustable surface acid-base properties. In addition, silicate nanotubes can provide confinement effect through nanoscale channels to improve catalyst stability. Ma et al. [101] developed a Ni-Mo-K catalyst doped with CNTs modified by metal Ni. Although CNTs were doped into the catalyst as a promoter, they can also explain some support-like problems. The surface of CNTs has sp2 hybridization of C. After Ni modification, it has good adsorption for H2 and can produce a high-concentration adsorbed H surface microenvironment on the surface of the catalyst. The high-concentration adsorbed H in this microenvironment can also inhibit the water-gas shift reaction. At the same time, it can also increase the proportion of two catalytically active species: NiO(OH) and Mo4+/Mo5+. Lv et al. [102] prepared an activated carbon-supported K-Co-Mo catalyst by sol-gel method. Compared with unsupported catalysts, activated carbon-supported K-Co-Mo has better selectivity for higher alcohols. This is mainly because activated carbon-supported catalysts have larger active surface area and porosity, which is conducive to dispersion of active sites and reduction of metal particle size. The hollow structure can increase the residence time of intermediate products on the catalyst. Liakakou et al. [103] also studied the effect of activated carbon support on catalyst performance. Activated carbon-supported catalysts led to a 3-fold increase in selectivity for higher alcohols, which may be due to reduced crystallinity of NiMoO4 phase and partial phase transformation. After pretreatment with HNO3 on activated carbon support, CO conversion rate increased significantly, which was related to reduction in ash content and high acidity after acid treatment of samples. The authors attributed the improvement in activity to better dispersion of active phases on activated carbon support and more complete exposure of active site Ni-O-Mo sites. Luk et al. [104] synthesized CoMo/CNF catalysts using carbon nanofibers (CNF) as the support. Compared with traditional oxide and amorphous carbon supports, carbon nanofibers have lower specific surface area but higher selectivity and stability for higher alcohols. This may be due to excellent electronic effects and improved metal dispersion by preparing catalysts using citric acid-sol method. Have et al. [89] synthesized MoP-based catalysts using amorphous silica, mesoporous silica and mesoporous carbon as supports. The results showed that the catalytic effect of amorphous silica was extremely poor, while mesoporous silica improved catalytic performance and stabilized nano-sized MoP particles with controllable size distribution and confinement effect. However, mesoporous carbon-supported catalysts had the best CO conversion rate and selectivity. Valle et al. [90] also studied the effect of mesoporous silica and mesoporous carbon supports on MoP catalysts. MoP catalysts on mesoporous carbon were more easily reduced and achieved better crystalline MoP phase at lower temperatures. There was strong MoP-support interaction on the mesoporous carbon support which promoted reduction of the catalyst and improved catalytic activity and selectivity for higher alcohols. It can be seen that mesoporous carbon support plays a good role in synthesizing higher alcohol catalysts from syngas. 2.3.4 Preparation methods of other Mo-based catalysts Tavasoli et al. [105] synthesized MoO3-K2O/CNTs catalysts using microemulsion technology. At higher metal loading levels, a very narrow metal particle size distribution was produced. The MoO3 particle size decreased from an average of 7.1 nm to 4.5 nm, exposing more active centers and significantly improving catalyst performance. Luk et al. [104] compared KCoMo catalysts prepared by dry impregnation, sol-gel method and ball milling method. Due to the complexation of citric acid, the sol-gel method with citric acid can improve metal dispersion, expose more active sites and increase the yield of higher alcohols. Aslam et al. [85] reported a bimetallic MoCo carbon sphere produced by glucose-mediated in situ hydrothermal reduction. In this method, glucose can derive a carbon scaffold with MoO2 and Co active sites very close inside the carbon scaffold which is conducive to CO hydrogenation synthesis of higher alcohols. Zhang et al. [100] synthesized NiMo silicate precursor by steaming ammonia method and then calcined at high temperature to synthesize K-(NiMo)Si-PS catalyst. The preparation of NiMo silicate precursor by this method provides a basis for metal-support interaction. The surface of the catalyst has suitable acidic and basic sites and the silicate nanotubes produced also have a confinement effect on metal particles. The selectivity for higher alcohols of the catalyst prepared by this method reached 43.8 % and stability test reached 200 h which was significantly better than deposition and wet impregnation methods. Li et al. [106] used radio frequency induction thermal plasma method, hydrothermal method and programmed temperature reduction method to synthesize MoO2 catalysts respectively. As shown in Fig. 11 , radio frequency induction thermal plasma synthesis produced a new type of core-shell structure catalyst (MoO2-Pla) with crystalline core MoO2 and chain mail-like amorphous MoOx shell. Compared with MoO2 catalysts synthesized by hydrothermal method and programmed temperature reduction method, the ultra-stable chain mail-like particles formed on the surface during ultra-high temperature and rapid quenching process had better selectivity for higher alcohols while having extremely strong stability still having high catalytic activity after testing for 300 h under laboratory conditions. Xu et al. [88] synthesized carbon-modified KCoMoP catalysts using sol-gel method. The catalysts prepared by this method had small metal particle size and uniform distribution and had higher selectivity for higher alcohols. Kang et al. [99] prepared MoP@C catalysts by precursor pyrolysis method and programmed temperature reduction method respectively. Precursor pyrolysis method was to prepare carbon-coated MoP by pyrolyzing phosphorus-containing dimolybdenum carbonyl clusters. The particle size of the catalyst prepared by programmed temperature reduction method was about 40 nm while the metal particle size of the precursor pyrolysis method was only 2–5 nm which greatly improved the dispersion of the catalyst and exposed more active sites. Carbon in precursor pyrolysis method can act as a structural promoter and the catalyst showed good anti-sintering performance. After catalytic testing for 180 h, its catalytic activity and selectivity remained basically unchanged. Qu et al. [93] reported a MoSe2 catalyst for selective conversion of syngas to ethanol. MoSe2 was prepared by reducing ammonium molybdate and selenium powder with sodium borohydride as reducing agent through hydrothermal method. The K-Mo-Se catalyst prepared by this method had high selectivity for ethanol which was attributed to the synergistic effect of multiple Mo species such as Mo+4, Mo+5 and Mo+6 in active phase and the authors believed that low-valent Mo+4, Mo+5 and high-valent Mo6+ were dual active sites promoting formation of higher alcohols. 2.4.5 Catalytic mechanisms of other Mo-based catalysts Muramatsu et al. [Anon., 107] prepared a series of MoO2/SiO2 catalysts. The authors believed that the formation of alcohols required two Mo species: metal Mo and MoO2. CO dissociated on Mo to form surface carbides which were then hydrogenated to form hydrocarbon intermediates while CO insertion occurred on MoO2 where CO was inserted into hydrocarbon intermediates and further hydrogenated to produce higher alcohols. Schaidle et al. [108] synthesized a series of Mo-based carbides and Mo-based nitrides catalysts. The authors found that the TOF of Mo2C catalyst was an order of magnitude higher than that of Mo2N catalyst which was attributed to the fact that the activation energy barrier for CO dissociation on Mo2C was significantly lower than that for activating CO on Mo2N. The authors also stated that both Mo2C and Mo2N could directly dissociate CO but only the Mo2N catalyst seemed to follow the carbide mechanism. On the surface of Mo2C without pre-adsorbed H2, CC coupling on the surface of Mo2C promoted by molecularly adsorbed CO indicated that the main pathway for higher hydrocarbons was through oxygenate mechanism. Zaman et al. [91] synthesized Mo2N and K-Mo2N catalysts and studied their performance in CO hydrogenation. As shown in Fig. 12 , the authors believed that hydrocarbon intermediates were mainly formed on non-K-promoted active sites such as Mo3+ and K-promoted active sites such as Mo3+ could undergo non-dissociative adsorption of CO where non-dissociatively adsorbed CO could be continuously hydrogenated to produce methanol while at this active site, molecularly adsorbed CO could be inserted into CHx* where obtained intermediate was further hydrogenated to produce oxygenates. 3 Conclusion and future perspectives The HAS can address the energy crisis and greenhouse effect, offering significant economic and environmental benefits. There are mainly four types of catalysts for this process, with Mo-based catalysts receiving considerable attention due to their adjustable valence states, sulfur tolerance, and resistance to carbon deposition. However, developing Mo-based catalysts with high activity, selectivity, and stability remains a significant challenge. This small review summarizes literature on various types of molybdenum-based catalysts for preparing higher alcohols from syngas with the aim of providing assistance in designing and preparing Mo-based catalysts. We divide Mo-based catalysts into MoS2, Mo2C and other Mo-based catalysts (MoOx, MoP, Mo2N and MoSe2) summarize the effects of various types of promoters (alkaline promoters and transition metal promoters) active phases support effects preparation method effects catalytic mechanisms. (1) Promoters are crucial for Mo-based catalysts to catalyze the preparation of higher alcohols from syngas and seem to play similar roles for different Mo-based catalysts. Alkali promoters have multiple effects on catalysts such as promoting dispersion of Mo affecting electron density of Mo metal thereby enhancing CO insertion ability stabilizing oxygen-containing intermediates etc. thereby improving selectivity for alcohols. Transition metal promoters mainly enhance the dissociative adsorption ability of CO increase the concentration of hydrocarbon species on the surface of the catalyst thereby improving the carbon chain extension ability of the product. Many authors have stated that transition metals and Mo metals need to be spatially close enough to have good promotion effect. (2) Active phase is key to catalyst design and different types of Mo-based catalysts have different active phases due to different valence states of Mo metal. The active phase of MoS2-based catalysts is mainly (K)-transition metal-Mo-S phase where transition metals may exist in the form of transition metal sulfides or NiMo3Sx active phase forming solid solution structure. In addition to (K)-transition metal-Mo-C phase molybdenum carbide-based catalysts also have various solid solution active phases such as Co3Mo3C, Co6Mo6C, Fe3Mo3C and Ni6Mo6C etc. The active phase of MoOx-based catalysts has K-Mo-O species and also has very close spatial positions between MoO2 and Co sites while the active phase of MoP-based catalyst is just MoP and K-Mo-Se phase is formed in MoSe2 catalyst. (3) Support plays a very important role in preparing higher alcohols from syngas. Acidic sites can increase CO conversion rate but also promote dehydration of alcohols thereby reducing selectivity for alcohols while basic sites have opposite effects so balancing acidity and basicity of catalysts to increase yield of higher alcohols is an important issue. Larger specific surface area can expose more active sites while suitable pore structure can improve entry of feed gas and removal of products but single pore structure may not meet requirements so multi-level pore structure may be a better choice. In addition, interaction strength between support and active metals also needs to be considered as metal-support interaction can affect surface coordination of metals thereby affecting activity selectivity and stability of catalysts. It is worth noting that compared with oxide supports carbon supports have unique advantages in preparing higher alcohols from syngas. (4) The preparation method of catalysts is the focus of catalyst research. Suitable preparation methods form a good catalytically active phase, smaller metal particles with more exposed active sites and suitable pore structure. Compared to traditional methods such as thermal decomposition and hydrothermal methods, microemulsion method, sol-gel method, radio frequency induction plasma method and atomic layer deposition method are all good catalyst synthesis methods. Ultrasonic-assisted and MOF-assisted strategies also greatly improve the performance of catalysts. (5) The catalytic mechanism is the core of catalytic reaction research. Mo-based catalysts for the synthesis of higher alcohols from syngas require both CO dissociation and CO insertion steps, making the reaction process extremely complex. The currently accepted mechanism is the CO hydrogen-assisted dissociation pathway: first, adsorbed CO forms an alkoxide intermediate CHO under the action of H; some CHO undergoes CO bond cleavage to form alkyl species while others insert into adsorbed alkyl species to form carbon chain growth alkoxide intermediates which eventually hydrogenate to form higher alcohols. In addition, some authors suggest that short-chain alcohols undergo aldol condensation to form higher alcohols. The process of HAS is complex and existing characterization techniques are limited. The structure and reaction mechanism of Mo-based catalyst active centers are still unclear. Designing and developing highly active, selective, stable and economical catalysts remains a major issue for industrialization of syngas-to-higher-alcohol production. Future research should focus on improving and enriching characterization techniques and preparation methods to clarify the catalytically active phase and provide reliable evidence for clarifying the catalytic mechanism and designing catalysts in order to achieve controllable construction of active centers at an atomic level and lay a solid theoretical foundation for industrialization of syngas-to-higher-alcohol production. CRediT authorship contribution statement Ren Yangbin: Writing – review & editing, Writing – original draft, Software, Project administration, Methodology, Investigation, Formal analysis, Conceptualization. Weng Yujing: Funding acquisition, Formal analysis, Conceptualization. Zhang Yiqing: Investigation, Formal analysis. Huang Chao: Writing – review & editing, Funding acquisition, Formal analysis, Conceptualization. Zhang Yulong: Writing – review & editing, Supervision, Resources, Project administration, Funding acquisition, Formal analysis, Conceptualization. Sun Qi: Supervision, Resources, Project administration, Methodology, Conceptualization. Declaration of competing interest The authors declare that they have no known competing financial interests or personal relationships that could have appeared to influence the work reported in this paper. Acknowledgments This work was supported by grants from National Natural Science Foundation of China Youth Fund (22208085), Henan Province Natural Science Foundation (GZS2020012), Key Scientific Research Projects of Colleges and Universities in Henan Province (24B530003); the Fundamental Research Funds for the Universities of Henan Province (NSFRF240504). References [1] J.P. Dorian H.T. Franssen D.R. Simbeck Global challenges in energy Energy Policy 34 2006 1984 1991 10.1016/j.enpol.2005.03.010 J.P. Dorian, H.T. Franssen, D.R. Simbeck, Global challenges in energy, Energy Policy 34 (2006) 1984–1991. https://doi.org/10.1016/j.enpol.2005.03.010. [2] D. Kweku O. Bismark A. Maxwell K. Desmond K. Danso E. Oti-Mensah A. Quachie B. Adormaa Greenhouse Effect: greenhouse Gases and Their Impact on Global Warming JSRR 17 2018 1 9 10.9734/JSRR/2017/39630 D. Kweku, O. Bismark, A. Maxwell, K. Desmond, K. Danso, E. Oti-Mensah, A. Quachie, B. Adormaa, Greenhouse Effect: greenhouse Gases and Their Impact on Global Warming, JSRR 17 (2018) 1–9. https://doi.org/10.9734/JSRR/2017/39630. [3] Y. Han W.W. Ho Facilitated transport membranes for H2 purification from coal-derived syngas: a techno-economic analysis J. Memb. Sci. 636 2021 119549 10.1016/j.memsci.2021.119549 Y. Han, W.W. Ho, Facilitated transport membranes for H2 purification from coal-derived syngas: a techno-economic analysis, J. Memb. Sci. 636 (2021) 119549. https://doi.org/10.1016/j.memsci.2021.119549. [4] H.A. Reyhani M. Meratizaman A. Ebrahimi O. Pourali M. Amidpour Thermodynamic and economic optimization of SOFC-GT and its cogeneration opportunities using generated syngas from heavy fuel oil gasification Energy 107 2016 141 164 10.1016/j.energy.2016.04.010 H.A. Reyhani, M. Meratizaman, A. Ebrahimi, O. Pourali, M. Amidpour, Thermodynamic and economic optimization of SOFC-GT and its cogeneration opportunities using generated syngas from heavy fuel oil gasification, Energy 107 (2016) 141–164. https://doi.org/10.1016/j.energy.2016.04.010. [5] K. Aasberg-Petersen I. Dybkjær C.V. Ovesen N.C. Schjødt J. Sehested S.G. Thomsen Natural gas to synthesis gas – Catalysts and catalytic processes J. Nat. Gas. Sci. Eng. 3 2011 423 459 10.1016/j.jngse.2011.03.004 K. Aasberg-Petersen, I. Dybkjær, C.V. Ovesen, N.C. Schjødt, J. Sehested, S.G. Thomsen, Natural gas to synthesis gas – Catalysts and catalytic processes, J. Nat. Gas. Sci. Eng. 3 (2011) 423–459. https://doi.org/10.1016/j.jngse.2011.03.004. [6] W.X. Peng L.S. Wang M. Mirzaee H. Ahmadi M.J. Esfahani S. Fremaux Hydrogen and syngas production by catalytic biomass gasification Energy Conver. Manag. 135 2017 270 273 10.1016/j.enconman.2016.12.056 W.X. Peng, L.S. Wang, M. Mirzaee, H. Ahmadi, M.J. Esfahani, S. Fremaux, Hydrogen and syngas production by catalytic biomass gasification, Energy Conver. Manag. 135 (2017) 270–273. https://doi.org/10.1016/j.enconman.2016.12.056. [7] Z. Zhan W. Kobsiriphat J.R. Wilson M. Pillai I. Kim S.A. Barnett Syngas Production by Co electrolysis of CO2/H2O: the Basis for a Renewable Energy Cycle Energy Fuels. 23 2009 3089 3096 10.1021/ef900111f Z. Zhan, W. Kobsiriphat, J.R. Wilson, M. Pillai, I. Kim, S.A. Barnett, Syngas Production by Co electrolysis of CO2/H2O: the Basis for a Renewable Energy Cycle, Energy Fuels. 23 (2009) 3089–3096. https://doi.org/10.1021/ef900111f. [8] S. Chu P. Ou P. Ghamari S. Vanka B. Zhou I. Shih J. Song Z. Mi Photoelectrochemical CO2 Reduction into Syngas with the Metal/Oxide Interface J. Am. Chem. Soc. 140 2018 7869 7877 10.1021/jacs.8b03067 S. Chu, P. Ou, P. Ghamari, S. Vanka, B. Zhou, I. Shih, J. Song, Z. Mi, Photoelectrochemical CO2 Reduction into Syngas with the Metal/Oxide Interface, J. Am. Chem. Soc. 140 (2018) 7869–7877. https://doi.org/10.1021/jacs.8b03067. [9] V.P. Santos B. van der Linden A. Chojecki G. Budroni S. Corthals H. Shibata G.R. Meima F. Kapteijn M. Makkee J. Gascon Mechanistic Insight into the Synthesis of Higher Alcohols from Syngas: the Role of K Promotion on MoS 2 Catalysts ACS. Catal. 3 2013 1634 1637 10.1021/cs4003518 V.P. Santos, B. van der Linden, A. Chojecki, G. Budroni, S. Corthals, H. Shibata, G.R. Meima, F. Kapteijn, M. Makkee, J. Gascon, Mechanistic Insight into the Synthesis of Higher Alcohols from Syngas: the Role of K Promotion on MoS 2 Catalysts, ACS. Catal.. 3 (2013) 1634–1637. https://doi.org/10.1021/cs4003518. [10] J. Liu Y. Liu W. Yan D. Yang J. Fan W. Huang Effect of zinc source on the ethanol synthesis from syngas over a slurry CuZnAl catalyst Int. J. Hydrogen. Energy 45 2020 22469 22479 10.1016/j.ijhydene.2020.06.166 J. Liu, Y. Liu, W. Yan, D. Yang, J. Fan, W. Huang, Effect of zinc source on the ethanol synthesis from syngas over a slurry CuZnAl catalyst, Int. J. Hydrogen. Energy 45 (2020) 22469–22479. https://doi.org/10.1016/j.ijhydene.2020.06.166. [11] Y. Li W. Gao M. Peng J. Zhang J. Sun Y. Xu S. Hong X. Liu X. Liu M. Wei B. Zhang D. Ma Interfacial Fe5C2-Cu catalysts toward low-pressure syngas conversion to long-chain alcohols Nat. Commun. 11 2020 61 10.1038/s41467-019-13691-4 Y. Li, W. Gao, M. Peng, J. Zhang, J. Sun, Y. Xu, S. Hong, X. Liu, X. Liu, M. Wei, B. Zhang, D. Ma, Interfacial Fe5C2-Cu catalysts toward low-pressure syngas conversion to long-chain alcohols, Nat. Commun. 11 (2020) 61. https://doi.org/10.1038/s41467-019-13691-4. [12] C. Huang C. Zhu M. Zhang J. Chen K. Fang Design of efficient ZnO/ZrO2 modified CuCoAl catalysts for boosting higher alcohol synthesis in syngas conversion Appl. Catal. B: Environ. 300 2022 120739 10.1016/j.apcatb.2021.120739 C. Huang, C. Zhu, M. Zhang, J. Chen, K. Fang, Design of efficient ZnO/ZrO2 modified CuCoAl catalysts for boosting higher alcohol synthesis in syngas conversion, Appl. Catal. B: Environ. 300 (2022) 120739. https://doi.org/10.1016/j.apcatb.2021.120739. [13] M. Ao G.H. Pham J. Sunarso F. Li Y. Jin S. Liu Effects of alkali promoters on tri-metallic Co-Ni-Cu-based perovskite catalyst for higher alcohol synthesis from syngas Catal. Today 355 2020 26 34 10.1016/j.cattod.2019.06.061 M. Ao, G.H. Pham, J. Sunarso, F. Li, Y. Jin, S. Liu, Effects of alkali promoters on tri-metallic Co-Ni-Cu-based perovskite catalyst for higher alcohol synthesis from syngas, Catal. Today 355 (2020) 26–34. https://doi.org/10.1016/j.cattod.2019.06.061. [14] M. HAIDER M. GOGATE R. DAVIS Fe-promotion of supported Rh catalysts for direct conversion of syngas to ethanol J. Catal. 261 2009 9 16 10.1016/j.jcat.2008.10.013 M. HAIDER, M. GOGATE, R. DAVIS, Fe-promotion of supported Rh catalysts for direct conversion of syngas to ethanol, J. Catal. 261 (2009) 9–16. https://doi.org/10.1016/j.jcat.2008.10.013. [15] Z. Li R. Fan Z. Hu W. Li H. Zhou S. Kang Y. Zhang H. Zhang G. Wang Ethanol introduced synthesis of ultrasTable 1T-MoS2 for removal of Cr (VI) J. Hazard. Mater. 394 2020 122525 10.1016/j.jhazmat.2020.122525 Z. Li, R. Fan, Z. Hu, W. Li, H. Zhou, S. Kang, Y. Zhang, H. Zhang, G. Wang, Ethanol introduced synthesis of ultrasTable 1T-MoS2 for removal of Cr (VI), J. Hazard. Mater. 394 (2020) 122525. https://doi.org/10.1016/j.jhazmat.2020.122525. [16] S. Meng J. Gu S. Jiang Y. Weng C. Huang P. Ren X. Xue Q. Sun Y. Zhang M. Fan Lignin carbon-initiated Ni/K/Mo2C catalyst for efficient synthesis of higher alcohols from syngas Chem. Eng. J. 481 2024 148751 10.1016/j.cej.2024.148751 S. Meng, J. Gu, S. Jiang, Y. Weng, C. Huang, P. Ren, X. Xue, Q. Sun, Y. Zhang, M. Fan, Lignin carbon-initiated Ni/K/Mo2C catalyst for efficient synthesis of higher alcohols from syngas, Chem. Eng. J. 481 (2024) 148751. https://doi.org/10.1016/j.cej.2024.148751. [17] A.S. Asundi A.S. Hoffman P. Bothra A. Boubnov F.D. Vila N. Yang J.A. Singh L. Zeng J.A. Raiford F. Abild-Pedersen S.R. Bare S.F. Bent Understanding Structure-Property Relationships of MoO3-Promoted Rh Catalysts for Syngas Conversion to Alcohols J. Am. Chem. Soc. 141 2019 19655 19668 10.1021/jacs.9b07460 A.S. Asundi, A.S. Hoffman, P. Bothra, A. Boubnov, F.D. Vila, N. Yang, J.A. Singh, L. Zeng, J.A. Raiford, F. Abild-Pedersen, S.R. Bare, S.F. Bent, Understanding Structure-Property Relationships of MoO3-Promoted Rh Catalysts for Syngas Conversion to Alcohols, J. Am. Chem. Soc. 141 (2019) 19655–19668. https://doi.org/10.1021/jacs.9b07460. [18] S. Zaman K.J. Smith A Review of Molybdenum Catalysts for Synthesis Gas Conversion to Alcohols: catalysts, Mechanisms and Kinetics Catal. Rev. 54 2012 41 132 10.1080/01614940.2012.627224 S. Zaman, K.J. Smith, A Review of Molybdenum Catalysts for Synthesis Gas Conversion to Alcohols: catalysts, Mechanisms and Kinetics, Catal. Rev. 54 (2012) 41–132. https://doi.org/10.1080/01614940.2012.627224. [19] M.E. Osman V.V. Maximov T.D. Dipheko T.F. Sheshko A.G. Cherednichenko P.A. Nikulshin V.M. Kogan Synthesis of Higher Alcohols from Syngas over a K-Modified CoMoS Catalyst Supported on Novel Powder and Fiber Commercial Activated Carbons ACS. Omega 7 2022 21346 21356 10.1021/acsomega.2c03082 M.E. Osman, V.V. Maximov, T.D. Dipheko, T.F. Sheshko, A.G. Cherednichenko, P.A. Nikulshin, V.M. Kogan, Synthesis of Higher Alcohols from Syngas over a K-Modified CoMoS Catalyst Supported on Novel Powder and Fiber Commercial Activated Carbons, ACS. Omega 7 (2022) 21346–21356. https://doi.org/10.1021/acsomega.2c03082. [20] N. Wang R. Hu J. Li F. Bai Y. Zhang H. Su X. Gu Insight into the promotion mechanism of K and Ni in sulfide molybdenum-based catalysts for higher alcohols synthesis from syngas Catal. Commun. 91 2017 57 61 10.1016/j.catcom.2016.12.015 N. Wang, R. Hu, J. Li, F. Bai, Y. Zhang, H. Su, X. Gu, Insight into the promotion mechanism of K and Ni in sulfide molybdenum-based catalysts for higher alcohols synthesis from syngas, Catal. Commun. 91 (2017) 57–61. https://doi.org/10.1016/j.catcom.2016.12.015. [21] F. Zeng X. Xi H. Cao Y. Pei H.J. Heeres R. Palkovits Synthesis of mixed alcohols with enhanced C3+ alcohol production by CO hydrogenation over potassium promoted molybdenum sulfide Appl. Catal. B: Environ. 246 2019 232 241 10.1016/j.apcatb.2019.01.063 F. Zeng, X. Xi, H. Cao, Y. Pei, H.J. Heeres, R. Palkovits, Synthesis of mixed alcohols with enhanced C3+ alcohol production by CO hydrogenation over potassium promoted molybdenum sulfide, Appl. Catal. B: Environ. 246 (2019) 232–241. https://doi.org/10.1016/j.apcatb.2019.01.063. [22] E.A. Permyakov V.S. Dorokhov V.V. Maximov P.A. Nikulshin A.A. Pimerzin V.M. Kogan Computational and experimental study of the second metal effect on the structure and properties of bi-metallic MeMoS-sites in transition metal sulfide catalysts Catal. Today 305 2018 19 27 10.1016/j.cattod.2017.10.041 E.A. Permyakov, V.S. Dorokhov, V.V. Maximov, P.A. Nikulshin, A.A. Pimerzin, V.M. Kogan, Computational and experimental study of the second metal effect on the structure and properties of bi-metallic MeMoS-sites in transition metal sulfide catalysts, Catal. Today 305 (2018) 19–27. https://doi.org/10.1016/j.cattod.2017.10.041. [23] V.S. Dorokhov E.A. Permyakov P.A. Nikulshin V.V. Maximov V.M. Kogan Experimental and computational study of syngas and ethanol conversion mechanisms over K-modified transition metal sulfide catalysts J. Catal. 344 2016 841 853 10.1016/j.jcat.2016.08.005 V.S. Dorokhov, E.A. Permyakov, P.A. Nikulshin, V.V. Maximov, V.M. Kogan, Experimental and computational study of syngas and ethanol conversion mechanisms over K-modified transition metal sulfide catalysts, J. Catal. 344 (2016) 841–853. https://doi.org/10.1016/j.jcat.2016.08.005. [24] V.R. Surisetty A. Tavasoli A.K. Dalai Synthesis of higher alcohols from syngas over alkali promoted MoS2 catalysts supported on multi-walled carbon nanotubes Appl.Catal. A: Gen. 365 2009 243 251 10.1016/j.apcata.2009.06.017 V.R. Surisetty, A. Tavasoli, A.K. Dalai, Synthesis of higher alcohols from syngas over alkali promoted MoS2 catalysts supported on multi-walled carbon nanotubes, Appl.Catal. A: Gen. 365 (2009) 243–251. https://doi.org/10.1016/j.apcata.2009.06.017. [25] T. Toyoda T. Minami E.W. Qian Mixed Alcohol Synthesis over Sulfided Molybdenum-Based Catalysts Energy Fuels. 27 2013 3769 3777 10.1021/ef400262a T. Toyoda, T. Minami, E.W. Qian, Mixed Alcohol Synthesis over Sulfided Molybdenum-Based Catalysts, Energy Fuels. 27 (2013) 3769–3777. https://doi.org/10.1021/ef400262a. [26] M.R. Morrill N.T. Thao H. Shou R.J. Davis D.G. Barton D. Ferrari P.K. Agrawal C.W. Jones Origins of Unusual Alcohol Selectivities over Mixed MgAl Oxide-Supported K/MoS2 Catalysts for Higher Alcohol Synthesis from Syngas ACS. Catal. 3 2013 1665 1675 10.1021/cs400147d M.R. Morrill, N.T. Thao, H. Shou, R.J. Davis, D.G. Barton, D. Ferrari, P.K. Agrawal, C.W. Jones, Origins of Unusual Alcohol Selectivities over Mixed MgAl Oxide-Supported K/MoS2 Catalysts for Higher Alcohol Synthesis from Syngas, ACS. Catal.. 3 (2013) 1665–1675. https://doi.org/10.1021/cs400147d. [27] H. Li W. Zhang Y. Wang M. Shui S. Sun J. Bao C. Gao Nanosheet-structured K–Co–MoS2 catalyst for the higher alcohol synthesis from syngas: synthesis and activation J. Energy Chem. 30 2019 57 62 10.1016/j.jechem.2018.03.019 H. Li, W. Zhang, Y. Wang, M. Shui, S. Sun, J. Bao, C. Gao, Nanosheet-structured K–Co–MoS2 catalyst for the higher alcohol synthesis from syngas: synthesis and activation, J. Energy Chem. 30 (2019) 57–62. https://doi.org/10.1016/j.jechem.2018.03.019. [28] D. Ferrari G. Budroni L. Bisson N.J. Rane B.D. Dickie J.H. Kang S.J. Rozeveld Effect of potassium addition method on MoS2 performance for the syngas to alcohol reaction Appl. Catal. A: Gen. 462-463 2013 302 309 10.1016/j.apcata.2013.05.006 D. Ferrari, G. Budroni, L. Bisson, N.J. Rane, B.D. Dickie, J.H. Kang, S.J. Rozeveld, Effect of potassium addition method on MoS2 performance for the syngas to alcohol reaction, Appl. Catal. A: Gen. 462-463 (2013) 302–309. https://doi.org/10.1016/j.apcata.2013.05.006. [29] V.R. Surisetty I. Eswaramoorthi A.K. Dalai Comparative study of higher alcohols synthesis over alumina and activated carbon-supported alkali-modified MoS2 catalysts promoted with group VIII metals Fuel 96 2012 77 84 10.1016/j.fuel.2011.12.054 V.R. Surisetty, I. Eswaramoorthi, A.K. Dalai, Comparative study of higher alcohols synthesis over alumina and activated carbon-supported alkali-modified MoS2 catalysts promoted with group VIII metals, Fuel 96 (2012) 77–84. https://doi.org/10.1016/j.fuel.2011.12.054. [30] J. Yong X. Luan X. Dai X. Zhang H. Qiao Y. Yang X. Huang Tuning the metal–support interaction in supported K-promoted NiMo catalysts for enhanced selectivity and productivity towards higher alcohols in CO hydrogenation Catal. Sci. Technol. 7 2017 4206 4215 10.1039/C7CY01295K J. Yong, X. Luan, X. Dai, X. Zhang, H. Qiao, Y. Yang, X. Huang, Tuning the metal–support interaction in supported K-promoted NiMo catalysts for enhanced selectivity and productivity towards higher alcohols in CO hydrogenation, Catal. Sci. Technol. 7 (2017) 4206–4215. https://doi.org/10.1039/C7CY01295K. [31] X. Xi F. Zeng H. Cao C. Cannilla T. Bisswanger S. de Graaf Y. Pei F. Frusteri C. Stampfer R. Palkovits H.J. Heeres Enhanced C3+ alcohol synthesis from syngas using KCoMoSx catalysts: effect of the Co-Mo ratio on catalyst performance Appl. Catal. B: Environ. 272 2020 118950 10.1016/j.apcatb.2020.118950 X. Xi, F. Zeng, H. Cao, C. Cannilla, T. Bisswanger, S. de Graaf, Y. Pei, F. Frusteri, C. Stampfer, R. Palkovits, H.J. Heeres, Enhanced C3+ alcohol synthesis from syngas using KCoMoSx catalysts: effect of the Co-Mo ratio on catalyst performance, Appl. Catal. B: Environ. 272 (2020) 118950. https://doi.org/10.1016/j.apcatb.2020.118950. [32] X. Zhang X. Luan X. Dai Z. Ren M. Cui H. Zhao F. Nie X. Huang Enhanced Higher Alcohol Synthesis from CO Hydrogenation on Zn-Modified MgAl-Mixed Oxide Supported KNiMoS-Based Catalysts Ind. Eng. Chem. Res. 59 2020 1413 1421 10.1021/acs.iecr.9b04047 X. Zhang, X. Luan, X. Dai, Z. Ren, M. Cui, H. Zhao, F. Nie, X. Huang, Enhanced Higher Alcohol Synthesis from CO Hydrogenation on Zn-Modified MgAl-Mixed Oxide Supported KNiMoS-Based Catalysts, Ind. Eng. Chem. Res. 59 (2020) 1413–1421. https://doi.org/10.1021/acs.iecr.9b04047. [33] H. Qi D. Li C. Yang Y. Ma W. Li Y. Sun B. Zhong Nickel and manganese co-modified K/MoS2 catalyst: high performance for higher alcohols synthesis from CO hydrogenation Catal. Commun. 4 2003 339 342 10.1016/S1566-7367(03)00061-X H. Qi, D. Li, C. Yang, Y. Ma, W. Li, Y. Sun, B. Zhong, Nickel and manganese co-modified K/MoS2 catalyst: high performance for higher alcohols synthesis from CO hydrogenation, Catal. Commun. 4 (2003) 339–342. https://doi.org/10.1016/S1566-7367(03)00061-X. [34] Y. YANG Y. WANG S. LIU Q. SONG Z. XIE Z. GAO Effect of Lanthanum Promotion on the Unsupported Mo–Co–K Sulfide Catalysts for Synthesis of Mixed Alcohols from Syngas Catal Lett 127 2009 448 455 10.1007/s10562-008-9739-3 Y. YANG, Y. WANG, S. LIU, Q. SONG, Z. XIE, Z. GAO, Effect of Lanthanum Promotion on the Unsupported Mo–Co–K Sulfide Catalysts for Synthesis of Mixed Alcohols from Syngas, Catal Lett 127 (2009) 448–455. https://doi.org/10.1007/s10562-008-9739-3. [35] D. Li C. Yang H. Qi H. Zhang W. Li Y. Sun B. Zhong Higher alcohol synthesis over a La promoted Ni/K2CO3/MoS2 catalyst Catal. Commun. 5 2004 605 609 10.1016/j.catcom.2004.07.011 D. Li, C. Yang, H. Qi, H. Zhang, W. Li, Y. Sun, B. Zhong, Higher alcohol synthesis over a La promoted Ni/K2CO3/MoS2 catalyst, Catal. Commun. 5 (2004) 605–609. https://doi.org/10.1016/j.catcom.2004.07.011. [36] V.R. Surisetty A.K. Dalai J. Kozinski Synthesis of higher alcohols from synthesis gas over Co-promoted alkali-modified MoS2 catalysts supported on MWCNTs Appl. Catal. A: Gen. 385 2010 153 162 10.1016/j.apcata.2010.07.009 V.R. Surisetty, A.K. Dalai, J. Kozinski, Synthesis of higher alcohols from synthesis gas over Co-promoted alkali-modified MoS2 catalysts supported on MWCNTs, Appl. Catal. A: Gen. 385 (2010) 153–162. https://doi.org/10.1016/j.apcata.2010.07.009. [37] X. Zheng S. Guo L. Guo Ethanol synthesis catalyzed by single Ni atom supported on Mo6S8 support Appl. Catal. A: Gen. 553 2018 52 64 10.1016/j.apcata.2018.01.010 X. Zheng, S. Guo, L. Guo, Ethanol synthesis catalyzed by single Ni atom supported on Mo6S8 support, Appl. Catal. A: Gen. 553 (2018) 52–64. https://doi.org/10.1016/j.apcata.2018.01.010. [38] N. Wang J. Li R. Hu Y. Zhang H. Su X. Gu Enhanced catalytic performance and promotional effect of molybdenum sulfide cluster-derived catalysts for higher alcohols synthesis from syngas Catal. Today 316 2018 177 184 10.1016/j.cattod.2018.03.007 N. Wang, J. Li, R. Hu, Y. Zhang, H. Su, X. Gu, Enhanced catalytic performance and promotional effect of molybdenum sulfide cluster-derived catalysts for higher alcohols synthesis from syngas, Catal. Today 316 (2018) 177–184. https://doi.org/10.1016/j.cattod.2018.03.007. [39] J.E. Hensley S. Pylypenko D.A. Ruddy Deactivation and stability of K-CoMoSx mixed alcohol synthesis catalysts J. Catal. 309 2014 199 208 10.1016/j.jcat.2013.10.001 J.E. Hensley, S. Pylypenko, D.A. Ruddy, Deactivation and stability of K-CoMoSx mixed alcohol synthesis catalysts, J. Catal. 309 (2014) 199–208. https://doi.org/10.1016/j.jcat.2013.10.001. [40] Z. Ren X. Zhang X. Dai X. Luan Z. Yang F. Nie X. Yin Y. Gan Y. Cao B. Wu Ordered mesoporous NiMg bimetal oxides confined KMoS catalyst for selective CO hydrogenation into higher alcohols Fuel 303 2021 121321 10.1016/j.fuel.2021.121321 Z. Ren, X. Zhang, X. Dai, X. Luan, Z. Yang, F. Nie, X. Yin, Y. Gan, Y. Cao, B. Wu, Ordered mesoporous NiMg bimetal oxides confined KMoS catalyst for selective CO hydrogenation into higher alcohols, Fuel 303 (2021) 121321. https://doi.org/10.1016/j.fuel.2021.121321. [41] Z. Ren Y. Cao R. Cai X. Dai Y. Wei F. Nie X. Yin Y. Gan B. Wu Y. Ye X. Huang Metal-Support interaction modulate the sulfidation and dispersion of MoS2 slabs on hierarchical KNiMo|ZnCrAl-Based multifunctional catalysts for selective conversion of syngas to higher alcohols Chem. Eng. J. 440 2022 135831 10.1016/j.cej.2022.135831 Z. Ren, Y. Cao, R. Cai, X. Dai, Y. Wei, F. Nie, X. Yin, Y. Gan, B. Wu, Y. Ye, X. Huang, Metal-Support interaction modulate the sulfidation and dispersion of MoS2 slabs on hierarchical KNiMo|ZnCrAl-Based multifunctional catalysts for selective conversion of syngas to higher alcohols, Chem. Eng. J. 440 (2022) 135831. https://doi.org/10.1016/j.cej.2022.135831. [42] Z. Ren Y. Cao X. Yin Y. Gan R. Cai Q. Wang B. Feng Y. Wu X. Dai Ordered mesoporous Mg-modified silica to confine MoS2 slabs with high sulfidation and dispersion for higher alcohol synthesis via CO hydrogenation Fuel 363 2024 130915 10.1016/j.fuel.2024.130915 Z. Ren, Y. Cao, X. Yin, Y. Gan, R. Cai, Q. Wang, B. Feng, Y. Wu, X. Dai, Ordered mesoporous Mg-modified silica to confine MoS2 slabs with high sulfidation and dispersion for higher alcohol synthesis via CO hydrogenation, Fuel 363 (2024) 130915. https://doi.org/10.1016/j.fuel.2024.130915. [43] T. Toyoda Y. Nishihara E.W. Qian CO hydrogenation on group VI metal–ceria catalysts Fuel Process. Technol. 125 2014 86 93 10.1016/j.fuproc.2014.03.033 T. Toyoda, Y. Nishihara, E.W. Qian, CO hydrogenation on group VI metal–ceria catalysts, Fuel Process. Technol. 125 (2014) 86–93. https://doi.org/10.1016/j.fuproc.2014.03.033. [44] J.-J. Wang J.-R. Xie Y.-H. Huang B.-H. Chen G.-D. Lin H.-B. Zhang An efficient Ni–Mo–K sulfide catalyst doped with CNTs for conversion of syngas to ethanol and higher alcohols Appl. Catal. A: Gen. 468 2013 44 51 10.1016/j.apcata.2013.08.026 J.-J. Wang, J.-R. Xie, Y.-H. Huang, B.-H. Chen, G.-D. Lin, H.-B. Zhang, An efficient Ni–Mo–K sulfide catalyst doped with CNTs for conversion of syngas to ethanol and higher alcohols, Appl. Catal. A: Gen. 468 (2013) 44–51. https://doi.org/10.1016/j.apcata.2013.08.026. [45] Z. Li Y. Fu M. Jiang T. Hu T. Liu Y. Xie Active Carbon Supported Mo–K Catalysts Used for Alcohol Synthesis J. Catal. 199 2001 155 161 10.1006/jcat.2001.3172 Z. Li, Y. Fu, M. Jiang, T. Hu, T. Liu, Y. Xie, Active Carbon Supported Mo–K Catalysts Used for Alcohol Synthesis, J. Catal. 199 (2001) 155–161. https://doi.org/10.1006/jcat.2001.3172. [46] M.E. Osman V.V. Maximov V.S. Dorokhov V.M. Mukhin T.F. Sheshko P.J. Kooyman V.M. Kogan Carbon-Supported KCoMoS2 for Alcohol Synthesis from Synthesis Gas Catalysts. 11 2021 1321 10.3390/catal11111321 M.E. Osman, V.V. Maximov, V.S. Dorokhov, V.M. Mukhin, T.F. Sheshko, P.J. Kooyman, V.M. Kogan, Carbon-Supported KCoMoS2 for Alcohol Synthesis from Synthesis Gas, Catalysts. 11 (2021) 1321. https://doi.org/10.3390/catal11111321. [47] M. Taborga Claure S.-H. Chai S. Dai K.A. Unocic F.M. Alamgir P.K. Agrawal C.W. Jones Tuning of higher alcohol selectivity and productivity in CO hydrogenation reactions over K/MoS2 domains supported on mesoporous activated carbon and mixed MgAl oxide J. Catal. 324 2015 88 97 10.1016/j.jcat.2015.01.015 M. Taborga Claure, S.-H. Chai, S. Dai, K.A. Unocic, F.M. Alamgir, P.K. Agrawal, C.W. Jones, Tuning of higher alcohol selectivity and productivity in CO hydrogenation reactions over K/MoS2 domains supported on mesoporous activated carbon and mixed MgAl oxide, J. Catal. 324 (2015) 88–97. https://doi.org/10.1016/j.jcat.2015.01.015. [48] N. Qin X. Mu L. Zhao K. Fang Effect of KCoMoS2 Catalyst Structures on the Catalytic Performance of Higher Alcohols Synthesis via CO Hydrogenation Catalysts. 10 2020 151 10.3390/catal10020151 N. Qin, X. Mu, L. Zhao, K. Fang, Effect of KCoMoS2 Catalyst Structures on the Catalytic Performance of Higher Alcohols Synthesis via CO Hydrogenation, Catalysts. 10 (2020) 151. https://doi.org/10.3390/catal10020151. [49] M. Konarova F. Tang J. Chen G. Wang V. Rudolph J. Beltramini Nano- and Microscale Engineering of the Molybdenum Disulfide-Based Catalysts for Syngas to Ethanol Conversion ChemCatChem. 6 2014 2394 2402 10.1002/cctc.201402067 M. Konarova, F. Tang, J. Chen, G. Wang, V. Rudolph, J. Beltramini, Nano- and Microscale Engineering of the Molybdenum Disulfide-Based Catalysts for Syngas to Ethanol Conversion, ChemCatChem. 6 (2014) 2394–2402. https://doi.org/10.1002/cctc.201402067. [50] R. Suárez París V. Montes M. Boutonnet S. Järås Higher alcohol synthesis over nickel-modified alkali-doped molybdenum sulfide catalysts prepared by conventional coprecipitation and coprecipitation in microemulsions Catal. Today 258 2015 294 303 10.1016/j.cattod.2014.12.003 R. Suárez París, V. Montes, M. Boutonnet, S. Järås, Higher alcohol synthesis over nickel-modified alkali-doped molybdenum sulfide catalysts prepared by conventional coprecipitation and coprecipitation in microemulsions, Catal. Today 258 (2015) 294–303. https://doi.org/10.1016/j.cattod.2014.12.003. [51] D. Li N. Zhao H. Qi W. Li Y.H. Sun B. Zhong Ultrasonic preparation of Ni modified K2CO3/MoS2 catalyst for higher alcohols synthesis Catal. Commun. 6 2005 674 678 10.1016/j.catcom.2005.06.007 D. Li, N. Zhao, H. Qi, W. Li, Y.H. Sun, B. Zhong, Ultrasonic preparation of Ni modified K2CO3/MoS2 catalyst for higher alcohols synthesis, Catal. Commun. 6 (2005) 674–678. https://doi.org/10.1016/j.catcom.2005.06.007. [52] J. Chen Z. Wang J. Zhao L. Ling R. Zhang B. Wang The active site of ethanol formation from syngas over Cu4 cluster modified MoS2 catalyst: a theoretical investigation Appl. Surf. Sci. 540 2021 148301 10.1016/j.apsusc.2020.148301 J. Chen, Z. Wang, J. Zhao, L. Ling, R. Zhang, B. Wang, The active site of ethanol formation from syngas over Cu4 cluster modified MoS2 catalyst: a theoretical investigation, Appl. Surf. Sci. 540 (2021) 148301. https://doi.org/10.1016/j.apsusc.2020.148301. [53] L. Zhao Y. Li X. Liu K. Fang Low-temperature synthesis of high-performance nano-MoS2-based catalyst via non-thermal plasma for higher alcohol synthesis from syngas Catal. Today 355 2020 17 25 10.1016/j.cattod.2019.01.069 L. Zhao, Y. Li, X. Liu, K. Fang, Low-temperature synthesis of high-performance nano-MoS2-based catalyst via non-thermal plasma for higher alcohol synthesis from syngas, Catal. Today 355 (2020) 17–25. https://doi.org/10.1016/j.cattod.2019.01.069. [54] J. Bao Y. Fu G. Bian Sol–gel Preparation of K–Co–Mo Catalyst and its Application in Mixed Alcohol Synthesis from CO Hydrogenation Catal Lett 121 2008 151 157 10.1007/s10562-007-9312-5 J. Bao, Y. Fu, G. Bian, Sol–gel Preparation of K–Co–Mo Catalyst and its Application in Mixed Alcohol Synthesis from CO Hydrogenation, Catal Lett 121 (2008) 151–157. https://doi.org/10.1007/s10562-007-9312-5. [55] J.S. Lee S. Kim Y.G. Kim Electronic and geometric effects of alkali promoters in CO hydrogenation over K/Mo2C catalysts Top. Catal. 2 1995 127 140 10.1007/BF01491961 J.S. Lee, S. Kim, Y.G. Kim, Electronic and geometric effects of alkali promoters in CO hydrogenation over K/Mo2C catalysts, Top. Catal. 2 (1995) 127–140. https://doi.org/10.1007/BF01491961. [56] S.-H. Chai V. Schwartz J.Y. Howe X. Wang M. Kidder S.H. Overbury S. Dai D. Jiang Graphitic mesoporous carbon-supported molybdenum carbides for catalytic hydrogenation of carbon monoxide to mixed alcohols Microporous Mesoporous Mater. 170 2013 141 149 10.1016/j.micromeso.2012.11.025 S.-H. Chai, V. Schwartz, J.Y. Howe, X. Wang, M. Kidder, S.H. Overbury, S. Dai, D. Jiang, Graphitic mesoporous carbon-supported molybdenum carbides for catalytic hydrogenation of carbon monoxide to mixed alcohols, Microporous Mesoporous Mater. 170 (2013) 141–149. https://doi.org/10.1016/j.micromeso.2012.11.025. [57] M. Xiang D. Li H. Qi W. Li B. Zhong Y. Sun Mixed alcohols synthesis from carbon monoxide hydrogenation over potassium promoted β-Mo2C catalysts Fuel 86 2007 1298 1303 10.1016/j.fuel.2006.08.032 M. Xiang, D. Li, H. Qi, W. Li, B. Zhong, Y. Sun, Mixed alcohols synthesis from carbon monoxide hydrogenation over potassium promoted β-Mo2C catalysts, Fuel 86 (2007) 1298–1303. https://doi.org/10.1016/j.fuel.2006.08.032. [58] A.P. Farkas F. Solymosi Effects of potassium on the adsorption and dissociation pathways of methanol and ethanol on Mo2C/Mo (100) Surf. Sci. 602 2008 1475 1485 10.1016/j.susc.2008.02.010 A.P. Farkas, F. Solymosi, Effects of potassium on the adsorption and dissociation pathways of methanol and ethanol on Mo2C/Mo (100), Surf. Sci. 602 (2008) 1475–1485. https://doi.org/10.1016/j.susc.2008.02.010. [59] S.-W. Chiang C.-C. Chang J.-L. Shie C.-Y. Chang D.-R. Ji J.-Y. Tseng Synthesis of alcohols and alkanes over potassium and vanadium promoted molybdenum carbides J. Taiwan Inst. Chem. Eng. 43 2012 918 925 10.1016/j.jtice.2012.07.008 S.-W. Chiang, C.-C. Chang, J.-L. Shie, C.-Y. Chang, D.-R. Ji, J.-Y. Tseng, Synthesis of alcohols and alkanes over potassium and vanadium promoted molybdenum carbides, J. Taiwan Inst. Chem. Eng. 43 (2012) 918–925. https://doi.org/10.1016/j.jtice.2012.07.008. [60] Q. Wu J.M. Christensen G.L. Chiarello L.D. Duchstein J.B. Wagner B. Temel J.-D. Grunwaldt A.D. Jensen Supported molybdenum carbide for higher alcohol synthesis from syngas Catal. Today 215 2013 162 168 10.1016/j.cattod.2013.03.002 Q. Wu, J.M. Christensen, G.L. Chiarello, L.D. Duchstein, J.B. Wagner, B. Temel, J.-D. Grunwaldt, A.D. Jensen, Supported molybdenum carbide for higher alcohol synthesis from syngas, Catal. Today 215 (2013) 162–168. https://doi.org/10.1016/j.cattod.2013.03.002. [61] R.M. Kiai T. Nematian A. Tavasoli A. Karimi Effect of elemental molar ratio on the synthesis of higher alcohols over Co-promoted alkali-modified Mo2C catalysts supported on CNTs J. Energy Chem. 24 2015 278 284 10.1016/S2095-4956(15)60312-6 R.M. Kiai, T. Nematian, A. Tavasoli, A. Karimi, Effect of elemental molar ratio on the synthesis of higher alcohols over Co-promoted alkali-modified Mo2C catalysts supported on CNTs, J. Energy Chem. 24 (2015) 278–284. https://doi.org/10.1016/S2095-4956(15)60312-6. [62] C. Wang H. Yu T. Lin X. Qi F. Yu L. Zhong Y. Sun Direct synthesis of higher alcohols from syngas over modified Mo2C catalysts under mild reaction conditions Catal. Sci. Technol. 12 2022 1697 1708 10.1039/D1CY02186A C. Wang, H. Yu, T. Lin, X. Qi, F. Yu, L. Zhong, Y. Sun, Direct synthesis of higher alcohols from syngas over modified Mo2C catalysts under mild reaction conditions, Catal. Sci. Technol. 12 (2022) 1697–1708. https://doi.org/10.1039/D1CY02186A. [63] H. Shou R.J. Davis Reactivity and in situ X-ray absorption spectroscopy of Rb-promoted Mo2C/MgO catalysts for higher alcohol synthesis J. Catal. 282 2011 83 93 10.1016/j.jcat.2011.05.028 H. Shou, R.J. Davis, Reactivity and in situ X-ray absorption spectroscopy of Rb-promoted Mo2C/MgO catalysts for higher alcohol synthesis, J. Catal. 282 (2011) 83–93. https://doi.org/10.1016/j.jcat.2011.05.028. [64] H. Shou D. Ferrari D.G. Barton C.W. Jones R.J. Davis Influence of Passivation on the Reactivity of Unpromoted and Rb-Promoted Mo2C Nanoparticles for CO Hydrogenation ACS. Catal. 2 2012 1408 1416 10.1021/cs300083b H. Shou, D. Ferrari, D.G. Barton, C.W. Jones, R.J. Davis, Influence of Passivation on the Reactivity of Unpromoted and Rb-Promoted Mo2C Nanoparticles for CO Hydrogenation, ACS. Catal.. 2 (2012) 1408–1416. https://doi.org/10.1021/cs300083b. [65] J.M. Christensen L.D.L. Duchstein J.B. Wagner P.A. Jensen B. Temel A.D. Jensen Catalytic Conversion of Syngas into Higher Alcohols over Carbide Catalysts Ind. Eng. Chem. Res. 51 2012 4161 4172 10.1021/ie2018417 J.M. Christensen, L.D.L. Duchstein, J.B. Wagner, P.A. Jensen, B. Temel, A.D. Jensen, Catalytic Conversion of Syngas into Higher Alcohols over Carbide Catalysts, Ind. Eng. Chem. Res. 51 (2012) 4161–4172. https://doi.org/10.1021/ie2018417. [66] C. Liu M. Lin D. Jiang K. Fang Y. Sun Preparation of Promoted Molybdenum Carbides Nanowire for CO Hydrogenation Catal Lett 144 2014 567 573 10.1007/s10562-013-1163-7 C. Liu, M. Lin, D. Jiang, K. Fang, Y. Sun, Preparation of Promoted Molybdenum Carbides Nanowire for CO Hydrogenation, Catal Lett 144 (2014) 567–573. https://doi.org/10.1007/s10562-013-1163-7. [67] M. Xiang D. Li W. Li B. Zhong Y. Sun Synthesis of higher alcohols from syngas over K/Co/β-Mo2C catalysts Catal. Commun. 8 2007 503 507 10.1016/j.catcom.2006.07.029 M. Xiang, D. Li, W. Li, B. Zhong, Y. Sun, Synthesis of higher alcohols from syngas over K/Co/β-Mo2C catalysts, Catal. Commun. 8 (2007) 503–507. https://doi.org/10.1016/j.catcom.2006.07.029. [68] A.S. Asundi A.S. Hoffman M. Chi S.S. Nathan A. Boubnov J. Hong S.R. Bare S.F. Bent Enhanced alcohol production over binary Mo/Co carbide catalysts in syngas conversion J. Catal. 391 2020 446 458 10.1016/j.jcat.2020.09.003 A.S. Asundi, A.S. Hoffman, M. Chi, S.S. Nathan, A. Boubnov, J. Hong, S.R. Bare, S.F. Bent, Enhanced alcohol production over binary Mo/Co carbide catalysts in syngas conversion, J. Catal. 391 (2020) 446–458. https://doi.org/10.1016/j.jcat.2020.09.003. [69] L. Zhao K. Fang D. Jiang D. Li Y. Sun Sol–gel derived Ni–Mo bimetallic carbide catalysts and their performance for CO hydrogenation Catal. Today 158 2010 490 495 10.1016/j.cattod.2010.07.021 L. Zhao, K. Fang, D. Jiang, D. Li, Y. Sun, Sol–gel derived Ni–Mo bimetallic carbide catalysts and their performance for CO hydrogenation, Catal. Today 158 (2010) 490–495. https://doi.org/10.1016/j.cattod.2010.07.021. [70] M. XIANG D. LI H. XIAO J. Zhang H. QI W. LI B. ZHONG Y. SUN Synthesis of higher alcohols from syngas over Fischer–Tropsch elements modified K/β-Mo2C catalysts Fuel 87 2008 599 603 10.1016/j.fuel.2007.01.041 M. XIANG, D. LI, H. XIAO, J. Zhang, H. QI, W. LI, B. ZHONG, Y. SUN, Synthesis of higher alcohols from syngas over Fischer–Tropsch elements modified K/β-Mo2C catalysts, Fuel 87 (2008) 599–603. https://doi.org/10.1016/j.fuel.2007.01.041. [71] Z. Hao X. Li Y. Tian T. Ding G. Yang Q. Ma N. Tsubaki X. Li Influence of Carbon Content in Ni-Doped Mo2C Catalysts on CO Hydrogenation to Mixed Alcohol Catalysts. 11 2021 230 10.3390/catal11020230 Z. Hao, X. Li, Y. Tian, T. Ding, G. Yang, Q. Ma, N. Tsubaki, X. Li, Influence of Carbon Content in Ni-Doped Mo2C Catalysts on CO Hydrogenation to Mixed Alcohol, Catalysts. 11 (2021) 230. https://doi.org/10.3390/catal11020230. [72] Y. Aoki H. Tominaga M. Nagai Hydrogenation of CO on molybdenum and cobalt molybdenum carbide catalysts—Mass and infrared spectroscopy studies Catal. Today 215 2013 169 175 10.1016/j.cattod.2013.05.007 Y. Aoki, H. Tominaga, M. Nagai, Hydrogenation of CO on molybdenum and cobalt molybdenum carbide catalysts—Mass and infrared spectroscopy studies, Catal. Today 215 (2013) 169–175. https://doi.org/10.1016/j.cattod.2013.05.007. [73] N. Wang K. Fang D. Jiang D. Li Y. Sun Iron carbide promoted K/β-Mo2C for higher alcohols synthesis Catal. Today 158 2010 241 245 10.1016/j.cattod.2010.03.079 N. Wang, K. Fang, D. Jiang, D. Li, Y. Sun, Iron carbide promoted K/β-Mo2C for higher alcohols synthesis, Catal. Today 158 (2010) 241–245. https://doi.org/10.1016/j.cattod.2010.03.079. [74] M. Xiang D. Wu J. Zou D. Li Y. Sun X. She Catalytic performance of Fe modified K/Mo2C catalyst for CO hydrogenation J. Natl. Gas Chem. 20 2011 520 524 10.1016/S1003-9953(10)60215-0 M. Xiang, D. Wu, J. Zou, D. Li, Y. Sun, X. She, Catalytic performance of Fe modified K/Mo2C catalyst for CO hydrogenation, J. Natl. Gas Chem. 20 (2011) 520–524. https://doi.org/10.1016/S1003-9953(10)60215-0. [75] F. Li J. Li K. Wang M. Ao J. Qiu X. Zhang H. Wang G.H. Pham S. Liu Co/Co6Mo6C@C nanoreactors derived from ZIF-67 composite for higher alcohols synthesis Compos. Part B: Eng. 209 2021 108608 10.1016/j.compositesb.2021.108608 F. Li, J. Li, K. Wang, M. Ao, J. Qiu, X. Zhang, H. Wang, G.H. Pham, S. Liu, Co/Co6Mo6C@C nanoreactors derived from ZIF-67 composite for higher alcohols synthesis, Compos. Part B: Eng. 209 (2021) 108608. https://doi.org/10.1016/j.compositesb.2021.108608. [76] N. Wang K. Fang M. Lin D. Jiang D. Li Y. Sun Synthesis of Higher Alcohols from Syngas over Fe/K/β-Mo2C Catalyst Catal Lett 136 2010 9 13 10.1007/s10562-010-0288-1 N. Wang, K. Fang, M. Lin, D. Jiang, D. Li, Y. Sun, Synthesis of Higher Alcohols from Syngas over Fe/K/β-Mo2C Catalyst, Catal Lett 136 (2010) 9–13. https://doi.org/10.1007/s10562-010-0288-1. [77] E.T. Liakakou E. Heracleous Transition metal promoted K/Mo2C as efficient catalysts for CO hydrogenation to higher alcohols Catal. Sci. Technol. 6 2016 1106 1119 10.1039/C5CY01173F E.T. Liakakou, E. Heracleous, Transition metal promoted K/Mo2C as efficient catalysts for CO hydrogenation to higher alcohols, Catal. Sci. Technol. 6 (2016) 1106–1119. https://doi.org/10.1039/C5CY01173F. [78] W. Marquart D.J. Morgan G.J. Hutchings M. Claeys N. Fischer Oxygenate formation over K/β-Mo2C catalysts in the Fischer–Tropsch synthesis Catal. Sci. Technol. 8 2018 3806 3817 10.1039/C8CY01181H W. Marquart, D.J. Morgan, G.J. Hutchings, M. Claeys, N. Fischer, Oxygenate formation over K/β-Mo2C catalysts in the Fischer–Tropsch synthesis, Catal. Sci. Technol. 8 (2018) 3806–3817. https://doi.org/10.1039/C8CY01181H. [79] C. Liu M. Lin K. Fang Y. Meng Y. Sun Preparation of nanostructured molybdenum carbides for CO hydrogenation RSC Adv. 4 2014 20948 20954 10.1039/C4RA01586J C. Liu, M. Lin, K. Fang, Y. Meng, Y. Sun, Preparation of nanostructured molybdenum carbides for CO hydrogenation, RSC Adv. 4 (2014) 20948–20954. https://doi.org/10.1039/C4RA01586J. [80] S. He H. Qu J. Liu J. Sun Y. Su R. Hu Y. Zhang H. Su Remarkably enhanced catalytic performance of three-dimensional hierarchically porous Mo2C catalysts for higher alcohols synthesis from syngas Mol. Catal. 556 2024 113941 10.1016/j.mcat.2024.113941 S. He, H. Qu, J. Liu, J. Sun, Y. Su, R. Hu, Y. Zhang, H. Su, Remarkably enhanced catalytic performance of three-dimensional hierarchically porous Mo2C catalysts for higher alcohols synthesis from syngas, Mol. Catal. 556 (2024) 113941. https://doi.org/10.1016/j.mcat.2024.113941. [81] R. Zhang C. Wei W. Guo Z. Li B. Wang L. Ling D. Li Syngas Conversion to C2 Oxygenates over the Cu/β-Mo2C Catalyst: probing into the Effect of the Interface between Cu and β-Mo2C on Catalytic Performance J. Phys. Chem. C 123 2019 21022 21030 10.1021/acs.jpcc.9b05963 R. Zhang, C. Wei, W. Guo, Z. Li, B. Wang, L. Ling, D. Li, Syngas Conversion to C2 Oxygenates over the Cu/β-Mo2C Catalyst: probing into the Effect of the Interface between Cu and β-Mo2C on Catalytic Performance, J. Phys. Chem. C 123 (2019) 21022–21030. https://doi.org/10.1021/acs.jpcc.9b05963. [82] Y. Dang S. Li Catalytic mechanism and selectivity prediction for syngas conversion over pure and K-promoted Mo2C catalysts Appl. Catal. A: Gen. 610 2021 117945 10.1016/j.apcata.2020.117945 Y. Dang, S. Li, Catalytic mechanism and selectivity prediction for syngas conversion over pure and K-promoted Mo2C catalysts, Appl. Catal. A: Gen. 610 (2021) 117945. https://doi.org/10.1016/j.apcata.2020.117945. [83] M. Luo C. Li Q. Liu Z. Yang Y. Wang H. Li β-Mo2C/γ-Al2O3 catalyst for one step CO hydrogenation to produce alcohols Catal. Today 2022 10.1016/j.cattod.2022.05.039 M. Luo, C. Li, Q. Liu, Z. Yang, Y. Wang, H. Li, β-Mo2C/γ-Al2O3 catalyst for one step CO hydrogenation to produce alcohols, Catal. Today (2022). https://doi.org/10.1016/j.cattod.2022.05.039. [84] M. Xiang D. Li H. Xiao J. Zhang W. Li B. Zhong Y. Sun K/Ni/β-Mo2C: a highly active and selective catalyst for higher alcohols synthesis from CO hydrogenation Catal. Today 131 2008 489 495 10.1016/j.cattod.2007.10.083 M. Xiang, D. Li, H. Xiao, J. Zhang, W. Li, B. Zhong, Y. Sun, K/Ni/β-Mo2C: a highly active and selective catalyst for higher alcohols synthesis from CO hydrogenation, Catal. Today 131 (2008) 489–495. https://doi.org/10.1016/j.cattod.2007.10.083. [85] W. Aslam J.N. Beltramini L.A. Atanda N.R. Batalha T.U. Schülli M. Konarova The catalytic activity of KMoCo carbon spheres for higher alcohols synthesis from syngas Appl. Catal. A: Gen. 605 2020 117803 10.1016/j.apcata.2020.117803 W. Aslam, J.N. Beltramini, L.A. Atanda, N.R. Batalha, T.U. Schülli, M. Konarova, The catalytic activity of KMoCo carbon spheres for higher alcohols synthesis from syngas, Appl. Catal. A: Gen. 605 (2020) 117803. https://doi.org/10.1016/j.apcata.2020.117803. [86] S.F. Zaman K.J. Smith A study of K-promoted MoP–SiO2 catalysts for synthesis gas conversion Appl. Catal. A: Gen. 378 2010 59 68 10.1016/j.apcata.2010.01.046 S.F. Zaman, K.J. Smith, A study of K-promoted MoP–SiO2 catalysts for synthesis gas conversion, Appl. Catal. A: Gen. 378 (2010) 59–68. https://doi.org/10.1016/j.apcata.2010.01.046. [87] S.F. Zaman K.J. Smith Synthesis gas conversion over MoP catalysts Catal. Commun. 10 2009 468 471 10.1016/j.catcom.2008.10.022 S.F. Zaman, K.J. Smith, Synthesis gas conversion over MoP catalysts, Catal. Commun. 10 (2009) 468–471. https://doi.org/10.1016/j.catcom.2008.10.022. [88] R. Xu Y. Li Z. Cao J. Zheng N. Zhang B. Chen W. Wang Higher alcohol synthesis from syngas over KCoMoP catalysts Catal. Commun. 51 2014 63 67 10.1016/j.catcom.2014.03.015 R. Xu, Y. Li, Z. Cao, J. Zheng, N. Zhang, B. Chen, W. Wang, Higher alcohol synthesis from syngas over KCoMoP catalysts, Catal. Commun. 51 (2014) 63–67. https://doi.org/10.1016/j.catcom.2014.03.015. [89] I.C. ten Have E. Valle A. Gallo J.L. Snider M.S. Duyar T.F. Jaramillo Development of Molybdenum Phosphide Catalysts for Higher Alcohol Synthesis from Syngas by Exploiting Support and Promoter Effects Energy Technol 7 2019 1801102 10.1002/ente.201801102 I.C. ten Have, E. Valle, A. Gallo, J.L. Snider, M.S. Duyar, T.F. Jaramillo, Development of Molybdenum Phosphide Catalysts for Higher Alcohol Synthesis from Syngas by Exploiting Support and Promoter Effects, Energy Technol. 7 (2019) 1801102. https://doi.org/10.1002/ente.201801102. [90] E. Valle M.S. Duyar J.L. Snider S.K. Regli M. Rønning A. Gallo T.F. Jaramillo In Situ Studies of the Formation of MoP Catalysts and Their Structure under Reaction Conditions for Higher Alcohol Synthesis: the Role of Promoters and Mesoporous Supports J. Phys. Chem. C 126 2022 5575 5583 10.1021/acs.jpcc.2c00837 E. Valle, M.S. Duyar, J.L. Snider, S.K. Regli, M. Rønning, A. Gallo, T.F. Jaramillo, In Situ Studies of the Formation of MoP Catalysts and Their Structure under Reaction Conditions for Higher Alcohol Synthesis: the Role of Promoters and Mesoporous Supports, J. Phys. Chem. C 126 (2022) 5575–5583. https://doi.org/10.1021/acs.jpcc.2c00837. [91] S.F. Zaman N. Pasupulety A.A. Al-Zahrani M.A. Daous S.S. Al-Shahrani H. Driss L.A. Petrov K.J. Smith Carbon monoxide hydrogenation on potassium promoted Mo2N catalysts Appl. Catal. A: Gen. 532 2017 133 145 10.1016/j.apcata.2016.12.015 S.F. Zaman, N. Pasupulety, A.A. Al-Zahrani, M.A. Daous, S.S. Al-Shahrani, H. Driss, L.A. Petrov, K.J. Smith, Carbon monoxide hydrogenation on potassium promoted Mo2N catalysts, Appl. Catal. A: Gen. 532 (2017) 133–145. https://doi.org/10.1016/j.apcata.2016.12.015. [92] S.F. Zaman N. Pasupulety A.A. Al-Zahrani M.A. Daous H. Driss S.S. Al-Shahrani L. Petrov Influence of alkali metal (Li and Cs) addition to Mo2N catalyst for CO hydrogenation to hydrocarbons and oxygenates Can. J. Chem. Eng. 96 2018 1770 1779 10.1002/cjce.23144 S.F. Zaman, N. Pasupulety, A.A. Al-Zahrani, M.A. Daous, H. Driss, S.S. Al-Shahrani, L. Petrov, Influence of alkali metal (Li and Cs) addition to Mo2N catalyst for CO hydrogenation to hydrocarbons and oxygenates, Can. J. Chem. Eng. 96 (2018) 1770–1779. https://doi.org/10.1002/cjce.23144. [93] H. Qu S. He Y. Su Y. Zhang H. Su MoSe2: a promising non-noble metal catalyst for direct ethanol synthesis from syngas Fuel 281 2020 118760 10.1016/j.fuel.2020.118760 H. Qu, S. He, Y. Su, Y. Zhang, H. Su, MoSe2: a promising non-noble metal catalyst for direct ethanol synthesis from syngas, Fuel 281 (2020) 118760. https://doi.org/10.1016/j.fuel.2020.118760. [94] X.-M. Wu Y.-Y. Guo J.-M. Zhou G.-D. Lin X. Dong H.-B. Zhang Co-decorated carbon nanotubes as a promoter of Co–Mo–K oxide catalyst for synthesis of higher alcohols from syngas Appl. Catal. A: Gen. 340 2008 87 97 10.1016/j.apcata.2007.09.051 X.-M. Wu, Y.-Y. Guo, J.-M. Zhou, G.-D. Lin, X. Dong, H.-B. Zhang, Co-decorated carbon nanotubes as a promoter of Co–Mo–K oxide catalyst for synthesis of higher alcohols from syngas, Appl. Catal. A: Gen. 340 (2008) 87–97. https://doi.org/10.1016/j.apcata.2007.09.051. [95] S.F. Zaman K.J. Smith Synthesis gas conversion over a Rh–K–MoP/SiO2 catalyst Catal. Today 171 2011 266 274 10.1016/j.cattod.2011.02.017 S.F. Zaman, K.J. Smith, Synthesis gas conversion over a Rh–K–MoP/SiO2 catalyst, Catal. Today 171 (2011) 266–274. https://doi.org/10.1016/j.cattod.2011.02.017. [96] W. Xie L. Ji J. Zhou H. Pan J. Zhu Y. Zhang S. Sun J. Bao C. Gao Effect of Mn Promoter on Structure and Performance of K-Co-Mo Catalyst for Synthesis of Higher Alcohols from CO Hydrogenation Chine. J. Chem. Phys. 29 2016 671 680 10.1063/1674-0068/29/cjcp1604070 W. Xie, L. Ji, J. Zhou, H. Pan, J. Zhu, Y. Zhang, S. Sun, J. Bao, C. Gao, Effect of Mn Promoter on Structure and Performance of K-Co-Mo Catalyst for Synthesis of Higher Alcohols from CO Hydrogenation, Chine. J. Chem. Phys. 29 (2016) 671–680. https://doi.org/10.1063/1674-0068/29/cjcp1604070. [97] L. Zhang M.R. Ball K.R. Rivera-Dones S. Wang T.F. Kuech G.W. Huber I. Hermans J.A. Dumesic Synthesis Gas Conversion Over Molybdenum-Based Catalysts Promoted by Transition Metals ACS. Catal. 10 2020 365 374 10.1021/acscatal.9b03968 L. Zhang, M.R. Ball, K.R. Rivera-Dones, S. Wang, T.F. Kuech, G.W. Huber, I. Hermans, J.A. Dumesic, Synthesis Gas Conversion Over Molybdenum-Based Catalysts Promoted by Transition Metals, ACS. Catal.. 10 (2020) 365–374. https://doi.org/10.1021/acscatal.9b03968. [98] G. Bian L. Fan Y. Fu K. Fujimoto High temperature calcined K–MoO3/γ-Al2O3 catalysts for mixed alcohols synthesis from syngas: effects of Mo loadings Appl. Catal. A: Gen. 170 1998 255 268 10.1016/S0926-860X(98)00053-2 G. Bian, L. Fan, Y. Fu, K. Fujimoto, High temperature calcined K–MoO3/γ-Al2O3 catalysts for mixed alcohols synthesis from syngas: effects of Mo loadings, Appl. Catal. A: Gen. 170 (1998) 255–268. https://doi.org/10.1016/S0926-860X(98)00053-2. [99] B. Kang S. Qi X. Wang F. Bai N. Wang R. Hu Y. Zhang H. Su Ultra-small and highly-dispersed MoP particles for remarkable enhanced catalytic performance in higher alcohols synthesis Catal. Commun. 137 2020 105945 10.1016/j.catcom.2020.105945 B. Kang, S. Qi, X. Wang, F. Bai, N. Wang, R. Hu, Y. Zhang, H. Su, Ultra-small and highly-dispersed MoP particles for remarkable enhanced catalytic performance in higher alcohols synthesis, Catal. Commun. 137 (2020) 105945. https://doi.org/10.1016/j.catcom.2020.105945. [100] F. Zhang Y. Li S. Gao H. Fang X. Liang Y. Yuan Synthesis of higher alcohols by CO hydrogenation on a K-promoted Ni–Mo catalyst derived from Ni–Mo phyllosilicate Catal. Sci. Technol. 8 2018 4219 4228 10.1039/C8CY01095A F. Zhang, Y. Li, S. Gao, H. Fang, X. Liang, Y. Yuan, Synthesis of higher alcohols by CO hydrogenation on a K-promoted Ni–Mo catalyst derived from Ni–Mo phyllosilicate, Catal. Sci. Technol. 8 (2018) 4219–4228. https://doi.org/10.1039/C8CY01095A. [101] C.-H. Ma H.-Y. Li G.-D. Lin H.-B. Zhang Ni-decorated carbon nanotube-promoted Ni–Mo–K catalyst for highly efficient synthesis of higher alcohols from syngas Appl. Catal. B: Environ. 100 2010 245 253 10.1016/j.apcatb.2010.07.040 C.-H. Ma, H.-Y. Li, G.-D. Lin, H.-B. Zhang, Ni-decorated carbon nanotube-promoted Ni–Mo–K catalyst for highly efficient synthesis of higher alcohols from syngas, Appl. Catal. B: Environ. 100 (2010) 245–253. https://doi.org/10.1016/j.apcatb.2010.07.040. [102] M. Lv W. Xie S. Sun G. Wu L. Zheng S. Chu C. Gao J. Bao Activated-carbon-supported K–Co–Mo catalysts for synthesis of higher alcohols from syngas Catal. Sci. Technol. 5 2015 2925 2934 10.1039/C5CY00083A M. Lv, W. Xie, S. Sun, G. Wu, L. Zheng, S. Chu, C. Gao, J. Bao, Activated-carbon-supported K–Co–Mo catalysts for synthesis of higher alcohols from syngas, Catal. Sci. Technol. 5 (2015) 2925–2934. https://doi.org/10.1039/C5CY00083A. [103] E.T. Liakakou E. Heracleous K.S. Triantafyllidis A.A. Lemonidou K-promoted NiMo catalysts supported on activated carbon for the hydrogenation reaction of CO to higher alcohols: effect of support and active metal Appl. Catal. B: Environ. 165 2015 296 305 10.1016/j.apcatb.2014.10.027 E.T. Liakakou, E. Heracleous, K.S. Triantafyllidis, A.A. Lemonidou, K-promoted NiMo catalysts supported on activated carbon for the hydrogenation reaction of CO to higher alcohols: effect of support and active metal, Appl. Catal. B: Environ. 165 (2015) 296–305. https://doi.org/10.1016/j.apcatb.2014.10.027. [104] H. Svedhem, Carbon nanofibres-supported KCoMo catalysts for syngas conversion into higher alcohols, 2016. [105] A. Tavasoli S. Karimi M. Davari N. Nasrollahi T. Nematian Enhancement of MoO3–K2O/CNTs nanocatalyst activity and selectivity in higher alcohols synthesis using microemulsion technique J. Ind. Eng. Chem. 20 2014 674 681 10.1016/j.jiec.2013.05.032 A. Tavasoli, S. Karimi, M. Davari, N. Nasrollahi, T. Nematian, Enhancement of MoO3–K2O/CNTs nanocatalyst activity and selectivity in higher alcohols synthesis using microemulsion technique, J. Ind. Eng. Chem. 20 (2014) 674–681. https://doi.org/10.1016/j.jiec.2013.05.032. [106] J. Li R. Hu H. Qu Y. Su N. Wang H. Su X. Gu Radio-frequency thermal plasma-induced novel chainmail-like core-shell MoO2 as highly stable catalyst for converting syngas to higher alcohols Appl. Catal. B: Environ. 249 2019 63 71 10.1016/j.apcatb.2019.02.060 J. Li, R. Hu, H. Qu, Y. Su, N. Wang, H. Su, X. Gu, Radio-frequency thermal plasma-induced novel chainmail-like core-shell MoO2 as highly stable catalyst for converting syngas to higher alcohols, Appl. Catal. B: Environ. 249 (2019) 63–71. https://doi.org/10.1016/j.apcatb.2019.02.060. [107] Anon Atsushi Muramatsu/Takashi Tatsumi/Hiroo Tominaga Active species of molybdenum for alcohol synthesis from carbon monoxide-hydrogen J. Phys. Chem. 96 1992 1334 1340 Anon. Atsushi Muramatsu/Takashi Tatsumi/Hiroo Tominaga, Active species of molybdenum for alcohol synthesis from carbon monoxide-hydrogen, J. Phys. Chem. 96 (1992) 1334–1340. [108] J.A. Schaidle L.T. Thompson Fischer–Tropsch synthesis over early transition metal carbides and nitrides: CO activation and chain growth J. Catal. 329 2015 325 334 10.1016/j.jcat.2015.05.020 J.A. Schaidle, L.T. Thompson, Fischer–Tropsch synthesis over early transition metal carbides and nitrides: CO activation and chain growth, J. Catal. 329 (2015) 325–334. https://doi.org/10.1016/j.jcat.2015.05.020.",
      "scopus-id": "85203011495",
      "coredata": {
        "eid": "1-s2.0-S2468823124006904",
        "dc:description": "The energy and environmental crises are becoming increasingly severe. Syngas, derived from coal, oil, biomass and other materials as an important platform for the conversion of matter and energy, can converted to the higher alcohols. Higher alcohols are important industrial raw materials and transportation fuels. Therefore, the synthesis of higher alcohols from syngas can effectively alleviate the energy and environmental crises. Despite decades of research, it is regrettable that the syngas to higher alcohols is still in the experimental research stage and has not yet been industrialized. This review comprehensively introduces the current status and progress of Mo-based catalysts for the syngas to higher alcohols. It is divided into three parts: MoS2, Mo2C and other Mo-based catalysts (MoOx, MoP, Mo2N and MoSe2) applied in the syngas to higher alcohols. Each part includes the promoters (alkaline promoters and transition metal promoters), active phase of catalysts, support, the preparation method and catalytic mechanism. The structure-activity relationship of catalysts, catalyst preparation and catalytic mechanism are emphasized to highlight the recent progress and challenges of Mo-based catalysts. The purpose of this review is to provide a comprehensive summary of Mo-based catalysts for the syngas to higher alcohols to provide a reference for the design, development and future perspective of Mo-based catalysts.",
        "openArchiveArticle": "false",
        "prism:coverDate": "2024-11-30",
        "openaccessUserLicense": null,
        "prism:aggregationType": "Journal",
        "prism:url": "https://api.elsevier.com/content/article/pii/S2468823124006904",
        "dc:creator": [
          {
            "@_fa": "true",
            "$": "Yangbin, Ren"
          },
          {
            "@_fa": "true",
            "$": "Yujing, Weng"
          },
          {
            "@_fa": "true",
            "$": "Yiqing, Zhang"
          },
          {
            "@_fa": "true",
            "$": "Chao, Huang"
          },
          {
            "@_fa": "true",
            "$": "Yulong, Zhang"
          },
          {
            "@_fa": "true",
            "$": "Qi, Sun"
          }
        ],
        "link": [
          {
            "@_fa": "true",
            "@rel": "self",
            "@href": "https://api.elsevier.com/content/article/pii/S2468823124006904"
          },
          {
            "@_fa": "true",
            "@rel": "scidir",
            "@href": "https://www.sciencedirect.com/science/article/pii/S2468823124006904"
          }
        ],
        "dc:format": "application/json",
        "openaccessType": null,
        "pii": "S2468-8231(24)00690-4",
        "prism:volume": "568",
        "articleNumber": "114508",
        "prism:publisher": "Elsevier B.V. All rights are reserved, including those for text and data mining, AI training, and similar technologies.",
        "dc:title": "Recent advances of Mo-based catalysts for synthesizing higher alcohols from Syngas",
        "prism:copyright": "© 2024 Elsevier B.V. All rights are reserved, including those for text and data mining, AI training, and similar technologies.",
        "openaccess": "0",
        "prism:issn": "24688231",
        "dcterms:subject": [
          {
            "@_fa": "true",
            "$": "Syngas"
          },
          {
            "@_fa": "true",
            "$": "Higher alcohols"
          },
          {
            "@_fa": "true",
            "$": "MoS2"
          },
          {
            "@_fa": "true",
            "$": "Mo2C"
          },
          {
            "@_fa": "true",
            "$": "Mo-based catalysts"
          }
        ],
        "openaccessArticle": "false",
        "prism:publicationName": "Molecular Catalysis",
        "openaccessSponsorType": null,
        "prism:pageRange": "114508",
        "pubType": "rev",
        "prism:coverDisplayDate": "November 2024",
        "prism:doi": "10.1016/j.mcat.2024.114508",
        "prism:startingPage": "114508",
        "dc:identifier": "doi:10.1016/j.mcat.2024.114508",
        "openaccessSponsorName": null
      },
      "objects": {
        "object": [
          {
            "@category": "standard",
            "@height": "593",
            "@width": "678",
            "@_fa": "true",
            "$": "https://api.elsevier.com/content/object/eid/1-s2.0-S2468823124006904-gr8.jpg?httpAccept=%2A%2F%2A",
            "@multimediatype": "JPEG image file",
            "@type": "IMAGE-DOWNSAMPLED",
            "@size": "108942",
            "@ref": "gr8",
            "@mimetype": "image/jpeg"
          },
          {
            "@category": "standard",
            "@height": "265",
            "@width": "527",
            "@_fa": "true",
            "$": "https://api.elsevier.com/content/object/eid/1-s2.0-S2468823124006904-gr7.jpg?httpAccept=%2A%2F%2A",
            "@multimediatype": "JPEG image file",
            "@type": "IMAGE-DOWNSAMPLED",
            "@size": "61952",
            "@ref": "gr7",
            "@mimetype": "image/jpeg"
          },
          {
            "@category": "standard",
            "@height": "224",
            "@width": "781",
            "@_fa": "true",
            "$": "https://api.elsevier.com/content/object/eid/1-s2.0-S2468823124006904-gr6.jpg?httpAccept=%2A%2F%2A",
            "@multimediatype": "JPEG image file",
            "@type": "IMAGE-DOWNSAMPLED",
            "@size": "55743",
            "@ref": "gr6",
            "@mimetype": "image/jpeg"
          },
          {
            "@category": "standard",
            "@height": "414",
            "@width": "565",
            "@_fa": "true",
            "$": "https://api.elsevier.com/content/object/eid/1-s2.0-S2468823124006904-gr5.jpg?httpAccept=%2A%2F%2A",
            "@multimediatype": "JPEG image file",
            "@type": "IMAGE-DOWNSAMPLED",
            "@size": "46427",
            "@ref": "gr5",
            "@mimetype": "image/jpeg"
          },
          {
            "@category": "standard",
            "@height": "265",
            "@width": "527",
            "@_fa": "true",
            "$": "https://api.elsevier.com/content/object/eid/1-s2.0-S2468823124006904-gr11.jpg?httpAccept=%2A%2F%2A",
            "@multimediatype": "JPEG image file",
            "@type": "IMAGE-DOWNSAMPLED",
            "@size": "65855",
            "@ref": "gr11",
            "@mimetype": "image/jpeg"
          },
          {
            "@category": "standard",
            "@height": "220",
            "@width": "715",
            "@_fa": "true",
            "$": "https://api.elsevier.com/content/object/eid/1-s2.0-S2468823124006904-gr10.jpg?httpAccept=%2A%2F%2A",
            "@multimediatype": "JPEG image file",
            "@type": "IMAGE-DOWNSAMPLED",
            "@size": "40749",
            "@ref": "gr10",
            "@mimetype": "image/jpeg"
          },
          {
            "@category": "standard",
            "@height": "527",
            "@width": "781",
            "@_fa": "true",
            "$": "https://api.elsevier.com/content/object/eid/1-s2.0-S2468823124006904-gr9.jpg?httpAccept=%2A%2F%2A",
            "@multimediatype": "JPEG image file",
            "@type": "IMAGE-DOWNSAMPLED",
            "@size": "113138",
            "@ref": "gr9",
            "@mimetype": "image/jpeg"
          },
          {
            "@category": "standard",
            "@height": "436",
            "@width": "565",
            "@_fa": "true",
            "$": "https://api.elsevier.com/content/object/eid/1-s2.0-S2468823124006904-gr12.jpg?httpAccept=%2A%2F%2A",
            "@multimediatype": "JPEG image file",
            "@type": "IMAGE-DOWNSAMPLED",
            "@size": "35970",
            "@ref": "gr12",
            "@mimetype": "image/jpeg"
          },
          {
            "@category": "standard",
            "@height": "345",
            "@width": "602",
            "@_fa": "true",
            "$": "https://api.elsevier.com/content/object/eid/1-s2.0-S2468823124006904-gr4.jpg?httpAccept=%2A%2F%2A",
            "@multimediatype": "JPEG image file",
            "@type": "IMAGE-DOWNSAMPLED",
            "@size": "96808",
            "@ref": "gr4",
            "@mimetype": "image/jpeg"
          },
          {
            "@category": "standard",
            "@height": "453",
            "@width": "640",
            "@_fa": "true",
            "$": "https://api.elsevier.com/content/object/eid/1-s2.0-S2468823124006904-gr3.jpg?httpAccept=%2A%2F%2A",
            "@multimediatype": "JPEG image file",
            "@type": "IMAGE-DOWNSAMPLED",
            "@size": "71811",
            "@ref": "gr3",
            "@mimetype": "image/jpeg"
          },
          {
            "@category": "standard",
            "@height": "561",
            "@width": "781",
            "@_fa": "true",
            "$": "https://api.elsevier.com/content/object/eid/1-s2.0-S2468823124006904-gr2.jpg?httpAccept=%2A%2F%2A",
            "@multimediatype": "JPEG image file",
            "@type": "IMAGE-DOWNSAMPLED",
            "@size": "133812",
            "@ref": "gr2",
            "@mimetype": "image/jpeg"
          },
          {
            "@category": "standard",
            "@height": "329",
            "@width": "678",
            "@_fa": "true",
            "$": "https://api.elsevier.com/content/object/eid/1-s2.0-S2468823124006904-gr1.jpg?httpAccept=%2A%2F%2A",
            "@multimediatype": "JPEG image file",
            "@type": "IMAGE-DOWNSAMPLED",
            "@size": "88013",
            "@ref": "gr1",
            "@mimetype": "image/jpeg"
          },
          {
            "@category": "standard",
            "@height": "200",
            "@width": "428",
            "@_fa": "true",
            "$": "https://api.elsevier.com/content/object/eid/1-s2.0-S2468823124006904-ga1.jpg?httpAccept=%2A%2F%2A",
            "@multimediatype": "JPEG image file",
            "@type": "IMAGE-DOWNSAMPLED",
            "@size": "34626",
            "@ref": "ga1",
            "@mimetype": "image/jpeg"
          },
          {
            "@category": "thumbnail",
            "@height": "164",
            "@width": "187",
            "@_fa": "true",
            "$": "https://api.elsevier.com/content/object/eid/1-s2.0-S2468823124006904-gr8.sml?httpAccept=%2A%2F%2A",
            "@multimediatype": "GIF image file",
            "@type": "IMAGE-THUMBNAIL",
            "@size": "18874",
            "@ref": "gr8",
            "@mimetype": "image/gif"
          },
          {
            "@category": "thumbnail",
            "@height": "110",
            "@width": "219",
            "@_fa": "true",
            "$": "https://api.elsevier.com/content/object/eid/1-s2.0-S2468823124006904-gr7.sml?httpAccept=%2A%2F%2A",
            "@multimediatype": "GIF image file",
            "@type": "IMAGE-THUMBNAIL",
            "@size": "17829",
            "@ref": "gr7",
            "@mimetype": "image/gif"
          },
          {
            "@category": "thumbnail",
            "@height": "63",
            "@width": "219",
            "@_fa": "true",
            "$": "https://api.elsevier.com/content/object/eid/1-s2.0-S2468823124006904-gr6.sml?httpAccept=%2A%2F%2A",
            "@multimediatype": "GIF image file",
            "@type": "IMAGE-THUMBNAIL",
            "@size": "8310",
            "@ref": "gr6",
            "@mimetype": "image/gif"
          },
          {
            "@category": "thumbnail",
            "@height": "161",
            "@width": "219",
            "@_fa": "true",
            "$": "https://api.elsevier.com/content/object/eid/1-s2.0-S2468823124006904-gr5.sml?httpAccept=%2A%2F%2A",
            "@multimediatype": "GIF image file",
            "@type": "IMAGE-THUMBNAIL",
            "@size": "11360",
            "@ref": "gr5",
            "@mimetype": "image/gif"
          },
          {
            "@category": "thumbnail",
            "@height": "110",
            "@width": "219",
            "@_fa": "true",
            "$": "https://api.elsevier.com/content/object/eid/1-s2.0-S2468823124006904-gr11.sml?httpAccept=%2A%2F%2A",
            "@multimediatype": "GIF image file",
            "@type": "IMAGE-THUMBNAIL",
            "@size": "20466",
            "@ref": "gr11",
            "@mimetype": "image/gif"
          },
          {
            "@category": "thumbnail",
            "@height": "67",
            "@width": "219",
            "@_fa": "true",
            "$": "https://api.elsevier.com/content/object/eid/1-s2.0-S2468823124006904-gr10.sml?httpAccept=%2A%2F%2A",
            "@multimediatype": "GIF image file",
            "@type": "IMAGE-THUMBNAIL",
            "@size": "7451",
            "@ref": "gr10",
            "@mimetype": "image/gif"
          },
          {
            "@category": "thumbnail",
            "@height": "148",
            "@width": "219",
            "@_fa": "true",
            "$": "https://api.elsevier.com/content/object/eid/1-s2.0-S2468823124006904-gr9.sml?httpAccept=%2A%2F%2A",
            "@multimediatype": "GIF image file",
            "@type": "IMAGE-THUMBNAIL",
            "@size": "14546",
            "@ref": "gr9",
            "@mimetype": "image/gif"
          },
          {
            "@category": "thumbnail",
            "@height": "163",
            "@width": "212",
            "@_fa": "true",
            "$": "https://api.elsevier.com/content/object/eid/1-s2.0-S2468823124006904-gr12.sml?httpAccept=%2A%2F%2A",
            "@multimediatype": "GIF image file",
            "@type": "IMAGE-THUMBNAIL",
            "@size": "5570",
            "@ref": "gr12",
            "@mimetype": "image/gif"
          },
          {
            "@category": "thumbnail",
            "@height": "126",
            "@width": "219",
            "@_fa": "true",
            "$": "https://api.elsevier.com/content/object/eid/1-s2.0-S2468823124006904-gr4.sml?httpAccept=%2A%2F%2A",
            "@multimediatype": "GIF image file",
            "@type": "IMAGE-THUMBNAIL",
            "@size": "17775",
            "@ref": "gr4",
            "@mimetype": "image/gif"
          },
          {
            "@category": "thumbnail",
            "@height": "155",
            "@width": "219",
            "@_fa": "true",
            "$": "https://api.elsevier.com/content/object/eid/1-s2.0-S2468823124006904-gr3.sml?httpAccept=%2A%2F%2A",
            "@multimediatype": "GIF image file",
            "@type": "IMAGE-THUMBNAIL",
            "@size": "10688",
            "@ref": "gr3",
            "@mimetype": "image/gif"
          },
          {
            "@category": "thumbnail",
            "@height": "157",
            "@width": "219",
            "@_fa": "true",
            "$": "https://api.elsevier.com/content/object/eid/1-s2.0-S2468823124006904-gr2.sml?httpAccept=%2A%2F%2A",
            "@multimediatype": "GIF image file",
            "@type": "IMAGE-THUMBNAIL",
            "@size": "19479",
            "@ref": "gr2",
            "@mimetype": "image/gif"
          },
          {
            "@category": "thumbnail",
            "@height": "106",
            "@width": "219",
            "@_fa": "true",
            "$": "https://api.elsevier.com/content/object/eid/1-s2.0-S2468823124006904-gr1.sml?httpAccept=%2A%2F%2A",
            "@multimediatype": "GIF image file",
            "@type": "IMAGE-THUMBNAIL",
            "@size": "15551",
            "@ref": "gr1",
            "@mimetype": "image/gif"
          },
          {
            "@category": "thumbnail",
            "@height": "102",
            "@width": "219",
            "@_fa": "true",
            "$": "https://api.elsevier.com/content/object/eid/1-s2.0-S2468823124006904-ga1.sml?httpAccept=%2A%2F%2A",
            "@multimediatype": "GIF image file",
            "@type": "IMAGE-THUMBNAIL",
            "@size": "10395",
            "@ref": "ga1",
            "@mimetype": "image/gif"
          },
          {
            "@category": "high",
            "@height": "2623",
            "@width": "3000",
            "@_fa": "true",
            "$": "https://api.elsevier.com/content/object/eid/1-s2.0-S2468823124006904-gr8_lrg.jpg?httpAccept=%2A%2F%2A",
            "@multimediatype": "JPEG image file",
            "@type": "IMAGE-HIGH-RES",
            "@size": "973525",
            "@ref": "gr8",
            "@mimetype": "image/jpeg"
          },
          {
            "@category": "high",
            "@height": "1174",
            "@width": "2333",
            "@_fa": "true",
            "$": "https://api.elsevier.com/content/object/eid/1-s2.0-S2468823124006904-gr7_lrg.jpg?httpAccept=%2A%2F%2A",
            "@multimediatype": "JPEG image file",
            "@type": "IMAGE-HIGH-RES",
            "@size": "699550",
            "@ref": "gr7",
            "@mimetype": "image/jpeg"
          },
          {
            "@category": "high",
            "@height": "991",
            "@width": "3458",
            "@_fa": "true",
            "$": "https://api.elsevier.com/content/object/eid/1-s2.0-S2468823124006904-gr6_lrg.jpg?httpAccept=%2A%2F%2A",
            "@multimediatype": "JPEG image file",
            "@type": "IMAGE-HIGH-RES",
            "@size": "391104",
            "@ref": "gr6",
            "@mimetype": "image/jpeg"
          },
          {
            "@category": "high",
            "@height": "1834",
            "@width": "2500",
            "@_fa": "true",
            "$": "https://api.elsevier.com/content/object/eid/1-s2.0-S2468823124006904-gr5_lrg.jpg?httpAccept=%2A%2F%2A",
            "@multimediatype": "JPEG image file",
            "@type": "IMAGE-HIGH-RES",
            "@size": "363214",
            "@ref": "gr5",
            "@mimetype": "image/jpeg"
          },
          {
            "@category": "high",
            "@height": "1172",
            "@width": "2333",
            "@_fa": "true",
            "$": "https://api.elsevier.com/content/object/eid/1-s2.0-S2468823124006904-gr11_lrg.jpg?httpAccept=%2A%2F%2A",
            "@multimediatype": "JPEG image file",
            "@type": "IMAGE-HIGH-RES",
            "@size": "797460",
            "@ref": "gr11",
            "@mimetype": "image/jpeg"
          },
          {
            "@category": "high",
            "@height": "976",
            "@width": "3167",
            "@_fa": "true",
            "$": "https://api.elsevier.com/content/object/eid/1-s2.0-S2468823124006904-gr10_lrg.jpg?httpAccept=%2A%2F%2A",
            "@multimediatype": "JPEG image file",
            "@type": "IMAGE-HIGH-RES",
            "@size": "317692",
            "@ref": "gr10",
            "@mimetype": "image/jpeg"
          },
          {
            "@category": "high",
            "@height": "2335",
            "@width": "3458",
            "@_fa": "true",
            "$": "https://api.elsevier.com/content/object/eid/1-s2.0-S2468823124006904-gr9_lrg.jpg?httpAccept=%2A%2F%2A",
            "@multimediatype": "JPEG image file",
            "@type": "IMAGE-HIGH-RES",
            "@size": "968580",
            "@ref": "gr9",
            "@mimetype": "image/jpeg"
          },
          {
            "@category": "high",
            "@height": "1928",
            "@width": "2500",
            "@_fa": "true",
            "$": "https://api.elsevier.com/content/object/eid/1-s2.0-S2468823124006904-gr12_lrg.jpg?httpAccept=%2A%2F%2A",
            "@multimediatype": "JPEG image file",
            "@type": "IMAGE-HIGH-RES",
            "@size": "254023",
            "@ref": "gr12",
            "@mimetype": "image/jpeg"
          },
          {
            "@category": "high",
            "@height": "1529",
            "@width": "2667",
            "@_fa": "true",
            "$": "https://api.elsevier.com/content/object/eid/1-s2.0-S2468823124006904-gr4_lrg.jpg?httpAccept=%2A%2F%2A",
            "@multimediatype": "JPEG image file",
            "@type": "IMAGE-HIGH-RES",
            "@size": "851771",
            "@ref": "gr4",
            "@mimetype": "image/jpeg"
          },
          {
            "@category": "high",
            "@height": "2005",
            "@width": "2833",
            "@_fa": "true",
            "$": "https://api.elsevier.com/content/object/eid/1-s2.0-S2468823124006904-gr3_lrg.jpg?httpAccept=%2A%2F%2A",
            "@multimediatype": "JPEG image file",
            "@type": "IMAGE-HIGH-RES",
            "@size": "494078",
            "@ref": "gr3",
            "@mimetype": "image/jpeg"
          },
          {
            "@category": "high",
            "@height": "2483",
            "@width": "3458",
            "@_fa": "true",
            "$": "https://api.elsevier.com/content/object/eid/1-s2.0-S2468823124006904-gr2_lrg.jpg?httpAccept=%2A%2F%2A",
            "@multimediatype": "JPEG image file",
            "@type": "IMAGE-HIGH-RES",
            "@size": "1100208",
            "@ref": "gr2",
            "@mimetype": "image/jpeg"
          },
          {
            "@category": "high",
            "@height": "1457",
            "@width": "3000",
            "@_fa": "true",
            "$": "https://api.elsevier.com/content/object/eid/1-s2.0-S2468823124006904-gr1_lrg.jpg?httpAccept=%2A%2F%2A",
            "@multimediatype": "JPEG image file",
            "@type": "IMAGE-HIGH-RES",
            "@size": "741458",
            "@ref": "gr1",
            "@mimetype": "image/jpeg"
          },
          {
            "@category": "high",
            "@height": "886",
            "@width": "1897",
            "@_fa": "true",
            "$": "https://api.elsevier.com/content/object/eid/1-s2.0-S2468823124006904-ga1_lrg.jpg?httpAccept=%2A%2F%2A",
            "@multimediatype": "JPEG image file",
            "@type": "IMAGE-HIGH-RES",
            "@size": "216813",
            "@ref": "ga1",
            "@mimetype": "image/jpeg"
          },
          {
            "@category": "standard",
            "@_fa": "true",
            "$": "https://api.elsevier.com/content/object/eid/1-s2.0-S2468823124006904-am.pdf?httpAccept=%2A%2F%2A",
            "@multimediatype": "Acrobat PDF file",
            "@type": "AAM-PDF",
            "@size": "1743500",
            "@ref": "am",
            "@mimetype": "application/pdf"
          }
        ]
      },
      "link": {
        "@rel": "abstract",
        "@href": "https://api.elsevier.com/content/abstract/scopus_id/85203011495"
      }
    }
  }
}