{
  "metadata": {
    "title": "High carrier mobility ZrSSe/SnX (X=S, Se, S<ce:inf loc=post>2</ce:inf>, Se<ce:inf loc=post>2</ce:inf>) vdW heterostructures for photocatalytic overall water splitting: A first-principles study",
    "authors": "; ; ",
    "journal": "Molecular Catalysis",
    "date": "2024-01-15",
    "doi": "10.1016/j.mcat.2023.113716",
    "abstract": "",
    "uri": "https://api.elsevier.com/content/article/pii/S246882312300799X",
    "pii": "S246882312300799X"
  },
  "fulltext": {
    "full-text-retrieval-response": {
      "scopus-eid": "2-s2.0-85183669193",
      "originalText": "serial JL 315758 291210 291744 291790 291809 31 Molecular Catalysis MOLECULARCATALYSIS 2023-11-25 2023-11-25 2023-11-25 2023-11-25 2024-01-14T03:56:07 1-s2.0-S246882312300799X S2468-8231(23)00799-X S246882312300799X 10.1016/j.mcat.2023.113716 S300 S300.1 FULL-TEXT 1-s2.0-S2468823123X00194 2024-02-03T12:24:03.252463Z 0 0 20240115 2024 2023-11-25T11:48:08.941856Z absattachment articleinfo articlenumber articletitlenorm authfirstinitialnorm authfirstsurnamenorm cid cids contenttype copyright crossmark dateloaded dateloadedtxt datesearch datesort dateupdated dco docsubtype doctype doi eid ewtransactionid hubeid indexeddate issn issnnorm itemstage itemtransactionid itemweight openaccess openarchive pg pgfirst pii piinorm pubdatestart pubdatetxt pubyr sectiontitle sortorder srctitle srctitlenorm srctype ssids alllist content subj subheadings suppl tomb volfirst volissue volumelist webpdf webpdfpagecount yearnav figure table e-component body mmlmath acknowledge affil appendices articletitle auth authfirstini authfull authkeywords authlast grantnumber grantsponsor highlightsabst orcid primabst pubtype ref specialabst 2468-8231 24688231 true 553 553 C Volume 553 8 113716 113716 113716 20240115 15 January 2024 2024-01-15 2024 Regular Papers article fla © 2023 Elsevier B.V. All rights reserved. HIGHCARRIERMOBILITYZRSSESNXXSSES2SE2VDWHETEROSTRUCTURESFORPHOTOCATALYTICOVERALLWATERSPLITTINGAFIRSTPRINCIPLESSTUDY TARIQ Z Introduction Computational method Results and discussion Structural optimization Stability Electronic properties Density of states Band alignment Absorption Charge density Mobility Conclusion Data availability Acknowledgments Appendix Supplementary materials References TURNER 1999 J RASUL 2016 M CLEANENERGYFORSUSTAINABLEDEVELOPMENTCOMPARISONSCONTRASTSNEWAPPROACHES SHEU 2017 86 90 J MOMIRLAN 2005 795 802 M SHANSHAN 2016 1447 1457 T TRANCIK 2014 300 302 J PRAKASH 2018 205 212 A NOVOSELOV 2016 aac9439 K WANG 2021 092001 D WANG 2015 5246 5254 S HU 2013 2325 2332 X CHEN 2017 460 464 P TSAI 2014 8317 8322 M LIU 2016 1 17 Y WONG 2017 7230 7240 J ZHANG 2015 298 305 Z SU 2019 1801702 J FAN 2018 27803 27810 Y LI 2022 021701 C MANIADAKI 2016 33 39 A SAADATI 2023 169594 A LIU 2022 214544 X RANI 2022 15381 15390 S GAO 2016 98 108 X GUO 2019 16 23 S NGUYEN 2020 114369 C CLARK 2005 567 570 S TARIQ 2019 7495 7503 Z PERDEW 1996 3865 J PERDEW 1993 4978 J LIU 1989 503 528 D NOCEDAL 1980 773 782 J GRIMME 2010 154104 S MONKHORST 1976 5188 H KRUKAU 2006 224106 A WANG 2004 214111 J MOUHAT 2014 224104 F REHMAN 2022 416 427 S YANG 2019 163789 A HEYD 2005 174101 J GRATZEL 2001 338 344 M NISAR 2012 181903 J ZHI 2020 2001070 Y BUTLER 1978 228 M LIU 2011 191903 J MA 2012 25074 25080 Z PERDEW 1983 1884 J TOROKER 2011 16644 16654 M WU 2019 18628 18639 S HAO 2010 063531 A XUECHU 1992 S SEMICONDUCTORSPECTRAOPTICALPROPERTIES GAO 2022 153942 X REHMAN 2019 143101 G LIU 2022 153025 J YANG 2018 4161 4166 H BRUZZONE 2011 222108 S YU 2023 10769 10777 W GIACOMETTI 2011 147 150 V HE 2023 102634 X SUCHARITAKUL 2015 3815 3819 S LI 2023 156544 X QIAN 2023 155306 G TENG 2021 16242 16247 S LI 2019 7559 7566 X LIU 2014 4033 4041 H XI 2012 4348 4369 J TARIQX2024X113716 TARIQX2024X113716XZ 2025-11-25T00:00:00.000Z 2025-11-25T00:00:00.000Z http://creativecommons.org/licenses/by-nc-nd/4.0/ © 2023 Elsevier B.V. All rights reserved. 2024-02-03T12:05:50.104Z http://vtw.elsevier.com/data/voc/AddOnTypes/50.7/aggregated-refined National Key Research and Development Program of China 2018YFB2200500 NKRDPC National Key Research and Development Program of China http://data.elsevier.com/vocabulary/SciValFunders/501100012166 http://sws.geonames.org/1814991/ National Natural Science Foundation of China 12174462 12174462,62274190,61974170,61934007 61934007 61974170 62274190 NSFC National Natural Science Foundation of China http://data.elsevier.com/vocabulary/SciValFunders/501100001809 http://sws.geonames.org/1814991/ Ministry of Science and Technology of China G2022184006L MOST Ministry of Science and Technology of the People&apos;s Republic of China http://data.elsevier.com/vocabulary/SciValFunders/501100002855 http://sws.geonames.org/1814991/ Higher Education Commission 7435/Punjab/NRPU/R&amp;D/HEC/2017 HEC Higher Education Commission, Pakistan http://data.elsevier.com/vocabulary/SciValFunders/501100004681 http://sws.geonames.org/1168579/ This work was supported by the National Key Research and Development Program of China (Grant No. 2018YFB2200500 ), the National Natural Science Foundation of China (Grant no. 12174462 , 62274190 , 61974170 , 61934007 ), and the international collaboration project of the Ministry of Science and Technology of China (Grant No. G2022184006L ). F. K. Butt acknowledges funding from Higher Education Commission (HEC) through grant number 7435/Punjab/NRPU/R&amp;D/HEC/2017 . This work was supported by the National Key Research and Development Program of China (Grant No. 2018YFB2200500), the National Natural Science Foundation of China (Grant no. 12174462,62274190,61974170,61934007), and the international collaboration project of the Ministry of Science and Technology of China (Grant No. G2022184006L). F. K. Butt acknowledges funding from Higher Education Commission (HEC) through grant number 7435/Punjab/NRPU/R&amp;D/HEC/2017. https://doi.org/10.15223/policy-017 https://doi.org/10.15223/policy-037 https://doi.org/10.15223/policy-012 https://doi.org/10.15223/policy-029 https://doi.org/10.15223/policy-004 item S2468-8231(23)00799-X S246882312300799X 1-s2.0-S246882312300799X 10.1016/j.mcat.2023.113716 315758 2024-01-14T04:04:14.583438Z 2024-01-15 1-s2.0-S246882312300799X-main.pdf https://s3-eu-west-1.amazonaws.com/prod-ucs-content-store-eu-west/content/pii:S246882312300799X/MAIN/application/pdf/678e3eb624d62e913f77d2d30dbff47a/main.pdf main.pdf pdf true 6867637 MAIN 9 1-s2.0-S246882312300799X-main_1.png https://s3-eu-west-1.amazonaws.com/prod-ucs-content-store-eu-west/content/pii:S246882312300799X/PREVIEW/image/png/d240a936edefe210f70d95ad340b8f63/main_1.png main_1.png png 58855 849 656 IMAGE-WEB-PDF 1 1-s2.0-S246882312300799X-gr1.jpg https://s3-eu-west-1.amazonaws.com/prod-ucs-content-store-eu-west/content/pii:S246882312300799X/gr1/DOWNSAMPLED/image/jpeg/37a10a68e04f885535ed2c3b4209693c/gr1.jpg gr1 gr1.jpg jpg 43205 261 508 IMAGE-DOWNSAMPLED 1-s2.0-S246882312300799X-gr2.jpg https://s3-eu-west-1.amazonaws.com/prod-ucs-content-store-eu-west/content/pii:S246882312300799X/gr2/DOWNSAMPLED/image/jpeg/3a186f17dcb175ba919949b03c80d572/gr2.jpg gr2 gr2.jpg jpg 139881 677 734 IMAGE-DOWNSAMPLED 1-s2.0-S246882312300799X-ga1.jpg https://s3-eu-west-1.amazonaws.com/prod-ucs-content-store-eu-west/content/pii:S246882312300799X/ga1/DOWNSAMPLED/image/jpeg/567923ad094e9588a5d69fc5cec9bab4/ga1.jpg ga1 true ga1.jpg jpg 29003 200 390 IMAGE-DOWNSAMPLED 1-s2.0-S246882312300799X-gr3.jpg https://s3-eu-west-1.amazonaws.com/prod-ucs-content-store-eu-west/content/pii:S246882312300799X/gr3/DOWNSAMPLED/image/jpeg/95ae5a400d127afc49fcf91afb41622e/gr3.jpg gr3 gr3.jpg jpg 76880 396 301 IMAGE-DOWNSAMPLED 1-s2.0-S246882312300799X-gr8.jpg https://s3-eu-west-1.amazonaws.com/prod-ucs-content-store-eu-west/content/pii:S246882312300799X/gr8/DOWNSAMPLED/image/jpeg/0648f3c976bc1a8fee28cd4a769a5d88/gr8.jpg gr8 gr8.jpg jpg 72906 430 602 IMAGE-DOWNSAMPLED 1-s2.0-S246882312300799X-gr4.jpg https://s3-eu-west-1.amazonaws.com/prod-ucs-content-store-eu-west/content/pii:S246882312300799X/gr4/DOWNSAMPLED/image/jpeg/b3cb5c3678e4aba28795f587025c3328/gr4.jpg gr4 gr4.jpg jpg 103486 446 565 IMAGE-DOWNSAMPLED 1-s2.0-S246882312300799X-gr5.jpg https://s3-eu-west-1.amazonaws.com/prod-ucs-content-store-eu-west/content/pii:S246882312300799X/gr5/DOWNSAMPLED/image/jpeg/5cc7bb0702809de4e41b902f4c7384a8/gr5.jpg gr5 gr5.jpg jpg 37307 296 386 IMAGE-DOWNSAMPLED 1-s2.0-S246882312300799X-gr6.jpg https://s3-eu-west-1.amazonaws.com/prod-ucs-content-store-eu-west/content/pii:S246882312300799X/gr6/DOWNSAMPLED/image/jpeg/7738289e03e7d64cdc3e9932dc73ab4d/gr6.jpg gr6 gr6.jpg jpg 74465 439 527 IMAGE-DOWNSAMPLED 1-s2.0-S246882312300799X-gr7.jpg https://s3-eu-west-1.amazonaws.com/prod-ucs-content-store-eu-west/content/pii:S246882312300799X/gr7/DOWNSAMPLED/image/jpeg/8f7c9e305d7aa8b71b4c726df16885c0/gr7.jpg gr7 gr7.jpg jpg 39837 319 386 IMAGE-DOWNSAMPLED 1-s2.0-S246882312300799X-gr1.sml https://s3-eu-west-1.amazonaws.com/prod-ucs-content-store-eu-west/content/pii:S246882312300799X/gr1/THUMBNAIL/image/gif/51cdafee010b7cea9f212cbeafa6ffef/gr1.sml gr1 gr1.sml sml 9000 113 219 IMAGE-THUMBNAIL 1-s2.0-S246882312300799X-gr2.sml https://s3-eu-west-1.amazonaws.com/prod-ucs-content-store-eu-west/content/pii:S246882312300799X/gr2/THUMBNAIL/image/gif/695cc2ec81229b1e884d3248602256bd/gr2.sml gr2 gr2.sml sml 15039 164 178 IMAGE-THUMBNAIL 1-s2.0-S246882312300799X-ga1.sml https://s3-eu-west-1.amazonaws.com/prod-ucs-content-store-eu-west/content/pii:S246882312300799X/ga1/THUMBNAIL/image/gif/951fb8bc4743c060991de3d57957e70e/ga1.sml ga1 true ga1.sml sml 10741 112 219 IMAGE-THUMBNAIL 1-s2.0-S246882312300799X-gr3.sml https://s3-eu-west-1.amazonaws.com/prod-ucs-content-store-eu-west/content/pii:S246882312300799X/gr3/THUMBNAIL/image/gif/0a9bf3078437b287378931a74bf431f7/gr3.sml gr3 gr3.sml sml 13281 163 124 IMAGE-THUMBNAIL 1-s2.0-S246882312300799X-gr8.sml https://s3-eu-west-1.amazonaws.com/prod-ucs-content-store-eu-west/content/pii:S246882312300799X/gr8/THUMBNAIL/image/gif/4b012c09150a0b442a6136d657820377/gr8.sml gr8 gr8.sml sml 13959 157 219 IMAGE-THUMBNAIL 1-s2.0-S246882312300799X-gr4.sml https://s3-eu-west-1.amazonaws.com/prod-ucs-content-store-eu-west/content/pii:S246882312300799X/gr4/THUMBNAIL/image/gif/137182bdd9588de96a63984f7fb26e69/gr4.sml gr4 gr4.sml sml 16622 164 207 IMAGE-THUMBNAIL 1-s2.0-S246882312300799X-gr5.sml https://s3-eu-west-1.amazonaws.com/prod-ucs-content-store-eu-west/content/pii:S246882312300799X/gr5/THUMBNAIL/image/gif/743b3f0df4f351e20d5b6f1f93e89323/gr5.sml gr5 gr5.sml sml 10784 164 214 IMAGE-THUMBNAIL 1-s2.0-S246882312300799X-gr6.sml https://s3-eu-west-1.amazonaws.com/prod-ucs-content-store-eu-west/content/pii:S246882312300799X/gr6/THUMBNAIL/image/gif/589da5cd30f756bf58cc15af84ef4956/gr6.sml gr6 gr6.sml sml 12801 164 197 IMAGE-THUMBNAIL 1-s2.0-S246882312300799X-gr7.sml https://s3-eu-west-1.amazonaws.com/prod-ucs-content-store-eu-west/content/pii:S246882312300799X/gr7/THUMBNAIL/image/gif/e8cc3dbf7e182643bb7d1c6756857e31/gr7.sml gr7 gr7.sml sml 15127 164 198 IMAGE-THUMBNAIL 1-s2.0-S246882312300799X-gr1_lrg.jpg https://s3-eu-west-1.amazonaws.com/prod-ucs-content-store-eu-west/content/pii:S246882312300799X/HIGHRES/image/jpeg/4ef067340333d476cfd6be13609354dc/gr1_lrg.jpg gr1 gr1_lrg.jpg jpg 276537 1157 2250 IMAGE-HIGH-RES 1-s2.0-S246882312300799X-gr2_lrg.jpg https://s3-eu-west-1.amazonaws.com/prod-ucs-content-store-eu-west/content/pii:S246882312300799X/HIGHRES/image/jpeg/a2d9e75bf0376fc4a924d232e0b9d332/gr2_lrg.jpg gr2 gr2_lrg.jpg jpg 1088432 2996 3250 IMAGE-HIGH-RES 1-s2.0-S246882312300799X-ga1_lrg.jpg https://s3-eu-west-1.amazonaws.com/prod-ucs-content-store-eu-west/content/pii:S246882312300799X/HIGHRES/image/jpeg/c95d87683d2aafa86ed1c257a63c23ff/ga1_lrg.jpg ga1 true ga1_lrg.jpg jpg 193172 886 1728 IMAGE-HIGH-RES 1-s2.0-S246882312300799X-gr3_lrg.jpg https://s3-eu-west-1.amazonaws.com/prod-ucs-content-store-eu-west/content/pii:S246882312300799X/HIGHRES/image/jpeg/322ce9ecb4ce5f7e3fb2cf8a37046895/gr3_lrg.jpg gr3 gr3_lrg.jpg jpg 534002 1753 1333 IMAGE-HIGH-RES 1-s2.0-S246882312300799X-gr8_lrg.jpg https://s3-eu-west-1.amazonaws.com/prod-ucs-content-store-eu-west/content/pii:S246882312300799X/HIGHRES/image/jpeg/6125380c552dbb0f810a52e878ba848a/gr8_lrg.jpg gr8 gr8_lrg.jpg jpg 487750 1907 2667 IMAGE-HIGH-RES 1-s2.0-S246882312300799X-gr4_lrg.jpg https://s3-eu-west-1.amazonaws.com/prod-ucs-content-store-eu-west/content/pii:S246882312300799X/HIGHRES/image/jpeg/e38d16f13e33f1d1aa225b0708d5517d/gr4_lrg.jpg gr4 gr4_lrg.jpg jpg 785165 1975 2500 IMAGE-HIGH-RES 1-s2.0-S246882312300799X-gr5_lrg.jpg https://s3-eu-west-1.amazonaws.com/prod-ucs-content-store-eu-west/content/pii:S246882312300799X/HIGHRES/image/jpeg/e11f958e9c5b83dd6f505eb399af7a05/gr5_lrg.jpg gr5 gr5_lrg.jpg jpg 223245 1309 1708 IMAGE-HIGH-RES 1-s2.0-S246882312300799X-gr6_lrg.jpg https://s3-eu-west-1.amazonaws.com/prod-ucs-content-store-eu-west/content/pii:S246882312300799X/HIGHRES/image/jpeg/3e93c7efa9f6251442a031b8d36909ef/gr6_lrg.jpg gr6 gr6_lrg.jpg jpg 482573 1943 2333 IMAGE-HIGH-RES 1-s2.0-S246882312300799X-gr7_lrg.jpg https://s3-eu-west-1.amazonaws.com/prod-ucs-content-store-eu-west/content/pii:S246882312300799X/HIGHRES/image/jpeg/76b001495752d54f7089b7629bb584c5/gr7_lrg.jpg gr7 gr7_lrg.jpg jpg 304135 1411 1708 IMAGE-HIGH-RES 1-s2.0-S246882312300799X-mmc1.docx https://s3-eu-west-1.amazonaws.com/prod-ucs-content-store-eu-west/content/pii:S246882312300799X/mmc1/MAIN/application/vnd.openxmlformats-officedocument.wordprocessingml.document/e7fec46513ed29c70b943a72e7f86f5c/mmc1.docx mmc1 mmc1.docx docx 2947195 APPLICATION 1-s2.0-S246882312300799X-si1.svg https://s3-eu-west-1.amazonaws.com/prod-ucs-content-store-eu-west/content/pii:S246882312300799X/image/svg+xml/670fa1405694b1fb0cefd499b37ae78f/si1.svg si1 si1.svg svg 5050 ALTIMG 1-s2.0-S246882312300799X-si10.svg https://s3-eu-west-1.amazonaws.com/prod-ucs-content-store-eu-west/content/pii:S246882312300799X/image/svg+xml/8236aff77ea09e7a931e7d8bc1e00680/si10.svg si10 si10.svg svg 10302 ALTIMG 1-s2.0-S246882312300799X-si11.svg https://s3-eu-west-1.amazonaws.com/prod-ucs-content-store-eu-west/content/pii:S246882312300799X/image/svg+xml/2c93a1686bab90e5bda34fdb953ba74e/si11.svg si11 si11.svg svg 5628 ALTIMG 1-s2.0-S246882312300799X-si12.svg https://s3-eu-west-1.amazonaws.com/prod-ucs-content-store-eu-west/content/pii:S246882312300799X/image/svg+xml/2b246d95f52f4a636a0ca7d3f70623c8/si12.svg si12 si12.svg svg 4151 ALTIMG 1-s2.0-S246882312300799X-si13.svg https://s3-eu-west-1.amazonaws.com/prod-ucs-content-store-eu-west/content/pii:S246882312300799X/image/svg+xml/62deedb560edf853d6cbec0b15d59d3b/si13.svg si13 si13.svg svg 19135 ALTIMG 1-s2.0-S246882312300799X-si14.svg https://s3-eu-west-1.amazonaws.com/prod-ucs-content-store-eu-west/content/pii:S246882312300799X/image/svg+xml/dda91037f6b04cb093e164dffb067b19/si14.svg si14 si14.svg svg 8407 ALTIMG 1-s2.0-S246882312300799X-si15.svg https://s3-eu-west-1.amazonaws.com/prod-ucs-content-store-eu-west/content/pii:S246882312300799X/image/svg+xml/b8edc7950d81d929bc4522b45e0a0add/si15.svg si15 si15.svg svg 2767 ALTIMG 1-s2.0-S246882312300799X-si16.svg https://s3-eu-west-1.amazonaws.com/prod-ucs-content-store-eu-west/content/pii:S246882312300799X/image/svg+xml/985985cfa396c167532f2c585ce5fc3d/si16.svg si16 si16.svg svg 2897 ALTIMG 1-s2.0-S246882312300799X-si17.svg https://s3-eu-west-1.amazonaws.com/prod-ucs-content-store-eu-west/content/pii:S246882312300799X/image/svg+xml/f5d71f3fbdd6696b6786ccda405bc9ab/si17.svg si17 si17.svg svg 12472 ALTIMG 1-s2.0-S246882312300799X-si18.svg https://s3-eu-west-1.amazonaws.com/prod-ucs-content-store-eu-west/content/pii:S246882312300799X/image/svg+xml/b604162ea0ea258e31c4e2681a20a7d0/si18.svg si18 si18.svg svg 6415 ALTIMG 1-s2.0-S246882312300799X-si19.svg https://s3-eu-west-1.amazonaws.com/prod-ucs-content-store-eu-west/content/pii:S246882312300799X/image/svg+xml/ecb162d11b1bcb6da2df21c273f58bc7/si19.svg si19 si19.svg svg 5580 ALTIMG 1-s2.0-S246882312300799X-si2.svg https://s3-eu-west-1.amazonaws.com/prod-ucs-content-store-eu-west/content/pii:S246882312300799X/image/svg+xml/036c700643c58532205e4cdddbd92ddb/si2.svg si2 si2.svg svg 6122 ALTIMG 1-s2.0-S246882312300799X-si20.svg https://s3-eu-west-1.amazonaws.com/prod-ucs-content-store-eu-west/content/pii:S246882312300799X/image/svg+xml/832a39de11c076d5e2748c13bb817b80/si20.svg si20 si20.svg svg 5642 ALTIMG 1-s2.0-S246882312300799X-si21.svg https://s3-eu-west-1.amazonaws.com/prod-ucs-content-store-eu-west/content/pii:S246882312300799X/image/svg+xml/996e6386d0cae919c4f9a43e6c0bef36/si21.svg si21 si21.svg svg 14481 ALTIMG 1-s2.0-S246882312300799X-si22.svg https://s3-eu-west-1.amazonaws.com/prod-ucs-content-store-eu-west/content/pii:S246882312300799X/image/svg+xml/4b330ca5f8a50278d8daa23983b5c22b/si22.svg si22 si22.svg svg 3982 ALTIMG 1-s2.0-S246882312300799X-si3.svg https://s3-eu-west-1.amazonaws.com/prod-ucs-content-store-eu-west/content/pii:S246882312300799X/image/svg+xml/26419f9fc2cd8962dddd94d36899b6ec/si3.svg si3 si3.svg svg 4477 ALTIMG 1-s2.0-S246882312300799X-si4.svg https://s3-eu-west-1.amazonaws.com/prod-ucs-content-store-eu-west/content/pii:S246882312300799X/image/svg+xml/61f1d1b3d4d28e0e20855238c2ca4469/si4.svg si4 si4.svg svg 5657 ALTIMG 1-s2.0-S246882312300799X-si5.svg https://s3-eu-west-1.amazonaws.com/prod-ucs-content-store-eu-west/content/pii:S246882312300799X/image/svg+xml/590a79be2d6e04a05bb6c07a4ac6fecf/si5.svg si5 si5.svg svg 2144 ALTIMG 1-s2.0-S246882312300799X-si6.svg https://s3-eu-west-1.amazonaws.com/prod-ucs-content-store-eu-west/content/pii:S246882312300799X/image/svg+xml/7c4f32f6257fd9df32837dacbb75381f/si6.svg si6 si6.svg svg 11335 ALTIMG 1-s2.0-S246882312300799X-si7.svg https://s3-eu-west-1.amazonaws.com/prod-ucs-content-store-eu-west/content/pii:S246882312300799X/image/svg+xml/e8ccc9acb4c4e61009211708155451af/si7.svg si7 si7.svg svg 9324 ALTIMG 1-s2.0-S246882312300799X-si8.svg https://s3-eu-west-1.amazonaws.com/prod-ucs-content-store-eu-west/content/pii:S246882312300799X/image/svg+xml/a00e7d8b9393228b49e3bfcd6151f81f/si8.svg si8 si8.svg svg 5906 ALTIMG 1-s2.0-S246882312300799X-si9.svg https://s3-eu-west-1.amazonaws.com/prod-ucs-content-store-eu-west/content/pii:S246882312300799X/image/svg+xml/d5dc3700a96fc49fe66f47ce6cf67a2e/si9.svg si9 si9.svg svg 4587 ALTIMG 1-s2.0-S246882312300799X-am.pdf https://s3-eu-west-1.amazonaws.com/prod-ucs-content-store-eu-west/content/egi:10QVHDFKZVK/MAIN/application/pdf/1c53594ea75301439db5c0b2bfeecdef/am.pdf am am.pdf pdf false 1321198 AAM-PDF MCAT 113716 113716 S2468-8231(23)00799-X 10.1016/j.mcat.2023.113716 Fig. 1 Top and side views of (a) ZrSSe/SnS and (b) ZrSSe/SnS2 heterostructures. In ZrSSe/SnSe and ZrSSe/SnSe2 heterostructures, the S atoms in SnS and SnS2 monolayers are replaced with Se atoms. Fig. 1 Fig. 2 (a) Formation energies of ZrSSe/SnX (X = S, Se, S2, Se2) vdWHs. (b) Phonon dispersion and (c) AIMD simulation results for SnS/ZrSSe. Fig. 2 Fig. 3 HSE06 band structures of (a) ZrSSe/SnS (b) ZrSSe/SnSe (c) ZrSSe/SnS2 and (d) ZrSSe/SnSe2 heterostructures. Fig. 3 Fig. 4 Density of states of (a) ZrSSe/SnS, (b) ZrSSe/SnSe, (c) ZrSSe/SnS2, and (d) ZrSSe/SnSe2 heterostructures. Fig. 4 Fig. 5 Empirically calculated band-edge positions of (a) ZrSSe/SnS, (b) ZrSSe/SnSe, (c) ZrSSe/SnS2, and (d) ZrSSe/SnSe2 heterostructures. Fig. 5 Fig. 6 DFT-calculated band-edge positions of (a) ZrSSe/SnS, (b) ZrSSe/SnSe, (c) ZrSSe/SnS2, and (d) ZrSSe/SnSe2 heterostructures. Fig. 6 Fig. 7 Absorption spectra of ZrSSe/SnX (X = S, Se, S2, Se2) vdW heterostructures. Fig. 7 Fig. 8 Difference in plane-averaged charge density of (a) ZrSSe/SnS, (b) ZrSSe/SnSe, (c) ZrSSe/SnS2, and (d) ZrSSe/SnSe2 vdWHs. The insets show 3D plots of the respective heterostructures where the blue regions correspond to the positive values (charge accumulation) and the yellow regions correspond to negative values (charge depletion). The heterostructures were calculated using an isosurface value of 0.005 eÅ−3. Fig. 8 Table 1 Lattice parameters, interlayer distance, formation energies (E f), PBE bandgaps ( E g PBE ) and hybrid (HSE06) bandgaps ( E g HSE 06 ), ΔV, and kinetic overpotentials (ΔE C, ΔE V) of the heterostructures. Table 1 Heterostructure Lattice Parameter (Å) Interlayer Distance (Å) E f (eV) E g PBE (eV) E g HSE 06 (eV) ΔV (eV) ΔEC (eV) ΔEV (eV) ZrSSe/SnS 3.74 4.33 −0.11 0.57 1.295 7.77 −0.1 0.14 ZrSSe/SnSe 3.78 4.50 −0.05 0.456 1.207 7.01 0.13 0.04 ZrSSe/SnS2 3.72 4.10 −0.13 0.62 1.372 2.55 0.06 0.07 ZrSSe/SnSe2 3.79 4.43 −0.08 0.768 1.587 2.09 0.34 0.02 Table 2 Calculated values of effective mass (m*), elastic modulus (C), deformation potential (E d), and carrier mobilities along armchair and zigzag directions. Table 2 Heterostructure Direction Carrier Effective Mass (m*) C (N m − 1) Ed (eV) µ (cm2 v − 1 s − 1) ZrSSe/SnS Armchair e − 2.233 64.11 0.05 62,803.20 h + 2.918 1.87 30.64 Zigzag e − 0.247 64.74 0.42 84,912.51 h + 2.622 2.33 24.86 ZrSSe/SnSe Armchair e − 2.172 67.94 0.30 2329.53 h + 1.406 2.19 102.41 Zigzag e − 0.276 76.43 0.45 69,412.86 h + 2.442 2.03 44.49 ZrSSe/SnS2 Armchair e − 1.128 92.60 2.58 156.12 h + 0.147 4.63 2857.83 Zigzag e − 0.252 88.64 2.62 2902.71 h + 0.331 1.79 3603.97 ZrSSe/SnSe2 Armchair e − 0.279 88.44 0.36 128,756 h + 1.586 1.08 427.65 Zigzag e − 0.528 87.70 3.28 418.37 h + 1.505 3.74 39.67 Research Paper High carrier mobility ZrSSe/SnX (X=S, Se, S2, Se2) vdW heterostructures for photocatalytic overall water splitting: A first-principles study Zeeshan Tariq a b Sajid Ur Rehman a b Faheem K. Butt c Xiaoming Zhang a b ⁎ Chuanbo Li a b ⁎ a School of Science, Minzu University of China, Beijing 100081, China School of Science Minzu University of China Beijing 100081 China aSchool of Science, Minzu University of China, Beijing 100081, China b Optoelectronics Research Center, Minzu University of China, Beijing 100081, China Optoelectronics Research Center Minzu University of China Beijing 100081 China bOptoelectronics Research Center, Minzu University of China, Beijing 100081, China c Department of Physics, Division of Science and Technology, University of Education Lahore, 54770 Lahore, Pakistan Department of Physics Division of Science and Technology University of Education Lahore Lahore 54770 Pakistan cDepartment of Physics, Division of Science and Technology, University of Education Lahore, 54770 Lahore, Pakistan ⁎ Corresponding authors. Recently, the assembly of novel two-dimensional materials via van der Waals (vdW) interactions to form heterostructures is considered an effective strategy for producing materials with enhanced photocatalytic activities. This study systematically explored the optoelectronic and photocatalytic properties and carrier mobilities of novel ZrSSe/SnX (X = S, Se, S2, Se2) vdW heterostructures using density functional theory. The formation energies, elastic constants, phonon dispersions, and results of ab-initio molecular dynamic simulations indicate structural, mechanical, dynamic, and thermal stability. The electronic band structure and optical properties are calculated using hybrid functional HSE06 for accurate calculations. The results of calculations using the bandgap center technique based on density functional theory show that ZrSSe/SnSe, ZrSSe/SnS2, and ZrSSe/SnSe2 heterostructures possess suitable band edges for photocatalytic overall water splitting. The optical absorption spectrum covers a broad range from 104 in the visible region and increases to 105 in the UV region. Furthermore, the ZrSSe/SnX (X = S, Se, S2, Se2) heterostructures have high carrier mobilities of the order of 105. High mobilities help carriers to move quickly and reduce the recombination rate of holes and electrons. The findings indicate that ZrSSe/SnX (X = S, Se, S2, Se2) heterostructures are potentially efficient visible-light photocatalysts for overall water splitting. Graphical abstract Image, graphical abstract Keywords 2D materials Heterostructure Photocatalysis Absorption Higher carrier mobilities Data availability Data will be made available on request. Introduction Global industrialization and population growth are resulting in a growing energy demand. Fossil fuels have long been a primary energy source to meet daily energy requirements. Fossil fuels are not only a non-renewable energy resource, but also main contributors to greenhouse gas emissions and pollution [1]. Alternatives to fossil fuels include environmentally friendly and renewable energy resources such as solar, wind, nuclear, and hydroelectric energy [2]. In addition, hydrogen is an alternative clean and renewable energy resource with the potential to overcome the above-mentioned issues [3,4]. Hydrogen can be generated by various techniques, among which water splitting using sunlight is one of the most attractive methods because it is a carbon-free process that mainly uses Earth-abundant materials [5–7]. Vertically aligned van der Waals heterostructures (vdWHs) comprising the same and different 2D structures have received research interest because of the potential advantages of their integral layers [8,9]. Recently, chemical vapor deposition (CVD) and epitaxial-growth techniques have been used to fabricate various vertical vdWHs, such as MoS2/h-BN [10], SnS/SnS2 [11] and SnSe/MoSe2 [12]. 2D vdWHs are currently considered feasible for developing innovative optical and electronic devices with distinctive properties not observed intrinsic to the integral layers. Specifically, novel 2D vdWHs with staggered bandgap (type-II) configurations have exhibited outstanding performance in photovoltaic devices [13–15] and photocatalysis [16–19] owing to their fascinating optical and electronic properties. After the successful synthesis of graphene and the demonstration of its unique properties, two-dimensional (2D) materials have attracted the interest of researchers for many applications. Specifically, 2D materials have been studied for photocatalytic water splitting. 2D materials exhibit higher carrier mobilities than 3D materials, which helps reduce the charge carrier recombination rates [20]. Among the many 2D materials, tin chalcogenides are appealing semiconductor materials and abundantly utilized in photocatalytic water splitting [21], lithium-ion batteries [22], gas sensors [23], and optoelectronic devices [11]. Tin chalcogenides (S- and Se-based) usually have wide bandgaps, are inexpensive, nontoxic, stable in acidic and neutral environments, and thermally stable in air [24]. Guo et al. showed that Janus ZrSSe, an indirect semiconductor, is mechanically and dynamically stable and exhibits high photocatalytic activities [25]. Furthermore, after the successful fabrication of Janus MoSSe layers by the selenization of MoS2, it is easy to synthesize Janus ZrSSe monolayers by the selenization of ZrS2 monolayers [26]. Therefore, in this study, we theoretically designed vdWHs of ZrSSe/SnX (X = S, Se, S2, Se2) and studied their stabilities (structural, mechanical, dynamic, and thermal) along with their optoelectronic and photocatalytic properties. The calculations also indicated that these heterostructures have high charge carrier (electron and hole) mobilities, making them viable candidates as photocatalysts for overall water splitting under visible light. Computational method Density functional theory (DFT)-based first-principles calculations were performed in this study using CASTEP code [27,28], which applies a plane-wave pseudopotential approach. A vacuum region of 20 Å was applied to omit any fictitious interactions between the 2D layers of ZrSSe and SnX (X = S, Se, S2, Se2). Within the framework of the generalized gradient approximation (GGA), the Perdew–Burke–Ernzerhof (PBE) approach was used to treat electron exchange correlation [29,30]. The Broyden–Fletcher–Goldfarb–Shanno (BFGS) algorithm was employed to relax the structures [31,32]. The dispersion-corrected method (DFT-D3) was employed to treat the van der Waals interactions because it is suitable for representing vdWHs [33]. A cutoff energy of 500 eV was used for the expansion of the wave functions. The Brillouin zone was integrated using the Monkhorst–Pack [34] scheme with 6 × 6 × 1 k-points. However, the density of states (DOS) and optical properties (absorption spectra) were evaluated at 20 × 20 × 1 k-points. An accurate estimation of the electronic band structure was performed by applying the Heyd–Scuseria–Ernzerhof (HSE06) exchange–correlation functional [35]. Furthermore, to assess the thermal stability of ZrSSe/SnX (X = S, Se, S2, Se2) heterostructures, we performed ab-initio molecular dynamics (AIMD) simulations with a 3 × 3 × 1 supercell, self-consistent field (SCF) value of 1.0 × 10−8 eV atom−1, max displacement of 5 × 10−4 Å, key force convergence value of 0.01 eVÅ−1, and pressure of 0.02 GPa. The Elastool package was used to evaluate elastic constants [36]. Results and discussion Structural optimization Side views of the crystal structures of ZrSSe/SnX (X = S, Se, S2, Se2) heterostructures are presented in Fig. 1 . The blue, pink, yellow, and green circles correspond to the Sn, Zr, S, and Se atoms, respectively. SnS2, SnSe2, and ZrSSe are layered structures that are packed hexagonally, where Sn is packed between two S or Se atoms and Zr is packed between S and Se atoms, respectively. The electronegativity difference between S and Se atoms generates the inequivalent bond lengths of Zr–S and Zr–Se. The optimized lattice parameters are 3.74, 3.78, 3.72, and 3.79 Å, for ZrSSe/SnS, ZrSSe/SnSe, ZrSSe/SnS2, and ZrSSe/SnSe2 heterostructures, respectively. The bond lengths are Zr–Se = 2.68 Å, Zr–S = 2.56 Å, Sn–S = 2.61 Å, and Sn–Se = 2.71 Å. Stability The elastic constants act like a bridge between the dynamic properties, mechanical properties, and the description of forces that occur inside the material, such as stability and stiffness [37]. The mechanical stability of the ZrSSe/SnX (X = S, Se, S2, Se2) vdWHs was evaluated and elastic isotropy was observed owing to the hexagonal symmetry, where C11, C12, and C66 are independent elastic constants and C11 = C22. The criteria for mechanical stability is C11C22 − C 12 2 > 0, and C11, C22, C66 > 0 [38]. Based on these criteria, all four of the analyzed vdWHs are mechanically stable. Other mechanical properties like Young's modulus, Poisson's ratio etc. are given in supplementary information file (Fig. S1). The formation energy (E f) values of all ZrSSe/SnX (X = S, Se, S2, Se2) vdWHs were calculated to evaluate the ease of synthesizing the structures using E f = (E SnX/ZrSSe −E SnX −E ZrSSe), where E SnX/ZrSSe, E SnX, and EZrSSe are the energies of the ZrSSe/SnX vdWHs, and ZrSSe and SnX single layers, respectively. The calculated results are illustrated in Fig. 2 (a). Negative E f values indicate exothermic reactions to form the vdWHs, implying that can be readily fabricated from ZrSSe and SnX single layers. Among these heterostructures, ZrSSe/SnS2 is the most stable and the E f values follow the order ZrSSe/SnS2 > ZrSSe/SnS > ZrSSe/SnSe2 > ZrSSe/SnSe. It is worth noting that the E f values of the four vdWHs are very minimum, indicating that they can form concurrently. The dynamic stabilities of ZrSSe/SnX (X = S, Se, S2, Se2) vdWHs were assessed by calculating the phonon dispersions. The computed phonon dispersion of the ZrSSe/SnS heterostructure is depicted in Fig. 2(b), whereas phonon dispersions of ZrSSe/SnSe, ZrSSe/SnS2, and ZrSSe/SnSe2 are shown in the Supplementary Information (Fig. S2(a-c)). There are no soft modes throughout the entire Brillouin zone, which illustrates the dynamic stability of these vdWHs. There are three branches of acoustic phonons and fifteen branches of optical phonons. The three lowermost acoustic branches were identified as the in-plane longitudinal acoustic (LA), flexural acoustic (FA) out-of-plane, and transverse acoustic (TA) branches. These branches have quadratic frequencies and around Γ point frequencies leads to be zero, which is typical in 2D materials. Around 6.2 THz, there is very little phonon dispersion (homopolar mode), which is attributed to the layered structure [39]. The phonon dispersion spectra indicate the possibility of synthesizing the ZrSSe/SnX (X = S, Se, S2, Se2) vdWHs. Furthermore, the thermal stability of these vdWHs was evaluated by performing AIMD simulations using the standard NVT ensemble at 300 K after relaxing the heterostructures for 10 ps. Fig. 2(c) shows the simulation step, temperature fluctuations, and change in the total energy of the SnS/ZrSSe heterostructure over time. The corresponding results for ZrSSe/SnSe, ZrSSe/SnS2, and ZrSSe/SnSe2 heterostructures are given in Fig. S3(a-c). The energy variation during the AIMD simulation is very small and the heterostructures vibrate very little at 300 K, indicating good thermal stability. Electronic properties The band structure provides significant information about the properties of ZrSSe and SnX (X = S, Se, S2, Se2) monolayers and vdWHs. The Fermi energy level (E f) was set to zero for post-processing calculations, since the physical properties of solid materials are generally affected by the electronic structure near E f [40]. The band structures of ZrSSe and SnX (X = S, Se, S2, Se2) monolayers and vdWHs were investigated using a hybrid potential (HSE06) because the GGA usually underestimates the band gap [41]. The calculated electronic band structures of the proposed heterostructures are depicted in Fig. 3 (a-d) whereas the band structures of the monolayers are provided in supplementary information (Fig. S4(a-e)). The conduction-band minimum (CBM) lies at the M-point for all heterostructures, while the valence-band maximum (VBM) for ZrSSe/SnS2 and ZrSSe/SnSe2 lies at the Γ-point while for ZrSSe/SnS and ZrSSe/SnSe, it lies between the Γ and K points. The band gaps of ZrSSe/SnS, ZrSSe/SnSe, ZrSSe/SnS2, and ZrSSe/SnSe2 heterostructures are all indirect, and the values determined using HSE06 are 1.295, 1.207, 1.372, and 1.587 eV, respectively (Table 1 ). The band gaps measured using HSE06 are higher than those determined using GGA, because GGA poorly describes the strong Coulombic interactions and correlation breaking in the exchange–correlation potential. Density of states Furthermore, the composition and structure of the energy bands were explored by investigating the projected DOS (Fig. 4 (a-d)). The dotted black line corresponds to E f, with the conduction and valance bands on the right and left sides of the E f, respectively. The orange and blue lines denote the DOS of ZrSSe and SnX, respectively, in ZrSSe/SnX (X = S, Se, S2, Se2) heterostructures. In the case of ZrSSe/SnS2 and ZrSSe/SnSe2, the major contribution in the conduction band near E f is from ZrSSe, but the orbitals of SnS2/SnSe2 are also hybridized with those of ZrSSe. On the other hand, in the valence band near E f, the major contribution is from ZrSSe/SnX (X = S, Se, S2, Se2) with orbitals of ZrSSe hybridized with those of SnX. In the energy range of −2 to −5 eV, the major contribution is from the orbitals of ZrSSe, while the orbitals of SnX are also hybridized with those of ZrSSe, but their contribution is small. For ZrSSe/SnS, ZrSSe/SnSe, and ZrSSe/SnSe2 vdWHs, it is clear that the VBM and CBM are confined in SnX (X = S, Se, Se2) and ZrSSe, respectively, indicating type-II band alignment. However, for ZrSSe/SnS2, the VBM and CBM are confined in ZrSSe, indicating type-I band alignment. Band alignment For several decades, photocatalytic water splitting to generate hydrogen and oxygen has been investigated as an attractive option for addressing energy shortage by producing green and environmentally friendly energy [42–44]. The band-edge positions can be predicted using two approaches. First approach is a semiempirical method proposed by Butler and Ginely [45] which is based on Eqs. (1) & 2 [46,47]. (1) E CBM = X − E e − 1 2 E g H S E 06 (2) E VBM = E CBM + E g H S E 06 In the above equations, X is the electronegativity and E e is the free-electron energy on the hydrogen scale (4.5 eV). As displayed in Fig. 5 , ΔE C is the energy difference between the oxidation potential of water and the valence band and ΔE V is the energy difference between the conduction band and reduction potential of water. ΔE C and ΔE V are called kinetic overpotentials and they have significant importance for driving redox reactions. Table 1 shows the calculated values of ΔE C and ΔE V for the studied heterostructures. The band-edge positions of ZrSSe/SnX (X = S, Se, S2, Se2) heterostructures calculated using the empirical formulas are favorable for overall photocatalytic water splitting. However, the band-edge positions of ZrSSe/SnS are only suitable for the oxidation reaction but not the reduction reaction. Second approach is bandgap-center based DFT scheme. It has been shown that DFT can be used to calculate the bandgap-center energy (E BGC) accurately [48], although Kohn–Sham DFT show errors while evaluating the exchange-correlation energy (XC). However, E BGC is independent of the functional used for calculating XC [49]. The PBE approach is used to lower the computational cost when calculating E BGC. Then, E g H S E 06 is used in place of E g P B E . Based on E BGC theory, the DFT scheme is implemented to compute the positions of the valence and conduction band edges using Eq. (3). (3) E C B M / V B M = E B G C ± 1 2 E g H S E The electrostatic potential, BGC energy, and band edge positions (CBM and VBM) for ZrSSe/SnX (X = S, Se, S2, Se2) vdWHs are depicted in Fig. 6 , along with the water-splitting redox potentials. All of the above-mentioned energy levels are presented with respect to the vacuum level (dashed black line). The redox levels of the oxygen evolution reaction (OER) and hydrogen evolution reaction (HER) are indicated by dotted blue and red lines, respectively, whereas the bandgap center is depicted by a solid magenta line. Generally, the photocatalytic reaction rate depends on the differences between the CBM and HER (or OER and VBM), where reducing the energy difference increases the reaction rate [50]. In stacked heterostructures, electrons flow from SnX (X = S, Se, S2, Se2) layers towards ZrSSe layer due to the electronegativity difference until the Fermi levels of both ZrSSe and SnX monolayers are perfectly aligned. An intrinsic electric field (E int), denoted by the black arrows in Fig. 6, is developed due to a dipole moment directed from the SnX (X = S, Se, S2, Se2) layer towards the ZrSSe layer. Moreover, this E int allows the flow of extra electrons to ZrSSe layer and holes towards SnX layer, hindering the reintegration of photogenerated holes and electrons. The HER occurs on the ZrSSe layer and the OER occurs on the SnX layer. ZrSSe/SnX (X = S, Se, S2, Se2) heterostructures effectively separate electrons and holes and have large enough ΔE C and ΔE V values for redox reactions due to their suitable ΔV values (Fig. S5 and Table 1). Fig. 6 shows that ZrSSe/SnSe, ZrSSe/SnS2, and ZrSSe/SnSe2 heterostructures have suitable band-edge positions for overall photocatalytic water splitting whereas ZrSSe/SnS is only suitable for water oxidation. The results obtained by the empirical method and DFT are consistent. Furthermore, the results illustrate that ZrSSe/SnX (X = S, Se, S2, Se2) heterostructures are favorable photocatalysts for overall water splitting over a broad spectral range. Absorption It is important to evaluate the optical properties of a system, such as the linear response and transmission behavior [51]. Various optical properties can be elucidated by calculating the complex dielectric function ε = ε r ( ω ) + i ε i ( ω ) . The Momentum matrix of unoccupied and occupied states, i ε i ( ω ) , is used to estimate the imaginary part of the dielectric function. The absorption coefficient (α) and imaginary part of the dielectric function (ε2(ω)) were determined using Eqs. (4) and 5 [52,53]. (4) ε 2 ( ω ) = 2 π 2 e Ω ε 0 ∑ k , ν , c | ψ k c | μ . r | ψ k v | δ ( E k c − E k v − E ) (5) α ( ω ) = 2 ω c [ ε 1 2 ( ω ) + ε 2 2 ( ω ) − ε 1 ( ω ) ] 1 2 Here, u is the incident polarization field, ω is the light frequency, Ψ k c and Ψ k v are the electric charges, where υ and c indicate the wave functions of the conduction and valence band, respectively. In addition to favorable band-edge positions, the light absorption efficiency of a photocatalytic material in sunlight is of great importance for determining its overall water-splitting performance [54]. An efficient photocatalyst should exhibit an absorption spectrum that covers the visible region of the solar spectrum. The absorption spectra of the ZrSSe/SnX (X = S, Se, S2, Se2) heterostructures are presented in Fig. 7 . These materials exhibit some IR absorption but there are no prominent peaks in this region. However, in the visible region (∼2–3.6 eV) there are considerable absorption peaks for all heterostructures. The absorption coefficient steadily increases from 104 cm−1 in the visible to 105 cm−1 in the UV region for all heterostructures. All of the studied vdWHs absorb sunlight over a broad spectral range, from visible to UV, with a high coefficient of absorption. Charge density The electrical characteristics of ZrSSe/SnX (X = S, Se, S2, Se2) vdWHs were studied in detail by investigating the differential of the planar-average charge density in the z-direction Δρ(z) using the following equation. (6) Δ ρ ( z ) = ρ v d W H ( z ) − ρ Z r S S e ( z ) − ρ S n X ( z ) Here, the plane-averaged charge densities of the ZrSSe/SnX vdWH, pristine ZrSSe monolayers, and SnX (X = S, Se, S2, Se2) are depicted by ρ v d W H ( z ) , ρ Z r S S e ( z ) and ρ S n X ( z ) , respectively. Charge relocation occurs at ZrSSe/SnX heterojunctions because of areas with high hole or electron concentrations (Fig. 8 (a-d)). Charge-relocation factors, such as charge depletion (yellow isosurface) and accumulation (blue isosurface), are known to produce interfacial dipoles and electron polarization. In addition, negative values indicate depletion and positive values indicate accumulation of charge. The influence of repulsion by surface charges is exhibited by charge depletion, which promptly causes the rehybridization of the surface orbitals. Mobility The carrier mobility is an essential material parameter in the development of photocatalysts [55]. At room temperature, the mobility of 2D materials is governed by the scattering of acoustic phonons via the intra- and inter-valley deformation potential (DP). DP theory was used to compute the carrier mobilities using the following equation. (7) μ 2 D = 2 e ℏ 3 C 3 K B T | m * | 2 E d 2 Here, m* is the effective mass, e is the charge of an electron, K B is Boltzmann's constant, and T is the temperature (300 K in this study). The strain-induced band-edge shift (DP constant) and elastic modulus are represented by E d and C respectively. Here, C = [ ∂ 2 E / ∂ ε 2 ]/S, where S is the area of the system and E is the total energy under the applied uniaxial strain (ε= Δa/a0, where a0 is the initial lattice constant of the heterostructure). The calculated values of m*, C, E d, and the carrier mobilities (of electrons and holes) for ZrSSe/SnX (X = S, Se, S2, Se2) vdWHs are given in Table 2 . The evaluated VBM and CBM positions and relative energies of the heterostructures as a function of uniaxial strain along the armchair and zigzag directions are given in Figs. (S6, S7) and Fig. S8 respectively. Table 2 shows that the electron mobilities (armchair and zigzag direction) are greater than the hole mobilities for ZrSSe/SnS, ZrSSe/SnSe, and ZrSSe/SnSe2 heterostructures, whereas the hole mobilities are higher than the electron mobilities for ZrSSe/SnS2. The likelihood of the recombination of photogenerated carriers is minimized due to the difference in the magnitudes of the mobilities of holes and electrons, which is highly favorable for enhancing the photocatalytic activities of the heterostructures [56]. The carrier mobilities of ZrSSe/SnX (X = S, Se, S2, Se2) vdWHs are higher than many 2D semiconductor materials such as BN [57]; InAs [58]; MoS2 [59]; InSe/MoSe2 [60]; InSe [61]; GaP/GaSe [62]; hBNC/Janus WSSe [63]; 1T-SnS2/MoTe2 [64]; SnS, SnSe, SnS2, and SnSe2 [65]; and phosphorene [66] and comparable to some organic electronic materials [67]. The very high mobility of photogenerated electrons and holes enables the carriers to migrate quickly toward the interface of the heterostructures to contribute to the redox reactions. Higher carrier mobilities (in the range of 105 cm2 v − 1 s − 1) indicate that ZrSSe/SnX (X = S, Se, S2, Se2) heterostructures are favorable candidates for overall photocatalytic water splitting for hydrogen production. Conclusion In this study, we systematically calculated the optoelectronic properties, photocatalytic activities, and carrier mobilities of ZrSSe/SnX (X = S, Se, S2, Se2) vdWHs using DFT. The structural, mechanical, dynamic, and thermal stabilities of these materials were also assessed by calculating the formation energies, elastic constants, phonon dispersions, and molecular dynamic simulations. Accurate band structures of all heterostructures were calculated by employing the hybrid HSE06 functional because the GGA method underestimates the bandgap. The calculated bandgaps range from 1.2 eV to 1.6 eV. BGC-based DFT was used to calculate the band-edge positions for the redox reactions for water splitting (HER and OER). ZrSSe/SnSe, ZrSSe/SnS2, and ZrSSe/SnSe2 heterostructures have suitable band edges for overall photocatalytic water splitting. The absorption spectra of the heterojunctions indicate visible light harvesting with an absorption coefficient of 104, which increases to 105 in the UV region. Furthermore, the calculated carrier mobilities of the heterostructures are in the range of 105 cm2 v − 1 s − 1, which is considered sufficiently high. The differences in the magnitude of the hole and electron mobilities are highly favorable for facilitating carrier transport and reducing the recombination rate. The results of this study illustrate that the ZrSSe/SnX (X = S, Se, S2, Se2) vdWHs are suitable candidates as photocatalysts for overall water splitting with high carrier mobility, visible-light activity, and suitable stability. Data availability All data generated or analyzed during this study are included in this published article and supplementary information file. Declaration of Competing Interest The authors declare that they have no known competing financial interests or personal relationships that could have appeared to influence the work reported in this paper. Acknowledgments This work was supported by the National Key Research and Development Program of China (Grant No. 2018YFB2200500), the National Natural Science Foundation of China (Grant no. 12174462,62274190,61974170,61934007), and the international collaboration project of the Ministry of Science and Technology of China (Grant No. G2022184006L). F. K. Butt acknowledges funding from Higher Education Commission (HEC) through grant number 7435/Punjab/NRPU/R&D/HEC/2017. Supplementary materials Supplementary material associated with this article can be found, in the online version, at doi:10.1016/j.mcat.2023.113716. Appendix Supplementary materials Image, application 1 References [1] J. Turner A realizable renewable energy future (vol 285, pg 687, 1999) Science 285 5433 1999 1493–1493 Turner, J., A realizable renewable energy future (vol 285, pg 687, 1999). Science, 1999. 285(5433): p. 1493–1493. [2] M. Rasul Clean Energy For Sustainable development: Comparisons and Contrasts of New Approaches 2016 Academic Press Rasul, M., Clean Energy For Sustainable development: Comparisons and Contrasts of New Approaches. 2016: Academic Press. [3] J.K. Sheu InGaN-based epitaxial films as photoelectrodes for hydrogen generation through water photoelectrolysis and CO2 reduction to formic acid Sol. Energy Mater. Sol. Cells 166 2017 86 90 Sheu, J.K., et al., InGaN-based epitaxial films as photoelectrodes for hydrogen generation through water photoelectrolysis and CO2 reduction to formic acid. Sol. Energy Mater. Sol. Cells, 2017. 166: p. 86–90. [4] M. Momirlan T.N. Veziroglu The properties of hydrogen as fuel tomorrow in sustainable energy system for a cleaner planet Int. J. Hydrogen Energy 30 7 2005 795 802 Momirlan, M. and T.N. Veziroglu, The properties of hydrogen as fuel tomorrow in sustainable energy system for a cleaner planet. Int. J. Hydrogen Energy, 2005. 30(7): p. 795–802. [5] T. Shan-Shan Progress on electrocatalysts of hydrogen evolution reaction based on carbon fiber materials Chin. J. Anal. Chem. 44 9 2016 1447 1457 Shan-Shan, T., et al., Progress on electrocatalysts of hydrogen evolution reaction based on carbon fiber materials. Chin. J. Anal. Chem., 2016. 44(9): p. 1447–1457. [6] J.E. Trancik Renewable energy: Back the renewables boom Nature 507 7492 2014 300 302 Trancik, J.E., Renewable energy: Back the renewables boom. Nature, 2014. 507(7492): p. 300–302. [7] A. Prakash In2S3/CuS nanosheet composite: an excellent visible light photocatalyst for H2 production from H2S Sol. Energy Mater. Sol. Cells 180 2018 205 212 Prakash, A., et al., In2S3/CuS nanosheet composite: an excellent visible light photocatalyst for H2 production from H2S. Sol. Energy Mater. Sol. Cells, 2018. 180: p. 205–212. [8] K. Novoselov 2D materials and van der Waals heterostructures Science 353 6298 2016 aac9439 Novoselov, K., et al., 2D materials and van der Waals heterostructures. Science, 2016. 353(6298): p. aac9439. [9] D. Wang Synthesis of two-dimensional/one-dimensional heterostructures with tunable width J. Semicond. 42 9 2021 092001 Wang, D., et al., Synthesis of two-dimensional/one-dimensional heterostructures with tunable width. J. Semicond., 2021. 42(9): p. 092001. [10] S. Wang X. Wang J.H. Warner All chemical vapor deposition growth of MoS2: h-BN vertical van der Waals heterostructures ACS Nano 9 5 2015 5246 5254 Wang, S., X. Wang, and J.H. Warner, All chemical vapor deposition growth of MoS2: h-BN vertical van der Waals heterostructures. ACS Nano, 2015. 9(5): p. 5246–5254. [11] X. Hu Phase-controlled synthesis and photocatalytic properties of SnS, SnS2 and SnS/SnS2 heterostructure nanocrystals Mater. Res. Bull. 48 6 2013 2325 2332 Hu, X., et al., Phase-controlled synthesis and photocatalytic properties of SnS, SnS2 and SnS/SnS2 heterostructure nanocrystals. Mater. Res. Bull., 2013. 48(6): p. 2325–2332. [12] P. Chen Annealing tunes interlayer coupling and optoelectronic property of bilayer SnSe2/MoSe2 heterostructures Appl. Surf. Sci. 419 2017 460 464 Chen, P., et al., Annealing tunes interlayer coupling and optoelectronic property of bilayer SnSe2/MoSe2 heterostructures. Appl. Surf. Sci., 2017. 419: p. 460–464. [13] M.L. Tsai Monolayer MoS2 heterojunction solar cells ACS Nano 8 8 2014 8317 8322 Tsai, M.L., et al., Monolayer MoS2 heterojunction solar cells. ACS Nano, 2014. 8(8): p. 8317–8322. [14] Y. Liu Van der Waals heterostructures and devices Nat. Rev. Mater. 1 9 2016 1 17 Liu, Y., et al., Van der Waals heterostructures and devices. Nat. Rev. Mater., 2016. 1(9): p. 1–17. [15] J. Wong High photovoltaic quantum efficiency in ultrathin van der Waals heterostructures ACS Nano 11 7 2017 7230 7240 Wong, J., et al., High photovoltaic quantum efficiency in ultrathin van der Waals heterostructures. ACS Nano, 2017. 11(7): p. 7230–7240. [16] Z. Zhang Ultrathin hexagonal SnS2 nanosheets coupled with g-C3N4 nanosheets as 2D/2D heterojunction photocatalysts toward high photocatalytic activity Appl. Catal. B 163 2015 298 305 Zhang, Z., et al., Ultrathin hexagonal SnS2 nanosheets coupled with g-C3N4 nanosheets as 2D/2D heterojunction photocatalysts toward high photocatalytic activity. Appl. Catal. B, 2015. 163: p. 298–305. [17] J. Su 2D/2D heterojunctions for catalysis Adv. Sci. 6 7 2019 1801702 Su, J., et al., 2D/2D heterojunctions for catalysis. Adv. Sci., 2019. 6(7): p. 1801702. [18] Y. Fan Theoretical design of an InSe/GaTe vdW heterobilayer: A potential visible-light photocatalyst for water splitting J. Phys. Chem. C 122 49 2018 27803 27810 Fan, Y., et al., Theoretical design of an InSe/GaTe vdW heterobilayer: A potential visible-light photocatalyst for water splitting. J. Phys. Chem. C, 2018. 122(49): p. 27803–27810. [19] C. Li Recent development in electronic structure tuning of graphitic carbon nitride for highly efficient photocatalysis J. Semicond. 43 2 2022 021701 Li, C., et al., Recent development in electronic structure tuning of graphitic carbon nitride for highly efficient photocatalysis. J. Semicond., 2022. 43(2): p. 021701. [20] A.E. Maniadaki G. Kopidakis I.N. Remediakis Strain engineering of electronic properties of transition metal dichalcogenide monolayers Solid State Commun. 227 2016 33 39 Maniadaki, A.E., G. Kopidakis, and I.N. Remediakis, Strain engineering of electronic properties of transition metal dichalcogenide monolayers. Solid State Commun., 2016. 227: p. 33–39. [21] A. Saadati S. Sheibani Nitrogen-doped carbon dot impregnated g-C3N4/SnS2 nanocomposite as an efficient mediator and co-catalyst for enhanced photocatalytic degradation and water splitting J. Alloys Compd. 947 2023 169594 Saadati, A. and S. Sheibani, Nitrogen-doped carbon dot impregnated g-C3N4/SnS2 nanocomposite as an efficient mediator and co-catalyst for enhanced photocatalytic degradation and water splitting. J. Alloys Compd., 2023. 947: p. 169594. [22] X. Liu Design strategy for MXene and metal chalcogenides/oxides hybrids for supercapacitors, secondary batteries and electro/photocatalysis Coord. Chem. Rev. 464 2022 214544 Liu, X., et al., Design strategy for MXene and metal chalcogenides/oxides hybrids for supercapacitors, secondary batteries and electro/photocatalysis. Coord. Chem. Rev., 2022. 464: p. 214544. [23] S. Rani Temperature-dependent n–p–n switching and highly selective room-temperature n-SnSe2/p-SnO/n-SnSe heterojunction-based NO2 gas sensor ACS Appl. Mater. Interfaces 14 13 2022 15381 15390 Rani, S., et al., Temperature-dependent n–p–n switching and highly selective room-temperature n-SnSe2/p-SnO/n-SnSe heterojunction-based NO2 gas sensor. ACS Appl. Mater. Interfaces, 2022. 14(13): p. 15381–15390. [24] X. Gao Facile fabrication of Bi2S3/SnS2 heterojunction photocatalysts with efficient photocatalytic activity under visible light J. Alloys Compd. 674 2016 98 108 Gao, X., et al., Facile fabrication of Bi2S3/SnS2 heterojunction photocatalysts with efficient photocatalytic activity under visible light. J. Alloys Compd., 2016. 674: p. 98–108. [25] S.D. Guo Y.F. Li X.S. Guo Predicted Janus monolayer ZrSSe with enhanced n-type thermoelectric properties compared with monolayer ZrS2 Comput. Mater. Sci. 161 2019 16 23 Guo, S.D., Y.F. Li, and X.S. Guo, Predicted Janus monolayer ZrSSe with enhanced n-type thermoelectric properties compared with monolayer ZrS2. Comput. Mater. Sci., 2019. 161: p. 16–23. [26] C.V. Nguyen Electronic structure and band alignment of Blue Phosphorene/Janus ZrSSe heterostructure: A first principles study Physica E 124 2020 114369 Nguyen, C.V., et al., Electronic structure and band alignment of Blue Phosphorene/Janus ZrSSe heterostructure: A first principles study. Physica E, 2020. 124: p. 114369. [27] S.J. Clark First principles methods using CASTEP Zeitschrift für Kristallographie-Crystalline Materials 220 5-6 2005 567 570 Clark, S.J., et al., First principles methods using CASTEP. Zeitschrift für Kristallographie-Crystalline Materials, 2005. 220(5-6): p. 567–570. [28] Z. Tariq First-principles study of electronic and optical properties of sulfur doped tin monoxide: A potential applicant for optoelectronic devices Ceram. Int. 45 6 2019 7495 7503 Tariq, Z., et al., First-principles study of electronic and optical properties of sulfur doped tin monoxide: A potential applicant for optoelectronic devices. Ceram. Int., 2019. 45(6): p. 7495–7503. [29] J.P. Perdew K. Burke M. Ernzerhof Generalized gradient approximation made simple Phys. Rev. Lett. 77 18 1996 3865 Perdew, J.P., K. Burke, and M. Ernzerhof, Generalized gradient approximation made simple. Phys. Rev. Lett., 1996. 77(18): p. 3865. [30] J.P. Perdew Erratum: Atoms, molecules, solids, and surfaces: Applications of the generalized gradient approximation for exchange and correlation Phys. Rev. B 48 7 1993 4978 Perdew, J.P., et al., Erratum: Atoms, molecules, solids, and surfaces: Applications of the generalized gradient approximation for exchange and correlation. Phys. Rev. B, 1993. 48(7): p. 4978. [31] D.C. Liu J. Nocedal On the limited memory BFGS method for large scale optimization Math. Program. 45 1-3 1989 503 528 Liu, D.C. and J. Nocedal, On the limited memory BFGS method for large scale optimization. Math. Program., 1989. 45(1-3): p. 503–528. [32] J. Nocedal Updating quasi-Newton matrices with limited storage Math. Comput. 35 151 1980 773 782 Nocedal, J., Updating quasi-Newton matrices with limited storage. Math. Comput., 1980. 35(151): p. 773–782. [33] S. Grimme A consistent and accurate ab initio parametrization of density functional dispersion correction (DFT-D) for the 94 elements H-Pu J. Chem. Phys. 132 15 2010 154104 Grimme, S., et al., A consistent and accurate ab initio parametrization of density functional dispersion correction (DFT-D) for the 94 elements H-Pu. J. Chem. Phys., 2010. 132(15): p. 154104. [34] H.J. Monkhorst J.D. Pack Special points for Brillouin-zone integrations Phys. Rev. B 13 12 1976 5188 Monkhorst, H.J. and J.D. Pack, Special points for Brillouin-zone integrations. Phys. Rev. B, 1976. 13(12): p. 5188. [35] A.V. Krukau Influence of the exchange screening parameter on the performance of screened hybrid functionals J. Chem. Phys. 125 22 2006 224106 Krukau, A.V., et al., Influence of the exchange screening parameter on the performance of screened hybrid functionals. J. Chem. Phys., 2006. 125(22): p. 224106. [36] Liu, Z.L., ElasTool: An automated toolkit for elastic constants calculation. arXiv preprint , 2020. [37] J. Wang Y. Zhou Dependence of elastic stiffness on electronic band structure of nanolaminate M 2 AlC (M= Ti, V, Nb, and Cr) ceramics Phys. Rev. B 69 21 2004 214111 Wang, J. and Y. Zhou, Dependence of elastic stiffness on electronic band structure of nanolaminate M 2 AlC (M= Ti, V, Nb, and Cr) ceramics. Phys. Rev. B, 2004. 69(21): p. 214111. [38] F. Mouhat F.X. Coudert Necessary and sufficient elastic stability conditions in various crystal systems Phys. Rev. B 90 22 2014 224104 Mouhat, F. and F.X. Coudert, Necessary and sufficient elastic stability conditions in various crystal systems. Phys. Rev. B, 2014. 90(22): p. 224104. [39] S.U. Rehman Novel Two-Dimensional MC2N4 (M= Cr, Mo, W) Monolayers for Overall Water Splitting with High Visible-Light Absorption Sol. Energy 241 2022 416 427 Rehman, S.U., et al., Novel Two-Dimensional MC2N4 (M= Cr, Mo, W) Monolayers for Overall Water Splitting with High Visible-Light Absorption. Sol. Energy, 2022. 241: p. 416–427. [40] A. Yang First-principles study on the electronic structures and optical properties of ZnV2O6 Optik 2019 163789 Yang, A., et al., First-principles study on the electronic structures and optical properties of ZnV2O6. Optik, 2019: p. 163789. [41] J. Heyd Energy band gaps and lattice parameters evaluated with the Heyd-Scuseria-Ernzerhof screened hybrid functional J. Chem. Phys. 123 17 2005 174101 Heyd, J., et al., Energy band gaps and lattice parameters evaluated with the Heyd-Scuseria-Ernzerhof screened hybrid functional. J. Chem. Phys., 2005. 123(17): p. 174101. [42] M. Grätzel Photoelectrochemical cells Nature 414 6861 2001 338 344 Grätzel, M., Photoelectrochemical cells. Nature, 2001. 414(6861): p. 338–344. [43] J. Nisar B. Pathak R. Ahuja Screened hybrid density functional study on Sr2Nb2O7 for visible light photocatalysis Appl. Phys. Lett. 100 18 2012 181903 Nisar, J., B. Pathak, and R. Ahuja, Screened hybrid density functional study on Sr2Nb2O7 for visible light photocatalysis. Appl. Phys. Lett., 2012. 100(18): p. 181903. [44] Y. Zhi Recent Progress in Metal-Free Covalent Organic Frameworks as Heterogeneous Catalysts Small 16 24 2020 2001070 Zhi, Y., et al., Recent Progress in Metal-Free Covalent Organic Frameworks as Heterogeneous Catalysts. Small, 2020. 16(24): p. 2001070. [45] M. Butler D. Ginley Prediction of flatband potentials at semiconductor-electrolyte interfaces from atomic electronegativities J. Electrochem. Soc. 125 2 1978 228 Butler, M. and D. Ginley, Prediction of flatband potentials at semiconductor-electrolyte interfaces from atomic electronegativities. J. Electrochem. Soc., 1978. 125(2): p. 228. [46] J. Liu Electronic structure and optical properties of Ag3PO4 photocatalyst calculated by hybrid density functional method Appl. Phys. Lett. 99 19 2011 191903 Liu, J., et al., Electronic structure and optical properties of Ag3PO4 photocatalyst calculated by hybrid density functional method. Appl. Phys. Lett., 2011. 99(19): p. 191903. [47] Z. Ma Electronic and photocatalytic properties of Ag3PC4VI (C= O, S, Se): a systemic hybrid DFT study J. Phys. Chem. C 116 47 2012 25074 25080 Ma, Z., et al., Electronic and photocatalytic properties of Ag3PC4VI (C= O, S, Se): a systemic hybrid DFT study. J. Phys. Chem. C, 2012. 116(47): p. 25074–25080. [48] J.P. Perdew M. Levy Physical content of the exact Kohn-Sham orbital energies: band gaps and derivative discontinuities Phys. Rev. Lett. 51 20 1983 1884 Perdew, J.P. and M. Levy, Physical content of the exact Kohn-Sham orbital energies: band gaps and derivative discontinuities. Phys. Rev. Lett., 1983. 51(20): p. 1884. [49] M.C. Toroker First principles scheme to evaluate band edge positions in potential transition metal oxide photocatalysts and photoelectrodes Phys. Chem. Chem. Phys. 13 37 2011 16644 16654 Toroker, M.C., et al., First principles scheme to evaluate band edge positions in potential transition metal oxide photocatalysts and photoelectrodes. Phys. Chem. Chem. Phys., 2011. 13(37): p. 16644–16654. [50] S. Wu The novel two-dimensional photocatalyst SnN 3 with enhanced visible-light absorption for overall water splitting Nanoscale 11 40 2019 18628 18639 Wu, S., et al., The novel two-dimensional photocatalyst SnN 3 with enhanced visible-light absorption for overall water splitting. Nanoscale, 2019. 11(40): p. 18628–18639. [51] A. Hao First-principles investigations on electronic, elastic and optical properties of XC (X= Si, Ge, and Sn) under high pressure J. Appl. Phys. 108 6 2010 063531 Hao, A., et al., First-principles investigations on electronic, elastic and optical properties of XC (X= Si, Ge, and Sn) under high pressure. J. Appl. Phys., 2010. 108(6): p. 063531. [52] S. Xuechu Semiconductor Spectra and Optical Properties The Second Edition 1992 Science Press Beijing Xuechu, S., Semiconductor Spectra and Optical Properties. 1992, Beijing: Science Press (The Second Edition). [53] X. Gao Developing Dipole-scheme heterojunction photocatalysts Appl. Surf. Sci. 599 2022 153942 Gao, X., et al., Developing Dipole-scheme heterojunction photocatalysts. Appl. Surf. Sci., 2022. 599: p. 153942. [54] G. Rehman Van der Waals heterostructures of blue phosphorene and scandium-based MXenes monolayers J. Appl. Phys. 126 14 2019 143101 Rehman, G., et al., Van der Waals heterostructures of blue phosphorene and scandium-based MXenes monolayers. J. Appl. Phys., 2019. 126(14): p. 143101. [55] J. Liu Rational design direct Z-scheme β-GeSe/HfS2 heterostructure by interfacial engineering: Efficient photocatalyst for overall water splitting in the wide solar spectrum Appl. Surf. Sci. 589 2022 153025 Liu, J., et al., Rational design direct Z-scheme β-GeSe/HfS2 heterostructure by interfacial engineering: Efficient photocatalyst for overall water splitting in the wide solar spectrum. Appl. Surf. Sci., 2022. 589: p. 153025. [56] H. Yang A theoretical study on the electronic properties of in-plane CdS/ZnSe heterostructures: type-II band alignment for water splitting J. Mater. Chem. A 6 9 2018 4161 4166 Yang, H., et al., A theoretical study on the electronic properties of in-plane CdS/ZnSe heterostructures: type-II band alignment for water splitting. J. Mater. Chem. A, 2018. 6(9): p. 4161–4166. [57] S. Bruzzone G. Fiori Ab-initio simulations of deformation potentials and electron mobility in chemically modified graphene and two-dimensional hexagonal boron-nitride Appl. Phys. Lett. 99 22 2011 222108 Bruzzone, S. and G. Fiori, Ab-initio simulations of deformation potentials and electron mobility in chemically modified graphene and two-dimensional hexagonal boron-nitride. Appl. Phys. Lett., 2011. 99(22): p. 222108. [58] W. Yu Systematic investigation of the mechanical, electronic, and interfacial properties of high mobility monolayer InAs from first-principles calculations Phys. Chem. Chem. Phys. 25 15 2023 10769 10777 Yu, W., et al., Systematic investigation of the mechanical, electronic, and interfacial properties of high mobility monolayer InAs from first-principles calculations. Phys. Chem. Chem. Phys., 2023. 25(15): p. 10769–10777. [59] V. Giacometti Single-layer MoS2 transistors Nat Nanotechnol 6 3 2011 147 150 Giacometti, V., et al., Single-layer MoS2 transistors. Nat Nanotechnol, 2011. 6(3): p. 147–150. [60] X. He The tunability of electronic and transport properties of InSe/MoSe2 van der Waals heterostructure: A first-principles study Surfaces and Interfaces 36 2023 102634 He, X., et al., The tunability of electronic and transport properties of InSe/MoSe2 van der Waals heterostructure: A first-principles study. Surfaces and Interfaces, 2023. 36: p. 102634. [61] S. Sucharitakul Intrinsic electron mobility exceeding 103 cm2/(Vs) in multilayer InSe FETs Nano Lett. 15 6 2015 3815 3819 Sucharitakul, S., et al., Intrinsic electron mobility exceeding 103 cm2/(Vs) in multilayer InSe FETs. Nano Lett., 2015. 15(6): p. 3815–3819. [62] X. Li A type-II GaP/GaSe van der Waals heterostructure with high carrier mobility and promising photovoltaic properties Appl. Surf. Sci. 618 2023 156544 Li, X., et al., A type-II GaP/GaSe van der Waals heterostructure with high carrier mobility and promising photovoltaic properties. Appl. Surf. Sci., 2023. 618: p. 156544. [63] G.L. Qian Electronic properties and photocatalytic water splitting with high solar-to-hydrogen efficiency in a hBNC/Janus WSSe heterojunction: First-principles calculations Phys. Rev. B 107 15 2023 155306 Qian, G.L., et al., Electronic properties and photocatalytic water splitting with high solar-to-hydrogen efficiency in a hBNC/Janus WSSe heterojunction: First-principles calculations. Phys. Rev. B, 2023. 107(15): p. 155306. [64] S. Teng Large Rashba splitting, carrier mobility, and valley polarization in a 1T-SnS 2/MoTe 2 heterostructure Phys. Chem. Chem. Phys. 23 30 2021 16242 16247 Teng, S., et al., Large Rashba splitting, carrier mobility, and valley polarization in a 1T-SnS 2/MoTe 2 heterostructure. Phys. Chem. Chem. Phys., 2021. 23(30): p. 16242–16247. [65] X. Li Enhanced photocatalysis for water splitting in layered tin chalcogenides with high carrier mobility Phys. Chem. Chem. Phys. 21 14 2019 7559 7566 Li, X., et al., Enhanced photocatalysis for water splitting in layered tin chalcogenides with high carrier mobility. Phys. Chem. Chem. Phys., 2019. 21(14): p. 7559–7566. [66] H. Liu Phosphorene: an unexplored 2D semiconductor with a high hole mobility ACS Nano 8 4 2014 4033 4041 Liu, H., et al., Phosphorene: an unexplored 2D semiconductor with a high hole mobility. ACS Nano, 2014. 8(4): p. 4033–4041. [67] J. Xi First-principles prediction of charge mobility in carbon and organic nanomaterials Nanoscale 4 15 2012 4348 4369 Xi, J., et al., First-principles prediction of charge mobility in carbon and organic nanomaterials. Nanoscale, 2012. 4(15): p. 4348–4369.",
      "scopus-id": "85183669193",
      "coredata": {
        "eid": "1-s2.0-S246882312300799X",
        "dc:description": "Recently, the assembly of novel two-dimensional materials via van der Waals (vdW) interactions to form heterostructures is considered an effective strategy for producing materials with enhanced photocatalytic activities. This study systematically explored the optoelectronic and photocatalytic properties and carrier mobilities of novel ZrSSe/SnX (X = S, Se, S2, Se2) vdW heterostructures using density functional theory. The formation energies, elastic constants, phonon dispersions, and results of ab-initio molecular dynamic simulations indicate structural, mechanical, dynamic, and thermal stability. The electronic band structure and optical properties are calculated using hybrid functional HSE06 for accurate calculations. The results of calculations using the bandgap center technique based on density functional theory show that ZrSSe/SnSe, ZrSSe/SnS2, and ZrSSe/SnSe2 heterostructures possess suitable band edges for photocatalytic overall water splitting. The optical absorption spectrum covers a broad range from 104 in the visible region and increases to 105 in the UV region. Furthermore, the ZrSSe/SnX (X = S, Se, S2, Se2) heterostructures have high carrier mobilities of the order of 105. High mobilities help carriers to move quickly and reduce the recombination rate of holes and electrons. The findings indicate that ZrSSe/SnX (X = S, Se, S2, Se2) heterostructures are potentially efficient visible-light photocatalysts for overall water splitting.",
        "openArchiveArticle": "false",
        "prism:coverDate": "2024-01-15",
        "openaccessUserLicense": null,
        "prism:aggregationType": "Journal",
        "prism:url": "https://api.elsevier.com/content/article/pii/S246882312300799X",
        "dc:creator": [
          {
            "@_fa": "true",
            "$": "Tariq, Zeeshan"
          },
          {
            "@_fa": "true",
            "$": "Rehman, Sajid Ur"
          },
          {
            "@_fa": "true",
            "$": "Butt, Faheem K."
          },
          {
            "@_fa": "true",
            "$": "Zhang, Xiaoming"
          },
          {
            "@_fa": "true",
            "$": "Li, Chuanbo"
          }
        ],
        "link": [
          {
            "@_fa": "true",
            "@rel": "self",
            "@href": "https://api.elsevier.com/content/article/pii/S246882312300799X"
          },
          {
            "@_fa": "true",
            "@rel": "scidir",
            "@href": "https://www.sciencedirect.com/science/article/pii/S246882312300799X"
          }
        ],
        "dc:format": "application/json",
        "openaccessType": null,
        "pii": "S2468-8231(23)00799-X",
        "prism:volume": "553",
        "articleNumber": "113716",
        "prism:publisher": "Elsevier B.V.",
        "dc:title": "High carrier mobility ZrSSe/SnX (X=S, Se, S2, Se2) vdW heterostructures for photocatalytic overall water splitting: A first-principles study",
        "prism:copyright": "© 2023 Elsevier B.V. All rights reserved.",
        "openaccess": "0",
        "prism:issn": "24688231",
        "dcterms:subject": [
          {
            "@_fa": "true",
            "$": "2D materials"
          },
          {
            "@_fa": "true",
            "$": "Heterostructure"
          },
          {
            "@_fa": "true",
            "$": "Photocatalysis"
          },
          {
            "@_fa": "true",
            "$": "Absorption"
          },
          {
            "@_fa": "true",
            "$": "Higher carrier mobilities"
          }
        ],
        "openaccessArticle": "false",
        "prism:publicationName": "Molecular Catalysis",
        "openaccessSponsorType": null,
        "prism:pageRange": "113716",
        "pubType": "fla",
        "prism:coverDisplayDate": "15 January 2024",
        "prism:doi": "10.1016/j.mcat.2023.113716",
        "prism:startingPage": "113716",
        "dc:identifier": "doi:10.1016/j.mcat.2023.113716",
        "openaccessSponsorName": null
      },
      "objects": {
        "object": [
          {
            "@category": "standard",
            "@height": "261",
            "@width": "508",
            "@_fa": "true",
            "$": "https://api.elsevier.com/content/object/eid/1-s2.0-S246882312300799X-gr1.jpg?httpAccept=%2A%2F%2A",
            "@multimediatype": "JPEG image file",
            "@type": "IMAGE-DOWNSAMPLED",
            "@size": "43205",
            "@ref": "gr1",
            "@mimetype": "image/jpeg"
          },
          {
            "@category": "standard",
            "@height": "677",
            "@width": "734",
            "@_fa": "true",
            "$": "https://api.elsevier.com/content/object/eid/1-s2.0-S246882312300799X-gr2.jpg?httpAccept=%2A%2F%2A",
            "@multimediatype": "JPEG image file",
            "@type": "IMAGE-DOWNSAMPLED",
            "@size": "139881",
            "@ref": "gr2",
            "@mimetype": "image/jpeg"
          },
          {
            "@category": "standard",
            "@height": "200",
            "@width": "390",
            "@_fa": "true",
            "$": "https://api.elsevier.com/content/object/eid/1-s2.0-S246882312300799X-ga1.jpg?httpAccept=%2A%2F%2A",
            "@multimediatype": "JPEG image file",
            "@type": "IMAGE-DOWNSAMPLED",
            "@size": "29003",
            "@ref": "ga1",
            "@mimetype": "image/jpeg"
          },
          {
            "@category": "standard",
            "@height": "396",
            "@width": "301",
            "@_fa": "true",
            "$": "https://api.elsevier.com/content/object/eid/1-s2.0-S246882312300799X-gr3.jpg?httpAccept=%2A%2F%2A",
            "@multimediatype": "JPEG image file",
            "@type": "IMAGE-DOWNSAMPLED",
            "@size": "76880",
            "@ref": "gr3",
            "@mimetype": "image/jpeg"
          },
          {
            "@category": "standard",
            "@height": "430",
            "@width": "602",
            "@_fa": "true",
            "$": "https://api.elsevier.com/content/object/eid/1-s2.0-S246882312300799X-gr8.jpg?httpAccept=%2A%2F%2A",
            "@multimediatype": "JPEG image file",
            "@type": "IMAGE-DOWNSAMPLED",
            "@size": "72906",
            "@ref": "gr8",
            "@mimetype": "image/jpeg"
          },
          {
            "@category": "standard",
            "@height": "446",
            "@width": "565",
            "@_fa": "true",
            "$": "https://api.elsevier.com/content/object/eid/1-s2.0-S246882312300799X-gr4.jpg?httpAccept=%2A%2F%2A",
            "@multimediatype": "JPEG image file",
            "@type": "IMAGE-DOWNSAMPLED",
            "@size": "103486",
            "@ref": "gr4",
            "@mimetype": "image/jpeg"
          },
          {
            "@category": "standard",
            "@height": "296",
            "@width": "386",
            "@_fa": "true",
            "$": "https://api.elsevier.com/content/object/eid/1-s2.0-S246882312300799X-gr5.jpg?httpAccept=%2A%2F%2A",
            "@multimediatype": "JPEG image file",
            "@type": "IMAGE-DOWNSAMPLED",
            "@size": "37307",
            "@ref": "gr5",
            "@mimetype": "image/jpeg"
          },
          {
            "@category": "standard",
            "@height": "439",
            "@width": "527",
            "@_fa": "true",
            "$": "https://api.elsevier.com/content/object/eid/1-s2.0-S246882312300799X-gr6.jpg?httpAccept=%2A%2F%2A",
            "@multimediatype": "JPEG image file",
            "@type": "IMAGE-DOWNSAMPLED",
            "@size": "74465",
            "@ref": "gr6",
            "@mimetype": "image/jpeg"
          },
          {
            "@category": "standard",
            "@height": "319",
            "@width": "386",
            "@_fa": "true",
            "$": "https://api.elsevier.com/content/object/eid/1-s2.0-S246882312300799X-gr7.jpg?httpAccept=%2A%2F%2A",
            "@multimediatype": "JPEG image file",
            "@type": "IMAGE-DOWNSAMPLED",
            "@size": "39837",
            "@ref": "gr7",
            "@mimetype": "image/jpeg"
          },
          {
            "@category": "thumbnail",
            "@height": "113",
            "@width": "219",
            "@_fa": "true",
            "$": "https://api.elsevier.com/content/object/eid/1-s2.0-S246882312300799X-gr1.sml?httpAccept=%2A%2F%2A",
            "@multimediatype": "GIF image file",
            "@type": "IMAGE-THUMBNAIL",
            "@size": "9000",
            "@ref": "gr1",
            "@mimetype": "image/gif"
          },
          {
            "@category": "thumbnail",
            "@height": "164",
            "@width": "178",
            "@_fa": "true",
            "$": "https://api.elsevier.com/content/object/eid/1-s2.0-S246882312300799X-gr2.sml?httpAccept=%2A%2F%2A",
            "@multimediatype": "GIF image file",
            "@type": "IMAGE-THUMBNAIL",
            "@size": "15039",
            "@ref": "gr2",
            "@mimetype": "image/gif"
          },
          {
            "@category": "thumbnail",
            "@height": "112",
            "@width": "219",
            "@_fa": "true",
            "$": "https://api.elsevier.com/content/object/eid/1-s2.0-S246882312300799X-ga1.sml?httpAccept=%2A%2F%2A",
            "@multimediatype": "GIF image file",
            "@type": "IMAGE-THUMBNAIL",
            "@size": "10741",
            "@ref": "ga1",
            "@mimetype": "image/gif"
          },
          {
            "@category": "thumbnail",
            "@height": "163",
            "@width": "124",
            "@_fa": "true",
            "$": "https://api.elsevier.com/content/object/eid/1-s2.0-S246882312300799X-gr3.sml?httpAccept=%2A%2F%2A",
            "@multimediatype": "GIF image file",
            "@type": "IMAGE-THUMBNAIL",
            "@size": "13281",
            "@ref": "gr3",
            "@mimetype": "image/gif"
          },
          {
            "@category": "thumbnail",
            "@height": "157",
            "@width": "219",
            "@_fa": "true",
            "$": "https://api.elsevier.com/content/object/eid/1-s2.0-S246882312300799X-gr8.sml?httpAccept=%2A%2F%2A",
            "@multimediatype": "GIF image file",
            "@type": "IMAGE-THUMBNAIL",
            "@size": "13959",
            "@ref": "gr8",
            "@mimetype": "image/gif"
          },
          {
            "@category": "thumbnail",
            "@height": "164",
            "@width": "207",
            "@_fa": "true",
            "$": "https://api.elsevier.com/content/object/eid/1-s2.0-S246882312300799X-gr4.sml?httpAccept=%2A%2F%2A",
            "@multimediatype": "GIF image file",
            "@type": "IMAGE-THUMBNAIL",
            "@size": "16622",
            "@ref": "gr4",
            "@mimetype": "image/gif"
          },
          {
            "@category": "thumbnail",
            "@height": "164",
            "@width": "214",
            "@_fa": "true",
            "$": "https://api.elsevier.com/content/object/eid/1-s2.0-S246882312300799X-gr5.sml?httpAccept=%2A%2F%2A",
            "@multimediatype": "GIF image file",
            "@type": "IMAGE-THUMBNAIL",
            "@size": "10784",
            "@ref": "gr5",
            "@mimetype": "image/gif"
          },
          {
            "@category": "thumbnail",
            "@height": "164",
            "@width": "197",
            "@_fa": "true",
            "$": "https://api.elsevier.com/content/object/eid/1-s2.0-S246882312300799X-gr6.sml?httpAccept=%2A%2F%2A",
            "@multimediatype": "GIF image file",
            "@type": "IMAGE-THUMBNAIL",
            "@size": "12801",
            "@ref": "gr6",
            "@mimetype": "image/gif"
          },
          {
            "@category": "thumbnail",
            "@height": "164",
            "@width": "198",
            "@_fa": "true",
            "$": "https://api.elsevier.com/content/object/eid/1-s2.0-S246882312300799X-gr7.sml?httpAccept=%2A%2F%2A",
            "@multimediatype": "GIF image file",
            "@type": "IMAGE-THUMBNAIL",
            "@size": "15127",
            "@ref": "gr7",
            "@mimetype": "image/gif"
          },
          {
            "@category": "high",
            "@height": "1157",
            "@width": "2250",
            "@_fa": "true",
            "$": "https://api.elsevier.com/content/object/eid/1-s2.0-S246882312300799X-gr1_lrg.jpg?httpAccept=%2A%2F%2A",
            "@multimediatype": "JPEG image file",
            "@type": "IMAGE-HIGH-RES",
            "@size": "276537",
            "@ref": "gr1",
            "@mimetype": "image/jpeg"
          },
          {
            "@category": "high",
            "@height": "2996",
            "@width": "3250",
            "@_fa": "true",
            "$": "https://api.elsevier.com/content/object/eid/1-s2.0-S246882312300799X-gr2_lrg.jpg?httpAccept=%2A%2F%2A",
            "@multimediatype": "JPEG image file",
            "@type": "IMAGE-HIGH-RES",
            "@size": "1088432",
            "@ref": "gr2",
            "@mimetype": "image/jpeg"
          },
          {
            "@category": "high",
            "@height": "886",
            "@width": "1728",
            "@_fa": "true",
            "$": "https://api.elsevier.com/content/object/eid/1-s2.0-S246882312300799X-ga1_lrg.jpg?httpAccept=%2A%2F%2A",
            "@multimediatype": "JPEG image file",
            "@type": "IMAGE-HIGH-RES",
            "@size": "193172",
            "@ref": "ga1",
            "@mimetype": "image/jpeg"
          },
          {
            "@category": "high",
            "@height": "1753",
            "@width": "1333",
            "@_fa": "true",
            "$": "https://api.elsevier.com/content/object/eid/1-s2.0-S246882312300799X-gr3_lrg.jpg?httpAccept=%2A%2F%2A",
            "@multimediatype": "JPEG image file",
            "@type": "IMAGE-HIGH-RES",
            "@size": "534002",
            "@ref": "gr3",
            "@mimetype": "image/jpeg"
          },
          {
            "@category": "high",
            "@height": "1907",
            "@width": "2667",
            "@_fa": "true",
            "$": "https://api.elsevier.com/content/object/eid/1-s2.0-S246882312300799X-gr8_lrg.jpg?httpAccept=%2A%2F%2A",
            "@multimediatype": "JPEG image file",
            "@type": "IMAGE-HIGH-RES",
            "@size": "487750",
            "@ref": "gr8",
            "@mimetype": "image/jpeg"
          },
          {
            "@category": "high",
            "@height": "1975",
            "@width": "2500",
            "@_fa": "true",
            "$": "https://api.elsevier.com/content/object/eid/1-s2.0-S246882312300799X-gr4_lrg.jpg?httpAccept=%2A%2F%2A",
            "@multimediatype": "JPEG image file",
            "@type": "IMAGE-HIGH-RES",
            "@size": "785165",
            "@ref": "gr4",
            "@mimetype": "image/jpeg"
          },
          {
            "@category": "high",
            "@height": "1309",
            "@width": "1708",
            "@_fa": "true",
            "$": "https://api.elsevier.com/content/object/eid/1-s2.0-S246882312300799X-gr5_lrg.jpg?httpAccept=%2A%2F%2A",
            "@multimediatype": "JPEG image file",
            "@type": "IMAGE-HIGH-RES",
            "@size": "223245",
            "@ref": "gr5",
            "@mimetype": "image/jpeg"
          },
          {
            "@category": "high",
            "@height": "1943",
            "@width": "2333",
            "@_fa": "true",
            "$": "https://api.elsevier.com/content/object/eid/1-s2.0-S246882312300799X-gr6_lrg.jpg?httpAccept=%2A%2F%2A",
            "@multimediatype": "JPEG image file",
            "@type": "IMAGE-HIGH-RES",
            "@size": "482573",
            "@ref": "gr6",
            "@mimetype": "image/jpeg"
          },
          {
            "@category": "high",
            "@height": "1411",
            "@width": "1708",
            "@_fa": "true",
            "$": "https://api.elsevier.com/content/object/eid/1-s2.0-S246882312300799X-gr7_lrg.jpg?httpAccept=%2A%2F%2A",
            "@multimediatype": "JPEG image file",
            "@type": "IMAGE-HIGH-RES",
            "@size": "304135",
            "@ref": "gr7",
            "@mimetype": "image/jpeg"
          },
          {
            "@category": "standard",
            "@_fa": "true",
            "$": "https://api.elsevier.com/content/object/eid/1-s2.0-S246882312300799X-mmc1.docx?httpAccept=%2A%2F%2A",
            "@multimediatype": "Microsoft Word file",
            "@type": "APPLICATION",
            "@size": "2947195",
            "@ref": "mmc1",
            "@mimetype": "application/word"
          },
          {
            "@category": "thumbnail",
            "@_fa": "true",
            "$": "https://api.elsevier.com/content/object/eid/1-s2.0-S246882312300799X-si1.svg?httpAccept=%2A%2F%2A",
            "@multimediatype": "Scalable Vector Graphics file",
            "@type": "ALTIMG",
            "@size": "5050",
            "@ref": "si1",
            "@mimetype": "image/svg+xml"
          },
          {
            "@category": "thumbnail",
            "@_fa": "true",
            "$": "https://api.elsevier.com/content/object/eid/1-s2.0-S246882312300799X-si10.svg?httpAccept=%2A%2F%2A",
            "@multimediatype": "Scalable Vector Graphics file",
            "@type": "ALTIMG",
            "@size": "10302",
            "@ref": "si10",
            "@mimetype": "image/svg+xml"
          },
          {
            "@category": "thumbnail",
            "@_fa": "true",
            "$": "https://api.elsevier.com/content/object/eid/1-s2.0-S246882312300799X-si11.svg?httpAccept=%2A%2F%2A",
            "@multimediatype": "Scalable Vector Graphics file",
            "@type": "ALTIMG",
            "@size": "5628",
            "@ref": "si11",
            "@mimetype": "image/svg+xml"
          },
          {
            "@category": "thumbnail",
            "@_fa": "true",
            "$": "https://api.elsevier.com/content/object/eid/1-s2.0-S246882312300799X-si12.svg?httpAccept=%2A%2F%2A",
            "@multimediatype": "Scalable Vector Graphics file",
            "@type": "ALTIMG",
            "@size": "4151",
            "@ref": "si12",
            "@mimetype": "image/svg+xml"
          },
          {
            "@category": "thumbnail",
            "@_fa": "true",
            "$": "https://api.elsevier.com/content/object/eid/1-s2.0-S246882312300799X-si13.svg?httpAccept=%2A%2F%2A",
            "@multimediatype": "Scalable Vector Graphics file",
            "@type": "ALTIMG",
            "@size": "19135",
            "@ref": "si13",
            "@mimetype": "image/svg+xml"
          },
          {
            "@category": "thumbnail",
            "@_fa": "true",
            "$": "https://api.elsevier.com/content/object/eid/1-s2.0-S246882312300799X-si14.svg?httpAccept=%2A%2F%2A",
            "@multimediatype": "Scalable Vector Graphics file",
            "@type": "ALTIMG",
            "@size": "8407",
            "@ref": "si14",
            "@mimetype": "image/svg+xml"
          },
          {
            "@category": "thumbnail",
            "@_fa": "true",
            "$": "https://api.elsevier.com/content/object/eid/1-s2.0-S246882312300799X-si15.svg?httpAccept=%2A%2F%2A",
            "@multimediatype": "Scalable Vector Graphics file",
            "@type": "ALTIMG",
            "@size": "2767",
            "@ref": "si15",
            "@mimetype": "image/svg+xml"
          },
          {
            "@category": "thumbnail",
            "@_fa": "true",
            "$": "https://api.elsevier.com/content/object/eid/1-s2.0-S246882312300799X-si16.svg?httpAccept=%2A%2F%2A",
            "@multimediatype": "Scalable Vector Graphics file",
            "@type": "ALTIMG",
            "@size": "2897",
            "@ref": "si16",
            "@mimetype": "image/svg+xml"
          },
          {
            "@category": "thumbnail",
            "@_fa": "true",
            "$": "https://api.elsevier.com/content/object/eid/1-s2.0-S246882312300799X-si17.svg?httpAccept=%2A%2F%2A",
            "@multimediatype": "Scalable Vector Graphics file",
            "@type": "ALTIMG",
            "@size": "12472",
            "@ref": "si17",
            "@mimetype": "image/svg+xml"
          },
          {
            "@category": "thumbnail",
            "@_fa": "true",
            "$": "https://api.elsevier.com/content/object/eid/1-s2.0-S246882312300799X-si18.svg?httpAccept=%2A%2F%2A",
            "@multimediatype": "Scalable Vector Graphics file",
            "@type": "ALTIMG",
            "@size": "6415",
            "@ref": "si18",
            "@mimetype": "image/svg+xml"
          },
          {
            "@category": "thumbnail",
            "@_fa": "true",
            "$": "https://api.elsevier.com/content/object/eid/1-s2.0-S246882312300799X-si19.svg?httpAccept=%2A%2F%2A",
            "@multimediatype": "Scalable Vector Graphics file",
            "@type": "ALTIMG",
            "@size": "5580",
            "@ref": "si19",
            "@mimetype": "image/svg+xml"
          },
          {
            "@category": "thumbnail",
            "@_fa": "true",
            "$": "https://api.elsevier.com/content/object/eid/1-s2.0-S246882312300799X-si2.svg?httpAccept=%2A%2F%2A",
            "@multimediatype": "Scalable Vector Graphics file",
            "@type": "ALTIMG",
            "@size": "6122",
            "@ref": "si2",
            "@mimetype": "image/svg+xml"
          },
          {
            "@category": "thumbnail",
            "@_fa": "true",
            "$": "https://api.elsevier.com/content/object/eid/1-s2.0-S246882312300799X-si20.svg?httpAccept=%2A%2F%2A",
            "@multimediatype": "Scalable Vector Graphics file",
            "@type": "ALTIMG",
            "@size": "5642",
            "@ref": "si20",
            "@mimetype": "image/svg+xml"
          },
          {
            "@category": "thumbnail",
            "@_fa": "true",
            "$": "https://api.elsevier.com/content/object/eid/1-s2.0-S246882312300799X-si21.svg?httpAccept=%2A%2F%2A",
            "@multimediatype": "Scalable Vector Graphics file",
            "@type": "ALTIMG",
            "@size": "14481",
            "@ref": "si21",
            "@mimetype": "image/svg+xml"
          },
          {
            "@category": "thumbnail",
            "@_fa": "true",
            "$": "https://api.elsevier.com/content/object/eid/1-s2.0-S246882312300799X-si22.svg?httpAccept=%2A%2F%2A",
            "@multimediatype": "Scalable Vector Graphics file",
            "@type": "ALTIMG",
            "@size": "3982",
            "@ref": "si22",
            "@mimetype": "image/svg+xml"
          },
          {
            "@category": "thumbnail",
            "@_fa": "true",
            "$": "https://api.elsevier.com/content/object/eid/1-s2.0-S246882312300799X-si3.svg?httpAccept=%2A%2F%2A",
            "@multimediatype": "Scalable Vector Graphics file",
            "@type": "ALTIMG",
            "@size": "4477",
            "@ref": "si3",
            "@mimetype": "image/svg+xml"
          },
          {
            "@category": "thumbnail",
            "@_fa": "true",
            "$": "https://api.elsevier.com/content/object/eid/1-s2.0-S246882312300799X-si4.svg?httpAccept=%2A%2F%2A",
            "@multimediatype": "Scalable Vector Graphics file",
            "@type": "ALTIMG",
            "@size": "5657",
            "@ref": "si4",
            "@mimetype": "image/svg+xml"
          },
          {
            "@category": "thumbnail",
            "@_fa": "true",
            "$": "https://api.elsevier.com/content/object/eid/1-s2.0-S246882312300799X-si5.svg?httpAccept=%2A%2F%2A",
            "@multimediatype": "Scalable Vector Graphics file",
            "@type": "ALTIMG",
            "@size": "2144",
            "@ref": "si5",
            "@mimetype": "image/svg+xml"
          },
          {
            "@category": "thumbnail",
            "@_fa": "true",
            "$": "https://api.elsevier.com/content/object/eid/1-s2.0-S246882312300799X-si6.svg?httpAccept=%2A%2F%2A",
            "@multimediatype": "Scalable Vector Graphics file",
            "@type": "ALTIMG",
            "@size": "11335",
            "@ref": "si6",
            "@mimetype": "image/svg+xml"
          },
          {
            "@category": "thumbnail",
            "@_fa": "true",
            "$": "https://api.elsevier.com/content/object/eid/1-s2.0-S246882312300799X-si7.svg?httpAccept=%2A%2F%2A",
            "@multimediatype": "Scalable Vector Graphics file",
            "@type": "ALTIMG",
            "@size": "9324",
            "@ref": "si7",
            "@mimetype": "image/svg+xml"
          },
          {
            "@category": "thumbnail",
            "@_fa": "true",
            "$": "https://api.elsevier.com/content/object/eid/1-s2.0-S246882312300799X-si8.svg?httpAccept=%2A%2F%2A",
            "@multimediatype": "Scalable Vector Graphics file",
            "@type": "ALTIMG",
            "@size": "5906",
            "@ref": "si8",
            "@mimetype": "image/svg+xml"
          },
          {
            "@category": "thumbnail",
            "@_fa": "true",
            "$": "https://api.elsevier.com/content/object/eid/1-s2.0-S246882312300799X-si9.svg?httpAccept=%2A%2F%2A",
            "@multimediatype": "Scalable Vector Graphics file",
            "@type": "ALTIMG",
            "@size": "4587",
            "@ref": "si9",
            "@mimetype": "image/svg+xml"
          },
          {
            "@category": "standard",
            "@_fa": "true",
            "$": "https://api.elsevier.com/content/object/eid/1-s2.0-S246882312300799X-am.pdf?httpAccept=%2A%2F%2A",
            "@multimediatype": "Acrobat PDF file",
            "@type": "AAM-PDF",
            "@size": "1321198",
            "@ref": "am",
            "@mimetype": "application/pdf"
          }
        ]
      },
      "link": {
        "@rel": "abstract",
        "@href": "https://api.elsevier.com/content/abstract/scopus_id/85183669193"
      }
    }
  }
}