{
  "metadata": {
    "title": "Polydopamine modified heteropolyacids catalyst for methacrolein oxidation: Organic ammonia functionalized and regulation of morphology",
    "authors": "; ; ",
    "journal": "Molecular Catalysis",
    "date": "2023-11-30",
    "doi": "10.1016/j.mcat.2023.113571",
    "abstract": "",
    "uri": "https://api.elsevier.com/content/article/pii/S2468823123006545",
    "pii": "S2468823123006545"
  },
  "fulltext": {
    "full-text-retrieval-response": {
      "scopus-eid": "2-s2.0-85171687568",
      "originalText": "serial JL 315758 291210 291744 291790 291809 31 Molecular Catalysis MOLECULARCATALYSIS 2023-09-21 2023-09-21 2023-09-21 2023-09-21 2024-03-01T15:59:47 1-s2.0-S2468823123006545 S2468-8231(23)00654-5 S2468823123006545 10.1016/j.mcat.2023.113571 S300 S300.1 FULL-TEXT 1-s2.0-S2468823123X00169 2024-06-26T17:47:57.959873Z 0 0 20231101 20231130 2023 2023-09-21T04:16:22.295211Z absattachment articleinfo articlenumber articletitlenorm authfirstinitialnorm authfirstsurnamenorm cid cids contenttype copyright crossmark dateloaded dateloadedtxt datesearch datesort dateupdated dco docsubtype doctype doi eid ewtransactionid hubeid indexeddate issn issnnorm itemstage itemtransactionid itemweight openaccess openarchive pg pgfirst pii piinorm pubdateend pubdatestart pubdatetxt pubyr sectiontitle sortorder srctitle srctitlenorm srctype ssids alllist content subj subheadings suppl tomb volfirst volissue volumelist webpdf webpdfpagecount yearnav figure table e-component body acknowledge affil appendices articletitle auth authfirstini authfull authkeywords authlast footnotes grantnumber grantsponsor grantsponsorid highlightsabst primabst ref specialabst 2468-8231 24688231 true 550 550 C Volume 550 25 113571 113571 113571 202311 November 2023 2023-11-01 2023-11-30 2023 Regular Papers article fla © 2023 Elsevier B.V. All rights reserved. POLYDOPAMINEMODIFIEDHETEROPOLYACIDSCATALYSTFORMETHACROLEINOXIDATIONORGANICAMMONIAFUNCTIONALIZEDREGULATIONMORPHOLOGY LI Y Introduction Experimental section Materials Catalysts preparation Characterization of catalysts Catalytic reaction experiment Results and discussion Characterization of catalysts Catalytic performance of the catalysts Effect of reaction temperature on the performance of catalyst Preparation reproducibility and stability evaluation of catalysts General discussion Conclusion Credit author statement Acknowledgements Appendix Supplementary materials References CAO 2017 653 664 Y DEUSSER 1998 3230 3236 L MAROSI 2003 235 240 L M 1996 981 990 D LIU 2016 85 92 S KIM 2007 159 165 H MARCHALROCH 2000 173 181 C LANGPAPE 2000 89 101 M KONISHI 1982 169 179 Y SCHINDLER 2003 G MARCHALROCH 2000 143 150 C PIZZIO 2003 265 277 L STYTSENKO 2000 212 216 V TOKARZSOBIERAJ 2017 20 25 R KNAPPA 2001 111 119 C SULTAN 2004 141 152 M LIU 2022 Y CAO 2018 254 263 Y JING 2013 10095 10104 L WANG 2023 887 897 B CAO 2018 1657 1667 Y YANG 2012 252 256 L GUO 2014 1154 1161 W WEI 2022 1935 1948 Z ROSE 2022 I RYU 2018 7523 7540 J KONG 2016 15604 15610 X LEE 2007 426 430 H SUN 2016 10662 10666 T ZHU 2023 Q QU 2018 289 296 W GUO 2008 697 702 X TANDEKAR 2022 5521 5531 K ZHENG 2015 11671 11677 W WEI 2010 1430 1433 Q ZHANG 2021 B JING 2014 121 135 F ZHOU 2015 431 440 L DONG 2015 1474 1480 R ZHU 2015 4164 4173 H ZHANG 2013 4484 4490 H ZHOU 2017 153 161 L CAO 2020 1774 1785 Y CEN 2012 5769 5777 W JENTOFT 2003 291 317 F LEE 2000 2977 2983 J KOZHEVNIKOV 2007 86 92 I KHATTAK 2009 2148 2155 G MA 2015 15531 15541 F DING 2017 10338 10343 Y ZHOU 2019 44 49 L LIX2023X113571 LIX2023X113571XY 2025-09-21T00:00:00.000Z 2025-09-21T00:00:00.000Z http://creativecommons.org/licenses/by-nc-nd/4.0/ © 2023 Elsevier B.V. All rights reserved. 2023-09-24T02:59:01.876Z http://vtw.elsevier.com/data/voc/AddOnTypes/50.7/aggregated-refined National Natural Science Foundation of China 21606168 NSFC National Natural Science Foundation of China http://data.elsevier.com/vocabulary/SciValFunders/501100001809 http://sws.geonames.org/1814991/ This work was financially supported by the National Natural Science Foundation of China (No. 21606168 ). https://doi.org/10.15223/policy-017 https://doi.org/10.15223/policy-037 https://doi.org/10.15223/policy-012 https://doi.org/10.15223/policy-029 https://doi.org/10.15223/policy-004 item S2468-8231(23)00654-5 S2468823123006545 1-s2.0-S2468823123006545 10.1016/j.mcat.2023.113571 315758 2024-03-01T16:30:11.423025Z 2023-11-01 2023-11-30 1-s2.0-S2468823123006545-main.pdf https://s3-eu-west-1.amazonaws.com/prod-ucs-content-store-eu-west/content/pii:S2468823123006545/MAIN/application/pdf/ac80d4370a9a92d41aa18bcbb2e959ee/main.pdf main.pdf pdf true 7207990 MAIN 12 1-s2.0-S2468823123006545-main_1.png https://s3-eu-west-1.amazonaws.com/prod-ucs-content-store-eu-west/content/pii:S2468823123006545/PREVIEW/image/png/202d43acd12827a9f0825ecc5f2007a6/main_1.png main_1.png png 59281 849 656 IMAGE-WEB-PDF 1 1-s2.0-S2468823123006545-gr6.jpg https://s3-eu-west-1.amazonaws.com/prod-ucs-content-store-eu-west/content/pii:S2468823123006545/gr6/DOWNSAMPLED/image/jpeg/7209a4417f0a86ee1b0d675eda9441a0/gr6.jpg gr6 gr6.jpg jpg 26623 299 339 IMAGE-DOWNSAMPLED 1-s2.0-S2468823123006545-gr12.jpg https://s3-eu-west-1.amazonaws.com/prod-ucs-content-store-eu-west/content/pii:S2468823123006545/gr12/DOWNSAMPLED/image/jpeg/a19e85b7011e426360b351ea656fd42e/gr12.jpg gr12 gr12.jpg jpg 49638 298 715 IMAGE-DOWNSAMPLED 1-s2.0-S2468823123006545-gr13.jpg https://s3-eu-west-1.amazonaws.com/prod-ucs-content-store-eu-west/content/pii:S2468823123006545/gr13/DOWNSAMPLED/image/jpeg/bcc2a23e98749a81351649783e4147d1/gr13.jpg gr13 gr13.jpg jpg 56547 292 715 IMAGE-DOWNSAMPLED 1-s2.0-S2468823123006545-gr2.jpg https://s3-eu-west-1.amazonaws.com/prod-ucs-content-store-eu-west/content/pii:S2468823123006545/gr2/DOWNSAMPLED/image/jpeg/da7614cb07e7799479bae4074d7708ad/gr2.jpg gr2 gr2.jpg jpg 71335 291 715 IMAGE-DOWNSAMPLED 1-s2.0-S2468823123006545-gr3.jpg https://s3-eu-west-1.amazonaws.com/prod-ucs-content-store-eu-west/content/pii:S2468823123006545/gr3/DOWNSAMPLED/image/jpeg/f324027ba75983ae367dd4d28d51e272/gr3.jpg gr3 gr3.jpg jpg 117692 422 565 IMAGE-DOWNSAMPLED 1-s2.0-S2468823123006545-gr4.jpg https://s3-eu-west-1.amazonaws.com/prod-ucs-content-store-eu-west/content/pii:S2468823123006545/gr4/DOWNSAMPLED/image/jpeg/b3ec0ad51436301a8a2b4352759d5b59/gr4.jpg gr4 gr4.jpg jpg 41560 180 565 IMAGE-DOWNSAMPLED 1-s2.0-S2468823123006545-gr14.jpg https://s3-eu-west-1.amazonaws.com/prod-ucs-content-store-eu-west/content/pii:S2468823123006545/gr14/DOWNSAMPLED/image/jpeg/dfd0ccfcacc5b16d65bec432f27547b5/gr14.jpg gr14 gr14.jpg jpg 58479 290 489 IMAGE-DOWNSAMPLED 1-s2.0-S2468823123006545-gr5.jpg https://s3-eu-west-1.amazonaws.com/prod-ucs-content-store-eu-west/content/pii:S2468823123006545/gr5/DOWNSAMPLED/image/jpeg/1616f2eabc53f23f7fbe36cb8cd60109/gr5.jpg gr5 gr5.jpg jpg 79177 550 715 IMAGE-DOWNSAMPLED 1-s2.0-S2468823123006545-gr15.jpg https://s3-eu-west-1.amazonaws.com/prod-ucs-content-store-eu-west/content/pii:S2468823123006545/gr15/DOWNSAMPLED/image/jpeg/046b60b8a2d46646c2fe7c9c5551d86f/gr15.jpg gr15 true gr15.jpg jpg 40172 200 395 IMAGE-DOWNSAMPLED 1-s2.0-S2468823123006545-gr8.jpg https://s3-eu-west-1.amazonaws.com/prod-ucs-content-store-eu-west/content/pii:S2468823123006545/gr8/DOWNSAMPLED/image/jpeg/3964cbda21777b2127f48395b5e4c9f4/gr8.jpg gr8 gr8.jpg jpg 46334 293 715 IMAGE-DOWNSAMPLED 1-s2.0-S2468823123006545-gr7.jpg https://s3-eu-west-1.amazonaws.com/prod-ucs-content-store-eu-west/content/pii:S2468823123006545/gr7/DOWNSAMPLED/image/jpeg/d9b14e3ff6ce2bd2cb9bd166cfd671e9/gr7.jpg gr7 gr7.jpg jpg 24635 299 339 IMAGE-DOWNSAMPLED 1-s2.0-S2468823123006545-gr9.jpg https://s3-eu-west-1.amazonaws.com/prod-ucs-content-store-eu-west/content/pii:S2468823123006545/gr9/DOWNSAMPLED/image/jpeg/88db7ec6082ba7240011035fb4c796b1/gr9.jpg gr9 gr9.jpg jpg 114283 602 715 IMAGE-DOWNSAMPLED 1-s2.0-S2468823123006545-gr10.jpg https://s3-eu-west-1.amazonaws.com/prod-ucs-content-store-eu-west/content/pii:S2468823123006545/gr10/DOWNSAMPLED/image/jpeg/b67d8b7f726253c2f861d0a49d14dc72/gr10.jpg gr10 gr10.jpg jpg 110302 574 715 IMAGE-DOWNSAMPLED 1-s2.0-S2468823123006545-gr11.jpg https://s3-eu-west-1.amazonaws.com/prod-ucs-content-store-eu-west/content/pii:S2468823123006545/gr11/DOWNSAMPLED/image/jpeg/9c1c512721e167d858e7afb576b89a1b/gr11.jpg gr11 gr11.jpg jpg 54826 298 715 IMAGE-DOWNSAMPLED 1-s2.0-S2468823123006545-gr1.jpg https://s3-eu-west-1.amazonaws.com/prod-ucs-content-store-eu-west/content/pii:S2468823123006545/gr1/DOWNSAMPLED/image/jpeg/92a69e9fd4329d92166e7ae3132de4f5/gr1.jpg gr1 gr1.jpg jpg 72904 293 715 IMAGE-DOWNSAMPLED 1-s2.0-S2468823123006545-gr6.sml https://s3-eu-west-1.amazonaws.com/prod-ucs-content-store-eu-west/content/pii:S2468823123006545/gr6/THUMBNAIL/image/gif/212d2033ca551e948ea7a70cd98ad8df/gr6.sml gr6 gr6.sml sml 9158 164 186 IMAGE-THUMBNAIL 1-s2.0-S2468823123006545-gr12.sml https://s3-eu-west-1.amazonaws.com/prod-ucs-content-store-eu-west/content/pii:S2468823123006545/gr12/THUMBNAIL/image/gif/1d94c39523ed803314de45cf93050523/gr12.sml gr12 gr12.sml sml 7978 91 219 IMAGE-THUMBNAIL 1-s2.0-S2468823123006545-gr13.sml https://s3-eu-west-1.amazonaws.com/prod-ucs-content-store-eu-west/content/pii:S2468823123006545/gr13/THUMBNAIL/image/gif/0074fce3f8ededff111d2467972385ef/gr13.sml gr13 gr13.sml sml 8386 90 219 IMAGE-THUMBNAIL 1-s2.0-S2468823123006545-gr2.sml https://s3-eu-west-1.amazonaws.com/prod-ucs-content-store-eu-west/content/pii:S2468823123006545/gr2/THUMBNAIL/image/gif/6b5de55b7d3390f90bdff529cd1883ce/gr2.sml gr2 gr2.sml sml 9415 89 219 IMAGE-THUMBNAIL 1-s2.0-S2468823123006545-gr3.sml https://s3-eu-west-1.amazonaws.com/prod-ucs-content-store-eu-west/content/pii:S2468823123006545/gr3/THUMBNAIL/image/gif/37af5409eb564ef36373037af0d1ed6a/gr3.sml gr3 gr3.sml sml 34125 164 219 IMAGE-THUMBNAIL 1-s2.0-S2468823123006545-gr4.sml https://s3-eu-west-1.amazonaws.com/prod-ucs-content-store-eu-west/content/pii:S2468823123006545/gr4/THUMBNAIL/image/gif/7433822685ca966e88d97fb94c029ce0/gr4.sml gr4 gr4.sml sml 10026 70 219 IMAGE-THUMBNAIL 1-s2.0-S2468823123006545-gr14.sml https://s3-eu-west-1.amazonaws.com/prod-ucs-content-store-eu-west/content/pii:S2468823123006545/gr14/THUMBNAIL/image/gif/a9a48e8c0c72d48e3c2bbe6d402a9382/gr14.sml gr14 gr14.sml sml 15677 130 219 IMAGE-THUMBNAIL 1-s2.0-S2468823123006545-gr5.sml https://s3-eu-west-1.amazonaws.com/prod-ucs-content-store-eu-west/content/pii:S2468823123006545/gr5/THUMBNAIL/image/gif/4cb12d96795b744131c8452e215ad911/gr5.sml gr5 gr5.sml sml 8741 164 213 IMAGE-THUMBNAIL 1-s2.0-S2468823123006545-gr15.sml https://s3-eu-west-1.amazonaws.com/prod-ucs-content-store-eu-west/content/pii:S2468823123006545/gr15/THUMBNAIL/image/gif/900af18a372977dfe0f2c1e4aa5e05dc/gr15.sml gr15 true gr15.sml sml 14574 111 219 IMAGE-THUMBNAIL 1-s2.0-S2468823123006545-gr8.sml https://s3-eu-west-1.amazonaws.com/prod-ucs-content-store-eu-west/content/pii:S2468823123006545/gr8/THUMBNAIL/image/gif/fc7aba09f0bec130f43daabf8c8f6a1e/gr8.sml gr8 gr8.sml sml 7437 90 219 IMAGE-THUMBNAIL 1-s2.0-S2468823123006545-gr7.sml https://s3-eu-west-1.amazonaws.com/prod-ucs-content-store-eu-west/content/pii:S2468823123006545/gr7/THUMBNAIL/image/gif/d2e221dad96fd7adddbd26662eed5176/gr7.sml gr7 gr7.sml sml 9344 164 186 IMAGE-THUMBNAIL 1-s2.0-S2468823123006545-gr9.sml https://s3-eu-west-1.amazonaws.com/prod-ucs-content-store-eu-west/content/pii:S2468823123006545/gr9/THUMBNAIL/image/gif/c721e9037041e717a3faff3431de7acb/gr9.sml gr9 gr9.sml sml 11950 164 195 IMAGE-THUMBNAIL 1-s2.0-S2468823123006545-gr10.sml https://s3-eu-west-1.amazonaws.com/prod-ucs-content-store-eu-west/content/pii:S2468823123006545/gr10/THUMBNAIL/image/gif/1e5425b4421f7ac958c1b21f8fdc98ab/gr10.sml gr10 gr10.sml sml 12407 164 204 IMAGE-THUMBNAIL 1-s2.0-S2468823123006545-gr11.sml https://s3-eu-west-1.amazonaws.com/prod-ucs-content-store-eu-west/content/pii:S2468823123006545/gr11/THUMBNAIL/image/gif/05afb40d077c9c79a61d52fd62be87ad/gr11.sml gr11 gr11.sml sml 7946 91 219 IMAGE-THUMBNAIL 1-s2.0-S2468823123006545-gr1.sml https://s3-eu-west-1.amazonaws.com/prod-ucs-content-store-eu-west/content/pii:S2468823123006545/gr1/THUMBNAIL/image/gif/ac082cde0ee06b7de455544be0264305/gr1.sml gr1 gr1.sml sml 9412 90 219 IMAGE-THUMBNAIL 1-s2.0-S2468823123006545-gr6_lrg.jpg https://s3-eu-west-1.amazonaws.com/prod-ucs-content-store-eu-west/content/pii:S2468823123006545/HIGHRES/image/jpeg/3f6ccd9ba6cd094f550adc27bda1a859/gr6_lrg.jpg gr6 gr6_lrg.jpg jpg 193776 1324 1500 IMAGE-HIGH-RES 1-s2.0-S2468823123006545-gr12_lrg.jpg https://s3-eu-west-1.amazonaws.com/prod-ucs-content-store-eu-west/content/pii:S2468823123006545/HIGHRES/image/jpeg/d8aacf131217a3e837d9eead95dc3eb5/gr12_lrg.jpg gr12 gr12_lrg.jpg jpg 354671 1318 3167 IMAGE-HIGH-RES 1-s2.0-S2468823123006545-gr13_lrg.jpg https://s3-eu-west-1.amazonaws.com/prod-ucs-content-store-eu-west/content/pii:S2468823123006545/HIGHRES/image/jpeg/3f5668b12518e98ad0515ec91f5995bb/gr13_lrg.jpg gr13 gr13_lrg.jpg jpg 401404 1295 3167 IMAGE-HIGH-RES 1-s2.0-S2468823123006545-gr2_lrg.jpg https://s3-eu-west-1.amazonaws.com/prod-ucs-content-store-eu-west/content/pii:S2468823123006545/HIGHRES/image/jpeg/c6329b37cd1e21ebe17701aded1f9974/gr2_lrg.jpg gr2 gr2_lrg.jpg jpg 521673 1287 3167 IMAGE-HIGH-RES 1-s2.0-S2468823123006545-gr3_lrg.jpg https://s3-eu-west-1.amazonaws.com/prod-ucs-content-store-eu-west/content/pii:S2468823123006545/HIGHRES/image/jpeg/a516046744b6624afb533e7ee33971d5/gr3_lrg.jpg gr3 gr3_lrg.jpg jpg 1014598 1868 2500 IMAGE-HIGH-RES 1-s2.0-S2468823123006545-gr4_lrg.jpg https://s3-eu-west-1.amazonaws.com/prod-ucs-content-store-eu-west/content/pii:S2468823123006545/HIGHRES/image/jpeg/0369ecbc664a010a697dd7034a1132ae/gr4_lrg.jpg gr4 gr4_lrg.jpg jpg 343582 797 2500 IMAGE-HIGH-RES 1-s2.0-S2468823123006545-gr14_lrg.jpg https://s3-eu-west-1.amazonaws.com/prod-ucs-content-store-eu-west/content/pii:S2468823123006545/HIGHRES/image/jpeg/fd724e07973eb59323f3701ce6cd1eb0/gr14_lrg.jpg gr14 gr14_lrg.jpg jpg 451379 1287 2167 IMAGE-HIGH-RES 1-s2.0-S2468823123006545-gr5_lrg.jpg https://s3-eu-west-1.amazonaws.com/prod-ucs-content-store-eu-west/content/pii:S2468823123006545/HIGHRES/image/jpeg/1b7bcab4ee4a293816f0ab79d064ea93/gr5_lrg.jpg gr5 gr5_lrg.jpg jpg 577636 2435 3167 IMAGE-HIGH-RES 1-s2.0-S2468823123006545-gr15_lrg.jpg https://s3-eu-west-1.amazonaws.com/prod-ucs-content-store-eu-west/content/pii:S2468823123006545/HIGHRES/image/jpeg/f4b6d380c945d35c60b58fb9f1b8f65d/gr15_lrg.jpg gr15 true gr15_lrg.jpg jpg 303300 886 1748 IMAGE-HIGH-RES 1-s2.0-S2468823123006545-gr8_lrg.jpg https://s3-eu-west-1.amazonaws.com/prod-ucs-content-store-eu-west/content/pii:S2468823123006545/HIGHRES/image/jpeg/9da65ef305fc900e4745f7e4c498b285/gr8_lrg.jpg gr8 gr8_lrg.jpg jpg 324817 1297 3167 IMAGE-HIGH-RES 1-s2.0-S2468823123006545-gr7_lrg.jpg https://s3-eu-west-1.amazonaws.com/prod-ucs-content-store-eu-west/content/pii:S2468823123006545/HIGHRES/image/jpeg/a63f24829f07f74ecb36ff38fcb024e7/gr7_lrg.jpg gr7 gr7_lrg.jpg jpg 189415 1323 1500 IMAGE-HIGH-RES 1-s2.0-S2468823123006545-gr9_lrg.jpg https://s3-eu-west-1.amazonaws.com/prod-ucs-content-store-eu-west/content/pii:S2468823123006545/HIGHRES/image/jpeg/5c6e672464248335145766f977760e9c/gr9_lrg.jpg gr9 gr9_lrg.jpg jpg 827242 2665 3167 IMAGE-HIGH-RES 1-s2.0-S2468823123006545-gr10_lrg.jpg https://s3-eu-west-1.amazonaws.com/prod-ucs-content-store-eu-west/content/pii:S2468823123006545/HIGHRES/image/jpeg/be8bfade4d5b54dd88f072f212666360/gr10_lrg.jpg gr10 gr10_lrg.jpg jpg 769297 2543 3167 IMAGE-HIGH-RES 1-s2.0-S2468823123006545-gr11_lrg.jpg https://s3-eu-west-1.amazonaws.com/prod-ucs-content-store-eu-west/content/pii:S2468823123006545/HIGHRES/image/jpeg/9b09a77c8438316ed5b24cc80145c4fd/gr11_lrg.jpg gr11 gr11_lrg.jpg jpg 402073 1321 3167 IMAGE-HIGH-RES 1-s2.0-S2468823123006545-gr1_lrg.jpg https://s3-eu-west-1.amazonaws.com/prod-ucs-content-store-eu-west/content/pii:S2468823123006545/HIGHRES/image/jpeg/7cb799ee85e8e9c4f6384241d835fe45/gr1_lrg.jpg gr1 gr1_lrg.jpg jpg 526783 1296 3167 IMAGE-HIGH-RES 1-s2.0-S2468823123006545-mmc1.docx https://s3-eu-west-1.amazonaws.com/prod-ucs-content-store-eu-west/content/pii:S2468823123006545/mmc1/MAIN/application/vnd.openxmlformats-officedocument.wordprocessingml.document/9dcac0c8286fff4f4b2898adb953ac6b/mmc1.docx mmc1 mmc1.docx docx 148150 APPLICATION 1-s2.0-S2468823123006545-am.pdf https://s3-eu-west-1.amazonaws.com/prod-ucs-content-store-eu-west/content/egi:1059FFRR0Q1/MAIN/application/pdf/755f915d3a04260d4a287cf9fb83db92/am.pdf am am.pdf pdf false 3057759 AAM-PDF MCAT 113571 113571 S2468-8231(23)00654-5 10.1016/j.mcat.2023.113571 Elsevier B.V. Fig. 1 FT-IR spectra of PDA, PDA-CsPAV and CsPAV (a). The signal amplification of the samples in 2000–500 cm−1 (b). Fig 1 Fig. 2 XRD spectra of PDA, PDA-CsPAV and CsPAV (a). The signal amplification of the samples in 20∼32 ° (b). Fig 2 Fig. 3 SEM images of the PDA (a), uncalcined PDA-CsPAV (b), calcined PDA-CsPAV (c) and calcined CsPAV (d). Fig 3 Fig. 4 Proposed synthetic scheme of PDA-CsPAV catalyst. Fig 4 Fig. 5 TG and DTA curves of PDA (a), uncalcined CsPAV (b) and uncalcined PDA-CsPAV (c). Fig 5 Fig. 6 NH3-TPD profiles of PDA-CsPAV and CsPAV. Fig 6 Fig. 7 H2-TPR profiles of calcined PDA-CsPAV and CsPAV. Fig 7 Fig. 8 N 1s XPS spectra of PDA-CsPAV before (a) and after (b) calcination. Fig 8 Fig. 9 V 2p3/2 XPS spectra of CsPAV (a,b) and PDA-CsPAV (c,d) before and after calcination. Fig 9 Fig. 10 O 1s XPS spectra of CsPAV (a,b) and PDA-CsPAV (c,d) before and after calcination. Fig 10 Fig. 11 Effect of reaction temperature on the performance of PDA-CsPAV (a) and CsPAV (b). Fig 11 Fig. 12 Preparation reproducibility (a) and catalytic stability (b) tests of PDA-CsPAV. Fig 12 Fig. 13 FT-IR spectra (a) and XRD pattern (b) of PDA-CsPAV after the long-term performance test. Fig 13 Fig. 14 Plausible formation mechanism of composite PDA-CsPAV catalyst and the effect of the formation of NH4 + on the catalytic active sites. Fig 14 Table 1 Elemental distribution on the surface of CsPAV and PDA-CsPAV before and after calcination. Table 1 Sample Atomic ratio P/Mo/N/V Molar ratio V4+/V5+ NH4 +/Mo6+ Od/OB/Oi 1 2.42/13.65/-/0.89 0.31 – 0.46/0.30/0.24 2 2.34/13.89/-/0.63 0.40 – 0.50/0.28/0.22 3 1.53/7.69/0.86/1.47 0.52 – 0.36/0.31/0.32 4 1.58/8.92/0.73/2.79 1.33 0.054 0.54/0.26/0.20 Note: Sample 1 is uncalcined CsPAV, Sample 2 is calcined CsPAV, Sample 3 is uncalcined PDA-CsPAV, Sample 4 is calcined PDA-CsPAV. Polydopamine modified heteropolyacids catalyst for methacrolein oxidation: Organic ammonia functionalized and regulation of morphology Yang Li a b # Qianwen Zhu a b # Yifan Yue a b Zhaobang Zhang a b Baohe Wang a b Jing Zhu a b ⁎ Jing Ma a b ⁎ a Key Laboratory for Green Chemical Technology of Ministry of Education, R&D Center for Petrochemical Technology, Tianjin University, Tianjin 300072, China Key Laboratory for Green Chemical Technology of Ministry of Education R&D Center for Petrochemical Technology Tianjin University Tianjin 300072 China aKey Laboratory for Green Chemical Technology of Ministry of Education, R&D Center for Petrochemical Technology, Tianjin University, Tianjin 300072, China b Collaborative Innovation Center of Chemical Science and Engineering, Tianjin University, Tianjin 300072, China Collaborative Innovation Center of Chemical Science and Engineering Tianjin University Tianjin 300072 China bCollaborative Innovation Center of Chemical Science and Engineering, Tianjin University, Tianjin 300072, China ⁎ Corresponding authors. # The two authors contributed equally to this work. The oxidation of methacrolein (MAL) to methacrylic acid (MAA) catalyzed by Keggin-type phosphomolybdovanadic acid catalyst belongs to the acid-catalyzed and oxygen-catalyzed co-promoted reactions. It is a challenge to design catalysts with suitable acidity and redox properties. In this paper, a strategy using organic ammonia to modify CsH3PMo11VO40 (CsPAV) was proposed. Core-shell polymerization precursors were synthesized by using polydopamine (PDA) microspheres as modifiers and templates, and regularly arranged PDA-CsPAV bowl-shaped catalysts were obtained via one-step calcination. The morphology, structure, thermal stability, acidity and redox properties of PDA-CsPAV catalysts were characterized by XRD, FT-IR, TG-DTA, XPS, SEM, H2-TPR and NH3-TPD, and the catalytic performance was evaluated by oxidation of MAL to MAA. The rich functional groups on the surface of PDA microspheres combine with H4PMo11VO40 (HPAV) through strong coordination bonds to form a catalyst film. The uniform spherical structure of PDA can adjust the dispersion and morphology of CsPAV. NH4 + was formed and rearranged with heteropoly anions during calcination, which positively regulated the acidity and redox property of the catalyst. The addition of PDA accelerated electron transfer and strengthened the self-reduction process of HPAV. Compared with CsPAV, PDA-CsPAV has more acid sites and oxidation catalytic active centers (VO2+), thus exhibiting better MAL oxidation performance and good thermal stability. Graphical abstract Image, graphical abstract Keywords Phosphomolybdovanadinic acid Polydopamine Methacrolein Oxidation Data Availability Data will be made available on request. Introduction Methacrylic acid (MAA) is an important chemical intermediate for the synthesis of methyl methacrylate (MMA) [1,2]. The traditional acetone cyanohydrin process uses toxic HCN and corrosive H2SO4, which is not environmentally friendly. Heteropolyacids (HPAs) is an essential and efficient catalyst for the oxidation of methacrolein (MAL) to methacrylic acid (MAA). Keggin-type HPAs have strong Brönsted acidity and reversible redox property [3,4], it can be used as a green and efficient catalyst for a wide range of reactions [5]. The most common P-Mo-V-based HPAs catalyst for MAL oxidation is H4PMo11VO40 (HPAV). However, the catalyst has some defects of small specific surface area (typically less than 10 m2·g − 1) [6], few active sites, and poor thermal stability. Dipping the counterions into HPAV is the most widely used method to solve these problems. Counterions have the opposite charge with heteropoly anions and can replace hydrogen protons in HPAV. Substitution of protons by counterions can modulate the composition and properties of HPAV [7–9]. The common counterions include Cs+/Na+/K+ [10–12], and some transition metal ions such as Cu2+ and Fe3+ [13–15], etc. The introduction of counterions can change the pore structure of HPAV, increase the specific surface area, affect the acidity and redox performance of HPAV, and improve the stability. In recent years, NH4 +modified HPAV has attracted much attention. The elimination of ammonium in the calcination process can promote electron transfer and change the redox performance of the catalyst. The heteropoly acid modified by Cs+ or Cu2+ which is introduced of NH4 + has better catalytic performance [1,16,17]. Most of the reported NH4 + sources are inorganic salts. Heteropoly anions can combine with organic units to form hybrid catalysts with improved activity [18,19]. Wang et al. [20] modified CsH3PMo11VO40 with dendritic polyamide-amine as modifier. Hydrogen bonding network and mixed amino modified ammonium ions eliminate weak acid sites and promote the migration and formation of active vanadium oxide species (VO2+). Cao et al. [21] prepared Chitin-CsH3PMo11VO40 hybrid catalyst by chitin modified CsH3PMo11VO40. The acylamino group in chitin provided ammonia source and converted to NH4 + during calcination. Uniform Ch-CsPAV microspheres with more acidic sites and better redox active sites (VO2+) were obtained. Consequently, the introduction of nitrogen-containing organic compounds with larger molecular structures into HPA can provide NH4 + groups for HPAV, which can facilitate the construction of catalyst morphology and the formation of active sites [22,23]. Polydopamine (PDA) is a fascinating material inspired by mussels byssus [24], and its surface is rich in amino, imine, phenolic hydroxyl and other functional groups [25,26]. The abundant functional groups can combine with organic and inorganic materials by covalent bond, hydrogen bond, coordination, etc. The resulting organic-inorganic hybrid compounds are unique dispersibility, high chemical activity, and can accelerate electron transfer [27–29]. Herein, it is proposed that HPAV molecules are coated on the surface of PDA microspheres to form organic core-inorganic shell polymerization precursors, and then calcined to obtain composite catalysts with specific morphology. The surface properties of the catalysts were further tuned based on the optimization of HPAV acid sites and oxidation active sites. In this work, to control the morphology and optimize the acidity and redox properties of CsPAV, bowl-shaped PDA-CsH3PMo11VO40 (PDA-CsPAV) composite catalysts were prepared by one-pot method. The fresh and spent catalysts were characterized by XRD, FT-IR, TG-DTA, XPS, SEM, H2-TPR, and NH3-TPD, and the catalytic performance was evaluated by oxidation reaction of MAL to MAA. The preparation reproducibility and long-term catalytic performance stability of the composite catalysts were investigated. The effect of PDA on the formation mechanism of acid sites and oxidation active sites was studied. This work provides research ideas for the synthesis of HPAV catalysts with specific morphology, suitable acidity and redox properties. Experimental section Materials Molybdenum trioxide (≥99.9%), vanadium oxide (≥98%), phosphoric acid (≥85%), dopamine hydrochloride (≥98%), Arginine (≥99%) and cesium hydroxide (≥99%) were purchased from Aladdin Chemistry Co., Ltd. (Shanghai, China). Ethanol absolute (≥99.7%) were purchased from Tianjin Jiangtian Chemical Technology Co., Ltd. Catalysts preparation HPAV was first prepared for subsequent preparation of hybrid catalysts, and the preparation method of HPAV is consistent with that reported in the literature [30]. PDA was prepared by the method in the reference literature [31]. PDA-CsPAV was synthesized by one-pot method: Firstly, 0.15 g dopamine hydrochloride was dissolved in a mixture of 25 mL ethanol and 150 mL deionized water to obtain dopamine salt solution, and then 0.1 g arginine was dissolved in 50 mL deionized water to get arginine solution. Dopamine salt solution and arginine solution were mixed, stirred mechanically at 25 °C for 24 h, then centrifuged and washed with water to obtain solid particles. The solid particles were dispersed in 30 mL deionized water to obtain PDA microsphere dispersion, marked A. 7.13 g HPAV and 0.67 g CsOH·H2O were dissolved in 30 mL and 10 mL deionized water, and were labeled B and C, respectively. Then the B and C solutions were dripped into the dispersion A and stirred at 80 °C for 6 h. After that, the reaction solution was dried at 80 °C for 12 h, and the precursor of PDA-CsPAV polymerization was obtained. Finally, the PDA-CsPAV catalyst was obtained by calcining the polymerization precursor at 350 °C for 12 h. CsH3PMo11VO40 (CsPAV) contrast catalyst was synthesized according to the preparation steps described above. Characterization of catalysts Fourier-transform infrared (FT-IR) spectra were obtained on a Nexus 670 infrared spectrometer. Powder X-ray diffraction (XRD) were recorded on Bruker D8 Advance X-ray diffractometer with Cu Kα radiation source (λ = 1.5418 Å) from 5 ° to 70 ° The microscopic morphology of the catalyst surface was analyzed by scanning electron microscopy (SEM). The TG/DTA curve was obtained on a Rigaku TG-DTA8122 thermal analyzer. Samples were heated from room temperature to 600 °C at a constant heating rate of 5 °C·min−1. Ammonia temperature-programmed desorption (NH3-TPD) experiments were carried out on a BELCAT II chemisorption analyzer. About 50 mg sample was pretreated with He flow, and then was adsorbed in a mixed flow of NH3/He (5% NH3, 15 mL·min−1) at 100 °C for 60 min. Finally, the temperature was increased to 600 °C at a rate of 10 °C·min−1 in He flow (25 mL·min−1). The NH3-TPD curve was recorded with a thermal conductivity detector (TCD). Temperature programmed reduction (H2-TPR) were performed in a BELCAT II chemisorption analyzer. X-ray photoelectron spectroscopy (XPS) data were acquired by an ESCALAB-250Xi with monochromated Al Ka radiation. Catalytic reaction experiment The performance of catalysts for selective oxidation of MAL to MAA was carried out in a fixed-bed reactor at atmospheric pressure. 5 mL (about 6 g) catalysts were tableted and sieved to obtain a particle size of 20–40 mesh. The catalyst was placed in the constant temperature section of the fixed bed reactor. First, 75 mL·min−1 of N2 and 10 mL·min−1 of O2 were injected into reactor. After that, when the temperature increased to a suitable reaction temperature, MAL and H2O were pumped into the preheater and gasified and injected into the reactor together with the carrier gas. After the reaction system was stable, the product was liquefied by cyclic condensation system. The liquid phase products were mainly unreacted MAL, oxidation product MAA, and some low volatile by-products. Liquid phase products were collected and analyzed using the Agilent-6820 gas chromatograph (GC) equipped by a thermal conductivity cell detector (TCD) with a HP-INNOWAX capillary column. The highly volatile byproducts (such as: CO and CO2) were detected using an HP-PLOT packed column. The performance evaluation device of the catalyst is consistent with that reported in the literature [30], as shown in Fig. S1. Results and discussion Characterization of catalysts FT-IR (Fig. 1 ) was performed to investigate the chemical composition and the function groups of the PDA, CsPAV and PDA-CsPAV. The typical absorption bands of Keggin structure appeared in the range of 1100–700 cm−1 for PDA-CsPAV before and after calcination. The peaks at 1062 cm−1, 965 cm−1, 862 cm−1 and 773 cm−1 were assigned to P-Oi, Mo=Od, Mo-Ob-Mo and Mo-Oc-Mo, respectively [30,32,33]. The broad peak of 3500 cm−1 to 3000 cm−1 in the PDA band was attributed to the stretching vibration peaks of OH and NH, and the absorption peaks at 1615 cm−1 and 1718 cm−1 corresponded to the typical C = C and C = O vibration peaks in the quinone group, respectively [29,34]. The results show that the dopamine monomer was successfully polymerized into PDA microspheres. In addition, the infrared absorption peaks belonging to PDA can also be observed in PDA-CsPAV polymerization precursors, which means that CsPAV combined with PDA microspheres by hydrogen bonding to form PDA-CsPAV polymerization precursors [35]. Compared with CsPAV, the four Keggin structural characteristic peaks of the polymerization precursors were slightly red-shifted. There is a strong hydrogen bond and electrostatic interaction between HPAV and PDA amino ligands, which leads to the decrease of vibration frequency and tensile strength of heteropoly structures [36]. After calcination, the characteristic peak of alkyl chain of PDA-CsPAV disappeared, and new vibration peaks at 3215 cm−1 and 1415 cm−1 attributed to NH4 + appeared [37]. The results show that there was a chemical reaction between PDA microspheres and HPAV during the calcination process, and the nitrogen-containing groups on the surface of PDA were transformed into ammonium ions coordinated with heteropoly anions. In addition, the absorption bands at 1035 cm−1 and 594 cm−1 of calcined catalyst were assigned to VO2+ and MoO3 [38]. Some vanadium and molybdenum atoms in the Keggin structure of the catalyst were disconnected from the P-Oi bond and released. The reduced vanadium and molybdenum species migrated and aggregated to the secondary structure, and the defective heteropoly acid catalyst was formed. The XRD spectra of the catalysts before and after calcination are shown in Fig. 2 . All the samples show characteristic diffraction peaks of typical cubic phase (2θ = 10.4 °, 18.5 °, 23.8 °, 26.2 °, 30.1 °, 35.7 °) [3]. Compared with CsPAV (26.14 °) before calcination, the main diffraction peak of PDA-CsPAV polymerization precursor shifted to low angle (26.12 °), indicating that the crystal size of the catalyst became larger and the crystal cell was swollen. However, the main diffraction peak of PDA-CsPAV shifted obviously to the high angle (26.28 °) after calcination. According to Scheler's formula, the PDA-CsPAV catalyst has the smallest crystal cell parameters and grain size. The changes of cell parameters and grain size were attributed to the enthalpy contribution of lattice energy in the process of calcination of polymerization precursor to cesium molybdovanadate ammonium salt, that is, the interaction energy of NH4 + with heteropoly anions is higher than that of Cs+ and H+ with heteropoly anions [39]. Fig. 3 is SEM diagram of the microstructure of PDA, PDA-CsPAV and CsPAV. PDA was a uniform sphere with size of about 133 nm from Fig. 3(a). For uncalcined PDA-CsPAV, HPAV molecules were coated on the surface of PDA microspheres to form solid microspheres with rough surface from Fig. 3(b). The calcined PDA-CsPAV exhibited a regular arrangement of double-layer or three-layer bowl shaped morphology, and abundant pore structure can be observed in the particles from Fig. 3(c). The pore structure and bowl shape of the catalyst were formed by sintering and collapsing of the polymerization precursor in high temperature gas flow. On the contrary, CsPAV was irregular hardening and block morphology as shown in Fig. 3(d). Using organic compounds to modify heteropoly compounds can change the morphology of the catalyst, and the modified catalyst has more uniform structure. The uniform structure made the distribution of NH4 + more uniform and facilitated the exposure of more active centers. The same phenomenon has been reported in the literature [18,21,36]. HPAV was supported on PDA microspheres to form core-shell polymerization precursors, and then the polymerization precursors were calcined to form composite catalysts with specific morphology. In the preparation of hybrid catalysts, the rich functional groups on the surface of PDA nanospheres can play the role of structural guidance and pore formation. The synthesis scheme of PDA-CsPAV catalyst deduced from above characterization analysis is suggested as Fig. 4 . Heteropoly anions and amino ligands of PDA were anchored by hydrogen bonding and a catalyst film was formed on the surface of PDA to form precursor microspheres with organic core-inorganic shell structure. During calcination, the nitrogen-containing groups of PDA were converted into NH4 + and coordinated with heteropoly anions. NH4 +, Cs+, H+ counterions and crystalline water were rearranged in the secondary structure of heteropoly acid to achieve charge balance. The hydrocarbon chains in the polymerization precursor microspheres were broken and decomposed to form a cavity and further collapsed to form a bowl-shaped morphology. In addition, the formation of NH4 + during calcination will have accumulation effect on HPAV nanocrystals, and the voids between microcrystals created a rich pore structure of the hybrid catalyst. The structure-induced effect of PDA microspheres during calcination promoted the assembly of Keggin unit clusters into particles with a new tertiary structure, while core-shell hybrid nanospheres were transformed into ordered double-layer or three-layer bowl-shaped porous catalysts. The TG/DTA curves of PDA, uncalcined CsPAV and uncalcined PDA-CsPAV at 25–650 °C are shown in Fig. 5 . For all samples, the weight loss below 200 °C corresponded to the desorption of physically adsorbed water on the surface [5]. For uncalcined PDA-CsPAV, the weight loss in the range of 250 °C to 450 °C was attributed to the thermal decomposition of organic matter and active phase in the precursor of PDA-CsPAV polymerization. The decomposition sequence was roughly as follows: the decomposition of organic chain of PDA molecules, the loss of crystalline water, decomposition after the chemical reaction of nitrogen-containing groups and heteropoly anions to form NH4 +. The high activity defective heteropoly acid catalyst with Keggin structure was formed during the decomposition process [40]. From the thermal weight loss of PDA and PDA-CsPAV polymerization precursors during calcining, the mass fraction of CsPAV in the polymerization precursors was calculated to be 94.5 wt%. In addition, compared with the TG curve of CsPAV, the decomposition temperature of PDA-CsPAV was lower. The loss of structural water during the calcining process will accelerate the decomposition of PDA-CsPAV polymerization precursors. When the calcination temperature was 350 °C, some ammonia active groups and structural water were retained in the crystal structure of the catalyst, and the suitable catalytic performance of the catalyst can be obtained in the process of MAL oxidation. The acid center properties of the catalysts were investigated by NH3-TPD. Fig. 6 is the NH3 desorption curves of CsPAV and PDA-CsPAV catalysts. Both the two catalysts have desorption peaks in weak acid region (100–350 °C) and medium-strong acid region (350–550 °C) [41,42]. The two desorption peaks were produced by the thermal desorption of adsorbed ammonia at Lewis acid sites and Brönsted acid sites, respectively. The desorption peak in the medium-strong acid region of the PDA-CsPAV composite catalyst corresponded to the ammonia desorption at the acidic sites of Brönsted and the decomposition of NH4 + in the secondary structure. Ammonia desorption experiments were carried out on the composite catalyst without ammonia adsorption to eliminate the effect of NH4 + decomposition in the catalyst. The total acidity of Brönsted of PDA-CsPAV after correction (0.31 mmol·g − 1) was higher than that of CsPAV (0.24 mmol·g − 1). The acid catalytic activity sites of MAL to MAA catalytic oxidation system is the acid sites of Brönsted at 350–550 °C, and there were more acid sites in PDA-CsPAV than in CsPAV. Therefore, it can be inferred that the catalytic efficiency of PDA-CsPAV catalyst is higher than that of CsPAV. Compared with CsPAV, the positions of the two desorption peaks of PDA-CsPAV shifted significantly to the strong acid region, which means that the introduction of PDA significantly optimized the acid site properties of CsPAV catalysts because NH4 + was formed during calcination [21]. The H2-TPR characterization results of CsPAV and PDA-CsPAV after calcination are shown in Fig. 7 . CsPAV showed a main reduction peak at 570–650 °C, corresponding to the metal oxides (MoO3, V2O5) generated by the decomposition of heteropoly anions [43]. However, besides the main reduction peak at 540–620 °C, PDA-CsPAV had a reduction peak attributed to V5+ at about 360 °C [40]. Therefore, after calcination at 350 °C, PDA-CsPAV can produce more active VO2+. The maximum reduction temperature of PDA-CsPAV (590 °C) was significantly lower than that of CsPAV (620 °C), indicating that the introduction of PDA enhanced the redox ability of heteropoly acid catalysts. The above results show that the introduction of PDA into HPAV catalyst can accelerate the transfer rate of electrons from bulk phase to surface in heteropoly anions [44], promote the formation of redox centers and improve the redox activity of the catalyst. The valence state and composition of the near surface elements of CsPAV and PDA-CsPAV catalysts were analyzed by XPS technique. The relative quantization results of the species composition of the samples (expressed in atomic ratio) and the different chemical states of the elements (expressed in molar ratio) are shown in Table 1 . The N 1s, V 2p3/2, Mo 3d, O 1s spectra of catalysts before and after calcination are displayed in Fig. 8 , Fig. 9 , Fig. S3 and Fig. 10 , respectively. First, the composition determined by the atomic ratio is analyzed. The variability of V/P ratio (Table 1) indicates the rearrangement of element V on the surface of the catalyst. Compared with CsPAV, the ratio of V/P of PDA-CsPAV catalyst increased. The increase in the ratio was caused by the migration of V from the bulk to the surface [37]. Fig. 8 is the N 1s XPS spectra of PDA-CsPAV before and after calcination. For PDA-CsPAV catalyst before calcination, there was only one peak assigning to Mo6+ at 398.96 eV. The calcined PDA-CsPAV catalyst exhibited a new peak belonging to NH4 + (402.41 eV) in the N 1s spectra, indicating that the group evolution occurred in the polymerization precursor during the calcination process and NH4 + was formed. Besides, compared with the uncalcined PDA-CsPAV, the Mo/N atomic ratio of the calcined catalyst increased from 8.94 to 12.22 (Table 1). The decrease of the proportion of N element in the calcined catalyst is due to the release of ammonia from the Keggin structure during calcination, which is consistent with the characterization results of TG/DTA. According to the skeleton charge balance, the N species originally located in organic groups were converted to NH4 + counterions coordinated with heteropoly anions after calcination [18]. Fig. S2 is full spectra and C 1s spectra of uncalcined PDA-CsPAV. The peaks of PDA-CsPAV polymerization precursors at 399.5 eV assigned to the amino groups on PDA heterocycles. The three splitting peaks in C 1s spectra were attributed to 284.5 eV (C = C and CC), 285.7 eV (CO and CN) and 288.7 eV (C = O), respectively [29]. The existence of C = O indicates the successful formation of PDA microspheres containing quinone groups, which is consistent with the characterization results of FT-IR. Fig. S3 is the Mo 3d spectra of CsPAV and PDA-CsPAV before and after calcination. The binding energy and peak area of Mo did not change obviously before and after calcination for the two catalysts, indicating that the existence of PDA has little effect on the chemical state of Mo element. The peaks of V 2p3/2 for PDA-CsPAV and CsPAV are shown in Fig. 9. The binding energy at around 516.7 eV and 517.8 eV of the two catalysts before and after calcination corresponded to V4+ and V5+ species [30]. No other V species were detected in the range of 520–515 eV, which was consistent with the reports in the literature [17,18,37]. During the calcination process, the relative molar ratio of V4+/V5+ in the PDA-CsPAV catalyst increased from 0.52 to 1.33 (Table 1). The organic components in the polymerization precursors produced NH4 + during calcination, which promoted the reduction of V5+ to V4+. The molar ratio of V4+/V5+ in PDA-CsPAV was significantly higher than that in CsPAV (0.40) after calcination. The introduction of PDA strengthened the self-reduction process of HPAV catalyst [45]. The reasons for the increase of the proportion of V4+/V5+ after calcination are as follows: (1) during the calcination process, the bridging oxygen or terminal oxygen was easy to break and precipitate lattice oxygen (O2−) and form oxygen vacancy, more electron transfer in heteropoly anions promoted the reduction of vanadium species. (2) The oxidative decomposition of organic precursors to form NH4 +, reduced the structural stability of Keggin structure and promoted the reduction of V5+ to V4+. As the redox active center of HPAV catalyst, a large number of reduced vanadium species (VO2+) were generated and migrated to the secondary structure. VO2+ is helpful to improve the catalytic performance of heteropoly acid [38,46]. The oxygen atoms in the skeleton structure of Keggin can be divided into three types: relatively stable central oxygen Oi (P-Oi), a large number of highly active bridging oxygen OB (Mo-Ob-Mo/V, Mo-Oc-Mo/V), terminal oxygen Od (Mo/V=Od) [47]. The hydrated protons on the terminal oxygen were the acidic sites of heteropoly acids. In the process of calcination and catalysis, the lattice oxygen formed by bridging oxygen or terminal oxygen fracture was helpful to enhance the redox performance of heteropoly acid. Therefore, the content and properties of active oxygen atoms in heteropoly anions have a direct effect on the activity of the catalyst. Based on this, the binding energy and distribution of different types of oxygen species in the catalyst before and after calcination were studied [48]. O 1s XPS spectra of PDA-CsPAV before and after calcination are shown in Fig. 10(c) and Fig. 10(d). For uncalcined PDA-CsPAV, the deconvoluted spectra for O 1s exhibited three main peaks at 530.81 eV, 531.42 eV and 532.18 eV, linked to Od, OB and Oi species. The relative peak area ratio of the three O species was 0.36, 0.31 and 0.32 from Table 1. For calcined PDA-CsPAV, the three main peaks of O 1s at 530.65 eV, 531.28 eV, 531.94 eV and the relative peak area ratio was 0.54, 0.26, 0.20. O 1s XPS spectra of CsPAV before and after calcination are shown in Fig. 10(a)-Fig. 10(b), the three main peaks of O 1s at 530.72 eV, 531.22 eV, 531.93 eV and the relative peak area ratio was 0.46, 0.30, 0.24 for uncalcined CsPAV. Compared with the uncalcined CsPAV, there was almost no obvious change in the binding energy and molar ratio of oxygen species after calcined. Different from CsPAV, the three O 1s species of PDA-CsPAV catalyst changed significantly before and after calcination. The proportion of terminal oxygen Od in the uncalcined PDA-CsPAV was significantly lower than that of CsPAV. But the proportion of terminal oxygen Od in the calcined composite catalyst increased greatly. The O atoms of quinone group (C = O) and catechol group (COH) in PDA microspheres coincided with the central oxygen Oi and bridging oxygen OB of heteropoly acid to occupy a large cleavage peak area [35,49,50]. During the calcination process, the oxygen atoms originally belonging to the organic group disappeared due to the decomposition of the organic chain in PDA. Thus, the relative content of terminal oxygen Od in the composite catalyst increased from 0.36 to 0.54. In addition, the formation and migration of a large amount of VO2+ changed the redox potential around the oxygen atoms, resulting in the decrease of the binding energy of oxygen species in PDA-CsPAV after calcination. This result further verified the analytical conclusions of FT-IR and H2-TPR. Through the introduction of PDA modifier into HPAV, the ratio of V4+/V5+ and terminal oxygen (Od) in HPAV catalyst was increased, which means that PDA-CsPAV composite catalyst has stronger redox performance. Catalytic performance of the catalysts Compared with the CsPAV catalyst, the PDA-CsPAV composite catalyst exhibited rich pore structure, bowl-shaped morphology and better acidity and redox performance. The oxidation of MAL to MAA was used as a probe reaction to study the performance of the catalyst. This work was based on the previous studies and further discussion was carried out [30]. The effect of reaction temperature on the performance of the catalyst was investigated, and the long-term performance was evaluated. Effect of reaction temperature on the performance of catalyst As shown in Fig. 11 (a), for the catalyst PDA-CsPAV, with the increase of reaction temperature, the MAL conversion increased gradually, and the selectivity to MAA increased at first and then decreased. From 290 °C to 310 °C, the selectivity to MAA increased from 87.0% to 95.1%, but decreased to 73.6% at 330 °C (Fig. 11(a)). The change of selectivity was due to the over-activation of MAL and the deep oxidation of MAA at high temperature. For the contrast catalyst CsPAV, the conversion and selectivity were lower than PDA-CsPAV. Even if the temperature rose to 330 °C, the MAL conversion was less than 70% (Fig. 11(b)). According to the above evaluation results, the highest yield of PDA-CsPAV catalyst was 71.6% at 310 °C, while that of CsPAV catalyst was only 45.6% at higher temperature (320 °C). The performance of PDA-CsPAV is compared with the literatures. Wang et al. [20] studied dendritic polyamide-amine modified phosphomolybdovanadic catalyst for methacrolein to methacrylic acid. The optimal reaction temperature was 320 °C, MAL conversion was 60%, the selectivity to MAA was 97% and yield reached the maximum was 58%. Zhou et al. [51] used carbon catalyst for selective oxidation of methacrolein to methacrylic acid. Methacrolein conversion, methacrylic acid selectivity and yield were 42.8%, 70.8% and 30.3%, respectively. Kim et al. [6] immobilized H5PMo10V2O40 catalyst on nitrogen-containing mesoporous carbon and used for methacrolein oxidation. The yield was below 70%. It can be seen that the highest yield of PDA-CsPAV was higher than that reported in the literatures, and the reaction temperature was lower [6,20]. This catalytic phenomenon is consistent with the characterization results of NH3-TPD, H2-TPR, SEM and TEM. PDA microspheres were introduced into CsPAV to form a porous bowl-like structure of heteropoly acid, which significantly improved the protonation degree and redox potential of the catalyst. Therefore, the suitable catalytic temperature of PDA-CsPAV was reduced by about 10 °C compared to CsPAV. For the oxidation of MAL to MAA reaction system, lower reaction temperature can slow down the decomposition and deactivation of Keggin structure and prolong the service life of the composite catalyst. Preparation reproducibility and stability evaluation of catalysts The preparation reproducibility of PDA-CsPAV catalyst was investigated by orthogonal experiment. The specific scheme is as follows: firstly, 3 batches of PDA microspheres and 3 batches of HPAV were synthesized respectively, then 9 batches of PDA-CsPAV composite catalysts were prepared by orthogonal method, and finally the performance evaluation experiments of 9 batches of catalysts were carried out under the same catalytic conditions. The evaluation results are shown in Fig. 12 (a), and there was no obvious fluctuation in the PDA-CsPAV catalytic performance of each batch. Therefore, this kind of catalyst had good preparation reproducibility. In addition, continuous evaluation experiments on PDA-CsPAV were carried out under the same reaction conditions to explore its long-term thermal stability. As shown in Fig. 12(b), the MAL conversion and MAA selectivity of PDA-CsPAV remained stable around 75% and 95% throughout the evaluation process, indicating that the introduction of PDA microspheres would not adversely affect the stability of the catalyst. At the same time, it was further verified that the stability of heteropoly acid catalyst was mainly related to the existence of Cs+ [11]. FT-IR and XRD were used to characterize the PDA-CsPAV catalyst after long-term evaluation. Compared with the fresh catalyst (Fig. 1(a)), the characteristic peaks of Keggin structure were existed in the used catalyst. The infrared vibration peak of NH4 + at 1415 cm−1 disappeared after long-term evaluation and the new peak corresponded to the reduced molybdenum species appeared at 624 cm−1 (Fig. 13 (a)). This shows that during the long-term reaction, ammonia was decomposed and MoO3/MoO2 was formed [11,37]. The same phenomenon has been reported in the literatures [1,18,20,21]. In order to determine the effect of NH4 + with temperature changes on acidity, the catalyst PDA-CsPAV was characterized by NH3-TPD without adsorption NH3 to eliminate the effect of the decomposition of NH4 + in PDA-CsPAV on acidity. The acidity of NH4 + decomposition was only 0.003 mmol·g − 1, accounting for about 1.89%, so the decomposition of NH4 + was very small. The effect of such a small amount of degradation on the activity of PDA-CsPAV was almost negligible. As shown in Fig. 13(b), after long-term evaluation, the characteristic peaks of Keggin structure were weakened, but the catalyst still had a complete Keggin structure unit. In addition, there were diffraction peaks belonging to MoO3, MoO2 and VO2+ at 2θ=12.9 °, 23.5 °and 26.7 °, respectively. According to the oxidation mechanism of MAL to MAA [21], the formation of reduced state of Mo and V species was beneficial to accelerate the catalytic reaction. In the process of catalytic reaction, PDA-CsPAV composite catalyst was finally transformed into defective cesium molybdovanadate, molybdenum oxide and VO2+hybrid. In the long-term evaluation experiment for 136 h, the activity of the catalyst almost did not change, which indicates that the PDA-CsPAV catalyst had good stability. General discussion According to the performance evaluation of the catalyst and the previous characterization analysis, the plausible formation mechanism of composite catalyst PDA-CsPAV and the effect of the formation of NH4 + on the catalytic active sites are shown in Fig. 14 . The addition of PDA accelerated the electron transfer and strengthened the self-reduction process of HPAV. The terminal oxygen and bridging oxygen precipitated lattice oxygen to form O vacancy, and more electron transfer promoted the reduction of VOx species to VO2+. The formation of NH4 + promoted the reduction of V species and optimized the acidity of HPAV. Thus, the acid sites and oxidation active sites of PDA modified CsPAV catalysts increased. PDA-CsPAV had better catalytic performance when it was used in MAL oxidation under the influence of both acid catalysis and oxidation catalysis. Conclusion PDA microspheres were used as modifiers and templates to prepare PDA-CsPAV polymerization precursors with organic core-inorganic shell structure. Regular double-layer or three-layer bowl-shaped composite catalysts were prepared by one-step calcination. HPAV can form strong coordination bonds with rich amino and hydroxyl groups on the surface of PDA microspheres, so HPAV can covered on the surface of PDA, thus effectively inhibiting their agglomeration behavior. The oxidative decomposition of PDA-CsPAV polymerization precursor can form NH4 + on the surface of the catalyst in calcination process, which further undergoes and coordinate rearrangement with heteropoly anions, thus significantly increasing the amount of acid sites and oxygen catalytic active sites (VO2+) of the catalyst. Besides, the addition of PDA accelerated the electron transfer, strengthened the self-reduction process of HPAV and promoted the formation of redox centers. During calcination, the bridging oxygen or terminal oxygen was easy to break and precipitate lattice oxygen (O2−) and form oxygen vacancy, more electron transfer in heteropoly anions promoted the reduction of vanadium species. The reversible redox characteristics of HPAV catalysts combined with the unique electron transfer properties of PDA reduced the reduction temperature of the composite catalysts, and the stronger redox properties lead to lower catalytic reaction temperature (310 °C). Compared with the CsPAV catalyst, PDA-CsPAV catalyst exhibits better surface morphology, higher degree of protonation and redox potential, so that the PDA-CsPAV catalyst shows higher catalytic activity with the MAL conversion of 75.3% and the MAA selectivity of 95.1%. It also showed stable catalytic performance in the continuous evaluation experiment for 136 h. Credit author statement Yang Li: Research plan, Investigation, Data processing, Qianwen Zhu: Research plan, Data curation, Writing – review & editing. Yifan Yue: Investigation, Writing – review & editing. Zhaobang Zhang: Data processing, Validation. Baohe Wang: Validation, Writing review & editing. Jing Zhu : Validation, Writing review & editing. Jing Ma: Validation, Research plan, Writing review & editing, Funding acquisition. Declaration of Competing Interest The authors declare that they have no known competing financial interests or personal relationships that could have appeared to influence the work reported in this paper. Acknowledgements This work was financially supported by the National Natural Science Foundation of China (No. 21606168). Supplementary materials Supplementary material associated with this article can be found, in the online version, at doi:10.1016/j.mcat.2023.113571. Appendix Supplementary materials Image, application 1 References [1] Y.L. Cao L. Wang L.L. Zhou G.J. Zhang B.H. Xu S.J. Zhang Cs(NH4)xH3–xPMo11VO40 catalyzed selective oxidation of methacrolein to methacrylic acid: Effects of NH4 + on the structure and catalytic activity Ind. Eng. Chem. Res. 56 2017 653 664 Y.L. Cao, L. Wang, L.L. Zhou, G.J. Zhang, B.H. Xu, S.J. Zhang, Cs(NH4)xH3–xPMo11VO40 catalyzed selective oxidation of methacrolein to methacrylic acid: Effects of NH4+ on the structure and catalytic activity, Ind. Eng. Chem. Res., 56 (2017) 653–664. [2] L.M. Deusser J.C. Petzoldt J.W. Gaube Kinetic model for methacrolein oxidations-influence of cesium and vanadium on heteropolyacid catalysts CsxH3-x+y[PMo12-yVyO40] Ind. Eng. Chem. Res. 37 1998 3230 3236 L.M. Deusser, J.C. Petzoldt, J.W. Gaube, Kinetic model for methacrolein oxidations-influence of cesium and vanadium on heteropolyacid catalysts CsxH3-x+y[PMo12-yVyO40], Ind. Eng. Chem. Res., 37 (1998) 3230–3236. [3] L. Marosi A.C. Otero Catalytic performance of Csx(NH4)yHzPMo12O40 and related heteropolyacids in the methacrolein to methacrylic acid conversion: in situ structural study of the formation and stability of the catalytically active species J. Catal. 213 2003 235 240 L. Marosi, A.C. Otero, Catalytic performance of Csx(NH4)yHzPMo12O40 and related heteropolyacids in the methacrolein to methacrylic acid conversion: in situ structural study of the formation and stability of the catalytically active species, J. Catal., 213 (2003) 235–240. [4] D.L. M G.J. W F.G. Martin H. Hibst Effects of Cs and V on heteropolyacid catalysts in methacrolein oxidation Stud. Surf. Sci. Catal. 101 1996 981 990 D.L. M., G.J. W., Martin, F.G., H. Hibst, Effects of Cs and V on heteropolyacid catalysts in methacrolein oxidation, Stud. Surf. Sci. Catal., 101 (1996) 981–990. [5] S.Z. Liu L. Chen G.W. Wang J.W. Liu Y.A. Gao C.Y. Li H.H. Shan Effects of Cs-substitution and partial reduction on catalytic performance of Keggin-type phosphomolybdic polyoxometalates for selective oxidation of isobutane J. Energy Chem. 25 2016 85 92 S.Z. Liu, L. Chen, G.W. Wang, J.W. Liu, Y.A. Gao, C.Y. Li, H.H. Shan, Effects of Cs-substitution and partial reduction on catalytic performance of Keggin-type phosphomolybdic polyoxometalates for selective oxidation of isobutane, J. Energy Chem., 25 (2016) 85–92. [6] H. Kim J.C. Jung D.R. Park S.H. Baeck I.K. Song Preparation of H5PMo10V2O40 (PMo10V2) catalyst immobilized on nitrogen-containing mesoporous carbon (N-MC) and its application to the methacrolein oxidation Appl. Catal. A 320 2007 159 165 H. Kim, J.C. Jung, D.R. Park, S.H. Baeck, I.K. Song, Preparation of H5PMo10V2O40 (PMo10V2) catalyst immobilized on nitrogen-containing mesoporous carbon (N-MC) and its application to the methacrolein oxidation, Appl. Catal. A, 320 (2007) 159–165. [7] C. Marchal-Roch N. Laronze R. Villanneau N. Guillou A. Tézé G. Hervé Effects of NH4 +, Cs+, and H+ counterions of the molybdophosphate anion in the oxidative dehydrogenation of isobutyric acid J. Catal. 190 2000 173 181 C. Marchal-Roch, N. Laronze, R. Villanneau, N. Guillou, A. Tézé, G. Hervé, Effects of NH4+, Cs+, and H+ counterions of the molybdophosphate anion in the oxidative dehydrogenation of isobutyric acid, J. Catal., 190 (2000) 173–181. [8] Martin Langpape J.M.M. Millet Effect of iron counter-ions on the redox properties of the Keggin-type molybdophosphoric heteropolyacid Part I. An experimental study on isobutane oxidation catalysts Appl. Catal. A 200 2000 89 101 Martin Langpape, J.M.M. Millet, Effect of iron counter-ions on the redox properties of the Keggin-type molybdophosphoric heteropolyacid Part I. An experimental study on isobutane oxidation catalysts, Appl. Catal. A, 200 (2000) 89–101. [9] Y. Konishi K. Sakata M. Misono Y. Yoneda Catalysis by heteropoly compounds IV. Oxidation of methacrolein to methacrylic acid over 12-molybdophosphoric acid J. Catal. 77 1982 169 179 Y. Konishi, K. Sakata, M. Misono, Y. Yoneda, Catalysis by heteropoly compounds IV. Oxidation of methacrolein to methacrylic acid over 12-molybdophosphoric acid, J. Catal., 77 (1982) 169–179. [10] Go¨tz-Peter Schindler Carlos Knapp Toshiaki Ui K. Nagai Enhancing the productivity of isobutane selective oxidation over a Mo–V–P–As–Cs–Cu–O heteropoly acid catalyst Top. Catal. 22 2003 Go¨tz-Peter Schindler, Carlos Knapp, Toshiaki Ui, K. Nagai, Enhancing the productivity of isobutane selective oxidation over a Mo–V–P–As–Cs–Cu–O heteropoly acid catalyst, Top. Catal., 22 (2003). [11] C. Marchal-Roch N. Laronze N. Guillou A. Tézé G. Hervé Study of ammonium, mixed ammonium–cesium and cesium salts derived from (NH4)5[PMo11VIVO40] as isobutyric acid oxidation catalysts Part II. Synthesis, characterization and catalytic activity in the oxidative dehydrogenation of isobutyric acid of mixed ammonium–cesium and cesium salts Appl. Catal. A 203 2000 143 150 C. Marchal-Roch, N. Laronze, N. Guillou, A. Tézé, G. Hervé, Study of ammonium, mixed ammonium–cesium and cesium salts derived from (NH4)5[PMo11VIVO40] as isobutyric acid oxidation catalysts Part II. Synthesis, characterization and catalytic activity in the oxidative dehydrogenation of isobutyric acid of mixed ammonium–cesium and cesium salts, Appl. Catal. A, 203 (2000) 143–150. [12] L.R. Pizzio M.N. Blanco Isoamyl acetate production catalyzed by H3PW12O40 on their partially substituted Cs or K salts Appl. Catal. A 255 2003 265 277 L.R. Pizzio, M.N. Blanco, Isoamyl acetate production catalyzed by H3PW12O40 on their partially substituted Cs or K salts, Appl. Catal. A, 255 (2003) 265–277. [13] V.D. Stytsenko W.H. Lee J.W. Lee Catalyst design for methacrolein oxidation to methacrylic acid Kinet. Catal. 42 2000 212 216 V.D. Stytsenko, W.H. Lee, J.W. Lee, Catalyst design for methacrolein oxidation to methacrylic acid, Kinet. Catal., 42 (2000) 212–216. [14] R. Tokarz-Sobieraj P. Niemiec Cu2+ in Keggin anion – Influence of copper position on electronic structure/redox properties of heteropolyacids. DFT cluster model study J. Mol. Struct. 1135 2017 20 25 R. Tokarz-Sobieraj, P. Niemiec, Cu2+ in Keggin anion – Influence of copper position on electronic structure/redox properties of heteropolyacids. DFT cluster model study, J. Mol. Struct., 1135 (2017) 20–25. [15] C. Knappa T. Ui K. Nagai N. Mizunob Stability of iron in the Keggin anion of heteropoly acid catalysts for selective oxidation of isobutane Catal. Today 71 2001 111 119 C. Knappa, T. Ui, K. Nagai, N. Mizunob, Stability of iron in the Keggin anion of heteropoly acid catalysts for selective oxidation of isobutane, Catal. Today, 71 (2001) 111–119. [16] M. Sultan S. Paul M. Fournier D. Vanhove Evaluation and design of heteropolycompound catalysts for the selective oxidation of isobutane into methacrylic acid Appl. Catal. A 259 2004 141 152 M. Sultan, S. Paul, M. Fournier, D. Vanhove, Evaluation and design of heteropolycompound catalysts for the selective oxidation of isobutane into methacrylic acid, Appl. Catal. A, 259 (2004) 141–152. [17] Y.Y. Liu S. Wang Y.J. Li X.L. Cai M.Y. Zhu X.L. Han (NH4)Cu0.2H2.8PMo11VO40 via a hydrothermal homogeneous precipitation method for selective oxidation of methacrolein to methacrylic acid Appl. Catal. A 643 2022 Y.Y. Liu, S. Wang, Y.J. Li, X.L. Cai, M.Y. Zhu, X.L. Han, (NH4)Cu0.2H2.8PMo11VO40 via a hydrothermal homogeneous precipitation method for selective oxidation of methacrolein to methacrylic acid, Appl. Catal. A, 643 (2022). [18] Y.L. Cao L. Wang L.L. Zhou B.H. Xu Y.Y. Diao S.J. Zhang A modified heteropoly acid catalyst with cetyltrimethylammonium bromide for methacrolein to methacrylic acid J. Ind. Eng. Chem. 65 2018 254 263 Y.L. Cao, L. Wang, L.L. Zhou, B.H. Xu, Y.Y. Diao, S.J. Zhang, A modified heteropoly acid catalyst with cetyltrimethylammonium bromide for methacrolein to methacrylic acid, J. Ind. Eng. Chem., 65 (2018) 254–263. [19] L. Jing J. Shi F.M. Zhang Y.J. Zhong W.D. Zhu Polyoxometalate-based amphiphilic catalysts for selective oxidation of benzyl alcohol with hydrogen peroxide under organic solvent-free conditions Ind. Eng. Chem. Res. 52 2013 10095 10104 L. Jing, J. Shi, F.M. Zhang, Y.J. Zhong, W.D. Zhu, Polyoxometalate-based amphiphilic catalysts for selective oxidation of benzyl alcohol with hydrogen peroxide under organic solvent-free conditions, Ind. Eng. Chem. Res., 52 (2013) 10095–10104. [20] B.H. Wang Y. Li Q.W. Zhu J. Zhu Z.B. Zhang J. Ma Dendritic polyamide-amine modified phosphomolybdovanadic hybrid microspheres as a catalyst for methacrolein to methacrylic acid Catal. Sci. Technol. 13 2023 887 897 B.H. Wang, Y. Li, Q.W. Zhu, J. Zhu, Z.B. Zhang, J. Ma, Dendritic polyamide-amine modified phosphomolybdovanadic hybrid microspheres as a catalyst for methacrolein to methacrylic acid, Catal. Sci. Technol., 13 (2023) 887–897. [21] Y.L. Cao L. Wang B.H. Xu S.J. Zhang The Chitin/Keggin-type heteropolyacid hybrid microspheres as catalyst for oxidation of methacrolein to methacrylic acid Chem. Eng. J. 334 2018 1657 1667 Y.L. Cao, L. Wang, B.H. Xu, S.J. Zhang, The Chitin/Keggin-type heteropolyacid hybrid microspheres as catalyst for oxidation of methacrolein to methacrylic acid, Chem. Eng. J., 334 (2018) 1657–1667. [22] L. Yang H. Zhang R.Y. Yan X.P. Zhang G.J. Zhang B.Z. Ren PEG400 modification of Keggin-type H4PMo11VO40-based catalysts for the selective oxidation of methacrolein to methacrylic acid Adv. Mat. Res. 550-553 2012 252 256 L. Yang, H. Zhang, R.Y. Yan, X.P. Zhang, G.J. Zhang, B.Z. Ren, PEG400 modification of Keggin-type H4PMo11VO40-based catalysts for the selective oxidation of methacrolein to methacrylic acid, Adv. Mat. Res., 550-553 (2012) 252–256. [23] W.W. Guo Z. Luo H.J. Lv C.L. Hill Aerobic oxidation of formaldehyde catalyzed by polyvanadotungstates ACS Catal. 4 2014 1154 1161 W.W. Guo, Z. Luo, H.J. Lv, C.L. Hill, Aerobic oxidation of formaldehyde catalyzed by polyvanadotungstates, ACS Catal.., 4 (2014) 1154–1161. [24] Z.B. Wei Z.T. Yang Z.X. Chen T. Yu Q. Li W.D. Yang Y. Li Bio-inspired dopamine-functionalized silica nanoparticles via self-polymerization to simultaneously enhance thermal stability, fire safety and dynamic mechanical properties of PFRP composites J. Therm. Anal. Calorim. 148 2022 1935 1948 Z.B. Wei, Z.T. Yang, Z.X. Chen, T. Yu, Q. Li, W.D. Yang, Y. Li, Bio-inspired dopamine-functionalized silica nanoparticles via self-polymerization to simultaneously enhance thermal stability, fire safety and dynamic mechanical properties of PFRP composites, J. Therm. Anal. Calorim., 148 (2022) 1935–1948. [25] I.I. Rose H. Roth J.Y. Xie F. Hollmann S. Votteler M. Storr B. Krause M. Wessling Chemistry in a spinneret—Polydopamine functionalized hollow fiber membranes J. Membr. Sci. 648 2022 I.I. Rose, H. Roth, J.Y. Xie, F. Hollmann, S. Votteler, M. Storr, B. Krause, M. Wessling, Chemistry in a spinneret—Polydopamine functionalized hollow fiber membranes, J. Membr. Sci., 648 (2022). [26] J.H. Ryu P.B. Messersmith H. Lee Polydopamine surface chemistry: A decade of discovery ACS Appl. Mater. Interfaces 10 2018 7523 7540 J.H. Ryu, P.B. Messersmith, H. Lee, Polydopamine surface chemistry: A decade of discovery, ACS Appl. Mater. Interfaces, 10 (2018) 7523–7540. [27] X.J. Kong S. Wu T.T. Chen R.Q. Yu X. Chu MnO2-induced synthesis of fluorescent polydopamine nanoparticles for reduced glutathione sensing in human whole blood Nanoscale 8 2016 15604 15610 X.J. Kong, S. Wu, T.T. Chen, R.Q. Yu, X. Chu, MnO2-induced synthesis of fluorescent polydopamine nanoparticles for reduced glutathione sensing in human whole blood, Nanoscale, 8 (2016) 15604–15610. [28] H. Lee S.M. Dellatore W.M. Miller P.B. Messersmith Mussel-inspired surface chemistry for multifunctional coatings Science 318 2007 426 430 H. Lee, S.M. Dellatore, W.M. Miller, P.B. Messersmith, Mussel-inspired surface chemistry for multifunctional coatings, Science, 318 (2007) 426–430. [29] T. Sun Z.J. Li H.G. Wang D. Bao F.L. Meng X.B. Zhang A biodegradable polydopamine-derived electrode material for high-capacity and long-life lithium-ion and sodium-ion batteries Angew. Chem. Int. Ed. 55 2016 10662 10666 T. Sun, Z.J. Li, H.G. Wang, D. Bao, F.L. Meng, X.B. Zhang, A biodegradable polydopamine-derived electrode material for high-capacity and long-life lithium-ion and sodium-ion batteries, Angew. Chem. Int. Ed., 55 (2016) 10662–10666. [30] Q.W. Zhu J. Zhu Y. Li Z.B. Zhang B.H. Wang J. Ma Kaolin supported heteropoly acid catalysts for methacrolein oxidation: Insights into the carrier acidity effect on active components Appl. Catal. A 649 2023 Q.W. Zhu, J. Zhu, Y. Li, Z.B. Zhang, B.H. Wang, J. Ma, Kaolin supported heteropoly acid catalysts for methacrolein oxidation: Insights into the carrier acidity effect on active components, Appl. Catal. A, 649 (2023). [31] W.X. Qu S. Lou X.H. Yin Y.X. Song G.L. Wu F. Xin J.Z. Wang Block copolymer-assisted synthesis of monodisperse colloidal patchy nanoparticles J. Colloid Interface Sci. 524 2018 289 296 W.X. Qu, S. Lou, X.H. Yin, Y.X. Song, G.L. Wu, F. Xin, J.Z. Wang, Block copolymer-assisted synthesis of monodisperse colloidal patchy nanoparticles, J. Colloid Interface Sci., 524 (2018) 289–296. [32] X.J. Guo C.P. Huang Y.X. Li Effect of cesium content on the structure and catalytic performances of heteropoly compounds in one-step synthesis of methylmethacrylate from methacrolein Korean J. Chem. Eng. 25 2008 697 702 X.J. Guo, C.P. Huang, Y.X. Li, Effect of cesium content on the structure and catalytic performances of heteropoly compounds in one-step synthesis of methylmethacrylate from methacrolein, Korean J. Chem. Eng., 25 (2008) 697–702. [33] K. Tandekar A. Tripathi M.D. Prasad S. Supriya Keggin based self-assembled mesoporous materials for the capture of selective guest molecules Mater. Adv. 3 2022 5521 5531 K. Tandekar, A. Tripathi, M.D. Prasad, S. Supriya, Keggin based self-assembled mesoporous materials for the capture of selective guest molecules, Mater. Adv., 3 (2022) 5521–5531. [34] W.C. Zheng H.L. Fan L. Wang Z.X. Jin Oxidative self-polymerization of dopamine in an acidic environment Langmuir 31 2015 11671 11677 W.C. Zheng, H.L. Fan, L. Wang, Z.X. Jin, Oxidative self-polymerization of dopamine in an acidic environment, Langmuir, 31 (2015) 11671–11677. [35] Q. Wei F.L. Zhang J. Li B.J. Li C.S. Zhao Oxidant-induced dopamine polymerization for multifunctional coatings Polym. Chem. 1 2010 1430 1433 Q. Wei, F.L. Zhang, J. Li, B.J. Li, C.S. Zhao, Oxidant-induced dopamine polymerization for multifunctional coatings, Polym. Chem., 1 (2010) 1430–1433. [36] B.Y. Zhang H.J. Zou Y.F. Qi X.M. Zhang R.T. Sheng Y. Zhang R.M. Sun L.X. Chen R.J. Lv Assembly of polyoxometalates/polydopamine nanozymes as a multifunctional platform for glutathione and Escherichia coli O157:H7 detection Microchem. J. 164 2021 B.Y. Zhang, H.J. Zou, Y.F. Qi, X.M. Zhang, R.T. Sheng, Y. Zhang, R.M. Sun, L.X. Chen, R.J. Lv, Assembly of polyoxometalates/polydopamine nanozymes as a multifunctional platform for glutathione and Escherichia coli O157:H7 detection, Microchem. J., 164 (2021). [37] F.L. Jing B. Katryniok F. Dumeignil E. Bordes-Richard S. Paul Catalytic selective oxidation of isobutane to methacrylic acid on supported (NH4)3HPMo11VO40 catalysts J. Catal. 309 2014 121 135 F.L. Jing, B. Katryniok, F. Dumeignil, E. Bordes-Richard, S. Paul, Catalytic selective oxidation of isobutane to methacrylic acid on supported (NH4)3HPMo11VO40 catalysts, J. Catal., 309 (2014) 121–135. [38] L.L. Zhou L. Wang S.J. Zhang R.Y. Yan Y.Y. Diao Effect of vanadyl species in Keggin-type heteropoly catalysts in selective oxidation of methacrolein to methacrylic acid J. Catal. 329 2015 431 440 L.L. Zhou, L. Wang, S.J. Zhang, R.Y. Yan, Y.Y. Diao, Effect of vanadyl species in Keggin-type heteropoly catalysts in selective oxidation of methacrolein to methacrylic acid, J. Catal., 329 (2015) 431–440. [39] R. Dong N.N. Wang Y. Wang Y.X. Lan J.S. Hu J. He Structure and photocatalytic performance of K1−3xMxTiNbO5 (M = Fe, Ce) for ethyl mercaptan Russ. J. Appl. Chem. 87 2015 1474 1480 R. Dong, N.N. Wang, Y. Wang, Y.X. Lan, J.S. Hu, J. He, Structure and photocatalytic performance of K1−3xMxTiNbO5 (M = Fe, Ce) for ethyl mercaptan, Russ. J. Appl. Chem., 87 (2015) 1474–1480. [40] H.B. Zhu P. Laveille D.C. Rosenfeld M.N. Hedhili J.M. Basset A high-throughput reactor system for optimization of Mo–V–Nb mixed oxide catalyst composition in ethane ODH Catal. Sci. Technol. 5 2015 4164 4173 H.B. Zhu, P. Laveille, D.C. Rosenfeld, M.N. Hedhili, J.M. Basset, A high-throughput reactor system for optimization of Mo–V–Nb mixed oxide catalyst composition in ethane ODH, Catal. Sci. Technol., 5 (2015) 4164–4173. [41] H. Zhang R.Y. Yan L. Yang Y.Y. Diao L. Wang S.J. Zhang Investigation of Cu- and Fe-doped CsH3PMo11VO40 heteropoly compounds for the selective oxidation of methacrolein to methacrylic Acid Ind. Eng. Chem. Res. 52 2013 4484 4490 H. Zhang, R.Y. Yan, L. Yang, Y.Y. Diao, L. Wang, S.J. Zhang, Investigation of Cu- and Fe-doped CsH3PMo11VO40 heteropoly compounds for the selective oxidation of methacrolein to methacrylic Acid, Ind. Eng. Chem. Res., 52 (2013) 4484–4490. [42] L.L. Zhou L. Wang Y.Y. Diao R.Y. Yan S.J. Zhang Cesium salts supported heteropoly acid for oxidation of methacrolein to methacrylic acid Mol. Catal. 433 2017 153 161 L.L. Zhou, L. Wang, Y.Y. Diao, R.Y. Yan, S.J. Zhang, Cesium salts supported heteropoly acid for oxidation of methacrolein to methacrylic acid, Mol. Catal., 433 (2017) 153–161. [43] Y.L. Cao L. Wang Y.G. Bai R.Y. Yan B.H. Xu Molybdovanadophosphoric heteropolyacid-catalyzed aerobic oxidation of methacrolein: The crucial role of ionic liquid as a modifier Catal. Lett. 150 2020 1774 1785 Y.L. Cao, L. Wang, Y.G. Bai, R.Y. Yan, B.H. Xu, Molybdovanadophosphoric heteropolyacid-catalyzed aerobic oxidation of methacrolein: The crucial role of ionic liquid as a modifier, Catal. Lett., 150 (2020) 1774–1785. [44] W.L. Cen Y. Liu Z.B. Wu H.Q. Wang X.L. Weng A theoretic insight into the catalytic activity promotion of CeO2 surfaces by Mn doping Phys. Chem. Chem. Phys. 14 2012 5769 5777 W.L. Cen, Y. Liu, Z.B. Wu, H.Q. Wang, X.L. Weng, A theoretic insight into the catalytic activity promotion of CeO2 surfaces by Mn doping, Phys. Chem. Chem. Phys., 14 (2012) 5769–5777. [45] F.C. Jentoft S. Klokishner J. Kröhnert J. Melsheimer T. Ressler O. Timpe J. Wienold R. Schlögl The structure of molybdenum-heteropoly acids under conditions of gas-phase selective oxidation catalysis: a multi-method in situ study Appl. Catal. A 256 2003 291 317 F.C. Jentoft, S. Klokishner, J. Kröhnert, J. Melsheimer, T. Ressler, O. Timpe, J. Wienold, R. Schlögl, The structure of molybdenum-heteropoly acids under conditions of gas-phase selective oxidation catalysis: a multi-method in situ study, Appl. Catal. A, 256 (2003) 291–317. [46] J.K. Lee V. Russo J. Melsheimer K. Köhler R. Schlögl Genesis of V4+ in heteropoly compounds CsxH4-xPVMo11O40 during thermal treatment, rehydration and oxidation of methanol studied by EPR spectroscopy Phys. Chem. Chem. Phys. 2 2000 2977 2983 J.K. Lee, V. Russo, J. Melsheimer, K. Köhler, R. Schlögl, Genesis of V4+ in heteropoly compounds CsxH4-xPVMo11O40 during thermal treatment, rehydration and oxidation of methanol studied by EPR spectroscopy, Phys. Chem. Chem. Phys., 2 (2000) 2977–2983. [47] I.V. Kozhevnikov Sustainable heterogeneous acid catalysis by heteropoly acids J. Mol. Catal. A Chem. 262 2007 86 92 I.V. Kozhevnikov, Sustainable heterogeneous acid catalysis by heteropoly acids, J. Mol. Catal. A Chem., 262 (2007) 86–92. [48] G.D. Khattak A. Mekki L.E. Wenger X-ray photoelectron spectroscopy (XPS) and magnetic susceptibility studies of vanadium phosphate glasses J. Non-Cryst. Solids 355 2009 2148 2155 G.D. Khattak, A. Mekki, L.E. Wenger, X-ray photoelectron spectroscopy (XPS) and magnetic susceptibility studies of vanadium phosphate glasses, J. Non-Cryst. Solids, 355 (2009) 2148–2155. [49] F. Ma A.B. Yuan J.Q. Xu P.F. Hu Porous alpha-MoO3/MWCNT nanocomposite synthesized via a surfactant-assisted solvothermal route as a lithium-ion-battery high-capacity anode material with excellent rate capability and cyclability ACS Appl. Mater. Interfaces 7 2015 15531 15541 F. Ma, A.B. Yuan, J.Q. Xu, P.F. Hu, Porous alpha-MoO3/MWCNT nanocomposite synthesized via a surfactant-assisted solvothermal route as a lithium-ion-battery high-capacity anode material with excellent rate capability and cyclability, ACS Appl. Mater. Interfaces, 7 (2015) 15531–15541. [50] Y.H. Ding J. Peng S.U. Khan Y. Yuan A new polyoxometalate (POM)-based composite: Fabrication through POM-assisted polymerization of dopamine and properties as anode materials for high-performance lithium-ion batteries Chem. Eur. J. 23 2017 10338 10343 Y.H. Ding, J. Peng, S.U. Khan, Y. Yuan, A new polyoxometalate (POM)-based composite: Fabrication through POM-assisted polymerization of dopamine and properties as anode materials for high-performance lithium-ion batteries, Chem. Eur. J., 23 (2017) 10338–10343. [51] L.L. Zhou Y. Sun B. Li Z.J. Li Z.K. Zhang J. Yun R.J. Liu Selective oxidation of methacrolein to methacrylic acid on carbon catalysts Catal. Commun. 126 2019 44 49 L.L. Zhou, Y. Sun, B. Li, Z.J. Li, Z.K. Zhang, J. Yun, R.J. Liu, Selective oxidation of methacrolein to methacrylic acid on carbon catalysts, Catal. Commun., 126 (2019) 44–49.",
      "scopus-id": "85171687568",
      "coredata": {
        "eid": "1-s2.0-S2468823123006545",
        "dc:description": "The oxidation of methacrolein (MAL) to methacrylic acid (MAA) catalyzed by Keggin-type phosphomolybdovanadic acid catalyst belongs to the acid-catalyzed and oxygen-catalyzed co-promoted reactions. It is a challenge to design catalysts with suitable acidity and redox properties. In this paper, a strategy using organic ammonia to modify CsH3PMo11VO40 (CsPAV) was proposed. Core-shell polymerization precursors were synthesized by using polydopamine (PDA) microspheres as modifiers and templates, and regularly arranged PDA-CsPAV bowl-shaped catalysts were obtained via one-step calcination. The morphology, structure, thermal stability, acidity and redox properties of PDA-CsPAV catalysts were characterized by XRD, FT-IR, TG-DTA, XPS, SEM, H2-TPR and NH3-TPD, and the catalytic performance was evaluated by oxidation of MAL to MAA. The rich functional groups on the surface of PDA microspheres combine with H4PMo11VO40 (HPAV) through strong coordination bonds to form a catalyst film. The uniform spherical structure of PDA can adjust the dispersion and morphology of CsPAV. NH4 + was formed and rearranged with heteropoly anions during calcination, which positively regulated the acidity and redox property of the catalyst. The addition of PDA accelerated electron transfer and strengthened the self-reduction process of HPAV. Compared with CsPAV, PDA-CsPAV has more acid sites and oxidation catalytic active centers (VO2+), thus exhibiting better MAL oxidation performance and good thermal stability.",
        "openArchiveArticle": "false",
        "prism:coverDate": "2023-11-30",
        "openaccessUserLicense": null,
        "prism:aggregationType": "Journal",
        "prism:url": "https://api.elsevier.com/content/article/pii/S2468823123006545",
        "dc:creator": [
          {
            "@_fa": "true",
            "$": "Li, Yang"
          },
          {
            "@_fa": "true",
            "$": "Zhu, Qianwen"
          },
          {
            "@_fa": "true",
            "$": "Yue, Yifan"
          },
          {
            "@_fa": "true",
            "$": "Zhang, Zhaobang"
          },
          {
            "@_fa": "true",
            "$": "Wang, Baohe"
          },
          {
            "@_fa": "true",
            "$": "Zhu, Jing"
          },
          {
            "@_fa": "true",
            "$": "Ma, Jing"
          }
        ],
        "link": [
          {
            "@_fa": "true",
            "@rel": "self",
            "@href": "https://api.elsevier.com/content/article/pii/S2468823123006545"
          },
          {
            "@_fa": "true",
            "@rel": "scidir",
            "@href": "https://www.sciencedirect.com/science/article/pii/S2468823123006545"
          }
        ],
        "dc:format": "application/json",
        "openaccessType": null,
        "pii": "S2468-8231(23)00654-5",
        "prism:volume": "550",
        "articleNumber": "113571",
        "prism:publisher": "Elsevier B.V.",
        "dc:title": "Polydopamine modified heteropolyacids catalyst for methacrolein oxidation: Organic ammonia functionalized and regulation of morphology",
        "prism:copyright": "© 2023 Elsevier B.V. All rights reserved.",
        "openaccess": "0",
        "prism:issn": "24688231",
        "dcterms:subject": [
          {
            "@_fa": "true",
            "$": "Phosphomolybdovanadinic acid"
          },
          {
            "@_fa": "true",
            "$": "Polydopamine"
          },
          {
            "@_fa": "true",
            "$": "Methacrolein"
          },
          {
            "@_fa": "true",
            "$": "Oxidation"
          }
        ],
        "openaccessArticle": "false",
        "prism:publicationName": "Molecular Catalysis",
        "openaccessSponsorType": null,
        "prism:pageRange": "113571",
        "pubType": "fla",
        "prism:coverDisplayDate": "November 2023",
        "prism:doi": "10.1016/j.mcat.2023.113571",
        "prism:startingPage": "113571",
        "dc:identifier": "doi:10.1016/j.mcat.2023.113571",
        "openaccessSponsorName": null
      },
      "objects": {
        "object": [
          {
            "@category": "standard",
            "@height": "299",
            "@width": "339",
            "@_fa": "true",
            "$": "https://api.elsevier.com/content/object/eid/1-s2.0-S2468823123006545-gr6.jpg?httpAccept=%2A%2F%2A",
            "@multimediatype": "JPEG image file",
            "@type": "IMAGE-DOWNSAMPLED",
            "@size": "26623",
            "@ref": "gr6",
            "@mimetype": "image/jpeg"
          },
          {
            "@category": "standard",
            "@height": "298",
            "@width": "715",
            "@_fa": "true",
            "$": "https://api.elsevier.com/content/object/eid/1-s2.0-S2468823123006545-gr12.jpg?httpAccept=%2A%2F%2A",
            "@multimediatype": "JPEG image file",
            "@type": "IMAGE-DOWNSAMPLED",
            "@size": "49638",
            "@ref": "gr12",
            "@mimetype": "image/jpeg"
          },
          {
            "@category": "standard",
            "@height": "292",
            "@width": "715",
            "@_fa": "true",
            "$": "https://api.elsevier.com/content/object/eid/1-s2.0-S2468823123006545-gr13.jpg?httpAccept=%2A%2F%2A",
            "@multimediatype": "JPEG image file",
            "@type": "IMAGE-DOWNSAMPLED",
            "@size": "56547",
            "@ref": "gr13",
            "@mimetype": "image/jpeg"
          },
          {
            "@category": "standard",
            "@height": "291",
            "@width": "715",
            "@_fa": "true",
            "$": "https://api.elsevier.com/content/object/eid/1-s2.0-S2468823123006545-gr2.jpg?httpAccept=%2A%2F%2A",
            "@multimediatype": "JPEG image file",
            "@type": "IMAGE-DOWNSAMPLED",
            "@size": "71335",
            "@ref": "gr2",
            "@mimetype": "image/jpeg"
          },
          {
            "@category": "standard",
            "@height": "422",
            "@width": "565",
            "@_fa": "true",
            "$": "https://api.elsevier.com/content/object/eid/1-s2.0-S2468823123006545-gr3.jpg?httpAccept=%2A%2F%2A",
            "@multimediatype": "JPEG image file",
            "@type": "IMAGE-DOWNSAMPLED",
            "@size": "117692",
            "@ref": "gr3",
            "@mimetype": "image/jpeg"
          },
          {
            "@category": "standard",
            "@height": "180",
            "@width": "565",
            "@_fa": "true",
            "$": "https://api.elsevier.com/content/object/eid/1-s2.0-S2468823123006545-gr4.jpg?httpAccept=%2A%2F%2A",
            "@multimediatype": "JPEG image file",
            "@type": "IMAGE-DOWNSAMPLED",
            "@size": "41560",
            "@ref": "gr4",
            "@mimetype": "image/jpeg"
          },
          {
            "@category": "standard",
            "@height": "290",
            "@width": "489",
            "@_fa": "true",
            "$": "https://api.elsevier.com/content/object/eid/1-s2.0-S2468823123006545-gr14.jpg?httpAccept=%2A%2F%2A",
            "@multimediatype": "JPEG image file",
            "@type": "IMAGE-DOWNSAMPLED",
            "@size": "58479",
            "@ref": "gr14",
            "@mimetype": "image/jpeg"
          },
          {
            "@category": "standard",
            "@height": "550",
            "@width": "715",
            "@_fa": "true",
            "$": "https://api.elsevier.com/content/object/eid/1-s2.0-S2468823123006545-gr5.jpg?httpAccept=%2A%2F%2A",
            "@multimediatype": "JPEG image file",
            "@type": "IMAGE-DOWNSAMPLED",
            "@size": "79177",
            "@ref": "gr5",
            "@mimetype": "image/jpeg"
          },
          {
            "@category": "standard",
            "@height": "200",
            "@width": "395",
            "@_fa": "true",
            "$": "https://api.elsevier.com/content/object/eid/1-s2.0-S2468823123006545-gr15.jpg?httpAccept=%2A%2F%2A",
            "@multimediatype": "JPEG image file",
            "@type": "IMAGE-DOWNSAMPLED",
            "@size": "40172",
            "@ref": "gr15",
            "@mimetype": "image/jpeg"
          },
          {
            "@category": "standard",
            "@height": "293",
            "@width": "715",
            "@_fa": "true",
            "$": "https://api.elsevier.com/content/object/eid/1-s2.0-S2468823123006545-gr8.jpg?httpAccept=%2A%2F%2A",
            "@multimediatype": "JPEG image file",
            "@type": "IMAGE-DOWNSAMPLED",
            "@size": "46334",
            "@ref": "gr8",
            "@mimetype": "image/jpeg"
          },
          {
            "@category": "standard",
            "@height": "299",
            "@width": "339",
            "@_fa": "true",
            "$": "https://api.elsevier.com/content/object/eid/1-s2.0-S2468823123006545-gr7.jpg?httpAccept=%2A%2F%2A",
            "@multimediatype": "JPEG image file",
            "@type": "IMAGE-DOWNSAMPLED",
            "@size": "24635",
            "@ref": "gr7",
            "@mimetype": "image/jpeg"
          },
          {
            "@category": "standard",
            "@height": "602",
            "@width": "715",
            "@_fa": "true",
            "$": "https://api.elsevier.com/content/object/eid/1-s2.0-S2468823123006545-gr9.jpg?httpAccept=%2A%2F%2A",
            "@multimediatype": "JPEG image file",
            "@type": "IMAGE-DOWNSAMPLED",
            "@size": "114283",
            "@ref": "gr9",
            "@mimetype": "image/jpeg"
          },
          {
            "@category": "standard",
            "@height": "574",
            "@width": "715",
            "@_fa": "true",
            "$": "https://api.elsevier.com/content/object/eid/1-s2.0-S2468823123006545-gr10.jpg?httpAccept=%2A%2F%2A",
            "@multimediatype": "JPEG image file",
            "@type": "IMAGE-DOWNSAMPLED",
            "@size": "110302",
            "@ref": "gr10",
            "@mimetype": "image/jpeg"
          },
          {
            "@category": "standard",
            "@height": "298",
            "@width": "715",
            "@_fa": "true",
            "$": "https://api.elsevier.com/content/object/eid/1-s2.0-S2468823123006545-gr11.jpg?httpAccept=%2A%2F%2A",
            "@multimediatype": "JPEG image file",
            "@type": "IMAGE-DOWNSAMPLED",
            "@size": "54826",
            "@ref": "gr11",
            "@mimetype": "image/jpeg"
          },
          {
            "@category": "standard",
            "@height": "293",
            "@width": "715",
            "@_fa": "true",
            "$": "https://api.elsevier.com/content/object/eid/1-s2.0-S2468823123006545-gr1.jpg?httpAccept=%2A%2F%2A",
            "@multimediatype": "JPEG image file",
            "@type": "IMAGE-DOWNSAMPLED",
            "@size": "72904",
            "@ref": "gr1",
            "@mimetype": "image/jpeg"
          },
          {
            "@category": "thumbnail",
            "@height": "164",
            "@width": "186",
            "@_fa": "true",
            "$": "https://api.elsevier.com/content/object/eid/1-s2.0-S2468823123006545-gr6.sml?httpAccept=%2A%2F%2A",
            "@multimediatype": "GIF image file",
            "@type": "IMAGE-THUMBNAIL",
            "@size": "9158",
            "@ref": "gr6",
            "@mimetype": "image/gif"
          },
          {
            "@category": "thumbnail",
            "@height": "91",
            "@width": "219",
            "@_fa": "true",
            "$": "https://api.elsevier.com/content/object/eid/1-s2.0-S2468823123006545-gr12.sml?httpAccept=%2A%2F%2A",
            "@multimediatype": "GIF image file",
            "@type": "IMAGE-THUMBNAIL",
            "@size": "7978",
            "@ref": "gr12",
            "@mimetype": "image/gif"
          },
          {
            "@category": "thumbnail",
            "@height": "90",
            "@width": "219",
            "@_fa": "true",
            "$": "https://api.elsevier.com/content/object/eid/1-s2.0-S2468823123006545-gr13.sml?httpAccept=%2A%2F%2A",
            "@multimediatype": "GIF image file",
            "@type": "IMAGE-THUMBNAIL",
            "@size": "8386",
            "@ref": "gr13",
            "@mimetype": "image/gif"
          },
          {
            "@category": "thumbnail",
            "@height": "89",
            "@width": "219",
            "@_fa": "true",
            "$": "https://api.elsevier.com/content/object/eid/1-s2.0-S2468823123006545-gr2.sml?httpAccept=%2A%2F%2A",
            "@multimediatype": "GIF image file",
            "@type": "IMAGE-THUMBNAIL",
            "@size": "9415",
            "@ref": "gr2",
            "@mimetype": "image/gif"
          },
          {
            "@category": "thumbnail",
            "@height": "164",
            "@width": "219",
            "@_fa": "true",
            "$": "https://api.elsevier.com/content/object/eid/1-s2.0-S2468823123006545-gr3.sml?httpAccept=%2A%2F%2A",
            "@multimediatype": "GIF image file",
            "@type": "IMAGE-THUMBNAIL",
            "@size": "34125",
            "@ref": "gr3",
            "@mimetype": "image/gif"
          },
          {
            "@category": "thumbnail",
            "@height": "70",
            "@width": "219",
            "@_fa": "true",
            "$": "https://api.elsevier.com/content/object/eid/1-s2.0-S2468823123006545-gr4.sml?httpAccept=%2A%2F%2A",
            "@multimediatype": "GIF image file",
            "@type": "IMAGE-THUMBNAIL",
            "@size": "10026",
            "@ref": "gr4",
            "@mimetype": "image/gif"
          },
          {
            "@category": "thumbnail",
            "@height": "130",
            "@width": "219",
            "@_fa": "true",
            "$": "https://api.elsevier.com/content/object/eid/1-s2.0-S2468823123006545-gr14.sml?httpAccept=%2A%2F%2A",
            "@multimediatype": "GIF image file",
            "@type": "IMAGE-THUMBNAIL",
            "@size": "15677",
            "@ref": "gr14",
            "@mimetype": "image/gif"
          },
          {
            "@category": "thumbnail",
            "@height": "164",
            "@width": "213",
            "@_fa": "true",
            "$": "https://api.elsevier.com/content/object/eid/1-s2.0-S2468823123006545-gr5.sml?httpAccept=%2A%2F%2A",
            "@multimediatype": "GIF image file",
            "@type": "IMAGE-THUMBNAIL",
            "@size": "8741",
            "@ref": "gr5",
            "@mimetype": "image/gif"
          },
          {
            "@category": "thumbnail",
            "@height": "111",
            "@width": "219",
            "@_fa": "true",
            "$": "https://api.elsevier.com/content/object/eid/1-s2.0-S2468823123006545-gr15.sml?httpAccept=%2A%2F%2A",
            "@multimediatype": "GIF image file",
            "@type": "IMAGE-THUMBNAIL",
            "@size": "14574",
            "@ref": "gr15",
            "@mimetype": "image/gif"
          },
          {
            "@category": "thumbnail",
            "@height": "90",
            "@width": "219",
            "@_fa": "true",
            "$": "https://api.elsevier.com/content/object/eid/1-s2.0-S2468823123006545-gr8.sml?httpAccept=%2A%2F%2A",
            "@multimediatype": "GIF image file",
            "@type": "IMAGE-THUMBNAIL",
            "@size": "7437",
            "@ref": "gr8",
            "@mimetype": "image/gif"
          },
          {
            "@category": "thumbnail",
            "@height": "164",
            "@width": "186",
            "@_fa": "true",
            "$": "https://api.elsevier.com/content/object/eid/1-s2.0-S2468823123006545-gr7.sml?httpAccept=%2A%2F%2A",
            "@multimediatype": "GIF image file",
            "@type": "IMAGE-THUMBNAIL",
            "@size": "9344",
            "@ref": "gr7",
            "@mimetype": "image/gif"
          },
          {
            "@category": "thumbnail",
            "@height": "164",
            "@width": "195",
            "@_fa": "true",
            "$": "https://api.elsevier.com/content/object/eid/1-s2.0-S2468823123006545-gr9.sml?httpAccept=%2A%2F%2A",
            "@multimediatype": "GIF image file",
            "@type": "IMAGE-THUMBNAIL",
            "@size": "11950",
            "@ref": "gr9",
            "@mimetype": "image/gif"
          },
          {
            "@category": "thumbnail",
            "@height": "164",
            "@width": "204",
            "@_fa": "true",
            "$": "https://api.elsevier.com/content/object/eid/1-s2.0-S2468823123006545-gr10.sml?httpAccept=%2A%2F%2A",
            "@multimediatype": "GIF image file",
            "@type": "IMAGE-THUMBNAIL",
            "@size": "12407",
            "@ref": "gr10",
            "@mimetype": "image/gif"
          },
          {
            "@category": "thumbnail",
            "@height": "91",
            "@width": "219",
            "@_fa": "true",
            "$": "https://api.elsevier.com/content/object/eid/1-s2.0-S2468823123006545-gr11.sml?httpAccept=%2A%2F%2A",
            "@multimediatype": "GIF image file",
            "@type": "IMAGE-THUMBNAIL",
            "@size": "7946",
            "@ref": "gr11",
            "@mimetype": "image/gif"
          },
          {
            "@category": "thumbnail",
            "@height": "90",
            "@width": "219",
            "@_fa": "true",
            "$": "https://api.elsevier.com/content/object/eid/1-s2.0-S2468823123006545-gr1.sml?httpAccept=%2A%2F%2A",
            "@multimediatype": "GIF image file",
            "@type": "IMAGE-THUMBNAIL",
            "@size": "9412",
            "@ref": "gr1",
            "@mimetype": "image/gif"
          },
          {
            "@category": "high",
            "@height": "1324",
            "@width": "1500",
            "@_fa": "true",
            "$": "https://api.elsevier.com/content/object/eid/1-s2.0-S2468823123006545-gr6_lrg.jpg?httpAccept=%2A%2F%2A",
            "@multimediatype": "JPEG image file",
            "@type": "IMAGE-HIGH-RES",
            "@size": "193776",
            "@ref": "gr6",
            "@mimetype": "image/jpeg"
          },
          {
            "@category": "high",
            "@height": "1318",
            "@width": "3167",
            "@_fa": "true",
            "$": "https://api.elsevier.com/content/object/eid/1-s2.0-S2468823123006545-gr12_lrg.jpg?httpAccept=%2A%2F%2A",
            "@multimediatype": "JPEG image file",
            "@type": "IMAGE-HIGH-RES",
            "@size": "354671",
            "@ref": "gr12",
            "@mimetype": "image/jpeg"
          },
          {
            "@category": "high",
            "@height": "1295",
            "@width": "3167",
            "@_fa": "true",
            "$": "https://api.elsevier.com/content/object/eid/1-s2.0-S2468823123006545-gr13_lrg.jpg?httpAccept=%2A%2F%2A",
            "@multimediatype": "JPEG image file",
            "@type": "IMAGE-HIGH-RES",
            "@size": "401404",
            "@ref": "gr13",
            "@mimetype": "image/jpeg"
          },
          {
            "@category": "high",
            "@height": "1287",
            "@width": "3167",
            "@_fa": "true",
            "$": "https://api.elsevier.com/content/object/eid/1-s2.0-S2468823123006545-gr2_lrg.jpg?httpAccept=%2A%2F%2A",
            "@multimediatype": "JPEG image file",
            "@type": "IMAGE-HIGH-RES",
            "@size": "521673",
            "@ref": "gr2",
            "@mimetype": "image/jpeg"
          },
          {
            "@category": "high",
            "@height": "1868",
            "@width": "2500",
            "@_fa": "true",
            "$": "https://api.elsevier.com/content/object/eid/1-s2.0-S2468823123006545-gr3_lrg.jpg?httpAccept=%2A%2F%2A",
            "@multimediatype": "JPEG image file",
            "@type": "IMAGE-HIGH-RES",
            "@size": "1014598",
            "@ref": "gr3",
            "@mimetype": "image/jpeg"
          },
          {
            "@category": "high",
            "@height": "797",
            "@width": "2500",
            "@_fa": "true",
            "$": "https://api.elsevier.com/content/object/eid/1-s2.0-S2468823123006545-gr4_lrg.jpg?httpAccept=%2A%2F%2A",
            "@multimediatype": "JPEG image file",
            "@type": "IMAGE-HIGH-RES",
            "@size": "343582",
            "@ref": "gr4",
            "@mimetype": "image/jpeg"
          },
          {
            "@category": "high",
            "@height": "1287",
            "@width": "2167",
            "@_fa": "true",
            "$": "https://api.elsevier.com/content/object/eid/1-s2.0-S2468823123006545-gr14_lrg.jpg?httpAccept=%2A%2F%2A",
            "@multimediatype": "JPEG image file",
            "@type": "IMAGE-HIGH-RES",
            "@size": "451379",
            "@ref": "gr14",
            "@mimetype": "image/jpeg"
          },
          {
            "@category": "high",
            "@height": "2435",
            "@width": "3167",
            "@_fa": "true",
            "$": "https://api.elsevier.com/content/object/eid/1-s2.0-S2468823123006545-gr5_lrg.jpg?httpAccept=%2A%2F%2A",
            "@multimediatype": "JPEG image file",
            "@type": "IMAGE-HIGH-RES",
            "@size": "577636",
            "@ref": "gr5",
            "@mimetype": "image/jpeg"
          },
          {
            "@category": "high",
            "@height": "886",
            "@width": "1748",
            "@_fa": "true",
            "$": "https://api.elsevier.com/content/object/eid/1-s2.0-S2468823123006545-gr15_lrg.jpg?httpAccept=%2A%2F%2A",
            "@multimediatype": "JPEG image file",
            "@type": "IMAGE-HIGH-RES",
            "@size": "303300",
            "@ref": "gr15",
            "@mimetype": "image/jpeg"
          },
          {
            "@category": "high",
            "@height": "1297",
            "@width": "3167",
            "@_fa": "true",
            "$": "https://api.elsevier.com/content/object/eid/1-s2.0-S2468823123006545-gr8_lrg.jpg?httpAccept=%2A%2F%2A",
            "@multimediatype": "JPEG image file",
            "@type": "IMAGE-HIGH-RES",
            "@size": "324817",
            "@ref": "gr8",
            "@mimetype": "image/jpeg"
          },
          {
            "@category": "high",
            "@height": "1323",
            "@width": "1500",
            "@_fa": "true",
            "$": "https://api.elsevier.com/content/object/eid/1-s2.0-S2468823123006545-gr7_lrg.jpg?httpAccept=%2A%2F%2A",
            "@multimediatype": "JPEG image file",
            "@type": "IMAGE-HIGH-RES",
            "@size": "189415",
            "@ref": "gr7",
            "@mimetype": "image/jpeg"
          },
          {
            "@category": "high",
            "@height": "2665",
            "@width": "3167",
            "@_fa": "true",
            "$": "https://api.elsevier.com/content/object/eid/1-s2.0-S2468823123006545-gr9_lrg.jpg?httpAccept=%2A%2F%2A",
            "@multimediatype": "JPEG image file",
            "@type": "IMAGE-HIGH-RES",
            "@size": "827242",
            "@ref": "gr9",
            "@mimetype": "image/jpeg"
          },
          {
            "@category": "high",
            "@height": "2543",
            "@width": "3167",
            "@_fa": "true",
            "$": "https://api.elsevier.com/content/object/eid/1-s2.0-S2468823123006545-gr10_lrg.jpg?httpAccept=%2A%2F%2A",
            "@multimediatype": "JPEG image file",
            "@type": "IMAGE-HIGH-RES",
            "@size": "769297",
            "@ref": "gr10",
            "@mimetype": "image/jpeg"
          },
          {
            "@category": "high",
            "@height": "1321",
            "@width": "3167",
            "@_fa": "true",
            "$": "https://api.elsevier.com/content/object/eid/1-s2.0-S2468823123006545-gr11_lrg.jpg?httpAccept=%2A%2F%2A",
            "@multimediatype": "JPEG image file",
            "@type": "IMAGE-HIGH-RES",
            "@size": "402073",
            "@ref": "gr11",
            "@mimetype": "image/jpeg"
          },
          {
            "@category": "high",
            "@height": "1296",
            "@width": "3167",
            "@_fa": "true",
            "$": "https://api.elsevier.com/content/object/eid/1-s2.0-S2468823123006545-gr1_lrg.jpg?httpAccept=%2A%2F%2A",
            "@multimediatype": "JPEG image file",
            "@type": "IMAGE-HIGH-RES",
            "@size": "526783",
            "@ref": "gr1",
            "@mimetype": "image/jpeg"
          },
          {
            "@category": "standard",
            "@_fa": "true",
            "$": "https://api.elsevier.com/content/object/eid/1-s2.0-S2468823123006545-mmc1.docx?httpAccept=%2A%2F%2A",
            "@multimediatype": "Microsoft Word file",
            "@type": "APPLICATION",
            "@size": "148150",
            "@ref": "mmc1",
            "@mimetype": "application/word"
          },
          {
            "@category": "standard",
            "@_fa": "true",
            "$": "https://api.elsevier.com/content/object/eid/1-s2.0-S2468823123006545-am.pdf?httpAccept=%2A%2F%2A",
            "@multimediatype": "Acrobat PDF file",
            "@type": "AAM-PDF",
            "@size": "3057759",
            "@ref": "am",
            "@mimetype": "application/pdf"
          }
        ]
      },
      "link": {
        "@rel": "abstract",
        "@href": "https://api.elsevier.com/content/abstract/scopus_id/85171687568"
      }
    }
  }
}