{
  "metadata": {
    "title": "Mechanistic insight into the photocatalytic <ce:italic>N</ce:italic>-alkylation of piperazine with alcohols over TiO<ce:inf loc=post>2</ce:inf> supported Pd catalysts",
    "authors": "; ; ",
    "journal": "Molecular Catalysis",
    "date": "2023-03-01",
    "doi": "10.1016/j.mcat.2023.112993",
    "abstract": "",
    "uri": "https://api.elsevier.com/content/article/pii/S2468823123000809",
    "pii": "S2468823123000809"
  },
  "fulltext": {
    "full-text-retrieval-response": {
      "scopus-eid": "2-s2.0-85148957020",
      "originalText": "serial JL 315758 291210 291744 291790 291809 31 Molecular Catalysis MOLECULARCATALYSIS 2023-02-07 2023-02-07 2023-02-07 2023-02-07 2023-09-20T11:58:35 1-s2.0-S2468823123000809 S2468-8231(23)00080-9 S2468823123000809 10.1016/j.mcat.2023.112993 S300 S300.1 FULL-TEXT 1-s2.0-S2468823123X00042 2024-06-26T17:47:57.988066Z 0 0 20230301 2023 2023-02-07T20:04:23.365694Z absattachment articleinfo articlenumber articletitlenorm authfirstinitialnorm authfirstsurnamenorm cid cids contenttype copyright crossmark dateloaded dateloadedtxt datesearch datesort dateupdated dco docsubtype doctype doi eid ewtransactionid hubeid indexeddate issn issnnorm itemstage itemtransactionid itemweight openaccess openarchive pg pgfirst pii piinorm pubdatestart pubdatetxt pubyr sortorder srctitle srctitlenorm srctype ssids alllist content subj subheadings suppl tomb volfirst volissue volumelist webpdf webpdfpagecount yearnav figure table e-component body acknowledge affil appendices articletitle auth authfirstini authfull authkeywords authlast grantnumber grantsponsor grantsponsorid highlightsabst orcid primabst ref specialabst 2468-8231 24688231 true 538 538 C Volume 538 19 112993 112993 112993 20230301 1 March 2023 2023-03-01 2023 article fla © 2023 Elsevier B.V. All rights reserved. MECHANISTICINSIGHTPHOTOCATALYTICNALKYLATIONPIPERAZINEALCOHOLSOVERTIO2SUPPORTEDPDCATALYSTS CHEN W 1 Introduction 2 Experimental section 2.1 Preparation of the catalysts 2.1.1 Photodeposition method 2.1.2 Chemical reduction method 2.1.3 Hydrogen reduction method 2.2 Material characterization 2.3 Catalytic activity test 2.3.1 Photocatalytic N-alkylation reaction 2.3.2 Condensation of piperazine with formaldehyde 2.3.3 Hydrogenation of enamine 2.3.4 Kinetic isotope effect experiment 3 Results and discussion 3.1 Evaluation of catalytic performance 3.2 Characterization of Pd/TiO2 catalysts 3.3 Photocatalysis of piperazine N-methylation 3.4 Recycling test and substrate scope 3.5 Proposed reaction mechanism 4 Conclusions CRediT authorship contribution statement Acknowledgement Appendix Supplementary materials References WANG 2021 7239 7254 X DOW 2021 1827 1842 N JAFARZADEH 2022 7713 7745 M IRRGANG 2018 2524 2549 T JIANG 2017 1831 1835 X JAMIL 2019 47 56 M SHI 2009 5912 5915 F SUN 2012 30 33 J SIDDIKI 2018 3091 3103 S SHANG 2021 4613 4632 W GUO 2018 2469 2473 X ALAM 2018 2680 2684 R SHIRAISHI 2013 312 320 Y TSAREV 2015 2530 2533 V WANG 2018 970 975 B WANG 2018 15419 15424 L CHAUDHARY 2006 1819 1826 P ARBO 2012 174 185 M NEUMANN 2017 5410 5413 J TAYADE 2014 91 96 K TIAN 2020 2603 2612 C LU 2021 127709 X LIU 2011 14398 14401 J YU 2021 6656 6661 J DU 2020 110771 M TANG 2021 121186 C MOHAJERNIA 2020 1432 1442 S XIU 2020 123011 Z KHAN 2015 2522 2531 M FAN 2018 2274 2282 Y ZHU 2019 36 42 Y WANG 2018 7270 7278 D HAO 2021 2100919 L BAMWENDA 1995 177 189 G TAYLOR 2006 1520 1543 M DOYLE 2007 5713 5743 A DING 2017 484 491 S HAN 2018 200 S JEDSUKONTORN 2017 160 171 T ALAZRI 2015 355 367 Z CHEN 2022 19614 19621 W CHEN 2017 352 367 Y LI 2016 890 895 A WANG 2016 151 157 D YE 2010 184 187 M LIU 2015 757 759 R ALSHAMMARI 2020 141 149 A JIANG 2019 2046 2049 L ZHANG 2015 14514 14521 L ZHANG 2020 4433 4437 B CHENX2023X112993 CHENX2023X112993XW 2025-02-07T00:00:00.000Z 2025-02-07T00:00:00.000Z http://creativecommons.org/licenses/by-nc-nd/4.0/ © 2023 Elsevier B.V. All rights reserved. 2023-03-03T10:47:07.467Z http://vtw.elsevier.com/data/voc/AddOnTypes/50.7/aggregated-refined National Natural Science Foundation of China 21972113 22272135 NSFC National Natural Science Foundation of China http://data.elsevier.com/vocabulary/SciValFunders/501100001809 http://sws.geonames.org/1814991/ The authors thank for the financial support from the National Natural Science Foundation of China ( 21972113 and 22272135 ). https://doi.org/10.15223/policy-017 https://doi.org/10.15223/policy-037 https://doi.org/10.15223/policy-012 https://doi.org/10.15223/policy-029 https://doi.org/10.15223/policy-004 item S2468-8231(23)00080-9 S2468823123000809 1-s2.0-S2468823123000809 10.1016/j.mcat.2023.112993 315758 2023-09-20T11:26:20.963956Z 2023-03-01 1-s2.0-S2468823123000809-main.pdf https://s3-eu-west-1.amazonaws.com/prod-ucs-content-store-eu-west/content/pii:S2468823123000809/MAIN/application/pdf/0ebbc26014caf466cde244307dd9a5a2/main.pdf main.pdf pdf true 2841016 MAIN 10 1-s2.0-S2468823123000809-main_1.png https://s3-eu-west-1.amazonaws.com/prod-ucs-content-store-eu-west/content/pii:S2468823123000809/PREVIEW/image/png/ef4f1115e8c81ee6fce2af3b70f26781/main_1.png main_1.png png 59209 849 656 IMAGE-WEB-PDF 1 1-s2.0-S2468823123000809-fx5.jpg https://s3-eu-west-1.amazonaws.com/prod-ucs-content-store-eu-west/content/pii:S2468823123000809/fx5/DOWNSAMPLED/image/jpeg/e6d611fc14cfbb6bf312ee2a117e6ab6/fx5.jpg fx5 fx5.jpg jpg 1933 49 116 IMAGE-DOWNSAMPLED 1-s2.0-S2468823123000809-fx6.jpg https://s3-eu-west-1.amazonaws.com/prod-ucs-content-store-eu-west/content/pii:S2468823123000809/fx6/DOWNSAMPLED/image/jpeg/0e9ff56cd7c07211e25a7187242e91c9/fx6.jpg fx6 fx6.jpg jpg 1676 51 88 IMAGE-DOWNSAMPLED 1-s2.0-S2468823123000809-sc1.jpg https://s3-eu-west-1.amazonaws.com/prod-ucs-content-store-eu-west/content/pii:S2468823123000809/sc1/DOWNSAMPLED/image/jpeg/ef49a12a7cbec04aeea0f8d7ed9840fc/sc1.jpg sc1 sc1.jpg jpg 15458 169 339 IMAGE-DOWNSAMPLED 1-s2.0-S2468823123000809-fx3.jpg https://s3-eu-west-1.amazonaws.com/prod-ucs-content-store-eu-west/content/pii:S2468823123000809/fx3/DOWNSAMPLED/image/jpeg/09a76f3958af67e7f9bffefb7f43225b/fx3.jpg fx3 fx3.jpg jpg 1641 50 88 IMAGE-DOWNSAMPLED 1-s2.0-S2468823123000809-sc2.jpg https://s3-eu-west-1.amazonaws.com/prod-ucs-content-store-eu-west/content/pii:S2468823123000809/sc2/DOWNSAMPLED/image/jpeg/612f63377fdd2e3c7c4ee315c4809663/sc2.jpg sc2 sc2.jpg jpg 19868 307 339 IMAGE-DOWNSAMPLED 1-s2.0-S2468823123000809-fx4.jpg https://s3-eu-west-1.amazonaws.com/prod-ucs-content-store-eu-west/content/pii:S2468823123000809/fx4/DOWNSAMPLED/image/jpeg/b1d7f523ae75008be14130e19f93a633/fx4.jpg fx4 fx4.jpg jpg 782 17 47 IMAGE-DOWNSAMPLED 1-s2.0-S2468823123000809-gr2.jpg https://s3-eu-west-1.amazonaws.com/prod-ucs-content-store-eu-west/content/pii:S2468823123000809/gr2/DOWNSAMPLED/image/jpeg/6f5ab99d19bc4c5dae2871041e6afecd/gr2.jpg gr2 gr2.jpg jpg 46804 371 339 IMAGE-DOWNSAMPLED 1-s2.0-S2468823123000809-fx9.jpg https://s3-eu-west-1.amazonaws.com/prod-ucs-content-store-eu-west/content/pii:S2468823123000809/fx9/DOWNSAMPLED/image/jpeg/866caf4e0ef0be3bdc1bdb571036aab9/fx9.jpg fx9 fx9.jpg jpg 1433 51 62 IMAGE-DOWNSAMPLED 1-s2.0-S2468823123000809-gr3.jpg https://s3-eu-west-1.amazonaws.com/prod-ucs-content-store-eu-west/content/pii:S2468823123000809/gr3/DOWNSAMPLED/image/jpeg/08b86cb36d644b2688db005ce24c108c/gr3.jpg gr3 gr3.jpg jpg 112626 924 606 IMAGE-DOWNSAMPLED 1-s2.0-S2468823123000809-fx7.jpg https://s3-eu-west-1.amazonaws.com/prod-ucs-content-store-eu-west/content/pii:S2468823123000809/fx7/DOWNSAMPLED/image/jpeg/c9422e838e8cacc6eea9439305b2a99c/fx7.jpg fx7 fx7.jpg jpg 1175 21 88 IMAGE-DOWNSAMPLED 1-s2.0-S2468823123000809-gr1.jpg https://s3-eu-west-1.amazonaws.com/prod-ucs-content-store-eu-west/content/pii:S2468823123000809/gr1/DOWNSAMPLED/image/jpeg/963f99423ce90e9446186d57d417ee4e/gr1.jpg gr1 gr1.jpg jpg 52131 279 659 IMAGE-DOWNSAMPLED 1-s2.0-S2468823123000809-fx8.jpg https://s3-eu-west-1.amazonaws.com/prod-ucs-content-store-eu-west/content/pii:S2468823123000809/fx8/DOWNSAMPLED/image/jpeg/6aff989d283070878c67fb34fa8c479a/fx8.jpg fx8 fx8.jpg jpg 2238 51 148 IMAGE-DOWNSAMPLED 1-s2.0-S2468823123000809-gr10.jpg https://s3-eu-west-1.amazonaws.com/prod-ucs-content-store-eu-west/content/pii:S2468823123000809/gr10/DOWNSAMPLED/image/jpeg/cccf26aa83ba377ffe0ef6532af17127/gr10.jpg gr10 gr10.jpg jpg 21304 302 339 IMAGE-DOWNSAMPLED 1-s2.0-S2468823123000809-fx1.jpg https://s3-eu-west-1.amazonaws.com/prod-ucs-content-store-eu-west/content/pii:S2468823123000809/fx1/DOWNSAMPLED/image/jpeg/8b15c33b4a3a8951caa4e484ece0c9f2/fx1.jpg fx1 fx1.jpg jpg 2354 73 87 IMAGE-DOWNSAMPLED 1-s2.0-S2468823123000809-fx2.jpg https://s3-eu-west-1.amazonaws.com/prod-ucs-content-store-eu-west/content/pii:S2468823123000809/fx2/DOWNSAMPLED/image/jpeg/a8f3f8e210c39954d40b7067ec53315e/fx2.jpg fx2 fx2.jpg jpg 10918 57 703 IMAGE-DOWNSAMPLED 1-s2.0-S2468823123000809-ga1.jpg https://s3-eu-west-1.amazonaws.com/prod-ucs-content-store-eu-west/content/pii:S2468823123000809/ga1/DOWNSAMPLED/image/jpeg/092c6374042507534515aca6a9c400de/ga1.jpg ga1 true ga1.jpg jpg 33825 200 351 IMAGE-DOWNSAMPLED 1-s2.0-S2468823123000809-fx19.jpg https://s3-eu-west-1.amazonaws.com/prod-ucs-content-store-eu-west/content/pii:S2468823123000809/fx19/DOWNSAMPLED/image/jpeg/5aff3da7387192fd7d1fe71a8b4fc214/fx19.jpg fx19 fx19.jpg jpg 797 23 45 IMAGE-DOWNSAMPLED 1-s2.0-S2468823123000809-fx18.jpg https://s3-eu-west-1.amazonaws.com/prod-ucs-content-store-eu-west/content/pii:S2468823123000809/fx18/DOWNSAMPLED/image/jpeg/189cf4761f6e34fe6d18ae44f0242d52/fx18.jpg fx18 fx18.jpg jpg 2338 66 87 IMAGE-DOWNSAMPLED 1-s2.0-S2468823123000809-fx17.jpg https://s3-eu-west-1.amazonaws.com/prod-ucs-content-store-eu-west/content/pii:S2468823123000809/fx17/DOWNSAMPLED/image/jpeg/b4496587d4ee5ac6b574a7051d68e9c3/fx17.jpg fx17 fx17.jpg jpg 2516 83 99 IMAGE-DOWNSAMPLED 1-s2.0-S2468823123000809-fx16.jpg https://s3-eu-west-1.amazonaws.com/prod-ucs-content-store-eu-west/content/pii:S2468823123000809/fx16/DOWNSAMPLED/image/jpeg/5c5badd9eb0e396c957b5c79a3664a38/fx16.jpg fx16 fx16.jpg jpg 809 22 46 IMAGE-DOWNSAMPLED 1-s2.0-S2468823123000809-fx11.jpg https://s3-eu-west-1.amazonaws.com/prod-ucs-content-store-eu-west/content/pii:S2468823123000809/fx11/DOWNSAMPLED/image/jpeg/7f83a6cc48ae87c9c5d4b4bae7769ae7/fx11.jpg fx11 fx11.jpg jpg 1498 54 80 IMAGE-DOWNSAMPLED 1-s2.0-S2468823123000809-fx10.jpg https://s3-eu-west-1.amazonaws.com/prod-ucs-content-store-eu-west/content/pii:S2468823123000809/fx10/DOWNSAMPLED/image/jpeg/75a5974e57d67f67d4c6dd502b3e7167/fx10.jpg fx10 fx10.jpg jpg 825 20 44 IMAGE-DOWNSAMPLED 1-s2.0-S2468823123000809-fx15.jpg https://s3-eu-west-1.amazonaws.com/prod-ucs-content-store-eu-west/content/pii:S2468823123000809/fx15/DOWNSAMPLED/image/jpeg/317dfdec005bace5ed540a982553d4cd/fx15.jpg fx15 fx15.jpg jpg 2507 74 95 IMAGE-DOWNSAMPLED 1-s2.0-S2468823123000809-fx14.jpg https://s3-eu-west-1.amazonaws.com/prod-ucs-content-store-eu-west/content/pii:S2468823123000809/fx14/DOWNSAMPLED/image/jpeg/d7efc5e0cdb8333515b663e7f449d06d/fx14.jpg fx14 fx14.jpg jpg 1605 49 89 IMAGE-DOWNSAMPLED 1-s2.0-S2468823123000809-fx13.jpg https://s3-eu-west-1.amazonaws.com/prod-ucs-content-store-eu-west/content/pii:S2468823123000809/fx13/DOWNSAMPLED/image/jpeg/1d86a2e769af31e682f0c5e45b69ce76/fx13.jpg fx13 fx13.jpg jpg 828 20 44 IMAGE-DOWNSAMPLED 1-s2.0-S2468823123000809-fx12.jpg https://s3-eu-west-1.amazonaws.com/prod-ucs-content-store-eu-west/content/pii:S2468823123000809/fx12/DOWNSAMPLED/image/jpeg/cea441112864fe61fbdadb6afb09c521/fx12.jpg fx12 fx12.jpg jpg 1521 49 74 IMAGE-DOWNSAMPLED 1-s2.0-S2468823123000809-gr6.jpg https://s3-eu-west-1.amazonaws.com/prod-ucs-content-store-eu-west/content/pii:S2468823123000809/gr6/DOWNSAMPLED/image/jpeg/2ddd3f8fabc6040e275f201713896276/gr6.jpg gr6 gr6.jpg jpg 34053 291 339 IMAGE-DOWNSAMPLED 1-s2.0-S2468823123000809-gr7.jpg https://s3-eu-west-1.amazonaws.com/prod-ucs-content-store-eu-west/content/pii:S2468823123000809/gr7/DOWNSAMPLED/image/jpeg/bd322472a146d7c5b5d88e0bf6e80925/gr7.jpg gr7 gr7.jpg jpg 31355 290 339 IMAGE-DOWNSAMPLED 1-s2.0-S2468823123000809-gr4.jpg https://s3-eu-west-1.amazonaws.com/prod-ucs-content-store-eu-west/content/pii:S2468823123000809/gr4/DOWNSAMPLED/image/jpeg/9dee78d4544f55efb51a4f843d89e93d/gr4.jpg gr4 gr4.jpg jpg 55566 318 339 IMAGE-DOWNSAMPLED 1-s2.0-S2468823123000809-gr5.jpg https://s3-eu-west-1.amazonaws.com/prod-ucs-content-store-eu-west/content/pii:S2468823123000809/gr5/DOWNSAMPLED/image/jpeg/2ad905a47ed062ebd5545453ebc95f09/gr5.jpg gr5 gr5.jpg jpg 25954 294 339 IMAGE-DOWNSAMPLED 1-s2.0-S2468823123000809-gr8.jpg https://s3-eu-west-1.amazonaws.com/prod-ucs-content-store-eu-west/content/pii:S2468823123000809/gr8/DOWNSAMPLED/image/jpeg/2b9dca96052df41979a56f672d5c8ab6/gr8.jpg gr8 gr8.jpg jpg 50900 282 659 IMAGE-DOWNSAMPLED 1-s2.0-S2468823123000809-gr9.jpg https://s3-eu-west-1.amazonaws.com/prod-ucs-content-store-eu-west/content/pii:S2468823123000809/gr9/DOWNSAMPLED/image/jpeg/f3960727bb7474f307fb0a7578bf2ba6/gr9.jpg gr9 gr9.jpg jpg 101652 621 659 IMAGE-DOWNSAMPLED 1-s2.0-S2468823123000809-fx5.sml https://s3-eu-west-1.amazonaws.com/prod-ucs-content-store-eu-west/content/pii:S2468823123000809/fx5/THUMBNAIL/image/gif/713c09bd4e052faf57489fbccec5be8e/fx5.sml fx5 fx5.sml sml 2975 92 219 IMAGE-THUMBNAIL 1-s2.0-S2468823123000809-fx6.sml https://s3-eu-west-1.amazonaws.com/prod-ucs-content-store-eu-west/content/pii:S2468823123000809/fx6/THUMBNAIL/image/gif/2d72acf1b1bdf7a3c50a7874e60ee1e3/fx6.sml fx6 fx6.sml sml 3708 127 219 IMAGE-THUMBNAIL 1-s2.0-S2468823123000809-sc1.sml https://s3-eu-west-1.amazonaws.com/prod-ucs-content-store-eu-west/content/pii:S2468823123000809/sc1/THUMBNAIL/image/gif/110975494ac9f0ff7f025401cc5a32cc/sc1.sml sc1 sc1.sml sml 6090 109 219 IMAGE-THUMBNAIL 1-s2.0-S2468823123000809-fx3.sml https://s3-eu-west-1.amazonaws.com/prod-ucs-content-store-eu-west/content/pii:S2468823123000809/fx3/THUMBNAIL/image/gif/46e3104bbcc3795ef7c86240ed1310a0/fx3.sml fx3 fx3.sml sml 3446 123 219 IMAGE-THUMBNAIL 1-s2.0-S2468823123000809-sc2.sml https://s3-eu-west-1.amazonaws.com/prod-ucs-content-store-eu-west/content/pii:S2468823123000809/sc2/THUMBNAIL/image/gif/5f9fe4f918dfca1b032834d3f69c18c6/sc2.sml sc2 sc2.sml sml 6575 164 181 IMAGE-THUMBNAIL 1-s2.0-S2468823123000809-fx4.sml https://s3-eu-west-1.amazonaws.com/prod-ucs-content-store-eu-west/content/pii:S2468823123000809/fx4/THUMBNAIL/image/gif/54d90433cc227e52276d65617cd1b281/fx4.sml fx4 fx4.sml sml 3006 77 210 IMAGE-THUMBNAIL 1-s2.0-S2468823123000809-gr2.sml https://s3-eu-west-1.amazonaws.com/prod-ucs-content-store-eu-west/content/pii:S2468823123000809/gr2/THUMBNAIL/image/gif/97fe163672ce3b3af78fe470d78237bf/gr2.sml gr2 gr2.sml sml 9514 164 150 IMAGE-THUMBNAIL 1-s2.0-S2468823123000809-fx9.sml https://s3-eu-west-1.amazonaws.com/prod-ucs-content-store-eu-west/content/pii:S2468823123000809/fx9/THUMBNAIL/image/gif/7f2589abaa83899eac715dcbfdd9ae5e/fx9.sml fx9 fx9.sml sml 4425 163 197 IMAGE-THUMBNAIL 1-s2.0-S2468823123000809-gr3.sml https://s3-eu-west-1.amazonaws.com/prod-ucs-content-store-eu-west/content/pii:S2468823123000809/gr3/THUMBNAIL/image/gif/4d8b16b38214f927ae18bded4b5dd83d/gr3.sml gr3 gr3.sml sml 9746 163 107 IMAGE-THUMBNAIL 1-s2.0-S2468823123000809-fx7.sml https://s3-eu-west-1.amazonaws.com/prod-ucs-content-store-eu-west/content/pii:S2468823123000809/fx7/THUMBNAIL/image/gif/ff7d10ea9bb11ba848459ddb0063289e/fx7.sml fx7 fx7.sml sml 2677 52 219 IMAGE-THUMBNAIL 1-s2.0-S2468823123000809-gr1.sml https://s3-eu-west-1.amazonaws.com/prod-ucs-content-store-eu-west/content/pii:S2468823123000809/gr1/THUMBNAIL/image/gif/9896eb1fc1d40ee35b172f08a9452881/gr1.sml gr1 gr1.sml sml 9144 93 219 IMAGE-THUMBNAIL 1-s2.0-S2468823123000809-fx8.sml https://s3-eu-west-1.amazonaws.com/prod-ucs-content-store-eu-west/content/pii:S2468823123000809/fx8/THUMBNAIL/image/gif/5d1740d725f88c6b1f2e67c1ca5fb981/fx8.sml fx8 fx8.sml sml 2715 76 219 IMAGE-THUMBNAIL 1-s2.0-S2468823123000809-gr10.sml https://s3-eu-west-1.amazonaws.com/prod-ucs-content-store-eu-west/content/pii:S2468823123000809/gr10/THUMBNAIL/image/gif/c78cf5fa3b2fc44da14701c6d9906557/gr10.sml gr10 gr10.sml sml 7611 164 184 IMAGE-THUMBNAIL 1-s2.0-S2468823123000809-fx1.sml https://s3-eu-west-1.amazonaws.com/prod-ucs-content-store-eu-west/content/pii:S2468823123000809/fx1/THUMBNAIL/image/gif/0e9ec63ef49e3798378de4e771982a0c/fx1.sml fx1 fx1.sml sml 4705 164 194 IMAGE-THUMBNAIL 1-s2.0-S2468823123000809-fx2.sml https://s3-eu-west-1.amazonaws.com/prod-ucs-content-store-eu-west/content/pii:S2468823123000809/fx2/THUMBNAIL/image/gif/a034593e0bdcea10555285d3b2f84e0f/fx2.sml fx2 fx2.sml sml 1952 18 219 IMAGE-THUMBNAIL 1-s2.0-S2468823123000809-ga1.sml https://s3-eu-west-1.amazonaws.com/prod-ucs-content-store-eu-west/content/pii:S2468823123000809/ga1/THUMBNAIL/image/gif/07674458807a37b57fd8dd5559f72166/ga1.sml ga1 true ga1.sml sml 22039 125 219 IMAGE-THUMBNAIL 1-s2.0-S2468823123000809-fx19.sml https://s3-eu-west-1.amazonaws.com/prod-ucs-content-store-eu-west/content/pii:S2468823123000809/fx19/THUMBNAIL/image/gif/24e26ccbaedf7487f996693d081b1e6c/fx19.sml fx19 fx19.sml sml 3145 101 201 IMAGE-THUMBNAIL 1-s2.0-S2468823123000809-fx18.sml https://s3-eu-west-1.amazonaws.com/prod-ucs-content-store-eu-west/content/pii:S2468823123000809/fx18/THUMBNAIL/image/gif/3ec05164b7fcccd4e19fb549a4c88468/fx18.sml fx18 fx18.sml sml 5377 164 217 IMAGE-THUMBNAIL 1-s2.0-S2468823123000809-fx17.sml https://s3-eu-west-1.amazonaws.com/prod-ucs-content-store-eu-west/content/pii:S2468823123000809/fx17/THUMBNAIL/image/gif/66657a2b0c76b8ce0213e10e76c080dd/fx17.sml fx17 fx17.sml sml 4241 164 196 IMAGE-THUMBNAIL 1-s2.0-S2468823123000809-fx16.sml https://s3-eu-west-1.amazonaws.com/prod-ucs-content-store-eu-west/content/pii:S2468823123000809/fx16/THUMBNAIL/image/gif/489c12771936057cd95442537684818a/fx16.sml fx16 fx16.sml sml 3187 101 207 IMAGE-THUMBNAIL 1-s2.0-S2468823123000809-fx11.sml https://s3-eu-west-1.amazonaws.com/prod-ucs-content-store-eu-west/content/pii:S2468823123000809/fx11/THUMBNAIL/image/gif/40509275450037fcda9424f11488f4b9/fx11.sml fx11 fx11.sml sml 3742 148 219 IMAGE-THUMBNAIL 1-s2.0-S2468823123000809-fx10.sml https://s3-eu-west-1.amazonaws.com/prod-ucs-content-store-eu-west/content/pii:S2468823123000809/fx10/THUMBNAIL/image/gif/d6cff6ed09f2881587980db0daf61928/fx10.sml fx10 fx10.sml sml 2840 88 197 IMAGE-THUMBNAIL 1-s2.0-S2468823123000809-fx15.sml https://s3-eu-west-1.amazonaws.com/prod-ucs-content-store-eu-west/content/pii:S2468823123000809/fx15/THUMBNAIL/image/gif/f06d0e272f50ca8650c1497a5c280856/fx15.sml fx15 fx15.sml sml 4757 164 210 IMAGE-THUMBNAIL 1-s2.0-S2468823123000809-fx14.sml https://s3-eu-west-1.amazonaws.com/prod-ucs-content-store-eu-west/content/pii:S2468823123000809/fx14/THUMBNAIL/image/gif/144d88e704b6428d90c4927ce0381b24/fx14.sml fx14 fx14.sml sml 3191 121 219 IMAGE-THUMBNAIL 1-s2.0-S2468823123000809-fx13.sml https://s3-eu-west-1.amazonaws.com/prod-ucs-content-store-eu-west/content/pii:S2468823123000809/fx13/THUMBNAIL/image/gif/4c46bb826ab89078be88ddf9854b79ce/fx13.sml fx13 fx13.sml sml 2714 88 197 IMAGE-THUMBNAIL 1-s2.0-S2468823123000809-fx12.sml https://s3-eu-west-1.amazonaws.com/prod-ucs-content-store-eu-west/content/pii:S2468823123000809/fx12/THUMBNAIL/image/gif/eb4a2676bc96865a56f7e2ff3cb3418e/fx12.sml fx12 fx12.sml sml 3941 145 219 IMAGE-THUMBNAIL 1-s2.0-S2468823123000809-gr6.sml https://s3-eu-west-1.amazonaws.com/prod-ucs-content-store-eu-west/content/pii:S2468823123000809/gr6/THUMBNAIL/image/gif/95d59e1e4e8a4232ea9cf3c97ae573b8/gr6.sml gr6 gr6.sml sml 10598 164 191 IMAGE-THUMBNAIL 1-s2.0-S2468823123000809-gr7.sml https://s3-eu-west-1.amazonaws.com/prod-ucs-content-store-eu-west/content/pii:S2468823123000809/gr7/THUMBNAIL/image/gif/9e26dbb36b01eb5a7adb5183dff19844/gr7.sml gr7 gr7.sml sml 9579 163 191 IMAGE-THUMBNAIL 1-s2.0-S2468823123000809-gr4.sml https://s3-eu-west-1.amazonaws.com/prod-ucs-content-store-eu-west/content/pii:S2468823123000809/gr4/THUMBNAIL/image/gif/3149c38dd0cfe30f0e7c9f2260bf916a/gr4.sml gr4 gr4.sml sml 12353 164 175 IMAGE-THUMBNAIL 1-s2.0-S2468823123000809-gr5.sml https://s3-eu-west-1.amazonaws.com/prod-ucs-content-store-eu-west/content/pii:S2468823123000809/gr5/THUMBNAIL/image/gif/0caaa04321087096160a952d00cdafff/gr5.sml gr5 gr5.sml sml 7597 164 189 IMAGE-THUMBNAIL 1-s2.0-S2468823123000809-gr8.sml https://s3-eu-west-1.amazonaws.com/prod-ucs-content-store-eu-west/content/pii:S2468823123000809/gr8/THUMBNAIL/image/gif/8a92b9a9f973f0377ba682acccd94236/gr8.sml gr8 gr8.sml sml 8139 94 219 IMAGE-THUMBNAIL 1-s2.0-S2468823123000809-gr9.sml https://s3-eu-west-1.amazonaws.com/prod-ucs-content-store-eu-west/content/pii:S2468823123000809/gr9/THUMBNAIL/image/gif/d3212bd3a6693cfa122eaa97c4e5cd4c/gr9.sml gr9 gr9.sml sml 9505 164 174 IMAGE-THUMBNAIL 1-s2.0-S2468823123000809-fx5_lrg.jpg https://s3-eu-west-1.amazonaws.com/prod-ucs-content-store-eu-west/content/pii:S2468823123000809/HIGHRES/image/jpeg/fbd96588cdeed03a98dc431f6d8157a2/fx5_lrg.jpg fx5 fx5_lrg.jpg jpg 11744 218 517 IMAGE-HIGH-RES 1-s2.0-S2468823123000809-fx6_lrg.jpg https://s3-eu-west-1.amazonaws.com/prod-ucs-content-store-eu-west/content/pii:S2468823123000809/HIGHRES/image/jpeg/47a8c82d2476139aa98a78c92a84aca0/fx6_lrg.jpg fx6 fx6_lrg.jpg jpg 9858 227 392 IMAGE-HIGH-RES 1-s2.0-S2468823123000809-sc1_lrg.jpg https://s3-eu-west-1.amazonaws.com/prod-ucs-content-store-eu-west/content/pii:S2468823123000809/HIGHRES/image/jpeg/c7b4991bbb26adfbfdd07a2e1a0c1e6f/sc1_lrg.jpg sc1 sc1_lrg.jpg jpg 92840 747 1500 IMAGE-HIGH-RES 1-s2.0-S2468823123000809-fx3_lrg.jpg https://s3-eu-west-1.amazonaws.com/prod-ucs-content-store-eu-west/content/pii:S2468823123000809/HIGHRES/image/jpeg/14971d63b05249e22ecb0beb7488de3d/fx3_lrg.jpg fx3 fx3_lrg.jpg jpg 9169 221 392 IMAGE-HIGH-RES 1-s2.0-S2468823123000809-sc2_lrg.jpg https://s3-eu-west-1.amazonaws.com/prod-ucs-content-store-eu-west/content/pii:S2468823123000809/HIGHRES/image/jpeg/f5ab86bb97bc2760d72c598c90cc30b3/sc2_lrg.jpg sc2 sc2_lrg.jpg jpg 128462 1360 1500 IMAGE-HIGH-RES 1-s2.0-S2468823123000809-fx4_lrg.jpg https://s3-eu-west-1.amazonaws.com/prod-ucs-content-store-eu-west/content/pii:S2468823123000809/HIGHRES/image/jpeg/18a863bbf4546ec026bebc46aa330c3f/fx4_lrg.jpg fx4 fx4_lrg.jpg jpg 4171 77 210 IMAGE-HIGH-RES 1-s2.0-S2468823123000809-gr2_lrg.jpg https://s3-eu-west-1.amazonaws.com/prod-ucs-content-store-eu-west/content/pii:S2468823123000809/HIGHRES/image/jpeg/3903d1bfad12528e3ef8e6a8284035fe/gr2_lrg.jpg gr2 gr2_lrg.jpg jpg 335303 1642 1500 IMAGE-HIGH-RES 1-s2.0-S2468823123000809-fx9_lrg.jpg https://s3-eu-west-1.amazonaws.com/prod-ucs-content-store-eu-west/content/pii:S2468823123000809/HIGHRES/image/jpeg/0f2228c34d04dd443b0f426546f6dd9d/fx9_lrg.jpg fx9 fx9_lrg.jpg jpg 9121 229 276 IMAGE-HIGH-RES 1-s2.0-S2468823123000809-gr3_lrg.jpg https://s3-eu-west-1.amazonaws.com/prod-ucs-content-store-eu-west/content/pii:S2468823123000809/HIGHRES/image/jpeg/0e8ff18b74299ee6dfc7fa7767663d09/gr3_lrg.jpg gr3 gr3_lrg.jpg jpg 957516 4093 2684 IMAGE-HIGH-RES 1-s2.0-S2468823123000809-fx7_lrg.jpg https://s3-eu-west-1.amazonaws.com/prod-ucs-content-store-eu-west/content/pii:S2468823123000809/HIGHRES/image/jpeg/c6ec2f37383b7713d5a083b1015981c8/fx7_lrg.jpg fx7 fx7_lrg.jpg jpg 6916 92 391 IMAGE-HIGH-RES 1-s2.0-S2468823123000809-gr1_lrg.jpg https://s3-eu-west-1.amazonaws.com/prod-ucs-content-store-eu-west/content/pii:S2468823123000809/HIGHRES/image/jpeg/47fa97311e158803bd33725d93987627/gr1_lrg.jpg gr1 gr1_lrg.jpg jpg 336843 1235 2917 IMAGE-HIGH-RES 1-s2.0-S2468823123000809-fx8_lrg.jpg https://s3-eu-west-1.amazonaws.com/prod-ucs-content-store-eu-west/content/pii:S2468823123000809/HIGHRES/image/jpeg/b3ec4c7fa9d4d725734734792e9040cc/fx8_lrg.jpg fx8 fx8_lrg.jpg jpg 14422 227 656 IMAGE-HIGH-RES 1-s2.0-S2468823123000809-gr10_lrg.jpg https://s3-eu-west-1.amazonaws.com/prod-ucs-content-store-eu-west/content/pii:S2468823123000809/HIGHRES/image/jpeg/545dd1d9cd673fb8dd06e124e725d435/gr10_lrg.jpg gr10 gr10_lrg.jpg jpg 123016 1338 1500 IMAGE-HIGH-RES 1-s2.0-S2468823123000809-fx1_lrg.jpg https://s3-eu-west-1.amazonaws.com/prod-ucs-content-store-eu-west/content/pii:S2468823123000809/HIGHRES/image/jpeg/b7033007ba5a19bdbea564e2f7884657/fx1_lrg.jpg fx1 fx1_lrg.jpg jpg 16792 326 386 IMAGE-HIGH-RES 1-s2.0-S2468823123000809-fx2_lrg.jpg https://s3-eu-west-1.amazonaws.com/prod-ucs-content-store-eu-west/content/pii:S2468823123000809/HIGHRES/image/jpeg/faf6fb6bf3d0f5c509b1ae57ef59c574/fx2_lrg.jpg fx2 fx2_lrg.jpg jpg 68561 254 3111 IMAGE-HIGH-RES 1-s2.0-S2468823123000809-ga1_lrg.jpg https://s3-eu-west-1.amazonaws.com/prod-ucs-content-store-eu-west/content/pii:S2468823123000809/HIGHRES/image/jpeg/1be42099ee5badd0cdb03b6bded428a3/ga1_lrg.jpg ga1 true ga1_lrg.jpg jpg 263102 886 1556 IMAGE-HIGH-RES 1-s2.0-S2468823123000809-fx19_lrg.jpg https://s3-eu-west-1.amazonaws.com/prod-ucs-content-store-eu-west/content/pii:S2468823123000809/HIGHRES/image/jpeg/5d58329cdcda3c80c0e1e8eb7540effa/fx19_lrg.jpg fx19 fx19_lrg.jpg jpg 4053 101 201 IMAGE-HIGH-RES 1-s2.0-S2468823123000809-fx18_lrg.jpg https://s3-eu-west-1.amazonaws.com/prod-ucs-content-store-eu-west/content/pii:S2468823123000809/HIGHRES/image/jpeg/1efb07d509372adc4f797e275a363886/fx18_lrg.jpg fx18 fx18_lrg.jpg jpg 16749 294 389 IMAGE-HIGH-RES 1-s2.0-S2468823123000809-fx17_lrg.jpg https://s3-eu-west-1.amazonaws.com/prod-ucs-content-store-eu-west/content/pii:S2468823123000809/HIGHRES/image/jpeg/c1b1b827256b2072e8b1f5de85c75fe5/fx17_lrg.jpg fx17 fx17_lrg.jpg jpg 19257 369 441 IMAGE-HIGH-RES 1-s2.0-S2468823123000809-fx16_lrg.jpg https://s3-eu-west-1.amazonaws.com/prod-ucs-content-store-eu-west/content/pii:S2468823123000809/HIGHRES/image/jpeg/ca9a9c7018e53eb1fc243ddb3eae3ae8/fx16_lrg.jpg fx16 fx16_lrg.jpg jpg 4052 101 207 IMAGE-HIGH-RES 1-s2.0-S2468823123000809-fx11_lrg.jpg https://s3-eu-west-1.amazonaws.com/prod-ucs-content-store-eu-west/content/pii:S2468823123000809/HIGHRES/image/jpeg/b72d2f54666aea7be2efde48606edb2f/fx11_lrg.jpg fx11 fx11_lrg.jpg jpg 9428 242 358 IMAGE-HIGH-RES 1-s2.0-S2468823123000809-fx10_lrg.jpg https://s3-eu-west-1.amazonaws.com/prod-ucs-content-store-eu-west/content/pii:S2468823123000809/HIGHRES/image/jpeg/33cb89fdaee8505ec84dedb42130fa93/fx10_lrg.jpg fx10 fx10_lrg.jpg jpg 3688 88 197 IMAGE-HIGH-RES 1-s2.0-S2468823123000809-fx15_lrg.jpg https://s3-eu-west-1.amazonaws.com/prod-ucs-content-store-eu-west/content/pii:S2468823123000809/HIGHRES/image/jpeg/89d5671f1180fb29075acd2753fcec32/fx15_lrg.jpg fx15 fx15_lrg.jpg jpg 18287 330 422 IMAGE-HIGH-RES 1-s2.0-S2468823123000809-fx14_lrg.jpg https://s3-eu-west-1.amazonaws.com/prod-ucs-content-store-eu-west/content/pii:S2468823123000809/HIGHRES/image/jpeg/adb0540d7d32dc6527cf1915e9076d2e/fx14_lrg.jpg fx14 fx14_lrg.jpg jpg 9304 218 394 IMAGE-HIGH-RES 1-s2.0-S2468823123000809-fx13_lrg.jpg https://s3-eu-west-1.amazonaws.com/prod-ucs-content-store-eu-west/content/pii:S2468823123000809/HIGHRES/image/jpeg/b77090ab76d687d8e999f36dc1270ff9/fx13_lrg.jpg fx13 fx13_lrg.jpg jpg 3688 88 197 IMAGE-HIGH-RES 1-s2.0-S2468823123000809-fx12_lrg.jpg https://s3-eu-west-1.amazonaws.com/prod-ucs-content-store-eu-west/content/pii:S2468823123000809/HIGHRES/image/jpeg/df270560258f96383b07ee311cd47910/fx12_lrg.jpg fx12 fx12_lrg.jpg jpg 9067 218 329 IMAGE-HIGH-RES 1-s2.0-S2468823123000809-gr6_lrg.jpg https://s3-eu-west-1.amazonaws.com/prod-ucs-content-store-eu-west/content/pii:S2468823123000809/HIGHRES/image/jpeg/ca997dd23cccb993c8701b840d45b028/gr6_lrg.jpg gr6 gr6_lrg.jpg jpg 214753 1287 1500 IMAGE-HIGH-RES 1-s2.0-S2468823123000809-gr7_lrg.jpg https://s3-eu-west-1.amazonaws.com/prod-ucs-content-store-eu-west/content/pii:S2468823123000809/HIGHRES/image/jpeg/ba3521c1edda1b35a3350ca514f5c275/gr7_lrg.jpg gr7 gr7_lrg.jpg jpg 201966 1284 1500 IMAGE-HIGH-RES 1-s2.0-S2468823123000809-gr4_lrg.jpg https://s3-eu-west-1.amazonaws.com/prod-ucs-content-store-eu-west/content/pii:S2468823123000809/HIGHRES/image/jpeg/65854d6dab9b6974aa1207f17bb0a82a/gr4_lrg.jpg gr4 gr4_lrg.jpg jpg 418930 1405 1500 IMAGE-HIGH-RES 1-s2.0-S2468823123000809-gr5_lrg.jpg https://s3-eu-west-1.amazonaws.com/prod-ucs-content-store-eu-west/content/pii:S2468823123000809/HIGHRES/image/jpeg/3129f8ded402b3c08c07d8e4514cf725/gr5_lrg.jpg gr5 gr5_lrg.jpg jpg 154479 1303 1500 IMAGE-HIGH-RES 1-s2.0-S2468823123000809-gr8_lrg.jpg https://s3-eu-west-1.amazonaws.com/prod-ucs-content-store-eu-west/content/pii:S2468823123000809/HIGHRES/image/jpeg/f60b2284513f42494c6d55f1f11243a1/gr8_lrg.jpg gr8 gr8_lrg.jpg jpg 340885 1248 2917 IMAGE-HIGH-RES 1-s2.0-S2468823123000809-gr9_lrg.jpg https://s3-eu-west-1.amazonaws.com/prod-ucs-content-store-eu-west/content/pii:S2468823123000809/HIGHRES/image/jpeg/1113b80a75f8d4b91d4a1c5d0c5dd891/gr9_lrg.jpg gr9 gr9_lrg.jpg jpg 739050 2751 2917 IMAGE-HIGH-RES 1-s2.0-S2468823123000809-mmc1.docx https://s3-eu-west-1.amazonaws.com/prod-ucs-content-store-eu-west/content/pii:S2468823123000809/mmc1/MAIN/application/vnd.openxmlformats-officedocument.wordprocessingml.document/d72796392e2cfade67745c60f0ac0cc1/mmc1.docx mmc1 mmc1.docx docx 4052573 APPLICATION 1-s2.0-S2468823123000809-am.pdf https://s3-eu-west-1.amazonaws.com/prod-ucs-content-store-eu-west/content/egi:104SDGNRJHH/MAIN/application/pdf/f77caa1ed37539992df89e9d82209a15/am.pdf am am.pdf pdf false 448803 AAM-PDF MCAT 112993 112993 S2468-8231(23)00080-9 10.1016/j.mcat.2023.112993 Elsevier B.V. Fig. 1 Photocatalytic N-methylation of piperazine with methanol over (a) Pd/TiO2-P catalysts with different Pd loadings and (b) 1.0Pd/TiO2-P catalyst as a function of reaction time. Fig 1 Fig. 2 XRD patterns of Pd/TiO2 catalysts. Fig 2 Fig. 3 (a–c) HAADF-STEM images and (d–f) particle size distribution of 1.0Pd/TiO2. Fig 3 Fig. 4 XPS spectra of 1.0Pd/TiO2-P, 1.0Pd/TiO2-C, and 1.0Pd/TiO2-H. Fig 4 Fig. 5 Photocatalytic dehydrogenation of methanol over 1.0Pd/TiO2 catalysts. Fig 5 Fig. 6 Condensation of piperazine with formaldehyde over 1.0Pd/TiO2 catalysts. Fig 6 Fig. 7 Hydrogenation of enamine over 1.0Pd/TiO2 catalysts under H2. Fig 7 Fig. 8 (a) UV–vis spectra and (b) PL spectra of 1.0Pd/TiO2 catalysts. The inset in (a) presents the Tauc curves of 1.0Pd/TiO2 catalysts. Fig 8 Fig. 9 (a) In situ ESR spectra of 1.0Pd/TiO2-P in CH3OH and CH3OH/piperazine. The rate constants of (b) the dehydrogenation and (c) N-methylation over 1.0Pd/TiO2-P in CH3OH, CH3OD, and CD3OH. Fig 9 Fig. 10 Reuse experiment of the 1.0Pd/TiO2-P catalyst. Fig 10 Scheme 1 Two methodologies for the N-alkylation of piperazine with alcohols. Scheme 1 Scheme 2 Proposed mechanism for photo-driven N-methylation of piperazine with methanol over Pd/TiO2. Scheme 2 Table 1 N-methylation of piperazine on the various semiconductor photocatalysts. Table 1 Image, table 1 Entry Catalyst Conv. (%) Selec. (%) H2 (μmol) A B C D 1 Blank – – – – – – 2 1.0Pd/TiO2-P a – – – – – – 3 1.0Pd/C3N4-P 3.9 61.1 – 38.9 – 4.2 4 1.0Pd/CdS-P 3.4 14.6 – 85.4 – 7.9 5 1.0Pd/ZnO-P 2.5 50.2 – 49.8 – 3.3 6 TiO2 1.9 – – > 99.0 – 6.1 7 1.0Pd/TiO2-P 25.9 88.2 0.9 10.9 – 8.1 8 1.0Pt/TiO2-P 29.2 3.3 – 96.7 – 77.1 9 1.0Au/TiO2-P 11.7 4.7 – 95.3 – 31.4 10 1.0Ni/TiO2-P 3.8 – – > 99.0 – 9.8 11 1.0Cu/TiO2-P 5.8 – – > 99.0 – 16.2 12 1.0Pd/TiO2-C 20.1 89.1 0.8 10.1 – 6.3 13 1.0Pd/TiO2-H 24.7 71.3 0.7 28.0 – 20.5 Reaction conditions: methanol 5 mL, piperazine 0.25 mmol, catalyst 10 mg, temperature 25 °C, Ar, 2 h, λ > 300 nm. a Without irradiation. Table 2 Photocatalytic N-alkylation of different N-heterocyclic amines with alcohols over the 1.0Pd/TiO2-P catalyst. Table 2 Entry Amine Alcohol Conv. (%) Selec. (%) product 1 Image, table 2 Image, table 2 85.2 85.3 Image, table 2 2 Image, table 2 Image, table 2 67.5 78.8 Image, table 2 3 Image, table 2 Image, table 2 89.8 91.9 Image, table 2 4 Image, table 2 Image, table 2 86.7 90.7 Image, table 2 5 Image, table 2 Image, table 2 91.5 95.4 Image, table 2 6 Image, table 2 Image, table 2 84.6 93.4 Image, table 2 Reaction conditions: alcohol 5 mL, amine 0.25 mmol, 1.0Pd/TiO2-P 10 mg, temperature 25 °C, Ar, 10 h, λ > 300 nm. Mechanistic insight into the photocatalytic N-alkylation of piperazine with alcohols over TiO2 supported Pd catalysts Weikun Chen Investigation Formal analysis Writing – original draft Xiao Fu Investigation Formal analysis Xiaoying Liu Investigation Formal analysis Linmin Ye Investigation Formal analysis Youzhu Yuan Supervision Writing – review & editing ⁎ State Key Laboratory of Physical Chemistry of Solid Surfaces, National Engineering Laboratory for Green Chemical Productions of Alcohols–Ethers–Esters, College of Chemistry and Chemical Engineering, Xiamen University, Xiamen 361005, China State Key Laboratory of Physical Chemistry of Solid Surfaces, National Engineering Laboratory for Green Chemical Productions of Alcohols–Ethers–Esters, College of Chemistry and Chemical Engineering Xiamen University Xiamen 361005 China State Key Laboratory of Physical Chemistry of Solid Surfaces, National Engineering Laboratory for Green Chemical Productions of Alcohols–Ethers–Esters, College of Chemistry and Chemical Engineering, Xiamen University, Xiamen 361005, China ⁎ Corresponding author. N-alkylated piperazines can be synthesized by the thermal catalytic alkylation of piperazine with alkyl halides or alcohols in the presence of supported metal catalysts. However, these processes either discharge large amounts of waste or require harsh conditions. Here, we report the results of N-alkylation of piperazine with lower alcohols (methanol, ethanol, and propanol) without external hydrogen addition at room temperature in the presence of a TiO2-supported Pd catalyst (Pd/TiO2-P) prepared by photodeposition method. Compared with the catalysts prepared by the conventional chemical reduction or hydrogen reduction, the Pd/TiO2-P catalyst showed the highest conversion of piperazine and the best selectivity to N-alkypiperazines. The mechanistic studies indicated that this phenomenon occurs via tandem photocatalytic reactions involving alcohol dehydrgenation to aldehyde, aldehyde condensation with piperazine to enamine, and enamine hydrogenation to N-alkylated piperazines. Considering the experimental results of methanol isotope kinetics, the α-C–H cleavage of methanol to form hydroxymethyl radical (·CH2OH) was proven to be the rate-determining step in the N-alkylation reaction of piperazine with low carbon alcohols. The characterization and control experiments revealed that the size of Pd nanoparticles and the valence of Pd species were vital to the reaction. The Pd/TiO2-P catalyst with an average of 2.5 ± 0.5 nm Pd particles and approximately 68% Pd0 species on surfaces presented the highest activity for the photocatalytic tandem reactions of methanol dehydrogenation and enamine hydrogenation. Graphic abstract The photocatalytic N-alkylation of piperazine with alcohols has been studied in-depth over Pd/TiO2 catalyst fabricated via photodeposition. Image, graphical abstract Keywords Pd/TiO2 Photocatalysis Piperazine N-alkylation Reaction mechanism Data availability Data will be made available on request. 1 Introduction The development of more green and sustainable N-alkylation routes for functionalizing amines is essential due to the widespread applications of amines and its alkylated derivatives. In various strategies for catalytic N-alkylation reactions, carbonyl compounds and alkyl halides are the most widely used alkylating reagents [1,2]. However, in these cases, when alkyl halides are used, an equal molar amount of halide salts is produced as the reaction proceeds. When carbonyl compounds are used, H2 is required as the reducing agent. Compared with the traditional methods, the direct N-alkylation of amines with alcohols via borrowing hydrogen mechanism can provide an alternative approach without generating any toxic waste and without requiring an external H2 supply [3,4]. This allows the route in which alcohols are used as the alkylation agents to achieve high atomic efficiency in an environmentally friendly manner, with water as the sole by-product. A typical reaction for the N-alkylation of amines with alcohols via the borrowing hydrogen mechanism involves three consecutive steps: (i) the dehydrogenation of an alcohol to aldehyde and H atom bonding with metal (metal-H species); (ii) the dehydration condensation of amines with the formed aldehyde to produce imines; and (iii) the imine hydrogenated by metal-H species to yield the N-alkylated product [5,6]. In the terms of thermal catalysis, harsh reaction conditions (120 °C–200 °C) are usually necessary [7,8]. Moreover, excess amounts of inorganic bases are required to promote alcohol dehydrogenation, which will cause corrosion to the reaction vessel and produce salt waste [9]. Thus, developing more efficient and green catalytic routes for the N-alkylation of amines remains challenging. In recent years, the coupled photoredox reaction has been proven as a promising route for the synthesis of value-added N-alkylated organics [10]. Photocatalytic N-alkylation via borrowing hydrogen can be triggered under mild conditions and has therefore been extensively explored. For instance, homogeneous transition-metal catalysts, such as Ru [11] and Ir [12] have displayed good activity for light-driven N-alkylation of amines with alcohols, but the drawback in the separation of catalyst and product limits their practical application. Meanwhile, metal/semiconductor hybrids, such as Pd/TiO2 [13], Ag/TiO2 [14], and Pd/ZnIn2S4 [15] have also been applied successfully for photocatalytic N-alkylation reactions. In those cases, the N-alkylation involves alcohol photocatalytic dehydrogenation over a semiconductor in tandem with the metal-catalyzed hydrogenation. The studies mainly focused on the N-alkylation of aromatic and primary amines [13–15], and the imine hydrogenation was proposed as the rate-determining reaction [13]. However, investigations on the photocatalytic N-alkylation of N-heterocyclic compounds, such as piperazine, are rare; the relevant catalytic mechanism remains unknown [16]. Piperazine is an important N-heterocyclic compound, and its alkylated derivatives are a vital class of building block for synthesis of antibiotics and antibacterial agents [17,18]. N-alkylation reactions of piperazine with alcohols typically require temperatures exceeding 150 °C [19,20]. In this work, a photodeposition method was adopted to prepare Pd nanoparticles (NPs) onto commercially available TiO2 (Pd/TiO2-P). The resultant Pd/TiO2 catalysts are active in the photocatalytic borrowing hydrogen N-alkylation of piperazine at room temperature (Scheme 1 ). Compared with the chemical reduction by NaBH4 (Pd/TiO2-C) and the hydrogen reduction (Pd/TiO2-H), the photodeposition method endowed the as-prepared Pd/TiO2-P with Pd NPs containing high proportion of Pd0 species, which facilitated the photocatalytic dehydrogenation of alcohols and subsequent hydrogenation reaction. Each step of this tandem process was studied. The α-C–H bond cleavage of methanol was the rate-determining step in the overall N-alkylation of piperazine by isotopic experiments using deuterium-substituted methanol. This work provided an in-depth understanding of N-alkylation of N-heterocyclic compounds. 2 Experimental section 2.1 Preparation of the catalysts 2.1.1 Photodeposition method Different metals were loaded onto the support by photodeposition according to the procedure in literature [21]. Taking the preparation of 1.0Pd/TiO2-P as an example, 0.1 g of commercially available TiO2 (Degussa P25) was firstly dispersed in a 20% methanol aqueous solution, an appropriate amount of PdCl2 solution was added to the suspension after sonication. After the suspension was purged with Ar to eliminate the dissolved oxygen and stirred for 1 h, the solution was irradiated under a 500 W Xe lamp (λ > 300 nm) in Ar atmosphere for another 1 h. The precipitate was filtered for collection using deionized water until Cl– was no longer detected in the filtrate. Then, the precipitate was dried at 60 °C overnight under vacuum in an oven. The obtained solid was denoted as xPd/TiO2-P, with x representing the amount of Pd. CdS and C3N4 were synthesized by using the method found in published literature [22,23], and ZnO was purchased from Shanghai Aladdin Biochemical Technology Co., Ltd. 2.1.2 Chemical reduction method TiO2 (0.1 g) was dispersed in 50 mL water containing PdCl2. After stirring for 1 h, 10 mL of aqueous solution (0.5 M NaBH4) was added dropwise under vigorous stirring. The precipitate was filtered and dried by the same procedure after stirring for 1 h more. The obtained solid was denoted as 1.0Pd/TiO2-C. 2.1.3 Hydrogen reduction method TiO2 (0.5 g) was dispersed in 50 mL of acetone containing Pd(acac)2 by ultrasonication. After stirring for 1 h, the suspension was heated at 70 °C to remove the solvent. The precursor was calcinated at 300 °C for 2 h in air. This was followed by reduction at 300 °C for another 2 h in 5% H2/Ar atmosphere. The obtained solid was denoted as 1.0Pd/TiO2-H. 2.2 Material characterization X-ray diffraction analysis (XRD) was executed using an X-ray diffractometer (Rigaku Ultima IV) equipped with Cu–Kα radiation (40 kV and 30 mA) at 10°/min. The actual content of Pd in the catalyst was tested by inductively coupled plasma mass spectrometry (ICP-MS) on an Agilent ICP-MS 4500 instrument. N2 physisorption was carried out using Micromeritics TriStar II 3020, and the surface areas of the catalysts were determined by using the Brunauer–Emmett–Teller method. High-angle annular dark field imaging scanning transmission electron microscopy (HAADF-STEM) was used to observe Pd particles on an electron microscope (Phillips Analytical FEI TECNAI F20) with a 200 kV electron acceleration voltage. X-ray photoelectron spectroscopy (XPS) was conducted using a PHI QUANTUM 2000 Scanning ESCA Microprobe instrument equipped with an Al-Kα radiation source (hν = 1486.6 eV). Ultraviolet–visible (UV–vis) adsorption spectra were obtained on a Varian Cary 5000 spectrophotometer equipped with a diffuse reflectance accessory. The spectra were collected by using BaSO4 as the reference. Electron spin resonance (ESR) spectroscopy was measured to the analysis of radicals using a Bruker EMX-10/12 ESR spectrometer operating at the X-band frequency, and 5,5-dimethyl-1-pyrroline-N-oxide (DMPO) was used as the radical spin-trapping agent. For in situ ESR measurements, catalyst (10 mg) was dispersed in 5 mL of methanol by ultrasonic treatment. Then, 50 μL of DMPO was added to the suspension. The spectra were recorded after the suspension was illuminated for 5 min under a 500 W Xenon lamp. For low temperature (–173 °C) ESR characterization, 100 mg powder samples in a quartz tube was operated at the X-band frequency of 9.47 GHz and 100 kHz field modulation. Photoluminescence (PL) spectra were performed at ambient temperature over F4500 fluorescence spectrophotometer at an excitation wavelength of 315 nm. 2.3 Catalytic activity test 2.3.1 Photocatalytic N-alkylation reaction Photocatalytic N-alkylation reaction was conducted in a quartz tube reactor with an interlayer for circulating water. Typically, 10 mg of catalyst was ultrasonically dispersed in 5 mL methanol solution containing 0.25 mmol substrate. Then, the reactor was purged with Ar to eliminate the dissolved oxygen. The reaction temperature was controlled by circulating water and stirring for 30 min prior to irradiation to reach adsorption equilibrium. A 500 W Xenon lamp was the light source. After the reaction, the resulting solution was recovered and analyzed by using a gas chromatograph (Agilent 7890A) equipped with a DM-35 amine column and a flame ionization detector. The gaseous products were analyzed using a gas chromatograph (INFICON Micro GC Fusion) equipped with a molecular sieve 5A column and a high-sensitivity thermal conductivity detector. The liquid products of methanol photocatalytic dehydrogenation were analyzed using a high-performance liquid chromatograph (Shimazu LC-20A) equipped with a Shodex SUGAR SH-1011 column by using a 5 mmol/L H2SO4 solution as the mobile phase. For the recycling test, the spent catalyst was centrifuged and washed with methanol five times. Subsequently, the recovered catalyst was reused without drying by using the same procedure. 2.3.2 Condensation of piperazine with formaldehyde Formaldehyde (0.25 mmol) was added to 5 mL methanol containing 0.25 mmol piperazine and 10 mg catalyst under stirring. After the Ar purge, the reactor was sealed and stirred at 25 °C. 2.3.3 Hydrogenation of enamine Homemade enamine was used as an intermediate. This was prepared through the condensation of piperazine with formaldehyde. Pd/TiO2 catalysts (10 mg) were suspended in a 5 mL methanol solution containing 0.25 mmol enamine within an interlayer for circulating water. H2 was purged through the solution for 5 min after the catalyst was dispersed by ultrasonication. The H2 pressure was maintained at atmospheric pressure. The reaction temperature was controlled by circulating water with magnetic stirring at 25 °C. 2.3.4 Kinetic isotope effect experiment The 1.0 Pd/TiO2-P catalysts (10 mg) were suspended in a 5 mL CH3CN solution containing 3.75 mmol CH3OH within an interlayer of circulating water. Ar was purged through the solution for 5 min after the dispersal of the catalyst by ultrasonication. The reaction temperature was controlled by circulating water with magnetic stirring at 25 °C. The procedure of N-methylation was similar to the above except for the addition of 0.25 mmol piperazine. 3 Results and discussion 3.1 Evaluation of catalytic performance The N-methylation of piperazine in methanol solution by borrowing hydrogen process was investigated as a benchmark reaction at room temperature, and the results are listed in Table 1 . No product was detected without photocatalyst or photoirradiation (entries 1 and 2). Pd catalysts supported on different semiconductors were evaluated first. Among them, 1.0Pd/TiO2-P prepared by photodeposition showed the best N-methylation activity with 25.9% conversion of piperazine and a relatively high selectivity of 1-methylpiperazine (A) (88.2%) (entry 7). Except for the main product A, an unhydrogenated intermediate 1-methyl-1,2,3,4-tetrahydropyrazine (C, 10.9% selectivity) and trace amounts of 1,4-dimethylpiperazine (B, 0.9% selectivity) were present in the organic product. Moreover, hydrogen was formed during the reaction. In addition to TiO2, other supports were also examined for comparison (entries 3−5). The 1.0Pd/CdS-P exhibited low piperazine conversion and poor selectivity of A. The 1.0Pd/C3N4-P and 1.0Pd/ZnO-P were also ineffective, despite showing moderate selectivity of A (68.7% and 50.2%), respectively. Then, the effect of the metal species loaded on TiO2 was explored. Bare TiO2 without metal loading exhibited low conversion and no A was detected (entry 6). The photocatalytic activities of the catalysts increased after metal loading. Noble metal-modified catalysts exhibited higher piperazine conversion (entries 7–9). However, C was the main product of 1.0Pt/TiO2-P and 1.0Au/TiO2-P catalysts. This product may be related to H atoms and the C desorbed readily from the surface of Pt and Au NPs [24]. Thus, more H2 were detected at 1.0Pt/TiO2-P and 1.0Au/TiO2-P. When the non-precious metal Ni and Cu were loaded onto TiO2, the conversion of piperazine improved, but A was scarcely produced. It was remarkable that only Pd decorated on TiO2 catalyst showed the promising activity of N-methylation of piperazine, whereas other metals or semiconductors were inferior. Afterward, the catalytic performances of Pd/TiO2 catalysts prepared by different methods were compared. Although 1.0Pd/TiO2-C prepared by chemical reduction showed 89.1% selectivity to A, the conversion of piperazine was lower (20.1%) compared with that over 1.0Pd/TiO2-P (entry 12). The 1.0Pd/TiO2-H (entry 13) prepared by hydrogen reduction exhibited a similar conversion (24.7%), but its selectivity to N-alkylating product was 71.3%. These results implied that the combination of Pd entity and TiO2 support played a critical role in the N-methylation of piperazine. With this result, the effect of different Pd contents on the N-methylation of piperazine was further explored, and the results are shown in Fig. 1 a. The conversion of piperazine increased from 16.5% to 25.9% when Pd loading increased from 0.5 wt% to 1.0 wt%. When Pd loading was further increased to 5.0 wt%, piperazine conversion began to decrease. However, with increasing Pd loading, the selectivity of A increased from 63.1% to 97.3%, and a trace amount of B appeared when the Pd loading reached 1.0 wt%. In addition, the amount of hydrogen detected continued to decrease, indicating the enhanced hydrogenation capacity of the xPd/TiO2-P catalysts. Fig. 1 b shows the N-methylation of piperazine over the 1.0Pd/TiO2-P catalyst as a function of reaction time. With progressing reaction time, the piperazine conversion increased continuously. It reached 97.9% after 12 h. The amount of hydrogen accumulated continuously. The selectivity to A reached 88.2% at 2 h and then decreased slightly, because A could be further methylated with methanol to form B. However, when the piperazine conversion was 97.9% after 12 h, the selectivity to A was 81.1%. 3.2 Characterization of Pd/TiO2 catalysts Fig. 2 shows the XRD patterns of Pd/TiO2 catalysts prepared by different methods. Support TiO2 was composed of both anatase and rutile crystals. Little change was observed in the relative intensity and crystallite size of TiO2 after Pd loading. Clearly, the diffraction peak around 40.2° due to Pd(111) could not be detected when the Pd loading weight was lower than 5.0 wt%, which indicates that the average size of Pd NPs was less than 3.0 nm in these cases. As the Pd content increased to 5.0 wt%, the diffraction line attributed to Pd(111) appeared, indicating the growth of Pd NPs. In addition, elevated Pd content led to a slight decrease in the specific surface area of the Pd/TiO2 catalysts (Table S1). Other control catalysts were also explored by XRD analysis (Fig. S1). No obvious Pd(111) peak was observed in any of these control catalysts due to low metal loading. The morphology of the typical catalyst 1.0Pd/TiO2-P was studied by SEM and TEM. As shown in Fig. S2, the size of TiO2 particle was approximately 20 nm. The TEM and HAADF-STEM images of Pd/TiO2 catalysts revealed that the Pd species were successfully deposited onto the TiO2 (Figs. 3 , S2, and S3). The Pd species of 1.0Pd/TiO2-P and 1.0Pd/TiO2-H were highly dispersed as clusters or NPs with mean diameters of 2.5 and 2.1 nm, respectively (Fig. 3). The 1.0Pd/TiO2-C catalyst showed wide particle size distribution and larger particle size of Pd (3.7 nm). The Pd NPs of xPd/TiO2-P enlarged and aggregated with increasing Pd content (Fig. S3). The change in Pd NPs with elevated Pd content was consistent with the XRD results. The information of composition and valence of the Pd species on the TiO2 surface was investigated by XPS, and the results are shown in Figs. 4 and S4. The area ratio of Pd 3d5/2 and 3d3/2 peak was fixed at 3:2, and the full-width half-maximum (FWHM) was fixed at around 1.9. The XPS binding energy distance between Pd 3d5/2 and 3d3/2 was controlled at around 5.3. Detailed information of the binding energy of the Pd species is listed in Table S2 [25,26]. The proportion of Pd0 in total Pd species for 1.0Pd/TiO2-H (53.3%) was lower than those for 1.0Pd/TiO2-P (66.7%) and 1.0Pd/TiO2-C (68.4%). In addition, the percentage of Pd0 species increased from 43.6% to 66.7% as Pd content increased from 0.5 wt% to 1.0 wt%. Little change in proportion of Pd0 species was observed as Pd content further increased to 5.0 wt%. ESR was used to elucidate the difference in nature of the defect types of 1.0Pd/TiO2 prepared with different methods (Fig. S5). The resonance features observed are attributed to Ti3+ sites that are surface exposed (g = 1.927), to Ti3+ sites that are lattice embedded (g = 1.981) and oxygen vacancies (g = 2.003) [27,28]. The ESR signals of 1.0Pd/TiO2-P and 1.0Pd/TiO2-C were similar to that of TiO2, whereas that of 1.0Pd/TiO2-H was stronger than that of TiO2. The ESR result suggested that hydrogen treatment resulted in more defects. 3.3 Photocatalysis of piperazine N-methylation The photocatalytic N-methylation of piperazine with methanol over Pd/TiO2 proceeded through a tandem mode. Thus, the effect of Pd loading in the respective reaction steps for N-methylation of piperazine was explored to clarify the reasons for the differences in activity among various Pd/TiO2 catalysts. Photocatalytic oxidative dehydrogenation of methanol by respective catalysts was first studied in the absence of piperazine in methanol. As shown in Fig. 5 , no products were formed in the absence of a photocatalyst. A significant increase was found in photocatalytic activity after Pd loading comparing with bare TiO2. The enhancement of photocatalytic activity was attributed to the Schottky barrier formed by metal/semiconductor heterojunction to enhance the charge separation between photogenerated h+ and e– [29]. A small amount of ethylene glycol was formed during methanol dehydrogenation; this was derived from the photocatalytic coupling of formaldehyde and methanol [30]. When metal NPs are used as a cocatalyst, the smaller particle size and metallic state showed better promotion effect on the photocatalytic activity [31,32]. The 1.0Pd/TiO2-H catalyst had lower Pd0 content than 1.0Pd/TiO2-P and 1.0Pd/TiO2-C, but it had better photocatalytic activity than 1.0Pd/TiO2-C (Fig. 5). This phenomenon might be due to the smaller size of Pd NPs and the higher number of defects induced by hydrogen reduction, which was also beneficial for enhancing photocatalytic activity [33]. The 1.0Pd/TiO2-C prepared by NaBH4 had a similar Pd0 content to that of 1.0Pd/TiO2-P, but the Pd NPs were larger and showed less photocatalytic activity. For xPd/TiO2-P catalysts, the photocatalytic activity decreased when Pd loading exceeded 1.0 wt% (Fig. S6). This was attributed to the fact that excessive Pd species deposited on the surface of TiO2 became the recombination centers of the photogenerated h+ and e– [34]. Results of methanol photocatalytic dehydrogenation showed that the trend in the conversion of piperazine from different catalysts was in accordance with their photocatalytic activity. The condensation of piperazine with aldehyde was the next step in N-methylation. Figs. 6 and S7 show the rapid condensation of piperazine with formaldehyde to produce C in 0.2 h even in the absence of the catalyst. The consumption rate of piperazine (>1143.8 μmol h–1) was much higher than the formation rate of formaldehyde produced by photocatalytic dehydrogenation of methanol (35.3 μmol h–1) over 1.0Pd/TiO2-P, indicating that the condensation that occurred to produce C was not the rate-determining step for the N-methylation of piperazine. In addition, we compared the condensation of piperazine with formaldehyde in the coexistence of N-methylpiperazine A (Table S3). The conversion of piperazine (79.8%) was higher than that of A (18.8%), indicating that piperazine was more readily condensed with formaldehyde to form C and subsequently hydrogenated to A. Obviously, piperazine was easily condensed with HCHO, which could be ascribed to the formation of hydrogen bond between the N-H of piperazine and the C=O of HCHO (N-H···O=C). The H atom of N-H acted as a hydrogen bond donor and the O atom of C=O acted as a hydrogen bond acceptor, which helped activate the carbonyl group during the nucleophilic attack of the other N atom of piperazine to the carbonyl group of HCHO (Scheme S1) [35,36]. This phenomenon explained why A was the main product during the N-methylation of piperazine. Hydrogenation of enamine C as the final step in N-methylation was explored with molecular hydrogen. As shown in Fig. 7 , the hydrogenation reaction did not occur without Pd in the reaction system. The 1.0Pd/TiO2-P and 1.0Pd/TiO2-C with a higher proportion of Pd0 species facilitated the hydrogenation process from C to A to achieve better selectivity of A compared with that of 1.0Pd/TiO2-H [37,38]. With increasing Pd content, more C was hydrogenated to A. So, the selectivity to A continued to increase in the N-methylation of piperazine (Fig. S8). The selectivity of A in the N-methylation of piperazine was closely related to the hydrogenation activity of C over Pd/TiO2 catalysts. After the disassembly analysis of the three steps of N-methylation of piperazine, 1.0Pd/TiO2-P prepared via photodeposition showed the best activity due to its better simultaneous performance of photocatalytic methanol dehydrogenation and intermediate hydrogenation. Moreover, the consumption rate of C for 1.0Pd/TiO2-P (468.0 μmol h–1) was much higher than the formation rate of formaldehyde (35.3 μmol h–1), suggesting that the photocatalytic dehydrogenation of methanol was the slowest step in the N-methylation of piperazine. To obtain more insight into the structure-activity relationship, UV–vis and PL spectra were carried out over 1.0Pd/TiO2 catalysts and bare TiO2 support, respectively, as shown in Fig. 8 . Bare TiO2 only showed absorption at a wavelength below 390 nm and the 1.0Pd/TiO2 catalysts presented an enhanced absorption of visible light (Fig. 8 a) [39]. The band gaps of TiO2 and 1.0Pd/TiO2 catalysts were estimated from the Tauc curves and varied in the range of 3.27–3.31 eV, indicating that the loading of Pd did not change the band gap of TiO2. The transfer and separation of photogenerated charge carriers were identified by PL spectra (Fig. 8 b). The presence of Pd species remarkably reduced PL intensity compared with TiO2, indicating that the recombination of h+–e– pairs was effectively suppressed over 1.0Pd/TiO2 catalysts [40]. Moreover, 1.0Pd/TiO2-P exhibited lower PL intensity among 1.0Pd/TiO2 catalysts, corresponding to higher electron transfer rate and separation efficiency of photogenerated h+–e– pairs. This phenomenon accounted for its better photocatalytic activity. The in situ ESR was used to detect the radicals generated during the reaction. The radical signal attributed to hydroxymethyl radical (·CH2OH) was detected for both methanol and methanol/piperazine mixtures under radiation (Fig. 9 a) [41]. The result indicated the activation of α-C–H bond during the dehydrogenation of CH3OH by holes. The hydroxymethyl radical should be an intermediate for the formation of formaldehyde. Studies on the different steps of N-methylation suggested that the overall N-methylation process was limited by the dehydrogenation step of methanol. To gain more insight into this step, kinetic isotope effect (KIE) was explored using isotopic substitution reagents (CH3OD and CD3OH). In general, the hydrogen atom (H) replacement by its isotope deuterium (D) is known as the hydrogen isotope effect. The hydrogen isotope effect can be classified into primary hydrogen kinetic isotope effect (PHKIE) and secondary hydrogen kinetic isotope effect (SHKIE) [42,43]. In PHKIE, the isotopically substituted hydrogen is broken, whereas in SHKIE, the isotopic substitution is remote from the breaking of the bond. In Fig. 9 b, the KIE for CH3OH/CH3OD in methanol dehydrogenation was 0.71, which belonged to SHKIE, suggesting that the cleavage of O–H bond was not the rate-determining step. The KIE for CH3OH/CD3OH in methanol was 2.29, which belonged to PHKIE. In addition, this value was close to that of the KIE for N-methylation (0.75 for CH3OH/CH3OD and 2.39 for CH3OH/CD3OH in Fig. 9 c), indicating that the α-C–H bond cleavage of methanol was the rate-determining step for the overall N-methylation reaction over 1.0Pd/TiO2-P [44]. 3.4 Recycling test and substrate scope To investigate the catalyst stability, a reusability experiment of 1.0Pd/TiO2-P catalyst for N-methylation of piperazine to A was evaluated. The results are plotted in Fig. 10 . After four cycles, the conversion of piperazine decreased slightly from 25.9% to 23.7% with minimal change in the selectivity of A. As shown in Figs. S9 and S10, the sizes of Pd NPs in used 1.0Pd/TiO2-P increased slightly from 2.5 nm to 2.8 nm, and the proportion of Pd0 species decreased from 68.5% to 63.4%. The structure of 1.0Pd/TiO2-P during the photocatalytic reactions can be stable. In addition, the substrate scope of reactions was examined for the N-alkylation of N-heterocyclic compounds with different alcohols (Table 2 ). When ethanol was used, the N-alkylation activity was similar to that of methanol. When the longer-chained propanol was used, the conversion of piperazine decreased to 67.5%. The N-alkylation of different N-heterocyclic compounds and methanol was implemented with high selectivity for the N-alkylated products. The 1.0Pd/TiO2-P can be effectively used for the synthesis of N-alkylated products from N-heterocyclic compounds. Table S4 compares the N-alkylation results of piperazine with alcohols on catalyst 1.0Pd/TiO2-P, and those of different amines with alcohols on various catalysts. Clearly, the N-alkylation of amines with alcohols using thermal catalysis requires high temperature and alkaline additives (entries 1–4) [45–48]. By contrast, our results indicate that N-alkylation of piperazine with lower alcohols (methanol, ethanol, and propanol) by photocatalysis can afford the desired products with good yield under mild conditions without using additives and the results are comparable with the photocatalytic N-alkylation of other amines with alcohols (entries 5–10) [13,49,50]. 3.5 Proposed reaction mechanism Based on above observations, we proposed the photo-driven N-methylation of piperazine with methanol over Pd/TiO2 as shown in Scheme 2 . Methanol was first oxidized to hydroxymethyl radical (·CH2OH) and H+ by photogenerated holes (①) and then further dehydrogenated to HCHO (②), formed H+ transferred to bond with Pd nanoparticles that capture photogenerated electrons to form Pd-H species. Enamine was formed through the rapid condensation between piperazine and in situ generated HCHO (③). Enamine was further hydrogenated to N-alkyl piperazine with Pd-H species (④). 4 Conclusions We demonstrated the light-driven N-alkylation of piperazine to construct C–N bond over Pd-modified semiconductor nanophotocatalyst Pd/TiO2-P by photodeposition. The optimized 1.0Pd/TiO2-P catalyst with 2.5 ± 0.5 nm average Pd NPs containing high proportion of metallic Pd0 species exhibited better activity compared with catalysts obtained by chemical reduction using NaBH4 (1.0Pd/TiO2-C) or reduction by H2 (1.0Pd/TiO2-H). The reaction followed a tandem process, and the photocatalytic dehydrogenation of methanol was the slowest step. This finding was obtained by comparing the rates of different reaction steps in the tandem N-alkylation reaction. For the N-methylation of piperazine, the α-C–H cleavage of methanol to form hydroxymethyl radical (·CH2OH) was the rate-determining step in the overall N-methylation reaction over ESR and isotopic experiments. This study provided an efficient way to realize a highly efficient N-alkylation of N-heterocyclic compounds by successful coupling of semiconductor-based photocatalyst with Pd NPs for hydrogenation. This study also highlighted the rational configuration of multifunctional photocatalysts for light induce value-added organic synthesis. CRediT authorship contribution statement Weikun Chen: Investigation, Formal analysis, Writing – original draft. Xiao Fu: Investigation, Formal analysis. Xiaoying Liu: Investigation, Formal analysis. Linmin Ye: Investigation, Formal analysis. Youzhu Yuan: Supervision, Writing – review & editing. Declaration of Competing Interest The authors declare that they have no known competing financial interests or personal relationships that could have appeared to influence the work reported in this paper. Acknowledgement The authors thank for the financial support from the National Natural Science Foundation of China (21972113 and 22272135). Supplementary materials Supplementary material associated with this article can be found, in the online version, at doi:10.1016/j.mcat.2023.112993. Appendix Supplementary materials Image, application 1 References [1] X. Wang K. Zhao H. Wang F. Shi Selective synthesis of N-monomethyl amines with primary amines and nitro compounds Catal. Sci. Technol. 11 2021 7239 7254 X. Wang, K. Zhao, H. Wang, F. Shi, Selective synthesis of N-monomethyl amines with primary amines and nitro compounds, Catal. Sci. Technol. 11 (2021) 7239–7254. [2] N.W. Dow A. Cabré D.W.C. MacMillan A general N-alkylation platform via copper metallaphotoredox and silyl radical activation of alkyl halides Chem 7 2021 1827 1842 N.W. Dow, A. Cabré, D.W.C. MacMillan, A general N-alkylation platform via copper metallaphotoredox and silyl radical activation of alkyl halides, Chem 7 (2021) 1827–1842. [3] M. Jafarzadeh S.H. Sobhani K. Gajewski E. Kianmehr Recent advances in C/N-alkylation with alcohols through hydride transfer strategies Org. Biomol. Chem. 20 2022 7713 7745 M. Jafarzadeh, S.H. Sobhani, K. Gajewski, E. Kianmehr, Recent advances in C/N-alkylation with alcohols through hydride transfer strategies, Org. Biomol. Chem. 20 (2022) 7713–7745. [4] T. Irrgang R. Kempe 3d-Metal catalyzed N-and C-alkylation reactions via borrowing hydrogen or hydrogen autotransfer Chem. Rev. 119 2018 2524 2549 T. Irrgang, R. Kempe, 3d-Metal catalyzed N-and C-alkylation reactions via borrowing hydrogen or hydrogen autotransfer, Chem. Rev. 119 (2018) 2524–2549. [5] X. Jiang W. Tang D. Xue J. Xiao C. Wang Divergent dehydrogenative coupling of indolines with alcohols ACS Catal. 7 2017 1831 1835 X. Jiang, W. Tang, D. Xue, J. Xiao, C. Wang, Divergent dehydrogenative coupling of indolines with alcohols, ACS Catal.. 7 (2017) 1831–1835. [6] M.A.R. Jamil A.S. Touchy M.N. Rashed K.W. Ting S.M.A.H. Siddiki T. Toyao Z. Maeno K.-i. Shimizu N-methylation of amines and nitroarenes with methanol using heterogeneous platinum catalysts J. Catal. 371 2019 47 56 M.A.R. Jamil, A.S. Touchy, M.N. Rashed, K.W. Ting, S.M.A.H. Siddiki, T. Toyao, Z. Maeno, K.-i. Shimizu, N-methylation of amines and nitroarenes with methanol using heterogeneous platinum catalysts, J. Catal. 371 (2019) 47–56. [7] F. Shi M.K. Tse X. Cui D. Gördes D. Michalik K. Thurow Y. Deng M. Beller Copper-catalyzed alkylation of sulfonamides with alcohols Angew. Chem. Int. Ed. 48 2009 5912 5915 F. Shi, M.K. Tse, X. Cui, D. Gördes, D. Michalik, K. Thurow, Y. Deng, M. Beller, Copper-catalyzed alkylation of sulfonamides with alcohols, Angew. Chem. Int. Ed. 48 (2009) 5912–5915. [8] J. Sun X. Jin F. Zhang W. Hu J. Liu R. Li Ni–Cu/γ-Al2O3 catalyzed N-alkylation of amines with alcohols Catal. Commun. 24 2012 30 33 J. Sun, X. Jin, F. Zhang, W. Hu, J. Liu, R. Li, Ni–Cu/γ-Al2O3 catalyzed N-alkylation of amines with alcohols, Catal. Commun. 24 (2012) 30–33. [9] S.H. Siddiki A.S. Touchy M.A. Jamil T. Toyao K.-i. Shimizu C-methylation of alcohols, ketones, and indoles with methanol using heterogeneous platinum catalysts ACS Catal. 8 2018 3091 3103 S.H. Siddiki, A.S. Touchy, M.A. Jamil, T. Toyao, K.-i. Shimizu, C-methylation of alcohols, ketones, and indoles with methanol using heterogeneous platinum catalysts, ACS Catal.. 8 (2018) 3091–3103. [10] W. Shang Y. Li H. Huang F. Lai M.B.J. Roeffaers B. Weng Synergistic redox reaction for value-added organic transformation via dual-functional photocatalytic systems ACS Catal. 11 2021 4613 4632 W. Shang, Y. Li, H. Huang, F. Lai, M.B.J. Roeffaers, B. Weng, Synergistic redox reaction for value-added organic transformation via dual-functional photocatalytic systems, ACS Catal.. 11 (2021) 4613–4632. [11] X. Guo O.S. Wenger Reductive amination by photoredox catalysis and polarity-matched hydrogen atom transfer Angew. Chem. Int. Ed. 57 2018 2469 2473 X. Guo, O.S. Wenger, Reductive amination by photoredox catalysis and polarity-matched hydrogen atom transfer, Angew. Chem. Int. Ed. 57 (2018) 2469–2473. [12] R. Alam G.A. Molander Photoredox-catalyzed direct reductive amination of aldehydes without an external hydrogen/hydride source Org. Lett. 20 2018 2680 2684 R. Alam, G.A. Molander, Photoredox-catalyzed direct reductive amination of aldehydes without an external hydrogen/hydride source, Org. Lett. 20 (2018) 2680–2684. [13] Y. Shiraishi K. Fujiwara Y. Sugano S. Ichikawa T. Hirai N-monoalkylation of amines with alcohols by tandem photocatalytic and catalytic reactions on TiO2 loaded with Pd nanoparticles ACS Catal. 3 2013 312 320 Y. Shiraishi, K. Fujiwara, Y. Sugano, S. Ichikawa, T. Hirai, N-monoalkylation of amines with alcohols by tandem photocatalytic and catalytic reactions on TiO2 loaded with Pd nanoparticles, ACS Catal.. 3 (2013) 312–320. [14] V.N. Tsarev Y. Morioka J. Caner Q. Wang R. Ushimaru A. Kudo H. Naka S. Saito N-methylation of amines with methanol at room temperature Org. Lett. 17 2015 2530 2533 V.N. Tsarev, Y. Morioka, J. Caner, Q. Wang, R. Ushimaru, A. Kudo, H. Naka, S. Saito, N-methylation of amines with methanol at room temperature, Org. Lett. 17 (2015) 2530–2533. [15] B. Wang Z. Deng X. Fu C. Xu Z. Li Photodeposition of Pd nanoparticles on ZnIn2S4 for efficient alkylation of amines and ketones’ α-H with alcohols under visible light Appl. Catal. B 237 2018 970 975 B. Wang, Z. Deng, X. Fu, C. Xu, Z. Li, Photodeposition of Pd nanoparticles on ZnIn2S4 for efficient alkylation of amines and ketones’ α-H with alcohols under visible light, Appl. Catal. B 237 (2018) 970–975. [16] L.-.M. Wang K. Jenkinson A.E.H. Wheatley K. Kuwata S. Saito H. Naka Photocatalytic N-methylation of amines over Pd/TiO2 for the functionalization of heterocycles and pharmaceutical intermediates ACS Sustain. Chem. Eng. 6 2018 15419 15424 L.-.M. Wang, K. Jenkinson, A.E.H. Wheatley, K. Kuwata, S. Saito, H. Naka, Photocatalytic N-methylation of amines over Pd/TiO2 for the functionalization of heterocycles and pharmaceutical intermediates, ACS Sustain. Chem. Eng. 6 (2018) 15419–15424. [17] P. Chaudhary R. Kumar A.K. Verma D. Singh V. Yadav A.K. Chhillar G. Sharma R. Chandra Synthesis and antimicrobial activity of N-alkyl and N-aryl piperazine derivatives Bioorgan. Med. Chem. 14 2006 1819 1826 P. Chaudhary, R. Kumar, A.K. Verma, D. Singh, V. Yadav, A.K. Chhillar, G. Sharma, R. Chandra, Synthesis and antimicrobial activity of N-alkyl and N-aryl piperazine derivatives, Bioorgan. Med. Chem. 14 (2006) 1819–1826. [18] M. Arbo M. Bastos H. Carmo Piperazine compounds as drugs of abuse Drug Alcohol Depend. 122 2012 174 185 M. Arbo, M. Bastos, H. Carmo, Piperazine compounds as drugs of abuse, Drug Alcohol Depend.. 122 (2012) 174–185. [19] J. Neumann S. Elangovan A. Spannenberg K. Junge M. Beller Improved and general manganese-catalyzed N-methylation of aromatic amines using methanol Chem. Eur. J. 23 2017 5410 5413 J. Neumann, S. Elangovan, A. Spannenberg, K. Junge, M. Beller, Improved and general manganese-catalyzed N-methylation of aromatic amines using methanol, Chem. Eur. J. 23 (2017) 5410–5413. [20] K.N. Tayade M. Mishra K. M R.S. Somani Solvent free acid catalysed direct N-alkylation of amines with alcohols using Al grafted MCM-41 J. Mol. Catal. A 390 2014 91 96 K.N. Tayade, M. Mishra, M K., R.S. Somani, Solvent free acid catalysed direct N-alkylation of amines with alcohols using Al grafted MCM-41, J. Mol. Catal. A 390 (2014) 91–96. [21] C. Tian H. Fang H. Chen W. Chen S. Zhou X. Duan X. Liu Y. Yuan Photodeposition of Pd onto TiO2 nanowires for aqueous-phase selective hydrogenation of phenolics to cyclohexanones Nanoscale 12 2020 2603 2612 C. Tian, H. Fang, H. Chen, W. Chen, S. Zhou, X. Duan, X. Liu, Y. Yuan, Photodeposition of Pd onto TiO2 nanowires for aqueous-phase selective hydrogenation of phenolics to cyclohexanones, Nanoscale 12 (2020) 2603–2612. [22] X. Lu W. Chen Y. Yao X. Wen J.N. Hart C. Tsounis C. Ying Toe J. Scott Y.H. Ng Photogenerated charge dynamics of CdS nanorods with spatially distributed MoS2 for photocatalytic hydrogen generation Chem. Eng. J. 420 2021 127709 X. Lu, W. Chen, Y. Yao, X. Wen, J.N. Hart, C. Tsounis, C. Ying Toe, J. Scott, Y.H. Ng, Photogenerated charge dynamics of CdS nanorods with spatially distributed MoS2 for photocatalytic hydrogen generation, Chem. Eng. J. 420 (2021) 127709. [23] J. Liu T. Zhang Z. Wang G. Dawson W. Chen Simple pyrolysis of urea into graphitic carbon nitride with recyclable adsorption and photocatalytic activity J. Mater. Chem. A 21 2011 14398 14401 J. Liu, T. Zhang, Z. Wang, G. Dawson, W. Chen, Simple pyrolysis of urea into graphitic carbon nitride with recyclable adsorption and photocatalytic activity, J. Mater. Chem. A 21 (2011) 14398–14401. [24] J. Yu Q. Liu W. Qiao D. Lv Y. Li C. Liu Y. Yu Y. Li H. Niemantsverdriet B. Zhang Catalytic role of metal nanoparticles in selectivity control over photodehydrogenative coupling of primary amines to imines and secondary amines ACS Catal. 11 2021 6656 6661 J. Yu, Q. Liu, W. Qiao, D. Lv, Y. Li, C. Liu, Y. Yu, Y. Li, H. Niemantsverdriet, B. Zhang, Catalytic role of metal nanoparticles in selectivity control over photodehydrogenative coupling of primary amines to imines and secondary amines, ACS Catal.. 11 (2021) 6656–6661. [25] M. Du G. Zeng C. Ye H. Jin J. Huang D. Sun Q. Li B. Chen X. Li Solvent-free photo-thermocatalytic oxidation of benzyl alcohol on Pd/TiO2 (B) nanowires Mol. Catal. 483 2020 110771 M. Du, G. Zeng, C. Ye, H. Jin, J. Huang, D. Sun, Q. Li, B. Chen, X. Li, Solvent-free photo-thermocatalytic oxidation of benzyl alcohol on Pd/TiO2 (B) nanowires, Mol. Catal. 483 (2020) 110771. [26] C. Tang Z. Feng X. Bai In situ preparation of Pd nanoparticles on N-doped graphitized carbon derived from ZIF-67 by nitrogen glow-discharge plasma for the catalytic dehydrogenation of dodecahydro-N-ethylcarbazole Fuel 302 2021 121186 C. Tang, Z. Feng, X. Bai, In situ preparation of Pd nanoparticles on N-doped graphitized carbon derived from ZIF-67 by nitrogen glow-discharge plasma for the catalytic dehydrogenation of dodecahydro-N-ethylcarbazole, Fuel 302 (2021) 121186. [27] S. Mohajernia P. Andryskova G. Zoppellaro S. Hejazi S. Kment R. Zboril J. Schmidt P. Schmuki Influence of Ti3+ defect-type on heterogeneous photocatalytic H2 evolution activity of TiO2 J. Mater. Chem. A 8 2020 1432 1442 S. Mohajernia, P. Andryskova, G. Zoppellaro, S. Hejazi, S. Kment, R. Zboril, J. Schmidt, P. Schmuki, Influence of Ti3+ defect-type on heterogeneous photocatalytic H2 evolution activity of TiO2, J. Mater. Chem. A 8 (2020) 1432–1442. [28] Z. Xiu M. Guo T. Zhao K. Pan Z. Xing Z. Li W. Zhou Recent advances in Ti3+ self-doped nanostructured TiO2 visible light photocatalysts for environmental and energy applications Chem. Eng. J. 382 2020 123011 Z. Xiu, M. Guo, T. Zhao, K. Pan, Z. Xing, Z. Li, W. Zhou, Recent advances in Ti3+ self-doped nanostructured TiO2 visible light photocatalysts for environmental and energy applications, Chem. Eng. J. 382 (2020) 123011. [29] M.R. Khan T.W. Chuan A. Yousuf M. Chowdhury C.K. Cheng Schottky barrier and surface plasmonic resonance phenomena towards the photocatalytic reaction: study of their mechanisms to enhance photocatalytic activity Catal. Sci. Technol. 5 2015 2522 2531 M.R. Khan, T.W. Chuan, A. Yousuf, M. Chowdhury, C.K. Cheng, Schottky barrier and surface plasmonic resonance phenomena towards the photocatalytic reaction: study of their mechanisms to enhance photocatalytic activity, Catal. Sci. Technol. 5 (2015) 2522–2531. [30] Y. Fan J. Bao L. Shi S. Li Y. Lu H. Liu H. Wang L. Zhong Y. Sun Photocatalytic coupling of methanol and formaldehyde into ethylene glycol with high atomic efficiency Catal. Lett. 148 2018 2274 2282 Y. Fan, J. Bao, L. Shi, S. Li, Y. Lu, H. Liu, H. Wang, L. Zhong, Y. Sun, Photocatalytic coupling of methanol and formaldehyde into ethylene glycol with high atomic efficiency, Catal. Lett. 148 (2018) 2274–2282. [31] Y. Zhu T. Wang T. Xu Y. Li C. Wang Size effect of Pt co-catalyst on photocatalytic efficiency of g-C3N4 for hydrogen evolution Appl. Surf. Sci. 464 2019 36 42 Y. Zhu, T. Wang, T. Xu, Y. Li, C. Wang, Size effect of Pt co-catalyst on photocatalytic efficiency of g-C3N4 for hydrogen evolution, Appl. Surf. Sci. 464 (2019) 36–42. [32] D. Wang Z.-.P. Liu W.-.M. Yang Revealing the size effect of platinum cocatalyst for photocatalytic hydrogen evolution on TiO2 support: a DFT study ACS Catal. 8 2018 7270 7278 D. Wang, Z.-.P. Liu, W.-.M. Yang, Revealing the size effect of platinum cocatalyst for photocatalytic hydrogen evolution on TiO2 support: a DFT study, ACS Catal.. 8 (2018) 7270–7278. [33] L. Hao H. Huang Y. Zhang T. Ma Oxygen vacant semiconductor photocatalysts Adv. Funct. Mater. 31 2021 2100919 L. Hao, H. Huang, Y. Zhang, T. Ma, Oxygen vacant semiconductor photocatalysts, Adv. Funct. Mater. 31 (2021) 2100919. [34] G.R. Bamwenda S. Tsubota T. Nakamura M. Haruta Photoassisted hydrogen production from a water-ethanol solution: a comparison of activities of Au-TiO2 and Pt-TiO2 J. Photochem. Photobiol. A 89 1995 177 189 G.R. Bamwenda, S. Tsubota, T. Nakamura, M. Haruta, Photoassisted hydrogen production from a water-ethanol solution: a comparison of activities of Au-TiO2 and Pt-TiO2, J. Photochem. Photobiol. A 89 (1995) 177–189. [35] M.S. Taylor E.N. Jacobsen Asymmetric catalysis by chiral hydrogen-bond donors Angew. Chem. Int. Ed. 45 2006 1520 1543 M.S. Taylor, E.N. Jacobsen, Asymmetric catalysis by chiral hydrogen-bond donors, Angew. Chem. Int. Ed. 45 (2006) 1520–1543. [36] A.G. Doyle E.N. Jacobsen Small-molecule H-bond donors in asymmetric catalysis Chem. Rev. 107 2007 5713 5743 A.G. Doyle, E.N. Jacobsen, Small-molecule H-bond donors in asymmetric catalysis, Chem. Rev. 107 (2007) 5713–5743. [37] S. Ding C. Zhang Y. Liu H. Jiang R. Chen Selective hydrogenation of phenol to cyclohexanone in water over Pd@N-doped carbons derived from ZIF-67: role of dicyandiamide Appl. Surf. Sci. 425 2017 484 491 S. Ding, C. Zhang, Y. Liu, H. Jiang, R. Chen, Selective hydrogenation of phenol to cyclohexanone in water over Pd@N-doped carbons derived from ZIF-67: role of dicyandiamide, Appl. Surf. Sci. 425 (2017) 484–491. [38] S. Han Y. Liu J. Li R. Li F. Yuan Y. Zhu Improvement effect of Ni to Pd-Ni/SBA-15 catalyst for selective hydrogenation of cinnamaldehyde to hydrocinnamaldehyde Catalysts 8 2018 200 S. Han, Y. Liu, J. Li, R. Li, F. Yuan, Y. Zhu, Improvement effect of Ni to Pd-Ni/SBA-15 catalyst for selective hydrogenation of cinnamaldehyde to hydrocinnamaldehyde, Catalysts 8 (2018) 200. [39] T. Jedsukontorn N. Saito M. Hunsom Photocatalytic behavior of metal-decorated TiO2 and their catalytic activity for transformation of glycerol to value added compounds Mol. Catal. 432 2017 160 171 T. Jedsukontorn, N. Saito, M. Hunsom, Photocatalytic behavior of metal-decorated TiO2 and their catalytic activity for transformation of glycerol to value added compounds, Mol. Catal. 432 (2017) 160–171. [40] Z.H. Al-Azri W.-.T. Chen A. Chan V. Jovic T. Ina H. Idriss G.I. Waterhouse The roles of metal co-catalysts and reaction media in photocatalytic hydrogen production: performance evaluation of M/TiO2 photocatalysts (M = Pd, Pt, Au) in different alcohol-water mixtures J. Catal. 329 2015 355 367 Z.H. Al-Azri, W.-.T. Chen, A. Chan, V. Jovic, T. Ina, H. Idriss, G.I. Waterhouse, The roles of metal co-catalysts and reaction media in photocatalytic hydrogen production: performance evaluation of M/TiO2 photocatalysts (M = Pd, Pt, Au) in different alcohol-water mixtures, J. Catal. 329 (2015) 355–367. [41] W. Chen X. Liu H. Zheng X. Fu Y. Yuan One-Pot Synthesis of hexamethylenetetramine coupled with H2 evolution from methanol and ammonia by a Pt/TiO2 nanophotocatalyst ACS Omega 7 2022 19614 19621 W. Chen, X. Liu, H. Zheng, X. Fu, Y. Yuan, One-Pot Synthesis of hexamethylenetetramine coupled with H2 evolution from methanol and ammonia by a Pt/TiO2 nanophotocatalyst, ACS Omega 7 (2022) 19614–19621. [42] Y. Chen Y. Wang W. Li Q. Yang Q. Hou L. Wei L. Liu F. Huang M. Ju Enhancement of photocatalytic performance with the use of noble-metal-decorated TiO2 nanocrystals as highly active catalysts for aerobic oxidation under visible-light irradiation Appl. Catal. B 210 2017 352 367 Y. Chen, Y. Wang, W. Li, Q. Yang, Q. Hou, L. Wei, L. Liu, F. Huang, M. Ju, Enhancement of photocatalytic performance with the use of noble-metal-decorated TiO2 nanocrystals as highly active catalysts for aerobic oxidation under visible-light irradiation, Appl. Catal. B 210 (2017) 352–367. [43] A. Li T. Wang X. Chang W. Cai P. Zhang J. Zhang J. Gong Spatial separation of oxidation and reduction co-catalysts for efficient charge separation: Pt@TiO2@MnOx hollow spheres for photocatalytic reactions Chem. Sci. 7 2016 890 895 A. Li, T. Wang, X. Chang, W. Cai, P. Zhang, J. Zhang, J. Gong, Spatial separation of oxidation and reduction co-catalysts for efficient charge separation: Pt@TiO2@MnOx hollow spheres for photocatalytic reactions, Chem. Sci. 7 (2016) 890–895. [44] D. Wang Z. Li Coupling MOF-based photocatalysis with Pd catalysis over Pd@MIL-100 (Fe) for efficient N-alkylation of amines with alcohols under visible light J. Catal. 342 2016 151 157 D. Wang, Z. Li, Coupling MOF-based photocatalysis with Pd catalysis over Pd@MIL-100 (Fe) for efficient N-alkylation of amines with alcohols under visible light, J. Catal. 342 (2016) 151–157. [45] M. Ye C. Zhang H. Chen X. Chen Catalytic synthesis of N-methylpiperazine in fixed bed reactor Petrochem. Technol. 2 2010 184 187 M. Ye, C. Zhang, H. Chen, X. Chen, Catalytic synthesis of N-methylpiperazine in fixed bed reactor, Petrochem. Technol. 2 (2010) 184–187. [46] R. Liu P. Ma P. Li H. Tian Synthesis of N-ethylpiperazine catalyzed by Cu-Zn/γ-Al2O3 Synth. Chem. 23 2015 757 759 R. Liu, P. Ma, P. Li, H. Tian, Synthesis of N-ethylpiperazine catalyzed by Cu-Zn/γ-Al2O3, Synth. Chem. 23 (2015) 757–759. [47] A.S. Alshammari K. Natte N.V. Kalevaru A. Bagabas R.V. Jagadeesh Scalable preparation of stable and reusable silica supported palladium nanoparticles as catalysts for N-alkylation of amines with alcohols J. Catal. 382 2020 141 149 A.S. Alshammari, K. Natte, N.V. Kalevaru, A. Bagabas, R.V. Jagadeesh, Scalable preparation of stable and reusable silica supported palladium nanoparticles as catalysts for N-alkylation of amines with alcohols, J. Catal. 382 (2020) 141–149. [48] L. Jiang F. Guo Y. Wang J. Jiang Y. Duan Z. Hou Selective N-monomethylation of anilines with methanol catalyzed by commercial Pd/C as an efficient and reusable catalyst Asian J. Org. Chem. 8 2019 2046 2049 L. Jiang, F. Guo, Y. Wang, J. Jiang, Y. Duan, Z. Hou, Selective N-monomethylation of anilines with methanol catalyzed by commercial Pd/C as an efficient and reusable catalyst, Asian J. Org. Chem. 8 (2019) 2046–2049. [49] L. Zhang Y. Zhang Y. Deng F. Shi Light-promoted N,N-dimethylation of amine and nitro compound with methanol catalyzed by Pd/TiO2 at room temperature RSC Adv. 5 2015 14514 14521 L. Zhang, Y. Zhang, Y. Deng, F. Shi, Light-promoted N,N-dimethylation of amine and nitro compound with methanol catalyzed by Pd/TiO2 at room temperature, RSC Adv.. 5 (2015) 14514–14521. [50] B. Zhang H. Gao W. Wang Photon-initiated heterogeneous redox couples for methylation of anilines under mild conditions Green Chem. 22 2020 4433 4437 B. Zhang, H. Gao, W. Wang, Photon-initiated heterogeneous redox couples for methylation of anilines under mild conditions, Green Chem.. 22 (2020) 4433–4437.",
      "scopus-id": "85148957020",
      "coredata": {
        "eid": "1-s2.0-S2468823123000809",
        "dc:description": "N-alkylated piperazines can be synthesized by the thermal catalytic alkylation of piperazine with alkyl halides or alcohols in the presence of supported metal catalysts. However, these processes either discharge large amounts of waste or require harsh conditions. Here, we report the results of N-alkylation of piperazine with lower alcohols (methanol, ethanol, and propanol) without external hydrogen addition at room temperature in the presence of a TiO2-supported Pd catalyst (Pd/TiO2-P) prepared by photodeposition method. Compared with the catalysts prepared by the conventional chemical reduction or hydrogen reduction, the Pd/TiO2-P catalyst showed the highest conversion of piperazine and the best selectivity to N-alkypiperazines. The mechanistic studies indicated that this phenomenon occurs via tandem photocatalytic reactions involving alcohol dehydrgenation to aldehyde, aldehyde condensation with piperazine to enamine, and enamine hydrogenation to N-alkylated piperazines. Considering the experimental results of methanol isotope kinetics, the α-C–H cleavage of methanol to form hydroxymethyl radical (·CH2OH) was proven to be the rate-determining step in the N-alkylation reaction of piperazine with low carbon alcohols. The characterization and control experiments revealed that the size of Pd nanoparticles and the valence of Pd species were vital to the reaction. The Pd/TiO2-P catalyst with an average of 2.5 ± 0.5 nm Pd particles and approximately 68% Pd0 species on surfaces presented the highest activity for the photocatalytic tandem reactions of methanol dehydrogenation and enamine hydrogenation.",
        "openArchiveArticle": "false",
        "prism:coverDate": "2023-03-01",
        "openaccessUserLicense": null,
        "prism:aggregationType": "Journal",
        "prism:url": "https://api.elsevier.com/content/article/pii/S2468823123000809",
        "dc:creator": [
          {
            "@_fa": "true",
            "$": "Chen, Weikun"
          },
          {
            "@_fa": "true",
            "$": "Fu, Xiao"
          },
          {
            "@_fa": "true",
            "$": "Liu, Xiaoying"
          },
          {
            "@_fa": "true",
            "$": "Ye, Linmin"
          },
          {
            "@_fa": "true",
            "$": "Yuan, Youzhu"
          }
        ],
        "link": [
          {
            "@_fa": "true",
            "@rel": "self",
            "@href": "https://api.elsevier.com/content/article/pii/S2468823123000809"
          },
          {
            "@_fa": "true",
            "@rel": "scidir",
            "@href": "https://www.sciencedirect.com/science/article/pii/S2468823123000809"
          }
        ],
        "dc:format": "application/json",
        "openaccessType": null,
        "pii": "S2468-8231(23)00080-9",
        "prism:volume": "538",
        "articleNumber": "112993",
        "prism:publisher": "Elsevier B.V.",
        "dc:title": "Mechanistic insight into the photocatalytic N-alkylation of piperazine with alcohols over TiO2 supported Pd catalysts",
        "prism:copyright": "© 2023 Elsevier B.V. All rights reserved.",
        "openaccess": "0",
        "prism:issn": "24688231",
        "dcterms:subject": [
          {
            "@_fa": "true",
            "$": "Pd/TiO2"
          },
          {
            "@_fa": "true",
            "$": "Photocatalysis"
          },
          {
            "@_fa": "true",
            "$": "Piperazine"
          },
          {
            "@_fa": "true",
            "$": "N-alkylation"
          },
          {
            "@_fa": "true",
            "$": "Reaction mechanism"
          }
        ],
        "openaccessArticle": "false",
        "prism:publicationName": "Molecular Catalysis",
        "openaccessSponsorType": null,
        "prism:pageRange": "112993",
        "pubType": "fla",
        "prism:coverDisplayDate": "1 March 2023",
        "prism:doi": "10.1016/j.mcat.2023.112993",
        "prism:startingPage": "112993",
        "dc:identifier": "doi:10.1016/j.mcat.2023.112993",
        "openaccessSponsorName": null
      },
      "objects": {
        "object": [
          {
            "@category": "standard",
            "@height": "49",
            "@width": "116",
            "@_fa": "true",
            "$": "https://api.elsevier.com/content/object/eid/1-s2.0-S2468823123000809-fx5.jpg?httpAccept=%2A%2F%2A",
            "@multimediatype": "JPEG image file",
            "@type": "IMAGE-DOWNSAMPLED",
            "@size": "1933",
            "@ref": "fx5",
            "@mimetype": "image/jpeg"
          },
          {
            "@category": "standard",
            "@height": "51",
            "@width": "88",
            "@_fa": "true",
            "$": "https://api.elsevier.com/content/object/eid/1-s2.0-S2468823123000809-fx6.jpg?httpAccept=%2A%2F%2A",
            "@multimediatype": "JPEG image file",
            "@type": "IMAGE-DOWNSAMPLED",
            "@size": "1676",
            "@ref": "fx6",
            "@mimetype": "image/jpeg"
          },
          {
            "@category": "standard",
            "@height": "169",
            "@width": "339",
            "@_fa": "true",
            "$": "https://api.elsevier.com/content/object/eid/1-s2.0-S2468823123000809-sc1.jpg?httpAccept=%2A%2F%2A",
            "@multimediatype": "JPEG image file",
            "@type": "IMAGE-DOWNSAMPLED",
            "@size": "15458",
            "@ref": "sc1",
            "@mimetype": "image/jpeg"
          },
          {
            "@category": "standard",
            "@height": "50",
            "@width": "88",
            "@_fa": "true",
            "$": "https://api.elsevier.com/content/object/eid/1-s2.0-S2468823123000809-fx3.jpg?httpAccept=%2A%2F%2A",
            "@multimediatype": "JPEG image file",
            "@type": "IMAGE-DOWNSAMPLED",
            "@size": "1641",
            "@ref": "fx3",
            "@mimetype": "image/jpeg"
          },
          {
            "@category": "standard",
            "@height": "307",
            "@width": "339",
            "@_fa": "true",
            "$": "https://api.elsevier.com/content/object/eid/1-s2.0-S2468823123000809-sc2.jpg?httpAccept=%2A%2F%2A",
            "@multimediatype": "JPEG image file",
            "@type": "IMAGE-DOWNSAMPLED",
            "@size": "19868",
            "@ref": "sc2",
            "@mimetype": "image/jpeg"
          },
          {
            "@category": "standard",
            "@height": "17",
            "@width": "47",
            "@_fa": "true",
            "$": "https://api.elsevier.com/content/object/eid/1-s2.0-S2468823123000809-fx4.jpg?httpAccept=%2A%2F%2A",
            "@multimediatype": "JPEG image file",
            "@type": "IMAGE-DOWNSAMPLED",
            "@size": "782",
            "@ref": "fx4",
            "@mimetype": "image/jpeg"
          },
          {
            "@category": "standard",
            "@height": "371",
            "@width": "339",
            "@_fa": "true",
            "$": "https://api.elsevier.com/content/object/eid/1-s2.0-S2468823123000809-gr2.jpg?httpAccept=%2A%2F%2A",
            "@multimediatype": "JPEG image file",
            "@type": "IMAGE-DOWNSAMPLED",
            "@size": "46804",
            "@ref": "gr2",
            "@mimetype": "image/jpeg"
          },
          {
            "@category": "standard",
            "@height": "51",
            "@width": "62",
            "@_fa": "true",
            "$": "https://api.elsevier.com/content/object/eid/1-s2.0-S2468823123000809-fx9.jpg?httpAccept=%2A%2F%2A",
            "@multimediatype": "JPEG image file",
            "@type": "IMAGE-DOWNSAMPLED",
            "@size": "1433",
            "@ref": "fx9",
            "@mimetype": "image/jpeg"
          },
          {
            "@category": "standard",
            "@height": "924",
            "@width": "606",
            "@_fa": "true",
            "$": "https://api.elsevier.com/content/object/eid/1-s2.0-S2468823123000809-gr3.jpg?httpAccept=%2A%2F%2A",
            "@multimediatype": "JPEG image file",
            "@type": "IMAGE-DOWNSAMPLED",
            "@size": "112626",
            "@ref": "gr3",
            "@mimetype": "image/jpeg"
          },
          {
            "@category": "standard",
            "@height": "21",
            "@width": "88",
            "@_fa": "true",
            "$": "https://api.elsevier.com/content/object/eid/1-s2.0-S2468823123000809-fx7.jpg?httpAccept=%2A%2F%2A",
            "@multimediatype": "JPEG image file",
            "@type": "IMAGE-DOWNSAMPLED",
            "@size": "1175",
            "@ref": "fx7",
            "@mimetype": "image/jpeg"
          },
          {
            "@category": "standard",
            "@height": "279",
            "@width": "659",
            "@_fa": "true",
            "$": "https://api.elsevier.com/content/object/eid/1-s2.0-S2468823123000809-gr1.jpg?httpAccept=%2A%2F%2A",
            "@multimediatype": "JPEG image file",
            "@type": "IMAGE-DOWNSAMPLED",
            "@size": "52131",
            "@ref": "gr1",
            "@mimetype": "image/jpeg"
          },
          {
            "@category": "standard",
            "@height": "51",
            "@width": "148",
            "@_fa": "true",
            "$": "https://api.elsevier.com/content/object/eid/1-s2.0-S2468823123000809-fx8.jpg?httpAccept=%2A%2F%2A",
            "@multimediatype": "JPEG image file",
            "@type": "IMAGE-DOWNSAMPLED",
            "@size": "2238",
            "@ref": "fx8",
            "@mimetype": "image/jpeg"
          },
          {
            "@category": "standard",
            "@height": "302",
            "@width": "339",
            "@_fa": "true",
            "$": "https://api.elsevier.com/content/object/eid/1-s2.0-S2468823123000809-gr10.jpg?httpAccept=%2A%2F%2A",
            "@multimediatype": "JPEG image file",
            "@type": "IMAGE-DOWNSAMPLED",
            "@size": "21304",
            "@ref": "gr10",
            "@mimetype": "image/jpeg"
          },
          {
            "@category": "standard",
            "@height": "73",
            "@width": "87",
            "@_fa": "true",
            "$": "https://api.elsevier.com/content/object/eid/1-s2.0-S2468823123000809-fx1.jpg?httpAccept=%2A%2F%2A",
            "@multimediatype": "JPEG image file",
            "@type": "IMAGE-DOWNSAMPLED",
            "@size": "2354",
            "@ref": "fx1",
            "@mimetype": "image/jpeg"
          },
          {
            "@category": "standard",
            "@height": "57",
            "@width": "703",
            "@_fa": "true",
            "$": "https://api.elsevier.com/content/object/eid/1-s2.0-S2468823123000809-fx2.jpg?httpAccept=%2A%2F%2A",
            "@multimediatype": "JPEG image file",
            "@type": "IMAGE-DOWNSAMPLED",
            "@size": "10918",
            "@ref": "fx2",
            "@mimetype": "image/jpeg"
          },
          {
            "@category": "standard",
            "@height": "200",
            "@width": "351",
            "@_fa": "true",
            "$": "https://api.elsevier.com/content/object/eid/1-s2.0-S2468823123000809-ga1.jpg?httpAccept=%2A%2F%2A",
            "@multimediatype": "JPEG image file",
            "@type": "IMAGE-DOWNSAMPLED",
            "@size": "33825",
            "@ref": "ga1",
            "@mimetype": "image/jpeg"
          },
          {
            "@category": "standard",
            "@height": "23",
            "@width": "45",
            "@_fa": "true",
            "$": "https://api.elsevier.com/content/object/eid/1-s2.0-S2468823123000809-fx19.jpg?httpAccept=%2A%2F%2A",
            "@multimediatype": "JPEG image file",
            "@type": "IMAGE-DOWNSAMPLED",
            "@size": "797",
            "@ref": "fx19",
            "@mimetype": "image/jpeg"
          },
          {
            "@category": "standard",
            "@height": "66",
            "@width": "87",
            "@_fa": "true",
            "$": "https://api.elsevier.com/content/object/eid/1-s2.0-S2468823123000809-fx18.jpg?httpAccept=%2A%2F%2A",
            "@multimediatype": "JPEG image file",
            "@type": "IMAGE-DOWNSAMPLED",
            "@size": "2338",
            "@ref": "fx18",
            "@mimetype": "image/jpeg"
          },
          {
            "@category": "standard",
            "@height": "83",
            "@width": "99",
            "@_fa": "true",
            "$": "https://api.elsevier.com/content/object/eid/1-s2.0-S2468823123000809-fx17.jpg?httpAccept=%2A%2F%2A",
            "@multimediatype": "JPEG image file",
            "@type": "IMAGE-DOWNSAMPLED",
            "@size": "2516",
            "@ref": "fx17",
            "@mimetype": "image/jpeg"
          },
          {
            "@category": "standard",
            "@height": "22",
            "@width": "46",
            "@_fa": "true",
            "$": "https://api.elsevier.com/content/object/eid/1-s2.0-S2468823123000809-fx16.jpg?httpAccept=%2A%2F%2A",
            "@multimediatype": "JPEG image file",
            "@type": "IMAGE-DOWNSAMPLED",
            "@size": "809",
            "@ref": "fx16",
            "@mimetype": "image/jpeg"
          },
          {
            "@category": "standard",
            "@height": "54",
            "@width": "80",
            "@_fa": "true",
            "$": "https://api.elsevier.com/content/object/eid/1-s2.0-S2468823123000809-fx11.jpg?httpAccept=%2A%2F%2A",
            "@multimediatype": "JPEG image file",
            "@type": "IMAGE-DOWNSAMPLED",
            "@size": "1498",
            "@ref": "fx11",
            "@mimetype": "image/jpeg"
          },
          {
            "@category": "standard",
            "@height": "20",
            "@width": "44",
            "@_fa": "true",
            "$": "https://api.elsevier.com/content/object/eid/1-s2.0-S2468823123000809-fx10.jpg?httpAccept=%2A%2F%2A",
            "@multimediatype": "JPEG image file",
            "@type": "IMAGE-DOWNSAMPLED",
            "@size": "825",
            "@ref": "fx10",
            "@mimetype": "image/jpeg"
          },
          {
            "@category": "standard",
            "@height": "74",
            "@width": "95",
            "@_fa": "true",
            "$": "https://api.elsevier.com/content/object/eid/1-s2.0-S2468823123000809-fx15.jpg?httpAccept=%2A%2F%2A",
            "@multimediatype": "JPEG image file",
            "@type": "IMAGE-DOWNSAMPLED",
            "@size": "2507",
            "@ref": "fx15",
            "@mimetype": "image/jpeg"
          },
          {
            "@category": "standard",
            "@height": "49",
            "@width": "89",
            "@_fa": "true",
            "$": "https://api.elsevier.com/content/object/eid/1-s2.0-S2468823123000809-fx14.jpg?httpAccept=%2A%2F%2A",
            "@multimediatype": "JPEG image file",
            "@type": "IMAGE-DOWNSAMPLED",
            "@size": "1605",
            "@ref": "fx14",
            "@mimetype": "image/jpeg"
          },
          {
            "@category": "standard",
            "@height": "20",
            "@width": "44",
            "@_fa": "true",
            "$": "https://api.elsevier.com/content/object/eid/1-s2.0-S2468823123000809-fx13.jpg?httpAccept=%2A%2F%2A",
            "@multimediatype": "JPEG image file",
            "@type": "IMAGE-DOWNSAMPLED",
            "@size": "828",
            "@ref": "fx13",
            "@mimetype": "image/jpeg"
          },
          {
            "@category": "standard",
            "@height": "49",
            "@width": "74",
            "@_fa": "true",
            "$": "https://api.elsevier.com/content/object/eid/1-s2.0-S2468823123000809-fx12.jpg?httpAccept=%2A%2F%2A",
            "@multimediatype": "JPEG image file",
            "@type": "IMAGE-DOWNSAMPLED",
            "@size": "1521",
            "@ref": "fx12",
            "@mimetype": "image/jpeg"
          },
          {
            "@category": "standard",
            "@height": "291",
            "@width": "339",
            "@_fa": "true",
            "$": "https://api.elsevier.com/content/object/eid/1-s2.0-S2468823123000809-gr6.jpg?httpAccept=%2A%2F%2A",
            "@multimediatype": "JPEG image file",
            "@type": "IMAGE-DOWNSAMPLED",
            "@size": "34053",
            "@ref": "gr6",
            "@mimetype": "image/jpeg"
          },
          {
            "@category": "standard",
            "@height": "290",
            "@width": "339",
            "@_fa": "true",
            "$": "https://api.elsevier.com/content/object/eid/1-s2.0-S2468823123000809-gr7.jpg?httpAccept=%2A%2F%2A",
            "@multimediatype": "JPEG image file",
            "@type": "IMAGE-DOWNSAMPLED",
            "@size": "31355",
            "@ref": "gr7",
            "@mimetype": "image/jpeg"
          },
          {
            "@category": "standard",
            "@height": "318",
            "@width": "339",
            "@_fa": "true",
            "$": "https://api.elsevier.com/content/object/eid/1-s2.0-S2468823123000809-gr4.jpg?httpAccept=%2A%2F%2A",
            "@multimediatype": "JPEG image file",
            "@type": "IMAGE-DOWNSAMPLED",
            "@size": "55566",
            "@ref": "gr4",
            "@mimetype": "image/jpeg"
          },
          {
            "@category": "standard",
            "@height": "294",
            "@width": "339",
            "@_fa": "true",
            "$": "https://api.elsevier.com/content/object/eid/1-s2.0-S2468823123000809-gr5.jpg?httpAccept=%2A%2F%2A",
            "@multimediatype": "JPEG image file",
            "@type": "IMAGE-DOWNSAMPLED",
            "@size": "25954",
            "@ref": "gr5",
            "@mimetype": "image/jpeg"
          },
          {
            "@category": "standard",
            "@height": "282",
            "@width": "659",
            "@_fa": "true",
            "$": "https://api.elsevier.com/content/object/eid/1-s2.0-S2468823123000809-gr8.jpg?httpAccept=%2A%2F%2A",
            "@multimediatype": "JPEG image file",
            "@type": "IMAGE-DOWNSAMPLED",
            "@size": "50900",
            "@ref": "gr8",
            "@mimetype": "image/jpeg"
          },
          {
            "@category": "standard",
            "@height": "621",
            "@width": "659",
            "@_fa": "true",
            "$": "https://api.elsevier.com/content/object/eid/1-s2.0-S2468823123000809-gr9.jpg?httpAccept=%2A%2F%2A",
            "@multimediatype": "JPEG image file",
            "@type": "IMAGE-DOWNSAMPLED",
            "@size": "101652",
            "@ref": "gr9",
            "@mimetype": "image/jpeg"
          },
          {
            "@category": "thumbnail",
            "@height": "92",
            "@width": "219",
            "@_fa": "true",
            "$": "https://api.elsevier.com/content/object/eid/1-s2.0-S2468823123000809-fx5.sml?httpAccept=%2A%2F%2A",
            "@multimediatype": "GIF image file",
            "@type": "IMAGE-THUMBNAIL",
            "@size": "2975",
            "@ref": "fx5",
            "@mimetype": "image/gif"
          },
          {
            "@category": "thumbnail",
            "@height": "127",
            "@width": "219",
            "@_fa": "true",
            "$": "https://api.elsevier.com/content/object/eid/1-s2.0-S2468823123000809-fx6.sml?httpAccept=%2A%2F%2A",
            "@multimediatype": "GIF image file",
            "@type": "IMAGE-THUMBNAIL",
            "@size": "3708",
            "@ref": "fx6",
            "@mimetype": "image/gif"
          },
          {
            "@category": "thumbnail",
            "@height": "109",
            "@width": "219",
            "@_fa": "true",
            "$": "https://api.elsevier.com/content/object/eid/1-s2.0-S2468823123000809-sc1.sml?httpAccept=%2A%2F%2A",
            "@multimediatype": "GIF image file",
            "@type": "IMAGE-THUMBNAIL",
            "@size": "6090",
            "@ref": "sc1",
            "@mimetype": "image/gif"
          },
          {
            "@category": "thumbnail",
            "@height": "123",
            "@width": "219",
            "@_fa": "true",
            "$": "https://api.elsevier.com/content/object/eid/1-s2.0-S2468823123000809-fx3.sml?httpAccept=%2A%2F%2A",
            "@multimediatype": "GIF image file",
            "@type": "IMAGE-THUMBNAIL",
            "@size": "3446",
            "@ref": "fx3",
            "@mimetype": "image/gif"
          },
          {
            "@category": "thumbnail",
            "@height": "164",
            "@width": "181",
            "@_fa": "true",
            "$": "https://api.elsevier.com/content/object/eid/1-s2.0-S2468823123000809-sc2.sml?httpAccept=%2A%2F%2A",
            "@multimediatype": "GIF image file",
            "@type": "IMAGE-THUMBNAIL",
            "@size": "6575",
            "@ref": "sc2",
            "@mimetype": "image/gif"
          },
          {
            "@category": "thumbnail",
            "@height": "77",
            "@width": "210",
            "@_fa": "true",
            "$": "https://api.elsevier.com/content/object/eid/1-s2.0-S2468823123000809-fx4.sml?httpAccept=%2A%2F%2A",
            "@multimediatype": "GIF image file",
            "@type": "IMAGE-THUMBNAIL",
            "@size": "3006",
            "@ref": "fx4",
            "@mimetype": "image/gif"
          },
          {
            "@category": "thumbnail",
            "@height": "164",
            "@width": "150",
            "@_fa": "true",
            "$": "https://api.elsevier.com/content/object/eid/1-s2.0-S2468823123000809-gr2.sml?httpAccept=%2A%2F%2A",
            "@multimediatype": "GIF image file",
            "@type": "IMAGE-THUMBNAIL",
            "@size": "9514",
            "@ref": "gr2",
            "@mimetype": "image/gif"
          },
          {
            "@category": "thumbnail",
            "@height": "163",
            "@width": "197",
            "@_fa": "true",
            "$": "https://api.elsevier.com/content/object/eid/1-s2.0-S2468823123000809-fx9.sml?httpAccept=%2A%2F%2A",
            "@multimediatype": "GIF image file",
            "@type": "IMAGE-THUMBNAIL",
            "@size": "4425",
            "@ref": "fx9",
            "@mimetype": "image/gif"
          },
          {
            "@category": "thumbnail",
            "@height": "163",
            "@width": "107",
            "@_fa": "true",
            "$": "https://api.elsevier.com/content/object/eid/1-s2.0-S2468823123000809-gr3.sml?httpAccept=%2A%2F%2A",
            "@multimediatype": "GIF image file",
            "@type": "IMAGE-THUMBNAIL",
            "@size": "9746",
            "@ref": "gr3",
            "@mimetype": "image/gif"
          },
          {
            "@category": "thumbnail",
            "@height": "52",
            "@width": "219",
            "@_fa": "true",
            "$": "https://api.elsevier.com/content/object/eid/1-s2.0-S2468823123000809-fx7.sml?httpAccept=%2A%2F%2A",
            "@multimediatype": "GIF image file",
            "@type": "IMAGE-THUMBNAIL",
            "@size": "2677",
            "@ref": "fx7",
            "@mimetype": "image/gif"
          },
          {
            "@category": "thumbnail",
            "@height": "93",
            "@width": "219",
            "@_fa": "true",
            "$": "https://api.elsevier.com/content/object/eid/1-s2.0-S2468823123000809-gr1.sml?httpAccept=%2A%2F%2A",
            "@multimediatype": "GIF image file",
            "@type": "IMAGE-THUMBNAIL",
            "@size": "9144",
            "@ref": "gr1",
            "@mimetype": "image/gif"
          },
          {
            "@category": "thumbnail",
            "@height": "76",
            "@width": "219",
            "@_fa": "true",
            "$": "https://api.elsevier.com/content/object/eid/1-s2.0-S2468823123000809-fx8.sml?httpAccept=%2A%2F%2A",
            "@multimediatype": "GIF image file",
            "@type": "IMAGE-THUMBNAIL",
            "@size": "2715",
            "@ref": "fx8",
            "@mimetype": "image/gif"
          },
          {
            "@category": "thumbnail",
            "@height": "164",
            "@width": "184",
            "@_fa": "true",
            "$": "https://api.elsevier.com/content/object/eid/1-s2.0-S2468823123000809-gr10.sml?httpAccept=%2A%2F%2A",
            "@multimediatype": "GIF image file",
            "@type": "IMAGE-THUMBNAIL",
            "@size": "7611",
            "@ref": "gr10",
            "@mimetype": "image/gif"
          },
          {
            "@category": "thumbnail",
            "@height": "164",
            "@width": "194",
            "@_fa": "true",
            "$": "https://api.elsevier.com/content/object/eid/1-s2.0-S2468823123000809-fx1.sml?httpAccept=%2A%2F%2A",
            "@multimediatype": "GIF image file",
            "@type": "IMAGE-THUMBNAIL",
            "@size": "4705",
            "@ref": "fx1",
            "@mimetype": "image/gif"
          },
          {
            "@category": "thumbnail",
            "@height": "18",
            "@width": "219",
            "@_fa": "true",
            "$": "https://api.elsevier.com/content/object/eid/1-s2.0-S2468823123000809-fx2.sml?httpAccept=%2A%2F%2A",
            "@multimediatype": "GIF image file",
            "@type": "IMAGE-THUMBNAIL",
            "@size": "1952",
            "@ref": "fx2",
            "@mimetype": "image/gif"
          },
          {
            "@category": "thumbnail",
            "@height": "125",
            "@width": "219",
            "@_fa": "true",
            "$": "https://api.elsevier.com/content/object/eid/1-s2.0-S2468823123000809-ga1.sml?httpAccept=%2A%2F%2A",
            "@multimediatype": "GIF image file",
            "@type": "IMAGE-THUMBNAIL",
            "@size": "22039",
            "@ref": "ga1",
            "@mimetype": "image/gif"
          },
          {
            "@category": "thumbnail",
            "@height": "101",
            "@width": "201",
            "@_fa": "true",
            "$": "https://api.elsevier.com/content/object/eid/1-s2.0-S2468823123000809-fx19.sml?httpAccept=%2A%2F%2A",
            "@multimediatype": "GIF image file",
            "@type": "IMAGE-THUMBNAIL",
            "@size": "3145",
            "@ref": "fx19",
            "@mimetype": "image/gif"
          },
          {
            "@category": "thumbnail",
            "@height": "164",
            "@width": "217",
            "@_fa": "true",
            "$": "https://api.elsevier.com/content/object/eid/1-s2.0-S2468823123000809-fx18.sml?httpAccept=%2A%2F%2A",
            "@multimediatype": "GIF image file",
            "@type": "IMAGE-THUMBNAIL",
            "@size": "5377",
            "@ref": "fx18",
            "@mimetype": "image/gif"
          },
          {
            "@category": "thumbnail",
            "@height": "164",
            "@width": "196",
            "@_fa": "true",
            "$": "https://api.elsevier.com/content/object/eid/1-s2.0-S2468823123000809-fx17.sml?httpAccept=%2A%2F%2A",
            "@multimediatype": "GIF image file",
            "@type": "IMAGE-THUMBNAIL",
            "@size": "4241",
            "@ref": "fx17",
            "@mimetype": "image/gif"
          },
          {
            "@category": "thumbnail",
            "@height": "101",
            "@width": "207",
            "@_fa": "true",
            "$": "https://api.elsevier.com/content/object/eid/1-s2.0-S2468823123000809-fx16.sml?httpAccept=%2A%2F%2A",
            "@multimediatype": "GIF image file",
            "@type": "IMAGE-THUMBNAIL",
            "@size": "3187",
            "@ref": "fx16",
            "@mimetype": "image/gif"
          },
          {
            "@category": "thumbnail",
            "@height": "148",
            "@width": "219",
            "@_fa": "true",
            "$": "https://api.elsevier.com/content/object/eid/1-s2.0-S2468823123000809-fx11.sml?httpAccept=%2A%2F%2A",
            "@multimediatype": "GIF image file",
            "@type": "IMAGE-THUMBNAIL",
            "@size": "3742",
            "@ref": "fx11",
            "@mimetype": "image/gif"
          },
          {
            "@category": "thumbnail",
            "@height": "88",
            "@width": "197",
            "@_fa": "true",
            "$": "https://api.elsevier.com/content/object/eid/1-s2.0-S2468823123000809-fx10.sml?httpAccept=%2A%2F%2A",
            "@multimediatype": "GIF image file",
            "@type": "IMAGE-THUMBNAIL",
            "@size": "2840",
            "@ref": "fx10",
            "@mimetype": "image/gif"
          },
          {
            "@category": "thumbnail",
            "@height": "164",
            "@width": "210",
            "@_fa": "true",
            "$": "https://api.elsevier.com/content/object/eid/1-s2.0-S2468823123000809-fx15.sml?httpAccept=%2A%2F%2A",
            "@multimediatype": "GIF image file",
            "@type": "IMAGE-THUMBNAIL",
            "@size": "4757",
            "@ref": "fx15",
            "@mimetype": "image/gif"
          },
          {
            "@category": "thumbnail",
            "@height": "121",
            "@width": "219",
            "@_fa": "true",
            "$": "https://api.elsevier.com/content/object/eid/1-s2.0-S2468823123000809-fx14.sml?httpAccept=%2A%2F%2A",
            "@multimediatype": "GIF image file",
            "@type": "IMAGE-THUMBNAIL",
            "@size": "3191",
            "@ref": "fx14",
            "@mimetype": "image/gif"
          },
          {
            "@category": "thumbnail",
            "@height": "88",
            "@width": "197",
            "@_fa": "true",
            "$": "https://api.elsevier.com/content/object/eid/1-s2.0-S2468823123000809-fx13.sml?httpAccept=%2A%2F%2A",
            "@multimediatype": "GIF image file",
            "@type": "IMAGE-THUMBNAIL",
            "@size": "2714",
            "@ref": "fx13",
            "@mimetype": "image/gif"
          },
          {
            "@category": "thumbnail",
            "@height": "145",
            "@width": "219",
            "@_fa": "true",
            "$": "https://api.elsevier.com/content/object/eid/1-s2.0-S2468823123000809-fx12.sml?httpAccept=%2A%2F%2A",
            "@multimediatype": "GIF image file",
            "@type": "IMAGE-THUMBNAIL",
            "@size": "3941",
            "@ref": "fx12",
            "@mimetype": "image/gif"
          },
          {
            "@category": "thumbnail",
            "@height": "164",
            "@width": "191",
            "@_fa": "true",
            "$": "https://api.elsevier.com/content/object/eid/1-s2.0-S2468823123000809-gr6.sml?httpAccept=%2A%2F%2A",
            "@multimediatype": "GIF image file",
            "@type": "IMAGE-THUMBNAIL",
            "@size": "10598",
            "@ref": "gr6",
            "@mimetype": "image/gif"
          },
          {
            "@category": "thumbnail",
            "@height": "163",
            "@width": "191",
            "@_fa": "true",
            "$": "https://api.elsevier.com/content/object/eid/1-s2.0-S2468823123000809-gr7.sml?httpAccept=%2A%2F%2A",
            "@multimediatype": "GIF image file",
            "@type": "IMAGE-THUMBNAIL",
            "@size": "9579",
            "@ref": "gr7",
            "@mimetype": "image/gif"
          },
          {
            "@category": "thumbnail",
            "@height": "164",
            "@width": "175",
            "@_fa": "true",
            "$": "https://api.elsevier.com/content/object/eid/1-s2.0-S2468823123000809-gr4.sml?httpAccept=%2A%2F%2A",
            "@multimediatype": "GIF image file",
            "@type": "IMAGE-THUMBNAIL",
            "@size": "12353",
            "@ref": "gr4",
            "@mimetype": "image/gif"
          },
          {
            "@category": "thumbnail",
            "@height": "164",
            "@width": "189",
            "@_fa": "true",
            "$": "https://api.elsevier.com/content/object/eid/1-s2.0-S2468823123000809-gr5.sml?httpAccept=%2A%2F%2A",
            "@multimediatype": "GIF image file",
            "@type": "IMAGE-THUMBNAIL",
            "@size": "7597",
            "@ref": "gr5",
            "@mimetype": "image/gif"
          },
          {
            "@category": "thumbnail",
            "@height": "94",
            "@width": "219",
            "@_fa": "true",
            "$": "https://api.elsevier.com/content/object/eid/1-s2.0-S2468823123000809-gr8.sml?httpAccept=%2A%2F%2A",
            "@multimediatype": "GIF image file",
            "@type": "IMAGE-THUMBNAIL",
            "@size": "8139",
            "@ref": "gr8",
            "@mimetype": "image/gif"
          },
          {
            "@category": "thumbnail",
            "@height": "164",
            "@width": "174",
            "@_fa": "true",
            "$": "https://api.elsevier.com/content/object/eid/1-s2.0-S2468823123000809-gr9.sml?httpAccept=%2A%2F%2A",
            "@multimediatype": "GIF image file",
            "@type": "IMAGE-THUMBNAIL",
            "@size": "9505",
            "@ref": "gr9",
            "@mimetype": "image/gif"
          },
          {
            "@category": "high",
            "@height": "218",
            "@width": "517",
            "@_fa": "true",
            "$": "https://api.elsevier.com/content/object/eid/1-s2.0-S2468823123000809-fx5_lrg.jpg?httpAccept=%2A%2F%2A",
            "@multimediatype": "JPEG image file",
            "@type": "IMAGE-HIGH-RES",
            "@size": "11744",
            "@ref": "fx5",
            "@mimetype": "image/jpeg"
          },
          {
            "@category": "high",
            "@height": "227",
            "@width": "392",
            "@_fa": "true",
            "$": "https://api.elsevier.com/content/object/eid/1-s2.0-S2468823123000809-fx6_lrg.jpg?httpAccept=%2A%2F%2A",
            "@multimediatype": "JPEG image file",
            "@type": "IMAGE-HIGH-RES",
            "@size": "9858",
            "@ref": "fx6",
            "@mimetype": "image/jpeg"
          },
          {
            "@category": "high",
            "@height": "747",
            "@width": "1500",
            "@_fa": "true",
            "$": "https://api.elsevier.com/content/object/eid/1-s2.0-S2468823123000809-sc1_lrg.jpg?httpAccept=%2A%2F%2A",
            "@multimediatype": "JPEG image file",
            "@type": "IMAGE-HIGH-RES",
            "@size": "92840",
            "@ref": "sc1",
            "@mimetype": "image/jpeg"
          },
          {
            "@category": "high",
            "@height": "221",
            "@width": "392",
            "@_fa": "true",
            "$": "https://api.elsevier.com/content/object/eid/1-s2.0-S2468823123000809-fx3_lrg.jpg?httpAccept=%2A%2F%2A",
            "@multimediatype": "JPEG image file",
            "@type": "IMAGE-HIGH-RES",
            "@size": "9169",
            "@ref": "fx3",
            "@mimetype": "image/jpeg"
          },
          {
            "@category": "high",
            "@height": "1360",
            "@width": "1500",
            "@_fa": "true",
            "$": "https://api.elsevier.com/content/object/eid/1-s2.0-S2468823123000809-sc2_lrg.jpg?httpAccept=%2A%2F%2A",
            "@multimediatype": "JPEG image file",
            "@type": "IMAGE-HIGH-RES",
            "@size": "128462",
            "@ref": "sc2",
            "@mimetype": "image/jpeg"
          },
          {
            "@category": "high",
            "@height": "77",
            "@width": "210",
            "@_fa": "true",
            "$": "https://api.elsevier.com/content/object/eid/1-s2.0-S2468823123000809-fx4_lrg.jpg?httpAccept=%2A%2F%2A",
            "@multimediatype": "JPEG image file",
            "@type": "IMAGE-HIGH-RES",
            "@size": "4171",
            "@ref": "fx4",
            "@mimetype": "image/jpeg"
          },
          {
            "@category": "high",
            "@height": "1642",
            "@width": "1500",
            "@_fa": "true",
            "$": "https://api.elsevier.com/content/object/eid/1-s2.0-S2468823123000809-gr2_lrg.jpg?httpAccept=%2A%2F%2A",
            "@multimediatype": "JPEG image file",
            "@type": "IMAGE-HIGH-RES",
            "@size": "335303",
            "@ref": "gr2",
            "@mimetype": "image/jpeg"
          },
          {
            "@category": "high",
            "@height": "229",
            "@width": "276",
            "@_fa": "true",
            "$": "https://api.elsevier.com/content/object/eid/1-s2.0-S2468823123000809-fx9_lrg.jpg?httpAccept=%2A%2F%2A",
            "@multimediatype": "JPEG image file",
            "@type": "IMAGE-HIGH-RES",
            "@size": "9121",
            "@ref": "fx9",
            "@mimetype": "image/jpeg"
          },
          {
            "@category": "high",
            "@height": "4093",
            "@width": "2684",
            "@_fa": "true",
            "$": "https://api.elsevier.com/content/object/eid/1-s2.0-S2468823123000809-gr3_lrg.jpg?httpAccept=%2A%2F%2A",
            "@multimediatype": "JPEG image file",
            "@type": "IMAGE-HIGH-RES",
            "@size": "957516",
            "@ref": "gr3",
            "@mimetype": "image/jpeg"
          },
          {
            "@category": "high",
            "@height": "92",
            "@width": "391",
            "@_fa": "true",
            "$": "https://api.elsevier.com/content/object/eid/1-s2.0-S2468823123000809-fx7_lrg.jpg?httpAccept=%2A%2F%2A",
            "@multimediatype": "JPEG image file",
            "@type": "IMAGE-HIGH-RES",
            "@size": "6916",
            "@ref": "fx7",
            "@mimetype": "image/jpeg"
          },
          {
            "@category": "high",
            "@height": "1235",
            "@width": "2917",
            "@_fa": "true",
            "$": "https://api.elsevier.com/content/object/eid/1-s2.0-S2468823123000809-gr1_lrg.jpg?httpAccept=%2A%2F%2A",
            "@multimediatype": "JPEG image file",
            "@type": "IMAGE-HIGH-RES",
            "@size": "336843",
            "@ref": "gr1",
            "@mimetype": "image/jpeg"
          },
          {
            "@category": "high",
            "@height": "227",
            "@width": "656",
            "@_fa": "true",
            "$": "https://api.elsevier.com/content/object/eid/1-s2.0-S2468823123000809-fx8_lrg.jpg?httpAccept=%2A%2F%2A",
            "@multimediatype": "JPEG image file",
            "@type": "IMAGE-HIGH-RES",
            "@size": "14422",
            "@ref": "fx8",
            "@mimetype": "image/jpeg"
          },
          {
            "@category": "high",
            "@height": "1338",
            "@width": "1500",
            "@_fa": "true",
            "$": "https://api.elsevier.com/content/object/eid/1-s2.0-S2468823123000809-gr10_lrg.jpg?httpAccept=%2A%2F%2A",
            "@multimediatype": "JPEG image file",
            "@type": "IMAGE-HIGH-RES",
            "@size": "123016",
            "@ref": "gr10",
            "@mimetype": "image/jpeg"
          },
          {
            "@category": "high",
            "@height": "326",
            "@width": "386",
            "@_fa": "true",
            "$": "https://api.elsevier.com/content/object/eid/1-s2.0-S2468823123000809-fx1_lrg.jpg?httpAccept=%2A%2F%2A",
            "@multimediatype": "JPEG image file",
            "@type": "IMAGE-HIGH-RES",
            "@size": "16792",
            "@ref": "fx1",
            "@mimetype": "image/jpeg"
          },
          {
            "@category": "high",
            "@height": "254",
            "@width": "3111",
            "@_fa": "true",
            "$": "https://api.elsevier.com/content/object/eid/1-s2.0-S2468823123000809-fx2_lrg.jpg?httpAccept=%2A%2F%2A",
            "@multimediatype": "JPEG image file",
            "@type": "IMAGE-HIGH-RES",
            "@size": "68561",
            "@ref": "fx2",
            "@mimetype": "image/jpeg"
          },
          {
            "@category": "high",
            "@height": "886",
            "@width": "1556",
            "@_fa": "true",
            "$": "https://api.elsevier.com/content/object/eid/1-s2.0-S2468823123000809-ga1_lrg.jpg?httpAccept=%2A%2F%2A",
            "@multimediatype": "JPEG image file",
            "@type": "IMAGE-HIGH-RES",
            "@size": "263102",
            "@ref": "ga1",
            "@mimetype": "image/jpeg"
          },
          {
            "@category": "high",
            "@height": "101",
            "@width": "201",
            "@_fa": "true",
            "$": "https://api.elsevier.com/content/object/eid/1-s2.0-S2468823123000809-fx19_lrg.jpg?httpAccept=%2A%2F%2A",
            "@multimediatype": "JPEG image file",
            "@type": "IMAGE-HIGH-RES",
            "@size": "4053",
            "@ref": "fx19",
            "@mimetype": "image/jpeg"
          },
          {
            "@category": "high",
            "@height": "294",
            "@width": "389",
            "@_fa": "true",
            "$": "https://api.elsevier.com/content/object/eid/1-s2.0-S2468823123000809-fx18_lrg.jpg?httpAccept=%2A%2F%2A",
            "@multimediatype": "JPEG image file",
            "@type": "IMAGE-HIGH-RES",
            "@size": "16749",
            "@ref": "fx18",
            "@mimetype": "image/jpeg"
          },
          {
            "@category": "high",
            "@height": "369",
            "@width": "441",
            "@_fa": "true",
            "$": "https://api.elsevier.com/content/object/eid/1-s2.0-S2468823123000809-fx17_lrg.jpg?httpAccept=%2A%2F%2A",
            "@multimediatype": "JPEG image file",
            "@type": "IMAGE-HIGH-RES",
            "@size": "19257",
            "@ref": "fx17",
            "@mimetype": "image/jpeg"
          },
          {
            "@category": "high",
            "@height": "101",
            "@width": "207",
            "@_fa": "true",
            "$": "https://api.elsevier.com/content/object/eid/1-s2.0-S2468823123000809-fx16_lrg.jpg?httpAccept=%2A%2F%2A",
            "@multimediatype": "JPEG image file",
            "@type": "IMAGE-HIGH-RES",
            "@size": "4052",
            "@ref": "fx16",
            "@mimetype": "image/jpeg"
          },
          {
            "@category": "high",
            "@height": "242",
            "@width": "358",
            "@_fa": "true",
            "$": "https://api.elsevier.com/content/object/eid/1-s2.0-S2468823123000809-fx11_lrg.jpg?httpAccept=%2A%2F%2A",
            "@multimediatype": "JPEG image file",
            "@type": "IMAGE-HIGH-RES",
            "@size": "9428",
            "@ref": "fx11",
            "@mimetype": "image/jpeg"
          },
          {
            "@category": "high",
            "@height": "88",
            "@width": "197",
            "@_fa": "true",
            "$": "https://api.elsevier.com/content/object/eid/1-s2.0-S2468823123000809-fx10_lrg.jpg?httpAccept=%2A%2F%2A",
            "@multimediatype": "JPEG image file",
            "@type": "IMAGE-HIGH-RES",
            "@size": "3688",
            "@ref": "fx10",
            "@mimetype": "image/jpeg"
          },
          {
            "@category": "high",
            "@height": "330",
            "@width": "422",
            "@_fa": "true",
            "$": "https://api.elsevier.com/content/object/eid/1-s2.0-S2468823123000809-fx15_lrg.jpg?httpAccept=%2A%2F%2A",
            "@multimediatype": "JPEG image file",
            "@type": "IMAGE-HIGH-RES",
            "@size": "18287",
            "@ref": "fx15",
            "@mimetype": "image/jpeg"
          },
          {
            "@category": "high",
            "@height": "218",
            "@width": "394",
            "@_fa": "true",
            "$": "https://api.elsevier.com/content/object/eid/1-s2.0-S2468823123000809-fx14_lrg.jpg?httpAccept=%2A%2F%2A",
            "@multimediatype": "JPEG image file",
            "@type": "IMAGE-HIGH-RES",
            "@size": "9304",
            "@ref": "fx14",
            "@mimetype": "image/jpeg"
          },
          {
            "@category": "high",
            "@height": "88",
            "@width": "197",
            "@_fa": "true",
            "$": "https://api.elsevier.com/content/object/eid/1-s2.0-S2468823123000809-fx13_lrg.jpg?httpAccept=%2A%2F%2A",
            "@multimediatype": "JPEG image file",
            "@type": "IMAGE-HIGH-RES",
            "@size": "3688",
            "@ref": "fx13",
            "@mimetype": "image/jpeg"
          },
          {
            "@category": "high",
            "@height": "218",
            "@width": "329",
            "@_fa": "true",
            "$": "https://api.elsevier.com/content/object/eid/1-s2.0-S2468823123000809-fx12_lrg.jpg?httpAccept=%2A%2F%2A",
            "@multimediatype": "JPEG image file",
            "@type": "IMAGE-HIGH-RES",
            "@size": "9067",
            "@ref": "fx12",
            "@mimetype": "image/jpeg"
          },
          {
            "@category": "high",
            "@height": "1287",
            "@width": "1500",
            "@_fa": "true",
            "$": "https://api.elsevier.com/content/object/eid/1-s2.0-S2468823123000809-gr6_lrg.jpg?httpAccept=%2A%2F%2A",
            "@multimediatype": "JPEG image file",
            "@type": "IMAGE-HIGH-RES",
            "@size": "214753",
            "@ref": "gr6",
            "@mimetype": "image/jpeg"
          },
          {
            "@category": "high",
            "@height": "1284",
            "@width": "1500",
            "@_fa": "true",
            "$": "https://api.elsevier.com/content/object/eid/1-s2.0-S2468823123000809-gr7_lrg.jpg?httpAccept=%2A%2F%2A",
            "@multimediatype": "JPEG image file",
            "@type": "IMAGE-HIGH-RES",
            "@size": "201966",
            "@ref": "gr7",
            "@mimetype": "image/jpeg"
          },
          {
            "@category": "high",
            "@height": "1405",
            "@width": "1500",
            "@_fa": "true",
            "$": "https://api.elsevier.com/content/object/eid/1-s2.0-S2468823123000809-gr4_lrg.jpg?httpAccept=%2A%2F%2A",
            "@multimediatype": "JPEG image file",
            "@type": "IMAGE-HIGH-RES",
            "@size": "418930",
            "@ref": "gr4",
            "@mimetype": "image/jpeg"
          },
          {
            "@category": "high",
            "@height": "1303",
            "@width": "1500",
            "@_fa": "true",
            "$": "https://api.elsevier.com/content/object/eid/1-s2.0-S2468823123000809-gr5_lrg.jpg?httpAccept=%2A%2F%2A",
            "@multimediatype": "JPEG image file",
            "@type": "IMAGE-HIGH-RES",
            "@size": "154479",
            "@ref": "gr5",
            "@mimetype": "image/jpeg"
          },
          {
            "@category": "high",
            "@height": "1248",
            "@width": "2917",
            "@_fa": "true",
            "$": "https://api.elsevier.com/content/object/eid/1-s2.0-S2468823123000809-gr8_lrg.jpg?httpAccept=%2A%2F%2A",
            "@multimediatype": "JPEG image file",
            "@type": "IMAGE-HIGH-RES",
            "@size": "340885",
            "@ref": "gr8",
            "@mimetype": "image/jpeg"
          },
          {
            "@category": "high",
            "@height": "2751",
            "@width": "2917",
            "@_fa": "true",
            "$": "https://api.elsevier.com/content/object/eid/1-s2.0-S2468823123000809-gr9_lrg.jpg?httpAccept=%2A%2F%2A",
            "@multimediatype": "JPEG image file",
            "@type": "IMAGE-HIGH-RES",
            "@size": "739050",
            "@ref": "gr9",
            "@mimetype": "image/jpeg"
          },
          {
            "@category": "standard",
            "@_fa": "true",
            "$": "https://api.elsevier.com/content/object/eid/1-s2.0-S2468823123000809-mmc1.docx?httpAccept=%2A%2F%2A",
            "@multimediatype": "Microsoft Word file",
            "@type": "APPLICATION",
            "@size": "4052573",
            "@ref": "mmc1",
            "@mimetype": "application/word"
          },
          {
            "@category": "standard",
            "@_fa": "true",
            "$": "https://api.elsevier.com/content/object/eid/1-s2.0-S2468823123000809-am.pdf?httpAccept=%2A%2F%2A",
            "@multimediatype": "Acrobat PDF file",
            "@type": "AAM-PDF",
            "@size": "448803",
            "@ref": "am",
            "@mimetype": "application/pdf"
          }
        ]
      },
      "link": {
        "@rel": "abstract",
        "@href": "https://api.elsevier.com/content/abstract/scopus_id/85148957020"
      }
    }
  }
}