{
  "metadata": {
    "title": "Co-doping WO<ce:inf loc=post>3</ce:inf>-MoO<ce:inf loc=post>3</ce:inf> enhances the low-temperature NH<ce:inf loc=post>3</ce:inf>-SCR activity of V<ce:inf loc=post>2</ce:inf>O<ce:inf loc=post>5</ce:inf>/TiO<ce:inf loc=post>2</ce:inf> catalysts",
    "authors": "; ; ",
    "journal": "Molecular Catalysis",
    "date": "2025-07-31",
    "doi": "10.1016/j.mcat.2025.115171",
    "abstract": "",
    "uri": "https://api.elsevier.com/content/article/pii/S2468823125003566",
    "pii": "S2468823125003566"
  },
  "fulltext": {
    "full-text-retrieval-response": {
      "scopus-eid": "2-s2.0-105004361478",
      "originalText": "serial JL 315758 291210 291744 291790 291809 31 Molecular Catalysis MOLECULARCATALYSIS 2025-05-09 2025-05-09 2025-05-09 2025-05-09 2025-05-21T23:56:09 1-s2.0-S2468823125003566 S2468-8231(25)00356-6 S2468823125003566 10.1016/j.mcat.2025.115171 S300 S300.1 FULL-TEXT 1-s2.0-S2468823125X00092 2025-05-21T23:08:23.366963Z 0 0 20250701 20250731 2025 2025-05-09T04:17:37.456058Z absattachment articleinfo articlenumber articletitlenorm authfirstinitialnorm authfirstsurnamenorm cid cids contenttype copyright crossmark dateloaded dateloadedtxt datesearch datesort dateupdated dco docsubtype doctype doi eid ewtransactionid hubeid indexeddate issn issnnorm itemstage itemtransactionid itemweight openaccess openarchive pg pgfirst pii piinorm pubdateend pubdatestart pubdatetxt pubyr sectiontitle sortorder srctitle srctitlenorm srctype ssids alllist content subj subheadings suppl tomb volfirst volissue volumelist webpdf webpdfpagecount yearnav figure table body mmlmath acknowledge affil articletitle auth authfirstini authfull authkeywords authlast grantnumber grantsponsor highlightsabst orcid primabst pubtype ref specialabst 2468-8231 24688231 true 582 582 C Volume 582 17 115171 115171 115171 202507 July 2025 2025-07-01 2025-07-31 2025 Regular Papers article fla © 2025 Elsevier B.V. All rights are reserved, including those for text and data mining, AI training, and similar technologies. CODOPINGWO3MOO3ENHANCESLOWTEMPERATURENH3SCRACTIVITYV2O5TIO2CATALYSTS CHEN H 1 Introduction 2 Experimental 2.1 Preparation of catalyst 2.2 Characterization 2.3 NH3-SCR activity test 3 Results 3.1 NH3-SCR performance 3.2 Structural analysis 3.3 Acid sites 3.4 Redox properties 3.5 Surface vanadium species 4 Discussion 5 Conclusion CRediT authorship contribution statement Acknowledgements References CHEN 2018 1347 1365 C DAMMA 2019 9040349 D CHEN 2022 21474 21491 Z CHEN 2022 112693 Z CHEN 2023 126986 Z YANG 2022 1245 1256 J SHI 2023 125885 Z JAEGERS 2019 12609 12616 N CAO 2022 125262 J DONG 2025 133311 C HU 2023 120306 W LV 2024 130472 Z PU 2020 2549 2555 Y LV 2024 358 367 Z ZHANG 2012 1523 1531 Y JUNG 2024 911 924 M KRISTENSEN 2011 60 67 S CHEN 2020 1441 1452 D KWON 2019 1167 1177 D KWON 2016 315 324 D LI 2014 69 77 X TAN 2022 475 483 W ZHANG 2015 338 346 T KANG 2023 156159 T ZHU 2017 169 179 L LEE 2021 11061452 M WANG 2020 555 562 X LIAN 2015 37675 37681 Z MARBERGER 2016 11989 11994 A JIN 2010 1160 1166 R LIETTI 1999 419 435 L NOVA 1998 245 258 I CHEN 2018 639 646 H MURKUTE 2015 1224 1236 A CHEN 2017 249 259 D ZHAN 2017 199 209 S HE 2018 4637 G KWON 2015 1 12 D JIA 2022 2647 2655 Z CHOO 2000 177 188 S YU 2019 110512 X RAMIREZ 2014 14073 14081 A LI 2016 3971 3975 H HRYHA 2012 1022 1025 E LI 2020 118854 C LIU 2016 1340 1346 X KOMPIO 2017 365 377 P PUTLURU 2016 282 290 S BESSELMANN 2000 401 411 S SONG 2022 198 208 J CHENX2025X115171 CHENX2025X115171XH 2027-05-09T00:00:00.000Z 2027-05-09T00:00:00.000Z http://creativecommons.org/licenses/by-nc-nd/4.0/ © 2025 Elsevier B.V. All rights are reserved, including those for text and data mining, AI training, and similar technologies. 2025-05-10T00:56:26.780Z http://vtw.elsevier.com/data/voc/AddOnTypes/50.7/aggregated-refined National Natural Science Foundation of China NSFC National Natural Science Foundation of China http://data.elsevier.com/vocabulary/SciValFunders/501100001809 http://sws.geonames.org/1814991/ 91745116 Natural Science Foundation of Tianjin Municipal Science and Technology Commission http://data.elsevier.com/vocabulary/SciValFunders/501100010229 http://sws.geonames.org/1814991 Thank Professor Li for many suggestions during the experiment and for his great support in material characterization. Thank Professor Li for his valuable suggestions in the process of thesis writing and revision. At the same time, this work was supported by the National Natural Science Foundation of China ( 91745116 ). Thanks again to the strong support of the National Natural Science Foundation of China. https://doi.org/10.15223/policy-017 https://doi.org/10.15223/policy-037 https://doi.org/10.15223/policy-012 https://doi.org/10.15223/policy-029 https://doi.org/10.15223/policy-004 item S2468-8231(25)00356-6 S2468823125003566 1-s2.0-S2468823125003566 10.1016/j.mcat.2025.115171 315758 2025-05-21T23:08:23.366963Z 2025-07-01 2025-07-31 1-s2.0-S2468823125003566-main.pdf https://s3-eu-west-1.amazonaws.com/prod-ucs-content-store-eu-west/content/pii:S2468823125003566/MAIN/application/pdf/9a7819562adbafb31bfe100568aa4100/main.pdf main.pdf pdf true 4980744 MAIN 9 1-s2.0-S2468823125003566-main_1.png https://s3-eu-west-1.amazonaws.com/prod-ucs-content-store-eu-west/content/pii:S2468823125003566/PREVIEW/image/png/7eb0153e301fb7caf2c61243bcad59ce/main_1.png main_1.png png 58708 928 656 IMAGE-WEB-PDF 1 1-s2.0-S2468823125003566-gr5.jpg https://s3-eu-west-1.amazonaws.com/prod-ucs-content-store-eu-west/content/pii:S2468823125003566/gr5/DOWNSAMPLED/image/jpeg/dfc4109af87b8b81e733aeed87266d43/gr5.jpg gr5 gr5.jpg jpg 38549 273 375 IMAGE-DOWNSAMPLED 1-s2.0-S2468823125003566-gr6.jpg https://s3-eu-west-1.amazonaws.com/prod-ucs-content-store-eu-west/content/pii:S2468823125003566/gr6/DOWNSAMPLED/image/jpeg/f14fb61c870193ad6f91b341d614bb5d/gr6.jpg gr6 gr6.jpg jpg 47291 272 376 IMAGE-DOWNSAMPLED 1-s2.0-S2468823125003566-gr7.jpg https://s3-eu-west-1.amazonaws.com/prod-ucs-content-store-eu-west/content/pii:S2468823125003566/gr7/DOWNSAMPLED/image/jpeg/cd0b0ca11a6feb01b694837b3cd685ae/gr7.jpg gr7 gr7.jpg jpg 87698 272 678 IMAGE-DOWNSAMPLED 1-s2.0-S2468823125003566-gr8.jpg https://s3-eu-west-1.amazonaws.com/prod-ucs-content-store-eu-west/content/pii:S2468823125003566/gr8/DOWNSAMPLED/image/jpeg/a67426656d65c0c7ba279917ec4a4fd7/gr8.jpg gr8 gr8.jpg jpg 73854 273 678 IMAGE-DOWNSAMPLED 1-s2.0-S2468823125003566-gr1.jpg https://s3-eu-west-1.amazonaws.com/prod-ucs-content-store-eu-west/content/pii:S2468823125003566/gr1/DOWNSAMPLED/image/jpeg/c7429149a19baa42859c776af6daf2f5/gr1.jpg gr1 gr1.jpg jpg 41208 335 565 IMAGE-DOWNSAMPLED 1-s2.0-S2468823125003566-gr2.jpg https://s3-eu-west-1.amazonaws.com/prod-ucs-content-store-eu-west/content/pii:S2468823125003566/gr2/DOWNSAMPLED/image/jpeg/f44cdf79f57754c41e73d675319e5d79/gr2.jpg gr2 gr2.jpg jpg 195843 909 678 IMAGE-DOWNSAMPLED 1-s2.0-S2468823125003566-ga1.jpg https://s3-eu-west-1.amazonaws.com/prod-ucs-content-store-eu-west/content/pii:S2468823125003566/ga1/DOWNSAMPLED/image/jpeg/c7cd82d6eb305412851f0a2a010fee90/ga1.jpg ga1 true ga1.jpg jpg 34912 190 500 IMAGE-DOWNSAMPLED 1-s2.0-S2468823125003566-gr3.jpg https://s3-eu-west-1.amazonaws.com/prod-ucs-content-store-eu-west/content/pii:S2468823125003566/gr3/DOWNSAMPLED/image/jpeg/32decbf85799a633cdc6dff45738fea4/gr3.jpg gr3 gr3.jpg jpg 41586 319 376 IMAGE-DOWNSAMPLED 1-s2.0-S2468823125003566-gr4.jpg https://s3-eu-west-1.amazonaws.com/prod-ucs-content-store-eu-west/content/pii:S2468823125003566/gr4/DOWNSAMPLED/image/jpeg/db06d6b69c7b170d4813aa1f48a22bf8/gr4.jpg gr4 gr4.jpg jpg 41905 312 376 IMAGE-DOWNSAMPLED 1-s2.0-S2468823125003566-sc1.jpg https://s3-eu-west-1.amazonaws.com/prod-ucs-content-store-eu-west/content/pii:S2468823125003566/sc1/DOWNSAMPLED/image/jpeg/66fc33cafa73c2d32abb43c28fd5a250/sc1.jpg sc1 sc1.jpg jpg 50242 259 678 IMAGE-DOWNSAMPLED 1-s2.0-S2468823125003566-gr5.sml https://s3-eu-west-1.amazonaws.com/prod-ucs-content-store-eu-west/content/pii:S2468823125003566/gr5/THUMBNAIL/image/gif/6c5b5f5523ef4a9a58eba38536a367ef/gr5.sml gr5 gr5.sml sml 14776 159 219 IMAGE-THUMBNAIL 1-s2.0-S2468823125003566-gr6.sml https://s3-eu-west-1.amazonaws.com/prod-ucs-content-store-eu-west/content/pii:S2468823125003566/gr6/THUMBNAIL/image/gif/a1e6bf8b7c1a8fae3a89b2bf9361cd97/gr6.sml gr6 gr6.sml sml 13027 158 219 IMAGE-THUMBNAIL 1-s2.0-S2468823125003566-gr7.sml https://s3-eu-west-1.amazonaws.com/prod-ucs-content-store-eu-west/content/pii:S2468823125003566/gr7/THUMBNAIL/image/gif/1ced1d165ccdc4d8c83e047127c514cc/gr7.sml gr7 gr7.sml sml 11720 88 219 IMAGE-THUMBNAIL 1-s2.0-S2468823125003566-gr8.sml https://s3-eu-west-1.amazonaws.com/prod-ucs-content-store-eu-west/content/pii:S2468823125003566/gr8/THUMBNAIL/image/gif/a93a4cdeae66d340a119ac028339d2d3/gr8.sml gr8 gr8.sml sml 10098 88 219 IMAGE-THUMBNAIL 1-s2.0-S2468823125003566-gr1.sml https://s3-eu-west-1.amazonaws.com/prod-ucs-content-store-eu-west/content/pii:S2468823125003566/gr1/THUMBNAIL/image/gif/7fbae1ff44fad4f27818bd836238b1de/gr1.sml gr1 gr1.sml sml 11962 130 219 IMAGE-THUMBNAIL 1-s2.0-S2468823125003566-gr2.sml https://s3-eu-west-1.amazonaws.com/prod-ucs-content-store-eu-west/content/pii:S2468823125003566/gr2/THUMBNAIL/image/gif/704a1dd1d1595e3d7842c22c8997be0b/gr2.sml gr2 gr2.sml sml 11986 164 122 IMAGE-THUMBNAIL 1-s2.0-S2468823125003566-ga1.sml https://s3-eu-west-1.amazonaws.com/prod-ucs-content-store-eu-west/content/pii:S2468823125003566/ga1/THUMBNAIL/image/gif/b548944230c4d2767f8e42f5155bfb38/ga1.sml ga1 true ga1.sml sml 10191 83 219 IMAGE-THUMBNAIL 1-s2.0-S2468823125003566-gr3.sml https://s3-eu-west-1.amazonaws.com/prod-ucs-content-store-eu-west/content/pii:S2468823125003566/gr3/THUMBNAIL/image/gif/f86f036c8fba04f936b360e18725ffcc/gr3.sml gr3 gr3.sml sml 11242 164 193 IMAGE-THUMBNAIL 1-s2.0-S2468823125003566-gr4.sml https://s3-eu-west-1.amazonaws.com/prod-ucs-content-store-eu-west/content/pii:S2468823125003840/gr4/THUMBNAIL/image/gif/c02734d6c2c0a6f632508a2cb1457120/gr4.sml gr4 gr4.sml sml 10776 164 197 IMAGE-THUMBNAIL 1-s2.0-S2468823125003566-sc1.sml https://s3-eu-west-1.amazonaws.com/prod-ucs-content-store-eu-west/content/pii:S2468823125003840/sc1/THUMBNAIL/image/gif/22280d638f7f6b6da11d5ab9a4367202/sc1.sml sc1 sc1.sml sml 10295 84 219 IMAGE-THUMBNAIL 1-s2.0-S2468823125003566-gr5_lrg.jpg https://s3-eu-west-1.amazonaws.com/prod-ucs-content-store-eu-west/content/pii:S2468823125003566/HIGHRES/image/jpeg/49d8854f6a0eb0d09ec071884d0d92e1/gr5_lrg.jpg gr5 gr5_lrg.jpg jpg 274545 1208 1662 IMAGE-HIGH-RES 1-s2.0-S2468823125003566-gr6_lrg.jpg https://s3-eu-west-1.amazonaws.com/prod-ucs-content-store-eu-west/content/pii:S2468823125003566/HIGHRES/image/jpeg/254ad6aff08aa03254c258a045fb37da/gr6_lrg.jpg gr6 gr6_lrg.jpg jpg 282706 1206 1667 IMAGE-HIGH-RES 1-s2.0-S2468823125003566-gr7_lrg.jpg https://s3-eu-west-1.amazonaws.com/prod-ucs-content-store-eu-west/content/pii:S2468823125003566/HIGHRES/image/jpeg/387b07204310b1f2875d6d60e6af4715/gr7_lrg.jpg gr7 gr7_lrg.jpg jpg 616044 1202 3000 IMAGE-HIGH-RES 1-s2.0-S2468823125003566-gr8_lrg.jpg https://s3-eu-west-1.amazonaws.com/prod-ucs-content-store-eu-west/content/pii:S2468823125003566/HIGHRES/image/jpeg/f7f04d642cccd5207072f0fa8659371b/gr8_lrg.jpg gr8 gr8_lrg.jpg jpg 436466 1210 3000 IMAGE-HIGH-RES 1-s2.0-S2468823125003566-gr1_lrg.jpg https://s3-eu-west-1.amazonaws.com/prod-ucs-content-store-eu-west/content/pii:S2468823125003566/HIGHRES/image/jpeg/51bbf1598cbcb29be92beecc6ca347d7/gr1_lrg.jpg gr1 gr1_lrg.jpg jpg 277596 1483 2500 IMAGE-HIGH-RES 1-s2.0-S2468823125003566-gr2_lrg.jpg https://s3-eu-west-1.amazonaws.com/prod-ucs-content-store-eu-west/content/pii:S2468823125003840/HIGHRES/image/jpeg/77e848d03467098b339d2ea7c4416b12/gr2_lrg.jpg gr2 gr2_lrg.jpg jpg 1359064 4024 3000 IMAGE-HIGH-RES 1-s2.0-S2468823125003566-ga1_lrg.jpg https://s3-eu-west-1.amazonaws.com/prod-ucs-content-store-eu-west/content/pii:S2468823125003566/HIGHRES/image/jpeg/513f1901aba987e05dd4c3f544a62021/ga1_lrg.jpg ga1 true ga1_lrg.jpg jpg 221074 842 2213 IMAGE-HIGH-RES 1-s2.0-S2468823125003566-gr3_lrg.jpg https://s3-eu-west-1.amazonaws.com/prod-ucs-content-store-eu-west/content/pii:S2468823125003840/HIGHRES/image/jpeg/0303be6a2e1b67f2f2848a39b23cbbd3/gr3_lrg.jpg gr3 gr3_lrg.jpg jpg 254232 1415 1667 IMAGE-HIGH-RES 1-s2.0-S2468823125003566-gr4_lrg.jpg https://s3-eu-west-1.amazonaws.com/prod-ucs-content-store-eu-west/content/pii:S2468823125003840/HIGHRES/image/jpeg/2d5a8e04da6cdbdca49d395bc85e861b/gr4_lrg.jpg gr4 gr4_lrg.jpg jpg 244925 1384 1667 IMAGE-HIGH-RES 1-s2.0-S2468823125003566-sc1_lrg.jpg https://s3-eu-west-1.amazonaws.com/prod-ucs-content-store-eu-west/content/pii:S2468823125003840/HIGHRES/image/jpeg/135ed849a7d585c107f026fcd16102fe/sc1_lrg.jpg sc1 sc1_lrg.jpg jpg 346910 1148 3000 IMAGE-HIGH-RES 1-s2.0-S2468823125003566-si1.svg https://s3-eu-west-1.amazonaws.com/prod-ucs-content-store-eu-west/content/pii:S2468823125003566/image/svg+xml/6b421787aaa5cc7b1571b6676d695220/si1.svg si1 si1.svg svg 11675 ALTIMG 1-s2.0-S2468823125003566-si2.svg https://s3-eu-west-1.amazonaws.com/prod-ucs-content-store-eu-west/content/pii:S2468823125003566/image/svg+xml/e1eed4f7c6e86c11151a4b20eb9fc2e5/si2.svg si2 si2.svg svg 13551 ALTIMG 1-s2.0-S2468823125003566-si3.svg https://s3-eu-west-1.amazonaws.com/prod-ucs-content-store-eu-west/content/pii:S2468823125003566/image/svg+xml/8c0f00aee444a9fce160e39413c72ca5/si3.svg si3 si3.svg svg 16783 ALTIMG MCAT 115171 115171 S2468-8231(25)00356-6 10.1016/j.mcat.2025.115171 Elsevier B.V. Fig. 1 Schematic diagram of fixed-bed reactor system. Fig 1 Fig. 2 The curves of NO and NH3 conversion rates and N2 selectivity in NH3-SCR reaction of changes in WO3 content (a) (c) (e)and changes in MoO3 content (b) (d) (f). Fig 2 Fig. 3 XRD patterns of V/Ti, VMo5.5/Ti, VW10Mo5.5/Ti, VW15Mo5.5/Ti catalysts. Fig 3 Fig. 4 N2 adsorption-desorption curves of V/Ti, VMo5.5/Ti, VW10Mo5.5/Ti, VW15Mo5.5/Ti catalysts. Fig 4 Fig. 5 NH3-TPD curves of vanadium-titanium-based catalysts. Fig 5 Fig. 6 H2-TPR of vanadium-titanium-based catalysts. Fig 6 Fig. 7 XPS spectra for (a) O 1s, (b) V 2p of the vanadium-titanium-based catalysts. Fig 7 Fig. 8 Raman spectra of vanadium-titanium-based catalysts samples in a range of (a)100-1100 cm−1(b)900-1100 cm−1. Fig 8 Scheme 1 The possible mechanism over the VMo5.5/Ti and VW10Mo5.5/Ti catalyst. Scheme 1 Table 1 The surface area, pore volume, and micropore volume ratio of vanadium-titanium-based catalysts. Table 1 Sample Surface area (m2/g) Pore volume (ml/g) Pore diameter (nm) V/Ti 95.1 0.39 16.28 VMo5.5/Ti 90.3 0.35 15.36 VW10Mo5.5/Ti 86.1 0.30 15.71 VW15Mo5.5/Ti 84.7 0.29 15.33 Table 2 The peak area ratio and NH3 adsorption capacity of vanadium-titanium-based catalysts. Table 2 Sample NH3 adsorption capacity (mmol/g) Ⅰ Ⅱ Ⅲ Total V/Ti 0.0487 0.1434 0.3059 0.4979 VMo5.5/Ti 0.1126 0.2465 0.1534 0.5126 VW5Mo5.5/Ti 0.0594 0.2700 0.2436 0.5731 VW10Mo5.5/Ti 0.0336 0.3065 0.2595 0.5996 VW15Mo5.5/Ti 0.1010 0.2569 0.1785 0.5364 Table 3 H2 consumption of vanadium-titanium-based catalysts. Table 3 Sample V/Ti VMo5.5/Ti VW5Mo5.5/Ti VW10Mo5.5/Ti VW15Mo5.5/Ti H2 consumption (mmol/g) 1.0855 1.4424 1.9591 2.5850 2.1120 Research Paper Co-doping WO3-MoO3 enhances the low-temperature NH3-SCR activity of V2O5/TiO2 catalysts Huayan Chen Writing – review & editing Supervision a Qingcai Liu Writing – review & editing Writing – original draft a Yuan Li Writing – review & editing Supervision a b ⁎ Jian Gao Validation Supervision a b Xiaoyao Tan Validation Supervision a b Yifan Cao Validation Supervision a Jian Zhang Validation Supervision a a State Key Laboratory of Separation Membranes and Membrane Processes, Tianjin 300387, China State Key Laboratory of Separation Membranes and Membrane Processes Tianjin 300387 China aState Key Laboratory of Separation Membranes and Membrane Processes, Tianjin 300387, China b School of Chemical Engineering and Technology, Tiangong University, Tianjin 300387, China School of Chemical Engineering and Technology Tiangong University Tianjin 300387 China bSchool of Chemical Engineering and Technology, Tiangong University, Tianjin 300387, China ⁎ Corresponding author at: School of Chemical Engineering and Technology, Tiangong University, Tianjin 300387, China. School of Chemical Engineering and Technology Tiangong University Tianjin 300387 China To improve the low-temperature performance of V2O5/TiO2 catalysts in the selective catalytic reduction of ammonia (NH3-SCR), tungsten (W) and molybdenum (Mo) were incorporated into the V2O5/TiO2 catalyst. A series of V-W-Mo/TiO2 catalysts were synthesized using the incipient wetness impregnation method. Advanced characterization techniques, including Raman spectroscopy, X-ray photoelectron spectroscopy (XPS), and NH3 temperature-programmed desorption (NH3-TPD), were utilized to examine the effects of WO3 and MoO3 co-doping on the performance of V/Ti catalysts. The findings reveal that the VW10Mo5.5/TiO2 catalyst demonstrated exceptional performance, maintaining a NO conversion rate above 80 % across a broad temperature range of 190 °C to 400 °C. In comparison, the V2O5/TiO2 catalyst required a temperature of 230 °C to achieve the same NO conversion rate, indicating that the co-doping of WO3 and MoO3 lowered the temperature for efficient NO conversion by 40 °C. Raman spectroscopy and XPS analyses revealed that the co-doping of WO3 and MoO3 increased the proportion of V4+ species and chemically adsorbed oxygen on the vanadium-titanium-based catalyst, which enhances low-temperature NH3-SCR activity. Furthermore, the co-doping of WO3 and MoO3 significantly affected the migration and aggregation of vanadium species, converting surface monomeric vanadium oxide species into surface polymeric vanadium oxide species. Polymeric vanadium oxide species are crucial for enhancing the NH3-SCR activity of the catalyst, with a high proportion of these species significantly boosting the NH3-SCR activity under low-temperature conditions. Graphical abstract Image, graphical abstract Keywords V2O5/TiO2 catalyst WO3 MoO3 NH3-SCR Catalytic performance Data availability I have shared the link to my data at the Attach File step. 1 Introduction With the tightening of environmental regulations and the acceleration of industrialization, vanadium-titanium-based catalysts have played a pivotal role in reducing atmospheric pollution due to their superior denitrification performance [1–3]. Particularly in selective catalytic reduction (SCR) technology, they efficiently convert nitrogen oxides (NOx) into harmless nitrogen and water vapor, which is of great significance for controlling air pollution and protecting the environment [4–6]. However, despite the excellent performance of vanadium-titanium-based catalysts in the temperature range of 300-400 °C, their denitrification efficiency at low temperatures (<300 °C) still needs improvement, presenting a significant challenge in current research [7]. The promoting effect of tungsten oxide (WO3) on V2O5/TiO2 catalysts has been extensively studied [8–15]. Zhihui Lv and colleagues investigated the positive role of WO3 in the reduction of NOx by supported vanadium catalysts, confirming that WO3 occupies the surface of TiO2, reducing the available surface sites for V2O5 anchoring, thereby promoting the aggregation of vanadium oxide species and increasing the number of Brønsted acid sites [14]. Jaegers and his team revealed the structural impact of WO3 on supported V2O5/TiO2 catalysts, suggesting that non-reactive WO3 induces the formation of oligomeric vanadium oxide species, which are proposed as reactive sites for NOx reduction [8]. Similarly, molybdenum oxide (MoO3) has been demonstrated to be a catalyst promoter for NH3-SCR reactions due to its ability to accelerate electron transfer and improve surface acidity [16–22]. Min Gie Jung and colleagues investigated the effects of incorporating Sb, La, Ce, and Mo additives into high vanadium-content V2O5-WO3/TiO2 catalysts on NH3-SCR, proving that Sb, La, Ce, and Mo enhance the reaction activity, which is attributed to the increased V4+(3+) ratio and the enhancement of surface-adsorbed oxygen species [16]. Kobayashi and others reported that by incorporating MoO3 into TiO2-SiO2, highly active polymeric vanadium oxide species are formed, which exhibit significant activity at low temperatures [17]. Previous studies have demonstrated that single doping with WO3 or MoO3 alters the acid amount and acid strength of V2O5/TiO2 catalysts, which significantly influence catalytic performance. In this study, we investigated the co-doping of WO3 and MoO3 to expand the regulation range of acid amount and acid strength in V2O5/TiO2 catalysts by adjusting the dosage and ratio of WO3 and MoO3, thereby improving denitration performance. Moreover, single doping with WO3 or MoO3 was found to have a dispersion threshold; beyond this critical threshold, WO3 or MoO3 tended to agglomerate, forming crystalline phases that reduced the acid amount. However, co-doping with WO3 and MoO3 increased the loading of dopants while maintaining a highly dispersed state, thereby enabling precise control over the acid amount, acid strength, and active sites of V2O5/TiO2 catalysts. This paper prepared V2O5-WO3-MoO3/TiO2 catalysts using the incipient wetness impregnation method and adjusted the ratio of WO3 to MoO3 in the catalysts. The NH3-SCR performance was tested, and characterization techniques such as Raman spectroscopy, XPS, N2 adsorption-desorption, NH3-TPD, and H2-TPR were used to analyze their physicochemical properties. This allows researchers to better understand the physicochemical properties of these catalysts, thereby providing a scientific basis for further optimization of their denitrification performance. 2 Experimental 2.1 Preparation of catalyst A series of V2O5-WO3-MoO3/TiO2 catalysts were prepared by the incipient wetness impregnation method. The content of V2O5 is 3.5 wt%. A certain amount of ammonium metavanadate (NH3VO3) (99 %, Macklin), ammonium metatungstate ((NH4)10H2(W2O7)6) (analytical purity, Damao), and ammonium molybdate ((NH)6Mo7O24) (99 %) are dissolved in deionized water and impregnated into TiO2 (97 %) to prepare. Dry the obtained sample overnight at 100 °C and calcine at 500 °C for 3 hours. A series of VWxMoy/TiO2 catalysts with different doping ratios of WO3 and MoO3 were synthesized, where x and y represent the mass fractions of WO3 and MoO3, respectively. For example, VW10Mo5.5/TiO2 corresponds to a catalyst containing 10 wt% WO3 and 5.5 wt% MoO3. 2.2 Characterization The Rigaku Ultima IV X-ray diffractometer (XRD) (Rigaku, Japan) was used to characterize the crystal structure of the catalyst. The detection parameters were: scanning voltage 40 kV, scanning current 150 mA, sample scanning speed: 5°/min, and angle range: 20°∼80°. Autosorb-IQ-C-MP automatic physical-chemical adsorption instrument was used to determine the N2 adsorption-desorption isotherms and pore size distribution of the catalyst. NH3-TPD and H2-TPR were measured by a Micrometrics AutoChem2920II chemisorption instrument. NH3-TPD test protocol: a sample mass of 500 mg was used. The sample was first heated to 500 °C in helium at a heating rate of 10 °C/min and held for 2 hours to remove impurities. Ammonia adsorption was conducted at 80 °C using 20 % NH3/He for 60 minutes. The sample was then purged with argon at 80 °C for 30 minutes, followed by heating to 600 °C in nitrogen at a heating rate of 10 °C/min. H2-TPR test protocol: a sample mass of 500 mg was used. The sample was first heated to 500 °C in helium at a heating rate of 10 °C/min and held for 2 hours to remove impurities. The temperature was then lowered to 100 °C, and the sample was purged with He for an additional 30 minutes. Subsequently, the sample was heated to 900 °C in 10 % H2/He. XPS was performed on a NEXSA (Thermos Fisher, USA) X-ray photoelectron spectrometer to determine the elemental composition of the catalyst surface. 2.3 NH3-SCR activity test The NH3-SCR denitrification performance was assessed in a fixed-bed reactor system (Fig. 1 ), comprising three modules: (1) gas distribution unit, (2) tubular quartz reactor (10 mm inner diameter), and (3) online flue gas analyzer. Gas concentrations (NO, NO2, N2O, CO2, NH3 ,H2O) were tracked in real time using an MKS FTIR analyzer. The simulated flue gas contained 2000 ppm NO, 2000 ppm NH3, 5 % O2, 5 % CO2, 5 % H2O and N2 as balance gas. Experiments were performed at a gas hourly space velocity (GHSV) of 14,000 h⁻¹, with temperature programmed from 100 °C to 400 °C (heating rate: 5 °C·min⁻¹). NO conversion and NH3 conversion were calculated as: X N O ( % ) = [ N O ] i n − [ N O ] o u t [ N O ] i n × 100 % X N H 3 ( % ) = [ N H 3 ] i n − [ N H 3 ] o u t [ N H 3 ] i n × 100 % N 2 S e l = 1 − [ N O 2 ] o u t + 2 [ N 2 O ] o u t [ N O ] i n + [ N H 3 ] i n − [ N O ] o u t − [ N H 3 ] o u t × 100 % where: [NO]in, [NH3]in: Inlet concentrations (ppm) [NO]out, [NH3]out: Outlet concentrations (ppm) 3 Results 3.1 NH3-SCR performance As shown in Fig. 2 (a), under 150 – 400 °C, GHSV = 14,000 h⁻¹ conditions, the V/Ti catalyst achieved 80 % NO conversion at 230 °C, demonstrating moderate-temperature activity but limited performance below 200 °C. MoO3 doping significantly enhanced low-temperature activity, reducing the 80 % NO conversion threshold (T80) to 198 °C. Subsequent WO3 co-doping further broadened the operational temperature window and shifted its lower limit with increasing WO3 loading. The optimized VW10Mo5.5/Ti catalyst exhibited >80 % NO conversion across 190–400 °C, showcasing superior low-temperature performance (Fig. 2(b)). However, an excessively high WO3 loading (e.g., 15 wt%) led to a decrease in NO conversion rate, indicating that there was an optimal range for the WO3 loading amount. Systematic MoO3 content optimization (Fig. 2(c)) revealed that the T80 values for VW10/Ti (0 wt% MoO3) and VW10Mo10/Ti (10 wt% MoO3) were 210 °C and 209 °C, respectively. In contrast, the VW10Mo5.5/Ti catalyst achieved T80 at 190 °C, confirming that 5.5 wt% MoO3 represents the optimal doping level for maximizing low-temperature efficiency. Fig. 2(e) and (f) presented the N2 selectivity curves of vanadium-titanium-based catalysts with varying W and Mo contents. The results showed that samples doped with WO3 and MoO3 exhibited excellent N₂ selectivity across the temperature range of 150-400 °C, consistently maintaining selectivity levels above 96 %. 3.2 Structural analysis Through in-depth analysis of the XRD patterns in Fig. 3 , it is observed that the four catalysts exhibit highly consistent characteristic diffraction peaks at 25.24°, 37.8°, 48.06°, and 62.72°. By comparing with the standard JCPDS card for anatase TiO2 (PDF#44-0477), these peaks are identified to correspond to the (101), (004), (200), and (204) crystal planes of anatase TiO2, respectively, confirming the dominant anatase phase in all catalysts [23–25]. Notably, despite the introduction of V, W, and Mo oxide promoters into the catalyst system, no characteristic diffraction peaks of V2O5 or MoO3 were detected in any samples except for the VW15Mo5.5/Ti sample. This absence may be attributed to either the loading amounts of these oxides being below the detection limit of X-ray diffraction or their existence as highly dispersed amorphous species on the TiO2 support surface [24]. Further investigation revealed that when the WO3 doping level reached a critical value (as exemplified by the VW15Mo5.5/Ti sample), distinct diffraction peaks emerged at 23.86° and 34.02°, which corresponded to the (002) and (202) crystal planes of WO3 (PDF card #43-1035), respectively. This phenomenon indicated that excessive doping induced localized aggregation of WO3, leading to crystalline phase formation. At lower loading levels, W species tended to atomically disperse or form ultra-small nanoclusters uniformly distributed across the TiO2 surface. However, when the loading exceeded the monolayer dispersion capacity of the support, surplus W species underwent lattice migration and aggregation, ultimately crystallizing into WO3 particles. N2 adsorption-desorption analysis was systematically performed on the four samples to investigate their textural properties, with the experimental results presented in Fig. 4 . Detailed examination of the N2 physisorption isotherms revealed that all samples exhibited characteristic Type IV isotherms with H3-type hysteresis loops [26]. This distinctive combination conclusively demonstrates the existence of well-developed mesoporous structures in the catalysts - a crucial feature for catalytic applications as it promotes abundant active sites and facilitates efficient mass transport during reactions [27]. The specific surface area of the V/Ti catalyst was measured to be 95.1 m2/g. Upon doping with MoO3 and WO3, a decreasing trend was observed in the specific surface area, pore volume, and pore size. This suggests that MoO3 and WO3 may exist as oxide nanoparticles attached to the inner walls, leading to the reduction in specific surface area, pore volume, and pore size, as shown in Table 1 . Of particular interest was the VW10Mo5.5/Ti catalyst, which exhibited the most promising NH3-SCR performance despite exhibiting relatively moderate textural parameters (surface area = 86.1 m2g⁻¹, pore volume = 0.30 cm3 g⁻¹). This apparent paradox suggests that the remaining accessible surface area in VW10Mo5.5/Ti remains sufficient to sustain exceptional catalytic efficiency. 3.3 Acid sites Fig. 5 displays the NH3-TPD profiles of the vanadium-titanium catalyst series, revealing three distinct desorption peaks between 100-600 °C. The low-temperature peak (Peak I) corresponded to NH3 adsorbed on weak acid sites, including physically adsorbed NH3, while the medium-temperature peak (Peak II) was attributed to NH3 bound to medium acid sites. The high-temperature peak (Peak III) originated from NH3 associated with strong acid sites [28–30]. Experimental characterization showed that the introduction of MoO3 increased the amount of medium and weak acid sites while reducing that of strong acid sites, resulting in an overall increase in total acidity, consistent with previous reports [31,32]. When MoO3 and WO3 were co-doped, compared with the V2O5/TiO2 catalyst, the peak II area corresponding to the medium acid sites significantly increased, indicating that the introduction of MoO3 and WO3 enhanced the medium acid amount of the catalyst, thereby improving its low-temperature NH3 adsorption capacity. Meanwhile, the desorption peak temperature of peak III, corresponding to the strong acid sites, shifted toward lower temperatures, suggesting that the co-doping altered the distribution of strong acid sites and reduced the desorption energy barrier of NH3 on these sites, making it easier for NH3 to be activated at low temperatures and participate in the reaction. Notably, when the MoO3 content reached a threshold value, a further increase in WO3 loading could additionally elevate the acid amount. However, NH3 adsorption capacity showed a non-linear relationship with WO3 loading - initially increasing then decreasing at higher concentrations (15 wt%). As quantified through Gaussian deconvolution in Table 2 , the NH3 adsorption capacities followed the order: VW10Mo5.5/Ti > VW5Mo5.5/Ti > VW15Mo5.5/Ti > VMo5.5/Ti. The optimal WO3 loading (10 wt%) in VW10Mo5.5/Ti achieved maximum NH3 adsorption capacity, which correlated with enhanced low-temperature NH3-SCR activity. The capacity reduction at 15 wt% WO3 likely stemmed from WO3 agglomeration and crystalline WO3 formation, as supported by complementary BET surface area measurements and XRD patterns discussed earlier. This particle aggregation phenomenon reduced effective surface area and consequently diminished NH3 adsorption capability. 3.4 Redox properties The reducibility of vanadium-titanium-based catalysts with varying WO3 loadings was systematically investigated by H2-TPR analysis (Fig. 6 ). Five distinct reduction peaks were observed in the temperature range of 300-900 °C, each corresponding to specific redox processes. Peak I (400-450 °C) was attributed to the reduction of surface-isolated V5+ species, as previously documented in literature. Peak II (450-500 °C) corresponded to the Ti4+→Ti3+ reduction process. The broad Peak III centered at 600 °C represented overlapping reduction events involving both the reduction of polymeric V5+ species and the sequential reductions of Mo6+→Mo4+ and W6+→W4+. Subsequent high-temperature reductions were observed as Peak IV (750-800 °C) for Mo4+→Mo0 and Peak V (800-850 °C) for W4+→W0 [33,34]. A notable shift in reduction temperatures was observed with increasing WO3 content. The VW10Mo5.5/Ti catalyst exhibited the most optimal reducibility, exhibited the lowest peak center temperatures (Peak I: 399 °C, Peak II: 462 °C, Peak III: 575 °C, Peak IV: 782 °C, Peak V: 803 °C). This enhanced reducibility, particularly in the critical low-temperature region below 600 °C, strongly correlates with its superior low-temperature NH3-SCR performance [35,36]. The hydrogen consumption quantification revealed a progressive increase in H2 consumption with WO3 loading, reaching maximum value of 2.5850 mmol/g for VW10Mo5.5/Ti. However, when WO3 loading exceeded 15 wt%, both reduction temperatures and H2 consumption exhibited counterintuitive trends – the former shifted to higher temperatures while the latter decreased significantly, as shown in Table 3 . This reversal suggested that excessive WO3 doping induced agglomeration of tungsten species, forming bulk-like WO3 crystallites that reduced interfacial contact and hindered hydrogen accessibility. The evolution of peak intensities provides further mechanistic insights. With increasing WO3 content, the reduction peak intensity of surface-isolated V5+ (Peak I) species gradually decreases, while the intensity of Peak III showed a significant enhancement. This observation suggested the potential formation of surface polymeric vanadium oxide species. It was widely recognized that polymeric vanadyl species served as the predominant active sites, playing a decisive role in governing low-temperature SCR activity [37–40]. This proposed structure-activity relationship will be further corroborated by Raman spectroscopic analysis in subsequent sections. To investigate the surface vanadium species evolution and electronic states of vanadium-titanium-based catalysts, X-ray photoelectron spectroscopy (XPS) analyses were performed. Fig. 7 (a) and 7(b) display the O 1s and V 2p core-level spectra, respectively. The O 1s spectra exhibited two distinct peaks: lattice oxygen (Oβ) at 530.5–530.8 eV and surface-adsorbed oxygen (Oα) at 532.0–532.3 eV [41]. Oα demonstrated superior activity owing to its enhanced electron transfer capability, which promoted NO oxidation to NO2 and facilitated active intermediate formation in the NH3-SCR cycle [42,43]. Consequently, higher Oα content significantly improved low-temperature NH3-SCR performance. The Oα/(Oα+Oβ) ratios follow the order: V/Ti (21.1%) < VMo5.5/Ti (25.5%) < VW10Mo5.5/Ti (27.1 %) < VW15Mo5.5/Ti (29.5 %) < VW10Mo5.5/Ti (30.3 %). Compared with V/Ti, the introduction of 5.5 wt% MoO3 elevated the Oα ratio to 25.5 %, while co-doping with 10 wt% WO3 maximized this value (30.3 %), correlating with optimal low-temperature activity. This enhancement arose from MoO3 and WO3 modulating oxygen speciation, where moderate doping increased surface-adsorbed oxygen content and redox capacity. However, excessive WO3 loading (15 wt%) reduced the Oα ratio to 29.5 %, likely due to tungsten agglomeration and surface site blockage. The V 2p spectra revealed two peaks at 514–521 eV. Deconvolution of the V 2p region yielded components at 518.2–518.7 eV (V5+) and 516.8–517.0 eV (V4+) [44]. The reduced V4+ species, with excess electrons, enhanced surface electron mobility and promoted O2 adsorption/activation, critical for low-temperature SCR reactions [45].The V4+/(V4++V5+) ratios increased sequentially: V/Ti (66.6 %) < VMo5.5/Ti (77.4 %) < VW5Mo5.5/Ti (79.0 %) < VW10Mo5.5/Ti (80.5 %), aligning with their NH3-SCR activity trends. This confirmed that synergistic WO3-MoO3 doping optimized vanadium redox properties through structural interactions. At 15 wt% WO3 loading (VW15Mo5.5/Ti), the ratio declined to 78.1 %, indicating that excessive doping induced active site aggregation, reduced reactant-catalyst contact area, and diminished catalytic efficiency. 3.5 Surface vanadium species As shown in Fig. 8 , the Raman results indicated that all catalysts exhibited five bands at 636 cm⁻¹, 514 cm⁻¹, 395 cm⁻¹, 196 cm⁻¹, and 143 cm⁻¹, which were attributed to signals from anatase TiO2 [46]. Further examination in the range of 900-1100 cm⁻¹ revealed weak but distinct signals, which could be deconvoluted into three peaks. The bands at 1035 cm⁻¹ and 930 cm⁻¹ corresponded to monomeric vanadium oxide species and polymeric vanadium oxide species, respectively, while the peak at 969 cm⁻¹ was attributed to the Raman signal of Mo=O species [47–50]. Analysis of the Raman spectra of the four samples showed that the V/Ti catalyst primarily exhibited signals from monomeric surface vanadium oxide species. Upon the addition of Mo species, a signal for Mo=O species appeared at 969 cm⁻¹, and a signal for polymeric vanadium oxide species emerged at 930 cm⁻¹. This indicated that the addition of MoO3 indeed promoted the formation of polymeric vanadium oxide species on the surface, which was consistent with the NH3-TPD results. When both W and Mo species were introduced, a more intense signal for polymeric vanadium oxide species was observed at 930 cm⁻¹. This suggested that the incorporation of W and Mo species further promoted the aggregation of monomeric surface vanadium oxide species into polymeric forms, likely due to the partial occupation of TiO2 surface sites by W and Mo species, which caused vanadium species to come into closer proximity. However, when the W content in the catalyst reached 15 wt%, the signal for polymeric vanadium oxide species began to weaken. Polymeric vanadium oxide species exhibited higher NH3-SCR activity compared to monomeric surface vanadium oxide species. The increased number of polymeric vanadium oxide species in the VW10Mo5.5/Ti catalyst contributed to its superior low-temperature NH3-SCR activity. 4 Discussion The synergistic co-doping of WO3 and MoO3 effectively enhanced the low-temperature NH3-SCR performance of vanadium-titanium catalysts. In V2O5/TiO2 catalysts, the active sites for NH3-SCR reactions primarily consisted of V5+=O species, which adsorbed NH3 and reacted with NO to form the (-NH2NO) intermediate, ultimately converting it into N2. Meanwhile, certain acid sites (e.g., V–OH) served as NH3 reservoirs. Although these sites did not directly participate in the reaction, they promoted NH3-SCR by increasing NH3 adsorption capacity [29]. NH3-TPD results showed that when MoO3 and WO3 were co-doped, compared with the V2O5/TiO2 catalyst, the peak II area corresponding to the medium acid sites significantly increased, indicating that the introduction of MoO3 and WO3 enhanced the medium acid amount of the catalyst, thereby improving its low-temperature NH3 adsorption capacity. Meanwhile, the desorption peak temperature of peak III, corresponding to the strong acid sites, shifted toward lower temperatures, suggesting that the co-doping altered the distribution of strong acid sites and reduced the desorption energy barrier of NH3 on these sites, making it easier for NH3 to be activated at low temperatures and participate in the reaction. Furthermore, the co-doping of WO3 and MoO3 synergistically enhanced the V4+/(V5++V4+) ratio (reaching 80.5 % in VW10Mo5.5/Ti) and Oα proportion (30.3 %), which accelerated two critical processes: electron transfer and O2 activation. These steps were essential for NO oxidation and intermediate formation. The WO3-MoO3 co-doping induced the aggregation of surface monomeric vanadium oxide species, forming polymeric vanadium oxide species (Scheme 1 ). Notably, these polymeric vanadyl species exhibited significantly higher activity than their monomeric counterparts, playing a decisive role in low-temperature SCR performance. These results aligned with recent studies emphasizing the importance of acid-redox bifunctionality in SCR catalysts [16], The structural evolution induced by WO3-MoO3 co-doping further elucidated the \"dispersal-aggregation\" threshold phenomenon. At low loading levels, W species achieved atomic-level dispersion or formed uniformly distributed ultra-small nanoclusters on the TiO2 surface. However, exceeding this threshold triggered WO3 agglomeration (as evidenced by XRD and BET data), physically blocking active sites and deteriorating the redox cycle. This phenomenon explained the paradoxical decline in hydrogen consumption (2.5850 → 2.1120 mmol/g) and V4+ content (80.5 % → 78.1 %) at 15wt % WO3 loading, underscoring the delicate balance required in the design of multicomponent catalysts. 5 Conclusion In this study, a series of V-W-M/TiO2 catalysts were synthesized via the incipient wetness impregnation method. by introducing tungsten (W) and molybdenum (Mo) elements into a V2O5/TiO2 base catalyst. The NH3-SCR performance of these catalysts was systematically investigated, with the VW10Mo5.5/Ti catalyst exhibiting optimal low-temperature activity, achieving >80 % NO conversion across a broad temperature window of 190–400 °C. NH3-TPD results demonstrated that the VW10Mo5.5/Ti catalyst possessed the highest acid amount, which facilitated NH3-SCR reactions by increasing NH3 adsorption capacity. H2-TPR and XPS analyses revealed that this catalyst exhibited superior low-temperature reducibility (as evidenced by an isolated V5+ reduction peak at 399 °C), which was beneficial for promoting the acid cycle. The highest V4+ content (80.5 %) and Oα proportion (30.3 %) were found to facilitate electron transfer and O2 activation. Raman spectroscopy further confirmed that WO3-MoO3 co-doping drove the transformation of monomeric vanadium species into highly active polymeric vanadium species, while excessive WO3 loading reduced the formation of these polymeric species. The exceptional performance of VW10Mo5.5/Ti was ascribed to its enhanced acidity, optimized redox properties, and abundant polymeric vanadium species. In contrast, excessive MoO3 or WO3 doping was found to disrupt this balance through aggregation, diminished redox performance, and structural disorder. CRediT authorship contribution statement Huayan Chen: Writing – review & editing, Supervision. Qingcai Liu: Writing – review & editing, Writing – original draft. Yuan Li: Writing – review & editing, Supervision. Jian Gao: Validation, Supervision. Xiaoyao Tan: Validation, Supervision. Yifan Cao: Validation, Supervision. Jian Zhang: Validation, Supervision. Declaration of competing interest The authors declare that they have no known competing financial interests or personal relationships that could have appeared to influence the work reported in this paper. Acknowledgements Thank Professor Li for many suggestions during the experiment and for his great support in material characterization. Thank Professor Li for his valuable suggestions in the process of thesis writing and revision. At the same time, this work was supported by the National Natural Science Foundation of China (91745116). Thanks again to the strong support of the National Natural Science Foundation of China. References [1] C.M. Chen Y. Cao S.T. Liu J.M. Chen W.B. Jia Review on the latest developments in modified vanadium-titanium-based SCR catalysts Chinese J. Catal. 39 8 2018 1347 1365 10.1016/s1872-2067(18)63090-6 C.M. Chen, Y. Cao, S.T. Liu, J.M. Chen, W.B. Jia, Review on the latest developments in modified vanadium-titanium-based SCR catalysts, Chinese J. Catal. 39(8) (2018) 1347-1365, https://doi.org/10.1016/s1872-2067(18)63090-6. [2] D. Damma P.R. Ettireddy B.M. Reddy P.G. Smirniotis A review of low temperature NH3-SCR for removal of NOx Catalysts 9 4 2019 9040349 10.3390/catal9040349 D. Damma, P.R. Ettireddy, B.M. Reddy, P.G. Smirniotis, A review of low temperature NH3-SCR for removal of NOx, Catalysts 9(4) (2019) 9040349, https://doi.org/10.3390/catal9040349. [3] Z.C. Chen R.T. Guo S. Ren L. Chen X.D. Li M.M. Wang Comparative analysis of the dual origins of the N2O byproduct on MnOx, FeOx, and MnFeOx sphere catalysts for a low-temperature SCR of NO with NH3 J. Mater. Chem. A 10 40 2022 21474 21491 10.1039/d2ta06199f Z.C. Chen, R.T. Guo, S. Ren, L. Chen, X.D. Li, M.M. Wang, Comparative analysis of the dual origins of the N2O byproduct on MnOx, FeOx, and MnFeOx sphere catalysts for a low-temperature SCR of NO with NH3, J. Mater. Chem. A 10(40) (2022) 21474-21491, https://doi.org/10.1039/d2ta06199f. [4] Z.C. Chen S. Ren M.M. Wang L. Chen X.D. Li J.L. Li J. Yang Q.C. Liu Structure-activity strategy comparison of (NH4)2CO3 and NH4OH precipitants on MnOx catalyst for low-temperature NO abatement Mol. Catal. 531 2022 112693 10.1016/j.mcat.2022.112693 Z.C. Chen, S. Ren, M.M. Wang, L. Chen, X.D. Li, J.L. Li, J. Yang, Q.C. Liu, Structure-activity strategy comparison of (NH4)2CO3 and NH4OH precipitants on MnOx catalyst for low-temperature NO abatement, Mol. Catal. 531 (2022) 112693, https://doi.org/10.1016/j.mcat.2022.112693. [5] Z.C. Chen S. Ren X.D. Xing X.D. Li L. Chen M.M. Wang Unveiling the inductive strategy of different precipitants on MnFeOx catalyst for low-temperature NH3-SCR reaction Fuel 335 2023 126986 10.1016/j.fuel.2022.126986 Z.C. Chen, S. Ren, X.D. Xing, X.D. Li, L. Chen, M.M. Wang, Unveiling the inductive strategy of different precipitants on MnFeOx catalyst for low-temperature NH3-SCR reaction, Fuel 335 (2023) 126986, https://doi.org/10.1016/j.fuel.2022.126986. [6] J. Yang S. Ren M.M. Wang Z.C. Chen L. Chen L. Liu Time-resolved in situ DRIFTS study on NH3-SCR of NO on a CeO2/TiO2 catalyst Catal. Sci. Technol. 12 4 2022 1245 1256 10.1039/d1cy02089g J. Yang, S. Ren, M.M. Wang, Z.C. Chen, L. Chen, L. Liu, Time-resolved in situ DRIFTS study on NH3-SCR of NO on a CeO2/TiO2 catalyst, Catal. Sci. Technol. 12(4) (2022) 1245-1256, https://doi.org/10.1039/d1cy02089g. [7] Z. Shi Q. Peng J.Q. E B. Xie J. Wei R. Yin G. Fu Mechanism, performance and modification methods for NH3-SCR catalysts: A review Fuel 331 2023 125885 10.1016/j.fuel.2022.125885 Z. Shi, Q. Peng, J.Q. E, B. Xie, J. Wei, R. Yin, G. Fu, Mechanism, performance and modification methods for NH3-SCR catalysts: A review, Fuel 331 (2023) 125885, https://doi.org/10.1016/j.fuel.2022.125885. [8] N.R. Jaegers J.K. Lai Y. He E. Walter D.A. Dixon M. Vasiliu Y. Chen C.M. Wang M.Y. Hu K.T. Mueller I.E. Wachs Y. Wang J.Z. Hu Mechanism by which tungsten oxide promotes the activity of supported V2O5/TiO2 catalysts for NO x abatement: structural effects revealed by 51V MAS NMR spectroscopy Angew. Chem. Int. Ed. 58 36 2019 12609 12616 10.1002/anie.201904503 N.R. Jaegers, J.K. Lai, Y. He, E. Walter, D.A. Dixon, M. Vasiliu, Y. Chen, C.M. Wang, M.Y. Hu, K.T. Mueller, I.E. Wachs, Y. Wang, J.Z. Hu, Mechanism by which tungsten oxide promotes the activity of supported V2O5/TiO2 catalysts for NOx abatement: structural effects revealed by 51V MAS NMR spectroscopy, Angew. Chem. Int. Ed. 58(36) (2019) 12609-12616, https://doi.org/10.1002/anie.201904503. [9] J. Cao C. Nannuzzi W.Z. Liu H.L. Wu Y.X. Gao R.G. Zhong Q.C. Liu G. Berlier Improving the tolerance to alkali and alkaline earth metal chlorides of WO3 and Nb2O5 promoted V2O5/TiO2 catalysts for the NH3-SCR reaction Fuel 328 2022 125262 10.1016/j.fuel.2022.125262 J. Cao, C. Nannuzzi, W.Z. Liu, H.L. Wu, Y.X. Gao, R.G. Zhong, Q.C. Liu, G. Berlier, Improving the tolerance to alkali and alkaline earth metal chlorides of WO3 and Nb2O5 promoted V2O5/TiO2 catalysts for the NH3-SCR reaction, Fuel 328 (2022) 125262, https://doi.org/10.1016/j.fuel.2022.125262. [10] C. Dong J.X. Yao J.Q. Shi L.N. Han H.W. Qin Z.H. Zhang Q.H. Zhang J.C. Wang Resource utilization strategy based on the deactivation mechanism of V2O5-WO3/TiO2 catalyst Fuel 381 2025 133311 10.1016/j.fuel.2024.133311 C. Dong, J.X. Yao, J.Q. Shi, L.N. Han, H.W. Qin, Z.H. Zhang, Q.H. Zhang, J.C. Wang, Resource utilization strategy based on the deactivation mechanism of V2O5-WO3/TiO2 catalyst, Fuel 381 (2025) 133311, https://doi.org/10.1016/j.fuel.2024.133311. [11] W.S. Hu Y. Zhang X.X. Wang W.H. Wu H. Song Y. Yang S.J. Liu C.H. Zheng X. Gao Mechanistic assessment of NO oxidative activation on tungsten-promoted ceria catalysts and its consequence for low-temperature NH3-SCR Appl. Energy 330 2023 120306 10.1016/j.apenergy.2022.120306 W.S. Hu, Y. Zhang, X.X. Wang, W.H. Wu, H. Song, Y. Yang, S.J. Liu, C.H. Zheng, X. Gao, Mechanistic assessment of NO oxidative activation on tungsten-promoted ceria catalysts and its consequence for low-temperature NH3-SCR, Appl. Energy 330 (2023) 120306, https://doi.org/10.1016/j.apenergy.2022.120306. [12] Z.H. Lv G.Z. He Y.L. Ge Y.C. Liu Y.B. Yu H. He Effects of WO3 and MoO3 loadings on vanadia-based catalysts for NH3-SCR: revealed by in situ infrared and two-dimensional correlation spectroscopy Fuel 359 2024 130472 10.1016/j.fuel.2023.130472 Z.H. Lv, G.Z. He, Y.L. Ge, Y.C. Liu, Y.B. Yu, H. He, Effects of WO3 and MoO3 loadings on vanadia-based catalysts for NH3-SCR: revealed by in situ infrared and two-dimensional correlation spectroscopy, Fuel 359 (2024) 130472, https://doi.org/10.1016/j.fuel.2023.130472. [13] Y.J. Pu X.Y. Xie W.J. Jiang L. Yang X. Jiang L. Yao Low-temperature selective catalytic reduction of NOx with NH3 over zeolite catalysts: A review Chin. Chem. Lett. 31 10 2020 2549 2555 10.1016/j.cclet.2020.04.012 Y.J. Pu, X.Y. Xie, W.J. Jiang, L. Yang, X. Jiang, L. Yao, Low-temperature selective catalytic reduction of NOx with NH3 over zeolite catalysts: A review, Chin. Chem. Lett. 31(10) (2020) 2549-2555, https://doi.org/10.1016/j.cclet.2020.04.012. [14] Z.H. Lv G.Y. Xu Y.J. Wang Y.B. Yu H. He Unraveling the positive role of WO3 on supported vanadium catalysts for NO x reduction by operando spectroscopy ACS Omega 10 1 2024 358 367 10.1021/acsomega.4c06372 Z.H. Lv, G.Y. Xu, Y.J. Wang, Y.B. Yu, H. He, Unraveling the positive role of WO3 on supported vanadium catalysts for NOx reduction by operando spectroscopy, ACS Omega 10(1) (2024) 358-367, https://doi.org/10.1021/acsomega.4c06372. [15] Y.P. Zhang X.L. Wang K. Shen H.T. Xu K.Q. Sun C.C. Zhou WO3 modification of MnO x /TiO2 catalysts for low temperature selective catalytic reduction of NO with Ammonia Chine. J. Catal. 33 9 2012 1523 1531 10.1016/s1872-2067(11)60427-0 Y.P. Zhang, X.L. Wang, K. Shen, H.T. Xu, K.Q. Sun, C.C. Zhou, WO3 modification of MnOx/TiO2 catalysts for low temperature selective catalytic reduction of NO with Ammonia, Chine. J. Catal. 33(9) (2012) 1523-1531, https://doi.org/10.1016/s1872-2067(11)60427-0. [16] M.G. Jung J.H. Shin D.W. Kwon S.C. Hong Promotional effects of Me (Sb, La, Ce, Mo) additives on the NH3-SCR activity and SO2 durability of V2O5-WO3/TiO2 catalysts Process. Saf. Environ. Prot. 183 2024 911 924 10.1016/j.psep.2024.01.044 M.G. Jung, J.H. Shin, D.W. Kwon, S.C. Hong, Promotional effects of Me (Sb, La, Ce, Mo) additives on the NH3-SCR activity and SO2 durability of V2O5-WO3/TiO2 catalysts, Process. Saf. Environ. Prot. 183 (2024) 911-924, https://doi.org/10.1016/j.psep.2024.01.044. [17] S.B. Kristensen A.J. Kunov-Kruse A. Riisager S.B. Rasmussen R. Fehrmann High performance vanadia-anatase nanoparticle catalysts for the Selective Catalytic Reduction of NO by ammonia J. Catal. 284 1 2011 60 67 10.1016/j.jcat.2011.08.017 S.B. Kristensen, A.J. Kunov-Kruse, A. Riisager, S.B. Rasmussen, R. Fehrmann, High performance vanadia-anatase nanoparticle catalysts for the Selective Catalytic Reduction of NO by ammonia, J. Catal. 284(1) (2011) 60-67, https://doi.org/10.1016/j.jcat.2011.08.017. [18] D.S. Chen J.X. Feng J.X. Sun C.P. Cen S.H. Tian J. Yang Y. Xiong Molybdenum modified montmonrillonite clay as an efficient catalyst for low temperature NH3-SCR J. Chem. Technol. Biotechnol.. 95 5 2020 1441 1452 10.1002/jctb.6329 D.S. Chen, J.X. Feng, J.X. Sun, C.P. Cen, S.H. Tian, J. Yang, Y. Xiong, Molybdenum modified montmonrillonite clay as an efficient catalyst for low temperature NH3-SCR, J. Chem. Technol. Biotechnol.. 95(5) (2020) 1441-1452, https://doi.org/10.1002/jctb.6329. [19] D.W. Kwon K.H. Park H.P. Ha S.C. Hong The role of molybdenum on the enhanced performance and SO2 resistance of V/Mo-Ti catalysts for NH3-SCR Appl. Surf. Sci. 481 2019 1167 1177 10.1016/j.apsusc.2019.03.118 D.W. Kwon, K.H. Park, H.P. Ha, S.C. Hong, The role of molybdenum on the enhanced performance and SO2 resistance of V/Mo-Ti catalysts for NH3-SCR, Appl. Surf. Sci. 481 (2019) 1167-1177, https://doi.org/10.1016/j.apsusc.2019.03.118. [20] D.W. Kwon K.H. Park S.C. Hong Enhancement of SCR activity and SO2 resistance on VO x /TiO2 catalyst by addition of molybdenum Chem. Eng. J. 284 2016 315 324 10.1016/j.cej.2015.08.152 D.W. Kwon, K.H. Park, S.C. Hong, Enhancement of SCR activity and SO2 resistance on VOx/TiO2 catalyst by addition of molybdenum, Chem. Eng. J. 284 (2016) 315-324, https://doi.org/10.1016/j.cej.2015.08.152. [21] X.L. Li Y.H. Li Molybdenum modified CeAlOx catalyst for the selective catalytic reduction of NO with NH3 J. Mol. Catal. A-Chem. 386 2014 69 77 10.1016/j.molcata.2014.02.016 X.L. Li, Y.H. Li, Molybdenum modified CeAlOx catalyst for the selective catalytic reduction of NO with NH3, J. Mol. Catal. A-Chem. 386 (2014) 69-77, https://doi.org/10.1016/j.molcata.2014.02.016. [22] W. Tan J. Wang Y.D. Cai L.L. Li S.H. Xie F. Gao F.D. Liu L. Dong Molybdenum oxide as an efficient promoter to enhance the NH3-SCR performance of CeO2-SiO2 catalyst for NOx removal Catal. Today 397 2022 475 483 10.1016/j.cattod.2021.07.007 W. Tan, J. Wang, Y.D. Cai, L.L. Li, S.H. Xie, F. Gao, F.D. Liu, L. Dong, Molybdenum oxide as an efficient promoter to enhance the NH3-SCR performance of CeO2-SiO2 catalyst for NOx removal, Catal. Today 397 (2022) 475-483, https://doi.org/10.1016/j.cattod.2021.07.007. [23] T. Zhang R.Y. Qu W.K. Su J.H. Li A novel Ce-Ta mixed oxide catalyst for the selective catalytic reduction of NOx with NH3 Appl. Catal. B Environ. 176 2015 338 346 10.1016/j.apcatb.2015.04.023 T. Zhang, R.Y. Qu, W.K. Su, J.H. Li, A novel Ce-Ta mixed oxide catalyst for the selective catalytic reduction of NOx with NH3, Appl. Catal. B Environ. 176 (2015) 338-346, https://doi.org/10.1016/j.apcatb.2015.04.023. [24] T.H. Kang H.S. Kim H. Lee D.H. Kim Synergistic effect of V2O5-WO3/TiO2 and H-ZSM-5 catalysts prepared by physical mixing on the selective catalytic reduction of NOx with NH3 Appl. Surf. Sci. 614 2023 156159 10.1016/j.apsusc.2022.156159 T.H. Kang, H.S. Kim, H. Lee, D.H. Kim, Synergistic effect of V2O5-WO3/TiO2 and H-ZSM-5 catalysts prepared by physical mixing on the selective catalytic reduction of NOx with NH3, Appl. Surf. Sci. 614 (2023) 156159, https://doi.org/10.1016/j.apsusc.2022.156159. [25] L. Zhu Z.P. Zhong H. Yang C.H. Wang Effect of MoO3 on vanadium based catalysts for the selective catalytic reduction of NOx with NH3 at low temperature J. Environ. Sci. 56 2017 169 179 10.1016/j.jes.2016.08.025 L. Zhu, Z.P. Zhong, H. Yang, C.H. Wang, Effect of MoO3 on vanadium based catalysts for the selective catalytic reduction of NOx with NH3 at low temperature, J. Environ. Sci. 56 (2017) 169-179, https://doi.org/10.1016/j.jes.2016.08.025. [26] M.S. Lee S.I. Kim M.J. Lee B. Ye T. Kim H.D. Kim J.W. Lee D.H. Lee Effect of catalyst crystallinity on V-based selective catalytic reduction with Ammonia Nanomaterials 11 6 2021 11061452 10.3390/nano11061452 M.S. Lee, S.I. Kim, M.J. Lee, B. Ye, T. Kim, H.D. Kim, J.W. Lee, D.H. Lee, Effect of catalyst crystallinity on V-based selective catalytic reduction with Ammonia, Nanomaterials 11(6) (2021) 11061452, https://doi.org/10.3390/nano11061452. [27] X.M. Wang X.S. Du J.Y. Xue G.P. Yang Y.R. Chen L. Zhang New insights into the N2O formation mechanism during selective catalytic reduction of NO x with NH3 over V-based catalyst Catal. Today 355 2020 555 562 10.1016/j.cattod.2019.06.052 X.M. Wang, X.S. Du, J.Y. Xue, G.P. Yang, Y.R. Chen, L. Zhang, New insights into the N2O formation mechanism during selective catalytic reduction of NOxwith NH3 over V-based catalyst, Catal. Today 355 (2020) 555-562, https://doi.org/10.1016/j.cattod.2019.06.052. [28] Z.H. Lian F.D. Liu H. He K. Liu Nb-doped VO x /CeO2 catalyst for NH3-SCR of NO x at low temperatures RSC Adv. 5 47 2015 37675 37681 10.1039/c5ra02752g Z.H. Lian, F.D. Liu, H. He, K. Liu, Nb-doped VOx/CeO2 catalyst for NH3-SCR of NOx at low temperatures, RSC Adv. 5(47) (2015) 37675-37681, https://doi.org/10.1039/c5ra02752g. [29] A. Marberger D. Ferri M. Elsener O. Kröcher The significance of Lewis Acid sites for the selective catalytic reduction of nitric oxide on vanadium-based catalysts Angew. Chem. Int. Ed. 55 39 2016 11989 11994 10.1002/anie.201605397 A. Marberger, D. Ferri, M. Elsener, O. Kröcher, The significance of Lewis Acid sites for the selective catalytic reduction of nitric oxide on vanadium-based catalysts, Angew. Chem. Int. Ed. 55(39) (2016) 11989-11994, https://doi.org/10.1002/anie.201605397. [30] R.B. Jin Y. Liu Z.B. Wu H.Q. Wang T.T. Gu Low-temperature selective catalytic reduction of NO with NH3 over Mn-Ce oxides supported on TiO2 and Al2O3: A comparative study Chemosphere 78 9 2010 1160 1166 10.1016/j.chemosphere.2009.11.049 R.B. Jin, Y. Liu, Z.B. Wu, H.Q. Wang, T.T. Gu, Low-temperature selective catalytic reduction of NO with NH3 over Mn-Ce oxides supported on TiO2 and Al2O3: A comparative study, Chemosphere 78(9) (2010) 1160-1166, https://doi.org/10.1016/j.chemosphere.2009.11.049. [31] L. Lietti I. Nova G. Ramis L. Dall'Acqua G. Busca E. Giamello P. Forzatti F. Bregani Characterization and reactivity of V2O5-MoO3/TiO2 de-NO x SCR catalysts J. Catal. 187 2 1999 419 435 10.1006/jcat.1999.2603 L. Lietti, I. Nova, G. Ramis, L. Dall'Acqua, G. Busca, E. Giamello, P. Forzatti, F. Bregani, Characterization and reactivity of V2O5-MoO3/TiO2 de-NOx SCR catalysts, J. Catal. 187(2) (1999) 419-435, https://doi.org/10.1006/jcat.1999.2603. [32] I. Nova L. Lietti L. Casagrande L. Dall'Acqua E. Giamello P. Forzatti Characterization and reactivity of TiO2-supported MoO3 De-NOx SCR catalysts Appl.Catal. B-Environ. 17 3 1998 245 258 10.1016/s0926-3373(98)00015-0 I. Nova, L. Lietti, L. Casagrande, L. Dall'Acqua, E. Giamello, P. Forzatti, Characterization and reactivity of TiO2-supported MoO3 De-NOx SCR catalysts, Appl.Catal. B-Environ. 17(3) (1998) 245-258, https://doi.org/10.1016/s0926-3373(98)00015-0. [33] H.F. Chen Y. Xia R.Y. Fang H. Huang Y.P. Gan C. Liang J. Zhang W.K. Zhang X.S. Liu The effects of tungsten and hydrothermal aging in promoting NH3-SCR activity on V2O5/WO3-TiO2 catalysts Appl. Surf. Sci. 459 2018 639 646 10.1016/j.apsusc.2018.08.046 H.F. Chen, Y. Xia, R.Y. Fang, H. Huang, Y.P. Gan, C. Liang, J. Zhang, W.K. Zhang, X.S. Liu, The effects of tungsten and hydrothermal aging in promoting NH3-SCR activity on V2O5/WO3-TiO2 catalysts, Appl. Surf. Sci. 459 (2018) 639-646, https://doi.org/10.1016/j.apsusc.2018.08.046. [34] A.D. Murkute D. Vanderwiel Active sites evaluation of Vanadia based powdered and extruded SCR catalysts prepared on commercial titania Catal. Lett. 145 6 2015 1224 1236 10.1007/s10562-015-1511-x A.D. Murkute, D. Vanderwiel, Active sites evaluation of Vanadia based powdered and extruded SCR catalysts prepared on commercial titania, Catal. Lett. 145(6) (2015) 1224-1236, https://doi.org/10.1007/s10562-015-1511-x. [35] D.K. Chen D.D. He J.C. Lu L.P. Zhong F. Liu J.P. Liu J. Yu G.P. Wan S.F. He Y.M. Luo Investigation of the role of surface lattice oxygen and bulk lattice oxygen migration of cerium-based oxygen carriers: XPS and designed H2-TPR characterization Appl. Catal. B-Environ. 218 2017 249 259 10.1016/j.apcatb.2017.06.053 D.K. Chen, D.D. He, J.C. Lu, L.P. Zhong, F. Liu, J.P. Liu, J. Yu, G.P. Wan, S.F. He, Y.M. Luo, Investigation of the role of surface lattice oxygen and bulk lattice oxygen migration of cerium-based oxygen carriers: XPS and designed H2-TPR characterization, Appl. Catal. B-Environ. 218 (2017) 249-259, https://doi.org/10.1016/j.apcatb.2017.06.053. [36] S.H. Zhan H. Zhang Y. Zhang Q. Shi Y. Li X.J. Li Efficient NH3-SCR removal of NOx with highly ordered mesoporous WO3(x)-CeO2 at low temperatures Appl. Catal. B-Environ. 203 2017 199 209 10.1016/j.apcatb.2016.10.010 S.H. Zhan, H. Zhang, Y. Zhang, Q. Shi, Y. Li, X.J. Li, Efficient NH3-SCR removal of NOx with highly ordered mesoporous WO3(x)-CeO2 at low temperatures, Appl. Catal. B-Environ. 203 (2017) 199-209, https://doi.org/10.1016/j.apcatb.2016.10.010. [37] G.Z. He Z.H. Lian Y.B. Yu Y. Yang K. Liu X.Y. Shi Z.D. Yan W.P. Shan H. He Polymeric vanadyl species determine the low-temperature activity of V-based catalysts for the SCR of NOx with NH3 Sci. Adv. 4 11 2018 4637 10.1126/sciadv.aau4637 G.Z. He, Z.H. Lian, Y.B. Yu, Y. Yang, K. Liu, X.Y. Shi, Z.D. Yan, W.P. Shan, H. He, Polymeric vanadyl species determine the low-temperature activity of V-based catalysts for the SCR of NOx with NH3, Sci. Adv. 4(11) (2018) 4637, https://doi.org/10.1126/sciadv.aau4637. [38] D.W. Kwon K.H. Park S.C. Hong Influence of VOx, surface density and vanadyl species on the selective catalytic reduction of NO by NH3 over VUx/TiO2 for superior catalytic activity Appl. Catal. A-Gen. 499 2015 1 12 10.1016/j.apcata.2015.04.005 D.W. Kwon, K.H. Park, S.C. Hong, Influence of VOx, surface density and vanadyl species on the selective catalytic reduction of NO by NH3 over VUx/TiO2 for superior catalytic activity, Appl. Catal. A-Gen. 499 (2015) 1-12, https://doi.org/10.1016/j.apcata.2015.04.005. [39] Z.Z. Jia Y.J. Shen T.T. Yan H.R. Li J. Deng J.H. Fang D.S. Zhang Efficient NO X abatement over Alkali-resistant catalysts via constructing durable dimeric VO X species Environ. Sci. Technol. 56 4 2022 2647 2655 10.1021/acs.est.1c06932 Z.Z. Jia, Y.J. Shen, T.T. Yan, H.R. Li, J. Deng, J.H. Fang, D.S. Zhang, Efficient NOX abatement over Alkali-resistant catalysts via constructing durable dimeric VOX species, Environ. Sci. Technol. 56(4) (2022) 2647-2655, https://doi.org/10.1021/acs.est.1c06932. [40] S.T. Choo Y.G. Lee I.S. Nam S.W. Ham J.B. Lee Characteristics of V2O5 supported on sulfated TiO2 for selective catalytic reduction of NO by NH3 Appl. Catal. A-Gen. 200 1-2 2000 177 188 10.1016/s0926-860x(00)00636-0 S.T. Choo, Y.G. Lee, I.S. Nam, S.W. Ham, J.B. Lee, Characteristics of V2O5 supported on sulfated TiO2 for selective catalytic reduction of NO by NH3, Appl. Catal. A-Gen. 200(1-2) (2000) 177-188, https://doi.org/10.1016/s0926-860x(00)00636-0. [41] X.L. Yu X.M. Wu Z.Y. Chen Z.W. Huang G.H. Jing Oxygen vacancy defect engineering in Mn-doped CeO2 nanostructures for, nitrogen oxides emission abatement Mol. Catal. 476 2019 110512 10.1016/j.mcat.2019.110512 X.L. Yu, X.M. Wu, Z.Y. Chen, Z.W. Huang, G.H. Jing, Oxygen vacancy defect engineering in Mn-doped CeO2 nanostructures for, nitrogen oxides emission abatement, Mol. Catal. 476 (2019) 110512, https://doi.org/10.1016/j.mcat.2019.110512. [42] A. Ramírez P. Hillebrand D. Stellmach M.M. May P. Bogdanoff S. Fiechter Evaluation of MnOx, Mn2O3, and Mn3O4 electrodeposited films for the oxygen evolution reaction of water J. Phys. Chem. C 118 26 2014 14073 14081 10.1021/jp500939d A. Ramírez, P. Hillebrand, D. Stellmach, M.M. May, P. Bogdanoff, S. Fiechter, Evaluation of MnOx, Mn2O3, and Mn3O4 electrodeposited films for the oxygen evolution reaction of water, J. Phys. Chem. C 118(26) (2014) 14073-14081, https://doi.org/10.1021/jp500939d. [43] H.B. Li W.H. Wang X.Y. Qian Y.H. Cheng X.J. Xie J.Y. Liu S.H. Sun J.G. Zhou Y.F. Hu J.P. Xu L. Li Y. Zhang X.W. Du K.H. Gao Z.Q. Li C. Zhang S.D. Wang H.J. Chen Y.D. Zhao F. Lu W.C. Wang H. Liu Identifying the descriptor governing NO oxidation on mullite Sm(Y, Tb, Gd, Lu)Mn2O5 for diesel exhaust cleaning Catal. Sci. Technol. 6 11 2016 3971 3975 10.1039/c5cy01798j H.B. Li, W.H. Wang, X.Y. Qian, Y.H. Cheng, X.J. Xie, J.Y. Liu, S.H. Sun, J.G. Zhou, Y.F. Hu, J.P. Xu, L. Li, Y. Zhang, X.W. Du, K.H. Gao, Z.Q. Li, C. Zhang, S.D. Wang, H.J. Chen, Y.D. Zhao, F. Lu, W.C. Wang, H. Liu, Identifying the descriptor governing NO oxidation on mullite Sm(Y, Tb, Gd, Lu)Mn2O5 for diesel exhaust cleaning, Catal. Sci. Technol. 6(11) (2016) 3971-3975, https://doi.org/10.1039/c5cy01798j. [44] E. Hryha E. Rutqvist L. Nyborg Stoichiometric vanadium oxides studied by XPS Surf. Interface Anal. 44 8 2012 1022 1025 10.1002/sia.3844 E. Hryha, E. Rutqvist, L. Nyborg, Stoichiometric vanadium oxides studied by XPS, Surf. Interface Anal. 44(8) (2012) 1022-1025, https://doi.org/10.1002/sia.3844. [45] C. Li D. Brewe J.Y. Lee Effects of impregnation sequence for Mo-modified V-based SCR catalyst on simultaneous Hg(0) oxidation and NO reduction Appl. Catal. B-Environ. 270 2020 118854 10.1016/j.apcatb.2020.118854 C. Li, D. Brewe, J.Y. Lee, Effects of impregnation sequence for Mo-modified V-based SCR catalyst on simultaneous Hg(0) oxidation and NO reduction, Appl. Catal. B-Environ. 270 (2020) 118854, https://doi.org/10.1016/j.apcatb.2020.118854. [46] X.S. Liu X.D. Wu T.F. Xu D. Weng Z.C. Si R. Ran Effects of silica additive on the NH3-SCR activity and thermal stability of a V2O5/WO3-TiO2 catalyst Chinese J. Catal. 37 8 2016 1340 1346 10.1016/s1872-2067(15)61109-3 X.S. Liu, X.D. Wu, T.F. Xu, D. Weng, Z.C. Si, R. Ran, Effects of silica additive on the NH3-SCR activity and thermal stability of a V2O5/WO3-TiO2 catalyst, Chinese J. Catal. 37(8) (2016) 1340-1346, https://doi.org/10.1016/s1872-2067(15)61109-3. [47] P. Kompio A. Brückner F. Hipler O. Manoylova G. Auer G. Mestl W. Grünert V2O5-WO3/TiO2 catalysts under thermal stress: responses of structure and catalytic behavior in the selective catalytic reduction of NO by NH3 Appl. Catal. B-Environ. 217 2017 365 377 10.1016/j.apcatb.2017.06.006 P. Kompio, A. Brückner, F. Hipler, O. Manoylova, G. Auer, G. Mestl, W. Grünert, V2O5-WO3/TiO2 catalysts under thermal stress: responses of structure and catalytic behavior in the selective catalytic reduction of NO by NH3, Appl. Catal. B-Environ. 217 (2017) 365-377, https://doi.org/10.1016/j.apcatb.2017.06.006. [48] S.S.R. Putluru L. Schill A. Godiksen R. Poreddy S. Mossin A.D. Jensen R. Fehrmann Promoted V2O5/TiO2 catalysts for selective catalytic reduction of NO with NH3 at low temperatures Appl. Catal. B-Environ. 183 2016 282 290 10.1016/j.apcatb.2015.10.044 S.S.R. Putluru, L. Schill, A. Godiksen, R. Poreddy, S. Mossin, A.D. Jensen, R. Fehrmann, Promoted V2O5/TiO2 catalysts for selective catalytic reduction of NO with NH3 at low temperatures, Appl. Catal. B-Environ. 183 (2016) 282-290, https://doi.org/10.1016/j.apcatb.2015.10.044. [49] S. Besselmann E. Löffler M. Muhler On the role of monomeric vanadyl species in toluene adsorption and oxidation on V2O5/TiO2 catalysts:a Raman and in situ DRIFTS study J. Mol. Catal. A-Chem. 162 1-2 2000 401 411 10.1016/s1381-1169(00)00307-1 S. Besselmann, E. Löffler, M. Muhler, On the role of monomeric vanadyl species in toluene adsorption and oxidation on V2O5/TiO2 catalysts:a Raman and in situ DRIFTS study, J. Mol. Catal. A-Chem. 162(1-2) (2000) 401-411, https://doi.org/10.1016/s1381-1169(00)00307-1. [50] J.Y. Song S. Impeng J.P. Zhang J. Deng D.S. Zhang Elucidating the sensitivity of vanadyl species to water over V2O5/TiO2 catalysts for NOx abatement via operando Raman spectroscopy J. Catal. 416 2022 198 208 10.1016/j.jcat.2022.11.003 J.Y. Song, S. Impeng, J.P. Zhang, J. Deng, D.S. Zhang, Elucidating the sensitivity of vanadyl species to water over V2O5/TiO2 catalysts for NOx abatement via operando Raman spectroscopy, J. Catal. 416 (2022) 198-208, https://doi.org/10.1016/j.jcat.2022.11.003.",
      "scopus-id": "105004361478",
      "coredata": {
        "eid": "1-s2.0-S2468823125003566",
        "dc:description": "To improve the low-temperature performance of V2O5/TiO2 catalysts in the selective catalytic reduction of ammonia (NH3-SCR), tungsten (W) and molybdenum (Mo) were incorporated into the V2O5/TiO2 catalyst. A series of V-W-Mo/TiO2 catalysts were synthesized using the incipient wetness impregnation method. Advanced characterization techniques, including Raman spectroscopy, X-ray photoelectron spectroscopy (XPS), and NH3 temperature-programmed desorption (NH3-TPD), were utilized to examine the effects of WO3 and MoO3 co-doping on the performance of V/Ti catalysts. The findings reveal that the VW10Mo5.5/TiO2 catalyst demonstrated exceptional performance, maintaining a NO conversion rate above 80 % across a broad temperature range of 190 °C to 400 °C. In comparison, the V2O5/TiO2 catalyst required a temperature of 230 °C to achieve the same NO conversion rate, indicating that the co-doping of WO3 and MoO3 lowered the temperature for efficient NO conversion by 40 °C. Raman spectroscopy and XPS analyses revealed that the co-doping of WO3 and MoO3 increased the proportion of V4+ species and chemically adsorbed oxygen on the vanadium-titanium-based catalyst, which enhances low-temperature NH3-SCR activity. Furthermore, the co-doping of WO3 and MoO3 significantly affected the migration and aggregation of vanadium species, converting surface monomeric vanadium oxide species into surface polymeric vanadium oxide species. Polymeric vanadium oxide species are crucial for enhancing the NH3-SCR activity of the catalyst, with a high proportion of these species significantly boosting the NH3-SCR activity under low-temperature conditions.",
        "openArchiveArticle": "false",
        "prism:coverDate": "2025-07-31",
        "openaccessUserLicense": null,
        "prism:aggregationType": "Journal",
        "prism:url": "https://api.elsevier.com/content/article/pii/S2468823125003566",
        "dc:creator": [
          {
            "@_fa": "true",
            "$": "Chen, Huayan"
          },
          {
            "@_fa": "true",
            "$": "Liu, Qingcai"
          },
          {
            "@_fa": "true",
            "$": "Li, Yuan"
          },
          {
            "@_fa": "true",
            "$": "Gao, Jian"
          },
          {
            "@_fa": "true",
            "$": "Tan, Xiaoyao"
          },
          {
            "@_fa": "true",
            "$": "Cao, Yifan"
          },
          {
            "@_fa": "true",
            "$": "Zhang, Jian"
          }
        ],
        "link": [
          {
            "@_fa": "true",
            "@rel": "self",
            "@href": "https://api.elsevier.com/content/article/pii/S2468823125003566"
          },
          {
            "@_fa": "true",
            "@rel": "scidir",
            "@href": "https://www.sciencedirect.com/science/article/pii/S2468823125003566"
          }
        ],
        "dc:format": "application/json",
        "openaccessType": null,
        "pii": "S2468-8231(25)00356-6",
        "prism:volume": "582",
        "articleNumber": "115171",
        "prism:publisher": "Elsevier B.V. All rights are reserved, including those for text and data mining, AI training, and similar technologies.",
        "dc:title": "Co-doping WO3-MoO3 enhances the low-temperature NH3-SCR activity of V2O5/TiO2 catalysts",
        "prism:copyright": "© 2025 Elsevier B.V. All rights are reserved, including those for text and data mining, AI training, and similar technologies.",
        "openaccess": "0",
        "prism:issn": "24688231",
        "dcterms:subject": [
          {
            "@_fa": "true",
            "$": "V2O5/TiO2 catalyst"
          },
          {
            "@_fa": "true",
            "$": "WO3"
          },
          {
            "@_fa": "true",
            "$": "MoO3"
          },
          {
            "@_fa": "true",
            "$": "NH3-SCR"
          },
          {
            "@_fa": "true",
            "$": "Catalytic performance"
          }
        ],
        "openaccessArticle": "false",
        "prism:publicationName": "Molecular Catalysis",
        "openaccessSponsorType": null,
        "prism:pageRange": "115171",
        "pubType": "fla",
        "prism:coverDisplayDate": "July 2025",
        "prism:doi": "10.1016/j.mcat.2025.115171",
        "prism:startingPage": "115171",
        "dc:identifier": "doi:10.1016/j.mcat.2025.115171",
        "openaccessSponsorName": null
      },
      "objects": {
        "object": [
          {
            "@category": "standard",
            "@height": "273",
            "@width": "375",
            "@_fa": "true",
            "$": "https://api.elsevier.com/content/object/eid/1-s2.0-S2468823125003566-gr5.jpg?httpAccept=%2A%2F%2A",
            "@multimediatype": "JPEG image file",
            "@type": "IMAGE-DOWNSAMPLED",
            "@size": "38549",
            "@ref": "gr5",
            "@mimetype": "image/jpeg"
          },
          {
            "@category": "standard",
            "@height": "272",
            "@width": "376",
            "@_fa": "true",
            "$": "https://api.elsevier.com/content/object/eid/1-s2.0-S2468823125003566-gr6.jpg?httpAccept=%2A%2F%2A",
            "@multimediatype": "JPEG image file",
            "@type": "IMAGE-DOWNSAMPLED",
            "@size": "47291",
            "@ref": "gr6",
            "@mimetype": "image/jpeg"
          },
          {
            "@category": "standard",
            "@height": "272",
            "@width": "678",
            "@_fa": "true",
            "$": "https://api.elsevier.com/content/object/eid/1-s2.0-S2468823125003566-gr7.jpg?httpAccept=%2A%2F%2A",
            "@multimediatype": "JPEG image file",
            "@type": "IMAGE-DOWNSAMPLED",
            "@size": "87698",
            "@ref": "gr7",
            "@mimetype": "image/jpeg"
          },
          {
            "@category": "standard",
            "@height": "273",
            "@width": "678",
            "@_fa": "true",
            "$": "https://api.elsevier.com/content/object/eid/1-s2.0-S2468823125003566-gr8.jpg?httpAccept=%2A%2F%2A",
            "@multimediatype": "JPEG image file",
            "@type": "IMAGE-DOWNSAMPLED",
            "@size": "73854",
            "@ref": "gr8",
            "@mimetype": "image/jpeg"
          },
          {
            "@category": "standard",
            "@height": "335",
            "@width": "565",
            "@_fa": "true",
            "$": "https://api.elsevier.com/content/object/eid/1-s2.0-S2468823125003566-gr1.jpg?httpAccept=%2A%2F%2A",
            "@multimediatype": "JPEG image file",
            "@type": "IMAGE-DOWNSAMPLED",
            "@size": "41208",
            "@ref": "gr1",
            "@mimetype": "image/jpeg"
          },
          {
            "@category": "standard",
            "@height": "909",
            "@width": "678",
            "@_fa": "true",
            "$": "https://api.elsevier.com/content/object/eid/1-s2.0-S2468823125003566-gr2.jpg?httpAccept=%2A%2F%2A",
            "@multimediatype": "JPEG image file",
            "@type": "IMAGE-DOWNSAMPLED",
            "@size": "195843",
            "@ref": "gr2",
            "@mimetype": "image/jpeg"
          },
          {
            "@category": "standard",
            "@height": "190",
            "@width": "500",
            "@_fa": "true",
            "$": "https://api.elsevier.com/content/object/eid/1-s2.0-S2468823125003566-ga1.jpg?httpAccept=%2A%2F%2A",
            "@multimediatype": "JPEG image file",
            "@type": "IMAGE-DOWNSAMPLED",
            "@size": "34912",
            "@ref": "ga1",
            "@mimetype": "image/jpeg"
          },
          {
            "@category": "standard",
            "@height": "319",
            "@width": "376",
            "@_fa": "true",
            "$": "https://api.elsevier.com/content/object/eid/1-s2.0-S2468823125003566-gr3.jpg?httpAccept=%2A%2F%2A",
            "@multimediatype": "JPEG image file",
            "@type": "IMAGE-DOWNSAMPLED",
            "@size": "41586",
            "@ref": "gr3",
            "@mimetype": "image/jpeg"
          },
          {
            "@category": "standard",
            "@height": "312",
            "@width": "376",
            "@_fa": "true",
            "$": "https://api.elsevier.com/content/object/eid/1-s2.0-S2468823125003566-gr4.jpg?httpAccept=%2A%2F%2A",
            "@multimediatype": "JPEG image file",
            "@type": "IMAGE-DOWNSAMPLED",
            "@size": "41905",
            "@ref": "gr4",
            "@mimetype": "image/jpeg"
          },
          {
            "@category": "standard",
            "@height": "259",
            "@width": "678",
            "@_fa": "true",
            "$": "https://api.elsevier.com/content/object/eid/1-s2.0-S2468823125003566-sc1.jpg?httpAccept=%2A%2F%2A",
            "@multimediatype": "JPEG image file",
            "@type": "IMAGE-DOWNSAMPLED",
            "@size": "50242",
            "@ref": "sc1",
            "@mimetype": "image/jpeg"
          },
          {
            "@category": "thumbnail",
            "@height": "159",
            "@width": "219",
            "@_fa": "true",
            "$": "https://api.elsevier.com/content/object/eid/1-s2.0-S2468823125003566-gr5.sml?httpAccept=%2A%2F%2A",
            "@multimediatype": "GIF image file",
            "@type": "IMAGE-THUMBNAIL",
            "@size": "14776",
            "@ref": "gr5",
            "@mimetype": "image/gif"
          },
          {
            "@category": "thumbnail",
            "@height": "158",
            "@width": "219",
            "@_fa": "true",
            "$": "https://api.elsevier.com/content/object/eid/1-s2.0-S2468823125003566-gr6.sml?httpAccept=%2A%2F%2A",
            "@multimediatype": "GIF image file",
            "@type": "IMAGE-THUMBNAIL",
            "@size": "13027",
            "@ref": "gr6",
            "@mimetype": "image/gif"
          },
          {
            "@category": "thumbnail",
            "@height": "88",
            "@width": "219",
            "@_fa": "true",
            "$": "https://api.elsevier.com/content/object/eid/1-s2.0-S2468823125003566-gr7.sml?httpAccept=%2A%2F%2A",
            "@multimediatype": "GIF image file",
            "@type": "IMAGE-THUMBNAIL",
            "@size": "11720",
            "@ref": "gr7",
            "@mimetype": "image/gif"
          },
          {
            "@category": "thumbnail",
            "@height": "88",
            "@width": "219",
            "@_fa": "true",
            "$": "https://api.elsevier.com/content/object/eid/1-s2.0-S2468823125003566-gr8.sml?httpAccept=%2A%2F%2A",
            "@multimediatype": "GIF image file",
            "@type": "IMAGE-THUMBNAIL",
            "@size": "10098",
            "@ref": "gr8",
            "@mimetype": "image/gif"
          },
          {
            "@category": "thumbnail",
            "@height": "130",
            "@width": "219",
            "@_fa": "true",
            "$": "https://api.elsevier.com/content/object/eid/1-s2.0-S2468823125003566-gr1.sml?httpAccept=%2A%2F%2A",
            "@multimediatype": "GIF image file",
            "@type": "IMAGE-THUMBNAIL",
            "@size": "11962",
            "@ref": "gr1",
            "@mimetype": "image/gif"
          },
          {
            "@category": "thumbnail",
            "@height": "164",
            "@width": "122",
            "@_fa": "true",
            "$": "https://api.elsevier.com/content/object/eid/1-s2.0-S2468823125003566-gr2.sml?httpAccept=%2A%2F%2A",
            "@multimediatype": "GIF image file",
            "@type": "IMAGE-THUMBNAIL",
            "@size": "11986",
            "@ref": "gr2",
            "@mimetype": "image/gif"
          },
          {
            "@category": "thumbnail",
            "@height": "83",
            "@width": "219",
            "@_fa": "true",
            "$": "https://api.elsevier.com/content/object/eid/1-s2.0-S2468823125003566-ga1.sml?httpAccept=%2A%2F%2A",
            "@multimediatype": "GIF image file",
            "@type": "IMAGE-THUMBNAIL",
            "@size": "10191",
            "@ref": "ga1",
            "@mimetype": "image/gif"
          },
          {
            "@category": "thumbnail",
            "@height": "164",
            "@width": "193",
            "@_fa": "true",
            "$": "https://api.elsevier.com/content/object/eid/1-s2.0-S2468823125003566-gr3.sml?httpAccept=%2A%2F%2A",
            "@multimediatype": "GIF image file",
            "@type": "IMAGE-THUMBNAIL",
            "@size": "11242",
            "@ref": "gr3",
            "@mimetype": "image/gif"
          },
          {
            "@category": "thumbnail",
            "@height": "164",
            "@width": "197",
            "@_fa": "true",
            "$": "https://api.elsevier.com/content/object/eid/1-s2.0-S2468823125003566-gr4.sml?httpAccept=%2A%2F%2A",
            "@multimediatype": "GIF image file",
            "@type": "IMAGE-THUMBNAIL",
            "@size": "10776",
            "@ref": "gr4",
            "@mimetype": "image/gif"
          },
          {
            "@category": "thumbnail",
            "@height": "84",
            "@width": "219",
            "@_fa": "true",
            "$": "https://api.elsevier.com/content/object/eid/1-s2.0-S2468823125003566-sc1.sml?httpAccept=%2A%2F%2A",
            "@multimediatype": "GIF image file",
            "@type": "IMAGE-THUMBNAIL",
            "@size": "10295",
            "@ref": "sc1",
            "@mimetype": "image/gif"
          },
          {
            "@category": "high",
            "@height": "1208",
            "@width": "1662",
            "@_fa": "true",
            "$": "https://api.elsevier.com/content/object/eid/1-s2.0-S2468823125003566-gr5_lrg.jpg?httpAccept=%2A%2F%2A",
            "@multimediatype": "JPEG image file",
            "@type": "IMAGE-HIGH-RES",
            "@size": "274545",
            "@ref": "gr5",
            "@mimetype": "image/jpeg"
          },
          {
            "@category": "high",
            "@height": "1206",
            "@width": "1667",
            "@_fa": "true",
            "$": "https://api.elsevier.com/content/object/eid/1-s2.0-S2468823125003566-gr6_lrg.jpg?httpAccept=%2A%2F%2A",
            "@multimediatype": "JPEG image file",
            "@type": "IMAGE-HIGH-RES",
            "@size": "282706",
            "@ref": "gr6",
            "@mimetype": "image/jpeg"
          },
          {
            "@category": "high",
            "@height": "1202",
            "@width": "3000",
            "@_fa": "true",
            "$": "https://api.elsevier.com/content/object/eid/1-s2.0-S2468823125003566-gr7_lrg.jpg?httpAccept=%2A%2F%2A",
            "@multimediatype": "JPEG image file",
            "@type": "IMAGE-HIGH-RES",
            "@size": "616044",
            "@ref": "gr7",
            "@mimetype": "image/jpeg"
          },
          {
            "@category": "high",
            "@height": "1210",
            "@width": "3000",
            "@_fa": "true",
            "$": "https://api.elsevier.com/content/object/eid/1-s2.0-S2468823125003566-gr8_lrg.jpg?httpAccept=%2A%2F%2A",
            "@multimediatype": "JPEG image file",
            "@type": "IMAGE-HIGH-RES",
            "@size": "436466",
            "@ref": "gr8",
            "@mimetype": "image/jpeg"
          },
          {
            "@category": "high",
            "@height": "1483",
            "@width": "2500",
            "@_fa": "true",
            "$": "https://api.elsevier.com/content/object/eid/1-s2.0-S2468823125003566-gr1_lrg.jpg?httpAccept=%2A%2F%2A",
            "@multimediatype": "JPEG image file",
            "@type": "IMAGE-HIGH-RES",
            "@size": "277596",
            "@ref": "gr1",
            "@mimetype": "image/jpeg"
          },
          {
            "@category": "high",
            "@height": "4024",
            "@width": "3000",
            "@_fa": "true",
            "$": "https://api.elsevier.com/content/object/eid/1-s2.0-S2468823125003566-gr2_lrg.jpg?httpAccept=%2A%2F%2A",
            "@multimediatype": "JPEG image file",
            "@type": "IMAGE-HIGH-RES",
            "@size": "1359064",
            "@ref": "gr2",
            "@mimetype": "image/jpeg"
          },
          {
            "@category": "high",
            "@height": "842",
            "@width": "2213",
            "@_fa": "true",
            "$": "https://api.elsevier.com/content/object/eid/1-s2.0-S2468823125003566-ga1_lrg.jpg?httpAccept=%2A%2F%2A",
            "@multimediatype": "JPEG image file",
            "@type": "IMAGE-HIGH-RES",
            "@size": "221074",
            "@ref": "ga1",
            "@mimetype": "image/jpeg"
          },
          {
            "@category": "high",
            "@height": "1415",
            "@width": "1667",
            "@_fa": "true",
            "$": "https://api.elsevier.com/content/object/eid/1-s2.0-S2468823125003566-gr3_lrg.jpg?httpAccept=%2A%2F%2A",
            "@multimediatype": "JPEG image file",
            "@type": "IMAGE-HIGH-RES",
            "@size": "254232",
            "@ref": "gr3",
            "@mimetype": "image/jpeg"
          },
          {
            "@category": "high",
            "@height": "1384",
            "@width": "1667",
            "@_fa": "true",
            "$": "https://api.elsevier.com/content/object/eid/1-s2.0-S2468823125003566-gr4_lrg.jpg?httpAccept=%2A%2F%2A",
            "@multimediatype": "JPEG image file",
            "@type": "IMAGE-HIGH-RES",
            "@size": "244925",
            "@ref": "gr4",
            "@mimetype": "image/jpeg"
          },
          {
            "@category": "high",
            "@height": "1148",
            "@width": "3000",
            "@_fa": "true",
            "$": "https://api.elsevier.com/content/object/eid/1-s2.0-S2468823125003566-sc1_lrg.jpg?httpAccept=%2A%2F%2A",
            "@multimediatype": "JPEG image file",
            "@type": "IMAGE-HIGH-RES",
            "@size": "346910",
            "@ref": "sc1",
            "@mimetype": "image/jpeg"
          },
          {
            "@category": "thumbnail",
            "@_fa": "true",
            "$": "https://api.elsevier.com/content/object/eid/1-s2.0-S2468823125003566-si1.svg?httpAccept=%2A%2F%2A",
            "@multimediatype": "Scalable Vector Graphics file",
            "@type": "ALTIMG",
            "@size": "11675",
            "@ref": "si1",
            "@mimetype": "image/svg+xml"
          },
          {
            "@category": "thumbnail",
            "@_fa": "true",
            "$": "https://api.elsevier.com/content/object/eid/1-s2.0-S2468823125003566-si2.svg?httpAccept=%2A%2F%2A",
            "@multimediatype": "Scalable Vector Graphics file",
            "@type": "ALTIMG",
            "@size": "13551",
            "@ref": "si2",
            "@mimetype": "image/svg+xml"
          },
          {
            "@category": "thumbnail",
            "@_fa": "true",
            "$": "https://api.elsevier.com/content/object/eid/1-s2.0-S2468823125003566-si3.svg?httpAccept=%2A%2F%2A",
            "@multimediatype": "Scalable Vector Graphics file",
            "@type": "ALTIMG",
            "@size": "16783",
            "@ref": "si3",
            "@mimetype": "image/svg+xml"
          }
        ]
      },
      "link": {
        "@rel": "abstract",
        "@href": "https://api.elsevier.com/content/abstract/scopus_id/105004361478"
      }
    }
  }
}