{
  "metadata": {
    "title": "Theoretical insight of pyrite-like bimetallic diselenides for oxygen reduction reaction",
    "authors": "; ; ",
    "journal": "Molecular Catalysis",
    "date": "2024-05-01",
    "doi": "10.1016/j.mcat.2024.114129",
    "abstract": "",
    "uri": "https://api.elsevier.com/content/article/pii/S2468823124003122",
    "pii": "S2468823124003122"
  },
  "fulltext": {
    "full-text-retrieval-response": {
      "scopus-eid": "2-s2.0-85190349791",
      "originalText": "serial JL 315758 291210 291744 291790 291809 31 Molecular Catalysis MOLECULARCATALYSIS 2024-04-16 2024-04-16 2024-04-16 2024-04-16 2024-04-25T19:58:46 1-s2.0-S2468823124003122 S2468-8231(24)00312-2 S2468823124003122 10.1016/j.mcat.2024.114129 S300 S300.1 FULL-TEXT 1-s2.0-S2468823124X00061 2024-06-04T00:32:32.225288Z 0 0 20240501 2024 2024-04-16T16:29:56.754967Z absattachment articleinfo articlenumber articletitlenorm authfirstinitialnorm authfirstsurnamenorm cid cids contenttype copyright crossmark dateloaded dateloadedtxt datesearch datesort dateupdated dco docsubtype doctype doi eid ewtransactionid hubeid indexeddate issn issnnorm itemstage itemtransactionid itemweight openaccess openarchive pg pgfirst pii piinorm pubdatestart pubdatetxt pubyr sectiontitle sortorder srctitle srctitlenorm srctype ssids alllist content subj subheadings suppl tomb volfirst volissue volumelist webpdf webpdfpagecount yearnav figure e-component body mmlmath acknowledge affil appendices articletitle auth authfirstini authfull authkeywords authlast grantnumber grantsponsor grantsponsorid highlightsabst orcid primabst ref specialabst 2468-8231 24688231 true 560 560 C Volume 560 29 114129 114129 114129 20240501 1 May 2024 2024-05-01 2024 Regular Papers article fla © 2024 Elsevier B.V. All rights reserved. THEORETICALINSIGHTPYRITELIKEBIMETALLICDISELENIDESFOROXYGENREDUCTIONREACTION YI J 1 Introduction 2 Computational methods 3 Results and discussion 3.1 The structures and stabilities of A0.5B0.5Se2 3.2 The catalytical activity and mechanism of A0.5B0.5Se2 3.3 The linear scaling relationships of A0.5B0.5Se2 3.4 The origin of high-performance A0.5B0.5Se2 4 Conclusions Appendix A. Supplementary material CRediT authorship contribution statement Acknowledgements Appendix Supplementary materials References CHU 2017 16 22 S CHU 2012 294 303 S BRUCE 2012 19 29 P CANO 2018 279 289 Z OLABI 2021 118955 A CARRETTE 2001 5 39 B RAHMAN 2013 A1759 A1771 M YU 2019 26744 26768 W NORSKOV 2004 17886 17892 J LU 2022 6067 6075 R NIE 2015 2168 2201 Y SNITKOFFSOL 2022 163 170 R ZENG 2022 eabj1584 R HE 2022 1216 1227 Y QIU 2019 1900843 H YANG 2019 2158 2163 Z YU 2021 2101242 D ZHOU 2019 1807468 T ZHU 2021 3923 3929 M ALI 2023 108980 H LIN 2019 408 423 L AFTAB 2023 144039 S SOHN 2024 158906 I GUO 2022 112625 J HOU 2023 112967 P LEI 2020 058104 B SUN 2019 103996 Z CHUA 2016 5724 5734 X DOU 2019 1800211 S LIU 2019 4897 4903 Z MANZELI 2017 17033 S SONG 2022 4687 4692 Z YANG 2018 1803477 S CAO 2021 3464 3471 Y ZHAO 2019 8605 8614 W ZHENG 2018 2019 2028 J LEE 2022 19911 19918 W KULKARNI 2018 2302 2312 A ZHOU 2017 4335 4342 M KRESSE 1996 15 50 G KRESSE 1996 11169 G BLOCHL 1994 17953 17979 P PERDEW 1996 3865 J DUDAREV 1998 1505 S MA 2021 233 242 X MONKHORST 1976 5188 5192 H HENKELMAN 2006 354 360 G DERINGER 2011 5461 5466 V TOGO 2008 134106 A TOGO 2015 1 5 A PARLINSKI 1997 4063 K WANG 2021 108033 V LIU 2000 1685 1700 Y XIE 2020 5142 5149 Z LIU 2017 1606521 B QIAN 2016 29486 29495 X MEDFORD 2015 36 42 A GAMBO 2022 118658 Y LIU 2021 120451 H PEI 2021 1203 1204 C LIU 2024 351 360 C WANG 2023 112879 D FU 2024 2284 2290 Q YIX2024X114129 YIX2024X114129XJ 2026-04-16T00:00:00.000Z 2026-04-16T00:00:00.000Z http://creativecommons.org/licenses/by-nc-nd/4.0/ © 2024 Elsevier B.V. All rights reserved. 2024-04-27T16:09:23.290Z http://vtw.elsevier.com/data/voc/AddOnTypes/50.7/aggregated-refined http://sws.geonames.org/1814991 National Key R&amp;D program of China 2022YFA1204100 2019YFA0308500 NKRDPC National Key Research and Development Program of China http://data.elsevier.com/vocabulary/SciValFunders/501100012166 http://sws.geonames.org/1814991/ http://sws.geonames.org/1814991 Fundamental Research Funds for the Central Universities Fundamental Research Funds for the Central Universities http://data.elsevier.com/vocabulary/SciValFunders/501100012226 http://sws.geonames.org/1814991/ CAS YSBR-003 CAS Chinese Academy of Sciences http://data.elsevier.com/vocabulary/SciValFunders/501100002367 http://sws.geonames.org/1814991/ National Natural Science Foundation of China 52250402 61888102 NSFC National Natural Science Foundation of China http://data.elsevier.com/vocabulary/SciValFunders/501100001809 http://sws.geonames.org/1814991/ http://sws.geonames.org/1814991 http://sws.geonames.org/1814991 CAS Key Laboratory of Vacuum Physics This work was supported by the National Key R&amp;D program of China (No. 2019YFA0308500 and 2022YFA1204100), the National Natural Science Foundation of China (No. 52250402 and 61888102), CAS Project for Young Scientists in Basic Research (YSBR-003), and the Fundamental Research Funds for the Central Universities. A portion of the research was performed in CAS Key Laboratory of Vacuum Physics. https://doi.org/10.15223/policy-017 https://doi.org/10.15223/policy-037 https://doi.org/10.15223/policy-012 https://doi.org/10.15223/policy-029 https://doi.org/10.15223/policy-004 item S2468-8231(24)00312-2 S2468823124003122 1-s2.0-S2468823124003122 10.1016/j.mcat.2024.114129 315758 2024-06-04T00:32:32.225288Z 2024-05-01 1-s2.0-S2468823124003122-main.pdf https://s3-eu-west-1.amazonaws.com/prod-ucs-content-store-eu-west/content/pii:S2468823124003122/MAIN/application/pdf/fc5e6e8ce594cb34f1b0587a61e1897d/main.pdf main.pdf pdf true 3807384 MAIN 7 1-s2.0-S2468823124003122-main_1.png https://s3-eu-west-1.amazonaws.com/prod-ucs-content-store-eu-west/content/pii:S2468823124003122/PREVIEW/image/png/db1b0f3e4d246971d8e6aa8cd5df76c7/main_1.png main_1.png png 59203 849 656 IMAGE-WEB-PDF 1 1-s2.0-S2468823124003122-gr1.jpg https://s3-eu-west-1.amazonaws.com/prod-ucs-content-store-eu-west/content/pii:S2468823124003122/gr1/DOWNSAMPLED/image/jpeg/02259ff39019ca415b0b2fd0173af685/gr1.jpg gr1 gr1.jpg jpg 63100 395 434 IMAGE-DOWNSAMPLED 1-s2.0-S2468823124003122-gr3.jpg https://s3-eu-west-1.amazonaws.com/prod-ucs-content-store-eu-west/content/pii:S2468823124003122/gr3/DOWNSAMPLED/image/jpeg/f2318a925cfd0b52762f8ffb68c74056/gr3.jpg gr3 gr3.jpg jpg 31896 186 484 IMAGE-DOWNSAMPLED 1-s2.0-S2468823124003122-gr2.jpg https://s3-eu-west-1.amazonaws.com/prod-ucs-content-store-eu-west/content/pii:S2468823124003122/gr2/DOWNSAMPLED/image/jpeg/0cdb70d904f59d71a189f23896942973/gr2.jpg gr2 gr2.jpg jpg 81964 471 517 IMAGE-DOWNSAMPLED 1-s2.0-S2468823124003122-ga1.jpg https://s3-eu-west-1.amazonaws.com/prod-ucs-content-store-eu-west/content/pii:S2468823124003122/ga1/DOWNSAMPLED/image/jpeg/87e189de441f9dd6705a79b37ff3b460/ga1.jpg ga1 true ga1.jpg jpg 27314 200 313 IMAGE-DOWNSAMPLED 1-s2.0-S2468823124003122-gr4.jpg https://s3-eu-west-1.amazonaws.com/prod-ucs-content-store-eu-west/content/pii:S2468823124003122/gr4/DOWNSAMPLED/image/jpeg/96ebab8fa25f3c1858acbb71e51415de/gr4.jpg gr4 gr4.jpg jpg 66274 405 464 IMAGE-DOWNSAMPLED 1-s2.0-S2468823124003122-gr1.sml https://s3-eu-west-1.amazonaws.com/prod-ucs-content-store-eu-west/content/pii:S2468823124003122/gr1/THUMBNAIL/image/gif/88d7d0ec0b855753bb1ac2c8e966d760/gr1.sml gr1 gr1.sml sml 14262 164 180 IMAGE-THUMBNAIL 1-s2.0-S2468823124003122-gr3.sml https://s3-eu-west-1.amazonaws.com/prod-ucs-content-store-eu-west/content/pii:S2468823124003122/gr3/THUMBNAIL/image/gif/303b29779e7b0bd671f20a9c4d84a019/gr3.sml gr3 gr3.sml sml 7422 84 219 IMAGE-THUMBNAIL 1-s2.0-S2468823124003122-gr2.sml https://s3-eu-west-1.amazonaws.com/prod-ucs-content-store-eu-west/content/pii:S2468823124003122/gr2/THUMBNAIL/image/gif/ba7c3ba4e0219329f1f71b4f1bc00c06/gr2.sml gr2 gr2.sml sml 12378 164 180 IMAGE-THUMBNAIL 1-s2.0-S2468823124003122-ga1.sml https://s3-eu-west-1.amazonaws.com/prod-ucs-content-store-eu-west/content/pii:S2468823124003122/ga1/THUMBNAIL/image/gif/b00cb49fd8ce1d07ac313afac15bfcc1/ga1.sml ga1 true ga1.sml sml 10668 140 219 IMAGE-THUMBNAIL 1-s2.0-S2468823124003122-gr4.sml https://s3-eu-west-1.amazonaws.com/prod-ucs-content-store-eu-west/content/pii:S2468823124003122/gr4/THUMBNAIL/image/gif/76f762eeda29a126247fa0e4cfeadd77/gr4.sml gr4 gr4.sml sml 12521 164 188 IMAGE-THUMBNAIL 1-s2.0-S2468823124003122-gr1_lrg.jpg https://s3-eu-west-1.amazonaws.com/prod-ucs-content-store-eu-west/content/pii:S2468823124003122/HIGHRES/image/jpeg/f64ffd5cb96b22f2bee1c12d9068482f/gr1_lrg.jpg gr1 gr1_lrg.jpg jpg 513605 1753 1924 IMAGE-HIGH-RES 1-s2.0-S2468823124003122-gr3_lrg.jpg https://s3-eu-west-1.amazonaws.com/prod-ucs-content-store-eu-west/content/pii:S2468823124003122/HIGHRES/image/jpeg/bbfd0a157d6abee2d1c008ddda8d38ff/gr3_lrg.jpg gr3 gr3_lrg.jpg jpg 192632 823 2142 IMAGE-HIGH-RES 1-s2.0-S2468823124003122-gr2_lrg.jpg https://s3-eu-west-1.amazonaws.com/prod-ucs-content-store-eu-west/content/pii:S2468823124003122/HIGHRES/image/jpeg/54413e4cd429fec3ccac364463c7bd3c/gr2_lrg.jpg gr2 gr2_lrg.jpg jpg 587422 2089 2292 IMAGE-HIGH-RES 1-s2.0-S2468823124003122-ga1_lrg.jpg https://s3-eu-west-1.amazonaws.com/prod-ucs-content-store-eu-west/content/pii:S2468823124003122/HIGHRES/image/jpeg/4172c1cb86f26e7653e52bbe439031fb/ga1_lrg.jpg ga1 true ga1_lrg.jpg jpg 175608 886 1388 IMAGE-HIGH-RES 1-s2.0-S2468823124003122-gr4_lrg.jpg https://s3-eu-west-1.amazonaws.com/prod-ucs-content-store-eu-west/content/pii:S2468823124003122/HIGHRES/image/jpeg/fc5cb0d5a4067caa89ea2046815b46a6/gr4_lrg.jpg gr4 gr4_lrg.jpg jpg 519336 1794 2054 IMAGE-HIGH-RES 1-s2.0-S2468823124003122-mmc1.docx https://s3-eu-west-1.amazonaws.com/prod-ucs-content-store-eu-west/content/pii:S2468823124003122/mmc1/MAIN/application/vnd.openxmlformats-officedocument.wordprocessingml.document/363f221b48b48bc3c034865189ee7d5a/mmc1.docx mmc1 mmc1.docx docx 3732000 APPLICATION 1-s2.0-S2468823124003122-si1.svg https://s3-eu-west-1.amazonaws.com/prod-ucs-content-store-eu-west/content/pii:S2468823124003122/image/svg+xml/a5e5544b0bf1744a3f088bc6d2bd05a2/si1.svg si1 si1.svg svg 551 ALTIMG 1-s2.0-S2468823124003122-si10.svg https://s3-eu-west-1.amazonaws.com/prod-ucs-content-store-eu-west/content/pii:S2468823124003122/image/svg+xml/5dcee4529b13ffb6d5600cc7086ed858/si10.svg si10 si10.svg svg 6322 ALTIMG 1-s2.0-S2468823124003122-si11.svg https://s3-eu-west-1.amazonaws.com/prod-ucs-content-store-eu-west/content/pii:S2468823124003122/image/svg+xml/3437d7d240b00a42cbbf2631e0c7928d/si11.svg si11 si11.svg svg 1474 ALTIMG 1-s2.0-S2468823124003122-si12.svg https://s3-eu-west-1.amazonaws.com/prod-ucs-content-store-eu-west/content/pii:S2468823124003122/image/svg+xml/7da72cf65b82e5cf392ab62589dbf438/si12.svg si12 si12.svg svg 3238 ALTIMG 1-s2.0-S2468823124003122-si13.svg https://s3-eu-west-1.amazonaws.com/prod-ucs-content-store-eu-west/content/pii:S2468823124003122/image/svg+xml/c6404aade14034be09ddb8e4dfcc6531/si13.svg si13 si13.svg svg 1522 ALTIMG 1-s2.0-S2468823124003122-si14.svg https://s3-eu-west-1.amazonaws.com/prod-ucs-content-store-eu-west/content/pii:S2468823124003122/image/svg+xml/adf3d2b8f8d21c59d74ace425c7c2a98/si14.svg si14 si14.svg svg 8293 ALTIMG 1-s2.0-S2468823124003122-si15.svg https://s3-eu-west-1.amazonaws.com/prod-ucs-content-store-eu-west/content/pii:S2468823124003122/image/svg+xml/0a3d822bb7aa003346b928c0ddec739b/si15.svg si15 si15.svg svg 7308 ALTIMG 1-s2.0-S2468823124003122-si16.svg https://s3-eu-west-1.amazonaws.com/prod-ucs-content-store-eu-west/content/pii:S2468823124003122/image/svg+xml/d0d233810d7e52a11ecfe5c2dd1afbcb/si16.svg si16 si16.svg svg 5792 ALTIMG 1-s2.0-S2468823124003122-si17.svg https://s3-eu-west-1.amazonaws.com/prod-ucs-content-store-eu-west/content/pii:S2468823124003122/image/svg+xml/f249db1a41ea186fbaa4d8f1cdbaf356/si17.svg si17 si17.svg svg 6671 ALTIMG 1-s2.0-S2468823124003122-si18.svg https://s3-eu-west-1.amazonaws.com/prod-ucs-content-store-eu-west/content/pii:S2468823124003122/image/svg+xml/d71783db9122583ab2ba3d50f856d5bb/si18.svg si18 si18.svg svg 13298 ALTIMG 1-s2.0-S2468823124003122-si19.svg https://s3-eu-west-1.amazonaws.com/prod-ucs-content-store-eu-west/content/pii:S2468823124003122/image/svg+xml/ad51b0a1a2b7b0c79b6a5406dafb7c7a/si19.svg si19 si19.svg svg 12414 ALTIMG 1-s2.0-S2468823124003122-si2.svg https://s3-eu-west-1.amazonaws.com/prod-ucs-content-store-eu-west/content/pii:S2468823124003122/image/svg+xml/44bba3c28c8432cce42c01466e10c851/si2.svg si2 si2.svg svg 5421 ALTIMG 1-s2.0-S2468823124003122-si20.svg https://s3-eu-west-1.amazonaws.com/prod-ucs-content-store-eu-west/content/pii:S2468823124003122/image/svg+xml/fa297b14f92b6ac17005ef339f28f22b/si20.svg si20 si20.svg svg 6914 ALTIMG 1-s2.0-S2468823124003122-si21.svg https://s3-eu-west-1.amazonaws.com/prod-ucs-content-store-eu-west/content/pii:S2468823124003122/image/svg+xml/a21081f0a4ae15fbff5f634a4d9c6a7b/si21.svg si21 si21.svg svg 1825 ALTIMG 1-s2.0-S2468823124003122-si22.svg https://s3-eu-west-1.amazonaws.com/prod-ucs-content-store-eu-west/content/pii:S2468823124003122/image/svg+xml/bf2622bb5b6ab367f4d79cd8450e08db/si22.svg si22 si22.svg svg 2080 ALTIMG 1-s2.0-S2468823124003122-si23.svg https://s3-eu-west-1.amazonaws.com/prod-ucs-content-store-eu-west/content/pii:S2468823124003122/image/svg+xml/5f4ac122a9bd862f1cc00e0b6dd571b0/si23.svg si23 si23.svg svg 2578 ALTIMG 1-s2.0-S2468823124003122-si3.svg https://s3-eu-west-1.amazonaws.com/prod-ucs-content-store-eu-west/content/pii:S2468823124003122/image/svg+xml/a4cc4ad42e40aa1fe4b628e0ce9174c8/si3.svg si3 si3.svg svg 5459 ALTIMG 1-s2.0-S2468823124003122-si4.svg https://s3-eu-west-1.amazonaws.com/prod-ucs-content-store-eu-west/content/pii:S2468823124003122/image/svg+xml/7fd5c32023533170b8747a5f3ea331db/si4.svg si4 si4.svg svg 4685 ALTIMG 1-s2.0-S2468823124003122-si5.svg https://s3-eu-west-1.amazonaws.com/prod-ucs-content-store-eu-west/content/pii:S2468823124003122/image/svg+xml/498423f49e332b74b512120d70c49dc2/si5.svg si5 si5.svg svg 5419 ALTIMG 1-s2.0-S2468823124003122-si6.svg https://s3-eu-west-1.amazonaws.com/prod-ucs-content-store-eu-west/content/pii:S2468823124003122/image/svg+xml/5b3bfcbb676a42dd798d506c24709612/si6.svg si6 si6.svg svg 1628 ALTIMG 1-s2.0-S2468823124003122-si7.svg https://s3-eu-west-1.amazonaws.com/prod-ucs-content-store-eu-west/content/pii:S2468823124003122/image/svg+xml/2613afac7e2c241644deaf20660b1f64/si7.svg si7 si7.svg svg 2865 ALTIMG 1-s2.0-S2468823124003122-si8.svg https://s3-eu-west-1.amazonaws.com/prod-ucs-content-store-eu-west/content/pii:S2468823124003122/image/svg+xml/4fa7341fe2a0f314d5f9694eb5d49150/si8.svg si8 si8.svg svg 2141 ALTIMG 1-s2.0-S2468823124003122-si9.svg https://s3-eu-west-1.amazonaws.com/prod-ucs-content-store-eu-west/content/pii:S2468823124003122/image/svg+xml/2da2f020d8b9e9725dbb8f248a6ce8cf/si9.svg si9 si9.svg svg 2812 ALTIMG 1-s2.0-S2468823124003122-am.pdf am am.pdf pdf 682917 AAM-PDF https://s3-eu-west-1.amazonaws.com/prod-ucs-content-store-eu-west/content/egi:106F1JXS14J/MAIN/application/pdf/db341afe5e9655b89ffaf5ae516cfb2d/am.pdf MCAT 114129 114129 S2468-8231(24)00312-2 10.1016/j.mcat.2024.114129 Elsevier B.V. Fig. 1 The atomic structures and stabilities of pyrite-like bimetallic diselenides. (a) The configurations of bimetallic diselenides A0.5B0.5Se2 (A = Mn, Fe, Co, Ni, B = Cu, Cd, Sn). Blue, pink and green balls denote transition metal A (TM-A), transition metal B (TM-B) and Se atoms, respectively. (b) The phonon dispersion and phonon density of states diagrams of Co0.5Sn0.5Se2 (a typical A0.5B0.5Se2). (c) The formation energies of all A0.5B0.5Se2. Fig 1 Fig. 2 The ORR catalytic mechanism and activities of ASe2 and A0.5B0.5Se2. (a) The schematic diagram of tandem catalysis mechanism. The free energy diagrams of two representative (b) Co0.5Cd0.5Se2 and (c) Co0.5Sn0.5Se2 catalysts for ORR tandem catalysis, where the solid lines represent the rate-determining steps (RDS). (d) The ORR overpotentials of the ASe2 and A0.5B0.5Se2 catalysts, where the red dash line represents the data of benchmark Pt (0.45 V) as a Ref. [9]. Fig 2 Fig. 3 The relationships of free energies of intermediates on different ASe2 and A0.5B0.5Se2 catalysts. (a) ΔG O* vs. ΔG OH* and (b) ΔG OOH* vs. ΔG OH* associated with the ASe2 (blue) and A0.5B0.5Se2 (pink) catalysts, where the black dash lines represent the standard linear scaling relationships as references. Fig 3 Fig. 4 Bader charge and projected density of state (PDOS) analysis for ASe2 and A0.5B0.5Se2 catalysts. (a) The numbers of electron lost at metallic sites in ASe2 and A0.5B0.5Se2, where the ΔQ e (green parts) represent the variance in the numbers of electron lost by corresponding metal elements in ASe2 and A0.5B0.5Se2. The PDOS analysis on (b) Co in CoSe2, Cd in CdSe2, Co and Cd in Co0.5Cd0.5Se2, (c) Co in CoSe2, Sn in SnSe2, Co and Sn in Co0.5Sn0.5Se2. Fig 4 Theoretical insight of pyrite-like bimetallic diselenides for oxygen reduction reaction Ju-Xia Yi Writing – original draft Investigation a Lei Tao Project administration a ⁎ Yu-Yang Zhang Project administration Funding acquisition a ⁎ Shi-Xuan Du Project administration Funding acquisition a b a University of Chinese Academy of Sciences and Institute of Physics, Chinese Academy of Sciences, Beijing 100190, China University of Chinese Academy of Sciences and Institute of Physics Chinese Academy of Sciences Beijing 100190 China aUniversity of Chinese Academy of Sciences and Institute of Physics, Chinese Academy of Sciences, Beijing 100190, China b Songshan Lake Materials Laboratory, Dongguan, Guangdong 523808, China Songshan Lake Materials Laboratory Dongguan Guangdong 523808 China bSongshan Lake Materials Laboratory, Dongguan, Guangdong 523808, China ⁎ Corresponding authors. Transition metal dichalcogenides (TMDs) have been widely considered as one of the promising candidates to replace platinum-based oxygen reduction reaction (ORR) catalysts due to their attractive properties. However, the single active site in such catalysts poses challenges in surpassing the inherent limits of scaling relations between adsorption energy of multi-intermediates in ORR catalytic process. Herein, inspired by the concept of multiple active centers, we design a series of stable pyrite-like bimetallic diselenides (A0.5B0.5Se2, A = Mn, Fe, Co, Ni, B = Cu, Cd, Sn) as catalysts, which aim at enhancing ORR catalytic activity through synergistic effect in dual active sites. Through density functional theory calculations, we find that the ORR activities of most A0.5B0.5Se2 catalysts are comparable to or even better than those of the noble metal Pt, verifying the promotional ORR activities of A0.5B0.5Se2. Among them, Co0.5Sn0.5Se2 has an overpotential of 0.31 V, which shows better catalytic performance than Pt for ORR. Such improvement is attributed to the tandem reaction mechanism and the reduction in the barrier for the rate-determining steps, resulting from the presence of dual active sites within Co0.5Sn0.5Se2. The projected density of states (PDOS) and Bader charge analysis reveal that the excellent catalytic activity is contributed by the strong d-p orbital hybridization between Co and Sn in the Co0.5Sn0.5Se2, which significantly weakens the over-adsorption of the crucial O* intermediates. These findings provide valuable theoretical insights for designing optimum ORR catalysts. Graphical abstract Image, graphical abstract Keywords Pyrite-like bimetallic diselenides Oxygen reduction reaction Dual active sites Tandem catalysis mechanism Synergistic effect Data availability Data will be made available on request. 1 Introduction The increasing environmental concerns and the global energy crisis due to the depletion of traditional fossil fuels have motivated for searching the sustainable and renewable energy sources [1,2]. Energy technologies such as fuel cells and metal-air batteries are practical, environmentally friendly and efficient solutions in the fields of energy conversion and storage [3–8]. Particularly, oxygen reduction reaction (ORR) plays a crucial role in these electrochemical energy technologies [9]. Platinum-based catalysts show excellent ORR performance and have been extensively utilized as electrocatalysts for oxygen reduction. However, the high cost of Pt-based catalysts limits the practical application of these materials on a large scale [9–11]. Given this, a large number of highly active, robust, and cost-effective electrocatalysts free of noble Pt metals have been investigated [12–19]. Among them, transition metal dichalcogenides (TMDs) are promising candidates due to their earth abundance and robustness. These materials have been widely reported in energy storage [20,21], sensing [22,23], and multifunctional catalysis [24,25]. Moreover, their multiphase structures suggest the potential for tuning catalytic performance [26–33]. For example, hexagonal FeSe (h-FeSe) has been experimentally confirmed to be more efficient than tetragonal FeSe (t-FeSe) towards alkaline ORR [34]. The cubic pyrite phase of TMDs materials as catalysts has also been reported in electrocatalytic reactions. The cases in point are that cubic NiSe2 and CoS2 are experimentally potential ORR catalysts, but their performance still needs to be improved [35,36]. The cubic pyrite CoSe2 has been theoretically predicted to possess the rate-limiting barrier in ORR of 0.43 V, which is comparable to Pt (0.45 V) but not significantly improved [37]. One of the main reasons that limit the catalytic activity is the linear scaling relationships of free energies of intermediates (O*, OH*, and OOH*) at a single active center in ORR catalytic processes, which is difficult to exceed the inherent limit of multi-intermediate reactions due to the lack of synergistic active centers [38]. More importantly, such cubic TMDs catalysts are still far from exhibiting excellent ORR catalytic performance with the sluggish reaction kinetics, mainly because of their relatively strong adsorption for reaction intermediates O* group [37,39]. Therefore, it remains a challenge of designing highly active TMDs catalysts that are capable of achieving top ORR performance. In this paper, motivated by the concept of multiple active centers, we design a series of pyrite-like bimetallic diselenides (A0.5B0.5Se2, A = Mn, Fe, Co, Ni, B = Cu, Cd, Sn) to enhance catalytic performance of TMDs materials. Through density functional theory calculations, we systematically investigate the ORR catalytic activities and synergistic effects of all stable A0.5B0.5Se2 electrocatalysts. Our results show that the ORR theoretical overpotentials of A0.5B0.5Se2 are remarkably lower than those of intrinsic ASe2 materials. Among them, the ORR activities of most A0.5B0.5Se2 catalysts are comparable to or even better than those of the noble metal Pt, verifying the excellent ORR performances of A0.5B0.5Se2. Particularly, the Co0.5Sn0.5Se2 catalyst with an overpotential of 0.31 V exhibits the best ORR performance, which is ascribed to the synergistic effect resulting from the presence of dual active sites within Co0.5Sn0.5Se2, leading to a tandem reaction mechanism and a reduction in the barrier for the rate-determining steps. The projected density of states and Bader charge analysis reveal that the enhanced catalytic activity is contributed by the strong d-p orbital hybridization between Co and Sn in the Co0.5Sn0.5Se2, which independently weakens the over-adsorption of the key O* intermediates without affecting the adsorption of OH* and OOH* intermediates. Furthermore, the standard linear scaling relationships between the free energies of three intermediates (ΔG OOH* vs. ΔG OH* and ΔG O* vs. ΔG OH*) in the Co0.5Sn0.5Se2 are successfully established, consequently improving the ORR activity. This theoretical insight provides a valuable guideline to optimize the catalytic activities of ORR catalysts in the future. 2 Computational methods First-principle calculations based on spin-polarized density functional theory (DFT) were performed by using the Vienna ab initio simulation package (VASP) [40,41]. The interactions between core electrons and valence electrons were described via the projected-augmented-wave (PAW) method [42]. The exchange-correlation functional was described by the Perdew-Burke-Ernzerhof (PBE) generalized gradient approximation (GGA) [43]. The Hubbard's U correction scheme was applied with Ueff = 4 eV for transition metal elements (Mn, Fe, Co, Ni, Cu) with 3d electrons [44,45]. Using the optimized bulk structures, the most stable (100) surface structures with four layers were constructed and the bottom two layers were fixed in the geometry optimization. A 15 Å vacuum layer was used to eliminate the interactions with the periodic images along the Z-axial direction. The electronic wavefunctions were expanded on a plane wave basis with an energy cutoff of 450 eV. A Γ-centered Monkhorst-Pack k-point sampling of 2 × 2 × 1 was employed for all surface calculations [46]. All atoms were fully relaxed until the energy and residual forces on each atom were smaller than 10−6 eV and 10−2 eV·Å−1, respectively. Bader charge analysis was used to explore the charge change of atoms in all bulk systems [47]. Crystal orbital Hamilton population (COHP) analysis was performed using the Lobster program [48]. The phonon dispersion was calculated based on a 2 × 2 × 2 supercell using the finite displacement method as implemented in the PHONOPY package [49–51]. The phonon density of states was obtained according to the element type. The Gibbs free energy was calculated by post-processing the VASP-calculated data using the VASPKIT program [52]. Ab initio molecular dynamical simulations (AIMD) were performed under an NVT ensemble with a temperature of 300 K and 400 K for 5 ps [53]. The four-electron transfer reaction pathways of ORR in an acidic medium have been widely investigated, and the four elementary steps can be described by the following equations: (1) * + O 2 + H + + e − → OO H * (2) OO H * + H + + e − → O * + H 2 O (3) O * + H + + e − → O H * (4) O H * + H + + e − → * + H 2 O where * , OO H * , O * , and O H * indicate the adsorption site of the catalyst surface, adsorbed reaction intermediates OOH, O, and OH, respectively. According to the computational hydrogen electrode (CHE) model suggested by Nørskov et al. [9], the free energy change of each elementary step is calculated at T = 298.15 K, pH = 0, and U = 0 V as the following equation: (5) Δ G = Δ E + Δ E ZPE − T Δ S where Δ E is the total energy change obtained from DFT calculations, Δ E ZPE and Δ S represent the zero-point energy and entropy changes, respectively. Since DFT cannot describe the energy of O2 well, the free energy of O2 molecule in the gas phase [9,54] is calculated by (6) G O 2 ( g ) = 2 G H 2 O − 2 G H 2 + 4.92 V The adsorption free energies of three key ORR intermediates (OOH*, O*, and OH*) were calculated as follows (7) Δ G OOH * = G OOH * − G * − 2 G H 2 O + 3 / 2 G H 2 (8) Δ G O * = G O * − G * − G H 2 O + G H 2 (9) Δ G OH * = G OH * − G * − G H 2 O + 1 / 2 G H 2 The overpotential is defined to describe the ORR catalytic activity as shown in the following Eq. (10), and the maximum ΔG among the four elementary steps would determine the reaction rate, that is, the rate-determining step (RDS). (10) η ORR = max [ Δ G 1 , Δ G 2 , Δ G 3 , Δ G 4 ] e + 1.23 V The formation energy of A0.5B0.5Se2 is calculated according to Eq. (11), defined as (11) E form = E A 0.5 B 0.5 S e 2 − 0.5 μ A − 0.5 μ B − 2 μ Se where E A 0.5 B 0.5 S e 2 are the total energies of the A0.5B0.5Se2 systems, μ A , μ B , and μ Se are the chemical potential of A atom, B atom, and Se atom, respectively. It is noted that μ A and μ B are the energies of A and B atoms in the corresponding bulk materials, and μ Se is the energy of a Se atom in the Se8 molecule. 3 Results and discussion 3.1 The structures and stabilities of A0.5B0.5Se2 The atomic structure of A0.5B0.5Se2 (A = Mn, Fe, Co, Ni, B = Cu, Cd, Sn; for details on the selection of element B see Fig. S1 and Table S1 in the Supplementary Material (SM)) is shown in Fig. 1 (a), where the primitive cell contains four A0.5B0.5Se2 formula units. The A0.5B0.5Se2 adopts a pyrite-like lattice with the P2 1 /c (No. 14) space group. The metal atoms are coordinated to six neighboring selenium atoms. Each selenium atom is coordinated with three metal atoms and one selenium atom, forming a tetrahedron. The calculated magnetic properties of 12 kinds of A0.5B0.5Se2 are represented in Table S2 in the SM. It's worth noting that the magnetic ground states of A0.5B0.5Se2 are all antiferromagnetic, except for the Mn0.5Cu0.5Se2 and Fe0.5Cu0.5Se2. Besides, A0.5Cu0.5Se2 and A0.5Sn0.5Se2 are metallic while all A0.5Cd0.5Se2 are semiconductors. For designing A0.5B0.5Se2 as electrocatalysts, one of the key issues is the structural stability, which can be evaluated by the phonon dispersions, AIMD simulation, formation energy and energy-above-hull analysis. As shown in the Fig. 1(b) and Fig. S2 in the SM, it is found that no imaginary frequencies have been observed in the phonon dispersions of three representative bimetallic A0.5B0.5Se2 (Co0.5Cu0.5Se2, Co0.5Cd0.5Se2 and Co0.5Sn0.5Se2), proving the dynamic stability of A0.5B0.5Se2 catalysts. Moreover, no obvious structural deformation after 300 K and 400 K AIMD simulations for 5 ps (Fig. S3 in the SM), confirming the thermodynamic stability of A0.5B0.5Se2 electrocatalysts. According to Eq. (11) in the SM, the resulting formation energies of all A0.5B0.5Se2 are negative, as displayed in Fig. 1(c), demonstrating their great promise for experimental synthesis. The relevant synthesis methods reported in previous literatures include microwave-assisted polyol process [36], solvothermal process combined with selenization [55], facile precursor transformation method [56] and so on. In addition, the energy-above-hull analysis of two representative A0.5B0.5Se2 such as Co0.5Cd0.5Se2 and Co0.5Sn0.5Se2 in Fig. S4 in the SM further demonstrates the thermal stability of those structures. Moreover, the stability of other AxBySe2 catalysts also have been considered. Taking A0.25B0.75Se2 as an example, the energy-above-hull analysis of Co0.25Cd0.75Se2 and Co0.25Sn0.75Se2 (as shown in the Fig. S4) indicate that they are also thermally stable. 3.2 The catalytical activity and mechanism of A0.5B0.5Se2 According to the Sabatier principle [57], in a multi-step reaction, it's crucial that the adsorption of intermediates onto the catalyst's surface should be at an appropriate level of strength. Hence, based on the interactions between adsorbed oxygenating species and catalytic sites, the synergy of two kinds of metal active sites in the A0.5B0.5Se2 contributes to the transfer of adsorbed intermediates between two active sites. For example, the ORR process on A0.5B0.5Se2 in Fig. 2 (a) represents a classical tandem catalysis mechanism [58–60], which reveals the synergistic effect of the two active sites. In the reaction process, according to the adsorption strength between reaction intermediates (O*, OH*, OOH*) and reaction sites (A and B), the adsorption of O2 and formation of OOH* occur on the A site, and subsequently, the next elementary reactions involving the formation of O* and OH* take place on the B site. This tandem catalysis mechanism, in principle, has weakened the over-bonding of O* species at the A site, thereby enhancing the ORR activity. Fig. 2(b)-(c) show the free energy diagrams of two representative bimetallic A0.5B0.5Se2 (Co0.5Cd0.5Se2 and Co0.5Sn0.5Se2) based on the tandem catalysis mechanism as well as those of ASe2 and BSe2 which only contain single transition metal element. It is found that the rate-determining steps (RDS) of CoSe2, CdSe2 and SnSe2 are O*-OH*, O*-OH* and OH*-H2O, respectively, and corresponding overpotentials are 0.45, 1.09 and 0.70 V, respectively. After optimization of the tandem catalysis mechanism, the RDS of Co0.5Cd0.5Se2 and Co0.5Sn0.5Se2 have been changed to O2-OOH* and OH*-H2O, respectively. And the overpotentials have been significantly reduced to 0.46 and 0.31 V, respectively. The free energy diagrams of other bimetallic A0.5B0.5Se2 are shown in the Fig. S5 in the SM, it is quite clear that the two active sites in the A0.5B0.5Se2 can take effect synergistically to optimize ORR pathway, and the rate-determining steps (RDS) have been adjusted compared with those of the intrinsic ASe2 and BSe2, sequentially accelerating the ORR. Fig. 2(d) summarizes the ORR overpotentials of seven types of monometallic ASe2 and the corresponding 12 bimetallic A0.5B0.5Se2 systems, respectively. The calculated overpotentials of A0.5B0.5Se2 based on the tandem catalysis mechanism are significantly lower than those of intrinsic ASe2 catalysts. Most A0.5B0.5Se2 catalysts have ORR activities that are comparable to or even better than the noble metal Pt. Among them, A0.5Sn0.5Se2 catalysts are remarkably superior to the A0.5Cu0.5Se2 and A0.5Cd0.5Se2. Of course, as long as the two active sites are exposed on the reactive surface, other AxBySe2 catalysts also possess the same excellent catalytic performance as A0.5B0.5Se2. Moreover, the OER and HER activities of A0.5B0.5Se2 as multifunctional catalysts [61,62] also have been considered. As shown in the Table S3, the HER overpotentials of A0.5B0.5Se2 is poor, but the OER overpotentials of Co0.5Sn0.5Se2 catalyst are significantly lower than those of Co0.5Cd0.5Se2 and Co0.5Cu0.5Se2. Among these, Co0.5Sn0.5Se2 catalyst shows an overpotential for OER of 0.65 V and ORR of 0.31 V, indicating its great potential as a bifunctional oxygen electrocatalyst. 3.3 The linear scaling relationships of A0.5B0.5Se2 It's widely acknowledged that linear scaling relationships exist between the free energies of oxygenating adsorbates (OOH*, O*, and OH*) on most catalysts, demonstrating that the free energies of intermediates are highly correlated with each other [38]. Based on the calculated free energies (Table S4-S7 in the SM), we compare ΔG O* as a function of ΔG OH* as well as ΔG OOH* as a function of ΔG OH* in the ASe2 and A0.5B0.5Se2, as shown in Fig. 3 (a)-(b). The black dotted lines represent the well-known linear scaling relationships, ΔG O* = 2ΔG OH* and ΔG OOH* = ΔG OH* + 3.2, which were proposed by Jens K. Nørskov [38]. It is worth noting that the relationship between ΔG O* and ΔG OH* significantly deviates from the dashed line in Fig. 3(a) because of the over-bonding of O* species in the ASe2, while it undergoes standard relationship in A0.5B0.5Se2. Furthermore, the correlation of ΔG OOH* and ΔG OH* in the ASe2 aligns well with the standard line, and this well-established linear scaling relationship remains in A0.5B0.5Se2. Therefore, the cooperative active sites in the A0.5B0.5Se2 can independently modulate the free energy of O* intermediates without changing the adsorption of OH* and OOH*, consequently enhancing the ORR activity. Given the crucial role that the free energy of O* (ΔG O*) plays in enhancing the ORR activity of A0.5B0.5Se2, larger ΔG O* can lead to lower overpotential (as shown in the Fig. S6(a) in the SM). Therefore, we further search for suitable physical quantities to describe qualitatively ΔG O* [63]. As shown in the Fig. S6 and Table S8 in the SM, it is found that the Pearson correlation coefficient (Pearson's r) between ΔG O*, ionization energy and the number of valence electrons is closest to 1. Particularly, the ionization energy can more intuitively reflect the difficulty of electrons participating in chemical reactions compared with the number of valence electrons. The larger ionization energy makes it difficult for the electrons of metal atoms at the active site to ionize, which subsequently results in the weaker interaction between the O* group and reactive center (larger ΔG O*). As a consequence, the ionization energy of metal atoms at the reaction center can become a feasible descriptor for quantifying the free energy of key O* species. 3.4 The origin of high-performance A0.5B0.5Se2 In order to gain a deep understanding of the synergistic effect contributing to the enhanced ORR performance of A0.5B0.5Se2, we carry out Bader charge analysis to reveal the changes in atomic charge for all systems. Fig. 4 (a) summarizes the numbers of electrons lost at each metal atom in all A0.5B0.5Se2, with the ΔQ e (green sections) representing the variance of the charge of corresponding metal elements in the ASe2 and A0.5B0.5Se2. It is clear that the charge transfer of Sn in the A0.5Sn0.5Se2 is significantly greater than that of SnSe2, indicating a substantial modulation of the electronic states of Sn in A0.5Sn0.5Se2. In contrast, the charge transfer of metal atoms in A0.5Cu0.5Se2 and A0.5Cd0.5Se2 are almost indistinguishable from that in ASe2. This phenomenon has been further verified by the PDOS analysis and electron localization function (ELF), as shown in the Fig. 4(b)-(c) and Fig. S7-S8 in the SM. Taking the PDOS of Co0.5Cd0.5Se2 and Co0.5Sn0.5Se2 as examples (Fig. 4(b)-(c)), the electronic states of Co, Cd atoms in Co0.5Cd0.5Se2 closely resemble those in CoSe2 and CdSe2, while the electronic states of Sn atoms in Co0.5Sn0.5Se2 differ from those in SnSe2. In the Fig. S8, it is found that the electrons in Co0.5Cd0.5Se2 are only localized on Se atoms, while the electrons in Co0.5Sn0.5Se2 are localized on Se atoms and Sn atoms. This indicates that the optimal ORR activity of A0.5Sn0.5Se2 is mainly contributed to the electronic states modulation of Sn induced by the synergistic effect between metal atoms. The interaction between transition-metal atoms in the A0.5B0.5Se2 is investigated by calculating Crystal Orbital Hamilton Population (COHP) and the integrated COHP (-ICOHP) which is the integration of COHP up to the Fermi level. As shown in Table S9 in the SM, it reveals relatively strong interactions between A and Sn atoms in A0.5Sn0.5Se2. In contrast, the interactions between metal atoms in A0.5Cu0.5Se2 and A0.5Cd0.5Se2 are negligible. Therefore, A0.5Cu0.5Se2 and A0.5Cd0.5Se2 have weak d-d orbital interactions between metal atoms, making them being simple solid solutions with only an ordinary tandem catalysis process for ORR. On the other hand, A0.5Sn0.5Se2 benefits from intense d-p orbital interactions between A and Sn, leading to the modulation of the local electronic structures of Sn. As a result, A0.5Sn0.5Se2 catalysts possess outstanding ORR performance. 4 Conclusions In summary, we provide comprehensive investigations of the ORR catalytic performances of a series of stable A0.5B0.5Se2 electrocatalysts. Our results demonstrate that the ORR activities of most A0.5B0.5Se2 catalysts are comparable to or even exceed those of the noble metal Pt. Particularly, the Co0.5Sn0.5Se2 catalyst with an overpotential of 0.31 V exhibits the best ORR performance. Such enhancement in the ORR electrocatalytic activities is attributed to the tandem catalysis mechanism and strong d-p orbital hybridization between Co and Sn in the Co0.5Sn0.5Se2 catalysts, which significantly weaken the over-binding of the key O* intermediates without affecting the adsorption of OH* and OOH* intermediates. Therefore, this research provides valuable theoretical insights for the design and optimization of ORR catalysts in the future. Appendix A. Supplementary material Supplementary material (free energy diagrams; phonon dispersions; energy-above-hull; free energies of the O* group on the BSe2; PDOS analysis; overpotentials and rate-determining steps of ASe2 and A0.5B0.5Se2; Pearson correlations; -ICOHP) related to this article can be found online. CRediT authorship contribution statement Ju-Xia Yi: Writing – original draft, Investigation. Lei Tao: Project administration. Yu-Yang Zhang: Project administration, Funding acquisition. Shi-Xuan Du: Project administration, Funding acquisition. Declaration of competing interest The authors declare that they have no known competing financial interests or personal relationships that could have appeared to influence the work reported in this paper. Acknowledgements This work was supported by the National Key R&D program of China (No. 2019YFA0308500 and 2022YFA1204100), the National Natural Science Foundation of China (No. 52250402 and 61888102), CAS Project for Young Scientists in Basic Research (YSBR-003), and the Fundamental Research Funds for the Central Universities. A portion of the research was performed in CAS Key Laboratory of Vacuum Physics. Supplementary materials Supplementary material associated with this article can be found, in the online version, at doi:10.1016/j.mcat.2024.114129. Appendix Supplementary materials Image, application 1 References [1] S. Chu Y. Cui N. Liu The path towards sustainable energy Nat. Mater. 16 2017 16 22 S. Chu, Y. Cui, N. Liu, The path towards sustainable energy, Nat. Mater. 16 (2017) 16–22. [2] S. Chu A. Majumdar Opportunities and challenges for a sustainable energy future Nature 488 2012 294 303 S. Chu, A. Majumdar, Opportunities and challenges for a sustainable energy future, Nature 488 (2012) 294–303. [3] P.G. Bruce S.A. Freunberger L.J. Hardwick J.M. Tarascon Li-O2 and Li-S batteries with high energy storage Nat. Mater. 11 2012 19 29 P.G. Bruce, S.A. Freunberger, L.J. Hardwick, J.M. Tarascon, Li-O2 and Li-S batteries with high energy storage, Nat. Mater. 11 (2012) 19–29. [4] Z.P. Cano D. Banham S.Y. Ye A. Hintennach J. Lu M. Fowler Z.W. Chen Batteries and fuel cells for emerging electric vehicle markets Nat. Energy 3 2018 279 289 Z.P. Cano, D. Banham, S.Y. Ye, A. Hintennach, J. Lu, M. Fowler, Z.W. Chen, Batteries and fuel cells for emerging electric vehicle markets, Nat. Energy 3 (2018) 279–289. [5] A.G. Olabi T. Wilberforce M.A. Abdelkareem Fuel cell application in the automotive industry and future perspective Energy 214 2021 118955 A.G. Olabi, T. Wilberforce, M.A. Abdelkareem, Fuel cell application in the automotive industry and future perspective, Energy 214 (2021) 118955. [6] K. A. B.L.F. Carrette U. Stimming Fuel cells-fundamentals and applications Fuel Cells 1 2001 5 39 B.L.F. Carrette, K. A.; Stimming, U., Fuel cells-fundamentals and applications, Fuel Cells 1 (2001) 5–39. [7] M.A. Rahman X.J. Wang C.E. Wen High energy density metal-air batteries: a review J. Electrochem. Soc. 160 2013 A1759 A1771 M.A. Rahman, X.J. Wang, C.E. Wen, High energy density metal-air batteries: a review, J. Electrochem. Soc. 160 (2013) A1759–A1771. [8] W.T. Yu W.X. Shang P. Tan B. Chen Z. Wu H.R. Xu Z.P. Shao M.L. Liu M. Ni Toward a new generation of low cost, efficient, and durable metal-air flow batteries J. Mater. Chem. A 7 2019 26744 26768 W.T. Yu, W.X. Shang, P. Tan, B. Chen, Z. Wu, H.R. Xu, Z.P. Shao, M.L. Liu, M. Ni, Toward a new generation of low cost, efficient, and durable metal-air flow batteries, J. Mater. Chem. A 7 (2019) 26744–26768. [9] J. J.K.R. Nørskov A. Logadottir L. Lindqvist J.R. Kitchin T. Bligaard H. Jo´nsson Origin of the overpotential for oxygen reduction at a fuel-cell cathode J. Phys. Chem. B 108 2004 17886 17892 J.K.R. Nørskov, J.; Logadottir, A.; Lindqvist, L.; Kitchin, J.R.; Bligaard, T.; Jo´nsson, H., Origin of the overpotential for oxygen reduction at a fuel-cell cathode, J. Phys. Chem. B 108 (2004) 17886–17892. [10] R.H. Lu C.X. Quan C.Y. Zhang Q. He X.B. Liao Z.Y. Wang Y. Zhao Establishing a theoretical insight for penta-coordinated iron-nitrogen-carbon catalysts toward oxygen reaction Nano Res. 15 2022 6067 6075 R.H. Lu, C.X. Quan, C.Y. Zhang, Q. He, X.B. Liao, Z.Y. Wang, Y. Zhao, Establishing a theoretical insight for penta-coordinated iron-nitrogen-carbon catalysts toward oxygen reaction, Nano Res.. 15 (2022) 6067–6075. [11] Y. Nie L. Li Z.D. Wei Recent advancements in Pt and Pt-free catalysts for oxygen reduction reaction Chem. Soc. Rev. 44 2015 2168 2201 Y. Nie, L. Li, Z.D. Wei, Recent advancements in Pt and Pt-free catalysts for oxygen reduction reaction, Chem. Soc. Rev. 44 (2015) 2168–2201. [12] R.Z. Snitkoff-Sol A. Friedman H.C. Honig Y. Yurko A. Kozhushner M.J. Zachman P. Zelenay A.M. Bond L. Elbaz Quantifying the electrochemical active site density of precious metal-free catalysts in situ in fuel cells Nat. Catal. 5 2022 163 170 R.Z. Snitkoff-Sol, A. Friedman, H.C. Honig, Y. Yurko, A. Kozhushner, M.J. Zachman, P. Zelenay, A.M. Bond, L. Elbaz, Quantifying the electrochemical active site density of precious metal-free catalysts in situ in fuel cells, Nat. Catal. 5 (2022) 163–170. [13] R. Zeng Y. Yang X.R. Feng H.Q. Li L.M. Gibbs F.J. DiSalvo H.D. Abruña Nonprecious transition metal nitrides as efficient oxygen reduction electrocatalysts for alkaline fuel cells Sci. Adv. 8 2022 eabj1584 R. Zeng, Y. Yang, X.R. Feng, H.Q. Li, L.M. Gibbs, F.J. DiSalvo, H.D. Abruña, Nonprecious transition metal nitrides as efficient oxygen reduction electrocatalysts for alkaline fuel cells, Sci. Adv. 8 (2022) eabj1584. [14] Y.T. He X.X. Yang Y.S. Li L.T. Liu S.W. Guo C.Y. Shu F. Liu Y.N. Liu Q. Tan G. Wu Atomically dispersed Fe-Co dual metal sites as bifunctional oxygen electrocatalysts for rechargeable and flexible Zn-Air batteries ACS Catal. 12 2022 1216 1227 Y.T. He, X.X. Yang, Y.S. Li, L.T. Liu, S.W. Guo, C.Y. Shu, F. Liu, Y.N. Liu, Q. Tan, G. Wu, Atomically dispersed Fe-Co dual metal sites as bifunctional oxygen electrocatalysts for rechargeable and flexible Zn-Air batteries, ACS Catal.. 12 (2022) 1216–1227. [15] H.J. Qiu P. Du K.L. Hu J.J. Gao H.L. Li P. Liu T. Ina K. Ohara Y. Ito M.W. Chen Metal and nonmetal codoped 3D nanoporous graphene for efficient bifunctional electrocatalysis and rechargeable Zn-Air batteries Adv. Mater. 31 2019 1900843 H.J. Qiu, P. Du, K.L. Hu, J.J. Gao, H.L. Li, P. Liu, T. Ina, K. Ohara, Y. Ito, M.W. Chen, Metal and nonmetal codoped 3D nanoporous graphene for efficient bifunctional electrocatalysis and rechargeable Zn-Air batteries, Adv. Mater. 31 (2019) 1900843. [16] Z.K. Yang Y. Wang M.Z. Zhu Z.J. Li W.X. Chen W.C. Wei T.W. Yuan Y.T. Qu Q. Xu C.M. Zhao X. Wang P. Li Y.F. Li Y.E. Wu Y.D. Li Boosting oxygen reduction catalysis with Fe-N4 sites decorated porous carbons toward fuel cells ACS Catal. 9 2019 2158 2163 Z.K. Yang, Y. Wang, M.Z. Zhu, Z.J. Li, W.X. Chen, W.C. Wei, T.W. Yuan, Y.T. Qu, Q. Xu, C.M. Zhao, X. Wang, P. Li, Y.F. Li, Y.E. Wu, Y.D. Li, Boosting oxygen reduction catalysis with Fe-N4 sites decorated porous carbons toward fuel cells, ACS Catal.. 9 (2019) 2158–2163. [17] D.S. Yu Y.C. Ma F. Hu C.C. Lin L.L. Li H.Y. Chen X.P. Han S.J. Peng Dual-sites coordination engineering of single atom catalysts for flexible metal-air batteries Adv. Energy Mater. 11 2021 2101242 D.S. Yu, Y.C. Ma, F. Hu, C.C. Lin, L.L. Li, H.Y. Chen, X.P. Han, S.J. Peng, Dual-sites coordination engineering of single atom catalysts for flexible metal-air batteries, Adv. Energy Mater. 11 (2021) 2101242. [18] T.P. Zhou W.F. Xu N. Zhang Z.Y. Du C.G. Zhong W.S. Yan H.X. Ju W.S. Chu H. Jiang C.Z. Wu Y. Xie Ultrathin cobalt oxide layers as electrocatalysts for high-performance flexible Zn-Air batteries Adv. Mater. 31 2019 1807468 T.P. Zhou, W.F. Xu, N. Zhang, Z.Y. Du, C.G. Zhong, W.S. Yan, H.X. Ju, W.S. Chu, H. Jiang, C.Z. Wu, Y. Xie, Ultrathin cobalt oxide layers as electrocatalysts for high-performance flexible Zn-Air batteries, Adv. Mater. 31 (2019) 1807468. [19] M.Z. Zhu C. Zhao X.K. Liu X.L. Wang F.Y. Zhou J. Wang Y.M. Hu Y.F. Zhao T. Yao L.M. Yang Y.E. Wu Single atomic cerium sites with a high coordination number for efficient oxygen reduction in proton-exchange membrane fuel cells ACS Catal. 11 2021 3923 3929 M.Z. Zhu, C. Zhao, X.K. Liu, X.L. Wang, F.Y. Zhou, J. Wang, Y.M. Hu, Y.F. Zhao, T. Yao, L.M. Yang, Y.E. Wu, Single atomic cerium sites with a high coordination number for efficient oxygen reduction in proton-exchange membrane fuel cells, ACS Catal.. 11 (2021) 3923–3929. [20] H.G. Ali K. Khan M.B. Hanif M.Z. Khan I. Hussain M.S. Javed H.A.Z. Al-bonsrulah M. Mosiałek M. Fichtner M. Motola Advancements in two-dimensional materials as anodes for lithium-ion batteries: exploring composition-structure-property relationships emerging trends, and future perspective J. Energy Storage 73 2023 108980 H.G. Ali, K. Khan, M.B. Hanif, M.Z. Khan, I. Hussain, M.S. Javed, H.A.Z. Al-bonsrulah, M. Mosiałek, M. Fichtner, M. Motola, Advancements in two-dimensional materials as anodes for lithium-ion batteries: exploring composition-structure-property relationships emerging trends, and future perspective, J. Energy Storage 73 (2023) 108980. [21] L.X. Lin W. Lei S.W. Zhang Y.Q. Liu G.G. Wallace J. Chen Two-dimensional transition metal dichalcogenides in supercapacitors and secondary batteries Energy Stor. Mater. 19 2019 408 423 L.X. Lin, W. Lei, S.W. Zhang, Y.Q. Liu, G.G. Wallace, J. Chen, Two-dimensional transition metal dichalcogenides in supercapacitors and secondary batteries, Energy Stor. Mater. 19 (2019) 408–423. [22] S. Aftab M. Zahir Iqbal S. Hussain H.H. Hegazy F. Kabir S. Hassan Abbas Jaffery G. Koyyada New developments in gas sensing using various two-dimensional architectural designs Chem. Eng. J. 469 2023 144039 S. Aftab, M. Zahir Iqbal, S. Hussain, H.H. Hegazy, F. Kabir, S. Hassan Abbas Jaffery, G. Koyyada, New developments in gas sensing using various two-dimensional architectural designs, Chem. Eng. J. 469 (2023) 144039. [23] I. Sohn S. Wi Y. Kim D. Shin M. Kim S. Lee H. Yoon J. Yoo S.M. Chung H. Kim Selective passivation of 2D TMD surface defects by atomic layer deposited Al2O3 to enhance recovery properties of gas sensor Appl. Surf. Sci. 646 2024 158906 I. Sohn, S. Wi, Y. Kim, D. Shin, M. Kim, S. Lee, H. Yoon, J. Yoo, S.M. Chung, H. Kim, Selective passivation of 2D TMD surface defects by atomic layer deposited Al2O3 to enhance recovery properties of gas sensor, Appl. Surf. Sci. 646 (2024) 158906. [24] J.X. Guo S.Y. Wu G.J. Zhang Q.H. Qiu T.H. Guo Single Ni atom embedded Janus WSSe monolayer as a cost-effective electrocatalyst for oxygen evolution reaction Mol. Catal. 530 2022 112625 J.X. Guo, S.Y. Wu, G.J. Zhang, Q.H. Qiu, T.H. Guo, Single Ni atom embedded Janus WSSe monolayer as a cost-effective electrocatalyst for oxygen evolution reaction, Mol. Catal. 530 (2022) 112625. [25] P.F. Hou Y.H. Huang F. Ma G.Q. Zhu R.A. Du X.M. Wei J.M. Zhang M. Wang Screening of single-atom catalysts of transition metal supported on MoSe2 for high-efficiency nitrogen reduction reaction Mol. Catal. 537 2023 112967 P.F. Hou, Y.H. Huang, F. Ma, G.Q. Zhu, R.A. Du, X.M. Wei, J.M. Zhang, M. Wang, Screening of single-atom catalysts of transition metal supported on MoSe2 for high-efficiency nitrogen reduction reaction, Mol. Catal. 537 (2023) 112967. [26] B. Lei Y.Y. Zhang S.X. Du Prediction of structured void-containing 1T-PtTe2 monolayer with potential catalytic activity for hydrogen evolution reaction Chin. Phys. B 29 2020 058104 B. Lei, Y.Y. Zhang, S.X. Du, Prediction of structured void-containing 1T-PtTe2 monolayer with potential catalytic activity for hydrogen evolution reaction, Chin. Phys. B 29 (2020) 058104. [27] Z.M. Sun J.L. He M.W. Yuan L. Lin Z. Zhang Z. Kang Q.L. Liao H.F. Li G.B. Sun X.J. Yang R. Long Y. Zhang Li+-clipping for edge S-vacancy MoS2 quantum dots as an efficient bifunctional electrocatalyst enabling discharge growth of amorphous Li2O2 film Nano Energy 65 2019 103996 Z.M. Sun, J.L. He, M.W. Yuan, L. Lin, Z. Zhang, Z. Kang, Q.L. Liao, H.F. Li, G.B. Sun, X.J. Yang, R. Long, Y. Zhang, Li+-clipping for edge S-vacancy MoS2 quantum dots as an efficient bifunctional electrocatalyst enabling discharge growth of amorphous Li2O2 film, Nano Energy 65 (2019) 103996. [28] X.J. Chua J. Luxa A.Y.S. Eng S.M. Tan Z. Sofer M. Pumera Negative electrocatalytic effects of p-doping niobium and tantalum on MoS2 and WS2 for the hydrogen evolution reaction and oxygen reduction reaction ACS Catal. 6 2016 5724 5734 X.J. Chua, J. Luxa, A.Y.S. Eng, S.M. Tan, Z. Sofer, M. Pumera, Negative electrocatalytic effects of p-doping niobium and tantalum on MoS2 and WS2 for the hydrogen evolution reaction and oxygen reduction reaction, ACS Catal.. 6 (2016) 5724–5734. [29] S. Dou X. Wang S.Y. Wang Rational design of transition metal-based materials for highly efficient electrocatalysis Small Methods 3 2019 1800211 S. Dou, X. Wang, S.Y. Wang, Rational design of transition metal-based materials for highly efficient electrocatalysis, Small Methods 3 (2019) 1800211. [30] Z.L. Liu B. Lei Z.L. Zhu L. Tao J. Qi D.L. Bao X. Wu L. Huang Y.Y. Zhang X. Lin Y.L. Wang S.X. Du S.T. Pantelides H.J. Gao Spontaneous formation of 1D pattern in monolayer VSe2 with dispersive adsorption of Pt atoms for HER catalysis Nano Lett. 19 2019 4897 4903 Z.L. Liu, B. Lei, Z.L. Zhu, L. Tao, J. Qi, D.L. Bao, X. Wu, L. Huang, Y.Y. Zhang, X. Lin, Y.L. Wang, S.X. Du, S.T. Pantelides, H.J. Gao, Spontaneous formation of 1D pattern in monolayer VSe2 with dispersive adsorption of Pt atoms for HER catalysis, Nano Lett.. 19 (2019) 4897–4903. [31] S. Manzeli D. Ovchinnikov D. Pasquier O.V. Yazyev A. Kis 2D transition metal dichalcogenides Nat. Rev. Mater. 2 2017 17033 S. Manzeli, D. Ovchinnikov, D. Pasquier, O.V. Yazyev, A. Kis, 2D transition metal dichalcogenides, Nat. Rev. Mater. 2 (2017) 17033. [32] Z.P. Song J.X. Yi J. Qi Q. Zheng Z.L. Zhu L. Tao Y. Cao Y. Li Z.Y. Gao R.Z. Zhang L. Huang G. Li Z.Q. Xu X. Wu Y.L. Wang C.M. Shen Y.Y. Zhang H.L. Lu X. Lin S.X. Du H.J. Gao Line defects in monolayer TiSe2 with adsorption of Pt atoms potentially enable excellent catalytic activity Nano Res. 15 2022 4687 4692 Z.P. Song, J.X. Yi, J. Qi, Q. Zheng, Z.L. Zhu, L. Tao, Y. Cao, Y. Li, Z.Y. Gao, R.Z. Zhang, L. Huang, G. Li, Z.Q. Xu, X. Wu, Y.L. Wang, C.M. Shen, Y.Y. Zhang, H.L. Lu, X. Lin, S.X. Du, H.J. Gao, Line defects in monolayer TiSe2 with adsorption of Pt atoms potentially enable excellent catalytic activity, Nano Res.. 15 (2022) 4687–4692. [33] S.Z. Yang Y.J. Gong P. Manchanda Y.Y. Zhang G.L. Ye S.M. Chen L. Song S.T. Pantelides P.M. Ajayan M.F. Chisholm W. Zhou Rhenium-doped and stabilized MoS2 atomic layers with basal-plane catalytic activity Adv. Mater. 30 2018 1803477 S.Z. Yang, Y.J. Gong, P. Manchanda, Y.Y. Zhang, G.L. Ye, S.M. Chen, L. Song, S.T. Pantelides, P.M. Ajayan, M.F. Chisholm, W. Zhou, Rhenium-doped and stabilized MoS2 atomic layers with basal-plane catalytic activity, Adv. Mater. 30 (2018) 1803477. [34] Y.F. Cao S.C. Huang Z.Q. Peng F. Yao X.H. Li Y. Liu H.T. Huang M.M. Wu Phase control of ultrafine FeSe nanocrystals in a N-doped carbon matrix for highly efficient and stable oxygen reduction reaction J. Mater. Chem. A 9 2021 3464 3471 Y.F. Cao, S.C. Huang, Z.Q. Peng, F. Yao, X.H. Li, Y. Liu, H.T. Huang, M.M. Wu, Phase control of ultrafine FeSe nanocrystals in a N-doped carbon matrix for highly efficient and stable oxygen reduction reaction, J. Mater. Chem. A 9 (2021) 3464–3471. [35] W.W. Zhao P. Bothra Z.Y. Lu Y.B. Li L.P. Mei K. Liu Z.H. Zhao G.X. Chen S. Back S. Siahrostami A. Kulkarni J.K. Nørskov M. Bajdich Y. Cui Improved oxygen reduction reaction activity of nanostructured CoS2 through electrochemical tuning ACS Appl. Energy Mater. 2 2019 8605 8614 W.W. Zhao, P. Bothra, Z.Y. Lu, Y.B. Li, L.P. Mei, K. Liu, Z.H. Zhao, G.X. Chen, S. Back, S. Siahrostami, A. Kulkarni, J.K. Nørskov, M. Bajdich, Y. Cui, Improved oxygen reduction reaction activity of nanostructured CoS2 through electrochemical tuning, ACS Appl. Energy Mater. 2 (2019) 8605–8614. [36] J.W. Zheng Q. Gong X. Cheng S.P. Gong W.F. Yang L.Y. Huang Microwave synthesis of carbon supported cobalt nickel selenide ternary catalyst toward oxygen reduction reaction ChemElectroChem 5 2018 2019 2028 J.W. Zheng, Q. Gong, X. Cheng, S.P. Gong, W.F. Yang, L.Y. Huang, Microwave synthesis of carbon supported cobalt nickel selenide ternary catalyst toward oxygen reduction reaction, ChemElectroChem 5 (2018) 2019–2028. [37] W. Lee J. Kim H. Kim S. Back Catalytic activity trends of pyrite transition metal dichalcogenides for oxygen reduction and evolution Phys. Chem. Chem. Phys. 24 2022 19911 19918 W. Lee, J. Kim, H. Kim, S. Back, Catalytic activity trends of pyrite transition metal dichalcogenides for oxygen reduction and evolution, Phys. Chem. Chem. Phys. 24 (2022) 19911–19918. [38] A. Kulkarni S. Siahrostami A. Patel J.K. Norskov Understanding catalytic activity trends in the oxygen reduction reaction Chem. Rev. 118 2018 2302 2312 A. Kulkarni, S. Siahrostami, A. Patel, J.K. Norskov, Understanding catalytic activity trends in the oxygen reduction reaction, Chem. Rev. 118 (2018) 2302–2312. [39] M. Zhou Q.H. Weng X.Y. Zhang X. Wang Y.M. Xue X.H. Zeng Y. Bando D. Golberg In situ electrochemical formation of core-shell nickel-iron disulfide and oxyhydroxide heterostructured catalysts for a stable oxygen evolution reaction and the associated mechanisms J. Mater. Chem. A 5 2017 4335 4342 M. Zhou, Q.H. Weng, X.Y. Zhang, X. Wang, Y.M. Xue, X.H. Zeng, Y. Bando, D. Golberg, In situ electrochemical formation of core-shell nickel-iron disulfide and oxyhydroxide heterostructured catalysts for a stable oxygen evolution reaction and the associated mechanisms, J. Mater. Chem. A 5 (2017) 4335–4342. [40] G.F. Kresse Efficiency of ab-initio total energy calculations for metals and semiconductors using a plane-wave basis set Comput. Mater. Sci. 6 1996 15 50 G.F. Kresse, J., Efficiency of ab-initio total energy calculations for metals and semiconductors using a plane-wave basis set, Comput. Mater. Sci. 6 (1996) 15–50. [41] G.F. Kresse Efficient iterative schemes for ab initio total-energy calculations using a plane-wave basis set Phys. Rev. B 54 1996 11169 G.F. Kresse, J., Efficient iterative schemes for ab initio total-energy calculations using a plane-wave basis set, Phys. Rev. B 54 (1996) 11169. [42] P.E. Blochl Projector augmented-wave method Phys. Rev. B 50 1994 17953 17979 P.E. Blochl, Projector augmented-wave method, Phys. Rev. B 50 (1994) 17953–17979. [43] K. J.P.B. Perdew M. Ernzerhof Generalized gradient approximation made simple Phys. Rev. Lett. 77 1996 3865 J.P.B. Perdew, K.; Ernzerhof, M., Generalized gradient approximation made simple, Phys. Rev. Lett. 77 (1996) 3865. [44] G. A. S.L.B. Dudarev S.Y. Savrasov C.J. Humphreys A.P. Sutton Electron-energy-loss spectra and the structural stability of nickel oxide: an LSDA+U study Phys. Rev. B 57 1998 1505 S.L.B. Dudarev, G. A.; Savrasov, S.Y.; Humphreys, C.J.; Sutton, A.P., Electron-energy-loss spectra and the structural stability of nickel oxide: an LSDA+U study, Phys. Rev. B 57 (1998) 1505. [45] X.Y. Ma H.Y. Lyu K.R. Hao Y.M. Zhao X.F. Qian Q.B. Yan G. Su Large family of two-dimensional ferroelectric metals discovered via machine learning Sci. Bull. 66 2021 233 242 X.Y. Ma, H.Y. Lyu, K.R. Hao, Y.M. Zhao, X.F. Qian, Q.B. Yan, G. Su, Large family of two-dimensional ferroelectric metals discovered via machine learning, Sci. Bull. 66 (2021) 233–242. [46] H.J. Monkhorst J.D. Pack Special points for Brillouin-zone integrations Phys. Rev. B 13 1976 5188 5192 H.J. Monkhorst, J.D. Pack, Special points for Brillouin-zone integrations, Phys. Rev. B 13 (1976) 5188–5192. [47] G. Henkelman A. Arnaldsson H. Jónsson A fast and robust algorithm for Bader decomposition of charge density Comput. Mater. Sci. 36 2006 354 360 G. Henkelman, A. Arnaldsson, H. Jónsson, A fast and robust algorithm for Bader decomposition of charge density, Comput. Mater. Sci. 36 (2006) 354–360. [48] V.L. Deringer A.L. Tchougreeff R. Dronskowski Crystal orbital hamilton population (COHP) analysis as projected from plane-wave basis sets J. Phys. Chem. A 115 2011 5461 5466 V.L. Deringer, A.L. Tchougreeff, R. Dronskowski, Crystal orbital hamilton population (COHP) analysis as projected from plane-wave basis sets, J. Phys. Chem. A 115 (2011) 5461–5466. [49] A. Togo F. Oba I. Tanaka First-principles calculations of the ferroelastic transition between rutile-type and CaCl2-type SiO2 at high pressures Phys. Rev. B 78 2008 134106 A. Togo, F. Oba, I. Tanaka, First-principles calculations of the ferroelastic transition between rutile-type and CaCl2-type SiO2 at high pressures, Phys. Rev. B 78 (2008) 134106. [50] A. Togo I. Tanaka First principles phonon calculations in materials science Scr. Mater. 108 2015 1 5 A. Togo, I. Tanaka, First principles phonon calculations in materials science, Scr. Mater. 108 (2015) 1–5. [51] K. Parlinski Z.Q. Li Y. Kawazoe First-principles determination of the soft mode in cubic ZrO2 Phys. Rev. Lett. 78 1997 4063 K. Parlinski, Z.Q. Li, Y. Kawazoe, First-principles determination of the soft mode in cubic ZrO2, Phys. Rev. Lett. 78 (1997) 4063. [52] V. Wang N. Xu J.C. Liu G. Tang W.T. Geng VASPKIT: a user-friendly interface facilitating high-throughput computing and analysis using VASP code Comput. Phys. Commun. 267 2021 108033 V. Wang, N. Xu, J.C. Liu, G. Tang, W.T. Geng, VASPKIT: a user-friendly interface facilitating high-throughput computing and analysis using VASP code, Comput. Phys. Commun. 267 (2021) 108033. [53] Y. Liu M.E. Tuckerman Generalized Gaussian moment thermostatting: a new continuous dynamical approach to the canonical ensemble J. Chem. Phys. 112 2000 1685 1700 Y. Liu, M.E. Tuckerman, Generalized Gaussian moment thermostatting: a new continuous dynamical approach to the canonical ensemble, J. Chem. Phys. 112 (2000) 1685–1700. [54] Z.M. Xie M.W. Chen S.G. Peera C. Liu H. Yang X.P. Qi U.P. Kumar T.X. Liang Theoretical study on a nitrogen-doped graphene nanoribbon with edge defects as the electrocatalyst for oxygen reduction reaction ACS Omega 5 2020 5142 5149 Z.M. Xie, M.W. Chen, S.G. Peera, C. Liu, H. Yang, X.P. Qi, U.P. Kumar, T.X. Liang, Theoretical study on a nitrogen-doped graphene nanoribbon with edge defects as the electrocatalyst for oxygen reduction reaction, ACS Omega 5 (2020) 5142–5149. [55] B. Liu Y.F. Zhao H.Q. Peng Z.Y. Zhang C.K. Sit M.F. Yuen T.R. Zhang C.S. Lee W.J. Zhang Nickel-cobalt diselenide 3D mesoporous nanosheet networks supported on Ni foam: an all-pH highly efficient integrated electrocatalyst for hydrogen evolution Adv. Mater. 29 2017 1606521 B. Liu, Y.F. Zhao, H.Q. Peng, Z.Y. Zhang, C.K. Sit, M.F. Yuen, T.R. Zhang, C.S. Lee, W.J. Zhang, Nickel-cobalt diselenide 3D mesoporous nanosheet networks supported on Ni foam: an all-pH highly efficient integrated electrocatalyst for hydrogen evolution, Adv. Mater. 29 (2017) 1606521. [56] X. Qian H.M. Li L. Shao X.C. Jiang L.X. Hou Morphology-tuned synthesis of nickel cobalt selenides as highly efficient Pt-free counter electrode catalysts for dye-sensitized solar cells ACS Appl. Mater. Interfaces 8 2016 29486 29495 X. Qian, H.M. Li, L. Shao, X.C. Jiang, L.X. Hou, Morphology-tuned synthesis of nickel cobalt selenides as highly efficient Pt-free counter electrode catalysts for dye-sensitized solar cells, ACS Appl. Mater. Interfaces 8 (2016) 29486–29495. [57] A.J. Medford A. Vojvodic J.S. Hummelshøj J. Voss F. Abild-Pedersen F. Studt T. Bligaard A. Nilsson J.K. Nørskov From the Sabatier principle to a predictive theory of transition-metal heterogeneous catalysis J. Catal. 328 2015 36 42 A.J. Medford, A. Vojvodic, J.S. Hummelshøj, J. Voss, F. Abild-Pedersen, F. Studt, T. Bligaard, A. Nilsson, J.K. Nørskov, From the Sabatier principle to a predictive theory of transition-metal heterogeneous catalysis, J. Catal. 328 (2015) 36–42. [58] Y. Gambo S. Adamu R.A. Lucky M.S. Ba-Shammakh M.M. Hossain Tandem catalysis: a sustainable alternative for direct hydrogenation of CO2 to light olefins Appl. Catal. A-Gen. 641 2022 118658 Y. Gambo, S. Adamu, R.A. Lucky, M.S. Ba-Shammakh, M.M. Hossain, Tandem catalysis: a sustainable alternative for direct hydrogenation of CO2 to light olefins, Appl. Catal. A-Gen. 641 (2022) 118658. [59] H.B. Liu X.C. Xu H.X. Xu S.T. Wang Z.Q. Niu Q.H. Jia L. Yang R. Cao L.R. Zheng D.P. Cao Dual active site tandem catalysis of metal hydroxyl oxides and single atoms for boosting oxygen evolution reaction Appl. Catal. B-Environ. 297 2021 120451 H.B. Liu, X.C. Xu, H.X. Xu, S.T. Wang, Z.Q. Niu, Q.H. Jia, L. Yang, R. Cao, L.R. Zheng, D.P. Cao, Dual active site tandem catalysis of metal hydroxyl oxides and single atoms for boosting oxygen evolution reaction, Appl. Catal. B-Environ. 297 (2021) 120451. [60] C.L. Pei J.L. Gong Tandem catalysis at nanoscale Science 371 2021 1203 1204 C.L. Pei, J.L. Gong, Tandem catalysis at nanoscale, Science 371 (2021) 1203–1204. [61] C. Liu L.Y. Jin M.L. Liu D.M. Wang T. Xu A. Asokan B. Jayaraman S.G. Peera Theoretical investigation on the bifunctional hydrogen/oxygen electrode catalysis in Cd-N-C-doped graphene systems regulated by the active center configuration Int. J. Hydrog. Energy 50 2024 351 360 C. Liu, L.Y. Jin, M.L. Liu, D.M. Wang, T. Xu, A. Asokan, B. Jayaraman, S.G. Peera, Theoretical investigation on the bifunctional hydrogen/oxygen electrode catalysis in Cd-N-C-doped graphene systems regulated by the active center configuration, Int. J. Hydrog. Energy 50 (2024) 351–360. [62] D.M. Wang L.Y. Jin M.L. Liu T.G. Lee S.G. Peera C. Liu The graphene-supported Lanthanum oxide cluster as efficient bifunctional electrocatalyst for oxygen reaction Mol. Catal. 535 2023 112879 D.M. Wang, L.Y. Jin, M.L. Liu, T.G. Lee, S.G. Peera, C. Liu, The graphene-supported Lanthanum oxide cluster as efficient bifunctional electrocatalyst for oxygen reaction, Mol. Catal. 535 (2023) 112879. [63] Q.M. Fu D.M. Wang C. Liu Mechanistic study of Eu single atoms occupying four vacancy centers as potential electrocatalysts for the oxygen reduction reaction Phys. Chem. Chem. Phys. 26 2024 2284 2290 Q.M. Fu, D.M. Wang, C. Liu, Mechanistic study of Eu single atoms occupying four vacancy centers as potential electrocatalysts for the oxygen reduction reaction, Phys. Chem. Chem. Phys. 26 (2024) 2284–2290.",
      "scopus-id": "85190349791",
      "coredata": {
        "eid": "1-s2.0-S2468823124003122",
        "dc:description": "Transition metal dichalcogenides (TMDs) have been widely considered as one of the promising candidates to replace platinum-based oxygen reduction reaction (ORR) catalysts due to their attractive properties. However, the single active site in such catalysts poses challenges in surpassing the inherent limits of scaling relations between adsorption energy of multi-intermediates in ORR catalytic process. Herein, inspired by the concept of multiple active centers, we design a series of stable pyrite-like bimetallic diselenides (A0.5B0.5Se2, A = Mn, Fe, Co, Ni, B = Cu, Cd, Sn) as catalysts, which aim at enhancing ORR catalytic activity through synergistic effect in dual active sites. Through density functional theory calculations, we find that the ORR activities of most A0.5B0.5Se2 catalysts are comparable to or even better than those of the noble metal Pt, verifying the promotional ORR activities of A0.5B0.5Se2. Among them, Co0.5Sn0.5Se2 has an overpotential of 0.31 V, which shows better catalytic performance than Pt for ORR. Such improvement is attributed to the tandem reaction mechanism and the reduction in the barrier for the rate-determining steps, resulting from the presence of dual active sites within Co0.5Sn0.5Se2. The projected density of states (PDOS) and Bader charge analysis reveal that the excellent catalytic activity is contributed by the strong d-p orbital hybridization between Co and Sn in the Co0.5Sn0.5Se2, which significantly weakens the over-adsorption of the crucial O* intermediates. These findings provide valuable theoretical insights for designing optimum ORR catalysts.",
        "openArchiveArticle": "false",
        "prism:coverDate": "2024-05-01",
        "openaccessUserLicense": null,
        "prism:aggregationType": "Journal",
        "prism:url": "https://api.elsevier.com/content/article/pii/S2468823124003122",
        "dc:creator": [
          {
            "@_fa": "true",
            "$": "Yi, Ju-Xia"
          },
          {
            "@_fa": "true",
            "$": "Tao, Lei"
          },
          {
            "@_fa": "true",
            "$": "Zhang, Yu-Yang"
          },
          {
            "@_fa": "true",
            "$": "Du, Shi-Xuan"
          }
        ],
        "link": [
          {
            "@_fa": "true",
            "@rel": "self",
            "@href": "https://api.elsevier.com/content/article/pii/S2468823124003122"
          },
          {
            "@_fa": "true",
            "@rel": "scidir",
            "@href": "https://www.sciencedirect.com/science/article/pii/S2468823124003122"
          }
        ],
        "dc:format": "application/json",
        "openaccessType": null,
        "pii": "S2468-8231(24)00312-2",
        "prism:volume": "560",
        "articleNumber": "114129",
        "prism:publisher": "Elsevier B.V.",
        "dc:title": "Theoretical insight of pyrite-like bimetallic diselenides for oxygen reduction reaction",
        "prism:copyright": "© 2024 Elsevier B.V. All rights reserved.",
        "openaccess": "0",
        "prism:issn": "24688231",
        "dcterms:subject": [
          {
            "@_fa": "true",
            "$": "Pyrite-like bimetallic diselenides"
          },
          {
            "@_fa": "true",
            "$": "Oxygen reduction reaction"
          },
          {
            "@_fa": "true",
            "$": "Dual active sites"
          },
          {
            "@_fa": "true",
            "$": "Tandem catalysis mechanism"
          },
          {
            "@_fa": "true",
            "$": "Synergistic effect"
          }
        ],
        "openaccessArticle": "false",
        "prism:publicationName": "Molecular Catalysis",
        "openaccessSponsorType": null,
        "prism:pageRange": "114129",
        "pubType": "fla",
        "prism:coverDisplayDate": "1 May 2024",
        "prism:doi": "10.1016/j.mcat.2024.114129",
        "prism:startingPage": "114129",
        "dc:identifier": "doi:10.1016/j.mcat.2024.114129",
        "openaccessSponsorName": null
      },
      "objects": {
        "object": [
          {
            "@category": "standard",
            "@height": "395",
            "@width": "434",
            "@_fa": "true",
            "$": "https://api.elsevier.com/content/object/eid/1-s2.0-S2468823124003122-gr1.jpg?httpAccept=%2A%2F%2A",
            "@multimediatype": "JPEG image file",
            "@type": "IMAGE-DOWNSAMPLED",
            "@size": "63100",
            "@ref": "gr1",
            "@mimetype": "image/jpeg"
          },
          {
            "@category": "standard",
            "@height": "186",
            "@width": "484",
            "@_fa": "true",
            "$": "https://api.elsevier.com/content/object/eid/1-s2.0-S2468823124003122-gr3.jpg?httpAccept=%2A%2F%2A",
            "@multimediatype": "JPEG image file",
            "@type": "IMAGE-DOWNSAMPLED",
            "@size": "31896",
            "@ref": "gr3",
            "@mimetype": "image/jpeg"
          },
          {
            "@category": "standard",
            "@height": "471",
            "@width": "517",
            "@_fa": "true",
            "$": "https://api.elsevier.com/content/object/eid/1-s2.0-S2468823124003122-gr2.jpg?httpAccept=%2A%2F%2A",
            "@multimediatype": "JPEG image file",
            "@type": "IMAGE-DOWNSAMPLED",
            "@size": "81964",
            "@ref": "gr2",
            "@mimetype": "image/jpeg"
          },
          {
            "@category": "standard",
            "@height": "200",
            "@width": "313",
            "@_fa": "true",
            "$": "https://api.elsevier.com/content/object/eid/1-s2.0-S2468823124003122-ga1.jpg?httpAccept=%2A%2F%2A",
            "@multimediatype": "JPEG image file",
            "@type": "IMAGE-DOWNSAMPLED",
            "@size": "27314",
            "@ref": "ga1",
            "@mimetype": "image/jpeg"
          },
          {
            "@category": "standard",
            "@height": "405",
            "@width": "464",
            "@_fa": "true",
            "$": "https://api.elsevier.com/content/object/eid/1-s2.0-S2468823124003122-gr4.jpg?httpAccept=%2A%2F%2A",
            "@multimediatype": "JPEG image file",
            "@type": "IMAGE-DOWNSAMPLED",
            "@size": "66274",
            "@ref": "gr4",
            "@mimetype": "image/jpeg"
          },
          {
            "@category": "thumbnail",
            "@height": "164",
            "@width": "180",
            "@_fa": "true",
            "$": "https://api.elsevier.com/content/object/eid/1-s2.0-S2468823124003122-gr1.sml?httpAccept=%2A%2F%2A",
            "@multimediatype": "GIF image file",
            "@type": "IMAGE-THUMBNAIL",
            "@size": "14262",
            "@ref": "gr1",
            "@mimetype": "image/gif"
          },
          {
            "@category": "thumbnail",
            "@height": "84",
            "@width": "219",
            "@_fa": "true",
            "$": "https://api.elsevier.com/content/object/eid/1-s2.0-S2468823124003122-gr3.sml?httpAccept=%2A%2F%2A",
            "@multimediatype": "GIF image file",
            "@type": "IMAGE-THUMBNAIL",
            "@size": "7422",
            "@ref": "gr3",
            "@mimetype": "image/gif"
          },
          {
            "@category": "thumbnail",
            "@height": "164",
            "@width": "180",
            "@_fa": "true",
            "$": "https://api.elsevier.com/content/object/eid/1-s2.0-S2468823124003122-gr2.sml?httpAccept=%2A%2F%2A",
            "@multimediatype": "GIF image file",
            "@type": "IMAGE-THUMBNAIL",
            "@size": "12378",
            "@ref": "gr2",
            "@mimetype": "image/gif"
          },
          {
            "@category": "thumbnail",
            "@height": "140",
            "@width": "219",
            "@_fa": "true",
            "$": "https://api.elsevier.com/content/object/eid/1-s2.0-S2468823124003122-ga1.sml?httpAccept=%2A%2F%2A",
            "@multimediatype": "GIF image file",
            "@type": "IMAGE-THUMBNAIL",
            "@size": "10668",
            "@ref": "ga1",
            "@mimetype": "image/gif"
          },
          {
            "@category": "thumbnail",
            "@height": "164",
            "@width": "188",
            "@_fa": "true",
            "$": "https://api.elsevier.com/content/object/eid/1-s2.0-S2468823124003122-gr4.sml?httpAccept=%2A%2F%2A",
            "@multimediatype": "GIF image file",
            "@type": "IMAGE-THUMBNAIL",
            "@size": "12521",
            "@ref": "gr4",
            "@mimetype": "image/gif"
          },
          {
            "@category": "high",
            "@height": "1753",
            "@width": "1924",
            "@_fa": "true",
            "$": "https://api.elsevier.com/content/object/eid/1-s2.0-S2468823124003122-gr1_lrg.jpg?httpAccept=%2A%2F%2A",
            "@multimediatype": "JPEG image file",
            "@type": "IMAGE-HIGH-RES",
            "@size": "513605",
            "@ref": "gr1",
            "@mimetype": "image/jpeg"
          },
          {
            "@category": "high",
            "@height": "823",
            "@width": "2142",
            "@_fa": "true",
            "$": "https://api.elsevier.com/content/object/eid/1-s2.0-S2468823124003122-gr3_lrg.jpg?httpAccept=%2A%2F%2A",
            "@multimediatype": "JPEG image file",
            "@type": "IMAGE-HIGH-RES",
            "@size": "192632",
            "@ref": "gr3",
            "@mimetype": "image/jpeg"
          },
          {
            "@category": "high",
            "@height": "2089",
            "@width": "2292",
            "@_fa": "true",
            "$": "https://api.elsevier.com/content/object/eid/1-s2.0-S2468823124003122-gr2_lrg.jpg?httpAccept=%2A%2F%2A",
            "@multimediatype": "JPEG image file",
            "@type": "IMAGE-HIGH-RES",
            "@size": "587422",
            "@ref": "gr2",
            "@mimetype": "image/jpeg"
          },
          {
            "@category": "high",
            "@height": "886",
            "@width": "1388",
            "@_fa": "true",
            "$": "https://api.elsevier.com/content/object/eid/1-s2.0-S2468823124003122-ga1_lrg.jpg?httpAccept=%2A%2F%2A",
            "@multimediatype": "JPEG image file",
            "@type": "IMAGE-HIGH-RES",
            "@size": "175608",
            "@ref": "ga1",
            "@mimetype": "image/jpeg"
          },
          {
            "@category": "high",
            "@height": "1794",
            "@width": "2054",
            "@_fa": "true",
            "$": "https://api.elsevier.com/content/object/eid/1-s2.0-S2468823124003122-gr4_lrg.jpg?httpAccept=%2A%2F%2A",
            "@multimediatype": "JPEG image file",
            "@type": "IMAGE-HIGH-RES",
            "@size": "519336",
            "@ref": "gr4",
            "@mimetype": "image/jpeg"
          },
          {
            "@category": "standard",
            "@_fa": "true",
            "$": "https://api.elsevier.com/content/object/eid/1-s2.0-S2468823124003122-mmc1.docx?httpAccept=%2A%2F%2A",
            "@multimediatype": "Microsoft Word file",
            "@type": "APPLICATION",
            "@size": "3732000",
            "@ref": "mmc1",
            "@mimetype": "application/word"
          },
          {
            "@category": "thumbnail",
            "@_fa": "true",
            "$": "https://api.elsevier.com/content/object/eid/1-s2.0-S2468823124003122-si1.svg?httpAccept=%2A%2F%2A",
            "@multimediatype": "Scalable Vector Graphics file",
            "@type": "ALTIMG",
            "@size": "551",
            "@ref": "si1",
            "@mimetype": "image/svg+xml"
          },
          {
            "@category": "thumbnail",
            "@_fa": "true",
            "$": "https://api.elsevier.com/content/object/eid/1-s2.0-S2468823124003122-si10.svg?httpAccept=%2A%2F%2A",
            "@multimediatype": "Scalable Vector Graphics file",
            "@type": "ALTIMG",
            "@size": "6322",
            "@ref": "si10",
            "@mimetype": "image/svg+xml"
          },
          {
            "@category": "thumbnail",
            "@_fa": "true",
            "$": "https://api.elsevier.com/content/object/eid/1-s2.0-S2468823124003122-si11.svg?httpAccept=%2A%2F%2A",
            "@multimediatype": "Scalable Vector Graphics file",
            "@type": "ALTIMG",
            "@size": "1474",
            "@ref": "si11",
            "@mimetype": "image/svg+xml"
          },
          {
            "@category": "thumbnail",
            "@_fa": "true",
            "$": "https://api.elsevier.com/content/object/eid/1-s2.0-S2468823124003122-si12.svg?httpAccept=%2A%2F%2A",
            "@multimediatype": "Scalable Vector Graphics file",
            "@type": "ALTIMG",
            "@size": "3238",
            "@ref": "si12",
            "@mimetype": "image/svg+xml"
          },
          {
            "@category": "thumbnail",
            "@_fa": "true",
            "$": "https://api.elsevier.com/content/object/eid/1-s2.0-S2468823124003122-si13.svg?httpAccept=%2A%2F%2A",
            "@multimediatype": "Scalable Vector Graphics file",
            "@type": "ALTIMG",
            "@size": "1522",
            "@ref": "si13",
            "@mimetype": "image/svg+xml"
          },
          {
            "@category": "thumbnail",
            "@_fa": "true",
            "$": "https://api.elsevier.com/content/object/eid/1-s2.0-S2468823124003122-si14.svg?httpAccept=%2A%2F%2A",
            "@multimediatype": "Scalable Vector Graphics file",
            "@type": "ALTIMG",
            "@size": "8293",
            "@ref": "si14",
            "@mimetype": "image/svg+xml"
          },
          {
            "@category": "thumbnail",
            "@_fa": "true",
            "$": "https://api.elsevier.com/content/object/eid/1-s2.0-S2468823124003122-si15.svg?httpAccept=%2A%2F%2A",
            "@multimediatype": "Scalable Vector Graphics file",
            "@type": "ALTIMG",
            "@size": "7308",
            "@ref": "si15",
            "@mimetype": "image/svg+xml"
          },
          {
            "@category": "thumbnail",
            "@_fa": "true",
            "$": "https://api.elsevier.com/content/object/eid/1-s2.0-S2468823124003122-si16.svg?httpAccept=%2A%2F%2A",
            "@multimediatype": "Scalable Vector Graphics file",
            "@type": "ALTIMG",
            "@size": "5792",
            "@ref": "si16",
            "@mimetype": "image/svg+xml"
          },
          {
            "@category": "thumbnail",
            "@_fa": "true",
            "$": "https://api.elsevier.com/content/object/eid/1-s2.0-S2468823124003122-si17.svg?httpAccept=%2A%2F%2A",
            "@multimediatype": "Scalable Vector Graphics file",
            "@type": "ALTIMG",
            "@size": "6671",
            "@ref": "si17",
            "@mimetype": "image/svg+xml"
          },
          {
            "@category": "thumbnail",
            "@_fa": "true",
            "$": "https://api.elsevier.com/content/object/eid/1-s2.0-S2468823124003122-si18.svg?httpAccept=%2A%2F%2A",
            "@multimediatype": "Scalable Vector Graphics file",
            "@type": "ALTIMG",
            "@size": "13298",
            "@ref": "si18",
            "@mimetype": "image/svg+xml"
          },
          {
            "@category": "thumbnail",
            "@_fa": "true",
            "$": "https://api.elsevier.com/content/object/eid/1-s2.0-S2468823124003122-si19.svg?httpAccept=%2A%2F%2A",
            "@multimediatype": "Scalable Vector Graphics file",
            "@type": "ALTIMG",
            "@size": "12414",
            "@ref": "si19",
            "@mimetype": "image/svg+xml"
          },
          {
            "@category": "thumbnail",
            "@_fa": "true",
            "$": "https://api.elsevier.com/content/object/eid/1-s2.0-S2468823124003122-si2.svg?httpAccept=%2A%2F%2A",
            "@multimediatype": "Scalable Vector Graphics file",
            "@type": "ALTIMG",
            "@size": "5421",
            "@ref": "si2",
            "@mimetype": "image/svg+xml"
          },
          {
            "@category": "thumbnail",
            "@_fa": "true",
            "$": "https://api.elsevier.com/content/object/eid/1-s2.0-S2468823124003122-si20.svg?httpAccept=%2A%2F%2A",
            "@multimediatype": "Scalable Vector Graphics file",
            "@type": "ALTIMG",
            "@size": "6914",
            "@ref": "si20",
            "@mimetype": "image/svg+xml"
          },
          {
            "@category": "thumbnail",
            "@_fa": "true",
            "$": "https://api.elsevier.com/content/object/eid/1-s2.0-S2468823124003122-si21.svg?httpAccept=%2A%2F%2A",
            "@multimediatype": "Scalable Vector Graphics file",
            "@type": "ALTIMG",
            "@size": "1825",
            "@ref": "si21",
            "@mimetype": "image/svg+xml"
          },
          {
            "@category": "thumbnail",
            "@_fa": "true",
            "$": "https://api.elsevier.com/content/object/eid/1-s2.0-S2468823124003122-si22.svg?httpAccept=%2A%2F%2A",
            "@multimediatype": "Scalable Vector Graphics file",
            "@type": "ALTIMG",
            "@size": "2080",
            "@ref": "si22",
            "@mimetype": "image/svg+xml"
          },
          {
            "@category": "thumbnail",
            "@_fa": "true",
            "$": "https://api.elsevier.com/content/object/eid/1-s2.0-S2468823124003122-si23.svg?httpAccept=%2A%2F%2A",
            "@multimediatype": "Scalable Vector Graphics file",
            "@type": "ALTIMG",
            "@size": "2578",
            "@ref": "si23",
            "@mimetype": "image/svg+xml"
          },
          {
            "@category": "thumbnail",
            "@_fa": "true",
            "$": "https://api.elsevier.com/content/object/eid/1-s2.0-S2468823124003122-si3.svg?httpAccept=%2A%2F%2A",
            "@multimediatype": "Scalable Vector Graphics file",
            "@type": "ALTIMG",
            "@size": "5459",
            "@ref": "si3",
            "@mimetype": "image/svg+xml"
          },
          {
            "@category": "thumbnail",
            "@_fa": "true",
            "$": "https://api.elsevier.com/content/object/eid/1-s2.0-S2468823124003122-si4.svg?httpAccept=%2A%2F%2A",
            "@multimediatype": "Scalable Vector Graphics file",
            "@type": "ALTIMG",
            "@size": "4685",
            "@ref": "si4",
            "@mimetype": "image/svg+xml"
          },
          {
            "@category": "thumbnail",
            "@_fa": "true",
            "$": "https://api.elsevier.com/content/object/eid/1-s2.0-S2468823124003122-si5.svg?httpAccept=%2A%2F%2A",
            "@multimediatype": "Scalable Vector Graphics file",
            "@type": "ALTIMG",
            "@size": "5419",
            "@ref": "si5",
            "@mimetype": "image/svg+xml"
          },
          {
            "@category": "thumbnail",
            "@_fa": "true",
            "$": "https://api.elsevier.com/content/object/eid/1-s2.0-S2468823124003122-si6.svg?httpAccept=%2A%2F%2A",
            "@multimediatype": "Scalable Vector Graphics file",
            "@type": "ALTIMG",
            "@size": "1628",
            "@ref": "si6",
            "@mimetype": "image/svg+xml"
          },
          {
            "@category": "thumbnail",
            "@_fa": "true",
            "$": "https://api.elsevier.com/content/object/eid/1-s2.0-S2468823124003122-si7.svg?httpAccept=%2A%2F%2A",
            "@multimediatype": "Scalable Vector Graphics file",
            "@type": "ALTIMG",
            "@size": "2865",
            "@ref": "si7",
            "@mimetype": "image/svg+xml"
          },
          {
            "@category": "thumbnail",
            "@_fa": "true",
            "$": "https://api.elsevier.com/content/object/eid/1-s2.0-S2468823124003122-si8.svg?httpAccept=%2A%2F%2A",
            "@multimediatype": "Scalable Vector Graphics file",
            "@type": "ALTIMG",
            "@size": "2141",
            "@ref": "si8",
            "@mimetype": "image/svg+xml"
          },
          {
            "@category": "thumbnail",
            "@_fa": "true",
            "$": "https://api.elsevier.com/content/object/eid/1-s2.0-S2468823124003122-si9.svg?httpAccept=%2A%2F%2A",
            "@multimediatype": "Scalable Vector Graphics file",
            "@type": "ALTIMG",
            "@size": "2812",
            "@ref": "si9",
            "@mimetype": "image/svg+xml"
          },
          {
            "@category": "standard",
            "@_fa": "true",
            "$": "https://api.elsevier.com/content/object/eid/1-s2.0-S2468823124003122-am.pdf?httpAccept=%2A%2F%2A",
            "@multimediatype": "Acrobat PDF file",
            "@type": "AAM-PDF",
            "@size": "682917",
            "@ref": "am",
            "@mimetype": "application/pdf"
          }
        ]
      },
      "link": {
        "@rel": "abstract",
        "@href": "https://api.elsevier.com/content/abstract/scopus_id/85190349791"
      }
    }
  }
}