{
  "metadata": {
    "title": "Efficient conversion of corn stover to 5-hydroxymethylfurfural and furfural using a novel acidic resin catalyst in water-1, 4-dioxane system",
    "authors": "; ; ",
    "journal": "Molecular Catalysis",
    "date": "2021-10-31",
    "doi": "10.1016/j.mcat.2021.111920",
    "abstract": "",
    "uri": "https://api.elsevier.com/content/article/pii/S246882312100537X",
    "pii": "S246882312100537X"
  },
  "fulltext": {
    "full-text-retrieval-response": {
      "scopus-eid": "2-s2.0-85115972539",
      "originalText": "serial JL 315758 291210 291744 291790 291809 31 Molecular Catalysis MOLECULARCATALYSIS 2021-09-29 2021-09-29 2021-09-29 2021-09-29 2021-12-01T07:56:01 1-s2.0-S246882312100537X S2468-8231(21)00537-X S246882312100537X 10.1016/j.mcat.2021.111920 S300 S300.1 FULL-TEXT 1-s2.0-S2468823121X00156 2023-02-06T23:00:32.757434Z 0 0 20211001 20211031 2021 2021-09-29T11:04:51.125671Z absattachment articleinfo articlenumber articletitlenorm authfirstinitialnorm authfirstsurnamenorm cid cids contenttype copyright crossmark dateloaded dateloadedtxt datesearch datesort dateupdated dco docsubtype doctype doi eid ewtransactionid hubeid indexeddate issn issnnorm itemstage itemtransactionid itemweight openaccess openarchive pg pgfirst pii piinorm pubdateend pubdatestart pubdatetxt pubyr sectiontitle sortorder srctitle srctitlenorm srctype ssids alllist content subj subheadings suppl tomb volfirst volissue volumelist webpdf webpdfpagecount yearnav figure table e-component body acknowledge affil appendices articletitle auth authfirstini authfull authkeywords authlast footnotes grantnumber grantsponsor highlightsabst orcid primabst ref specialabst 2468-8231 24688231 true 515 515 C Volume 515 36 111920 111920 111920 202110 October 2021 2021-10-01 2021-10-31 2021 Regular Papers article fla © 2021 Elsevier B.V. All rights reserved. EFFICIENTCONVERSIONCORNSTOVER5HYDROXYMETHYLFURFURALFURFURALUSINGANOVELACIDICRESINCATALYSTINWATER14DIOXANESYSTEM YANG T 1 Introduction 2 Materials and methods 2.1 Materials 2.2 Synthesis of catalyst 2.3 Characterization of catalyst 2.4 Experimental procedure and analysis method 3 Results and discussion 3.1 Characterization of catalyst samples 3.2 Screening of catalysts for corn stover conversion 3.3 The effects of solvent types and water concentrations on the corn stover transformation 3.4 Effect of corn stover loading on production of 5-HMF and furfural 3.5 Discussion of structure-property correlation 3.6 Catalyst recycles 4 Conclusions CRediT authorship contribution statement Acknowledgments Appendix Supplementary materials References BOZELL 2010 539 554 J HAN 2019 2 13 X ZHOU 2011 5588 5617 C HOU 2021 119 231 Q YU 2020 1 54 I GUO 2020 122754 122766 W YANG 2012 53 61 W MACHADO 2016 115 129 G AGIRREZABALTELLERIA 2014 42 58 I ATABAKI 2016 7879 7885 F GUO 2018 18 25 X LI 2020 119 126 X MIAO 2020 109159 109171 J WANG 2019 130 139 Y GERBER 2020 1250 1349 I LI 2017 258 265 W ZHANG 2019 60 64 L TENG 2020 112481 112487 X SHUAI 2012 6889 6894 L HU 2014 1905 1911 S SHEN 2017 2421 2427 F JIN 2020 105611 105617 S ZUO 2014 753 757 Y ZHANG 2018 261 267 T XU 2015 764 771 Z YU 2014 6915 6918 Z A 2005 S DETERMINATIONASHINBIOMASSLABORATORYANALYTICALPROCEDURELAP A 2008 S DETERMINATIONTOTALSOLIDSINBIOMASSTOTALDISSOLVEDSOLIDSINLIQUIDPROCESSSAMPLES ZHANG 2016 405 414 Z DUTTA 2020 122544 122551 S HU 2014 2562 2575 X LEE 2021 110172 110190 C CUI 2016 1619 1624 J GONG 2019 122065 122071 L AGIRREZABALTELLERIA 2014 42 58 I CAI 2021 125410 125419 D JI 2021 125691 125698 L YANG 2021 113173 113182 T YANGX2021X111920 YANGX2021X111920XT 2023-09-29T00:00:00.000Z 2023-09-29T00:00:00.000Z http://creativecommons.org/licenses/by-nc-nd/4.0/ © 2021 Elsevier B.V. All rights reserved. 2021-10-02T22:10:58.599Z http://vtw.elsevier.com/data/voc/AddOnTypes/50.7/aggregated-refined 2018YFB1501601 National Key Research and Development Program of China Stem Cell and Translational Research http://data.elsevier.com/vocabulary/SciValFunders/501100013290 http://sws.geonames.org/1814991 Key Research and Development Projects in Anhui Province 202004a06020053 Anhui Provincial Key Research and Development Plan http://data.elsevier.com/vocabulary/SciValFunders/501100017668 http://sws.geonames.org/1814991/ Chinese Academy of Sciences XDA 21060101 CAS Chinese Academy of Sciences http://data.elsevier.com/vocabulary/SciValFunders/501100002367 http://sws.geonames.org/1814991/ National Key R&D Program of China NKRDPC National Key Research and Development Program of China http://data.elsevier.com/vocabulary/SciValFunders/501100012166 http://sws.geonames.org/1814991/ This study was financially supported by the National Key R&D Program of China (No. 2018YFB1501601 ), “Transformational Technologies for Clean Energy and Demonstration”, Strategic Priority Research Program of the Chinese Academy of Sciences, Grant No. XDA 21060101 and the Key Research and Development Projects in Anhui Province (202004a06020053). 0 https://doi.org/10.15223/policy-017 https://doi.org/10.15223/policy-037 https://doi.org/10.15223/policy-012 https://doi.org/10.15223/policy-029 https://doi.org/10.15223/policy-004 item S2468-8231(21)00537-X S246882312100537X 1-s2.0-S246882312100537X 10.1016/j.mcat.2021.111920 315758 2023-02-06T23:00:32.757434Z 2021-10-01 2021-10-31 1-s2.0-S246882312100537X-main.pdf https://s3-eu-west-1.amazonaws.com/prod-ucs-content-store-eu-west/content/pii:S246882312100537X/MAIN/application/pdf/86c1330686d9261a14ac56f0faa6be84/main.pdf main.pdf pdf true 6363081 MAIN 9 1-s2.0-S246882312100537X-main_1.png https://s3-eu-west-1.amazonaws.com/prod-ucs-content-store-eu-west/content/pii:S246882312100537X/PREVIEW/image/png/069c9f142a446783bc5476da332d091c/main_1.png main_1.png png 56919 849 656 IMAGE-WEB-PDF 1 1-s2.0-S246882312100537X-sc1.jpg https://s3-eu-west-1.amazonaws.com/prod-ucs-content-store-eu-west/content/pii:S246882312100537X/sc1/DOWNSAMPLED/image/jpeg/73c5c2cb8fd7a41708bc21d433e47cf2/sc1.jpg sc1 sc1.jpg jpg 40188 358 527 IMAGE-DOWNSAMPLED 1-s2.0-S246882312100537X-fx3.jpg https://s3-eu-west-1.amazonaws.com/prod-ucs-content-store-eu-west/content/pii:S246882312100537X/fx3/DOWNSAMPLED/image/jpeg/db26d54530229cf77cae6ae4aa7817b7/fx3.jpg fx3 fx3.jpg jpg 5359 30 287 IMAGE-DOWNSAMPLED 1-s2.0-S246882312100537X-fx2.jpg https://s3-eu-west-1.amazonaws.com/prod-ucs-content-store-eu-west/content/pii:S246882312100537X/fx2/DOWNSAMPLED/image/jpeg/097326ad2e9fb197ed5b76bcd7fdcc5f/fx2.jpg fx2 fx2.jpg jpg 19406 164 404 IMAGE-DOWNSAMPLED 1-s2.0-S246882312100537X-gr6.jpg https://s3-eu-west-1.amazonaws.com/prod-ucs-content-store-eu-west/content/pii:S246882312100537X/gr6/DOWNSAMPLED/image/jpeg/9410dbdbd754c5a0a45ef5e234d84879/gr6.jpg gr6 gr6.jpg jpg 43181 290 357 IMAGE-DOWNSAMPLED 1-s2.0-S246882312100537X-gr5.jpg https://s3-eu-west-1.amazonaws.com/prod-ucs-content-store-eu-west/content/pii:S246882312100537X/gr5/DOWNSAMPLED/image/jpeg/6b0a04d04a79d5e6ec430c2895260a74/gr5.jpg gr5 gr5.jpg jpg 42597 323 791 IMAGE-DOWNSAMPLED 1-s2.0-S246882312100537X-gr4.jpg https://s3-eu-west-1.amazonaws.com/prod-ucs-content-store-eu-west/content/pii:S246882312100537X/gr4/DOWNSAMPLED/image/jpeg/c345f556e2381e7a67020f4e711f1701/gr4.jpg gr4 gr4.jpg jpg 49767 322 809 IMAGE-DOWNSAMPLED 1-s2.0-S246882312100537X-gr3.jpg https://s3-eu-west-1.amazonaws.com/prod-ucs-content-store-eu-west/content/pii:S246882312100537X/gr3/DOWNSAMPLED/image/jpeg/e44e0f39d0af7a350f17c220d2baa673/gr3.jpg gr3 gr3.jpg jpg 42238 298 386 IMAGE-DOWNSAMPLED 1-s2.0-S246882312100537X-gr2.jpg https://s3-eu-west-1.amazonaws.com/prod-ucs-content-store-eu-west/content/pii:S246882312100537X/gr2/DOWNSAMPLED/image/jpeg/71c3be43546fa76fcf771eefd2c1fc9b/gr2.jpg gr2 gr2.jpg jpg 34086 307 376 IMAGE-DOWNSAMPLED 1-s2.0-S246882312100537X-ga1.jpg https://s3-eu-west-1.amazonaws.com/prod-ucs-content-store-eu-west/content/pii:S246882312100537X/ga1/DOWNSAMPLED/image/jpeg/1e106c081e0aaba27dc8cfadfc1aa8bc/ga1.jpg ga1 true ga1.jpg jpg 12331 97 301 IMAGE-DOWNSAMPLED 1-s2.0-S246882312100537X-gr1.jpg https://s3-eu-west-1.amazonaws.com/prod-ucs-content-store-eu-west/content/pii:S246882312100537X/gr1/DOWNSAMPLED/image/jpeg/064e708ba6d8c2552e6a89c869dcdcf5/gr1.jpg gr1 gr1.jpg jpg 186776 604 809 IMAGE-DOWNSAMPLED 1-s2.0-S246882312100537X-sc1.sml https://s3-eu-west-1.amazonaws.com/prod-ucs-content-store-eu-west/content/pii:S246882312100537X/sc1/THUMBNAIL/image/gif/56be98cefb9f7d7b62b4a10bd14d3e40/sc1.sml sc1 sc1.sml sml 9333 149 219 IMAGE-THUMBNAIL 1-s2.0-S246882312100537X-fx3.sml https://s3-eu-west-1.amazonaws.com/prod-ucs-content-store-eu-west/content/pii:S246882312100537X/fx3/THUMBNAIL/image/gif/7d9d5fc6e882e6f24666c5401ee1a024/fx3.sml fx3 fx3.sml sml 2809 23 219 IMAGE-THUMBNAIL 1-s2.0-S246882312100537X-fx2.sml https://s3-eu-west-1.amazonaws.com/prod-ucs-content-store-eu-west/content/pii:S246882312100537X/fx2/THUMBNAIL/image/gif/57506053799a9d2a561e59d827c7233c/fx2.sml fx2 fx2.sml sml 5057 89 219 IMAGE-THUMBNAIL 1-s2.0-S246882312100537X-gr6.sml https://s3-eu-west-1.amazonaws.com/prod-ucs-content-store-eu-west/content/pii:S246882312100537X/gr6/THUMBNAIL/image/gif/718b895c9bcc050ec45b344def25012f/gr6.sml gr6 gr6.sml sml 19499 164 202 IMAGE-THUMBNAIL 1-s2.0-S246882312100537X-gr5.sml https://s3-eu-west-1.amazonaws.com/prod-ucs-content-store-eu-west/content/pii:S246882312100537X/gr5/THUMBNAIL/image/gif/27d566370c9e83ee295357a244e9ca1a/gr5.sml gr5 gr5.sml sml 6495 89 219 IMAGE-THUMBNAIL 1-s2.0-S246882312100537X-gr4.sml https://s3-eu-west-1.amazonaws.com/prod-ucs-content-store-eu-west/content/pii:S246882312100537X/gr4/THUMBNAIL/image/gif/7d1eb72fa815a7437893990b0e48cc93/gr4.sml gr4 gr4.sml sml 6663 87 219 IMAGE-THUMBNAIL 1-s2.0-S246882312100537X-gr3.sml https://s3-eu-west-1.amazonaws.com/prod-ucs-content-store-eu-west/content/pii:S246882312100537X/gr3/THUMBNAIL/image/gif/59cc393b21d1be38bc57a052e548de46/gr3.sml gr3 gr3.sml sml 12250 164 212 IMAGE-THUMBNAIL 1-s2.0-S246882312100537X-gr2.sml https://s3-eu-west-1.amazonaws.com/prod-ucs-content-store-eu-west/content/pii:S246882312100537X/gr2/THUMBNAIL/image/gif/0932b18727918352952b4aec21e110a1/gr2.sml gr2 gr2.sml sml 10497 164 201 IMAGE-THUMBNAIL 1-s2.0-S246882312100537X-ga1.sml https://s3-eu-west-1.amazonaws.com/prod-ucs-content-store-eu-west/content/pii:S246882312100537X/ga1/THUMBNAIL/image/gif/f1ee9a88099d1354496a359ffdfcc63f/ga1.sml ga1 true ga1.sml sml 7484 71 219 IMAGE-THUMBNAIL 1-s2.0-S246882312100537X-gr1.sml https://s3-eu-west-1.amazonaws.com/prod-ucs-content-store-eu-west/content/pii:S246882312100537X/gr1/THUMBNAIL/image/gif/01ec6fdd1c8330f696c10e75e1455ba9/gr1.sml gr1 gr1.sml sml 31316 164 219 IMAGE-THUMBNAIL 1-s2.0-S246882312100537X-sc1_lrg.jpg https://s3-eu-west-1.amazonaws.com/prod-ucs-content-store-eu-west/content/pii:S246882312100537X/sc1/HIGHRES/image/jpeg/a4073d61f044367bcf0456826e4f5691/sc1_lrg.jpg sc1 sc1_lrg.jpg jpg 284665 1587 2333 IMAGE-HIGH-RES 1-s2.0-S246882312100537X-fx3_lrg.jpg https://s3-eu-west-1.amazonaws.com/prod-ucs-content-store-eu-west/content/pii:S246882312100537X/fx3/HIGHRES/image/jpeg/d1aa8d0b09605a37fe0a1b7915bb5565/fx3_lrg.jpg fx3 fx3_lrg.jpg jpg 41580 131 1270 IMAGE-HIGH-RES 1-s2.0-S246882312100537X-fx2_lrg.jpg https://s3-eu-west-1.amazonaws.com/prod-ucs-content-store-eu-west/content/pii:S246882312100537X/fx2/HIGHRES/image/jpeg/686a2564bf5937ee3b72b802da287d02/fx2_lrg.jpg fx2 fx2_lrg.jpg jpg 172957 725 1791 IMAGE-HIGH-RES 1-s2.0-S246882312100537X-gr6_lrg.jpg https://s3-eu-west-1.amazonaws.com/prod-ucs-content-store-eu-west/content/pii:S246882312100537X/gr6/HIGHRES/image/jpeg/ff841558263d1c4525dce3ed36236d48/gr6_lrg.jpg gr6 gr6_lrg.jpg jpg 784502 1286 1583 IMAGE-HIGH-RES 1-s2.0-S246882312100537X-gr5_lrg.jpg https://s3-eu-west-1.amazonaws.com/prod-ucs-content-store-eu-west/content/pii:S246882312100537X/gr5/HIGHRES/image/jpeg/46f25e6d927bef1066f44ae2ff12db9a/gr5_lrg.jpg gr5 gr5_lrg.jpg jpg 302552 1430 3500 IMAGE-HIGH-RES 1-s2.0-S246882312100537X-gr4_lrg.jpg https://s3-eu-west-1.amazonaws.com/prod-ucs-content-store-eu-west/content/pii:S246882312100537X/gr4/HIGHRES/image/jpeg/ba15a13d89f27ae0271e14d1cd76458d/gr4_lrg.jpg gr4 gr4_lrg.jpg jpg 353605 1426 3583 IMAGE-HIGH-RES 1-s2.0-S246882312100537X-gr3_lrg.jpg https://s3-eu-west-1.amazonaws.com/prod-ucs-content-store-eu-west/content/pii:S246882312100537X/gr3/HIGHRES/image/jpeg/ca751a9817ce3fee4458560dfc172996/gr3_lrg.jpg gr3 gr3_lrg.jpg jpg 290765 1321 1709 IMAGE-HIGH-RES 1-s2.0-S246882312100537X-gr2_lrg.jpg https://s3-eu-west-1.amazonaws.com/prod-ucs-content-store-eu-west/content/pii:S246882312100537X/gr2/HIGHRES/image/jpeg/95ff6bf7b1d733bb490cdc98ae602ad6/gr2_lrg.jpg gr2 gr2_lrg.jpg jpg 235073 1360 1667 IMAGE-HIGH-RES 1-s2.0-S246882312100537X-ga1_lrg.jpg https://s3-eu-west-1.amazonaws.com/prod-ucs-content-store-eu-west/content/pii:S246882312100537X/ga1/HIGHRES/image/jpeg/b50e051bcd43f6c579cf8cdefb9c51b3/ga1_lrg.jpg ga1 true ga1_lrg.jpg jpg 89389 431 1333 IMAGE-HIGH-RES 1-s2.0-S246882312100537X-gr1_lrg.jpg https://s3-eu-west-1.amazonaws.com/prod-ucs-content-store-eu-west/content/pii:S246882312100537X/gr1/HIGHRES/image/jpeg/08a80969f9e43a965a04da31d0bdac50/gr1_lrg.jpg gr1 gr1_lrg.jpg jpg 1782421 2677 3583 IMAGE-HIGH-RES 1-s2.0-S246882312100537X-mmc1.docx https://s3-eu-west-1.amazonaws.com/prod-ucs-content-store-eu-west/content/pii:S246882312100537X/mmc1/MAIN/application/vnd.openxmlformats-officedocument.wordprocessingml.document/cfa65edc82a6ccbf1e903949d397597d/mmc1.docx mmc1 mmc1.docx docx 567097 APPLICATION 1-s2.0-S246882312100537X-am.pdf am am.pdf pdf 1587407 AAM-PDF https://s3-eu-west-1.amazonaws.com/prod-ucs-content-store-eu-west/content/egi:104BCJ9CFFX/MAIN/application/pdf/48276aee7b4768c2cf59d110fdbb7a99/am.pdf MCAT 111920 111920 S2468-8231(21)00537-X 10.1016/j.mcat.2021.111920 Fig. 1 SEM images of (A) S-R, (B) Cl0.3-S-R, (C) Cl0.5-S-R and (D) Cl-R. Fig 1 Fig. 2 N2 adsorption/desorption isotherms of S-R, Cl0.3-S-R, Cl0.3-S-R and Cl-R. Fig 2 Fig. 3 FTIR spectra of S-R, Cl0.3-S-R, Cl0.5-S-R and Cl-R. Fig 3 Fig. 4 The full XPS spectra (A) and S 2p (B) of catalysts. Fig 4 Fig. 5 The comparison of S-R and Cl0.3-S-R on the 5-HMF (A) and furfural yield (B) from the corn stover conversion. Reaction conditions: 0.2 g corn stover, 0.2 g catalyst, 15 mL 1,4-dioxane, 1.5 mL distilled water, 190 °C, 20–100 min. Fig 5 Fig. 6 Effect of water concentrations on furfural and 5-HMF production from corn stover. Reaction conditions: 0.2 g corn stover, 0.2 g Cl0.3-S-R, 15 mL 1,4-dioxane, 0–3 mL water, 190 °C, 80 min. Fig 6 Scheme 1 Proposed reaction pathway of 5-HMF formation from cellulose fraction of corn stover with Cl0.3-S-R. Scheme 1 Table 1 Physicochemical properties of the catalysts. Table 1 Catalyst SBET (m2/g) Pore volume (cm3/g) S a Cl b SO3H Density c (mmol/g) S-R 85.13 0.13 5.2 – 1.62 Cl0.3-S-R 10.54 0.028 4.7 0.5 1.47 Cl0.5-S-R 9.30 0.015 4.4 0.9 1.37 Cl-R 1.12 0.0061 – 7.0 – a By elemental analysis. b By XPS. c Calculated based on elemental analysis. Table 2 Effect of diverse solvents on corn stover conversion. Table 2 Entry solvent 5-HMF yield (%) Furfural yield (%) 1 1,4-dioxane 2.8 25.9 2 GBL 20.7 42.2 3 GVL 23.2 42.4 4 1,4-dioxane/water a 43.8 38.1 5 GBL/water a 30.7 46.8 6 GVL/water a 34.8 42.1 7 Water 7.1 10.4 Reaction conditions: 0.2 g corn stover, 0.2 g Cl0.3-S-R, 190 °C, 80 min, 16.5 mL solvent. a15 mL organic solvent, 1.5 mL water. Table 3 Effect of corn stover loading on 5-HMF and furfural production. Table 3 Entry catalyst/corn stover (g/g) 5-HMF yield (%) Furfural yield (%) 1 0.2/0.1 44.8 42.4 2 0.2/0.2 43.8 38.1 3 0.2/0.4 14.1 25.1 4 0.2/0.6 7.5 15.4 5 0.2/0.8 6.7 12.1 6 0.6/0.6 30.8 30.2 7 0.8/0.8 22.9 25.2 Reaction conditions: 0.1–0.8 g corn stover, 15 mL 1, 4-dioxane, 1.5 mL water, 190 °C, 80 min. Table 4 5-HMF and furfural production from biomass using various catalysts. Table 4 Catalyst Reaction conditions Solvent 5-HMF yield (%) Furfural yield (%) Reference S-Ra 190 °C, 80 min Water/1,4-dioxane 38.4 32.8 This work Cl0.3-S-Ra 190 °C, 80 min Water/1,4-dioxane 43.8 38.1 This work HSC-SO3H b 175 °C, 0.5 h GVL-water 9.8 90.8 [17] SO4 2−/SnO2-Al2O3 CFAa 190 °C, 0.5 h NH4Cl- Toluene – 84.7 [32] SO4 2−/Sn-TRPa 190 °C, 3 h Toluene/NaCl/DMSO – 77.8 [18] SO4 2−/CX-DMSn b 180 °C, 5 h Water – 65.74 [36] PTSA-POMa 190 °C, 100 min GVL 19.5 83.5 [25] SO4 2−/SnO2 CSa 170 °C, 0.5 h ChCl:EG-water c – 68.2 [37] Substrate: aCorn stover. b Corn cob. c ChCl (choline chcloride):EG (ethylene glycol). Table 5 5-HMF and furfural yields from corn stover catalyzed by Cl0.3-S-R. Table 5 Product yields (%) 1st run 2nd run 3rd run 4th run 5th run 5-HMF 43.8 35.7 29.3 18.3 7.4 Furfural 54.2 48.7 40.5 29.8 18.7 Reaction conditions: 0.3 g Cl0.3-S-R, 0.1 g corn stover, 15 mL 1,4-dioxane, 1.5 mL water, 190 °C, 10 min. Efficient conversion of corn stover to 5-hydroxymethylfurfural and furfural using a novel acidic resin catalyst in water-1, 4-dioxane system Tao Yang Conceptualization Methodology Formal analysis Investigation Data curation Writing – original draft Visualization Project administration Supervision a † Dong Chen Formal analysis Investigation Resources Data curation Writing – original draft Visualization Project administration Supervision a † Wenzhi Li Conceptualization Validation Data curation Writing – review & editing Project administration Funding acquisition a b ⁎ Hao Zhang Resources a a Laboratory of Basic Research in Biomass Conversion and Utilization, University of Science and Technology of China, Hefei 230026, People's Republic of China Laboratory of Basic Research in Biomass Conversion and Utilization University of Science and Technology of China Hefei 230026 People's Republic of China aLaboratory of Basic Research in Biomass Conversion and Utilization, University of Science and Technology of China, Hefei 230026, People's Republic of China b Institute of Energy, Hefei Comprehensive National Science Center, Hefei 230031, People's Republic of China Institute of Energy Hefei Comprehensive National Science Center Hefei 230031 People's Republic of China bInstitute of Energy, Hefei Comprehensive National Science Center, Hefei 230031, People's Republic of China ⁎ Corresponding author. † These authors contributed equally to this work. A route of corn stover conversion was developed for 5-hydroxymethylfurfural (5-HMF) and furfural production by a novel Cl-containing resin-based solid acid catalyst (Cl0.3-S-R), which was synthetized by a simple hydrothermal method through polymerization reaction of o-chlorophenol and p-hydroxybenzenesulfonic with formaldehyde. The effects of catalyst types, reaction time, substrate types, solvent types, additional water concentrations and corn stover concentrations were investigated in detail. The high 5-HMF yield of 43.8% and furfural yield of 38.1% (based on the xylose and glucose units) could be achieved from corn stover simultaneously in water/1,4-dioxane at 190 °C in 80 min, with Cl0.3-S-R as catalyst. Furthermore, the catalysts were characterized by SEM, elemental analysis, FTIR, XPS and N2 adsorption-desorption to reveal its physical and chemical properties. Graphic abstract Image, graphical abstract Keywords Corn stover 5-HMF Furfural Acidic resin -Cl group -SO3H group 1 Introduction 5-hydroxymethylfurfural (5-HMF) and furfural have been listed as the high value-added chemicals by the U.S.DOE in 2010 [1], which may play a vital role in producing important building block intermediates in the industrial applications, such as polymers, resins, chemicals and fuel additives [2, 3]. Therefore, the conversion of biomass to these biomass-derived platform chemicals has attracted more and more attention due to its ability for replacing traditional fossil fuels, reducing environmental pollution and achieving carbon neutral. Especially, lignocellulosic biomass, with low price, abundant reserves and wide distribution, could be used as a promising renewable source for the production of 5-HMF and furfural. During the conversion processes of lignocellulosic biomass, the fractions of cellulose and hemicellulose can be hydrolyzed into C6 and C5 sugars platform molecules, which are further dehydrated to 5-HMF and furfural [4], respectively. In order to achieve the high 5-HMF and furfural production from biomass, various catalysts were reported in recent years. In the field of homogeneous catalysis, the production of 5-HMF and furfural from raw biomass or sugars were mainly focused on mineral acids, organic acid, metal chloride and ionic liquid [5–8]. However, some common problems such as equipment corrosion, environmental pollution and difficult separation of catalysts would hinder the utilization of homogeneous catalysts. To overcome these drawbacks, heterogeneous acidic catalysts are widely developed for 5-HMF and furfural production from various carbohydrates [9]. These catalysts included zeolites, metal organic frameworks, modified metal oxides, metal phosphates and carbon-based solid acid [10–14]. Among above catalysts, carbon-based solid acids have attracted much attention owing to its abundant sources, low price and tunable surface acidity [15]. For example, Li et al. prepared a heterogeneous strong acid catalyst and 93% furfural yield was achieved from corn stover at 200 °C in 100 min [16]. Zhang et al. prepared the bi-functional solid acid catalyst which can obtain a 90.8 mol% furfural yield from corncob in GVL-water system at 175 °C in 30 min [17]. Teng et al. explored a tin loaded sulfonated carbonized solid acid catalyst and 77.82% furfural yield from corn stover was achieved under 190 °C for 3 h [18]. Although high furfural yields have been obtained from corn stover or corncob with these catalysts, while the furfural was mainly derived from the hemicellulose fraction of biomass. As for the cellulose, which are the major components in biomass, has not been utilized effectively during corn stover conversion. The reason may be ascribed to its stable structure, meanwhile, the strong hydrogen interactions in cellulose would also hinder the access of catalytic sites. Thus, it is necessary to develop novel catalyst to achieve full utilization of cellulose and hemicellulose fractions simultaneously. As we all know, the cellulase exhibited high selectivity for conversion of cellulose into glucose, because it contained a cellulose-binding domain and a catalytic domain which were used to adsorb and hydrolyze cellulose, respectively. Inspired by the structure of cellulase, considerable works have been devoted to transform cellulose to glucose, 5-HMF or levulinic acid by developing the cellulase-mimetic solid catalyst. For example, Shuai et al. prepared a sulfonated commercial chloromethyl polystyrene resin which was used to hydrolyze the microcrystalline cellulose and 93% yield of glucose was obtained [19]. Hu et al. prepared a similar bi-functional solid acid catalyst by using sucralose as -Cl and carbon sources with H2SO4 as sulfonation agent [20]. Shen et al. also developed a solid acid catalyst with sulfonic acid functionalized sucralose, which achieve 61% levulinic acid yield from cellulose [21]. Therefore, dedicated cellulose-binding and cellulose-adsorbing functionalities are successful strategy for promoting the interactions of catalyst with cellulosic biomass. However, the most previous reported catalysts were needed the tedious preparation procedures such as carbonization/sulfonation or polymerization/sulfonation [22, 23]. In this study, in order to achieve the highly efficient conversion of cellulose fraction in corn stover, a novel cellulase-mimetic solid acid catalyst was proposed by a facile hydrothermal method on the basis of the synthesis of various phenolic resins [24 –26]. Specifically, the resin-based cellulase-mimetic solid acid catalyst was prepared by using o-chlorophenol and p-hydroxybenzenesulfonic acid as –Cl and –SO3H sources, respectively, which can be used as a cellulose-binding domain and catalytic domain to achieve the better conversion of cellulose in corn stover. Furthermore, 1, 4-dioxane, as one of the low boiling point solvents, which would be beneficial for the separation of products, was chosen as solvent system for the corn stover conversion. Herein, an extremely simple hydrothermal strategy for the novel -Cl and –SO3H functionalized resin catalyst was developed for the co-production of 5-HMF and furfural from corn stover. The catalysts ware characterized by various instruments to reveal its physical and chemical properties. Furthermore, the effects of catalyst types and various reaction conditions on the 5-HMF and furfural yields were investigated in detail. 2 Materials and methods 2.1 Materials 5-hydroxymethylfurfural (5-HMF, 99%), furfural (99%), d-(+)-glucose (99.5%, GC), d-(+)-xylose (98%), chitosan (degree of deacetylation ≥ 95%), o-chlorophenol, p-hydroxybenzenesulfonic acid hydrate (85%), γ-valerolactone (GVL) and butyrolactone (GBL) were purchased from Alladdin Industrial Inc. (Shanghai, China). Acetic acid, formaldehyde solution (37 wt%), 1, 4-dioxane and ethanol were purchased from Sinopharm Chemical Reagent Co., Ltd. (Shanghai, China). The corn stover was collected from Bozhou, Anhui province, China. The corn stover was washed by distilled water for several times and dried in a 105 °C oven, then, the corn stover was ground into particles that can pass a 40-mesh sieve. Finally, the corn stover was dried in the 80 °C oven until to constant weight for next utilization. The components of corn stover were determined on the basis of the Laboratory Analytical Procedures (LAP) which were established by the National Renewable Energy Laboratory (NREL) and the detailed procedures were listed in previous reports [27, 28]. And the xylan, glucan and lignin units in corn stover were 31.6 wt%, 20.5 wt% and 22.8 wt%, respectively. 2.2 Synthesis of catalyst The Cl-containing sulfonated resin-based solid acid catalyst (Cl-S-R) was prepared from previous reports with some modifications [24, 26]. In a typical preparation process (Scheme S1), 30 mL distilled water, 0.45 g chitosan and 0.6 mL acetic acid were added into a 100 mL beaker with vigorous magnetic stirring for 10 min until the solution becoming transparent. In the preparation of catalyst, chitosan could dissolve well in acetic acid solution and form three-dimension transparent gel, which can be cross-linked by formaldehyde. Furthermore, chitosan can be usually chosen as an absorbent for p-hydroxybenzenesulfonic acid and o-chlorophenol. Moreover, aldehydes and p-hydroxybenzenesulfonic acid/o-chlorophenol can polymerize in the acidic environment. Then, 3.2 g p-hydroxybenzenesulfonic acid hydrate and 0.3 mL o-chlorophenol were added into above mixture, respectively. After dissolution, 3 mL formaldehyde solution (37 wt%) was added into the beaker and stirring for 10 min. Then, the mixtures were poured into a 50 mL Teflon-lined hydrothermal reactor, sealed firmly and kept at a 120 °C oven for 12 h. After the autoclave cooling to the room temperature, the solid products were transferred into 250 mL beaker and mashed to a paste, then, the paste was dried at 100 °C oven for another 24 h. The obtained bulk materials were ground into powder and washed with distilled water and ethanol for several times until pH to neutral. Finally, the catalyst was dried in 80 °C oven to constant weight and labelled as Cl0.3-S-R. As for ClX-S-R, the X represented the adding o-chlorophenol contents while p-hydroxybenzenesulfonic acid hydrate was kept at 3.2 g. Furthermore, the S-R or Cl-R were prepared according to above method without adding the o-chlorophenol or p-hydroxybenzenesulfonic acid hydrate. 2.3 Characterization of catalyst SEM (scanning electron microscopy) was used to reveal the morphologies of the catalysts and the mapping was carried out to analyze the elemental distribution in the catalyst. N2 sorption analysis was used to investigate the textural properties of the catalysts. Sulfur (S) content of the catalyst samples were examined by an Elementar model Vario EL Ⅲ. The chemical bonds of the catalysts were recorded on FT-IR spectra in the range of 400–4000 cm−1. X-ray photoelectron spectroscopy (XPS) was used to determine the chemical state of Cl, O and S. 2.4 Experimental procedure and analysis method All catalytic reactions were performed in a 25 mL stainless steel reactor with a stirring rate of 600 rpm/min. In a typical experimental procedure, 0.2 g catalyst, 0.2 g corn stover, 15 mL 1, 4-dioxane and 1.5 mL distilled water were added into the reactor. Then, the reactor was sealed firmly and heated to a given temperature with a heating rate of 5 °C/min and kept at given temperature for a certain reaction time (20–100 min). After reaction ending, the reactor was cooling to ambient temperature naturally. The reaction solution was collected by filtration and the solution was restored into a 4 °C refrigerator for further analysis. HPLC (Shimadzu) was used to quantify the 5-HMF and furfural concentrations with an Ultraviolet Detector and Agilent C18 column. A solution of methanol/distilled water (2/3, V/V) was chosen as mobile phase with a flow rate of 0.4 mL/min. The 5-HMF and furfrual contents were calculated on the basis of corresponding standard calibration curves. Yields (mol%) of furfural and 5-HMF were calculated as follows: Substrate= xylose, fructose, glucose, cellobiose and cellulose Substrate= fructose, glucose, cellobiose and cellulose 3 Results and discussion 3.1 Characterization of catalyst samples In this study, with chitosan as the soft template, and the p-hydroxybenzenesulfonic acid and o-chlorophenol were used as –SO3H and –Cl sources, respectively, which can react with formaldehyde via polymerization reaction to form the novel resin polymer. Then, SEM was used to reveal the morphologies of catalyst samples. As shown in Fig. 1 , the synthesized S-R and Cl-S-R samples showed an irregular particle structure. The uneven surface of catalyst particles could provide more acidic catalytic sites for contacting with corn stover, which may be in favor of products formation. Furthermore, the specific surface area and pore size are important features for catalysts, the N2 adsorption/desorption isotherms of all sample were shown in Fig. 2 . The results indicated that the S-R exhibited typical Ⅳ adsorption isotherms with a H3 type hysteresis loop. It is obvious that the BET area and pore volume of catalyst samples decreased sharply after introduction of o-chlorophenol. As listed in Table 1 , the BET surface areas of S-R, Cl0.3-S-R, Cl0.5-S-R and Cl-R are 85.13, 10.54, 9.30 and 1.12 m2/g, the corresponding pore volume are 0.13, 0.028, 0.015 and 0.0061 cm3/g, implying that BET surface and pore volume decreased sharply with the increase of Cl contents. Thus, the introduction of -Cl source may result in tensely polymerization of resin catalyst to form low-porosity samples. The organic groups in the catalyst samples were identified by the FTIR. As shown in Fig. 3 , for S-R, Cl0.3-S-R and Cl0.5-S-R samples, the peaks around 570, 625 and 1034 cm−1 clearly demonstrated the presence of –SO3H group in the catalysts. As for the Cl0.3-S-R, Cl0.5-S-R and Cl-R, a new peak around 742 cm−1 was corresponded to CCl [29], suggesting that the –Cl groups was introduced into S-R successfully. Therefore, the catalyst containing the chlorine and sulfonic acid functional groups was achieved on Cl0.3-S-R simultaneously. Furthermore, the peak at around 880 cm−1 may be ascribed to a CH out-of-plane bending in the tetrasubstituted benzene rings, while the –OH stretching peak around 3400 cm−1 can be ascribed to presence of phenolic hydroxyl. Then, the sulfur contents of catalysts were determined by elemental analysis and the results were summarized in Table 1. According to the results, the amount of sulfur has a slight decrease after adding Cl sources. The S contents of S-R, Cl0.3-S-R and Cl0.5-S-R were 5.2, 4.7 and 4.4 wt%, and the corresponding -SO3H group densities were 1.62, 1.47 and 1.37 mmol/g. Furthermore, the relative percentages of Cl atom in the catalyst samples was determined by XPS and the Cl element contents in Cl0.3-S-R, Cl0.5-S-R and Cl-R were 0.5, 0.9 and 7.0 wt%, respectively. The XPS was used to quantitatively measure the Cl composition and valence states of various elements in the catalyst sample. Fig. 4 A shows elemental changes in full spectra of samples with different Cl doping contents. It was obvious found that four predominant peaks around 168, 201, 285 and 532 eV corresponded to S 2p, Cl 2p, C 1 s and O 1 s, respectively. It is clearly observed that peaks of Cl 2p appears in Cl0.3-S-R, Cl0.5-S-R and Cl-R and the intensity of –Cl peak increased with the increase of o-chlorophenol as Cl sources. Similarly, the peaks of S 2p emerges in S-R, Cl0.3-S-R and Cl0.5-S-R, which are absent in Cl-R. Thus, The Cl 2p appeared in the XPS spectra of Cl-S-R and Cl-R also demonstrated that the Cl-containing sulfonated resin catalysts were synthesized successfully by this hydrothermal method. As shown in Fig. 4B, a peak at 168 eV that is ascribed to single S 2p peak, implying the all S corresponding to –SO3H. 3.2 Screening of catalysts for corn stover conversion Initially, acid-catalyzed hydrolysis of corn stover was explored using a series of acidic resin as catalyst. The catalytic reaction of corn stover to 5-HMF and furfural was carried out at 190 °C for 80 min with 1, 4-dioxane-water as solvent, and the results are summarized in Table S1. Comparing with S-R, Cl0.5-S-R and Cl-R, Cl0.3-S-R gave the highest 5-HMF and furfural yields, which are 43.8% and 38.1%, respectively. Besides Cl0.3-S-R, when Cl0.5-S-R was used as catalysts, achieving 41.9% 5-HMF yield, which was higher than 38.4% 5-HMF yield with S-R as catalyst. Furthermore, when commercial Amberlyst 15 (Table S1, entry 5) was used as catalyst, 35.6% 5-HMF and 28.2% furfural yields were achieved under the same reaction conditions. These results indicated that the presence of –Cl and -SO3H sites exhibited a higher activity for the dehydration of cellulose fraction in corn stover. In this reaction process, the –Cl group can play the role for absorbing the cellulose like the binding domain of cellulase and the –SO3H group can hydrolyze the cellulose further. Furthermore, Cl0.5-S-R showed a higher furfural yield than S-R, which implied that the presence of –Cl and –SO3H groups also exhibited a synergistic effect for hemicellulose conversion. It is no doubt that the Cl-R catalyst lacking of –SO3H sites showed lowest 5-HMF and furfural yields, which were no more than 10%. The further comparisons of S-R and Cl0.3-S-R on the 5-HMF and furfural yields from the corn stover were investigated at 190 °C in a time range of 20 to 100 min. As shown in Fig. 5 , the Cl0.3-S-R exhibited a higher catalytic activity than S-R in a shorter reaction time. For example, 34.6% 5-HMF and 35.3% furfural yields were achieved by Cl0.3-S-R, while 17.5% 5-HMF and 28.8% furfural yields were obtained by S-R in 20 min. With the increase of reaction time, the 5-HMF and furfural yields reached to the peak values at 60 min for two catalysts. During whole reaction of corn stover conversion, the results indicated that the Cl0.3-S-R resin catalyst showed a better catalytic activity than S-R. Therefore, the Cl0.3-S-R catalyst can be regarded as a highly efficient solid acid catalyst for conversion of cellulose and hemicellulose in corn stover. In order to test the catalytic performance of catalyst further, production of 5-HMF and furfural from various biomass-derived carbohydrates were also investigated by using the Cl0.3-S-R as catalyst in a water/1, 4-dioxane system. As listed in Table S2, it has been shown that such Cl0.3-S-R catalyst exhibited good catalytic performance in conversion of disaccharides and polysaccharides. The yield of 5-HMF from cellulose, glucose, fructose, cellobiose were 37.5%, 33.5%, 69.3% and 24.4%, respectively. Moreover, the furfural could also be produced from above substrates and the corresponding furfural yields were 6.3%, 4.5%, 9.4% and 2.4%, respectively. The results indicated that the furfural can also be transformed from C6 sugars, thus, the furfural yield in this study was calculated on the basis of xylose unit and glucose unit of corn stover. 3.3 The effects of solvent types and water concentrations on the corn stover transformation Besides catalysts, the numbers of previous studies have demonstrated that the solvent may also play a vital role in the process of carbohydrates dehydration, which can not only be acted as physical medium for the substrate dissolution, but also may be present some chemical interactions between catalyst and substrate [30–32]. Thus, the effect of diverse solvents on the transformation of corn stover to 5-HMF and furfural were performed by using Cl0.3-S-R as catalyst. In this study, 1, 4-dioxane was chosen as solvent for its advantages of low boiling point, which is beneficial for separation from furfural and 5-HMF. GVL and GBL are typical green organic solvent, which can be prepared from biomass-derived furfural [32]. To estimate comprehensively the catalytic performance of Cl0.3-S-R, diverse organic solvents and water were investigated in the same reaction conditions. As shown in Table 2 , the highest furfural yield of 42.4% was obtained with GVL as solvent, followed by GBL (42.2%), 1, 4-dioxane (25.9%) and water (10.4%). Meanwhile, 23.2%, 20.7%, 2.8% and 7.1% 5-HMF yields were achieved in GVL, GBL, 1, 4-dioxane and water, respectively. According to previous literature reports, when the moderate water was added into the organic reaction system, the 5-HMF yield can be improved remarkably. Then, the volume ratio (water/organic solvent) of 10% was chosen to add into the organic solvent. Surprisingly, when the water was added into 1, 4-dioxane, the 5-HMF yield increased from 2.8% to 43.8% and the furfural yield increased from 25.9% to 38.1%. As for the GVL and GBL solvent system, the furfural yield changed slightly and the 5-HMF yield increased about 10%. Furthermore, to investigate the detailed effect of water contents on the products yields, a series of water/1, 4-dioxane concentrations were examined. As shown in Fig. 6 , the 5-HMF yield increased from 2.8% to 26% with 3.2wt% water adding into the 1, 4-dioxane. Then, the 5-HMF yield increased gradually with the further increase of water concentrations from 3.2wt% to 14.3wt%, and the highest 5-HMF yield of 46.4% was obtained with 14.3wt% water concentrations. While the 5-HMF yield had some decrease with the further increase of water to 16.7wt%. Meanwhile, the furfural yield increased from 25% to 38% when the water contents increased from 0 to 3.2wt%. Furthermore, when xylose was used as substrate in Table S2 (entry 5, 6), 72.8% and 69.9% furfural yields were achieved with 1, 4-dioxane/water and 1, 4-dioxane as solvent, respectively. Therefore, these results demonstrated that the presence of proper water in 1,4-dioxane would also be beneficial for furfural formation which may be caused by stabilizing the reactants and transition states with unsaturated CC bonds [33]. However, with the further increase of water amounts from 3.2wt% to 16.7wt%, the furfural yields kept about 38% that did not show obvious characteristic trend. The possible reason may be ascribed to the hemicellulose in corn stover has been hydrolyzed fully with the water/1, 4-dioxane as solvent system, thus, the furfural yield was kept at a relatively constant value with the increase of water amounts. 3.4 Effect of corn stover loading on production of 5-HMF and furfural During industrial production, higher substrate loadings can enhance the economic efficacy. Thus, the effect of corn stover loading was conducted at 190 °C for 80 min using 0.2 g Cl0.3-S-R by varying the corn stover loading from 0.1 to 0.8 g. As shown in Table 3 , the highest yields of 5-HMF and furfural were achieved at the corn stover loading of 0.1 g, which were 44.8% and 42.4%. With the increase of the substrate contents from 0.1 g (0.6wt%, mass ratio of corn stover/solvent) to 0.8 g (4.8wt%), the yield of 5-HMF decreased to 38.1%, 25.1%, 15.4% and 12.1%. This phenomenon may be ascribed to the higher substrate which resulted in the self-condensation or cross-polymerization between substrate and products. Besides, the catalytic sites are not adequate to catalyze the corn stover conversion with increasing the substrate loading. Therefore, further investigation was carried out employing 0.6 g and 0.8 g corn stover with higher catalyst contents (Table 1, entries 6, 7). It has been shown that 30.8% 5-HMF and 30.2% furfural yields were obtained under the same conditions by using 0.6 g catalyst, and the 5-HMF and furfural yields can also be enhanced to 22.9% and 25.5% with 0.8 g Cl0.3-S-R. Thus, the lack of enough catalytic sites may be the main reason for the low products yields. These results indicated that the Cl0.3-S-R catalyst exhibited a superior catalytic ability even in high corn stover concentration, which can be regarded as a promising catalyst in industrial application. 3.5 Discussion of structure-property correlation In order to compare the catalytic performance of our catalysts with some previous reports, the results were listed in Table 4 . Various solid acid catalysts such as HSC-SO3H (Cl-bearing solid acid catalyst) [17], SO4 2−/SnO2-Al2O3 CFA (composite coal fly ash solid acid catalyst) [34], SO4 2−/Sn-TRP (Tin-loaded sulfonated rape pollen) [18], SO4 2−/CX-DMSn (sulfonated tin-loaded diatomite catalyst) [35] and PTSA-POM [25] were used to convert corn stover or corncob, and 90.8%, 84.7%, 82.7%, 66.24% furfural yields were obtained, respectively. The furfural yields from these reports were calculated on the basis of the starting moles of xylan. According to these results, despite good furfural yields from biomass, while a low 5-HMF yield indicated that the cellulose fractions of corn stover have not been hydrolyzed effectively. Notably, the 5-HMF yield reached to a relatively high value of 43.8% in this study with Cl0.3-S-R as catalyst under 190 °C for 80 min. Comparing with other studies, a better 5-HMF yield in this study may be attributed to the presence of electronegative –Cl groups and sulfonic acid. The chloride group (-Cl) could be regarded as the cellulose-binding domain which can form stronger hydrogen bonds with hydroxyl groups of cellulose to weaken intra- and inter-hydrogen bonds of cellulose (Scheme 1 ). Then, the adjacent –SO3H groups in catalyst can hydrolyze cellulose into the oligosaccharides via cleavage of β−1, 4-glycosidic bonds, which can be transformed into glucose further with acidic sites [19]. After that, the produced glucose was converted to fructose, which was transformed into 5-HMF with the help of sulfonic acidic sites. According to the results of Table S2, partial C6 sugars were also be converted into furfural. Furthermore, the proposed reaction pathway of hemicellulose conversion was shown in Scheme S2 [35]. The –SO3H of Cl-S-R can react with ether oxygen bond of hemicellulose to form trivalent oxygen via hydroxylation reaction. Then, the oxygen bond breaks to generate carbonium ions and hydroxyl groups. The former can react with water molecules to form the hydroxyl groups, and the pentose was formed after above reaction steps. Next, the –SO3H of Cl-S-R attacks the non-bonding electron pair of hydroxyl oxygen bonded bound to a carbon atom to generate trivalent positively charged oxygen atom. The positive charge is immediately transferred to the adjacent carbon atoms due to the stronger electronegativity of oxygen than carbon atom, which resulted in the fracture of CO bond, the generation of carbonium ions and the release of water molecules. After that, carbonium ions were transformed to the C = C bond and the ring of pentose was opened in this reaction process. During this step, a water molecule is generated again in this process, and another C = C bond is formed at the same time. Then, after 1, 4-elimination reaction, the trivalent oxygen atom form a plane structure with 120° bond angle. Finally, the ring closure reaction occurred to produce furfural. During the above reaction process, the reasonable distribution of binding sites and acidic sites in the cellulase-mimetic catalyst can also be beneficial for the acidic sites closer to the cellulose, moreover, the presence of acidic sites could also promote the conversion of hemicellulose. Thus, a novel catalyst and reaction system can be regarded as a highly efficient catalytic system for full utilization of cellulose and hemicellulose of corn stover. 3.6 Catalyst recycles The reusability of the catalyst was important factor to evaluate its application in industrial production, the Cl0.3-S-R was used for the conversion of corn stover. In a typical reaction, 0.3 g Cl0.3-S-R, 0.1 g corn stover, 15 mL 1, 4-dioxane and 1.5 mL water were added into autoclave and the reactor was heated at 190 °C for 10 min. After cooling to room temperature, the reaction solution was obtained through filtration and then measured by HPLC. As generally known, it is difficult to recover the solid acid catalyst from the corn stover residue. Thus, the reused catalysts were washed with distilled water and acetone for several times, dried in the 80 °C oven and used for the next cycle directly. As shown in Table 5 , the 5-HMF yields were 43.8%, 35.7%, 29.3%, 18.3% and 7.4% from 1st to 5th runs, respectively. The 5-HMF yield decreased after every run, and the similar result was found for the furfural yield. From 1st to 5th runs, 54.2%, 48.7%, 40.5%, 29.8% and 18.7% furfural yields were obtained, respectively. The decrease of 5-HMF and furfural yields may be caused by the presence of corn stover residue and the leaching of sulfonic acid, which has been proved by our previous reports [38]. 4 Conclusions In this study, a novel solid acid catalyst bearing with –Cl and –SO3H groups was prepared successfully through hydrothermal method via a polymerization of o-chlorophenol and p-hydroxybenzenesulfonic with formaldehyde. The synthesized Cl0.3-S-R catalyst showed a superior catalytic activity in the catalytic conversion of corn stover to 5-HMF and furfural in a 1, 4-dioxane/water reaction system. A promising 5-HMF yield of 43.8% and furfural yield of 38.1% were achieved at 190 °C for 80 min over Cl0.3-S-R in the presence of 10wt% water in the 1, 4-dioxane. The better catalytic performance of the Cl0.3-S-R than S-R was attributed to the presence of binding domain and catalytic domain on the catalyst. Furthermore, the as-synthesized Cl0.3-S-R exhibited a good catalytic activity for various substrates. In summary, this work provided a novel catalyst and reaction system for the full utilization of cellulose and hemicellulose fractions in biomass. CRediT authorship contribution statement Tao Yang: Conceptualization, Methodology, Formal analysis, Investigation, Data curation, Writing – original draft, Visualization, Project administration, Supervision. Dong Chen: Formal analysis, Investigation, Resources, Data curation, Writing – original draft, Visualization, Project administration, Supervision. Wenzhi Li: Conceptualization, Validation, Data curation, Writing – review & editing, Project administration, Funding acquisition. Hao Zhang: Resources. Declaration of Competing Interest The authors declare that they have no known competing financial interests or personal relationships that could have appeared to influence the work reported in this paper. Acknowledgments This study was financially supported by the National Key R&D Program of China (No. 2018YFB1501601), “Transformational Technologies for Clean Energy and Demonstration”, Strategic Priority Research Program of the Chinese Academy of Sciences, Grant No. XDA 21060101 and the Key Research and Development Projects in Anhui Province (202004a06020053). Supplementary materials Supplementary material associated with this article can be found, in the online version, at doi:10.1016/j.mcat.2021.111920. Appendix Supplementary materials Image, application 1 References [1] J.J. Bozell G.R. Petersen Technology development for the production of biobased products from biorefinery carbohydrates—the US department of energy's “Top 10” revisited Green Chem 12 2010 539 554 J.J. Bozell, G.R. Petersen, Technology development for the production of biobased products from biorefinery carbohydrates—the US department of energy's “Top 10” revisited, Green Chem. 12 (2010) 539–554. [2] X. Han Y. Guo X. Liu Q. Xia Y. Wang Catalytic conversion of lignocellulosic biomass into hydrocarbons: a mini review Catal. Today 319 2019 2 13 X. Han, Y. Guo, X. Liu, Q. Xia, Y. Wang, Catalytic conversion of lignocellulosic biomass into hydrocarbons: a mini review, Catal. Today319 (2019) 2–13. [3] C.-.H. Zhou X. Xia C.-.X. Lin D.-.S. Tong J. Beltramini Catalytic conversion of lignocellulosic biomass to fine chemicals and fuels Chem. Soc. Rev. 40 2011 5588 5617 C.-.H. Zhou, X. Xia, C.-.X. Lin, D.-.S. Tong, J. Beltramini, Catalytic conversion of lignocellulosic biomass to fine chemicals and fuels, Chem. Soc. Rev.40 (2011) 5588–5617. [4] Q. Hou X. Qi M. Zhen H. Qian Y. Nie C. Bai S. Zhang X. Bai M. Ju Biorefinery roadmap based on catalytic production and upgrading 5-hydroxymethylfurfural Green Chem. 23 2021 119 231 Q. Hou, X. Qi, M. Zhen, H. Qian, Y. Nie, C. Bai, S. Zhang, X. Bai, M. Ju, Biorefinery roadmap based on catalytic production and upgrading 5-hydroxymethylfurfural, Green Chem.23 (2021) 119–231. [5] I.K.M. Yu H. Chen F. Abeln H. Auta J. Fan V.L. Budarin J.H. Clark S. Parsons C.J. Chuck S. Zhang G. Luo D.C.W. Tsang Chemicals from lignocellulosic biomass: a critical comparison between biochemical, microwave and thermochemical conversion methods Crit. Rev. Environ. Sci. Technol. 2 2020 1 54 I.K.M. Yu, H. Chen, F. Abeln, H. Auta, J. Fan, V.L. Budarin, J.H. Clark, S. Parsons, C.J. Chuck, S. Zhang, G. Luo, D.C.W. Tsang, Chemicals from lignocellulosic biomass: a critical comparison between biochemical, microwave and thermochemical conversion methods, Crit. Rev. Environ. Sci. Technol.. 2 (2020) 1–54. [6] W. Guo H.J. Heeres J. Yue Continuous synthesis of 5-hydroxymethylfurfural from glucose using a combination of AlCl3 and HCl as catalyst in a biphasic slug flow capillary microreactor Chem. Eng. J. 381 2020 122754 122766 W. Guo, H.J. Heeres, J. Yue, Continuous synthesis of 5-hydroxymethylfurfural from glucose using a combination of AlCl3 and HCl as catalyst in a biphasic slug flow capillary microreactor, Chem. Eng. J.381 (2020) 122754–122766. [7] W. Yang P. Li D. Bo H. Chang The optimization of formic acid hydrolysis of xylose in furfural production Carbohydr. Res. 357 2012 53 61 W. Yang, P. Li, D. Bo, H. Chang, The optimization of formic acid hydrolysis of xylose in furfural production, Carbohydr. Res.357 (2012) 53–61. [8] G. Machado S. Leon F. Santos R. Lourega J. Dullius M.E. Mollmann P. Eichler Literature review on furfural production from lignocellulosic biomass Nat. Resour. 7 2016 115 129 G. Machado, S. Leon, F. Santos, R. Lourega, J. Dullius, M.E. Mollmann, P. Eichler, Literature review on furfural production from lignocellulosic biomass, Nat. Resour.7 (2016) 115–129. [9] I. Agirrezabal-Telleria I. Gandarias P.L. Arias Heterogeneous acid-catalysts for the production of furan-derived compounds (furfural and hydroxymethylfurfural) from renewable carbohydrates: a review Catal. Today 234 2014 42 58 I. Agirrezabal-Telleria, I. Gandarias, P.L. Arias, Heterogeneous acid-catalysts for the production of furan-derived compounds (furfural and hydroxymethylfurfural) from renewable carbohydrates: a review, Catal. Today234 (2014) 42–58. [10] F. Atabaki E. Abedini A. Shokrolahi Efficient hydrolysis of cellulose into glucose over sulfonated polynaphthalene (SPN) and rapid determination of glucose using positive corona discharge ion mobility spectrometry RSC Adv 6 2016 7879 7885 F. Atabaki, E. Abedini, A. Shokrolahi, Efficient hydrolysis of cellulose into glucose over sulfonated polynaphthalene (SPN) and rapid determination of glucose using positive corona discharge ion mobility spectrometry, RSC Adv. 6 (2016) 7879–7885. [11] X. Guo F. Guo Y. Li Z. Zheng Z. Xing Z. Zhu T. Liu X. Zhang Y. Jin Dehydration of d-xylose into furfural over bimetallic salts of heteropolyacid in DMSO/H2O mixture Appl. Catal. A 558 2018 18 25 X. Guo, F. Guo, Y. Li, Z. Zheng, Z. Xing, Z. Zhu, T. Liu, X. Zhang, Y. Jin, Dehydration of d-xylose into furfural over bimetallic salts of heteropolyacid in DMSO/H2O mixture, Appl. Catal. A558 (2018) 18–25. [12] X. Li X. Lu M. Liang R. Xu Z. Yu B. Duan L. Lu C. Si Conversion of waste lignocellulose to furfural using sulfonated carbon microspheres as catalyst Waste Manage 108 2020 119 126 X. Li, X. Lu, M. Liang, R. Xu, Z. Yu, B. Duan, L. Lu, C. Si, Conversion of waste lignocellulose to furfural using sulfonated carbon microspheres as catalyst, Waste Manage. 108 (2020) 119–126. [13] J. Miao Y. Fang X. Yang Y. Zhu A. Hu G. Wang Fabrication, flame retardancy and physical properties of phosphorus containing porous organic polymers/epoxy resin composites Polym. Degrad. Stab. 176 2020 109159 109171 J. Miao, Y. Fang, X. Yang, Y. Zhu, A. Hu, G. Wang, Fabrication, flame retardancy and physical properties of phosphorus containing porous organic polymers/epoxy resin composites, Polym. Degrad. Stab.176 (2020) 109159–109171. [14] Y. Wang X. Yang H. Zheng X. Li Y. Zhu Y. Li Mechanistic insights on catalytic conversion fructose to furfural on beta zeolite via selective carbon-carbon bond cleavage Mol. Catal. 463 2019 130 139 Y. Wang, X. Yang, H. Zheng, X. Li, Y. Zhu, Y. Li, Mechanistic insights on catalytic conversion fructose to furfural on beta zeolite via selective carbon-carbon bond cleavage, Mol. Catal.463 (2019) 130–139. [15] I.C. Gerber P. Serp A theory/experience description of support effects in carbon-supported catalysts Chem Rev 120 2020 1250 1349 I.C. Gerber, P. Serp, A theory/experience description of support effects in carbon-supported catalysts, Chem Rev. 120 (2020) 1250–1349. [16] W. Li Y. Zhu Y. Lu Q. Liu S. Guan H.M. Chang H. Jameel L. Ma Enhanced furfural production from raw corn stover employing a novel heterogeneous acid catalyst Bioresour. Technol. 245 2017 258 265 W. Li, Y. Zhu, Y. Lu, Q. Liu, S. Guan, H.M. Chang, H. Jameel, L. Ma, Enhanced furfural production from raw corn stover employing a novel heterogeneous acid catalyst, Bioresour. Technol.245 (2017) 258–265. [17] L. Zhang L. Tian R. Sun C. Liu Q. Kou H. Zuo Transformation of corncob into furfural by a bifunctional solid acid catalyst Bioresour. Technol. 276 2019 60 64 L. Zhang, L. Tian, R. Sun, C. Liu, Q. Kou, H. Zuo, Transformation of corncob into furfural by a bifunctional solid acid catalyst, Bioresour. Technol.276 (2019) 60–64. [18] X. Teng Z. Si S. Li Y. Yang Z. Wang G. Li J. Zhao D. Cai P. Qin Tin-loaded sulfonated rape pollen for efficient catalytic production of furfural from corn stover Ind. Crops Prod. 151 2020 112481 112487 X. Teng, Z. Si, S. Li, Y. Yang, Z. Wang, G. Li, J. Zhao, D. Cai, P. Qin, Tin-loaded sulfonated rape pollen for efficient catalytic production of furfural from corn stover, Ind. Crops Prod.151 (2020) 112481–112487. [19] L. Shuai X. Pan Hydrolysis of cellulose by cellulase-mimetic solid catalyst Energy. Environl Sci. 5 2012 6889 6894 L. Shuai, X. Pan, Hydrolysis of cellulose by cellulase-mimetic solid catalyst, Energy. Environl Sci.5 (2012) 6889–6894. [20] S. Hu T.J. Smith W. Lou M. Zong Efficient hydrolysis of cellulose over a novel sucralose-derived solid acid with cellulose-binding and catalytic sites J. Agric. Food Chem. 62 2014 1905 1911 S. Hu, T.J. Smith, W. Lou, M. Zong, Efficient hydrolysis of cellulose over a novel sucralose-derived solid acid with cellulose-binding and catalytic sites, J. Agric. Food Chem.62 (2014) 1905–1911. [21] F. Shen R.L. Smith L. Li L. Yan X. Qi Eco-friendly method for efficient conversion of cellulose into levulinic acid in pure water with cellulase-mimetic solid acid catalyst ACS Sustain. Chem. Eng. 5 2017 2421 2427 F. Shen, R.L. Smith, L. Li, L. Yan, X. Qi, Eco-friendly method for efficient conversion of cellulose into levulinic acid in pure water with cellulase-mimetic solid acid catalyst, ACS Sustain. Chem. Eng.5 (2017) 2421–2427. [22] S. Jin J. Gong C. Yang Y. Cheng J. Lu Q. Yang H. Wang A recyclable and regenerable solid acid for efficient hydrolysis of cellulose to glucose Biomass Bioenergy 138 2020 105611 105617 S. Jin, J. Gong, C. Yang, Y. Cheng, J. Lu, Q. Yang, H. Wang, A recyclable and regenerable solid acid for efficient hydrolysis of cellulose to glucose, Biomass Bioenergy. 138 (2020) 105611–105617. [23] Y. Zuo Y. Zhang Y. Fu Catalytic conversion of cellulose into levulinic acid by a sulfonated chloromethyl polystyrene solid acid catalyst ChemCatChem 6 2014 753 757 Y. Zuo, Y. Zhang, Y. Fu, Catalytic conversion of cellulose into levulinic acid by a sulfonated chloromethyl polystyrene solid acid catalyst, ChemCatChem. 6 (2014) 753–757. [24] T. Zhang W. Li S. An F. Huang X. Li J. Liu G. Pei Q. Liu Efficient transformation of corn stover to furfural using p-hydroxybenzenesulfonic acid-formaldehyde resin solid acid Bioresour. Technol. 264 2018 261 267 T. Zhang, W. Li, S. An, F. Huang, X. Li, J. Liu, G. Pei, Q. Liu, Efficient transformation of corn stover to furfural using p-hydroxybenzenesulfonic acid-formaldehyde resin solid acid, Bioresour. Technol.264 (2018) 261–267. [25] Z. Xu W. Li Z. Du H. Wu H. Jameel H.M. Chang L. Ma Conversion of corn stalk into furfural using a novel heterogeneous strong acid catalyst in gamma-valerolactone Bioresour. Technol. 198 2015 764 771 Z. Xu, W. Li, Z. Du, H. Wu, H. Jameel, H.M. Chang, L. Ma, Conversion of corn stalk into furfural using a novel heterogeneous strong acid catalyst in gamma-valerolactone, Bioresour. Technol.198 (2015) 764–771. [26] Z.-.L. Yu Z.-.Y. Wu S. Xin C. Qiao Z.-.Y. Yu H.-.P. Cong S.-.H. Yu General and straightforward synthetic route to phenolic resin gels templated by chitosan networks Chem. Mater. 26 2014 6915 6918 Z.-.L. Yu, Z.-.Y. Wu, S. Xin, C. Qiao, Z.-.Y. Yu, H.-.P. Cong, S.-.H. Yu, General and straightforward synthetic route to phenolic resin gels templated by chitosan networks, Chem. Mater.26 (2014) 6915–6918. [27] Sluiter A B. Hames R. Ruiz C. Scarlata J. Sluiter D. Templeton Determination of Ash in Biomass, Laboratory Analytical Procedure (LAP) 2005 National Renewable Energy Laboratory Golden, CO A, Sluiter, B. Hames, R. Ruiz, C. Scarlata, J. Sluiter, D. Templeton, Determination of Ash in Biomass, Laboratory Analytical Procedure (LAP). National Renewable Energy Laboratory, Golden, CO. (2005) [28] Sluiter A B. Hames D. Hyman C. Payne R. Ruiz C. Scarlata J. Sluiter D. Templeton J. Wolfe Determination of Total Solids in Biomass and Total Dissolved Solids in Liquid Process Samples 2008 National Renewable Energy Laboratory Golden, CO A, Sluiter, B. Hames, D. Hyman, C. Payne, R. Ruiz, C. Scarlata, J. Sluiter, D. Templeton, J. Wolfe, Determination of Total Solids in Biomass and Total Dissolved Solids in Liquid Process Samples, National Renewable Energy Laboratory, Golden, CO. (2008) [29] Z. Zhang Y. Gu S. Wang Q. Li M. Li Z. Zhang Enhanced dielectric and mechanical properties in chlorine-doped continuous CNT sheet reinforced sandwich polyvinylidene fluoride film Carbon N Y 107 2016 405 414 Z. Zhang, Y. Gu, S. Wang, Q. Li, M. Li, Z. Zhang, Enhanced dielectric and mechanical properties in chlorine-doped continuous CNT sheet reinforced sandwich polyvinylidene fluoride film, CarbonCarbon N Y 107 (2016) 405–414. [30] S. Dutta I.K.M. Yu D.C.W. Tsang Z. Su C. Hu K.C.W. Wu A.C.K. Yip Y.S. Ok C.S. Poon Influence of green solvent on levulinic acid production from lignocellulosic paper waste Bioresour. Technol. 298 2020 122544 122551 S. Dutta, I.K.M. Yu, D.C.W. Tsang, Z. Su, C. Hu, K.C.W. Wu, A.C.K. Yip, Y.S. Ok, C.S. Poon, Influence of green solvent on levulinic acid production from lignocellulosic paper waste, Bioresour. Technol.298 (2020) 122544–122551. [31] X. Hu R.J.M. Westerhof D. Dong L. Wu C.-.Z. Li Acid-catalyzed conversion of xylose in 20 solvents: insight into interactions of the solvents with xylose, furfural, and the acid catalyst ACS Sustain. Chem. Eng. 2 2014 2562 2575 X. Hu, R.J.M. Westerhof, D. Dong, L. Wu, C.-.Z. Li, Acid-catalyzed conversion of xylose in 20 solvents: insight into interactions of the solvents with xylose, furfural, and the acid catalyst, ACS Sustain. Chem. Eng.2 (2014) 2562–2575. [32] C.B.T.L. Lee T.Y. Wu A review on solvent systems for furfural production from lignocellulosic biomass Renew. Sustain. Energ. Rev. 137 2021 110172 110190 C.B.T.L. Lee, T.Y. Wu, A review on solvent systems for furfural production from lignocellulosic biomass, Renew. Sustain. Energ. Rev.137 (2021) 110172–110190. [33] J. Cui J. Tan T. Deng X. Cui Y. Zhu Y. Li Conversion of carbohydrates to furfural via selective cleavage of the carbon–carbon bond: the cooperative effects of zeolite and solvent Green Chem. 18 2016 1619 1624 J. Cui, J. Tan, T. Deng, X. Cui, Y. Zhu, Y. Li, Conversion of carbohydrates to furfural via selective cleavage of the carbon–carbon bond: the cooperative effects of zeolite and solvent, Green Chem.. 18 (2016) 1619–1624. [34] L. Gong Z.-.Y. Xu J.-.J. Dong H. Li R.-.Z. Han G.-.C. Xu Y. Ni Composite coal fly ash solid acid catalyst in synergy with chloride for biphasic preparation of furfural from corn stover hydrolysate Bioresour. Technol. 293 2019 122065 122071 L. Gong, Z.-.Y. Xu, J.-.J. Dong, H. Li, R.-.Z. Han, G.-.C. Xu, Y. Ni, Composite coal fly ash solid acid catalyst in synergy with chloride for biphasic preparation of furfural from corn stover hydrolysate, Bioresour. Technol.293 (2019) 122065–122071. [35] I. Agirrezabal-Telleria I. Gandarias P. Arias Heterogeneous acid-catalysts for the production of furan-derived compounds (furfural and hydroxymethylfurfural) from renewable carbohydrates: a review Catal. Today 234 2014 42 58 I. Agirrezabal-Telleria, I. Gandarias, P. Arias, Heterogeneous acid-catalysts for the production of furan-derived compounds (furfural and hydroxymethylfurfural) from renewable carbohydrates: a review, Catal. Today234 (2014) 42–58. [36] D. Cai H. Chen C. Zhang X. Teng X. Li Z. Si G. Li S. Yang G. Wang P. Qin Carbonized core-shell diatomite for efficient catalytic furfural production from corn cob J. Clean. Prod. 283 2021 125410 125419 D. Cai, H. Chen, C. Zhang, X. Teng, X. Li, Z. Si, G. Li, S. Yang, G. Wang, P. Qin, Carbonized core-shell diatomite for efficient catalytic furfural production from corn cob, J. Clean. Prod.283 (2021) 125410–125419. [37] L. Ji Z. Tang D. Yang C. Ma Y. He Improved one-pot synthesis of furfural from corn stalk with heterogeneous catalysis using corn stakl as biobased carrier in deep eutectic solvent-water system Bioresour. Technol. 340 2021 125691 125698 L. Ji, Z. Tang, D. Yang, C. Ma, Y. He, Improved one-pot synthesis of furfural from corn stalk with heterogeneous catalysis using corn stakl as biobased carrier in deep eutectic solvent-water system, Bioresour. Technol.340 (2021) 125691–125698. [38] T. Yang W. Li A. Ogunbiyi S. An Efficient catalytic conversion of corn stover to furfural and 5-hydromethylfurfural using glucosamine hydrochloride derivd carbon solid acid in γ–valerolactone Ind. Crops Prod. 161 2021 113173 113182 T. Yang, W. Li, A. Ogunbiyi, S. An, Efficient catalytic conversion of corn stover to furfural and 5-hydromethylfurfural using glucosamine hydrochloride derivd carbon solid acid in γ–valerolactone, Ind. Crops Prod.161 (2021) 113173–113182.",
      "scopus-id": "85115972539",
      "coredata": {
        "eid": "1-s2.0-S246882312100537X",
        "dc:description": "A route of corn stover conversion was developed for 5-hydroxymethylfurfural (5-HMF) and furfural production by a novel Cl-containing resin-based solid acid catalyst (Cl0.3-S-R), which was synthetized by a simple hydrothermal method through polymerization reaction of o-chlorophenol and p-hydroxybenzenesulfonic with formaldehyde. The effects of catalyst types, reaction time, substrate types, solvent types, additional water concentrations and corn stover concentrations were investigated in detail. The high 5-HMF yield of 43.8% and furfural yield of 38.1% (based on the xylose and glucose units) could be achieved from corn stover simultaneously in water/1,4-dioxane at 190 °C in 80 min, with Cl0.3-S-R as catalyst. Furthermore, the catalysts were characterized by SEM, elemental analysis, FTIR, XPS and N2 adsorption-desorption to reveal its physical and chemical properties.",
        "openArchiveArticle": "false",
        "prism:coverDate": "2021-10-31",
        "openaccessUserLicense": null,
        "prism:aggregationType": "Journal",
        "prism:url": "https://api.elsevier.com/content/article/pii/S246882312100537X",
        "dc:creator": [
          {
            "@_fa": "true",
            "$": "Yang, Tao"
          },
          {
            "@_fa": "true",
            "$": "Chen, Dong"
          },
          {
            "@_fa": "true",
            "$": "Li, Wenzhi"
          },
          {
            "@_fa": "true",
            "$": "Zhang, Hao"
          }
        ],
        "link": [
          {
            "@_fa": "true",
            "@rel": "self",
            "@href": "https://api.elsevier.com/content/article/pii/S246882312100537X"
          },
          {
            "@_fa": "true",
            "@rel": "scidir",
            "@href": "https://www.sciencedirect.com/science/article/pii/S246882312100537X"
          }
        ],
        "dc:format": "application/json",
        "openaccessType": null,
        "pii": "S2468-8231(21)00537-X",
        "prism:volume": "515",
        "articleNumber": "111920",
        "prism:publisher": "Elsevier B.V.",
        "dc:title": "Efficient conversion of corn stover to 5-hydroxymethylfurfural and furfural using a novel acidic resin catalyst in water-1, 4-dioxane system",
        "prism:copyright": "© 2021 Elsevier B.V. All rights reserved.",
        "openaccess": "0",
        "prism:issn": "24688231",
        "dcterms:subject": [
          {
            "@_fa": "true",
            "$": "Corn stover"
          },
          {
            "@_fa": "true",
            "$": "5-HMF"
          },
          {
            "@_fa": "true",
            "$": "Furfural"
          },
          {
            "@_fa": "true",
            "$": "Acidic resin"
          },
          {
            "@_fa": "true",
            "$": "-Cl group"
          },
          {
            "@_fa": "true",
            "$": "-SO3H group"
          }
        ],
        "openaccessArticle": "false",
        "prism:publicationName": "Molecular Catalysis",
        "openaccessSponsorType": null,
        "prism:pageRange": "111920",
        "pubType": "fla",
        "prism:coverDisplayDate": "October 2021",
        "prism:doi": "10.1016/j.mcat.2021.111920",
        "prism:startingPage": "111920",
        "dc:identifier": "doi:10.1016/j.mcat.2021.111920",
        "openaccessSponsorName": null
      },
      "objects": {
        "object": [
          {
            "@category": "standard",
            "@height": "358",
            "@width": "527",
            "@_fa": "true",
            "$": "https://api.elsevier.com/content/object/eid/1-s2.0-S246882312100537X-sc1.jpg?httpAccept=%2A%2F%2A",
            "@multimediatype": "JPEG image file",
            "@type": "IMAGE-DOWNSAMPLED",
            "@size": "40188",
            "@ref": "sc1",
            "@mimetype": "image/jpeg"
          },
          {
            "@category": "standard",
            "@height": "30",
            "@width": "287",
            "@_fa": "true",
            "$": "https://api.elsevier.com/content/object/eid/1-s2.0-S246882312100537X-fx3.jpg?httpAccept=%2A%2F%2A",
            "@multimediatype": "JPEG image file",
            "@type": "IMAGE-DOWNSAMPLED",
            "@size": "5359",
            "@ref": "fx3",
            "@mimetype": "image/jpeg"
          },
          {
            "@category": "standard",
            "@height": "164",
            "@width": "404",
            "@_fa": "true",
            "$": "https://api.elsevier.com/content/object/eid/1-s2.0-S246882312100537X-fx2.jpg?httpAccept=%2A%2F%2A",
            "@multimediatype": "JPEG image file",
            "@type": "IMAGE-DOWNSAMPLED",
            "@size": "19406",
            "@ref": "fx2",
            "@mimetype": "image/jpeg"
          },
          {
            "@category": "standard",
            "@height": "290",
            "@width": "357",
            "@_fa": "true",
            "$": "https://api.elsevier.com/content/object/eid/1-s2.0-S246882312100537X-gr6.jpg?httpAccept=%2A%2F%2A",
            "@multimediatype": "JPEG image file",
            "@type": "IMAGE-DOWNSAMPLED",
            "@size": "43181",
            "@ref": "gr6",
            "@mimetype": "image/jpeg"
          },
          {
            "@category": "standard",
            "@height": "323",
            "@width": "791",
            "@_fa": "true",
            "$": "https://api.elsevier.com/content/object/eid/1-s2.0-S246882312100537X-gr5.jpg?httpAccept=%2A%2F%2A",
            "@multimediatype": "JPEG image file",
            "@type": "IMAGE-DOWNSAMPLED",
            "@size": "42597",
            "@ref": "gr5",
            "@mimetype": "image/jpeg"
          },
          {
            "@category": "standard",
            "@height": "322",
            "@width": "809",
            "@_fa": "true",
            "$": "https://api.elsevier.com/content/object/eid/1-s2.0-S246882312100537X-gr4.jpg?httpAccept=%2A%2F%2A",
            "@multimediatype": "JPEG image file",
            "@type": "IMAGE-DOWNSAMPLED",
            "@size": "49767",
            "@ref": "gr4",
            "@mimetype": "image/jpeg"
          },
          {
            "@category": "standard",
            "@height": "298",
            "@width": "386",
            "@_fa": "true",
            "$": "https://api.elsevier.com/content/object/eid/1-s2.0-S246882312100537X-gr3.jpg?httpAccept=%2A%2F%2A",
            "@multimediatype": "JPEG image file",
            "@type": "IMAGE-DOWNSAMPLED",
            "@size": "42238",
            "@ref": "gr3",
            "@mimetype": "image/jpeg"
          },
          {
            "@category": "standard",
            "@height": "307",
            "@width": "376",
            "@_fa": "true",
            "$": "https://api.elsevier.com/content/object/eid/1-s2.0-S246882312100537X-gr2.jpg?httpAccept=%2A%2F%2A",
            "@multimediatype": "JPEG image file",
            "@type": "IMAGE-DOWNSAMPLED",
            "@size": "34086",
            "@ref": "gr2",
            "@mimetype": "image/jpeg"
          },
          {
            "@category": "standard",
            "@height": "97",
            "@width": "301",
            "@_fa": "true",
            "$": "https://api.elsevier.com/content/object/eid/1-s2.0-S246882312100537X-ga1.jpg?httpAccept=%2A%2F%2A",
            "@multimediatype": "JPEG image file",
            "@type": "IMAGE-DOWNSAMPLED",
            "@size": "12331",
            "@ref": "ga1",
            "@mimetype": "image/jpeg"
          },
          {
            "@category": "standard",
            "@height": "604",
            "@width": "809",
            "@_fa": "true",
            "$": "https://api.elsevier.com/content/object/eid/1-s2.0-S246882312100537X-gr1.jpg?httpAccept=%2A%2F%2A",
            "@multimediatype": "JPEG image file",
            "@type": "IMAGE-DOWNSAMPLED",
            "@size": "186776",
            "@ref": "gr1",
            "@mimetype": "image/jpeg"
          },
          {
            "@category": "thumbnail",
            "@height": "149",
            "@width": "219",
            "@_fa": "true",
            "$": "https://api.elsevier.com/content/object/eid/1-s2.0-S246882312100537X-sc1.sml?httpAccept=%2A%2F%2A",
            "@multimediatype": "GIF image file",
            "@type": "IMAGE-THUMBNAIL",
            "@size": "9333",
            "@ref": "sc1",
            "@mimetype": "image/gif"
          },
          {
            "@category": "thumbnail",
            "@height": "23",
            "@width": "219",
            "@_fa": "true",
            "$": "https://api.elsevier.com/content/object/eid/1-s2.0-S246882312100537X-fx3.sml?httpAccept=%2A%2F%2A",
            "@multimediatype": "GIF image file",
            "@type": "IMAGE-THUMBNAIL",
            "@size": "2809",
            "@ref": "fx3",
            "@mimetype": "image/gif"
          },
          {
            "@category": "thumbnail",
            "@height": "89",
            "@width": "219",
            "@_fa": "true",
            "$": "https://api.elsevier.com/content/object/eid/1-s2.0-S246882312100537X-fx2.sml?httpAccept=%2A%2F%2A",
            "@multimediatype": "GIF image file",
            "@type": "IMAGE-THUMBNAIL",
            "@size": "5057",
            "@ref": "fx2",
            "@mimetype": "image/gif"
          },
          {
            "@category": "thumbnail",
            "@height": "164",
            "@width": "202",
            "@_fa": "true",
            "$": "https://api.elsevier.com/content/object/eid/1-s2.0-S246882312100537X-gr6.sml?httpAccept=%2A%2F%2A",
            "@multimediatype": "GIF image file",
            "@type": "IMAGE-THUMBNAIL",
            "@size": "19499",
            "@ref": "gr6",
            "@mimetype": "image/gif"
          },
          {
            "@category": "thumbnail",
            "@height": "89",
            "@width": "219",
            "@_fa": "true",
            "$": "https://api.elsevier.com/content/object/eid/1-s2.0-S246882312100537X-gr5.sml?httpAccept=%2A%2F%2A",
            "@multimediatype": "GIF image file",
            "@type": "IMAGE-THUMBNAIL",
            "@size": "6495",
            "@ref": "gr5",
            "@mimetype": "image/gif"
          },
          {
            "@category": "thumbnail",
            "@height": "87",
            "@width": "219",
            "@_fa": "true",
            "$": "https://api.elsevier.com/content/object/eid/1-s2.0-S246882312100537X-gr4.sml?httpAccept=%2A%2F%2A",
            "@multimediatype": "GIF image file",
            "@type": "IMAGE-THUMBNAIL",
            "@size": "6663",
            "@ref": "gr4",
            "@mimetype": "image/gif"
          },
          {
            "@category": "thumbnail",
            "@height": "164",
            "@width": "212",
            "@_fa": "true",
            "$": "https://api.elsevier.com/content/object/eid/1-s2.0-S246882312100537X-gr3.sml?httpAccept=%2A%2F%2A",
            "@multimediatype": "GIF image file",
            "@type": "IMAGE-THUMBNAIL",
            "@size": "12250",
            "@ref": "gr3",
            "@mimetype": "image/gif"
          },
          {
            "@category": "thumbnail",
            "@height": "164",
            "@width": "201",
            "@_fa": "true",
            "$": "https://api.elsevier.com/content/object/eid/1-s2.0-S246882312100537X-gr2.sml?httpAccept=%2A%2F%2A",
            "@multimediatype": "GIF image file",
            "@type": "IMAGE-THUMBNAIL",
            "@size": "10497",
            "@ref": "gr2",
            "@mimetype": "image/gif"
          },
          {
            "@category": "thumbnail",
            "@height": "71",
            "@width": "219",
            "@_fa": "true",
            "$": "https://api.elsevier.com/content/object/eid/1-s2.0-S246882312100537X-ga1.sml?httpAccept=%2A%2F%2A",
            "@multimediatype": "GIF image file",
            "@type": "IMAGE-THUMBNAIL",
            "@size": "7484",
            "@ref": "ga1",
            "@mimetype": "image/gif"
          },
          {
            "@category": "thumbnail",
            "@height": "164",
            "@width": "219",
            "@_fa": "true",
            "$": "https://api.elsevier.com/content/object/eid/1-s2.0-S246882312100537X-gr1.sml?httpAccept=%2A%2F%2A",
            "@multimediatype": "GIF image file",
            "@type": "IMAGE-THUMBNAIL",
            "@size": "31316",
            "@ref": "gr1",
            "@mimetype": "image/gif"
          },
          {
            "@category": "high",
            "@height": "1587",
            "@width": "2333",
            "@_fa": "true",
            "$": "https://api.elsevier.com/content/object/eid/1-s2.0-S246882312100537X-sc1_lrg.jpg?httpAccept=%2A%2F%2A",
            "@multimediatype": "JPEG image file",
            "@type": "IMAGE-HIGH-RES",
            "@size": "284665",
            "@ref": "sc1",
            "@mimetype": "image/jpeg"
          },
          {
            "@category": "high",
            "@height": "131",
            "@width": "1270",
            "@_fa": "true",
            "$": "https://api.elsevier.com/content/object/eid/1-s2.0-S246882312100537X-fx3_lrg.jpg?httpAccept=%2A%2F%2A",
            "@multimediatype": "JPEG image file",
            "@type": "IMAGE-HIGH-RES",
            "@size": "41580",
            "@ref": "fx3",
            "@mimetype": "image/jpeg"
          },
          {
            "@category": "high",
            "@height": "725",
            "@width": "1791",
            "@_fa": "true",
            "$": "https://api.elsevier.com/content/object/eid/1-s2.0-S246882312100537X-fx2_lrg.jpg?httpAccept=%2A%2F%2A",
            "@multimediatype": "JPEG image file",
            "@type": "IMAGE-HIGH-RES",
            "@size": "172957",
            "@ref": "fx2",
            "@mimetype": "image/jpeg"
          },
          {
            "@category": "high",
            "@height": "1286",
            "@width": "1583",
            "@_fa": "true",
            "$": "https://api.elsevier.com/content/object/eid/1-s2.0-S246882312100537X-gr6_lrg.jpg?httpAccept=%2A%2F%2A",
            "@multimediatype": "JPEG image file",
            "@type": "IMAGE-HIGH-RES",
            "@size": "784502",
            "@ref": "gr6",
            "@mimetype": "image/jpeg"
          },
          {
            "@category": "high",
            "@height": "1430",
            "@width": "3500",
            "@_fa": "true",
            "$": "https://api.elsevier.com/content/object/eid/1-s2.0-S246882312100537X-gr5_lrg.jpg?httpAccept=%2A%2F%2A",
            "@multimediatype": "JPEG image file",
            "@type": "IMAGE-HIGH-RES",
            "@size": "302552",
            "@ref": "gr5",
            "@mimetype": "image/jpeg"
          },
          {
            "@category": "high",
            "@height": "1426",
            "@width": "3583",
            "@_fa": "true",
            "$": "https://api.elsevier.com/content/object/eid/1-s2.0-S246882312100537X-gr4_lrg.jpg?httpAccept=%2A%2F%2A",
            "@multimediatype": "JPEG image file",
            "@type": "IMAGE-HIGH-RES",
            "@size": "353605",
            "@ref": "gr4",
            "@mimetype": "image/jpeg"
          },
          {
            "@category": "high",
            "@height": "1321",
            "@width": "1709",
            "@_fa": "true",
            "$": "https://api.elsevier.com/content/object/eid/1-s2.0-S246882312100537X-gr3_lrg.jpg?httpAccept=%2A%2F%2A",
            "@multimediatype": "JPEG image file",
            "@type": "IMAGE-HIGH-RES",
            "@size": "290765",
            "@ref": "gr3",
            "@mimetype": "image/jpeg"
          },
          {
            "@category": "high",
            "@height": "1360",
            "@width": "1667",
            "@_fa": "true",
            "$": "https://api.elsevier.com/content/object/eid/1-s2.0-S246882312100537X-gr2_lrg.jpg?httpAccept=%2A%2F%2A",
            "@multimediatype": "JPEG image file",
            "@type": "IMAGE-HIGH-RES",
            "@size": "235073",
            "@ref": "gr2",
            "@mimetype": "image/jpeg"
          },
          {
            "@category": "high",
            "@height": "431",
            "@width": "1333",
            "@_fa": "true",
            "$": "https://api.elsevier.com/content/object/eid/1-s2.0-S246882312100537X-ga1_lrg.jpg?httpAccept=%2A%2F%2A",
            "@multimediatype": "JPEG image file",
            "@type": "IMAGE-HIGH-RES",
            "@size": "89389",
            "@ref": "ga1",
            "@mimetype": "image/jpeg"
          },
          {
            "@category": "high",
            "@height": "2677",
            "@width": "3583",
            "@_fa": "true",
            "$": "https://api.elsevier.com/content/object/eid/1-s2.0-S246882312100537X-gr1_lrg.jpg?httpAccept=%2A%2F%2A",
            "@multimediatype": "JPEG image file",
            "@type": "IMAGE-HIGH-RES",
            "@size": "1782421",
            "@ref": "gr1",
            "@mimetype": "image/jpeg"
          },
          {
            "@category": "standard",
            "@_fa": "true",
            "$": "https://api.elsevier.com/content/object/eid/1-s2.0-S246882312100537X-mmc1.docx?httpAccept=%2A%2F%2A",
            "@multimediatype": "Microsoft Word file",
            "@type": "APPLICATION",
            "@size": "567097",
            "@ref": "mmc1",
            "@mimetype": "application/word"
          },
          {
            "@category": "standard",
            "@_fa": "true",
            "$": "https://api.elsevier.com/content/object/eid/1-s2.0-S246882312100537X-am.pdf?httpAccept=%2A%2F%2A",
            "@multimediatype": "Acrobat PDF file",
            "@type": "AAM-PDF",
            "@size": "1587407",
            "@ref": "am",
            "@mimetype": "application/pdf"
          }
        ]
      },
      "link": {
        "@rel": "abstract",
        "@href": "https://api.elsevier.com/content/abstract/scopus_id/85115972539"
      }
    }
  }
}