{
  "metadata": {
    "title": "Direct conversion of furfuryl alcohol to butyl levulinate using tin exchanged tungstophosphoric acid catalysts",
    "authors": "; ; ",
    "journal": "Molecular Catalysis",
    "date": "2020-06-30",
    "doi": "10.1016/j.mcat.2020.110918",
    "abstract": "",
    "uri": "https://api.elsevier.com/content/article/pii/S2468823120301723",
    "pii": "S2468823120301723"
  },
  "fulltext": {
    "full-text-retrieval-response": {
      "scopus-eid": "2-s2.0-85082739737",
      "originalText": "serial JL 315758 291210 291744 291790 291809 31 Molecular Catalysis MOLECULARCATALYSIS 2020-04-06 2020-04-06 2020-04-06 2020-04-06 2020-05-23T15:56:08 1-s2.0-S2468823120301723 S2468-8231(20)30172-3 S2468823120301723 10.1016/j.mcat.2020.110918 S300 S300.2 FULL-TEXT 1-s2.0-S2468823120X00071 2022-06-21T08:42:27.495436Z 0 0 20200601 20200630 2020 2020-04-06T17:31:53.86252Z absattachment articleinfo articlenumber articletitlenorm authfirstinitialnorm authfirstsurnamenorm cid cids contenttype copyright crossmark dateloaded dateloadedtxt datesearch datesort dateupdated dco docsubtype doctype doi eid ewtransactionid hubeid indexeddate issn issnnorm itemstage itemtransactionid itemweight openaccess openarchive pg pgfirst pii piinorm pubdateend pubdatestart pubdatetxt pubyr sectiontitle sortorder srctitle srctitlenorm srctype ssids alllist content subj subheadings suppl tomb volfirst volissue volumelist webpdf webpdfpagecount yearnav figure table body acknowledge affil articletitle auth authfirstini authfull authkeywords authlast grantsponsor highlightsabst nomenclature orcid primabst ref specialabst 2468-8231 24688231 true 488 488 C Volume 488 14 110918 110918 110918 202006 June 2020 2020-06-01 2020-06-30 2020 Regular Papers article fla © 2020 Elsevier B.V. All rights reserved. DIRECTCONVERSIONFURFURYLALCOHOLBUTYLLEVULINATEUSINGTINEXCHANGEDTUNGSTOPHOSPHORICACIDCATALYSTS TIWARI M Nomenclature 1 Introduction 2 Experimental section 2.1 Chemicals 2.2 Preparation of catalyst 2.3 Catalyst characterization 2.4 Reaction procedure 3 Results and discussion 3.1 Catalyst characterization 3.1.1 X-ray diffraction spectroscopy 3.1.2 Fourier-transform infrared spectroscopy (FT-IR) 3.1.3 UV-VIS spectroscopy 3.1.4 SEM 3.2 Efficacy of different solid acid catalysts 3.3 Optimization of reaction parameters 3.3.1 Effect of catalyst loading 3.3.2 Effect of mole ratio 3.3.3 Effect of temperature 3.4 Comparison with solid acid catalysts 3.5 Catalyst reusability and heterogeneity 4 Conclusions Disclaimer CRediT authorship contribution statement Acknowledgments References AHMAD 2016 4804 4823 E NANDIWALE 2017 1 7 K HPWANCHOREDMESOHZ5ANOVELCATALYSTFORSELECTIVESYNTHESISETHYLLEVULINATEBIOFUELBYALCOHOLYSISBIOMASSDERIVEDFURFURYLALCOHOL00 CHEN 2017 145 149 Y MOLLETI 2018 2488 2499 J ENUMULA 2017 644 651 S REDDY 2018 R GAWADE 2016 4113 4123 A CUI 2015 3084 3089 J HUANG 2016 1516 1523 Y TIWARI 2017 963 976 M WANG 2020 110630 Y ZHAO 2018 6901 6909 D SIVA 2017 2807 2816 E RAO 2017 80 86 B CARA 2014 835 840 P ENHANCEDHETEROGENEOUSCATALYTICCONVERSIONFURFURYLALCOHOLBUTYLLEVULINATE OUYANG 2018 6746 6752 W ZHAO 2019 110456 D DHARNE 2011 18 24 S HENGNE 2013 2540 A NEVES 2013 3367 P WANG 2014 1436 1443 G ZHANG 2011 112 118 Z BRINGUE 2019 116010 R ALLOHEDAN 2017 55206 55214 H TIWARI 2015 64 73 M YADAV 2003 85 96 G MANYAR 2006 244 252 H DOHERTY 2012 925 S TIWARI 2016 49091 49100 M ARMATAS 2011 2997 G KUMAR 2012 1360 1367 C SHIMIZU 2008 980 983 K TIWARI 2017 12909 12919 M NOVELBIFUNCTIONALPALLADIUMDODECATUNGSTOPHOSPHORICACIDSUPPORTEDTITANIANANOTUBESONEPOTSYNTHESISNPENTYLTETRAHYDROFURFURYLETHERFURFURYLALCOHOLNPENTANOL RAMESHKUMAR 2011 17 24 C DENDEOLIVEIRA 2019 1431 A DACONCEICAO 2017 119 128 L WANG 2015 2455 2463 F GARADE 2010 164 170 A AYOUB 2013 22 25 M VARADWAJ 2014 7526 G TIWARI 2015 M TIWARI 2016 M MOHAMMADBAGHERI 2018 401 408 Z BABA 1983 2406 2411 T BANERJEE 2016 1043 1058 S LAZARIDIS 2003 2875 2882 N DECHAMP 1995 29 34 N APPATURI 2017 55206 55214 J TIWARIX2020X110918 TIWARIX2020X110918XM 2022-04-06T00:00:00.000Z 2022-04-06T00:00:00.000Z http://creativecommons.org/licenses/by-nc-nd/4.0/ © 2020 Elsevier B.V. All rights reserved. 2022-06-10T20:19:40.506Z http://vtw.elsevier.com/data/voc/AddOnTypes/50.7/aggregated-refined SEUPB Department for the Economy DfE Department for the Economy http://data.elsevier.com/vocabulary/SciValFunders/100016337 http://sws.geonames.org/2635167/ EU Programmes Body Invest Northern Ireland Competence Centre The authors gratefully acknowledge the financial support from the Invest Northern Ireland Competence Centre programme under the “Centre for Advanced Sustainable Energy” (CASE) project R3947CCE for postdoctoral funding for MT, Department for the Economy (DfE) for PhD studentship to JD and “The Bryden centre for advanced marine and bio-energy research” project for PhD studentship to JK . The Bryden Centre project is supported by the European Union’s INTERREG VA Programme, managed by the Special EU Programmes Body (SEUPB) . item S2468-8231(20)30172-3 S2468823120301723 1-s2.0-S2468823120301723 10.1016/j.mcat.2020.110918 315758 2020-06-06T08:24:18.896764Z 2020-06-01 2020-06-30 1-s2.0-S2468823120301723-main.pdf https://s3-eu-west-1.amazonaws.com/prod-ucs-content-store-eu-west/content/pii:S2468823120301723/MAIN/application/pdf/7d91cb954c273d769ce9a0d05129c38d/main.pdf main.pdf pdf true 4479138 MAIN 9 1-s2.0-S2468823120301723-main_1.png https://s3-eu-west-1.amazonaws.com/prod-ucs-content-store-eu-west/content/pii:S2468823120301723/PREVIEW/image/png/14ead4338efea19f8a9754e12dec0ff5/main_1.png main_1.png png 53659 849 656 IMAGE-WEB-PDF 1 1-s2.0-S2468823120301723-fx1.jpg https://s3-eu-west-1.amazonaws.com/prod-ucs-content-store-eu-west/content/pii:S2468823120301723/fx1/DOWNSAMPLED/image/jpeg/8f9a55049391477bb16168d76b51798a/fx1.jpg fx1 fx1.jpg jpg 397 9 9 IMAGE-DOWNSAMPLED 1-s2.0-S2468823120301723-fx1.sml https://s3-eu-west-1.amazonaws.com/prod-ucs-content-store-eu-west/content/pii:S2468823120301723/fx1/THUMBNAIL/image/gif/440d8fb59fafa6e04072ee65bca711b3/fx1.sml fx1 fx1.sml sml 1864 42 42 IMAGE-THUMBNAIL 1-s2.0-S2468823120301723-fx2.jpg https://s3-eu-west-1.amazonaws.com/prod-ucs-content-store-eu-west/content/pii:S2468823120301723/fx2/DOWNSAMPLED/image/jpeg/1796fffcaa6529886480ee842768ed67/fx2.jpg fx2 fx2.jpg jpg 398 9 9 IMAGE-DOWNSAMPLED 1-s2.0-S2468823120301723-fx2.sml https://s3-eu-west-1.amazonaws.com/prod-ucs-content-store-eu-west/content/pii:S2468823120301723/fx2/THUMBNAIL/image/gif/d48c8aa47535a4ce350e05d3d8b69b84/fx2.sml fx2 fx2.sml sml 1916 42 41 IMAGE-THUMBNAIL 1-s2.0-S2468823120301723-fx3.jpg https://s3-eu-west-1.amazonaws.com/prod-ucs-content-store-eu-west/content/pii:S2468823120301723/fx3/DOWNSAMPLED/image/jpeg/b156e92dcc1d86a7a7023065853b22d4/fx3.jpg fx3 fx3.jpg jpg 344 9 9 IMAGE-DOWNSAMPLED 1-s2.0-S2468823120301723-fx3.sml https://s3-eu-west-1.amazonaws.com/prod-ucs-content-store-eu-west/content/pii:S2468823120301723/fx3/THUMBNAIL/image/gif/132697d820975f3e6afb9ee246fcc568/fx3.sml fx3 fx3.sml sml 902 41 42 IMAGE-THUMBNAIL 1-s2.0-S2468823120301723-fx4.jpg https://s3-eu-west-1.amazonaws.com/prod-ucs-content-store-eu-west/content/pii:S2468823120301723/fx4/DOWNSAMPLED/image/jpeg/231a4a04bd619ce6e56277e52e1ac20a/fx4.jpg fx4 fx4.jpg jpg 398 9 9 IMAGE-DOWNSAMPLED 1-s2.0-S2468823120301723-fx4.sml https://s3-eu-west-1.amazonaws.com/prod-ucs-content-store-eu-west/content/pii:S2468823120301723/fx4/THUMBNAIL/image/gif/039283180e655eaffa30e327cd0b0e7b/fx4.sml fx4 fx4.sml sml 1681 41 40 IMAGE-THUMBNAIL 1-s2.0-S2468823120301723-ga1.jpg https://s3-eu-west-1.amazonaws.com/prod-ucs-content-store-eu-west/content/pii:S2468823120301723/ga1/DOWNSAMPLED/image/jpeg/d655579691f01f26e4408ecdde465313/ga1.jpg ga1 true ga1.jpg jpg 29198 200 346 IMAGE-DOWNSAMPLED 1-s2.0-S2468823120301723-ga1.sml https://s3-eu-west-1.amazonaws.com/prod-ucs-content-store-eu-west/content/pii:S2468823120301723/ga1/THUMBNAIL/image/gif/4f1c6223d3c388989d84f18487d49c70/ga1.sml ga1 true ga1.sml sml 14107 127 219 IMAGE-THUMBNAIL 1-s2.0-S2468823120301723-gr1.jpg https://s3-eu-west-1.amazonaws.com/prod-ucs-content-store-eu-west/content/pii:S2468823120301723/gr1/DOWNSAMPLED/image/jpeg/0c7ef7bbab07d99deebbb317c01c64f4/gr1.jpg gr1 gr1.jpg jpg 72316 450 753 IMAGE-DOWNSAMPLED 1-s2.0-S2468823120301723-gr1.sml https://s3-eu-west-1.amazonaws.com/prod-ucs-content-store-eu-west/content/pii:S2468823120301723/gr1/THUMBNAIL/image/gif/8fbc3b16f3b090f6f238d91a9def62a6/gr1.sml gr1 gr1.sml sml 9263 131 219 IMAGE-THUMBNAIL 1-s2.0-S2468823120301723-gr2.jpg https://s3-eu-west-1.amazonaws.com/prod-ucs-content-store-eu-west/content/pii:S2468823120301723/gr2/DOWNSAMPLED/image/jpeg/f65c52c1cee56142c54dc8bb38a7578b/gr2.jpg gr2 gr2.jpg jpg 28460 353 376 IMAGE-DOWNSAMPLED 1-s2.0-S2468823120301723-gr2.sml https://s3-eu-west-1.amazonaws.com/prod-ucs-content-store-eu-west/content/pii:S2468823120301723/gr2/THUMBNAIL/image/gif/67faa7dd71f9496285e83b1f62b90653/gr2.sml gr2 gr2.sml sml 6872 163 174 IMAGE-THUMBNAIL 1-s2.0-S2468823120301723-gr3.jpg https://s3-eu-west-1.amazonaws.com/prod-ucs-content-store-eu-west/content/pii:S2468823120301723/gr3/DOWNSAMPLED/image/jpeg/6203f30415dfd3c40f583b99dd01c1a5/gr3.jpg gr3 gr3.jpg jpg 15087 258 375 IMAGE-DOWNSAMPLED 1-s2.0-S2468823120301723-gr3.sml https://s3-eu-west-1.amazonaws.com/prod-ucs-content-store-eu-west/content/pii:S2468823120301723/gr3/THUMBNAIL/image/gif/30c7b3f8e17d28037e4f827ef9738b74/gr3.sml gr3 gr3.sml sml 5349 151 219 IMAGE-THUMBNAIL 1-s2.0-S2468823120301723-gr4.jpg https://s3-eu-west-1.amazonaws.com/prod-ucs-content-store-eu-west/content/pii:S2468823120301723/gr4/DOWNSAMPLED/image/jpeg/2125c88c8de048ec47ad5c94f50e94fc/gr4.jpg gr4 gr4.jpg jpg 126142 718 678 IMAGE-DOWNSAMPLED 1-s2.0-S2468823120301723-gr4.sml https://s3-eu-west-1.amazonaws.com/prod-ucs-content-store-eu-west/content/pii:S2468823120301723/gr4/THUMBNAIL/image/gif/b78e25d30bad255b8934e2dd396d0a2d/gr4.sml gr4 gr4.sml sml 14107 164 155 IMAGE-THUMBNAIL 1-s2.0-S2468823120301723-gr5.jpg https://s3-eu-west-1.amazonaws.com/prod-ucs-content-store-eu-west/content/pii:S2468823120301723/gr5/DOWNSAMPLED/image/jpeg/02d61605cd42696b896f0e4345dccf17/gr5.jpg gr5 gr5.jpg jpg 30313 300 678 IMAGE-DOWNSAMPLED 1-s2.0-S2468823120301723-gr5.sml https://s3-eu-west-1.amazonaws.com/prod-ucs-content-store-eu-west/content/pii:S2468823120301723/gr5/THUMBNAIL/image/gif/497dea1cf161f499655a8bf2a6961f3e/gr5.sml gr5 gr5.sml sml 3916 97 219 IMAGE-THUMBNAIL 1-s2.0-S2468823120301723-gr6.jpg https://s3-eu-west-1.amazonaws.com/prod-ucs-content-store-eu-west/content/pii:S2468823120301723/gr6/DOWNSAMPLED/image/jpeg/175a419500892424f96fe495d7b93f7b/gr6.jpg gr6 gr6.jpg jpg 31056 304 678 IMAGE-DOWNSAMPLED 1-s2.0-S2468823120301723-gr6.sml https://s3-eu-west-1.amazonaws.com/prod-ucs-content-store-eu-west/content/pii:S2468823120301723/gr6/THUMBNAIL/image/gif/48d4801c20cd324ee5e46bdd72422646/gr6.sml gr6 gr6.sml sml 4137 98 219 IMAGE-THUMBNAIL 1-s2.0-S2468823120301723-gr7.jpg https://s3-eu-west-1.amazonaws.com/prod-ucs-content-store-eu-west/content/pii:S2468823120301723/gr7/DOWNSAMPLED/image/jpeg/2bfeeed453ea93c9afc0087354676777/gr7.jpg gr7 gr7.jpg jpg 29155 308 678 IMAGE-DOWNSAMPLED 1-s2.0-S2468823120301723-gr7.sml https://s3-eu-west-1.amazonaws.com/prod-ucs-content-store-eu-west/content/pii:S2468823120301723/gr7/THUMBNAIL/image/gif/8516da84b81a0b18d115ea27f71c54a4/gr7.sml gr7 gr7.sml sml 3817 100 219 IMAGE-THUMBNAIL 1-s2.0-S2468823120301723-gr8.jpg https://s3-eu-west-1.amazonaws.com/prod-ucs-content-store-eu-west/content/pii:S2468823120301723/gr8/DOWNSAMPLED/image/jpeg/2a9d119b7ccfab61fc8cb491ccce82f5/gr8.jpg gr8 gr8.jpg jpg 26739 275 678 IMAGE-DOWNSAMPLED 1-s2.0-S2468823120301723-gr8.sml https://s3-eu-west-1.amazonaws.com/prod-ucs-content-store-eu-west/content/pii:S2468823120301723/gr8/THUMBNAIL/image/gif/3aa04f3609e018a79fe27a3aed598390/gr8.sml gr8 gr8.sml sml 4181 89 219 IMAGE-THUMBNAIL 1-s2.0-S2468823120301723-sc1.jpg https://s3-eu-west-1.amazonaws.com/prod-ucs-content-store-eu-west/content/pii:S2468823120301723/sc1/DOWNSAMPLED/image/jpeg/2af4adeaca8f7f768746b2398e648e2b/sc1.jpg sc1 sc1.jpg jpg 28575 324 753 IMAGE-DOWNSAMPLED 1-s2.0-S2468823120301723-sc1.sml https://s3-eu-west-1.amazonaws.com/prod-ucs-content-store-eu-west/content/pii:S2468823120301723/sc1/THUMBNAIL/image/gif/37a18d77d6cbe77f001dba6cad4b4be1/sc1.sml sc1 sc1.sml sml 3224 94 219 IMAGE-THUMBNAIL 1-s2.0-S2468823120301723-am.pdf am am.pdf pdf 1660220 AAM-PDF https://s3-eu-west-1.amazonaws.com/prod-ucs-content-store-eu-west/content/egi:106GC3514JT/MAIN/application/pdf/054c915bb3de79ec22b453872f19c280/am.pdf MCAT 110918 110918 S2468-8231(20)30172-3 10.1016/j.mcat.2020.110918 Elsevier B.V. Fig. 1 X-ray diffraction patterns of different catalysts (a) K-10 clay, (b) TPA/K-10,(c) Sn0.5-TPA/K-10 (d) Sn1-TPA/K-10 (e) Sn1.5-TPA/K-10 (f) reused Sn1-TPA/K-10. Insight figure i) TPA, ii) Unsupported Sn1-TPA. Fig. 1 Fig. 2 FT-IR spectra of catalysts (a) TPA, (b) K-10 clay, (c) TPA/K-10, (d) Sn0.5-TPA/K-10, (e) Sn1-TPA/K-10, (f) Sn1.5-TPA/K-10, and (g) reused Sn1-TPA/K-10. Fig. 2 Fig. 3 UV-VI S of catalysts (a) TPA, (b) Sn1-TPA/K-10 (c) K-10 clay. Fig. 3 Fig. 4 SEM images of fresh and recovered catalysts (a, b) 20 % w/w Sn1-TPA/K-10, (c, d) reused 20 % w/w Sn1-TPA/K-10. Fig. 4 Fig. 5 Effect of catalyst loading on the (a) % yield of BL, ( ) 0.3 mol%, ( ) 0.6 mol%, ( ) 0.9 mol%, ( ) 1.2 mol%, (b) initial rate of BL formation. Reaction conditions: FAL 2.3 mmol, 1-butanol 45.9 mmol, 20 % w/w Sn1-TPA/K-10 catalyst, temperature 110 °C, speed of agitation 1000 rpm, reaction time 300 min. Fig. 5 Fig. 6 Effect of mole ratio of FAL to 1-butanol on the (a) % yield of BL, ( ) 1:5, ( ) 1:10, ( ) 1:15, ( ) 1:20, (b) initial rate of BL formation. Reaction conditions: FAL, 1-butanol, 20 % w/w Sn1-TPA/K-10 catalyst 1.2 mol%, reaction temperature 110 °C, speed of agitation 1000 rpm, reaction time 300 min. Fig. 6 Fig. 7 Effect of temperature on the (a) % yield of BL, ( ) 90 °C, ( ) 100 °C, ( ) 110 °C, ( ) 120 °C, (b) Arrhenius dependence of BL formation. Reaction conditions: FAL 2.3 mmol, 1-butanol 45.9 mmol, 20 % w/w Sn1-TPA/K-10 catalyst 1.2 mol%, speed of agitation 1000 rpm, reaction time 300 min. Fig. 7 Fig. 8 (a) Effect of catalyst reusability on the % yield of BL, (b) Evaluation of stability of 20 % w/w Sn1-TPA on K-10. Reaction conditions: FAL 2.3 mmol, 1-butanol 45.9 mmol, 20 % w/w Sn1-TPA/K-10 catalyst 1.2 mol%, speed of agitation 1000 rpm, reaction temperature 110 °C, reaction time 300 min. Fig. 8 Scheme 1 Synthesis of BL from Furfuryl alcohol. Scheme 1 Table 1 Effect of various catalysts on conversion of furfuryl alcohol and yield of butyl levulinate. Table 1 Entry Catalyst Acidity (mmol g−1) FAL Conversion (%) BL Yield (%) 1 Bentonite clay 0.24 60 1.2 2 Montmorillonite K-10 clay 0.82 100 23.2 3 20 % w/w TPA/K-10 1.45 100 42.4 4 20 % w/w Sn0.5-TPA/K-10 1.85 100 52.6 5 20 % w/w Sn1-TPA/K-10 2.21 100 72.6 6 20 % w/w Sn1.5-TPA/K-10 1.25 100 36.6 Reaction conditions: FAL 2.3 mmol, 1-butanol 45.9 mmol, catalyst 0.9 mol%, temperature 110 °C, speed of agitation 1000 rpm, reaction time 150 min. Table 2 Comparison of different solid acid catalysts for BL synthesis after 3 h. Table 2 No. Mole ratio Catalyst Cat. Amt. T (°C) X (%) Y (%) Ref 1 1:65 Zn1TPA/Nb2O5 0.3 g 110 100 91 [14] 2 1:33 SBA-15-SO3H 0.5g 110 100 92 [15] 3 1:60 100Ti-KIT-6 0.3g 110 90 72 [49] 4 1:65 25TS/SBA-16 0.3g 110 100 97 [13] 5 1:8 Amberlyst 39 1g 110 99 52 [23] 6 1:15 KCC-1/Pr-SO3H 0.1 g 120 99 81.9 [44] 7 1:48 [MIMBS]3PW12O40 0.2 g 110 99 78 [22] 8 1:48 h-Y Zeolite 0.03 g 110 100 N.R. [22] 9 1:33 HZSM-5 0.05g 110 100 33 [15] 10 1:65 20Al2O3/SBA-15 0.4 g 110 100 60 [5] 11 1:20 Sn1TPA/K-10 0.4 g 120 100 97.5 This work X = % conversion of FAL, Y = %Yield of BL after 3 h, N.R.= not reported. Direct conversion of furfuryl alcohol to butyl levulinate using tin exchanged tungstophosphoric acid catalysts Manishkumar S. Tiwari Investigation Methodology Writing - original draft a b Jennifer Sarah Dicks Investigation a John Keogh Investigation a Vivek V. Ranade Writing - review & editing Funding acquisition a Haresh G. Manyar Conceptualization Supervision Writing - review & editing Funding acquisition a * a Theoretical and Applied Catalysis Research Cluster, School of Chemistry and Chemical Engineering, Queen’s University Belfast, David-Keir Building, Stranmillis Road, Belfast, BT9 5AG, UK Theoretical and Applied Catalysis Research Cluster School of Chemistry and Chemical Engineering Queen’s University Belfast David-Keir Building Stranmillis Road Belfast BT9 5AG UK Theoretical and Applied Catalysis Research Cluster, School of Chemistry and Chemical Engineering, Queen’s University Belfast, David-Keir Building, Stranmillis Road, Belfast BT9 5AG, UK b Department of Chemical Engineering, Mukesh Patel School of Technology Management and Engineering, SVKM’s NMIMS University, Mumbai, 400065, India Department of Chemical Engineering Mukesh Patel School of Technology Management and Engineering SVKM’s NMIMS University Mumbai 400065 India Department of Chemical Engineering, Mukesh Patel School of Technology Management and Engineering, SVKM’s NMIMS University, Mumbai 400065 ⁎ Corresponding author. Graphical abstract To decrease the dependence on crude oil, biomass derived liquid transportation fuels are highly desirable. Butyl levulinate is a potential cellulose-derived biofuel additive with properties similar to diesel and low water solubility. Herein we report a direct one-pot production of levulinic acid ester, butyl levulinate, from furfuryl alcohol by alcoholysis using n-butanol. The partial tin exchanged tungstophosphoric acid (TPA) supported on montmorillonite K-10 catalysts showed facile alcoholysis of furfuryl alcohol to levulinate ester under mild temperature conditions. Partially exchanging the H+ ion of TPA with Sn (x = 1) resulted in enhanced acidity of the catalyst and showed an increase in the catalytic activity as compared to TPA/K-10 catalyst. A series of tin exchanged tungstophosphoric acid (20 % w/w) supported on montmorillonite K-10 clay (Snx-TPA/K-10, where x = 0.5–1.5) were synthesized and thoroughly characterized by using XRD, FT-IR, UV-VIS, titration and SEM techniques. Among various catalysts, Sn1- TPA/K-10 was found to be the most active catalyst for butyl levulinate synthesis. Two different clay supports and varying tin loadings were used to study the effects on surface acidity as well as catalytic activity in butyl levulinate synthesis. Effects of different reaction parameters were studied and optimized to get high yields of butyl levulinate. Under mild reaction conditions at 110 °C, complete conversion of furfuryl alcohol with 98 % selectivity to butyl levulinate was achieved. The prepared catalyst could be recycled at least five times without significant loss of activity. The overall process is green and clean. Keywords Butyl levulinate Furfuryl alcohol Tungstophosphoric acid Montmorillonite K-10 Heteropoly acids Biofuels Nomenclature K-10 Montmorillonite clay TPA Tungstophosphoric acid i.e. H3PW12O40 Snx-TPA/K-10 SnxH(3-x)PW12O40 supported on montmorillonite K-10 clay 1 Introduction In recent times, the rise in energy demand and depletion of fossil fuel reserves has led to an increased attention to biomass as the potential resource for alternative energy and biofuels [1]. Apart from sustainable energy, biomass is also a key feedstock for production of a variety of value-added chemicals, which makes the biomass-derived fuel processes more economic [2–4]. To reduce the dependency on non-renewable resources, the European Union and US governments have set targets to utilize renewable resources to produce up to 20 % of fuel and 25 % of chemicals [5]. Lignocellulosic biomass is most abundant and promising feedstock for production of chemicals and biofuels. The main components of Lignocellulosic biomass are cellulose (40–50 %), hemicellulose (25–30 %) and lignin (15–20 %) on weight basis [6,7]. Cellulose and hemicellulose can be easily converted into respective sugars, which are useful raw materials to synthesise various chemicals, fuel additives and biofuels [8,9]. Alkyl levulinates (AL) have received significant attention in recent time due to their unique properties such as stable flashpoint, high lubricity, non-toxic nature and better flow properties under cold conditions [10,11] These properties make them important value-added chemicals, especially as fuel additives [9,12]. Also, AL are useful to synthesize chemicals and drug intermediates, in flavors and fragrance, in plasticizer industries and as a solvent [12–17] Particularly, butyl levulinate (BL) has high oxygen content, high octane number, low water solubility and physical properties similar to diesel [13,18]. BL is also used in flavours and fragrances, and is approved by the food and drug administration of the USA (FDA) [14]. The synthesis of BL can be performed using various routes starting from raw biomass, carbohydrates, levulinic acid, furfuryl alcohol and 5-hydroxymethylfurfural. Low cost of furfuryl alcohol (FAL) as compared to levulinic acid, makes direct one-pot BL synthesis from FAL lot more attractive [10]. Several homogenous and heterogenous catalysts have been reported for synthesis of BL from FAL, however a number of recyclability and environmental issues have attracted the replacement of homogeneous catalysts with heterogeneous solid acid catalysts such as sulfonic acid functionalized ionic liquids [19], Al2O3/SBA-15 [5], Al-TUD-1 [20], double SO3H-functionalized ionic liquids [21], organo-inorganic hybrid catalyst [22], ion-exchange resin [23], zinc exchanged tungstophosphoric acid supported on niobium oxide [14] and zeolites [24]. Most of these catalysts are either expensive, hard to regenerate, less active, require a high catalyst to substrate ratio, or need tedious method of preparation, making it unsuitable for commercialization. Supported heteropoly acids (HPAs) are known to be very efficient heterogeneous catalysts for a range of acid catalysed as well as oxidation processes [25–29]. Amongst many structures of HPAs, Keggin ion, in particular Tungstophosphoric acid (TPA) is found to be a more acidic and active solid acid catalyst for application in various acid catalysed reactions. However all HPAs are highly soluble in polar solvents and possess poor surface areas. To overcome such limitations and achieve higher dispersion, either they are immobilised on different supports and/or protons are partially or fully substituted with metal ions [23]. Different metal ions such as Cu, Cs, Pd, Ag, Al and Sn have been used to replace the H+ ions in TPA [24,25]. Different supports such as silica, alumina, titania, tin oxide, niobia oxide and K-10 have been used to make solid acid catalysts for a range of organic transformations [30–34]. Unsupported Sn exchanged TPA was prepared by Lingaiah et al and showed high activity for benzylation of arenes [27]. However, unsupported catalysts are difficult to recover and recycle, due to loss of catalytic activity upon agglomeration. K-10 with higher surface area and acidic nature, is advantageous to get better dispersion of Keggin ions to improve the catalytic activity vis-a-vis unsupported HPAs. To the best of our knowledge tin exchanged TPA as a supported catalyst for alcoholysis of furfuryl alcohol has not been explored yet. The current work aims at synthesis of tin exchanged tungstophosphoric acid supported on K-10 with different amount of tin and its activity toward synthesis of butyl levulinate (BL) from furfuryl alcohol (FAL) and 1-butanol. The catalyst was thoroughly characterised to correlate the activity of the catalyst for BL synthesis. The reaction parameters were also optimized. 2 Experimental section 2.1 Chemicals All chemicals were of AR grade and used without any further purification. Montmorillonite K-10 clay, Tungstophosphoric acid hydrated and tin chloride were obtained from Sigma Aldrich, UK. Furfuryl alcohol, methanol and 1-butanol were procured from Alfa Aesar. All catalysts were prepared and tested in house. 2.2 Preparation of catalyst All catalysts were prepared by incipient wetness impregnation method and the loading of tungstophosphoric acid (TPA) on K-10 was 20 % w/w. Tin exchanged TPA supported on K-10 catalysts, 20 % w/w SnxH3-x PW12O40/K-10 (Snx-TPA/K-10) with x varying from 0.5 to 1.5 were prepared in two steps of impregnation. Firstly, tin with varying amount was loaded on K-10. Around 5 g of support (K-10) was dried for 3 h in an oven at 120 °C to remove moisture. The required amount of Sn(II)Cl2 was dissolved in methanol (5 ml) and then added in 1 ml quantities each time as tin precursor to dried K-10 (4 g). After each addition the solid was kneaded thoroughly to get free flowing powder. The obtained solid material was then dried at 90 °C for 5 h to remove methanol. In the second step, the desired amount of TPA dissolved in methanol (5 ml) was added to the dried powder of tin loaded K-10 clay, using same procedure as stated above to get nearly dry solid material. The resultant material was then dried at 120 °C for 12 h in a tubular furnace under flowing air, followed by calcination at 300 °C for 3 h to get active 20 % w/w Snx-TPA/K-10 catalyst. The resultant 20 % w/w Snx-TPA/K-10 catalyst was stored in an air tight bottle. 20 % w/w tin exchanged TPA supported on bentonite clay catalyst was also prepared by using same method as above. 20 % (w/w) TPA/K-10 catalyst was prepared by directly following the second step of the preparation method. 2.3 Catalyst characterization 20 % w/w tin exchanged TPA supported on K-10 and bentonite, and 20 % w/w TPA supported on K-10 catalysts were characterized by X-ray diffraction, framework IR, UV–vis and SEM analyses as well as surface acidity measurement. The X-ray scattering measurements were made with PANalytical X-Pert Pro MPD diffractometer with Ni filtered CuK α radiation (1.5405 A°). The diffractograms were recorded with step size of 0.016° from 5° to 80°. FT-IR spectra of samples were recorded on a Perkin-Elmer Fourier Transform Infrared Spectrometer. Thin transparent wafer like pellets were prepared by mixing 1 mg of catalyst with 100 mg of dried KBr and subsequent pressing.The UV–vis spectral characterization was done using Shimadzu UV-1280 03540 spectrometer. SEM images were collected on FEI Quanta FEG 250 Scanning Electron Microscope. The acidity of prepared catalysts was measured by acid-base titration method as reported earlier [35,36]. The solid catalysts were stirred in 25 ml of 0.1 M NaOH solution for 6 h, and then titrated with 0.1 M HCl solution to get the acidity of the samples. 2.4 Reaction procedure All the reactions were performed in 20 ml glass reactors equipped with magnetic stirring Appropriate quantities of the reactants, FAL and 1-butanol were taken in a reactor and placed in oil bath at 110 °C and agitated. The reaction mixture was stirred for 2 min at 1000 rpm and then a zero hour sample was taken. Catalyst was added and stirring started again, the reaction was carried out for 5 h and samples were taken periodically for analysis. The reaction mixture was analysed by using a HP-5 capillary column in an Agilent 7820A GC equipped with an FID detector. The products were identified by GC–MS, synthetic mixtures were prepared and used for quantification of the data. 3 Results and discussion 3.1 Catalyst characterization 3.1.1 X-ray diffraction spectroscopy The X-ray diffraction patterns of all catalysts including K-10 clay, 20 % w/w TPA supported on K-10, 20 % w/w tin exchanged TPA supported K-10 with x = 0.5 to 1.5, and reused 20 % w/w Sn1TPA supported on K-10 were recorded and are shown in Fig. 1 . X-ray diffraction pattern of unsupported TPA and Sn1TPA is also shown as an insert in Fig. 1. TPA and unsupported Sn1TPA showed crystalline nature, as can be seen in the insert in Fig. 1. However, peak intensity decreased after proton exchange with tin indicating the decrease in crystallinity. X-ray diffraction pattern of K-10 showed peaks at 20° and 35° attributed to 110 and 105 facets of montmorillonite [29,37]. Apart from that all the other peaks are due to impurities and other materials present in the K-10. This includes quartz (peaks at 21.1°, 26.5°, 50.1°,59.8°), feldspar (peak at 27.9°) and phengite (peaks at 36.6°,42.5°,45.6°), which confirms that K-10 is made of different phases as reported earlier [37–40]. X-ray diffraction patterns of TPA, and tin exchanged TPA supported on K-10 were similar to those of the corresponding K-10. This could be attributed to uniform distribution of Keggin anion in the non-crystalline form because of the interaction with the surface of K-10 clay [25,29]. The X-ray diffraction pattern of reused and fresh 20 % w/w Sn1TPA supported on K-10 catalysts were almost identical which confirmed the stability of the catalyst after reactions. 3.1.2 Fourier-transform infrared spectroscopy (FT-IR) FT-IR spectra of all catalyst samples are shown in Fig. 2 . It exhibits characteristic bands at 790, 891, 987 and 1081 cm−1 related to the Keggin structure of TPA, assignable respectively to the stretching vibration of edge sharing WOW, corner sharing WOW, WO terminal and PO bonds of the Keggin ion structure in pure TPA [19,26]. FT-IR spectra of K-10, TPA/K-10 and tin exchanged TPA supported on K-10 were similar. The K-10 shows the intense band at 1010 cm−1 corresponding to SiO out of plane stretching while shoulder at 935 cm−1 is due to SiO in-plane stretching vibration [37]. The FT-IR band in the region of 3410 cm−1 is due to asymmetric stretching of the OH group while the band in the region of 1600–1700 cm−1 corresponds to bending vibration of HOH bonds [40]. All catalyst shows the same bands as corresponding to K-10 because the bands related to Keggin ion of TPA were superimposed by K-10 bands in the region of 700–1100 cm−1 as reported earlier [41,42]. FT-IR spectra of reused and fresh catalysts were also the same, and no additional bands were observed. This indicates the supported Keggin anion is stable under the reaction conditions. 3.1.3 UV-VIS spectroscopy UV-VIS spectra of K-10, TPA and TPA/K-10 are shown in Fig. 3 . K-10 showed no absorption bands indicating there is no absorbance of light. TPA showed two absorption bands at 204 nm and 265 nm. These bands could be attributed to the charge transfer from terminal oxygen to tungsten and the charge transfer from bridge oxygen to metallic tungsten respectively. These bands are characteristic bands of the TPA polyanionic structure [29]. 20 % w/w Sn1TPA/K-10 showed the two bands which confirmed that the Keggin ion is intact and supporting TPA on K-10 does not affect the structure of TPA. 3.1.4 SEM The surface morphology of the catalysts was evaluated from SEM analysis. The SEM images of 20 % w/w Sn1-TPA/K-10, fresh and reused catalysts at different magnifications are shown in Fig. 4 . These catalyst samples show particles of irregular morphology, which are fairly uniform in size. The images of 20 % w/w Sn1-TPA/K-10 show the smooth surfaces, which is similar to the K-10 [26]. The reused and fresh catalyst does not show any difference in morphology which along with x-ray diffraction patterns confirms the structural stability of catalyst after reuse. 3.2 Efficacy of different solid acid catalysts The catalytic activity of various catalysts is compared on the basis of the %yield of BL, since the synthesis of butyl levulinate from furfuryl alcohol is a two-step reaction. The first step is formation of intermediates, 2-butoxymethyl furan (BMF) and 5,5-dibutoxymethyl furan (DBP), which is a very fast reaction (Scheme 1 ). The second step, subsequent conversion of intermediates to BL, is relatively slower as compared to the first step of consumption of FAL. As reported in earlier reports [14,15,44], the formation of BL can directly be correlated with activity of the catalyst hence we have considered the yield of BL as a parameter for comparison. The performance of different catalysts such as tin exchanged TPA supported on K-10, TPA supported on K-10, bentonite clay and K-10 were evaluated for butanolysis of FAL (Table 1 ). Two different clays as catalyst support were first used to compare their activity for butanolysis of FAL. K-10 clay as catalyst showed 100 % FAL conversion with 23.2 % yield of BL in 150 min, while the use of bentonite clay catalyst resulted in 60 % FAL conversion with 1.2 % BL yield. The better activity of K-10 clay over bentonite clay is due to higher acidity of K-10, hence K-10 was used as catalyst support for impregnation of TPA and tin exchanged TPA. The efficacy of different TPA supported catalyst was compared on the basis of the yield of BL as the furfuryl alcohol conversion was found to be 100 % in all cases (Table 1). 20 % w/w TPA supported on K-10 showed 42.4 % BL yield (entry 3), while exchange of H+ ion with tin (x = 0.5) resulted in higher yield of BL. 20 % w/w Sn0.5-TPA/K-10 showed 52.6 % yield of BL. Further replacement of proton with Sn (x = 1) resulted in increase in overall activity of catalyst with 72.6 % yield of BL at (entry 5). A subsequent increase in Sn amount up to x = 1.5, resulted in complete removal of H+ which showed lower activity (entry 6). The efficacy of catalysts was in following order: bentonite clay (least) < K-10 < 20 % w/w TPA/K-10 < 20 % w/w Sn1.5-TPA/K-10 < 20 % w/w Sn0.5-TPA/K-10 < 20 % w/w Sn1-TPA/K-10 (highest). The activity could directly be correlated with the acidity of catalyst as measured by titration method. The acidity of catalyst was also in the same order as the efficacy: bentonite clay (least) < K-10 < 20 % w/w TPA/K-10 < 20 % w/w Sn1.5-TPA/K-10 < 20 % w/w Sn0.5-TPA/K-10 < 20 % w/w Sn1.0-TPA/K-10 (most). The Bronsted acidity of TPA is due to the proton conductivity in Keggin structure and exchanging the protons with metal ions results in the presence of both Bronsted as well as Lewis acidity as elucidated previously in literature [45,46]. Exchanging the protons of TPA in its secondary structure improves the proton mobility and thus increases the acidity of prepared catalyst [46]. With exchange of Sn in the secondary structure of TPA will have the same effect and hence results in increase in the acidity of catalyst as explained earlier. All further experiments for optimisation of the process conditions were carried out using 20 % w/w Sn1-TPA/K-10 catalyst. 3.3 Optimization of reaction parameters It was desirable to study the influence of various reaction parameters on alcoholysis of FAL to optimize the process conditions for maximising the yield of BL. The results are compared on the basis of the % yield of BL, as the conversion of FAL was always near 100 % in very short reaction times. 3.3.1 Effect of catalyst loading The effect of catalyst loading was studied over a range of 0.3–1.2 mol% by using 20 % w/w Sn1-TPA/K-10 as catalyst. The increase in catalyst loading resulted in a linear increase in the yield of BL, which is due to proportional increase in the amount of acid sites (Fig. 5 a). The rate of formation of BL was directly proportional to catalyst loading based on the mol% of FAL, which indicates that reaction is free from external mass transfer resistance (Fig. 5b). At 1.2 mol% catalyst loading, maximum BL yield of 98.4 % was achieved and hence this catalyst loading was used for further reactions. 3.3.2 Effect of mole ratio The effect of FAL to 1-butanol mole ratio was studied over the range of 1:5 to 1:20 by using 1.2 mol% of 20 % w/w Sn1-TPA/K-10 as catalyst maintaining other reaction parameters constant (Fig. 6 a). The increase in FAL:1-butanol mole ratio results in an excess amount of 1-butanol, which acts as solvent and helps to solubilize the formed products and intermediates and frees the catalyst active site easily for further reaction. The reaction rate of formation of BL increased linearly with increase in FAL:1-butanol mole ratio from 1:5 to 1:20 (Fig. 6b). At 1:20 mol ratio of FAL to 1-butanol, maximum yield of BL (98.4 %) was achieved, which was used as the mole ratio for further reactions. 3.3.3 Effect of temperature The effect of temperature was studied by varying the reaction temperature in the range of 90 to 120 °C by using 1.2 mol% of 20 % w/w Sn1-TPA/K-10 as catalyst, maintaining other reaction parameters constant. The increase in temperature results in an enhanced reaction rate for both steps of FAL conversion to intermediates and subsequent conversion of intermediates to BL, indicating that the reaction is kinetically controlled and any diffusion limitation was absent. The yield of BL increases with an increase in temperature up to 110 °C and thereafter no significant change was observed in the yield of BL (Fig. 7 a). Hence 110 °C was chosen as an optimum temperature for this reaction under specified condition. The activation energy for butyl levulinate formation was estimated from the Arrhenius plot using the initial rate of formation of BL (Fig. 7b). The apparent activation energy for the formation of BL was found to be 36.6 kJ mol−1 using 20 % w/w Sn1-TPA/K-10 catalyst. The observed activation energy is larger than the activation energy of diffusion in liquids (12-21 kJ mol−1), thus confirming the absence of external mass transfer and intra-particle diffusion resistances [47,48] 3.4 Comparison with solid acid catalysts The activity of 20 % w/w Sn1-TPA/K-10 catalyst was compared with other solid acid catalysts reported in literature for BL synthesis from FAL to compare the catalyst performance with the state-of-the-art catalysts (Table 2 ). However, the comparison was only semiquantitative, since in many cases the reaction conditions applied are far from optimum. The activity of catalysts was compared on the basis of the % yield of BL after 3 h. Tin exchanged TPA supported on K-10 is highly active as compared to most catalysts with 97.5 % yield of BL in 3 h. The result is indicative of the better efficacy of 20 % w/w Sn1-TPA/K-10 catalyst for conversion of FAL to BL. 3.5 Catalyst reusability and heterogeneity The catalyst reusability was studied five times under optimum reaction conditions (Fig. 8 a). After the reaction catalyst was filtered, and washed with acetone under reflux. The colour of catalyst was black after recovery, which changed to dark brown upon washing. The washed catalyst was subsequently calcined at 300 °C before being reused in subsequent batches. In presence of the fresh 20 % w/w Sn1-TPA/K-10 catalyst, the BL yield was 98.4 %. During the 5th cycle, BL yield decreased to 93.6 %, which may be attributed to chemical adsorption of reactants or intermediates, as indicated from the colour of the catalyst. Reused catalyst was characterized using different techniques and found to be same in the nature as the fresh catalyst, indicating that the catalyst is stable and reusable. A further proof of TPA stability on K-10 clay was obtained by a control experiment. The reaction mixture consisted of FAL (2.3 mmol) and 1-butanol (45.9 mmol) with standard catalyst loading of 0.4 g of 20 % w/w Sn1-TPA/K-10, alcoholysis was performed at 110 °C, for 30 min. A BL yield of 54.6 % was achieved. The reaction mixture was hot filtered, and all catalyst particles were separated. The reaction was then further continued at 110 °C, for next 4 h without any catalyst. There was a slight increase in yield of BL from 54.6 % to 55.8 % (Fig. 8b). The test was performed 3 times with fresh catalyst and each time there was a very slight change noticed either decrease or increase but limited within ±1 %, which is within experimental error. Thus it is concluded, that Sn exchanged TPA was strongly adsorbed on K-10 clay, and the catalyst is stable under reaction conditions. 4 Conclusions Various tin exchanged tungstophosphoric acid supported on K-10 catalysts with intact Keggin ion structure were prepared. Sn exchanged catalysts were found to be highly active for synthesis of butyl levulinate from alcoholysis of FAL with 1-butanol. The amount of Sn exchanged, and type of clay control the acidity of catalyst and hence the activity of catalyst. 20 % w/w Sn1-TPA/K-10 catalyst was found to be most active catalyst. The reaction parameters, 1.2 mol% 20 % w/w Sn1-TPA/K-10 catalyst loading, reaction temperature 110 °C, speed of agitation 1000 RPM and FAL to 1-butanol mole ratio of 1:20, resulted in complete conversion of FAL, with maximum yield (98.4 %) of BL. The 20 % w/w Sn1-TPA/K-10 catalyst exhibited good reusability over 5 recycles, without significant loss of activity. The catalyst activity was compared with reported literature and found to be a highly active catalyst. Disclaimer The views and opinions expressed in this paper do not necessarily reflect those of the European Commission or the Special EU Programmes Body (SEUPB). CRediT authorship contribution statement Manishkumar S. Tiwari: Investigation, Methodology, Writing - original draft. Jennifer Sarah Dicks: Investigation. John Keogh: Investigation. Vivek V. Ranade: Writing - review & editing, Funding acquisition. Haresh G. Manyar: Conceptualization, Supervision, Writing - review & editing, Funding acquisition. Declaration of Competing Interest The authors declare that they have no known competing financial interests or personal relationships that could have appeared to influence the work reported in this paper. Acknowledgments The authors gratefully acknowledge the financial support from the Invest Northern Ireland Competence Centre programme under the “Centre for Advanced Sustainable Energy” (CASE) project R3947CCE for postdoctoral funding for MT, Department for the Economy (DfE) for PhD studentship to JD and “The Bryden centre for advanced marine and bio-energy research” project for PhD studentship to JK. The Bryden Centre project is supported by the European Union’s INTERREG VA Programme, managed by the Special EU Programmes Body (SEUPB). References [1] E. Ahmad I. Alam K.K. Pant M.A. Haider Catalytic and mechanistic insights into the production of ethyl levulinate from biorenewable feedstocks Green Chem. 18 2016 4804 4823 10.1039/c6gc01523a E. Ahmad, I. Alam, K.K. Pant, M.A. Haider, Catalytic and mechanistic insights into the production of ethyl levulinate from biorenewable feedstocks, Green Chem. 18 (2016) 4804–4823. doi:10.1039/c6gc01523a. [2] K.Y. Nandiwale A.M. Pande V.V. Bokade HPW Anchored Meso-HZ-5, a Novel Catalyst for Selective Synthesis of Ethyl Levulinate Biofuel by Alcoholysis of Biomass-Derived Furfuryl Alcohol, 00 2017 1 7 10.1002/ep.12822 K.Y. Nandiwale, A.M. Pande, V. V Bokade, HPW Anchored Meso-HZ-5, a Novel Catalyst for Selective Synthesis of Ethyl Levulinate Biofuel by Alcoholysis of Biomass-Derived Furfuryl Alcohol, 00 (2017) 1–7. doi:10.1002/ep.12822. [3] Y. Chen F. Wang Y. Jia N. Yang X. Zhang One-step ethanolysis of lignin into small-molecular aromatic hydrocarbons over nano-SiC catalyst Bioresour. Technol. 226 2017 145 149 10.1016/j.biortech.2016.12.008 Y. Chen, F. Wang, Y. Jia, N. Yang, X. Zhang, One-step ethanolysis of lignin into small-molecular aromatic hydrocarbons over nano-SiC catalyst, Bioresour. Technol. 226 (2017) 145–149. doi:10.1016/j.biortech.2016.12.008. [4] J. Molleti M.S. Tiwari G.D. Yadav Novel synthesis of Ru/OMS catalyst by solvent-free method: selective hydrogenation of levulinic acid to γ-valerolactone in aqueous medium and kinetic modelling Chem. Eng. J. 334 2018 2488 2499 10.1016/j.cej.2017.11.125 J. Molleti, M.S. Tiwari, G.D. Yadav, Novel synthesis of Ru/OMS catalyst by solvent-free method: Selective hydrogenation of levulinic acid to γ-valerolactone in aqueous medium and kinetic modelling, Chem. Eng. J. 334 (2018) 2488–2499. doi:10.1016/j.cej.2017.11.125. [5] S.S. Enumula K.S. Koppadi V. Ramesh B. Gurram D.R. Burri S. Rama R. Kamaraju Sustainable energy & fuels Sustain. Energy Fuels. 1 2017 644 651 10.1039/C6SE00103C S.S. Enumula, K.S. Koppadi, V. Ramesh, B. Gurram, D.R. Burri, S. Rama, R. Kamaraju, Sustainable Energy & Fuels, Sustain. Energy Fuels. 1 (2017) 644–651. doi:10.1039/C6SE00103C. [6] R. Reddy C. Kumara S. Koppadi S. Sankar E. Murali Continuous synthesis of fuel additives alkyl levulinates via alcoholysis of furfuryl alcohol over silica supported metal oxides Catal. Lett. 2018 10.1007/s10562-018-2371-y 0 0 R. Reddy, C. Kumara, S. Koppadi, S. Sankar, E. Murali, Continuous Synthesis of Fuel Additives Alkyl Levulinates via Alcoholysis of Furfuryl Alcohol over Silica Supported Metal Oxides, Catal. Letters. 0 (2018) 0. doi:10.1007/s10562-018-2371-y. [7] A.B. Gawade M.S. Tiwari G.D. Yadav Biobased green process: selective hydrogenation of 5-hydroxymethylfurfural to 2,5-dimethyl furan under mild conditions using Pd-Cs 2.5 H 0.5 PW 12 O 40 /K-10 Clay ACS Sustain. Chem. Eng. 4 2016 4113 4123 10.1021/acssuschemeng.6b00426 A.B. Gawade, M.S. Tiwari, G.D. Yadav, Biobased Green Process: Selective Hydrogenation of 5-Hydroxymethylfurfural to 2,5-Dimethyl Furan under Mild Conditions Using Pd-Cs 2.5 H 0.5 PW 12 O 40 /K-10 Clay, ACS Sustain. Chem. Eng. 4 (2016) 4113–4123. doi:10.1021/acssuschemeng.6b00426. [8] J. Cui J. Tan T. Deng X. Cui H. Zheng Y. Zhu Y. Li Direct conversion of carbohydrates to γ-valerolactone facilitated by a solvent effect Green Chem. 17 2015 3084 3089 10.1039/C5GC00110B J. Cui, J. Tan, T. Deng, X. Cui, H. Zheng, Y. Zhu, Y. Li, Direct conversion of carbohydrates to γ-valerolactone facilitated by a solvent effect, Green Chem. 17 (2015) 3084–3089. doi:10.1039/C5GC00110B. [9] Y.-B. Huang T. Yang M.-C. Zhou H. Pan Y. Fu Microwave-assisted alcoholysis of furfural alcohol into alkyl levulinates catalyzed by metal salts Green Chem. 18 2016 1516 1523 10.1039/C5GC01581B Y.-B. Huang, T. Yang, M.-C. Zhou, H. Pan, Y. Fu, Microwave-assisted alcoholysis of furfural alcohol into alkyl levulinates catalyzed by metal salts, Green Chem. 18 (2016) 1516–1523. doi:10.1039/C5GC01581B. [10] M.S. Tiwari A.B. Gawade G.D. Yadav Magnetically separable sulfated zirconia as highly active acidic catalysts for selective synthesis of ethyl levulinate from furfuryl alcohol Green Chem. 19 2017 963 976 10.1039/C6GC02466A M.S. Tiwari, A.B. Gawade, G.D. Yadav, Magnetically separable sulfated zirconia as highly active acidic catalysts for selective synthesis of ethyl levulinate from furfuryl alcohol, Green Chem. 19 (2017) 963–976. doi:10.1039/C6GC02466A. [11] Y. Wang D. Zhao K.S. Triantafyllidis W. Ouyang R. Luque C. Len Microwave-assisted catalytic upgrading of bio-based furfuryl alcohol to alkyl levulinate over commercial non-metal activated carbon Mol. Catal. 480 2020 110630 10.1016/j.mcat.2019.110630 Y. Wang, D. Zhao, K.S. Triantafyllidis, W. Ouyang, R. Luque, C. Len, Microwave-assisted catalytic upgrading of bio-based furfuryl alcohol to alkyl levulinate over commercial non-metal activated carbon, Mol. Catal. 480 (2020) 110630. doi:10.1016/j.mcat.2019.110630. [12] D. Zhao P. Prinsen Y. Wang W. Ouyang F. Delbecq C. Len R. Luque Continuous flow alcoholysis of furfuryl alcohol to alkyl levulinates using zeolites ACS Sustain. Chem. Eng. 6 2018 6901 6909 10.1021/acssuschemeng.8b00726 D. Zhao, P. Prinsen, Y. Wang, W. Ouyang, F. Delbecq, C. Len, R. Luque, Continuous Flow Alcoholysis of Furfuryl Alcohol to Alkyl Levulinates Using Zeolites, ACS Sustain. Chem. Eng. 6 (2018) 6901–6909. doi:10.1021/acssuschemeng.8b00726. [13] E. Siva S.K. Saidulu R. Yadagiri J. Burri D. Raju Alcoholysis of furfuryl alcohol into n -butyl levulinate over SBA-16 supported heteropoly acid catalyst Catal. Lett. 147 2017 2807 2816 10.1007/s10562-017-2155-9 E. Siva, S.K. Saidulu, R. Yadagiri, J. Burri, D. Raju, Alcoholysis of Furfuryl Alcohol into n -Butyl Levulinate Over SBA-16 Supported Heteropoly Acid Catalyst, Catal. Letters. 147 (2017) 2807–2816. doi:10.1007/s10562-017-2155-9. [14] B.S. Rao P.K. Kumari D. Dhanalakshmi N. Lingaiah Selective conversion of furfuryl alcohol into butyl levulinate over zinc exchanged heteropoly tungstate supported on niobia catalysts Mol. Catal. 427 2017 80 86 10.1016/j.molcata.2016.11.032 B.S. Rao, P.K. Kumari, D. Dhanalakshmi, N. Lingaiah, Selective conversion of furfuryl alcohol into butyl levulinate over zinc exchanged heteropoly tungstate supported on niobia catalysts, Mol. Catal. 427 (2017) 80–86. doi:10.1016/j.molcata.2016.11.032. [15] P.D. Carà R. Ciriminna N.R. Shiju G. Rothenberg Enhanced Heterogeneous Catalytic Conversion of Furfuryl Alcohol into Butyl Levulinate 2014 835 840 10.1002/cssc.201301027 P.D. Carà, R. Ciriminna, N.R. Shiju, G. Rothenberg, Enhanced Heterogeneous Catalytic Conversion of Furfuryl Alcohol into Butyl Levulinate, (2014) 835–840. doi:10.1002/cssc.201301027. [16] W. Ouyang D. Zhao Y. Wang A.M. Balu C. Len R. Luque Continuous flow conversion of biomass-derived methyl levulinate into γ-valerolactone using functional metal organic frameworks ACS Sustain. Chem. Eng. 6 2018 6746 6752 10.1021/acssuschemeng.8b00549 W. Ouyang, D. Zhao, Y. Wang, A.M. Balu, C. Len, R. Luque, Continuous Flow Conversion of Biomass-Derived Methyl Levulinate into γ-Valerolactone Using Functional Metal Organic Frameworks, ACS Sustain. Chem. Eng. 6 (2018) 6746–6752. doi:10.1021/acssuschemeng.8b00549. [17] D. Zhao Y. Wang F. Delbecq C. Len Continuous flow conversion of alkyl levulinates into γ-valerolactone in the presence of Ru/C as catalyst Mol. Catal. 475 2019 110456 10.1016/j.mcat.2019.110456 D. Zhao, Y. Wang, F. Delbecq, C. Len, Continuous flow conversion of alkyl levulinates into γ-valerolactone in the presence of Ru/C as catalyst, Mol. Catal. 475 (2019) 110456. doi:10.1016/j.mcat.2019.110456. [18] S. Dharne V.V. Bokade Esterification of levulinic acid to n-butyl levulinate over heteropolyacid supported on acid-treated clay J. Nat. Gas Chem. 20 2011 18 24 10.1016/S1003-9953(10)60147-8 S. Dharne, V.V. Bokade, Esterification of levulinic acid to n-butyl levulinate over heteropolyacid supported on acid-treated clay, J. Nat. Gas Chem. 20 (2011) 18–24. doi:10.1016/S1003-9953(10)60147-8. [19] A.M. Hengne S.B. Kamble C.V. Rode Single pot conversion of furfuryl alcohol to levulinic esters and γ-valerolactone in the presence of sulfonic acid functionalized ILs and metal catalysts Green Chem. 15 2013 2540 10.1039/c3gc41098f A.M. Hengne, S.B. Kamble, C. V. Rode, Single pot conversion of furfuryl alcohol to levulinic esters and γ-valerolactone in the presence of sulfonic acid functionalized ILs and metal catalysts, Green Chem. 15 (2013) 2540. doi:10.1039/c3gc41098f. [20] P. Neves M.M. Antunes P.A. Russo J.P. Abrantes S. Lima A. Fernandes M. Pillinger S.M. Rocha M.F. Ribeiro A.A. Valente Production of biomass-derived furanic ethers and levulinate esters using heterogeneous acid catalysts Green Chem. 15 2013 3367 10.1039/c3gc41908h P. Neves, M.M. Antunes, P.A. Russo, J.P. Abrantes, S. Lima, A. Fernandes, M. Pillinger, S.M. Rocha, M.F. Ribeiro, A.A. Valente, Production of biomass-derived furanic ethers and levulinate esters using heterogeneous acid catalysts, Green Chem. 15 (2013) 3367. doi:10.1039/c3gc41908h. [21] G. Wang Z. Zhang L. Song Efficient and selective alcoholysis of furfuryl alcohol to alkyl levulinates catalyzed by double SO 3 H-functionalized ionic liquids Green Chem. 16 2014 1436 1443 10.1039/C3GC41693C G. Wang, Z. Zhang, L. Song, Efficient and selective alcoholysis of furfuryl alcohol to alkyl levulinates catalyzed by double SO 3 H-functionalized ionic liquids, Green Chem. 16 (2014) 1436–1443. doi:10.1039/C3GC41693C. [22] Z. Zhang K. Dong Z.K. Zhao Efficient conversion of furfuryl alcohol into alkyl levulinates catalyzed by an organic-inorganic hybrid solid acid catalyst ChemSusChem 4 2011 112 118 10.1002/cssc.201000231 Z. Zhang, K. Dong, Z.K. Zhao, Efficient Conversion of Furfuryl Alcohol into Alkyl Levulinates Catalyzed by an Organic-Inorganic Hybrid Solid Acid Catalyst, ChemSusChem. 4 (2011) 112–118. doi:10.1002/cssc.201000231. [23] R. Bringué E. Ramírez M. Iborra J. Tejero F. Cunill Esterification of furfuryl alcohol to butyl levulinate over ion-exchange resins Fuel 257 2019 116010 10.1016/j.fuel.2019.116010 R. Bringué, E. Ramírez, M. Iborra, J. Tejero, F. Cunill, Esterification of furfuryl alcohol to butyl levulinate over ion-exchange resins, Fuel. 257 (2019) 116010. doi:10.1016/j.fuel.2019.116010. [24] H.A. Al-Lohedan J.J. Vijaya J.N. Appaturi M.R. Johan R.J. Ramalingam H.A. Al-Lohedan J.J. Vijaya Efficient synthesis of butyl levulinate from furfuryl alcohol over ordered mesoporous Ti-KIT-6 catalysts for green chemistry applications RSC Adv. 7 2017 55206 55214 10.1039/C7RA10289E H.A. Al-Lohedan, J.J. Vijaya, J.N. Appaturi, M.R. Johan, R.J. Ramalingam, H.A. Al-Lohedan, J.J. Vijaya, Efficient synthesis of butyl levulinate from furfuryl alcohol over ordered mesoporous Ti-KIT-6 catalysts for green chemistry applications, RSC Adv. 7 (2017) 55206–55214. doi:10.1039/C7RA10289E. [25] M.S. Tiwari G.D. Yadav Kinetics of Friedel–Crafts benzoylation of veratrole with benzoic anhydride using Cs2.5H0.5PW12O40/K-10 solid acid catalyst Chem. Eng. J. 266 2015 64 73 10.1016/j.cej.2014.12.043 M.S. Tiwari, G.D. Yadav, Kinetics of Friedel–Crafts benzoylation of veratrole with benzoic anhydride using Cs2.5H0.5PW12O40/K-10 solid acid catalyst, Chem. Eng. J. 266 (2015) 64–73. doi:10.1016/j.cej.2014.12.043. [26] G.D. Yadav H.G. Manyar Novelties of synthesis of acetoveratrone using heteropoly acid supported on hexagonal mesoporous silica Microporous Mesoporous Mater. 63 2003 85 96 10.1016/S1387-1811(03)00434-7 G.D. Yadav, H.G. Manyar, Novelties of synthesis of acetoveratrone using heteropoly acid supported on hexagonal mesoporous silica, Microporous Mesoporous Mater. 63 (2003) 85–96. doi:10.1016/S1387-1811(03)00434-7. [27] H.G. Manyar G.S. Chaure A. Kumar Supported polyperoxometallates: Highly selective catalyst for oxidation of alcohols to aldehydes J. Mol. Catal. A Chem. 243 2006 244 252 10.1016/j.molcata.2005.09.036 H.G. Manyar, G.S. Chaure, A. Kumar, Supported polyperoxometallates: Highly selective catalyst for oxidation of alcohols to aldehydes, J. Mol. Catal. A Chem. 243 (2006) 244–252. doi:10.1016/j.molcata.2005.09.036. [28] S. Doherty J.G. Knight J.R. Ellison D. Weekes R.W. Harrington C. Hardacre H. Manyar An efficient recyclable peroxometalate-based polymer-immobilised ionic liquid phase (PIILP) catalyst for hydrogen peroxide-mediated oxidation Green Chem. 14 2012 925 10.1039/c2gc16679h S. Doherty, J.G. Knight, J.R. Ellison, D. Weekes, R.W. Harrington, C. Hardacre, H. Manyar, An efficient recyclable peroxometalate-based polymer-immobilised ionic liquid phase (PIILP) catalyst for hydrogen peroxide-mediated oxidation, Green Chem. 14 (2012) 925. doi:10.1039/c2gc16679h. [29] M.S. Tiwari G.D. Yadav Novel aluminium exchanged dodecatungstophosphoric acid supported on K-10 clay as catalyst: benzoylation of diphenyloxide with benzoic anhydride RSC Adv. 6 2016 49091 49100 10.1039/C6RA05379C M.S. Tiwari, G.D. Yadav, Novel aluminium exchanged dodecatungstophosphoric acid supported on K-10 clay as catalyst: benzoylation of diphenyloxide with benzoic anhydride, RSC Adv. 6 (2016) 49091–49100. doi:10.1039/C6RA05379C. [30] G.S. Armatas G. Bilis M. Louloudi Highly ordered mesoporous zirconia-polyoxometalate nanocomposite materials for catalytic oxidation of alkenes J. Mater. Chem. 21 2011 2997 10.1039/c0jm03395b G.S. Armatas, G. Bilis, M. Louloudi, Highly ordered mesoporous zirconia-polyoxometalate nanocomposite materials for catalytic oxidation of alkenes, J. Mater. Chem. 21 (2011) 2997. doi:10.1039/c0jm03395b. [31] C.R. Kumar K. Jagadeeswaraiah P.S.S. Prasad N. Lingaiah Samarium-exchanged heteropoly tungstate: an efficient solid acid catalyst for the synthesis of glycerol carbonate from glycerol and benzylation of anisole ChemCatChem 4 2012 1360 1367 10.1002/cctc.201200110 C.R. Kumar, K. Jagadeeswaraiah, P.S.S. Prasad, N. Lingaiah, Samarium-exchanged Heteropoly Tungstate: An Efficient Solid Acid Catalyst for the Synthesis of Glycerol Carbonate from Glycerol and Benzylation of Anisole, ChemCatChem. 4 (2012) 1360–1367. doi:10.1002/cctc.201200110. [32] K. Shimizu K. Niimi A. Satsuma Polyvalent-metal salts of heteropolyacid as efficient heterogeneous catalysts for Friedel–Crafts acylation of arenes with carboxylic acids Catal. Commun. 9 2008 980 983 10.1016/j.catcom.2007.09.030 K. Shimizu, K. Niimi, A. Satsuma, Polyvalent-metal salts of heteropolyacid as efficient heterogeneous catalysts for Friedel–Crafts acylation of arenes with carboxylic acids, Catal. Commun. 9 (2008) 980–983. doi:10.1016/j.catcom.2007.09.030. [33] M.S. Tiwari T. Jain G.D. Yadav Novel Bifunctional Palladium-dodecatungstophosphoric Acid Supported on Titania Nanotubes: One-pot Synthesis of N ‑ Pentyl Tetrahydrofurfuryl Ether from Furfuryl Alcohol and N ‑ Pentanol 2017 12909 12919 10.1021/acs.iecr.7b00078 M.S. Tiwari, T. Jain, G.D. Yadav, Novel Bifunctional Palladium-Dodecatungstophosphoric Acid Supported on Titania Nanotubes : One-Pot Synthesis of n ‑ Pentyl Tetrahydrofurfuryl Ether from Furfuryl Alcohol and n ‑ Pentanol, (2017) 12909–12919. doi:10.1021/acs.iecr.7b00078. [34] C. Ramesh Kumar K.T.V. Rao P.S. Sai Prasad N. Lingaiah Tin exchanged heteropoly tungstate: an efficient catalyst for benzylation of arenes with benzyl alcohol J. Mol. Catal. A Chem. 337 2011 17 24 10.1016/j.molcata.2011.01.008 C. Ramesh Kumar, K.T.V. Rao, P.S. Sai Prasad, N. Lingaiah, Tin exchanged heteropoly tungstate: An efficient catalyst for benzylation of arenes with benzyl alcohol, J. Mol. Catal. A Chem. 337 (2011) 17–24. doi:10.1016/j.molcata.2011.01.008. [35] A. de N. de Oliveira M.A. Barbosa de Lima L.H. de Oliveira Pires M. Rosas da Silva P.T. Souza da Luz R.S. Angélica G.N. da Rocha Filho C.E.F. da Costa R. Luque L.A. Santos do Nascimento Bentonites modified with phosphomolybdic heteropolyacid (HPMo) for biowaste to biofuel production Materials (Basel) 12 2019 1431 10.3390/ma12091431 A. de N. de Oliveira, M.A. Barbosa de Lima, L.H. de Oliveira Pires, M. Rosas da Silva, P.T. Souza da Luz, R.S. Angélica, G.N. da Rocha Filho, C.E. F. da Costa, R. Luque, L.A. Santos do Nascimento, Bentonites Modified with Phosphomolybdic Heteropolyacid (HPMo) for Biowaste to Biofuel Production, Materials (Basel). 12 (2019) 1431. doi:10.3390/ma12091431. [36] L.R.V. da Conceição L.M. Carneiro D.S. Giordani H.F. de Castro Synthesis of biodiesel from macaw palm oil using mesoporous solid catalyst comprising 12-molybdophosphoric acid and niobia Renew. Energy 113 2017 119 128 10.1016/j.renene.2017.05.080 L.R. V. da Conceição, L.M. Carneiro, D.S. Giordani, H.F. de Castro, Synthesis of biodiesel from macaw palm oil using mesoporous solid catalyst comprising 12-molybdophosphoric acid and niobia, Renew. Energy. 113 (2017) 119–128. doi:10.1016/j.renene.2017.05.080. [37] F.-F. Wang J. Liu H. Li C.-L. Liu R.-Z. Yang W.-S. Dong Conversion of cellulose to lactic acid catalyzed by erbium-exchanged montmorillonite K10 Green Chem. 17 2015 2455 2463 10.1039/C4GC02131B F.-F. Wang, J. Liu, H. Li, C.-L. Liu, R.-Z. Yang, W.-S. Dong, Conversion of cellulose to lactic acid catalyzed by erbium-exchanged montmorillonite K10, Green Chem. 17 (2015) 2455–2463. doi:10.1039/C4GC02131B. [38] A.C. Garade V.S. Kshirsagar R.B. Mane A.A. Ghalwadkar U.D. Joshi C.V. Rode Acidity tuning of montmorillonite K10 by impregnation with dodecatungstophosphoric acid and hydroxyalkylation of phenol Appl. Clay Sci. 48 2010 164 170 10.1016/j.clay.2009.11.042 A.C. Garade, V.S. Kshirsagar, R.B. Mane, A.A. Ghalwadkar, U.D. Joshi, C.V. Rode, Acidity tuning of montmorillonite K10 by impregnation with dodecatungstophosphoric acid and hydroxyalkylation of phenol, Appl. Clay Sci. 48 (2010) 164–170. doi:10.1016/j.clay.2009.11.042. [39] M. Ayoub A.Z. Abdullah LiOH-modified montmorillonite K-10 as catalyst for selective glycerol etherification to diglycerol Catal. Commun. 34 2013 22 25 10.1016/j.catcom.2013.01.007 M. Ayoub, A.Z. Abdullah, LiOH-modified montmorillonite K-10 as catalyst for selective glycerol etherification to diglycerol, Catal. Commun. 34 (2013) 22–25. doi:10.1016/j.catcom.2013.01.007. [40] G.B.B. Varadwaj S. Rana K. Parida B.B. Nayak A multi-functionalized montmorillonite for co-operative catalysis in one-pot Henry reaction and water pollution remediation J. Mater. Chem. A 2 2014 7526 10.1039/c4ta00042k G.B.B. Varadwaj, S. Rana, K. Parida, B.B. Nayak, A multi-functionalized montmorillonite for co-operative catalysis in one-pot Henry reaction and water pollution remediation, J. Mater. Chem. A. 2 (2014) 7526. doi:10.1039/c4ta00042k. [41] M.S. Tiwari G.D. Yadav Kinetics of Friedel-Crafts benzoylation of veratrole with benzoic anhydride using Cs2.5H0.5PW12O40/K-10 solid acid catalyst Chem. Eng. J. 266 2015 10.1016/j.cej.2014.12.043 M.S. Tiwari, G.D. Yadav, Kinetics of Friedel-Crafts benzoylation of veratrole with benzoic anhydride using Cs2.5H0.5PW12O40/K-10 solid acid catalyst, Chem. Eng. J. 266 (2015). doi:10.1016/j.cej.2014.12.043. [42] M.S. Tiwari G.D. Yadav Novel aluminium exchanged dodecatungstophosphoric acid supported on K-10 clay as catalyst: Benzoylation of diphenyloxide with benzoic anhydride RSC Adv. 6 2016 10.1039/c6ra05379c M.S. Tiwari, G.D. Yadav, Novel aluminium exchanged dodecatungstophosphoric acid supported on K-10 clay as catalyst: Benzoylation of diphenyloxide with benzoic anhydride, RSC Adv. 6 (2016). doi:10.1039/c6ra05379c. [44] Z. Mohammadbagheri A. Najafi Chermahini KCC-1/Pr-SO3H as an efficient heterogeneous catalyst for production of n-butyl levulinate from furfuryl alcohol J. Ind. Eng. Chem. 62 2018 401 408 10.1016/j.jiec.2018.01.020 Z. Mohammadbagheri, A. Najafi Chermahini, KCC-1/Pr-SO3H as an efficient heterogeneous catalyst for production of n-butyl levulinate from furfuryl alcohol, J. Ind. Eng. Chem. 62 (2018) 401–408. doi:10.1016/j.jiec.2018.01.020. [45] T. Baba H. Watanabe Y. Ono Generation of acidic sites in metal salts of heteropoly acids J. Phys. Chem. 87 1983 2406 2411 10.1021/j100236a033 T. Baba, H. Watanabe, Y. Ono, Generation of acidic sites in metal salts of heteropoly acids, J. Phys. Chem. 87 (1983) 2406–2411. doi:10.1021/j100236a033. [46] S. Banerjee K.K. Kar Aluminum-substituted phosphotungstic acid/sulfonated poly ether ether ketone nanocomposite membrane with reduced leaching and improved proton conductivity High Perform. Polym. 28 2016 1043 1058 10.1177/0954008315614984 S. Banerjee, K.K. Kar, Aluminum-substituted phosphotungstic acid/sulfonated poly ether ether ketone nanocomposite membrane with reduced leaching and improved proton conductivity, High Perform. Polym. 28 (2016) 1043–1058. doi:10.1177/0954008315614984. [47] N.K. Lazaridis D.D. Asouhidou Kinetics of sorptive removal of chromium(VI) from aqueous solutions by calcined Mg–Al–CO3 hydrotalcite Water Res. 37 2003 2875 2882 10.1016/S0043-1354(03)00119-2 N.K. Lazaridis, D.D. Asouhidou, Kinetics of sorptive removal of chromium(VI) from aqueous solutions by calcined Mg–Al–CO3 hydrotalcite, Water Res. 37 (2003) 2875–2882. doi:10.1016/S0043-1354(03)00119-2. [48] N. Déchamp A. Gamez A. Perrard P. Gallezot Kinetics of glucose hydrogenation in a trickle-bed reactor Catal. Today 24 1995 29 34 10.1016/0920-5861(95)00019-C N. Déchamp, A. Gamez, A. Perrard, P. Gallezot, Kinetics of glucose hydrogenation in a trickle-bed reactor, Catal. Today. 24 (1995) 29–34. doi:10.1016/0920-5861(95)00019-C. [49] J.N. Appaturi M.R. Johan R.J. Ramalingam H.A. Al-Lohedan J.J. Vijaya Efficient synthesis of butyl levulinate from furfuryl alcohol over ordered mesoporous Ti-KIT-6 catalysts for green chemistry applications RSC Adv. 7 2017 55206 55214 10.1039/C7RA10289E J.N. Appaturi, M.R. Johan, R.J. Ramalingam, H.A. Al-Lohedan, J.J. Vijaya, Efficient synthesis of butyl levulinate from furfuryl alcohol over ordered mesoporous Ti-KIT-6 catalysts for green chemistry applications, RSC Adv. 7 (2017) 55206–55214. doi:10.1039/C7RA10289E.",
      "scopus-id": "85082739737",
      "coredata": {
        "eid": "1-s2.0-S2468823120301723",
        "dc:description": "To decrease the dependence on crude oil, biomass derived liquid transportation fuels are highly desirable. Butyl levulinate is a potential cellulose-derived biofuel additive with properties similar to diesel and low water solubility. Herein we report a direct one-pot production of levulinic acid ester, butyl levulinate, from furfuryl alcohol by alcoholysis using n-butanol. The partial tin exchanged tungstophosphoric acid (TPA) supported on montmorillonite K-10 catalysts showed facile alcoholysis of furfuryl alcohol to levulinate ester under mild temperature conditions. Partially exchanging the H+ ion of TPA with Sn (x = 1) resulted in enhanced acidity of the catalyst and showed an increase in the catalytic activity as compared to TPA/K-10 catalyst. A series of tin exchanged tungstophosphoric acid (20 % w/w) supported on montmorillonite K-10 clay (Snx-TPA/K-10, where x = 0.5–1.5) were synthesized and thoroughly characterized by using XRD, FT-IR, UV-VIS, titration and SEM techniques. Among various catalysts, Sn1- TPA/K-10 was found to be the most active catalyst for butyl levulinate synthesis. Two different clay supports and varying tin loadings were used to study the effects on surface acidity as well as catalytic activity in butyl levulinate synthesis. Effects of different reaction parameters were studied and optimized to get high yields of butyl levulinate. Under mild reaction conditions at 110 °C, complete conversion of furfuryl alcohol with 98 % selectivity to butyl levulinate was achieved. The prepared catalyst could be recycled at least five times without significant loss of activity. The overall process is green and clean.",
        "openArchiveArticle": "false",
        "prism:coverDate": "2020-06-30",
        "openaccessUserLicense": null,
        "prism:aggregationType": "Journal",
        "prism:url": "https://api.elsevier.com/content/article/pii/S2468823120301723",
        "dc:creator": [
          {
            "@_fa": "true",
            "$": "Tiwari, Manishkumar S."
          },
          {
            "@_fa": "true",
            "$": "Dicks, Jennifer Sarah"
          },
          {
            "@_fa": "true",
            "$": "Keogh, John"
          },
          {
            "@_fa": "true",
            "$": "Ranade, Vivek V."
          },
          {
            "@_fa": "true",
            "$": "Manyar, Haresh G."
          }
        ],
        "link": [
          {
            "@_fa": "true",
            "@rel": "self",
            "@href": "https://api.elsevier.com/content/article/pii/S2468823120301723"
          },
          {
            "@_fa": "true",
            "@rel": "scidir",
            "@href": "https://www.sciencedirect.com/science/article/pii/S2468823120301723"
          }
        ],
        "dc:format": "application/json",
        "openaccessType": null,
        "pii": "S2468-8231(20)30172-3",
        "prism:volume": "488",
        "articleNumber": "110918",
        "prism:publisher": "Elsevier B.V.",
        "dc:title": "Direct conversion of furfuryl alcohol to butyl levulinate using tin exchanged tungstophosphoric acid catalysts",
        "prism:copyright": "© 2020 Elsevier B.V. All rights reserved.",
        "openaccess": "0",
        "prism:issn": "24688231",
        "dcterms:subject": [
          {
            "@_fa": "true",
            "$": "Butyl levulinate"
          },
          {
            "@_fa": "true",
            "$": "Furfuryl alcohol"
          },
          {
            "@_fa": "true",
            "$": "Tungstophosphoric acid"
          },
          {
            "@_fa": "true",
            "$": "Montmorillonite K-10"
          },
          {
            "@_fa": "true",
            "$": "Heteropoly acids"
          },
          {
            "@_fa": "true",
            "$": "Biofuels"
          }
        ],
        "openaccessArticle": "false",
        "prism:publicationName": "Molecular Catalysis",
        "openaccessSponsorType": null,
        "prism:pageRange": "110918",
        "pubType": "fla",
        "prism:coverDisplayDate": "June 2020",
        "prism:doi": "10.1016/j.mcat.2020.110918",
        "prism:startingPage": "110918",
        "dc:identifier": "doi:10.1016/j.mcat.2020.110918",
        "openaccessSponsorName": null
      },
      "objects": {
        "object": [
          {
            "@category": "standard",
            "@height": "9",
            "@width": "9",
            "@_fa": "true",
            "$": "https://api.elsevier.com/content/object/eid/1-s2.0-S2468823120301723-fx1.jpg?httpAccept=%2A%2F%2A",
            "@multimediatype": "JPEG image file",
            "@type": "IMAGE-DOWNSAMPLED",
            "@size": "397",
            "@ref": "fx1",
            "@mimetype": "image/jpeg"
          },
          {
            "@category": "thumbnail",
            "@height": "42",
            "@width": "42",
            "@_fa": "true",
            "$": "https://api.elsevier.com/content/object/eid/1-s2.0-S2468823120301723-fx1.sml?httpAccept=%2A%2F%2A",
            "@multimediatype": "GIF image file",
            "@type": "IMAGE-THUMBNAIL",
            "@size": "1864",
            "@ref": "fx1",
            "@mimetype": "image/gif"
          },
          {
            "@category": "standard",
            "@height": "9",
            "@width": "9",
            "@_fa": "true",
            "$": "https://api.elsevier.com/content/object/eid/1-s2.0-S2468823120301723-fx2.jpg?httpAccept=%2A%2F%2A",
            "@multimediatype": "JPEG image file",
            "@type": "IMAGE-DOWNSAMPLED",
            "@size": "398",
            "@ref": "fx2",
            "@mimetype": "image/jpeg"
          },
          {
            "@category": "thumbnail",
            "@height": "42",
            "@width": "41",
            "@_fa": "true",
            "$": "https://api.elsevier.com/content/object/eid/1-s2.0-S2468823120301723-fx2.sml?httpAccept=%2A%2F%2A",
            "@multimediatype": "GIF image file",
            "@type": "IMAGE-THUMBNAIL",
            "@size": "1916",
            "@ref": "fx2",
            "@mimetype": "image/gif"
          },
          {
            "@category": "standard",
            "@height": "9",
            "@width": "9",
            "@_fa": "true",
            "$": "https://api.elsevier.com/content/object/eid/1-s2.0-S2468823120301723-fx3.jpg?httpAccept=%2A%2F%2A",
            "@multimediatype": "JPEG image file",
            "@type": "IMAGE-DOWNSAMPLED",
            "@size": "344",
            "@ref": "fx3",
            "@mimetype": "image/jpeg"
          },
          {
            "@category": "thumbnail",
            "@height": "41",
            "@width": "42",
            "@_fa": "true",
            "$": "https://api.elsevier.com/content/object/eid/1-s2.0-S2468823120301723-fx3.sml?httpAccept=%2A%2F%2A",
            "@multimediatype": "GIF image file",
            "@type": "IMAGE-THUMBNAIL",
            "@size": "902",
            "@ref": "fx3",
            "@mimetype": "image/gif"
          },
          {
            "@category": "standard",
            "@height": "9",
            "@width": "9",
            "@_fa": "true",
            "$": "https://api.elsevier.com/content/object/eid/1-s2.0-S2468823120301723-fx4.jpg?httpAccept=%2A%2F%2A",
            "@multimediatype": "JPEG image file",
            "@type": "IMAGE-DOWNSAMPLED",
            "@size": "398",
            "@ref": "fx4",
            "@mimetype": "image/jpeg"
          },
          {
            "@category": "thumbnail",
            "@height": "41",
            "@width": "40",
            "@_fa": "true",
            "$": "https://api.elsevier.com/content/object/eid/1-s2.0-S2468823120301723-fx4.sml?httpAccept=%2A%2F%2A",
            "@multimediatype": "GIF image file",
            "@type": "IMAGE-THUMBNAIL",
            "@size": "1681",
            "@ref": "fx4",
            "@mimetype": "image/gif"
          },
          {
            "@category": "standard",
            "@height": "200",
            "@width": "346",
            "@_fa": "true",
            "$": "https://api.elsevier.com/content/object/eid/1-s2.0-S2468823120301723-ga1.jpg?httpAccept=%2A%2F%2A",
            "@multimediatype": "JPEG image file",
            "@type": "IMAGE-DOWNSAMPLED",
            "@size": "29198",
            "@ref": "ga1",
            "@mimetype": "image/jpeg"
          },
          {
            "@category": "thumbnail",
            "@height": "127",
            "@width": "219",
            "@_fa": "true",
            "$": "https://api.elsevier.com/content/object/eid/1-s2.0-S2468823120301723-ga1.sml?httpAccept=%2A%2F%2A",
            "@multimediatype": "GIF image file",
            "@type": "IMAGE-THUMBNAIL",
            "@size": "14107",
            "@ref": "ga1",
            "@mimetype": "image/gif"
          },
          {
            "@category": "standard",
            "@height": "450",
            "@width": "753",
            "@_fa": "true",
            "$": "https://api.elsevier.com/content/object/eid/1-s2.0-S2468823120301723-gr1.jpg?httpAccept=%2A%2F%2A",
            "@multimediatype": "JPEG image file",
            "@type": "IMAGE-DOWNSAMPLED",
            "@size": "72316",
            "@ref": "gr1",
            "@mimetype": "image/jpeg"
          },
          {
            "@category": "thumbnail",
            "@height": "131",
            "@width": "219",
            "@_fa": "true",
            "$": "https://api.elsevier.com/content/object/eid/1-s2.0-S2468823120301723-gr1.sml?httpAccept=%2A%2F%2A",
            "@multimediatype": "GIF image file",
            "@type": "IMAGE-THUMBNAIL",
            "@size": "9263",
            "@ref": "gr1",
            "@mimetype": "image/gif"
          },
          {
            "@category": "standard",
            "@height": "353",
            "@width": "376",
            "@_fa": "true",
            "$": "https://api.elsevier.com/content/object/eid/1-s2.0-S2468823120301723-gr2.jpg?httpAccept=%2A%2F%2A",
            "@multimediatype": "JPEG image file",
            "@type": "IMAGE-DOWNSAMPLED",
            "@size": "28460",
            "@ref": "gr2",
            "@mimetype": "image/jpeg"
          },
          {
            "@category": "thumbnail",
            "@height": "163",
            "@width": "174",
            "@_fa": "true",
            "$": "https://api.elsevier.com/content/object/eid/1-s2.0-S2468823120301723-gr2.sml?httpAccept=%2A%2F%2A",
            "@multimediatype": "GIF image file",
            "@type": "IMAGE-THUMBNAIL",
            "@size": "6872",
            "@ref": "gr2",
            "@mimetype": "image/gif"
          },
          {
            "@category": "standard",
            "@height": "258",
            "@width": "375",
            "@_fa": "true",
            "$": "https://api.elsevier.com/content/object/eid/1-s2.0-S2468823120301723-gr3.jpg?httpAccept=%2A%2F%2A",
            "@multimediatype": "JPEG image file",
            "@type": "IMAGE-DOWNSAMPLED",
            "@size": "15087",
            "@ref": "gr3",
            "@mimetype": "image/jpeg"
          },
          {
            "@category": "thumbnail",
            "@height": "151",
            "@width": "219",
            "@_fa": "true",
            "$": "https://api.elsevier.com/content/object/eid/1-s2.0-S2468823120301723-gr3.sml?httpAccept=%2A%2F%2A",
            "@multimediatype": "GIF image file",
            "@type": "IMAGE-THUMBNAIL",
            "@size": "5349",
            "@ref": "gr3",
            "@mimetype": "image/gif"
          },
          {
            "@category": "standard",
            "@height": "718",
            "@width": "678",
            "@_fa": "true",
            "$": "https://api.elsevier.com/content/object/eid/1-s2.0-S2468823120301723-gr4.jpg?httpAccept=%2A%2F%2A",
            "@multimediatype": "JPEG image file",
            "@type": "IMAGE-DOWNSAMPLED",
            "@size": "126142",
            "@ref": "gr4",
            "@mimetype": "image/jpeg"
          },
          {
            "@category": "thumbnail",
            "@height": "164",
            "@width": "155",
            "@_fa": "true",
            "$": "https://api.elsevier.com/content/object/eid/1-s2.0-S2468823120301723-gr4.sml?httpAccept=%2A%2F%2A",
            "@multimediatype": "GIF image file",
            "@type": "IMAGE-THUMBNAIL",
            "@size": "14107",
            "@ref": "gr4",
            "@mimetype": "image/gif"
          },
          {
            "@category": "standard",
            "@height": "300",
            "@width": "678",
            "@_fa": "true",
            "$": "https://api.elsevier.com/content/object/eid/1-s2.0-S2468823120301723-gr5.jpg?httpAccept=%2A%2F%2A",
            "@multimediatype": "JPEG image file",
            "@type": "IMAGE-DOWNSAMPLED",
            "@size": "30313",
            "@ref": "gr5",
            "@mimetype": "image/jpeg"
          },
          {
            "@category": "thumbnail",
            "@height": "97",
            "@width": "219",
            "@_fa": "true",
            "$": "https://api.elsevier.com/content/object/eid/1-s2.0-S2468823120301723-gr5.sml?httpAccept=%2A%2F%2A",
            "@multimediatype": "GIF image file",
            "@type": "IMAGE-THUMBNAIL",
            "@size": "3916",
            "@ref": "gr5",
            "@mimetype": "image/gif"
          },
          {
            "@category": "standard",
            "@height": "304",
            "@width": "678",
            "@_fa": "true",
            "$": "https://api.elsevier.com/content/object/eid/1-s2.0-S2468823120301723-gr6.jpg?httpAccept=%2A%2F%2A",
            "@multimediatype": "JPEG image file",
            "@type": "IMAGE-DOWNSAMPLED",
            "@size": "31056",
            "@ref": "gr6",
            "@mimetype": "image/jpeg"
          },
          {
            "@category": "thumbnail",
            "@height": "98",
            "@width": "219",
            "@_fa": "true",
            "$": "https://api.elsevier.com/content/object/eid/1-s2.0-S2468823120301723-gr6.sml?httpAccept=%2A%2F%2A",
            "@multimediatype": "GIF image file",
            "@type": "IMAGE-THUMBNAIL",
            "@size": "4137",
            "@ref": "gr6",
            "@mimetype": "image/gif"
          },
          {
            "@category": "standard",
            "@height": "308",
            "@width": "678",
            "@_fa": "true",
            "$": "https://api.elsevier.com/content/object/eid/1-s2.0-S2468823120301723-gr7.jpg?httpAccept=%2A%2F%2A",
            "@multimediatype": "JPEG image file",
            "@type": "IMAGE-DOWNSAMPLED",
            "@size": "29155",
            "@ref": "gr7",
            "@mimetype": "image/jpeg"
          },
          {
            "@category": "thumbnail",
            "@height": "100",
            "@width": "219",
            "@_fa": "true",
            "$": "https://api.elsevier.com/content/object/eid/1-s2.0-S2468823120301723-gr7.sml?httpAccept=%2A%2F%2A",
            "@multimediatype": "GIF image file",
            "@type": "IMAGE-THUMBNAIL",
            "@size": "3817",
            "@ref": "gr7",
            "@mimetype": "image/gif"
          },
          {
            "@category": "standard",
            "@height": "275",
            "@width": "678",
            "@_fa": "true",
            "$": "https://api.elsevier.com/content/object/eid/1-s2.0-S2468823120301723-gr8.jpg?httpAccept=%2A%2F%2A",
            "@multimediatype": "JPEG image file",
            "@type": "IMAGE-DOWNSAMPLED",
            "@size": "26739",
            "@ref": "gr8",
            "@mimetype": "image/jpeg"
          },
          {
            "@category": "thumbnail",
            "@height": "89",
            "@width": "219",
            "@_fa": "true",
            "$": "https://api.elsevier.com/content/object/eid/1-s2.0-S2468823120301723-gr8.sml?httpAccept=%2A%2F%2A",
            "@multimediatype": "GIF image file",
            "@type": "IMAGE-THUMBNAIL",
            "@size": "4181",
            "@ref": "gr8",
            "@mimetype": "image/gif"
          },
          {
            "@category": "standard",
            "@height": "324",
            "@width": "753",
            "@_fa": "true",
            "$": "https://api.elsevier.com/content/object/eid/1-s2.0-S2468823120301723-sc1.jpg?httpAccept=%2A%2F%2A",
            "@multimediatype": "JPEG image file",
            "@type": "IMAGE-DOWNSAMPLED",
            "@size": "28575",
            "@ref": "sc1",
            "@mimetype": "image/jpeg"
          },
          {
            "@category": "thumbnail",
            "@height": "94",
            "@width": "219",
            "@_fa": "true",
            "$": "https://api.elsevier.com/content/object/eid/1-s2.0-S2468823120301723-sc1.sml?httpAccept=%2A%2F%2A",
            "@multimediatype": "GIF image file",
            "@type": "IMAGE-THUMBNAIL",
            "@size": "3224",
            "@ref": "sc1",
            "@mimetype": "image/gif"
          },
          {
            "@category": "standard",
            "@_fa": "true",
            "$": "https://api.elsevier.com/content/object/eid/1-s2.0-S2468823120301723-am.pdf?httpAccept=%2A%2F%2A",
            "@multimediatype": "Acrobat PDF file",
            "@type": "AAM-PDF",
            "@size": "1660220",
            "@ref": "am",
            "@mimetype": "application/pdf"
          }
        ]
      },
      "link": {
        "@rel": "abstract",
        "@href": "https://api.elsevier.com/content/abstract/scopus_id/85082739737"
      }
    }
  }
}