{
  "metadata": {
    "title": "Electrochemical activation of Ru catalyst with alkaline ion conductors for the catalytic decomposition of ammonia",
    "authors": "; ; ",
    "journal": "Molecular Catalysis",
    "date": "2021-07-31",
    "doi": "10.1016/j.mcat.2021.111721",
    "abstract": "",
    "uri": "https://api.elsevier.com/content/article/pii/S2468823121003382",
    "pii": "S2468823121003382"
  },
  "fulltext": {
    "full-text-retrieval-response": {
      "scopus-eid": "2-s2.0-85109424241",
      "originalText": "serial JL 315758 291210 291744 291790 291809 31 90 Molecular Catalysis MOLECULARCATALYSIS 2021-07-08 2021-07-08 2021-07-08 2021-07-08 2021-09-21T23:55:52 1-s2.0-S2468823121003382 S2468-8231(21)00338-2 S2468823121003382 10.1016/j.mcat.2021.111721 S300 S300.1 FULL-TEXT 1-s2.0-S2468823121X00119 2021-09-21T23:13:22.395597Z 0 0 20210701 20210731 2021 2021-07-08T23:13:26.809679Z articleinfo articlenumber articletitlenorm authfirstinitialnorm authfirstsurnamenorm cid cids contenttype copyright crossmark dateloaded dateloadedtxt datesearch datesort dateupdated dco docsubtype doctype doi eid ewtransactionid fundingbodyid hubeid indexeddate issn issnnorm itemstage itemtransactionid itemweight oauserlicense openaccess openarchive pg pgfirst pii piinorm pubdateend pubdatestart pubdatetxt pubyr sectiontitle sortorder sponsoredaccesstype srctitle srctitlenorm srctype ssids alllist content oa subj subheadings suppl tomb volfirst volissue volumelist webpdf webpdfpagecount yearnav figure e-component body mmlmath acknowledge affil appendices articletitle auth authfirstini authfull authkeywords authlast grantnumber grantsponsor grantsponsorid highlightsabst orcid primabst ref 2468-8231 24688231 UNLIMITED SPLAMAN21 true 511 511 C Volume 511 4 111721 111721 111721 202107 July 2021 2021-07-01 2021-07-31 2021 Regular Papers article fla © 2021 The Authors. Published by Elsevier B.V. ELECTROCHEMICALACTIVATIONRUCATALYSTALKALINEIONCONDUCTORSFORCATALYTICDECOMPOSITIONAMMONIA PINZON M 1 Introduction 2 Experimental 2.1 Electrochemical catalysts preparation 2.2 Ex-situ characterization of the electrochemical catalysts 2.3 Electrocatalytic tests 3 Results and discussion 3.1 Electrochemical catalyst characterization 3.2 Electrochemical activation of Ru catalyst with Na+ ions 3.3 Electrochemical activation of Ru catalyst with K+ ions 3.4 Cyclic voltammetry measurements 4 Conclusions CRediT authorship contribution statement Acknowledgments Appendix Supplementary materials References ABDIN 2020 109620 Z MAZLOOMI 2012 3024 3033 K WAN 2021 228 Z NIAZ 2015 457 469 S MALEKI 2021 128595 H LE 2021 119831 T PINZON 2021 326 335 M LUCENTINI 2021 286 I HUANG 2019 928 936 C KOCER 2021 610 T WANG 2019 7300 7307 Z BAJUS 2016 189 195 S JU 2019 4161 4170 X IM 2020 26979 26988 Y STOUKIDES 1981 137 146 M LOPEZ 2019 355 364 E PITSELIS 1997 110 116 G CARAVACA 2020 1276 A DIEZRAMIREZ 2017 8844 8851 J GONZALEZCOBOS 2017 13712 13723 J GRIGORIOU 2021 122 127 D PANARITIS 2020 350 C DELUCASCONSUEGRA 2011 6 9 A PANARITIS 2020 119 C ZAGORAIOS 2020 14916 14927 D DELUCASCONSUEGRA 2013 18 26 A GONZALEZCOBOS 2015 2203 2214 J DORADO 2007 42 50 F THELERITIS 2012 770 780 D DELUCASCONSUEGRA 2009 330 335 A LAROSA 2010 1390 1397 D DELUCASCONSUEGRA 2009 274 280 A ESPINOS 2018 27 34 J VAYENAS 1992 303 438 C DELUCASCONSUEGRA 2007 474 484 A VERNOUX 2013 8192 8260 P PEKRIDIS 2011 653 658 G ARMENISE 2013 12104 S VAYENAS 2002 C ELECTROCHEMICALACTIVATIONCATALYSIS DORADO 2007 86 92 F YENTEKAKIS 1997 3759 3768 I DELUCASCONSUEGRA 2015 25 37 A MAKRI 2015 556 564 M LANG 1985 24 38 N WILLIAMS 2002 5668 5672 F DIEZRAMIREZ 2016 375 383 J WANG 2004 287 299 S PALERMO 2002 331 340 A HILL 2014 7646 7654 A YIN 2004 384 396 S VERNOUX 2004 609 613 P PINZONX2021X111721 PINZONX2021X111721XM Full 2021-07-09T12:14:37Z FundingBody SPAIN 2021: Universidad De Castilla - La Mancha http://creativecommons.org/licenses/by-nc-nd/4.0/ 2023-07-08T00:00:00.000Z 2023-07-08T00:00:00.000Z http://creativecommons.org/licenses/by-nc-nd/4.0/ This is an open access article under the CC BY-NC-ND license. © 2021 The Authors. Published by Elsevier B.V. 2021-07-14T02:08:03.073Z http://vtw.elsevier.com/data/voc/AddOnTypes/50.7/aggregated-refined FEDER SBPLY/180501/000281 ERDF European Regional Development Fund http://data.elsevier.com/vocabulary/SciValFunders/501100008530 http://sws.geonames.org/6695072/ Regional Government of Castilla-La Mancha JCCM Junta de Comunidades de Castilla-La Mancha http://data.elsevier.com/vocabulary/SciValFunders/501100011698 http://sws.geonames.org/2510769/ European Union EC European Commission http://data.elsevier.com/vocabulary/SciValFunders/501100000780 http://sws.geonames.org/6695072/ This work was supported by the Regional Government of Castilla-La Mancha and the European Union [FEDER funds SBPLY/180501/000281 ]. 0 item S2468-8231(21)00338-2 S2468823121003382 1-s2.0-S2468823121003382 10.1016/j.mcat.2021.111721 315758 2021-09-21T23:13:22.395597Z 2021-07-01 2021-07-31 UNLIMITED SPLAMAN21 1-s2.0-S2468823121003382-main.pdf https://s3-eu-west-1.amazonaws.com/prod-ucs-content-store-eu-west/content/pii:S2468823121003382/MAIN/application/pdf/5655ee1b69e9d14fab91e88be58a63c3/main.pdf main.pdf pdf true 6025223 MAIN 9 1-s2.0-S2468823121003382-main_1.png https://s3-eu-west-1.amazonaws.com/prod-ucs-content-store-eu-west/content/pii:S2468823121003382/PREVIEW/image/png/1297deaad4f715aaf58215d525648b50/main_1.png main_1.png png 60016 849 656 IMAGE-WEB-PDF 1 1-s2.0-S2468823121003382-gr5.jpg https://s3-eu-west-1.amazonaws.com/prod-ucs-content-store-eu-west/content/pii:S2468823121003382/gr5/DOWNSAMPLED/image/jpeg/5fa3b0e633ae933369f779c4f590ff71/gr5.jpg gr5 gr5.jpg jpg 33095 374 376 IMAGE-DOWNSAMPLED 1-s2.0-S2468823121003382-gr6.jpg https://s3-eu-west-1.amazonaws.com/prod-ucs-content-store-eu-west/content/pii:S2468823121003382/gr6/DOWNSAMPLED/image/jpeg/a5b0b3c24f9b724ef185f326e61cd453/gr6.jpg gr6 gr6.jpg jpg 35648 370 339 IMAGE-DOWNSAMPLED 1-s2.0-S2468823121003382-gr7.jpg https://s3-eu-west-1.amazonaws.com/prod-ucs-content-store-eu-west/content/pii:S2468823121003382/gr7/DOWNSAMPLED/image/jpeg/3a058b2d55feab1858b73e7f17860f9a/gr7.jpg gr7 gr7.jpg jpg 32845 339 339 IMAGE-DOWNSAMPLED 1-s2.0-S2468823121003382-gr1.jpg https://s3-eu-west-1.amazonaws.com/prod-ucs-content-store-eu-west/content/pii:S2468823121003382/gr1/DOWNSAMPLED/image/jpeg/c769a2cfbe43a6231d29586f9c4fc32f/gr1.jpg gr1 gr1.jpg jpg 40616 400 376 IMAGE-DOWNSAMPLED 1-s2.0-S2468823121003382-gr2.jpg https://s3-eu-west-1.amazonaws.com/prod-ucs-content-store-eu-west/content/pii:S2468823121003382/gr2/DOWNSAMPLED/image/jpeg/753dbb18753bd73a67e093df1d76719b/gr2.jpg gr2 gr2.jpg jpg 225065 775 565 IMAGE-DOWNSAMPLED 1-s2.0-S2468823121003382-gr3.jpg https://s3-eu-west-1.amazonaws.com/prod-ucs-content-store-eu-west/content/pii:S2468823121003382/gr3/DOWNSAMPLED/image/jpeg/7dff4af5b98110c0b81baa6cb8d30c35/gr3.jpg gr3 gr3.jpg jpg 27531 356 357 IMAGE-DOWNSAMPLED 1-s2.0-S2468823121003382-gr4.jpg https://s3-eu-west-1.amazonaws.com/prod-ucs-content-store-eu-west/content/pii:S2468823121003382/gr4/DOWNSAMPLED/image/jpeg/36414b08f56ea9414dbaa8a5be50b625/gr4.jpg gr4 gr4.jpg jpg 28734 372 339 IMAGE-DOWNSAMPLED 1-s2.0-S2468823121003382-gr5.sml https://s3-eu-west-1.amazonaws.com/prod-ucs-content-store-eu-west/content/pii:S2468823121003382/gr5/THUMBNAIL/image/gif/bb2db0188fca24af0f2ad9c0b375f64c/gr5.sml gr5 gr5.sml sml 8636 164 165 IMAGE-THUMBNAIL 1-s2.0-S2468823121003382-gr6.sml https://s3-eu-west-1.amazonaws.com/prod-ucs-content-store-eu-west/content/pii:S2468823121003382/gr6/THUMBNAIL/image/gif/9845765d9d03a56f2d806b7e64f8a2b5/gr6.sml gr6 gr6.sml sml 8596 164 150 IMAGE-THUMBNAIL 1-s2.0-S2468823121003382-gr7.sml https://s3-eu-west-1.amazonaws.com/prod-ucs-content-store-eu-west/content/pii:S2468823121003382/gr7/THUMBNAIL/image/gif/633db13ca1b79ae45bb36635234bf5f5/gr7.sml gr7 gr7.sml sml 8920 164 164 IMAGE-THUMBNAIL 1-s2.0-S2468823121003382-gr1.sml https://s3-eu-west-1.amazonaws.com/prod-ucs-content-store-eu-west/content/pii:S2468823121003382/gr1/THUMBNAIL/image/gif/bb73de3d8e6f8dac0bb5330e8a4e0504/gr1.sml gr1 gr1.sml sml 10410 164 154 IMAGE-THUMBNAIL 1-s2.0-S2468823121003382-gr2.sml https://s3-eu-west-1.amazonaws.com/prod-ucs-content-store-eu-west/content/pii:S2468823121003382/gr2/THUMBNAIL/image/gif/d5262b72415a7aacf198456d1e64dfee/gr2.sml gr2 gr2.sml sml 19544 163 119 IMAGE-THUMBNAIL 1-s2.0-S2468823121003382-gr3.sml https://s3-eu-west-1.amazonaws.com/prod-ucs-content-store-eu-west/content/pii:S2468823121003382/gr3/THUMBNAIL/image/gif/af2c6e3a697ac6c14f8b1d2fec59f68a/gr3.sml gr3 gr3.sml sml 7763 163 164 IMAGE-THUMBNAIL 1-s2.0-S2468823121003382-gr4.sml https://s3-eu-west-1.amazonaws.com/prod-ucs-content-store-eu-west/content/pii:S2468823121003382/gr4/THUMBNAIL/image/gif/f1c8608d3022a593226eb7139334247f/gr4.sml gr4 gr4.sml sml 7509 164 149 IMAGE-THUMBNAIL 1-s2.0-S2468823121003382-gr5_lrg.jpg https://s3-eu-west-1.amazonaws.com/prod-ucs-content-store-eu-west/content/pii:S2468823121003382/gr5/HIGHRES/image/jpeg/5ba2f8c9a2b0676465d8559458197663/gr5_lrg.jpg gr5 gr5_lrg.jpg jpg 210422 1658 1667 IMAGE-HIGH-RES 1-s2.0-S2468823121003382-gr6_lrg.jpg https://s3-eu-west-1.amazonaws.com/prod-ucs-content-store-eu-west/content/pii:S2468823121003382/gr6/HIGHRES/image/jpeg/0b353c6d559b908d498d6e76e9ddf605/gr6_lrg.jpg gr6 gr6_lrg.jpg jpg 261668 1637 1500 IMAGE-HIGH-RES 1-s2.0-S2468823121003382-gr7_lrg.jpg https://s3-eu-west-1.amazonaws.com/prod-ucs-content-store-eu-west/content/pii:S2468823121003382/gr7/HIGHRES/image/jpeg/ed1849c440e35aa4a612e0f846ce2bf5/gr7_lrg.jpg gr7 gr7_lrg.jpg jpg 214801 1500 1500 IMAGE-HIGH-RES 1-s2.0-S2468823121003382-gr1_lrg.jpg https://s3-eu-west-1.amazonaws.com/prod-ucs-content-store-eu-west/content/pii:S2468823121003382/gr1/HIGHRES/image/jpeg/f03155b01eb74a5147342cba202a2a43/gr1_lrg.jpg gr1 gr1_lrg.jpg jpg 302012 1774 1667 IMAGE-HIGH-RES 1-s2.0-S2468823121003382-gr2_lrg.jpg https://s3-eu-west-1.amazonaws.com/prod-ucs-content-store-eu-west/content/pii:S2468823121003382/gr2/HIGHRES/image/jpeg/44603a0353f2f32ea5908ed0014f845b/gr2_lrg.jpg gr2 gr2_lrg.jpg jpg 2210683 3427 2500 IMAGE-HIGH-RES 1-s2.0-S2468823121003382-gr3_lrg.jpg https://s3-eu-west-1.amazonaws.com/prod-ucs-content-store-eu-west/content/pii:S2468823121003382/gr3/HIGHRES/image/jpeg/83c5d7e32646aaedceeec6c144a1fa60/gr3_lrg.jpg gr3 gr3_lrg.jpg jpg 174467 1578 1583 IMAGE-HIGH-RES 1-s2.0-S2468823121003382-gr4_lrg.jpg https://s3-eu-west-1.amazonaws.com/prod-ucs-content-store-eu-west/content/pii:S2468823121003382/gr4/HIGHRES/image/jpeg/ad57ff0058a6abee917a529f6214f967/gr4_lrg.jpg gr4 gr4_lrg.jpg jpg 189813 1648 1500 IMAGE-HIGH-RES 1-s2.0-S2468823121003382-mmc1.docx https://s3-eu-west-1.amazonaws.com/prod-ucs-content-store-eu-west/content/pii:S2468823121003382/mmc1/MAIN/application/vnd.openxmlformats-officedocument.wordprocessingml.document/27c372019a502108d107a4199a923f5c/mmc1.docx mmc1 mmc1.docx docx 1570464 APPLICATION 1-s2.0-S2468823121003382-si1.svg https://s3-eu-west-1.amazonaws.com/prod-ucs-content-store-eu-west/content/pii:S2468823121003382/STRIPIN/image/svg+xml/23baeabc24bd279c1060af2556cc6dcd/si1.svg si1 si1.svg svg 7411 ALTIMG 1-s2.0-S2468823121003382-si10.svg https://s3-eu-west-1.amazonaws.com/prod-ucs-content-store-eu-west/content/pii:S2468823121003382/STRIPIN/image/svg+xml/20a2a44ab3e3c4b704b14fd530a1d7b5/si10.svg si10 si10.svg svg 11466 ALTIMG 1-s2.0-S2468823121003382-si11.svg https://s3-eu-west-1.amazonaws.com/prod-ucs-content-store-eu-west/content/pii:S2468823121003382/STRIPIN/image/svg+xml/bb356bad99c86f26ea73f2db8856c8ae/si11.svg si11 si11.svg svg 11731 ALTIMG 1-s2.0-S2468823121003382-si12.svg https://s3-eu-west-1.amazonaws.com/prod-ucs-content-store-eu-west/content/pii:S2468823121003382/STRIPIN/image/svg+xml/7be5347bd8612bbde7f2161d2ef1f4ea/si12.svg si12 si12.svg svg 2639 ALTIMG 1-s2.0-S2468823121003382-si2.svg https://s3-eu-west-1.amazonaws.com/prod-ucs-content-store-eu-west/content/pii:S2468823121003382/STRIPIN/image/svg+xml/adb53611128f9a564035ccc1631f2087/si2.svg si2 si2.svg svg 3531 ALTIMG 1-s2.0-S2468823121003382-si3.svg https://s3-eu-west-1.amazonaws.com/prod-ucs-content-store-eu-west/content/pii:S2468823121003382/STRIPIN/image/svg+xml/e9fa49caf780a202943fe65eff908f83/si3.svg si3 si3.svg svg 12079 ALTIMG 1-s2.0-S2468823121003382-si4.svg https://s3-eu-west-1.amazonaws.com/prod-ucs-content-store-eu-west/content/pii:S2468823121003382/STRIPIN/image/svg+xml/2bc6a303d348c5c56f71cfc056de9801/si4.svg si4 si4.svg svg 4650 ALTIMG 1-s2.0-S2468823121003382-si5.svg https://s3-eu-west-1.amazonaws.com/prod-ucs-content-store-eu-west/content/pii:S2468823121003382/STRIPIN/image/svg+xml/f830f8b3ca00a8282b59fa83e968aa92/si5.svg si5 si5.svg svg 5042 ALTIMG 1-s2.0-S2468823121003382-si6.svg https://s3-eu-west-1.amazonaws.com/prod-ucs-content-store-eu-west/content/pii:S2468823121003382/STRIPIN/image/svg+xml/e607ef4c9f83979f96c918b562cbb8f7/si6.svg si6 si6.svg svg 10976 ALTIMG 1-s2.0-S2468823121003382-si7.svg https://s3-eu-west-1.amazonaws.com/prod-ucs-content-store-eu-west/content/pii:S2468823121003382/STRIPIN/image/svg+xml/118ae312dd6ec8f85f1c050c0b95111e/si7.svg si7 si7.svg svg 11230 ALTIMG 1-s2.0-S2468823121003382-si8.svg https://s3-eu-west-1.amazonaws.com/prod-ucs-content-store-eu-west/content/pii:S2468823121003382/STRIPIN/image/svg+xml/fd5aef18ce5393a5c036583555546cb9/si8.svg si8 si8.svg svg 11313 ALTIMG 1-s2.0-S2468823121003382-si9.svg https://s3-eu-west-1.amazonaws.com/prod-ucs-content-store-eu-west/content/pii:S2468823121003382/STRIPIN/image/svg+xml/0cbd8bf75557c389a0d78edfa0cc7e3b/si9.svg si9 si9.svg svg 9451 ALTIMG 1-s2.0-S2468823121003382-am.pdf https://s3-eu-west-1.amazonaws.com/prod-ucs-content-store-eu-west/content/egi:10N0DTN4MDZ/MAIN/application/pdf/0e3340d6c8aa3e27f22c9faa35bb93ee/am.pdf am am.pdf pdf false 1635790 AAM-PDF MCAT 111721 111721 S2468-8231(21)00338-2 10.1016/j.mcat.2021.111721 The Authors Fig. 1 XRD pattern for Ru/Na-βAl2O3 electrochemical catalysts reduced at 400 °C before and after ammonia decomposition reaction. Fig. 1 Fig. 2 SEM-EDX for Ru/Na-bAl2O3 electrochemical catalyst reduced at 400 °C before (a, b and c) and, after ammonia decomposition reaction (d, e and f). Fig. 2 Fig. 3 Dynamic response of hydrogen production rate vs. applied potential at 300 °C for Ru/Na-βAl2O3. Fig. 3 Fig. 4 Steady state of ammonia conversion vs. the applied potential for Ru-Na/βAl2O3 at different reaction temperatures. Fig. 4 Fig. 5 Dynamic response of hydrogen production rate vs. applied potential at 300 °C and 320 °C for Ru/K-βAl2O3. Fig. 5 Fig. 6 Ammonia conversion variation under temperature programmed reaction experiments (2 °C·min−1) under different applied potentials for Ru/K-βAl2O3 electrochemical catalyst. Fig. 6 Fig. 7 Current variation and hydrogen production rate vs. applied potential during cyclic voltammetry between +2 V and −2 V for Ru/K-βAl2O3. T = 280 °C and scan rate = 5 mV·s− 1. Fig. 7 Electrochemical activation of Ru catalyst with alkaline ion conductors for the catalytic decomposition of ammonia M. Pinzón Investigation Methodology Validation Visualization Writing – original draft E. Ruiz-López Investigation Methodology A. Romero Conceptualization Visualization Writing – review & editing Supervision Funding acquisition A.R. de la Osa Conceptualization Visualization Writing – review & editing Supervision Funding acquisition P. Sánchez Conceptualization Visualization Writing – review & editing Supervision Funding acquisition A. de Lucas-Consuegra Conceptualization Visualization Writing – review & editing Supervision Funding acquisition ⁎ Department of Chemical Engineering, School of Chemical Sciences and Technologies, University of Castilla-La Mancha, Avda. Camilo José Cela 12, E-13071, Ciudad Real, Spain Department of Chemical Engineering School of Chemical Sciences and Technologies University of Castilla-La Mancha Avda. Camilo José Cela 12 Ciudad Real E-13071 Spain Department of Chemical Engineering, School of Chemical Sciences and Technologies, University of Castilla-La Mancha, Avda. Camilo José Cela 12, E-13071, Ciudad Real, Spain ⁎ Corresponding author. This study reports the electrochemical activation (EPOC) of ruthenium catalyst film with alkaline ion conductors for hydrogen production via catalytic decomposition of ammonia. Two electrocatalysts, Ru/Na-βAl2O3 and Ru/K-βAl2O3 have been prepared, characterized, and tested under low temperature reaction conditions (250–350 °C). The electrochemically supply of moderate amounts of alkaline ions (Na+ and K+) from the solid electrolyte support to the ruthenium catalyst film, activated the hydrogen production rate. The promotional effect has been attributed to a strengthening of the chemisorptive bond of weakly adsorbed N surface species, which stabilizes N adsorbed molecules on the ruthenium catalyst surface and thus facilitating the ammonia decomposition reaction. Among the two alkali ions, the effect of potassium was stronger, increasing the hydrogen production rate above 230% at 300 °C under optimally conditions. Temperature programmed reaction experiments also confirms the interest of EPOC for the activation of the catalyst at low temperatures. Keywords Electrochemical promotion EPOC Ammonia decomposition Hydrogen production Ruthenium 1 Introduction An imminent decarbonization of the energy sector is needed in order to reduce the environmental damage caused by fossil fuel. As a result, clean, sustainable and renewable energy sources appear to be potential alternatives. In fact, the development of hydrogen-based technologies can help to reduce or eliminate greenhouse gas emission. In this sense, hydrogen (H2) possesses the highest specific energy content among all conventional fuels and, it can be used as a green energy carrier using fuel cells and internal combustion engines by releasing only nontoxic by-products such as water [1]. However, the main drawback related to this compound is its low volumetric energy density which increases storage and transport costs [2]. An alternative to remove these issues is the use of hydrogen carrier compounds. In this respect, liquid fuels generated from hydrogen (ammonia, methanol, metal amine salts, etc.) might be easily stored and transported to be in situ decomposed to produce clean hydrogen through suitable conversion processes [3,4]. Ammonia (NH3) is a promising hydrogen carrier because of its high volumetric energy density and high hydrogen content, well-known technology for production and distribution and relatively low cost [5]. Moreover, its decomposition only produces hydrogen and nitrogen. Therefore, ammonia is an exceptional carbon-free hydrogen vector. However, fuel cells which are very sensitive to ammonia concentration (<1 ppm), demand high purity hydrogen [6]. Thus, almost complete ammonia conversion is required at relatively low temperature (<500 °C). For that purpose, hydrogen production from ammonia decomposition requires efficient and low-cost catalysts to reduce the reaction temperature and the energy cost of the process. Promising results of ammonia decomposition at low temperatures are achieved with ruthenium (Ru) catalysts [6–8]. Nevertheless, catalytic activity is very affected by other factors such as the size of metal particles since it is a structure-sensitive reaction [7,8]. Consequently, hydrogen production from ammonia has been widely studied using different types of active phases (Ni, Co, Rh, Pd, Pt, etc.) and supports such as Al2O3, SiC, ZrO2, CeO2, La2O3, MgO and carbonaceous materials [6–13]. Moreover, different types of promoters have been investigated to enhance the catalytic activity by adding alkaline species to the active phase [11–14]. In fact, these promoters increase the electron-donation to the active metals and stabilize the binding energy between metal and N atoms, favouring ammonia decomposition reaction. In recent years, a novel route for adding promoters to heterogeneous catalyst has been developed through the phenomenon of Electrochemical Promotion of Catalysis (EPOC). This phenomenon discovered by Stoukides and Vayenas in 1981 [15] is a promising alternative way to explore the in-situ addition of electronic promoters to a heterogeneous catalyst and hence, to enhance catalytic reaction rates [16–18]. This phenomenon is based on the electrochemical supply of promoter ions from a solid electrolyte material (support) to a metal catalyst (working electrode) by the application of electrical currents or potentials. This electrochemical activation of the catalyst by using a solid electrolyte support allows the in-situ electrochemical addition or removal of a wide variety of promoters, anionic (O2−) or cationic (Na+, K+, H+) to different kinds of catalysts in a wide range of catalytic reactions [16,17,19–22]. The EPOC phenomenon has been widely investigated for different kinds of hydrogen production reactions, e.g., catalytic reforming of methane [20], water gas shift reaction [23–25] and reforming or partial oxidation of alcohols such as methanol and ethanol [16,26,27]. However, one can find in literature a unique previous study of EPOC in the catalytic decomposition of ammonia [17]. In this previous study an iron catalyst film deposited on both K2YZr(PO4)3 (K+ ionic conductor) and, CaZr0.9In0.1O3-α (H+ ionic conductor material), were electrochemically activated. Although very promising results were obtained, a high temperature range (500–600 °C) was explored probably due to the requirements for ionic conductivity of the solid electrolyte used. In this work it has been explored for the first time in the literature, the effect of the electrochemical promotion for low temperature catalytic decomposition of ammonia (250–350 °C). For that purpose, a ruthenium catalyst and an alkaline solid electrolyte (Na-βAl2O3 and K-βAl2O3) have been used on the catalytic reaction. Very promising results have been obtained in a lower temperature range (250–350 °C) which have been discussed in terms of the EPOC rules and the mechanism of ammonia decomposition reaction. Hence, relevant findings are reported of great interest for the general catalysis field which could serve for the design of future novel catalyst formulations. 2 Experimental 2.1 Electrochemical catalysts preparation Na-βAl2O3 and K-βAl2O3 (20 mm diameter and 1 mm thickness from Ionotec company) solid electrolyte discs were used as supports. First, thin coatings of gold paste (Gwent Electronic Materials) were deposited on the one side of the solid electrolyte disk as Au counter (CE) and reference (RE) electrodes, followed by calcination steps at 300 °C for 1 h (5 °C·min−1) and 800 °C for 2 h (5 °C·min−1). Blank experiments demonstrated the catalytically inactive properties of the prepared gold counter and reference electrodes for ammonia catalytic decomposition reaction. Then, an electrically continuous ruthenium catalyst film-working electrode (WE) (geometric area of 2.01 cm2) was deposited on the other side of the disk as schematically shown in Figure S1 of the supporting information. An impregnation method described in detail elsewhere was used [28] by using a RuCl3 solution. The precursor salt, RuCl3 ·3H2O (Sigma Aldrich) was dissolved in 1:1 (volume) water: 2-propanol (Sigma Aldrich, 99.9% purity) solution, followed by a calcination step at 500 °C for 1 h (5 °C·min−1). Both obtained electrochemical catalysts (Ru/Na-βAl2O3 and Ru/K-βAl2O3) showed a similar final metal loading of 1.3 mgRu ·cm−2. Before the catalytic activity measurements, the metal catalyst film was reduced under 5 v/v% H2/He gas mixture (100 mL·min−1) at 400 °C for 1 h (10 °C·min−1), in order to ensure the complete reduction of the active ruthenium particles, achieving a metal catalyst film with an in plane electrical resistance around 30 Ω. 2.2 Ex-situ characterization of the electrochemical catalysts For the ex-situ characterization of the ruthenium catalyst film, X-Ray Diffraction (XRD) and Scanning Electron Microscopy (SEM) techniques were used. XRD diffractograms were obtained on a Philips X'Pert MPD with co-filtered Cu-Ka radiation (λ=1.54056 Å), after reduction under 5 v/v% H2/Ar and for used catalyst. The XRD pattern were recorded from 20<2θ<80° with a scan rate of 0.02° step size and acquisition time of 4 s per step. The crystal size was determined by the Debye-Scherrer Eq. (1): (1) d = K · λ β · cos θ where d is the average particles size (nm), assuming particles are spherical, K = 0.9, λ=1.54056 Å, β is the full width at half the diffracted peak and θ is the Bragg angle. SEM images of the ruthenium films were performed by ZEISS GeminiSEM 500 FE-SEM with a PIN-diode BSE detector. This instrument was equipped with an energy-dispersive X-ray spectroscopy (EDX) analyzer to verify the composition of the samples. 2.3 Electrocatalytic tests Catalytic tests were carried out in a single chamber solid electrolyte cell reactor configuration (Figure S2 of the supporting information). The electrochemical catalyst was suspended in the reactor by using gold wires (Alfa Aesar, 99.95% purity) which also allow the electrical connections of the three electrodes (Counter (CE), Reference (RE) and Working electrode (WE)) with the potentiostat-galvanostat (Voltalab PGZ 301, Radiometer Analytical). The EPOC phenomenon was investigated by applying different electrical potentials between the WE and CE and measured between the WE and RE electrodes (VWR), according to the technique generally used in conventional three-electrode electrochemical cells [29]. Reaction gasses (Air Liquide) were certified standards of helium (99.999% purity) and ammonia (5011.50 ppm) and the gas flows were controlled by a set of calibrated mass flow meters (Brooks 5850 E). The ammonia decomposition reaction was carried out at atmospheric pressure operating at a temperature range from 220 to 350 °C, using an inlet composition of 1250 ppm ammonia with an overall gas flow rate of 200 mL·min−1 (He balance). Gas effluents were analysed on-line with a dispersive IR Rosemount X-STREAM Enhanced XEGP continuous gas analyzer (EMERSON) for ammonia detection. The hydrogen formation rate (mmol H2 ·min−1 ·gcat −1) was calculated from balance of the ammonia content in the outgas stream, while conversion of ammonia ( X N H 3 ) was calculated as follows: (2) X N H 3 ( % ) = F N H 3 in − F N H 3 out F N H 3 in . 100 Where, F N H 3 in and F N H 3 out referred to the inlet and outlet ammonia molar flows (mmol gas·min−1), respectively. Furthermore, the apparent activation energy of the synthesized catalysts was calculated from the Arrhenius plot at low conversion values (<10%) in order to operate into differential conditions. The electrochemical catalyst was also in-situ characterized in the single chamber cell reactor by cyclic voltammetry experiments. A cyclic voltammetry experiment with simultaneous ammonia recording was performed under ammonia catalytic decomposition reaction (1250 ppm ammonia and a gas flow of 200 mL·min−1) at 280 °C and a scan rate of 5 mV·s− 1. 3 Results and discussion 3.1 Electrochemical catalyst characterization Firstly, the catalytic activity of the ruthenium catalyst film was tested from 200 to 450 °C in the ammonia decomposition reaction under open circuit conditions (O.C.) for Ru/Na-βAl2O3 electrocatalyst (Figure S3 of the supporting information). This initial experiment demonstrated that the prepared metal catalyst film was active for the ammonia catalytic decomposition reaction under the explored reaction conditions. It shows a typical trend of ammonia conversion increasing with the reaction temperature due to the increase in the reaction kinetics [3]. However, it can be observed that full conversion of ammonia was never reached (maximum conversion of 74% at 450 °C) due to certain bypass of the gas reactants flow to the ruthenium catalyst film. This behavior is typically observed with those kinds of solid electrolyte cells reactors and have been reported in previous studies [30]. The crystalline structure of the ruthenium catalyst film in the Ru/Na-βAl2O3 electrocatalyst after hydrogen reduction and after ammonia decomposition reaction was examined by XRD (Fig. 1 ). The reduced electrocatalyst showed the main diffraction peaks corresponding to hexagonal phase of Na-βAl2O3 (JCPDS: 19–1173) associated with the electrolyte support [31] and the hexagonal phase of metallic ruthenium (JCPDS: 06–0663) [7]. After catalytic activity measurements, the post-reaction ruthenium catalyst film showed the same crystalline phases than the reduced sample (metallic ruthenium and Na-βAl2O3) not showing crystalline phases derived from the EPOC experiments. Using the Scherrer equation at peak 2θ=44°, the average particles size of ruthenium for both electrocatalyst, reduced and post reaction, was 15.7 and 21.4 nm, respectively. These results demonstrated certain sintering of the metal particles in the catalyst film during the catalytic activity measurements. This kind of sintering of metal particles are typical for conductive catalyst films and have been reported in previous studies of EPOC [28]. Fig. 2 shows SEM micrographs and EDX analysis of the metal film on reduced catalyst (a, b and c) and after ammonia decomposition reaction (d, e and f). Typically, the ruthenium film after reduction treatment was porous and continuous, which suggested that the preparation technique was adequate to synthesize ruthenium films for EPOC experiments [32]. It was observed from the EDX of the reduced sample (Fig. 2b), large concentrations of sodium (in blue) which were attributed to the thermal migration of alkaline ions from the solid electrolyte to the ruthenium catalyst film during the catalyst preparation procedure and reduction step [16,21]. From the SEM analysis of the post reaction sample, in agreement with the XRD, a sintering of the metal particles in the catalyst film could be observed. Furthermore, some cracks in the ruthenium catalyst film after catalysis were observed at microscopy level. However, these cracks did not affect the electrical conductivity of the ruthenium catalyst film as verified along the surface with a multimeter. In any case, this sintering process of the metal particles shown in the sample after catalytic reaction probably occurred at the beginning of the experimental tests (initial experiment under open circuit conditions shown in Figure S3), since reproducible and stable catalytic activity values were obtained during EPOC experiments (as will be shown below). 3.2 Electrochemical activation of Ru catalyst with Na+ ions Fig. 3 shows the variation of the hydrogen production rate vs. time at different applied potentials between 2 and −2 V at 300 °C. Each polarization was applied for 30 min in order to achieve a steady state catalytic behavior. In agreement with previous EPOC studies and considering that the initial polarization at VWR= 2 V allowed to obtain a metal catalyst film free of any sodium ions (reference state, i.e., un-promoted catalytic activity), the subsequent decrease in the applied potential led to the electrochemical supply of sodium ions to the catalyst surface. It was confirmed by the obtained measured negative electrical currents (not shown here) of higher magnitude as the applied potential decreased to more negative values, corresponding to a higher electrochemical supply of electropositive alkali sodium ions. This direct correlation has been recently confirmed by an Operando Near Ambient Pressure Photoemission Spectroscopy performed on Ni/K-βAl2O3 in a previous work of the research team [33]. Concerning the variation of the catalytic activity with the different applied polarizations, according to previous studies [22,24,25,34–37], one may rationalize the observed variation in the catalytic activity on the basis of the catalyst-electrode work function modification upon applied potential. A decrease in the catalyst potential below the open circuit conditions, and therefore, in the catalyst work function, led to an increase of the electronic density of ruthenium catalyst with a concomitant spillover of Na+ ions from the electrolyte onto the metal catalyst surface. This decreased work function, weakened the ruthenium chemical bond with electron-donor adsorbates and strengthened those with electron acceptors ones. In this work, the strong promotional effect, observed when lowering the catalyst potential below the open circuit conditions (50 mV), can be explained on the basis of a strengthening of the chemisorptive bond of weakly adsorbed N surface species, which stabilizes N on the catalyst surface. It facilitates the ammonia decomposition reaction, in good agreement with a previous EPOC study in the catalytic ammonia decomposition reaction on iron deposited on K2YZr(PO4)3, a K+ conductor solid electrolyte [17]. This experimental observation is also in good agreement with the mechanism proposed in the literature for the catalytic ammonia decomposition reaction, which follows these six consecutive steps [38]: (3) Step 1 : N H 3 ( g ) ↔ N H 3 ( a ) (4) Step 2 : N H 3 ( a ) + s ↔ N H 2 ( a ) + H ( a ) (5) Step 3 : N H 2 ( a ) + s ↔ NH ( a ) + H ( a ) (6) Step 4 : NH ( a ) + s ↔ N ( a ) + H ( a ) (7) Step 5 : 2 N ( a ) → N 2 ( g ) + 2 s (8) Step 6 : 2 H ( a ) ↔ H 2 ( g ) + 2 s where s represents a vacant site of the catalyst surface, (g) stands for gas and (a) stands for adsorbed molecules. Hence, a previous detailed kinetics analysis [8] has demonstrated that for the case of a ruthenium based catalyst under similar reaction conditions than our work, step 2 is the main rate determining step in the overall reaction mechanism. Then, the stabilization of NH2(a) adsorbed species on the catalyst surface when the potential is decreased, might increase the kinetics of the dehydrogenation reactions (steps 2–4), leading to an overall activation of the process. On the other hand, the increase in the value of the applied potential above that of the open circuit conditions (50 mV), enhanced the binding strength of the electron donor ammonia molecules (facilitating the ammonia adsorption, step 1 of the mechanism) [17]. It led to a slight increase in the catalytic activity, as can be observed under application of 2 V in Fig. 3, but much less important considering that a higher effect is produced when the electronic effect increases the kinetics of the rate determining step. Finally, it can also be observed that the final application of a potential of 2 V allowed to recover the initial un-promoted catalytic activity achieved at the beginning of the experiment, leading to a reversible EPOC phenomenon [16,25]. It implied that the same amount of sodium ions, initially transferred from the solid electrolyte to the catalyst during the previous polarizations, were returned from the catalyst to the solid electrolyte after the final application of 2 V. It also demonstrated the stability of the catalyst film under EPOC reaction conditions. Therefore, the sintering of the metal particles observed in Figs. 1 and 2 might occurred during the preliminary reaction experiment under O.C. (Figure S3), stabilizing the ruthenium catalyst film for the subsequent EPOC experiments. In order to study the influence of the reaction temperature, the same experiment performed at 300 °C was repeated at other reaction temperatures, i.e. 250 °C, 320 °C and, 350 °C. The steady state variation of the ammonia conversion vs. the applied polarization at the different reaction temperatures is shown in Fig. 4 . Also, to quantify the magnitude of the EPOC phenomenon, Fig. 4 shows the maximum value calculated of the rate enhancement ratio (ρ), obtained by the following equation and typically used in EPOC studies [24,39]: (9) ρ = r r 0 where r0 is the un-promoted catalytic reaction rate (VWR=2 V) and r is the promoted catalytic reaction rate at the explored potential. Firstly, it could be observed a similar overall EPOC behavior, at the explored reaction temperatures, to the one already described in Fig. 3, with an increase in the catalytic reaction rate as the applied potential decreases from the open circuit potential values (typically around 50 mV). As typically found in previous EPOC studies with alkaline ion conductors [40], the highest value of the rate enhancement ratio was achieved at an intermediate reaction temperature, i.e. 300 °C, increasing the ammonia conversion 1.4 times vs. the un-promoted conditions (2 V). Hence, at low temperatures (i.e. 250 °C) the EPOC phenomenon is limited by the low ionic conductivity of the solid electrolyte which decreases the amount of electrochemically supplied ions. However, above certain reaction temperatures (e.g. 320 °C), the relative increase induced by the EPOC phenomenon, measured by ρ, is limited by the initial higher value of the un-promoted catalytic activity (i.e. 30% at 320 °C). On the other hand, it is also interesting to note that, a poisoning effect can be observed at higher temperatures (above 320 °C), which led to an optimal value of the applied potential which maximized the catalytic activity at VWR= −1 V at 320 °C and VWR= −0,5 V at 350 °C. This behavior typically found in previous studies of alkaline EPOC can be attributed to an excess of promoting species on the catalyst surface which block the catalytic active sites [41]. In the present study, as already mentioned, the application of negative potentials decreased the relative coverage of electron donor molecules (ammonia) (step 1), causing a poisoning effect observed above certain temperatures and below certain applied potentials. Hence, above certain temperatures and above certain alkali coverage on the catalyst, the mechanism could be limited by the ammonia adsorption step, which may also justify the higher inhibiting effect observed at 350 °C vs. 320 °C at high negative potential (close to −2 V). On the other hand, it could be observed that higher optimal applied potential values (which maximized the catalytic activity) were obtained at higher reaction temperatures. It can be attributed to an increase in the solid electrolyte ionic conductivity with temperature leading to a higher supply of sodium ions for the same potential. Obtained results clearly demonstrated the interest of the EPOC phenomenon to electrochemically supply the optimal promoter amount at different reaction conditions (e.g. temperature), which is not possible with conventional heterogeneous catalyst doped with alkali, where a fix amount of promoter is added to the catalyst during the preparation step. This is one of the most interesting findings of EPOC which has been analysed in detail in a previous reviewed manuscript [42]. 3.3 Electrochemical activation of Ru catalyst with K+ ions In order to evaluate the electro-promotional effect of other type of alkali ions, the EPOC phenomenon was investigated on a Ru/K-βAl2O3 electrochemical catalyst. Fig. 5 shows the variation of the hydrogen production rate vs. time at different applied potentials (between VWR= 2 V and −2 V) and reaction temperatures (300 and 320 °C). Each polarization was again applied for 30 min until a steady state catalytic behavior is achieved. In good agreement with the results obtained with Ru/Na-βAl2O3, a strong activation effect in the catalytic activity was observed under conditions of electrochemically supply of alkali ions (K+). The observed promotional effect can be explained considering the influence of the alkali ions on the binding strength of chemisorbed reactants and intermediate molecules, as previously discussed for Ru/Na-βAl2O3. The electrochemical supply of potassium ions enhanced the chemisorption of electron acceptor molecules (weakly adsorbed N surface species) facilitating ammonia decomposition reactions, increasing the rate of the three consecutive steps 2, 3 and 4, on the previously mentioned reaction mechanism. In this case, it can be observed that an optimum applied potential of VWR= 0 V and VWR=0.5 V was obtained at 300 °C and 320 °C, respectively. These optimal VWR values were higher than the ones obtained for Ru/Na-βAl2O3, which can be justified considering the higher electronic effect on the catalyst of K+vs. Na+ions, attributed to the different ionic size of both cations (Na+= 0.10 nm and K+=0.13 nm). In addition, some authors suggested that the higher dipole moment of potassium ion (~14 Debye) could increase the promotional effect of K+ vs. Na+ (whose dipole moment was ~6 Debye) and H+ ions into the CO2 hydrogenation reaction on Ru catalysts [43]. Hence, Lang et al. [44] clearly showed that the larger the alkali cation was, the greater the electric field suffered by co-adsorbed species located at an adjacent site. These higher promotional effect of K+ vs. Na+ ions have been observed in different chemical reactions through Electrochemical Promotion [35,45,46]. On the other hand, in a previous study of a conventional heterogeneous Ru catalyst doping with K+ and Na+ led to an increase in the ammonia conversion with respect un-doped catalyst at lower temperature, being the Ru-K the highest ammonia conversion due to the lower electronegative of potassium [47]. Thus, K+ should perturb the Ru-NH3 bond more strongly than Na+, leading to a higher activation effect. In fact, considering the lower ionic conductivity of K-βAl2O3 (5.5 (ohm.m)−1) vs. Na-βAl2O3 (23.8 (ohm.m)−1) at 300 °C provided by the supplier (Ionotec), lower values of potassium vs. sodium ions coverages on the metal catalyst surface would be attained for the same explored potential range (at the same temperature). Then, the higher effect on the reactants and intermediates chemisorption induced by K+ vs. Na+ can also explain the lower optimal potential values obtained, which maximized the hydrogen production rate. As already mentioned, the presence of an optimal VWR value, and hence, an optimal alkali coverage on the catalyst, is probably due to an excessive decrease on the adsorption of electron acceptor ammonia molecules induced by potassium, which limits step 1 in the overall reaction mechanism. Results are in good agreement with a previous work of EPOC on catalytic ammonia decomposition reaction, in which moderate potassium coverages electrochemically supplied at VWR=1.3 V were found to optimize the catalytic activity of an iron catalyst [17]. On the other hand, it is also interesting to note that a slight permanent EPOC effect was observed at 300 °C (the initial un-promoted catalytic rate was not reached after the final polarization of 2 V). This permanent effect is clearer at 320 °C in which larger differences between the initial and final polarization at VWR=2 V were obtained. This kind of permanent EPOC effect has been also observed in previous studies above certain reaction temperatures working with K+ ions conductor solid electrolytes [35]. It might be explained considering the possible formation of different kinds of promoting phases with higher stability on the catalyst surface, which cannot be electrochemical decomposed under the explored reaction conditions (temperature and electrical potential) [26]. Likely, an applied potential value higher than 2 V would be required for the decomposition of such promotional phases in order to reach the initial un-promoted state. At this point, it should be mentioned that under the explored reaction conditions, K+ ions may also form different kinds of surface species (promotional phases) as a result of their reaction with the chemisorbed reactant and intermediates molecules. These species such as ammonia and nitrogen adsorbed molecules react with K+ ions by distinct charge transfer electrochemical reactions (e.g., potassium nitrites, nitrates or nitrides among others) occurring at the different applied VWR values. In fact, various kinds of promotional phases have been already shown in other EPOC studies with potassium ions conductor electrolyte, verified by ex-situ FTIR [35] and XPS measurements [48]. This in-situ formation of different kinds of adsorbed species will be analysed with more detail in the next section by cyclic voltammetry measurements. Thus, the presence of distinct kind of promotional phases could also confirmed the presence of two local maximum on the hydrogen production rates observed at 320 °C at VWR=0.5 V and −1.5 V. The formation and nature of different kind of promotional phases causing two optimal applied potential values have been reported in a previous work of hydrogen production via partial oxidation of methanol on platinum catalyst film deposited on K-βAl2O3 [26]. Thus, the catalytic rates would be affected by the formation of several kinds of promoter phases as will be also lately confirmed by cyclic voltammetry. The higher promotional effect of potassium vs. sodium ions can be clearly observed also on Figure S4 of the supporting information, which compares the potentiostatic variation of ρ vs. VWR at the two common explored reaction temperatures (300 and 320 °C). It can be observed that in both cases higher ρ values were obtained for Ru/K-βAl2O3 vs. Ru/Na-βAl2O3 at lower VWR values. Hence, in the case of Ru/K-βAl2O3 the catalytic hydrogen production rate via ammonia decomposition under optimal promotor coverage is multiplied by a factor close to 231.8% at 300 °C, which is one of the most important findings of the present work. It led to an overall higher ammonia conversion on the Ru/K-βAl2O3 electrochemical catalyst vs. Ru/Na-βAl2O3 as can be observed on Figure S5 of the supporting information. Considering the similar nature of both kinds of ruthenium catalyst films deposited on both, Na-βAl2O3 and K-βAl2O3 (same preparation procedure and same geometric area of the catalyst working-electrode), the observed difference in the ammonia conversion is clearly due to a higher promotional effect of potassium. Therefore, considering that the most interesting results were obtained by the Ru/K-βAl2O3 electrochemical catalyst, this sample was selected for further reaction and characterization experiments as will be shown below. Fig. 6 shows the ammonia conversion on Ru/K-βAl2O3 electrochemical catalyst through temperature programmed reaction experiments (2 °C·min−1) under application of three different potentials (VWR=2, 0 and −1 V). In first place it can be observed that under the three explored VWR values, ammonia conversion increased with the reaction temperature due to an increase in the reaction kinetics and the endothermic nature of the reaction. In good agreement with previous results, it can be observed that the application of a mild potential value (VWR= 0 V) enhanced ammonia conversion at the whole explored temperature range vs. the un-promoted potential value (2 V). Under these conditions, a moderate amount of potassium ions was supplied to the catalyst leading to an electrochemical activation of the metal catalyst film. This catalyst potential (VWR= 0 V) was selected from the results obtained in Fig. 5 in order to improve the catalytic activity in a wide temperature range (220–320 °C). However, it can be observed again that, a decrease in the potential to VWR=−1 V decreased ammonia conversion in the whole temperature range. It was related to a strong increase on the K+ coverage, which weakens the binding strength of ammonia, decreasing the reaction rate. Moreover, the excess of promoter over catalyst surface, induced by a negative potential, led to the blockage of ruthenium active sites causing electrochemical poisoning, similarly to a previous EPOC study on ammonia decomposition using an Fe electrochemical catalyst under potassium coverages [17]. This kind of poisoning behavior has been also observed in previous studies of catalytic ammonia decomposition on ruthenium catalysts chemically doped with potassium [47] and cesium [49]. In any case, results shown in Fig. 6 demonstrate the interest of EPOC phenomenon to activate the catalyst at lower reaction temperatures, which may be of great interest for energy saving, especially for endothermic reactions as the one explored here. In this sense, Figure S6 of the supporting information shows the reaction temperature necessary to achieve a specific ammonia conversion (5 and 10%) as a function of the three explored potentials (VWR=2, 0 and −1 V) used in the experiment of Fig. 6. It can be observed an activation by means of a reduction of 20 °C to achieve 5% of ammonia conversion and 30 °C for 10% ammonia conversion induced by EPOC under VWR= 0 V. At this point it should be mentioned that a further optimization could be performed (out of the scope of the present study), applying the optimal potential value at each explored temperature to maximize the hydrogen production rate. The apparent activation energy values (Ea) were calculated from these experiments via the Arrhenius plot at each applied potentials (VWR=2, 0 and −1 V) as shown in Figure S7 of the supporting information. The obtained values, which were in the range of previously obtained ones with ruthenium catalysts [7,50], decrease from Ea = 80.9 kJ·mol−1 at VWR= 2 V to Ea = 74.6 kJ·mol−1 at VWR= 0 V. This decrease in the Ea induced under electrochemical activation conditions is in good agreement with the promotional mechanism explained above. Hence, the optimal potassium coverages achieved at VWR=0 V allowed an activation of the chemisorption of electron acceptor molecules (N adsorbed molecules), which promotes the rate determining step of ammonia decomposition reaction, decreasing the Ea [17]. In addition, a similar decrease in the apparent activation energy of 5–20 kJ·mol−1 was observed for ruthenium catalysts chemically doped with potassium species on ammonia decomposition reaction [47]. 3.4 Cyclic voltammetry measurements Fig. 7 shows the cyclic voltammetry experiment (CV) of Ru/K-βAl2O3 with the simultaneous recording of ammonia signal under ammonia catalytic decomposition reaction at 280 °C, from VWR=2 V to −2 V and a scan rate of 5 mV·s− 1. Before the cyclic voltammetry experiment, the electrochemical catalysts were kept at 2 V for 30 min in order to define an initial reference state. Staring from 2 V, during the initial forward scan from 2 V to −2 V, it can be observed negative current values attributed to the electrochemical supply of K+ ions from the solid electrolyte to the metal catalyst film with the simultaneous formation of surface promotional phases between the K+ ions and the chemisorbed reactant and product species [51]. According to the obtained CV curve one could envisage different kinds of charge transfer reactions evidenced by the different obtained cathodic peaks vs. other CV curves obtained in EPOC systems where single cathodic peaks were typically observed [51]. It demonstrates the formation of different kinds of promotional phases between the K+ ions and chemisorbed molecules, in good agreement with the different observed promotional effects already discussed in Fig. 5. During the forward CV scan, an increase in the hydrogen production rate was also observed due to the electrochemical supply of K+ ions. In good agreement with the previous results shown in Fig. 5, an optimal potential value was attained corresponding to an optimal alkali coverage on the catalyst surface. During the positive scan from −2 V to 2 V (backward scan) the different promotional phases previously formed on the metal catalyst film were electrochemically decomposed, returning the K+ ions to the solid electrolyte and leading to the appearance of different anodic current peaks. It is interesting to note that during this positive scan a new promotional state is again reached at VWR= −0.5 V maximizing the hydrogen production rate. In addition, during the backward scan a second local maximum in the hydrogen production rate was also observed at VWR= 1 V. Considering the dynamic character of the experiment, these results again confirmed the presence of different kinds of promotional phases which locally optimize the hydrogen production rate at different potentials. Some of these species were likely formed from the partial electrochemical decomposition of the promotional phases initially formed during the forward scan. The existence of a permanent EPOC effect is also clear at the end of the cyclic voltammetry experiment at 2 V which showed a higher hydrogen production rate in the backward vs. the forward scan. At this point (VWR= 2 V), positive current values were obtained showing that certain promotional phases were still present on the catalyst surface and were not completely removed (via electrochemistry). It supports the origin of the permanent EPOC phenomenon observed in Fig. 5 and previously discussed in the case of the Ru/K-βAl2O3 electrochemical catalyst. 4 Conclusions The electrochemical supply of alkaline ions (Na+ and K+) to a ruthenium catalyst film activates the hydrogen production rate via catalytic ammonia decomposition reaction. The promotional effect is due to the strengthening of the chemisorptive bond of weakly adsorbed N surface molecules which stabilizes N adsorbed species on the ruthenium catalyst surface. This stabilization increases the kinetics of the ammonia decomposition reaction leading to the overall activation of the process. A higher promotional effect of K+ ions was found vs. Na+ ions. It is attributed to the higher electronic effect induced by K+which allows to increase the hydrogen production rate above 230% under optimal potential conditions. However, a large amount of alkali ions supplied to the catalyst at very negative potentials, led to a poisoning effect on the catalytic activity. It is associated with a strong decrease in the chemisorption of the electron donor molecules (ammonia). Temperature programmed reaction experiments show the interest of EPOC for the electrochemical activation of the catalyst at lower temperatures, which may contribute to decrease on the overall energy requirements of the process. A permanent EPOC effect was also found for the case of Ru/K-βAl2O3 which led to a permanent activation of the catalyst under the explored conditions. It was attributed to a higher stability of some promotional phases formed during the negative polarization as supported by cyclic voltammetry. CRediT authorship contribution statement M. Pinzón: Investigation, Methodology, Validation, Visualization, Writing – original draft. E. Ruiz-López: Investigation, Methodology. A. Romero: Conceptualization, Visualization, Writing – review & editing, Supervision, Funding acquisition. A.R. de la Osa: Conceptualization, Visualization, Writing – review & editing, Supervision, Funding acquisition. P. Sánchez: Conceptualization, Visualization, Writing – review & editing, Supervision, Funding acquisition. A. de Lucas-Consuegra: Conceptualization, Visualization, Writing – review & editing, Supervision, Funding acquisition. Declaration of Competing Interest The authors declare that they have no known competing financial interests or personal relationships that could have appeared to influence the work reported in this paper. Acknowledgments This work was supported by the Regional Government of Castilla-La Mancha and the European Union [FEDER funds SBPLY/180501/000281]. Supplementary materials Supplementary material associated with this article can be found, in the online version, at doi:10.1016/j.mcat.2021.111721. Appendix Supplementary materials Image, image 1 References [1] Z. Abdin A. Zafaranloo A. Rafiee W. Mérida W. Lipiński K.R. Khalilpour Hydrogen as an energy vector Renew. Sustain. Energy Rev. 120 2020 109620 10.1016/j.rser.2019.109620 Z. Abdin, A. Zafaranloo, A. Rafiee, W. Mérida, W. Lipiński, K.R. Khalilpour, Hydrogen as an energy vector, Renew. Sustain. Energy Rev.120 (2020) 109620. https://doi.org/10.1016/j.rser.2019.109620. [2] K. Mazloomi C. Gomes Hydrogen as an energy carrier: prospects and challenges Renew. Sustain. Energy Rev. 16 2012 3024 3033 10.1016/j.rser.2012.02.028 K. Mazloomi, C. Gomes, Hydrogen as an energy carrier: prospects and challenges, Renew. Sustain. Energy Rev.16 (2012) 3024–3033. https://doi.org/10.1016/j.rser.2012.02.028. [3] Z. Wan Y. Tao J. Shao Y. Zhang H. You Ammonia as an effective hydrogen carrier and a clean fuel for solid oxide fuel cells Energy Convers. Manag. 2021 228 10.1016/j.enconman.2020.113729 Z. Wan, Y. Tao, J. Shao, Y. Zhang, H. You, Ammonia as an effective hydrogen carrier and a clean fuel for solid oxide fuel cells, Energy Convers. Manag.228 (2021). https://doi.org/10.1016/j.enconman.2020.113729. [4] S. Niaz T. Manzoor A.H. Pandith Hydrogen storage: materials, methods and perspectives, Renew Sustain. Energy Rev 50 2015 457 469 10.1016/j.rser.2015.05.011 S. Niaz, T. Manzoor, A.H. Pandith, Hydrogen storage: materials, methods and perspectives, Renew. Sustain. Energy Rev. 50 (2015) 457–469. https://doi.org/10.1016/j.rser.2015.05.011. [5] H. Maleki M. Fulton V. Bertola Kinetic assessment of H2 production from NH3 decomposition over CoCeAlO catalyst in a microreactor: experiments and CFD modelling Chem. Eng. J. 411 2021 128595 10.1016/j.cej.2021.128595 H. Maleki, M. Fulton, V. Bertola, Kinetic assessment of H2 production from NH3 decomposition over CoCeAlO catalyst in a microreactor: experiments and CFD modelling, Chem. Eng. J.411 (2021) 128595. https://doi.org/10.1016/j.cej.2021.128595. [6] T.A. Le Y. Kim H.W. Kim S.U. Lee J.R. Kim T.W. Kim Y.J. Lee H.J. Chae Ru-supported lanthania-ceria composite as an efficient catalyst for COx-free H2 production from ammonia decomposition Appl. Catal. B Environ. 285 2021 119831 10.1016/j.apcatb.2020.119831 T.A. Le, Y. Kim, H.W. Kim, S.U. Lee, J.R. Kim, T.W. Kim, Y.J. Lee, H.J. Chae, Ru-supported lanthania-ceria composite as an efficient catalyst for COx-free H2 production from ammonia decomposition, Appl. Catal. B Environ.285 (2021) 119831. https://doi.org/10.1016/j.apcatb.2020.119831. [7] M. Pinzón A. Romero A. de Lucas Consuegra A.R. de la Osa P. Sánchez Hydrogen production by ammonia decomposition over ruthenium supported on SiC catalyst J. Ind. Eng. Chem. 94 2021 326 335 10.1016/j.jiec.2020.11.003 M. Pinzón, A. Romero, A. de Lucas Consuegra, A.R. de la Osa, P. Sánchez, Hydrogen production by ammonia decomposition over ruthenium supported on SiC catalyst, J. Ind. Eng. Chem.94 (2021) 326–335. https://doi.org/10.1016/j.jiec.2020.11.003. [8] I. Lucentini G. García Colli C.D. Luzi I. Serrano O.M. Martínez J. Llorca Catalytic ammonia decomposition over Ni-Ru supported on CeO2 for hydrogen production: effect of metal loading and kinetic analysis Appl. Catal. B Environ. 2021 286 10.1016/j.apcatb.2021.119896 I. Lucentini, G. García Colli, C.D. Luzi, I. Serrano, O.M. Martínez, J. Llorca, Catalytic ammonia decomposition over Ni-Ru supported on CeO2 for hydrogen production: effect of metal loading and kinetic analysis, Appl. Catal. B Environ.286 (2021). https://doi.org/10.1016/j.apcatb.2021.119896. [9] C. Huang Y. Yu J. Yang Y. Yan D. Wang F. Hu X. Wang R. Zhang G. Feng Ru/La2O3 catalyst for ammonia decomposition to hydrogen Appl. Surf. Sci. 476 2019 928 936 10.1016/j.apsusc.2019.01.112 C. Huang, Y. Yu, J. Yang, Y. Yan, D. Wang, F. Hu, X. Wang, R. Zhang, G. Feng, Ru/La2O3 catalyst for ammonia decomposition to hydrogen, Appl. Surf. Sci.476 (2019) 928–936. https://doi.org/10.1016/j.apsusc.2019.01.112. [10] T. Kocer F.E.S. Oztuna S.F. Kurtoğlu U. Unal A. Uzun Graphene aerogel-supported ruthenium nanoparticles for COx-free hydrogen production from ammonia Appl. Catal. A Gen. 2021 610 10.1016/j.apcata.2020.117969 T. Kocer, F.E.S. Oztuna, S.F. Kurtoğlu, U. Unal, A. Uzun, Graphene aerogel-supported ruthenium nanoparticles for COx-free hydrogen production from ammonia, Appl. Catal. A Gen.610 (2021). https://doi.org/10.1016/j.apcata.2020.117969. [11] Z. Wang Y. Qu X. Shen Z. Cai Ruthenium catalyst supported on Ba modified ZrO2 for ammonia decomposition to COx-free hydrogen Int. J. Hydrogen Energy. 44 2019 7300 7307 10.1016/j.ijhydene.2019.01.235 Z. Wang, Y. Qu, X. Shen, Z. Cai, Ruthenium catalyst supported on Ba modified ZrO2 for ammonia decomposition to COx-free hydrogen, Int. J. Hydrogen Energy.44 (2019) 7300–7307. https://doi.org/10.1016/j.ijhydene.2019.01.235. [12] S. Bajus F. Agel M. Kusche N. Ní Bhriain P. Wasserscheid Alkali hydroxide-modified Ru/γ-Al2O3 catalysts for ammonia decomposition Appl. Catal. A Gen. 510 2016 189 195 10.1016/j.apcata.2015.11.024 S. Bajus, F. Agel, M. Kusche, N. Ní Bhriain, P. Wasserscheid, Alkali hydroxide-modified Ru/γ-Al2O3 catalysts for ammonia decomposition, Appl. Catal. A Gen.510 (2016) 189–195. https://doi.org/10.1016/j.apcata.2015.11.024. [13] X. Ju L. Liu X. Zhang J. Feng T. He P. Chen Highly Efficient Ru/MgO Catalyst with Surface-Enriched Basic Sites for Production of Hydrogen from Ammonia Decomposition ChemCatChem 11 2019 4161 4170 10.1002/cctc.201900306 X. Ju, L. Liu, X. Zhang, J. Feng, T. He, P. Chen, Highly Efficient Ru/MgO Catalyst with Surface-Enriched Basic Sites for Production of Hydrogen from Ammonia Decomposition, ChemCatChem. 11 (2019) 4161–4170. https://doi.org/10.1002/cctc.201900306. [14] Y. Im H. Muroyama T. Matsui K. Eguchi Ammonia decomposition over nickel catalysts supported on alkaline earth metal aluminate for H2 production Int. J. Hydrogen Energy. 45 2020 26979 26988 10.1016/j.ijhydene.2020.07.014 Y. Im, H. Muroyama, T. Matsui, K. Eguchi, Ammonia decomposition over nickel catalysts supported on alkaline earth metal aluminate for H2 production, Int. J. Hydrogen Energy.45 (2020) 26979–26988. https://doi.org/10.1016/j.ijhydene.2020.07.014. [15] M. Stoukides C.G. Vayenas The effect of electrochemical oxygen pumping on the rate and selectivity of ethylene oxidation on polycrystalline silver J. Catal. 70 1981 137 146 10.1016/0021-9517(81)90323-7 M. Stoukides, C.G. Vayenas, The effect of electrochemical oxygen pumping on the rate and selectivity of ethylene oxidation on polycrystalline silver, J. Catal.70 (1981) 137–146. https://doi.org/10.1016/0021-9517(81)90323-7. [16] E.R. López F. Dorado A. de Lucas-Consuegra Electrochemical promotion for hydrogen production via ethanol steam reforming reaction Appl. Catal. B Environ. 243 2019 355 364 10.1016/j.apcatb.2018.10.062 E.R. López, F. Dorado, A. de Lucas-Consuegra, Electrochemical promotion for hydrogen production via ethanol steam reforming reaction, Appl. Catal. B Environ.243 (2019) 355–364. https://doi.org/10.1016/j.apcatb.2018.10.062. [17] G.E. Pitselis P.D. Petrolekas C.G. Vayenas Electrochemical promotion of ammonia decomposition over Fe catalyst films interfaced with K+- & H+- conductors Ionics (Kiel) 3 1997 110 116 10.1007/BF02375532 G.E. Pitselis, P.D. Petrolekas, C.G. Vayenas, Electrochemical promotion of ammonia decomposition over Fe catalyst films interfaced with K+- & H+- conductors, Ionics (Kiel). 3 (1997) 110–116. https://doi.org/10.1007/BF02375532. [18] A. Caravaca J. González-Cobos P. Vernoux A Discussion on the Unique Features of Electrochemical Promotion of Catalysis (EPOC): are We in the Right Path Towards Commercial Implementation? Catalysts 10 2020 1276 10.3390/catal10111276 A. Caravaca, J. González-Cobos, P. Vernoux, A Discussion on the Unique Features of Electrochemical Promotion of Catalysis (EPOC): are We in the Right Path Towards Commercial Implementation?, Catalysts. 10 (2020) 1276. https://doi.org/10.3390/catal10111276. [19] J. Díez-Ramírez V. Kyriakou I. Garagounis A. Vourros E. Vasileiou P. Sánchez F. Dorado M. Stoukides Enhancement of Ammonia Synthesis on a Co3Mo3N-Ag Electrocatalyst in a K-βAl2O3 Solid Electrolyte Cell ACS Sustain. Chem. Eng. 5 2017 8844 8851 10.1021/acssuschemeng.7b01618 J. Díez-Ramírez, V. Kyriakou, I. Garagounis, A. Vourros, E. Vasileiou, P. Sánchez, F. Dorado, M. Stoukides, Enhancement of Ammonia Synthesis on a Co3Mo3N-Ag Electrocatalyst in a K-βAl2O3 Solid Electrolyte Cell, ACS Sustain. Chem. Eng.5 (2017) 8844–8851. https://doi.org/10.1021/acssuschemeng.7b01618. [20] J. González-Cobos J.L. Valverde A. de Lucas-Consuegra Electrochemical vs. chemical promotion in the H2 production catalytic reactions Int. J. Hydrogen Energy. 42 2017 13712 13723 10.1016/j.ijhydene.2017.03.085 J. González-Cobos, J.L. Valverde, A. de Lucas-Consuegra, Electrochemical vs. chemical promotion in the H2 production catalytic reactions, Int. J. Hydrogen Energy.42 (2017) 13712–13723. https://doi.org/10.1016/j.ijhydene.2017.03.085. [21] D. Grigoriou D. Zagoraios A. Katsaounis C.G. Vayenas The role of the promoting ionic species in electrochemical promotion and in metal-support interactions Catal. Today. 363 2021 122 127 10.1016/j.cattod.2019.08.024 D. Grigoriou, D. Zagoraios, A. Katsaounis, C.G. Vayenas, The role of the promoting ionic species in electrochemical promotion and in metal-support interactions, Catal. Today.363 (2021) 122–127. https://doi.org/10.1016/j.cattod.2019.08.024. [22] C. Panaritis C. Michel M. Couillard E.A. Baranova S.N. Steinmann Elucidating the role of electrochemical polarization on the selectivity of the CO2 hydrogenation reaction over Ru Electrochim. Acta. 2020 350 10.1016/j.electacta.2020.136405 C. Panaritis, C. Michel, M. Couillard, E.A. Baranova, S.N. Steinmann, Elucidating the role of electrochemical polarization on the selectivity of the CO2 hydrogenation reaction over Ru, Electrochim. Acta.350 (2020). https://doi.org/10.1016/j.electacta.2020.136405. [23] A. De Lucas-Consuegra A. Caravaca J. González-Cobos J.L. Valverde F. Dorado Electrochemical activation of a non noble metal catalyst for the water-gas shift reaction Catal. Commun. 15 2011 6 9 10.1016/j.catcom.2011.08.007 A. De Lucas-Consuegra, A. Caravaca, J. González-Cobos, J.L. Valverde, F. Dorado, Electrochemical activation of a non noble metal catalyst for the water-gas shift reaction, Catal. Commun.15 (2011) 6–9. https://doi.org/10.1016/j.catcom.2011.08.007. [24] C. Panaritis J. Zgheib M. Couillard E.A. Baranova The role of Ru clusters in Fe carbide suppression for the reverse water gas shift reaction over electropromoted Ru/FeOx catalysts Electrochem. Commun. 2020 119 10.1016/j.elecom.2020.106824 C. Panaritis, J. Zgheib, M. Couillard, E.A. Baranova, The role of Ru clusters in Fe carbide suppression for the reverse water gas shift reaction over electropromoted Ru/FeOx catalysts, Electrochem. Commun.119 (2020). https://doi.org/10.1016/j.elecom.2020.106824. [25] D. Zagoraios S. Tsatsos S. Kennou C.G. Vayenas G. Kyriakou A. Katsaounis Tuning the RWGS Reaction via EPOC and in Situ Electro-oxidation of Cobalt Nanoparticles ACS Catal 2020 14916 14927 10.1021/acscatal.0c04133 D. Zagoraios, S. Tsatsos, S. Kennou, C.G. Vayenas, G. Kyriakou, A. Katsaounis, Tuning the RWGS Reaction via EPOC and in Situ Electro-oxidation of Cobalt Nanoparticles, ACS Catal. (2020) 14916–14927. https://doi.org/10.1021/acscatal.0c04133. [26] A. De Lucas-Consuegra J. González-Cobos V. Carcelén C. Magén J.L. Endrino J.L. Valverde Electrochemical promotion of Pt nanoparticles dispersed on a diamond-like carbon matrix: a novel electrocatalytic system for H2 production J. Catal. 307 2013 18 26 10.1016/j.jcat.2013.06.012 A. De Lucas-Consuegra, J. González-Cobos, V. Carcelén, C. Magén, J.L. Endrino, J.L. Valverde, Electrochemical promotion of Pt nanoparticles dispersed on a diamond-like carbon matrix: a novel electrocatalytic system for H2 production, J. Catal.307 (2013) 18–26. https://doi.org/10.1016/j.jcat.2013.06.012. [27] J. González-Cobos V.J. Rico A.R. González-Elipe J.L. Valverde A. De Lucas-Consuegra Electrochemical activation of an oblique angle deposited Cu catalyst film for H2 production Catal. Sci. Technol. 5 2015 2203 2214 10.1039/c4cy01524j J. González-Cobos, V.J. Rico, A.R. González-Elipe, J.L. Valverde, A. De Lucas-Consuegra, Electrochemical activation of an oblique angle deposited Cu catalyst film for H2 production, Catal. Sci. Technol.5 (2015) 2203–2214. https://doi.org/10.1039/c4cy01524j. [28] F. Dorado A. de Lucas-Consuegra P. Vernoux J.L. Valverde Electrochemical promotion of platinum impregnated catalyst for the selective catalytic reduction of NO by propene in presence of oxygen Appl. Catal. B Environ. 73 2007 42 50 10.1016/j.apcatb.2006.12.001 F. Dorado, A. de Lucas-Consuegra, P. Vernoux, J.L. Valverde, Electrochemical promotion of platinum impregnated catalyst for the selective catalytic reduction of NO by propene in presence of oxygen, Appl. Catal. B Environ.73 (2007) 42–50. https://doi.org/10.1016/j.apcatb.2006.12.001. [29] D. Theleritis S. Souentie A. Siokou A. Katsaounis C.G. Vayenas Hydrogenation of CO2 over Ru/YSZ electropromoted catalysts ACS Catal 2 2012 770 780 10.1021/cs300072a D. Theleritis, S. Souentie, A. Siokou, A. Katsaounis, C.G. Vayenas, Hydrogenation of CO2 over Ru/YSZ electropromoted catalysts, ACS Catal. 2 (2012) 770–780. https://doi.org/10.1021/cs300072a. [30] A. de Lucas-Consuegra Á. Caravaca F. Dorado J.L. Valverde Pt/K-βAl2O3 solid electrolyte cell as a “smart electrochemical catalyst” for the effective removal of NOx under wet reaction conditions Catal. Today. 146 2009 330 335 10.1016/j.cattod.2009.02.043 A. de Lucas-Consuegra, Á. Caravaca, F. Dorado, J.L. Valverde, Pt/K-βAl2O3 solid electrolyte cell as a “smart electrochemical catalyst” for the effective removal of NOx under wet reaction conditions, Catal. Today.146 (2009) 330–335. https://doi.org/10.1016/j.cattod.2009.02.043. [31] D. La Rosa G. Monforte C. D’Urso V. Baglio V. Antonucci A.S. Aricò Enhanced ionic conductivity in planar sodium-β\"-alumina electrolyte for electrochemical energy storage applications ChemSusChem 3 2010 1390 1397 10.1002/cssc.201000223 D. La Rosa, G. Monforte, C. D'Urso, V. Baglio, V. Antonucci, A.S. Aricò, Enhanced ionic conductivity in planar sodium-β\"-alumina electrolyte for electrochemical energy storage applications, ChemSusChem. 3 (2010) 1390–1397. https://doi.org/10.1002/cssc.201000223. [32] A. de Lucas-Consuegra A. Princivalle A. Caravaca F. Dorado A. Marouf C. Guizard J.L. Valverde P. Vernoux Preparation and characterization of a low particle size Pt/C catalyst electrode for the simultaneous electrochemical promotion of CO and C3H6 oxidation Appl. Catal. A Gen. 365 2009 274 280 10.1016/j.apcata.2009.06.026 A. de Lucas-Consuegra, A. Princivalle, A. Caravaca, F. Dorado, A. Marouf, C. Guizard, J.L. Valverde, P. Vernoux, Preparation and characterization of a low particle size Pt/C catalyst electrode for the simultaneous electrochemical promotion of CO and C3H6 oxidation, Appl. Catal. A Gen.365 (2009) 274–280. https://doi.org/10.1016/j.apcata.2009.06.026. [33] J.P Espinós V.J. Rico J. González-Cobos J.R. Sánchez-Valencia V. Pérez-Dieste C. Escudero A. de Lucas-Consuegra A.R. González-Elipe In situ monitoring of the phenomenon of electrochemical promotion of catalysis J. Catal. 358 2018 27 34 10.1016/j.jcat.2017.11.027 J.P. Espinós, V.J. Rico, J. González-Cobos, J.R. Sánchez-Valencia, V. Pérez-Dieste, C. Escudero, A. de Lucas-Consuegra, A.R. González-Elipe, In situ monitoring of the phenomenon of electrochemical promotion of catalysis, J. Catal.358 (2018) 27–34. https://doi.org/10.1016/j.jcat.2017.11.027. [34] C.G. Vayenas S. Bebelis I.V. Yentekakis H.G. Lintz Non-faradaic electrochemical modification of catalytic activity: a status report Catal. Today. 11 1992 303 438 10.1016/0920-5861(92)80002-5 C.G. Vayenas, S. Bebelis, I.V. Yentekakis, H.G. Lintz, Non-faradaic electrochemical modification of catalytic activity: a status report, Catal. Today.11 (1992) 303–438. https://doi.org/10.1016/0920-5861(92)80002-5. [35] A. de Lucas-Consuegra F. Dorado J.L. Valverde R. Karoum P. Vernoux Low-temperature propene combustion over Pt/K-βAl2O3 electrochemical catalyst: characterization, catalytic activity measurements, and investigation of the NEMCA effect J. Catal. 251 2007 474 484 10.1016/j.jcat.2007.06.031 A. de Lucas-Consuegra, F. Dorado, J.L. Valverde, R. Karoum, P. Vernoux, Low-temperature propene combustion over Pt/K-βAl2O3 electrochemical catalyst: characterization, catalytic activity measurements, and investigation of the NEMCA effect, J. Catal.251 (2007) 474–484. https://doi.org/10.1016/j.jcat.2007.06.031. [36] P. Vernoux L. Lizarraga M.N. Tsampas F.M. Sapountzi A. De Lucas-Consuegra J.L. Valverde S. Souentie C.G. Vayenas D. Tsiplakides S. Balomenou E.A. Baranova Ionically conducting ceramics as active catalyst supports Chem. Rev. 113 2013 8192 8260 10.1021/cr4000336 P. Vernoux, L. Lizarraga, M.N. Tsampas, F.M. Sapountzi, A. De Lucas-Consuegra, J.L. Valverde, S. Souentie, C.G. Vayenas, D. Tsiplakides, S. Balomenou, E.A. Baranova, Ionically conducting ceramics as active catalyst supports, Chem. Rev.113 (2013) 8192–8260. https://doi.org/10.1021/cr4000336. [37] G. Pekridis N. Kaklidis M. Konsolakis C. Athanasiou I.V. Yentekakis G.E. Marnellos A comparison between electrochemical and conventional catalyst promotion: the case of N2O reduction by alkanes or alkenes over K-modified Pd catalysts Solid State Ionics 2011 653 658 10.1016/j.ssi.2010.03.024 G. Pekridis, N. Kaklidis, M. Konsolakis, C. Athanasiou, I.V. Yentekakis, G.E. Marnellos, A comparison between electrochemical and conventional catalyst promotion: the case of N2O reduction by alkanes or alkenes over K-modified Pd catalysts, in: Solid State Ionics. (2011) 653–658. https://doi.org/10.1016/j.ssi.2010.03.024. [38] S. Armenise E. García-Bordejé J.L. Valverde E. Romeo A. Monzón A Langmuir–Hinshelwood approach to the kinetic modelling of catalytic ammonia decomposition in an integral reactor Phys. Chem. Chem. Phys. 15 2013 12104 10.1039/c3cp50715g S. Armenise, E. García-Bordejé, J.L. Valverde, E. Romeo, A. Monzón, A Langmuir–Hinshelwood approach to the kinetic modelling of catalytic ammonia decomposition in an integral reactor, Phys. Chem. Chem. Phys.15 (2013) 12104. https://doi.org/10.1039/c3cp50715g. [39] C.G. Vayenas S. Bebelis C. Pliangos S. Brosda D. Tsiplakides Electrochemical Activation of Catalysis 2002 Kluwer Academic Publishers New York 10.1007/b115566 C.G. Vayenas, S. Bebelis, C. Pliangos, S. Brosda, D. Tsiplakides, Electrochemical Activation of Catalysis, Kluwer Academic Publishers, New York, 2002. https://doi.org/10.1007/b115566. [40] F. Dorado A. de Lucas-Consuegra C. Jiménez J.L. Valverde Influence of the reaction temperature on the electrochemical promoted catalytic behaviour of platinum impregnated catalysts for the reduction of nitrogen oxides under lean burn conditions Appl. Catal. A Gen. 321 2007 86 92 10.1016/j.apcata.2007.01.035 F. Dorado, A. de Lucas-Consuegra, C. Jiménez, J.L. Valverde, Influence of the reaction temperature on the electrochemical promoted catalytic behaviour of platinum impregnated catalysts for the reduction of nitrogen oxides under lean burn conditions, Appl. Catal. A Gen.321 (2007) 86–92. https://doi.org/10.1016/j.apcata.2007.01.035. [41] I.V. Yentekakis A. Palermo N.C. Filkin M.S. Tikhov R.M. Lambert In situ electrochemical promotion by sodium of the platinum-catalyzed reduction of NO by propene J. Phys. Chem. B. 101 1997 3759 3768 10.1021/jp963052c I.V. Yentekakis, A. Palermo, N.C. Filkin, M.S. Tikhov, R.M. Lambert, In situ electrochemical promotion by sodium of the platinum-catalyzed reduction of NO by propene, J. Phys. Chem. B.101 (1997) 3759–3768. https://doi.org/10.1021/jp963052c. [42] A. de Lucas-Consuegra New trends of alkali promotion in heterogeneous catalysis: electrochemical promotion with alkaline ionic conductors Catal. Surv. from Asia. 19 2015 25 37 10.1007/s10563-014-9179-6 A. de Lucas-Consuegra, New trends of alkali promotion in heterogeneous catalysis: electrochemical promotion with alkaline ionic conductors, Catal. Surv. from Asia.19 (2015) 25–37. https://doi.org/10.1007/s10563-014-9179-6. [43] M. Makri A. Katsaounis C.G. Vayenas Electrochemical promotion of CO2 hydrogenation on Ru catalyst-electrodes supported on a K-β″-Al2O3 solid electrolyte Electrochim. Acta. 179 2015 556 564 10.1016/j.electacta.2015.03.144 M. Makri, A. Katsaounis, C.G. Vayenas, Electrochemical promotion of CO2 hydrogenation on Ru catalyst-electrodes supported on a K-β″-Al2O3 solid electrolyte, Electrochim. Acta.179 (2015) 556–564. https://doi.org/10.1016/j.electacta.2015.03.144. [44] N.D. Lang S. Holloway J.K. Nørskov Electrostatic adsorbate-adsorbate interactions: the poisoning and promotion of the molecular adsorption reaction Surf. Sci. 150 1985 24 38 10.1016/0039-6028(85)90208-0 N.D. Lang, S. Holloway, J.K. Nørskov, Electrostatic adsorbate-adsorbate interactions: the poisoning and promotion of the molecular adsorption reaction, Surf. Sci.150 (1985) 24–38. https://doi.org/10.1016/0039-6028(85)90208-0. [45] F.J. Williams A. Palermo S. Tracey M.S. Tikhov R.M. Lambert Electrochemical promotion by potassium of the selective hydrogenation of acetylene on platinum: reaction studies and XP spectroscopy J. Phys. Chem. B. 106 2002 5668 5672 10.1021/jp0203954 F.J. Williams, A. Palermo, S. Tracey, M.S. Tikhov, R.M. Lambert, Electrochemical promotion by potassium of the selective hydrogenation of acetylene on platinum: reaction studies and XP spectroscopy, J. Phys. Chem. B.106 (2002) 5668–5672. https://doi.org/10.1021/jp0203954. [46] J. Díez-Ramírez P. Sánchez J.L. Valverde F. Dorado Electrochemical promotion and characterization of PdZn alloy catalysts with K and Na ionic conductors for pure gaseous CO2 hydrogenation J. CO2 Util 16 2016 375 383 10.1016/j.jcou.2016.09.007 J. Díez-Ramírez, P. Sánchez, J.L. Valverde, F. Dorado, Electrochemical promotion and characterization of PdZn alloy catalysts with K and Na ionic conductors for pure gaseous CO2 hydrogenation, J. CO2 Util. 16 (2016) 375–383. https://doi.org/10.1016/j.jcou.2016.09.007. [47] S.J. Wang S.F. Yin L. Li B.Q. Xu C.F. Ng C.T. Au Investigation on modification of Ru/CNTs catalyst for the generation of COx-free hydrogen from ammonia Appl. Catal. B Environ. 52 2004 287 299 10.1016/j.apcatb.2004.05.002 S.J. Wang, S.F. Yin, L. Li, B.Q. Xu, C.F. Ng, C.T. Au, Investigation on modification of Ru/CNTs catalyst for the generation of COx-free hydrogen from ammonia, Appl. Catal. B Environ.52 (2004) 287–299. https://doi.org/10.1016/j.apcatb.2004.05.002. [48] A. Palermo A. Husain M.S. Tikhov R.M. Lambert Ag-catalysed epoxidation of propene and ethene: an investigation using electrochemical promotion of the effects of alkali, NOx, and chlorine J. Catal. 207 2002 331 340 10.1006/jcat.2002.3509 A. Palermo, A. Husain, M.S. Tikhov, R.M. Lambert, Ag-catalysed epoxidation of propene and ethene: an investigation using electrochemical promotion of the effects of alkali, NOx, and chlorine, J. Catal.207 (2002) 331–340. https://doi.org/10.1006/jcat.2002.3509. [49] A.K. Hill L. Torrente-Murciano In-situ H2 production via low temperature decomposition of ammonia: insights into the role of cesium as a promoter Int. J. Hydrogen Energy. 39 2014 7646 7654 10.1016/j.ijhydene.2014.03.043 A.K. Hill, L. Torrente-Murciano, In-situ H2 production via low temperature decomposition of ammonia: insights into the role of cesium as a promoter, Int. J. Hydrogen Energy.39 (2014) 7646–7654. https://doi.org/10.1016/j.ijhydene.2014.03.043. [50] S.F. Yin Q.H. Zhang B.Q. Xu W.X. Zhu C.F. Ng C.T. Au Investigation on the catalysis of COx-free hydrogen generation from ammonia J. Catal. 224 2004 384 396 10.1016/j.jcat.2004.03.008 S.F. Yin, Q.H. Zhang, B.Q. Xu, W.X. Zhu, C.F. Ng, C.T. Au, Investigation on the catalysis of COx-free hydrogen generation from ammonia, J. Catal.224 (2004) 384–396. https://doi.org/10.1016/j.jcat.2004.03.008. [51] P. Vernoux C.Lopez F.Gaillard E Siebert In-situ electrochemical control of the catalytic activity of platinum for the propene oxidation Solid State Ionics 175 2004 609 613 10.1016/j.ssi.2004.01.075 P. Vernoux, F.Gaillard, C.Lopez, E.Siebert, In-situ electrochemical control of the catalytic activity of platinum for the propene oxidation, Solid State Ionics. 175 (2004) 609–613. https://doi.org/10.1016/j.ssi.2004.01.075.",
      "scopus-id": "85109424241",
      "coredata": {
        "eid": "1-s2.0-S2468823121003382",
        "dc:description": "This study reports the electrochemical activation (EPOC) of ruthenium catalyst film with alkaline ion conductors for hydrogen production via catalytic decomposition of ammonia. Two electrocatalysts, Ru/Na-βAl2O3 and Ru/K-βAl2O3 have been prepared, characterized, and tested under low temperature reaction conditions (250–350 °C). The electrochemically supply of moderate amounts of alkaline ions (Na+ and K+) from the solid electrolyte support to the ruthenium catalyst film, activated the hydrogen production rate. The promotional effect has been attributed to a strengthening of the chemisorptive bond of weakly adsorbed N surface species, which stabilizes N adsorbed molecules on the ruthenium catalyst surface and thus facilitating the ammonia decomposition reaction. Among the two alkali ions, the effect of potassium was stronger, increasing the hydrogen production rate above 230% at 300 °C under optimally conditions. Temperature programmed reaction experiments also confirms the interest of EPOC for the activation of the catalyst at low temperatures.",
        "openArchiveArticle": "false",
        "prism:coverDate": "2021-07-31",
        "openaccessUserLicense": "http://creativecommons.org/licenses/by-nc-nd/4.0/",
        "prism:aggregationType": "Journal",
        "prism:url": "https://api.elsevier.com/content/article/pii/S2468823121003382",
        "dc:creator": [
          {
            "@_fa": "true",
            "$": "Pinzón, M."
          },
          {
            "@_fa": "true",
            "$": "Ruiz-López, E."
          },
          {
            "@_fa": "true",
            "$": "Romero, A."
          },
          {
            "@_fa": "true",
            "$": "de la Osa, A.R."
          },
          {
            "@_fa": "true",
            "$": "Sánchez, P."
          },
          {
            "@_fa": "true",
            "$": "de Lucas-Consuegra, A."
          }
        ],
        "link": [
          {
            "@_fa": "true",
            "@rel": "self",
            "@href": "https://api.elsevier.com/content/article/pii/S2468823121003382"
          },
          {
            "@_fa": "true",
            "@rel": "scidir",
            "@href": "https://www.sciencedirect.com/science/article/pii/S2468823121003382"
          }
        ],
        "dc:format": "application/json",
        "openaccessType": "Full",
        "pii": "S2468-8231(21)00338-2",
        "prism:volume": "511",
        "articleNumber": "111721",
        "prism:publisher": "The Authors. Published by Elsevier B.V.",
        "dc:title": "Electrochemical activation of Ru catalyst with alkaline ion conductors for the catalytic decomposition of ammonia",
        "prism:copyright": "© 2021 The Authors. Published by Elsevier B.V.",
        "openaccess": "1",
        "prism:issn": "24688231",
        "dcterms:subject": [
          {
            "@_fa": "true",
            "$": "Electrochemical promotion"
          },
          {
            "@_fa": "true",
            "$": "EPOC"
          },
          {
            "@_fa": "true",
            "$": "Ammonia decomposition"
          },
          {
            "@_fa": "true",
            "$": "Hydrogen production"
          },
          {
            "@_fa": "true",
            "$": "Ruthenium"
          }
        ],
        "openaccessArticle": "true",
        "prism:publicationName": "Molecular Catalysis",
        "openaccessSponsorType": "FundingBody",
        "prism:pageRange": "111721",
        "pubType": "fla",
        "prism:coverDisplayDate": "July 2021",
        "prism:doi": "10.1016/j.mcat.2021.111721",
        "prism:startingPage": "111721",
        "dc:identifier": "doi:10.1016/j.mcat.2021.111721",
        "openaccessSponsorName": "SPAIN 2021: Universidad De Castilla - La Mancha"
      },
      "objects": {
        "object": [
          {
            "@category": "standard",
            "@height": "374",
            "@width": "376",
            "@_fa": "true",
            "$": "https://api.elsevier.com/content/object/eid/1-s2.0-S2468823121003382-gr5.jpg?httpAccept=%2A%2F%2A",
            "@multimediatype": "JPEG image file",
            "@type": "IMAGE-DOWNSAMPLED",
            "@size": "33095",
            "@ref": "gr5",
            "@mimetype": "image/jpeg"
          },
          {
            "@category": "standard",
            "@height": "370",
            "@width": "339",
            "@_fa": "true",
            "$": "https://api.elsevier.com/content/object/eid/1-s2.0-S2468823121003382-gr6.jpg?httpAccept=%2A%2F%2A",
            "@multimediatype": "JPEG image file",
            "@type": "IMAGE-DOWNSAMPLED",
            "@size": "35648",
            "@ref": "gr6",
            "@mimetype": "image/jpeg"
          },
          {
            "@category": "standard",
            "@height": "339",
            "@width": "339",
            "@_fa": "true",
            "$": "https://api.elsevier.com/content/object/eid/1-s2.0-S2468823121003382-gr7.jpg?httpAccept=%2A%2F%2A",
            "@multimediatype": "JPEG image file",
            "@type": "IMAGE-DOWNSAMPLED",
            "@size": "32845",
            "@ref": "gr7",
            "@mimetype": "image/jpeg"
          },
          {
            "@category": "standard",
            "@height": "400",
            "@width": "376",
            "@_fa": "true",
            "$": "https://api.elsevier.com/content/object/eid/1-s2.0-S2468823121003382-gr1.jpg?httpAccept=%2A%2F%2A",
            "@multimediatype": "JPEG image file",
            "@type": "IMAGE-DOWNSAMPLED",
            "@size": "40616",
            "@ref": "gr1",
            "@mimetype": "image/jpeg"
          },
          {
            "@category": "standard",
            "@height": "775",
            "@width": "565",
            "@_fa": "true",
            "$": "https://api.elsevier.com/content/object/eid/1-s2.0-S2468823121003382-gr2.jpg?httpAccept=%2A%2F%2A",
            "@multimediatype": "JPEG image file",
            "@type": "IMAGE-DOWNSAMPLED",
            "@size": "225065",
            "@ref": "gr2",
            "@mimetype": "image/jpeg"
          },
          {
            "@category": "standard",
            "@height": "356",
            "@width": "357",
            "@_fa": "true",
            "$": "https://api.elsevier.com/content/object/eid/1-s2.0-S2468823121003382-gr3.jpg?httpAccept=%2A%2F%2A",
            "@multimediatype": "JPEG image file",
            "@type": "IMAGE-DOWNSAMPLED",
            "@size": "27531",
            "@ref": "gr3",
            "@mimetype": "image/jpeg"
          },
          {
            "@category": "standard",
            "@height": "372",
            "@width": "339",
            "@_fa": "true",
            "$": "https://api.elsevier.com/content/object/eid/1-s2.0-S2468823121003382-gr4.jpg?httpAccept=%2A%2F%2A",
            "@multimediatype": "JPEG image file",
            "@type": "IMAGE-DOWNSAMPLED",
            "@size": "28734",
            "@ref": "gr4",
            "@mimetype": "image/jpeg"
          },
          {
            "@category": "thumbnail",
            "@height": "164",
            "@width": "165",
            "@_fa": "true",
            "$": "https://api.elsevier.com/content/object/eid/1-s2.0-S2468823121003382-gr5.sml?httpAccept=%2A%2F%2A",
            "@multimediatype": "GIF image file",
            "@type": "IMAGE-THUMBNAIL",
            "@size": "8636",
            "@ref": "gr5",
            "@mimetype": "image/gif"
          },
          {
            "@category": "thumbnail",
            "@height": "164",
            "@width": "150",
            "@_fa": "true",
            "$": "https://api.elsevier.com/content/object/eid/1-s2.0-S2468823121003382-gr6.sml?httpAccept=%2A%2F%2A",
            "@multimediatype": "GIF image file",
            "@type": "IMAGE-THUMBNAIL",
            "@size": "8596",
            "@ref": "gr6",
            "@mimetype": "image/gif"
          },
          {
            "@category": "thumbnail",
            "@height": "164",
            "@width": "164",
            "@_fa": "true",
            "$": "https://api.elsevier.com/content/object/eid/1-s2.0-S2468823121003382-gr7.sml?httpAccept=%2A%2F%2A",
            "@multimediatype": "GIF image file",
            "@type": "IMAGE-THUMBNAIL",
            "@size": "8920",
            "@ref": "gr7",
            "@mimetype": "image/gif"
          },
          {
            "@category": "thumbnail",
            "@height": "164",
            "@width": "154",
            "@_fa": "true",
            "$": "https://api.elsevier.com/content/object/eid/1-s2.0-S2468823121003382-gr1.sml?httpAccept=%2A%2F%2A",
            "@multimediatype": "GIF image file",
            "@type": "IMAGE-THUMBNAIL",
            "@size": "10410",
            "@ref": "gr1",
            "@mimetype": "image/gif"
          },
          {
            "@category": "thumbnail",
            "@height": "163",
            "@width": "119",
            "@_fa": "true",
            "$": "https://api.elsevier.com/content/object/eid/1-s2.0-S2468823121003382-gr2.sml?httpAccept=%2A%2F%2A",
            "@multimediatype": "GIF image file",
            "@type": "IMAGE-THUMBNAIL",
            "@size": "19544",
            "@ref": "gr2",
            "@mimetype": "image/gif"
          },
          {
            "@category": "thumbnail",
            "@height": "163",
            "@width": "164",
            "@_fa": "true",
            "$": "https://api.elsevier.com/content/object/eid/1-s2.0-S2468823121003382-gr3.sml?httpAccept=%2A%2F%2A",
            "@multimediatype": "GIF image file",
            "@type": "IMAGE-THUMBNAIL",
            "@size": "7763",
            "@ref": "gr3",
            "@mimetype": "image/gif"
          },
          {
            "@category": "thumbnail",
            "@height": "164",
            "@width": "149",
            "@_fa": "true",
            "$": "https://api.elsevier.com/content/object/eid/1-s2.0-S2468823121003382-gr4.sml?httpAccept=%2A%2F%2A",
            "@multimediatype": "GIF image file",
            "@type": "IMAGE-THUMBNAIL",
            "@size": "7509",
            "@ref": "gr4",
            "@mimetype": "image/gif"
          },
          {
            "@category": "high",
            "@height": "1658",
            "@width": "1667",
            "@_fa": "true",
            "$": "https://api.elsevier.com/content/object/eid/1-s2.0-S2468823121003382-gr5_lrg.jpg?httpAccept=%2A%2F%2A",
            "@multimediatype": "JPEG image file",
            "@type": "IMAGE-HIGH-RES",
            "@size": "210422",
            "@ref": "gr5",
            "@mimetype": "image/jpeg"
          },
          {
            "@category": "high",
            "@height": "1637",
            "@width": "1500",
            "@_fa": "true",
            "$": "https://api.elsevier.com/content/object/eid/1-s2.0-S2468823121003382-gr6_lrg.jpg?httpAccept=%2A%2F%2A",
            "@multimediatype": "JPEG image file",
            "@type": "IMAGE-HIGH-RES",
            "@size": "261668",
            "@ref": "gr6",
            "@mimetype": "image/jpeg"
          },
          {
            "@category": "high",
            "@height": "1500",
            "@width": "1500",
            "@_fa": "true",
            "$": "https://api.elsevier.com/content/object/eid/1-s2.0-S2468823121003382-gr7_lrg.jpg?httpAccept=%2A%2F%2A",
            "@multimediatype": "JPEG image file",
            "@type": "IMAGE-HIGH-RES",
            "@size": "214801",
            "@ref": "gr7",
            "@mimetype": "image/jpeg"
          },
          {
            "@category": "high",
            "@height": "1774",
            "@width": "1667",
            "@_fa": "true",
            "$": "https://api.elsevier.com/content/object/eid/1-s2.0-S2468823121003382-gr1_lrg.jpg?httpAccept=%2A%2F%2A",
            "@multimediatype": "JPEG image file",
            "@type": "IMAGE-HIGH-RES",
            "@size": "302012",
            "@ref": "gr1",
            "@mimetype": "image/jpeg"
          },
          {
            "@category": "high",
            "@height": "3427",
            "@width": "2500",
            "@_fa": "true",
            "$": "https://api.elsevier.com/content/object/eid/1-s2.0-S2468823121003382-gr2_lrg.jpg?httpAccept=%2A%2F%2A",
            "@multimediatype": "JPEG image file",
            "@type": "IMAGE-HIGH-RES",
            "@size": "2210683",
            "@ref": "gr2",
            "@mimetype": "image/jpeg"
          },
          {
            "@category": "high",
            "@height": "1578",
            "@width": "1583",
            "@_fa": "true",
            "$": "https://api.elsevier.com/content/object/eid/1-s2.0-S2468823121003382-gr3_lrg.jpg?httpAccept=%2A%2F%2A",
            "@multimediatype": "JPEG image file",
            "@type": "IMAGE-HIGH-RES",
            "@size": "174467",
            "@ref": "gr3",
            "@mimetype": "image/jpeg"
          },
          {
            "@category": "high",
            "@height": "1648",
            "@width": "1500",
            "@_fa": "true",
            "$": "https://api.elsevier.com/content/object/eid/1-s2.0-S2468823121003382-gr4_lrg.jpg?httpAccept=%2A%2F%2A",
            "@multimediatype": "JPEG image file",
            "@type": "IMAGE-HIGH-RES",
            "@size": "189813",
            "@ref": "gr4",
            "@mimetype": "image/jpeg"
          },
          {
            "@category": "standard",
            "@_fa": "true",
            "$": "https://api.elsevier.com/content/object/eid/1-s2.0-S2468823121003382-mmc1.docx?httpAccept=%2A%2F%2A",
            "@multimediatype": "Microsoft Word file",
            "@type": "APPLICATION",
            "@size": "1570464",
            "@ref": "mmc1",
            "@mimetype": "application/word"
          },
          {
            "@category": "thumbnail",
            "@_fa": "true",
            "$": "https://api.elsevier.com/content/object/eid/1-s2.0-S2468823121003382-si1.svg?httpAccept=%2A%2F%2A",
            "@multimediatype": "Scalable Vector Graphics file",
            "@type": "ALTIMG",
            "@size": "7411",
            "@ref": "si1",
            "@mimetype": "image/svg+xml"
          },
          {
            "@category": "thumbnail",
            "@_fa": "true",
            "$": "https://api.elsevier.com/content/object/eid/1-s2.0-S2468823121003382-si10.svg?httpAccept=%2A%2F%2A",
            "@multimediatype": "Scalable Vector Graphics file",
            "@type": "ALTIMG",
            "@size": "11466",
            "@ref": "si10",
            "@mimetype": "image/svg+xml"
          },
          {
            "@category": "thumbnail",
            "@_fa": "true",
            "$": "https://api.elsevier.com/content/object/eid/1-s2.0-S2468823121003382-si11.svg?httpAccept=%2A%2F%2A",
            "@multimediatype": "Scalable Vector Graphics file",
            "@type": "ALTIMG",
            "@size": "11731",
            "@ref": "si11",
            "@mimetype": "image/svg+xml"
          },
          {
            "@category": "thumbnail",
            "@_fa": "true",
            "$": "https://api.elsevier.com/content/object/eid/1-s2.0-S2468823121003382-si12.svg?httpAccept=%2A%2F%2A",
            "@multimediatype": "Scalable Vector Graphics file",
            "@type": "ALTIMG",
            "@size": "2639",
            "@ref": "si12",
            "@mimetype": "image/svg+xml"
          },
          {
            "@category": "thumbnail",
            "@_fa": "true",
            "$": "https://api.elsevier.com/content/object/eid/1-s2.0-S2468823121003382-si2.svg?httpAccept=%2A%2F%2A",
            "@multimediatype": "Scalable Vector Graphics file",
            "@type": "ALTIMG",
            "@size": "3531",
            "@ref": "si2",
            "@mimetype": "image/svg+xml"
          },
          {
            "@category": "thumbnail",
            "@_fa": "true",
            "$": "https://api.elsevier.com/content/object/eid/1-s2.0-S2468823121003382-si3.svg?httpAccept=%2A%2F%2A",
            "@multimediatype": "Scalable Vector Graphics file",
            "@type": "ALTIMG",
            "@size": "12079",
            "@ref": "si3",
            "@mimetype": "image/svg+xml"
          },
          {
            "@category": "thumbnail",
            "@_fa": "true",
            "$": "https://api.elsevier.com/content/object/eid/1-s2.0-S2468823121003382-si4.svg?httpAccept=%2A%2F%2A",
            "@multimediatype": "Scalable Vector Graphics file",
            "@type": "ALTIMG",
            "@size": "4650",
            "@ref": "si4",
            "@mimetype": "image/svg+xml"
          },
          {
            "@category": "thumbnail",
            "@_fa": "true",
            "$": "https://api.elsevier.com/content/object/eid/1-s2.0-S2468823121003382-si5.svg?httpAccept=%2A%2F%2A",
            "@multimediatype": "Scalable Vector Graphics file",
            "@type": "ALTIMG",
            "@size": "5042",
            "@ref": "si5",
            "@mimetype": "image/svg+xml"
          },
          {
            "@category": "thumbnail",
            "@_fa": "true",
            "$": "https://api.elsevier.com/content/object/eid/1-s2.0-S2468823121003382-si6.svg?httpAccept=%2A%2F%2A",
            "@multimediatype": "Scalable Vector Graphics file",
            "@type": "ALTIMG",
            "@size": "10976",
            "@ref": "si6",
            "@mimetype": "image/svg+xml"
          },
          {
            "@category": "thumbnail",
            "@_fa": "true",
            "$": "https://api.elsevier.com/content/object/eid/1-s2.0-S2468823121003382-si7.svg?httpAccept=%2A%2F%2A",
            "@multimediatype": "Scalable Vector Graphics file",
            "@type": "ALTIMG",
            "@size": "11230",
            "@ref": "si7",
            "@mimetype": "image/svg+xml"
          },
          {
            "@category": "thumbnail",
            "@_fa": "true",
            "$": "https://api.elsevier.com/content/object/eid/1-s2.0-S2468823121003382-si8.svg?httpAccept=%2A%2F%2A",
            "@multimediatype": "Scalable Vector Graphics file",
            "@type": "ALTIMG",
            "@size": "11313",
            "@ref": "si8",
            "@mimetype": "image/svg+xml"
          },
          {
            "@category": "thumbnail",
            "@_fa": "true",
            "$": "https://api.elsevier.com/content/object/eid/1-s2.0-S2468823121003382-si9.svg?httpAccept=%2A%2F%2A",
            "@multimediatype": "Scalable Vector Graphics file",
            "@type": "ALTIMG",
            "@size": "9451",
            "@ref": "si9",
            "@mimetype": "image/svg+xml"
          },
          {
            "@category": "standard",
            "@_fa": "true",
            "$": "https://api.elsevier.com/content/object/eid/1-s2.0-S2468823121003382-am.pdf?httpAccept=%2A%2F%2A",
            "@multimediatype": "Acrobat PDF file",
            "@type": "AAM-PDF",
            "@size": "1635790",
            "@ref": "am",
            "@mimetype": "application/pdf"
          }
        ]
      },
      "link": {
        "@rel": "abstract",
        "@href": "https://api.elsevier.com/content/abstract/scopus_id/85109424241"
      }
    }
  }
}