{
  "metadata": {
    "title": "Evaluation of Co-Fe, Cu-Fe, Ni-Al and Ni-Fe mixed oxides in catalytic combustion of methane: Comparison study and investigating the effect of preparation method",
    "authors": "; ",
    "journal": "Molecular Catalysis",
    "date": "2023-03-01",
    "doi": "10.1016/j.mcat.2023.112989",
    "abstract": "",
    "uri": "https://api.elsevier.com/content/article/pii/S2468823123000767",
    "pii": "S2468823123000767"
  },
  "fulltext": {
    "full-text-retrieval-response": {
      "scopus-eid": "2-s2.0-85147554692",
      "originalText": "serial JL 315758 291210 291744 291790 291809 31 Molecular Catalysis MOLECULARCATALYSIS 2023-02-07 2023-02-07 2023-02-07 2023-02-07 2023-09-20T11:58:35 1-s2.0-S2468823123000767 S2468-8231(23)00076-7 S2468823123000767 10.1016/j.mcat.2023.112989 S300 S300.1 FULL-TEXT 1-s2.0-S2468823123X00042 2023-09-20T11:26:20.971783Z 0 0 20230301 2023 2023-02-08T00:58:08.93398Z absattachment articleinfo articlenumber articletitlenorm authfirstinitialnorm authfirstsurnamenorm cid cids contenttype copyright crossmark dateloaded dateloadedtxt datesearch datesort dateupdated dco docsubtype doctype doi eid ewtransactionid hubeid indexeddate issn issnnorm itemstage itemtransactionid itemweight openaccess openarchive pg pgfirst pii piinorm pubdatestart pubdatetxt pubyr sortorder srctitle srctitlenorm srctype ssids alllist content subj subheadings suppl tomb volfirst volissue volumelist webpdf webpdfpagecount yearnav figure table body mmlmath affil articletitle auth authfirstini authfull authkeywords authlast highlightsabst primabst ref specialabst 2468-8231 24688231 true 538 538 C Volume 538 20 112989 112989 112989 20230301 1 March 2023 2023-03-01 2023 article fla © 2023 Elsevier B.V. All rights reserved. EVALUATIONCOFECUFENIALNIFEMIXEDOXIDESINCATALYTICCOMBUSTIONMETHANECOMPARISONSTUDYINVESTIGATINGEFFECTPREPARATIONMETHOD SHAFAEI A 1 Introduction 2 Experimental section 2.1 Raw materials 2.2 Catalyst preparation 2.3 Characterization 2.4 Catalytic activity tests 3 Results and discussion 4 Conclusions References KONG 2018 2526 2532 Q SINGH 2020 1 13 S ASGHAR 2021 106064 U AZIMI 2022 283 296 N LI 2009 307 312 J MUNDHWA 2018 487 514 M CHEN 2011 216 222 J CIUPARU 2002 593 649 D NILSSON 2015 2481 2489 J KOZLOV 2016 111 121 S GELIN 2002 1 37 P HAYES 2001 4815 4835 R CHEN 2015 140 171 J BRIOT 1991 301 314 P BALDWIN 1990 131 138 T CULLIS 1983 267 285 C JEONG 2016 259 262 M KUMAR 2010 77 84 M SHAH 2021 V LI 2016 2187 2195 H TAO 2015 1 10 F MO 2016 8113 8122 S WANG 2017 419 429 F BARBATO 2015 381 390 P JUNG 2020 118710 S NAM 2021 118895 H LIOTTA 2013 3085 3102 L HOJJATINAJAFABADI 2023 A BALADI 2022 114270 E TANG 2018 38 52 M HU 2016 17967 17975 S WEISS 2000 75 90 W DAVOODBEYGI 2019 16443 16451 Y DAVOODBEYGI 2018 22281 22290 Y GUO 2019 431 441 Q WU 2015 1888 1901 H MANSOORIANFAR 2022 114113 M LIU 2017 1 6 F AKBARI 2021 5181 5196 E FAN 2018 588 595 X RAO 2022 134595 L AMMAR 2001 186 192 S ZHENG 2004 661 663 H LI 2015 8920 8930 M DUMITRU 2013 178 186 R SADAKANE 2012 17766 17770 M LI 2010 4594 4598 Z LI 2017 590 600 X CHEN 2006 447 450 M HEIDARI 2014 12655 12660 F RATEGARPANAH 2018 268 280 A MAO 2021 982 992 H SOLANKI 2019 6390 6406 B HAMMICHEBELLAL 2016 384 397 Y BEJAOUI 2020 15 M BRAGA 2011 1383 1392 T OZKARAAYDINOGLU 2009 9711 9722 S POMPEO 2007 175 183 F ZHU 2011 7094 7104 J WANG 2003 13 23 J LI 2009 652 656 Y CHEN 2013 12 18 J LI 2007 410 415 S CHU 2021 23954 23961 P LUO 2012 121 129 J SHAFAEIX2023X112989 SHAFAEIX2023X112989XA 2025-02-07T00:00:00.000Z 2025-02-07T00:00:00.000Z http://creativecommons.org/licenses/by-nc-nd/4.0/ © 2023 Elsevier B.V. All rights reserved. https://doi.org/10.15223/policy-017 https://doi.org/10.15223/policy-037 https://doi.org/10.15223/policy-012 https://doi.org/10.15223/policy-029 https://doi.org/10.15223/policy-004 item S2468-8231(23)00076-7 S2468823123000767 1-s2.0-S2468823123000767 10.1016/j.mcat.2023.112989 315758 2023-09-20T11:26:20.971783Z 2023-03-01 1-s2.0-S2468823123000767-main.pdf https://s3-eu-west-1.amazonaws.com/prod-ucs-content-store-eu-west/content/pii:S2468823123000767/MAIN/application/pdf/8c69ec00190156af4761c5e144626c41/main.pdf main.pdf pdf true 15123287 MAIN 10 1-s2.0-S2468823123000767-main_1.png https://s3-eu-west-1.amazonaws.com/prod-ucs-content-store-eu-west/content/pii:S2468823123000767/PREVIEW/image/png/a199cd31ca4d0204f6dca3574617c517/main_1.png main_1.png png 56882 849 656 IMAGE-WEB-PDF 1 1-s2.0-S2468823123000767-gr1.jpg https://s3-eu-west-1.amazonaws.com/prod-ucs-content-store-eu-west/content/pii:S2468823123000767/gr1/DOWNSAMPLED/image/jpeg/510393462c373baedb2287e24a686257/gr1.jpg gr1 gr1.jpg jpg 32178 363 565 IMAGE-DOWNSAMPLED 1-s2.0-S2468823123000767-gr2.jpg https://s3-eu-west-1.amazonaws.com/prod-ucs-content-store-eu-west/content/pii:S2468823123000767/gr2/DOWNSAMPLED/image/jpeg/cadfa237514925ecdce4190859150694/gr2.jpg gr2 gr2.jpg jpg 86874 867 376 IMAGE-DOWNSAMPLED 1-s2.0-S2468823123000767-ga1.jpg https://s3-eu-west-1.amazonaws.com/prod-ucs-content-store-eu-west/content/pii:S2468823123000767/ga1/DOWNSAMPLED/image/jpeg/96b21420b756c987f8142e24de5925ac/ga1.jpg ga1 true ga1.jpg jpg 17955 200 323 IMAGE-DOWNSAMPLED 1-s2.0-S2468823123000767-gr3.jpg https://s3-eu-west-1.amazonaws.com/prod-ucs-content-store-eu-west/content/pii:S2468823123000767/gr3/DOWNSAMPLED/image/jpeg/71b3b879f4d90782bcb6853142c26701/gr3.jpg gr3 gr3.jpg jpg 121231 978 558 IMAGE-DOWNSAMPLED 1-s2.0-S2468823123000767-gr4.jpg https://s3-eu-west-1.amazonaws.com/prod-ucs-content-store-eu-west/content/pii:S2468823123000767/gr4/DOWNSAMPLED/image/jpeg/69e985f766e9c430bbd692ca9e571af5/gr4.jpg gr4 gr4.jpg jpg 217175 793 565 IMAGE-DOWNSAMPLED 1-s2.0-S2468823123000767-gr5.jpg https://s3-eu-west-1.amazonaws.com/prod-ucs-content-store-eu-west/content/pii:S2468823123000767/gr5/DOWNSAMPLED/image/jpeg/325d78a76b3e672c83b6f59bbf94687b/gr5.jpg gr5 gr5.jpg jpg 322005 943 753 IMAGE-DOWNSAMPLED 1-s2.0-S2468823123000767-gr6.jpg https://s3-eu-west-1.amazonaws.com/prod-ucs-content-store-eu-west/content/pii:S2468823123000767/gr6/DOWNSAMPLED/image/jpeg/e1082dba0ed224c518d7186411dcc2ef/gr6.jpg gr6 gr6.jpg jpg 78386 827 753 IMAGE-DOWNSAMPLED 1-s2.0-S2468823123000767-gr7.jpg https://s3-eu-west-1.amazonaws.com/prod-ucs-content-store-eu-west/content/pii:S2468823123000767/gr7/DOWNSAMPLED/image/jpeg/69109dda20728d9051b43e736450e9d3/gr7.jpg gr7 gr7.jpg jpg 27123 264 376 IMAGE-DOWNSAMPLED 1-s2.0-S2468823123000767-gr8.jpg https://s3-eu-west-1.amazonaws.com/prod-ucs-content-store-eu-west/content/pii:S2468823123000767/gr8/DOWNSAMPLED/image/jpeg/901bd82def0a441d68fb47993715b39a/gr8.jpg gr8 gr8.jpg jpg 35170 288 376 IMAGE-DOWNSAMPLED 1-s2.0-S2468823123000767-gr9.jpg https://s3-eu-west-1.amazonaws.com/prod-ucs-content-store-eu-west/content/pii:S2468823123000767/gr9/DOWNSAMPLED/image/jpeg/2b8a0d0470e0529f4d0286cee7c3b2d1/gr9.jpg gr9 gr9.jpg jpg 11539 256 376 IMAGE-DOWNSAMPLED 1-s2.0-S2468823123000767-gr1.sml https://s3-eu-west-1.amazonaws.com/prod-ucs-content-store-eu-west/content/pii:S2468823123000767/gr1/THUMBNAIL/image/gif/a546b2ffc013e1e048354f87162cda84/gr1.sml gr1 gr1.sml sml 11023 141 219 IMAGE-THUMBNAIL 1-s2.0-S2468823123000767-gr2.sml https://s3-eu-west-1.amazonaws.com/prod-ucs-content-store-eu-west/content/pii:S2468823123000767/gr2/THUMBNAIL/image/gif/fd6be54604da7f91181ada31041c689c/gr2.sml gr2 gr2.sml sml 7010 164 71 IMAGE-THUMBNAIL 1-s2.0-S2468823123000767-ga1.sml https://s3-eu-west-1.amazonaws.com/prod-ucs-content-store-eu-west/content/pii:S2468823123000767/ga1/THUMBNAIL/image/gif/c42bed8b175c6edfa3ba27a45d71b668/ga1.sml ga1 true ga1.sml sml 9705 135 219 IMAGE-THUMBNAIL 1-s2.0-S2468823123000767-gr3.sml https://s3-eu-west-1.amazonaws.com/prod-ucs-content-store-eu-west/content/pii:S2468823123000767/gr3/THUMBNAIL/image/gif/9cb23e93b5734cd7b5ef0c05cfd15acd/gr3.sml gr3 gr3.sml sml 7630 163 93 IMAGE-THUMBNAIL 1-s2.0-S2468823123000767-gr4.sml https://s3-eu-west-1.amazonaws.com/prod-ucs-content-store-eu-west/content/pii:S2468823123000767/gr4/THUMBNAIL/image/gif/b253064a3a7fc892be01a9734d7fbcf4/gr4.sml gr4 gr4.sml sml 18126 164 117 IMAGE-THUMBNAIL 1-s2.0-S2468823123000767-gr5.sml https://s3-eu-west-1.amazonaws.com/prod-ucs-content-store-eu-west/content/pii:S2468823123000767/gr5/THUMBNAIL/image/gif/d24cc243c272bd4b26e7fef05256acd4/gr5.sml gr5 gr5.sml sml 20818 164 131 IMAGE-THUMBNAIL 1-s2.0-S2468823123000767-gr6.sml https://s3-eu-west-1.amazonaws.com/prod-ucs-content-store-eu-west/content/pii:S2468823123000767/gr6/THUMBNAIL/image/gif/4842dfd6c14e49cb03b208ed1dee9e74/gr6.sml gr6 gr6.sml sml 7787 164 149 IMAGE-THUMBNAIL 1-s2.0-S2468823123000767-gr7.sml https://s3-eu-west-1.amazonaws.com/prod-ucs-content-store-eu-west/content/pii:S2468823123000767/gr7/THUMBNAIL/image/gif/4a4af90b3d34eb50134580481960bae4/gr7.sml gr7 gr7.sml sml 8831 154 219 IMAGE-THUMBNAIL 1-s2.0-S2468823123000767-gr8.sml https://s3-eu-west-1.amazonaws.com/prod-ucs-content-store-eu-west/content/pii:S2468823123000767/gr8/THUMBNAIL/image/gif/86641b8a700a7dfdeacfe0cc82296e37/gr8.sml gr8 gr8.sml sml 9619 164 214 IMAGE-THUMBNAIL 1-s2.0-S2468823123000767-gr9.sml https://s3-eu-west-1.amazonaws.com/prod-ucs-content-store-eu-west/content/pii:S2468823123000767/gr9/THUMBNAIL/image/gif/c7b30c3bd1e2e81dc782ab4c46a31668/gr9.sml gr9 gr9.sml sml 3891 149 219 IMAGE-THUMBNAIL 1-s2.0-S2468823123000767-gr1_lrg.jpg https://s3-eu-west-1.amazonaws.com/prod-ucs-content-store-eu-west/content/pii:S2468823123000767/HIGHRES/image/jpeg/3082fac27b88fa7d17dfbb7082278750/gr1_lrg.jpg gr1 gr1_lrg.jpg jpg 259001 1608 2500 IMAGE-HIGH-RES 1-s2.0-S2468823123000767-gr2_lrg.jpg https://s3-eu-west-1.amazonaws.com/prod-ucs-content-store-eu-west/content/pii:S2468823123000767/HIGHRES/image/jpeg/4e723afa0b47c35da29e25317e9d8ecb/gr2_lrg.jpg gr2 gr2_lrg.jpg jpg 648287 3843 1667 IMAGE-HIGH-RES 1-s2.0-S2468823123000767-ga1_lrg.jpg https://s3-eu-west-1.amazonaws.com/prod-ucs-content-store-eu-west/content/pii:S2468823123000767/HIGHRES/image/jpeg/f97b80cac50d331a6a87a3572ca55517/ga1_lrg.jpg ga1 true ga1_lrg.jpg jpg 143106 886 1432 IMAGE-HIGH-RES 1-s2.0-S2468823123000767-gr3_lrg.jpg https://s3-eu-west-1.amazonaws.com/prod-ucs-content-store-eu-west/content/pii:S2468823123000767/HIGHRES/image/jpeg/e01a045454426aa82fd3bee8b6ea4341/gr3_lrg.jpg gr3 gr3_lrg.jpg jpg 874741 4333 2471 IMAGE-HIGH-RES 1-s2.0-S2468823123000767-gr4_lrg.jpg https://s3-eu-west-1.amazonaws.com/prod-ucs-content-store-eu-west/content/pii:S2468823123000767/HIGHRES/image/jpeg/278d41df7c1490faa3ccb266c535b8bc/gr4_lrg.jpg gr4 gr4_lrg.jpg jpg 1763324 3508 2500 IMAGE-HIGH-RES 1-s2.0-S2468823123000767-gr5_lrg.jpg https://s3-eu-west-1.amazonaws.com/prod-ucs-content-store-eu-west/content/pii:S2468823123000767/HIGHRES/image/jpeg/3b67d3e6a7817df0a41698e82d048498/gr5_lrg.jpg gr5 gr5_lrg.jpg jpg 3096008 4174 3333 IMAGE-HIGH-RES 1-s2.0-S2468823123000767-gr6_lrg.jpg https://s3-eu-west-1.amazonaws.com/prod-ucs-content-store-eu-west/content/pii:S2468823123000767/HIGHRES/image/jpeg/e9415f34fb81bcc156ba002d75fd1e8a/gr6_lrg.jpg gr6 gr6_lrg.jpg jpg 701852 3661 3333 IMAGE-HIGH-RES 1-s2.0-S2468823123000767-gr7_lrg.jpg https://s3-eu-west-1.amazonaws.com/prod-ucs-content-store-eu-west/content/pii:S2468823123000767/HIGHRES/image/jpeg/3f43fa9a3a3c182342c9e71735588aba/gr7_lrg.jpg gr7 gr7_lrg.jpg jpg 177885 1170 1667 IMAGE-HIGH-RES 1-s2.0-S2468823123000767-gr8_lrg.jpg https://s3-eu-west-1.amazonaws.com/prod-ucs-content-store-eu-west/content/pii:S2468823123000767/HIGHRES/image/jpeg/f30274eac4d82175d9c6a015df6ea16b/gr8_lrg.jpg gr8 gr8_lrg.jpg jpg 226122 1277 1667 IMAGE-HIGH-RES 1-s2.0-S2468823123000767-gr9_lrg.jpg https://s3-eu-west-1.amazonaws.com/prod-ucs-content-store-eu-west/content/pii:S2468823123000767/HIGHRES/image/jpeg/f6f056d507e3e5f77b39b76ea743059b/gr9_lrg.jpg gr9 gr9_lrg.jpg jpg 96702 1137 1667 IMAGE-HIGH-RES 1-s2.0-S2468823123000767-si1.svg https://s3-eu-west-1.amazonaws.com/prod-ucs-content-store-eu-west/content/pii:S2468823123000767/image/svg+xml/3830bf83e434793453d98511c8c8ee65/si1.svg si1 si1.svg svg 12318 ALTIMG 1-s2.0-S2468823123000767-si2.svg https://s3-eu-west-1.amazonaws.com/prod-ucs-content-store-eu-west/content/pii:S2468823123000767/image/svg+xml/30a356d484217b06c96cec93c35859ec/si2.svg si2 si2.svg svg 2500 ALTIMG 1-s2.0-S2468823123000767-si3.svg https://s3-eu-west-1.amazonaws.com/prod-ucs-content-store-eu-west/content/pii:S2468823123000767/image/svg+xml/d430cd506ee261ad064dfd2647669bc1/si3.svg si3 si3.svg svg 4126 ALTIMG 1-s2.0-S2468823123000767-si4.svg https://s3-eu-west-1.amazonaws.com/prod-ucs-content-store-eu-west/content/pii:S2468823123000767/image/svg+xml/806eb506bd7c80b82dc22d3bb9559845/si4.svg si4 si4.svg svg 7724 ALTIMG 1-s2.0-S2468823123000767-si5.svg https://s3-eu-west-1.amazonaws.com/prod-ucs-content-store-eu-west/content/pii:S2468823123000767/image/svg+xml/16f212d3a54d92020ce120a3091a774d/si5.svg si5 si5.svg svg 15178 ALTIMG 1-s2.0-S2468823123000767-si6.svg https://s3-eu-west-1.amazonaws.com/prod-ucs-content-store-eu-west/content/pii:S2468823123000767/image/svg+xml/16c46e54733be233e386f00967e775df/si6.svg si6 si6.svg svg 14814 ALTIMG 1-s2.0-S2468823123000767-am.pdf https://s3-eu-west-1.amazonaws.com/prod-ucs-content-store-eu-west/content/egi:10FPJNV45PF/MAIN/application/pdf/27397ffdb297f82878ff66f1e931202b/am.pdf am am.pdf pdf false 2212614 AAM-PDF MCAT 112989 112989 S2468-8231(23)00076-7 10.1016/j.mcat.2023.112989 Elsevier B.V. Fig. 1 Block flow diagram of catalytic test set up. Fig 1 Fig. 2 XRD patterns of CoFe2O4 (Sol gel and co-precipitation), CuFe2O4 (Sol gel and co-precipitation), NiAl2O4 and NiFe2O4. Fig 2 Fig. 3 Nitrogen adsorption/desorption isotherms and pore size distributions of the CoFe2O4 (Sol gel and co-precipitation), CuFe2O4 (Sol gel and co-precipitation), NiAl2O4 and NiFe2O4. Fig 3 Fig. 4 SEM micrographs of the (a) CoFe2O4 (co-precipitation) (b) CoFe2O4 (Sol gel) (c) CuFe2O4 (Co-precipitation) (d)CuFe2O4 (Sol gel) (e) NiAl2O4 (f) NiFe2O4. Fig 4 Fig. 5 SEM micrographs of the (a) CoFe2O4 (co-precipitation) (b) CoFe2O4 (Sol gel) (c) CuFe2O4 (Co-precipitation) (d)CuFe2O4 (Sol gel) (e) NiAl2O4 (f) NiFe2O4. Fig 5 Fig. 6 Energy dispersive X-ray (EDX) analysis of the (a) CoFe2O4 (co-precipitation) (b) CoFe2O4 (Sol gel), (c) CuFe2O4 (Co-precipitation) (d) CuFe2O4 (Sol gel) (e) NiAl2O4 (f) NiFe2O4. Fig 6 Fig. 7 TPR diagrams of CoFe2O4 and CuFe2O4 catalysts. Fig 7 Fig. 8 CH4 conversion of synthesized catalysts (GHSV=14,000 h − 1, P = 1 atm). Fig 8 Fig. 9 Stability of CoFe2O4 (co-participation) in 550 °C for 900 min. Fig 9: Table 1 Crystalline size of species in various samples. Table 1 Samples Preparation Method Crystalline size [nm] NiAl2O4 Co-precipitation 11.30 NiFe2O4 Co-precipitation 10.13 CuFe2O4 Co-precipitation 11.80 CuFe2O4 Sol gel 16.20 CoFe2O4 Co-precipitation 13.20 CoFe2O4 Sol gel 26.70 Table 2 Structural characteristics for synthesis catalysts. Table 2 Samples Preparation Method Surface area [m2 g-1] Mesopore volume [cm3 g − 1] Mesopore size [nm] NiAl2O4 Co-precipitation 45.91 0.20 17.82 NiFe2O4 Co-precipitation 9.711 0.05 19.80 CuFe2O4 Co-precipitation 12.86 0.11 35.25 CuFe2O4 Sol gel 4.70 0.04 38.72 CoFe2O4 Co-precipitation 41.81 0.25 24.19 CoFe2O4 Sol gel 11.12 0.11 42.74 Table 3 Summary of catalysts and reaction conditions for Catalytic Combustion of Methane. Table 3 Catalyst Preparation method space velocity T90( °C) Ref 1 Co(0)Cr(10) co-precipitation 36,000 h − 1 592 [63] 2 Co(5)Cr(1) co-precipitation 36,000 h − 1 530 3 BaAl12O19-α co-precipitation 15,000 h − 1 841 [64] 4 LaMnO3 Sol gel – 550 [65] 5 LaFeO3 Sol gel – 650 6 Cu/ γ-Al2O3 Impregnation 12,000 h − 1 590 [66] 7 CoFe2O4 co-precipitation 14,000 h − 1 520 This work Evaluation of Co-Fe, Cu-Fe, Ni-Al and Ni-Fe mixed oxides in catalytic combustion of methane: Comparison study and investigating the effect of preparation method Arash Shafaei Abdullah Irankhah ⁎ Hydrogen and Fuel Cell Research Laboratory, Department of Chemical Engineering, Faculty of Engineering, University of Kashan, Kashan, Iran Hydrogen and Fuel Cell Research Laboratory, Department of Chemical Engineering, Faculty of Engineering University of Kashan Kashan Iran Hydrogen and Fuel Cell Research Laboratory, Department of Chemical Engineering, Faculty of Engineering, University of Kashan, Kashan, Iran ⁎ Corresponding author. In this investigation, co-precipitation (Cp) and sol gel (Sg) technique were employed to fabricate CoFe2O4, CuFe2O4, NiAl2O4 and NiFe2O4 mixed oxide catalysts. The catalytic activity of these catalysts in methane combustion was studied at temperature range of 300 to 550 °C and gas hourly space velocity of 14,000 h − 1. Different analyses including the X-Ray Diffraction (XRD), N2 adsorption-desorption (BET), Energy Dispersive X-Ray Analysis (EDX), Scanning Electron Microscopy (SEM) and H2-TPR analysis were used in order to investigate the structural properties of the catalysts. The small crystal size improves the surface area and catalyst active site, thus increasing the rate of reaction and conversion factor. The results revealed that the method of preparation had an important role in controlling the structural features of the catalysts, resulting in an important difference in catalytic presentation. The reactor tests required CO2 selectivity of 100% for all synthesized catalysts, and the best catalytic activity (97% methane conversion) and structural properties (surface area of 41.81 m2 g − 1 and crystal size of 13.20 nm) was demonstrated by CoFe2O4 (co-precipitation) sample. It was also revealed that catalysts synthesized using sol gel method had agglomeration impact on the surface of the catalyst, leading to an increase in crystalline size and a decrease in catalytic activity. Graphical abstract Image, graphical abstract Keywords Catalytic methane combustion Cobalt oxide Mixed oxide catalysts Preparation method Data availability No data was used for the research described in the article. 1 Introduction Nowadays, the constantly increasing demand for energy is among the main concerns over economic growth and social development. Because of its large quantities in the world and its high calorific value, natural gas is widely used in power generation and heating applications. Methane, as the main component of natural gas, is an important clean energy with low nitrogen and sulfur contaminants [1–4].Methane combustion requires high temperatures, up to 1400 °C, for complete combustion. In this process, the nitrogen in air and the traces of nitrogen and sulfur in natural gas can be oxidized into harmful NOx and SOx[5,6]. Incomplete combustion causes unburned methane to be released, causing a greenhouse effect 20 times as much as CO2. NOx formation can be reduced by employing catalytic combustion to lower the temperatures of methane combustion. The important issue is to make a high-efficiency and stable catalyst that can promise the complete combustion of methane at low temperatures. Compared to the conventional flame combustion, the presence of certain catalysts may lead to a decrease in the working temperature (<1400 °C). The operational temperature for catalytic methane combustion (CMC) can be divided into a relatively lower range (about 300–700 °C) and a relatively higher one (about 700–1400 °C), depending on the target application. [7]. Due to the remarkable abatement of pollutant emissions and prolonged catalyst lifetime, low temperature CMC becomes more attractive. For example, the reusability and reproducibility of catalysts, particularly for noble metal catalysts, are shortened at high temperatures. In this regard, the challenging issue is to make catalysts which have high catalytic activity, low light-off temperature and good thermal stability even for such low temperature operations [8]. Eq (1) shows the main equation of methane combustion: (1) C H 4 + 2 O 2 ↔ C O 2 + 2 H 2 Δ H 298 = − 802.7 Kj / mol The common catalysts for this process could be divided into two groups: novel metal catalysts and metal oxides. The former (Pd, Pt, Au, etc.) have high catalytic activity [9–13], but they are very expensive. The Pd and Pd supported on ϒ-Al2O3 are the most interesting catalytic materials for methane combustion, which show high activity and acceptable active phase thermo stability [14]. These metals are very active catalysts for complete oxidation of hydrocarbons. As mentioned above, owing to their high activities, palladium and platinum are reported to be the most extensively employed metals for complete oxidation of methane [15–17]. In recent studies, with regard to higher activities of Pd compared to Pt, Pd is in the center of attention for methane oxidation. Kumar et al. investigated the behavior of palladium at high temperatures in methane combustion. Pd/CeZrO2 and Pd/LaFeO3 catalysts have provided better Pd dispersion in Pd/CeZrO2 catalysts and they have shown more stability and activity in the same temperature range. In addition, Jong et al. have investigated the effect of NiO addition to alumina-based palladium catalyst to achieve a higher conversion rate of methane. It has been concluded that NiO can adsorb and release due to its cubic structure and the amount of oxygen increases in the catalyst [18–21]. The transition metal oxides (CoOx, NiO, CuO, Cr2O3, and MnOx), spinel oxides, and Perovskites-type catalysts as non-noble metal catalysts are more desirable since the limitation in abundance of noble metals and their high cost have no chance for further industrialization [22–30]. Metal oxides are more economical than noble metals. High conversion of metal oxides such as TiO2, ZnO, Co3O4, and Fe3O4 make them proper for low-temperature oxidation reactions. Moreover, such materials are usually reduced through losing their lattice oxygen at moderate temperatures (< 500 °C). The easy reduction of reducible metal oxides has a major impact on the long-term stability for methane combustion or reforming [28,31-38]. The following factors including reactor temperature, the ratio of oxygen/ methane, gas hourly space velocity (GHSV), amount of catalyst loading, and some catalytic process like particular surface area, and crystal size are important in methane combustion; and the uniform catalyst distribution affects catalyst combustion of methane [35,39,40]. Transition metal ions are the activation centers of gaseous oxygen by changing the valence state. The capability for oxygen activation is influenced by crystalline structure of the metal oxide. Moreover, the catalysts for catalytic combustion of methane such as simple transition metal oxides could be employed with high catalytic activity [41,42]. Recently, the CoFe2O4 has gained attention because of its low cost and suitable chemical stability [43,44]. Li et al. [45] prepared the MFe2O4(M = Co, Ni, Cu, Mn) nanofibers using the electrospinning technique; and after consequent heat treatment, it was demonstrated that CoFe2O4 quasi-nanofibers show the highest catalytic activity for H2O2 reduction in alkaline environment. Obviously, these materials are usually gained after calcination at high temperature, but they lead to a low surface area. Consequently, the development of an efficient technique to produce catalysts with porous structures and high surface area is urgently needed. For example, Dumitrou et al. [46] synthesized mesoporous cobalt ferrite and found out that the porous materials displayed suitable catalytic activity for lean methane combustion. Ueda et al. [47] produced 3DOM MFe2O4 (M = Zn, Ni, Co) samples using polystyrene colloidal crystal molding technique with ethylene glycol as solvent. Li et al. [48] also approved a similar technique to find 3DOM CoFe2O4 and proved that it displayed suitable electrochemical performance in Li-ion battery. In addition, Li et al. [49]. investigated the catalytic presentation for methane combustion of 3DOM CoFe2O4 by co-loading MnOx and Pd–Pt alloy nanoparticles. They demonstrated that the as-prepared samples showed a surface area of 19–28 m2/g, a high-quality 3DOM structure (103 ± 20 nm in pore size), and the noble metal or alloy nanoparticles (NPs) with a size of 2.2–3.0 nm were uniformly dispersed on the macropore wall surface of 3DOM CoFe2O4. According to our results, it is obviously achieving more optimum conditions for combustion of methane with higher surface area, pore size, and consequently more conversion response for suggested catalyst. In this study, we set out to evaluate the impact of synthesis method (co-precipitation and sol-gel) and transition metals (Fe, Co, Cu, and Ni) on the combustion activity of methane. Catalytic combustion reaction has been performed under constant feed condition at a fix temperature range 300–550 °C. Methane conversion of each catalysis has been investigated to provide suitable catalysis for methane combustion reaction. In the co-precipitation method, it has better mixing and its industrial application is more than that of the other synthesis method. Bonds are better performed at the molecular scale. In fact, NiAl2O4 was the first synthesized sample which was then promoted by substitution of Al with Fe; moreover, to promote the catalytic presentation, Cu and Co were also used as compared to Ni. 2 Experimental section 2.1 Raw materials The materials applied in this study are: Aluminum Nitrate Al(NO3)3·9H2O (Loba Chemie, 99.95%), Ferric Nitrate Fe(NO3)3·9H2O (Loba Chemie, 99.95%), Cobalt Nitrate Co(NO3)2·6H2O (Loba Chemie, 99.95%), Nickel Nitrate Ni(NO3)3·6H2O (Loba Chemie, 99.95%), Copper Nitrate Cu(NO3)2·3H2O (Loba Chemie, 99.95%) and potassium carbonate (Loba Chemie, 99.95%) without any further purification. 2.2 Catalyst preparation Different catalysts including CoFe2O4, CuFe2O4, NiAl2O4 and NiFe2O4 were prepared by Co-precipitation and sol-gel methods. In a typical synthesis of AB2O4 spinel catalyst, a suitable amount of A and B as metal and nitrate salt was, respectively, dissolved in distilled water. Precipitation agents such as metal salts and sodium carbonate were then applied. The solutions were placed in two burettes, and during precipitation, the pH was kept at about 9.The precipitates were aged by stirring at room temperature for 8 h, then dried at 80 °C for 12 h and finally calcined at 500 °C for 4 h [50]. The CoFe2O4 and CuFe2O4 catalysts were fabricated via sol-gel method to compare with the sample synthesized by co-precipitation method. Cobalt Nitrate Co(NO3)3·6H2O and Ferric Nitrate Fe(NO3)3·9H2O mixed in 2-Methoxyethonal were under constant magnetic stirring for a few minutes. After that, NH3 was added to the precursor solution in order to maintain the pH of the solution about 11. Acetic acid and ethylene glycol were added to the solution in a molar ratio of 1:1. The clear sol was completely turned to a gel. After continuous stirring for 4 h at 80 °C, the gel was dried and ground into powders before being calcined at 500 °C for 4 h. 2.3 Characterization X-ray diffractometer method (PANalytical, X'Pert-Pro, Wavelength of x-ray beam (Cu Kα): 1.54 angstrom, Anode material: Cu Voltage: 40 kV Current: 30 mA) by scanning rate 0.05 2 θ / s was employed to investigate the evaluation of the crystalline sizes and phase composition. Scattering intensities were determined over the angular range 2 θ = 10 − 80 0 . Crystalline sizes were gained by Scherrer's equation as follows: (2) d = 0.9 λ β . c o s θ Where, d is the crystalline size, λ shows the X-ray wavelength, β and θ stand for line broadening at half the maximum intensity (FWHM) and the Bragg angle, respectively. The surface morphology of the suggested catalysts was investigated by scanning electron microscopy analysis (SEM) using a Nova Nano SEM 650 instrument. N2 adsorption–desorption analysis (BET) was performed by an automatic gas adsorption analyzer (Tristar 3020, Micrometrics) at the boiling temperature of nitrogen (−196 °C) 2.4 Catalytic activity tests Catalyst activity for methane combustion reaction was done by quartz fixed-bed reactor with 8 mm inner diameter. The mass of the catalyst was 200 mg with 40–60 mesh. The reaction temperature was improved from 300 °C to 550 °C at a heating rate of 5 °C min−1, and the data point was carried out. After that, each temperature point was stabilized for 30 min. The feed gas mixture contained 4 mol.% CH4, 8 mol.% O2 balanced with Ar, and total feed (dry) flow rate was 47 ml/min, and GHSV was kept at 14,000 h − 1. Before each test, the catalysts were oxidized under pure oxygen stream (30 ml/min) at 300 °C and atmospheric pressure for 1 h. The outlet gas composition and concentration were evaluated on-line by a gas chromatograph (GC), Shimadzu-8A (Carbosieve column), with a thermal conductivity detector (TCD). BFD Experimental set up is shown in Fig. 1 . The gas in the capsule enters the reactor through pipelines. By using MFC, the flow required for the flow is measured and controlled. After passing through the MFC, the gas flow enters the reactor and then the gas flow coming out of the reactor enters the condenser to separate the water vapor contained in it. At the end, the output dry flow enters to GC device. The methane conversion is calculated as follows: M e t h a n e C o n v e r s i o n = F C H 4 i n − F C H 4 o u t F C H 4 i n F C H 4 o u t ( mol . s − 1 ) a n d F C H 4 i n are outlet streams and the methane flow rate in the inlet, respectively. Because there was no carbon monoxide formation in the experiments, selectivity of carbon monoxide for all examinations was assumed zero. 3 Results and discussion The crystalline structures of all catalysts were studied using the X-ray diffraction analysis, and the responses are illustrated in Fig. 3. As can be seen, crystalline phases are formed in all catalyst structures. The average crystalline size of the samples is investigated by Scherrer's equation and given in Table 1 . The diffraction patterns of the NiAl2O4 and NiFe2O4 samples are presented in Figs. 2 a and 2b, respectively. The peaks at 2θ = 36.963°, 59.599° and 65.495° can be related to nickel aluminum oxide (JCPDS 00–001–1299). Moreover, those located at 43.381°, 63.024° and 75.598° refer to the nickel oxide phase with the cubic structures (JCPDS 01–073–1519). In addition, the peaks at 19.331, 31.820° and 45.619° with low intensity show the presence of cubic aluminum oxide in the composition (JCPDS 00–047–1292). The diffraction peaks at 2θ = 30.263°, 43.473°, 53.888° and 62.728° can be related to the presence of NiFe2O4 (JCPDS 00–003–0875), and the peaks at 2θ= 37.460°, 57.588° and 74.868° are related to iron oxide (JCPDS 01–075–0449). According to Scherrer equation, increasing the peak height increases the crystalline size. By observing Fig. 3 a, it can be stated that NiAl2O4 sample has sharper and narrower peaks compared to NiFe2O4 sample. As a result, NiFe2O4 sample demonstrates smaller average crystalline size (10.13 nm) than NiAl2O4 (11.3 nm). The diffraction pattern of the CuFe2O4 is presented in Fig 2c. The peaks at 2θ= 18.508°, 30.168° and 62.775° indicate the formation of CuFe2O4 compound in sample a (JCPDS 00–025–0283). The presence of peaks at 2θ=33.331°, 41.056° and 56.419° as well as 2θ=36.143°, 43.834° and 58.071° shows the presence of iron oxide (JCPDS 01–084–0308) and copper oxide (JCPDS 01–083–1665) phases, respectively. The peaks of sample CuFe2O4 (Sol gel) are sharper than those of CuFe2O4 (Co-precipitation). The crystalline sizes of CuFe2O4 (Co-precipitation) and CuFe2O4 (Sol gel) samples according to the XRD data and using the Scherrer equation, were achieved 13.20 and 26.70 nm, respectively. In the case of the CoFe2O4 sample (Fig. 2d), the change was also obtained in the XRD pattern of the two samples. The peaks located at 30.273°, 37.281°, 43.473° and 57.168° are related to cobalt iron oxide (JCPDS 00–001–1121). Furthermore, the diffraction peaks at 2θ = 24.262°, 33.331°, 41.056°, 349.706°, 54.360°, 64.419°, and 72.403° as well as 2θ =36.687° and 59.084° can refer to the iron oxide (JCPDS 01–084–0308) and cobalt oxide (JCPDS 01–080–1534) phases, respectively. The crystalline sizes of CoFe2O4 (Co-precipitation, Sol gel) are 11.80 and 16.20 nm, respectively. Nitrogen adsorption-desorption isotherm versus relative pressure and pore size distributions of catalysts for NiAl2O4, NiFe2O4, CoFe2O4 and CuFe2O4 are shown in Fig. 3. The BET results of synthesis catalysts are shown in Table 2 . Regarding the IUPAC classification, the mesoporous materials with H3 hysteresis loops are in the type of IV isotherm category which are assumed by non-rigid aggregates of plate-like particles. However, the pore network contains macro-pores not totally filled with pore condensate. Mesoporous formation is clearly evident in the BJH plots for all catalysts. The formation of the hysteresis loop at the lower relative pressure and the greater slope of the adsorption profile of the NiAl2O4 sample in this catalyst affirmed the existence of smaller pores at this proposed catalyst compared to the experimental ones in the NiFe2O4 catalyst. In addition, by changing the synthesis method, no obvious change was observed in the shape of the isotherms; furthermore, the distribution of pores, shown in Fig. 3, affirmed these mentioned results. These results show that the synthesis method has no change in the structure of the sample and the shape of the pores, and that the particles have an extensive pore size distribution in macro and meso ranges. The morphology and particle size distribution of the catalysts are presented in Fig. 4 . The change in the morphology and the decrease in the particle size are clearly visible in FESEM images, showing that the preparation techniques have an impact on the structure of the catalyst. The particular surface area of the catalysis fabricated by Co-precipitation method is smaller than that of the Sol- gel method. The presence of PEG as surfactant the procedure of catalyst preparation via Co-precipitation method. By using PEG, the nuclear growth, which is significantly affect the size of particles. In fact, the presence of PEG leads to formation of smaller particles and higher surface area [51]. It is clear that the catalyst prepared by the Sol gel method has larger particles than the co-precipitated samples. Furthermore, the pore volume of CuFe2O4 (Cp) and CoFe2O4 (Cp) catalyst is much larger than CuFe2O4 (Sg) and CoFe2O4 (Sg). In order to ensure uniform distribution of catalysts, SEM micrograph with 1 micrometer resolution is presented in Fig 5 . As it can be seen in this figure, the samples are uniform, which is a good property for the catalytic performance. As can be seen, the active metals in the catalysts synthesized by Co-precipitation method had a more uniform distribution than the one synthesized by sol gel method. EDX analysis of the samples are also illustrated in Fig 6 . The reduction behaviors of CuFe2O4 and CoFe2O4 samples were considered through H2-TPR analysis, and the reduction curves are displayed in Fig. 7 . The CuFe2O4 as-prepared sample presented three main reduction peaks at ∼ 279, 437, and ∼ 687 °C. The low temperature peak at 279 °C is related to the conversion of the CuFe2O4 into metallic copper and α-Fe2O3 species. In addition, the CuO reduction into copper (Cu2+→ Cu0) occurs at this temperature [52,53]. Simultaneously, the high temperature peaks at 437 and 687 °C are attributed to the sequential reduction of α-Fe2O3 to Fe3O4 and Fe3O4 to FeO and Fe, respectively [54]. For CoFe2O4 catalyst, the weak shoulder at 335 °C was attributed to the surface cobalt species reduction [55]. As can be seen, three reduction peaks at around 420, 670, and 900 °C are characterized for the CoFe2O4 reduction. The first one is assigned to the Co2+ reduction to metallic cobalt sequentially (Co2+→ Co0). The peaks are observed at higher temperatures due to the promotion by the metal cobalt, and Fe3+ reduction to metallic iron [56]. It should be noted that the peaks for temperatures above 600 °C may have resulted from Fe2+ reduction driven by the existence of cobalt and/or textural qualities [57]. The performance of the synthesized catalysts is shown in Fig. 8 . As it is seen, in all experiments, the catalytic performance improved significantly with increasing temperature. In other words, the performance of the catalyst is directly related to temperature. In the temperature range of 400 to 550 °C, with increasing temperature, the performance of the catalyst has increased with a significant slope. The catalytic tests indicate that in the investigated temperature range, all catalysts displayed 100% selectivity towards CO2, and no CO was perceived during the reaction. In the initial review, the catalysts showed almost the same activity at low temperatures, while the activity of CoFe2O4 was significantly higher than that of other catalysts at high temperatures. NiFe2O4 has the lowest performance compared to other samples because of nickel deactivation, with the metal sintering and coke deposition caused mainly effectively by methane decomposition and Boudouard reaction [58–60]. By replacing aluminum with iron, as shown in Fig. 8, the catalyst activity is increased. As shown in Fig. 8, the catalyst activity increases by replacing aluminum with iron. As demonstrated in the figure, by adding cobalt and copper to the sample instead of nickel, the catalyst activity increased significantly. The cobalt can improve the catalytic features such as resistance to metal sintering and carbon deposition [61]. Decreased activity may be due to agglomeration of copper on the catalyst surface, leading to sharp reduction activities. In addition, slight coke formation also contributes to catalyst deactivation [62]. As shown in Fig. 8, the performance of Co-precipitated catalysts is higher than that of sol-gel-synthesized catalysts. It is also observed that the dispersion of elements in the Co-precipitation method is better than that in sol-gel. It is observed in the SEM analysis that some agglomeration has occurred in the catalysts prepared by sol-gel method, which cause an increase in the particle size and a decrease in the specific surface area, thus reducing the catalyst activity. Fig. 9 depicts the stability of CoFe2O4 (co-participation) in 550 °C during 15 hr at constant GHSV of 14,000 h − 1 and atmospheric pressure. As can be seen in this figure, no important activity loss was achieved during 15 hr and the conversion was constant and the stability was stable which affirmed that the catalyst was inactive. Based on Table 3 , the results of this research have been compared with previously reported methods and more acceptable results have been observed. 4 Conclusions In this study, CoFe2O4, CuFe2O4, NiAl2O4, and NiFe2O4 mixed oxide catalysts were prepared through the Co-precipitation method. The reactor tests revealed the CoFe2O4 and CuFe2O4 samples by 97% and 80% methane conversion had superior performance (at 550 °C, atmospheric pressure, O2/CH4 =2 molar ratio, and GHSV=14,000 h-1 operating condition). For comparison, the CoFe2O4 and CuFe2O4 catalysts were fabricated using a sol-gel procedure and the results ascertain methane conversion reduction to 90% and 73%, respectively. As well, the particle size of the CoFe2O4 and CuFe2O4 catalysts in the sol-gel method has increased to 13.5 nm and 5.6 nm, respectively, which attributed to the particle agglomeration and can be seen in the SEM analysis data. According to H2-TPR analysis, the peaks are presented at higher temperature because of they are mostly promoted by the cobalt. With the existence of cobalt or textural qualities, Fe3+ reduction to metallic iron can be observed, and the peaks for temperatures above 600 °C may have resulted from Fe2+ reduction-driven qualities. In co-precipitated CoFe2O4, according to XRD analysis, the distribution of nanoparticles showed that the amount of crystal size was obtained smaller than sol gel and that the elemental distribution obtained in co-precipitated method was most uniform compared to sol gel method. The presence of Co and Cu leads to an increase in the lattice oxygen, and consequently in the activity. Substituting Co with Cu, due to an increase in the lattice defects and lattice oxygen, leads to an increase in the catalytic activity despite smaller Cu crystalline size in comparison to Co. High catalytic activity of the CoFe2O4 refers to its larger capability for oxygen adsorption even at 500 °C, since activation of oxygen to the surface kinetics-controlled region plays an important role in methane oxidation. The results demonstrated that the CoFe2O4 (Co-precipitation) exhibited the most promising activity for methane's catalytic combustion. Declaration of Competing Interest The authors declare that they have no known competing financial interests or personal relationships that could have appeared to influence the work reported in this paper. References [1] Q. Kong Improved catalytic combustion of methane using CuO nanobelts with predominantly (001) surfaces Beilst. J. Nanotechnol. 9 1 2018 2526 2532 Kong, Q., et al., Improved catalytic combustion of methane using CuO nanobelts with predominantly (001) surfaces. Beilst. J. Nanotechnol., 2018. 9(1): p. 2526–2532. [2] S.A. Singh G. Madras I. Sreedhar Transition metal (Ni, Cu and Fe) substituted Co 3 O 4–ZrO 2 catalysts for lean methane combustion Top. Catal. 2020 1 13 Singh, S.A., G. Madras, and I. Sreedhar, Transition metal (Ni, Cu and Fe) substituted Co 3 O 4–ZrO 2 catalysts for lean methane combustion. Top. Catal., 2020: p. 1–13. [3] U. Asghar Review of the Progress in Emission Control Technologies for the Abatement of CO2, SOx and NOx from Fuel Combustion J. Environ. Chem. Eng. 2021 106064 Asghar, U., et al., Review of the Progress in Emission Control Technologies for the Abatement of CO2, SOx and NOx from Fuel Combustion. J. Environ. Chem. Eng., 2021: p. 106064. [4] N. Azimi Optimization of thermal and electrical efficiencies of a photovoltaic module using combined PCMs with a thermo-conductive filler Sol. Energy 231 2022 283 296 Azimi, N., et al., Optimization of thermal and electrical efficiencies of a photovoltaic module using combined PCMs with a thermo-conductive filler. Sol. Energy, 2022. 231: p. 283–296. [5] J. Li Catalytic performance of manganese cobalt oxides on methane combustion at low temperature Appl. Catal. B 90 1–2 2009 307 312 Li, J., et al., Catalytic performance of manganese cobalt oxides on methane combustion at low temperature. Appl. Catal. B, 2009. 90(1–2): p. 307–312. [6] M. Mundhwa C.P. Thurgood Improved performance of a catalytic plate reactor coated with distributed layers of reforming and combustion catalysts for hydrogen production React. Chem. Eng. 3 4 2018 487 514 Mundhwa, M. and C.P. Thurgood, Improved performance of a catalytic plate reactor coated with distributed layers of reforming and combustion catalysts for hydrogen production. React. Chem. Eng., 2018. 3(4): p. 487–514. [7] J. Chen W. Shi J. Li Catalytic combustion of methane over cerium-doped cobalt chromite catalysts Catal. Today 175 1 2011 216 222 Chen, J., W. Shi, and J. Li, Catalytic combustion of methane over cerium-doped cobalt chromite catalysts. Catal. Today, 2011. 175(1): p. 216–222. [8] Thevenin, P., Catalytic combustion of methane. 2002, Kemiteknik. [9] D. Ciuparu Catalytic combustion of methane over palladium-based catalysts Catal. Rev. 44 4 2002 593 649 Ciuparu, D., et al., Catalytic combustion of methane over palladium-based catalysts. Catal. Rev., 2002. 44(4): p. 593–649. [10] J. Nilsson Chemistry of supported palladium nanoparticles during methane oxidation ACS Catal. 5 4 2015 2481 2489 Nilsson, J., et al., Chemistry of supported palladium nanoparticles during methane oxidation. ACS Catal., 2015. 5(4): p. 2481–2489. [11] S.M. Kozlov K.M. Neyman Insights from methane decomposition on nanostructured palladium J. Catal. 337 2016 111 121 Kozlov, S.M. and K.M. Neyman, Insights from methane decomposition on nanostructured palladium. J. Catal., 2016. 337: p. 111–121. [12] P. Gélin M. Primet Complete oxidation of methane at low temperature over noble metal based catalysts: a review Appl. Catal. B 39 1 2002 1 37 Gélin, P. and M. Primet, Complete oxidation of methane at low temperature over noble metal based catalysts: a review. Appl. Catal. B, 2002. 39(1): p. 1–37. [13] R.E. Hayes The palladium catalysed oxidation of methane: reaction kinetics and the effect of diffusion barriers Chem. Eng. Sci. 56 16 2001 4815 4835 Hayes, R.E., et al., The palladium catalysed oxidation of methane: reaction kinetics and the effect of diffusion barriers. Chem. Eng. Sci., 2001. 56(16): p. 4815–4835. [14] J. Chen Recent advances in catalysts for methane combustion Catal. Surv. Asia 19 3 2015 140 171 Chen, J., et al., Recent advances in catalysts for methane combustion. Catal. Surv. Asia, 2015. 19(3): p. 140–171. [15] P. Briot M. Primet Catalytic oxidation of methane over palladium supported on alumina: effect of aging under reactants Appl. Catal. 68 1 1991 301 314 Briot, P. and M. Primet, Catalytic oxidation of methane over palladium supported on alumina: effect of aging under reactants. Appl. Catal., 1991. 68(1): p. 301–314. [16] T. Baldwin R. Burch Remarkable activity enhancement in the catalytic combustion of methane on supported palladium catalysts Catal. Lett. 6 1 1990 131 138 Baldwin, T. and R. Burch, Remarkable activity enhancement in the catalytic combustion of methane on supported palladium catalysts. Catal. Lett., 1990. 6(1): p. 131–138. [17] C. Cullis B. Willatt Oxidation of methane over supported precious metal catalysts J. Catal. 83 2 1983 267 285 Cullis, C. and B. Willatt, Oxidation of methane over supported precious metal catalysts. J. Catal., 1983. 83(2): p. 267–285. [18] M. Jeong High methane combustion activity of PdO/CeO2–ZrO2–NiO/γ-Al2O3 catalysts J. Asian Ceram. Societ. 4 3 2016 259 262 Jeong, M., et al., High methane combustion activity of PdO/CeO2–ZrO2–NiO/γ-Al2O3 catalysts. J. Asian Ceram. Societ., 2016. 4(3): p. 259–262. [19] M.S. Kumar Elucidation of structure–activity relationships of model three way catalysts for the combustion of methane Appl. Catal. B 94 1–2 2010 77 84 Kumar, M.S., et al., Elucidation of structure–activity relationships of model three way catalysts for the combustion of methane. Appl. Catal. B, 2010. 94(1–2): p. 77–84. [20] V. Shah Enhanced methane conversion using Ni-doped calcium ferrite oxygen carriers in chemical looping partial oxidation systems with CO 2 utilization React. Chem. Eng. 2021 Shah, V., et al., Enhanced methane conversion using Ni-doped calcium ferrite oxygen carriers in chemical looping partial oxidation systems with CO 2 utilization. React. Chem. Eng., 2021. [21] H. Li The preparation effect on activity and thermal stability of La0. 8Ca0. 2FeO3 perovskite honeycombs dispersed by MgAl2O4 spinel washcoat for catalytic combustion of dilute methane J. Environ. Chem. Eng. 4 2 2016 2187 2195 Li, H., et al., The preparation effect on activity and thermal stability of La0. 8Ca0. 2FeO3 perovskite honeycombs dispersed by MgAl2O4 spinel washcoat for catalytic combustion of dilute methane. J. Environ. Chem. Eng., 2016. 4(2): p. 2187–2195. [22] F.F. Tao Understanding complete oxidation of methane on spinel oxides at a molecular level Nat. Commun. 6 1 2015 1 10 Tao, F.F., et al., Understanding complete oxidation of methane on spinel oxides at a molecular level. Nat. Commun., 2015. 6(1): p. 1–10. [23] S. Mo Excellent low temperature performance for total benzene oxidation over mesoporous CoMnAl composited oxides from hydrotalcites J. Mater. Chem. A 4 21 2016 8113 8122 Mo, S., et al., Excellent low temperature performance for total benzene oxidation over mesoporous CoMnAl composited oxides from hydrotalcites. J. Mater. Chem. A, 2016. 4(21): p. 8113–8122. [24] F. Wang Low temperature CO oxidation and CH4 combustion over Co3O4 nanosheets Fuel 203 2017 419 429 Wang, F., et al., Low temperature CO oxidation and CH4 combustion over Co3O4 nanosheets. Fuel, 2017. 203: p. 419–429. [25] P.S. Barbato High pressure methane catalytic combustion over novel partially coated LaMnO3-based monoliths Chem. Eng. J. 259 2015 381 390 Barbato, P.S., et al., High pressure methane catalytic combustion over novel partially coated LaMnO3-based monoliths. Chem. Eng. J., 2015. 259: p. 381–390. [26] S. Jung Synergistic use of carbon dioxide in catalytic pyrolysis of chlorella vulgaris over Ni and Co catalysts Energy 211 2020 118710 Jung, S., et al., Synergistic use of carbon dioxide in catalytic pyrolysis of chlorella vulgaris over Ni and Co catalysts. Energy, 2020. 211: p. 118710. [27] H. Nam CO2 methanation in a bench-scale bubbling fluidized bed reactor using Ni-based catalyst and its exothermic heat transfer analysis Energy 214 2021 118895 Nam, H., et al., CO2 methanation in a bench-scale bubbling fluidized bed reactor using Ni-based catalyst and its exothermic heat transfer analysis. Energy, 2021. 214: p. 118895. [28] L.F. Liotta Co 3 O 4 nanocrystals and Co 3 O 4–MO x binary oxides for CO, CH 4 and VOC oxidation at low temperatures: a review Catal. Sci. Technol. 3 12 2013 3085 3102 Liotta, L.F., et al., Co 3 O 4 nanocrystals and Co 3 O 4–MO x binary oxides for CO, CH 4 and VOC oxidation at low temperatures: a review. Catal. Sci. Technol., 2013. 3(12): p. 3085–3102. [29] A. Hojjati-Najafabadi Bacillus thuringiensis based ruthenium/nickel Co-doped zinc as a green nanocatalyst: enhanced photocatalytic activity, mechanism, and efficient H2 production from sodium borohydride methanolysis Ind. Eng. Chem. Res. 2023 Hojjati-Najafabadi, A., et al., Bacillus thuringiensis based ruthenium/nickel Co-doped zinc as a green nanocatalyst: enhanced photocatalytic activity, mechanism, and efficient H2 production from sodium borohydride methanolysis. Ind. Eng. Chem. Res., 2023. [30] E. Baladi F. Davar A. Hojjati-Najafabadi Synthesis and characterization of g–C3N4–CoFe2O4–ZnO magnetic nanocomposites for enhancing photocatalytic activity with visible light for degradation of penicillin G antibiotic Environ. Res. 215 2022 114270 Baladi, E., F. Davar, and A. Hojjati-Najafabadi, Synthesis and characterization of g–C3N4–CoFe2O4–ZnO magnetic nanocomposites for enhancing photocatalytic activity with visible light for degradation of penicillin G antibiotic. Environ. Res., 2022. 215: p. 114270. [31] M. Tang Enhanced lattice oxygen reactivity over Fe2O3/Al2O3 redox catalyst for chemical-looping dry (CO2) reforming of CH4: synergistic La-Ce effect J. Catal. 368 2018 38 52 Tang, M., et al., Enhanced lattice oxygen reactivity over Fe2O3/Al2O3 redox catalyst for chemical-looping dry (CO2) reforming of CH4: synergistic La-Ce effect. J. Catal., 2018. 368: p. 38–52. [32] S. Hu Effects of oxygen species from Fe addition on promoting steam reforming of toluene over Fe–Ni/Al2O3 catalysts Int. J. Hydrog. Energy 41 40 2016 17967 17975 Hu, S., et al., Effects of oxygen species from Fe addition on promoting steam reforming of toluene over Fe–Ni/Al2O3 catalysts. Int. J. Hydrog. Energy, 2016. 41(40): p. 17967–17975. [33] W. Weiss R. Schlögl An integrated surface science approach towards metal oxide catalysis Top. Catal. 13 1–2 2000 75 90 Weiss, W. and R. Schlögl, An integrated surface science approach towards metal oxide catalysis. Top. Catal., 2000. 13(1–2): p. 75–90. [34] Y. Davoodbeygi A. Irankhah Catalytic characteristics of CexCu1-xO1. 9 catalysts formed by solid state method for MTS and OMTS reactions Int. J. Hydrog. Energy 44 31 2019 16443 16451 Davoodbeygi, Y. and A. Irankhah, Catalytic characteristics of CexCu1-xO1. 9 catalysts formed by solid state method for MTS and OMTS reactions. Int. J. Hydrog. Energy, 2019. 44(31): p. 16443–16451. [35] Y. Davoodbeygi A. Irankhah Nanostructured CeCu mixed oxide synthesized by solid state reaction for medium temperature shift reaction: optimization using response surface method Int. J. Hydrog. Energy 43 49 2018 22281 22290 Davoodbeygi, Y. and A. Irankhah, Nanostructured CeCu mixed oxide synthesized by solid state reaction for medium temperature shift reaction: optimization using response surface method. Int. J. Hydrog. Energy, 2018. 43(49): p. 22281–22290. [36] Q. Guo Study of low temperature combustion performance for composite metal catalysts prepared via rotating packed bed Energy 179 2019 431 441 Guo, Q., et al., Study of low temperature combustion performance for composite metal catalysts prepared via rotating packed bed. Energy, 2019. 179: p. 431–441. [37] H. Wu Co 3 O 4 particles grown over nanocrystalline CeO 2: influence of precipitation agents and calcination temperature on the catalytic activity for methane oxidation Catal. Sci. Technol. 5 3 2015 1888 1901 Wu, H., et al., Co 3 O 4 particles grown over nanocrystalline CeO 2: influence of precipitation agents and calcination temperature on the catalytic activity for methane oxidation. Catal. Sci. Technol., 2015. 5(3): p. 1888–1901. [38] M. Mansoorianfar Recent progress on adsorption of cadmium ion from water systems using metal-organic frameworks (MOFs) as an efficient class of porous materials Environ. Res. 2022 114113 Mansoorianfar, M., et al., Recent progress on adsorption of cadmium ion from water systems using metal-organic frameworks (MOFs) as an efficient class of porous materials. Environ. Res., 2022: p. 114113. [39] F. Liu Nickel oxide as an effective catalyst for catalytic combustion of methane J. Nat. Gas Sci. Eng. 41 2017 1 6 Liu, F., et al., Nickel oxide as an effective catalyst for catalytic combustion of methane. J. Nat. Gas Sci. Eng., 2017. 41: p. 1–6. [40] E. Akbari Barium promoted manganese oxide catalysts in low-temperature methane catalytic combustion Int. J. Hydrog. Energy 46 7 2021 5181 5196 Akbari, E., et al., Barium promoted manganese oxide catalysts in low-temperature methane catalytic combustion. Int. J. Hydrog. Energy, 2021. 46(7): p. 5181–5196. [41] X. Fan Effects of preparation methods on CoAlOx/CeO2 catalysts for methane catalytic combustion Fuel 225 2018 588 595 Fan, X., et al., Effects of preparation methods on CoAlOx/CeO2 catalysts for methane catalytic combustion. Fuel, 2018. 225: p. 588–595. [42] L. Rao Lotus seedpods biochar decorated molybdenum disulfide for portable, flexible, outdoor and inexpensive sensing of hyperin Chemosphere 301 2022 134595 Rao, L., et al., Lotus seedpods biochar decorated molybdenum disulfide for portable, flexible, outdoor and inexpensive sensing of hyperin. Chemosphere, 2022. 301: p. 134595. [43] S. Ammar Magnetic properties of ultrafine cobalt ferrite particles synthesized by hydrolysis in a polyol medium basis of a presentation given at materials discussion No. 3, 26–29 September 2000, University of Cambridge, UK J. Mater. Chem. 11 1 2001 186 192 Ammar, S., et al., Magnetic properties of ultrafine cobalt ferrite particles synthesized by hydrolysis in a polyol medium basis of a presentation given at materials discussion No. 3, 26–29 September 2000, University of Cambridge, UK. J. Mater. Chem., 2001. 11(1): p. 186–192. [44] H. Zheng Multiferroic batio3-cofe2o4 nanostructures Science 303 5658 2004 661 663 Zheng, H., et al., Multiferroic batio3-cofe2o4 nanostructures. Science, 2004. 303(5658): p. 661–663. [45] M. Li Facile synthesis of electrospun MFe 2 O 4 (M= Co, Ni, Cu, Mn) spinel nanofibers with excellent electrocatalytic properties for oxygen evolution and hydrogen peroxide reduction Nanoscale 7 19 2015 8920 8930 Li, M., et al., Facile synthesis of electrospun MFe 2 O 4 (M= Co, Ni, Cu, Mn) spinel nanofibers with excellent electrocatalytic properties for oxygen evolution and hydrogen peroxide reduction. Nanoscale, 2015. 7(19): p. 8920–8930. [46] R. Dumitru Mesoporous cobalt ferrite: a rival of platinum catalyst in methane combustion reaction Appl. Catal. A 467 2013 178 186 Dumitru, R., et al., Mesoporous cobalt ferrite: a rival of platinum catalyst in methane combustion reaction. Appl. Catal. A, 2013. 467: p. 178–186. [47] M. Sadakane Important property of polymer spheres for the preparation of three-dimensionally ordered macroporous (3DOM) metal oxides by the ethylene glycol method: the glass-transition temperature Langmuir 28 51 2012 17766 17770 Sadakane, M., et al., Important property of polymer spheres for the preparation of three-dimensionally ordered macroporous (3DOM) metal oxides by the ethylene glycol method: the glass-transition temperature. Langmuir, 2012. 28(51): p. 17766–17770. [48] Z. Li High capacity three-dimensional ordered macroporous CoFe2O4 as anode material for lithium ion batteries Electrochim. Acta 55 15 2010 4594 4598 Li, Z., et al., High capacity three-dimensional ordered macroporous CoFe2O4 as anode material for lithium ion batteries. Electrochim. Acta, 2010. 55(15): p. 4594–4598. [49] X. Li Enhanced catalytic performance for methane combustion of 3DOM CoFe2O4 by co-loading MnOx and Pd–Pt alloy nanoparticles Appl. Surf. Sci. 403 2017 590 600 Li, X., et al., Enhanced catalytic performance for methane combustion of 3DOM CoFe2O4 by co-loading MnOx and Pd–Pt alloy nanoparticles. Appl. Surf. Sci., 2017. 403: p. 590–600. [50] M. Chen L. Fan X. Zheng Effect of novel supporter on catalytic combustion of methane J. Rare Earths 24 4 2006 447 450 Chen, M., L. Fan, and X. Zheng, Effect of novel supporter on catalytic combustion of methane. J. Rare Earths, 2006. 24(4): p. 447–450. [51] F. Heidari A. Irankhah Effect of surfactants and digestion time on nano crystalline cerium oxide characteristics synthesized by differential precipitation Ceram. Int. 40 8 2014 12655 12660 Heidari, F. and A. Irankhah, Effect of surfactants and digestion time on nano crystalline cerium oxide characteristics synthesized by differential precipitation. Ceram. Int., 2014. 40(8): p. 12655–12660. [52] A. Rategarpanah Thermocatalytic conversion of methane to highly pure hydrogen over Ni–Cu/MgO· Al2O3 catalysts: influence of noble metals (Pt and Pd) on the catalytic activity and stability Energy Convers. Manage. 166 2018 268 280 Rategarpanah, A., et al., Thermocatalytic conversion of methane to highly pure hydrogen over Ni–Cu/MgO· Al2O3 catalysts: influence of noble metals (Pt and Pd) on the catalytic activity and stability. Energy Convers. Manage., 2018. 166: p. 268–280. [53] H. Mao An efficient environmentally friendly CuFe 2 O 4/SiO 2 catalyst for vanillyl mandelic acid oxidation in water under atmospheric pressure and a mechanism study New J. Chem. 45 2 2021 982 992 Mao, H., et al., An efficient environmentally friendly CuFe 2 O 4/SiO 2 catalyst for vanillyl mandelic acid oxidation in water under atmospheric pressure and a mechanism study. New J. Chem., 2021. 45(2): p. 982–992. [54] B.S. Solanki C.V. Rode Selective hydrogenation of 5-HMF to 2, 5-DMF over a magnetically recoverable non-noble metal catalyst Green Chem. 21 23 2019 6390 6406 Solanki, B.S. and C.V. Rode, Selective hydrogenation of 5-HMF to 2, 5-DMF over a magnetically recoverable non-noble metal catalyst. Green Chem., 2019. 21(23): p. 6390–6406. [55] Y. Hammiche-Bellal Effect of the preparation method on the structural and catalytic properties of spinel cobalt-iron oxide Mater. Chem. Phys. 177 2016 384 397 Hammiche-Bellal, Y., et al., Effect of the preparation method on the structural and catalytic properties of spinel cobalt-iron oxide. Mater. Chem. Phys., 2016. 177: p. 384–397. [56] M. Béjaoui Preferential Oxidation of CO over CoFe2O4 and M/CoFe2O4 (M= Ce, Co, Cu or Zr) Catalysts Catalysts 11 1 2020 15 Béjaoui, M., et al., Preferential Oxidation of CO over CoFe2O4 and M/CoFe2O4 (M= Ce, Co, Cu or Zr) Catalysts. Catalysts, 2020. 11(1): p. 15. [57] T.P. Braga Catalytic properties of cobalt and nickel ferrites dispersed in mesoporous silicon oxide for ethylbenzene dehydrogenation with CO 2 Catal. Sci. Technol. 1 8 2011 1383 1392 Braga, T.P., et al., Catalytic properties of cobalt and nickel ferrites dispersed in mesoporous silicon oxide for ethylbenzene dehydrogenation with CO 2. Catal. Sci. Technol., 2011. 1(8): p. 1383–1392. [58] Ş. Özkara-Aydınoğlu E. Özensoy A.E. Aksoylu The effect of impregnation strategy on methane dry reforming activity of Ce promoted Pt/ZrO2 Int. J. Hydrog. Energy 34 24 2009 9711 9722 Özkara-Aydınoğlu, Ş., E. Özensoy, and A.E. Aksoylu, The effect of impregnation strategy on methane dry reforming activity of Ce promoted Pt/ZrO2. Int. J. Hydrog. Energy, 2009. 34(24): p. 9711–9722. [59] F. Pompeo Study of Ni and Pt catalysts supported on α-Al2O3 and ZrO2 applied in methane reforming with CO2 Appl. Catal. A 316 2 2007 175 183 Pompeo, F., et al., Study of Ni and Pt catalysts supported on α-Al2O3 and ZrO2 applied in methane reforming with CO2. Appl. Catal. A, 2007. 316(2): p. 175–183. [60] J. Zhu The promoting effect of La, Mg, Co and Zn on the activity and stability of Ni/SiO2 catalyst for CO2 reforming of methane Int. J. Hydrog. Energy 36 12 2011 7094 7104 Zhu, J., et al., The promoting effect of La, Mg, Co and Zn on the activity and stability of Ni/SiO2 catalyst for CO2 reforming of methane. Int. J. Hydrog. Energy, 2011. 36(12): p. 7094–7104. [61] J. Wang Methane reforming with carbon dioxide to synthesis gas over Co-doped Ni-based magnetoplumbite catalysts Appl. Catal. A 250 1 2003 13 23 Wang, J., et al., Methane reforming with carbon dioxide to synthesis gas over Co-doped Ni-based magnetoplumbite catalysts. Appl. Catal. A, 2003. 250(1): p. 13–23. [62] Y. Li Y. Guo B. Xue Catalytic combustion of methane over M (Ni, Co, Cu) supported on ceria–magnesia Fuel Process. Technol. 90 5 2009 652 656 Li, Y., Y. Guo, and B. Xue, Catalytic combustion of methane over M (Ni, Co, Cu) supported on ceria–magnesia. Fuel Process. Technol., 2009. 90(5): p. 652–656. [63] J. Chen Low temperature complete combustion of methane over cobalt chromium oxides catalysts Catal. Today 201 2013 12 18 Chen, J., et al., Low temperature complete combustion of methane over cobalt chromium oxides catalysts. Catal. Today, 2013. 201: p. 12–18. [64] S. Li X. Wang The Ba-hexaaluminate doped with CeO2 nanoparticles for catalytic combustion of methane Catal. Commun. 8 3 2007 410 415 Li, S. and X. Wang, The Ba-hexaaluminate doped with CeO2 nanoparticles for catalytic combustion of methane. Catal. Commun., 2007. 8(3): p. 410–415. [65] P. Chu Catalytic combustion of methane conducted on La–B–O–C (BCo, Mn, Fe) composites: the effects of B-sites cation properties Int. J. Hydrog. Energy 46 46 2021 23954 23961 Chu, P., et al., Catalytic combustion of methane conducted on La–B–O–C (BCo, Mn, Fe) composites: the effects of B-sites cation properties. Int. J. Hydrog. Energy, 2021. 46(46): p. 23954–23961. [66] J. Luo A facile approach for the preparation of biomorphic CuO–ZrO2 catalyst for catalytic combustion of methane Appl. Catal. A 423 2012 121 129 Luo, J., et al., A facile approach for the preparation of biomorphic CuO–ZrO2 catalyst for catalytic combustion of methane. Appl. Catal. A, 2012. 423: p. 121–129.",
      "scopus-id": "85147554692",
      "coredata": {
        "eid": "1-s2.0-S2468823123000767",
        "dc:description": "In this investigation, co-precipitation (Cp) and sol gel (Sg) technique were employed to fabricate CoFe2O4, CuFe2O4, NiAl2O4 and NiFe2O4 mixed oxide catalysts. The catalytic activity of these catalysts in methane combustion was studied at temperature range of 300 to 550 °C and gas hourly space velocity of 14,000 h − 1. Different analyses including the X-Ray Diffraction (XRD), N2 adsorption-desorption (BET), Energy Dispersive X-Ray Analysis (EDX), Scanning Electron Microscopy (SEM) and H2-TPR analysis were used in order to investigate the structural properties of the catalysts. The small crystal size improves the surface area and catalyst active site, thus increasing the rate of reaction and conversion factor. The results revealed that the method of preparation had an important role in controlling the structural features of the catalysts, resulting in an important difference in catalytic presentation. The reactor tests required CO2 selectivity of 100% for all synthesized catalysts, and the best catalytic activity (97% methane conversion) and structural properties (surface area of 41.81 m2 g − 1 and crystal size of 13.20 nm) was demonstrated by CoFe2O4 (co-precipitation) sample. It was also revealed that catalysts synthesized using sol gel method had agglomeration impact on the surface of the catalyst, leading to an increase in crystalline size and a decrease in catalytic activity.",
        "openArchiveArticle": "false",
        "prism:coverDate": "2023-03-01",
        "openaccessUserLicense": null,
        "prism:aggregationType": "Journal",
        "prism:url": "https://api.elsevier.com/content/article/pii/S2468823123000767",
        "dc:creator": [
          {
            "@_fa": "true",
            "$": "Shafaei, Arash"
          },
          {
            "@_fa": "true",
            "$": "Irankhah, Abdullah"
          }
        ],
        "link": [
          {
            "@_fa": "true",
            "@rel": "self",
            "@href": "https://api.elsevier.com/content/article/pii/S2468823123000767"
          },
          {
            "@_fa": "true",
            "@rel": "scidir",
            "@href": "https://www.sciencedirect.com/science/article/pii/S2468823123000767"
          }
        ],
        "dc:format": "application/json",
        "openaccessType": null,
        "pii": "S2468-8231(23)00076-7",
        "prism:volume": "538",
        "articleNumber": "112989",
        "prism:publisher": "Elsevier B.V.",
        "dc:title": "Evaluation of Co-Fe, Cu-Fe, Ni-Al and Ni-Fe mixed oxides in catalytic combustion of methane: Comparison study and investigating the effect of preparation method",
        "prism:copyright": "© 2023 Elsevier B.V. All rights reserved.",
        "openaccess": "0",
        "prism:issn": "24688231",
        "dcterms:subject": [
          {
            "@_fa": "true",
            "$": "Catalytic methane combustion"
          },
          {
            "@_fa": "true",
            "$": "Cobalt oxide"
          },
          {
            "@_fa": "true",
            "$": "Mixed oxide catalysts"
          },
          {
            "@_fa": "true",
            "$": "Preparation method"
          }
        ],
        "openaccessArticle": "false",
        "prism:publicationName": "Molecular Catalysis",
        "openaccessSponsorType": null,
        "prism:pageRange": "112989",
        "pubType": "fla",
        "prism:coverDisplayDate": "1 March 2023",
        "prism:doi": "10.1016/j.mcat.2023.112989",
        "prism:startingPage": "112989",
        "dc:identifier": "doi:10.1016/j.mcat.2023.112989",
        "openaccessSponsorName": null
      },
      "objects": {
        "object": [
          {
            "@category": "standard",
            "@height": "363",
            "@width": "565",
            "@_fa": "true",
            "$": "https://api.elsevier.com/content/object/eid/1-s2.0-S2468823123000767-gr1.jpg?httpAccept=%2A%2F%2A",
            "@multimediatype": "JPEG image file",
            "@type": "IMAGE-DOWNSAMPLED",
            "@size": "32178",
            "@ref": "gr1",
            "@mimetype": "image/jpeg"
          },
          {
            "@category": "standard",
            "@height": "867",
            "@width": "376",
            "@_fa": "true",
            "$": "https://api.elsevier.com/content/object/eid/1-s2.0-S2468823123000767-gr2.jpg?httpAccept=%2A%2F%2A",
            "@multimediatype": "JPEG image file",
            "@type": "IMAGE-DOWNSAMPLED",
            "@size": "86874",
            "@ref": "gr2",
            "@mimetype": "image/jpeg"
          },
          {
            "@category": "standard",
            "@height": "200",
            "@width": "323",
            "@_fa": "true",
            "$": "https://api.elsevier.com/content/object/eid/1-s2.0-S2468823123000767-ga1.jpg?httpAccept=%2A%2F%2A",
            "@multimediatype": "JPEG image file",
            "@type": "IMAGE-DOWNSAMPLED",
            "@size": "17955",
            "@ref": "ga1",
            "@mimetype": "image/jpeg"
          },
          {
            "@category": "standard",
            "@height": "978",
            "@width": "558",
            "@_fa": "true",
            "$": "https://api.elsevier.com/content/object/eid/1-s2.0-S2468823123000767-gr3.jpg?httpAccept=%2A%2F%2A",
            "@multimediatype": "JPEG image file",
            "@type": "IMAGE-DOWNSAMPLED",
            "@size": "121231",
            "@ref": "gr3",
            "@mimetype": "image/jpeg"
          },
          {
            "@category": "standard",
            "@height": "793",
            "@width": "565",
            "@_fa": "true",
            "$": "https://api.elsevier.com/content/object/eid/1-s2.0-S2468823123000767-gr4.jpg?httpAccept=%2A%2F%2A",
            "@multimediatype": "JPEG image file",
            "@type": "IMAGE-DOWNSAMPLED",
            "@size": "217175",
            "@ref": "gr4",
            "@mimetype": "image/jpeg"
          },
          {
            "@category": "standard",
            "@height": "943",
            "@width": "753",
            "@_fa": "true",
            "$": "https://api.elsevier.com/content/object/eid/1-s2.0-S2468823123000767-gr5.jpg?httpAccept=%2A%2F%2A",
            "@multimediatype": "JPEG image file",
            "@type": "IMAGE-DOWNSAMPLED",
            "@size": "322005",
            "@ref": "gr5",
            "@mimetype": "image/jpeg"
          },
          {
            "@category": "standard",
            "@height": "827",
            "@width": "753",
            "@_fa": "true",
            "$": "https://api.elsevier.com/content/object/eid/1-s2.0-S2468823123000767-gr6.jpg?httpAccept=%2A%2F%2A",
            "@multimediatype": "JPEG image file",
            "@type": "IMAGE-DOWNSAMPLED",
            "@size": "78386",
            "@ref": "gr6",
            "@mimetype": "image/jpeg"
          },
          {
            "@category": "standard",
            "@height": "264",
            "@width": "376",
            "@_fa": "true",
            "$": "https://api.elsevier.com/content/object/eid/1-s2.0-S2468823123000767-gr7.jpg?httpAccept=%2A%2F%2A",
            "@multimediatype": "JPEG image file",
            "@type": "IMAGE-DOWNSAMPLED",
            "@size": "27123",
            "@ref": "gr7",
            "@mimetype": "image/jpeg"
          },
          {
            "@category": "standard",
            "@height": "288",
            "@width": "376",
            "@_fa": "true",
            "$": "https://api.elsevier.com/content/object/eid/1-s2.0-S2468823123000767-gr8.jpg?httpAccept=%2A%2F%2A",
            "@multimediatype": "JPEG image file",
            "@type": "IMAGE-DOWNSAMPLED",
            "@size": "35170",
            "@ref": "gr8",
            "@mimetype": "image/jpeg"
          },
          {
            "@category": "standard",
            "@height": "256",
            "@width": "376",
            "@_fa": "true",
            "$": "https://api.elsevier.com/content/object/eid/1-s2.0-S2468823123000767-gr9.jpg?httpAccept=%2A%2F%2A",
            "@multimediatype": "JPEG image file",
            "@type": "IMAGE-DOWNSAMPLED",
            "@size": "11539",
            "@ref": "gr9",
            "@mimetype": "image/jpeg"
          },
          {
            "@category": "thumbnail",
            "@height": "141",
            "@width": "219",
            "@_fa": "true",
            "$": "https://api.elsevier.com/content/object/eid/1-s2.0-S2468823123000767-gr1.sml?httpAccept=%2A%2F%2A",
            "@multimediatype": "GIF image file",
            "@type": "IMAGE-THUMBNAIL",
            "@size": "11023",
            "@ref": "gr1",
            "@mimetype": "image/gif"
          },
          {
            "@category": "thumbnail",
            "@height": "164",
            "@width": "71",
            "@_fa": "true",
            "$": "https://api.elsevier.com/content/object/eid/1-s2.0-S2468823123000767-gr2.sml?httpAccept=%2A%2F%2A",
            "@multimediatype": "GIF image file",
            "@type": "IMAGE-THUMBNAIL",
            "@size": "7010",
            "@ref": "gr2",
            "@mimetype": "image/gif"
          },
          {
            "@category": "thumbnail",
            "@height": "135",
            "@width": "219",
            "@_fa": "true",
            "$": "https://api.elsevier.com/content/object/eid/1-s2.0-S2468823123000767-ga1.sml?httpAccept=%2A%2F%2A",
            "@multimediatype": "GIF image file",
            "@type": "IMAGE-THUMBNAIL",
            "@size": "9705",
            "@ref": "ga1",
            "@mimetype": "image/gif"
          },
          {
            "@category": "thumbnail",
            "@height": "163",
            "@width": "93",
            "@_fa": "true",
            "$": "https://api.elsevier.com/content/object/eid/1-s2.0-S2468823123000767-gr3.sml?httpAccept=%2A%2F%2A",
            "@multimediatype": "GIF image file",
            "@type": "IMAGE-THUMBNAIL",
            "@size": "7630",
            "@ref": "gr3",
            "@mimetype": "image/gif"
          },
          {
            "@category": "thumbnail",
            "@height": "164",
            "@width": "117",
            "@_fa": "true",
            "$": "https://api.elsevier.com/content/object/eid/1-s2.0-S2468823123000767-gr4.sml?httpAccept=%2A%2F%2A",
            "@multimediatype": "GIF image file",
            "@type": "IMAGE-THUMBNAIL",
            "@size": "18126",
            "@ref": "gr4",
            "@mimetype": "image/gif"
          },
          {
            "@category": "thumbnail",
            "@height": "164",
            "@width": "131",
            "@_fa": "true",
            "$": "https://api.elsevier.com/content/object/eid/1-s2.0-S2468823123000767-gr5.sml?httpAccept=%2A%2F%2A",
            "@multimediatype": "GIF image file",
            "@type": "IMAGE-THUMBNAIL",
            "@size": "20818",
            "@ref": "gr5",
            "@mimetype": "image/gif"
          },
          {
            "@category": "thumbnail",
            "@height": "164",
            "@width": "149",
            "@_fa": "true",
            "$": "https://api.elsevier.com/content/object/eid/1-s2.0-S2468823123000767-gr6.sml?httpAccept=%2A%2F%2A",
            "@multimediatype": "GIF image file",
            "@type": "IMAGE-THUMBNAIL",
            "@size": "7787",
            "@ref": "gr6",
            "@mimetype": "image/gif"
          },
          {
            "@category": "thumbnail",
            "@height": "154",
            "@width": "219",
            "@_fa": "true",
            "$": "https://api.elsevier.com/content/object/eid/1-s2.0-S2468823123000767-gr7.sml?httpAccept=%2A%2F%2A",
            "@multimediatype": "GIF image file",
            "@type": "IMAGE-THUMBNAIL",
            "@size": "8831",
            "@ref": "gr7",
            "@mimetype": "image/gif"
          },
          {
            "@category": "thumbnail",
            "@height": "164",
            "@width": "214",
            "@_fa": "true",
            "$": "https://api.elsevier.com/content/object/eid/1-s2.0-S2468823123000767-gr8.sml?httpAccept=%2A%2F%2A",
            "@multimediatype": "GIF image file",
            "@type": "IMAGE-THUMBNAIL",
            "@size": "9619",
            "@ref": "gr8",
            "@mimetype": "image/gif"
          },
          {
            "@category": "thumbnail",
            "@height": "149",
            "@width": "219",
            "@_fa": "true",
            "$": "https://api.elsevier.com/content/object/eid/1-s2.0-S2468823123000767-gr9.sml?httpAccept=%2A%2F%2A",
            "@multimediatype": "GIF image file",
            "@type": "IMAGE-THUMBNAIL",
            "@size": "3891",
            "@ref": "gr9",
            "@mimetype": "image/gif"
          },
          {
            "@category": "high",
            "@height": "1608",
            "@width": "2500",
            "@_fa": "true",
            "$": "https://api.elsevier.com/content/object/eid/1-s2.0-S2468823123000767-gr1_lrg.jpg?httpAccept=%2A%2F%2A",
            "@multimediatype": "JPEG image file",
            "@type": "IMAGE-HIGH-RES",
            "@size": "259001",
            "@ref": "gr1",
            "@mimetype": "image/jpeg"
          },
          {
            "@category": "high",
            "@height": "3843",
            "@width": "1667",
            "@_fa": "true",
            "$": "https://api.elsevier.com/content/object/eid/1-s2.0-S2468823123000767-gr2_lrg.jpg?httpAccept=%2A%2F%2A",
            "@multimediatype": "JPEG image file",
            "@type": "IMAGE-HIGH-RES",
            "@size": "648287",
            "@ref": "gr2",
            "@mimetype": "image/jpeg"
          },
          {
            "@category": "high",
            "@height": "886",
            "@width": "1432",
            "@_fa": "true",
            "$": "https://api.elsevier.com/content/object/eid/1-s2.0-S2468823123000767-ga1_lrg.jpg?httpAccept=%2A%2F%2A",
            "@multimediatype": "JPEG image file",
            "@type": "IMAGE-HIGH-RES",
            "@size": "143106",
            "@ref": "ga1",
            "@mimetype": "image/jpeg"
          },
          {
            "@category": "high",
            "@height": "4333",
            "@width": "2471",
            "@_fa": "true",
            "$": "https://api.elsevier.com/content/object/eid/1-s2.0-S2468823123000767-gr3_lrg.jpg?httpAccept=%2A%2F%2A",
            "@multimediatype": "JPEG image file",
            "@type": "IMAGE-HIGH-RES",
            "@size": "874741",
            "@ref": "gr3",
            "@mimetype": "image/jpeg"
          },
          {
            "@category": "high",
            "@height": "3508",
            "@width": "2500",
            "@_fa": "true",
            "$": "https://api.elsevier.com/content/object/eid/1-s2.0-S2468823123000767-gr4_lrg.jpg?httpAccept=%2A%2F%2A",
            "@multimediatype": "JPEG image file",
            "@type": "IMAGE-HIGH-RES",
            "@size": "1763324",
            "@ref": "gr4",
            "@mimetype": "image/jpeg"
          },
          {
            "@category": "high",
            "@height": "4174",
            "@width": "3333",
            "@_fa": "true",
            "$": "https://api.elsevier.com/content/object/eid/1-s2.0-S2468823123000767-gr5_lrg.jpg?httpAccept=%2A%2F%2A",
            "@multimediatype": "JPEG image file",
            "@type": "IMAGE-HIGH-RES",
            "@size": "3096008",
            "@ref": "gr5",
            "@mimetype": "image/jpeg"
          },
          {
            "@category": "high",
            "@height": "3661",
            "@width": "3333",
            "@_fa": "true",
            "$": "https://api.elsevier.com/content/object/eid/1-s2.0-S2468823123000767-gr6_lrg.jpg?httpAccept=%2A%2F%2A",
            "@multimediatype": "JPEG image file",
            "@type": "IMAGE-HIGH-RES",
            "@size": "701852",
            "@ref": "gr6",
            "@mimetype": "image/jpeg"
          },
          {
            "@category": "high",
            "@height": "1170",
            "@width": "1667",
            "@_fa": "true",
            "$": "https://api.elsevier.com/content/object/eid/1-s2.0-S2468823123000767-gr7_lrg.jpg?httpAccept=%2A%2F%2A",
            "@multimediatype": "JPEG image file",
            "@type": "IMAGE-HIGH-RES",
            "@size": "177885",
            "@ref": "gr7",
            "@mimetype": "image/jpeg"
          },
          {
            "@category": "high",
            "@height": "1277",
            "@width": "1667",
            "@_fa": "true",
            "$": "https://api.elsevier.com/content/object/eid/1-s2.0-S2468823123000767-gr8_lrg.jpg?httpAccept=%2A%2F%2A",
            "@multimediatype": "JPEG image file",
            "@type": "IMAGE-HIGH-RES",
            "@size": "226122",
            "@ref": "gr8",
            "@mimetype": "image/jpeg"
          },
          {
            "@category": "high",
            "@height": "1137",
            "@width": "1667",
            "@_fa": "true",
            "$": "https://api.elsevier.com/content/object/eid/1-s2.0-S2468823123000767-gr9_lrg.jpg?httpAccept=%2A%2F%2A",
            "@multimediatype": "JPEG image file",
            "@type": "IMAGE-HIGH-RES",
            "@size": "96702",
            "@ref": "gr9",
            "@mimetype": "image/jpeg"
          },
          {
            "@category": "thumbnail",
            "@_fa": "true",
            "$": "https://api.elsevier.com/content/object/eid/1-s2.0-S2468823123000767-si1.svg?httpAccept=%2A%2F%2A",
            "@multimediatype": "Scalable Vector Graphics file",
            "@type": "ALTIMG",
            "@size": "12318",
            "@ref": "si1",
            "@mimetype": "image/svg+xml"
          },
          {
            "@category": "thumbnail",
            "@_fa": "true",
            "$": "https://api.elsevier.com/content/object/eid/1-s2.0-S2468823123000767-si2.svg?httpAccept=%2A%2F%2A",
            "@multimediatype": "Scalable Vector Graphics file",
            "@type": "ALTIMG",
            "@size": "2500",
            "@ref": "si2",
            "@mimetype": "image/svg+xml"
          },
          {
            "@category": "thumbnail",
            "@_fa": "true",
            "$": "https://api.elsevier.com/content/object/eid/1-s2.0-S2468823123000767-si3.svg?httpAccept=%2A%2F%2A",
            "@multimediatype": "Scalable Vector Graphics file",
            "@type": "ALTIMG",
            "@size": "4126",
            "@ref": "si3",
            "@mimetype": "image/svg+xml"
          },
          {
            "@category": "thumbnail",
            "@_fa": "true",
            "$": "https://api.elsevier.com/content/object/eid/1-s2.0-S2468823123000767-si4.svg?httpAccept=%2A%2F%2A",
            "@multimediatype": "Scalable Vector Graphics file",
            "@type": "ALTIMG",
            "@size": "7724",
            "@ref": "si4",
            "@mimetype": "image/svg+xml"
          },
          {
            "@category": "thumbnail",
            "@_fa": "true",
            "$": "https://api.elsevier.com/content/object/eid/1-s2.0-S2468823123000767-si5.svg?httpAccept=%2A%2F%2A",
            "@multimediatype": "Scalable Vector Graphics file",
            "@type": "ALTIMG",
            "@size": "15178",
            "@ref": "si5",
            "@mimetype": "image/svg+xml"
          },
          {
            "@category": "thumbnail",
            "@_fa": "true",
            "$": "https://api.elsevier.com/content/object/eid/1-s2.0-S2468823123000767-si6.svg?httpAccept=%2A%2F%2A",
            "@multimediatype": "Scalable Vector Graphics file",
            "@type": "ALTIMG",
            "@size": "14814",
            "@ref": "si6",
            "@mimetype": "image/svg+xml"
          },
          {
            "@category": "standard",
            "@_fa": "true",
            "$": "https://api.elsevier.com/content/object/eid/1-s2.0-S2468823123000767-am.pdf?httpAccept=%2A%2F%2A",
            "@multimediatype": "Acrobat PDF file",
            "@type": "AAM-PDF",
            "@size": "2212614",
            "@ref": "am",
            "@mimetype": "application/pdf"
          }
        ]
      },
      "link": {
        "@rel": "abstract",
        "@href": "https://api.elsevier.com/content/abstract/scopus_id/85147554692"
      }
    }
  }
}