{
  "metadata": {
    "title": "Catalytic styrene combustion over Pt/ZSM-5 Catalysts: Elucidating the deactivation mechanism induced by surface acid sites",
    "authors": "; ; ",
    "journal": "Molecular Catalysis",
    "date": "2024-05-15",
    "doi": "10.1016/j.mcat.2024.114193",
    "abstract": "",
    "uri": "https://api.elsevier.com/content/article/pii/S2468823124003766",
    "pii": "S2468823124003766"
  },
  "fulltext": {
    "full-text-retrieval-response": {
      "scopus-eid": "2-s2.0-85191961468",
      "originalText": "serial JL 315758 291210 291744 291790 291809 31 Molecular Catalysis MOLECULARCATALYSIS 2024-05-03 2024-05-03 2024-05-03 2024-05-03 2025-01-16T07:57:07 1-s2.0-S2468823124003766 S2468-8231(24)00376-6 S2468823124003766 10.1016/j.mcat.2024.114193 S300 S300.1 FULL-TEXT 1-s2.0-S2468823124X00073 2025-01-16T09:03:16.533871Z 0 0 20240515 2024 2024-05-03T07:00:14.744649Z absattachment articleinfo articlenumber articletitlenorm authfirstinitialnorm authfirstsurnamenorm cid cids contenttype copyright crossmark dateloaded dateloadedtxt datesearch datesort dateupdated dco docsubtype doctype doi eid ewtransactionid hubeid indexeddate issn issnnorm itemstage itemtransactionid itemweight openaccess openarchive pg pgfirst pii piinorm pubdatestart pubdatetxt pubyr sectiontitle sortorder srctitle srctitlenorm srctype ssids alllist content subj subheadings suppl tomb volfirst volissue volumelist webpdf webpdfpagecount yearnav figure table body mmlmath acknowledge affil articletitle auth authfirstini authfull authkeywords authlast grantnumber grantsponsor grantsponsorid highlightsabst orcid primabst ref specialabst 2468-8231 24688231 true 561 561 C Volume 561 21 114193 114193 114193 20240515 15 May 2024 2024-05-15 2024 Regular Papers article fla © 2024 Elsevier B.V. All rights reserved. CATALYTICSTYRENECOMBUSTIONOVERPTZSM5CATALYSTSELUCIDATINGDEACTIVATIONMECHANISMINDUCEDBYSURFACEACIDSITES ZHAO X 1 Introduction 2 Experimental section 2.1 Catalyst synthesis 2.2 Catalyst characterization 2.3 Catalytic activity test 3 Results and discussion 3.1 Physical and chemical properties 3.2 Catalytic styrene oxidation 3.3 Deactivation mechanism 3.4 Water resistance of catalysts 4 Conclusion CRediT authorship contribution statement Acknowledgements References PAN 2009 1166 1169 H SHEN 2023 805 822 W PAN 2016 468 474 H CHEN 2022 154851 Y LIAO 2023 157434 W HOU 2023 137679 S ZHANG 2024 123461 Y ZHANG 2022 134863 Y ZHANG 2015 50 55 J PAN 2009 721 726 H ZHANG 2024 114015 W FAN 2024 114013 J LI 2023 112857 Z GU 2023 132499 H LI 2023 112857 Z LI 2024 159225 B ZHOU 2023 113019 Y HAN 2023 113426 X LI 2023 118960 B LI 2022 322 332 D GE 2024 2532 2544 S WANG 2023 119108 X LU 2020 146348 Y HE 2023 127792 L MO 2020 118464 S LI 2014 690 696 J WANG 2021 19301 19310 W ZHAOX2024X114193 ZHAOX2024X114193XX 2026-05-03T00:00:00.000Z 2026-05-03T00:00:00.000Z http://creativecommons.org/licenses/by-nc-nd/4.0/ © 2024 Elsevier B.V. All rights reserved. 2024-05-09T04:02:35.110Z http://vtw.elsevier.com/data/voc/AddOnTypes/50.7/aggregated-refined National Natural Science Foundation of China 22172145 NSFC National Natural Science Foundation of China http://data.elsevier.com/vocabulary/SciValFunders/501100001809 http://sws.geonames.org/1814991 Leading Innovative and Entrepreneur Team Introduction Program of Zhejiang 2022R01007 This work was financially supported by the National Natural Science Foundation of China (No. 22172145 ) and the Leading Innovative and Entrepreneur Team Introduction Program of Zhejiang (No. 2022R01007 ). https://doi.org/10.15223/policy-017 https://doi.org/10.15223/policy-037 https://doi.org/10.15223/policy-012 https://doi.org/10.15223/policy-029 https://doi.org/10.15223/policy-004 item S2468-8231(24)00376-6 S2468823124003766 1-s2.0-S2468823124003766 10.1016/j.mcat.2024.114193 315758 2025-01-16T09:03:16.533871Z 2024-05-15 1-s2.0-S2468823124003766-main.pdf https://s3-eu-west-1.amazonaws.com/prod-ucs-content-store-eu-west/content/pii:S2468823124003766/MAIN/application/pdf/0c194ba3d88a5848093940f6c2f1f890/main.pdf main.pdf pdf true 11343241 MAIN 10 1-s2.0-S2468823124003766-main_1.png https://s3-eu-west-1.amazonaws.com/prod-ucs-content-store-eu-west/content/pii:S2468823124003766/PREVIEW/image/png/6aa317e1f3cbe9b0c00eef945ce0c54a/main_1.png main_1.png png 58833 849 656 IMAGE-WEB-PDF 1 1-s2.0-S2468823124003766-gr8.jpg https://s3-eu-west-1.amazonaws.com/prod-ucs-content-store-eu-west/content/pii:S2468823124003766/gr8/DOWNSAMPLED/image/jpeg/2ce3d0bdfd5624448edf55e653f25d3d/gr8.jpg gr8 gr8.jpg jpg 73549 469 451 IMAGE-DOWNSAMPLED 1-s2.0-S2468823124003766-sc1.jpg https://s3-eu-west-1.amazonaws.com/prod-ucs-content-store-eu-west/content/pii:S2468823124003766/sc1/DOWNSAMPLED/image/jpeg/8cb5f59d4a355ca62b1cb759504ff2ab/sc1.jpg sc1 sc1.jpg jpg 51147 280 452 IMAGE-DOWNSAMPLED 1-s2.0-S2468823124003766-gr1.jpg https://s3-eu-west-1.amazonaws.com/prod-ucs-content-store-eu-west/content/pii:S2468823124003766/gr1/DOWNSAMPLED/image/jpeg/4c272b489f9719f2fcfac1e06e444c1a/gr1.jpg gr1 gr1.jpg jpg 104060 428 637 IMAGE-DOWNSAMPLED 1-s2.0-S2468823124003766-gr3.jpg https://s3-eu-west-1.amazonaws.com/prod-ucs-content-store-eu-west/content/pii:S2468823124003766/gr3/DOWNSAMPLED/image/jpeg/8c3faefc073453a17db8a0a411c1797b/gr3.jpg gr3 gr3.jpg jpg 54841 294 540 IMAGE-DOWNSAMPLED 1-s2.0-S2468823124003766-gr2.jpg https://s3-eu-west-1.amazonaws.com/prod-ucs-content-store-eu-west/content/pii:S2468823124003766/gr2/DOWNSAMPLED/image/jpeg/eb10263a33b2669e4351549b9f12d57d/gr2.jpg gr2 gr2.jpg jpg 79594 487 454 IMAGE-DOWNSAMPLED 1-s2.0-S2468823124003766-ga1.jpg https://s3-eu-west-1.amazonaws.com/prod-ucs-content-store-eu-west/content/pii:S2468823124003766/ga1/DOWNSAMPLED/image/jpeg/658b468004ab41144c8f315035afc018/ga1.jpg ga1 true ga1.jpg jpg 31730 200 322 IMAGE-DOWNSAMPLED 1-s2.0-S2468823124003766-gr5.jpg https://s3-eu-west-1.amazonaws.com/prod-ucs-content-store-eu-west/content/pii:S2468823124003766/gr5/DOWNSAMPLED/image/jpeg/c5b60de75abef286cf5873db2c2544bd/gr5.jpg gr5 gr5.jpg jpg 59735 474 443 IMAGE-DOWNSAMPLED 1-s2.0-S2468823124003766-gr4.jpg https://s3-eu-west-1.amazonaws.com/prod-ucs-content-store-eu-west/content/pii:S2468823124003766/gr4/DOWNSAMPLED/image/jpeg/f7f8df223bd0f4332ece6413a68f577a/gr4.jpg gr4 gr4.jpg jpg 110857 714 460 IMAGE-DOWNSAMPLED 1-s2.0-S2468823124003766-gr7.jpg https://s3-eu-west-1.amazonaws.com/prod-ucs-content-store-eu-west/content/pii:S2468823124003766/gr7/DOWNSAMPLED/image/jpeg/5ed2e0ce3122c2902337f35c3565e90a/gr7.jpg gr7 gr7.jpg jpg 215755 732 661 IMAGE-DOWNSAMPLED 1-s2.0-S2468823124003766-gr6.jpg https://s3-eu-west-1.amazonaws.com/prod-ucs-content-store-eu-west/content/pii:S2468823124003766/gr6/DOWNSAMPLED/image/jpeg/072bc632df81c4f09947697702d73ea0/gr6.jpg gr6 gr6.jpg jpg 35348 348 410 IMAGE-DOWNSAMPLED 1-s2.0-S2468823124003766-gr8.sml https://s3-eu-west-1.amazonaws.com/prod-ucs-content-store-eu-west/content/pii:S2468823124003766/gr8/THUMBNAIL/image/gif/bf5afcd7678458c1f986e5e1c6aeedbe/gr8.sml gr8 gr8.sml sml 12170 163 157 IMAGE-THUMBNAIL 1-s2.0-S2468823124003766-sc1.sml https://s3-eu-west-1.amazonaws.com/prod-ucs-content-store-eu-west/content/pii:S2468823124003766/sc1/THUMBNAIL/image/gif/e67ccbe0dcd0378ee10500cbdefd9c4a/sc1.sml sc1 sc1.sml sml 19510 136 219 IMAGE-THUMBNAIL 1-s2.0-S2468823124003766-gr1.sml https://s3-eu-west-1.amazonaws.com/prod-ucs-content-store-eu-west/content/pii:S2468823124003766/gr1/THUMBNAIL/image/gif/07e0e31cc1af4d6477273be26f8b1c3e/gr1.sml gr1 gr1.sml sml 26447 147 219 IMAGE-THUMBNAIL 1-s2.0-S2468823124003766-gr3.sml https://s3-eu-west-1.amazonaws.com/prod-ucs-content-store-eu-west/content/pii:S2468823124003766/gr3/THUMBNAIL/image/gif/6fa1301c34f0efdc48caa66f79cb3003/gr3.sml gr3 gr3.sml sml 11741 119 219 IMAGE-THUMBNAIL 1-s2.0-S2468823124003766-gr2.sml https://s3-eu-west-1.amazonaws.com/prod-ucs-content-store-eu-west/content/pii:S2468823124003766/gr2/THUMBNAIL/image/gif/e29f14a63434f4fb4fcac56346d996fd/gr2.sml gr2 gr2.sml sml 12856 164 153 IMAGE-THUMBNAIL 1-s2.0-S2468823124003766-ga1.sml https://s3-eu-west-1.amazonaws.com/prod-ucs-content-store-eu-west/content/pii:S2468823124003766/ga1/THUMBNAIL/image/gif/556df3187232e959acb4469804520320/ga1.sml ga1 true ga1.sml sml 19531 136 219 IMAGE-THUMBNAIL 1-s2.0-S2468823124003766-gr5.sml https://s3-eu-west-1.amazonaws.com/prod-ucs-content-store-eu-west/content/pii:S2468823124003766/gr5/THUMBNAIL/image/gif/caa62828e70ae56fa605a3afb2a8dbef/gr5.sml gr5 gr5.sml sml 10951 164 153 IMAGE-THUMBNAIL 1-s2.0-S2468823124003766-gr4.sml https://s3-eu-west-1.amazonaws.com/prod-ucs-content-store-eu-west/content/pii:S2468823124003766/gr4/THUMBNAIL/image/gif/ea45657627935fcf6339ea740b05d214/gr4.sml gr4 gr4.sml sml 10287 163 105 IMAGE-THUMBNAIL 1-s2.0-S2468823124003766-gr7.sml https://s3-eu-west-1.amazonaws.com/prod-ucs-content-store-eu-west/content/pii:S2468823124003766/gr7/THUMBNAIL/image/gif/a2ca21300a04dbe7f3113893febd1c24/gr7.sml gr7 gr7.sml sml 15509 164 148 IMAGE-THUMBNAIL 1-s2.0-S2468823124003766-gr6.sml https://s3-eu-west-1.amazonaws.com/prod-ucs-content-store-eu-west/content/pii:S2468823124003766/gr6/THUMBNAIL/image/gif/2e345c492e8884345bef0cf8aa0c459a/gr6.sml gr6 gr6.sml sml 25064 164 193 IMAGE-THUMBNAIL 1-s2.0-S2468823124003766-gr8_lrg.jpg https://s3-eu-west-1.amazonaws.com/prod-ucs-content-store-eu-west/content/pii:S2468823124003766/HIGHRES/image/jpeg/8cca61ca18df602b1c2ce09c808a4731/gr8_lrg.jpg gr8 gr8_lrg.jpg jpg 669510 2076 1996 IMAGE-HIGH-RES 1-s2.0-S2468823124003766-sc1_lrg.jpg https://s3-eu-west-1.amazonaws.com/prod-ucs-content-store-eu-west/content/pii:S2468823124003766/HIGHRES/image/jpeg/5cdbbdda731fe98a4d585928293b8e7a/sc1_lrg.jpg sc1 sc1_lrg.jpg jpg 469331 1241 2000 IMAGE-HIGH-RES 1-s2.0-S2468823124003766-gr1_lrg.jpg https://s3-eu-west-1.amazonaws.com/prod-ucs-content-store-eu-west/content/pii:S2468823124003766/HIGHRES/image/jpeg/be353c03b645703958ef52322c178081/gr1_lrg.jpg gr1 gr1_lrg.jpg jpg 1319887 1897 2822 IMAGE-HIGH-RES 1-s2.0-S2468823124003766-gr3_lrg.jpg https://s3-eu-west-1.amazonaws.com/prod-ucs-content-store-eu-west/content/pii:S2468823124003766/HIGHRES/image/jpeg/6c068fa0f8a7f6da792f79b31643080d/gr3_lrg.jpg gr3 gr3_lrg.jpg jpg 475212 1302 2392 IMAGE-HIGH-RES 1-s2.0-S2468823124003766-gr2_lrg.jpg https://s3-eu-west-1.amazonaws.com/prod-ucs-content-store-eu-west/content/pii:S2468823124003766/HIGHRES/image/jpeg/c3782b9e9e1f332cbcc3d6e641108ecb/gr2_lrg.jpg gr2 gr2_lrg.jpg jpg 709841 2154 2010 IMAGE-HIGH-RES 1-s2.0-S2468823124003766-ga1_lrg.jpg https://s3-eu-west-1.amazonaws.com/prod-ucs-content-store-eu-west/content/pii:S2468823124003766/HIGHRES/image/jpeg/44f8ca2ae70668120f50af930243e244/ga1_lrg.jpg ga1 true ga1_lrg.jpg jpg 276291 886 1429 IMAGE-HIGH-RES 1-s2.0-S2468823124003766-gr5_lrg.jpg https://s3-eu-west-1.amazonaws.com/prod-ucs-content-store-eu-west/content/pii:S2468823124003766/HIGHRES/image/jpeg/066f89dd0171a8b162edd03bb975de87/gr5_lrg.jpg gr5 gr5_lrg.jpg jpg 539782 2102 1964 IMAGE-HIGH-RES 1-s2.0-S2468823124003766-gr4_lrg.jpg https://s3-eu-west-1.amazonaws.com/prod-ucs-content-store-eu-west/content/pii:S2234943X21018777/HIGHRES/image/jpeg/e8923d8d8966e3e0fa8ae9d34e6004f1/gr4_lrg.jpg gr4 gr4_lrg.jpg jpg 916485 3162 2036 IMAGE-HIGH-RES 1-s2.0-S2468823124003766-gr7_lrg.jpg https://s3-eu-west-1.amazonaws.com/prod-ucs-content-store-eu-west/content/pii:S2234943X21018765/HIGHRES/image/jpeg/d9bf756f741b0d4297a2faff353d628d/gr7_lrg.jpg gr7 gr7_lrg.jpg jpg 1994426 3240 2925 IMAGE-HIGH-RES 1-s2.0-S2468823124003766-gr6_lrg.jpg https://s3-eu-west-1.amazonaws.com/prod-ucs-content-store-eu-west/content/pii:S2234943X21018777/HIGHRES/image/jpeg/43ad5c2141c777323a35ebe2bc32f6ce/gr6_lrg.jpg gr6 gr6_lrg.jpg jpg 340429 1539 1815 IMAGE-HIGH-RES 1-s2.0-S2468823124003766-si1.svg https://s3-eu-west-1.amazonaws.com/prod-ucs-content-store-eu-west/content/pii:S2468823124003766/image/svg+xml/fd3ad15be119ee24e0806dcd8a1024c9/si1.svg si1 si1.svg svg 10686 ALTIMG 1-s2.0-S2468823124003766-am.pdf https://s3-eu-west-1.amazonaws.com/prod-ucs-content-store-eu-west/content/egi:100TG7G85KF/MAIN/application/pdf/0a616554953dce61f66579b93b33a08c/am.pdf am am.pdf pdf false 8145396 AAM-PDF MCAT 114193 114193 S2468-8231(24)00376-6 10.1016/j.mcat.2024.114193 Elsevier B.V. Fig. 1 TEM images of the Pt@ZSM-5 catalysts with different Si/Al ratio. Fig. 1 Fig. 2 a) The XRD patterns, b) NH3-TPD profiles, c) N2 adsorption-desorption isotherm curves and d) CO-DRIFTS spectra of the Pt@ZSM-5 catalysts. Fig. 2 Fig. 3 a) Light-off curves and b) specific mass rates of styrene oxidation over the Pt@ZSM-5 catalysts. Fig. 3 Fig. 4 Stability of Pt@ZSM-5 catalysts with different Si/Al ratios at different temperature. Fig. 4 Fig. 5 Thermogravimetric analysis of fresh and spent Pt@ZSM-5 catalysts (reaction at T80) reaction for catalysts with different Si/Al ratios. Fig. 5 Fig. 6 The colour changes of spent Pt@ZSM-5 catalysts with different Si/Al ratio at their T80 for 10 h. Fig. 6 Fig. 7 In situ FTIR results of styrene oxidation over the Pt@ZSM-5 catalyst with different Si/Al ratio. Fig. 7 Scheme 1 The proposed mechanism of styrene oxidation on the Pt@ZSM-5 catalyst. Scheme 1 Fig. 8 The stability of styrene oxidation over the Pt@ZSM-5 catalysts with different Si/Al ratio under staged reaction conditions at 240 °C. Fig. 8 Table 1 Physicochemical properties of Pt@ZSM-5 with different Si/Al ratios. Table 1 Catalyst BET Surface area (m2 g−1) a Vpore (cm 3 g −1) b Pore size(nm) c Actual Pt content (wt.%) d CO uptake(μmol g−1) e Pt dispersion (%) e mean size of Pt particle (nm) e mean size of Pt particle (nm) f Pt@ZSM-5–18 468 3.21 0.56 0.97 15.6 30.6 2.9 2.7 Pt@ZSM-5–40 426 2.86 0.61 0.89 9.1 20.4 3.3 3.1 Pt@ZSM-5–800 400 2.12 0.59 1.01 4.8 9.6 9.4 10.4 Pt@ZSM-5–1200 368 2.08 0.78 0.96 3.2 7.3 11.8 11.6 a The BET surface area was determined by N2 adsorption; b Total pore volumes (Vpore) were calculated at the relative pressure of 0.99; c Pore size was calculated by using NLDFT method; d The Pt content was measured by XRF; e The CO uptake was tested by chemical CO pulse adsorption, the Pt dispersion and Pt mean size was based on the assumption of Pt:CO=1; f Pt mean size was obtained by particle statistics from TEM images. Table 2 Assignment of IR bands appearing after the adsorption-oxidation process of styrene over the Pt@ZSM-5 catalysts at different time and temperature. Table 2 Position/ cm−1 Assignment characteristic of 3733 hydroxyl group stretching vibration of -OH 3091, 3032 aromatic ring υ(CH) stretching vibration 1440,1500,1593 aromatic ring skeletal υ(C=C) stretching vibrations 1651, 1731, 2691, 2874, 2925 benzaldehyde species C=O stretching vibration 1400, 1543 skeletal υ(C=C) stretching vibrations benzoate 1944, 1950 cyclic anhydrides asymmetric and symmetric υ(C=O) stretching vibrations of maleic anhydride 2082 CO CO linearly adsorbed on Pt 2282, 2314 CO2 stretching vibration of CO2 Catalytic styrene combustion over Pt/ZSM-5 Catalysts: Elucidating the deactivation mechanism induced by surface acid sites Xi Zhao Writing – original draft Validation Software Resources Investigation Formal analysis Data curation Conceptualization a Hua-Hui Xu Visualization Validation Software Resources Methodology Formal analysis Data curation a Lin-Ya Xu Visualization Validation Software Resources Investigation Formal analysis Data curation a Cai-Hao Wen Visualization Validation Software Resources Investigation Formal analysis Data curation a Xu-Dong Guo Validation Software Resources Formal analysis Data curation a Cen Tang Visualization Validation Supervision Investigation Formal analysis Data curation Conceptualization a Wen-Zhi Jia Visualization Validation Supervision Software Resources Methodology Investigation Formal analysis Data curation b ⁎ Meng-Fei Luo Writing – review & editing Visualization Supervision Project administration Investigation Conceptualization a Jian Chen Writing – review & editing Writing – original draft Visualization Supervision Methodology Investigation Conceptualization a ⁎ a Key Laboratory of the Ministry of Education for Advanced Catalysis Materials, Zhejiang Key Laboratory for Reactive Chemistry on Solid Surfaces, Institute of Physical Chemistry, Zhejiang Normal University, Jinhua 321004, China Key Laboratory of the Ministry of Education for Advanced Catalysis Materials Zhejiang Key Laboratory for Reactive Chemistry on Solid Surfaces Institute of Physical Chemistry Zhejiang Normal University Jinhua 321004 China aKey Laboratory of the Ministry of Education for Advanced Catalysis Materials, Zhejiang Key Laboratory for Reactive Chemistry on Solid Surfaces, Institute of Physical Chemistry, Zhejiang Normal University, Jinhua 321004, China b Huzhou Key Laboratory of Environmental Functional Materials and Pollution Control, Department of Materials Engineering, Huzhou University, Huzhou 313000, China Huzhou Key Laboratory of Environmental Functional Materials and Pollution Control Department of Materials Engineering Huzhou University Huzhou 313000 China bHuzhou Key Laboratory of Environmental Functional Materials and Pollution Control, Department of Materials Engineering, Huzhou University, Huzhou 313000, China ⁎ Corresponding authors. Catalytic oxidation plays a pivotal role in styrene elimination, yet the development of highly active and robust catalysts remains a challenge. This work aims to elucidate the mechanisms underlying styrene oxidation and catalyst deactivation over the Pt@ZSM-5 catalyst. The Pt@ZSM-5 catalyst with low Si/Al ratio and high surface acidity leads to generation of small Pt particle, the initial activity of the catalyst varies in a volcanic curve with the size of Pt particles. Notably, the Pt@ZSM-5–40 catalyst with Pt particle size of 3.3 nm exhibits the highest reaction rate of 1.6 µmol gPt −1 s−1 at 100 °C. However, the Pt@ZSM-5 catalysts undergo significant deactivation at their T80 (the temperature styrene conversion of 80 %). Through comprehensive characterizations and detailed mechanistic studies, it has been observed that intermediates from styrene oxidation accumulate heavily on the catalyst, especially for the Pt@ZSM-5 catalyst with high acidity. Improving the reaction temperature could inhibit the deactivation which is dependent on the surface acidity of Pt@ZSM-5 catalyst. For instance, the Pt@ZSM-5–800 and Pt@ZSM-5–1200 catalysts remains high activity when reaction is operated at T99+30, whereas a substantially higher reaction temperature (T99+80) is required for both Pt@ZSM-5–18 and Pt@ZSM-5–40 catalysts to counteract deactivation. Our primary results provide insights to develop effective and robust catalyst for styrene oxidation. Graphical abstract Image, graphical abstract Keywords Pt@ZSM-5 Styrene complete oxidation Catalyst deactivation Surface acidity Carbon deposition Data availability Data will be made available on request. 1 Introduction Styrene as one of the 50 largest volume industrial raw materials in the world is widely used in synthetic rubber, plastics, resins, pharmaceuticals and other industries, and it is still produced at a high rate of millions of tons per year [1,2]. However, the use of such large amount of styrene also brings a serious environmental problem, because the release of massive styrene exhaust gas poses a great threat to human health and ecological environment [4,5]. Styrene would seriously damage our respiratory system and central nervous system even at low concentrations, owing to styrene being easily absorbed by human through respiratory tract, skin and digestive tract. Therefore, styrene is regarded as one of the priority environmental toxic pollutants, and there is an urgent need to remove styrene exhaust gas due to the strict legislations published for protecting environment. Numerous technologies have been developed to control the emission of this troublesome substance, including adsorption, thermal combustion, catalytic combustion, low-temperature plasma, and photocatalytic oxidation [6–9]. Among them, catalytic combustion is considered to be one of the most promising techniques for eliminating styrene exhaust gas, which directly oxidizes deleterious styrene into harmless CO2 and H2O at relatively low temperature [10]. It should be pointed out that the catalysts employed for styrene combustion is decisive to the elimination efficiency, thus understanding the reaction mechanism and active sites on catalyst surface is vital for designing effective catalysts. The catalysts used for VOCs combustion commonly include two categories: transition metal oxide catalysts (CuO, CeO2, MnOx, etc.) and supported noble metal catalysts (Pt, Pd) [11-15]. Although numerous previous works studied the VOCs combustion over transition metal oxide catalysts because of their accessibility and low cost, their low thermal stabilities seriously limited the wide industrial applications [16-18]. Due to the high activity and thermal stability, noble metal catalysts are recognized as more suitable ones and widely employed in the field of VOCs combustion. In particularly, Pt based catalysts have drawn more and more attentions due to price advantage compared to Pd metal. In the previous research, it is found that there are many factors significantly affecting the performances of Pt based catalysts: nature of Pt active sites (particles sizes, chemical state, morphologies), support properties, promoters addition, etc. [19-21]. Thus, precisely regulating the particle size of Pt is often employed to improve the activity of Pt based catalysts. For instance, Ge et al. found that the size of Pt nanoparticles on CeO2 (100) significantly affects the charge of Pt specie, which is closely related to the catalytic performance of catalyst [22]. Many supports have been used for loading Pt catalysts, including zeolites (ZSM-5, HY, etc.) and metal oxides (ZrO2, Al2O3, CeO2, etc.). And it is found that surface acidity of support often remarkably affects the nature of Pt active sites, such as strong acid support benefits to stabilize the metallic Pt species under oxidation atmosphere. Due to the high specific surface area, uniform porous structure and abundant acid sites on surface, ZMS-5 zeolites are often employed to support Pt catalyst for catalytic oxidation reaction. Wang et al. found the strong acidity of ZSM-5 also benefits to the small size of Pt particle generation, which enhances the catalytic activity [23]. Besides catalytic activity, another question is also necessary to be considered, for instance, carbon deposition is considered as one of the significant threats to zeolites supported Pt catalysts, and carbon deposition preferred to occur at the acid sites on the catalyst surface. In particularly, unstable styrene easily aggregates on the catalyst surface, leading to significant carbon deposition. Thus, there is a great challenge in developing a highly active and durable catalyst for styrene combustion, which seriously limited the application of ZSM-5 supported Pt catalysts. However, there are still few works on the deactivation mechanism of catalyst for styrene oxidation. Herein, we conducted the studies of styrene combustion over a series of Pt@ZSM-5 catalysts with different surface acidity (different Si/Al ratio). Combined with the detailed characterizations of TEM, NH3-TPD and styrene oxidation in-suit FTIR, etc., the relationship between catalytic activity and Pt nanoparticles size has been investigated. More importantly, to clearly understand the deactivation mechanism of Pt@ZSM-5 catalyst, this work focused on studying the carbon deposition pathway. It is found that surface acid sites benefits to highly disperse the Pt species and the Pt@ZSM-5 catalyst with suitable small size of Pt particle exhibits the high initial reaction rate. However, the styrene oxidation intermediates (benzaldehyde, maleic anhydride, etc.) easily accumulated on the catalyst surface with high acidity. The higher the surface acidity of the catalyst, the more difficult it is to remove these reaction intermediates. To avoid deactivation caused by carbon deposition, the catalyst with high surface acidity needs to be carried out at a reaction temperature much higher than T99. Our primary work provides profound insights into surface acidity influences on catalytic activity and deactivation mechanism caused by carbon deposition. 2 Experimental section 2.1 Catalyst synthesis A series of commercial ZSM-5 supports with varying Si/Al ratios (Si/Al= 18, 40, 800 and 1200) were obtained from Shandong Dengzhuo Chemical Co., Ltd., China. Pt(NO3)2 solution as Pt precursor was purchased from Shanghai Tuosi Chemical Co., Ltd., China. The typical impregnation method was employed for preparation of a series of Pt@ZSM-5 catalysts with 1 wt.% Pt loading. In a typical procedure, the 1.00 g of ZSM-5 support was immersed into Pt(NO3)2 aqueous solution (5 mL, 0.002 g ml−1) for 2 h, followed by evaporation and drying at 100 °C for 3 h. Afterwards, the solid was calcined in a muffle furnace at 600 °C for 4 h. Consequently, a series of Pt@ZSM-5 catalysts with different Si/Al ratios were synthesized and designated as Pt@ZSM-5-x, where ‘x’ represents the Si/Al ratio of the ZSM-5 zeolite. 2.2 Catalyst characterization Powder X-ray diffraction (XRD) patterns were obtained using an X-ray diffractometer, employing Cu Kα radiation (Bruker D8, 40 kV, 40 mA). The scan speed was set at 12° min−1 across a range of 2θ from 5 to 90° The Brunauer-Emmet-Teller (BET) surface areas of the synthesized catalysts were measured through N2 adsorption at −196 °C on a BK 200C apparatus. Prior to the analysis, the catalyst underwent degassing for four hours at 100 °C to eliminate any residual substances. To analyze carbon deposition content, the thermogravimetry analysis (TGA) was carried on a NETZSCH STA 449F3 analyzer from 30 to 800 °C with a ramp rate of 10 °C min−1 under air flow. Prior to the test, the sample was dried at 100 °C to remove the adsorbed substance such as water, etc. The surface acidity of the catalyst was analyzed using a home-made laboratory apparatus. Typically, 100 mg of the catalyst was introduced into the apparatus and pre-treated under a nitrogen flow (20 mL min−1) at a temperature of 300 °C for a duration of 30 min, subsequently cooling to 50 °C. Following this, a pure ammonia flow (30 mL min−1) was directed through the catalyst bed for a period of 10 min. This was followed by a nitrogen gas flow (20 mL min−1) for 0.5 h to eliminate any residual gaseous ammonia and physically adsorbed ammonia on the catalyst surface. Finally, the catalyst bed was heated from 40 to 700 °C in a high-purity helium flow (20 mL min−1) to desorb the ammonia that had been chemisorbed on acid sites. Concurrently, the ammonia signal was recorded using a thermal conductivity detector (TCD). The dispersion of Pt was ascertained through CO chemisorption, utilizing a BELCAT II analyzer. Prior to the experiment, the catalyst underwent reduction under a gas flow mixture (5 % H2/N2 balanced, 30 mL min−1) at a temperature of 150 °C for one hour. Following this, a pulsed flow of CO mixture (5 % CO/N2 balanced) was introduced into the analyzer to measure the uptake of CO chemisorption. The dispersion of Pt was subsequently calculated based on the uptake of CO, assuming a CO:Pt ratio of 1:1. In-situ Diffuse Reflectance Infrared Fourier Transform Spectra (DRIFTS) of styrene oxidation were conducted using a Thermal Fischer Nicolet iS50 FT-IR spectrometer, equipped with a MCT detector and a PIKE DRIFT accessory. Prior to the experiment, the catalyst placed in the PIKE DRIFT accessory was subjected to treatment in an atmosphere of 10 % O2 + 90 % N2 at 300 °C for 30 min to eliminate residuals on the catalyst surface. Background spectra were subsequently recorded. Following this, a mixture flow (styrene/air balanced, at 30 mL min−1) was introduced into the apparatus for 30 min at 50 °C. This was followed by a pure N2 flow (30 mL min−1) for another 30 min, after which the spectra were recorded. Diffuse reflectance infrared Fourier transform spectra (DRIFTS) of CO chemisorption were measured on a Nicolet iS50 FT-IR spectrometer equipped with a MCT detector and a PIKE DRIFT accessory for the Pt@ZSM-5 catalysts. Prior to the test, a certain amount of catalyst was put into a cell and was pre-treated in a O2 mixture flow (30 mL min−1, 10 % O2 + 90 % N2) at 300 °C for 1 h and then cooled down to 30 °C in a N2 flow (30 mL min−1). Subsequently, the sample was reduced in a high purity H2 flow (30 mL min−1) at 300 °C for another 1 h. After it was cooled down to 30 °C, a mixture of 5% CO in He (30 mL min−1) was introduced for 30 min. After purge with N2 (30 mL min−1) for 1 h, the spectrum was recorded at 30 °C. 2.3 Catalytic activity test The styrene oxidation activities of the Pt@ZSM-5 catalysts were measured using a home-made reactor. In typical, the catalyst (60–80 mesh, 50 mg) was introduced into a quartz wool-secured reactor. A quartz bubbler, filled with styrene liquid, was positioned in a water bath at 30 °C. An air flow (5 mL min−1) was directed through the bubbler to extract the saturated styrene vapor, which was then combined with an additional air flow of 61 mL min−1. The resultant gas mixture, containing a styrene concentration of 1000 ppm and a gas hourly space velocity (GHSV) of 80,000 mL g−1 h−1, flowed onto the catalyst bed. Subsequently, the catalyst bed was heated from ambient temperature to 480 °C at a ramp rate of 10 °C min−1. Gas chromatography (Shimadzu GC-2014), equipped with a DB-Wax (30 m × 0.25 mm × 0.25 μm) capillary column and an FID detector, was employed to measure the concentrations of propane in both the inlet and outlet gases. Styrene conversion was calculated by following equation: X styrene = ( [ C ] in − [ C ] out ) / [ C ] in in which [C]in and [C]out represents the styrene concentration of inlet and outlet gas, respectively. 3 Results and discussion 3.1 Physical and chemical properties Table 1 summaries general characterizations of the Pt@ZSM-5 catalysts with different Si/Al ratios (18, 40, 800 and 1200). According to N2 adsorption experiments, it is found that all these catalysts have a large specific surface area due to porous zeolites framework. CO chemisorption results indicate that the Pt dispersion in these Pt@ZSM-5 catalysts significantly decreases with the increase of the Si/Al ratio. The mean sizes of Pt particles in the Pt@ZSM-5 catalysts are summarized in Table 1. The Pt@ZSM-5–18 catalyst with higher Si/Al ratio has larger Pt particles. For instance, the Pt@ZSM-5–18 catalyst shows the smallest Pt particle of 2.9 nm, whereas the Pt@ZSM-5–1200 catalyst shows the largest Pt particle of 11.8 nm. The above results confirm that ZSM-5 with low Si/Al ratio benefits the dispersion of Pt, which is consistent with our previous work [23]. The Pt particle sizes in the TEM images (Fig. 1 ) were analyzed by particle size statistics. It can be seen that the average size of Pt particles obtained by particle size statistics is close to that obtained by CO chemisorption. This result indicates that the Pt particle size of the Pt@ZSM-5 catalyst prepared by the impregnation method indeed increases with the increase of the Si/Al ratio of ZSM-5. Fig. 2 shows the XRD patterns and NH3-TPD profiles of the Pt@ZSM-5–18, Pt@ZSM-5–40, Pt@ZSM-5–800 and Pt@ZSM-5–1200 catalysts. The characteristic diffraction peaks at 7.84, 8.77, 11.78, 22.94, 23.18 and 24.39° are assigned to the MIF structure of ZSM-5 (JCPDS No. 42–0024) [24-26]. The characteristic diffraction peak corresponding to Pt species is absent in the XRD patterns, suggesting Pt species low content or well-dispersed in ZSM-5. The NH3-TPD profiles indicates the acid sites distribution on these Pt@ZSM-5 catalysts. For the four catalysts, the Pt@ZSM-5–18 catalyst exhibits the highest relative surface acidity, while the relative surface acidity of Pt@ZSM-5–800 and Pt@ZSM-5–1200 is similar to each other. Based on the NH3 desorption peak, it can be seen that the Pt@ZSM-5 catalyst with lower Si/Al has more acid sites. The desorption peak (α) centered at 150 °C is ascribed to the NH3 absorbed on weak sites for the Pt@ZSM-5–800 and Pt@ZSM-5–1200 catalysts. For the Pt@ZSM-5–40 catalyst, the desorption peak (labeled α) area remarkably increases compared to that of the Pt@ZSM-5–800 and Pt@ZSM-5–1200 catalysts, and a weak desorption peak (labeled β) centered at 450 °C is assigned to the moderate strong or strong acid sites [21]. The Pt@ZSM-5–18 catalyst exhibits larger desorption peak area of both peak (α) and peak (β), suggesting its more total amount of acid sites. N2 adsorption-desorption isotherm curves were measured to characterize the porosity of these Pt@ZSM-5 catalysts. It can be found that all the Pt@ZSM-5 catalysts show the type IV isotherm curves with a remarkable hysteresis loop, confirming the abundant micro-mesoporous structure in the Pt@ZSM-5 catalysts. The parameters regarding the porosity of these catalysts are also listed in the Table 1. It is found that the Pt@ZSM-5 catalyst with higher Si/Al ratio shows the lower surface area. To study the electron structure of Pt nanoparticles in these Pt@ZSM-5 catalysts, the experiment of CO adsorption infrared spectra were conducted (Fig. 2d). The intense bands observed at 2000–2100 cm−1 are present in all of the catalysts, and they are attributed to CO linearly adsorbed on the Pt sites [23]. These bands exhibit a shift to lower wavenumbers for the Pt@ZSM-5 catalysts with a low Si/Al ratio, indicating that Pt species in ZSM-5 with low Si/Al possess higher electron density. 3.2 Catalytic styrene oxidation Fig. 3 shows the light-off curves and the specific mass reaction rates (at 100 °C) for styrene complete oxidation over these Pt@ZSM-5 catalysts. It can be found that the catalytic activity of the Pt@ZSM-5 catalyst firstly increases then decreases when Si/Al ratio increases from 18 to 1200 (Fig. 3a). The specific mass rate presents a volcanic curve change to the increase Pt particle size of the Pt@ZSM-5 catalyst for styrene oxidation (Fig. 3b). Among them, the Pt@ZSM-5–40 catalyst shows the highest catalytic activity, which exhibits a specific mass rate of 1.6 µmol gPt −1 s−1 at 100 °C. The Pt@ZSM-5–1200 catalyst shows the lowest specific mass rate of 0.3 µmol gPt −1 s−1. The above results confirm that Pt particle size, affected by Si/Al ratio of ZSM-5, is closely related to the catalytic activity for styrene, the suitable small Pt particle (3.3 nm) benefits to styrene oxidation reaction. Carbon deposition often leads to serious deactivation of catalyst for VOCs elimination, particularly for zeolites based catalysts. Therefore, the stability of these catalysts has been evaluated at different reaction temperature as shown in Fig. 4 . It can be found that all these catalysts exhibits remarkable deactivation when reaction conducted at their T80 (the temperature of styrene conversion 80 %) in Fig. 4a. Such deactivation phenomenon was also observed at the temperature of T99+10 for all these Pt@ZSM-5 catalysts (Fig. 4b). When the reaction temperature was further increased to T99+30, remarkable deactivation has still been found for the Pt@ZSM-5–18 and Pt@ZSM-5–40 catalysts (Fig. 4c). Whereas, the Pt@ZSM-5–800 and Pt@ZSM-5–1200 catalysts can remain stable activity at T99+30, indicating the high reaction temperature inhibits the catalyst deactivation. For the Pt@ZSM-5–18 and Pt@ZSM-5–40 catalysts, the deactivation still occurs when reaction temperature increases to their T99+50 (Fig. 4d). The Pt@ZSM-5–18 and Pt@ZSM-5–40 catalysts can remain high activity only when reaction temperature is further increased to T99+80 (Fig. 4e-f). The above results suggest that Si/Al ratio seriously affects the deactivation of Pt@ZSM-5 catalyst for styrene combustion, and the lower Si/Al ratio of Pt@ZSM-5, the higher operation need to inhibit the deactivation. 3.3 Deactivation mechanism In order to clearly reveal the deactivation mechanism for these Pt@ZSM-5 catalysts, thermogravimetric analysis (TGA) was conducted for both the fresh and spent Pt@ZSM-5 catalysts (reaction at T80 for 10 h) (Fig. 5 ). Compared to the fresh catalyst, the additional weight loss of the spent Pt@ZSM-5 in TGA curve is ascribed to the carbon deposition during stryene oxidation. The additional weight loss order of these Pt@ZSM-5 catalysts is Pt@ZSM-5–18 > Pt@ZSM-5–40 > Pt@ZSM-5–800 > Pt@ZSM-5–1200. Among them, the Pt@ZSM-5–18 catalyst shows the most additional weight loss of 5.63 %, suggesting its serious carbon deposition behavior. The Pt@ZSM-5–1200 catalyst nearly shows no additional weight loss, representing less carbon deposition in Pt@ZSM-5–1200 catalyst under same reaction condition. The images of these fresh and spent Pt@ZSM-5 catalysts are also collected as shown in Fig. 6 . It can be found that the spent Pt@ZSM-5–18 catalyst shows purple colour which is very different with its fresh catalyst. Similar result is also observed for the spent Pt@ZSM-5–40 and Pt@ZSM-5–800 catalysts. Interestingly, the spent Pt@ZSM-5–1200 catalyst keeps the same colour to the fresh one, confirming not serious carbon deposition on the spent Pt@ZSM-5–1200 catalyst. In order to further understand the styrene oxidation mechanism on catalyst surface, in situ FTIR spectra of styrene oxidation were conducted as shown in Fig. 7 . The related characteristic vibration peaks are assigned in the Table 2 . For the Pt@ZSM-5 catalyst, it can be found that the skeletal υ(C=C) stretching vibrations of aromatic ring can be found at 1440, 1500 and 1593 cm−1, and the υ(C-H) stretching vibrations appear at 3091 and 3032 cm−1.[27] This result suggests styrene absorbed on the catalyst preparing to participate oxidation reaction. In addition, the characteristic vibration peaks of 1651, 1731, 2691, 2874 and 2925 cm−1 are ascribed to the C=O stretching vibration of benzaldehyde specie.[7,27] Then the benzaldehyde specie is further oxidized to benzoate specie as confirmed by the appearance of skeletal υ(C=C) stretching vibration. The characteristic vibration peaks of 1944 and 1950 cm−1 are attributed to the asymmetric and symmetric υ(C=O) stretching vibrations of maleic anhydride, indicating the destruction of aromatic ring [28]. The characteristic vibration peaks of CO linearly adsorbed on Pt is found at 2082 cm−1 due to organic intermediate oxidized to CO [29]. Afterwards, CO adsorbed on Pt sites is further oxidized to CO2. The specific pathway of styrene oxidation on Pt@ZSM-5 catalyst has been proposed in the Scheme 1 . Besides, it can be found that the intensity of characteristic vibration peaks ascribed to intermediates gradually increases when reaction temperature increased for both Pt@ZSM-5–18 and Pt@ZSM-5–40. This result suggests high reaction temperature promotes the styrene oxidation on catalyst surface, but the intermediates (benzaldehyde, maleic anhydride, etc.) remarkably accumulated on the catalyst surface. Whereas, the Pt@ZSM-5–800 and Pt@ZSM-5–1200 catalysts show relatively weak intensity of characteristic vibrations ascribed to those intermediates. In particularly, the characteristic vibrations of intermediates rapidly weaken when reaction temperature increased over 250 °C. The above result confirms that the Si/Al ratio of the Pt@ZSM-5 catalyst affects the intermediates accumulated on catalyst surface. 3.4 Water resistance of catalysts Considering that water vapor usually exists in the real exhaust gas and causes the serious deactivation of platinum-based catalysts due to the competitive adsorption of water vapor in active sites. Thus, the influence of water vapor on these Pt@ZSM-5 catalysts for styrene oxidation was also conducted. The styrene oxidation reaction was carried out under staged reaction conditions (0.1 % styrene/Air balanced; 0.1 % styrene + 5 % H2O/Air balanced) to observe the effect of water. It can be found that the presence of water vapor (5 vol% H2O) leads to a slight decrease of catalytic activity for the Pt@ZSM-5–18 and Pt@ZSM-5–40 catalysts, whereas the Pt@ZSM-5–800 and Pt@ZSM-5–1200 shows very robust catalytic stability for styrene even under 5 vol% H2O condition. Such result suggests that the Pt@ZSM-5 catalyst with low Si/Al ratio is more sensitive to water vapor (5 vol% H2O) due to the significantly competitive adsorption of water vapor to reactant molecule, which is consistent with our previous work [23] (Fig. 8 ). 4 Conclusion In summary, the Pt@ZSM-5 catalysts with different Si/Al ratio (18, 40, 800, 1200) were employed for styrene combustion. It is found that Si/Al ratio of ZSM-5 significantly affects the Pt particles size and the initial reaction rate of Pt@ZSM-5 catalyst for styrene combustion. The specific mass rate presents a volcanic curve change to the increase Pt particle size of the Pt@ZSM-5 catalyst for styrene oxidation. Moreover, serious deactivation was observed for all these Pt@ZSM-5 catalysts at relatively low reaction temperature such as their T80. The deactivation of the Pt@ZSM-5 catalyst is remarkably dependent on the Si/Al ratio of ZSM-5 catalyst. According to the detailed characterizations, it is found that the intermediates (benzaldehyde, maleic anhydride, etc.) of styrene oxidation easier accumulate on the Pt@ZSM-5 catalyst surface with abundant surface acid sites (low Si/Al ratio). The Pt@ZSM-5–800 and Pt@ZSM-5–1200 catalysts with low density of surface acid sites is responsible for the rapid removal of styrene oxidation intermediates. The deactivation of Pt@ZSM-5 catalyst will be inhibited by conducting the reaction at higher temperature. For instance, the Pt@ZSM-5–800 and Pt@ZSM-5–1200 catalysts remains stable activity when reaction was conducted at the T99 +30, whereas a much higher operation reaction temperature (T99 +80) is necessary to resist deactivation for the Pt@ZSM-5–18 and Pt@ZSM-5–40 catalysts. Besides, it is found that all these Pt@ZSM-5 catalysts exhibit very robust stabilities for styrene oxidation under water vapor (5 vol% H2O) condition, particularly for those catalysts with high Si/Al ratio. CRediT authorship contribution statement Xi Zhao: Writing – original draft, Validation, Software, Resources, Investigation, Formal analysis, Data curation, Conceptualization. Hua-Hui Xu: Visualization, Validation, Software, Resources, Methodology, Formal analysis, Data curation. Lin-Ya Xu: Visualization, Validation, Software, Resources, Investigation, Formal analysis, Data curation. Cai-Hao Wen: Visualization, Validation, Software, Resources, Investigation, Formal analysis, Data curation. Xu-Dong Guo: Validation, Software, Resources, Formal analysis, Data curation. Cen Tang: Visualization, Validation, Supervision, Investigation, Formal analysis, Data curation, Conceptualization. Wen-Zhi Jia: Visualization, Validation, Supervision, Software, Resources, Methodology, Investigation, Formal analysis, Data curation. Meng-Fei Luo: Writing – review & editing, Visualization, Supervision, Project administration, Investigation, Conceptualization. Jian Chen: Writing – review & editing, Writing – original draft, Visualization, Supervision, Methodology, Investigation, Conceptualization. Declaration of competing interest The authors declare that they have no known competing financial interests or personal relationships that could have appeared to influence the work reported in this paper. Acknowledgements This work was financially supported by the National Natural Science Foundation of China (No. 22172145) and the Leading Innovative and Entrepreneur Team Introduction Program of Zhejiang (No. 2022R01007). References [1] H. Pan Z. Li Q. Xia H. Xi C. He Catalytic activity of copper based catalysts pretreated with H2 reduction for catalytic combustion of styrene Catal. Commun. 10 8 2009 1166 1169 30 H. Pan, Z. Li, Q. Xia, H. Xi, C. He, Catalytic activity of copper based catalysts pretreated with H2 reduction for catalytic combustion of styrene, Catal. Commun. 2009, 10 (8), 30 1166–1169. [2] W. Shen K. Li Y. Zhang Y. Li Y. Lin Catalytic properties of Cu-substituted LaMn1-yCuyO3 on styrene combustion React. Kinet. Mech. Catal. 136 2023 805 822 W. Shen, K. Li, Y. Zhang, Y. Li, Y. Lin, Catalytic properties of Cu-substituted LaMn1-yCuyO3 on styrene combustion, React. Kinet. Mech. Catal. 2023, 136, 805–822. [3] H.Y. Pan Z.Y. He Q. Lin F. Liu Z. Li The effect of copper valence on catalytic combustion of styrene over the copper based catalysts in the absence and presence of water vapor Chin. J. Chem. Eng. 24 2016 468 474 H.Y. Pan, Z.Y. He, Q. Lin, F. Liu, Z. Li, The effect of copper valence on catalytic combustion of styrene over the copper based catalysts in the absence and presence of water vapor, Chin. J. Chem. Eng. 2016, 24, 468–474. [4] Y. Chen C. Cao C. Huang W. Gong K. Niu Y. Luo E. Wu L. Zeng Q. Qian Q. Chen CoOx supported on rice-husk derived SiO2 for styrene combustion: the balance of low temperature activity and thermal stability Appl. Surf. Sci. 606 2022 154851 Y. Chen, C. Cao, C. Huang, W. Gong, K. Niu, Y. Luo, E. Wu, L. Zeng, Q. Qian, Q. Chen, CoOx supported on rice-husk derived SiO2 for styrene combustion: the balance of low temperature activity and thermal stability, Appl. Surf. Sci. 2022, 606, 154851. [5] W. Liao W. Zhu J. Lu L. Zhang J. Zhang X. Gao Y. Luo Revealing the equilibrium relationship between lattice oxygen mobility and styrene removal: sources of adsorption and activation by in situ experiments Appl. Surf. Sci. 629 2023 157434 W. Liao, W. Zhu, J. Lu, L. Zhang, J. Zhang, X. Gao, Y. Luo, Revealing the equilibrium relationship between lattice oxygen mobility and styrene removal: sources of adsorption and activation by in situ experiments, Appl. Surf. Sci. 2023, 629, 157434. [6] S. Hou Z. Huang T. Zhu Y. Tang Y. Sun X. Li F. Shen Adsorption removal of styrene on C-Cl grafted silica gel adsorbents Chemosphere 315 2023 137679 S. Hou, Z. Huang, T. Zhu, Y. Tang, Y. Sun, X. Li, F. Shen, Adsorption removal of styrene on C-Cl grafted silica gel adsorbents, Chemosphere 2023, 315, 137679. [7] Y. Zhang W. Zhu J. Lu W. Liao N. Qi Y. Luo D.D. Dionysiou Induced synthesis of CeO2 with abundant crystal boundary for promoting catalytic oxidation of gaseous styrene Appl. Catal. B Environ. Energy 342 2024 123461 Y. Zhang, W. Zhu, J. Lu, W. Liao, N. Qi, Y. Luo, D.D. Dionysiou, Induced synthesis of CeO2 with abundant crystal boundary for promoting catalytic oxidation of gaseous styrene, Appl. Catal. B Environ. Energy 2024, 342, 123461. [8] Y. Zhang L. Zhang J. Lu W. Liao J. Zhang X. Gao Y. Luo W. Zhu Investigation of defect-rich CeO2 catalysts for super low-temperature catalytic oxidation and durable styrene removal Chemosphere 303 2022 134863 Y. Zhang, L. Zhang, J. Lu, W. Liao, J. Zhang, X. Gao, Y. Luo, W. Zhu, Investigation of defect-rich CeO2 catalysts for super low-temperature catalytic oxidation and durable styrene removal, Chemosphere, 2022, 303, 134863. [9] J. Zhang J. Liu R. Zhang H. Hou S. Chen Y. Zhang Destruction of gaseous styrene with a low-temperature plasma induced by a tubular multilayer dielectric barrier discharge Plasm. Sci. tech. 17 1 2015 50 55 J. Zhang, J. Liu, R. Zhang, H. Hou, S. Chen, Y. Zhang, Destruction of gaseous styrene with a low-temperature plasma induced by a tubular multilayer dielectric barrier discharge, Plasm. Sci. tech. 2015, 17 (1), 50–55. [10] H. Pan M. Xu Z. Li S. Huang C. He Catalytic combustion of styrene over copper based catalyst: inhibitory effect of water vapor Chemosphere 76 5 2009 721 726 H. Pan, M. Xu, Z. Li, S. Huang,C. He, Catalytic combustion of styrene over copper based catalyst: inhibitory effect of water vapor, Chemosphere, 2009, 76 (5), 721–726. [11] W.X. Zhang X. Zhao L.Y. Xu S. Xia Y.F. Zhou C.L. Chen H.H. He M.F. Luo J. Chen Unveiling the crucial active sites responsible for CO, n-heptane, and toluene oxidation over Pt@ZrO2 catalyst Mol. Catal. 558 2024 114015 W.X. Zhang, X. Zhao, L.Y. Xu, S. Xia, Y.F. Zhou, C.L. Chen, H.H. He, M.F. Luo, J. Chen, Unveiling the crucial active sites responsible for CO, n-heptane, and toluene oxidation over Pt@ZrO2 catalyst, Mol. Catal. 2024, 558, 114015. [12] J. Fan S. Hu C. Li Y. Wang G. Chen Effect of loading method on catalytic performance of Pt@CeO2 system for CO oxidation Mol. Catal. 558 2024 114013 J. Fan, S. Hu, C. Li, Y. Wang, G. Chen, Effect of loading method on catalytic performance of Pt@CeO2 system for CO oxidation, Mol. Catal. 2024, 558, 114013. [13] Z. Li C. Ma M. Qi Y. Li Y. Qu Y. Zhang L. Zhou J. Yun CeO2 from pyrolysis of MOFs for efficient catalytic combustion of VOCs Mol. Catal. 535 2023 112857 Z. Li, C. Ma, M. Qi, Y. Li, Y. Qu, Y. Zhang, L. Zhou, J. Yun. CeO2 from pyrolysis of MOFs for efficient catalytic combustion of VOCs. Mol. Catal., 2023, 535, 112857. [14] H. Gu J. Lan H. Hu F. Jia Z. Ai L. Zhang X. Liu Surface oxygen vacancy-dependent molecular oxygen activation for propane combustion over α-MnO2 J. Hazard. Mater. 460 2023 132499 H. Gu, J. Lan, H. Hu, F. Jia, Z. Ai, L. Zhang, X. Liu, Surface oxygen vacancy-dependent molecular oxygen activation for propane combustion over α-MnO2, J. Hazard. Mater. 2023, 460, 132499. [15] Z. Li C. Ma M. Qi Y. Li Y. Qu Y. Zhang L. Zhou J. Yun CeO2 from pyrolysis of MOFs for efficient catalytic combustion of VOCs Mol. Catal. 535 2023 112857 Z. Li, C. Ma, M. Qi, Y. Li, Y. Qu, Y. Zhang, L. Zhou, J. Yun, CeO2 from pyrolysis of MOFs for efficient catalytic combustion of VOCs, Mol. Catal. 2023, 535, 112857. [16] B. Li X. Zhao X. Luo W. Zhang C. Wen L. Xu C. Tang M. Luo J. Chen Boosting propane combustion over Pt@WO3 catalyst by activating interface oxygen species Appl. Surf. Sci. 650 2024 159225 B. Li, X. Zhao, X. Luo, W. Zhang, C. Wen, L. Xu, C. Tang, M. Luo, J. Chen, Boosting propane combustion over Pt@WO3 catalyst by activating interface oxygen species, Appl. Surf. Sci. 2024, 650, 159225. [17] Y. Zhou J. Wan X. Wang L. Deng Y. Liu J. Kan X. Yu X. Yang G. Wu Promoting effect of Ce doping on catalytic performance and water resistance ability for toluene catalytic combustion over the cheap and efficient Mn8Ni2CeaOx catalysts Mol. Catal. 540 2023 113019 Y. Zhou, J. Wan, X. Wang, L. Deng, Y. Liu, J. Kan, X. Yu, X. Yang, G. Wu. Promoting effect of Ce doping on catalytic performance and water resistance ability for toluene catalytic combustion over the cheap and efficient Mn8Ni2CeaOx catalysts. Mol. Catal., 2023, 540, 113019. [18] X. Han S. Jin C. Rao Y. Fang B. Hu K. Liu Y. Zhang X. Yang Mo-modified Pt@CeO2 nanorods with high propane catalytic combustion activity: comparison of phosphoric, sulphuric and molybdic acid modifications Mol. Catal. 548 2023 113426 X. Han, S. Jin, C. Rao, Y. Fang, B. Hu, K. Liu, Y. Zhang, X. Yang. Mo-modified Pt@CeO2 nanorods with high propane catalytic combustion activity: comparison of phosphoric, sulphuric and molybdic acid modifications. Mol. Catal., 2023, 548, 113426. [19] B. Li X.F. Wang W.Y. Wang C.F. Liu L.C. He M.F. Luo J. Chen Identifying the surface active sites of FeOx-modified Pt@Nb2O5 catalysts in CO and propane oxidation Appl. Catal. A Gen. 649 2023 118960 B. Li, X.F. Wang, W.Y. Wang, C.F. Liu, L.C. He, M.F. Luo, J. Chen, Identifying the surface active sites of FeOx-modified Pt@Nb2O5 catalysts in CO and propane oxidation, Appl. Catal. A Gen. 2023, 649, 118960. [20] X. Wang, L. Xu, C. Wen, D. Li, B. Li, J. Lu, Q. Yang, M. Luo, J. Chen, WO3 boosted water tolerance of Pt nanoparticle on SO42−-ZrO2 for propane oxidation, Appl. Catal. B Environ. 2023, 338, 123000. [21] D. Li X. Leng X. Wang H. Yu W. Zhang J. Chen J. Lu M. Luo Unraveling the promoting roles of sulfate groups on propane combustion over Pt@SO4 2−/ZrO2 catalysts J. Catal. 407 2022 322 332 D. Li, X. Leng, X. Wang, H. Yu, W. Zhang, J. Chen, J. Lu, M. Luo, Unraveling the promoting roles of sulfate groups on propane combustion over Pt@SO42−/ZrO2 catalysts, J. Catal. 2022, 407, 322–332. [22] S. Ge W. Fan X. Tang Y. Cui D. Wang X. Gong S. Dai Y. Lou J. Tang Y. Guo W. Zhan L. Wang Y. Guo Revealing the size effect of ceria nanocube-supported platinum nanoparticles in complete propane oxidation ACS Catal 14 4 2024 2532 2544 S. Ge, W. Fan, X. Tang, Y. Cui, D. Wang, X. Gong, S. Dai, Y. Lou, J. Tang, Y. Guo, W. Zhan, L. Wang, Y. Guo, Revealing the size effect of ceria nanocube-supported platinum nanoparticles in complete propane oxidation, ACS Catal. 2024, 14 (4) 2532–2544. [23] X. Wang C. Liu L. He B. Li J. Lu M. Luo J. Chen Unveiling geometric and electronic effects of Pt species on water-tolerant Pt@ZSM-5 catalyst for propane oxidation Appl. Catal. A Gen. 655 2023 119108 X. Wang, C. Liu, L. He, B. Li, J. Lu, M. Luo, J. Chen, Unveiling geometric and electronic effects of Pt species on water-tolerant Pt@ZSM-5 catalyst for propane oxidation, Appl. Catal. A Gen. 2023, 655, 119108. [24] Y. Lu C. Hu W. Zhang Z. Jin X. Leng Y. Wang J. Chen M. Luo Promoting the selective catalytic oxidation of diethylamine over MnOx/ZSM-5 by surface acid centers Appl. Surf. Sci. 521 2020 146348 Y. Lu, C. Hu, W. Zhang, Z. Jin, X. Leng, Y. Wang, J. Chen, M. Luo, Promoting the selective catalytic oxidation of diethylamine over MnOx/ZSM-5 by surface acid centers, Appl. Surf. Sci., 2020, 521, 146348. [25] C.F. Liu, L.C. He, X.F. Wang, J. Chen, J.Q. Lu, M.F. Luo, Tailoring Co3O4 active species to promote propane combustion over Co3O4/ZSM-5 catalyst,Mol. Catal. 2022, 524, 112297. [26] L. He H. Xu X. Leng L. Jin A. Jia M. Luo J. Chen Boosting diethylamine selective oxidation over CuO/ZSM-5 catalyst by CeO2 modification Fuel 342 2023 127792 L. He, H. Xu, X. Leng, L. Jin, A. Jia, M. Luo, J. Chen, Boosting diethylamine selective oxidation over CuO/ZSM-5 catalyst by CeO2 modification, Fuel, 2023, 342, 127792. [27] S. Mo Q. Zhang J. Li Y. Sun Q. Ren S. Zou Q. Zhang J. Lu M. Fu D. Mo J. Wu H. Huang D. Ye Highly efficient mesoporous MnO2 catalysts for the total toluene oxidation: oxygen-vacancy defect engineering and involved intermediates using in situ DRIFTS Appl. Catal. B Environ. 264 2020 118464 S. Mo, Q. Zhang, J. Li, Y. Sun, Q. Ren, S. Zou, Q. Zhang, J. Lu, M. Fu, D. Mo, J. Wu, H. Huang, D. Ye, Highly efficient mesoporous MnO2 catalysts for the total toluene oxidation: oxygen-vacancy defect engineering and involved intermediates using in situ DRIFTS, Appl. Catal. B Environ. 2020, 264, 118464. [28] J. Li H. Na X. Zeng T. Zhu Z. Liu In situ DRIFTS investigation for the oxidation of toluene by ozone over Mn/HZSM-5, Ag/HZSM-5 and Mn-Ag/HZSM-5 catalysts Appl. Surf. Sci. 311 2014 690 696 J. Li, H. Na, X. Zeng, T. Zhu, Z. Liu, In situ DRIFTS investigation for the oxidation of toluene by ozone over Mn/HZSM-5, Ag/HZSM-5 and Mn-Ag/HZSM-5 catalysts, Appl. Surf. Sci. 2014, 311, 690–696. [29] W. Wang D. Li H. Yu C. Liu C. Tang J. Chen J. Lu M. Luo Insights into different reaction behaviors of propane and CO oxidation over Pt@CeO2 and Pt@Nb2O5: the crucial roles of support properties J. Phys. Chem. C 125 35 2021 19301 19310 W. Wang, D. Li, H. Yu, C. Liu, C. Tang, J. Chen, J. Lu, M. Luo, Insights into different reaction behaviors of propane and CO oxidation over Pt@CeO2 and Pt@Nb2O5: the crucial roles of support properties, J. Phys. Chem. C 2021, 125 (35), 19301–19310.",
      "scopus-id": "85191961468",
      "coredata": {
        "eid": "1-s2.0-S2468823124003766",
        "dc:description": "Catalytic oxidation plays a pivotal role in styrene elimination, yet the development of highly active and robust catalysts remains a challenge. This work aims to elucidate the mechanisms underlying styrene oxidation and catalyst deactivation over the Pt@ZSM-5 catalyst. The Pt@ZSM-5 catalyst with low Si/Al ratio and high surface acidity leads to generation of small Pt particle, the initial activity of the catalyst varies in a volcanic curve with the size of Pt particles. Notably, the Pt@ZSM-5–40 catalyst with Pt particle size of 3.3 nm exhibits the highest reaction rate of 1.6 µmol gPt −1 s−1 at 100 °C. However, the Pt@ZSM-5 catalysts undergo significant deactivation at their T80 (the temperature styrene conversion of 80 %). Through comprehensive characterizations and detailed mechanistic studies, it has been observed that intermediates from styrene oxidation accumulate heavily on the catalyst, especially for the Pt@ZSM-5 catalyst with high acidity. Improving the reaction temperature could inhibit the deactivation which is dependent on the surface acidity of Pt@ZSM-5 catalyst. For instance, the Pt@ZSM-5–800 and Pt@ZSM-5–1200 catalysts remains high activity when reaction is operated at T99+30, whereas a substantially higher reaction temperature (T99+80) is required for both Pt@ZSM-5–18 and Pt@ZSM-5–40 catalysts to counteract deactivation. Our primary results provide insights to develop effective and robust catalyst for styrene oxidation.",
        "openArchiveArticle": "false",
        "prism:coverDate": "2024-05-15",
        "openaccessUserLicense": null,
        "prism:aggregationType": "Journal",
        "prism:url": "https://api.elsevier.com/content/article/pii/S2468823124003766",
        "dc:creator": [
          {
            "@_fa": "true",
            "$": "Zhao, Xi"
          },
          {
            "@_fa": "true",
            "$": "Xu, Hua-Hui"
          },
          {
            "@_fa": "true",
            "$": "Xu, Lin-Ya"
          },
          {
            "@_fa": "true",
            "$": "Wen, Cai-Hao"
          },
          {
            "@_fa": "true",
            "$": "Guo, Xu-Dong"
          },
          {
            "@_fa": "true",
            "$": "Tang, Cen"
          },
          {
            "@_fa": "true",
            "$": "Jia, Wen-Zhi"
          },
          {
            "@_fa": "true",
            "$": "Luo, Meng-Fei"
          },
          {
            "@_fa": "true",
            "$": "Chen, Jian"
          }
        ],
        "link": [
          {
            "@_fa": "true",
            "@rel": "self",
            "@href": "https://api.elsevier.com/content/article/pii/S2468823124003766"
          },
          {
            "@_fa": "true",
            "@rel": "scidir",
            "@href": "https://www.sciencedirect.com/science/article/pii/S2468823124003766"
          }
        ],
        "dc:format": "application/json",
        "openaccessType": null,
        "pii": "S2468-8231(24)00376-6",
        "prism:volume": "561",
        "articleNumber": "114193",
        "prism:publisher": "Elsevier B.V.",
        "dc:title": "Catalytic styrene combustion over Pt/ZSM-5 Catalysts: Elucidating the deactivation mechanism induced by surface acid sites",
        "prism:copyright": "© 2024 Elsevier B.V. All rights reserved.",
        "openaccess": "0",
        "prism:issn": "24688231",
        "dcterms:subject": [
          {
            "@_fa": "true",
            "$": "Pt@ZSM-5"
          },
          {
            "@_fa": "true",
            "$": "Styrene complete oxidation"
          },
          {
            "@_fa": "true",
            "$": "Catalyst deactivation"
          },
          {
            "@_fa": "true",
            "$": "Surface acidity"
          },
          {
            "@_fa": "true",
            "$": "Carbon deposition"
          }
        ],
        "openaccessArticle": "false",
        "prism:publicationName": "Molecular Catalysis",
        "openaccessSponsorType": null,
        "prism:pageRange": "114193",
        "pubType": "fla",
        "prism:coverDisplayDate": "15 May 2024",
        "prism:doi": "10.1016/j.mcat.2024.114193",
        "prism:startingPage": "114193",
        "dc:identifier": "doi:10.1016/j.mcat.2024.114193",
        "openaccessSponsorName": null
      },
      "objects": {
        "object": [
          {
            "@category": "standard",
            "@height": "469",
            "@width": "451",
            "@_fa": "true",
            "$": "https://api.elsevier.com/content/object/eid/1-s2.0-S2468823124003766-gr8.jpg?httpAccept=%2A%2F%2A",
            "@multimediatype": "JPEG image file",
            "@type": "IMAGE-DOWNSAMPLED",
            "@size": "73549",
            "@ref": "gr8",
            "@mimetype": "image/jpeg"
          },
          {
            "@category": "standard",
            "@height": "280",
            "@width": "452",
            "@_fa": "true",
            "$": "https://api.elsevier.com/content/object/eid/1-s2.0-S2468823124003766-sc1.jpg?httpAccept=%2A%2F%2A",
            "@multimediatype": "JPEG image file",
            "@type": "IMAGE-DOWNSAMPLED",
            "@size": "51147",
            "@ref": "sc1",
            "@mimetype": "image/jpeg"
          },
          {
            "@category": "standard",
            "@height": "428",
            "@width": "637",
            "@_fa": "true",
            "$": "https://api.elsevier.com/content/object/eid/1-s2.0-S2468823124003766-gr1.jpg?httpAccept=%2A%2F%2A",
            "@multimediatype": "JPEG image file",
            "@type": "IMAGE-DOWNSAMPLED",
            "@size": "104060",
            "@ref": "gr1",
            "@mimetype": "image/jpeg"
          },
          {
            "@category": "standard",
            "@height": "294",
            "@width": "540",
            "@_fa": "true",
            "$": "https://api.elsevier.com/content/object/eid/1-s2.0-S2468823124003766-gr3.jpg?httpAccept=%2A%2F%2A",
            "@multimediatype": "JPEG image file",
            "@type": "IMAGE-DOWNSAMPLED",
            "@size": "54841",
            "@ref": "gr3",
            "@mimetype": "image/jpeg"
          },
          {
            "@category": "standard",
            "@height": "487",
            "@width": "454",
            "@_fa": "true",
            "$": "https://api.elsevier.com/content/object/eid/1-s2.0-S2468823124003766-gr2.jpg?httpAccept=%2A%2F%2A",
            "@multimediatype": "JPEG image file",
            "@type": "IMAGE-DOWNSAMPLED",
            "@size": "79594",
            "@ref": "gr2",
            "@mimetype": "image/jpeg"
          },
          {
            "@category": "standard",
            "@height": "200",
            "@width": "322",
            "@_fa": "true",
            "$": "https://api.elsevier.com/content/object/eid/1-s2.0-S2468823124003766-ga1.jpg?httpAccept=%2A%2F%2A",
            "@multimediatype": "JPEG image file",
            "@type": "IMAGE-DOWNSAMPLED",
            "@size": "31730",
            "@ref": "ga1",
            "@mimetype": "image/jpeg"
          },
          {
            "@category": "standard",
            "@height": "474",
            "@width": "443",
            "@_fa": "true",
            "$": "https://api.elsevier.com/content/object/eid/1-s2.0-S2468823124003766-gr5.jpg?httpAccept=%2A%2F%2A",
            "@multimediatype": "JPEG image file",
            "@type": "IMAGE-DOWNSAMPLED",
            "@size": "59735",
            "@ref": "gr5",
            "@mimetype": "image/jpeg"
          },
          {
            "@category": "standard",
            "@height": "714",
            "@width": "460",
            "@_fa": "true",
            "$": "https://api.elsevier.com/content/object/eid/1-s2.0-S2468823124003766-gr4.jpg?httpAccept=%2A%2F%2A",
            "@multimediatype": "JPEG image file",
            "@type": "IMAGE-DOWNSAMPLED",
            "@size": "110857",
            "@ref": "gr4",
            "@mimetype": "image/jpeg"
          },
          {
            "@category": "standard",
            "@height": "732",
            "@width": "661",
            "@_fa": "true",
            "$": "https://api.elsevier.com/content/object/eid/1-s2.0-S2468823124003766-gr7.jpg?httpAccept=%2A%2F%2A",
            "@multimediatype": "JPEG image file",
            "@type": "IMAGE-DOWNSAMPLED",
            "@size": "215755",
            "@ref": "gr7",
            "@mimetype": "image/jpeg"
          },
          {
            "@category": "standard",
            "@height": "348",
            "@width": "410",
            "@_fa": "true",
            "$": "https://api.elsevier.com/content/object/eid/1-s2.0-S2468823124003766-gr6.jpg?httpAccept=%2A%2F%2A",
            "@multimediatype": "JPEG image file",
            "@type": "IMAGE-DOWNSAMPLED",
            "@size": "35348",
            "@ref": "gr6",
            "@mimetype": "image/jpeg"
          },
          {
            "@category": "thumbnail",
            "@height": "163",
            "@width": "157",
            "@_fa": "true",
            "$": "https://api.elsevier.com/content/object/eid/1-s2.0-S2468823124003766-gr8.sml?httpAccept=%2A%2F%2A",
            "@multimediatype": "GIF image file",
            "@type": "IMAGE-THUMBNAIL",
            "@size": "12170",
            "@ref": "gr8",
            "@mimetype": "image/gif"
          },
          {
            "@category": "thumbnail",
            "@height": "136",
            "@width": "219",
            "@_fa": "true",
            "$": "https://api.elsevier.com/content/object/eid/1-s2.0-S2468823124003766-sc1.sml?httpAccept=%2A%2F%2A",
            "@multimediatype": "GIF image file",
            "@type": "IMAGE-THUMBNAIL",
            "@size": "19510",
            "@ref": "sc1",
            "@mimetype": "image/gif"
          },
          {
            "@category": "thumbnail",
            "@height": "147",
            "@width": "219",
            "@_fa": "true",
            "$": "https://api.elsevier.com/content/object/eid/1-s2.0-S2468823124003766-gr1.sml?httpAccept=%2A%2F%2A",
            "@multimediatype": "GIF image file",
            "@type": "IMAGE-THUMBNAIL",
            "@size": "26447",
            "@ref": "gr1",
            "@mimetype": "image/gif"
          },
          {
            "@category": "thumbnail",
            "@height": "119",
            "@width": "219",
            "@_fa": "true",
            "$": "https://api.elsevier.com/content/object/eid/1-s2.0-S2468823124003766-gr3.sml?httpAccept=%2A%2F%2A",
            "@multimediatype": "GIF image file",
            "@type": "IMAGE-THUMBNAIL",
            "@size": "11741",
            "@ref": "gr3",
            "@mimetype": "image/gif"
          },
          {
            "@category": "thumbnail",
            "@height": "164",
            "@width": "153",
            "@_fa": "true",
            "$": "https://api.elsevier.com/content/object/eid/1-s2.0-S2468823124003766-gr2.sml?httpAccept=%2A%2F%2A",
            "@multimediatype": "GIF image file",
            "@type": "IMAGE-THUMBNAIL",
            "@size": "12856",
            "@ref": "gr2",
            "@mimetype": "image/gif"
          },
          {
            "@category": "thumbnail",
            "@height": "136",
            "@width": "219",
            "@_fa": "true",
            "$": "https://api.elsevier.com/content/object/eid/1-s2.0-S2468823124003766-ga1.sml?httpAccept=%2A%2F%2A",
            "@multimediatype": "GIF image file",
            "@type": "IMAGE-THUMBNAIL",
            "@size": "19531",
            "@ref": "ga1",
            "@mimetype": "image/gif"
          },
          {
            "@category": "thumbnail",
            "@height": "164",
            "@width": "153",
            "@_fa": "true",
            "$": "https://api.elsevier.com/content/object/eid/1-s2.0-S2468823124003766-gr5.sml?httpAccept=%2A%2F%2A",
            "@multimediatype": "GIF image file",
            "@type": "IMAGE-THUMBNAIL",
            "@size": "10951",
            "@ref": "gr5",
            "@mimetype": "image/gif"
          },
          {
            "@category": "thumbnail",
            "@height": "163",
            "@width": "105",
            "@_fa": "true",
            "$": "https://api.elsevier.com/content/object/eid/1-s2.0-S2468823124003766-gr4.sml?httpAccept=%2A%2F%2A",
            "@multimediatype": "GIF image file",
            "@type": "IMAGE-THUMBNAIL",
            "@size": "10287",
            "@ref": "gr4",
            "@mimetype": "image/gif"
          },
          {
            "@category": "thumbnail",
            "@height": "164",
            "@width": "148",
            "@_fa": "true",
            "$": "https://api.elsevier.com/content/object/eid/1-s2.0-S2468823124003766-gr7.sml?httpAccept=%2A%2F%2A",
            "@multimediatype": "GIF image file",
            "@type": "IMAGE-THUMBNAIL",
            "@size": "15509",
            "@ref": "gr7",
            "@mimetype": "image/gif"
          },
          {
            "@category": "thumbnail",
            "@height": "164",
            "@width": "193",
            "@_fa": "true",
            "$": "https://api.elsevier.com/content/object/eid/1-s2.0-S2468823124003766-gr6.sml?httpAccept=%2A%2F%2A",
            "@multimediatype": "GIF image file",
            "@type": "IMAGE-THUMBNAIL",
            "@size": "25064",
            "@ref": "gr6",
            "@mimetype": "image/gif"
          },
          {
            "@category": "high",
            "@height": "2076",
            "@width": "1996",
            "@_fa": "true",
            "$": "https://api.elsevier.com/content/object/eid/1-s2.0-S2468823124003766-gr8_lrg.jpg?httpAccept=%2A%2F%2A",
            "@multimediatype": "JPEG image file",
            "@type": "IMAGE-HIGH-RES",
            "@size": "669510",
            "@ref": "gr8",
            "@mimetype": "image/jpeg"
          },
          {
            "@category": "high",
            "@height": "1241",
            "@width": "2000",
            "@_fa": "true",
            "$": "https://api.elsevier.com/content/object/eid/1-s2.0-S2468823124003766-sc1_lrg.jpg?httpAccept=%2A%2F%2A",
            "@multimediatype": "JPEG image file",
            "@type": "IMAGE-HIGH-RES",
            "@size": "469331",
            "@ref": "sc1",
            "@mimetype": "image/jpeg"
          },
          {
            "@category": "high",
            "@height": "1897",
            "@width": "2822",
            "@_fa": "true",
            "$": "https://api.elsevier.com/content/object/eid/1-s2.0-S2468823124003766-gr1_lrg.jpg?httpAccept=%2A%2F%2A",
            "@multimediatype": "JPEG image file",
            "@type": "IMAGE-HIGH-RES",
            "@size": "1319887",
            "@ref": "gr1",
            "@mimetype": "image/jpeg"
          },
          {
            "@category": "high",
            "@height": "1302",
            "@width": "2392",
            "@_fa": "true",
            "$": "https://api.elsevier.com/content/object/eid/1-s2.0-S2468823124003766-gr3_lrg.jpg?httpAccept=%2A%2F%2A",
            "@multimediatype": "JPEG image file",
            "@type": "IMAGE-HIGH-RES",
            "@size": "475212",
            "@ref": "gr3",
            "@mimetype": "image/jpeg"
          },
          {
            "@category": "high",
            "@height": "2154",
            "@width": "2010",
            "@_fa": "true",
            "$": "https://api.elsevier.com/content/object/eid/1-s2.0-S2468823124003766-gr2_lrg.jpg?httpAccept=%2A%2F%2A",
            "@multimediatype": "JPEG image file",
            "@type": "IMAGE-HIGH-RES",
            "@size": "709841",
            "@ref": "gr2",
            "@mimetype": "image/jpeg"
          },
          {
            "@category": "high",
            "@height": "886",
            "@width": "1429",
            "@_fa": "true",
            "$": "https://api.elsevier.com/content/object/eid/1-s2.0-S2468823124003766-ga1_lrg.jpg?httpAccept=%2A%2F%2A",
            "@multimediatype": "JPEG image file",
            "@type": "IMAGE-HIGH-RES",
            "@size": "276291",
            "@ref": "ga1",
            "@mimetype": "image/jpeg"
          },
          {
            "@category": "high",
            "@height": "2102",
            "@width": "1964",
            "@_fa": "true",
            "$": "https://api.elsevier.com/content/object/eid/1-s2.0-S2468823124003766-gr5_lrg.jpg?httpAccept=%2A%2F%2A",
            "@multimediatype": "JPEG image file",
            "@type": "IMAGE-HIGH-RES",
            "@size": "539782",
            "@ref": "gr5",
            "@mimetype": "image/jpeg"
          },
          {
            "@category": "high",
            "@height": "3162",
            "@width": "2036",
            "@_fa": "true",
            "$": "https://api.elsevier.com/content/object/eid/1-s2.0-S2468823124003766-gr4_lrg.jpg?httpAccept=%2A%2F%2A",
            "@multimediatype": "JPEG image file",
            "@type": "IMAGE-HIGH-RES",
            "@size": "916485",
            "@ref": "gr4",
            "@mimetype": "image/jpeg"
          },
          {
            "@category": "high",
            "@height": "3240",
            "@width": "2925",
            "@_fa": "true",
            "$": "https://api.elsevier.com/content/object/eid/1-s2.0-S2468823124003766-gr7_lrg.jpg?httpAccept=%2A%2F%2A",
            "@multimediatype": "JPEG image file",
            "@type": "IMAGE-HIGH-RES",
            "@size": "1994426",
            "@ref": "gr7",
            "@mimetype": "image/jpeg"
          },
          {
            "@category": "high",
            "@height": "1539",
            "@width": "1815",
            "@_fa": "true",
            "$": "https://api.elsevier.com/content/object/eid/1-s2.0-S2468823124003766-gr6_lrg.jpg?httpAccept=%2A%2F%2A",
            "@multimediatype": "JPEG image file",
            "@type": "IMAGE-HIGH-RES",
            "@size": "340429",
            "@ref": "gr6",
            "@mimetype": "image/jpeg"
          },
          {
            "@category": "thumbnail",
            "@_fa": "true",
            "$": "https://api.elsevier.com/content/object/eid/1-s2.0-S2468823124003766-si1.svg?httpAccept=%2A%2F%2A",
            "@multimediatype": "Scalable Vector Graphics file",
            "@type": "ALTIMG",
            "@size": "10686",
            "@ref": "si1",
            "@mimetype": "image/svg+xml"
          },
          {
            "@category": "standard",
            "@_fa": "true",
            "$": "https://api.elsevier.com/content/object/eid/1-s2.0-S2468823124003766-am.pdf?httpAccept=%2A%2F%2A",
            "@multimediatype": "Acrobat PDF file",
            "@type": "AAM-PDF",
            "@size": "8145396",
            "@ref": "am",
            "@mimetype": "application/pdf"
          }
        ]
      },
      "link": {
        "@rel": "abstract",
        "@href": "https://api.elsevier.com/content/abstract/scopus_id/85191961468"
      }
    }
  }
}