{
  "metadata": {
    "title": "First-principles study of CO<ce:inf loc=post>2</ce:inf> hydrogenation to methanol on In-Ru alloys: Revealing the influence of surface In/Ru ratio on reaction mechanism and catalyst performance",
    "authors": "; ; ",
    "journal": "Molecular Catalysis",
    "date": "2024-06-01",
    "doi": "10.1016/j.mcat.2024.114192",
    "abstract": "",
    "uri": "https://api.elsevier.com/content/article/pii/S2468823124003754",
    "pii": "S2468823124003754"
  },
  "fulltext": {
    "full-text-retrieval-response": {
      "scopus-eid": "2-s2.0-85192223385",
      "originalText": "serial JL 315758 291210 291744 291790 291809 31 Molecular Catalysis MOLECULARCATALYSIS 2024-05-08 2024-05-08 2024-05-08 2024-05-08 2025-01-21T07:56:21 1-s2.0-S2468823124003754 S2468-8231(24)00375-4 S2468823124003754 10.1016/j.mcat.2024.114192 S300 S300.1 FULL-TEXT 1-s2.0-S2468823124X00085 2025-01-21T11:14:04.901926Z 0 0 20240601 2024 2024-05-08T05:29:46.625254Z absattachment articleinfo articlenumber articletitlenorm authfirstinitialnorm authfirstsurnamenorm cid cids contenttype copyright crossmark dateloaded dateloadedtxt datesearch datesort dateupdated dco docsubtype doctype doi eid ewtransactionid hubeid indexeddate issn issnnorm itemstage itemtransactionid itemweight openaccess openarchive pg pgfirst pii piinorm pubdatestart pubdatetxt pubyr sectiontitle sortorder srctitle srctitlenorm srctype ssids alllist content subj subheadings suppl tomb volfirst volissue volumelist webpdf webpdfpagecount yearnav figure e-component body mmlmath acknowledge affil appendices articletitle auth authfirstini authfull authkeywords authlast grantnumber grantsponsor highlightsabst orcid primabst pubtype ref specialabst 2468-8231 24688231 true 562 562 C Volume 562 3 114192 114192 114192 20240601 1 June 2024 2024-06-01 2024 Regular Papers article fla © 2024 Elsevier B.V. All rights reserved. FIRSTPRINCIPLESSTUDYCO2HYDROGENATIONMETHANOLINRUALLOYSREVEALINGINFLUENCESURFACEINRURATIOREACTIONMECHANISMCATALYSTPERFORMANCE YU J 1 Introduction 2 Computational methods 2.1 DFT calculation methods 2.2 Surface models 2.3 Microkinetic modeling 3 Results and discussion 3.1 Morphological and electronic properties of both surfaces 3.2 Adsorption and dissociation behavior of H2 on both surfaces 3.3 Adsorption behavior of CO2 on both surfaces 3.4 First elementary step of CO2 hydrogenation on both surfaces 3.5 The integrated reaction route towards methanol and CO formation through CO2 hydrogenation on both surfaces 3.5.1 The integrated reaction route towards methanol formation (through “Formate” pathway) on In3Ru_i surface 3.5.2 The integrated reaction route towards CO formation (through “RWGS” pathway) on In3Ru_i surface 3.5.3 The integrated reaction route towards methanol formation (through “Formate” pathway) on In3Ru_r surface 3.5.4 The integrated reaction route towards CO formation (through “RWGS” pathway) on In3Ru_i surface 3.5.5 Microkinetic modeling 4 Discussions 4.1 The influence of water on the catalyst performance of In3Ru_i for methanol formation 4.2 The influence with respect to the ratio of surface In/Ru on catalyst performance of In3Ru_i for methanol formation 5 Conclusions CRediT authorship contribution statement Acknowledgment Appendix Supplementary materials References ALFONSO 2020 1496 1508 S BAI 2021 4259 4298 S ZANDALINAS 2021 588 599 S TEBALDI 2021 588 599 C GAO 2020 8584 8686 W GODIN 2021 105644 J KIM 2022 102239 C HO 2019 8941 8954 H ALMAMOORI 2017 834 849 A GHIAT 2021 101432 I YU 2022 23182 23194 J VERHELST 2019 43 88 S HE 2024 114008 Q LIU 2024 114002 H RAUCHLE 2016 193 200 K GRACIANI 2014 546 550 J BEHRENS 2012 893 897 M YANG 2017 4580 4598 H LI 2019 7840 7861 K MONTINI 2016 5987 6041 T YAN 2022 121098 Y BAHRUJI 2016 133 146 H CHOI 2019 68 76 H WANG 2021 1406 1423 J LI 2018 3450 3464 M GENG 2020 6931 6943 F JIANG 2015 173 185 X NIE 2018 4873 4892 X JIANG 2019 21 32 X JIANG 2019 10 14 X LIU 2017 26287 26299 L YANG 2021 3961 3971 G SNIDER 2019 3399 3412 J YE 2015 193 201 J LI 2020 16039 16046 M GENG 2021 11891 11902 F MOHAN 2021 2420 2433 O YU 2022 14654 14666 J CHEN 2023 15230 15247 L DREYER 2017 715 726 J KRESSE 1996 11169 11186 G KRESSE 1999 1758 G KRESSE 1999 1758 1775 G PERDEW 1996 3865 3868 J MONKHORST 1976 5188 5192 H LEE 2010 081101 K HENKELMAN 2000 G HENKELMAN 2006 354 360 G SANVILLE 2007 899 908 E TAKAGIWA 2012 123707 Y POTTGEN 1995 59 64 R STUDIO 2018 M BIOVIASOFTWAREINC5005WATERIDGEVISTADRIVE MEDFORD 2015 794 807 A CAMPBELL 2017 2770 2779 C LI 2022 1330 1337 J DENG 2021 22276 22282 L HUSSAIN 2023 113539 S BUTT 2021 111630 M QIN 2020 3390 3399 B YE 2013 1296 1306 J YUX2024X114192 YUX2024X114192XJ 2026-05-08T00:00:00.000Z 2026-05-08T00:00:00.000Z http://creativecommons.org/licenses/by-nc-nd/4.0/ © 2024 Elsevier B.V. All rights reserved. 2024-05-10T16:40:08.093Z http://vtw.elsevier.com/data/voc/AddOnTypes/50.7/aggregated-refined National Natural Science Foundation of China 21973014 NSFC National Natural Science Foundation of China http://data.elsevier.com/vocabulary/SciValFunders/501100001809 http://sws.geonames.org/1814991 This work was financially supported by the National Natural Science Foundation of China ( 21973014 ). https://doi.org/10.15223/policy-017 https://doi.org/10.15223/policy-037 https://doi.org/10.15223/policy-012 https://doi.org/10.15223/policy-029 https://doi.org/10.15223/policy-004 item S2468-8231(24)00375-4 S2468823124003754 1-s2.0-S2468823124003754 10.1016/j.mcat.2024.114192 315758 2025-01-21T11:14:04.901926Z 2024-06-01 1-s2.0-S2468823124003754-main.pdf https://s3-eu-west-1.amazonaws.com/prod-ucs-content-store-eu-west/content/pii:S2468823124003754/MAIN/application/pdf/ae05a1e4163fc9caecb51ecd37b5a454/main.pdf main.pdf pdf true 10533346 MAIN 13 1-s2.0-S2468823124003754-main_1.png https://s3-eu-west-1.amazonaws.com/prod-ucs-content-store-eu-west/content/pii:S2468823124003754/PREVIEW/image/png/1f982a2d850f64ee288ea30d0e2cb43d/main_1.png main_1.png png 57878 849 656 IMAGE-WEB-PDF 1 1-s2.0-S2468823124003754-gr9.jpg https://s3-eu-west-1.amazonaws.com/prod-ucs-content-store-eu-west/content/pii:S2468823124003754/gr9/DOWNSAMPLED/image/jpeg/5b09f0ba40dc25fc2d8251dbbdf17564/gr9.jpg gr9 gr9.jpg jpg 62558 448 577 IMAGE-DOWNSAMPLED 1-s2.0-S2468823124003754-gr5.jpg https://s3-eu-west-1.amazonaws.com/prod-ucs-content-store-eu-west/content/pii:S2468823124003754/gr5/DOWNSAMPLED/image/jpeg/21786bb133dd0cdfc60aeabcb9950339/gr5.jpg gr5 gr5.jpg jpg 106252 543 656 IMAGE-DOWNSAMPLED 1-s2.0-S2468823124003754-gr6.jpg https://s3-eu-west-1.amazonaws.com/prod-ucs-content-store-eu-west/content/pii:S2468823124003754/gr6/DOWNSAMPLED/image/jpeg/b411af107cb92e7e5af6913694c2bca5/gr6.jpg gr6 gr6.jpg jpg 107689 566 671 IMAGE-DOWNSAMPLED 1-s2.0-S2468823124003754-gr7.jpg https://s3-eu-west-1.amazonaws.com/prod-ucs-content-store-eu-west/content/pii:S2468823124003754/gr7/DOWNSAMPLED/image/jpeg/97c93e0c04e84ed389fa41748bd5b59c/gr7.jpg gr7 gr7.jpg jpg 52261 271 732 IMAGE-DOWNSAMPLED 1-s2.0-S2468823124003754-gr8.jpg https://s3-eu-west-1.amazonaws.com/prod-ucs-content-store-eu-west/content/pii:S2468823124003754/gr8/DOWNSAMPLED/image/jpeg/d8088bde183e1a2d196ff80b975d82b4/gr8.jpg gr8 gr8.jpg jpg 49811 268 730 IMAGE-DOWNSAMPLED 1-s2.0-S2468823124003754-gr1.jpg https://s3-eu-west-1.amazonaws.com/prod-ucs-content-store-eu-west/content/pii:S2468823124003754/gr1/DOWNSAMPLED/image/jpeg/0763ba0a8bb169070272c000c7ed69bf/gr1.jpg gr1 gr1.jpg jpg 141547 669 650 IMAGE-DOWNSAMPLED 1-s2.0-S2468823124003754-gr2.jpg https://s3-eu-west-1.amazonaws.com/prod-ucs-content-store-eu-west/content/pii:S2468823124003754/gr2/DOWNSAMPLED/image/jpeg/59e1f2d4745c1d794b88a2caa3725fc0/gr2.jpg gr2 gr2.jpg jpg 89424 311 710 IMAGE-DOWNSAMPLED 1-s2.0-S2468823124003754-gr3.jpg https://s3-eu-west-1.amazonaws.com/prod-ucs-content-store-eu-west/content/pii:S2468823124003754/gr3/DOWNSAMPLED/image/jpeg/e06be47a0a8f9741bed976a6ace7c0eb/gr3.jpg gr3 gr3.jpg jpg 65782 271 755 IMAGE-DOWNSAMPLED 1-s2.0-S2468823124003754-gr10.jpg https://s3-eu-west-1.amazonaws.com/prod-ucs-content-store-eu-west/content/pii:S2468823124003754/gr10/DOWNSAMPLED/image/jpeg/576dcf2f20fb6b0f6a4b53254554f3a7/gr10.jpg gr10 gr10.jpg jpg 29477 306 401 IMAGE-DOWNSAMPLED 1-s2.0-S2468823124003754-gr4.jpg https://s3-eu-west-1.amazonaws.com/prod-ucs-content-store-eu-west/content/pii:S2468823124003754/gr4/DOWNSAMPLED/image/jpeg/25b1a6a91468f9e1f0bc80900040dc3f/gr4.jpg gr4 gr4.jpg jpg 61810 275 523 IMAGE-DOWNSAMPLED 1-s2.0-S2468823124003754-gr11.jpg https://s3-eu-west-1.amazonaws.com/prod-ucs-content-store-eu-west/content/pii:S2468823124003754/gr11/DOWNSAMPLED/image/jpeg/d897c5b33ea5987f86a8803b58754357/gr11.jpg gr11 gr11.jpg jpg 68534 283 725 IMAGE-DOWNSAMPLED 1-s2.0-S2468823124003754-ga1.jpg https://s3-eu-west-1.amazonaws.com/prod-ucs-content-store-eu-west/content/pii:S2468823124003754/ga1/DOWNSAMPLED/image/jpeg/94e38addd723f4c9dea6aebb6d819976/ga1.jpg ga1 true ga1.jpg jpg 37921 200 402 IMAGE-DOWNSAMPLED 1-s2.0-S2468823124003754-gr9.sml https://s3-eu-west-1.amazonaws.com/prod-ucs-content-store-eu-west/content/pii:S2468823124003754/gr9/THUMBNAIL/image/gif/02bfc3c04792ec940135d4fa3fb72365/gr9.sml gr9 gr9.sml sml 16721 164 211 IMAGE-THUMBNAIL 1-s2.0-S2468823124003754-gr5.sml https://s3-eu-west-1.amazonaws.com/prod-ucs-content-store-eu-west/content/pii:S2468823124003754/gr5/THUMBNAIL/image/gif/e03bf5c4fce43ab137f8133a40064a0f/gr5.sml gr5 gr5.sml sml 14984 164 198 IMAGE-THUMBNAIL 1-s2.0-S2468823124003754-gr6.sml https://s3-eu-west-1.amazonaws.com/prod-ucs-content-store-eu-west/content/pii:S2468823124003754/gr6/THUMBNAIL/image/gif/d0b9ffe85a34c3f45ef230d2d61a77cd/gr6.sml gr6 gr6.sml sml 14517 164 194 IMAGE-THUMBNAIL 1-s2.0-S2468823124003754-gr7.sml https://s3-eu-west-1.amazonaws.com/prod-ucs-content-store-eu-west/content/pii:S2468823124003754/gr7/THUMBNAIL/image/gif/bc9ff7a0e6311b1d66e8d3cc06849fd1/gr7.sml gr7 gr7.sml sml 8019 81 219 IMAGE-THUMBNAIL 1-s2.0-S2468823124003754-gr8.sml https://s3-eu-west-1.amazonaws.com/prod-ucs-content-store-eu-west/content/pii:S2468823124003754/gr8/THUMBNAIL/image/gif/651ef806a047aa5daa0695b701a690cf/gr8.sml gr8 gr8.sml sml 7835 80 219 IMAGE-THUMBNAIL 1-s2.0-S2468823124003754-gr1.sml https://s3-eu-west-1.amazonaws.com/prod-ucs-content-store-eu-west/content/pii:S2468823124003754/gr1/THUMBNAIL/image/gif/d0965c056ab3a10126a6d74a719d6bb5/gr1.sml gr1 gr1.sml sml 13645 164 159 IMAGE-THUMBNAIL 1-s2.0-S2468823124003754-gr2.sml https://s3-eu-west-1.amazonaws.com/prod-ucs-content-store-eu-west/content/pii:S2468823124003754/gr2/THUMBNAIL/image/gif/11754352c2ef2ceea8481a6f5ac3d0af/gr2.sml gr2 gr2.sml sml 14467 96 219 IMAGE-THUMBNAIL 1-s2.0-S2468823124003754-gr3.sml https://s3-eu-west-1.amazonaws.com/prod-ucs-content-store-eu-west/content/pii:S2468823124003754/gr3/THUMBNAIL/image/gif/37bcf841088a49f628537ac663a733cf/gr3.sml gr3 gr3.sml sml 9771 79 219 IMAGE-THUMBNAIL 1-s2.0-S2468823124003754-gr10.sml https://s3-eu-west-1.amazonaws.com/prod-ucs-content-store-eu-west/content/pii:S2468823124003754/gr10/THUMBNAIL/image/gif/16cee6114410a786253da5d12e65f6bc/gr10.sml gr10 gr10.sml sml 9532 164 215 IMAGE-THUMBNAIL 1-s2.0-S2468823124003754-gr4.sml https://s3-eu-west-1.amazonaws.com/prod-ucs-content-store-eu-west/content/pii:S2468823124003754/gr4/THUMBNAIL/image/gif/8ec520b8de733b03a325909ad4acefd4/gr4.sml gr4 gr4.sml sml 15421 115 219 IMAGE-THUMBNAIL 1-s2.0-S2468823124003754-gr11.sml https://s3-eu-west-1.amazonaws.com/prod-ucs-content-store-eu-west/content/pii:S2468823124003754/gr11/THUMBNAIL/image/gif/7acef7b65b00f9d4ee6b971d1ad58e58/gr11.sml gr11 gr11.sml sml 11187 86 219 IMAGE-THUMBNAIL 1-s2.0-S2468823124003754-ga1.sml https://s3-eu-west-1.amazonaws.com/prod-ucs-content-store-eu-west/content/pii:S2468823124003754/ga1/THUMBNAIL/image/gif/e22e670b8b7ba2f0b53b4428a50ac90a/ga1.sml ga1 true ga1.sml sml 16319 109 219 IMAGE-THUMBNAIL 1-s2.0-S2468823124003754-gr9_lrg.jpg https://s3-eu-west-1.amazonaws.com/prod-ucs-content-store-eu-west/content/pii:S2468823124003754/HIGHRES/image/jpeg/4d1ee4f7c1eb35fee1e3cc245789c0a3/gr9_lrg.jpg gr9 gr9_lrg.jpg jpg 511427 1982 2555 IMAGE-HIGH-RES 1-s2.0-S2468823124003754-gr5_lrg.jpg https://s3-eu-west-1.amazonaws.com/prod-ucs-content-store-eu-west/content/pii:S2468823124003754/HIGHRES/image/jpeg/e8bc5573bb7ebbd06642df12caa53baa/gr5_lrg.jpg gr5 gr5_lrg.jpg jpg 893657 2402 2903 IMAGE-HIGH-RES 1-s2.0-S2468823124003754-gr6_lrg.jpg https://s3-eu-west-1.amazonaws.com/prod-ucs-content-store-eu-west/content/pii:S2468823124003754/HIGHRES/image/jpeg/4f1760cb0f44360546410ededc344c31/gr6_lrg.jpg gr6 gr6_lrg.jpg jpg 887945 2504 2970 IMAGE-HIGH-RES 1-s2.0-S2468823124003754-gr7_lrg.jpg https://s3-eu-west-1.amazonaws.com/prod-ucs-content-store-eu-west/content/pii:S2468823124003754/HIGHRES/image/jpeg/867ad47583d7135bf78acd490049bcc5/gr7_lrg.jpg gr7 gr7_lrg.jpg jpg 374628 1198 3240 IMAGE-HIGH-RES 1-s2.0-S2468823124003754-gr8_lrg.jpg https://s3-eu-west-1.amazonaws.com/prod-ucs-content-store-eu-west/content/pii:S2468823124003754/HIGHRES/image/jpeg/317bf81de4001411473f91cd66e2dbbe/gr8_lrg.jpg gr8 gr8_lrg.jpg jpg 357689 1185 3232 IMAGE-HIGH-RES 1-s2.0-S2468823124003754-gr1_lrg.jpg https://s3-eu-west-1.amazonaws.com/prod-ucs-content-store-eu-west/content/pii:S2468823124003754/HIGHRES/image/jpeg/e029a07f0a5b8fc9a9d57828bf73f709/gr1_lrg.jpg gr1 gr1_lrg.jpg jpg 1251310 2964 2878 IMAGE-HIGH-RES 1-s2.0-S2468823124003754-gr2_lrg.jpg https://s3-eu-west-1.amazonaws.com/prod-ucs-content-store-eu-west/content/pii:S2468823124003754/HIGHRES/image/jpeg/749143b175797c731ddc83531bdfba76/gr2_lrg.jpg gr2 gr2_lrg.jpg jpg 796450 1376 3146 IMAGE-HIGH-RES 1-s2.0-S2468823124003754-gr3_lrg.jpg https://s3-eu-west-1.amazonaws.com/prod-ucs-content-store-eu-west/content/pii:S2468823124003754/HIGHRES/image/jpeg/1afe6ea19fbdb611040ea444c8a0ccd9/gr3_lrg.jpg gr3 gr3_lrg.jpg jpg 531044 1201 3341 IMAGE-HIGH-RES 1-s2.0-S2468823124003754-gr10_lrg.jpg https://s3-eu-west-1.amazonaws.com/prod-ucs-content-store-eu-west/content/pii:S2468823124003754/HIGHRES/image/jpeg/ec2819bdec467de1feb581cc710f2659/gr10_lrg.jpg gr10 gr10_lrg.jpg jpg 179150 1356 1776 IMAGE-HIGH-RES 1-s2.0-S2468823124003754-gr4_lrg.jpg https://s3-eu-west-1.amazonaws.com/prod-ucs-content-store-eu-west/content/pii:S2468823124003754/HIGHRES/image/jpeg/f21c0344bb15a7d392f5fd75e4c07cf4/gr4_lrg.jpg gr4 gr4_lrg.jpg jpg 561536 1218 2317 IMAGE-HIGH-RES 1-s2.0-S2468823124003754-gr11_lrg.jpg https://s3-eu-west-1.amazonaws.com/prod-ucs-content-store-eu-west/content/pii:S2468823124003754/HIGHRES/image/jpeg/c8ca31e5d19fc36fef4c4a1ccf089c0a/gr11_lrg.jpg gr11 gr11_lrg.jpg jpg 604416 1254 3211 IMAGE-HIGH-RES 1-s2.0-S2468823124003754-ga1_lrg.jpg https://s3-eu-west-1.amazonaws.com/prod-ucs-content-store-eu-west/content/pii:S2468823124003754/HIGHRES/image/jpeg/1db0b085e95343ad1b8f44b79a68b5f3/ga1_lrg.jpg ga1 true ga1_lrg.jpg jpg 275600 886 1780 IMAGE-HIGH-RES 1-s2.0-S2468823124003754-mmc1.docx https://s3-eu-west-1.amazonaws.com/prod-ucs-content-store-eu-west/content/pii:S2468823124003754/mmc1/MAIN/application/vnd.openxmlformats-officedocument.wordprocessingml.document/281fc71df72c7cb42d9d06be5d0ffc6e/mmc1.docx mmc1 mmc1.docx docx 12589559 APPLICATION 1-s2.0-S2468823124003754-si1.svg https://s3-eu-west-1.amazonaws.com/prod-ucs-content-store-eu-west/content/pii:S2468823124003754/image/svg+xml/985e144d6b473793cdf76074a215a4c8/si1.svg si1 si1.svg svg 2541 ALTIMG 1-s2.0-S2468823124003754-si10.svg https://s3-eu-west-1.amazonaws.com/prod-ucs-content-store-eu-west/content/pii:S2468823124003754/image/svg+xml/1cfecb06dd230f7a8f33216686e655cf/si10.svg si10 si10.svg svg 1993 ALTIMG 1-s2.0-S2468823124003754-si11.svg https://s3-eu-west-1.amazonaws.com/prod-ucs-content-store-eu-west/content/pii:S2468823124003754/image/svg+xml/9b1daff9217caf7496166661cce4e27c/si11.svg si11 si11.svg svg 5140 ALTIMG 1-s2.0-S2468823124003754-si12.svg https://s3-eu-west-1.amazonaws.com/prod-ucs-content-store-eu-west/content/pii:S2468823124003754/image/svg+xml/5c2df12ac2aa9e5727aa7456e0523921/si12.svg si12 si12.svg svg 3475 ALTIMG 1-s2.0-S2468823124003754-si13.svg https://s3-eu-west-1.amazonaws.com/prod-ucs-content-store-eu-west/content/pii:S2468823124003754/image/svg+xml/63df8f74c1b2ac17f7eb943bde8aadac/si13.svg si13 si13.svg svg 2571 ALTIMG 1-s2.0-S2468823124003754-si14.svg https://s3-eu-west-1.amazonaws.com/prod-ucs-content-store-eu-west/content/pii:S2468823124003754/image/svg+xml/67569479eecc3853e214823fbdf4a430/si14.svg si14 si14.svg svg 2276 ALTIMG 1-s2.0-S2468823124003754-si15.svg https://s3-eu-west-1.amazonaws.com/prod-ucs-content-store-eu-west/content/pii:S2468823124003754/image/svg+xml/dbfb5b709f3ebc3dfb6a82f4d1be542e/si15.svg si15 si15.svg svg 2519 ALTIMG 1-s2.0-S2468823124003754-si16.svg https://s3-eu-west-1.amazonaws.com/prod-ucs-content-store-eu-west/content/pii:S2468823124003754/image/svg+xml/c7da9dae8156afb7d9491ecdbe3ca19b/si16.svg si16 si16.svg svg 3993 ALTIMG 1-s2.0-S2468823124003754-si2.svg https://s3-eu-west-1.amazonaws.com/prod-ucs-content-store-eu-west/content/pii:S2468823124003754/image/svg+xml/0dc775126654aaf8e3fbf6925344b72c/si2.svg si2 si2.svg svg 486 ALTIMG 1-s2.0-S2468823124003754-si3.svg https://s3-eu-west-1.amazonaws.com/prod-ucs-content-store-eu-west/content/pii:S2468823124003754/image/svg+xml/73e44dbb427429457a47ddc97ea2c0fe/si3.svg si3 si3.svg svg 465 ALTIMG 1-s2.0-S2468823124003754-si4.svg https://s3-eu-west-1.amazonaws.com/prod-ucs-content-store-eu-west/content/pii:S2468823124003754/image/svg+xml/a5e5544b0bf1744a3f088bc6d2bd05a2/si4.svg si4 si4.svg svg 551 ALTIMG 1-s2.0-S2468823124003754-si5.svg https://s3-eu-west-1.amazonaws.com/prod-ucs-content-store-eu-west/content/pii:S2468823124003754/image/svg+xml/0dacd048989a5fbfa35569fe6736dcd5/si5.svg si5 si5.svg svg 14110 ALTIMG 1-s2.0-S2468823124003754-si6.svg https://s3-eu-west-1.amazonaws.com/prod-ucs-content-store-eu-west/content/pii:S2468823124003754/image/svg+xml/bbfb127d87127c1808e4bd62c0a53c51/si6.svg si6 si6.svg svg 1800 ALTIMG 1-s2.0-S2468823124003754-si7.svg https://s3-eu-west-1.amazonaws.com/prod-ucs-content-store-eu-west/content/pii:S2468823124003754/image/svg+xml/16a01bbba7d9415872cbb27881de82b9/si7.svg si7 si7.svg svg 834 ALTIMG 1-s2.0-S2468823124003754-si8.svg https://s3-eu-west-1.amazonaws.com/prod-ucs-content-store-eu-west/content/pii:S2468823124003754/image/svg+xml/8362f70b15ca9f5263ffaf40b149d556/si8.svg si8 si8.svg svg 4144 ALTIMG 1-s2.0-S2468823124003754-si9.svg https://s3-eu-west-1.amazonaws.com/prod-ucs-content-store-eu-west/content/pii:S2468823124003754/image/svg+xml/4066ed686940d1d928e5cab2d4575caa/si9.svg si9 si9.svg svg 9871 ALTIMG 1-s2.0-S2468823124003754-am.pdf https://s3-eu-west-1.amazonaws.com/prod-ucs-content-store-eu-west/content/egi:10LKJSMCS9T/MAIN/application/pdf/b9a2666395a775e0a7647b89ea2ccccd/am.pdf am am.pdf pdf false 1937188 AAM-PDF MCAT 114192 114192 S2468-8231(24)00375-4 10.1016/j.mcat.2024.114192 Elsevier B.V. Fig. 1 (a, b) The optimized structures of In3Ru_i and In3Ru_r. The red spheres represents the active Ru atoms and green sphere represents the uppermost In atoms (In4 and In9) removed from the In3Ru_r surface. The Bader charge of four top-layered Ru atoms are highlighted in yellow values. (c-d) AIMD plots of In3Ru_i and In3Ru_r surfaces. Fig 1 Fig. 2 (a, b) The relative locations of all chemisorbed atomic hydrogen along with their configuration number on In3Ru_i and In3Ru_r surfaces. Refer to Fig. S2–3 for more information about their optimized structures. Fig 2 Fig. 3 (a, b) Potential energy diagrams for H2 activation on In3Ru_i and In3Ru_r surfaces. Fig 3 Fig. 4 (a, b) Optimized structures of various chemisorbed CO2 modes on both In3Ru_i and In3Ru_r surfaces (physisorbed adsorption mode of CO2 is not shown here). Fig 4 Fig. 5 Potential energy diagram associated with the first elementary step of CO2 activation on In3Ru_i surface. Fig 5 Fig. 6 Potential energy diagram associated with the first elementary step of CO2 activation on In3Ru_r surface. Fig 6 Fig. 7 Potential energy diagram of CO2 hydrogenation to CH3OH and CO on In3Ru_i surface. The corresponding optimized structures of initial state (IS), transition state (TS) and final state (FS) are shown in Fig. S8. Fig 7 Fig. 8 Potential energy diagram of CO2 hydrogenation to CH3OH and CO on In3Ru_r surface. The corresponding optimized structures of initial state (IS), transition state (TS) and final state (FS) are shown in Fig. S9. Fig 8 Fig. 9 Microkinetic modeling results associated with: (a) log(TOF) values of CH3OH and CO on In3Ru_i surface; (b) log(TOF) values of CH3OH and CO on In3Ru_r surface. Fig 9 Fig. 10 Activation energy difference ( Δ E a ) for each elementary steps on In3Ru_i surface without and with H2O. Fig 10 Fig. 11 (a, b) Charge difference analysis (CDA) with respect to TS configuration of CH3O* protonation with or without H2O inclusion, where the isosurface value is set to 0.0013 e/Å3. Yellow and blue isosurfaces represent the charge accumulation and depletion regions, respectively. Fig 11 Research Paper First-principles study of CO2 hydrogenation to methanol on In-Ru alloys: Revealing the influence of surface In/Ru ratio on reaction mechanism and catalyst performance Jie Yu Writing – original draft Data curation a Yabing Zeng Writing – review & editing Data curation b Kai Tan Validation Funding acquisition c d ⁎ Wei Lin Writing – review & editing Supervision Funding acquisition Conceptualization b d ⁎ a College of Life Sciences, Fujian Agriculture and Forestry University, Fuzhou, Fujian 350002, China College of Life Sciences Fujian Agriculture and Forestry University Fuzhou Fujian 350002 China aCollege of Life Sciences, Fujian Agriculture and Forestry University, Fuzhou, Fujian 350002, China b College of Chemistry, Fuzhou University, Fuzhou, Fujian 350108, China College of Chemistry Fuzhou University Fuzhou Fujian 350108 China bCollege of Chemistry, Fuzhou University, Fuzhou, Fujian 350108, China c State Key Laboratory of Physical Chemistry of Solid Surfaces, College of Chemistry and Chemical Engineering, Xiamen University, Xiamen, Fujian 361005, China State Key Laboratory of Physical Chemistry of Solid Surfaces College of Chemistry and Chemical Engineering Xiamen University Xiamen Fujian 361005 China cState Key Laboratory of Physical Chemistry of Solid Surfaces, College of Chemistry and Chemical Engineering, Xiamen University, Xiamen, Fujian 361005, China d Fujian Provincial Key Laboratory of Theoretical and Computational Chemistry, Xiamen University, Xiamen, Fujian 361005, China Fujian Provincial Key Laboratory of Theoretical and Computational Chemistry Xiamen University Xiamen Fujian 361005 China dFujian Provincial Key Laboratory of Theoretical and Computational Chemistry, Xiamen University, Xiamen, Fujian 361005, China ⁎ Corresponding authors at: College of Chemistry, Fuzhou University, Fuzhou, Fujian 350108, China. College of Chemistry Fuzhou University Fuzhou Fujian 350108 China Designing high-performance catalyst is vital in the field of CO2 methanolization. In this study, two In3Ru surfaces (In3Ru_i and In3Ru_r) were employed as computational models and the density functional theory was applied to study the influence of surface In/Ru ratio on their surface morphologies, reaction mechanisms and catalysis performance for methanol synthesis. Surface characterization reveals that In3Ru_i is higher in surface In/Ru ratio than In3Ru_r, and such difference facilitates CO2 adsorption on In3Ru_r. Being different in surface In/Ru ratio, two surfaces exhibit distinct variations in the reaction mechanism of methanol formation. For In3Ru_i, the “Formate” pathway dominates the first CO2 activation step which leads to methanol production. On the other hand, In3Ru_r prefers the “reverse water-gas shift” pathway (RWGS) in the initial step of CO2 activation, but this mechanism is unable to generate CH3OH due to the kinetic limitation of CO* hydrogenation. Based on the microkinetic modeling, In3Ru_i is superior in both CO2 production rate and CH3OH selectivity than the other one, suggesting higher surface In/Ru ratio benefits methanol formation, which complies well with the experiment. Overall, our study offers a new perspective with respect to how surface morphology of the bimetallic catalyst influences the reaction mechanisms of CO2 hydrogenation. Graphical abstract Image, graphical abstract Keywords First-principles method Bimetallic catalyst CO2 hydrogenation to methanol Reaction mechanism Surface atomic ratio Data availability Data will be made available on request. 1 Introduction For decades, increasing industrial and human activities have severely exacerbated the “greenhouse effect” by pumping large amount of carbon dioxide (CO2) into the atmosphere. How to deal with the excess CO2 waste and alleviate its harmful resultant such as global warming and the increase of sea levels have become a global issue [1–4]. Among various approaches been put forward to deal with this issue, Carbon dioxide Capture and Utilization (CCU) is a very efficient and economic one due to several advantages: (1) directly reducing the CO2 emission; (2) using the renewable energy in water electrolysis to produce the hydrogen gas; (3) taking advantage of CO2 as a carbon feedstocks to manufacture the high-valued C1 product industrially (e.g., methane, methanol and CO) [5–10]. In particular, CO2 hydrogenation to methanol (CO2 + 3H2 = CH3OH + H2O) has attracted extensive attention because methanol is a vital industrial material and could be treated as the alternative of fossile fuel [11–15]. Similar as the nitrogen gas, CO2 is very stable in the atmosphere and thereby requires both the catalysts and relatively higher temperature to activate the molecule. To date, the industrial realization of this reaction is available by pumping into the feed gas (mainly CO2, H2 and CO) over a trinary catalyst Cu/ZnO/Al2O3 under the environment of 5–10 MPa and 493–573 K [16,17]. Compared with the high conversion rate of CO2, this strategy remains very low in methanol selectivity (< 32 %) due to the fact that high temperature boosts the CO formation from the reverse water-gas shift reaction (CO2 + H2 = CO + H2O) which is an endothermic process [18,19]. Hence, a suitable catalyst should be well designed to satisfy both the need for higher selectivity of methanol and conversion rate of CO2 at low temperature. Being encouraged by the first example, many researches in this area focus on taking advantage of the reducible metal-oxides (e.g. CeO2, ZrO2, ZnO and In2O3) and their derivatives as the catalyst because of their high activity towards the methanol formation [20–24]. Besides, bimetallic catalysts which comprises of different metal components have gradually received more attention and become another important class of catalyst in CO2 methonalization [25,26]. In comparison with both of its monometal counterparts, different components inside alloys could interact with each other and impose a synergy effect on catalysts. When this occurs, the structural and electronic configuration of the catalyst would be greatly altered, which in turns enhances the overall performance of the catalyst. In parallel with the Cu-Pd alloy which has been extensively researched experimentally and theoretically by Song et al. and other groups, [27–32] we have seen various good examples of In-based catalyst. For example, Snider et al., found that In2O3 could be partially reduced when it is alloyed with Pd and the synergy effect between In2O3 and PdIn significantly improve the selectivity of CH3OH relative to the mono-Pd catalysts [33] SiO2 supported In-Pd designed by Ye et al., was also found to reduce the activity towards H2 dissociative adsorption when compared with the Pd monometallic particles [34]. More recently, Li et al., designed a In-Rh catalyst which exhibits high selectivity and activity towards CO2 methanolization under the H2-difficient environment [35]. As can be seen from these examples that In addition significantly improves the catalytic performance of the alloys towards methanol formation. Apart from Pd and Rh, In addition could enhance the catalysis behavior of Ru nanoparticles as well. Experiment results suggest that incorporation of In into Ru nanoparticles generates the In-Ru bimetallic catalyst which exhibit high activity and selectivity towards methanol formation [36]. Furthermore, this catalyst displays little inclination towards methane formation which is generally reported to be the dominant product on the metallic or supported Ru surface [37–40]. The promotion effect of the catalyst has been attributed primarily to the formation of tetragonal-In3Ru (space group: P42/mnm) which displays different crystalline planes under different reducing temperature. Accordingly, surface characterization shows that In3Ru is dominated by the (212) facet when it is reduced under 450 K and such temperature leads to the optimal performance of the catalyst (both CO2 conversion rate and CH3OH selectivity). The same facet has been observed in tegragonal-In3Rh as well which turns out to exhibit high reactivity towards CO2 methanation [35]. Quite contrary to the (110) and (001) planes, the exposed-In and Ru atoms are more randomly distributed along the (212) facet and therefore makes it more difficult to study the synergy effect between In and Ru. By increasing or decreasing the number of the top-layered In atoms, the numbers of undercoordinated Ru atoms will change and this could cause the variations in electronic and structural properties of the In3Ru surface and ultimately lead to difference in reaction mechanism of CO2 hydrogenation. All of these issues have not been taken seriously in the experiment and should therefore be further discussed. On account of this, we employed density functional theory (DFT) to systematically study the surface of In3Ru(212) and analyze the impact with respect to the degree of Pd exposure on their surface morphology and catalytic performance towards methanol formation. 2 Computational methods 2.1 DFT calculation methods In this study, all the spin-polarized DFT calculations with periodic boundary was performed on Vienna ab initio simulation package (VASP)[41] which uses the projector augmented wave (PAW) to solve Kohn-Sham equations and describe the valence electrons and core interaction [42,43]. The exchange and correlation energies were described by the spin-polarized generalized gradient approximation (GGA) functional in conjunction with the Perdew−Burke−Ernzerhof functional (PBE) format [44]. Before structural optimization, we employed the convergence tests on both k-point and the energy cutoff. Based on the results, the Kohn-Sham orbital is expanded using plane waves with 400 eV energy cutoff and a (2 × 2 × 1) k-point grid using Monkhorst−Pack scheme were applied in this study [45]. Dispersion corrected vdW-D3 functional proposed by Grimme was used to describe the van der Waals effect [46]. All structures including the surface models and intermediates (INT) were optimized using the conjugated-gradient (CG) method and the climbing image nudged elastic band (CI-NEB) method was employed to locate the transition states (TS) [47]. The vibrational frequencies of the structure found by CI-NEB method were further evaluated to see if it has only one imaginary vibrational frequency along the reaction coordinate and whether the predicted TS connects the initial state (IS) and final state (FS). For all structures considered in this study, the local relaxation was allowed to stop before the forces on all atoms were less than 0.03 eV/Å. The Bader charge analysis was employed to analyze the electronic properties of the key intermediate and transition state in our study [48,49] 2.2 Surface models According to the experiment results, In3Ru is the major component of the In-Ru bimetallic catalyst under 450 K and 800 K, which remains over 86 % in CH3OH selectivity. In comparison with the one of 800 K, In3Ru being reduced under 450 K is approximately 2 times in CO2 conversion rate and the HR-TEM images reveal that it is dominated by (212) facet. As displayed in Fig. S1, the optimized lattice parameters of the tetragonal-In3Ru unit cell is a = 7.02 Å, b = 7.02 Å and c = 7.24 Å, which agrees well with the experiment and calculation results reported by Takagiwa et al. and PÖttgen et al. [50,51]. As displayed in Fig. 1 a, b, two different types of In3Ru (212) (denoted as In3Ru_i and In3Ru_r) were modeled from the bulk t-In3Ru using a 1 × 2 supercell with three atomic layers (96 atoms in total), and each layer contains 32 atoms including 8 Ru and 24 In. Moreover, In3Ru_i could transform into In3Ru_r through removing two uppermost In atoms (In4 and In9) from its surface while keeping the total number of atoms unchanged. The active Ru atoms (act_Ru) is defined as the top-layered Ru whose coordination number to the top-layered In is lower than 5 and such threshold was set to select the more undercoordinated Ru atoms from all exposed-Ru atoms. For geometry optimization of both surface models, the bottom layer of In3Ru slab was fixed at their original positions while the rest were allowed to fully relax and a 15 Å vacuum slab was applied to avoid the interaction between each adjacent slab. To evaluate the kinetic stability of both surface models, AIMD simulation was used in our calculations. In specific, NVT ensemble is employed where the temperature is set as 500 K. EDIFF is set as 1E-4, the simulation period and each time step are set as 5 ps and 1 fs, respectively. As displayed in Fig. 1c, d, both surface models remain constant without obvious distortion in configuration after a period of 5 ps. All structures were built and visualized from Materials Studio [52]. In addition, the free energies of the gaseous species were calculated as: G g ( T ) = E elec + E ZPE + ∫ C p d T − T S Where C p represents the heat capacity of gaseous species as a function of T , which is obtained from the NIST Website[53]. 2.3 Microkinetic modeling To evaluate the overall turnover frequencies (TOF) of CH3OH formation on both surfaces, the catalysis microkinetic analysis package CatMAP developed by Nørskov's group is employed to simulate its reaction kinetics underthe pressure and temperature of 1–10 MPa and 400–1000 K, respectively [54]. For both In3Ru_i and In3Ru_r, two different adsorption sites were considered for hydrogen, including t_site for the ones binding to the exposed-Ru atom and v_site for the others binding to the exposed-In atoms. Otherwise, the adsorption sites which are occupied by the remaining adsorbates are all assigned to s_site. In this manner, hydrogen could be treated as an independent species adsorbing at a special “hydrogen reservoir” site which prevents it from competing for the free site with the other species. The maximum surface coverage for each site is summed to 1 ML to ignore multilayer adsorption and the initial concentration ratio of CO2, H2, CH3OH, H2O and CO in the gas-phase was set as 0.249: 0.749: 0.001: 0.001: 0.0001. Furthermore, the degree of rate control (DRC) method popularized by Campbell's group was performed to determine the rate-limiting step during CO2 hydrogenation to methanol [55]. In specific, the degree of rate control X R C , i for each elementary step is defined as: X R C , i = k i r ( ∂ r ∂ k i ) k j ≠ i , k i where X R C , i , k i and r are the DRC matrix, equilibrium constant and reaction rate for each step, respectively. The sum of all X R C , i coefficients have to obey the following rule: ∑ i X R C , i = 1 DRC value being positive corresponds to the rate-controlling transition state, being negative corresponds to the rate-controlling intermediate and represents neither of both if its value is close to zero. 3 Results and discussion 3.1 Morphological and electronic properties of both surfaces As displayed in Fig. 1a, b, there are four different types of exposed-Ru atoms observed on the top layer of both In3Ru_i and In3Ru_r, wherein Ru1 and Ru3 are solely coordinated to In atoms. The coordination behaviors of Ru2 and Ru4 are quite different from the other two types because these two atoms could not only establish the linkage to each other but also maintain the rest connections to In atoms. For In3Ru_i, the coordination numbers of both Ru1 and Ru3 to top-layered In are 4 and 3, respectively, which are lower than the other two exposed-Ru atoms from the top layer (5 for both Ru2 and Ru4). Hence, both Ru1 and Ru3 are the ones that fit our criteria for act_Ru. For In3Ru_r surface, Ru1 and Ru4 exhibit the same binding behavior as the ones observed in In3Ru_i, so their coordination number to In atoms remains unchanged. However, when In3Ru_r is generated by removing In4 from In3Ru_i, the respective coordination number of Ru2 reduces to 4 and thereby turning itself into the act_Ru. Even though Ru3 loses Ru3-In9 bonding after In9 removal, this drives it to get closer to In11 and establish the Ru3-In11 linkage. Hence, the coordination of Ru3 remains almost unchanged. In comparison with In3Ru_i, one more act_Ru (Ru2) is found on the top layer of In3Ru_r, which therefore becomes lower in surface In/Ru ratio. In addition to structural variation, we also comparatively studied the electronic differences between two surfaces by investigating the Bader charge on four top-layered Ru atoms. As displayed in Fig. 1, the charge of Ru1 and Ru4 remains constant for both surfaces, which is consistent with their identical coordination number to top-layered In. On the contrary, the charge of Ru2 and Ru3 decreases by 0.13 and 0.12, respectively, as a result of In4 and In9 removal. We speculated that such change will cause a dramatic difference on the adsorption behavior of the reactants and reaction mechanism of CO2 hydrogenation, both of which will be discussed in detail in the following section. 3.2 Adsorption and dissociation behavior of H2 on both surfaces Before delving into the reaction mechanisms of methanol formation on both surfaces, we should initiate by studying the way how both reactants interact with the surface. Having this idea in mind, the adsorption and dissociation behavior of H2 was examined firstly since the process of CO2 hydrogenation will be heavily influenced by surface coverage of the atomic hydrogen. As mentioned above, the atomic arrangement from the top layers of both In3Ru_i and In3Ru_r is very disordered and this increases the difficulties of finding the best activation sites for H2. Hence, we began by manually placing the atomic hydrogen on all possible positions including the top, bridged and hollow sites, and these configurations of the initial guess were allowed to locally relax before the force criterion was met. Fig. 2 a, b displays the relative positions of all individually adsorbed H* along with the number of their corresponding configurations on both surfaces after structural optimization. It is noticed that a total number of 8 and 7 configurations were located on In3Ru_i and In3Ru_r, respectively. In3Ru_r has one fewer structure due to the fact that H* could hardly be stabilized between In1 and In2, which causes the configuration No. 1 to be very unstable and quickly transforms into configuration No.2. For In3Ru_i surface, the adsorption sites for atomic hydrogen could generally fall into two categories: either the one bridging between two In atoms (No. of configurations: 1, 2, 7, 8) or the other one on the top of Ru atoms (No. of configurations: 3, 4, 5, 6). When H* is stabilized by two In atoms, the adsorption energy is between 0.36–0.47 eV, which is much higher than binding H* in the other manners whose adsorption energies vary from −0.57 to −0.46 eV. For most adsorption configurations of H*, the difference of binding strength between two surfaces are quite small, so a similar trend is observed for In3Ru_r surface which is found to be much more inclined to accommodate the hydrogen atom on the exposed-Ru atoms (including act_Ru). However, it is noticed that H* adsorbed on In3Ru_r is much stronger in binding strength for configuration No. 2 and 7, both of which are lower in adsorption energy by 0.52 and 0.24 eV, respectively. For these two configurations, the adsorbed H* binds to In1 and In12, and surface characterization of In3Ru_i suggests that both sites are neighboring to In4 and In9, respectively. As a result, In1 and In12 become more undercoordinated and active towards H*-adsorption when both In4 and In9 are removed from the surface transformation. In addition to In1, the absence of In4 also enhances the adsorption ability of Ru2 towards H* whose adsorption energy is lower by 0.17 eV relative to its counterpart on In3Ru_i. All the above discussions reveal that Ru atoms are very active towards interacting with H*, which is consistent with the previous theoretical results [56,57]. By comparison with the other two Ru atoms, Ru1 and Ru3 are determined to be the active sites for hydrogen gas on both surfaces since they are close to each and slightly more favorable in binding to H*. To continue, we kept on studying the way with respect to how H2 interacts with the active site on both surfaces. As displayed in Fig. 3 , the physisorbed structure i_H2_IS is the only stable adsorption configuration of H2 we found on In3Ru_i surface, and it could readily undergo bond cleavage with the assistance of the active site and generates two hydrogen atoms binding to both Ru1 and Ru3, respectively. The CI-NEB result shown in Fig. S4 suggest that the bond dissociation of the physisorbed H2 is a barrierless process since we observed a continuous decrease in energetics for all climbing images along the reaction coordinates. The facile H2 activation is also evidenced by the formation of a very stable i_H2_FS which lowers the reaction energy by 1.03 eV relative to its initial state. On the other hand, H2 could be stabilized by Ru1 without breaking apart on In3Ru_r surface and this configuration is exothermic by 0.97 eV in adsorption energy. Similar as the one we found on In3Ru_i, H2 is also very active towards further bond dissociation at the active site with the energetics of the TS nearly the same as that of IS. This process ends with a coadsorption configuration of two atomic hydrogen binding to both Ru1 and Ru3, respectively, with the reaction energy being as low as −0.04 eV. On the basis of these findings, it is found that the process of H2 activation is rather facile on both surfaces suggesting they could provide enough atomic H for CO2 hydrogenation. 3.3 Adsorption behavior of CO2 on both surfaces Subsequently, the adsorption behavior of various CO2 modes as well as their energetics were examined on both surfaces. Fig. 4 a, b displays the adsorbed CO2 configurations of the most stable ones and the ones which initiates the first elementary step of CO2 hydrogenation (including both “Formate” and “RWGS” pathways), and their corresponding structural parameters (related to CO1, CO2 and angles of O1-C-O2) are summarized in Table S1. For In3Ru_i surface, the most energetically favorable CO2 structure is i_CO2_1 which is a chemisorbed mode and has an adsorption energy of −0.30 eV. It exhibits a tridentated configuration with the calculated O1-C-O2 angle of 122.2° by coordinating O1, C and O2 to Ru1, Ru3 and In10, respectively. By comparing the bond distance, we found that CO1 is more elongated than CO2 by 0.04 Å, whereas O1-Ru1 is shorter than O2-In by 0.40 Å. It is therefore evidenced that the oxygen atom from CO2 prefers to bind to Ru atom and O-Ru interaction promotes the activation of CO bond. Quite contrary to that of the most stable one, physisorbed CO2 exhibits linear structure and both of its CO bonds experience little fluctuation relative to its gaseous phase. Even though being slightly lower binding strength, it is later found that this mode could serve as the starting configuration of the “Formate” pathway. To continue, we further examined the structural properties of i_CO2_3 that triggers the “RWGS” pathway during CO2 hydrogenation. Upon its adsorption, both of the oxygen atoms are coordinated to two exposed-In atoms (In4 and In8) while the remaining carbon atom are bonded by Ru2, and the distance of both CO1 and CO2 linkages are 1.30 and 1.28 Å, respectively. The calculated adsorption energy of this CO2 mode is −0.20 eV, which is slightly higher than that of i_CO2_1 even though they are similar in configuration. The inferior in binding strength for i_CO2_3 could be attributed to O2-In interaction being weaker than O2-Ru interaction in i_CO2_1. As for i_CO2_4 shown in Fig. S5, its adsorption process is endothermic in nature by requesting for an extra energy of 0.28 eV, so it is a very unstable configuration and could hardly be found at low temperature. Unlike two aforementioned chemisorbed configurations being tridentate, i_CO2_4 exhibits a bidentate structure and both of its O1 and C are coordinated to two exposed-In atoms which further hinders its stabilization. Next, we paid our attention to In3Ru_r surface which also has five different CO2 adsorption modes. First of all, we found that r_CO2_1 is both the most favorable structure and the starting CO2 configuration for the “RWGS” mechanism on In3Ru_r surface. Despite of sharing the similar structure as i_CO2_3, it is much more stable with an adsorption energy of −0.64 eV. As shown in Fig. S6, r_CO2_2 and r_CO2_3 are the second and third most stable CO2 configuration on In3Ru_r and their adsorption energies are −0.45 and −0.36 eV, respectively. For the former one, r_CO2_2 differs from the most stabilized CO2 in that In6 rather than In8 is the adsorption site for O2. In comparison with In6 which is involved in direct binding to In4, In8 is little affected by In4 removal and thereby shows lower reactivity towards O2 coordination. As for the other one, we found that both r_CO2_3 and i_CO2_1 are the corresponding CO2 configuration on both surfaces. When In3Ru_r is employed as our surface model, O2-coordinated In10 becomes more unsaturated in coordination number owing to the In9 removal, so we observed a more stable CO2 configuration in comparison with its counterpart on In3Ru_i. Unlike other CO2 modes we found, physisorbed CO2 mode is the starting configuration of the “Formate” pathway and its adsorption energy is lower than the ones have already been discussed. However, it is still stronger in binding strength than r_CO2_4 which is the most unfavorable CO2 configuration on In3Ru_r surface. 3.4 First elementary step of CO2 hydrogenation on both surfaces It is widely accepted that the first elementary step of CO2 hydrogenation plays a significant role in determination of the overall reaction route for CH3OH formation. Since the adsorption behavior of CO2 as well as the activation manner of H2 has been examined individually, in this part, we will further our research by investigating how both reactants interact with each other in the first step. Generally, two mechanisms are taken into account for the bimetallic catalyst system: (1) the “Formate” pathway wherein the formate species (HCOO*) is generated from CO2 hydrogenation and (2) the \"RWGS\" pathway in which CO2 is protonated to the carboxyl species (COOH*) [24,27–29]. Throughout our studies, the adsorbed H* is treated as the hydrogen source for hydrogenation or protonation related elementary steps since the bond dissociation of H2 is a facile process on both surfaces. As a start, we examined both mechanisms for In3Ru_i surface, the potential energy diagram of which are displayed in Fig. 5 . The “Formate” pathway initiates with the coexistent configuration of i_CO2_4 and H* on the top of Ru2. In the TS configuration, bending of the linear-shaped CO2 and elongation of the Ru2-H distance occur at the same time for CH interaction and this requires a kinetic energy of 0.55 eV. When CH distance is further shrunk to 1.11 Å, HCOO* is produced which bridges between In6 and In8 using both of its oxygen atoms and this process is almost thermoneutral energetically. On the other hand, the “RWGS” pathway initiates with configuration of both i_CO2_3 and H* at the bridge site between In2 and In4. To meet with the protonation process, a high kinetic barrier of 1.48 eV is needed which makes O2 of CO2 lose connection to In4 and reduces O2-H distance to 1.60 Å in the transition state. This pathway ends with the formation of trans-COOH* which stabilize the system by 0.67 eV relative to its initial state. In addition to i_CO2_3, it is also found that i_CO2_1 could be further protonated to COOH*. However, this pathway is very unlikely to happen under low temperature since the calculated kinetic barrier is as high as 1.81 eV (refer to Fig. S7 for more information). By comparison, the “Formate” pathway is more competitive than the “RWGS” pathway from the kinetic aspect, suggesting CH bond formation should precede OH bond formation at low temperature. Moreover, adsorption analysis of the individual species reveals that i_CO2_1 from IS of the “RWGS” pathway is higher in adsorption energy than H* from IS of the “Formate” pathway. Being lower in binding strength makes CO2 become less competitive thermodynamically in coordination to Ru3 in comparison with H*, and such situation could get worse when it comes to a H2-rich environment. Based on these findings, the “Formate pathway” is the dominant reaction mechanism on In3Ru_i surface. Next, both mechanisms are examined individually on the In3Ru_r surface with their potential energy diagram displayed in Fig. 6 . Similar as that of In3Ru_i, the “Formate” pathway also begins with the structure of physisorbed CO2 (r_CO2_4) which coadsorbs with H at Ru3. In the TS configuration, a 0.61 eV kinetic barrier should be overcome and the CH distance is reduced to 1.46 Å. This process generates a bi-HCOO as its resultant which is nearly thermoneutral as its initial state. In both cases, HCOO is produced from the interaction between a physisorbed CO2 and surface hydrogen atom, and this is so called the Eley-Rideal mechanism [58,59]. As a matter of fact, such mechanism has been already reported in the process of methanol formation via CO2 hydrogenation catalyzed by the bimetallic alloys or transition-metal oxide [28,60]. On the other hand, CO2 could also undergo the “RWGS” pathway which starts with the coadsorption configuration of r_CO2_1 and H* bridging between In1 and In5. In the TS configuration, O2-In5 linkage is broken so that O2 of CO2 could approach H* and reduces their distance to 1.48 Å. After overcoming a 0.47 eV kinetic barrier, the trans-COOH* is produced and this process is exothermic by 0.66 eV. As the activation energy of OH bond formation is lower than CH bond formation, it is found that In3Ru_i exhibits a reverse trend with respect to the kinetics of two mechanisms by comparison with In3Ru_r. In addition to this, the “RWGS” pathway is thermodynamically preferable by forming a more stable intermediate, and both of these factors reveal that it is the dominant reaction pathway on In3Ru_r surface. 3.5 The integrated reaction route towards methanol and CO formation through CO2 hydrogenation on both surfaces The previous section reveals that both surface models choose different reaction mechanisms as their preferred ones in the first elementary step (the “Formate pathway” for In3Ru_i and the “RWGS” pathway for In3Ru_r). However, determination of the most favorable reaction route towards methanol formation lies on every other elementary steps beside this one. Hence, we further examined the integrated reaction routes towards methanol formation through CO2 hydrogenation on both In3Ru_i and In3Ru_r. 3.5.1 The integrated reaction route towards methanol formation (through “Formate” pathway) on In3Ru_i surface We began by examining the reaction route controlled by the “Formate” pathway in the first step. As displayed in Fig. 7 , after HCOO* is produced through facile interaction between a physisorbed CO2 and H* (I1), it could be further hydrogenated by getting access to H* bridged between In9 and In10 (I2). The kinetic energy for this step is 0.98 eV and H2COO* formation comes along with elevation of energetics by 0.37 eV. Structural examination of the final state reveals that the H2COO* uses O1 to bind to both In8 and In10 while its O2 is solely coordinated to In6, displaying a structure different from the traditional bi-H2COO. For the next step, H2COO* could be further protonated and renders H2COOH* as its product by acceptance of the H* bridging between In2 and In4 (I3). The corresponding kinetic barrier and reaction energy are 0.62 and −0.40 eV, respectively, suggesting this step is feasible from both kinetic and thermodynamic aspect. The generated H2COOH* could experience a CO bond cleavage process and generates the [CH2O + OH]* as its FS configuration (I4), which raises energetics of the system by 0.41 eV. However, increasing in reaction energy does not influence the rate of this step as it is kinetically favorable with the required activation energy being only 0.60 eV. We then individually examined the reaction potential for both OH* (I5–1) and CH2O* (I5–2), and the hydrogenation product of which are H2O* and CH3O*, respectively. For the former one, the activation energy of H2O formation (OH* + H* =H2O*, I5–1) is 0.72 eV and this step is found to be endothermic by 0.26 eV. As for the other one, CH3O* formation encounters subtle difficulties in kinetics owing to the low activation energy of its TS configuration. This step is followed by methanol production (I6) with a 0.80 eV kinetic barrier and gasification of the product is endothermic by 0.58 eV. 3.5.2 The integrated reaction route towards CO formation (through “RWGS” pathway) on In3Ru_i surface The carboxyl species is also the potential product for the initial step of CO2 activation which could subsequently transform into both CO and methanol, and this mechanism is so called the “RWGS” mechanism. As displayed in Fig. 7, after COOH* is produced (I7), a CO bond dissociation occurs very fast by producing [CO + OH]* as its FS configuration (I8), and the reaction barrier and energy for this elementary step are 0.22 and −1.40 eV, respectively. The thermodynamic advantage of this step could be attributed to the fact that OH* displays direct linkage to In4, In5 as well as In9 and this tridentate configuration significantly increases its binding strength. For the next two elementary steps, OH* and CO* could be further hydrogenated and generate H2O* and CHO* (I9) as their respective resultant. Owing to its stability, OH* is unable to be directly hydrogenated but needs to migrate to the bridge site between In4 and In6 and then undergoes the process exactly the same as that of step I5–1 within the “Formate” pathway. On the other hand, the process of CO* hydrogenation is examined as well, but it is found that methanol formation is unavailable through this mechanism because both the reaction barrier and energy for this step are very high. As a result, the “RWGS” pathway only leads to formation of CO* which could desorb from the catalyst surface by additional 2.08 eV in energetics. 3.5.3 The integrated reaction route towards methanol formation (through “Formate” pathway) on In3Ru_r surface As displayed in Fig. 8 , the “Formate” pathway on In3Ru_r leads to facile formation of HCOO* which could be further hydrogenated to H2COO*(R2). With the distance between HCOO* and H* on the top of In10 become shorter in the TS configuration, this elementary step has to overcome a 0.65 eV activation energy before the formation of H2COO*. In the final state, both O1 and O2 from H2COO* exhibit bridging configuration between two surface atoms and such multiple-bonding structure significantly enhances the adsorption capacity of H2COO*. Hence, we noticed that step R2 is exothermic by 0.57 eV in energetics and this characteristic in reaction energy is very different from step I2 on In3Ru_i surface which is found to be intrinsically endothermic. However, intermediate being too strong in binding strength also limits the reaction rate of next elementary step (protonation of H2COO*, R3) which has a much higher kinetic barrier than its counterpart on In3Ru_i (I3). Subsequently, H2COOH could undergoes the process of CO bond dissociation and this could be achieved in two manners depending on whether the assistance of H* is needed. Energetically, cleavage of the CO bond directly without H* involvement is unlikely to proceed as it is featured by a very high activation energy and unstable [CH2O + OH]* coadsorbed species in the final state. By comparison, H-participation largely reduces the reaction energy by affording H2O* as the coexisting species beside CH2O*, so it is determined to be the more favorable mechanism (R4). When H is involved in step R4, CO bond cleavage and OH formation happens simultaneously in the TS configuration and elevates its activation energy to 1.23 eV. For the last two elementary steps before methanol formation, the kinetic energy required from CH2O* hydrogenation (R5) and CH3O* protonation (R6) are 0.81 and 0.93 eV, respectively. 3.5.4 The integrated reaction route towards CO formation (through “RWGS” pathway) on In3Ru_i surface As displayed in Fig. 8, being promoted by both the low activation barrier and reaction energy, COOH* could undergoes CO bond dissociation (R8) after CO2 protonation (R7). This elementary step generates the stable coexisting species OH* and CO*, both of which will be examined with respect to their activation potential. In terms of the former one, OH* hydrogenation is a retarded process as evidenced by the activation energy being as high as 1.44 eV. As for the other one, CO* is generally regarded as the key intermediate during the process of methanol formation when CO2 activation is dominated by the “RWGS” pathway and the process with respect to CO* hydrogenation could help us evaluate the feasibility of this mechanism. Similar as that of step I9, CO* is very stable and its hydrogenation on In3Ru_r is kinetically hindered as well owing to the high activation energy needed for the interaction between CO* and H* in the TS configuration. Due to the stability of CO*, formation of carbon monoxide is also difficult and both findings suggest that methanol formation is not viable via the “RWGS” mechanism. 3.5.5 Microkinetic modeling Based on our DFT calculations, it is found that methanol formation on both surfaces is lead by the “Formate” rather than the “RWGS” pathway, which generates only CO as its product. For both In3Ru_i and In3Ru_r, the effective barriers of the whole reaction route during CH3OH synthesis are 1.47 and 1.67 eV, respectively, so it appears that In3Ru_i is better in catalyzing the methanol formation than In3Ru_r on the basis of the potential energy diagram. To further support this point of view, microkinetic modeling analysis was employed to calculate the logarithm values of turnover frequency (log(TOF)) for both methanol and CO, and their corresponding elementary steps on both surfaces are summarized in Tables S2 and S3, respectively. As displayed in Fig. 9 a-b, on In3Ru_i surface, the log(TOF) value of both CH3OH and CO increases with the temperature indicating that temperature increment promotes the production for both products. In specific, we noticed that CH3OH is more advantageous in product selectivity than CO on In3Ru_i since its log(TOF) values remains higher than that of the other within our investigated temperature range. Owing to the endothermic nature of the “RWGS” reaction, the product preference for CH3OH reaches its maximum at temperature as low as 400 K and gradually becomes weaker when temperature rises. This finding suggests that methanol and carbon monoxide are the major products on In3Ru_i at lower and higher temperature range, respectively. As displayed in Fig. 9c-d, In3Ru_r generally follows a similar trend as that of In3Ru_i when it comes to log(TOF) change of the two product with the temperature. However, CH3OH is not the preferable product for In3Ru_r because its log(TOF) value remains lower than that of CO even at low temperature. Hence, CO is determined to be the dominant product on In3Ru_r, which thereby reduces its selectivity towards methanol. Moreover, both surface models were compared with each in terms of their catalysis performance towards methanol production rate at lower temperature. When T < 600 K, the log(TOF) value of CH3OH remains higher for In3Ru_i over In3Ru_r, suggesting higher methanol production rate could be guaranteed by taking In3Ru_i as the catalyst. Furthermore, the degree of rate control analysis (DRC) suggested by Campell group was employed to evaluate the step that limits the reaction rate for both products which are displayed in Fig. S10. On In3Ru_i surface, HCOO* hydrogenation (I2) and the CO2* protonation (I7) are the corresponding rate-determining step for producing both CH3OH and CO. On the other hand, as displayed in Fig. S11, the reaction rate of methanol production on In3Ru_r is limited by HCOO* hydrogenation (R2) at low temperature, which is gradually replaced by the H-assisted bond dissociation of H2COOH* (R4) when the temperature begins to increase. Likewise, OH hydrogenation (R9–1) limits the reaction rate for CO production on In3Ru_r surface at low temperature, but it becomes replaced by CO2 protonation as the temperature rises. 4 Discussions 4.1 The influence of water on the catalyst performance of In3Ru_i for methanol formation Our results in Section 3 suggest that In3Ru_i is better in performing the catalysis of methanol formation from CO2 hydrogenation owing to relatively higher production rate and selectivity of the target product than In3Ru_r. However, it should be noted that the calculated log(TOF) value of CH3OH is still not high enough at low temperature (−17.7 at 533 K), which seems to contradict with the high CH3OH production rate of In-Ru alloys observed in the experiment [26]. Therefore, we speculated that other factors should be taken into account to further examine the whole reaction route during the methanol formation. For all types of reaction involved with CO2 hydrogenation, it is generally accepted that water is the major side product and its presence in the system could affect the adsorption behavior of key intermediates and activation energy of transition state, both of which could further influence the rate and even catalysis mechanism of the reaction. For example, the presence of water on the defective In2O3 could coexist with the carboxyl species and thereby hinders the hydrogenation of CO* generated from the “RWGS”mechanism [61]. Likewise, Song et al., discovered that water could not only alter rate-determining step of the reaction, but also increase reaction rate of CH3OH production [27,28]. Besides, in his study, a water molecule is explicitly introduced in the reaction system for each elementary step and water could interact with other intermediates in two ways: (1) the “H-shuttled” mechanism in which H2O serves as a “shuttle” and transfer the H* to the adsorbate, This mechanism generally applies to the process of both CO bond cleavage and OH bond formation during methanol formation; (2) the “H2O-solvated” mechanism wherein H2O does not directly participate in the reaction the intermediate and only serves as a “spectator”. This mechanism works well with the elementary steps involving CH bond formation. Inspired by Song's study, we also evaluated the extent of “hydration effect” on each elementary step in the process of CO2 hydrogenation. To be more specific, the activation energy difference ( Δ E a ) of the corresponding elementary steps with and without water are expressed as follow: Δ E a = E a ′ − E a wherein E a ′ and E a denote the activation of the step without and with H2O, respectively. As displayed in Fig. 10 , except for W4 and W8, the Δ E a values for most elementary steps of CO2 hydrogenation are positive suggesting both methanol and CO production are benefited from H2O inclusion. In addition, the “hydration effect” experiences large fluctuation in dimension among different elementary steps and it is noticed that such variation depends strongly on the reaction mechanism of the steps. For elementary steps involved with OH formation, H2O inclusion in the system reduces the kinetic barrier by more than 0.23 eV and these steps include W3, W5–1, W6, and W7. On the other hand, elementary steps except for the aforementioned ones are classified as either CH formation or CO bond cleavage. We noticed that these steps are less affected by introducing H2O in the system because their corresponding activation energy decreases by less than 0.15 eV or even increases for W4 and W8. These findings comply well with Song's research showing that steps associated with OH interaction are kinetically beneficial from the “hydration effect” in comparison with that of CH and CO interaction. To unveil the reason behind the promotion effect of H2O on OH bond formation, we further examined the electronic properties of both TS configurations for CH3O* protonation with and without H2O. In order to elucidate the direction of charge transfer within both structures, the adsorbed species were further divided into two moieties in which H3Oδ or Hδ is the first part (denoted as part I) while the remaining fragments (CH3Oδ) are all included in the second part (denoted as part II). As displayed in Fig. 11 , for both TS configurations, charge is observed to transfer from part I to part II, so they become either more electron deficient or more electron rich, respectively. For the H2O-absent system, the charges for both Hδ and CH3Oδ are +0.05 and −0.54, respectively, suggesting that H* is ineffective in donating the electron to part II. By comparison, H3Oδ is more positively charged (+0.22) while CH3Oδ is more negatively charged (−0.64) in the H2O-included system and this contributes to the electronic interaction between two parts which could stabilize the transition state. The enhanced electronic interaction inside TS configuration is further revealed by the charge difference analysis revealing that two areas are mainly accumulated with excess of charge when H3Oδ loses electron: (1) between H2O and adsorbed H* in the H3Oδ moiety; (2) between H3Oδ and CH3Oδ. To evaluate the “hydration effect” on the catalyst performance, we further calculated the production rate and selectivity of target product on In3Ru_i with H2O inclusion and compared them to the one without H2O. As displayed in Fig. S12, the TOF value of CH3OH in the presence of water is 1.01 × 10 − 17 at 533 K, which is 4.76 times higher than the one without H2O. Moreover, at the same temperature, the TOF value of CO quickly decreases to 1.81 × 10 − 24 and become much lower than that of CH3OH when H2O is not included in the system. On the basis of this finding, it is concluded that the catalyst performance of In3Ru_i could be greatly enhanced by introducing water in the reaction system. 4.2 The influence with respect to the ratio of surface In/Ru on catalyst performance of In3Ru_i for methanol formation According to the experiment results, the reduction temperature has a huge effect on the performance of In3Ru catalyst. It is observed that In3Ru being reduced under 450 K has a much higher CH3OH production rate than the one being reduced under 300 K. When the reduction temperature rises from 300 to 450 K, more In atoms become incorporated into the In-Ru alloys and this morphological change gradually increases surface In/Ru ratio of In3Ru catalyst. For both surface models employed in our study, removing both top-layered In atoms from In3Ru_i generates In3Ru_r which therefore has a lower ratio of surface In/Ru than In3Ru_i and this could bring about several changes in its catalyst performance towards methanol formation. As mentioned earlier, active Ru atom binds strongly to the oxygen atom and thereby increases the binding strength of chemisorbed CO2, which is the starting configuration of the “RWGS” mechanism. Hence, protonation becomes more favorable on In3Ru_r and precedes an hydrogenation in the first activation step of CO2, which leads to the facile formation of CO*. Compared with that of In3Ru_i, CO* on In3Ru_r is calculated to be more stabilized by 0.47 eV in energetics (see Table S4 for more information) and it is observed to be linear-shaped by adsorbing firmly at the active Ru atom which coincide with the DRIFTS study for In3Ru catalyst reduced under 300 K. However, the “RWGS” pathway could hardly lead to formation of the final product since CO* is too stable to undergo further activation, so it is concluded that methanol formation on In3Ru_r is dominated by the “Formate” pathway as well. Our findings comply well with the experiment results suggesting that HCOO* is the key intermediate during the process of CO2 hydrogenation to methanol. Moreover, lower surface In/Ru ratio of In3Ru_r also causes the over-stability of H2COOH*, H2COO* and CH2O* resulting from the “Formate” pathway, and these three species are found to be more retarded in further activation in comparison with their counterparts on In3Ru_i. In terms of the first one, stronger interaction between O and active Ru atom stabilizes H2COOH whose CO bond could only be broken by the assistance of H*. As for the other two, the adsorption energy of H2COO* and CH2O* are further lower by 0.54 and 1.09 eV when employing In3Ru_r rather In3Ru_i as the catalyst, whereas this also increases the kinetic barrier of their protonation by 0.35 and 0.60 eV, respectively. All of these factors significantly lower the production rate and selectivity of CH3OH on In3Ru_r surface. 5 Conclusions In this study, we employed density functional theory (DFT) calculation, along with microkinetic modeling (MKM) to investigate the reaction mechanism and catalyst performance associated with methanol formation from CO2 hydrogenation on In3Ru(212) surface. Both In3Ru_i and In3Ru_r being different in the surface ratio of In/Ru were used as our surface models. Based on our calculations, the activation behavior of H2 is subtly influenced by surface morphology differences since it readily undergoes bond dissociation and guarantees high coverage of atomic hydrogen on both surfaces. On the contrary, adsorption modes of CO2 experience large variation in binding strength when different surface model is applied. In comparison with In3Ru_i, In3Ru_r is more favorable in binding to CO2 owing to the more abundant active Ru atoms on the surface that strengthen the Ru-O interaction. In addition, difference in the numbers of active Ru atom also influences the reaction mechanism of methanol formation on both surfaces. For In3Ru_i surface, CO2* is weaker in binding strength than H*, so the “Formate” pathway is the mechanism that dominates the initial step of CO2 hydrogenation as well as the overall reaction route towards CH3OH production. As for In3Ru_r surface, the reversed trend of binding strength is observed between two reactants, which thereby promotes the “RWGS” pathway in the first elementary step. However, this pathway could hardly lead to methanol formation because CO* is too retarded to be further hydrogenated. On the basis of MKM results, it is found that In3Ru_i is better than the other one in both production rate and selectivity of the target product, suggesting methanol formation is more favorable on In3Ru surface with higher In/Ru raio from the top layer, which is consistent with the experiment. Further analysis reveals that inferior catalyst performance of In3Ru_r towards methanol synthesis could be attributed to over-stability of some key intermediates adsorbed at the active Ru atom during the process of CO2 hydrogenation. Our calculation results offer a new perspective with respect to the influence of surface atom upon the reaction mechanism and catalyst performance of a catalyst. CRediT authorship contribution statement Jie Yu: Writing – original draft, Data curation. Yabing Zeng: Writing – review & editing, Data curation. Kai Tan: Validation, Funding acquisition. Wei Lin: Writing – review & editing, Supervision, Funding acquisition, Conceptualization. Declaration of competing interest The authors declare that they have no known competing financial interests or personal relationships that could have appeared to influence the work reported in this paper. Acknowledgment This work was financially supported by the National Natural Science Foundation of China (21973014). Supplementary materials Supplementary material associated with this article can be found, in the online version, at doi:10.1016/j.mcat.2024.114192. Appendix Supplementary materials Image, application 1 References [1] S. Alfonso M. Gesto B. Sadoul Temperature increase and its effects on fish stress physiology in the context of global warming J. Fish Biol. 98 2020 1496 1508 Alfonso, S.; Gesto, M.; Sadoul, B., Temperature increase and its effects on fish stress physiology in the context of global warming. J. Fish Biol. 2020, 98, 1496–1508. [2] S.T. Bai G.D. Smet Y. Liao R. Sun C. Zhou M. Beller B.U.W. Maes B.F. Sels Homogeneous and heterogeneous catalysts for hydrogenation of CO2 to methanol under mild conditions Chem. Soc. Rev. 50 2021 4259 4298 Bai, S.T.; Smet, G.D.; Liao, Y.; Sun, R.; Zhou, C.; Beller, M.; Maes, B.U.W.; Sels, B.F., Homogeneous and heterogeneous catalysts for hydrogenation of CO2 to methanol under mild conditions. Chem. Soc. Rev. 2021, 50, 4259–4298. [3] S.I. Zandalinas F.B. Fritschi R. Mittler Global warming, climate change, and environmental pollution: recipe for a multifactorial stress combination disaster Trends Plant Sci. 26 2021 588 599 Zandalinas, S.I.; Fritschi, F.B.; Mittler, R., Global warming, climate change, and environmental pollution: recipe for a multifactorial stress combination disaster. Trends Plant Sci. 2021, 26, 588–599. [4] C. Tebaldi R. Renasinghe M. Vousdoukas D.J. Rasmussen B. Vega-Westhoff E. Kirezci R.E. Kopp R. Sriver L. Mentaschi Extreme sea levels at different global warming levels Nat. Clim. Change 26 2021 588 599 Tebaldi, C.; Renasinghe, R.; Vousdoukas, M.; Rasmussen, D.J.; Vega-Westhoff, B.; Kirezci, E.; Kopp, R.E.; Sriver, R.; Mentaschi, L., Extreme sea levels at different global warming levels. Nat. Clim. Change 2021, 26, 588–599. [5] W.L. Gao S.Y. Liang R.J. Wang Q. Jiang Y. Zhang Q.W. Zheng B.Q. Xie C.Y. Toe X.C. Zhu J.Y. Wang Industrial carbon dioxide capture and utilization: state of the art and future challenges Chem. Soc. Rev. 49 2020 8584 8686 Gao, W.L.; Liang, S.Y.; Wang, R.J.; Jiang, Q.; Zhang, Y.; Zheng, Q.W.; Xie, B.Q.; Toe, C.Y.; Zhu, X.C.; Wang, J.Y.; et al. Industrial carbon dioxide capture and utilization: state of the art and future challenges. Chem. Soc. Rev. 2020, 49, 8584–8686. [6] J. Godin W. Liu S. Ren C.C. Xu Advances in recovery and utilization of carbon dioxide: a brief reivew J. Environ. Chem. Eng. 9 2021 105644 Godin, J.; Liu, W.; Ren, S.; Xu, C.C., Advances in recovery and utilization of carbon dioxide: a brief reivew. J. Environ. Chem. Eng. 2021, 9, 105644. [7] C. Kim C.J. Yoo H.S. Oh B.K. Min U. Lee Review of carbon dioxide utilization technologies and their potential for industrial application J. CO2 Util. 65 2022 102239 Kim, C.; Yoo, C.J., Oh, H.S.; Min, B.K.; Lee, U., Review of carbon dioxide utilization technologies and their potential for industrial application. J. CO2 Util. 2022, 65, 102239. [8] H.J. Ho A. Lizuka E. Shibata Carbon capture and utilization technology without carbon dioxide purification and pressurization: a review on its necessity and available technologies Ind. Eng. Chem. Res. 58 2019 8941 8954 Ho, H.J.; Lizuka, A.; Shibata, E., Carbon capture and utilization technology without carbon dioxide purification and pressurization: a review on its necessity and available technologies. Ind. Eng. Chem. Res. 2019, 58, 8941–8954. [9] A. Al-Mamoori A. Krishnamurthy A.A. Rownaghi F. Rezaei Carbon capture and utilization update Energy Technol. 5 2017 834 849 Al-Mamoori, A.; Krishnamurthy, A.; Rownaghi, A.A.; Rezaei, F., Carbon capture and utilization update. Energy Technol. 2017, 5, 834–849. [10] I. Ghiat T. Al-Ansari A review of carbon capture and utilisation as a CO2 abatement opportunity within the EWF nexus J. CO2 Util. 45 2021 101432 Ghiat, I.; Al-Ansari, T., A review of carbon capture and utilisation as a CO2 abatement opportunity within the EWF nexus. J. CO2 Util. 2021, 45, 101432. [11] J. Yu Y. Zeng W. Lin X. Lu Hydrogenation of CO2 to methanol over in-doped m-ZrO2: a DFT investigation into the oxygen vacancy size-dependent reaction mechanism Phys. Chem. Chem. Phys. 24 2022 23182 23194 Yu, J.; Zeng, Y.; Lin, W.; Lu, X., Hydrogenation of CO2 to methanol over in-doped m-ZrO2: a DFT investigation into the oxygen vacancy size-dependent reaction mechanism. Phys. Chem. Chem. Phys. 2022, 24, 23182–23194. [12] S. Verhelst J.WG. Turner L. Sileghem J. Vancoillie Methanol as a fuel for internal combustion engine Prog. Energy Combust. 70 2019 43 88 Verhelst, S.; Turner, J.WG.; Sileghem, L.; Vancoillie, J., Methanol as a fuel for internal combustion engine. Prog. Energy Combust. 2019, 70, 43–88. [13] Q. He Z. Li D. Li F. Ning Q. Wang W. Liu W. Zhang Y. Cui J. Zhang C. Liu Mg enhanced the performance of Cu/ZnO/ZrO2 for CO2 hydrogenation to methanol and the mechanism investigation Mol. Catal. 558 2024 114008 He, Q.; Li, Z.; Li, D.; Ning, F.; Wang, Q.; Liu, W.; Zhang, W.; Cui, Y.; Zhang, J.; Liu, C., Mg enhanced the performance of Cu/ZnO/ZrO2 for CO2 hydrogenation to methanol and the mechanism investigation. Mol. Catal. 2024, 558, 114008. [14] H. Liu W. Huang Z. Yu X. Wang Y. Jia M. Huang H. Yang R. Li Q. Wei High-performance CuMgAl catalysts derived from hydrotalcite for CO2 hydrogenation to methanol: effects of Cu-MgO interaction Mol. Catal. 558 2024 114002 Liu, H.; Huang, W.; Yu, Z.; Wang, X.; Jia, Y.; Huang, M.; Yang, H.; Li, R.; Wei, Q., High-performance CuMgAl catalysts derived from hydrotalcite for CO2 hydrogenation to methanol: effects of Cu-MgO interaction. Mol. Catal. 2024, 558, 114002. [15] K. Räuchle L. Plass H.J. Wernicke M. Bertau Methanol for renewable energy storage and utilization Angew. Chem. Int. Ed. 4 2016 193 200 Räuchle, K.; Plass, L.; Wernicke, H.J.; Bertau, M., Methanol for renewable energy storage and utilization. Angew. Chem. Int. Ed. 2016, 4, 193–200. [16] J. Graciani K. Mudiyanselage F. Xu A.E. Bader J. Evans S.D. Senanayake D.J. Stacchiola P. Liu J. Hrbek J.F. Sanz J.A. Rodriguez Highly active copper-ceria and copper-ceria-titania catalysts for methanol synthesis from CO2 Science 345 2014 546 550 Graciani, J.; Mudiyanselage, K.; Xu, F.; Bader, A.E.; Evans, J.; Senanayake, S.D.; Stacchiola, D.J.; Liu, P.; Hrbek, J.; Sanz, J.F.; Rodriguez, J.A., Highly active copper-ceria and copper-ceria-titania catalysts for methanol synthesis from CO2. Science 2014, 345, 546–550. [17] M. Behrens F. Studt I. Kasatkin S. Kühl M. Hävecher F. Abild-Pedersen S. Zander F. Girgsdies P. Kurr B. Kniep M. Tovar R.W. Fischer J.K. Norskov R. SchlÖgl The active site of methanol synthesis over Cu/ZnO/Al2O3 industrial catalysts Science 336 2012 893 897 Behrens, M.; Studt, F.; Kasatkin, I.; Kühl, S.; Hävecher, M.; Abild-Pedersen, F.; Zander, S.; Girgsdies, F.; Kurr, P.; Kniep, B.; Tovar, M.; Fischer, R.W.; Norskov, J.K.; SchlÖgl, R., The active site of methanol synthesis over Cu/ZnO/Al2O3 industrial catalysts. Science 2012, 336, 893–897. [18] H. Yang C. Zhang P. Gao H. Wang X. Li L. Zhong W. Wei Y. Sun A review of the catalytic hydrogenation of carbon dioxide into value-added hydrocarbons Catal. Sci. Technol. 7 2017 4580 4598 Yang, H.; Zhang, C.; Gao, P.; Wang, H.; Li, X.; Zhong, L.; Wei, W.; Sun, Y., A review of the catalytic hydrogenation of carbon dioxide into value-added hydrocarbons. Catal. Sci. Technol. 2017, 7, 4580–4598. [19] K. Li J.G. Chen CO2 hydrogenation to methanol over ZrO2-containing catalysts: insights into ZrO2 induced synergy ACS Catal. 9 2019 7840 7861 Li, K.; Chen, J.G., CO2 hydrogenation to methanol over ZrO2-containing catalysts: insights into ZrO2 induced synergy. ACS Catal. 2019, 9, 7840–7861. [20] T. Montini M. Melchionna, Monai P. Fornasiero Fundamentals and catalytic applications of CeO2-based materials Chem. Rev. 116 2016 5987 6041 Montini, T.; Melchionna, Monai, M.; Fornasiero, P., Fundamentals and catalytic applications of CeO2-based materials. Chem. Rev. 2016, 116, 5987–6041. [21] Y. Yan R.J. Wong Z. Ma F. Donat S. Xi S. Saqline Q. Fan Y. Du A. Borgna Q. He C.R. Muller W. Chen A.A. Lapkin W. Liu CO2 hydrogenation to methanol on tungsten-doped Cu/CeO2 catalysts Appl. Catal. B Environ. 306 2022 121098 Yan, Y.; Wong, R.J.; Ma, Z.; Donat, F.; Xi, S.; Saqline, S.; Fan, Q.; Du, Y.; Borgna, A.; He, Q.; Muller, C.R.; Chen, W.; Lapkin A.A.; Liu, W., CO2 hydrogenation to methanol on tungsten-doped Cu/CeO2 catalysts. Appl. Catal. B Environ. 2022, 306, 121098. [22] H. Bahruji M. Bowker G. Hutchings D. Nikolaos P. Wells E. Gibson W. Jones C. Brookes D. Morgan G. Laley Pd/ZnO catalysts for direct CO2 hydrogenation to methanol J. Catal. 343 2016 133 146 Bahruji, H.; Bowker, M.; Hutchings, G.; Nikolaos, D.; Wells, P.; Gibson, E.; Jones, W.; Brookes, C.; Morgan, D.; Laley, G., Pd/ZnO catalysts for direct CO2 hydrogenation to methanol. J. Catal. 2016, 343, 133–146. [23] H. Choi S. Oh S.B.T. Tran J.Y. Park Size-controlled model Ni catalysts on Ga2O3 for CO2 hydrogenation to methanol J. Catal. 376 2019 68 76 Choi, H.; Oh, S.; Tran, S.B.T.; Park, J.Y., Size-controlled model Ni catalysts on Ga2O3 for CO2 hydrogenation to methanol. J. Catal. 2019, 376, 68–76. [24] J. Wang G. Zhang J. Zhu X. Zhang F. Ding A. Zhang X. Guo C. Song CO2 hydrogenation to methanol over In2O3-based catalysts: from mechanism to catalyst development ACS Catal. 11 2021 1406 1423 Wang, J.; Zhang, G.; Zhu, J.; Zhang, X.; Ding, F.; Zhang, A.; Guo, X.; Song, C., CO2 hydrogenation to methanol over In2O3-based catalysts: from mechanism to catalyst development. ACS Catal. 2021, 11, 1406–1423. [25] M.M.J. Li S.C.E. Tsang Bimetallic catalysts for green methanol production via CO2 and renewable hydrogen: a mini-review and prospects Catal. Sci. Technol. 8 2018 3450 3464 Li, M.M.J.; Tsang, S.C.E., Bimetallic catalysts for green methanol production via CO2 and renewable hydrogen: a mini-review and prospects. Catal. Sci. Technol. 2018, 8, 3450–3464. [26] F. Geng Y. Bonita V. Jain M. Magiera N. Rai J.C. Hicks Bimetallic Ru-Mo phosphide catalysts for the hydrogenation of CO2 to methanol Ind. Eng. Chem. Res. 59 2020 6931 6943 Geng, F.; Bonita, Y.; Jain, V.; Magiera, M.; Rai, N.; Hicks, J.C., Bimetallic Ru-Mo phosphide catalysts for the hydrogenation of CO2 to methanol. Ind. Eng. Chem. Res. 2020, 59, 6931–6943. [27] X. Jiang N. Koizumi X. Guo C. Song Bimetallic Pd-Cu catalysts for selective CO2 hydrogenation to methanol Appl. Catal. B Environ. 170-171 2015 173 185 Jiang, X.; Koizumi, N.; Guo, X.; Song, C., Bimetallic Pd-Cu catalysts for selective CO2 hydrogenation to methanol. Appl. Catal. B Environ. 2015, 170-171, 173–185. [28] X. Nie X. Jiang H. Wang W. Luo M.J. Janik Y. Chen X. Guo C. Song Mechanistic understanding of alloy effect and water promotion for Pd-Cu bimetallic catalysts in CO2 hydrogenation to methanol ACS Catal. 8 2018 4873 4892 Nie, X.; Jiang, X.; Wang, H.; Luo, W.; Janik, M.J.; Chen, Y.; Guo, X.; Song, C., Mechanistic understanding of alloy effect and water promotion for Pd-Cu bimetallic catalysts in CO2 hydrogenation to methanol. ACS Catal. 2018, 8, 4873–4892. [29] X. Jiang X. Nie X. Wang H. Wang N. Koizumi Y. Chen X. Guo C. Song Origin of Pd-Cu bimetallic effect for synergetic promotion of methanol formation from CO2 hydrogenation J. Catal. 369 2019 21 32 Jiang, X.; Nie, X.; Wang, X.; Wang, H.; Koizumi, N.; Chen, Y.; Guo, X.; Song, C., Origin of Pd-Cu bimetallic effect for synergetic promotion of methanol formation from CO2 hydrogenation. J. Catal. 2019, 369, 21–32. [30] X. Jiang Y. Jiao C. Moran X. Nie Y. Gong X. Guo K.S. Walton C. Song CO2 hydrogenation to methanol on Pd-Cu bimetallic catalysts with lower metal loadings Catal. Commun. 118 2019 10 14 Jiang, X.; Jiao, Y.; Moran, C.; Nie, X.; Gong, Y.; Guo, X.; Walton, K.S.; Song, C., CO2 hydrogenation to methanol on Pd-Cu bimetallic catalysts with lower metal loadings. Catal. Commun. 2019, 118, 10–14. [31] L. Liu F. Fan Z. Jiang X. Gao J. Wei T. Fang Mechanistic study of Pd-Cu bimetallic catalysts for methanol synthesis from CO2 hydrogenation J. Phys. Chem. C 47 2017 26287 26299 Liu, L.; Fan, F.; Jiang, Z.; Gao, X.; Wei, J.; Fang, T., Mechanistic study of Pd-Cu bimetallic catalysts for methanol synthesis from CO2 hydrogenation. J. Phys. Chem. C 2017, 47, 26287–26299. [32] G. Yang Y. Kuwahara K. Mori C. Louis H. Yamashita Pd-Cu Alloy nanoparticles confined within mesoporous hollow carbon spheres for the hydrogenation of CO2 to formate J. Phys. Chem. C 125 2021 3961 3971 Yang, G.; Kuwahara, Y.; Mori, K.; Louis, C.; Yamashita, H., Pd-Cu Alloy nanoparticles confined within mesoporous hollow carbon spheres for the hydrogenation of CO2 to formate. J. Phys. Chem. C 2021, 125, 3961–3971. [33] J.L. Snider V. Streibel M.A. Hubert T.S. Choksi E. Valle D.C. Upham J. Schumann M.S. Duyar A. Gallo F. Abild-Pedersen T.F. Jaramillo Revealing the synergy between oxide and alloy phases on the performance of bimetallic In-Pd catalysts for CO2 hydrogenation to methanol ACS Catal. 9 2019 3399 3412 Snider, J.L.; Streibel, V.; Hubert, M.A.; Choksi, T.S.; Valle, E.; Upham, D.C.; Schumann, J.; Duyar, M.S.; Gallo, A.; Abild-Pedersen, F.; Jaramillo, T.F., Revealing the synergy between oxide and alloy phases on the performance of bimetallic In-Pd catalysts for CO2 hydrogenation to methanol. ACS Catal. 2019, 9, 3399–3412. [34] J. Ye Q. Ge C. Liu Effect of PdIn bimetallic particle formation on CO2 reduction over the Pd-In/SiO2 catalyst Chem. Eng. Sci. 135 2015 193 201 Ye, J.; Ge, Q.; Liu, C., Effect of PdIn bimetallic particle formation on CO2 reduction over the Pd-In/SiO2 catalyst. Chem. Eng. Sci. 2015, 135, 193–201. [35] M.M. Li H. Zou J. Zheng T.S. Wu T.S. Chan Y.L. Soo X.P. Wu X.Q. Gong T. Chen K. Roy G. Held S.C.E. Tsang Methanol synthesis at a wide range of H2/CO2 ratios over a Rh-In bimetallic catalyst Angew. Chem. Int. Ed. 59 2020 16039 16046 Li, M.M.; Zou, H.; Zheng, J.; Wu, T.S.; Chan, T.S.; Soo, Y.L.; Wu, X.P.; Gong, X.Q.; Chen, T.; Roy, K.; Held, G.; Tsang, S.C.E., Methanol synthesis at a wide range of H2/CO2 ratios over a Rh-In bimetallic catalyst. Angew. Chem. Int. Ed. 2020, 59, 16039–16046. [36] F. Geng X. Zhan J.C. Hicks Promoting methanol synthesis and inhibiting CO2 methanation with bimetallic In-Ru catalysts ACS Sustain. Chem. Eng. 9 2021 11891 11902 Geng, F.; Zhan, X.; Hicks, J.C., Promoting methanol synthesis and inhibiting CO2 methanation with bimetallic In-Ru catalysts. ACS Sustain. Chem. Eng. 2021, 9, 11891–11902. [37] O. Mohan S. Shambhawi R. Xu A.A. Lapkin Investigating CO2 methanation on Ni and Ru: DFT assisted microkinetic analysis ChemCatChem 13 2021 2420 2433 Mohan, O.; Shambhawi, S.; Xu, R.; Lapkin, A.A., Investigating CO2 methanation on Ni and Ru: DFT assisted microkinetic analysis. ChemCatChem 2021, 13, 2420–2433. [38] J. Yu Y. Zeng Q. Jin W. Lin X. Lu Hydrogenation of CO2 to methane over a Ru/RuTiO2 surface: a DFT investigation into the significant role of the RuO2 overlayer ACS Catal. 12 2022 14654 14666 Yu, J.; Zeng, Y.; Jin, Q.; Lin, W.; Lu, X., Hydrogenation of CO2 to methane over a Ru/RuTiO2 surface: a DFT investigation into the significant role of the RuO2 overlayer. ACS Catal. 2022, 12, 14654–14666. [39] L. Chen I.A.W. Filot E.J.M. Hensen Computational study of CO2 methanation on Ru/CeO2 model surfaces: on the impact of Ru doping in CeO2 ACS Catal. 13 2023 15230 15247 Chen, L.; Filot, I.A.W.; Hensen, E.J.M., Computational study of CO2 methanation on Ru/CeO2 model surfaces: on the impact of Ru doping in CeO2. ACS Catal. 2023, 13, 15230–15247. [40] J.A.H. Dreyer P. Li L. Zhang G.K. Beh R. Zhang P.H-L. Sit W.Y. Teoh Influence of the oxide support reducibility on the CO2 methanation over Ru-based catalysts Appl. Catal. B Environ. 15 2017 715 726 Dreyer, J.A.H.; Li, P.; Zhang, L.; Beh, G.K.; Zhang, R.; Sit, P.H-L.; Teoh, W.Y., Influence of the oxide support reducibility on the CO2 methanation over Ru-based catalysts. Appl. Catal. B Environ. 2017, 15, 715–726. [41] G. Kresse J. Furthmüller Efficient iterative schemes for Ab initio total-energy calculations using a plane-wave basis set Phys. Rev. Lett. 54 1996 11169 11186 Kresse, G.; Furthmüller, J., Efficient iterative schemes for Ab initio total-energy calculations using a plane-wave basis set. Phys. Rev. Lett. 1996, 54, 11169–11186. [42] G. Kresse D. Joubert From ultrasoft pseudopotentials to the projector augmented-wave method Phys. Rev. B Condens. Matter Mater. Phys. 59 1999 1758 Kresse, G.; Joubert, D., From ultrasoft pseudopotentials to the projector augmented-wave method. Phys. Rev. B Condens. Matter Mater. Phys. 1999, 59, 1758. [43] G. Kresse D. Joubert From ultrasoft pseudopotentials to the projector augmented-wave method Phys. Rev. B 59 1999 1758 1775 Kresse, G.; Joubert, D., From ultrasoft pseudopotentials to the projector augmented-wave method. Phys. Rev. B 1999, 59, 1758–1775. [44] J.P. Perdew K. Burke M. Ernzerhof Generalized gradient approximation made simple Phys. Rev. Lett. 77 1996 3865 3868 Perdew, J.P.; Burke, K.; Ernzerhof, M., Generalized gradient approximation made simple. Phys. Rev. Lett. 1996, 77, 3865–3868. [45] H.J. Monkhorst J.D. Pack Special points for brillouin-zone integrations Phys. Rev. B 13 1976 5188 5192 Monkhorst, H.J.; Pack, J.D. Special points for brillouin-zone integrations. Phys. Rev. B 1976, 13, 5188–5192. [46] K. Lee É.D. Murray L. Kong B.I. Lundqvist D.C. Langreth Higher-accuracy van der waals density functional Phys. Rev. B 82 2010 081101 Lee, K.; Murray, É.D.; Kong, L.; Lundqvist, B.I.; Langreth, D.C. Higher-accuracy van der waals density functional. Phys. Rev. B 2010, 82, 081101. [47] G. Henkelman B.P. Uberuaga H.A. Jonsson A climbing image nudged elastic BVand method for finding saddle points and minimum energy path J. Chem. Phys. 113 2000 9901-9004 Henkelman, G.; Uberuaga, B.P.; Jonsson H.A., A climbing image nudged elastic BVand method for finding saddle points and minimum energy path. J. Chem. Phys. 2000, 113, 9901-9004. [48] G. Henkelman A. Arnaldsson H.A. Jonsson Fast and robust algorithm for bader decomposition of charge density Comput. Mat. Sci. 36 2006 354 360 Henkelman, G.; Arnaldsson, A.; Jonsson, H.A., Fast and robust algorithm for bader decomposition of charge density. Comput. Mat. Sci. 2006, 36, 354–360. [49] E. Sanville S.D. Kenny R. Smith G. Henkelman Improved grid-based algorithm for bader charge allocation J. Comput. Chem. 28 2007 899 908 Sanville, E.; Kenny, S.D.; Smith, R.; Henkelman, G. Improved grid-based algorithm for bader charge allocation. J. Comput. Chem. 2007, 28, 899–908. [50] Y. Takagiwa K. Kitahara Y. Matsubayashi K. Kimura Thermoelectric properties of FeGa3-type narrow-bandgap intermetallic compounds Ru(Ga,In)3: experimental and calculational studies J. Appl. Phys. 111 2012 123707 Takagiwa, Y.; Kitahara, K.; Matsubayashi, Y.; Kimura, K., Thermoelectric properties of FeGa3-type narrow-bandgap intermetallic compounds Ru(Ga,In)3: experimental and calculational studies. J. Appl. Phys. 2012, 111, 123707. [51] R. PÖttgen Preperation, crystal structure and properties of RuIn3 J. Alloys Compd. 226 1995 59 64 PÖttgen, R., Preperation, crystal structure and properties of RuIn3. J. Alloys Compd. 1995, 226, 59–64. [52] M. Studio; Biovia Software Inc.: 5005 Wateridge Vista Drive 2018 San Diego USA, Release CA 92121 Studio; M. Biovia Software Inc.: 5005 Wateridge Vista Drive, San Diego, CA 92121 USA, Release 2018. [53] Afeefy, H.Y.; Liebman, J.F.; Stein, S.E. Neutral Thermochemical Data. In NIST Chemsitry WebBook; Linstorom, P. J., Mallard, W. G., Eds.; NIST Standard Reference Database Number 69; National Institute of Standards and Technology: Gaithersburg, MD, http://webbook.nist.giv, (retrieved November 13, 2023). [54] A.J. Medford C. Shi M.J. Hoffmann A.C. Lausche S.R. Fitzgibbon T. Bligaard J.K. Nørskov CatMAP: a software package for descriptor-based microkinetic mapping of catalytic trends Catal. Lett. 145 2015 794 807 Medford, A.J.; Shi, C.; Hoffmann, M.J.; Lausche, A.C.; Fitzgibbon, S.R.; Bligaard, T.; Nørskov, J.K., CatMAP: a software package for descriptor-based microkinetic mapping of catalytic trends. Catal. Lett. 2015, 145, 794–807. [55] C.T. Campbell The degree of rate control: a powerful toolfor catalysis research ACS Catal. 7 2017 2770 2779 Campbell, C.T., The degree of rate control: a powerful toolfor catalysis research. ACS Catal. 2017, 7, 2770–2779. [56] J. Li Y. Tan M. Zhang W. Gou S. Zhang Y. Ma J. Hu Y. Qu Boosting electrocatalytic activity of Ru for Acid hydrogen evolution through hydrogen spillover strategy ACS Energy Lett. 7 2022 1330 1337 Li, J.; Tan, Y.; Zhang, M.; Gou, W.; Zhang, S.; Ma, Y.; Hu, J.; Qu, Y., Boosting electrocatalytic activity of Ru for Acid hydrogen evolution through hydrogen spillover strategy. ACS Energy Lett. 2022, 7, 1330–1337. [57] L. Deng F. Hu M. Ma S.C. Huang Y. Xiong H.Y. Chen L. Li S. Peng Electronic modulation caused by interfacial Ni-O-M (M=Ru, Ir, Pd) bonding for accelerating hydrogen evolution kinetics Angew. Chem. Int. Ed. 60 2021 22276 22282 Deng, L.; Hu, F.; Ma, M.; Huang, S.C.; Xiong, Y.; Chen, H.Y.; Li, L.; Peng, S., Electronic modulation caused by interfacial Ni-O-M (M=Ru, Ir, Pd) bonding for accelerating hydrogen evolution kinetics. Angew. Chem. Int. Ed. 2021, 60, 22276–22282. [58] S. Hussain S.H. Talib S.R. Shahzad S. Muhammad S. Mohamed A. Qurashi H. Wang Z. Lu Heterogeneous Co1/P1Mo12O40 single-atom catalyst for CO oxidation via termolecular eley-rideal (TER) mechanism Mol. Catal 550 2023 113539 Hussain, S.; Talib, S.H.; Shahzad, S.R.; Muhammad, S.; Mohamed, S.; Qurashi, A.; Wang, H.; Lu, Z., Heterogeneous Co1/P1Mo12O40 single-atom catalyst for CO oxidation via termolecular eley-rideal (TER) mechanism. Mol. Catal. 2023, 550, 113539. [59] M.H. Butt S.H.M. Zaidi A. Khan K. Ayub M. Yar Cu-doped phosphorene as highly efficient single atom catalyst for CO oxidation: a DFT study Mol. Catal. 509 2021 111630 Butt, M.H.; Zaidi, S.H.M.; Khan, A.; Ayub, K.; Yar, M., Cu-doped phosphorene as highly efficient single atom catalyst for CO oxidation: a DFT study. Mol. Catal. 2021, 509, 111630. [60] B. Qin S. Li First principles investigation of dissociative adsorption of H2 during CO2 hydrogenation over cubic and hexagonal In2O3 catalysts Phys. Chem. Chem. Phys. 22 2020 3390 3399 Qin, B.; Li, S., First principles investigation of dissociative adsorption of H2 during CO2 hydrogenation over cubic and hexagonal In2O3 catalysts. Phys. Chem. Chem. Phys. 2020, 22, 3390–3399. [61] J. Ye C. Liu D. Mei Q. Ge Active oxygen vacancy site for methanol synthesis from CO2 hydrogenation on In2O3(110): a DFT study ACS Catal. 6 2013 1296 1306 Ye, J.; Liu, C.; Mei, D.; Ge, Q., Active oxygen vacancy site for methanol synthesis from CO2 hydrogenation on In2O3(110): a DFT study. ACS Catal. 2013, 6, 1296–1306.",
      "scopus-id": "85192223385",
      "coredata": {
        "eid": "1-s2.0-S2468823124003754",
        "dc:description": "Designing high-performance catalyst is vital in the field of CO2 methanolization. In this study, two In3Ru surfaces (In3Ru_i and In3Ru_r) were employed as computational models and the density functional theory was applied to study the influence of surface In/Ru ratio on their surface morphologies, reaction mechanisms and catalysis performance for methanol synthesis. Surface characterization reveals that In3Ru_i is higher in surface In/Ru ratio than In3Ru_r, and such difference facilitates CO2 adsorption on In3Ru_r. Being different in surface In/Ru ratio, two surfaces exhibit distinct variations in the reaction mechanism of methanol formation. For In3Ru_i, the “Formate” pathway dominates the first CO2 activation step which leads to methanol production. On the other hand, In3Ru_r prefers the “reverse water-gas shift” pathway (RWGS) in the initial step of CO2 activation, but this mechanism is unable to generate CH3OH due to the kinetic limitation of CO* hydrogenation. Based on the microkinetic modeling, In3Ru_i is superior in both CO2 production rate and CH3OH selectivity than the other one, suggesting higher surface In/Ru ratio benefits methanol formation, which complies well with the experiment. Overall, our study offers a new perspective with respect to how surface morphology of the bimetallic catalyst influences the reaction mechanisms of CO2 hydrogenation.",
        "openArchiveArticle": "false",
        "prism:coverDate": "2024-06-01",
        "openaccessUserLicense": null,
        "prism:aggregationType": "Journal",
        "prism:url": "https://api.elsevier.com/content/article/pii/S2468823124003754",
        "dc:creator": [
          {
            "@_fa": "true",
            "$": "Yu, Jie"
          },
          {
            "@_fa": "true",
            "$": "Zeng, Yabing"
          },
          {
            "@_fa": "true",
            "$": "Tan, Kai"
          },
          {
            "@_fa": "true",
            "$": "Lin, Wei"
          }
        ],
        "link": [
          {
            "@_fa": "true",
            "@rel": "self",
            "@href": "https://api.elsevier.com/content/article/pii/S2468823124003754"
          },
          {
            "@_fa": "true",
            "@rel": "scidir",
            "@href": "https://www.sciencedirect.com/science/article/pii/S2468823124003754"
          }
        ],
        "dc:format": "application/json",
        "openaccessType": null,
        "pii": "S2468-8231(24)00375-4",
        "prism:volume": "562",
        "articleNumber": "114192",
        "prism:publisher": "Elsevier B.V.",
        "dc:title": "First-principles study of CO2 hydrogenation to methanol on In-Ru alloys: Revealing the influence of surface In/Ru ratio on reaction mechanism and catalyst performance",
        "prism:copyright": "© 2024 Elsevier B.V. All rights reserved.",
        "openaccess": "0",
        "prism:issn": "24688231",
        "dcterms:subject": [
          {
            "@_fa": "true",
            "$": "First-principles method"
          },
          {
            "@_fa": "true",
            "$": "Bimetallic catalyst"
          },
          {
            "@_fa": "true",
            "$": "CO2 hydrogenation to methanol"
          },
          {
            "@_fa": "true",
            "$": "Reaction mechanism"
          },
          {
            "@_fa": "true",
            "$": "Surface atomic ratio"
          }
        ],
        "openaccessArticle": "false",
        "prism:publicationName": "Molecular Catalysis",
        "openaccessSponsorType": null,
        "prism:pageRange": "114192",
        "pubType": "fla",
        "prism:coverDisplayDate": "1 June 2024",
        "prism:doi": "10.1016/j.mcat.2024.114192",
        "prism:startingPage": "114192",
        "dc:identifier": "doi:10.1016/j.mcat.2024.114192",
        "openaccessSponsorName": null
      },
      "objects": {
        "object": [
          {
            "@category": "standard",
            "@height": "448",
            "@width": "577",
            "@_fa": "true",
            "$": "https://api.elsevier.com/content/object/eid/1-s2.0-S2468823124003754-gr9.jpg?httpAccept=%2A%2F%2A",
            "@multimediatype": "JPEG image file",
            "@type": "IMAGE-DOWNSAMPLED",
            "@size": "62558",
            "@ref": "gr9",
            "@mimetype": "image/jpeg"
          },
          {
            "@category": "standard",
            "@height": "543",
            "@width": "656",
            "@_fa": "true",
            "$": "https://api.elsevier.com/content/object/eid/1-s2.0-S2468823124003754-gr5.jpg?httpAccept=%2A%2F%2A",
            "@multimediatype": "JPEG image file",
            "@type": "IMAGE-DOWNSAMPLED",
            "@size": "106252",
            "@ref": "gr5",
            "@mimetype": "image/jpeg"
          },
          {
            "@category": "standard",
            "@height": "566",
            "@width": "671",
            "@_fa": "true",
            "$": "https://api.elsevier.com/content/object/eid/1-s2.0-S2468823124003754-gr6.jpg?httpAccept=%2A%2F%2A",
            "@multimediatype": "JPEG image file",
            "@type": "IMAGE-DOWNSAMPLED",
            "@size": "107689",
            "@ref": "gr6",
            "@mimetype": "image/jpeg"
          },
          {
            "@category": "standard",
            "@height": "271",
            "@width": "732",
            "@_fa": "true",
            "$": "https://api.elsevier.com/content/object/eid/1-s2.0-S2468823124003754-gr7.jpg?httpAccept=%2A%2F%2A",
            "@multimediatype": "JPEG image file",
            "@type": "IMAGE-DOWNSAMPLED",
            "@size": "52261",
            "@ref": "gr7",
            "@mimetype": "image/jpeg"
          },
          {
            "@category": "standard",
            "@height": "268",
            "@width": "730",
            "@_fa": "true",
            "$": "https://api.elsevier.com/content/object/eid/1-s2.0-S2468823124003754-gr8.jpg?httpAccept=%2A%2F%2A",
            "@multimediatype": "JPEG image file",
            "@type": "IMAGE-DOWNSAMPLED",
            "@size": "49811",
            "@ref": "gr8",
            "@mimetype": "image/jpeg"
          },
          {
            "@category": "standard",
            "@height": "669",
            "@width": "650",
            "@_fa": "true",
            "$": "https://api.elsevier.com/content/object/eid/1-s2.0-S2468823124003754-gr1.jpg?httpAccept=%2A%2F%2A",
            "@multimediatype": "JPEG image file",
            "@type": "IMAGE-DOWNSAMPLED",
            "@size": "141547",
            "@ref": "gr1",
            "@mimetype": "image/jpeg"
          },
          {
            "@category": "standard",
            "@height": "311",
            "@width": "710",
            "@_fa": "true",
            "$": "https://api.elsevier.com/content/object/eid/1-s2.0-S2468823124003754-gr2.jpg?httpAccept=%2A%2F%2A",
            "@multimediatype": "JPEG image file",
            "@type": "IMAGE-DOWNSAMPLED",
            "@size": "89424",
            "@ref": "gr2",
            "@mimetype": "image/jpeg"
          },
          {
            "@category": "standard",
            "@height": "271",
            "@width": "755",
            "@_fa": "true",
            "$": "https://api.elsevier.com/content/object/eid/1-s2.0-S2468823124003754-gr3.jpg?httpAccept=%2A%2F%2A",
            "@multimediatype": "JPEG image file",
            "@type": "IMAGE-DOWNSAMPLED",
            "@size": "65782",
            "@ref": "gr3",
            "@mimetype": "image/jpeg"
          },
          {
            "@category": "standard",
            "@height": "306",
            "@width": "401",
            "@_fa": "true",
            "$": "https://api.elsevier.com/content/object/eid/1-s2.0-S2468823124003754-gr10.jpg?httpAccept=%2A%2F%2A",
            "@multimediatype": "JPEG image file",
            "@type": "IMAGE-DOWNSAMPLED",
            "@size": "29477",
            "@ref": "gr10",
            "@mimetype": "image/jpeg"
          },
          {
            "@category": "standard",
            "@height": "275",
            "@width": "523",
            "@_fa": "true",
            "$": "https://api.elsevier.com/content/object/eid/1-s2.0-S2468823124003754-gr4.jpg?httpAccept=%2A%2F%2A",
            "@multimediatype": "JPEG image file",
            "@type": "IMAGE-DOWNSAMPLED",
            "@size": "61810",
            "@ref": "gr4",
            "@mimetype": "image/jpeg"
          },
          {
            "@category": "standard",
            "@height": "283",
            "@width": "725",
            "@_fa": "true",
            "$": "https://api.elsevier.com/content/object/eid/1-s2.0-S2468823124003754-gr11.jpg?httpAccept=%2A%2F%2A",
            "@multimediatype": "JPEG image file",
            "@type": "IMAGE-DOWNSAMPLED",
            "@size": "68534",
            "@ref": "gr11",
            "@mimetype": "image/jpeg"
          },
          {
            "@category": "standard",
            "@height": "200",
            "@width": "402",
            "@_fa": "true",
            "$": "https://api.elsevier.com/content/object/eid/1-s2.0-S2468823124003754-ga1.jpg?httpAccept=%2A%2F%2A",
            "@multimediatype": "JPEG image file",
            "@type": "IMAGE-DOWNSAMPLED",
            "@size": "37921",
            "@ref": "ga1",
            "@mimetype": "image/jpeg"
          },
          {
            "@category": "thumbnail",
            "@height": "164",
            "@width": "211",
            "@_fa": "true",
            "$": "https://api.elsevier.com/content/object/eid/1-s2.0-S2468823124003754-gr9.sml?httpAccept=%2A%2F%2A",
            "@multimediatype": "GIF image file",
            "@type": "IMAGE-THUMBNAIL",
            "@size": "16721",
            "@ref": "gr9",
            "@mimetype": "image/gif"
          },
          {
            "@category": "thumbnail",
            "@height": "164",
            "@width": "198",
            "@_fa": "true",
            "$": "https://api.elsevier.com/content/object/eid/1-s2.0-S2468823124003754-gr5.sml?httpAccept=%2A%2F%2A",
            "@multimediatype": "GIF image file",
            "@type": "IMAGE-THUMBNAIL",
            "@size": "14984",
            "@ref": "gr5",
            "@mimetype": "image/gif"
          },
          {
            "@category": "thumbnail",
            "@height": "164",
            "@width": "194",
            "@_fa": "true",
            "$": "https://api.elsevier.com/content/object/eid/1-s2.0-S2468823124003754-gr6.sml?httpAccept=%2A%2F%2A",
            "@multimediatype": "GIF image file",
            "@type": "IMAGE-THUMBNAIL",
            "@size": "14517",
            "@ref": "gr6",
            "@mimetype": "image/gif"
          },
          {
            "@category": "thumbnail",
            "@height": "81",
            "@width": "219",
            "@_fa": "true",
            "$": "https://api.elsevier.com/content/object/eid/1-s2.0-S2468823124003754-gr7.sml?httpAccept=%2A%2F%2A",
            "@multimediatype": "GIF image file",
            "@type": "IMAGE-THUMBNAIL",
            "@size": "8019",
            "@ref": "gr7",
            "@mimetype": "image/gif"
          },
          {
            "@category": "thumbnail",
            "@height": "80",
            "@width": "219",
            "@_fa": "true",
            "$": "https://api.elsevier.com/content/object/eid/1-s2.0-S2468823124003754-gr8.sml?httpAccept=%2A%2F%2A",
            "@multimediatype": "GIF image file",
            "@type": "IMAGE-THUMBNAIL",
            "@size": "7835",
            "@ref": "gr8",
            "@mimetype": "image/gif"
          },
          {
            "@category": "thumbnail",
            "@height": "164",
            "@width": "159",
            "@_fa": "true",
            "$": "https://api.elsevier.com/content/object/eid/1-s2.0-S2468823124003754-gr1.sml?httpAccept=%2A%2F%2A",
            "@multimediatype": "GIF image file",
            "@type": "IMAGE-THUMBNAIL",
            "@size": "13645",
            "@ref": "gr1",
            "@mimetype": "image/gif"
          },
          {
            "@category": "thumbnail",
            "@height": "96",
            "@width": "219",
            "@_fa": "true",
            "$": "https://api.elsevier.com/content/object/eid/1-s2.0-S2468823124003754-gr2.sml?httpAccept=%2A%2F%2A",
            "@multimediatype": "GIF image file",
            "@type": "IMAGE-THUMBNAIL",
            "@size": "14467",
            "@ref": "gr2",
            "@mimetype": "image/gif"
          },
          {
            "@category": "thumbnail",
            "@height": "79",
            "@width": "219",
            "@_fa": "true",
            "$": "https://api.elsevier.com/content/object/eid/1-s2.0-S2468823124003754-gr3.sml?httpAccept=%2A%2F%2A",
            "@multimediatype": "GIF image file",
            "@type": "IMAGE-THUMBNAIL",
            "@size": "9771",
            "@ref": "gr3",
            "@mimetype": "image/gif"
          },
          {
            "@category": "thumbnail",
            "@height": "164",
            "@width": "215",
            "@_fa": "true",
            "$": "https://api.elsevier.com/content/object/eid/1-s2.0-S2468823124003754-gr10.sml?httpAccept=%2A%2F%2A",
            "@multimediatype": "GIF image file",
            "@type": "IMAGE-THUMBNAIL",
            "@size": "9532",
            "@ref": "gr10",
            "@mimetype": "image/gif"
          },
          {
            "@category": "thumbnail",
            "@height": "115",
            "@width": "219",
            "@_fa": "true",
            "$": "https://api.elsevier.com/content/object/eid/1-s2.0-S2468823124003754-gr4.sml?httpAccept=%2A%2F%2A",
            "@multimediatype": "GIF image file",
            "@type": "IMAGE-THUMBNAIL",
            "@size": "15421",
            "@ref": "gr4",
            "@mimetype": "image/gif"
          },
          {
            "@category": "thumbnail",
            "@height": "86",
            "@width": "219",
            "@_fa": "true",
            "$": "https://api.elsevier.com/content/object/eid/1-s2.0-S2468823124003754-gr11.sml?httpAccept=%2A%2F%2A",
            "@multimediatype": "GIF image file",
            "@type": "IMAGE-THUMBNAIL",
            "@size": "11187",
            "@ref": "gr11",
            "@mimetype": "image/gif"
          },
          {
            "@category": "thumbnail",
            "@height": "109",
            "@width": "219",
            "@_fa": "true",
            "$": "https://api.elsevier.com/content/object/eid/1-s2.0-S2468823124003754-ga1.sml?httpAccept=%2A%2F%2A",
            "@multimediatype": "GIF image file",
            "@type": "IMAGE-THUMBNAIL",
            "@size": "16319",
            "@ref": "ga1",
            "@mimetype": "image/gif"
          },
          {
            "@category": "high",
            "@height": "1982",
            "@width": "2555",
            "@_fa": "true",
            "$": "https://api.elsevier.com/content/object/eid/1-s2.0-S2468823124003754-gr9_lrg.jpg?httpAccept=%2A%2F%2A",
            "@multimediatype": "JPEG image file",
            "@type": "IMAGE-HIGH-RES",
            "@size": "511427",
            "@ref": "gr9",
            "@mimetype": "image/jpeg"
          },
          {
            "@category": "high",
            "@height": "2402",
            "@width": "2903",
            "@_fa": "true",
            "$": "https://api.elsevier.com/content/object/eid/1-s2.0-S2468823124003754-gr5_lrg.jpg?httpAccept=%2A%2F%2A",
            "@multimediatype": "JPEG image file",
            "@type": "IMAGE-HIGH-RES",
            "@size": "893657",
            "@ref": "gr5",
            "@mimetype": "image/jpeg"
          },
          {
            "@category": "high",
            "@height": "2504",
            "@width": "2970",
            "@_fa": "true",
            "$": "https://api.elsevier.com/content/object/eid/1-s2.0-S2468823124003754-gr6_lrg.jpg?httpAccept=%2A%2F%2A",
            "@multimediatype": "JPEG image file",
            "@type": "IMAGE-HIGH-RES",
            "@size": "887945",
            "@ref": "gr6",
            "@mimetype": "image/jpeg"
          },
          {
            "@category": "high",
            "@height": "1198",
            "@width": "3240",
            "@_fa": "true",
            "$": "https://api.elsevier.com/content/object/eid/1-s2.0-S2468823124003754-gr7_lrg.jpg?httpAccept=%2A%2F%2A",
            "@multimediatype": "JPEG image file",
            "@type": "IMAGE-HIGH-RES",
            "@size": "374628",
            "@ref": "gr7",
            "@mimetype": "image/jpeg"
          },
          {
            "@category": "high",
            "@height": "1185",
            "@width": "3232",
            "@_fa": "true",
            "$": "https://api.elsevier.com/content/object/eid/1-s2.0-S2468823124003754-gr8_lrg.jpg?httpAccept=%2A%2F%2A",
            "@multimediatype": "JPEG image file",
            "@type": "IMAGE-HIGH-RES",
            "@size": "357689",
            "@ref": "gr8",
            "@mimetype": "image/jpeg"
          },
          {
            "@category": "high",
            "@height": "2964",
            "@width": "2878",
            "@_fa": "true",
            "$": "https://api.elsevier.com/content/object/eid/1-s2.0-S2468823124003754-gr1_lrg.jpg?httpAccept=%2A%2F%2A",
            "@multimediatype": "JPEG image file",
            "@type": "IMAGE-HIGH-RES",
            "@size": "1251310",
            "@ref": "gr1",
            "@mimetype": "image/jpeg"
          },
          {
            "@category": "high",
            "@height": "1376",
            "@width": "3146",
            "@_fa": "true",
            "$": "https://api.elsevier.com/content/object/eid/1-s2.0-S2468823124003754-gr2_lrg.jpg?httpAccept=%2A%2F%2A",
            "@multimediatype": "JPEG image file",
            "@type": "IMAGE-HIGH-RES",
            "@size": "796450",
            "@ref": "gr2",
            "@mimetype": "image/jpeg"
          },
          {
            "@category": "high",
            "@height": "1201",
            "@width": "3341",
            "@_fa": "true",
            "$": "https://api.elsevier.com/content/object/eid/1-s2.0-S2468823124003754-gr3_lrg.jpg?httpAccept=%2A%2F%2A",
            "@multimediatype": "JPEG image file",
            "@type": "IMAGE-HIGH-RES",
            "@size": "531044",
            "@ref": "gr3",
            "@mimetype": "image/jpeg"
          },
          {
            "@category": "high",
            "@height": "1356",
            "@width": "1776",
            "@_fa": "true",
            "$": "https://api.elsevier.com/content/object/eid/1-s2.0-S2468823124003754-gr10_lrg.jpg?httpAccept=%2A%2F%2A",
            "@multimediatype": "JPEG image file",
            "@type": "IMAGE-HIGH-RES",
            "@size": "179150",
            "@ref": "gr10",
            "@mimetype": "image/jpeg"
          },
          {
            "@category": "high",
            "@height": "1218",
            "@width": "2317",
            "@_fa": "true",
            "$": "https://api.elsevier.com/content/object/eid/1-s2.0-S2468823124003754-gr4_lrg.jpg?httpAccept=%2A%2F%2A",
            "@multimediatype": "JPEG image file",
            "@type": "IMAGE-HIGH-RES",
            "@size": "561536",
            "@ref": "gr4",
            "@mimetype": "image/jpeg"
          },
          {
            "@category": "high",
            "@height": "1254",
            "@width": "3211",
            "@_fa": "true",
            "$": "https://api.elsevier.com/content/object/eid/1-s2.0-S2468823124003754-gr11_lrg.jpg?httpAccept=%2A%2F%2A",
            "@multimediatype": "JPEG image file",
            "@type": "IMAGE-HIGH-RES",
            "@size": "604416",
            "@ref": "gr11",
            "@mimetype": "image/jpeg"
          },
          {
            "@category": "high",
            "@height": "886",
            "@width": "1780",
            "@_fa": "true",
            "$": "https://api.elsevier.com/content/object/eid/1-s2.0-S2468823124003754-ga1_lrg.jpg?httpAccept=%2A%2F%2A",
            "@multimediatype": "JPEG image file",
            "@type": "IMAGE-HIGH-RES",
            "@size": "275600",
            "@ref": "ga1",
            "@mimetype": "image/jpeg"
          },
          {
            "@category": "standard",
            "@_fa": "true",
            "$": "https://api.elsevier.com/content/object/eid/1-s2.0-S2468823124003754-mmc1.docx?httpAccept=%2A%2F%2A",
            "@multimediatype": "Microsoft Word file",
            "@type": "APPLICATION",
            "@size": "12589559",
            "@ref": "mmc1",
            "@mimetype": "application/word"
          },
          {
            "@category": "thumbnail",
            "@_fa": "true",
            "$": "https://api.elsevier.com/content/object/eid/1-s2.0-S2468823124003754-si1.svg?httpAccept=%2A%2F%2A",
            "@multimediatype": "Scalable Vector Graphics file",
            "@type": "ALTIMG",
            "@size": "2541",
            "@ref": "si1",
            "@mimetype": "image/svg+xml"
          },
          {
            "@category": "thumbnail",
            "@_fa": "true",
            "$": "https://api.elsevier.com/content/object/eid/1-s2.0-S2468823124003754-si10.svg?httpAccept=%2A%2F%2A",
            "@multimediatype": "Scalable Vector Graphics file",
            "@type": "ALTIMG",
            "@size": "1993",
            "@ref": "si10",
            "@mimetype": "image/svg+xml"
          },
          {
            "@category": "thumbnail",
            "@_fa": "true",
            "$": "https://api.elsevier.com/content/object/eid/1-s2.0-S2468823124003754-si11.svg?httpAccept=%2A%2F%2A",
            "@multimediatype": "Scalable Vector Graphics file",
            "@type": "ALTIMG",
            "@size": "5140",
            "@ref": "si11",
            "@mimetype": "image/svg+xml"
          },
          {
            "@category": "thumbnail",
            "@_fa": "true",
            "$": "https://api.elsevier.com/content/object/eid/1-s2.0-S2468823124003754-si12.svg?httpAccept=%2A%2F%2A",
            "@multimediatype": "Scalable Vector Graphics file",
            "@type": "ALTIMG",
            "@size": "3475",
            "@ref": "si12",
            "@mimetype": "image/svg+xml"
          },
          {
            "@category": "thumbnail",
            "@_fa": "true",
            "$": "https://api.elsevier.com/content/object/eid/1-s2.0-S2468823124003754-si13.svg?httpAccept=%2A%2F%2A",
            "@multimediatype": "Scalable Vector Graphics file",
            "@type": "ALTIMG",
            "@size": "2571",
            "@ref": "si13",
            "@mimetype": "image/svg+xml"
          },
          {
            "@category": "thumbnail",
            "@_fa": "true",
            "$": "https://api.elsevier.com/content/object/eid/1-s2.0-S2468823124003754-si14.svg?httpAccept=%2A%2F%2A",
            "@multimediatype": "Scalable Vector Graphics file",
            "@type": "ALTIMG",
            "@size": "2276",
            "@ref": "si14",
            "@mimetype": "image/svg+xml"
          },
          {
            "@category": "thumbnail",
            "@_fa": "true",
            "$": "https://api.elsevier.com/content/object/eid/1-s2.0-S2468823124003754-si15.svg?httpAccept=%2A%2F%2A",
            "@multimediatype": "Scalable Vector Graphics file",
            "@type": "ALTIMG",
            "@size": "2519",
            "@ref": "si15",
            "@mimetype": "image/svg+xml"
          },
          {
            "@category": "thumbnail",
            "@_fa": "true",
            "$": "https://api.elsevier.com/content/object/eid/1-s2.0-S2468823124003754-si16.svg?httpAccept=%2A%2F%2A",
            "@multimediatype": "Scalable Vector Graphics file",
            "@type": "ALTIMG",
            "@size": "3993",
            "@ref": "si16",
            "@mimetype": "image/svg+xml"
          },
          {
            "@category": "thumbnail",
            "@_fa": "true",
            "$": "https://api.elsevier.com/content/object/eid/1-s2.0-S2468823124003754-si2.svg?httpAccept=%2A%2F%2A",
            "@multimediatype": "Scalable Vector Graphics file",
            "@type": "ALTIMG",
            "@size": "486",
            "@ref": "si2",
            "@mimetype": "image/svg+xml"
          },
          {
            "@category": "thumbnail",
            "@_fa": "true",
            "$": "https://api.elsevier.com/content/object/eid/1-s2.0-S2468823124003754-si3.svg?httpAccept=%2A%2F%2A",
            "@multimediatype": "Scalable Vector Graphics file",
            "@type": "ALTIMG",
            "@size": "465",
            "@ref": "si3",
            "@mimetype": "image/svg+xml"
          },
          {
            "@category": "thumbnail",
            "@_fa": "true",
            "$": "https://api.elsevier.com/content/object/eid/1-s2.0-S2468823124003754-si4.svg?httpAccept=%2A%2F%2A",
            "@multimediatype": "Scalable Vector Graphics file",
            "@type": "ALTIMG",
            "@size": "551",
            "@ref": "si4",
            "@mimetype": "image/svg+xml"
          },
          {
            "@category": "thumbnail",
            "@_fa": "true",
            "$": "https://api.elsevier.com/content/object/eid/1-s2.0-S2468823124003754-si5.svg?httpAccept=%2A%2F%2A",
            "@multimediatype": "Scalable Vector Graphics file",
            "@type": "ALTIMG",
            "@size": "14110",
            "@ref": "si5",
            "@mimetype": "image/svg+xml"
          },
          {
            "@category": "thumbnail",
            "@_fa": "true",
            "$": "https://api.elsevier.com/content/object/eid/1-s2.0-S2468823124003754-si6.svg?httpAccept=%2A%2F%2A",
            "@multimediatype": "Scalable Vector Graphics file",
            "@type": "ALTIMG",
            "@size": "1800",
            "@ref": "si6",
            "@mimetype": "image/svg+xml"
          },
          {
            "@category": "thumbnail",
            "@_fa": "true",
            "$": "https://api.elsevier.com/content/object/eid/1-s2.0-S2468823124003754-si7.svg?httpAccept=%2A%2F%2A",
            "@multimediatype": "Scalable Vector Graphics file",
            "@type": "ALTIMG",
            "@size": "834",
            "@ref": "si7",
            "@mimetype": "image/svg+xml"
          },
          {
            "@category": "thumbnail",
            "@_fa": "true",
            "$": "https://api.elsevier.com/content/object/eid/1-s2.0-S2468823124003754-si8.svg?httpAccept=%2A%2F%2A",
            "@multimediatype": "Scalable Vector Graphics file",
            "@type": "ALTIMG",
            "@size": "4144",
            "@ref": "si8",
            "@mimetype": "image/svg+xml"
          },
          {
            "@category": "thumbnail",
            "@_fa": "true",
            "$": "https://api.elsevier.com/content/object/eid/1-s2.0-S2468823124003754-si9.svg?httpAccept=%2A%2F%2A",
            "@multimediatype": "Scalable Vector Graphics file",
            "@type": "ALTIMG",
            "@size": "9871",
            "@ref": "si9",
            "@mimetype": "image/svg+xml"
          },
          {
            "@category": "standard",
            "@_fa": "true",
            "$": "https://api.elsevier.com/content/object/eid/1-s2.0-S2468823124003754-am.pdf?httpAccept=%2A%2F%2A",
            "@multimediatype": "Acrobat PDF file",
            "@type": "AAM-PDF",
            "@size": "1937188",
            "@ref": "am",
            "@mimetype": "application/pdf"
          }
        ]
      },
      "link": {
        "@rel": "abstract",
        "@href": "https://api.elsevier.com/content/abstract/scopus_id/85192223385"
      }
    }
  }
}