{
  "metadata": {
    "title": "Advances in the preparation and application of nanoconfined metal catalysts composed of porous materials",
    "authors": "; ; ",
    "journal": "Molecular Catalysis",
    "date": "2025-07-31",
    "doi": "10.1016/j.mcat.2025.115175",
    "abstract": "",
    "uri": "https://api.elsevier.com/content/article/pii/S2468823125003608",
    "pii": "S2468823125003608"
  },
  "fulltext": {
    "full-text-retrieval-response": {
      "scopus-eid": "2-s2.0-105003992873",
      "originalText": "serial JL 315758 291210 291744 291790 291809 31 Molecular Catalysis MOLECULARCATALYSIS 2025-05-03 2025-05-03 2025-05-03 2025-05-03 2025-05-21T23:56:09 1-s2.0-S2468823125003608 S2468-8231(25)00360-8 S2468823125003608 10.1016/j.mcat.2025.115175 S300 S300.1 FULL-TEXT 1-s2.0-S2468823125X00092 2025-05-21T23:08:23.358231Z 0 0 20250701 20250731 2025 2025-05-03T12:43:53.80641Z absattachment articleinfo articlenumber articletitlenorm authfirstinitialnorm authfirstsurnamenorm cid cids contenttype copyright crossmark dateloaded dateloadedtxt datesearch datesort dateupdated dco docsubtype doctype doi eid ewtransactionid hubeid indexeddate issn issnnorm itemstage itemtransactionid itemweight openaccess openarchive pg pgfirst pii piinorm pubdateend pubdatestart pubdatetxt pubyr sectiontitle sortorder srctitle srctitlenorm srctype ssids alllist content subj subheadings suppl tomb volfirst volissue volumelist webpdf webpdfpagecount yearnav figure table body acknowledge affil articletitle auth authfirstini authfull authkeywords authlast grantnumber grantsponsor highlightsabst orcid primabst pubtype ref specialabst 2468-8231 24688231 true 582 582 C Volume 582 32 115175 115175 115175 202507 July 2025 2025-07-01 2025-07-31 2025 Review Papers article rev © 2025 Elsevier B.V. All rights are reserved, including those for text and data mining, AI training, and similar technologies. ADVANCESINPREPARATIONAPPLICATIONNANOCONFINEDMETALCATALYSTSCOMPOSEDPOROUSMATERIALS LI L 1 Introduction 2 Research progress of porous nanoconfined catalysts with different structures 2.1 Research progress of in situ encapsulated porous nanoconfined catalysts 2.2 Research progress of core-shell structured porous nanoconfined catalysts 2.3 Research progress of two-dimensional layered porous nanoconfined catalysts 2.4 Research progress of single-atom anchored porous nanoconfined catalysts 3 Application advances of porous nanoconfined catalysts 3.1 Application of porous nanoconfined catalysts in syngas to olefin reactions 3.2 Application of porous nanoconfined catalysts in dehydrogenation of n-alkanes reactions 3.3 Application of porous nanoconfined catalysts in synthesis of fine chemicals 3.4 Application of porous nanoconfined catalysts in other reactions 4 Conclusion and prospects CRediT authorship contribution statement Acknowledgement References WANG 2019 1806 1854 Y CHAI 2021 2894 2904 Y ZHANG 2024 e19 Z JEONG 2020 1903423 H WU 2019 12340 12354 S ZHENG 2021 2011027 T LYU 2019 208 216 Y ZHOU 2022 563 595 Z LIU 2022 762 S ZHANG 2022 2156 Q ZHANG 2020 683 733 L ZHANG 2021 25 30 J PANPRANOT 2004 583 590 J JAVED 2020 604 612 M LIANG 2022 610 621 H SUN 2019 18570 18576 Q MA 2023 368 378 S CHEN 2017 4614 4630 L DENG 2021 20898 20906 X CHAI 2023 Y LIU 2024 24033 24041 H YANG 2023 3151 3158 S WANG 2022 127755 Z CAO 2022 1569 1593 L LI 2019 1874 1907 A MA 2020 2001291 X WANG 2016 7880 7883 C ZENG 2016 2729 2734 M MA 2024 e202403245 B TANG 2023 112348 B LIU 2024 206 214 S DING 2025 128964 S GAO 2016 68 71 S WU 2021 2007368 J LI 2020 894 899 Y WANG 2017 1538 1548 Y TANG 2019 1901996 L ZHANG 2025 1 13 C LYU 2022 6171 S HUO 2021 120254 L JIANG 2023 2300505 Z GE 2024 2311713 K QIAO 2011 634 641 B GUO 2022 9373 9394 J JIANG 2019 3508 3514 Z SONG 2022 122580 W WANG 2024 129439 D HAN 2020 11824 11829 B XI 2021 2008318 J ZHANG 2018 1980 1984 H LIU 2016 5758 5764 W GU 2021 1141 1149 J ZHAO 2020 455 457 X PANG 2024 M DENG 2024 Z HAI 2022 174 181 X WANG 2024 5675 Y DING 2025 128158 S SHI 2022 913 922 Z YU 2022 5987 H ZAO 2023 19 33 H HU 2023 R XU 2021 610 613 Y JIAO 2016 1065 1068 F WANG 2024 Z JIAO 2023 727 730 F GOLDMAN 2006 257 261 A ZHOU 2021 76 80 H QIU 2020 176 182 B FARZANEH 2023 404 416 A LIU 2024 130069 M ZHOU 2022 1145 1156 Y ZHANG 2018 653 672 L LI 2024 149665 Y CHAI 2018 8578 8589 Y PENG 2024 112962 P ZHANG 2022 125201 M JIA 2022 10337 10343 B YANG 2020 1647 1651 H LIU 2023 513 G ZHOU 2023 5872 S WANG 2022 3482 3492 J LIU 2023 Y LIX2025X115175 LIX2025X115175XL 2027-05-03T00:00:00.000Z 2027-05-03T00:00:00.000Z http://creativecommons.org/licenses/by-nc-nd/4.0/ © 2025 Elsevier B.V. All rights are reserved, including those for text and data mining, AI training, and similar technologies. 2025-05-07T02:27:31.445Z http://vtw.elsevier.com/data/voc/AddOnTypes/50.7/aggregated-refined National Natural Science Foundation of China 22272097 National Natural Science Foundation of China http://data.elsevier.com/vocabulary/SciValFunders/501100001809 http://sws.geonames.org/1814991 Shanxi Scholarship Council of China 2023-019 Shanxi Scholarship Council of China http://data.elsevier.com/vocabulary/SciValFunders/501100003398 http://sws.geonames.org/1814991 This work was financially supported by the National Natural Science Foundation of China (Grant No. 22272097 ) and the Research Project Supported by Shanxi Scholarship Council of China ( 2023-019 ). https://doi.org/10.15223/policy-017 https://doi.org/10.15223/policy-037 https://doi.org/10.15223/policy-012 https://doi.org/10.15223/policy-029 https://doi.org/10.15223/policy-004 item S2468-8231(25)00360-8 S2468823125003608 1-s2.0-S2468823125003608 10.1016/j.mcat.2025.115175 315758 2025-05-21T23:08:23.358231Z 2025-07-01 2025-07-31 1-s2.0-S2468823125003608-main.pdf https://s3-eu-west-1.amazonaws.com/prod-ucs-content-store-eu-west/content/pii:S2468823125003608/MAIN/application/pdf/e5d3e83193a2b39957fa2a6a16b08c12/main.pdf main.pdf pdf true 18868099 MAIN 15 1-s2.0-S2468823125003608-main_1.png https://s3-eu-west-1.amazonaws.com/prod-ucs-content-store-eu-west/content/pii:S2468823125003608/PREVIEW/image/png/8b5d137389e3d9e93bf04665e6194e11/main_1.png main_1.png png 58032 928 656 IMAGE-WEB-PDF 1 1-s2.0-S2468823125003608-gr5.jpg https://s3-eu-west-1.amazonaws.com/prod-ucs-content-store-eu-west/content/pii:S2468823125003608/gr5/DOWNSAMPLED/image/jpeg/a9258136fa037adb5bf307cf42c8fc99/gr5.jpg gr5 gr5.jpg jpg 124650 362 715 IMAGE-DOWNSAMPLED 1-s2.0-S2468823125003608-gr4.jpg https://s3-eu-west-1.amazonaws.com/prod-ucs-content-store-eu-west/content/pii:S2468823125003608/gr4/DOWNSAMPLED/image/jpeg/ad04df25ca851f7da99d494f87c35246/gr4.jpg gr4 gr4.jpg jpg 86304 378 678 IMAGE-DOWNSAMPLED 1-s2.0-S2468823125003608-gr7.jpg https://s3-eu-west-1.amazonaws.com/prod-ucs-content-store-eu-west/content/pii:S2468823125003608/gr7/DOWNSAMPLED/image/jpeg/4c4dba0405c91a3609a9ddfb3cd8c94d/gr7.jpg gr7 gr7.jpg jpg 101990 446 640 IMAGE-DOWNSAMPLED 1-s2.0-S2468823125003608-gr6.jpg https://s3-eu-west-1.amazonaws.com/prod-ucs-content-store-eu-west/content/pii:S2468823125003608/gr6/DOWNSAMPLED/image/jpeg/35bb899d3cd4d5849c88ba9cc7f9aecd/gr6.jpg gr6 gr6.jpg jpg 150172 619 640 IMAGE-DOWNSAMPLED 1-s2.0-S2468823125003608-gr1.jpg https://s3-eu-west-1.amazonaws.com/prod-ucs-content-store-eu-west/content/pii:S2468823125003608/gr1/DOWNSAMPLED/image/jpeg/e058c930576d34f45607a69b52b5ed64/gr1.jpg gr1 gr1.jpg jpg 33973 257 565 IMAGE-DOWNSAMPLED 1-s2.0-S2468823125003608-gr3.jpg https://s3-eu-west-1.amazonaws.com/prod-ucs-content-store-eu-west/content/pii:S2468823125003608/gr3/DOWNSAMPLED/image/jpeg/c6e3282c752d0c7039ca4bfb81fe308b/gr3.jpg gr3 gr3.jpg jpg 107879 587 640 IMAGE-DOWNSAMPLED 1-s2.0-S2468823125003608-gr10.jpg https://s3-eu-west-1.amazonaws.com/prod-ucs-content-store-eu-west/content/pii:S2468823125003608/gr10/DOWNSAMPLED/image/jpeg/b40082ffcd9941eb8f69324cdecc16f3/gr10.jpg gr10 gr10.jpg jpg 128969 449 715 IMAGE-DOWNSAMPLED 1-s2.0-S2468823125003608-gr2.jpg https://s3-eu-west-1.amazonaws.com/prod-ucs-content-store-eu-west/content/pii:S2468823125003608/gr2/DOWNSAMPLED/image/jpeg/06bb20e02f868f3ba3910b7c72c42b9d/gr2.jpg gr2 gr2.jpg jpg 91580 358 565 IMAGE-DOWNSAMPLED 1-s2.0-S2468823125003608-ga1.jpg https://s3-eu-west-1.amazonaws.com/prod-ucs-content-store-eu-west/content/pii:S2468823125003608/ga1/DOWNSAMPLED/image/jpeg/52282184ee05e08fad4505aad70b12e9/ga1.jpg ga1 true ga1.jpg jpg 21823 200 281 IMAGE-DOWNSAMPLED 1-s2.0-S2468823125003608-gr11.jpg https://s3-eu-west-1.amazonaws.com/prod-ucs-content-store-eu-west/content/pii:S2468823125003608/gr11/DOWNSAMPLED/image/jpeg/89dd460af0538eb45de685e72ac6e7f7/gr11.jpg gr11 gr11.jpg jpg 134452 518 678 IMAGE-DOWNSAMPLED 1-s2.0-S2468823125003608-gr9.jpg https://s3-eu-west-1.amazonaws.com/prod-ucs-content-store-eu-west/content/pii:S2468823125003608/gr9/DOWNSAMPLED/image/jpeg/2c208c1f263935ab73dbc5abb94b2584/gr9.jpg gr9 gr9.jpg jpg 129424 526 715 IMAGE-DOWNSAMPLED 1-s2.0-S2468823125003608-gr8.jpg https://s3-eu-west-1.amazonaws.com/prod-ucs-content-store-eu-west/content/pii:S2468823125003608/gr8/DOWNSAMPLED/image/jpeg/97b90a1e15be53c3674f4cc30c289b2e/gr8.jpg gr8 gr8.jpg jpg 119068 597 678 IMAGE-DOWNSAMPLED 1-s2.0-S2468823125003608-gr5.sml https://s3-eu-west-1.amazonaws.com/prod-ucs-content-store-eu-west/content/pii:S2468823125003608/gr5/THUMBNAIL/image/gif/ed3b5e4af88664318991fe5e2d9b1364/gr5.sml gr5 gr5.sml sml 15967 111 219 IMAGE-THUMBNAIL 1-s2.0-S2468823125003608-gr4.sml https://s3-eu-west-1.amazonaws.com/prod-ucs-content-store-eu-west/content/pii:S2468823125003608/gr4/THUMBNAIL/image/gif/5d709911fffc347955cd3bb3a8e417fe/gr4.sml gr4 gr4.sml sml 15822 122 219 IMAGE-THUMBNAIL 1-s2.0-S2468823125003608-gr7.sml https://s3-eu-west-1.amazonaws.com/prod-ucs-content-store-eu-west/content/pii:S2468823125003608/gr7/THUMBNAIL/image/gif/a0351dfb6f8cf2263c0da68c1fd78a17/gr7.sml gr7 gr7.sml sml 17890 153 219 IMAGE-THUMBNAIL 1-s2.0-S2468823125003608-gr6.sml https://s3-eu-west-1.amazonaws.com/prod-ucs-content-store-eu-west/content/pii:S2468823125003608/gr6/THUMBNAIL/image/gif/d3aa6a302c5bf5d53998ecf584029416/gr6.sml gr6 gr6.sml sml 18658 164 169 IMAGE-THUMBNAIL 1-s2.0-S2468823125003608-gr1.sml https://s3-eu-west-1.amazonaws.com/prod-ucs-content-store-eu-west/content/pii:S2468823125003608/gr1/THUMBNAIL/image/gif/b50daae2008b1d53cf68191ff6b2c5d2/gr1.sml gr1 gr1.sml sml 11805 99 219 IMAGE-THUMBNAIL 1-s2.0-S2468823125003608-gr3.sml https://s3-eu-west-1.amazonaws.com/prod-ucs-content-store-eu-west/content/pii:S2468823125003608/gr3/THUMBNAIL/image/gif/66e282a7b55ab7e500fcf3121b771745/gr3.sml gr3 gr3.sml sml 14555 164 179 IMAGE-THUMBNAIL 1-s2.0-S2468823125003608-gr10.sml https://s3-eu-west-1.amazonaws.com/prod-ucs-content-store-eu-west/content/pii:S2468823125003608/gr10/THUMBNAIL/image/gif/e71f1bda01fb0fa0c61f58a4ac77d228/gr10.sml gr10 gr10.sml sml 18573 138 219 IMAGE-THUMBNAIL 1-s2.0-S2468823125003608-gr2.sml https://s3-eu-west-1.amazonaws.com/prod-ucs-content-store-eu-west/content/pii:S2468823125003608/gr2/THUMBNAIL/image/gif/16ac79c5a74c7db833d1e6705952ed4a/gr2.sml gr2 gr2.sml sml 17772 139 219 IMAGE-THUMBNAIL 1-s2.0-S2468823125003608-ga1.sml https://s3-eu-west-1.amazonaws.com/prod-ucs-content-store-eu-west/content/pii:S2468823125003608/ga1/THUMBNAIL/image/gif/4004d3a125a8bad4a300c9580e5d8708/ga1.sml ga1 true ga1.sml sml 18341 156 219 IMAGE-THUMBNAIL 1-s2.0-S2468823125003608-gr11.sml https://s3-eu-west-1.amazonaws.com/prod-ucs-content-store-eu-west/content/pii:S2468823125003608/gr11/THUMBNAIL/image/gif/ab526eae8057e1e9e7714e6844dac976/gr11.sml gr11 gr11.sml sml 19829 164 215 IMAGE-THUMBNAIL 1-s2.0-S2468823125003608-gr9.sml https://s3-eu-west-1.amazonaws.com/prod-ucs-content-store-eu-west/content/pii:S2468823125003608/gr9/THUMBNAIL/image/gif/663892207bf35899adbe2976cb1d0d6f/gr9.sml gr9 gr9.sml sml 17987 161 219 IMAGE-THUMBNAIL 1-s2.0-S2468823125003608-gr8.sml https://s3-eu-west-1.amazonaws.com/prod-ucs-content-store-eu-west/content/pii:S246882312500361X/gr8/THUMBNAIL/image/gif/3780ba7dbf872781a79f4b8d5fe734c8/gr8.sml gr8 gr8.sml sml 14544 164 186 IMAGE-THUMBNAIL 1-s2.0-S2468823125003608-gr5_lrg.jpg https://s3-eu-west-1.amazonaws.com/prod-ucs-content-store-eu-west/content/pii:S2468823125003608/HIGHRES/image/jpeg/c2c39566220649d53fb926f615a33c96/gr5_lrg.jpg gr5 gr5_lrg.jpg jpg 899935 1605 3167 IMAGE-HIGH-RES 1-s2.0-S2468823125003608-gr4_lrg.jpg https://s3-eu-west-1.amazonaws.com/prod-ucs-content-store-eu-west/content/pii:S2468823125003608/HIGHRES/image/jpeg/c99da834164ade21aefb546ab8e44eb5/gr4_lrg.jpg gr4 gr4_lrg.jpg jpg 741447 1671 3000 IMAGE-HIGH-RES 1-s2.0-S2468823125003608-gr7_lrg.jpg https://s3-eu-west-1.amazonaws.com/prod-ucs-content-store-eu-west/content/pii:S2468823125003608/HIGHRES/image/jpeg/ddcb4402781be10a9ada05dde825d166/gr7_lrg.jpg gr7 gr7_lrg.jpg jpg 898860 1973 2833 IMAGE-HIGH-RES 1-s2.0-S2468823125003608-gr6_lrg.jpg https://s3-eu-west-1.amazonaws.com/prod-ucs-content-store-eu-west/content/pii:S2468823125003608/HIGHRES/image/jpeg/3166a741c4a911364822e05b15677f2f/gr6_lrg.jpg gr6 gr6_lrg.jpg jpg 1275469 2742 2833 IMAGE-HIGH-RES 1-s2.0-S2468823125003608-gr1_lrg.jpg https://s3-eu-west-1.amazonaws.com/prod-ucs-content-store-eu-west/content/pii:S2468823125003608/HIGHRES/image/jpeg/aa523dd28859249080b929f649782340/gr1_lrg.jpg gr1 gr1_lrg.jpg jpg 246851 1135 2500 IMAGE-HIGH-RES 1-s2.0-S2468823125003608-gr3_lrg.jpg https://s3-eu-west-1.amazonaws.com/prod-ucs-content-store-eu-west/content/pii:S2468823125003608/HIGHRES/image/jpeg/e1ed0be16796c988ed0652219eb6aeaf/gr3_lrg.jpg gr3 gr3_lrg.jpg jpg 902070 2599 2833 IMAGE-HIGH-RES 1-s2.0-S2468823125003608-gr10_lrg.jpg https://s3-eu-west-1.amazonaws.com/prod-ucs-content-store-eu-west/content/pii:S2468823125003608/HIGHRES/image/jpeg/0fcf089e9d604266745fc54db800c205/gr10_lrg.jpg gr10 gr10_lrg.jpg jpg 1117654 1990 3167 IMAGE-HIGH-RES 1-s2.0-S2468823125003608-gr2_lrg.jpg https://s3-eu-west-1.amazonaws.com/prod-ucs-content-store-eu-west/content/pii:S2468823125003608/HIGHRES/image/jpeg/46b7a2f43b1428705e0a1e7ff8dbdded/gr2_lrg.jpg gr2 gr2_lrg.jpg jpg 716200 1585 2500 IMAGE-HIGH-RES 1-s2.0-S2468823125003608-ga1_lrg.jpg https://s3-eu-west-1.amazonaws.com/prod-ucs-content-store-eu-west/content/pii:S2468823125003608/HIGHRES/image/jpeg/19babdd0af26afaf4c9ea108189c6a88/ga1_lrg.jpg ga1 true ga1_lrg.jpg jpg 146065 886 1247 IMAGE-HIGH-RES 1-s2.0-S2468823125003608-gr11_lrg.jpg https://s3-eu-west-1.amazonaws.com/prod-ucs-content-store-eu-west/content/pii:S2468823125003608/HIGHRES/image/jpeg/e22a198221a42649437fde81c27d2da9/gr11_lrg.jpg gr11 gr11_lrg.jpg jpg 1478111 2291 3000 IMAGE-HIGH-RES 1-s2.0-S2468823125003608-gr9_lrg.jpg https://s3-eu-west-1.amazonaws.com/prod-ucs-content-store-eu-west/content/pii:S246882312500361X/HIGHRES/image/jpeg/695d20589d202ff5c120aa3401b7bd78/gr9_lrg.jpg gr9 gr9_lrg.jpg jpg 1007080 2331 3167 IMAGE-HIGH-RES 1-s2.0-S2468823125003608-gr8_lrg.jpg https://s3-eu-west-1.amazonaws.com/prod-ucs-content-store-eu-west/content/pii:S246882312500361X/HIGHRES/image/jpeg/c5b80b33a16c27fa7395d271e6668657/gr8_lrg.jpg gr8 gr8_lrg.jpg jpg 912496 2642 3000 IMAGE-HIGH-RES MCAT 115175 115175 S2468-8231(25)00360-8 10.1016/j.mcat.2025.115175 Elsevier B.V. Fig. 1 Advantages of nanoconfinement catalysis. Fig 1 Fig. 2 (A) HAADF-STEM image of Pt@Y. (B) Schematic model of Pt@Y along the orientation of [110]. (C) Hydrogenation of α, β-unsaturated aldehydes and nitroaromatics on Pt@Y catalyst. Reproduced with permission from Ref. [20]. Copyright 2021, American Chemical Society. (D) Schematic model of Cu@FAU. Reproduced with permission from Ref. [21]. Copyright 2023, Oxford University Press on behalf of China Science Publishing & Media Ltd. Fig 2 Fig. 3 (A) Schematic illustration of the fabrication process of CoP@quasi-Co-MOF-74. (B) Comparison of hydrogen generation rate over CoP@quasi-Co-MOF-74 for the catalytic hydrolysis of ammonia borane to previously reported cobalt-based catalysts. Reproduced with permission from Ref. [23]. Copyright 2023, Royal Society of Chemistry. (C) Reduction reaction of ammonia borane on OPH@Zn/Co-ZIF catalyst. Reproduced with permission from Ref. [24]. Copyright 2022, Elsevier. Fig 3 Fig. 4 (A) Preparation of Pd@S-1 catalyst. Reproduced with permission from Ref. [28]. Copyright 2016, American Chemical Society. (B) Dehydrogenation of formic acid on CdS@ZIF-8 catalyst. Reproduced with permission from Ref. [29]. Copyright 2016, Springer Nature. (C) Ethanol dehydration reaction on Fe3O4@ZSM-5 catalyst. Reproduced with permission from Ref. [30]. Copyright 2024, Wiley-VCH. (D) HAADF-STEM image of PdCu@SiO2@Cu. Reproduced with permission from Ref. [32]. Copyright 2024, Royal Society of Chemistry. Fig 4 Fig. 5 (A) Preparation of NiFe-MOFs//G catalyst and oxygen evolution reaction in water electrolysis. Reproduced with permission from Ref. [40]. Copyright 2022, Springer Nature. (B) Schematic representation of the structural transformations of d-MHOFs to M(OH)2 and MOOH. Reproduced with permission from Ref. [43]. Copyright 2024, Wiley-VCH. Fig 5 Fig. 6 (A) Acetylene semi-hydrogenation on Ni1Cu2/g-C3N4 catalyst. (B) HAADF-STEM image of Ni1Cu2/g-C3N4. Reproduced with permission from Ref. [53]. Copyright 2021, Springer Nature. (C) HAADF-STEM image of 41.8 % Pt SACs/PCN. (D) Catalytic performance of various catalysts in the oxidation reaction of propane at 6 h. Reproduced with permission from Ref. [58]. Copyright 2024, Springer Nature. Fig 6 Fig. 7 (A) Syngas to olefins reaction on FeMn@Si catalyst. Reproduced with permission from Ref. [64]. Copyright 2021, American Association for the Advancement of Science. (B) Syngas to olefins reaction on ZnCrOx/SAPO catalyst. Reproduced with permission from Ref. [66]. Copyright 2024, Wiley-VCH. (C) Scheme depicting the activity-selectivity trade-off. Reproduced with permission from Ref. [67]. Copyright 2023, American Association for the Advancement of Science. Fig 7 Fig. 8 (A) Schematic model of propane dehydrogenation on BS-1 catalyst. Reproduced with permission from Ref. [69]. Copyright 2021, American Association for the Advancement of Science. (B) Propane dehydrogenation on BZEO-2 catalyst. Reproduced with permission from Ref. [70]. Copyright 2020, Elsevier. (C) Propane dehydrogenation on V/UiO-66 catalyst. Reproduced with permission from Ref. [71]. Copyright 2022, Elsevier. (D) Propane dehydrogenation on NiSn@S-1 catalyst. Reproduced with permission from Ref. [72]. Copyright 2023, Elsevier. (E) Preparation of Ru1/NC catalyst. Reproduced with permission from Ref. [73]. Copyright 2022, Springer Nature. Fig 8 Fig. 9 (A) Hydrogen spillover catalyzed furfural to furfuryl alcohol reaction on Pt@HA catalyst. Reproduced with permission from Ref. [77]. Copyright 2024, Elsevier. (B) BYD hydrogenation to BED reaction on Pt@ZSM-48 catalyst. Reproduced with permission from Ref. [78]. Copyright 2022, Elsevier. (C) Mechanism for styrene epoxidation on Co/ZIF-1000 catalyst. Reproduced with permission from Ref. [79]. Copyright 2022, American Chemical Society. (D) Styrene epoxidation reaction on Ru/β catalyst. Reproduced with permission from Ref. [80]. Copyright 2020, Wiley-VCH. Fig 9 Fig. 10 (A) Preparation of Mo3S4@NaZSM-5 catalyst. (B) Mechanism for CO2 hydrogenation on Mo3S4@NaZSM-5 catalyst. Reproduced with permission from Ref. [81]. Copyright 2023, Springer Nature. (C) Preparation of Cu/MoS2@SiO2 catalyst. (D) Cu migration within the two-vacancy site. Reproduced with permission from Ref. [82]. Copyright 2023, Springer Nature. Fig 10 Fig. 11 (A) n-hexane hydroisomerization reaction on Ni/SAPO-11 catalyst. Reproduced with permission from Ref. [7]. Copyright 2019, Elsevier. (B) n-hexane hydroisomerization reaction on Pt/HL catalyst. Reproduced with permission from Ref. [83]. Copyright 2022, Royal Society of Chemistry. Fig 11 Table 1 Properties and synthesized methods of some porous nanoconfined catalysts on different structures. Table 1 Synthesis strategies Advantage Limitation Materials suitable Catalyst Support material Build confinement method Ref. In situ encapsulate Simple and easily applicable Precursor wastage Zeolite; MOFs Pt@Y Y zeolite Hydrothermal method [20] Cu@FAU FAU zeolite Hydrothermal method [21] Pd1@ZSM-5 ZSM-5 zeolite One-pot seed-assisted growth method [22] CoP@quasi-Co-MOF-74 Quasi-Co-MOF-74 Solvent-thermal synthesis method [23] OPH@Zn/Co-ZIF Zn/Co-ZIF MOFs One-pot method [24] Core-shell structure Excellent selectivity and stability Low activity Zeolite; SiO2 Pd@S-1 Silicalite-1 zeolite One-step solvent-free method [28] CdS@ZIF-8 ZIF-8 MOFs Two-step method [29] Fe3O4@ZSM-5 ZSM-5 zeolite Stepwise crystallization method [30] Au/Snβ@mesosilica β@mesosilica Deposition precipitation method [31] PdCu@SiO2@Cu SiO2 Reverse microemulsion method [32] Two-dimensional layer Suppression metal migration and aggregation Application limit in small-molecule transformations MOFs; rGO; MoS2 NiFe-MOFs//G Graphene Two-electrode electrochemical system [40] Mo2N/SBA-15/rGO SBA-15/rGO Impregnation-vacuum diffusion method [41] NiFe@MoS2 MoS2 Laser molecular beam epitaxy [42] NiO/FeO/CoO Hydrothermal method [43] Single-atom anchor Tunable morphology of the product Tedious process Carbon nitride Co-N-C Carbon nitride One-pot roasting method [52] Ni1Cu2/g-C3N4 g-C3N4 Atomic layer deposition [53] UHD Ni1/NC Carbon nitride Two-step annealing method [57] Pt SACs/PCN Polymeric carbon nitride Negative pressure annealing method [58] Table 2 Reaction overview of selected porous nanoconfined catalysts in different reactions. Table 2 Entry Catalyst Type of reaction Reaction conditions Results Conventional catalysts Ref. Catalyst Results 1 Fe@n-hS-HT Syngas to light olefins 10 bar, 340 °C X = 15 %,S = 21.38 % Fe/S-1 X = 18 %,S = 14.77 % [63] 2 FeMn@Si Syngas to light olefins 3.0 MPa, 320 °C X = 56.1 %,S = 83.3 % ε-Fe2C X = 18 %,S = 72 % [64] 3 ZnCrOx/SAPO Syngas to light olefins 2.5 MPa, 400 °C X = 17 %,S = 80 % ZnCrOx S = 38 % [65] 4 ZnCrOx/SAPO Syngas to light olefins 3 MPa, 380 °C yield = 559, S = 90 % GaZrOx yield = 180, S = 88.6 % [66] 5 ZnCrOx-GeAlPO-18 Syngas to light olefins 6 MPa, 430 °C X = 85 %,S = 83 % ZnCrOx/SAPO X = 27 %,S = 80 % [67] 6 Pd@S-1 Propane dehydrogenation to propylene 0.1 MPa, 570 °C X = 41.4 %, S = 81.2 % h-BN X = 40.2 %,S = 47.0 % [69] 7 BZEO-2 Propane dehydrogenation to propylene 0.1 MPa, 500 °C X = 44 %,S = 83.6 % [70] 8 V/UiO-66 Propane dehydrogenation to propylene 0.1 MPa, 350 °C X = 17.1 %,S = 49.7 % VOx/γ-Al2O3 X = 4.5 %,S = 55.1 % [71] 9 NiSn@S-1 Propane dehydrogenation to propylene 0.1 MPa, 600 °C X = 33.5 %,S = 88.2 % Ni@S-1 X = 10 %,S = 69 % [72] 10 Ru1/NC Propane dehydrogenation to propylene 0.1 MPa, 600 °C X = 33 %,S = 92 % RuNP/NC X = 8 %,S = 65 % [73] 11 Pd@MFI Furfural hydrogenation to furfuryl alcohol 1 MPa, 175 °C, 3 h S = 90.2 % Pd/MFI S = 9.7 % [76] 12 Pt@HA Furfural hydrogenation to furfuryl alcohol 1.5 MPa, 100 °C, 3 h X = 100 %,S = 99 % Pt/HA X = 84 %,S = 30 % [77] 13 Pt@ZSM-48 BYD hydrogenation to BED 1 MPa, 100 °C, 4 h X = 87 %,S = 86 % [78] 14 Co/ZIF-1000 Styrene epoxidation to phenylene oxide ethane 100 °C, 8 h X = 99.9 %,S = 71 % Co2O3 X = 96.4 %,S = 31 % [79] 15 Ru/β Styrene epoxidation to phenylene oxide ethane 80 °C, 6 h X = 96 %,S = 93 % RuNPs/β X = 25 %,S = 31 % [80] 16 Mo3S4@NaZSM-5 CO2 hydrogenation to methanol 4 MPa, 180 °C X = 10.2 %,S = 98 % MoSx/NaZSM-5 X = 0.4 %,S = 63 % [81] 17 Cu/MoS2@SiO2 CO2 hydrogenation to methanol 5 MPa, 260 °C X = 12 %,S = 72 % MoS2-NPs X = 9 %,S = 63 % [82] 18 Ni/SAPO-11 n-hexane hydroisomerization to isohexane 2 MPa, 340 °C X = 71.2 %,S = 66.7 % [7] 19 Pt/HL n-hexane hydroisomerization to isohexane 340 °C X = 61.4 %,S = 96.7 % [83] X = conversion, S = selectivity. Review Paper Advances in the preparation and application of nanoconfined metal catalysts composed of porous materials Liang Li Writing – original draft Methodology Data curation Conceptualization a Jiamin Liang Formal analysis Data curation a Jinwei Zhu Writing – review & editing Conceptualization b ⁎ Yongxiang Zhao Investigation Conceptualization a Hao Wang Writing – review & editing Investigation Funding acquisition Conceptualization a ⁎ a Engineering Research Center of Ministry of Education for Fine Chemicals, School of Chemistry and Chemical, Engineering, Shanxi University, Taiyuan 030006, PR China Engineering Research Center of Ministry of Education for Fine Chemicals School of Chemistry and Chemical Engineering Shanxi University Taiyuan 030006 PR China aEngineering Research Center of Ministry of Education for Fine Chemicals, School of Chemistry and Chemical, Engineering, Shanxi University, Taiyuan 030006, PR China b School of Humanities and Social Sciences, Shanxi Medical University, Taiyuan 030001, PR China School of Humanities and Social Sciences Shanxi Medical University Taiyuan 030001 PR China bSchool of Humanities and Social Sciences, Shanxi Medical University, Taiyuan 030001, PR China ⁎ Corresponding authors. Nanoconfinement catalysis is becoming a research hotspot in the field of catalytic reactions due to its potential to enhance catalytic performance. Porous nanoconfined catalysts are designed by dispersing nanoparticles of active metal into porous support through various synthesis methods. This kind of catalyst can utilize the confinement effect of the pores to precisely regulate the dispersion and particle size of the metal particles, and then improve their catalytic activity and stability. During the process of catalytic reaction, the confinement effect of the pores in porous materials can effectively optimize the electronic states of the metal active components. Furthermore, the shape-selectivity of the pore channels can significantly improve the selectivity of the reaction products. This paper provides a comprehensive review of recent synthesized strategies for pore-confined metal nano-catalysts and their catalytic applications, and then delves into the mechanism by which the pore-confinement effect enhances catalytic activity, product selectivity, and the stability of catalysts. Specifically, the discussion is focused on various synthesis methods for pore-confined catalysts, including in situ encapsulated, core-shell structured, two-dimensional layered, and single-atom anchored catalysts, as well as recent advances of these catalysts in different catalytic reactions. Finally, the future prospect is proposed in order to provide a guidance for the development and application of pore-confined catalysts in catalytic reaction. Graphical abstract Nanoconfinement catalysis is becoming a research hotspot in the field of catalytic reactions due to its potential to enhance catalytic performance. This paper focuses on the latest research advances of porous nano-confined materials in the field of catalysis. Image, graphical abstract Keywords Nanoconfinement effect Porous material Pore-confined catalysis Structure regulation In situ encapsulated Data availability Data will be made available on request. 1 Introduction Significant distinctions exist in both structure and performance between confined catalysts and traditional catalysts. Conventional catalysts generally feature open active sites that allow unrestricted access to reactants, which commonly results in the decrease of the selectivity and stability. In contrast, confined catalysts achieve precise control for reaction pathways by restricting active metal sites within nanoscale environments, such as pores, cavities, or interlayers [1]. Consequently, confined catalysts demonstrate remarkable advantages in complex reaction systems, and offer new opportunities for efficient and precise catalytic process. In generally, porous nanoconfinement effect mainly comes from the dispersion of metal nanoparticles or clusters into the pores or cavities of porous supports, such as zeolites [2] or carbon nanotubes [3]. In this process, the metal particles interact strongly with the pore surfaces, significantly impacting the activity, adsorption capacity, diffusivity, and stability of the materials [4,5]. As a result, these materials have widely applied in catalysis, hydrogen storage, drug separation, and other fields [6]. Specifically in catalytic reaction, nanoconfined catalysts play a crucial role in regulating the adsorption/desorption states and diffusion properties of various reactants and products through the confinement effect, which effectively enhances the selectivity of the target product. Moreover, the confinement effect facilitates the dispersion and settling of active metal particles on the surface of supports, thereby improving the catalytic efficiency of metal atoms and the anti-sintering and anti-loss ability of the catalysts [7]. So there is an important practical and theoretical significance to deeply investigate the nanoconfinement mechanism of porous catalyst and developing new synthetic method for nanoconfined catalysts. The confinement effect of supported metal catalysts is significantly influenced by the structural and property characteristics of the support materials. Key factors such as pore structure, adsorption capacity, spatial site resistance, and electronic states of the supports play a crucial role in affecting confinement effect at the nanoscale [8–10]. Porous materials are often employed as ideal supports for confined metal catalysts due to their highly ordered pore structure and excellent hydrothermal stability. As presented in Fig. 1 , the pore walls of porous material can generate electronic interactions or interfacial bonding with active metal particles, and then precisely regulate the size and electronic structure of the metal particles. This regulation not only enhances the stability of the active metal on support but also contributes to catalyze specific functional groups, thereby significantly improving the selectivity and stability of the catalysts [11]. For instance, Zhang et al. [12] utilized an isovolumetric impregnation method to load Ni onto mesoporous SBA-15 and prepared the Ni/SBA-15 catalysts. Compared with traditional catalyst with oxide support, the Ni/SBA-15 catalyst shows exceptionally high selectivity for 1,4-butenediol in the selective hydrogenation of 1,4-butynediol. Panpranot et al. [13] employed the incipient wet impregnation method to load Pd onto MCM-41 and SiO2 supports, respectively. In the reaction of hydrogenation of 1-hexene, although both catalysts exhibit similar turnover frequencies (TOF), the Pd/MCM-41 catalyst expresses superior catalytic stability, which can be attributed to the stronger pore confinement effect of the MCM-41 for active metal. In the past, it was a big challenge to prepare truly nanoconfined catalysts with porous structures due to the limitation of traditional loading and doping methods for active metal. There was also a lack of effective means to control the dispersion, placement, and particle size of active metals within the porous support, which greatly limited the application of confined catalysts. Recently, highly dispersed and uniformly sized catalysts with nanoconfinement effect have been developed and prepared successfully thanks to the emergence and application of new methods, such as in situ encapsulation [14] and single-atom anchoring [15] techniques. Yu et al. [16] prepared the in situ encapsulated Rh@S-1 catalyst by confined the active metal Rh in the five-membered ring of an S-1 zeolite. This catalyst demonstrates remarkable aniline selectivity and catalytic stability in the selective hydrogenation of nitroaromatics. Zhang et al. [17] developed a series of single-atom anchoring CoNC catalysts by anchoring single-atom Co in amino-modified carbon nanotubes. These catalysts exhibit outstanding electrocatalytic performance by effectively regulating the electronic state of confinement-activated metals through the formation of Co-N-C covalent bonds. These studies not only demonstrate the potential to enhance the catalytic performance of active metals in porous materials through optimizing the confined structure, but also open new avenues for the preparation of catalysts with nanoconfinement properties. Therefore, the selection of suitable porous materials as the support and the application of the latest synthesis techniques to prepare the catalyst with a new nanoconfined structure have high scientific research value and wide application prospects. It is well known that the traditional metal loading and doping techniques often encounter some practical challenges, such as difficulty in controlling particle size, uneven distribution, and random positioning of active metal. In contrast, nanoconfined metal catalysts offer a perfect solution to deal with these problems by confining active metals to specific regions within porous materials. The confinement effect of the porous support can precisely regulate the particle size and the location of the active metal, and finally significantly enhance the activity, selectivity, and stability of catalysts. This paper is focused on the latest research advances of porous nano-confined materials in the field of catalysis, and emphasizes the structural regulation strategies and the primary construction methods of these catalysts. Moreover, the paper discusses the structural characteristics and application areas of various types of confined catalysts. Finally, the challenges and future development of porous nano-confined catalysts are summarized and prospected. 2 Research progress of porous nanoconfined catalysts with different structures Recently, advances in synthesis technology and characterization methods have enabled the preparation of pore confined catalysts with genuine nanoconfinement effect. By modulating the structure of these catalysts, it has been able to enhance significantly their catalytic performance. The research progress on porous nanoconfined catalysts with different structures is summarized below. 2.1 Research progress of in situ encapsulated porous nanoconfined catalysts Porous materials, such as zeolites [18] and metal-organic frameworks (MOFs) [19], are highly effective to encapsulate active metal particles in their cages or pores. The confinement effect of in situ encapsulated confined catalysts can be obtained through the formation of chemical bonds between the metal particles and porous wall. Subnanometric metal clusters or metal single-atoms have been encapsulated within porous materials by ligand-stabilized or precursor-stabilized methods during the synthesis process of porous materials, which exhibited superior catalytic activity [16]. This structure promotes the uniform dispersion of metal particles on the support, and then significantly inhibits the aggregation and loss of active metal components, which improves the stability of catalyst. Moreover, in situ encapsulation has normally emerged as a methodology for fabricating porous-confined catalysts, yet the resultant architectures exhibit distinct structural characteristics similarly to other confinement structures. This technique can achieve two different active metal dispersion states along with the preparation of porous-confined catalyst: (i) single-atom sites where metal centers coordinate with oxygen ligands in cavity environments, and (ii) sub-nanometric particles (<2 nm) confined within channels of porous material. Such structure creates unique configurations including localized cationic confinement and physical deposition effects. Here, given these distinctive structure-property relationships, we also classify in situ encapsulation as a confinement architecture category. Till now, several methods are available to synthesize in situ encapsulated porous nanoconfined catalysts, such as hydrothermal synthesis, solvothermal synthesis, and seed-assisted in situ encapsulation. Li et al. [20,21] developed a Pt@Y catalyst by hydrothermally encapsulating Pt in Y zeolite, and the Pt atom is confined in a six-membered ring cage of Y zeolite (Fig. 2 A and B). They found that Pt@Y catalyst was present in Ptδ+···O2− units, which provides a unique environment for H2 activation. This catalyst demonstrated excellent semi-hydrogenation activity and selectivity for unsaturated alcohols in the selective hydrogenation reaction of α, β-unsaturated aldehydes (Fig. 2C). On this basis, a rational mechanism is proposed for the heterolytic cleavage of dihydrogen into H+ and Hδ− and selective reduction of unsaturated aldehydes. Moreover, they also synthesized a Cu@FAU catalyst by encapsulating Cu in a FAU-structured zeolite (Fig. 2D), which achieved a methanol selectivity of 89.5 % in CO2 hydrogenation to methanol, outperforming the industrialized Cu/ZnO/Al2O3 catalyst. Li et al. [22] successfully synthesized the Pd1@ZSM-5 catalyst using the seed-assisted in situ encapsulation method without templating agents. This method can confine the Pd atoms in the six-membered ring of the ZSM-5 zeolite, which results in a higher TOF of 33,582 molC=C/molPd/h in the semi-hydrogenation of phenylacetylene to styrene compared with all previously reported catalysts. Mechanism studies reveal that Pd1@ZSM-5 features Pd-O-Al/Si bonds, which makes the Pd single-atom with an electron-rich state, thereby promoting the adsorption of substrates on Pd sites and reducing the energy barrier for the semihydrogenation of alkynes. In addition, MOFs also can serve as an excellent support for encapsulated nano-confined catalysts. Yang et al. [23] encapsulated CoP in MOFs to prepare the CoP@quasi-Co-MOF-74 catalyst, which exhibited outstanding catalytic activity in the dehydrogenation process of ammonia-borane, and achieved a hydrogen generation rate of 9,790 mL/min (Fig. 3 A and B). The study reveals that the catalyst features a hierarchical pore structure comprising 1.48 nm micropores and 6.3 nm mesopores, which facilitates the transport and contact between ammonia-borane and the catalyst to accelerate ammonia-borane hydrolysis. Wang et al. [24] prepared an OPH@Zn/Co-ZIF catalyst by confining organophosphorus hydrolase (OPH) in Zn-doping Co-based MOFs using a one-pot method (Fig. 3C). This encapsulated catalyst expressed high activity and stability in the process of organophosphate esters to 4-aminophenol, achieving the complete conversion of 95 μM methyl isothiocyanate to 4-aminophenol in just 15 minutes, with nearly 100 % yield. In summary, in situ encapsulated confined catalysts can modulate the active metals at the atomic-level by the confinement effect of pores, and then prepare successfully the highly dispersed and stable metal nanoparticles or single-atom catalysts. Consequently, these catalysts can exhibit excellent activity, selectivity, and stability in many specific reactions. Although in situ encapsulated method is relatively simple and often requires only one step reaction to obtain metal precursor loaded porous materials, it is difficult for the metal precursors to be completely wrapped in the process of self-assembly of this structure in the solution, which will result in the waste of a large amount of metal precursors. The another problem is that when using this method, it is usually very difficult to accurately control the amount of metal precursor being encapsulated [25]. 2.2 Research progress of core-shell structured porous nanoconfined catalysts Core-shell structured nanoconfined catalysts are composite catalysts composed of metal nanoparticles and shell porous nanomaterials [26]. The synthesis of core-shell nanoconfined catalysts typically involves a two-step process. Initially, stable metal nanoparticles are prepared, often utilizing stabilizing agents such as polyvinylpyrrolidone (PVP) or cetyltrimethylammonium bromide (CTAB) to control particle size and prevent aggregation. Subsequently, a porous shell is constructed on the surface of the nanoparticles using strategies such as seed-assisted growth or layer-by-layer deposition. For core-shell nanoconfined catalysts, the active metal particles as a core are confined within the interior of porous shells. Not only does the shape-selectivity of the porous shell significantly enhance the selectivity of the target product, but the confinement effect of the nano-shell also notably improves the stability of the catalyst [27]. Xiao et al. [28] successfully prepared a kind of Pd@S-1 zeolite catalyst with a core-shell structure using solvent-free method (Fig. 4 A). This catalyst demonstrated superior catalytic activity and furan selectivity in the furfural hydrogenation reaction compared with the Pd/S-1 catalyst prepared by traditional methods. The density functional theory (DFT) calculations in the case show that the adsorption energy of furan in the Pd@S-1 catalyst is significantly lower than that of other molecules, indicating that furan has the fastest diffusion rate in the micropores of S-1 supports. Therefore, the catalyst exhibits excellent furan selectivity in the furfural hydrogenation reaction. Xu et al. [29] synthesized CdS@ZIF-8 photocatalysts using a two-step method, which involved the growth of a ZIF-8 MOFs on CdS nanoparticles (Fig. 4B). These photocatalysts exhibited excellent catalytic activity and selectivity in the photocatalytic reaction for formic acid to hydrogen, and the by-product CO generation amount is only 3.2 %, which is far lower than that of CdS nanoparticles (12.5 %). Ma et al. [30] successfully developed the Fe3O4@ZSM-5 zeolite catalyst with core-shell structure by encapsulating Fe3O4 colloidal cores in ZSM-5 zeolite with a stepwise crystallization method (Fig. 4C). This catalyst achieved the 95 % conversion of ethanol and the 98 % selectivity of ethylene in ethanol dehydration reactions. Tang et al. [31] prepared a Au/Snβ@mesosilica bifunctional catalyst using the deposition precipitation method, where mesoporous SiO2 covered the surface of microporous Snβ zeolites, and Sn-anchored Au nanoparticles were confined within the β zeolite pores. The catalyst showed higher conversion of glycerol (98.2 %) and the selectivity of lactic acid methyl ester (91.9 %) in glycerol reforming reactions, outperforming the Au/Snβ catalyst prepared by conventional methods. Liu et al. [32] synthesized a kind of PdCu@SiO2@Cu catalyst with a novel core-shell structure by the reverse microemulsion method. Here, beyond the conventional synthesis of metal nanoparticles and layer-by-layer deposition, a silylation reagent is employed to graft the reactive -NH2 group to the surface of the SiO2 shell. These grafted groups serve as anchoring sites to capture metal cations, facilitating the formation of satellite particles (Fig. 4D). The catalyst showed an ethylene selectivity of 89 % in acetylene selective hydrogenation reactions. In conclusion, core-shell structured confined catalysts effectively confine active metals in the porous shell layer, which not only optimize the interaction between reactant and active site, but also promote the generation of target product. In the meantime, the protective effect of the shell material for the active metal can effectively shield the contamination by the external environment, thus greatly improving the stability of the catalyst. In addition, although the porous shell architecture effectively disperses and stabilizes metallic nanoparticles, this protective configuration concomitantly reduces catalytic activity through restricted mass transport and diminished accessibility to active sites [33]. 2.3 Research progress of two-dimensional layered porous nanoconfined catalysts Two-dimensional layered nanoconfined catalysts are synthesized by confining active metals within the interfaces of layered materials, such as graphene and MoS2 [34]. The synthesis of two-dimensional layered materials can be broadly categorized into two primary strategies: top-down and bottom-up approaches. The top-down method involves the exfoliation or etching of bulk precursors to yield thin layers. For instance, mechanical exfoliation, liquid-phase exfoliation, or chemical etching are commonly employed. Wu et al. [35] prepared two-dimensional HOF ultrathin nanosheets via ultrasonic exfoliation and adaptively embedded nanoparticles by exploiting the reversibility of hydrogen bonds. Huang et al. [36] developed a Lewis acidic etching strategy, which selectively removed the Al layer from the MAX phase by metal cations in high-temperature molten salts to prepare MXene material. In contrast, the bottom-up approach relies on the controlled growth of two-dimensional materials from atomic or molecular precursors. A prominent example is chemical vapor deposition (CVD), which enables the synthesis of large-area, high-crystallinity two-dimensional layers, such as graphene, transition metal dichalcogenides (TMDs), and hexagonal boron nitride (h-BN) [34,37]. Subsequently, a post-treatment approach is employed to confine the active metal species within the interlayers of the two-dimensional material, resulting in the synthesis of two-dimensional layered nanoconfined catalysts. The stronger chemical bond between the interfacial layer and the active metal particles can regulate the electronic state of metal atoms, and produce an unsaturated metastable structure of active atoms, which is helpful to improve the catalytic activity of the catalyst [38,39]. Zhang et al. [40] prepared the NiFe-MOFs//G electrocatalyst by confining MOFs within the graphene interface. This catalyst demonstrated exceptional catalytic activity and stability in the oxygen evolution by electrolysis of water, achieving an overpotential of only 106 mV at a current density of 10 mA cm−2 and stable operation for over 150 hours (Fig. 5 A). According to the mechanism research, they discovered that the nanoconfinement effect from graphene multilayers induces the formation of highly reactive NiO6-FeO5 distorted octahedral species in MOF structure, which significantly enhance the efficiency of the catalytic reaction. Huo et al. [41] employed the impregnation-vacuum diffusion method to synthesize Mo2N/SBA-15/rGO catalysts, where Mo2N nano-single crystals were confined within the two-dimensional space of a zeolite/graphene composite. The as-synthesized catalysts possess large specific surface area (185 m2/g) and well-organized mesopores (3.7 nm). Meanwhile, the confinement effect significantly improved the dispersion and stability of Mo2N in the zeolite/graphene composite, resulting in a hydrogen production rate of 30.58 mmol·g−1·min−1 during the ammonia decomposition reaction. Jiang et al. [42] utilized laser molecular beam epitaxy technique to confine single atoms of Ni and Fe within nanolayer of MoS2, bending the layered MoS2 to create NiFe@MoS2 catalysts. These catalysts exhibited outstanding catalytic activity and selectivity in acidic water splitting, with an overpotential of only 67 mV at the same current density, significantly lower than that of the commercial IrO2 catalyst (338 mV). Ge et al. [43] synthesized successfully metal hydroxide organic frameworks catalysts with a two-dimensional confinement structure (2D d-MHOFs) using hydrotalcite as a precursor (Fig. 5B). The ordered and stable structure was achieved by incorporating Fe, Co and Ni species in a specific sequence, resulting in an overpotential of only 207 mV in the hydrogen evolution reaction of electrolyzed water, which is considerably lower than that of traditional catalysts. In conclusion, two-dimensional layered confinement catalysts can effectively suppress metal migration and aggregation through interlayer van der Waals interaction. However, the restricted interlayer spacing typically limits their catalytic applications for small-molecule transformations. 2.4 Research progress of single-atom anchored porous nanoconfined catalysts The concept of single-atom catalysis was first proposed by the team of Academician Tao Zhang of Dalian Institute of Chemical Physics. CAS in 2011, and has quickly become the research front in the field of catalysis [44]. Over the past decade, numerous strategies for anchoring single atoms have been explored, including crystal plane control [45], interface engineering [46], strain engineering [47], and defect engineering [48]. Among these strategies, defect engineering has emerged as a particularly promising approach due to its high density of anchoring sites, local chemical environments, and simple synthesis methods. These advantages have made defect engineering widely applied in the preparation of single-atom catalysts supported by porous materials. For single-atom anchored porous nanoconfined catalysts, active metal atoms are anchored to defect sites of porous support materials by the formation of covalent bonds, and the strong metal-support interaction makes the single atom confined catalyst show excellent catalytic performance [49–51]. Zhang et al. [52] prepared a Co-N-C single-atom catalyst by one-pot roasting method, and the Co atom was anchored at the defect site of mesoporous carbon nitride material. The catalyst expressed higher catalytic activity and stability in the hydrogenation of nitroaromatics to azo compounds. Lu et al. [53] used atomic layer deposition technique to anchor single-atom Cu on the graphitic carbon nitride support at first, and further anchor Ni atoms on the support by the formation of hydroxylated Cu, successfully preparing the Ni1Cu2/g-C3N4 catalyst with a three-atom cooperative catalytic structure. The conversion of this catalyst was higher 11 times than that of the traditional Ni1/g-C3N4 catalyst in the selective hydrogenation of acetylene, along with higher ethylene selectivity and catalytic stability. The mechanism study reveals that the Ni site dynamically changes by breaking the chemical bonds of Ni-support during reactant adsorption and forming these bonds on product desorption (Fig. 6 A and B). In additional, single atom catalysts with high loading amount are also an important development direction in the field of single atom catalysis [54–56]. Hai et al. [57] prepared the UHD Ni1/NC single-atom catalyst by two-step annealing method, where Ni atoms were selectively anchored at the N4 defect site of the support by annealing treatment, and the loading amount of the metal was high up to 16.3wt %. Comprehensive characterization and theoretical calculations reveal that the Ni precursor migrates to the defect sites of the nitrogen carbide material in the first annealing. Further annealing removes the remaining ligands, enabling the successful anchoring of Ni atoms at the N4 sites of the nitrogen carbide. The catalyst showed excellent catalytic activity and stability in the carbon dioxide reduction reaction, which was significantly better than the Ni1/NC catalyst with low loading. Wang et al. [58] developed the Pt SACs/PCN catalyst by negative pressure annealing method, and the active metal particles were anchored on the nitrogen carbide support as single atom. The conversion rate of the catalyst was up to 71.9 mmol/gcat in the propane oxidation reaction (Fig. 6C and D). In short, porous materials, due to their large specific surface area and abundant anchoring sites, provide an ideal space and microenvironment for the loading of metal single atoms. Furthermore, through the specific post-treatment process for the catalyst, the loading capacity of the single atom catalyst can be significantly increased to meet the needs of industrial production. It is noteworthy that both in situ encapsulation technique and single-atom anchoring strategies can be employed to fabricate single-atom confined catalysts supported by porous materials. However, these methods differ significantly in their mechanisms and outcomes. In situ encapsulation technique primarily relies on spatial confinement and electrostatic interactions in the pores or cages of the material to confine metal complexes, followed by removal of ligand to yield single-atom catalysts. This approach typically results in structures with exceptional stability but relatively low catalytic activity. In contrast, single-atom anchoring catalyst utilizes defect sites of the porous material to immobilize and bond with single metal atoms. The density of defect site directly influences the metal loading, which makes it possible to achieve single-atom catalysts with high metal loading and catalytic activity. By the end of this paragraph, we summarize the properties and synthesized methods of the porous nanoconfined catalysts with different structures as shown in Table 1 . 3 Application advances of porous nanoconfined catalysts Porous nanoconfined catalysts have expressed exceptional catalytic performance in selective hydrogenation, dehydrogenation, and isomerization reaction, and so on. Their unique structures can precisely control the molecular diffusion pathway and intermediate stabilization. This structural advantage significantly enhances product selectivity of reaction, and effectively restrains the catalyst deactivation through spatial restriction for metal sintering [59]. Here, we illustrate in detail the application advances of porous nanoconfined catalysts to deeply understand the advantages and generality of porous confined catalysis in some important chemical reactions, including syngas to olefin, dehydrogenation of n-alkanes, and synthesis of fine chemicals. 3.1 Application of porous nanoconfined catalysts in syngas to olefin reactions Syngas to olefin reaction is an important catalytic process in energy industry, which transforms the syngas (CO/H2) derived from coal, natural gas or biomass into light olefins (C2-C4) and chemicals. This technology not only enhances the high-value utilization of coal resources, but also reduces the dependence on conventional petroleum-based route. However, the intrinsic challenge of competitive C-C coupling reaction and the requisite high temperature inevitably leads to unsatisfactory catalytic performance, expressing as poor product selectivity and catalyst stability [60]. According to the previous research works, the porous nanoconfined metal catalysts play a crucial role in syngas to olefin reactions. The shape selectivity of nanopores can change the diffusion pathways of reaction intermediates in syngas-to-olefin reaction, selectively allowing molecules with suitable sizes (e.g., ethylene, propylene) to pass, thereby significantly enhancing the selectivity of target product. Furthermore, compared to traditional open catalytic systems, the nanoconfinement effect markedly improves the stability and anti-sintering capability of confined catalysts. This is attributed to the confined mobility of active metals within the nanopores, which prevents aggregation and deactivation under harsh reaction conditions [61,62]. Hu et al. [63] developed a Fe@n-hS-HT catalyst with a core-shell structure using melt recrystallization technique, and the Fe species were encapsulated in the cavities of hollow S-1 zeolite, which effectively prevented the loss of active components. This catalyst exhibited significantly higher activity and light olefin selectivity in the syngas to olefin reaction compared with the Fe/S-1 catalyst synthesized by the conventional impregnation method. Xu et al. [64] encapsulated Fe and Mn active metal species with porous SiO2 as the shell layer, and then prepared the FeMn@Si catalyst with excellent hydrophobicity by the hydrophobic modification for surface (Fig. 7 A). In the process of syngas to olefins, the porous hydrophobic shell of this catalyst significantly suppressed the side reaction of water-gas shift and prevented the oxidation of the active component of iron carbide, demonstrating higher CO conversion rate with 56.1 % and light olefin selectivity with 83.3 % than traditional non-porous ε-Fe2C catalysts. In addition, the application of metal oxide-zeolite bifunctional catalysts in the process of the syngas to light olefin has also drawn a widespread attention. Bao et al. [65] combined the spinel structure ZnCrOx with SAPO-34 zeolites to successfully prepare a ZnCrOx/SAPO bifunctional catalyst. This catalyst achieved a CO conversion rate of 17 % and a selectivity for light olefin of 80 % in the direct conversion of syngas to light olefin. Mechanism studies reveal that CO is activated on the surface of ZnCrOx at first, and then diffuse into the zeolite pores where it participates in coupling reactions to generate light olefins. On this basis, Wang et al. [66] employed a sequential template method to develop a ZnCrOx/SAPO bifunctional catalyst with a hollow multi-shell structure, which achieved a remarkable light olefin selectivity of up to 90 % in the syngas to olefin reaction (Fig. 7B). Subsequently, Bao et al. [67] prepared the GeAlPO-18 molecular sieve catalysts with metal Ge ion isomorphous substitution by hydrothermal synthesis method, and the catalyst demonstrated extremely high catalytic activity in the syngas to olefin reaction. Both the CO conversion rate and the selectivity for light olefin exceeded 80 %, which was higher than that of all previously reported catalysts. Characterization and theoretical calculations demonstrate that the active sites of Brønsted acid improve the conversion rate of ketene intermediates to olefins as well as inhibit the secondary reactions of hydrogenation and oligomerization of olefin (Fig. 7C). 3.2 Application of porous nanoconfined catalysts in dehydrogenation of n-alkanes reactions The dehydrogenation of n-alkanes to olefin plays an important role in reducing petroleum energy consumption and solving the problem of olefin supply and demand. But dehydrogenation of n-alkanes is easily overoxidized to form valueless CO2, which limits its practical application. The nanoconfinement effect effectively stabilizes key reaction intermediates (e.g., alkyl radicals) generated during the catalytic process, thereby suppressing their decomposition and undesired side reactions, which consequently enhances the selectivity toward alkene [68]. Xiao et al. [69] constructed isolated B centers in pure silica MFI zeolites, and successfully synthesized a BS-1 catalyst by solvent-free method. The catalyst not only effectively activates molecular oxygen and propane to promote dehydrogenation, but also significantly reduces the energy barrier for C3H7 intermediate formation. (Fig. 8 A). The catalytic activity and stability are far superior to the traditional non-porous supported boron oxide catalytic materials, and the selectivity of propylene is more than 80 %. Lu et al. [70] successfully synthesized a BZEO-2 catalyst by doping the active component B in ZEO-2 zeolite with a MWW structure (Fig. 8B), and this catalyst has a high propylene selectivity up to 83.6 % in the dehydrogenation of propane. Farzaneh et al. [71] confined VOX within the UiO-66 metal organic framework (MOFs) using one-pot method, and successfully synthesized the V/UiO-66 catalyst (Fig. 8C). The abundant organic ligands of this catalyst not only stabilize the V species but also effectively prevent the direct contact between reactants and metal oxides, which results in the higher catalytic activity and propylene selectivity than VOX/γ-Al2O3 in the propane dehydrogenation reaction. Liu et al. [72] prepared the NiSn@S-1 bimetallic catalyst via a one-step hydrothermal synthesis method and the catalyst exhibits excellent catalytic activity and selectivity for the target product in the propane dehydrogenation reaction, with a propylene selectivity of over 88 % (Fig. 8D). The study reveals that the confined microenvironment effectively stabilizes both the 2-propyl intermediate and NiSn subnanoclusters. Zhou et al. [73] prepared a kind of Ru1/NC single-atom catalyst by anchoring Ru to carbon nitride materials with the ball milling method (Fig. 8E). In the process of propane dehydrogenation, the catalyst displayed exceptional catalytic performance and stability, reaching a high propylene selectivity of 92 %. There is no doubt that the porous nanoconfined catalyst demonstrates an excellent selectivity of propylene and catalytic stability in the dehydrogenation reaction of propane. However, significant challenges also persist in achieving great improvement for catalytic activity. 3.3 Application of porous nanoconfined catalysts in synthesis of fine chemicals Generally speaking, the structure of the synthetic raw materials for high-value fine chemicals is relatively complex, there may be two or more functional groups such as CC, C=C, C=O, so the choice of catalyst in the reaction becomes the key factor for synthesis of fine chemicals [74]. The porous nanoconfined catalysts express exceptional selectivity in fine chemical synthesis because of its tailored metal coordination environment that can precisely activate specific functional groups as well as suppress competing reaction pathways [75]. Li et al. [76] prepared an in situ encapsulated Pd@MFI catalyst using microporous zeolite with MFI structure as support, which obtained furan, furfuryl alcohol and 1,5-pentanediol products with correspondingly high selectivity according to the different supports (silicalite-1, Na-ZSM-5 and H-ZSM-5, respectively) in the selective hydrogenation reaction of furfural. Chen et al. [77] developed a Pt@HA catalyst by sol-gel method, and the active metal Pt atoms are confined in the frame of zeolite, which can avoid the direct interaction between the furfural and the active metal. The catalyst exhibited excellent activity and selectivity of furfuryl alcohol (approaching 100 %) in the hydrogenation of furfural, since the reaction was efficiently catalyzed by hydrogen spillover (Fig. 9 A). An in situ encapsulated Pt@ZSM-48 catalyst using a one-pot method was synthesized by Zhang et al. [78]. The catalyst demonstrated high catalytic activity and 1,4-butynediol (BED) selectivity in the hydrogenation of 1,4-butynediol (BYD) (Fig. 9B). The DFT calculations demonstrate that the ZSM-48 channels exhibit strong adsorption ability toward BYD and the weaker adsorption for BED, which facilitates the faster diffusion of BED through the zeolite pores. In addition, the narrow pores (∼0.6nm) of ZSM-48 inhibit the process of BYD isomerization, thus exhibiting higher BED selectivity than that of non-porous materials. Jia et al. [79] applied a host-guest synthesis strategy to confined Co precursors in MOFs, and successfully synthesized the Co/ZIF-1000 monoatomic catalyst after high temperature calcination. The catalyst achieved a 99.9 % conversion of styrene and 71 % selectivity of phenylene oxide ethane in the styrene epoxidation reaction, which was significantly superior to the non-porous Co2O3 catalyst. The confined Co-N3 structure significantly reduces the energy barrier for the conversion of transition state 4 (TS4) to styrene oxide, thus enhancing the catalyst's selectivity (Fig. 9C). Yang et al. [80] prepared a Ru/β monoatomic catalyst by initial wet impregnation method, in which Ru atoms were anchored on the Lewis acidic sites of the β zeolite and uniformly dispersed on the support (Fig. 9D). The catalyst showed high catalytic activity and 93 % selectivity for epoxidation of styrene. In conclusion, porous nanoconfined catalysts can achieve high selectivity and stability in the synthesis of high-value fine chemicals by regulating the distribution and location of active metal sites. Further exploration of porous confined catalysts in fine chemical synthesis should be actively pursued. 3.4 Application of porous nanoconfined catalysts in other reactions Besides the above mentioned reactions, nanoconfined catalysts also demonstrate exceptional catalytic performance in other reaction processes, such as CO2 hydrogenation, hydroisomerization of n-alkane and so on. The nanoscale channels of these catalysts precisely control the formation of intermediates and products in these hydrogenation reactions by their unique spatial confinement effects. Liu et al. [81] successfully designed a Mo3S4@NaZSM-5 catalyst for CO2 hydrogenation to methanol by confining Mo3S4 clusters in 10-membered rings (10-MR) of NaZSM-5 zeolite through a mechanical mixing and calcination method (Fig. 10 A). Based on the DFT calculations and operando FT-IR spectra results, they find that CO2 convert to methanol by various intermediates like *CO, *CHO, *CH2O, and *CH3O in the confined catalytic system (Fig. 10B). Zeng et al. [82] synthesized a core-shell structured Cu/MoS2@SiO2 catalyst by uniformly depositing a silica shell on the surface of MoS2 nanoparticles and anchoring Cu at MoS2 (Fig. 10C and D). This catalyst showed excellent performance in CO2 hydrogenation to methanol, achieving a methanol selectivity of 72 % and a CO2 conversion rate of 12 %, significantly superior the commercial Cu/ZnO/Al2O3 catalyst. In addition, Lv et al. [7] synthesized a Ni/SAPO-11 catalyst with one-pot method, in which the active Ni species were confined in the zeolite framework. Compared to the catalyst prepared by conventional impregnation method, this catalyst exhibited superior catalytic performance in n-hexane hydroisomerization, achieving a high n-hexane conversion rate of 71.2 % and an isohexane selectivity of 66.7 % (Fig. 11 A). Zhang et al. [83] obtained a Pt/HL catalyst by in-situ encapsulation technique, which confined Pt nanoparticles within the 12-MR of HL. In the hydroisomerization process of n-hexane, the catalyst demonstrated a high conversion rate of n-hexane (61.4 %) and an exceptional selectivity of isomer (96.7 %) (Fig. 11B). Wang et al. [84] successfully prepared Pd-SnOx@MFI catalysts with an ethylenediamine-assisted encapsulation strategy that confined Pd and Sn nanoparticles within MFI zeolite frameworks. This catalyst exhibited superior performance in the direct synthesis of hydrogen peroxide from hydrogen and oxygen, steadily outperforming the catalysts tested previously. The catalytic performances of porous nanoconfined catalysts in different reactions are partly listed in Table 2 . 4 Conclusion and prospects As an important branch of modern catalysis science, confined catalysis not only enhances the stability of the active component and optimizes its electronic structure through the exquisitely designed nano-space to confine the active component, but also promotes the formation of reaction intermediates and the diffusion of products in the catalytic process, thus achieving synchronous improvement of catalytic activity, selectivity and stability. Porous materials are often selected as an ideal support for confined catalysts due to their highly ordered pore structure and excellent hydrothermal stability. When active metal particles are loaded on these porous materials, the pore wall of the porous material can produce electronic interaction or interface bonding with the active metal particles, which enhances the stability of the metal particles and the selective catalytic ability for specific functional groups, thus significantly improving the selectivity and stability of the catalyst. This review systematically summarizes several innovative strategies for improving active metal dispersion and stability by utilizing the unique confinement effect of porous materials in the design of metal catalysts. Meanwhile, this article also conducts an in-depth analysis of the latest advances for these confined catalysts in various application fields, and provides a comprehensive summary and review. After winning the 2024 Future Science Award, Prof. Yadong Li predicted that single-atom catalysts would be industrialized on a large scale within two or three years. However, the low metal loading amount of single-atom catalysts significantly limits their potential for industrial application. Therefore, increasing the metal loading of single-atom catalysts, developing new catalytic reactions, advancing advanced characterization techniques, and deepening the theoretical understanding of single-atom catalysis have become the key factors to overcoming the industrialization challenges of single-atom catalysts. The regular pore structure and numerous anchoring sites of porous confined metal catalysts have become a key strategy for synthesizing high-loading single-atom catalysts. Future research on porous nano-confined catalysts may focus on three main aspects: i) to precisely control the size, shape, and distribution of the pores in porous nanomaterials, so as to maximize mass transfer efficiency and the accessibility of catalytic active sites; ii) to understand the confinement effect of the catalyst on reaction pathways, interface structures and catalytic performance, and to study the mechanism of confined catalysis by using the latest in situ characterization technology; iii) to resolve the issue of large-scale preparation of porous nanoconfined catalysts, and to facilitate the practical application of the catalysts in energy conversion, environmental governance and other fields. In summary, future research on porous nanoconfined catalysts will focus on precise control, performance optimization, and large-scale production. This development trend indicates that the catalysis field is on the verge of ushering in a new round of technological innovation and industrial upgrading. CRediT authorship contribution statement Liang Li: Writing – original draft, Methodology, Data curation, Conceptualization. Jiamin Liang: Formal analysis, Data curation. Jinwei Zhu: Writing – review & editing, Conceptualization. Yongxiang Zhao: Investigation, Conceptualization. Hao Wang: Writing – review & editing, Investigation, Funding acquisition, Conceptualization. Declaration of competing interest The authors declare that they have no known competing financial interests or personal relationships that could have appeared to influence the work reported in this paper. Acknowledgement This work was financially supported by the National Natural Science Foundation of China (Grant No. 22272097) and the Research Project Supported by Shanxi Scholarship Council of China (2023-019). References [1] Y. Wang J. Mao X. Meng L. Yu D. Deng X. Bao Catalysis with two-dimensional materials confining single atoms: concept, design, and applications Chem. Rev. 119 3 2019 1806 1854 10.1021/acs.chemrev.8b00501 Y. Wang, J. Mao, X. Meng, L. Yu, D. Deng, X. Bao, Catalysis with two-dimensional materials confining single atoms: concept, design, and applications, Chem. Rev. 119(3) (2019) 1806-1854. https://doi.org/10.1021/acs.chemrev.8b00501. [2] Y. Chai W. Dai G. Wu N. Guan L. Li Confinement in a Zeolite and zeolite catalysis Acc. Chem. Res. 54 13 2021 2894 2904 10.1021/acs.accounts.1c00274 Y. Chai, W. Dai, G. Wu, N. Guan, L. Li, Confinement in a Zeolite and zeolite catalysis, Acc. Chem. Res. 54(13) (2021) 2894-2904. https://doi.org/10.1021/acs.accounts.1c00274. [3] Z. Zhang Y. Xu D. Xiong J. Yu J. Cai Y. Huang Z. Yang Improving sulfur transformation of lean electrolyte lithium–sulfur battery using nickel nanoparticles encapsulated in N-doped carbon nanotubes Electron 2 1 2024 e19 10.1002/elt2.19 Z. Zhang, Y. Xu, D. Xiong, J. Yu, J. Cai, Y. Huang, Z. Yang, Improving sulfur transformation of lean electrolyte lithium–sulfur battery using nickel nanoparticles encapsulated in N-doped carbon nanotubes, Electron 2(1) (2024) e19. https://doi.org/10.1002/elt2.19. [4] H.M. Jeong Y. Kwon J.H. Won Y. Lum M.J. Cheng K.H. Kim M. Head-Gordon J.K. Kang Atomic-scale spacing between copper facets for the electrochemical reduction of carbon dioxide Adv. Energy Mater. 10 10 2020 1903423 10.1002/aenm.201903423 H. M. Jeong, Y. Kwon, J. H. Won, Y. Lum, M. J. Cheng, K.H. Kim, M. Head-Gordon, J.K. Kang, Atomic-scale spacing between copper facets for the electrochemical reduction of carbon dioxide, Adv. Energy Mater. 10(10) (2020) 1903423. https://doi.org/10.1002/aenm.201903423. [5] S. Wu X. Yang C. Janiak Confinement effects in zeolite-confined noble metals Angew. Chem. Int. Ed. 58 36 2019 12340 12354 10.1002/anie.201900013 S. Wu, X. Yang, C. Janiak, Confinement effects in zeolite-confined noble metals, Angew. Chem. Int. Ed. 58(36) (2019) 12340-12354. https://doi.org/10.1002/anie.201900013. [6] T. Zheng J. Jiang J. Wang S. Hu W. Ding Z. Wei Regulation of electrocatalysts based on confinement-induced properties Acta Phys.-Chim. Sin. 37 11 2021 2011027 10.3866/PKU.WHXB202011027 T Zheng, J Jiang, J Wang, S Hu, W Ding, Z Wei. Regulation of electrocatalysts based on confinement-induced properties. Acta Phys.-Chim. Sin. 2021, 37(11), 2011027. https://doi.org/10.3866/PKU.WHXB202011027. [7] Y. Lyu Z. Yu Y. Yang Y. Liu X. Zhao X. Liu S. Mintova Z. Yan G. Zhao Metal and acid sites instantaneously prepared over Ni/SAPO-11 bifunctional catalyst J. Catal. 374 2019 208 216 10.1016/j.jcat.2019.04.031 Y. Lyu, Z. Yu, Y. Yang, Y. Liu, X. Zhao, X. Liu, S. Mintova, Z. Yan, G. Zhao, Metal and acid sites instantaneously prepared over Ni/SAPO-11 bifunctional catalyst, J. Catal. 374 (2019) 208-216. https://doi.org/10.1016/j.jcat.2019.04.031. [8] Z. Zhou F. Yu J. Ma Nanoconfinement engineering for enchanced adsorption of carbon materials, metal–organic frameworks, mesoporous silica, MXenes and porous organic polymers: a review Environ. Chem. Lett. 20 1 2022 563 595 10.1007/s10311-021-01355-z Z. Zhou, F. Yu, J. Ma, Nanoconfinement engineering for enchanced adsorption of carbon materials, metal–organic frameworks, mesoporous silica, MXenes and porous organic polymers: a review, Environ. Chem. Lett. 20(1) (2022) 563-595. https://doi.org/10.1007/s10311-021-01355-z. [9] S. Liu X. Liao Q. Zhang Y. Zhang H. Wang Y. Zhao Crystal-plane and shape influences of nanoscale CeO2 on the activity of Ni/CeO2 catalysts for maleic anhydride hydrogenation Nanomaterials 12 5 2022 762 10.3390/nano12050762 S. Liu, X. Liao, Q. Zhang, Y. Zhang, H. Wang, Y. Zhao, Crystal-plane and shape influences of nanoscale CeO2 on the activity of Ni/CeO2 catalysts for maleic anhydride hydrogenation, Nanomaterials 12(5) (2022) 762. https://doi.org/10.3390/nano12050762. [10] Q. Zhang X. Liao S. Liu H. Wang Y. Zhang Y. Zhao Tuning particle sizes and active sites of Ni/CeO2 catalysts and their influence on maleic anhydride hydrogenation Nanomaterials 12 13 2022 2156 10.3390/nano12132156 Q. Zhang, X. Liao, S. Liu, H. Wang, Y. Zhang, Y. Zhao, Tuning particle sizes and active sites of Ni/CeO2 catalysts and their influence on maleic anhydride hydrogenation, Nanomaterials 12(13) (2022) 2156. https://doi.org/10.3390/nano12132156. [11] L. Zhang M. Zhou A. Wang T. Zhang Selective hydrogenation over supported metal catalysts: from nanoparticles to single atoms Chem. Rev. 120 2 2020 683 733 10.1021/acs.chemrev.9b00230 L. Zhang, M. Zhou, A. Wang, T. Zhang, Selective hydrogenation over supported metal catalysts: from nanoparticles to single atoms, Chem. Rev. 120(2) (2020) 683-733. https://doi.org/10.1021/acs.chemrev.9b00230. [12] J. Zhang T. Zuo J. Lu Tuning catalytic performance of Ni-based catalyst supported on molecular sieve in hydrogenation of 1,4-butynediol to 1,4-butenediol Pet. Process. Petrochem. 52 09 2021 25 30 10.3969/j.issn.1005-2399.2021.09.007 J. Zhang, T. Zuo, J. Lu. Tuning catalytic performance of Ni-based catalyst supported on molecular sieve in hydrogenation of 1,4-butynediol to 1,4-butenediol. Pet. Process. Petrochem. 2021;52(09):25-30. https://doi.org/10.3969/j.issn.1005-2399.2021.09.007. [13] J. Panpranot K. Pattamakomsan J.G. Goodwin P. Praserthdam A comparative study of Pd/SiO2 and Pd/MCM-41 catalysts in liquid-phase hydrogenation Catal. Commun. 5 10 2004 583 590 10.1016/j.catcom.2004.07.008 J. Panpranot, K. Pattamakomsan, J.G. Goodwin, P. Praserthdam, A comparative study of Pd/SiO2 and Pd/MCM-41 catalysts in liquid-phase hydrogenation, Catal. Commun. 5(10) (2004) 583-590. https://doi.org/10.1016/j.catcom.2004.07.008. [14] M. Javed S. Cheng G. Zhang C.C. Amoo J. Wang P. Lu C. Lu C. Xing J. Sun N. Tsubaki A facile solvent-free synthesis strategy for Co-imbedded zeolite-based Fischer-Tropsch catalysts for direct gasoline production Chin. J. Catal. 41 4 2020 604 612 10.1016/S1872-2067(19)63436-4 M. Javed, S. Cheng, G. Zhang, C.C. Amoo, J. Wang, P. Lu, C. Lu, C. Xing, J. Sun, N. Tsubaki, A facile solvent-free synthesis strategy for Co-imbedded zeolite-based Fischer-Tropsch catalysts for direct gasoline production, Chin. J. Catal. 41(4) (2020) 604-612. https://doi.org/10.1016/S1872-2067(19)63436-4. [15] H. Liang B. Zhang P. Gao X. Yu X. Liu X. Yang H. Wu L. Zhai S. Zhao G. Wang A.P. van Bavel Y. Qin Strong Co-O-Si bonded ultra-stable single-atom Co/SBA-15 catalyst for selective hydrogenation of CO2 to CO Chem Catal. 2 3 2022 610 621 10.1016/j.checat.2022.01.020 H. Liang, B. Zhang, P. Gao, X. Yu, X. Liu, X. Yang, H. Wu, L. Zhai, S. Zhao, G. Wang, A.P. van Bavel, Y. Qin, Strong Co-O-Si bonded ultra-stable single-atom Co/SBA-15 catalyst for selective hydrogenation of CO2 to CO, Chem Catal. 2(3) (2022) 610-621. https://doi.org/10.1016/j.checat.2022.01.020. [16] Q. Sun N. Wang T. Zhang R. Bai A. Mayoral P. Zhang Q. Zhang O. Terasaki J. Yu Zeolite-encaged single-atom rhodium catalysts: highly-efficient hydrogen generation and shape-selective tandem hydrogenation of nitroarenes Angew. Chem. Int. Ed. 58 51 2019 18570 18576 10.1002/anie.201912367 Q. Sun, N. Wang, T. Zhang, R. Bai, A. Mayoral, P. Zhang, Q. Zhang, O. Terasaki, J. Yu, Zeolite-encaged single-atom rhodium catalysts: highly-efficient hydrogen generation and shape-selective tandem hydrogenation of nitroarenes, Angew. Chem. Int. Ed. 58(51) (2019) 18570-18576. https://doi.org/10.1002/anie.201912367. [17] C. Zhao, J. Liu, J. Wang, C. Wang, X. Guo, X. Li, X. Chen, L. Song, B. Li, Q. Zhang, A clicking confinement strategy to fabricate transition metal single-atom sites for bifunctional oxygen electrocatalysis, Sci. Adv. 8(11) eabn5091. doi:10.1126/sciadv.abn5091. [18] S. Ma X. Li Z. Yang H. Li Size effect of encapsulated metal within zeolite: biomass, CO2 and methane utilization J. Catal. 417 2023 368 378 10.1016/j.jcat.2022.12.010 S. Ma, X. Li, Z. Yang, H. Li, Size effect of encapsulated metal within zeolite: biomass, CO2 and methane utilization, J. Catal. 417 (2023) 368-378. https://doi.org/10.1016/j.jcat.2022.12.010. [19] L. Chen R. Luque Y. Li Controllable design of tunable nanostructures inside metal–organic frameworks Chem. Soc. Rev. 46 15 2017 4614 4630 10.1039/C6CS00537C L. Chen, R. Luque, Y. Li, Controllable design of tunable nanostructures inside metal–organic frameworks, Chem. Soc. Rev. 46(15) (2017) 4614-4630. https://doi.org/10.1039/C6CS00537C. [20] X. Deng B. Qin R. Liu X. Qin W. Dai G. Wu N. Guan D. Ma L. Li Zeolite-encaged isolated platinum ions enable heterolytic dihydrogen activation and selective hydrogenations J. Am. Chem. Soc. 143 49 2021 20898 20906 10.1021/jacs.1c09535 X. Deng, B. Qin, R. Liu, X. Qin, W. Dai, G. Wu, N. Guan, D. Ma, L. Li, Zeolite-encaged isolated platinum ions enable heterolytic dihydrogen activation and selective hydrogenations, J. Am. Chem. Soc. 143(49) (2021) 20898-20906. https://doi.org/10.1021/jacs.1c09535. [21] Y. Chai B. Qin B. Li W. Dai G. Wu N. Guan L. Li Zeolite-encaged mononuclear copper centers catalyze CO2 selective hydrogenation to methanol Natl. Sci. Rev. 10 7 2023 10.1093/nsr/nwad043 nwad043 Y. Chai, B. Qin, B. Li, W. Dai, G. Wu, N. Guan, L. Li, Zeolite-encaged mononuclear copper centers catalyze CO2 selective hydrogenation to methanol, Natl. Sci. Rev. 10(7) (2023) nwad043. https://doi.org/10.1093/nsr/nwad043. [22] H. Liu J. Li X. Liang H. Ren H. Yin L. Wang D. Yang D. Wang Y. Li Encapsulation of Pd single-atom sites in zeolite for highly efficient semihydrogenation of alkynes J. Am. Chem. Soc. 146 34 2024 24033 24041 10.1021/jacs.4c07674 H. Liu, J. Li, X. Liang, H. Ren, H. Yin, L. Wang, D. Yang, D. Wang, Y. Li, Encapsulation of Pd single-atom sites in zeolite for highly efficient semihydrogenation of alkynes, J. Am. Chem. Soc. 146(34) (2024) 24033-24041. https://doi.org/10.1021/jacs.4c07674. [23] S. Yang P. He Y. Tian Y. Luo J. Jiang In situ encapsulating cobalt phosphide into a quasi-MOF: a high-performance catalyst for hydrolytic dehydrogenation of ammonia borane New J. Chem. 47 6 2023 3151 3158 10.1039/D2NJ05443D S. Yang, P. He, Y. Tian, Y. Luo, J. Jiang, In situ encapsulating cobalt phosphide into a quasi-MOF: a high-performance catalyst for hydrolytic dehydrogenation of ammonia borane, New J. Chem. 47(6) (2023) 3151-3158. https://doi.org/10.1039/D2NJ05443D. [24] Z. Wang Y. Sun A hybrid nanobiocatalyst with in situ encapsulated enzyme and exsolved Co nanoclusters for complete chemoenzymatic conversion of methyl parathion to 4-aminophenol J. Hazard. Mater. 424 2022 127755 10.1016/j.jhazmat.2021.127755 Z. Wang, Y. Sun, A hybrid nanobiocatalyst with in situ encapsulated enzyme and exsolved Co nanoclusters for complete chemoenzymatic conversion of methyl parathion to 4-aminophenol, J. Hazard. Mater. 424 (2022) 127755. https://doi.org/10.1016/j.jhazmat.2021.127755. [25] L. Cao J. Zhang X. Zhang C. He Confinement synthesis in porous molecule-based materials: a new opportunity for ultrafine nanostructures Chem. Sci. 13 6 2022 1569 1593 10.1039/D1SC05983A L. Cao, J. Zhang, X. Zhang, C. He, Confinement synthesis in porous molecule-based materials: a new opportunity for ultrafine nanostructures, Chem. Sci. 13(6) (2022) 1569-1593. https://doi.org/10.1039/D1SC05983A. [26] A. Li W. Zhu C. Li T. Wang J. Gong Rational design of yolk–shell nanostructures for photocatalysis Chem. Soc. Rev. 48 7 2019 1874 1907 10.1039/C8CS00711J A. Li, W. Zhu, C. Li, T. Wang, J. Gong, Rational design of yolk–shell nanostructures for photocatalysis, Chem. Soc. Rev. 48(7) (2019) 1874-1907. https://doi.org/10.1039/C8CS00711J. [27] X. Ma Y. Li I. Hussain R. Shen G. Yang K. Zhang Core–Shell structured nanoenergetic materials: preparation and fundamental properties Adv. Mater. 32 30 2020 2001291 10.1002/adma.202001291 X. Ma, Y. Li, I. Hussain, R. Shen, G. Yang, K. Zhang, Core–Shell structured nanoenergetic materials: preparation and fundamental properties, Adv. Mater. 32(30) (2020) 2001291. https://doi.org/10.1002/adma.202001291. [28] C. Wang L. Wang J. Zhang H. Wang J.P. Lewis F.-S. Xiao Product selectivity controlled by zeolite crystals in biomass hydrogenation over a palladium catalyst J. Am. Chem. Soc. 138 25 2016 7880 7883 10.1021/jacs.6b04951 C. Wang, L. Wang, J. Zhang, H. Wang, J.P. Lewis, F.-S. Xiao, Product selectivity controlled by zeolite crystals in biomass hydrogenation over a palladium catalyst, J. Am. Chem. Soc. 138(25) (2016) 7880-7883. https://doi.org/10.1021/jacs.6b04951. [29] M. Zeng Z. Chai X. Deng Q. Li S. Feng J. Wang D. Xu Core–shell CdS@ZIF-8 structures for improved selectivity in photocatalytic H2 generation from formic acid Nano Res. 9 9 2016 2729 2734 10.1007/s12274-016-1161-3 M. Zeng, Z. Chai, X. Deng, Q. Li, S. Feng, J. Wang, D. Xu, Core–shell CdS@ZIF-8 structures for improved selectivity in photocatalytic H2 generation from formic acid, Nano Res. 9(9) (2016) 2729-2734. https://doi.org/10.1007/s12274-016-1161-3. [30] B. Ma L. Duan Y. Ma F. Bu K. Lan T. Zhao L. Chen L. Zu L. Peng Z. Zhao J. Xu S. Zhong D.M. Aldhayan A.M. Al-Enizi A. Elzatahry W. Li W. Yang D. Zhao Implanting colloidal nanoparticles into single-crystalline zeolites for catalytic dehydration Angew. Chem. Int. Ed. 2024 e202403245 10.1002/anie.202403245 n/a(n/a) B. Ma, L. Duan, Y. Ma, F. Bu, K. Lan, T. Zhao, L. Chen, L. Zu, L. Peng, Z. Zhao, J. Xu, S. Zhong, D.M. Aldhayan, A.M. Al-Enizi, A. Elzatahry, W. Li, W. Yang, D. Zhao, Implanting colloidal nanoparticles into single-crystalline zeolites for catalytic dehydration, Angew. Chem. Int. Ed. n/a(n/a) (2024) e202403245. https://doi.org/10.1002/anie.202403245. [31] B. Tang D. Wang A. Li H.-M. Tang E.-C. Yang W. Dai Constructing core-shell structured Au/snβ@mesosilica composite for one-pot base-free conversion of glycerol to methyl lactate Microporous Mesoporous Mater. 347 2023 112348 10.1016/j.micromeso.2022.112348 B. Tang, D. Wang, A. Li, H.-M. Tang, E.-C. Yang, W. Dai, Constructing core-shell structured Au/snβ@mesosilica composite for one-pot base-free conversion of glycerol to methyl lactate, Microporous Mesoporous Mater. 347 (2023) 112348. https://doi.org/10.1016/j.micromeso.2022.112348. [32] S. Liu S. Han Y. Li W. Shen Fabrication of a PdCu@SiO2@Cu core–shell–satellite catalyst for the selective hydrogenation of acetylene Dalton Trans. 53 1 2024 206 214 10.1039/D3DT03170E S. Liu, S. Han, Y. Li, W. Shen, Fabrication of a PdCu@SiO2@Cu core–shell–satellite catalyst for the selective hydrogenation of acetylene, Dalton Trans. 53(1) (2024) 206-214. https://doi.org/10.1039/D3DT03170E. [33] S. Ding S. Wu P. Wang N. Fang Q. Zhang S. Li Y. Chu Structure-selectivity relevance of multiple-component catalysts for CVOCs’ complete oxidation: State-of-the-art and perspectives Sep. Purif. Technol. 354 2025 128964 10.1016/j.seppur.2024.128964 S. Ding, S. Wu, P. Wang, N. Fang, Q. Zhang, S. Li, Y. Chu, Structure-selectivity relevance of multiple-component catalysts for CVOCs’ complete oxidation: State-of-the-art and perspectives, Sep. Purif. Technol. 354 (2025) 128964. https://doi.org/10.1016/j.seppur.2024.128964. [34] S. Gao Y. Lin X. Jiao Y. Sun Q. Luo W. Zhang D. Li J. Yang Y. Xie Partially oxidized atomic cobalt layers for carbon dioxide electroreduction to liquid fuel Nature 529 7584 2016 68 71 10.1038/nature16455 S. Gao, Y. Lin, X. Jiao, Y. Sun, Q. Luo, W. Zhang, D. Li, J. Yang, Y. Xie, Partially oxidized atomic cobalt layers for carbon dioxide electroreduction to liquid fuel, Nature 529(7584) (2016) 68-71. https://doi.org/10.1038/nature16455. [35] J. Wu P. Bag Y. Xu L. Gong C. He X. Chen J. Zhang Graphene-like hydrogen-bonded melamine-cyanuric acid supramolecular nanosheets as pseudo-porous catalyst support Adv. Mater. 33 22 2021 2007368 10.1002/adma.202007368 J. Wu, P. Bag, Y. Xu, L. Gong, C. He, X. Chen, J. Zhang, Graphene-like hydrogen-bonded melamine-cyanuric acid supramolecular nanosheets as pseudo-porous catalyst support, Adv. Mater. 33(22) (2021) 2007368. https://doi.org/10.1002/adma.202007368. [36] Y. Li H. Shao Z. Lin J. Lu L. Liu B. Duployer P. Persson P. Eklund L. Hultman M. Li K. Chen X. Zha S. Du P. Rozier Z. Chai E. Raymundo P. Taberna P. Simon Q. Huang A general Lewis acidic etching route for preparing MXenes with enhanced electrochemical performance in non-aqueous electrolyte Nat. Mater. 19 8 2020 894 899 10.1038/s41563-020-0657-0 Y. Li, H. Shao, Z. Lin, J. Lu, L. Liu, B. Duployer, P. Persson, P. Eklund, L. Hultman, M. Li, K. Chen, X. Zha, S. Du, P. Rozier, Z. Chai, E. Raymundo, P. Taberna, P. Simon, Q. Huang, A general Lewis acidic etching route for preparing MXenes with enhanced electrochemical performance in non-aqueous electrolyte, Nat. Mater. 19(8) (2020) 894-899. https://doi.org/10.1038/s41563-020-0657-0. [37] Y. Wang Z. Rong Y. Wang T. Wang Q. Du Y. Wang J. Qu Graphene-based metal/acid bifunctional catalyst for the conversion of levulinic acid to γ-valerolactone ACS Sustain. Chem. Eng. 5 2 2017 1538 1548 10.1021/acssuschemeng.6b02244 Y. Wang, Z. Rong, Y. Wang, T. Wang, Q. Du, Y. Wang, J. Qu, Graphene-based metal/acid bifunctional catalyst for the conversion of levulinic acid to γ-valerolactone, ACS Sustain. Chem. Eng. 5(2) (2017) 1538-1548. https://doi.org/10.1021/acssuschemeng.6b02244. [38] L. Tang X. Meng D. Deng X. Bao Confinement catalysis with 2D materials for energy conversion Adv. Mater. 31 50 2019 1901996 10.1002/adma.201901996 L. Tang, X. Meng, D. Deng, X. Bao, Confinement catalysis with 2D materials for energy conversion, Adv. Mater. 31(50) (2019) 1901996. https://doi.org/10.1002/adma.201901996. [39] C. Zhang C. Yang J. Zhao X. Wang W. Zhao Y. Xiao Y. Tang Sun H W. Wang Research of nanoconfinement effect for catalyst on advanced oxidation process Environ. Chem. 44 1 2025 1 13 10.7524/j.issn.0254-6108.2023071404 C. Zhang, C. Yang, J. Zhao, X. Wang, W. Zhao, Y. Xiao, Y. Tang, H, Sun, W. Wang, Research of nanoconfinement effect for catalyst on advanced oxidation process. Environ. Chem. 2025;44(1):1-13. https://doi.org/10.7524/j.issn.0254-6108.2023071404. [40] S. Lyu C. Guo J. Wang Z. Li B. Yang L. Lei L. Wang J. Xiao T. Zhang Y. Hou Exceptional catalytic activity of oxygen evolution reaction via two-dimensional graphene multilayer confined metal-organic frameworks Nat. Commun. 13 1 2022 6171 10.1038/s41467-022-33847-z S. Lyu, C. Guo, J. Wang, Z. Li, B. Yang, L. Lei, L. Wang, J. Xiao, T. Zhang, Y. Hou, Exceptional catalytic activity of oxygen evolution reaction via two-dimensional graphene multilayer confined metal-organic frameworks, Nat. Commun. 13(1) (2022) 6171. https://doi.org/10.1038/s41467-022-33847-z. [41] L. Huo X. Han L. Zhang B. Liu R. Gao B. Cao W. Wang C. Jia K. Liu J. Liu J. Zhang Spatial confinement and electron transfer moderating MoN bond strength for superior ammonia decomposition catalysis Appl. Catal. B: Environ. 294 2021 120254 10.1016/j.apcatb.2021.120254 L. Huo, X. Han, L. Zhang, B. Liu, R. Gao, B. Cao, W. Wang, C. Jia, K. Liu, J. Liu, J. Zhang, Spatial confinement and electron transfer moderating MoN bond strength for superior ammonia decomposition catalysis, Appl. Catal. B: Environ. 294 (2021) 120254. https://doi.org/10.1016/j.apcatb.2021.120254. [42] Z. Jiang W. Zhou C. Hu X. Luo W. Zeng X. Gong Y. Yang T. Yu W. Lei C. Yuan Interlayer-confined NiFe dual atoms within MoS2 electrocatalyst for ultra-efficient acidic overall water splitting Adv. Mater. 35 32 2023 2300505 10.1002/adma.202300505 Z. Jiang, W. Zhou, C. Hu, X. Luo, W. Zeng, X. Gong, Y. Yang, T. Yu, W. Lei, C. Yuan, Interlayer-confined NiFe dual atoms within MoS2 electrocatalyst for ultra-efficient acidic overall water splitting, Adv. Mater. 35(32) (2023) 2300505. https://doi.org/10.1002/adma.202300505. [43] K. Ge Y. Zhao Y. Hu Z. Wang J. Wang M. Yang H. Cui Y. Yang L. Zhu B. Shen In situ modulation of oxygen vacancies on 2D metal hydroxide organic frameworks for high-efficiency oxygen evolution reaction Small 2024 2311713 10.1002/smll.202311713 n/a(n/a) K. Ge, Y. Zhao, Y. Hu, Z. Wang, J. Wang, M. Yang, H. Cui, Y. Yang, L. Zhu, B. Shen, In situ modulation of oxygen vacancies on 2D metal hydroxide organic frameworks for high-efficiency oxygen evolution reaction, Small n/a(n/a) (2024) 2311713. https://doi.org/10.1002/smll.202311713. [44] B. Qiao A. Wang X. Yang L.F. Allard Z. Jiang Y. Cui J. Liu J. Li T. Zhang Single-atom catalysis of CO oxidation using Pt1/FeOx Nat. Chem. 3 8 2011 634 641 10.1038/nchem.1095 B. Qiao, A. Wang, X. Yang, L.F. Allard, Z. Jiang, Y. Cui, J. Liu, J. Li, T. Zhang, Single-atom catalysis of CO oxidation using Pt1/FeOx, Nat. Chem. 3(8) (2011) 634-641. https://doi.org/10.1038/nchem.1095. [45] J. Guo H. Liu D. Li J. Wang X. Djitcheu D. He Q. Zhang A minireview on the synthesis of single atom catalysts RSC Adv. 12 15 2022 9373 9394 10.1039/d2ra00657j J. Guo, H. Liu, D. Li, J. Wang, X. Djitcheu, D. He, Q. Zhang, A minireview on the synthesis of single atom catalysts, RSC Adv. 12(15) (2022) 9373-9394. https://doi.org/10.1039/d2ra00657j. [46] Z. Jiang W. Sun H. Shang W. Chen T. Sun H. Li J. Dong J. Zhou Z. Li Y. Wang R. Cao R. Sarangi Z. Yang D. Wang J. Zhang Y. Li Atomic interface effect of a single atom copper catalyst for enhanced oxygen reduction reactions Energy Environ. Sci. 12 12 2019 3508 3514 10.1039/C9EE02974E Z. Jiang, W. Sun, H. Shang, W. Chen, T. Sun, H. Li, J. Dong, J. Zhou, Z. Li, Y. Wang, R. Cao, R. Sarangi, Z. Yang, D. Wang, J. Zhang, Y. Li, Atomic interface effect of a single atom copper catalyst for enhanced oxygen reduction reactions, Energy Environ. Sci. 12(12) (2019) 3508-3514. https://doi.org/10.1039/C9EE02974E. [47] W. Song Y. Kang M. Yang Z. Li L. Chen Z. Zhao J. Liu Promoting propane dehydrogenation via strain engineering on iridium single-atom catalyst Fuel 311 2022 122580 10.1016/j.fuel.2021.122580 W. Song, Y. Kang, M. Yang, Z. Li, L. Chen, Z. Zhao, J. Liu, Promoting propane dehydrogenation via strain engineering on iridium single-atom catalyst, Fuel 311 (2022) 122580. https://doi.org/10.1016/j.fuel.2021.122580. [48] D. Wang H. Shan W. Yin H. Li Defect engineering of single-atom catalysts in biomass conversion Fuel 355 2024 129439 10.1016/j.fuel.2023.129439 D. Wang, H. Shan, W. Yin, H. Li, Defect engineering of single-atom catalysts in biomass conversion, Fuel 355 (2024) 129439. https://doi.org/10.1016/j.fuel.2023.129439. [49] B. Han Y. Guo Y. Huang W. Xi J. Xu J. Luo H. Qi Y. Ren X. Liu B. Qiao T. Zhang Strong metal–Support interactions between Pt single atoms and TiO2 Angew. Chem. Int. Ed. 59 29 2020 11824 11829 10.1002/anie.202003208 B. Han, Y. Guo, Y. Huang, W. Xi, J. Xu, J. Luo, H. Qi, Y. Ren, X. Liu, B. Qiao, T. Zhang, Strong metal–Support interactions between Pt single atoms and TiO2, Angew. Chem. Int. Ed. 59(29) (2020) 11824-11829. https://doi.org/10.1002/anie.202003208. [50] J. Xi H. Jung Y. Xu F. Xiao J. Bae S. Wang Synthesis strategies, catalytic applications, and performance regulation of single-atom catalysts Adv. Funct. Mater. 31 12 2021 2008318 10.1002/adfm.202008318 J. Xi, H. Jung, Y. Xu, F. Xiao, J. Bae, S. Wang, Synthesis strategies, catalytic applications, and performance regulation of single-atom catalysts, Adv. Funct. Mater. 31(12) (2021) 2008318. https://doi.org/10.1002/adfm.202008318. [51] H. Zhang W. Zhou T. Chen B. Guan Z. Li X. Lou A modular strategy for decorating isolated cobalt atoms into multichannel carbon matrix for electrocatalytic oxygen reduction Energy Environ. Sci. 11 8 2018 1980 1984 10.1039/C8EE00901E H. Zhang, W. Zhou, T. Chen, B. Guan, Z. Li, X. Lou, A modular strategy for decorating isolated cobalt atoms into multichannel carbon matrix for electrocatalytic oxygen reduction, Energy Environ. Sci. 11(8) (2018) 1980-1984. https://doi.org/10.1039/C8EE00901E. [52] W. Liu L. Zhang W. Yan X. Liu X. Yang S. Miao W. Wang A. Wang T. Zhang Single-atom dispersed Co–N–C catalyst: structure identification and performance for hydrogenative coupling of nitroarenes Chem. Sci. 7 9 2016 5758 5764 10.1039/C6SC02105K W. Liu, L. Zhang, W. Yan, X. Liu, X. Yang, S. Miao, W. Wang, A. Wang, T. Zhang, Single-atom dispersed Co–N–C catalyst: structure identification and performance for hydrogenative coupling of nitroarenes, Chem. Sci. 7(9) (2016) 5758-5764. https://doi.org/10.1039/C6SC02105K. [53] J. Gu M. Jian L. Huang Z. Sun A. Li Y. Pan J. Yang W. Wen W. Zhou Y. Lin H. Wang X. Liu L. Wang X. Shi X. Huang L. Cao S. Chen X. Zheng H. Pan J. Zhu S. Wei W. Li J. Lu Synergizing metal–support interactions and spatial confinement boosts dynamics of atomic nickel for hydrogenations Nat. Nanotechnol. 16 10 2021 1141 1149 10.1038/s41565-021-00951-y J. Gu, M. Jian, L. Huang, Z. Sun, A. Li, Y. Pan, J. Yang, W. Wen, W. Zhou, Y. Lin, H. Wang, X. Liu, L. Wang, X. Shi, X. Huang, L. Cao, S. Chen, X. Zheng, H. Pan, J. Zhu, S. Wei, W. Li, J. Lu, Synergizing metal–support interactions and spatial confinement boosts dynamics of atomic nickel for hydrogenations, Nat. Nanotechnol. 16(10) (2021) 1141-1149. https://doi.org/10.1038/s41565-021-00951-y. [54] X. Zhao Y. Li Two-electron oxygen reduction reaction by high-loading molybdenum single-atom catalysts Rare Met. 39 5 2020 455 457 10.1007/s12598-020-01415-3 X. Zhao, Y. Li, Two-electron oxygen reduction reaction by high-loading molybdenum single-atom catalysts, Rare Met. 39(5) (2020) 455-457. https://doi.org/10.1007/s12598-020-01415-3. [55] M. Pang M. Yang H. Zhang Y. Shen Z. Kong J. Ye C. Shan Y. Wang J. An W. Li X. Gao J. Song Synthesis techniques, mechanism, and prospects of high-loading single-atom catalysts for oxygen reduction reactions Nano Res. 2024 10.1007/s12274-024-6923-8 M. Pang, M. Yang, H. Zhang, Y. Shen, Z. Kong, J. Ye, C. Shan, Y. Wang, J. An, W. Li, X. Gao, J. Song, Synthesis techniques, mechanism, and prospects of high-loading single-atom catalysts for oxygen reduction reactions, Nano Res. (2024). https://doi.org/10.1007/s12274-024-6923-8. [56] Z. Deng Y. Liu J. Lin W. Chen Rational design and energy catalytic application of high-loading single-atom catalysts Rare Met. 2024 10.1007/s12598-024-02727-4 Z. Deng, Y. Liu, J. Lin, W. Chen, Rational design and energy catalytic application of high-loading single-atom catalysts, Rare Met. (2024). https://doi.org/10.1007/s12598-024-02727-4. [57] X. Hai S. Xi S. Mitchell K. Harrath H. Xu D. Akl D. Kong J. Li Z. Li T. Sun H. Yang Y. Cui C. Su X. Zhao J. Li J. Pérez J. Lu Scalable two-step annealing method for preparing ultra-high-density single-atom catalyst libraries Nat. Nanotechnol. 17 2 2022 174 181 10.1038/s41565-021-01022-y X. Hai, S. Xi, S. Mitchell, K. Harrath, H. Xu, D. Akl, D. Kong, J. Li, Z. Li, T. Sun, H. Yang, Y. Cui, C. Su, X. Zhao, J. Li, J. Pérez, J. Lu, Scalable two-step annealing method for preparing ultra-high-density single-atom catalyst libraries, Nat. Nanotechnol. 17(2) (2022) 174-181. https://doi.org/10.1038/s41565-021-01022-y. [58] Y. Wang C. Li X. Han J. Bai X. Wang L. Zheng C. Hong Z. Li J. Bai K. Leng Y. Lin Y. Qu General negative pressure annealing approach for creating ultra-high-loading single atom catalyst libraries Nat. Commun. 15 1 2024 5675 10.1038/s41467-024-50061-1 Y. Wang, C. Li, X. Han, J. Bai, X. Wang, L. Zheng, C. Hong, Z. Li, J. Bai, K. Leng, Y. Lin, Y. Qu, General negative pressure annealing approach for creating ultra-high-loading single atom catalyst libraries, Nat. Commun. 15(1) (2024) 5675. https://doi.org/10.1038/s41467-024-50061-1. [59] S. Ding S. Wu N. Fang Y. Chu P. Wang L. Ding Design and synthesis of porous nano-confined catalysts for VOCs oxidation: A critical review based on pollutant sorts Sep. Purif. Technol. 352 2025 128158 10.1016/j.seppur.2024.128158 S. Ding, S. Wu, N. Fang, Y. Chu, P. Wang, L. Ding, Design and synthesis of porous nano-confined catalysts for VOCs oxidation: A critical review based on pollutant sorts, Sep. Purif. Technol. 352 (2025) 128158. https://doi.org/10.1016/j.seppur.2024.128158. [60] Z. Shi A. Bhan Methanol-to-olefins catalysis on window-cage type zeolites/zeotypes with syngas co-feeds: understanding syngas-to-olefins chemistry J. Catal. 413 2022 913 922 10.1016/j.jcat.2022.07.035 Z. Shi, A. Bhan, Methanol-to-olefins catalysis on window-cage type zeolites/zeotypes with syngas co-feeds: understanding syngas-to-olefins chemistry, J. Catal. 413 (2022) 913-922. https://doi.org/10.1016/j.jcat.2022.07.035. [61] H. Yu C. Wang T. Lin Y. An Y. Wang Q. Chang F. Yu Y. Wei F. Sun Z. Jiang S. Li Y. Sun L. Zhong Direct production of olefins from syngas with ultrahigh carbon efficiency Nat. Commun. 13 1 2022 5987 10.1038/s41467-022-33715-w H. Yu, C. Wang, T. Lin, Y. An, Y. Wang, Q. Chang, F. Yu, Y. Wei, F. Sun, Z. Jiang, S. Li, Y. Sun, L. Zhong, Direct production of olefins from syngas with ultrahigh carbon efficiency, Nat. Commun. 13(1) (2022) 5987. https://doi.org/10.1038/s41467-022-33715-w. [62] H. Zao J. Yao J. Liu G. Chen W. Yi J. Xion New research progress on bifunctional catalysts for one-step direct production of low carbon olefins from syngas J. Fuel Chem. Technol. 51 01 2023 19 33 10.19906/j.cnki.jfct.2022052 H. Zao, J. Yao, J. Liu, G. Chen, W. Yi, J. Xion, New research progress on bifunctional catalysts for one-step direct production of low carbon olefins from syngas. J. Fuel Chem. Technol. 2023;51(01):19-33. https://doi.org/10.19906/j.cnki.jfct.2022052. [63] R. Hu T. Wang Y. Wang Y. Zhu L. Xie E. Xing Y. Wu Z. Da Nano-hollow zeolite-encapsulated highly dispersed ultra-fine Fe nanoparticles as Fischer–Tropsch catalyst for syngas-to-Olefins Catalysts 13 6 2023 10.3390/catal13060948 R. Hu, T. Wang, Y. Wang, Y. Zhu, L. Xie, E. Xing, Y. Wu, Z. Da, Nano-hollow zeolite-encapsulated highly dispersed ultra-fine Fe nanoparticles as Fischer–Tropsch catalyst for syngas-to-Olefins, Catalysts 13(6) (2023). https://doi.org/10.3390/catal13060948. [64] Y. Xu X. Li J. Gao J. Wang G. Ma X. Wen Y. Yang Y. Li M. Ding A hydrophobic FeMn@Si catalyst increases olefins from syngas by suppressing C1 by-products Science 371 6529 2021 610 613 10.1126/science.abb3649 Y. Xu, X. Li, J. Gao, J. Wang, G. Ma, X. Wen, Y. Yang, Y. Li, M. Ding, A hydrophobic FeMn@Si catalyst increases olefins from syngas by suppressing C1 by-products, Science 371(6529) (2021) 610-613. https://doi.org/10.1126/science.abb3649. [65] F. Jiao J. Li X. Pan J. Xiao H. Li H. Ma M. Wei Y. Pan Z. Zhou M. Li S. Miao J. Li Y. Zhu D. Xiao T. He J. Yang F. Qi Q. Fu X. Bao Selective conversion of syngas to light olefins Science 351 6277 2016 1065 1068 10.1126/science.aaf1835 F. Jiao, J. Li, X. Pan, J. Xiao, H. Li, H. Ma, M. Wei, Y. Pan, Z. Zhou, M. Li, S. Miao, J. Li, Y. Zhu, D. Xiao, T. He, J. Yang, F. Qi, Q. Fu, X. Bao, Selective conversion of syngas to light olefins, Science 351(6277) (2016) 1065-1068. https://doi.org/10.1126/science.aaf1835. [66] Z. Wang Y. Wei J. Qi J. Wan Z. Wang R. Yu D. Wang Mass transfer modulation by hollow multi-shelled structures for high space-time yield synthesis of light olefins from Syngas Adv. Funct. Mater. 2024 10.1002/adfm.202316547 Z. Wang, Y. Wei, J. Qi, J. Wan, Z. Wang, R. Yu, D. Wang, Mass transfer modulation by hollow multi-shelled structures for high space-time yield synthesis of light olefins from Syngas, Adv. Funct. Mater. (2024). https://doi.org/10.1002/adfm.202316547. [67] F. Jiao B. Bai G. Li X. Pan Y. Ye S. Qu C. Xu J. Xiao Z. Jia W. Liu T. Peng Y. Ding C. Liu J. Li X. Bao Disentangling the activity-selectivity trade-off in catalytic conversion of syngas to light olefins Science 380 6646 2023 727 730 10.1126/science.adg2491 F. Jiao, B. Bai, G. Li, X. Pan, Y. Ye, S. Qu, C. Xu, J. Xiao, Z. Jia, W. Liu, T. Peng, Y. Ding, C. Liu, J. Li, X. Bao, Disentangling the activity-selectivity trade-off in catalytic conversion of syngas to light olefins, Science 380(6646) (2023) 727-730. https://doi.org/10.1126/science.adg2491. [68] A.S. Goldman A.H. Roy Z. Huang R. Ahuja W. Schinski M. Brookhart Catalytic alkane metathesis by Tandem alkane dehydrogenation-olefin metathesis Science 312 5771 2006 257 261 10.1126/science.1123787 A.S. Goldman, A.H. Roy, Z. Huang, R. Ahuja, W. Schinski, M. Brookhart, Catalytic alkane metathesis by Tandem alkane dehydrogenation-olefin metathesis, Science 312(5771) (2006) 257-261. https://doi.org/10.1126/science.1123787. [69] H. Zhou X. Yi Y. Hui L. Wang W. Chen Y. Qin M. Wang J. Ma X. Chu Y. Wang X. Hong Z. Chen X. Meng H. Wang Q. Zhu L. Song A. Zheng F.-S. Xiao Isolated boron in zeolite for oxidative dehydrogenation of propane Science 372 6537 2021 76 80 10.1126/science.abe7935 H. Zhou, X. Yi, Y. Hui, L. Wang, W. Chen, Y. Qin, M. Wang, J. Ma, X. Chu, Y. Wang, X. Hong, Z. Chen, X. Meng, H. Wang, Q. Zhu, L. Song, A. Zheng, F.-S. Xiao, Isolated boron in zeolite for oxidative dehydrogenation of propane, Science 372(6537) (2021) 76-80. https://doi.org/10.1126/science.abe7935. [70] B. Qiu F. Jiang W. Lu B. Yan W. Li Z. Zhao A. Lu Oxidative dehydrogenation of propane using layered borosilicate zeolite as the active and selective catalyst J. Catal. 385 2020 176 182 10.1016/j.jcat.2020.03.021 B. Qiu, F. Jiang, W. Lu, B. Yan, W. Li, Z. Zhao, A. Lu, Oxidative dehydrogenation of propane using layered borosilicate zeolite as the active and selective catalyst, J. Catal. 385 (2020) 176-182. https://doi.org/10.1016/j.jcat.2020.03.021. [71] A. Farzaneh M. Moghaddam Low-temperature propane oxidative dehydrogenation over UiO-66 supported vanadia catalysts: role of support confinement effects J. Colloid Interface Sci. 629 2023 404 416 10.1016/j.jcis.2022.09.086 A. Farzaneh, M. Moghaddam, Low-temperature propane oxidative dehydrogenation over UiO-66 supported vanadia catalysts: role of support confinement effects, J. Colloid Interface Sci. 629 (2023) 404-416. https://doi.org/10.1016/j.jcis.2022.09.086. [72] M. Liu X. Sun Y. Zhang Y. Yang Y. Qin B. He Y. Mei Y. Zu Highly dispersed and stable NiSn subnanoclusters encapsulated within silicalite-1 zeolite for efficient propane dehydrogenation Fuel 357 2024 130069 10.1016/j.fuel.2023.130069 M. Liu, X. Sun, Y. Zhang, Y. Yang, Y. Qin, B. He, Y. Mei, Y. Zu, Highly dispersed and stable NiSn subnanoclusters encapsulated within silicalite-1 zeolite for efficient propane dehydrogenation, Fuel 357 (2024) 130069. https://doi.org/10.1016/j.fuel.2023.130069. [73] Y. Zhou F. Wei H. Qi Y. Chai L. Cao J. Lin Q. Wan X. Liu Y. Xing S. Lin A. Wang X. Wang T. Zhang Peripheral-nitrogen effects on the Ru1 centre for highly efficient propane dehydrogenation Nat. Catal. 5 12 2022 1145 1156 10.1038/s41929-022-00885-1 Y. Zhou, F. Wei, H. Qi, Y. Chai, L. Cao, J. Lin, Q. Wan, X. Liu, Y. Xing, S. Lin, A. Wang, X. Wang, T. Zhang, Peripheral-nitrogen effects on the Ru1 centre for highly efficient propane dehydrogenation, Nat. Catal. 5(12) (2022) 1145-1156. https://doi.org/10.1038/s41929-022-00885-1. [74] L. Zhang Y. Ren W. Liu A. Wang T. Zhang Single-atom catalyst: a rising star for green synthesis of fine chemicals Natl. Sci. Rev. 5 5 2018 653 672 10.1093/nsr/nwy077 L. Zhang, Y. Ren, W. Liu, A. Wang, T. Zhang, Single-atom catalyst: a rising star for green synthesis of fine chemicals, Natl. Sci. Rev. 5(5) (2018) 653-672. https://doi.org/10.1093/nsr/nwy077. [75] Y. Li Q. Guo Z. Ding H. Jiang H. Yang W. Du Y. Zheng K. Huo L. Shaw MOFs-based materials for solid-State hydrogen storage: strategies and perspectives Chem. Eng. J. 485 2024 149665 10.1016/j.cej.2024.149665 Y. Li, Q. Guo, Z. Ding, H. Jiang, H. Yang, W. Du, Y. Zheng, K. Huo, L. Shaw, MOFs-based materials for solid-State hydrogen storage: strategies and perspectives, Chem. Eng. J. 485 (2024) 149665. https://doi.org/10.1016/j.cej.2024.149665. [76] Y. Chai S. Liu Z. Zhao J. Gong W. Dai G. Wu N. Guan L. Li Selectivity modulation of encapsulated palladium nanoparticles by zeolite microenvironment for biomass catalytic upgrading ACS Catal. 8 9 2018 8578 8589 10.1021/acscatal.8b02276 Y. Chai, S. Liu, Z. Zhao, J. Gong, W. Dai, G. Wu, N. Guan, L. Li, Selectivity modulation of encapsulated palladium nanoparticles by zeolite microenvironment for biomass catalytic upgrading, ACS Catal. 8(9) (2018) 8578-8589. https://doi.org/10.1021/acscatal.8b02276. [77] P. Peng Y. Yue M. Han J. Shi J. Yang J. Chen Q. Chen Selective hydrogenation of furfural to furfuryl alcohol through hydrogenation spillover over amorphized HA zeolite encapsulated platinum clusters Microporous Mesoporous Mater. 366 2024 112962 10.1016/j.micromeso.2023.112962 P. Peng, Y. Yue, M. Han, J. Shi, J. Yang, J. Chen, Q. Chen, Selective hydrogenation of furfural to furfuryl alcohol through hydrogenation spillover over amorphized HA zeolite encapsulated platinum clusters, Microporous Mesoporous Mater. 366 (2024) 112962. https://doi.org/10.1016/j.micromeso.2023.112962. [78] M. Zhang H. Long J. Lu M. Zhang Selective hydrogenation of 1,4-butynediol to 1,4-butenediol over platinum encapsulated in ZSM-48 with one-pot synthesis method Fuel 327 2022 125201 10.1016/j.fuel.2022.125201 M. Zhang, H. Long, J. Lu, M. Zhang, Selective hydrogenation of 1,4-butynediol to 1,4-butenediol over platinum encapsulated in ZSM-48 with one-pot synthesis method, Fuel 327 (2022) 125201. https://doi.org/10.1016/j.fuel.2022.125201. [79] B. Jia L. Bai Z. Han R. Li J. Huangfu C. Li J. Zheng Y. Qu K. Leng Y. Wang J. Bai High-performance styrene epoxidation with vacancy-defect cobalt single-atom catalysts ACS Appl. Mater. Interfaces 14 8 2022 10337 10343 10.1021/acsami.1c23079 B. Jia, L. Bai, Z. Han, R. Li, J. Huangfu, C. Li, J. Zheng, Y. Qu, K. Leng, Y. Wang, J. Bai, High-performance styrene epoxidation with vacancy-defect cobalt single-atom catalysts, ACS Appl. Mater. Interfaces 14(8) (2022) 10337-10343. https://doi.org/10.1021/acsami.1c23079. [80] H. Yang Q. Liu Y. Li K. Sun Z. Chen Q. Peng C. Chen Isolated single-atom ruthenium anchored on beta zeolite as an efficient heterogeneous catalyst for styrene epoxidation ChemNanoMat 6 11 2020 1647 1651 10.1002/cnma.202000394 H. Yang, Q. Liu, Y. Li, K. Sun, Z. Chen, Q. Peng, C. Chen, Isolated single-atom ruthenium anchored on beta zeolite as an efficient heterogeneous catalyst for styrene epoxidation, ChemNanoMat 6(11) (2020) 1647-1651. https://doi.org/10.1002/cnma.202000394. [81] G. Liu P. Liu D. Meng T. Zhao X. Qian Q. He X. Guo J. Qi L. Peng N. Xue Y. Zhu J. Ma Q. Wang X. Liu L. Chen W. Ding COx hydrogenation to methanol and other hydrocarbons under mild conditions with Mo3S4@ZSM-5 Nat. Commun. 14 1 2023 513 10.1038/s41467-023-36259-9 G. Liu, P. Liu, D. Meng, T. Zhao, X. Qian, Q. He, X. Guo, J. Qi, L. Peng, N. Xue, Y. Zhu, J. Ma, Q. Wang, X. Liu, L. Chen, W. Ding, COx hydrogenation to methanol and other hydrocarbons under mild conditions with Mo3S4@ZSM-5, Nat. Commun. 14(1) (2023) 513. https://doi.org/10.1038/s41467-023-36259-9. [82] S. Zhou W. Ma U. Anjum M. Kosari S. Xi S. Kozlov H. Zeng Strained few-layer MoS2 with atomic copper and selectively exposed in-plane sulfur vacancies for CO2 hydrogenation to methanol Nat. Commun. 14 1 2023 5872 10.1038/s41467-023-41362-y S. Zhou, W. Ma, U. Anjum, M. Kosari, S. Xi, S. Kozlov, H. Zeng, Strained few-layer MoS2 with atomic copper and selectively exposed in-plane sulfur vacancies for CO2 hydrogenation to methanol, Nat. Commun. 14(1) (2023) 5872. https://doi.org/10.1038/s41467-023-41362-y. [83] J. Wang C. Liu P. Zhu H. Liu X. Zhang Mercaptosilane-assisted synthesis of highly dispersed and stable Pt nanoparticles on HL zeolites for enhancing hydroisomerization of n-hexane New J. Chem. 46 7 2022 3482 3492 10.1039/D1NJ05774J J. Wang, C. Liu, P. Zhu, H. Liu, X. Zhang, Mercaptosilane-assisted synthesis of highly dispersed and stable Pt nanoparticles on HL zeolites for enhancing hydroisomerization of n-hexane, New J. Chem. 46(7) (2022) 3482-3492. https://doi.org/10.1039/D1NJ05774J. [84] Y. Liu Z. Liu J. Zhang F. Xiao X. Cao L. Wang Efficient catalytic production of hydrogen peroxide using tin-containing zeolite fixed palladium nanoparticles with oxidation resistance Angew. Chem. Int. Ed. 62 47 2023 10.1002/anie.202312377 e202312377 Y. Liu, Z. Liu, J. Zhang, F. Xiao, X. Cao, L. Wang, Efficient catalytic production of hydrogen peroxide using tin-containing zeolite fixed palladium nanoparticles with oxidation resistance, Angew. Chem. Int. Ed. 62(47) (2023) e202312377. https://doi.org/10.1002/anie.202312377.",
      "scopus-id": "105003992873",
      "coredata": {
        "eid": "1-s2.0-S2468823125003608",
        "dc:description": "Nanoconfinement catalysis is becoming a research hotspot in the field of catalytic reactions due to its potential to enhance catalytic performance. Porous nanoconfined catalysts are designed by dispersing nanoparticles of active metal into porous support through various synthesis methods. This kind of catalyst can utilize the confinement effect of the pores to precisely regulate the dispersion and particle size of the metal particles, and then improve their catalytic activity and stability. During the process of catalytic reaction, the confinement effect of the pores in porous materials can effectively optimize the electronic states of the metal active components. Furthermore, the shape-selectivity of the pore channels can significantly improve the selectivity of the reaction products. This paper provides a comprehensive review of recent synthesized strategies for pore-confined metal nano-catalysts and their catalytic applications, and then delves into the mechanism by which the pore-confinement effect enhances catalytic activity, product selectivity, and the stability of catalysts. Specifically, the discussion is focused on various synthesis methods for pore-confined catalysts, including in situ encapsulated, core-shell structured, two-dimensional layered, and single-atom anchored catalysts, as well as recent advances of these catalysts in different catalytic reactions. Finally, the future prospect is proposed in order to provide a guidance for the development and application of pore-confined catalysts in catalytic reaction.",
        "openArchiveArticle": "false",
        "prism:coverDate": "2025-07-31",
        "openaccessUserLicense": null,
        "prism:aggregationType": "Journal",
        "prism:url": "https://api.elsevier.com/content/article/pii/S2468823125003608",
        "dc:creator": [
          {
            "@_fa": "true",
            "$": "Li, Liang"
          },
          {
            "@_fa": "true",
            "$": "Liang, Jiamin"
          },
          {
            "@_fa": "true",
            "$": "Zhu, Jinwei"
          },
          {
            "@_fa": "true",
            "$": "Zhao, Yongxiang"
          },
          {
            "@_fa": "true",
            "$": "Wang, Hao"
          }
        ],
        "link": [
          {
            "@_fa": "true",
            "@rel": "self",
            "@href": "https://api.elsevier.com/content/article/pii/S2468823125003608"
          },
          {
            "@_fa": "true",
            "@rel": "scidir",
            "@href": "https://www.sciencedirect.com/science/article/pii/S2468823125003608"
          }
        ],
        "dc:format": "application/json",
        "openaccessType": null,
        "pii": "S2468-8231(25)00360-8",
        "prism:volume": "582",
        "articleNumber": "115175",
        "prism:publisher": "Elsevier B.V. All rights are reserved, including those for text and data mining, AI training, and similar technologies.",
        "dc:title": "Advances in the preparation and application of nanoconfined metal catalysts composed of porous materials",
        "prism:copyright": "© 2025 Elsevier B.V. All rights are reserved, including those for text and data mining, AI training, and similar technologies.",
        "openaccess": "0",
        "prism:issn": "24688231",
        "dcterms:subject": [
          {
            "@_fa": "true",
            "$": "Nanoconfinement effect"
          },
          {
            "@_fa": "true",
            "$": "Porous material"
          },
          {
            "@_fa": "true",
            "$": "Pore-confined catalysis"
          },
          {
            "@_fa": "true",
            "$": "Structure regulation"
          },
          {
            "@_fa": "true",
            "$": "In situ encapsulated"
          }
        ],
        "openaccessArticle": "false",
        "prism:publicationName": "Molecular Catalysis",
        "openaccessSponsorType": null,
        "prism:pageRange": "115175",
        "pubType": "rev",
        "prism:coverDisplayDate": "July 2025",
        "prism:doi": "10.1016/j.mcat.2025.115175",
        "prism:startingPage": "115175",
        "dc:identifier": "doi:10.1016/j.mcat.2025.115175",
        "openaccessSponsorName": null
      },
      "objects": {
        "object": [
          {
            "@category": "standard",
            "@height": "362",
            "@width": "715",
            "@_fa": "true",
            "$": "https://api.elsevier.com/content/object/eid/1-s2.0-S2468823125003608-gr5.jpg?httpAccept=%2A%2F%2A",
            "@multimediatype": "JPEG image file",
            "@type": "IMAGE-DOWNSAMPLED",
            "@size": "124650",
            "@ref": "gr5",
            "@mimetype": "image/jpeg"
          },
          {
            "@category": "standard",
            "@height": "378",
            "@width": "678",
            "@_fa": "true",
            "$": "https://api.elsevier.com/content/object/eid/1-s2.0-S2468823125003608-gr4.jpg?httpAccept=%2A%2F%2A",
            "@multimediatype": "JPEG image file",
            "@type": "IMAGE-DOWNSAMPLED",
            "@size": "86304",
            "@ref": "gr4",
            "@mimetype": "image/jpeg"
          },
          {
            "@category": "standard",
            "@height": "446",
            "@width": "640",
            "@_fa": "true",
            "$": "https://api.elsevier.com/content/object/eid/1-s2.0-S2468823125003608-gr7.jpg?httpAccept=%2A%2F%2A",
            "@multimediatype": "JPEG image file",
            "@type": "IMAGE-DOWNSAMPLED",
            "@size": "101990",
            "@ref": "gr7",
            "@mimetype": "image/jpeg"
          },
          {
            "@category": "standard",
            "@height": "619",
            "@width": "640",
            "@_fa": "true",
            "$": "https://api.elsevier.com/content/object/eid/1-s2.0-S2468823125003608-gr6.jpg?httpAccept=%2A%2F%2A",
            "@multimediatype": "JPEG image file",
            "@type": "IMAGE-DOWNSAMPLED",
            "@size": "150172",
            "@ref": "gr6",
            "@mimetype": "image/jpeg"
          },
          {
            "@category": "standard",
            "@height": "257",
            "@width": "565",
            "@_fa": "true",
            "$": "https://api.elsevier.com/content/object/eid/1-s2.0-S2468823125003608-gr1.jpg?httpAccept=%2A%2F%2A",
            "@multimediatype": "JPEG image file",
            "@type": "IMAGE-DOWNSAMPLED",
            "@size": "33973",
            "@ref": "gr1",
            "@mimetype": "image/jpeg"
          },
          {
            "@category": "standard",
            "@height": "587",
            "@width": "640",
            "@_fa": "true",
            "$": "https://api.elsevier.com/content/object/eid/1-s2.0-S2468823125003608-gr3.jpg?httpAccept=%2A%2F%2A",
            "@multimediatype": "JPEG image file",
            "@type": "IMAGE-DOWNSAMPLED",
            "@size": "107879",
            "@ref": "gr3",
            "@mimetype": "image/jpeg"
          },
          {
            "@category": "standard",
            "@height": "449",
            "@width": "715",
            "@_fa": "true",
            "$": "https://api.elsevier.com/content/object/eid/1-s2.0-S2468823125003608-gr10.jpg?httpAccept=%2A%2F%2A",
            "@multimediatype": "JPEG image file",
            "@type": "IMAGE-DOWNSAMPLED",
            "@size": "128969",
            "@ref": "gr10",
            "@mimetype": "image/jpeg"
          },
          {
            "@category": "standard",
            "@height": "358",
            "@width": "565",
            "@_fa": "true",
            "$": "https://api.elsevier.com/content/object/eid/1-s2.0-S2468823125003608-gr2.jpg?httpAccept=%2A%2F%2A",
            "@multimediatype": "JPEG image file",
            "@type": "IMAGE-DOWNSAMPLED",
            "@size": "91580",
            "@ref": "gr2",
            "@mimetype": "image/jpeg"
          },
          {
            "@category": "standard",
            "@height": "200",
            "@width": "281",
            "@_fa": "true",
            "$": "https://api.elsevier.com/content/object/eid/1-s2.0-S2468823125003608-ga1.jpg?httpAccept=%2A%2F%2A",
            "@multimediatype": "JPEG image file",
            "@type": "IMAGE-DOWNSAMPLED",
            "@size": "21823",
            "@ref": "ga1",
            "@mimetype": "image/jpeg"
          },
          {
            "@category": "standard",
            "@height": "518",
            "@width": "678",
            "@_fa": "true",
            "$": "https://api.elsevier.com/content/object/eid/1-s2.0-S2468823125003608-gr11.jpg?httpAccept=%2A%2F%2A",
            "@multimediatype": "JPEG image file",
            "@type": "IMAGE-DOWNSAMPLED",
            "@size": "134452",
            "@ref": "gr11",
            "@mimetype": "image/jpeg"
          },
          {
            "@category": "standard",
            "@height": "526",
            "@width": "715",
            "@_fa": "true",
            "$": "https://api.elsevier.com/content/object/eid/1-s2.0-S2468823125003608-gr9.jpg?httpAccept=%2A%2F%2A",
            "@multimediatype": "JPEG image file",
            "@type": "IMAGE-DOWNSAMPLED",
            "@size": "129424",
            "@ref": "gr9",
            "@mimetype": "image/jpeg"
          },
          {
            "@category": "standard",
            "@height": "597",
            "@width": "678",
            "@_fa": "true",
            "$": "https://api.elsevier.com/content/object/eid/1-s2.0-S2468823125003608-gr8.jpg?httpAccept=%2A%2F%2A",
            "@multimediatype": "JPEG image file",
            "@type": "IMAGE-DOWNSAMPLED",
            "@size": "119068",
            "@ref": "gr8",
            "@mimetype": "image/jpeg"
          },
          {
            "@category": "thumbnail",
            "@height": "111",
            "@width": "219",
            "@_fa": "true",
            "$": "https://api.elsevier.com/content/object/eid/1-s2.0-S2468823125003608-gr5.sml?httpAccept=%2A%2F%2A",
            "@multimediatype": "GIF image file",
            "@type": "IMAGE-THUMBNAIL",
            "@size": "15967",
            "@ref": "gr5",
            "@mimetype": "image/gif"
          },
          {
            "@category": "thumbnail",
            "@height": "122",
            "@width": "219",
            "@_fa": "true",
            "$": "https://api.elsevier.com/content/object/eid/1-s2.0-S2468823125003608-gr4.sml?httpAccept=%2A%2F%2A",
            "@multimediatype": "GIF image file",
            "@type": "IMAGE-THUMBNAIL",
            "@size": "15822",
            "@ref": "gr4",
            "@mimetype": "image/gif"
          },
          {
            "@category": "thumbnail",
            "@height": "153",
            "@width": "219",
            "@_fa": "true",
            "$": "https://api.elsevier.com/content/object/eid/1-s2.0-S2468823125003608-gr7.sml?httpAccept=%2A%2F%2A",
            "@multimediatype": "GIF image file",
            "@type": "IMAGE-THUMBNAIL",
            "@size": "17890",
            "@ref": "gr7",
            "@mimetype": "image/gif"
          },
          {
            "@category": "thumbnail",
            "@height": "164",
            "@width": "169",
            "@_fa": "true",
            "$": "https://api.elsevier.com/content/object/eid/1-s2.0-S2468823125003608-gr6.sml?httpAccept=%2A%2F%2A",
            "@multimediatype": "GIF image file",
            "@type": "IMAGE-THUMBNAIL",
            "@size": "18658",
            "@ref": "gr6",
            "@mimetype": "image/gif"
          },
          {
            "@category": "thumbnail",
            "@height": "99",
            "@width": "219",
            "@_fa": "true",
            "$": "https://api.elsevier.com/content/object/eid/1-s2.0-S2468823125003608-gr1.sml?httpAccept=%2A%2F%2A",
            "@multimediatype": "GIF image file",
            "@type": "IMAGE-THUMBNAIL",
            "@size": "11805",
            "@ref": "gr1",
            "@mimetype": "image/gif"
          },
          {
            "@category": "thumbnail",
            "@height": "164",
            "@width": "179",
            "@_fa": "true",
            "$": "https://api.elsevier.com/content/object/eid/1-s2.0-S2468823125003608-gr3.sml?httpAccept=%2A%2F%2A",
            "@multimediatype": "GIF image file",
            "@type": "IMAGE-THUMBNAIL",
            "@size": "14555",
            "@ref": "gr3",
            "@mimetype": "image/gif"
          },
          {
            "@category": "thumbnail",
            "@height": "138",
            "@width": "219",
            "@_fa": "true",
            "$": "https://api.elsevier.com/content/object/eid/1-s2.0-S2468823125003608-gr10.sml?httpAccept=%2A%2F%2A",
            "@multimediatype": "GIF image file",
            "@type": "IMAGE-THUMBNAIL",
            "@size": "18573",
            "@ref": "gr10",
            "@mimetype": "image/gif"
          },
          {
            "@category": "thumbnail",
            "@height": "139",
            "@width": "219",
            "@_fa": "true",
            "$": "https://api.elsevier.com/content/object/eid/1-s2.0-S2468823125003608-gr2.sml?httpAccept=%2A%2F%2A",
            "@multimediatype": "GIF image file",
            "@type": "IMAGE-THUMBNAIL",
            "@size": "17772",
            "@ref": "gr2",
            "@mimetype": "image/gif"
          },
          {
            "@category": "thumbnail",
            "@height": "156",
            "@width": "219",
            "@_fa": "true",
            "$": "https://api.elsevier.com/content/object/eid/1-s2.0-S2468823125003608-ga1.sml?httpAccept=%2A%2F%2A",
            "@multimediatype": "GIF image file",
            "@type": "IMAGE-THUMBNAIL",
            "@size": "18341",
            "@ref": "ga1",
            "@mimetype": "image/gif"
          },
          {
            "@category": "thumbnail",
            "@height": "164",
            "@width": "215",
            "@_fa": "true",
            "$": "https://api.elsevier.com/content/object/eid/1-s2.0-S2468823125003608-gr11.sml?httpAccept=%2A%2F%2A",
            "@multimediatype": "GIF image file",
            "@type": "IMAGE-THUMBNAIL",
            "@size": "19829",
            "@ref": "gr11",
            "@mimetype": "image/gif"
          },
          {
            "@category": "thumbnail",
            "@height": "161",
            "@width": "219",
            "@_fa": "true",
            "$": "https://api.elsevier.com/content/object/eid/1-s2.0-S2468823125003608-gr9.sml?httpAccept=%2A%2F%2A",
            "@multimediatype": "GIF image file",
            "@type": "IMAGE-THUMBNAIL",
            "@size": "17987",
            "@ref": "gr9",
            "@mimetype": "image/gif"
          },
          {
            "@category": "thumbnail",
            "@height": "164",
            "@width": "186",
            "@_fa": "true",
            "$": "https://api.elsevier.com/content/object/eid/1-s2.0-S2468823125003608-gr8.sml?httpAccept=%2A%2F%2A",
            "@multimediatype": "GIF image file",
            "@type": "IMAGE-THUMBNAIL",
            "@size": "14544",
            "@ref": "gr8",
            "@mimetype": "image/gif"
          },
          {
            "@category": "high",
            "@height": "1605",
            "@width": "3167",
            "@_fa": "true",
            "$": "https://api.elsevier.com/content/object/eid/1-s2.0-S2468823125003608-gr5_lrg.jpg?httpAccept=%2A%2F%2A",
            "@multimediatype": "JPEG image file",
            "@type": "IMAGE-HIGH-RES",
            "@size": "899935",
            "@ref": "gr5",
            "@mimetype": "image/jpeg"
          },
          {
            "@category": "high",
            "@height": "1671",
            "@width": "3000",
            "@_fa": "true",
            "$": "https://api.elsevier.com/content/object/eid/1-s2.0-S2468823125003608-gr4_lrg.jpg?httpAccept=%2A%2F%2A",
            "@multimediatype": "JPEG image file",
            "@type": "IMAGE-HIGH-RES",
            "@size": "741447",
            "@ref": "gr4",
            "@mimetype": "image/jpeg"
          },
          {
            "@category": "high",
            "@height": "1973",
            "@width": "2833",
            "@_fa": "true",
            "$": "https://api.elsevier.com/content/object/eid/1-s2.0-S2468823125003608-gr7_lrg.jpg?httpAccept=%2A%2F%2A",
            "@multimediatype": "JPEG image file",
            "@type": "IMAGE-HIGH-RES",
            "@size": "898860",
            "@ref": "gr7",
            "@mimetype": "image/jpeg"
          },
          {
            "@category": "high",
            "@height": "2742",
            "@width": "2833",
            "@_fa": "true",
            "$": "https://api.elsevier.com/content/object/eid/1-s2.0-S2468823125003608-gr6_lrg.jpg?httpAccept=%2A%2F%2A",
            "@multimediatype": "JPEG image file",
            "@type": "IMAGE-HIGH-RES",
            "@size": "1275469",
            "@ref": "gr6",
            "@mimetype": "image/jpeg"
          },
          {
            "@category": "high",
            "@height": "1135",
            "@width": "2500",
            "@_fa": "true",
            "$": "https://api.elsevier.com/content/object/eid/1-s2.0-S2468823125003608-gr1_lrg.jpg?httpAccept=%2A%2F%2A",
            "@multimediatype": "JPEG image file",
            "@type": "IMAGE-HIGH-RES",
            "@size": "246851",
            "@ref": "gr1",
            "@mimetype": "image/jpeg"
          },
          {
            "@category": "high",
            "@height": "2599",
            "@width": "2833",
            "@_fa": "true",
            "$": "https://api.elsevier.com/content/object/eid/1-s2.0-S2468823125003608-gr3_lrg.jpg?httpAccept=%2A%2F%2A",
            "@multimediatype": "JPEG image file",
            "@type": "IMAGE-HIGH-RES",
            "@size": "902070",
            "@ref": "gr3",
            "@mimetype": "image/jpeg"
          },
          {
            "@category": "high",
            "@height": "1990",
            "@width": "3167",
            "@_fa": "true",
            "$": "https://api.elsevier.com/content/object/eid/1-s2.0-S2468823125003608-gr10_lrg.jpg?httpAccept=%2A%2F%2A",
            "@multimediatype": "JPEG image file",
            "@type": "IMAGE-HIGH-RES",
            "@size": "1117654",
            "@ref": "gr10",
            "@mimetype": "image/jpeg"
          },
          {
            "@category": "high",
            "@height": "1585",
            "@width": "2500",
            "@_fa": "true",
            "$": "https://api.elsevier.com/content/object/eid/1-s2.0-S2468823125003608-gr2_lrg.jpg?httpAccept=%2A%2F%2A",
            "@multimediatype": "JPEG image file",
            "@type": "IMAGE-HIGH-RES",
            "@size": "716200",
            "@ref": "gr2",
            "@mimetype": "image/jpeg"
          },
          {
            "@category": "high",
            "@height": "886",
            "@width": "1247",
            "@_fa": "true",
            "$": "https://api.elsevier.com/content/object/eid/1-s2.0-S2468823125003608-ga1_lrg.jpg?httpAccept=%2A%2F%2A",
            "@multimediatype": "JPEG image file",
            "@type": "IMAGE-HIGH-RES",
            "@size": "146065",
            "@ref": "ga1",
            "@mimetype": "image/jpeg"
          },
          {
            "@category": "high",
            "@height": "2291",
            "@width": "3000",
            "@_fa": "true",
            "$": "https://api.elsevier.com/content/object/eid/1-s2.0-S2468823125003608-gr11_lrg.jpg?httpAccept=%2A%2F%2A",
            "@multimediatype": "JPEG image file",
            "@type": "IMAGE-HIGH-RES",
            "@size": "1478111",
            "@ref": "gr11",
            "@mimetype": "image/jpeg"
          },
          {
            "@category": "high",
            "@height": "2331",
            "@width": "3167",
            "@_fa": "true",
            "$": "https://api.elsevier.com/content/object/eid/1-s2.0-S2468823125003608-gr9_lrg.jpg?httpAccept=%2A%2F%2A",
            "@multimediatype": "JPEG image file",
            "@type": "IMAGE-HIGH-RES",
            "@size": "1007080",
            "@ref": "gr9",
            "@mimetype": "image/jpeg"
          },
          {
            "@category": "high",
            "@height": "2642",
            "@width": "3000",
            "@_fa": "true",
            "$": "https://api.elsevier.com/content/object/eid/1-s2.0-S2468823125003608-gr8_lrg.jpg?httpAccept=%2A%2F%2A",
            "@multimediatype": "JPEG image file",
            "@type": "IMAGE-HIGH-RES",
            "@size": "912496",
            "@ref": "gr8",
            "@mimetype": "image/jpeg"
          }
        ]
      },
      "link": {
        "@rel": "abstract",
        "@href": "https://api.elsevier.com/content/abstract/scopus_id/105003992873"
      }
    }
  }
}