{
  "metadata": {
    "title": "Bimetallic oxide catalysis meets silanol-enhanced synergy: A winning combination for efficient CO<ce:inf loc=post>2</ce:inf> fixation by cycloaddition with styrene oxide",
    "authors": "; ; ",
    "journal": "Molecular Catalysis",
    "date": "2025-05-15",
    "doi": "10.1016/j.mcat.2025.115029",
    "abstract": "",
    "uri": "https://api.elsevier.com/content/article/pii/S2468823125002159",
    "pii": "S2468823125002159"
  },
  "fulltext": {
    "full-text-retrieval-response": {
      "scopus-eid": "2-s2.0-105000465783",
      "originalText": "serial JL 315758 291210 291744 291790 291809 31 Molecular Catalysis MOLECULARCATALYSIS 2025-03-22 2025-03-22 2025-03-22 2025-03-22 2025-04-12T03:56:21 1-s2.0-S2468823125002159 S2468-8231(25)00215-9 S2468823125002159 10.1016/j.mcat.2025.115029 S300 S300.1 FULL-TEXT 1-s2.0-S2468823125X00067 2025-04-12T03:20:31.366709Z 0 0 20250515 2025 2025-03-22T17:47:37.647755Z absattachment articleinfo articlenumber articletitlenorm authfirstinitialnorm authfirstsurnamenorm cid cids contenttype copyright crossmark dateloaded dateloadedtxt datesearch datesort dateupdated dco docsubtype doctype doi eid ewtransactionid hubeid indexeddate issn issnnorm itemstage itemtransactionid itemweight openaccess openarchive pg pgfirst pii piinorm pubdatestart pubdatetxt pubyr sectiontitle sortorder srctitle srctitlenorm srctype ssids alllist content subj subheadings suppl tomb volfirst volissue volumelist webpdf webpdfpagecount yearnav figure table e-component body mmlmath acknowledge affil appendices articletitle auth authfirstini authfull authkeywords authlast highlightsabst orcid primabst ref specialabst 2468-8231 24688231 true 579 579 C Volume 579 9 115029 115029 115029 20250515 15 May 2025 2025-05-15 2025 Regular Papers article fla © 2025 Elsevier B.V. All rights are reserved, including those for text and data mining, AI training, and similar technologies. BIMETALLICOXIDECATALYSISMEETSSILANOLENHANCEDSYNERGYAWINNINGCOMBINATIONFOREFFICIENTCO2FIXATIONBYCYCLOADDITIONSTYRENEOXIDE MALLANNAVAR C 1 Introduction 2 Experimental 2.1 Materials 2.2 Catalyst preparation 2.2.1 Synthesis of SBA-15 2.2.2 Preparation of silanol rich SBA-15 2.2.3 Preparation of xSnyNi/SBA-15-OH-z M 2.3 Catalyst characterization 2.4 Catalytic activity studies 2.5 Catalyst regeneration procedure 3 Results and discussion 3.1 Catalyst characterization 3.1.1 Nitrogen sorption studies 3.1.2 X-ray diffraction 3.1.3 Thermogravimetric analysis 3.1.4 Electron microscopy studies 3.1.5 Temperature programmed desorption 3.1.6 Temperature programmed reduction 3.1.7 X-ray photoelectron spectrometer 3.2 Catalyst activity studies 3.2.1 Screening studies 3.2.2 Effect of alkali treatment and variation of Sn-Ni loading on support 3.2.3 Influence of reaction parameters 3.2.3.1 Catalyst concentration 3.2.3.2 Effect of pressure 3.2.3.3 Effect of reaction temperature 3.2.3.4 Time resolved study 3.2.4 Leaching studies and recyclability 3.2.5 Cycloaddition of CO2 to different epoxides 3.2.6 Plausible mechanism 4 Conclusions CRediT authorship contribution statement Acknowledgements Appendix Supplementary materials References HE 2013 M ARAKAWA 2001 953 996 H SAKAKURA 2007 2365 2387 T ARESTA 2007 2975 2992 M RAZALI 2012 4951 4964 N ANASTAS 2003 G29 G34 P SONG 2006 2 32 C OCHOAGOMEZ 2012 389 399 J NORTH 2010 1514 1539 M WHITEOAK 2013 1228 1231 C ZHOU 2015 6773 6779 H SABETSARVESTANI 2017 459 466 H SABETSARVESTANI 2020 223 237 H DAI 2016 3180 3192 Z HU 2017 6468 6472 X LIU 2021 29522 29531 L SCHOEPFF 2020 5826 5833 L BAI 2022 5093 5102 X WANG 2018 13135 13141 W SCHAFFNER 2010 4554 4581 B WU 2012 17739 17745 G PADDOCK 2001 11498 11499 R AOMCHAD 2021 324 334 V JUTZ 2008 94 103 F BUTLER 2018 E IRONAMINOPHENOLATECOMPLEXESCATALYSTSFORCOACTIVATION ELKURTEHI 2017 A SYNTHESISCHARACTERIZATIONTRANSITIONMETALAMINOPHENOLATECOMPLEXESREACTIVITYTOWARDSOXIDATIONLIGNINMODELCOMPOUNDSCYCLICCARBONATEFORMATION XIE 2007 7255 7258 Y WANG 2016 6091 6100 W LONG 2020 101155 G LIU 2019 3834 3838 J WANG 2020 109751 Y MIRABAUD 2015 6748 6752 A XIN 2020 13185 13194 X ULUSOY 2011 1372 1379 M DAI 2009 2 12 W MA 2009 221 231 J MENG 2014 2771 2778 X HUANG 2018 9079 9102 K JAWAD 2017 589 596 A LI 2021 2795 2803 Y KIM 2013 175 180 J ZHU 2013 36 40 M HUH 2019 34 S XU 2018 503 514 K JI 2018 1768 1771 X WU 2018 296 303 Y NGUYEN 2021 4067 4073 P WU 2019 288 297 Y ZALOMAEVA 2013 179 185 O ZHU 2014 M ZHANG 2018 4204 4211 S HEYDARI 2020 104568 P LAN 2014 351 360 D KUMAR 2018 77 84 S RAVI 2015 88 94 S ZHANG 2006 102 106 X RAJU 2022 1198 1248 N GUHA 2021 101575 N SU 2014 1556 1562 Q SAMANTA 2020 1506 1545 S LIU 2023 1483 1494 N LIU 2022 4883 4900 N SAMANTA 2017 1390 1404 S YANO 1997 1129 1130 T TAMBE 2018 345 356 P YAMAGUCHI 1999 4526 4527 K ARESTA 2003 245 252 M RAMIN 2006 165 171 M YASUDA 2006 177 180 H KULAL 2019 434 444 N SCHWAB 1979 1 22 G ADVANCESINCATALYSIS ELECTRONICSSUPPORTEDCATALYSTS LAGARDE 2019 34 39 F ZHU 2017 315 324 Y SILAGHI 2014 82 96 M ZHAO 1998 548 552 D THOMMES 2014 233 250 M GREGG 1982 153 164 S STUDIESINSURFACESCIENCECATALYSIS ADSORPTIONGASESTOOLFORSTUDYTEXTURESOLIDS LI 2022 13055 13068 C CALZADA 2019 247 258 L ZHANG 2013 1701 1707 H UNGUREANU 2013 3010 3025 A LORENZ 1979 267 276 P KULAL 2023 102323 N MALLANNAVARX2025X115029 MALLANNAVARX2025X115029XC 2027-03-22T00:00:00.000Z 2027-03-22T00:00:00.000Z http://creativecommons.org/licenses/by-nc-nd/4.0/ © 2025 Elsevier B.V. All rights are reserved, including those for text and data mining, AI training, and similar technologies. 2025-03-26T04:11:41.749Z http://vtw.elsevier.com/data/voc/AddOnTypes/50.7/aggregated-refined Centre of Excellence in Science Engineering and Medicine 307 Admar Mutt Education Foundation AMEF Admar Mutt Education Foundation http://data.elsevier.com/vocabulary/SciValFunders/501100007365 http://sws.geonames.org/1269750/ Vision Group on Science and Technology http://data.elsevier.com/vocabulary/SciValFunders/501100014738 http://sws.geonames.org/1269750 GVS is thankful to Vision Group on Science and Technology (VGST), Govt. of Karnataka, India for sponsoring the project under Centre of Excellence in Science Engineering and Medicine (CESEM) Grant (GRD No 307). The authors acknowledge Admar Mutt Education Foundation (AMEF), Bengaluru for providing the research facilities. https://doi.org/10.15223/policy-017 https://doi.org/10.15223/policy-037 https://doi.org/10.15223/policy-012 https://doi.org/10.15223/policy-029 https://doi.org/10.15223/policy-004 item S2468-8231(25)00215-9 S2468823125002159 1-s2.0-S2468823125002159 10.1016/j.mcat.2025.115029 315758 2025-04-12T03:20:31.366709Z 2025-05-15 1-s2.0-S2468823125002159-main.pdf https://s3-eu-west-1.amazonaws.com/prod-ucs-content-store-eu-west/content/pii:S2468823125002159/MAIN/application/pdf/02f3d693b57fd3471f59fb403a03b1f8/main.pdf main.pdf pdf true 16553185 MAIN 16 1-s2.0-S2468823125002159-main_1.png https://s3-eu-west-1.amazonaws.com/prod-ucs-content-store-eu-west/content/pii:S2468823125002159/PREVIEW/image/png/72afa6a0cb515f1337dc2077a6f7f7bd/main_1.png main_1.png png 59915 849 656 IMAGE-WEB-PDF 1 1-s2.0-S2468823125002159-gr8.jpg https://s3-eu-west-1.amazonaws.com/prod-ucs-content-store-eu-west/content/pii:S2468823125002159/gr8/DOWNSAMPLED/image/jpeg/cf890c2bcfc2001e256ffdf2f468a747/gr8.jpg gr8 gr8.jpg jpg 43522 318 452 IMAGE-DOWNSAMPLED 1-s2.0-S2468823125002159-gr9.jpg https://s3-eu-west-1.amazonaws.com/prod-ucs-content-store-eu-west/content/pii:S2468823125002159/gr9/DOWNSAMPLED/image/jpeg/63d96d6373bda93612c12b8396393610/gr9.jpg gr9 gr9.jpg jpg 98349 566 678 IMAGE-DOWNSAMPLED 1-s2.0-S2468823125002159-gr2.jpg https://s3-eu-west-1.amazonaws.com/prod-ucs-content-store-eu-west/content/pii:S2468823125002159/gr2/DOWNSAMPLED/image/jpeg/d2c2a15d0b80cc9e894f05040c8c3801/gr2.jpg gr2 gr2.jpg jpg 60472 276 772 IMAGE-DOWNSAMPLED 1-s2.0-S2468823125002159-gr3.jpg https://s3-eu-west-1.amazonaws.com/prod-ucs-content-store-eu-west/content/pii:S2468823125002159/gr3/DOWNSAMPLED/image/jpeg/dea6068a9bb822dedee1d61c54a8dcf4/gr3.jpg gr3 gr3.jpg jpg 29180 297 395 IMAGE-DOWNSAMPLED 1-s2.0-S2468823125002159-gr1.jpg https://s3-eu-west-1.amazonaws.com/prod-ucs-content-store-eu-west/content/pii:S2468823125002159/gr1/DOWNSAMPLED/image/jpeg/399fed85a472c8eeac72625acd9386dc/gr1.jpg gr1 gr1.jpg jpg 128671 960 707 IMAGE-DOWNSAMPLED 1-s2.0-S2468823125002159-gr10.jpg https://s3-eu-west-1.amazonaws.com/prod-ucs-content-store-eu-west/content/pii:S2468823125002159/gr10/DOWNSAMPLED/image/jpeg/1bc51ef5a00a56fc17a734fca62b0725/gr10.jpg gr10 gr10.jpg jpg 68501 546 678 IMAGE-DOWNSAMPLED 1-s2.0-S2468823125002159-gr6.jpg https://s3-eu-west-1.amazonaws.com/prod-ucs-content-store-eu-west/content/pii:S2468823125002159/gr6/DOWNSAMPLED/image/jpeg/3fa2d97d447eb651045f577183d40f47/gr6.jpg gr6 gr6.jpg jpg 70831 304 769 IMAGE-DOWNSAMPLED 1-s2.0-S2468823125002159-gr7.jpg https://s3-eu-west-1.amazonaws.com/prod-ucs-content-store-eu-west/content/pii:S2468823125002159/gr7/DOWNSAMPLED/image/jpeg/bac2ba31cdc2b2e28f9cba33352b9ea2/gr7.jpg gr7 gr7.jpg jpg 73864 303 772 IMAGE-DOWNSAMPLED 1-s2.0-S2468823125002159-gr4.jpg https://s3-eu-west-1.amazonaws.com/prod-ucs-content-store-eu-west/content/pii:S2468823125002159/gr4/DOWNSAMPLED/image/jpeg/254da6de7ea69ba3dd11afde963197da/gr4.jpg gr4 gr4.jpg jpg 65548 388 489 IMAGE-DOWNSAMPLED 1-s2.0-S2468823125002159-gr5.jpg https://s3-eu-west-1.amazonaws.com/prod-ucs-content-store-eu-west/content/pii:S2468823125002159/gr5/DOWNSAMPLED/image/jpeg/5420a8db2da5df3a0e7655596ece5675/gr5.jpg gr5 gr5.jpg jpg 228552 777 772 IMAGE-DOWNSAMPLED 1-s2.0-S2468823125002159-fx1.jpg https://s3-eu-west-1.amazonaws.com/prod-ucs-content-store-eu-west/content/pii:S2468823125002159/fx1/DOWNSAMPLED/image/jpeg/049fafb0d0350d395d465e7d948a993d/fx1.jpg fx1 fx1.jpg jpg 34972 520 565 IMAGE-DOWNSAMPLED 1-s2.0-S2468823125002159-gr11.jpg https://s3-eu-west-1.amazonaws.com/prod-ucs-content-store-eu-west/content/pii:S2468823125002159/gr11/DOWNSAMPLED/image/jpeg/4736f8fcf2ec37a50e6b1ec7d2766ae1/gr11.jpg gr11 gr11.jpg jpg 70616 279 678 IMAGE-DOWNSAMPLED 1-s2.0-S2468823125002159-gr12.jpg https://s3-eu-west-1.amazonaws.com/prod-ucs-content-store-eu-west/content/pii:S2468823125002159/gr12/DOWNSAMPLED/image/jpeg/f96ca2159cc5e7458129270cc122243a/gr12.jpg gr12 gr12.jpg jpg 67564 546 675 IMAGE-DOWNSAMPLED 1-s2.0-S2468823125002159-gr13.jpg https://s3-eu-west-1.amazonaws.com/prod-ucs-content-store-eu-west/content/pii:S2468823125002159/gr13/DOWNSAMPLED/image/jpeg/87c8f87215292001a1776a7421f01e6a/gr13.jpg gr13 gr13.jpg jpg 25297 300 395 IMAGE-DOWNSAMPLED 1-s2.0-S2468823125002159-sc1.jpg https://s3-eu-west-1.amazonaws.com/prod-ucs-content-store-eu-west/content/pii:S2468823125002159/sc1/DOWNSAMPLED/image/jpeg/6e99e1329f4081a8bbb20ce79cc5ecfc/sc1.jpg sc1 sc1.jpg jpg 57598 599 678 IMAGE-DOWNSAMPLED 1-s2.0-S2468823125002159-gr14.jpg https://s3-eu-west-1.amazonaws.com/prod-ucs-content-store-eu-west/content/pii:S2468823125002159/gr14/DOWNSAMPLED/image/jpeg/ccaca777a99b51572b94a8c58bd8cf1e/gr14.jpg gr14 gr14.jpg jpg 65046 320 395 IMAGE-DOWNSAMPLED 1-s2.0-S2468823125002159-ga1.jpg https://s3-eu-west-1.amazonaws.com/prod-ucs-content-store-eu-west/content/pii:S2468823125002159/ga1/DOWNSAMPLED/image/jpeg/96c0a0d5418a0ab058c28950c9e7c425/ga1.jpg ga1 true ga1.jpg jpg 29569 200 375 IMAGE-DOWNSAMPLED 1-s2.0-S2468823125002159-gr8.sml https://s3-eu-west-1.amazonaws.com/prod-ucs-content-store-eu-west/content/pii:S2468823125002159/gr8/THUMBNAIL/image/gif/8defadf51223b99ef4ce17b6bb194ed9/gr8.sml gr8 gr8.sml sml 10265 154 219 IMAGE-THUMBNAIL 1-s2.0-S2468823125002159-gr9.sml https://s3-eu-west-1.amazonaws.com/prod-ucs-content-store-eu-west/content/pii:S2468823125002159/gr9/THUMBNAIL/image/gif/9d71126d4a18ceabcc1dfcb239dc6296/gr9.sml gr9 gr9.sml sml 14193 164 196 IMAGE-THUMBNAIL 1-s2.0-S2468823125002159-gr2.sml https://s3-eu-west-1.amazonaws.com/prod-ucs-content-store-eu-west/content/pii:S2468823125002159/gr2/THUMBNAIL/image/gif/35a7540da329747b43d7ebb236e45af5/gr2.sml gr2 gr2.sml sml 8479 78 219 IMAGE-THUMBNAIL 1-s2.0-S2468823125002159-gr3.sml https://s3-eu-west-1.amazonaws.com/prod-ucs-content-store-eu-west/content/pii:S2468823125002159/gr3/THUMBNAIL/image/gif/2b00bbb594403b7bad860de073237435/gr3.sml gr3 gr3.sml sml 9409 164 218 IMAGE-THUMBNAIL 1-s2.0-S2468823125002159-gr1.sml https://s3-eu-west-1.amazonaws.com/prod-ucs-content-store-eu-west/content/pii:S2468823125002159/gr1/THUMBNAIL/image/gif/8db52577cd3e9e77c2989aee595b4c95/gr1.sml gr1 gr1.sml sml 8561 163 120 IMAGE-THUMBNAIL 1-s2.0-S2468823125002159-gr10.sml https://s3-eu-west-1.amazonaws.com/prod-ucs-content-store-eu-west/content/pii:S2468823125002159/gr10/THUMBNAIL/image/gif/47e2c39aeced0b158141aec116bd4bca/gr10.sml gr10 gr10.sml sml 12290 164 204 IMAGE-THUMBNAIL 1-s2.0-S2468823125002159-gr6.sml https://s3-eu-west-1.amazonaws.com/prod-ucs-content-store-eu-west/content/pii:S2468823125002159/gr6/THUMBNAIL/image/gif/9148b97bf9d35e546b9492e1a4e01628/gr6.sml gr6 gr6.sml sml 9419 87 219 IMAGE-THUMBNAIL 1-s2.0-S2468823125002159-gr7.sml https://s3-eu-west-1.amazonaws.com/prod-ucs-content-store-eu-west/content/pii:S2468823125002159/gr7/THUMBNAIL/image/gif/fb876c34a8464fbea10311b52ffe84c2/gr7.sml gr7 gr7.sml sml 10279 86 219 IMAGE-THUMBNAIL 1-s2.0-S2468823125002159-gr4.sml https://s3-eu-west-1.amazonaws.com/prod-ucs-content-store-eu-west/content/pii:S2468823125002159/gr4/THUMBNAIL/image/gif/8e88ed94a508bc15cf9a13e13a38bb36/gr4.sml gr4 gr4.sml sml 23293 164 207 IMAGE-THUMBNAIL 1-s2.0-S2468823125002159-gr5.sml https://s3-eu-west-1.amazonaws.com/prod-ucs-content-store-eu-west/content/pii:S2468823125002159/gr5/THUMBNAIL/image/gif/b6fc549a028ec705952f3259d73bd7f6/gr5.sml gr5 gr5.sml sml 22866 164 163 IMAGE-THUMBNAIL 1-s2.0-S2468823125002159-fx1.sml https://s3-eu-west-1.amazonaws.com/prod-ucs-content-store-eu-west/content/pii:S2468823125002159/fx1/THUMBNAIL/image/gif/60a21a2bb92940d670bf3d2f995ed951/fx1.sml fx1 fx1.sml sml 5877 164 178 IMAGE-THUMBNAIL 1-s2.0-S2468823125002159-gr11.sml https://s3-eu-west-1.amazonaws.com/prod-ucs-content-store-eu-west/content/pii:S2468823125002159/gr11/THUMBNAIL/image/gif/f7602d601087c9a975c5812516e0e0f0/gr11.sml gr11 gr11.sml sml 12584 90 219 IMAGE-THUMBNAIL 1-s2.0-S2468823125002159-gr12.sml https://s3-eu-west-1.amazonaws.com/prod-ucs-content-store-eu-west/content/pii:S2468823125002159/gr12/THUMBNAIL/image/gif/5af63f93afeca2d77e2795c508424ea7/gr12.sml gr12 gr12.sml sml 9761 163 202 IMAGE-THUMBNAIL 1-s2.0-S2468823125002159-gr13.sml https://s3-eu-west-1.amazonaws.com/prod-ucs-content-store-eu-west/content/pii:S2468823125002159/gr13/THUMBNAIL/image/gif/f51f51ef2a3be5e54c01a064ee45d8e7/gr13.sml gr13 gr13.sml sml 8650 164 216 IMAGE-THUMBNAIL 1-s2.0-S2468823125002159-sc1.sml https://s3-eu-west-1.amazonaws.com/prod-ucs-content-store-eu-west/content/pii:S2468823125002159/sc1/THUMBNAIL/image/gif/6549c27aadf3821e2e8ae528a3262247/sc1.sml sc1 sc1.sml sml 8630 163 185 IMAGE-THUMBNAIL 1-s2.0-S2468823125002159-gr14.sml https://s3-eu-west-1.amazonaws.com/prod-ucs-content-store-eu-west/content/pii:S2468823125002159/gr14/THUMBNAIL/image/gif/4d25b4c43633e9b94148fba70578ad86/gr14.sml gr14 gr14.sml sml 18294 164 202 IMAGE-THUMBNAIL 1-s2.0-S2468823125002159-ga1.sml https://s3-eu-west-1.amazonaws.com/prod-ucs-content-store-eu-west/content/pii:S2468823125002676/ga1/THUMBNAIL/image/gif/e9a37862ad650d750db17dad2fab0f99/ga1.sml ga1 true ga1.sml sml 12055 117 219 IMAGE-THUMBNAIL 1-s2.0-S2468823125002159-gr8_lrg.jpg https://s3-eu-west-1.amazonaws.com/prod-ucs-content-store-eu-west/content/pii:S2468823125002159/HIGHRES/image/jpeg/7c229acc7e3176f829fe9fc33822f122/gr8_lrg.jpg gr8 gr8_lrg.jpg jpg 887389 1409 2000 IMAGE-HIGH-RES 1-s2.0-S2468823125002159-gr9_lrg.jpg https://s3-eu-west-1.amazonaws.com/prod-ucs-content-store-eu-west/content/pii:S2468823125002159/HIGHRES/image/jpeg/1734d6c95c533ac49b7b04ac6ac82421/gr9_lrg.jpg gr9 gr9_lrg.jpg jpg 753283 2504 3000 IMAGE-HIGH-RES 1-s2.0-S2468823125002159-gr2_lrg.jpg https://s3-eu-west-1.amazonaws.com/prod-ucs-content-store-eu-west/content/pii:S2468823125002159/HIGHRES/image/jpeg/7ba4e99074ab9f7a8ee46b5651716308/gr2_lrg.jpg gr2 gr2_lrg.jpg jpg 391656 1222 3417 IMAGE-HIGH-RES 1-s2.0-S2468823125002159-gr3_lrg.jpg https://s3-eu-west-1.amazonaws.com/prod-ucs-content-store-eu-west/content/pii:S2468823125002159/HIGHRES/image/jpeg/d4b66d1378f76d7c3d9be5a3961c49ab/gr3_lrg.jpg gr3 gr3_lrg.jpg jpg 199559 1315 1750 IMAGE-HIGH-RES 1-s2.0-S2468823125002159-gr1_lrg.jpg https://s3-eu-west-1.amazonaws.com/prod-ucs-content-store-eu-west/content/pii:S2468823125002159/HIGHRES/image/jpeg/8a685ed3afea3162d7a11d79f252d6dc/gr1_lrg.jpg gr1 gr1_lrg.jpg jpg 916877 4250 3129 IMAGE-HIGH-RES 1-s2.0-S2468823125002159-gr10_lrg.jpg https://s3-eu-west-1.amazonaws.com/prod-ucs-content-store-eu-west/content/pii:S2468823125002159/HIGHRES/image/jpeg/d971f263b824b035933b4d368220bba9/gr10_lrg.jpg gr10 gr10_lrg.jpg jpg 528841 2414 3000 IMAGE-HIGH-RES 1-s2.0-S2468823125002159-gr6_lrg.jpg https://s3-eu-west-1.amazonaws.com/prod-ucs-content-store-eu-west/content/pii:S2468823125002159/HIGHRES/image/jpeg/89ed0b611768a8e6da2eadb7a9893a6f/gr6_lrg.jpg gr6 gr6_lrg.jpg jpg 467498 1346 3406 IMAGE-HIGH-RES 1-s2.0-S2468823125002159-gr7_lrg.jpg https://s3-eu-west-1.amazonaws.com/prod-ucs-content-store-eu-west/content/pii:S2468823125002159/HIGHRES/image/jpeg/06e66f4baec8887d54feef1030bfebec/gr7_lrg.jpg gr7 gr7_lrg.jpg jpg 558629 1340 3417 IMAGE-HIGH-RES 1-s2.0-S2468823125002159-gr4_lrg.jpg https://s3-eu-west-1.amazonaws.com/prod-ucs-content-store-eu-west/content/pii:S2468823125002159/HIGHRES/image/jpeg/cf791e1057260d3d1651b8204bb654fe/gr4_lrg.jpg gr4 gr4_lrg.jpg jpg 590367 1719 2167 IMAGE-HIGH-RES 1-s2.0-S2468823125002159-gr5_lrg.jpg https://s3-eu-west-1.amazonaws.com/prod-ucs-content-store-eu-west/content/pii:S2468823125002159/HIGHRES/image/jpeg/17bcc1c4feb9e3004e77bbf1e2e5bd18/gr5_lrg.jpg gr5 gr5_lrg.jpg jpg 2229469 3439 3417 IMAGE-HIGH-RES 1-s2.0-S2468823125002159-fx1_lrg.jpg https://s3-eu-west-1.amazonaws.com/prod-ucs-content-store-eu-west/content/pii:S2468823125002159/HIGHRES/image/jpeg/eb21407fc3bc8794c7fb49ab3abb3096/fx1_lrg.jpg fx1 fx1_lrg.jpg jpg 292133 2303 2500 IMAGE-HIGH-RES 1-s2.0-S2468823125002159-gr11_lrg.jpg https://s3-eu-west-1.amazonaws.com/prod-ucs-content-store-eu-west/content/pii:S2468823125002159/HIGHRES/image/jpeg/2c6c3b3ac8d929e63b3295a2a44e587d/gr11_lrg.jpg gr11 gr11_lrg.jpg jpg 749073 1234 3000 IMAGE-HIGH-RES 1-s2.0-S2468823125002159-gr12_lrg.jpg https://s3-eu-west-1.amazonaws.com/prod-ucs-content-store-eu-west/content/pii:S2468823125002159/HIGHRES/image/jpeg/c53a541a444a77939e9480f9997c3bd7/gr12_lrg.jpg gr12 gr12_lrg.jpg jpg 441624 2420 2990 IMAGE-HIGH-RES 1-s2.0-S2468823125002159-gr13_lrg.jpg https://s3-eu-west-1.amazonaws.com/prod-ucs-content-store-eu-west/content/pii:S2468823125002159/HIGHRES/image/jpeg/b284e514a7850bcaaf0f8a5144ddb119/gr13_lrg.jpg gr13 gr13_lrg.jpg jpg 416541 1329 1750 IMAGE-HIGH-RES 1-s2.0-S2468823125002159-sc1_lrg.jpg https://s3-eu-west-1.amazonaws.com/prod-ucs-content-store-eu-west/content/pii:S2468823125002676/HIGHRES/image/jpeg/2f8891a1cb7523de402222d1b36719c9/sc1_lrg.jpg sc1 sc1_lrg.jpg jpg 397757 2651 3000 IMAGE-HIGH-RES 1-s2.0-S2468823125002159-gr14_lrg.jpg https://s3-eu-west-1.amazonaws.com/prod-ucs-content-store-eu-west/content/pii:S2468823125002676/HIGHRES/image/jpeg/30bbd61ba029684fa06035726b6e11b9/gr14_lrg.jpg gr14 gr14_lrg.jpg jpg 1232464 1418 1750 IMAGE-HIGH-RES 1-s2.0-S2468823125002159-ga1_lrg.jpg https://s3-eu-west-1.amazonaws.com/prod-ucs-content-store-eu-west/content/pii:S2468823125002676/HIGHRES/image/jpeg/1b27016612262913596f63b456d89e1e/ga1_lrg.jpg ga1 true ga1_lrg.jpg jpg 165240 886 1663 IMAGE-HIGH-RES 1-s2.0-S2468823125002159-mmc1.docx https://s3-eu-west-1.amazonaws.com/prod-ucs-content-store-eu-west/content/pii:S2468823125002159/mmc1/MAIN/application/vnd.openxmlformats-officedocument.wordprocessingml.document/79423b5ed8413724fbabf1851543ef9c/mmc1.docx mmc1 mmc1.docx docx 10836885 APPLICATION 1-s2.0-S2468823125002159-si1.svg https://s3-eu-west-1.amazonaws.com/prod-ucs-content-store-eu-west/content/pii:S2468823125002159/image/svg+xml/0f0e94b2b530314241f8b51e1ef06f3d/si1.svg si1 si1.svg svg 20890 ALTIMG 1-s2.0-S2468823125002159-si2.svg https://s3-eu-west-1.amazonaws.com/prod-ucs-content-store-eu-west/content/pii:S2468823125002159/image/svg+xml/d339e6b6628b6f9904380b4f452fcb68/si2.svg si2 si2.svg svg 21785 ALTIMG 1-s2.0-S2468823125002159-si3.svg https://s3-eu-west-1.amazonaws.com/prod-ucs-content-store-eu-west/content/pii:S2468823125002159/image/svg+xml/112f86f6a46b1e2cf47fead3bc3633bc/si3.svg si3 si3.svg svg 20753 ALTIMG 1-s2.0-S2468823125002159-si4.svg https://s3-eu-west-1.amazonaws.com/prod-ucs-content-store-eu-west/content/pii:S2468823125002159/image/svg+xml/4c870b89664ae7dbce36dd95f5dfc8c1/si4.svg si4 si4.svg svg 515 ALTIMG MCAT 115029 115029 S2468-8231(25)00215-9 10.1016/j.mcat.2025.115029 Fig. 1 (a) N2-sorption isotherms and (b) pore size distribution obtained from BJH method. Fig 1 Fig. 2 (a) Small angle X-ray scattering patterns (b) Wide angle XRD patterns. Fig 2 Fig. 3 Thermo gravimetric analysis (a) SBA-15 (b) SBA-15-OH (c) 10Sn5Ni/SBA-15-OH. Fig 3 Fig. 4 SEM images (a) SBA-15 (b) SBA-15-OH (c) 10Sn5Ni/SBA-15 (d) 10Sn5Ni/SBA-15-OH. Fig 4 Fig. 5 TEM images and SAED patterns (a1–a4) SBA-15 (b1–b4) SBA-15-OH (c1–c4) 10Sn5Ni/SBA-15 (d1–d4) 10Sn5Ni/SBA-15-OH. Fig 5 Fig. 6 NH3-TPD profiles of (a) Sn-Ni oxide, SBA-15(/OH) and Sn-Ni/ SBA-15(/OH) materials, (b) Sn-Ni oxide and different xSnyNi/SBA-15-OH materials with x:y = 2:1. Fig 6 Fig. 7 CO2-TPD profiles of (a) Sn-Ni oxide, SBA-15(/OH) and Sn-Ni/ SBA-15(/OH) materials, (b) Sn-Ni oxide and different xSnyNi/SBA-15-OH materials with x:y = 2:1. Fig 7 Fig. 8 H2-TPR profiles of the catalysts. Fig 8 Fig. 9 XPS spectra of Ni 2p (a) 15Ni/SBA-15-OH (b) 10Sn5Ni/SBA-15-OH (c) 10Sn5Ni/SBA-15. Fig 9 Fig. 10 XPS spectra of Sn 3d (a) 15Sn/SBA-15-OH (b) 10Sn5Ni/SBA-15-OH (c) 10Sn5Ni/SBA-15. Fig 10 Fig. 11 (a) Effect of alkali treatment (20Sn10Ni/SBA-15-OH-z M) (b) Variation of Sn-Ni loading on SBA-15-OH-0.1M. Reaction Conditions: styrene oxide-15 mmol, catalyst −180 mg (10 % w.r.t. SO), DMF-12 mL, temperature-130 °C, CO2 pressure-7 bar(a), time-4 h, SO- styrene oxide, SC- styrene carbonate, and SG- styrene glycol. Fig 11 Fig. 12 Effect of (a) Catalyst loading (b) pressure (c) temperature (d) time on catalytic activity of 10Sn5Ni/SBA-15-OH-0.1 M. Reaction conditions: 15 mmol styrene oxide, 12 mL of DMF, temperature-130 °C, time-4 h for [(a) and (b)], catalyst-180 mg catalyst (10 % w.r.t. SO) [(b), (c) and (d)] CO2 pressure: 10.5 bar(a) for [(c) and (d)]. Fig 12 Fig. 13 Catalyst leaching studies. Reaction Conditions: styrene oxide-15 mmol, catalyst −180 mg (10 % w.r.t. SO), DMF-12 mL, temperature-130 °C, CO2 pressure-10.5 bar(a), time-4 h. Fig 13 Fig. 14 Catalyst recyclability studies. Reaction Conditions: styrene oxide-15 mmol, catalyst −180 mg (10 % w.r.t. SO), DMF-12 mL, temperature-130 °C, CO2 pressure-10.5 bar(a), time-5 h. Fig 14 Scheme 1 Cycloaddition of styrene oxide with CO2 using SnNi/SBA-15-OH catalyst. Scheme 1 Table 1 Physicochemical properties of the catalysts from N2-sorption analysis. Table 1 S. No Catalyst Specific Surface area (m2/g) Total Pore volume (cm3/g) Mean Pore diameter (nm) 1 Sn-Ni oxide 39 0.12 13.8 2 SBA-15 680 1.10 7.4 3 SBA-15-OH-0.1 M 347 0.89 10.4 4 10Sn5Ni/SBA-15-OH 248 0.60 8.2 5 10Sn5Ni/SBA-15 433 0.80 7.3 Table 2 Physical properties of SBA-15 and SBA-15-OH from TEM analysis. Table 2 Catalyst d110 value (nm) d100 value (nm) Unit cell(a0) (nm) Average Pore size (nm) Wall thickness (nm) SBA-15 4.72 8.2 9.44 6.2 3.24 SBA-15-OH 4.90 8.5 9.80 6.6 3.20 d100=√3*d110; a0 = 2d100/ √3 as distance of nearest pore centers; wall thickness = a0 ‒ pore size. Table 3 Physicochemical properties of the catalysts from TPD analysis. Table 3 S. No Catalyst Acidity (µmol/g) Basicity (µmol/g) Total active sites (µmol/g) W M S Total W M S Total 1 Sn-Ni oxide 60 47 37 144 66 37 16 119 263 2 SBA-15 41 17 20 78 6 12 12 30 108 3 SBA-15-OH-0.1 M 50 41 44 135 11 8 5 24 159 4 10Sn5Ni/SBA-15 170 119 68 357 48 21 28 97 454 5 10Sn5Ni/SBA-15-OH 169 126 96 391 50 27 20 97 488 Table 4 Screening of catalysts for synthesis of styrene carbonate from styrene oxide and CO2. Table 4 S. No Catalyst SO Conversion (%) Selectivity (%) SC Yield (%) SC SG 1 Blank 1.3 88.3 11.7 1.1 2 Sn-Ni oxide 46.5 99.7 0.3 46.4 3 a Sn-Ni oxide 5.2 81.6 18.4 4.2 3 SBA-15 13.1 57.4 42.6 7.5 4 SBA-15-OH-0.2 M 32.5 42.8 57.2 13.9 5 20Sn10Ni/SBA-15 42.7 86.4 13.6 36.9 6 20Sn10Ni /SBA-15-OH-0.2 M 77.5 54.3 45.7 42.1 Reaction Conditions: styrene oxide-15 mmol, catalyst −180 mg (10 % w.r.t. SO), DMF-12 mL, temperature-130 °C, CO2 pressure-7 bar(a), time-4 h, SO- styrene oxide, SC- styrene carbonate, and SG- styrene glycol. a Catalyst weight taken is same as the amount of Sn+Ni in catalyst 10Sn5Ni/SBA-15-OH-0.1 M. Table 5 Varying the ratio of Sn-Ni oxide loading keeping 15 % overall metal concentration. Table 5 S. No Catalyst SO Conversion (%) Selectivity (%) SC Yield (%) SC SG 1 SBA-15-OH-0.1 M 28.5 46.5 53.5 13.2 2 5Sn10Ni/SBA-15-OH 55.7 81.7 18.3 45.5 3 7.5Sn7.5 Ni/SBA-15-OH 32.2 69.7 30.3 22.4 4 15Sn/SBA-15-OH 34.3 85.4 14.6 29.3 5 15Ni/SBA-15-OH 17.2 66.1 33.9 11.3 6 10Sn5Ni/SBA-15 50.6 66.5 33.5 33.6 Reaction Conditions: styrene oxide-15 mmol, catalyst −180 mg (10 % w.r.t. SO), DMF-12 mL, temperature-130 °C, CO2 pressure-7 bar(a), time-4 h, SO- styrene oxide, SC- styrene carbonate, and SG- styrene glycol. Table 6 Synthesis of cyclic carbonate from CO2 and various epoxide using 10Sn5Ni/SBA-15-OH catalyst. Table 6 Image, table 6 Reaction Conditions: Epoxide-15 mmol, catalyst −10 % w.r.t. epoxide, DMF-12 mL, temperature-130 °C, CO2 pressure-10.5 bar(a), time-5 h. Bimetallic oxide catalysis meets silanol-enhanced synergy: A winning combination for efficient CO2 fixation by cycloaddition with styrene oxide Chaitra N. Mallannavar Writing – review & editing Writing – original draft Validation Methodology Investigation Formal analysis Data curation Conceptualization a b S. Sujith Validation Investigation a Shrinidhi D. Patil Methodology a Sanjeev P. Maradur Writing – review & editing Resources a Ganapati V. Shanbhag Writing – review & editing Supervision Project administration Conceptualization a b ⁎ a Materials Science and Catalysis Division, Poornaprajna Institute of Scientific Research (PPISR), Bidalur post, Devanahalli, Bengaluru 562164, India Materials Science and Catalysis Division Poornaprajna Institute of Scientific Research (PPISR) Bidalur post Devanahalli Bengaluru 562164 India aMaterials Science and Catalysis Division, Poornaprajna Institute of Scientific Research (PPISR), Bidalur post, Devanahalli, Bengaluru 562164, India b Graduate Studies, Manipal Academy of Higher Education (MAHE), Manipal, 576104, India Graduate Studies Manipal Academy of Higher Education (MAHE) Manipal 576104 India bGraduate Studies, Manipal Academy of Higher Education (MAHE), Manipal, 576104, India ⁎ Corresponding author at: Materials Science and Catalysis Division, Poornaprajna Institute of Scientific Research (PPISR), Bidalur post, Devanahalli, Bengaluru 562164, India. Materials Science and Catalysis Division Poornaprajna Institute of Scientific Research (PPISR) Bidalur post Devanahalli Bengaluru 562164 India The bimetallic oxide dispersed on silanol rich SBA-15-OH was designed for the synthesis of cyclic carbonates from epoxides and CO2. The SBA-15-OH was synthesized via desilication and active metals were loaded by sol-gel method. Pure Sn-Ni oxide with a low surface area and lesser activity was modified by dispersing it on a high surface area SBA-15-OH. The different characterization techniques such as XRD, N2-sorption, CO2 and NH3-TPD, H2-TPR, SEM-EDX, TEM and XPS confirmed that the surface silanol group acts as anchoring site for the enhanced metal oxide-support interaction. Supported Sn-Ni oxide exhibited 16-fold better activity than pure Sn-Ni oxide, due to improved dispersion, which enhances the accessibility of reactants to the catalytic sites. Under the optimized reaction conditions 10Sn5Ni/SBA-15-OH gave 92.9 % styrene oxide conversion and 84.3 % selectivity for styrene carbonate. The catalyst is recyclable and the flexibility of the catalyst is tested for different epoxides with CO2. Graphical abstract The Sn-Ni oxide dispersed on silanol rich SBA-15-OH catalyst was designed for the synthesis of cyclic carbonate from CO2 and epoxides. The surface silanol group acts as anchoring sites for better metal oxide–support interaction, which resulted into enhanced catalytic activity compared to pure Sn-Ni oxide by 15 fold. Image, graphical abstract Keywords CO2 valorization Heterogeneous catalysis Epoxide Cyclic carbonate Supported bimetallic oxide Data availability Data will be made available on request. 1 Introduction The rise in CO2 concentration in the atmosphere from pre-industrial era to present day due to increasing population and industrialization has badly impacted the environment [1]. It is well known that CO2 is a greenhouse gas that causes global warming and ocean acidification. Apart from that, CO2 is a non-toxic, abundant and non-flammable C1 feedstock [2]. Therefore, many scientific communities are developing inventive methods to utilize CO2 and convert it into value-added chemicals. Till today, many processes have been developed to transform CO2 into value-added chemicals such as methanol, formic acid, dimethyl ether, dimethyl carbonate, cyclic carbonate, cyclic and substituted urea [3–7]. Synthesis of cyclic carbonates from CO2 and epoxides is 100 % atom-economical, cost effective and has many industrial applications such as electrolytes in lithium ion batteries, fuel additives, intermediates for pharmaceutical compounds, lubricants and polymer industries [8]. Several catalyst systems have been studied for the synthesis of styrene carbonate (SC) from CO2 and styrene oxide (SO) by knowing its potential for commercial applications due to its properties such as high dielectric constant, biocompatibility, nontoxicity, high boiling point, dipole moment, stereo selectivity etc. The synthesis of organic carbonates from CO2 is still challenging because CO2 is a thermodynamically stable molecule and to activate it under mild condition is very difficult without its activation by a catalyst. An extensive amount of research has been done on exploring different types of homogenous and heterogeneous catalysts for CO2 conversion to cyclic carbonates [9]. Various homogeneous catalysts such as phosphorus ylide [10–13], porphyrin complex [14–19], salen complexes [20–24], amino-phenolate complexes [25,26], ionic liquids [27–31], and metal complexes [32–34] have been studied under mild reaction parameters with high catalytic activity. Both homogenous and heterogeneous catalysts have their own benefits and drawbacks, yet homogenous catalysts typically give higher catalytic activity than its counterpart. Still, heterogeneous catalysts are desirable due to easy separation from reaction mixture, easy handling, higher stability, regeneration and recyclability of the catalyst [35,36]. In this perspective, many heterogeneous catalysts are reported such as modified polymers [28,37–39], metal-organic frameworks [40–50], graphene oxide [51–54], functionalized silica [55–58], and graphitic carbon nitrides [59–63]. Though they show good catalytic activity for epoxide and CO2 reaction, their synthesis procedure is tedious and is not cost-effective. Moreover, these materials have low thermal and chemical stability, which would be difficult for catalyst regeneration. The grafted graphene oxides and supported ionic liquids are effective only in the presence of halide ions which do not satisfy the green chemistry principles. Supported quaternary ammonium salts and amine functionalized silica showed good activity for carbonylation of epoxides by CO2. However, these catalysts have inherent leaching issues. Many of these heterogeneous catalysts have addressed the limitations of homogenous catalyst systems but still there is a room for improvement for these heterogeneous catalysts in terms of achieving high activity under mild reaction conditions and good recyclability without any leaching issues. Many mono and mixed metal oxides are reported for the synthesis of cyclic carbonates by carbonylation of epoxides, such as MgO [64], La-Zr oxide [65], Mg-Al oxide [66] and Nb2O5 [67]. However, one or the other parameters like harsh reaction conditions or the usage of tetrabutylammonium bromide as homogenous co-catalyst or supercritical CO2 (high pressure) helped these oxide catalysts to get better yields [68,69]. Recently, our group reported Sn-Ni oxide catalyst for the synthesis of cyclic carbonate from epoxide and CO2 with a detailed study on propylene carbonate synthesis [70]. However, this metal oxide gave low turnover number for epoxide conversion due to low surface area and low availability of active sites on the surface. This is an inherent problem with most of the mixed metal oxides as major quantity of the catalytic active sites present in the bulk inside the big clusters of oxides. Hence, there is a need to develop a method to disperse the metal oxides on the high surface area support with most of the metal species accessible to the reactants. The dispersion of bulk oxides on the high surface area support gives stability and better exposure to the active sites as well as it brings out strong metal support interaction [71] that might enhance the catalytic activity. Previously, SBA-15 has been functionalized with various amine groups for cyclic carbonate synthesis from epoxide and CO2 and in another work, SBA-15 has been used along with homogeneous quaternary ammonium salt as co-catalyst for the same reaction [72]. In this study, SBA-15 has been used as support for metal oxides due to its promising properties such as high surface area, high pore wall thickness, large pore size and pore volume, suitable for the dispersion of metal oxide. The preparation of supported metal oxide catalyst needs a conducive interaction of the support with metal oxide to achieve better dispersion, higher stability and recyclability of the catalyst. SBA-15 is an ordered mesoporous silicate material with uniform hexagonal pore structure. Silicates are irreducible oxides which lack the strong metal support interaction property leading to the formation of weaker secondary bonds with metal oxide species [73]. However, many in-situ and post-modification methods enable the proper dispersion and interaction with metal species. The well-known desilication process is mainly used to design hierarchical zeolite catalysts by treatment with alkaline solution at pH 10-11 [74]. Similarly, the defect sites can also be generated in silicate framework using the desilication technique to create a silanol rich surface. This embraces a different coordination environment compared to a perfect silica framework. These surface-defect sites act as anchoring sites and promote the silica-metal oxide interaction. We attempted to develop a new method for uniform dispersion of metal oxides on SBA-15 by creating more anchoring sites on the support by a simple alkali treatment for CO2 transformation. The effectiveness of desilication process to achieve silanol rich surface and its reflectance on achieving better metal oxide dispersion has been studied. The interaction between metal oxide and silanol-rich SBA-15 support is investigated using different characterization techniques, and its structure activity relationship is investigated. Further, the effect of reaction conditions, leaching, recyclability and substrate scope of different epoxides were also studied in detail. 2 Experimental 2.1 Materials Styrene oxide, propylene oxide, cyclohexene oxide, 1,2-epoxy-3-phenoxypropane and poly(ethylene glycol)-block-poly(propylene glycol)-block-poly(ethylene glycol) with average molecular weight, 5800 (hereafter triblock P123), tetraethyl orthosilicate (TEOS) were procured from Sigma Aldrich. Nickel(II)nitrate hexahydrate, citric acid anhydrous, N,N-dimethylformamide (hereafter DMF), hydrochloric acid (35 %) and sodium hydroxide pellets were purchased from Merck, India. Stannic chloride hydrate and epichlorohydrin were purchased from Loba Chemie Pvt. Ltd. India. All the chemicals procured were used as it is without further modification. 2.2 Catalyst preparation 2.2.1 Synthesis of SBA-15 The detailed procedure for mesoporous silica SBA-15 synthesis was first reported by GD Stucky and coworkers [75]. The SBA-15 was prepared using triblock P123 copolymer as a structure directing agent. In a typical procedure, 4 g triblock P123 copolymer was dissolved in 30 ml of water and 120 g of 2 M HCl solution was added under stirring. Then, 8 g of TEOS was added as a silica source to the above homogenous solution. This mixture was constantly stirred for 24 h at 40 °C. The obtained white gel was subjected for hydrothermal treatment in a polypropylene bottle at 100 °C for 48 h. The solid product was filtered and washed with distilled water followed by drying in air at room temperature. Finally, the material was calcined at 550 °C for 24 h with a heating rate of 5 °C/min to remove the template and obtain a white powder SBA-15. 2.2.2 Preparation of silanol rich SBA-15 The calcined SBA-15 was post-synthetically modified by alkali treatment with different concentrations of diluted aq. NaOH solution. Typically, 1 g of calcined SBA-15 was added to 10 ml of x M aq. NaOH solution and the mixture was stirred for 1 h at 80 °C. Then, obtained material was filtered, washed with distilled water till the pH of the filtrate was 7 and dried in a hot air oven for 12 h at 110 °C to obtain white powder SBA-15-OH. The resultant material was labeled as SBA-15-OH-z M, where z refers to concentration of NaOH solution. If the z M concentration is not mentioned in the sample name, it is understood as 0.1 M aq. NaOH-treated sample. 2.2.3 Preparation of xSnyNi/SBA-15-OH-z M The SBA-15-OH supported Sn-Ni oxide catalyst was synthesized by sol-gel method using citric acid as a complexing agent. In a typical synthesis, SnCl4·5H2O and Ni(NO3)2·6H2O were taken as Sn and Ni precursors. The required amount of SnCl4·5H2O, Ni(NO3)2·6H2O and citric acid with citric acid/ metal salts ratio of 1.2, were dissolved in 30 ml water and stirred for 1 h at room temperature. Then, 1 g of SBA-15-OH-z M was added to the above solution under constant stirring. This mixture was stirred for 2 h at room temperature followed by ultra-sonication for 2 h and then heated at 80 °C to evaporate the solvent. The obtained solid sample was dried at 110 °C for 5 h and calcined at 500 °C for 4 h @ 5 °C/min in static air. The formed catalyst contains Sn-Ni oxide dispersed on SBA-15-OH support which is denoted as xSnyNi/SBA-15-OH-z M, where, x and y are wt.% of Sn and Ni, respectively taken during the preparation. Similarly, different catalysts like Sn-Ni oxide on SBA-15 (without alkali treatment), Ni-oxide on SBA-15-OH, and Sn-oxide on SBA-15-OH were synthesized using the above procedure and denoted as xSnyNi/SBA-15, xSn/SBA-15-OH, yNi/SBA-15-OH, respectively. The pure form of Sn-Ni oxide (2:1) without support was prepared as per our previous report [70]. 2.3 Catalyst characterization A wide-angle powder X-ray diffraction (WAXRD) patterns of the catalysts were recorded with Bruker D2-phaser with CuKα radiation (λ=1.5418 Å) and high resolution Lynxeye detector. The catalysts were scanned with 2θ value from 5 to 90ₒ with 0.02° per step at a rate of 0.3 s/step. The small angle X-ray scattering (SAXS) patterns were obtained with 2θ values between 0.5 and 10ₒ using Rigaku Smartlab X-ray diffractometer with CuKα radiation (λ=1.5418 Å) and SC-70 detector. The N2-sorption isotherms were obtained using Belsorp mini-II instrument (Bel, Japan) at liquid nitrogen temperature (77 K) after degassing the catalysts at 250 ₒC for 2 h. The specific surface area and pore volume were determined using Brunauer-Emmett-Teller (BET) equation and BJH plot was used to determine the pore size of the samples. The acidity and basicity of the samples were determined by Temperature Programmed-Desorption (TPD) using NH3 and CO2 gases as probe molecules, respectively with Belcat-II instrument (BEL, Japan). In a typical procedure, samples were preheated at 500 °C under argon flow for 1 h in quartz-tube reactor prior to the analysis. The sample was cooled down to 50 °C and 10 % of NH3 in He (or 10 % CO2 in He) was passed through the catalyst for 30 min. The physisorbed NH3 (or CO2) was purged out by passing He gas for 15 min. The NH3 (or CO2) desorption was recorded with a temperature ranging from 50 to 600 °C at a heating rate of 10 °C min-1 under He flow. H2 temperature programmed reduction (H2-TPR) studies were conducted on Belcat-II instrument (BEL, Japan) to analyze the reducibility of the materials and to understand the metal-support interaction. The samples were loaded in quartz tube reactor and preheated at 500 °C under Ar flow prior to the analysis and cooled down to 50 °C. Then, the gas was changed to 10 % H2 in Ar flow and temperature increased from 50 °C to 800 °C with a heating rate of 10 °C/min. The thermal stability of the catalysts was analyzed by thermal analysis system (Perkin Elmer STA 6000). The experiments were carried out under air atmosphere from 30 to 800 °C with a heating rate of 10 °C min-1 and flow rate of 50 ml/min. The morphology of catalysts was acquired by field emission scanning electron microscope (FESEM) using JEOL JSM-7610F instrument. For the textural characterization, the HR-TEM images of the catalysts were recorded on JEM-2100 (JEOL) electron microscope at the operating voltage of 200kV. The X-ray photoelectron spectra of the catalysts were recorded on ULVAC PHI/PHI5000 Versa Probell instrument with monochromatic Al Kα radiation. 2.4 Catalytic activity studies The synthesis of styrene carbonate from styrene and CO2 was performed in a 50 ml stainless steel autoclave equipped with an overhead stirrer. The reactor was furnished with a pressure gauge, thermocouple and furnace, which are all connected to the controller unit to monitor pressure and temperature. Prior to each reaction, the catalyst was preheated in a hot air oven for 1 h at 110 °C. In a typical reaction procedure, 15 mmol of SO (1.8 g), and 12 ml of dimethylformamide (DMF) as a solvent were taken in the reactor. Then, a preheated catalyst (10 wt.% w.r.t. epoxide) was loaded into the reactor. The reactor was flushed with CO2 to eliminate residual air from the reactor and pressurized to the required pressure. Later, the reaction mixture was mechanically stirred at 700 rpm and the reactor was heated to specified temperature. After the reaction, the heating and stirring were stopped and the reactor was cooled in an ice bath. The gas in the reactor was analyzed by Agilent Technology Inc. GC equipped with GS-GasPro column (0.32 mm ID and 30 m length) and Thermal conductivity detector (TCD), then it was vent off by releasing the pressure. The liquid product was centrifuged to separate out the reaction mixture and the catalyst. Then, it was analyzed by Shimadzu GC-2014 AF equipped with DB-WAX column (0.25 mm ID and 30 m length) and flame ionization detector (FID). % C o n v e r s i o n = M o l e s o f s t y r e n e o x i d e c o n v e r t e d I n i t i a l m o l e s o f s t y r e n e o x i d e × 100 % S e l e c t i v i t y = M o l e s o f s t y r e n e c a r b o n a t e f o r m e d M o l e s o f s t y r e n e o x i d e c o n v e r t e d × 100 % Y i e l d = M o l e s o f s t y r e n e c a r b o n a t e f o r m e d I n i t i a l m o l e s o f s t y r e n e o x i d e × 100 2.5 Catalyst regeneration procedure The recyclability of the catalyst was tested under optimized reaction condition using DMF solvent. After each catalytic run, the catalyst was separated from the reaction mixture and washed thoroughly with acetone several times and collected by centrifugation. The catalyst was dried in oven overnight at 120 °C and calcined at 500 °C for 4 h. The same procedure was followed for all the subsequent runs. 3 Results and discussion 3.1 Catalyst characterization 3.1.1 Nitrogen sorption studies The specific surface area, pore size and pore volume of the materials obtained by using N2-sorption analysis are shown in Table 1 and the isotherms with BJH plots are depicted in Fig. 1 a-b. Firstly, Pure Sn-Ni (2:1) oxide showed type IV isotherm with H1 hysteresis loop which is typical of mesoporous material with ink-bottle type pore structure [76]. The pore size distribution was evaluated from BJH method showing a broad peak ranging from 4 to 25 nm with mean pore diameter of 13.8 nm. The SBA-15 showed typical type IV isotherm with H1 hysteresis loop according to IUPAC nomenclature, which is characteristic of hexagonal structure and cylindrical channels. The upward deviation at higher p/p0 (> 0.6) is due to the progressive filling of uniform mesopores by the process of capillary condensation of nitrogen within these pores. The BJH method was applied to the desorption branch of the isotherm to evaluate the pore size distribution and total pore volume of all the samples [77]. The specific surface area of SBA-15 was found to be 679.7 m2/g with a narrow pore size distribution with mean pore diameter of 7.4 nm. After alkali treatment with 0.1 M NaOH solution, the surface area of SBA-15 decreased to 347.1 m2/g and there was a noticeable broadening of pore size distribution with mean pore diameter of 10.4 nm. Here, the desilication of SBA-15 by the treatment with alkaline solution partially dissociated the silica wall and thus, the pore size of SBA-15-OH increased by the expansion of mesopore channels [78]. The 15 % of Sn-Ni oxide loading on alkali treated SBA-15-OH-0.1 M further decreased the specific surface area of the support to 247.8 m2/g. This could be attributed to the pore filling of SBA-15-OH-0.1 M by active metal loading, which is confirmed through narrowing of pore diameter from 10.4 to 8.2 nm. Moreover, it can be seen that after metal loading, the H1 hysteresis loop of SBA-15-OH-0.1 M remained unchanged, demonstrating the maintenance of the mesoporous texture of SBA-15. Similar changes were observed in case of 15 % Sn-Ni oxide loaded on SBA-15 support. The effect of alkali treatment (Table S1- entry 1–3), Sn-Ni loading (Table S1-entry 4–10) and variation in metal oxide ratio (Table S1-entry 11–14) on the textural properties of the support material were studied in detail. As the concentration of NaOH solution increased, the specific surface area of SBA-15 support decreased due to the desilication process which dissolves the silicate species from the framework. Further, loading of Sn-Ni oxide on support decreased the specific surface area and pore size due to pore filling of mesoporous channels. 3.1.2 X-ray diffraction The well-defined SAXS patterns of SBA-15, SBA-15-OH, 10Sn5Ni/SBA-15-OH and 10Sn5Ni/SBA-15 are shown in Fig. 2 a. The SAXS pattern of SBA-15 has three well resolved peaks in the 2θ range of 0.8°−1.2° that corresponds to (100), (110) and (200) planes, ascribed to the hexagonal mesoporous structure of SBA-15 with 2D symmetry [75]. Further, alkali treated SBA-15-OH, 10Sn5Ni/SBA-15-OH and 10Sn5Ni/SBA-15 materials showed similar diffraction peaks, which suggests that the ordered 2D hexagonal mesostructure was retained even after alkali treatment and active metal loading on the support. However, the peaks shifted slightly towards lower angles, depicting the increase in the interplanar spacing and this hypothesis is further confirmed by transmission electron microscopic studies. Additionally, the decrease in the intensity of the diffraction peaks were observed, which could be attributed to the decrease in long range order of the mesopore structure after alkali treatment and metal loading. Fig. 2b depicts the wide angle XRD patterns of Sn-Ni oxide, 10Sn5Ni/SBA-15, 10Sn5Ni/SBA-15-OH and SBA-15-OH. The highly ordered SBA-15-OH showed a broad peak at 2θ value of about 22°, ascribed to the amorphous nature of silica. The Sn-Ni oxide catalyst calcined at 600 °C showed the diffraction peaks, which can be indexed as cubic NiO and tetragonal SnO2 phases in the 2θ range of 5°–80° [70]. All the prominent peaks of unsupported Sn-Ni oxide can be observed in the 10Sn5Ni/SBA-15 and 10Sn5Ni/SBA-15-OH catalysts calcined at 500 °C, which confirms that the nature of Sn and Ni oxide phases is retained after loading on the support. 3.1.3 Thermogravimetric analysis The weight loss of the materials was measured using thermogravimetric analysis. Calcined SBA-15 lost 3.4 % of its original weight in the temperature range of 30–100 °C due to the loss of physisorbed moisture (Fig. 3 ) [78]. The negligible weight loss of 1.3 % after 100 °C indicates complete removal of template and thermal stability of the sample till 800 °C. The moisture content for SBA-15-OH measured till 100 °C is around 3.8 % which is similar to that of SBA-15. However, further weight loss of 4.3 % at higher temperature could be attributed to the additional silanol groups generated during desilication process. Upon Sn-Ni oxide loading on the SBA-15-OH support, the first weight loss of 4.7 % in the range of 30 to 100 °C could be attributed to physisorbed moisture. After 100 °C, the weight loss was only 2.4 % (reduced by almost half compared with that of SBA-15-OH) which might indicate that silanol groups present in the support act as anchoring sites for metal oxides. 3.1.4 Electron microscopy studies Scanning electron microscopy images confirms rod like morphology of SBA-15 for all the synthesised catalysts (Fig 4 a–d). This suggests that the morphology of the catalysts is not affected even after alkali treatment and active metal loading. The average particle size of SBA-15 is 950 nm length and 270 nm width. After alkali treatment, average particle size decreased (length-810 nm and width-250 nm) due to the dissolution of silica framework during desilication process. Metal loading on SBA-15-OH also showed same morphology with 880 nm length and 230 nm width. Morphology of 10Sn5Ni/SBA-15 was the same compared to unmodified SBA-15 and the average particle size 750 nm length and 375 nm width. The elemental compositions of catalysts (Si, O, Sn and Ni) were confirmed by EDX spectrum and ICP-OES analysis are summarized in Table S3. Transmission electron microscopy images of all the samples are shown in Fig. 5 a–d. The SBA-15 showed well-ordered and relatively uniform hexagonal arrays of mesoporous channels. The mean pore diameter of SBA-15 is 6.2 nm and the pore wall thickness is 4.2 nm (Table 2 ). After alkali treatment, the pore diameter of the material increased slightly to 6.6 nm due to desilication. This also slightly dissolved the silica wall thereby decreasing the pore wall thickness to 3.9 nm. The leaching of silicon from the SBA-15 framework during the alkaline treatment increased the unit cell parameter from 9.4 to 9.8 (Table 3 ). The ordered hexagonal structure of the material is retained after active metal loading of the support. This observation is well in accordance with the N2-sorption analysis where we found an increase in the pore size of the support after alkaline treatment. From these images and N2-sorption analysis, we can conclude that a large part of Sn-Ni oxide is distributed within the hexagonal pores of the support. The selected area electron diffraction (SAED) pattern of SBA-15 reveals the amorphous nature of the material and similar pattern was observed for SBA-15-OH. Loading of crystalline Sn-Ni oxide on support materials is reflected by an appearance of weak diffraction rings in the corresponding SAED patterns of samples (Fig. 5c4 and d4). 3.1.5 Temperature programmed desorption The temperature programmed desorption analysis is used to identify the nature, number and strength of the acidic and basic sites in the catalyst. The strength of acidity and basicity viz. weak, medium and strong was recorded at temperatures, <200 °C, 200‒350 °C and >350 °C respectively. Mainly, the weak and medium acidic and basic sites were dominated in all the catalysts reported in Table 3. The acidity of pure Sn-Ni oxide was 144 µmol/g, whereas 10Sn5Ni/SBA-15 showed much higher acidity of 357 µmol/g with only 15 % total metal oxide loading. This enhancement in acidity could be due to the well-dispersed Sn-Ni oxide particles on the support with much lesser agglomeration of particles compared to their unsupported form [79]. The support SBA-15 with surface silanol groups also contributed to the total acidity. The catalyst 10Sn5Ni/SBA-15-OH showed higher acidity of 391 µmol/g compared to 10Sn5Ni/SBA-15 (357 µmol/g) catalyst, where it possesses predominantly stronger acid sites in addition to similar number of weak and moderate acidity, which is due to the increased silanol groups after alkali treatment (Fig. 6 a and Table 3). The pure Sn-Ni oxide exhibited basicity of 119 µmol/g, whereas the 15 % Sn-Ni oxide on SBA-15 and SBA-15-OH both exhibited identical basicity of 97 µmol/g. The results showed that the 15 % Sn-Ni oxide on the support proportionately increased the amount of basicity by 5.4 times compared to unsupported Sn-Ni oxide (Fig. 7 a and Table 3). This could be due to the effective dispersion of active metal oxides on the support which gave more exposure to the surface acid/base sites compared to their bulk form [80]. The TPD profiles (Figs. 6b and 7b) of supported metal oxide showed an additional peak at higher temperature range compared with those of pure Sn-Ni oxide. This can be attributed to active sites generated by SBA-15/SBA-15-OH support, and thus there was an increase in the acidity and basicity value. With increase in the loading of active metal oxides from 5Sn2.5Ni to 10Sn5Ni, acidity and basicity number also increased. However, further increase in the metal loading to 30Sn15Ni decreased the acidity and basicity of the catalyst affecting primarily the weak and moderate acid and base sites, which could be due to agglomeration of metal oxide species. Later, 15 % of metal oxide concentration was kept constant and the ratio was varied (Figs. S1 and S2) as 1:2, 1:1 (Table S2-entry 8-9), and 2:1 (Table 3-entry 4), where these combinations showed total acid-base sites of 382, 541 and 488 µmol/g respectively. The Sn-Ni oxide loaded with 1:1 ratio showed highest active sites value which could be attributed to an efficient dispersion. The 15 % loading of individual oxide on the support exhibited total acid-base sites of 371 µmol/g (15Sn/SBA-15-OH) and 562 µmol/g (15Ni/SBA-15-OH). 3.1.6 Temperature programmed reduction H2-TPR profiles of 15Sn/SBA-15-OH, 15Ni/SBA-15-OH and 10Sn5Ni/SBA-15-OH are shown in Fig. 8 . The TPR plot of 15Ni/SBA-15-OH showed a broad peak 300–700 °C attributed to reduction of different types of NiO species anchored to the support SBA-15-OH in different chemical environments with 1.0 mmol/g of H2 uptake. This metal oxide-silica interaction is associated with the surface-defect sites generated during alkaline treatment. This hypothesis was further confirmed by the XPS analysis. The 15Sn/SBA-15-OH showed TPR plot from 300 to 700 °C with 0.7 mmol/g of H2 uptake. The flat surface from 300 to 620 °C is attributed to reduction of SnO2 species on the support with weak interaction and sharp peak at 620–700 °C is attributed reduction of SnO2 species with strong interaction. In the 10Sn5Ni/SBA-15-OH catalyst both the peaks of pure metal oxide on support are absent and new peak appeared at 370–600 °C, with peak maxima at 520 °C. This appearance of a new peak at intermediate temperature indicates synergic interaction between Sn and Ni and also with the support [81]. The reduction peak of 10Sn5Ni/SBA-15 appeared in the temperature range of 310–550 °C. The shift in the reduction temperature to higher side in case of 10Sn5Ni/SBA-15-OH compared with that of 10Sn5Ni/SBA-15 indicates the better interaction between metal oxide and support [80]. The higher H2 uptake of 10Sn5Ni/SBA-15-OH compared with 10Sn5Ni/SBA-15 shows the better dispersion of metal oxides on the support. 3.1.7 X-ray photoelectron spectrometer The XPS analysis is used for the determination of valence state and chemical composition of the catalysts. The XPS spectra of the catalysts 15Ni/SBA-15-OH, 15Sn/SBA-15-OH, 10Sn5 Ni/SBA-15, 10Sn5Ni/SBA-15-OH are shown in Fig. 9 a–c. The Ni 2p3/2 and Ni 2p1/2 spectra of 15Ni/SBA-15-OH at binding energy 856.0 eV and 873.1 eV, respectively, suggest that the Ni present in the material is in +2 oxidation state. Also, the deconvoluted peaks of Ni 2p3/2 suggest that Ni+2 present in two different chemical environments. The peak at 854.3 eV is NiO and peak at 856.5 eV is assigned to Ni2SiO4 species, signifying the strong interaction between support SBA-15-OH and NiO [82]. As shown in Fig. 8b 10Sn5Ni/SBA-15-OH catalyst shows relative intensity of the deconvoluted peaks of Ni 2p3/2 has increased in the presence of SnO2. This observation indicates that addition of SnO2 has enhanced the dispersion of NiO species on the support. In case of 10Sn5Ni /SBA-15 (Fig. 9c), Ni 2p3/2 and Ni 2p1/2 peaks at binding energy 855.3 eV and 872.7 eV respectively, showing Ni in +2 oxidation state. The broad and asymmetric peak of Ni2p3/2 shows a similar kind of interaction with support, SBA-15. The Sn 3d spectrum of 15Sn/SBA-15-OH, 10Sn5Ni/SBA-15 and 10Sn5Ni/SBA-15-OH are shown in Fig. 10 a–c. The two peaks of Sn3d5/2 and Sn3d3/2 at binding energy 486.9 ± 0.3 eV and 495.0 ± 0.4 eV respectively, are attributed to Sn4+ state which correspond to SnO2 species. The Si 2p spectra (Fig. S3) of the catalysts show peak at binding energy 103.2 ± 0.2 eV is corresponding to Si present in the mesoporous silica framework and the binding energy at 532.6 ± 0.1 eV of O1 s spectra (Fig. S4) are ascribed to the hydroxyl group associated with Si-OH. 3.2 Catalyst activity studies 3.2.1 Screening studies The cycloaddition of CO2 to styrene oxide (SO) yields styrene carbonate (SC) as the major product and styrene glycol (SG) as the side product. Initially, the reaction was carried out without a catalyst, where it gave 1.1 % yield under conditions; 130 °C, 7 bar(a) CO2 pressure, 15 mmol styrene oxide, 12 ml DMF (Table 4 -entry 1). This result motivated to design a suitable catalyst with acid-base properties for activating epoxide and CO2 to enhance the formation of the desirable product. Firstly, Sn-Ni (2:1) oxide catalyst was tested for this reaction under similar reaction conditions as mentioned above with 180 mg catalyst (10 % w.r.t. to styrene oxide), which gave 46.5 % SO conversion and 99.7 % selectivity for SC as shown in Table 4-entry 2. To improve the activity of the bulk Sn-Ni oxide, it was dispersed on the high surface area support which provides more exposure to the active components. Primarily, the two supports namely SBA-15 and SBA-15-OH-0.2 M were tested for this reaction. The SBA-15 showed 13.1 % SO conversion and 7.5 % yield for SC, whereas SBA-15-OH-0.2 M gave 32.5 % SO conversion and 13.9 % yield for SC. The poor activity of the support could be attributed to the lack of appropriate active sites to activate the reactants. Thus, it is considered that the combination of Sn-Ni oxide and support SBA-15 can bring out a better activity. Therefore, Sn and Ni (2:1) in their oxide form were loaded on SBA-15 and alkali treated SBA-15 (SBA-15-OH-0.2 M) by sol-gel method. The active metal oxides loaded on SBA-15 gave 42.7 % SO conversion and 86.4 % selectivity for SC (Table 4-entry 5), whereas SBA-15-OH-0.2 M supported catalysts showed more enhanced conversion of 77.5 % and 54.3 % selectivity for SC (Table 4-entry 6). Clearly, supported Sn-Ni oxide showed significantly better activity than pure Sn-Ni oxide for the cycloaddition of CO2 to epoxide, where the yield of styrene carbonate enhanced by 16-fold, from 4.2 % to 70 %. Dispersion of active metal species on high surface area SBA-15-OH-0.2 M support and increase in surface hydroxyl groups of the support acting as anchoring sites are responsible in enhancement of the activity. 3.2.2 Effect of alkali treatment and variation of Sn-Ni loading on support Furthermore, the effect of alkali treatment of the SBA-15 support on the conversion and selectivity for the desired product was studied. SBA-15 was treated with different concentrations of NaOH solution (0.05 M, 0.1 M, 0.15 M, and 0.2 M) for desilication to generate more silanol groups and loaded with 20Sn10Ni in their oxide form (Fig. 11 a). The 20Sn10Ni/SBA-15-OH-0.05 M gave 46.5 % SO conversion and 74.6 % selectivity for SC in 4 h reaction time. The conversion and selectivity increased with increase in NaOH concentration to 0.1 M (69.2 % and 87.5 % respectively). The conversion of SO increased further to 77.5 % with increase in the concentration of NaOH solution to 0.2 M, whereas the selectivity for SC decreased to 54.3 %. The stronger alkali treatment >0.1 M resulted in an increase in the side product SG, thus decreasing the selectivity for SC. Hence, SBA-15 treated with 0.1 M NaOH solution is considered as a better support and selected for further screening of catalyst composition. Based on these results, the catalysts are synthesized with different concentrations of active metal oxides keeping the ratio same (2:1). There is an increase in the conversion of SO (51.3 to 84.8 %) with increase in metal oxides concentration from 5Sn2.5Ni to 10Sn5Ni, which can be attributed to the increased acidity of catalysts from 293 to 391 µmol/g. The conversion decreased to 69.2 % and 67.2 % with further increase to 20Sn10Ni and 30Sn15Ni respectively (Fig. 11b). The acidity of the catalysts also decreased from 338 (20Sn10Ni) to 256 µmol/g (30Sn15Ni), where the strength of weak and moderate acid sites decreased drastically resulting in lower conversion. The decrease in the weak basic sites with increased metal oxide concentration (from 5Sn10Ni to 30Sn15Ni) resulted in improved selectivity for SC (80.3 to 88.9 %), whereas the medium and strong basic sites showed a marginal variation. This study shows that 10Sn5Ni is optimum amount of metal loading (15 %) on alkali modified support to get better activity for this reaction. Additionally, the reaction was carried out with Sn-Ni oxide, keeping the catalyst weight same as the amount of Sn-Ni oxide present in 10Sn5Ni/SBA-15-OH-0.1 M and obtained 5.2 % conversion for SO and 81.6 % selectivity for SC (Table 4-entry 3). The lower performance of the Sn-Ni oxide shows the need of support material in enhancing the performance of bulk metal oxides as mentioned previously. Keeping 15 % metal oxide concentration constant, the ratio was changed to 1:2, 1:1, 2:1 and 15 % individual metal oxide was also loaded on support and checked the activity. The loading of individual oxides i.e., NiO and SnO2 on the SBA-15-OH gave lower yield of 11.3 % and 29.3 % respectively which is due to the absence of optimum amount and nature of active sites (Table 5 -entry 5–6). For mixed oxide catalyst 5Sn10Ni/SBA-15-OH with 1:2 ratio, both conversion and selectivity enhanced substantially compared to individual oxide based catalysts (55.7 % SO conversion and 81.7 % selectivity for SC). Using equal amount of Sn and Ni in the catalysts (1:1); 7.5Sn7.5Ni/SBA-15-OH showed lower performance with 32.2 % conversion for SO and 69.7 % selectivity for SC. Thus, the catalyst with Sn:Ni = 2:1 (10Sn5Ni/SBA-15-OH-0.1 M) which gave 84.8 % conversion and 82.5 % selectivity towards SC was the best catalyst with ideal metal oxide combination. Also, 10Sn5Ni/SBA-15 without alkali treatment gave much lower activity (50.6 % conversion for SO and 66.5 % selectivity for SC) which clearly depicts the support SBA-15-OH with a greater number of silanol group has great influence on metal dispersion which reflected in the activity of the catalyst. 3.2.3 Influence of reaction parameters 3.2.3.1 Catalyst concentration Influence of catalyst wt. % on styrene carbonate synthesis from SO and CO2 was studied by varying the catalyst concentration from 5 to 15 wt. % using 10Sn5Ni/SBA-15-OH-0.1 M catalyst. The results illustrated in Fig. 12 a show that as the catalyst concentration increased from 5 to 12 wt. %, both SO conversion and SC selectivity increased from 80.3 to 86.5 % and 74.7 to 76.9 % respectively. Further increase in the catalyst concentration to 15 wt. % varied the conversion only marginally. This could be due to the product saturation on the catalyst surface above 86 % conversion, where the reaction tends to slow down [83]. As there was only a marginal increase in activity above 10 wt. % catalyst, it was selected for further optimization of reaction parameters. 3.2.3.2 Effect of pressure The pressure of CO2 plays a vital role in cycloaddition reaction with epoxide. The effect of CO2 pressure on SO conversion and selectivity for SC was monitored by increasing the CO2 pressure from 7 to 17.5 bar(a) which in turn increases the CO2: SO mole ratio from 1.2 to 2.9. Fig. 12b shows that an increase in CO2 pressure from 7 bar(a) (CO2: SO=1.2) to 10.5 bar(a) (CO2: SO=1.7) increased the SO conversion and SC selectivity from 84.7 to 86.7 % and 75.2 to 85.9 % respectively. Further increasing the CO2 pressure up to 17.5 bar(a), the SO conversion and SC selectivity decrease by 79.7 and 72.5 % respectively. Increase in the molar ratio increases the availability of CO2 and also the pressure brings the molecules closer to facilitate the reaction in favor of the formation of SC [70]. Decrease in selectivity at higher pressures could be due to blockage of basic sites of the catalyst caused due to adsorption of acidic CO2. The obtained results confirm that at 10.5 bar(a) CO2 pressure catalyst showed high conversion and selectivity. 3.2.3.3 Effect of reaction temperature To understand the effect of reaction temperature, the reaction was carried out for 4 h under 10.5 bar(a) pressure and 10 wt. % catalyst loading. It is observed that as the temperature increased from 110 to 140 °C (Fig. 12c), there was an increase in the conversion of SO from 66.3 to 93.2 % and further increasing the temperature to 150 °C did not influence significantly on the SO conversion. The selectivity for SC also increased from 80.5 to 85.9 % in the temperature range 110 °C to 130 °C, however it decreased to 73.1 % at 150 °C due to increase in the formation of styrene glycol side product. Thus, 130 C is considered as the optimum temperature for this reaction. 3.2.3.4 Time resolved study The effect of reaction time was investigated under optimized conditions using 10Sn5Ni/SBA-15-OH-0.1 M catalyst. There was an almost linear increase in SO conversion from 0 to 92.9 % in 5 h, then there was a marginal increase in the conversion till 8 h reaction time (Fig. 12d). The selectivity towards SC was 86.5 % in the first hour and remained almost same up to 5 h reaction time and later it decreased to 79.7 % which is due to the formation of the side product styrene glycol. 3.2.4 Leaching studies and recyclability The catalyst 10Sn5Ni/SBA-15-OH was subjected for the leaching test to check whether any active species leached out in the reaction medium during the reaction. Initially, the reaction was carried out with a catalyst for 2 h and it showed 59.9 % SO conversion. Later, the catalyst was removed from the reaction mixture and the reaction was continued for 8 h. There was negligible increase in the conversion of SO (62.4 %) at the end of 8 h which confirmed the heterogeneity of the catalyst (Fig. 13 ). One of the essential criteria of the heterogeneous catalyst is retaining its activity upon multiple cycles. The reactions were carried out for 5 h at 130 °C and 10.5 bar(a) CO2 and the results are depicted in Fig. 14 . For the 2nd cycle, the conversion of styrene oxide decreased by 2 % compared to the 1st one. From the 3rd cycle, there was a marginal decrease in the conversion in the range 0.5−2 % and the selectivity for SC remained almost the same (<2 %) throughout the 5 cycles. In addition, the re-used catalyst was characterized to check the integrity of its structural and textural properties. The wide-angle XRD pattern of the spent catalyst showed the presence of all the characteristic peaks of Sn-Ni oxide that were present in the fresh catalyst (Fig. S5a). The TGA profile of spent catalyst showed 9 % of weight loss that corresponds to the loss of adsorbed organic species (Fig. S5b). N2-sorption analysis showed type-IV isotherm with H1-type hysteresis loop and narrow pore size distribution with a little decrease in the surface area and almost the same pore size which indicates that the ordered mesoporous structure of catalyst was retained after a number of recycles of the catalyst which confirms the stability of the catalyst (Fig. S5c-d, Table S4). The acidity and basicity values of the catalyst decreased marginally after these recycles (Fig. S3e-f, Table S4). 3.2.5 Cycloaddition of CO2 to different epoxides Different epoxides were tested for the cycloaddition reaction between CO2 and epoxides to synthesize cyclic carbonate under optimized condition using 10Sn5Ni/SBA-15-OH catalyst (Table 6 ). Styrene oxide and 1, 2-Epoxy-3-phenoxy-propane gave lower yield for corresponding cyclic carbonates (78.3 and 71.2 %) compared to propylene oxide and epichlorohydrin (∼83 %) which could be due to the steric hindrance created by side chain substituent of the aromatic epoxides. Cyclohexene oxide gave lowest yield (24.8 %) as it is characteristically different from other epoxides. The epoxide ring of cyclohexene oxide is fused with the six membered cyclic ring which makes activation of epoxide difficult compared with others. 3.2.6 Plausible mechanism Based on the understanding of active sites of the catalyst and the reaction, a plausible reaction mechanism is proposed for the synthesis of styrene carbonate from styrene oxide and CO2 (Scheme 1 ). The silanol groups in synergy with Sn-Ni oxide serve as anchoring sites for the active centers of SnNi/SBA-15-OH catalyst. The reaction starts with adsorption of CO2 on the basic site (B), while SO coordinates with acidic site (A) present on the catalyst surface. The CO2 adsorbs on the coordinatively unsaturated oxygen anion (basic site) of mixed metal oxide forming carbonate species, while styrene oxide adsorbs on the coordinatively unsaturated metal centers (acidic sites). The weakly acidic, free silanol groups may also activate epoxide ring along with acidic centers of metal oxide. The activated CO2 in the carbonate form attacks epoxide and induces ring opening to form an intermediate. The oxyanion species of the intermediate attacks the carbocation to yield styrene carbonate. 4 Conclusions Supported bimetallic oxide catalyst was designed for CO2 transformation into cyclic carbonate. SnNi/SBA-15-OH is a novel catalyst with no prior report and found that the silanol groups act as anchoring sites for the active metal oxide site for CO2 transformation. The Sn-Ni oxide was loaded on the alkali treated SBA-15 support a sol-gel method using citric acid as a complexing agent. The TPD studies showed that the catalysts contained both acidic and basic sites required for the activation of epoxide and CO2 respectively. Supported Sn-Ni oxide showed better activity than pure Sn-Ni oxide by 16-fold due to the better dispersion of active sites on the support which enhances the accessibility of reactants to the catalytic sites. The metal oxide dispersion and its interaction with support was enhanced substantially with the presence of higher silanol groups in SBA-15-OH compared with untreated SBA-15 support as shown by H2-TPR studies and increased the catalyst performance by 55 %. Different compositions of active metal oxide on the modified support (SBA-15-OH) were studied. Sn-Ni (2:1) with 15 % loading was found to be sufficient to get high activity for the reaction. Under optimised conditions 10Sn5Ni/SBA-15-OH gave 92.9 % styrene oxide conversion and 84.3 % selectivity for styrene carbonate at 140 °C and 10.5 bar(a) pressure in 5 h. Thus, the supported Sn-Ni oxide is the efficient catalyst with better recyclability and versatile catalyst for the synthesis of cyclic carbonate from various epoxide with CO2. CRediT authorship contribution statement Chaitra N. Mallannavar: Writing – review & editing, Writing – original draft, Validation, Methodology, Investigation, Formal analysis, Data curation, Conceptualization. S. Sujith: Validation, Investigation. Shrinidhi D. Patil: Methodology. Sanjeev P. Maradur: Writing – review & editing, Resources. Ganapati V. Shanbhag: Writing – review & editing, Supervision, Project administration, Conceptualization. Declaration of competing interest The authors declare that they have no known competing financial interests or personal relationships that could have appeared to influence the work reported in this paper. Acknowledgements GVS is thankful to Vision Group on Science and Technology (VGST), Govt. of Karnataka, India for sponsoring the project under Centre of Excellence in Science Engineering and Medicine (CESEM) Grant (GRD No 307). The authors acknowledge Admar Mutt Education Foundation (AMEF), Bengaluru for providing the research facilities. Supplementary materials Supplementary material associated with this article can be found, in the online version, at doi:10.1016/j.mcat.2025.115029. Appendix Supplementary materials Image, application 1 References [1] M. He Y. Sun B. Han Green carbon science: scientific basis for integrating carbon resource processing, utilization, and recycling Angew. Chem. Int, Ed. 52 2013 M. He, Y. Sun, B. Han, Green carbon science: scientific basis for integrating carbon resource processing, utilization, and recycling, Angew. Chem. Int, Ed., 52 (2013). [2] H. Arakawa M. Aresta J.N. Armor M.A. Barteau E.J. Beckman A.T. Bell J.E. Bercaw C. Creutz E. Dinjus D.A. Dixon Catalysis research of relevance to carbon management: progress, challenges, and opportunities Chem. Rev. 101 2001 953 996 H. Arakawa, M. Aresta, J.N. Armor, M.A. Barteau, E.J. Beckman, A.T. Bell, J.E. Bercaw, C. Creutz, E. Dinjus, D.A. Dixon, Catalysis research of relevance to carbon management: progress, challenges, and opportunities, Chem. Rev., 101 (2001) 953–996. [3] T. Sakakura J.C. Choi H. Yasuda Transformation of carbon dioxide Chem. Rev. 107 2007 2365 2387 T. Sakakura, J.C. Choi, H. Yasuda, Transformation of carbon dioxide, Chem. Rev., 107 (2007) 2365–2387. [4] M. Aresta A. Dibenedetto Utilisation of CO2 as a chemical feedstock: opportunities and challenges Dalton Trans. 2007 2975 2992 M. Aresta, A. Dibenedetto, Utilisation of CO2 as a chemical feedstock: opportunities and challenges, Dalton Trans., (2007) 2975–2992. [5] N.A.M. Razali K.T. Lee S. Bhatia A.R. Mohamed Heterogeneous catalysts for production of chemicals using carbon dioxide as raw material: a review Renew. Sustain. Energy Rev. 16 2012 4951 4964 N.A.M. Razali, K.T. Lee, S. Bhatia, A.R. Mohamed, Heterogeneous catalysts for production of chemicals using carbon dioxide as raw material: a review, Renew. Sustain. Energy Rev., 16 (2012) 4951–4964. [6] P.T. Anastas Meeting the challenges to sustainability through green chemistry Green Chem. 5 2003 G29 G34 P.T. Anastas, Meeting the challenges to sustainability through green chemistry, Green Chem., 5 (2003) G29–G34. [7] C. Song Global challenges and strategies for control, conversion and utilization of CO2 for sustainable development involving energy, catalysis, adsorption and chemical processing Catal. Today 115 2006 2 32 C. Song, Global challenges and strategies for control, conversion and utilization of CO2 for sustainable development involving energy, catalysis, adsorption and chemical processing, Catal. Today, 115 (2006) 2–32. [8] J.R. Ochoa-Gómez O. Gómez-Jiménez-Aberasturi C. Ramirez-Lopez M. Belsué A brief review on industrial alternatives for the manufacturing of glycerol carbonate, a green chemical Org. Process Res. Dev. 16 2012 389 399 J.R. Ochoa-Gómez, O. Gómez-Jiménez-Aberasturi, C. Ramirez-Lopez, M. Belsué, A brief review on industrial alternatives for the manufacturing of glycerol carbonate, a green chemical, Org. Process Res. Dev., 16 (2012) 389–399. [9] M. North R. Pasquale C. Young Synthesis of cyclic carbonates from epoxides and CO2 Green Chem. 12 2010 1514 1539 M. North, R. Pasquale, C. Young, Synthesis of cyclic carbonates from epoxides and CO2, Green Chem., 12 (2010) 1514–1539. [10] C.J. Whiteoak N. Kielland V. Laserna E.C. Escudero-Adan E. Martin A.W. Kleij A powerful aluminum catalyst for the synthesis of highly functional organic carbonates J. Am. Chem. Soc. 135 2013 1228 1231 C.J. Whiteoak, N. Kielland, V. Laserna, E.C. Escudero-Adan, E. Martin, A.W. Kleij, A powerful aluminum catalyst for the synthesis of highly functional organic carbonates, J. Am. Chem. Soc., 135 (2013) 1228–1231. [11] H. Zhou G.X. Wang W.Z. Zhang X.B. Lu CO2 adducts of phosphorus ylides: highly active organocatalysts for carbon dioxide transformation ACS Catal. 5 2015 6773 6779 H. Zhou, G.X. Wang, W.Z. Zhang, X.B. Lu, CO2 adducts of phosphorus ylides: highly active organocatalysts for carbon dioxide transformation, ACS Catal., 5 (2015) 6773–6779. [12] H. Sabet-Sarvestani M. Izadyar H. Eshghi Phosphorus ylides as a new class of compounds in CO2 activation: thermodynamic and kinetic studies J. CO2 Util. 21 2017 459 466 H. Sabet-Sarvestani, M. Izadyar, H. Eshghi, Phosphorus ylides as a new class of compounds in CO2 activation: thermodynamic and kinetic studies, J. CO2 Util., 21 (2017) 459–466. [13] H. Sabet-Sarvestani M. Izadyar H. Eshghi N. Norozi-Shad Evaluation and understanding the performances of various derivatives of carbonyl-stabilized phosphonium ylides in CO2 transformation to cyclic carbonates Phys. Chem. Chem. Phys. 22 2020 223 237 H. Sabet-Sarvestani, M. Izadyar, H. Eshghi, N. Norozi-Shad, Evaluation and understanding the performances of various derivatives of carbonyl-stabilized phosphonium ylides in CO2 transformation to cyclic carbonates, Phys. Chem. Chem. Phys., 22 (2020) 223–237. [14] Z. Dai F. Qin H. Zhao J. Ding Y. Liu R. Chen Crystal defect engineering of aurivillius Bi2MoO6 by Ce doping for increased reactive species production in photocatalysis ACS Catal. 6 2016 3180 3192 Z. Dai, F. Qin, H. Zhao, J. Ding, Y. Liu, R. Chen, Crystal defect engineering of aurivillius Bi2MoO6 by Ce doping for increased reactive species production in photocatalysis, ACS Catal., 6 (2016) 3180–3192. [15] X.M. Hu M.H. Rønne S.U. Pedersen T. Skrydstrup K. Daasbjerg Enhanced catalytic activity of cobalt porphyrin in CO2 electroreduction upon immobilization on carbon materials Angew. Chem. Int, Ed. 56 2017 6468 6472 X.M. Hu, M.H. Rønne, S.U. Pedersen, T. Skrydstrup, K. Daasbjerg, Enhanced catalytic activity of cobalt porphyrin in CO2 electroreduction upon immobilization on carbon materials, Angew. Chem. Int, Ed., 56 (2017) 6468–6472. [16] L. Liu S. Jayakumar J. Chen L. Tao H. Li Q. Yang C. Li Synthesis of bifunctional porphyrin polymers for catalytic conversion of dilute CO2 to cyclic carbonates ACS Appl. Mater. Interfaces 13 2021 29522 29531 L. Liu, S. Jayakumar, J. Chen, L. Tao, H. Li, Q. Yang, C. Li, Synthesis of bifunctional porphyrin polymers for catalytic conversion of dilute CO2 to cyclic carbonates, ACS Appl. Mater. Interfaces, 13 (2021) 29522–29531. [17] L. Schoepff L. Monnereau S. Durot S. Jenni C. Gourlaouen V. Heitz A flexible bis-Co (III) porphyrin cage as a bimetallic catalyst for the conversion of CO2 and epoxides into cyclic carbonates ChemCatChem 12 2020 5826 5833 L. Schoepff, L. Monnereau, S. Durot, S. Jenni, C. Gourlaouen, V. Heitz, A flexible bis-Co (III) porphyrin cage as a bimetallic catalyst for the conversion of CO2 and epoxides into cyclic carbonates, ChemCatChem, 12 (2020) 5826–5833. [18] X. Bai Z. Su J. Wei L. Ma S. Duan N. Wang X. Zhang J. Li Zinc (II) porphyrin-based porous ionic polymers (PIPs) as multifunctional heterogeneous catalysts for the conversion of CO2 to cyclic carbonates Ind. Eng. Chem. Res. 61 2022 5093 5102 X. Bai, Z. Su, J. Wei, L. Ma, S. Duan, N. Wang, X. Zhang, J. Li, Zinc (II) porphyrin-based porous ionic polymers (PIPs) as multifunctional heterogeneous catalysts for the conversion of CO2 to cyclic carbonates, Ind. Eng. Chem. Res., 61 (2022) 5093–5102. [19] W. Wang C. Li J. Jin L. Yan Y. Ding Mg–porphyrin complex doped divinylbenzene based porous organic polymers (POPs) as highly efficient heterogeneous catalysts for the conversion of CO2 to cyclic carbonates Dalton Trans. 47 2018 13135 13141 W. Wang, C. Li, J. Jin, L. Yan, Y. Ding, Mg–porphyrin complex doped divinylbenzene based porous organic polymers (POPs) as highly efficient heterogeneous catalysts for the conversion of CO2 to cyclic carbonates, Dalton Trans., 47 (2018) 13135–13141. [20] B. Schaffner F. Schaffner S.P. Verevkin A. Borner Organic carbonates as solvents in synthesis and catalysis Chem. Rev. 110 2010 4554 4581 B. Schaffner, F. Schaffner, S.P. Verevkin, A. Borner, Organic carbonates as solvents in synthesis and catalysis, Chem. Rev., 110 (2010) 4554–4581. [21] G.P. Wu D.J. Darensbourg X.B. Lu Tandem metal-coordination copolymerization and organocatalytic ring-opening polymerization via water to synthesize diblock copolymers of styrene oxide/CO2 and lactide J. Am. Chem. Soc. 134 2012 17739 17745 G.P. Wu, D.J. Darensbourg, X.B. Lu, Tandem metal-coordination copolymerization and organocatalytic ring-opening polymerization via water to synthesize diblock copolymers of styrene oxide/CO2 and lactide, J. Am. Chem. Soc., 134 (2012) 17739–17745. [22] R.L. Paddock S.T. Nguyen Chemical CO2 fixation: Cr (III) salen complexes as highly efficient catalysts for the coupling of CO2 and epoxides J. Am. Chem. Soc. 123 2001 11498 11499 R.L. Paddock, S.T. Nguyen, Chemical CO2 fixation: Cr (III) salen complexes as highly efficient catalysts for the coupling of CO2 and epoxides, J. Am. Chem. Soc., 123 (2001) 11498–11499. [23] V. Aomchad S. Del Gobbo P. Yingcharoen A. Poater V. D'Elia Exploring the potential of group III salen complexes for the conversion of CO2 under ambient conditions Catal. Today 375 2021 324 334 V. Aomchad, S. Del Gobbo, P. Yingcharoen, A. Poater, V. D'Elia, Exploring the potential of group III salen complexes for the conversion of CO2 under ambient conditions, Catal. Today, 375 (2021) 324–334. [24] F. Jutz J.D. Grunwaldt A. Baiker Mn (III)(salen)-catalyzed synthesis of cyclic organic carbonates from propylene and styrene oxide in “supercritical” CO2 J. Mol. Catal. A Chem. 279 2008 94 103 F. Jutz, J.D. Grunwaldt, A. Baiker, Mn (III)(salen)-catalyzed synthesis of cyclic organic carbonates from propylene and styrene oxide in “supercritical” CO2, J. Mol. Catal. A Chem., 279 (2008) 94–103. [25] E.D. Butler Iron amino-phenolate complexes as catalysts for CO₂ activation 2018 Diss. Memorial University of Newfoundland http://research.library.mun.ca/id/eprint/13294 E.D. Butler, Iron amino-phenolate complexes as catalysts for CO... activation, Diss. Memorial University of Newfoundland, 2018. http://research.library.mun.ca/id/eprint/13294. [26] A.I. Elkurtehi Synthesis and characterization of transition metal amino-phenolate complexes and their reactivity towards the oxidation of lignin model compounds and cyclic carbonate formation 2017 Diss. Memorial University of Newfoundland http://research.library.mun.ca/id/eprint/15293 A.I. Elkurtehi, Synthesis and characterization of transition metal amino-phenolate complexes and their reactivity towards the oxidation of lignin model compounds and cyclic carbonate formation, Diss. Memorial University of Newfoundland, 2017. http://research.library.mun.ca/id/eprint/15293. [27] Y. Xie Z. Zhang T. Jiang J. He B. Han T. Wu K. Ding CO2 cycloaddition reactions catalyzed by an ionic liquid grafted onto a highly cross-linked polymer matrix Angew. Chem. Int, Ed. 46 2007 7255 7258 Y. Xie, Z. Zhang, T. Jiang, J. He, B. Han, T. Wu, K. Ding, CO2 cycloaddition reactions catalyzed by an ionic liquid grafted onto a highly cross-linked polymer matrix, Angew. Chem. Int, Ed., 46 (2007) 7255–7258. [28] W. Wang C. Li L. Yan Y. Wang M. Jiang Y. Ding Ionic liquid/Zn-PPh3 integrated porous organic polymers featuring multifunctional sites: highly active heterogeneous catalyst for cooperative conversion of CO2 to cyclic carbonates ACS Catal. 6 2016 6091 6100 W. Wang, C. Li, L. Yan, Y. Wang, M. Jiang, Y. Ding, Ionic liquid/Zn-PPh3 integrated porous organic polymers featuring multifunctional sites: highly active heterogeneous catalyst for cooperative conversion of CO2 to cyclic carbonates, ACS Catal., 6 (2016) 6091–6100. [29] G. Long D. Wu H. Pan T. Zhao X. Hu Imidazolium hydrogen carbonate ionic liquids: versatile organocatalysts for chemical conversion of CO2 into valuable chemicals J. CO2 Util. 39 2020 101155 G. Long, D. Wu, H. Pan, T. Zhao, X. Hu, Imidazolium hydrogen carbonate ionic liquids: versatile organocatalysts for chemical conversion of CO2 into valuable chemicals, J. CO2 Util., 39 (2020) 101155. [30] J. Liu G. Yang Y. Liu D. Wu X. Hu Z. Zhang Metal-free imidazolium hydrogen carbonate ionic liquids as bifunctional catalysts for the one-pot synthesis of cyclic carbonates from olefins and CO2 Green Chem. 21 2019 3834 3838 J. Liu, G. Yang, Y. Liu, D. Wu, X. Hu, Z. Zhang, Metal-free imidazolium hydrogen carbonate ionic liquids as bifunctional catalysts for the one-pot synthesis of cyclic carbonates from olefins and CO2, Green Chem., 21 (2019) 3834–3838. [31] Y. Wang J. Nie C. Lu F. Wang C. Ma Z. Chen G. Yang Imidazolium-based polymeric ionic liquids for heterogeneous catalytic conversion of CO2 into cyclic carbonates Microporous Mesoporous Mater. 292 2020 109751 Y. Wang, J. Nie, C. Lu, F. Wang, C. Ma, Z. Chen, G. Yang, Imidazolium-based polymeric ionic liquids for heterogeneous catalytic conversion of CO2 into cyclic carbonates, Microporous Mesoporous Mater., 292 (2020) 109751. [32] A. Mirabaud J.C. Mulatier A. Martinez J.P. Dutasta V. Dufaud Investigating host–guest complexes in the catalytic synthesis of cyclic carbonates from styrene oxide and CO2 ACS Catal. 5 2015 6748 6752 A. Mirabaud, J.C. Mulatier, A. Martinez, J.P. Dutasta, V. Dufaud, Investigating host–guest complexes in the catalytic synthesis of cyclic carbonates from styrene oxide and CO2, ACS Catal., 5 (2015) 6748–6752. [33] X. Xin H. Shan T. Tian Y. Wang D. Yuan H. You Y. Yao Conversion of CO2 into cyclic carbonates under ambient conditions catalyzed by rare-earth metal complexes bearing poly (phenolato) ligand ACS Sustain. Chem. Eng. 8 2020 13185 13194 X. Xin, H. Shan, T. Tian, Y. Wang, D. Yuan, H. You, Y. Yao, Conversion of CO2 into cyclic carbonates under ambient conditions catalyzed by rare-earth metal complexes bearing poly (phenolato) ligand, ACS Sustain. Chem. Eng., 8 (2020) 13185–13194. [34] M. Ulusoy A. Kilic M. Durgun Z. Tasci B. Cetinkaya Silicon containing new salicylaldimine Pd (II) and Co (II) metal complexes as efficient catalysts in transformation of carbon dioxide (CO2) to cyclic carbonates J. Organomet. Chem. 696 2011 1372 1379 M. Ulusoy, A. Kilic, M. Durgun, Z. Tasci, B. Cetinkaya, Silicon containing new salicylaldimine Pd (II) and Co (II) metal complexes as efficient catalysts in transformation of carbon dioxide (CO2) to cyclic carbonates, J. Organomet. Chem., 696 (2011) 1372–1379. [35] W.L. Dai S.L. Luo S.F. Yin C.T. Au The direct transformation of carbon dioxide to organic carbonates over heterogeneous catalysts Appl. Catal. A Gen. 366 2009 2 12 W.L. Dai, S.L. Luo, S.F. Yin, C.T. Au, The direct transformation of carbon dioxide to organic carbonates over heterogeneous catalysts, Appl. Catal. A Gen., 366 (2009) 2–12. [36] J. Ma N. Sun X. Zhang N. Zhao F. Xiao W. Wei Y. Sun A short review of catalysis for CO2 conversion Catal. Today 148 2009 221 231 J. Ma, N. Sun, X. Zhang, N. Zhao, F. Xiao, W. Wei, Y. Sun, A short review of catalysis for CO2 conversion, Catal. Today, 148 (2009) 221–231. [37] X.L. Meng Y. Nie J. Sun W.G. Cheng J.Q. Wang H.Y. He S.J. Zhang Functionalized dicyandiamide–formaldehyde polymers as efficient heterogeneous catalysts for conversion of CO2 into organic carbonates Green Chem. 16 2014 2771 2778 X.L. Meng, Y. Nie, J. Sun, W.G. Cheng, J.Q. Wang, H.Y. He, S.J. Zhang, Functionalized dicyandiamide–formaldehyde polymers as efficient heterogeneous catalysts for conversion of CO2 into organic carbonates, Green Chem., 16 (2014) 2771–2778. [38] K. Huang J.Y. Zhang F. Liu S. Dai Synthesis of porous polymeric catalysts for the conversion of carbon dioxide ACS Catal. 8 2018 9079 9102 K. Huang, J.Y. Zhang, F. Liu, S. Dai, Synthesis of porous polymeric catalysts for the conversion of carbon dioxide, ACS Catal., 8 (2018) 9079–9102. [39] A. Jawad F. Rezaei A.A. Rownaghi Porous polymeric hollow fibers as bifunctional catalysts for CO2 conversion to cyclic carbonates J. CO2 Util. 21 2017 589 596 A. Jawad, F. Rezaei, A.A. Rownaghi, Porous polymeric hollow fibers as bifunctional catalysts for CO2 conversion to cyclic carbonates, J. CO2 Util., 21 (2017) 589–596. [40] Y. Li X. Zhang J. Lan D. Li Z. Wang P. Xu J. Sun A high-performance zinc-organic framework with accessible open metal sites catalyzes CO2 and styrene oxide into styrene carbonate under mild conditions ACS Sustain. Chem. Eng. 9 2021 2795 2803 Y. Li, X. Zhang, J. Lan, D. Li, Z. Wang, P. Xu, J. Sun, A high-performance zinc-organic framework with accessible open metal sites catalyzes CO2 and styrene oxide into styrene carbonate under mild conditions, ACS Sustain. Chem. Eng., 9 (2021) 2795–2803. [41] J. Kim S.N. Kim H.G. Jang G. Seo W.S. Ahn CO2 cycloaddition of styrene oxide over MOF catalysts Appl. Catal. A Gen. 453 2013 175 180 J. Kim, S.N. Kim, H.G. Jang, G. Seo, W.S. Ahn, CO2 cycloaddition of styrene oxide over MOF catalysts, Appl. Catal. A Gen., 453 (2013) 175–180. [42] M. Zhu D. Srinivas S. Bhogeswararao P. Ratnasamy M.A. Carreon Catalytic activity of ZIF-8 in the synthesis of styrene carbonate from CO2 and styrene oxide Catal. Commun. 32 2013 36 40 M. Zhu, D. Srinivas, S. Bhogeswararao, P. Ratnasamy, M.A. Carreon, Catalytic activity of ZIF-8 in the synthesis of styrene carbonate from CO2 and styrene oxide, Catal. Commun., 32 (2013) 36–40. [43] S. Huh Direct catalytic conversion of CO2 to cyclic organic carbonates under mild reaction conditions by metal—Organic frameworks Catalysts 9 2019 34 S. Huh, Direct catalytic conversion of CO2 to cyclic organic carbonates under mild reaction conditions by metal—Organic frameworks, Catalysts, 9 (2019) 34. [44] K. Xu A.M.P. Moeljadi B.K. Mai H. Hirao How does CO2 react with styrene oxide in Co-MOF-74 and Mg-MOF-74? Catalytic mechanisms proposed by QM/MM calculations J. Phys. Chem. C 122 2018 503 514 K. Xu, A.M.P. Moeljadi, B.K. Mai, H. Hirao, How does CO2 react with styrene oxide in Co-MOF-74 and Mg-MOF-74? Catalytic mechanisms proposed by QM/MM calculations, J. Phys. Chem. C, 122 (2018) 503–514. [45] X.H. Ji N.N. Zhu J.G. Ma P. Cheng Conversion of CO2 into cyclic carbonates by a Co (ii) metal–organic framework and the improvement of catalytic activity via nanocrystallization Dalton Trans. 47 2018 1768 1771 X.H. Ji, N.N. Zhu, J.G. Ma, P. Cheng, Conversion of CO2 into cyclic carbonates by a Co (ii) metal–organic framework and the improvement of catalytic activity via nanocrystallization, Dalton Trans., 47 (2018) 1768–1771. [46] Y. Wu X. Song S. Li J. Zhang X. Yang P. Shen L. Gao R. Wei J. Zhang G. Xiao 3D-monoclinic M–BTC MOF (M= Mn, Co, Ni) as highly efficient catalysts for chemical fixation of CO2 into cyclic carbonates J. Ind. Eng. Chem. 58 2018 296 303 Y. Wu, X. Song, S. Li, J. Zhang, X. Yang, P. Shen, L. Gao, R. Wei, J. Zhang, G. Xiao, 3D-monoclinic M–BTC MOF (M= Mn, Co, Ni) as highly efficient catalysts for chemical fixation of CO2 into cyclic carbonates, J. Ind. Eng. Chem., 58 (2018) 296–303. [47] P.T. Nguyen Y.B. Tran Copper-based metal-organic framework for selective CO2 adsoprtion and catalysis fixation of CO2 into cyclic carbonates ChemistrySelect 6 2021 4067 4073 P.T. Nguyen, Y.B. Tran, Copper-based metal-organic framework for selective CO2 adsoprtion and catalysis fixation of CO2 into cyclic carbonates, ChemistrySelect, 6 (2021) 4067–4073. [48] Y. Wu X. Song J. Zhang S. Xu L. Gao J. Zhang G. Xiao Mn-based MOFs as efficient catalysts for catalytic conversion of carbon dioxide into cyclic carbonates and DFT studies Chem. Eng. Sci. 201 2019 288 297 Y. Wu, X. Song, J. Zhang, S. Xu, L. Gao, J. Zhang, G. Xiao, Mn-based MOFs as efficient catalysts for catalytic conversion of carbon dioxide into cyclic carbonates and DFT studies, Chem. Eng. Sci., 201 (2019) 288–297. [49] O.V. Zalomaeva A.M. Chibiryaev K.A. Kovalenko O.A. Kholdeeva B.S. Balzhinimaev V.P. Fedin Cyclic carbonates synthesis from epoxides and CO2 over metal–organic framework Cr-MIL-101 J. Catal. 298 2013 179 185 O.V. Zalomaeva, A.M. Chibiryaev, K.A. Kovalenko, O.A. Kholdeeva, B.S. Balzhinimaev, V.P. Fedin, Cyclic carbonates synthesis from epoxides and CO2 over metal–organic framework Cr-MIL-101, J. Catal., 298 (2013) 179–185. [50] M. Zhu M.A. Carreon Porous crystals as active catalysts for the synthesis of cyclic carbonates J. Appl. Polym. Sci. 131 2014 M. Zhu, M.A. Carreon, Porous crystals as active catalysts for the synthesis of cyclic carbonates, J. Appl. Polym. Sci., 131 (2014). [51] S. Zhang H. Zhang F. Cao Y. Ma Y. Qu Catalytic behavior of graphene oxides for converting CO2 into cyclic carbonates at one atmospheric pressure ACS Sustain. Chem. Eng. 6 2018 4204 4211 S. Zhang, H. Zhang, F. Cao, Y. Ma, Y. Qu, Catalytic behavior of graphene oxides for converting CO2 into cyclic carbonates at one atmospheric pressure, ACS Sustain. Chem. Eng., 6 (2018) 4204–4211. [52] P. Heydari A. Hafizi M. Rahimpour R. Khalifeh Experimental investigation of improved graphene oxide as an efficient catalyst for the sustainable chemical fixation of CO2 with epoxides J. Environ. Chem. Eng. 8 2020 104568 P. Heydari, A. Hafizi, M. Rahimpour, R. Khalifeh, Experimental investigation of improved graphene oxide as an efficient catalyst for the sustainable chemical fixation of CO2 with epoxides, J. Environ. Chem. Eng., 8 (2020) 104568. [53] D.H. Lan F.M. Yang S.L. Luo C.T. Au S.F. Yin Water-tolerant graphene oxide as a high-efficiency catalyst for the synthesis of propylene carbonate from propylene oxide and carbon dioxide Carbon 73 2014 351 360 D.H. Lan, F.M. Yang, S.L. Luo, C.T. Au, S.F. Yin, Water-tolerant graphene oxide as a high-efficiency catalyst for the synthesis of propylene carbonate from propylene oxide and carbon dioxide, Carbon, 73 (2014) 351–360. [54] S. Kumar M.Y. Wani J. Koh J.M. Gil A.J. Sobral Carbon dioxide adsorption and cycloaddition reaction of epoxides using chitosan–graphene oxide nanocomposite as a catalyst J. Environ. Sci. 69 2018 77 84 S. Kumar, M.Y. Wani, J. Koh, J.M. Gil, A.J. Sobral, Carbon dioxide adsorption and cycloaddition reaction of epoxides using chitosan–graphene oxide nanocomposite as a catalyst, J. Environ. Sci., 69 (2018) 77–84. [55] S. Ravi R. Roshan J. Tharun A.C. Kathalikkattil D.W. Park Sulfonic acid functionalized mesoporous SBA-15 as catalyst for styrene carbonate synthesis from CO2 and styrene oxide at moderate reaction conditions J. CO2 Util. 10 2015 88 94 S. Ravi, R. Roshan, J. Tharun, A.C. Kathalikkattil, D.W. Park, Sulfonic acid functionalized mesoporous SBA-15 as catalyst for styrene carbonate synthesis from CO2 and styrene oxide at moderate reaction conditions, J. CO2 Util., 10 (2015) 88–94. [56] X. Zhang N. Zhao W. Wei Y. Sun Chemical fixation of carbon dioxide to propylene carbonate over amine-functionalized silica catalysts Catal. Today 115 2006 102 106 X. Zhang, N. Zhao, W. Wei, Y. Sun, Chemical fixation of carbon dioxide to propylene carbonate over amine-functionalized silica catalysts, Catal. Today, 115 (2006) 102–106. [57] N.A. Raju D. Prasad P.M. Srinivasappa A.V. Biradar S.S. Gholap A.K. Samal B.M. Nagaraja A.H. Jadhav Recent developments in state-of-the-art silica-modified catalysts for the fixation of CO2 in epoxides to form organic carbonates Sustain. Energy Fuels 6 2022 1198 1248 N.A. Raju, D. Prasad, P.M. Srinivasappa, A.V. Biradar, S.S. Gholap, A.K. Samal, B.M. Nagaraja, A.H. Jadhav, Recent developments in state-of-the-art silica-modified catalysts for the fixation of CO2 in epoxides to form organic carbonates, Sustain. Energy Fuels, 6 (2022) 1198–1248. [58] N. Guha A.K. Gupta S. Chatterjee S. Krishnan M.K. Singh D.K. Rai Environmentally benign melamine functionalized silica-coated iron oxide for selective CO2 capture and fixation into cyclic carbonate J. CO2 Util. 49 2021 101575 N. Guha, A.K. Gupta, S. Chatterjee, S. Krishnan, M.K. Singh, D.K. Rai, Environmentally benign melamine functionalized silica-coated iron oxide for selective CO2 capture and fixation into cyclic carbonate, J. CO2 Util., 49 (2021) 101575. [59] Q. Su J. Sun J. Wang Z. Yang W. Cheng S. Zhang Urea-derived graphitic carbon nitride as an efficient heterogeneous catalyst for CO2 conversion into cyclic carbonates Catal. Sci. Technol. 4 2014 1556 1562 Q. Su, J. Sun, J. Wang, Z. Yang, W. Cheng, S. Zhang, Urea-derived graphitic carbon nitride as an efficient heterogeneous catalyst for CO2 conversion into cyclic carbonates, Catal. Sci. Technol., 4 (2014) 1556–1562. [60] S. Samanta R. Srivastava Catalytic conversion of CO2 to chemicals and fuels: the collective thermocatalytic/photocatalytic/electrocatalytic approach with graphitic carbon nitride Mater. Adv. 1 2020 1506 1545 S. Samanta, R. Srivastava, Catalytic conversion of CO2 to chemicals and fuels: the collective thermocatalytic/photocatalytic/electrocatalytic approach with graphitic carbon nitride, Mater. Adv., 1 (2020) 1506–1545. [61] N. Liu F. Wu J. Xu B. Xue J. Luo ZrO2 supported on graphitic carbon nitride based on metal–nitrogen interaction for enhanced catalytic cycloaddition of CO2 to cyclic carbonates Catal. Lett. 153 2023 1483 1494 N. Liu, F. Wu, J. Xu, B. Xue, J. Luo, ZrO2 supported on graphitic carbon nitride based on metal–nitrogen interaction for enhanced catalytic cycloaddition of CO2 to cyclic carbonates, Catal. Lett., 153 (2023) 1483–1494. [62] N. Liu J. Du J. Xu B. Xue J. Luo Efficient synthesis of cyclic carbonate via transformation of CO2 catalyzed by solid-base bifunctional graphitic carbon nitride materials Res. Chem. Intermed. 48 2022 4883 4900 N. Liu, J. Du, J. Xu, B. Xue, J. Luo, Efficient synthesis of cyclic carbonate via transformation of CO2 catalyzed by solid-base bifunctional graphitic carbon nitride materials, Res. Chem. Intermed., 48 (2022) 4883–4900. [63] S. Samanta R. Srivastava A novel method to introduce acidic and basic bi-functional sites in graphitic carbon nitride for sustainable catalysis: cycloaddition, esterification, and transesterification reactions Sustain. Energy Fuels 1 2017 1390 1404 S. Samanta, R. Srivastava, A novel method to introduce acidic and basic bi-functional sites in graphitic carbon nitride for sustainable catalysis: cycloaddition, esterification, and transesterification reactions, Sustain. Energy Fuels, 1 (2017) 1390–1404. [64] T. Yano H. Matsui T. Koike H. Ishiguro H. Fujihara M. Yoshihara T. Maeshima Magnesium oxide-catalysed reaction of carbon dioxide with an epoxide with retention of stereochemistry Chem. Commun. 1997 1129 1130 T. Yano, H. Matsui, T. Koike, H. Ishiguro, H. Fujihara, M. Yoshihara, T. Maeshima, Magnesium oxide-catalysed reaction of carbon dioxide with an epoxide with retention of stereochemistry, Chem. Commun., (1997) 1129–1130. [65] P.R. Tambe G.D. Yadav Heterogeneous cycloaddition of styrene oxide with carbon dioxide for synthesis of styrene carbonate using reusable lanthanum–zirconium mixed oxide as catalyst Clean Technol. Environ. Policy 20 2018 345 356 P.R. Tambe, G.D. Yadav, Heterogeneous cycloaddition of styrene oxide with carbon dioxide for synthesis of styrene carbonate using reusable lanthanum–zirconium mixed oxide as catalyst, Clean Technol. Environ. Policy, 20 (2018) 345–356. [66] K. Yamaguchi K. Ebitani T. Yoshida H. Yoshida K. Kaneda Mg− Al mixed oxides as highly active acid− base catalysts for cycloaddition of carbon dioxide to epoxides J. Am. Chem. Soc. 121 1999 4526 4527 K. Yamaguchi, K. Ebitani, T. Yoshida, H. Yoshida, K. Kaneda, Mg− Al mixed oxides as highly active acid− base catalysts for cycloaddition of carbon dioxide to epoxides, J. Am. Chem. Soc., 121 (1999) 4526–4527. [67] M. Aresta A. Dibenedetto L. Gianfrate C. Pastore Nb (V) compounds as epoxides carboxylation catalysts: the role of the solvent J. Mol. Catal. A Chem. 204 2003 245 252 M. Aresta, A. Dibenedetto, L. Gianfrate, C. Pastore, Nb (V) compounds as epoxides carboxylation catalysts: the role of the solvent, J. Mol. Catal. A Chem., 204 (2003) 245–252. [68] M. Ramin N. van Vegten J.D. Grunwaldt A. Baiker Simple preparation routes towards novel Zn-based catalysts for the solventless synthesis of propylene carbonate using dense carbon dioxide J. Mol. Catal. A Chem. 258 2006 165 171 M. Ramin, N. van Vegten, J.D. Grunwaldt, A. Baiker, Simple preparation routes towards novel Zn-based catalysts for the solventless synthesis of propylene carbonate using dense carbon dioxide, J. Mol. Catal. A Chem., 258 (2006) 165–171. [69] H. Yasuda L.N. He T. Takahashi T. Sakakura Non-halogen catalysts for propylene carbonate synthesis from CO2 under supercritical conditions Appl. Catal. A Gen. 298 2006 177 180 H. Yasuda, L.N. He, T. Takahashi, T. Sakakura, Non-halogen catalysts for propylene carbonate synthesis from CO2 under supercritical conditions, Appl. Catal. A Gen., 298 (2006) 177–180. [70] N. Kulal V. Vasista G.V. Shanbhag Identification and tuning of active sites in selected mixed metal oxide catalysts for cyclic carbonate synthesis from epoxides and CO2 J. CO2 Util. 33 2019 434 444 N. Kulal, V. Vasista, G.V. Shanbhag, Identification and tuning of active sites in selected mixed metal oxide catalysts for cyclic carbonate synthesis from epoxides and CO2, J. CO2 Util., 33 (2019) 434–444. [71] G.M. Schwab Electronics of supported catalysts Advances in Catalysis 1979 Elsevier 1 22 G.M. Schwab, Electronics of supported catalysts, in: Advances in Catalysis, Elsevier, 1979, pp. 1–22. [72] F. Lagarde H. Srour N. Berthet N. Oueslati B. Bousquet A. Nunes A. Martinez V. Dufaud Investigating the role of SBA-15 silica on the activity of quaternary ammonium halides in the coupling of epoxides and CO2 J. CO2 Util. 34 2019 34 39 F. Lagarde, H. Srour, N. Berthet, N. Oueslati, B. Bousquet, A. Nunes, A. Martinez, V. Dufaud, Investigating the role of SBA-15 silica on the activity of quaternary ammonium halides in the coupling of epoxides and CO2, J. CO2 Util., 34 (2019) 34–39. [73] Y. Zhu X. Kong J. Yin R. You B. Zhang H. Zheng X. Wen Y. Zhu Y.W. Li Covalent-bonding to irreducible SiO2 leads to high-loading and atomically dispersed metal catalysts J. Catal. 353 2017 315 324 Y. Zhu, X. Kong, J. Yin, R. You, B. Zhang, H. Zheng, X. Wen, Y. Zhu, Y.W. Li, Covalent-bonding to irreducible SiO2 leads to high-loading and atomically dispersed metal catalysts, J. Catal., 353 (2017) 315–324. [74] M.C. Silaghi C. Chizallet P. Raybaud Challenges on molecular aspects of dealumination and desilication of zeolites Microporous Mesoporous Mater. 191 2014 82 96 M.C. Silaghi, C. Chizallet, P. Raybaud, Challenges on molecular aspects of dealumination and desilication of zeolites, Microporous Mesoporous Mater., 191 (2014) 82–96. [75] D. Zhao J. Feng Q. Huo N. Melosh G.H. Fredrickson B.F. Chmelka G.D. Stucky Triblock copolymer syntheses of mesoporous silica with periodic 50 to 300 angstrom pores Science 279 1998 548 552 (1979) D. Zhao, J. Feng, Q. Huo, N. Melosh, G.H. Fredrickson, B.F. Chmelka, G.D. Stucky, Triblock copolymer syntheses of mesoporous silica with periodic 50 to 300 angstrom pores, Science (1979), 279 (1998) 548–552. [76] M. Thommes K.A. Cychosz Physical adsorption characterization of nanoporous materials: progress and challenges Adsorption 20 2014 233 250 M. Thommes, K.A. Cychosz, Physical adsorption characterization of nanoporous materials: progress and challenges, Adsorption, 20 (2014) 233–250. [77] S. Gregg Adsorption of gases-tool for the study of the texture of solids Studies in Surface Science and Catalysis 1982 Elsevier 153 164 S. Gregg, Adsorption of gases-tool for the study of the texture of solids, in: Studies in Surface Science and Catalysis, Elsevier, 1982, pp. 153–164. [78] C. Li B. Tang W. Li Q. Lu L. Yuan Palladium nanoparticles encapsulated in surface-defected SBA-15 for lean methane oxidation ACS Appl. Nano Mater. 5 2022 13055 13068 C. Li, B. Tang, W. Li, Q. Lu, L. Yuan, Palladium nanoparticles encapsulated in surface-defected SBA-15 for lean methane oxidation, ACS Appl. Nano Mater., 5 (2022) 13055–13068. [79] L.A. Calzada R. Castellanos L.A. García T.E. Klimova TiO2, SnO2 and ZnO catalysts supported on mesoporous SBA-15 versus unsupported nanopowders in photocatalytic degradation of methylene blue Microporous Mesoporous Mater. 285 2019 247 258 L.A. Calzada, R. Castellanos, L.A. García, T.E. Klimova, TiO2, SnO2 and ZnO catalysts supported on mesoporous SBA-15 versus unsupported nanopowders in photocatalytic degradation of methylene blue, Microporous Mesoporous Mater., 285 (2019) 247–258. [80] H. Zhang M. Li P. Xiao D. Liu C.J. Zou Structure and catalytic performance of Mg-SBA-15-supported nickel catalysts for CO2 reforming of methane to syngas Chem. Eng. Technol. 36 2013 1701 1707 H. Zhang, M. Li, P. Xiao, D. Liu, C.J. Zou, Structure and catalytic performance of Mg-SBA-15-supported nickel catalysts for CO2 reforming of methane to syngas, Chem. Eng. Technol., 36 (2013) 1701–1707. [81] A. Ungureanu B. Dragoi A. Chirieac C. Ciotonea S. Royer D. Duprez A.S. Mamede E. Dumitriu Composition-dependent morphostructural properties of Ni–Cu oxide nanoparticles confined within the channels of ordered mesoporous SBA-15 silica ACS Appl. Mater. Interfaces 5 2013 3010 3025 A. Ungureanu, B. Dragoi, A. Chirieac, C. Ciotonea, S. Royer, D. Duprez, A.S. Mamede, E. Dumitriu, Composition-dependent morphostructural properties of Ni–Cu oxide nanoparticles confined within the channels of ordered mesoporous SBA-15 silica, ACS Appl. Mater. Interfaces, 5 (2013) 3010–3025. [82] P. Lorenz J. Finster G. Wendt J. Salyn E. Žumadilov V. Nefedov ESCA investigations of some NiO/SiO2 and NiO—Al2O3/SiO2 catalysts J. Electron Spectrosc. Relat. Phenom. 16 1979 267 276 P. Lorenz, J. Finster, G. Wendt, J. Salyn, E. Žumadilov, V. Nefedov, ESCA investigations of some NiO/SiO2 and NiO—Al2O3/SiO2 catalysts, J. Electron Spectrosc. Relat. Phenom., 16 (1979) 267–276. [83] N. Kulal S.S. Bhat V. Hugar C.N. Mallannavar S.C. Lee S. Bhattacharjee R. Vetrivel G.V. Shanbhag Integrated DFT and experimental study on Co3O4/CeO2 catalyst for direct synthesis of dimethyl carbonate from CO2 J. CO2 Util. 67 2023 102323 N. Kulal, S.S. Bhat, V. Hugar, C.N. Mallannavar, S.C. Lee, S. Bhattacharjee, R. Vetrivel, G.V. Shanbhag, Integrated DFT and experimental study on Co3O4/CeO2 catalyst for direct synthesis of dimethyl carbonate from CO2, J. CO2 Util., 67 (2023) 102323.",
      "scopus-id": "105000465783",
      "coredata": {
        "eid": "1-s2.0-S2468823125002159",
        "dc:description": "The bimetallic oxide dispersed on silanol rich SBA-15-OH was designed for the synthesis of cyclic carbonates from epoxides and CO2. The SBA-15-OH was synthesized via desilication and active metals were loaded by sol-gel method. Pure Sn-Ni oxide with a low surface area and lesser activity was modified by dispersing it on a high surface area SBA-15-OH. The different characterization techniques such as XRD, N2-sorption, CO2 and NH3-TPD, H2-TPR, SEM-EDX, TEM and XPS confirmed that the surface silanol group acts as anchoring site for the enhanced metal oxide-support interaction. Supported Sn-Ni oxide exhibited 16-fold better activity than pure Sn-Ni oxide, due to improved dispersion, which enhances the accessibility of reactants to the catalytic sites. Under the optimized reaction conditions 10Sn5Ni/SBA-15-OH gave 92.9 % styrene oxide conversion and 84.3 % selectivity for styrene carbonate. The catalyst is recyclable and the flexibility of the catalyst is tested for different epoxides with CO2.",
        "openArchiveArticle": "false",
        "prism:coverDate": "2025-05-15",
        "openaccessUserLicense": null,
        "prism:aggregationType": "Journal",
        "prism:url": "https://api.elsevier.com/content/article/pii/S2468823125002159",
        "dc:creator": [
          {
            "@_fa": "true",
            "$": "Mallannavar, Chaitra N."
          },
          {
            "@_fa": "true",
            "$": "Sujith, S."
          },
          {
            "@_fa": "true",
            "$": "Patil, Shrinidhi D."
          },
          {
            "@_fa": "true",
            "$": "Maradur, Sanjeev P."
          },
          {
            "@_fa": "true",
            "$": "Shanbhag, Ganapati V."
          }
        ],
        "link": [
          {
            "@_fa": "true",
            "@rel": "self",
            "@href": "https://api.elsevier.com/content/article/pii/S2468823125002159"
          },
          {
            "@_fa": "true",
            "@rel": "scidir",
            "@href": "https://www.sciencedirect.com/science/article/pii/S2468823125002159"
          }
        ],
        "dc:format": "application/json",
        "openaccessType": null,
        "pii": "S2468-8231(25)00215-9",
        "prism:volume": "579",
        "articleNumber": "115029",
        "prism:publisher": "Elsevier B.V. All rights are reserved, including those for text and data mining, AI training, and similar technologies.",
        "dc:title": "Bimetallic oxide catalysis meets silanol-enhanced synergy: A winning combination for efficient CO2 fixation by cycloaddition with styrene oxide",
        "prism:copyright": "© 2025 Elsevier B.V. All rights are reserved, including those for text and data mining, AI training, and similar technologies.",
        "openaccess": "0",
        "prism:issn": "24688231",
        "dcterms:subject": [
          {
            "@_fa": "true",
            "$": "CO2 valorization"
          },
          {
            "@_fa": "true",
            "$": "Heterogeneous catalysis"
          },
          {
            "@_fa": "true",
            "$": "Epoxide"
          },
          {
            "@_fa": "true",
            "$": "Cyclic carbonate"
          },
          {
            "@_fa": "true",
            "$": "Supported bimetallic oxide"
          }
        ],
        "openaccessArticle": "false",
        "prism:publicationName": "Molecular Catalysis",
        "openaccessSponsorType": null,
        "prism:pageRange": "115029",
        "pubType": "fla",
        "prism:coverDisplayDate": "15 May 2025",
        "prism:doi": "10.1016/j.mcat.2025.115029",
        "prism:startingPage": "115029",
        "dc:identifier": "doi:10.1016/j.mcat.2025.115029",
        "openaccessSponsorName": null
      },
      "objects": {
        "object": [
          {
            "@category": "standard",
            "@height": "318",
            "@width": "452",
            "@_fa": "true",
            "$": "https://api.elsevier.com/content/object/eid/1-s2.0-S2468823125002159-gr8.jpg?httpAccept=%2A%2F%2A",
            "@multimediatype": "JPEG image file",
            "@type": "IMAGE-DOWNSAMPLED",
            "@size": "43522",
            "@ref": "gr8",
            "@mimetype": "image/jpeg"
          },
          {
            "@category": "standard",
            "@height": "566",
            "@width": "678",
            "@_fa": "true",
            "$": "https://api.elsevier.com/content/object/eid/1-s2.0-S2468823125002159-gr9.jpg?httpAccept=%2A%2F%2A",
            "@multimediatype": "JPEG image file",
            "@type": "IMAGE-DOWNSAMPLED",
            "@size": "98349",
            "@ref": "gr9",
            "@mimetype": "image/jpeg"
          },
          {
            "@category": "standard",
            "@height": "276",
            "@width": "772",
            "@_fa": "true",
            "$": "https://api.elsevier.com/content/object/eid/1-s2.0-S2468823125002159-gr2.jpg?httpAccept=%2A%2F%2A",
            "@multimediatype": "JPEG image file",
            "@type": "IMAGE-DOWNSAMPLED",
            "@size": "60472",
            "@ref": "gr2",
            "@mimetype": "image/jpeg"
          },
          {
            "@category": "standard",
            "@height": "297",
            "@width": "395",
            "@_fa": "true",
            "$": "https://api.elsevier.com/content/object/eid/1-s2.0-S2468823125002159-gr3.jpg?httpAccept=%2A%2F%2A",
            "@multimediatype": "JPEG image file",
            "@type": "IMAGE-DOWNSAMPLED",
            "@size": "29180",
            "@ref": "gr3",
            "@mimetype": "image/jpeg"
          },
          {
            "@category": "standard",
            "@height": "960",
            "@width": "707",
            "@_fa": "true",
            "$": "https://api.elsevier.com/content/object/eid/1-s2.0-S2468823125002159-gr1.jpg?httpAccept=%2A%2F%2A",
            "@multimediatype": "JPEG image file",
            "@type": "IMAGE-DOWNSAMPLED",
            "@size": "128671",
            "@ref": "gr1",
            "@mimetype": "image/jpeg"
          },
          {
            "@category": "standard",
            "@height": "546",
            "@width": "678",
            "@_fa": "true",
            "$": "https://api.elsevier.com/content/object/eid/1-s2.0-S2468823125002159-gr10.jpg?httpAccept=%2A%2F%2A",
            "@multimediatype": "JPEG image file",
            "@type": "IMAGE-DOWNSAMPLED",
            "@size": "68501",
            "@ref": "gr10",
            "@mimetype": "image/jpeg"
          },
          {
            "@category": "standard",
            "@height": "304",
            "@width": "769",
            "@_fa": "true",
            "$": "https://api.elsevier.com/content/object/eid/1-s2.0-S2468823125002159-gr6.jpg?httpAccept=%2A%2F%2A",
            "@multimediatype": "JPEG image file",
            "@type": "IMAGE-DOWNSAMPLED",
            "@size": "70831",
            "@ref": "gr6",
            "@mimetype": "image/jpeg"
          },
          {
            "@category": "standard",
            "@height": "303",
            "@width": "772",
            "@_fa": "true",
            "$": "https://api.elsevier.com/content/object/eid/1-s2.0-S2468823125002159-gr7.jpg?httpAccept=%2A%2F%2A",
            "@multimediatype": "JPEG image file",
            "@type": "IMAGE-DOWNSAMPLED",
            "@size": "73864",
            "@ref": "gr7",
            "@mimetype": "image/jpeg"
          },
          {
            "@category": "standard",
            "@height": "388",
            "@width": "489",
            "@_fa": "true",
            "$": "https://api.elsevier.com/content/object/eid/1-s2.0-S2468823125002159-gr4.jpg?httpAccept=%2A%2F%2A",
            "@multimediatype": "JPEG image file",
            "@type": "IMAGE-DOWNSAMPLED",
            "@size": "65548",
            "@ref": "gr4",
            "@mimetype": "image/jpeg"
          },
          {
            "@category": "standard",
            "@height": "777",
            "@width": "772",
            "@_fa": "true",
            "$": "https://api.elsevier.com/content/object/eid/1-s2.0-S2468823125002159-gr5.jpg?httpAccept=%2A%2F%2A",
            "@multimediatype": "JPEG image file",
            "@type": "IMAGE-DOWNSAMPLED",
            "@size": "228552",
            "@ref": "gr5",
            "@mimetype": "image/jpeg"
          },
          {
            "@category": "standard",
            "@height": "520",
            "@width": "565",
            "@_fa": "true",
            "$": "https://api.elsevier.com/content/object/eid/1-s2.0-S2468823125002159-fx1.jpg?httpAccept=%2A%2F%2A",
            "@multimediatype": "JPEG image file",
            "@type": "IMAGE-DOWNSAMPLED",
            "@size": "34972",
            "@ref": "fx1",
            "@mimetype": "image/jpeg"
          },
          {
            "@category": "standard",
            "@height": "279",
            "@width": "678",
            "@_fa": "true",
            "$": "https://api.elsevier.com/content/object/eid/1-s2.0-S2468823125002159-gr11.jpg?httpAccept=%2A%2F%2A",
            "@multimediatype": "JPEG image file",
            "@type": "IMAGE-DOWNSAMPLED",
            "@size": "70616",
            "@ref": "gr11",
            "@mimetype": "image/jpeg"
          },
          {
            "@category": "standard",
            "@height": "546",
            "@width": "675",
            "@_fa": "true",
            "$": "https://api.elsevier.com/content/object/eid/1-s2.0-S2468823125002159-gr12.jpg?httpAccept=%2A%2F%2A",
            "@multimediatype": "JPEG image file",
            "@type": "IMAGE-DOWNSAMPLED",
            "@size": "67564",
            "@ref": "gr12",
            "@mimetype": "image/jpeg"
          },
          {
            "@category": "standard",
            "@height": "300",
            "@width": "395",
            "@_fa": "true",
            "$": "https://api.elsevier.com/content/object/eid/1-s2.0-S2468823125002159-gr13.jpg?httpAccept=%2A%2F%2A",
            "@multimediatype": "JPEG image file",
            "@type": "IMAGE-DOWNSAMPLED",
            "@size": "25297",
            "@ref": "gr13",
            "@mimetype": "image/jpeg"
          },
          {
            "@category": "standard",
            "@height": "599",
            "@width": "678",
            "@_fa": "true",
            "$": "https://api.elsevier.com/content/object/eid/1-s2.0-S2468823125002159-sc1.jpg?httpAccept=%2A%2F%2A",
            "@multimediatype": "JPEG image file",
            "@type": "IMAGE-DOWNSAMPLED",
            "@size": "57598",
            "@ref": "sc1",
            "@mimetype": "image/jpeg"
          },
          {
            "@category": "standard",
            "@height": "320",
            "@width": "395",
            "@_fa": "true",
            "$": "https://api.elsevier.com/content/object/eid/1-s2.0-S2468823125002159-gr14.jpg?httpAccept=%2A%2F%2A",
            "@multimediatype": "JPEG image file",
            "@type": "IMAGE-DOWNSAMPLED",
            "@size": "65046",
            "@ref": "gr14",
            "@mimetype": "image/jpeg"
          },
          {
            "@category": "standard",
            "@height": "200",
            "@width": "375",
            "@_fa": "true",
            "$": "https://api.elsevier.com/content/object/eid/1-s2.0-S2468823125002159-ga1.jpg?httpAccept=%2A%2F%2A",
            "@multimediatype": "JPEG image file",
            "@type": "IMAGE-DOWNSAMPLED",
            "@size": "29569",
            "@ref": "ga1",
            "@mimetype": "image/jpeg"
          },
          {
            "@category": "thumbnail",
            "@height": "154",
            "@width": "219",
            "@_fa": "true",
            "$": "https://api.elsevier.com/content/object/eid/1-s2.0-S2468823125002159-gr8.sml?httpAccept=%2A%2F%2A",
            "@multimediatype": "GIF image file",
            "@type": "IMAGE-THUMBNAIL",
            "@size": "10265",
            "@ref": "gr8",
            "@mimetype": "image/gif"
          },
          {
            "@category": "thumbnail",
            "@height": "164",
            "@width": "196",
            "@_fa": "true",
            "$": "https://api.elsevier.com/content/object/eid/1-s2.0-S2468823125002159-gr9.sml?httpAccept=%2A%2F%2A",
            "@multimediatype": "GIF image file",
            "@type": "IMAGE-THUMBNAIL",
            "@size": "14193",
            "@ref": "gr9",
            "@mimetype": "image/gif"
          },
          {
            "@category": "thumbnail",
            "@height": "78",
            "@width": "219",
            "@_fa": "true",
            "$": "https://api.elsevier.com/content/object/eid/1-s2.0-S2468823125002159-gr2.sml?httpAccept=%2A%2F%2A",
            "@multimediatype": "GIF image file",
            "@type": "IMAGE-THUMBNAIL",
            "@size": "8479",
            "@ref": "gr2",
            "@mimetype": "image/gif"
          },
          {
            "@category": "thumbnail",
            "@height": "164",
            "@width": "218",
            "@_fa": "true",
            "$": "https://api.elsevier.com/content/object/eid/1-s2.0-S2468823125002159-gr3.sml?httpAccept=%2A%2F%2A",
            "@multimediatype": "GIF image file",
            "@type": "IMAGE-THUMBNAIL",
            "@size": "9409",
            "@ref": "gr3",
            "@mimetype": "image/gif"
          },
          {
            "@category": "thumbnail",
            "@height": "163",
            "@width": "120",
            "@_fa": "true",
            "$": "https://api.elsevier.com/content/object/eid/1-s2.0-S2468823125002159-gr1.sml?httpAccept=%2A%2F%2A",
            "@multimediatype": "GIF image file",
            "@type": "IMAGE-THUMBNAIL",
            "@size": "8561",
            "@ref": "gr1",
            "@mimetype": "image/gif"
          },
          {
            "@category": "thumbnail",
            "@height": "164",
            "@width": "204",
            "@_fa": "true",
            "$": "https://api.elsevier.com/content/object/eid/1-s2.0-S2468823125002159-gr10.sml?httpAccept=%2A%2F%2A",
            "@multimediatype": "GIF image file",
            "@type": "IMAGE-THUMBNAIL",
            "@size": "12290",
            "@ref": "gr10",
            "@mimetype": "image/gif"
          },
          {
            "@category": "thumbnail",
            "@height": "87",
            "@width": "219",
            "@_fa": "true",
            "$": "https://api.elsevier.com/content/object/eid/1-s2.0-S2468823125002159-gr6.sml?httpAccept=%2A%2F%2A",
            "@multimediatype": "GIF image file",
            "@type": "IMAGE-THUMBNAIL",
            "@size": "9419",
            "@ref": "gr6",
            "@mimetype": "image/gif"
          },
          {
            "@category": "thumbnail",
            "@height": "86",
            "@width": "219",
            "@_fa": "true",
            "$": "https://api.elsevier.com/content/object/eid/1-s2.0-S2468823125002159-gr7.sml?httpAccept=%2A%2F%2A",
            "@multimediatype": "GIF image file",
            "@type": "IMAGE-THUMBNAIL",
            "@size": "10279",
            "@ref": "gr7",
            "@mimetype": "image/gif"
          },
          {
            "@category": "thumbnail",
            "@height": "164",
            "@width": "207",
            "@_fa": "true",
            "$": "https://api.elsevier.com/content/object/eid/1-s2.0-S2468823125002159-gr4.sml?httpAccept=%2A%2F%2A",
            "@multimediatype": "GIF image file",
            "@type": "IMAGE-THUMBNAIL",
            "@size": "23293",
            "@ref": "gr4",
            "@mimetype": "image/gif"
          },
          {
            "@category": "thumbnail",
            "@height": "164",
            "@width": "163",
            "@_fa": "true",
            "$": "https://api.elsevier.com/content/object/eid/1-s2.0-S2468823125002159-gr5.sml?httpAccept=%2A%2F%2A",
            "@multimediatype": "GIF image file",
            "@type": "IMAGE-THUMBNAIL",
            "@size": "22866",
            "@ref": "gr5",
            "@mimetype": "image/gif"
          },
          {
            "@category": "thumbnail",
            "@height": "164",
            "@width": "178",
            "@_fa": "true",
            "$": "https://api.elsevier.com/content/object/eid/1-s2.0-S2468823125002159-fx1.sml?httpAccept=%2A%2F%2A",
            "@multimediatype": "GIF image file",
            "@type": "IMAGE-THUMBNAIL",
            "@size": "5877",
            "@ref": "fx1",
            "@mimetype": "image/gif"
          },
          {
            "@category": "thumbnail",
            "@height": "90",
            "@width": "219",
            "@_fa": "true",
            "$": "https://api.elsevier.com/content/object/eid/1-s2.0-S2468823125002159-gr11.sml?httpAccept=%2A%2F%2A",
            "@multimediatype": "GIF image file",
            "@type": "IMAGE-THUMBNAIL",
            "@size": "12584",
            "@ref": "gr11",
            "@mimetype": "image/gif"
          },
          {
            "@category": "thumbnail",
            "@height": "163",
            "@width": "202",
            "@_fa": "true",
            "$": "https://api.elsevier.com/content/object/eid/1-s2.0-S2468823125002159-gr12.sml?httpAccept=%2A%2F%2A",
            "@multimediatype": "GIF image file",
            "@type": "IMAGE-THUMBNAIL",
            "@size": "9761",
            "@ref": "gr12",
            "@mimetype": "image/gif"
          },
          {
            "@category": "thumbnail",
            "@height": "164",
            "@width": "216",
            "@_fa": "true",
            "$": "https://api.elsevier.com/content/object/eid/1-s2.0-S2468823125002159-gr13.sml?httpAccept=%2A%2F%2A",
            "@multimediatype": "GIF image file",
            "@type": "IMAGE-THUMBNAIL",
            "@size": "8650",
            "@ref": "gr13",
            "@mimetype": "image/gif"
          },
          {
            "@category": "thumbnail",
            "@height": "163",
            "@width": "185",
            "@_fa": "true",
            "$": "https://api.elsevier.com/content/object/eid/1-s2.0-S2468823125002159-sc1.sml?httpAccept=%2A%2F%2A",
            "@multimediatype": "GIF image file",
            "@type": "IMAGE-THUMBNAIL",
            "@size": "8630",
            "@ref": "sc1",
            "@mimetype": "image/gif"
          },
          {
            "@category": "thumbnail",
            "@height": "164",
            "@width": "202",
            "@_fa": "true",
            "$": "https://api.elsevier.com/content/object/eid/1-s2.0-S2468823125002159-gr14.sml?httpAccept=%2A%2F%2A",
            "@multimediatype": "GIF image file",
            "@type": "IMAGE-THUMBNAIL",
            "@size": "18294",
            "@ref": "gr14",
            "@mimetype": "image/gif"
          },
          {
            "@category": "thumbnail",
            "@height": "117",
            "@width": "219",
            "@_fa": "true",
            "$": "https://api.elsevier.com/content/object/eid/1-s2.0-S2468823125002159-ga1.sml?httpAccept=%2A%2F%2A",
            "@multimediatype": "GIF image file",
            "@type": "IMAGE-THUMBNAIL",
            "@size": "12055",
            "@ref": "ga1",
            "@mimetype": "image/gif"
          },
          {
            "@category": "high",
            "@height": "1409",
            "@width": "2000",
            "@_fa": "true",
            "$": "https://api.elsevier.com/content/object/eid/1-s2.0-S2468823125002159-gr8_lrg.jpg?httpAccept=%2A%2F%2A",
            "@multimediatype": "JPEG image file",
            "@type": "IMAGE-HIGH-RES",
            "@size": "887389",
            "@ref": "gr8",
            "@mimetype": "image/jpeg"
          },
          {
            "@category": "high",
            "@height": "2504",
            "@width": "3000",
            "@_fa": "true",
            "$": "https://api.elsevier.com/content/object/eid/1-s2.0-S2468823125002159-gr9_lrg.jpg?httpAccept=%2A%2F%2A",
            "@multimediatype": "JPEG image file",
            "@type": "IMAGE-HIGH-RES",
            "@size": "753283",
            "@ref": "gr9",
            "@mimetype": "image/jpeg"
          },
          {
            "@category": "high",
            "@height": "1222",
            "@width": "3417",
            "@_fa": "true",
            "$": "https://api.elsevier.com/content/object/eid/1-s2.0-S2468823125002159-gr2_lrg.jpg?httpAccept=%2A%2F%2A",
            "@multimediatype": "JPEG image file",
            "@type": "IMAGE-HIGH-RES",
            "@size": "391656",
            "@ref": "gr2",
            "@mimetype": "image/jpeg"
          },
          {
            "@category": "high",
            "@height": "1315",
            "@width": "1750",
            "@_fa": "true",
            "$": "https://api.elsevier.com/content/object/eid/1-s2.0-S2468823125002159-gr3_lrg.jpg?httpAccept=%2A%2F%2A",
            "@multimediatype": "JPEG image file",
            "@type": "IMAGE-HIGH-RES",
            "@size": "199559",
            "@ref": "gr3",
            "@mimetype": "image/jpeg"
          },
          {
            "@category": "high",
            "@height": "4250",
            "@width": "3129",
            "@_fa": "true",
            "$": "https://api.elsevier.com/content/object/eid/1-s2.0-S2468823125002159-gr1_lrg.jpg?httpAccept=%2A%2F%2A",
            "@multimediatype": "JPEG image file",
            "@type": "IMAGE-HIGH-RES",
            "@size": "916877",
            "@ref": "gr1",
            "@mimetype": "image/jpeg"
          },
          {
            "@category": "high",
            "@height": "2414",
            "@width": "3000",
            "@_fa": "true",
            "$": "https://api.elsevier.com/content/object/eid/1-s2.0-S2468823125002159-gr10_lrg.jpg?httpAccept=%2A%2F%2A",
            "@multimediatype": "JPEG image file",
            "@type": "IMAGE-HIGH-RES",
            "@size": "528841",
            "@ref": "gr10",
            "@mimetype": "image/jpeg"
          },
          {
            "@category": "high",
            "@height": "1346",
            "@width": "3406",
            "@_fa": "true",
            "$": "https://api.elsevier.com/content/object/eid/1-s2.0-S2468823125002159-gr6_lrg.jpg?httpAccept=%2A%2F%2A",
            "@multimediatype": "JPEG image file",
            "@type": "IMAGE-HIGH-RES",
            "@size": "467498",
            "@ref": "gr6",
            "@mimetype": "image/jpeg"
          },
          {
            "@category": "high",
            "@height": "1340",
            "@width": "3417",
            "@_fa": "true",
            "$": "https://api.elsevier.com/content/object/eid/1-s2.0-S2468823125002159-gr7_lrg.jpg?httpAccept=%2A%2F%2A",
            "@multimediatype": "JPEG image file",
            "@type": "IMAGE-HIGH-RES",
            "@size": "558629",
            "@ref": "gr7",
            "@mimetype": "image/jpeg"
          },
          {
            "@category": "high",
            "@height": "1719",
            "@width": "2167",
            "@_fa": "true",
            "$": "https://api.elsevier.com/content/object/eid/1-s2.0-S2468823125002159-gr4_lrg.jpg?httpAccept=%2A%2F%2A",
            "@multimediatype": "JPEG image file",
            "@type": "IMAGE-HIGH-RES",
            "@size": "590367",
            "@ref": "gr4",
            "@mimetype": "image/jpeg"
          },
          {
            "@category": "high",
            "@height": "3439",
            "@width": "3417",
            "@_fa": "true",
            "$": "https://api.elsevier.com/content/object/eid/1-s2.0-S2468823125002159-gr5_lrg.jpg?httpAccept=%2A%2F%2A",
            "@multimediatype": "JPEG image file",
            "@type": "IMAGE-HIGH-RES",
            "@size": "2229469",
            "@ref": "gr5",
            "@mimetype": "image/jpeg"
          },
          {
            "@category": "high",
            "@height": "2303",
            "@width": "2500",
            "@_fa": "true",
            "$": "https://api.elsevier.com/content/object/eid/1-s2.0-S2468823125002159-fx1_lrg.jpg?httpAccept=%2A%2F%2A",
            "@multimediatype": "JPEG image file",
            "@type": "IMAGE-HIGH-RES",
            "@size": "292133",
            "@ref": "fx1",
            "@mimetype": "image/jpeg"
          },
          {
            "@category": "high",
            "@height": "1234",
            "@width": "3000",
            "@_fa": "true",
            "$": "https://api.elsevier.com/content/object/eid/1-s2.0-S2468823125002159-gr11_lrg.jpg?httpAccept=%2A%2F%2A",
            "@multimediatype": "JPEG image file",
            "@type": "IMAGE-HIGH-RES",
            "@size": "749073",
            "@ref": "gr11",
            "@mimetype": "image/jpeg"
          },
          {
            "@category": "high",
            "@height": "2420",
            "@width": "2990",
            "@_fa": "true",
            "$": "https://api.elsevier.com/content/object/eid/1-s2.0-S2468823125002159-gr12_lrg.jpg?httpAccept=%2A%2F%2A",
            "@multimediatype": "JPEG image file",
            "@type": "IMAGE-HIGH-RES",
            "@size": "441624",
            "@ref": "gr12",
            "@mimetype": "image/jpeg"
          },
          {
            "@category": "high",
            "@height": "1329",
            "@width": "1750",
            "@_fa": "true",
            "$": "https://api.elsevier.com/content/object/eid/1-s2.0-S2468823125002159-gr13_lrg.jpg?httpAccept=%2A%2F%2A",
            "@multimediatype": "JPEG image file",
            "@type": "IMAGE-HIGH-RES",
            "@size": "416541",
            "@ref": "gr13",
            "@mimetype": "image/jpeg"
          },
          {
            "@category": "high",
            "@height": "2651",
            "@width": "3000",
            "@_fa": "true",
            "$": "https://api.elsevier.com/content/object/eid/1-s2.0-S2468823125002159-sc1_lrg.jpg?httpAccept=%2A%2F%2A",
            "@multimediatype": "JPEG image file",
            "@type": "IMAGE-HIGH-RES",
            "@size": "397757",
            "@ref": "sc1",
            "@mimetype": "image/jpeg"
          },
          {
            "@category": "high",
            "@height": "1418",
            "@width": "1750",
            "@_fa": "true",
            "$": "https://api.elsevier.com/content/object/eid/1-s2.0-S2468823125002159-gr14_lrg.jpg?httpAccept=%2A%2F%2A",
            "@multimediatype": "JPEG image file",
            "@type": "IMAGE-HIGH-RES",
            "@size": "1232464",
            "@ref": "gr14",
            "@mimetype": "image/jpeg"
          },
          {
            "@category": "high",
            "@height": "886",
            "@width": "1663",
            "@_fa": "true",
            "$": "https://api.elsevier.com/content/object/eid/1-s2.0-S2468823125002159-ga1_lrg.jpg?httpAccept=%2A%2F%2A",
            "@multimediatype": "JPEG image file",
            "@type": "IMAGE-HIGH-RES",
            "@size": "165240",
            "@ref": "ga1",
            "@mimetype": "image/jpeg"
          },
          {
            "@category": "standard",
            "@_fa": "true",
            "$": "https://api.elsevier.com/content/object/eid/1-s2.0-S2468823125002159-mmc1.docx?httpAccept=%2A%2F%2A",
            "@multimediatype": "Microsoft Word file",
            "@type": "APPLICATION",
            "@size": "10836885",
            "@ref": "mmc1",
            "@mimetype": "application/word"
          },
          {
            "@category": "thumbnail",
            "@_fa": "true",
            "$": "https://api.elsevier.com/content/object/eid/1-s2.0-S2468823125002159-si1.svg?httpAccept=%2A%2F%2A",
            "@multimediatype": "Scalable Vector Graphics file",
            "@type": "ALTIMG",
            "@size": "20890",
            "@ref": "si1",
            "@mimetype": "image/svg+xml"
          },
          {
            "@category": "thumbnail",
            "@_fa": "true",
            "$": "https://api.elsevier.com/content/object/eid/1-s2.0-S2468823125002159-si2.svg?httpAccept=%2A%2F%2A",
            "@multimediatype": "Scalable Vector Graphics file",
            "@type": "ALTIMG",
            "@size": "21785",
            "@ref": "si2",
            "@mimetype": "image/svg+xml"
          },
          {
            "@category": "thumbnail",
            "@_fa": "true",
            "$": "https://api.elsevier.com/content/object/eid/1-s2.0-S2468823125002159-si3.svg?httpAccept=%2A%2F%2A",
            "@multimediatype": "Scalable Vector Graphics file",
            "@type": "ALTIMG",
            "@size": "20753",
            "@ref": "si3",
            "@mimetype": "image/svg+xml"
          },
          {
            "@category": "thumbnail",
            "@_fa": "true",
            "$": "https://api.elsevier.com/content/object/eid/1-s2.0-S2468823125002159-si4.svg?httpAccept=%2A%2F%2A",
            "@multimediatype": "Scalable Vector Graphics file",
            "@type": "ALTIMG",
            "@size": "515",
            "@ref": "si4",
            "@mimetype": "image/svg+xml"
          }
        ]
      },
      "link": {
        "@rel": "abstract",
        "@href": "https://api.elsevier.com/content/abstract/scopus_id/105000465783"
      }
    }
  }
}