{
  "metadata": {
    "title": "<ce:italic>In-situ</ce:italic> constructed ultrathin hydrotalcite derivative supported PtIn catalyst for isobutane direct dehydrogenation",
    "authors": "; ; ",
    "journal": "Molecular Catalysis",
    "date": "2023-08-31",
    "doi": "10.1016/j.mcat.2023.113287",
    "abstract": "",
    "uri": "https://api.elsevier.com/content/article/pii/S2468823123003711",
    "pii": "S2468823123003711"
  },
  "fulltext": {
    "full-text-retrieval-response": {
      "scopus-eid": "2-s2.0-85161320548",
      "originalText": "serial JL 315758 291210 291744 291790 291809 31 Molecular Catalysis MOLECULARCATALYSIS 2023-06-08 2023-06-08 2023-06-08 2023-06-08 2023-11-16T15:56:12 1-s2.0-S2468823123003711 S2468-8231(23)00371-1 S2468823123003711 10.1016/j.mcat.2023.113287 S300 S300.1 FULL-TEXT 1-s2.0-S2468823123X00133 2023-11-16T16:10:46.873519Z 0 0 20230801 20230831 2023 2023-06-08T18:34:11.999215Z absattachment articleinfo articlenumber articletitlenorm authfirstinitialnorm authfirstsurnamenorm cid cids contenttype copyright crossmark dateloaded dateloadedtxt datesearch datesort dateupdated dco docsubtype doctype doi eid ewtransactionid hubeid indexeddate issn issnnorm itemstage itemtransactionid itemweight openaccess openarchive pg pgfirst pii piinorm pubdateend pubdatestart pubdatetxt pubyr sectiontitle sortorder srctitle srctitlenorm srctype ssids alllist content subj subheadings suppl tomb volfirst volissue volumelist webpdf webpdfpagecount yearnav figure table body mmlmath acknowledge affil articletitle auth authfirstini authfull authkeywords authlast footnotes grantnumber grantsponsor grantsponsorid highlightsabst orcid primabst ref specialabst 2468-8231 24688231 true 547 547 C Volume 547 12 113287 113287 113287 202308 August 2023 2023-08-01 2023-08-31 2023 Regular Papers article fla © 2023 Elsevier B.V. All rights reserved. INSITUCONSTRUCTEDULTRATHINHYDROTALCITEDERIVATIVESUPPORTEDPTINCATALYSTFORISOBUTANEDIRECTDEHYDROGENATION ZHANG X 1 Introduction 2 Experimental section 2.1 Materials 2.2 Preparation of alumina support 2.3 Synthesis of supported HT precursors with and without formamide 2.4 Synthesis of supported PtIn bimetallic catalysts 2.5 Characterization of catalysts and precursors 2.6 Dehydrogenation performance evaluation 2.7 Turnover frequency (TOF) calculation 3 Results and discussion 3.1 Catalytic behaviors 3.1.1 Isobutane dehydrogenation performance 3.1.2 Carbon deposition behavior 3.2 Characteristics of catalysts 3.2.1 XRD 3.2.2 AFM 3.2.3 TEM and HAADF-STEM 3.2.4 Texture feature 3.2.5 H2-TPR 3.2.6 NH3-TPD 3.2.7 XPS 4 Conclusions CRediT authorship contribution statement Acknowledgments References LUO 2013 1481 1487 S WANG 2014 1139 1143 G LIU 2018 11265 11270 J LIU 2021 58 65 J ZHU 2017 6973 6978 Y GAO 2021 2597 2603 X QIAN 2022 17264 17274 R LI 2019 767 J XIA 2016 104 114 K XIA 2016 1068 1079 K TOLEK 2020 100 108 W BAUER 2019 2842 2853 T LEE 2017 1337 1345 H CHEN 2019 1979 1988 C SUN 2020 19450 19459 Q ROCHLITZ 2019 1549 1555 L MATVEYEVA 2020 7719 7723 A TOLEK 2018 1624 1632 W RODEMERCK 2016 12222 12225 U HAN 2022 112233 J TAN 2017 6225 6331 C YIN 2016 4873 4891 H DING 2020 1105 1112 P ZHAO 2017 1703828 Y ZHAO 2015 7168 7173 Y WANG 2016 255 262 J PENG 2018 1707389 L HE 2013 5912 5920 S WANG 2013 6301 6303 Q YU 2016 12036 12041 J WANG 2019 378 384 Z YU 2015 9448 9451 J YU 2017 5950 5974 J WANG 2021 111746 J FENG 2023 1 18 F CAI 2018 6224 6266 X ZHU 2015 6310 6319 J ZHANG 2020 12932 12942 W YUE 2015 7052 7063 Y VANASSCHE 2022 112059 A OTROSHCHENKO 2017 4499 4510 T YU 2007 80 87 C JIANG 2020 105014 H LIAO 2015 3221 3246 H ZHANGX2023X113287 ZHANGX2023X113287XX 2025-06-08T00:00:00.000Z 2025-06-08T00:00:00.000Z http://creativecommons.org/licenses/by-nc-nd/4.0/ © 2023 Elsevier B.V. All rights reserved. 2023-06-13T05:24:31.136Z http://vtw.elsevier.com/data/voc/AddOnTypes/50.7/aggregated-refined National Natural Science Foundation of China 21776214 NSFC National Natural Science Foundation of China http://data.elsevier.com/vocabulary/SciValFunders/501100001809 http://sws.geonames.org/1814991/ This research was funded by the National Natural Science Foundation of China ( 21776214 ). https://doi.org/10.15223/policy-017 https://doi.org/10.15223/policy-037 https://doi.org/10.15223/policy-012 https://doi.org/10.15223/policy-029 https://doi.org/10.15223/policy-004 item S2468-8231(23)00371-1 S2468823123003711 1-s2.0-S2468823123003711 10.1016/j.mcat.2023.113287 315758 2023-11-16T16:10:46.873519Z 2023-08-01 2023-08-31 1-s2.0-S2468823123003711-main.pdf https://s3-eu-west-1.amazonaws.com/prod-ucs-content-store-eu-west/content/pii:S2468823123003711/MAIN/application/pdf/8f20a34d5f9e274c9c68eb63b26e035d/main.pdf main.pdf pdf true 10168620 MAIN 10 1-s2.0-S2468823123003711-main_1.png https://s3-eu-west-1.amazonaws.com/prod-ucs-content-store-eu-west/content/pii:S2468823123003711/PREVIEW/image/png/8943220f81cf3de6fe0f989faa2c12f4/main_1.png main_1.png png 58443 849 656 IMAGE-WEB-PDF 1 1-s2.0-S2468823123003711-gr2.jpg https://s3-eu-west-1.amazonaws.com/prod-ucs-content-store-eu-west/content/pii:S2468823123003711/gr2/DOWNSAMPLED/image/jpeg/55e29e035682bbfdddb7e59678ffed2e/gr2.jpg gr2 gr2.jpg jpg 22065 284 339 IMAGE-DOWNSAMPLED 1-s2.0-S2468823123003711-ga1.jpg https://s3-eu-west-1.amazonaws.com/prod-ucs-content-store-eu-west/content/pii:S2468823123003711/ga1/DOWNSAMPLED/image/jpeg/bfeafee82449e55c51efebe7df4f4900/ga1.jpg ga1 true ga1.jpg jpg 30822 200 257 IMAGE-DOWNSAMPLED 1-s2.0-S2468823123003711-gr1.jpg https://s3-eu-west-1.amazonaws.com/prod-ucs-content-store-eu-west/content/pii:S2468823123003711/gr1/DOWNSAMPLED/image/jpeg/67ec34ac98b90c4d92c2e559d0c301e8/gr1.jpg gr1 gr1.jpg jpg 53409 223 621 IMAGE-DOWNSAMPLED 1-s2.0-S2468823123003711-gr4.jpg https://s3-eu-west-1.amazonaws.com/prod-ucs-content-store-eu-west/content/pii:S2468823123003711/gr4/DOWNSAMPLED/image/jpeg/fd3888e75e031054919adb7f4a7643f2/gr4.jpg gr4 gr4.jpg jpg 47112 255 621 IMAGE-DOWNSAMPLED 1-s2.0-S2468823123003711-gr3.jpg https://s3-eu-west-1.amazonaws.com/prod-ucs-content-store-eu-west/content/pii:S2468823123003711/gr3/DOWNSAMPLED/image/jpeg/0edc7937633928943ee7ce079ff191a7/gr3.jpg gr3 gr3.jpg jpg 31284 289 339 IMAGE-DOWNSAMPLED 1-s2.0-S2468823123003711-gr6.jpg https://s3-eu-west-1.amazonaws.com/prod-ucs-content-store-eu-west/content/pii:S2468823123003711/gr6/DOWNSAMPLED/image/jpeg/f49718f3810c7a7717e42e956633b632/gr6.jpg gr6 gr6.jpg jpg 48222 290 602 IMAGE-DOWNSAMPLED 1-s2.0-S2468823123003711-gr5.jpg https://s3-eu-west-1.amazonaws.com/prod-ucs-content-store-eu-west/content/pii:S2468823123003711/gr5/DOWNSAMPLED/image/jpeg/d05ad6be88fb2d6d46fdda8d20517e90/gr5.jpg gr5 gr5.jpg jpg 103164 503 602 IMAGE-DOWNSAMPLED 1-s2.0-S2468823123003711-gr8.jpg https://s3-eu-west-1.amazonaws.com/prod-ucs-content-store-eu-west/content/pii:S2468823123003711/gr8/DOWNSAMPLED/image/jpeg/0a959deda95331b3ea1c87db31b1b28d/gr8.jpg gr8 gr8.jpg jpg 35152 251 602 IMAGE-DOWNSAMPLED 1-s2.0-S2468823123003711-gr7.jpg https://s3-eu-west-1.amazonaws.com/prod-ucs-content-store-eu-west/content/pii:S2468823123003711/gr7/DOWNSAMPLED/image/jpeg/8371876941c6925984155d11a03e3651/gr7.jpg gr7 gr7.jpg jpg 49155 507 414 IMAGE-DOWNSAMPLED 1-s2.0-S2468823123003711-gr9.jpg https://s3-eu-west-1.amazonaws.com/prod-ucs-content-store-eu-west/content/pii:S2468823123003711/gr9/DOWNSAMPLED/image/jpeg/e2e79963f839635c677c2cb28c8b1d89/gr9.jpg gr9 gr9.jpg jpg 26585 255 339 IMAGE-DOWNSAMPLED 1-s2.0-S2468823123003711-gr11.jpg https://s3-eu-west-1.amazonaws.com/prod-ucs-content-store-eu-west/content/pii:S2468823123003711/gr11/DOWNSAMPLED/image/jpeg/5acdcfd4ac6486fbf214602a5018ed05/gr11.jpg gr11 gr11.jpg jpg 31934 250 339 IMAGE-DOWNSAMPLED 1-s2.0-S2468823123003711-gr10.jpg https://s3-eu-west-1.amazonaws.com/prod-ucs-content-store-eu-west/content/pii:S2468823123003711/gr10/DOWNSAMPLED/image/jpeg/f1ecaf937db8762d23747cd2e538a1dc/gr10.jpg gr10 gr10.jpg jpg 31282 251 339 IMAGE-DOWNSAMPLED 1-s2.0-S2468823123003711-gr2.sml https://s3-eu-west-1.amazonaws.com/prod-ucs-content-store-eu-west/content/pii:S2468823123003711/gr2/THUMBNAIL/image/gif/7481a5d6942cf6fbb691309bff18f9d8/gr2.sml gr2 gr2.sml sml 12519 164 196 IMAGE-THUMBNAIL 1-s2.0-S2468823123003711-ga1.sml https://s3-eu-west-1.amazonaws.com/prod-ucs-content-store-eu-west/content/pii:S2468823123003711/ga1/THUMBNAIL/image/gif/7bf4082e0635eeefb88495415d76b968/ga1.sml ga1 true ga1.sml sml 21483 164 211 IMAGE-THUMBNAIL 1-s2.0-S2468823123003711-gr1.sml https://s3-eu-west-1.amazonaws.com/prod-ucs-content-store-eu-west/content/pii:S2468823123003711/gr1/THUMBNAIL/image/gif/5ebbcfa83d988c509034a85056590ac1/gr1.sml gr1 gr1.sml sml 12781 79 219 IMAGE-THUMBNAIL 1-s2.0-S2468823123003711-gr4.sml https://s3-eu-west-1.amazonaws.com/prod-ucs-content-store-eu-west/content/pii:S2468823123003711/gr4/THUMBNAIL/image/gif/a51de75560cc6e8f6974784cb4002751/gr4.sml gr4 gr4.sml sml 12178 90 219 IMAGE-THUMBNAIL 1-s2.0-S2468823123003711-gr3.sml https://s3-eu-west-1.amazonaws.com/prod-ucs-content-store-eu-west/content/pii:S2468823123003711/gr3/THUMBNAIL/image/gif/d99516eace31a98561aaab9c01309752/gr3.sml gr3 gr3.sml sml 15844 163 192 IMAGE-THUMBNAIL 1-s2.0-S2468823123003711-gr6.sml https://s3-eu-west-1.amazonaws.com/prod-ucs-content-store-eu-west/content/pii:S2468823123003711/gr6/THUMBNAIL/image/gif/b8ada118d59dca8a9bccdb24fa84a774/gr6.sml gr6 gr6.sml sml 15841 105 219 IMAGE-THUMBNAIL 1-s2.0-S2468823123003711-gr5.sml https://s3-eu-west-1.amazonaws.com/prod-ucs-content-store-eu-west/content/pii:S2468823123003711/gr5/THUMBNAIL/image/gif/2150d7ab6e3b479f31d67ad8bed10db4/gr5.sml gr5 gr5.sml sml 24177 164 196 IMAGE-THUMBNAIL 1-s2.0-S2468823123003711-gr8.sml https://s3-eu-west-1.amazonaws.com/prod-ucs-content-store-eu-west/content/pii:S2468823123003711/gr8/THUMBNAIL/image/gif/6db56e43a636fa1a3004422f9f968b76/gr8.sml gr8 gr8.sml sml 9397 91 219 IMAGE-THUMBNAIL 1-s2.0-S2468823123003711-gr7.sml https://s3-eu-west-1.amazonaws.com/prod-ucs-content-store-eu-west/content/pii:S2468823123003711/gr7/THUMBNAIL/image/gif/2f5af9dec2b369a51ef697ccb766c682/gr7.sml gr7 gr7.sml sml 16595 164 134 IMAGE-THUMBNAIL 1-s2.0-S2468823123003711-gr9.sml https://s3-eu-west-1.amazonaws.com/prod-ucs-content-store-eu-west/content/pii:S2468823123003711/gr9/THUMBNAIL/image/gif/6eca8f9630af0f971469e107166b6cee/gr9.sml gr9 gr9.sml sml 16959 164 218 IMAGE-THUMBNAIL 1-s2.0-S2468823123003711-gr11.sml https://s3-eu-west-1.amazonaws.com/prod-ucs-content-store-eu-west/content/pii:S2468823123003711/gr11/THUMBNAIL/image/gif/7a921e278eed8cdca2cfa2c38dddde92/gr11.sml gr11 gr11.sml sml 20133 161 219 IMAGE-THUMBNAIL 1-s2.0-S2468823123003711-gr10.sml https://s3-eu-west-1.amazonaws.com/prod-ucs-content-store-eu-west/content/pii:S2468823123003711/gr10/THUMBNAIL/image/gif/66f183e015879a36bc172a4f71e8f62e/gr10.sml gr10 gr10.sml sml 19047 162 219 IMAGE-THUMBNAIL 1-s2.0-S2468823123003711-gr2_lrg.jpg https://s3-eu-west-1.amazonaws.com/prod-ucs-content-store-eu-west/content/pii:S2468823123003711/HIGHRES/image/jpeg/2f10806a72ef041e0e3035529cb9f037/gr2_lrg.jpg gr2 gr2_lrg.jpg jpg 151671 1257 1500 IMAGE-HIGH-RES 1-s2.0-S2468823123003711-ga1_lrg.jpg https://s3-eu-west-1.amazonaws.com/prod-ucs-content-store-eu-west/content/pii:S2468823123003711/HIGHRES/image/jpeg/ac9c86b2aae4797b632eff65acc3085b/ga1_lrg.jpg ga1 true ga1_lrg.jpg jpg 243581 886 1141 IMAGE-HIGH-RES 1-s2.0-S2468823123003711-gr1_lrg.jpg https://s3-eu-west-1.amazonaws.com/prod-ucs-content-store-eu-west/content/pii:S2468823123003711/HIGHRES/image/jpeg/700c3b42de129d68f4217ea3946bd358/gr1_lrg.jpg gr1 gr1_lrg.jpg jpg 385559 989 2750 IMAGE-HIGH-RES 1-s2.0-S2468823123003711-gr4_lrg.jpg https://s3-eu-west-1.amazonaws.com/prod-ucs-content-store-eu-west/content/pii:S2468823123003711/HIGHRES/image/jpeg/05aabe022b8d46a6291b6ec02fc75df1/gr4_lrg.jpg gr4 gr4_lrg.jpg jpg 340117 1131 2750 IMAGE-HIGH-RES 1-s2.0-S2468823123003711-gr3_lrg.jpg https://s3-eu-west-1.amazonaws.com/prod-ucs-content-store-eu-west/content/pii:S2468823123003711/HIGHRES/image/jpeg/7832544b057524fdb32dcde0f5113a43/gr3_lrg.jpg gr3 gr3_lrg.jpg jpg 214973 1277 1500 IMAGE-HIGH-RES 1-s2.0-S2468823123003711-gr6_lrg.jpg https://s3-eu-west-1.amazonaws.com/prod-ucs-content-store-eu-west/content/pii:S2468823123003711/HIGHRES/image/jpeg/f4d53285955870a31b2011cc193fc5fc/gr6_lrg.jpg gr6 gr6_lrg.jpg jpg 397858 1283 2667 IMAGE-HIGH-RES 1-s2.0-S2468823123003711-gr5_lrg.jpg https://s3-eu-west-1.amazonaws.com/prod-ucs-content-store-eu-west/content/pii:S2468823123003711/HIGHRES/image/jpeg/e48bdffdac438e9a80a3bf759febb63f/gr5_lrg.jpg gr5 gr5_lrg.jpg jpg 820856 2229 2667 IMAGE-HIGH-RES 1-s2.0-S2468823123003711-gr8_lrg.jpg https://s3-eu-west-1.amazonaws.com/prod-ucs-content-store-eu-west/content/pii:S2468823123003711/HIGHRES/image/jpeg/0899e524beae3fa902acf60e0736ac41/gr8_lrg.jpg gr8 gr8_lrg.jpg jpg 257948 1114 2667 IMAGE-HIGH-RES 1-s2.0-S2468823123003711-gr7_lrg.jpg https://s3-eu-west-1.amazonaws.com/prod-ucs-content-store-eu-west/content/pii:S2468823123003711/HIGHRES/image/jpeg/f549bcd2f105cc83d52dd6b8dc9ef445/gr7_lrg.jpg gr7 gr7_lrg.jpg jpg 396959 2243 1833 IMAGE-HIGH-RES 1-s2.0-S2468823123003711-gr9_lrg.jpg https://s3-eu-west-1.amazonaws.com/prod-ucs-content-store-eu-west/content/pii:S2468823123003711/HIGHRES/image/jpeg/5a7e863dfe1d95fda8644dc43a5bfcec/gr9_lrg.jpg gr9 gr9_lrg.jpg jpg 187643 1129 1500 IMAGE-HIGH-RES 1-s2.0-S2468823123003711-gr11_lrg.jpg https://s3-eu-west-1.amazonaws.com/prod-ucs-content-store-eu-west/content/pii:S2468823123003711/HIGHRES/image/jpeg/44bac47d68bec1d714420c2d9e06d0ac/gr11_lrg.jpg gr11 gr11_lrg.jpg jpg 227126 1104 1500 IMAGE-HIGH-RES 1-s2.0-S2468823123003711-gr10_lrg.jpg https://s3-eu-west-1.amazonaws.com/prod-ucs-content-store-eu-west/content/pii:S2468823123003711/HIGHRES/image/jpeg/a240ecefd58fd2eb20b6dead875a9a9d/gr10_lrg.jpg gr10 gr10_lrg.jpg jpg 221858 1109 1500 IMAGE-HIGH-RES 1-s2.0-S2468823123003711-si1.svg https://s3-eu-west-1.amazonaws.com/prod-ucs-content-store-eu-west/content/pii:S2468823123003711/image/svg+xml/f4757111ef1cb1a613eb85b951b87890/si1.svg si1 si1.svg svg 10003 ALTIMG 1-s2.0-S2468823123003711-si2.svg https://s3-eu-west-1.amazonaws.com/prod-ucs-content-store-eu-west/content/pii:S2468823123003711/image/svg+xml/13cdd4fdd898dfe690cf1f04e9c521d7/si2.svg si2 si2.svg svg 11783 ALTIMG 1-s2.0-S2468823123003711-si3.svg https://s3-eu-west-1.amazonaws.com/prod-ucs-content-store-eu-west/content/pii:S2468823123003711/image/svg+xml/63dab050054dad624f5963e30efe5ea7/si3.svg si3 si3.svg svg 5180 ALTIMG 1-s2.0-S2468823123003711-si4.svg https://s3-eu-west-1.amazonaws.com/prod-ucs-content-store-eu-west/content/pii:S2468823123003711/image/svg+xml/aa0c9572b67e97e4f94e38878ef051c6/si4.svg si4 si4.svg svg 15483 ALTIMG 1-s2.0-S2468823123003711-am.pdf https://s3-eu-west-1.amazonaws.com/prod-ucs-content-store-eu-west/content/egi:10Q662LPQ7P/MAIN/application/pdf/9e9b1a341e6a5c7f5f3af0baa9e5dff9/am.pdf am am.pdf pdf false 1584334 AAM-PDF MCAT 113287 113287 S2468-8231(23)00371-1 10.1016/j.mcat.2023.113287 Fig. 1 (a) isobutane conversion and isobutene selectivity and (b) isobutene yield and methane selectivity over different catalysts under the reaction conditions of mcat = 0.5 g, T = 600 °C, iC4H10: H2 = 1: 1 and WHSV (iC4H10) = 3 h−1. Fig 1 Fig. 2 TG curves of the used catalyst PtIn/HTU-U and PtIn/HTU-W. Fig 2 Fig. 3 XRD patterns of HT-U, HT-W and Al-rod. Fig 3 Fig. 4 XRD patterns of (a) calcined PtIn/HTC-U and PtIn/HTC-W, (b) reduced PtIn/HTR-U and PtIn/HTR-W. Fig 4 Fig. 5 AFM images (left) and height profiles (right) of the precursors: (a) HT-U and (b) HT-W. Fig 5 Fig. 6 TEM images of the reduced samples: (a) PtIn/HTR-U and (b) PtIn/HTR-W. Fig 6 Fig. 7 HAADF-STEM images and particle size distribution histograms of (a, b) PtIn/HTR-U and (d, e) PtIn/HTR-W, and EDS mappings of Pt and In element of (c) PtIn/HTR-U. Fig 7 Fig. 8 Low temperature N2 adsorption-desorption isotherms (a) and pore size distributions (b) of the calcined PtIn/HTC-U and PtIn/HTC-W. Fig 8 Fig. 9 H2-TPR curves of the calcined PtIn/HTC-U and PtIn/HTC-W. Fig 9 Fig. 10 NH3-TPD curves of the calcined PtIn/HTC-U and PtIn/HTC-W. Fig 10 Fig. 11 XPS spectra of In 3d region for the reduced PtIn/HTR-U and PtIn/HTR-W. Fig 11 Table 1 Textural data of the calcined PtIn/HTC-U and PtIn/HTC-W. Table 1 Sample S BET (m2·g−1) V p (cm3·g−1) D p a (nm) D Pt b (%) TOF c (s−1) PtIn/HTC-U 247 0.57 6.6 30 13.45 PtIn/HTC-W 216 0.30 3.8 17 7.47 a The most probable pore size was obtained based on the BJH method. b The Pt dispersion was calculated by the CO chemisorption results. c TOF was determined by the Pt dispersion. Table 2 H2-TPR semi-quantitative results for calcined PtIn/HTC-U and PtIn/HTC-W. Table 2 Sample TM (°C) Total peak area Peak area fraction (%) Ⅰ Ⅱ Ⅲ Ⅰ Ⅱ Ⅲ PtIn/HTC-U 311 414 536 559 25.4 66.2 8.4 PtIn/HTC-W 216 390 536 361 8.1 87.9 4.0 Table 3 Semi-quantitative results of NH3-TPD measurements for the calcined PtIn/HTC-U and PtIn/HTC-W. Table 3 Sample TM (°C) Peak area fraction (%) Totalpeak area Ⅰ Ⅱ Ⅲ Ⅳ Ⅰ Ⅱ Ⅲ Ⅳ PtIn/HTC-UPtIn/HTC-W 154146 207181 300240 639647 16.39.0 21.819.4 26.428.3 35.543.3 98107 Table 4 XPS results of In 3d region for the reduced PtIn/HTR-U and PtIn/HTR-W. Table 4 Sample BE (eV) In3+/In0 a In3d5/2 In3d3/2 In0 a In3+ In0 a In3+ PtIn/HTR-U 444.7 445.6 452.3 453.3 2.87 PtIn/HTR-W 444.5 445.5 452.2 453.2 0.69 a Relative proportion of In3+ to In0 determined from corresponding peak intensity. In-situ constructed ultrathin hydrotalcite derivative supported PtIn catalyst for isobutane direct dehydrogenation Xiqing Zhang Investigation Data curation Writing – original draft a 1 Yanting Wang Investigation Data curation Writing – original draft a 1 Yanhong Xu Methodology Formal analysis b Énio Matusse Writing – original draft Writing – review & editing a Shuling Chang Data curation Writing – review & editing a Tingting Sun Data curation Writing – review & editing a Yiren Lu Data curation Writing – review & editing c Lihong Zhang Conceptualization Supervision Project administration Writing – review & editing a ⁎ a Department of Catalysis Science and Technology and Tianjin Key Laboratory of Applied Catalysis Science & Technology, School of Chemical Engineering and Technology, Tianjin University, Tianjin 300350, PR China Department of Catalysis Science and Technology and Tianjin Key Laboratory of Applied Catalysis Science & Technology, School of Chemical Engineering and Technology Tianjin University Tianjin 300350 PR China aDepartment of Catalysis Science and Technology and Tianjin Key Laboratory of Applied Catalysis Science & Technology, School of Chemical Engineering and Technology, Tianjin University, Tianjin 300350, PR China b School of Chemical and Environmental Engineering, Pingdingshan University, Pingdingshan, Henan 467000, PR China School of Chemical and Environmental Engineering Pingdingshan University Pingdingshan Henan 467000 PR China bSchool of Chemical and Environmental Engineering, Pingdingshan University, Pingdingshan, Henan 467000, PR China c School of Environmental Science and Engineering, Tianjin University, Tianjin 300350, PR China School of Environmental Science and Engineering Tianjin University Tianjin 300350 PR China cSchool of Environmental Science and Engineering, Tianjin University, Tianjin 300350, PR China ⁎ Corresponding author. 1 These authors contributed equally to this work. The stable and ultrathin hydrotalcite nanosheets with thickness of ca. 1.0 nm have been built on the surface of Al2O3 by sharing Al element and using layer growth inhibitor formamide. Based on the topological transformation characteristics of hydrotalcite and the structural memory effect of calcined product, the supported PtIn bimetallic catalyst was achieved by stepwise incipient wetness impregnation method followed by calcination and reduction, and evaluated in isobutane direct dehydrogenation (IDH) to isobutene. The derived ultrathin bimetallic catalyst possesses excellent IDH activity under extreme conditions, in which the isobutane conversion and isobutene selectivity can remain above 63% and 92% respectively, and the turnover frequency is as high as 13.45 s−1. The excellent activity can be attributed to the formation of ultrathin hydrotalcite precursor, which can greatly enhance the specific surface area, interaction among metal components, surface acidity of weak- and medium-acid sites and surface In3+/In0 ratio, and further effectively inhibit carbon deposition and improve dispersion and stability of active Pt species in the corresponding derivative. Graphical abstract Image, graphical abstract Keywords Isobutane dehydrogenation Bimetallic catalysts Ultrathin nanosheets Formamide Pt dispersion Data availability Data will be made available on request. 1 Introduction Isobutene is an important chemical raw material for the production of methyl methacrylate (MMA), methyl tert-butyl ether (MTBE), isoprene, polyisobutene, butyl rubber and other chemicals [1–4]. With the rapid development of industry, the existing production capacity of isobutene has been unable to meet the growing demand [1–3]. Besides the stream cracking and fluid catalytic cracking units, the isobutane direct dehydrogenation (IDH) to isobutene is another competitive process to produce the high value-added isobutene from the cheap and readily available isobutane [3,4]. The metal Pt species are known as the most effective active sites for the dehydrogenation of light alkanes [1,3–5]. Under high temperature reaction conditions, it is inevitable for the active Pt sintering and carbon deposition, which are the main reasons for Pt-based catalysts deactivation [3–6]. Usually, some additives such as Sn [1,3–6], In [3,7–11], Ga [12], Cu [13], Zn [14–16] and K [1,17] are used to improve the dehydrogenation performance and stability of these catalysts through geometric and electronic interactions with Pt species. Among them, the effect of In additive is similar to that of Sn additive [11]. On the one hand, the In species can be well distributed around Pt species, and effectively preventing the aggregation of Pt species and the formation of coke during the reaction process. On the other hand, the In species can increase the electron density around Pt species, weaken the adsorption between Pt and products, and thus inhibit the occurrence of side reactions [7]. In addition, compared to Pt-Sn catalysts, Pt-In catalysts have less dependence on the preparation process and are more suitable for dehydrogenation reactions [10]. It is noteworthy that a suitable In3+/In0 ratio can enhance the In-support interaction and stabilize the oxidized In species, while a large fraction of In0 species can block the Pt active sites, which may be a poison to the dehydrogenation reaction [11,18]. Modifying the support is also a commonly used method to improve the dehydrogenation performance of Pt-based catalysts. The high surface acidity of traditional Al2O3 supports can lead to side reactions such as coking and cracking, leading to catalyst deactivation. Alkali species, such as MgO, are usually added to reduce their surface acid sites [5,8,19]. It is worth emphasizing that the calcined hydrotalcite (HT) or HT-like materials have attracted extensive attention as layered supports of Pt-based catalysts for alkane dehydrogenation due to their suitable surface area, special lattice confinement and topological transformation, adjustable morphology and surface acidity [5,9,11]. Improving the dispersion and utilization of active components through support modification to improve isobutane conversion and isobutene selectivity can reduce the generation of by-products and environmental damage, which is also one of the development directions of molecular catalysis for the chemistry in the future [20]. It has been reported that the noble-based catalysts with ultrathin structure could improve the catalytic performance in many fields under mild conditions, due to possess the maximum accessible surface for reactants and expose abundant low-coordinated active species on the surface [21,22]. Ultrathin HT derived nanosheets have been deemed as appropriate templates to obtain the ultrathin noble-based catalysts [21,22]. They are also investigated in the fields of photocatalysis [23,24], electrocatalysis [25], adsorption [26], biomedicine [27] and so on. However, the ultrathin brucite-like nanosheets easily stack together arising from the strong van der Waals forces, hydrogen bonds and electrostatic interaction between the layers and the intercalated anions [28]. Although, there are many methods to obtain ultrathin HT nanosheets, involving top-down exfoliation method [29], bottom-up reverse microemulsion method [25], one-step synthesis method [30–32] and nucleation-crystallization isolation method [24]. It is still a challenge to avoid the re-stacking of lamellar structure and maintain the monolayer state [21,33]. In this context, the main aim of this work is to synthesize a stable and efficient PtIn bimetallic catalyst for IDH. For this purpose, the ultrathin HT-based nanosheets were designed as templates and in-situ grown on Al2O3 by sharing single Al element and forming in growth inhibitor formamide. The structure, texture and physicochemical properties of as-synthesized ultrathin HT nanosheets and its supported PtIn bimetallic catalyst were characterized by many methods and compared with those of reference sample prepared under the absence of formamide. The activity, selectivity and stability of IDH to isobutene were evaluated and the structure-properties relationship was investigated. 2 Experimental section 2.1 Materials The deionized water and analytical grade reagents, including H2PtCl6·6H2O, InNO3·xH2O, Mg(NO3)2·6H2O, Al(NO3)3·9H2O, NaNO3, formamide and urea were used in the preparation processes of catalysts. 2.2 Preparation of alumina support The rod alumina support, labeled as Al-rod, was synthesized by hydrothermal method, and detail process was described in our previous report [34]. 2.3 Synthesis of supported HT precursors with and without formamide The Al-rod supported HT ultrathin precursor was synthesized by in-situ growth strategy under the protection of nitrogen. First, 3 g Al-rod powder was impregnated in a solution of 100.0 mL Mg(NO3)2 (0.150 M) under vacuum for 1 h. Then, 100.0 mL of 0.010 M NaNO3 solution containing and 50 vol% growth inhibitor formamide was thoroughly mixed with the above solution under magnetic stirring at 80 °C. After that, 0.50 M NaOH solution was dropped into the mixture to adjust pH value to ca. 10. The obtained slurry was aged at room temperature in air for 12 h and subsequently rinsed with ethanol and deionized water for 3 times respectively. Finally, the wet sample was dried overnight at 60 °C and solid product was named as HT-U. A reference sample was prepared under the same conditions in the absence of formamide and named as HT-W. 2.4 Synthesis of supported PtIn bimetallic catalysts The supported HT precursors were calcined at 600 °C for 4 h with a heating rate of 2 °C min−1 and then the calcined HT (namely HTC) supported PtIn catalysts were synthesized via the stepwise incipient wetness impregnation method as described below: Firstly, the calcined HT samples were impregnated in In(NO3)3·xH2O aqueous solution for 6 h at room temperature and followed by drying at 120 °C for 12 h and calcining at 550 °C for 4 h. Subsequently, the obtained In-based samples were used to introduce the Pt species by using H2PtCl6·H2O aqueous solution as impregnation liquid under the same procedure except for cutting the impregnation time to 2 h. The obtained solids were defined as PtIn/HTC-U and PtIn/HTC-W with Pt of 0.5 wt% and In of 1.4 wt%, respectively. As another comparison sample, the Al-rod supported PtIn catalyst, namely PtIn/C-Al-rod, was also prepared by the same method. Before dehydrogenation reaction, these calcined catalysts should be reduced in 5 vol% H2/N2 (30 mL min−1) at 600 °C for 2 h with a ramp rate of 5 °C min−1. The corresponding reduced catalysts were labeled as PtIn/HTR-U, PtIn/HTR-W and PtIn/R-Al-rod. After reaction, the spent catalysts were marked as PtIn/HTU-U, PtIn/HTU-W and PtIn/U-Al-rod. 2.5 Characterization of catalysts and precursors X-ray powder diffraction (XRD) patterns were measured with a Bruker D8-Focus X-ray diffractometer by means of Cu Kα (λ = 0.15418 nm) radiation at 40 kV and 200 mA with a scan speed of 8 ° min−1. Low temperature N2 adsorption-desorption isotherms were performed on a Norcross TriStar 3000 micromeritics apparatus at −196 °C to characterize the textural properties of samples. Before the measurement, the solids were out-gassed at 300 °C for 4 h. The specific surface area was calculated based on BET equation, while the pore size distribution and pore volume were obtained by using BJH method based on the desorption branch of isotherm. The thickness of samples was collected by a Bruker Multimode 8 atomic force microscopy (AFM). Firstly, a small amount of powder was dispersed by ultrasonic in anhydrous ethanol. Then the suspension was dropped onto clean mica sheets and observed by AFM after drying. The AFM images were obtained by using chrome-plated/silicon tip with a force constant of 40 N m−1 in tap mode. Hydrogen temperature programmed reduction (H2-TPR) test was carried on a Sp-5100 multifunctional adsorption instrument. The solid sample was firstly flushed with N2 at 400 °C for 1 h. After cooling to 100 °C, the gas was switched to 5 vol% H2/N2 with a flow rate of 30 mL min−1, and then the system was heated to 900 °C with a ramp rate of 10 °C min−1. At the same time, the H2 concentration was monitored by a TCD detector. NH3 temperature programmed desorption (NH3-TPD) was measured on a Micromeritics AutoChem II 2920 apparatus. The sample was treated in He under a flow rate of 50 mL min−1 and heated from room temperature to 500 °C for 2 h with a heating rate of 10 °C min−1, then cooled to 100 °C for NH3 pulse adsorption until saturation. After He purging again for 1 h, the temperature was increased to 800 °C with a heating rate of 10 °C min−1, and the NH3 desorption signal was detected using a TCD detector. X-ray photo-electron spectra (XPS) of the reduced sample were determined on a PerkinElmer Thermo ESCALAB 250Xi apparatus with Al Kα radiation. All binding energy (BE) values were calibrated by using C1s signal of contaminant carbon at 284.8 eV. Transmission electron microscopy (TEM) analysis of the reduced samples was verified on a JEM-2100F electron microscope at 200 kV. After ultrasonic dispersion of the reduced sample in anhydrous ethanol, the suspension was dropped on the copper grid and tested after drying. High-angle annular dark-field scanning transmission electron microscopy (HAADF-STEM) images were obtained on a JEM-ARM 200F electron microscope capable. The ultra-thin carbon film on copper mesh was used to support and disperse the powder samples. The mapping images of Pt and In element were collected by using HAADF-STEM combined with energy dispersive spectroscopy (EDS) system. The Pt dispersion of the reduced sample was measured by CO adsorption on an AutoChem1 II 2920 chemoradiometer. The CO pulse adsorption was performed at 50 °C in the gas flow of 5 vol% CO/He until saturation. Assuming the CO/Pt adsorption stoichiometry ratio is 1, the Pt dispersion is calculated based on the CO chemisorption volume. Thermogravimetric analysis (TG) of the spent catalyst was performed in air on a PerkinElmer DTG-50/50H apparatus. The mass loss was conducted from room temperature to 900 °C with a ramp rate of 10 °C min−1. 2.6 Dehydrogenation performance evaluation Before reaction, the calcined catalyst (0.5 g, 40–60 mesh) was reduced under the same condition described in Experimental section. The IDH behavior was conducted in a fixed-bed reactor with 3 h−1 of isobutane weight hourly space velocity (WHSV) at 600 °C and 0.1 MPa. The volumetric ratio of reactant isobutane and balance hydrogen was 1: 1, and the inlet and outlet gasses were monitored by a gas chromatography (GC) equipped with Al2O3 column and FID detector. The dehydrogenation performance of catalyst was evaluated by using isobutane conversion (C), isobutene selectivity (S) and yield (Y), and the formulas were given below: C = i C 4 H 10 , in − i C 4 H 10 , out i C 4 H 10 , in × 100 % S = i C 4 H 8 , out i C 4 H 10 , in − i C 4 H 10 , out × 100 % Y = C × S × 100 % where, iC4H10,in and iC4H10,out are the isobutane concentrations in inlet and outlet stream respectively, and iC4H8,out is the isobutene concentration in outlet stream. 2.7 Turnover frequency (TOF) calculation The diffusion - free operation was studied by changing the space velocity and particle size of catalyst. The results show that the external and internal diffusion effects can be safely excluded under the reaction conditions adopted in this paper. The TOF was determined according to the given formula: TOF ( s − 1 ) = F 22 . 4 × 60 × 1000 × C × M Pt m cat × ω Pt × D Pt where, F (mL·min−1), C (%), mcat (g), MPt (%), ωPt (%) and DPt (%) stand for the isobutane flow rate, isobutane conversion, catalyst mass, Pt molar mass, Pt loading amount and Pt dispersion, respectively. 3 Results and discussion 3.1 Catalytic behaviors 3.1.1 Isobutane dehydrogenation performance In order to reveal the structural advantages of ultrathin HT nanosheets, the IDH activity and products selectivity over the derived catalysts PtIn/HTR-U, PtIn/HTR-W and PtIn/R-Al-rod were evaluated and the corresponding results are compared in Fig. 1 . Besides the target product isobutene, only one by-product methane can be monitored in the outlet gases, and the corresponding selectivity over these catalysts increases following the order: PtIn/HTR-U, PtIn/HTR-W and PtIn/R-Al-rod, but the methane selectivity is below 6% for PtIn/R-Al-rod and even ca. 2% for PtIn/HTR-U and PtIn/HTR-W. At the same time, the reactant isobutane conversion, main product isobutene selectivity and yield go an opposite trend. Another important difference is the stability among them. Obviously, PtIn/HTR-U possesses the optimal dehydrogenation activity and stability. Its isobutane conversion can be kept at ca. 63% and isobutene selectivity is still more than 92% within 6 h of reaction. Although the isobutene selectivity of PtIn/HTR-W can be maintained at 88%, the isobutane conversion declines from 64% to 57% with time on stream. However, the isobutane conversion and isobutene selectivity of PtIn/R-Al-rod drop dramatically from 50% to 36% and from 84% to 80%, respectively. From Fig. 1(b), it can be found that the isobutene yields of the three catalysts display a similar trend to the isobutane conversion. Although the yield of PtIn/HTR-U shows a slight fluctuation, but it still maintains above 58% throughout the reaction. At the same time, an obvious decrease yield can be found for PtIn/HTR-W from 57% to 51% and even a remarkable drop for PtIn/R-Al-rod from 42% to 29%. According to these results, it can be announced that the activity, selectivity and stability of PtIn/HTR-U are better than that of PtIn/HTR-W and even far better than PtIn/R-Al-rod. In addition, the negligible methane in gas-phase products hints that the hydrogenolysis reaction, which involving breakage of C-C bonds, can be efficiently inhibited by PtIn/HTR-U. The superior dehydrogenation performance of PtIn/HTR-U must be related to the special structure, texture feature, surface chemical state and physicochemical properties which will be revealed by comparing with PtIn/HTR-W in detail. 3.1.2 Carbon deposition behavior In order to study the deposited carbon behavior of PtIn/HTR-U and PtIn/HTR-W, the used catalyst PtIn/HTU-U and PtIn/HTU-W were characterized by TG technology and the curves drawn Fig. 2 . The mass loss of the used catalysts during the TG process is related to the removal of carbon deposition. It is obvious that the deposited carbon amount over PtIn/HTU-U is lower than that over PtIn/HTU-W. This indicates that PtIn/HTU-U has better anti-carbon deposition ability than PtIn/HTU-W, which must be related to the unique ultrathin nanosheet structure of PtIn/HTU-U. The low amount of deposited carbon, negligible methane by-product together with the stable and excellent catalytic performance over the catalyst derived from the ultrathin HT nanosheets suggest that the deposited carbon species tend to transfer from active Pt sites to support and the active Pt sintering can be effectively resisted [35]. All these can prolong the lifetime of the ultrathin catalyst in the IDH reaction. 3.2 Characteristics of catalysts 3.2.1 XRD The crystal phase structures of HT-U and HT-W precursor as well as support Al-Rod were indexed by XRD, and their patterns are displayed in Fig. 3 . HT-U and HT-W precursor shows two strong diffraction peaks at ca. 45.7° and 67°, it can be attributed to (400) and (440) plane characteristic diffraction peaks of γ-Al2O3 (JCPDS file No. 50-0741). In addition, a series of characteristic diffraction peaks for (003), (006), (012), (015) and (110) planes of HT phase appear at 2θ of 11.3°, 22.8°, 34.5°, 39.4° and 60.8° for HT-W. It indicates that the HT precursor can be in-situ assembled on the surface of Al-rod by sharing Al element. However, HT-U synthesized in formamide solution displays a weak (110) diffraction peak along with the disappearance of (003) diffraction peak, indicating the successful synthesis of ultrathin HT nanosheets [25]. The formation of ultrathin texture should be related to the stable adsorption of the lamellar growth inhibitor formamide on HT layer, which can inhibit the growth of HT microcrystal along the direction perpendicular to the HT layer and even prevent the stacking of the HT nanosheets [30,32]. As reported, the as-synthesized ultrathin HT nanosheets usually can be temporarily maintained in the wet state without drying treatment [36]. In this work, it is noteworthy that the drying treatment at 80 °C has not resulted in the stacking and repolymerization of ultrathin HT nanosheets. This should be related to the in-situ growth of ultrathin nanosheets on the surface of Al-rod, which making it possible for the nanosheets to be firmly anchored on Al-rod. The in situ formed HT derivatives were used to support active Pt and promoter In species and the phase compositions of the corresponding calcined and reduced samples were also investigated by XRD, which patterns are given in Fig. 4 . As shown in Fig. 4(a), all HT phase diffraction peaks have disappeared and the diffraction peaks of γ-Al2O3 phase still can be detected for the calcined samples. Furthermore, the new diffraction peaks at 2θ = 42.9°, 62.3° match well with (200) and (220) diffraction of MgO (JCPDF File No. 45-0946). It is necessary to emphasized that these diffraction peaks of MgO phase in PtIn/HTC-U are weaker than those in PtIn/HTC-W. This should be related to the poor crystalline of ultrathin HT nanosheets in HT-U. In other word, the evolution of MgO microcrystals is confined in the ultrathin nanosheets, therefore restraining the growth range of MgO microcrystals during thermal decomposition process. The absence of diffraction signals of Pt- and In-based species is another important information. It can be deduced that Pt and In species should be highly dispersed on the surface of support, resulting from the low concentration of metal species and the confinement effect of HT derivatives [5]. In Fig. 4(b), the XRD patterns of the reduced samples are shown to be similar to those of the calcined samples. Especially, the diffraction peaks of Pt- and In- related phases are still absent. These signify that the phase structure is stable enough for PtIn/HTR-U and PtIn/HTR-W during reduction at high temperature. This can be used to explain the better stability of PtIn/HTR-U and PtIn/HTR-W during dehydrogenation process. 3.2.2 AFM In order to further confirm the thickness of HT nanosheets, the AFM characterization are performed on the synthesized HT-U and HT-W. And the corresponding images and height analysis are presented in Fig. 5 . The results exhibit that the thickness of HT-W nanosheets synthesized in water is about 7.5 nm, while the value for HT-U nanosheets synthesized in formamide solution is only about 1.0 nm, which is almost equivalent to 0.8 nm of mono-layer HT nanosheets [31,32]. This indicates that the existence of formamide can exactly inhibit the growth of HT nanosheets along the direction perpendicular to the layer and help the formation of ultrathin structure. Additionally, the height images also demonstrate that the particle size of HT-U is more uniform than that of HT-W. 3.2.3 TEM and HAADF-STEM From Fig. 6 , the TEM image of PtIn/HTR-U clearly demonstrates that the Al-rods are tightly wrapped by many PtIn/HTR-U ultrathin nanosheets with uniform particle size, while the other image brings out that PtIn/HTR-W nanosheets are loosely deposited on the surface of Al-rods along with different particle size. But for each sample, the nanosheets are much small compared with some unsupported HT derivatives, as shown in references [9,10]. The open and short pore channels are beneficial to the diffusion of reactants and products [8]. In addition, it is difficult to determine the presence of metal particles on these TEM images, which is agreement with the XRD result mentioned above, indicating that the metal particles are too small to be identified [8]. This is attributed to the low concentration of metal species and the strong lattice confined effect of HT structure [5]. In order to determine the phase structure and size of metal particles, the HAADF-STEM images with particle size distribution of PtIn/HTR-U and PtIn/HTR-W and EDS mappings of PtIn/HTR-U are presented in Fig. 7 . From Fig. 7 (a and d), it can be seen that the dispersed bright spots are composed of many Pt atoms and there are no big Pt particles on the surface of support. This indicates that Pt clusters are the main chemical state of Pt species [5]. The EDS element maps of PtIn/HTR-U (Fig. 7c) further prove that Pt and In species are uniformly distributed on the support surface, arising from the lattice confinement effect of HT. Comparing the particle size distributions of PtIn/HTR-U and PtIn/HTR-W (Fig. 7 (b and e)), it can be seen that the average particle size of Pt clusters on PtIn/HTR-U is 1.29 nm, which is smaller than 1.55 nm of those on PtIn/HTR-W. It indicates that ultrathin nanosheets are more conducive to the dispersion of Pt particles. The activation of C-H bonds is a structurally sensitive behavior, therefore, the Pt clusters with smaller size would have lower dehydrogenation energy barriers and exhibit higher intrinsic activity [37,38]. It can be deduced that the formation small Pt clusters is the most important way for Pt-based catalysts to obtain superior dehydrogenation performance. 3.2.4 Texture feature The low temperature N2 adsorption - desorption isotherms and pore size distribution curves of calcined catalysts including PtIn/HTC-U and PtIn/HTC-W are given in Fig. 7. Some important parameters, involving specific surface area (S BET), pore volume (V p), and most probable pore size (D p) are analyzed and collected in Table 1 . As shown in Fig. 8 , the calcined catalysts PtIn/HTC-U and PtIn/HTC-W exhibit typical type IV adsorption isotherms, accompanied by type H3 hysteresis loop, indicating that the two catalysts possess mesoporous structures [8]. The formation of this hysteresis loop is related the existence of the slit pores built by the lamellar structure [39], which derived from the HT nanosheets in situ grown on the surface of Al-rods. In Table 1, the S BET, V p and D p values of these catalysts show an obvious increasing trend from PtIn/HTC-W to PtIn/HTC-U. The elevated textural data must be related to the ultrathin feature of PtIn/HTC-U, which topologically transformed from HT structure [22] and endowed with abundant pores. On the other hand, the pore size distribution range of PtIn/HTC-U is broader than that of PtIn/HTC-W. The hierarchical pore feature of PtIn/HTC-U also plays an important role in improving the activity and selectivity of isobutane dehydrogenation [39]. The large S BET and uniform pore size distribution of PtIn/HTC-U can optimize the distribution of Pt and In species, and thus obtain high isobutane dehydrogenation activity. At the same time, Pt dispersion (D pt) measured by CO pulse adsorption and turnover frequency (TOF) calculated by D pt are also listed in Table 1. It is worth noting that the D pt and TOF value of PtIn/HTC-U are nearly twice as high as that of PtIn/HTC-W. This indicates that the ultrathin nanosheets can effectively enhance the surface ratio of active Pt species and make the Pt centers can be fully utilized in the isobutane dehydrogenation. It is should be the direct reason of the excellent dehydrogenation performance for PtIn/HTR-U. The high TOF value of PtIn/HTC-U also means that it is possible for the formation and maintenance of surface single metal atom centers or metal atom clusters on the surface of ultrathin metal oxide nanosheets [38,40], which bearing out the HAADF-STEM deduction above. 3.2.5 H2-TPR The reduction properties of different catalysts and the interaction between metal components were studied based on the H2-TPR results as shown in Fig. 9 . Clearly, all catalysts are composed of a large and wide reduction peak, and there are three fitting peaks for both catalysts at ca. 300 °C (peak Ⅰ), 400 °C (peak Ⅱ) and 536 °C (peak Ⅲ), respectively. The semi-quantitative analysis of these peaks is conducted by deconvolution of Gaussian function fitting method, and the fitting data are summarized in Table 2 . According to the relevant reports [11], these peaks should be corresponded to the reduction of PtOx species at low temperature, InOx species interacting with PtOx and support at high temperature respectively. In Fig. 9, the reduction temperatures for peak Ⅰ and Ⅱ of PtIn/HTC-U are higher than those of PtIn/HTC-W, except the same peak Ⅲ temperatures. It indicates that the interaction among Pt, In and support is stronger in PtIn/HTC-U than that in PtIn/HTC-W. In other word, the effect of nanosheets thickness on the reducibility of catalysts is mainly arising from the different interaction strength among Pt, In and support. The strong interaction is just the reason of the stable dehydrogenation performance for PtIn/HTR-U. The data in Table 2 also show that the total peak area of PtIn/HTC-U is much larger than that of PtIn/HTC-W. This indicates that there are more reducible PtOx and InOx species in ultrathin sample than that in reference one. It demonstrates that the ultrathin nanosheets are beneficial to exposing and reducing PtOx and InOx species. At the same time, the peak II owns the largest area fraction in each sample, while the Peak III has the smallest value. This suggests that the Pt species could promote the reduction of partial InOx species. Compared with PtIn/HTC-W, the peak II area fraction of PtIn/HTC-U has a lower value. This hints that there is a lower amount of reductive In species on the surface of reduced PtIn/HTR-U. Additionally, the peak Ⅰ area fraction of PtIn/HTC-U is more than three times higher than that of PtIn/HTC-W. This predicts that there are more active metal Pt species on the reduced PtIn/HTR-U with ultrathin nanosheets, which is also consistent with the corresponding high Pt dispersion. Furthermore, the opposite trend for peak I and II also signifies that the surface Pt0/In0 ratio on PtIn/HTR-U would be higher than that on PtIn/HTR-W. In any case, the ultrathin nanosheet structure is beneficial to obtaining the more active metal Pt species by confinement reduction, while the strong interaction between In3+ ions and support can inhibit the reduction of In3+ ions, resulting in the more In3+ ions and less In0 species on PtIn/HTR-U than that on PtIn/HTR-W. 3.2.6 NH3-TPD As is known to all, the dehydrogenation performance of isobutane is also influenced by the surface acidity of catalysts. The acid sites distributions of the calcined PtIn/HTC-U and PtIn/HTC-W can be investigated by NH3-TPD measurement and the Gaussian function fitting method is used for deconvolution of the corresponding desorption peaks. The obtained curves are drawn in Fig. 10 and the fitting results are given in Table 3 . As shown in Fig. 10, there are four fitting peaks for the calcined PtIn/HTC-U and PtIn/HTC-W, which are peak Ⅰ located in the low temperature region, peak Ⅱ-Ⅲ located in the medium temperature region and peak Ⅳ located in the high temperature region, respectively. According to the reported results and analysis, they should be successively assigned to the weak-, medium- and strong-acid sites on the surface of calcined PtIn/HTC-U and PtIn/HTC-W. In Table 3, the total peak area of PtIn/HTC-U is slightly lower than that of PtIn/HTC-W. This indicates that the ultrathin nanosheets of PtIn/HTC-U can not only enhance the D pt value, but also boost the Mg utilization to neutralize partial surface acid sites. As we all known, the surface acid sites can activate isobutane dehydrogenation, but some undesired side reactions tend to occur at the strong-acid sites, thus affecting the isobutene selectivity [41]. As for peak Ⅰ, peak Ⅱ and peak Ⅲ, the maximal peak temperatures (TM) and peak area fraction of PtIn/HTC-U are higher than those of PtIn/HTC-W, while the contrary trend appears for peak Ⅳ. These mean that the strength and concentration of weak- and medium-acid sites on PtIn/HTC-U are higher than those on PtIn/HTC-W, but the acidity of strong-acid sites for PtIn/HTC-U is lower than that for PtIn/HTC-W. It can be confirmed that the strong medium-acid sites on PtIn/HTC-U make an important contribution to enhancing the isobutane conversion, and the weak strong-acid sites can effectively inhibit some side reactions, such as cracking and coking reactions [42], and thus result in the prominent isobutene selectivity and dehydrogenation stability for PtIn/HTC-U. 3.2.7 XPS Before dehydrogenation evaluation, the samples need to be reduced to obtain the appropriate chemical state and relative atom ratio of metal components on the reduced PtIn/HTR-U and PtIn/HTR-W, therefore the XPS analysis was carried out to obtain this information. It is necessary to account for the absence about the XPS spectra of Pt 4f region. It is the similar binding energies (BE) between Al 2p and Pt 4f make it difficult to distinguish Pt 4f spectra from Al 2p spectra [43]. Therefore, only the XPS spectra of In 3d region in the range of 440–460 eV are plotted in Fig. 11 . The broad In 3d peak has been deconvoluted into four peaks and the specific peak information of each sample is collected in Table 4 . This indicates that there are two In chemical states in the reduced catalysts. The peaks at low BE of 444.5 and 452.2 eV are attributed to the surface metal state In (In0), and the peaks at high BE of 445.6 and 453.2 eV depend on the oxidation state In (In3+) [9–11]. The BE values of In species in PtIn/HTR-U are slightly higher than those in PtIn/HTR-W, indicating that the formation of ultrathin nanosheets increases the interaction among In and other metal species as well as the electron transfer ability of In to Pt species [8]. This is in consistent with the above H2-TPR results (see Fig. 9). In addition, the In3+/In0 ratio of PtIn/HTR-U is much higher than that of PtIn/HTR-W. This suggests that the ultrathin nanosheets are more conducive to maintaining the ionic state of In3+, while the In3+ species in the ordinary HT derivative are easier to be reduced. Therefore, there are more metal In0 species on the surface of PtIn/HTR-W, which has been proved by the result of H2-TPR. According to the high D pt value and reduction temperature of PtIn/HTC-U mentioned above, it demonstrates that the high In3+/In0 ratio should be related to the easy surface segregation of active metal Pt0 species compared with the metal In0 species [44] and difficult reduction of In3+ species arising from the strong interaction among Pt, In and Al element in the ultrathin PtIn/HTR-U. The most important is that the existence of excess In0 species can block the Pt active sites [11,18], it should be one reason for the poor dehydrogenation performance over PtIn/HTR-W. Based on the results of HAADF-STEM, D pt and XPS, it can be deduced that an appropriate In3+/In0 ratio can not only avoid the coverage of Pt centers by In0 species, but also promote the dispersion and stability of Pt species by In0 insulation effect [11,18]. The difference about the surface chemical state and relative content of In species between PtIn/HTC-U and PtIn/HTC-W again reveals that the isobutane dehydrogenation performance can be improved by reducing the thickness of nanosheets to enhance the utilization and stabilization of supported active Pt species. 4 Conclusions In summary, we successfully in situ constructed stable ultrathin hydrotalcite nanosheets by using formamide as growth inhibitor on alumina support which providing the essential Al element. The excellent PtIn bimetallic catalysts can be obtained by combining stepwise incipient wetness impregnation method, calcination and reduction treatment, and successfully applied in the isobutane direct dehydrogenation at 600 °C. The XRD and AFM results verified the formation of ultrathin hydrotalcite nanosheets with a thickness of only 1.0 nm and no repolymerization occurred after high temperature treatment. Compared with PtIn/HTR-W with thick nanosheets, the ultrathin catalyst PtIn/HTR-U can obtain the optimal isobutane conversion (above 63%) and isobutene selectivity (above 92%) as well as excellent turnover frequency (13.45 s−1) and anti-carbon deposition behavior due to its large specific surface area, strong acidity of weak- and medium-acid sites, high In3+/In0 ratio and Pt dispersion (30%). The strong interaction among Pt, In and support, dispersion of appropriate In0 species and low carbon deposition further resulted in the stable dehydrogenation performance of PtIn/HTR-U. The formation of ultrathin hydrotalcite structure effectively improved the utilization and dispersion of active Pt species. This work provides an ingenious method to synthesize uniformly distributed and well dispersed noble metal catalysts and realizes the application of ultrathin hydrotalcite derivatives in the harsh condition of thermal catalysis. CRediT authorship contribution statement Xiqing Zhang: Investigation, Data curation, Writing – original draft. Yanting Wang: Investigation, Data curation, Writing – original draft. Yanhong Xu: Methodology, Formal analysis. Énio Matusse: Writing – original draft, Writing – review & editing. Shuling Chang: Data curation, Writing – review & editing. Tingting Sun: Data curation, Writing – review & editing. Yiren Lu: Data curation, Writing – review & editing. Lihong Zhang: Conceptualization, Supervision, Project administration, Writing – review & editing. Declaration of Competing Interest We declare that we have no financial and personal relationships with other people or organizations that could have appeared to influence the work reported in this manuscript. Acknowledgments This research was funded by the National Natural Science Foundation of China (21776214). References [1] S. Luo N. Wu B. Zhou S.B. He J.S. Qiu C.L. Sun Effect of alumina support on the performance of Pt-Sn-K/γ-Al2O3 catalyst in the dehydrogenation of isobutane J. Fuel Chem. Technol. 41 2013 1481 1487 S. Luo, N. Wu, B. Zhou, S.B. He, J.S. Qiu, C.L. Sun, Effect of alumina support on the performance of Pt-Sn-K/γ-Al2O3 catalyst in the dehydrogenation of isobutane, J. Fuel Chem. Technol. 41 (2013) 1481–1487. [2] G. Wang C. Li H. Shan Highly efficient metal sulfide catalysts for selective dehydrogenation of isobutane to isobutene ACS Catal. 4 2014 1139 1143 G. Wang, C. Li, H. Shan, Highly efficient metal sulfide catalysts for selective dehydrogenation of isobutane to isobutene, ACS Catal.. 4 (2014) 1139–1143. [3] J. Liu W. Zhou D. Jiang W. Wu C. Miao Y. Wang X. Ma Isobutane dehydrogenation over InPtSn/ZnAl2O4 catalysts: effect of Indium promoter Ind. Eng. Chem. Res. 57 2018 11265 11270 J. Liu, W. Zhou, D. Jiang, W. Wu, C. Miao, Y. Wang, X. Ma, Isobutane dehydrogenation over InPtSn/ZnAl2O4 catalysts: effect of Indium promoter, Ind. Eng. Chem. Res. 57 (2018) 11265–11270. [4] J. Liu W. Zhou D. Jiang D. Wang W. Wu Y. Wang X. Ma Insights into the doping effect of rare-earth metal on ZnAl2O4 supported PtSn catalyzed isobutane dehydrogenation Catal. Today. 368 2021 58 65 J. Liu, W. Zhou, D. Jiang, D. Wang, W. Wu, Y. Wang, X. Ma, Insights into the doping effect of rare-earth metal on ZnAl2O4 supported PtSn catalyzed isobutane dehydrogenation, Catal. Today. 368 (2021) 58–65. [5] Y. Zhu Z. An H. Song X. Xiang W. Yan J. He Lattice-confined Sn (IV/II) stabilizing raft-like Pt clusters: high selectivity and durability in propane dehydrogenation ACS Catal. 7 2017 6973 6978 Y. Zhu, Z. An, H. Song, X. Xiang, W. Yan, J. He, Lattice-confined Sn (IV/II) stabilizing raft-like Pt clusters: high selectivity and durability in propane dehydrogenation, ACS Catal.. 7 (2017) 6973–6978. [6] X.Q. Gao W. Song W.C. Li A.H. Lu Anti-coke behavior of an alumina nanosheet supported Pt–Sn catalyst for isobutane dehydrogenation Catal. Sci. Technol. 11 2021 2597 2603 X.Q. Gao, W. Song, W.C. Li, A.H. Lu, Anti-coke behavior of an alumina nanosheet supported Pt–Sn catalyst for isobutane dehydrogenation, Catal. Sci. Technol. 11 (2021) 2597–2603. [7] R. Qian S.Z. Luo F. Jing W. Fang Carbon nanotubes confined PtIn alloy as a highly stable catalyst for propane dehydrogenation Ind. Eng. Chem. Res. 61 2022 17264 17274 R. Qian, S.Z. Luo, F. Jing, W. Fang, Carbon nanotubes confined PtIn alloy as a highly stable catalyst for propane dehydrogenation, Ind. Eng. Chem. Res. 61 (2022) 17264–17274. [8] J. Li M. Zhang Z. Song S. Liu J. Wang L. Zhang Hierarchical PtIn/Mg(Al)O derived from reconstructed PtIn-hydrotalcite-like compounds for highly efficient propane dehydrogenation Catalysts 9 2019 767 J. Li, M. Zhang, Z. Song, S. Liu, J. Wang, L. Zhang, Hierarchical PtIn/Mg(Al)O derived from reconstructed PtIn-hydrotalcite-like compounds for highly efficient propane dehydrogenation, Catalysts. 9 (2019) 767. [9] K. Xia W.Z. Lang P.P. Li X. Yan Y.J. Guo The properties and catalytic performance of PtIn/Mg(Al)O catalysts for the propane dehydrogenation reaction: effects of pH value in preparing Mg(Al)O supports by the co-precipitation method J. Catal. 338 2016 104 114 K. Xia, W.Z. Lang, P.P. Li, X. Yan, Y.J. Guo, The properties and catalytic performance of PtIn/Mg(Al)O catalysts for the propane dehydrogenation reaction: effects of pH value in preparing Mg(Al)O supports by the co-precipitation method, J. Catal. 338 (2016) 104–114. [10] K. Xia W.Z. Lang P.P. Li L.L. Long X. Yan Y.J. Guo The influences of Mg/Al molar ratio on the properties of PtIn/Mg(Al)O- x catalysts for propane dehydrogenation reaction Chem. Eng. J. 284 2016 1068 1079 K. Xia, W.Z. Lang, P.P. Li, L.L. Long, X. Yan, Y.J. Guo, The influences of Mg/Al molar ratio on the properties of PtIn/Mg(Al)O- x catalysts for propane dehydrogenation reaction, Chem. Eng. J. 284 (2016) 1068–1079. [11] W. Tolek K. Suriye P. Praserthdam J. Panpranot Effect of preparation method on the Pt-In modified Mg(Al)O catalysts over dehydrogenation of propane Catal. Today 358 2020 100 108 W. Tolek, K. Suriye, P. Praserthdam, J. Panpranot, Effect of preparation method on the Pt-In modified Mg(Al)O catalysts over dehydrogenation of propane, Catal. Today 358 (2020) 100–108. [12] T. Bauer S. Maisel D. Blaumeiser J. Vecchietti N. Taccardi P. Wasserscheid A. Bonivardi A. Gorling J. Libuda Operando DRIFTS and DFT study of propane dehydrogenation over solid- and liquid-supported GaxPty catalysts ACS Catal. 9 2019 2842 2853 T. Bauer, S. Maisel, D. Blaumeiser, J. Vecchietti, N. Taccardi, P. Wasserscheid, A. Bonivardi, A. Gorling, J. Libuda, Operando DRIFTS and DFT study of propane dehydrogenation over solid- and liquid-supported GaxPty catalysts, ACS Catal.. 9 (2019) 2842–2853. [13] H. Lee W.I. Kim K.D. Jung H.L. Koh Effect of Cu promoter and alumina phases on Pt/Al2O3 for propane dehydrogenation Korean J. Chem. Eng. 34 2017 1337 1345 H. Lee, W.I. Kim, K.D. Jung, H.L. Koh, Effect of Cu promoter and alumina phases on Pt/Al2O3 for propane dehydrogenation, Korean J. Chem. Eng. 34 (2017) 1337–1345. [14] C. Chen M. Sun Z. Hu J. Ren S. Zhang Z.Y. Yuan New insight into the enhanced catalytic performance of ZnPt/HZSM-5 catalysts for direct dehydrogenation of propane to propylene Catal. Sci. Technol. 9 2019 1979 1988 C. Chen, M. Sun, Z. Hu, J. Ren, S. Zhang, Z.Y. Yuan, New insight into the enhanced catalytic performance of ZnPt/HZSM-5 catalysts for direct dehydrogenation of propane to propylene, Catal. Sci. Technol. 9 (2019) 1979–1988. [15] Q. Sun N. Wang Q. Fan L. Zeng A. Mayoral S. Miao R. Yang Z. Jiang W. Zhou J. Zhang T. Zhang J. Xu P. Zhang J. Cheng D.C. Yang R. Jia L. Li Q. Zhang Y. Wang O. Terasaki J. Yu Subnanometer bimetallic platinum - zinc clusters in zeolites for propane dehydrogenation Angew. Chem. Int. Ed. 59 2020 19450 19459 Q. Sun, N. Wang, Q. Fan, L. Zeng, A. Mayoral, S. Miao, R. Yang, Z. Jiang, W. Zhou, J. Zhang, T. Zhang, J. Xu, P. Zhang, J. Cheng, D.C. Yang, R. Jia, L. Li, Q. Zhang, Y. Wang, O. Terasaki, and J. Yu, Subnanometer bimetallic platinum - zinc clusters in zeolites for propane dehydrogenation, Angew. Chem. Int. Ed. 59 (2020) 19450-19450. [16] L. Rochlitz K. Searles J. Alfke D. Zemlyanov O.V. Safonova C. Coperet Silica-supported, narrowly distributed, subnanometric Pt-Zn particles from single sites with high propane dehydrogenation performance Chem. Sci. 11 2019 1549 1555 L. Rochlitz, K. Searles, J. Alfke, D. Zemlyanov, O.V. Safonova, C. Coperet, Silica-supported, narrowly distributed, subnanometric Pt-Zn particles from single sites with high propane dehydrogenation performance, Chem. Sci. 11 (2019) 1549–1555. [17] A.N. Matveyeva N.A. Zaitseva N.A. Pakhomov D.Y. Murzin Pt- and K-promoted supported gallia as a highly stable alternative catalyst for isobutane dehydrogenation Catal. Sci. Technol. 10 2020 7719 7723 A.N. Matveyeva, N.A. Zaitseva, N.A. Pakhomov, D.Y. Murzin, Pt- and K-promoted supported gallia as a highly stable alternative catalyst for isobutane dehydrogenation, Catal. Sci. Technol. 10 (2020) 7719–7723. [18] W. Tolek K. Suriye P. Praserthdam J. Panpranot Enhanced stability and propene yield in propane dehydrogenation on PtIn/Mg(Al)O catalysts with various in loadings Top. Catal. 61 2018 1624 1632 W. Tolek, K. Suriye, P. Praserthdam, J. Panpranot, Enhanced stability and propene yield in propane dehydrogenation on PtIn/Mg(Al)O catalysts with various in loadings, Top. Catal. 61 (2018) 1624–1632. [19] U. Rodemerck E.V. Kondratenko T. Otroshchenko D. Linke Unexpectedly high activity of bare alumina for non-oxidative isobutane dehydrogenation Chem. Commun. 52 2016 12222 12225 U. Rodemerck, E.V. Kondratenko, T. Otroshchenko, D. Linke,Unexpectedly high activity of bare alumina for non-oxidative isobutane dehydrogenation, Chem. Commun. 52 (2016) 12222–12225. [20] J.W. Han F. Hollmann R. Luque I.K. Song G. Talarico T. Tatsumi N. Yan Molecular catalysis for the chemistry of the future: a perspective Mol. Catal. 522 2022 112233 J.W. Han, F. Hollmann, R. Luque, I.K. Song, G. Talarico, T. Tatsumi, N. Yan, Molecular catalysis for the chemistry of the future: a perspective, Mol. Catal. 522 (2022) 112233. [21] C. Tan X. Cao X.J. Wu Q. He J. Yang X. Zhang J. Chen W. Zhao S. Han G.H. Nam M. Sindoro H. Zhang Recent advances in ultrathin two-dimensional nanomaterials Chem. Rev. 117 2017 6225 6331 C. Tan, X. Cao, X.J. Wu, Q. He, J. Yang, X. Zhang, J. Chen, W. Zhao, S. Han, G.H. Nam, M. Sindoro, H. Zhang, Recent advances in ultrathin two-dimensional nanomaterials, Chem. Rev. 117 (2017) 6225–6331. [22] H. Yin Z. Tang Ultrathin two-dimensional layered metal hydroxides: an emerging platform for advanced catalysis, energy conversion and storage Chem. Soc. Rev. 45 2016 4873 4891 H. Yin, Z. Tang, Ultrathin two-dimensional layered metal hydroxides: an emerging platform for advanced catalysis, energy conversion and storage, Chem. Soc. Rev. 45 (2016) 4873–4891. [23] P. Ding F. Luo P. Wang W. Xia X. Xu J. Hu H. Zeng Photo-induced charge kinetic acceleration in ultrathin layered double hydroxide nanosheets boosts the oxygen evolution reaction J. Mater. Chem. A 8 2020 1105 1112 P. Ding, F. Luo, P. Wang, W. Xia, X. Xu, J. Hu, H. Zeng, Photo-induced charge kinetic acceleration in ultrathin layered double hydroxide nanosheets boosts the oxygen evolution reaction, J. Mater. Chem. A 8 (2020) 1105–1112. [24] Y. Zhao Y. Zhao G.I.N. Waterhouse L. Zheng X. Cao F. Teng L.Z. Wu C.H. Tung D. O'Hare T. Zhang Layered-double-hydroxide nanosheets as efficient visible-light-driven photocatalysts for dinitrogen fixation Adv. Mater. 29 2017 1703828 Y. Zhao, Y. Zhao, G.I.N. Waterhouse, L. Zheng, X. Cao, F. Teng, L.Z. Wu, C.H. Tung, D. O'Hare, T. Zhang, Layered-double-hydroxide nanosheets as efficient visible-light-driven photocatalysts for dinitrogen fixation, Adv. Mater. 29 (2017) 1703828. [25] Y. Zhao Q. Wang T. Bian H. Yu H. Fan C. Zhou L.Z. Wu C.H. Tung D. O'Hare T. Zhang Ni3+ doped monolayer layered double hydroxide nanosheets as efficient electrodes for supercapacitors Nanoscale 7 2015 7168 7173 Y. Zhao, Q. Wang, T. Bian, H. Yu, H. Fan, C. Zhou, L.Z. Wu, C.H. Tung, D. O'Hare, T. Zhang, Ni3+ doped monolayer layered double hydroxide nanosheets as efficient electrodes for supercapacitors, Nanoscale 7 (2015) 7168–7173. [26] J. Wang L. Huang Q. Zheng Y. Qiao Q. Wang Layered double hydroxides/oxidized carbon nanotube nanocomposites for CO2 capture J. Ind. Eng. Chem. 36 2016 255 262 J. Wang, L. Huang, Q. Zheng, Y. Qiao, Q. Wang, Layered double hydroxides/oxidized carbon nanotube nanocomposites for CO2 capture, J. Ind. Eng. Chem. 36 (2016) 255–262. [27] L. Peng X. Mei J. He J. Xu W. Zhang R. Liang M. Wei D.G. Evans X. Duan Monolayer nanosheets with an extremely high drug loading toward controlled delivery and cancer theranostics Adv. Mater. 30 2018 1707389 L. Peng, X. Mei, J. He, J. Xu, W. Zhang, R. Liang, M. Wei, D.G. Evans, X. Duan, Monolayer nanosheets with an extremely high drug loading toward controlled delivery and cancer theranostics, Adv. Mater. 30 (2018) 1707389. [28] S. He Z. An M. Wei D.G. Evans X. Duan Layered double hydroxide-based catalysts: nanostructure design and catalytic performance Chem. Commun. 49 2013 5912 5920 S. He, Z. An, M. Wei, D.G. Evans, X. Duan, Layered double hydroxide-based catalysts: nanostructure design and catalytic performance, Chem. Commun. 49 (2013) 5912–5920. [29] Q. Wang D. O'Hare Large-scale synthesis of highly dispersed layered double hydroxide powders containing delaminated single layer nanosheets Chem. Commun. 49 2013 6301 6303 Q. Wang, D. O'Hare, Large-scale synthesis of highly dispersed layered double hydroxide powders containing delaminated single layer nanosheets, Chem. Commun. 49 (2013) 6301–6303. [30] J. Yu J. Liu A. Clearfield J.E. Sims M.T. Speiegle S.L. Suib L. Sun Synthesis of layered double hydroxide single-layer nanosheets in formamide Inorg. Chem. 55 2016 12036 12041 J. Yu, J. Liu, A. Clearfield, J.E. Sims, M.T. Speiegle, S.L. Suib, L. Sun, Synthesis of layered double hydroxide single-layer nanosheets in formamide, Inorg. Chem. 55 (2016) 12036–12041. [31] Z. Wang S.M. Xu Y. Xu L. Tan X. Wang Y. Zhao H. Duan Y.F. Song Single Ru atoms with precise coordination on a monolayer layered double hydroxide for efficient electrooxidation catalysis Chem. Sci. 10 2019 378 384 Z. Wang, S.M. Xu, Y. Xu, L. Tan, X. Wang, Y. Zhao, H. Duan, Y.F. Song, Single Ru atoms with precise coordination on a monolayer layered double hydroxide for efficient electrooxidation catalysis, Chem. Sci. 10 (2019) 378–384. [32] J. Yu B.R. Martin A. Clearfield Z. Luo L. Sun One-step direct synthesis of layered double hydroxide single-layer nanosheets Nanoscale 7 2015 9448 9451 J. Yu, B.R. Martin, A. Clearfield, Z. Luo, L. Sun, One-step direct synthesis of layered double hydroxide single-layer nanosheets, Nanoscale, 7 (2015) 9448–9451. [33] J. Yu Q. Wang D. O'Hare L. Sun Preparation of two dimensional layered double hydroxide nanosheets and their applications Chem. Soc. Revi. 46 2017 5950 5974 J. Yu, Q. Wang, D. O'Hare, L. Sun, Preparation of two dimensional layered double hydroxide nanosheets and their applications, Chem. Soc. Revi. 46 (2017) 5950–5974. [34] J. Wang Z. Song M. Han X. Li L. Zhang Molybdenum-based catalysts supported on alumina for direct dehydrogenation of isobutane Mol. Catal. 511 2021 111746 J. Wang, Z. Song, M. Han, X. Li, L. Zhang, Molybdenum-based catalysts supported on alumina for direct dehydrogenation of isobutane, Mol. Catal. 511 (2021) 111746. [35] F. Feng H. Zhang S. Chu Q. Zhang C. Wang G. Wang F. Wang L. Bing D. Han Recent progress on the traditional and emerging catalysts for propane dehydrogenation J. Ind. Eng. Chem. 118 2023 1 18 F. Feng, H. Zhang, S. Chu, Q. Zhang, C. Wang, G. Wang, F. Wang, L. Bing, D. Han, Recent progress on the traditional and emerging catalysts for propane dehydrogenation, J. Ind. Eng. Chem. 118 (2023) 1–18. [36] X. Cai Y. Luo B. Liu H.M. Cheng Preparation of 2D material dispersions and their applications Chem. Soc. Rev. 47 2018 6224 6266 X. Cai, Y. Luo, B. Liu, H.M. Cheng, Preparation of 2D material dispersions and their applications, Chem. Soc. Rev. 47 (2018) 6224–6266. [37] J. Zhu M.L. Yang Y. Yu Y.A. Zhu Z.J. Sui X.G. Zhou A. Holmen D. Chen Size-dependent reaction mechanism and kinetics for propane dehydrogenation over Pt catalysts ACS Catal. 5 2015 6310 6319 J. Zhu, M.L. Yang, Y. Yu, Y.A. Zhu, Z.J. Sui, X.G. Zhou, A. Holmen, D. Chen, Size-dependent reaction mechanism and kinetics for propane dehydrogenation over Pt catalysts, ACS Catal.. 5 (2015) 6310–6319. [38] W. Zhang H. Wang J. Jiang Z. Sui Y. Zhu D. Chen X. Zhou Size dependence of Pt catalysts for propane dehydrogenation: from atomically dispersed to nanoparticles ACS Catal. 10 2020 12932 12942 W. Zhang, H. Wang, J. Jiang, Z. Sui, Y. Zhu, D. Chen, X. Zhou, Size dependence of Pt catalysts for propane dehydrogenation: from atomically dispersed to nanoparticles, ACS Catal.. 10 (2020) 12932–12942. [39] Y.Z. Yue F. Liu L. Zhao L.H. Zhang Y. Liu Loading oxide nano sheet supported Ni–Co alloy nanoparticles on the macroporous walls of monolithic alumina and their catalytic performance for ethanol steam reforming Int. J. Hydrogen Energy 40 2015 7052 7063 Y.Z. Yue, F. Liu, L. Zhao, L.H. Zhang, Y. Liu, Loading oxide nano sheet supported Ni–Co alloy nanoparticles on the macroporous walls of monolithic alumina and their catalytic performance for ethanol steam reforming, Int. J. Hydrogen Energy 40 (2015) 7052–7063. [40] A. Van Assche C. Especel A.Le Valant F. Epron Effect of potassium and platinum contents on catalytic performance of Pt/Al2O3 monometallic catalysts for propane dehydrogenation Mol. Catal. 517 2022 112059 A. Van Assche, C. Especel, A.Le Valant, F. Epron, Effect of potassium and platinum contents on catalytic performance of Pt/Al2O3 monometallic catalysts for propane dehydrogenation, Mol. Catal. 517 (2022) 112059. [41] T.P. Otroshchenko V.A. Kondratenko U. Rodemerck D. Linke E.V. Kondratenko Non-oxidative dehydrogenation of propane, n-butane, and isobutane over bulk ZrO2-based catalysts: effect of dopant on the active site and pathways of product formation Catal. Sci. Technol. 7 2017 4499 4510 T.P. Otroshchenko, V.A. Kondratenko, U. Rodemerck, D. Linke, E.V. Kondratenko, Non-oxidative dehydrogenation of propane, n-butane, and isobutane over bulk ZrO2-based catalysts: effect of dopant on the active site and pathways of product formation, Catal. Sci. Technol. 7 (2017) 4499–4510. [42] C. Yu H. Xu Q. Ge W. Li Properties of the metallic phase of zinc-doped platinum catalysts for propane dehydrogenation J. Mol. Catal. A Chem. 266 2007 80 87 C. Yu, H. Xu, Q. Ge, W. Li, Properties of the metallic phase of zinc-doped platinum catalysts for propane dehydrogenation, J. Mol. Catal. A Chem. 266 (2007) 80–87. [43] H.X. Jiang C.X. Yao Y.D. Wang M.H. Zhang Synthesis and catalytic performance of highly dispersed platinum nanoparticles supported on alumina via supercritical fluid deposition J. Supercrit. Fluid. 166 2020 105014 H.X. Jiang, C.X. Yao, Y.D. Wang, M.H. Zhang, Synthesis and catalytic performance of highly dispersed platinum nanoparticles supported on alumina via supercritical fluid deposition, J. Supercrit. Fluid. 166 (2020) 105014. [44] H. Liao A. Fisher Z.J. Xu Surface segregation in bimetallic nanoparticles: a critical issue in electrocatalyst engineering Small 11 2015 3221 3246 H. Liao, A. Fisher, Z.J. Xu, Surface segregation in bimetallic nanoparticles: a critical issue in electrocatalyst engineering, Small 11 (2015) 3221–3246.",
      "scopus-id": "85161320548",
      "coredata": {
        "eid": "1-s2.0-S2468823123003711",
        "dc:description": "The stable and ultrathin hydrotalcite nanosheets with thickness of ca. 1.0 nm have been built on the surface of Al2O3 by sharing Al element and using layer growth inhibitor formamide. Based on the topological transformation characteristics of hydrotalcite and the structural memory effect of calcined product, the supported PtIn bimetallic catalyst was achieved by stepwise incipient wetness impregnation method followed by calcination and reduction, and evaluated in isobutane direct dehydrogenation (IDH) to isobutene. The derived ultrathin bimetallic catalyst possesses excellent IDH activity under extreme conditions, in which the isobutane conversion and isobutene selectivity can remain above 63% and 92% respectively, and the turnover frequency is as high as 13.45 s−1. The excellent activity can be attributed to the formation of ultrathin hydrotalcite precursor, which can greatly enhance the specific surface area, interaction among metal components, surface acidity of weak- and medium-acid sites and surface In3+/In0 ratio, and further effectively inhibit carbon deposition and improve dispersion and stability of active Pt species in the corresponding derivative.",
        "openArchiveArticle": "false",
        "prism:coverDate": "2023-08-31",
        "openaccessUserLicense": null,
        "prism:aggregationType": "Journal",
        "prism:url": "https://api.elsevier.com/content/article/pii/S2468823123003711",
        "dc:creator": [
          {
            "@_fa": "true",
            "$": "Zhang, Xiqing"
          },
          {
            "@_fa": "true",
            "$": "Wang, Yanting"
          },
          {
            "@_fa": "true",
            "$": "Xu, Yanhong"
          },
          {
            "@_fa": "true",
            "$": "Matusse, Énio"
          },
          {
            "@_fa": "true",
            "$": "Chang, Shuling"
          },
          {
            "@_fa": "true",
            "$": "Sun, Tingting"
          },
          {
            "@_fa": "true",
            "$": "Lu, Yiren"
          },
          {
            "@_fa": "true",
            "$": "Zhang, Lihong"
          }
        ],
        "link": [
          {
            "@_fa": "true",
            "@rel": "self",
            "@href": "https://api.elsevier.com/content/article/pii/S2468823123003711"
          },
          {
            "@_fa": "true",
            "@rel": "scidir",
            "@href": "https://www.sciencedirect.com/science/article/pii/S2468823123003711"
          }
        ],
        "dc:format": "application/json",
        "openaccessType": null,
        "pii": "S2468-8231(23)00371-1",
        "prism:volume": "547",
        "articleNumber": "113287",
        "prism:publisher": "Elsevier B.V.",
        "dc:title": "In-situ constructed ultrathin hydrotalcite derivative supported PtIn catalyst for isobutane direct dehydrogenation",
        "prism:copyright": "© 2023 Elsevier B.V. All rights reserved.",
        "openaccess": "0",
        "prism:issn": "24688231",
        "dcterms:subject": [
          {
            "@_fa": "true",
            "$": "Isobutane dehydrogenation"
          },
          {
            "@_fa": "true",
            "$": "Bimetallic catalysts"
          },
          {
            "@_fa": "true",
            "$": "Ultrathin nanosheets"
          },
          {
            "@_fa": "true",
            "$": "Formamide"
          },
          {
            "@_fa": "true",
            "$": "Pt dispersion"
          }
        ],
        "openaccessArticle": "false",
        "prism:publicationName": "Molecular Catalysis",
        "openaccessSponsorType": null,
        "prism:pageRange": "113287",
        "pubType": "fla",
        "prism:coverDisplayDate": "August 2023",
        "prism:doi": "10.1016/j.mcat.2023.113287",
        "prism:startingPage": "113287",
        "dc:identifier": "doi:10.1016/j.mcat.2023.113287",
        "openaccessSponsorName": null
      },
      "objects": {
        "object": [
          {
            "@category": "standard",
            "@height": "284",
            "@width": "339",
            "@_fa": "true",
            "$": "https://api.elsevier.com/content/object/eid/1-s2.0-S2468823123003711-gr2.jpg?httpAccept=%2A%2F%2A",
            "@multimediatype": "JPEG image file",
            "@type": "IMAGE-DOWNSAMPLED",
            "@size": "22065",
            "@ref": "gr2",
            "@mimetype": "image/jpeg"
          },
          {
            "@category": "standard",
            "@height": "200",
            "@width": "257",
            "@_fa": "true",
            "$": "https://api.elsevier.com/content/object/eid/1-s2.0-S2468823123003711-ga1.jpg?httpAccept=%2A%2F%2A",
            "@multimediatype": "JPEG image file",
            "@type": "IMAGE-DOWNSAMPLED",
            "@size": "30822",
            "@ref": "ga1",
            "@mimetype": "image/jpeg"
          },
          {
            "@category": "standard",
            "@height": "223",
            "@width": "621",
            "@_fa": "true",
            "$": "https://api.elsevier.com/content/object/eid/1-s2.0-S2468823123003711-gr1.jpg?httpAccept=%2A%2F%2A",
            "@multimediatype": "JPEG image file",
            "@type": "IMAGE-DOWNSAMPLED",
            "@size": "53409",
            "@ref": "gr1",
            "@mimetype": "image/jpeg"
          },
          {
            "@category": "standard",
            "@height": "255",
            "@width": "621",
            "@_fa": "true",
            "$": "https://api.elsevier.com/content/object/eid/1-s2.0-S2468823123003711-gr4.jpg?httpAccept=%2A%2F%2A",
            "@multimediatype": "JPEG image file",
            "@type": "IMAGE-DOWNSAMPLED",
            "@size": "47112",
            "@ref": "gr4",
            "@mimetype": "image/jpeg"
          },
          {
            "@category": "standard",
            "@height": "289",
            "@width": "339",
            "@_fa": "true",
            "$": "https://api.elsevier.com/content/object/eid/1-s2.0-S2468823123003711-gr3.jpg?httpAccept=%2A%2F%2A",
            "@multimediatype": "JPEG image file",
            "@type": "IMAGE-DOWNSAMPLED",
            "@size": "31284",
            "@ref": "gr3",
            "@mimetype": "image/jpeg"
          },
          {
            "@category": "standard",
            "@height": "290",
            "@width": "602",
            "@_fa": "true",
            "$": "https://api.elsevier.com/content/object/eid/1-s2.0-S2468823123003711-gr6.jpg?httpAccept=%2A%2F%2A",
            "@multimediatype": "JPEG image file",
            "@type": "IMAGE-DOWNSAMPLED",
            "@size": "48222",
            "@ref": "gr6",
            "@mimetype": "image/jpeg"
          },
          {
            "@category": "standard",
            "@height": "503",
            "@width": "602",
            "@_fa": "true",
            "$": "https://api.elsevier.com/content/object/eid/1-s2.0-S2468823123003711-gr5.jpg?httpAccept=%2A%2F%2A",
            "@multimediatype": "JPEG image file",
            "@type": "IMAGE-DOWNSAMPLED",
            "@size": "103164",
            "@ref": "gr5",
            "@mimetype": "image/jpeg"
          },
          {
            "@category": "standard",
            "@height": "251",
            "@width": "602",
            "@_fa": "true",
            "$": "https://api.elsevier.com/content/object/eid/1-s2.0-S2468823123003711-gr8.jpg?httpAccept=%2A%2F%2A",
            "@multimediatype": "JPEG image file",
            "@type": "IMAGE-DOWNSAMPLED",
            "@size": "35152",
            "@ref": "gr8",
            "@mimetype": "image/jpeg"
          },
          {
            "@category": "standard",
            "@height": "507",
            "@width": "414",
            "@_fa": "true",
            "$": "https://api.elsevier.com/content/object/eid/1-s2.0-S2468823123003711-gr7.jpg?httpAccept=%2A%2F%2A",
            "@multimediatype": "JPEG image file",
            "@type": "IMAGE-DOWNSAMPLED",
            "@size": "49155",
            "@ref": "gr7",
            "@mimetype": "image/jpeg"
          },
          {
            "@category": "standard",
            "@height": "255",
            "@width": "339",
            "@_fa": "true",
            "$": "https://api.elsevier.com/content/object/eid/1-s2.0-S2468823123003711-gr9.jpg?httpAccept=%2A%2F%2A",
            "@multimediatype": "JPEG image file",
            "@type": "IMAGE-DOWNSAMPLED",
            "@size": "26585",
            "@ref": "gr9",
            "@mimetype": "image/jpeg"
          },
          {
            "@category": "standard",
            "@height": "250",
            "@width": "339",
            "@_fa": "true",
            "$": "https://api.elsevier.com/content/object/eid/1-s2.0-S2468823123003711-gr11.jpg?httpAccept=%2A%2F%2A",
            "@multimediatype": "JPEG image file",
            "@type": "IMAGE-DOWNSAMPLED",
            "@size": "31934",
            "@ref": "gr11",
            "@mimetype": "image/jpeg"
          },
          {
            "@category": "standard",
            "@height": "251",
            "@width": "339",
            "@_fa": "true",
            "$": "https://api.elsevier.com/content/object/eid/1-s2.0-S2468823123003711-gr10.jpg?httpAccept=%2A%2F%2A",
            "@multimediatype": "JPEG image file",
            "@type": "IMAGE-DOWNSAMPLED",
            "@size": "31282",
            "@ref": "gr10",
            "@mimetype": "image/jpeg"
          },
          {
            "@category": "thumbnail",
            "@height": "164",
            "@width": "196",
            "@_fa": "true",
            "$": "https://api.elsevier.com/content/object/eid/1-s2.0-S2468823123003711-gr2.sml?httpAccept=%2A%2F%2A",
            "@multimediatype": "GIF image file",
            "@type": "IMAGE-THUMBNAIL",
            "@size": "12519",
            "@ref": "gr2",
            "@mimetype": "image/gif"
          },
          {
            "@category": "thumbnail",
            "@height": "164",
            "@width": "211",
            "@_fa": "true",
            "$": "https://api.elsevier.com/content/object/eid/1-s2.0-S2468823123003711-ga1.sml?httpAccept=%2A%2F%2A",
            "@multimediatype": "GIF image file",
            "@type": "IMAGE-THUMBNAIL",
            "@size": "21483",
            "@ref": "ga1",
            "@mimetype": "image/gif"
          },
          {
            "@category": "thumbnail",
            "@height": "79",
            "@width": "219",
            "@_fa": "true",
            "$": "https://api.elsevier.com/content/object/eid/1-s2.0-S2468823123003711-gr1.sml?httpAccept=%2A%2F%2A",
            "@multimediatype": "GIF image file",
            "@type": "IMAGE-THUMBNAIL",
            "@size": "12781",
            "@ref": "gr1",
            "@mimetype": "image/gif"
          },
          {
            "@category": "thumbnail",
            "@height": "90",
            "@width": "219",
            "@_fa": "true",
            "$": "https://api.elsevier.com/content/object/eid/1-s2.0-S2468823123003711-gr4.sml?httpAccept=%2A%2F%2A",
            "@multimediatype": "GIF image file",
            "@type": "IMAGE-THUMBNAIL",
            "@size": "12178",
            "@ref": "gr4",
            "@mimetype": "image/gif"
          },
          {
            "@category": "thumbnail",
            "@height": "163",
            "@width": "192",
            "@_fa": "true",
            "$": "https://api.elsevier.com/content/object/eid/1-s2.0-S2468823123003711-gr3.sml?httpAccept=%2A%2F%2A",
            "@multimediatype": "GIF image file",
            "@type": "IMAGE-THUMBNAIL",
            "@size": "15844",
            "@ref": "gr3",
            "@mimetype": "image/gif"
          },
          {
            "@category": "thumbnail",
            "@height": "105",
            "@width": "219",
            "@_fa": "true",
            "$": "https://api.elsevier.com/content/object/eid/1-s2.0-S2468823123003711-gr6.sml?httpAccept=%2A%2F%2A",
            "@multimediatype": "GIF image file",
            "@type": "IMAGE-THUMBNAIL",
            "@size": "15841",
            "@ref": "gr6",
            "@mimetype": "image/gif"
          },
          {
            "@category": "thumbnail",
            "@height": "164",
            "@width": "196",
            "@_fa": "true",
            "$": "https://api.elsevier.com/content/object/eid/1-s2.0-S2468823123003711-gr5.sml?httpAccept=%2A%2F%2A",
            "@multimediatype": "GIF image file",
            "@type": "IMAGE-THUMBNAIL",
            "@size": "24177",
            "@ref": "gr5",
            "@mimetype": "image/gif"
          },
          {
            "@category": "thumbnail",
            "@height": "91",
            "@width": "219",
            "@_fa": "true",
            "$": "https://api.elsevier.com/content/object/eid/1-s2.0-S2468823123003711-gr8.sml?httpAccept=%2A%2F%2A",
            "@multimediatype": "GIF image file",
            "@type": "IMAGE-THUMBNAIL",
            "@size": "9397",
            "@ref": "gr8",
            "@mimetype": "image/gif"
          },
          {
            "@category": "thumbnail",
            "@height": "164",
            "@width": "134",
            "@_fa": "true",
            "$": "https://api.elsevier.com/content/object/eid/1-s2.0-S2468823123003711-gr7.sml?httpAccept=%2A%2F%2A",
            "@multimediatype": "GIF image file",
            "@type": "IMAGE-THUMBNAIL",
            "@size": "16595",
            "@ref": "gr7",
            "@mimetype": "image/gif"
          },
          {
            "@category": "thumbnail",
            "@height": "164",
            "@width": "218",
            "@_fa": "true",
            "$": "https://api.elsevier.com/content/object/eid/1-s2.0-S2468823123003711-gr9.sml?httpAccept=%2A%2F%2A",
            "@multimediatype": "GIF image file",
            "@type": "IMAGE-THUMBNAIL",
            "@size": "16959",
            "@ref": "gr9",
            "@mimetype": "image/gif"
          },
          {
            "@category": "thumbnail",
            "@height": "161",
            "@width": "219",
            "@_fa": "true",
            "$": "https://api.elsevier.com/content/object/eid/1-s2.0-S2468823123003711-gr11.sml?httpAccept=%2A%2F%2A",
            "@multimediatype": "GIF image file",
            "@type": "IMAGE-THUMBNAIL",
            "@size": "20133",
            "@ref": "gr11",
            "@mimetype": "image/gif"
          },
          {
            "@category": "thumbnail",
            "@height": "162",
            "@width": "219",
            "@_fa": "true",
            "$": "https://api.elsevier.com/content/object/eid/1-s2.0-S2468823123003711-gr10.sml?httpAccept=%2A%2F%2A",
            "@multimediatype": "GIF image file",
            "@type": "IMAGE-THUMBNAIL",
            "@size": "19047",
            "@ref": "gr10",
            "@mimetype": "image/gif"
          },
          {
            "@category": "high",
            "@height": "1257",
            "@width": "1500",
            "@_fa": "true",
            "$": "https://api.elsevier.com/content/object/eid/1-s2.0-S2468823123003711-gr2_lrg.jpg?httpAccept=%2A%2F%2A",
            "@multimediatype": "JPEG image file",
            "@type": "IMAGE-HIGH-RES",
            "@size": "151671",
            "@ref": "gr2",
            "@mimetype": "image/jpeg"
          },
          {
            "@category": "high",
            "@height": "886",
            "@width": "1141",
            "@_fa": "true",
            "$": "https://api.elsevier.com/content/object/eid/1-s2.0-S2468823123003711-ga1_lrg.jpg?httpAccept=%2A%2F%2A",
            "@multimediatype": "JPEG image file",
            "@type": "IMAGE-HIGH-RES",
            "@size": "243581",
            "@ref": "ga1",
            "@mimetype": "image/jpeg"
          },
          {
            "@category": "high",
            "@height": "989",
            "@width": "2750",
            "@_fa": "true",
            "$": "https://api.elsevier.com/content/object/eid/1-s2.0-S2468823123003711-gr1_lrg.jpg?httpAccept=%2A%2F%2A",
            "@multimediatype": "JPEG image file",
            "@type": "IMAGE-HIGH-RES",
            "@size": "385559",
            "@ref": "gr1",
            "@mimetype": "image/jpeg"
          },
          {
            "@category": "high",
            "@height": "1131",
            "@width": "2750",
            "@_fa": "true",
            "$": "https://api.elsevier.com/content/object/eid/1-s2.0-S2468823123003711-gr4_lrg.jpg?httpAccept=%2A%2F%2A",
            "@multimediatype": "JPEG image file",
            "@type": "IMAGE-HIGH-RES",
            "@size": "340117",
            "@ref": "gr4",
            "@mimetype": "image/jpeg"
          },
          {
            "@category": "high",
            "@height": "1277",
            "@width": "1500",
            "@_fa": "true",
            "$": "https://api.elsevier.com/content/object/eid/1-s2.0-S2468823123003711-gr3_lrg.jpg?httpAccept=%2A%2F%2A",
            "@multimediatype": "JPEG image file",
            "@type": "IMAGE-HIGH-RES",
            "@size": "214973",
            "@ref": "gr3",
            "@mimetype": "image/jpeg"
          },
          {
            "@category": "high",
            "@height": "1283",
            "@width": "2667",
            "@_fa": "true",
            "$": "https://api.elsevier.com/content/object/eid/1-s2.0-S2468823123003711-gr6_lrg.jpg?httpAccept=%2A%2F%2A",
            "@multimediatype": "JPEG image file",
            "@type": "IMAGE-HIGH-RES",
            "@size": "397858",
            "@ref": "gr6",
            "@mimetype": "image/jpeg"
          },
          {
            "@category": "high",
            "@height": "2229",
            "@width": "2667",
            "@_fa": "true",
            "$": "https://api.elsevier.com/content/object/eid/1-s2.0-S2468823123003711-gr5_lrg.jpg?httpAccept=%2A%2F%2A",
            "@multimediatype": "JPEG image file",
            "@type": "IMAGE-HIGH-RES",
            "@size": "820856",
            "@ref": "gr5",
            "@mimetype": "image/jpeg"
          },
          {
            "@category": "high",
            "@height": "1114",
            "@width": "2667",
            "@_fa": "true",
            "$": "https://api.elsevier.com/content/object/eid/1-s2.0-S2468823123003711-gr8_lrg.jpg?httpAccept=%2A%2F%2A",
            "@multimediatype": "JPEG image file",
            "@type": "IMAGE-HIGH-RES",
            "@size": "257948",
            "@ref": "gr8",
            "@mimetype": "image/jpeg"
          },
          {
            "@category": "high",
            "@height": "2243",
            "@width": "1833",
            "@_fa": "true",
            "$": "https://api.elsevier.com/content/object/eid/1-s2.0-S2468823123003711-gr7_lrg.jpg?httpAccept=%2A%2F%2A",
            "@multimediatype": "JPEG image file",
            "@type": "IMAGE-HIGH-RES",
            "@size": "396959",
            "@ref": "gr7",
            "@mimetype": "image/jpeg"
          },
          {
            "@category": "high",
            "@height": "1129",
            "@width": "1500",
            "@_fa": "true",
            "$": "https://api.elsevier.com/content/object/eid/1-s2.0-S2468823123003711-gr9_lrg.jpg?httpAccept=%2A%2F%2A",
            "@multimediatype": "JPEG image file",
            "@type": "IMAGE-HIGH-RES",
            "@size": "187643",
            "@ref": "gr9",
            "@mimetype": "image/jpeg"
          },
          {
            "@category": "high",
            "@height": "1104",
            "@width": "1500",
            "@_fa": "true",
            "$": "https://api.elsevier.com/content/object/eid/1-s2.0-S2468823123003711-gr11_lrg.jpg?httpAccept=%2A%2F%2A",
            "@multimediatype": "JPEG image file",
            "@type": "IMAGE-HIGH-RES",
            "@size": "227126",
            "@ref": "gr11",
            "@mimetype": "image/jpeg"
          },
          {
            "@category": "high",
            "@height": "1109",
            "@width": "1500",
            "@_fa": "true",
            "$": "https://api.elsevier.com/content/object/eid/1-s2.0-S2468823123003711-gr10_lrg.jpg?httpAccept=%2A%2F%2A",
            "@multimediatype": "JPEG image file",
            "@type": "IMAGE-HIGH-RES",
            "@size": "221858",
            "@ref": "gr10",
            "@mimetype": "image/jpeg"
          },
          {
            "@category": "thumbnail",
            "@_fa": "true",
            "$": "https://api.elsevier.com/content/object/eid/1-s2.0-S2468823123003711-si1.svg?httpAccept=%2A%2F%2A",
            "@multimediatype": "Scalable Vector Graphics file",
            "@type": "ALTIMG",
            "@size": "10003",
            "@ref": "si1",
            "@mimetype": "image/svg+xml"
          },
          {
            "@category": "thumbnail",
            "@_fa": "true",
            "$": "https://api.elsevier.com/content/object/eid/1-s2.0-S2468823123003711-si2.svg?httpAccept=%2A%2F%2A",
            "@multimediatype": "Scalable Vector Graphics file",
            "@type": "ALTIMG",
            "@size": "11783",
            "@ref": "si2",
            "@mimetype": "image/svg+xml"
          },
          {
            "@category": "thumbnail",
            "@_fa": "true",
            "$": "https://api.elsevier.com/content/object/eid/1-s2.0-S2468823123003711-si3.svg?httpAccept=%2A%2F%2A",
            "@multimediatype": "Scalable Vector Graphics file",
            "@type": "ALTIMG",
            "@size": "5180",
            "@ref": "si3",
            "@mimetype": "image/svg+xml"
          },
          {
            "@category": "thumbnail",
            "@_fa": "true",
            "$": "https://api.elsevier.com/content/object/eid/1-s2.0-S2468823123003711-si4.svg?httpAccept=%2A%2F%2A",
            "@multimediatype": "Scalable Vector Graphics file",
            "@type": "ALTIMG",
            "@size": "15483",
            "@ref": "si4",
            "@mimetype": "image/svg+xml"
          },
          {
            "@category": "standard",
            "@_fa": "true",
            "$": "https://api.elsevier.com/content/object/eid/1-s2.0-S2468823123003711-am.pdf?httpAccept=%2A%2F%2A",
            "@multimediatype": "Acrobat PDF file",
            "@type": "AAM-PDF",
            "@size": "1584334",
            "@ref": "am",
            "@mimetype": "application/pdf"
          }
        ]
      },
      "link": {
        "@rel": "abstract",
        "@href": "https://api.elsevier.com/content/abstract/scopus_id/85161320548"
      }
    }
  }
}