{
  "metadata": {
    "title": "Carbon black intercalation compound as catalyst for unprecedent phase-transfer-catalyzed nucleophilic substitution (S<ce:inf loc=post>N</ce:inf>2) in water",
    "authors": "; ; ",
    "journal": "Molecular Catalysis",
    "date": "2023-02-15",
    "doi": "10.1016/j.mcat.2023.112951",
    "abstract": "",
    "uri": "https://api.elsevier.com/content/article/pii/S246882312300038X",
    "pii": "S246882312300038X"
  },
  "fulltext": {
    "full-text-retrieval-response": {
      "scopus-eid": "2-s2.0-85146710852",
      "originalText": "serial JL 315758 291210 291744 291790 291809 31 90 Molecular Catalysis MOLECULARCATALYSIS 2023-01-19 2023-01-19 2023-01-19 2023-01-19 2023-11-20T12:02:07 1-s2.0-S246882312300038X S2468-8231(23)00038-X S246882312300038X 10.1016/j.mcat.2023.112951 S300 S300.2 FULL-TEXT 1-s2.0-S2468823123X00030 2023-11-20T12:45:58.284335Z 0 0 20230215 2023 2023-01-19T17:13:50.351692Z absattachment articleinfo articlenumber articletitlenorm authfirstinitialnorm authfirstsurnamenorm cid cids contenttype copyright crossmark dateloaded dateloadedtxt datesearch datesort dateupdated dco docsubtype doctype doi eid ewtransactionid fundingbodyid hubeid indexeddate issn issnnorm itemstage itemtransactionid itemweight oauserlicense openaccess openarchive pg pgfirst pii piinorm pubdatestart pubdatetxt pubyr sectiontitle sortorder sponsoredaccesstype srctitle srctitlenorm srctype ssids alllist content oa subj subheadings suppl tomb volfirst volissue volumelist webpdf webpdfpagecount yearnav figure table e-component body acknowledge affil appendices articletitle auth authfirstini authfull authkeywords authlast grantsponsor highlightsabst orcid primabst ref specialabst 2468-8231 24688231 UNLIMITED CRUI2023 true 537 537 C Volume 537 13 112951 112951 112951 20230215 15 February 2023 2023-02-15 2023 Regular Papers article fla © 2023 The Authors. Published by Elsevier B.V. CARBONBLACKINTERCALATIONCOMPOUNDCATALYSTFORUNPRECEDENTPHASETRANSFERCATALYZEDNUCLEOPHILICSUBSTITUTIONSN2INWATER MELILLO A 1 Introduction 2 Experimental 2.1 Preparation and characterization of adducts of oxidized Carbon black with 2HT (di-(hydrogenated tallow)-dimethylammonium bromide) 2.2 General procedure for the nucleophilic substitution using oCB/2HT as PTC in water 3 Results and discussion 3.1 Preparation and characterization of oCB/2HT 3.2 Catalytic ability of oCB/2HT as PTC in a biphasic system 3.3 Catalytic ability of oCB/2HT in water 4 Conclusion CRediT authorship contribution statement Acknowledgments Appendix Supplementary materials References ABDELKADER 2014 1632 1639 A KIM 2011 860 865 N GOTOH 2013 1482 1486 Y FLANDROIS 1982 255 266 S BHAURIYAL 2017 7980 7989 P JACHE 2014 10169 10173 B ITAKAHARA 2021 0854011 0854017 T BHAURIYAL 2017 7980 7989 P YOSHIDA 2011 6751 6755 A SKOWRONSKI 2013 282 288 J PEI 2020 6713 6726 P KALUCKI 1990 357 363 K SHI 2016 1851 1859 M KIKUCHI 1979 27 34 E CHANG 2022 222 230 F MAURO 2013 395 403 M MAGGIO 2016 105565 105572 M SETTON 1988 467 473 R ALBANESE 2016 129 139 D TAN 2015 1731 1746 J SLIU 2016 331 341 Y PETROVA 2014 5154 5167 G MAKOSZA 1997 135 M INHANDBOOKPHASETRANSFERCATALYSIS NOROOZISHAD 2022 132628 N MAKOSZA 2020 1436 1451 M FEHER 2021 6542 Z DESIMONE 2017 5649 5659 N TILLOY 2002 188 193 S SCHETTINI 2018 4777 4795 R SALA 2013 726 731 G HADIANDEHKORDI 2020 31360 31371 L MANJUPRIYA 2021 17369 17410 R REZAEI 2021 4411 A HUMMERS 1958 1339 S CASCONE 2022 25394 25402 E PRAT 2014 4546 4551 D PRAT 2016 288 296 D EISSEN 2002 414 436 M HORVATH 2002 686 694 I ARANI 2009 725 748 C LI 2011 229 233 J STOTT 1980 4810 4815 P MELILLOX2023X112951 MELILLOX2023X112951XA Full 2023-09-12T13:06:22Z ElsevierBranded CRUI: Hybrid journals 2023 http://creativecommons.org/licenses/by-nc-nd/4.0/ 2024-01-19T00:00:00.000Z 2024-01-19T00:00:00.000Z http://creativecommons.org/licenses/by-nc-nd/4.0/ This is an open access article under the CC BY-NC-ND license. © 2023 The Authors. Published by Elsevier B.V. 2023-01-27T06:04:53.872Z http://vtw.elsevier.com/data/voc/AddOnTypes/50.7/aggregated-refined Ministero dell' Istruzione, dell' Università e della Ricerca MIUR Ministero dell’Istruzione, dell’Università e della Ricerca http://data.elsevier.com/vocabulary/SciValFunders/501100003407 http://sws.geonames.org/3175395/ Financial support of \" Ministero dell' Istruzione, dell' Università e della Ricerca \" is gratefully acknowledged. item S2468-8231(23)00038-X S246882312300038X 1-s2.0-S246882312300038X 10.1016/j.mcat.2023.112951 315758 2023-11-20T12:45:58.284335Z 2023-02-15 UNLIMITED CRUI2023 1-s2.0-S246882312300038X-main.pdf https://s3-eu-west-1.amazonaws.com/prod-ucs-content-store-eu-west/content/pii:S246882312300038X/MAIN/application/pdf/00693674d9530ba0a227cd7056f2ca30/main.pdf main.pdf pdf true 2189191 MAIN 7 1-s2.0-S246882312300038X-main_1.png https://s3-eu-west-1.amazonaws.com/prod-ucs-content-store-eu-west/content/pii:S246882312300038X/PREVIEW/image/png/f621bec4e1ed69dad331f0d497b0ce57/main_1.png main_1.png png 60287 849 656 IMAGE-WEB-PDF 1 1-s2.0-S246882312300038X-gr1.jpg https://s3-eu-west-1.amazonaws.com/prod-ucs-content-store-eu-west/content/pii:S246882312300038X/gr1/DOWNSAMPLED/image/jpeg/91365073730d2c882422dc28aa93cedb/gr1.jpg gr1 gr1.jpg jpg 36942 329 386 IMAGE-DOWNSAMPLED 1-s2.0-S246882312300038X-sc2.jpg https://s3-eu-west-1.amazonaws.com/prod-ucs-content-store-eu-west/content/pii:S246882312300038X/sc2/DOWNSAMPLED/image/jpeg/9cbc9d1b9a5024e393624df078b87aa6/sc2.jpg sc2 sc2.jpg jpg 57406 501 809 IMAGE-DOWNSAMPLED 1-s2.0-S246882312300038X-fx4.jpg https://s3-eu-west-1.amazonaws.com/prod-ucs-content-store-eu-west/content/pii:S246882312300038X/fx4/DOWNSAMPLED/image/jpeg/e6761edbe5a3b113c17713087f4eb191/fx4.jpg fx4 fx4.jpg jpg 6936 54 393 IMAGE-DOWNSAMPLED 1-s2.0-S246882312300038X-sc1.jpg https://s3-eu-west-1.amazonaws.com/prod-ucs-content-store-eu-west/content/pii:S246882312300038X/sc1/DOWNSAMPLED/image/jpeg/d8e012b4c1a4d60f7cb5a257ed6f6225/sc1.jpg sc1 sc1.jpg jpg 6717 49 386 IMAGE-DOWNSAMPLED 1-s2.0-S246882312300038X-fx3.jpg https://s3-eu-west-1.amazonaws.com/prod-ucs-content-store-eu-west/content/pii:S246882312300038X/fx3/DOWNSAMPLED/image/jpeg/270e882f4bb2224d95bbeec90d64e5d7/fx3.jpg fx3 fx3.jpg jpg 7150 52 410 IMAGE-DOWNSAMPLED 1-s2.0-S246882312300038X-fx2.jpg https://s3-eu-west-1.amazonaws.com/prod-ucs-content-store-eu-west/content/pii:S246882312300038X/fx2/DOWNSAMPLED/image/jpeg/4c39810b87618b05aff8e65576880359/fx2.jpg fx2 fx2.jpg jpg 7037 64 439 IMAGE-DOWNSAMPLED 1-s2.0-S246882312300038X-fx1.jpg https://s3-eu-west-1.amazonaws.com/prod-ucs-content-store-eu-west/content/pii:S246882312300038X/fx1/DOWNSAMPLED/image/jpeg/bccba9cf79d6ee5c46124cbecc7dedb2/fx1.jpg fx1 fx1.jpg jpg 4511 46 267 IMAGE-DOWNSAMPLED 1-s2.0-S246882312300038X-gr4.jpg https://s3-eu-west-1.amazonaws.com/prod-ucs-content-store-eu-west/content/pii:S246882312300038X/gr4/DOWNSAMPLED/image/jpeg/6e3c179a68fb5c2ae75b58239ddc28b2/gr4.jpg gr4 gr4.jpg jpg 16082 312 386 IMAGE-DOWNSAMPLED 1-s2.0-S246882312300038X-gr3.jpg https://s3-eu-west-1.amazonaws.com/prod-ucs-content-store-eu-west/content/pii:S246882312300038X/gr3/DOWNSAMPLED/image/jpeg/a2c18da52cf2ddeb807c99efb05fa348/gr3.jpg gr3 gr3.jpg jpg 26653 314 386 IMAGE-DOWNSAMPLED 1-s2.0-S246882312300038X-gr2.jpg https://s3-eu-west-1.amazonaws.com/prod-ucs-content-store-eu-west/content/pii:S246882312300038X/gr2/DOWNSAMPLED/image/jpeg/259b495d969c71c5f8a7f56acc8df142/gr2.jpg gr2 gr2.jpg jpg 57511 343 809 IMAGE-DOWNSAMPLED 1-s2.0-S246882312300038X-ga1.jpg https://s3-eu-west-1.amazonaws.com/prod-ucs-content-store-eu-west/content/pii:S246882312300038X/ga1/DOWNSAMPLED/image/jpeg/2f6d260d1e970cd19ca87dc4a07ccb8a/ga1.jpg ga1 true ga1.jpg jpg 25000 200 223 IMAGE-DOWNSAMPLED 1-s2.0-S246882312300038X-gr1.sml https://s3-eu-west-1.amazonaws.com/prod-ucs-content-store-eu-west/content/pii:S246882312300038X/gr1/THUMBNAIL/image/gif/365da71008a6af7c37b85f9fa836d5d8/gr1.sml gr1 gr1.sml sml 9908 164 192 IMAGE-THUMBNAIL 1-s2.0-S246882312300038X-sc2.sml https://s3-eu-west-1.amazonaws.com/prod-ucs-content-store-eu-west/content/pii:S246882312300038X/sc2/THUMBNAIL/image/gif/42644fcd32a0d7de5fb95701516def9d/sc2.sml sc2 sc2.sml sml 9571 136 219 IMAGE-THUMBNAIL 1-s2.0-S246882312300038X-fx4.sml https://s3-eu-west-1.amazonaws.com/prod-ucs-content-store-eu-west/content/pii:S246882312300038X/fx4/THUMBNAIL/image/gif/8debfd6d34e75b9f828324d9200fef26/fx4.sml fx4 fx4.sml sml 2544 30 219 IMAGE-THUMBNAIL 1-s2.0-S246882312300038X-sc1.sml https://s3-eu-west-1.amazonaws.com/prod-ucs-content-store-eu-west/content/pii:S246882312300038X/sc1/THUMBNAIL/image/gif/52bd5fb0b6e1d937ca7e848331f31f04/sc1.sml sc1 sc1.sml sml 2350 28 219 IMAGE-THUMBNAIL 1-s2.0-S246882312300038X-fx3.sml https://s3-eu-west-1.amazonaws.com/prod-ucs-content-store-eu-west/content/pii:S246882312300038X/fx3/THUMBNAIL/image/gif/90470551b86ad6a76596f32bb543ba21/fx3.sml fx3 fx3.sml sml 2457 28 219 IMAGE-THUMBNAIL 1-s2.0-S246882312300038X-fx2.sml https://s3-eu-west-1.amazonaws.com/prod-ucs-content-store-eu-west/content/pii:S246882312300038X/fx2/THUMBNAIL/image/gif/0646670de8ecaf2b4b329202cdb3d3c1/fx2.sml fx2 fx2.sml sml 2365 32 219 IMAGE-THUMBNAIL 1-s2.0-S246882312300038X-fx1.sml https://s3-eu-west-1.amazonaws.com/prod-ucs-content-store-eu-west/content/pii:S246882312300038X/fx1/THUMBNAIL/image/gif/984c2868d251dd17185b0da3c569aee2/fx1.sml fx1 fx1.sml sml 2811 38 219 IMAGE-THUMBNAIL 1-s2.0-S246882312300038X-gr4.sml https://s3-eu-west-1.amazonaws.com/prod-ucs-content-store-eu-west/content/pii:S246882312300038X/gr4/THUMBNAIL/image/gif/a385437efcf3f5610415395f4ca1dc88/gr4.sml gr4 gr4.sml sml 5742 164 203 IMAGE-THUMBNAIL 1-s2.0-S246882312300038X-gr3.sml https://s3-eu-west-1.amazonaws.com/prod-ucs-content-store-eu-west/content/pii:S246882312300038X/gr3/THUMBNAIL/image/gif/7bb33f70c597794afb0d6d752d63a80f/gr3.sml gr3 gr3.sml sml 7484 164 202 IMAGE-THUMBNAIL 1-s2.0-S246882312300038X-gr2.sml https://s3-eu-west-1.amazonaws.com/prod-ucs-content-store-eu-west/content/pii:S246882312300038X/gr2/THUMBNAIL/image/gif/b98ac2ebbe691e441ce309c0213c1648/gr2.sml gr2 gr2.sml sml 8096 93 219 IMAGE-THUMBNAIL 1-s2.0-S246882312300038X-ga1.sml https://s3-eu-west-1.amazonaws.com/prod-ucs-content-store-eu-west/content/pii:S246882312300038X/ga1/THUMBNAIL/image/gif/ccbba02c27f77cf9f3e6bef876fe4b57/ga1.sml ga1 true ga1.sml sml 15250 164 183 IMAGE-THUMBNAIL 1-s2.0-S246882312300038X-gr1_lrg.jpg https://s3-eu-west-1.amazonaws.com/prod-ucs-content-store-eu-west/content/pii:S246882312300038X/HIGHRES/image/jpeg/b2661f7d1c68445100ca5c6645448d52/gr1_lrg.jpg gr1 gr1_lrg.jpg jpg 297437 1455 1708 IMAGE-HIGH-RES 1-s2.0-S246882312300038X-sc2_lrg.jpg https://s3-eu-west-1.amazonaws.com/prod-ucs-content-store-eu-west/content/pii:S246882312300038X/HIGHRES/image/jpeg/400603fb052b217650bc3b8d5c914164/sc2_lrg.jpg sc2 sc2_lrg.jpg jpg 505246 2221 3583 IMAGE-HIGH-RES 1-s2.0-S246882312300038X-fx4_lrg.jpg https://s3-eu-west-1.amazonaws.com/prod-ucs-content-store-eu-west/content/pii:S246882312300038X/HIGHRES/image/jpeg/aba939343f37c506c85462fd9b7ce71b/fx4_lrg.jpg fx4 fx4_lrg.jpg jpg 51389 241 1741 IMAGE-HIGH-RES 1-s2.0-S246882312300038X-sc1_lrg.jpg https://s3-eu-west-1.amazonaws.com/prod-ucs-content-store-eu-west/content/pii:S246882312300038X/HIGHRES/image/jpeg/ab569edc412c8e98197622c70c027a6a/sc1_lrg.jpg sc1 sc1_lrg.jpg jpg 45856 216 1708 IMAGE-HIGH-RES 1-s2.0-S246882312300038X-fx3_lrg.jpg https://s3-eu-west-1.amazonaws.com/prod-ucs-content-store-eu-west/content/pii:S246882312300038X/HIGHRES/image/jpeg/44cf50ab962822e64f231a8205af179f/fx3_lrg.jpg fx3 fx3_lrg.jpg jpg 51321 230 1817 IMAGE-HIGH-RES 1-s2.0-S246882312300038X-fx2_lrg.jpg https://s3-eu-west-1.amazonaws.com/prod-ucs-content-store-eu-west/content/pii:S246882312300038X/HIGHRES/image/jpeg/a389cda3467565ee742773a849595692/fx2_lrg.jpg fx2 fx2_lrg.jpg jpg 53416 285 1946 IMAGE-HIGH-RES 1-s2.0-S246882312300038X-fx1_lrg.jpg https://s3-eu-west-1.amazonaws.com/prod-ucs-content-store-eu-west/content/pii:S246882312300038X/HIGHRES/image/jpeg/7ce99157a14405b3648b0cecccdc09e4/fx1_lrg.jpg fx1 fx1_lrg.jpg jpg 32239 205 1182 IMAGE-HIGH-RES 1-s2.0-S246882312300038X-gr4_lrg.jpg https://s3-eu-west-1.amazonaws.com/prod-ucs-content-store-eu-west/content/pii:S246882312300038X/HIGHRES/image/jpeg/355b514a0a2b8b22aa7643ee7d7a9170/gr4_lrg.jpg gr4 gr4_lrg.jpg jpg 99954 1381 1708 IMAGE-HIGH-RES 1-s2.0-S246882312300038X-gr3_lrg.jpg https://s3-eu-west-1.amazonaws.com/prod-ucs-content-store-eu-west/content/pii:S246882312300038X/HIGHRES/image/jpeg/9b09b2924f05ecfd81008c3773282a81/gr3_lrg.jpg gr3 gr3_lrg.jpg jpg 180589 1388 1708 IMAGE-HIGH-RES 1-s2.0-S246882312300038X-gr2_lrg.jpg https://s3-eu-west-1.amazonaws.com/prod-ucs-content-store-eu-west/content/pii:S246882312300038X/HIGHRES/image/jpeg/c19aefa5a8f845558eb98eceedd6c732/gr2_lrg.jpg gr2 gr2_lrg.jpg jpg 411950 1519 3583 IMAGE-HIGH-RES 1-s2.0-S246882312300038X-ga1_lrg.jpg https://s3-eu-west-1.amazonaws.com/prod-ucs-content-store-eu-west/content/pii:S246882312300038X/HIGHRES/image/jpeg/294acdc5fcd206390195e2c0b5828ce1/ga1_lrg.jpg ga1 true ga1_lrg.jpg jpg 212647 886 988 IMAGE-HIGH-RES 1-s2.0-S246882312300038X-mmc1.doc https://s3-eu-west-1.amazonaws.com/prod-ucs-content-store-eu-west/content/pii:S246882312300038X/mmc1/MAIN/application/msword/828c141b4f7ca57d6474964401ee7a7c/mmc1.doc mmc1 mmc1.doc doc 4849664 APPLICATION 1-s2.0-S246882312300038X-am.pdf https://s3-eu-west-1.amazonaws.com/prod-ucs-content-store-eu-west/content/egi:10MTR7MV510/MAIN/application/pdf/5257ebd75d31fe266f27dddb18e86f81/am.pdf am am.pdf pdf false 88768401 AAM-PDF MCAT 112951 112951 S2468-8231(23)00038-X 10.1016/j.mcat.2023.112951 The Authors Fig. 1 (A) X-ray diffraction patterns of: (a) 2HT; (b) the prepared oCB sample; (c) oCB/2HT adduct, as obtained from oCB sample. Insets (B) shows enlarged patterns for 2θ ranges 1.4–3.5. Fig 1 Fig. 2 (A) FT-IR spectra and TGA scans (B) of 2HT (blue), oCB (black), and oCB/2HT (red). Fig 2 Scheme 1 SN2 reaction with MSCN catalyzed by oCB/2HT. Scheme 1 Fig. 3 Yield versus reaction time of the nucleophilic substitution in water solution of 4-nitrobenzyl bromide and NaSCN in the presence of 5 mol% of 2HT (blue triangles) and oCB/2HT (red square), respectively. Fig 3 Fig. 4 Yields from recycling experiment. Fig 4 Scheme 2 The possible mechanism proposed for the SN2 type reaction catalyzed by oCB/2HT in water solution. Scheme 2 Table 1 Nucleophilic substitution with MSCN using different catalysts and different catalyst loading (a) . Table 1 Image, table 1 Entry Catalyst MSCN Catalyst loading (% mol) Time (h) Conversion (%) 1 oCB NaSCN 5 24 8 2 2HT NaSCN 5 24 89 3 oCB/2HT NaSCN 5 4 98 4 oCB/2HT NaSCN 1 24 72 5 oCB/2HT NaSCN 0.1 48 33 6 oCB/2HT KSCN 5 5.5 >98 7 Bu4NBr NaSCN 5 4.5 >99 (a) All reactions were performed using a 0.25 M solution of 4-nitrobenzylbromide in CHCl3 (0.4 mL, 0.10 mmol), a 0.75 M aqueous solution of MSCN 0.2 mL, 0.15 mmol) and catalyst (0.005 mmol). Table 2 Screening of different solvents for SN2 catalyzed by oCB/2HT (a) . Table 2 Image, table 2 Entry Solvent Conversion (%) 1 Chloroform 98 2 DCM 60 3 Toluene 72 4 Ethyl acetate 78 (a) All the reactions were perfomed using a 0.25 M solution of 4-nitrobenzyl bromide in the appropriate solvent (0.4 ml, 0.10 mmol), a 0.75 M aqueous solution of NaSCN (0.2 ml, 0.15 mmol) and catalyst (0.005 mmol). Table 3 Phase-transfer-catalyzed nucleophilic substitution in water (a) . Table 3 Image, table 3 Entry MSCN Catalyst Time (h) Conversion (%) 1 KSCN oCB/2HT 9 88 2 NaSCN oCB/2HT 8 95 3 NaSCN 2HT 8 63 4 NaSCN 2HT 24 89 (a) All reactions were performed using a 0.25 M solution of 4-nitrobenzylbromide in H2O (0.4 mL, 0.10 mmol), a 0.75 M aqueous solution of MSCN 0.2 mL, 0.15 mmol) and catalyst (0.005 mmol). Table 4 Phase-transfer-catalyzed nucleophilic substitution in water with different substrates(a). Table 4 Image, table 4 Entry R-Br Conversion (%) 1 4-nitro benzyl bromide 95 2 benzyl bromide 98 3 4-chloro benzyl bromide 98 4 4-methyl benzyl bromide 98 5 1-bromopropane - (a)All reactions were performed using a 0.25 M solution of substrate in H2O (0.4 mL, 0.10 mmol), a 0.75 M aqueous solution of NaSCN 0.2 mL, 0.15 mmol) and catalyst (0.005 mmol). Carbon black intercalation compound as catalyst for unprecedent phase-transfer-catalyzed nucleophilic substitution (SN2) in water Arianna Melillo Conceptualization Methodology Investigation a Aida Kiani Investigation b Rosaria Schettini Conceptualization Methodology Validation Supervision Writing – original draft Writing – review & editing b ⁎ Maria Rosaria Acocella Conceptualization Methodology Validation Supervision Writing – original draft Writing – review & editing b ⁎ a Ecole Normale Superiere de Paris, PSL 45 rue d'Ulm 75230 Paris cedex 05, France Ecole Normale Superiere de Paris PSL 45 rue d'Ulm 75230 Paris cedex 05 France aEcole Normale Superiere de Paris, PSL 45 rue d'Ulm 75230 Paris cedex 05, France b Department of Chemistry and Biology “A. Zambelli”, University of Salerno Via Giovanni Paolo II, 84084, Fisciano (Sa), Italy Department of Chemistry and Biology “A. Zambelli” University of Salerno Via Giovanni Paolo II Fisciano (Sa) 84084 Italy bDepartment of Chemistry and Biology “A. Zambelli”, University of Salerno Via Giovanni Paolo II, 84084, Fisciano (Sa), Italy ⁎ Corresponding authors. Carbon black intercalation compound was used for the first time as a heterogeneous phase-transfer-catalyst for SN2 type reaction of NaSCN with 4-nitrobenzyl bromide. The reaction proceeds in the presence of 5 mol% of catalyst with high efficiency in a liquid-liquid biphasic system (CHCl3/H2O), providing 98% conversion after only 4 h. Furthermore, an unprecedent efficient nucleophilic substitution was reported in water solution in the presence of the new catalyst, providing 95% yield in 8 h. The reaction is green, and the heterogeneous catalyst can be recovered and recycled without losing efficiency. Graphical abstract Image, graphical abstract Keywords Phase transfer catalyst Nucleophilic substitution Carbon black Green procedure Intercalation compounds Data availability Data will be made available on request. 1 Introduction Graphite intercalation compounds have been extensively studied for their interesting and useful properties and applications. They have been used as highly conductive materials [1–3], electrodes in batteries [4–8], for storage of hydrogen [9–11], and as catalysts for organic synthesis [12–15]. Although the crystalline structure of graphite is usually saved by introducing small ions that provide high 3D long-range order, with a small distance between the graphene sheets, the formation of highly ordered graphite oxide intercalation compounds in the presence of bulky cation has also been reported [16]. Specifically, high 3D order has been obtained by intercalating ammonium ions containing two long alkyl tails. Just recently, also the ability of oxidized Carbon black (oCB) to form ordered intercalation compounds in the presence of di-(hydrogenated tallow)-dimethylammonium chloride (2HT) was reported for the first time [17]. The unexpected formation of ordered intercalate crystalline structure from highly disordered oxidized Carbon black (oCB) was justified by the replacement of metal ions with ammonium ions on graphitic layers, whose ionically bonded hydrocarbon chains arrange in the hexagonal rotator phase. The resulting decorated small graphene layers self-assemble in an ordered intercalate crystalline structure with long tails perpendicular to the graphitic layers. This is possible because, although CB and oCB are amorphous powders, they are composed of a disordered spatial arrangement of graphene and graphene oxide layers. While the use of graphite intercalation compounds as catalysts for some organic reactions was already reported, to the best of our knowledge, there are no examples of reactions catalyzed by carbon black intercalation compounds. Considering the predominant use of ammonium salts in phase-transfer catalysis, we decided to evaluate the ability of the novel carbon black intercalated compound with the quaternary ammonium salt (2HT) as a phase-transfer catalyst. It has to be noted that if the use of quaternary ammonium salts is interesting due to their well-known catalytic properties as phase-transfer catalysts, their efficiency and selectivity could be enhanced by their intercalation into carbon black [18]. The great interest in phase-transfer catalysis (PTC) is due to its wide application in academia and industrial research. Since the pioneering studies on phase-transfer reactions, this research field has been recognized as an attractive area for green sustainable chemistry: benefits are particularly evident in oxidation chemistry [19,20] and asymmetric transformations [21,22]. Mainly, the advantages of phase-transfer catalysis are linked to mild reaction conditions, simplicity of experimental procedures, and the use of inexpensive and environmentally friendly reagents and solvents [23]. Generally, reactions occur in heterogeneous conditions at the interface of two immiscible phases. The role of a phase-transfer catalyst is to facilitate the migration of a reactant from one phase (the aqueous layer) to the other where the reaction occurs (the organic layer) [19,20]. Even if the most used phase-transfer catalysts are organic cations, such as ammonium or phosphonium salts, due to their relatively good stability, catalytic efficiency, and lipophilicity [24–26] also macrocyclic complexing agents like crown ethers [27], calixarenes [28], cyclodextrins [29], and more recently cyclic peptoids have been widely exploited [30,31]. Just lately, amphiphilic carbon-dots were used for a variety of organic transformations like carbon–carbon bond formation, oxidation, reduction, multiplestep synthesis in polar-nonpolar reaction media without additives and PTC, [32–34] but to the best of our knowledge, no examples of SN2 type reaction have been reported. We present here the synthesis, characterization, and catalytic performance of this novel PTC catalyst based on carbon intercalation compounds in a nucleophilic substitution reaction performed both in a biphasic (liquid-liquid) system and, most interestingly, in water. The new catalyst assures high conversion (up to 98%) and, being heterogenous, the possibility to be recovered and recycled with negligible efficiency reduction. 2 Experimental 2.1 Preparation and characterization of adducts of oxidized Carbon black with 2HT (di-(hydrogenated tallow)-dimethylammonium bromide) oCB/2HT adduct has been prepared starting from the oCB sample with a 0.58 O/C ratio. 200 mg of oCB powders were dispersed in 0.05 M NaOH solution (40 mL), and 100 mL of 2HT aqueous solution (2 mg mL−1) was added in this dispersion, and the reaction mixture was stirred at 60°C for 1 h. The black slurry was centrifuged at 10 000 rpm for 15 min, and the precipitate was washed with deionized water and dried at 60°C for 12 h in an oven. 2.2 General procedure for the nucleophilic substitution using oCB/2HT as PTC in water To a solution of 4-nitrobenzyl bromide (21.5 mg, 0.10 mmol) in H2O (0.25 M, 0.200 mL), containing 5 mol% of the catalyst, a 0.75 M aqueous solution of thiocyanate salt (0.15 mmol) was added, and the resulting mixture was stirred until total conversion unless otherwise mentioned. The reaction was monitored by TLC. The mixture was extracted with EtOAc, the solvent was removed in a vacuum, and the resulting residue was analyzed by 1H-NMR to measure the conversion percentage. NMR spectra were recorded on a Bruker DRX 400 (1H at 400.13 MHz). Chemical shifts (δ) are reported in ppm relative to the residual solvent peak (CHCl3, δ = 7.26), and the following abbreviations designate the multiplicity of each signal: s, singlet; d, doublet. Reactions were monitored by analytical thin layer chromatography (TLC) on precoated silica gel plates (0.25 mm) and visualized by UV light. 3 Results and discussion 3.1 Preparation and characterization of oCB/2HT Commercial Carbon Black sample, exhibiting a BET surface area of 130 m2/g, has been oxidized by the Hummers procedure, [35] providing 0.58 as O/C weight ratio as evaluated by elemental analysis. The synthesis and characterization of oCB are fully reported in the supporting information. oCB/2HT has been prepared starting from oCB and 2HT in alkaline aqueous dispersion according to the procedure reported in Section 2.1. X-ray diffraction patterns of 2HT (a), oCB (b), and oCB/2HT adduct (c) are shown in Fig. 1 . The 001, 003, and 005 reflections of the oCB/2HT intercalate structure, and the disappearance of 2HT diffraction peaks indicate the adduct formation. Furthermore, a broad diffraction peak centered at d=0.42 nm appears due to the formation of hexagonal hydrocarbon rotator order already observed with surfactants with long alkyl chains with graphene oxide [16,17]. The FTIR spectrum of oCB/2HT has been compared with the starting oCB and 2HT salt in the range of 4000-400 cm−1 (Fig. 2 A). The spectrum shows that many vibrational peaks of 2HT are clearly present in oCB/2HT. Specifically, the bands related to the 2HT alkyl chains in the range 2953-2842 and the peaks at 719 and 614 cm−1 are both observable in the intercalation compound. Furthermore, the peak at 1473 cm−1 is red-shifted to 1462 cm−1 , possibly due to the reduced confinement of 2HT in the oCB compounds. It is worth noting that alkaline treatment followed by adding salt changes the oCB spectrum significantly. In particular, the defined peaks in the range 1300-900 cm−1 corresponding to ethers, alcohols, carboxylic groups, and sulfonic groups vibrations [36] disappear, and a shift of carboxyl group frequency from 1715 cm−1 in oCB to 1640 cm−1 in oCB/2HT, resulting in carboxylate group formation is detected. TGA scans of oCB, 2HT and oCB/2HT are shown in Fig. 2B. It is apparent that the degradation of 2HT, which for the salt occurs around 200°C, for oCB/2HT arises at a higher temperature, centered around 300°C, showing higher thermal stability. Considering the residue at 800°C, the 2HT uptake is calculated to be 12 wt%. The oCB/2HT, as obtained, was investigated as a possible heterogeneous phase-transfer catalyst for the SN2 reaction of MSCN with 4-nitrobenzyl bromide, chosen as the model reaction (Scheme 1 ). 3.2 Catalytic ability of oCB/2HT as PTC in a biphasic system First, the catalytic ability of oCB/2HT in the nucleophilic substitution was evaluated in a liquid-liquid biphasic system (CHCl3/H2O) using NaSCN as a nucleophile. All reactions were carried out with 5 mol% of catalyst loading, were monitored chromatographically, and were analyzed by 1H-NMR determining the conversion percentage. To ensure the presence of 5 mol% of the intercalated ammonium ion, the functionalization degree of oCB/2HT was considered. In the same conditions, oCB and 2HT were evaluated separately, Table 1 (entries 1 and 2). In the presence of oxidized Carbon black (oCB), the reaction did not proceed significantly, giving just 8% of conversion after 24 h (Table 1, entry 1), while the quaternary ammonium salt 2HT afforded the product 89% of conversion after 24 h (Table 1, entry 2). Surprisingly, the intercalated compound oCB/2HT catalyzed the substitution reaction more efficiently than the quaternary ammonium salt 2HT (Table 1, entry 3 vs. entry 2), giving the substitution adduct in 98% of conversion after only 4 h. It has to be noted that the activity of oCB/2HT is comparable to that observed in the presence of the tetraalkylammonium salt (Table 1, entry 3 vs. entry 7), commonly used as a phase-transfer catalyst [24]. Encouraged by this result, we decided to screen the reaction parameters starting with the catalyst's loading. A high conversion was also reached by reducing the amount of catalyst to 1 mol%, although with a longer reaction time (Table 1, entry 4). Further reducing the catalyst loading up to 0.1 mol%, a substantial decrease in the efficiency was observed (Table 1, entry 5). To verify the scope of the procedure, an additional experiment was performed in the presence of KSCN, and interestingly, the reaction proceeded again with high conversion >98% in 5.5h (Table 1, entry 6). With the optimized reaction conditions in hand, we investigated the effect of solvents (Table 2 ). All reactions were stopped after 4 h to compare the percentage of conversion by 1H-NMR. Although the reaction in the presence of ethyl acetate provides an acceptable conversion, it is clear from all entries that the change of polarity of the solvent deeply affects the efficiency of the reaction, with chloroform being the best choice. 3.3 Catalytic ability of oCB/2HT in water Considering the evolving attitudes about environmental issues, the research field of green chemistry has been receiving a lot of attention. In particular, organic synthesis laboratories and pharmaceutical industries gave much more attention to green chemical processes. Several solvent selection guides were published in the literature to reduce the use of hazardous solvents [37,38]. Inspired by the result obtained with a recommended solvent as AcOEt (Table 2, entry 3) and considering that water is the greenest solvent, we decided to test our reaction without any organic solvent. Water is an inexpensive, renewable source for safe industrial processes and environmental concerns [39,40]. Although nucleophilic substitution is a widely used transformation for the formation of C-C or C-X (X=heteratom) bonds, water is rarely used as the reaction medium due to the poor solubility of organic substrates [41,42]. Here we show, for the first time, the ability of oCB/2HT to catalyze the reaction even in water solution, providing high conversion in a reasonable time in the presence of NaSCN as well as KSCN As reported in Table 3 , the reaction in the presence of NaSCN provides the product in 95% conversion in 8h, while in the presence of KSCN, the same reaction proceeds with 88% in 9h (Table 3, entries 1 and 2). It is worth noting that the same reaction performed with 2HT requires 24 h to reach up to 89% yield, showing again the better efficiency of oCB/2HT. The influence of the intercalation compound on reaction rate is shown in Fig. 3 , as yield of product versus reaction time. This phase-transfer reaction obeyed pseudo-first-order kinetic as confirmed by our experimental data [30,43]. It is evident that the reaction rate increases already after 2h of reaction, with the maximum rise after 8 h, providing 95% and 63% yield in the presence of oCB/2HT and 2HT, respectively [44]. The increased rate observed for oCB/2HT could be explained by considering the enhancement of the efficiency of 2HT for its intercalation into oxidized Carbon black [18]. To assess the scope of the procedure, a variety of alkylating agents was reacted with NaSCN under the optimized conditions in water and the results are summarized in Table 4 . As expected, benzyl bromides with electron-withdrawing or electron-donor substituents gave the same results in terms of conversion as their parents without substitution (Entry 1,3, and 4 vs entry 2 Table 4). With bromoalkene as the substrate (entry 5, Table 4), the reaction did not proceed at all even after a longer reaction time (24 h). Finally, the possibility of recycling our catalyst was investigated using the addition of NaSCN to 4-nitrobenzyl bromide as model reaction: all reactions were stopped after 8h, and an extraction recovered the product with ethyl acetate and the catalyst from the aqueous layer. An initial decrease of 7% was observed after the first run, while the yield was quite stable after the second one, (Fig. 4 ) showing interesting stability of the catalyst that, being heterogeneous, can be recovered and recycled [45]. Taking into account the ability of oCB/2HT to catalyze the reaction even in water solution, and to be recovered and recycled without substantial loss of efficiency, a possible catalytic mechanism has been hypothesized (Scheme 2 ). As described in Sections 2.1 and 3.1, the catalyst is formed by a cation exchange reaction after basification of the starting oCB, to provide ordered intercalated compounds with alkyl chains perpendicular to the graphitic planes. By adding NaSCN solution to the catalyst and reagent mixture, a further cation exchange could possibly occur to afford the 2HT/SCN ionic pair and restore the sodium intercalation compound of oCB. Then thiocyanate could attack the benzyl position to furnish the SN2 type substitution product, and 2HT/Br can be formed and react with the sodium intercalation compound, to provide the catalyst once again. (oCB/2HT). To the best of our knowledge, this is the first example of a nucleophilic substitution efficiently catalyzed by an intercalated carbon black compound. The reaction can be performed in a biphasic system and water solution, representing an important goal in PTC. This novel application paves the way to asymmetric phase-transfer reactions using this new typology of catalyst for sustainable processes. 4 Conclusion This contribution represents an unprecedent example of SN2 type reaction catalyzed by a new intercalated carbon compound. The reaction of NaSCN with 4-nitrobenzyl bromide was performed in a liquid-liquid biphasic system in the presence of 5 mol% of oCB/2HT, providing 98% conversion after only 4 h. Furthermore, for the first time, an efficient nucleophilic substitution in water solution was shown here, providing the desired product in the presence of oCB/2HT in 95% conversion after 8 h. Being heterogeneous, the catalyst can be easily recovered and recycled with negligible efficiency reduction. The high efficiency of this catalyst could find applications not only in academic laboratories but also for green industrial applications. Considering the potential of this heterogeneous catalyst, further studies on other organic reactions are in progress in our laboratories and will be reported in due course. CRediT authorship contribution statement Arianna Melillo: Conceptualization, Methodology, Investigation. Aida Kiani: Investigation. Rosaria Schettini: Conceptualization, Methodology, Validation, Supervision, Writing – original draft, Writing – review & editing. Maria Rosaria Acocella: Conceptualization, Methodology, Validation, Supervision, Writing – original draft, Writing – review & editing. Declaration of Competing Interest The authors declare that they have no known competing financial interests or personal relationships that could have appeared to influence the work reported in this paper. Acknowledgments Financial support of \"Ministero dell' Istruzione, dell' Università e della Ricerca\" is gratefully acknowledged. Supplementary materials Supplementary material associated with this article can be found, in the online version, at doi:10.1016/j.mcat.2023.112951. Appendix Supplementary materials Image, application 1 References [1] A.M. Abdelkader I.A. Kinloch R.A.W. Dryfe Continuous electrochemical exfoliation of micrometer-sized graphene using synergistic ion intercalations and organic solvents ACS Appl. Mater. Interface 6 3 2014 1632 1639 10.1021/am404497n A.M. Abdelkader, I. A. Kinloch, R. A. W. Dryfe, Continuous electrochemical exfoliation of micrometer-sized graphene using synergistic ion intercalations and organic solvents, ACS Appl. Mater. Interface. 6(3) (2014) 1632-1639. https://doi.org/10.1021/am404497n [2] N. Kim K.S. Kim N. Jung L. Brus P. Kim Synthesis and electrical characterization of magnetic bilayer graphene intercalate Nano Lett. 11 2 2011 860 865 10.1021/nl104228f N. Kim, K.S. Kim, N. Jung, L. Brus, P. Kim, Synthesis and electrical characterization of magnetic bilayer graphene intercalate, Nano Lett. 11(2) (2011) 860-865. https://doi.org/10.1021/nl104228f [3] Y. Gotoh K. Tamada N. Akuzawa M. Fujishige K. Takeuchi M. Endo R. Matsumoto Y. Soneda T. Takeichi Preparation of air-stable and highly conductive potassium-intercalated graphite sheet J. Phys. Chem. Solid 74 10 2013 1482 1486 10.1016/j.jpcs.2013.05.010 Y. Gotoh, K. Tamada, N. Akuzawa, M. Fujishige, K. Takeuchi, M. Endo, R. Matsumoto, Y. Soneda, T. Takeichi, Preparation of air-stable and highly conductive potassium-intercalated graphite sheet, J. Phys. Chem. Solid 74(10) (2013) 1482-1486. https://doi.org/10.1016/j.jpcs.2013.05.010 [4] S. Flandrois Graphite intercalation compounds as electrode materials in batteries Synth. Met. 4 3 1982 255 266 10.1016/0379-6779(82)90017-0 S. Flandrois, Graphite intercalation compounds as electrode materials in batteries Synth. Met. 4(3) (1982) 255-266. https://doi.org/10.1016/0379-6779(82)90017-0 [5] P. Bhauriyal A. Mahata B. Pathak The staging mechanism of AlCl4 intercalation in a graphite electrode for an aluminum-ion battery Phys. Chem. Chem. Phys. 19 11 2017 7980 7989 10.1039/C7CP00453B P. Bhauriyal, A. Mahata, B. Pathak, The staging mechanism of AlCl4 intercalation in a graphite electrode for an aluminum-ion battery, Phys. Chem. Chem. Phys. 19(11) (2017) 7980-7989. https://doi.org/10.1039/C7CP00453B [6] B. Jache P. Adelhelm Use of graphite as a highly reversible electrode with superior cycle life for sodium-ion batteries by making use of co-intercalation phenomena Angew. Chem., Int. Ed. Engl. 53 38 2014 10169 10173 10.1002/ange.201403734 B. Jache, P. Adelhelm, Use of graphite as a highly reversible electrode with superior cycle life for sodium-ion batteries by making use of co-intercalation phenomena Angew. Chem., Int. Ed. Engl. 53(38) (2014) 10169-10173. https://doi.org/10.1002/ange.201403734 [7] T.Mizoguchi I.Takahara First principles study on formation and migration energies of sodium and lithium in graphite Phys. Rev. Mater. 5 8 2021 0854011 0854017 I.Takahara, T. Mizoguchi, First principles study on formation and migration energies of sodium and lithium in graphite, Phys. Rev. Mater. 5 (8) (2021), 0854011-0854017. [8] P. Bhauriyal A. Mahata B. Pathak The staging mechanism of AlCl4 intercalation in a graphite electrode for an aluminium-ion battery Phys. Chem. Chem. Phys. 19 2017 7980 7989 10.1039/c7cp00453b P. Bhauriyal, A. Mahata, B. Pathak, The staging mechanism of AlCl4 intercalation in a graphite electrode for an aluminium-ion battery, Phys. Chem. Chem. Phys., 19, (2017), 7980-7989 10.1039/c7cp00453b [9] A. Yoshida H. Yoshimura T. Terada Y. Nakayama H. Kuno T. Miyao S. Naito Preparation of graphite supported Li–N–H hydrogen storage material from Li-graphite intercalation compound and their unique hydrogen release property Int. J. Hydrog. 36 11 2011 6751 6755 10.1016/j.ijhydene.2011.02.140 A. Yoshida, H. Yoshimura, T. Terada,Y. Nakayama, H. Kuno, T. Miyao, S. Naito, Preparation of graphite supported Li–N–H hydrogen storage material from Li-graphite intercalation compound and their unique hydrogen release property, Int. J. Hydrog. 36(11) (2011) 6751-6755. https://doi.org/10.1016/j.ijhydene.2011.02.140 [10] J.M. Skowronski T. Rozmanowski P. Krawczyk Enhancement of electrochemical hydrogen storage in NiCl2–FeCl3–PdCl2–graphite intercalation compound affected by chemical exfoliation Appl. Surf. Sci. 275 2013 282 288 10.1016/j.apsusc.2012.12.120 J. M. Skowronski, T. Rozmanowski, P. Krawczyk, Enhancement of electrochemical hydrogen storage in NiCl2–FeCl3–PdCl2–graphite intercalation compound affected by chemical exfoliation, Appl. Surf. Sci. 275 (2013) 282-288. https://doi.org/10.1016/j.apsusc.2012.12.120 [11] P. Pei M.B. Whitwick S. Kureshi M. Cannon G. Quan E. Kjieang Hydrogen storage mechanism in transition metal decorated graphene oxide: The symbiotic effect of oxygen groups and high layer spacing Int. J. Hydrog. Energy 45 2020 6713 6726 10.1016/j.ijhydene.2019.12.095 P. Pei, M. B. Whitwick, S. Kureshi, M. Cannon, G. Quan, E. Kjieang, Hydrogen storage mechanism in transition metal decorated graphene oxide: The symbiotic effect of oxygen groups and high layer spacing Int. J. Hydrog. Energy 45 (2020) 6713-6726. https://doi.org/10.1016/j.ijhydene.2019.12.095 [12] K. Kalucki A.W. Morawski Iron intercalated in graphite as catalysts for ammonia synthesis J. Chem. Technol. Biotechnol. 47 4 1990 357 363 10.1002/jctb.280470406 K. Kalucki, A. W. Morawski, Iron intercalated in graphite as catalysts for ammonia synthesis, J. Chem. Technol. Biotechnol. 47(4) (1990) 357-63. https://doi.org/10.1002/jctb.280470406 [13] M. Shi W. Zhang Y. Li Y. Chu C. Ma Tungsten carbide-reduced graphene oxide intercalation compound as co-catalyst for methanol oxidation Chin. J. Catal. 37 2016 1851 1859 10.1016/S1872-2067(16)62535-4 M. Shi, W. Zhang, Y. Li, Y. Chu, C. Ma, Tungsten carbide-reduced graphene oxide intercalation compound as co-catalyst for methanol oxidation, Chin. J. Catal. 37 (2016) 1851-1859. https://doi.org/10.1016/S1872-2067(16)62535-4 [14] E. Kikuchi T. Ino Y. Morita Catalytic synthesis of hydrocarbons from carbon monoxide and hydrogen on lamellar compound of graphite intercalated by ferric chloride J. Catal. 57 1 1979 27 34 10.1016/0021-9517(79)90040-X E. Kikuchi, T. Ino, Y. Morita, Catalytic synthesis of hydrocarbons from carbon monoxide and hydrogen on lamellar compound of graphite intercalated by ferric chloride, J. Catal. 57(1) (1979) 27-34. https://doi.org/10.1016/0021-9517(79)90040-X [15] F. Chang I. Tezsevin J.W. de Rijk J.D. Meeldijk J.P. Hofmann S. Er P. Ngene P.E. de Jongh Potassium hydride-intercalated graphite as an efficient heterogeneous catalyst for ammonia synthesis Nat. Catal. 5 2022 222 230 10.1038/s41929-022-00754-x F. Chang, I. Tezsevin, J. W. de Rijk, J. D. Meeldijk, J. P. Hofmann, S. Er, P. Ngene, P. E. de Jongh, Potassium hydride-intercalated graphite as an efficient heterogeneous catalyst for ammonia synthesis, Nat. Cataly. 5 (2022) 222–230 https://doi.org/10.1038/s41929-022-00754-x. [16] M. Mauro M. Maggio V. Cipolletti M. Galimberti P. Longo G. Guerra Graphite oxide intercalation compounds with rotator hexagonal order in the intercalated layers Carbon 61 2013 395 403 10.1016/j.carbon.2013.05.023 M. Mauro, M. Maggio, V. Cipolletti, M. Galimberti, P. Longo, G. Guerra, Graphite oxide intercalation compounds with rotator hexagonal order in the intercalated layers, Carbon. 61 (2013) 395-403. https://doi.org/10.1016/j.carbon.2013.05.023 [17] M. Maggio M.R. Acocella G. Guerra Intercalation compounds of oxidized Carbon black RSC Adv. 6 2016 105565 105572 10.1039/C6RA23053A M. Maggio, M.R. Acocella, G. Guerra, Intercalation compounds of oxidized Carbon black, RSC Adv.. 6 (2016) 105565-105572. https://doi.org/10.1039/C6RA23053A [18] R. Setton The graphite intercalation compounds: their uses in industry and chemistry Synth. Met. 23 1988 467 473 10.1016/0379-6779(88)90523-1 R. Setton, The graphite intercalation compounds: their uses in industry and chemistry, Synth. Met., 23 (1988) 467-473. https://doi.org/10.1016/0379-6779(88)90523-1 [19] Halpern, M. Phase-transfer catalysis. In: Ullmann's Encyclopedia of Industrial Chemistry, (Ed.) 2000. [20] D.C.M. Albanese F. Foschi M. Penso Sustainable oxidations under phase-transfer catalysis conditions Org. Process Res. Dev. 20 2016 129 139 10.1021/acs.oprd.5b00385 D. C. M. Albanese, F. Foschi, M. Penso, Sustainable oxidations under phase-transfer catalysis conditions, Org. Process Res. Dev.20 (2016) 129-139. https://doi.org/10.1021/acs.oprd.5b00385 [21] J. Tan N. Yasuda Contemporary asymmetric phase transfer catalysis: large-scale industrial applications Org. Process Res. Dev. 19 2015 1731 1746 10.1021/acs.oprd.5b00304 J. Tan, N. Yasuda, Contemporary asymmetric phase transfer catalysis: large-scale industrial applications, Org. Process Res. Dev. 19 (2015) 1731-1746. https://doi.org/10.1021/acs.oprd.5b00304 [22] Y.Kumatabara S.Liu S. Shirakawa Chiral quaternary phosphonium salts as phase-transfer catalysts for environmentally benign asymmetric transformations Green Chem. 18 2016 331 341 10.1039/C5GC02692J S.Liu, Y. Kumatabara, S. Shirakawa, Chiral quaternary phosphonium salts as phase-transfer catalysts for environmentally benign asymmetric transformations, Green Chem. 18 (2016) 331-341. https://doi.org/10.1039/C5GC02692J [23] G.P. Petrova H.-B. Li K. Maruoka K. Morokuma Asymmetric phase-transfer catalysis with homo-and heterochiral quaternary ammonium salts: a theoretical study J. Phys. Chem. B 118 2014 5154 5167 10.1021/jp501520g G. P. Petrova, H.-B. Li, K. Maruoka, K. Morokuma, Asymmetric phase-transfer catalysis with homo-and heterochiral quaternary ammonium salts: a theoretical study, J. Phys. Chem. B, 118 (2014) 5154-5167. https://doi.org/10.1021/jp501520g [24] M. Mąkosza Y. Sasson R. Neumann In Handbook of Phase-Transfer Catalysis 1997 Chapman Hall London 135 M. Mąkosza, In Handbook of Phase-Transfer Catalysis; Sasson, Y.; Neumann, R., (Eds.); Chapman Hall: London 1997 135. [25] N. Noroozi-Shad M. Gholizadeh H. Sabet-Sarvestani Quaternary phosphonium salts in the synthetic chemistry: recent progress, development, and future perspectives J. Molecul. Struct. 1257 2022 132628 10.1016/j.molstruc.2022.132628 N. Noroozi-Shad, M. Gholizadeh, H. Sabet-Sarvestani, Quaternary phosphonium salts in the synthetic chemistry: recent progress, development, and future perspectives, J. Molecul. Struct. 1257 (2022) 132628. DOI:10.1016/j.molstruc.2022.132628 [26] M. Makosza M. Fedorynski Interfacial processes—the key steps of phase transfer catalyzed reactions Catalysts 10 2020 1436 1451 10.3390/catal10121436 M. Makosza, M. Fedorynski, Interfacial processes—the key steps of phase transfer catalyzed reactions, Catalysts 10 (2020) 1436-1451. https://doi.org/10.3390/catal10121436 [27] Z. Fehèr D. Richter S. Nagy P. Bagi Z. Rapi A. Simon L. Drahos pù. Huszhty P. Bakό J. Kupai Synthesis of novel crown ether-squaramides and their application as phase-transfer catalysts Molecules 26 21 2021 6542 https://www.mdpi.com/1420-3049/26/21/6542 Z. Fehèr, D. Richter, S. Nagy, P. Bagi, Z. Rapi, A. Simon, L. Drahos, pù. Huszhty, P. Bakό, J. Kupai, Synthesis of novel crown ether-squaramides and their application as phase-transfer catalysts, Molecules 26 (21), (2021), 6542 https://www.mdpi.com/1420-3049/26/21/6542 [28] N.A. De Simone R. Schettini C. Talotta C. Gaeta I. Izzo G. Della Sala Neri directing the cation recognition ability of Calix[4]arenes toward asymmetric phase-transfer catalysis Eur. J. Org. Chem. 2017 5649 5659 10.1002/ejoc.201700912 N. A. De Simone, R. Schettini, C. Talotta, C. Gaeta, I. Izzo, G. Della Sala, P. Neri directing the cation recognition ability of Calix[4]arenes toward asymmetric phase-transfer catalysis Eur. J. Org. Chem. (2017) 5649–5659. https://doi.org/10.1002/ejoc.201700912. [29] S. Tilloy H. Bricouta E. Monflier Cyclodextrins as inverse phase transfer catalysts for the biphasic catalytic hydrogenation of aldehydes: a green and easy alternative to conventional mass transfer promoters Green Chem. 4 2002 188 193 10.1039/B108405B S. Tilloy, H. Bricouta, E. Monflier, Cyclodextrins as inverse phase transfer catalysts for the biphasic catalytic hydrogenation of aldehydes: a green and easy alternative to conventional mass transfer promoters Green Chem., 4, (2002) 188-193. https://doi.org/10.1039/B108405B [30] R. Schettini M. Sicignano F. De Riccardis I. Izzo G.Della Sala Macrocyclic hosts in asymmetric phase-transfer catalyzed reactions Synthesis 50 2018 4777 4795 10.1055/s-0037-1610311 R. Schettini, M. Sicignano, F. De Riccardis, I. Izzo, G. Della Sala, Macrocyclic hosts in asymmetric phase-transfer catalyzed reactions, Synthesis, 50 (2018) 4777-4795. 10.1055/s-0037-1610311 [31] G.Della Sala B. Nardone F. De Riccardis I. Izzo Cyclopeptoids: A novel class of phase-transfer catalysts Org. Biomol. Chem. 11 2013 726 731 10.1039/C2OB26764K G. Della Sala, B. Nardone, F. De Riccardis, I. Izzo, Cyclopeptoids: A novel class of phase-transfer catalysts, Org. Biomol. Chem. 11 (2013)726-731. https://doi.org/10.1039/C2OB26764K [32] L. Hadian-Dehkordi A. Rezaei A. Ramazani M. Jaymand H. Samadian L. Zheng X. Deng H. Zheng Amphiphilic carbon quantum dots as a bridge to a pseudohomogeneous catalyst for selective oxidative cracking of alkenes to aldehydes: a nonmetallic oxidation system ACS Appl. Mater. Interface 12 28 2020 31360 31371 10.1021/acsami.0c05025 L. Hadian-Dehkordi, A. Rezaei, A. Ramazani, M. Jaymand, H. Samadian, L. Zheng, X. Deng, H. Zheng, Amphiphilic carbon quantum dots as a bridge to a pseudohomogeneous catalyst for selective oxidative cracking of alkenes to aldehydes: a nonmetallic oxidation system ACS Appl. Mater. Interface. 12, (2020), 28, 31360–31371 https://doi.org/10.1021/acsami.0c05025 [33] R. Manjupriya1 S.M. Roopan Carbon dots-based catalyst for various organic transformations J. Mater. Sci. 56 2021 17369 17410 10.1007/s10853-021-06354-7 R. Manjupriya1 and S.M. Roopan, Carbon dots-based catalyst for various organic transformations J Mater Sci 56 (2021) 17369–17410 https://doi.org/10.1007/s10853-021-06354-7 [34] A. Rezaei L. Hadian-Dehkordi H. Samadian M. Jaymand H. Targhan A. Ramazani H. Adibi X. Deng L. Zheng H. Zheng Pseudohomogeneous metallic catalyst based on tungstate-decorated amphiphilic carbon quantum dots for selective oxidative scission of alkenes to aldehyde Sci. Rep. 11 2021 4411 10.1038/s41598-021-83863-0 A. Rezaei, L. Hadian-Dehkordi, H. Samadian, M. Jaymand, H. Targhan, A. Ramazani, H. Adibi, X. Deng, L. Zheng, H. Zheng, Pseudohomogeneous metallic catalyst based on tungstate-decorated amphiphilic carbon quantum dots for selective oxidative scission of alkenes to aldehyde. Sci. Rep. 11, 4411 (2021). https://doi.org/10.1038/s41598-021-83863-0 [35] S.W. Hummers E. Offeman Preparation of graphitic oxide J. Am. Chem. Soc. 80 1958 1339 S. W. Hummers, E. Offeman, Preparation of graphitic oxide, J. Am. Chem. Soc. 80 (1958) 1339. [36] E. Cascone S. Longo M.R. Acocella Basified graphene oxide and PPO composite aerogel with basified graphene oxide for henry reaction in solvent-free conditions: a green approa ACS Omega 7 2022 25394 25402 10.1021/acsomega.2c02335 E. Cascone, S. Longo, M.R. Acocella, Basified graphene oxide and PPO composite aerogel with basified graphene oxide for henry reaction in solvent-free conditions: a green approa ACS Omega, 7 (2022) 25394-25402. https://doi.org/10.1021/acsomega.2c02335 [37] D. Prat J. Haylerb A. Wellsc A survey of solvent selection guides Green Chem. 16 2014 4546 4551 10.1039/C4GC01149J D. Prat, J. Haylerb, A. Wellsc, A survey of solvent selection guides, Green Chem., 16 (2014) 4546-4551. https://doi.org/10.1039/C4GC01149J [38] D. Prat A. Wells J. Hayler H. Sneddon C.R. McElroy S. Abou-Shehadad Peter J. Dunne CHEM21 selection guide of classical-and less classical-solvents Green Chem. 18 2016 288 296 10.1039/C5GC01008J D. Prat, A. Wells, J. Hayler, H. Sneddon, C. R. McElroy, S. Abou-Shehadad, Peter J. Dunne, CHEM21 selection guide of classical-and less classical-solvents, Green Chem., 18 (2016) 288-296. https://doi.org/10.1039/C5GC01008J [39] M. Eissen J.O. Metzger E. Schmidt U. Schneidewind 10 years after Rio—concepts on the contribution of chemistry to a sustainable development Angew. Chem. Int. Ed. 41 2002 414 436 10.1002/1521-3773(20020201)41:3<414::AID-ANIE414>3.0.CO;2-N M. Eissen, J. O. Metzger, E. Schmidt, U. Schneidewind, 10 years after Rio—concepts on the contribution of chemistry to a sustainable development, Angew. Chem. Int. Ed. 41 (2002) 414-436. https://doi.org/10.1002/1521-3773(20020201)41:3%3C414::AID-ANIE414%3E3.0.CO;2-N. [40] I.T. Horváth Origins, current status, and future challenges of green chemistry Acc. Chem. Res. 35 2002 686 694 10.1021/ar010065m I. T. Horváth, Origins, current status, and future challenges of green chemistry, Acc. Chem. Res., 35 (2002) 686-694. https://doi.org/10.1021/ar010065m [41] C. Arani V.V. Fokin Organic Synthesis On water Chem. Rev. 109 2009 725 748 10.1021/cr800448q C. Arani, V. V. Fokin, Organic Synthesis \"On water\", Chem. Rev. 109 (2009) 725–748. https://doi.org/10.1021/cr800448q. [42] J. Li J-jing Cao J-fa Wei X-ying Shi L-hui Zhang J-juan Feng Z-guo Chen Ionic liquid brush as a highly efficient and reusable catalyst for on-water nucleophilic substitutions Eur. J. Org. Chem. 2 2011 229 233 10.1002/ejoc.201001227 J. Li, J-jing Cao, J-fa Wei, X-ying Shi, L-hui Zhang, J-juan Feng, Z-guo Chen, Ionic liquid brush as a highly efficient and reusable catalyst for on-water nucleophilic substitutions, Eur. J. Org. Chem. 2 (2011) 229-233. https://doi.org/10.1002/ejoc.201001227 [43] P.E. Stott J.S. Bradshaw W.W. Parish Modified crown ether catalysts. 3. structural parameters affecting phase transfer catalysis by crown ethers and a comparison of the effectiveness of crown ethers to that of other phase transfer catalysts J. Am. Chem. Soc. 102 1980 4810 4815 10.1021/ja00534a040 P. E. Stott, J. S. Bradshaw, W. W. Parish, Modified crown ether catalysts. 3. structural parameters affecting phase transfer catalysis by crown ethers and a comparison of the effectiveness of crown ethers to that of other phase transfer catalysts, J. Am. Chem. Soc. 102 (1980) 4810-4815. https://doi.org/10.1021/ja00534a040 [44] For more details, see the Supporting Information (Table 1). [45] For more details, see the Supporting Information (Table 2).",
      "scopus-id": "85146710852",
      "coredata": {
        "eid": "1-s2.0-S246882312300038X",
        "dc:description": "Carbon black intercalation compound was used for the first time as a heterogeneous phase-transfer-catalyst for SN2 type reaction of NaSCN with 4-nitrobenzyl bromide. The reaction proceeds in the presence of 5 mol% of catalyst with high efficiency in a liquid-liquid biphasic system (CHCl3/H2O), providing 98% conversion after only 4 h. Furthermore, an unprecedent efficient nucleophilic substitution was reported in water solution in the presence of the new catalyst, providing 95% yield in 8 h. The reaction is green, and the heterogeneous catalyst can be recovered and recycled without losing efficiency.",
        "openArchiveArticle": "false",
        "prism:coverDate": "2023-02-15",
        "openaccessUserLicense": "http://creativecommons.org/licenses/by-nc-nd/4.0/",
        "prism:aggregationType": "Journal",
        "prism:url": "https://api.elsevier.com/content/article/pii/S246882312300038X",
        "dc:creator": [
          {
            "@_fa": "true",
            "$": "Melillo, Arianna"
          },
          {
            "@_fa": "true",
            "$": "Kiani, Aida"
          },
          {
            "@_fa": "true",
            "$": "Schettini, Rosaria"
          },
          {
            "@_fa": "true",
            "$": "Acocella, Maria Rosaria"
          }
        ],
        "link": [
          {
            "@_fa": "true",
            "@rel": "self",
            "@href": "https://api.elsevier.com/content/article/pii/S246882312300038X"
          },
          {
            "@_fa": "true",
            "@rel": "scidir",
            "@href": "https://www.sciencedirect.com/science/article/pii/S246882312300038X"
          }
        ],
        "dc:format": "application/json",
        "openaccessType": "Full",
        "pii": "S2468-8231(23)00038-X",
        "prism:volume": "537",
        "articleNumber": "112951",
        "prism:publisher": "The Authors. Published by Elsevier B.V.",
        "dc:title": "Carbon black intercalation compound as catalyst for unprecedent phase-transfer-catalyzed nucleophilic substitution (SN2) in water",
        "prism:copyright": "© 2023 The Authors. Published by Elsevier B.V.",
        "openaccess": "1",
        "prism:issn": "24688231",
        "dcterms:subject": [
          {
            "@_fa": "true",
            "$": "Phase transfer catalyst"
          },
          {
            "@_fa": "true",
            "$": "Nucleophilic substitution"
          },
          {
            "@_fa": "true",
            "$": "Carbon black"
          },
          {
            "@_fa": "true",
            "$": "Green procedure"
          },
          {
            "@_fa": "true",
            "$": "Intercalation compounds"
          }
        ],
        "openaccessArticle": "true",
        "prism:publicationName": "Molecular Catalysis",
        "openaccessSponsorType": "ElsevierBranded",
        "prism:pageRange": "112951",
        "pubType": "fla",
        "prism:coverDisplayDate": "15 February 2023",
        "prism:doi": "10.1016/j.mcat.2023.112951",
        "prism:startingPage": "112951",
        "dc:identifier": "doi:10.1016/j.mcat.2023.112951",
        "openaccessSponsorName": "CRUI: Hybrid journals 2023"
      },
      "objects": {
        "object": [
          {
            "@category": "standard",
            "@height": "329",
            "@width": "386",
            "@_fa": "true",
            "$": "https://api.elsevier.com/content/object/eid/1-s2.0-S246882312300038X-gr1.jpg?httpAccept=%2A%2F%2A",
            "@multimediatype": "JPEG image file",
            "@type": "IMAGE-DOWNSAMPLED",
            "@size": "36942",
            "@ref": "gr1",
            "@mimetype": "image/jpeg"
          },
          {
            "@category": "standard",
            "@height": "501",
            "@width": "809",
            "@_fa": "true",
            "$": "https://api.elsevier.com/content/object/eid/1-s2.0-S246882312300038X-sc2.jpg?httpAccept=%2A%2F%2A",
            "@multimediatype": "JPEG image file",
            "@type": "IMAGE-DOWNSAMPLED",
            "@size": "57406",
            "@ref": "sc2",
            "@mimetype": "image/jpeg"
          },
          {
            "@category": "standard",
            "@height": "54",
            "@width": "393",
            "@_fa": "true",
            "$": "https://api.elsevier.com/content/object/eid/1-s2.0-S246882312300038X-fx4.jpg?httpAccept=%2A%2F%2A",
            "@multimediatype": "JPEG image file",
            "@type": "IMAGE-DOWNSAMPLED",
            "@size": "6936",
            "@ref": "fx4",
            "@mimetype": "image/jpeg"
          },
          {
            "@category": "standard",
            "@height": "49",
            "@width": "386",
            "@_fa": "true",
            "$": "https://api.elsevier.com/content/object/eid/1-s2.0-S246882312300038X-sc1.jpg?httpAccept=%2A%2F%2A",
            "@multimediatype": "JPEG image file",
            "@type": "IMAGE-DOWNSAMPLED",
            "@size": "6717",
            "@ref": "sc1",
            "@mimetype": "image/jpeg"
          },
          {
            "@category": "standard",
            "@height": "52",
            "@width": "410",
            "@_fa": "true",
            "$": "https://api.elsevier.com/content/object/eid/1-s2.0-S246882312300038X-fx3.jpg?httpAccept=%2A%2F%2A",
            "@multimediatype": "JPEG image file",
            "@type": "IMAGE-DOWNSAMPLED",
            "@size": "7150",
            "@ref": "fx3",
            "@mimetype": "image/jpeg"
          },
          {
            "@category": "standard",
            "@height": "64",
            "@width": "439",
            "@_fa": "true",
            "$": "https://api.elsevier.com/content/object/eid/1-s2.0-S246882312300038X-fx2.jpg?httpAccept=%2A%2F%2A",
            "@multimediatype": "JPEG image file",
            "@type": "IMAGE-DOWNSAMPLED",
            "@size": "7037",
            "@ref": "fx2",
            "@mimetype": "image/jpeg"
          },
          {
            "@category": "standard",
            "@height": "46",
            "@width": "267",
            "@_fa": "true",
            "$": "https://api.elsevier.com/content/object/eid/1-s2.0-S246882312300038X-fx1.jpg?httpAccept=%2A%2F%2A",
            "@multimediatype": "JPEG image file",
            "@type": "IMAGE-DOWNSAMPLED",
            "@size": "4511",
            "@ref": "fx1",
            "@mimetype": "image/jpeg"
          },
          {
            "@category": "standard",
            "@height": "312",
            "@width": "386",
            "@_fa": "true",
            "$": "https://api.elsevier.com/content/object/eid/1-s2.0-S246882312300038X-gr4.jpg?httpAccept=%2A%2F%2A",
            "@multimediatype": "JPEG image file",
            "@type": "IMAGE-DOWNSAMPLED",
            "@size": "16082",
            "@ref": "gr4",
            "@mimetype": "image/jpeg"
          },
          {
            "@category": "standard",
            "@height": "314",
            "@width": "386",
            "@_fa": "true",
            "$": "https://api.elsevier.com/content/object/eid/1-s2.0-S246882312300038X-gr3.jpg?httpAccept=%2A%2F%2A",
            "@multimediatype": "JPEG image file",
            "@type": "IMAGE-DOWNSAMPLED",
            "@size": "26653",
            "@ref": "gr3",
            "@mimetype": "image/jpeg"
          },
          {
            "@category": "standard",
            "@height": "343",
            "@width": "809",
            "@_fa": "true",
            "$": "https://api.elsevier.com/content/object/eid/1-s2.0-S246882312300038X-gr2.jpg?httpAccept=%2A%2F%2A",
            "@multimediatype": "JPEG image file",
            "@type": "IMAGE-DOWNSAMPLED",
            "@size": "57511",
            "@ref": "gr2",
            "@mimetype": "image/jpeg"
          },
          {
            "@category": "standard",
            "@height": "200",
            "@width": "223",
            "@_fa": "true",
            "$": "https://api.elsevier.com/content/object/eid/1-s2.0-S246882312300038X-ga1.jpg?httpAccept=%2A%2F%2A",
            "@multimediatype": "JPEG image file",
            "@type": "IMAGE-DOWNSAMPLED",
            "@size": "25000",
            "@ref": "ga1",
            "@mimetype": "image/jpeg"
          },
          {
            "@category": "thumbnail",
            "@height": "164",
            "@width": "192",
            "@_fa": "true",
            "$": "https://api.elsevier.com/content/object/eid/1-s2.0-S246882312300038X-gr1.sml?httpAccept=%2A%2F%2A",
            "@multimediatype": "GIF image file",
            "@type": "IMAGE-THUMBNAIL",
            "@size": "9908",
            "@ref": "gr1",
            "@mimetype": "image/gif"
          },
          {
            "@category": "thumbnail",
            "@height": "136",
            "@width": "219",
            "@_fa": "true",
            "$": "https://api.elsevier.com/content/object/eid/1-s2.0-S246882312300038X-sc2.sml?httpAccept=%2A%2F%2A",
            "@multimediatype": "GIF image file",
            "@type": "IMAGE-THUMBNAIL",
            "@size": "9571",
            "@ref": "sc2",
            "@mimetype": "image/gif"
          },
          {
            "@category": "thumbnail",
            "@height": "30",
            "@width": "219",
            "@_fa": "true",
            "$": "https://api.elsevier.com/content/object/eid/1-s2.0-S246882312300038X-fx4.sml?httpAccept=%2A%2F%2A",
            "@multimediatype": "GIF image file",
            "@type": "IMAGE-THUMBNAIL",
            "@size": "2544",
            "@ref": "fx4",
            "@mimetype": "image/gif"
          },
          {
            "@category": "thumbnail",
            "@height": "28",
            "@width": "219",
            "@_fa": "true",
            "$": "https://api.elsevier.com/content/object/eid/1-s2.0-S246882312300038X-sc1.sml?httpAccept=%2A%2F%2A",
            "@multimediatype": "GIF image file",
            "@type": "IMAGE-THUMBNAIL",
            "@size": "2350",
            "@ref": "sc1",
            "@mimetype": "image/gif"
          },
          {
            "@category": "thumbnail",
            "@height": "28",
            "@width": "219",
            "@_fa": "true",
            "$": "https://api.elsevier.com/content/object/eid/1-s2.0-S246882312300038X-fx3.sml?httpAccept=%2A%2F%2A",
            "@multimediatype": "GIF image file",
            "@type": "IMAGE-THUMBNAIL",
            "@size": "2457",
            "@ref": "fx3",
            "@mimetype": "image/gif"
          },
          {
            "@category": "thumbnail",
            "@height": "32",
            "@width": "219",
            "@_fa": "true",
            "$": "https://api.elsevier.com/content/object/eid/1-s2.0-S246882312300038X-fx2.sml?httpAccept=%2A%2F%2A",
            "@multimediatype": "GIF image file",
            "@type": "IMAGE-THUMBNAIL",
            "@size": "2365",
            "@ref": "fx2",
            "@mimetype": "image/gif"
          },
          {
            "@category": "thumbnail",
            "@height": "38",
            "@width": "219",
            "@_fa": "true",
            "$": "https://api.elsevier.com/content/object/eid/1-s2.0-S246882312300038X-fx1.sml?httpAccept=%2A%2F%2A",
            "@multimediatype": "GIF image file",
            "@type": "IMAGE-THUMBNAIL",
            "@size": "2811",
            "@ref": "fx1",
            "@mimetype": "image/gif"
          },
          {
            "@category": "thumbnail",
            "@height": "164",
            "@width": "203",
            "@_fa": "true",
            "$": "https://api.elsevier.com/content/object/eid/1-s2.0-S246882312300038X-gr4.sml?httpAccept=%2A%2F%2A",
            "@multimediatype": "GIF image file",
            "@type": "IMAGE-THUMBNAIL",
            "@size": "5742",
            "@ref": "gr4",
            "@mimetype": "image/gif"
          },
          {
            "@category": "thumbnail",
            "@height": "164",
            "@width": "202",
            "@_fa": "true",
            "$": "https://api.elsevier.com/content/object/eid/1-s2.0-S246882312300038X-gr3.sml?httpAccept=%2A%2F%2A",
            "@multimediatype": "GIF image file",
            "@type": "IMAGE-THUMBNAIL",
            "@size": "7484",
            "@ref": "gr3",
            "@mimetype": "image/gif"
          },
          {
            "@category": "thumbnail",
            "@height": "93",
            "@width": "219",
            "@_fa": "true",
            "$": "https://api.elsevier.com/content/object/eid/1-s2.0-S246882312300038X-gr2.sml?httpAccept=%2A%2F%2A",
            "@multimediatype": "GIF image file",
            "@type": "IMAGE-THUMBNAIL",
            "@size": "8096",
            "@ref": "gr2",
            "@mimetype": "image/gif"
          },
          {
            "@category": "thumbnail",
            "@height": "164",
            "@width": "183",
            "@_fa": "true",
            "$": "https://api.elsevier.com/content/object/eid/1-s2.0-S246882312300038X-ga1.sml?httpAccept=%2A%2F%2A",
            "@multimediatype": "GIF image file",
            "@type": "IMAGE-THUMBNAIL",
            "@size": "15250",
            "@ref": "ga1",
            "@mimetype": "image/gif"
          },
          {
            "@category": "high",
            "@height": "1455",
            "@width": "1708",
            "@_fa": "true",
            "$": "https://api.elsevier.com/content/object/eid/1-s2.0-S246882312300038X-gr1_lrg.jpg?httpAccept=%2A%2F%2A",
            "@multimediatype": "JPEG image file",
            "@type": "IMAGE-HIGH-RES",
            "@size": "297437",
            "@ref": "gr1",
            "@mimetype": "image/jpeg"
          },
          {
            "@category": "high",
            "@height": "2221",
            "@width": "3583",
            "@_fa": "true",
            "$": "https://api.elsevier.com/content/object/eid/1-s2.0-S246882312300038X-sc2_lrg.jpg?httpAccept=%2A%2F%2A",
            "@multimediatype": "JPEG image file",
            "@type": "IMAGE-HIGH-RES",
            "@size": "505246",
            "@ref": "sc2",
            "@mimetype": "image/jpeg"
          },
          {
            "@category": "high",
            "@height": "241",
            "@width": "1741",
            "@_fa": "true",
            "$": "https://api.elsevier.com/content/object/eid/1-s2.0-S246882312300038X-fx4_lrg.jpg?httpAccept=%2A%2F%2A",
            "@multimediatype": "JPEG image file",
            "@type": "IMAGE-HIGH-RES",
            "@size": "51389",
            "@ref": "fx4",
            "@mimetype": "image/jpeg"
          },
          {
            "@category": "high",
            "@height": "216",
            "@width": "1708",
            "@_fa": "true",
            "$": "https://api.elsevier.com/content/object/eid/1-s2.0-S246882312300038X-sc1_lrg.jpg?httpAccept=%2A%2F%2A",
            "@multimediatype": "JPEG image file",
            "@type": "IMAGE-HIGH-RES",
            "@size": "45856",
            "@ref": "sc1",
            "@mimetype": "image/jpeg"
          },
          {
            "@category": "high",
            "@height": "230",
            "@width": "1817",
            "@_fa": "true",
            "$": "https://api.elsevier.com/content/object/eid/1-s2.0-S246882312300038X-fx3_lrg.jpg?httpAccept=%2A%2F%2A",
            "@multimediatype": "JPEG image file",
            "@type": "IMAGE-HIGH-RES",
            "@size": "51321",
            "@ref": "fx3",
            "@mimetype": "image/jpeg"
          },
          {
            "@category": "high",
            "@height": "285",
            "@width": "1946",
            "@_fa": "true",
            "$": "https://api.elsevier.com/content/object/eid/1-s2.0-S246882312300038X-fx2_lrg.jpg?httpAccept=%2A%2F%2A",
            "@multimediatype": "JPEG image file",
            "@type": "IMAGE-HIGH-RES",
            "@size": "53416",
            "@ref": "fx2",
            "@mimetype": "image/jpeg"
          },
          {
            "@category": "high",
            "@height": "205",
            "@width": "1182",
            "@_fa": "true",
            "$": "https://api.elsevier.com/content/object/eid/1-s2.0-S246882312300038X-fx1_lrg.jpg?httpAccept=%2A%2F%2A",
            "@multimediatype": "JPEG image file",
            "@type": "IMAGE-HIGH-RES",
            "@size": "32239",
            "@ref": "fx1",
            "@mimetype": "image/jpeg"
          },
          {
            "@category": "high",
            "@height": "1381",
            "@width": "1708",
            "@_fa": "true",
            "$": "https://api.elsevier.com/content/object/eid/1-s2.0-S246882312300038X-gr4_lrg.jpg?httpAccept=%2A%2F%2A",
            "@multimediatype": "JPEG image file",
            "@type": "IMAGE-HIGH-RES",
            "@size": "99954",
            "@ref": "gr4",
            "@mimetype": "image/jpeg"
          },
          {
            "@category": "high",
            "@height": "1388",
            "@width": "1708",
            "@_fa": "true",
            "$": "https://api.elsevier.com/content/object/eid/1-s2.0-S246882312300038X-gr3_lrg.jpg?httpAccept=%2A%2F%2A",
            "@multimediatype": "JPEG image file",
            "@type": "IMAGE-HIGH-RES",
            "@size": "180589",
            "@ref": "gr3",
            "@mimetype": "image/jpeg"
          },
          {
            "@category": "high",
            "@height": "1519",
            "@width": "3583",
            "@_fa": "true",
            "$": "https://api.elsevier.com/content/object/eid/1-s2.0-S246882312300038X-gr2_lrg.jpg?httpAccept=%2A%2F%2A",
            "@multimediatype": "JPEG image file",
            "@type": "IMAGE-HIGH-RES",
            "@size": "411950",
            "@ref": "gr2",
            "@mimetype": "image/jpeg"
          },
          {
            "@category": "high",
            "@height": "886",
            "@width": "988",
            "@_fa": "true",
            "$": "https://api.elsevier.com/content/object/eid/1-s2.0-S246882312300038X-ga1_lrg.jpg?httpAccept=%2A%2F%2A",
            "@multimediatype": "JPEG image file",
            "@type": "IMAGE-HIGH-RES",
            "@size": "212647",
            "@ref": "ga1",
            "@mimetype": "image/jpeg"
          },
          {
            "@category": "standard",
            "@_fa": "true",
            "$": "https://api.elsevier.com/content/object/eid/1-s2.0-S246882312300038X-mmc1.doc?httpAccept=%2A%2F%2A",
            "@multimediatype": "Microsoft Word file",
            "@type": "APPLICATION",
            "@size": "4849664",
            "@ref": "mmc1",
            "@mimetype": "application/word"
          },
          {
            "@category": "standard",
            "@_fa": "true",
            "$": "https://api.elsevier.com/content/object/eid/1-s2.0-S246882312300038X-am.pdf?httpAccept=%2A%2F%2A",
            "@multimediatype": "Acrobat PDF file",
            "@type": "AAM-PDF",
            "@size": "88768401",
            "@ref": "am",
            "@mimetype": "application/pdf"
          }
        ]
      },
      "link": {
        "@rel": "abstract",
        "@href": "https://api.elsevier.com/content/abstract/scopus_id/85146710852"
      }
    }
  }
}