{
  "metadata": {
    "title": "Single–atom Cu catalysts for the oxidative coupling of styrenes with aryl sulfones: from salts and zeolites to MOFs",
    "authors": "; ; ",
    "journal": "Molecular Catalysis",
    "date": "2024-01-15",
    "doi": "10.1016/j.mcat.2023.113786",
    "abstract": "",
    "uri": "https://api.elsevier.com/content/article/pii/S246882312300874X",
    "pii": "S246882312300874X"
  },
  "fulltext": {
    "full-text-retrieval-response": {
      "scopus-eid": "2-s2.0-85180419444",
      "originalText": "serial JL 315758 291210 291744 291790 291809 31 90 Molecular Catalysis MOLECULARCATALYSIS 2023-12-21 2023-12-21 2023-12-21 2023-12-21 2024-01-14T03:56:07 1-s2.0-S246882312300874X S2468-8231(23)00874-X S246882312300874X 10.1016/j.mcat.2023.113786 S300 S300.1 FULL-TEXT 1-s2.0-S2468823123X00194 2024-01-26T05:56:41.018548Z 0 0 20240115 2024 2023-12-21T13:07:50.289389Z absattachment articleinfo articlenumber articletitlenorm authfirstinitialnorm authfirstsurnamenorm cid cids contenttype copyright crossmark dateloaded dateloadedtxt datesearch datesort dateupdated dco docsubtype doctype doi eid ewtransactionid fundingbodyid hubeid indexeddate issn issnnorm itemstage itemtransactionid itemweight oauserlicense openaccess openarchive pg pgfirst pii piinorm pubdatestart pubdatetxt pubyr sectiontitle sortorder sponsoredaccesstype srctitle srctitlenorm srctype ssids alllist content oa subj subheadings suppl tomb volfirst volissue volumelist webpdf webpdfpagecount yearnav figure table e-component body acknowledge affil appendices articletitle auth authfirstini authfull authkeywords authlast footnotes grantnumber grantsponsor highlightsabst orcid primabst pubtype ref specialabst 2468-8231 24688231 UNLIMITED SPAIN2022 true 553 553 C Volume 553 64 113786 113786 113786 20240115 15 January 2024 2024-01-15 2024 Regular Papers article fla © 2023 The Author(s). Published by Elsevier B.V. SINGLEATOMCUCATALYSTSFOROXIDATIVECOUPLINGSTYRENESARYLSULFONESSALTSZEOLITESMOFS BILANIN C 1 Introduction 2 Materials and methods 3 Results and discussion 3.1 Oxidative coupling of styrene 1a with aryl sulfone 2 catalyzed by Cu salts 3.1.1 Catalyst screening with different first–raw transition metal salts: from Ag to Cu 3.1.2 Substrate scope 3.1.3 Catalytic active species of Ag and Cu 3.2 Oxidative coupling of styrenes 1 with aryl sulfone 2 catalyzed by Cu2+–supported catalysts 3.2.1 Zeolites as supports for Cu2+ and Cu+ SACs 3.2.2 MOFs as a support for Cu2+ SACs 4 Conclusions Data availability CRediT authorship contribution statement Acknowledgements Appendix Supplementary materials References OBLIGACION 2018 15 34 J SCOTTI 2017 1386 1393 N RODYGIN 2022 1132 1140 K DELUCA 2011 5791 5795 L CHEN 2014 2955 2959 J KONG 2015 2487 2491 W SARKAR 2019 11722 11735 C SGROLLI 2017 143 151 N ALHMOUD 2014 514 522 L ALAMIN 2014 1631 1637 M JANTAN 2017 5846 5853 K PARY 2021 2414 2421 F JIMENEZALMARZA 2022 16258 16268 A BAKANDRITSOS 2019 1900323 A LIU 2018 4981 5079 L MARTIN 2021 2751 2765 N GUI 2018 5748 5751 Q REDDY 2013 3605 3631 L GROSSMANN 2016 5377 5389 A NENAJDENKO 2017 205 209 V MOTORNOV 2017 5274 5284 V GARNESPORTOLES 2021 293 303 F KOVAC 2020 7192 7206 O ZHANG 2022 298 303 X FANG 2016 59661 59676 Y LI 2014 7911 7915 X MAO 2015 1692 1695 S DAS 2011 2941 2944 B OJHA 2015 18 21 D CABREROANTONINO 2010 1571 1576 J CHOI 2013 3633 3638 J COLOMER 2016 4748 4752 I LIU 2022 103906 J BALLESTEROSSOBERANAS 2023 13 18 J SANTILLAN 2020 65 71 J PARAMELLE 2014 4855 4861 D OLIVERMESEGUER 2012 1452 1455 J OLIVERMESEGUER 2013 3509 3515 J TIBURCIO 2023 10342 10354 E UEDA 2021 3545 3550 M WALLEN 2018 4841 4848 C CHEN 2022 3920 3925 Y CHAWLA 2014 2032 2036 R LU 2013 11481 11484 Q SINGH 2014 4742 4746 A CHEN 2021 152794 Y CORMA 2004 350 358 A SOBHY 2022 109829 S SHIMIZU 2007 19043 19051 K OLIVERMESSEGUER 2015 3894 3900 J MEDA 2004 756 759 L DUTTA 1985 3490 3492 P SASS 1988 5192 5196 C PHAN 2013 38 46 N LUZ 2014 1829 1836 I TRUONG 2015 110 116 T ELAVARASAN 2019 4340 4350 S GRANCHA 2015 6521 6525 T GRECO 2022 112228 R TIBURCIO 2022 11796 11802 E BALEIZAO 2004 439 446 C BISWAS 2012 10200 10209 S DHAKSHINAMOORTHY 2020 454 466 A DHAKSHINAMOORTHY 2020 4732 4753 A BILANINX2024X113786 BILANINX2024X113786XC Full 2023-12-18T09:04:49Z FundingBody Spanish Institutions 2022 http://creativecommons.org/licenses/by-nc-nd/4.0/ 2024-06-21T00:00:00.000Z 2024-06-21T00:00:00.000Z http://creativecommons.org/licenses/by-nc-nd/4.0/ This is an open access article under the CC BY-NC-ND license. © 2023 The Author(s). Published by Elsevier B.V. 2023-12-29T04:25:30.285Z http://vtw.elsevier.com/data/voc/AddOnTypes/50.7/aggregated-refined CSIC CSIC Consejo Superior de Investigaciones Científicas http://data.elsevier.com/vocabulary/SciValFunders/501100003339 http://sws.geonames.org/2510769/ Generalitat Valenciana PROMETEO/2021/054 GVA Generalitat Valenciana http://data.elsevier.com/vocabulary/SciValFunders/501100003359 http://sws.geonames.org/2510769/ MOF MOF Ministry of Oceans and Fisheries http://data.elsevier.com/vocabulary/SciValFunders/501100003566 http://sws.geonames.org/1835841/ European Research Council http://data.elsevier.com/vocabulary/SciValFunders/100010663 http://sws.geonames.org/2802361 FJC2019–040523–I PID2019−104778GB−I00 PID2020–115100GB–I00 TED2021-130465B-I00 Gobierno de España Ministerio de Ciencia e Innovación http://data.elsevier.com/vocabulary/SciValFunders/100014440 http://sws.geonames.org/2510769 ERC 814804 ERC European Research Council http://data.elsevier.com/vocabulary/SciValFunders/501100000781 http://sws.geonames.org/6695072/ European Union's Horizon 2020 research and innovation programme Horizon 2020 http://data.elsevier.com/vocabulary/SciValFunders/501100007601 http://sws.geonames.org/6695072/ CSC 202009350009 CSC Consejería de Salud y Consumo, Junta de Andalucía http://data.elsevier.com/vocabulary/SciValFunders/501100023731 http://sws.geonames.org/2510769/ Juan de la Cierva program MICIIN PAID 01–20 UPV Universitat Politecnica de Valencia http://data.elsevier.com/vocabulary/SciValFunders/501100004233 http://sws.geonames.org/2510769 China Scholarship Council CSC China Scholarship Council http://data.elsevier.com/vocabulary/SciValFunders/501100004543 http://sws.geonames.org/1814991/ Spanish Ministry of Science and Innovation CEX2021−001230 MCIN/AEI/10.13039/501100011033 MICINN Ministerio de Ciencia e Innovación http://data.elsevier.com/vocabulary/SciValFunders/501100004837 http://sws.geonames.org/2510769/ Financial support by the Spanish Ministry of Science and Innovation ( CEX2021−001230−S grant funded by MCIN/AEI/10.13039/501100011033 ) is gratefully acknowledged. This work was also supported by the MICIIN (Spain) through projects TED2021-130465B-I00 , PID2020–115100GB–I00 , PID2019−104778GB−I00 and “Maria de Maeztu” CEX2019−000919−M . The Generalitat Valenciana (Project PROMETEO/2021/054 ) is also acknowledged. E.P. acknowledges the financial support of the European Research Council under the European Union's Horizon 2020 research and innovation programme / ERC Grant Agreement No 814804 , MOF–reactors. M.M. thanks MICIIN from a contract under the Juan de la Cierva program ( FJC2019–040523–I ). C.B. thanks ITQ/UPV–CSIC for a contract (PAID 01–20). Y.Z. thanks to the China Scholarship Council (CSC No: 202009350009 ) for a Ph.D. fellowship. Financial support by the Spanish Ministry of Science and Innovation (CEX2021−001230−S grant funded by MCIN/AEI/10.13039/501100011033) is gratefully acknowledged. This work was also supported by the MICIIN (Spain) through projects TED2021-130465B-I00, PID2020–115100GB–I00, PID2019−104778GB−I00 and “Maria de Maeztu” CEX2019−000919−M. The Generalitat Valenciana (Project PROMETEO/2021/054) is also acknowledged. E.P. acknowledges the financial support of the European Research Council under the European Union's Horizon 2020 research and innovation programme / ERC Grant Agreement No 814804, MOF–reactors. M.M. thanks MICIIN from a contract under the Juan de la Cierva program (FJC2019–040523–I). C.B. thanks ITQ/UPV–CSIC for a contract (PAID 01–20). Y.Z. thanks to the China Scholarship Council (CSC No: 202009350009) for a Ph.D. fellowship. item S2468-8231(23)00874-X S246882312300874X 1-s2.0-S246882312300874X 10.1016/j.mcat.2023.113786 315758 2024-01-26T05:56:41.018548Z 2024-01-15 UNLIMITED SPAIN2022 1-s2.0-S246882312300874X-main.pdf https://s3-eu-west-1.amazonaws.com/prod-ucs-content-store-eu-west/content/pii:S246882312300874X/MAIN/application/pdf/f8b1aa584d5cc902e92fe9d3815a663e/main.pdf main.pdf pdf true 2829632 MAIN 10 1-s2.0-S246882312300874X-main_1.png https://s3-eu-west-1.amazonaws.com/prod-ucs-content-store-eu-west/content/pii:S246882312300874X/PREVIEW/image/png/490ecfa15444085c16273914b8a51a72/main_1.png main_1.png png 59404 849 656 IMAGE-WEB-PDF 1 1-s2.0-S246882312300874X-gr8.jpg https://s3-eu-west-1.amazonaws.com/prod-ucs-content-store-eu-west/content/pii:S246882312300874X/gr8/DOWNSAMPLED/image/jpeg/2c2eebff6c0f5c3d5ff6b3aadf2856b9/gr8.jpg gr8 gr8.jpg jpg 51832 423 527 IMAGE-DOWNSAMPLED 1-s2.0-S246882312300874X-gr2.jpg https://s3-eu-west-1.amazonaws.com/prod-ucs-content-store-eu-west/content/pii:S246882312300874X/gr2/DOWNSAMPLED/image/jpeg/bc1071bb121734e796244e656eb047e6/gr2.jpg gr2 gr2.jpg jpg 54432 481 602 IMAGE-DOWNSAMPLED 1-s2.0-S246882312300874X-ga1.jpg https://s3-eu-west-1.amazonaws.com/prod-ucs-content-store-eu-west/content/pii:S246882312300874X/ga1/DOWNSAMPLED/image/jpeg/bf49dd4dc14309e12e1bb4fb18a11c47/ga1.jpg ga1 true ga1.jpg jpg 33146 200 459 IMAGE-DOWNSAMPLED 1-s2.0-S246882312300874X-gr1.jpg https://s3-eu-west-1.amazonaws.com/prod-ucs-content-store-eu-west/content/pii:S246882312300874X/gr1/DOWNSAMPLED/image/jpeg/049b8e0e5b0154b521712fb92d691f9a/gr1.jpg gr1 gr1.jpg jpg 28124 101 809 IMAGE-DOWNSAMPLED 1-s2.0-S246882312300874X-fx1.jpg https://s3-eu-west-1.amazonaws.com/prod-ucs-content-store-eu-west/content/pii:S246882312300874X/fx1/DOWNSAMPLED/image/jpeg/3acd3d043f9542b385d8023b323f120a/fx1.jpg fx1 fx1.jpg jpg 10576 78 547 IMAGE-DOWNSAMPLED 1-s2.0-S246882312300874X-gr7.jpg https://s3-eu-west-1.amazonaws.com/prod-ucs-content-store-eu-west/content/pii:S246882312300874X/gr7/DOWNSAMPLED/image/jpeg/80ffc6fac483b6f01a6de10ee4f31e86/gr7.jpg gr7 gr7.jpg jpg 33937 252 739 IMAGE-DOWNSAMPLED 1-s2.0-S246882312300874X-gr6.jpg https://s3-eu-west-1.amazonaws.com/prod-ucs-content-store-eu-west/content/pii:S246882312300874X/gr6/DOWNSAMPLED/image/jpeg/5dfc76e7fb2f24f1ca8bda9e2ecdf646/gr6.jpg gr6 gr6.jpg jpg 93394 253 809 IMAGE-DOWNSAMPLED 1-s2.0-S246882312300874X-gr5.jpg https://s3-eu-west-1.amazonaws.com/prod-ucs-content-store-eu-west/content/pii:S246882312300874X/gr5/DOWNSAMPLED/image/jpeg/a828085ec11e1b7f94b11a419d1d8fed/gr5.jpg gr5 gr5.jpg jpg 36719 238 736 IMAGE-DOWNSAMPLED 1-s2.0-S246882312300874X-gr4.jpg https://s3-eu-west-1.amazonaws.com/prod-ucs-content-store-eu-west/content/pii:S246882312300874X/gr4/DOWNSAMPLED/image/jpeg/5d627947cd4b47952bc90c16ee33fd65/gr4.jpg gr4 gr4.jpg jpg 54074 360 616 IMAGE-DOWNSAMPLED 1-s2.0-S246882312300874X-gr3.jpg https://s3-eu-west-1.amazonaws.com/prod-ucs-content-store-eu-west/content/pii:S246882312300874X/gr3/DOWNSAMPLED/image/jpeg/c3393fa635f04292b4612210e4c5e780/gr3.jpg gr3 gr3.jpg jpg 17846 298 386 IMAGE-DOWNSAMPLED 1-s2.0-S246882312300874X-gr8.sml https://s3-eu-west-1.amazonaws.com/prod-ucs-content-store-eu-west/content/pii:S246882312300874X/gr8/THUMBNAIL/image/gif/b5d6483d9d91691a1580ce19dfa1509b/gr8.sml gr8 gr8.sml sml 7931 164 204 IMAGE-THUMBNAIL 1-s2.0-S246882312300874X-gr2.sml https://s3-eu-west-1.amazonaws.com/prod-ucs-content-store-eu-west/content/pii:S246882312300874X/gr2/THUMBNAIL/image/gif/3e88b42c7c598fa32a4c759b71150597/gr2.sml gr2 gr2.sml sml 6233 164 205 IMAGE-THUMBNAIL 1-s2.0-S246882312300874X-ga1.sml https://s3-eu-west-1.amazonaws.com/prod-ucs-content-store-eu-west/content/pii:S246882312300874X/ga1/THUMBNAIL/image/gif/60651b8018a6bc812f1523ba56732087/ga1.sml ga1 true ga1.sml sml 8735 95 219 IMAGE-THUMBNAIL 1-s2.0-S246882312300874X-gr1.sml https://s3-eu-west-1.amazonaws.com/prod-ucs-content-store-eu-west/content/pii:S246882312300874X/gr1/THUMBNAIL/image/gif/9f89a48e9a5b6b0a934fa0ded3659f67/gr1.sml gr1 gr1.sml sml 5116 27 219 IMAGE-THUMBNAIL 1-s2.0-S246882312300874X-fx1.sml https://s3-eu-west-1.amazonaws.com/prod-ucs-content-store-eu-west/content/pii:S246882312300874X/fx1/THUMBNAIL/image/gif/48ab2416ef5ee810be0d6b11af71024d/fx1.sml fx1 fx1.sml sml 2331 31 219 IMAGE-THUMBNAIL 1-s2.0-S246882312300874X-gr7.sml https://s3-eu-west-1.amazonaws.com/prod-ucs-content-store-eu-west/content/pii:S246882312300874X/gr7/THUMBNAIL/image/gif/70a8a2e131d897d9ea64e79c40415d14/gr7.sml gr7 gr7.sml sml 6037 75 219 IMAGE-THUMBNAIL 1-s2.0-S246882312300874X-gr6.sml https://s3-eu-west-1.amazonaws.com/prod-ucs-content-store-eu-west/content/pii:S246882312300874X/gr6/THUMBNAIL/image/gif/da23ace4c67c49d46d427bd324f2ef8f/gr6.sml gr6 gr6.sml sml 12588 68 219 IMAGE-THUMBNAIL 1-s2.0-S246882312300874X-gr5.sml https://s3-eu-west-1.amazonaws.com/prod-ucs-content-store-eu-west/content/pii:S246882312300874X/gr5/THUMBNAIL/image/gif/d362308d8e7312c7b9e43e7c3bada6e7/gr5.sml gr5 gr5.sml sml 6250 71 219 IMAGE-THUMBNAIL 1-s2.0-S246882312300874X-gr4.sml https://s3-eu-west-1.amazonaws.com/prod-ucs-content-store-eu-west/content/pii:S246882312300874X/gr4/THUMBNAIL/image/gif/44678ee85a6492eb4cb4bd637688f71a/gr4.sml gr4 gr4.sml sml 7693 128 219 IMAGE-THUMBNAIL 1-s2.0-S246882312300874X-gr3.sml https://s3-eu-west-1.amazonaws.com/prod-ucs-content-store-eu-west/content/pii:S246882312300874X/gr3/THUMBNAIL/image/gif/f1088f290f26a05663c37e274bbafff2/gr3.sml gr3 gr3.sml sml 5898 164 212 IMAGE-THUMBNAIL 1-s2.0-S246882312300874X-gr8_lrg.jpg https://s3-eu-west-1.amazonaws.com/prod-ucs-content-store-eu-west/content/pii:S246882312300874X/HIGHRES/image/jpeg/2d20a1c382bd7fc8af5df6bf86e13305/gr8_lrg.jpg gr8 gr8_lrg.jpg jpg 380362 1871 2333 IMAGE-HIGH-RES 1-s2.0-S246882312300874X-gr2_lrg.jpg https://s3-eu-west-1.amazonaws.com/prod-ucs-content-store-eu-west/content/pii:S246882312300874X/HIGHRES/image/jpeg/868ea41307e93f00fa35baaa51737741/gr2_lrg.jpg gr2 gr2_lrg.jpg jpg 433672 2133 2668 IMAGE-HIGH-RES 1-s2.0-S246882312300874X-ga1_lrg.jpg https://s3-eu-west-1.amazonaws.com/prod-ucs-content-store-eu-west/content/pii:S246882312300874X/HIGHRES/image/jpeg/e515d9e56e4ff845f0be4e117f11a192/ga1_lrg.jpg ga1 true ga1_lrg.jpg jpg 252623 886 2034 IMAGE-HIGH-RES 1-s2.0-S246882312300874X-gr1_lrg.jpg https://s3-eu-west-1.amazonaws.com/prod-ucs-content-store-eu-west/content/pii:S246882312300874X/HIGHRES/image/jpeg/1b582ae66e4749e76e9b1ac55062642a/gr1_lrg.jpg gr1 gr1_lrg.jpg jpg 189239 449 3581 IMAGE-HIGH-RES 1-s2.0-S246882312300874X-fx1_lrg.jpg https://s3-eu-west-1.amazonaws.com/prod-ucs-content-store-eu-west/content/pii:S246882312300874X/HIGHRES/image/jpeg/b2c83a52d47b669ffe855d8fc886b30c/fx1_lrg.jpg fx1 fx1_lrg.jpg jpg 85823 344 2422 IMAGE-HIGH-RES 1-s2.0-S246882312300874X-gr7_lrg.jpg https://s3-eu-west-1.amazonaws.com/prod-ucs-content-store-eu-west/content/pii:S246882312300874X/HIGHRES/image/jpeg/b5d9190ddb412b107e3e77ff41243e27/gr7_lrg.jpg gr7 gr7_lrg.jpg jpg 214050 1117 3270 IMAGE-HIGH-RES 1-s2.0-S246882312300874X-gr6_lrg.jpg https://s3-eu-west-1.amazonaws.com/prod-ucs-content-store-eu-west/content/pii:S246882312300874X/HIGHRES/image/jpeg/b1138cb2bba1a7e5234bf779ea4bc6de/gr6_lrg.jpg gr6 gr6_lrg.jpg jpg 743000 1119 3583 IMAGE-HIGH-RES 1-s2.0-S246882312300874X-gr5_lrg.jpg https://s3-eu-west-1.amazonaws.com/prod-ucs-content-store-eu-west/content/pii:S246882312300874X/HIGHRES/image/jpeg/d5937d7ec6fc6362f15580b01a672a9d/gr5_lrg.jpg gr5 gr5_lrg.jpg jpg 234167 1053 3261 IMAGE-HIGH-RES 1-s2.0-S246882312300874X-gr4_lrg.jpg https://s3-eu-west-1.amazonaws.com/prod-ucs-content-store-eu-west/content/pii:S246882312300874X/HIGHRES/image/jpeg/b35b7c20bde58ea08168a05deb1b0e9f/gr4_lrg.jpg gr4 gr4_lrg.jpg jpg 390423 1595 2728 IMAGE-HIGH-RES 1-s2.0-S246882312300874X-gr3_lrg.jpg https://s3-eu-west-1.amazonaws.com/prod-ucs-content-store-eu-west/content/pii:S246882312300874X/HIGHRES/image/jpeg/de151a656b09f90dab02339289e287ed/gr3_lrg.jpg gr3 gr3_lrg.jpg jpg 108262 1322 1710 IMAGE-HIGH-RES 1-s2.0-S246882312300874X-mmc1.pdf https://s3-eu-west-1.amazonaws.com/prod-ucs-content-store-eu-west/content/pii:S246882312300874X/mmc1/MAIN/application/pdf/94cf914e2c3a23151d09d8a48cc7947e/mmc1.pdf mmc1 mmc1.pdf pdf false 3381605 APPLICATION 1-s2.0-S246882312300874X-am.pdf am am.pdf pdf 878155 AAM-PDF https://s3-eu-west-1.amazonaws.com/prod-ucs-content-store-eu-west/content/egi:108W0L1Z666/MAIN/application/pdf/de204d90cac12a8047d98747029bf2d8/am.pdf MCAT 113786 113786 S2468-8231(23)00874-X 10.1016/j.mcat.2023.113786 The Author(s) Fig. 1 Left: Oxidative coupling of styrenes 1 with aryl sulfone 2 catalyzed by AgNO3 or Cu catalysts (this work). Right: general conceptual approach based on the speciation of the metal catalyst. Fig 1 Fig. 2 Substrate scope for the oxidative cross–coupling reaction of different styrenes 1a–m with phenyl sulfone 2 catalyzed by CuCO3 under the conditions described in Table 1. Isolated yields. Fig 2 Fig. 3 Kinetic plots for the oxidative cross–coupling reaction of styrene 1a with phenyl sulfone 2 catalyzed by either CuCO3 or AgNO3 (15 mol%) under the conditions described in Fig. 1, in the presence of visible light. Error bars account for a 5% uncertainty. Fig 3 Fig. 4 Tentative mechanism for the oxidative cross–coupling reaction of styrene 1a with phenyl sulfone 2 catalyzed by either CuCO3 or AgNO3 in toluene solvent at 100 °C. Fig 4 Fig. 5 Results for the reuses (left) and leaching (right) of zeolite Cu–NaY as a catalyst for the oxidative cross–coupling reaction of styrene 1a with phenyl sulfone 2 under the optimized reaction conditions employed in this work. Error bars account for a 5% uncertainty. Fig 5 Fig. 6 Crystal structure of Cu–MOF [58]. Views along the c (left) and b (middle) axes, and a perspective view of one single channel (right). The ligands of the coordination 3D network are depicted as grey sticks whereas copper atoms are represented as cyan spheres. The compensation Ni2+ cations and water molecules are represented as yellow and red spheres, respectively. Yellow surfaces are used to highlight the compensation Ni2+ cations within MOF´s channels. Fig 6 Fig. 7 Results for the reuses (left) and leaching (right) of zeolite Cu2+(SACs)–MOF as a catalyst for the oxidative cross–coupling reaction of styrene 1a with phenyl sulfone 2 under the optimized reaction conditions employed in this work. Error bars account for a 5 % uncertainty. Fig 7 Fig. 8 Substrate scope for the oxidative cross–coupling reaction of different styrenes 1a–l with phenyl sulfone 2 catalyzed by Cu–NaY and Cu2+–MOF, respectively, under the optimized reaction conditions employed in this work. Isolated yields. Fig 8 Table 1 Catalytic results for the oxidative cross–coupling reaction of styrene 1a with phenyl sulfone 2, exposed or not to visible light, under reported conditions [17]. Visible light refers to the typical light in a laboratory (i.e. fumehood light), without any on–purpose device. The reactants disappearance and product appearance were followed by gas–chromatography (GC). [a] The reaction does not proceed if 3Å molecular sieves are added to the reaction. Table 1 Entry Catalyst Light 3a (yield, %) 1 None Yes 6.5 2 None 3.9 3[a] AgNO3 Yes 72.3 4 None 15.8 5 Mn(OAc)3·2H2O Yes 8.5 6 Fe2(SO4)3 Yes 27.6 7 NiCl2 Yes 40.3 8 Ni(OAc)2 Yes 11.2 9 CoSO4 Yes 11.8 10 CoCl2 Yes 15.7 11 Co(OAc)2 Yes 1.2 12 Co3O4 Yes 15.0 13 ZnCl2 Yes 3.6 14 ZnSO4 Yes 10.4 15[a] CuCO3 Yes 53.2 Table 2 Catalytic results for the oxidative cross–coupling reaction of styrene 1a with phenyl sulfone 2 catalyzed by Cu2+ (SACs)–supported materials, under the optimized reaction conditions shown in Table 1. Zeolites without Cu did not give any product 3a. The reactants disappearance and product appearance were followed by gas–chromatography (GC). [a] Same result after calcination of the zeolite under N2. Table 2 Entry Cu catalyst 3a (yield, %) 1 Cu–HY 56.7 2 Cu–NaY 70.2 3 Cu–CsY 76.4 4[a] CuCl2–NaY 66.5 5 Cu–MOF 68.2 Research Paper Single–atom Cu catalysts for the oxidative coupling of styrenes with aryl sulfones: from salts and zeolites to MOFs Cristina Bilanin Data curation Formal analysis Investigation Methodology a 1 Yongkun Zheng Conceptualization Data curation Formal analysis Investigation Methodology a 1 Alejandro Vidal–Moya Formal analysis Investigation a Emilio Pardo Investigation Resources Funding acquisition b Marta Mon Conceptualization Data curation Formal analysis Investigation Methodology Supervision Writing – original draft Writing – review & editing Funding acquisition a ⁎ Antonio Leyva–Pérez a ⁎ a Instituto de Tecnología Química (Universitat Politècnica de València- Agencia Estatal Consejo Superior de Investigaciones Científicas), Avda. de los Naranjos s/n, Valencia 46022, Spain Instituto de Tecnología Química (Universitat Politècnica de València- Agencia Estatal Consejo Superior de Investigaciones Científicas) Avda. de los Naranjos s/n Valencia 46022 Spain aInstituto de Tecnología Química (UPV–CSIC), Universidad Politècnica de València–Consejo Superior de Investigaciones Científicas, Avda. de los Naranjos s/n, Valencia 46022, Spain b Departamento de Química Inorgánica, Instituto de Ciencia Molecular (ICMol), Catedrático José Beltrán Martínez, 2, Universidad de Valencia, Paterna 46022, Valencia, Spain Departamento de Química Inorgánica Instituto de Ciencia Molecular (ICMol), Catedrático José Beltrán Martínez, 2, Universidad de Valencia Paterna Valencia 46022 Spain bDepartamento de Química Inorgánica, Instituto de Ciencia Molecular (ICMol), Catedrático José Beltrán Martínez, 2, Universidad de Valencia, Paterna 46022, Valencia, Spain ⁎ Corresponding authors. 1 These authors contributed equally to this work. Oxidative couplings in organic synthesis are typically performed with unrecoverable precious metal catalysts in solution. Here we show that CuCO3, Cu–supported zeolites and Cu–metal organic frameworks (MOFs) can replace AgNO3 as a catalyst for the oxidative coupling of styrenes with aryl sulfones, to give styrenyl sulfones. The single Cu atoms supported in zeolites show higher catalytic activity than the Cu salt as the basicity of the zeolite framework increases, to match the carbonate salt, and when embedded directly into a MOFs´ walls with oxamate ligands (thus with the proper electronic environment) they can be recycled for at least five times without any depletion in catalytic activity. These results showcase not only the substitution of a noble metal (Ag) by an abundant metal (Cu) in a metal–catalyzed oxidative coupling reaction, but also going from a salt to a supported solid catalyst, of high significance from a sustainable point of view. Graphical abstract Cu in the form of salt (CuCO3) and supported either on zeolites or a MOF catalyzes the oxidative coupling of styrenes with phenyl sulfone, to substitute the benchmark AgNO3 catalyst in solution. Mechanistic studies show that single atoms of Cu2+ (SACs) are the active sites. The Cu-MOF could be reused at least five times without depletion in final yield of the coupled product, despite the aggressive oxidative conditions typically employed for this reaction. Image, graphical abstract Keywords Single–atom catalyst (SAC) Oxidative coupling Copper catalysis Metal organic frameworks Zeolites Data availability Data will be made available on request. 1 Introduction The substitution of catalysts based on expensive precious metals by first–raw inexpensive metals is a high significance from a sustainable point of view, moreover if the latter can be easily recycled [1–3]. In particular, typically unrecoverable precious metal catalysts for oxidative cross–coupling reactions are difficult to either be supported on solids or be replaced by solid–supported earth–abundant metals [4–6], since the harsh reaction conditions needed for the C–H activation process are only achieved with strong oxidants, which promote the leaching of any supported metal catalyst [7–13]. In this regard, metal single atom catalysts (SACs) in microporous frameworks have shown a superior stability towards leaching compared to supported metal complexes and nanoparticles, since the constrained space of the support–embedded SAC solid allows to better retain the metal atom on the solid surface during reaction [14–16]. Here we show that the oxidative coupling of styrenes 1 with aryl sulfone 2, a reaction typically catalyzed by AgNO3 as a catalyst and 2,2,6,6–tetramethylpiperidine 1–oxyl (TEMPO)/K2S2O8 as an oxidant mixture in solution [17], can be carried out not only with simple Cu salts but also with Cu SACs in zeolites and MOFs (Fig. 1 , left), and that the latter is an effective and recyclable catalyst for the reaction. Mechanistic studies will show that AgNO3 is just a precursor of catalytically active ultrasmall Ag clusters, which are very difficult to support, while the Cu SACs act similarly in solution or supported. Thus, our approach here is based on the speciation of the catalytic metal species and goes from an unrecoverable precious metal to a recyclable common metal (Fig. 1, right). Functionalized styrenes 1 are building blocks in organic synthesis, which give access to a plethora of compounds such as substituted alkanes, cyclopropanes, polystyrenes, carbonyl compounds, and other styrenes, to name a few [18–22]. For instance, vinyl sulfones 3 are transformable to a variety of organic products after SO2 extrusion, sulfone exchange or reduction, and carbon–sulfur coupling [23,24]. However, the synthesis of vinyl sulfones 3 depends heavily on highly energetic compounds such as alkynes or tosyl hydrazones [25–27], and generally require precious metals or hypervalent iodine compounds to enable the transformation [28,29]. A direct synthesis from simple and commercially available styrenes 1 and aryl sulfone 2 is highly desirable but, to our knowledge and as mentioned above, the more efficient catalytic system reported so far for this transformation is based on unrecoverable Ag salts [17]. In our hands, the reaction in Fig. 1 with AgNO3 showed reproducibility problems. Different sources of AgNO3 gave inconsistent results and, furthermore (see below), the exposure of the reaction to visible light is key for the reaction, thus a new source of irreproducibility under standard reaction conditions was found. We show here that CuCO3 can play the role of AgNO3 in this transformation, without those irreproducibility issues. Comparative mechanistic studies will show that CuCO3 activates the styrene derivative as AgNO3 does, indeed, so strongly that can easily trigger other secondary reactions [30–32]. The catalytic activity of Cu in solution for a coupling reaction via C–H activation is not surprising [33], however, opens the door in this case for the design of solid catalysts. Once we know that Cu2+ can catalyze the reaction, different Cu–zeolites and a Cu–MOF were prepared and tested in the reaction, and the Cu SAC in the MOF showed a high catalytic efficiency and recyclability, to give high yields for different vinyl sulfones 3. Comparatively, AgNO3 in solution requires higher metal loadings to generate in–situ Ag clusters and effect the transformation, which avoids an easy supporting. These results illustrate how a particular first–raw transition metal SAC can play the catalytic role of a noble metal salt in solution with higher efficiency, better reproducibility and translation to a recyclable solid. 2 Materials and methods General. Reagents were obtained from commercial sources (Merck–Aldrich) and used without further purification otherwise indicated. Physical techniques for organic compound characterization. GC and GC–MS chromatography were performed in chromatographs with 25 m capillary columns filled with 1 or 5 wt % phenylsilicone (Shimadzu GC–2025, Agilent GC 6890 N coupled with Agilent MS–5973). 1H, 13C, 19F and DEPT nuclear magnetic resonance (NMR) spectra were recorded at room temperature on 300 or 400 MHz spectrometers using the appropriate deuterated solvent. Absorption spectra were recorded on a Cary 300 UV–Vis spectrophotometer (UV0811M209, Varian) in 1 cm wide cuvettes, and fluorescence spectra were obtained with a LP S–220B (Photon Technology International) equipped with 75 W Xe lamp. Fourier transform infrared spectroscopy (FT–IR) spectra were recorded on a spectrophotometer equipped with an attenuated total reflection instrument (JASCO FT/IR–4700), by dropping a small sample of the dissolved organic compound in dichloromethane on the ATR crystal and measuring from 400 to 4000 cm–1 after leaving to evaporate the solvent for 1 min. Physical techniques for solid characterization. The metal content of the samples was determined by inductively coupled plasma–atomic emission spectroscopy (ICP–AES), after disaggregating the solids in aqua regia and later diluted before analysis. Diffuse reflectance UV–Visible spectrophotometry (DR UV–vis) in the region comprised between 190 and 1100 nm was recorded at room temperature on a spectrophotometer equipped with an integrating sphere. The mixture was contained in a quartz cell with 1 mm path length; the layer can therefore be regarded as infinitely thick, as required by the Kubelka–Munk theory. Absorbance values (Al) were calculated from reflectance ones (Rl) according to the Kubelka–Munk transformation: Al = (1–Rl) 2/2Rl. X–ray photoelectron spectroscopy (XPS) measurements were performed on a SPECS spectrometer equipped with a Phoibos 150 MCD–9 analyser using a non–monochromatic Mg KR (1,253.6 eV) X–ray source working at 50 W. The C1s peak has been set at 284.5 eV as the internal reference for the peak positions in the XPS spectra. X–Ray diffraction (XRD) spectra of the support and supported catalyst were recorded in a CubiX PRO (PAN Analytical) spectrometer, with a Cu K(α) radiation source, 1.5406 Å wavelength. FT–IR spectra were recorded on a spectrophotometer equipped with an attenuated total reflection instrument (JASCO FT/IR–4700), by dropping the solid on the ATR crystal, pressing, and measuring from 400 to 4000 cm–1. Electronic paramagnetic resonance (EPR) measurements were performed at -170 °C using an EMX–12 Bruker spectrometer working at the X band, with a frequency modulation of 100 kHz and 1G amplitude. Portions at different times of each reactions were introduced inside an EPR quartz probe cell and were measured. Raman spectra were recorded at room temperature with a 514 nm laser excitation on a Renishaw Raman Spectrometer (“in via”) equipped with a CCD detector. Typical reaction procedure for oxidative styrene couplings with Ag catalysts in solution (reproductions). Product 3a was prepared following the reaction scheme in Fig. 1. Styrene 1a (1 eq, 0.4 mmol) and sulfone 2 (1 eq, 0.4 mmol) were introduced in a glass reactor equipped with a magnetic stirrer, together with K2S2O8 (2 eq, 0.8 mmol), TEMPO (0.2 eq, 0.08 mmol), AgNO3 (15 mol%, 0.06 mmol) and 2 mL of toluene, and allowed to react overnight (18 h) at 100 °C under N2 atmosphere. After that time, the resulting mixture is quenched by the addition of water, extracted with dichloromethane and dried over Na2SO4. The products obtained are characterized by GC–MS. Typical reaction procedure for oxidative styrene couplings with Cu catalysts in solution. The reaction procedure is the same as above for AgNO3, only that the silver catalyst (15 mol%) is replaced by the required amount of copper catalyst. Monitoring of the Ag–catalyzed coupling reaction by UV–Vis absorption and UV–Visible emission (fluorimetry) spectrophotometry. The photophysical measurements were performed at room temperature in a quartz cell of 1.0 cm optical path length. Aliquots of the reaction were taken at different reaction times and placed in the quartz cell, which was then closed to measure the corresponding absorption and fluorescence spectrum on a Cary 300 UV–Vis and a LP S–220B spectrophotometer respectively, the latter equipped with 75 W Xe lamp and irradiating between 240 and 260 nm. Determination of the reaction orders during the Ag and Cu–catalyzed reactions. To determine the rate equations, five kinetics were performed, following the reaction procedure detailed above. For each reagent, the amount of one of them is varied while the other reagent amounts remain constant, in order to determine its reaction order under pseudo–stationary conditions. The procedure is repeated for each reagent to obtain the reaction rate. Kinetic experiments with deuterated styrene. To determine the kinetic isotopic effect (KIE), kinetics with deuterated styrene–d8 were performed, following the reaction procedures described above with Ag or Cu catalysts in solution. General procedure for the preparation of basic zeolites and Cu2+ incorporation. Commercially available H–USY zeolite (Si/Al= 15) was treated with a 1M aqueous solution of Cs+ acetate, to give the corresponding Cs+–zeolite (CsY). Then, the HY, NaY and CsY zeolites were cationically exchanged with an aqueous solution of Cu(OAc)2. Finally, the zeolites were calcined at 450 °C. General procedure for the preparation of Ni–NaY zeolite. Commercially available Y zeolite, in Na+–form, was treated with a 0.1M aqueous solution of Ni2+ acetate at room temperature for 20 h. Then the zeolite was filtered, washed with deionized water and dry at 100 °C, to give the corresponding Ni–zeolite. In this way, Ni2+ is homogenously distributed along the zeolite channels and cavities. Final Ni content is 4.5 wt%. Reaction procedure for styrene couplings with Cu solid catalysts. Reagent styrene (1 eq, 0.05 mmol) and aryl sulfone (1 eq, 0.05 mmol) were introduced in a small glass vial with a magnetic stirrer, together with K2S2O8 (2 eq, 0.1 mmol), TEMPO (0.2 eq, 0.01 mmol), Cu solid catalysts (5 mg, 15 mol% Cu) and 0.25 mL of toluene and allowed to react for 24 h under N2 at 100 °C. After that time, the resulting mixture is quenched by the addition of water, extracted with dichloromethane and dried over Na2SO4. Products are characterized by GC–MS. Leaching tests. Following the general reaction procedure above, the hot reaction mixture was filtered at intermediate conversion, through a 0.25 μm Teflon filter. Filtrates were placed into a new glass reactor equipped with a magnetic stirrer and fresh insoluble aryl sulfone and K2S2O8, and placed under N2 and reaction temperature. The filtrates were periodically analyzed by GC, comparing the results obtained with the solid catalyst still in. Typical reaction procedure for reusing. Reuses of the Cu solid catalyst were performed after separating the solids at the end of reaction by centrifugation and washing the solid mixture with deionized water and methanol (three times) to remove excess styrene, aryl sulfone, TEMPO, K2S2O8, and any soluble product. Subsequently, the Cu solid catalyst is dried in oven at 100 °C overnight and directly use in the next reaction. 3 Results and discussion 3.1 Oxidative coupling of styrene 1a with aryl sulfone 2 catalyzed by Cu salts 3.1.1 Catalyst screening with different first–raw transition metal salts: from Ag to Cu Table 1 shows the catalytic results for the synthesis of vinyl sulfone 3a with different metal catalysts, after performing the reaction under the optimized reaction conditions reported in the literature but exposing or not the reaction mixture to visible light [17]. The reaction barely proceeds in the absence of any metal (entries 1–2), however, it does proceed when AgNO3 is in the presence of light, to give a yield of 3a as reported [17]. However, reproductions with different commercial AgNO3 batches gave disparate results, most of them disappointing, with yields <20 %. The reaction with the catalytically active AgNO3 batches was then performed in the absence of light, and the reaction did not work in any case (entry 4). These results indicate that the Ag–catalyzed reaction is very sensitive to the Ag source employed and the presence or not of light, suggesting that AgNO3 is not the truly catalyst of the oxidative coupling reaction but just a precursor. To further study this hypothesis, the reaction was in–situ monitored by absorption (UV–vis) and emission (fluorescence) UV–Vis spectroscopy (Figs S1 and S2, respectively) [34]. The results show that ultrasmall Ag clusters [35], but not Ag nanoparticles [36], are rapidly formed under the successful reaction conditions, which indicate that AgNO3 evolves to catalytically active ultrasmall clusters. In accordance with this, a house–made Ag on Al2O3 catalyst, composed of supported Ag nanoparticles with an average size >5 nm (Fig. S3) [36], was completely inactive for the reaction, and another metal salt prone to form ultrasmall clusters in solution such as AuCl [37,38], showed significant yields of the coupling product 3a (Table S1). These results support that AgNO3 evolves to catalytically active Ag clusters under very particular reaction conditions, which severely hampers the design of a solid–supported Ag catalyst for the oxidative coupling. With these results in hand, we turned our attention to first–raw metal catalysts, where the action of visible light and the formation of clusters during reaction should be less relevant. Mn(OAc)3 (entry 5), Fe2(SO4)3 and other Fe salts (entry 6 and Table S1), Ni salts (entries 7–8) and Co salts (entries 9–12) showed low to moderate catalytic results. Remarkably, CuCO3 gave consistently a 53 % yield of the coupling product 3a (entry 15). Several reproductions gave similar results. Other Cu salts (CuCl, CuCl2,…) were less active than CuCO3 (Table S1). It must be noticed that water must play a role in the reaction, since the use of 3Å molecular sieves together with either CuCO3 or AgNO3 inhibited the product formation. 3.1.2 Substrate scope CuCO3 can now be employed as a catalyst for the oxidative cross–coupling reaction of different styrene derivatives with phenyl sulfone 2 (Fig. 2 ), under the reaction conditions shown above (i.e. Table 1). The results show that different functionalities such as methyl (3b–c), halides (3d–i), ester (3j), aldehyde (3k), ether (3l) and nitro (3m), in different positions of the aryl ring including the sterically encumbered ortho position (3c,i) are tolerated during reaction, to give consistent yields around 50–60 %. The cases where the yield is low roughly correspond to the more electron withdrawing styrenes (i.e. products 3f, 3k and 3m; with CF3, COH and NO2 substituting groups, respectively), which can be due to an inefficient coupling with the somewhat more electrophilic sulfonyl radical. 3.1.3 Catalytic active species of Ag and Cu Experiments focused to better understanding the reasons why CuCO3 can substitute AgNO3 as a catalyst for the oxidative coupling of 1a and 2 in solution, were then accomplished. First, comparative kinetics plots for AgNO3 and CuCO3, under exactly the same reaction conditions, show that the initial rate for CuCO3 (thus the initial turnover frequency, TOF0) is nearly the double that AgNO3, without considering the aggregation of Ag, with >95% selectivity towards product 3a in both cases (Fig. 3 ). The small amount of by–products found correspond to dimers and trimers of styrene 1a [30]. The kinetic points for AgNO3 are the best obtained in our hands during a kinetic study while, in contrast, the CuCO3 results were highly reproducible. These results confirm the feasibility of CuCO3 to substitute AgNO3 as an effective catalyst for the oxidative coupling of styrene 1a with sulfone 2. The rate equation for both AgNO3 and CuCO3–catalyzed reactions was then determined from the initial rates of kinetic experiments, after varying the concentration of each reagent during reaction, since induction times are not present in the kinetic profile. The results (Fig. S4 for AgNO3 and Fig. S5 for CuCO3) unveiled different rate equations for each metal catalyst, as shown in Eq. (1) and (2). (1) v0= kexp[Ag]2[TEMPO][2][1a]−2 for AgNO3 (2) v0= kexp´[K2S2O8][2][1a]−2 for CuCO3 It can be seen that the reaction rate of the AgNO3–catalyzed reaction is directly proportional to the square of the Ag concentration, in good agreement with the formation of ultrasmall Ag2 dimers during reaction [34,39]. In contrast, the CuCO3–catalyzed reaction follows a linear dependence with the concentration of K2S2O8 and aryl sulfone 2, and an inverse linear dependence with styrene 1a. The concentration of TEMPO and CuCO3 does not influences the initial reaction rate for Cu, and can be included in the experimental constants kexp´. These rate equations are giving some information about the reaction mechanism. In one hand, the fact that the reaction rate is inversely proportional to styrene 1a for both catalysts reflect a strong binding and activation of 1a in the metal site, which is indeed the cause of the oligomerization of 1a. In other words, the oligomerization reaction of styrene 1a increases with the [1a]2, thus our oxidative coupling decreases. In the other hand, the relative catalytic behaviour of CuCO3 and AgNO3 towards 1a is opposite, and while increasing the amount of CuCO3 does not influence the reaction rate for the oxidative cross coupling, the increase in the amount of AgNO3 increases the reaction rate. Indeed, the linear dependence of the reaction rate with [Ag]2 confirms the need of agglomerating Ag during reaction to be catalytically active, thus explaining the high loadings of Ag required in solution. The reaction with Ag is linearly dependent of [TEMPO], which strongly indicates a radical activation of 1a. Electronic paramagnetic resonance (EPR) experiments showed the formation of the PhSO2 radical for the Ag–catalyzed reaction (Fig. S6) [40]. Besides, the EPR experiments also showed the formation of the hydroperoxide radical HOO·, which explains the need of having some water during reaction, and the disappearance of TEMPO during the first minutes of reaction. The formation of HOO· could led to some undesired by–reactions under aerobic conditions, and to check that, the coupling reaction was repeated under an O2 atmosphere [41,42]. The results showed the formation of ketone 4a instead of the alkene product 3a (Fig. S7), supporting the formation of a benzyl radical intermediate [43–46]. A Hammett plot for Cu (Fig. S8) shows a V–shaped curve after testing different p–substituted styrenes, with increasing electron richness. The slope values are ρmax= 1.1078 and ρmin= 0.8169, much lower that for AgNO3 (ρmax=2.6 and ρmin=2.5) [34,39], which indicates that the former does not depend much in the styrene electronics. The different dependency on substrate electronics of the two metal catalysts can be quantified, since the V–shaped curve indicates the adaptability of the metal catalyst to the substrate through the “adapted sensitivity constant” (ρ adap) and the “substrate electronics adaptability of the catalyst” value (SEAC) [34]. For AgNO3, these values were ρ adap= 5.18 and SEAC= 96%, while for CuCO3 these values are ρ adap= 0.29 and SEAC= 13%. The difference is so high that one can soundly affirm that the styrene electronics has much more influence on the Ag–catalyzed than in the Cu–catalyzed mechanism. The kinetic isotopic effect (KIE) was then measured for both metal catalysts, employing styrene–d8 (1a-d8 ) as a substrate. The results (Fig. S9) show a KIE= 1.38 for AgNO3 and a KIE= 1.16 for CuCO3, under exactly the same reaction conditions. It is clear that, for CuCO3, the breaking of the C–H bond does not participate in the rate-determining step of the reaction. For AgNO3, the contribution of the C–H bond in the reaction rate is perhaps significant, although minor anyway. The KIE results are consistent with an early rate-determining step during the oxidative coupling, where the key reactants are sulfone 2 and the metal catalyst. The combined kinetic, EPR and reactive experiments allow us to propose a plausible mechanism for the metal (CuCO3 or AgNO3)–catalyzed reaction (Fig. 4 ). The first step of the reaction is the formation of the phenyl sulfonyl radical 2·, catalyzed by the metal salt. This radical formation is the rate–determining step (rds) for CuCO3, since the corresponding equation rate (Eq. (2) above) only shows 2 and K2S2O8 as the participating reagents. In line with this, the styrene electronics is not relevant (Hammett plot in Fig. S8) and any KIE is not observed (Fig. S9). In contrast, the rds for AgNO3 can be considered the addition–elimination of TEMPO to the intermediate coupled species between 1a and 2·, since the corresponding equation rate (Eq. (1) above) shows also TEMPO, besides 2 and K2S2O8, as a participating reagent for the reaction rate. In line with this proposal, TEMPO disappears in the initial points of the kinetic curve (∼2 h, Fig. S6), the styrene electronics is relevant during Ag catalysis according to the Hammett plot [34] and the KIE is somewhat significant (Fig. S9). As a further indirect probe, O2 can replace TEMPO during the Cu–catalyzed reaction to capture the intermediate coupled radical, to form ketone 4a (Fig. S7), since Cu is much active than Ag in activating the O=O bond. Notice that the metal species for CuCO3 is composed by one single atom, while AgNO3 evolves to a dimer, and that in both cases the dimerization reaction of 1a competes, which is also reflected in the equation rate. 3.2 Oxidative coupling of styrenes 1 with aryl sulfone 2 catalyzed by Cu2+–supported catalysts 3.2.1 Zeolites as supports for Cu2+ and Cu+ SACs In view that a simple Cu2+ salt such as CuCO3 is able to catalyze the coupling of styrenes 1a–m with aryl sulfone 2, we decided to explore some Cu2+–supported catalysts where the structure of the solid could somehow substitute the action of the CO3 2– anion. For that, we used zeolites with increasing order of basicity, in this case zeolites H–Y, Na–Y and Cs–Y. The latter provides a pH ∼11, similar to carbonates [47]. The Cu2+–supported zeolites were prepared by cationic exchange of the corresponding USY zeolite with the Cu(OAc)2 salt, using a solution of Cu(OAc)2 in water, since this methodology assures a good dispersion of the Cu2+ cations across the zeolite surface. Notice that Cu(OAc)2 is barely active as a catalyst under homogeneous reaction conditions for the oxidative coupling (Table S1), thus any further catalytic activity should come from the new Cu–zeolite active site. ICP–AES measurements show that the USY zeolites incorporate between 3–10 wt% of Cu depending on the zeolite (Table S2, entries 1–4). While zeolite Na–Y readily exchanges Na+ by Cu2+, H–Y and Cs–Y are more reluctant to the exchange. All zeolites were calcined at 450 °C in an oven to remove the volatiles, and the resulting materials showed the expected blue color for supported Cu2+ species. Powder X–ray diffraction (XRD) measurements confirmed the stability of the zeolite framework after incorporation of Cu2+ (Fig. S10), without any peak corresponding to copper oxide nanoparticles [48]. Diffuse reflectance UV–Visible spectrophotometry (DR UV–vis, Fig. S11) shows the appearance of the expected absorption band for Cu2+ atoms attached to the hydroxyl groups of the zeolite [49] and not for copper clusters [50], and the same absorption band for Cu2+ appears regardless if the calcination is performed under air or N2 atmosphere. In order to confirm the exclusive presence of single Cu2+ cations supported on the hydroxyl groups of the zeolite framework, X–ray photoelectron spectroscopy (XPS), Raman and EPR measurements were performed to the calcined Cu–NaY zeolite. The deconvoluted signals for Cu 2p1/2 and Cu 2p3/2 in XPS (Fig. S12) show the only presence of Cu2+ species, since a binding energy of ∼935 eV for the Cu 2p3/2 signal and the quantitative presence of the satellite signal only visible for Cu2+, and not for either Cu+ or Cu0, is consistent with Cu2+ [51]. Besides, the Raman spectrum (Fig. S13) shows the presence of a peak at 420 cm−1, assignable to atomically isolated Cu2+ [52], and the EPR spectrum of calcined Cu-NaY (Fig. S14) clearly shows the expected signal and parameters for isolated Cu2+ cations bound to the OH groups of the zeolite framework (g ∥ = 2.39 G) [49,53]. All these results strongly support that the main species in the zeolites are atomically dispersed Cu2+ bound to the hydroxyl zeolite groups, and not reduced species, clusters or copper oxide. The catalytic results for the oxidative cross–coupling reaction of styrene 1a with phenyl sulfone 2 with the Cu2+-supported zeolites are shown in Table 2 . The pristine zeolites did not catalyze the reaction. It can be seen that the three Cu–zeolites tested gave good yields of product 3a (56–76%), even better than CuCO3 in solution under exactly the same reaction conditions (53% of 3a), and the more basic zeolite gave the best result (compare entries 1–3). Thus, the reactive trend follows the basicity order for the zeolite, the best when the zeolite framework compares to carbonate in terms of basicity. Given that the zeolites may somewhat modify the pH when exchanging the corresponding cations by Cu2+, we also prepared a Cu2+–zeolite by impregnation, instead of cationic exchange, thus fully maintaining the pH of the original zeolite. Here, CuCl2 was employed as Cu2+ source, with the same Cu loading of the exchange zeolite, in order to double check the effect of the zeolite on the catalytic Cu2+ site regardless the precursor salt employed [as for Cu(OAc)2, CuCl2 is not catalytically active under homogeneous reaction conditions, see Table S1]. The catalytic result found for CuCl2–NaY is very similar to Cu–NaY (66 vs 70 % yield of 3a, entry 4). In order to further exclude the possibility that CuO clusters may be formed inside the CuCl2–NaY, the zeolite was calcined under N2 and the corresponding DR–UVvis was recorded (Fig. S11), confirming the absence of Cu clusters but the presence, in this case, of single Cu+ cations as the main Cu species. The catalytic result for the CuCl2–NaY before and after calcination under N2 zeolite is identical, in good agreement with the redox switch between single Cu2+ and Cu+ cations during the catalytic cycle (see Fig. 4 above). These results, together, indicate that discrete monoatomic Cu2+ SACs are the catalytic sites of the zeolites. The reusability of the zeolite catalyst was tested for the oxidative cross–coupling reaction of styrene 1a with phenyl sulfone 2. Cu–NaY was employed as a solid catalyst since its higher Cu loading enables the use of lower amounts, in weight. The results show that the yield of product 3a rapidly decreases throughout the uses of the zeolite (Fig. 5 ), from a 72 to a 24 % yield. A hot filtration test was then carried out, and the results clearly show the leaching of catalytically active species from the solid to the solution, since after filtration of the Cu–NaY catalyst at ∼30 % conversion, the yield of 3a in the solution continues increasing, to be the 52 % of the total final yield. The ICP−AES analyses (Table S3) and PXRD and XPS (Fig. S15) measurements of Cu–NaY after reaction, show how most of the copper leaches from the zeolite, although the structure of the zeolite remains unaltered. These results explain the progressive loss of catalytic activity observed in the zeolite during the reuses. 3.2.2 MOFs as a support for Cu2+ SACs The observed leaching of Cu2+ into solution during the oxidative cross–coupling reaction can be easily explained by the harsh oxidative conditions employed, where not only the TEMPO and other hydroxyl radicals present in solution but also the K+ cations provided by the K2S2O2 oxidant can migrate the atomically dispersed Cu2+ species into solution. In order to have a much robust Cu2+ solid catalyst, it would be desirable to embed the Cu2+ sites inside the framework of the solid, but keeping a suitable coordination environment to permit the catalytic cycles. Since this task is not so easy in conventional inorganic solids, the use of a MOF was here considered [54–57]. In particular, the already reported MOF of formula NiII 2{NiII 4[CuII 2(Me3mpba)2]3}·54H2O; Me3mpba4− = N,N’–2,4,6–trimethyl–1,3–phenylenebis(oxamate) (Cu–MOF, Fig. 6 ) [58–60], contains accessible Cu2+ atoms in its walls, coordinated by flexible oxamate ligands to tune and stabilize the charge of the cation, according to a plethora of characterization techniques including crystal structure determination by synchrotron X–ray diffraction [58]. Besides, this MOF contains a Cu loading >10 wt%, higher than any zeolite prepared (Table S2, entry 5), and the oxamate ligands provide a suitable coordination environment to mimic the action of either carbonates or basic zeolites. The Cu–MOF was prepared according to the reported method [58] and employed as a catalyst for the oxidative cross–coupling reaction of styrene 1a with phenyl sulfone 2. The result (Table 2, entry 5) shows that the Cu–MOF is as active as the zeolites, to give a 68% of product 3a. Remarkably, the solid MOF is reusable at least 5 times without depletion in the final yield of 3a (Fig. 7 ). A hot filtration test reveals that, after filtration of the Cu–MOF catalyst at 30% conversion, the yield of 3a continues to increase up to 60%. On the contrary, the ICP–AES analysis shows that the copper loading in the catalyst after 5 uses only decreases by ∼1 wt% (Table S3). XRD and XPS measurements of Cu–MOF after reaction (Fig. S16) confirmed the stability of the solid throughout the reuses. Hence, these results indicate that copper is redeposited after cooling at room temperature, when the reaction is finished, in what is called the boomerang effect [61], allowing the reuse of the catalyst. A kinetic study with different amounts of Cu–MOF shows that the reaction order for the solid Cu catalyst is zero, as it occurs in solution (Fig. S17). This result strongly suggests that the reaction mechanism with the solid is similar to that with Cu in solution, shown in Fig. 4 above. Regarding the scope with the solid, the catalytic results with either Cu–NaY or Cu–MOF (Fig. 8 ) show that different coupling products can be obtained in even higher yields than with the homogeneous salts. These results showcase the advantages of using a metal–supported microporous solid catalyst, such as the zeolite or a MOF,[ 62–64 ] for this reaction. Since Ni could play a catalytic role in the solid but we can not disengage Ni and Cu in the MOF, we prepared and tested as a catalyst a new solid composed of Ni supported in the NaY zeolite. The Ni content is 4.5 wt%. The catalytic result with Ni–NaY, added in the reaction with a Ni content similar to that added in the Cu–MOF (Table S4), showed that the yield of product 3a with the Ni–NaY catalyst is just 1.5 %. Thus, we can say that Ni seems to be catalytically inactive for the coupling reaction of 1a and 2 when supported, at least in the zeolite, under optimized reaction conditions. 4 Conclusions The oxidative coupling of styrenes with aryl sulfones, a representative metal–catalyzed C–H activation process in solution under strong oxidant conditions and typically catalyzed by precious metal catalysts, is here catalyzed by a simple Cu2+ salt (CuCO3). A comparative study on the reaction mechanism between Cu and Ag salts catalysts is here provided, which reveals that Cu acts as a single atom while Ag acts as a dimer, after aggregation. The Cu2+ SACs have been supported in different zeolites, and although shows a higher catalytic activity than CuCO3 when the basicity of the zeolite matches that of carbonate, the solid shows a ∼50 % leaching of catalytically active species into solution during reaction. In contrast, a MOF containing the Cu2+ SACs within its framework shows a similar catalytic activity for at least five reuses. These results showcase how to replace a catalytic system based on a precious metal by a catalytic system based on an earth–abundant metal cation, in either solution or on solids, to ultimately stabilize the SAC site in the framework of a MOF despite the highly aggressive reaction conditions. Data availability The datasets generated during and/or analysed during the current study are available from the corresponding author on reasonable request. CRediT authorship contribution statement Cristina Bilanin: Data curation, Formal analysis, Investigation, Methodology. Yongkun Zheng: Conceptualization, Data curation, Formal analysis, Investigation, Methodology. Alejandro Vidal–Moya: Formal analysis, Investigation. Emilio Pardo: Investigation, Resources, Funding acquisition. Marta Mon: Conceptualization, Data curation, Formal analysis, Investigation, Methodology, Supervision, Writing – original draft, Writing – review & editing, Funding acquisition. Antonio Leyva–Pérez: . Declaration of Competing Interest The authors declare that they have no known competing financial interests or personal relationships that could have appeared to influence the work reported in this paper. Acknowledgements Financial support by the Spanish Ministry of Science and Innovation (CEX2021−001230−S grant funded by MCIN/AEI/10.13039/501100011033) is gratefully acknowledged. This work was also supported by the MICIIN (Spain) through projects TED2021-130465B-I00, PID2020–115100GB–I00, PID2019−104778GB−I00 and “Maria de Maeztu” CEX2019−000919−M. The Generalitat Valenciana (Project PROMETEO/2021/054) is also acknowledged. E.P. acknowledges the financial support of the European Research Council under the European Union's Horizon 2020 research and innovation programme / ERC Grant Agreement No 814804, MOF–reactors. M.M. thanks MICIIN from a contract under the Juan de la Cierva program (FJC2019–040523–I). C.B. thanks ITQ/UPV–CSIC for a contract (PAID 01–20). Y.Z. thanks to the China Scholarship Council (CSC No: 202009350009) for a Ph.D. fellowship. Supplementary materials Supplementary material associated with this article can be found, in the online version, at doi:10.1016/j.mcat.2023.113786. Appendix Supplementary materials Image, application 1 References [1] J.V. Obligacion P.J. Chirik Earth–abundant transition metal catalysts for alkene hydrosilylation and hydroboration Nat. Rev. Chem. 2 2018 15 34 10.1038/s41570–018–0001–2 J.V. Obligacion, P.J. Chirik, Earth–abundant transition metal catalysts for alkene hydrosilylation and hydroboration, Nat. Rev. Chem. 2 (2018) 15–34. 10.1038/s41570–018–0001–2. [2] N. Scotti F. Zaccheria C. Evangelisti R. Psaro N. Ravasio Dehydrogenative coupling promoted by copper catalysts: a way to optimise and upgrade bio–alcohols Catal. Sci. Technol. 7 2017 1386 1393 10.1039/C6CY02670B N. Scotti, F. Zaccheria, C. Evangelisti, R. Psaro, N. Ravasio, Dehydrogenative coupling promoted by copper catalysts: a way to optimise and upgrade bio–alcohols, Catal. Sci. Technol. 7 (2017) 1386–1393. 10.1039/C6CY02670B. [3] K.S. Rodygin D.E. Samoylenko M.M. Seitkalieva K.A. Lotsman S.A. Metlyaeva V.P. Ananikov Generation, regeneration, and recovery of Cu catalytic system by changing the polarity of electrodes Green Chem. 24 2022 1132 1140 10.1039/D1GC03975J K.S. Rodygin, D.E. Samoylenko, M.M. Seitkalieva, K.A. Lotsman, S.A. Metlyaeva, V.P. Ananikov, Generation, regeneration, and recovery of Cu catalytic system by changing the polarity of electrodes Green Chem. 24 (2022) 1132–1140. 10.1039/D1GC03975J. [4] L. De Luca A. Porcheddu Microwave–assisted synthesis of polysubstituted benzimidazoles by heterogeneous Pd–catalyzed oxidative C–H activation of tertiary amines Eur. J. Org. Chem. 2011 2011 5791 5795 10.1002/ejoc.201101001 L. De Luca, A. Porcheddu, Microwave–assisted synthesis of polysubstituted benzimidazoles by heterogeneous Pd–catalyzed oxidative C–H activation of tertiary amines, Eur. J. Org. Chem. 2011 (2011) 5791–5795. 10.1002/ejoc.201101001. [5] J. Chen L. He K. Natte H. Neumann M. Beller X.–F. Wu Palladium@Cerium(IV) oxide–catalyzed oxidative synthesis of N–(2–pyridyl)indoles via C–H activation reaction Adv. Synth. Catal. 356 2014 2955 2959 10.1002/adsc.201400466 J. Chen, L. He, K. Natte, H. Neumann, M. Beller, X.–F. Wu, Palladium@Cerium(IV) oxide–catalyzed oxidative synthesis of N–(2–pyridyl)indoles via C–H activation reaction, Adv. Synth. Catal. 356 (2014) 2955–2959. 10.1002/adsc.201400466. [6] W. Kong N. Fuentes A. García–Domínguez E. Merino C. Nevado Stereoselective synthesis of highly functionalized indanes and dibenzocycloheptadienes through complex radical cascade reactions Angew. Chem. Int. Ed. 54 2015 2487 2491 10.1002/anie.201409659 W. Kong, N. Fuentes, A. García–Domínguez, E. Merino, C. Nevado, Stereoselective synthesis of highly functionalized indanes and dibenzocycloheptadienes through complex radical cascade reactions, Angew. Chem. Int. Ed. 54 (2015) 2487–2491. 10.1002/anie.201409659. [7] C. Sarkar S. Pendem A. Shrotri D.Q. Dao P. Pham Thi Mai T. Nguyen Ngoc D.R. Chandaka T.V. Rao Q.T. Trinh M.P. Sherburne J. Mondal Interface engineering of graphene–supported Cu nanoparticles encapsulated by mesoporous silica for size–dependent catalytic oxidative coupling of aromatic amines ACS Appl. Mater. Interfaces 11 2019 11722 11735 10.1021/acsami.8b18675 C. Sarkar, S. Pendem, A. Shrotri, D.Q. Dao, P. Pham Thi Mai, T. Nguyen Ngoc, D.R. Chandaka, T.V. Rao, Q.T. Trinh, M.P. Sherburne, J. Mondal, Interface engineering of graphene–supported Cu nanoparticles encapsulated by mesoporous silica for size–dependent catalytic oxidative coupling of aromatic amines, ACS Appl. Mater. Interfaces 11 (2019) 11722–11735. 10.1021/acsami.8b18675. [8] N. Sgrolli N. Imlyhen J. Volkman A.M. Raspolli–Galletti P. Serp Copper–based magnetic catalysts for alkyne oxidative homocoupling reactions Mol. Catal. 438 2017 143 151 10.1016/j.mcat.2017.05.015 N. Sgrolli, N. Imlyhen, J. Volkman, A.M. Raspolli–Galletti, P. Serp, Copper–based magnetic catalysts for alkyne oxidative homocoupling reactions, Mol. Catal. 438 (2017) 143–151. 10.1016/j.mcat.2017.05.015. [9] L. Al–Hmoud S. Bali S. Mahamulkar J. Culligan C.W. Jones On the homogeneity/heterogeneity of solid copper oxide precatalysts in the oxidative homocoupling of ethynylbenzene J. Mol. Catal. A Chem. 395 2014 514 522 10.1016/j.molcata.2014.09.010 L. Al–Hmoud, S. Bali, S. Mahamulkar, J. Culligan, C.W. Jones, On the homogeneity/heterogeneity of solid copper oxide precatalysts in the oxidative homocoupling of ethynylbenzene, J. Mol. Catal. A Chem. 395 (2014) 514–522. 10.1016/j.molcata.2014.09.010. [10] M. Al–Amin M. Arisawa S. Shuto Y. Ano M. Tobisu N. Chatani Palladium nanoparticle–catalyzed direct ethynylation of aliphatic carboxylic acid derivatives via C(sp3)–H bond functionalization Adv. Synth. Catal. 356 2014 1631 1637 10.1002/adsc.201301180 M. Al–Amin, M. Arisawa, S. Shuto, Y. Ano, M. Tobisu, N. Chatani, Palladium nanoparticle–catalyzed direct ethynylation of aliphatic carboxylic acid derivatives via C(sp3)–H bond functionalization, Adv. Synth. Catal. 356 (2014) 1631–1637. 10.1002/adsc.201301180. [11] K.A. Jantan C.Y. Kwok K.W. Chan L. Marchiò A.J.P. White P. Deplano A. Serpe J.D.E.T. Wilton–Ely From recovered metal waste to high–performance palladium catalysts Green Chem. 19 2017 5846 5853 10.1039/C7GC02678A K.A. Jantan, C.Y. Kwok, K.W. Chan, L. Marchiò, A.J.P. White, P. Deplano, A. Serpe, J.D.E.T. Wilton–Ely, From recovered metal waste to high–performance palladium catalysts, Green Chem. 19 (2017) 5846–5853. 10.1039/C7GC02678A. [12] F.F. Pary R.T. Addanki Tirumala M. Andiappan T.L. Nelson Copper(I) oxide nanoparticle–mediated C–C couplings for synthesis of polyphenylenediethynylenes: evidence for a homogeneous catalytic pathway Catal. Sci. Technol. 11 2021 2414 2421 10.1039/D1CY00039J F.F. Pary, R.T. Addanki Tirumala, M. Andiappan, T.L. Nelson, Copper(I) oxide nanoparticle–mediated C–C couplings for synthesis of polyphenylenediethynylenes: evidence for a homogeneous catalytic pathway, Catal. Sci. Technol. 11 (2021) 2414–2421. 10.1039/D1CY00039J. [13] A. Jiménez–Almarza A. López–Magano R. Mas–Ballesté J. Alemán Tuning the activity–stability balance of photocatalytic organic materials for oxidative coupling reactions ACS Appl. Mater. Interfaces 14 2022 16258 16268 10.1021/acsami.2c01646 A. Jiménez–Almarza, A. López–Magano, R. Mas–Ballesté, J. Alemán, Tuning the activity–stability balance of photocatalytic organic materials for oxidative coupling reactions, ACS Appl. Mater. Interfaces 14 (2022) 16258–16268. 10.1021/acsami.2c01646. [14] A. Bakandritsos R.G. Kadam P. Kumar G. Zoppellaro M. Medved J. Tuček T. Montini O. Tomanec P. Andrýsková B. Drahoš R.S. Varma M. Otyepka M.B. Gawande P. Fornasiero R. Zbořil Mixed–valence single–atom catalyst derived from functionalized graphene Adv. Mater. 31 2019 1900323 10.1002/adma.201900323 A. Bakandritsos, R.G. Kadam, P. Kumar, G. Zoppellaro, M. Medved, J. Tuček, T. Montini, O. Tomanec, P. Andrýsková, B. Drahoš, R.S. Varma, M. Otyepka, M.B. Gawande, P. Fornasiero, R. Zbořil, Mixed–valence single–atom catalyst derived from functionalized graphene, Adv. Mater. 31 (2019) 1900323. 10.1002/adma.201900323. [15] L. Liu A. Corma Metal catalysts for heterogeneous catalysis: from single atoms to nanoclusters and nanoparticles Chem. Rev. 118 2018 4981 5079 10.1021/acs.chemrev.7b00776 L. Liu, A. Corma, Metal catalysts for heterogeneous catalysis: from single atoms to nanoclusters and nanoparticles, Chem. Rev. 118 (2018) 4981–5079. 10.1021/acs.chemrev.7b00776. [16] N. Martín F.G. Cirujano Supported single atom catalysts for C−H activation: selective C−H oxidations, dehydrogenations and oxidative C−H/C−H couplings ChemCatChem 13 2021 2751 2765 10.1002/cctc.202100345 N. Martín, F.G. Cirujano, Supported single atom catalysts for C−H activation: selective C−H oxidations, dehydrogenations and oxidative C−H/C−H couplings, ChemCatChem 13 (2021) 2751–2765. 10.1002/cctc.202100345. [17] Q. Gui K. Han Z. Liu Z. Su X. He H. Jiang B. Tian Y. Li E–selective synthesis of vinyl sulfones via silver–catalyzed sulfonylation of styrenes Org. Biomol. Chem. 16 2018 5748 5751 10.1039/C8OB01502C Q. Gui, K. Han, Z. Liu, Z. Su, X. He, H. Jiang, B. Tian, Y. Li, E–selective synthesis of vinyl sulfones via silver–catalyzed sulfonylation of styrenes, Org. Biomol. Chem. 16 (2018) 5748–5751. 10.1039/C8OB01502C. [18] L.V.R. Reddy V. Kumar R. Sagar A.K. Shaw Glycal–derived δ–hydroxy α,β–unsaturated aldehydes (perlin aldehydes): versatile building blocks in organic synthesis Chem. Rev. 113 2013 3605 3631 10.1021/cr200016m L.V.R. Reddy, V. Kumar, R. Sagar, A.K. Shaw, Glycal–derived δ–hydroxy α,β–unsaturated aldehydes (perlin aldehydes): versatile building blocks in organic synthesis, Chem. Rev. 113 (2013) 3605–3631. 10.1021/cr200016m. [19] A.S. Grossmann T. Magauer Trihaloethenes as versatile building blocks for organic synthesis Org. Biomol. Chem. 14 2016 5377 5389 10.1039/c6ob00091f A.S. Grossmann, T. Magauer, Trihaloethenes as versatile building blocks for organic synthesis, Org. Biomol. Chem. 14 (2016) 5377–5389. 10.1039/c6ob00091f. [20] V.G. Nenajdenko A.V. Shastin V.M. Gorbachev S.V. Shorunov V.M. Muzalevskiy A.I. Lukianova P.V. Dorovatovskii V.N. Khrustalev Copper–catalyzed transformation of hydrazones into halogenated azabutadienes, versatile building blocks for organic synthesis ACS Catal. 7 2017 205 209 10.1021/acscatal.6b03196 V.G. Nenajdenko, A.V. Shastin, V.M. Gorbachev, S.V. Shorunov, V.M. Muzalevskiy, A.I. Lukianova, P.V. Dorovatovskii, V.N. Khrustalev, Copper–catalyzed transformation of hydrazones into halogenated azabutadienes, versatile building blocks for organic synthesis, ACS Catal. 7 (2017) 205–209. 10.1021/acscatal.6b03196. [21] V.A. Motornov V.M. Muzalevskiy A.A. Tabolin R.A. Novikov Y.V. Nelyubina V.G. Nenajdenko S.L. Ioffe Radical nitration–debromination of α–bromo–α–fluoroalkenes as a stereoselective route to aromatic α–fluoronitroalkenes–functionalized fluorinated building blocks for organic synthesis J. Org. Chem. 82 2017 5274 5284 10.1021/acs.joc.7b00578 V.A. Motornov, V.M. Muzalevskiy, A.A. Tabolin, R.A. Novikov, Y.V. Nelyubina, V.G. Nenajdenko, S.L. Ioffe, Radical nitration–debromination of α–bromo–α–fluoroalkenes as a stereoselective route to aromatic α–fluoronitroalkenes–functionalized fluorinated building blocks for organic synthesis, J. Org. Chem. 82 (2017) 5274–5284. 10.1021/acs.joc.7b00578. [22] F. Garnes–Portolés R. Greco J. Oliver–Meseguer J. Castellanos–Soriano M. Consuelo Jiménez M. López–Haro J.C. Hernández–Garrido M. Boronat R. Pérez–Ruiz A. Leyva–Pérez Regioirregular and catalytic Mizoroki–Heck reactions Nat. Catal. 4 2021 293 303 10.1038/s41929–021–00592–3 F. Garnes–Portolés, R. Greco, J. Oliver–Meseguer, J. Castellanos–Soriano, M. Consuelo Jiménez, M. López–Haro, J.C. Hernández–Garrido, M. Boronat, R. Pérez–Ruiz, A. Leyva–Pérez, Regioirregular and catalytic Mizoroki–Heck reactions, Nat. Catal. 4 (2021) 293–303. 10.1038/s41929–021–00592–3. [23] O. Kováč F. Zálešák D.J.Y.D. Bon L. Roiser L.V. Baar M. Waser J. Pospíšil Trisubstituted highly activated benzo[d]thiazol–2–yl–sulfone–containing olefins as building blocks in organic synthesis J. Org. Chem. 85 2020 7192 7206 10.1021/acs.joc.0c00571 O. Kováč, F. Zálešák, D. J.Y. D. Bon, L. Roiser, L.V. Baar, M. Waser, J. Pospíšil, Trisubstituted highly activated benzo[d]thiazol–2–yl–sulfone–containing olefins as building blocks in organic synthesis, J. Org. Chem. 85 (2020) 7192–7206. 10.1021/acs.joc.0c00571. [24] X. Zhang E.C.X. Ang Z. Yang C.W. Kee C.H. Tan Synthesis of chiral sulfinate esters by asymmetric condensation Nature 604 2022 298 303 10.1038/s41586–022–04524–4 X. Zhang, E.C.X. Ang, Z. Yang, C.W. Kee, C.H. Tan, Synthesis of chiral sulfinate esters by asymmetric condensation, Nature 604 (2022) 298–303. 10.1038/s41586–022–04524–4. [25] Y. Fang Z. Luo X. Xu Recent advances in the synthesis of vinyl sulfones RSC Adv. 6 2016 59661 59676 10.1039/c6ra10731a Y. Fang, Z. Luo, X. Xu, Recent advances in the synthesis of vinyl sulfones, RSC Adv. 6 (2016) 59661–59676. 10.1039/c6ra10731a. [26] X. Li Y. Xu W. Wu C. Jiang C. Qi H. Jiang Copper–catalyzed aerobic oxidative N–S bond functionalization for C–S bond formation: regio– and stereoselective synthesis of sulfones and thioethers Chem. Eur. J. 20 2014 7911 7915 10.1002/chem.201402815 X. Li, Y. Xu, W. Wu, C. Jiang, C. Qi, H. Jiang, Copper–catalyzed aerobic oxidative N–S bond functionalization for C–S bond formation: regio– and stereoselective synthesis of sulfones and thioethers, Chem. Eur. J. 20 (2014) 7911–7915. 10.1002/chem.201402815. [27] S. Mao Y.R. Gao X.Q. Zhu D.D. Guo Y.Q. Wang Copper–catalyzed radical reaction of N–tosylhydrazones: stereoselective synthesis of (E)–vinyl sulfones Org. Lett. 17 2015 1692 1695 10.1021/acs.orglett.5b00461 S. Mao, Y.R. Gao, X.Q. Zhu, D.D. Guo, Y.Q. Wang, Copper–catalyzed radical reaction of N–tosylhydrazones: stereoselective synthesis of (E)–vinyl sulfones, Org. Lett. 17 (2015) 1692–1695. 10.1021/acs.orglett.5b00461. [28] B. Das M. Lingaiah K. Damodar N. Bhunia An efficient synthesis of vinyl sulfones from alkenes and aryl sulfinates Synthesis 18 2011 2941 2944 10.1055/s–0030–1260142 B. Das, M. Lingaiah, K. Damodar, N. Bhunia, An efficient synthesis of vinyl sulfones from alkenes and aryl sulfinates, Synthesis 18 (2011) 2941–2944. 10.1055/s–0030–1260142. [29] D.P. Ojha K.R. Prabhu Regioselective synthesis of vinyl halides, vinyl sulfones, and alkynes: A tandem intermolecular nucleophilic and electrophilic vinylation of tosylhydrazones Org. Lett. 17 2015 18 21 10.1021/ol503114n D.P. Ojha, K.R. Prabhu, Regioselective synthesis of vinyl halides, vinyl sulfones, and alkynes: A tandem intermolecular nucleophilic and electrophilic vinylation of tosylhydrazones, Org. Lett. 17 (2015) 18–21. 10.1021/ol503114n. [30] J.R. Cabrero–Antonino A. Leyva–Pérez A. Corma Iron–catalysed regio– stereoselective head–to–tail dimerisation of styrenes Adv. Synth. Catal. 352 2010 1571 1576 10.1002/adsc.201000096 J.R. Cabrero–Antonino, A. Leyva–Pérez, A. Corma, Iron–catalysed regio– and stereoselective head–to–tail dimerisation of styrenes, Adv. Synth. Catal. 352 (2010) 1571–1576. 10.1002/adsc.201000096. [31] J.H. Choi J.K. Kwon T.V. RajanBabu H.J. Lim Highly efficient catalytic dimerization of styrenes via cationic palladium(II) complexes Adv. Synth. Catal. 355 2013 3633 3638 10.1002/adsc.201300864 J.H. Choi, J.K. Kwon, T.V. RajanBabu, H.J. Lim, Highly efficient catalytic dimerization of styrenes via cationic palladium(II) complexes, Adv. Synth. Catal. 355 (2013) 3633–3638. 10.1002/adsc.201300864. [32] I. Colomer R. Coura Barcelos T.J. Donohoe Catalytic hypervalent iodine promoters lead to styrene dimerization and the formation of tri– and tetrasubstituted cyclobutanes Angew. Chem. Int. Ed. 55 2016 4748 4752 10.1002/anie.201511683 I. Colomer, R. Coura Barcelos, T.J. Donohoe, Catalytic hypervalent iodine promoters lead to styrene dimerization and the formation of tri– and tetrasubstituted cyclobutanes, Angew. Chem. Int. Ed. 55 (2016) 4748–4752. 10.1002/anie.201511683. [33] J. Liu X. Wang Z. Wang Y. Yang Q. Tang H. Liu H. Huang Unlocking a self–catalytic cycle in a copper–catalyzed aerobic oxidative coupling/cyclization reaction Science 25 2022 103906 10.1016/j.isci.2022.103906 J. Liu, X. Wang, Z. Wang, Y. Yang, Q. Tang, H. Liu, H. Huang, Unlocking a self–catalytic cycle in a copper–catalyzed aerobic oxidative coupling/cyclization reaction, Science 25 (2022) 103906. 10.1016/j.isci.2022.103906. [34] J. Ballesteros–Soberanas C. Bilanin A. Leyva–Pérez Parametrization of catalytic organic reactions with convex Hammett plots ACS Org. Inorg. Au 3 2023 13 18 10.1021/acsorginorgau.2c00050 J. Ballesteros–Soberanas, C. Bilanin, A. Leyva–Pérez, Parametrization of catalytic organic reactions with convex Hammett plots, ACS Org. Inorg. Au 3 (2023) 13–18. 10.1021/acsorginorgau.2c00050. [35] J.M.J. Santillán D. Muñetón Arboleda D. Muraca D.C. Schinca L.B. Scaffardi Ligand–free few atoms Ag nanoclusters synthesis and their potential application as photocatalytic agents J. Nanotechnol. Nanomater. 1 2020 65 71 10.33696/Nanotechnol.1.009 J.M.J. Santillán, D. Muñetón Arboleda, D. Muraca, D.C. Schinca, L.B. Scaffardi, Ligand–free few atoms Ag nanoclusters synthesis and their potential application as photocatalytic agents, J. Nanotechnol. Nanomater. 1 (2020) 65–71. 10.33696/Nanotechnol.1.009. [36] D. Paramelle A. Sadovoy S. Gorelik P. Free J. Hobley D.G. Fernig A rapid method to estimate the concentration of citrate capped silver nanoparticles from UV–visible light spectra Analyst 139 2014 4855 4861 10.1039/c4an00978a D. Paramelle, A. Sadovoy, S. Gorelik, P. Free, J. Hobley, D.G. Fernig, A rapid method to estimate the concentration of citrate capped silver nanoparticles from UV–visible light spectra, Analyst 139 (2014) 4855–4861. 10.1039/c4an00978a . [37] J. Oliver–Meseguer J.R. Cabrero–Antonino I. Domínguez A. Leyva–Pérez A. Corma Small gold clusters formed in solution give reaction turnover numbers of 107 at room temperature Science 338 2012 1452 1455 10.1126/science.1227813 J. Oliver–Meseguer, J.R. Cabrero–Antonino, I. Domínguez, A. Leyva–Pérez, A. Corma, Small gold clusters formed in solution give reaction turnover numbers of 107 at room temperature, Science 338 (2012) 1452–1455. 10.1126/science.1227813. [38] J. Oliver–Meseguer A. Leyva–Pérez A. Corma Very small (3–6 atoms) gold cluster catalyzed carbon–carbon and carbon–heteroatom bond–forming reactions in solution ChemCatChem 5 2013 3509 3515 10.1002/cctc.201300695 J. Oliver–Meseguer, A. Leyva–Pérez, A. Corma, Very small (3–6 atoms) gold cluster catalyzed carbon–carbon and carbon–heteroatom bond–forming reactions in solution, ChemCatChem 5 (2013) 3509–3515. 10.1002/cctc.201300695. [39] E. Tiburcio Y. Zheng C. Bilanin J.C. Hernández–Garrido A. Vidal–Moya J. Oliver–Meseguer N. Martín M. Mon J. Ferrando–Soria D. Armentano A. Leyva–Pérez E. Pardo MOF–triggered synthesis of subnanometer Ag0 2 clusters and Fe3+ single stoms: heterogenization led to efficient and synergetic one–pot catalytic reactions J. Am. Chem. Soc. 145 2023 10342 10354 10.1021/jacs.3c02155 E. Tiburcio, Y. Zheng, C. Bilanin, J.C. Hernández–Garrido, A. Vidal–Moya, J. Oliver–Meseguer, N. Martín, M. Mon, J. Ferrando–Soria, D. Armentano, A. Leyva–Pérez, E. Pardo, MOF–triggered synthesis of subnanometer Ag02 clusters and Fe3+ single stoms: heterogenization led to efficient and synergetic one–pot catalytic reactions, J. Am. Chem. Soc. 145 (2023) 10342–10354. 10.1021/jacs.3c02155. [40] M. Ueda K. Kamikawa T. Fukuyama Y.–T. Wang Y.–K. Wu I. Ryu Site–selective alkenylation of unactivated C(sp3)−H bonds mediated by compact sulfate radical Angew. Chem. Int. Ed. 60 2021 3545 3550 10.1002/anie.202011992 M. Ueda, K. Kamikawa, T. Fukuyama, Y.–T. Wang, Y.–K. Wu, I. Ryu, Site–selective alkenylation of unactivated C(sp3)−H bonds mediated by compact sulfate radical, Angew. Chem. Int. Ed. 60 (2021) 3545–3550. 10.1002/anie.202011992 . [41] C.M. Wallen J. Bacsa C.C. Scarborough Coordination of hydrogen peroxide with late–transition–metal sulfonamido complexes Inorg. Chem. 57 2018 4841 4848 10.1021/acs.inorgchem.7b02514 C.M. Wallen, J. Bacsa, C.C. Scarborough, Coordination of hydrogen peroxide with late–transition–metal sulfonamido complexes, Inorg. Chem. 57 (2018) 4841–4848. http://doi.org/10.1021/acs.inorgchem.7b02514. [42] Y.X. Chen J.T. He M.C. Wu Z.L. Liu K. Tang P.J. Xia K. Chen H.Y. Xiang X.Q. Chen H. Yang Photochemical organocatalytic aerobic cleavage of C=C bonds enabled by charge–transfer complex formation Org. Lett. 24 2022 3920 3925 10.1021/acs.orglett.2c01192 Y.X. Chen, J.T. He, M.C. Wu, Z.L. Liu, K. Tang, P.J. Xia, K. Chen, H.Y. Xiang, X.Q. Chen, H. Yang, Photochemical organocatalytic aerobic cleavage of C=C bonds enabled by charge–transfer complex formation, Org. Lett. 24 (2022) 3920–3925. http://doi.org/10.1021/acs.orglett.2c01192. [43] R. Chawla A.K. Singh L.D.S. Yadav K2S2O8–mediated aerobic oxysulfonylation of olefins into β–keto sulfones in aqueous media Eur. J. Org. Chem. 2014 2014 2032 2036 10.1002/ejoc.201301833 R. Chawla, A.K. Singh, L.D.S. Yadav, K2S2O8–mediated aerobic oxysulfonylation of olefins into β–keto sulfones in aqueous media, Eur. J. Org. Chem. 2014 (2014) 2032–2036. 10.1002/ejoc.201301833. [44] Q. Lu J. Zhang G. Zhao Y. Qi H. Wang A. Lei Dioxygen–triggered oxidative radical reaction: direct aerobic difunctionalization of terminal alkynes toward β–keto sulfones J. Am. Chem. Soc. 135 2013 11481 11484 10.1021/ja4052685 Q. Lu, J. Zhang, G. Zhao, Y. Qi, H. Wang, A. Lei, Dioxygen–triggered oxidative radical reaction: direct aerobic difunctionalization of terminal alkynes toward β–keto sulfones, J. Am. Chem. Soc. 135 (2013) 11481–11484. http://doi.org/10.1021/ja4052685. [45] A.K. Singh R. Chawla L.D.S. Yadav A direct approach to β–keto sulfones via AgNO3/K2S2O8 catalyzed aerobic oxysulfonylation of alkenes in aqueous medium Tetrahedron Lett. 55 2014 4742 4746 10.1016/j.tetlet.2014.06.086 A.K. Singh, R. Chawla, L.D.S. Yadav, A direct approach to β–keto sulfones via AgNO3/K2S2O8 catalyzed aerobic oxysulfonylation of alkenes in aqueous medium, Tetrahedron Lett. 55 (2014) 4742–4746. 10.1016/j.tetlet.2014.06.086 [46] Y. Chen L. Xu B. Wang J. Jiang Y. Sun L. Li Copper–catalyzed aerobic oxidative cross–coupling reactions of vinylarenes with sulfinate salts: A direct approach to β–ketosulfones Tetrahedron Lett. 65 2021 152794 10.1016/j.tetlet.2020.152794 Y. Chen, L. Xu, B. Wang, J. Jiang, Y. Sun, L. Li, Copper–catalyzed aerobic oxidative cross–coupling reactions of vinylarenes with sulfinate salts: A direct approach to β–ketosulfones, Tetrahedron Lett. 65 (2021) 152794. 10.1016/j.tetlet.2020.152794. [47] A. Corma H. Garcı́a A. Leyva Controlling the softness–hardness of Pd by strong metal–zeolite interaction: cyclisation of diallylmalonate as a test reaction J. Catal. 225 2004 350 358 10.1016/j.jcat.2004.03.044 A. Corma, H. Garcı́a, A. Leyva, Controlling the softness–hardness of Pd by strong metal–zeolite interaction: cyclisation of diallylmalonate as a test reaction. J. Catal. 225 (2004) 350–358. 10.1016/j.jcat.2004.03.044. [48] S. Sobhy M.M. Elsenety M.B.I. Mohamed Y.M. Moustafa T.M. Salama Molecular dynamic simulations for interactions of oxytetracycline with copper(II)–exchanged NaY zeolite Chem. Commun. 144 2022 109829 10.1016/j.inoche.2022.109829 S. Sobhy, M. M. Elsenety, M. B. I. Mohamed, Y. M. Moustafa, T. M. Salama. Molecular dynamic simulations for interactions of oxytetracycline with copper(II)–exchanged NaY zeolite. In. Chem. Commun. 144 (2022) 109829. 10.1016/j.inoche.2022.109829. [49] K. Shimizu Y. Murata A. Satsuma Dicopper(II)–dioxygen complexes in Y zeolite for selective catalytic oxidation of cyclohexane under photoirradiation J. Phys. Chem. C 111 2007 19043 19051 10.1021/jp0767821 K. Shimizu, Y. Murata, A. Satsuma, Dicopper(II)–dioxygen complexes in Y zeolite for selective catalytic oxidation of cyclohexane under photoirradiation. J. Phys. Chem. C 111 (2007) 19043–19051. 10.1021/jp0767821. [50] J. Oliver–Messeguer L. Liu S. García–García C. Canós–Giménez I. Domínguez R. Gavara A. Doménech–Carbó P. Concepción A. Leyva–Pérez A. Corma Stabilized naked Sub–nanometric Cu clusters within a polymeric film catalyze C−N, C−C, C−O, C−S, and C−P bond–forming reactions J. Am. Chem. Soc. 137 2015 3894 3900 10.1021/jacs.5b00222 J. Oliver–Messeguer, L. Liu, S. García–García, C. Canós–Giménez, I. Domínguez, R. Gavara, A. Doménech–Carbó, P. Concepción, A. Leyva–Pérez, A. Corma, Stabilized naked Sub–nanometric Cu clusters within a polymeric film catalyze C−N, C−C, C−O, C−S, and C−P bond–forming reactions. J. Am. Chem. Soc. 137 (2015) 3894–3900. 10.1021/jacs.5b00222. [51] L. Meda G.F. Cerofolini A decomposition procedure for the determination of copper oxidation states in Cu–zeolites by XPS Surf. Interface Anal. 36 2004 756 759 10.1002/sia.1757 L. Meda, G. F. Cerofolini, A decomposition procedure for the determination of copper oxidation states in Cu–zeolites by XPS. Surf. Interface Anal. 36 (2004) 756–759. 10.1002/sia.1757. [52] P.K. Dutta R.E. Zaykoski The tetraammine copper(II) complex in zeolite Y. A Raman spectroscopic study In. Chem. 24 1985 3490 3492 10.1021/ic00215a039 P. K. Dutta, R. E. Zaykoski, The tetraammine copper(II) complex in zeolite Y. A Raman spectroscopic study. In. Chem. 24 (1985) 3490–3492. 10.1021/ic00215a039. [53] C.E. Sass L.J. Kevan Electron spin echo modulation and electron spin resonance studies of cupric ions in H–ZSM–5, Na–ZSM–5, K–ZSM–5, and CA–ZSM–5 zeolites: analysis of carbon–13 electron spin echo modulation J. Phys. Chem. 92 1988 5192 5196 10.1021/j100329a026 C. E. Sass, L. J. Kevan, Electron spin echo modulation and electron spin resonance studies of cupric ions in H–ZSM–5, Na–ZSM–5, K–ZSM–5, and CA–ZSM–5 zeolites: analysis of carbon–13 electron spin echo modulation. J. Phys. Chem. 92 (1988) 5192–5196. 10.1021/j100329a026. [54] N.T.S. Phan P.H.L. Vu T.T. Nguyen Expanding applications of copper–based metal–organic frameworks in catalysis: Oxidative C–O coupling by direct C–H activation of ethers over Cu2(BPDC)2(BPY) as an efficient heterogeneous catalyst J. Catal. 306 2013 38 46 10.1016/j.jcat.2013.06.006 N.T.S. Phan, P.H.L. Vu, T.T. Nguyen, Expanding applications of copper–based metal–organic frameworks in catalysis: Oxidative C–O coupling by direct C–H activation of ethers over Cu2(BPDC)2(BPY) as an efficient heterogeneous catalyst, J. Catal. 306 (2013) 38–46. 10.1016/j.jcat.2013.06.006. [55] I. Luz A. Corma F.X. Llabrés i Xamena Cu–MOFs as active, selective and reusable catalysts for oxidative C–O bond coupling reactions by direct C–H activation of formamides, aldehydes and ethers Catal. Sci. Technol. 4 2014 1829 1836 10.1039/C4CY00032C I. Luz, A. Corma, F.X. Llabrés i Xamena, Cu–MOFs as active, selective and reusable catalysts for oxidative C–O bond coupling reactions by direct C–H activation of formamides, aldehydes and ethers, Catal. Sci. Technol. 4 (2014) 1829–1836. http://doi.org/10.1039/C4CY00032C. [56] T. Truong G.H. Dang N.V. Tran N.T. Truong D.T. Le N.T.S. Phan Oxidative cross–dehydrogenative coupling of amines and α–carbonyl aldehydes over heterogeneous Cu–MOF–74 catalyst: A ligand– and base–free approach J. Mol. Catal. A: Chem. 409 2015 110 116 10.1016/j.molcata.2015.07.022 T. Truong, G.H. Dang, N.V. Tran, N.T. Truong, D.T. Le, N.T.S. Phan, Oxidative cross–dehydrogenative coupling of amines and α–carbonyl aldehydes over heterogeneous Cu–MOF–74 catalyst: A ligand– and base–free approach, J. Mol. Catal. A: Chem. 409 (2015) 110–116. 10.1016/j.molcata.2015.07.022 . [57] S. Elavarasan A. Bhaumik M. Sasidharan An efficient mesoporous Cu–organic nanorod for Friedländer synthesis of quinoline and click reactions ChemCatChem 11 2019 4340 4350 10.1002/cctc.201900860 S. Elavarasan, A. Bhaumik, M. Sasidharan, An efficient mesoporous Cu–organic nanorod for Friedländer synthesis of quinoline and click reactions, ChemCatChem 11 (2019) 4340–4350. 10.1002/cctc.201900860 . [58] T. Grancha J. Ferrando–Soria H.C. Zhou J. Gascon B. Seoane J. Pasán O. Fabelo M. Julve E. Pardo Postsynthetic improvement of the physical properties in a metal–organic framework through a single crystal to single crystal transmetallation Angew. Chem. Int. Ed. 54 2015 6521 6525 10.1002/anie.201501691 T. Grancha, J. Ferrando–Soria, H.C. Zhou, J. Gascon, B. Seoane, J. Pasán, O. Fabelo, M. Julve, E. Pardo, Postsynthetic improvement of the physical properties in a metal–organic framework through a single crystal to single crystal transmetallation, Angew. Chem. Int. Ed. 54 (2015) 6521–6525. 10.1002/anie.201501691. [59] R. Greco E. Tiburcio B. Palomar–De Lucas J. Ferrando–Soria D. Armentano E. Pardo A. Leyva–Pérez Click amidations, esterifications and one–pot reactions catalyzed by Cu salts and multimetal–organic frameworks (M–MOFs) Mol. Catal. 522 2022 112228 10.1016/j.mcat.2022.112228 R. Greco, E. Tiburcio, B. Palomar–De Lucas, J. Ferrando–Soria, D. Armentano, E. Pardo, A. Leyva–Pérez, Click amidations, esterifications and one–pot reactions catalyzed by Cu salts and multimetal–organic frameworks (M–MOFs), Mol. Catal. 522 (2022) 112228. 10.1016/j.mcat.2022.112228. [60] E. Tiburcio Y. Zheng M. Mon N. Martín J. Ferrando−Soria D. Armentano A. Leyva−Pérez E. Pardo Highly efficient MOF–driven silver Subnanometer clusters for the catalytic buchner ring expansion reaction Inorg. Chem. 61 2022 11796 11802 10.1021/acs.inorgchem.2c01508 E. Tiburcio, Y. Zheng M. Mon, N. Martín, J. Ferrando−Soria, D. Armentano, A. Leyva−Pérez, E. Pardo, Highly efficient MOF–driven silver Subnanometer clusters for the catalytic buchner ring expansion reaction, Inorg. Chem. 61 (2022) 11796–11802. 10.1021/acs.inorgchem.2c01508. [61] C. Baleizão A. Corma H. Garcia A. Leyva Oxime carbapalladacycle covalently anchored to high surface area inorganic supports or polymers as heterogeneous green catalysts for the suzuki reaction in water J. Org. Chem. 69 2004 439 446 10.1021/jo030302u C. Baleizão, A. Corma, H. Garcia, A. Leyva, Oxime carbapalladacycle covalently anchored to high surface area inorganic supports or polymers as heterogeneous green catalysts for the suzuki reaction in water, J. Org. Chem. 69 (2004) 439–446. 10.1021/jo030302u. [62] S. Biswas M. Maes A. Dhakshinamoorthy M. Feyand D.E. De Vos H. Garcia N. Stock Fuel purification, lewis acid and aerobic oxidation catalysis performed by a microporous Co-BTT (BTT3− = 1,3,5-benzenetristetrazolate) framework having coordinatively unsaturated sites J. Mater. Chem. 22 2012 10200 10209 10.1039/C2JM15592C S. Biswas, M. Maes, A. Dhakshinamoorthy, M. Feyand, D. E. De Vos, H. Garcia, N. Stock, Fuel purification, lewis acid and aerobic oxidation catalysis performed by a microporous Co-BTT (BTT3− = 1,3,5-benzenetristetrazolate) framework having coordinatively unsaturated sites. J. Mater. Chem. 22 (2012) 10200–10209. 10.1039/C2JM15592C. [63] A. Dhakshinamoorthy A.M. Asiri H. García Metal–organic frameworks as multifunctional solid catalysts Trends Chem. 2 2020 454 466 10.1016/j.trechm.2020.02.004 A. Dhakshinamoorthy, A. M. Asiri, H. García, Metal–organic frameworks as multifunctional solid catalysts, Trends Chem. 2 (2020) 454–466. 10.1016/j.trechm.2020.02.004. [64] A. Dhakshinamoorthy A.M. Asiri H. García Catalysis in confined spaces of metal organic frameworks ChemCatChem 12 2020 4732 4753 10.1002/cctc.202001188 A. Dhakshinamoorthy, A. M. Asiri, H. García, Catalysis in confined spaces of metal organic frameworks, ChemCatChem 12 (2020) 4732–4753. 10.1002/cctc.202001188.",
      "scopus-id": "85180419444",
      "coredata": {
        "eid": "1-s2.0-S246882312300874X",
        "dc:description": "Oxidative couplings in organic synthesis are typically performed with unrecoverable precious metal catalysts in solution. Here we show that CuCO3, Cu–supported zeolites and Cu–metal organic frameworks (MOFs) can replace AgNO3 as a catalyst for the oxidative coupling of styrenes with aryl sulfones, to give styrenyl sulfones. The single Cu atoms supported in zeolites show higher catalytic activity than the Cu salt as the basicity of the zeolite framework increases, to match the carbonate salt, and when embedded directly into a MOFs´ walls with oxamate ligands (thus with the proper electronic environment) they can be recycled for at least five times without any depletion in catalytic activity. These results showcase not only the substitution of a noble metal (Ag) by an abundant metal (Cu) in a metal–catalyzed oxidative coupling reaction, but also going from a salt to a supported solid catalyst, of high significance from a sustainable point of view.",
        "openArchiveArticle": "false",
        "prism:coverDate": "2024-01-15",
        "openaccessUserLicense": "http://creativecommons.org/licenses/by-nc-nd/4.0/",
        "prism:aggregationType": "Journal",
        "prism:url": "https://api.elsevier.com/content/article/pii/S246882312300874X",
        "dc:creator": [
          {
            "@_fa": "true",
            "$": "Bilanin, Cristina"
          },
          {
            "@_fa": "true",
            "$": "Zheng, Yongkun"
          },
          {
            "@_fa": "true",
            "$": "Vidal–Moya, Alejandro"
          },
          {
            "@_fa": "true",
            "$": "Pardo, Emilio"
          },
          {
            "@_fa": "true",
            "$": "Mon, Marta"
          },
          {
            "@_fa": "true",
            "$": "Leyva–Pérez, Antonio"
          }
        ],
        "link": [
          {
            "@_fa": "true",
            "@rel": "self",
            "@href": "https://api.elsevier.com/content/article/pii/S246882312300874X"
          },
          {
            "@_fa": "true",
            "@rel": "scidir",
            "@href": "https://www.sciencedirect.com/science/article/pii/S246882312300874X"
          }
        ],
        "dc:format": "application/json",
        "openaccessType": "Full",
        "pii": "S2468-8231(23)00874-X",
        "prism:volume": "553",
        "articleNumber": "113786",
        "prism:publisher": "The Author(s). Published by Elsevier B.V.",
        "dc:title": "Single–atom Cu catalysts for the oxidative coupling of styrenes with aryl sulfones: from salts and zeolites to MOFs",
        "prism:copyright": "© 2023 The Author(s). Published by Elsevier B.V.",
        "openaccess": "1",
        "prism:issn": "24688231",
        "dcterms:subject": [
          {
            "@_fa": "true",
            "$": "Single–atom catalyst (SAC)"
          },
          {
            "@_fa": "true",
            "$": "Oxidative coupling"
          },
          {
            "@_fa": "true",
            "$": "Copper catalysis"
          },
          {
            "@_fa": "true",
            "$": "Metal organic frameworks"
          },
          {
            "@_fa": "true",
            "$": "Zeolites"
          }
        ],
        "openaccessArticle": "true",
        "prism:publicationName": "Molecular Catalysis",
        "openaccessSponsorType": "FundingBody",
        "prism:pageRange": "113786",
        "pubType": "fla",
        "prism:coverDisplayDate": "15 January 2024",
        "prism:doi": "10.1016/j.mcat.2023.113786",
        "prism:startingPage": "113786",
        "dc:identifier": "doi:10.1016/j.mcat.2023.113786",
        "openaccessSponsorName": "Spanish Institutions 2022"
      },
      "objects": {
        "object": [
          {
            "@category": "standard",
            "@height": "423",
            "@width": "527",
            "@_fa": "true",
            "$": "https://api.elsevier.com/content/object/eid/1-s2.0-S246882312300874X-gr8.jpg?httpAccept=%2A%2F%2A",
            "@multimediatype": "JPEG image file",
            "@type": "IMAGE-DOWNSAMPLED",
            "@size": "51832",
            "@ref": "gr8",
            "@mimetype": "image/jpeg"
          },
          {
            "@category": "standard",
            "@height": "481",
            "@width": "602",
            "@_fa": "true",
            "$": "https://api.elsevier.com/content/object/eid/1-s2.0-S246882312300874X-gr2.jpg?httpAccept=%2A%2F%2A",
            "@multimediatype": "JPEG image file",
            "@type": "IMAGE-DOWNSAMPLED",
            "@size": "54432",
            "@ref": "gr2",
            "@mimetype": "image/jpeg"
          },
          {
            "@category": "standard",
            "@height": "200",
            "@width": "459",
            "@_fa": "true",
            "$": "https://api.elsevier.com/content/object/eid/1-s2.0-S246882312300874X-ga1.jpg?httpAccept=%2A%2F%2A",
            "@multimediatype": "JPEG image file",
            "@type": "IMAGE-DOWNSAMPLED",
            "@size": "33146",
            "@ref": "ga1",
            "@mimetype": "image/jpeg"
          },
          {
            "@category": "standard",
            "@height": "101",
            "@width": "809",
            "@_fa": "true",
            "$": "https://api.elsevier.com/content/object/eid/1-s2.0-S246882312300874X-gr1.jpg?httpAccept=%2A%2F%2A",
            "@multimediatype": "JPEG image file",
            "@type": "IMAGE-DOWNSAMPLED",
            "@size": "28124",
            "@ref": "gr1",
            "@mimetype": "image/jpeg"
          },
          {
            "@category": "standard",
            "@height": "78",
            "@width": "547",
            "@_fa": "true",
            "$": "https://api.elsevier.com/content/object/eid/1-s2.0-S246882312300874X-fx1.jpg?httpAccept=%2A%2F%2A",
            "@multimediatype": "JPEG image file",
            "@type": "IMAGE-DOWNSAMPLED",
            "@size": "10576",
            "@ref": "fx1",
            "@mimetype": "image/jpeg"
          },
          {
            "@category": "standard",
            "@height": "252",
            "@width": "739",
            "@_fa": "true",
            "$": "https://api.elsevier.com/content/object/eid/1-s2.0-S246882312300874X-gr7.jpg?httpAccept=%2A%2F%2A",
            "@multimediatype": "JPEG image file",
            "@type": "IMAGE-DOWNSAMPLED",
            "@size": "33937",
            "@ref": "gr7",
            "@mimetype": "image/jpeg"
          },
          {
            "@category": "standard",
            "@height": "253",
            "@width": "809",
            "@_fa": "true",
            "$": "https://api.elsevier.com/content/object/eid/1-s2.0-S246882312300874X-gr6.jpg?httpAccept=%2A%2F%2A",
            "@multimediatype": "JPEG image file",
            "@type": "IMAGE-DOWNSAMPLED",
            "@size": "93394",
            "@ref": "gr6",
            "@mimetype": "image/jpeg"
          },
          {
            "@category": "standard",
            "@height": "238",
            "@width": "736",
            "@_fa": "true",
            "$": "https://api.elsevier.com/content/object/eid/1-s2.0-S246882312300874X-gr5.jpg?httpAccept=%2A%2F%2A",
            "@multimediatype": "JPEG image file",
            "@type": "IMAGE-DOWNSAMPLED",
            "@size": "36719",
            "@ref": "gr5",
            "@mimetype": "image/jpeg"
          },
          {
            "@category": "standard",
            "@height": "360",
            "@width": "616",
            "@_fa": "true",
            "$": "https://api.elsevier.com/content/object/eid/1-s2.0-S246882312300874X-gr4.jpg?httpAccept=%2A%2F%2A",
            "@multimediatype": "JPEG image file",
            "@type": "IMAGE-DOWNSAMPLED",
            "@size": "54074",
            "@ref": "gr4",
            "@mimetype": "image/jpeg"
          },
          {
            "@category": "standard",
            "@height": "298",
            "@width": "386",
            "@_fa": "true",
            "$": "https://api.elsevier.com/content/object/eid/1-s2.0-S246882312300874X-gr3.jpg?httpAccept=%2A%2F%2A",
            "@multimediatype": "JPEG image file",
            "@type": "IMAGE-DOWNSAMPLED",
            "@size": "17846",
            "@ref": "gr3",
            "@mimetype": "image/jpeg"
          },
          {
            "@category": "thumbnail",
            "@height": "164",
            "@width": "204",
            "@_fa": "true",
            "$": "https://api.elsevier.com/content/object/eid/1-s2.0-S246882312300874X-gr8.sml?httpAccept=%2A%2F%2A",
            "@multimediatype": "GIF image file",
            "@type": "IMAGE-THUMBNAIL",
            "@size": "7931",
            "@ref": "gr8",
            "@mimetype": "image/gif"
          },
          {
            "@category": "thumbnail",
            "@height": "164",
            "@width": "205",
            "@_fa": "true",
            "$": "https://api.elsevier.com/content/object/eid/1-s2.0-S246882312300874X-gr2.sml?httpAccept=%2A%2F%2A",
            "@multimediatype": "GIF image file",
            "@type": "IMAGE-THUMBNAIL",
            "@size": "6233",
            "@ref": "gr2",
            "@mimetype": "image/gif"
          },
          {
            "@category": "thumbnail",
            "@height": "95",
            "@width": "219",
            "@_fa": "true",
            "$": "https://api.elsevier.com/content/object/eid/1-s2.0-S246882312300874X-ga1.sml?httpAccept=%2A%2F%2A",
            "@multimediatype": "GIF image file",
            "@type": "IMAGE-THUMBNAIL",
            "@size": "8735",
            "@ref": "ga1",
            "@mimetype": "image/gif"
          },
          {
            "@category": "thumbnail",
            "@height": "27",
            "@width": "219",
            "@_fa": "true",
            "$": "https://api.elsevier.com/content/object/eid/1-s2.0-S246882312300874X-gr1.sml?httpAccept=%2A%2F%2A",
            "@multimediatype": "GIF image file",
            "@type": "IMAGE-THUMBNAIL",
            "@size": "5116",
            "@ref": "gr1",
            "@mimetype": "image/gif"
          },
          {
            "@category": "thumbnail",
            "@height": "31",
            "@width": "219",
            "@_fa": "true",
            "$": "https://api.elsevier.com/content/object/eid/1-s2.0-S246882312300874X-fx1.sml?httpAccept=%2A%2F%2A",
            "@multimediatype": "GIF image file",
            "@type": "IMAGE-THUMBNAIL",
            "@size": "2331",
            "@ref": "fx1",
            "@mimetype": "image/gif"
          },
          {
            "@category": "thumbnail",
            "@height": "75",
            "@width": "219",
            "@_fa": "true",
            "$": "https://api.elsevier.com/content/object/eid/1-s2.0-S246882312300874X-gr7.sml?httpAccept=%2A%2F%2A",
            "@multimediatype": "GIF image file",
            "@type": "IMAGE-THUMBNAIL",
            "@size": "6037",
            "@ref": "gr7",
            "@mimetype": "image/gif"
          },
          {
            "@category": "thumbnail",
            "@height": "68",
            "@width": "219",
            "@_fa": "true",
            "$": "https://api.elsevier.com/content/object/eid/1-s2.0-S246882312300874X-gr6.sml?httpAccept=%2A%2F%2A",
            "@multimediatype": "GIF image file",
            "@type": "IMAGE-THUMBNAIL",
            "@size": "12588",
            "@ref": "gr6",
            "@mimetype": "image/gif"
          },
          {
            "@category": "thumbnail",
            "@height": "71",
            "@width": "219",
            "@_fa": "true",
            "$": "https://api.elsevier.com/content/object/eid/1-s2.0-S246882312300874X-gr5.sml?httpAccept=%2A%2F%2A",
            "@multimediatype": "GIF image file",
            "@type": "IMAGE-THUMBNAIL",
            "@size": "6250",
            "@ref": "gr5",
            "@mimetype": "image/gif"
          },
          {
            "@category": "thumbnail",
            "@height": "128",
            "@width": "219",
            "@_fa": "true",
            "$": "https://api.elsevier.com/content/object/eid/1-s2.0-S246882312300874X-gr4.sml?httpAccept=%2A%2F%2A",
            "@multimediatype": "GIF image file",
            "@type": "IMAGE-THUMBNAIL",
            "@size": "7693",
            "@ref": "gr4",
            "@mimetype": "image/gif"
          },
          {
            "@category": "thumbnail",
            "@height": "164",
            "@width": "212",
            "@_fa": "true",
            "$": "https://api.elsevier.com/content/object/eid/1-s2.0-S246882312300874X-gr3.sml?httpAccept=%2A%2F%2A",
            "@multimediatype": "GIF image file",
            "@type": "IMAGE-THUMBNAIL",
            "@size": "5898",
            "@ref": "gr3",
            "@mimetype": "image/gif"
          },
          {
            "@category": "high",
            "@height": "1871",
            "@width": "2333",
            "@_fa": "true",
            "$": "https://api.elsevier.com/content/object/eid/1-s2.0-S246882312300874X-gr8_lrg.jpg?httpAccept=%2A%2F%2A",
            "@multimediatype": "JPEG image file",
            "@type": "IMAGE-HIGH-RES",
            "@size": "380362",
            "@ref": "gr8",
            "@mimetype": "image/jpeg"
          },
          {
            "@category": "high",
            "@height": "2133",
            "@width": "2668",
            "@_fa": "true",
            "$": "https://api.elsevier.com/content/object/eid/1-s2.0-S246882312300874X-gr2_lrg.jpg?httpAccept=%2A%2F%2A",
            "@multimediatype": "JPEG image file",
            "@type": "IMAGE-HIGH-RES",
            "@size": "433672",
            "@ref": "gr2",
            "@mimetype": "image/jpeg"
          },
          {
            "@category": "high",
            "@height": "886",
            "@width": "2034",
            "@_fa": "true",
            "$": "https://api.elsevier.com/content/object/eid/1-s2.0-S246882312300874X-ga1_lrg.jpg?httpAccept=%2A%2F%2A",
            "@multimediatype": "JPEG image file",
            "@type": "IMAGE-HIGH-RES",
            "@size": "252623",
            "@ref": "ga1",
            "@mimetype": "image/jpeg"
          },
          {
            "@category": "high",
            "@height": "449",
            "@width": "3581",
            "@_fa": "true",
            "$": "https://api.elsevier.com/content/object/eid/1-s2.0-S246882312300874X-gr1_lrg.jpg?httpAccept=%2A%2F%2A",
            "@multimediatype": "JPEG image file",
            "@type": "IMAGE-HIGH-RES",
            "@size": "189239",
            "@ref": "gr1",
            "@mimetype": "image/jpeg"
          },
          {
            "@category": "high",
            "@height": "344",
            "@width": "2422",
            "@_fa": "true",
            "$": "https://api.elsevier.com/content/object/eid/1-s2.0-S246882312300874X-fx1_lrg.jpg?httpAccept=%2A%2F%2A",
            "@multimediatype": "JPEG image file",
            "@type": "IMAGE-HIGH-RES",
            "@size": "85823",
            "@ref": "fx1",
            "@mimetype": "image/jpeg"
          },
          {
            "@category": "high",
            "@height": "1117",
            "@width": "3270",
            "@_fa": "true",
            "$": "https://api.elsevier.com/content/object/eid/1-s2.0-S246882312300874X-gr7_lrg.jpg?httpAccept=%2A%2F%2A",
            "@multimediatype": "JPEG image file",
            "@type": "IMAGE-HIGH-RES",
            "@size": "214050",
            "@ref": "gr7",
            "@mimetype": "image/jpeg"
          },
          {
            "@category": "high",
            "@height": "1119",
            "@width": "3583",
            "@_fa": "true",
            "$": "https://api.elsevier.com/content/object/eid/1-s2.0-S246882312300874X-gr6_lrg.jpg?httpAccept=%2A%2F%2A",
            "@multimediatype": "JPEG image file",
            "@type": "IMAGE-HIGH-RES",
            "@size": "743000",
            "@ref": "gr6",
            "@mimetype": "image/jpeg"
          },
          {
            "@category": "high",
            "@height": "1053",
            "@width": "3261",
            "@_fa": "true",
            "$": "https://api.elsevier.com/content/object/eid/1-s2.0-S246882312300874X-gr5_lrg.jpg?httpAccept=%2A%2F%2A",
            "@multimediatype": "JPEG image file",
            "@type": "IMAGE-HIGH-RES",
            "@size": "234167",
            "@ref": "gr5",
            "@mimetype": "image/jpeg"
          },
          {
            "@category": "high",
            "@height": "1595",
            "@width": "2728",
            "@_fa": "true",
            "$": "https://api.elsevier.com/content/object/eid/1-s2.0-S246882312300874X-gr4_lrg.jpg?httpAccept=%2A%2F%2A",
            "@multimediatype": "JPEG image file",
            "@type": "IMAGE-HIGH-RES",
            "@size": "390423",
            "@ref": "gr4",
            "@mimetype": "image/jpeg"
          },
          {
            "@category": "high",
            "@height": "1322",
            "@width": "1710",
            "@_fa": "true",
            "$": "https://api.elsevier.com/content/object/eid/1-s2.0-S246882312300874X-gr3_lrg.jpg?httpAccept=%2A%2F%2A",
            "@multimediatype": "JPEG image file",
            "@type": "IMAGE-HIGH-RES",
            "@size": "108262",
            "@ref": "gr3",
            "@mimetype": "image/jpeg"
          },
          {
            "@category": "standard",
            "@_fa": "true",
            "$": "https://api.elsevier.com/content/object/eid/1-s2.0-S246882312300874X-mmc1.pdf?httpAccept=%2A%2F%2A",
            "@multimediatype": "Acrobat PDF file",
            "@type": "APPLICATION",
            "@size": "3381605",
            "@ref": "mmc1",
            "@mimetype": "application/pdf"
          },
          {
            "@category": "standard",
            "@_fa": "true",
            "$": "https://api.elsevier.com/content/object/eid/1-s2.0-S246882312300874X-am.pdf?httpAccept=%2A%2F%2A",
            "@multimediatype": "Acrobat PDF file",
            "@type": "AAM-PDF",
            "@size": "878155",
            "@ref": "am",
            "@mimetype": "application/pdf"
          }
        ]
      },
      "link": {
        "@rel": "abstract",
        "@href": "https://api.elsevier.com/content/abstract/scopus_id/85180419444"
      }
    }
  }
}