{
  "metadata": {
    "title": "Influence of pretreatment conditions on low-temperature CO oxidation over Pd supported UiO-66 catalysts",
    "authors": "; ; ",
    "journal": "Molecular Catalysis",
    "date": "2021-06-30",
    "doi": "10.1016/j.mcat.2021.111633",
    "abstract": "",
    "uri": "https://api.elsevier.com/content/article/pii/S2468823121002509",
    "pii": "S2468823121002509"
  },
  "fulltext": {
    "full-text-retrieval-response": {
      "scopus-eid": "2-s2.0-85106938745",
      "originalText": "serial JL 315758 291210 291744 291790 291809 31 Molecular Catalysis MOLECULARCATALYSIS 2021-05-24 2021-05-24 2021-05-24 2021-05-24 2021-06-17T07:55:17 1-s2.0-S2468823121002509 S2468-8231(21)00250-9 S2468823121002509 10.1016/j.mcat.2021.111633 S300 S300.1 FULL-TEXT 1-s2.0-S2468823121X00090 2022-12-12T23:36:12.42485Z 0 0 20210601 20210630 2021 2021-05-24T12:59:50.689128Z absattachment articleinfo articlenumber articletitlenorm authfirstinitialnorm authfirstsurnamenorm cid cids contenttype copyright crossmark dateloaded dateloadedtxt datesearch datesort dateupdated dco docsubtype doctype doi eid ewtransactionid hubeid indexeddate issn issnnorm itemstage itemtransactionid itemweight openaccess openarchive pg pgfirst pii piinorm pubdateend pubdatestart pubdatetxt pubyr sectiontitle sortorder srctitle srctitlenorm srctype ssids alllist content subj subheadings suppl tomb volfirst volissue volumelist webpdf webpdfpagecount yearnav figure table e-component body mmlmath acknowledge affil appendices articletitle auth authfirstini authfull authkeywords authlast grantnumber grantsponsor grantsponsorid highlightsabst orcid primabst ref specialabst 2468-8231 24688231 true 509 509 C Volume 509 22 111633 111633 111633 202106 June 2021 2021-06-01 2021-06-30 2021 Regular Papers article fla © 2021 Elsevier B.V. All rights reserved. INFLUENCEPRETREATMENTCONDITIONSLOWTEMPERATURECOOXIDATIONOVERPDSUPPORTEDUIO66CATALYSTS BI F 1 Introduction 2 Experimental 2.1 Materials 2.2 Catalysts preparation 2.2.1 Synthesis of the MOFs supports 2.2.3 Preparation of the supported Pd catalysts 2.3 Characterization 2.4 Catalysts test 3 Results and discussion 3.1 CO catalytic performance of the xPd-66 catalysts 3.2 Characterization of the 0.5Pd-66 catalyst with different pretreat conditions 3.3 CO catalytic performance of the 0.5Pd-66 catalyst with different pretreat conditions 3.4 In situ DRIFTS of CO adsorption and oxidation mechanism 4 Conclusion CRediT authorship contribution statement Acknowledgements Appendix Supplementary materials References DANIELS 1989 161 173 S WEI 2017 381 391 M WANG 2019 193 204 L WANG 2016 1867 1873 F VARON 1999 87 93 J ZENG 2020 K LI 2021 127870 S ZHANG 2021 X ZHANG 2016 455 460 X ERTL 2008 3524 3535 G SARKODIE 2021 149241 B ZHANG 2017 771 779 X LIU 2019 721 729 X EDDAOUDI 2002 469 472 M YANG 2020 122686 Y SHI 2020 113812 X CHEN 2020 37 49 J ZHANG 2021 122 137 X YUE 2021 116108 K RI 2021 836 846 S ZHANG 2020 38 47 X CAO 2021 189 199 M ABBASI 2020 21450 21463 F KANDIAH 2010 6632 6640 M PLATEROPRATS 2016 4178 4185 A ZHANG 2016 2900 2908 F ZHANG 2020 4350 4360 Z YAZDI 2017 13966 13970 A BI 2020 118767 F YANG 2021 148928 T FENG 2020 109858 J GHAEDI 2017 395 403 H ZHANG 2019 140 150 X VALENZANO 2011 1700 1718 L ZHANG 2019 103405 X ZHANG 2020 147320 C WANG 2021 446 459 Y LIN 2020 3206 3213 Y NING 2018 135 142 L ODOOMWUBAH 2019 110558 T JIANG 2019 167 172 H CHEN 2019 57 60 J OSAKI 2019 110498 T KIM 2020 111014 H GUO 2020 358 365 L BI 2020 11 20 F AFZAL 2017 692 703 S ZHANG 2020 110701 X PENG 2018 462 470 R SONG 2006 3027 3037 H KON 2013 63 71 K ZHANG 2019 37 45 L PUIGDOLLERS 2017 1119 1127 A LI 2008 6567 6576 J YANG 2018 1 7 X ZHAO 2019 143579 Q LIU 2020 4240 X MA 2019 8404 8412 Y WEAVER 2017 7319 7331 J MARTIN 2014 1118 1128 N SONG 2020 891 898 S ZHANG 2019 4538 4551 Q ABDELMOEMEN 2016 160 179 A TANKOV 2012 831 839 I BIX2021X111633 BIX2021X111633XF 2023-05-24T00:00:00.000Z 2023-05-24T00:00:00.000Z http://creativecommons.org/licenses/by-nc-nd/4.0/ © 2021 Elsevier B.V. All rights reserved. 2021-06-05T23:39:31.065Z http://vtw.elsevier.com/data/voc/AddOnTypes/50.7/aggregated-refined Natural Science Foundation of Shanghai 19ZR1434900 Natural Science Foundation of Shanghai http://data.elsevier.com/vocabulary/SciValFunders/100007219 http://sws.geonames.org/1814991/ National Natural Science Foundation of China 12075147 21906104 NSFC National Natural Science Foundation of China http://data.elsevier.com/vocabulary/SciValFunders/501100001809 http://sws.geonames.org/1814991/ This work was sponsored financially by the National Natural Science Foundation of China (No. 21906104 ， 12075147 ) and Natural Science Foundation of Shanghai ( 19ZR1434900 ). https://doi.org/10.15223/policy-017 https://doi.org/10.15223/policy-037 https://doi.org/10.15223/policy-012 https://doi.org/10.15223/policy-029 https://doi.org/10.15223/policy-004 item S2468-8231(21)00250-9 S2468823121002509 1-s2.0-S2468823121002509 10.1016/j.mcat.2021.111633 315758 2021-06-17T10:37:19.103434Z 2021-06-01 2021-06-30 1-s2.0-S2468823121002509-main.pdf https://s3-eu-west-1.amazonaws.com/prod-ucs-content-store-eu-west/content/pii:S2468823121002509/MAIN/application/pdf/710f071fb16574a0dc79383b5849b298/main.pdf main.pdf pdf true 4909749 MAIN 10 1-s2.0-S2468823121002509-main_1.png https://s3-eu-west-1.amazonaws.com/prod-ucs-content-store-eu-west/content/pii:S2468823121002509/PREVIEW/image/png/e32d83687a4bf1db5ba97cedb8470d05/main_1.png main_1.png png 59002 849 656 IMAGE-WEB-PDF 1 1-s2.0-S2468823121002509-gr5.jpg https://s3-eu-west-1.amazonaws.com/prod-ucs-content-store-eu-west/content/pii:S2468823121002509/gr5/DOWNSAMPLED/image/jpeg/75343a16dd0822fc26a0e2ebc1082df7/gr5.jpg gr5 gr5.jpg jpg 53789 335 620 IMAGE-DOWNSAMPLED 1-s2.0-S2468823121002509-gr6.jpg https://s3-eu-west-1.amazonaws.com/prod-ucs-content-store-eu-west/content/pii:S2468823121002509/gr6/DOWNSAMPLED/image/jpeg/e48dc9a4df9950e778706d6118c3afa3/gr6.jpg gr6 gr6.jpg jpg 46614 267 643 IMAGE-DOWNSAMPLED 1-s2.0-S2468823121002509-gr3.jpg https://s3-eu-west-1.amazonaws.com/prod-ucs-content-store-eu-west/content/pii:S2468823121002509/gr3/DOWNSAMPLED/image/jpeg/13d5c474e6d1ae12b2ec2daf8a08961d/gr3.jpg gr3 gr3.jpg jpg 135554 470 706 IMAGE-DOWNSAMPLED 1-s2.0-S2468823121002509-gr4.jpg https://s3-eu-west-1.amazonaws.com/prod-ucs-content-store-eu-west/content/pii:S2468823121002509/gr4/DOWNSAMPLED/image/jpeg/ffc5ed2b8d08731207e55a36c14e88c4/gr4.jpg gr4 gr4.jpg jpg 67858 339 641 IMAGE-DOWNSAMPLED 1-s2.0-S2468823121002509-fx1.jpg https://s3-eu-west-1.amazonaws.com/prod-ucs-content-store-eu-west/content/pii:S2468823121002509/fx1/DOWNSAMPLED/image/jpeg/e4cd31f0b0f2e41efd9974196b95d5c0/fx1.jpg fx1 true fx1.jpg jpg 18091 245 242 IMAGE-DOWNSAMPLED 1-s2.0-S2468823121002509-gr7.jpg https://s3-eu-west-1.amazonaws.com/prod-ucs-content-store-eu-west/content/pii:S2468823121002509/gr7/DOWNSAMPLED/image/jpeg/c161b443fb370037051b7156fe99be30/gr7.jpg gr7 gr7.jpg jpg 114903 799 641 IMAGE-DOWNSAMPLED 1-s2.0-S2468823121002509-gr8.jpg https://s3-eu-west-1.amazonaws.com/prod-ucs-content-store-eu-west/content/pii:S2468823121002509/gr8/DOWNSAMPLED/image/jpeg/ea92dfb6df585150a45fe9d04a987708/gr8.jpg gr8 gr8.jpg jpg 130957 914 361 IMAGE-DOWNSAMPLED 1-s2.0-S2468823121002509-gr1.jpg https://s3-eu-west-1.amazonaws.com/prod-ucs-content-store-eu-west/content/pii:S2468823121002509/gr1/DOWNSAMPLED/image/jpeg/7b0902da1475a5283f2893d7d105f4be/gr1.jpg gr1 gr1.jpg jpg 44572 266 643 IMAGE-DOWNSAMPLED 1-s2.0-S2468823121002509-gr2.jpg https://s3-eu-west-1.amazonaws.com/prod-ucs-content-store-eu-west/content/pii:S2468823121002509/gr2/DOWNSAMPLED/image/jpeg/e72f3644280d310f07ea1362b75631cf/gr2.jpg gr2 gr2.jpg jpg 129537 567 651 IMAGE-DOWNSAMPLED 1-s2.0-S2468823121002509-gr5.sml https://s3-eu-west-1.amazonaws.com/prod-ucs-content-store-eu-west/content/pii:S2468823121002509/gr5/THUMBNAIL/image/gif/ad7192859f07605c6efea139ee4effc1/gr5.sml gr5 gr5.sml sml 9569 118 219 IMAGE-THUMBNAIL 1-s2.0-S2468823121002509-gr6.sml https://s3-eu-west-1.amazonaws.com/prod-ucs-content-store-eu-west/content/pii:S2468823121002509/gr6/THUMBNAIL/image/gif/4580e553bf7245d9bcd51ba6af208dbb/gr6.sml gr6 gr6.sml sml 7970 91 219 IMAGE-THUMBNAIL 1-s2.0-S2468823121002509-gr3.sml https://s3-eu-west-1.amazonaws.com/prod-ucs-content-store-eu-west/content/pii:S2468823121002509/gr3/THUMBNAIL/image/gif/d4ccc36640cca6f8abe429f91bbc28b9/gr3.sml gr3 gr3.sml sml 25915 146 219 IMAGE-THUMBNAIL 1-s2.0-S2468823121002509-gr4.sml https://s3-eu-west-1.amazonaws.com/prod-ucs-content-store-eu-west/content/pii:S2468823121002509/gr4/THUMBNAIL/image/gif/ad54eec09935a62dff1526fa79685bc4/gr4.sml gr4 gr4.sml sml 11901 116 219 IMAGE-THUMBNAIL 1-s2.0-S2468823121002509-fx1.sml https://s3-eu-west-1.amazonaws.com/prod-ucs-content-store-eu-west/content/pii:S2468823121002509/fx1/THUMBNAIL/image/gif/53026fe58530669d80655b2cbf5f8845/fx1.sml fx1 true fx1.sml sml 11163 164 162 IMAGE-THUMBNAIL 1-s2.0-S2468823121002509-gr7.sml https://s3-eu-west-1.amazonaws.com/prod-ucs-content-store-eu-west/content/pii:S2468823121002509/gr7/THUMBNAIL/image/gif/c30b7ac325b663382aa7c5ddd0aceb40/gr7.sml gr7 gr7.sml sml 9209 163 131 IMAGE-THUMBNAIL 1-s2.0-S2468823121002509-gr8.sml https://s3-eu-west-1.amazonaws.com/prod-ucs-content-store-eu-west/content/pii:S2468823121002509/gr8/THUMBNAIL/image/gif/93cf6189ca11faf9b6766010ab9cdaaf/gr8.sml gr8 gr8.sml sml 8235 162 64 IMAGE-THUMBNAIL 1-s2.0-S2468823121002509-gr1.sml https://s3-eu-west-1.amazonaws.com/prod-ucs-content-store-eu-west/content/pii:S2468823121002509/gr1/THUMBNAIL/image/gif/96e171b0063c005cbc46bf100d87eaa9/gr1.sml gr1 gr1.sml sml 7937 90 219 IMAGE-THUMBNAIL 1-s2.0-S2468823121002509-gr2.sml https://s3-eu-west-1.amazonaws.com/prod-ucs-content-store-eu-west/content/pii:S2468823121002509/gr2/THUMBNAIL/image/gif/59a40d25a01a8c67a8afc8589f5b73de/gr2.sml gr2 gr2.sml sml 14513 164 188 IMAGE-THUMBNAIL 1-s2.0-S2468823121002509-gr5_lrg.jpg https://s3-eu-west-1.amazonaws.com/prod-ucs-content-store-eu-west/content/pii:S2468823121002509/gr5/HIGHRES/image/jpeg/fc59916fbb3fde8387ada06b89752fc1/gr5_lrg.jpg gr5 gr5_lrg.jpg jpg 495473 1778 3295 IMAGE-HIGH-RES 1-s2.0-S2468823121002509-gr6_lrg.jpg https://s3-eu-west-1.amazonaws.com/prod-ucs-content-store-eu-west/content/pii:S2468823121002509/gr6/HIGHRES/image/jpeg/c9abdd72db8b858be1e2c7ef70196039/gr6_lrg.jpg gr6 gr6_lrg.jpg jpg 423655 1420 3416 IMAGE-HIGH-RES 1-s2.0-S2468823121002509-gr3_lrg.jpg https://s3-eu-west-1.amazonaws.com/prod-ucs-content-store-eu-west/content/pii:S2468823121002509/gr3/HIGHRES/image/jpeg/4a47f4423dc62a37e184e3e910a4bfb4/gr3_lrg.jpg gr3 gr3_lrg.jpg jpg 1457513 2081 3127 IMAGE-HIGH-RES 1-s2.0-S2468823121002509-gr4_lrg.jpg https://s3-eu-west-1.amazonaws.com/prod-ucs-content-store-eu-west/content/pii:S2468823121002509/gr4/HIGHRES/image/jpeg/1cf61f5e1ab974776c99fc6fb9ac7b30/gr4_lrg.jpg gr4 gr4_lrg.jpg jpg 691134 1801 3408 IMAGE-HIGH-RES 1-s2.0-S2468823121002509-fx1_lrg.jpg https://s3-eu-west-1.amazonaws.com/prod-ucs-content-store-eu-west/content/pii:S2468823121002509/fx1/HIGHRES/image/jpeg/b83dbd7dc19b233682e414dc4a033687/fx1_lrg.jpg fx1 true fx1_lrg.jpg jpg 108941 1085 1071 IMAGE-HIGH-RES 1-s2.0-S2468823121002509-gr7_lrg.jpg https://s3-eu-west-1.amazonaws.com/prod-ucs-content-store-eu-west/content/pii:S2468823121002509/gr7/HIGHRES/image/jpeg/ae6f5f594b4846745add1fd66a09d675/gr7_lrg.jpg gr7 gr7_lrg.jpg jpg 1110402 4244 3404 IMAGE-HIGH-RES 1-s2.0-S2468823121002509-gr8_lrg.jpg https://s3-eu-west-1.amazonaws.com/prod-ucs-content-store-eu-west/content/pii:S2468823121002509/gr8/HIGHRES/image/jpeg/8e0bef6aeeed0f80c4b1becd33d04211/gr8_lrg.jpg gr8 gr8_lrg.jpg jpg 1239374 4853 1917 IMAGE-HIGH-RES 1-s2.0-S2468823121002509-gr1_lrg.jpg https://s3-eu-west-1.amazonaws.com/prod-ucs-content-store-eu-west/content/pii:S2468823121002509/gr1/HIGHRES/image/jpeg/44809320587376f90f09cc731ead8be6/gr1_lrg.jpg gr1 gr1_lrg.jpg jpg 425950 1412 3418 IMAGE-HIGH-RES 1-s2.0-S2468823121002509-gr2_lrg.jpg https://s3-eu-west-1.amazonaws.com/prod-ucs-content-store-eu-west/content/pii:S2468823121002509/gr2/HIGHRES/image/jpeg/e52837cc8fbcb7c0be7060169204ff45/gr2_lrg.jpg gr2 gr2_lrg.jpg jpg 1289175 3012 3460 IMAGE-HIGH-RES 1-s2.0-S2468823121002509-mmc1.docx https://s3-eu-west-1.amazonaws.com/prod-ucs-content-store-eu-west/content/pii:S2468823121002509/mmc1/MAIN/application/vnd.openxmlformats-officedocument.wordprocessingml.document/140310a7347a98117ce58491d654dd47/mmc1.docx mmc1 mmc1.docx docx 2469924 APPLICATION 1-s2.0-S2468823121002509-si1.svg https://s3-eu-west-1.amazonaws.com/prod-ucs-content-store-eu-west/content/pii:S2468823121002509/STRIPIN/image/svg+xml/d23502d3ba37b7f4196627fde9065764/si1.svg si1 si1.svg svg 6789 ALTIMG 1-s2.0-S2468823121002509-si2.svg https://s3-eu-west-1.amazonaws.com/prod-ucs-content-store-eu-west/content/pii:S2468823121002509/STRIPIN/image/svg+xml/23b4b8626a886b756b2a7c6290b845b3/si2.svg si2 si2.svg svg 11084 ALTIMG 1-s2.0-S2468823121002509-am.pdf am am.pdf pdf 1178792 AAM-PDF https://s3-eu-west-1.amazonaws.com/prod-ucs-content-store-eu-west/content/egi:100HFV08TQV/MAIN/application/pdf/95239a29485abde49ca8315fd026d806/am.pdf MCAT 111633 111633 S2468-8231(21)00250-9 10.1016/j.mcat.2021.111633 Fig. 1 The supported-Pd catalysts with different Pd loading (A) and recycle of 0.5Pd-66 for CO oxidation. Fig 1 Fig. 2 (A) XRD patterns, (B) FT-IR spectra, (C) N2 adsorption-desorption curves, (D) and (E) pore size distribution calculated by DFT and BJH methods, respectively, of the supports and supported-Pd catalysts. Fig 2 Fig. 3 TEM images of (A) 0.5Pd-66, (B) 0.5Pd-66-H, (C) 0.5Pd-66-O and (D) 0.5Pd-66-CO; (E) HR-TEM of 0.5Pd-66-O and (F) the corresponding lattice spacing of Pd NPs in (E). Fig 3 Fig. 4 The XPS spectra of the supported-Pd catalysts: (A) Pd 3d, (B) O 1 s and (C) Zr 3d Fig 4 Fig. 5 H2-TPR files of the supported-Pd catalysts: (A) 50–850 °C and (B) 50–200 °C. Fig 5 Fig. 6 CO conversion (A) and the Arrhenius plots (B) of the supported-Pd catalysts pretreated on different conditions. Fig 6 Fig. 7 Recycle performance of (A) 0.5Pd-66-H, (B) 0.5Pd-66-O and (C) 0.5Pd-66-CO for CO oxidation and the effect of WHSV (D), stability (E) and water effect (F) of 0.5Pd-66-O. Fig 7 Fig. 8 In situ DRIFTS spectra of 0.5Pd-66-O: (A) the CO adsorption spectra relative to time at 150 °C in the feed gas of 5.0 vol.% CO/He (50 mL min−1). After in the feed of 5.0 vol.% CO/He for 60 min, (B) Ar flow was introduced and the spectra was recorded relative to time and (C) 30.0 vol.% O2/Ar was introduced for CO oxidation at 150 °C. Fig 8 Table 1 Physicochemical parameters of the supports and supported-Pd catalysts. Table 1 Samples SBET a (m2/g) V b (cc/g) DDFT c (nm) DBJH d (nm) CO uptake e (μmol/g) XPS Olat/Oads Pd2+/Pd0 UiO-66 1335 0.833 0.8–1.5 1.4–4.4 – – – 0.5Pd-66 682 0.389 0.8–1.6 1.4–6.5 0.382 0.181 0.086 0.5Pd-66-H 340 0.351 1.3–2.7 1.4–6.2 0.703 0.244 0.118 0.5Pd-66-O 859 0.491 0.8–1.8 1.4–6.2 1.03 0.268 0.236 0.5Pd-66-CO 626 0.405 0.8–1.8 1.4–4.1 0.831 0.263 0.152 a BET specific surface. b Total pore volume measured at P/P0 =0.99. c The pore diameter calculated by using the DFT method. d The pore diameter calculated from the desorption branch of the isotherm using the BJH method. e The CO uptake was calculated by CO chemisorption. Table 2 Comparison of the activities of different supported Pd catalysts for CO oxidation. Table 2 Catalysts Pd loading (wt%) Preparation method Reaction rate (mL/(g•h)) CO conversion (T100%, °C) Ref. Pd/Ba-γ-Al2O3 0.5 Impregnation 30,000 170 [42] Pd/CeO2-ZrO2-Al2O3 5.0 Sol-gel 150,000 170 [43] PdSi-700 0.8 Impregnation 120,000 170 [44] Pd/SnCe2 1.0 Impregnation 180,000 170 [45] Pd/ZrO2–700 0.5 NaBH4 reduction 30,000 190 [46] Pd-66-O 0.5 EG reduction 30,000 165 This work Influence of pretreatment conditions on low-temperature CO oxidation over Pd supported UiO-66 catalysts Fukun Bi Writing - original draft a Xiaodong Zhang Writing - review & editing Conceptualization Funding acquisition a ⁎ Quanxin Du Data curation a Ke Yue Formal analysis a Ruizhuo Wang Visualization a Fei Li Visualization b Ning Liu Investigation a Yuandong Huang Writing - review & editing a ⁎ a School of Environment and Architecture, University of Shanghai for Science and Technology, Shanghai 200093, China School of Environment and Architecture University of Shanghai for Science and Technology Shanghai 200093 China aSchool of Environment and Architecture, University of Shanghai for Science and Technology, Shanghai 200093, China b School of Environmental and Chemical Engineering, Shanghai University, Shanghai 200444, P. R. China School of Environmental and Chemical Engineering Shanghai University Shanghai 200444 P. R. China bSchool of Environmental and Chemical Engineering, Shanghai University, Shanghai 200444, P. R. China ⁎ Correspoding author. Polluting gas CO has attracted wide attention because of its toxicity to human health. Thus, it is urgent for the removal of CO. Herein, a series of Pd supported on UiO-66 catalysts were prepared by ethylene glycol reduction and the supported 0.5 wt% Pd on UiO-66 (0.5Pd-66) was used to investigate the influence of pretreatment conditions. It was found that the 0.5Pd-66 pretreated under O2 atmosphere (0.5Pd-66-O) possessed the better CO oxidation performance, which could completely oxide CO to CO2 at 165 °C. A series of characterization results indicated that the surface area, reduction ability at low temperature, particle size of Pd nanoparticles and surface chemical state of the catalyst were great influenced by pretreatment conditions. The better catalytic performance of 0.5Pd-66-O was ascribed to the high surface area, better reducibility at low temperature, small Pd NPs and more Pd2+ and Olat species. More importantly, the CO oxidation mechanism was proposed by in situ diffuse reflectance infrared Fourier transform spectroscopy of CO oxidation over 0.5Pd-66-O. This work has guiding significance for studying the effect of reaction atmosphere on the structure and activity of catalyst. Graphical abstract Image, graphical abstract Keywords CO oxidation Pd-UiO-66 catalysts Pretreatment condition MOFs 1 Introduction Carbon monoxide (CO) is the most abundant and widely distributed in the atmosphere. It is the product of incomplete combustion of carbonaceous materials such as coal and petroleum [1,2]. With the continuous development of transportation and industrial and mining enterprises in various countries around the world, the consumption of coal and petroleum fuels continues to increase, and carbon monoxide emissions are also increasing. Excessive CO emissions into the air will cause air pollution [3,4]. Additionally, CO breathing into humans and animals will bind to hemoglobin in the blood and cause hypoxia, causing CO poisoning and death [5]. Thus, the removal of CO is imminent. Catalytic oxidation was considered to be one of the most efficient methods for gaseous pollutions [6-8]. Catalytic oxidation CO to CO2 at low temperature is one of the important methods for air purification and green chemistry [9]. And CO oxidation is very important not only in fundamental science but also in a wide range of industrial fields, including automobiles and fuel cell systems [10]. For the removal of CO, many catalysts, including metal oxides, noble metal and supported noble metal catalysts, have been used [11-13]. Recently, metal organic frameworks, which consist of metal ions connected by organic bridging ligands to a porous structure, have attracted much research interest due to their superiority in gas storage [14], adsorption [15,16], photocatalysis [17-19], catalytic oxidation [20,21] and so on. Because of their high porosity and designability, MOFs had also received increasing interest as a functional support material for metal nanocatalysts. For example, Cao et al. [22] prepared MOF-based Pd@UiO-66-NH2@ZnIn2S4 flower-like nanocomposites which exhibited excellent photocatalysis performance for hydrogen production. Abbasi et al. [23] synthesized Pd supported on various MOFs (MIL-101(Cr), MIL-101-NH2(Cr), Cu-BTC) which exhibited great catalytic performance for CO oxidation. Thus, MOFs are the great platform to supported noble metal for many catalytic reactions. Due to the excellent thermal stability, high surface area and great water and organic solvent resistance, Zr-based metal organic framework UiO-66 was diffusely used to support noble metal [24-26]. For example, Zhang et al. [27] prepared UiO-66 supported Pt nanocatalysts by NaBH4 and H2 reduction. The catalysts displayed good durability for CO oxidation. Yazdi et al. [28] prepared core-shell Au/CeO2 supported in UiO-66, which could completely oxidation CO to CO2 at 100 °C. Additionally, our previous work [29] found that the Pd nanoparticles (NPs) supported on UiO-66 exhibited excellent catalytic performance for toluene oxidation. Although there had been many researches on MOF loaded noble metals for CO oxidation, few researchers paid attention to the influence of pretreatment conditions or reaction atmosphere on the catalyst. In this work, a series of catalysts, Pd supported on UiO-66, were prepared. The 0.5Pd-66 (0.5 wt% Pd supported on UiO-66) was selected to investigate the effect of pretreatment conditions to Pd species and structure of UiO-66. The N2 adsorption-desorption curves, pore size distribution, H2 temperature programmed reduction, transmission electron microscope and X-ray photoelectron spectroscopy showed that different pretreatment conditions could affect the surface area, reduction ability, the size of Pd NPs and surface chemical state and further influence the catalytic performance for CO oxidation. Importantly, a possible CO oxidation mechanism was revealed. 2 Experimental 2.1 Materials All the chemicals were A.R. grade and used directly. The detail information of those chemicals is described in the Supporting Information. 2.2 Catalysts preparation 2.2.1 Synthesis of the MOFs supports UiO-66 was prepared by the traditional solvothermal method followed our previous work [29]. 0.053 g of ZrCl4 (0.227 mmol) and 0.034 g of terephthalic acid (H2BDC, 0.227 mmol) were dissolved in 5 mL N, N-dimethylformamide (DMF) by ultrasound. Then, the clarified solution is transferred to the autoclave kept at 120 °C for 24 h. After cooled down to the room temperature, the UiO-66 powder could be obtained by centrifugation, washing with ethanol for several times and dried in an oven at 70 °C overnight. 2.2.3 Preparation of the supported Pd catalysts The supported Pd catalysts were prepared by wet impregnation method, using ethylene glycol (EG) as the solvent and reductant. The preparation method was followed our previous method [20]. Generally, 1.0 g of UiO-66 was placed in 150 mL EG, stirred until completely dispersed. Then, an amount of acetic solution of Pd(OAc)2 (3.133 mmol/L) was added dropwise to the above suspension and stirred for 0.5 h. Finally, the mixed solution was heated to 150 °C and reacted for 2 h under vigorous stirring. After that, the mixed solution was cooled down to the ambient temperature. After centrifugation, washing with deionized water and ethanol several times and drying in an oven at 70 °C overnight, the catalyst named xPd-66 could obtained. x was the theoretical load of Pd (0.1, 0.3 0.5 and 0.8 wt%). In addition, Pd-66 pretreated under H2, O2 (30% O2/Ar) and reaction atmosphere (1.05% CO, 20% O2 and N2 balanced) at 200 °C for 2 h was named as xPd-66-H, xPd-66-O and xPd-66-CO, respectively. Furthermore, after CO oxidation, these catalysts xPd-66, xPd-66-H, xPd-66-O and xPd-66-CO were donated as xPd-66-A, xPd-66-H-A, xPd-66-O-A and xPd-66-CO-A, respectively. 2.3 Characterization The physicochemical parameters and morphology of the samples were characterized by X-ray diffraction (XRD), Fourier transform infrared (FT-IR) spectroscopy, N2 adsorption-desorption, transmission electron microscopy (TEM), high resolution transmission electron microscopy (HRTEM), thermogravimetric (TG), X-ray photoelectron spectroscopy (XPS), H2 temperature programmed reduction (H2-TPR), CO chemisorption, CO2 adsorption and in situ diffuse reflectance infrared Fourier transform spectroscopy (DRIFTS) of CO adsorption and oxidation. The detail information of these characterization technologies is described in Supporting Information. 2.4 Catalysts test The CO oxidation experiment was carried out on a fixed bed microreactor. Typically, 0.1 g of catalyst was pressed and screened out between 20 and 40 mesh. A U-type quartz tube (outside diameter is 6 mm, inside diameter is 4 nm) was used to place the samples. The reaction gas (1.05% CO, 20% O2 and N2 balanced) was controlled by a mass flowmeter and the flow rate was set at 30 mL/min, namely, weight hourly space velocity (WHSV) was 18,000 mL/(g•h). To study the influence of water to the samples, the water vapors (5.0 and 10.0 Vol.%) were introduced by a water saturator. The amount of water vapors was calculated by our previous work [29]. An online gas chromatograph (GC2060, Ruimin, Shanghai) equipped with a flam ionization detector (FID) was used to detect the CO concentration in the inlet and outlet gas. Temperatures with CO conversion rate of 50% and 98% (T50 and T98) were used to estimate the catalytic activity of the catalysts. The CO conversion (XCO) was calculated by the following formula: X CO = ( C 0 − C 1 ) / C 0 × 100 % where, C0 and C1 were the CO concentration of the inlet and outlet gas, respectively. 3 Results and discussion 3.1 CO catalytic performance of the xPd-66 catalysts Fig. S1 shows the XRD patterns of UiO-66 and the xPd-66. The XRD pattern of UiO-66 is in line with our previous works [21], indicating its successfully synthesis. After the introduction of Pd, the intensity of diffraction peaks is decreased and with the increase of Pd loading, the diffraction peaks decreased gradually. The decrease of XRD patterns of UiO-66 might be due to that during the reduction process, the EG interacted with UiO-66, resulting in the deterioration of the crystal form of UiO-66. This was in consistence with our previous work [29] and could be confirmed by the TG curves (Fig. S2) which will discussed later. Notably, no peaks of Pd or PdO can be found in the XRD patterns, which may be ascribed to the low loading or high dispersion of Pd spices [30]. Fig. 1 (A) shows the CO conversion over the xPd-66 catalysts. The T50 and T98 were used to estimate the catalytic efficiency of the xPd-66 catalysts, and the results are listed in Table S1. The T98 of 0.1Pd-66, 0.3Pd-66, 0.5Pd-66 and 0.8Pd-66 are 199, 189, 180 and 180 °C, respectively. With the Pd loadings increase from 0.1 wt% to 0.5 wt%, the CO oxidation performance increased gradually. However, the catalytic activity of CO did not increase with the further increase of Pd loading to 0.8 wt%. Thus, the 0.5Pd-66 was selected for further study. Fig. 1(B) shows the CO recycle oxidation reaction of 0.5Pd-66. Interesting, As the number of cycles increases, the catalytic performance of 0.5Pd-66 increased until the furth times. The T98 of 0.5Pd-66 decreased from 180 to 155 °C. To understand the reason why the enhanced catalytic performance of 0.5Pd-66 for CO oxidation, 0.5Pd-66 was pretreated at different condition (H2, O2 and reaction gas atmosphere). 3.2 Characterization of the 0.5Pd-66 catalyst with different pretreat conditions Fig. 2 (A) shows the XRD patterns of UiO-66 0.5Pd-66 and the pretreated 0.5Pd-66. The XRD patterns of these pretreated 0.5Pd-66 present the similar peak shapes and are consistent with the peak shape of 0.5Pd-66. This result indicates that the pretreat conditions had no influence on the crystal structure of 0.5Pd-66. Fig. 2(B) shows the FT-IR spectra of UiO-66, 0.5Pd-66 and the pretreated 0.5Pd-66. All the supported 0.5Pd catalysts present the similar spectra with UiO-66, indicating that the introduction of Pd and the pretreatment conditions have hardly influence on the structure of UiO-66. However, compared with UiO-66, the band is disappeared in the supported 0.5Pd catalysts, which is attributed to the C=O of DMF at 1660 cm−1 [31]. This may be ascribed to that the residual DMF was removed during the EG reduction or washing process. In addition, after the introduction of Pd NPs, some new bands at the regions of 2950–2850 cm−1 and 1200–800 cm−1 which represented to EG was appeared [32], indicated that EG remained on the surface of the catalysts. In a word, the XRD and FT-IR results indicate the pretreatment condition had not influence on the structure of 0.5Pd-66. Fig. S2 shows the TG curves of UiO-66 and supported 0.5Pd catalysts. The UiO-66 structure collapses at a temperature of about 500 °C. However, after the introduction of Pd, the structures of supported 0.5Pd catalysts collapse at about 430 °C, because of EG interacted with the linkers of UiO-66 led to the deterioration of the crystal form and structural stability of UiO-66 during reduction progress, which was in consistence with the XRD patterns. For UiO-66, the TG curve can divide into three stages [33,34]. The first stage was at 30–100 °C, which could attributed to the loss of crystal water in the structure. The weight loss between 100 and 300 °C was ascribed to the loss of the residual DMF and impurities. The stage at above 300 °C was due to the structural collapse and finally formed ZrO2. After EG reduction, the shape of TG curves for the supported 0.5Pd catalysts have an obvious distinction. For 0.5Pd-66, the weight loss at 100–200 °C was attributed to the lost water and impurities. The second stage at 200–230 °C might be ascribed to the loss of residual EG. The existence of EG was confirmed by FT-IR. The final stage, above 230 °C, was attributed to the structural collapse. The difference of TG curves between UiO-66 and 0.5Pd-66 might lead to the change of pore structure, which will be discussed later. After pretreated at different conditions, the shapes of these TG curves for 0.5Pd-66-H, 0.5Pd-66-O and 0.5Pd-66-CO were similar and were consistent with 0.5Pd-66. Even so, there are still subtle differences between 0.5Pd-66-H, 0.5Pd-66-O and 0.5Pd-66-CO. These subtle differences might be related to the pore structure. The physical absorption was used to characterize the specific surface area and pore structure. The specific surface area was calculated by the Brunauer Emmett Teller (BET) model. The density functional-theory (DFT) and Barrett Joyner Halenda (BJH) method were used to calculated the pore diameter. Fig. 2(C, D and E) present the N2 adsorption-desorption, pore size distribution calculated by DFT and BJH method, respectively. The values of BET surface area (SBET), pore volume and pore diameter calculated by DFT (DDFT) and BJH (DBJH) method are summarized in Table 1 . UiO-66 exhibit a typical micropore structure with the SBET and pore volume of 1335 m2/g and 0.833 cc/g, respectively [35]. The pore size distribution (Fig. 2(D and E)) also confirmed its micropore structure. After the introduction of Pd, the N2 adsorption-desorption curve of 0.5Pd-66 appeared a small hysteresis loop, which indicated that the pore structure of UiO-66 was changed. This is consistent with the TG result. In addition, the appearance of mesoporous in 0.5Pd-66 also demonstrated the change of pore structure. After pretreated at different conditions, the hysteresis loop became bigger, indicated the appearance of more mesoporous. The SBET and total pore volume of 0.5Pd-66, 0.5Pd-66-H, 0.5Pd-66-O and 0.5Pd-66-CO are 682 m2/g and 0.389 cc/g, 340 m2/g and 0.351 cc/g, 859 m2/g and 0.491 cc/g, 626 m2/g and 0.405 cc/g, respectively. 0.5Pd-66-O possesses the largest SBET and pore volume. The changes of SBET, pore volume and pore size distribution (Fig. 2(D and E)) are closely related to the pretreatment condition. In addition, to determine the small micropore of the samples, the CO2 adsorption was performed. Fig. S3 shows the CO2 adsorption curves and pore size distribution calculated by Dolimore-Heal (DH) method. It can be found that compared with UiO-66, the uptake of CO2 of the supported 0.5Pd increased at different degree. All the samples present the similar small micropore distribution. Fig. 3 shows the TEM and the size distribution of Pd NPs of the supported 0.5Pd catalysts and HRTEM of 0.5Pd-66-O. It can be found that the Pd NPs were evenly distributed on the UiO-66 support. The average size of Pd NPs on 0.5Pd-66, 0.5Pd-66-H, 0.5Pd-66-O and 0.5Pd-66-CO are 6.3, 6.25, 5.26 and 6.01 nm, respectively. Among them, the 0.5Pd-66-O possesses the smallest Pd NPs. In addition, the HRTEM of 0.5Pd-66-O (Fig. 3(E)) displays a lattice spacing of 0.22 nm (Fig. 3(F)), corresponding to the Pd (111) plane. The TEM results indicated that the Pd NPs were successfully loaded on UiO-66 and the 0.5Pd-66 possessed the smallest Pd NPs. To determine the surface chemical composition, the XPS was used. Fig. 4 and Fig. S4 show the XPS spectra of the supported 0.5Pd catalysts. The XPS full spectra (Fig. S4) confirm that the C, O, Zr and Pd exist in the supported 0.5Pd catalysts. Fig. 4(A) shows the Zr 3d spectra. The Zr 3d spectra can be divided into two peaks at 185.2 (Zr 3d3/2) and 182.8 eV (Zr 3d5/2) assigned to Zr4+ in Zr-O clusters [30]. The O 1 s spectra (Fig. 4(B)) are fitted into three peaks at 533.3, 531.7 and 530.3 eV, corresponding to surface OH (OOH), adsorption oxygen (Oads) and lattice oxygen (Olat) [36-38]. The molar ratios of Olat to Oads calculated by the peak area are listed in Table 1. The values of Olat/Oads for 0.5Pd-66, 0.5Pd-66-H, 0.5Pd-66-O and 0.5Pd-66-CO are 0.181, 0.244, 0.268 and 0.263, respectively. 0.5Pd-66-O presents the highest Olat/Oads value. Fig. 4(C) shows the Pd 3d spectra of the supported 0.5Pd catalysts, the fitting peaks at 336.8 and 335.0 eV correspond to the Pd2+ and Pd0 species [20,29]. The values of Pd2+/Pd° for the supported 0.5Pd catalysts are summarized in Table 1. Among these catalysts, 0.5Pd-66-O possesses the highest Pd2+/Pd0 value (0.236). In short, the XPS results indicate 0.5Pd-66-O possesses the highest Olat/Oads and Pd2+/Pd0 values. To learn the reducibility of the supported 0.5Pd catalysts, the H2-TPR was performed. As shown in Fig. 5 (A), the supported 0.5Pd catalysts present the similar H2-TPR files. All the supported 0.5Pd catalysts display the similar curves. For UiO-66, only one peak appeared at the range of 450–600 °C, which was ascribed to the collapse of framework [39]. After the introduction of Pd NPs, a new negative peak appeared at about 100 °C, which was attributed to the reduction of Pd2+ to Pd0 [40] and the hydrogen spillover between UiO-66 and Pd [41]. In addition, the peak between 400 and 600 °C shifted to a lower temperature, which indicated that the introduction of Pd NPs accelerated the collapse of UiO-66 structure. This is consistent with the TG result. When 0.5Pd-66 pretreated at different conditions, it was no obvious influence on the UiO-66 structure. However, the reduction peak of Pd2+ (Fig. 5(B)) changed a lot. The negative peaks deviate to low temperature in different degrees and become more pronounced. The appearance of the more obvious negative peaks indicated more Pd2+ species in the pretreated 0.5Pd-66, which may be due to the influence of pretreatment atmospheres to Pd species. This is in accord with the XPS result. Additionally, the reduction peak of Pd2+ for 0.5Pd-66-O appeared at the lowest temperature (94 °C), indicating the 0.5Pd-66-O possesses the best reducibility at low temperature. 3.3 CO catalytic performance of the 0.5Pd-66 catalyst with different pretreat conditions Fig. 6 shows the temperature dependent CO conversion of 0.5Pd-66 and pretreated 0.5Pd-66 catalysts. The T50% and T98% of the supported 0.5Pd catalysts are summarized in Table S1. The T98% of 0.5Pd-66, 0.5Pd-66-H, 0.5Pd-66-O and 0.5Pd-66-CO are 180, 176, 163 and 170 °C, respectively. It can be found that the 0.5Pd-66-O exhibits the better catalytic performance for CO oxidation. The catalytic efficiency of the four catalysts ranked as: 0.5Pd-66-O > 0.5Pd-66-CO > 0.5Pd-66-H > 0.5Pd-66. Compared with the reported works (Table 2 ) [42–46], the 0.5Pd-66-O exhibits better catalytic performance. For kinetic study, t the first order kinetic analysis of CO oxidation was carried out. The CO concentration, and extra oxygen and oxygen concentration are closely related to the mechanism: r = − kc = [ − A e x p ( − Ea / RT ) ] c where k, r, Ea, and A refer to rate constant (s −1), reaction rate (μmol/(g•s)), apparent activation energy (kJ/mol), and pre-exponential factor, respectively. It is noting that the conversion rate below 20% to use this formula to calculate activation energy (Ea) and the results display in Fig. 6(B). As shown in Fig. 6(B), the Ea value decreases as follows: 0.5Pd-66-O (63.4 kJ/mol) < 0.5Pd-66-CO (65.3 kJ/mol) < 0.5Pd-66-H (67.4 kJ/mol) < 0.5Pd-66 (160.7 kJ/mol). The Ea values of 0.5Pd-66-O are smaller than that of other supported Pd catalysts, which indicates that 0.5Pd-66-O possessed the best catalytic activity for CO oxidation. Typically, the CO oxidation performance is affected by many factors, such as the surface area and reducibility at low temperature of the catalyst, the size of active species, chemical state of surface element, oxygen species and so on. It has been reported that the high specific surface area is beneficial for the mass transport to improve the catalytic performance [47]. The 0.5Pd-66-O possesses the highest SBET among the supported 0.5Pd catalysts, which led to the great catalytic performance for CO oxidation. Our previous works shows that the better reducibility at low temperature of a catalyst usually exhibited a better catalytic performance [46,48]. The H2-TPR result shows that the 0.5Pd-66-O have a better reducibility at low temperature. Thus, the better reduction ability at low temperature of 0.5Pd-66-O can account for its better CO oxidation activity. In addition, many researchers have investigated the size effect of the noble metal NPs to the catalytic activity [49-51]. They found that different size of noble metal NPs could bring about different metal dispersion, chemical state and strongly effect the catalytic performance. And the smaller the size of the noble metal NPs, the better the catalytic activity. For 0.5Pd-66-O, the average size of Pd NPs is 5.26 nm which is the smallest among the supported 0.5Pd-66 catalysts. So, the smallest size of Pd NPs in 0.5Pd-66-O was one of the factors for the better CO oxidation. Additionally, according to the XPS results, 0.5Pd-66-O possesses more Olat and Pd2+ species. Generally, the CO oxidation follows Mars Van Krevelen mechanism [52,53] CO + Pd2+O2−→ CO2 + Pd0. The Olat can directly activate gaseous CO in the oxidation reaction [28]. In addition, Li et al. [54] have been reported that the low-temperature catalytic activity exhibited for CO oxidation could be associated with the presence of Pd2+ species rather than Pd0 nanoparticles. Moreover, Yang et al. [55] found that the lattice oxygen can involve in the redox cycle of Pd0 and Pd2+ in the oxidative carbonylation of phenol to diphenyl carbonate. Thus, more Pd2+ and Olat species can enhance the oxidation reaction [56]. In a word, the better catalytic performance of 0.5Pd-66-O for CO oxidation was attributed to the high surface area, low temperature reduction ability, small Pd NPs and more Pd2+ and Olat species. Furthermore, the CO uptake obtained from CO chemisorption (Table 1) of the supported 0.5Pd catalysts also confirmed the better catalytic performance of 0.5Pd-66-O. Fig. 1(B) and Fig. 6(B, C and D) show the reusability of 0.5Pd-66, 0.5Pd-66-H, 0.5Pd-66-O and 0.5Pd-66-CO, respectively. It can be found that the 0.5Pd-66 and pretreated 0.5Pd-66 catalysts possess great reusability. In addition, with the increase of recycle, the catalytic performance of the three catalysts also increased in different degree. It is worth noting that no matter under what pretreatment conditions, the catalyst can always obtain similar catalytic activity after multiple cycles, which indicates that the reaction atmosphere (1.05% CO, 20% O2 and N2 balanced) further stabilized the catalyst structure. Additionally, the XPS spectra (Fig. S5) of 0.5Pd-66 and 0.5Pd-66-O after reaction indicated the increase of Pd2+ species (Table S2), which could be a reason for the increased catalytic performance. To investigate the effect of WHSV, stability and water resistance of the catalysts, 0.5Pd-66-O was selected. Fig 7 (A) shows the effect of WHSV on 0.5Pd-66-O for CO oxidation. With the increase of WHSV, the catalytic performance decreased a lot, which may be ascribed to the high WHSV value decreased the molar ratio of reactive oxygen species to CO molecules on the surface, restraining CO oxidation. The stability test of 0.5Pd-66-O was performed at different temperature (Fig. 7(B)). At a low temperature (150 °C), about 27% CO can convert to CO2 for 10 h. When the temperature rase to 165 °C, the CO conversion rate increased rapidly and reached complete conversion. Then reduce the temperature to 160 and 155 °C, the CO conversion rate can still maintain complete conversion, indicating the great stability of 0.5Pd-66-O. In addition, the XRD patterns, FT-IR spectra, N2 adsorption-desorption curves and pore size distribution (Fig. S6) of the supported 0.5Pd catalysts after reaction also indicated the stability of these catalysts. Fig. 7(C) exhibits the water resistance of 0.5Pd-66-O at 150 and 165 °C. Regardless of the low temperature or high temperature, the conversion rate of CO would decrease after the water was introduced. When the water vapor was turned off, the CO conversion would gradually recover, which indicated that 0.5Pd-66-O has better water resistance. In short, the 0.5Pd-66-O have good stability and water resistance. 3.4 In situ DRIFTS of CO adsorption and oxidation mechanism To investigate the CO adsorption and oxidation mechanism over 0.5Pd-66-O, the in situ DRIFTS was carried out. Fig. 8 showed the in situ DRIFTS spectra of CO adsorption and oxidation. Fig. 8(A) showed the CO adsorption spectra. The bands at 2170 and 2108 cm−1 were ascribed to the adsorption of gaseous CO on 0.5Pd-66-O [57,58]. The other two bands at 2027 and 1975 cm−1 were attributed to the chemisorption of CO in the form of bridging adsorption [59-61]. With the increase of time, the adsorption intensity of CO increased. After exposure to CO for 1 h, the gas was switched to Ar to study the adsorption intensity of CO on 0.5Pd-66-O. It can be found from Fig. 8(B) that as Ar purge time increased, the adsorption strength of CO decreased gradually. Especially, the bands of 2170 and 2108 cm−1 for the adsorption of gaseous CO on 0.5Pd-66-O were disappeared. This indicated that the gaseous CO adsorbed on the catalyst surface could not exist stably. Furtherly, to study the CO oxidation mechanism over 0.5Pd-66-O, 30 vol.% O2/Ar was introduced to the in situ cell after exposure to CO for 1 h. Fig. 8(C) presented the in situ DRIFTS spectra of CO oxidation on the surface of the 0.5Pd-66-O at 150 °C at different times. With time increased, the absorbed bands at 2170, 2108 cm−1 and 2027, 1975 cm−1 were ascribed to the absorbed gaseous CO molecules and chemisorption CO on Pd(111), respectively, gradually weaken and disappeared. Simultaneously, some new bands were appeared. The band at 1443 cm−1 was ascribed to the presence of bicarbonate species (HCO3 −), which indicated that the HCO3 − was produced during CO oxidation [62,63]. In addition, the peak at 1248 cm−1 which was assigned to the asymmetric bicarbonate species also confirmed the exitance of HCO3 − species. The bands between 1300 and 1400 cm−1 were ascribed to monodentate carbonates species (m-CO3 2−) [63,64]. The band at 1581 cm−1 was attributed to νas(OCO) stretching vibration of bidentate carbonate species (b-CO3 2−) [60,64]. The appearance of these bands indicated the HCO3 −, m-CO3 2− and b-CO3 2− are the main intermediates during CO oxidation. Additionally, the absorbance peak appeared at 2233 cm−1 was attributed to the CO2 species, indicating the formation of gaseous CO2. Based on the above studies, it could be found that the oxidation pathway of CO on the surface of the 0.5Pd-66-O catalyst could be carried out. CO was first adsorbed on Pd NPs, Then the rapid transformation of CO to various carbon-related species (HCO3 −, b-CO3 2− and m-CO3 2− species) and finally decomposed into gaseous CO2. 4 Conclusion In summary, a range of xPd-66 catalysts were prepared by EG reduction. The Pd loads were first investigated for CO oxidation. It was found that with the increase of Pd loadings, the catalytic performance for CO oxidation first increased. When the Pd loadings increased to 0.8 wt%, the CO oxidation activity was similar to the 0.5 wt% Pd. In addition, the reusability test of 0.5Pd-66 shows that with the increase of recycle number, the catalytic performance increased a lot. Thus, the 0.5Pd-66 was selected to investigate the effect of pretreatment conditions. It was found that compared with pretreated under H2, reaction gas (CO) atmosphere, 0.5Pd-66-O pretreated under O2 atmosphere showed the better catalytic performance for CO oxidation. The CO could completely convert to CO2 at 165 °C over 0.5Pd-66-O. A series of characterization results indicated that the pretreatment conditions could influence the surface area, reduction ability at low temperature, particle size of Pd NPs and surface chemical state of the catalyst. The better catalytic performance of 0.5Pd-66-O was ascribed to the high surface area, better reducibility at low temperature, small Pd NPs and more Pd2+ and Olat species. Importantly, the possible oxidation pathway of CO on the surface of the 0.5Pd-66-O catalyst was revealed. CO was first adsorbed on Pd NPs, Then the rapid transformation of CO to various carbon-related species (HCO3 −, b-CO3 2− and m-CO3 2− species) and finally decomposed into gaseous CO2. This work may inspire researchers to pay attention to the effect of reaction atmosphere on catalyst structure CRediT authorship contribution statement Fukun Bi: Writing - original draft. Xiaodong Zhang: Writing - review & editing, Conceptualization, Funding acquisition. Quanxin Du: Data curation. Ke Yue: Formal analysis. Ruizhuo Wang: Visualization. Fei Li: Visualization. Ning Liu: Investigation. Yuandong Huang: Writing - review & editing. Declaration of Competing Interest We wish to confirm that there are no known conflicts of interest associated with this publication and there has been no significant financial support for this work that could have influenced its outcome. We confirm that the manuscript has been read and approved by all named authors and that there are no other persons who satisfied the criteria for authorship but are not listed. We further confirm that the order of authors listed in the manuscript has been approved by all of us. We confirm that we have given due consideration to the protection of intellectual property associated with this work and that there are no impediments to publication, including the timing of publication, with respect to intellectual property. In so doing we confirm that we have followed the regulations of our institutions concerning intellectual property. We understand that the Corresponding Author is the sole contact for the Editorial process (including Editorial Manager and direct communications with the office). He is responsible for communicating with the other authors about progress, submissions of revisions and final approval of proofs. We confirm that we have provided a current, correct email address which is accessible by the Corresponding Author and which has been configured to accept email from fatzhxd@126.com Acknowledgements This work was sponsored financially by the National Natural Science Foundation of China (No. 21906104，12075147) and Natural Science Foundation of Shanghai (19ZR1434900). Supplementary materials Supplementary material associated with this article can be found, in the online version, at doi:10.1016/j.mcat.2021.111633. Appendix Supplementary materials Image, application 1 References [1] S.L. Daniels Products of incomplete combustion (Ox, COx, HOx, NOx, SOx ROx, MOx and POx) J. Hazard. Mater. 22 1989 161 173 S.L. Daniels, Products of incomplete combustion (Ox, COx, HOx, NOx, SOx ROx, MOx and POx), J. Hazard. Mater.22 (1989) 161–173. [2] M.R. Wei S. Li H.L. Xiao G.L. Guo Combustion performance and pollutant emissions analysis using diesel/gasoline/iso-butanol blends in a diesel engine Energ. Convers. Manage. 149 2017 381 391 M.R. Wei, S. Li, H.L. Xiao, G.L. Guo, Combustion performance and pollutant emissions analysis using diesel/gasoline/iso-butanol blends in a diesel engine, Energ. Convers. Manage.149 (2017) 381–391. [3] L. Wang G.G. Yin Y.Q. Yang X.D. Zhang Enhanced CO oxidation and toluene oxidation on CuCeZr catalysts derived from UiO-66 metal organic frameworks React. Kinet. Mech. Cat. 128 2019 193 204 L. Wang, G.G. Yin, Y.Q. Yang, X.D. Zhang, Enhanced CO oxidation and toluene oxidation on CuCeZr catalysts derived from UiO-66 metal organic frameworks, React. Kinet. Mech. Cat.128 (2019) 193–204. [4] F. Wang W. Li X.L. Feng D.P. Liu Y. Zhang Decoration of Pt on Cu/Co double-doped CeO2 nanospheres and their greatly enhanced catalytic activity Chem. Sci. 7 2016 1867 1873 F. Wang, W. Li, X.L. Feng, D.P. Liu, Y. Zhang, Decoration of Pt on Cu/Co double-doped CeO2 nanospheres and their greatly enhanced catalytic activity, Chem. Sci.7 (2016) 1867–1873. [5] J. Varon P.E. Marik R.E. Fromm A. Gueler Carbon monoxide poisoning: a review for clinicians J. Emerg. Med. 17 1999 87 93 J. Varon, P.E. Marik, R.E. Fromm, A. Gueler, Carbon monoxide poisoning: a review for clinicians, J. Emerg. Med.17 (1999) 87–93. [6] K. Zeng Z. Wang D. Wang C. Wang J. Yu G. Wu Q. Zhang X. Li C. Zhang X.S. Zhao Three-dimensionally ordered macroporous MnSmOx composite oxides for propane combustion: modification effect of Sm dopant Catal. Today 2020 10.1016/j.cattod.2020.05.043 K. Zeng, Z. Wang, D. Wang, C. Wang, J. Yu, G. Wu, Q. Zhang, X. Li, C. Zhang, X.S. Zhao, Three-dimensionally ordered macroporous MnSmOx composite oxides for propane combustion: modification effect of Sm dopant. Catal. Today2020, https://doi.org/10.1016/j.cattod.2020.05.043. [7] S.J. Li Y. Lin D. Wang C.H. Zhang Z. Wang X.B. Li Polyhedral cobalt oxide supported Pt nanoparticles with enhanced performance for toluene catalytic oxidation Chemosphere 263 2021 127870 S.J. Li, Y. Lin, D. Wang, C.H. Zhang, Z. Wang, X.B. Li. Polyhedral cobalt oxide supported Pt nanoparticles with enhanced performance for toluene catalytic oxidation. Chemosphere, 263 (2021) 127870. [8] X.D. Zhang Y. Yang Q. Zhu M.D. Ma Z.Y. Jiang X. Liao C. He Unraveling the effects of potassium incorporation routes and positions on toluene oxidation over α-MnO2 nanorods: based on experimental and density functional theory (DFT) studies J. Colloid Interf. Sci. 2021 10.1016/j.jcis.2021.04.053 X.D. Zhang, Y. Yang, Q. Zhu, M.D. Ma, Z.Y. Jiang, X. Liao, C. He, Unraveling the effects of potassium incorporation routes and positions on toluene oxidation over α-MnO2 nanorods: based on experimental and density functional theory (DFT) studies, J. Colloid Interf. Sci.2021, https://doi.org/10.1016/j.jcis.2021.04.053. [9] X.D. Zhang H. Dong D. Zhao Y. Wang Y.G. Wang L.F. Cui Effect of support calcination temperature on Ag structure and catalytic activity for CO oxidation Chem. Res. Chin. Univ. 32 2016 455 460 X.D. Zhang, H. Dong, D. Zhao, Y. Wang, Y.G. Wang, L.F. Cui, Effect of support calcination temperature on Ag structure and catalytic activity for CO oxidation, Chem. Res. Chin. Univ.32 (2016) 455–460. [10] G. Ertl Reactions at surfaces: from atoms to complexity (Nobel Lecture) Angew. Chem. Int. Ed. 47 2008 3524 3535 G. Ertl, Reactions at surfaces: from atoms to complexity (Nobel Lecture), Angew. Chem. Int. Ed.47 (2008) 3524–3535. [11] B. Sarkodie Y.J. Hu W. Bi J.C. Jiang C.Z. Li Promotional effects of CuxO on the activity of Cu/ZnO catalyst toward efficient CO oxidation Appl. Surf. Sci. 548 2021 149241 B. Sarkodie, Y.J. Hu, W. Bi, J.C. Jiang, C.Z. Li, Promotional effects of CuxO on the activity of Cu/ZnO catalyst toward efficient CO oxidation, Appl. Surf. Sci.548 (2021) 149241. [12] X.D. Zhang F.L. Hou Y. Yang Y.X. Wang N. Liu D. Chen Y.Q. Yang A facile synthesis for cauliflower like CeO2 catalysts from Ce-BTC precursor and their catalytic performance for CO oxidation Appl. Surf. Sci. 423 2017 771 779 X.D. Zhang, F.L. Hou, Y. Yang, Y.X. Wang, N. Liu, D. Chen, Y.Q. Yang, A facile synthesis for cauliflower like CeO2 catalysts from Ce-BTC precursor and their catalytic performance for CO oxidation, Appl. Surf. Sci.423 (2017) 771–779. [13] X.Y. Liu K. Wang Y. Zhou X.Y. Tang X.H. Zhu R.S. Zhang X.L. Zhang X. Jiang B.D. Liu In-situ fabrication of noble metal modified (Ce, Zr)O2-δ monolithic catalysts for CO oxidation Appl. Catal. Sci. 483 2019 721 729 X.Y. Liu, K. Wang, Y. Zhou, X.Y. Tang, X.H. Zhu, R.S. Zhang, X.L. Zhang, X. Jiang, B.D. Liu, In-situ fabrication of noble metal modified (Ce, Zr)O2-δ monolithic catalysts for CO oxidation, Appl. Catal. Sci.483 (2019) 721–729. [14] M. Eddaoudi J. Kim N. Rosi D. Vodak J. Wachter M. O’Keeffe O.M. Yaghi Systematic design of pore size and functionality in isoreticular MOFs and their application in methane storage Science 295 2002 469 472 M. Eddaoudi, J. Kim, N. Rosi, D. Vodak, J. Wachter, M. O'Keeffe, O.M. Yaghi, Systematic design of pore size and functionality in isoreticular MOFs and their application in methane storage. Science 295 (2002) 469–472. [15] Y.Q. Yang Z.H. Zheng W.Q. Ji J.C. Xu X.D. Zhang Insights to perfluorooctanoic acid adsorption micro-mechanism over Fe-based metal organic frameworks: combining computational calculation with response surface methodology J. Hazard. Mater. 395 2020 122686 Y.Q. Yang, Z.H. Zheng, W.Q. Ji, J.C. Xu, X.D. Zhang, Insights to perfluorooctanoic acid adsorption micro-mechanism over Fe-based metal organic frameworks: combining computational calculation with response surface methodology, J. Hazard. Mater.395 (2020) 122686. [16] X.Y. Shi X.D. Zhang F.K. Bi Z.H. Zheng L.J. Shen J.C. Xu Z. Wang Y.Q. Yang Effective toluene adsorption over defective UiO-66-NH2: an experimental and computational exploration J. Mol. Liq. 316 2020 113812 X.Y. Shi, X.D. Zhang, F.K. Bi, Z.H. Zheng, L.J. Shen, J.C. Xu, Z. Wang, Y.Q. Yang, Effective toluene adsorption over defective UiO-66-NH2: an experimental and computational exploration, J. Mol. Liq.316 (2020) 113812. [17] J.F. Chen X.D. Zhang X.Y. Shi F.K. Bi Y. Yang Y.X. Wang Synergistic effects of octahedral TiO2-MIL-101(Cr) with two heterojunctions for enhancing visible-light photocatalytic degradation of liquid tetracycline and gaseous toluene J. Colloid Interf. Sci. 579 2020 37 49 J.F. Chen, X.D. Zhang, X.Y. Shi, F.K. Bi, Y. Yang, Y.X. Wang, Synergistic effects of octahedral TiO2-MIL-101(Cr) with two heterojunctions for enhancing visible-light photocatalytic degradation of liquid tetracycline and gaseous toluene, J. Colloid Interf. Sci.579 (2020) 37–49. [18] X.D. Zhang J.F. Chen S.T. Jiang X.L. Zhang F.K. Bi Y. Yang Y.X. Wang Z. Wang Enhanced photocatalytic degradation of gaseous toluene and liquidus tetracycline by anatase/rutile titanium dioxide with heterophase junction derived from materials of Institut Lavoisier-125(Ti): degradation pathway and mechanism studies J. Colloid Interf. Sci. 588 2021 122 137 X.D. Zhang, J.F. Chen, S.T. Jiang, X.L. Zhang, F.K. Bi, Y. Yang, Y.X. Wang, Z. Wang, Enhanced photocatalytic degradation of gaseous toluene and liquidus tetracycline by anatase/rutile titanium dioxide with heterophase junction derived from materials of Institut Lavoisier-125(Ti): degradation pathway and mechanism studies, J. Colloid Interf. Sci.588 (2021) 122–137. [19] K. Yue X.D. Zhang S.T. Jiang J.F. Chen Y. Yang F.K. Bi Y.X. Wang Recent advances in strategies to modify MIL-125 (Ti) and its environmental applications J. Mol. Liq. 335 2021 116108 K. Yue, X.D. Zhang, S.T. Jiang, J.F. Chen, Y. Yang, F.K. Bi, Y.X. Wang, Recent advances in strategies to modify MIL-125 (Ti) and its environmental applications, J. Mol. Liq.335 (2021) 116108. [20] S.H. Ri F.K. Bi A.L. Guan X.D. Zhang Manganese-cerium composite oxide pyrolyzed from metal organic framework supporting palladium nanoparticles for efficient toluene oxidation J. Colloid Interf. Sci. 586 2021 836 846 S.H. Ri, F.K. Bi, A.L. Guan, X.D. Zhang, Manganese-cerium composite oxide pyrolyzed from metal organic framework supporting palladium nanoparticles for efficient toluene oxidation, J. Colloid Interf. Sci.586 (2021) 836–846. [21] X.D. Zhang L. Song F.K. Bi D.F. Zhang Y.X. Wang L.F. Cui Catalytic oxidation of toluene using a facile synthesized Ag nanoparticle supported on UiO-66 derivative J. Colloid Interf. Sci. 571 2020 38 47 X.D. Zhang, L. Song, F.K. Bi, D.F. Zhang, Y.X. Wang, L.F. Cui, Catalytic oxidation of toluene using a facile synthesized Ag nanoparticle supported on UiO-66 derivative, J. Colloid Interf. Sci.571 (2020) 38–47. [22] M.T. Cao F.L. Yang Q. Zhang J.H. Zhang L. Zhang L.F. Li X.H. Wang W.L. Dai Facile construction of highly efficient MOF-based Pd@UiO-66-NH2@ZnIn2S4 flower-like nanocomposites for visible-light-driven photocatalytic hydrogen production J. Mater. Sci. Technol. 76 2021 189 199 M.T. Cao, F.L. Yang, Q. Zhang, J.H. Zhang, L. Zhang, L.F. Li, X.H. Wang, W.L. Dai, Facile construction of highly efficient MOF-based Pd@UiO-66-NH2@ZnIn2S4 flower-like nanocomposites for visible-light-driven photocatalytic hydrogen production, J. Mater. Sci. Technol.76 (2021) 189–199. [23] F. Abbasi J. Karimi-Sabet C. Ghotbi Efficient CO oxidation over palladium supported on various MOFs: synthesis, amorphization, and space velocity of hydrogen stream Int. J. Hydrogen Energy 45 2020 21450 21463 F. Abbasi, J. Karimi-Sabet, C. Ghotbi, Efficient CO oxidation over palladium supported on various MOFs: synthesis, amorphization, and space velocity of hydrogen stream, Int. J. Hydrogen Energy45 (2020) 21450–21463. [24] M. Kandiah M.H. Nilsen S. Usseglio S. Jakobsen U. Olsbye M. Tilset C. Larabi E.A. Quadrelli F. Bonino K.P. Lillerud Synthesis and stability of tagged UiO-66 Zr-MOFs Chem. Mater. 22 2010 6632 6640 M. Kandiah, M.H. Nilsen, S. Usseglio, S. Jakobsen, U. Olsbye, M. Tilset, C. Larabi, E.A. Quadrelli, F. Bonino, K.P. Lillerud, Synthesis and stability of tagged UiO-66 Zr-MOFs, Chem. Mater.22 (2010) 6632–6640. [25] A.E. Platero-Prats A. Mavrandonakis L.C. Gallington Y.Y. Liu J.T. Hupp O.K. Farha C.J. Cramer K.W. Chapman Structural transitions of the metal-oxide nodes within metal-organic frameworks: on the local structures of NU-1000 and UiO-66 J. Am. Chem. Soc. 138 2016 4178 4185 A.E. Platero-Prats, A. Mavrandonakis, L.C. Gallington, Y.Y. Liu, J.T. Hupp, O.K. Farha, C.J. Cramer, K.W. Chapman, Structural transitions of the metal-oxide nodes within metal-organic frameworks: on the local structures of NU-1000 and UiO-66, J. Am. Chem. Soc.138 (2016) 4178–4185. [26] F.M. Zhang S. Zheng Q. Xiao Y.J. Zhong W.D. Zhu A. Lin M.S. El-Shall Synergetic catalysis of palladium nanoparticles encaged within amine-functionalized UiO-66 in the hydrodeoxygenation of vanillin in water Green Chem 18 2016 2900 2908 F.M. Zhang, S. Zheng, Q. Xiao, Y.J. Zhong, W.D. Zhu, A. Lin, M.S. El-Shall, Synergetic catalysis of palladium nanoparticles encaged within amine-functionalized UiO-66 in the hydrodeoxygenation of vanillin in water, Green Chem. 18 (2016) 2900–2908. [27] Z.H. Zhang X.K. Peng Z.P. Zhang W.M. Xiao S.J. Deng X.J. Mao S.G. Hong C. Chen N. Zhang A comparative study on the structure and catalytic performance of UiO-66 supported Pt nanocatalysts prepared by NaBH4 and H2 reduction: light-off, durability and mechanism for CO oxidation J. Inorg. Organomet. Polym. 30 2020 4350 4360 Z.H. Zhang, X.K. Peng, Z.P. Zhang, W.M. Xiao, S.J. Deng, X.J. Mao, S.G. Hong, C. Chen, N. Zhang, A comparative study on the structure and catalytic performance of UiO-66 supported Pt nanocatalysts prepared by NaBH4 and H2 reduction: light-off, durability and mechanism for CO oxidation, J. Inorg. Organomet. Polym.30 (2020) 4350–4360. [28] A. Yazdi A.A. Markeb L. Garzón-Tovar J. Patarroyo J. Moral-Vico A. Alonso A. Sánchez N. Bastus I. Imaz X. Font V. Puntes D. Maspoch Core-shell Au/CeO2 nanoparticles supported in UiO-66 beads exhibiting full CO conversion at 100 C° J. Mater. Chem. A 5 2017 13966 13970 A. Yazdi, A.A. Markeb, L. Garzón-Tovar, J. Patarroyo, J. Moral-Vico, A. Alonso, A. Sánchez, N. Bastus, I. Imaz, X. Font, V. Puntes, D. Maspoch, Core-shell Au/CeO2 nanoparticles supported in UiO-66 beads exhibiting full CO conversion at 100 °C, J. Mater. Chem. A5 (2017) 13966–13970. [29] F.K. Bi X.D. Zhang J.F. Chen Y. Yang Y.X. Wang Excellent catalytic activity and water resistance of UiO-66-supported highly dispersed Pd nanoparticles for toluene catalytic oxidation Appl. Catal. B: Environ. 269 2020 118767 F.K. Bi, X.D. Zhang, J.F. Chen, Y. Yang, Y.X. Wang, Excellent catalytic activity and water resistance of UiO-66-supported highly dispersed Pd nanoparticles for toluene catalytic oxidation, Appl. Catal. B: Environ.269 (2020) 118767. [30] T.Q. Yang T.Z. Ma L.X. Yang W.L. Dai S.Q. Zhang S.L. Luo A self-supporting UiO-66 photocatalyst with Pd nanoparticles for efficient degradation of tetracycline Appl. Surf. Sci. 544 2021 148928 T.Q. Yang, T.Z. Ma, L.X. Yang, W.L. Dai, S.Q. Zhang, S.L. Luo, A self-supporting UiO-66 photocatalyst with Pd nanoparticles for efficient degradation of tetracycline, Appl. Surf. Sci.544 (2021) 148928. [31] J. Feng M. Li Y.H. Zhong Y.L. Xu X.J. Meng Z.W. Zhao C.G. Feng Hydrogenation of levulinic acid to γ-valerolactone over Pd@UiO-66-NH2 with high metal dispersion and excellent reusability Microporous Mesoporous Mater 294 2020 109858 J. Feng, M. Li, Y.H. Zhong, Y.L. Xu, X.J. Meng, Z.W. Zhao, C.G. Feng, Hydrogenation of levulinic acid to γ-valerolactone over Pd@UiO-66-NH2 with high metal dispersion and excellent reusability, Microporous Mesoporous Mater. 294 (2020) 109858. [32] H. Ghaedi M. Ayoub S. Sufian B. Lal Y. Uemura Thermal stability and FT-IR analysis of Phosphonium-based deep eutectic solvents with different hydrogen bond donors J. Mol. Liq. 242 2017 395 403 H. Ghaedi, M. Ayoub, S. Sufian, B. Lal, Y. Uemura, Thermal stability and FT-IR analysis of Phosphonium-based deep eutectic solvents with different hydrogen bond donors, J. Mol. Liq.242 (2017) 395–403. [33] X.D. Zhang Y. Yang X.T. Lv Y.X. Wang N. Liu D. Chen L.F. Cui Adsorption/desorption kinetics and breakthrough of gaseous toluene for modified microporous-mesoporous UiO-66 metal organic framework J. Hazard. Mater. 366 2019 140 150 X.D. Zhang, Y. Yang, X.T. Lv, Y.X. Wang, N. Liu, D. Chen, L.F. Cui, Adsorption/desorption kinetics and breakthrough of gaseous toluene for modified microporous-mesoporous UiO-66 metal organic framework, J. Hazard. Mater.366 (2019) 140–150. [34] L. Valenzano B. Civalleri S. Chavan S. Bordiga M.H. Nilsen S. Jakobsen K.P. Lillerud C. Lamberti Disclosing the complex structure of UiO-66 metal organic framework: a synergic combination of experiment and theory Chem. Mater. 23 2011 1700 1718 L. Valenzano, B. Civalleri, S. Chavan, S. Bordiga, M.H. Nilsen, S. Jakobsen, K.P. Lillerud, C. Lamberti, Disclosing the complex structure of UiO-66 metal organic framework: a synergic combination of experiment and theory, Chem. Mater.23 (2011) 1700–1718. [35] X.D. Zhang X.Y. Shi J.F. Chen Y. Yang G. Lu The preparation of defective UiO-66 metal organic framework using MOF-5 as structural modifier with high sorption capacity for gaseous toluene J. Environ. Chem. Eng. 7 2019 103405 X.D. Zhang, X.Y. Shi, J.F. Chen, Y. Yang, G. Lu, The preparation of defective UiO-66 metal organic framework using MOF-5 as structural modifier with high sorption capacity for gaseous toluene, J. Environ. Chem. Eng.7 (2019) 103405. [36] C.H. Zhang Y.T. Wang G.Q. Li L. Chen Q.S. Zhang D. Wang X.B. Li Z. Wang Tuning smaller Co3O4 nanoparticles onto HZSM-5 zeolite via complexing agents for boosting toluene oxidation performance Appl. Surf. Sci. 532 2020 147320 C.H. Zhang, Y.T. Wang, G.Q. Li, L. Chen, Q.S. Zhang, D. Wang, X.B. Li, Z. Wang, Tuning smaller Co3O4 nanoparticles onto HZSM-5 zeolite via complexing agents for boosting toluene oxidation performance, Appl. Surf. Sci.532 (2020) 147320. [37] Y. Wang R.T. Wang N.P. Lin Y. Wang X.D. Zhang Highly efficient microwave-assisted Fenton degradation bisphenol A using iron oxide modified double perovskite intercalated montmorillonite composite nanomaterial as catalyst J. Colloid Interf. Sci. 594 2021 446 459 Y. Wang, R.T. Wang, N.P. Lin, Y. Wang, X.D. Zhang, Highly efficient microwave-assisted Fenton degradation bisphenol A using iron oxide modified double perovskite intercalated montmorillonite composite nanomaterial as catalyst, J. Colloid Interf. Sci.594 (2021) 446–459. [38] Y. Lin J. Sun S.J. Li D. Wang C.H. Zhang Z. Wang X.B. Li An efcient Pt/CeyCoOx composite metal oxide for catalytic oxidation of toluene Catal. Lett. 150 2020 3206 3213 Y. Lin, J. Sun, S.J. Li, D. Wang, C.H. Zhang, Z. Wang, X.B. Li. An efcient Pt/CeyCoOx composite metal oxide for catalytic oxidation of toluene, Catal. Lett.150 (2020) 3206–3213. [39] L.M. Ning S.Y. Liao H.G. Cui L.H. Yu X.L. Tong Selective conversion of renewable furfural with ethanol to produce furan-2-acrolein mediated by Pt@MOF-5 ACS Sustain. Chem. Eng. 6 2018 135 142 L.M. Ning, S.Y. Liao, H.G. Cui, L.H. Yu, X.L. Tong, Selective conversion of renewable furfural with ethanol to produce furan-2-acrolein mediated by Pt@MOF-5, ACS Sustain. Chem. Eng.6 (2018) 135–142. [40] T. Odoom-Wubah Q. Li I. Adilov J.L. Huang Q.B. Li Towards efficient Pd/Mn3O4 catalyst with enhanced acidic sites and low temperature reducibility for Benzene abatement Mol. Catal. 477 2019 110558 T. Odoom-Wubah, Q. Li, I. Adilov, J.L. Huang, Q.B. Li, Towards efficient Pd/Mn3O4 catalyst with enhanced acidic sites and low temperature reducibility for Benzene abatement, Mol. Catal.477 (2019) 110558. [41] H.X. Jiang Q. Gao S.T. Wang Y.F. Chen M.H. Zhang The synergistic effect of Pd NPs and UiO-66 for enhanced activity of carbon dioxide methanation J. CO2 Util. 31 2019 167 172 H.X. Jiang, Q. Gao, S.T. Wang, Y.F. Chen, M.H. Zhang, The synergistic effect of Pd NPs and UiO-66 for enhanced activity of carbon dioxide methanation, J. CO2 Util.31 (2019) 167–172. [42] J.B. Chen P. Wang L. Wang J.H. Cai Lysine-assisted synthesis of porous Ba-doped Pd/γ-Al2O3 hollow microspheres with enhanced catalytic properties for CO and C3H8 oxidation Mater. Lett. 237 2019 57 60 J.B. Chen, P. Wang, L. Wang, J.H. Cai, Lysine-assisted synthesis of porous Ba-doped Pd/γ-Al2O3 hollow microspheres with enhanced catalytic properties for CO and C3H8 oxidation. Mater. Lett.237 (2019) 57–60. [43] T. Osaki Factors controlling catalytic CO oxidation activity on Pd/CeO2-ZrO2-Al2O3 cryogels Mater. Res. Bull. 118 2019 110498 T. Osaki, Factors controlling catalytic CO oxidation activity on Pd/CeO2-ZrO2-Al2O3 cryogels. Mater. Res. Bull.118 (2019) 110498. [44] H.J. Kim J.H. Lee M.W. Lee Y. Seo J.W. Choung C.H. Kim K.Y. Lee SiO2@Pd@CeO2 catalyst with improved thermal stability: effect of interaction between Pd and CeO2 on activity for CO oxidation Mol. Catal. 492 2020 111014 H.J. Kim, J.H. Lee, M.W. Lee, Y. Seo, J.W. Choung, C.H. Kim, K.Y. Lee, SiO2@Pd@CeO2 catalyst with improved thermal stability: effect of interaction between Pd and CeO2 on activity for CO oxidation. Mol. Catal.492 (2020) 111014. [45] L.H. Guo Y. Tian J. Li D.Y. Zhao T. Ding Z. Jiang X.G. Li Effect of Sn-rich and Ce-rich Sn1-xCexO2 supports of Pd catalysts on CO oxidation Catal. Today 355 2020 358 365 L.H. Guo, Y. Tian, J. Li, D.Y. Zhao, T. Ding, Z. Jiang, X.G. Li, Effect of Sn-rich and Ce-rich Sn1-xCexO2 supports of Pd catalysts on CO oxidation. Catal. Today355 (2020) 358–365. [46] F.K. Bi X.D. Zhang S. Xiang Y.Y. Wang Effect of Pd loading on ZrO2 support resulting from pyrolysis of UiO-66: application to CO oxidation J. Colloid Interf. Sci. 573 2020 11 20 F.K. Bi, X.D. Zhang, S. Xiang, Y.Y. Wang, Effect of Pd loading on ZrO2 support resulting from pyrolysis of UiO-66: application to CO oxidation. J. Colloid Interf. Sci.573 (2020) 11–20. [47] S. Afzal X. Quan J.L. Zhang High surface area mesoporous nanocast LaMO3 (M = Mn, Fe) perovskites for efficient catalytic ozonation and an insight into probable catalytic mechanism Appl. Catal. B: Environ. 206 2017 692 703 S. Afzal, X. Quan, J.L. Zhang, High surface area mesoporous nanocast LaMO3 (M = Mn, Fe) perovskites for efficient catalytic ozonation and an insight into probable catalytic mechanism, Appl. Catal. B: Environ.206 (2017) 692–703. [48] X.D. Zhang X.T. Lv F.K. Bi G. Lu Y.X. Wang Highly efficient Mn2O3 catalysts derived from Mn-MOFs for toluene oxidation: the influence of MOFs precursors Mol. Catal. 482 2020 110701 X.D. Zhang, X.T. Lv, F.K. Bi, G. Lu, Y.X. Wang, Highly efficient Mn2O3 catalysts derived from Mn-MOFs for toluene oxidation: the influence of MOFs precursors, Mol. Catal.482 (2020) 110701. [49] R.S. Peng S.J. Li Q.M. Ren L.M. Chen M.L. Fu J.L. Wu D.Q. Ye Size effect of Pt nanoparticles on the catalytic oxidation of toluene over Pt/CeO2 catalysts Appl. Catal. B: Environ. 220 2018 462 470 R.S. Peng, S.J. Li, Q.M. Ren, L.M. Chen, M.L. Fu, J.L. Wu, D.Q. Ye, Size effect of Pt nanoparticles on the catalytic oxidation of toluene over Pt/CeO2 catalysts, Appl. Catal. B: Environ.220 (2018) 462–470. [50] H. Song R.M. Rioux J.D. Hoefelmeyer R. Komor K. Niesz M. Grass P.D. Yang G.A. Somorjai Hydrothermal growth of mesoporous SBA-15 silica in the presence of PVP-stabilized Pt nanoparticles: Synthesis, characterization, and catalytic properties J. Am. Chem. Soc. 128 2006 3027 3037 H. Song, R.M. Rioux, J.D. Hoefelmeyer, R. Komor, K. Niesz, M. Grass, P.D. Yang, G.A. Somorjai, Hydrothermal growth of mesoporous SBA-15 silica in the presence of PVP-stabilized Pt nanoparticles: Synthesis, characterization, and catalytic properties, J. Am. Chem. Soc.128 (2006) 3027–3037. [51] K. Kon S.M.A. Hakim Siddiki K.I. Shimizu Size- and support-dependent Pt nanocluster catalysis for oxidant-free dehydrogenation of alcohols J. Catal. 304 2013 63 71 K. Kon, S.M.A. Hakim Siddiki, K.I. Shimizu, Size- and support-dependent Pt nanocluster catalysis for oxidant-free dehydrogenation of alcohols, J. Catal.304 (2013) 63–71. [52] L.L. Zhang M.J. Sun C.G. Liu CO oxidation on the phosphotungstic acid supported Rh single-atom catalysts via Rh-assisted Mans-van Krevelen mechanism Mol. Catal. 462 2019 37 45 L.L. Zhang, M.J. Sun, C.G. Liu, CO oxidation on the phosphotungstic acid supported Rh single-atom catalysts via Rh-assisted Mans-van Krevelen mechanism, Mol. Catal.462 (2019) 37–45. [53] A.R. Puigdollers G. Pacchioni CO oxidation on Au nanoparticles supported on ZrO2: role of metal/oxide interface and oxide reducibility ChemCatChem 9 2017 1119 1127 A.R. Puigdollers, G. Pacchioni, CO oxidation on Au nanoparticles supported on ZrO2: role of metal/oxide interface and oxide reducibility, ChemCatChem 9 (2017) 1119–1127. [54] J. Li U.G. Singh T.D. Schladt J.K. Stalick S.L. Scott R. Seshadri Hexagonal YFe1-xPdxO3-δ: nonperovskite host compounds for Pd2+ and their catalytic activity for CO oxidation Chem. Mater. 20 2008 6567 6576 J. Li, U.G. Singh, T.D. Schladt, J.K. Stalick, S.L. Scott, R. Seshadri, Hexagonal YFe1-xPdxO3-δ: nonperovskite host compounds for Pd2+ and their catalytic activity for CO oxidation, Chem. Mater.20 (2008) 6567–6576. [55] X.J. Yang Y. Hu H. Bai M.Q. Feng Z.G. Yan S. Cao B. Yang Tuning of oxygen species and active Pd2+ species of supported catalysts via morphology and Mn doping in oxidative carbonylation of phenol Mol. Catal. 457 2018 1 7 X.J. Yang, Y. Hu, H. Bai, M.Q. Feng, Z.G. Yan, S. Cao, B. Yang, Tuning of oxygen species and active Pd2+ species of supported catalysts via morphology and Mn doping in oxidative carbonylation of phenol, Mol. Catal.457 (2018) 1–7. [56] Q. Zhao Y.L. Ge K.X. Fu Y.F. Zheng Q.L. Liu C.F. Song N. Ji D.G. Ma Catalytic performance of the Pd/TiO2 modified with MnOx catalyst for acetone total oxidation Appl. Catal. Sci. 496 2019 143579 Q. Zhao, Y.L. Ge, K.X. Fu, Y.F. Zheng, Q.L. Liu, C.F. Song, N. Ji, D.G. Ma, Catalytic performance of the Pd/TiO2 modified with MnOx catalyst for acetone total oxidation, Appl. Catal. Sci.496 (2019) 143579. [57] X. Liu S. Jia M. Yang Y. Tang Y. Wen S. Chu J. Wang B. Shan R. Chen Activation of subnanometric Pt on Cu-modified CeO2 via redox-coupled atomic layer deposition for CO oxidation Nat. Commun. 11 2020 4240 X. Liu, S. Jia, M. Yang, Y. Tang, Y. Wen, S. Chu, J. Wang, B. Shan, R. Chen, Activation of subnanometric Pt on Cu-modified CeO2 via redox-coupled atomic layer deposition for CO oxidation, Nat. Commun.11 (2020) 4240. [58] Y. Ma B. Chi W. Liu L. Cao Y. Lin X. Zhang X. Ye S. Wei J. Lu Tailoring of the proximity of platinum single atoms on CeO2 using phosphorus boosts the hydrogenation activity ACS Catal 9 2019 8404 8412 Y. Ma, B. Chi, W. Liu, L. Cao, Y. Lin, X. Zhang, X. Ye, S. Wei, J. Lu, Tailoring of the proximity of platinum single atoms on CeO2 using phosphorus boosts the hydrogenation activity, ACS Catal. 9 (2019) 8404–8412. [59] J.F. Weaver J. Choi V. Mehar C.J. Wu Kinetic coupling among metal and oxide phases during CO oxidation on partially reduced PdO(101): influence of gas-phase composition ACS Catal 7 2017 7319 7331 J.F. Weaver, J. Choi, V. Mehar, C.J. Wu, Kinetic coupling among metal and oxide phases during CO oxidation on partially reduced PdO(101): influence of gas-phase composition, ACS Catal. 7 (2017) 7319–7331. [60] N.M. Martin M. Van den Bossche H. Gronbeck C. Hakanoglu F. Zhang T. Li J. Gustafson J.F. Weaver E. Lundgren CO adsorption on clean and oxidized Pd(111) J. Phys. Chem. C 118 2014 1118 1128 N.M. Martin, M. Van den Bossche, H. Gronbeck, C. Hakanoglu, F. Zhang, T. Li, J. Gustafson, J.F. Weaver, E. Lundgren, CO adsorption on clean and oxidized Pd(111), J. Phys. Chem. C118 (2014) 1118–1128. [61] S.F. Song C. Zhang Y.K. Lou Y.J. Wu Y.L. Guo W.C. Zhan Y. Guo Effects of water on CO catalytic oxidation over Pd/CeO2 J. Rare Earth. 38 2020 891 898 S.F. Song, C. Zhang, Y.K. Lou, Y.J. Wu, Y.L. Guo, W.C. Zhan, Y. Guo, Effects of water on CO catalytic oxidation over Pd/CeO2, J. Rare Earth.38 (2020) 891–898. [62] Q. Zhang S.P. Mo J.Q. Li Y.H. Sun M.Y. Zhang P.R. Chen M.L. Fu J.L. Wu L.M. Chen D.Q. Ye In situ DRIFT spectroscopy insights into the reaction mechanism of CO and toluene co-oxidation over Pt-based catalysts Catal. Sci. Technol. 9 2019 4538 4551 Q. Zhang, S.P. Mo, J.Q. Li, Y.H. Sun, M.Y. Zhang, P.R. Chen, M.L. Fu, J.L. Wu, L.M. Chen, D.Q. Ye, In situ DRIFT spectroscopy insights into the reaction mechanism of CO and toluene co-oxidation over Pt-based catalysts, Catal. Sci. Technol.9 (2019) 4538–4551. [63] A. Abd El-Moemen A.M. Abdel-Mageed J. Bansmann M. Parlinska-Wojtan R.J. Behm G. Kučerová Deactivation of Au/CeO2 catalysts during CO oxidation: influence of pretreatment and reaction conditions J. Catal. 341 2016 160 179 A. Abd El-Moemen, A.M. Abdel-Mageed, J. Bansmann, M. Parlinska-Wojtan, R.J. Behm and G. Kučerová, Deactivation of Au/CeO2 catalysts during CO oxidation: influence of pretreatment and reaction conditions, J. Catal.341 (2016) 160–179. [64] I. Tankov W.H. Cassinelli J.M.C. Bueno K. Arishtirova S. Damyanova DRIFTS study of CO adsorption on praseodymium modified Pt/Al2O3 Appl. Surf. Sci. 259 2012 831 839 I. Tankov, W.H. Cassinelli, J.M.C. Bueno, K. Arishtirova and S. Damyanova, DRIFTS study of CO adsorption on praseodymium modified Pt/Al2O3, Appl. Surf. Sci.259 (2012) 831–839.",
      "scopus-id": "85106938745",
      "coredata": {
        "eid": "1-s2.0-S2468823121002509",
        "dc:description": "Polluting gas CO has attracted wide attention because of its toxicity to human health. Thus, it is urgent for the removal of CO. Herein, a series of Pd supported on UiO-66 catalysts were prepared by ethylene glycol reduction and the supported 0.5 wt% Pd on UiO-66 (0.5Pd-66) was used to investigate the influence of pretreatment conditions. It was found that the 0.5Pd-66 pretreated under O2 atmosphere (0.5Pd-66-O) possessed the better CO oxidation performance, which could completely oxide CO to CO2 at 165 °C. A series of characterization results indicated that the surface area, reduction ability at low temperature, particle size of Pd nanoparticles and surface chemical state of the catalyst were great influenced by pretreatment conditions. The better catalytic performance of 0.5Pd-66-O was ascribed to the high surface area, better reducibility at low temperature, small Pd NPs and more Pd2+ and Olat species. More importantly, the CO oxidation mechanism was proposed by in situ diffuse reflectance infrared Fourier transform spectroscopy of CO oxidation over 0.5Pd-66-O. This work has guiding significance for studying the effect of reaction atmosphere on the structure and activity of catalyst.",
        "openArchiveArticle": "false",
        "prism:coverDate": "2021-06-30",
        "openaccessUserLicense": null,
        "prism:aggregationType": "Journal",
        "prism:url": "https://api.elsevier.com/content/article/pii/S2468823121002509",
        "dc:creator": [
          {
            "@_fa": "true",
            "$": "Bi, Fukun"
          },
          {
            "@_fa": "true",
            "$": "Zhang, Xiaodong"
          },
          {
            "@_fa": "true",
            "$": "Du, Quanxin"
          },
          {
            "@_fa": "true",
            "$": "Yue, Ke"
          },
          {
            "@_fa": "true",
            "$": "Wang, Ruizhuo"
          },
          {
            "@_fa": "true",
            "$": "Li, Fei"
          },
          {
            "@_fa": "true",
            "$": "Liu, Ning"
          },
          {
            "@_fa": "true",
            "$": "Huang, Yuandong"
          }
        ],
        "link": [
          {
            "@_fa": "true",
            "@rel": "self",
            "@href": "https://api.elsevier.com/content/article/pii/S2468823121002509"
          },
          {
            "@_fa": "true",
            "@rel": "scidir",
            "@href": "https://www.sciencedirect.com/science/article/pii/S2468823121002509"
          }
        ],
        "dc:format": "application/json",
        "openaccessType": null,
        "pii": "S2468-8231(21)00250-9",
        "prism:volume": "509",
        "articleNumber": "111633",
        "prism:publisher": "Elsevier B.V.",
        "dc:title": "Influence of pretreatment conditions on low-temperature CO oxidation over Pd supported UiO-66 catalysts",
        "prism:copyright": "© 2021 Elsevier B.V. All rights reserved.",
        "openaccess": "0",
        "prism:issn": "24688231",
        "dcterms:subject": [
          {
            "@_fa": "true",
            "$": "CO oxidation"
          },
          {
            "@_fa": "true",
            "$": "Pd-UiO-66 catalysts"
          },
          {
            "@_fa": "true",
            "$": "Pretreatment condition"
          },
          {
            "@_fa": "true",
            "$": "MOFs"
          }
        ],
        "openaccessArticle": "false",
        "prism:publicationName": "Molecular Catalysis",
        "openaccessSponsorType": null,
        "prism:pageRange": "111633",
        "pubType": "fla",
        "prism:coverDisplayDate": "June 2021",
        "prism:doi": "10.1016/j.mcat.2021.111633",
        "prism:startingPage": "111633",
        "dc:identifier": "doi:10.1016/j.mcat.2021.111633",
        "openaccessSponsorName": null
      },
      "objects": {
        "object": [
          {
            "@category": "standard",
            "@height": "335",
            "@width": "620",
            "@_fa": "true",
            "$": "https://api.elsevier.com/content/object/eid/1-s2.0-S2468823121002509-gr5.jpg?httpAccept=%2A%2F%2A",
            "@multimediatype": "JPEG image file",
            "@type": "IMAGE-DOWNSAMPLED",
            "@size": "53789",
            "@ref": "gr5",
            "@mimetype": "image/jpeg"
          },
          {
            "@category": "standard",
            "@height": "267",
            "@width": "643",
            "@_fa": "true",
            "$": "https://api.elsevier.com/content/object/eid/1-s2.0-S2468823121002509-gr6.jpg?httpAccept=%2A%2F%2A",
            "@multimediatype": "JPEG image file",
            "@type": "IMAGE-DOWNSAMPLED",
            "@size": "46614",
            "@ref": "gr6",
            "@mimetype": "image/jpeg"
          },
          {
            "@category": "standard",
            "@height": "470",
            "@width": "706",
            "@_fa": "true",
            "$": "https://api.elsevier.com/content/object/eid/1-s2.0-S2468823121002509-gr3.jpg?httpAccept=%2A%2F%2A",
            "@multimediatype": "JPEG image file",
            "@type": "IMAGE-DOWNSAMPLED",
            "@size": "135554",
            "@ref": "gr3",
            "@mimetype": "image/jpeg"
          },
          {
            "@category": "standard",
            "@height": "339",
            "@width": "641",
            "@_fa": "true",
            "$": "https://api.elsevier.com/content/object/eid/1-s2.0-S2468823121002509-gr4.jpg?httpAccept=%2A%2F%2A",
            "@multimediatype": "JPEG image file",
            "@type": "IMAGE-DOWNSAMPLED",
            "@size": "67858",
            "@ref": "gr4",
            "@mimetype": "image/jpeg"
          },
          {
            "@category": "standard",
            "@height": "245",
            "@width": "242",
            "@_fa": "true",
            "$": "https://api.elsevier.com/content/object/eid/1-s2.0-S2468823121002509-fx1.jpg?httpAccept=%2A%2F%2A",
            "@multimediatype": "JPEG image file",
            "@type": "IMAGE-DOWNSAMPLED",
            "@size": "18091",
            "@ref": "fx1",
            "@mimetype": "image/jpeg"
          },
          {
            "@category": "standard",
            "@height": "799",
            "@width": "641",
            "@_fa": "true",
            "$": "https://api.elsevier.com/content/object/eid/1-s2.0-S2468823121002509-gr7.jpg?httpAccept=%2A%2F%2A",
            "@multimediatype": "JPEG image file",
            "@type": "IMAGE-DOWNSAMPLED",
            "@size": "114903",
            "@ref": "gr7",
            "@mimetype": "image/jpeg"
          },
          {
            "@category": "standard",
            "@height": "914",
            "@width": "361",
            "@_fa": "true",
            "$": "https://api.elsevier.com/content/object/eid/1-s2.0-S2468823121002509-gr8.jpg?httpAccept=%2A%2F%2A",
            "@multimediatype": "JPEG image file",
            "@type": "IMAGE-DOWNSAMPLED",
            "@size": "130957",
            "@ref": "gr8",
            "@mimetype": "image/jpeg"
          },
          {
            "@category": "standard",
            "@height": "266",
            "@width": "643",
            "@_fa": "true",
            "$": "https://api.elsevier.com/content/object/eid/1-s2.0-S2468823121002509-gr1.jpg?httpAccept=%2A%2F%2A",
            "@multimediatype": "JPEG image file",
            "@type": "IMAGE-DOWNSAMPLED",
            "@size": "44572",
            "@ref": "gr1",
            "@mimetype": "image/jpeg"
          },
          {
            "@category": "standard",
            "@height": "567",
            "@width": "651",
            "@_fa": "true",
            "$": "https://api.elsevier.com/content/object/eid/1-s2.0-S2468823121002509-gr2.jpg?httpAccept=%2A%2F%2A",
            "@multimediatype": "JPEG image file",
            "@type": "IMAGE-DOWNSAMPLED",
            "@size": "129537",
            "@ref": "gr2",
            "@mimetype": "image/jpeg"
          },
          {
            "@category": "thumbnail",
            "@height": "118",
            "@width": "219",
            "@_fa": "true",
            "$": "https://api.elsevier.com/content/object/eid/1-s2.0-S2468823121002509-gr5.sml?httpAccept=%2A%2F%2A",
            "@multimediatype": "GIF image file",
            "@type": "IMAGE-THUMBNAIL",
            "@size": "9569",
            "@ref": "gr5",
            "@mimetype": "image/gif"
          },
          {
            "@category": "thumbnail",
            "@height": "91",
            "@width": "219",
            "@_fa": "true",
            "$": "https://api.elsevier.com/content/object/eid/1-s2.0-S2468823121002509-gr6.sml?httpAccept=%2A%2F%2A",
            "@multimediatype": "GIF image file",
            "@type": "IMAGE-THUMBNAIL",
            "@size": "7970",
            "@ref": "gr6",
            "@mimetype": "image/gif"
          },
          {
            "@category": "thumbnail",
            "@height": "146",
            "@width": "219",
            "@_fa": "true",
            "$": "https://api.elsevier.com/content/object/eid/1-s2.0-S2468823121002509-gr3.sml?httpAccept=%2A%2F%2A",
            "@multimediatype": "GIF image file",
            "@type": "IMAGE-THUMBNAIL",
            "@size": "25915",
            "@ref": "gr3",
            "@mimetype": "image/gif"
          },
          {
            "@category": "thumbnail",
            "@height": "116",
            "@width": "219",
            "@_fa": "true",
            "$": "https://api.elsevier.com/content/object/eid/1-s2.0-S2468823121002509-gr4.sml?httpAccept=%2A%2F%2A",
            "@multimediatype": "GIF image file",
            "@type": "IMAGE-THUMBNAIL",
            "@size": "11901",
            "@ref": "gr4",
            "@mimetype": "image/gif"
          },
          {
            "@category": "thumbnail",
            "@height": "164",
            "@width": "162",
            "@_fa": "true",
            "$": "https://api.elsevier.com/content/object/eid/1-s2.0-S2468823121002509-fx1.sml?httpAccept=%2A%2F%2A",
            "@multimediatype": "GIF image file",
            "@type": "IMAGE-THUMBNAIL",
            "@size": "11163",
            "@ref": "fx1",
            "@mimetype": "image/gif"
          },
          {
            "@category": "thumbnail",
            "@height": "163",
            "@width": "131",
            "@_fa": "true",
            "$": "https://api.elsevier.com/content/object/eid/1-s2.0-S2468823121002509-gr7.sml?httpAccept=%2A%2F%2A",
            "@multimediatype": "GIF image file",
            "@type": "IMAGE-THUMBNAIL",
            "@size": "9209",
            "@ref": "gr7",
            "@mimetype": "image/gif"
          },
          {
            "@category": "thumbnail",
            "@height": "162",
            "@width": "64",
            "@_fa": "true",
            "$": "https://api.elsevier.com/content/object/eid/1-s2.0-S2468823121002509-gr8.sml?httpAccept=%2A%2F%2A",
            "@multimediatype": "GIF image file",
            "@type": "IMAGE-THUMBNAIL",
            "@size": "8235",
            "@ref": "gr8",
            "@mimetype": "image/gif"
          },
          {
            "@category": "thumbnail",
            "@height": "90",
            "@width": "219",
            "@_fa": "true",
            "$": "https://api.elsevier.com/content/object/eid/1-s2.0-S2468823121002509-gr1.sml?httpAccept=%2A%2F%2A",
            "@multimediatype": "GIF image file",
            "@type": "IMAGE-THUMBNAIL",
            "@size": "7937",
            "@ref": "gr1",
            "@mimetype": "image/gif"
          },
          {
            "@category": "thumbnail",
            "@height": "164",
            "@width": "188",
            "@_fa": "true",
            "$": "https://api.elsevier.com/content/object/eid/1-s2.0-S2468823121002509-gr2.sml?httpAccept=%2A%2F%2A",
            "@multimediatype": "GIF image file",
            "@type": "IMAGE-THUMBNAIL",
            "@size": "14513",
            "@ref": "gr2",
            "@mimetype": "image/gif"
          },
          {
            "@category": "high",
            "@height": "1778",
            "@width": "3295",
            "@_fa": "true",
            "$": "https://api.elsevier.com/content/object/eid/1-s2.0-S2468823121002509-gr5_lrg.jpg?httpAccept=%2A%2F%2A",
            "@multimediatype": "JPEG image file",
            "@type": "IMAGE-HIGH-RES",
            "@size": "495473",
            "@ref": "gr5",
            "@mimetype": "image/jpeg"
          },
          {
            "@category": "high",
            "@height": "1420",
            "@width": "3416",
            "@_fa": "true",
            "$": "https://api.elsevier.com/content/object/eid/1-s2.0-S2468823121002509-gr6_lrg.jpg?httpAccept=%2A%2F%2A",
            "@multimediatype": "JPEG image file",
            "@type": "IMAGE-HIGH-RES",
            "@size": "423655",
            "@ref": "gr6",
            "@mimetype": "image/jpeg"
          },
          {
            "@category": "high",
            "@height": "2081",
            "@width": "3127",
            "@_fa": "true",
            "$": "https://api.elsevier.com/content/object/eid/1-s2.0-S2468823121002509-gr3_lrg.jpg?httpAccept=%2A%2F%2A",
            "@multimediatype": "JPEG image file",
            "@type": "IMAGE-HIGH-RES",
            "@size": "1457513",
            "@ref": "gr3",
            "@mimetype": "image/jpeg"
          },
          {
            "@category": "high",
            "@height": "1801",
            "@width": "3408",
            "@_fa": "true",
            "$": "https://api.elsevier.com/content/object/eid/1-s2.0-S2468823121002509-gr4_lrg.jpg?httpAccept=%2A%2F%2A",
            "@multimediatype": "JPEG image file",
            "@type": "IMAGE-HIGH-RES",
            "@size": "691134",
            "@ref": "gr4",
            "@mimetype": "image/jpeg"
          },
          {
            "@category": "high",
            "@height": "1085",
            "@width": "1071",
            "@_fa": "true",
            "$": "https://api.elsevier.com/content/object/eid/1-s2.0-S2468823121002509-fx1_lrg.jpg?httpAccept=%2A%2F%2A",
            "@multimediatype": "JPEG image file",
            "@type": "IMAGE-HIGH-RES",
            "@size": "108941",
            "@ref": "fx1",
            "@mimetype": "image/jpeg"
          },
          {
            "@category": "high",
            "@height": "4244",
            "@width": "3404",
            "@_fa": "true",
            "$": "https://api.elsevier.com/content/object/eid/1-s2.0-S2468823121002509-gr7_lrg.jpg?httpAccept=%2A%2F%2A",
            "@multimediatype": "JPEG image file",
            "@type": "IMAGE-HIGH-RES",
            "@size": "1110402",
            "@ref": "gr7",
            "@mimetype": "image/jpeg"
          },
          {
            "@category": "high",
            "@height": "4853",
            "@width": "1917",
            "@_fa": "true",
            "$": "https://api.elsevier.com/content/object/eid/1-s2.0-S2468823121002509-gr8_lrg.jpg?httpAccept=%2A%2F%2A",
            "@multimediatype": "JPEG image file",
            "@type": "IMAGE-HIGH-RES",
            "@size": "1239374",
            "@ref": "gr8",
            "@mimetype": "image/jpeg"
          },
          {
            "@category": "high",
            "@height": "1412",
            "@width": "3418",
            "@_fa": "true",
            "$": "https://api.elsevier.com/content/object/eid/1-s2.0-S2468823121002509-gr1_lrg.jpg?httpAccept=%2A%2F%2A",
            "@multimediatype": "JPEG image file",
            "@type": "IMAGE-HIGH-RES",
            "@size": "425950",
            "@ref": "gr1",
            "@mimetype": "image/jpeg"
          },
          {
            "@category": "high",
            "@height": "3012",
            "@width": "3460",
            "@_fa": "true",
            "$": "https://api.elsevier.com/content/object/eid/1-s2.0-S2468823121002509-gr2_lrg.jpg?httpAccept=%2A%2F%2A",
            "@multimediatype": "JPEG image file",
            "@type": "IMAGE-HIGH-RES",
            "@size": "1289175",
            "@ref": "gr2",
            "@mimetype": "image/jpeg"
          },
          {
            "@category": "standard",
            "@_fa": "true",
            "$": "https://api.elsevier.com/content/object/eid/1-s2.0-S2468823121002509-mmc1.docx?httpAccept=%2A%2F%2A",
            "@multimediatype": "Microsoft Word file",
            "@type": "APPLICATION",
            "@size": "2469924",
            "@ref": "mmc1",
            "@mimetype": "application/word"
          },
          {
            "@category": "thumbnail",
            "@_fa": "true",
            "$": "https://api.elsevier.com/content/object/eid/1-s2.0-S2468823121002509-si1.svg?httpAccept=%2A%2F%2A",
            "@multimediatype": "Scalable Vector Graphics file",
            "@type": "ALTIMG",
            "@size": "6789",
            "@ref": "si1",
            "@mimetype": "image/svg+xml"
          },
          {
            "@category": "thumbnail",
            "@_fa": "true",
            "$": "https://api.elsevier.com/content/object/eid/1-s2.0-S2468823121002509-si2.svg?httpAccept=%2A%2F%2A",
            "@multimediatype": "Scalable Vector Graphics file",
            "@type": "ALTIMG",
            "@size": "11084",
            "@ref": "si2",
            "@mimetype": "image/svg+xml"
          },
          {
            "@category": "standard",
            "@_fa": "true",
            "$": "https://api.elsevier.com/content/object/eid/1-s2.0-S2468823121002509-am.pdf?httpAccept=%2A%2F%2A",
            "@multimediatype": "Acrobat PDF file",
            "@type": "AAM-PDF",
            "@size": "1178792",
            "@ref": "am",
            "@mimetype": "application/pdf"
          }
        ]
      },
      "link": {
        "@rel": "abstract",
        "@href": "https://api.elsevier.com/content/abstract/scopus_id/85106938745"
      }
    }
  }
}