{
  "metadata": {
    "title": "Selenomethyl Schiff base coordination compounds as m-TiO<ce:inf loc=post>2</ce:inf> co-catalysts for efficient hydrogen production",
    "authors": "; ; ",
    "journal": "Molecular Catalysis",
    "date": "2025-10-31",
    "doi": "10.1016/j.mcat.2025.115365",
    "abstract": "",
    "uri": "https://api.elsevier.com/content/article/pii/S2468823125005504",
    "pii": "S2468823125005504"
  },
  "fulltext": {
    "full-text-retrieval-response": {
      "scopus-eid": "2-s2.0-105011190719",
      "originalText": "serial JL 315758 291210 291744 291790 291809 31 Molecular Catalysis MOLECULARCATALYSIS 2025-07-24 2025-07-24 2025-07-24 2025-07-24 2025-09-05T15:57:56 1-s2.0-S2468823125005504 S2468-8231(25)00550-4 S2468823125005504 10.1016/j.mcat.2025.115365 S300 S300.1 FULL-TEXT 1-s2.0-S2468823125X00122 2025-09-05T15:12:44.587689Z 0 0 20251001 20251031 2025 2025-07-24T03:33:21.850614Z absattachment articleinfo articlenumber articletitlenorm authfirstinitialnorm authfirstsurnamenorm cid cids contenttype copyright crossmark dateloaded dateloadedtxt datesearch datesort dateupdated dco docsubtype doctype doi eid ewtransactionid hubeid indexeddate issn issnnorm itemstage itemtransactionid itemweight openaccess openarchive pg pgfirst pii piinorm pubdateend pubdatestart pubdatetxt pubyr sectiontitle sortorder srctitle srctitlenorm srctype ssids alllist content subj subheadings suppl tomb volfirst volissue volumelist webpdf webpdfpagecount yearnav figure table e-component body acknowledge affil appendices articletitle auth authfirstini authfull authkeywords authlast highlightsabst orcid primabst ref specialabst 2468-8231 24688231 true 585 585 C Volume 585 32 115365 115365 115365 202510 October 2025 2025-10-01 2025-10-31 2025 Regular Papers article fla © 2025 Elsevier B.V. All rights are reserved, including those for text and data mining, AI training, and similar technologies. SELENOMETHYLSCHIFFBASECOORDINATIONCOMPOUNDSMTIO2COCATALYSTSFOREFFICIENTHYDROGENPRODUCTION DASILVA T 1 Introduction 2 Experimental section 2.1 Materials 2.2 Physical measurements 2.2.1 Ligand HL and complexes (1–4) 2.2.2 Photocatalysts (m-TiO2-n) ( n = 1–4) 2.3 Synthesis 2.3.1 Synthesis of ligand HL 2.3.2 Synthesis of complexes (1–4) 2.3.3 Preparation of m-TiO2 and m-TiO2-n ( n = 1–4) 2.3.4 Protocol for hydrogen production experiments 3 Results and discussion 3.1 Synthetic route for the preparation of complexes 1–4 3.2 Characterization of complexes 1–4 3.2.1 X-ray crystallography 3.2.2 FT-IR, Raman and NMR spectroscopy 3.2.3 UV–Vis spectroscopy 3.2.4 Cyclic voltammetry 3.3 Photocatalytic hydrogen production via water photolysis 3.3.1 Characterization of photocatalysts 3.3.2 Photocatalytic hydrogen production 3.3.3 Electron transfer mechanism of m-TiO2–1 4 Conclusions CRediT authorship contribution statement Acknowledgments Appendix Supplementary materials References ZHANG 2023 e202301041 P GONUGUNTLA 2023 100621 S HISATOMI 2024 1411644 T RAFIQUE 2023 25640 25648 M NGUYEN 2024 141785 T MA 2014 9987 10043 Y GUO 2016 3701 3730 Q HIDALGOJIMENEZ 2023 23523 23535 J KATAI 2024 115409 M HUANG 2020 5863 5895 J WILLKOMM 2016 9 23 J NIU 2013 39 44 J WANG 2005 15397 15409 Q BATALOVIC 2017 7062 7071 K BUMAJDAD 2014 7146 7158 A DOZZI 2013 595 601 M GAO 2021 120057 D MELLO 2019 14196 14201 M VEIKKO 2013 539 544 U VERMA 2012 1543 1548 S GRABULOSA 2009 8030 8036 A CERVO 2025 7902 7919 R STRAISTARI 2018 2259 2266 T SCHROETER 2017 3004 3009 F BAI 2014 1617 1623 C XU 2008 2996 3000 Y RAEBIGER 2006 3345 3351 J ZIANNA 2019 110792 A KARAMI 2016 78424 78435 K GAO 2007 1404 1409 E PADHYE 2005 1154 1156 S CHAUHAN 2019 2381 2388 R CARGNELUTTI 2015 7948 7953 R DESDIAS 2020 e5750 R CERVO 2021 12863 12870 R XIE 2019 107598 A GUPTA 2008 1420 1450 K COZZI 2004 410 421 P JUNGFER 2020 4303 4312 M ROCAJUNGFER 2019 4974 4984 M SHELDRICK 2008 112 122 G SHELDRICK 2015 3 8 G DOLOMANOV 2009 339 341 O BRANDENBURG 2019 K DIAMONDCRYSTALMOLECULARSTRUCTUREVISUALIZATIONVERSION460 MURPHY 2007 1326 1337 A MAKULA 2018 6814 6817 P BOND 2000 3492 3496 A PEGLOW 2017 3734 3738 T SAMSUDIN 2015 959 968 E MACHADO 2010 130 141 G YANG 2007 955 964 L PALURU 2015 397 407 D DUNSKI 1973 2707 2717 N FONTANA 2024 171 L ZELENAK 2007 262 272 V SOCRATES 2001 G INFRAREDRAMANCHARACTERISTICGROUPFREQUENCIESTABLESCHARTS SORSCHE 2025 216454 D VLCEK 1998 219 256 A INDELLI 1998 6084 6089 M FERREIRA 2025 141239 W FONTANA 2019 e4903 L CECHIN 2021 19255 19263 C SIQUEIRA 2020 110950 J FIORAVANCO 2023 112070 L QIN 2009 1168 1174 X NITHIYANANTHAM 2014 35659 35672 U OHSAKA 1978 321 324 T AN 2005 2713 2718 H SUDANT 2005 1263 1269 G CAMARGO 2022 2534 2545 M SANTARELLI 2024 114431 A LUNARDI 2023 16841 16848 A DASILVA 2022 18165 18172 F ASAHI 2014 9824 9852 R MURUGESAN 2019 12206 12235 P DASILVAX2025X115365 DASILVAX2025X115365XT 2027-07-24T00:00:00.000Z 2027-07-24T00:00:00.000Z http://creativecommons.org/licenses/by-nc-nd/4.0/ © 2025 Elsevier B.V. All rights are reserved, including those for text and data mining, AI training, and similar technologies. 2025-07-25T02:01:54.542Z http://vtw.elsevier.com/data/voc/AddOnTypes/50.7/aggregated-refined CNPq UNIVERSAL 405965/2023\\u20130 131208/2023\\u20133 National Council for Scientific and Technological Development http://data.elsevier.com/vocabulary/SciValFunders/501100003593 http://sws.geonames.org/3469034 Coordination of Higher Education Personnel Improvement http://data.elsevier.com/vocabulary/SciValFunders/501100002322 http://sws.geonames.org/3469034 FINEP FINEP Financiadora de Estudos e Projetos http://data.elsevier.com/vocabulary/SciValFunders/501100004809 http://sws.geonames.org/3469034/ Fundação de Amparo à Pesquisa do Estado do Rio Grande do Sul – FAPERGS ARD 21/2551\\u20130000712\\u20135 Foundation for Research Support of Rio Grande do Sul State http://data.elsevier.com/vocabulary/SciValFunders/501100004263 http://sws.geonames.org/3469034 This work was supported by funding from Funda\\u00E7\\u00E3o de Amparo \\u00E0 Pesquisa do Estado do Rio Grande do Sul \\u2013 FAPERGS (ARD 21/2551\\u20130000712\\u20135), Conselho Nacional de Desenvolvimento Cient\\u00EDfico e Tecnol\\u00F3gico - CNPq (UNIVERSAL 405965/2023\\u20130) and FINEP. T. A. T. S. sincerely thanks the Conselho Nacional de Desenvolvimento Cient\\u00EDfico e Tecnol\\u00F3gico (CNPq \\u2013 131208/2023\\u20133) for the scholarship. This study was financed in part by the Coordena\\u00E7\\u00E3o de Aperfei\\u00E7oamento de Pessoal de N\\u00EDvel Superior \\u2013 Brazil (CAPES) \\u2013 Finance Code 001. https://doi.org/10.15223/policy-017 https://doi.org/10.15223/policy-037 https://doi.org/10.15223/policy-012 https://doi.org/10.15223/policy-029 https://doi.org/10.15223/policy-004 item S2468-8231(25)00550-4 S2468823125005504 1-s2.0-S2468823125005504 10.1016/j.mcat.2025.115365 315758 2025-09-05T15:12:44.587689Z 2025-10-01 2025-10-31 1-s2.0-S2468823125005504-main.pdf https://s3-eu-west-1.amazonaws.com/prod-ucs-content-store-eu-west/content/pii:S2468823125005504/MAIN/application/pdf/137b814eeba88a685951dcccdfcf4efc/main.pdf main.pdf pdf true 6425929 MAIN 13 1-s2.0-S2468823125005504-main_1.png https://s3-eu-west-1.amazonaws.com/prod-ucs-content-store-eu-west/content/pii:S2468823125005504/PREVIEW/image/png/d5f37d8aa00ed0a6fd85ebf9a08a14e7/main_1.png main_1.png png 58857 928 656 IMAGE-WEB-PDF 1 1-s2.0-S2468823125005504-ga1.jpg https://s3-eu-west-1.amazonaws.com/prod-ucs-content-store-eu-west/content/pii:S2468823125005504/ga1/DOWNSAMPLED/image/jpeg/80c05b6d304912839730723139521707/ga1.jpg ga1 true ga1.jpg jpg 31658 200 432 IMAGE-DOWNSAMPLED 1-s2.0-S2468823125005504-gr12.jpg https://s3-eu-west-1.amazonaws.com/prod-ucs-content-store-eu-west/content/pii:S2468823125005504/gr12/DOWNSAMPLED/image/jpeg/19ee1283665efcb9ee4410109c42c701/gr12.jpg gr12 gr12.jpg jpg 49237 408 473 IMAGE-DOWNSAMPLED 1-s2.0-S2468823125005504-sc2.jpg https://s3-eu-west-1.amazonaws.com/prod-ucs-content-store-eu-west/content/pii:S2468823125005504/sc2/DOWNSAMPLED/image/jpeg/d36fbd8d30be7729c77679417e6ae9e9/sc2.jpg sc2 sc2.jpg jpg 33109 464 425 IMAGE-DOWNSAMPLED 1-s2.0-S2468823125005504-sc1.jpg https://s3-eu-west-1.amazonaws.com/prod-ucs-content-store-eu-west/content/pii:S2468823125005504/sc1/DOWNSAMPLED/image/jpeg/a26fe99090626d91bde71eeeb484b547/sc1.jpg sc1 sc1.jpg jpg 20031 168 606 IMAGE-DOWNSAMPLED 1-s2.0-S2468823125005504-gr2.jpg https://s3-eu-west-1.amazonaws.com/prod-ucs-content-store-eu-west/content/pii:S2468823125005504/gr2/DOWNSAMPLED/image/jpeg/6466d890822eab34dd9378fb7b18051d/gr2.jpg gr2 gr2.jpg jpg 24714 285 473 IMAGE-DOWNSAMPLED 1-s2.0-S2468823125005504-gr1.jpg https://s3-eu-west-1.amazonaws.com/prod-ucs-content-store-eu-west/content/pii:S2468823125005504/gr1/DOWNSAMPLED/image/jpeg/cbff4656abae000333728d746e5e3f1b/gr1.jpg gr1 gr1.jpg jpg 30957 260 623 IMAGE-DOWNSAMPLED 1-s2.0-S2468823125005504-gr10.jpg https://s3-eu-west-1.amazonaws.com/prod-ucs-content-store-eu-west/content/pii:S2468823125005504/gr10/DOWNSAMPLED/image/jpeg/686b391b55bfd3181a4d6b031638cb8f/gr10.jpg gr10 gr10.jpg jpg 24828 326 465 IMAGE-DOWNSAMPLED 1-s2.0-S2468823125005504-gr11.jpg https://s3-eu-west-1.amazonaws.com/prod-ucs-content-store-eu-west/content/pii:S2468823125005504/gr11/DOWNSAMPLED/image/jpeg/7fa75c85c9e6d80490ab3422b3741b97/gr11.jpg gr11 gr11.jpg jpg 61915 607 631 IMAGE-DOWNSAMPLED 1-s2.0-S2468823125005504-gr6.jpg https://s3-eu-west-1.amazonaws.com/prod-ucs-content-store-eu-west/content/pii:S2468823125005504/gr6/DOWNSAMPLED/image/jpeg/f736ae0ebb464aedc4455d2b93920837/gr6.jpg gr6 gr6.jpg jpg 37191 352 472 IMAGE-DOWNSAMPLED 1-s2.0-S2468823125005504-gr5.jpg https://s3-eu-west-1.amazonaws.com/prod-ucs-content-store-eu-west/content/pii:S2468823125005504/gr5/DOWNSAMPLED/image/jpeg/ebf5eac6888e0825907ec3828bd7d627/gr5.jpg gr5 gr5.jpg jpg 39879 377 464 IMAGE-DOWNSAMPLED 1-s2.0-S2468823125005504-gr4.jpg https://s3-eu-west-1.amazonaws.com/prod-ucs-content-store-eu-west/content/pii:S2468823125005504/gr4/DOWNSAMPLED/image/jpeg/ca4501f818202755ba62624f4f1c419e/gr4.jpg gr4 gr4.jpg jpg 40110 375 470 IMAGE-DOWNSAMPLED 1-s2.0-S2468823125005504-gr3.jpg https://s3-eu-west-1.amazonaws.com/prod-ucs-content-store-eu-west/content/pii:S2468823125005504/gr3/DOWNSAMPLED/image/jpeg/cb2f041ef1c5fb3413f98f38beec9da7/gr3.jpg gr3 gr3.jpg jpg 57179 311 659 IMAGE-DOWNSAMPLED 1-s2.0-S2468823125005504-gr9.jpg https://s3-eu-west-1.amazonaws.com/prod-ucs-content-store-eu-west/content/pii:S2468823125005504/gr9/DOWNSAMPLED/image/jpeg/5205bd94dd0f3b1147aa4bad351eac35/gr9.jpg gr9 gr9.jpg jpg 32777 334 420 IMAGE-DOWNSAMPLED 1-s2.0-S2468823125005504-gr8.jpg https://s3-eu-west-1.amazonaws.com/prod-ucs-content-store-eu-west/content/pii:S2468823125005504/gr8/DOWNSAMPLED/image/jpeg/bc6b92b85caf37490c9201658e89f47e/gr8.jpg gr8 gr8.jpg jpg 102492 343 492 IMAGE-DOWNSAMPLED 1-s2.0-S2468823125005504-gr7.jpg https://s3-eu-west-1.amazonaws.com/prod-ucs-content-store-eu-west/content/pii:S2468823125005504/gr7/DOWNSAMPLED/image/jpeg/065510ef158a446f02759d41b641559c/gr7.jpg gr7 gr7.jpg jpg 51355 466 566 IMAGE-DOWNSAMPLED 1-s2.0-S2468823125005504-ga1.sml https://s3-eu-west-1.amazonaws.com/prod-ucs-content-store-eu-west/content/pii:S2468823125005504/ga1/THUMBNAIL/image/gif/ce90714d1a59609b9e9432bc6af2d88d/ga1.sml ga1 true ga1.sml sml 15023 101 219 IMAGE-THUMBNAIL 1-s2.0-S2468823125005504-gr12.sml https://s3-eu-west-1.amazonaws.com/prod-ucs-content-store-eu-west/content/pii:S2468823125005504/gr12/THUMBNAIL/image/gif/80fe837900de6ef5bc4ede01caaaf4b7/gr12.sml gr12 gr12.sml sml 13003 164 190 IMAGE-THUMBNAIL 1-s2.0-S2468823125005504-sc2.sml https://s3-eu-west-1.amazonaws.com/prod-ucs-content-store-eu-west/content/pii:S2468823125005504/sc2/THUMBNAIL/image/gif/573b6cd16d0f5cd40b80e9b6d2ea7773/sc2.sml sc2 sc2.sml sml 6485 164 150 IMAGE-THUMBNAIL 1-s2.0-S2468823125005504-sc1.sml https://s3-eu-west-1.amazonaws.com/prod-ucs-content-store-eu-west/content/pii:S2468823125005504/sc1/THUMBNAIL/image/gif/64b22ca9ed7ae66a9720961a19272225/sc1.sml sc1 sc1.sml sml 5172 61 219 IMAGE-THUMBNAIL 1-s2.0-S2468823125005504-gr2.sml https://s3-eu-west-1.amazonaws.com/prod-ucs-content-store-eu-west/content/pii:S2468823125005504/gr2/THUMBNAIL/image/gif/5b42cb8a30cec29ec99571543c67e54d/gr2.sml gr2 gr2.sml sml 7404 132 219 IMAGE-THUMBNAIL 1-s2.0-S2468823125005504-gr1.sml https://s3-eu-west-1.amazonaws.com/prod-ucs-content-store-eu-west/content/pii:S2468823125005504/gr1/THUMBNAIL/image/gif/f6a3bd4a9ab86f21c84b5363ae868299/gr1.sml gr1 gr1.sml sml 7714 91 219 IMAGE-THUMBNAIL 1-s2.0-S2468823125005504-gr10.sml https://s3-eu-west-1.amazonaws.com/prod-ucs-content-store-eu-west/content/pii:S2468823125005504/gr10/THUMBNAIL/image/gif/ae1173f3b95b0c87d290f40fa85588e3/gr10.sml gr10 gr10.sml sml 7228 153 219 IMAGE-THUMBNAIL 1-s2.0-S2468823125005504-gr11.sml https://s3-eu-west-1.amazonaws.com/prod-ucs-content-store-eu-west/content/pii:S2468823125005504/gr11/THUMBNAIL/image/gif/e89051797f8066ed9b96c1ade2f827bb/gr11.sml gr11 gr11.sml sml 8142 163 170 IMAGE-THUMBNAIL 1-s2.0-S2468823125005504-gr6.sml https://s3-eu-west-1.amazonaws.com/prod-ucs-content-store-eu-west/content/pii:S2468823125005504/gr6/THUMBNAIL/image/gif/5d84fca0eac9d36d8c3c18e539ed3edf/gr6.sml gr6 gr6.sml sml 8826 163 219 IMAGE-THUMBNAIL 1-s2.0-S2468823125005504-gr5.sml https://s3-eu-west-1.amazonaws.com/prod-ucs-content-store-eu-west/content/pii:S2468823125005504/gr5/THUMBNAIL/image/gif/eb2b422c8bac7d2452d30603715c2f4b/gr5.sml gr5 gr5.sml sml 8154 164 202 IMAGE-THUMBNAIL 1-s2.0-S2468823125005504-gr4.sml https://s3-eu-west-1.amazonaws.com/prod-ucs-content-store-eu-west/content/pii:S2468823125005504/gr4/THUMBNAIL/image/gif/71195babd02c22743f3efa759cf82fe5/gr4.sml gr4 gr4.sml sml 8626 164 205 IMAGE-THUMBNAIL 1-s2.0-S2468823125005504-gr3.sml https://s3-eu-west-1.amazonaws.com/prod-ucs-content-store-eu-west/content/pii:S2468823125005504/gr3/THUMBNAIL/image/gif/d720f73044d1c19b292e1dd019978f07/gr3.sml gr3 gr3.sml sml 10206 104 219 IMAGE-THUMBNAIL 1-s2.0-S2468823125005504-gr9.sml https://s3-eu-west-1.amazonaws.com/prod-ucs-content-store-eu-west/content/pii:S2468823125005504/gr9/THUMBNAIL/image/gif/33eb719576b0a4fc8aa3aa4cad12544f/gr9.sml gr9 gr9.sml sml 8735 164 206 IMAGE-THUMBNAIL 1-s2.0-S2468823125005504-gr8.sml https://s3-eu-west-1.amazonaws.com/prod-ucs-content-store-eu-west/content/pii:S2468823125005504/gr8/THUMBNAIL/image/gif/f3a85bc62d3a3d3f81aa43dda9c0f55f/gr8.sml gr8 gr8.sml sml 31180 153 219 IMAGE-THUMBNAIL 1-s2.0-S2468823125005504-gr7.sml https://s3-eu-west-1.amazonaws.com/prod-ucs-content-store-eu-west/content/pii:S2468823125005504/gr7/THUMBNAIL/image/gif/4623f608dfa10643049229916122917c/gr7.sml gr7 gr7.sml sml 7626 164 199 IMAGE-THUMBNAIL 1-s2.0-S2468823125005504-ga1_lrg.jpg https://s3-eu-west-1.amazonaws.com/prod-ucs-content-store-eu-west/content/pii:S2468823125005504/HIGHRES/image/jpeg/c8a038e211c2096360185acab59645c7/ga1_lrg.jpg ga1 true ga1_lrg.jpg jpg 249927 886 1914 IMAGE-HIGH-RES 1-s2.0-S2468823125005504-gr12_lrg.jpg https://s3-eu-west-1.amazonaws.com/prod-ucs-content-store-eu-west/content/pii:S2468823125005504/HIGHRES/image/jpeg/41050a112c09994a93f583d89860b653/gr12_lrg.jpg gr12 gr12_lrg.jpg jpg 373555 1805 2093 IMAGE-HIGH-RES 1-s2.0-S2468823125005504-sc2_lrg.jpg https://s3-eu-west-1.amazonaws.com/prod-ucs-content-store-eu-west/content/pii:S2468823125005504/HIGHRES/image/jpeg/55441ebfa98f61af9ffdbbc267e06844/sc2_lrg.jpg sc2 sc2_lrg.jpg jpg 247093 2057 1883 IMAGE-HIGH-RES 1-s2.0-S2468823125005504-sc1_lrg.jpg https://s3-eu-west-1.amazonaws.com/prod-ucs-content-store-eu-west/content/pii:S2468823125005504/HIGHRES/image/jpeg/e1761eb8d4f162df015b651d9a060eea/sc1_lrg.jpg sc1 sc1_lrg.jpg jpg 155110 742 2683 IMAGE-HIGH-RES 1-s2.0-S2468823125005504-gr2_lrg.jpg https://s3-eu-west-1.amazonaws.com/prod-ucs-content-store-eu-west/content/pii:S2468823125005504/HIGHRES/image/jpeg/2a201b1ab7f6b95fca15f2ab68b4867c/gr2_lrg.jpg gr2 gr2_lrg.jpg jpg 181426 1260 2093 IMAGE-HIGH-RES 1-s2.0-S2468823125005504-gr1_lrg.jpg https://s3-eu-west-1.amazonaws.com/prod-ucs-content-store-eu-west/content/pii:S2468823125005504/HIGHRES/image/jpeg/49ecfdbd89f1569e45e3ad40042f711f/gr1_lrg.jpg gr1 gr1_lrg.jpg jpg 226561 1151 2759 IMAGE-HIGH-RES 1-s2.0-S2468823125005504-gr10_lrg.jpg https://s3-eu-west-1.amazonaws.com/prod-ucs-content-store-eu-west/content/pii:S2468823125005504/HIGHRES/image/jpeg/bfb9595f2ef7672cb6af47b72f6e7bff/gr10_lrg.jpg gr10 gr10_lrg.jpg jpg 187714 1442 2058 IMAGE-HIGH-RES 1-s2.0-S2468823125005504-gr11_lrg.jpg https://s3-eu-west-1.amazonaws.com/prod-ucs-content-store-eu-west/content/pii:S2468823125005504/HIGHRES/image/jpeg/386dd2a573f07c88301e44416c82114f/gr11_lrg.jpg gr11 gr11_lrg.jpg jpg 416951 2686 2793 IMAGE-HIGH-RES 1-s2.0-S2468823125005504-gr6_lrg.jpg https://s3-eu-west-1.amazonaws.com/prod-ucs-content-store-eu-west/content/pii:S2468823125005504/HIGHRES/image/jpeg/baf19060ead56e7f266558e91c0b898e/gr6_lrg.jpg gr6 gr6_lrg.jpg jpg 321154 1559 2092 IMAGE-HIGH-RES 1-s2.0-S2468823125005504-gr5_lrg.jpg https://s3-eu-west-1.amazonaws.com/prod-ucs-content-store-eu-west/content/pii:S2468823125005504/HIGHRES/image/jpeg/4b076098df7d991da9b6094b93aff025/gr5_lrg.jpg gr5 gr5_lrg.jpg jpg 328512 1670 2055 IMAGE-HIGH-RES 1-s2.0-S2468823125005504-gr4_lrg.jpg https://s3-eu-west-1.amazonaws.com/prod-ucs-content-store-eu-west/content/pii:S2468823125005504/HIGHRES/image/jpeg/295b391a12e66d95a73e64aa76c6a223/gr4_lrg.jpg gr4 gr4_lrg.jpg jpg 330885 1662 2083 IMAGE-HIGH-RES 1-s2.0-S2468823125005504-gr3_lrg.jpg https://s3-eu-west-1.amazonaws.com/prod-ucs-content-store-eu-west/content/pii:S2468823125005504/HIGHRES/image/jpeg/c3ad054861448f634111f0476c1a8aac/gr3_lrg.jpg gr3 gr3_lrg.jpg jpg 800992 1380 2920 IMAGE-HIGH-RES 1-s2.0-S2468823125005504-gr9_lrg.jpg https://s3-eu-west-1.amazonaws.com/prod-ucs-content-store-eu-west/content/pii:S2468823125005504/HIGHRES/image/jpeg/e1ebe20270abf371e5a897fb391baf19/gr9_lrg.jpg gr9 gr9_lrg.jpg jpg 209151 1480 1859 IMAGE-HIGH-RES 1-s2.0-S2468823125005504-gr8_lrg.jpg https://s3-eu-west-1.amazonaws.com/prod-ucs-content-store-eu-west/content/pii:S2468823125005504/HIGHRES/image/jpeg/78716c9b629f5a8da5c67e103ee956c3/gr8_lrg.jpg gr8 gr8_lrg.jpg jpg 1329901 1517 2177 IMAGE-HIGH-RES 1-s2.0-S2468823125005504-gr7_lrg.jpg https://s3-eu-west-1.amazonaws.com/prod-ucs-content-store-eu-west/content/pii:S2468823125005504/HIGHRES/image/jpeg/327438d8c921f1a0b59cb3fc8b3b7cb2/gr7_lrg.jpg gr7 gr7_lrg.jpg jpg 445418 2066 2508 IMAGE-HIGH-RES 1-s2.0-S2468823125005504-mmc1.pdf https://s3-eu-west-1.amazonaws.com/prod-ucs-content-store-eu-west/content/pii:S2468823125005504/mmc1/MAIN/application/pdf/ac13c86ef3088b48d8c24155ce33a79b/mmc1.pdf mmc1 mmc1.pdf pdf false 5824173 APPLICATION MCAT 115365 115365 S2468-8231(25)00550-4 10.1016/j.mcat.2025.115365 Elsevier B.V. Fig. 1 Molecular structure of palladium(II) complexes (a) 1 and (b) 2 (’) = 1-x, 1-y, -z. The crystallization solvent molecules and the aromatic hydrogen atoms were omitted for clarity. Fig. 1 Fig. 2 Molecular structure of (a) 3 (’) = 1-x, 1-y, -z and (b) 4 (’) = 1-x, 1-y, 1-z. The crystallization solvent molecules and the aromatic hydrogen atoms were omitted for clarity. Fig. 2 Fig. 3 (a) FT-IR and (b) Raman spectra for HL and complexes 1–4. Fig. 3 Fig. 4 UV–Vis spectra in CHCl3 of HL and complexes 1–4. Fig. 4 Fig. 5 Absorbance spectra of HL and complexes 1–4 in the solid state. Fig. 5 Fig. 6 Cyclic voltammetry analysis of HL and complexes 1–4 in a dry DMF solution (E versus NHE), using 0.1 M of TBAClO4 as supporting electrolyte, at scan rate of 100 mV s‒1. Fig. 6 Fig. 7 Powder X-ray diffractograms for the photocatalysts and the crystallography open database reference for the TiO2 anatase (CCDC 1671224). Fig. 7 Fig. 8 Elemental mapping images of m-TiO2–1. Fig. 8 Fig. 9 H2 evolution (μmol g-1) over a 6-hour run using pure m-TiO2, Degussa P25, and m-TiO2-n (n = 1–4). Fig. 9 Fig. 10 Hydrogen evolution (µmol g⁻¹) at sixth hour run for m-TiO₂−1 and m-TiO₂−2 in comparison with the pure m-TiO2 matrix. Fig. 10 Fig. 11 Recyclability test of m-TiO2–1 under 5 h of irradiation per cycle (top) and long-term stability of m-TiO2–1 over 30 h (bottom). Fig. 11 Fig. 12 Proposed electron transfer mechanism between complex 1 and m-TiO2 matrix in water photolysis, using TEOA as sacrificial agent. Fig. 12 Scheme 1 General route to obtain HL. Scheme 1 Scheme 2 Preparation of complexes 1–4. Scheme 2 Table 1 Selected FT-IR spectral data of HL and complexes 1‒4. Table 1 Assignments HL 1 2 3 4 ν(OH) 3205 – – – – ν(CH)ar 3070; 3052 3055; 3035 3039 3039 3046 νa(CH3) 2981 2940 3013 3011 3010 νs(CH3) 2927 2926 2930 2924 2925 ν(COO-) – 1585 – – – ν(C = N)imine 1616 1610 1605 1604 1604 ν(C = N)py 1564 1579 1568 1565 1565 ν(C = C) 1548 1518 1530 1528 1525 Table 2 Redox potentials of HL and complexes 1–4 in a dry DMF solution (E versus NHE). Table 2 Compound E red1 (V) a E red2(V) a E red3(V) a E ox1 (V) b E ox2 (V) b HL −0.37 −0.98 −1.69 1.06 – 1 −0.33 −0.63 −1.27 1.09 1.26 2 −0.26 −0.56 −1.14 1.08 – 3 −0.50 – – 1.00 – 4 −0.40 c −1.00 −1.65 0.66 0.95 a E pc = cathodic peak. b E pa = anodic peak. c E 1/2 = 1/2(E pc + E pa). Table 3 Immobilization yield and loading of the m-TiO2-n (n = 1–4) photocatalysts. Table 3 Photocatalyst Immobilization yield (wt %) Loading (μmol g-1) m-TiO2–1 1.42 25.1 m-TiO2–2 2.03 28.9 m-TiO2–3 1.39 21.4 m-TiO2–4 0.64 9.90 Table 4 TiO2 matrix modified with metal complexes as co-catalysts for photocatalytic H2 production. Table 4 Co-catalyst Light source Sacrificial Reagent H2 evolution (μmol g-1) over 6 h Ref. [PdL(OAc)] (1) Xe/Hg lamp TEOA 20,895 This work [PdL2] (2) Xe/Hg lamp TEOA 13,271 This work [NiL2] (3) Xe/Hg lamp TEOA 1083 This work [CuL2] (4) Xe/Hg lamp TEOA 7819 This work [Cu2(μ-SO4)2(LA)2] a Xe/Hg lamp TEOA 7800 [22] [CuCl2(LA)] a Xe/Hg lamp TEOA 1600 [22] [CuCl2(LC)2] b Xe/Hg lamp TEOA 6315 [70] [Ni(LT)] c Xe/Hg lamp TEOA 6200 [71] [Cu(LT)] c Xe/Hg lamp TEOA 360 [71] [Zn(μ-HSeO3)2(bipy)] n Xe/Hg lamp TEOA 1615 [72] [Zn(μ-HSeO3)2(phen)] n Xe/Hg lamp TEOA 335.50 [72] [Co(2-Py2Te2-κN,N′)Cl2] Xe/Hg lamp TEOA 615 [73] [Co(2-Py2Te2-κN,N′)Br2] Xe/Hg lamp TEOA 587 [73] a : LA: bis((3-aminopyridin-2-yl)selanyl)methane. b : LC: chromone-derived ligand (C19H11NO5). c : H2LT: thiophene-2,5-dicarboxaldehyde-bis-thiosemicarbazone (C8H10N6S3), LT (C8H8N6S3). Selenomethyl Schiff base coordination compounds as m-TiO2 co-catalysts for efficient hydrogen production Thiago Acosta Trindade da Silva Visualization Methodology Investigation Formal analysis a Leonardo Carneiro Lanes Visualization Formal analysis a Rodrigo Cervo Writing – review & editing Visualization Formal analysis a Camila Nunes Cechin Writing – review & editing Formal analysis a Claudia Cristina Gatto Writing – review & editing Formal analysis b Gabriela Nanci Ledesma Writing – review & editing Formal analysis c Bernardo Almeida Iglesias Formal analysis a Ernesto Schulz Lang Writing – review & editing Resources Funding acquisition a Bárbara Tirloni Writing – review & editing Funding acquisition a Roberta Cargnelutti Writing – review & editing Writing – original draft Supervision Resources Methodology Funding acquisition Conceptualization a ⁎ a Department of Chemistry, Laboratory of Inorganic Materials, Federal University of Santa Maria – UFSM, 97105–900, Santa Maria, RS, Brazil Department of Chemistry Laboratory of Inorganic Materials Federal University of Santa Maria – UFSM Santa Maria RS 97105–900 Brazil aDepartment of Chemistry, Laboratory of Inorganic Materials, Federal University of Santa Maria – UFSM, 97105–900, Santa Maria, RS, Brazil b Laboratory of Inorganic Synthesis and Crystallography, Institute of Chemistry, University of Brasilia, Brasília, DF, Brazil Laboratory of Inorganic Synthesis and Crystallography Institute of Chemistry University of Brasilia Brasília DF Brazil bLaboratory of Inorganic Synthesis and Crystallography, Institute of Chemistry, University of Brasilia, Brasília, DF, Brazil c Instituto de Química Rosario (IQUIR), Consejo Nacional de Investigaciones Científicas y Técnicas (CONICET), Facultad de Ciencias Bioquímicas y Farmacéuticas, Universidad Nacional de Rosario, Suipacha 531, (S2002LRK) Rosario, Argentina Instituto de Química Rosario (IQUIR) Consejo Nacional de Investigaciones Científicas y Técnicas (CONICET) Facultad de Ciencias Bioquímicas y Farmacéuticas Universidad Nacional de Rosario Suipacha 531, (S2002LRK) Rosario Argentina cInstituto de Química Rosario (IQUIR), Consejo Nacional de Investigaciones Científicas y Técnicas (CONICET), Facultad de Ciencias Bioquímicas y Farmacéuticas, Universidad Nacional de Rosario, Suipacha 531, (S2002LRK) Rosario, Argentina ⁎ Corresponding author. Selenomethyl-substituted Schiff base ligand (HL) reacts with Pd(OAc)2, Ni(OAc)2 or CuCl2 resulting in the formation of tetracoordinate metal(II) complexes, with the formula [PdL(OAc)]·CH2Cl2·H2O (1), [PdL2] (2), [NiL2] (3) and [CuL2]·2CHCl3 (4). The deprotonation of the hydroxyl group of the ligand occurs with the addition of triethylamine. For complex 1, the ligand coordinates to the palladium(II) metal as tridentate {O,N,Se} chelate. On the other hand, for complexes 2–4, a bidentate {O,N} coordination mode was observed. All complexes had their structure elucidated by single-crystal X-ray diffraction (SCXRD) and a square planar geometry was observed for palladium(II) (1–2), nickel(II) (3) and copper(II) complexes. Spectroscopic data of 1–4 are in accordance with the structures obtained by SCXRD. In addition, diffuse reflectance spectroscopy (DRS) data were employed for energy gap (Eg ) determinations, which ranged from 2.24 to 2.49 eV. Complexes 1–4 were immobilized in the mesoporous-TiO2 matrix to obtain four photocatalysts m-TiO2-n ( n = 1–4). All photocatalysts tested were active for hydrogen generation via water photolysis. The best results were achieved using palladium(II) (1, 2) and copper(II) (4) complexes as co-catalysts. The m-TiO2–1 and TiO2–2 produced 20,895 and 13,271 μmol g-1 of hydrogen gas, after 6 h of irradiation (300 W Hg/Xe lamp) and its activity surpassed that of the standards (m-TiO₂ and Degussa P25) by approximately 67-fold and 42-fold, respectively. For m-TiO2–4 the production was 7819 μmol g-1 of H2 in the same conditions, and it corresponds approximately 25 times more than pure m-TiO2. These results are highly promising and demonstrate the potential of selenomethyl-substituted Schiff base metal complexes as efficient co-catalysts for water photolysis applications. Graphical abstract Image, graphical abstract Keywords Palladium(II) complex Schiff Base Titanium dioxide Photocatalyst Hydrogen production Data availability Data will be made available on request. 1 Introduction The generation of green hydrogen through photocatalytic water splitting process, using solar irradiation, has been considered one of the best candidates to solve the energy crisis [1,2]. Hydrogen gas is a non-polluting burning fuel and has been considered a clean energy carrier. Also, H2 is a fundamental reagent used in the hydrogenation of CO2 and N2, to generate hydrocarbons and ammonia, respectively [2,3]. It is well-know that TiO2 is a very promising photocatalyst for hydrogen generation by water splitting through solar irradiation [4,5]. However, this semiconductor absorbs only in the UV region (a small part of the solar spectrum) as a consequence of its wide band gap (Eg = 3.2 eV for anatase) in addition to presenting a high recombination rate of charge carriers [6–9]. Consequently, many efforts were directed in the exploration of techniques to extend the light absorption of TiO2 to the visible region, such as, sensitization by dyes [10,11], metalloporphyrins [12,13], doping of TiO2 with noble metals [14–16], and with metal chalcogenides [17,18]. Although metal complexes have been reported as co-catalysts or sensitizers of titania matrix for hydrogen production [19–21], this field lacks in-depth studies regarding the potential of these molecular compounds in photocatalysis. Metal complexes with wider visible absorption spectra besides Se Lewis base anchoring sites in their structures, may lead to greater photocatalytic performance for H2 production [22]. Therefore, the development of new complexes with application as co-catalysts in photocatalysis deserves special attention. In this way, the growing interest in the coordination chemistry of palladium(II) complexes is fueled by the manifold of their catalytic properties beyond H2 generation [23–27], besides their biological activities [28–31], among others. Furthermore, nickel(II) and copper(II) complexes, especially with organoselenium ligands, have been applied as catalysts in organic reactions [32,33], for antibacterial evaluation [34,35], and in photocatalysis for hydrogen production [36]. Many chelating ligands have been used in the formation of these coordination compounds, where the well-known Schiff base ligands stand out as being considered ‘‘privileged ligands’’, because they can coordinate many different metals with various oxidation states [37]. In this way, they can be used in many catalytic reactions [38]. While complexes with Schiff base ligands are well established, only a limited number of complexes with selenolate-substituted Schiff bases have been structurally characterized up to now [39,40]. Based on the above findings, our work is the first to describe the selenomethyl-substituted Schiff base ligand (E)-2-(((2-(methylselanyl)pyridin-3-yl)imino)methyl)phenol (HL), synthesized by the reaction of salicylaldehyde with 2-(methylselanyl)pyridin-3-amine. In addition, metal(II) complexes with this ligand are reported as [PdL(OAc)]·CH2Cl2·H2O (1), [PdL2] (2), [NiL2] (3) and [CuL2]·2CHCl3 (4). Interestingly, a different ligand coordination mode was observed in the palladium(II) complex (1). The selenomethyl-substituted Schiff base complexes (1–4) were full characterized by crystallographic and spectroscopic methods and were applied as co-catalysts of m-TiO2. All prepared photocatalysts (TiO2-n) ( n = 1–4) were tested for hydrogen production via water photolysis using a 300 W Hg/Xe lamp as the irradiation source. The results show the promising potential of all complexes as co-catalysts of m-TiO2 via water photolysis. 2 Experimental section 2.1 Materials All reagents were obtained from Sigma-Aldrich and used as received. The solvents acetonitrile and methanol used in the synthesis of the complexes were dried and freshly distilled before use. 2.2 Physical measurements 2.2.1 Ligand HL and complexes (1–4) Crystallographic data for HL and compounds 1 and 2, were collected at 297(2) K on a Bruker D8 QUEST ECO Photon II CPAD Diffractometer, using graphite monochromator Mo-Kα radiation (λ = 0.71073 Å). Data collection was carried out using the Bruker APEX4 package and cell refinement and data reduction were achieved with the program SAINT V8.40B. The structures were solved by direct methods with SHELX V 2018/2 and refined by full-matrix least-squares on F2 data with SHELXL-2019/1. Crystallographic analyses of compounds 3 and 4 were solved using SHELXS [41] and the refinement was accomplished using SHELXL [42] with minimization of least squares. The data collection was performed on Bruker CCD SMART APEX II diffractometer, in which a graphite monochromator was used that has a Mo-Kα (0.71073 Å) at 296 K. Data from the unit cell were obtained by collecting three matrices, each with twelve images and the refinement was carried out with anisotropic parameters, using the OLEX2 program [43]. Molecular graphics were generated via DIAMOND software [44]. Selected crystallographic data are summarized in Table S1 and the ellipsoid plots are depicted in Figure S1. Full crystallographic data for compounds have been deposited with the CCDC n° 2424672 (HL), 2417826 (1), 2420207 (2), 2419420 (3) and 2471681 (4). A Bruker D8 Advance diffractometer with copper radiation (Kα, λ = 1.54056 Å), equipped with a LynxEye detector was used for powder X-ray diffraction (PXRD) analysis. The following conditions were applied: 0.02° increment, counting time of 300 ms per step and collected from 6 to 60° 2θ with θ − θ geometry at room temperature, with divergence slit of 0.2° and receiving slit of 8 mm. NMR data were obtained using the Bruker Avance III HD 600 spectrometer (600, 150 and 114 MHz for 1H, 13C and 77Se, respectively). The tetramethylsilane was used as an internal standard in the CDCl3, and the measurements were performed at room temperature (298 K). Chemical shifts (δ) are expressed in ppm and coupling constant (J) in Hz. FT-IR spectra were recorded on a Bruker FT-IR model Tensor 27 spectrophotometer over the range 4000 – 400 cm-1. Raman spectra were obtained using the spectrometer Bruker SENTERRA. Measurements of the ligand and complexes were performed with spectral window of 50 – 3500 cm-1 and 532 nm laser. The UV–Vis spectra data were obtained using the Shimadzu UV-2600 spectrometer. The measurements were done using CHCl3 as solvent, in a spectral window of 200 – 800 nm. The stability of the complexes was monitored over time, with measurements taken every hour for 6 h. The diffuse reflectance spectra were measured using a Shimadzu UV-2600 spectrometer with an ISR-2600 Plus integrating sphere. A barium sulfate pellet was used as a reference, and a spectral window of 220 – 800 nm was applied. UV–Vis spectra data by diffuse reflectance were used for the evaluation of energy gap Eg . The data were converted to absorbance, using the Kubelka-Munk function [45,46]. For the cyclic voltammetry (CV) analyses it was used a Metrohm Eco Chemie AutoLab PGSTAT128N potentiostat/galvanostat at room temperature and under argon atmosphere in dry DMF solution. Tetrabutylammonium hexafluorophosphate (0.1 M) was used as supporting electrolyte. The CV experiments were carried out using a standard three-component system consisting of a glassy carbon working electrode; a platinum pseudo-reference electrode; and a platinum counter (auxiliary) electrode. The ferrocene (Fc+/Fc redox couple) was used as an internal reference and redox potentials are corrected to the normal hydrogen electrode (NHE) [47]. Elemental analysis (CNH) of compounds was performed on a Perkin Elmer 2400 series II elemental analyzer. 2.2.2 Photocatalysts (m-TiO2-n) ( n = 1–4) For the characterization of the photocatalysts, the scanning electron microscopy (SEM) images were obtained by a JEOL 55 M6360 microscope, operating at an acceleration voltage of 20 kV. For the chemical composition analysis by energy dispersive X-ray spectroscopy (EDS), a Quantax 75 device (Bruker Nano GmbH) was employed. The textural characterization of m-TiO2 was determined by N2(g) adsorption/desorption analyses, using a Micromeritics Surface Area and Porosity Analyzer ASAP2020N equipment. The samples were previously dried under vacuum at 150–250 °C. BET (Brunauer–Emmett–Teller) method was used to measure the surface area and average pore size and BJH (Barrett–Joyner–Halenda) method was used to measure the average pore volume. A Shimadzu CG – 2014 gas chromatograph composed of a Carboxem 1000 column, length 4.6 m with an internal diameter of 2.10 mm, was used to measure the hydrogen production. 300 W Hg/Xe lamp was employed as a solar simulator with an intensity of approximately 1370 W/m2. 2.3 Synthesis 2.3.1 Synthesis of ligand HL Scheme 1 describes the general route to obtain the selenomethyl-substituted Schiff base ligand (E)-2-(((2-(methylselanyl)pyridin-3-yl)imino)methyl)phenol (HL). 1,2-bis(3-aminopyridin-2-yl)diselane (apySe)2 was used as precursor and synthesized according to the literature [48]. Initially, 1.25 mmol (0.430 g) of (apySe)2 dissolved in 15 mL of anhydrous EtOH reacted with NaBH4 (3.75 mmol, 0.141 g), under argon atmosphere for 1 hour. Then, iodomethane (3 mmol, 0.187 mL) was added. After 2 h, the reaction was quenched (15 mL of water), and the organic phase was extracted with ethyl acetate (3 × 15 mL). The organic solvent was removed under vacuum and the obtained product (apySeCH3) was used without further purification. Subsequently, the condensation reaction was conducted using a Dean-Stark apparatus under an argon atmosphere, in which 2.21 mmol (0.413 g) of apySeCH3 reacted with salicylic aldehyde (2.21 mmol, 0.24 mL) in anhydrous toluene (5 mL) under reflux temperature for 12 h. After this time, the solvent was removed under vacuum, and an orange oil was obtained. The product was purified by chromatographic column using hexane/ethyl acetate (9:1) as eluent and a yellow precipitate was obtained. Yield: 79 %. Melting point: 78–80 °C. Elemental analysis: Calculated for C13H12N2OSe: C, 53.62; H, 4.15; N, 9.62 %; Found: C, 53.21; H 3.94; N 9.40 %. FT-IR (KBr, cm-1): ν(OH) = 3205; ν(CH)ar = 3070, 3052; νa(CH3) = 2981; νs(CH3) = 2927; ν(C = N)imine = 1616; ν(C = N)py = 1564; ν(C = C) = 1548. Raman (cm-1): ν(C-Se-C) = 598; ν(C = N)imine = 1606; ν(C = N)py = 1575; ν(C = C) = 1551. 1H NMR (600 MHz, CDCl3): δ (ppm) = 12.53 (s, 1H); 8.59 (s, 1H); 8.38 (dd, J = 4.8; 1.5 Hz, 1H); 7.42 – 7.37 (m, 2H); 7.29 (dd, J = 7.8; 1.5 Hz, 1H); 7.08 (dd, J = 8.6; 4.3 Hz, 1H); 7.05 (d, J = 8.3 Hz, 1H); 6.94 (td, J = 8.4; 1.0 Hz, 1H); 2.47 (s, 3H). 13C NMR (151 MHz, CDCl3): δ (ppm) = 163.9; 161.3; 153.6; 148.0; 143.7; 134.1; 132.8; 123.0; 120.3; 119.4; 119.2; 117.7; 77.2; 5.0. 77Se NMR (114 MHz, CDCl3): δ (ppm) = 232.1. UV–vis (CHCl3); λmax (nm): 239; 283; 368. 2.3.2 Synthesis of complexes (1–4) [PdL(OAc)]·CH2Cl2·H2O ( 1 ): Pd(OAc)2 (0.10 mmol, 0.022 g) was added to a solution containing HL (0.10 mmol, 0.029 g), anhydrous acetonitrile (5 mL) and NEt3 (5.02 × 10–3 mmol, 70.0 μL). The reaction was kept under stirring and refluxed under argon atmosphere for 12 h. After this time, the suspension was cooled at room temperature and the orange precipitate obtained was filtered, washed with CH3CN and EtOH and dried under vacuum system. Yield: 79 %. Melting point: 211 – 213 °C. Elemental analysis: Calculated for C16H16Cl2N2O3PdSe: C, 35.55; H, 2.98; N, 5.18 %; Found: C, 35.95; H, 2.81; N, 5.67 %. FT-IR (KBr, cm-1): ν(CH)ar = 3055, 3035; νa(CH3) = 2940; νs(CH3) = 2926; ν(COO-) = 1585; ν(C = N)imine = 1610; ν(C = N)py = 1579; ν(C = C) = 1518. Raman (cm-1): ν(C-Se-C) = 581; ν(COO-) = 1568; ν(C = N)imine = 1611; ν(C = N)py =1587; ν(C = C) = 1560. 1H NMR (600 MHz, CDCl3): δ (ppm) = 8.54 (dd, J = 4.5, 1.1 Hz, 1H); 8,35 (s, 1H); 8.01 (d, J = 8.4 Hz, 1H); 7.42 – 7.40 (m, 1H); 7.37 (dd, J = 8.1, 1.5 Hz, 1H); 7.33 (dd, J = 8.5, 4.5 Hz, 1H); 7.16 (d, J = 8.7 Hz, 1H); 6.68 (t, J = 7.1 Hz, 1H); 2.87 (s, 3H); 2.16 (s, 3H). 13C NMR (151 MHz, CDCl3): δ (ppm) = 177.9; 167.6; 157.6; 150.6; 149.0; 145.8; 138.2; 135.6; 125.1; 123.7; 122.1; 120.2; 116.8; 22.1; 21.5. 77Se NMR (114 MHz, CDCl3): δ (ppm) = 377.8. UV–vis (CHCl3); λmax (nm): 254; 331; 470. [PdL2] ( 2 ): Pd(OAc)2 (0.10 mmol, 0.022 g) was added in a solution containing HL (0.20 mmol, 0.058 g), anhydrous acetonitrile (5 mL) and NEt3 (5.02 × 10–3 mmol, 70.0 μL). The reaction was kept under stirring and refluxed under argon atmosphere for 12 h. After this time, the suspension was cooled at room temperature and the yellow precipitate obtained was filtered, washed with CH3CN and EtOH and dried under vacuum system. Yield: 44 %. Melting point: 93 – 95 °C. Elemental analysis: Calculated for C26H22N4O2PdSe2: C, 45.47; H, 3.23; N, 8.16 %; Found: C, 45.58; H, 3.17; N, 8.41 %. FT-IR (KBr, cm-1): ν(CH)ar = 3039; νa(CH3) = 3013; νs(CH3) = 2930; ν(C = N)imine = 1605; ν(C = N)py = 1568; ν(C = C) = 1530. Raman (cm-1): ν(C-Se-C): 598; ν(C = N)imine = 1610; ν(C = N)py =1595; ν(C = C) = 1553. 1H NMR (600 MHz, CDCl3): δ (ppm) = 8.42 (dd, J = 3.6, 1.1 Hz, 1H); 7.52 (s, 1H); 7.34 (d, J = 7.2 Hz, 1H); 7.08–7.03 (m, 3H); 6.41 (t, J = 7.4 Hz, 1H); 5.98 (d, J = 8.5 Hz, 1H); 2.36 (s, 3H). UV–vis (CHCl3); λmax (nm): 243; 332; 472. [NiL2] ( 3 ): Ni(OAc)2 (0.10 mmol, 0.018 g) was added in a solution containing HL (0.20 mmol, 0.058 g), anhydrous methanol (5 mL) and NEt3 (5.02 × 10–3 mmol, 70.0 μL). The reaction was kept under stirring and refluxed under argon atmosphere for 12 h. After this time, the suspension was cooled at room temperature and the dark green precipitate obtained was filtered, washed with methanol and dried under vacuum system. Yield: 43 %. Melting point: 122 – 125 °C. Elemental analysis: Calculated for C26H22N4NiO2Se2: C, 48.86; H, 3.47; N 8.77 %; Found: C, 48.63; H, 3.53; N 8.97 %. FT-IR (KBr, cm-1): ν(CH)ar = 3039; νa(CH3) = 3011; νs(CH3) = 2924; ν(C = N)imine = 1604; ν(C = N)py = 1565; ν(C = C) = 1528. Raman (cm-1): ν(C-Se-C): 598; ν(C = N)imine = 1613; ν(C = N)py =1590; ν(C = C) = 1553. UV–vis (CHCl3); λmax (nm): 242; 284; 378. [CuL2] ( 4 ): CuCl2 (0.10 mmol, 0.013 g) was added in a solution containing HL (0.20 mmol, 0.058 g), anhydrous methanol (5 mL) and NEt3 (5.02 × 10–3 mmol, 70.0 μL). The reaction was kept under stirring and refluxed under argon atmosphere for 12 h. After this time, the suspension was cooled at room temperature and the brown precipitate obtained was filtered, washed with methanol and dried under vacuum system. Yield: 32 %. Melting point: 155 – 160 °C. Elemental analysis: Calculated for C26H22CuN4O2Se2: C, 48.49; H, 3.44; N, 8.70 %; Found: C, 48,45; H, 3.35; N, 8.99 %. FT-IR (KBr, cm-1): ν(CH)ar = 3046; νa(CH3) = 3010; νs(CH3) = 2925; ν(C = N)imine = 1604; ν(C = N)py = 1565; ν(C = C) = 1525. Raman (cm-1): ν(C-Se-C): 598; ν(C = N)imine = 1608; ν(C = N)py =1594; ν(C = C) = 1556. UV–vis (CHCl3); λmax (nm): 240; 284; 369. 2.3.3 Preparation of m-TiO2 and m-TiO2-n ( n = 1–4) The synthesis of mesoporous TiO₂ was performed through a sol-gel method [49]. To a mixture of H2O/EtOH (9/23 mL), Pluronic® F-127 (0.1 mmol; 1.230 g) was added and stirred for 1 hour. Then, concentrated HCl was slowly added to a solution, until pH value of 3. In the sequence, titanium isopropoxide [Ti( i PrO)4] (20.0 mmol; 6.14 mL) was slowly added to the solution, resulting in the formation of a white suspension, which was heated (50°) and kept under stirring for 24 h. Then, the obtained product was washed with water and calcined at 500 °C for 6 h. m-TiO2 (textural properties): surface area (BET): 34.9 m2g-1; average pore size (BET): 19.25 nm and average pore volume (BJH): 0.167 cm3g-1. The photocatalysts m-TiO2-n ( n = 1–4) were synthesized based on the literature [50]. Initially, 0.0100 g of the complex (1–4) and 2 mL of CHCl3 were added to a SCHLENK tube and kept under magnetic stirring. After the complete dissolution of the corresponding complex, m-TiO₂ (0.200 g) was added, and the system was kept closed, protected from light, and under magnetic stirring for 72 h. After this period, the suspension was vortexed and centrifuged at 5000 rpm for 10 min, separating the solid from the supernatant. The solid was washed several times with CHCl3, to ensure the absence of any non-impregnated complex. The product m-TiO2-n was dried under vacuum. The immobilization yield (wt %) and loading value of the new photocatalysts were determined using UV–Vis absorption spectra data from the washing solutions and the supernatant solutions of the immobilization processes. 2.3.4 Protocol for hydrogen production experiments For the hydrogen evolution tests, it was used 1.80 mL of triethanolamine (TEOA) as sacrificial reagent, 18.2 mL of deionized water, and 10.0 mg of the photocatalyst (m-TiO2-n, n = 1–4). The mixture was briefly sonicated in a water bath and in the sequence transferred to a quartz reactor. After closing the reactor, the system was purged with argon gas, to remove any residual gases. The reactor was exposed to light irradiation (300 W Xe/Hg lamp) during 6 h, and the system was kept under constant agitation. During this time, 300 μL gas aliquots were collected every one hour to monitor hydrogen production. 3 Results and discussion 3.1 Synthetic route for the preparation of complexes 1–4 Scheme 2 summarizes the synthetic routes used for the preparation of complexes 1–4. All complexes were obtained from HL. However, for the palladium(II) complexes the difference in reaction stoichiometry led to the formation of different products. For complex [PdL(OAc)] (1), it was used 1 equiv. of HL and 1 equiv. of Pd(OAc)2, and the product shows the presence of one ligand (L- ) and one acetate anion. On the other hand, for the formation of complex [PdL2] (2), it was used 2 equiv. of HL and 1 equiv. of Pd(OAc)2. For the preparation of [NiL2] (3) and [CuL2] (4) the same stoichiometry was applied (2:1 / L:M). Et3N was used to deprotonate the hydroxyl group in HL. Reactions without a base were also performed, however the yield of the complexes was much lower. The crystalline structure elucidation of HL and complexes 1–4 was performed by SCXRD analysis. In addition, the compounds were characterized by spectroscopic techniques such as, FT-IR, Raman, UV–Vis, and NMR (1H, 13C, 77Se). The purity of the compounds was confirmed through elemental analysis data. 3.2 Characterization of complexes 1–4 3.2.1 X-ray crystallography The molecular structure of HL in the solid state was determined by SCXRD analysis and it is depicted in Figure S1. The ligand has a planar structure, with the three donor atoms {Se,N,O} oriented on the same side. In the palladium(II) complexes, [PdL(OAc)]·CH2Cl2·H2O (1) and [PdL2] (2), the coordination mode of L- is different. For complex 1, a tridentate {O,N,Se} chelate ligand is observed, and the coordination sphere of palladium is completed by an acetate ligand in a monodentate manner, as shown in Fig. 1 a. The value of the geometric parameter τ 4 can be used to assign the geometry of tetracoordinate complexes. A perfect square planar geometry has the τ 4 value equal to zero, while a value of 1.00 represents a perfect tetrahedral geometry. On the other hand, τ 4 value equal to 0.5 indicates a seesaw geometry [51]. Compound 1 has a τ 4 parameter equal to 0.06 indicating a distorted square planar geometry. In contrast, for complex 2, two ligands L - are coordinated to PdII, and a bidentate {N,O} coordination mode was observed. Fig. 1b shows the molecular structure of 2 with a perfect square planar geometry, confirmed by a τ 4 value equal to zero. The ligand L- , in complexes [NiL2] (3) and [NiL2] (4), also exhibited a bidentate {N,O} coordination mode. The molecular structure of 3 and 4 is depicted in Fig. 2 . For these complexes, the calculated τ 4 parameter is also zero, indicating a perfect square planar geometry. Table S2 shows selected bond lengths and angles for HL and 1–4. A very similar N1–Pd1 and O1–Pd1 bond lengths were observed for 1 and 2, with values ​​ranging from 2.001(2) – 2.026(5) Å (N1–Pd1) and 1.980(5) – 2.002(2) Å (O1–Pd1). The Se1–Pd1 bond length of 2.3547(6) Å in 1 is in accordance with the complex [PdCl2(PhSeCH2CH2NMe2)]n·0.5CH2Cl2 reported in literature [Se1–Pd1 = 2.3611(11) Å] [52]. Also, in complex 1, the angles Se1–Pd1–O1 of 176.82(6)° and N1–Pd1–O2 of 174.29(8)° are in accordance with a distorted square planar geometry. In complex 2, for the same labeling atoms, the angles are 180°, corroborating with their square planar geometry. Comparing complexes 3 and 4, the distances for N1–Ni1 [1.907(5) Å] and O1–Ni1 [1.821(4) Å] are slightly lower than N1–Cu1 [2.006(5) Å] and O1–Cu1 [1.918(4) Å]. The two largest angles in 3 (N1–Ni1–N1’ and O1–Ni1–O1’) and 4 (N1–Cu1–N1’ and O1–Cu1–O1’) are 180°. The powder X-ray diffraction (PXRD) was also used to analyze HL and complexes 1–4. In general, the PXRD diffractograms are in accordance with the simulated diffractograms generated from SCXRD data (Figure S2). 3.2.2 FT-IR, Raman and NMR spectroscopy Fig. 3 a displays the FT-IR spectra of HL and complexes 1–4, with selected FT-IR data presented in Table 1 . The FT-IR spectra of the complexes 1–4 display characteristic bands corresponding to the ligand L, indicating its coordination with the metal(II) atom. The O–H stretching vibration band for HL appears at 3205 cm-1 and is not observed in the spectra of the complexes, confirming the coordination of deprotonated L- to the metal center [53]. Furthermore, the infrared spectra of the complexes display a stretching vibration band at lower wavenumbers (1610 – 1604 cm⁻¹), which corresponds to the coordinated imine group [54]. Typical ν(C = N)py/(C = C) are observed in the range of 1579 – 1518 cm-1 for HL and complexes. The IR spectrum of 1 displays a characteristic stretching vibration band at 1585 cm-1 corresponding to ν(COO-), confirming the monodentate coordination of the acetate group [55]. The Raman spectra of the free ligand and complexes are represented in Fig. 3b. For complex 1, the unique complex with Se–Pd bond, the (C–Se–C) stretching band shifts to 581 cm-1, while for HL and 2–4, the ν(C–Se–C) appears in 598 cm-1 [56]. In particular, the Raman spectrum for 1 displays a ν(COO-) vibration at 1568 cm-1, corresponding to the acetate group. The (C = N)imine stretching bands for complexes 1–4 shift to 1608–1613 cm-1. HL and palladium(II) complexes 1 and 2 were characterized by 1H NMR spectroscopy (Figure S3). A typical singlet corresponding to the O–H group present in HL is observed in 12.53 ppm, which disappears in the spectra of 1 and 2, confirming the coordination of deprotonated L - to the palladium(II) center. For HL, 1 and 2, the aromatic hydrogens are observed in the region of 8.59 – 5.98 ppm. A singlet with satellite bands in the region of 2.87 – 2.36 ppm, is also observed in the 1H NMR spectra for all compounds, referring to the hydrogens of the methyl group (Se–CH3). This occurs due to the coupling between 1H and 77Se nuclei. Furthermore, for complex 1, a singlet in 2.16 ppm attributed to the hydrogens of the acetate group is also detected. COSY, HSQC, and HMBC NMR experiments, were performed to help with the correct assignment of the hydrogen atoms (Figure S4). In the 13C NMR spectra for HL and 1 (Figure S3), expected signals were observed in the region of aromatic carbons (177.9 – 116.8 ppm), as well as a shift of the signal relative to CH3–Se [5.0 ppm (HL) and 21.5 ppm (1)]. 13C NMR spectrum of 1 also showed a signal at 22.1 ppm corresponding to the methyl group of acetate ligand. 77Se NMR spectra for HL and 1 show signals at 232.1 and 377.8 ppm, respectively. Due to the low solubility of complex 2, 13C and 77Se NMR spectra with good quality could not be obtained. 3.2.3 UV–Vis spectroscopy The UV–Vis absorption spectra of HL and complexes 1–4 were recorded in CHCl3 (Fig. 4 ), enabling the characterization of their electronic transitions. HL shows three prominent absorption bands at 239 and 283 nm, attributed to π-π* transitions, and at 368 nm assigned to n-π* transitions. The spectra of palladium(II) complexes 1 and 2 show three notable absorption bands corresponding to π-π* (254, 243 nm), n-π*(331, 332 nm), and metal-ligand charge-transfer (MLCT) (470, 472 nm) transitions. Typical MLCT involves a dπ-π* transition, in which an electron is excited from occupied dπ metal orbital (t2g set) to an unoccupied π* ligand orbital. Coordination compounds with metal atoms in low oxidation states and containing electron accepting ligands like 2,2-bipyridine, 1,10-phenanthroline, CO, and many others, can present MLCT electronic transitions [57–59]. The band at 283 nm (π-π*) of HL disappeared upon coordination in the UV–Vis spectra of 1 and 2. UV–Vis spectra of complexes 3 and 4 exhibit three main bands in the region of 240–284 nm (π-π*) and 369–378 nm (n-π*). The presence of d-d transitions can be visualized in the calculated Kubelka-Munk [46] absorption spectra (Fig. 5 ), especially for complexes 3 and 1 at approximately 630 and 670 nm, respectively, which following literature [60,61]. The stability of complexes 1–4 in CHCl3 solution was evaluated through spectrophotometric measurements every 1 hour, for 6 h (Figure S5). The results suggest that the complexes are stable in solution. Solid state UV–Vis diffuse reflectance using the Kubelka–Munk function [46] was employed to estimate the energy gap values (Eg ) for complexes 1–4 (Figure S6), which ranged from 2.24 to 2.49 eV. 3.2.4 Cyclic voltammetry The electrochemical behavior of the ligand HL and complexes 1–4 was investigated by cyclic voltammetry analysis in a dry DMF solution. The redox potentials are summarized in Table 2 and the voltammograms are shown in Fig. 6 . All compounds were evaluated in the range of –2.00 to +2.00 V (versus NHE). The first irreversible reduction potential for all compounds appears in the range of −0.26 to −0.50 V, which can be assigned to the SeII → Se0 redox couple [62]. The second reduction peak for HL and complexes 1 and 2 was observed in the −0.56 to −0.98 V range and can be attributed to the Se0 → Se-II reduction. On the other hand, for complex 4, the second reduction peak was observed at −1.00 V and can be associated with the CuII → CuI redox couple [63]. For HL and complexes 1, 2 and 4, a third reduction peak was observed in the range of −1.14 to −1.69 V, probably assigned to the imine reduction of the ligand [64]. In the anodic region, for all compounds, the first irreversible oxidation process was observed in the 0.66 to 1.09 V range, which could be attributed to Se0 → SeII oxidation process. In addition, for complexes 1 and 4, a second oxidation process was observed in 1.26 and 0.95 V, respectively, which can be attributed to SeII → SeIV for 1 and CuI → CuII for 4 oxidation processes [62,63]. 3.3 Photocatalytic hydrogen production via water photolysis 3.3.1 Characterization of photocatalysts FT-IR, Raman, PXRD, SEM, and EDS techniques were used to characterize the photocatalysts m-TiO2-n ( n = 1–4). FT-IR spectra (Figure S7) show strong bands at 628, 414 and 233 cm-1 corresponding to the ν(Ti–O) stretching vibration [65,66]. Raman Spectra (Figure S8) reveal characteristic peaks of the m-TiO2 anatase phase [67,68]: ν(Ti−O) = 637 and 516 cm-1, and δ(O−Ti−O) = 143, 195 and 396 cm-1. The powder diffraction patterns for all photocatalysts are depicted in Fig. 7 . It was observed that pure m-TiO2 and all photocatalysts exhibited the main crystallographic planes of the anatase phase in the matrix [69]. The same characteristics were observed for m-TiO2–1 after photocatalytic tests, as shown in Figure S9. The diffractograms of all photocatalysts are very similar to the pure m-TiO2, likely due to the low immobilization yield (wt %) and loading of the photocatalysts. SEM images of the photocatalysts (Figure S10) show particles with irregular sizes and no well-defined shapes. EDS spectra are shown in Figure S11 and report characteristic peaks corresponding to the elements Ti, O, Se, N and M [M = Pd (1, 2), Ni (3) or Cu (4)], which are present in the photocatalysts. Elemental mapping (Figs. 8 and S12) reveals a uniform distribution of the elements on the surface of the photocatalysts. 3.3.2 Photocatalytic hydrogen production Fig. 9 shows the amount of H2 produced using m-TiO2-n, through water photolysis, under 300 W Xe/Hg lamp irradiation for 6 h, using TEOA as a sacrificial reagent. The results were compared to the production of pure m-TiO2 and Degussa P25 (particle size of 21 nm; Sigma-Aldrich) (standard samples). All photocatalysts impregnated with complexes 1–4 exhibited enhanced photocatalytic activity, with palladium complex co-catalysts yielding the highest results (20,895 and 13,271 μmol g-1 for 1 and 2, respectively, after 6-hour irradiation) (Fig. 10 ). These results could be related to the highest wt % (Table 3 ) of palladium complexes co-catalyzing m-TiO2 and consequently highest loading values for the photocatalysts m-TiO2–1 and m-TiO2–2 compared to the others. Additionally, the palladium complexes absorb visible light to a greater extent compared to the nickel and copper ones (Figs. 4 and 5), with a greater solar harvesting ability of m-TiO2–1 even when compared to m-TiO2–2, corroborating with the notable H2(g) production of m-TiO2–1. Nevertheless, impregnation rates are low, the complexes have shown efficient activity as co-catalysts of m-TiO2. The stability of the photocatalyst with higher activity (m-TiO2–1) was investigated over a four-cycle recycling experiment. At the end of each run, the system was opened, and argon was purged to initiate a new run. The results obtained are reported in Fig. 11 (top). A decrease of 41 % in H2 production was observed especially in the fourth run. However, the hydrogen production in the fourth run (5-hour run) remained approximately 30 times higher than that of pure m-TiO₂. Furthermore, a long-term stability test was run over 30 h for m-TiO2–1, reaching about 65,000 μmol g-1 of H2 gas until this extended period (Fig. 11, bottom). This result demonstrates that the use of m-TiO2–1 for a long period of time still provides high catalytic amounts of hydrogen gas, although a plateau feature arises in the final period of the 30-hour test. Table 4 summarizes the catalytic performance for hydrogen production of several photocatalysts based on titania modified with metal complexes. The results exhibit that all synthesized photocatalysts in this work, particularly m-TiO2–1 and m-TiO2–2, demonstrate notable photocatalytic activity for H2 production. It is proposed that especially for palladium(II) complexes (1 and 2) co-catalysts, their wide UV–Vis absorption spectra may result in significantly higher hydrogen production compared to that reported in the literature. 3.3.3 Electron transfer mechanism of m-TiO2–1 Based on the electrochemical data showed in Table 2, a proposal electron transfer mechanism between complex 1 and m-TiO2 is represented in Fig. 12 . The photogenerated electrons (e-) can migrate from CB of m-TiO2 to LUMO of complex 1, where the H + ions are reduced to H2. The holes (h +) from m-TiO2 accumulate in complex 1 and the sacrificial agent, TEOA, acts as hole scavenger being oxidized to TEOA+ [74,75]. Therefore, it can be assumed that the photocatalyst m-TiO2–1 promotes satisfactory charge separation, reducing the recombination of the photo-excited e-/h + pairs, improving the results of hydrogen production from water photolysis. 4 Conclusions In conclusion, HL ligand and four complexes with selenomethyl-substituted Schiff base [PdL(OAc)]·CH2Cl2·H2O (1), [PdL2] (2), [NiL2] (3) and [CuL2]·2CHCl3 (4) were synthesized by the first time and fully characterized by crystallographic and spectroscopic methods. All complexes showed a tetracoordinated metal(II) center, presented a square planar geometry for palladium(II), nickel(II) and copper(II) compounds. Spectroscopy data obtained by FT-IR, Raman, UV–Vis and NMR are in accordance with the molecular structures determined by SCRXD. In addition, the catalytic performance of m-TiO2 impregnated with metal complexes (1–4) was notable, particularly for those with palladium(II) complexes as co-catalysts, producing 20,895 μmol g-1 and 13,271 μmol g-1 of H2, after 6 h of irradiation (approximately 67-fold and 42-fold compared to the pure matrix). These results are consistent with the highest wt % and loading of palladium(II) complexes impregnated in the m-TiO2 matrix, as well as their greater absorption in the visible light range. Furthermore, the photocatalysts containing non-noble metals (NiII and CuII), also exhibited notable photocatalytic performance, producing 1083 μmol g-1 and 7819 μmol g-1 of H2, respectively. These results demonstrate the excellent potential of metal complexes with selenomethyl-substituted Schiff base ligand for application as co-catalysts of titania for H2 production via water photolysis. CRediT authorship contribution statement Thiago Acosta Trindade da Silva: Visualization, Methodology, Investigation, Formal analysis. Leonardo Carneiro Lanes: Visualization, Formal analysis. Rodrigo Cervo: Writing – review & editing, Visualization, Formal analysis. Camila Nunes Cechin: Writing – review & editing, Formal analysis. Claudia Cristina Gatto: Writing – review & editing, Formal analysis. Gabriela Nanci Ledesma: Writing – review & editing, Formal analysis. Bernardo Almeida Iglesias: Formal analysis. Ernesto Schulz Lang: Writing – review & editing, Resources, Funding acquisition. Bárbara Tirloni: Writing – review & editing, Funding acquisition. Roberta Cargnelutti: Writing – review & editing, Writing – original draft, Supervision, Resources, Methodology, Funding acquisition, Conceptualization. Declaration of competing interest The authors declare that they have no known competing financial interests or personal relationships that could have appeared to influence the work reported in this paper. Acknowledgments This work was supported by funding from Fundação de Amparo à Pesquisa do Estado do Rio Grande do Sul – FAPERGS (ARD 21/2551–0000712–5), Conselho Nacional de Desenvolvimento Científico e Tecnológico - CNPq (UNIVERSAL 405965/2023–0) and FINEP. T. A. T. S. sincerely thanks the Conselho Nacional de Desenvolvimento Científico e Tecnológico (CNPq – 131208/2023–3) for the scholarship. This study was financed in part by the Coordenação de Aperfeiçoamento de Pessoal de Nível Superior – Brazil (CAPES) – Finance Code 001. Supplementary materials Supplementary material associated with this article can be found, in the online version, at doi:10.1016/j.mcat.2025.115365. Appendix Supplementary materials Image, application 1 References [1] P. Zhang H. Zeng D. Wen X. Sui Z. Wang Y. Wang H. Chen Y. Weng J. Long Single-site Ni-grafted TiO2 with diverse coordination environments for visible-light hydrogen production ChemSusChem 17 2023 e202301041 10.1002/cssc.202301041 P. Zhang, H. Zeng, D. Wen, X. Sui, Z. Wang, Y. Wang, H. Chen, Y. Weng, J. Long, Single-site Ni-grafted TiO2 with diverse coordination environments for visible-light hydrogen production, ChemSusChem 17 (2023) e202301041. https://doi.org/10.1002/cssc.202301041. [2] S. Gonuguntla R. Kamesh U. Pal D. Chatterjee Dye sensitization of TiO2 relevant to photocatalytic hydrogen generation: current research trends and prospects J. Photochem. Photobiol. C: Photochem. Rev. 57 2023 100621 10.1016/j.jphotochemrev.2023.100621 S. Gonuguntla, R. Kamesh, U. Pal, D. Chatterjee, Dye sensitization of TiO2 relevant to photocatalytic hydrogen generation: current research trends and prospects, J. Photochem. Photobiol. C: Photochem. Rev 57 (2023) 100621. https://doi.org/10.1016/j.jphotochemrev.2023.100621. [3] T. Hisatomi Q. Wang F. Zhang S. Ardo E. Reisner H. Nishiyama A. Kudo T. Yamada K. Domen Photocatalytic water splitting for large-scale solar-to-chemical energy conversion and storage Front. Sci. 2 2024 1411644 10.3389/fsci.2024.1411644 T. Hisatomi, Q. Wang, F. Zhang, S. Ardo, E. Reisner, H. Nishiyama, A. Kudo, T. Yamada, K. Domen, Photocatalytic water splitting for large-scale solar-to-chemical energy conversion and storage, Front. Sci 2 (2024) 1411644. https://doi.org/10.3389/fsci.2024.1411644. [4] M. Rafique S. Hajra M. Irshad M. Usman M. Imran M.A. Assiri W.M. Ashraf Hydrogen production using TiO2-based photocatalysts: a comprehensive review ACS Omega 8 2023 25640 25648 10.1021/acsomega.3c00963 M. Rafique, S. Hajra, M. Irshad, M. Usman, M. Imran, M.A. Assiri, W.M. Ashraf, Hydrogen production using TiO2-based photocatalysts: a comprehensive review, ACS Omega 8 (2023) 25640–25648. https://doi.org/10.1021/acsomega.3c00963. [5] T.T. Nguyen K. Edalati Brookite TiO2 as an active photocatalyst for photoconversion of plastic wastes to acetic acid and simultaneous hydrogen production: comparison with anatase and rutile Chemosphere 355 2024 141785 10.1016/j.chemosphere.2024.141785 T.T. Nguyen, K. Edalati, Brookite TiO2 as an active photocatalyst for photoconversion of plastic wastes to acetic acid and simultaneous hydrogen production: comparison with anatase and rutile, Chemosphere 355 (2024) 141785. https://doi.org/10.1016/j.chemosphere.2024.141785. [6] Y. Ma X. Wang Y. Jia X. Chen H. Han C. Li Titanium dioxide-based nanomaterials for photocatalytic fuel generations Chem. Rev. 114 2014 9987 10043 10.1021/cr500008u Y. Ma, X. Wang, Y. Jia, X. Chen, H. Han, C. Li, Titanium dioxide-based nanomaterials for photocatalytic fuel generations, Chem. Rev 114 (2014) 9987–10043. https://doi.org/10.1021/cr500008u. [7] Q. Guo C. Zhou Z. Ma Z. Ren H. Fan X. Yang Elementary photocatalytic chemistry on TiO2 surfaces Chem. Soc. Rev. 45 2016 3701 3730 10.1039/c5cs00448a Q. Guo, C. Zhou, Z. Ma, Z. Ren, H. Fan, X. Yang, Elementary photocatalytic chemistry on TiO2 surfaces, Chem. Soc. Rev 45 (2016) 3701–3730. https://doi.org/10.1039/c5cs00448a. [8] J. Hidalgo-Jiménez T. Akbay T. Ishihara K. Edalati Understanding high photocatalytic activity of the TiO2 high-pressure columbite phase by experiments and first-principles calculations J. Mater. Chem. A 11 2023 23523 23535 10.1039/d3ta04198k J. Hidalgo-Jiménez, T. Akbay, T. Ishihara, K. Edalati, Understanding high photocatalytic activity of the TiO2 high-pressure columbite phase by experiments and first-principles calculations, J. Mater. Chem. A 11 (2023) 23523–23535. https://doi.org/10.1039/d3ta04198k. [9] M. Katai P. Edalati J. Hidalgo-Jimenez Y. Shundo T. Akbay T. Ishihara M. Arita M. Fuji K. Edalati Black brookite rich in oxygen vacancies as an active photocatalyst for CO2 conversion: experiments and first-principles calculations J. Photochem. Photobiol. Chem. 449 2024 115409 10.1016/j.jphotochem.2023.115409 M. Katai, P. Edalati, J. Hidalgo-Jimenez, Y. Shundo, T. Akbay, T. Ishihara, M. Arita, M. Fuji, K. Edalati, Black brookite rich in oxygen vacancies as an active photocatalyst for CO2 conversion: experiments and first-principles calculations, J. Photochem. Photobiol. Chem 449 (2024) 115409. https://doi.org/10.1016/j.jphotochem.2023.115409. [10] J.F. Huang Y. Lei T. Luo J.M. Liu Photocatalytic H2 production from water by metal-free dye-sensitized TiO2 semiconductors: the role and development process of organic sensitizers ChemSusChem 13 2020 5863 5895 10.1002/cssc.202001646 J.F. Huang, Y. Lei, T. Luo, J.M. Liu, Photocatalytic H2 production from water by metal-free dye-sensitized TiO2 semiconductors: the role and development process of organic sensitizers, ChemSusChem 13 (2020) 5863–5895. https://doi.org/10.1002/cssc.202001646. [11] J. Willkomm K.L. Orchard A. Reynal E. Pastor J.R. Durrant E. Reisner Dye-sensitised semiconductors modified with molecular catalysts for light-driven H2 production Chem. Soc. Rev. 45 2016 9 23 10.1039/c5cs00733j J. Willkomm, K.L. Orchard, A. Reynal, E. Pastor, J.R. Durrant, E. Reisner, Dye-sensitised semiconductors modified with molecular catalysts for light-driven H2 production, Chem. Soc. Rev 45 (2016) 9–23. https://doi.org/10.1039/c5cs00733j. [12] J. Niu B. Yao Y. Chen C. Peng X. Yu J. Zhang G. Bai Enhanced photocatalytic activity of nitrogen doped TiO2 photocatalysts sensitized by metallo Co, Ni-porphyrins Appl. Surf. Sci. 271 2013 39 44 10.1016/j.apsusc.2012.12.175 J. Niu, B. Yao, Y. Chen, C. Peng, X. Yu, J. Zhang, G. Bai, Enhanced photocatalytic activity of nitrogen doped TiO2 photocatalysts sensitized by metallo Co, Ni-porphyrins, Appl. Surf. Sci 271 (2013) 39–44. https://doi.org/10.1016/j.apsusc.2012.12.175. [13] Q. Wang W.M. Campbell E.E. Bonfantani K.W. Jolley D.L. Officer P.J. Walsh K. Gordon R. Humphry-Baker M.K. Nazeeruddin M. Grätzel Efficient light harvesting by using green Zn-porphyrin-sensitized nanocrystalline TiO2 films J. Phys. Chem. B 109 2005 15397 15409 10.1021/jp052877w Q. Wang, W.M. Campbell, E.E. Bonfantani, K.W. Jolley, D.L. Officer, P.J. Walsh, K. Gordon, R. Humphry-Baker, M.K. Nazeeruddin, M. Grätzel, Efficient light harvesting by using green Zn-porphyrin-sensitized nanocrystalline TiO2 films, J. Phys. Chem. B 109 (2005) 15397–15409. https://doi.org/10.1021/jp052877w. [14] K. Batalović N. Bundaleski J. Radaković N. Abazović M. Mitrić R.A. Silva M. Savić J. Belošević-Čavor Z. Rakočević C.M. Rangel Modification of N-doped TiO2 photocatalysts using noble metals (Pt, Pd) - A combined XPS and DFT study Phys. Chem. Chem. Phys. 19 2017 7062 7071 10.1039/c7cp00188f K. Batalović, N. Bundaleski, J. Radaković, N. Abazović, M. Mitrić, R.A. Silva, M. Savić, J. Belošević-Čavor, Z. Rakočević, C.M. Rangel, Modification of N-doped TiO2 photocatalysts using noble metals (Pt, Pd) - A combined XPS and DFT study, Phys. Chem. Chem. Phys 19 (2017) 7062–7071. https://doi.org/10.1039/c7cp00188f. [15] A. Bumajdad M. Madkour Understanding the superior photocatalytic activity of noble metals modified titania under UV and visible light irradiation Phys. Chem. Chem. Phys. 16 2014 7146 7158 10.1039/c3cp54411g A. Bumajdad, M. Madkour, Understanding the superior photocatalytic activity of noble metals modified titania under UV and visible light irradiation, Phys. Chem. Chem. Phys 16 (2014) 7146–7158. https://doi.org/10.1039/c3cp54411g. [16] M.V. Dozzi A. Saccomanni M. Altomare E. Selli Photocatalytic activity of NH4F-doped TiO2 modified by noble metal nanoparticle deposition Photochem. Photobiol. Sci. 12 2013 595 601 10.1039/c2pp25175b M.V. Dozzi, A. Saccomanni, M. Altomare, E. Selli, Photocatalytic activity of NH4F-doped TiO2 modified by noble metal nanoparticle deposition, Photochem. Photobiol. Sci 12 (2013) 595–601. https://doi.org/10.1039/c2pp25175b. [17] D. Gao W. Zhong Y. Liu H. Yu J. Fan Synergism of tellurium-rich structure and amorphization of NiTe1+x nanodots for efficient photocatalytic H2-evolution of TiO2 Appl. Catal. B 290 2021 120057 10.1016/j.apcatb.2021.120057 D. Gao, W. Zhong, Y. Liu, H. Yu, J. Fan, Synergism of tellurium-rich structure and amorphization of NiTe1+x nanodots for efficient photocatalytic H2-evolution of TiO2, Appl. Catal. B 290 (2021) 120057. https://doi.org/10.1016/j.apcatb.2021.120057. [18] M.D.A. Mello J.F. Rodrigues T.A. Salgueiro Soares G.M.D.M.E. Silva P.C. Piquini B. Tirloni G. Machado E.S. Lang Synthesis and characterisation of [Cu4In(PPh3)3SePh(μ-SePh)3(μ3-SePh)3], and its application as a precursor of a sensitizer for a photocatalyst New J. Chem. 43 2019 14196 14201 10.1039/c9nj02046b M.D.A. Mello, J.F. Rodrigues, T.A. Salgueiro Soares, G.M.D.M.E. Silva, P.C. Piquini, B. Tirloni, G. Machado, E.S. Lang, Synthesis and characterisation of [Cu4In(PPh3)3SePh(μ-SePh)3(μ3-SePh)3], and its application as a precursor of a sensitizer for a photocatalyst, New J. Chem 43 (2019) 14196–14201. https://doi.org/10.1039/c9nj02046b. [19] U. Veikko X. Zhang T. Peng P. Cai G. Cheng The synthesis and characterization of dinuclear ruthenium sensitizers and their applications in photocatalytic hydrogen production Spectrochim. Acta Mol. Biomol. Spectrosc. 105 2013 539 544 10.1016/j.saa.2012.12.061 U. Veikko, X. Zhang, T. Peng, P. Cai, G. Cheng, The synthesis and characterization of dinuclear ruthenium sensitizers and their applications in photocatalytic hydrogen production, Spectrochim. Acta Mol. Biomol. Spectrosc 105 (2013) 539–544. https://doi.org/10.1016/j.saa.2012.12.061. [20] S. Verma P. Kar T. Banerjee A. Das H.N. Ghosh Sequential energy and electron transfer in polynuclear complex sensitized TiO2 nanoparticles J. Phys. Chem. Lett. 3 2012 1543 1548 10.1021/jz3005305 S. Verma, P. Kar, T. Banerjee, A. Das, H.N. Ghosh, Sequential energy and electron transfer in polynuclear complex sensitized TiO2 nanoparticles, J. Phys. Chem. Lett 3 (2012) 1543–1548. https://doi.org/10.1021/jz3005305. [21] A. Grabulosa M. Beley P.C. Gros S. Cazzanti S. Caramori C.A. Bignozzi Homoleptic ruthenium complex bearing dissymmetrical 4-carboxy-4′ -pyrrolo-2.2 -bipyridine for efficient sensitization of TiO2 in solar cells Inorg. Chem. 48 2009 8030 8036 10.1021/ic9009256 A. Grabulosa, M. Beley, P.C. Gros, S. Cazzanti, S. Caramori, C.A. Bignozzi, Homoleptic ruthenium complex bearing dissymmetrical 4-carboxy-4′ -pyrrolo-2.2 -bipyridine for efficient sensitization of TiO2 in solar cells, Inorg. Chem 48 (2009) 8030–8036. https://doi.org/10.1021/ic9009256. [22] R. Cervo C.A. Brandl T. Bortolotto C.N. Cechin N.F. Daudt B.A. Iglesias E.S. Lang B. Tirloni R. Cargnelutti Inorg. Chem. 64 2025 7902 7919 10.1021/acs.inorgchem.4c05325 R. Cervo, C.A. Brandl, T. Bortolotto, C.N. Cechin, N.F. Daudt, B.A. Iglesias, E.S. Lang, B. Tirloni, R. Cargnelutti, Inorg. Chem, 64 (2025) 7902–7919. https://doi.org/10.1021/acs.inorgchem.4c05325. [23] T. Straistari R. Hardré J. Massin M. Attolini B. Faure M. Giorgi M. Réglier M. Orio Influence of the metal ion on the electrocatalytic hydrogen production by a thiosemicarbazone palladium complex Eur. J. Inorg. Chem. 2018 2018 2259 2266 10.1002/ejic.201800120 T. Straistari, R. Hardré, J. Massin, M. Attolini, B. Faure, M. Giorgi, M. Réglier, M. Orio, Influence of the metal ion on the electrocatalytic hydrogen production by a thiosemicarbazone palladium complex, Eur. J. Inorg. Chem 2018 (2018) 2259–2266. https://doi.org/10.1002/ejic.201800120. [24] F. Schroeter J. Soellner T. Strassner Cross-coupling catalysis by an anionic palladium complex ACS Catal. 7 2017 3004 3009 10.1021/acscatal.6b03655 F. Schroeter, J. Soellner, T. Strassner, Cross-coupling catalysis by an anionic palladium complex, ACS Catal. 7 (2017) 3004–3009. https://doi.org/10.1021/acscatal.6b03655. [25] C. Bai Q. Zhao Y. Li G. Zhang F. Zhang X. Fan Palladium complex immobilized on graphene oxide as an efficient and recyclable catalyst for suzuki coupling reaction Catal. Lett. 144 2014 1617 1623 10.1007/s10562-014-1299-0 C. Bai, Q. Zhao, Y. Li, G. Zhang, F. Zhang, X. Fan, Palladium complex immobilized on graphene oxide as an efficient and recyclable catalyst for suzuki coupling reaction, Catal. Lett. 144 (2014) 1617–1623. https://doi.org/10.1007/s10562-014-1299-0. [26] Y. Xu L. Zhang Y. Cui Catalytic performance of cellulose supported palladium complex for heck reaction in water Ying J. Appl. Polym. Sci. 110 2008 2996 3000 10.1002/app.28655 Y. Xu, L. Zhang, Y. Cui, Catalytic performance of cellulose supported palladium complex for heck reaction in water Ying, J. Appl. Polym. Sci 110 (2008) 2996–3000. https://doi.org/10.1002/app.28655. [27] J.W. Raebiger J.W. Turner B.C. Noll C.J. Curtis A. Miedaner B. Cox D.L. DuBois Electrochemical reduction of CO2 to CO catalyzed by a bimetallic palladium complex Organometallics 25 2006 3345 3351 10.1021/om060228g J.W. Raebiger, J.W. Turner, B.C. Noll, C.J. Curtis, A. Miedaner, B. Cox, D.L. DuBois, Electrochemical reduction of CO2 to CO catalyzed by a bimetallic palladium complex, Organometallics 25 (2006) 3345–3351. https://doi.org/10.1021/om060228g. [28] A. Zianna G.D. Geromichalos A. Pekou A.G. Hatzidimitriou E. Coutouli-Argyropoulou M. Lalia-Kantouri A.A. Pantazaki G. Psomas A palladium(II) complex with the Schiff base 4-chloro-2-(N-ethyliminomethyl)-phenol: synthesis, structural characterization, and in vitro and in silico biological activity studies J. Inorg. Biochem. 199 2019 110792 10.1016/j.jinorgbio.2019.110792 A. Zianna, G.D. Geromichalos, A. Pekou, A.G. Hatzidimitriou, E. Coutouli-Argyropoulou, M. Lalia-Kantouri, A.A. Pantazaki, G. Psomas, A palladium(II) complex with the Schiff base 4-chloro-2-(N-ethyliminomethyl)-phenol: synthesis, structural characterization, and in vitro and in silico biological activity studies, J. Inorg. Biochem 199 (2019) 110792. https://doi.org/10.1016/j.jinorgbio.2019.110792. [29] K. Karami Z. Mehri Lighvan A.M. Alizadeh M. Poshteh-Shirani T. Khayamian J. Lipkowski Synthesis of a novel trinuclear palladium complex: the influence of an oxime chelate ligand on biological evaluation towards double-strand DNA, BSA protein and molecular modeling studies RSC Adv. 6 2016 78424 78435 10.1039/c6ra08744b K. Karami, Z. Mehri Lighvan, A.M. Alizadeh, M. Poshteh-Shirani, T. Khayamian, J. Lipkowski, Synthesis of a novel trinuclear palladium complex: the influence of an oxime chelate ligand on biological evaluation towards double-strand DNA, BSA protein and molecular modeling studies, RSC Adv. 6 (2016) 78424–78435. https://doi.org/10.1039/c6ra08744b. [30] E.J. Gao K.H. Wang X.F. Gu Y. Yu Y.G. Sun W.Z. Zhang H.X. Yin Q. Wu M.C. Zhu X.M. Yan A novel binuclear palladium complex with benzothiazole-2-thiolate: synthesis, crystal structure and interaction with DNA J. Inorg. Biochem. 101 2007 1404 1409 10.1016/j.jinorgbio.2007.06.007 E.J. Gao, K.H. Wang, X.F. Gu, Y. Yu, Y.G. Sun, W.Z. Zhang, H.X. Yin, Q. Wu, M.C. Zhu, X.M. Yan, A novel binuclear palladium complex with benzothiazole-2-thiolate: synthesis, crystal structure and interaction with DNA, J. Inorg. Biochem 101 (2007) 1404–1409. https://doi.org/10.1016/j.jinorgbio.2007.06.007. [31] S. Padhye Z. Afrasiabi E. Sinn J. Fok K. Mehta N. Rath Antitumor metallothiosemicarbazonates: structure and antitumor activity of palladium complex of phenanthrenequinone thiosemicarbazone Inorg. Chem. 44 2005 1154 1156 10.1021/ic048214v S. Padhye, Z. Afrasiabi, E. Sinn, J. Fok, K. Mehta, N. Rath, Antitumor metallothiosemicarbazonates: structure and antitumor activity of palladium complex of phenanthrenequinone thiosemicarbazone, Inorg. Chem 44 (2005) 1154–1156. https://doi.org/10.1021/ic048214v. [32] R.S. Chauhan D. Oza S. Yadav C. Dash A.M.Z. Slawin N. Shivran Copper complexes of arylselenolate-based ligands: synthesis and catalytic activity in azide-alkyne cycloaddition reactions New J. Chem. 43 2019 2381 2388 10.1039/c8nj04602f R.S. Chauhan, D. Oza, S. Yadav, C. Dash, A.M.Z. Slawin, N. Shivran, Copper complexes of arylselenolate-based ligands: synthesis and catalytic activity in azide-alkyne cycloaddition reactions, New J. Chem 43 (2019) 2381–2388. https://doi.org/10.1039/c8nj04602f. [33] R. Cargnelutti F.D. Da Silva U. Abram E.S. Lang Metal complexes with bis(2-pyridyl)diselenoethers: structural chemistry and catalysis New J. Chem. 39 2015 7948 7953 10.1039/c5nj01400j R. Cargnelutti, F.D. Da Silva, U. Abram, E.S. Lang, Metal complexes with bis(2-pyridyl)diselenoethers: structural chemistry and catalysis, New J. Chem 39 (2015) 7948–7953. https://doi.org/10.1039/c5nj01400j. [34] R. de S. Dias R. Cervo F. dos S. Siqueira M.M.A. de Campos E.S. Lang B. Tirloni R.F. Schumacher R. Cargnelutti Synthesis and antimicrobial evaluation of coordination compounds containing 2,2′-bis(3-aminopyridyl) diselenide as ligand Appl. Organomet. Chem. 34 2020 e5750 10.1002/aoc.5750 R. de S. Dias, R. Cervo, F. dos S. Siqueira, M.M.A. de Campos, E.S. Lang, B. Tirloni, R.F. Schumacher, R. Cargnelutti, Synthesis and antimicrobial evaluation of coordination compounds containing 2,2′-bis(3-aminopyridyl) diselenide as ligand, Appl. Organomet. Chem 34 (2020) e5750. https://doi.org/10.1002/aoc.5750. [35] R. Cervo T.R.R. Lopes A.R. de Vasconcelos J.F. Cargnelutti R.F. Schumacher B. Tirloni S.S. dos Santos U. Abram E.S. Lang R. Cargnelutti Coordination compounds containing 2-pyridylselenium ligands: synthesis, structural characterization, and antibacterial evaluation New J. Chem. 45 2021 12863 12870 10.1039/d1nj02374h R. Cervo, T.R.R. Lopes, A.R. de Vasconcelos, J.F. Cargnelutti, R.F. Schumacher, B. Tirloni, S.S. dos Santos, U. Abram, E.S. Lang, R. Cargnelutti, Coordination compounds containing 2-pyridylselenium ligands: synthesis, structural characterization, and antibacterial evaluation, New J. Chem 45 (2021) 12863–12870. https://doi.org/10.1039/d1nj02374h. [36] A. Xie Y.W. Tao C. Peng G.G. Luo A nickel pyridine-selenolate complex for the photocatalytic evolution of hydrogen from aqueous solutions Inorg. Chem. Commun. 110 2019 107598 10.1016/j.inoche.2019.107598 A. Xie, Y.W. Tao, C. Peng, G.G. Luo, A nickel pyridine-selenolate complex for the photocatalytic evolution of hydrogen from aqueous solutions, Inorg. Chem. Commun 110 (2019) 107598. https://doi.org/10.1016/j.inoche.2019.107598. [37] K.C. Gupta A.K. Sutar Catalytic activities of Schiff base transition metal complexes Coord. Chem. Rev. 252 2008 1420 1450 10.1016/j.ccr.2007.09.005 K.C. Gupta, A.K. Sutar, Catalytic activities of Schiff base transition metal complexes, Coord. Chem. Rev 252 (2008) 1420–1450. https://doi.org/10.1016/j.ccr.2007.09.005. [38] P.G. Cozzi Metal-Salen Schiff base complexes in catalysis: practical aspects Chem. Soc. Rev. 33 2004 410 421 10.1039/b307853c P.G. Cozzi, Metal-Salen Schiff base complexes in catalysis: practical aspects, Chem. Soc. Rev 33 (2004) 410–421. https://doi.org/10.1039/b307853c. [39] M.Roca Jungfer E.S. Lang U. Abram Reactions of Schiff base-substituted diselenides and -tellurides with Ni(II), Pd(II) and Pt(II) phosphine complexes Eur. J. Inorg. Chem. 2020 2020 4303 4312 10.1002/ejic.202000750 M.Roca Jungfer, E.S. Lang, U. Abram, Reactions of Schiff base-substituted diselenides and -tellurides with Ni(II), Pd(II) and Pt(II) phosphine complexes, Eur. J. Inorg. Chem 2020 (2020) 4303–4312. https://doi.org/10.1002/ejic.202000750. [40] M. Roca Jungfer A. Hagenbach E. Schulz Lang U. Abram Rhenium(V) complexes with selenolato- and tellurolato-substituted schiff bases – Released PPh3 as a facile reductant Eur. J. Inorg. Chem. 2019 2019 4974 4984 10.1002/ejic.201901092 M. Roca Jungfer, A. Hagenbach, E. Schulz Lang, U. Abram, Rhenium(V) complexes with selenolato- and tellurolato-substituted schiff bases – Released PPh3 as a facile reductant, Eur. J. Inorg. Chem 2019 (2019) 4974–4984. https://doi.org/10.1002/ejic.201901092. [41] G.M. Sheldrick A short history of SHELX Acta Crystallogr. A 64 2008 112 122 10.1107/S0108767307043930 G.M. Sheldrick, A short history of SHELX, Acta Crystallogr. A 64 (2008) 112–122. https://doi.org/10.1107/S0108767307043930. [42] G.M. Sheldrick Crystal structure refinement with SHELXL Acta Crystallogr. C Struct. Chem. 71 2015 3 8 10.1107/S2053229614024218 G.M. Sheldrick, Crystal structure refinement with SHELXL, Acta Crystallogr. C Struct. Chem 71 (2015) 3–8. https://doi.org/10.1107/S2053229614024218. [43] O.V. Dolomanov L.J. Bourhis R.J. Gildea J.A.K. Howard H. Puschmann OLEX2: a complete structure solution, refinement and analysis program J. Appl. Crystallogr. 42 2009 339 341 10.1107/S0021889808042726 O.V. Dolomanov, L.J. Bourhis, R.J. Gildea, J.A.K. Howard, H. Puschmann, OLEX2: a complete structure solution, refinement and analysis program, J. Appl. Crystallogr 42 (2009) 339–341. https://doi.org/10.1107/S0021889808042726. [44] K. Brandenburg H. Putz Diamond - Crystal and Molecular Structure Visualization (Version 4.6.0) 2019 Crystal Impact GbR Bonn, Germany K. Brandenburg, H. Putz, Diamond - Crystal and Molecular Structure Visualization (Version 4.6.0). Crystal Impact GbR – Bonn, Germany, 2019. [45] A.B. Murphy Band-gap determination from diffuse reflectance measurements of semiconductor films, and application to photoelectrochemical water-splitting Sol. Energy Mater. Sol. Cells 91 2007 1326 1337 10.1016/j.solmat.2007.05.005 A.B. Murphy, Band-gap determination from diffuse reflectance measurements of semiconductor films, and application to photoelectrochemical water-splitting, Sol. Energy Mater. Sol. Cells 91 (2007) 1326–1337. https://doi.org/10.1016/j.solmat.2007.05.005. [46] P. Makuła M. Pacia W. Macyk How to correctly determine the band gap energy of modified semiconductor photocatalysts based on UV-vis spectra J. Phys. Chem. Lett 9 2018 6814 6817 10.1021/acs.jpclett.8b02892 P. Makuła, M. Pacia, W. Macyk, How to correctly determine the band gap energy of modified semiconductor photocatalysts based on UV-vis spectra, J. Phys. Chem. Lett 9 (2018) 6814–6817. https://doi.org/10.1021/acs.jpclett.8b02892. [47] A.M. Bond K.B. Oldham G.A. Snook Use of the ferrocene oxidation process to provide both reference electrode potential calibration and a simple measurement (via Semiintegration) of the uncompensated resistance in cyclic voltammetric studies in high-resistance organic solvents Anal. Chem. 72 2000 3492 3496 10.1021/ac000020j A.M. Bond, K.B. Oldham, G.A. Snook, Use of the ferrocene oxidation process to provide both reference electrode potential calibration and a simple measurement (via Semiintegration) of the uncompensated resistance in cyclic voltammetric studies in high-resistance organic solvents, Anal. Chem 72 (2000), 3492–3496. https://doi.org/10.1021/ac000020j. [48] T.J. Peglow R.F. Schumacher R. Cargnelutti A.S. Reis C. Luchese E.A. Wilhelm G. Perin Preparation of bis(2-pyridyl) diselenide derivatives: synthesis of selenazolo[5,4-b]pyridines and unsymmetrical diorganyl selenides, and evaluation of antioxidant and anticholinesterasic activities Tetrahedron Lett. 58 2017 3734 3738 10.1016/j.tetlet.2017.08.030 T.J. Peglow, R.F. Schumacher, R. Cargnelutti, A.S. Reis, C. Luchese, E.A. Wilhelm, G. Perin, Preparation of bis(2-pyridyl) diselenide derivatives: synthesis of selenazolo[5,4-b]pyridines and unsymmetrical diorganyl selenides, and evaluation of antioxidant and anticholinesterasic activities, Tetrahedron Lett. 58 (2017) 3734–3738. https://doi.org/10.1016/j.tetlet.2017.08.030. [49] E.M. Samsudin S.B.A. Hamid J.C. Juan W.J. Basirun Influence of triblock copolymer (pluronic F127) on enhancing the physico-chemical properties and photocatalytic response of mesoporous TiO2 Appl. Surf. Sci. 355 2015 959 968 10.1016/j.apsusc.2015.07.178 E.M. Samsudin, S.B.A. Hamid, J.C. Juan, W.J. Basirun, Influence of triblock copolymer (pluronic F127) on enhancing the physico-chemical properties and photocatalytic response of mesoporous TiO2, Appl. Surf. Sci 355 (2015) 959–968. https://doi.org/10.1016/j.apsusc.2015.07.178. [50] G.S. MacHado G.G.C. Arízaga F. Wypych S. Nakagaki Immobilization of anionic metalloporphyrins on zinc hydroxide nitrate and study of an unusual catalytic activity J. Catal. 274 2010 130 141 10.1016/j.jcat.2010.06.012 G.S. MacHado, G.G.C. Arízaga, F. Wypych, S. Nakagaki, Immobilization of anionic metalloporphyrins on zinc hydroxide nitrate and study of an unusual catalytic activity, J. Catal 274 (2010) 130–141. https://doi.org/10.1016/j.jcat.2010.06.012. [51] L. Yang D.R. Powell R.P. Houser Structural variation in copper(I) complexes with pyridylmethylamide ligands: structural analysis with a new four-coordinate geometry index, τ4 J. Chem. Soc. Dalton Trans. 2007 955 964 10.1039/b617136b L. Yang, D.R. Powell, R.P. Houser, Structural variation in copper(I) complexes with pyridylmethylamide ligands: structural analysis with a new four-coordinate geometry index, τ4, J. Chem. Soc. Dalton Trans (2007) 955–964. https://doi.org/10.1039/b617136b. [52] D.K. Paluru S. Dey A. Wadawale D.K. Maity N. Bhuvanesh V.K. Jain Structural variation in [PdX2{RE(CH2)nNMe2}] (E = Se, Te; X = Cl, OAc) complexes: experimental results, computational analysis, and catalytic activity in Suzuki coupling reactions Eur. J. Inorg. Chem. 2015 2015 397 407 10.1002/ejic.201402943 D.K. Paluru, S. Dey, A. Wadawale, D.K. Maity, N. Bhuvanesh, V.K. Jain, Structural variation in [PdX2{RE(CH2)nNMe2}] (E = Se, Te; X = Cl, OAc) complexes: experimental results, computational analysis, and catalytic activity in Suzuki coupling reactions, Eur. J. Inorg. Chem 2015 (2015) 397–407. https://doi.org/10.1002/ejic.201402943. [53] N. Dunski T.H. Crawford Coordination polymers of Schiff base ligands and their monomeric analogs J. Inorg. Nucl. Chem. 35 1973 2707 2717 10.1016/0022-1902(73)80501-9 N. Dunski, T.H. Crawford, Coordination polymers of Schiff base ligands and their monomeric analogs, J. Inorg. Nucl. Chem 35 (1973) 2707–2717. https://doi.org/10.1016/0022-1902(73)80501-9. [54] L.A. Fontana F.M. Martins J.D. Siqueira C. Serpa A. Chaves D.F. Back Synthesis of cobalt(III) complexes derived from pyridoxal: structural cleavage evaluations and In silico calculations for biological targets Inorganics 12 2024 171 10.3390/inorganics12060171 L.A. Fontana, F.M. Martins, J.D. Siqueira, C. Serpa, A. Chaves, D.F. Back, Synthesis of cobalt(III) complexes derived from pyridoxal: structural cleavage evaluations and In silico calculations for biological targets, Inorganics 12 (2024) 171. https://doi.org/10.3390/inorganics12060171. [55] V. Zeleňák Z. Vargová K. Györyová Correlation of infrared spectra of zinc(II) carboxylates with their structures Spectrochim. Acta Mol. Biomol. Spectrosc. 66 2007 262 272 10.1016/j.saa.2006.02.050 V. Zeleňák, Z. Vargová, K. Györyová, Correlation of infrared spectra of zinc(II) carboxylates with their structures, Spectrochim. Acta Mol. Biomol. Spectrosc 66 (2007) 262–272. https://doi.org/10.1016/j.saa.2006.02.050. [56] G. Socrates Infrared and Raman characteristic Group frequencies: Tables and Charts 2001 Wiley Chichester G. Socrates, Infrared and Raman characteristic Group frequencies: Tables and Charts, Wiley, Chichester, 2001. [57] D. Sorsche M.A.L. Lima N. Meitinger K. Prasad S. Mandal K.D. Glusac S. Rau A. Pannwitz Shifting the MLCT of d6 metal complexes to the red and NIR Coord. Chem. Rev. 530 2025 216454 10.1016/j.ccr.2025.216454 D. Sorsche, M.A.L. Lima, N. Meitinger, K. Prasad, S. Mandal, K.D. Glusac, S. Rau, A. Pannwitz, Shifting the MLCT of d6 metal complexes to the red and NIR, Coord. Chem. Rev 530 (2025) 216454. https://doi.org/10.1016/j.ccr.2025.216454. [58] A. Vlček Mechanistic roles of metal-to-ligand charge-transfer excited states in organometallic photochemistry Coord. Chem. Rev. 177 1998 219 256 10.1016/s0010-8545(98)00187-8 A. Vlček, Mechanistic roles of metal-to-ligand charge-transfer excited states in organometallic photochemistry, Coord. Chem. Rev 177 (1998) 219–256. https://doi.org/10.1016/s0010-8545(98)00187-8. [59] M.T. Indelli C.A. Bignozzi F. Scandola Design of long-lived Ru(II) terpyridine MLCT states. Tricyano terpyridine complexes Inorg. Chem. 37 1998 6084 6089 10.1021/ic980060u M.T. Indelli, C.A. Bignozzi, F. Scandola, Design of long-lived Ru(II) terpyridine MLCT states. Tricyano terpyridine complexes, Inorg. Chem 37 (1998) 6084–6089. https://doi.org/10.1021/ic980060u. [60] W.V. Ferreira F.R. Ráice A.F. da Silva I.J. Nunes R. Cervo R. Cargnelutti J. Saffi J.L.S. Milani O. de L. Casagrande A.C. Pinheiro Synthesis, characterization, electronic properties, and cytotoxic activities on cancer cells line of novel Cu(II) complexes with benzimidazole-Schiff base tridentate ligand J. Mol. Struct. 1327 2025 141239 10.1016/j.molstruc.2024.141239 W.V. Ferreira, F.R. Ráice, A.F. da Silva, I.J. Nunes, R. Cervo, R. Cargnelutti, J. Saffi, J.L.S. Milani, O. de L. Casagrande, A.C. Pinheiro, Synthesis, characterization, electronic properties, and cytotoxic activities on cancer cells line of novel Cu(II) complexes with benzimidazole-Schiff base tridentate ligand, J. Mol. Struct 1327 (2025) 141239. https://doi.org/10.1016/j.molstruc.2024.141239. [61] L.A. Fontana J.D. Siqueira J. Ceolin B.A. Iglesias P.C. Piquini A. Neves D.F. Back Peroxidase activity of new mixed-valence cobalt complexes with ligands derived from pyridoxal Appl. Organomet. Chem. 33 2019 e4903 10.1002/aoc.4903 L.A. Fontana, J.D. Siqueira, J. Ceolin, B.A. Iglesias, P.C. Piquini, A. Neves, D.F. Back, Peroxidase activity of new mixed-valence cobalt complexes with ligands derived from pyridoxal, Appl. Organomet. Chem 33 (2019) e4903. https://doi.org/10.1002/aoc.4903. [62] C.N. Cechin B.N. Cabral F. Bublitz T. Bortolotto G.D. Da Silveira L.M. De Carvalho R. Cargnelutti U. Abram S. Nakagaki E.S. Lang B. Tirloni Nuclearity growth of new PdII complexes induced by the electronic effect of selenium-containing ligands New J. Chem. 45 2021 19255 19263 10.1039/d1nj03710b C.N. Cechin, B.N. Cabral, F. Bublitz, T. Bortolotto, G.D. Da Silveira, L.M. De Carvalho, R. Cargnelutti, U. Abram, S. Nakagaki, E.S. Lang, B. Tirloni, Nuclearity growth of new PdII complexes induced by the electronic effect of selenium-containing ligands, New J. Chem 45 (2021) 19255–19263. https://doi.org/10.1039/d1nj03710b. [63] J.D. Siqueira S.F. de Pellegrin S.S. dos Santos B.A. Iglesias P.C. Piquini L.P. Arantes F.A. Soares O.A. Chaves A. Neves D.F. Back SOD activity of new copper II complexes with ligands derived from pyridoxal and toxicity in Caenorhabditis elegans J. Inorg. Biochem. 204 2020 110950 10.1016/j.jinorgbio.2019.110950 J.D. Siqueira, S.F. de Pellegrin, S.S. dos Santos, B.A. Iglesias, P.C. Piquini, L.P. Arantes, F.A. Soares, O.A. Chaves, A. Neves, D.F. Back, SOD activity of new copper II complexes with ligands derived from pyridoxal and toxicity in Caenorhabditis elegans, J. Inorg. Biochem 204 (2020) 110950. https://doi.org/10.1016/j.jinorgbio.2019.110950. [64] L.P. Fioravanço J.B. Pôrto F.M. Martins J.D. Siqueira B.A. Iglesias B.M. Rodrigues O.A. Chaves D.F. Back A vanadium(V) complexes derived from pyridoxal/salicylaldehyde. Interaction with CT-DNA/HSA, and molecular docking assessments J. Inorg. Biochem. 239 2023 112070 10.1016/j.jinorgbio.2022.112070 L.P. Fioravanço, J.B. Pôrto, F.M. Martins, J.D. Siqueira, B.A. Iglesias, B.M. Rodrigues, O.A. Chaves, D.F. Back, A vanadium(V) complexes derived from pyridoxal/salicylaldehyde. Interaction with CT-DNA/HSA, and molecular docking assessments, J. Inorg. Biochem 239 (2023) 112070. https://doi.org/10.1016/j.jinorgbio.2022.112070. [65] X. Qin L. Jing G. Tian Y. Qu Y. Feng Enhanced photocatalytic activity for degrading rhodamine B solution of commercial Degussa P25 TiO2 and its mechanisms J. Hazard Mater. 172 2009 1168 1174 10.1016/j.jhazmat.2009.07.120 X. Qin, L. Jing, G. Tian, Y. Qu, Y. Feng, Enhanced photocatalytic activity for degrading rhodamine B solution of commercial Degussa P25 TiO2 and its mechanisms, J. Hazard Mater 172 (2009) 1168–1174. https://doi.org/10.1016/j.jhazmat.2009.07.120. [66] U. Nithiyanantham A. Ramadoss S. Kundu Supercapacitor and dye-sensitized solar cell (DSSC) applications of shape-selective TiO2 nanostructures RSC Adv. 4 2014 35659 35672 10.1039/c4ra06226d U. Nithiyanantham, A. Ramadoss, S. Kundu, Supercapacitor and dye-sensitized solar cell (DSSC) applications of shape-selective TiO2 nanostructures, RSC Adv. 4 (2014) 35659–35672. https://doi.org/10.1039/c4ra06226d. [67] T. Ohsaka F. Izumi Y. Fujiki Raman spectrum of anatase, TiO2 J. Raman Spectrosc. 7 1978 321 324 10.1002/jrs.1250070606 T. Ohsaka, F. Izumi, Y. Fujiki, Raman spectrum of anatase, TiO2, J. Raman Spectrosc 7 (1978) 321–324. https://doi.org/10.1002/jrs.1250070606. [68] H.J. An S.R. Jang R. Vittal J. Lee K.J. Kim Cationic surfactant promoted reductive electrodeposition of nanocrystalline anatase TiO2 for application to dye-sensitized solar cells Electrochim. Acta 50 2005 2713 2718 10.1016/j.electacta.2004.11.017 H.J. An, S.R. Jang, R. Vittal, J. Lee, K.J. Kim, Cationic surfactant promoted reductive electrodeposition of nanocrystalline anatase TiO2 for application to dye-sensitized solar cells, Electrochim. Acta 50 (2005) 2713–2718. https://doi.org/10.1016/j.electacta.2004.11.017. [69] G. Sudant E. Baudrin D. Larcher J.M. Tarascon Electrochemical lithium reactivity with nanotextured anatase-type TiO2 J. Mater. Chem. 15 2005 1263 1269 10.1039/b416176a G. Sudant, E. Baudrin, D. Larcher, J.M. Tarascon, Electrochemical lithium reactivity with nanotextured anatase-type TiO2, J. Mater. Chem 15 (2005) 1263–1269. https://doi.org/10.1039/b416176a. [70] M.L.M. Camargo C.S. Schwalm T. Bortolotto N. De Freitas Daudt G.G. Rossi M.M. Anraku De Campos K.A. D’Oliveira A. Cuin V.D. Schwade MII(M = Mn, Fe, Co, Ni and Cu) complexes with a chromone-derived neutral ligand: synthesis, structural characterization, photocatalytic and mycobacterial activity studies New J. Chem. 46 2022 2534 2545 10.1039/d1nj05011g M.L.M. Camargo, C.S. Schwalm, T. Bortolotto, N. De Freitas Daudt, G.G. Rossi, M.M. Anraku De Campos, K.A. D’Oliveira, A. Cuin, V.D. Schwade, MII(M = Mn, Fe, Co, Ni and Cu) complexes with a chromone-derived neutral ligand: synthesis, structural characterization, photocatalytic and mycobacterial activity studies, New J. Chem 46 (2022) 2534–2545. https://doi.org/10.1039/d1nj05011g. [71] A. Santarelli C.A. Brandl C.N. Cechin T. Bortolotto N.de F. Daudt R.A. Burrow E.S. Lang B. Tirloni G.N. Ledesma Ni(II) and Cu(II) complexes derived from thiophene-2,5-bis(thiosemicarbazone) as unprecedented templates for photocatalytic hydrogen production Mol. Catal. 566 2024 114431 10.1016/j.mcat.2024.114431 A. Santarelli, C.A. Brandl, C.N. Cechin, T. Bortolotto, N.de F. Daudt, R.A. Burrow, E.S. Lang, B. Tirloni, G.N. Ledesma, Ni(II) and Cu(II) complexes derived from thiophene-2,5-bis(thiosemicarbazone) as unprecedented templates for photocatalytic hydrogen production, Mol. Catal 566 (2024) 114431. https://doi.org/10.1016/j.mcat.2024.114431. [72] A. Lunardi T. Bortolotto C. Nunes Cechin N. de F. Daudt M. de A. Mello S.S. dos Santos R. Cargnelutti E.S. Lang B. Tirloni Novel organically linked ZnII hydrogenselenite coordination polymers: synthesis, characterization, and efficient TiO2 photosensitization for enhanced photocatalytic hydrogen production Dalton Trans. 52 2023 16841 16848 10.1039/d3dt03094f A. Lunardi, T. Bortolotto, C. Nunes Cechin, N. de F. Daudt, M. de A. Mello, S.S. dos Santos, R. Cargnelutti, E.S. Lang, B. Tirloni, Novel organically linked ZnII hydrogenselenite coordination polymers: synthesis, characterization, and efficient TiO2 photosensitization for enhanced photocatalytic hydrogen production, Dalton Trans. 52 (2023) 16841–16848. https://doi.org/10.1039/d3dt03094f. [73] F.D. da Silva T. Bortolotto B. Tirloni N. de F. Daudt E.S. Lang R. Cargnelutti Bis(2-pyridyl)ditellane as a precursor to CoII, CuI and CuII complex formation: structural characterization and photocatalytic studies New J. Chem. 46 2022 18165 18172 10.1039/d2nj02761e F.D. da Silva, T. Bortolotto, B. Tirloni, N. de F. Daudt, E.S. Lang, R. Cargnelutti, Bis(2-pyridyl)ditellane as a precursor to CoII, CuI and CuII complex formation: structural characterization and photocatalytic studies, New J. Chem 46 (2022) 18165–18172. https://doi.org/10.1039/d2nj02761e. [74] R. Asahi T. Morikawa H. Irie T. Ohwaki Nitrogen-doped titanium dioxide as visible-light-sensitive photocatalyst: designs, developments, and prospects Chem. Rev. 114 2014 9824 9852 10.1021/cr5000738 R. Asahi, T. Morikawa, H. Irie, T. Ohwaki, Nitrogen-doped titanium dioxide as visible-light-sensitive photocatalyst: designs, developments, and prospects, Chem. Rev 114 (2014) 9824–9852. https://doi.org/10.1021/cr5000738. [75] P. Murugesan J.A. Moses C. Anandharamakrishnan Photocatalytic disinfection efficiency of 2D structure graphitic carbon nitride-based nanocomposites: a review J. Mater. Sci. 54 2019 12206 12235 10.1007/s10853-019-03695-2 P. Murugesan, J.A. Moses, C. Anandharamakrishnan, Photocatalytic disinfection efficiency of 2D structure graphitic carbon nitride-based nanocomposites: a review, J. Mater. Sci 54 (2019) 12206–12235. https://doi.org/10.1007/s10853-019-03695-2.",
      "scopus-id": "105011190719",
      "coredata": {
        "eid": "1-s2.0-S2468823125005504",
        "dc:description": "Selenomethyl-substituted Schiff base ligand (HL) reacts with Pd(OAc)2, Ni(OAc)2 or CuCl2 resulting in the formation of tetracoordinate metal(II) complexes, with the formula [PdL(OAc)]·CH2Cl2·H2O (1), [PdL2] (2), [NiL2] (3) and [CuL2]·2CHCl3 (4). The deprotonation of the hydroxyl group of the ligand occurs with the addition of triethylamine. For complex 1, the ligand coordinates to the palladium(II) metal as tridentate {O,N,Se} chelate. On the other hand, for complexes 2–4, a bidentate {O,N} coordination mode was observed. All complexes had their structure elucidated by single-crystal X-ray diffraction (SCXRD) and a square planar geometry was observed for palladium(II) (1–2), nickel(II) (3) and copper(II) complexes. Spectroscopic data of 1–4 are in accordance with the structures obtained by SCXRD. In addition, diffuse reflectance spectroscopy (DRS) data were employed for energy gap (Eg ) determinations, which ranged from 2.24 to 2.49 eV. Complexes 1–4 were immobilized in the mesoporous-TiO2 matrix to obtain four photocatalysts m-TiO2-n ( n = 1–4). All photocatalysts tested were active for hydrogen generation via water photolysis. The best results were achieved using palladium(II) (1, 2) and copper(II) (4) complexes as co-catalysts. The m-TiO2–1 and TiO2–2 produced 20,895 and 13,271 μmol g-1 of hydrogen gas, after 6 h of irradiation (300 W Hg/Xe lamp) and its activity surpassed that of the standards (m-TiO₂ and Degussa P25) by approximately 67-fold and 42-fold, respectively. For m-TiO2–4 the production was 7819 μmol g-1 of H2 in the same conditions, and it corresponds approximately 25 times more than pure m-TiO2. These results are highly promising and demonstrate the potential of selenomethyl-substituted Schiff base metal complexes as efficient co-catalysts for water photolysis applications.",
        "openArchiveArticle": "false",
        "prism:coverDate": "2025-10-31",
        "openaccessUserLicense": null,
        "prism:aggregationType": "Journal",
        "prism:url": "https://api.elsevier.com/content/article/pii/S2468823125005504",
        "dc:creator": [
          {
            "@_fa": "true",
            "$": "da Silva, Thiago Acosta Trindade"
          },
          {
            "@_fa": "true",
            "$": "Lanes, Leonardo Carneiro"
          },
          {
            "@_fa": "true",
            "$": "Cervo, Rodrigo"
          },
          {
            "@_fa": "true",
            "$": "Cechin, Camila Nunes"
          },
          {
            "@_fa": "true",
            "$": "Gatto, Claudia Cristina"
          },
          {
            "@_fa": "true",
            "$": "Ledesma, Gabriela Nanci"
          },
          {
            "@_fa": "true",
            "$": "Iglesias, Bernardo Almeida"
          },
          {
            "@_fa": "true",
            "$": "Lang, Ernesto Schulz"
          },
          {
            "@_fa": "true",
            "$": "Tirloni, Bárbara"
          },
          {
            "@_fa": "true",
            "$": "Cargnelutti, Roberta"
          }
        ],
        "link": [
          {
            "@_fa": "true",
            "@rel": "self",
            "@href": "https://api.elsevier.com/content/article/pii/S2468823125005504"
          },
          {
            "@_fa": "true",
            "@rel": "scidir",
            "@href": "https://www.sciencedirect.com/science/article/pii/S2468823125005504"
          }
        ],
        "dc:format": "application/json",
        "openaccessType": null,
        "pii": "S2468-8231(25)00550-4",
        "prism:volume": "585",
        "articleNumber": "115365",
        "prism:publisher": "Elsevier B.V. All rights are reserved, including those for text and data mining, AI training, and similar technologies.",
        "dc:title": "Selenomethyl Schiff base coordination compounds as m-TiO2 co-catalysts for efficient hydrogen production",
        "prism:copyright": "© 2025 Elsevier B.V. All rights are reserved, including those for text and data mining, AI training, and similar technologies.",
        "openaccess": "0",
        "prism:issn": "24688231",
        "dcterms:subject": [
          {
            "@_fa": "true",
            "$": "Palladium(II) complex"
          },
          {
            "@_fa": "true",
            "$": "Schiff Base"
          },
          {
            "@_fa": "true",
            "$": "Titanium dioxide"
          },
          {
            "@_fa": "true",
            "$": "Photocatalyst"
          },
          {
            "@_fa": "true",
            "$": "Hydrogen production"
          }
        ],
        "openaccessArticle": "false",
        "prism:publicationName": "Molecular Catalysis",
        "openaccessSponsorType": null,
        "prism:pageRange": "115365",
        "pubType": "fla",
        "prism:coverDisplayDate": "October 2025",
        "prism:doi": "10.1016/j.mcat.2025.115365",
        "prism:startingPage": "115365",
        "dc:identifier": "doi:10.1016/j.mcat.2025.115365",
        "openaccessSponsorName": null
      },
      "objects": {
        "object": [
          {
            "@category": "standard",
            "@height": "200",
            "@width": "432",
            "@_fa": "true",
            "$": "https://api.elsevier.com/content/object/eid/1-s2.0-S2468823125005504-ga1.jpg?httpAccept=%2A%2F%2A",
            "@multimediatype": "JPEG image file",
            "@type": "IMAGE-DOWNSAMPLED",
            "@size": "31658",
            "@ref": "ga1",
            "@mimetype": "image/jpeg"
          },
          {
            "@category": "standard",
            "@height": "408",
            "@width": "473",
            "@_fa": "true",
            "$": "https://api.elsevier.com/content/object/eid/1-s2.0-S2468823125005504-gr12.jpg?httpAccept=%2A%2F%2A",
            "@multimediatype": "JPEG image file",
            "@type": "IMAGE-DOWNSAMPLED",
            "@size": "49237",
            "@ref": "gr12",
            "@mimetype": "image/jpeg"
          },
          {
            "@category": "standard",
            "@height": "464",
            "@width": "425",
            "@_fa": "true",
            "$": "https://api.elsevier.com/content/object/eid/1-s2.0-S2468823125005504-sc2.jpg?httpAccept=%2A%2F%2A",
            "@multimediatype": "JPEG image file",
            "@type": "IMAGE-DOWNSAMPLED",
            "@size": "33109",
            "@ref": "sc2",
            "@mimetype": "image/jpeg"
          },
          {
            "@category": "standard",
            "@height": "168",
            "@width": "606",
            "@_fa": "true",
            "$": "https://api.elsevier.com/content/object/eid/1-s2.0-S2468823125005504-sc1.jpg?httpAccept=%2A%2F%2A",
            "@multimediatype": "JPEG image file",
            "@type": "IMAGE-DOWNSAMPLED",
            "@size": "20031",
            "@ref": "sc1",
            "@mimetype": "image/jpeg"
          },
          {
            "@category": "standard",
            "@height": "285",
            "@width": "473",
            "@_fa": "true",
            "$": "https://api.elsevier.com/content/object/eid/1-s2.0-S2468823125005504-gr2.jpg?httpAccept=%2A%2F%2A",
            "@multimediatype": "JPEG image file",
            "@type": "IMAGE-DOWNSAMPLED",
            "@size": "24714",
            "@ref": "gr2",
            "@mimetype": "image/jpeg"
          },
          {
            "@category": "standard",
            "@height": "260",
            "@width": "623",
            "@_fa": "true",
            "$": "https://api.elsevier.com/content/object/eid/1-s2.0-S2468823125005504-gr1.jpg?httpAccept=%2A%2F%2A",
            "@multimediatype": "JPEG image file",
            "@type": "IMAGE-DOWNSAMPLED",
            "@size": "30957",
            "@ref": "gr1",
            "@mimetype": "image/jpeg"
          },
          {
            "@category": "standard",
            "@height": "326",
            "@width": "465",
            "@_fa": "true",
            "$": "https://api.elsevier.com/content/object/eid/1-s2.0-S2468823125005504-gr10.jpg?httpAccept=%2A%2F%2A",
            "@multimediatype": "JPEG image file",
            "@type": "IMAGE-DOWNSAMPLED",
            "@size": "24828",
            "@ref": "gr10",
            "@mimetype": "image/jpeg"
          },
          {
            "@category": "standard",
            "@height": "607",
            "@width": "631",
            "@_fa": "true",
            "$": "https://api.elsevier.com/content/object/eid/1-s2.0-S2468823125005504-gr11.jpg?httpAccept=%2A%2F%2A",
            "@multimediatype": "JPEG image file",
            "@type": "IMAGE-DOWNSAMPLED",
            "@size": "61915",
            "@ref": "gr11",
            "@mimetype": "image/jpeg"
          },
          {
            "@category": "standard",
            "@height": "352",
            "@width": "472",
            "@_fa": "true",
            "$": "https://api.elsevier.com/content/object/eid/1-s2.0-S2468823125005504-gr6.jpg?httpAccept=%2A%2F%2A",
            "@multimediatype": "JPEG image file",
            "@type": "IMAGE-DOWNSAMPLED",
            "@size": "37191",
            "@ref": "gr6",
            "@mimetype": "image/jpeg"
          },
          {
            "@category": "standard",
            "@height": "377",
            "@width": "464",
            "@_fa": "true",
            "$": "https://api.elsevier.com/content/object/eid/1-s2.0-S2468823125005504-gr5.jpg?httpAccept=%2A%2F%2A",
            "@multimediatype": "JPEG image file",
            "@type": "IMAGE-DOWNSAMPLED",
            "@size": "39879",
            "@ref": "gr5",
            "@mimetype": "image/jpeg"
          },
          {
            "@category": "standard",
            "@height": "375",
            "@width": "470",
            "@_fa": "true",
            "$": "https://api.elsevier.com/content/object/eid/1-s2.0-S2468823125005504-gr4.jpg?httpAccept=%2A%2F%2A",
            "@multimediatype": "JPEG image file",
            "@type": "IMAGE-DOWNSAMPLED",
            "@size": "40110",
            "@ref": "gr4",
            "@mimetype": "image/jpeg"
          },
          {
            "@category": "standard",
            "@height": "311",
            "@width": "659",
            "@_fa": "true",
            "$": "https://api.elsevier.com/content/object/eid/1-s2.0-S2468823125005504-gr3.jpg?httpAccept=%2A%2F%2A",
            "@multimediatype": "JPEG image file",
            "@type": "IMAGE-DOWNSAMPLED",
            "@size": "57179",
            "@ref": "gr3",
            "@mimetype": "image/jpeg"
          },
          {
            "@category": "standard",
            "@height": "334",
            "@width": "420",
            "@_fa": "true",
            "$": "https://api.elsevier.com/content/object/eid/1-s2.0-S2468823125005504-gr9.jpg?httpAccept=%2A%2F%2A",
            "@multimediatype": "JPEG image file",
            "@type": "IMAGE-DOWNSAMPLED",
            "@size": "32777",
            "@ref": "gr9",
            "@mimetype": "image/jpeg"
          },
          {
            "@category": "standard",
            "@height": "343",
            "@width": "492",
            "@_fa": "true",
            "$": "https://api.elsevier.com/content/object/eid/1-s2.0-S2468823125005504-gr8.jpg?httpAccept=%2A%2F%2A",
            "@multimediatype": "JPEG image file",
            "@type": "IMAGE-DOWNSAMPLED",
            "@size": "102492",
            "@ref": "gr8",
            "@mimetype": "image/jpeg"
          },
          {
            "@category": "standard",
            "@height": "466",
            "@width": "566",
            "@_fa": "true",
            "$": "https://api.elsevier.com/content/object/eid/1-s2.0-S2468823125005504-gr7.jpg?httpAccept=%2A%2F%2A",
            "@multimediatype": "JPEG image file",
            "@type": "IMAGE-DOWNSAMPLED",
            "@size": "51355",
            "@ref": "gr7",
            "@mimetype": "image/jpeg"
          },
          {
            "@category": "thumbnail",
            "@height": "101",
            "@width": "219",
            "@_fa": "true",
            "$": "https://api.elsevier.com/content/object/eid/1-s2.0-S2468823125005504-ga1.sml?httpAccept=%2A%2F%2A",
            "@multimediatype": "GIF image file",
            "@type": "IMAGE-THUMBNAIL",
            "@size": "15023",
            "@ref": "ga1",
            "@mimetype": "image/gif"
          },
          {
            "@category": "thumbnail",
            "@height": "164",
            "@width": "190",
            "@_fa": "true",
            "$": "https://api.elsevier.com/content/object/eid/1-s2.0-S2468823125005504-gr12.sml?httpAccept=%2A%2F%2A",
            "@multimediatype": "GIF image file",
            "@type": "IMAGE-THUMBNAIL",
            "@size": "13003",
            "@ref": "gr12",
            "@mimetype": "image/gif"
          },
          {
            "@category": "thumbnail",
            "@height": "164",
            "@width": "150",
            "@_fa": "true",
            "$": "https://api.elsevier.com/content/object/eid/1-s2.0-S2468823125005504-sc2.sml?httpAccept=%2A%2F%2A",
            "@multimediatype": "GIF image file",
            "@type": "IMAGE-THUMBNAIL",
            "@size": "6485",
            "@ref": "sc2",
            "@mimetype": "image/gif"
          },
          {
            "@category": "thumbnail",
            "@height": "61",
            "@width": "219",
            "@_fa": "true",
            "$": "https://api.elsevier.com/content/object/eid/1-s2.0-S2468823125005504-sc1.sml?httpAccept=%2A%2F%2A",
            "@multimediatype": "GIF image file",
            "@type": "IMAGE-THUMBNAIL",
            "@size": "5172",
            "@ref": "sc1",
            "@mimetype": "image/gif"
          },
          {
            "@category": "thumbnail",
            "@height": "132",
            "@width": "219",
            "@_fa": "true",
            "$": "https://api.elsevier.com/content/object/eid/1-s2.0-S2468823125005504-gr2.sml?httpAccept=%2A%2F%2A",
            "@multimediatype": "GIF image file",
            "@type": "IMAGE-THUMBNAIL",
            "@size": "7404",
            "@ref": "gr2",
            "@mimetype": "image/gif"
          },
          {
            "@category": "thumbnail",
            "@height": "91",
            "@width": "219",
            "@_fa": "true",
            "$": "https://api.elsevier.com/content/object/eid/1-s2.0-S2468823125005504-gr1.sml?httpAccept=%2A%2F%2A",
            "@multimediatype": "GIF image file",
            "@type": "IMAGE-THUMBNAIL",
            "@size": "7714",
            "@ref": "gr1",
            "@mimetype": "image/gif"
          },
          {
            "@category": "thumbnail",
            "@height": "153",
            "@width": "219",
            "@_fa": "true",
            "$": "https://api.elsevier.com/content/object/eid/1-s2.0-S2468823125005504-gr10.sml?httpAccept=%2A%2F%2A",
            "@multimediatype": "GIF image file",
            "@type": "IMAGE-THUMBNAIL",
            "@size": "7228",
            "@ref": "gr10",
            "@mimetype": "image/gif"
          },
          {
            "@category": "thumbnail",
            "@height": "163",
            "@width": "170",
            "@_fa": "true",
            "$": "https://api.elsevier.com/content/object/eid/1-s2.0-S2468823125005504-gr11.sml?httpAccept=%2A%2F%2A",
            "@multimediatype": "GIF image file",
            "@type": "IMAGE-THUMBNAIL",
            "@size": "8142",
            "@ref": "gr11",
            "@mimetype": "image/gif"
          },
          {
            "@category": "thumbnail",
            "@height": "163",
            "@width": "219",
            "@_fa": "true",
            "$": "https://api.elsevier.com/content/object/eid/1-s2.0-S2468823125005504-gr6.sml?httpAccept=%2A%2F%2A",
            "@multimediatype": "GIF image file",
            "@type": "IMAGE-THUMBNAIL",
            "@size": "8826",
            "@ref": "gr6",
            "@mimetype": "image/gif"
          },
          {
            "@category": "thumbnail",
            "@height": "164",
            "@width": "202",
            "@_fa": "true",
            "$": "https://api.elsevier.com/content/object/eid/1-s2.0-S2468823125005504-gr5.sml?httpAccept=%2A%2F%2A",
            "@multimediatype": "GIF image file",
            "@type": "IMAGE-THUMBNAIL",
            "@size": "8154",
            "@ref": "gr5",
            "@mimetype": "image/gif"
          },
          {
            "@category": "thumbnail",
            "@height": "164",
            "@width": "205",
            "@_fa": "true",
            "$": "https://api.elsevier.com/content/object/eid/1-s2.0-S2468823125005504-gr4.sml?httpAccept=%2A%2F%2A",
            "@multimediatype": "GIF image file",
            "@type": "IMAGE-THUMBNAIL",
            "@size": "8626",
            "@ref": "gr4",
            "@mimetype": "image/gif"
          },
          {
            "@category": "thumbnail",
            "@height": "104",
            "@width": "219",
            "@_fa": "true",
            "$": "https://api.elsevier.com/content/object/eid/1-s2.0-S2468823125005504-gr3.sml?httpAccept=%2A%2F%2A",
            "@multimediatype": "GIF image file",
            "@type": "IMAGE-THUMBNAIL",
            "@size": "10206",
            "@ref": "gr3",
            "@mimetype": "image/gif"
          },
          {
            "@category": "thumbnail",
            "@height": "164",
            "@width": "206",
            "@_fa": "true",
            "$": "https://api.elsevier.com/content/object/eid/1-s2.0-S2468823125005504-gr9.sml?httpAccept=%2A%2F%2A",
            "@multimediatype": "GIF image file",
            "@type": "IMAGE-THUMBNAIL",
            "@size": "8735",
            "@ref": "gr9",
            "@mimetype": "image/gif"
          },
          {
            "@category": "thumbnail",
            "@height": "153",
            "@width": "219",
            "@_fa": "true",
            "$": "https://api.elsevier.com/content/object/eid/1-s2.0-S2468823125005504-gr8.sml?httpAccept=%2A%2F%2A",
            "@multimediatype": "GIF image file",
            "@type": "IMAGE-THUMBNAIL",
            "@size": "31180",
            "@ref": "gr8",
            "@mimetype": "image/gif"
          },
          {
            "@category": "thumbnail",
            "@height": "164",
            "@width": "199",
            "@_fa": "true",
            "$": "https://api.elsevier.com/content/object/eid/1-s2.0-S2468823125005504-gr7.sml?httpAccept=%2A%2F%2A",
            "@multimediatype": "GIF image file",
            "@type": "IMAGE-THUMBNAIL",
            "@size": "7626",
            "@ref": "gr7",
            "@mimetype": "image/gif"
          },
          {
            "@category": "high",
            "@height": "886",
            "@width": "1914",
            "@_fa": "true",
            "$": "https://api.elsevier.com/content/object/eid/1-s2.0-S2468823125005504-ga1_lrg.jpg?httpAccept=%2A%2F%2A",
            "@multimediatype": "JPEG image file",
            "@type": "IMAGE-HIGH-RES",
            "@size": "249927",
            "@ref": "ga1",
            "@mimetype": "image/jpeg"
          },
          {
            "@category": "high",
            "@height": "1805",
            "@width": "2093",
            "@_fa": "true",
            "$": "https://api.elsevier.com/content/object/eid/1-s2.0-S2468823125005504-gr12_lrg.jpg?httpAccept=%2A%2F%2A",
            "@multimediatype": "JPEG image file",
            "@type": "IMAGE-HIGH-RES",
            "@size": "373555",
            "@ref": "gr12",
            "@mimetype": "image/jpeg"
          },
          {
            "@category": "high",
            "@height": "2057",
            "@width": "1883",
            "@_fa": "true",
            "$": "https://api.elsevier.com/content/object/eid/1-s2.0-S2468823125005504-sc2_lrg.jpg?httpAccept=%2A%2F%2A",
            "@multimediatype": "JPEG image file",
            "@type": "IMAGE-HIGH-RES",
            "@size": "247093",
            "@ref": "sc2",
            "@mimetype": "image/jpeg"
          },
          {
            "@category": "high",
            "@height": "742",
            "@width": "2683",
            "@_fa": "true",
            "$": "https://api.elsevier.com/content/object/eid/1-s2.0-S2468823125005504-sc1_lrg.jpg?httpAccept=%2A%2F%2A",
            "@multimediatype": "JPEG image file",
            "@type": "IMAGE-HIGH-RES",
            "@size": "155110",
            "@ref": "sc1",
            "@mimetype": "image/jpeg"
          },
          {
            "@category": "high",
            "@height": "1260",
            "@width": "2093",
            "@_fa": "true",
            "$": "https://api.elsevier.com/content/object/eid/1-s2.0-S2468823125005504-gr2_lrg.jpg?httpAccept=%2A%2F%2A",
            "@multimediatype": "JPEG image file",
            "@type": "IMAGE-HIGH-RES",
            "@size": "181426",
            "@ref": "gr2",
            "@mimetype": "image/jpeg"
          },
          {
            "@category": "high",
            "@height": "1151",
            "@width": "2759",
            "@_fa": "true",
            "$": "https://api.elsevier.com/content/object/eid/1-s2.0-S2468823125005504-gr1_lrg.jpg?httpAccept=%2A%2F%2A",
            "@multimediatype": "JPEG image file",
            "@type": "IMAGE-HIGH-RES",
            "@size": "226561",
            "@ref": "gr1",
            "@mimetype": "image/jpeg"
          },
          {
            "@category": "high",
            "@height": "1442",
            "@width": "2058",
            "@_fa": "true",
            "$": "https://api.elsevier.com/content/object/eid/1-s2.0-S2468823125005504-gr10_lrg.jpg?httpAccept=%2A%2F%2A",
            "@multimediatype": "JPEG image file",
            "@type": "IMAGE-HIGH-RES",
            "@size": "187714",
            "@ref": "gr10",
            "@mimetype": "image/jpeg"
          },
          {
            "@category": "high",
            "@height": "2686",
            "@width": "2793",
            "@_fa": "true",
            "$": "https://api.elsevier.com/content/object/eid/1-s2.0-S2468823125005504-gr11_lrg.jpg?httpAccept=%2A%2F%2A",
            "@multimediatype": "JPEG image file",
            "@type": "IMAGE-HIGH-RES",
            "@size": "416951",
            "@ref": "gr11",
            "@mimetype": "image/jpeg"
          },
          {
            "@category": "high",
            "@height": "1559",
            "@width": "2092",
            "@_fa": "true",
            "$": "https://api.elsevier.com/content/object/eid/1-s2.0-S2468823125005504-gr6_lrg.jpg?httpAccept=%2A%2F%2A",
            "@multimediatype": "JPEG image file",
            "@type": "IMAGE-HIGH-RES",
            "@size": "321154",
            "@ref": "gr6",
            "@mimetype": "image/jpeg"
          },
          {
            "@category": "high",
            "@height": "1670",
            "@width": "2055",
            "@_fa": "true",
            "$": "https://api.elsevier.com/content/object/eid/1-s2.0-S2468823125005504-gr5_lrg.jpg?httpAccept=%2A%2F%2A",
            "@multimediatype": "JPEG image file",
            "@type": "IMAGE-HIGH-RES",
            "@size": "328512",
            "@ref": "gr5",
            "@mimetype": "image/jpeg"
          },
          {
            "@category": "high",
            "@height": "1662",
            "@width": "2083",
            "@_fa": "true",
            "$": "https://api.elsevier.com/content/object/eid/1-s2.0-S2468823125005504-gr4_lrg.jpg?httpAccept=%2A%2F%2A",
            "@multimediatype": "JPEG image file",
            "@type": "IMAGE-HIGH-RES",
            "@size": "330885",
            "@ref": "gr4",
            "@mimetype": "image/jpeg"
          },
          {
            "@category": "high",
            "@height": "1380",
            "@width": "2920",
            "@_fa": "true",
            "$": "https://api.elsevier.com/content/object/eid/1-s2.0-S2468823125005504-gr3_lrg.jpg?httpAccept=%2A%2F%2A",
            "@multimediatype": "JPEG image file",
            "@type": "IMAGE-HIGH-RES",
            "@size": "800992",
            "@ref": "gr3",
            "@mimetype": "image/jpeg"
          },
          {
            "@category": "high",
            "@height": "1480",
            "@width": "1859",
            "@_fa": "true",
            "$": "https://api.elsevier.com/content/object/eid/1-s2.0-S2468823125005504-gr9_lrg.jpg?httpAccept=%2A%2F%2A",
            "@multimediatype": "JPEG image file",
            "@type": "IMAGE-HIGH-RES",
            "@size": "209151",
            "@ref": "gr9",
            "@mimetype": "image/jpeg"
          },
          {
            "@category": "high",
            "@height": "1517",
            "@width": "2177",
            "@_fa": "true",
            "$": "https://api.elsevier.com/content/object/eid/1-s2.0-S2468823125005504-gr8_lrg.jpg?httpAccept=%2A%2F%2A",
            "@multimediatype": "JPEG image file",
            "@type": "IMAGE-HIGH-RES",
            "@size": "1329901",
            "@ref": "gr8",
            "@mimetype": "image/jpeg"
          },
          {
            "@category": "high",
            "@height": "2066",
            "@width": "2508",
            "@_fa": "true",
            "$": "https://api.elsevier.com/content/object/eid/1-s2.0-S2468823125005504-gr7_lrg.jpg?httpAccept=%2A%2F%2A",
            "@multimediatype": "JPEG image file",
            "@type": "IMAGE-HIGH-RES",
            "@size": "445418",
            "@ref": "gr7",
            "@mimetype": "image/jpeg"
          },
          {
            "@category": "standard",
            "@_fa": "true",
            "$": "https://api.elsevier.com/content/object/eid/1-s2.0-S2468823125005504-mmc1.pdf?httpAccept=%2A%2F%2A",
            "@multimediatype": "Acrobat PDF file",
            "@type": "APPLICATION",
            "@size": "5824173",
            "@ref": "mmc1",
            "@mimetype": "application/pdf"
          }
        ]
      },
      "link": {
        "@rel": "abstract",
        "@href": "https://api.elsevier.com/content/abstract/scopus_id/105011190719"
      }
    }
  }
}